================================================================================
                        FULL GAME - Team_009 vs Team_046                        
================================================================================

================================================================================
                       1ST QUARTER - Team_009 vs Team_046                       
================================================================================

[12:00] Team_009 possession (Score: 0-0)
Anfernee Anunoby makes the Midrange and draws the foul on Lauri Carter! And-1! Anfernee Anunoby to the line for 1. [Team fouls: 1] (Lauri Carter: 1 personal fouls)   FT 1/1: GOOD Anfernee Anunoby makes 1/1 from the line.
Score: 3-0

[11:45] Team_046 possession (Score: 3-0)
Cade Wall attempts a 3Pt. Wide open! Cole Mitchell is 7.8 feet away. [MAN] Cade Wall misses. Rebound secured by Cole Mitchell.

[11:32] Team_009 possession (Score: 3-0)
Cole Mitchell attempts a 3Pt. Contested by Cade Wall (5.3 feet, MAN). Cole Mitchell misses. Offensive rebound by Kyle Brogdon! Kyle Brogdon puts it back in!
Score: 5-0

[11:19] Team_046 possession (Score: 5-0)
D'Angelo O'Neal attempts a 3Pt. Wide open! Miles Sabonis is 8.7 feet away. [MAN] D'Angelo O'Neal misses. FOUL! Loose ball foul on Anfernee Anunoby during the rebound battle. [Team fouls: 1] No free throws, side out. (Anfernee Anunoby: 1 personal fouls)

[11:06] Team_046 possession (Score: 5-0)
Cade Wall attempts a Midrange. Contested by Anfernee Anunoby (4.4 feet, ZONE). CADE WALL MAKES IT!
Score: 5-2

[10:49] Team_009 possession (Score: 5-2)
FOUL! Holding foul on Cade Wall. [Team fouls: 2] No free throws, side out. (Cade Wall: 1 personal fouls)

[10:33] Team_009 possession (Score: 5-2)
Desmond Harden drives, Victor Nowitzki stays with him. Desmond Harden attempts a Dunk. Wide open! Victor Nowitzki is 6.2 feet away. [MAN] DESMOND HARDEN MAKES IT!
Score: 7-2

[10:19] Team_046 possession (Score: 7-2)
Victor Nowitzki throws a bad pass out of bounds! TURNOVER! (dead ball)

[10:05] Team_009 possession (Score: 7-2)
Desmond Harden attempts a Midrange. Contested by Victor Nowitzki (5.8 feet, MAN). DESMOND HARDEN MAKES IT! Assist: Cole Mitchell
Score: 9-2

[09:52] Team_046 possession (Score: 9-2)
Victor Nowitzki attempts a 3Pt. Wide open! Miles Sabonis is 8.7 feet away. [ZONE] VICTOR NOWITZKI MAKES IT! Assist: Kevin Allen
Score: 9-5

[09:37] Team_009 possession (Score: 9-5)
Miles Sabonis attempts a Layup. BLOCKED BY D'ANGELO O'NEAL! Ball is loose! Rebound secured by Kevin Allen.

[09:25] Team_046 possession (Score: 9-5)
Lauri Carter attempts a 3Pt. Contested by Anfernee Anunoby (5.0 feet, MAN). LAURI CARTER MAKES IT! Assist: Cade Wall
Score: 9-8

[09:14] Team_009 possession (Score: 9-8)
Cole Mitchell attempts a Layup. BLOCKED BY CADE WALL! Ball is loose! Rebound secured by Lauri Carter.

[08:55] Team_046 possession (Score: 9-8)
Cade Wall drives and kicks out. Cade Wall attempts a 3Pt. Wide open! Cole Mitchell is 7.8 feet away. [MAN] Cade Wall misses. Offensive rebound by Kevin Allen! Kevin Allen kicks it out.

[08:45] Team_046 possession (Score: 9-8)
Cade Wall drives, picks up Cole Mitchell. Help arrives from Miles Sabonis! Cade Wall attempts a Layup. Contested by Miles Sabonis (4.5 feet, MAN). CADE WALL MAKES IT!
Score: 9-10

[08:30] Team_009 possession (Score: 9-10)
Cole Mitchell loses the ball! Stripped by Cade Wall! TURNOVER! (live ball)

[08:18] Team_046 possession (Score: 9-10)
Lauri Carter makes the 3Pt and draws the foul on Anfernee Anunoby! And-1! Lauri Carter to the line for 1. [Team fouls: 2] (Anfernee Anunoby: 2 personal fouls)   FT 1/1: GOOD Lauri Carter makes 1/1 from the line.
Score: 9-14

[08:02] Team_009 possession (Score: 9-14)
Kyle Brogdon drives to the basket... Kyle Brogdon throws a bad pass out of bounds! TURNOVER! (dead ball)

[07:46] Team_046 possession (Score: 9-14)
FOUL! Shooting foul on Kyle Brogdon. Kevin Allen to the line for 2 free throws. [Team fouls: 3] (Kyle Brogdon: 1 personal fouls)   FT 1/2: GOOD   FT 2/2: MISS Kevin Allen makes 1/2 from the line. Rebound secured by Cole Mitchell.
Score: 9-15

[07:32] Team_009 possession (Score: 9-15)
Anfernee Anunoby attempts a 3Pt. Contested by Lauri Carter (3.0 feet, ZONE). Anfernee Anunoby misses. Rebound secured by Lauri Carter.

[07:19] Team_046 possession (Score: 9-15)
Lauri Carter attempts a 3Pt. Contested by Anfernee Anunoby (5.8 feet, MAN). Lauri Carter misses. Offensive rebound by Kevin Allen! Kevin Allen kicks it out.

[07:05] Team_046 possession (Score: 9-15)
Victor Nowitzki throws a bad pass out of bounds! TURNOVER! (dead ball)

[06:48] Team_009 possession (Score: 9-15)
Desmond Harden commits a violation (traveling/carry)! TURNOVER! (dead ball)

[06:32] Team_046 possession (Score: 9-15)
Victor Nowitzki attempts a 3Pt. Contested by Desmond Harden (3.1 feet, MAN). Victor Nowitzki misses. Rebound secured by Kyle Brogdon.

[06:14] Team_009 possession (Score: 9-15)
FOUL! Holding foul on Kevin Allen. [Team fouls: 3] No free throws, side out. (Kevin Allen: 1 personal fouls)

[06:04] Team_009 possession (Score: 9-15)
Desmond Harden attempts a Layup. Heavily contested by Victor Nowitzki (1.8 feet, MAN)! DESMOND HARDEN MAKES IT! Assist: Miles Sabonis
Score: 11-15

[05:50] Team_046 possession (Score: 11-15)
D'Angelo O'Neal drives to the basket... FOUL! Offensive foul on D'Angelo O'Neal! Kyle Brogdon drew the charge! [Team fouls: 4] (D'Angelo O'Neal: 1 personal fouls) TURNOVER! (dead ball)

[05:37] Team_009 possession (Score: 11-15)
Cole Mitchell attempts a 3Pt. Contested by Cade Wall (2.6 feet, ZONE). COLE MITCHELL MAKES IT!
Score: 14-15

[05:18] Team_046 possession (Score: 14-15)
D'Angelo O'Neal attempts a Midrange. Contested by Cole Mitchell (4.0 feet, ZONE). D'Angelo O'Neal misses. Rebound secured by Anfernee Anunoby.

[05:03] Team_009 possession (Score: 14-15)
Miles Sabonis attempts a 3Pt. Heavily contested by D'Angelo O'Neal (1.6 feet, MAN)! Miles Sabonis misses. Rebound secured by Cade Wall.

[04:52] Team_046 possession (Score: 14-15)
Cade Wall attempts a 3Pt. Contested by Miles Sabonis (3.9 feet, ZONE). Cade Wall misses. Rebound secured by Anfernee Anunoby.

[04:37] Team_009 possession (Score: 14-15)
Cole Mitchell attempts a 3Pt. Wide open! Lauri Carter is 7.5 feet away. [ZONE] Cole Mitchell misses. Rebound secured by Cade Wall.

[04:23] Team_046 possession (Score: 14-15)
Cade Wall attempts a 3Pt. Wide open! Cole Mitchell is 7.9 feet away. [MAN] CADE WALL MAKES IT! Assist: Kevin Allen
Score: 14-18

[04:09] Team_009 possession (Score: 14-18)
Kyle Brogdon attempts a 3Pt. Contested by Lauri Carter (3.3 feet, ZONE). Kyle Brogdon misses. Rebound secured by Kevin Allen.

[03:51] Team_046 possession (Score: 14-18)
D'Angelo O'Neal attempts a 3Pt. Contested by Miles Sabonis (5.9 feet, MAN). D'Angelo O'Neal misses. Offensive rebound by Cade Wall! Cade Wall kicks it out.

[03:32] Team_046 possession (Score: 14-18)
Victor Nowitzki drives and kicks out. FOUL! Shooting foul on Cole Mitchell. Cade Wall to the line for 2 free throws. [Team fouls: 4] (Cole Mitchell: 1 personal fouls)   FT 1/2: GOOD   FT 2/2: GOOD Cade Wall makes 2/2 from the line.
Score: 14-20

[03:16] Team_009 possession (Score: 14-20)
Anfernee Anunoby makes the Layup and draws the foul on D'Angelo O'Neal! And-1! Anfernee Anunoby to the line for 1. [BONUS: 5 team fouls] (D'Angelo O'Neal: 2 personal fouls)   FT 1/1: GOOD Anfernee Anunoby makes 1/1 from the line.
Score: 17-20

[03:00] Team_046 possession (Score: 17-20)
Cade Wall attempts a Midrange. Contested by Cole Mitchell (4.8 feet, MAN). CADE WALL MAKES IT!
Score: 17-22

[02:49] Team_009 possession (Score: 17-22)
Cole Mitchell drives, picks up Cade Wall. Help arrives from D'Angelo O'Neal! Cole Mitchell attempts a Dunk. Wide open! D'Angelo O'Neal is 6.8 feet away. [MAN] COLE MITCHELL MAKES IT! Assist: Miles Sabonis
Score: 19-22

[02:35] Team_046 possession (Score: 19-22)
Kevin Allen attempts a Layup. Contested by Kyle Brogdon (4.0 feet, ZONE). KEVIN ALLEN MAKES IT! Assist: Cade Wall
Score: 19-24

[02:22] Team_009 possession (Score: 19-24)
Anfernee Anunoby attempts a 3Pt. Contested by Lauri Carter (3.0 feet, ZONE). Anfernee Anunoby misses. Rebound secured by Cade Wall.

[02:06] Team_046 possession (Score: 19-24)
D'Angelo O'Neal makes the Layup and draws the foul on Kyle Brogdon! And-1! D'Angelo O'Neal to the line for 1. [BONUS: 5 team fouls] (Kyle Brogdon: 2 personal fouls)   FT 1/1: GOOD D'Angelo O'Neal makes 1/1 from the line.
Score: 19-27

[01:52] Team_009 possession (Score: 19-27)
Anfernee Anunoby attempts a 3Pt. Heavily contested by Lauri Carter (1.9 feet, ZONE)! ANFERNEE ANUNOBY MAKES IT!
Score: 22-27

[01:40] Team_046 possession (Score: 22-27)
Cade Wall attempts a 3Pt. Contested by Miles Sabonis (4.5 feet, ZONE). CADE WALL MAKES IT! Assist: D'Angelo O'Neal
Score: 22-30

[01:26] Team_009 possession (Score: 22-30)
Desmond Harden loses control! Ball rolls out of bounds! TURNOVER! (dead ball)

[01:26] Substitution (Team_009): Miles Sabonis OUT → Paul Trent IN (stamina_rule2)

[01:26] Substitution (Team_009): Desmond Harden OUT → Evan Curry IN (stamina_rule2)

[01:26] Substitution (Team_009): Anfernee Anunoby OUT → RJ Jokic IN (stamina_rule2)

[01:26] Substitution (Team_009): Cole Mitchell OUT → Kawhi Herro IN (stamina_rule2)

[01:26] Substitution (Team_009): Kyle Brogdon OUT → Shaquille Green IN (stamina_rule2)

[01:26] Substitution (Team_046): D'Angelo O'Neal OUT → Collin Butler IN (stamina_rule2)

[01:26] Substitution (Team_046): Victor Nowitzki OUT → Manu Dosunmu IN (stamina_rule2)

[01:26] Substitution (Team_046): Lauri Carter OUT → Josh Barrett IN (stamina_rule2)

[01:26] Substitution (Team_046): Cade Wall OUT → Chris LaVine IN (stamina_rule2)

[01:26] Substitution (Team_046): Kevin Allen OUT → Paul DeRozan IN (stamina_rule2)

[01:11] Team_046 possession (Score: 22-30)
Manu Dosunmu attempts a 3Pt. Contested by Paul Trent (3.7 feet, ZONE). Manu Dosunmu misses. Rebound secured by RJ Jokic.

[00:59] Team_009 possession (Score: 22-30)
Kawhi Herro attempts a 3Pt. BLOCKED BY CHRIS LAVINE! Ball goes out off Chris LaVine. Kawhi Herro's ball!

[00:48] Team_009 possession (Score: 22-30)
Kawhi Herro drives and kicks out. Kawhi Herro attempts a 3Pt. Contested by Collin Butler (2.8 feet, ZONE). Kawhi Herro misses. Rebound secured by Manu Dosunmu.

[00:28] Team_046 possession (Score: 22-30)
Chris LaVine attempts a Layup. Contested by Shaquille Green (2.9 feet, ZONE). CHRIS LAVINE MAKES IT! Assist: Paul DeRozan
Score: 22-32

[00:11] Team_009 possession (Score: 22-32)
Evan Curry drives to the basket... Evan Curry throws a bad pass out of bounds! TURNOVER! (dead ball)

================================================================================
                              1ST QUARTER COMPLETE                              
================================================================================

1ST QUARTER SCORE: Team_009 22, Team_046 32

BOX SCORE:
================================================================================

Team_009
--------------------------------------------------------------------------------
Player                MIN  PTS  REB  AST  TO      FG   FG%      3P   3P%
--------------------------------------------------------------------------------
Anfernee Anunoby       11    9    2    0   0   3/5    60.0     0/0   0.0
Desmond Harden         11    6    0    0   0   3/3   100.0     0/0   0.0
Cole Mitchell          11    5    2    1   0   2/4    50.0     0/0   0.0
Kyle Brogdon           11    2    2    0   0   1/2    50.0     0/0   0.0
Miles Sabonis          11    0    0    2   0   0/2     0.0     0/0   0.0
RJ Jokic                1    0    1    0   0   0/0     0.0     0/0   0.0
Kawhi Herro             1    0    0    0   0   0/1     0.0     0/0   0.0

TEAM: FG: 9/17 (52.9%), 3PT: 3/8 (37.5%), REB: 7 (1 off, 6 def), AST: 3, TO: 5
TEAM FOULS: 5 [Team_046 in BONUS]


Team_046
--------------------------------------------------------------------------------
Player                MIN  PTS  REB  AST  TO      FG   FG%      3P   3P%
--------------------------------------------------------------------------------
Cade Wall              11   14    4    2   0   6/8    75.0     0/0   0.0
Lauri Carter           11    7    2    0   0   2/2   100.0     0/0   0.0
Victor Nowitzki        11    3    0    0   0   1/2    50.0     0/0   0.0
D'Angelo O'Neal        11    3    0    1   0   1/2    50.0     0/0   0.0
Kevin Allen            11    2    5    2   0   1/2    50.0     0/0   0.0
Chris LaVine            1    2    0    0   0   1/1   100.0     0/0   0.0
Manu Dosunmu            1    0    1    0   0   0/1     0.0     0/0   0.0
Paul DeRozan            1    0    0    1   0   0/0     0.0     0/0   0.0

TEAM: FG: 12/18 (66.7%), 3PT: 5/9 (55.6%), REB: 12 (4 off, 8 def), AST: 6, TO: 3
TEAM FOULS: 5 [Team_009 in BONUS]

================================================================================

================================================================================
                       2ND QUARTER - Team_009 vs Team_046                       
================================================================================

[12:00] Team_009 possession (Score: 22-32)
Miles Sabonis attempts a 3Pt. Wide open! D'Angelo O'Neal is 7.5 feet away. [MAN] MILES SABONIS MAKES IT! Assist: Anfernee Anunoby
Score: 25-32

[11:44] Team_046 possession (Score: 25-32)
FOUL! Reach-in foul on Kyle Brogdon during the drive. [Team fouls: 1] No free throws, side out. (Kyle Brogdon: 1 personal fouls)

[11:26] Team_046 possession (Score: 25-32)
Kevin Allen attempts a 3Pt. Wide open! Miles Sabonis is 6.5 feet away. [ZONE] KEVIN ALLEN MAKES IT! Assist: D'Angelo O'Neal
Score: 25-35

[11:15] Team_009 possession (Score: 25-35)
Kyle Brogdon drives and kicks out. Cole Mitchell attempts a Midrange. Contested by Victor Nowitzki (6.0 feet, ZONE). Cole Mitchell misses. Rebound secured by Lauri Carter.

[10:58] Team_046 possession (Score: 25-35)
Cade Wall attempts a Layup. BLOCKED BY COLE MITCHELL! Ball is loose! Rebound secured by Anfernee Anunoby.

[10:39] Team_009 possession (Score: 25-35)
FOUL! Shooting foul on D'Angelo O'Neal. Miles Sabonis to the line for 2 free throws. [Team fouls: 1] (D'Angelo O'Neal: 1 personal fouls)   FT 1/2: MISS   FT 2/2: GOOD Miles Sabonis makes 1/2 from the line.
Score: 26-35

[10:28] Team_046 possession (Score: 26-35)
Cade Wall makes the Layup and draws the foul on Kyle Brogdon! And-1! Cade Wall to the line for 1. [Team fouls: 2] (Kyle Brogdon: 2 personal fouls)   FT 1/1: GOOD Cade Wall makes 1/1 from the line.
Score: 26-38

[10:10] Team_009 possession (Score: 26-38)
Anfernee Anunoby drives, Kevin Allen stays with him. Anfernee Anunoby attempts a Dunk. Contested by Kevin Allen (3.9 feet, ZONE). Anfernee Anunoby misses. Rebound secured by Cade Wall.

[09:56] Team_046 possession (Score: 26-38)
Lauri Carter drives and kicks out. Victor Nowitzki attempts a 3Pt. Wide open! Desmond Harden is 7.3 feet away. [MAN] VICTOR NOWITZKI MAKES IT! Assist: Lauri Carter
Score: 26-41

[09:46] Team_009 possession (Score: 26-41)
Anfernee Anunoby makes the Layup and draws the foul on Lauri Carter! And-1! Anfernee Anunoby to the line for 1. [Team fouls: 2] (Lauri Carter: 1 personal fouls)   FT 1/1: GOOD Anfernee Anunoby makes 1/1 from the line.
Score: 29-41

[09:33] Team_046 possession (Score: 29-41)
Lauri Carter attempts a 3Pt. Wide open! Miles Sabonis is 8.2 feet away. [ZONE] Lauri Carter misses. Rebound secured by Kyle Brogdon.

[09:20] Team_009 possession (Score: 29-41)
Kyle Brogdon drives and kicks out. Desmond Harden attempts a 3Pt. Contested by Victor Nowitzki (4.8 feet, MAN). Desmond Harden misses. Offensive rebound by Kyle Brogdon! Kyle Brogdon kicks it out.

[09:06] Team_009 possession (Score: 29-41)
Anfernee Anunoby makes the Midrange and draws the foul on Lauri Carter! And-1! Anfernee Anunoby to the line for 1. [Team fouls: 3] (Lauri Carter: 2 personal fouls)   FT 1/1: GOOD Anfernee Anunoby makes 1/1 from the line.
Score: 32-41

[08:51] Team_046 possession (Score: 32-41)
Cade Wall attempts a Layup. Contested by Kyle Brogdon (3.2 feet, ZONE). Cade Wall misses. Rebound secured by Kyle Brogdon.

[08:38] Team_009 possession (Score: 32-41)
Cole Mitchell drives, picks up Kevin Allen. Help arrives from D'Angelo O'Neal! Cole Mitchell attempts a Layup. Contested by D'Angelo O'Neal (4.5 feet, ZONE). COLE MITCHELL MAKES IT!
Score: 34-41

[08:23] Team_046 possession (Score: 34-41)
Cade Wall drives, picks up Cole Mitchell. Help arrives from Miles Sabonis! Cade Wall attempts a Dunk. Contested by Miles Sabonis (4.7 feet, ZONE). CADE WALL MAKES IT! Assist: D'Angelo O'Neal
Score: 34-43

[08:08] Team_009 possession (Score: 34-43)
Cole Mitchell drives, Cade Wall stays with him. Cole Mitchell attempts a Dunk. Contested by Cade Wall (3.0 feet, MAN). COLE MITCHELL MAKES IT!
Score: 36-43

[07:54] Team_046 possession (Score: 36-43)
Kevin Allen attempts a Layup. Contested by Kyle Brogdon (5.0 feet, MAN). KEVIN ALLEN MAKES IT! Assist: Lauri Carter
Score: 36-45

[07:41] Team_009 possession (Score: 36-45)
Cole Mitchell attempts a Midrange. Contested by Victor Nowitzki (4.2 feet, ZONE). Cole Mitchell misses. Offensive rebound by Cole Mitchell! Cole Mitchell kicks it out.

[07:25] Team_009 possession (Score: 36-45)
FOUL! Shooting foul on Lauri Carter. Anfernee Anunoby to the line for 3 free throws. [Team fouls: 4] (Lauri Carter: 3 personal fouls)   FT 1/3: GOOD   FT 2/3: GOOD   FT 3/3: MISS Anfernee Anunoby makes 2/3 from the line. Rebound secured by Cade Wall.
Score: 38-45

[07:12] Team_046 possession (Score: 38-45)
D'Angelo O'Neal attempts a Layup. Contested by Miles Sabonis (5.7 feet, MAN). D'ANGELO O'NEAL MAKES IT! Assist: Victor Nowitzki
Score: 38-47

[06:56] Team_009 possession (Score: 38-47)
Miles Sabonis attempts a 3Pt. Contested by D'Angelo O'Neal (2.2 feet, MAN). Miles Sabonis misses. Rebound secured by Cade Wall.

[06:43] Team_046 possession (Score: 38-47)
Kevin Allen attempts a Midrange. Wide open! Desmond Harden is 6.8 feet away. [ZONE] Kevin Allen misses. Rebound secured by Kyle Brogdon.

[06:26] Team_009 possession (Score: 38-47)
Desmond Harden attempts a Midrange. Wide open! Victor Nowitzki is 8.7 feet away. [MAN] Desmond Harden misses. Rebound secured by Cade Wall.

[06:09] Team_046 possession (Score: 38-47)
Victor Nowitzki makes the Midrange and draws the foul on Anfernee Anunoby! And-1! Victor Nowitzki to the line for 1. [Team fouls: 3] (Anfernee Anunoby: 1 personal fouls)   FT 1/1: GOOD Victor Nowitzki makes 1/1 from the line.
Score: 38-50

[05:58] Team_009 possession (Score: 38-50)
Anfernee Anunoby attempts a Midrange. Contested by Lauri Carter (2.2 feet, MAN). Anfernee Anunoby misses. Rebound secured by Kevin Allen.

[05:47] Team_046 possession (Score: 38-50)
Lauri Carter attempts a 3Pt. Wide open! Miles Sabonis is 6.5 feet away. [ZONE] LAURI CARTER MAKES IT!
Score: 38-53

[05:35] Team_009 possession (Score: 38-53)
Anfernee Anunoby drives, Kevin Allen stays with him. Anfernee Anunoby attempts a Layup. Contested by Kevin Allen (5.3 feet, ZONE). ANFERNEE ANUNOBY MAKES IT! Assist: Kyle Brogdon
Score: 40-53

[05:17] Team_046 possession (Score: 40-53)
D'Angelo O'Neal drives, Miles Sabonis stays with him. D'Angelo O'Neal attempts a Dunk. Contested by Miles Sabonis (2.9 feet, MAN). D'ANGELO O'NEAL MAKES IT!
Score: 40-55

[05:05] Team_009 possession (Score: 40-55)
Desmond Harden attempts a Midrange. Wide open! Victor Nowitzki is 6.4 feet away. [MAN] Desmond Harden misses. Rebound secured by Lauri Carter.

[04:54] Team_046 possession (Score: 40-55)
Kevin Allen attempts a Layup. Contested by Kyle Brogdon (5.3 feet, ZONE). KEVIN ALLEN MAKES IT!
Score: 40-57

[04:41] Team_009 possession (Score: 40-57)
Desmond Harden attempts a Layup. Wide open! Victor Nowitzki is 7.2 feet away. [MAN] DESMOND HARDEN MAKES IT!
Score: 42-57

[04:27] Team_046 possession (Score: 42-57)
Kevin Allen drives to the basket... Kevin Allen throws a bad pass out of bounds! TURNOVER! (dead ball)

[04:27] Substitution (Team_009): Miles Sabonis OUT → Paul Trent IN (stamina_rule2)

[04:27] Substitution (Team_009): Desmond Harden OUT → Evan Curry IN (stamina_rule2)

[04:27] Substitution (Team_009): Anfernee Anunoby OUT → RJ Jokic IN (stamina_rule2)

[04:27] Substitution (Team_009): Cole Mitchell OUT → Kawhi Herro IN (stamina_rule2)

[04:27] Substitution (Team_009): Kyle Brogdon OUT → Shaquille Green IN (stamina_rule2)

[04:27] Substitution (Team_046): D'Angelo O'Neal OUT → Collin Butler IN (stamina_rule2)

[04:27] Substitution (Team_046): Victor Nowitzki OUT → Manu Dosunmu IN (stamina_rule2)

[04:27] Substitution (Team_046): Lauri Carter OUT → Josh Barrett IN (stamina_rule2)

[04:27] Substitution (Team_046): Cade Wall OUT → Chris LaVine IN (stamina_rule2)

[04:27] Substitution (Team_046): Kevin Allen OUT → Paul DeRozan IN (stamina_rule2)

[04:10] Team_009 possession (Score: 42-57)
Paul Trent attempts a Midrange. Contested by Collin Butler (5.1 feet, MAN). Paul Trent misses. FOUL! Loose ball foul on Manu Dosunmu during the rebound battle. [IN THE BONUS! 5 team fouls] Kawhi Herro to the line for 2 free throws. (Manu Dosunmu: 1 personal fouls)   FT 1/2: MISS   FT 2/2: MISS Kawhi Herro makes 0/2 from the line. Rebound secured by Manu Dosunmu.

[04:00] Team_046 possession (Score: 42-57)
Chris LaVine attempts a Midrange. Contested by Evan Curry (5.9 feet, ZONE). CHRIS LAVINE MAKES IT! Assist: Paul DeRozan
Score: 42-59

[03:45] Team_009 possession (Score: 42-59)
RJ Jokic attempts a Layup. Contested by Chris LaVine (5.0 feet, ZONE). RJ JOKIC MAKES IT! Assist: Evan Curry
Score: 44-59

[03:31] Team_046 possession (Score: 44-59)
Paul DeRozan drives and kicks out. Paul DeRozan attempts a Midrange. Wide open! Shaquille Green is 7.4 feet away. [MAN] Paul DeRozan misses. Offensive rebound by Paul DeRozan! Paul DeRozan's putback is no good. Rebound secured by Kawhi Herro.

[03:21] Team_009 possession (Score: 44-59)
Evan Curry attempts a 3Pt. Wide open! Manu Dosunmu is 7.7 feet away. [MAN] Evan Curry misses. Rebound secured by Manu Dosunmu.

[03:10] Team_046 possession (Score: 44-59)
Chris LaVine attempts a 3Pt. Contested by Kawhi Herro (3.1 feet, MAN). Chris LaVine misses. Rebound secured by Shaquille Green.

[02:56] Team_009 possession (Score: 44-59)
RJ Jokic attempts a Midrange. Wide open! Manu Dosunmu is 9.3 feet away. [ZONE] RJ Jokic misses. Rebound secured by Manu Dosunmu.

[02:39] Team_046 possession (Score: 44-59)
Collin Butler attempts a Midrange. Wide open! Shaquille Green is 6.1 feet away. [ZONE] Collin Butler misses. Rebound secured by RJ Jokic.

[02:27] Team_009 possession (Score: 44-59)
Kawhi Herro makes the Layup and draws the foul on Chris LaVine! And-1! Kawhi Herro to the line for 1. [BONUS: 6 team fouls] (Chris LaVine: 1 personal fouls)   FT 1/1: MISS Kawhi Herro makes 0/1 from the line. Rebound secured by Manu Dosunmu.
Score: 46-59

[02:13] Team_046 possession (Score: 46-59)
Collin Butler attempts a 3Pt. Wide open! Paul Trent is 6.6 feet away. [MAN] Collin Butler misses. Rebound secured by Kawhi Herro.

[02:03] Team_009 possession (Score: 46-59)
RJ Jokic attempts a 3Pt. Wide open! Josh Barrett is 6.1 feet away. [MAN] RJ JOKIC MAKES IT! Assist: Evan Curry
Score: 49-59

[01:49] Team_046 possession (Score: 49-59)
Collin Butler attempts a 3Pt. Contested by RJ Jokic (3.7 feet, ZONE). COLLIN BUTLER MAKES IT! Assist: Chris LaVine
Score: 49-62

[01:34] Team_009 possession (Score: 49-62)
Evan Curry attempts a Midrange. Contested by Manu Dosunmu (5.3 feet, MAN). EVAN CURRY MAKES IT! Assist: Paul Trent
Score: 51-62

[01:19] Team_046 possession (Score: 51-62)
Paul DeRozan drives to the basket... Paul DeRozan commits a violation (traveling/carry)! TURNOVER! (dead ball)

[01:03] Team_009 possession (Score: 51-62)
RJ Jokic attempts a 3Pt. Contested by Josh Barrett (3.2 feet, MAN). RJ Jokic misses. Offensive rebound by Shaquille Green! Shaquille Green kicks it out.

[00:49] Team_009 possession (Score: 51-62)
Kawhi Herro attempts a Midrange. Contested by Chris LaVine (3.0 feet, MAN). Kawhi Herro misses. Rebound secured by Paul DeRozan.

[00:37] Team_046 possession (Score: 51-62)
Josh Barrett attempts a 3Pt. Contested by RJ Jokic (4.6 feet, MAN). Josh Barrett misses. Rebound secured by RJ Jokic.

[00:26] Team_009 possession (Score: 51-62)
Shaquille Green drives and kicks out. RJ Jokic attempts a 3Pt. Contested by Josh Barrett (4.9 feet, MAN). RJ JOKIC MAKES IT! Assist: Paul Trent
Score: 54-62

[00:12] Team_046 possession (Score: 54-62)
Paul DeRozan attempts a Midrange. Wide open! Evan Curry is 7.5 feet away. [ZONE] PAUL DEROZAN MAKES IT!
Score: 54-64

================================================================================
                              2ND QUARTER COMPLETE                              
================================================================================

2ND QUARTER SCORE: Team_009 32, Team_046 32

BOX SCORE:
================================================================================

Team_009
--------------------------------------------------------------------------------
Player                MIN  PTS  REB  AST  TO      FG   FG%      3P   3P%
--------------------------------------------------------------------------------
Anfernee Anunoby       19    8    1    1   0   3/6    50.0     0/0   0.0
RJ Jokic                6    8    2    0   0   3/4    75.0     0/0   0.0
Miles Sabonis          19    4    0    0   0   2/3    66.7     0/0   0.0
Cole Mitchell          19    4    1    0   0   2/2   100.0     0/0   0.0
Desmond Harden         19    2    0    0   0   1/3    33.3     0/0   0.0
Evan Curry              6    2    0    2   0   1/2    50.0     0/0   0.0
Kyle Brogdon           19    0    4    1   0   0/1     0.0     0/0   0.0
Paul Trent              6    0    0    2   0   0/1     0.0     0/0   0.0
Kawhi Herro             6    0    2    0   0   0/2     0.0     0/0   0.0
Shaquille Green         6    0    2    0   0   0/0     0.0     0/0   0.0

TEAM: FG: 12/24 (50.0%), 3PT: 2/5 (40.0%), REB: 12 (4 off, 8 def), AST: 6, TO: 0
TEAM FOULS: 3


Team_046
--------------------------------------------------------------------------------
Player                MIN  PTS  REB  AST  TO      FG   FG%      3P   3P%
--------------------------------------------------------------------------------
Kevin Allen            19    7    1    0   0   3/4    75.0     0/0   0.0
Victor Nowitzki        19    6    0    1   0   2/2   100.0     0/0   0.0
Cade Wall              19    5    4    0   0   2/4    50.0     0/0   0.0
D'Angelo O'Neal        19    4    0    2   0   2/2   100.0     0/0   0.0
Lauri Carter           19    3    2    2   0   1/2    50.0     0/0   0.0
Collin Butler           6    3    0    0   0   1/3    33.3     0/0   0.0
Chris LaVine            6    2    0    1   0   1/2    50.0     0/0   0.0
Paul DeRozan            6    2    1    1   0   1/2    50.0     0/0   0.0
Manu Dosunmu            6    0    4    0   0   0/0     0.0     0/0   0.0
Josh Barrett            6    0    0    0   0   0/1     0.0     0/0   0.0

TEAM: FG: 13/22 (59.1%), 3PT: 3/7 (42.9%), REB: 12 (1 off, 11 def), AST: 7, TO: 2
TEAM FOULS: 6 [Team_009 in BONUS]

================================================================================

================================================================================
                       3RD QUARTER - Team_009 vs Team_046                       
================================================================================

[12:00] Team_009 possession (Score: 54-64)
Kyle Brogdon attempts a Midrange. Contested by Victor Nowitzki (6.0 feet, ZONE). Kyle Brogdon misses. Rebound secured by Kevin Allen.

[11:50] Team_046 possession (Score: 54-64)
Cade Wall drives and kicks out. Lauri Carter attempts a 3Pt. Wide open! Anfernee Anunoby is 6.3 feet away. [MAN] Lauri Carter misses. Rebound secured by Cole Mitchell.

[11:34] Team_009 possession (Score: 54-64)
Desmond Harden drives to the basket... FOUL! Offensive foul on Desmond Harden! Kevin Allen drew the charge! [Team fouls: 1] (Desmond Harden: 1 personal fouls) TURNOVER! (dead ball)

[11:15] Team_046 possession (Score: 54-64)
Lauri Carter makes the 3Pt and draws the foul on Anfernee Anunoby! And-1! Lauri Carter to the line for 1. [Team fouls: 2] (Anfernee Anunoby: 1 personal fouls)   FT 1/1: MISS Lauri Carter makes 0/1 from the line. Rebound secured by Cole Mitchell.
Score: 54-67

[11:04] Team_009 possession (Score: 54-67)
Desmond Harden attempts a 3Pt. Wide open! Victor Nowitzki is 7.4 feet away. [MAN] DESMOND HARDEN MAKES IT! Assist: Anfernee Anunoby
Score: 57-67

[10:53] Team_046 possession (Score: 57-67)
Kevin Allen attempts a Midrange. Contested by Kyle Brogdon (3.1 feet, MAN). Kevin Allen misses. Rebound secured by Cole Mitchell.

[10:43] Team_009 possession (Score: 57-67)
Kyle Brogdon attempts a Layup. Heavily contested by Kevin Allen (0.5 feet, MAN)! Kyle Brogdon misses. Rebound secured by Cade Wall.

[10:28] Team_046 possession (Score: 57-67)
Cade Wall drives and kicks out. Cade Wall attempts a Midrange. Contested by Cole Mitchell (4.2 feet, MAN). CADE WALL MAKES IT! Assist: D'Angelo O'Neal
Score: 57-69

[10:14] Team_009 possession (Score: 57-69)
Anfernee Anunoby attempts a 3Pt. Contested by Lauri Carter (3.7 feet, ZONE). Anfernee Anunoby misses. Rebound secured by Kevin Allen.

[10:01] Team_046 possession (Score: 57-69)
Kevin Allen attempts a 3Pt. Wide open! Miles Sabonis is 6.1 feet away. [ZONE] KEVIN ALLEN MAKES IT! Assist: Lauri Carter
Score: 57-72

[09:47] Team_009 possession (Score: 57-72)
Miles Sabonis attempts a Layup. BLOCKED BY D'ANGELO O'NEAL! Ball is loose! Rebound secured by Cade Wall.

[09:34] Team_046 possession (Score: 57-72)
Cade Wall attempts a 3Pt. Heavily contested by Cole Mitchell (1.6 feet, MAN)! Cade Wall misses. Rebound secured by Anfernee Anunoby.

[09:21] Team_009 possession (Score: 57-72)
Anfernee Anunoby attempts a 3Pt. Contested by D'Angelo O'Neal (2.5 feet, ZONE). ANFERNEE ANUNOBY MAKES IT! Assist: Kyle Brogdon
Score: 60-72

[09:10] Team_046 possession (Score: 60-72)
FOUL! Holding foul on Anfernee Anunoby. [Team fouls: 3] No free throws, side out. (Anfernee Anunoby: 2 personal fouls)

[08:55] Team_046 possession (Score: 60-72)
Cade Wall attempts a Midrange. Wide open! Cole Mitchell is 7.7 feet away. [MAN] Cade Wall misses. FOUL! Loose ball foul on Anfernee Anunoby during the rebound battle. [Team fouls: 4] No free throws, side out. (Anfernee Anunoby: 3 personal fouls)

[08:38] Team_046 possession (Score: 60-72)
Cade Wall attempts a Layup. Wide open! Kyle Brogdon is 8.0 feet away. [ZONE] CADE WALL MAKES IT!
Score: 60-74

[08:20] Team_009 possession (Score: 60-74)
FOUL! Shooting foul on Victor Nowitzki. Desmond Harden to the line for 2 free throws. [Team fouls: 1] (Victor Nowitzki: 1 personal fouls)   FT 1/2: GOOD   FT 2/2: MISS Desmond Harden makes 1/2 from the line. Rebound secured by Lauri Carter.
Score: 61-74

[08:06] Team_046 possession (Score: 61-74)
D'Angelo O'Neal attempts a 3Pt. Wide open! Desmond Harden is 6.8 feet away. [ZONE] D'Angelo O'Neal misses. Rebound secured by Cole Mitchell.

[07:53] Team_009 possession (Score: 61-74)
Desmond Harden drives, picks up Victor Nowitzki. Help arrives from Lauri Carter! Desmond Harden attempts a Layup. Contested by Lauri Carter (5.1 feet, MAN). Desmond Harden misses. Rebound secured by Lauri Carter.

[07:39] Team_046 possession (Score: 61-74)
FOUL! Shooting foul on Cole Mitchell. Cade Wall to the line for 2 free throws. [BONUS: 5 team fouls] (Cole Mitchell: 1 personal fouls)   FT 1/2: GOOD   FT 2/2: GOOD Cade Wall makes 2/2 from the line.
Score: 61-76

[07:26] Team_009 possession (Score: 61-76)
Miles Sabonis attempts a 3Pt. Contested by Lauri Carter (4.1 feet, ZONE). Miles Sabonis misses. Rebound secured by Cade Wall.

[07:11] Team_046 possession (Score: 61-76)
Cade Wall drives, Kyle Brogdon stays with him. Cade Wall attempts a Layup. Wide open! Kyle Brogdon is 6.4 feet away. [ZONE] CADE WALL MAKES IT!
Score: 61-78

[06:55] Team_009 possession (Score: 61-78)
Cole Mitchell attempts a 3Pt. Wide open! Cade Wall is 7.1 feet away. [MAN] Cole Mitchell misses. Rebound secured by Lauri Carter.

[06:42] Team_046 possession (Score: 61-78)
Kevin Allen attempts a 3Pt. Contested by Kyle Brogdon (4.9 feet, MAN). KEVIN ALLEN MAKES IT! Assist: Lauri Carter
Score: 61-81

[06:24] Team_009 possession (Score: 61-81)
Miles Sabonis attempts a Layup. Wide open! Kevin Allen is 8.1 feet away. [ZONE] Miles Sabonis misses. Rebound secured by Lauri Carter.

[06:09] Team_046 possession (Score: 61-81)
FOUL! Holding foul on Anfernee Anunoby. [IN THE BONUS! 6 team fouls] Lauri Carter to the line for 2 free throws. (Anfernee Anunoby: 4 personal fouls)   FT 1/2: GOOD   FT 2/2: GOOD Lauri Carter makes 2/2 from the line.
Score: 61-83

[05:55] Team_009 possession (Score: 61-83)
Desmond Harden attempts a Layup. Contested by Victor Nowitzki (4.8 feet, MAN). DESMOND HARDEN MAKES IT!
Score: 63-83

[05:40] Team_046 possession (Score: 63-83)
FOUL! Shooting foul on Kyle Brogdon. Kevin Allen to the line for 2 free throws. [BONUS: 7 team fouls] (Kyle Brogdon: 1 personal fouls)   FT 1/2: GOOD   FT 2/2: GOOD Kevin Allen makes 2/2 from the line.
Score: 63-85

[05:25] Team_009 possession (Score: 63-85)
Desmond Harden attempts a 3Pt. Wide open! Victor Nowitzki is 7.0 feet away. [MAN] Desmond Harden misses. Rebound secured by Cade Wall.

[05:10] Team_046 possession (Score: 63-85)
Victor Nowitzki attempts a 3Pt. Wide open! Desmond Harden is 7.5 feet away. [MAN] Victor Nowitzki misses. Rebound secured by Anfernee Anunoby.

[04:54] Team_009 possession (Score: 63-85)
Anfernee Anunoby attempts a 3Pt. Heavily contested by Lauri Carter (0.5 feet, ZONE)! Anfernee Anunoby misses. Rebound secured by Cade Wall.

[04:37] Team_046 possession (Score: 63-85)
Lauri Carter attempts a 3Pt. Contested by Miles Sabonis (5.3 feet, ZONE). Lauri Carter misses. Rebound secured by Anfernee Anunoby.

[04:20] Team_009 possession (Score: 63-85)
Miles Sabonis throws a bad pass! Stolen by D'Angelo O'Neal! TURNOVER! (live ball)

[04:03] Team_046 possession (Score: 63-85)
Lauri Carter attempts a 3Pt. Contested by Anfernee Anunoby (5.5 feet, ZONE). Lauri Carter misses. Rebound secured by Cole Mitchell.

[03:51] Team_009 possession (Score: 63-85)
Anfernee Anunoby attempts a Midrange. Contested by Cade Wall (4.3 feet, ZONE). Anfernee Anunoby misses. Rebound secured by Cade Wall.

[03:36] Team_046 possession (Score: 63-85)
D'Angelo O'Neal drives to the basket... D'Angelo O'Neal throws a bad pass out of bounds! TURNOVER! (dead ball)

[03:21] Team_009 possession (Score: 63-85)
Cole Mitchell drives and kicks out. Kyle Brogdon attempts a Midrange. Contested by Kevin Allen (4.3 feet, MAN). KYLE BROGDON MAKES IT!
Score: 65-85

[03:05] Team_046 possession (Score: 65-85)
Kevin Allen attempts a 3Pt. Wide open! Miles Sabonis is 9.3 feet away. [ZONE] KEVIN ALLEN MAKES IT! Assist: D'Angelo O'Neal
Score: 65-88

[02:52] Team_009 possession (Score: 65-88)
Cole Mitchell drives, Kevin Allen stays with him. Cole Mitchell attempts a Dunk. Heavily contested by Kevin Allen (1.7 feet, ZONE)! Cole Mitchell misses. Rebound secured by Lauri Carter.

[02:37] Team_046 possession (Score: 65-88)
Cade Wall attempts a Midrange. Wide open! Cole Mitchell is 6.9 feet away. [MAN] Cade Wall misses. Offensive rebound by Lauri Carter! Lauri Carter kicks it out.

[02:22] Team_046 possession (Score: 65-88)
Cade Wall attempts a 3Pt. Wide open! Miles Sabonis is 6.8 feet away. [ZONE] Cade Wall misses. Rebound secured by Kyle Brogdon.

[02:07] Team_009 possession (Score: 65-88)
Cole Mitchell attempts a Midrange. Contested by Victor Nowitzki (3.4 feet, ZONE). Cole Mitchell misses. Rebound secured by Cade Wall.

[01:50] Team_046 possession (Score: 65-88)
Victor Nowitzki commits a violation (traveling/carry)! TURNOVER! (dead ball)

[01:50] Substitution (Team_009): Miles Sabonis OUT → Paul Trent IN (stamina_rule2)

[01:50] Substitution (Team_009): Desmond Harden OUT → Evan Curry IN (stamina_rule2)

[01:50] Substitution (Team_009): Anfernee Anunoby OUT → RJ Jokic IN (stamina_rule2)

[01:50] Substitution (Team_009): Cole Mitchell OUT → Kawhi Herro IN (stamina_rule2)

[01:50] Substitution (Team_009): Kyle Brogdon OUT → Shaquille Green IN (stamina_rule2)

[01:50] Substitution (Team_046): D'Angelo O'Neal OUT → Collin Butler IN (stamina_rule2)

[01:50] Substitution (Team_046): Victor Nowitzki OUT → Manu Dosunmu IN (stamina_rule2)

[01:50] Substitution (Team_046): Lauri Carter OUT → Josh Barrett IN (stamina_rule2)

[01:50] Substitution (Team_046): Cade Wall OUT → Chris LaVine IN (stamina_rule2)

[01:50] Substitution (Team_046): Kevin Allen OUT → Paul DeRozan IN (stamina_rule2)

[01:38] Team_009 possession (Score: 65-88)
Shaquille Green attempts a Midrange. Contested by Chris LaVine (5.3 feet, ZONE). Shaquille Green misses. Rebound secured by Paul DeRozan.

[01:22] Team_046 possession (Score: 65-88)
Manu Dosunmu drives, Kawhi Herro stays with him. Manu Dosunmu attempts a Dunk. Contested by Kawhi Herro (2.2 feet, ZONE). Manu Dosunmu misses. Rebound secured by Kawhi Herro.

[01:08] Team_009 possession (Score: 65-88)
Kawhi Herro throws a bad pass out of bounds! TURNOVER! (dead ball)

[00:56] Team_046 possession (Score: 65-88)
Chris LaVine drives to the basket... FOUL! Offensive foul on Chris LaVine! Kawhi Herro drew the charge! [Team fouls: 2] (Chris LaVine: 1 personal fouls) TURNOVER! (dead ball)

[00:41] Team_009 possession (Score: 65-88)
Kawhi Herro attempts a 3Pt. Contested by Collin Butler (3.8 feet, ZONE). Kawhi Herro misses. Rebound secured by Paul DeRozan.

[00:24] Team_046 possession (Score: 65-88)
Paul DeRozan attempts a Midrange. Contested by Shaquille Green (3.8 feet, MAN). Paul DeRozan misses. Rebound secured by RJ Jokic.

[00:10] Team_009 possession (Score: 65-88)
FOUL! Holding foul on Chris LaVine. [Team fouls: 3] No free throws, side out. (Chris LaVine: 2 personal fouls)

================================================================================
                              3RD QUARTER COMPLETE                              
================================================================================

3RD QUARTER SCORE: Team_009 11, Team_046 24

BOX SCORE:
================================================================================

Team_009
--------------------------------------------------------------------------------
Player                MIN  PTS  REB  AST  TO      FG   FG%      3P   3P%
--------------------------------------------------------------------------------
Desmond Harden         29    5    0    0   0   2/5    40.0     0/0   0.0
Anfernee Anunoby       29    3    3    1   0   1/4    25.0     0/0   0.0
Kyle Brogdon           29    2    1    1   0   1/3    33.3     0/0   0.0
Cole Mitchell          29    0    5    0   0   0/3     0.0     0/0   0.0
Miles Sabonis          29    0    0    0   0   0/3     0.0     0/0   0.0
Shaquille Green         7    0    0    0   0   0/1     0.0     0/0   0.0
Kawhi Herro             7    0    1    0   0   0/1     0.0     0/0   0.0
RJ Jokic                7    0    1    0   0   0/0     0.0     0/0   0.0

TEAM: FG: 4/20 (20.0%), 3PT: 2/8 (25.0%), REB: 11 (0 off, 11 def), AST: 2, TO: 3
TEAM FOULS: 7 [Team_046 in BONUS]


Team_046
--------------------------------------------------------------------------------
Player                MIN  PTS  REB  AST  TO      FG   FG%      3P   3P%
--------------------------------------------------------------------------------
Kevin Allen            29   11    2    0   0   4/5    80.0     0/0   0.0
Cade Wall              29    8    8    0   0   4/7    57.1     0/0   0.0
Lauri Carter           29    2    6    2   0   1/4    25.0     0/0   0.0
D'Angelo O'Neal        29    0    0    2   0   0/1     0.0     0/0   0.0
Victor Nowitzki        29    0    0    0   0   0/1     0.0     0/0   0.0
Paul DeRozan            7    0    2    0   0   0/1     0.0     0/0   0.0
Manu Dosunmu            7    0    0    0   0   0/1     0.0     0/0   0.0

TEAM: FG: 9/20 (45.0%), 3PT: 3/10 (30.0%), REB: 18 (2 off, 16 def), AST: 4, TO: 3
TEAM FOULS: 3

================================================================================

================================================================================
                       4TH QUARTER - Team_009 vs Team_046                       
================================================================================

[12:00] Substitution (Team_009): Miles Sabonis OUT (stamina: 77) → Paul Trent IN (comeback_detected)

[12:00] Substitution (Team_046): D'Angelo O'Neal OUT (stamina: 76) → Collin Butler IN (comeback_detected)

[12:00] Team_009 possession (Score: 65-88)
Anfernee Anunoby attempts a Midrange. Contested by Lauri Carter (3.5 feet, MAN). Anfernee Anunoby misses. Rebound secured by Lauri Carter.

[11:49] Team_046 possession (Score: 65-88)
Cade Wall attempts a 3Pt. Wide open! Paul Trent is 6.4 feet away. [ZONE] Cade Wall misses. Rebound secured by Cole Mitchell.

[11:33] Team_009 possession (Score: 65-88)
Cole Mitchell attempts a 3Pt. Heavily contested by Lauri Carter (1.0 feet, ZONE)! Cole Mitchell misses. Rebound secured by Kevin Allen.

[11:20] Team_046 possession (Score: 65-88)
Kevin Allen drives and kicks out. Kevin Allen attempts a Midrange. Wide open! Kyle Brogdon is 7.2 feet away. [MAN] Kevin Allen misses. Rebound secured by Kyle Brogdon.

[11:04] Team_009 possession (Score: 65-88)
Paul Trent attempts a Midrange. Heavily contested by Lauri Carter (0.5 feet, ZONE)! Paul Trent misses. Rebound secured by Cade Wall.

[10:54] Team_046 possession (Score: 65-88)
Lauri Carter drives, Anfernee Anunoby stays with him. Lauri Carter attempts a Layup. Contested by Anfernee Anunoby (3.1 feet, MAN). LAURI CARTER MAKES IT!
Score: 65-90

[10:38] Team_009 possession (Score: 65-90)
FOUL! Shooting foul on Kevin Allen. Kyle Brogdon to the line for 2 free throws. [Team fouls: 1] (Kevin Allen: 1 personal fouls)   FT 1/2: GOOD   FT 2/2: GOOD Kyle Brogdon makes 2/2 from the line.
Score: 67-90

[10:27] Team_046 possession (Score: 67-90)
Cade Wall loses the ball! Stripped by Cole Mitchell! TURNOVER! (live ball)

[10:13] Team_009 possession (Score: 67-90)
Kyle Brogdon makes the Layup and draws the foul on Kevin Allen! And-1! Kyle Brogdon to the line for 1. [Team fouls: 2] (Kevin Allen: 2 personal fouls)   FT 1/1: GOOD Kyle Brogdon makes 1/1 from the line.
Score: 70-90

[09:59] Team_046 possession (Score: 70-90)
Victor Nowitzki drives and kicks out. Collin Butler attempts a Midrange. Contested by Paul Trent (3.2 feet, ZONE). COLLIN BUTLER MAKES IT! Assist: Kevin Allen
Score: 70-92

[09:41] Team_009 possession (Score: 70-92)
Desmond Harden attempts a 3Pt. Contested by Victor Nowitzki (3.6 feet, MAN). Desmond Harden misses. Offensive rebound by Kyle Brogdon! Kyle Brogdon puts it back in!
Score: 72-92

[09:30] Team_046 possession (Score: 72-92)
Kevin Allen drives to the basket... Kevin Allen loses the ball! Stripped by Kyle Brogdon! TURNOVER! (live ball)

[09:14] Team_009 possession (Score: 72-92)
Anfernee Anunoby attempts a 3Pt. Contested by Lauri Carter (3.4 feet, MAN). Anfernee Anunoby misses. Rebound secured by Lauri Carter.

[08:56] Team_046 possession (Score: 72-92)
Cade Wall attempts a Midrange. Wide open! Cole Mitchell is 8.7 feet away. [MAN] CADE WALL MAKES IT!
Score: 72-94

[08:40] Team_009 possession (Score: 72-94)
Paul Trent attempts a 3Pt. Contested by Collin Butler (3.0 feet, MAN). Paul Trent misses. FOUL! Loose ball foul on Kevin Allen during the rebound battle. [Team fouls: 3] No free throws, side out. (Kevin Allen: 3 personal fouls)

[08:22] Team_009 possession (Score: 72-94)
Desmond Harden attempts a Layup. Contested by Kevin Allen (3.7 feet, ZONE). DESMOND HARDEN MAKES IT! Assist: Paul Trent
Score: 74-94

[08:10] Team_046 possession (Score: 74-94)
Lauri Carter attempts a 3Pt. Contested by Paul Trent (5.2 feet, ZONE). Lauri Carter misses. Rebound secured by Anfernee Anunoby.

[07:55] Team_009 possession (Score: 74-94)
Desmond Harden drives and kicks out. Cole Mitchell attempts a Midrange. Contested by Cade Wall (5.5 feet, MAN). Cole Mitchell misses. Rebound secured by Lauri Carter.

[07:37] Team_046 possession (Score: 74-94)
Collin Butler attempts a 3Pt. Contested by Paul Trent (4.9 feet, MAN). Collin Butler misses. Offensive rebound by Cade Wall! Cade Wall kicks it out.

[07:20] Team_046 possession (Score: 74-94)
Victor Nowitzki attempts a Layup. Wide open! Kyle Brogdon is 6.6 feet away. [ZONE] VICTOR NOWITZKI MAKES IT! Assist: Cade Wall
Score: 74-96

[07:02] Team_009 possession (Score: 74-96)
Desmond Harden attempts a 3Pt. Wide open! Cade Wall is 7.1 feet away. [ZONE] Desmond Harden misses. Rebound secured by Lauri Carter.

[06:52] Team_046 possession (Score: 74-96)
Victor Nowitzki attempts a 3Pt. Wide open! Desmond Harden is 7.4 feet away. [MAN] Victor Nowitzki misses. FOUL! Loose ball foul on Anfernee Anunoby during the rebound battle. [Team fouls: 1] No free throws, side out. (Anfernee Anunoby: 1 personal fouls)

[06:37] Team_046 possession (Score: 74-96)
Victor Nowitzki attempts a 3Pt. Contested by Desmond Harden (3.6 feet, MAN). Victor Nowitzki misses. Offensive rebound by Collin Butler! Collin Butler kicks it out.

[06:22] Team_046 possession (Score: 74-96)
Kevin Allen attempts a Midrange. Contested by Desmond Harden (5.5 feet, ZONE). Kevin Allen misses. Offensive rebound by Collin Butler! Collin Butler kicks it out.

[06:06] Team_046 possession (Score: 74-96)
Victor Nowitzki attempts a 3Pt. Contested by Paul Trent (4.2 feet, ZONE). Victor Nowitzki misses. Rebound secured by Kyle Brogdon.

[05:51] Team_009 possession (Score: 74-96)
FOUL! Shooting foul on Cade Wall. Cole Mitchell to the line for 2 free throws. [Team fouls: 4] (Cade Wall: 1 personal fouls)   FT 1/2: GOOD   FT 2/2: GOOD Cole Mitchell makes 2/2 from the line.
Score: 76-96

[05:36] Team_046 possession (Score: 76-96)
Collin Butler drives and kicks out. Cade Wall attempts a 3Pt. Wide open! Anfernee Anunoby is 8.0 feet away. [ZONE] Cade Wall misses. Offensive rebound by Collin Butler! Collin Butler kicks it out.

[05:23] Team_046 possession (Score: 76-96)
Lauri Carter attempts a Layup. Wide open! Anfernee Anunoby is 7.0 feet away. [MAN] Lauri Carter misses. Rebound secured by Cole Mitchell.

[05:09] Team_009 possession (Score: 76-96)
Desmond Harden attempts a Midrange. Contested by Victor Nowitzki (4.9 feet, MAN). DESMOND HARDEN MAKES IT!
Score: 78-96

[04:56] Team_046 possession (Score: 78-96)
Collin Butler attempts a Layup. Wide open! Paul Trent is 7.6 feet away. [MAN] COLLIN BUTLER MAKES IT!
Score: 78-98

[04:41] Team_009 possession (Score: 78-98)
Cole Mitchell drives, Cade Wall stays with him. Cole Mitchell attempts a Dunk. Heavily contested by Cade Wall (1.7 feet, MAN)! COLE MITCHELL MAKES IT!
Score: 80-98

[04:24] Team_046 possession (Score: 80-98)
Collin Butler attempts a Midrange. Wide open! Paul Trent is 7.2 feet away. [MAN] COLLIN BUTLER MAKES IT!
Score: 80-100

[04:09] Team_009 possession (Score: 80-100)
Paul Trent attempts a 3Pt. Contested by Collin Butler (3.5 feet, MAN). Paul Trent misses. Rebound secured by Cade Wall.

[03:53] Team_046 possession (Score: 80-100)
Lauri Carter attempts a Layup. Wide open! Cole Mitchell is 8.0 feet away. [ZONE] LAURI CARTER MAKES IT!
Score: 80-102

[03:37] Team_009 possession (Score: 80-102)
Anfernee Anunoby attempts a 3Pt. Contested by Lauri Carter (4.8 feet, MAN). Anfernee Anunoby misses. Rebound secured by Cade Wall.

[03:21] Team_046 possession (Score: 80-102)
Kevin Allen attempts a Layup. Wide open! Kyle Brogdon is 10.0 feet away. [ZONE] Kevin Allen misses. Rebound secured by Kyle Brogdon.

[03:10] Team_009 possession (Score: 80-102)
Kyle Brogdon attempts a 3Pt. Contested by Collin Butler (4.7 feet, ZONE). Kyle Brogdon misses. Rebound secured by Lauri Carter.

[02:59] Team_046 possession (Score: 80-102)
Kevin Allen attempts a Midrange. Wide open! Kyle Brogdon is 7.8 feet away. [MAN] KEVIN ALLEN MAKES IT! Assist: Cade Wall
Score: 80-104

[02:45] Team_009 possession (Score: 80-104)
Cole Mitchell attempts a Layup. BLOCKED BY COLLIN BUTLER! Ball is loose! Rebound secured by Cade Wall.

[02:31] Team_046 possession (Score: 80-104)
Kevin Allen attempts a 3Pt. Wide open! Desmond Harden is 8.0 feet away. [ZONE] KEVIN ALLEN MAKES IT! Assist: Victor Nowitzki
Score: 80-107

[02:15] Team_009 possession (Score: 80-107)
Kyle Brogdon makes the Dunk and draws the foul on Kevin Allen! And-1! Kyle Brogdon to the line for 1. [BONUS: 5 team fouls] (Kevin Allen: 4 personal fouls)   FT 1/1: MISS Kyle Brogdon makes 0/1 from the line. Rebound secured by Lauri Carter.
Score: 82-107

[02:04] Team_046 possession (Score: 82-107)
Collin Butler throws a bad pass! Stolen by Paul Trent! TURNOVER! (live ball)

[01:48] Team_009 possession (Score: 82-107)
Anfernee Anunoby attempts a 3Pt. Contested by Collin Butler (3.9 feet, ZONE). Anfernee Anunoby misses. Rebound secured by Lauri Carter.

[01:32] Team_046 possession (Score: 82-107)
Lauri Carter attempts a 3Pt. Wide open! Paul Trent is 6.0 feet away. [ZONE] LAURI CARTER MAKES IT!
Score: 82-110

[01:17] Team_009 possession (Score: 82-110)
Anfernee Anunoby attempts a 3Pt. Contested by Lauri Carter (4.8 feet, MAN). Anfernee Anunoby misses. Rebound secured by Lauri Carter.

[01:02] Team_046 possession (Score: 82-110)
Lauri Carter attempts a 3Pt. Wide open! Anfernee Anunoby is 8.2 feet away. [MAN] LAURI CARTER MAKES IT! Assist: Cade Wall
Score: 82-113

[00:48] Team_009 possession (Score: 82-113)
Paul Trent attempts a 3Pt. Contested by Collin Butler (2.3 feet, ZONE). Paul Trent misses. Offensive rebound by Kyle Brogdon! Kyle Brogdon kicks it out.

[00:35] Team_009 possession (Score: 82-113)
FOUL! Holding foul on Lauri Carter. [IN THE BONUS! 6 team fouls] Anfernee Anunoby to the line for 2 free throws. (Lauri Carter: 1 personal fouls)   FT 1/2: GOOD   FT 2/2: GOOD Anfernee Anunoby makes 2/2 from the line.
Score: 84-113

[00:21] Team_046 possession (Score: 84-113)
Collin Butler attempts a 3Pt. Wide open! Paul Trent is 7.4 feet away. [ZONE] COLLIN BUTLER MAKES IT! Assist: Cade Wall
Score: 84-116

[00:08] Team_009 possession (Score: 84-116)
Paul Trent drives to the basket... Paul Trent loses control! Ball rolls out of bounds! TURNOVER! (dead ball)

[00:08] Substitution (Team_009): Desmond Harden OUT → Evan Curry IN (stamina_rule2)

[00:08] Substitution (Team_009): Anfernee Anunoby OUT → RJ Jokic IN (stamina_rule2)

[00:08] Substitution (Team_009): Cole Mitchell OUT → Kawhi Herro IN (stamina_rule2)

[00:08] Substitution (Team_009): Kyle Brogdon OUT → Shaquille Green IN (stamina_rule2)

[00:08] Substitution (Team_009): Paul Trent OUT → Miles Sabonis IN (starter_return_rule1)

[00:08] Substitution (Team_046): Victor Nowitzki OUT → Manu Dosunmu IN (stamina_rule2)

[00:08] Substitution (Team_046): Lauri Carter OUT → Josh Barrett IN (stamina_rule2)

[00:08] Substitution (Team_046): Cade Wall OUT → Chris LaVine IN (stamina_rule2)

[00:08] Substitution (Team_046): Kevin Allen OUT → Paul DeRozan IN (stamina_rule2)

[00:08] Substitution (Team_046): Collin Butler OUT → D'Angelo O'Neal IN (starter_return_rule1)

================================================================================
                              4TH QUARTER COMPLETE                              
================================================================================

4TH QUARTER SCORE: Team_009 19, Team_046 28

BOX SCORE:
================================================================================

Team_009
--------------------------------------------------------------------------------
Player                MIN  PTS  REB  AST  TO      FG   FG%      3P   3P%
--------------------------------------------------------------------------------
Kyle Brogdon           41    7    6    0   0   3/5    60.0     0/0   0.0
Cole Mitchell          41    4    2    0   0   2/4    50.0     0/0   0.0
Desmond Harden         41    4    0    0   0   2/4    50.0     0/0   0.0
Anfernee Anunoby       41    2    1    0   0   1/6    16.7     0/0   0.0
Paul Trent             19    0    0    1   0   0/2     0.0     0/0   0.0

TEAM: FG: 8/21 (38.1%), 3PT: 1/9 (11.1%), REB: 9 (3 off, 6 def), AST: 1, TO: 1
TEAM FOULS: 1


Team_046
--------------------------------------------------------------------------------
Player                MIN  PTS  REB  AST  TO      FG   FG%      3P   3P%
--------------------------------------------------------------------------------
Lauri Carter           41   10    8    0   0   4/6    66.7     0/0   0.0
Collin Butler          19    9    4    0   0   4/4   100.0     0/0   0.0
Kevin Allen            41    5    1    1   0   2/4    50.0     0/0   0.0
Cade Wall              41    2    5    4   0   1/2    50.0     0/0   0.0
Victor Nowitzki        41    2    0    1   0   1/2    50.0     0/0   0.0

TEAM: FG: 12/18 (66.7%), 3PT: 4/7 (57.1%), REB: 18 (5 off, 13 def), AST: 6, TO: 3
TEAM FOULS: 6 [Team_009 in BONUS]

================================================================================

================================================================================
                               FULL GAME COMPLETE                               
================================================================================

FINAL SCORE: Team_009 84, Team_046 116

SCORING BY QUARTER:
--------------------------------------------------------------------------------
Team                     Q1     Q2     Q3     Q4    FINAL
--------------------------------------------------------------------------------
Team_009                 22     32     11     19       84
Team_046                 32     32     24     28      116
--------------------------------------------------------------------------------

FULL GAME BOX SCORE:
================================================================================

Team_009
--------------------------------------------------------------------------------
Player                MIN  PTS  REB  AST  TO      FG   FG%      3P   3P%      FT STL BLK
--------------------------------------------------------------------------------
Desmond Harden         41   17    0    0   2   9/16   56.2   2/4    50.0   1/2     0   0
Anfernee Anunoby       41   22    7    2   1   7/20   35.0   2/11   18.2   8/9     0   0
Cole Mitchell          41   13   10    1   1   8/15   53.3   2/5    40.0   2/2     1   1
Kyle Brogdon           41   11   13    2   0   2/8    25.0   0/2     0.0   3/4     1   0
Miles Sabonis          29    4    0    2   3   2/8    25.0   1/4    25.0   1/2     0   0
Paul Trent             19    0    0    3   0   0/3     0.0   0/1     0.0   0/0     1   0
Evan Curry              7    2    0    2   0   1/2    50.0   0/1     0.0   0/0     0   0
RJ Jokic                7    8    4    0   0   2/3    66.7   1/1   100.0   0/0     0   0
Kawhi Herro             7    0    3    0   1   0/4     0.0   0/1     0.0   0/3     0   0
Shaquille Green         7    0    2    0   1   1/2    50.0   0/0     0.0   0/0     0   0

TEAM: FG: 33/82 (40.2%), 3PT: 8/30 (26.7%), REB: 39 (8 off, 31 def), AST: 12, TO: 9


Team_046
--------------------------------------------------------------------------------
Player                MIN  PTS  REB  AST  TO      FG   FG%      3P   3P%      FT STL BLK
--------------------------------------------------------------------------------
Victor Nowitzki        41   11    0    2   3   5/8    62.5   1/4    25.0   1/1     0   0
Lauri Carter           41   22   18    4   2   8/14   57.1   5/10   50.0   3/4     0   0
Cade Wall              41   29   21    6   2  12/20   60.0   2/7    28.6   5/5     1   1
Kevin Allen            41   25    9    3   1  10/15   66.7   5/5   100.0   3/4     0   0
D'Angelo O'Neal        29    7    0    5   0   3/5    60.0   0/1     0.0   1/1     1   2
Collin Butler          19   12    4    0   1   4/6    66.7   2/3    66.7   0/0     0   1
Manu Dosunmu            7    0    5    0   0   0/2     0.0   0/1     0.0   0/0     0   0
Josh Barrett            7    0    0    0   0   0/1     0.0   0/1     0.0   0/0     0   0
Chris LaVine            7    4    0    1   1   2/3    66.7   0/1     0.0   0/0     0   1
Paul DeRozan            7    2    3    2   1   1/3    33.3   0/0     0.0   0/0     0   0

TEAM: FG: 46/78 (59.0%), 3PT: 15/33 (45.5%), REB: 60 (12 off, 48 def), AST: 23, TO: 11

================================================================================
