================================================================================
                        FULL GAME - Team_098 vs Team_026                        
================================================================================

================================================================================
                       1ST QUARTER - Team_098 vs Team_026                       
================================================================================

[12:00] Team_098 possession (Score: 0-0)
FOUL! Shooting foul on Immanuel Hyland. Derrick Durant to the line for 2 free throws. [Team fouls: 1] (Immanuel Hyland: 1 personal fouls)   FT 1/2: MISS   FT 2/2: GOOD Derrick Durant makes 1/2 from the line.
Score: 1-0

[11:44] Team_026 possession (Score: 1-0)
Klay Giddey attempts a Layup. BLOCKED BY PASCAL LILLARD! Ball is loose! Rebound secured by Nikola Rose.

[11:31] Team_098 possession (Score: 1-0)
Derrick Durant drives and kicks out. FOUL! Shooting foul on Klay Giddey. Blake Murray to the line for 2 free throws. [Team fouls: 2] (Klay Giddey: 1 personal fouls)   FT 1/2: GOOD   FT 2/2: GOOD Blake Murray makes 2/2 from the line.
Score: 3-0

[11:20] Team_026 possession (Score: 3-0)
Kobe Booker attempts a 3Pt. Contested by Derrick Durant (4.6 feet, MAN). Kobe Booker misses. Rebound secured by Pascal Lillard.

[11:06] Team_098 possession (Score: 3-0)
Nikola Rose attempts a 3Pt. Contested by Immanuel Hyland (5.8 feet, ZONE). Nikola Rose misses. Rebound secured by Shaquille Trent.

[10:53] Team_026 possession (Score: 3-0)
Wendell Gasol throws a bad pass out of bounds! TURNOVER! (dead ball)

[10:37] Team_098 possession (Score: 3-0)
FOUL! Holding foul on Shaquille Trent. [Team fouls: 3] No free throws, side out. (Shaquille Trent: 1 personal fouls)

[10:21] Team_098 possession (Score: 3-0)
Malcolm Tatum attempts a 3Pt. Contested by Immanuel Hyland (4.1 feet, ZONE). MALCOLM TATUM MAKES IT! Assist: Nikola Rose
Score: 6-0

[10:09] Team_026 possession (Score: 6-0)
Klay Giddey loses control! Ball rolls out of bounds! TURNOVER! (dead ball)

[09:54] Team_098 possession (Score: 6-0)
Nikola Rose attempts a 3Pt. Wide open! Immanuel Hyland is 6.1 feet away. [ZONE] Nikola Rose misses. Rebound secured by Kobe Booker.

[09:40] Team_026 possession (Score: 6-0)
Shaquille Trent attempts a 3Pt. Wide open! Pascal Lillard is 7.9 feet away. [MAN] SHAQUILLE TRENT MAKES IT! Assist: Wendell Gasol
Score: 6-3

[09:22] Team_098 possession (Score: 6-3)
Blake Murray attempts a Layup. Heavily contested by Klay Giddey (1.8 feet, MAN)! Blake Murray misses. Rebound secured by Kobe Booker.

[09:09] Team_026 possession (Score: 6-3)
Klay Giddey attempts a 3Pt. Contested by Blake Murray (5.5 feet, MAN). Klay Giddey misses. Rebound secured by Nikola Rose.

[08:56] Team_098 possession (Score: 6-3)
FOUL! Offensive foul on Derrick Durant! Kobe Booker drew the charge! [Team fouls: 1] (Derrick Durant: 1 personal fouls) TURNOVER! (dead ball)

[08:44] Team_026 possession (Score: 6-3)
Kobe Booker drives and kicks out. Immanuel Hyland attempts a Midrange. Contested by Nikola Rose (4.0 feet, MAN). Immanuel Hyland misses. Rebound secured by Nikola Rose.

[08:32] Team_098 possession (Score: 6-3)
FOUL! Shooting foul on Immanuel Hyland. Nikola Rose to the line for 2 free throws. [Team fouls: 4] (Immanuel Hyland: 2 personal fouls)   FT 1/2: GOOD   FT 2/2: GOOD Nikola Rose makes 2/2 from the line.
Score: 8-3

[08:18] Team_026 possession (Score: 8-3)
Klay Giddey attempts a Layup. Wide open! Blake Murray is 6.1 feet away. [MAN] KLAY GIDDEY MAKES IT! Assist: Wendell Gasol
Score: 8-5

[08:06] Team_098 possession (Score: 8-5)
Blake Murray drives, Kobe Booker stays with him. Blake Murray attempts a Layup. Heavily contested by Kobe Booker (1.2 feet, ZONE)! BLAKE MURRAY MAKES IT!
Score: 10-5

[07:57] Team_026 possession (Score: 10-5)
FOUL! Holding foul on Pascal Lillard. [Team fouls: 2] No free throws, side out. (Pascal Lillard: 1 personal fouls)

[07:41] Team_026 possession (Score: 10-5)
Kobe Booker drives, Derrick Durant stays with him. Kobe Booker attempts a Layup. Wide open! Derrick Durant is 6.1 feet away. [MAN] Kobe Booker misses. Rebound secured by Nikola Rose.

[07:26] Team_098 possession (Score: 10-5)
Malcolm Tatum attempts a 3Pt. Contested by Wendell Gasol (3.9 feet, MAN). MALCOLM TATUM MAKES IT! Assist: Blake Murray
Score: 13-5

[07:13] Team_026 possession (Score: 13-5)
FOUL! Shooting foul on Nikola Rose. Immanuel Hyland to the line for 3 free throws. [Team fouls: 3] (Nikola Rose: 1 personal fouls)   FT 1/3: GOOD   FT 2/3: GOOD   FT 3/3: GOOD Immanuel Hyland makes 3/3 from the line.
Score: 13-8

[07:00] Team_098 possession (Score: 13-8)
Nikola Rose drives and kicks out. Malcolm Tatum attempts a Midrange. Wide open! Shaquille Trent is 10.0 feet away. [ZONE] Malcolm Tatum misses. Rebound secured by Kobe Booker.

[06:42] Team_026 possession (Score: 13-8)
Immanuel Hyland makes the Midrange and draws the foul on Nikola Rose! And-1! Immanuel Hyland to the line for 1. [Team fouls: 4] (Nikola Rose: 2 personal fouls)   FT 1/1: GOOD Immanuel Hyland makes 1/1 from the line.
Score: 13-11

[06:24] Team_098 possession (Score: 13-11)
FOUL! Holding foul on Shaquille Trent. [IN THE BONUS! 5 team fouls] Pascal Lillard to the line for 2 free throws. (Shaquille Trent: 2 personal fouls)   FT 1/2: GOOD   FT 2/2: MISS Pascal Lillard makes 1/2 from the line. Offensive rebound by Pascal Lillard! Pascal Lillard kicks it out.
Score: 14-11

[06:08] Team_098 possession (Score: 14-11)
Blake Murray drives, Klay Giddey stays with him. Blake Murray attempts a Dunk. Wide open! Klay Giddey is 6.3 feet away. [MAN] BLAKE MURRAY MAKES IT! Assist: Malcolm Tatum
Score: 16-11

[05:55] Team_026 possession (Score: 16-11)
Wendell Gasol drives, Pascal Lillard stays with him. Wendell Gasol attempts a Dunk. Contested by Pascal Lillard (2.4 feet, ZONE). Wendell Gasol misses. Rebound secured by Pascal Lillard.

[05:41] Team_098 possession (Score: 16-11)
Derrick Durant drives and kicks out. Malcolm Tatum makes the Midrange and draws the foul on Wendell Gasol! And-1! Malcolm Tatum to the line for 1. [BONUS: 6 team fouls] (Wendell Gasol: 1 personal fouls)   FT 1/1: GOOD Malcolm Tatum makes 1/1 from the line.
Score: 19-11

[05:26] Team_026 possession (Score: 19-11)
Immanuel Hyland attempts a 3Pt. Heavily contested by Nikola Rose (0.5 feet, MAN)! Immanuel Hyland misses. Rebound secured by Pascal Lillard.

[05:13] Team_098 possession (Score: 19-11)
Nikola Rose attempts a 3Pt. Contested by Wendell Gasol (5.5 feet, ZONE). Nikola Rose misses. Rebound secured by Immanuel Hyland.

[04:56] Team_026 possession (Score: 19-11)
Shaquille Trent makes the Layup and draws the foul on Pascal Lillard! And-1! Shaquille Trent to the line for 1. [BONUS: 5 team fouls] (Pascal Lillard: 2 personal fouls)   FT 1/1: GOOD Shaquille Trent makes 1/1 from the line.
Score: 19-14

[04:43] Team_098 possession (Score: 19-14)
Pascal Lillard attempts a Midrange. Wide open! Klay Giddey is 6.4 feet away. [ZONE] Pascal Lillard misses. Rebound secured by Immanuel Hyland.

[04:29] Team_026 possession (Score: 19-14)
Immanuel Hyland drives, Nikola Rose stays with him. Immanuel Hyland attempts a Dunk. Contested by Nikola Rose (2.9 feet, MAN). IMMANUEL HYLAND MAKES IT!
Score: 19-16

[04:15] Team_098 possession (Score: 19-16)
Pascal Lillard drives and kicks out. Blake Murray attempts a Midrange. Contested by Klay Giddey (5.2 feet, MAN). Blake Murray misses. Rebound secured by Shaquille Trent.

[04:00] Team_026 possession (Score: 19-16)
Kobe Booker attempts a Layup. Contested by Derrick Durant (4.6 feet, MAN). KOBE BOOKER MAKES IT! Assist: Immanuel Hyland
Score: 19-18

[03:49] Team_098 possession (Score: 19-18)
Pascal Lillard attempts a Midrange. Contested by Shaquille Trent (5.3 feet, MAN). Pascal Lillard misses. Rebound secured by Immanuel Hyland.

[03:39] Team_026 possession (Score: 19-18)
Kobe Booker makes the Dunk and draws the foul on Nikola Rose! And-1! Kobe Booker to the line for 1. [BONUS: 6 team fouls] (Nikola Rose: 3 personal fouls)   FT 1/1: GOOD Kobe Booker makes 1/1 from the line.
Score: 19-21

[03:28] Team_098 possession (Score: 19-21)
Derrick Durant attempts a Layup. Contested by Kobe Booker (2.4 feet, MAN). DERRICK DURANT MAKES IT! Assist: Malcolm Tatum
Score: 21-21

[03:17] Team_026 possession (Score: 21-21)
FOUL! Reach-in foul on Pascal Lillard during the drive. [IN THE BONUS! 7 team fouls] Shaquille Trent to the line for 2 free throws. (Pascal Lillard: 3 personal fouls)   FT 1/2: GOOD   FT 2/2: GOOD Shaquille Trent makes 2/2 from the line.
Score: 21-23

[02:59] Team_098 possession (Score: 21-23)
Blake Murray attempts a 3Pt. Contested by Immanuel Hyland (3.8 feet, ZONE). Blake Murray misses. Offensive rebound by Pascal Lillard! Pascal Lillard kicks it out.

[02:42] Team_098 possession (Score: 21-23)
Derrick Durant attempts a 3Pt. Wide open! Kobe Booker is 7.0 feet away. [MAN] Derrick Durant misses. Rebound secured by Kobe Booker.

[02:29] Team_026 possession (Score: 21-23)
FOUL! Offensive foul on Shaquille Trent! Pascal Lillard drew the charge! [Team fouls: 7] (Shaquille Trent: 3 personal fouls) TURNOVER! (dead ball)

[02:12] Team_098 possession (Score: 21-23)
Pascal Lillard drives and kicks out. Nikola Rose attempts a 3Pt. Wide open! Immanuel Hyland is 7.7 feet away. [ZONE] NIKOLA ROSE MAKES IT! Assist: Malcolm Tatum
Score: 24-23

[01:58] Team_026 possession (Score: 24-23)
Kobe Booker attempts a 3Pt. Heavily contested by Pascal Lillard (1.8 feet, ZONE)! Kobe Booker misses. Rebound secured by Nikola Rose.

[01:46] Team_098 possession (Score: 24-23)
FOUL! Shooting foul on Klay Giddey. Nikola Rose to the line for 2 free throws. [BONUS: 8 team fouls] (Klay Giddey: 2 personal fouls)   FT 1/2: MISS   FT 2/2: GOOD Nikola Rose makes 1/2 from the line.
Score: 25-23

[01:30] Team_026 possession (Score: 25-23)
Klay Giddey attempts a 3Pt. Contested by Blake Murray (3.8 feet, MAN). Klay Giddey misses. Rebound secured by Derrick Durant.

[01:12] Team_098 possession (Score: 25-23)
Pascal Lillard attempts a 3Pt. Wide open! Wendell Gasol is 9.0 feet away. [ZONE] Pascal Lillard misses. Offensive rebound by Pascal Lillard! Pascal Lillard kicks it out.

[00:57] Team_098 possession (Score: 25-23)
Malcolm Tatum drives, picks up Kobe Booker. Help arrives from Immanuel Hyland! Malcolm Tatum attempts a Layup. Contested by Immanuel Hyland (2.9 feet, ZONE). MALCOLM TATUM MAKES IT! Assist: Blake Murray
Score: 27-23

[00:40] Team_026 possession (Score: 27-23)
Immanuel Hyland attempts a Midrange. Wide open! Nikola Rose is 7.3 feet away. [MAN] IMMANUEL HYLAND MAKES IT! Assist: Wendell Gasol
Score: 27-25

[00:24] Team_098 possession (Score: 27-25)
Pascal Lillard attempts a Midrange. Contested by Shaquille Trent (5.9 feet, MAN). Pascal Lillard misses. Rebound secured by Immanuel Hyland.

[00:09] Team_026 possession (Score: 27-25)
Wendell Gasol drives and kicks out. Immanuel Hyland attempts a 3Pt. Contested by Nikola Rose (5.8 feet, MAN). Immanuel Hyland misses. Rebound secured by Pascal Lillard.

================================================================================
                              1ST QUARTER COMPLETE                              
================================================================================

1ST QUARTER SCORE: Team_098 27, Team_026 25

BOX SCORE:
================================================================================

Team_098
--------------------------------------------------------------------------------
Player                MIN  PTS  REB  AST  TO      FG   FG%      3P   3P%
--------------------------------------------------------------------------------
Malcolm Tatum          12   11    0    3   0   4/4   100.0     0/0   0.0
Nikola Rose            12    6    5    1   0   3/7    42.9     0/0   0.0
Blake Murray           12    6    0    2   0   3/4    75.0     0/0   0.0
Derrick Durant         12    3    1    0   0   2/3    66.7     0/0   0.0
Pascal Lillard         12    0    7    0   0   0/4     0.0     0/0   0.0

TEAM: FG: 12/22 (54.5%), 3PT: 2/6 (33.3%), REB: 13 (3 off, 10 def), AST: 6, TO: 1
TEAM FOULS: 7 [Team_026 in BONUS]


Team_026
--------------------------------------------------------------------------------
Player                MIN  PTS  REB  AST  TO      FG   FG%      3P   3P%
--------------------------------------------------------------------------------
Immanuel Hyland        12   10    4    1   0   4/5    80.0     0/0   0.0
Shaquille Trent        12    8    2    0   0   3/3   100.0     0/0   0.0
Kobe Booker            12    5    4    0   0   2/6    33.3     0/0   0.0
Klay Giddey            12    2    0    0   0   1/4    25.0     0/0   0.0
Wendell Gasol          12    0    0    3   0   0/2     0.0     0/0   0.0

TEAM: FG: 10/20 (50.0%), 3PT: 2/7 (28.6%), REB: 10 (0 off, 10 def), AST: 4, TO: 3
TEAM FOULS: 8 [Team_098 in BONUS]

================================================================================

================================================================================
                       2ND QUARTER - Team_098 vs Team_026                       
================================================================================

[12:00] Team_098 possession (Score: 27-25)
FOUL! Shooting foul on Kobe Booker. Nikola Rose to the line for 2 free throws. [Team fouls: 1] (Kobe Booker: 1 personal fouls)   FT 1/2: GOOD   FT 2/2: GOOD Nikola Rose makes 2/2 from the line.
Score: 29-25

[11:46] Team_026 possession (Score: 29-25)
Wendell Gasol attempts a Layup. Contested by Malcolm Tatum (3.9 feet, MAN). WENDELL GASOL MAKES IT!
Score: 29-27

[11:34] Team_098 possession (Score: 29-27)
Malcolm Tatum attempts a Layup. Contested by Wendell Gasol (3.6 feet, MAN). MALCOLM TATUM MAKES IT! Assist: Nikola Rose
Score: 31-27

[11:23] Team_026 possession (Score: 31-27)
Kobe Booker drives to the basket... Kobe Booker throws a bad pass out of bounds! TURNOVER! (dead ball)

[11:23] Substitution (Team_098): Malcolm Tatum OUT → Tracy Rose IN (stamina_rule2)

[11:23] Substitution (Team_098): Nikola Rose OUT → Dirk McCollum IN (stamina_rule2)

[11:23] Substitution (Team_098): Blake Murray OUT → Kristaps Iverson IN (stamina_rule2)

[11:23] Substitution (Team_098): Pascal Lillard OUT → Manu Jordan IN (stamina_rule2)

[11:23] Substitution (Team_098): Derrick Durant OUT → Russell McGrady IN (stamina_rule2)

[11:23] Substitution (Team_026): Wendell Gasol OUT → Myles Tatum IN (stamina_rule2)

[11:23] Substitution (Team_026): Immanuel Hyland OUT → Karl Barrett IN (stamina_rule2)

[11:23] Substitution (Team_026): Klay Giddey OUT → Josh Simons IN (stamina_rule2)

[11:23] Substitution (Team_026): Shaquille Trent OUT → Damian Doncic IN (stamina_rule2)

[11:23] Substitution (Team_026): Kobe Booker OUT → Dirk Randle IN (stamina_rule2)

[11:09] Team_098 possession (Score: 31-27)
Kristaps Iverson attempts a Midrange. Heavily contested by Karl Barrett (1.8 feet, ZONE)! Kristaps Iverson misses. Rebound secured by Damian Doncic.

[10:56] Team_026 possession (Score: 31-27)
Damian Doncic drives to the basket... Damian Doncic commits a violation (traveling/carry)! TURNOVER! (dead ball)

[10:42] Team_098 possession (Score: 31-27)
Tracy Rose attempts a Midrange. Wide open! Dirk Randle is 6.5 feet away. [ZONE] TRACY ROSE MAKES IT! Assist: Kristaps Iverson
Score: 33-27

[10:30] Team_026 possession (Score: 33-27)
Dirk Randle makes the Layup and draws the foul on Russell McGrady! And-1! Dirk Randle to the line for 1. [Team fouls: 1] (Russell McGrady: 1 personal fouls)   FT 1/1: MISS Dirk Randle makes 0/1 from the line. FOUL! Loose ball foul on Kristaps Iverson during the free throw rebound! [Team fouls: 2] No free throws, side out. (Kristaps Iverson: 1 personal fouls)
Score: 33-29

[10:19] Team_026 possession (Score: 33-29)
Karl Barrett attempts a Layup. BLOCKED BY DIRK MCCOLLUM! Ball is loose! Rebound secured by Kristaps Iverson.

[10:06] Team_098 possession (Score: 33-29)
Tracy Rose attempts a 3Pt. Contested by Karl Barrett (5.6 feet, ZONE). Tracy Rose misses. Offensive rebound by Kristaps Iverson! Kristaps Iverson kicks it out.

[09:49] Team_098 possession (Score: 33-29)
FOUL! Holding foul on Josh Simons. [Team fouls: 2] No free throws, side out. (Josh Simons: 1 personal fouls)

[09:33] Team_098 possession (Score: 33-29)
Russell McGrady drives, Dirk Randle stays with him. Russell McGrady attempts a Dunk. Contested by Dirk Randle (2.9 feet, MAN). RUSSELL MCGRADY MAKES IT! Assist: Kristaps Iverson
Score: 35-29

[09:21] Team_026 possession (Score: 35-29)
Josh Simons drives to the basket... Josh Simons throws a bad pass out of bounds! TURNOVER! (dead ball)

[09:05] Team_098 possession (Score: 35-29)
Russell McGrady attempts a 3Pt. Contested by Dirk Randle (5.4 feet, MAN). Russell McGrady misses. Rebound secured by Damian Doncic.

[08:52] Team_026 possession (Score: 35-29)
Damian Doncic attempts a 3Pt. Contested by Manu Jordan (4.4 feet, MAN). Damian Doncic misses. Rebound secured by Kristaps Iverson.

[08:36] Team_098 possession (Score: 35-29)
Dirk McCollum attempts a 3Pt. Contested by Karl Barrett (3.1 feet, MAN). Dirk McCollum misses. Rebound secured by Josh Simons.

[08:23] Team_026 possession (Score: 35-29)
Josh Simons attempts a Midrange. Contested by Dirk McCollum (4.2 feet, ZONE). JOSH SIMONS MAKES IT!
Score: 35-31

[08:11] Team_098 possession (Score: 35-31)
Kristaps Iverson attempts a 3Pt. Contested by Karl Barrett (3.2 feet, ZONE). Kristaps Iverson misses. Rebound secured by Josh Simons.

[07:55] Team_026 possession (Score: 35-31)
Dirk Randle drives and kicks out. Josh Simons attempts a Midrange. Heavily contested by Kristaps Iverson (2.0 feet, MAN)! Josh Simons misses. Offensive rebound by Josh Simons! Josh Simons kicks it out.

[07:38] Team_026 possession (Score: 35-31)
Dirk Randle attempts a Midrange. Contested by Russell McGrady (3.0 feet, MAN). Dirk Randle misses. Offensive rebound by Damian Doncic! Damian Doncic kicks it out.

[07:26] Team_026 possession (Score: 35-31)
Karl Barrett throws a bad pass out of bounds! TURNOVER! (dead ball)

[07:12] Team_098 possession (Score: 35-31)
Tracy Rose attempts a Layup. Contested by Myles Tatum (3.4 feet, MAN). Tracy Rose misses. Offensive rebound by Russell McGrady! Russell McGrady puts it back in!
Score: 37-31

[07:00] Team_026 possession (Score: 37-31)
Myles Tatum attempts a 3Pt. Wide open! Tracy Rose is 7.4 feet away. [MAN] Myles Tatum misses. Rebound secured by Russell McGrady.

[06:48] Team_098 possession (Score: 37-31)
Kristaps Iverson attempts a Midrange. Wide open! Josh Simons is 10.0 feet away. [MAN] KRISTAPS IVERSON MAKES IT! Assist: Tracy Rose
Score: 39-31

[06:29] Team_026 possession (Score: 39-31)
Josh Simons attempts a 3Pt. Contested by Kristaps Iverson (3.7 feet, MAN). Josh Simons misses. Offensive rebound by Damian Doncic! Damian Doncic kicks it out.

[06:14] Team_026 possession (Score: 39-31)
Josh Simons makes the Dunk and draws the foul on Kristaps Iverson! And-1! Josh Simons to the line for 1. [Team fouls: 3] (Kristaps Iverson: 2 personal fouls)   FT 1/1: GOOD Josh Simons makes 1/1 from the line.
Score: 39-34

[06:00] Team_098 possession (Score: 39-34)
Kristaps Iverson attempts a 3Pt. Wide open! Karl Barrett is 7.2 feet away. [ZONE] Kristaps Iverson misses. Rebound secured by Karl Barrett.

[05:45] Team_026 possession (Score: 39-34)
Dirk Randle drives to the basket... Dirk Randle loses the ball! Stripped by Russell McGrady! TURNOVER! (live ball)

[05:31] Team_098 possession (Score: 39-34)
Russell McGrady attempts a Midrange. Contested by Karl Barrett (4.3 feet, ZONE). Russell McGrady misses. Rebound secured by Damian Doncic.

[05:16] Team_026 possession (Score: 39-34)
Dirk Randle attempts a Midrange. Contested by Russell McGrady (4.5 feet, MAN). DIRK RANDLE MAKES IT! Assist: Karl Barrett
Score: 39-36

[05:03] Team_098 possession (Score: 39-36)
Dirk McCollum attempts a 3Pt. Contested by Karl Barrett (5.4 feet, MAN). Dirk McCollum misses. Rebound secured by Damian Doncic.

[04:46] Team_026 possession (Score: 39-36)
Karl Barrett attempts a 3Pt. Heavily contested by Dirk McCollum (1.9 feet, ZONE)! KARL BARRETT MAKES IT! Assist: Josh Simons
Score: 39-39

[04:32] Team_098 possession (Score: 39-39)
Kristaps Iverson drives, Josh Simons stays with him. Kristaps Iverson attempts a Dunk. Contested by Josh Simons (4.8 feet, MAN). KRISTAPS IVERSON MAKES IT! Assist: Manu Jordan
Score: 41-39

[04:13] Team_026 possession (Score: 41-39)
Dirk Randle attempts a Midrange. Contested by Kristaps Iverson (5.7 feet, ZONE). Dirk Randle misses. Offensive rebound by Josh Simons! Josh Simons kicks it out.

[04:01] Team_026 possession (Score: 41-39)
Josh Simons attempts a Midrange. Heavily contested by Kristaps Iverson (1.9 feet, ZONE)! Josh Simons misses. Rebound secured by Russell McGrady.

[03:49] Team_098 possession (Score: 41-39)
Kristaps Iverson attempts a Midrange. Contested by Dirk Randle (5.0 feet, ZONE). KRISTAPS IVERSON MAKES IT!
Score: 43-39

[03:38] Team_026 possession (Score: 43-39)
Karl Barrett drives and kicks out. Damian Doncic attempts a Midrange. Wide open! Kristaps Iverson is 6.2 feet away. [ZONE] DAMIAN DONCIC MAKES IT! Assist: Karl Barrett
Score: 43-41

[03:25] Team_098 possession (Score: 43-41)
Tracy Rose attempts a Midrange. Contested by Karl Barrett (3.2 feet, ZONE). TRACY ROSE MAKES IT! Assist: Manu Jordan
Score: 45-41

[03:11] Team_026 possession (Score: 45-41)
Myles Tatum drives and kicks out. Myles Tatum attempts a 3Pt. Contested by Dirk McCollum (2.7 feet, ZONE). Myles Tatum misses. Rebound secured by Russell McGrady.

[02:57] Team_098 possession (Score: 45-41)
Tracy Rose drives, picks up Myles Tatum. Help arrives from Josh Simons! Tracy Rose attempts a Dunk. Contested by Josh Simons (2.6 feet, MAN). Tracy Rose misses. Rebound secured by Karl Barrett.

[02:45] Team_026 possession (Score: 45-41)
Karl Barrett attempts a 3Pt. Heavily contested by Dirk McCollum (1.8 feet, MAN)! KARL BARRETT MAKES IT! Assist: Myles Tatum
Score: 45-44

[02:30] Team_098 possession (Score: 45-44)
Dirk McCollum drives and kicks out. Tracy Rose attempts a 3Pt. Wide open! Myles Tatum is 7.4 feet away. [MAN] Tracy Rose misses. Rebound secured by Karl Barrett.

[02:13] Team_026 possession (Score: 45-44)
Damian Doncic attempts a 3Pt. Contested by Dirk McCollum (3.2 feet, ZONE). Damian Doncic misses. Rebound secured by Manu Jordan.

[01:57] Team_098 possession (Score: 45-44)
Tracy Rose attempts a 3Pt. Contested by Myles Tatum (4.8 feet, MAN). Tracy Rose misses. Rebound secured by Josh Simons.

[01:41] Team_026 possession (Score: 45-44)
Josh Simons attempts a 3Pt. Contested by Dirk McCollum (4.3 feet, ZONE). Josh Simons misses. Rebound secured by Kristaps Iverson.

[01:25] Team_098 possession (Score: 45-44)
Kristaps Iverson drives and kicks out. Kristaps Iverson attempts a 3Pt. Contested by Josh Simons (2.5 feet, MAN). Kristaps Iverson misses. Rebound secured by Josh Simons.

[01:13] Team_026 possession (Score: 45-44)
Myles Tatum attempts a 3Pt. Contested by Dirk McCollum (4.5 feet, ZONE). Myles Tatum misses. Rebound secured by Russell McGrady.

[00:56] Team_098 possession (Score: 45-44)
Dirk McCollum attempts a Midrange. Contested by Karl Barrett (5.4 feet, ZONE). Dirk McCollum misses. Rebound secured by Josh Simons.

[00:40] Team_026 possession (Score: 45-44)
Myles Tatum throws a bad pass out of bounds! TURNOVER! (dead ball)

[00:27] Team_098 possession (Score: 45-44)
Tracy Rose attempts a 3Pt. Wide open! Karl Barrett is 6.5 feet away. [ZONE] Tracy Rose misses. Rebound secured by Damian Doncic.

[00:12] Team_026 possession (Score: 45-44)
Myles Tatum attempts a 3Pt. Contested by Dirk McCollum (4.0 feet, ZONE). MYLES TATUM MAKES IT! Assist: Dirk Randle
Score: 45-47

================================================================================
                              2ND QUARTER COMPLETE                              
================================================================================

2ND QUARTER SCORE: Team_098 18, Team_026 22

BOX SCORE:
================================================================================

Team_098
--------------------------------------------------------------------------------
Player                MIN  PTS  REB  AST  TO      FG   FG%      3P   3P%
--------------------------------------------------------------------------------
Kristaps Iverson       11    6    4    2   0   3/7    42.9     0/0   0.0
Tracy Rose             11    4    0    1   0   2/5    40.0     0/0   0.0
Russell McGrady        11    4    5    0   0   2/4    50.0     0/0   0.0
Nikola Rose            13    2    0    1   0   1/1   100.0     0/0   0.0
Malcolm Tatum          13    2    0    0   0   1/1   100.0     0/0   0.0
Dirk McCollum          11    0    0    0   0   0/4     0.0     0/0   0.0
Manu Jordan            11    0    1    2   0   0/0     0.0     0/0   0.0

TEAM: FG: 9/22 (40.9%), 3PT: 0/7 (0.0%), REB: 10 (2 off, 8 def), AST: 6, TO: 0
TEAM FOULS: 3


Team_026
--------------------------------------------------------------------------------
Player                MIN  PTS  REB  AST  TO      FG   FG%      3P   3P%
--------------------------------------------------------------------------------
Karl Barrett           11    6    3    2   0   2/3    66.7     0/0   0.0
Josh Simons            11    5    8    1   0   2/4    50.0     0/0   0.0
Myles Tatum            11    3    0    1   0   1/4    25.0     0/0   0.0
Wendell Gasol          13    2    0    0   0   1/1   100.0     0/0   0.0
Damian Doncic          11    2    7    0   0   1/3    33.3     0/0   0.0
Dirk Randle            11    2    0    1   0   1/1   100.0     0/0   0.0

TEAM: FG: 8/16 (50.0%), 3PT: 3/8 (37.5%), REB: 18 (5 off, 13 def), AST: 5, TO: 6
TEAM FOULS: 2

================================================================================

================================================================================
                       3RD QUARTER - Team_098 vs Team_026                       
================================================================================

[12:00] Team_098 possession (Score: 45-47)
Blake Murray attempts a 3Pt. Contested by Immanuel Hyland (3.1 feet, ZONE). BLAKE MURRAY MAKES IT! Assist: Malcolm Tatum
Score: 48-47

[11:47] Team_026 possession (Score: 48-47)
Kobe Booker drives and kicks out. Immanuel Hyland attempts a 3Pt. Heavily contested by Nikola Rose (0.5 feet, MAN)! IMMANUEL HYLAND MAKES IT! Assist: Klay Giddey
Score: 48-50

[11:34] Team_098 possession (Score: 48-50)
FOUL! Shooting foul on Immanuel Hyland. Malcolm Tatum to the line for 2 free throws. [Team fouls: 1] (Immanuel Hyland: 1 personal fouls)   FT 1/2: GOOD   FT 2/2: GOOD Malcolm Tatum makes 2/2 from the line.
Score: 50-50

[11:20] Team_026 possession (Score: 50-50)
Klay Giddey throws a bad pass! Stolen by Blake Murray! TURNOVER! (live ball)

[11:02] Team_098 possession (Score: 50-50)
Malcolm Tatum attempts a 3Pt. Contested by Wendell Gasol (5.0 feet, ZONE). Malcolm Tatum misses. Rebound secured by Shaquille Trent.

[10:50] Team_026 possession (Score: 50-50)
Immanuel Hyland attempts a 3Pt. Contested by Nikola Rose (3.1 feet, MAN). IMMANUEL HYLAND MAKES IT! Assist: Kobe Booker
Score: 50-53

[10:35] Team_098 possession (Score: 50-53)
Blake Murray drives and kicks out. Pascal Lillard attempts a Midrange. Wide open! Shaquille Trent is 6.5 feet away. [MAN] PASCAL LILLARD MAKES IT!
Score: 52-53

[10:19] Team_026 possession (Score: 52-53)
FOUL! Holding foul on Pascal Lillard. [Team fouls: 1] No free throws, side out. (Pascal Lillard: 1 personal fouls)

[10:09] Team_026 possession (Score: 52-53)
Klay Giddey attempts a 3Pt. Contested by Blake Murray (4.4 feet, MAN). Klay Giddey misses. Rebound secured by Pascal Lillard.

[09:56] Team_098 possession (Score: 52-53)
Pascal Lillard makes the Midrange and draws the foul on Shaquille Trent! And-1! Pascal Lillard to the line for 1. [Team fouls: 2] (Shaquille Trent: 1 personal fouls)   FT 1/1: MISS Pascal Lillard makes 0/1 from the line. Offensive rebound by Derrick Durant! Derrick Durant's putback is no good.
Score: 54-53

[09:42] Team_026 possession (Score: 54-53)
FOUL! Offensive foul on Klay Giddey! Blake Murray drew the charge! [Team fouls: 3] (Klay Giddey: 1 personal fouls) TURNOVER! (dead ball)

[09:27] Team_098 possession (Score: 54-53)
FOUL! Offensive foul on Malcolm Tatum! Wendell Gasol drew the charge! [Team fouls: 2] (Malcolm Tatum: 1 personal fouls) TURNOVER! (dead ball)

[09:10] Team_026 possession (Score: 54-53)
Kobe Booker throws a bad pass! Stolen by Derrick Durant! TURNOVER! (live ball)

[08:53] Team_098 possession (Score: 54-53)
Derrick Durant attempts a Layup. Heavily contested by Kobe Booker (1.5 feet, MAN)! DERRICK DURANT MAKES IT! Assist: Pascal Lillard
Score: 56-53

[08:36] Team_026 possession (Score: 56-53)
Wendell Gasol attempts a Midrange. Contested by Malcolm Tatum (4.6 feet, MAN). WENDELL GASOL MAKES IT!
Score: 56-55

[08:22] Team_098 possession (Score: 56-55)
Malcolm Tatum drives and kicks out. Pascal Lillard attempts a 3Pt. Wide open! Shaquille Trent is 6.6 feet away. [MAN] Pascal Lillard misses. Rebound secured by Kobe Booker.

[08:13] Team_026 possession (Score: 56-55)
Klay Giddey attempts a Midrange. Contested by Blake Murray (3.7 feet, MAN). KLAY GIDDEY MAKES IT!
Score: 56-57

[08:02] Team_098 possession (Score: 56-57)
Nikola Rose attempts a Midrange. Contested by Immanuel Hyland (5.9 feet, MAN). NIKOLA ROSE MAKES IT! Assist: Pascal Lillard
Score: 58-57

[07:49] Team_026 possession (Score: 58-57)
Wendell Gasol attempts a Midrange. Contested by Nikola Rose (5.4 feet, ZONE). Wendell Gasol misses. Rebound secured by Derrick Durant.

[07:32] Team_098 possession (Score: 58-57)
Pascal Lillard attempts a 3Pt. Wide open! Wendell Gasol is 6.8 feet away. [ZONE] Pascal Lillard misses. Rebound secured by Kobe Booker.

[07:18] Team_026 possession (Score: 58-57)
FOUL! Holding foul on Pascal Lillard. [Team fouls: 3] No free throws, side out. (Pascal Lillard: 2 personal fouls)

[07:04] Team_026 possession (Score: 58-57)
FOUL! Holding foul on Malcolm Tatum. [Team fouls: 4] No free throws, side out. (Malcolm Tatum: 2 personal fouls)

[06:46] Team_026 possession (Score: 58-57)
FOUL! Reach-in foul on Pascal Lillard during the drive. [IN THE BONUS! 5 team fouls] Wendell Gasol to the line for 2 free throws. (Pascal Lillard: 3 personal fouls)   FT 1/2: MISS   FT 2/2: GOOD Wendell Gasol makes 1/2 from the line.
Score: 58-58

[06:31] Team_098 possession (Score: 58-58)
Pascal Lillard attempts a 3Pt. Contested by Shaquille Trent (4.7 feet, MAN). Pascal Lillard misses. Rebound secured by Kobe Booker.

[06:19] Team_026 possession (Score: 58-58)
Wendell Gasol attempts a 3Pt. Contested by Malcolm Tatum (3.9 feet, MAN). WENDELL GASOL MAKES IT! Assist: Shaquille Trent
Score: 58-61

[06:01] Team_098 possession (Score: 58-61)
Malcolm Tatum drives, Kobe Booker stays with him. Malcolm Tatum attempts a Layup. Contested by Kobe Booker (4.0 feet, ZONE). MALCOLM TATUM MAKES IT! Assist: Pascal Lillard
Score: 60-61

[05:49] Team_026 possession (Score: 60-61)
Immanuel Hyland attempts a Midrange. Heavily contested by Nikola Rose (1.6 feet, MAN)! IMMANUEL HYLAND MAKES IT! Assist: Wendell Gasol
Score: 60-63

[05:32] Team_098 possession (Score: 60-63)
Nikola Rose attempts a 3Pt. Contested by Immanuel Hyland (4.1 feet, ZONE). NIKOLA ROSE MAKES IT! Assist: Pascal Lillard
Score: 63-63

[05:17] Team_026 possession (Score: 63-63)
Immanuel Hyland attempts a Midrange. Contested by Pascal Lillard (2.8 feet, ZONE). Immanuel Hyland misses. Rebound secured by Nikola Rose.

[05:04] Team_098 possession (Score: 63-63)
Pascal Lillard throws a bad pass out of bounds! TURNOVER! (dead ball)

[04:46] Team_026 possession (Score: 63-63)
FOUL! Reach-in foul on Pascal Lillard during the drive. [IN THE BONUS! 6 team fouls] Klay Giddey to the line for 2 free throws. (Pascal Lillard: 4 personal fouls)   FT 1/2: GOOD   FT 2/2: GOOD Klay Giddey makes 2/2 from the line.
Score: 63-65

[04:36] Team_098 possession (Score: 63-65)
Nikola Rose attempts a Midrange. Contested by Shaquille Trent (6.0 feet, ZONE). Nikola Rose misses. Rebound secured by Immanuel Hyland.

[04:19] Team_026 possession (Score: 63-65)
FOUL! Reach-in foul on Derrick Durant during the drive. [IN THE BONUS! 7 team fouls] Kobe Booker to the line for 2 free throws. (Derrick Durant: 1 personal fouls)   FT 1/2: GOOD   FT 2/2: GOOD Kobe Booker makes 2/2 from the line.
Score: 63-67

[04:07] Team_098 possession (Score: 63-67)
Nikola Rose attempts a 3Pt. Contested by Immanuel Hyland (3.5 feet, ZONE). NIKOLA ROSE MAKES IT! Assist: Malcolm Tatum
Score: 66-67

[03:53] Team_026 possession (Score: 66-67)
Kobe Booker drives, Pascal Lillard stays with him. Kobe Booker attempts a Dunk. Heavily contested by Pascal Lillard (1.3 feet, ZONE)! KOBE BOOKER MAKES IT!
Score: 66-69

[03:39] Team_098 possession (Score: 66-69)
Blake Murray attempts a 3Pt. Wide open! Klay Giddey is 8.7 feet away. [MAN] BLAKE MURRAY MAKES IT! Assist: Pascal Lillard
Score: 69-69

[03:24] Team_026 possession (Score: 69-69)
Shaquille Trent attempts a Midrange. Contested by Pascal Lillard (4.1 feet, ZONE). Shaquille Trent misses. Rebound secured by Pascal Lillard.

[03:06] Team_098 possession (Score: 69-69)
Blake Murray drives, Klay Giddey stays with him. Blake Murray attempts a Dunk. Heavily contested by Klay Giddey (1.3 feet, MAN)! BLAKE MURRAY MAKES IT!
Score: 71-69

[02:51] Team_026 possession (Score: 71-69)
Kobe Booker drives and kicks out. Wendell Gasol attempts a 3Pt. Wide open! Malcolm Tatum is 6.2 feet away. [MAN] WENDELL GASOL MAKES IT!
Score: 71-72

[02:34] Team_098 possession (Score: 71-72)
Blake Murray attempts a Midrange. Wide open! Klay Giddey is 7.4 feet away. [MAN] BLAKE MURRAY MAKES IT!
Score: 73-72

[02:16] Team_026 possession (Score: 73-72)
Kobe Booker attempts a Layup. BLOCKED BY DERRICK DURANT! Ball is loose! Rebound secured by Derrick Durant.

[02:02] Team_098 possession (Score: 73-72)
Derrick Durant drives, Kobe Booker stays with him. Derrick Durant attempts a Layup. Wide open! Kobe Booker is 6.3 feet away. [ZONE] DERRICK DURANT MAKES IT!
Score: 75-72

[01:51] Team_026 possession (Score: 75-72)
Wendell Gasol attempts a 3Pt. Contested by Nikola Rose (4.3 feet, ZONE). Wendell Gasol misses. Rebound secured by Pascal Lillard.

[01:36] Team_098 possession (Score: 75-72)
Malcolm Tatum attempts a 3Pt. Wide open! Wendell Gasol is 7.6 feet away. [MAN] Malcolm Tatum misses. Rebound secured by Shaquille Trent.

[01:21] Team_026 possession (Score: 75-72)
Immanuel Hyland loses the ball! Stripped by Nikola Rose! TURNOVER! (live ball)

[01:07] Team_098 possession (Score: 75-72)
Blake Murray drives, Klay Giddey stays with him. Blake Murray attempts a Layup. Contested by Klay Giddey (4.0 feet, MAN). Blake Murray misses. FOUL! Loose ball foul on Kobe Booker during the rebound battle. [Team fouls: 4] No free throws, side out. (Kobe Booker: 1 personal fouls)

[00:53] Team_098 possession (Score: 75-72)
Malcolm Tatum drives, Wendell Gasol stays with him. Malcolm Tatum attempts a Dunk. Wide open! Wendell Gasol is 7.3 feet away. [MAN] MALCOLM TATUM MAKES IT!
Score: 77-72

[00:37] Team_026 possession (Score: 77-72)
Wendell Gasol drives, Malcolm Tatum stays with him. Wendell Gasol attempts a Dunk. Contested by Malcolm Tatum (5.0 feet, MAN). Wendell Gasol misses. Rebound secured by Pascal Lillard.

[00:21] Team_098 possession (Score: 77-72)
Derrick Durant attempts a Midrange. Contested by Kobe Booker (5.9 feet, MAN). Derrick Durant misses. Rebound secured by Shaquille Trent.

[00:07] Team_026 possession (Score: 77-72)
Shaquille Trent attempts a Midrange. Wide open! Blake Murray is 7.8 feet away. [ZONE] SHAQUILLE TRENT MAKES IT!
Score: 77-74

================================================================================
                              3RD QUARTER COMPLETE                              
================================================================================

3RD QUARTER SCORE: Team_098 32, Team_026 27

BOX SCORE:
================================================================================

Team_098
--------------------------------------------------------------------------------
Player                MIN  PTS  REB  AST  TO      FG   FG%      3P   3P%
--------------------------------------------------------------------------------
Blake Murray           25   10    0    0   0   4/4   100.0     0/0   0.0
Nikola Rose            25    8    1    0   0   3/4    75.0     0/0   0.0
Malcolm Tatum          25    6    0    2   0   3/6    50.0     0/0   0.0
Derrick Durant         25    4    3    0   0   2/3    66.7     0/0   0.0
Pascal Lillard         25    2    5    5   0   1/4    25.0     0/0   0.0

TEAM: FG: 13/21 (61.9%), 3PT: 4/8 (50.0%), REB: 8 (1 off, 7 def), AST: 7, TO: 2
TEAM FOULS: 7 [Team_026 in BONUS]


Team_026
--------------------------------------------------------------------------------
Player                MIN  PTS  REB  AST  TO      FG   FG%      3P   3P%
--------------------------------------------------------------------------------
Wendell Gasol          25    9    0    1   0   4/7    57.1     0/0   0.0
Immanuel Hyland        25    8    1    0   0   3/4    75.0     0/0   0.0
Klay Giddey            25    4    0    1   0   2/3    66.7     0/0   0.0
Kobe Booker            25    4    3    1   0   2/3    66.7     0/0   0.0
Shaquille Trent        25    2    3    1   0   1/2    50.0     0/0   0.0

TEAM: FG: 12/19 (63.2%), 3PT: 2/4 (50.0%), REB: 8 (0 off, 8 def), AST: 4, TO: 4
TEAM FOULS: 4

================================================================================

================================================================================
                       4TH QUARTER - Team_098 vs Team_026                       
================================================================================

[12:00] Team_098 possession (Score: 77-74)
Malcolm Tatum attempts a 3Pt. Wide open! Shaquille Trent is 6.6 feet away. [ZONE] MALCOLM TATUM MAKES IT! Assist: Pascal Lillard
Score: 80-74

[11:45] Team_026 possession (Score: 80-74)
Klay Giddey attempts a 3Pt. Contested by Blake Murray (4.8 feet, MAN). Klay Giddey misses. Rebound secured by Pascal Lillard.

[11:33] Team_098 possession (Score: 80-74)
Blake Murray throws a bad pass! Stolen by Klay Giddey! TURNOVER! (live ball)

[11:21] Team_026 possession (Score: 80-74)
Immanuel Hyland attempts a 3Pt. Contested by Nikola Rose (4.4 feet, ZONE). IMMANUEL HYLAND MAKES IT! Assist: Wendell Gasol
Score: 80-77

[11:04] Team_098 possession (Score: 80-77)
Malcolm Tatum attempts a Layup. Contested by Wendell Gasol (5.1 feet, MAN). MALCOLM TATUM MAKES IT!
Score: 82-77

[10:50] Team_026 possession (Score: 82-77)
Shaquille Trent makes the Layup and draws the foul on Pascal Lillard! And-1! Shaquille Trent to the line for 1. [Team fouls: 1] (Pascal Lillard: 1 personal fouls)   FT 1/1: GOOD Shaquille Trent makes 1/1 from the line.
Score: 82-80

[10:32] Team_098 possession (Score: 82-80)
Pascal Lillard attempts a 3Pt. Contested by Immanuel Hyland (5.2 feet, ZONE). Pascal Lillard misses. FOUL! Loose ball foul on Shaquille Trent during the rebound battle. [Team fouls: 1] No free throws, side out. (Shaquille Trent: 1 personal fouls)

[10:14] Team_098 possession (Score: 82-80)
Pascal Lillard attempts a 3Pt. Contested by Immanuel Hyland (3.5 feet, ZONE). Pascal Lillard misses. Rebound secured by Kobe Booker.

[10:00] Team_026 possession (Score: 82-80)
FOUL! Offensive foul on Shaquille Trent! Pascal Lillard drew the charge! [Team fouls: 2] (Shaquille Trent: 2 personal fouls) TURNOVER! (dead ball)

[09:47] Team_098 possession (Score: 82-80)
FOUL! Shooting foul on Wendell Gasol. Malcolm Tatum to the line for 2 free throws. [Team fouls: 3] (Wendell Gasol: 1 personal fouls)   FT 1/2: MISS   FT 2/2: GOOD Malcolm Tatum makes 1/2 from the line.
Score: 83-80

[09:34] Team_026 possession (Score: 83-80)
Klay Giddey attempts a 3Pt. Wide open! Nikola Rose is 9.9 feet away. [ZONE] KLAY GIDDEY MAKES IT!
Score: 83-83

[09:22] Team_098 possession (Score: 83-83)
Blake Murray makes the Dunk and draws the foul on Klay Giddey! And-1! Blake Murray to the line for 1. [Team fouls: 4] (Klay Giddey: 1 personal fouls)   FT 1/1: GOOD Blake Murray makes 1/1 from the line.
Score: 86-83

[09:05] Team_026 possession (Score: 86-83)
Immanuel Hyland attempts a 3Pt. Contested by Nikola Rose (4.9 feet, MAN). IMMANUEL HYLAND MAKES IT! Assist: Wendell Gasol
Score: 86-86

[08:51] Team_098 possession (Score: 86-86)
FOUL! Shooting foul on Immanuel Hyland. Malcolm Tatum to the line for 2 free throws. [BONUS: 5 team fouls] (Immanuel Hyland: 1 personal fouls)   FT 1/2: GOOD   FT 2/2: MISS Malcolm Tatum makes 1/2 from the line. Rebound secured by Kobe Booker.
Score: 87-86

[08:41] Team_026 possession (Score: 87-86)
Klay Giddey attempts a Midrange. Contested by Blake Murray (3.9 feet, ZONE). KLAY GIDDEY MAKES IT!
Score: 87-88

[08:27] Team_098 possession (Score: 87-88)
Malcolm Tatum attempts a Layup. Contested by Kobe Booker (4.6 feet, ZONE). Malcolm Tatum misses. Rebound secured by Shaquille Trent.

[08:16] Team_026 possession (Score: 87-88)
Shaquille Trent attempts a Midrange. Contested by Blake Murray (2.9 feet, ZONE). SHAQUILLE TRENT MAKES IT! Assist: Immanuel Hyland
Score: 87-90

[08:00] Team_098 possession (Score: 87-90)
Nikola Rose attempts a 3Pt. Contested by Immanuel Hyland (4.8 feet, ZONE). NIKOLA ROSE MAKES IT! Assist: Malcolm Tatum
Score: 90-90

[07:45] Team_026 possession (Score: 90-90)
Wendell Gasol attempts a 3Pt. Wide open! Malcolm Tatum is 8.3 feet away. [MAN] WENDELL GASOL MAKES IT! Assist: Klay Giddey
Score: 90-93

[07:34] Team_098 possession (Score: 90-93)
Pascal Lillard drives, Shaquille Trent stays with him. Pascal Lillard attempts a Layup. Wide open! Shaquille Trent is 6.4 feet away. [MAN] PASCAL LILLARD MAKES IT!
Score: 92-93

[07:22] Team_026 possession (Score: 92-93)
Wendell Gasol attempts a 3Pt. Contested by Malcolm Tatum (5.7 feet, MAN). Wendell Gasol misses. Rebound secured by Pascal Lillard.

[07:07] Team_098 possession (Score: 92-93)
Malcolm Tatum drives, Kobe Booker stays with him. Malcolm Tatum attempts a Dunk. Wide open! Kobe Booker is 9.2 feet away. [ZONE] MALCOLM TATUM MAKES IT!
Score: 94-93

[06:49] Team_026 possession (Score: 94-93)
Shaquille Trent drives and kicks out. Klay Giddey attempts a Midrange. Contested by Pascal Lillard (2.4 feet, ZONE). Klay Giddey misses. Offensive rebound by Shaquille Trent! Shaquille Trent kicks it out.

[06:32] Team_026 possession (Score: 94-93)
Shaquille Trent drives and kicks out. Kobe Booker attempts a 3Pt. Contested by Derrick Durant (5.3 feet, MAN). KOBE BOOKER MAKES IT! Assist: Shaquille Trent
Score: 94-96

[06:18] Team_098 possession (Score: 94-96)
Blake Murray drives and kicks out. Derrick Durant attempts a 3Pt. Wide open! Kobe Booker is 7.1 feet away. [MAN] Derrick Durant misses. Rebound secured by Kobe Booker.

[06:04] Team_026 possession (Score: 94-96)
Shaquille Trent attempts a 3Pt. Contested by Nikola Rose (3.2 feet, ZONE). SHAQUILLE TRENT MAKES IT! Assist: Kobe Booker
Score: 94-99

[05:48] Team_098 possession (Score: 94-99)
Malcolm Tatum attempts a Midrange. Contested by Wendell Gasol (5.0 feet, MAN). Malcolm Tatum misses. Offensive rebound by Derrick Durant! Derrick Durant kicks it out.

[05:37] Team_098 possession (Score: 94-99)
Blake Murray attempts a 3Pt. Wide open! Klay Giddey is 7.5 feet away. [ZONE] Blake Murray misses. Rebound secured by Shaquille Trent.

[05:22] Team_026 possession (Score: 94-99)
Wendell Gasol attempts a Midrange. Contested by Malcolm Tatum (2.2 feet, MAN). WENDELL GASOL MAKES IT!
Score: 94-101

[05:05] Team_098 possession (Score: 94-101)
Derrick Durant makes the Layup and draws the foul on Kobe Booker! And-1! Derrick Durant to the line for 1. [BONUS: 6 team fouls] (Kobe Booker: 1 personal fouls)   FT 1/1: GOOD Derrick Durant makes 1/1 from the line.
Score: 97-101

[04:53] Team_026 possession (Score: 97-101)
Shaquille Trent attempts a Midrange. Contested by Pascal Lillard (2.4 feet, MAN). Shaquille Trent misses. Rebound secured by Nikola Rose.

[04:44] Team_098 possession (Score: 97-101)
Derrick Durant attempts a Midrange. Wide open! Kobe Booker is 6.5 feet away. [MAN] DERRICK DURANT MAKES IT! Assist: Pascal Lillard
Score: 99-101

[04:33] Team_026 possession (Score: 99-101)
Shaquille Trent loses the ball! Stripped by Pascal Lillard! TURNOVER! (live ball)

[04:17] Team_098 possession (Score: 99-101)
FOUL! Reach-in foul on Kobe Booker during the drive. [IN THE BONUS! 7 team fouls] Pascal Lillard to the line for 2 free throws. (Kobe Booker: 2 personal fouls)   FT 1/2: GOOD   FT 2/2: GOOD Pascal Lillard makes 2/2 from the line.
Score: 101-101

[04:04] Team_026 possession (Score: 101-101)
Wendell Gasol loses control! Ball rolls out of bounds! TURNOVER! (dead ball)

[04:04] Substitution (Team_098): Malcolm Tatum OUT → Tracy Rose IN (stamina_rule2)

[04:04] Substitution (Team_098): Nikola Rose OUT → Dirk McCollum IN (stamina_rule2)

[04:04] Substitution (Team_098): Blake Murray OUT → Kristaps Iverson IN (stamina_rule2)

[04:04] Substitution (Team_098): Pascal Lillard OUT → Manu Jordan IN (stamina_rule2)

[04:04] Substitution (Team_098): Derrick Durant OUT → Russell McGrady IN (stamina_rule2)

[04:04] Substitution (Team_026): Wendell Gasol OUT → Myles Tatum IN (stamina_rule2)

[04:04] Substitution (Team_026): Immanuel Hyland OUT → Karl Barrett IN (stamina_rule2)

[04:04] Substitution (Team_026): Klay Giddey OUT → Josh Simons IN (stamina_rule2)

[04:04] Substitution (Team_026): Shaquille Trent OUT → Damian Doncic IN (stamina_rule2)

[04:04] Substitution (Team_026): Kobe Booker OUT → Dirk Randle IN (stamina_rule2)

[03:50] Team_098 possession (Score: 101-101)
FOUL! Holding foul on Karl Barrett. [IN THE BONUS! 8 team fouls] Dirk McCollum to the line for 2 free throws. (Karl Barrett: 1 personal fouls)   FT 1/2: MISS   FT 2/2: GOOD Dirk McCollum makes 1/2 from the line.
Score: 102-101

[03:37] Team_026 possession (Score: 102-101)
Myles Tatum drives and kicks out. Josh Simons attempts a 3Pt. Contested by Dirk McCollum (2.9 feet, ZONE). JOSH SIMONS MAKES IT!
Score: 102-104

[03:23] Team_098 possession (Score: 102-104)
Kristaps Iverson drives and kicks out. Russell McGrady attempts a Midrange. Contested by Josh Simons (5.2 feet, ZONE). Russell McGrady misses. Rebound secured by Damian Doncic.

[03:08] Team_026 possession (Score: 102-104)
Damian Doncic attempts a Layup. Heavily contested by Russell McGrady (1.2 feet, ZONE)! Damian Doncic misses. Offensive rebound by Josh Simons! Josh Simons kicks it out.

[02:51] Team_026 possession (Score: 102-104)
Josh Simons attempts a Layup. BLOCKED BY KRISTAPS IVERSON! Ball is loose! Offensive rebound by Damian Doncic! Damian Doncic kicks it out.

[02:33] Team_026 possession (Score: 102-104)
Josh Simons attempts a Layup. Wide open! Kristaps Iverson is 6.2 feet away. [MAN] Josh Simons misses. Rebound secured by Russell McGrady.

[02:20] Team_098 possession (Score: 102-104)
Kristaps Iverson attempts a 3Pt. Contested by Josh Simons (2.6 feet, MAN). Kristaps Iverson misses. Rebound secured by Josh Simons.

[02:08] Team_026 possession (Score: 102-104)
FOUL! Reach-in foul on Russell McGrady during the drive. [Team fouls: 2] No free throws, side out. (Russell McGrady: 1 personal fouls)

[01:54] Team_026 possession (Score: 102-104)
Myles Tatum attempts a 3Pt. Heavily contested by Tracy Rose (0.5 feet, MAN)! Myles Tatum misses. Rebound secured by Russell McGrady.

[01:37] Team_098 possession (Score: 102-104)
Tracy Rose attempts a Midrange. Wide open! Damian Doncic is 7.0 feet away. [ZONE] Tracy Rose misses. Rebound secured by Damian Doncic.

[01:24] Team_026 possession (Score: 102-104)
Dirk Randle drives to the basket... Dirk Randle throws a bad pass! Stolen by Russell McGrady! TURNOVER! (live ball)

[01:14] Team_098 possession (Score: 102-104)
Tracy Rose drives and kicks out. Tracy Rose attempts a 3Pt. Contested by Karl Barrett (5.3 feet, ZONE). TRACY ROSE MAKES IT! Assist: Dirk McCollum
Score: 105-104

[01:02] Team_026 possession (Score: 105-104)
Damian Doncic drives, Manu Jordan stays with him. Damian Doncic attempts a Dunk. Contested by Manu Jordan (2.4 feet, ZONE). Damian Doncic misses. Rebound secured by Manu Jordan.

[00:45] Team_098 possession (Score: 105-104)
Tracy Rose throws a bad pass out of bounds! TURNOVER! (dead ball)

[00:32] Team_026 possession (Score: 105-104)
Myles Tatum drives to the basket... FOUL! Offensive foul on Myles Tatum! Tracy Rose drew the charge! [Team fouls: 9] (Myles Tatum: 1 personal fouls) TURNOVER! (dead ball)

[00:20] Team_098 possession (Score: 105-104)
Manu Jordan makes the Layup and draws the foul on Damian Doncic! And-1! Manu Jordan to the line for 1. [BONUS: 10 team fouls] (Damian Doncic: 1 personal fouls)   FT 1/1: GOOD Manu Jordan makes 1/1 from the line.
Score: 108-104

[00:04] Team_026 possession (Score: 108-104)
Karl Barrett attempts a 3Pt. Wide open! Dirk McCollum is 6.5 feet away. [ZONE] KARL BARRETT MAKES IT! Assist: Myles Tatum
Score: 108-107

================================================================================
                              4TH QUARTER COMPLETE                              
================================================================================

4TH QUARTER SCORE: Team_098 31, Team_026 33

BOX SCORE:
================================================================================

Team_098
--------------------------------------------------------------------------------
Player                MIN  PTS  REB  AST  TO      FG   FG%      3P   3P%
--------------------------------------------------------------------------------
Malcolm Tatum          33    8    0    1   0   4/6    66.7     0/0   0.0
Derrick Durant         33    5    1    0   0   2/2   100.0     0/0   0.0
Pascal Lillard         33    4    3    2   0   2/3    66.7     0/0   0.0
Blake Murray           33    3    0    0   0   1/3    33.3     0/0   0.0
Nikola Rose            33    3    1    0   0   1/1   100.0     0/0   0.0
Tracy Rose             15    3    0    0   0   1/2    50.0     0/0   0.0
Manu Jordan            15    3    1    0   0   1/1   100.0     0/0   0.0
Dirk McCollum          15    1    0    1   0   1/1   100.0     0/0   0.0
Kristaps Iverson       15    0    0    0   0   0/2     0.0     0/0   0.0
Russell McGrady        15    0    2    0   0   0/0     0.0     0/0   0.0

TEAM: FG: 13/21 (61.9%), 3PT: 2/5 (40.0%), REB: 8 (2 off, 6 def), AST: 4, TO: 2
TEAM FOULS: 2


Team_026
--------------------------------------------------------------------------------
Player                MIN  PTS  REB  AST  TO      FG   FG%      3P   3P%
--------------------------------------------------------------------------------
Shaquille Trent        33    8    3    1   0   3/4    75.0     0/0   0.0
Immanuel Hyland        33    6    0    1   0   2/2   100.0     0/0   0.0
Klay Giddey            33    5    0    1   0   2/3    66.7     0/0   0.0
Wendell Gasol          33    5    0    2   0   2/3    66.7     0/0   0.0
Kobe Booker            33    3    3    1   0   1/1   100.0     0/0   0.0
Josh Simons            15    3    2    0   0   1/2    50.0     0/0   0.0
Karl Barrett           15    3    0    0   0   1/1   100.0     0/0   0.0
Damian Doncic          15    0    3    0   0   0/1     0.0     0/0   0.0
Myles Tatum            15    0    0    1   0   0/1     0.0     0/0   0.0

TEAM: FG: 12/18 (66.7%), 3PT: 6/9 (66.7%), REB: 11 (3 off, 8 def), AST: 7, TO: 5
TEAM FOULS: 10 [Team_098 in BONUS]

================================================================================

================================================================================
                               FULL GAME COMPLETE                               
================================================================================

FINAL SCORE: Team_098 108, Team_026 107

SCORING BY QUARTER:
--------------------------------------------------------------------------------
Team                     Q1     Q2     Q3     Q4    FINAL
--------------------------------------------------------------------------------
Team_098                 27     18     32     31      108
Team_026                 25     22     27     33      107
--------------------------------------------------------------------------------

FULL GAME BOX SCORE:
================================================================================

Team_098
--------------------------------------------------------------------------------
Player                MIN  PTS  REB  AST  TO      FG   FG%      3P   3P%      FT STL BLK
--------------------------------------------------------------------------------
Malcolm Tatum          33   27    0    6   1  11/16   68.8   3/5    60.0   5/7     0   0
Nikola Rose            33   19    7    2   0   7/12   58.3   3/6    50.0   5/6     1   0
Blake Murray           33   19    0    2   1   8/11   72.7   2/3    66.7   3/3     1   0
Pascal Lillard         33    6   15    7   1   3/11   27.3   0/3     0.0   3/5     1   1
Derrick Durant         33   12    5    0   1   8/10   80.0   0/1     0.0   2/3     1   1
Tracy Rose             15    7    0    1   1   4/8    50.0   0/2     0.0   0/0     0   0
Dirk McCollum          15    1    0    1   0   0/4     0.0   0/2     0.0   1/2     0   1
Kristaps Iverson       15    6    4    2   0   3/9    33.3   0/3     0.0   0/0     0   1
Manu Jordan            15    3    2    2   0   1/1   100.0   0/0     0.0   1/1     0   0
Russell McGrady        15    4    7    0   0   1/3    33.3   0/1     0.0   0/0     2   0

TEAM: FG: 47/86 (54.7%), 3PT: 8/26 (30.8%), REB: 39 (8 off, 31 def), AST: 23, TO: 5


Team_026
--------------------------------------------------------------------------------
Player                MIN  PTS  REB  AST  TO      FG   FG%      3P   3P%      FT STL BLK
--------------------------------------------------------------------------------
Wendell Gasol          33   16    0    6   2   6/12   50.0   2/4    50.0   1/2     0   0
Immanuel Hyland        33   24    5    2   1   8/10   80.0   4/5    80.0   4/4     0   0
Klay Giddey            33   11    0    2   4   5/10   50.0   1/5    20.0   2/2     1   0
Shaquille Trent        33   18    8    2   3   8/10   80.0   2/2   100.0   4/4     0   0
Kobe Booker            33   12   10    2   1   6/11   54.5   0/2     0.0   3/3     0   0
Myles Tatum            15    3    0    2   3   2/6    33.3   1/4    25.0   0/0     0   0
Karl Barrett           15    9    3    2   2   4/5    80.0   3/3   100.0   0/0     0   0
Josh Simons            15    8   10    1   1   2/5    40.0   0/1     0.0   1/1     0   0
Damian Doncic          15    2   10    0   0   0/3     0.0   0/2     0.0   0/0     0   0
Dirk Randle            15    2    0    1   1   1/1   100.0   0/0     0.0   0/1     0   0

TEAM: FG: 42/73 (57.5%), 3PT: 13/28 (46.4%), REB: 47 (8 off, 39 def), AST: 20, TO: 18

================================================================================
