================================================================================
                        FULL GAME - Team_074 vs Team_032                        
================================================================================

================================================================================
                       1ST QUARTER - Team_074 vs Team_032                       
================================================================================

[12:00] Team_074 possession (Score: 0-0)
FOUL! Reach-in foul on Jalen Westbrook during the drive. [Team fouls: 1] No free throws, side out. (Jalen Westbrook: 1 personal fouls)

[11:49] Team_074 possession (Score: 0-0)
Donovan Doncic drives, Malcolm Lillard stays with him. Donovan Doncic attempts a Dunk. Contested by Malcolm Lillard (2.3 feet, ZONE). DONOVAN DONCIC MAKES IT! Assist: Chris Carter
Score: 2-0

[11:32] Team_032 possession (Score: 2-0)
DeMar Giddey attempts a 3Pt. Wide open! Chris Carter is 6.5 feet away. [MAN] DeMar Giddey misses. Rebound secured by Shai Green.

[11:17] Team_074 possession (Score: 2-0)
Dwyane Quickley attempts a 3Pt. Heavily contested by Tobias Bane (1.7 feet, ZONE)! Dwyane Quickley misses. Offensive rebound by Donovan Doncic! Donovan Doncic kicks it out.

[11:03] Team_074 possession (Score: 2-0)
Chris Carter attempts a 3Pt. Contested by Anfernee Butler (5.5 feet, ZONE). Chris Carter misses. Rebound secured by Tobias Bane.

[10:48] Team_032 possession (Score: 2-0)
DeMar Giddey attempts a 3Pt. Contested by Chris Carter (3.9 feet, MAN). DeMar Giddey misses. Offensive rebound by Malcolm Lillard! Malcolm Lillard kicks it out.

[10:32] Team_032 possession (Score: 2-0)
Anfernee Butler attempts a 3Pt. Contested by Dwyane Quickley (4.9 feet, ZONE). ANFERNEE BUTLER MAKES IT! Assist: Tobias Bane
Score: 2-3

[10:16] Team_074 possession (Score: 2-3)
Shai Green attempts a 3Pt. Contested by Tobias Bane (2.8 feet, ZONE). Shai Green misses. Rebound secured by Malcolm Lillard.

[09:59] Team_032 possession (Score: 2-3)
Anfernee Butler drives to the basket... Anfernee Butler commits a violation (traveling/carry)! TURNOVER! (dead ball)

[09:44] Team_074 possession (Score: 2-3)
Dwyane Quickley attempts a Layup. Contested by Malcolm Lillard (3.2 feet, ZONE). DWYANE QUICKLEY MAKES IT! Assist: Shai Green
Score: 4-3

[09:33] Team_032 possession (Score: 4-3)
Malcolm Lillard attempts a Midrange. Contested by Shai Green (2.2 feet, ZONE). Malcolm Lillard misses. Offensive rebound by Malcolm Lillard! Malcolm Lillard kicks it out.

[09:16] Team_032 possession (Score: 4-3)
Jalen Westbrook drives, Shai Green stays with him. Jalen Westbrook attempts a Layup. Contested by Shai Green (3.3 feet, MAN). JALEN WESTBROOK MAKES IT! Assist: Tobias Bane
Score: 4-5

[09:00] Team_074 possession (Score: 4-5)
FOUL! Reach-in foul on Anfernee Butler during the drive. [Team fouls: 2] No free throws, side out. (Anfernee Butler: 1 personal fouls)

[08:41] Team_074 possession (Score: 4-5)
Dwyane Quickley makes the Layup and draws the foul on DeMar Giddey! And-1! Dwyane Quickley to the line for 1. [Team fouls: 3] (DeMar Giddey: 1 personal fouls)   FT 1/1: MISS Dwyane Quickley makes 0/1 from the line. Rebound secured by Anfernee Butler.
Score: 6-5

[08:23] Team_032 possession (Score: 6-5)
Jalen Westbrook loses control! Ball rolls out of bounds! TURNOVER! (dead ball)

[08:08] Team_074 possession (Score: 6-5)
Shai Green attempts a 3Pt. Wide open! Jalen Westbrook is 6.5 feet away. [MAN] Shai Green misses. Rebound secured by Malcolm Lillard.

[07:51] Team_032 possession (Score: 6-5)
Jalen Westbrook attempts a Midrange. Contested by Shai Green (4.4 feet, MAN). JALEN WESTBROOK MAKES IT!
Score: 6-7

[07:34] Team_074 possession (Score: 6-7)
Dwyane Quickley drives and kicks out. Dwyane Quickley attempts a Midrange. Contested by DeMar Giddey (4.5 feet, ZONE). DWYANE QUICKLEY MAKES IT!
Score: 8-7

[07:19] Team_032 possession (Score: 8-7)
FOUL! Shooting foul on Donovan Doncic. Anfernee Butler to the line for 2 free throws. [Team fouls: 1] (Donovan Doncic: 1 personal fouls)   FT 1/2: GOOD   FT 2/2: GOOD Anfernee Butler makes 2/2 from the line.
Score: 8-9

[07:03] Team_074 possession (Score: 8-9)
Chris Carter attempts a 3Pt. Contested by DeMar Giddey (2.9 feet, MAN). Chris Carter misses. Rebound secured by Anfernee Butler.

[06:49] Team_032 possession (Score: 8-9)
DeMar Giddey drives to the basket... DeMar Giddey throws a bad pass out of bounds! TURNOVER! (dead ball)

[06:37] Team_074 possession (Score: 8-9)
James Turner throws a bad pass out of bounds! TURNOVER! (dead ball)

[06:23] Team_032 possession (Score: 8-9)
Jalen Westbrook drives, picks up Donovan Doncic. Help arrives from Chris Carter! Jalen Westbrook attempts a Dunk. Heavily contested by Chris Carter (0.7 feet, ZONE)! JALEN WESTBROOK MAKES IT! Assist: Tobias Bane
Score: 8-11

[06:06] Team_074 possession (Score: 8-11)
FOUL! Holding foul on Malcolm Lillard. [Team fouls: 4] No free throws, side out. (Malcolm Lillard: 1 personal fouls)

[05:54] Team_074 possession (Score: 8-11)
Dwyane Quickley attempts a Layup. Heavily contested by Tobias Bane (0.5 feet, MAN)! Dwyane Quickley misses. FOUL! Loose ball foul on Tobias Bane during the rebound battle. [IN THE BONUS! 5 team fouls] James Turner to the line for 2 free throws. (Tobias Bane: 1 personal fouls)   FT 1/2: GOOD   FT 2/2: GOOD James Turner makes 2/2 from the line.
Score: 10-11

[05:39] Team_032 possession (Score: 10-11)
DeMar Giddey attempts a 3Pt. Wide open! Dwyane Quickley is 7.5 feet away. [ZONE] DEMAR GIDDEY MAKES IT! Assist: Jalen Westbrook
Score: 10-14

[05:26] Team_074 possession (Score: 10-14)
James Turner drives, Malcolm Lillard stays with him. James Turner attempts a Layup. Wide open! Malcolm Lillard is 6.1 feet away. [MAN] JAMES TURNER MAKES IT! Assist: Dwyane Quickley
Score: 12-14

[05:10] Team_032 possession (Score: 12-14)
Anfernee Butler attempts a Midrange. Contested by James Turner (4.2 feet, ZONE). ANFERNEE BUTLER MAKES IT! Assist: DeMar Giddey
Score: 12-16

[04:53] Team_074 possession (Score: 12-16)
FOUL! Shooting foul on Jalen Westbrook. Dwyane Quickley to the line for 3 free throws. [BONUS: 6 team fouls] (Jalen Westbrook: 2 personal fouls)   FT 1/3: GOOD   FT 2/3: GOOD   FT 3/3: GOOD Dwyane Quickley makes 3/3 from the line.
Score: 15-16

[04:37] Team_032 possession (Score: 15-16)
FOUL! Shooting foul on Shai Green. Jalen Westbrook to the line for 3 free throws. [Team fouls: 2] (Shai Green: 1 personal fouls)   FT 1/3: GOOD   FT 2/3: GOOD   FT 3/3: MISS Jalen Westbrook makes 2/3 from the line. Rebound secured by James Turner.
Score: 15-18

[04:27] Team_074 possession (Score: 15-18)
Donovan Doncic attempts a Midrange. Wide open! Anfernee Butler is 7.2 feet away. [MAN] DONOVAN DONCIC MAKES IT! Assist: James Turner
Score: 17-18

[04:11] Team_032 possession (Score: 17-18)
Tobias Bane attempts a Midrange. Wide open! Dwyane Quickley is 7.9 feet away. [MAN] TOBIAS BANE MAKES IT! Assist: Malcolm Lillard
Score: 17-20

[04:00] Team_074 possession (Score: 17-20)
Chris Carter attempts a Midrange. Wide open! DeMar Giddey is 7.8 feet away. [ZONE] Chris Carter misses. Offensive rebound by James Turner! James Turner puts it back in!
Score: 19-20

[03:46] Team_032 possession (Score: 19-20)
Jalen Westbrook drives, picks up Donovan Doncic. Help arrives from Chris Carter! Jalen Westbrook attempts a Dunk. Contested by Chris Carter (3.8 feet, ZONE). JALEN WESTBROOK MAKES IT! Assist: Tobias Bane
Score: 19-22

[03:30] Team_074 possession (Score: 19-22)
Chris Carter drives, picks up Malcolm Lillard. Help arrives from DeMar Giddey! Chris Carter attempts a Layup. Wide open! DeMar Giddey is 6.2 feet away. [ZONE] CHRIS CARTER MAKES IT! Assist: Dwyane Quickley
Score: 21-22

[03:12] Team_032 possession (Score: 21-22)
DeMar Giddey attempts a Layup. BLOCKED BY CHRIS CARTER! Ball is loose! Rebound secured by James Turner.

[02:57] Team_074 possession (Score: 21-22)
James Turner attempts a Layup. Contested by Malcolm Lillard (4.5 feet, MAN). JAMES TURNER MAKES IT!
Score: 23-22

[02:47] Team_032 possession (Score: 23-22)
Jalen Westbrook attempts a 3Pt. Contested by Shai Green (2.6 feet, MAN). Jalen Westbrook misses. Rebound secured by Shai Green.

[02:33] Team_074 possession (Score: 23-22)
Shai Green attempts a 3Pt. Contested by Tobias Bane (5.9 feet, ZONE). SHAI GREEN MAKES IT! Assist: James Turner
Score: 26-22

[02:18] Team_032 possession (Score: 26-22)
FOUL! Shooting foul on Shai Green. Jalen Westbrook to the line for 2 free throws. [Team fouls: 3] (Shai Green: 2 personal fouls)   FT 1/2: GOOD   FT 2/2: GOOD Jalen Westbrook makes 2/2 from the line.
Score: 26-24

[02:03] Team_074 possession (Score: 26-24)
James Turner attempts a Midrange. Wide open! Malcolm Lillard is 9.0 feet away. [MAN] James Turner misses. Offensive rebound by James Turner! James Turner puts it back in!
Score: 28-24

[01:45] Team_032 possession (Score: 28-24)
FOUL! Reach-in foul on James Turner during the drive. [Team fouls: 4] No free throws, side out. (James Turner: 1 personal fouls)

[01:29] Team_032 possession (Score: 28-24)
Jalen Westbrook attempts a 3Pt. Contested by Shai Green (4.4 feet, MAN). Jalen Westbrook misses. Offensive rebound by Anfernee Butler! Anfernee Butler kicks it out.

[01:17] Team_032 possession (Score: 28-24)
Malcolm Lillard makes the Dunk and draws the foul on Chris Carter! And-1! Malcolm Lillard to the line for 1. [BONUS: 5 team fouls] (Chris Carter: 1 personal fouls)   FT 1/1: GOOD Malcolm Lillard makes 1/1 from the line.
Score: 28-27

[01:02] Team_074 possession (Score: 28-27)
Shai Green attempts a 3Pt. Wide open! Jalen Westbrook is 8.1 feet away. [MAN] Shai Green misses. Rebound secured by Tobias Bane.

[00:49] Team_032 possession (Score: 28-27)
FOUL! Holding foul on Shai Green. [IN THE BONUS! 6 team fouls] Jalen Westbrook to the line for 2 free throws. (Shai Green: 3 personal fouls)   FT 1/2: GOOD   FT 2/2: GOOD Jalen Westbrook makes 2/2 from the line.
Score: 28-29

[00:35] Team_074 possession (Score: 28-29)
Donovan Doncic attempts a Layup. BLOCKED BY MALCOLM LILLARD! Ball is loose! Rebound secured by Anfernee Butler.

[00:24] Team_032 possession (Score: 28-29)
Malcolm Lillard attempts a Layup. Contested by Donovan Doncic (4.8 feet, ZONE). MALCOLM LILLARD MAKES IT!
Score: 28-31

[00:14] Team_074 possession (Score: 28-31)
Shai Green drives, Malcolm Lillard stays with him. Shai Green attempts a Dunk. Contested by Malcolm Lillard (2.6 feet, ZONE). Shai Green misses. Offensive rebound by James Turner! James Turner kicks it out.

================================================================================
                              1ST QUARTER COMPLETE                              
================================================================================

1ST QUARTER SCORE: Team_074 28, Team_032 31

BOX SCORE:
================================================================================

Team_074
--------------------------------------------------------------------------------
Player                MIN  PTS  REB  AST  TO      FG   FG%      3P   3P%
--------------------------------------------------------------------------------
James Turner           12   10    5    2   0   5/5   100.0     0/0   0.0
Dwyane Quickley        12    7    0    2   0   3/4    75.0     0/0   0.0
Donovan Doncic         12    4    1    0   0   2/3    66.7     0/0   0.0
Shai Green             12    3    2    1   0   1/4    25.0     0/0   0.0
Chris Carter           12    2    0    1   0   1/3    33.3     0/0   0.0

TEAM: FG: 12/19 (63.2%), 3PT: 2/7 (28.6%), REB: 8 (4 off, 4 def), AST: 6, TO: 1
TEAM FOULS: 6 [Team_032 in BONUS]


Team_032
--------------------------------------------------------------------------------
Player                MIN  PTS  REB  AST  TO      FG   FG%      3P   3P%
--------------------------------------------------------------------------------
Jalen Westbrook        12   12    0    1   0   6/8    75.0     0/0   0.0
Anfernee Butler        12    7    4    0   0   3/3   100.0     0/0   0.0
Malcolm Lillard        12    5    4    1   0   2/2   100.0     0/0   0.0
DeMar Giddey           12    3    0    1   0   1/3    33.3     0/0   0.0
Tobias Bane            12    2    2    4   0   1/1   100.0     0/0   0.0

TEAM: FG: 13/17 (76.5%), 3PT: 2/5 (40.0%), REB: 10 (3 off, 7 def), AST: 7, TO: 3
TEAM FOULS: 6 [Team_074 in BONUS]

================================================================================

================================================================================
                       2ND QUARTER - Team_074 vs Team_032                       
================================================================================

[12:00] Team_074 possession (Score: 28-31)
Dwyane Quickley attempts a Layup. Heavily contested by Tobias Bane (0.5 feet, MAN)! DWYANE QUICKLEY MAKES IT! Assist: Chris Carter
Score: 30-31

[11:45] Team_032 possession (Score: 30-31)
Tobias Bane attempts a 3Pt. Wide open! Dwyane Quickley is 6.2 feet away. [ZONE] TOBIAS BANE MAKES IT! Assist: Malcolm Lillard
Score: 30-34

[11:33] Team_074 possession (Score: 30-34)
Shai Green attempts a Midrange. Contested by Jalen Westbrook (4.6 feet, MAN). SHAI GREEN MAKES IT! Assist: Dwyane Quickley
Score: 32-34

[11:18] Team_032 possession (Score: 32-34)
Jalen Westbrook drives and kicks out. Jalen Westbrook attempts a 3Pt. Wide open! Dwyane Quickley is 6.9 feet away. [ZONE] Jalen Westbrook misses. Rebound secured by James Turner.

[11:04] Team_074 possession (Score: 32-34)
Chris Carter attempts a Layup. BLOCKED BY MALCOLM LILLARD! Ball is loose! Rebound secured by Malcolm Lillard.

[10:48] Team_032 possession (Score: 32-34)
Malcolm Lillard drives, James Turner stays with him. Malcolm Lillard attempts a Dunk. Contested by James Turner (5.1 feet, MAN). Malcolm Lillard misses. Rebound secured by Donovan Doncic.

[10:31] Team_074 possession (Score: 32-34)
Dwyane Quickley attempts a Midrange. Contested by Tobias Bane (5.7 feet, MAN). DWYANE QUICKLEY MAKES IT! Assist: Donovan Doncic
Score: 34-34

[10:12] Team_032 possession (Score: 34-34)
Tobias Bane attempts a Midrange. Contested by Dwyane Quickley (5.3 feet, MAN). TOBIAS BANE MAKES IT! Assist: Malcolm Lillard
Score: 34-36

[09:59] Team_074 possession (Score: 34-36)
FOUL! Reach-in foul on Malcolm Lillard during the drive. [Team fouls: 1] No free throws, side out. (Malcolm Lillard: 1 personal fouls)

[09:42] Team_074 possession (Score: 34-36)
Chris Carter attempts a 3Pt. Contested by Tobias Bane (5.7 feet, ZONE). Chris Carter misses. Rebound secured by Anfernee Butler.

[09:25] Team_032 possession (Score: 34-36)
Malcolm Lillard attempts a 3Pt. Wide open! Dwyane Quickley is 6.5 feet away. [ZONE] MALCOLM LILLARD MAKES IT! Assist: DeMar Giddey
Score: 34-39

[09:11] Team_074 possession (Score: 34-39)
Donovan Doncic attempts a Midrange. Wide open! Anfernee Butler is 6.8 feet away. [MAN] DONOVAN DONCIC MAKES IT!
Score: 36-39

[08:54] Team_032 possession (Score: 36-39)
FOUL! Shooting foul on Chris Carter. DeMar Giddey to the line for 2 free throws. [Team fouls: 1] (Chris Carter: 1 personal fouls)   FT 1/2: MISS   FT 2/2: MISS DeMar Giddey makes 0/2 from the line. Rebound secured by Donovan Doncic.

[08:42] Team_074 possession (Score: 36-39)
Donovan Doncic drives and kicks out. Dwyane Quickley attempts a 3Pt. Contested by Tobias Bane (5.1 feet, MAN). DWYANE QUICKLEY MAKES IT! Assist: Shai Green
Score: 39-39

[08:29] Team_032 possession (Score: 39-39)
FOUL! Shooting foul on Dwyane Quickley. Jalen Westbrook to the line for 2 free throws. [Team fouls: 2] (Dwyane Quickley: 1 personal fouls)   FT 1/2: MISS   FT 2/2: GOOD Jalen Westbrook makes 1/2 from the line.
Score: 39-40

[08:19] Team_074 possession (Score: 39-40)
Dwyane Quickley commits a violation (traveling/carry)! TURNOVER! (dead ball)

[08:19] Substitution (Team_074): Dwyane Quickley OUT → James Barnes IN (stamina_rule2)

[08:19] Substitution (Team_074): Chris Carter OUT → Giannis Westbrook IN (stamina_rule2)

[08:19] Substitution (Team_074): Shai Green OUT → Ayo Smith IN (stamina_rule2)

[08:19] Substitution (Team_074): Donovan Doncic OUT → Yao Randle IN (stamina_rule2)

[08:19] Substitution (Team_074): James Turner OUT → Jaren Rozier IN (stamina_rule2)

[08:19] Substitution (Team_032): Tobias Bane OUT → Anfernee Griffin IN (stamina_rule2)

[08:19] Substitution (Team_032): DeMar Giddey OUT → Myles Herro IN (stamina_rule2)

[08:19] Substitution (Team_032): Jalen Westbrook OUT → Jrue Simmons IN (stamina_rule2)

[08:19] Substitution (Team_032): Anfernee Butler OUT → Jayson O'Neal IN (stamina_rule2)

[08:19] Substitution (Team_032): Malcolm Lillard OUT → Lauri Towns IN (stamina_rule2)

[08:02] Team_032 possession (Score: 39-40)
FOUL! Shooting foul on Yao Randle. Jayson O'Neal to the line for 2 free throws. [Team fouls: 3] (Yao Randle: 1 personal fouls)   FT 1/2: GOOD   FT 2/2: GOOD Jayson O'Neal makes 2/2 from the line.
Score: 39-42

[07:49] Team_074 possession (Score: 39-42)
Yao Randle attempts a 3Pt. Contested by Jrue Simmons (4.6 feet, ZONE). YAO RANDLE MAKES IT! Assist: Ayo Smith
Score: 42-42

[07:35] Team_032 possession (Score: 42-42)
FOUL! Shooting foul on Yao Randle. Jayson O'Neal to the line for 2 free throws. [Team fouls: 4] (Yao Randle: 2 personal fouls)   FT 1/2: GOOD   FT 2/2: GOOD Jayson O'Neal makes 2/2 from the line.
Score: 42-44

[07:20] Team_074 possession (Score: 42-44)
FOUL! Shooting foul on Myles Herro. James Barnes to the line for 2 free throws. [Team fouls: 2] (Myles Herro: 1 personal fouls)   FT 1/2: GOOD   FT 2/2: GOOD James Barnes makes 2/2 from the line.
Score: 44-44

[07:04] Team_032 possession (Score: 44-44)
FOUL! Holding foul on James Barnes. [IN THE BONUS! 5 team fouls] Anfernee Griffin to the line for 2 free throws. (James Barnes: 1 personal fouls)   FT 1/2: GOOD   FT 2/2: GOOD Anfernee Griffin makes 2/2 from the line.
Score: 44-46

[06:47] Team_074 possession (Score: 44-46)
Giannis Westbrook attempts a Midrange. Contested by Myles Herro (3.5 feet, MAN). GIANNIS WESTBROOK MAKES IT!
Score: 46-46

[06:30] Team_032 possession (Score: 46-46)
Myles Herro attempts a 3Pt. Contested by Giannis Westbrook (5.8 feet, MAN). Myles Herro misses. Offensive rebound by Lauri Towns! Lauri Towns kicks it out.

[06:16] Team_032 possession (Score: 46-46)
Anfernee Griffin attempts a 3Pt. Contested by James Barnes (3.1 feet, MAN). ANFERNEE GRIFFIN MAKES IT! Assist: Jrue Simmons
Score: 46-49

[06:02] Team_074 possession (Score: 46-49)
Giannis Westbrook attempts a 3Pt. Contested by Myles Herro (5.0 feet, MAN). GIANNIS WESTBROOK MAKES IT! Assist: James Barnes
Score: 49-49

[05:48] Team_032 possession (Score: 49-49)
Anfernee Griffin attempts a Midrange. Wide open! James Barnes is 6.3 feet away. [MAN] Anfernee Griffin misses. Rebound secured by Ayo Smith.

[05:34] Team_074 possession (Score: 49-49)
Yao Randle attempts a Midrange. BLOCKED BY JAYSON O'NEAL! Ball is loose! Rebound secured by Lauri Towns.

[05:23] Team_032 possession (Score: 49-49)
Jayson O'Neal drives, Yao Randle stays with him. Jayson O'Neal attempts a Layup. Contested by Yao Randle (5.6 feet, MAN). JAYSON O'NEAL MAKES IT! Assist: Lauri Towns
Score: 49-51

[05:09] Team_074 possession (Score: 49-51)
James Barnes attempts a Layup. Contested by Anfernee Griffin (4.4 feet, MAN). JAMES BARNES MAKES IT! Assist: Ayo Smith
Score: 51-51

[04:57] Team_032 possession (Score: 51-51)
Jayson O'Neal attempts a Layup. Contested by Yao Randle (4.0 feet, ZONE). JAYSON O'NEAL MAKES IT!
Score: 51-53

[04:38] Team_074 possession (Score: 51-53)
James Barnes attempts a 3Pt. Wide open! Anfernee Griffin is 6.2 feet away. [MAN] James Barnes misses. Rebound secured by Myles Herro.

[04:24] Team_032 possession (Score: 51-53)
Jayson O'Neal throws a bad pass! Stolen by Yao Randle! TURNOVER! (live ball)

[04:07] Team_074 possession (Score: 51-53)
Yao Randle drives, picks up Jayson O'Neal. Help arrives from Myles Herro! Yao Randle attempts a Dunk. Contested by Myles Herro (2.4 feet, MAN). Yao Randle misses. Rebound secured by Lauri Towns.

[03:51] Team_032 possession (Score: 51-53)
Jrue Simmons drives and kicks out. Anfernee Griffin attempts a Midrange. Contested by James Barnes (4.7 feet, MAN). ANFERNEE GRIFFIN MAKES IT!
Score: 51-55

[03:38] Team_074 possession (Score: 51-55)
James Barnes attempts a 3Pt. Wide open! Anfernee Griffin is 7.9 feet away. [MAN] James Barnes misses. Rebound secured by Jayson O'Neal.

[03:25] Team_032 possession (Score: 51-55)
Lauri Towns attempts a 3Pt. Contested by James Barnes (5.5 feet, ZONE). Lauri Towns misses. Rebound secured by Yao Randle.

[03:07] Team_074 possession (Score: 51-55)
Ayo Smith drives and kicks out. James Barnes attempts a Midrange. Wide open! Jayson O'Neal is 7.9 feet away. [ZONE] James Barnes misses. Offensive rebound by Yao Randle! Yao Randle kicks it out.

[02:53] Team_074 possession (Score: 51-55)
Jaren Rozier drives to the basket... Jaren Rozier loses control! Ball rolls out of bounds! TURNOVER! (dead ball)

[02:38] Team_032 possession (Score: 51-55)
Jrue Simmons attempts a 3Pt. Contested by Ayo Smith (4.3 feet, ZONE). Jrue Simmons misses. Rebound secured by Jaren Rozier.

[02:23] Team_074 possession (Score: 51-55)
FOUL! Reach-in foul on Lauri Towns during the drive. [Team fouls: 3] No free throws, side out. (Lauri Towns: 1 personal fouls)

[02:06] Team_074 possession (Score: 51-55)
Ayo Smith drives, picks up Jrue Simmons. Help arrives from Myles Herro! Ayo Smith attempts a Layup. Contested by Myles Herro (3.0 feet, MAN). Ayo Smith misses. Rebound secured by Myles Herro.

[01:54] Team_032 possession (Score: 51-55)
Jrue Simmons attempts a 3Pt. Wide open! James Barnes is 6.3 feet away. [ZONE] JRUE SIMMONS MAKES IT! Assist: Myles Herro
Score: 51-58

[01:38] Team_074 possession (Score: 51-58)
James Barnes attempts a 3Pt. Wide open! Anfernee Griffin is 6.8 feet away. [MAN] James Barnes misses. Rebound secured by Jayson O'Neal.

[01:24] Team_032 possession (Score: 51-58)
Jayson O'Neal attempts a 3Pt. Contested by Yao Randle (5.1 feet, MAN). Jayson O'Neal misses. Rebound secured by Jaren Rozier.

[01:09] Team_074 possession (Score: 51-58)
FOUL! Offensive foul on Jaren Rozier! Lauri Towns drew the charge! [Team fouls: 6] (Jaren Rozier: 1 personal fouls) TURNOVER! (dead ball)

[00:51] Team_032 possession (Score: 51-58)
Lauri Towns attempts a Layup. Contested by Jaren Rozier (2.9 feet, MAN). LAURI TOWNS MAKES IT!
Score: 51-60

[00:37] Team_074 possession (Score: 51-60)
Ayo Smith attempts a Layup. Wide open! Lauri Towns is 6.0 feet away. [ZONE] Ayo Smith misses. Rebound secured by Lauri Towns.

[00:24] Team_032 possession (Score: 51-60)
Anfernee Griffin attempts a 3Pt. Wide open! James Barnes is 7.2 feet away. [ZONE] Anfernee Griffin misses. Rebound secured by Jaren Rozier.

[00:08] Team_074 possession (Score: 51-60)
FOUL! Reach-in foul on Lauri Towns during the drive. [Team fouls: 4] No free throws, side out. (Lauri Towns: 2 personal fouls)

================================================================================
                              2ND QUARTER COMPLETE                              
================================================================================

2ND QUARTER SCORE: Team_074 23, Team_032 29

BOX SCORE:
================================================================================

Team_074
--------------------------------------------------------------------------------
Player                MIN  PTS  REB  AST  TO      FG   FG%      3P   3P%
--------------------------------------------------------------------------------
Dwyane Quickley        16    7    0    1   0   3/3   100.0     0/0   0.0
Giannis Westbrook       8    5    0    0   0   2/2   100.0     0/0   0.0
James Barnes            8    4    0    1   0   2/5    40.0     0/0   0.0
Yao Randle              8    3    2    0   0   1/3    33.3     0/0   0.0
Shai Green             16    2    0    1   0   1/1   100.0     0/0   0.0
Donovan Doncic         16    2    2    1   0   1/1   100.0     0/0   0.0
Chris Carter           16    0    0    1   0   0/2     0.0     0/0   0.0
James Turner           16    0    1    0   0   0/0     0.0     0/0   0.0
Ayo Smith               8    0    1    2   0   0/2     0.0     0/0   0.0
Jaren Rozier            8    0    3    0   0   0/0     0.0     0/0   0.0

TEAM: FG: 10/19 (52.6%), 3PT: 2/6 (33.3%), REB: 9 (1 off, 8 def), AST: 7, TO: 3
TEAM FOULS: 6 [Team_032 in BONUS]


Team_032
--------------------------------------------------------------------------------
Player                MIN  PTS  REB  AST  TO      FG   FG%      3P   3P%
--------------------------------------------------------------------------------
Jayson O'Neal           8    8    2    0   0   4/5    80.0     0/0   0.0
Anfernee Griffin        8    7    0    0   0   3/5    60.0     0/0   0.0
Tobias Bane            16    5    0    0   0   2/2   100.0     0/0   0.0
Malcolm Lillard        16    3    1    2   0   1/2    50.0     0/0   0.0
Jrue Simmons            8    3    0    1   0   1/2    50.0     0/0   0.0
Lauri Towns             8    2    4    1   0   1/2    50.0     0/0   0.0
Jalen Westbrook        16    1    0    0   0   1/2    50.0     0/0   0.0
Anfernee Butler        16    0    1    0   0   0/0     0.0     0/0   0.0
DeMar Giddey           16    0    0    1   0   0/1     0.0     0/0   0.0
Myles Herro             8    0    2    1   0   0/0     0.0     0/0   0.0

TEAM: FG: 13/21 (61.9%), 3PT: 4/8 (50.0%), REB: 10 (1 off, 9 def), AST: 6, TO: 1
TEAM FOULS: 4

================================================================================

================================================================================
                       3RD QUARTER - Team_074 vs Team_032                       
================================================================================

[12:00] Team_074 possession (Score: 51-60)
Shai Green makes the Layup and draws the foul on Jalen Westbrook! And-1! Shai Green to the line for 1. [Team fouls: 1] (Jalen Westbrook: 1 personal fouls)   FT 1/1: MISS Shai Green makes 0/1 from the line. Offensive rebound by Donovan Doncic! Donovan Doncic kicks it out.
Score: 53-60

[11:41] Team_074 possession (Score: 53-60)
Donovan Doncic attempts a Midrange. Contested by Anfernee Butler (5.2 feet, MAN). Donovan Doncic misses. Rebound secured by Anfernee Butler.

[11:28] Team_032 possession (Score: 53-60)
Tobias Bane attempts a Midrange. Contested by Donovan Doncic (2.3 feet, ZONE). Tobias Bane misses. Offensive rebound by Anfernee Butler! Anfernee Butler kicks it out.

[11:14] Team_032 possession (Score: 53-60)
Anfernee Butler drives and kicks out. Malcolm Lillard attempts a Midrange. Contested by James Turner (4.5 feet, MAN). Malcolm Lillard misses. Rebound secured by Shai Green.

[10:59] Team_074 possession (Score: 53-60)
James Turner attempts a Midrange. Wide open! Jalen Westbrook is 7.8 feet away. [ZONE] James Turner misses. Rebound secured by Tobias Bane.

[10:45] Team_032 possession (Score: 53-60)
Jalen Westbrook attempts a 3Pt. Wide open! Dwyane Quickley is 8.4 feet away. [ZONE] Jalen Westbrook misses. Rebound secured by James Turner.

[10:30] Team_074 possession (Score: 53-60)
Chris Carter attempts a 3Pt. Wide open! DeMar Giddey is 6.5 feet away. [MAN] CHRIS CARTER MAKES IT! Assist: Donovan Doncic
Score: 56-60

[10:16] Team_032 possession (Score: 56-60)
DeMar Giddey attempts a 3Pt. Wide open! Dwyane Quickley is 6.3 feet away. [ZONE] DeMar Giddey misses. Offensive rebound by Anfernee Butler! Anfernee Butler kicks it out.

[10:01] Team_032 possession (Score: 56-60)
Malcolm Lillard drives, James Turner stays with him. Malcolm Lillard attempts a Dunk. Contested by James Turner (2.4 feet, MAN). MALCOLM LILLARD MAKES IT! Assist: Anfernee Butler
Score: 56-62

[09:44] Team_074 possession (Score: 56-62)
Donovan Doncic attempts a Midrange. Heavily contested by DeMar Giddey (0.8 feet, ZONE)! Donovan Doncic misses. Rebound secured by Anfernee Butler.

[09:29] Team_032 possession (Score: 56-62)
Jalen Westbrook attempts a 3Pt. Contested by Shai Green (4.0 feet, MAN). JALEN WESTBROOK MAKES IT! Assist: Tobias Bane
Score: 56-65

[09:13] Team_074 possession (Score: 56-65)
Shai Green attempts a 3Pt. Contested by Jalen Westbrook (3.1 feet, MAN). Shai Green misses. Rebound secured by Tobias Bane.

[08:57] Team_032 possession (Score: 56-65)
FOUL! Shooting foul on Dwyane Quickley. Tobias Bane to the line for 2 free throws. [Team fouls: 1] (Dwyane Quickley: 1 personal fouls)   FT 1/2: GOOD   FT 2/2: GOOD Tobias Bane makes 2/2 from the line.
Score: 56-67

[08:39] Team_074 possession (Score: 56-67)
Shai Green attempts a Midrange. Contested by Jalen Westbrook (3.8 feet, MAN). Shai Green misses. Rebound secured by Anfernee Butler.

[08:25] Team_032 possession (Score: 56-67)
Tobias Bane attempts a Midrange. Contested by James Turner (3.6 feet, ZONE). TOBIAS BANE MAKES IT! Assist: Anfernee Butler
Score: 56-69

[08:13] Team_074 possession (Score: 56-69)
James Turner drives, picks up Malcolm Lillard. Help arrives from DeMar Giddey! James Turner attempts a Dunk. Contested by DeMar Giddey (3.0 feet, ZONE). JAMES TURNER MAKES IT! Assist: Shai Green
Score: 58-69

[07:58] Team_032 possession (Score: 58-69)
DeMar Giddey drives and kicks out. Anfernee Butler attempts a 3Pt. Wide open! Dwyane Quickley is 6.3 feet away. [ZONE] ANFERNEE BUTLER MAKES IT! Assist: Jalen Westbrook
Score: 58-72

[07:44] Team_074 possession (Score: 58-72)
Dwyane Quickley drives, Tobias Bane stays with him. Dwyane Quickley attempts a Dunk. Wide open! Tobias Bane is 6.2 feet away. [MAN] DWYANE QUICKLEY MAKES IT! Assist: Shai Green
Score: 60-72

[07:34] Team_032 possession (Score: 60-72)
DeMar Giddey drives to the basket... DeMar Giddey loses the ball! Stripped by Chris Carter! TURNOVER! (live ball)

[07:19] Team_074 possession (Score: 60-72)
Dwyane Quickley attempts a 3Pt. Contested by Tobias Bane (6.0 feet, ZONE). Dwyane Quickley misses. Rebound secured by Malcolm Lillard.

[07:05] Team_032 possession (Score: 60-72)
FOUL! Holding foul on Shai Green. [Team fouls: 2] No free throws, side out. (Shai Green: 1 personal fouls)

[06:50] Team_032 possession (Score: 60-72)
Malcolm Lillard attempts a Midrange. Wide open! Chris Carter is 7.2 feet away. [ZONE] MALCOLM LILLARD MAKES IT!
Score: 60-74

[06:32] Team_074 possession (Score: 60-74)
Chris Carter attempts a 3Pt. Wide open! Tobias Bane is 6.0 feet away. [ZONE] CHRIS CARTER MAKES IT! Assist: Dwyane Quickley
Score: 63-74

[06:16] Team_032 possession (Score: 63-74)
Tobias Bane attempts a Layup. Contested by Dwyane Quickley (4.7 feet, MAN). TOBIAS BANE MAKES IT! Assist: DeMar Giddey
Score: 63-76

[05:57] Team_074 possession (Score: 63-76)
Dwyane Quickley drives, picks up Tobias Bane. Help arrives from Jalen Westbrook! Dwyane Quickley attempts a Dunk. Heavily contested by Jalen Westbrook (0.5 feet, MAN)! DWYANE QUICKLEY MAKES IT!
Score: 65-76

[05:45] Team_032 possession (Score: 65-76)
Tobias Bane attempts a Layup. Heavily contested by Donovan Doncic (1.5 feet, ZONE)! TOBIAS BANE MAKES IT!
Score: 65-78

[05:28] Team_074 possession (Score: 65-78)
Donovan Doncic drives to the basket... Donovan Doncic throws a bad pass out of bounds! TURNOVER! (dead ball)

[05:11] Team_032 possession (Score: 65-78)
Tobias Bane attempts a 3Pt. Contested by Dwyane Quickley (3.7 feet, ZONE). TOBIAS BANE MAKES IT! Assist: Jalen Westbrook
Score: 65-81

[04:59] Team_074 possession (Score: 65-81)
Donovan Doncic attempts a Layup. Heavily contested by Anfernee Butler (0.8 feet, MAN)! DONOVAN DONCIC MAKES IT!
Score: 67-81

[04:46] Team_032 possession (Score: 67-81)
Jalen Westbrook attempts a Layup. BLOCKED BY DONOVAN DONCIC! Ball goes out off Donovan Doncic. Jalen Westbrook's ball!

[04:27] Team_032 possession (Score: 67-81)
Jalen Westbrook attempts a 3Pt. Heavily contested by Shai Green (1.6 feet, MAN)! Jalen Westbrook misses. Rebound secured by Shai Green.

[04:14] Team_074 possession (Score: 67-81)
James Turner makes the Layup and draws the foul on DeMar Giddey! And-1! James Turner to the line for 1. [Team fouls: 2] (DeMar Giddey: 1 personal fouls)   FT 1/1: GOOD James Turner makes 1/1 from the line.
Score: 70-81

[04:00] Team_032 possession (Score: 70-81)
DeMar Giddey attempts a 3Pt. Contested by Dwyane Quickley (5.3 feet, ZONE). DEMAR GIDDEY MAKES IT! Assist: Jalen Westbrook
Score: 70-84

[03:44] Team_074 possession (Score: 70-84)
Shai Green attempts a 3Pt. Contested by Anfernee Butler (3.1 feet, ZONE). Shai Green misses. Rebound secured by Anfernee Butler.

[03:25] Team_032 possession (Score: 70-84)
Tobias Bane drives, Donovan Doncic stays with him. Tobias Bane attempts a Dunk. Wide open! Donovan Doncic is 6.0 feet away. [ZONE] TOBIAS BANE MAKES IT! Assist: Anfernee Butler
Score: 70-86

[03:07] Team_074 possession (Score: 70-86)
Dwyane Quickley attempts a 3Pt. Wide open! Tobias Bane is 6.5 feet away. [ZONE] DWYANE QUICKLEY MAKES IT! Assist: Shai Green
Score: 73-86

[02:52] Team_032 possession (Score: 73-86)
Malcolm Lillard drives to the basket... Malcolm Lillard throws a bad pass! Stolen by James Turner! TURNOVER! (live ball)

[02:37] Team_074 possession (Score: 73-86)
Chris Carter attempts a 3Pt. Heavily contested by DeMar Giddey (0.9 feet, MAN)! Chris Carter misses. Rebound secured by Malcolm Lillard.

[02:23] Team_032 possession (Score: 73-86)
FOUL! Reach-in foul on Shai Green during the drive. [Team fouls: 3] No free throws, side out. (Shai Green: 2 personal fouls)

[02:08] Team_032 possession (Score: 73-86)
Malcolm Lillard attempts a Midrange. Wide open! Dwyane Quickley is 9.9 feet away. [ZONE] Malcolm Lillard misses. Rebound secured by James Turner.

[01:57] Team_074 possession (Score: 73-86)
Shai Green drives and kicks out. James Turner makes the 3Pt and draws the foul on Malcolm Lillard! And-1! James Turner to the line for 1. [Team fouls: 3] (Malcolm Lillard: 1 personal fouls)   FT 1/1: GOOD James Turner makes 1/1 from the line.
Score: 77-86

[01:47] Team_032 possession (Score: 77-86)
Tobias Bane attempts a 3Pt. Contested by Dwyane Quickley (4.2 feet, ZONE). TOBIAS BANE MAKES IT! Assist: Malcolm Lillard
Score: 77-89

[01:31] Team_074 possession (Score: 77-89)
Shai Green attempts a 3Pt. Contested by DeMar Giddey (5.0 feet, ZONE). Shai Green misses. Offensive rebound by Donovan Doncic! Donovan Doncic kicks it out.

[01:20] Team_074 possession (Score: 77-89)
James Turner drives, Malcolm Lillard stays with him. James Turner attempts a Dunk. Contested by Malcolm Lillard (4.5 feet, MAN). JAMES TURNER MAKES IT! Assist: Shai Green
Score: 79-89

[01:05] Team_032 possession (Score: 79-89)
FOUL! Shooting foul on Donovan Doncic. Tobias Bane to the line for 2 free throws. [Team fouls: 4] (Donovan Doncic: 1 personal fouls)   FT 1/2: GOOD   FT 2/2: MISS Tobias Bane makes 1/2 from the line. Rebound secured by James Turner.
Score: 79-90

[00:51] Team_074 possession (Score: 79-90)
FOUL! Reach-in foul on Malcolm Lillard during the drive. [Team fouls: 4] No free throws, side out. (Malcolm Lillard: 2 personal fouls)

[00:37] Team_074 possession (Score: 79-90)
Chris Carter throws a bad pass out of bounds! TURNOVER! (dead ball)

[00:37] Substitution (Team_074): Dwyane Quickley OUT → James Barnes IN (stamina_rule2)

[00:37] Substitution (Team_074): Chris Carter OUT → Giannis Westbrook IN (stamina_rule2)

[00:37] Substitution (Team_074): Shai Green OUT → Ayo Smith IN (stamina_rule2)

[00:37] Substitution (Team_074): Donovan Doncic OUT → Yao Randle IN (stamina_rule2)

[00:37] Substitution (Team_074): James Turner OUT → Jaren Rozier IN (stamina_rule2)

[00:37] Substitution (Team_032): Tobias Bane OUT → Anfernee Griffin IN (stamina_rule2)

[00:37] Substitution (Team_032): DeMar Giddey OUT → Myles Herro IN (stamina_rule2)

[00:37] Substitution (Team_032): Jalen Westbrook OUT → Jrue Simmons IN (stamina_rule2)

[00:37] Substitution (Team_032): Anfernee Butler OUT → Jayson O'Neal IN (stamina_rule2)

[00:37] Substitution (Team_032): Malcolm Lillard OUT → Lauri Towns IN (stamina_rule2)

[00:23] Team_032 possession (Score: 79-90)
Lauri Towns attempts a Layup. Contested by Yao Randle (3.9 feet, ZONE). Lauri Towns misses. Rebound secured by Ayo Smith.

[00:07] Team_074 possession (Score: 79-90)
Jaren Rozier drives, picks up Lauri Towns. Help arrives from Myles Herro! Jaren Rozier attempts a Dunk. Contested by Myles Herro (4.0 feet, MAN). JAREN ROZIER MAKES IT!
Score: 81-90

================================================================================
                              3RD QUARTER COMPLETE                              
================================================================================

3RD QUARTER SCORE: Team_074 30, Team_032 30

BOX SCORE:
================================================================================

Team_074
--------------------------------------------------------------------------------
Player                MIN  PTS  REB  AST  TO      FG   FG%      3P   3P%
--------------------------------------------------------------------------------
James Turner           28   11    3    0   0   4/5    80.0     0/0   0.0
Dwyane Quickley        28    7    0    1   0   3/4    75.0     0/0   0.0
Chris Carter           28    6    0    0   0   2/3    66.7     0/0   0.0
Donovan Doncic         28    2    2    1   0   1/3    33.3     0/0   0.0
Jaren Rozier            9    2    0    0   0   1/1   100.0     0/0   0.0
Shai Green             28    0    2    4   0   0/3     0.0     0/0   0.0
Ayo Smith               9    0    1    0   0   0/0     0.0     0/0   0.0

TEAM: FG: 11/19 (57.9%), 3PT: 3/7 (42.9%), REB: 8 (2 off, 6 def), AST: 6, TO: 2
TEAM FOULS: 4


Team_032
--------------------------------------------------------------------------------
Player                MIN  PTS  REB  AST  TO      FG   FG%      3P   3P%
--------------------------------------------------------------------------------
Tobias Bane            28   16    2    1   0   7/8    87.5     0/0   0.0
Malcolm Lillard        28    4    2    1   0   2/3    66.7     0/0   0.0
Anfernee Butler        28    3    6    3   0   1/2    50.0     0/0   0.0
Jalen Westbrook        28    3    0    3   0   1/3    33.3     0/0   0.0
DeMar Giddey           28    3    0    1   0   1/1   100.0     0/0   0.0
Lauri Towns             9    0    0    0   0   0/1     0.0     0/0   0.0

TEAM: FG: 12/18 (66.7%), 3PT: 4/6 (66.7%), REB: 10 (2 off, 8 def), AST: 9, TO: 2
TEAM FOULS: 4

================================================================================

================================================================================
                       4TH QUARTER - Team_074 vs Team_032                       
================================================================================

[12:00] Team_074 possession (Score: 81-90)
Shai Green drives to the basket... Shai Green loses the ball! Stripped by Jalen Westbrook! TURNOVER! (live ball)

[11:44] Team_032 possession (Score: 81-90)
Anfernee Butler loses control! Ball rolls out of bounds! TURNOVER! (dead ball)

[11:44] Substitution (Team_074): Chris Carter OUT → Giannis Westbrook IN (stamina_rule2)

[11:44] Substitution (Team_032): DeMar Giddey OUT → Myles Herro IN (stamina_rule2)

[11:44] Substitution (Team_032): Jalen Westbrook OUT → Jrue Simmons IN (stamina_rule2)

[11:44] Substitution (Team_032): Anfernee Butler OUT → Jayson O'Neal IN (stamina_rule2)

[11:27] Team_074 possession (Score: 81-90)
James Turner drives to the basket... James Turner throws a bad pass! Stolen by Malcolm Lillard! TURNOVER! (live ball)

[11:14] Team_032 possession (Score: 81-90)
FOUL! Holding foul on Shai Green. [Team fouls: 1] No free throws, side out. (Shai Green: 1 personal fouls)

[11:00] Team_032 possession (Score: 81-90)
Jayson O'Neal attempts a 3Pt. Wide open! Donovan Doncic is 8.5 feet away. [MAN] Jayson O'Neal misses. Offensive rebound by Jayson O'Neal! Jayson O'Neal puts it back in!
Score: 81-92

[10:49] Team_074 possession (Score: 81-92)
FOUL! Reach-in foul on Myles Herro during the drive. [Team fouls: 1] No free throws, side out. (Myles Herro: 1 personal fouls)

[10:36] Team_074 possession (Score: 81-92)
Donovan Doncic attempts a Layup. Wide open! Jayson O'Neal is 6.2 feet away. [ZONE] DONOVAN DONCIC MAKES IT!
Score: 83-92

[10:18] Team_032 possession (Score: 83-92)
Myles Herro drives and kicks out. Jrue Simmons attempts a 3Pt. Contested by Dwyane Quickley (3.6 feet, ZONE). JRUE SIMMONS MAKES IT! Assist: Jayson O'Neal
Score: 83-95

[10:02] Team_074 possession (Score: 83-95)
James Turner attempts a 3Pt. Wide open! Tobias Bane is 8.2 feet away. [ZONE] James Turner misses. Rebound secured by Jayson O'Neal.

[09:48] Team_032 possession (Score: 83-95)
Myles Herro attempts a 3Pt. Heavily contested by Giannis Westbrook (0.5 feet, MAN)! Myles Herro misses. Rebound secured by Donovan Doncic.

[09:30] Team_074 possession (Score: 83-95)
James Turner attempts a Layup. Heavily contested by Malcolm Lillard (2.0 feet, MAN)! JAMES TURNER MAKES IT!
Score: 85-95

[09:15] Team_032 possession (Score: 85-95)
Myles Herro attempts a Layup. Wide open! Donovan Doncic is 6.5 feet away. [ZONE] Myles Herro misses. Rebound secured by Donovan Doncic.

[09:01] Team_074 possession (Score: 85-95)
Giannis Westbrook attempts a 3Pt. Contested by Myles Herro (4.5 feet, MAN). Giannis Westbrook misses. Rebound secured by Myles Herro.

[08:42] Team_032 possession (Score: 85-95)
FOUL! Reach-in foul on Donovan Doncic during the drive. [Team fouls: 2] No free throws, side out. (Donovan Doncic: 1 personal fouls)

[08:26] Team_032 possession (Score: 85-95)
Jayson O'Neal drives and kicks out. Jayson O'Neal attempts a 3Pt. Heavily contested by Donovan Doncic (1.4 feet, MAN)! JAYSON O'NEAL MAKES IT! Assist: Myles Herro
Score: 85-98

[08:11] Team_074 possession (Score: 85-98)
Shai Green throws a bad pass! Stolen by Jrue Simmons! TURNOVER! (live ball)

[07:56] Team_032 possession (Score: 85-98)
Malcolm Lillard drives and kicks out. Jrue Simmons attempts a Midrange. Wide open! Shai Green is 8.4 feet away. [MAN] JRUE SIMMONS MAKES IT!
Score: 85-100

[07:42] Team_074 possession (Score: 85-100)
FOUL! Holding foul on Malcolm Lillard. [Team fouls: 2] No free throws, side out. (Malcolm Lillard: 1 personal fouls)

[07:29] Team_074 possession (Score: 85-100)
Donovan Doncic attempts a Midrange. Contested by Jayson O'Neal (4.6 feet, MAN). Donovan Doncic misses. Rebound secured by Malcolm Lillard.

[07:15] Team_032 possession (Score: 85-100)
Tobias Bane attempts a 3Pt. Contested by Giannis Westbrook (4.1 feet, ZONE). Tobias Bane misses. Rebound secured by Donovan Doncic.

[07:02] Team_074 possession (Score: 85-100)
Shai Green attempts a Layup. Contested by Jrue Simmons (5.3 feet, MAN). SHAI GREEN MAKES IT!
Score: 87-100

[06:48] Team_032 possession (Score: 87-100)
FOUL! Offensive foul on Jrue Simmons! Shai Green drew the charge! [Team fouls: 3] (Jrue Simmons: 1 personal fouls) TURNOVER! (dead ball)

[06:33] Team_074 possession (Score: 87-100)
FOUL! Shooting foul on Myles Herro. Dwyane Quickley to the line for 2 free throws. [Team fouls: 4] (Myles Herro: 2 personal fouls)   FT 1/2: MISS   FT 2/2: GOOD Dwyane Quickley makes 1/2 from the line.
Score: 88-100

[06:18] Team_032 possession (Score: 88-100)
Malcolm Lillard makes the Layup and draws the foul on James Turner! And-1! Malcolm Lillard to the line for 1. [Team fouls: 3] (James Turner: 1 personal fouls)   FT 1/1: GOOD Malcolm Lillard makes 1/1 from the line.
Score: 88-103

[06:04] Team_074 possession (Score: 88-103)
Dwyane Quickley drives and kicks out. Giannis Westbrook attempts a Midrange. Wide open! Myles Herro is 7.2 feet away. [MAN] GIANNIS WESTBROOK MAKES IT!
Score: 90-103

[05:50] Team_032 possession (Score: 90-103)
Malcolm Lillard attempts a Midrange. Contested by James Turner (3.2 feet, MAN). Malcolm Lillard misses. Offensive rebound by Jayson O'Neal! Jayson O'Neal puts it back in!
Score: 90-105

[05:33] Team_074 possession (Score: 90-105)
Donovan Doncic drives to the basket... FOUL! Offensive foul on Donovan Doncic! Jayson O'Neal drew the charge! [Team fouls: 4] (Donovan Doncic: 2 personal fouls) TURNOVER! (dead ball)

[05:19] Team_032 possession (Score: 90-105)
Myles Herro attempts a 3Pt. Heavily contested by Giannis Westbrook (0.5 feet, ZONE)! MYLES HERRO MAKES IT! Assist: Malcolm Lillard
Score: 90-108

[05:05] Team_074 possession (Score: 90-108)
James Turner attempts a Midrange. Wide open! Jrue Simmons is 7.9 feet away. [ZONE] JAMES TURNER MAKES IT! Assist: Donovan Doncic
Score: 92-108

[04:45] Team_032 possession (Score: 92-108)
Tobias Bane attempts a Midrange. Contested by Dwyane Quickley (4.8 feet, MAN). TOBIAS BANE MAKES IT! Assist: Myles Herro
Score: 92-110

[04:28] Team_074 possession (Score: 92-110)
FOUL! Holding foul on Myles Herro. [IN THE BONUS! 5 team fouls] Giannis Westbrook to the line for 2 free throws. (Myles Herro: 3 personal fouls)   FT 1/2: GOOD   FT 2/2: GOOD Giannis Westbrook makes 2/2 from the line.
Score: 94-110

[04:15] Team_032 possession (Score: 94-110)
Myles Herro drives and kicks out. Myles Herro attempts a 3Pt. Wide open! Giannis Westbrook is 6.6 feet away. [ZONE] Myles Herro misses. Offensive rebound by Malcolm Lillard! Malcolm Lillard kicks it out.

[03:58] Team_032 possession (Score: 94-110)
Jayson O'Neal throws a bad pass out of bounds! TURNOVER! (dead ball)

[03:58] Substitution (Team_074): Dwyane Quickley OUT → James Barnes IN (stamina_rule2)

[03:58] Substitution (Team_074): Shai Green OUT → Ayo Smith IN (stamina_rule2)

[03:58] Substitution (Team_074): Donovan Doncic OUT → Yao Randle IN (stamina_rule2)

[03:58] Substitution (Team_074): James Turner OUT → Jaren Rozier IN (stamina_rule2)

[03:58] Substitution (Team_032): Tobias Bane OUT → Anfernee Griffin IN (stamina_rule2)

[03:58] Substitution (Team_032): Malcolm Lillard OUT → Lauri Towns IN (stamina_rule2)

[03:47] Team_074 possession (Score: 94-110)
Ayo Smith attempts a Layup. Wide open! Lauri Towns is 7.8 feet away. [ZONE] AYO SMITH MAKES IT!
Score: 96-110

[03:30] Team_032 possession (Score: 96-110)
Jrue Simmons attempts a 3Pt. Contested by Ayo Smith (5.2 feet, MAN). Jrue Simmons misses. Rebound secured by Yao Randle.

[03:11] Team_074 possession (Score: 96-110)
Yao Randle drives, Lauri Towns stays with him. Yao Randle attempts a Dunk. Contested by Lauri Towns (4.4 feet, ZONE). YAO RANDLE MAKES IT! Assist: James Barnes
Score: 98-110

[02:59] Team_032 possession (Score: 98-110)
Jayson O'Neal drives and kicks out. Lauri Towns attempts a Midrange. Contested by Jaren Rozier (5.2 feet, MAN). Lauri Towns misses. Rebound secured by Jaren Rozier.

[02:41] Team_074 possession (Score: 98-110)
Yao Randle drives, Jayson O'Neal stays with him. Yao Randle attempts a Dunk. Heavily contested by Jayson O'Neal (0.5 feet, MAN)! YAO RANDLE MAKES IT!
Score: 100-110

[02:30] Team_032 possession (Score: 100-110)
Jayson O'Neal attempts a Midrange. Heavily contested by Yao Randle (0.5 feet, MAN)! Jayson O'Neal misses. FOUL! Loose ball foul on Ayo Smith during the rebound battle. [IN THE BONUS! 5 team fouls] Jayson O'Neal to the line for 2 free throws. (Ayo Smith: 1 personal fouls)   FT 1/2: GOOD   FT 2/2: GOOD Jayson O'Neal makes 2/2 from the line.
Score: 100-112

[02:16] Team_074 possession (Score: 100-112)
Jaren Rozier attempts a Midrange. Wide open! Lauri Towns is 6.4 feet away. [MAN] JAREN ROZIER MAKES IT!
Score: 102-112

[02:03] Team_032 possession (Score: 102-112)
Myles Herro drives to the basket... Myles Herro throws a bad pass out of bounds! TURNOVER! (dead ball)

[01:44] Team_074 possession (Score: 102-112)
Ayo Smith attempts a Layup. Wide open! Jrue Simmons is 7.4 feet away. [MAN] AYO SMITH MAKES IT! Assist: James Barnes
Score: 104-112

[01:28] Team_032 possession (Score: 104-112)
Anfernee Griffin loses the ball! Stripped by James Barnes! TURNOVER! (live ball)

[01:16] Team_074 possession (Score: 104-112)
Yao Randle attempts a Layup. Wide open! Lauri Towns is 10.0 feet away. [ZONE] YAO RANDLE MAKES IT! Assist: James Barnes
Score: 106-112

[01:04] Team_032 possession (Score: 106-112)
Lauri Towns drives to the basket... Lauri Towns throws a bad pass out of bounds! TURNOVER! (dead ball)

[00:50] Team_074 possession (Score: 106-112)
Yao Randle drives to the basket... Yao Randle loses control! Ball rolls out of bounds! TURNOVER! (dead ball)

[00:32] Team_032 possession (Score: 106-112)
Anfernee Griffin attempts a Layup. Contested by Yao Randle (3.1 feet, ZONE). Anfernee Griffin misses. Offensive rebound by Jayson O'Neal! Jayson O'Neal kicks it out.

[00:17] Team_032 possession (Score: 106-112)
Lauri Towns attempts a Layup. Wide open! Jaren Rozier is 7.0 feet away. [MAN] Lauri Towns misses. Rebound secured by Ayo Smith.

[00:02] Team_074 possession (Score: 106-112)
Jaren Rozier makes the Dunk and draws the foul on Myles Herro! And-1! Jaren Rozier to the line for 1. [BONUS: 6 team fouls] (Myles Herro: 4 personal fouls)   FT 1/1: GOOD Jaren Rozier makes 1/1 from the line.
Score: 109-112

================================================================================
                              4TH QUARTER COMPLETE                              
================================================================================

4TH QUARTER SCORE: Team_074 28, Team_032 22

BOX SCORE:
================================================================================

Team_074
--------------------------------------------------------------------------------
Player                MIN  PTS  REB  AST  TO      FG   FG%      3P   3P%
--------------------------------------------------------------------------------
Yao Randle             13    6    1    0   0   3/3   100.0     0/0   0.0
Jaren Rozier           13    5    1    0   0   2/2   100.0     0/0   0.0
James Turner           36    4    0    0   0   2/3    66.7     0/0   0.0
Giannis Westbrook      20    4    0    0   0   2/3    66.7     0/0   0.0
Ayo Smith              13    4    1    0   0   2/2   100.0     0/0   0.0
Donovan Doncic         36    2    3    1   0   1/2    50.0     0/0   0.0
Shai Green             36    2    0    0   0   1/1   100.0     0/0   0.0
Dwyane Quickley        36    1    0    0   0   1/1   100.0     0/0   0.0
James Barnes           13    0    0    3   0   0/0     0.0     0/0   0.0

TEAM: FG: 14/17 (82.4%), 3PT: 0/2 (0.0%), REB: 6 (0 off, 6 def), AST: 4, TO: 5
TEAM FOULS: 5 [Team_032 in BONUS]


Team_032
--------------------------------------------------------------------------------
Player                MIN  PTS  REB  AST  TO      FG   FG%      3P   3P%
--------------------------------------------------------------------------------
Jayson O'Neal          20    9    4    1   0   4/5    80.0     0/0   0.0
Jrue Simmons           20    5    0    0   0   2/3    66.7     0/0   0.0
Myles Herro            20    3    1    2   0   1/3    33.3     0/0   0.0
Malcolm Lillard        36    3    2    1   0   1/1   100.0     0/0   0.0
Tobias Bane            36    2    0    0   0   1/2    50.0     0/0   0.0
Lauri Towns            13    0    0    0   0   0/1     0.0     0/0   0.0

TEAM: FG: 9/15 (60.0%), 3PT: 2/5 (40.0%), REB: 7 (4 off, 3 def), AST: 4, TO: 6
TEAM FOULS: 6 [Team_074 in BONUS]

================================================================================

================================================================================
                               FULL GAME COMPLETE                               
================================================================================

FINAL SCORE: Team_074 109, Team_032 112

SCORING BY QUARTER:
--------------------------------------------------------------------------------
Team                     Q1     Q2     Q3     Q4    FINAL
--------------------------------------------------------------------------------
Team_074                 28     23     30     28      109
Team_032                 31     29     30     22      112
--------------------------------------------------------------------------------

FULL GAME BOX SCORE:
================================================================================

Team_074
--------------------------------------------------------------------------------
Player                MIN  PTS  REB  AST  TO      FG   FG%      3P   3P%      FT STL BLK
--------------------------------------------------------------------------------
Dwyane Quickley        36   22    0    4   1  11/13   84.6   2/3    66.7   4/6     0   0
Shai Green             36    7    4    6   3   4/10   40.0   1/6    16.7   0/1     0   0
Donovan Doncic         36   10    8    3   0   6/10   60.0   0/0     0.0   0/0     0   1
James Turner           36   25    9    2   2   8/10   80.0   0/1     0.0   4/4     1   0
Chris Carter           28    8    0    2   1   4/9    44.4   2/6    33.3   0/0     1   1
Giannis Westbrook      20    9    0    0   1   2/3    66.7   1/2    50.0   2/2     0   0
James Barnes           13    4    0    4   1   2/5    40.0   0/3     0.0   2/2     1   0
Ayo Smith              13    4    3    2   1   2/4    50.0   0/0     0.0   0/0     0   0
Yao Randle             13    9    3    0   0   4/6    66.7   1/1   100.0   0/0     1   0
Jaren Rozier           13    7    4    0   1   3/3   100.0   0/0     0.0   1/1     0   0

TEAM: FG: 47/74 (63.5%), 3PT: 7/22 (31.8%), REB: 31 (7 off, 24 def), AST: 23, TO: 11


Team_032
--------------------------------------------------------------------------------
Player                MIN  PTS  REB  AST  TO      FG   FG%      3P   3P%      FT STL BLK
--------------------------------------------------------------------------------
Tobias Bane            36   25    4    5   2  11/13   84.6   3/4    75.0   3/4     0   0
Malcolm Lillard        36   15    9    5   1   8/10   80.0   1/1   100.0   2/2     1   2
DeMar Giddey           28    6    0    3   0   3/6    50.0   2/3    66.7   0/2     0   0
Jalen Westbrook        28   16    0    4   1   7/12   58.3   1/5    20.0   7/9     1   0
Anfernee Butler        28   10   11    3   2   3/4    75.0   1/1   100.0   2/2     0   0
Myles Herro            20    3    3    3   1   2/4    50.0   1/2    50.0   0/0     0   0
Jrue Simmons           20    8    0    1   1   2/4    50.0   1/3    33.3   0/0     1   0
Jayson O'Neal          20   17    6    1   3   7/9    77.8   1/2    50.0   6/6     0   1
Anfernee Griffin       13    7    0    0   1   1/3    33.3   1/2    50.0   2/2     0   0
Lauri Towns            13    2    4    1   0   1/4    25.0   0/1     0.0   0/0     0   0

TEAM: FG: 47/71 (66.2%), 3PT: 12/24 (50.0%), REB: 37 (10 off, 27 def), AST: 26, TO: 12

================================================================================
