================================================================================
                        FULL GAME - Team_048 vs Team_087                        
================================================================================

================================================================================
                       1ST QUARTER - Team_048 vs Team_087                       
================================================================================

[12:00] Team_048 possession (Score: 0-0)
FOUL! Offensive foul on Paolo Rozier! Allen Mitchell drew the charge! [Team fouls: 1] (Paolo Rozier: 1 personal fouls) TURNOVER! (dead ball)

[11:45] Team_087 possession (Score: 0-0)
Devin Anunoby attempts a Layup. BLOCKED BY DEJOUNTE SEXTON! Ball is loose! Rebound secured by Dejounte Sexton.

[11:31] Team_048 possession (Score: 0-0)
FOUL! Shooting foul on Allen Mitchell. Paolo Rozier to the line for 3 free throws. [Team fouls: 1] (Allen Mitchell: 1 personal fouls)   FT 1/3: GOOD   FT 2/3: MISS   FT 3/3: GOOD Paolo Rozier makes 2/3 from the line.
Score: 2-0

[11:16] Team_087 possession (Score: 2-0)
Allen Mitchell attempts a Midrange. Wide open! Paolo Rozier is 6.1 feet away. [MAN] ALLEN MITCHELL MAKES IT! Assist: Jimmy Ming
Score: 2-2

[11:00] Team_048 possession (Score: 2-2)
FOUL! Shooting foul on Allen Mitchell. Karl Johnson to the line for 3 free throws. [Team fouls: 2] (Allen Mitchell: 2 personal fouls)   FT 1/3: GOOD   FT 2/3: MISS   FT 3/3: GOOD Karl Johnson makes 2/3 from the line.
Score: 4-2

[10:42] Team_087 possession (Score: 4-2)
Devin Anunoby drives and kicks out. Malcolm Embiid attempts a Midrange. Contested by Dejounte Sexton (4.0 feet, ZONE). MALCOLM EMBIID MAKES IT! Assist: Jimmy Ming
Score: 4-4

[10:25] Team_048 possession (Score: 4-4)
Damian Mobley attempts a Midrange. Heavily contested by Devin Anunoby (1.6 feet, ZONE)! DAMIAN MOBLEY MAKES IT! Assist: Dejounte Sexton
Score: 6-4

[10:16] Team_087 possession (Score: 6-4)
FOUL! Offensive foul on Allen Mitchell! Paolo Rozier drew the charge! [Team fouls: 3] (Allen Mitchell: 3 personal fouls) TURNOVER! (dead ball)

[10:03] Team_048 possession (Score: 6-4)
Dejounte Sexton attempts a Midrange. Contested by Devin Anunoby (4.4 feet, MAN). Dejounte Sexton misses. Rebound secured by Ben Brogdon.

[09:48] Team_087 possession (Score: 6-4)
Malcolm Embiid attempts a Midrange. Contested by Karl Johnson (4.8 feet, ZONE). MALCOLM EMBIID MAKES IT!
Score: 6-6

[09:32] Team_048 possession (Score: 6-6)
Dejounte Sexton attempts a Midrange. Contested by Jimmy Ming (5.7 feet, ZONE). Dejounte Sexton misses. Rebound secured by Ben Brogdon.

[09:16] Team_087 possession (Score: 6-6)
Allen Mitchell attempts a Layup. Contested by Paolo Rozier (3.7 feet, MAN). ALLEN MITCHELL MAKES IT!
Score: 6-8

[09:02] Team_048 possession (Score: 6-8)
Paolo Rozier drives and kicks out. Paolo Rozier attempts a 3Pt. Contested by Allen Mitchell (4.8 feet, ZONE). Paolo Rozier misses. Rebound secured by Malcolm Embiid.

[08:46] Team_087 possession (Score: 6-8)
Malcolm Embiid drives, picks up Kevin Fox. Help arrives from Karl Johnson! Malcolm Embiid attempts a Dunk. Contested by Karl Johnson (3.8 feet, MAN). Malcolm Embiid misses. Offensive rebound by Malcolm Embiid! Malcolm Embiid's putback is no good. Rebound secured by Dejounte Sexton.

[08:33] Team_048 possession (Score: 6-8)
Kevin Fox drives, picks up Malcolm Embiid. Help arrives from Jimmy Ming! Kevin Fox attempts a Dunk. Contested by Jimmy Ming (4.8 feet, MAN). Kevin Fox misses. FOUL! Loose ball foul on Malcolm Embiid during the rebound battle. [Team fouls: 4] No free throws, side out. (Malcolm Embiid: 1 personal fouls)

[08:14] Team_048 possession (Score: 6-8)
Dejounte Sexton commits a violation (traveling/carry)! TURNOVER! (dead ball)

[07:59] Team_087 possession (Score: 6-8)
Ben Brogdon attempts a 3Pt. Contested by Dejounte Sexton (4.0 feet, ZONE). BEN BROGDON MAKES IT! Assist: Malcolm Embiid
Score: 6-11

[07:46] Team_048 possession (Score: 6-11)
FOUL! Reach-in foul on Malcolm Embiid during the drive. [IN THE BONUS! 5 team fouls] Paolo Rozier to the line for 2 free throws. (Malcolm Embiid: 2 personal fouls)   FT 1/2: GOOD   FT 2/2: MISS Paolo Rozier makes 1/2 from the line. Rebound secured by Devin Anunoby.
Score: 7-11

[07:33] Team_087 possession (Score: 7-11)
Ben Brogdon drives and kicks out. Malcolm Embiid attempts a 3Pt. Heavily contested by Kevin Fox (0.6 feet, MAN)! Malcolm Embiid misses. Rebound secured by Kevin Fox.

[07:20] Team_048 possession (Score: 7-11)
Paolo Rozier attempts a 3Pt. Contested by Allen Mitchell (4.5 feet, ZONE). PAOLO ROZIER MAKES IT! Assist: Damian Mobley
Score: 10-11

[07:04] Team_087 possession (Score: 10-11)
Malcolm Embiid attempts a Midrange. Wide open! Kevin Fox is 6.7 feet away. [MAN] Malcolm Embiid misses. Rebound secured by Damian Mobley.

[06:46] Team_048 possession (Score: 10-11)
Karl Johnson attempts a 3Pt. Contested by Jimmy Ming (4.4 feet, MAN). Karl Johnson misses. Rebound secured by Malcolm Embiid.

[06:35] Team_087 possession (Score: 10-11)
Allen Mitchell attempts a 3Pt. Contested by Dejounte Sexton (5.8 feet, ZONE). Allen Mitchell misses. FOUL! Loose ball foul on Kevin Fox during the rebound battle. [Team fouls: 2] No free throws, side out. (Kevin Fox: 1 personal fouls)

[06:17] Team_087 possession (Score: 10-11)
Devin Anunoby attempts a Midrange. Contested by Dejounte Sexton (3.0 feet, ZONE). DEVIN ANUNOBY MAKES IT! Assist: Allen Mitchell
Score: 10-13

[06:04] Team_048 possession (Score: 10-13)
FOUL! Shooting foul on Devin Anunoby. Karl Johnson to the line for 2 free throws. [BONUS: 6 team fouls] (Devin Anunoby: 1 personal fouls)   FT 1/2: GOOD   FT 2/2: GOOD Karl Johnson makes 2/2 from the line.
Score: 12-13

[05:52] Team_087 possession (Score: 12-13)
Devin Anunoby attempts a 3Pt. Contested by Dejounte Sexton (4.3 feet, MAN). Devin Anunoby misses. Offensive rebound by Devin Anunoby! Devin Anunoby puts it back in!
Score: 12-15

[05:39] Team_048 possession (Score: 12-15)
Dejounte Sexton attempts a 3Pt. Wide open! Jimmy Ming is 7.0 feet away. [ZONE] Dejounte Sexton misses. Rebound secured by Ben Brogdon.

[05:26] Team_087 possession (Score: 12-15)
Ben Brogdon attempts a Midrange. Contested by Damian Mobley (5.4 feet, ZONE). BEN BROGDON MAKES IT! Assist: Malcolm Embiid
Score: 12-17

[05:13] Team_048 possession (Score: 12-17)
Kevin Fox makes the Dunk and draws the foul on Malcolm Embiid! And-1! Kevin Fox to the line for 1. [BONUS: 7 team fouls] (Malcolm Embiid: 3 personal fouls)   FT 1/1: GOOD Kevin Fox makes 1/1 from the line.
Score: 15-17

[05:00] Team_087 possession (Score: 15-17)
Ben Brogdon throws a bad pass! Stolen by Kevin Fox! TURNOVER! (live ball)

[04:48] Team_048 possession (Score: 15-17)
Dejounte Sexton drives, Ben Brogdon stays with him. Dejounte Sexton attempts a Dunk. Wide open! Ben Brogdon is 6.4 feet away. [ZONE] DEJOUNTE SEXTON MAKES IT! Assist: Karl Johnson
Score: 17-17

[04:34] Team_087 possession (Score: 17-17)
Ben Brogdon attempts a 3Pt. Contested by Dejounte Sexton (4.3 feet, ZONE). Ben Brogdon misses. Rebound secured by Damian Mobley.

[04:22] Team_048 possession (Score: 17-17)
Karl Johnson drives and kicks out. Dejounte Sexton attempts a Midrange. Heavily contested by Jimmy Ming (1.8 feet, ZONE)! Dejounte Sexton misses. Rebound secured by Ben Brogdon.

[04:08] Team_087 possession (Score: 17-17)
Ben Brogdon drives, picks up Kevin Fox. Help arrives from Karl Johnson! Ben Brogdon attempts a Dunk. Contested by Karl Johnson (3.8 feet, MAN). BEN BROGDON MAKES IT! Assist: Allen Mitchell
Score: 17-19

[03:51] Team_048 possession (Score: 17-19)
Dejounte Sexton attempts a Midrange. Wide open! Jimmy Ming is 6.6 feet away. [ZONE] Dejounte Sexton misses. Offensive rebound by Damian Mobley! Damian Mobley's putback is no good. Offensive rebound by Kevin Fox! Kevin Fox kicks it out.

[03:37] Team_048 possession (Score: 17-19)
Paolo Rozier attempts a 3Pt. Wide open! Allen Mitchell is 6.9 feet away. [MAN] Paolo Rozier misses. Offensive rebound by Damian Mobley! Damian Mobley's putback is no good. Offensive rebound by Kevin Fox! Kevin Fox kicks it out.

[03:24] Team_048 possession (Score: 17-19)
Damian Mobley attempts a 3Pt. Wide open! Allen Mitchell is 6.6 feet away. [ZONE] Damian Mobley misses. Offensive rebound by Kevin Fox! Kevin Fox kicks it out.

[03:06] Team_048 possession (Score: 17-19)
Kevin Fox drives to the basket... Kevin Fox loses control! Ball rolls out of bounds! TURNOVER! (dead ball)

[03:06] Substitution (Team_048): Karl Johnson OUT → Yao Booker IN (stamina_rule2)

[03:06] Substitution (Team_087): Ben Brogdon OUT → Kristaps Young IN (stamina_rule2)

[02:55] Team_087 possession (Score: 17-19)
Kristaps Young attempts a Midrange. Wide open! Yao Booker is 6.1 feet away. [ZONE] Kristaps Young misses. Rebound secured by Kevin Fox.

[02:41] Team_048 possession (Score: 17-19)
Damian Mobley makes the Layup and draws the foul on Kristaps Young! And-1! Damian Mobley to the line for 1. [BONUS: 9 team fouls] (Kristaps Young: 1 personal fouls)   FT 1/1: GOOD Damian Mobley makes 1/1 from the line.
Score: 20-19

[02:24] Team_087 possession (Score: 20-19)
Kristaps Young attempts a Midrange. Contested by Yao Booker (4.1 feet, ZONE). KRISTAPS YOUNG MAKES IT!
Score: 20-21

[02:10] Team_048 possession (Score: 20-21)
Kevin Fox attempts a Layup. Contested by Malcolm Embiid (2.4 feet, MAN). KEVIN FOX MAKES IT! Assist: Damian Mobley
Score: 22-21

[01:56] Team_087 possession (Score: 22-21)
Jimmy Ming drives, picks up Kevin Fox. Help arrives from Paolo Rozier! Jimmy Ming attempts a Layup. Contested by Paolo Rozier (3.3 feet, ZONE). JIMMY MING MAKES IT!
Score: 22-23

[01:46] Team_048 possession (Score: 22-23)
Yao Booker attempts a 3Pt. Wide open! Jimmy Ming is 6.7 feet away. [MAN] YAO BOOKER MAKES IT! Assist: Damian Mobley
Score: 25-23

[01:27] Team_087 possession (Score: 25-23)
FOUL! Reach-in foul on Kevin Fox during the drive. [Team fouls: 3] No free throws, side out. (Kevin Fox: 2 personal fouls)

[01:12] Team_087 possession (Score: 25-23)
Devin Anunoby attempts a Layup. BLOCKED BY DEJOUNTE SEXTON! Ball is loose! Rebound secured by Dejounte Sexton.

[00:53] Team_048 possession (Score: 25-23)
Damian Mobley drives, Kristaps Young stays with him. Damian Mobley attempts a Dunk. Contested by Kristaps Young (4.2 feet, ZONE). DAMIAN MOBLEY MAKES IT! Assist: Dejounte Sexton
Score: 27-23

[00:39] Team_087 possession (Score: 27-23)
Allen Mitchell attempts a Layup. BLOCKED BY KEVIN FOX! Ball is loose! Rebound secured by Dejounte Sexton.

[00:26] Team_048 possession (Score: 27-23)
FOUL! Reach-in foul on Devin Anunoby during the drive. [IN THE BONUS! 10 team fouls] Dejounte Sexton to the line for 2 free throws. (Devin Anunoby: 2 personal fouls)   FT 1/2: GOOD   FT 2/2: GOOD Dejounte Sexton makes 2/2 from the line.
Score: 29-23

[00:12] Team_087 possession (Score: 29-23)
Allen Mitchell attempts a 3Pt. Contested by Dejounte Sexton (5.5 feet, ZONE). Allen Mitchell misses. Rebound secured by Kevin Fox.

================================================================================
                              1ST QUARTER COMPLETE                              
================================================================================

1ST QUARTER SCORE: Team_048 29, Team_087 23

BOX SCORE:
================================================================================

Team_048
--------------------------------------------------------------------------------
Player                MIN  PTS  REB  AST  TO      FG   FG%      3P   3P%
--------------------------------------------------------------------------------
Damian Mobley          12    7    2    3   0   3/3   100.0     0/0   0.0
Paolo Rozier           12    5    0    0   0   2/4    50.0     0/0   0.0
Kevin Fox              12    5    7    0   0   2/2   100.0     0/0   0.0
Dejounte Sexton        12    4    4    2   0   2/5    40.0     0/0   0.0
Karl Johnson            9    4    0    1   0   2/4    50.0     0/0   0.0
Yao Booker              3    3    0    0   0   1/1   100.0     0/0   0.0

TEAM: FG: 12/19 (63.2%), 3PT: 4/6 (66.7%), REB: 12 (4 off, 8 def), AST: 6, TO: 3
TEAM FOULS: 3


Team_087
--------------------------------------------------------------------------------
Player                MIN  PTS  REB  AST  TO      FG   FG%      3P   3P%
--------------------------------------------------------------------------------
Ben Brogdon             9    7    4    0   0   3/5    60.0     0/0   0.0
Devin Anunoby          12    4    3    0   0   2/4    50.0     0/0   0.0
Allen Mitchell         12    4    0    2   0   2/4    50.0     0/0   0.0
Malcolm Embiid         12    4    2    2   0   2/4    50.0     0/0   0.0
Jimmy Ming             12    2    0    2   0   1/1   100.0     0/0   0.0
Kristaps Young          3    2    0    0   0   1/2    50.0     0/0   0.0

TEAM: FG: 11/20 (55.0%), 3PT: 2/4 (50.0%), REB: 10 (3 off, 7 def), AST: 6, TO: 2
TEAM FOULS: 10 [Team_048 in BONUS]

================================================================================

================================================================================
                       2ND QUARTER - Team_048 vs Team_087                       
================================================================================

[12:00] Team_048 possession (Score: 29-23)
Kevin Fox attempts a 3Pt. Contested by Allen Mitchell (5.3 feet, ZONE). Kevin Fox misses. FOUL! Loose ball foul on Ben Brogdon during the rebound battle. [Team fouls: 1] No free throws, side out. (Ben Brogdon: 1 personal fouls)

[11:47] Team_048 possession (Score: 29-23)
Kevin Fox attempts a 3Pt. Wide open! Allen Mitchell is 6.2 feet away. [ZONE] KEVIN FOX MAKES IT! Assist: Karl Johnson
Score: 32-23

[11:34] Team_087 possession (Score: 32-23)
Allen Mitchell attempts a Layup. Contested by Kevin Fox (3.9 feet, ZONE). Allen Mitchell misses. Rebound secured by Kevin Fox.

[11:21] Team_048 possession (Score: 32-23)
Damian Mobley drives to the basket... Damian Mobley loses the ball! Stripped by Malcolm Embiid! TURNOVER! (live ball)

[11:10] Team_087 possession (Score: 32-23)
Allen Mitchell attempts a 3Pt. Contested by Dejounte Sexton (5.2 feet, ZONE). Allen Mitchell misses. Rebound secured by Kevin Fox.

[10:58] Team_048 possession (Score: 32-23)
Kevin Fox attempts a 3Pt. Contested by Malcolm Embiid (5.9 feet, ZONE). KEVIN FOX MAKES IT! Assist: Karl Johnson
Score: 35-23

[10:44] Team_087 possession (Score: 35-23)
Allen Mitchell attempts a 3Pt. Contested by Dejounte Sexton (3.7 feet, ZONE). Allen Mitchell misses. Rebound secured by Dejounte Sexton.

[10:32] Team_048 possession (Score: 35-23)
Paolo Rozier attempts a 3Pt. Contested by Allen Mitchell (5.9 feet, MAN). Paolo Rozier misses. Offensive rebound by Damian Mobley! Damian Mobley puts it back in!
Score: 37-23

[10:20] Team_087 possession (Score: 37-23)
Malcolm Embiid makes the Layup and draws the foul on Kevin Fox! And-1! Malcolm Embiid to the line for 1. [Team fouls: 1] (Kevin Fox: 1 personal fouls)   FT 1/1: GOOD Malcolm Embiid makes 1/1 from the line.
Score: 37-26

[10:06] Team_048 possession (Score: 37-26)
Kevin Fox attempts a 3Pt. Wide open! Jimmy Ming is 10.0 feet away. [ZONE] Kevin Fox misses. Rebound secured by Devin Anunoby.

[09:47] Team_087 possession (Score: 37-26)
Jimmy Ming attempts a Midrange. Contested by Karl Johnson (5.1 feet, MAN). Jimmy Ming misses. Rebound secured by Kevin Fox.

[09:33] Team_048 possession (Score: 37-26)
Paolo Rozier drives and kicks out. Dejounte Sexton attempts a Midrange. Contested by Devin Anunoby (3.3 feet, MAN). DEJOUNTE SEXTON MAKES IT!
Score: 39-26

[09:17] Team_087 possession (Score: 39-26)
Ben Brogdon drives, Kevin Fox stays with him. Ben Brogdon attempts a Layup. Contested by Kevin Fox (3.0 feet, ZONE). Ben Brogdon misses. Rebound secured by Dejounte Sexton.

[09:03] Team_048 possession (Score: 39-26)
Karl Johnson attempts a Midrange. Wide open! Jimmy Ming is 6.2 feet away. [ZONE] KARL JOHNSON MAKES IT! Assist: Damian Mobley
Score: 41-26

[08:49] Team_087 possession (Score: 41-26)
Jimmy Ming attempts a Layup. Contested by Karl Johnson (3.4 feet, MAN). JIMMY MING MAKES IT! Assist: Allen Mitchell
Score: 41-28

[08:32] Team_048 possession (Score: 41-28)
Dejounte Sexton attempts a 3Pt. Wide open! Allen Mitchell is 6.8 feet away. [ZONE] DEJOUNTE SEXTON MAKES IT! Assist: Damian Mobley
Score: 44-28

[08:16] Team_087 possession (Score: 44-28)
Jimmy Ming attempts a 3Pt. Wide open! Karl Johnson is 6.4 feet away. [MAN] Jimmy Ming misses. Offensive rebound by Malcolm Embiid! Malcolm Embiid kicks it out.

[08:01] Team_087 possession (Score: 44-28)
Jimmy Ming attempts a 3Pt. Contested by Karl Johnson (4.2 feet, MAN). Jimmy Ming misses. Offensive rebound by Malcolm Embiid! Malcolm Embiid kicks it out.

[07:45] Team_087 possession (Score: 44-28)
Jimmy Ming attempts a 3Pt. Wide open! Karl Johnson is 7.1 feet away. [MAN] JIMMY MING MAKES IT! Assist: Allen Mitchell
Score: 44-31

[07:31] Team_048 possession (Score: 44-31)
Dejounte Sexton attempts a 3Pt. Wide open! Allen Mitchell is 7.5 feet away. [ZONE] Dejounte Sexton misses. Rebound secured by Malcolm Embiid.

[07:19] Team_087 possession (Score: 44-31)
Ben Brogdon attempts a 3Pt. Wide open! Dejounte Sexton is 6.5 feet away. [ZONE] BEN BROGDON MAKES IT!
Score: 44-34

[07:07] Team_048 possession (Score: 44-34)
FOUL! Reach-in foul on Malcolm Embiid during the drive. [Team fouls: 2] No free throws, side out. (Malcolm Embiid: 1 personal fouls)

[06:50] Team_048 possession (Score: 44-34)
Paolo Rozier attempts a Midrange. Contested by Malcolm Embiid (3.1 feet, ZONE). Paolo Rozier misses. Rebound secured by Ben Brogdon.

[06:35] Team_087 possession (Score: 44-34)
Malcolm Embiid drives to the basket... FOUL! Offensive foul on Malcolm Embiid! Kevin Fox drew the charge! [Team fouls: 3] (Malcolm Embiid: 2 personal fouls) TURNOVER! (dead ball)

[06:17] Team_048 possession (Score: 44-34)
FOUL! Shooting foul on Malcolm Embiid. Paolo Rozier to the line for 2 free throws. [Team fouls: 4] (Malcolm Embiid: 3 personal fouls)   FT 1/2: GOOD   FT 2/2: GOOD Paolo Rozier makes 2/2 from the line.
Score: 46-34

[06:05] Team_087 possession (Score: 46-34)
Malcolm Embiid drives and kicks out. Devin Anunoby attempts a Midrange. Contested by Dejounte Sexton (5.0 feet, MAN). DEVIN ANUNOBY MAKES IT! Assist: Ben Brogdon
Score: 46-36

[05:50] Team_048 possession (Score: 46-36)
Damian Mobley attempts a Midrange. Wide open! Ben Brogdon is 9.5 feet away. [MAN] DAMIAN MOBLEY MAKES IT!
Score: 48-36

[05:34] Team_087 possession (Score: 48-36)
Jimmy Ming drives and kicks out. Devin Anunoby attempts a 3Pt. Contested by Dejounte Sexton (2.3 feet, MAN). Devin Anunoby misses. Rebound secured by Kevin Fox.

[05:20] Team_048 possession (Score: 48-36)
Dejounte Sexton attempts a 3Pt. Contested by Allen Mitchell (3.9 feet, ZONE). Dejounte Sexton misses. Rebound secured by Malcolm Embiid.

[05:07] Team_087 possession (Score: 48-36)
Devin Anunoby attempts a Layup. Wide open! Dejounte Sexton is 6.1 feet away. [MAN] Devin Anunoby misses. Offensive rebound by Malcolm Embiid! Malcolm Embiid kicks it out.

[04:56] Team_087 possession (Score: 48-36)
Devin Anunoby attempts a 3Pt. Wide open! Dejounte Sexton is 7.4 feet away. [MAN] DEVIN ANUNOBY MAKES IT! Assist: Ben Brogdon
Score: 48-39

[04:45] Team_048 possession (Score: 48-39)
Karl Johnson makes the Dunk and draws the foul on Devin Anunoby! And-1! Karl Johnson to the line for 1. [BONUS: 5 team fouls] (Devin Anunoby: 1 personal fouls)   FT 1/1: GOOD Karl Johnson makes 1/1 from the line.
Score: 51-39

[04:35] Team_087 possession (Score: 51-39)
FOUL! Shooting foul on Kevin Fox. Devin Anunoby to the line for 2 free throws. [Team fouls: 2] (Kevin Fox: 2 personal fouls)   FT 1/2: GOOD   FT 2/2: GOOD Devin Anunoby makes 2/2 from the line.
Score: 51-41

[04:22] Team_048 possession (Score: 51-41)
Dejounte Sexton drives, Devin Anunoby stays with him. Dejounte Sexton attempts a Dunk. Contested by Devin Anunoby (5.2 feet, MAN). DEJOUNTE SEXTON MAKES IT! Assist: Karl Johnson
Score: 53-41

[04:10] Team_087 possession (Score: 53-41)
Ben Brogdon drives and kicks out. Ben Brogdon attempts a 3Pt. Contested by Dejounte Sexton (4.8 feet, ZONE). Ben Brogdon misses. Rebound secured by Damian Mobley.

[03:54] Team_048 possession (Score: 53-41)
Kevin Fox attempts a Midrange. Wide open! Malcolm Embiid is 9.1 feet away. [MAN] KEVIN FOX MAKES IT!
Score: 55-41

[03:36] Team_087 possession (Score: 55-41)
Jimmy Ming attempts a 3Pt. Wide open! Dejounte Sexton is 7.3 feet away. [ZONE] Jimmy Ming misses. Rebound secured by Damian Mobley.

[03:26] Team_048 possession (Score: 55-41)
Paolo Rozier attempts a Layup. Contested by Allen Mitchell (3.8 feet, MAN). PAOLO ROZIER MAKES IT! Assist: Damian Mobley
Score: 57-41

[03:12] Team_087 possession (Score: 57-41)
Devin Anunoby throws a bad pass out of bounds! TURNOVER! (dead ball)

[03:12] Substitution (Team_048): Paolo Rozier OUT → Lauri Curry IN (stamina_rule2)

[03:12] Substitution (Team_048): Karl Johnson OUT → Yao Booker IN (stamina_rule2)

[03:12] Substitution (Team_048): Dejounte Sexton OUT → Kyle Irving IN (stamina_rule2)

[03:12] Substitution (Team_048): Kevin Fox OUT → DeMar Hyland IN (stamina_rule2)

[03:12] Substitution (Team_048): Damian Mobley OUT → Gary Giddey IN (stamina_rule2)

[03:12] Substitution (Team_087): Allen Mitchell OUT → Wendell Haliburton IN (stamina_rule2)

[03:12] Substitution (Team_087): Jimmy Ming OUT → Ben Lillard IN (stamina_rule2)

[03:12] Substitution (Team_087): Devin Anunoby OUT → Larry Green IN (stamina_rule2)

[03:12] Substitution (Team_087): Malcolm Embiid OUT → Pau Russell IN (stamina_rule2)

[03:12] Substitution (Team_087): Ben Brogdon OUT → Kristaps Young IN (stamina_rule2)

[03:00] Team_048 possession (Score: 57-41)
Lauri Curry attempts a Midrange. Wide open! Wendell Haliburton is 6.2 feet away. [ZONE] LAURI CURRY MAKES IT! Assist: DeMar Hyland
Score: 59-41

[02:46] Team_087 possession (Score: 59-41)
Kristaps Young attempts a Layup. Contested by DeMar Hyland (2.8 feet, ZONE). Kristaps Young misses. Offensive rebound by Larry Green! Larry Green kicks it out.

[02:36] Team_087 possession (Score: 59-41)
Ben Lillard makes the Dunk and draws the foul on Lauri Curry! And-1! Ben Lillard to the line for 1. [Team fouls: 3] (Lauri Curry: 1 personal fouls)   FT 1/1: GOOD Ben Lillard makes 1/1 from the line.
Score: 59-44

[02:25] Team_048 possession (Score: 59-44)
Kyle Irving attempts a 3Pt. Contested by Pau Russell (5.3 feet, ZONE). Kyle Irving misses. Rebound secured by Pau Russell.

[02:08] Team_087 possession (Score: 59-44)
Ben Lillard attempts a Midrange. Contested by Kyle Irving (4.2 feet, ZONE). Ben Lillard misses. Offensive rebound by Larry Green! Larry Green kicks it out.

[01:54] Team_087 possession (Score: 59-44)
Kristaps Young drives, DeMar Hyland stays with him. Kristaps Young attempts a Dunk. Contested by DeMar Hyland (2.2 feet, MAN). Kristaps Young misses. Rebound secured by Kyle Irving.

[01:41] Team_048 possession (Score: 59-44)
FOUL! Holding foul on Kristaps Young. [IN THE BONUS! 6 team fouls] Gary Giddey to the line for 2 free throws. (Kristaps Young: 1 personal fouls)   FT 1/2: GOOD   FT 2/2: GOOD Gary Giddey makes 2/2 from the line.
Score: 61-44

[01:26] Team_087 possession (Score: 61-44)
Pau Russell drives and kicks out. Larry Green attempts a 3Pt. Wide open! Kyle Irving is 6.9 feet away. [MAN] Larry Green misses. Rebound secured by Kyle Irving.

[01:10] Team_048 possession (Score: 61-44)
FOUL! Reach-in foul on Kristaps Young during the drive. [IN THE BONUS! 7 team fouls] DeMar Hyland to the line for 2 free throws. (Kristaps Young: 2 personal fouls)   FT 1/2: GOOD   FT 2/2: MISS DeMar Hyland makes 1/2 from the line. Rebound secured by Larry Green.
Score: 62-44

[00:53] Team_087 possession (Score: 62-44)
Ben Lillard attempts a 3Pt. Contested by DeMar Hyland (4.8 feet, ZONE). Ben Lillard misses. Rebound secured by Kyle Irving.

[00:39] Team_048 possession (Score: 62-44)
Kyle Irving attempts a Layup. Wide open! Kristaps Young is 6.3 feet away. [ZONE] Kyle Irving misses. Offensive rebound by Kyle Irving! Kyle Irving puts it back in!
Score: 64-44

[00:20] Team_087 possession (Score: 64-44)
Kristaps Young drives and kicks out. Larry Green attempts a 3Pt. Contested by DeMar Hyland (3.9 feet, ZONE). Larry Green misses. Rebound secured by Kyle Irving.

[00:07] Team_048 possession (Score: 64-44)
Yao Booker attempts a Midrange. Wide open! Ben Lillard is 6.8 feet away. [MAN] YAO BOOKER MAKES IT!
Score: 66-44

================================================================================
                              2ND QUARTER COMPLETE                              
================================================================================

2ND QUARTER SCORE: Team_048 37, Team_087 21

BOX SCORE:
================================================================================

Team_048
--------------------------------------------------------------------------------
Player                MIN  PTS  REB  AST  TO      FG   FG%      3P   3P%
--------------------------------------------------------------------------------
Kevin Fox              21    8    5    0   0   3/4    75.0     0/0   0.0
Dejounte Sexton        21    7    2    0   0   3/5    60.0     0/0   0.0
Karl Johnson           18    5    0    3   0   2/2   100.0     0/0   0.0
Damian Mobley          21    4    3    3   0   2/2   100.0     0/0   0.0
Paolo Rozier           21    4    0    0   0   2/3    66.7     0/0   0.0
Lauri Curry             3    2    0    0   0   1/1   100.0     0/0   0.0
Kyle Irving             3    2    5    0   0   1/2    50.0     0/0   0.0
Gary Giddey             3    2    0    0   0   1/1   100.0     0/0   0.0
Yao Booker              6    2    0    0   0   1/1   100.0     0/0   0.0
DeMar Hyland            3    0    0    1   0   0/1     0.0     0/0   0.0

TEAM: FG: 16/22 (72.7%), 3PT: 4/8 (50.0%), REB: 15 (3 off, 12 def), AST: 7, TO: 1
TEAM FOULS: 3


Team_087
--------------------------------------------------------------------------------
Player                MIN  PTS  REB  AST  TO      FG   FG%      3P   3P%
--------------------------------------------------------------------------------
Devin Anunoby          21    7    1    0   0   3/3   100.0     0/0   0.0
Jimmy Ming             21    5    0    0   0   2/5    40.0     0/0   0.0
Malcolm Embiid         21    3    5    0   0   1/1   100.0     0/0   0.0
Ben Brogdon            18    3    1    2   0   1/3    33.3     0/0   0.0
Ben Lillard             3    3    0    0   0   1/2    50.0     0/0   0.0
Allen Mitchell         21    0    0    2   0   0/3     0.0     0/0   0.0
Larry Green             3    0    3    0   0   0/0     0.0     0/0   0.0
Pau Russell             3    0    1    0   0   0/1     0.0     0/0   0.0
Kristaps Young          6    0    0    0   0   0/2     0.0     0/0   0.0

TEAM: FG: 8/20 (40.0%), 3PT: 3/7 (42.9%), REB: 11 (5 off, 6 def), AST: 4, TO: 2
TEAM FOULS: 7 [Team_048 in BONUS]

================================================================================

================================================================================
                       3RD QUARTER - Team_048 vs Team_087                       
================================================================================

[12:00] Team_048 possession (Score: 66-44)
Kevin Fox throws a bad pass! Stolen by Malcolm Embiid! TURNOVER! (live ball)

[11:44] Team_087 possession (Score: 66-44)
Jimmy Ming drives and kicks out. Malcolm Embiid attempts a 3Pt. Contested by Dejounte Sexton (3.1 feet, ZONE). Malcolm Embiid misses. Rebound secured by Damian Mobley.

[11:33] Team_048 possession (Score: 66-44)
FOUL! Reach-in foul on Malcolm Embiid during the drive. [Team fouls: 1] No free throws, side out. (Malcolm Embiid: 1 personal fouls)

[11:17] Team_048 possession (Score: 66-44)
Dejounte Sexton attempts a Midrange. Contested by Devin Anunoby (5.6 feet, MAN). Dejounte Sexton misses. Rebound secured by Ben Brogdon.

[11:01] Team_087 possession (Score: 66-44)
Malcolm Embiid drives and kicks out. Malcolm Embiid attempts a Midrange. Contested by Kevin Fox (3.7 feet, MAN). Malcolm Embiid misses. Offensive rebound by Malcolm Embiid! Malcolm Embiid puts it back in!
Score: 66-46

[10:47] Team_048 possession (Score: 66-46)
Karl Johnson commits a violation (traveling/carry)! TURNOVER! (dead ball)

[10:32] Team_087 possession (Score: 66-46)
Malcolm Embiid attempts a Midrange. BLOCKED BY KEVIN FOX! Ball deflects out of bounds off Malcolm Embiid.

[10:20] Team_048 possession (Score: 66-46)
Damian Mobley makes the Layup and draws the foul on Malcolm Embiid! And-1! Damian Mobley to the line for 1. [Team fouls: 2] (Malcolm Embiid: 2 personal fouls)   FT 1/1: GOOD Damian Mobley makes 1/1 from the line.
Score: 69-46

[10:08] Team_087 possession (Score: 69-46)
Ben Brogdon attempts a Midrange. Heavily contested by Karl Johnson (1.7 feet, ZONE)! BEN BROGDON MAKES IT! Assist: Malcolm Embiid
Score: 69-48

[09:58] Team_048 possession (Score: 69-48)
Damian Mobley attempts a Layup. Contested by Malcolm Embiid (4.4 feet, MAN). DAMIAN MOBLEY MAKES IT! Assist: Paolo Rozier
Score: 71-48

[09:40] Team_087 possession (Score: 71-48)
Devin Anunoby drives, Kevin Fox stays with him. Devin Anunoby attempts a Dunk. Contested by Kevin Fox (2.2 feet, ZONE). DEVIN ANUNOBY MAKES IT! Assist: Malcolm Embiid
Score: 71-50

[09:28] Team_048 possession (Score: 71-50)
Kevin Fox attempts a Layup. Heavily contested by Malcolm Embiid (0.5 feet, ZONE)! Kevin Fox misses. Offensive rebound by Kevin Fox! Kevin Fox kicks it out.

[09:15] Team_048 possession (Score: 71-50)
Paolo Rozier attempts a 3Pt. Contested by Allen Mitchell (5.4 feet, ZONE). PAOLO ROZIER MAKES IT! Assist: Damian Mobley
Score: 74-50

[09:04] Team_087 possession (Score: 74-50)
Jimmy Ming makes the Dunk and draws the foul on Dejounte Sexton! And-1! Jimmy Ming to the line for 1. [Team fouls: 1] (Dejounte Sexton: 1 personal fouls)   FT 1/1: GOOD Jimmy Ming makes 1/1 from the line.
Score: 74-53

[08:51] Team_048 possession (Score: 74-53)
Paolo Rozier attempts a 3Pt. Wide open! Allen Mitchell is 8.0 feet away. [MAN] PAOLO ROZIER MAKES IT! Assist: Karl Johnson
Score: 77-53

[08:36] Team_087 possession (Score: 77-53)
Jimmy Ming attempts a 3Pt. Wide open! Karl Johnson is 6.1 feet away. [MAN] Jimmy Ming misses. FOUL! Loose ball foul on Damian Mobley during the rebound battle. [Team fouls: 2] No free throws, side out. (Damian Mobley: 1 personal fouls)

[08:23] Team_087 possession (Score: 77-53)
FOUL! Shooting foul on Kevin Fox. Ben Brogdon to the line for 2 free throws. [Team fouls: 3] (Kevin Fox: 1 personal fouls)   FT 1/2: GOOD   FT 2/2: GOOD Ben Brogdon makes 2/2 from the line.
Score: 77-55

[08:11] Team_048 possession (Score: 77-55)
Dejounte Sexton drives to the basket... Dejounte Sexton commits a violation (traveling/carry)! TURNOVER! (dead ball)

[07:59] Team_087 possession (Score: 77-55)
Malcolm Embiid attempts a 3Pt. Contested by Dejounte Sexton (3.5 feet, ZONE). Malcolm Embiid misses. Rebound secured by Dejounte Sexton.

[07:44] Team_048 possession (Score: 77-55)
FOUL! Reach-in foul on Malcolm Embiid during the drive. [Team fouls: 3] No free throws, side out. (Malcolm Embiid: 3 personal fouls)

[07:30] Team_048 possession (Score: 77-55)
FOUL! Reach-in foul on Malcolm Embiid during the drive. [Team fouls: 4] No free throws, side out. (Malcolm Embiid: 4 personal fouls)

[07:15] Team_048 possession (Score: 77-55)
Dejounte Sexton attempts a 3Pt. Contested by Devin Anunoby (4.2 feet, MAN). DEJOUNTE SEXTON MAKES IT!
Score: 80-55

[07:00] Team_087 possession (Score: 80-55)
Devin Anunoby drives, picks up Dejounte Sexton. Help arrives from Karl Johnson! Devin Anunoby attempts a Layup. Contested by Karl Johnson (3.8 feet, MAN). Devin Anunoby misses. Offensive rebound by Malcolm Embiid! Malcolm Embiid's putback is no good. Offensive rebound by Devin Anunoby! Devin Anunoby kicks it out.

[06:48] Team_087 possession (Score: 80-55)
Jimmy Ming attempts a Midrange. Wide open! Karl Johnson is 6.0 feet away. [MAN] Jimmy Ming misses. Rebound secured by Kevin Fox.

[06:32] Team_048 possession (Score: 80-55)
Damian Mobley throws a bad pass out of bounds! TURNOVER! (dead ball)

[06:14] Team_087 possession (Score: 80-55)
Malcolm Embiid attempts a 3Pt. Heavily contested by Dejounte Sexton (0.5 feet, ZONE)! Malcolm Embiid misses. Rebound secured by Damian Mobley.

[05:58] Team_048 possession (Score: 80-55)
Paolo Rozier drives, Malcolm Embiid stays with him. Paolo Rozier attempts a Dunk. Contested by Malcolm Embiid (4.0 feet, ZONE). Paolo Rozier misses. Offensive rebound by Kevin Fox! Kevin Fox kicks it out.

[05:47] Team_048 possession (Score: 80-55)
FOUL! Offensive foul on Karl Johnson! Jimmy Ming drew the charge! [Team fouls: 5] (Karl Johnson: 1 personal fouls) TURNOVER! (dead ball)

[05:32] Team_087 possession (Score: 80-55)
Malcolm Embiid drives, Kevin Fox stays with him. Malcolm Embiid attempts a Layup. Contested by Kevin Fox (2.7 feet, MAN). MALCOLM EMBIID MAKES IT! Assist: Ben Brogdon
Score: 80-57

[05:15] Team_048 possession (Score: 80-57)
Damian Mobley drives, Malcolm Embiid stays with him. Damian Mobley attempts a Dunk. Contested by Malcolm Embiid (4.7 feet, ZONE). DAMIAN MOBLEY MAKES IT! Assist: Karl Johnson
Score: 82-57

[05:04] Team_087 possession (Score: 82-57)
Allen Mitchell drives and kicks out. Ben Brogdon attempts a Midrange. Heavily contested by Kevin Fox (1.6 feet, ZONE)! Ben Brogdon misses. Rebound secured by Damian Mobley.

[04:52] Team_048 possession (Score: 82-57)
Paolo Rozier attempts a 3Pt. Contested by Allen Mitchell (4.2 feet, MAN). Paolo Rozier misses. Offensive rebound by Damian Mobley! Damian Mobley puts it back in!
Score: 84-57

[04:39] Team_087 possession (Score: 84-57)
FOUL! Reach-in foul on Kevin Fox during the drive. [IN THE BONUS! 6 team fouls] Devin Anunoby to the line for 2 free throws. (Kevin Fox: 2 personal fouls)   FT 1/2: MISS   FT 2/2: GOOD Devin Anunoby makes 1/2 from the line.
Score: 84-58

[04:25] Team_048 possession (Score: 84-58)
FOUL! Holding foul on Jimmy Ming. [IN THE BONUS! 5 team fouls] Karl Johnson to the line for 2 free throws. (Jimmy Ming: 1 personal fouls)   FT 1/2: GOOD   FT 2/2: GOOD Karl Johnson makes 2/2 from the line.
Score: 86-58

[04:13] Team_087 possession (Score: 86-58)
Ben Brogdon drives and kicks out. Devin Anunoby attempts a Midrange. Contested by Damian Mobley (2.4 feet, ZONE). DEVIN ANUNOBY MAKES IT!
Score: 86-60

[03:59] Team_048 possession (Score: 86-60)
Kevin Fox attempts a Midrange. Contested by Malcolm Embiid (4.6 feet, ZONE). KEVIN FOX MAKES IT!
Score: 88-60

[03:45] Team_087 possession (Score: 88-60)
FOUL! Shooting foul on Kevin Fox. Malcolm Embiid to the line for 2 free throws. [BONUS: 7 team fouls] (Kevin Fox: 3 personal fouls)   FT 1/2: GOOD   FT 2/2: GOOD Malcolm Embiid makes 2/2 from the line.
Score: 88-62

[03:28] Team_048 possession (Score: 88-62)
Dejounte Sexton attempts a 3Pt. Contested by Devin Anunoby (5.0 feet, MAN). DEJOUNTE SEXTON MAKES IT! Assist: Kevin Fox
Score: 91-62

[03:14] Team_087 possession (Score: 91-62)
Ben Brogdon attempts a Midrange. Wide open! Paolo Rozier is 7.5 feet away. [ZONE] BEN BROGDON MAKES IT! Assist: Allen Mitchell
Score: 91-64

[02:59] Team_048 possession (Score: 91-64)
FOUL! Holding foul on Allen Mitchell. [IN THE BONUS! 6 team fouls] Paolo Rozier to the line for 2 free throws. (Allen Mitchell: 1 personal fouls)   FT 1/2: MISS   FT 2/2: GOOD Paolo Rozier makes 1/2 from the line.
Score: 92-64

[02:44] Team_087 possession (Score: 92-64)
Allen Mitchell attempts a Midrange. Contested by Karl Johnson (5.5 feet, ZONE). ALLEN MITCHELL MAKES IT! Assist: Ben Brogdon
Score: 92-66

[02:27] Team_048 possession (Score: 92-66)
Karl Johnson attempts a 3Pt. Contested by Jimmy Ming (5.2 feet, MAN). Karl Johnson misses. Rebound secured by Malcolm Embiid.

[02:10] Team_087 possession (Score: 92-66)
Allen Mitchell attempts a 3Pt. Heavily contested by Dejounte Sexton (1.4 feet, ZONE)! ALLEN MITCHELL MAKES IT! Assist: Ben Brogdon
Score: 92-69

[01:54] Team_048 possession (Score: 92-69)
Kevin Fox attempts a 3Pt. Contested by Malcolm Embiid (4.9 feet, MAN). KEVIN FOX MAKES IT! Assist: Paolo Rozier
Score: 95-69

[01:39] Team_087 possession (Score: 95-69)
Ben Brogdon drives to the basket... Ben Brogdon commits a violation (traveling/carry)! TURNOVER! (dead ball)

[01:39] Substitution (Team_048): Paolo Rozier OUT → Lauri Curry IN (stamina_rule2)

[01:39] Substitution (Team_048): Karl Johnson OUT → Yao Booker IN (stamina_rule2)

[01:39] Substitution (Team_048): Dejounte Sexton OUT → Kyle Irving IN (stamina_rule2)

[01:39] Substitution (Team_048): Kevin Fox OUT → DeMar Hyland IN (stamina_rule2)

[01:39] Substitution (Team_048): Damian Mobley OUT → Gary Giddey IN (stamina_rule2)

[01:39] Substitution (Team_087): Allen Mitchell OUT → Wendell Haliburton IN (stamina_rule2)

[01:39] Substitution (Team_087): Jimmy Ming OUT → Ben Lillard IN (stamina_rule2)

[01:39] Substitution (Team_087): Devin Anunoby OUT → Larry Green IN (stamina_rule2)

[01:39] Substitution (Team_087): Malcolm Embiid OUT → Pau Russell IN (stamina_rule2)

[01:39] Substitution (Team_087): Ben Brogdon OUT → Kristaps Young IN (stamina_rule2)

[01:23] Team_048 possession (Score: 95-69)
Gary Giddey drives, Kristaps Young stays with him. Gary Giddey attempts a Dunk. Contested by Kristaps Young (4.7 feet, ZONE). GARY GIDDEY MAKES IT! Assist: Lauri Curry
Score: 97-69

[01:10] Team_087 possession (Score: 97-69)
Ben Lillard attempts a 3Pt. Contested by DeMar Hyland (4.5 feet, ZONE). BEN LILLARD MAKES IT! Assist: Larry Green
Score: 97-72

[00:54] Team_048 possession (Score: 97-72)
FOUL! Holding foul on Ben Lillard. [IN THE BONUS! 7 team fouls] Yao Booker to the line for 2 free throws. (Ben Lillard: 1 personal fouls)   FT 1/2: GOOD   FT 2/2: GOOD Yao Booker makes 2/2 from the line.
Score: 99-72

[00:40] Team_087 possession (Score: 99-72)
Larry Green drives, Kyle Irving stays with him. Larry Green attempts a Dunk. Contested by Kyle Irving (4.3 feet, MAN). LARRY GREEN MAKES IT!
Score: 99-74

[00:28] Team_048 possession (Score: 99-74)
Lauri Curry drives, picks up Kristaps Young. Help arrives from Ben Lillard! Lauri Curry attempts a Layup. Heavily contested by Ben Lillard (1.6 feet, ZONE)! Lauri Curry misses. Offensive rebound by Kyle Irving! Kyle Irving puts it back in!
Score: 101-74

[00:15] Team_087 possession (Score: 101-74)
Ben Lillard loses control! Ball rolls out of bounds! TURNOVER! (dead ball)

================================================================================
                              3RD QUARTER COMPLETE                              
================================================================================

3RD QUARTER SCORE: Team_048 35, Team_087 30

BOX SCORE:
================================================================================

Team_048
--------------------------------------------------------------------------------
Player                MIN  PTS  REB  AST  TO      FG   FG%      3P   3P%
--------------------------------------------------------------------------------
Damian Mobley          32    9    4    1   0   4/4   100.0     0/0   0.0
Paolo Rozier           32    7    0    2   0   3/3   100.0     0/0   0.0
Dejounte Sexton        32    6    1    0   0   2/3    66.7     0/0   0.0
Kevin Fox              32    5    3    1   0   2/2   100.0     0/0   0.0
Karl Johnson           29    2    0    2   0   1/2    50.0     0/0   0.0
Gary Giddey             5    2    0    0   0   1/1   100.0     0/0   0.0
Yao Booker              8    2    0    0   0   1/1   100.0     0/0   0.0
Kyle Irving             5    2    1    0   0   1/1   100.0     0/0   0.0
Lauri Curry             5    0    0    1   0   0/0     0.0     0/0   0.0

TEAM: FG: 15/17 (88.2%), 3PT: 6/7 (85.7%), REB: 9 (4 off, 5 def), AST: 7, TO: 5
TEAM FOULS: 7 [Team_087 in BONUS]


Team_087
--------------------------------------------------------------------------------
Player                MIN  PTS  REB  AST  TO      FG   FG%      3P   3P%
--------------------------------------------------------------------------------
Ben Brogdon            29    6    1    3   0   3/3   100.0     0/0   0.0
Malcolm Embiid         32    6    3    2   0   3/6    50.0     0/0   0.0
Devin Anunoby          32    5    1    0   0   3/3   100.0     0/0   0.0
Allen Mitchell         32    5    0    1   0   2/3    66.7     0/0   0.0
Jimmy Ming             32    3    0    0   0   1/3    33.3     0/0   0.0
Ben Lillard             5    3    0    0   0   1/1   100.0     0/0   0.0
Larry Green             5    2    0    1   0   1/1   100.0     0/0   0.0

TEAM: FG: 14/20 (70.0%), 3PT: 2/4 (50.0%), REB: 5 (3 off, 2 def), AST: 7, TO: 2
TEAM FOULS: 7 [Team_048 in BONUS]

================================================================================

================================================================================
                       4TH QUARTER - Team_048 vs Team_087                       
================================================================================

[12:00] Team_048 possession (Score: 101-74)
Karl Johnson drives and kicks out. Paolo Rozier attempts a 3Pt. Contested by Allen Mitchell (2.9 feet, MAN). Paolo Rozier misses. Rebound secured by Devin Anunoby.

[11:44] Team_087 possession (Score: 101-74)
Malcolm Embiid attempts a 3Pt. Contested by Dejounte Sexton (2.7 feet, ZONE). Malcolm Embiid misses. Rebound secured by Damian Mobley.

[11:33] Team_048 possession (Score: 101-74)
Paolo Rozier drives, Malcolm Embiid stays with him. Paolo Rozier attempts a Dunk. Heavily contested by Malcolm Embiid (0.5 feet, ZONE)! PAOLO ROZIER MAKES IT! Assist: Kevin Fox
Score: 103-74

[11:22] Team_087 possession (Score: 103-74)
Ben Brogdon attempts a Midrange. BLOCKED BY KEVIN FOX! Ball goes out off Kevin Fox. Ben Brogdon's ball!

[11:03] Team_087 possession (Score: 103-74)
Devin Anunoby drives and kicks out. Devin Anunoby attempts a Midrange. Contested by Kevin Fox (5.5 feet, ZONE). Devin Anunoby misses. Rebound secured by Dejounte Sexton.

[10:52] Team_048 possession (Score: 103-74)
Karl Johnson drives and kicks out. Dejounte Sexton attempts a Midrange. Contested by Jimmy Ming (5.0 feet, ZONE). DEJOUNTE SEXTON MAKES IT! Assist: Karl Johnson
Score: 105-74

[10:35] Team_087 possession (Score: 105-74)
Devin Anunoby throws a bad pass! Stolen by Dejounte Sexton! TURNOVER! (live ball)

[10:18] Team_048 possession (Score: 105-74)
Kevin Fox commits a violation (traveling/carry)! TURNOVER! (dead ball)

[10:18] Substitution (Team_048): Paolo Rozier OUT → Lauri Curry IN (stamina_rule2)

[10:18] Substitution (Team_048): Karl Johnson OUT → Yao Booker IN (stamina_rule2)

[10:18] Substitution (Team_048): Kevin Fox OUT → DeMar Hyland IN (stamina_rule2)

[10:18] Substitution (Team_048): Damian Mobley OUT → Gary Giddey IN (stamina_rule2)

[10:18] Substitution (Team_087): Devin Anunoby OUT → Larry Green IN (stamina_rule2)

[10:18] Substitution (Team_087): Malcolm Embiid OUT → Pau Russell IN (stamina_rule2)

[10:18] Substitution (Team_087): Ben Brogdon OUT → Kristaps Young IN (stamina_rule2)

[10:04] Team_087 possession (Score: 105-74)
Larry Green drives to the basket... Larry Green commits a violation (traveling/carry)! TURNOVER! (dead ball)

[09:45] Team_048 possession (Score: 105-74)
Lauri Curry drives, picks up Allen Mitchell. Help arrives from Larry Green! Lauri Curry attempts a Layup. Heavily contested by Larry Green (1.0 feet, MAN)! LAURI CURRY MAKES IT!
Score: 107-74

[09:32] Team_087 possession (Score: 107-74)
Kristaps Young attempts a Midrange. Contested by DeMar Hyland (5.0 feet, MAN). KRISTAPS YOUNG MAKES IT! Assist: Jimmy Ming
Score: 107-76

[09:16] Team_048 possession (Score: 107-76)
DeMar Hyland drives to the basket... DeMar Hyland throws a bad pass out of bounds! TURNOVER! (dead ball)

[09:16] Substitution (Team_048): Dejounte Sexton OUT → Kyle Irving IN (stamina_rule2)

[09:16] Substitution (Team_087): Allen Mitchell OUT → Wendell Haliburton IN (stamina_rule2)

[09:16] Substitution (Team_087): Jimmy Ming OUT → Ben Lillard IN (stamina_rule2)

[09:03] Team_087 possession (Score: 107-76)
Wendell Haliburton attempts a Midrange. Wide open! DeMar Hyland is 6.4 feet away. [ZONE] Wendell Haliburton misses. Rebound secured by Gary Giddey.

[08:51] Team_048 possession (Score: 107-76)
Gary Giddey attempts a Layup. Contested by Kristaps Young (4.3 feet, MAN). Gary Giddey misses. Offensive rebound by DeMar Hyland! DeMar Hyland kicks it out.

[08:36] Team_048 possession (Score: 107-76)
DeMar Hyland attempts a 3Pt. Wide open! Pau Russell is 6.5 feet away. [ZONE] DeMar Hyland misses. Offensive rebound by Kyle Irving! Kyle Irving's putback is no good. Rebound secured by Pau Russell.

[08:22] Team_087 possession (Score: 107-76)
Larry Green attempts a Layup. Contested by DeMar Hyland (5.1 feet, ZONE). LARRY GREEN MAKES IT! Assist: Wendell Haliburton
Score: 107-78

[08:05] Team_048 possession (Score: 107-78)
Kyle Irving throws a bad pass out of bounds! TURNOVER! (dead ball)

[07:49] Team_087 possession (Score: 107-78)
Kristaps Young attempts a Layup. Contested by DeMar Hyland (5.4 feet, MAN). KRISTAPS YOUNG MAKES IT! Assist: Larry Green
Score: 107-80

[07:37] Team_048 possession (Score: 107-80)
FOUL! Reach-in foul on Kristaps Young during the drive. [Team fouls: 1] No free throws, side out. (Kristaps Young: 1 personal fouls)

[07:17] Team_048 possession (Score: 107-80)
Lauri Curry attempts a Midrange. Wide open! Wendell Haliburton is 8.3 feet away. [MAN] Lauri Curry misses. Offensive rebound by Kyle Irving! Kyle Irving's putback is no good. Rebound secured by Kristaps Young.

[07:01] Team_087 possession (Score: 107-80)
Kristaps Young drives and kicks out. Kristaps Young attempts a 3Pt. Contested by DeMar Hyland (4.0 feet, MAN). Kristaps Young misses. Offensive rebound by Larry Green! Larry Green kicks it out.

[06:46] Team_087 possession (Score: 107-80)
FOUL! Reach-in foul on Yao Booker during the drive. [Team fouls: 1] No free throws, side out. (Yao Booker: 1 personal fouls)

[06:35] Team_087 possession (Score: 107-80)
Wendell Haliburton attempts a 3Pt. Contested by DeMar Hyland (3.9 feet, ZONE). WENDELL HALIBURTON MAKES IT! Assist: Ben Lillard
Score: 107-83

[06:23] Team_048 possession (Score: 107-83)
FOUL! Holding foul on Wendell Haliburton. [Team fouls: 2] No free throws, side out. (Wendell Haliburton: 1 personal fouls)

[06:10] Team_048 possession (Score: 107-83)
DeMar Hyland attempts a 3Pt. Wide open! Pau Russell is 9.8 feet away. [ZONE] DeMar Hyland misses. Rebound secured by Kristaps Young.

[05:54] Team_087 possession (Score: 107-83)
Larry Green drives, Kyle Irving stays with him. Larry Green attempts a Dunk. Heavily contested by Kyle Irving (1.6 feet, MAN)! Larry Green misses. Offensive rebound by Kristaps Young! Kristaps Young puts it back in!
Score: 107-85

[05:41] Team_048 possession (Score: 107-85)
Kyle Irving attempts a 3Pt. Wide open! Larry Green is 6.2 feet away. [MAN] Kyle Irving misses. Rebound secured by Kristaps Young.

[05:25] Team_087 possession (Score: 107-85)
Ben Lillard attempts a 3Pt. Contested by Yao Booker (4.9 feet, MAN). Ben Lillard misses. Rebound secured by Kyle Irving.

[05:13] Team_048 possession (Score: 107-85)
Gary Giddey makes the Layup and draws the foul on Kristaps Young! And-1! Gary Giddey to the line for 1. [Team fouls: 3] (Kristaps Young: 2 personal fouls)   FT 1/1: GOOD Gary Giddey makes 1/1 from the line.
Score: 110-85

[05:02] Team_087 possession (Score: 110-85)
Ben Lillard attempts a Midrange. Contested by Yao Booker (5.3 feet, MAN). Ben Lillard misses. Rebound secured by DeMar Hyland.

[04:47] Team_048 possession (Score: 110-85)
Lauri Curry attempts a 3Pt. Contested by Pau Russell (5.1 feet, ZONE). LAURI CURRY MAKES IT! Assist: DeMar Hyland
Score: 113-85

[04:33] Team_087 possession (Score: 113-85)
Kristaps Young drives, picks up DeMar Hyland. Help arrives from Lauri Curry! Kristaps Young attempts a Layup. Heavily contested by Lauri Curry (0.5 feet, ZONE)! Kristaps Young misses. Rebound secured by Kyle Irving.

[04:15] Team_048 possession (Score: 113-85)
Kyle Irving drives, Kristaps Young stays with him. Kyle Irving attempts a Layup. Contested by Kristaps Young (2.4 feet, ZONE). KYLE IRVING MAKES IT! Assist: Yao Booker
Score: 115-85

[04:04] Team_087 possession (Score: 115-85)
Ben Lillard attempts a 3Pt. Wide open! DeMar Hyland is 6.2 feet away. [ZONE] Ben Lillard misses. Rebound secured by Gary Giddey.

[03:48] Team_048 possession (Score: 115-85)
Lauri Curry attempts a 3Pt. Wide open! Pau Russell is 7.0 feet away. [ZONE] Lauri Curry misses. FOUL! Loose ball foul on Larry Green during the rebound battle. [Team fouls: 4] No free throws, side out. (Larry Green: 1 personal fouls)

[03:33] Team_048 possession (Score: 115-85)
DeMar Hyland attempts a 3Pt. Contested by Pau Russell (6.0 feet, MAN). DeMar Hyland misses. FOUL! Loose ball foul on Larry Green during the rebound battle. [IN THE BONUS! 5 team fouls] DeMar Hyland to the line for 2 free throws. (Larry Green: 2 personal fouls)   FT 1/2: GOOD   FT 2/2: GOOD DeMar Hyland makes 2/2 from the line.
Score: 117-85

[03:22] Team_087 possession (Score: 117-85)
Ben Lillard drives, picks up DeMar Hyland. Help arrives from Lauri Curry! Ben Lillard attempts a Dunk. Heavily contested by Lauri Curry (0.5 feet, ZONE)! Ben Lillard misses. Rebound secured by DeMar Hyland.

[03:06] Team_048 possession (Score: 117-85)
Lauri Curry drives, Kristaps Young stays with him. Lauri Curry attempts a Dunk. Wide open! Kristaps Young is 6.9 feet away. [ZONE] LAURI CURRY MAKES IT! Assist: DeMar Hyland
Score: 119-85

[02:55] Team_087 possession (Score: 119-85)
Kristaps Young attempts a Midrange. Contested by DeMar Hyland (5.6 feet, ZONE). Kristaps Young misses. Rebound secured by Gary Giddey.

[02:44] Team_048 possession (Score: 119-85)
Kyle Irving makes the Layup and draws the foul on Larry Green! And-1! Kyle Irving to the line for 1. [BONUS: 6 team fouls] (Larry Green: 3 personal fouls)   FT 1/1: GOOD Kyle Irving makes 1/1 from the line.
Score: 122-85

[02:28] Team_087 possession (Score: 122-85)
Larry Green drives and kicks out. Ben Lillard attempts a 3Pt. Heavily contested by DeMar Hyland (1.6 feet, ZONE)! Ben Lillard misses. Rebound secured by DeMar Hyland.

[02:12] Team_048 possession (Score: 122-85)
FOUL! Reach-in foul on Kristaps Young during the drive. [IN THE BONUS! 7 team fouls] Gary Giddey to the line for 2 free throws. (Kristaps Young: 3 personal fouls)   FT 1/2: GOOD   FT 2/2: GOOD Gary Giddey makes 2/2 from the line.
Score: 124-85

[02:00] Team_087 possession (Score: 124-85)
Pau Russell attempts a Midrange. Heavily contested by DeMar Hyland (1.8 feet, MAN)! Pau Russell misses. Rebound secured by DeMar Hyland.

[01:42] Team_048 possession (Score: 124-85)
Yao Booker attempts a 3Pt. Wide open! Pau Russell is 7.6 feet away. [ZONE] Yao Booker misses. Rebound secured by Kristaps Young.

[01:27] Team_087 possession (Score: 124-85)
Ben Lillard loses control! Ball rolls out of bounds! TURNOVER! (dead ball)

[01:13] Team_048 possession (Score: 124-85)
FOUL! Holding foul on Kristaps Young. [IN THE BONUS! 8 team fouls] Gary Giddey to the line for 2 free throws. (Kristaps Young: 4 personal fouls)   FT 1/2: MISS   FT 2/2: GOOD Gary Giddey makes 1/2 from the line.
Score: 125-85

[01:02] Team_087 possession (Score: 125-85)
Pau Russell drives to the basket... Pau Russell throws a bad pass out of bounds! TURNOVER! (dead ball)

[00:48] Team_048 possession (Score: 125-85)
Lauri Curry attempts a 3Pt. Wide open! Pau Russell is 6.8 feet away. [ZONE] Lauri Curry misses. Rebound secured by Pau Russell.

[00:31] Team_087 possession (Score: 125-85)
FOUL! Offensive foul on Kristaps Young! DeMar Hyland drew the charge! [Team fouls: 9] (Kristaps Young: 5 personal fouls) TURNOVER! (dead ball)

[00:19] Team_048 possession (Score: 125-85)
Lauri Curry attempts a 3Pt. Wide open! Pau Russell is 6.6 feet away. [ZONE] Lauri Curry misses. Rebound secured by Kristaps Young.

[00:05] Team_087 possession (Score: 125-85)
Larry Green attempts a 3Pt. Wide open! Kyle Irving is 7.1 feet away. [MAN] Larry Green misses. Offensive rebound by Kristaps Young! Kristaps Young kicks it out.

================================================================================
                              4TH QUARTER COMPLETE                              
================================================================================

4TH QUARTER SCORE: Team_048 24, Team_087 11

BOX SCORE:
================================================================================

Team_048
--------------------------------------------------------------------------------
Player                MIN  PTS  REB  AST  TO      FG   FG%      3P   3P%
--------------------------------------------------------------------------------
Lauri Curry            15    7    0    0   0   3/6    50.0     0/0   0.0
Gary Giddey            15    6    3    0   0   3/3   100.0     0/0   0.0
Kyle Irving            14    5    3    0   0   2/3    66.7     0/0   0.0
Paolo Rozier           34    2    0    0   0   1/1   100.0     0/0   0.0
Dejounte Sexton        35    2    1    0   0   1/1   100.0     0/0   0.0
DeMar Hyland           15    2    5    2   0   1/3    33.3     0/0   0.0
Karl Johnson           31    0    0    1   0   0/1     0.0     0/0   0.0
Damian Mobley          34    0    1    0   0   0/0     0.0     0/0   0.0
Kevin Fox              34    0    0    1   0   0/0     0.0     0/0   0.0
Yao Booker             18    0    0    1   0   0/1     0.0     0/0   0.0

TEAM: FG: 11/19 (57.9%), 3PT: 2/8 (25.0%), REB: 15 (4 off, 11 def), AST: 5, TO: 3
TEAM FOULS: 1


Team_087
--------------------------------------------------------------------------------
Player                MIN  PTS  REB  AST  TO      FG   FG%      3P   3P%
--------------------------------------------------------------------------------
Kristaps Young         18    6    7    0   0   3/5    60.0     0/0   0.0
Wendell Haliburton     14    3    0    1   0   1/2    50.0     0/0   0.0
Larry Green            15    2    1    1   0   1/2    50.0     0/0   0.0
Devin Anunoby          34    0    1    0   0   0/1     0.0     0/0   0.0
Malcolm Embiid         34    0    0    0   0   0/1     0.0     0/0   0.0
Jimmy Ming             35    0    0    1   0   0/0     0.0     0/0   0.0
Pau Russell            15    0    2    0   0   0/1     0.0     0/0   0.0
Ben Lillard            14    0    0    1   0   0/4     0.0     0/0   0.0

TEAM: FG: 5/16 (31.2%), 3PT: 1/4 (25.0%), REB: 9 (3 off, 6 def), AST: 4, TO: 5
TEAM FOULS: 9 [Team_048 in BONUS]

================================================================================

================================================================================
                               FULL GAME COMPLETE                               
================================================================================

FINAL SCORE: Team_048 125, Team_087 85

SCORING BY QUARTER:
--------------------------------------------------------------------------------
Team                     Q1     Q2     Q3     Q4    FINAL
--------------------------------------------------------------------------------
Team_048                 29     37     35     24      125
Team_087                 23     21     30     11       85
--------------------------------------------------------------------------------

FULL GAME BOX SCORE:
================================================================================

Team_048
--------------------------------------------------------------------------------
Player                MIN  PTS  REB  AST  TO      FG   FG%      3P   3P%      FT STL BLK
--------------------------------------------------------------------------------
Dejounte Sexton        35   19    8    2   1   6/12   50.0   3/6    50.0   2/2     1   2
Paolo Rozier           34   18    0    2   2  10/13   76.9   6/6   100.0   6/9     0   0
Kevin Fox              34   18   15    2   2   7/8    87.5   3/4    75.0   1/1     1   3
Damian Mobley          34   20   10    7   3   7/7   100.0   0/0     0.0   2/2     0   0
Karl Johnson           31   11    0    7   2   5/9    55.6   1/3    33.3   7/8     0   0
Yao Booker             18    7    0    1   0   2/3    66.7   1/2    50.0   2/2     0   0
Lauri Curry            15    9    0    1   1   5/8    62.5   1/3    33.3   0/0     0   0
DeMar Hyland           15    2    5    3   0   1/4    25.0   1/3    33.3   3/4     0   0
Gary Giddey            15   10    3    0   0   3/3   100.0   0/0     0.0   6/7     0   0
Kyle Irving            14    9    9    0   1   3/5    60.0   0/2     0.0   1/1     0   0

TEAM: FG: 54/77 (70.1%), 3PT: 16/29 (55.2%), REB: 51 (15 off, 36 def), AST: 25, TO: 12


Team_087
--------------------------------------------------------------------------------
Player                MIN  PTS  REB  AST  TO      FG   FG%      3P   3P%      FT STL BLK
--------------------------------------------------------------------------------
Allen Mitchell         35    9    0    5   1   4/10   40.0   1/4    25.0   0/0     0   0
Jimmy Ming             35   10    0    3   1   4/9    44.4   1/2    50.0   1/1     0   0
Devin Anunoby          34   16    6    0   2   7/10   70.0   2/2   100.0   3/4     0   0
Malcolm Embiid         34   13   10    4   1   6/12   50.0   0/3     0.0   3/3     2   0
Ben Brogdon            31   16    6    5   1   8/12   66.7   2/3    66.7   2/2     0   0
Kristaps Young         18    8    7    0   1   3/8    37.5   0/0     0.0   0/0     0   0
Larry Green            15    4    4    2   0   3/4    75.0   0/0     0.0   0/0     0   0
Pau Russell            15    0    3    0   2   0/2     0.0   0/0     0.0   0/0     0   0
Wendell Haliburton     14    3    0    1   0   1/2    50.0   1/1   100.0   0/0     0   0
Ben Lillard            14    6    0    1   2   2/7    28.6   1/4    25.0   1/1     0   0

TEAM: FG: 38/76 (50.0%), 3PT: 8/19 (42.1%), REB: 35 (14 off, 21 def), AST: 21, TO: 11

================================================================================
