================================================================================
                        FULL GAME - Team_085 vs Team_050                        
================================================================================

================================================================================
                       1ST QUARTER - Team_085 vs Team_050                       
================================================================================

[12:00] Team_085 possession (Score: 0-0)
Stephen Bird attempts a Layup. Contested by Donovan Trent (3.9 feet, ZONE). STEPHEN BIRD MAKES IT! Assist: Collin Mobley
Score: 2-0

[11:45] Team_050 possession (Score: 2-0)
Donovan Trent attempts a Midrange. Contested by Stephen Bird (3.8 feet, ZONE). DONOVAN TRENT MAKES IT!
Score: 2-2

[11:29] Team_085 possession (Score: 2-2)
Stephen Bird attempts a 3Pt. Contested by Joel Banchero (5.5 feet, MAN). Stephen Bird misses. Rebound secured by Joel Banchero.

[11:18] Team_050 possession (Score: 2-2)
Joel Banchero attempts a Midrange. Contested by Stephen Bird (2.7 feet, MAN). JOEL BANCHERO MAKES IT!
Score: 2-4

[11:03] Team_085 possession (Score: 2-4)
Stephen Bird attempts a Layup. BLOCKED BY COLLIN BANE! Ball is loose! Offensive rebound by Paul Wagner! Paul Wagner kicks it out.

[10:49] Team_085 possession (Score: 2-4)
FOUL! Reach-in foul on Donovan Trent during the drive. [Team fouls: 1] No free throws, side out. (Donovan Trent: 1 personal fouls)

[10:34] Team_085 possession (Score: 2-4)
Collin Mobley throws a bad pass out of bounds! TURNOVER! (dead ball)

[10:21] Team_050 possession (Score: 2-4)
FOUL! Offensive foul on Donovan Trent! Collin Mobley drew the charge! [Team fouls: 2] (Donovan Trent: 2 personal fouls) TURNOVER! (dead ball)

[10:06] Team_085 possession (Score: 2-4)
Collin Mobley attempts a Layup. Contested by Donovan Trent (3.7 feet, MAN). Collin Mobley misses. Rebound secured by Joel Banchero.

[09:51] Team_050 possession (Score: 2-4)
Joel Banchero attempts a 3Pt. Contested by Stephen Bird (3.7 feet, MAN). JOEL BANCHERO MAKES IT! Assist: Collin Bane
Score: 2-7

[09:36] Team_085 possession (Score: 2-7)
Collin Mobley drives and kicks out. Magic Beal attempts a 3Pt. Wide open! Giannis LaVine is 7.4 feet away. [MAN] MAGIC BEAL MAKES IT! Assist: Collin Mobley
Score: 5-7

[09:26] Team_050 possession (Score: 5-7)
Joel Banchero attempts a Midrange. Contested by Larry Duncan (2.6 feet, ZONE). Joel Banchero misses. Rebound secured by Larry Duncan.

[09:09] Team_085 possession (Score: 5-7)
Larry Duncan attempts a 3Pt. Contested by Collin Bane (3.2 feet, MAN). Larry Duncan misses. Offensive rebound by Paul Wagner! Paul Wagner kicks it out.

[08:52] Team_085 possession (Score: 5-7)
Stephen Bird attempts a Layup. Contested by LeBron Bridges (5.1 feet, ZONE). STEPHEN BIRD MAKES IT!
Score: 7-7

[08:42] Team_050 possession (Score: 7-7)
Giannis LaVine attempts a 3Pt. Wide open! Magic Beal is 7.0 feet away. [MAN] Giannis LaVine misses. Rebound secured by Paul Wagner.

[08:27] Team_085 possession (Score: 7-7)
Stephen Bird attempts a 3Pt. Contested by Giannis LaVine (4.0 feet, ZONE). Stephen Bird misses. Rebound secured by Collin Bane.

[08:13] Team_050 possession (Score: 7-7)
LeBron Bridges drives, picks up Paul Wagner. Help arrives from Magic Beal! LeBron Bridges attempts a Layup. Heavily contested by Magic Beal (1.1 feet, MAN)! LEBRON BRIDGES MAKES IT! Assist: Joel Banchero
Score: 7-9

[07:53] Team_085 possession (Score: 7-9)
Larry Duncan attempts a 3Pt. Wide open! Collin Bane is 6.1 feet away. [MAN] Larry Duncan misses. Rebound secured by Collin Bane.

[07:38] Team_050 possession (Score: 7-9)
Collin Bane attempts a Layup. Heavily contested by Larry Duncan (0.5 feet, MAN)! COLLIN BANE MAKES IT! Assist: LeBron Bridges
Score: 7-11

[07:23] Team_085 possession (Score: 7-11)
Paul Wagner drives and kicks out. Stephen Bird makes the Midrange and draws the foul on Joel Banchero! And-1! Stephen Bird to the line for 1. [Team fouls: 3] (Joel Banchero: 1 personal fouls)   FT 1/1: MISS Stephen Bird makes 0/1 from the line. Rebound secured by Collin Bane.
Score: 9-11

[07:05] Team_050 possession (Score: 9-11)
FOUL! Reach-in foul on Paul Wagner during the drive. [Team fouls: 1] No free throws, side out. (Paul Wagner: 1 personal fouls)

[06:48] Team_050 possession (Score: 9-11)
Giannis LaVine attempts a 3Pt. Wide open! Paul Wagner is 6.0 feet away. [ZONE] Giannis LaVine misses. Offensive rebound by Collin Bane! Collin Bane kicks it out.

[06:35] Team_050 possession (Score: 9-11)
FOUL! Holding foul on Paul Wagner. [Team fouls: 2] No free throws, side out. (Paul Wagner: 2 personal fouls)

[06:16] Team_050 possession (Score: 9-11)
Giannis LaVine attempts a Layup. BLOCKED BY MAGIC BEAL! Ball is loose! Rebound secured by Larry Duncan.

[05:58] Team_085 possession (Score: 9-11)
Stephen Bird attempts a 3Pt. Contested by Joel Banchero (4.3 feet, MAN). Stephen Bird misses. Rebound secured by Collin Bane.

[05:45] Team_050 possession (Score: 9-11)
Joel Banchero drives, Paul Wagner stays with him. Joel Banchero attempts a Layup. Contested by Paul Wagner (2.1 feet, ZONE). Joel Banchero misses. Rebound secured by Larry Duncan.

[05:32] Team_085 possession (Score: 9-11)
Magic Beal drives and kicks out. Collin Mobley attempts a 3Pt. Contested by Giannis LaVine (5.2 feet, ZONE). Collin Mobley misses. Rebound secured by LeBron Bridges.

[05:15] Team_050 possession (Score: 9-11)
Donovan Trent attempts a Midrange. Contested by Collin Mobley (3.9 feet, MAN). Donovan Trent misses. Rebound secured by Larry Duncan.

[04:58] Team_085 possession (Score: 9-11)
Larry Duncan attempts a 3Pt. Wide open! Collin Bane is 6.1 feet away. [MAN] Larry Duncan misses. Rebound secured by Joel Banchero.

[04:40] Team_050 possession (Score: 9-11)
LeBron Bridges drives, Paul Wagner stays with him. LeBron Bridges attempts a Layup. Heavily contested by Paul Wagner (1.0 feet, MAN)! LeBron Bridges misses. Rebound secured by Collin Mobley.

[04:30] Team_085 possession (Score: 9-11)
Collin Mobley attempts a Midrange. Wide open! Donovan Trent is 7.2 feet away. [ZONE] Collin Mobley misses. Rebound secured by Collin Bane.

[04:16] Team_050 possession (Score: 9-11)
Giannis LaVine attempts a 3Pt. Contested by Magic Beal (5.8 feet, MAN). GIANNIS LAVINE MAKES IT! Assist: LeBron Bridges
Score: 9-14

[04:07] Team_085 possession (Score: 9-14)
Stephen Bird attempts a 3Pt. Contested by Giannis LaVine (4.6 feet, ZONE). STEPHEN BIRD MAKES IT! Assist: Larry Duncan
Score: 12-14

[03:51] Team_050 possession (Score: 12-14)
FOUL! Offensive foul on Collin Bane! Larry Duncan drew the charge! [Team fouls: 4] (Collin Bane: 1 personal fouls) TURNOVER! (dead ball)

[03:39] Team_085 possession (Score: 12-14)
Larry Duncan drives to the basket... Larry Duncan loses the ball! Stripped by Collin Bane! TURNOVER! (live ball)

[03:26] Team_050 possession (Score: 12-14)
Collin Bane drives, Larry Duncan stays with him. Collin Bane attempts a Dunk. Contested by Larry Duncan (2.8 feet, MAN). Collin Bane misses. Rebound secured by Collin Mobley.

[03:11] Team_085 possession (Score: 12-14)
Larry Duncan throws a bad pass! Stolen by Collin Bane! TURNOVER! (live ball)

[02:52] Team_050 possession (Score: 12-14)
Collin Bane loses the ball! Stripped by Larry Duncan! TURNOVER! (live ball)

[02:38] Team_085 possession (Score: 12-14)
Paul Wagner attempts a 3Pt. Contested by Giannis LaVine (4.6 feet, ZONE). Paul Wagner misses. FOUL! Loose ball foul on Joel Banchero during the rebound battle. [IN THE BONUS! 5 team fouls] Paul Wagner to the line for 2 free throws. (Joel Banchero: 2 personal fouls)   FT 1/2: GOOD   FT 2/2: GOOD Paul Wagner makes 2/2 from the line.
Score: 14-14

[02:25] Team_050 possession (Score: 14-14)
Joel Banchero drives, Stephen Bird stays with him. Joel Banchero attempts a Dunk. Heavily contested by Stephen Bird (0.5 feet, MAN)! JOEL BANCHERO MAKES IT!
Score: 14-16

[02:13] Team_085 possession (Score: 14-16)
FOUL! Reach-in foul on Donovan Trent during the drive. [IN THE BONUS! 6 team fouls] Stephen Bird to the line for 2 free throws. (Donovan Trent: 3 personal fouls)   FT 1/2: GOOD   FT 2/2: MISS Stephen Bird makes 1/2 from the line. Offensive rebound by Larry Duncan! Larry Duncan kicks it out.
Score: 15-16

[02:00] Team_085 possession (Score: 15-16)
Larry Duncan drives and kicks out. FOUL! Shooting foul on LeBron Bridges. Paul Wagner to the line for 2 free throws. [BONUS: 7 team fouls] (LeBron Bridges: 1 personal fouls)   FT 1/2: GOOD   FT 2/2: GOOD Paul Wagner makes 2/2 from the line.
Score: 17-16

[01:46] Team_050 possession (Score: 17-16)
Collin Bane attempts a 3Pt. Contested by Larry Duncan (2.2 feet, MAN). Collin Bane misses. Rebound secured by Paul Wagner.

[01:30] Team_085 possession (Score: 17-16)
Collin Mobley drives, Donovan Trent stays with him. Collin Mobley attempts a Layup. Contested by Donovan Trent (4.1 feet, MAN). Collin Mobley misses. Rebound secured by LeBron Bridges.

[01:19] Team_050 possession (Score: 17-16)
FOUL! Reach-in foul on Magic Beal during the drive. [Team fouls: 3] No free throws, side out. (Magic Beal: 1 personal fouls)

[01:05] Team_050 possession (Score: 17-16)
Joel Banchero attempts a Layup. BLOCKED BY LARRY DUNCAN! Ball is loose! Rebound secured by Larry Duncan.

[00:50] Team_085 possession (Score: 17-16)
FOUL! Holding foul on Collin Bane. [IN THE BONUS! 8 team fouls] Larry Duncan to the line for 2 free throws. (Collin Bane: 2 personal fouls)   FT 1/2: GOOD   FT 2/2: GOOD Larry Duncan makes 2/2 from the line.
Score: 19-16

[00:37] Team_050 possession (Score: 19-16)
FOUL! Shooting foul on Magic Beal. LeBron Bridges to the line for 2 free throws. [Team fouls: 4] (Magic Beal: 2 personal fouls)   FT 1/2: MISS   FT 2/2: MISS LeBron Bridges makes 0/2 from the line. Rebound secured by Larry Duncan.

[00:19] Team_085 possession (Score: 19-16)
Paul Wagner drives, LeBron Bridges stays with him. Paul Wagner attempts a Layup. Contested by LeBron Bridges (4.4 feet, MAN). PAUL WAGNER MAKES IT! Assist: Stephen Bird
Score: 21-16

[00:06] Team_050 possession (Score: 21-16)
Joel Banchero attempts a 3Pt. Contested by Stephen Bird (5.1 feet, MAN). Joel Banchero misses. Rebound secured by Larry Duncan.

================================================================================
                              1ST QUARTER COMPLETE                              
================================================================================

1ST QUARTER SCORE: Team_085 21, Team_050 16

BOX SCORE:
================================================================================

Team_085
--------------------------------------------------------------------------------
Player                MIN  PTS  REB  AST  TO      FG   FG%      3P   3P%
--------------------------------------------------------------------------------
Stephen Bird           12    7    0    1   0   3/6    50.0     0/0   0.0
Paul Wagner            12    6    4    0   0   3/4    75.0     0/0   0.0
Magic Beal             12    3    0    0   0   1/2    50.0     0/0   0.0
Larry Duncan           12    2    8    1   0   1/3    33.3     0/0   0.0
Collin Mobley          12    0    2    2   0   0/3     0.0     0/0   0.0

TEAM: FG: 8/18 (44.4%), 3PT: 2/7 (28.6%), REB: 14 (3 off, 11 def), AST: 4, TO: 3
TEAM FOULS: 4


Team_050
--------------------------------------------------------------------------------
Player                MIN  PTS  REB  AST  TO      FG   FG%      3P   3P%
--------------------------------------------------------------------------------
Joel Banchero          12    7    3    1   0   3/7    42.9     0/0   0.0
Giannis LaVine         12    3    0    0   0   1/3    33.3     0/0   0.0
Donovan Trent          12    2    0    0   0   1/2    50.0     0/0   0.0
Collin Bane            12    2    6    1   0   1/3    33.3     0/0   0.0
LeBron Bridges         12    2    2    2   0   1/3    33.3     0/0   0.0

TEAM: FG: 7/18 (38.9%), 3PT: 2/5 (40.0%), REB: 11 (1 off, 10 def), AST: 4, TO: 3
TEAM FOULS: 8 [Team_085 in BONUS]

================================================================================

================================================================================
                       2ND QUARTER - Team_085 vs Team_050                       
================================================================================

[12:00] Team_085 possession (Score: 21-16)
Larry Duncan drives, picks up Collin Bane. Help arrives from Joel Banchero! Larry Duncan attempts a Dunk. Contested by Joel Banchero (3.6 feet, MAN). LARRY DUNCAN MAKES IT! Assist: Collin Mobley
Score: 23-16

[11:43] Team_050 possession (Score: 23-16)
LeBron Bridges loses control! Ball rolls out of bounds! TURNOVER! (dead ball)

[11:43] Substitution (Team_085): Magic Beal OUT → Khris Brogdon IN (stamina_rule2)

[11:43] Substitution (Team_085): Stephen Bird OUT → Jordan Morant IN (stamina_rule2)

[11:43] Substitution (Team_085): Larry Duncan OUT → Giannis Johnson IN (stamina_rule2)

[11:43] Substitution (Team_085): Collin Mobley OUT → Malcolm Beal IN (stamina_rule2)

[11:43] Substitution (Team_050): Giannis LaVine OUT → Damian O'Neal IN (stamina_rule2)

[11:43] Substitution (Team_050): Joel Banchero OUT → Dwyane Towns IN (stamina_rule2)

[11:43] Substitution (Team_050): Collin Bane OUT → Larry Curry IN (stamina_rule2)

[11:43] Substitution (Team_050): LeBron Bridges OUT → Luka Gasol IN (stamina_rule2)

[11:43] Substitution (Team_050): Donovan Trent OUT → Tyler Smith IN (stamina_rule2)

[11:29] Team_085 possession (Score: 23-16)
Malcolm Beal attempts a Midrange. Wide open! Tyler Smith is 7.4 feet away. [MAN] MALCOLM BEAL MAKES IT! Assist: Giannis Johnson
Score: 25-16

[11:11] Team_050 possession (Score: 25-16)
Tyler Smith makes the Layup and draws the foul on Paul Wagner! And-1! Tyler Smith to the line for 1. [Team fouls: 1] (Paul Wagner: 1 personal fouls)   FT 1/1: GOOD Tyler Smith makes 1/1 from the line.
Score: 25-19

[10:54] Team_085 possession (Score: 25-19)
Paul Wagner attempts a 3Pt. Contested by Luka Gasol (5.6 feet, MAN). PAUL WAGNER MAKES IT! Assist: Malcolm Beal
Score: 28-19

[10:39] Team_050 possession (Score: 28-19)
Tyler Smith attempts a Midrange. Wide open! Paul Wagner is 7.0 feet away. [MAN] Tyler Smith misses. Offensive rebound by Larry Curry! Larry Curry kicks it out.

[10:23] Team_050 possession (Score: 28-19)
Luka Gasol attempts a Midrange. Heavily contested by Paul Wagner (1.8 feet, MAN)! Luka Gasol misses. Rebound secured by Malcolm Beal.

[10:08] Team_085 possession (Score: 28-19)
Malcolm Beal drives and kicks out. Khris Brogdon attempts a Midrange. Wide open! Luka Gasol is 6.9 feet away. [ZONE] KHRIS BROGDON MAKES IT! Assist: Paul Wagner
Score: 30-19

[09:58] Team_050 possession (Score: 30-19)
FOUL! Shooting foul on Paul Wagner. Larry Curry to the line for 2 free throws. [Team fouls: 2] (Paul Wagner: 2 personal fouls)   FT 1/2: GOOD   FT 2/2: MISS Larry Curry makes 1/2 from the line. Rebound secured by Giannis Johnson.
Score: 30-20

[09:47] Team_085 possession (Score: 30-20)
Paul Wagner attempts a Layup. Contested by Tyler Smith (3.4 feet, ZONE). Paul Wagner misses. Rebound secured by Tyler Smith.

[09:33] Team_050 possession (Score: 30-20)
Dwyane Towns drives and kicks out. Larry Curry attempts a 3Pt. Wide open! Giannis Johnson is 7.0 feet away. [MAN] Larry Curry misses. Rebound secured by Malcolm Beal.

[09:17] Team_085 possession (Score: 30-20)
Khris Brogdon attempts a 3Pt. Contested by Damian O'Neal (5.2 feet, MAN). KHRIS BROGDON MAKES IT! Assist: Paul Wagner
Score: 33-20

[09:01] Team_050 possession (Score: 33-20)
Larry Curry throws a bad pass out of bounds! TURNOVER! (dead ball)

[09:01] Substitution (Team_085): Paul Wagner OUT → Jalen Leonard IN (stamina_rule2)

[08:46] Team_085 possession (Score: 33-20)
Khris Brogdon attempts a 3Pt. Contested by Luka Gasol (5.6 feet, ZONE). Khris Brogdon misses. Rebound secured by Tyler Smith.

[08:34] Team_050 possession (Score: 33-20)
Tyler Smith loses the ball! Stripped by Malcolm Beal! TURNOVER! (live ball)

[08:16] Team_085 possession (Score: 33-20)
Malcolm Beal drives, Tyler Smith stays with him. Malcolm Beal attempts a Dunk. Contested by Tyler Smith (4.5 feet, MAN). Malcolm Beal misses. Rebound secured by Larry Curry.

[08:02] Team_050 possession (Score: 33-20)
Dwyane Towns makes the Dunk and draws the foul on Malcolm Beal! And-1! Dwyane Towns to the line for 1. [Team fouls: 3] (Malcolm Beal: 1 personal fouls)   FT 1/1: MISS Dwyane Towns makes 0/1 from the line. Rebound secured by Malcolm Beal.
Score: 33-22

[07:51] Team_085 possession (Score: 33-22)
Jalen Leonard attempts a 3Pt. Contested by Luka Gasol (5.3 feet, MAN). Jalen Leonard misses. Rebound secured by Larry Curry.

[07:38] Team_050 possession (Score: 33-22)
Damian O'Neal attempts a 3Pt. Contested by Jordan Morant (3.5 feet, ZONE). Damian O'Neal misses. Rebound secured by Giannis Johnson.

[07:24] Team_085 possession (Score: 33-22)
Khris Brogdon attempts a Midrange. Contested by Dwyane Towns (2.4 feet, ZONE). Khris Brogdon misses. Offensive rebound by Jalen Leonard! Jalen Leonard kicks it out.

[07:10] Team_085 possession (Score: 33-22)
Jordan Morant attempts a 3Pt. Contested by Luka Gasol (5.7 feet, ZONE). Jordan Morant misses. Rebound secured by Tyler Smith.

[06:59] Team_050 possession (Score: 33-22)
FOUL! Offensive foul on Damian O'Neal! Khris Brogdon drew the charge! [Team fouls: 1] (Damian O'Neal: 1 personal fouls) TURNOVER! (dead ball)

[06:45] Team_085 possession (Score: 33-22)
Malcolm Beal attempts a Midrange. Contested by Luka Gasol (5.6 feet, ZONE). Malcolm Beal misses. Rebound secured by Tyler Smith.

[06:33] Team_050 possession (Score: 33-22)
FOUL! Holding foul on Giannis Johnson. [Team fouls: 4] No free throws, side out. (Giannis Johnson: 1 personal fouls)

[06:18] Team_050 possession (Score: 33-22)
Luka Gasol drives, Jalen Leonard stays with him. Luka Gasol attempts a Dunk. Wide open! Jalen Leonard is 8.5 feet away. [MAN] LUKA GASOL MAKES IT! Assist: Dwyane Towns
Score: 33-24

[06:03] Team_085 possession (Score: 33-24)
FOUL! Shooting foul on Tyler Smith. Malcolm Beal to the line for 2 free throws. [Team fouls: 2] (Tyler Smith: 1 personal fouls)   FT 1/2: GOOD   FT 2/2: GOOD Malcolm Beal makes 2/2 from the line.
Score: 35-24

[05:51] Team_050 possession (Score: 35-24)
Luka Gasol drives to the basket... Luka Gasol throws a bad pass! Stolen by Jalen Leonard! TURNOVER! (live ball)

[05:40] Team_085 possession (Score: 35-24)
Jordan Morant attempts a 3Pt. Contested by Dwyane Towns (2.3 feet, MAN). Jordan Morant misses. Rebound secured by Larry Curry.

[05:27] Team_050 possession (Score: 35-24)
Dwyane Towns attempts a Midrange. Contested by Jalen Leonard (2.8 feet, ZONE). DWYANE TOWNS MAKES IT!
Score: 35-26

[05:13] Team_085 possession (Score: 35-26)
Jalen Leonard attempts a Midrange. Contested by Dwyane Towns (3.5 feet, ZONE). Jalen Leonard misses. Rebound secured by Larry Curry.

[04:58] Team_050 possession (Score: 35-26)
Luka Gasol attempts a 3Pt. Contested by Jalen Leonard (2.5 feet, MAN). Luka Gasol misses. Offensive rebound by Tyler Smith! Tyler Smith kicks it out.

[04:44] Team_050 possession (Score: 35-26)
Tyler Smith drives, Malcolm Beal stays with him. Tyler Smith attempts a Dunk. Contested by Malcolm Beal (3.6 feet, ZONE). TYLER SMITH MAKES IT!
Score: 35-28

[04:30] Team_085 possession (Score: 35-28)
Khris Brogdon commits a violation (traveling/carry)! TURNOVER! (dead ball)

[04:14] Team_050 possession (Score: 35-28)
Dwyane Towns attempts a Midrange. Wide open! Jalen Leonard is 6.6 feet away. [ZONE] Dwyane Towns misses. Rebound secured by Malcolm Beal.

[04:02] Team_085 possession (Score: 35-28)
Jordan Morant attempts a Layup. BLOCKED BY LUKA GASOL! Ball goes out off Luka Gasol. Jordan Morant's ball!

[03:48] Team_085 possession (Score: 35-28)
Giannis Johnson attempts a 3Pt. Wide open! Larry Curry is 8.2 feet away. [MAN] Giannis Johnson misses. Rebound secured by Dwyane Towns.

[03:36] Team_050 possession (Score: 35-28)
FOUL! Shooting foul on Malcolm Beal. Tyler Smith to the line for 2 free throws. [BONUS: 5 team fouls] (Malcolm Beal: 2 personal fouls)   FT 1/2: GOOD   FT 2/2: GOOD Tyler Smith makes 2/2 from the line.
Score: 35-30

[03:19] Team_085 possession (Score: 35-30)
Jordan Morant attempts a Midrange. Contested by Larry Curry (5.8 feet, ZONE). Jordan Morant misses. Rebound secured by Tyler Smith.

[03:07] Team_050 possession (Score: 35-30)
Dwyane Towns attempts a 3Pt. Contested by Jordan Morant (5.8 feet, MAN). Dwyane Towns misses. Rebound secured by Jalen Leonard.

[02:52] Team_085 possession (Score: 35-30)
Giannis Johnson drives and kicks out. Giannis Johnson attempts a 3Pt. Contested by Larry Curry (5.9 feet, MAN). Giannis Johnson misses. Rebound secured by Tyler Smith.

[02:38] Team_050 possession (Score: 35-30)
Dwyane Towns attempts a 3Pt. Wide open! Khris Brogdon is 8.0 feet away. [ZONE] Dwyane Towns misses. Rebound secured by Malcolm Beal.

[02:21] Team_085 possession (Score: 35-30)
Khris Brogdon attempts a Layup. Contested by Damian O'Neal (5.1 feet, MAN). KHRIS BROGDON MAKES IT!
Score: 37-30

[02:07] Team_050 possession (Score: 37-30)
Damian O'Neal throws a bad pass out of bounds! TURNOVER! (dead ball)

[01:50] Team_085 possession (Score: 37-30)
Malcolm Beal drives and kicks out. Jordan Morant attempts a Midrange. Wide open! Dwyane Towns is 7.9 feet away. [MAN] JORDAN MORANT MAKES IT!
Score: 39-30

[01:40] Team_050 possession (Score: 39-30)
FOUL! Shooting foul on Jalen Leonard. Luka Gasol to the line for 2 free throws. [BONUS: 6 team fouls] (Jalen Leonard: 1 personal fouls)   FT 1/2: GOOD   FT 2/2: GOOD Luka Gasol makes 2/2 from the line.
Score: 39-32

[01:23] Team_085 possession (Score: 39-32)
Jalen Leonard drives to the basket... FOUL! Offensive foul on Jalen Leonard! Tyler Smith drew the charge! [Team fouls: 7] (Jalen Leonard: 2 personal fouls) TURNOVER! (dead ball)

[01:08] Team_050 possession (Score: 39-32)
Larry Curry attempts a 3Pt. Contested by Jordan Morant (4.1 feet, ZONE). Larry Curry misses. FOUL! Loose ball foul on Jalen Leonard during the rebound battle. [IN THE BONUS! 8 team fouls] Tyler Smith to the line for 2 free throws. (Jalen Leonard: 3 personal fouls)   FT 1/2: GOOD   FT 2/2: MISS Tyler Smith makes 1/2 from the line. FOUL! Loose ball foul on Giannis Johnson during the free throw rebound! [IN THE BONUS! 9 team fouls] Tyler Smith to the line for 2 free throws. (Giannis Johnson: 2 personal fouls)   FT 1/2: GOOD   FT 2/2: MISS Tyler Smith makes 1/2 from the line. Rebound secured by Jalen Leonard.
Score: 39-34

[00:54] Team_085 possession (Score: 39-34)
Giannis Johnson drives and kicks out. Malcolm Beal attempts a 3Pt. Wide open! Tyler Smith is 6.6 feet away. [MAN] MALCOLM BEAL MAKES IT! Assist: Jordan Morant
Score: 42-34

[00:41] Team_050 possession (Score: 42-34)
Luka Gasol throws a bad pass! Stolen by Jalen Leonard! TURNOVER! (live ball)

[00:30] Team_085 possession (Score: 42-34)
FOUL! Shooting foul on Dwyane Towns. Khris Brogdon to the line for 2 free throws. [Team fouls: 3] (Dwyane Towns: 1 personal fouls)   FT 1/2: GOOD   FT 2/2: GOOD Khris Brogdon makes 2/2 from the line.
Score: 44-34

[00:14] Team_050 possession (Score: 44-34)
Damian O'Neal drives and kicks out. Tyler Smith attempts a 3Pt. Contested by Malcolm Beal (3.6 feet, MAN). TYLER SMITH MAKES IT!
Score: 44-37

================================================================================
                              2ND QUARTER COMPLETE                              
================================================================================

2ND QUARTER SCORE: Team_085 23, Team_050 21

BOX SCORE:
================================================================================

Team_085
--------------------------------------------------------------------------------
Player                MIN  PTS  REB  AST  TO      FG   FG%      3P   3P%
--------------------------------------------------------------------------------
Khris Brogdon          11    9    0    0   0   4/5    80.0     0/0   0.0
Malcolm Beal           11    7    5    1   0   3/5    60.0     0/0   0.0
Paul Wagner            15    3    0    2   0   1/2    50.0     0/0   0.0
Larry Duncan           13    2    0    0   0   1/1   100.0     0/0   0.0
Jordan Morant          11    2    0    1   0   1/4    25.0     0/0   0.0
Collin Mobley          13    0    0    1   0   0/0     0.0     0/0   0.0
Giannis Johnson        11    0    2    1   0   0/2     0.0     0/0   0.0

TEAM: FG: 10/21 (47.6%), 3PT: 2/7 (28.6%), REB: 9 (1 off, 8 def), AST: 6, TO: 2
TEAM FOULS: 9 [Team_050 in BONUS]


Team_050
--------------------------------------------------------------------------------
Player                MIN  PTS  REB  AST  TO      FG   FG%      3P   3P%
--------------------------------------------------------------------------------
Tyler Smith            11   10    7    0   0   4/4   100.0     0/0   0.0
Luka Gasol             11    4    0    0   0   2/3    66.7     0/0   0.0
Dwyane Towns           11    2    1    1   0   1/6    16.7     0/0   0.0
Larry Curry            11    0    5    0   0   0/2     0.0     0/0   0.0
Jalen Leonard           9    0    3    0   0   0/2     0.0     0/0   0.0
Damian O'Neal          11    0    0    0   0   0/1     0.0     0/0   0.0

TEAM: FG: 7/16 (43.8%), 3PT: 0/4 (0.0%), REB: 14 (3 off, 11 def), AST: 1, TO: 7
TEAM FOULS: 3

================================================================================

================================================================================
                       3RD QUARTER - Team_085 vs Team_050                       
================================================================================

[12:00] Team_085 possession (Score: 44-37)
Collin Mobley attempts a Layup. Contested by Donovan Trent (3.1 feet, MAN). COLLIN MOBLEY MAKES IT! Assist: Magic Beal
Score: 46-37

[11:50] Team_050 possession (Score: 46-37)
LeBron Bridges drives and kicks out. LeBron Bridges attempts a 3Pt. Wide open! Magic Beal is 8.6 feet away. [ZONE] LeBron Bridges misses. Rebound secured by Collin Mobley.

[11:37] Team_085 possession (Score: 46-37)
Magic Beal attempts a 3Pt. Contested by Giannis LaVine (5.8 feet, ZONE). MAGIC BEAL MAKES IT! Assist: Larry Duncan
Score: 49-37

[11:26] Team_050 possession (Score: 49-37)
Joel Banchero attempts a Layup. Wide open! Paul Wagner is 6.6 feet away. [ZONE] JOEL BANCHERO MAKES IT! Assist: Giannis LaVine
Score: 49-39

[11:14] Team_085 possession (Score: 49-39)
Collin Mobley attempts a Midrange. Contested by Donovan Trent (2.8 feet, MAN). Collin Mobley misses. Rebound secured by Collin Bane.

[10:58] Team_050 possession (Score: 49-39)
Donovan Trent makes the Layup and draws the foul on Collin Mobley! And-1! Donovan Trent to the line for 1. [Team fouls: 1] (Collin Mobley: 1 personal fouls)   FT 1/1: GOOD Donovan Trent makes 1/1 from the line.
Score: 49-42

[10:44] Team_085 possession (Score: 49-42)
Paul Wagner makes the Layup and draws the foul on LeBron Bridges! And-1! Paul Wagner to the line for 1. [Team fouls: 1] (LeBron Bridges: 1 personal fouls)   FT 1/1: MISS Paul Wagner makes 0/1 from the line. Offensive rebound by Paul Wagner! Paul Wagner kicks it out.
Score: 51-42

[10:32] Team_085 possession (Score: 51-42)
Stephen Bird attempts a 3Pt. Contested by Giannis LaVine (2.3 feet, ZONE). Stephen Bird misses. Offensive rebound by Paul Wagner! Paul Wagner kicks it out.

[10:14] Team_085 possession (Score: 51-42)
Larry Duncan attempts a 3Pt. Wide open! Collin Bane is 7.2 feet away. [MAN] LARRY DUNCAN MAKES IT! Assist: Paul Wagner
Score: 54-42

[10:02] Team_050 possession (Score: 54-42)
FOUL! Shooting foul on Paul Wagner. LeBron Bridges to the line for 2 free throws. [Team fouls: 2] (Paul Wagner: 1 personal fouls)   FT 1/2: GOOD   FT 2/2: GOOD LeBron Bridges makes 2/2 from the line.
Score: 54-44

[09:51] Team_085 possession (Score: 54-44)
Magic Beal throws a bad pass! Stolen by Giannis LaVine! TURNOVER! (live ball)

[09:34] Team_050 possession (Score: 54-44)
LeBron Bridges drives and kicks out. Donovan Trent attempts a Midrange. Contested by Collin Mobley (4.3 feet, MAN). Donovan Trent misses. Rebound secured by Collin Mobley.

[09:21] Team_085 possession (Score: 54-44)
Magic Beal attempts a 3Pt. Contested by Giannis LaVine (3.9 feet, MAN). Magic Beal misses. Rebound secured by Joel Banchero.

[09:06] Team_050 possession (Score: 54-44)
LeBron Bridges attempts a Layup. BLOCKED BY PAUL WAGNER! Ball is loose! Offensive rebound by Collin Bane! Collin Bane kicks it out.

[08:56] Team_050 possession (Score: 54-44)
Donovan Trent makes the Dunk and draws the foul on Magic Beal! And-1! Donovan Trent to the line for 1. [Team fouls: 4] (Magic Beal: 1 personal fouls)   FT 1/1: GOOD Donovan Trent makes 1/1 from the line.
Score: 54-47

[08:38] Team_085 possession (Score: 54-47)
Paul Wagner throws a bad pass out of bounds! TURNOVER! (dead ball)

[08:29] Team_050 possession (Score: 54-47)
Joel Banchero attempts a 3Pt. Contested by Magic Beal (2.4 feet, ZONE). JOEL BANCHERO MAKES IT! Assist: LeBron Bridges
Score: 54-50

[08:16] Team_085 possession (Score: 54-50)
Magic Beal drives and kicks out. Stephen Bird attempts a 3Pt. Contested by Joel Banchero (5.1 feet, MAN). STEPHEN BIRD MAKES IT! Assist: Larry Duncan
Score: 57-50

[08:02] Team_050 possession (Score: 57-50)
Joel Banchero attempts a 3Pt. Contested by Stephen Bird (5.9 feet, MAN). Joel Banchero misses. Offensive rebound by LeBron Bridges! LeBron Bridges kicks it out.

[07:49] Team_050 possession (Score: 57-50)
Donovan Trent drives and kicks out. Collin Bane attempts a 3Pt. Contested by Larry Duncan (4.3 feet, MAN). Collin Bane misses. Rebound secured by Larry Duncan.

[07:33] Team_085 possession (Score: 57-50)
Paul Wagner attempts a Midrange. Contested by Joel Banchero (4.4 feet, ZONE). Paul Wagner misses. Rebound secured by Collin Bane.

[07:19] Team_050 possession (Score: 57-50)
FOUL! Shooting foul on Magic Beal. LeBron Bridges to the line for 2 free throws. [BONUS: 5 team fouls] (Magic Beal: 2 personal fouls)   FT 1/2: GOOD   FT 2/2: GOOD LeBron Bridges makes 2/2 from the line.
Score: 57-52

[07:05] Team_085 possession (Score: 57-52)
Paul Wagner drives, picks up Donovan Trent. Help arrives from Joel Banchero! Paul Wagner attempts a Layup. Wide open! Joel Banchero is 7.9 feet away. [ZONE] PAUL WAGNER MAKES IT! Assist: Stephen Bird
Score: 59-52

[06:47] Team_050 possession (Score: 59-52)
Donovan Trent drives to the basket... Donovan Trent loses the ball! Stripped by Collin Mobley! TURNOVER! (live ball)

[06:30] Team_085 possession (Score: 59-52)
Paul Wagner attempts a 3Pt. Wide open! Giannis LaVine is 9.0 feet away. [ZONE] Paul Wagner misses. Rebound secured by Joel Banchero.

[06:15] Team_050 possession (Score: 59-52)
FOUL! Reach-in foul on Collin Mobley during the drive. [IN THE BONUS! 6 team fouls] Donovan Trent to the line for 2 free throws. (Collin Mobley: 3 personal fouls)   FT 1/2: GOOD   FT 2/2: MISS Donovan Trent makes 1/2 from the line. Rebound secured by Paul Wagner.
Score: 59-53

[06:02] Team_085 possession (Score: 59-53)
Stephen Bird attempts a 3Pt. Contested by Giannis LaVine (4.7 feet, ZONE). Stephen Bird misses. Rebound secured by Collin Bane.

[05:43] Team_050 possession (Score: 59-53)
Giannis LaVine attempts a 3Pt. Contested by Larry Duncan (3.9 feet, ZONE). GIANNIS LAVINE MAKES IT! Assist: Joel Banchero
Score: 59-56

[05:30] Team_085 possession (Score: 59-56)
Collin Mobley attempts a Layup. Contested by Donovan Trent (4.0 feet, MAN). COLLIN MOBLEY MAKES IT! Assist: Magic Beal
Score: 61-56

[05:11] Team_050 possession (Score: 61-56)
LeBron Bridges attempts a Layup. Contested by Paul Wagner (2.2 feet, MAN). LeBron Bridges misses. FOUL! Loose ball foul on Larry Duncan during the rebound battle. [IN THE BONUS! 7 team fouls] LeBron Bridges to the line for 2 free throws. (Larry Duncan: 1 personal fouls)   FT 1/2: GOOD   FT 2/2: GOOD LeBron Bridges makes 2/2 from the line.
Score: 61-58

[04:55] Team_085 possession (Score: 61-58)
Collin Mobley drives and kicks out. Larry Duncan attempts a 3Pt. Contested by Collin Bane (4.1 feet, MAN). Larry Duncan misses. Rebound secured by Collin Bane.

[04:39] Team_050 possession (Score: 61-58)
FOUL! Offensive foul on Donovan Trent! Collin Mobley drew the charge! [Team fouls: 2] (Donovan Trent: 1 personal fouls) TURNOVER! (dead ball)

[04:27] Team_085 possession (Score: 61-58)
Paul Wagner drives, picks up LeBron Bridges. Help arrives from Joel Banchero! Paul Wagner attempts a Dunk. Contested by Joel Banchero (2.8 feet, MAN). PAUL WAGNER MAKES IT! Assist: Larry Duncan
Score: 63-58

[04:10] Team_050 possession (Score: 63-58)
LeBron Bridges drives and kicks out. LeBron Bridges attempts a Midrange. Contested by Paul Wagner (3.3 feet, ZONE). LEBRON BRIDGES MAKES IT! Assist: Joel Banchero
Score: 63-60

[03:57] Team_085 possession (Score: 63-60)
FOUL! Shooting foul on Donovan Trent. Collin Mobley to the line for 2 free throws. [Team fouls: 3] (Donovan Trent: 2 personal fouls)   FT 1/2: GOOD   FT 2/2: GOOD Collin Mobley makes 2/2 from the line.
Score: 65-60

[03:42] Team_050 possession (Score: 65-60)
Giannis LaVine attempts a 3Pt. Contested by Magic Beal (4.9 feet, MAN). Giannis LaVine misses. Offensive rebound by Collin Bane! Collin Bane kicks it out.

[03:31] Team_050 possession (Score: 65-60)
Joel Banchero makes the Dunk and draws the foul on Larry Duncan! And-1! Joel Banchero to the line for 1. [BONUS: 8 team fouls] (Larry Duncan: 2 personal fouls)   FT 1/1: GOOD Joel Banchero makes 1/1 from the line.
Score: 65-63

[03:17] Team_085 possession (Score: 65-63)
Collin Mobley drives and kicks out. Stephen Bird attempts a 3Pt. Wide open! Joel Banchero is 9.6 feet away. [MAN] STEPHEN BIRD MAKES IT! Assist: Magic Beal
Score: 68-63

[03:03] Team_050 possession (Score: 68-63)
Joel Banchero drives to the basket... Joel Banchero throws a bad pass! Stolen by Paul Wagner! TURNOVER! (live ball)

[02:49] Team_085 possession (Score: 68-63)
Paul Wagner attempts a 3Pt. Contested by Giannis LaVine (5.6 feet, ZONE). PAUL WAGNER MAKES IT! Assist: Magic Beal
Score: 71-63

[02:33] Team_050 possession (Score: 71-63)
LeBron Bridges attempts a Layup. BLOCKED BY PAUL WAGNER! Ball is loose! Rebound secured by Larry Duncan.

[02:19] Team_085 possession (Score: 71-63)
Stephen Bird attempts a 3Pt. Contested by LeBron Bridges (3.5 feet, ZONE). Stephen Bird misses. Rebound secured by LeBron Bridges.

[02:05] Team_050 possession (Score: 71-63)
Collin Bane attempts a Midrange. Contested by Larry Duncan (4.2 feet, MAN). COLLIN BANE MAKES IT! Assist: LeBron Bridges
Score: 71-65

[01:53] Team_085 possession (Score: 71-65)
Larry Duncan drives, Donovan Trent stays with him. Larry Duncan attempts a Dunk. Wide open! Donovan Trent is 9.6 feet away. [ZONE] LARRY DUNCAN MAKES IT! Assist: Paul Wagner
Score: 73-65

[01:42] Team_050 possession (Score: 73-65)
LeBron Bridges attempts a Layup. Contested by Paul Wagner (2.6 feet, ZONE). LEBRON BRIDGES MAKES IT!
Score: 73-67

[01:29] Team_085 possession (Score: 73-67)
Larry Duncan attempts a 3Pt. Heavily contested by Giannis LaVine (1.5 feet, ZONE)! Larry Duncan misses. Offensive rebound by Paul Wagner! Paul Wagner kicks it out.

[01:09] Team_085 possession (Score: 73-67)
Larry Duncan attempts a Layup. Heavily contested by Collin Bane (1.6 feet, MAN)! Larry Duncan misses. Rebound secured by Joel Banchero.

[00:54] Team_050 possession (Score: 73-67)
Donovan Trent attempts a 3Pt. Contested by Magic Beal (3.8 feet, ZONE). DONOVAN TRENT MAKES IT! Assist: Giannis LaVine
Score: 73-70

[00:35] Team_085 possession (Score: 73-70)
Larry Duncan attempts a 3Pt. Wide open! Collin Bane is 6.0 feet away. [MAN] Larry Duncan misses. Rebound secured by LeBron Bridges.

[00:18] Team_050 possession (Score: 73-70)
LeBron Bridges makes the Layup and draws the foul on Paul Wagner! And-1! LeBron Bridges to the line for 1. [BONUS: 9 team fouls] (Paul Wagner: 2 personal fouls)   FT 1/1: GOOD LeBron Bridges makes 1/1 from the line.
Score: 73-73

[00:07] Team_085 possession (Score: 73-73)
Magic Beal attempts a 3Pt. Wide open! Giannis LaVine is 7.7 feet away. [ZONE] Magic Beal misses. Offensive rebound by Paul Wagner! Paul Wagner kicks it out.

================================================================================
                              3RD QUARTER COMPLETE                              
================================================================================

3RD QUARTER SCORE: Team_085 29, Team_050 36

BOX SCORE:
================================================================================

Team_085
--------------------------------------------------------------------------------
Player                MIN  PTS  REB  AST  TO      FG   FG%      3P   3P%
--------------------------------------------------------------------------------
Paul Wagner            28    7    5    2   0   3/5    60.0     0/0   0.0
Collin Mobley          25    6    2    0   0   3/5    60.0     0/0   0.0
Stephen Bird           25    6    0    1   0   2/4    50.0     0/0   0.0
Larry Duncan           25    5    2    3   0   2/4    50.0     0/0   0.0
Magic Beal             25    3    0    4   0   1/2    50.0     0/0   0.0

TEAM: FG: 11/20 (55.0%), 3PT: 3/8 (37.5%), REB: 9 (4 off, 5 def), AST: 10, TO: 2
TEAM FOULS: 9 [Team_050 in BONUS]


Team_050
--------------------------------------------------------------------------------
Player                MIN  PTS  REB  AST  TO      FG   FG%      3P   3P%
--------------------------------------------------------------------------------
LeBron Bridges         25   13    3    2   0   6/9    66.7     0/0   0.0
Donovan Trent          25    9    0    0   0   3/5    60.0     0/0   0.0
Joel Banchero          25    8    3    2   0   3/3   100.0     0/0   0.0
Giannis LaVine         25    3    0    2   0   1/1   100.0     0/0   0.0
Collin Bane            25    2    6    0   0   1/1   100.0     0/0   0.0

TEAM: FG: 14/19 (73.7%), 3PT: 3/3 (100.0%), REB: 12 (3 off, 9 def), AST: 6, TO: 3
TEAM FOULS: 3

================================================================================

================================================================================
                       4TH QUARTER - Team_085 vs Team_050                       
================================================================================

[12:00] Team_085 possession (Score: 73-73)
Collin Mobley attempts a Layup. Wide open! Donovan Trent is 7.9 feet away. [MAN] COLLIN MOBLEY MAKES IT! Assist: Magic Beal
Score: 75-73

[11:45] Team_050 possession (Score: 75-73)
LeBron Bridges drives and kicks out. Collin Bane attempts a 3Pt. Wide open! Magic Beal is 6.8 feet away. [ZONE] Collin Bane misses. Rebound secured by Paul Wagner.

[11:36] Team_085 possession (Score: 75-73)
Magic Beal attempts a 3Pt. Heavily contested by Giannis LaVine (2.0 feet, MAN)! Magic Beal misses. Rebound secured by LeBron Bridges.

[11:21] Team_050 possession (Score: 75-73)
Joel Banchero attempts a Midrange. Heavily contested by Magic Beal (1.1 feet, ZONE)! Joel Banchero misses. Rebound secured by Paul Wagner.

[11:06] Team_085 possession (Score: 75-73)
Magic Beal attempts a 3Pt. Contested by Giannis LaVine (4.0 feet, ZONE). Magic Beal misses. Offensive rebound by Larry Duncan! Larry Duncan kicks it out.

[10:48] Team_085 possession (Score: 75-73)
Larry Duncan attempts a 3Pt. Contested by Giannis LaVine (5.1 feet, ZONE). Larry Duncan misses. Offensive rebound by Paul Wagner! Paul Wagner kicks it out.

[10:34] Team_085 possession (Score: 75-73)
Stephen Bird attempts a 3Pt. Contested by Joel Banchero (5.3 feet, MAN). STEPHEN BIRD MAKES IT!
Score: 78-73

[10:21] Team_050 possession (Score: 78-73)
FOUL! Shooting foul on Larry Duncan. Collin Bane to the line for 2 free throws. [Team fouls: 1] (Larry Duncan: 1 personal fouls)   FT 1/2: GOOD   FT 2/2: GOOD Collin Bane makes 2/2 from the line.
Score: 78-75

[10:08] Team_085 possession (Score: 78-75)
Stephen Bird attempts a Midrange. Contested by Joel Banchero (5.4 feet, MAN). STEPHEN BIRD MAKES IT!
Score: 80-75

[09:50] Team_050 possession (Score: 80-75)
LeBron Bridges attempts a 3Pt. Contested by Magic Beal (3.9 feet, ZONE). LeBron Bridges misses. Rebound secured by Paul Wagner.

[09:36] Team_085 possession (Score: 80-75)
Paul Wagner makes the Layup and draws the foul on LeBron Bridges! And-1! Paul Wagner to the line for 1. [Team fouls: 1] (LeBron Bridges: 1 personal fouls)   FT 1/1: GOOD Paul Wagner makes 1/1 from the line.
Score: 83-75

[09:19] Team_050 possession (Score: 83-75)
Giannis LaVine makes the Dunk and draws the foul on Magic Beal! And-1! Giannis LaVine to the line for 1. [Team fouls: 2] (Magic Beal: 1 personal fouls)   FT 1/1: GOOD Giannis LaVine makes 1/1 from the line.
Score: 83-78

[09:02] Team_085 possession (Score: 83-78)
Stephen Bird drives, Donovan Trent stays with him. Stephen Bird attempts a Dunk. Contested by Donovan Trent (5.6 feet, ZONE). STEPHEN BIRD MAKES IT! Assist: Paul Wagner
Score: 85-78

[08:49] Team_050 possession (Score: 85-78)
Collin Bane attempts a Midrange. Contested by Larry Duncan (4.2 feet, ZONE). COLLIN BANE MAKES IT!
Score: 85-80

[08:38] Team_085 possession (Score: 85-80)
Magic Beal attempts a 3Pt. Contested by Giannis LaVine (3.0 feet, MAN). Magic Beal misses. Offensive rebound by Larry Duncan! Larry Duncan kicks it out.

[08:24] Team_085 possession (Score: 85-80)
Stephen Bird drives, Joel Banchero stays with him. Stephen Bird attempts a Dunk. Wide open! Joel Banchero is 6.1 feet away. [MAN] STEPHEN BIRD MAKES IT! Assist: Collin Mobley
Score: 87-80

[08:13] Team_050 possession (Score: 87-80)
LeBron Bridges makes the Layup and draws the foul on Paul Wagner! And-1! LeBron Bridges to the line for 1. [Team fouls: 3] (Paul Wagner: 1 personal fouls)   FT 1/1: GOOD LeBron Bridges makes 1/1 from the line.
Score: 87-83

[07:57] Team_085 possession (Score: 87-83)
Larry Duncan attempts a Layup. Contested by Donovan Trent (5.0 feet, ZONE). Larry Duncan misses. Rebound secured by Collin Bane.

[07:44] Team_050 possession (Score: 87-83)
LeBron Bridges attempts a 3Pt. Wide open! Magic Beal is 8.9 feet away. [ZONE] LEBRON BRIDGES MAKES IT! Assist: Collin Bane
Score: 87-86

[07:28] Team_085 possession (Score: 87-86)
Collin Mobley attempts a Midrange. Wide open! Collin Bane is 8.4 feet away. [ZONE] COLLIN MOBLEY MAKES IT! Assist: Larry Duncan
Score: 89-86

[07:14] Team_050 possession (Score: 89-86)
Collin Bane attempts a 3Pt. Contested by Larry Duncan (2.9 feet, MAN). Collin Bane misses. Offensive rebound by Collin Bane! Collin Bane kicks it out.

[06:57] Team_050 possession (Score: 89-86)
LeBron Bridges attempts a 3Pt. Wide open! Magic Beal is 9.3 feet away. [ZONE] LeBron Bridges misses. Offensive rebound by Joel Banchero! Joel Banchero kicks it out.

[06:37] Team_050 possession (Score: 89-86)
Giannis LaVine attempts a 3Pt. Contested by Magic Beal (5.8 feet, MAN). Giannis LaVine misses. Rebound secured by Collin Mobley.

[06:23] Team_085 possession (Score: 89-86)
Magic Beal makes the Midrange and draws the foul on Joel Banchero! And-1! Magic Beal to the line for 1. [Team fouls: 2] (Joel Banchero: 1 personal fouls)   FT 1/1: GOOD Magic Beal makes 1/1 from the line.
Score: 92-86

[06:14] Team_050 possession (Score: 92-86)
Collin Bane attempts a 3Pt. Contested by Larry Duncan (3.8 feet, MAN). Collin Bane misses. Rebound secured by Larry Duncan.

[05:57] Team_085 possession (Score: 92-86)
Magic Beal makes the Dunk and draws the foul on Giannis LaVine! And-1! Magic Beal to the line for 1. [Team fouls: 3] (Giannis LaVine: 1 personal fouls)   FT 1/1: GOOD Magic Beal makes 1/1 from the line.
Score: 95-86

[05:44] Team_050 possession (Score: 95-86)
LeBron Bridges drives and kicks out. Donovan Trent attempts a 3Pt. Contested by Collin Mobley (5.5 feet, MAN). Donovan Trent misses. Rebound secured by Collin Mobley.

[05:28] Team_085 possession (Score: 95-86)
Larry Duncan attempts a 3Pt. Wide open! Giannis LaVine is 9.3 feet away. [ZONE] Larry Duncan misses. Rebound secured by Joel Banchero.

[05:15] Team_050 possession (Score: 95-86)
Giannis LaVine attempts a 3Pt. Contested by Magic Beal (3.1 feet, MAN). Giannis LaVine misses. Rebound secured by Paul Wagner.

[05:01] Team_085 possession (Score: 95-86)
Paul Wagner attempts a 3Pt. Contested by LeBron Bridges (4.0 feet, MAN). Paul Wagner misses. Offensive rebound by Larry Duncan! Larry Duncan kicks it out.

[04:48] Team_085 possession (Score: 95-86)
Collin Mobley drives and kicks out. Stephen Bird attempts a 3Pt. Wide open! Giannis LaVine is 6.7 feet away. [ZONE] Stephen Bird misses. Rebound secured by LeBron Bridges.

[04:35] Team_050 possession (Score: 95-86)
LeBron Bridges attempts a 3Pt. Contested by Paul Wagner (5.1 feet, MAN). LeBron Bridges misses. Rebound secured by Collin Mobley.

[04:19] Team_085 possession (Score: 95-86)
Paul Wagner makes the Layup and draws the foul on Donovan Trent! And-1! Paul Wagner to the line for 1. [Team fouls: 4] (Donovan Trent: 1 personal fouls)   FT 1/1: GOOD Paul Wagner makes 1/1 from the line.
Score: 98-86

[04:02] Team_050 possession (Score: 98-86)
Joel Banchero loses the ball! Stripped by Stephen Bird! TURNOVER! (live ball)

[03:51] Team_085 possession (Score: 98-86)
Paul Wagner drives, Donovan Trent stays with him. Paul Wagner attempts a Dunk. Wide open! Donovan Trent is 7.2 feet away. [ZONE] PAUL WAGNER MAKES IT!
Score: 100-86

[03:40] Team_050 possession (Score: 100-86)
LeBron Bridges attempts a Midrange. Contested by Paul Wagner (5.4 feet, MAN). LeBron Bridges misses. Offensive rebound by Joel Banchero! Joel Banchero kicks it out.

[03:24] Team_050 possession (Score: 100-86)
Donovan Trent drives and kicks out. Collin Bane attempts a 3Pt. Contested by Larry Duncan (5.9 feet, MAN). Collin Bane misses. Rebound secured by Paul Wagner.

[03:08] Team_085 possession (Score: 100-86)
Collin Mobley attempts a Layup. Wide open! Donovan Trent is 10.0 feet away. [MAN] COLLIN MOBLEY MAKES IT! Assist: Paul Wagner
Score: 102-86

[02:58] Team_050 possession (Score: 102-86)
FOUL! Reach-in foul on Paul Wagner during the drive. [Team fouls: 4] No free throws, side out. (Paul Wagner: 2 personal fouls)

[02:39] Team_050 possession (Score: 102-86)
Giannis LaVine drives and kicks out. Joel Banchero attempts a 3Pt. Contested by Stephen Bird (5.0 feet, MAN). Joel Banchero misses. Offensive rebound by Collin Bane! Collin Bane kicks it out.

[02:23] Team_050 possession (Score: 102-86)
Donovan Trent drives to the basket... Donovan Trent throws a bad pass! Stolen by Paul Wagner! TURNOVER! (live ball)

[02:07] Team_085 possession (Score: 102-86)
Collin Mobley throws a bad pass out of bounds! TURNOVER! (dead ball)

[02:07] Substitution (Team_085): Magic Beal OUT → Khris Brogdon IN (stamina_rule2)

[02:07] Substitution (Team_085): Stephen Bird OUT → Jordan Morant IN (stamina_rule2)

[02:07] Substitution (Team_085): Larry Duncan OUT → Giannis Johnson IN (stamina_rule2)

[02:07] Substitution (Team_085): Paul Wagner OUT → Jalen Leonard IN (stamina_rule2)

[02:07] Substitution (Team_085): Collin Mobley OUT → Malcolm Beal IN (stamina_rule2)

[02:07] Substitution (Team_050): Giannis LaVine OUT → Damian O'Neal IN (stamina_rule2)

[02:07] Substitution (Team_050): Joel Banchero OUT → Dwyane Towns IN (stamina_rule2)

[02:07] Substitution (Team_050): Collin Bane OUT → Larry Curry IN (stamina_rule2)

[02:07] Substitution (Team_050): LeBron Bridges OUT → Luka Gasol IN (stamina_rule2)

[02:07] Substitution (Team_050): Donovan Trent OUT → Tyler Smith IN (stamina_rule2)

[01:55] Team_050 possession (Score: 102-86)
Larry Curry attempts a 3Pt. Contested by Jordan Morant (4.8 feet, ZONE). Larry Curry misses. Rebound secured by Malcolm Beal.

[01:42] Team_085 possession (Score: 102-86)
Khris Brogdon attempts a 3Pt. Contested by Luka Gasol (5.0 feet, ZONE). Khris Brogdon misses. Rebound secured by Larry Curry.

[01:28] Team_050 possession (Score: 102-86)
Dwyane Towns attempts a 3Pt. Contested by Jordan Morant (3.2 feet, ZONE). Dwyane Towns misses. Rebound secured by Jalen Leonard.

[01:16] Team_085 possession (Score: 102-86)
Jordan Morant attempts a 3Pt. Contested by Dwyane Towns (3.6 feet, MAN). Jordan Morant misses. Rebound secured by Larry Curry.

[01:02] Team_050 possession (Score: 102-86)
Damian O'Neal drives and kicks out. Damian O'Neal attempts a Midrange. Wide open! Giannis Johnson is 9.4 feet away. [ZONE] DAMIAN O'NEAL MAKES IT!
Score: 102-88

[00:45] Team_085 possession (Score: 102-88)
Malcolm Beal attempts a Layup. Contested by Tyler Smith (4.9 feet, ZONE). MALCOLM BEAL MAKES IT! Assist: Khris Brogdon
Score: 104-88

[00:33] Team_050 possession (Score: 104-88)
Damian O'Neal makes the Midrange and draws the foul on Giannis Johnson! And-1! Damian O'Neal to the line for 1. [BONUS: 5 team fouls] (Giannis Johnson: 1 personal fouls)   FT 1/1: GOOD Damian O'Neal makes 1/1 from the line.
Score: 104-91

[00:19] Team_085 possession (Score: 104-91)
Giannis Johnson attempts a 3Pt. Wide open! Luka Gasol is 7.0 feet away. [ZONE] Giannis Johnson misses. Rebound secured by Dwyane Towns.

[00:08] Team_050 possession (Score: 104-91)
Tyler Smith drives and kicks out. Larry Curry attempts a Midrange. Contested by Giannis Johnson (3.3 feet, MAN). LARRY CURRY MAKES IT!
Score: 104-93

================================================================================
                              4TH QUARTER COMPLETE                              
================================================================================

4TH QUARTER SCORE: Team_085 31, Team_050 20

BOX SCORE:
================================================================================

Team_085
--------------------------------------------------------------------------------
Player                MIN  PTS  REB  AST  TO      FG   FG%      3P   3P%
--------------------------------------------------------------------------------
Stephen Bird           35    9    0    0   0   4/4   100.0     0/0   0.0
Paul Wagner            38    8    6    2   0   3/3   100.0     0/0   0.0
Collin Mobley          35    6    3    1   0   3/4    75.0     0/0   0.0
Magic Beal             35    6    0    1   0   2/3    66.7     0/0   0.0
Malcolm Beal           14    2    1    0   0   1/1   100.0     0/0   0.0
Larry Duncan           35    0    4    1   0   0/2     0.0     0/0   0.0
Khris Brogdon          14    0    0    1   0   0/1     0.0     0/0   0.0
Jalen Leonard          11    0    1    0   0   0/0     0.0     0/0   0.0
Jordan Morant          14    0    0    0   0   0/1     0.0     0/0   0.0
Giannis Johnson        14    0    0    0   0   0/1     0.0     0/0   0.0

TEAM: FG: 13/20 (65.0%), 3PT: 1/6 (16.7%), REB: 15 (4 off, 11 def), AST: 6, TO: 1
TEAM FOULS: 5 [Team_050 in BONUS]


Team_050
--------------------------------------------------------------------------------
Player                MIN  PTS  REB  AST  TO      FG   FG%      3P   3P%
--------------------------------------------------------------------------------
LeBron Bridges         35    6    2    0   0   2/6    33.3     0/0   0.0
Damian O'Neal          14    5    0    0   0   2/2   100.0     0/0   0.0
Collin Bane            35    4    3    1   0   2/3    66.7     0/0   0.0
Giannis LaVine         35    3    0    0   0   1/3    33.3     0/0   0.0
Larry Curry            14    2    2    0   0   1/2    50.0     0/0   0.0
Joel Banchero          35    0    3    0   0   0/1     0.0     0/0   0.0
Donovan Trent          35    0    0    0   0   0/1     0.0     0/0   0.0
Dwyane Towns           14    0    1    0   0   0/1     0.0     0/0   0.0

TEAM: FG: 8/19 (42.1%), 3PT: 1/8 (12.5%), REB: 11 (4 off, 7 def), AST: 1, TO: 2
TEAM FOULS: 4

================================================================================

================================================================================
                               FULL GAME COMPLETE                               
================================================================================

FINAL SCORE: Team_085 104, Team_050 93

SCORING BY QUARTER:
--------------------------------------------------------------------------------
Team                     Q1     Q2     Q3     Q4    FINAL
--------------------------------------------------------------------------------
Team_085                 21     23     29     31      104
Team_050                 16     21     36     20       93
--------------------------------------------------------------------------------

FULL GAME BOX SCORE:
================================================================================

Team_085
--------------------------------------------------------------------------------
Player                MIN  PTS  REB  AST  TO      FG   FG%      3P   3P%      FT STL BLK
--------------------------------------------------------------------------------
Paul Wagner            38   24   15    6   1   9/13   69.2   3/4    75.0   6/7     2   2
Magic Beal             35   12    0    5   2   4/7    57.1   1/3    33.3   2/2     0   1
Stephen Bird           35   22    0    2   0   7/12   58.3   2/7    28.6   1/3     1   0
Larry Duncan           35    9   14    5   1   4/10   40.0   1/5    20.0   2/2     1   1
Collin Mobley          35   12    7    4   2   8/14   57.1   0/0     0.0   2/2     1   0
Khris Brogdon          14    9    0    1   1   3/5    60.0   1/3    33.3   2/2     0   0
Jordan Morant          14    2    0    1   0   0/4     0.0   0/3     0.0   0/0     0   0
Giannis Johnson        14    0    2    1   1   1/4    25.0   0/2     0.0   0/0     0   0
Malcolm Beal           14    9    6    1   0   5/7    71.4   0/0     0.0   2/2     1   0
Jalen Leonard          11    0    4    0   0   0/2     0.0   0/1     0.0   0/0     2   0

TEAM: FG: 42/79 (53.2%), 3PT: 8/28 (28.6%), REB: 47 (12 off, 35 def), AST: 26, TO: 8


Team_050
--------------------------------------------------------------------------------
Player                MIN  PTS  REB  AST  TO      FG   FG%      3P   3P%      FT STL BLK
--------------------------------------------------------------------------------
Giannis LaVine         35    9    0    2   0   3/7    42.9   2/5    40.0   1/1     1   0
Joel Banchero          35   15    9    3   2   6/11   54.5   2/3    66.7   1/1     0   0
Collin Bane            35    8   15    2   2   4/7    57.1   0/2     0.0   2/2     2   1
LeBron Bridges         35   21    7    4   2   9/18   50.0   1/3    33.3   8/10    0   0
Donovan Trent          35   11    0    0   3   4/8    50.0   1/1   100.0   3/4     0   0
Damian O'Neal          14    5    0    0   2   3/4    75.0   0/1     0.0   1/1     0   0
Dwyane Towns           14    2    2    1   0   1/7    14.3   0/3     0.0   0/1     0   0
Larry Curry            14    2    7    0   2   0/3     0.0   0/2     0.0   1/2     0   0
Luka Gasol             14    4    0    0   1   2/3    66.7   0/0     0.0   2/2     0   1
Tyler Smith            14   10    7    0   1   4/4   100.0   0/0     0.0   4/5     0   0

TEAM: FG: 36/72 (50.0%), 3PT: 6/20 (30.0%), REB: 48 (11 off, 37 def), AST: 12, TO: 15

================================================================================
