================================================================================
                        FULL GAME - Team_088 vs Team_064                        
================================================================================

================================================================================
                       1ST QUARTER - Team_088 vs Team_064                       
================================================================================

[12:00] Team_088 possession (Score: 0-0)
FOUL! Reach-in foul on Ja Mitchell during the drive. [Team fouls: 1] No free throws, side out. (Ja Mitchell: 1 personal fouls)

[11:45] Team_088 possession (Score: 0-0)
Josh Duncan attempts a 3Pt. Wide open! Ja Mitchell is 6.5 feet away. [ZONE] Josh Duncan misses. Rebound secured by Russell Simons.

[11:31] Team_064 possession (Score: 0-0)
Shai Hyland loses control! Ball rolls out of bounds! TURNOVER! (dead ball)

[11:19] Team_088 possession (Score: 0-0)
FOUL! Reach-in foul on Ja Mitchell during the drive. [Team fouls: 2] No free throws, side out. (Ja Mitchell: 2 personal fouls)

[11:02] Team_088 possession (Score: 0-0)
Allen Ming attempts a Midrange. Contested by Jordan Mitchell (2.3 feet, ZONE). Allen Ming misses. Rebound secured by Russell Simons.

[10:43] Team_064 possession (Score: 0-0)
Kawhi Irving drives to the basket... Kawhi Irving throws a bad pass! Stolen by Giannis Smith! TURNOVER! (live ball)

[10:27] Team_088 possession (Score: 0-0)
Josh Duncan attempts a Layup. BLOCKED BY JA MITCHELL! Ball is loose! Rebound secured by Shai Hyland.

[10:10] Team_064 possession (Score: 0-0)
Ja Mitchell drives and kicks out. Shai Hyland attempts a 3Pt. Contested by Tobias Haliburton (5.9 feet, ZONE). Shai Hyland misses. Rebound secured by Tyler Hyland.

[09:54] Team_088 possession (Score: 0-0)
Tobias Haliburton attempts a 3Pt. Wide open! Jordan Mitchell is 6.2 feet away. [MAN] Tobias Haliburton misses. Rebound secured by Kawhi Irving.

[09:41] Team_064 possession (Score: 0-0)
Shai Hyland attempts a Layup. Wide open! Giannis Smith is 6.5 feet away. [ZONE] SHAI HYLAND MAKES IT!
Score: 0-2

[09:29] Team_088 possession (Score: 0-2)
Allen Ming drives, picks up Russell Simons. Help arrives from Jordan Mitchell! Allen Ming attempts a Dunk. Contested by Jordan Mitchell (2.4 feet, ZONE). ALLEN MING MAKES IT! Assist: Josh Duncan
Score: 2-2

[09:13] Team_064 possession (Score: 2-2)
Shai Hyland drives and kicks out. Jordan Mitchell attempts a Midrange. Contested by Tyler Hyland (3.1 feet, ZONE). JORDAN MITCHELL MAKES IT! Assist: Ja Mitchell
Score: 2-4

[09:01] Team_088 possession (Score: 2-4)
Giannis Smith makes the Layup and draws the foul on Russell Simons! And-1! Giannis Smith to the line for 1. [Team fouls: 3] (Russell Simons: 1 personal fouls)   FT 1/1: GOOD Giannis Smith makes 1/1 from the line.
Score: 5-4

[08:44] Team_064 possession (Score: 5-4)
Russell Simons attempts a Layup. BLOCKED BY GIANNIS SMITH! Ball is loose! Rebound secured by Tyler Hyland.

[08:25] Team_088 possession (Score: 5-4)
Josh Duncan attempts a Midrange. Contested by Ja Mitchell (5.6 feet, MAN). Josh Duncan misses. Rebound secured by Shai Hyland.

[08:13] Team_064 possession (Score: 5-4)
Kawhi Irving attempts a 3Pt. Contested by Tobias Haliburton (2.8 feet, ZONE). KAWHI IRVING MAKES IT! Assist: Ja Mitchell
Score: 5-7

[08:01] Team_088 possession (Score: 5-7)
Tyler Hyland attempts a 3Pt. Wide open! Kawhi Irving is 8.6 feet away. [MAN] Tyler Hyland misses. Rebound secured by Shai Hyland.

[07:44] Team_064 possession (Score: 5-7)
Kawhi Irving drives and kicks out. Kawhi Irving attempts a 3Pt. Contested by Tyler Hyland (2.2 feet, MAN). Kawhi Irving misses. Rebound secured by Giannis Smith.

[07:31] Team_088 possession (Score: 5-7)
Giannis Smith makes the Layup and draws the foul on Russell Simons! And-1! Giannis Smith to the line for 1. [Team fouls: 4] (Russell Simons: 2 personal fouls)   FT 1/1: GOOD Giannis Smith makes 1/1 from the line.
Score: 8-7

[07:20] Team_064 possession (Score: 8-7)
Ja Mitchell attempts a Midrange. Contested by Tyler Hyland (2.5 feet, ZONE). Ja Mitchell misses. Rebound secured by Tyler Hyland.

[07:07] Team_088 possession (Score: 8-7)
Allen Ming attempts a Midrange. Contested by Shai Hyland (5.5 feet, MAN). Allen Ming misses. Rebound secured by Russell Simons.

[06:55] Team_064 possession (Score: 8-7)
Jordan Mitchell drives and kicks out. Ja Mitchell attempts a 3Pt. Contested by Tobias Haliburton (3.5 feet, ZONE). Ja Mitchell misses. Rebound secured by Tyler Hyland.

[06:38] Team_088 possession (Score: 8-7)
Allen Ming attempts a Midrange. Wide open! Jordan Mitchell is 7.7 feet away. [ZONE] Allen Ming misses. Offensive rebound by Allen Ming! Allen Ming's putback is no good. Offensive rebound by Allen Ming! Allen Ming kicks it out.

[06:20] Team_088 possession (Score: 8-7)
Allen Ming attempts a Midrange. Wide open! Shai Hyland is 6.4 feet away. [MAN] Allen Ming misses. Rebound secured by Shai Hyland.

[06:06] Team_064 possession (Score: 8-7)
Kawhi Irving attempts a Midrange. Contested by Josh Duncan (4.9 feet, ZONE). KAWHI IRVING MAKES IT! Assist: Russell Simons
Score: 8-9

[05:48] Team_088 possession (Score: 8-9)
Tyler Hyland attempts a Midrange. Contested by Kawhi Irving (3.6 feet, MAN). TYLER HYLAND MAKES IT! Assist: Allen Ming
Score: 10-9

[05:31] Team_064 possession (Score: 10-9)
Shai Hyland attempts a Layup. BLOCKED BY TOBIAS HALIBURTON! Ball is loose! Rebound secured by Allen Ming.

[05:19] Team_088 possession (Score: 10-9)
FOUL! Holding foul on Shai Hyland. [IN THE BONUS! 5 team fouls] Allen Ming to the line for 2 free throws. (Shai Hyland: 1 personal fouls)   FT 1/2: GOOD   FT 2/2: GOOD Allen Ming makes 2/2 from the line.
Score: 12-9

[05:05] Team_064 possession (Score: 12-9)
Jordan Mitchell attempts a 3Pt. Contested by Tobias Haliburton (3.8 feet, ZONE). Jordan Mitchell misses. Rebound secured by Giannis Smith.

[04:54] Team_088 possession (Score: 12-9)
Josh Duncan drives and kicks out. Josh Duncan attempts a 3Pt. Contested by Ja Mitchell (5.2 feet, ZONE). Josh Duncan misses. Rebound secured by Russell Simons.

[04:40] Team_064 possession (Score: 12-9)
Ja Mitchell attempts a 3Pt. Wide open! Tobias Haliburton is 7.1 feet away. [ZONE] Ja Mitchell misses. Rebound secured by Allen Ming.

[04:29] Team_088 possession (Score: 12-9)
FOUL! Reach-in foul on Russell Simons during the drive. [IN THE BONUS! 6 team fouls] Giannis Smith to the line for 2 free throws. (Russell Simons: 3 personal fouls)   FT 1/2: GOOD   FT 2/2: GOOD Giannis Smith makes 2/2 from the line.
Score: 14-9

[04:13] Team_064 possession (Score: 14-9)
Shai Hyland attempts a Midrange. Heavily contested by Allen Ming (1.7 feet, ZONE)! Shai Hyland misses. Rebound secured by Giannis Smith.

[03:58] Team_088 possession (Score: 14-9)
Tobias Haliburton drives, Jordan Mitchell stays with him. Tobias Haliburton attempts a Layup. Heavily contested by Jordan Mitchell (0.5 feet, MAN)! TOBIAS HALIBURTON MAKES IT! Assist: Giannis Smith
Score: 16-9

[03:39] Team_064 possession (Score: 16-9)
FOUL! Reach-in foul on Giannis Smith during the drive. [Team fouls: 1] No free throws, side out. (Giannis Smith: 1 personal fouls)

[03:26] Team_064 possession (Score: 16-9)
Ja Mitchell drives and kicks out. Russell Simons attempts a 3Pt. Contested by Giannis Smith (3.6 feet, MAN). Russell Simons misses. Rebound secured by Tyler Hyland.

[03:07] Team_088 possession (Score: 16-9)
Giannis Smith attempts a Layup. Contested by Russell Simons (3.0 feet, MAN). Giannis Smith misses. Rebound secured by Shai Hyland.

[02:50] Team_064 possession (Score: 16-9)
Shai Hyland attempts a 3Pt. Wide open! Tobias Haliburton is 7.9 feet away. [ZONE] SHAI HYLAND MAKES IT! Assist: Jordan Mitchell
Score: 16-12

[02:35] Team_088 possession (Score: 16-12)
Josh Duncan attempts a Midrange. Wide open! Ja Mitchell is 6.0 feet away. [MAN] JOSH DUNCAN MAKES IT!
Score: 18-12

[02:22] Team_064 possession (Score: 18-12)
Ja Mitchell attempts a 3Pt. Contested by Tobias Haliburton (5.2 feet, ZONE). Ja Mitchell misses. Rebound secured by Tyler Hyland.

[02:06] Team_088 possession (Score: 18-12)
FOUL! Holding foul on Shai Hyland. [IN THE BONUS! 7 team fouls] Allen Ming to the line for 2 free throws. (Shai Hyland: 2 personal fouls)   FT 1/2: GOOD   FT 2/2: GOOD Allen Ming makes 2/2 from the line.
Score: 20-12

[01:52] Team_064 possession (Score: 20-12)
Shai Hyland attempts a 3Pt. Contested by Tobias Haliburton (4.0 feet, ZONE). Shai Hyland misses. Rebound secured by Allen Ming.

[01:37] Team_088 possession (Score: 20-12)
Josh Duncan attempts a 3Pt. Contested by Ja Mitchell (3.8 feet, MAN). Josh Duncan misses. Rebound secured by Russell Simons.

[01:20] Team_064 possession (Score: 20-12)
Jordan Mitchell drives to the basket... FOUL! Offensive foul on Jordan Mitchell! Tobias Haliburton drew the charge! [Team fouls: 8] (Jordan Mitchell: 1 personal fouls) TURNOVER! (dead ball)

[01:05] Team_088 possession (Score: 20-12)
Tobias Haliburton drives to the basket... FOUL! Offensive foul on Tobias Haliburton! Jordan Mitchell drew the charge! [Team fouls: 2] (Tobias Haliburton: 1 personal fouls) TURNOVER! (dead ball)

[00:48] Team_064 possession (Score: 20-12)
Shai Hyland attempts a 3Pt. Wide open! Allen Ming is 6.2 feet away. [MAN] Shai Hyland misses. Rebound secured by Giannis Smith.

[00:31] Team_088 possession (Score: 20-12)
Tyler Hyland attempts a 3Pt. Wide open! Ja Mitchell is 7.3 feet away. [ZONE] TYLER HYLAND MAKES IT! Assist: Tobias Haliburton
Score: 23-12

[00:16] Team_064 possession (Score: 23-12)
FOUL! Holding foul on Tyler Hyland. [Team fouls: 3] No free throws, side out. (Tyler Hyland: 1 personal fouls)

[00:03] Team_064 possession (Score: 23-12)
Jordan Mitchell attempts a Midrange. Contested by Josh Duncan (3.8 feet, ZONE). JORDAN MITCHELL MAKES IT!
Score: 23-14

================================================================================
                              1ST QUARTER COMPLETE                              
================================================================================

1ST QUARTER SCORE: Team_088 23, Team_064 14

BOX SCORE:
================================================================================

Team_088
--------------------------------------------------------------------------------
Player                MIN  PTS  REB  AST  TO      FG   FG%      3P   3P%
--------------------------------------------------------------------------------
Giannis Smith          12    8    4    1   0   3/4    75.0     0/0   0.0
Allen Ming             12    6    4    1   0   3/6    50.0     0/0   0.0
Tyler Hyland           12    5    6    0   0   2/3    66.7     0/0   0.0
Josh Duncan            12    2    0    1   0   1/6    16.7     0/0   0.0
Tobias Haliburton      12    2    0    1   0   1/2    50.0     0/0   0.0

TEAM: FG: 10/21 (47.6%), 3PT: 1/5 (20.0%), REB: 14 (1 off, 13 def), AST: 4, TO: 1
TEAM FOULS: 3


Team_064
--------------------------------------------------------------------------------
Player                MIN  PTS  REB  AST  TO      FG   FG%      3P   3P%
--------------------------------------------------------------------------------
Shai Hyland            12    5    5    0   0   2/6    33.3     0/0   0.0
Kawhi Irving           12    5    1    0   0   2/3    66.7     0/0   0.0
Jordan Mitchell        12    4    0    1   0   2/4    50.0     0/0   0.0
Russell Simons         12    0    5    1   0   0/1     0.0     0/0   0.0
Ja Mitchell            12    0    0    2   0   0/5     0.0     0/0   0.0

TEAM: FG: 6/19 (31.6%), 3PT: 2/7 (28.6%), REB: 11 (0 off, 11 def), AST: 4, TO: 3
TEAM FOULS: 8 [Team_088 in BONUS]

================================================================================

================================================================================
                       2ND QUARTER - Team_088 vs Team_064                       
================================================================================

[12:00] Team_088 possession (Score: 23-14)
FOUL! Shooting foul on Russell Simons. Allen Ming to the line for 2 free throws. [Team fouls: 1] (Russell Simons: 1 personal fouls)   FT 1/2: GOOD   FT 2/2: GOOD Allen Ming makes 2/2 from the line.
Score: 25-14

[11:42] Team_064 possession (Score: 25-14)
Jordan Mitchell loses control! Ball rolls out of bounds! TURNOVER! (dead ball)

[11:42] Substitution (Team_088): Josh Duncan OUT → Klay Quickley IN (stamina_rule2)

[11:42] Substitution (Team_088): Tobias Haliburton OUT → Vince Carter IN (stamina_rule2)

[11:42] Substitution (Team_088): Tyler Hyland OUT → Pau Bird IN (stamina_rule2)

[11:42] Substitution (Team_088): Giannis Smith OUT → Zion Harris IN (stamina_rule2)

[11:42] Substitution (Team_088): Allen Ming OUT → Josh Embiid IN (stamina_rule2)

[11:42] Substitution (Team_064): Ja Mitchell OUT → CJ Haliburton IN (stamina_rule2)

[11:42] Substitution (Team_064): Jordan Mitchell OUT → Ja Simmons IN (stamina_rule2)

[11:42] Substitution (Team_064): Kawhi Irving OUT → Tobias Herro IN (stamina_rule2)

[11:42] Substitution (Team_064): Russell Simons OUT → Austin Smith IN (stamina_rule2)

[11:42] Substitution (Team_064): Shai Hyland OUT → Devin Cunningham IN (stamina_rule2)

[11:29] Team_088 possession (Score: 25-14)
Zion Harris attempts a 3Pt. Contested by Austin Smith (3.2 feet, MAN). Zion Harris misses. Rebound secured by Devin Cunningham.

[11:14] Team_064 possession (Score: 25-14)
Ja Simmons drives and kicks out. Austin Smith attempts a 3Pt. Contested by Pau Bird (5.6 feet, ZONE). Austin Smith misses. Rebound secured by Pau Bird.

[10:58] Team_088 possession (Score: 25-14)
Zion Harris attempts a Layup. BLOCKED BY AUSTIN SMITH! Ball deflects out of bounds off Zion Harris.

[10:45] Team_064 possession (Score: 25-14)
Austin Smith loses control! Ball rolls out of bounds! TURNOVER! (dead ball)

[10:27] Team_088 possession (Score: 25-14)
Josh Embiid attempts a Layup. Contested by Devin Cunningham (4.3 feet, MAN). JOSH EMBIID MAKES IT! Assist: Vince Carter
Score: 27-14

[10:12] Team_064 possession (Score: 27-14)
Ja Simmons attempts a 3Pt. Contested by Vince Carter (4.1 feet, MAN). Ja Simmons misses. Rebound secured by Pau Bird.

[09:58] Team_088 possession (Score: 27-14)
Vince Carter drives to the basket... FOUL! Offensive foul on Vince Carter! Austin Smith drew the charge! [Team fouls: 1] (Vince Carter: 1 personal fouls) TURNOVER! (dead ball)

[09:41] Team_064 possession (Score: 27-14)
Tobias Herro attempts a 3Pt. Contested by Pau Bird (2.2 feet, MAN). TOBIAS HERRO MAKES IT! Assist: CJ Haliburton
Score: 27-17

[09:31] Team_088 possession (Score: 27-17)
Klay Quickley attempts a Layup. BLOCKED BY TOBIAS HERRO! Ball is loose! Rebound secured by Devin Cunningham.

[09:14] Team_064 possession (Score: 27-17)
Ja Simmons attempts a 3Pt. Contested by Pau Bird (5.3 feet, ZONE). Ja Simmons misses. Rebound secured by Josh Embiid.

[09:01] Team_088 possession (Score: 27-17)
Josh Embiid attempts a Layup. BLOCKED BY AUSTIN SMITH! Ball is loose! Rebound secured by Ja Simmons.

[08:51] Team_064 possession (Score: 27-17)
Ja Simmons loses control! Ball rolls out of bounds! TURNOVER! (dead ball)

[08:35] Team_088 possession (Score: 27-17)
Vince Carter attempts a Midrange. Contested by Tobias Herro (4.5 feet, ZONE). Vince Carter misses. Rebound secured by Austin Smith.

[08:24] Team_064 possession (Score: 27-17)
Ja Simmons attempts a 3Pt. Contested by Vince Carter (4.4 feet, MAN). Ja Simmons misses. Rebound secured by Pau Bird.

[08:11] Team_088 possession (Score: 27-17)
Pau Bird attempts a 3Pt. Contested by Austin Smith (4.4 feet, ZONE). Pau Bird misses. Rebound secured by Ja Simmons.

[07:59] Team_064 possession (Score: 27-17)
CJ Haliburton drives, Klay Quickley stays with him. CJ Haliburton attempts a Dunk. Wide open! Klay Quickley is 6.2 feet away. [MAN] CJ HALIBURTON MAKES IT! Assist: Tobias Herro
Score: 27-19

[07:44] Team_088 possession (Score: 27-19)
Josh Embiid makes the Dunk and draws the foul on Austin Smith! And-1! Josh Embiid to the line for 1. [Team fouls: 2] (Austin Smith: 1 personal fouls)   FT 1/1: GOOD Josh Embiid makes 1/1 from the line.
Score: 30-19

[07:31] Team_064 possession (Score: 30-19)
Austin Smith drives, Zion Harris stays with him. Austin Smith attempts a Dunk. Contested by Zion Harris (4.1 feet, ZONE). Austin Smith misses. Rebound secured by Zion Harris.

[07:16] Team_088 possession (Score: 30-19)
Josh Embiid drives to the basket... Josh Embiid throws a bad pass! Stolen by Austin Smith! TURNOVER! (live ball)

[07:02] Team_064 possession (Score: 30-19)
CJ Haliburton attempts a Layup. Contested by Klay Quickley (5.9 feet, MAN). CJ HALIBURTON MAKES IT! Assist: Ja Simmons
Score: 30-21

[06:49] Team_088 possession (Score: 30-21)
Zion Harris commits a violation (traveling/carry)! TURNOVER! (dead ball)

[06:36] Team_064 possession (Score: 30-21)
Devin Cunningham attempts a Layup. Contested by Josh Embiid (5.1 feet, MAN). Devin Cunningham misses. Rebound secured by Pau Bird.

[06:26] Team_088 possession (Score: 30-21)
Zion Harris throws a bad pass out of bounds! TURNOVER! (dead ball)

[06:13] Team_064 possession (Score: 30-21)
CJ Haliburton drives, Zion Harris stays with him. CJ Haliburton attempts a Layup. Contested by Zion Harris (3.8 feet, ZONE). CJ Haliburton misses. Rebound secured by Zion Harris.

[05:56] Team_088 possession (Score: 30-21)
Vince Carter attempts a 3Pt. Contested by Ja Simmons (5.3 feet, MAN). Vince Carter misses. Offensive rebound by Josh Embiid! Josh Embiid kicks it out.

[05:38] Team_088 possession (Score: 30-21)
Pau Bird attempts a Layup. Wide open! Tobias Herro is 6.9 feet away. [MAN] PAU BIRD MAKES IT! Assist: Zion Harris
Score: 32-21

[05:23] Team_064 possession (Score: 32-21)
Austin Smith drives and kicks out. Ja Simmons attempts a 3Pt. Wide open! Vince Carter is 6.5 feet away. [MAN] Ja Simmons misses. Rebound secured by Zion Harris.

[05:05] Team_088 possession (Score: 32-21)
Vince Carter makes the Layup and draws the foul on Austin Smith! And-1! Vince Carter to the line for 1. [Team fouls: 3] (Austin Smith: 2 personal fouls)   FT 1/1: GOOD Vince Carter makes 1/1 from the line.
Score: 35-21

[04:54] Team_064 possession (Score: 35-21)
Austin Smith attempts a Layup. BLOCKED BY ZION HARRIS! Ball is loose! Rebound secured by Pau Bird.

[04:43] Team_088 possession (Score: 35-21)
Vince Carter drives and kicks out. Vince Carter attempts a 3Pt. Contested by Ja Simmons (5.4 feet, MAN). VINCE CARTER MAKES IT! Assist: Pau Bird
Score: 38-21

[04:28] Team_064 possession (Score: 38-21)
Austin Smith loses control! Ball rolls out of bounds! TURNOVER! (dead ball)

[04:14] Team_088 possession (Score: 38-21)
FOUL! Reach-in foul on Ja Simmons during the drive. [Team fouls: 4] No free throws, side out. (Ja Simmons: 1 personal fouls)

[03:57] Team_088 possession (Score: 38-21)
Vince Carter drives and kicks out. Josh Embiid attempts a 3Pt. Wide open! Ja Simmons is 7.8 feet away. [ZONE] Josh Embiid misses. Rebound secured by Devin Cunningham.

[03:44] Team_064 possession (Score: 38-21)
Ja Simmons attempts a Midrange. Contested by Vince Carter (4.4 feet, ZONE). JA SIMMONS MAKES IT!
Score: 38-23

[03:27] Team_088 possession (Score: 38-23)
Vince Carter commits a violation (traveling/carry)! TURNOVER! (dead ball)

[03:11] Team_064 possession (Score: 38-23)
Austin Smith attempts a Layup. Wide open! Zion Harris is 6.9 feet away. [MAN] Austin Smith misses. Rebound secured by Josh Embiid.

[02:56] Team_088 possession (Score: 38-23)
Vince Carter attempts a 3Pt. Contested by Austin Smith (4.0 feet, ZONE). Vince Carter misses. Rebound secured by Austin Smith.

[02:41] Team_064 possession (Score: 38-23)
CJ Haliburton drives, Klay Quickley stays with him. CJ Haliburton attempts a Layup. Wide open! Klay Quickley is 7.9 feet away. [MAN] CJ Haliburton misses. Rebound secured by Pau Bird.

[02:23] Team_088 possession (Score: 38-23)
Vince Carter attempts a 3Pt. Wide open! Austin Smith is 8.4 feet away. [ZONE] Vince Carter misses. Offensive rebound by Josh Embiid! Josh Embiid kicks it out.

[02:09] Team_088 possession (Score: 38-23)
Pau Bird makes the Dunk and draws the foul on Ja Simmons! And-1! Pau Bird to the line for 1. [BONUS: 5 team fouls] (Ja Simmons: 2 personal fouls)   FT 1/1: GOOD Pau Bird makes 1/1 from the line.
Score: 41-23

[01:51] Team_064 possession (Score: 41-23)
CJ Haliburton attempts a 3Pt. Wide open! Pau Bird is 7.0 feet away. [ZONE] CJ HALIBURTON MAKES IT! Assist: Devin Cunningham
Score: 41-26

[01:40] Team_088 possession (Score: 41-26)
Josh Embiid attempts a Midrange. Wide open! CJ Haliburton is 9.8 feet away. [ZONE] JOSH EMBIID MAKES IT!
Score: 43-26

[01:27] Team_064 possession (Score: 43-26)
CJ Haliburton drives and kicks out. Tobias Herro attempts a 3Pt. Contested by Klay Quickley (3.6 feet, ZONE). TOBIAS HERRO MAKES IT! Assist: Ja Simmons
Score: 43-29

[01:10] Team_088 possession (Score: 43-29)
Zion Harris attempts a Midrange. Contested by Tobias Herro (5.0 feet, ZONE). ZION HARRIS MAKES IT!
Score: 45-29

[00:58] Team_064 possession (Score: 45-29)
Devin Cunningham drives, picks up Zion Harris. Help arrives from Klay Quickley! Devin Cunningham attempts a Dunk. Contested by Klay Quickley (3.7 feet, ZONE). DEVIN CUNNINGHAM MAKES IT!
Score: 45-31

[00:40] Team_088 possession (Score: 45-31)
Pau Bird drives and kicks out. Pau Bird attempts a 3Pt. Contested by Austin Smith (3.0 feet, ZONE). Pau Bird misses. Rebound secured by Austin Smith.

[00:25] Team_064 possession (Score: 45-31)
Ja Simmons attempts a Layup. Wide open! Vince Carter is 8.0 feet away. [MAN] Ja Simmons misses. Rebound secured by Zion Harris.

[00:07] Team_088 possession (Score: 45-31)
Josh Embiid attempts a Midrange. Contested by Devin Cunningham (5.2 feet, MAN). Josh Embiid misses. Rebound secured by Ja Simmons.

================================================================================
                              2ND QUARTER COMPLETE                              
================================================================================

2ND QUARTER SCORE: Team_088 22, Team_064 17

BOX SCORE:
================================================================================

Team_088
--------------------------------------------------------------------------------
Player                MIN  PTS  REB  AST  TO      FG   FG%      3P   3P%
--------------------------------------------------------------------------------
Josh Embiid            12    7    4    0   0   3/5    60.0     0/0   0.0
Vince Carter           12    6    0    1   0   2/5    40.0     0/0   0.0
Pau Bird               12    5    6    1   0   2/4    50.0     0/0   0.0
Allen Ming             13    2    0    0   0   1/1   100.0     0/0   0.0
Zion Harris            12    2    4    1   0   1/3    33.3     0/0   0.0
Klay Quickley          12    0    0    0   0   0/1     0.0     0/0   0.0

TEAM: FG: 9/19 (47.4%), 3PT: 0/3 (0.0%), REB: 14 (2 off, 12 def), AST: 3, TO: 5
TEAM FOULS: 1


Team_064
--------------------------------------------------------------------------------
Player                MIN  PTS  REB  AST  TO      FG   FG%      3P   3P%
--------------------------------------------------------------------------------
CJ Haliburton          12    7    0    1   0   3/5    60.0     0/0   0.0
Tobias Herro           12    6    0    1   0   2/2   100.0     0/0   0.0
Devin Cunningham       12    2    3    1   0   1/2    50.0     0/0   0.0
Ja Simmons             12    2    3    2   0   1/6    16.7     0/0   0.0
Austin Smith           12    0    3    0   0   0/4     0.0     0/0   0.0

TEAM: FG: 7/19 (36.8%), 3PT: 2/5 (40.0%), REB: 9 (0 off, 9 def), AST: 5, TO: 4
TEAM FOULS: 5 [Team_088 in BONUS]

================================================================================

================================================================================
                       3RD QUARTER - Team_088 vs Team_064                       
================================================================================

[12:00] Team_088 possession (Score: 45-31)
Allen Ming attempts a Midrange. Contested by Kawhi Irving (4.6 feet, ZONE). Allen Ming misses. Offensive rebound by Allen Ming! Allen Ming's putback is no good. Offensive rebound by Allen Ming! Allen Ming kicks it out.

[11:49] Team_088 possession (Score: 45-31)
Tyler Hyland attempts a 3Pt. Contested by Ja Mitchell (4.7 feet, ZONE). TYLER HYLAND MAKES IT! Assist: Tobias Haliburton
Score: 48-31

[11:37] Team_064 possession (Score: 48-31)
Russell Simons drives to the basket... FOUL! Offensive foul on Russell Simons! Giannis Smith drew the charge! [Team fouls: 1] (Russell Simons: 1 personal fouls) TURNOVER! (dead ball)

[11:19] Team_088 possession (Score: 48-31)
Tyler Hyland attempts a Layup. Contested by Russell Simons (3.1 feet, ZONE). TYLER HYLAND MAKES IT! Assist: Josh Duncan
Score: 50-31

[11:01] Team_064 possession (Score: 50-31)
Shai Hyland attempts a Midrange. Contested by Giannis Smith (2.7 feet, ZONE). SHAI HYLAND MAKES IT!
Score: 50-33

[10:45] Team_088 possession (Score: 50-33)
Allen Ming makes the Layup and draws the foul on Russell Simons! And-1! Allen Ming to the line for 1. [Team fouls: 2] (Russell Simons: 2 personal fouls)   FT 1/1: GOOD Allen Ming makes 1/1 from the line.
Score: 53-33

[10:29] Team_064 possession (Score: 53-33)
Russell Simons drives, picks up Giannis Smith. Help arrives from Tobias Haliburton! Russell Simons attempts a Dunk. Contested by Tobias Haliburton (2.4 feet, MAN). RUSSELL SIMONS MAKES IT! Assist: Jordan Mitchell
Score: 53-35

[10:17] Team_088 possession (Score: 53-35)
Tobias Haliburton attempts a 3Pt. Contested by Jordan Mitchell (5.4 feet, MAN). Tobias Haliburton misses. Offensive rebound by Allen Ming! Allen Ming puts it back in!
Score: 55-35

[10:06] Team_064 possession (Score: 55-35)
Ja Mitchell attempts a 3Pt. Contested by Tobias Haliburton (5.1 feet, ZONE). Ja Mitchell misses. Rebound secured by Allen Ming.

[09:52] Team_088 possession (Score: 55-35)
Tyler Hyland attempts a Layup. BLOCKED BY KAWHI IRVING! Ball is loose! Rebound secured by Kawhi Irving.

[09:33] Team_064 possession (Score: 55-35)
Ja Mitchell attempts a 3Pt. Contested by Josh Duncan (5.4 feet, MAN). Ja Mitchell misses. Rebound secured by Tyler Hyland.

[09:14] Team_088 possession (Score: 55-35)
Josh Duncan attempts a Midrange. Wide open! Shai Hyland is 6.1 feet away. [ZONE] Josh Duncan misses. Offensive rebound by Allen Ming! Allen Ming puts it back in!
Score: 57-35

[09:01] Team_064 possession (Score: 57-35)
Russell Simons attempts a Midrange. Contested by Giannis Smith (4.9 feet, MAN). Russell Simons misses. Rebound secured by Allen Ming.

[08:50] Team_088 possession (Score: 57-35)
Josh Duncan attempts a 3Pt. Contested by Ja Mitchell (3.8 feet, ZONE). Josh Duncan misses. FOUL! Loose ball foul on Kawhi Irving during the rebound battle. [Team fouls: 3] No free throws, side out. (Kawhi Irving: 1 personal fouls)

[08:34] Team_088 possession (Score: 57-35)
FOUL! Shooting foul on Kawhi Irving. Giannis Smith to the line for 2 free throws. [Team fouls: 4] (Kawhi Irving: 2 personal fouls)   FT 1/2: GOOD   FT 2/2: GOOD Giannis Smith makes 2/2 from the line.
Score: 59-35

[08:18] Team_064 possession (Score: 59-35)
Kawhi Irving attempts a Layup. Contested by Giannis Smith (5.5 feet, ZONE). KAWHI IRVING MAKES IT! Assist: Ja Mitchell
Score: 59-37

[08:04] Team_088 possession (Score: 59-37)
Tobias Haliburton drives, Russell Simons stays with him. Tobias Haliburton attempts a Dunk. Heavily contested by Russell Simons (0.5 feet, ZONE)! TOBIAS HALIBURTON MAKES IT! Assist: Tyler Hyland
Score: 61-37

[07:53] Team_064 possession (Score: 61-37)
Jordan Mitchell drives and kicks out. Shai Hyland attempts a 3Pt. Contested by Tobias Haliburton (2.7 feet, ZONE). Shai Hyland misses. Rebound secured by Giannis Smith.

[07:43] Team_088 possession (Score: 61-37)
Tyler Hyland attempts a 3Pt. Wide open! Kawhi Irving is 6.7 feet away. [MAN] TYLER HYLAND MAKES IT! Assist: Josh Duncan
Score: 64-37

[07:29] Team_064 possession (Score: 64-37)
Jordan Mitchell attempts a 3Pt. Heavily contested by Tobias Haliburton (1.9 feet, ZONE)! Jordan Mitchell misses. Rebound secured by Tyler Hyland.

[07:12] Team_088 possession (Score: 64-37)
Josh Duncan throws a bad pass! Stolen by Ja Mitchell! TURNOVER! (live ball)

[06:58] Team_064 possession (Score: 64-37)
Shai Hyland attempts a Midrange. Contested by Allen Ming (3.7 feet, MAN). SHAI HYLAND MAKES IT! Assist: Russell Simons
Score: 64-39

[06:39] Team_088 possession (Score: 64-39)
Tyler Hyland commits a violation (traveling/carry)! TURNOVER! (dead ball)

[06:23] Team_064 possession (Score: 64-39)
Ja Mitchell attempts a Midrange. Contested by Josh Duncan (3.1 feet, MAN). JA MITCHELL MAKES IT!
Score: 64-41

[06:12] Team_088 possession (Score: 64-41)
Josh Duncan attempts a 3Pt. Wide open! Ja Mitchell is 6.5 feet away. [ZONE] Josh Duncan misses. Rebound secured by Russell Simons.

[05:59] Team_064 possession (Score: 64-41)
Russell Simons drives and kicks out. Kawhi Irving attempts a 3Pt. Contested by Tyler Hyland (2.9 feet, MAN). Kawhi Irving misses. Rebound secured by Giannis Smith.

[05:43] Team_088 possession (Score: 64-41)
Allen Ming drives, picks up Russell Simons. Help arrives from Jordan Mitchell! Allen Ming attempts a Layup. Heavily contested by Jordan Mitchell (0.8 feet, ZONE)! ALLEN MING MAKES IT! Assist: Tyler Hyland
Score: 66-41

[05:26] Team_064 possession (Score: 66-41)
Shai Hyland attempts a 3Pt. Wide open! Allen Ming is 6.2 feet away. [MAN] Shai Hyland misses. FOUL! Loose ball foul on Tyler Hyland during the rebound battle. [Team fouls: 1] No free throws, side out. (Tyler Hyland: 1 personal fouls)

[05:13] Team_064 possession (Score: 66-41)
Kawhi Irving drives, Tyler Hyland stays with him. Kawhi Irving attempts a Dunk. Contested by Tyler Hyland (4.5 feet, MAN). Kawhi Irving misses. Rebound secured by Giannis Smith.

[04:57] Team_088 possession (Score: 66-41)
Tobias Haliburton attempts a 3Pt. Contested by Jordan Mitchell (4.1 feet, ZONE). Tobias Haliburton misses. Offensive rebound by Giannis Smith! Giannis Smith's putback is no good. Offensive rebound by Allen Ming! Allen Ming kicks it out.

[04:40] Team_088 possession (Score: 66-41)
Tobias Haliburton attempts a Midrange. Contested by Jordan Mitchell (5.4 feet, MAN). Tobias Haliburton misses. Offensive rebound by Allen Ming! Allen Ming puts it back in!
Score: 68-41

[04:26] Team_064 possession (Score: 68-41)
Jordan Mitchell loses the ball! Stripped by Tobias Haliburton! TURNOVER! (live ball)

[04:12] Team_088 possession (Score: 68-41)
Tobias Haliburton drives to the basket... Tobias Haliburton throws a bad pass out of bounds! TURNOVER! (dead ball)

[04:01] Team_064 possession (Score: 68-41)
Kawhi Irving attempts a Midrange. Contested by Tyler Hyland (3.5 feet, MAN). Kawhi Irving misses. Offensive rebound by Kawhi Irving! Kawhi Irving kicks it out.

[03:47] Team_064 possession (Score: 68-41)
FOUL! Shooting foul on Giannis Smith. Shai Hyland to the line for 2 free throws. [Team fouls: 2] (Giannis Smith: 1 personal fouls)   FT 1/2: GOOD   FT 2/2: GOOD Shai Hyland makes 2/2 from the line.
Score: 68-43

[03:32] Team_088 possession (Score: 68-43)
FOUL! Holding foul on Kawhi Irving. [IN THE BONUS! 5 team fouls] Tyler Hyland to the line for 2 free throws. (Kawhi Irving: 3 personal fouls)   FT 1/2: GOOD   FT 2/2: GOOD Tyler Hyland makes 2/2 from the line.
Score: 70-43

[03:21] Team_064 possession (Score: 70-43)
FOUL! Offensive foul on Jordan Mitchell! Tobias Haliburton drew the charge! [Team fouls: 6] (Jordan Mitchell: 1 personal fouls) TURNOVER! (dead ball)

[03:03] Team_088 possession (Score: 70-43)
Giannis Smith attempts a 3Pt. Contested by Ja Mitchell (2.9 feet, ZONE). Giannis Smith misses. Rebound secured by Kawhi Irving.

[02:47] Team_064 possession (Score: 70-43)
FOUL! Offensive foul on Shai Hyland! Allen Ming drew the charge! [Team fouls: 7] (Shai Hyland: 1 personal fouls) TURNOVER! (dead ball)

[02:30] Team_088 possession (Score: 70-43)
Josh Duncan attempts a Midrange. Contested by Ja Mitchell (4.5 feet, MAN). JOSH DUNCAN MAKES IT!
Score: 72-43

[02:14] Team_064 possession (Score: 72-43)
Russell Simons drives to the basket... Russell Simons loses control! Ball rolls out of bounds! TURNOVER! (dead ball)

[02:14] Substitution (Team_088): Josh Duncan OUT → Klay Quickley IN (stamina_rule2)

[02:14] Substitution (Team_088): Tobias Haliburton OUT → Vince Carter IN (stamina_rule2)

[02:14] Substitution (Team_088): Tyler Hyland OUT → Pau Bird IN (stamina_rule2)

[02:14] Substitution (Team_088): Giannis Smith OUT → Zion Harris IN (stamina_rule2)

[02:14] Substitution (Team_088): Allen Ming OUT → Josh Embiid IN (stamina_rule2)

[02:14] Substitution (Team_064): Ja Mitchell OUT → CJ Haliburton IN (stamina_rule2)

[02:14] Substitution (Team_064): Jordan Mitchell OUT → Ja Simmons IN (stamina_rule2)

[02:14] Substitution (Team_064): Kawhi Irving OUT → Tobias Herro IN (stamina_rule2)

[02:14] Substitution (Team_064): Russell Simons OUT → Austin Smith IN (stamina_rule2)

[02:14] Substitution (Team_064): Shai Hyland OUT → Devin Cunningham IN (stamina_rule2)

[01:58] Team_088 possession (Score: 72-43)
Klay Quickley makes the Dunk and draws the foul on Tobias Herro! And-1! Klay Quickley to the line for 1. [BONUS: 8 team fouls] (Tobias Herro: 1 personal fouls)   FT 1/1: MISS Klay Quickley makes 0/1 from the line. Rebound secured by Ja Simmons.
Score: 74-43

[01:42] Team_064 possession (Score: 74-43)
FOUL! Offensive foul on Ja Simmons! Vince Carter drew the charge! [Team fouls: 9] (Ja Simmons: 1 personal fouls) TURNOVER! (dead ball)

[01:29] Team_088 possession (Score: 74-43)
Vince Carter attempts a 3Pt. Contested by Ja Simmons (3.0 feet, MAN). Vince Carter misses. Rebound secured by Austin Smith.

[01:14] Team_064 possession (Score: 74-43)
Tobias Herro attempts a Midrange. Contested by Vince Carter (4.8 feet, ZONE). TOBIAS HERRO MAKES IT! Assist: Austin Smith
Score: 74-45

[01:01] Team_088 possession (Score: 74-45)
Josh Embiid drives, Devin Cunningham stays with him. Josh Embiid attempts a Layup. Heavily contested by Devin Cunningham (0.5 feet, MAN)! JOSH EMBIID MAKES IT! Assist: Zion Harris
Score: 76-45

[00:47] Team_064 possession (Score: 76-45)
Ja Simmons attempts a 3Pt. Contested by Pau Bird (2.3 feet, ZONE). Ja Simmons misses. Rebound secured by Josh Embiid.

[00:28] Team_088 possession (Score: 76-45)
Zion Harris drives to the basket... Zion Harris loses the ball! Stripped by Austin Smith! TURNOVER! (live ball)

[00:15] Team_064 possession (Score: 76-45)
Devin Cunningham attempts a Layup. Wide open! Zion Harris is 6.8 feet away. [ZONE] Devin Cunningham misses. Rebound secured by Josh Embiid.

================================================================================
                              3RD QUARTER COMPLETE                              
================================================================================

3RD QUARTER SCORE: Team_088 31, Team_064 14

BOX SCORE:
================================================================================

Team_088
--------------------------------------------------------------------------------
Player                MIN  PTS  REB  AST  TO      FG   FG%      3P   3P%
--------------------------------------------------------------------------------
Allen Ming             23   11    8    0   0   5/5   100.0     0/0   0.0
Tyler Hyland           23   10    2    2   0   4/5    80.0     0/0   0.0
Tobias Haliburton      23    2    0    1   0   1/1   100.0     0/0   0.0
Josh Duncan            23    2    0    2   0   1/2    50.0     0/0   0.0
Giannis Smith          23    2    3    0   0   1/2    50.0     0/0   0.0
Josh Embiid            14    2    2    0   0   1/1   100.0     0/0   0.0
Klay Quickley          14    0    0    0   0   0/1     0.0     0/0   0.0
Vince Carter           14    0    0    0   0   0/1     0.0     0/0   0.0
Zion Harris            14    0    0    1   0   0/0     0.0     0/0   0.0

TEAM: FG: 13/18 (72.2%), 3PT: 3/6 (50.0%), REB: 15 (6 off, 9 def), AST: 6, TO: 4
TEAM FOULS: 2


Team_064
--------------------------------------------------------------------------------
Player                MIN  PTS  REB  AST  TO      FG   FG%      3P   3P%
--------------------------------------------------------------------------------
Shai Hyland            23    6    0    0   0   3/3   100.0     0/0   0.0
Russell Simons         23    2    1    1   0   1/3    33.3     0/0   0.0
Ja Mitchell            23    2    0    1   0   1/3    33.3     0/0   0.0
Kawhi Irving           23    2    4    0   0   1/2    50.0     0/0   0.0
Tobias Herro           14    2    0    0   0   1/1   100.0     0/0   0.0
Jordan Mitchell        23    0    0    1   0   0/2     0.0     0/0   0.0
Ja Simmons             14    0    1    0   0   0/1     0.0     0/0   0.0
Austin Smith           14    0    1    1   0   0/0     0.0     0/0   0.0
Devin Cunningham       14    0    0    0   0   0/1     0.0     0/0   0.0

TEAM: FG: 7/16 (43.8%), 3PT: 0/4 (0.0%), REB: 7 (2 off, 5 def), AST: 4, TO: 6
TEAM FOULS: 9 [Team_088 in BONUS]

================================================================================

================================================================================
                       4TH QUARTER - Team_088 vs Team_064                       
================================================================================

[12:00] Team_088 possession (Score: 76-45)
Tobias Haliburton drives and kicks out. Tobias Haliburton attempts a Midrange. Contested by Jordan Mitchell (2.4 feet, MAN). TOBIAS HALIBURTON MAKES IT!
Score: 78-45

[11:42] Team_064 possession (Score: 78-45)
Ja Mitchell attempts a 3Pt. Contested by Josh Duncan (5.5 feet, MAN). Ja Mitchell misses. Rebound secured by Giannis Smith.

[11:29] Team_088 possession (Score: 78-45)
Tyler Hyland makes the Layup and draws the foul on Kawhi Irving! And-1! Tyler Hyland to the line for 1. [Team fouls: 1] (Kawhi Irving: 1 personal fouls)   FT 1/1: GOOD Tyler Hyland makes 1/1 from the line.
Score: 81-45

[11:09] Team_064 possession (Score: 81-45)
Ja Mitchell attempts a Layup. Contested by Giannis Smith (4.7 feet, ZONE). JA MITCHELL MAKES IT! Assist: Russell Simons
Score: 81-47

[10:53] Team_088 possession (Score: 81-47)
FOUL! Shooting foul on Russell Simons. Giannis Smith to the line for 2 free throws. [Team fouls: 2] (Russell Simons: 1 personal fouls)   FT 1/2: MISS   FT 2/2: MISS Giannis Smith makes 0/2 from the line. Rebound secured by Kawhi Irving.

[10:41] Team_064 possession (Score: 81-47)
Jordan Mitchell drives, Giannis Smith stays with him. Jordan Mitchell attempts a Dunk. Contested by Giannis Smith (4.4 feet, ZONE). Jordan Mitchell misses. Offensive rebound by Kawhi Irving! Kawhi Irving kicks it out.

[10:25] Team_064 possession (Score: 81-47)
Ja Mitchell drives and kicks out. Kawhi Irving attempts a 3Pt. Wide open! Tyler Hyland is 7.5 feet away. [MAN] Kawhi Irving misses. Rebound secured by Giannis Smith.

[10:08] Team_088 possession (Score: 81-47)
Tobias Haliburton attempts a 3Pt. Contested by Ja Mitchell (5.3 feet, ZONE). Tobias Haliburton misses. Rebound secured by Russell Simons.

[09:51] Team_064 possession (Score: 81-47)
Ja Mitchell loses control! Ball rolls out of bounds! TURNOVER! (dead ball)

[09:51] Substitution (Team_088): Josh Duncan OUT → Klay Quickley IN (stamina_rule2)

[09:51] Substitution (Team_088): Giannis Smith OUT → Zion Harris IN (stamina_rule2)

[09:51] Substitution (Team_088): Allen Ming OUT → Josh Embiid IN (stamina_rule2)

[09:51] Substitution (Team_064): Russell Simons OUT → Austin Smith IN (stamina_rule2)

[09:51] Substitution (Team_064): Shai Hyland OUT → Devin Cunningham IN (stamina_rule2)

[09:38] Team_088 possession (Score: 81-47)
Tyler Hyland drives and kicks out. Josh Embiid attempts a 3Pt. Heavily contested by Devin Cunningham (1.9 feet, MAN)! Josh Embiid misses. Offensive rebound by Josh Embiid! Josh Embiid kicks it out.

[09:24] Team_088 possession (Score: 81-47)
Tyler Hyland attempts a 3Pt. Contested by Ja Mitchell (2.7 feet, ZONE). TYLER HYLAND MAKES IT!
Score: 84-47

[09:08] Team_064 possession (Score: 84-47)
FOUL! Offensive foul on Devin Cunningham! Josh Embiid drew the charge! [Team fouls: 3] (Devin Cunningham: 1 personal fouls) TURNOVER! (dead ball)

[08:54] Team_088 possession (Score: 84-47)
Tobias Haliburton attempts a 3Pt. Contested by Ja Mitchell (3.4 feet, ZONE). TOBIAS HALIBURTON MAKES IT! Assist: Klay Quickley
Score: 87-47

[08:42] Team_064 possession (Score: 87-47)
Austin Smith drives and kicks out. Jordan Mitchell attempts a 3Pt. Wide open! Tobias Haliburton is 7.2 feet away. [ZONE] Jordan Mitchell misses. Rebound secured by Josh Embiid.

[08:29] Team_088 possession (Score: 87-47)
Josh Embiid attempts a Midrange. Wide open! Devin Cunningham is 6.7 feet away. [MAN] Josh Embiid misses. Rebound secured by Austin Smith.

[08:14] Team_064 possession (Score: 87-47)
Jordan Mitchell makes the Dunk and draws the foul on Klay Quickley! And-1! Jordan Mitchell to the line for 1. [Team fouls: 1] (Klay Quickley: 1 personal fouls)   FT 1/1: GOOD Jordan Mitchell makes 1/1 from the line.
Score: 87-50

[07:57] Team_088 possession (Score: 87-50)
Klay Quickley attempts a Layup. Contested by Ja Mitchell (3.8 feet, MAN). Klay Quickley misses. Offensive rebound by Tyler Hyland! Tyler Hyland kicks it out.

[07:40] Team_088 possession (Score: 87-50)
Tyler Hyland attempts a 3Pt. Wide open! Kawhi Irving is 7.2 feet away. [MAN] Tyler Hyland misses. Rebound secured by Kawhi Irving.

[07:29] Team_064 possession (Score: 87-50)
Kawhi Irving attempts a Midrange. Wide open! Tyler Hyland is 6.8 feet away. [MAN] Kawhi Irving misses. Offensive rebound by Austin Smith! Austin Smith kicks it out.

[07:13] Team_064 possession (Score: 87-50)
Devin Cunningham attempts a 3Pt. Contested by Josh Embiid (3.9 feet, MAN). DEVIN CUNNINGHAM MAKES IT! Assist: Austin Smith
Score: 87-53

[06:59] Team_088 possession (Score: 87-53)
Zion Harris attempts a Layup. Contested by Austin Smith (5.1 feet, ZONE). Zion Harris misses. Rebound secured by Kawhi Irving.

[06:44] Team_064 possession (Score: 87-53)
Ja Mitchell drives, picks up Zion Harris. Help arrives from Klay Quickley! Ja Mitchell attempts a Layup. Heavily contested by Klay Quickley (0.5 feet, ZONE)! JA MITCHELL MAKES IT!
Score: 87-55

[06:29] Team_088 possession (Score: 87-55)
Zion Harris throws a bad pass out of bounds! TURNOVER! (dead ball)

[06:29] Substitution (Team_088): Tobias Haliburton OUT → Vince Carter IN (stamina_rule2)

[06:29] Substitution (Team_088): Tyler Hyland OUT → Pau Bird IN (stamina_rule2)

[06:29] Substitution (Team_064): Ja Mitchell OUT → CJ Haliburton IN (stamina_rule2)

[06:29] Substitution (Team_064): Jordan Mitchell OUT → Ja Simmons IN (stamina_rule2)

[06:29] Substitution (Team_064): Kawhi Irving OUT → Tobias Herro IN (stamina_rule2)

[06:14] Team_064 possession (Score: 87-55)
Devin Cunningham drives and kicks out. Ja Simmons attempts a Midrange. Contested by Vince Carter (2.1 feet, ZONE). JA SIMMONS MAKES IT! Assist: Tobias Herro
Score: 87-57

[06:04] Team_088 possession (Score: 87-57)
Klay Quickley drives, Austin Smith stays with him. Klay Quickley attempts a Layup. Contested by Austin Smith (3.4 feet, ZONE). Klay Quickley misses. Rebound secured by Austin Smith.

[05:48] Team_064 possession (Score: 87-57)
Tobias Herro attempts a 3Pt. Heavily contested by Pau Bird (0.5 feet, MAN)! Tobias Herro misses. Rebound secured by Pau Bird.

[05:39] Team_088 possession (Score: 87-57)
Vince Carter makes the Dunk and draws the foul on Ja Simmons! And-1! Vince Carter to the line for 1. [Team fouls: 4] (Ja Simmons: 1 personal fouls)   FT 1/1: MISS Vince Carter makes 0/1 from the line. Offensive rebound by Pau Bird! Pau Bird kicks it out.
Score: 89-57

[05:22] Team_088 possession (Score: 89-57)
Zion Harris attempts a Layup. Contested by Austin Smith (5.1 feet, ZONE). Zion Harris misses. Offensive rebound by Josh Embiid! Josh Embiid kicks it out.

[05:06] Team_088 possession (Score: 89-57)
Zion Harris drives and kicks out. Klay Quickley attempts a Midrange. Contested by Austin Smith (5.9 feet, ZONE). Klay Quickley misses. Rebound secured by Ja Simmons.

[04:53] Team_064 possession (Score: 89-57)
Devin Cunningham drives, picks up Zion Harris. Help arrives from Klay Quickley! Devin Cunningham attempts a Layup. Contested by Klay Quickley (3.1 feet, ZONE). DEVIN CUNNINGHAM MAKES IT! Assist: CJ Haliburton
Score: 89-59

[04:36] Team_088 possession (Score: 89-59)
Zion Harris attempts a Midrange. Wide open! Ja Simmons is 8.2 feet away. [ZONE] Zion Harris misses. Rebound secured by Devin Cunningham.

[04:22] Team_064 possession (Score: 89-59)
CJ Haliburton drives and kicks out. Devin Cunningham attempts a Midrange. Contested by Vince Carter (3.1 feet, ZONE). Devin Cunningham misses. Rebound secured by Josh Embiid.

[04:10] Team_088 possession (Score: 89-59)
FOUL! Shooting foul on Austin Smith. Pau Bird to the line for 2 free throws. [BONUS: 5 team fouls] (Austin Smith: 1 personal fouls)   FT 1/2: GOOD   FT 2/2: GOOD Pau Bird makes 2/2 from the line.
Score: 91-59

[03:53] Team_064 possession (Score: 91-59)
Devin Cunningham attempts a Midrange. Contested by Vince Carter (4.6 feet, ZONE). Devin Cunningham misses. Offensive rebound by Ja Simmons! Ja Simmons kicks it out.

[03:35] Team_064 possession (Score: 91-59)
Devin Cunningham attempts a Midrange. Contested by Josh Embiid (4.6 feet, MAN). Devin Cunningham misses. Rebound secured by Josh Embiid.

[03:21] Team_088 possession (Score: 91-59)
Vince Carter attempts a Midrange. Contested by Ja Simmons (4.7 feet, MAN). Vince Carter misses. Rebound secured by Austin Smith.

[03:10] Team_064 possession (Score: 91-59)
CJ Haliburton attempts a 3Pt. Contested by Pau Bird (5.7 feet, ZONE). CJ Haliburton misses. Offensive rebound by Austin Smith! Austin Smith kicks it out.

[02:55] Team_064 possession (Score: 91-59)
Tobias Herro attempts a 3Pt. Contested by Pau Bird (5.0 feet, MAN). TOBIAS HERRO MAKES IT! Assist: Ja Simmons
Score: 91-62

[02:43] Team_088 possession (Score: 91-62)
Zion Harris makes the Layup and draws the foul on Ja Simmons! And-1! Zion Harris to the line for 1. [BONUS: 6 team fouls] (Ja Simmons: 2 personal fouls)   FT 1/1: GOOD Zion Harris makes 1/1 from the line.
Score: 94-62

[02:28] Team_064 possession (Score: 94-62)
Tobias Herro drives, picks up Zion Harris. Help arrives from Vince Carter! Tobias Herro attempts a Layup. Contested by Vince Carter (3.1 feet, ZONE). Tobias Herro misses. Offensive rebound by Austin Smith! Austin Smith kicks it out.

[02:13] Team_064 possession (Score: 94-62)
Austin Smith attempts a 3Pt. Wide open! Zion Harris is 9.0 feet away. [MAN] Austin Smith misses. Rebound secured by Zion Harris.

[01:54] Team_088 possession (Score: 94-62)
FOUL! Shooting foul on CJ Haliburton. Klay Quickley to the line for 3 free throws. [BONUS: 7 team fouls] (CJ Haliburton: 1 personal fouls)   FT 1/3: GOOD   FT 2/3: GOOD   FT 3/3: MISS Klay Quickley makes 2/3 from the line. Rebound secured by Austin Smith.
Score: 96-62

[01:40] Team_064 possession (Score: 96-62)
Ja Simmons attempts a Midrange. Contested by Vince Carter (2.8 feet, MAN). Ja Simmons misses. Rebound secured by Pau Bird.

[01:27] Team_088 possession (Score: 96-62)
Zion Harris attempts a Layup. BLOCKED BY AUSTIN SMITH! Ball is loose! Offensive rebound by Josh Embiid! Josh Embiid kicks it out.

[01:16] Team_088 possession (Score: 96-62)
Zion Harris throws a bad pass! Stolen by Austin Smith! TURNOVER! (live ball)

[00:56] Team_064 possession (Score: 96-62)
Austin Smith loses control! Ball rolls out of bounds! TURNOVER! (dead ball)

[00:42] Team_088 possession (Score: 96-62)
Josh Embiid drives and kicks out. Josh Embiid attempts a 3Pt. Contested by CJ Haliburton (2.8 feet, ZONE). JOSH EMBIID MAKES IT! Assist: Vince Carter
Score: 99-62

[00:27] Team_064 possession (Score: 99-62)
Devin Cunningham attempts a Layup. BLOCKED BY ZION HARRIS! Ball goes out off Zion Harris. Devin Cunningham's ball!

[00:10] Team_064 possession (Score: 99-62)
FOUL! Shooting foul on Vince Carter. Devin Cunningham to the line for 2 free throws. [Team fouls: 2] (Vince Carter: 1 personal fouls)   FT 1/2: GOOD   FT 2/2: GOOD Devin Cunningham makes 2/2 from the line.
Score: 99-64

================================================================================
                              4TH QUARTER COMPLETE                              
================================================================================

4TH QUARTER SCORE: Team_088 23, Team_064 19

BOX SCORE:
================================================================================

Team_088
--------------------------------------------------------------------------------
Player                MIN  PTS  REB  AST  TO      FG   FG%      3P   3P%
--------------------------------------------------------------------------------
Tyler Hyland           29    6    1    0   0   2/3    66.7     0/0   0.0
Tobias Haliburton      29    5    0    0   0   2/3    66.7     0/0   0.0
Josh Embiid            23    3    6    0   0   1/2    50.0     0/0   0.0
Zion Harris            23    3    1    0   0   1/4    25.0     0/0   0.0
Pau Bird               20    2    3    0   0   1/1   100.0     0/0   0.0
Giannis Smith          25    0    2    0   0   0/1     0.0     0/0   0.0
Klay Quickley          23    0    0    1   0   0/2     0.0     0/0   0.0
Vince Carter           20    0    0    1   0   0/1     0.0     0/0   0.0

TEAM: FG: 7/17 (41.2%), 3PT: 2/5 (40.0%), REB: 13 (5 off, 8 def), AST: 2, TO: 2
TEAM FOULS: 2


Team_064
--------------------------------------------------------------------------------
Player                MIN  PTS  REB  AST  TO      FG   FG%      3P   3P%
--------------------------------------------------------------------------------
Devin Cunningham       23    7    1    0   0   3/4    75.0     0/0   0.0
Ja Mitchell            29    4    0    0   0   2/4    50.0     0/0   0.0
Jordan Mitchell        29    3    0    0   0   1/1   100.0     0/0   0.0
Tobias Herro           20    3    0    1   0   1/2    50.0     0/0   0.0
Ja Simmons             20    2    2    1   0   1/2    50.0     0/0   0.0
Russell Simons         25    0    1    1   0   0/0     0.0     0/0   0.0
Kawhi Irving           29    0    4    0   0   0/0     0.0     0/0   0.0
Austin Smith           23    0    7    1   0   0/2     0.0     0/0   0.0
CJ Haliburton          20    0    0    1   0   0/1     0.0     0/0   0.0

TEAM: FG: 8/16 (50.0%), 3PT: 2/5 (40.0%), REB: 15 (5 off, 10 def), AST: 5, TO: 3
TEAM FOULS: 8 [Team_088 in BONUS]

================================================================================

================================================================================
                               FULL GAME COMPLETE                               
================================================================================

FINAL SCORE: Team_088 99, Team_064 64

SCORING BY QUARTER:
--------------------------------------------------------------------------------
Team                     Q1     Q2     Q3     Q4    FINAL
--------------------------------------------------------------------------------
Team_088                 23     22     31     23       99
Team_064                 14     17     14     19       64
--------------------------------------------------------------------------------

FULL GAME BOX SCORE:
================================================================================

Team_088
--------------------------------------------------------------------------------
Player                MIN  PTS  REB  AST  TO      FG   FG%      3P   3P%      FT STL BLK
--------------------------------------------------------------------------------
Tobias Haliburton      29    9    0    2   1   6/8    75.0   2/4    50.0   0/0     1   1
Tyler Hyland           29   21    9    2   1   7/10   70.0   4/6    66.7   3/3     0   0
Josh Duncan            25    4    0    3   2   3/9    33.3   0/3     0.0   0/0     0   0
Giannis Smith          25   10    9    1   0   4/7    57.1   0/1     0.0   6/8     1   1
Allen Ming             25   19   12    1   0   4/7    57.1   0/0     0.0   7/7     0   0
Klay Quickley          23    0    0    1   1   0/4     0.0   0/1     0.0   2/4     0   0
Zion Harris            23    5    5    2   5   2/7    28.6   0/1     0.0   1/1     0   2
Josh Embiid            23   12   12    0   0   5/8    62.5   0/0     0.0   1/1     0   0
Vince Carter           20    6    0    2   1   2/7    28.6   0/2     0.0   1/2     0   0
Pau Bird               20    7    9    1   1   3/5    60.0   0/1     0.0   3/3     0   0

TEAM: FG: 39/75 (52.0%), 3PT: 6/19 (31.6%), REB: 56 (14 off, 42 def), AST: 15, TO: 12


Team_064
--------------------------------------------------------------------------------
Player                MIN  PTS  REB  AST  TO      FG   FG%      3P   3P%      FT STL BLK
--------------------------------------------------------------------------------
Ja Mitchell            29    6    0    3   3   3/12   25.0   0/5     0.0   0/0     1   1
Jordan Mitchell        29    7    0    2   4   2/6    33.3   0/2     0.0   1/1     0   0
Kawhi Irving           29    7    9    0   0   3/5    60.0   1/1   100.0   0/0     0   1
Russell Simons         25    2    7    3   0   1/4    25.0   0/0     0.0   0/0     0   0
Shai Hyland            25   11    5    0   3   6/10   60.0   1/3    33.3   2/2     0   0
Austin Smith           23    0   11    2   3   0/6     0.0   0/1     0.0   0/0     3   3
Devin Cunningham       23    9    4    1   1   5/8    62.5   1/1   100.0   2/2     0   0
CJ Haliburton          20    7    0    2   0   4/7    57.1   1/1   100.0   0/0     0   0
Ja Simmons             20    4    6    3   2   1/8    12.5   0/4     0.0   0/0     0   0
Tobias Herro           20   11    0    2   0   3/4    75.0   2/3    66.7   0/0     0   1

TEAM: FG: 28/70 (40.0%), 3PT: 6/21 (28.6%), REB: 42 (7 off, 35 def), AST: 18, TO: 16

================================================================================
