================================================================================
                        FULL GAME - Team_010 vs Team_098                        
================================================================================

================================================================================
                       1ST QUARTER - Team_010 vs Team_098                       
================================================================================

[12:00] Team_010 possession (Score: 0-0)
FOUL! Holding foul on Nikola Rose. [Team fouls: 1] No free throws, side out. (Nikola Rose: 1 personal fouls)

[11:45] Team_010 possession (Score: 0-0)
RJ Young attempts a 3Pt. Contested by Blake Murray (5.5 feet, MAN). RJ Young misses. FOUL! Loose ball foul on Pascal Lillard during the rebound battle. [Team fouls: 2] No free throws, side out. (Pascal Lillard: 1 personal fouls)

[11:29] Team_010 possession (Score: 0-0)
Anthony Durant throws a bad pass out of bounds! TURNOVER! (dead ball)

[11:17] Team_098 possession (Score: 0-0)
Blake Murray attempts a Midrange. Wide open! RJ Young is 8.4 feet away. [MAN] BLAKE MURRAY MAKES IT!
Score: 0-2

[10:58] Team_010 possession (Score: 0-2)
Anthony Durant attempts a Midrange. Wide open! Derrick Durant is 8.1 feet away. [MAN] ANTHONY DURANT MAKES IT!
Score: 2-2

[10:45] Team_098 possession (Score: 2-2)
Nikola Rose drives and kicks out. Blake Murray attempts a 3Pt. Contested by Cade Morant (4.0 feet, ZONE). Blake Murray misses. Rebound secured by Desmond Antetokounmpo.

[10:26] Team_010 possession (Score: 2-2)
Anthony Durant makes the Layup and draws the foul on Pascal Lillard! And-1! Anthony Durant to the line for 1. [Team fouls: 3] (Pascal Lillard: 2 personal fouls)   FT 1/1: GOOD Anthony Durant makes 1/1 from the line.
Score: 5-2

[10:13] Team_098 possession (Score: 5-2)
FOUL! Offensive foul on Pascal Lillard! Desmond Antetokounmpo drew the charge! [Team fouls: 4] (Pascal Lillard: 3 personal fouls) TURNOVER! (dead ball)

[10:02] Team_010 possession (Score: 5-2)
Desmond Antetokounmpo commits a violation (traveling/carry)! TURNOVER! (dead ball)

[09:43] Team_098 possession (Score: 5-2)
Blake Murray attempts a Layup. Contested by RJ Young (4.2 feet, MAN). BLAKE MURRAY MAKES IT! Assist: Nikola Rose
Score: 5-4

[09:31] Team_010 possession (Score: 5-4)
RJ Young attempts a 3Pt. Wide open! Blake Murray is 8.9 feet away. [ZONE] RJ Young misses. Rebound secured by Derrick Durant.

[09:18] Team_098 possession (Score: 5-4)
Pascal Lillard attempts a 3Pt. Contested by Desmond Antetokounmpo (4.4 feet, MAN). Pascal Lillard misses. Rebound secured by Cade Morant.

[09:05] Team_010 possession (Score: 5-4)
RJ Young attempts a Midrange. Wide open! Blake Murray is 7.4 feet away. [MAN] RJ Young misses. Offensive rebound by Cade Morant! Cade Morant kicks it out.

[08:53] Team_010 possession (Score: 5-4)
Anthony Durant attempts a Layup. Heavily contested by Derrick Durant (1.9 feet, MAN)! ANTHONY DURANT MAKES IT! Assist: RJ Young
Score: 7-4

[08:39] Team_098 possession (Score: 7-4)
Blake Murray attempts a 3Pt. Contested by Cade Morant (3.3 feet, ZONE). BLAKE MURRAY MAKES IT! Assist: Derrick Durant
Score: 7-7

[08:27] Team_010 possession (Score: 7-7)
Cade Morant drives to the basket... FOUL! Offensive foul on Cade Morant! Malcolm Tatum drew the charge! [Team fouls: 1] (Cade Morant: 1 personal fouls) TURNOVER! (dead ball)

[08:12] Team_098 possession (Score: 7-7)
Blake Murray attempts a 3Pt. Contested by RJ Young (4.1 feet, ZONE). Blake Murray misses. Offensive rebound by Pascal Lillard! Pascal Lillard kicks it out.

[08:01] Team_098 possession (Score: 7-7)
Derrick Durant attempts a Dunk. BLOCKED BY ANTHONY DURANT! Ball deflects out of bounds off Derrick Durant.

[07:44] Team_010 possession (Score: 7-7)
Cade Morant makes the Layup and draws the foul on Malcolm Tatum! And-1! Cade Morant to the line for 1. [BONUS: 5 team fouls] (Malcolm Tatum: 1 personal fouls)   FT 1/1: GOOD Cade Morant makes 1/1 from the line.
Score: 10-7

[07:30] Team_098 possession (Score: 10-7)
Pascal Lillard attempts a Midrange. Contested by Desmond Antetokounmpo (5.1 feet, MAN). PASCAL LILLARD MAKES IT! Assist: Nikola Rose
Score: 10-9

[07:16] Team_010 possession (Score: 10-9)
Anthony Durant makes the Layup and draws the foul on Pascal Lillard! And-1! Anthony Durant to the line for 1. [BONUS: 6 team fouls] (Pascal Lillard: 4 personal fouls)   FT 1/1: GOOD Anthony Durant makes 1/1 from the line.
Score: 13-9

[07:05] Team_098 possession (Score: 13-9)
FOUL! Holding foul on Cade Morant. [Team fouls: 2] No free throws, side out. (Cade Morant: 2 personal fouls)

[06:54] Team_098 possession (Score: 13-9)
Nikola Rose drives, Anthony Durant stays with him. Nikola Rose attempts a Dunk. Heavily contested by Anthony Durant (1.5 feet, ZONE)! NIKOLA ROSE MAKES IT!
Score: 13-11

[06:38] Team_010 possession (Score: 13-11)
FOUL! Reach-in foul on Nikola Rose during the drive. [IN THE BONUS! 7 team fouls] Michael Turner to the line for 2 free throws. (Nikola Rose: 2 personal fouls)   FT 1/2: MISS   FT 2/2: GOOD Michael Turner makes 1/2 from the line.
Score: 14-11

[06:27] Team_098 possession (Score: 14-11)
Nikola Rose drives, Anthony Durant stays with him. Nikola Rose attempts a Dunk. Contested by Anthony Durant (2.4 feet, ZONE). NIKOLA ROSE MAKES IT!
Score: 14-13

[06:16] Team_010 possession (Score: 14-13)
Cade Morant attempts a 3Pt. Contested by Malcolm Tatum (3.1 feet, MAN). Cade Morant misses. Offensive rebound by Anthony Durant! Anthony Durant kicks it out.

[06:02] Team_010 possession (Score: 14-13)
Desmond Antetokounmpo attempts a Midrange. Contested by Pascal Lillard (3.0 feet, MAN). DESMOND ANTETOKOUNMPO MAKES IT! Assist: Cade Morant
Score: 16-13

[05:48] Team_098 possession (Score: 16-13)
Blake Murray attempts a 3Pt. Wide open! RJ Young is 6.5 feet away. [MAN] Blake Murray misses. Rebound secured by Cade Morant.

[05:35] Team_010 possession (Score: 16-13)
Anthony Durant attempts a Midrange. Heavily contested by Nikola Rose (0.6 feet, ZONE)! Anthony Durant misses. Rebound secured by Derrick Durant.

[05:23] Team_098 possession (Score: 16-13)
Blake Murray drives, RJ Young stays with him. Blake Murray attempts a Layup. Wide open! RJ Young is 6.9 feet away. [MAN] Blake Murray misses. Rebound secured by Anthony Durant.

[05:09] Team_010 possession (Score: 16-13)
Anthony Durant attempts a 3Pt. Wide open! Pascal Lillard is 6.7 feet away. [ZONE] ANTHONY DURANT MAKES IT! Assist: RJ Young
Score: 19-13

[04:54] Team_098 possession (Score: 19-13)
Malcolm Tatum attempts a 3Pt. Wide open! Cade Morant is 6.4 feet away. [ZONE] MALCOLM TATUM MAKES IT! Assist: Derrick Durant
Score: 19-16

[04:42] Team_010 possession (Score: 19-16)
RJ Young drives, Pascal Lillard stays with him. RJ Young attempts a Dunk. Contested by Pascal Lillard (3.2 feet, ZONE). RJ YOUNG MAKES IT!
Score: 21-16

[04:28] Team_098 possession (Score: 21-16)
Pascal Lillard attempts a 3Pt. Wide open! Desmond Antetokounmpo is 6.6 feet away. [MAN] Pascal Lillard misses. Rebound secured by Michael Turner.

[04:13] Team_010 possession (Score: 21-16)
FOUL! Shooting foul on Nikola Rose. Michael Turner to the line for 3 free throws. [BONUS: 8 team fouls] (Nikola Rose: 3 personal fouls)   FT 1/3: MISS   FT 2/3: GOOD   FT 3/3: GOOD Michael Turner makes 2/3 from the line.
Score: 23-16

[03:56] Team_098 possession (Score: 23-16)
FOUL! Reach-in foul on Anthony Durant during the drive. [Team fouls: 3] No free throws, side out. (Anthony Durant: 1 personal fouls)

[03:47] Team_098 possession (Score: 23-16)
Blake Murray attempts a Midrange. Heavily contested by Desmond Antetokounmpo (1.5 feet, ZONE)! Blake Murray misses. Rebound secured by Anthony Durant.

[03:35] Team_010 possession (Score: 23-16)
Michael Turner attempts a 3Pt. Contested by Nikola Rose (2.4 feet, MAN). Michael Turner misses. Rebound secured by Nikola Rose.

[03:19] Team_098 possession (Score: 23-16)
Malcolm Tatum attempts a Layup. Contested by Cade Morant (3.5 feet, MAN). Malcolm Tatum misses. Offensive rebound by Derrick Durant! Derrick Durant's putback is no good. Offensive rebound by Pascal Lillard! Pascal Lillard kicks it out.

[03:05] Team_098 possession (Score: 23-16)
Blake Murray attempts a 3Pt. Wide open! RJ Young is 6.4 feet away. [MAN] Blake Murray misses. Rebound secured by Anthony Durant.

[02:50] Team_010 possession (Score: 23-16)
Cade Morant attempts a Midrange. Heavily contested by Malcolm Tatum (0.8 feet, MAN)! Cade Morant misses. Rebound secured by Pascal Lillard.

[02:40] Team_098 possession (Score: 23-16)
FOUL! Shooting foul on Cade Morant. Malcolm Tatum to the line for 2 free throws. [Team fouls: 4] (Cade Morant: 3 personal fouls)   FT 1/2: GOOD   FT 2/2: GOOD Malcolm Tatum makes 2/2 from the line.
Score: 23-18

[02:29] Team_010 possession (Score: 23-18)
Desmond Antetokounmpo attempts a Layup. Contested by Pascal Lillard (5.8 feet, MAN). DESMOND ANTETOKOUNMPO MAKES IT! Assist: Anthony Durant
Score: 25-18

[02:11] Team_098 possession (Score: 25-18)
Malcolm Tatum makes the Layup and draws the foul on Cade Morant! And-1! Malcolm Tatum to the line for 1. [BONUS: 5 team fouls] (Cade Morant: 4 personal fouls)   FT 1/1: GOOD Malcolm Tatum makes 1/1 from the line.
Score: 25-21

[01:57] Team_010 possession (Score: 25-21)
Desmond Antetokounmpo commits a violation (traveling/carry)! TURNOVER! (dead ball)

[01:57] Substitution (Team_010): Cade Morant OUT → Draymond Leonard IN (stamina_rule2)

[01:57] Substitution (Team_010): Michael Turner OUT → Blake Harden IN (stamina_rule2)

[01:57] Substitution (Team_010): RJ Young OUT → Ben Gilgeous-Alexander IN (stamina_rule2)

[01:57] Substitution (Team_010): Desmond Antetokounmpo OUT → Vince Ingram IN (stamina_rule2)

[01:57] Substitution (Team_010): Anthony Durant OUT → Paolo Wade IN (stamina_rule2)

[01:57] Substitution (Team_098): Malcolm Tatum OUT → Tracy Rose IN (stamina_rule2)

[01:57] Substitution (Team_098): Nikola Rose OUT → Dirk McCollum IN (stamina_rule2)

[01:57] Substitution (Team_098): Blake Murray OUT → Kristaps Iverson IN (stamina_rule2)

[01:57] Substitution (Team_098): Pascal Lillard OUT → Manu Jordan IN (stamina_rule2)

[01:57] Substitution (Team_098): Derrick Durant OUT → Russell McGrady IN (stamina_rule2)

[01:43] Team_098 possession (Score: 25-21)
Russell McGrady attempts a Layup. Wide open! Paolo Wade is 6.8 feet away. [ZONE] Russell McGrady misses. Offensive rebound by Russell McGrady! Russell McGrady's putback is no good. Rebound secured by Ben Gilgeous-Alexander.

[01:34] Team_010 possession (Score: 25-21)
Paolo Wade makes the Layup and draws the foul on Dirk McCollum! And-1! Paolo Wade to the line for 1. [BONUS: 9 team fouls] (Dirk McCollum: 1 personal fouls)   FT 1/1: GOOD Paolo Wade makes 1/1 from the line.
Score: 28-21

[01:22] Team_098 possession (Score: 28-21)
Tracy Rose makes the Dunk and draws the foul on Paolo Wade! And-1! Tracy Rose to the line for 1. [BONUS: 6 team fouls] (Paolo Wade: 1 personal fouls)   FT 1/1: GOOD Tracy Rose makes 1/1 from the line.
Score: 28-24

[01:10] Team_010 possession (Score: 28-24)
Draymond Leonard attempts a 3Pt. Contested by Tracy Rose (3.5 feet, MAN). Draymond Leonard misses. Rebound secured by Russell McGrady.

[01:00] Team_098 possession (Score: 28-24)
Kristaps Iverson throws a bad pass out of bounds! TURNOVER! (dead ball)

[00:44] Team_010 possession (Score: 28-24)
Paolo Wade makes the Midrange and draws the foul on Russell McGrady! And-1! Paolo Wade to the line for 1. [BONUS: 10 team fouls] (Russell McGrady: 1 personal fouls)   FT 1/1: GOOD Paolo Wade makes 1/1 from the line.
Score: 31-24

[00:33] Team_098 possession (Score: 31-24)
Manu Jordan drives, picks up Vince Ingram. Help arrives from Blake Harden! Manu Jordan attempts a Layup. Contested by Blake Harden (4.2 feet, MAN). Manu Jordan misses. Rebound secured by Paolo Wade.

[00:18] Team_010 possession (Score: 31-24)
Draymond Leonard attempts a Midrange. Contested by Dirk McCollum (4.3 feet, ZONE). DRAYMOND LEONARD MAKES IT!
Score: 33-24

[00:04] Team_098 possession (Score: 33-24)
Dirk McCollum attempts a Layup. Wide open! Paolo Wade is 6.3 feet away. [ZONE] Dirk McCollum misses. Rebound secured by Blake Harden.

================================================================================
                              1ST QUARTER COMPLETE                              
================================================================================

1ST QUARTER SCORE: Team_010 33, Team_098 24

BOX SCORE:
================================================================================

Team_010
--------------------------------------------------------------------------------
Player                MIN  PTS  REB  AST  TO      FG   FG%      3P   3P%
--------------------------------------------------------------------------------
Anthony Durant         10   13    4    1   0   5/6    83.3     0/0   0.0
Paolo Wade              2    6    1    0   0   2/2   100.0     0/0   0.0
Desmond Antetokounmpo   10    4    1    0   0   2/2   100.0     0/0   0.0
Cade Morant            10    3    4    1   0   1/2    50.0     0/0   0.0
Michael Turner         10    3    1    0   0   2/3    66.7     0/0   0.0
RJ Young               10    2    0    2   0   1/2    50.0     0/0   0.0
Draymond Leonard        2    2    0    0   0   1/2    50.0     0/0   0.0
Blake Harden            2    0    1    0   0   0/0     0.0     0/0   0.0

TEAM: FG: 14/19 (73.7%), 3PT: 2/5 (40.0%), REB: 12 (3 off, 9 def), AST: 4, TO: 4
TEAM FOULS: 6 [Team_098 in BONUS]


Team_098
--------------------------------------------------------------------------------
Player                MIN  PTS  REB  AST  TO      FG   FG%      3P   3P%
--------------------------------------------------------------------------------
Malcolm Tatum          10    8    0    0   0   3/3   100.0     0/0   0.0
Blake Murray           10    7    0    0   0   3/7    42.9     0/0   0.0
Nikola Rose            10    4    1    2   0   2/3    66.7     0/0   0.0
Tracy Rose              2    3    0    0   0   1/1   100.0     0/0   0.0
Pascal Lillard         10    2    3    0   0   1/3    33.3     0/0   0.0
Derrick Durant         10    0    2    2   0   0/1     0.0     0/0   0.0
Russell McGrady         2    0    1    0   0   0/1     0.0     0/0   0.0
Ben Gilgeous-Alexander    2    0    1    0   0   0/0     0.0     0/0   0.0
Manu Jordan             2    0    0    0   0   0/1     0.0     0/0   0.0
Dirk McCollum           2    0    0    0   0   0/1     0.0     0/0   0.0

TEAM: FG: 10/21 (47.6%), 3PT: 2/6 (33.3%), REB: 8 (3 off, 5 def), AST: 4, TO: 2
TEAM FOULS: 10 [Team_010 in BONUS]

================================================================================

================================================================================
                       2ND QUARTER - Team_010 vs Team_098                       
================================================================================

[12:00] Team_010 possession (Score: 33-24)
Cade Morant attempts a Midrange. Contested by Blake Murray (3.3 feet, ZONE). Cade Morant misses. Rebound secured by Pascal Lillard.

[11:50] Team_098 possession (Score: 33-24)
Nikola Rose drives, Michael Turner stays with him. Nikola Rose attempts a Layup. Contested by Michael Turner (3.7 feet, MAN). NIKOLA ROSE MAKES IT!
Score: 33-26

[11:32] Team_010 possession (Score: 33-26)
FOUL! Shooting foul on Pascal Lillard. Desmond Antetokounmpo to the line for 3 free throws. [Team fouls: 1] (Pascal Lillard: 1 personal fouls)   FT 1/3: GOOD   FT 2/3: GOOD   FT 3/3: GOOD Desmond Antetokounmpo makes 3/3 from the line.
Score: 36-26

[11:14] Team_098 possession (Score: 36-26)
Malcolm Tatum attempts a Midrange. Wide open! Desmond Antetokounmpo is 7.5 feet away. [ZONE] Malcolm Tatum misses. Rebound secured by Michael Turner.

[10:57] Team_010 possession (Score: 36-26)
Desmond Antetokounmpo drives, picks up Pascal Lillard. Help arrives from Nikola Rose! Desmond Antetokounmpo attempts a Dunk. Contested by Nikola Rose (4.1 feet, ZONE). Desmond Antetokounmpo misses. FOUL! Loose ball foul on Nikola Rose during the rebound battle. [Team fouls: 2] No free throws, side out. (Nikola Rose: 1 personal fouls)

[10:45] Team_010 possession (Score: 36-26)
FOUL! Offensive foul on Desmond Antetokounmpo! Pascal Lillard drew the charge! [Team fouls: 1] (Desmond Antetokounmpo: 1 personal fouls) TURNOVER! (dead ball)

[10:35] Team_098 possession (Score: 36-26)
Pascal Lillard attempts a Midrange. Contested by RJ Young (5.1 feet, ZONE). Pascal Lillard misses. Offensive rebound by Derrick Durant! Derrick Durant puts it back in!
Score: 36-28

[10:20] Team_010 possession (Score: 36-28)
RJ Young attempts a Layup. Contested by Blake Murray (3.4 feet, MAN). RJ Young misses. Rebound secured by Nikola Rose.

[10:03] Team_098 possession (Score: 36-28)
Pascal Lillard drives and kicks out. Nikola Rose attempts a 3Pt. Contested by Michael Turner (3.8 feet, MAN). Nikola Rose misses. Rebound secured by Michael Turner.

[09:45] Team_010 possession (Score: 36-28)
Anthony Durant attempts a Layup. Contested by Pascal Lillard (2.3 feet, ZONE). ANTHONY DURANT MAKES IT! Assist: RJ Young
Score: 38-28

[09:34] Team_098 possession (Score: 38-28)
Malcolm Tatum attempts a 3Pt. Wide open! Cade Morant is 6.6 feet away. [ZONE] Malcolm Tatum misses. Rebound secured by Anthony Durant.

[09:16] Team_010 possession (Score: 38-28)
Anthony Durant attempts a Layup. Contested by Derrick Durant (4.3 feet, MAN). ANTHONY DURANT MAKES IT! Assist: Desmond Antetokounmpo
Score: 40-28

[09:05] Team_098 possession (Score: 40-28)
Nikola Rose loses control! Ball rolls out of bounds! TURNOVER! (dead ball)

[09:05] Substitution (Team_010): Cade Morant OUT → Draymond Leonard IN (stamina_rule2)

[09:05] Substitution (Team_010): Michael Turner OUT → Blake Harden IN (stamina_rule2)

[09:05] Substitution (Team_010): RJ Young OUT → Ben Gilgeous-Alexander IN (stamina_rule2)

[09:05] Substitution (Team_010): Desmond Antetokounmpo OUT → Vince Ingram IN (stamina_rule2)

[09:05] Substitution (Team_010): Anthony Durant OUT → Paolo Wade IN (stamina_rule2)

[09:05] Substitution (Team_098): Malcolm Tatum OUT → Tracy Rose IN (stamina_rule2)

[09:05] Substitution (Team_098): Nikola Rose OUT → Dirk McCollum IN (stamina_rule2)

[09:05] Substitution (Team_098): Blake Murray OUT → Kristaps Iverson IN (stamina_rule2)

[09:05] Substitution (Team_098): Pascal Lillard OUT → Manu Jordan IN (stamina_rule2)

[09:05] Substitution (Team_098): Derrick Durant OUT → Russell McGrady IN (stamina_rule2)

[08:47] Team_010 possession (Score: 40-28)
Blake Harden attempts a 3Pt. Contested by Dirk McCollum (2.9 feet, ZONE). Blake Harden misses. Rebound secured by Russell McGrady.

[08:32] Team_098 possession (Score: 40-28)
Kristaps Iverson attempts a 3Pt. Wide open! Ben Gilgeous-Alexander is 8.6 feet away. [MAN] KRISTAPS IVERSON MAKES IT! Assist: Russell McGrady
Score: 40-31

[08:18] Team_010 possession (Score: 40-31)
Paolo Wade drives and kicks out. Draymond Leonard attempts a Midrange. Wide open! Tracy Rose is 6.2 feet away. [MAN] DRAYMOND LEONARD MAKES IT! Assist: Blake Harden
Score: 42-31

[08:07] Team_098 possession (Score: 42-31)
Tracy Rose attempts a Layup. Contested by Draymond Leonard (2.6 feet, MAN). Tracy Rose misses. Rebound secured by Blake Harden.

[07:53] Team_010 possession (Score: 42-31)
Draymond Leonard attempts a 3Pt. Heavily contested by Dirk McCollum (1.2 feet, ZONE)! Draymond Leonard misses. Rebound secured by Kristaps Iverson.

[07:38] Team_098 possession (Score: 42-31)
Tracy Rose drives and kicks out. Russell McGrady makes the Midrange and draws the foul on Ben Gilgeous-Alexander! And-1! Russell McGrady to the line for 1. [Team fouls: 2] (Ben Gilgeous-Alexander: 1 personal fouls)   FT 1/1: GOOD Russell McGrady makes 1/1 from the line.
Score: 42-34

[07:25] Team_010 possession (Score: 42-34)
Vince Ingram drives and kicks out. Ben Gilgeous-Alexander attempts a 3Pt. Heavily contested by Kristaps Iverson (0.9 feet, MAN)! BEN GILGEOUS-ALEXANDER MAKES IT! Assist: Draymond Leonard
Score: 45-34

[07:14] Team_098 possession (Score: 45-34)
FOUL! Shooting foul on Ben Gilgeous-Alexander. Dirk McCollum to the line for 2 free throws. [Team fouls: 3] (Ben Gilgeous-Alexander: 2 personal fouls)   FT 1/2: GOOD   FT 2/2: GOOD Dirk McCollum makes 2/2 from the line.
Score: 45-36

[07:00] Team_010 possession (Score: 45-36)
Paolo Wade attempts a Layup. BLOCKED BY RUSSELL MCGRADY! Ball is loose! Rebound secured by Kristaps Iverson.

[06:45] Team_098 possession (Score: 45-36)
Manu Jordan attempts a 3Pt. Contested by Vince Ingram (5.3 feet, MAN). Manu Jordan misses. Rebound secured by Blake Harden.

[06:30] Team_010 possession (Score: 45-36)
Paolo Wade attempts a Midrange. Contested by Russell McGrady (3.8 feet, MAN). Paolo Wade misses. Rebound secured by Kristaps Iverson.

[06:16] Team_098 possession (Score: 45-36)
Kristaps Iverson attempts a Midrange. Contested by Blake Harden (3.2 feet, ZONE). KRISTAPS IVERSON MAKES IT! Assist: Russell McGrady
Score: 45-38

[06:01] Team_010 possession (Score: 45-38)
Draymond Leonard drives and kicks out. Draymond Leonard attempts a Midrange. Contested by Tracy Rose (3.7 feet, MAN). Draymond Leonard misses. Offensive rebound by Paolo Wade! Paolo Wade kicks it out.

[05:50] Team_010 possession (Score: 45-38)
Ben Gilgeous-Alexander attempts a 3Pt. Wide open! Kristaps Iverson is 8.4 feet away. [MAN] BEN GILGEOUS-ALEXANDER MAKES IT! Assist: Paolo Wade
Score: 48-38

[05:39] Team_098 possession (Score: 48-38)
Tracy Rose throws a bad pass! Stolen by Draymond Leonard! TURNOVER! (live ball)

[05:22] Team_010 possession (Score: 48-38)
Ben Gilgeous-Alexander attempts a 3Pt. Wide open! Dirk McCollum is 6.7 feet away. [ZONE] BEN GILGEOUS-ALEXANDER MAKES IT! Assist: Blake Harden
Score: 51-38

[05:07] Team_098 possession (Score: 51-38)
Tracy Rose commits a violation (traveling/carry)! TURNOVER! (dead ball)

[04:47] Team_010 possession (Score: 51-38)
Vince Ingram attempts a Layup. Contested by Russell McGrady (3.8 feet, ZONE). VINCE INGRAM MAKES IT! Assist: Draymond Leonard
Score: 53-38

[04:29] Team_098 possession (Score: 53-38)
Kristaps Iverson attempts a Midrange. Contested by Ben Gilgeous-Alexander (5.2 feet, MAN). KRISTAPS IVERSON MAKES IT!
Score: 53-40

[04:13] Team_010 possession (Score: 53-40)
Draymond Leonard drives to the basket... Draymond Leonard loses the ball! Stripped by Russell McGrady! TURNOVER! (live ball)

[03:54] Team_098 possession (Score: 53-40)
Manu Jordan drives to the basket... FOUL! Offensive foul on Manu Jordan! Vince Ingram drew the charge! [Team fouls: 3] (Manu Jordan: 1 personal fouls) TURNOVER! (dead ball)

[03:38] Team_010 possession (Score: 53-40)
Ben Gilgeous-Alexander attempts a Midrange. Contested by Manu Jordan (4.5 feet, ZONE). BEN GILGEOUS-ALEXANDER MAKES IT! Assist: Draymond Leonard
Score: 55-40

[03:26] Team_098 possession (Score: 55-40)
Tracy Rose attempts a 3Pt. Contested by Draymond Leonard (5.5 feet, MAN). Tracy Rose misses. Rebound secured by Ben Gilgeous-Alexander.

[03:08] Team_010 possession (Score: 55-40)
Blake Harden attempts a 3Pt. Contested by Dirk McCollum (2.1 feet, MAN). BLAKE HARDEN MAKES IT! Assist: Ben Gilgeous-Alexander
Score: 58-40

[02:56] Team_098 possession (Score: 58-40)
Kristaps Iverson attempts a Midrange. Wide open! Vince Ingram is 7.6 feet away. [ZONE] Kristaps Iverson misses. Offensive rebound by Russell McGrady! Russell McGrady puts it back in!
Score: 58-42

[02:38] Team_010 possession (Score: 58-42)
Ben Gilgeous-Alexander attempts a 3Pt. Contested by Tracy Rose (4.3 feet, ZONE). Ben Gilgeous-Alexander misses. Rebound secured by Kristaps Iverson.

[02:22] Team_098 possession (Score: 58-42)
Kristaps Iverson attempts a 3Pt. Wide open! Ben Gilgeous-Alexander is 6.3 feet away. [MAN] Kristaps Iverson misses. Rebound secured by Blake Harden.

[02:07] Team_010 possession (Score: 58-42)
Ben Gilgeous-Alexander attempts a Layup. BLOCKED BY KRISTAPS IVERSON! Ball is loose! Rebound secured by Kristaps Iverson.

[01:53] Team_098 possession (Score: 58-42)
Russell McGrady attempts a Layup. Heavily contested by Paolo Wade (0.5 feet, MAN)! RUSSELL MCGRADY MAKES IT!
Score: 58-44

[01:38] Team_010 possession (Score: 58-44)
Vince Ingram attempts a Layup. Heavily contested by Russell McGrady (0.5 feet, ZONE)! VINCE INGRAM MAKES IT! Assist: Draymond Leonard
Score: 60-44

[01:29] Team_098 possession (Score: 60-44)
Russell McGrady attempts a 3Pt. Contested by Draymond Leonard (4.8 feet, ZONE). Russell McGrady misses. Rebound secured by Paolo Wade.

[01:11] Team_010 possession (Score: 60-44)
Ben Gilgeous-Alexander attempts a 3Pt. Wide open! Kristaps Iverson is 7.9 feet away. [MAN] BEN GILGEOUS-ALEXANDER MAKES IT! Assist: Vince Ingram
Score: 63-44

[00:55] Team_098 possession (Score: 63-44)
Kristaps Iverson drives and kicks out. Russell McGrady makes the 3Pt and draws the foul on Draymond Leonard! And-1! Russell McGrady to the line for 1. [Team fouls: 4] (Draymond Leonard: 1 personal fouls)   FT 1/1: GOOD Russell McGrady makes 1/1 from the line.
Score: 63-48

[00:36] Team_010 possession (Score: 63-48)
FOUL! Holding foul on Tracy Rose. [Team fouls: 4] No free throws, side out. (Tracy Rose: 1 personal fouls)

[00:25] Team_010 possession (Score: 63-48)
Ben Gilgeous-Alexander attempts a 3Pt. Contested by Tracy Rose (2.0 feet, ZONE). Ben Gilgeous-Alexander misses. Offensive rebound by Blake Harden! Blake Harden kicks it out.

[00:09] Team_010 possession (Score: 63-48)
Ben Gilgeous-Alexander drives, picks up Russell McGrady. Help arrives from Dirk McCollum! Ben Gilgeous-Alexander attempts a Dunk. Contested by Dirk McCollum (3.2 feet, ZONE). BEN GILGEOUS-ALEXANDER MAKES IT! Assist: Blake Harden
Score: 65-48

================================================================================
                              2ND QUARTER COMPLETE                              
================================================================================

2ND QUARTER SCORE: Team_010 32, Team_098 24

BOX SCORE:
================================================================================

Team_010
--------------------------------------------------------------------------------
Player                MIN  PTS  REB  AST  TO      FG   FG%      3P   3P%
--------------------------------------------------------------------------------
Ben Gilgeous-Alexander   11   16    1    1   0   6/8    75.0     0/0   0.0
Anthony Durant         14    4    1    0   0   2/2   100.0     0/0   0.0
Vince Ingram           11    4    0    1   0   2/2   100.0     0/0   0.0
Desmond Antetokounmpo   14    3    0    1   0   1/1   100.0     0/0   0.0
Blake Harden           11    3    4    3   0   1/2    50.0     0/0   0.0
Draymond Leonard       11    2    0    4   0   1/2    50.0     0/0   0.0
Cade Morant            14    0    1    0   0   0/1     0.0     0/0   0.0
Michael Turner         14    0    2    0   0   0/0     0.0     0/0   0.0
RJ Young               14    0    0    1   0   0/1     0.0     0/0   0.0
Paolo Wade             11    0    2    1   0   0/2     0.0     0/0   0.0

TEAM: FG: 13/21 (61.9%), 3PT: 5/8 (62.5%), REB: 11 (3 off, 8 def), AST: 12, TO: 2
TEAM FOULS: 4


Team_098
--------------------------------------------------------------------------------
Player                MIN  PTS  REB  AST  TO      FG   FG%      3P   3P%
--------------------------------------------------------------------------------
Russell McGrady        11   11    2    2   0   4/5    80.0     0/0   0.0
Kristaps Iverson       11    7    5    0   0   3/4    75.0     0/0   0.0
Nikola Rose            14    2    1    0   0   1/1   100.0     0/0   0.0
Derrick Durant         14    2    1    0   0   1/1   100.0     0/0   0.0
Dirk McCollum          11    2    0    0   0   1/1   100.0     0/0   0.0
Pascal Lillard         14    0    1    0   0   0/1     0.0     0/0   0.0
Malcolm Tatum          14    0    0    0   0   0/2     0.0     0/0   0.0
Tracy Rose             11    0    0    0   0   0/2     0.0     0/0   0.0
Manu Jordan            11    0    0    0   0   0/1     0.0     0/0   0.0

TEAM: FG: 10/18 (55.6%), 3PT: 1/6 (16.7%), REB: 10 (2 off, 8 def), AST: 2, TO: 4
TEAM FOULS: 4

================================================================================

================================================================================
                       3RD QUARTER - Team_010 vs Team_098                       
================================================================================

[12:00] Team_010 possession (Score: 65-48)
RJ Young makes the 3Pt and draws the foul on Pascal Lillard! And-1! RJ Young to the line for 1. [Team fouls: 1] (Pascal Lillard: 1 personal fouls)   FT 1/1: GOOD RJ Young makes 1/1 from the line.
Score: 69-48

[11:44] Team_098 possession (Score: 69-48)
FOUL! Reach-in foul on Michael Turner during the drive. [Team fouls: 1] No free throws, side out. (Michael Turner: 1 personal fouls)

[11:30] Team_098 possession (Score: 69-48)
Derrick Durant drives and kicks out. Blake Murray attempts a Midrange. Contested by RJ Young (2.8 feet, ZONE). Blake Murray misses. Rebound secured by Anthony Durant.

[11:15] Team_010 possession (Score: 69-48)
Cade Morant attempts a 3Pt. Contested by Pascal Lillard (5.1 feet, ZONE). Cade Morant misses. Rebound secured by Derrick Durant.

[11:04] Team_098 possession (Score: 69-48)
Malcolm Tatum makes the Layup and draws the foul on Cade Morant! And-1! Malcolm Tatum to the line for 1. [Team fouls: 2] (Cade Morant: 1 personal fouls)   FT 1/1: GOOD Malcolm Tatum makes 1/1 from the line.
Score: 69-51

[10:45] Team_010 possession (Score: 69-51)
RJ Young attempts a 3Pt. Heavily contested by Blake Murray (2.0 feet, MAN)! RJ Young misses. Rebound secured by Pascal Lillard.

[10:30] Team_098 possession (Score: 69-51)
Malcolm Tatum attempts a 3Pt. Contested by Cade Morant (2.3 feet, ZONE). Malcolm Tatum misses. Rebound secured by Anthony Durant.

[10:21] Team_010 possession (Score: 69-51)
RJ Young drives to the basket... FOUL! Offensive foul on RJ Young! Pascal Lillard drew the charge! [Team fouls: 3] (RJ Young: 1 personal fouls) TURNOVER! (dead ball)

[10:08] Team_098 possession (Score: 69-51)
Blake Murray drives, Anthony Durant stays with him. Blake Murray attempts a Dunk. Contested by Anthony Durant (2.0 feet, ZONE). Blake Murray misses. Rebound secured by Cade Morant.

[09:54] Team_010 possession (Score: 69-51)
Michael Turner attempts a 3Pt. Heavily contested by Nikola Rose (1.5 feet, MAN)! Michael Turner misses. Rebound secured by Derrick Durant.

[09:38] Team_098 possession (Score: 69-51)
FOUL! Reach-in foul on Anthony Durant during the drive. [Team fouls: 4] No free throws, side out. (Anthony Durant: 1 personal fouls)

[09:25] Team_098 possession (Score: 69-51)
FOUL! Offensive foul on Blake Murray! RJ Young drew the charge! [Team fouls: 2] (Blake Murray: 1 personal fouls) TURNOVER! (dead ball)

[09:11] Team_010 possession (Score: 69-51)
FOUL! Offensive foul on RJ Young! Blake Murray drew the charge! [Team fouls: 5] (RJ Young: 2 personal fouls) TURNOVER! (dead ball)

[08:53] Team_098 possession (Score: 69-51)
FOUL! Reach-in foul on Desmond Antetokounmpo during the drive. [IN THE BONUS! 6 team fouls] Pascal Lillard to the line for 2 free throws. (Desmond Antetokounmpo: 1 personal fouls)   FT 1/2: GOOD   FT 2/2: GOOD Pascal Lillard makes 2/2 from the line.
Score: 69-53

[08:42] Team_010 possession (Score: 69-53)
FOUL! Holding foul on Blake Murray. [Team fouls: 3] No free throws, side out. (Blake Murray: 2 personal fouls)

[08:29] Team_010 possession (Score: 69-53)
Michael Turner drives and kicks out. Desmond Antetokounmpo attempts a 3Pt. Contested by Nikola Rose (2.3 feet, ZONE). Desmond Antetokounmpo misses. Rebound secured by Pascal Lillard.

[08:17] Team_098 possession (Score: 69-53)
Nikola Rose attempts a 3Pt. Wide open! Michael Turner is 7.6 feet away. [MAN] Nikola Rose misses. Offensive rebound by Pascal Lillard! Pascal Lillard kicks it out.

[08:00] Team_098 possession (Score: 69-53)
Derrick Durant drives and kicks out. Blake Murray attempts a 3Pt. Contested by RJ Young (2.3 feet, MAN). Blake Murray misses. Rebound secured by Desmond Antetokounmpo.

[07:43] Team_010 possession (Score: 69-53)
Cade Morant attempts a 3Pt. Contested by Malcolm Tatum (4.9 feet, MAN). Cade Morant misses. Offensive rebound by Anthony Durant! Anthony Durant kicks it out.

[07:29] Team_010 possession (Score: 69-53)
FOUL! Shooting foul on Pascal Lillard. Anthony Durant to the line for 2 free throws. [Team fouls: 4] (Pascal Lillard: 2 personal fouls)   FT 1/2: GOOD   FT 2/2: MISS Anthony Durant makes 1/2 from the line. Rebound secured by Nikola Rose.
Score: 70-53

[07:12] Team_098 possession (Score: 70-53)
FOUL! Reach-in foul on Anthony Durant during the drive. [IN THE BONUS! 7 team fouls] Derrick Durant to the line for 2 free throws. (Anthony Durant: 2 personal fouls)   FT 1/2: MISS   FT 2/2: GOOD Derrick Durant makes 1/2 from the line.
Score: 70-54

[06:58] Team_010 possession (Score: 70-54)
Michael Turner attempts a 3Pt. Contested by Blake Murray (5.8 feet, ZONE). Michael Turner misses. Rebound secured by Derrick Durant.

[06:46] Team_098 possession (Score: 70-54)
Nikola Rose attempts a Midrange. Wide open! Michael Turner is 7.5 feet away. [MAN] NIKOLA ROSE MAKES IT!
Score: 70-56

[06:31] Team_010 possession (Score: 70-56)
FOUL! Reach-in foul on Pascal Lillard during the drive. [IN THE BONUS! 5 team fouls] Anthony Durant to the line for 2 free throws. (Pascal Lillard: 3 personal fouls)   FT 1/2: MISS   FT 2/2: MISS Anthony Durant makes 0/2 from the line. Rebound secured by Nikola Rose.

[06:18] Team_098 possession (Score: 70-56)
Blake Murray attempts a 3Pt. Contested by RJ Young (4.4 feet, MAN). Blake Murray misses. Rebound secured by Desmond Antetokounmpo.

[06:04] Team_010 possession (Score: 70-56)
Anthony Durant drives to the basket... Anthony Durant loses the ball! Stripped by Pascal Lillard! TURNOVER! (live ball)

[05:51] Team_098 possession (Score: 70-56)
Blake Murray drives and kicks out. Nikola Rose attempts a 3Pt. Contested by Michael Turner (2.6 feet, MAN). Nikola Rose misses. Rebound secured by Anthony Durant.

[05:39] Team_010 possession (Score: 70-56)
Desmond Antetokounmpo attempts a Midrange. Contested by Derrick Durant (5.0 feet, ZONE). Desmond Antetokounmpo misses. Rebound secured by Pascal Lillard.

[05:28] Team_098 possession (Score: 70-56)
Derrick Durant makes the Layup and draws the foul on Anthony Durant! And-1! Derrick Durant to the line for 1. [BONUS: 8 team fouls] (Anthony Durant: 3 personal fouls)   FT 1/1: GOOD Derrick Durant makes 1/1 from the line.
Score: 70-59

[05:09] Team_010 possession (Score: 70-59)
RJ Young attempts a 3Pt. Contested by Nikola Rose (2.4 feet, ZONE). RJ Young misses. Rebound secured by Nikola Rose.

[04:51] Team_098 possession (Score: 70-59)
Malcolm Tatum attempts a Midrange. Contested by Cade Morant (5.5 feet, MAN). MALCOLM TATUM MAKES IT! Assist: Nikola Rose
Score: 70-61

[04:39] Team_010 possession (Score: 70-61)
Cade Morant attempts a 3Pt. BLOCKED BY NIKOLA ROSE! Ball is loose! Rebound secured by Pascal Lillard.

[04:24] Team_098 possession (Score: 70-61)
Blake Murray attempts a 3Pt. Wide open! RJ Young is 7.9 feet away. [MAN] BLAKE MURRAY MAKES IT! Assist: Malcolm Tatum
Score: 70-64

[04:07] Team_010 possession (Score: 70-64)
Michael Turner attempts a 3Pt. Contested by Nikola Rose (3.5 feet, MAN). MICHAEL TURNER MAKES IT! Assist: Cade Morant
Score: 73-64

[03:55] Team_098 possession (Score: 73-64)
Pascal Lillard makes the Midrange and draws the foul on Desmond Antetokounmpo! And-1! Pascal Lillard to the line for 1. [BONUS: 9 team fouls] (Desmond Antetokounmpo: 2 personal fouls)   FT 1/1: GOOD Pascal Lillard makes 1/1 from the line.
Score: 73-67

[03:36] Team_010 possession (Score: 73-67)
Desmond Antetokounmpo drives, Pascal Lillard stays with him. Desmond Antetokounmpo attempts a Dunk. Contested by Pascal Lillard (5.2 feet, ZONE). DESMOND ANTETOKOUNMPO MAKES IT! Assist: Cade Morant
Score: 75-67

[03:22] Team_098 possession (Score: 75-67)
Nikola Rose attempts a Midrange. Contested by Michael Turner (2.0 feet, MAN). NIKOLA ROSE MAKES IT!
Score: 75-69

[03:03] Team_010 possession (Score: 75-69)
Cade Morant drives, Pascal Lillard stays with him. Cade Morant attempts a Layup. Wide open! Pascal Lillard is 8.0 feet away. [ZONE] CADE MORANT MAKES IT! Assist: Michael Turner
Score: 77-69

[02:45] Team_098 possession (Score: 77-69)
FOUL! Reach-in foul on Desmond Antetokounmpo during the drive. [IN THE BONUS! 10 team fouls] Pascal Lillard to the line for 2 free throws. (Desmond Antetokounmpo: 3 personal fouls)   FT 1/2: GOOD   FT 2/2: MISS Pascal Lillard makes 1/2 from the line. Rebound secured by Cade Morant.
Score: 77-70

[02:33] Team_010 possession (Score: 77-70)
Cade Morant attempts a 3Pt. Contested by Nikola Rose (4.0 feet, ZONE). Cade Morant misses. Rebound secured by Pascal Lillard.

[02:20] Team_098 possession (Score: 77-70)
Nikola Rose attempts a 3Pt. Wide open! Cade Morant is 8.7 feet away. [ZONE] Nikola Rose misses. Rebound secured by Anthony Durant.

[02:10] Team_010 possession (Score: 77-70)
RJ Young attempts a 3Pt. Contested by Nikola Rose (3.8 feet, ZONE). RJ Young misses. Rebound secured by Pascal Lillard.

[01:57] Team_098 possession (Score: 77-70)
Pascal Lillard attempts a Layup. Heavily contested by Anthony Durant (0.5 feet, ZONE)! PASCAL LILLARD MAKES IT! Assist: Malcolm Tatum
Score: 77-72

[01:42] Team_010 possession (Score: 77-72)
RJ Young drives, Blake Murray stays with him. RJ Young attempts a Layup. Contested by Blake Murray (3.5 feet, MAN). RJ YOUNG MAKES IT!
Score: 79-72

[01:26] Team_098 possession (Score: 79-72)
Pascal Lillard attempts a Layup. Contested by Desmond Antetokounmpo (3.5 feet, MAN). PASCAL LILLARD MAKES IT!
Score: 79-74

[01:10] Team_010 possession (Score: 79-74)
Michael Turner attempts a 3Pt. Contested by Nikola Rose (5.8 feet, MAN). Michael Turner misses. Rebound secured by Pascal Lillard.

[00:54] Team_098 possession (Score: 79-74)
Pascal Lillard throws a bad pass! Stolen by Desmond Antetokounmpo! TURNOVER! (live ball)

[00:38] Team_010 possession (Score: 79-74)
Desmond Antetokounmpo attempts a 3Pt. Wide open! Pascal Lillard is 6.8 feet away. [MAN] DESMOND ANTETOKOUNMPO MAKES IT! Assist: Anthony Durant
Score: 82-74

[00:21] Team_098 possession (Score: 82-74)
Nikola Rose attempts a 3Pt. Wide open! Cade Morant is 9.5 feet away. [ZONE] NIKOLA ROSE MAKES IT! Assist: Derrick Durant
Score: 82-77

[00:06] Team_010 possession (Score: 82-77)
FOUL! Reach-in foul on Blake Murray during the drive. [IN THE BONUS! 6 team fouls] RJ Young to the line for 2 free throws. (Blake Murray: 3 personal fouls)   FT 1/2: MISS   FT 2/2: GOOD RJ Young makes 1/2 from the line.
Score: 83-77

================================================================================
                              3RD QUARTER COMPLETE                              
================================================================================

3RD QUARTER SCORE: Team_010 18, Team_098 29

BOX SCORE:
================================================================================

Team_010
--------------------------------------------------------------------------------
Player                MIN  PTS  REB  AST  TO      FG   FG%      3P   3P%
--------------------------------------------------------------------------------
RJ Young               26    7    0    0   0   3/6    50.0     0/0   0.0
Desmond Antetokounmpo   26    5    2    0   0   2/3    66.7     0/0   0.0
Michael Turner         26    3    0    1   0   1/5    20.0     0/0   0.0
Cade Morant            26    2    2    2   0   1/4    25.0     0/0   0.0
Anthony Durant         26    0    5    1   0   0/2     0.0     0/0   0.0

TEAM: FG: 7/20 (35.0%), 3PT: 3/12 (25.0%), REB: 9 (1 off, 8 def), AST: 4, TO: 3
TEAM FOULS: 10 [Team_098 in BONUS]


Team_098
--------------------------------------------------------------------------------
Player                MIN  PTS  REB  AST  TO      FG   FG%      3P   3P%
--------------------------------------------------------------------------------
Pascal Lillard         26    9    8    0   0   4/5    80.0     0/0   0.0
Nikola Rose            26    7    3    1   0   3/4    75.0     0/0   0.0
Malcolm Tatum          26    5    0    2   0   2/3    66.7     0/0   0.0
Derrick Durant         26    4    3    1   0   2/4    50.0     0/0   0.0
Blake Murray           26    3    0    0   0   1/4    25.0     0/0   0.0

TEAM: FG: 12/20 (60.0%), 3PT: 2/5 (40.0%), REB: 14 (1 off, 13 def), AST: 4, TO: 2
TEAM FOULS: 6 [Team_010 in BONUS]

================================================================================

================================================================================
                       4TH QUARTER - Team_010 vs Team_098                       
================================================================================

[12:00] Team_010 possession (Score: 83-77)
FOUL! Reach-in foul on Pascal Lillard during the drive. [Team fouls: 1] No free throws, side out. (Pascal Lillard: 1 personal fouls)

[11:43] Team_010 possession (Score: 83-77)
Anthony Durant throws a bad pass out of bounds! TURNOVER! (dead ball)

[11:43] Substitution (Team_010): Cade Morant OUT → Draymond Leonard IN (stamina_rule2)

[11:43] Substitution (Team_010): Michael Turner OUT → Blake Harden IN (stamina_rule2)

[11:43] Substitution (Team_010): RJ Young OUT → Ben Gilgeous-Alexander IN (stamina_rule2)

[11:43] Substitution (Team_010): Desmond Antetokounmpo OUT → Vince Ingram IN (stamina_rule2)

[11:43] Substitution (Team_010): Anthony Durant OUT → Paolo Wade IN (stamina_rule2)

[11:43] Substitution (Team_098): Malcolm Tatum OUT → Tracy Rose IN (stamina_rule2)

[11:43] Substitution (Team_098): Nikola Rose OUT → Dirk McCollum IN (stamina_rule2)

[11:43] Substitution (Team_098): Blake Murray OUT → Kristaps Iverson IN (stamina_rule2)

[11:43] Substitution (Team_098): Pascal Lillard OUT → Manu Jordan IN (stamina_rule2)

[11:43] Substitution (Team_098): Derrick Durant OUT → Russell McGrady IN (stamina_rule2)

[11:32] Team_098 possession (Score: 83-77)
Dirk McCollum attempts a Midrange. Wide open! Vince Ingram is 7.1 feet away. [ZONE] DIRK MCCOLLUM MAKES IT!
Score: 83-79

[11:17] Team_010 possession (Score: 83-79)
Blake Harden attempts a Midrange. Contested by Dirk McCollum (2.5 feet, MAN). Blake Harden misses. Rebound secured by Russell McGrady.

[11:04] Team_098 possession (Score: 83-79)
Tracy Rose attempts a 3Pt. Contested by Draymond Leonard (3.3 feet, MAN). Tracy Rose misses. Rebound secured by Paolo Wade.

[10:53] Team_010 possession (Score: 83-79)
Draymond Leonard attempts a Midrange. Wide open! Tracy Rose is 6.0 feet away. [MAN] Draymond Leonard misses. Rebound secured by Russell McGrady.

[10:35] Team_098 possession (Score: 83-79)
Dirk McCollum attempts a Midrange. Contested by Blake Harden (5.9 feet, MAN). Dirk McCollum misses. Rebound secured by Blake Harden.

[10:18] Team_010 possession (Score: 83-79)
Draymond Leonard attempts a Layup. Contested by Russell McGrady (4.6 feet, ZONE). DRAYMOND LEONARD MAKES IT!
Score: 85-79

[10:05] Team_098 possession (Score: 85-79)
Kristaps Iverson throws a bad pass! Stolen by Ben Gilgeous-Alexander! TURNOVER! (live ball)

[09:52] Team_010 possession (Score: 85-79)
Paolo Wade attempts a Layup. Contested by Russell McGrady (2.1 feet, MAN). Paolo Wade misses. Offensive rebound by Paolo Wade! Paolo Wade kicks it out.

[09:36] Team_010 possession (Score: 85-79)
Vince Ingram drives, picks up Russell McGrady. Help arrives from Dirk McCollum! Vince Ingram attempts a Dunk. Contested by Dirk McCollum (3.7 feet, ZONE). Vince Ingram misses. Rebound secured by Kristaps Iverson.

[09:21] Team_098 possession (Score: 85-79)
Russell McGrady attempts a 3Pt. Wide open! Draymond Leonard is 6.7 feet away. [ZONE] RUSSELL MCGRADY MAKES IT! Assist: Kristaps Iverson
Score: 85-82

[09:09] Team_010 possession (Score: 85-82)
Blake Harden attempts a 3Pt. Contested by Dirk McCollum (4.2 feet, ZONE). Blake Harden misses. Rebound secured by Manu Jordan.

[08:55] Team_098 possession (Score: 85-82)
FOUL! Offensive foul on Russell McGrady! Paolo Wade drew the charge! [Team fouls: 2] (Russell McGrady: 1 personal fouls) TURNOVER! (dead ball)

[08:43] Team_010 possession (Score: 85-82)
Ben Gilgeous-Alexander attempts a Midrange. Wide open! Kristaps Iverson is 7.2 feet away. [MAN] Ben Gilgeous-Alexander misses. Rebound secured by Manu Jordan.

[08:28] Team_098 possession (Score: 85-82)
Dirk McCollum attempts a Midrange. Contested by Blake Harden (4.0 feet, MAN). Dirk McCollum misses. Rebound secured by Paolo Wade.

[08:12] Team_010 possession (Score: 85-82)
Blake Harden attempts a 3Pt. Contested by Dirk McCollum (4.2 feet, MAN). BLAKE HARDEN MAKES IT! Assist: Draymond Leonard
Score: 88-82

[08:00] Team_098 possession (Score: 88-82)
Tracy Rose attempts a 3Pt. Contested by Draymond Leonard (5.1 feet, ZONE). Tracy Rose misses. Offensive rebound by Kristaps Iverson! Kristaps Iverson kicks it out.

[07:45] Team_098 possession (Score: 88-82)
Russell McGrady drives to the basket... Russell McGrady throws a bad pass out of bounds! TURNOVER! (dead ball)

[07:27] Team_010 possession (Score: 88-82)
Blake Harden attempts a Midrange. Wide open! Dirk McCollum is 7.3 feet away. [MAN] BLAKE HARDEN MAKES IT!
Score: 90-82

[07:11] Team_098 possession (Score: 90-82)
FOUL! Shooting foul on Draymond Leonard. Kristaps Iverson to the line for 3 free throws. [Team fouls: 1] (Draymond Leonard: 1 personal fouls)   FT 1/3: GOOD   FT 2/3: GOOD   FT 3/3: GOOD Kristaps Iverson makes 3/3 from the line.
Score: 90-85

[06:56] Team_010 possession (Score: 90-85)
Vince Ingram drives and kicks out. Draymond Leonard attempts a 3Pt. Contested by Dirk McCollum (2.8 feet, ZONE). Draymond Leonard misses. Rebound secured by Manu Jordan.

[06:44] Team_098 possession (Score: 90-85)
Russell McGrady makes the Dunk and draws the foul on Blake Harden! And-1! Russell McGrady to the line for 1. [Team fouls: 2] (Blake Harden: 1 personal fouls)   FT 1/1: GOOD Russell McGrady makes 1/1 from the line.
Score: 90-88

[06:30] Team_010 possession (Score: 90-88)
Paolo Wade drives to the basket... FOUL! Offensive foul on Paolo Wade! Russell McGrady drew the charge! [Team fouls: 3] (Paolo Wade: 1 personal fouls) TURNOVER! (dead ball)

[06:17] Team_098 possession (Score: 90-88)
Tracy Rose drives and kicks out. Manu Jordan attempts a Midrange. Wide open! Blake Harden is 7.0 feet away. [ZONE] MANU JORDAN MAKES IT!
Score: 90-90

[05:59] Team_010 possession (Score: 90-90)
Blake Harden attempts a 3Pt. Contested by Dirk McCollum (5.4 feet, ZONE). Blake Harden misses. FOUL! Loose ball foul on Kristaps Iverson during the rebound battle. [Team fouls: 3] No free throws, side out. (Kristaps Iverson: 1 personal fouls)

[05:46] Team_010 possession (Score: 90-90)
Paolo Wade attempts a 3Pt. Contested by Russell McGrady (3.3 feet, MAN). Paolo Wade misses. Rebound secured by Russell McGrady.

[05:34] Team_098 possession (Score: 90-90)
Kristaps Iverson attempts a 3Pt. Wide open! Ben Gilgeous-Alexander is 7.9 feet away. [MAN] Kristaps Iverson misses. Rebound secured by Blake Harden.

[05:22] Team_010 possession (Score: 90-90)
Paolo Wade attempts a Layup. Contested by Russell McGrady (2.6 feet, ZONE). Paolo Wade misses. Offensive rebound by Paolo Wade! Paolo Wade kicks it out.

[05:07] Team_010 possession (Score: 90-90)
Ben Gilgeous-Alexander drives to the basket... FOUL! Offensive foul on Ben Gilgeous-Alexander! Russell McGrady drew the charge! [Team fouls: 4] (Ben Gilgeous-Alexander: 1 personal fouls) TURNOVER! (dead ball)

[04:52] Team_098 possession (Score: 90-90)
Kristaps Iverson drives and kicks out. Dirk McCollum attempts a 3Pt. Contested by Ben Gilgeous-Alexander (5.7 feet, ZONE). Dirk McCollum misses. Rebound secured by Blake Harden.

[04:38] Team_010 possession (Score: 90-90)
Vince Ingram attempts a 3Pt. Contested by Dirk McCollum (5.3 feet, ZONE). VINCE INGRAM MAKES IT! Assist: Draymond Leonard
Score: 93-90

[04:22] Team_098 possession (Score: 93-90)
Tracy Rose attempts a 3Pt. Contested by Blake Harden (4.7 feet, ZONE). Tracy Rose misses. Rebound secured by Blake Harden.

[04:09] Team_010 possession (Score: 93-90)
Ben Gilgeous-Alexander attempts a 3Pt. Contested by Kristaps Iverson (3.3 feet, MAN). BEN GILGEOUS-ALEXANDER MAKES IT! Assist: Vince Ingram
Score: 96-90

[03:52] Team_098 possession (Score: 96-90)
Tracy Rose drives to the basket... FOUL! Offensive foul on Tracy Rose! Paolo Wade drew the charge! [Team fouls: 4] (Tracy Rose: 1 personal fouls) TURNOVER! (dead ball)

[03:39] Team_010 possession (Score: 96-90)
Ben Gilgeous-Alexander attempts a 3Pt. Contested by Kristaps Iverson (3.6 feet, MAN). Ben Gilgeous-Alexander misses. Rebound secured by Manu Jordan.

[03:21] Team_098 possession (Score: 96-90)
Kristaps Iverson drives, picks up Ben Gilgeous-Alexander. Help arrives from Blake Harden! Kristaps Iverson attempts a Dunk. Contested by Blake Harden (2.7 feet, MAN). KRISTAPS IVERSON MAKES IT! Assist: Dirk McCollum
Score: 96-92

[03:08] Team_010 possession (Score: 96-92)
Paolo Wade loses the ball! Stripped by Russell McGrady! TURNOVER! (live ball)

[02:54] Team_098 possession (Score: 96-92)
Kristaps Iverson attempts a 3Pt. Contested by Draymond Leonard (3.8 feet, ZONE). Kristaps Iverson misses. Rebound secured by Blake Harden.

[02:38] Team_010 possession (Score: 96-92)
Vince Ingram attempts a Midrange. Wide open! Manu Jordan is 10.0 feet away. [MAN] VINCE INGRAM MAKES IT! Assist: Draymond Leonard
Score: 98-92

[02:22] Team_098 possession (Score: 98-92)
FOUL! Reach-in foul on Vince Ingram during the drive. [IN THE BONUS! 5 team fouls] Manu Jordan to the line for 2 free throws. (Vince Ingram: 1 personal fouls)   FT 1/2: GOOD   FT 2/2: GOOD Manu Jordan makes 2/2 from the line.
Score: 98-94

[02:06] Team_010 possession (Score: 98-94)
Ben Gilgeous-Alexander loses control! Ball rolls out of bounds! TURNOVER! (dead ball)

[01:51] Team_098 possession (Score: 98-94)
Russell McGrady drives to the basket... Russell McGrady loses the ball! Stripped by Paolo Wade! TURNOVER! (live ball)

[01:38] Team_010 possession (Score: 98-94)
FOUL! Reach-in foul on Kristaps Iverson during the drive. [IN THE BONUS! 5 team fouls] Ben Gilgeous-Alexander to the line for 2 free throws. (Kristaps Iverson: 2 personal fouls)   FT 1/2: MISS   FT 2/2: GOOD Ben Gilgeous-Alexander makes 1/2 from the line.
Score: 99-94

[01:22] Team_098 possession (Score: 99-94)
Dirk McCollum attempts a 3Pt. BLOCKED BY BLAKE HARDEN! Ball is loose! Rebound secured by Ben Gilgeous-Alexander.

[01:08] Team_010 possession (Score: 99-94)
Vince Ingram throws a bad pass! Stolen by Manu Jordan! TURNOVER! (live ball)

[00:50] Team_098 possession (Score: 99-94)
Tracy Rose makes the Dunk and draws the foul on Blake Harden! And-1! Tracy Rose to the line for 1. [BONUS: 6 team fouls] (Blake Harden: 2 personal fouls)   FT 1/1: GOOD Tracy Rose makes 1/1 from the line.
Score: 99-97

[00:36] Team_010 possession (Score: 99-97)
Ben Gilgeous-Alexander drives, Kristaps Iverson stays with him. Ben Gilgeous-Alexander attempts a Layup. Contested by Kristaps Iverson (5.5 feet, MAN). Ben Gilgeous-Alexander misses. Rebound secured by Manu Jordan.

[00:23] Team_098 possession (Score: 99-97)
Tracy Rose attempts a 3Pt. Contested by Draymond Leonard (3.4 feet, ZONE). TRACY ROSE MAKES IT!
Score: 99-100

[00:09] Team_010 possession (Score: 99-100)
Vince Ingram attempts a 3Pt. Wide open! Dirk McCollum is 6.8 feet away. [ZONE] VINCE INGRAM MAKES IT! Assist: Ben Gilgeous-Alexander
Score: 102-100

================================================================================
                              4TH QUARTER COMPLETE                              
================================================================================

4TH QUARTER SCORE: Team_010 19, Team_098 23

BOX SCORE:
================================================================================

Team_010
--------------------------------------------------------------------------------
Player                MIN  PTS  REB  AST  TO      FG   FG%      3P   3P%
--------------------------------------------------------------------------------
Vince Ingram           22    8    0    1   0   3/5    60.0     0/0   0.0
Blake Harden           22    5    6    0   0   2/4    50.0     0/0   0.0
Ben Gilgeous-Alexander   22    4    1    1   0   2/5    40.0     0/0   0.0
Draymond Leonard       22    2    0    3   0   1/2    50.0     0/0   0.0
Paolo Wade             22    0    4    0   0   0/1     0.0     0/0   0.0

TEAM: FG: 8/17 (47.1%), 3PT: 4/7 (57.1%), REB: 11 (3 off, 8 def), AST: 5, TO: 6
TEAM FOULS: 6 [Team_098 in BONUS]


Team_098
--------------------------------------------------------------------------------
Player                MIN  PTS  REB  AST  TO      FG   FG%      3P   3P%
--------------------------------------------------------------------------------
Russell McGrady        22    6    3    0   0   2/2   100.0     0/0   0.0
Tracy Rose             22    6    0    0   0   2/4    50.0     0/0   0.0
Kristaps Iverson       22    5    2    1   0   2/5    40.0     0/0   0.0
Manu Jordan            22    4    5    0   0   2/2   100.0     0/0   0.0
Dirk McCollum          22    2    0    1   0   1/4    25.0     0/0   0.0

TEAM: FG: 9/17 (52.9%), 3PT: 3/8 (37.5%), REB: 10 (1 off, 9 def), AST: 2, TO: 5
TEAM FOULS: 5 [Team_010 in BONUS]

================================================================================

================================================================================
                               FULL GAME COMPLETE                               
================================================================================

FINAL SCORE: Team_010 102, Team_098 100

SCORING BY QUARTER:
--------------------------------------------------------------------------------
Team                     Q1     Q2     Q3     Q4    FINAL
--------------------------------------------------------------------------------
Team_010                 33     32     18     19      102
Team_098                 24     24     29     23      100
--------------------------------------------------------------------------------

FULL GAME BOX SCORE:
================================================================================

Team_010
--------------------------------------------------------------------------------
Player                MIN  PTS  REB  AST  TO      FG   FG%      3P   3P%      FT STL BLK
--------------------------------------------------------------------------------
Cade Morant            26    5    7    3   0   2/7    28.6   0/3     0.0   1/1     0   0
Michael Turner         26    6    3    1   1   3/8    37.5   2/6    33.3   3/5     0   0
RJ Young               26    9    0    3   2   4/9    44.4   1/5    20.0   2/3     0   0
Desmond Antetokounmpo   26   12    3    1   3   5/6    83.3   2/2   100.0   3/3     1   0
Anthony Durant         26   17   10    2   3   7/10   70.0   1/1   100.0   3/6     0   1
Draymond Leonard       22    6    0    7   0   2/5    40.0   0/2     0.0   0/0     1   0
Blake Harden           22    8   11    3   1   3/6    50.0   2/4    50.0   0/0     0   1
Ben Gilgeous-Alexander   22   20    3    2   2   7/12   58.3   4/6    66.7   1/2     1   0
Vince Ingram           22   12    0    2   2   6/8    75.0   2/2   100.0   0/0     0   0
Paolo Wade             22    6    7    1   1   3/6    50.0   0/1     0.0   2/2     1   0

TEAM: FG: 42/77 (54.5%), 3PT: 14/32 (43.8%), REB: 43 (10 off, 33 def), AST: 25, TO: 15


Team_098
--------------------------------------------------------------------------------
Player                MIN  PTS  REB  AST  TO      FG   FG%      3P   3P%      FT STL BLK
--------------------------------------------------------------------------------
Malcolm Tatum          26   13    0    2   0   5/8    62.5   1/3    33.3   4/4     0   0
Nikola Rose            26   13    5    3   1   6/8    75.0   1/2    50.0   0/0     0   1
Blake Murray           26   10    0    0   1   4/11   36.4   2/5    40.0   0/0     0   0
Pascal Lillard         26   11   12    0   2   6/10   60.0   0/2     0.0   4/5     1   0
Derrick Durant         26    6    6    3   0   2/5    40.0   0/0     0.0   2/3     0   0
Tracy Rose             22    9    0    0   3   5/9    55.6   1/4    25.0   2/2     0   0
Dirk McCollum          22    4    0    1   0   2/6    33.3   0/1     0.0   2/2     0   0
Kristaps Iverson       22   12    7    1   4   7/11   63.6   2/5    40.0   3/3     0   1
Manu Jordan            22    4    5    0   1   1/3    33.3   0/1     0.0   2/2     1   0
Russell McGrady        22   17    6    2   1   3/5    60.0   1/2    50.0   3/3     2   1

TEAM: FG: 41/76 (53.9%), 3PT: 8/25 (32.0%), REB: 42 (7 off, 35 def), AST: 12, TO: 13

================================================================================
