================================================================================
                        FULL GAME - Team_046 vs Team_091                        
================================================================================

================================================================================
                       1ST QUARTER - Team_046 vs Team_091                       
================================================================================

[12:00] Team_046 possession (Score: 0-0)
Cade Wall attempts a Layup. Contested by Kevin Simons (3.4 feet, ZONE). CADE WALL MAKES IT! Assist: Victor Nowitzki
Score: 2-0

[11:48] Team_091 possession (Score: 2-0)
Isaiah Siakam attempts a 3Pt. Contested by Lauri Carter (3.0 feet, ZONE). Isaiah Siakam misses. Offensive rebound by Rudy Bridges! Rudy Bridges kicks it out.

[11:34] Team_091 possession (Score: 2-0)
Kyrie Rozier attempts a 3Pt. Contested by Cade Wall (4.8 feet, ZONE). Kyrie Rozier misses. Rebound secured by Cade Wall.

[11:23] Team_046 possession (Score: 2-0)
Cade Wall drives to the basket... Cade Wall commits a violation (traveling/carry)! TURNOVER! (dead ball)

[11:11] Team_091 possession (Score: 2-0)
Rudy Bridges loses control! Ball rolls out of bounds! TURNOVER! (dead ball)

[11:00] Team_046 possession (Score: 2-0)
Cade Wall attempts a Layup. Heavily contested by Kevin Simons (1.8 feet, ZONE)! CADE WALL MAKES IT!
Score: 4-0

[10:50] Team_091 possession (Score: 4-0)
Isaiah Siakam attempts a Midrange. Wide open! Victor Nowitzki is 7.2 feet away. [MAN] ISAIAH SIAKAM MAKES IT! Assist: Rudy Bridges
Score: 4-2

[10:36] Team_046 possession (Score: 4-2)
Victor Nowitzki drives and kicks out. Lauri Carter attempts a Midrange. Contested by Rudy Bridges (4.8 feet, MAN). LAURI CARTER MAKES IT!
Score: 6-2

[10:22] Team_091 possession (Score: 6-2)
Kyrie Rozier attempts a 3Pt. Contested by D'Angelo O'Neal (2.3 feet, MAN). KYRIE ROZIER MAKES IT! Assist: Rudy Bridges
Score: 6-5

[10:05] Team_046 possession (Score: 6-5)
FOUL! Shooting foul on Kevin Simons. Kevin Allen to the line for 2 free throws. [Team fouls: 1] (Kevin Simons: 1 personal fouls)   FT 1/2: GOOD   FT 2/2: GOOD Kevin Allen makes 2/2 from the line.
Score: 8-5

[09:52] Team_091 possession (Score: 8-5)
D'Angelo Ingram attempts a 3Pt. Wide open! Cade Wall is 6.7 feet away. [MAN] D'Angelo Ingram misses. Rebound secured by Lauri Carter.

[09:36] Team_046 possession (Score: 8-5)
Victor Nowitzki attempts a 3Pt. Contested by Isaiah Siakam (4.3 feet, MAN). Victor Nowitzki misses. Offensive rebound by Kevin Allen! Kevin Allen kicks it out.

[09:22] Team_046 possession (Score: 8-5)
Lauri Carter attempts a 3Pt. Wide open! Rudy Bridges is 6.4 feet away. [MAN] Lauri Carter misses. Offensive rebound by Kevin Allen! Kevin Allen kicks it out.

[09:13] Team_046 possession (Score: 8-5)
D'Angelo O'Neal drives, picks up D'Angelo Ingram. Help arrives from Kyrie Rozier! D'Angelo O'Neal attempts a Dunk. Contested by Kyrie Rozier (3.7 feet, ZONE). D'Angelo O'Neal misses. Offensive rebound by Kevin Allen! Kevin Allen kicks it out.

[08:55] Team_046 possession (Score: 8-5)
D'Angelo O'Neal throws a bad pass! Stolen by Kyrie Rozier! TURNOVER! (live ball)

[08:40] Team_091 possession (Score: 8-5)
Isaiah Siakam attempts a 3Pt. Contested by Victor Nowitzki (4.8 feet, MAN). Isaiah Siakam misses. Offensive rebound by Kevin Simons! Kevin Simons puts it back in!
Score: 8-7

[08:26] Team_046 possession (Score: 8-7)
Cade Wall commits a violation (traveling/carry)! TURNOVER! (dead ball)

[08:12] Team_091 possession (Score: 8-7)
Kevin Simons attempts a 3Pt. Contested by Lauri Carter (5.1 feet, ZONE). Kevin Simons misses. Rebound secured by Cade Wall.

[07:54] Team_046 possession (Score: 8-7)
Cade Wall drives, D'Angelo Ingram stays with him. Cade Wall attempts a Dunk. Contested by D'Angelo Ingram (5.5 feet, MAN). Cade Wall misses. Rebound secured by Rudy Bridges.

[07:38] Team_091 possession (Score: 8-7)
Kevin Simons attempts a Layup. Contested by Kevin Allen (4.0 feet, MAN). KEVIN SIMONS MAKES IT! Assist: D'Angelo Ingram
Score: 8-9

[07:21] Team_046 possession (Score: 8-9)
Cade Wall drives, D'Angelo Ingram stays with him. Cade Wall attempts a Dunk. Contested by D'Angelo Ingram (3.1 feet, MAN). Cade Wall misses. Offensive rebound by Cade Wall! Cade Wall kicks it out.

[07:04] Team_046 possession (Score: 8-9)
Victor Nowitzki attempts a Layup. Contested by Kevin Simons (2.7 feet, ZONE). VICTOR NOWITZKI MAKES IT!
Score: 10-9

[06:55] Team_091 possession (Score: 10-9)
Isaiah Siakam attempts a Midrange. Wide open! Victor Nowitzki is 6.9 feet away. [MAN] Isaiah Siakam misses. Rebound secured by Kevin Allen.

[06:38] Team_046 possession (Score: 10-9)
D'Angelo O'Neal attempts a Midrange. Wide open! Isaiah Siakam is 6.1 feet away. [ZONE] D'Angelo O'Neal misses. Rebound secured by Kyrie Rozier.

[06:21] Team_091 possession (Score: 10-9)
Rudy Bridges drives, Kevin Allen stays with him. Rudy Bridges attempts a Dunk. Contested by Kevin Allen (4.8 feet, ZONE). Rudy Bridges misses. Offensive rebound by Rudy Bridges! Rudy Bridges kicks it out.

[06:07] Team_091 possession (Score: 10-9)
FOUL! Shooting foul on Lauri Carter. Rudy Bridges to the line for 3 free throws. [Team fouls: 1] (Lauri Carter: 1 personal fouls)   FT 1/3: GOOD   FT 2/3: MISS   FT 3/3: GOOD Rudy Bridges makes 2/3 from the line.
Score: 10-11

[05:51] Team_046 possession (Score: 10-11)
D'Angelo O'Neal attempts a 3Pt. Contested by Kyrie Rozier (2.9 feet, MAN). D'Angelo O'Neal misses. Rebound secured by Kevin Simons.

[05:35] Team_091 possession (Score: 10-11)
Rudy Bridges drives to the basket... Rudy Bridges commits a violation (traveling/carry)! TURNOVER! (dead ball)

[05:22] Team_046 possession (Score: 10-11)
Victor Nowitzki attempts a Midrange. Contested by Rudy Bridges (3.5 feet, ZONE). Victor Nowitzki misses. Rebound secured by Rudy Bridges.

[05:10] Team_091 possession (Score: 10-11)
D'Angelo Ingram attempts a Midrange. Contested by Victor Nowitzki (3.7 feet, ZONE). D'Angelo Ingram misses. FOUL! Loose ball foul on Cade Wall during the rebound battle. [Team fouls: 2] No free throws, side out. (Cade Wall: 1 personal fouls)

[04:59] Team_091 possession (Score: 10-11)
Rudy Bridges attempts a 3Pt. Wide open! Victor Nowitzki is 6.4 feet away. [ZONE] Rudy Bridges misses. Rebound secured by Cade Wall.

[04:49] Team_046 possession (Score: 10-11)
Kevin Allen attempts a Layup. Contested by Kevin Simons (5.1 feet, MAN). KEVIN ALLEN MAKES IT!
Score: 12-11

[04:35] Team_091 possession (Score: 12-11)
D'Angelo Ingram attempts a Midrange. Contested by Cade Wall (4.6 feet, MAN). D'Angelo Ingram misses. Offensive rebound by Rudy Bridges! Rudy Bridges kicks it out.

[04:23] Team_091 possession (Score: 12-11)
FOUL! Offensive foul on D'Angelo Ingram! Cade Wall drew the charge! [Team fouls: 2] (D'Angelo Ingram: 1 personal fouls) TURNOVER! (dead ball)

[04:06] Team_046 possession (Score: 12-11)
Victor Nowitzki drives to the basket... FOUL! Offensive foul on Victor Nowitzki! Kevin Simons drew the charge! [Team fouls: 3] (Victor Nowitzki: 1 personal fouls) TURNOVER! (dead ball)

[03:52] Team_091 possession (Score: 12-11)
Rudy Bridges drives and kicks out. Kyrie Rozier attempts a 3Pt. Wide open! D'Angelo O'Neal is 6.8 feet away. [MAN] Kyrie Rozier misses. Rebound secured by Cade Wall.

[03:37] Team_046 possession (Score: 12-11)
D'Angelo O'Neal attempts a Midrange. Contested by D'Angelo Ingram (3.8 feet, ZONE). D'ANGELO O'NEAL MAKES IT!
Score: 14-11

[03:22] Team_091 possession (Score: 14-11)
Kyrie Rozier loses control! Ball rolls out of bounds! TURNOVER! (dead ball)

[03:22] Substitution (Team_046): Kevin Allen OUT → Paul DeRozan IN (stamina_rule2)

[03:22] Substitution (Team_091): Isaiah Siakam OUT → Julius Barnes IN (stamina_rule2)

[03:10] Team_046 possession (Score: 14-11)
Paul DeRozan attempts a Midrange. Contested by Rudy Bridges (5.0 feet, ZONE). PAUL DEROZAN MAKES IT!
Score: 16-11

[02:54] Team_091 possession (Score: 16-11)
FOUL! Shooting foul on Cade Wall. Rudy Bridges to the line for 2 free throws. [Team fouls: 4] (Cade Wall: 2 personal fouls)   FT 1/2: GOOD   FT 2/2: GOOD Rudy Bridges makes 2/2 from the line.
Score: 16-13

[02:41] Team_046 possession (Score: 16-13)
Paul DeRozan attempts a 3Pt. Wide open! Kevin Simons is 7.5 feet away. [MAN] Paul DeRozan misses. Rebound secured by Kevin Simons.

[02:27] Team_091 possession (Score: 16-13)
Julius Barnes drives, picks up Victor Nowitzki. Help arrives from Lauri Carter! Julius Barnes attempts a Layup. Contested by Lauri Carter (4.9 feet, MAN). JULIUS BARNES MAKES IT! Assist: Rudy Bridges
Score: 16-15

[02:13] Team_046 possession (Score: 16-15)
Lauri Carter attempts a Layup. BLOCKED BY KEVIN SIMONS! Ball is loose! Offensive rebound by Cade Wall! Cade Wall kicks it out.

[01:59] Team_046 possession (Score: 16-15)
Paul DeRozan attempts a 3Pt. Wide open! Kyrie Rozier is 7.6 feet away. [ZONE] PAUL DEROZAN MAKES IT! Assist: Victor Nowitzki
Score: 19-15

[01:46] Team_091 possession (Score: 19-15)
D'Angelo Ingram drives to the basket... D'Angelo Ingram loses the ball! Stripped by Paul DeRozan! TURNOVER! (live ball)

[01:28] Team_046 possession (Score: 19-15)
D'Angelo O'Neal attempts a Midrange. Heavily contested by Kyrie Rozier (1.6 feet, MAN)! D'Angelo O'Neal misses. Rebound secured by Kevin Simons.

[01:11] Team_091 possession (Score: 19-15)
Kyrie Rozier attempts a Midrange. Wide open! Victor Nowitzki is 9.4 feet away. [ZONE] KYRIE ROZIER MAKES IT!
Score: 19-17

[00:57] Team_046 possession (Score: 19-17)
Victor Nowitzki attempts a Layup. Contested by Julius Barnes (2.3 feet, MAN). Victor Nowitzki misses. Rebound secured by Kevin Simons.

[00:44] Team_091 possession (Score: 19-17)
Julius Barnes attempts a 3Pt. Wide open! Victor Nowitzki is 7.4 feet away. [MAN] Julius Barnes misses. Rebound secured by Cade Wall.

[00:29] Team_046 possession (Score: 19-17)
Lauri Carter throws a bad pass out of bounds! TURNOVER! (dead ball)

[00:29] Substitution (Team_046): D'Angelo O'Neal OUT → Collin Butler IN (stamina_rule2)

[00:29] Substitution (Team_046): Victor Nowitzki OUT → Manu Dosunmu IN (stamina_rule2)

[00:29] Substitution (Team_046): Lauri Carter OUT → Josh Barrett IN (stamina_rule2)

[00:29] Substitution (Team_046): Cade Wall OUT → Chris LaVine IN (stamina_rule2)

[00:29] Substitution (Team_091): Kyrie Rozier OUT → Karl Morant IN (stamina_rule2)

[00:29] Substitution (Team_091): Rudy Bridges OUT → Tim Antetokounmpo IN (stamina_rule2)

[00:29] Substitution (Team_091): D'Angelo Ingram OUT → Zion Mitchell IN (stamina_rule2)

[00:29] Substitution (Team_091): Kevin Simons OUT → Ja George IN (stamina_rule2)

[00:18] Team_091 possession (Score: 19-17)
Zion Mitchell drives, Chris LaVine stays with him. Zion Mitchell attempts a Layup. Contested by Chris LaVine (4.8 feet, MAN). Zion Mitchell misses. Rebound secured by Paul DeRozan.

[00:02] Team_046 possession (Score: 19-17)
Manu Dosunmu attempts a 3Pt. Contested by Julius Barnes (5.2 feet, MAN). MANU DOSUNMU MAKES IT! Assist: Josh Barrett
Score: 22-17

================================================================================
                              1ST QUARTER COMPLETE                              
================================================================================

1ST QUARTER SCORE: Team_046 22, Team_091 17

BOX SCORE:
================================================================================

Team_046
--------------------------------------------------------------------------------
Player                MIN  PTS  REB  AST  TO      FG   FG%      3P   3P%
--------------------------------------------------------------------------------
Paul DeRozan            3    5    1    0   0   2/3    66.7     0/0   0.0
Cade Wall              12    4    7    0   0   2/3    66.7     0/0   0.0
Kevin Allen             9    4    4    0   0   2/2   100.0     0/0   0.0
Manu Dosunmu            1    3    0    0   0   1/1   100.0     0/0   0.0
Victor Nowitzki        12    2    0    2   0   1/3    33.3     0/0   0.0
Lauri Carter           12    2    1    0   0   1/1   100.0     0/0   0.0
D'Angelo O'Neal        12    2    0    0   0   1/4    25.0     0/0   0.0
Josh Barrett            1    0    0    1   0   0/0     0.0     0/0   0.0

TEAM: FG: 10/17 (58.8%), 3PT: 2/4 (50.0%), REB: 13 (5 off, 8 def), AST: 3, TO: 5
TEAM FOULS: 4


Team_091
--------------------------------------------------------------------------------
Player                MIN  PTS  REB  AST  TO      FG   FG%      3P   3P%
--------------------------------------------------------------------------------
Kyrie Rozier           12    5    1    0   0   2/3    66.7     0/0   0.0
Rudy Bridges           12    4    5    3   0   2/4    50.0     0/0   0.0
Kevin Simons           12    4    6    0   0   2/3    66.7     0/0   0.0
Isaiah Siakam           9    2    0    0   0   1/2    50.0     0/0   0.0
Julius Barnes           3    2    0    0   0   1/2    50.0     0/0   0.0
D'Angelo Ingram        12    0    0    1   0   0/1     0.0     0/0   0.0
Zion Mitchell           1    0    0    0   0   0/1     0.0     0/0   0.0

TEAM: FG: 8/16 (50.0%), 3PT: 3/8 (37.5%), REB: 12 (5 off, 7 def), AST: 4, TO: 5
TEAM FOULS: 2

================================================================================

================================================================================
                       2ND QUARTER - Team_046 vs Team_091                       
================================================================================

[12:00] Team_046 possession (Score: 22-17)
Victor Nowitzki attempts a 3Pt. Contested by Isaiah Siakam (3.2 feet, MAN). VICTOR NOWITZKI MAKES IT! Assist: Kevin Allen
Score: 25-17

[11:43] Team_091 possession (Score: 25-17)
Rudy Bridges attempts a 3Pt. Wide open! D'Angelo O'Neal is 6.7 feet away. [ZONE] RUDY BRIDGES MAKES IT! Assist: Kevin Simons
Score: 25-20

[11:29] Team_046 possession (Score: 25-20)
FOUL! Shooting foul on Kevin Simons. Kevin Allen to the line for 2 free throws. [Team fouls: 1] (Kevin Simons: 1 personal fouls)   FT 1/2: GOOD   FT 2/2: GOOD Kevin Allen makes 2/2 from the line.
Score: 27-20

[11:16] Team_091 possession (Score: 27-20)
FOUL! Offensive foul on Kevin Simons! Kevin Allen drew the charge! [Team fouls: 2] (Kevin Simons: 2 personal fouls) TURNOVER! (dead ball)

[11:05] Team_046 possession (Score: 27-20)
D'Angelo O'Neal attempts a 3Pt. Wide open! Kyrie Rozier is 7.0 feet away. [ZONE] D'ANGELO O'NEAL MAKES IT! Assist: Cade Wall
Score: 30-20

[10:49] Team_091 possession (Score: 30-20)
Rudy Bridges attempts a Layup. BLOCKED BY D'ANGELO O'NEAL! Ball deflects out of bounds off Rudy Bridges.

[10:31] Team_046 possession (Score: 30-20)
D'Angelo O'Neal attempts a Midrange. Wide open! Kyrie Rozier is 8.9 feet away. [MAN] D'ANGELO O'NEAL MAKES IT! Assist: Cade Wall
Score: 32-20

[10:19] Team_091 possession (Score: 32-20)
Kyrie Rozier attempts a Midrange. Wide open! Victor Nowitzki is 6.1 feet away. [ZONE] KYRIE ROZIER MAKES IT!
Score: 32-22

[10:06] Team_046 possession (Score: 32-22)
D'Angelo O'Neal attempts a 3Pt. Wide open! Kyrie Rozier is 8.2 feet away. [MAN] D'Angelo O'Neal misses. Rebound secured by Kyrie Rozier.

[09:48] Team_091 possession (Score: 32-22)
FOUL! Reach-in foul on Kevin Allen during the drive. [Team fouls: 1] No free throws, side out. (Kevin Allen: 1 personal fouls)

[09:31] Team_091 possession (Score: 32-22)
Kevin Simons attempts a Layup. BLOCKED BY KEVIN ALLEN! Ball is loose! Rebound secured by Lauri Carter.

[09:17] Team_046 possession (Score: 32-22)
Kevin Allen drives, picks up Kevin Simons. Help arrives from Kyrie Rozier! Kevin Allen attempts a Layup. Heavily contested by Kyrie Rozier (1.1 feet, ZONE)! KEVIN ALLEN MAKES IT! Assist: Cade Wall
Score: 34-22

[09:04] Team_091 possession (Score: 34-22)
Kyrie Rozier attempts a 3Pt. Contested by D'Angelo O'Neal (4.9 feet, MAN). Kyrie Rozier misses. Rebound secured by Kevin Allen.

[08:50] Team_046 possession (Score: 34-22)
Lauri Carter attempts a 3Pt. Wide open! Kyrie Rozier is 6.3 feet away. [ZONE] LAURI CARTER MAKES IT! Assist: Cade Wall
Score: 37-22

[08:36] Team_091 possession (Score: 37-22)
D'Angelo Ingram attempts a Midrange. Wide open! Cade Wall is 9.0 feet away. [ZONE] D'Angelo Ingram misses. Rebound secured by Lauri Carter.

[08:25] Team_046 possession (Score: 37-22)
Cade Wall attempts a Midrange. Wide open! D'Angelo Ingram is 7.3 feet away. [MAN] CADE WALL MAKES IT!
Score: 39-22

[08:09] Team_091 possession (Score: 39-22)
Rudy Bridges drives, Kevin Allen stays with him. Rudy Bridges attempts a Layup. Contested by Kevin Allen (2.7 feet, ZONE). RUDY BRIDGES MAKES IT! Assist: Isaiah Siakam
Score: 39-24

[07:53] Team_046 possession (Score: 39-24)
Victor Nowitzki attempts a Layup. Contested by Isaiah Siakam (3.7 feet, MAN). VICTOR NOWITZKI MAKES IT! Assist: Kevin Allen
Score: 41-24

[07:38] Team_091 possession (Score: 41-24)
Kyrie Rozier throws a bad pass! Stolen by D'Angelo O'Neal! TURNOVER! (live ball)

[07:19] Team_046 possession (Score: 41-24)
FOUL! Reach-in foul on Kevin Simons during the drive. [Team fouls: 3] No free throws, side out. (Kevin Simons: 3 personal fouls)

[07:04] Team_046 possession (Score: 41-24)
Victor Nowitzki attempts a 3Pt. Wide open! Isaiah Siakam is 6.6 feet away. [MAN] VICTOR NOWITZKI MAKES IT! Assist: Lauri Carter
Score: 44-24

[06:49] Team_091 possession (Score: 44-24)
Isaiah Siakam attempts a Layup. Wide open! Victor Nowitzki is 9.0 feet away. [MAN] ISAIAH SIAKAM MAKES IT!
Score: 44-26

[06:37] Team_046 possession (Score: 44-26)
Kevin Allen attempts a Layup. BLOCKED BY KEVIN SIMONS! Ball deflects out of bounds off Kevin Allen.

[06:27] Team_091 possession (Score: 44-26)
Rudy Bridges attempts a Midrange. Contested by Victor Nowitzki (5.1 feet, ZONE). RUDY BRIDGES MAKES IT! Assist: Kevin Simons
Score: 44-28

[06:17] Team_046 possession (Score: 44-28)
Victor Nowitzki attempts a Layup. Heavily contested by D'Angelo Ingram (1.3 feet, ZONE)! Victor Nowitzki misses. Rebound secured by Kevin Simons.

[05:59] Team_091 possession (Score: 44-28)
Kyrie Rozier drives and kicks out. Rudy Bridges attempts a 3Pt. Wide open! Lauri Carter is 6.4 feet away. [ZONE] Rudy Bridges misses. Rebound secured by Cade Wall.

[05:46] Team_046 possession (Score: 44-28)
Cade Wall attempts a Midrange. Wide open! D'Angelo Ingram is 6.6 feet away. [MAN] Cade Wall misses. Rebound secured by Kevin Simons.

[05:29] Team_091 possession (Score: 44-28)
Kevin Simons throws a bad pass out of bounds! TURNOVER! (dead ball)

[05:29] Substitution (Team_046): D'Angelo O'Neal OUT → Collin Butler IN (stamina_rule2)

[05:29] Substitution (Team_046): Victor Nowitzki OUT → Manu Dosunmu IN (stamina_rule2)

[05:29] Substitution (Team_046): Lauri Carter OUT → Josh Barrett IN (stamina_rule2)

[05:29] Substitution (Team_046): Cade Wall OUT → Chris LaVine IN (stamina_rule2)

[05:29] Substitution (Team_046): Kevin Allen OUT → Paul DeRozan IN (stamina_rule2)

[05:29] Substitution (Team_091): Kyrie Rozier OUT → Karl Morant IN (stamina_rule2)

[05:29] Substitution (Team_091): Isaiah Siakam OUT → Julius Barnes IN (stamina_rule2)

[05:29] Substitution (Team_091): Rudy Bridges OUT → Tim Antetokounmpo IN (stamina_rule2)

[05:29] Substitution (Team_091): D'Angelo Ingram OUT → Zion Mitchell IN (stamina_rule2)

[05:29] Substitution (Team_091): Kevin Simons OUT → Ja George IN (stamina_rule2)

[05:16] Team_046 possession (Score: 44-28)
Paul DeRozan attempts a Layup. Contested by Zion Mitchell (5.2 feet, ZONE). Paul DeRozan misses. Rebound secured by Tim Antetokounmpo.

[05:01] Team_091 possession (Score: 44-28)
Tim Antetokounmpo makes the Layup and draws the foul on Manu Dosunmu! And-1! Tim Antetokounmpo to the line for 1. [Team fouls: 2] (Manu Dosunmu: 1 personal fouls)   FT 1/1: GOOD Tim Antetokounmpo makes 1/1 from the line.
Score: 44-31

[04:45] Team_046 possession (Score: 44-31)
Collin Butler attempts a Layup. BLOCKED BY KARL MORANT! Ball goes out off Karl Morant. Collin Butler's ball!

[04:30] Team_046 possession (Score: 44-31)
Manu Dosunmu makes the Midrange and draws the foul on Julius Barnes! And-1! Manu Dosunmu to the line for 1. [Team fouls: 4] (Julius Barnes: 1 personal fouls)   FT 1/1: GOOD Manu Dosunmu makes 1/1 from the line.
Score: 47-31

[04:13] Team_091 possession (Score: 47-31)
Ja George drives and kicks out. Zion Mitchell attempts a 3Pt. Contested by Josh Barrett (3.7 feet, ZONE). ZION MITCHELL MAKES IT! Assist: Tim Antetokounmpo
Score: 47-34

[03:56] Team_046 possession (Score: 47-34)
Paul DeRozan attempts a Midrange. Heavily contested by Ja George (1.8 feet, MAN)! Paul DeRozan misses. Rebound secured by Tim Antetokounmpo.

[03:40] Team_091 possession (Score: 47-34)
FOUL! Shooting foul on Collin Butler. Ja George to the line for 2 free throws. [Team fouls: 3] (Collin Butler: 1 personal fouls)   FT 1/2: GOOD   FT 2/2: GOOD Ja George makes 2/2 from the line.
Score: 47-36

[03:30] Team_046 possession (Score: 47-36)
FOUL! Holding foul on Ja George. [IN THE BONUS! 5 team fouls] Paul DeRozan to the line for 2 free throws. (Ja George: 1 personal fouls)   FT 1/2: MISS   FT 2/2: GOOD Paul DeRozan makes 1/2 from the line.
Score: 48-36

[03:13] Team_091 possession (Score: 48-36)
Julius Barnes commits a violation (traveling/carry)! TURNOVER! (dead ball)

[03:00] Team_046 possession (Score: 48-36)
Paul DeRozan drives to the basket... Paul DeRozan throws a bad pass out of bounds! TURNOVER! (dead ball)

[02:43] Team_091 possession (Score: 48-36)
Ja George attempts a Midrange. Contested by Chris LaVine (5.2 feet, MAN). Ja George misses. Rebound secured by Paul DeRozan.

[02:27] Team_046 possession (Score: 48-36)
Paul DeRozan attempts a Midrange. Wide open! Tim Antetokounmpo is 7.0 feet away. [ZONE] Paul DeRozan misses. Offensive rebound by Paul DeRozan! Paul DeRozan puts it back in!
Score: 50-36

[02:11] Team_091 possession (Score: 50-36)
Zion Mitchell attempts a Midrange. Wide open! Paul DeRozan is 7.1 feet away. [ZONE] Zion Mitchell misses. Offensive rebound by Zion Mitchell! Zion Mitchell kicks it out.

[02:00] Team_091 possession (Score: 50-36)
Julius Barnes attempts a Midrange. Contested by Manu Dosunmu (3.3 feet, MAN). Julius Barnes misses. Rebound secured by Manu Dosunmu.

[01:44] Team_046 possession (Score: 50-36)
Josh Barrett attempts a Midrange. Contested by Tim Antetokounmpo (4.1 feet, ZONE). Josh Barrett misses. Rebound secured by Tim Antetokounmpo.

[01:33] Team_091 possession (Score: 50-36)
Zion Mitchell drives and kicks out. Tim Antetokounmpo attempts a 3Pt. Heavily contested by Collin Butler (1.7 feet, ZONE)! Tim Antetokounmpo misses. Rebound secured by Chris LaVine.

[01:18] Team_046 possession (Score: 50-36)
Paul DeRozan drives, picks up Zion Mitchell. Help arrives from Karl Morant! Paul DeRozan attempts a Layup. Contested by Karl Morant (2.2 feet, ZONE). PAUL DEROZAN MAKES IT!
Score: 52-36

[01:06] Team_091 possession (Score: 52-36)
Julius Barnes drives, Chris LaVine stays with him. Julius Barnes attempts a Layup. Heavily contested by Chris LaVine (0.5 feet, ZONE)! Julius Barnes misses. Rebound secured by Manu Dosunmu.

[00:52] Team_046 possession (Score: 52-36)
Josh Barrett attempts a 3Pt. Wide open! Karl Morant is 6.8 feet away. [ZONE] Josh Barrett misses. Rebound secured by Tim Antetokounmpo.

[00:36] Team_091 possession (Score: 52-36)
Tim Antetokounmpo attempts a 3Pt. Contested by Josh Barrett (4.9 feet, MAN). TIM ANTETOKOUNMPO MAKES IT! Assist: Zion Mitchell
Score: 52-39

[00:24] Team_046 possession (Score: 52-39)
Collin Butler drives to the basket... Collin Butler throws a bad pass out of bounds! TURNOVER! (dead ball)

[00:13] Team_091 possession (Score: 52-39)
Karl Morant throws a bad pass! Stolen by Collin Butler! TURNOVER! (live ball)

================================================================================
                              2ND QUARTER COMPLETE                              
================================================================================

2ND QUARTER SCORE: Team_046 30, Team_091 22

BOX SCORE:
================================================================================

Team_046
--------------------------------------------------------------------------------
Player                MIN  PTS  REB  AST  TO      FG   FG%      3P   3P%
--------------------------------------------------------------------------------
Victor Nowitzki        18    8    0    0   0   3/4    75.0     0/0   0.0
D'Angelo O'Neal        18    5    0    0   0   2/3    66.7     0/0   0.0
Paul DeRozan            9    5    2    0   0   3/5    60.0     0/0   0.0
Kevin Allen            16    4    1    2   0   2/3    66.7     0/0   0.0
Lauri Carter           18    3    2    1   0   1/1   100.0     0/0   0.0
Manu Dosunmu            6    3    2    0   0   1/1   100.0     0/0   0.0
Cade Wall              18    2    1    4   0   1/2    50.0     0/0   0.0
Josh Barrett            6    0    0    0   0   0/2     0.0     0/0   0.0
Chris LaVine            6    0    1    0   0   0/0     0.0     0/0   0.0

TEAM: FG: 13/21 (61.9%), 3PT: 4/6 (66.7%), REB: 9 (1 off, 8 def), AST: 7, TO: 2
TEAM FOULS: 3


Team_091
--------------------------------------------------------------------------------
Player                MIN  PTS  REB  AST  TO      FG   FG%      3P   3P%
--------------------------------------------------------------------------------
Rudy Bridges           18    7    0    0   0   3/4    75.0     0/0   0.0
Tim Antetokounmpo       6    6    4    1   0   2/2   100.0     0/0   0.0
Zion Mitchell           6    3    1    1   0   1/2    50.0     0/0   0.0
Kyrie Rozier           18    2    1    0   0   1/3    33.3     0/0   0.0
Isaiah Siakam          16    2    0    1   0   1/1   100.0     0/0   0.0
Ja George               6    2    0    0   0   1/2    50.0     0/0   0.0
Kevin Simons           18    0    2    2   0   0/1     0.0     0/0   0.0
D'Angelo Ingram        18    0    0    0   0   0/1     0.0     0/0   0.0
Julius Barnes           9    0    0    0   0   0/2     0.0     0/0   0.0

TEAM: FG: 9/18 (50.0%), 3PT: 2/3 (66.7%), REB: 8 (1 off, 7 def), AST: 5, TO: 5
TEAM FOULS: 5 [Team_046 in BONUS]

================================================================================

================================================================================
                       3RD QUARTER - Team_046 vs Team_091                       
================================================================================

[12:00] Team_046 possession (Score: 52-39)
Lauri Carter attempts a 3Pt. Contested by Rudy Bridges (2.8 feet, MAN). LAURI CARTER MAKES IT! Assist: Cade Wall
Score: 55-39

[11:48] Team_091 possession (Score: 55-39)
Kevin Simons attempts a 3Pt. Contested by Lauri Carter (3.5 feet, ZONE). Kevin Simons misses. Rebound secured by Cade Wall.

[11:34] Team_046 possession (Score: 55-39)
Lauri Carter attempts a 3Pt. Contested by Kyrie Rozier (3.5 feet, ZONE). Lauri Carter misses. Rebound secured by Rudy Bridges.

[11:20] Team_091 possession (Score: 55-39)
Kyrie Rozier attempts a 3Pt. Wide open! D'Angelo O'Neal is 6.0 feet away. [MAN] Kyrie Rozier misses. Rebound secured by Lauri Carter.

[11:02] Team_046 possession (Score: 55-39)
Cade Wall attempts a Layup. Wide open! D'Angelo Ingram is 6.4 feet away. [MAN] CADE WALL MAKES IT! Assist: Kevin Allen
Score: 57-39

[10:50] Team_091 possession (Score: 57-39)
Kevin Simons drives to the basket... FOUL! Offensive foul on Kevin Simons! Kevin Allen drew the charge! [Team fouls: 1] (Kevin Simons: 1 personal fouls) TURNOVER! (dead ball)

[10:35] Team_046 possession (Score: 57-39)
Cade Wall attempts a 3Pt. Contested by D'Angelo Ingram (4.5 feet, MAN). Cade Wall misses. Rebound secured by Kevin Simons.

[10:19] Team_091 possession (Score: 57-39)
Kyrie Rozier attempts a 3Pt. Contested by D'Angelo O'Neal (5.3 feet, MAN). Kyrie Rozier misses. Rebound secured by Kevin Allen.

[10:02] Team_046 possession (Score: 57-39)
Kevin Allen makes the Dunk and draws the foul on Kyrie Rozier! And-1! Kevin Allen to the line for 1. [Team fouls: 2] (Kyrie Rozier: 1 personal fouls)   FT 1/1: GOOD Kevin Allen makes 1/1 from the line.
Score: 60-39

[09:48] Team_091 possession (Score: 60-39)
FOUL! Holding foul on D'Angelo O'Neal. [Team fouls: 1] No free throws, side out. (D'Angelo O'Neal: 1 personal fouls)

[09:35] Team_091 possession (Score: 60-39)
Rudy Bridges attempts a 3Pt. Contested by Lauri Carter (2.8 feet, ZONE). Rudy Bridges misses. FOUL! Loose ball foul on Lauri Carter during the rebound battle. [Team fouls: 2] No free throws, side out. (Lauri Carter: 1 personal fouls)

[09:16] Team_091 possession (Score: 60-39)
Isaiah Siakam makes the Layup and draws the foul on D'Angelo O'Neal! And-1! Isaiah Siakam to the line for 1. [Team fouls: 3] (D'Angelo O'Neal: 2 personal fouls)   FT 1/1: GOOD Isaiah Siakam makes 1/1 from the line.
Score: 60-42

[09:03] Team_046 possession (Score: 60-42)
D'Angelo O'Neal attempts a Midrange. Contested by Kyrie Rozier (5.0 feet, MAN). D'ANGELO O'NEAL MAKES IT! Assist: Victor Nowitzki
Score: 62-42

[08:50] Team_091 possession (Score: 62-42)
Isaiah Siakam attempts a Midrange. Wide open! Victor Nowitzki is 6.7 feet away. [MAN] ISAIAH SIAKAM MAKES IT!
Score: 62-44

[08:35] Team_046 possession (Score: 62-44)
Kevin Allen attempts a Midrange. Contested by Kevin Simons (2.4 feet, ZONE). Kevin Allen misses. Rebound secured by Kevin Simons.

[08:19] Team_091 possession (Score: 62-44)
Rudy Bridges makes the Layup and draws the foul on D'Angelo O'Neal! And-1! Rudy Bridges to the line for 1. [Team fouls: 4] (D'Angelo O'Neal: 3 personal fouls)   FT 1/1: GOOD Rudy Bridges makes 1/1 from the line.
Score: 62-47

[08:01] Team_046 possession (Score: 62-47)
Cade Wall attempts a 3Pt. Contested by D'Angelo Ingram (3.6 feet, MAN). CADE WALL MAKES IT! Assist: Lauri Carter
Score: 65-47

[07:48] Team_091 possession (Score: 65-47)
Rudy Bridges drives and kicks out. FOUL! Shooting foul on Cade Wall. Kyrie Rozier to the line for 2 free throws. [BONUS: 5 team fouls] (Cade Wall: 1 personal fouls)   FT 1/2: GOOD   FT 2/2: GOOD Kyrie Rozier makes 2/2 from the line.
Score: 65-49

[07:34] Team_046 possession (Score: 65-49)
Victor Nowitzki attempts a Midrange. Contested by Isaiah Siakam (4.9 feet, MAN). VICTOR NOWITZKI MAKES IT!
Score: 67-49

[07:16] Team_091 possession (Score: 67-49)
D'Angelo Ingram drives and kicks out. FOUL! Shooting foul on Lauri Carter. Isaiah Siakam to the line for 3 free throws. [BONUS: 6 team fouls] (Lauri Carter: 2 personal fouls)   FT 1/3: MISS   FT 2/3: GOOD   FT 3/3: GOOD Isaiah Siakam makes 2/3 from the line.
Score: 67-51

[06:58] Team_046 possession (Score: 67-51)
D'Angelo O'Neal attempts a 3Pt. Contested by Kyrie Rozier (4.9 feet, ZONE). D'ANGELO O'NEAL MAKES IT! Assist: Lauri Carter
Score: 70-51

[06:45] Team_091 possession (Score: 70-51)
Kyrie Rozier attempts a Midrange. Contested by D'Angelo O'Neal (3.7 feet, MAN). Kyrie Rozier misses. Rebound secured by Kevin Allen.

[06:29] Team_046 possession (Score: 70-51)
Lauri Carter attempts a Layup. BLOCKED BY KYRIE ROZIER! Ball is loose! Rebound secured by Kevin Simons.

[06:17] Team_091 possession (Score: 70-51)
D'Angelo Ingram drives and kicks out. D'Angelo Ingram attempts a 3Pt. Heavily contested by Lauri Carter (1.3 feet, ZONE)! D'ANGELO INGRAM MAKES IT! Assist: Kyrie Rozier
Score: 70-54

[06:02] Team_046 possession (Score: 70-54)
Lauri Carter attempts a 3Pt. Heavily contested by Kyrie Rozier (0.6 feet, ZONE)! Lauri Carter misses. Rebound secured by Kyrie Rozier.

[05:47] Team_091 possession (Score: 70-54)
Kyrie Rozier attempts a 3Pt. Contested by Lauri Carter (4.4 feet, ZONE). Kyrie Rozier misses. Rebound secured by Lauri Carter.

[05:33] Team_046 possession (Score: 70-54)
Victor Nowitzki drives, picks up Isaiah Siakam. Help arrives from Rudy Bridges! Victor Nowitzki attempts a Dunk. Wide open! Rudy Bridges is 6.2 feet away. [MAN] VICTOR NOWITZKI MAKES IT! Assist: Lauri Carter
Score: 72-54

[05:15] Team_091 possession (Score: 72-54)
Kyrie Rozier attempts a Layup. Heavily contested by Kevin Allen (0.5 feet, ZONE)! KYRIE ROZIER MAKES IT!
Score: 72-56

[05:01] Team_046 possession (Score: 72-56)
Lauri Carter attempts a 3Pt. Contested by Isaiah Siakam (5.1 feet, ZONE). Lauri Carter misses. Rebound secured by Kevin Simons.

[04:47] Team_091 possession (Score: 72-56)
Isaiah Siakam attempts a Layup. Heavily contested by Kevin Allen (1.5 feet, ZONE)! ISAIAH SIAKAM MAKES IT! Assist: D'Angelo Ingram
Score: 72-58

[04:31] Team_046 possession (Score: 72-58)
Kevin Allen attempts a 3Pt. Wide open! Kyrie Rozier is 6.7 feet away. [ZONE] Kevin Allen misses. Rebound secured by Kyrie Rozier.

[04:13] Team_091 possession (Score: 72-58)
Rudy Bridges attempts a 3Pt. Contested by Lauri Carter (4.5 feet, ZONE). Rudy Bridges misses. Offensive rebound by Kevin Simons! Kevin Simons's putback is no good. Rebound secured by Cade Wall.

[03:58] Team_046 possession (Score: 72-58)
Victor Nowitzki attempts a 3Pt. Wide open! Isaiah Siakam is 6.4 feet away. [MAN] VICTOR NOWITZKI MAKES IT! Assist: Lauri Carter
Score: 75-58

[03:43] Team_091 possession (Score: 75-58)
Kyrie Rozier attempts a 3Pt. Contested by Lauri Carter (4.9 feet, ZONE). Kyrie Rozier misses. Rebound secured by Lauri Carter.

[03:28] Team_046 possession (Score: 75-58)
Lauri Carter attempts a 3Pt. Wide open! Kyrie Rozier is 7.0 feet away. [ZONE] LAURI CARTER MAKES IT!
Score: 78-58

[03:13] Team_091 possession (Score: 78-58)
D'Angelo Ingram attempts a Midrange. Contested by Cade Wall (4.7 feet, MAN). D'Angelo Ingram misses. Offensive rebound by Kevin Simons! Kevin Simons puts it back in!
Score: 78-60

[02:59] Team_046 possession (Score: 78-60)
Kevin Allen attempts a Midrange. Contested by Rudy Bridges (5.7 feet, ZONE). KEVIN ALLEN MAKES IT!
Score: 80-60

[02:40] Team_091 possession (Score: 80-60)
FOUL! Shooting foul on Lauri Carter. Rudy Bridges to the line for 2 free throws. [BONUS: 7 team fouls] (Lauri Carter: 3 personal fouls)   FT 1/2: MISS   FT 2/2: GOOD Rudy Bridges makes 1/2 from the line.
Score: 80-61

[02:21] Team_046 possession (Score: 80-61)
Cade Wall attempts a Midrange. Wide open! D'Angelo Ingram is 8.1 feet away. [MAN] Cade Wall misses. Rebound secured by Kyrie Rozier.

[02:05] Team_091 possession (Score: 80-61)
Rudy Bridges makes the Layup and draws the foul on Lauri Carter! And-1! Rudy Bridges to the line for 1. [BONUS: 8 team fouls] (Lauri Carter: 4 personal fouls)   FT 1/1: GOOD Rudy Bridges makes 1/1 from the line.
Score: 80-64

[01:49] Team_046 possession (Score: 80-64)
Kevin Allen throws a bad pass out of bounds! TURNOVER! (dead ball)

[01:49] Substitution (Team_046): D'Angelo O'Neal OUT → Collin Butler IN (stamina_rule2)

[01:49] Substitution (Team_046): Victor Nowitzki OUT → Manu Dosunmu IN (stamina_rule2)

[01:49] Substitution (Team_046): Lauri Carter OUT → Josh Barrett IN (stamina_rule2)

[01:49] Substitution (Team_046): Cade Wall OUT → Chris LaVine IN (stamina_rule2)

[01:49] Substitution (Team_046): Kevin Allen OUT → Paul DeRozan IN (stamina_rule2)

[01:49] Substitution (Team_091): Isaiah Siakam OUT → Julius Barnes IN (stamina_rule2)

[01:49] Substitution (Team_091): D'Angelo Ingram OUT → Zion Mitchell IN (stamina_rule2)

[01:49] Substitution (Team_091): Kevin Simons OUT → Ja George IN (stamina_rule2)

[01:32] Team_091 possession (Score: 80-64)
Ja George drives to the basket... Ja George throws a bad pass out of bounds! TURNOVER! (dead ball)

[01:15] Team_046 possession (Score: 80-64)
FOUL! Offensive foul on Manu Dosunmu! Julius Barnes drew the charge! [Team fouls: 9] (Manu Dosunmu: 1 personal fouls) TURNOVER! (dead ball)

[00:58] Team_091 possession (Score: 80-64)
FOUL! Reach-in foul on Chris LaVine during the drive. [IN THE BONUS! 10 team fouls] Rudy Bridges to the line for 2 free throws. (Chris LaVine: 1 personal fouls)   FT 1/2: GOOD   FT 2/2: MISS Rudy Bridges makes 1/2 from the line. Rebound secured by Manu Dosunmu.
Score: 80-65

[00:40] Team_046 possession (Score: 80-65)
Chris LaVine loses the ball! Stripped by Zion Mitchell! TURNOVER! (live ball)

[00:24] Team_091 possession (Score: 80-65)
FOUL! Holding foul on Chris LaVine. [IN THE BONUS! 11 team fouls] Ja George to the line for 2 free throws. (Chris LaVine: 2 personal fouls)   FT 1/2: GOOD   FT 2/2: MISS Ja George makes 1/2 from the line. Offensive rebound by Zion Mitchell! Zion Mitchell kicks it out.
Score: 80-66

[00:10] Team_091 possession (Score: 80-66)
Kyrie Rozier attempts a 3Pt. Contested by Collin Butler (3.4 feet, ZONE). Kyrie Rozier misses. Offensive rebound by Zion Mitchell! Zion Mitchell kicks it out.

================================================================================
                              3RD QUARTER COMPLETE                              
================================================================================

3RD QUARTER SCORE: Team_046 28, Team_091 27

BOX SCORE:
================================================================================

Team_046
--------------------------------------------------------------------------------
Player                MIN  PTS  REB  AST  TO      FG   FG%      3P   3P%
--------------------------------------------------------------------------------
Victor Nowitzki        29    7    0    1   0   3/3   100.0     0/0   0.0
Lauri Carter           29    6    3    4   0   2/6    33.3     0/0   0.0
Cade Wall              29    5    2    1   0   2/4    50.0     0/0   0.0
Kevin Allen            26    5    2    1   0   2/4    50.0     0/0   0.0
D'Angelo O'Neal        29    5    0    0   0   2/2   100.0     0/0   0.0
Manu Dosunmu            7    0    1    0   0   0/0     0.0     0/0   0.0

TEAM: FG: 11/19 (57.9%), 3PT: 5/10 (50.0%), REB: 7 (0 off, 7 def), AST: 7, TO: 3
TEAM FOULS: 11 [Team_091 in BONUS]


Team_091
--------------------------------------------------------------------------------
Player                MIN  PTS  REB  AST  TO      FG   FG%      3P   3P%
--------------------------------------------------------------------------------
Isaiah Siakam          26    9    0    0   0   4/4   100.0     0/0   0.0
Rudy Bridges           31    7    2    0   0   3/5    60.0     0/0   0.0
Kyrie Rozier           31    4    3    1   0   2/7    28.6     0/0   0.0
D'Angelo Ingram        29    3    0    1   0   1/1   100.0     0/0   0.0
Kevin Simons           29    2    5    0   0   1/2    50.0     0/0   0.0
Zion Mitchell           7    0    2    0   0   0/0     0.0     0/0   0.0

TEAM: FG: 11/19 (57.9%), 3PT: 0/6 (0.0%), REB: 13 (5 off, 8 def), AST: 2, TO: 2
TEAM FOULS: 2

================================================================================

================================================================================
                       4TH QUARTER - Team_046 vs Team_091                       
================================================================================

[12:00] Team_046 possession (Score: 80-66)
D'Angelo O'Neal drives and kicks out. D'Angelo O'Neal attempts a Midrange. Contested by Kevin Simons (3.5 feet, ZONE). D'ANGELO O'NEAL MAKES IT! Assist: Kevin Allen
Score: 82-66

[11:45] Team_091 possession (Score: 82-66)
FOUL! Shooting foul on Kevin Allen. D'Angelo Ingram to the line for 2 free throws. [Team fouls: 1] (Kevin Allen: 1 personal fouls)   FT 1/2: MISS   FT 2/2: MISS D'Angelo Ingram makes 0/2 from the line. Rebound secured by Lauri Carter.

[11:30] Team_046 possession (Score: 82-66)
Kevin Allen attempts a Layup. BLOCKED BY KEVIN SIMONS! Ball is loose! Rebound secured by Kevin Simons.

[11:14] Team_091 possession (Score: 82-66)
Kyrie Rozier drives, picks up D'Angelo O'Neal. Help arrives from Lauri Carter! Kyrie Rozier attempts a Layup. Contested by Lauri Carter (3.6 feet, MAN). KYRIE ROZIER MAKES IT!
Score: 82-68

[11:01] Team_046 possession (Score: 82-68)
Cade Wall drives to the basket... Cade Wall commits a violation (traveling/carry)! TURNOVER! (dead ball)

[11:01] Substitution (Team_091): Kyrie Rozier OUT → Karl Morant IN (stamina_rule2)

[11:01] Substitution (Team_091): Rudy Bridges OUT → Tim Antetokounmpo IN (stamina_rule2)

[10:45] Team_091 possession (Score: 82-68)
D'Angelo Ingram drives to the basket... D'Angelo Ingram throws a bad pass! Stolen by Cade Wall! TURNOVER! (live ball)

[10:32] Team_046 possession (Score: 82-68)
FOUL! Holding foul on Kevin Simons. [Team fouls: 1] No free throws, side out. (Kevin Simons: 1 personal fouls)

[10:20] Team_046 possession (Score: 82-68)
Victor Nowitzki attempts a 3Pt. Contested by Isaiah Siakam (4.0 feet, MAN). VICTOR NOWITZKI MAKES IT! Assist: Kevin Allen
Score: 85-68

[10:06] Team_091 possession (Score: 85-68)
FOUL! Shooting foul on D'Angelo O'Neal. Isaiah Siakam to the line for 3 free throws. [Team fouls: 2] (D'Angelo O'Neal: 1 personal fouls)   FT 1/3: GOOD   FT 2/3: GOOD   FT 3/3: MISS Isaiah Siakam makes 2/3 from the line. Rebound secured by Cade Wall.
Score: 85-70

[09:52] Team_046 possession (Score: 85-70)
Cade Wall attempts a Midrange. Wide open! D'Angelo Ingram is 6.2 feet away. [ZONE] Cade Wall misses. Rebound secured by Tim Antetokounmpo.

[09:34] Team_091 possession (Score: 85-70)
D'Angelo Ingram attempts a 3Pt. Contested by Victor Nowitzki (5.9 feet, ZONE). D'Angelo Ingram misses. Rebound secured by Cade Wall.

[09:17] Team_046 possession (Score: 85-70)
Lauri Carter attempts a 3Pt. Contested by Karl Morant (4.8 feet, ZONE). Lauri Carter misses. Rebound secured by Kevin Simons.

[09:02] Team_091 possession (Score: 85-70)
D'Angelo Ingram attempts a Layup. Contested by Kevin Allen (5.9 feet, ZONE). D'ANGELO INGRAM MAKES IT!
Score: 85-72

[08:48] Team_046 possession (Score: 85-72)
Kevin Allen loses the ball! Stripped by Kevin Simons! TURNOVER! (live ball)

[08:36] Team_091 possession (Score: 85-72)
Tim Antetokounmpo drives to the basket... Tim Antetokounmpo loses the ball! Stripped by Kevin Allen! TURNOVER! (live ball)

[08:22] Team_046 possession (Score: 85-72)
FOUL! Shooting foul on Tim Antetokounmpo. Lauri Carter to the line for 2 free throws. [Team fouls: 2] (Tim Antetokounmpo: 1 personal fouls)   FT 1/2: MISS   FT 2/2: GOOD Lauri Carter makes 1/2 from the line.
Score: 86-72

[08:09] Team_091 possession (Score: 86-72)
D'Angelo Ingram attempts a Layup. BLOCKED BY CADE WALL! Ball is loose! Offensive rebound by Tim Antetokounmpo! Tim Antetokounmpo kicks it out.

[07:57] Team_091 possession (Score: 86-72)
Karl Morant makes the Dunk and draws the foul on Lauri Carter! And-1! Karl Morant to the line for 1. [Team fouls: 4] (Lauri Carter: 1 personal fouls)   FT 1/1: GOOD Karl Morant makes 1/1 from the line.
Score: 86-75

[07:43] Team_046 possession (Score: 86-75)
D'Angelo O'Neal attempts a 3Pt. Contested by Karl Morant (3.2 feet, MAN). D'Angelo O'Neal misses. Offensive rebound by Lauri Carter! Lauri Carter kicks it out.

[07:29] Team_046 possession (Score: 86-75)
D'Angelo O'Neal loses the ball! Stripped by Karl Morant! TURNOVER! (live ball)

[07:14] Team_091 possession (Score: 86-75)
Kevin Simons drives, Kevin Allen stays with him. Kevin Simons attempts a Dunk. Wide open! Kevin Allen is 6.0 feet away. [MAN] Kevin Simons misses. Rebound secured by Lauri Carter.

[07:01] Team_046 possession (Score: 86-75)
Lauri Carter attempts a 3Pt. Contested by Tim Antetokounmpo (5.1 feet, MAN). Lauri Carter misses. Rebound secured by Kevin Simons.

[06:48] Team_091 possession (Score: 86-75)
Isaiah Siakam attempts a 3Pt. Contested by Lauri Carter (5.7 feet, ZONE). Isaiah Siakam misses. Rebound secured by Cade Wall.

[06:34] Team_046 possession (Score: 86-75)
Victor Nowitzki attempts a 3Pt. Wide open! Isaiah Siakam is 7.4 feet away. [MAN] Victor Nowitzki misses. Rebound secured by Tim Antetokounmpo.

[06:19] Team_091 possession (Score: 86-75)
Kevin Simons makes the Layup and draws the foul on Kevin Allen! And-1! Kevin Simons to the line for 1. [BONUS: 5 team fouls] (Kevin Allen: 3 personal fouls)   FT 1/1: GOOD Kevin Simons makes 1/1 from the line.
Score: 86-78

[06:03] Team_046 possession (Score: 86-78)
Lauri Carter loses control! Ball rolls out of bounds! TURNOVER! (dead ball)

[06:03] Substitution (Team_046): D'Angelo O'Neal OUT → Collin Butler IN (stamina_rule2)

[06:03] Substitution (Team_046): Victor Nowitzki OUT → Manu Dosunmu IN (stamina_rule2)

[06:03] Substitution (Team_046): Lauri Carter OUT → Josh Barrett IN (stamina_rule2)

[06:03] Substitution (Team_046): Cade Wall OUT → Chris LaVine IN (stamina_rule2)

[06:03] Substitution (Team_046): Kevin Allen OUT → Paul DeRozan IN (stamina_rule2)

[06:03] Substitution (Team_091): Isaiah Siakam OUT → Julius Barnes IN (stamina_rule2)

[06:03] Substitution (Team_091): D'Angelo Ingram OUT → Zion Mitchell IN (stamina_rule2)

[06:03] Substitution (Team_091): Kevin Simons OUT → Ja George IN (stamina_rule2)

[05:51] Team_091 possession (Score: 86-78)
Ja George drives and kicks out. Julius Barnes makes the Midrange and draws the foul on Chris LaVine! And-1! Julius Barnes to the line for 1. [BONUS: 6 team fouls] (Chris LaVine: 1 personal fouls)   FT 1/1: GOOD Julius Barnes makes 1/1 from the line.
Score: 86-81

[05:41] Team_046 possession (Score: 86-81)
Paul DeRozan drives to the basket... FOUL! Offensive foul on Paul DeRozan! Ja George drew the charge! [Team fouls: 7] (Paul DeRozan: 1 personal fouls) TURNOVER! (dead ball)

[05:27] Team_091 possession (Score: 86-81)
Tim Antetokounmpo attempts a 3Pt. Contested by Josh Barrett (5.7 feet, MAN). Tim Antetokounmpo misses. Rebound secured by Paul DeRozan.

[05:14] Team_046 possession (Score: 86-81)
Josh Barrett attempts a Midrange. Contested by Tim Antetokounmpo (5.5 feet, ZONE). JOSH BARRETT MAKES IT! Assist: Paul DeRozan
Score: 88-81

[05:04] Team_091 possession (Score: 88-81)
Ja George attempts a Midrange. Contested by Chris LaVine (4.9 feet, MAN). JA GEORGE MAKES IT!
Score: 88-83

[04:52] Team_046 possession (Score: 88-83)
Chris LaVine attempts a Layup. BLOCKED BY ZION MITCHELL! Ball is loose! Offensive rebound by Paul DeRozan! Paul DeRozan kicks it out.

[04:38] Team_046 possession (Score: 88-83)
Chris LaVine attempts a 3Pt. Wide open! Karl Morant is 6.5 feet away. [ZONE] Chris LaVine misses. Rebound secured by Zion Mitchell.

[04:25] Team_091 possession (Score: 88-83)
FOUL! Offensive foul on Julius Barnes! Manu Dosunmu drew the charge! [Team fouls: 4] (Julius Barnes: 1 personal fouls) TURNOVER! (dead ball)

[04:09] Team_046 possession (Score: 88-83)
Manu Dosunmu attempts a Midrange. Wide open! Zion Mitchell is 7.0 feet away. [ZONE] Manu Dosunmu misses. Rebound secured by Ja George.

[03:54] Team_091 possession (Score: 88-83)
Ja George attempts a Midrange. Contested by Chris LaVine (2.7 feet, ZONE). Ja George misses. Offensive rebound by Ja George! Ja George kicks it out.

[03:37] Team_091 possession (Score: 88-83)
Julius Barnes attempts a 3Pt. Heavily contested by Collin Butler (1.3 feet, ZONE)! JULIUS BARNES MAKES IT! Assist: Zion Mitchell
Score: 88-86

[03:24] Team_046 possession (Score: 88-86)
Collin Butler attempts a Midrange. Wide open! Karl Morant is 6.4 feet away. [MAN] COLLIN BUTLER MAKES IT! Assist: Josh Barrett
Score: 90-86

[03:09] Team_091 possession (Score: 90-86)
FOUL! Shooting foul on Chris LaVine. Ja George to the line for 2 free throws. [BONUS: 8 team fouls] (Chris LaVine: 2 personal fouls)   FT 1/2: GOOD   FT 2/2: GOOD Ja George makes 2/2 from the line.
Score: 90-88

[02:53] Team_046 possession (Score: 90-88)
Josh Barrett attempts a Midrange. Wide open! Tim Antetokounmpo is 6.1 feet away. [ZONE] JOSH BARRETT MAKES IT!
Score: 92-88

[02:39] Team_091 possession (Score: 92-88)
Tim Antetokounmpo attempts a Layup. Heavily contested by Josh Barrett (0.9 feet, MAN)! Tim Antetokounmpo misses. Rebound secured by Paul DeRozan.

[02:24] Team_046 possession (Score: 92-88)
Manu Dosunmu drives and kicks out. Collin Butler makes the Midrange and draws the foul on Karl Morant! And-1! Collin Butler to the line for 1. [BONUS: 5 team fouls] (Karl Morant: 1 personal fouls)   FT 1/1: MISS Collin Butler makes 0/1 from the line. Offensive rebound by Chris LaVine! Chris LaVine kicks it out.
Score: 94-88

[02:11] Team_046 possession (Score: 94-88)
Paul DeRozan drives and kicks out. Manu Dosunmu attempts a 3Pt. Wide open! Karl Morant is 6.8 feet away. [ZONE] MANU DOSUNMU MAKES IT! Assist: Paul DeRozan
Score: 97-88

[01:54] Team_091 possession (Score: 97-88)
Tim Antetokounmpo attempts a 3Pt. Contested by Collin Butler (4.0 feet, ZONE). Tim Antetokounmpo misses. Rebound secured by Chris LaVine.

[01:41] Team_046 possession (Score: 97-88)
Chris LaVine attempts a 3Pt. Wide open! Karl Morant is 6.5 feet away. [ZONE] CHRIS LAVINE MAKES IT! Assist: Josh Barrett
Score: 100-88

[01:25] Team_091 possession (Score: 100-88)
Tim Antetokounmpo drives and kicks out. Zion Mitchell attempts a Midrange. Heavily contested by Chris LaVine (1.7 feet, MAN)! Zion Mitchell misses. Rebound secured by Manu Dosunmu.

[01:13] Team_046 possession (Score: 100-88)
FOUL! Reach-in foul on Julius Barnes during the drive. [IN THE BONUS! 6 team fouls] Manu Dosunmu to the line for 2 free throws. (Julius Barnes: 2 personal fouls)   FT 1/2: MISS   FT 2/2: MISS Manu Dosunmu makes 0/2 from the line. Rebound secured by Tim Antetokounmpo.

[00:56] Team_091 possession (Score: 100-88)
Ja George attempts a Midrange. Contested by Chris LaVine (4.3 feet, MAN). JA GEORGE MAKES IT!
Score: 100-90

[00:41] Team_046 possession (Score: 100-90)
Josh Barrett drives, picks up Tim Antetokounmpo. Help arrives from Julius Barnes! Josh Barrett attempts a Layup. Contested by Julius Barnes (5.9 feet, MAN). JOSH BARRETT MAKES IT!
Score: 102-90

[00:26] Team_091 possession (Score: 102-90)
Karl Morant attempts a 3Pt. Contested by Collin Butler (3.3 feet, ZONE). Karl Morant misses. Rebound secured by Manu Dosunmu.

[00:08] Team_046 possession (Score: 102-90)
Collin Butler makes the Dunk and draws the foul on Julius Barnes! And-1! Collin Butler to the line for 1. [BONUS: 7 team fouls] (Julius Barnes: 3 personal fouls)   FT 1/1: GOOD Collin Butler makes 1/1 from the line.
Score: 105-90

================================================================================
                              4TH QUARTER COMPLETE                              
================================================================================

4TH QUARTER SCORE: Team_046 25, Team_091 24

BOX SCORE:
================================================================================

Team_046
--------------------------------------------------------------------------------
Player                MIN  PTS  REB  AST  TO      FG   FG%      3P   3P%
--------------------------------------------------------------------------------
Josh Barrett           13    6    0    2   0   3/3   100.0     0/0   0.0
Collin Butler          13    5    0    0   0   2/2   100.0     0/0   0.0
Victor Nowitzki        35    3    0    0   0   1/2    50.0     0/0   0.0
Chris LaVine           13    3    2    0   0   1/2    50.0     0/0   0.0
Manu Dosunmu           13    3    2    0   0   1/3    33.3     0/0   0.0
D'Angelo O'Neal        35    2    0    0   0   1/1   100.0     0/0   0.0
Lauri Carter           35    1    3    0   0   1/3    33.3     0/0   0.0
Kevin Allen            32    0    0    2   0   0/1     0.0     0/0   0.0
Cade Wall              35    0    3    0   0   0/1     0.0     0/0   0.0
Paul DeRozan           16    0    3    2   0   0/0     0.0     0/0   0.0

TEAM: FG: 10/18 (55.6%), 3PT: 2/6 (33.3%), REB: 13 (3 off, 10 def), AST: 6, TO: 5
TEAM FOULS: 8 [Team_091 in BONUS]


Team_091
--------------------------------------------------------------------------------
Player                MIN  PTS  REB  AST  TO      FG   FG%      3P   3P%
--------------------------------------------------------------------------------
Julius Barnes          16    6    0    0   0   2/2   100.0     0/0   0.0
Ja George              13    6    2    0   0   3/3   100.0     0/0   0.0
Kevin Simons           35    3    3    0   0   1/2    50.0     0/0   0.0
Karl Morant            17    3    0    0   0   1/2    50.0     0/0   0.0
D'Angelo Ingram        35    2    0    0   0   1/3    33.3     0/0   0.0
Kyrie Rozier           32    2    0    0   0   1/1   100.0     0/0   0.0
Isaiah Siakam          32    0    0    0   0   0/2     0.0     0/0   0.0
Tim Antetokounmpo      17    0    4    0   0   0/4     0.0     0/0   0.0
Zion Mitchell          13    0    1    1   0   0/0     0.0     0/0   0.0

TEAM: FG: 9/19 (47.4%), 3PT: 1/7 (14.3%), REB: 10 (2 off, 8 def), AST: 1, TO: 3
TEAM FOULS: 7 [Team_046 in BONUS]

================================================================================

================================================================================
                               FULL GAME COMPLETE                               
================================================================================

FINAL SCORE: Team_046 105, Team_091 90

SCORING BY QUARTER:
--------------------------------------------------------------------------------
Team                     Q1     Q2     Q3     Q4    FINAL
--------------------------------------------------------------------------------
Team_046                 22     30     28     25      105
Team_091                 17     22     27     24       90
--------------------------------------------------------------------------------

FULL GAME BOX SCORE:
================================================================================

Team_046
--------------------------------------------------------------------------------
Player                MIN  PTS  REB  AST  TO      FG   FG%      3P   3P%      FT STL BLK
--------------------------------------------------------------------------------
D'Angelo O'Neal        35   14    0    0   2   6/10   60.0   2/4    50.0   0/0     1   1
Victor Nowitzki        35   20    0    3   0   9/13   69.2   4/5    80.0   0/0     0   0
Lauri Carter           35   12    9    5   3   4/10   40.0   3/8    37.5   1/2     0   0
Cade Wall              35   11   13    5   2   5/10   50.0   1/2    50.0   0/0     1   1
Kevin Allen            32   13    7    5   3   6/10   60.0   0/1     0.0   5/5     1   1
Paul DeRozan           16   10    6    2   0   5/8    62.5   1/2    50.0   1/2     1   0
Collin Butler          13    5    0    0   0   2/2   100.0   0/0     0.0   1/2     1   0
Manu Dosunmu           13    9    5    0   2   2/4    50.0   1/1   100.0   1/3     0   0
Josh Barrett           13    6    0    3   1   3/5    60.0   0/1     0.0   0/0     0   0
Chris LaVine           13    3    3    0   2   1/2    50.0   1/2    50.0   0/0     0   0

TEAM: FG: 44/75 (58.7%), 3PT: 13/26 (50.0%), REB: 42 (9 off, 33 def), AST: 23, TO: 15


Team_091
--------------------------------------------------------------------------------
Player                MIN  PTS  REB  AST  TO      FG   FG%      3P   3P%      FT STL BLK
--------------------------------------------------------------------------------
D'Angelo Ingram        35    5    0    2   3   4/8    50.0   0/2     0.0   0/2     0   0
Kevin Simons           35    9   16    2   2   2/6    33.3   0/2     0.0   1/1     1   3
Isaiah Siakam          32   13    0    1   0   6/9    66.7   1/3    33.3   5/7     0   0
Kyrie Rozier           32   13    5    1   2   5/13   38.5   1/7    14.3   2/2     1   1
Rudy Bridges           32   18    7    3   2   9/14   64.3   2/4    50.0   8/11    0   0
Karl Morant            17    3    0    0   2   1/2    50.0   0/1     0.0   1/1     1   1
Tim Antetokounmpo      17    6    8    1   1   2/6    33.3   1/3    33.3   1/1     0   0
Julius Barnes          16    8    0    0   3   2/5    40.0   1/2    50.0   1/1     0   0
Zion Mitchell          13    3    4    2   0   0/2     0.0   0/0     0.0   0/0     1   1
Ja George              13    8    2    0   0   6/7    85.7   0/0     0.0   5/6     0   0

TEAM: FG: 37/72 (51.4%), 3PT: 6/24 (25.0%), REB: 43 (13 off, 30 def), AST: 12, TO: 15

================================================================================
