================================================================================
                        FULL GAME - Team_020 vs Team_055                        
================================================================================

================================================================================
                       1ST QUARTER - Team_020 vs Team_055                       
================================================================================

[12:00] Team_020 possession (Score: 0-0)
James Cunningham drives to the basket... James Cunningham loses the ball! Stripped by Shaquille Herro! TURNOVER! (live ball)

[11:47] Team_055 possession (Score: 0-0)
Devin Siakam attempts a 3Pt. Contested by Jarrett McCollum (5.5 feet, MAN). Devin Siakam misses. Rebound secured by Bam Leonard.

[11:33] Team_020 possession (Score: 0-0)
Bam Leonard attempts a 3Pt. Heavily contested by Kevin Bane (1.2 feet, ZONE)! BAM LEONARD MAKES IT! Assist: Terry Simons
Score: 3-0

[11:21] Team_055 possession (Score: 3-0)
Devin Siakam attempts a Midrange. Contested by Jarrett McCollum (4.4 feet, MAN). DEVIN SIAKAM MAKES IT! Assist: Shaquille Herro
Score: 3-2

[11:05] Team_020 possession (Score: 3-2)
FOUL! Holding foul on Shaquille Herro. [Team fouls: 1] No free throws, side out. (Shaquille Herro: 1 personal fouls)

[10:46] Team_020 possession (Score: 3-2)
Jarrett McCollum attempts a Layup. Contested by Devin Siakam (4.2 feet, MAN). JARRETT MCCOLLUM MAKES IT!
Score: 5-2

[10:32] Team_055 possession (Score: 5-2)
Jrue Sabonis attempts a Layup. Wide open! Trae Curry is 6.2 feet away. [ZONE] Jrue Sabonis misses. Rebound secured by Bam Leonard.

[10:19] Team_020 possession (Score: 5-2)
James Cunningham attempts a 3Pt. Contested by Kevin Bane (3.4 feet, ZONE). James Cunningham misses. Rebound secured by Jrue Sabonis.

[10:02] Team_055 possession (Score: 5-2)
FOUL! Reach-in foul on Bam Leonard during the drive. [Team fouls: 1] No free throws, side out. (Bam Leonard: 1 personal fouls)

[09:50] Team_055 possession (Score: 5-2)
Shaquille Herro attempts a 3Pt. Contested by James Cunningham (5.5 feet, MAN). SHAQUILLE HERRO MAKES IT! Assist: Devin Siakam
Score: 5-5

[09:39] Team_020 possession (Score: 5-5)
Jarrett McCollum attempts a 3Pt. Contested by Devin Siakam (4.4 feet, MAN). Jarrett McCollum misses. Rebound secured by Chris Turner.

[09:22] Team_055 possession (Score: 5-5)
Shaquille Herro attempts a 3Pt. BLOCKED BY BAM LEONARD! Ball is loose! Rebound secured by Terry Simons.

[09:12] Team_020 possession (Score: 5-5)
Jarrett McCollum attempts a 3Pt. Contested by Devin Siakam (5.0 feet, MAN). Jarrett McCollum misses. Offensive rebound by Trae Curry! Trae Curry's putback is no good. Offensive rebound by Bam Leonard! Bam Leonard kicks it out.

[09:01] Team_020 possession (Score: 5-5)
Bam Leonard attempts a 3Pt. Contested by Kevin Bane (3.2 feet, ZONE). BAM LEONARD MAKES IT! Assist: James Cunningham
Score: 8-5

[08:48] Team_055 possession (Score: 8-5)
Kevin Bane attempts a 3Pt. Heavily contested by Terry Simons (1.9 feet, MAN)! KEVIN BANE MAKES IT!
Score: 8-8

[08:31] Team_020 possession (Score: 8-8)
Trae Curry drives, Chris Turner stays with him. Trae Curry attempts a Dunk. Heavily contested by Chris Turner (2.0 feet, ZONE)! TRAE CURRY MAKES IT! Assist: Bam Leonard
Score: 10-8

[08:15] Team_055 possession (Score: 10-8)
Devin Siakam attempts a 3Pt. Contested by Jarrett McCollum (5.5 feet, MAN). Devin Siakam misses. Rebound secured by Terry Simons.

[08:00] Team_020 possession (Score: 10-8)
Jarrett McCollum attempts a 3Pt. Heavily contested by Kevin Bane (1.9 feet, ZONE)! JARRETT MCCOLLUM MAKES IT! Assist: Bam Leonard
Score: 13-8

[07:43] Team_055 possession (Score: 13-8)
Shaquille Herro attempts a 3Pt. Wide open! James Cunningham is 6.4 feet away. [MAN] SHAQUILLE HERRO MAKES IT! Assist: Kevin Bane
Score: 13-11

[07:29] Team_020 possession (Score: 13-11)
Terry Simons drives to the basket... Terry Simons throws a bad pass! Stolen by Kevin Bane! TURNOVER! (live ball)

[07:14] Team_055 possession (Score: 13-11)
Shaquille Herro attempts a Midrange. Wide open! James Cunningham is 8.2 feet away. [MAN] Shaquille Herro misses. Rebound secured by Bam Leonard.

[06:58] Team_020 possession (Score: 13-11)
Jarrett McCollum attempts a 3Pt. Contested by Kevin Bane (2.4 feet, ZONE). Jarrett McCollum misses. Rebound secured by Jrue Sabonis.

[06:43] Team_055 possession (Score: 13-11)
Chris Turner attempts a Layup. Contested by Trae Curry (4.2 feet, ZONE). CHRIS TURNER MAKES IT! Assist: Shaquille Herro
Score: 13-13

[06:28] Team_020 possession (Score: 13-13)
Jarrett McCollum attempts a Midrange. Heavily contested by Shaquille Herro (0.8 feet, ZONE)! Jarrett McCollum misses. Rebound secured by Jrue Sabonis.

[06:17] Team_055 possession (Score: 13-13)
Jrue Sabonis drives to the basket... Jrue Sabonis throws a bad pass! Stolen by Bam Leonard! TURNOVER! (live ball)

[06:02] Team_020 possession (Score: 13-13)
FOUL! Holding foul on Devin Siakam. [Team fouls: 2] No free throws, side out. (Devin Siakam: 1 personal fouls)

[05:51] Team_020 possession (Score: 13-13)
James Cunningham attempts a Midrange. Contested by Shaquille Herro (4.8 feet, MAN). JAMES CUNNINGHAM MAKES IT!
Score: 15-13

[05:37] Team_055 possession (Score: 15-13)
Devin Siakam attempts a 3Pt. Wide open! Jarrett McCollum is 6.5 feet away. [MAN] Devin Siakam misses. Rebound secured by Trae Curry.

[05:24] Team_020 possession (Score: 15-13)
Terry Simons attempts a Midrange. Contested by Jrue Sabonis (5.7 feet, ZONE). TERRY SIMONS MAKES IT!
Score: 17-13

[05:09] Team_055 possession (Score: 17-13)
Chris Turner drives, Trae Curry stays with him. Chris Turner attempts a Layup. Contested by Trae Curry (4.5 feet, ZONE). CHRIS TURNER MAKES IT!
Score: 17-15

[04:51] Team_020 possession (Score: 17-15)
Jarrett McCollum drives and kicks out. Terry Simons attempts a 3Pt. Contested by Kevin Bane (2.0 feet, MAN). Terry Simons misses. Rebound secured by Chris Turner.

[04:38] Team_055 possession (Score: 17-15)
Jrue Sabonis makes the Dunk and draws the foul on Trae Curry! And-1! Jrue Sabonis to the line for 1. [Team fouls: 2] (Trae Curry: 1 personal fouls)   FT 1/1: GOOD Jrue Sabonis makes 1/1 from the line.
Score: 17-18

[04:22] Team_020 possession (Score: 17-18)
Trae Curry drives, Chris Turner stays with him. Trae Curry attempts a Dunk. Heavily contested by Chris Turner (0.5 feet, MAN)! TRAE CURRY MAKES IT! Assist: Terry Simons
Score: 19-18

[04:12] Team_055 possession (Score: 19-18)
Shaquille Herro attempts a Midrange. Contested by James Cunningham (5.5 feet, MAN). SHAQUILLE HERRO MAKES IT!
Score: 19-20

[03:58] Team_020 possession (Score: 19-20)
Jarrett McCollum drives to the basket... Jarrett McCollum throws a bad pass! Stolen by Chris Turner! TURNOVER! (live ball)

[03:43] Team_055 possession (Score: 19-20)
Devin Siakam attempts a Layup. Wide open! Trae Curry is 6.4 feet away. [ZONE] Devin Siakam misses. Rebound secured by Bam Leonard.

[03:29] Team_020 possession (Score: 19-20)
Trae Curry drives, Chris Turner stays with him. Trae Curry attempts a Layup. Heavily contested by Chris Turner (1.2 feet, ZONE)! TRAE CURRY MAKES IT! Assist: James Cunningham
Score: 21-20

[03:15] Team_055 possession (Score: 21-20)
Shaquille Herro attempts a Midrange. Contested by James Cunningham (4.4 feet, ZONE). Shaquille Herro misses. FOUL! Loose ball foul on Trae Curry during the rebound battle. [Team fouls: 3] No free throws, side out. (Trae Curry: 2 personal fouls)

[03:05] Team_055 possession (Score: 21-20)
Chris Turner drives, Bam Leonard stays with him. Chris Turner attempts a Dunk. Heavily contested by Bam Leonard (0.5 feet, MAN)! CHRIS TURNER MAKES IT! Assist: Shaquille Herro
Score: 21-22

[02:53] Team_020 possession (Score: 21-22)
Trae Curry attempts a Midrange. Contested by Shaquille Herro (4.9 feet, ZONE). TRAE CURRY MAKES IT!
Score: 23-22

[02:37] Team_055 possession (Score: 23-22)
Chris Turner loses control! Ball rolls out of bounds! TURNOVER! (dead ball)

[02:37] Substitution (Team_020): Jarrett McCollum OUT → Franz Doncic IN (stamina_rule2)

[02:37] Substitution (Team_020): James Cunningham OUT → Stephen Parker IN (stamina_rule2)

[02:37] Substitution (Team_020): Terry Simons OUT → Victor Holiday IN (stamina_rule2)

[02:37] Substitution (Team_020): Bam Leonard OUT → Cole Barnes IN (stamina_rule2)

[02:37] Substitution (Team_020): Trae Curry OUT → Miles Siakam IN (stamina_rule2)

[02:37] Substitution (Team_055): Devin Siakam OUT → Luka Wall IN (stamina_rule2)

[02:37] Substitution (Team_055): Shaquille Herro OUT → Dirk Duncan IN (stamina_rule2)

[02:37] Substitution (Team_055): Jrue Sabonis OUT → Malcolm Williamson IN (stamina_rule2)

[02:37] Substitution (Team_055): Chris Turner OUT → D'Angelo Antetokounmpo IN (stamina_rule2)

[02:20] Team_020 possession (Score: 23-22)
Franz Doncic drives, Luka Wall stays with him. Franz Doncic attempts a Dunk. Wide open! Luka Wall is 7.1 feet away. [MAN] FRANZ DONCIC MAKES IT! Assist: Miles Siakam
Score: 25-22

[02:06] Team_055 possession (Score: 25-22)
FOUL! Offensive foul on Malcolm Williamson! Cole Barnes drew the charge! [Team fouls: 3] (Malcolm Williamson: 1 personal fouls) TURNOVER! (dead ball)

[01:53] Team_020 possession (Score: 25-22)
Franz Doncic drives to the basket... Franz Doncic loses the ball! Stripped by Malcolm Williamson! TURNOVER! (live ball)

[01:40] Team_055 possession (Score: 25-22)
Kevin Bane drives and kicks out. Dirk Duncan attempts a 3Pt. Wide open! Stephen Parker is 6.4 feet away. [MAN] Dirk Duncan misses. Offensive rebound by D'Angelo Antetokounmpo! D'Angelo Antetokounmpo puts it back in!
Score: 25-24

[01:28] Team_020 possession (Score: 25-24)
Miles Siakam makes the Dunk and draws the foul on D'Angelo Antetokounmpo! And-1! Miles Siakam to the line for 1. [Team fouls: 4] (D'Angelo Antetokounmpo: 1 personal fouls)   FT 1/1: MISS Miles Siakam makes 0/1 from the line. Offensive rebound by Cole Barnes! Cole Barnes kicks it out.
Score: 27-24

[01:15] Team_020 possession (Score: 27-24)
Miles Siakam drives and kicks out. Stephen Parker attempts a Midrange. Contested by Dirk Duncan (3.7 feet, MAN). Stephen Parker misses. Rebound secured by Dirk Duncan.

[01:01] Team_055 possession (Score: 27-24)
Dirk Duncan attempts a Layup. Heavily contested by Stephen Parker (1.8 feet, MAN)! Dirk Duncan misses. Rebound secured by Miles Siakam.

[00:48] Team_020 possession (Score: 27-24)
Franz Doncic drives to the basket... Franz Doncic loses control! Ball rolls out of bounds! TURNOVER! (dead ball)

[00:48] Substitution (Team_055): Kevin Bane OUT → Kyle Wall IN (stamina_rule2)

[00:31] Team_055 possession (Score: 27-24)
Dirk Duncan attempts a 3Pt. Wide open! Stephen Parker is 7.6 feet away. [MAN] Dirk Duncan misses. Rebound secured by Miles Siakam.

[00:20] Team_020 possession (Score: 27-24)
Miles Siakam drives to the basket... FOUL! Offensive foul on Miles Siakam! Malcolm Williamson drew the charge! [Team fouls: 4] (Miles Siakam: 1 personal fouls) TURNOVER! (dead ball)

[00:06] Team_055 possession (Score: 27-24)
Malcolm Williamson attempts a 3Pt. Contested by Cole Barnes (4.4 feet, MAN). Malcolm Williamson misses. Rebound secured by Victor Holiday.

================================================================================
                              1ST QUARTER COMPLETE                              
================================================================================

1ST QUARTER SCORE: Team_020 27, Team_055 24

BOX SCORE:
================================================================================

Team_020
--------------------------------------------------------------------------------
Player                MIN  PTS  REB  AST  TO      FG   FG%      3P   3P%
--------------------------------------------------------------------------------
Trae Curry             10    8    1    0   0   4/4   100.0     0/0   0.0
Bam Leonard            10    6    5    2   0   2/2   100.0     0/0   0.0
Jarrett McCollum       10    5    0    0   0   2/6    33.3     0/0   0.0
Terry Simons           10    2    2    2   0   1/1   100.0     0/0   0.0
James Cunningham       10    2    0    2   0   1/2    50.0     0/0   0.0
Franz Doncic            3    2    0    0   0   1/1   100.0     0/0   0.0
Miles Siakam            3    0    2    1   0   0/1     0.0     0/0   0.0
Cole Barnes             3    0    1    0   0   0/0     0.0     0/0   0.0
Victor Holiday          3    0    1    0   0   0/0     0.0     0/0   0.0

TEAM: FG: 11/17 (64.7%), 3PT: 3/6 (50.0%), REB: 12 (2 off, 10 def), AST: 7, TO: 6
TEAM FOULS: 4


Team_055
--------------------------------------------------------------------------------
Player                MIN  PTS  REB  AST  TO      FG   FG%      3P   3P%
--------------------------------------------------------------------------------
Shaquille Herro        10    8    0    3   0   3/5    60.0     0/0   0.0
Chris Turner           10    6    3    0   0   3/3   100.0     0/0   0.0
Jrue Sabonis           10    3    3    0   0   1/2    50.0     0/0   0.0
Kevin Bane             11    3    0    1   0   1/1   100.0     0/0   0.0
Devin Siakam           10    2    0    1   0   1/5    20.0     0/0   0.0
D'Angelo Antetokounmpo    3    2    1    0   0   1/1   100.0     0/0   0.0
Dirk Duncan             3    0    1    0   0   0/2     0.0     0/0   0.0
Malcolm Williamson      3    0    0    0   0   0/1     0.0     0/0   0.0

TEAM: FG: 10/20 (50.0%), 3PT: 3/9 (33.3%), REB: 8 (2 off, 6 def), AST: 5, TO: 3
TEAM FOULS: 4

================================================================================

================================================================================
                       2ND QUARTER - Team_020 vs Team_055                       
================================================================================

[12:00] Team_020 possession (Score: 27-24)
James Cunningham drives and kicks out. Bam Leonard attempts a 3Pt. Contested by Chris Turner (2.0 feet, MAN). Bam Leonard misses. Rebound secured by Kevin Bane.

[11:44] Team_055 possession (Score: 27-24)
Jrue Sabonis drives to the basket... Jrue Sabonis throws a bad pass! Stolen by Trae Curry! TURNOVER! (live ball)

[11:30] Team_020 possession (Score: 27-24)
James Cunningham loses the ball! Stripped by Shaquille Herro! TURNOVER! (live ball)

[11:17] Team_055 possession (Score: 27-24)
Kevin Bane drives, Terry Simons stays with him. Kevin Bane attempts a Layup. Contested by Terry Simons (2.2 feet, MAN). KEVIN BANE MAKES IT!
Score: 27-26

[11:02] Team_020 possession (Score: 27-26)
FOUL! Offensive foul on James Cunningham! Shaquille Herro drew the charge! [Team fouls: 1] (James Cunningham: 1 personal fouls) TURNOVER! (dead ball)

[10:44] Team_055 possession (Score: 27-26)
Jrue Sabonis loses control! Ball rolls out of bounds! TURNOVER! (dead ball)

[10:30] Team_020 possession (Score: 27-26)
FOUL! Holding foul on Devin Siakam. [Team fouls: 1] No free throws, side out. (Devin Siakam: 1 personal fouls)

[10:14] Team_020 possession (Score: 27-26)
Bam Leonard drives and kicks out. James Cunningham attempts a 3Pt. Wide open! Shaquille Herro is 8.2 feet away. [MAN] James Cunningham misses. Rebound secured by Kevin Bane.

[10:02] Team_055 possession (Score: 27-26)
Chris Turner attempts a Midrange. Heavily contested by Bam Leonard (1.6 feet, ZONE)! Chris Turner misses. Rebound secured by Trae Curry.

[09:49] Team_020 possession (Score: 27-26)
FOUL! Holding foul on Shaquille Herro. [Team fouls: 2] No free throws, side out. (Shaquille Herro: 1 personal fouls)

[09:30] Team_020 possession (Score: 27-26)
Jarrett McCollum attempts a 3Pt. Contested by Shaquille Herro (3.2 feet, ZONE). Jarrett McCollum misses. Rebound secured by Chris Turner.

[09:16] Team_055 possession (Score: 27-26)
Jrue Sabonis attempts a Midrange. Contested by Terry Simons (5.9 feet, ZONE). Jrue Sabonis misses. Rebound secured by Terry Simons.

[09:00] Team_020 possession (Score: 27-26)
Jarrett McCollum drives and kicks out. Trae Curry attempts a Midrange. Contested by Kevin Bane (4.4 feet, ZONE). TRAE CURRY MAKES IT! Assist: Terry Simons
Score: 29-26

[08:45] Team_055 possession (Score: 29-26)
Chris Turner attempts a 3Pt. Heavily contested by Bam Leonard (1.6 feet, ZONE)! Chris Turner misses. Rebound secured by Terry Simons.

[08:35] Team_020 possession (Score: 29-26)
Bam Leonard attempts a Layup. Heavily contested by Chris Turner (0.5 feet, MAN)! Bam Leonard misses. Rebound secured by Chris Turner.

[08:18] Team_055 possession (Score: 29-26)
Kevin Bane attempts a Midrange. Contested by Bam Leonard (2.9 feet, ZONE). KEVIN BANE MAKES IT!
Score: 29-28

[08:02] Team_020 possession (Score: 29-28)
Trae Curry makes the Midrange and draws the foul on Jrue Sabonis! And-1! Trae Curry to the line for 1. [Team fouls: 3] (Jrue Sabonis: 1 personal fouls)   FT 1/1: GOOD Trae Curry makes 1/1 from the line.
Score: 32-28

[07:53] Team_055 possession (Score: 32-28)
Jrue Sabonis drives, Bam Leonard stays with him. Jrue Sabonis attempts a Layup. Contested by Bam Leonard (5.9 feet, MAN). JRUE SABONIS MAKES IT!
Score: 32-30

[07:42] Team_020 possession (Score: 32-30)
James Cunningham drives, Shaquille Herro stays with him. James Cunningham attempts a Layup. Contested by Shaquille Herro (4.3 feet, MAN). JAMES CUNNINGHAM MAKES IT! Assist: Terry Simons
Score: 34-30

[07:27] Team_055 possession (Score: 34-30)
Kevin Bane attempts a 3Pt. Heavily contested by Bam Leonard (1.8 feet, ZONE)! Kevin Bane misses. Rebound secured by Trae Curry.

[07:14] Team_020 possession (Score: 34-30)
James Cunningham attempts a 3Pt. Contested by Jrue Sabonis (3.6 feet, ZONE). James Cunningham misses. Rebound secured by Chris Turner.

[06:58] Team_055 possession (Score: 34-30)
Devin Siakam attempts a 3Pt. Contested by Bam Leonard (3.3 feet, ZONE). DEVIN SIAKAM MAKES IT! Assist: Jrue Sabonis
Score: 34-33

[06:45] Team_020 possession (Score: 34-33)
James Cunningham attempts a 3Pt. Heavily contested by Shaquille Herro (1.3 feet, MAN)! JAMES CUNNINGHAM MAKES IT!
Score: 37-33

[06:32] Team_055 possession (Score: 37-33)
Devin Siakam attempts a Midrange. Heavily contested by Bam Leonard (1.2 feet, ZONE)! Devin Siakam misses. Rebound secured by Terry Simons.

[06:19] Team_020 possession (Score: 37-33)
Bam Leonard attempts a Layup. BLOCKED BY SHAQUILLE HERRO! Ball is loose! Offensive rebound by Trae Curry! Trae Curry kicks it out.

[06:06] Team_020 possession (Score: 37-33)
Bam Leonard attempts a 3Pt. Contested by Chris Turner (6.0 feet, MAN). BAM LEONARD MAKES IT! Assist: Trae Curry
Score: 40-33

[05:49] Team_055 possession (Score: 40-33)
Kevin Bane attempts a 3Pt. Wide open! Terry Simons is 7.3 feet away. [MAN] KEVIN BANE MAKES IT! Assist: Chris Turner
Score: 40-36

[05:34] Team_020 possession (Score: 40-36)
Jarrett McCollum attempts a 3Pt. Contested by Shaquille Herro (4.6 feet, ZONE). Jarrett McCollum misses. Rebound secured by Kevin Bane.

[05:15] Team_055 possession (Score: 40-36)
Kevin Bane loses control! Ball rolls out of bounds! TURNOVER! (dead ball)

[05:15] Substitution (Team_020): Jarrett McCollum OUT → Franz Doncic IN (stamina_rule2)

[05:15] Substitution (Team_020): James Cunningham OUT → Stephen Parker IN (stamina_rule2)

[05:15] Substitution (Team_020): Terry Simons OUT → Victor Holiday IN (stamina_rule2)

[05:15] Substitution (Team_020): Bam Leonard OUT → Cole Barnes IN (stamina_rule2)

[05:15] Substitution (Team_020): Trae Curry OUT → Miles Siakam IN (stamina_rule2)

[05:15] Substitution (Team_055): Devin Siakam OUT → Luka Wall IN (stamina_rule2)

[05:15] Substitution (Team_055): Shaquille Herro OUT → Dirk Duncan IN (stamina_rule2)

[05:15] Substitution (Team_055): Kevin Bane OUT → Kyle Wall IN (stamina_rule2)

[05:15] Substitution (Team_055): Jrue Sabonis OUT → Malcolm Williamson IN (stamina_rule2)

[05:15] Substitution (Team_055): Chris Turner OUT → D'Angelo Antetokounmpo IN (stamina_rule2)

[05:00] Team_020 possession (Score: 40-36)
Stephen Parker attempts a 3Pt. Contested by Kyle Wall (5.5 feet, ZONE). Stephen Parker misses. Offensive rebound by Miles Siakam! Miles Siakam kicks it out.

[04:40] Team_020 possession (Score: 40-36)
Franz Doncic attempts a 3Pt. Contested by Luka Wall (3.3 feet, MAN). Franz Doncic misses. Offensive rebound by Miles Siakam! Miles Siakam kicks it out.

[04:27] Team_020 possession (Score: 40-36)
Cole Barnes attempts a 3Pt. Wide open! Malcolm Williamson is 7.2 feet away. [MAN] Cole Barnes misses. Rebound secured by Malcolm Williamson.

[04:11] Team_055 possession (Score: 40-36)
Kyle Wall attempts a 3Pt. Wide open! Cole Barnes is 6.1 feet away. [ZONE] KYLE WALL MAKES IT! Assist: Luka Wall
Score: 40-39

[03:55] Team_020 possession (Score: 40-39)
Victor Holiday attempts a 3Pt. Wide open! Kyle Wall is 7.7 feet away. [MAN] Victor Holiday misses. Offensive rebound by Cole Barnes! Cole Barnes kicks it out.

[03:37] Team_020 possession (Score: 40-39)
Cole Barnes attempts a 3Pt. Contested by Kyle Wall (3.6 feet, ZONE). COLE BARNES MAKES IT! Assist: Victor Holiday
Score: 43-39

[03:23] Team_055 possession (Score: 43-39)
Luka Wall drives to the basket... Luka Wall throws a bad pass! Stolen by Miles Siakam! TURNOVER! (live ball)

[03:10] Team_020 possession (Score: 43-39)
Victor Holiday makes the Dunk and draws the foul on Dirk Duncan! And-1! Victor Holiday to the line for 1. [Team fouls: 4] (Dirk Duncan: 1 personal fouls)   FT 1/1: GOOD Victor Holiday makes 1/1 from the line.
Score: 46-39

[02:58] Team_055 possession (Score: 46-39)
Kyle Wall drives to the basket... Kyle Wall throws a bad pass! Stolen by Victor Holiday! TURNOVER! (live ball)

[02:41] Team_020 possession (Score: 46-39)
FOUL! Holding foul on Malcolm Williamson. [IN THE BONUS! 5 team fouls] Cole Barnes to the line for 2 free throws. (Malcolm Williamson: 1 personal fouls)   FT 1/2: GOOD   FT 2/2: MISS Cole Barnes makes 1/2 from the line. Offensive rebound by Miles Siakam! Miles Siakam kicks it out.
Score: 47-39

[02:26] Team_020 possession (Score: 47-39)
Miles Siakam attempts a 3Pt. Contested by Kyle Wall (3.6 feet, ZONE). MILES SIAKAM MAKES IT! Assist: Stephen Parker
Score: 50-39

[02:15] Team_055 possession (Score: 50-39)
Dirk Duncan attempts a 3Pt. Contested by Stephen Parker (4.1 feet, ZONE). DIRK DUNCAN MAKES IT!
Score: 50-42

[01:59] Team_020 possession (Score: 50-42)
Miles Siakam attempts a Midrange. Heavily contested by D'Angelo Antetokounmpo (1.6 feet, MAN)! Miles Siakam misses. Offensive rebound by Miles Siakam! Miles Siakam kicks it out.

[01:45] Team_020 possession (Score: 50-42)
FOUL! Reach-in foul on Malcolm Williamson during the drive. [IN THE BONUS! 6 team fouls] Miles Siakam to the line for 2 free throws. (Malcolm Williamson: 2 personal fouls)   FT 1/2: GOOD   FT 2/2: MISS Miles Siakam makes 1/2 from the line. Rebound secured by Dirk Duncan.
Score: 51-42

[01:34] Team_055 possession (Score: 51-42)
Kyle Wall attempts a 3Pt. Contested by Victor Holiday (3.1 feet, MAN). Kyle Wall misses. Rebound secured by Miles Siakam.

[01:19] Team_020 possession (Score: 51-42)
Victor Holiday attempts a Layup. Heavily contested by Malcolm Williamson (0.5 feet, ZONE)! VICTOR HOLIDAY MAKES IT! Assist: Franz Doncic
Score: 53-42

[01:08] Team_055 possession (Score: 53-42)
Dirk Duncan attempts a 3Pt. Contested by Stephen Parker (3.8 feet, ZONE). Dirk Duncan misses. Rebound secured by Cole Barnes.

[00:53] Team_020 possession (Score: 53-42)
Stephen Parker attempts a 3Pt. Wide open! Kyle Wall is 6.6 feet away. [ZONE] Stephen Parker misses. Rebound secured by Malcolm Williamson.

[00:39] Team_055 possession (Score: 53-42)
Dirk Duncan attempts a 3Pt. Heavily contested by Stephen Parker (1.9 feet, ZONE)! DIRK DUNCAN MAKES IT!
Score: 53-45

[00:24] Team_020 possession (Score: 53-45)
Cole Barnes attempts a 3Pt. Contested by Malcolm Williamson (6.0 feet, MAN). COLE BARNES MAKES IT! Assist: Franz Doncic
Score: 56-45

[00:10] Team_055 possession (Score: 56-45)
Luka Wall attempts a 3Pt. Contested by Stephen Parker (4.9 feet, ZONE). Luka Wall misses. Offensive rebound by Malcolm Williamson! Malcolm Williamson puts it back in!
Score: 56-47

================================================================================
                              2ND QUARTER COMPLETE                              
================================================================================

2ND QUARTER SCORE: Team_020 29, Team_055 23

BOX SCORE:
================================================================================

Team_020
--------------------------------------------------------------------------------
Player                MIN  PTS  REB  AST  TO      FG   FG%      3P   3P%
--------------------------------------------------------------------------------
Cole Barnes             8    6    2    0   0   2/3    66.7     0/0   0.0
James Cunningham       17    5    0    0   0   2/4    50.0     0/0   0.0
Trae Curry             17    5    3    1   0   2/2   100.0     0/0   0.0
Victor Holiday          8    5    0    1   0   2/2   100.0     0/0   0.0
Bam Leonard            17    3    0    0   0   1/3    33.3     0/0   0.0
Miles Siakam            8    3    5    0   0   1/2    50.0     0/0   0.0
Jarrett McCollum       17    0    0    0   0   0/2     0.0     0/0   0.0
Terry Simons           17    0    3    2   0   0/0     0.0     0/0   0.0
Stephen Parker          8    0    0    1   0   0/1     0.0     0/0   0.0
Franz Doncic            8    0    0    2   0   0/0     0.0     0/0   0.0

TEAM: FG: 10/19 (52.6%), 3PT: 5/10 (50.0%), REB: 13 (6 off, 7 def), AST: 7, TO: 2
TEAM FOULS: 1


Team_055
--------------------------------------------------------------------------------
Player                MIN  PTS  REB  AST  TO      FG   FG%      3P   3P%
--------------------------------------------------------------------------------
Kevin Bane             18    7    3    0   0   3/4    75.0     0/0   0.0
Dirk Duncan             8    6    1    0   0   2/3    66.7     0/0   0.0
Devin Siakam           17    3    0    0   0   1/2    50.0     0/0   0.0
Kyle Wall               6    3    0    0   0   1/2    50.0     0/0   0.0
Jrue Sabonis           17    2    0    1   0   1/2    50.0     0/0   0.0
Malcolm Williamson      8    2    3    0   0   1/1   100.0     0/0   0.0
Chris Turner           17    0    3    1   0   0/2     0.0     0/0   0.0
Luka Wall               8    0    0    1   0   0/0     0.0     0/0   0.0

TEAM: FG: 9/16 (56.2%), 3PT: 6/10 (60.0%), REB: 10 (1 off, 9 def), AST: 3, TO: 5
TEAM FOULS: 6 [Team_020 in BONUS]

================================================================================

================================================================================
                       3RD QUARTER - Team_020 vs Team_055                       
================================================================================

[12:00] Team_020 possession (Score: 56-47)
FOUL! Offensive foul on James Cunningham! Shaquille Herro drew the charge! [Team fouls: 1] (James Cunningham: 1 personal fouls) TURNOVER! (dead ball)

[11:46] Team_055 possession (Score: 56-47)
Shaquille Herro attempts a Midrange. Wide open! James Cunningham is 6.1 feet away. [ZONE] SHAQUILLE HERRO MAKES IT!
Score: 56-49

[11:33] Team_020 possession (Score: 56-49)
Trae Curry attempts a Midrange. Heavily contested by Chris Turner (0.5 feet, MAN)! Trae Curry misses. Rebound secured by Kevin Bane.

[11:19] Team_055 possession (Score: 56-49)
Jrue Sabonis attempts a Layup. BLOCKED BY JARRETT MCCOLLUM! Ball is loose! Rebound secured by Bam Leonard.

[11:02] Team_020 possession (Score: 56-49)
Jarrett McCollum attempts a Layup. BLOCKED BY CHRIS TURNER! Ball deflects out of bounds off Jarrett McCollum.

[10:50] Team_055 possession (Score: 56-49)
Shaquille Herro makes the Dunk and draws the foul on James Cunningham! And-1! Shaquille Herro to the line for 1. [Team fouls: 2] (James Cunningham: 2 personal fouls)   FT 1/1: GOOD Shaquille Herro makes 1/1 from the line.
Score: 56-52

[10:34] Team_020 possession (Score: 56-52)
Jarrett McCollum drives, Chris Turner stays with him. Jarrett McCollum attempts a Dunk. Heavily contested by Chris Turner (0.5 feet, ZONE)! JARRETT MCCOLLUM MAKES IT! Assist: James Cunningham
Score: 58-52

[10:19] Team_055 possession (Score: 58-52)
Chris Turner drives, picks up Trae Curry. Help arrives from Jarrett McCollum! Chris Turner attempts a Layup. Contested by Jarrett McCollum (5.0 feet, ZONE). CHRIS TURNER MAKES IT!
Score: 58-54

[10:02] Team_020 possession (Score: 58-54)
Trae Curry attempts a Dunk. BLOCKED BY CHRIS TURNER! Ball is loose! Rebound secured by Kevin Bane.

[09:49] Team_055 possession (Score: 58-54)
FOUL! Shooting foul on Bam Leonard. Kevin Bane to the line for 2 free throws. [Team fouls: 3] (Bam Leonard: 1 personal fouls)   FT 1/2: MISS   FT 2/2: GOOD Kevin Bane makes 1/2 from the line.
Score: 58-55

[09:34] Team_020 possession (Score: 58-55)
Trae Curry drives to the basket... FOUL! Offensive foul on Trae Curry! Chris Turner drew the charge! [Team fouls: 4] (Trae Curry: 1 personal fouls) TURNOVER! (dead ball)

[09:19] Team_055 possession (Score: 58-55)
Shaquille Herro drives, James Cunningham stays with him. Shaquille Herro attempts a Dunk. Heavily contested by James Cunningham (1.8 feet, MAN)! Shaquille Herro misses. Rebound secured by Trae Curry.

[09:08] Team_020 possession (Score: 58-55)
FOUL! Reach-in foul on Kevin Bane during the drive. [Team fouls: 1] No free throws, side out. (Kevin Bane: 1 personal fouls)

[08:53] Team_020 possession (Score: 58-55)
Trae Curry drives, picks up Chris Turner. Help arrives from Shaquille Herro! Trae Curry attempts a Dunk. Heavily contested by Shaquille Herro (0.9 feet, ZONE)! TRAE CURRY MAKES IT! Assist: Bam Leonard
Score: 60-55

[08:39] Team_055 possession (Score: 60-55)
Shaquille Herro attempts a 3Pt. Contested by James Cunningham (4.5 feet, MAN). Shaquille Herro misses. Offensive rebound by Jrue Sabonis! Jrue Sabonis kicks it out.

[08:25] Team_055 possession (Score: 60-55)
Shaquille Herro drives and kicks out. Jrue Sabonis attempts a Midrange. Heavily contested by Bam Leonard (0.7 feet, MAN)! Jrue Sabonis misses. Rebound secured by Trae Curry.

[08:08] Team_020 possession (Score: 60-55)
Bam Leonard attempts a Layup. Contested by Chris Turner (2.7 feet, ZONE). BAM LEONARD MAKES IT! Assist: Trae Curry
Score: 62-55

[07:54] Team_055 possession (Score: 62-55)
Shaquille Herro attempts a 3Pt. Wide open! James Cunningham is 6.6 feet away. [ZONE] SHAQUILLE HERRO MAKES IT! Assist: Devin Siakam
Score: 62-58

[07:38] Team_020 possession (Score: 62-58)
Trae Curry drives, Chris Turner stays with him. Trae Curry attempts a Layup. Contested by Chris Turner (4.3 feet, ZONE). TRAE CURRY MAKES IT!
Score: 64-58

[07:27] Team_055 possession (Score: 64-58)
Jrue Sabonis makes the Layup and draws the foul on Trae Curry! And-1! Jrue Sabonis to the line for 1. [BONUS: 5 team fouls] (Trae Curry: 2 personal fouls)   FT 1/1: GOOD Jrue Sabonis makes 1/1 from the line.
Score: 64-61

[07:10] Team_020 possession (Score: 64-61)
Jarrett McCollum attempts a Midrange. Contested by Shaquille Herro (2.7 feet, ZONE). Jarrett McCollum misses. Rebound secured by Jrue Sabonis.

[06:55] Team_055 possession (Score: 64-61)
Kevin Bane attempts a 3Pt. Contested by Terry Simons (3.3 feet, MAN). Kevin Bane misses. Rebound secured by Trae Curry.

[06:38] Team_020 possession (Score: 64-61)
Terry Simons attempts a 3Pt. Wide open! Shaquille Herro is 6.6 feet away. [ZONE] Terry Simons misses. Rebound secured by Kevin Bane.

[06:23] Team_055 possession (Score: 64-61)
FOUL! Holding foul on James Cunningham. [IN THE BONUS! 6 team fouls] Shaquille Herro to the line for 2 free throws. (James Cunningham: 3 personal fouls)   FT 1/2: GOOD   FT 2/2: MISS Shaquille Herro makes 1/2 from the line. Rebound secured by Bam Leonard.
Score: 64-62

[06:09] Team_020 possession (Score: 64-62)
Trae Curry attempts a Dunk. BLOCKED BY CHRIS TURNER! Ball deflects out of bounds off Trae Curry.

[05:58] Team_055 possession (Score: 64-62)
FOUL! Shooting foul on Jarrett McCollum. Devin Siakam to the line for 2 free throws. [BONUS: 7 team fouls] (Jarrett McCollum: 1 personal fouls)   FT 1/2: GOOD   FT 2/2: GOOD Devin Siakam makes 2/2 from the line.
Score: 64-64

[05:41] Team_020 possession (Score: 64-64)
FOUL! Shooting foul on Shaquille Herro. Terry Simons to the line for 3 free throws. [Team fouls: 2] (Shaquille Herro: 1 personal fouls)   FT 1/3: GOOD   FT 2/3: GOOD   FT 3/3: GOOD Terry Simons makes 3/3 from the line.
Score: 67-64

[05:30] Team_055 possession (Score: 67-64)
Devin Siakam attempts a 3Pt. Contested by Jarrett McCollum (5.2 feet, MAN). Devin Siakam misses. Rebound secured by Terry Simons.

[05:14] Team_020 possession (Score: 67-64)
James Cunningham attempts a Midrange. Contested by Shaquille Herro (3.6 feet, ZONE). James Cunningham misses. Rebound secured by Chris Turner.

[04:59] Team_055 possession (Score: 67-64)
FOUL! Holding foul on Jarrett McCollum. [IN THE BONUS! 8 team fouls] Devin Siakam to the line for 2 free throws. (Jarrett McCollum: 2 personal fouls)   FT 1/2: GOOD   FT 2/2: GOOD Devin Siakam makes 2/2 from the line.
Score: 67-66

[04:43] Team_020 possession (Score: 67-66)
Trae Curry drives to the basket... Trae Curry throws a bad pass out of bounds! TURNOVER! (dead ball)

[04:31] Team_055 possession (Score: 67-66)
Chris Turner attempts a Layup. Heavily contested by Trae Curry (1.4 feet, ZONE)! CHRIS TURNER MAKES IT!
Score: 67-68

[04:12] Team_020 possession (Score: 67-68)
Jarrett McCollum attempts a Midrange. Wide open! Devin Siakam is 6.7 feet away. [MAN] JARRETT MCCOLLUM MAKES IT! Assist: James Cunningham
Score: 69-68

[03:59] Team_055 possession (Score: 69-68)
Kevin Bane attempts a Midrange. Contested by Terry Simons (5.7 feet, ZONE). KEVIN BANE MAKES IT! Assist: Devin Siakam
Score: 69-70

[03:47] Team_020 possession (Score: 69-70)
Jarrett McCollum drives, Chris Turner stays with him. Jarrett McCollum attempts a Dunk. Contested by Chris Turner (4.0 feet, ZONE). JARRETT MCCOLLUM MAKES IT!
Score: 71-70

[03:32] Team_055 possession (Score: 71-70)
Devin Siakam drives, picks up Jarrett McCollum. Help arrives from Terry Simons! Devin Siakam attempts a Dunk. Contested by Terry Simons (3.5 feet, MAN). DEVIN SIAKAM MAKES IT! Assist: Kevin Bane
Score: 71-72

[03:20] Team_020 possession (Score: 71-72)
Trae Curry makes the Dunk and draws the foul on Shaquille Herro! And-1! Trae Curry to the line for 1. [Team fouls: 3] (Shaquille Herro: 2 personal fouls)   FT 1/1: GOOD Trae Curry makes 1/1 from the line.
Score: 74-72

[03:06] Team_055 possession (Score: 74-72)
Kevin Bane attempts a 3Pt. Contested by Bam Leonard (3.5 feet, ZONE). Kevin Bane misses. Rebound secured by Terry Simons.

[02:55] Team_020 possession (Score: 74-72)
Jarrett McCollum attempts a Midrange. Contested by Shaquille Herro (4.0 feet, ZONE). Jarrett McCollum misses. Rebound secured by Kevin Bane.

[02:42] Team_055 possession (Score: 74-72)
Chris Turner attempts a Midrange. Contested by Bam Leonard (4.8 feet, MAN). CHRIS TURNER MAKES IT!
Score: 74-74

[02:31] Team_020 possession (Score: 74-74)
James Cunningham loses the ball! Stripped by Shaquille Herro! TURNOVER! (live ball)

[02:20] Team_055 possession (Score: 74-74)
Chris Turner attempts a Midrange. Contested by Bam Leonard (2.8 feet, MAN). Chris Turner misses. Rebound secured by Terry Simons.

[02:05] Team_020 possession (Score: 74-74)
James Cunningham drives, picks up Shaquille Herro. Help arrives from Devin Siakam! James Cunningham attempts a Layup. Contested by Devin Siakam (5.7 feet, MAN). JAMES CUNNINGHAM MAKES IT! Assist: Terry Simons
Score: 76-74

[01:50] Team_055 possession (Score: 76-74)
FOUL! Reach-in foul on Trae Curry during the drive. [IN THE BONUS! 9 team fouls] Chris Turner to the line for 2 free throws. (Trae Curry: 3 personal fouls)   FT 1/2: GOOD   FT 2/2: GOOD Chris Turner makes 2/2 from the line.
Score: 76-76

[01:31] Team_020 possession (Score: 76-76)
Jarrett McCollum attempts a 3Pt. Contested by Devin Siakam (5.7 feet, MAN). Jarrett McCollum misses. Offensive rebound by Bam Leonard! Bam Leonard's putback is no good. Offensive rebound by Trae Curry! Trae Curry kicks it out.

[01:13] Team_020 possession (Score: 76-76)
Trae Curry attempts a Midrange. Contested by Chris Turner (4.4 feet, MAN). TRAE CURRY MAKES IT! Assist: James Cunningham
Score: 78-76

[00:56] Team_055 possession (Score: 78-76)
Chris Turner drives, Trae Curry stays with him. Chris Turner attempts a Dunk. Contested by Trae Curry (2.4 feet, ZONE). CHRIS TURNER MAKES IT!
Score: 78-78

[00:41] Team_020 possession (Score: 78-78)
Trae Curry attempts a 3Pt. Contested by Kevin Bane (2.7 feet, ZONE). Trae Curry misses. Rebound secured by Kevin Bane.

[00:26] Team_055 possession (Score: 78-78)
Shaquille Herro attempts a Midrange. Contested by James Cunningham (5.7 feet, ZONE). SHAQUILLE HERRO MAKES IT!
Score: 78-80

[00:12] Team_020 possession (Score: 78-80)
Jarrett McCollum attempts a 3Pt. Wide open! Devin Siakam is 6.1 feet away. [MAN] JARRETT MCCOLLUM MAKES IT! Assist: James Cunningham
Score: 81-80

================================================================================
                              3RD QUARTER COMPLETE                              
================================================================================

3RD QUARTER SCORE: Team_020 25, Team_055 33

BOX SCORE:
================================================================================

Team_020
--------------------------------------------------------------------------------
Player                MIN  PTS  REB  AST  TO      FG   FG%      3P   3P%
--------------------------------------------------------------------------------
Trae Curry             29    9    4    1   0   4/8    50.0     0/0   0.0
Jarrett McCollum       29    9    0    0   0   4/7    57.1     0/0   0.0
Terry Simons           29    3    3    1   0   1/2    50.0     0/0   0.0
Bam Leonard            29    2    2    1   0   1/1   100.0     0/0   0.0
James Cunningham       29    2    0    4   0   1/2    50.0     0/0   0.0

TEAM: FG: 11/20 (55.0%), 3PT: 2/4 (50.0%), REB: 9 (1 off, 8 def), AST: 7, TO: 4
TEAM FOULS: 9 [Team_055 in BONUS]


Team_055
--------------------------------------------------------------------------------
Player                MIN  PTS  REB  AST  TO      FG   FG%      3P   3P%
--------------------------------------------------------------------------------
Shaquille Herro        29   10    0    0   0   4/6    66.7     0/0   0.0
Chris Turner           29   10    1    0   0   5/6    83.3     0/0   0.0
Devin Siakam           29    6    0    2   0   3/4    75.0     0/0   0.0
Kevin Bane             31    3    5    1   0   2/4    50.0     0/0   0.0
Jrue Sabonis           29    3    2    0   0   1/2    50.0     0/0   0.0

TEAM: FG: 15/23 (65.2%), 3PT: 1/4 (25.0%), REB: 8 (1 off, 7 def), AST: 3, TO: 0
TEAM FOULS: 3

================================================================================

================================================================================
                       4TH QUARTER - Team_020 vs Team_055                       
================================================================================

[12:00] Team_020 possession (Score: 81-80)
Terry Simons attempts a 3Pt. Wide open! Kevin Bane is 8.4 feet away. [MAN] TERRY SIMONS MAKES IT! Assist: Jarrett McCollum
Score: 84-80

[11:46] Team_055 possession (Score: 84-80)
Kevin Bane drives to the basket... Kevin Bane throws a bad pass! Stolen by Trae Curry! TURNOVER! (live ball)

[11:32] Team_020 possession (Score: 84-80)
Trae Curry drives, picks up Chris Turner. Help arrives from Shaquille Herro! Trae Curry attempts a Dunk. Contested by Shaquille Herro (3.8 feet, ZONE). TRAE CURRY MAKES IT!
Score: 86-80

[11:18] Team_055 possession (Score: 86-80)
Chris Turner attempts a 3Pt. Contested by Bam Leonard (3.6 feet, MAN). Chris Turner misses. Rebound secured by Bam Leonard.

[11:01] Team_020 possession (Score: 86-80)
Jarrett McCollum attempts a Midrange. Wide open! Devin Siakam is 8.5 feet away. [MAN] Jarrett McCollum misses. Offensive rebound by Bam Leonard! Bam Leonard puts it back in!
Score: 88-80

[10:46] Team_055 possession (Score: 88-80)
Shaquille Herro attempts a 3Pt. Contested by James Cunningham (4.4 feet, MAN). Shaquille Herro misses. FOUL! Loose ball foul on Bam Leonard during the rebound battle. [Team fouls: 1] No free throws, side out. (Bam Leonard: 1 personal fouls)

[10:36] Team_055 possession (Score: 88-80)
Devin Siakam attempts a Midrange. Contested by Jarrett McCollum (2.8 feet, MAN). DEVIN SIAKAM MAKES IT!
Score: 88-82

[10:24] Team_020 possession (Score: 88-82)
Jarrett McCollum attempts a Midrange. Contested by Jrue Sabonis (4.2 feet, ZONE). Jarrett McCollum misses. Offensive rebound by Trae Curry! Trae Curry puts it back in!
Score: 90-82

[10:11] Team_055 possession (Score: 90-82)
FOUL! Reach-in foul on Trae Curry during the drive. [Team fouls: 2] No free throws, side out. (Trae Curry: 1 personal fouls)

[10:00] Team_055 possession (Score: 90-82)
Shaquille Herro attempts a 3Pt. Contested by Bam Leonard (3.7 feet, ZONE). SHAQUILLE HERRO MAKES IT!
Score: 90-85

[09:43] Team_020 possession (Score: 90-85)
Terry Simons attempts a Layup. BLOCKED BY SHAQUILLE HERRO! Ball is loose! Rebound secured by Kevin Bane.

[09:30] Team_055 possession (Score: 90-85)
Chris Turner loses the ball! Stripped by Bam Leonard! TURNOVER! (live ball)

[09:15] Team_020 possession (Score: 90-85)
Bam Leonard attempts a Midrange. Heavily contested by Chris Turner (1.5 feet, MAN)! BAM LEONARD MAKES IT!
Score: 92-85

[09:05] Team_055 possession (Score: 92-85)
Devin Siakam attempts a 3Pt. Heavily contested by Bam Leonard (0.6 feet, ZONE)! Devin Siakam misses. Offensive rebound by Chris Turner! Chris Turner puts it back in!
Score: 92-87

[08:49] Team_020 possession (Score: 92-87)
Trae Curry attempts a Layup. Contested by Chris Turner (2.6 feet, MAN). TRAE CURRY MAKES IT! Assist: Jarrett McCollum
Score: 94-87

[08:33] Team_055 possession (Score: 94-87)
Kevin Bane drives, Trae Curry stays with him. Kevin Bane attempts a Layup. Contested by Trae Curry (5.3 feet, ZONE). Kevin Bane misses. Rebound secured by Trae Curry.

[08:22] Team_020 possession (Score: 94-87)
James Cunningham attempts a Midrange. Wide open! Kevin Bane is 6.6 feet away. [ZONE] JAMES CUNNINGHAM MAKES IT! Assist: Trae Curry
Score: 96-87

[08:08] Team_055 possession (Score: 96-87)
Chris Turner attempts a Midrange. Wide open! James Cunningham is 6.9 feet away. [ZONE] Chris Turner misses. Rebound secured by Terry Simons.

[07:54] Team_020 possession (Score: 96-87)
FOUL! Holding foul on Shaquille Herro. [Team fouls: 1] No free throws, side out. (Shaquille Herro: 1 personal fouls)

[07:43] Team_020 possession (Score: 96-87)
Terry Simons attempts a Midrange. Contested by Kevin Bane (3.4 feet, MAN). TERRY SIMONS MAKES IT!
Score: 98-87

[07:26] Team_055 possession (Score: 98-87)
Chris Turner throws a bad pass! Stolen by Bam Leonard! TURNOVER! (live ball)

[07:10] Team_020 possession (Score: 98-87)
Bam Leonard drives, picks up Chris Turner. Help arrives from Shaquille Herro! Bam Leonard attempts a Dunk. Contested by Shaquille Herro (3.3 feet, ZONE). BAM LEONARD MAKES IT!
Score: 100-87

[06:57] Team_055 possession (Score: 100-87)
Kevin Bane attempts a Midrange. Wide open! James Cunningham is 9.2 feet away. [ZONE] Kevin Bane misses. Rebound secured by Terry Simons.

[06:43] Team_020 possession (Score: 100-87)
Trae Curry attempts a Midrange. Contested by Kevin Bane (5.1 feet, ZONE). TRAE CURRY MAKES IT!
Score: 102-87

[06:27] Team_055 possession (Score: 102-87)
FOUL! Holding foul on Jarrett McCollum. [Team fouls: 3] No free throws, side out. (Jarrett McCollum: 1 personal fouls)

[06:16] Team_055 possession (Score: 102-87)
Shaquille Herro attempts a 3Pt. Wide open! James Cunningham is 8.0 feet away. [MAN] SHAQUILLE HERRO MAKES IT! Assist: Chris Turner
Score: 102-90

[05:57] Team_020 possession (Score: 102-90)
FOUL! Reach-in foul on Kevin Bane during the drive. [Team fouls: 2] No free throws, side out. (Kevin Bane: 1 personal fouls)

[05:43] Team_020 possession (Score: 102-90)
Jarrett McCollum attempts a 3Pt. Wide open! Devin Siakam is 8.5 feet away. [MAN] JARRETT MCCOLLUM MAKES IT! Assist: James Cunningham
Score: 105-90

[05:32] Team_055 possession (Score: 105-90)
Devin Siakam drives, Trae Curry stays with him. Devin Siakam attempts a Dunk. Contested by Trae Curry (3.5 feet, ZONE). Devin Siakam misses. Rebound secured by Trae Curry.

[05:18] Team_020 possession (Score: 105-90)
Trae Curry drives, Chris Turner stays with him. Trae Curry attempts a Dunk. Wide open! Chris Turner is 6.2 feet away. [MAN] Trae Curry misses. Rebound secured by Jrue Sabonis.

[05:04] Team_055 possession (Score: 105-90)
Devin Siakam attempts a 3Pt. Contested by Jarrett McCollum (3.9 feet, MAN). DEVIN SIAKAM MAKES IT! Assist: Kevin Bane
Score: 105-93

[04:52] Team_020 possession (Score: 105-93)
Terry Simons attempts a 3Pt. Contested by Kevin Bane (5.9 feet, ZONE). Terry Simons misses. Rebound secured by Kevin Bane.

[04:35] Team_055 possession (Score: 105-93)
Kevin Bane attempts a Layup. BLOCKED BY TRAE CURRY! Ball is loose! Offensive rebound by Chris Turner! Chris Turner kicks it out.

[04:25] Team_055 possession (Score: 105-93)
Devin Siakam throws a bad pass out of bounds! TURNOVER! (dead ball)

[04:25] Substitution (Team_020): Jarrett McCollum OUT → Franz Doncic IN (stamina_rule2)

[04:25] Substitution (Team_020): James Cunningham OUT → Stephen Parker IN (stamina_rule2)

[04:25] Substitution (Team_020): Terry Simons OUT → Victor Holiday IN (stamina_rule2)

[04:25] Substitution (Team_020): Bam Leonard OUT → Cole Barnes IN (stamina_rule2)

[04:25] Substitution (Team_020): Trae Curry OUT → Miles Siakam IN (stamina_rule2)

[04:25] Substitution (Team_055): Devin Siakam OUT → Luka Wall IN (stamina_rule2)

[04:25] Substitution (Team_055): Shaquille Herro OUT → Dirk Duncan IN (stamina_rule2)

[04:25] Substitution (Team_055): Kevin Bane OUT → Kyle Wall IN (stamina_rule2)

[04:25] Substitution (Team_055): Jrue Sabonis OUT → Malcolm Williamson IN (stamina_rule2)

[04:25] Substitution (Team_055): Chris Turner OUT → D'Angelo Antetokounmpo IN (stamina_rule2)

[04:13] Team_020 possession (Score: 105-93)
FOUL! Reach-in foul on Luka Wall during the drive. [Team fouls: 3] No free throws, side out. (Luka Wall: 1 personal fouls)

[03:57] Team_020 possession (Score: 105-93)
Victor Holiday drives and kicks out. Franz Doncic attempts a 3Pt. Contested by Kyle Wall (3.9 feet, ZONE). Franz Doncic misses. Rebound secured by Malcolm Williamson.

[03:45] Team_055 possession (Score: 105-93)
Luka Wall attempts a 3Pt. Heavily contested by Franz Doncic (0.5 feet, MAN)! Luka Wall misses. Rebound secured by Miles Siakam.

[03:32] Team_020 possession (Score: 105-93)
Stephen Parker attempts a 3Pt. Contested by Dirk Duncan (4.5 feet, MAN). Stephen Parker misses. Rebound secured by D'Angelo Antetokounmpo.

[03:17] Team_055 possession (Score: 105-93)
Luka Wall loses control! Ball rolls out of bounds! TURNOVER! (dead ball)

[03:02] Team_020 possession (Score: 105-93)
Miles Siakam attempts a Midrange. Contested by D'Angelo Antetokounmpo (4.2 feet, MAN). MILES SIAKAM MAKES IT!
Score: 107-93

[02:45] Team_055 possession (Score: 107-93)
Kyle Wall drives to the basket... Kyle Wall throws a bad pass out of bounds! TURNOVER! (dead ball)

[02:29] Team_020 possession (Score: 107-93)
Stephen Parker makes the Layup and draws the foul on Dirk Duncan! And-1! Stephen Parker to the line for 1. [Team fouls: 4] (Dirk Duncan: 1 personal fouls)   FT 1/1: GOOD Stephen Parker makes 1/1 from the line.
Score: 110-93

[02:16] Team_055 possession (Score: 110-93)
Malcolm Williamson attempts a Layup. BLOCKED BY MILES SIAKAM! Ball goes out off Miles Siakam. Malcolm Williamson's ball!

[02:02] Team_055 possession (Score: 110-93)
Luka Wall makes the Layup and draws the foul on Franz Doncic! And-1! Luka Wall to the line for 1. [Team fouls: 4] (Franz Doncic: 1 personal fouls)   FT 1/1: GOOD Luka Wall makes 1/1 from the line.
Score: 110-96

[01:52] Team_020 possession (Score: 110-96)
FOUL! Shooting foul on D'Angelo Antetokounmpo. Miles Siakam to the line for 2 free throws. [BONUS: 5 team fouls] (D'Angelo Antetokounmpo: 1 personal fouls)   FT 1/2: MISS   FT 2/2: GOOD Miles Siakam makes 1/2 from the line.
Score: 111-96

[01:39] Team_055 possession (Score: 111-96)
Luka Wall attempts a 3Pt. Wide open! Stephen Parker is 7.1 feet away. [ZONE] Luka Wall misses. Rebound secured by Cole Barnes.

[01:27] Team_020 possession (Score: 111-96)
Cole Barnes commits a violation (traveling/carry)! TURNOVER! (dead ball)

[01:12] Team_055 possession (Score: 111-96)
Dirk Duncan attempts a 3Pt. Contested by Stephen Parker (4.9 feet, MAN). DIRK DUNCAN MAKES IT!
Score: 111-99

[00:54] Team_020 possession (Score: 111-99)
Victor Holiday attempts a 3Pt. Wide open! Kyle Wall is 7.0 feet away. [ZONE] Victor Holiday misses. Rebound secured by Malcolm Williamson.

[00:40] Team_055 possession (Score: 111-99)
Luka Wall drives, picks up Miles Siakam. Help arrives from Franz Doncic! Luka Wall attempts a Dunk. Contested by Franz Doncic (3.4 feet, ZONE). LUKA WALL MAKES IT!
Score: 111-101

[00:29] Team_020 possession (Score: 111-101)
Miles Siakam drives, picks up D'Angelo Antetokounmpo. Help arrives from Dirk Duncan! Miles Siakam attempts a Layup. Heavily contested by Dirk Duncan (1.8 feet, MAN)! MILES SIAKAM MAKES IT!
Score: 113-101

[00:13] Team_055 possession (Score: 113-101)
Luka Wall attempts a 3Pt. Contested by Franz Doncic (4.4 feet, MAN). LUKA WALL MAKES IT! Assist: D'Angelo Antetokounmpo
Score: 113-104

================================================================================
                              4TH QUARTER COMPLETE                              
================================================================================

4TH QUARTER SCORE: Team_020 32, Team_055 24

BOX SCORE:
================================================================================

Team_020
--------------------------------------------------------------------------------
Player                MIN  PTS  REB  AST  TO      FG   FG%      3P   3P%
--------------------------------------------------------------------------------
Trae Curry             37    8    3    1   0   4/5    80.0     0/0   0.0
Bam Leonard            37    6    2    0   0   3/3   100.0     0/0   0.0
Terry Simons           37    5    2    0   0   2/4    50.0     0/0   0.0
Miles Siakam           12    5    1    0   0   3/3   100.0     0/0   0.0
Jarrett McCollum       37    3    0    2   0   1/1   100.0     0/0   0.0
Stephen Parker         12    3    0    0   0   1/2    50.0     0/0   0.0
James Cunningham       37    2    0    1   0   1/1   100.0     0/0   0.0
Victor Holiday         12    0    0    0   0   0/2     0.0     0/0   0.0
Cole Barnes            12    0    1    0   0   0/0     0.0     0/0   0.0

TEAM: FG: 15/21 (71.4%), 3PT: 2/5 (40.0%), REB: 9 (2 off, 7 def), AST: 4, TO: 1
TEAM FOULS: 4


Team_055
--------------------------------------------------------------------------------
Player                MIN  PTS  REB  AST  TO      FG   FG%      3P   3P%
--------------------------------------------------------------------------------
Luka Wall              12    8    0    0   0   3/5    60.0     0/0   0.0
Shaquille Herro        37    6    0    0   0   2/2   100.0     0/0   0.0
Devin Siakam           37    5    0    0   0   2/3    66.7     0/0   0.0
Dirk Duncan            12    3    0    0   0   1/1   100.0     0/0   0.0
Chris Turner           37    2    3    1   0   1/3    33.3     0/0   0.0
Kevin Bane             38    0    2    1   0   0/2     0.0     0/0   0.0
Jrue Sabonis           37    0    1    0   0   0/0     0.0     0/0   0.0
Malcolm Williamson     12    0    2    0   0   0/0     0.0     0/0   0.0
D'Angelo Antetokounmpo   12    0    1    1   0   0/0     0.0     0/0   0.0

TEAM: FG: 9/16 (56.2%), 3PT: 6/9 (66.7%), REB: 9 (3 off, 6 def), AST: 3, TO: 6
TEAM FOULS: 5 [Team_020 in BONUS]

================================================================================

================================================================================
                               FULL GAME COMPLETE                               
================================================================================

FINAL SCORE: Team_020 113, Team_055 104

SCORING BY QUARTER:
--------------------------------------------------------------------------------
Team                     Q1     Q2     Q3     Q4    FINAL
--------------------------------------------------------------------------------
Team_020                 27     29     25     32      113
Team_055                 24     23     33     24      104
--------------------------------------------------------------------------------

FULL GAME BOX SCORE:
================================================================================

Team_020
--------------------------------------------------------------------------------
Player                MIN  PTS  REB  AST  TO      FG   FG%      3P   3P%      FT STL BLK
--------------------------------------------------------------------------------
Jarrett McCollum       37   17    0    2   1  10/19   52.6   3/7    42.9   0/0     0   1
James Cunningham       37   11    0    7   5   5/9    55.6   1/3    33.3   0/0     0   0
Terry Simons           37   10   10    5   2   4/7    57.1   2/4    50.0   3/3     0   0
Bam Leonard            37   17    9    3   1   6/8    75.0   3/3   100.0   0/0     3   1
Trae Curry             37   30   11    3   0  12/17   70.6   0/1     0.0   2/2     2   1
Franz Doncic           12    2    0    2   1   1/1   100.0   0/0     0.0   0/0     0   0
Stephen Parker         12    3    0    1   2   1/3    33.3   0/2     0.0   1/1     0   0
Victor Holiday         12    5    1    1   0   2/4    50.0   0/1     0.0   1/1     1   0
Cole Barnes            12    6    4    0   1   2/3    66.7   2/3    66.7   1/2     0   0
Miles Siakam           12    8    8    1   0   4/6    66.7   1/1   100.0   2/5     1   1

TEAM: FG: 47/77 (61.0%), 3PT: 12/25 (48.0%), REB: 43 (11 off, 32 def), AST: 25, TO: 13


Team_055
--------------------------------------------------------------------------------
Player                MIN  PTS  REB  AST  TO      FG   FG%      3P   3P%      FT STL BLK
--------------------------------------------------------------------------------
Kevin Bane             38   13   10    3   1   7/12   58.3   2/5    40.0   1/2     1   0
Devin Siakam           37   16    0    3   2   7/14   50.0   3/7    42.9   4/4     0   0
Shaquille Herro        37   24    0    3   1   9/13   69.2   5/6    83.3   2/3     3   2
Jrue Sabonis           37    8    6    1   1   3/6    50.0   0/0     0.0   2/2     0   0
Chris Turner           37   18   10    2   4   8/13   61.5   0/2     0.0   2/2     1   3
Luka Wall              12    8    0    1   2   4/6    66.7   2/4    50.0   1/1     0   0
Dirk Duncan            12    9    2    0   0   3/6    50.0   3/5    60.0   0/0     0   0
Malcolm Williamson     12    2    5    0   2   0/1     0.0   0/1     0.0   0/0     1   0
D'Angelo Antetokounmpo   12    2    2    1   0   0/0     0.0   0/0     0.0   0/0     0   0
Kyle Wall              10    3    0    0   1   1/2    50.0   1/2    50.0   0/0     0   0

TEAM: FG: 43/75 (57.3%), 3PT: 16/32 (50.0%), REB: 35 (7 off, 28 def), AST: 14, TO: 14

================================================================================
