================================================================================
                        FULL GAME - Team_072 vs Team_020                        
================================================================================

================================================================================
                       1ST QUARTER - Team_072 vs Team_020                       
================================================================================

[12:00] Team_072 possession (Score: 0-0)
Collin Griffin throws a bad pass! Stolen by Jarrett McCollum! TURNOVER! (live ball)

[11:42] Team_020 possession (Score: 0-0)
Trae Curry makes the Layup and draws the foul on Tyrese Williamson! And-1! Trae Curry to the line for 1. [Team fouls: 1] (Tyrese Williamson: 1 personal fouls)   FT 1/1: MISS Trae Curry makes 0/1 from the line. Rebound secured by Wendell Anthony.
Score: 0-2

[11:26] Team_072 possession (Score: 0-2)
Wendell Anthony drives, Terry Simons stays with him. Wendell Anthony attempts a Layup. Contested by Terry Simons (2.5 feet, MAN). Wendell Anthony misses. Rebound secured by Terry Simons.

[11:13] Team_020 possession (Score: 0-2)
Jarrett McCollum attempts a Midrange. Contested by Collin Griffin (4.8 feet, MAN). JARRETT MCCOLLUM MAKES IT!
Score: 0-4

[10:56] Team_072 possession (Score: 0-4)
Cade Poole attempts a 3Pt. Contested by Terry Simons (4.4 feet, ZONE). CADE POOLE MAKES IT! Assist: Tracy Giddey
Score: 3-4

[10:44] Team_020 possession (Score: 3-4)
James Cunningham attempts a 3Pt. Contested by Cade Poole (2.8 feet, MAN). JAMES CUNNINGHAM MAKES IT! Assist: Bam Leonard
Score: 3-7

[10:31] Team_072 possession (Score: 3-7)
Collin Griffin attempts a Midrange. BLOCKED BY JARRETT MCCOLLUM! Ball is loose! Offensive rebound by Tracy Giddey! Tracy Giddey kicks it out.

[10:18] Team_072 possession (Score: 3-7)
Cade Poole attempts a 3Pt. Contested by Bam Leonard (2.8 feet, ZONE). Cade Poole misses. Rebound secured by Terry Simons.

[10:02] Team_020 possession (Score: 3-7)
Bam Leonard attempts a Layup. BLOCKED BY TYRESE WILLIAMSON! Ball deflects out of bounds off Bam Leonard.

[09:43] Team_072 possession (Score: 3-7)
Tracy Giddey drives and kicks out. Collin Griffin attempts a 3Pt. BLOCKED BY BAM LEONARD! Ball is loose! Rebound secured by Terry Simons.

[09:30] Team_020 possession (Score: 3-7)
James Cunningham attempts a 3Pt. Contested by Cade Poole (2.7 feet, MAN). James Cunningham misses. Rebound secured by Tracy Giddey.

[09:17] Team_072 possession (Score: 3-7)
Collin Griffin attempts a 3Pt. Contested by Bam Leonard (2.4 feet, ZONE). Collin Griffin misses. Rebound secured by Bam Leonard.

[09:06] Team_020 possession (Score: 3-7)
Terry Simons attempts a Layup. Heavily contested by Wendell Anthony (1.3 feet, MAN)! Terry Simons misses. Rebound secured by Tyrese Williamson.

[08:50] Team_072 possession (Score: 3-7)
Cade Poole drives to the basket... Cade Poole throws a bad pass! Stolen by Trae Curry! TURNOVER! (live ball)

[08:34] Team_020 possession (Score: 3-7)
Trae Curry drives, picks up Tyrese Williamson. Help arrives from Collin Griffin! Trae Curry attempts a Layup. Contested by Collin Griffin (3.8 feet, ZONE). TRAE CURRY MAKES IT!
Score: 3-9

[08:19] Team_072 possession (Score: 3-9)
Wendell Anthony attempts a 3Pt. Contested by Terry Simons (5.5 feet, MAN). Wendell Anthony misses. Offensive rebound by Tracy Giddey! Tracy Giddey kicks it out.

[08:05] Team_072 possession (Score: 3-9)
FOUL! Holding foul on Bam Leonard. [Team fouls: 2] No free throws, side out. (Bam Leonard: 1 personal fouls)

[07:52] Team_072 possession (Score: 3-9)
Collin Griffin attempts a 3Pt. Contested by Terry Simons (3.4 feet, ZONE). Collin Griffin misses. Rebound secured by Bam Leonard.

[07:38] Team_020 possession (Score: 3-9)
Terry Simons drives and kicks out. FOUL! Shooting foul on Cade Poole. James Cunningham to the line for 3 free throws. [Team fouls: 2] (Cade Poole: 1 personal fouls)   FT 1/3: GOOD   FT 2/3: GOOD   FT 3/3: GOOD James Cunningham makes 3/3 from the line.
Score: 3-12

[07:22] Team_072 possession (Score: 3-12)
FOUL! Reach-in foul on Jarrett McCollum during the drive. [Team fouls: 3] No free throws, side out. (Jarrett McCollum: 1 personal fouls)

[07:08] Team_072 possession (Score: 3-12)
Wendell Anthony drives and kicks out. Tyrese Williamson attempts a 3Pt. Contested by Bam Leonard (2.6 feet, ZONE). Tyrese Williamson misses. Rebound secured by Terry Simons.

[06:54] Team_020 possession (Score: 3-12)
Bam Leonard attempts a Midrange. Contested by Tracy Giddey (4.6 feet, MAN). BAM LEONARD MAKES IT!
Score: 3-14

[06:44] Team_072 possession (Score: 3-14)
Collin Griffin drives and kicks out. Wendell Anthony attempts a 3Pt. Contested by Terry Simons (3.6 feet, MAN). Wendell Anthony misses. Rebound secured by Trae Curry.

[06:26] Team_020 possession (Score: 3-14)
James Cunningham attempts a Layup. Heavily contested by Tracy Giddey (0.5 feet, ZONE)! James Cunningham misses. Rebound secured by Tyrese Williamson.

[06:11] Team_072 possession (Score: 3-14)
Tyrese Williamson drives, Trae Curry stays with him. Tyrese Williamson attempts a Dunk. Contested by Trae Curry (2.9 feet, ZONE). TYRESE WILLIAMSON MAKES IT! Assist: Wendell Anthony
Score: 5-14

[05:55] Team_020 possession (Score: 5-14)
Jarrett McCollum attempts a Midrange. Contested by Cade Poole (6.0 feet, ZONE). JARRETT MCCOLLUM MAKES IT! Assist: Bam Leonard
Score: 5-16

[05:41] Team_072 possession (Score: 5-16)
Wendell Anthony drives and kicks out. Tracy Giddey attempts a Midrange. Contested by Terry Simons (4.7 feet, ZONE). Tracy Giddey misses. Offensive rebound by Tracy Giddey! Tracy Giddey kicks it out.

[05:26] Team_072 possession (Score: 5-16)
FOUL! Holding foul on Bam Leonard. [Team fouls: 4] No free throws, side out. (Bam Leonard: 2 personal fouls)

[05:08] Team_072 possession (Score: 5-16)
Collin Griffin drives, Trae Curry stays with him. Collin Griffin attempts a Layup. Contested by Trae Curry (3.5 feet, ZONE). COLLIN GRIFFIN MAKES IT! Assist: Tyrese Williamson
Score: 7-16

[04:53] Team_020 possession (Score: 7-16)
Jarrett McCollum attempts a Midrange. Contested by Collin Griffin (3.2 feet, MAN). JARRETT MCCOLLUM MAKES IT! Assist: Bam Leonard
Score: 7-18

[04:39] Team_072 possession (Score: 7-18)
Tracy Giddey attempts a Layup. Contested by Bam Leonard (2.1 feet, MAN). TRACY GIDDEY MAKES IT!
Score: 9-18

[04:28] Team_020 possession (Score: 9-18)
Terry Simons attempts a 3Pt. Contested by Wendell Anthony (4.6 feet, MAN). TERRY SIMONS MAKES IT! Assist: Bam Leonard
Score: 9-21

[04:12] Team_072 possession (Score: 9-21)
Tracy Giddey attempts a 3Pt. Contested by Bam Leonard (2.1 feet, ZONE). TRACY GIDDEY MAKES IT! Assist: Cade Poole
Score: 12-21

[03:52] Team_020 possession (Score: 12-21)
Trae Curry drives and kicks out. Trae Curry attempts a 3Pt. Contested by Tyrese Williamson (3.7 feet, MAN). Trae Curry misses. Rebound secured by Tyrese Williamson.

[03:34] Team_072 possession (Score: 12-21)
Wendell Anthony attempts a Midrange. Contested by Terry Simons (2.8 feet, MAN). WENDELL ANTHONY MAKES IT! Assist: Tracy Giddey
Score: 14-21

[03:20] Team_020 possession (Score: 14-21)
Trae Curry throws a bad pass! Stolen by Tyrese Williamson! TURNOVER! (live ball)

[03:08] Team_072 possession (Score: 14-21)
Tracy Giddey attempts a 3Pt. Heavily contested by Bam Leonard (1.7 feet, MAN)! Tracy Giddey misses. Rebound secured by Trae Curry.

[02:54] Team_020 possession (Score: 14-21)
Terry Simons drives and kicks out. Jarrett McCollum attempts a 3Pt. Wide open! Collin Griffin is 7.7 feet away. [ZONE] JARRETT MCCOLLUM MAKES IT! Assist: Terry Simons
Score: 14-24

[02:38] Team_072 possession (Score: 14-24)
Tyrese Williamson loses the ball! Stripped by Bam Leonard! TURNOVER! (live ball)

[02:19] Team_020 possession (Score: 14-24)
Trae Curry attempts a Midrange. Wide open! Tyrese Williamson is 6.6 feet away. [MAN] Trae Curry misses. Offensive rebound by Trae Curry! Trae Curry puts it back in!
Score: 14-26

[02:05] Team_072 possession (Score: 14-26)
Collin Griffin drives, Trae Curry stays with him. Collin Griffin attempts a Layup. Contested by Trae Curry (2.6 feet, ZONE). COLLIN GRIFFIN MAKES IT!
Score: 16-26

[01:53] Team_020 possession (Score: 16-26)
Jarrett McCollum attempts a 3Pt. Wide open! Cade Poole is 7.8 feet away. [ZONE] Jarrett McCollum misses. Rebound secured by Tyrese Williamson.

[01:41] Team_072 possession (Score: 16-26)
Cade Poole drives and kicks out. Tracy Giddey attempts a 3Pt. Contested by Bam Leonard (3.2 feet, MAN). TRACY GIDDEY MAKES IT!
Score: 19-26

[01:30] Team_020 possession (Score: 19-26)
Bam Leonard attempts a Midrange. Wide open! Cade Poole is 6.4 feet away. [ZONE] Bam Leonard misses. Offensive rebound by Bam Leonard! Bam Leonard puts it back in!
Score: 19-28

[01:17] Team_072 possession (Score: 19-28)
Cade Poole makes the 3Pt and draws the foul on Jarrett McCollum! And-1! Cade Poole to the line for 1. [BONUS: 5 team fouls] (Jarrett McCollum: 2 personal fouls)   FT 1/1: GOOD Cade Poole makes 1/1 from the line.
Score: 23-28

[01:03] Team_020 possession (Score: 23-28)
Jarrett McCollum attempts a Layup. Contested by Collin Griffin (4.9 feet, MAN). JARRETT MCCOLLUM MAKES IT!
Score: 23-30

[00:49] Team_072 possession (Score: 23-30)
Cade Poole attempts a Midrange. Wide open! James Cunningham is 10.0 feet away. [MAN] Cade Poole misses. Rebound secured by Trae Curry.

[00:36] Team_020 possession (Score: 23-30)
Trae Curry drives, picks up Tyrese Williamson. Help arrives from Collin Griffin! Trae Curry attempts a Dunk. Contested by Collin Griffin (4.3 feet, ZONE). TRAE CURRY MAKES IT!
Score: 23-32

[00:25] Team_072 possession (Score: 23-32)
Collin Griffin attempts a Midrange. Contested by Jarrett McCollum (5.4 feet, MAN). Collin Griffin misses. Rebound secured by Trae Curry.

[00:13] Team_020 possession (Score: 23-32)
Terry Simons attempts a 3Pt. Contested by Wendell Anthony (5.7 feet, MAN). Terry Simons misses. Offensive rebound by Trae Curry! Trae Curry puts it back in!
Score: 23-34

================================================================================
                              1ST QUARTER COMPLETE                              
================================================================================

1ST QUARTER SCORE: Team_072 23, Team_020 34

BOX SCORE:
================================================================================

Team_072
--------------------------------------------------------------------------------
Player                MIN  PTS  REB  AST  TO      FG   FG%      3P   3P%
--------------------------------------------------------------------------------
Tracy Giddey           12    8    4    2   0   3/5    60.0     0/0   0.0
Cade Poole             12    7    0    1   0   2/4    50.0     0/0   0.0
Collin Griffin         12    4    0    0   0   2/6    33.3     0/0   0.0
Wendell Anthony        12    2    1    1   0   1/3    33.3     0/0   0.0
Tyrese Williamson      12    2    4    1   0   1/1   100.0     0/0   0.0

TEAM: FG: 9/19 (47.4%), 3PT: 3/7 (42.9%), REB: 9 (3 off, 6 def), AST: 5, TO: 3
TEAM FOULS: 2


Team_020
--------------------------------------------------------------------------------
Player                MIN  PTS  REB  AST  TO      FG   FG%      3P   3P%
--------------------------------------------------------------------------------
Jarrett McCollum       12   11    0    0   0   5/6    83.3     0/0   0.0
Trae Curry             12    8    6    0   0   4/6    66.7     0/0   0.0
James Cunningham       12    6    0    0   0   2/4    50.0     0/0   0.0
Bam Leonard            12    4    3    4   0   2/3    66.7     0/0   0.0
Terry Simons           12    3    4    1   0   1/2    50.0     0/0   0.0

TEAM: FG: 14/21 (66.7%), 3PT: 3/5 (60.0%), REB: 13 (3 off, 10 def), AST: 5, TO: 1
TEAM FOULS: 5 [Team_072 in BONUS]

================================================================================

================================================================================
                       2ND QUARTER - Team_072 vs Team_020                       
================================================================================

[12:00] Team_072 possession (Score: 23-34)
Cade Poole attempts a 3Pt. Contested by Bam Leonard (4.3 feet, ZONE). Cade Poole misses. Offensive rebound by Tracy Giddey! Tracy Giddey kicks it out.

[11:43] Team_072 possession (Score: 23-34)
Cade Poole attempts a 3Pt. Contested by James Cunningham (5.3 feet, MAN). Cade Poole misses. FOUL! Loose ball foul on Bam Leonard during the rebound battle. [Team fouls: 1] No free throws, side out. (Bam Leonard: 1 personal fouls)

[11:29] Team_072 possession (Score: 23-34)
Tyrese Williamson makes the Layup and draws the foul on Bam Leonard! And-1! Tyrese Williamson to the line for 1. [Team fouls: 2] (Bam Leonard: 2 personal fouls)   FT 1/1: GOOD Tyrese Williamson makes 1/1 from the line.
Score: 26-34

[11:14] Team_020 possession (Score: 26-34)
Jarrett McCollum attempts a Midrange. Contested by Collin Griffin (3.4 feet, MAN). Jarrett McCollum misses. Rebound secured by Wendell Anthony.

[11:02] Team_072 possession (Score: 26-34)
Tracy Giddey attempts a Midrange. Contested by Bam Leonard (3.8 feet, MAN). TRACY GIDDEY MAKES IT!
Score: 28-34

[10:52] Team_020 possession (Score: 28-34)
Trae Curry attempts a Midrange. Wide open! Tyrese Williamson is 7.6 feet away. [MAN] Trae Curry misses. Offensive rebound by Trae Curry! Trae Curry puts it back in!
Score: 28-36

[10:34] Team_072 possession (Score: 28-36)
FOUL! Shooting foul on Terry Simons. Wendell Anthony to the line for 2 free throws. [Team fouls: 3] (Terry Simons: 1 personal fouls)   FT 1/2: GOOD   FT 2/2: GOOD Wendell Anthony makes 2/2 from the line.
Score: 30-36

[10:21] Team_020 possession (Score: 30-36)
Trae Curry attempts a Layup. Contested by Tyrese Williamson (3.7 feet, MAN). TRAE CURRY MAKES IT!
Score: 30-38

[10:09] Team_072 possession (Score: 30-38)
Wendell Anthony attempts a 3Pt. Contested by Terry Simons (5.4 feet, MAN). Wendell Anthony misses. Rebound secured by Trae Curry.

[09:55] Team_020 possession (Score: 30-38)
Terry Simons attempts a 3Pt. Contested by Wendell Anthony (4.9 feet, MAN). Terry Simons misses. Rebound secured by Tracy Giddey.

[09:42] Team_072 possession (Score: 30-38)
Collin Griffin attempts a 3Pt. Contested by Jarrett McCollum (5.7 feet, MAN). Collin Griffin misses. Rebound secured by Bam Leonard.

[09:27] Team_020 possession (Score: 30-38)
Bam Leonard attempts a Layup. Heavily contested by Tracy Giddey (0.5 feet, MAN)! BAM LEONARD MAKES IT!
Score: 30-40

[09:15] Team_072 possession (Score: 30-40)
Tracy Giddey attempts a 3Pt. Contested by Jarrett McCollum (5.0 feet, ZONE). TRACY GIDDEY MAKES IT! Assist: Tyrese Williamson
Score: 33-40

[08:57] Team_020 possession (Score: 33-40)
Terry Simons drives and kicks out. Bam Leonard attempts a Midrange. Contested by Tracy Giddey (2.7 feet, ZONE). Bam Leonard misses. Rebound secured by Tracy Giddey.

[08:43] Team_072 possession (Score: 33-40)
Wendell Anthony attempts a 3Pt. Contested by Terry Simons (3.9 feet, MAN). WENDELL ANTHONY MAKES IT! Assist: Collin Griffin
Score: 36-40

[08:31] Team_020 possession (Score: 36-40)
Terry Simons attempts a 3Pt. Contested by Wendell Anthony (3.5 feet, MAN). TERRY SIMONS MAKES IT!
Score: 36-43

[08:11] Team_072 possession (Score: 36-43)
Tracy Giddey makes the Layup and draws the foul on Trae Curry! And-1! Tracy Giddey to the line for 1. [Team fouls: 4] (Trae Curry: 1 personal fouls)   FT 1/1: GOOD Tracy Giddey makes 1/1 from the line.
Score: 39-43

[07:56] Team_020 possession (Score: 39-43)
Bam Leonard drives to the basket... Bam Leonard throws a bad pass out of bounds! TURNOVER! (dead ball)

[07:56] Substitution (Team_072): Collin Griffin OUT → Giannis Gobert IN (stamina_rule2)

[07:56] Substitution (Team_072): Cade Poole OUT → CJ Jokic IN (stamina_rule2)

[07:56] Substitution (Team_072): Wendell Anthony OUT → CJ Bane IN (stamina_rule2)

[07:56] Substitution (Team_072): Tracy Giddey OUT → Brandon Durant IN (stamina_rule2)

[07:56] Substitution (Team_072): Tyrese Williamson OUT → Stephen Holiday IN (stamina_rule2)

[07:56] Substitution (Team_020): Jarrett McCollum OUT → Franz Doncic IN (stamina_rule2)

[07:56] Substitution (Team_020): James Cunningham OUT → Stephen Parker IN (stamina_rule2)

[07:56] Substitution (Team_020): Terry Simons OUT → Victor Holiday IN (stamina_rule2)

[07:56] Substitution (Team_020): Bam Leonard OUT → Cole Barnes IN (stamina_rule2)

[07:56] Substitution (Team_020): Trae Curry OUT → Miles Siakam IN (stamina_rule2)

[07:45] Team_072 possession (Score: 39-43)
CJ Bane attempts a 3Pt. Wide open! Stephen Parker is 8.0 feet away. [ZONE] CJ Bane misses. Rebound secured by Miles Siakam.

[07:27] Team_020 possession (Score: 39-43)
Franz Doncic drives and kicks out. Franz Doncic attempts a Midrange. Contested by CJ Jokic (3.1 feet, ZONE). FRANZ DONCIC MAKES IT! Assist: Victor Holiday
Score: 39-45

[07:11] Team_072 possession (Score: 39-45)
CJ Jokic loses the ball! Stripped by Stephen Parker! TURNOVER! (live ball)

[06:58] Team_020 possession (Score: 39-45)
Miles Siakam throws a bad pass out of bounds! TURNOVER! (dead ball)

[06:42] Team_072 possession (Score: 39-45)
FOUL! Offensive foul on CJ Bane! Victor Holiday drew the charge! [Team fouls: 1] (CJ Bane: 1 personal fouls) TURNOVER! (dead ball)

[06:29] Team_020 possession (Score: 39-45)
Miles Siakam drives, picks up Stephen Holiday. Help arrives from Giannis Gobert! Miles Siakam attempts a Dunk. Contested by Giannis Gobert (2.7 feet, MAN). MILES SIAKAM MAKES IT! Assist: Cole Barnes
Score: 39-47

[06:12] Team_072 possession (Score: 39-47)
Stephen Holiday drives, picks up Miles Siakam. Help arrives from Franz Doncic! Stephen Holiday attempts a Dunk. Heavily contested by Franz Doncic (0.5 feet, ZONE)! Stephen Holiday misses. Rebound secured by Miles Siakam.

[05:59] Team_020 possession (Score: 39-47)
Franz Doncic attempts a Layup. BLOCKED BY GIANNIS GOBERT! Ball is loose! Offensive rebound by Miles Siakam! Miles Siakam kicks it out.

[05:43] Team_020 possession (Score: 39-47)
Franz Doncic attempts a 3Pt. Contested by Giannis Gobert (4.0 feet, MAN). Franz Doncic misses. Rebound secured by Brandon Durant.

[05:29] Team_072 possession (Score: 39-47)
CJ Jokic drives, Stephen Parker stays with him. CJ Jokic attempts a Layup. Wide open! Stephen Parker is 6.2 feet away. [MAN] CJ JOKIC MAKES IT! Assist: Stephen Holiday
Score: 41-47

[05:15] Team_020 possession (Score: 41-47)
Victor Holiday attempts a 3Pt. Wide open! Giannis Gobert is 6.7 feet away. [ZONE] Victor Holiday misses. Rebound secured by CJ Jokic.

[05:05] Team_072 possession (Score: 41-47)
Stephen Holiday drives and kicks out. Giannis Gobert attempts a 3Pt. Contested by Franz Doncic (5.2 feet, MAN). Giannis Gobert misses. Offensive rebound by Stephen Holiday! Stephen Holiday kicks it out.

[04:55] Team_072 possession (Score: 41-47)
CJ Jokic attempts a 3Pt. Wide open! Stephen Parker is 7.0 feet away. [ZONE] CJ Jokic misses. Rebound secured by Victor Holiday.

[04:41] Team_020 possession (Score: 41-47)
Stephen Parker throws a bad pass out of bounds! TURNOVER! (dead ball)

[04:23] Team_072 possession (Score: 41-47)
Brandon Durant attempts a Midrange. Contested by Stephen Parker (5.5 feet, ZONE). BRANDON DURANT MAKES IT! Assist: Stephen Holiday
Score: 43-47

[04:10] Team_020 possession (Score: 43-47)
Cole Barnes drives, picks up Stephen Holiday. Help arrives from Giannis Gobert! Cole Barnes attempts a Layup. Wide open! Giannis Gobert is 6.1 feet away. [ZONE] COLE BARNES MAKES IT!
Score: 43-49

[03:54] Team_072 possession (Score: 43-49)
Stephen Holiday attempts a Midrange. Wide open! Stephen Parker is 6.2 feet away. [ZONE] STEPHEN HOLIDAY MAKES IT!
Score: 45-49

[03:37] Team_020 possession (Score: 45-49)
Stephen Parker attempts a Midrange. Wide open! Giannis Gobert is 7.9 feet away. [ZONE] Stephen Parker misses. Rebound secured by Stephen Holiday.

[03:18] Team_072 possession (Score: 45-49)
Brandon Durant makes the Layup and draws the foul on Cole Barnes! And-1! Brandon Durant to the line for 1. [BONUS: 5 team fouls] (Cole Barnes: 1 personal fouls)   FT 1/1: GOOD Brandon Durant makes 1/1 from the line.
Score: 48-49

[03:08] Team_020 possession (Score: 48-49)
Stephen Parker attempts a 3Pt. Contested by Giannis Gobert (3.2 feet, ZONE). Stephen Parker misses. Offensive rebound by Cole Barnes! Cole Barnes kicks it out.

[02:58] Team_020 possession (Score: 48-49)
FOUL! Reach-in foul on CJ Jokic during the drive. [Team fouls: 2] No free throws, side out. (CJ Jokic: 1 personal fouls)

[02:43] Team_020 possession (Score: 48-49)
Cole Barnes attempts a 3Pt. Contested by Giannis Gobert (4.5 feet, ZONE). COLE BARNES MAKES IT! Assist: Franz Doncic
Score: 48-52

[02:33] Team_072 possession (Score: 48-52)
CJ Jokic attempts a Layup. Heavily contested by Stephen Parker (1.2 feet, MAN)! CJ JOKIC MAKES IT!
Score: 50-52

[02:18] Team_020 possession (Score: 50-52)
Franz Doncic drives and kicks out. Miles Siakam attempts a 3Pt. Wide open! Giannis Gobert is 7.7 feet away. [ZONE] Miles Siakam misses. Rebound secured by Stephen Holiday.

[02:04] Team_072 possession (Score: 50-52)
CJ Bane attempts a 3Pt. Contested by Stephen Parker (2.9 feet, ZONE). CJ BANE MAKES IT!
Score: 53-52

[01:50] Team_020 possession (Score: 53-52)
Stephen Parker attempts a 3Pt. Contested by Giannis Gobert (4.1 feet, ZONE). Stephen Parker misses. Offensive rebound by Miles Siakam! Miles Siakam kicks it out.

[01:39] Team_020 possession (Score: 53-52)
Miles Siakam attempts a 3Pt. Wide open! Stephen Holiday is 7.2 feet away. [MAN] MILES SIAKAM MAKES IT! Assist: Victor Holiday
Score: 53-55

[01:23] Team_072 possession (Score: 53-55)
FOUL! Reach-in foul on Victor Holiday during the drive. [IN THE BONUS! 6 team fouls] CJ Bane to the line for 2 free throws. (Victor Holiday: 1 personal fouls)   FT 1/2: GOOD   FT 2/2: GOOD CJ Bane makes 2/2 from the line.
Score: 55-55

[01:10] Team_020 possession (Score: 55-55)
Stephen Parker throws a bad pass! Stolen by CJ Jokic! TURNOVER! (live ball)

[00:58] Team_072 possession (Score: 55-55)
CJ Jokic drives and kicks out. Stephen Holiday attempts a 3Pt. Wide open! Stephen Parker is 7.0 feet away. [ZONE] Stephen Holiday misses. Rebound secured by Cole Barnes.

[00:43] Team_020 possession (Score: 55-55)
FOUL! Holding foul on Giannis Gobert. [Team fouls: 3] No free throws, side out. (Giannis Gobert: 1 personal fouls)

[00:26] Team_020 possession (Score: 55-55)
Stephen Parker attempts a 3Pt. Wide open! CJ Jokic is 7.8 feet away. [MAN] Stephen Parker misses. Rebound secured by Stephen Holiday.

[00:12] Team_072 possession (Score: 55-55)
Brandon Durant attempts a 3Pt. Wide open! Cole Barnes is 7.9 feet away. [MAN] Brandon Durant misses. Rebound secured by Miles Siakam.

================================================================================
                              2ND QUARTER COMPLETE                              
================================================================================

2ND QUARTER SCORE: Team_072 32, Team_020 21

BOX SCORE:
================================================================================

Team_072
--------------------------------------------------------------------------------
Player                MIN  PTS  REB  AST  TO      FG   FG%      3P   3P%
--------------------------------------------------------------------------------
Tracy Giddey           16    8    3    0   0   3/3   100.0     0/0   0.0
Wendell Anthony        16    5    1    0   0   2/3    66.7     0/0   0.0
CJ Bane                 8    5    0    0   0   2/3    66.7     0/0   0.0
Brandon Durant          8    5    1    0   0   2/3    66.7     0/0   0.0
CJ Jokic                8    4    1    0   0   2/4    50.0     0/0   0.0
Tyrese Williamson      16    3    1    1   0   1/1   100.0     0/0   0.0
Stephen Holiday         8    2    4    2   0   1/2    50.0     0/0   0.0
Collin Griffin         16    0    0    1   0   0/1     0.0     0/0   0.0

TEAM: FG: 13/20 (65.0%), 3PT: 3/8 (37.5%), REB: 11 (3 off, 8 def), AST: 4, TO: 2
TEAM FOULS: 3


Team_020
--------------------------------------------------------------------------------
Player                MIN  PTS  REB  AST  TO      FG   FG%      3P   3P%
--------------------------------------------------------------------------------
Miles Siakam            8    5    5    0   0   2/2   100.0     0/0   0.0
Cole Barnes             8    5    2    1   0   2/2   100.0     0/0   0.0
Trae Curry             16    4    2    0   0   2/2   100.0     0/0   0.0
Terry Simons           16    3    0    0   0   1/3    33.3     0/0   0.0
Bam Leonard            16    2    1    0   0   1/1   100.0     0/0   0.0
Franz Doncic            8    2    0    1   0   1/3    33.3     0/0   0.0
Jarrett McCollum       16    0    0    0   0   0/1     0.0     0/0   0.0
Victor Holiday          8    0    1    2   0   0/1     0.0     0/0   0.0
Stephen Parker          8    0    0    0   0   0/2     0.0     0/0   0.0

TEAM: FG: 9/17 (52.9%), 3PT: 3/7 (42.9%), REB: 11 (4 off, 7 def), AST: 4, TO: 4
TEAM FOULS: 6 [Team_072 in BONUS]

================================================================================

================================================================================
                       3RD QUARTER - Team_072 vs Team_020                       
================================================================================

[12:00] Team_072 possession (Score: 55-55)
Tyrese Williamson loses the ball! Stripped by Bam Leonard! TURNOVER! (live ball)

[11:46] Team_020 possession (Score: 55-55)
Bam Leonard attempts a Midrange. Wide open! Wendell Anthony is 6.6 feet away. [ZONE] BAM LEONARD MAKES IT!
Score: 55-57

[11:30] Team_072 possession (Score: 55-57)
FOUL! Offensive foul on Tyrese Williamson! Bam Leonard drew the charge! [Team fouls: 1] (Tyrese Williamson: 1 personal fouls) TURNOVER! (dead ball)

[11:16] Team_020 possession (Score: 55-57)
Terry Simons attempts a 3Pt. Contested by Wendell Anthony (4.8 feet, MAN). Terry Simons misses. Rebound secured by Tracy Giddey.

[11:06] Team_072 possession (Score: 55-57)
Tyrese Williamson attempts a Layup. Contested by Trae Curry (4.7 feet, ZONE). TYRESE WILLIAMSON MAKES IT! Assist: Tracy Giddey
Score: 57-57

[10:47] Team_020 possession (Score: 57-57)
Trae Curry attempts a Midrange. Contested by Tyrese Williamson (3.5 feet, MAN). Trae Curry misses. Rebound secured by Tyrese Williamson.

[10:36] Team_072 possession (Score: 57-57)
Collin Griffin attempts a 3Pt. Contested by Bam Leonard (3.4 feet, ZONE). Collin Griffin misses. Rebound secured by Terry Simons.

[10:22] Team_020 possession (Score: 57-57)
Trae Curry attempts a Midrange. Wide open! Tracy Giddey is 6.2 feet away. [ZONE] Trae Curry misses. Rebound secured by Tyrese Williamson.

[10:04] Team_072 possession (Score: 57-57)
Cade Poole attempts a 3Pt. Contested by Bam Leonard (5.1 feet, ZONE). Cade Poole misses. Rebound secured by Bam Leonard.

[09:48] Team_020 possession (Score: 57-57)
Trae Curry attempts a Midrange. Contested by Tyrese Williamson (3.8 feet, MAN). Trae Curry misses. Rebound secured by Wendell Anthony.

[09:38] Team_072 possession (Score: 57-57)
Wendell Anthony attempts a 3Pt. Heavily contested by Bam Leonard (1.0 feet, ZONE)! Wendell Anthony misses. Rebound secured by Trae Curry.

[09:23] Team_020 possession (Score: 57-57)
FOUL! Shooting foul on Tyrese Williamson. Terry Simons to the line for 2 free throws. [Team fouls: 2] (Tyrese Williamson: 2 personal fouls)   FT 1/2: GOOD   FT 2/2: GOOD Terry Simons makes 2/2 from the line.
Score: 57-59

[09:13] Team_072 possession (Score: 57-59)
Tyrese Williamson drives to the basket... Tyrese Williamson throws a bad pass out of bounds! TURNOVER! (dead ball)

[09:02] Team_020 possession (Score: 57-59)
Trae Curry drives and kicks out. Terry Simons attempts a Midrange. Wide open! Wendell Anthony is 6.0 feet away. [MAN] TERRY SIMONS MAKES IT! Assist: Bam Leonard
Score: 57-61

[08:46] Team_072 possession (Score: 57-61)
Cade Poole drives, James Cunningham stays with him. Cade Poole attempts a Dunk. Wide open! James Cunningham is 6.6 feet away. [MAN] CADE POOLE MAKES IT! Assist: Collin Griffin
Score: 59-61

[08:34] Team_020 possession (Score: 59-61)
James Cunningham throws a bad pass! Stolen by Cade Poole! TURNOVER! (live ball)

[08:20] Team_072 possession (Score: 59-61)
Tyrese Williamson attempts a Layup. BLOCKED BY BAM LEONARD! Ball deflects out of bounds off Tyrese Williamson.

[08:06] Team_020 possession (Score: 59-61)
Bam Leonard attempts a 3Pt. Contested by Wendell Anthony (4.3 feet, ZONE). Bam Leonard misses. Rebound secured by Tracy Giddey.

[07:51] Team_072 possession (Score: 59-61)
Tracy Giddey attempts a Dunk. BLOCKED BY JARRETT MCCOLLUM! Ball is loose! Rebound secured by Bam Leonard.

[07:40] Team_020 possession (Score: 59-61)
Jarrett McCollum drives, Collin Griffin stays with him. Jarrett McCollum attempts a Dunk. Contested by Collin Griffin (3.7 feet, MAN). JARRETT MCCOLLUM MAKES IT!
Score: 59-63

[07:27] Team_072 possession (Score: 59-63)
Tracy Giddey drives, picks up Bam Leonard. Help arrives from Jarrett McCollum! Tracy Giddey attempts a Dunk. Heavily contested by Jarrett McCollum (1.2 feet, MAN)! Tracy Giddey misses. Offensive rebound by Tracy Giddey! Tracy Giddey kicks it out.

[07:12] Team_072 possession (Score: 59-63)
Cade Poole drives to the basket... Cade Poole throws a bad pass! Stolen by Trae Curry! TURNOVER! (live ball)

[06:58] Team_020 possession (Score: 59-63)
James Cunningham attempts a 3Pt. Contested by Cade Poole (4.7 feet, ZONE). JAMES CUNNINGHAM MAKES IT! Assist: Bam Leonard
Score: 59-66

[06:41] Team_072 possession (Score: 59-66)
Tracy Giddey attempts a 3Pt. Contested by Bam Leonard (3.4 feet, MAN). Tracy Giddey misses. Offensive rebound by Tyrese Williamson! Tyrese Williamson kicks it out.

[06:28] Team_072 possession (Score: 59-66)
Collin Griffin attempts a Layup. BLOCKED BY BAM LEONARD! Ball goes out off Bam Leonard. Collin Griffin's ball!

[06:17] Team_072 possession (Score: 59-66)
Tyrese Williamson drives and kicks out. Wendell Anthony attempts a Midrange. Contested by Trae Curry (5.2 feet, ZONE). Wendell Anthony misses. Rebound secured by Bam Leonard.

[05:58] Team_020 possession (Score: 59-66)
Jarrett McCollum attempts a 3Pt. Wide open! Collin Griffin is 6.4 feet away. [MAN] JARRETT MCCOLLUM MAKES IT! Assist: Trae Curry
Score: 59-69

[05:43] Team_072 possession (Score: 59-69)
Wendell Anthony attempts a Midrange. Heavily contested by Bam Leonard (1.1 feet, ZONE)! WENDELL ANTHONY MAKES IT!
Score: 61-69

[05:25] Team_020 possession (Score: 61-69)
Trae Curry drives and kicks out. Bam Leonard attempts a 3Pt. Wide open! Tracy Giddey is 8.0 feet away. [MAN] Bam Leonard misses. Rebound secured by Tyrese Williamson.

[05:13] Team_072 possession (Score: 61-69)
Cade Poole drives to the basket... FOUL! Offensive foul on Cade Poole! Trae Curry drew the charge! [Team fouls: 3] (Cade Poole: 1 personal fouls) TURNOVER! (dead ball)

[05:01] Team_020 possession (Score: 61-69)
Trae Curry drives, Tyrese Williamson stays with him. Trae Curry attempts a Layup. Wide open! Tyrese Williamson is 7.0 feet away. [MAN] TRAE CURRY MAKES IT!
Score: 61-71

[04:50] Team_072 possession (Score: 61-71)
Tyrese Williamson attempts a Midrange. Contested by Bam Leonard (4.1 feet, ZONE). TYRESE WILLIAMSON MAKES IT! Assist: Collin Griffin
Score: 63-71

[04:35] Team_020 possession (Score: 63-71)
James Cunningham attempts a 3Pt. Contested by Cade Poole (3.8 feet, MAN). James Cunningham misses. Rebound secured by Wendell Anthony.

[04:20] Team_072 possession (Score: 63-71)
Collin Griffin drives to the basket... Collin Griffin loses control! Ball rolls out of bounds! TURNOVER! (dead ball)

[04:07] Team_020 possession (Score: 63-71)
Terry Simons drives and kicks out. James Cunningham attempts a 3Pt. Wide open! Cade Poole is 6.2 feet away. [MAN] James Cunningham misses. Rebound secured by Wendell Anthony.

[03:52] Team_072 possession (Score: 63-71)
Cade Poole makes the Dunk and draws the foul on James Cunningham! And-1! Cade Poole to the line for 1. [Team fouls: 1] (James Cunningham: 1 personal fouls)   FT 1/1: GOOD Cade Poole makes 1/1 from the line.
Score: 66-71

[03:36] Team_020 possession (Score: 66-71)
Bam Leonard attempts a Midrange. Contested by Tracy Giddey (4.8 feet, ZONE). Bam Leonard misses. Offensive rebound by Trae Curry! Trae Curry puts it back in!
Score: 66-73

[03:26] Team_072 possession (Score: 66-73)
Collin Griffin attempts a 3Pt. Contested by Bam Leonard (3.0 feet, ZONE). Collin Griffin misses. Rebound secured by Bam Leonard.

[03:12] Team_020 possession (Score: 66-73)
FOUL! Reach-in foul on Tyrese Williamson during the drive. [Team fouls: 4] No free throws, side out. (Tyrese Williamson: 3 personal fouls)

[02:58] Team_020 possession (Score: 66-73)
James Cunningham attempts a 3Pt. Contested by Cade Poole (4.0 feet, MAN). James Cunningham misses. Rebound secured by Wendell Anthony.

[02:47] Team_072 possession (Score: 66-73)
Wendell Anthony drives to the basket... Wendell Anthony loses the ball! Stripped by Terry Simons! TURNOVER! (live ball)

[02:34] Team_020 possession (Score: 66-73)
Bam Leonard loses control! Ball rolls out of bounds! TURNOVER! (dead ball)

[02:34] Substitution (Team_072): Collin Griffin OUT → Giannis Gobert IN (stamina_rule2)

[02:34] Substitution (Team_072): Cade Poole OUT → CJ Jokic IN (stamina_rule2)

[02:34] Substitution (Team_072): Wendell Anthony OUT → CJ Bane IN (stamina_rule2)

[02:34] Substitution (Team_072): Tyrese Williamson OUT → Stephen Holiday IN (stamina_rule2)

[02:34] Substitution (Team_020): Jarrett McCollum OUT → Franz Doncic IN (stamina_rule2)

[02:34] Substitution (Team_020): James Cunningham OUT → Stephen Parker IN (stamina_rule2)

[02:34] Substitution (Team_020): Terry Simons OUT → Victor Holiday IN (stamina_rule2)

[02:34] Substitution (Team_020): Bam Leonard OUT → Cole Barnes IN (stamina_rule2)

[02:34] Substitution (Team_020): Trae Curry OUT → Miles Siakam IN (stamina_rule2)

[02:21] Team_072 possession (Score: 66-73)
Tracy Giddey attempts a 3Pt. Wide open! Cole Barnes is 7.6 feet away. [MAN] TRACY GIDDEY MAKES IT! Assist: Giannis Gobert
Score: 69-73

[02:08] Team_020 possession (Score: 69-73)
Victor Holiday attempts a 3Pt. Contested by Tracy Giddey (5.3 feet, ZONE). Victor Holiday misses. Rebound secured by Tracy Giddey.

[01:59] Team_072 possession (Score: 69-73)
CJ Bane attempts a 3Pt. Wide open! Stephen Parker is 6.7 feet away. [ZONE] CJ BANE MAKES IT!
Score: 72-73

[01:43] Team_020 possession (Score: 72-73)
FOUL! Reach-in foul on CJ Bane during the drive. [IN THE BONUS! 5 team fouls] Victor Holiday to the line for 2 free throws. (CJ Bane: 1 personal fouls)   FT 1/2: GOOD   FT 2/2: GOOD Victor Holiday makes 2/2 from the line.
Score: 72-75

[01:28] Team_072 possession (Score: 72-75)
CJ Jokic attempts a 3Pt. Contested by Stephen Parker (5.3 feet, ZONE). CJ Jokic misses. Rebound secured by Miles Siakam.

[01:14] Team_020 possession (Score: 72-75)
Cole Barnes makes the Layup and draws the foul on Stephen Holiday! And-1! Cole Barnes to the line for 1. [BONUS: 6 team fouls] (Stephen Holiday: 1 personal fouls)   FT 1/1: MISS Cole Barnes makes 0/1 from the line. Rebound secured by Tracy Giddey.
Score: 72-77

[01:00] Team_072 possession (Score: 72-77)
Tracy Giddey attempts a 3Pt. Wide open! Stephen Parker is 6.4 feet away. [ZONE] Tracy Giddey misses. Rebound secured by Victor Holiday.

[00:46] Team_020 possession (Score: 72-77)
Miles Siakam attempts a Layup. BLOCKED BY STEPHEN HOLIDAY! Ball is loose! Rebound secured by Tracy Giddey.

[00:30] Team_072 possession (Score: 72-77)
CJ Bane attempts a 3Pt. Contested by Victor Holiday (4.2 feet, MAN). CJ Bane misses. Rebound secured by Miles Siakam.

[00:16] Team_020 possession (Score: 72-77)
Miles Siakam drives, picks up Stephen Holiday. Help arrives from Giannis Gobert! Miles Siakam attempts a Dunk. Contested by Giannis Gobert (5.0 feet, MAN). MILES SIAKAM MAKES IT!
Score: 72-79

[00:03] Team_072 possession (Score: 72-79)
CJ Bane attempts a 3Pt. Contested by Cole Barnes (3.1 feet, ZONE). CJ Bane misses. Offensive rebound by Tracy Giddey! Tracy Giddey kicks it out.

================================================================================
                              3RD QUARTER COMPLETE                              
================================================================================

3RD QUARTER SCORE: Team_072 17, Team_020 24

BOX SCORE:
================================================================================

Team_072
--------------------------------------------------------------------------------
Player                MIN  PTS  REB  AST  TO      FG   FG%      3P   3P%
--------------------------------------------------------------------------------
Cade Poole             26    5    0    0   0   2/3    66.7     0/0   0.0
Tyrese Williamson      26    4    4    0   0   2/4    50.0     0/0   0.0
Tracy Giddey           29    3    7    1   0   1/3    33.3     0/0   0.0
CJ Bane                10    3    0    0   0   1/2    50.0     0/0   0.0
Wendell Anthony        26    2    4    0   0   1/2    50.0     0/0   0.0
Collin Griffin         26    0    0    2   0   0/2     0.0     0/0   0.0
Giannis Gobert         10    0    0    1   0   0/0     0.0     0/0   0.0
CJ Jokic               10    0    0    0   0   0/1     0.0     0/0   0.0

TEAM: FG: 7/17 (41.2%), 3PT: 2/9 (22.2%), REB: 15 (3 off, 12 def), AST: 4, TO: 7
TEAM FOULS: 6 [Team_020 in BONUS]


Team_020
--------------------------------------------------------------------------------
Player                MIN  PTS  REB  AST  TO      FG   FG%      3P   3P%
--------------------------------------------------------------------------------
Jarrett McCollum       26    5    0    0   0   2/2   100.0     0/0   0.0
Terry Simons           26    4    1    0   0   2/4    50.0     0/0   0.0
Trae Curry             26    4    2    1   0   2/6    33.3     0/0   0.0
James Cunningham       26    3    0    0   0   1/3    33.3     0/0   0.0
Bam Leonard            26    2    4    2   0   1/2    50.0     0/0   0.0
Victor Holiday         10    2    1    0   0   1/2    50.0     0/0   0.0
Miles Siakam           10    2    2    0   0   1/2    50.0     0/0   0.0
Cole Barnes            10    0    0    0   0   0/1     0.0     0/0   0.0

TEAM: FG: 10/22 (45.5%), 3PT: 2/7 (28.6%), REB: 10 (1 off, 9 def), AST: 3, TO: 2
TEAM FOULS: 1

================================================================================

================================================================================
                       4TH QUARTER - Team_072 vs Team_020                       
================================================================================

[12:00] Team_072 possession (Score: 72-79)
Wendell Anthony attempts a 3Pt. Contested by Bam Leonard (3.5 feet, ZONE). Wendell Anthony misses. Rebound secured by Bam Leonard.

[11:42] Team_020 possession (Score: 72-79)
Jarrett McCollum drives and kicks out. Terry Simons attempts a 3Pt. Wide open! Wendell Anthony is 7.0 feet away. [MAN] Terry Simons misses. Rebound secured by Wendell Anthony.

[11:30] Team_072 possession (Score: 72-79)
Tracy Giddey attempts a Layup. BLOCKED BY TRAE CURRY! Ball is loose! Offensive rebound by Wendell Anthony! Wendell Anthony kicks it out.

[11:16] Team_072 possession (Score: 72-79)
FOUL! Holding foul on Bam Leonard. [Team fouls: 2] No free throws, side out. (Bam Leonard: 1 personal fouls)

[11:00] Team_072 possession (Score: 72-79)
Tyrese Williamson drives, Bam Leonard stays with him. Tyrese Williamson attempts a Dunk. Heavily contested by Bam Leonard (0.5 feet, MAN)! TYRESE WILLIAMSON MAKES IT! Assist: Cade Poole
Score: 74-79

[10:45] Team_020 possession (Score: 74-79)
Trae Curry attempts a Midrange. Contested by Wendell Anthony (4.5 feet, ZONE). TRAE CURRY MAKES IT! Assist: James Cunningham
Score: 74-81

[10:31] Team_072 possession (Score: 74-81)
Tyrese Williamson drives and kicks out. Collin Griffin attempts a Midrange. Contested by Jarrett McCollum (3.4 feet, MAN). Collin Griffin misses. Rebound secured by Terry Simons.

[10:16] Team_020 possession (Score: 74-81)
Terry Simons attempts a Midrange. Contested by Cade Poole (5.8 feet, ZONE). Terry Simons misses. Rebound secured by Wendell Anthony.

[09:59] Team_072 possession (Score: 74-81)
Tyrese Williamson drives, Bam Leonard stays with him. Tyrese Williamson attempts a Dunk. Contested by Bam Leonard (5.6 feet, MAN). Tyrese Williamson misses. Rebound secured by Terry Simons.

[09:44] Team_020 possession (Score: 74-81)
James Cunningham attempts a 3Pt. Contested by Collin Griffin (5.1 feet, ZONE). James Cunningham misses. Rebound secured by Tyrese Williamson.

[09:28] Team_072 possession (Score: 74-81)
Tracy Giddey attempts a 3Pt. Heavily contested by Bam Leonard (1.6 feet, ZONE)! Tracy Giddey misses. Rebound secured by Bam Leonard.

[09:16] Team_020 possession (Score: 74-81)
Trae Curry drives to the basket... FOUL! Offensive foul on Trae Curry! Tyrese Williamson drew the charge! [Team fouls: 3] (Trae Curry: 1 personal fouls) TURNOVER! (dead ball)

[09:03] Team_072 possession (Score: 74-81)
Cade Poole attempts a 3Pt. Contested by Bam Leonard (4.4 feet, ZONE). CADE POOLE MAKES IT! Assist: Collin Griffin
Score: 77-81

[08:45] Team_020 possession (Score: 77-81)
Jarrett McCollum drives and kicks out. Trae Curry makes the Midrange and draws the foul on Wendell Anthony! And-1! Trae Curry to the line for 1. [Team fouls: 1] (Wendell Anthony: 1 personal fouls)   FT 1/1: GOOD Trae Curry makes 1/1 from the line.
Score: 77-84

[08:28] Team_072 possession (Score: 77-84)
Tyrese Williamson makes the Layup and draws the foul on Bam Leonard! And-1! Tyrese Williamson to the line for 1. [Team fouls: 4] (Bam Leonard: 2 personal fouls)   FT 1/1: MISS Tyrese Williamson makes 0/1 from the line. Rebound secured by Trae Curry.
Score: 79-84

[08:11] Team_020 possession (Score: 79-84)
Bam Leonard throws a bad pass out of bounds! TURNOVER! (dead ball)

[08:11] Substitution (Team_072): Collin Griffin OUT → Giannis Gobert IN (stamina_rule2)

[08:11] Substitution (Team_072): Cade Poole OUT → CJ Jokic IN (stamina_rule2)

[08:11] Substitution (Team_072): Wendell Anthony OUT → CJ Bane IN (stamina_rule2)

[08:11] Substitution (Team_072): Tracy Giddey OUT → Brandon Durant IN (stamina_rule2)

[08:11] Substitution (Team_072): Tyrese Williamson OUT → Stephen Holiday IN (stamina_rule2)

[08:11] Substitution (Team_020): Jarrett McCollum OUT → Franz Doncic IN (stamina_rule2)

[08:11] Substitution (Team_020): James Cunningham OUT → Stephen Parker IN (stamina_rule2)

[08:11] Substitution (Team_020): Terry Simons OUT → Victor Holiday IN (stamina_rule2)

[08:11] Substitution (Team_020): Bam Leonard OUT → Cole Barnes IN (stamina_rule2)

[08:11] Substitution (Team_020): Trae Curry OUT → Miles Siakam IN (stamina_rule2)

[07:55] Team_072 possession (Score: 79-84)
FOUL! Reach-in foul on Miles Siakam during the drive. [IN THE BONUS! 5 team fouls] CJ Bane to the line for 2 free throws. (Miles Siakam: 1 personal fouls)   FT 1/2: GOOD   FT 2/2: GOOD CJ Bane makes 2/2 from the line.
Score: 81-84

[07:41] Team_020 possession (Score: 81-84)
FOUL! Offensive foul on Cole Barnes! Brandon Durant drew the charge! [Team fouls: 6] (Cole Barnes: 1 personal fouls) TURNOVER! (dead ball)

[07:26] Team_072 possession (Score: 81-84)
CJ Bane drives and kicks out. Brandon Durant attempts a 3Pt. Wide open! Cole Barnes is 6.5 feet away. [MAN] Brandon Durant misses. Rebound secured by Miles Siakam.

[07:12] Team_020 possession (Score: 81-84)
Victor Holiday attempts a 3Pt. Wide open! CJ Bane is 6.8 feet away. [MAN] VICTOR HOLIDAY MAKES IT! Assist: Cole Barnes
Score: 81-87

[06:58] Team_072 possession (Score: 81-87)
CJ Bane drives, picks up Victor Holiday. Help arrives from Franz Doncic! CJ Bane attempts a Layup. Contested by Franz Doncic (3.8 feet, MAN). CJ BANE MAKES IT! Assist: Brandon Durant
Score: 83-87

[06:45] Team_020 possession (Score: 83-87)
Victor Holiday attempts a 3Pt. Contested by CJ Bane (4.0 feet, MAN). Victor Holiday misses. Rebound secured by Stephen Holiday.

[06:28] Team_072 possession (Score: 83-87)
CJ Jokic attempts a 3Pt. Contested by Victor Holiday (3.5 feet, ZONE). CJ Jokic misses. Rebound secured by Miles Siakam.

[06:11] Team_020 possession (Score: 83-87)
Franz Doncic attempts a 3Pt. Wide open! Giannis Gobert is 8.1 feet away. [ZONE] Franz Doncic misses. Rebound secured by Stephen Holiday.

[06:00] Team_072 possession (Score: 83-87)
Giannis Gobert attempts a 3Pt. Contested by Franz Doncic (5.8 feet, MAN). Giannis Gobert misses. Rebound secured by Miles Siakam.

[05:45] Team_020 possession (Score: 83-87)
Victor Holiday drives, picks up Stephen Holiday. Help arrives from Giannis Gobert! Victor Holiday attempts a Layup. Contested by Giannis Gobert (3.7 feet, ZONE). Victor Holiday misses. Offensive rebound by Miles Siakam! Miles Siakam kicks it out.

[05:28] Team_020 possession (Score: 83-87)
Victor Holiday drives, Stephen Holiday stays with him. Victor Holiday attempts a Layup. Contested by Stephen Holiday (3.8 feet, ZONE). VICTOR HOLIDAY MAKES IT!
Score: 83-89

[05:17] Team_072 possession (Score: 83-89)
Stephen Holiday attempts a Midrange. Wide open! Miles Siakam is 7.7 feet away. [MAN] STEPHEN HOLIDAY MAKES IT! Assist: Giannis Gobert
Score: 85-89

[05:01] Team_020 possession (Score: 85-89)
Stephen Parker attempts a 3Pt. Contested by Giannis Gobert (3.6 feet, ZONE). Stephen Parker misses. Rebound secured by CJ Jokic.

[04:44] Team_072 possession (Score: 85-89)
Stephen Holiday attempts a Midrange. Wide open! Victor Holiday is 6.1 feet away. [ZONE] Stephen Holiday misses. Rebound secured by Cole Barnes.

[04:31] Team_020 possession (Score: 85-89)
Cole Barnes attempts a 3Pt. Contested by Giannis Gobert (2.3 feet, ZONE). COLE BARNES MAKES IT! Assist: Franz Doncic
Score: 85-92

[04:20] Team_072 possession (Score: 85-92)
CJ Bane attempts a Midrange. Wide open! Victor Holiday is 9.2 feet away. [MAN] CJ Bane misses. Offensive rebound by Stephen Holiday! Stephen Holiday kicks it out.

[04:06] Team_072 possession (Score: 85-92)
FOUL! Reach-in foul on Miles Siakam during the drive. [IN THE BONUS! 7 team fouls] Stephen Holiday to the line for 2 free throws. (Miles Siakam: 2 personal fouls)   FT 1/2: GOOD   FT 2/2: GOOD Stephen Holiday makes 2/2 from the line.
Score: 87-92

[03:53] Team_020 possession (Score: 87-92)
Stephen Parker drives, picks up CJ Jokic. Help arrives from CJ Bane! Stephen Parker attempts a Layup. Contested by CJ Bane (3.8 feet, MAN). Stephen Parker misses. Rebound secured by Stephen Holiday.

[03:40] Team_072 possession (Score: 87-92)
Brandon Durant drives, Miles Siakam stays with him. Brandon Durant attempts a Dunk. Contested by Miles Siakam (3.1 feet, ZONE). Brandon Durant misses. Rebound secured by Victor Holiday.

[03:26] Team_020 possession (Score: 87-92)
Cole Barnes attempts a 3Pt. Heavily contested by Brandon Durant (1.3 feet, MAN)! Cole Barnes misses. Offensive rebound by Miles Siakam! Miles Siakam kicks it out.

[03:13] Team_020 possession (Score: 87-92)
Franz Doncic attempts a Layup. Heavily contested by Stephen Holiday (0.5 feet, ZONE)! FRANZ DONCIC MAKES IT! Assist: Stephen Parker
Score: 87-94

[03:01] Team_072 possession (Score: 87-94)
Brandon Durant attempts a Midrange. Contested by Cole Barnes (3.5 feet, ZONE). Brandon Durant misses. Rebound secured by Cole Barnes.

[02:47] Team_020 possession (Score: 87-94)
Miles Siakam drives, Stephen Holiday stays with him. Miles Siakam attempts a Layup. Contested by Stephen Holiday (3.3 feet, MAN). Miles Siakam misses. Offensive rebound by Miles Siakam! Miles Siakam kicks it out.

[02:32] Team_020 possession (Score: 87-94)
Stephen Parker drives to the basket... Stephen Parker commits a violation (traveling/carry)! TURNOVER! (dead ball)

[02:20] Team_072 possession (Score: 87-94)
CJ Bane attempts a 3Pt. Heavily contested by Victor Holiday (1.5 feet, MAN)! CJ Bane misses. Offensive rebound by Stephen Holiday! Stephen Holiday kicks it out.

[02:05] Team_072 possession (Score: 87-94)
CJ Bane makes the Dunk and draws the foul on Victor Holiday! And-1! CJ Bane to the line for 1. [BONUS: 8 team fouls] (Victor Holiday: 1 personal fouls)   FT 1/1: GOOD CJ Bane makes 1/1 from the line.
Score: 90-94

[01:48] Team_020 possession (Score: 90-94)
Miles Siakam attempts a Layup. Heavily contested by Stephen Holiday (1.6 feet, MAN)! Miles Siakam misses. Rebound secured by Stephen Holiday.

[01:37] Team_072 possession (Score: 90-94)
Giannis Gobert drives and kicks out. CJ Jokic attempts a 3Pt. Wide open! Stephen Parker is 6.5 feet away. [MAN] CJ Jokic misses. Offensive rebound by Stephen Holiday! Stephen Holiday kicks it out.

[01:23] Team_072 possession (Score: 90-94)
CJ Bane drives to the basket... FOUL! Offensive foul on CJ Bane! Victor Holiday drew the charge! [Team fouls: 2] (CJ Bane: 1 personal fouls) TURNOVER! (dead ball)

[01:08] Team_020 possession (Score: 90-94)
Cole Barnes attempts a Midrange. Contested by Brandon Durant (4.9 feet, MAN). Cole Barnes misses. Rebound secured by Stephen Holiday.

[00:53] Team_072 possession (Score: 90-94)
Brandon Durant drives, Cole Barnes stays with him. Brandon Durant attempts a Layup. Heavily contested by Cole Barnes (1.4 feet, ZONE)! Brandon Durant misses. Rebound secured by Miles Siakam.

[00:38] Team_020 possession (Score: 90-94)
Victor Holiday attempts a 3Pt. Wide open! Giannis Gobert is 8.5 feet away. [ZONE] Victor Holiday misses. Rebound secured by Brandon Durant.

[00:28] Team_072 possession (Score: 90-94)
Giannis Gobert drives and kicks out. CJ Jokic attempts a Midrange. Wide open! Cole Barnes is 7.4 feet away. [ZONE] CJ Jokic misses. Rebound secured by Cole Barnes.

[00:17] Team_020 possession (Score: 90-94)
Stephen Parker attempts a 3Pt. Wide open! Giannis Gobert is 8.4 feet away. [ZONE] Stephen Parker misses. Rebound secured by Stephen Holiday.

[00:04] Team_072 possession (Score: 90-94)
Brandon Durant attempts a 3Pt. Wide open! Cole Barnes is 8.2 feet away. [MAN] BRANDON DURANT MAKES IT! Assist: CJ Jokic
Score: 93-94

================================================================================
                              4TH QUARTER COMPLETE                              
================================================================================

4TH QUARTER SCORE: Team_072 21, Team_020 15

BOX SCORE:
================================================================================

Team_072
--------------------------------------------------------------------------------
Player                MIN  PTS  REB  AST  TO      FG   FG%      3P   3P%
--------------------------------------------------------------------------------
CJ Bane                18    7    0    0   0   3/4    75.0     0/0   0.0
Stephen Holiday        18    4    9    0   0   2/3    66.7     0/0   0.0
Cade Poole             30    3    0    1   0   1/1   100.0     0/0   0.0
Brandon Durant         16    3    1    1   0   1/4    25.0     0/0   0.0
Tyrese Williamson      30    2    1    0   0   1/4    25.0     0/0   0.0
Wendell Anthony        30    0    3    0   0   0/1     0.0     0/0   0.0
Tracy Giddey           33    0    0    0   0   0/1     0.0     0/0   0.0
Collin Griffin         30    0    0    1   0   0/0     0.0     0/0   0.0
CJ Jokic               18    0    1    1   0   0/1     0.0     0/0   0.0
Giannis Gobert         18    0    0    1   0   0/2     0.0     0/0   0.0

TEAM: FG: 8/21 (38.1%), 3PT: 2/6 (33.3%), REB: 15 (4 off, 11 def), AST: 5, TO: 1
TEAM FOULS: 2


Team_020
--------------------------------------------------------------------------------
Player                MIN  PTS  REB  AST  TO      FG   FG%      3P   3P%
--------------------------------------------------------------------------------
Trae Curry             30    5    1    0   0   2/2   100.0     0/0   0.0
Victor Holiday         18    5    1    0   0   2/4    50.0     0/0   0.0
Cole Barnes            18    3    3    1   0   1/2    50.0     0/0   0.0
Franz Doncic           18    2    0    1   0   1/2    50.0     0/0   0.0
Bam Leonard            30    0    2    0   0   0/0     0.0     0/0   0.0
Jarrett McCollum       30    0    0    0   0   0/1     0.0     0/0   0.0
James Cunningham       30    0    0    1   0   0/1     0.0     0/0   0.0
Terry Simons           30    0    2    0   0   0/1     0.0     0/0   0.0
Miles Siakam           18    0    7    0   0   0/1     0.0     0/0   0.0
Stephen Parker         18    0    0    1   0   0/3     0.0     0/0   0.0

TEAM: FG: 6/17 (35.3%), 3PT: 2/8 (25.0%), REB: 16 (3 off, 13 def), AST: 4, TO: 4
TEAM FOULS: 8 [Team_072 in BONUS]

================================================================================

================================================================================
                               FULL GAME COMPLETE                               
================================================================================

FINAL SCORE: Team_072 93, Team_020 94

SCORING BY QUARTER:
--------------------------------------------------------------------------------
Team                     Q1     Q2     Q3     Q4    FINAL
--------------------------------------------------------------------------------
Team_072                 23     32     17     21       93
Team_020                 34     21     24     15       94
--------------------------------------------------------------------------------

FULL GAME BOX SCORE:
================================================================================

Team_072
--------------------------------------------------------------------------------
Player                MIN  PTS  REB  AST  TO      FG   FG%      3P   3P%      FT STL BLK
--------------------------------------------------------------------------------
Tracy Giddey           33   19   14    3   1   6/11   54.5   3/6    50.0   1/1     0   0
Collin Griffin         30    4    0    4   2   2/9    22.2   0/5     0.0   0/0     0   0
Cade Poole             30   15    0    2   2   6/9    66.7   3/5    60.0   2/2     1   0
Wendell Anthony        30    9    9    1   1   4/9    44.4   1/4    25.0   2/2     0   0
Tyrese Williamson      30   11   10    2   4   5/10   50.0   0/0     0.0   1/2     1   1
Giannis Gobert         18    0    0    2   0   0/2     0.0   0/1     0.0   0/0     0   1
CJ Jokic               18    4    2    1   2   2/6    33.3   0/3     0.0   0/0     1   0
CJ Bane                18   15    0    0   1   6/9    66.7   2/4    50.0   5/5     0   0
Stephen Holiday        18    6   13    2   0   3/5    60.0   0/0     0.0   2/2     0   1
Brandon Durant         16    8    2    1   0   3/7    42.9   1/2    50.0   1/1     0   0

TEAM: FG: 37/77 (48.1%), 3PT: 10/30 (33.3%), REB: 50 (13 off, 37 def), AST: 18, TO: 13


Team_020
--------------------------------------------------------------------------------
Player                MIN  PTS  REB  AST  TO      FG   FG%      3P   3P%      FT STL BLK
--------------------------------------------------------------------------------
Jarrett McCollum       30   16    0    0   0   7/10   70.0   1/2    50.0   0/0     1   2
James Cunningham       30    9    0    1   1   2/7    28.6   2/6    33.3   3/3     0   0
Terry Simons           30   10    7    1   1   6/12   50.0   3/5    60.0   2/2     1   0
Bam Leonard            30    8   10    6   2   5/7    71.4   0/1     0.0   0/0     2   3
Trae Curry             30   21   11    1   2   8/14   57.1   0/0     0.0   1/2     2   1
Franz Doncic           18    4    0    2   0   2/5    40.0   0/2     0.0   0/0     0   0
Stephen Parker         18    0    0    1   3   0/5     0.0   0/3     0.0   0/0     1   0
Victor Holiday         18    7    3    2   0   3/7    42.9   1/5    20.0   2/2     0   0
Cole Barnes            18    8    5    2   1   3/5    60.0   2/2   100.0   0/1     0   0
Miles Siakam           18    7   14    0   1   3/5    60.0   1/1   100.0   0/0     0   0

TEAM: FG: 39/77 (50.6%), 3PT: 10/27 (37.0%), REB: 50 (11 off, 39 def), AST: 16, TO: 11

================================================================================
