================================================================================
                        FULL GAME - Team_016 vs Team_026                        
================================================================================

================================================================================
                       1ST QUARTER - Team_016 vs Team_026                       
================================================================================

[12:00] Team_016 possession (Score: 0-0)
FOUL! Holding foul on Wendell Gasol. [Team fouls: 1] No free throws, side out. (Wendell Gasol: 1 personal fouls)

[11:48] Team_016 possession (Score: 0-0)
Vince Quickley drives, Kobe Booker stays with him. Vince Quickley attempts a Dunk. Heavily contested by Kobe Booker (0.5 feet, ZONE)! VINCE QUICKLEY MAKES IT! Assist: Vince Duncan
Score: 2-0

[11:34] Team_026 possession (Score: 2-0)
Kobe Booker attempts a Layup. Heavily contested by Vince Duncan (0.7 feet, MAN)! KOBE BOOKER MAKES IT! Assist: Wendell Gasol
Score: 2-2

[11:17] Team_016 possession (Score: 2-2)
Vince Duncan attempts a Midrange. Contested by Kobe Booker (2.5 feet, MAN). Vince Duncan misses. Rebound secured by Shaquille Trent.

[11:02] Team_026 possession (Score: 2-2)
FOUL! Holding foul on Ben Barrett. [Team fouls: 1] No free throws, side out. (Ben Barrett: 1 personal fouls)

[10:45] Team_026 possession (Score: 2-2)
Shaquille Trent drives and kicks out. Shaquille Trent attempts a Midrange. Contested by Vince Quickley (4.4 feet, ZONE). Shaquille Trent misses. Rebound secured by Vince Quickley.

[10:36] Team_016 possession (Score: 2-2)
Vince Duncan drives, Kobe Booker stays with him. Vince Duncan attempts a Layup. Contested by Kobe Booker (3.6 feet, ZONE). VINCE DUNCAN MAKES IT! Assist: Collin Barnes
Score: 4-2

[10:19] Team_026 possession (Score: 4-2)
Klay Giddey attempts a 3Pt. Wide open! Vince Quickley is 7.9 feet away. [MAN] KLAY GIDDEY MAKES IT! Assist: Kobe Booker
Score: 4-5

[10:01] Team_016 possession (Score: 4-5)
Collin Barnes attempts a Layup. Contested by Wendell Gasol (6.0 feet, MAN). Collin Barnes misses. Rebound secured by Kobe Booker.

[09:49] Team_026 possession (Score: 4-5)
FOUL! Reach-in foul on Ben Barrett during the drive. [Team fouls: 2] No free throws, side out. (Ben Barrett: 2 personal fouls)

[09:38] Team_026 possession (Score: 4-5)
Klay Giddey attempts a 3Pt. Contested by Ben Barrett (4.5 feet, ZONE). Klay Giddey misses. Rebound secured by Ben Barrett.

[09:24] Team_016 possession (Score: 4-5)
Vince Duncan drives, picks up Kobe Booker. Help arrives from Immanuel Hyland! Vince Duncan attempts a Dunk. Contested by Immanuel Hyland (2.7 feet, MAN). VINCE DUNCAN MAKES IT!
Score: 6-5

[09:11] Team_026 possession (Score: 6-5)
Kobe Booker attempts a Midrange. Heavily contested by Vince Duncan (1.5 feet, MAN)! Kobe Booker misses. Offensive rebound by Kobe Booker! Kobe Booker kicks it out.

[08:57] Team_026 possession (Score: 6-5)
Immanuel Hyland attempts a 3Pt. Wide open! Giannis Ginobili is 6.8 feet away. [MAN] Immanuel Hyland misses. FOUL! Loose ball foul on Vince Duncan during the rebound battle. [Team fouls: 3] No free throws, side out. (Vince Duncan: 1 personal fouls)

[08:43] Team_026 possession (Score: 6-5)
Shaquille Trent throws a bad pass out of bounds! TURNOVER! (dead ball)

[08:29] Team_016 possession (Score: 6-5)
Giannis Ginobili attempts a 3Pt. Wide open! Immanuel Hyland is 6.8 feet away. [MAN] GIANNIS GINOBILI MAKES IT! Assist: Ben Barrett
Score: 9-5

[08:14] Team_026 possession (Score: 9-5)
Klay Giddey attempts a Midrange. Contested by Ben Barrett (3.6 feet, ZONE). Klay Giddey misses. Rebound secured by Vince Duncan.

[07:57] Team_016 possession (Score: 9-5)
Vince Quickley drives, picks up Klay Giddey. Help arrives from Immanuel Hyland! Vince Quickley attempts a Dunk. Contested by Immanuel Hyland (4.4 feet, MAN). Vince Quickley misses. Offensive rebound by Vince Duncan! Vince Duncan's putback is no good. Rebound secured by Shaquille Trent.

[07:43] Team_026 possession (Score: 9-5)
Shaquille Trent makes the Layup and draws the foul on Ben Barrett! And-1! Shaquille Trent to the line for 1. [Team fouls: 4] (Ben Barrett: 3 personal fouls)   FT 1/1: GOOD Shaquille Trent makes 1/1 from the line.
Score: 9-8

[07:26] Team_016 possession (Score: 9-8)
Giannis Ginobili attempts a 3Pt. Heavily contested by Immanuel Hyland (2.0 feet, ZONE)! Giannis Ginobili misses. Rebound secured by Kobe Booker.

[07:15] Team_026 possession (Score: 9-8)
Klay Giddey attempts a 3Pt. Heavily contested by Collin Barnes (1.4 feet, ZONE)! KLAY GIDDEY MAKES IT! Assist: Kobe Booker
Score: 9-11

[07:00] Team_016 possession (Score: 9-11)
Collin Barnes attempts a Layup. Heavily contested by Wendell Gasol (0.5 feet, MAN)! Collin Barnes misses. Offensive rebound by Vince Duncan! Vince Duncan puts it back in!
Score: 11-11

[06:47] Team_026 possession (Score: 11-11)
Shaquille Trent attempts a 3Pt. Wide open! Ben Barrett is 7.0 feet away. [MAN] Shaquille Trent misses. Offensive rebound by Shaquille Trent! Shaquille Trent kicks it out.

[06:33] Team_026 possession (Score: 11-11)
FOUL! Holding foul on Collin Barnes. [IN THE BONUS! 5 team fouls] Wendell Gasol to the line for 2 free throws. (Collin Barnes: 1 personal fouls)   FT 1/2: GOOD   FT 2/2: GOOD Wendell Gasol makes 2/2 from the line.
Score: 11-13

[06:17] Team_016 possession (Score: 11-13)
Ben Barrett drives to the basket... Ben Barrett loses control! Ball rolls out of bounds! TURNOVER! (dead ball)

[06:04] Team_026 possession (Score: 11-13)
Kobe Booker attempts a Midrange. Contested by Vince Duncan (4.2 feet, MAN). Kobe Booker misses. Rebound secured by Vince Duncan.

[05:49] Team_016 possession (Score: 11-13)
Vince Duncan drives, Kobe Booker stays with him. Vince Duncan attempts a Dunk. Contested by Kobe Booker (3.2 feet, MAN). Vince Duncan misses. Rebound secured by Shaquille Trent.

[05:32] Team_026 possession (Score: 11-13)
Kobe Booker drives, Vince Duncan stays with him. Kobe Booker attempts a Layup. Contested by Vince Duncan (2.5 feet, MAN). Kobe Booker misses. Rebound secured by Vince Quickley.

[05:21] Team_016 possession (Score: 11-13)
Giannis Ginobili attempts a 3Pt. Contested by Immanuel Hyland (2.8 feet, MAN). Giannis Ginobili misses. Rebound secured by Shaquille Trent.

[05:05] Team_026 possession (Score: 11-13)
Wendell Gasol throws a bad pass! Stolen by Collin Barnes! TURNOVER! (live ball)

[04:49] Team_016 possession (Score: 11-13)
Giannis Ginobili drives, Kobe Booker stays with him. Giannis Ginobili attempts a Layup. Contested by Kobe Booker (5.2 feet, ZONE). Giannis Ginobili misses. Rebound secured by Shaquille Trent.

[04:34] Team_026 possession (Score: 11-13)
Wendell Gasol attempts a 3Pt. Heavily contested by Collin Barnes (1.7 feet, MAN)! Wendell Gasol misses. Rebound secured by Vince Quickley.

[04:20] Team_016 possession (Score: 11-13)
Vince Duncan attempts a Midrange. Contested by Kobe Booker (4.6 feet, MAN). Vince Duncan misses. Offensive rebound by Vince Duncan! Vince Duncan puts it back in!
Score: 13-13

[04:04] Team_026 possession (Score: 13-13)
Kobe Booker attempts a Midrange. Contested by Vince Duncan (3.8 feet, MAN). Kobe Booker misses. Offensive rebound by Shaquille Trent! Shaquille Trent kicks it out.

[03:49] Team_026 possession (Score: 13-13)
Immanuel Hyland attempts a Midrange. Contested by Giannis Ginobili (3.4 feet, MAN). Immanuel Hyland misses. Rebound secured by Ben Barrett.

[03:35] Team_016 possession (Score: 13-13)
Collin Barnes attempts a Layup. Contested by Kobe Booker (3.8 feet, ZONE). COLLIN BARNES MAKES IT! Assist: Vince Duncan
Score: 15-13

[03:25] Team_026 possession (Score: 15-13)
FOUL! Offensive foul on Kobe Booker! Vince Duncan drew the charge! [Team fouls: 2] (Kobe Booker: 1 personal fouls) TURNOVER! (dead ball)

[03:11] Team_016 possession (Score: 15-13)
Ben Barrett drives, picks up Kobe Booker. Help arrives from Immanuel Hyland! Ben Barrett attempts a Dunk. Heavily contested by Immanuel Hyland (0.8 feet, ZONE)! BEN BARRETT MAKES IT! Assist: Collin Barnes
Score: 17-13

[03:00] Team_026 possession (Score: 17-13)
Kobe Booker drives to the basket... Kobe Booker loses control! Ball rolls out of bounds! TURNOVER! (dead ball)

[03:00] Substitution (Team_016): Collin Barnes OUT → Lamelo Herro IN (stamina_rule2)

[03:00] Substitution (Team_026): Immanuel Hyland OUT → Karl Barrett IN (stamina_rule2)

[03:00] Substitution (Team_026): Klay Giddey OUT → Josh Simons IN (stamina_rule2)

[03:00] Substitution (Team_026): Shaquille Trent OUT → Damian Doncic IN (stamina_rule2)

[03:00] Substitution (Team_026): Kobe Booker OUT → Dirk Randle IN (stamina_rule2)

[02:49] Team_016 possession (Score: 17-13)
Vince Quickley attempts a 3Pt. Heavily contested by Karl Barrett (1.1 feet, ZONE)! VINCE QUICKLEY MAKES IT! Assist: Vince Duncan
Score: 20-13

[02:37] Team_026 possession (Score: 20-13)
Damian Doncic attempts a 3Pt. Contested by Ben Barrett (3.8 feet, MAN). Damian Doncic misses. Rebound secured by Vince Duncan.

[02:22] Team_016 possession (Score: 20-13)
Vince Quickley attempts a 3Pt. Contested by Josh Simons (3.2 feet, MAN). VINCE QUICKLEY MAKES IT! Assist: Ben Barrett
Score: 23-13

[02:07] Team_026 possession (Score: 23-13)
Wendell Gasol throws a bad pass! Stolen by Lamelo Herro! TURNOVER! (live ball)

[01:52] Team_016 possession (Score: 23-13)
Lamelo Herro attempts a 3Pt. Contested by Wendell Gasol (2.5 feet, MAN). Lamelo Herro misses. Offensive rebound by Ben Barrett! Ben Barrett puts it back in!
Score: 25-13

[01:38] Team_026 possession (Score: 25-13)
Damian Doncic throws a bad pass! Stolen by Ben Barrett! TURNOVER! (live ball)

[01:25] Team_016 possession (Score: 25-13)
Vince Duncan drives and kicks out. Vince Quickley attempts a 3Pt. Contested by Josh Simons (5.0 feet, MAN). Vince Quickley misses. Rebound secured by Josh Simons.

[01:11] Team_026 possession (Score: 25-13)
Josh Simons attempts a 3Pt. Wide open! Giannis Ginobili is 6.5 feet away. [ZONE] Josh Simons misses. Rebound secured by Vince Duncan.

[00:55] Team_016 possession (Score: 25-13)
Vince Quickley attempts a 3Pt. Contested by Josh Simons (4.5 feet, MAN). VINCE QUICKLEY MAKES IT! Assist: Lamelo Herro
Score: 28-13

[00:43] Team_026 possession (Score: 28-13)
Wendell Gasol drives and kicks out. Damian Doncic makes the 3Pt and draws the foul on Lamelo Herro! And-1! Damian Doncic to the line for 1. [BONUS: 6 team fouls] (Lamelo Herro: 1 personal fouls)   FT 1/1: MISS Damian Doncic makes 0/1 from the line. Rebound secured by Ben Barrett.
Score: 28-16

[00:29] Team_016 possession (Score: 28-16)
Vince Duncan drives to the basket... Vince Duncan loses the ball! Stripped by Damian Doncic! TURNOVER! (live ball)

[00:16] Team_026 possession (Score: 28-16)
Josh Simons attempts a 3Pt. Wide open! Vince Quickley is 6.8 feet away. [MAN] Josh Simons misses. Rebound secured by Vince Duncan.

================================================================================
                              1ST QUARTER COMPLETE                              
================================================================================

1ST QUARTER SCORE: Team_016 28, Team_026 16

BOX SCORE:
================================================================================

Team_016
--------------------------------------------------------------------------------
Player                MIN  PTS  REB  AST  TO      FG   FG%      3P   3P%
--------------------------------------------------------------------------------
Vince Quickley         12   11    3    0   0   4/5    80.0     0/0   0.0
Vince Duncan           12    8    7    3   0   4/7    57.1     0/0   0.0
Ben Barrett            12    4    4    2   0   2/2   100.0     0/0   0.0
Giannis Ginobili       12    3    0    0   0   1/4    25.0     0/0   0.0
Collin Barnes           9    2    0    2   0   1/2    50.0     0/0   0.0
Lamelo Herro            3    0    0    1   0   0/0     0.0     0/0   0.0

TEAM: FG: 12/20 (60.0%), 3PT: 5/7 (71.4%), REB: 15 (4 off, 11 def), AST: 8, TO: 2
TEAM FOULS: 6 [Team_026 in BONUS]


Team_026
--------------------------------------------------------------------------------
Player                MIN  PTS  REB  AST  TO      FG   FG%      3P   3P%
--------------------------------------------------------------------------------
Klay Giddey             9    6    0    0   0   2/4    50.0     0/0   0.0
Shaquille Trent         9    3    7    0   0   1/2    50.0     0/0   0.0
Kobe Booker             9    2    4    2   0   1/3    33.3     0/0   0.0
Wendell Gasol          12    2    0    1   0   1/3    33.3     0/0   0.0
Immanuel Hyland         9    0    0    0   0   0/1     0.0     0/0   0.0
Damian Doncic           3    0    0    0   0   0/1     0.0     0/0   0.0
Josh Simons             3    0    1    0   0   0/2     0.0     0/0   0.0

TEAM: FG: 5/16 (31.2%), 3PT: 2/7 (28.6%), REB: 11 (4 off, 7 def), AST: 3, TO: 6
TEAM FOULS: 2

================================================================================

================================================================================
                       2ND QUARTER - Team_016 vs Team_026                       
================================================================================

[12:00] Team_016 possession (Score: 28-16)
FOUL! Holding foul on Wendell Gasol. [Team fouls: 1] No free throws, side out. (Wendell Gasol: 1 personal fouls)

[11:49] Team_016 possession (Score: 28-16)
Vince Quickley attempts a 3Pt. Wide open! Klay Giddey is 6.8 feet away. [MAN] Vince Quickley misses. Rebound secured by Kobe Booker.

[11:30] Team_026 possession (Score: 28-16)
Klay Giddey attempts a 3Pt. Wide open! Vince Quickley is 7.0 feet away. [MAN] KLAY GIDDEY MAKES IT! Assist: Wendell Gasol
Score: 28-19

[11:11] Team_016 possession (Score: 28-19)
Collin Barnes attempts a 3Pt. Contested by Wendell Gasol (4.5 feet, MAN). COLLIN BARNES MAKES IT! Assist: Vince Quickley
Score: 31-19

[11:01] Team_026 possession (Score: 31-19)
Kobe Booker drives and kicks out. Shaquille Trent attempts a 3Pt. Heavily contested by Collin Barnes (1.0 feet, ZONE)! SHAQUILLE TRENT MAKES IT! Assist: Kobe Booker
Score: 31-22

[10:43] Team_016 possession (Score: 31-22)
Giannis Ginobili drives to the basket... Giannis Ginobili loses control! Ball rolls out of bounds! TURNOVER! (dead ball)

[10:43] Substitution (Team_016): Giannis Ginobili OUT → Immanuel Nowitzki IN (stamina_rule2)

[10:43] Substitution (Team_016): Vince Quickley OUT → Kevin Butler IN (stamina_rule2)

[10:43] Substitution (Team_016): Ben Barrett OUT → Giannis Doncic IN (stamina_rule2)

[10:43] Substitution (Team_016): Vince Duncan OUT → Trae Barnes IN (stamina_rule2)

[10:43] Substitution (Team_026): Wendell Gasol OUT → Myles Tatum IN (stamina_rule2)

[10:30] Team_026 possession (Score: 31-22)
Kobe Booker attempts a 3Pt. Contested by Trae Barnes (4.8 feet, MAN). Kobe Booker misses. Offensive rebound by Kobe Booker! Kobe Booker kicks it out.

[10:18] Team_026 possession (Score: 31-22)
Shaquille Trent attempts a 3Pt. Contested by Collin Barnes (5.2 feet, ZONE). Shaquille Trent misses. Offensive rebound by Shaquille Trent! Shaquille Trent kicks it out.

[10:02] Team_026 possession (Score: 31-22)
Klay Giddey attempts a Layup. BLOCKED BY KEVIN BUTLER! Ball is loose! Rebound secured by Giannis Doncic.

[09:53] Team_016 possession (Score: 31-22)
Collin Barnes attempts a 3Pt. Contested by Immanuel Hyland (4.4 feet, ZONE). Collin Barnes misses. Rebound secured by Shaquille Trent.

[09:41] Team_026 possession (Score: 31-22)
Myles Tatum loses control! Ball rolls out of bounds! TURNOVER! (dead ball)

[09:29] Team_016 possession (Score: 31-22)
Kevin Butler makes the 3Pt and draws the foul on Klay Giddey! And-1! Kevin Butler to the line for 1. [Team fouls: 2] (Klay Giddey: 1 personal fouls)   FT 1/1: GOOD Kevin Butler makes 1/1 from the line.
Score: 35-22

[09:18] Team_026 possession (Score: 35-22)
Kobe Booker attempts a Midrange. Wide open! Trae Barnes is 7.1 feet away. [MAN] KOBE BOOKER MAKES IT!
Score: 35-24

[09:06] Team_016 possession (Score: 35-24)
Collin Barnes attempts a 3Pt. Wide open! Immanuel Hyland is 7.8 feet away. [ZONE] Collin Barnes misses. Rebound secured by Kobe Booker.

[08:56] Team_026 possession (Score: 35-24)
Shaquille Trent attempts a 3Pt. Contested by Giannis Doncic (5.8 feet, MAN). Shaquille Trent misses. Offensive rebound by Kobe Booker! Kobe Booker kicks it out.

[08:43] Team_026 possession (Score: 35-24)
Immanuel Hyland attempts a Layup. BLOCKED BY IMMANUEL NOWITZKI! Ball is loose! Offensive rebound by Kobe Booker! Kobe Booker kicks it out.

[08:29] Team_026 possession (Score: 35-24)
Klay Giddey attempts a Layup. BLOCKED BY GIANNIS DONCIC! Ball deflects out of bounds off Klay Giddey.

[08:18] Team_016 possession (Score: 35-24)
Kevin Butler drives, Kobe Booker stays with him. Kevin Butler attempts a Layup. Heavily contested by Kobe Booker (1.3 feet, ZONE)! Kevin Butler misses. Offensive rebound by Trae Barnes! Trae Barnes kicks it out.

[08:08] Team_016 possession (Score: 35-24)
Immanuel Nowitzki attempts a 3Pt. Contested by Immanuel Hyland (3.4 feet, MAN). Immanuel Nowitzki misses. Rebound secured by Shaquille Trent.

[07:55] Team_026 possession (Score: 35-24)
Shaquille Trent attempts a Layup. BLOCKED BY GIANNIS DONCIC! Ball is loose! Rebound secured by Giannis Doncic.

[07:43] Team_016 possession (Score: 35-24)
Giannis Doncic attempts a Layup. BLOCKED BY SHAQUILLE TRENT! Ball is loose! Rebound secured by Shaquille Trent.

[07:32] Team_026 possession (Score: 35-24)
Shaquille Trent throws a bad pass out of bounds! TURNOVER! (dead ball)

[07:32] Substitution (Team_016): Collin Barnes OUT → Lamelo Herro IN (stamina_rule2)

[07:32] Substitution (Team_026): Immanuel Hyland OUT → Karl Barrett IN (stamina_rule2)

[07:32] Substitution (Team_026): Klay Giddey OUT → Josh Simons IN (stamina_rule2)

[07:32] Substitution (Team_026): Shaquille Trent OUT → Damian Doncic IN (stamina_rule2)

[07:32] Substitution (Team_026): Kobe Booker OUT → Dirk Randle IN (stamina_rule2)

[07:20] Team_016 possession (Score: 35-24)
Giannis Doncic attempts a Layup. Contested by Damian Doncic (4.9 feet, ZONE). GIANNIS DONCIC MAKES IT! Assist: Lamelo Herro
Score: 37-24

[07:07] Team_026 possession (Score: 37-24)
Damian Doncic attempts a Layup. Contested by Giannis Doncic (3.4 feet, MAN). DAMIAN DONCIC MAKES IT! Assist: Karl Barrett
Score: 37-26

[06:50] Team_016 possession (Score: 37-26)
Giannis Doncic drives to the basket... Giannis Doncic throws a bad pass out of bounds! TURNOVER! (dead ball)

[06:34] Team_026 possession (Score: 37-26)
Josh Simons attempts a Midrange. Contested by Kevin Butler (3.6 feet, MAN). Josh Simons misses. Rebound secured by Lamelo Herro.

[06:21] Team_016 possession (Score: 37-26)
Lamelo Herro attempts a Midrange. Contested by Karl Barrett (3.2 feet, ZONE). LAMELO HERRO MAKES IT!
Score: 39-26

[06:08] Team_026 possession (Score: 39-26)
Myles Tatum attempts a Midrange. Heavily contested by Giannis Doncic (1.8 feet, ZONE)! Myles Tatum misses. Rebound secured by Lamelo Herro.

[05:54] Team_016 possession (Score: 39-26)
Trae Barnes drives, picks up Damian Doncic. Help arrives from Karl Barrett! Trae Barnes attempts a Layup. Wide open! Karl Barrett is 7.6 feet away. [ZONE] Trae Barnes misses. Rebound secured by Damian Doncic.

[05:40] Team_026 possession (Score: 39-26)
Josh Simons attempts a Midrange. Heavily contested by Immanuel Nowitzki (2.0 feet, ZONE)! JOSH SIMONS MAKES IT! Assist: Myles Tatum
Score: 39-28

[05:25] Team_016 possession (Score: 39-28)
Trae Barnes drives, picks up Dirk Randle. Help arrives from Karl Barrett! Trae Barnes attempts a Dunk. Wide open! Karl Barrett is 6.5 feet away. [MAN] Trae Barnes misses. Rebound secured by Damian Doncic.

[05:08] Team_026 possession (Score: 39-28)
Damian Doncic loses the ball! Stripped by Giannis Doncic! TURNOVER! (live ball)

[04:57] Team_016 possession (Score: 39-28)
Immanuel Nowitzki drives to the basket... FOUL! Offensive foul on Immanuel Nowitzki! Karl Barrett drew the charge! [Team fouls: 1] (Immanuel Nowitzki: 1 personal fouls) TURNOVER! (dead ball)

[04:39] Team_026 possession (Score: 39-28)
Josh Simons attempts a 3Pt. Contested by Kevin Butler (2.0 feet, MAN). Josh Simons misses. Rebound secured by Lamelo Herro.

[04:24] Team_016 possession (Score: 39-28)
Kevin Butler attempts a 3Pt. Contested by Josh Simons (5.2 feet, MAN). Kevin Butler misses. Rebound secured by Josh Simons.

[04:09] Team_026 possession (Score: 39-28)
Karl Barrett attempts a Midrange. Wide open! Immanuel Nowitzki is 6.6 feet away. [MAN] KARL BARRETT MAKES IT! Assist: Josh Simons
Score: 39-30

[03:52] Team_016 possession (Score: 39-30)
Kevin Butler loses control! Ball rolls out of bounds! TURNOVER! (dead ball)

[03:43] Team_026 possession (Score: 39-30)
Dirk Randle attempts a Midrange. Wide open! Immanuel Nowitzki is 7.6 feet away. [ZONE] Dirk Randle misses. Rebound secured by Lamelo Herro.

[03:30] Team_016 possession (Score: 39-30)
Giannis Doncic attempts a Layup. Contested by Damian Doncic (4.4 feet, ZONE). Giannis Doncic misses. Rebound secured by Karl Barrett.

[03:17] Team_026 possession (Score: 39-30)
Myles Tatum attempts a Midrange. Contested by Lamelo Herro (2.8 feet, MAN). Myles Tatum misses. Rebound secured by Giannis Doncic.

[03:03] Team_016 possession (Score: 39-30)
Lamelo Herro attempts a Layup. Contested by Myles Tatum (4.3 feet, MAN). LAMELO HERRO MAKES IT! Assist: Kevin Butler
Score: 41-30

[02:50] Team_026 possession (Score: 41-30)
Myles Tatum attempts a 3Pt. Contested by Lamelo Herro (5.2 feet, MAN). MYLES TATUM MAKES IT! Assist: Damian Doncic
Score: 41-33

[02:31] Team_016 possession (Score: 41-33)
Giannis Doncic attempts a Midrange. Contested by Josh Simons (5.6 feet, ZONE). GIANNIS DONCIC MAKES IT!
Score: 43-33

[02:13] Team_026 possession (Score: 43-33)
Karl Barrett attempts a 3Pt. Contested by Lamelo Herro (4.6 feet, ZONE). KARL BARRETT MAKES IT! Assist: Dirk Randle
Score: 43-36

[01:59] Team_016 possession (Score: 43-36)
FOUL! Holding foul on Karl Barrett. [Team fouls: 3] No free throws, side out. (Karl Barrett: 1 personal fouls)

[01:45] Team_016 possession (Score: 43-36)
Trae Barnes attempts a 3Pt. Contested by Karl Barrett (5.9 feet, ZONE). TRAE BARNES MAKES IT! Assist: Giannis Doncic
Score: 46-36

[01:34] Team_026 possession (Score: 46-36)
FOUL! Shooting foul on Giannis Doncic. Damian Doncic to the line for 2 free throws. [Team fouls: 2] (Giannis Doncic: 1 personal fouls)   FT 1/2: MISS   FT 2/2: MISS Damian Doncic makes 0/2 from the line. Offensive rebound by Damian Doncic! Damian Doncic kicks it out.

[01:17] Team_026 possession (Score: 46-36)
FOUL! Shooting foul on Kevin Butler. Josh Simons to the line for 2 free throws. [Team fouls: 3] (Kevin Butler: 1 personal fouls)   FT 1/2: GOOD   FT 2/2: GOOD Josh Simons makes 2/2 from the line.
Score: 46-38

[01:04] Team_016 possession (Score: 46-38)
Immanuel Nowitzki attempts a Layup. Contested by Damian Doncic (5.3 feet, ZONE). IMMANUEL NOWITZKI MAKES IT! Assist: Trae Barnes
Score: 48-38

[00:50] Team_026 possession (Score: 48-38)
Damian Doncic drives, picks up Giannis Doncic. Help arrives from Lamelo Herro! Damian Doncic attempts a Layup. Contested by Lamelo Herro (2.7 feet, ZONE). DAMIAN DONCIC MAKES IT! Assist: Karl Barrett
Score: 48-40

[00:33] Team_016 possession (Score: 48-40)
Immanuel Nowitzki attempts a Midrange. Wide open! Damian Doncic is 6.6 feet away. [ZONE] IMMANUEL NOWITZKI MAKES IT!
Score: 50-40

[00:22] Team_026 possession (Score: 50-40)
Karl Barrett drives and kicks out. Josh Simons attempts a 3Pt. Wide open! Kevin Butler is 6.4 feet away. [MAN] Josh Simons misses. Offensive rebound by Josh Simons! Josh Simons kicks it out.

[00:05] Team_026 possession (Score: 50-40)
FOUL! Shooting foul on Lamelo Herro. Myles Tatum to the line for 2 free throws. [Team fouls: 4] (Lamelo Herro: 1 personal fouls)   FT 1/2: GOOD   FT 2/2: GOOD Myles Tatum makes 2/2 from the line.
Score: 50-42

================================================================================
                              2ND QUARTER COMPLETE                              
================================================================================

2ND QUARTER SCORE: Team_016 22, Team_026 26

BOX SCORE:
================================================================================

Team_016
--------------------------------------------------------------------------------
Player                MIN  PTS  REB  AST  TO      FG   FG%      3P   3P%
--------------------------------------------------------------------------------
Giannis Doncic         11    4    3    1   0   2/4    50.0     0/0   0.0
Kevin Butler           11    4    0    1   0   1/2    50.0     0/0   0.0
Immanuel Nowitzki      11    4    0    0   0   2/3    66.7     0/0   0.0
Lamelo Herro           10    4    4    1   0   2/2   100.0     0/0   0.0
Collin Barnes          14    3    0    0   0   1/3    33.3     0/0   0.0
Trae Barnes            11    3    1    1   0   1/3    33.3     0/0   0.0
Vince Quickley         14    0    0    1   0   0/1     0.0     0/0   0.0

TEAM: FG: 9/18 (50.0%), 3PT: 3/8 (37.5%), REB: 8 (1 off, 7 def), AST: 5, TO: 4
TEAM FOULS: 4


Team_026
--------------------------------------------------------------------------------
Player                MIN  PTS  REB  AST  TO      FG   FG%      3P   3P%
--------------------------------------------------------------------------------
Karl Barrett           10    5    1    2   0   2/2   100.0     0/0   0.0
Myles Tatum            11    5    0    1   0   2/4    50.0     0/0   0.0
Damian Doncic          10    4    3    1   0   2/2   100.0     0/0   0.0
Josh Simons            10    4    2    1   0   2/4    50.0     0/0   0.0
Klay Giddey            14    3    0    0   0   1/3    33.3     0/0   0.0
Shaquille Trent        14    3    4    0   0   1/2    50.0     0/0   0.0
Kobe Booker            14    2    5    1   0   1/1   100.0     0/0   0.0
Wendell Gasol          14    0    0    1   0   0/0     0.0     0/0   0.0
Dirk Randle            10    0    0    1   0   0/1     0.0     0/0   0.0

TEAM: FG: 11/19 (57.9%), 3PT: 3/4 (75.0%), REB: 15 (6 off, 9 def), AST: 8, TO: 3
TEAM FOULS: 3

================================================================================

================================================================================
                       3RD QUARTER - Team_016 vs Team_026                       
================================================================================

[12:00] Team_016 possession (Score: 50-42)
Giannis Ginobili attempts a 3Pt. Contested by Immanuel Hyland (5.2 feet, MAN). GIANNIS GINOBILI MAKES IT! Assist: Collin Barnes
Score: 53-42

[11:49] Team_026 possession (Score: 53-42)
Klay Giddey attempts a 3Pt. Wide open! Vince Quickley is 7.3 feet away. [MAN] Klay Giddey misses. Offensive rebound by Kobe Booker! Kobe Booker kicks it out.

[11:33] Team_026 possession (Score: 53-42)
Shaquille Trent throws a bad pass out of bounds! TURNOVER! (dead ball)

[11:21] Team_016 possession (Score: 53-42)
Collin Barnes attempts a 3Pt. Wide open! Wendell Gasol is 6.7 feet away. [MAN] COLLIN BARNES MAKES IT! Assist: Ben Barrett
Score: 56-42

[11:09] Team_026 possession (Score: 56-42)
FOUL! Shooting foul on Ben Barrett. Shaquille Trent to the line for 2 free throws. [Team fouls: 1] (Ben Barrett: 1 personal fouls)   FT 1/2: MISS   FT 2/2: GOOD Shaquille Trent makes 1/2 from the line.
Score: 56-43

[10:56] Team_016 possession (Score: 56-43)
FOUL! Reach-in foul on Klay Giddey during the drive. [Team fouls: 1] No free throws, side out. (Klay Giddey: 1 personal fouls)

[10:46] Team_016 possession (Score: 56-43)
Vince Duncan drives and kicks out. Collin Barnes attempts a Midrange. Contested by Klay Giddey (5.7 feet, ZONE). COLLIN BARNES MAKES IT!
Score: 58-43

[10:37] Team_026 possession (Score: 58-43)
Klay Giddey attempts a Midrange. Heavily contested by Ben Barrett (0.5 feet, ZONE)! Klay Giddey misses. Rebound secured by Vince Duncan.

[10:25] Team_016 possession (Score: 58-43)
Giannis Ginobili attempts a 3Pt. Contested by Immanuel Hyland (4.0 feet, MAN). GIANNIS GINOBILI MAKES IT! Assist: Collin Barnes
Score: 61-43

[10:07] Team_026 possession (Score: 61-43)
FOUL! Reach-in foul on Vince Duncan during the drive. [Team fouls: 2] No free throws, side out. (Vince Duncan: 1 personal fouls)

[09:54] Team_026 possession (Score: 61-43)
Kobe Booker attempts a Midrange. Wide open! Vince Duncan is 6.2 feet away. [MAN] KOBE BOOKER MAKES IT! Assist: Wendell Gasol
Score: 61-45

[09:39] Team_016 possession (Score: 61-45)
Collin Barnes attempts a 3Pt. Heavily contested by Immanuel Hyland (1.1 feet, ZONE)! Collin Barnes misses. Rebound secured by Shaquille Trent.

[09:24] Team_026 possession (Score: 61-45)
Shaquille Trent loses control! Ball rolls out of bounds! TURNOVER! (dead ball)

[09:09] Team_016 possession (Score: 61-45)
Collin Barnes drives and kicks out. Collin Barnes attempts a Midrange. Contested by Wendell Gasol (3.4 feet, MAN). COLLIN BARNES MAKES IT! Assist: Vince Duncan
Score: 63-45

[08:57] Team_026 possession (Score: 63-45)
Klay Giddey loses the ball! Stripped by Vince Quickley! TURNOVER! (live ball)

[08:39] Team_016 possession (Score: 63-45)
Ben Barrett attempts a Midrange. Contested by Klay Giddey (5.8 feet, ZONE). BEN BARRETT MAKES IT!
Score: 65-45

[08:21] Team_026 possession (Score: 65-45)
Klay Giddey attempts a Layup. Wide open! Vince Duncan is 6.4 feet away. [ZONE] KLAY GIDDEY MAKES IT! Assist: Immanuel Hyland
Score: 65-47

[08:09] Team_016 possession (Score: 65-47)
Ben Barrett drives and kicks out. FOUL! Shooting foul on Wendell Gasol. Collin Barnes to the line for 2 free throws. [Team fouls: 2] (Wendell Gasol: 1 personal fouls)   FT 1/2: GOOD   FT 2/2: GOOD Collin Barnes makes 2/2 from the line.
Score: 67-47

[07:57] Team_026 possession (Score: 67-47)
Immanuel Hyland attempts a Midrange. Wide open! Giannis Ginobili is 8.4 feet away. [MAN] Immanuel Hyland misses. Rebound secured by Vince Duncan.

[07:45] Team_016 possession (Score: 67-47)
Ben Barrett attempts a Midrange. Wide open! Shaquille Trent is 8.0 feet away. [ZONE] Ben Barrett misses. Offensive rebound by Vince Duncan! Vince Duncan's putback is no good. Rebound secured by Immanuel Hyland.

[07:30] Team_026 possession (Score: 67-47)
Wendell Gasol drives to the basket... Wendell Gasol loses the ball! Stripped by Vince Duncan! TURNOVER! (live ball)

[07:11] Team_016 possession (Score: 67-47)
Vince Duncan makes the Layup and draws the foul on Immanuel Hyland! And-1! Vince Duncan to the line for 1. [Team fouls: 3] (Immanuel Hyland: 1 personal fouls)   FT 1/1: GOOD Vince Duncan makes 1/1 from the line.
Score: 70-47

[06:58] Team_026 possession (Score: 70-47)
Klay Giddey drives to the basket... FOUL! Offensive foul on Klay Giddey! Vince Quickley drew the charge! [Team fouls: 4] (Klay Giddey: 2 personal fouls) TURNOVER! (dead ball)

[06:44] Team_016 possession (Score: 70-47)
Ben Barrett attempts a Midrange. Contested by Shaquille Trent (5.1 feet, ZONE). BEN BARRETT MAKES IT!
Score: 72-47

[06:30] Team_026 possession (Score: 72-47)
Immanuel Hyland drives, Giannis Ginobili stays with him. Immanuel Hyland attempts a Dunk. Contested by Giannis Ginobili (2.6 feet, MAN). IMMANUEL HYLAND MAKES IT! Assist: Wendell Gasol
Score: 72-49

[06:20] Team_016 possession (Score: 72-49)
Giannis Ginobili attempts a Layup. Heavily contested by Immanuel Hyland (0.5 feet, MAN)! GIANNIS GINOBILI MAKES IT!
Score: 74-49

[06:03] Team_026 possession (Score: 74-49)
Kobe Booker attempts a Dunk. BLOCKED BY VINCE DUNCAN! Ball is loose! Rebound secured by Vince Quickley.

[05:48] Team_016 possession (Score: 74-49)
Collin Barnes drives, Wendell Gasol stays with him. Collin Barnes attempts a Layup. Contested by Wendell Gasol (3.2 feet, MAN). Collin Barnes misses. Rebound secured by Kobe Booker.

[05:34] Team_026 possession (Score: 74-49)
Wendell Gasol throws a bad pass out of bounds! TURNOVER! (dead ball)

[05:20] Team_016 possession (Score: 74-49)
Vince Duncan attempts a Midrange. Contested by Kobe Booker (3.4 feet, MAN). Vince Duncan misses. Rebound secured by Kobe Booker.

[05:06] Team_026 possession (Score: 74-49)
Klay Giddey drives to the basket... Klay Giddey throws a bad pass out of bounds! TURNOVER! (dead ball)

[04:47] Team_016 possession (Score: 74-49)
Vince Quickley drives to the basket... Vince Quickley commits a violation (traveling/carry)! TURNOVER! (dead ball)

[04:34] Team_026 possession (Score: 74-49)
Shaquille Trent drives, Vince Duncan stays with him. Shaquille Trent attempts a Dunk. Heavily contested by Vince Duncan (0.8 feet, ZONE)! Shaquille Trent misses. Rebound secured by Vince Quickley.

[04:20] Team_016 possession (Score: 74-49)
FOUL! Holding foul on Shaquille Trent. [IN THE BONUS! 5 team fouls] Ben Barrett to the line for 2 free throws. (Shaquille Trent: 1 personal fouls)   FT 1/2: GOOD   FT 2/2: GOOD Ben Barrett makes 2/2 from the line.
Score: 76-49

[04:02] Team_026 possession (Score: 76-49)
Immanuel Hyland drives, Vince Duncan stays with him. Immanuel Hyland attempts a Layup. Contested by Vince Duncan (3.7 feet, ZONE). IMMANUEL HYLAND MAKES IT!
Score: 76-51

[03:48] Team_016 possession (Score: 76-51)
Ben Barrett makes the Midrange and draws the foul on Shaquille Trent! And-1! Ben Barrett to the line for 1. [BONUS: 6 team fouls] (Shaquille Trent: 2 personal fouls)   FT 1/1: GOOD Ben Barrett makes 1/1 from the line.
Score: 79-51

[03:35] Team_026 possession (Score: 79-51)
Wendell Gasol attempts a 3Pt. Contested by Collin Barnes (4.3 feet, ZONE). WENDELL GASOL MAKES IT! Assist: Kobe Booker
Score: 79-54

[03:17] Team_016 possession (Score: 79-54)
Vince Quickley drives to the basket... Vince Quickley throws a bad pass out of bounds! TURNOVER! (dead ball)

[03:03] Team_026 possession (Score: 79-54)
Immanuel Hyland attempts a Midrange. Contested by Collin Barnes (4.8 feet, ZONE). Immanuel Hyland misses. Rebound secured by Ben Barrett.

[02:43] Team_016 possession (Score: 79-54)
Ben Barrett loses the ball! Stripped by Shaquille Trent! TURNOVER! (live ball)

[02:29] Team_026 possession (Score: 79-54)
Immanuel Hyland attempts a 3Pt. Contested by Giannis Ginobili (4.7 feet, MAN). Immanuel Hyland misses. Rebound secured by Vince Quickley.

[02:15] Team_016 possession (Score: 79-54)
Vince Quickley attempts a Layup. Wide open! Klay Giddey is 6.8 feet away. [MAN] Vince Quickley misses. Offensive rebound by Ben Barrett! Ben Barrett puts it back in!
Score: 81-54

[02:05] Team_026 possession (Score: 81-54)
Shaquille Trent throws a bad pass out of bounds! TURNOVER! (dead ball)

[02:05] Substitution (Team_016): Collin Barnes OUT → Lamelo Herro IN (stamina_rule2)

[02:05] Substitution (Team_016): Giannis Ginobili OUT → Immanuel Nowitzki IN (stamina_rule2)

[02:05] Substitution (Team_016): Ben Barrett OUT → Giannis Doncic IN (stamina_rule2)

[02:05] Substitution (Team_016): Vince Duncan OUT → Trae Barnes IN (stamina_rule2)

[02:05] Substitution (Team_026): Wendell Gasol OUT → Myles Tatum IN (stamina_rule2)

[02:05] Substitution (Team_026): Immanuel Hyland OUT → Karl Barrett IN (stamina_rule2)

[02:05] Substitution (Team_026): Klay Giddey OUT → Josh Simons IN (stamina_rule2)

[02:05] Substitution (Team_026): Shaquille Trent OUT → Damian Doncic IN (stamina_rule2)

[02:05] Substitution (Team_026): Kobe Booker OUT → Dirk Randle IN (stamina_rule2)

[01:49] Team_016 possession (Score: 81-54)
Immanuel Nowitzki attempts a 3Pt. Contested by Karl Barrett (2.9 feet, ZONE). IMMANUEL NOWITZKI MAKES IT! Assist: Vince Quickley
Score: 84-54

[01:35] Team_026 possession (Score: 84-54)
Dirk Randle drives, picks up Trae Barnes. Help arrives from Lamelo Herro! Dirk Randle attempts a Layup. Wide open! Lamelo Herro is 9.0 feet away. [MAN] DIRK RANDLE MAKES IT! Assist: Karl Barrett
Score: 84-56

[01:21] Team_016 possession (Score: 84-56)
Immanuel Nowitzki attempts a 3Pt. Wide open! Karl Barrett is 7.6 feet away. [ZONE] Immanuel Nowitzki misses. Rebound secured by Josh Simons.

[01:06] Team_026 possession (Score: 84-56)
Dirk Randle attempts a Midrange. Wide open! Trae Barnes is 8.3 feet away. [MAN] Dirk Randle misses. Rebound secured by Giannis Doncic.

[00:53] Team_016 possession (Score: 84-56)
Giannis Doncic attempts a Midrange. Contested by Damian Doncic (4.8 feet, ZONE). GIANNIS DONCIC MAKES IT!
Score: 86-56

[00:38] Team_026 possession (Score: 86-56)
Myles Tatum throws a bad pass! Stolen by Lamelo Herro! TURNOVER! (live ball)

[00:27] Team_016 possession (Score: 86-56)
Lamelo Herro makes the Midrange and draws the foul on Myles Tatum! And-1! Lamelo Herro to the line for 1. [BONUS: 7 team fouls] (Myles Tatum: 1 personal fouls)   FT 1/1: GOOD Lamelo Herro makes 1/1 from the line.
Score: 89-56

[00:15] Team_026 possession (Score: 89-56)
Josh Simons attempts a 3Pt. Contested by Vince Quickley (5.4 feet, MAN). Josh Simons misses. Rebound secured by Giannis Doncic.

================================================================================
                              3RD QUARTER COMPLETE                              
================================================================================

3RD QUARTER SCORE: Team_016 39, Team_026 14

BOX SCORE:
================================================================================

Team_016
--------------------------------------------------------------------------------
Player                MIN  PTS  REB  AST  TO      FG   FG%      3P   3P%
--------------------------------------------------------------------------------
Ben Barrett            24   11    2    1   0   5/6    83.3     0/0   0.0
Collin Barnes          24    9    0    2   0   4/6    66.7     0/0   0.0
Giannis Ginobili       24    8    0    0   0   3/3   100.0     0/0   0.0
Vince Duncan           24    3    2    1   0   1/2    50.0     0/0   0.0
Immanuel Nowitzki      13    3    0    0   0   1/2    50.0     0/0   0.0
Lamelo Herro           12    3    0    0   0   1/1   100.0     0/0   0.0
Giannis Doncic         13    2    2    0   0   1/1   100.0     0/0   0.0
Vince Quickley         26    0    3    1   0   0/0     0.0     0/0   0.0

TEAM: FG: 16/21 (76.2%), 3PT: 4/6 (66.7%), REB: 10 (2 off, 8 def), AST: 5, TO: 3
TEAM FOULS: 2


Team_026
--------------------------------------------------------------------------------
Player                MIN  PTS  REB  AST  TO      FG   FG%      3P   3P%
--------------------------------------------------------------------------------
Immanuel Hyland        24    4    1    1   0   2/5    40.0     0/0   0.0
Wendell Gasol          24    3    0    2   0   1/1   100.0     0/0   0.0
Kobe Booker            24    2    3    1   0   1/2    50.0     0/0   0.0
Klay Giddey            24    2    0    0   0   1/2    50.0     0/0   0.0
Dirk Randle            12    2    0    0   0   1/2    50.0     0/0   0.0
Shaquille Trent        24    1    1    0   0   1/2    50.0     0/0   0.0
Karl Barrett           12    0    0    1   0   0/0     0.0     0/0   0.0
Josh Simons            12    0    1    0   0   0/1     0.0     0/0   0.0

TEAM: FG: 7/15 (46.7%), 3PT: 1/3 (33.3%), REB: 5 (1 off, 4 def), AST: 5, TO: 9
TEAM FOULS: 7 [Team_016 in BONUS]

================================================================================

================================================================================
                       4TH QUARTER - Team_016 vs Team_026                       
================================================================================

[12:00] Team_016 possession (Score: 89-56)
Ben Barrett drives, Kobe Booker stays with him. Ben Barrett attempts a Dunk. Wide open! Kobe Booker is 6.0 feet away. [ZONE] Ben Barrett misses. Rebound secured by Kobe Booker.

[11:49] Team_026 possession (Score: 89-56)
Immanuel Hyland drives, Vince Duncan stays with him. Immanuel Hyland attempts a Layup. Heavily contested by Vince Duncan (0.7 feet, ZONE)! IMMANUEL HYLAND MAKES IT! Assist: Shaquille Trent
Score: 89-58

[11:36] Team_016 possession (Score: 89-58)
Collin Barnes attempts a Midrange. Contested by Shaquille Trent (5.1 feet, ZONE). Collin Barnes misses. Offensive rebound by Vince Duncan! Vince Duncan's putback is no good. Rebound secured by Immanuel Hyland.

[11:21] Team_026 possession (Score: 89-58)
Klay Giddey attempts a 3Pt. Contested by Collin Barnes (4.0 feet, ZONE). Klay Giddey misses. Rebound secured by Vince Duncan.

[11:04] Team_016 possession (Score: 89-58)
Vince Duncan attempts a Layup. Contested by Kobe Booker (5.3 feet, ZONE). VINCE DUNCAN MAKES IT! Assist: Giannis Ginobili
Score: 91-58

[10:50] Team_026 possession (Score: 91-58)
Immanuel Hyland attempts a Layup. Contested by Vince Duncan (2.6 feet, ZONE). IMMANUEL HYLAND MAKES IT!
Score: 91-60

[10:35] Team_016 possession (Score: 91-60)
Giannis Ginobili attempts a 3Pt. Contested by Immanuel Hyland (5.4 feet, MAN). GIANNIS GINOBILI MAKES IT! Assist: Vince Duncan
Score: 94-60

[10:19] Team_026 possession (Score: 94-60)
Wendell Gasol attempts a Midrange. Wide open! Collin Barnes is 6.3 feet away. [MAN] WENDELL GASOL MAKES IT! Assist: Shaquille Trent
Score: 94-62

[10:06] Team_016 possession (Score: 94-62)
Collin Barnes attempts a 3Pt. Wide open! Shaquille Trent is 6.4 feet away. [ZONE] COLLIN BARNES MAKES IT!
Score: 97-62

[09:53] Team_026 possession (Score: 97-62)
Wendell Gasol drives, Collin Barnes stays with him. Wendell Gasol attempts a Layup. Contested by Collin Barnes (3.5 feet, MAN). Wendell Gasol misses. Rebound secured by Vince Duncan.

[09:42] Team_016 possession (Score: 97-62)
Giannis Ginobili attempts a 3Pt. Wide open! Immanuel Hyland is 7.2 feet away. [MAN] Giannis Ginobili misses. Rebound secured by Kobe Booker.

[09:29] Team_026 possession (Score: 97-62)
Shaquille Trent attempts a 3Pt. Wide open! Ben Barrett is 6.2 feet away. [MAN] Shaquille Trent misses. Rebound secured by Vince Duncan.

[09:10] Team_016 possession (Score: 97-62)
Ben Barrett drives and kicks out. Giannis Ginobili attempts a 3Pt. Wide open! Immanuel Hyland is 9.5 feet away. [ZONE] GIANNIS GINOBILI MAKES IT! Assist: Ben Barrett
Score: 100-62

[08:52] Team_026 possession (Score: 100-62)
Immanuel Hyland attempts a 3Pt. Contested by Ben Barrett (4.8 feet, ZONE). Immanuel Hyland misses. Rebound secured by Vince Quickley.

[08:40] Team_016 possession (Score: 100-62)
Ben Barrett attempts a 3Pt. Contested by Immanuel Hyland (4.2 feet, ZONE). BEN BARRETT MAKES IT! Assist: Collin Barnes
Score: 103-62

[08:20] Team_026 possession (Score: 103-62)
Klay Giddey attempts a Midrange. Contested by Giannis Ginobili (5.9 feet, ZONE). KLAY GIDDEY MAKES IT!
Score: 103-64

[08:07] Team_016 possession (Score: 103-64)
Giannis Ginobili attempts a 3Pt. Heavily contested by Immanuel Hyland (1.9 feet, ZONE)! Giannis Ginobili misses. FOUL! Loose ball foul on Immanuel Hyland during the rebound battle. [Team fouls: 1] No free throws, side out. (Immanuel Hyland: 1 personal fouls)

[07:53] Team_016 possession (Score: 103-64)
Ben Barrett attempts a 3Pt. Wide open! Klay Giddey is 6.9 feet away. [ZONE] Ben Barrett misses. Rebound secured by Kobe Booker.

[07:37] Team_026 possession (Score: 103-64)
Kobe Booker attempts a Midrange. Wide open! Giannis Ginobili is 7.3 feet away. [ZONE] Kobe Booker misses. Offensive rebound by Kobe Booker! Kobe Booker kicks it out.

[07:25] Team_026 possession (Score: 103-64)
Shaquille Trent attempts a 3Pt. Wide open! Ben Barrett is 7.4 feet away. [MAN] Shaquille Trent misses. Offensive rebound by Kobe Booker! Kobe Booker kicks it out.

[07:14] Team_026 possession (Score: 103-64)
Klay Giddey attempts a 3Pt. Heavily contested by Vince Quickley (2.0 feet, MAN)! Klay Giddey misses. Offensive rebound by Kobe Booker! Kobe Booker kicks it out.

[07:03] Team_026 possession (Score: 103-64)
Wendell Gasol attempts a 3Pt. Wide open! Collin Barnes is 7.6 feet away. [MAN] Wendell Gasol misses. Rebound secured by Ben Barrett.

[06:49] Team_016 possession (Score: 103-64)
Vince Duncan drives to the basket... Vince Duncan throws a bad pass! Stolen by Kobe Booker! TURNOVER! (live ball)

[06:35] Team_026 possession (Score: 103-64)
Klay Giddey attempts a 3Pt. Contested by Vince Quickley (2.9 feet, MAN). Klay Giddey misses. Rebound secured by Vince Duncan.

[06:19] Team_016 possession (Score: 103-64)
Vince Duncan attempts a Layup. Contested by Kobe Booker (2.8 feet, MAN). Vince Duncan misses. Offensive rebound by Vince Duncan! Vince Duncan kicks it out.

[06:01] Team_016 possession (Score: 103-64)
Ben Barrett attempts a Midrange. Wide open! Shaquille Trent is 8.1 feet away. [MAN] BEN BARRETT MAKES IT! Assist: Vince Duncan
Score: 105-64

[05:47] Team_026 possession (Score: 105-64)
Kobe Booker attempts a Layup. BLOCKED BY GIANNIS GINOBILI! Ball is loose! Offensive rebound by Kobe Booker! Kobe Booker kicks it out.

[05:31] Team_026 possession (Score: 105-64)
FOUL! Offensive foul on Klay Giddey! Vince Quickley drew the charge! [Team fouls: 2] (Klay Giddey: 1 personal fouls) TURNOVER! (dead ball)

[05:17] Team_016 possession (Score: 105-64)
FOUL! Shooting foul on Wendell Gasol. Collin Barnes to the line for 2 free throws. [Team fouls: 3] (Wendell Gasol: 1 personal fouls)   FT 1/2: GOOD   FT 2/2: GOOD Collin Barnes makes 2/2 from the line.
Score: 107-64

[05:03] Team_026 possession (Score: 107-64)
Wendell Gasol attempts a 3Pt. Wide open! Collin Barnes is 6.8 feet away. [MAN] WENDELL GASOL MAKES IT! Assist: Shaquille Trent
Score: 107-67

[04:47] Team_016 possession (Score: 107-67)
Ben Barrett attempts a 3Pt. Wide open! Shaquille Trent is 6.6 feet away. [MAN] BEN BARRETT MAKES IT! Assist: Vince Duncan
Score: 110-67

[04:37] Team_026 possession (Score: 110-67)
Klay Giddey attempts a 3Pt. Contested by Collin Barnes (5.9 feet, ZONE). Klay Giddey misses. Offensive rebound by Shaquille Trent! Shaquille Trent kicks it out.

[04:19] Team_026 possession (Score: 110-67)
Klay Giddey attempts a 3Pt. Wide open! Vince Quickley is 6.2 feet away. [MAN] KLAY GIDDEY MAKES IT! Assist: Kobe Booker
Score: 110-70

[04:06] Team_016 possession (Score: 110-70)
FOUL! Holding foul on Kobe Booker. [Team fouls: 4] No free throws, side out. (Kobe Booker: 1 personal fouls)

[03:56] Team_016 possession (Score: 110-70)
Giannis Ginobili attempts a 3Pt. Contested by Immanuel Hyland (3.7 feet, MAN). Giannis Ginobili misses. Rebound secured by Shaquille Trent.

[03:40] Team_026 possession (Score: 110-70)
FOUL! Shooting foul on Vince Duncan. Kobe Booker to the line for 2 free throws. [Team fouls: 1] (Vince Duncan: 1 personal fouls)   FT 1/2: GOOD   FT 2/2: GOOD Kobe Booker makes 2/2 from the line.
Score: 110-72

[03:25] Team_016 possession (Score: 110-72)
Giannis Ginobili drives, Immanuel Hyland stays with him. Giannis Ginobili attempts a Dunk. Wide open! Immanuel Hyland is 6.4 feet away. [MAN] Giannis Ginobili misses. Rebound secured by Kobe Booker.

[03:08] Team_026 possession (Score: 110-72)
Klay Giddey attempts a Midrange. Contested by Vince Quickley (4.6 feet, ZONE). Klay Giddey misses. Rebound secured by Ben Barrett.

[02:50] Team_016 possession (Score: 110-72)
Vince Duncan attempts a Layup. Heavily contested by Kobe Booker (0.5 feet, ZONE)! Vince Duncan misses. Rebound secured by Immanuel Hyland.

[02:38] Team_026 possession (Score: 110-72)
FOUL! Shooting foul on Vince Duncan. Immanuel Hyland to the line for 2 free throws. [Team fouls: 2] (Vince Duncan: 2 personal fouls)   FT 1/2: GOOD   FT 2/2: GOOD Immanuel Hyland makes 2/2 from the line.
Score: 110-74

[02:24] Team_016 possession (Score: 110-74)
Vince Quickley attempts a Midrange. Contested by Klay Giddey (5.3 feet, MAN). Vince Quickley misses. Rebound secured by Immanuel Hyland.

[02:09] Team_026 possession (Score: 110-74)
Immanuel Hyland drives, Ben Barrett stays with him. Immanuel Hyland attempts a Layup. Wide open! Ben Barrett is 8.3 feet away. [ZONE] Immanuel Hyland misses. Rebound secured by Vince Duncan.

[01:54] Team_016 possession (Score: 110-74)
Collin Barnes attempts a 3Pt. Wide open! Immanuel Hyland is 6.2 feet away. [ZONE] Collin Barnes misses. Offensive rebound by Vince Duncan! Vince Duncan kicks it out.

[01:39] Team_016 possession (Score: 110-74)
Vince Duncan drives, picks up Kobe Booker. Help arrives from Immanuel Hyland! Vince Duncan attempts a Layup. Contested by Immanuel Hyland (3.4 feet, ZONE). VINCE DUNCAN MAKES IT! Assist: Vince Quickley
Score: 112-74

[01:23] Team_026 possession (Score: 112-74)
FOUL! Reach-in foul on Vince Duncan during the drive. [Team fouls: 3] No free throws, side out. (Vince Duncan: 3 personal fouls)

[01:09] Team_026 possession (Score: 112-74)
Wendell Gasol attempts a Layup. Wide open! Collin Barnes is 6.4 feet away. [MAN] Wendell Gasol misses. Rebound secured by Vince Quickley.

[00:53] Team_016 possession (Score: 112-74)
Vince Quickley loses the ball! Stripped by Klay Giddey! TURNOVER! (live ball)

[00:41] Team_026 possession (Score: 112-74)
Klay Giddey attempts a 3Pt. Contested by Vince Quickley (5.1 feet, MAN). KLAY GIDDEY MAKES IT!
Score: 112-77

[00:30] Team_016 possession (Score: 112-77)
Giannis Ginobili attempts a 3Pt. Wide open! Immanuel Hyland is 7.1 feet away. [MAN] Giannis Ginobili misses. Rebound secured by Shaquille Trent.

[00:18] Team_026 possession (Score: 112-77)
Immanuel Hyland drives to the basket... Immanuel Hyland throws a bad pass out of bounds! TURNOVER! (dead ball)

[00:18] Substitution (Team_016): Collin Barnes OUT → Lamelo Herro IN (stamina_rule2)

[00:18] Substitution (Team_016): Giannis Ginobili OUT → Immanuel Nowitzki IN (stamina_rule2)

[00:18] Substitution (Team_016): Vince Quickley OUT → Kevin Butler IN (stamina_rule2)

[00:18] Substitution (Team_016): Ben Barrett OUT → Giannis Doncic IN (stamina_rule2)

[00:18] Substitution (Team_016): Vince Duncan OUT → Trae Barnes IN (stamina_rule2)

[00:18] Substitution (Team_026): Wendell Gasol OUT → Myles Tatum IN (stamina_rule2)

[00:18] Substitution (Team_026): Immanuel Hyland OUT → Karl Barrett IN (stamina_rule2)

[00:18] Substitution (Team_026): Klay Giddey OUT → Josh Simons IN (stamina_rule2)

[00:18] Substitution (Team_026): Shaquille Trent OUT → Damian Doncic IN (stamina_rule2)

[00:18] Substitution (Team_026): Kobe Booker OUT → Dirk Randle IN (stamina_rule2)

[00:03] Team_016 possession (Score: 112-77)
Immanuel Nowitzki drives and kicks out. Giannis Doncic attempts a Midrange. Contested by Damian Doncic (6.0 feet, MAN). Giannis Doncic misses. Rebound secured by Karl Barrett.

================================================================================
                              4TH QUARTER COMPLETE                              
================================================================================

4TH QUARTER SCORE: Team_016 23, Team_026 21

BOX SCORE:
================================================================================

Team_016
--------------------------------------------------------------------------------
Player                MIN  PTS  REB  AST  TO      FG   FG%      3P   3P%
--------------------------------------------------------------------------------
Ben Barrett            36    8    2    1   0   3/5    60.0     0/0   0.0
Giannis Ginobili       36    6    0    1   0   2/6    33.3     0/0   0.0
Collin Barnes          36    5    0    1   0   2/3    66.7     0/0   0.0
Vince Duncan           36    4    8    3   0   2/3    66.7     0/0   0.0
Vince Quickley         37    0    2    1   0   0/1     0.0     0/0   0.0
Immanuel Nowitzki      13    0    0    0   0   0/1     0.0     0/0   0.0

TEAM: FG: 9/19 (47.4%), 3PT: 4/8 (50.0%), REB: 13 (4 off, 9 def), AST: 7, TO: 2
TEAM FOULS: 3


Team_026
--------------------------------------------------------------------------------
Player                MIN  PTS  REB  AST  TO      FG   FG%      3P   3P%
--------------------------------------------------------------------------------
Klay Giddey            36    8    0    0   0   3/6    50.0     0/0   0.0
Immanuel Hyland        36    6    3    0   0   3/5    60.0     0/0   0.0
Wendell Gasol          36    5    0    0   0   2/5    40.0     0/0   0.0
Kobe Booker            36    2    8    1   0   1/1   100.0     0/0   0.0
Shaquille Trent        36    0    3    3   0   0/1     0.0     0/0   0.0
Karl Barrett           12    0    1    0   0   0/0     0.0     0/0   0.0

TEAM: FG: 9/18 (50.0%), 3PT: 3/8 (37.5%), REB: 14 (5 off, 9 def), AST: 4, TO: 2
TEAM FOULS: 4

================================================================================

================================================================================
                               FULL GAME COMPLETE                               
================================================================================

FINAL SCORE: Team_016 112, Team_026 77

SCORING BY QUARTER:
--------------------------------------------------------------------------------
Team                     Q1     Q2     Q3     Q4    FINAL
--------------------------------------------------------------------------------
Team_016                 28     22     39     23      112
Team_026                 16     26     14     21       77
--------------------------------------------------------------------------------

FULL GAME BOX SCORE:
================================================================================

Team_016
--------------------------------------------------------------------------------
Player                MIN  PTS  REB  AST  TO      FG   FG%      3P   3P%      FT STL BLK
--------------------------------------------------------------------------------
Vince Quickley         37   11    8    3   1   5/8    62.5   3/4    75.0   0/0     1   0
Collin Barnes          36   19    0    5   2   7/13   53.8   3/6    50.0   4/4     1   0
Giannis Ginobili       36   17    0    1   2   5/12   41.7   4/9    44.4   0/0     0   1
Ben Barrett            36   23    8    4   1   9/12   75.0   2/3    66.7   3/3     1   0
Vince Duncan           36   15   17    7   2   7/12   58.3   0/0     0.0   1/1     1   1
Immanuel Nowitzki      13    7    0    0   1   3/6    50.0   1/3    33.3   0/0     0   1
Giannis Doncic         13    6    5    1   0   3/5    60.0   0/0     0.0   0/0     1   2
Trae Barnes            13    3    1    1   1   1/3    33.3   1/1   100.0   0/0     0   0
Lamelo Herro           12    7    4    2   0   4/4   100.0   1/1   100.0   1/1     2   0
Kevin Butler           11    4    0    1   1   1/2    50.0   1/2    50.0   1/1     0   1

TEAM: FG: 46/78 (59.0%), 3PT: 16/29 (55.2%), REB: 46 (11 off, 35 def), AST: 25, TO: 11


Team_026
--------------------------------------------------------------------------------
Player                MIN  PTS  REB  AST  TO      FG   FG%      3P   3P%      FT STL BLK
--------------------------------------------------------------------------------
Immanuel Hyland        36   10    4    1   2   5/11   45.5   0/2     0.0   2/2     0   0
Klay Giddey            36   19    0    0   2   7/15   46.7   5/8    62.5   0/0     1   0
Shaquille Trent        36    7   15    3   6   2/6    33.3   0/1     0.0   2/3     1   1
Kobe Booker            36    8   20    5   3   5/8    62.5   0/0     0.0   2/2     1   0
Wendell Gasol          36   10    0    4   3   3/8    37.5   2/4    50.0   2/2     0   0
Myles Tatum            13    5    0    1   2   2/4    50.0   1/1   100.0   2/2     0   0
Karl Barrett           12    5    2    3   0   2/2   100.0   1/1   100.0   0/0     0   0
Josh Simons            12    4    4    1   0   2/7    28.6   0/4     0.0   2/2     0   0
Damian Doncic          12    4    3    1   2   2/3    66.7   0/1     0.0   0/3     1   0
Dirk Randle            12    2    0    1   0   1/3    33.3   0/0     0.0   0/0     0   0

TEAM: FG: 32/68 (47.1%), 3PT: 9/22 (40.9%), REB: 45 (16 off, 29 def), AST: 20, TO: 20

================================================================================
