================================================================================
                        FULL GAME - Team_016 vs Team_050                        
================================================================================

================================================================================
                       1ST QUARTER - Team_016 vs Team_050                       
================================================================================

[12:00] Team_016 possession (Score: 0-0)
Vince Duncan attempts a Midrange. Wide open! LeBron Bridges is 6.5 feet away. [ZONE] Vince Duncan misses. Rebound secured by Joel Banchero.

[11:46] Team_050 possession (Score: 0-0)
Joel Banchero attempts a Midrange. Contested by Giannis Ginobili (3.2 feet, ZONE). Joel Banchero misses. Rebound secured by Ben Barrett.

[11:33] Team_016 possession (Score: 0-0)
Giannis Ginobili drives, Joel Banchero stays with him. Giannis Ginobili attempts a Dunk. Contested by Joel Banchero (2.3 feet, MAN). Giannis Ginobili misses. Rebound secured by LeBron Bridges.

[11:18] Team_050 possession (Score: 0-0)
Giannis LaVine attempts a Layup. Wide open! Collin Barnes is 7.1 feet away. [MAN] Giannis LaVine misses. Offensive rebound by LeBron Bridges! LeBron Bridges kicks it out.

[11:07] Team_050 possession (Score: 0-0)
Collin Bane attempts a 3Pt. Contested by Vince Quickley (3.0 feet, MAN). COLLIN BANE MAKES IT! Assist: LeBron Bridges
Score: 0-3

[10:55] Team_016 possession (Score: 0-3)
Giannis Ginobili attempts a Midrange. Contested by Collin Bane (2.9 feet, ZONE). GIANNIS GINOBILI MAKES IT! Assist: Vince Quickley
Score: 2-3

[10:40] Team_050 possession (Score: 2-3)
Donovan Trent drives, Vince Duncan stays with him. Donovan Trent attempts a Layup. Contested by Vince Duncan (2.6 feet, ZONE). DONOVAN TRENT MAKES IT! Assist: Collin Bane
Score: 2-5

[10:24] Team_016 possession (Score: 2-5)
Vince Quickley attempts a 3Pt. Contested by Giannis LaVine (3.8 feet, ZONE). Vince Quickley misses. Rebound secured by Collin Bane.

[10:08] Team_050 possession (Score: 2-5)
Collin Bane attempts a 3Pt. Wide open! Vince Quickley is 6.8 feet away. [ZONE] Collin Bane misses. Rebound secured by Vince Duncan.

[09:54] Team_016 possession (Score: 2-5)
Vince Quickley attempts a Midrange. Heavily contested by LeBron Bridges (0.5 feet, ZONE)! Vince Quickley misses. FOUL! Loose ball foul on LeBron Bridges during the rebound battle. [Team fouls: 1] No free throws, side out. (LeBron Bridges: 1 personal fouls)

[09:43] Team_016 possession (Score: 2-5)
FOUL! Shooting foul on Donovan Trent. Vince Quickley to the line for 2 free throws. [Team fouls: 2] (Donovan Trent: 1 personal fouls)   FT 1/2: GOOD   FT 2/2: GOOD Vince Quickley makes 2/2 from the line.
Score: 4-5

[09:33] Team_050 possession (Score: 4-5)
Collin Bane attempts a Midrange. Wide open! Vince Quickley is 7.3 feet away. [MAN] COLLIN BANE MAKES IT! Assist: Donovan Trent
Score: 4-7

[09:22] Team_016 possession (Score: 4-7)
Giannis Ginobili attempts a 3Pt. Contested by Joel Banchero (4.4 feet, MAN). Giannis Ginobili misses. Offensive rebound by Ben Barrett! Ben Barrett puts it back in!
Score: 6-7

[09:09] Team_050 possession (Score: 6-7)
Donovan Trent attempts a Midrange. Contested by Vince Duncan (5.2 feet, MAN). Donovan Trent misses. Offensive rebound by LeBron Bridges! LeBron Bridges kicks it out.

[08:55] Team_050 possession (Score: 6-7)
Joel Banchero attempts a Midrange. Wide open! Giannis Ginobili is 7.8 feet away. [MAN] Joel Banchero misses. Rebound secured by Ben Barrett.

[08:41] Team_016 possession (Score: 6-7)
Vince Quickley drives and kicks out. Collin Barnes attempts a Midrange. Contested by Giannis LaVine (5.5 feet, MAN). COLLIN BARNES MAKES IT! Assist: Ben Barrett
Score: 8-7

[08:25] Team_050 possession (Score: 8-7)
LeBron Bridges attempts a 3Pt. Contested by Collin Barnes (4.3 feet, ZONE). LEBRON BRIDGES MAKES IT! Assist: Joel Banchero
Score: 8-10

[08:11] Team_016 possession (Score: 8-10)
Vince Duncan makes the Dunk and draws the foul on Donovan Trent! And-1! Vince Duncan to the line for 1. [Team fouls: 3] (Donovan Trent: 2 personal fouls)   FT 1/1: GOOD Vince Duncan makes 1/1 from the line.
Score: 11-10

[07:54] Team_050 possession (Score: 11-10)
Collin Bane attempts a Layup. Heavily contested by Vince Quickley (1.1 feet, MAN)! Collin Bane misses. Rebound secured by Vince Duncan.

[07:41] Team_016 possession (Score: 11-10)
Ben Barrett attempts a Layup. Contested by Donovan Trent (5.4 feet, ZONE). BEN BARRETT MAKES IT!
Score: 13-10

[07:26] Team_050 possession (Score: 13-10)
LeBron Bridges makes the Layup and draws the foul on Vince Duncan! And-1! LeBron Bridges to the line for 1. [Team fouls: 1] (Vince Duncan: 1 personal fouls)   FT 1/1: GOOD LeBron Bridges makes 1/1 from the line.
Score: 13-13

[07:12] Team_016 possession (Score: 13-13)
FOUL! Reach-in foul on Collin Bane during the drive. [Team fouls: 4] No free throws, side out. (Collin Bane: 1 personal fouls)

[07:00] Team_016 possession (Score: 13-13)
Vince Quickley attempts a Layup. BLOCKED BY COLLIN BANE! Ball is loose! Rebound secured by Joel Banchero.

[06:44] Team_050 possession (Score: 13-13)
Collin Bane loses the ball! Stripped by Vince Quickley! TURNOVER! (live ball)

[06:29] Team_016 possession (Score: 13-13)
Collin Barnes attempts a 3Pt. Contested by Giannis LaVine (4.4 feet, ZONE). Collin Barnes misses. Offensive rebound by Vince Duncan! Vince Duncan's putback is no good. Rebound secured by Joel Banchero.

[06:14] Team_050 possession (Score: 13-13)
Giannis LaVine attempts a 3Pt. Contested by Collin Barnes (4.1 feet, ZONE). Giannis LaVine misses. Rebound secured by Ben Barrett.

[06:01] Team_016 possession (Score: 13-13)
Giannis Ginobili drives to the basket... Giannis Ginobili throws a bad pass out of bounds! TURNOVER! (dead ball)

[05:45] Team_050 possession (Score: 13-13)
Giannis LaVine attempts a 3Pt. Contested by Ben Barrett (4.7 feet, ZONE). Giannis LaVine misses. Offensive rebound by Collin Bane! Collin Bane kicks it out.

[05:28] Team_050 possession (Score: 13-13)
FOUL! Offensive foul on Giannis LaVine! Collin Barnes drew the charge! [Team fouls: 5] (Giannis LaVine: 1 personal fouls) TURNOVER! (dead ball)

[05:14] Team_016 possession (Score: 13-13)
Giannis Ginobili attempts a Midrange. Wide open! LeBron Bridges is 6.7 feet away. [ZONE] Giannis Ginobili misses. Offensive rebound by Vince Duncan! Vince Duncan puts it back in!
Score: 15-13

[04:57] Team_050 possession (Score: 15-13)
FOUL! Reach-in foul on Ben Barrett during the drive. [Team fouls: 2] No free throws, side out. (Ben Barrett: 1 personal fouls)

[04:42] Team_050 possession (Score: 15-13)
LeBron Bridges drives to the basket... LeBron Bridges throws a bad pass out of bounds! TURNOVER! (dead ball)

[04:25] Team_016 possession (Score: 15-13)
Collin Barnes drives to the basket... FOUL! Offensive foul on Collin Barnes! Giannis LaVine drew the charge! [Team fouls: 3] (Collin Barnes: 1 personal fouls) TURNOVER! (dead ball)

[04:14] Team_050 possession (Score: 15-13)
LeBron Bridges throws a bad pass out of bounds! TURNOVER! (dead ball)

[03:59] Team_016 possession (Score: 15-13)
Collin Barnes attempts a Layup. BLOCKED BY DONOVAN TRENT! Ball is loose! Rebound secured by Joel Banchero.

[03:42] Team_050 possession (Score: 15-13)
Collin Bane drives and kicks out. Giannis LaVine attempts a 3Pt. Contested by Collin Barnes (2.5 feet, MAN). Giannis LaVine misses. Rebound secured by Vince Duncan.

[03:29] Team_016 possession (Score: 15-13)
Ben Barrett attempts a Midrange. Contested by Collin Bane (2.9 feet, ZONE). BEN BARRETT MAKES IT!
Score: 17-13

[03:20] Team_050 possession (Score: 17-13)
Collin Bane attempts a 3Pt. Contested by Collin Barnes (5.0 feet, ZONE). Collin Bane misses. Rebound secured by Vince Duncan.

[03:06] Team_016 possession (Score: 17-13)
Ben Barrett attempts a Midrange. Contested by Donovan Trent (6.0 feet, ZONE). BEN BARRETT MAKES IT! Assist: Collin Barnes
Score: 19-13

[02:46] Team_050 possession (Score: 19-13)
Giannis LaVine attempts a Midrange. Contested by Vince Quickley (4.6 feet, ZONE). GIANNIS LAVINE MAKES IT! Assist: LeBron Bridges
Score: 19-15

[02:36] Team_016 possession (Score: 19-15)
Giannis Ginobili drives and kicks out. Collin Barnes attempts a Midrange. Contested by Collin Bane (4.0 feet, ZONE). COLLIN BARNES MAKES IT! Assist: Vince Quickley
Score: 21-15

[02:21] Team_050 possession (Score: 21-15)
Donovan Trent drives to the basket... Donovan Trent throws a bad pass out of bounds! TURNOVER! (dead ball)

[02:21] Substitution (Team_016): Collin Barnes OUT → Lamelo Herro IN (stamina_rule2)

[02:21] Substitution (Team_016): Ben Barrett OUT → Giannis Doncic IN (stamina_rule2)

[02:21] Substitution (Team_016): Vince Duncan OUT → Trae Barnes IN (stamina_rule2)

[02:21] Substitution (Team_050): Giannis LaVine OUT → Damian O'Neal IN (stamina_rule2)

[02:21] Substitution (Team_050): Joel Banchero OUT → Dwyane Towns IN (stamina_rule2)

[02:21] Substitution (Team_050): Collin Bane OUT → Larry Curry IN (stamina_rule2)

[02:21] Substitution (Team_050): LeBron Bridges OUT → Luka Gasol IN (stamina_rule2)

[02:21] Substitution (Team_050): Donovan Trent OUT → Tyler Smith IN (stamina_rule2)

[02:08] Team_016 possession (Score: 21-15)
Trae Barnes attempts a 3Pt. Contested by Luka Gasol (4.4 feet, ZONE). Trae Barnes misses. Rebound secured by Larry Curry.

[01:59] Team_050 possession (Score: 21-15)
Dwyane Towns attempts a 3Pt. Contested by Giannis Ginobili (5.3 feet, MAN). DWYANE TOWNS MAKES IT! Assist: Damian O'Neal
Score: 21-18

[01:46] Team_016 possession (Score: 21-18)
Giannis Doncic attempts a 3Pt. Contested by Luka Gasol (4.0 feet, ZONE). Giannis Doncic misses. FOUL! Loose ball foul on Larry Curry during the rebound battle. [IN THE BONUS! 6 team fouls] Vince Quickley to the line for 2 free throws. (Larry Curry: 1 personal fouls)   FT 1/2: GOOD   FT 2/2: GOOD Vince Quickley makes 2/2 from the line.
Score: 23-18

[01:32] Team_050 possession (Score: 23-18)
Tyler Smith makes the Dunk and draws the foul on Trae Barnes! And-1! Tyler Smith to the line for 1. [Team fouls: 4] (Trae Barnes: 1 personal fouls)   FT 1/1: GOOD Tyler Smith makes 1/1 from the line.
Score: 23-21

[01:15] Team_016 possession (Score: 23-21)
Lamelo Herro attempts a Midrange. Contested by Dwyane Towns (4.6 feet, ZONE). LAMELO HERRO MAKES IT!
Score: 25-21

[01:02] Team_050 possession (Score: 25-21)
Larry Curry attempts a Layup. Contested by Vince Quickley (2.6 feet, MAN). LARRY CURRY MAKES IT!
Score: 25-23

[00:44] Team_016 possession (Score: 25-23)
Vince Quickley attempts a 3Pt. Contested by Larry Curry (5.7 feet, MAN). Vince Quickley misses. FOUL! Loose ball foul on Dwyane Towns during the rebound battle. [IN THE BONUS! 7 team fouls] Trae Barnes to the line for 2 free throws. (Dwyane Towns: 1 personal fouls)   FT 1/2: GOOD   FT 2/2: GOOD Trae Barnes makes 2/2 from the line.
Score: 27-23

[00:27] Team_050 possession (Score: 27-23)
Luka Gasol drives to the basket... FOUL! Offensive foul on Luka Gasol! Giannis Doncic drew the charge! [Team fouls: 8] (Luka Gasol: 1 personal fouls) TURNOVER! (dead ball)

[00:12] Team_016 possession (Score: 27-23)
Trae Barnes drives to the basket... FOUL! Offensive foul on Trae Barnes! Tyler Smith drew the charge! [Team fouls: 5] (Trae Barnes: 2 personal fouls) TURNOVER! (dead ball)

================================================================================
                              1ST QUARTER COMPLETE                              
================================================================================

1ST QUARTER SCORE: Team_016 27, Team_050 23

BOX SCORE:
================================================================================

Team_016
--------------------------------------------------------------------------------
Player                MIN  PTS  REB  AST  TO      FG   FG%      3P   3P%
--------------------------------------------------------------------------------
Ben Barrett            10    8    4    1   0   4/4   100.0     0/0   0.0
Vince Duncan           10    5    6    0   0   2/3    66.7     0/0   0.0
Vince Quickley         12    4    0    2   0   2/4    50.0     0/0   0.0
Collin Barnes          10    4    0    1   0   2/4    50.0     0/0   0.0
Giannis Ginobili       12    2    0    0   0   1/2    50.0     0/0   0.0
Trae Barnes             2    2    0    0   0   1/2    50.0     0/0   0.0
Lamelo Herro            2    2    0    0   0   1/1   100.0     0/0   0.0

TEAM: FG: 13/20 (65.0%), 3PT: 3/6 (50.0%), REB: 11 (4 off, 7 def), AST: 4, TO: 3
TEAM FOULS: 5 [Team_050 in BONUS]


Team_050
--------------------------------------------------------------------------------
Player                MIN  PTS  REB  AST  TO      FG   FG%      3P   3P%
--------------------------------------------------------------------------------
LeBron Bridges         10    6    3    2   0   2/2   100.0     0/0   0.0
Collin Bane            10    5    2    1   0   2/6    33.3     0/0   0.0
Dwyane Towns            2    3    0    0   0   1/1   100.0     0/0   0.0
Tyler Smith             2    3    0    0   0   1/1   100.0     0/0   0.0
Donovan Trent          10    2    0    1   0   1/1   100.0     0/0   0.0
Giannis LaVine         10    2    0    0   0   1/2    50.0     0/0   0.0
Larry Curry             2    2    1    0   0   1/1   100.0     0/0   0.0
Joel Banchero          10    0    4    1   0   0/2     0.0     0/0   0.0
Damian O'Neal           2    0    0    1   0   0/0     0.0     0/0   0.0

TEAM: FG: 9/16 (56.2%), 3PT: 3/6 (50.0%), REB: 9 (3 off, 6 def), AST: 6, TO: 6
TEAM FOULS: 8 [Team_016 in BONUS]

================================================================================

================================================================================
                       2ND QUARTER - Team_016 vs Team_050                       
================================================================================

[12:00] Team_016 possession (Score: 27-23)
Vince Quickley attempts a 3Pt. Contested by Collin Bane (4.7 feet, MAN). Vince Quickley misses. Rebound secured by LeBron Bridges.

[11:49] Team_050 possession (Score: 27-23)
Joel Banchero attempts a 3Pt. Wide open! Giannis Ginobili is 7.4 feet away. [MAN] Joel Banchero misses. Rebound secured by Vince Quickley.

[11:35] Team_016 possession (Score: 27-23)
Vince Duncan attempts a Midrange. Wide open! Donovan Trent is 9.9 feet away. [MAN] Vince Duncan misses. Rebound secured by Collin Bane.

[11:22] Team_050 possession (Score: 27-23)
Collin Bane attempts a 3Pt. Contested by Vince Quickley (4.0 feet, MAN). Collin Bane misses. Rebound secured by Vince Quickley.

[11:11] Team_016 possession (Score: 27-23)
Collin Barnes attempts a 3Pt. Contested by Giannis LaVine (3.5 feet, ZONE). Collin Barnes misses. Rebound secured by Collin Bane.

[10:58] Team_050 possession (Score: 27-23)
FOUL! Reach-in foul on Vince Duncan during the drive. [Team fouls: 1] No free throws, side out. (Vince Duncan: 1 personal fouls)

[10:42] Team_050 possession (Score: 27-23)
Collin Bane attempts a Layup. BLOCKED BY VINCE QUICKLEY! Ball is loose! Offensive rebound by Collin Bane! Collin Bane kicks it out.

[10:29] Team_050 possession (Score: 27-23)
LeBron Bridges attempts a Midrange. Contested by Ben Barrett (5.3 feet, ZONE). LeBron Bridges misses. Rebound secured by Vince Quickley.

[10:14] Team_016 possession (Score: 27-23)
Vince Quickley attempts a 3Pt. Contested by Giannis LaVine (3.1 feet, ZONE). Vince Quickley misses. Offensive rebound by Ben Barrett! Ben Barrett's putback is no good. Rebound secured by Collin Bane.

[09:57] Team_050 possession (Score: 27-23)
Donovan Trent drives, picks up Vince Duncan. Help arrives from Collin Barnes! Donovan Trent attempts a Layup. Contested by Collin Barnes (4.2 feet, ZONE). Donovan Trent misses. Rebound secured by Vince Duncan.

[09:45] Team_016 possession (Score: 27-23)
Giannis Ginobili attempts a 3Pt. Contested by Joel Banchero (3.9 feet, MAN). Giannis Ginobili misses. Offensive rebound by Vince Duncan! Vince Duncan kicks it out.

[09:35] Team_016 possession (Score: 27-23)
FOUL! Holding foul on Giannis LaVine. [Team fouls: 1] No free throws, side out. (Giannis LaVine: 1 personal fouls)

[09:24] Team_016 possession (Score: 27-23)
Collin Barnes drives, Donovan Trent stays with him. Collin Barnes attempts a Dunk. Contested by Donovan Trent (5.7 feet, ZONE). Collin Barnes misses. Offensive rebound by Vince Duncan! Vince Duncan kicks it out.

[09:06] Team_016 possession (Score: 27-23)
Giannis Ginobili attempts a Layup. Contested by Donovan Trent (5.7 feet, ZONE). Giannis Ginobili misses. Rebound secured by Collin Bane.

[08:49] Team_050 possession (Score: 27-23)
Joel Banchero attempts a 3Pt. Contested by Collin Barnes (3.4 feet, ZONE). JOEL BANCHERO MAKES IT! Assist: LeBron Bridges
Score: 27-26

[08:33] Team_016 possession (Score: 27-26)
Giannis Ginobili loses control! Ball rolls out of bounds! TURNOVER! (dead ball)

[08:33] Substitution (Team_016): Collin Barnes OUT → Lamelo Herro IN (stamina_rule2)

[08:33] Substitution (Team_016): Giannis Ginobili OUT → Immanuel Nowitzki IN (stamina_rule2)

[08:33] Substitution (Team_016): Vince Quickley OUT → Kevin Butler IN (stamina_rule2)

[08:33] Substitution (Team_016): Ben Barrett OUT → Giannis Doncic IN (stamina_rule2)

[08:33] Substitution (Team_016): Vince Duncan OUT → Trae Barnes IN (stamina_rule2)

[08:33] Substitution (Team_050): Giannis LaVine OUT → Damian O'Neal IN (stamina_rule2)

[08:33] Substitution (Team_050): Joel Banchero OUT → Dwyane Towns IN (stamina_rule2)

[08:33] Substitution (Team_050): Collin Bane OUT → Larry Curry IN (stamina_rule2)

[08:33] Substitution (Team_050): LeBron Bridges OUT → Luka Gasol IN (stamina_rule2)

[08:33] Substitution (Team_050): Donovan Trent OUT → Tyler Smith IN (stamina_rule2)

[08:20] Team_050 possession (Score: 27-26)
Larry Curry throws a bad pass out of bounds! TURNOVER! (dead ball)

[08:04] Team_016 possession (Score: 27-26)
Lamelo Herro drives, Tyler Smith stays with him. Lamelo Herro attempts a Layup. Heavily contested by Tyler Smith (1.5 feet, ZONE)! LAMELO HERRO MAKES IT! Assist: Trae Barnes
Score: 29-26

[07:52] Team_050 possession (Score: 29-26)
Larry Curry attempts a Layup. Contested by Kevin Butler (3.9 feet, MAN). LARRY CURRY MAKES IT! Assist: Luka Gasol
Score: 29-28

[07:37] Team_016 possession (Score: 29-28)
Kevin Butler throws a bad pass! Stolen by Larry Curry! TURNOVER! (live ball)

[07:26] Team_050 possession (Score: 29-28)
Dwyane Towns loses the ball! Stripped by Immanuel Nowitzki! TURNOVER! (live ball)

[07:13] Team_016 possession (Score: 29-28)
Immanuel Nowitzki attempts a Midrange. Wide open! Damian O'Neal is 9.0 feet away. [ZONE] IMMANUEL NOWITZKI MAKES IT! Assist: Giannis Doncic
Score: 31-28

[07:00] Team_050 possession (Score: 31-28)
Damian O'Neal attempts a 3Pt. Contested by Lamelo Herro (3.4 feet, ZONE). Damian O'Neal misses. Offensive rebound by Tyler Smith! Tyler Smith kicks it out.

[06:42] Team_050 possession (Score: 31-28)
Damian O'Neal attempts a 3Pt. Wide open! Lamelo Herro is 7.2 feet away. [MAN] Damian O'Neal misses. Rebound secured by Giannis Doncic.

[06:29] Team_016 possession (Score: 31-28)
Lamelo Herro attempts a Midrange. Contested by Damian O'Neal (4.7 feet, MAN). LAMELO HERRO MAKES IT!
Score: 33-28

[06:16] Team_050 possession (Score: 33-28)
Tyler Smith drives, picks up Trae Barnes. Help arrives from Lamelo Herro! Tyler Smith attempts a Layup. Contested by Lamelo Herro (4.6 feet, MAN). Tyler Smith misses. Offensive rebound by Tyler Smith! Tyler Smith kicks it out.

[06:04] Team_050 possession (Score: 33-28)
Tyler Smith attempts a Layup. Contested by Trae Barnes (4.1 feet, MAN). Tyler Smith misses. Rebound secured by Giannis Doncic.

[05:46] Team_016 possession (Score: 33-28)
Lamelo Herro attempts a 3Pt. Wide open! Damian O'Neal is 7.8 feet away. [MAN] LAMELO HERRO MAKES IT! Assist: Giannis Doncic
Score: 36-28

[05:32] Team_050 possession (Score: 36-28)
Tyler Smith attempts a Layup. Contested by Trae Barnes (4.3 feet, MAN). TYLER SMITH MAKES IT! Assist: Luka Gasol
Score: 36-30

[05:22] Team_016 possession (Score: 36-30)
Trae Barnes attempts a Layup. BLOCKED BY TYLER SMITH! Ball is loose! Rebound secured by Larry Curry.

[05:12] Team_050 possession (Score: 36-30)
Larry Curry attempts a 3Pt. Contested by Kevin Butler (4.1 feet, MAN). Larry Curry misses. Rebound secured by Giannis Doncic.

[04:59] Team_016 possession (Score: 36-30)
Lamelo Herro drives and kicks out. FOUL! Shooting foul on Luka Gasol. Giannis Doncic to the line for 3 free throws. [Team fouls: 2] (Luka Gasol: 1 personal fouls)   FT 1/3: GOOD   FT 2/3: MISS   FT 3/3: GOOD Giannis Doncic makes 2/3 from the line.
Score: 38-30

[04:43] Team_050 possession (Score: 38-30)
Dwyane Towns attempts a Layup. Contested by Immanuel Nowitzki (4.6 feet, MAN). Dwyane Towns misses. Offensive rebound by Tyler Smith! Tyler Smith kicks it out.

[04:26] Team_050 possession (Score: 38-30)
Damian O'Neal attempts a Layup. BLOCKED BY LAMELO HERRO! Ball is loose! Offensive rebound by Larry Curry! Larry Curry kicks it out.

[04:13] Team_050 possession (Score: 38-30)
FOUL! Reach-in foul on Trae Barnes during the drive. [Team fouls: 3] No free throws, side out. (Trae Barnes: 2 personal fouls)

[03:55] Team_050 possession (Score: 38-30)
Dwyane Towns drives and kicks out. Larry Curry attempts a 3Pt. Contested by Lamelo Herro (3.9 feet, ZONE). Larry Curry misses. Rebound secured by Lamelo Herro.

[03:41] Team_016 possession (Score: 38-30)
Giannis Doncic drives and kicks out. Kevin Butler attempts a Midrange. Wide open! Dwyane Towns is 8.1 feet away. [ZONE] Kevin Butler misses. Rebound secured by Dwyane Towns.

[03:32] Team_050 possession (Score: 38-30)
Tyler Smith attempts a Midrange. Contested by Immanuel Nowitzki (4.9 feet, ZONE). TYLER SMITH MAKES IT! Assist: Luka Gasol
Score: 38-32

[03:21] Team_016 possession (Score: 38-32)
Lamelo Herro attempts a 3Pt. Wide open! Damian O'Neal is 7.3 feet away. [MAN] LAMELO HERRO MAKES IT! Assist: Kevin Butler
Score: 41-32

[03:02] Team_050 possession (Score: 41-32)
Dwyane Towns makes the Midrange and draws the foul on Giannis Doncic! And-1! Dwyane Towns to the line for 1. [Team fouls: 4] (Giannis Doncic: 1 personal fouls)   FT 1/1: GOOD Dwyane Towns makes 1/1 from the line.
Score: 41-35

[02:49] Team_016 possession (Score: 41-35)
FOUL! Reach-in foul on Damian O'Neal during the drive. [Team fouls: 3] No free throws, side out. (Damian O'Neal: 1 personal fouls)

[02:33] Team_016 possession (Score: 41-35)
Giannis Doncic attempts a Layup. Contested by Tyler Smith (4.2 feet, ZONE). GIANNIS DONCIC MAKES IT!
Score: 43-35

[02:20] Team_050 possession (Score: 43-35)
Larry Curry drives, Giannis Doncic stays with him. Larry Curry attempts a Dunk. Heavily contested by Giannis Doncic (0.5 feet, ZONE)! Larry Curry misses. Rebound secured by Lamelo Herro.

[02:07] Team_016 possession (Score: 43-35)
Lamelo Herro attempts a Layup. Contested by Damian O'Neal (3.4 feet, MAN). Lamelo Herro misses. Rebound secured by Dwyane Towns.

[01:51] Team_050 possession (Score: 43-35)
Luka Gasol drives, picks up Giannis Doncic. Help arrives from Lamelo Herro! Luka Gasol attempts a Layup. Contested by Lamelo Herro (2.4 feet, ZONE). LUKA GASOL MAKES IT! Assist: Dwyane Towns
Score: 43-37

[01:36] Team_016 possession (Score: 43-37)
Giannis Doncic drives and kicks out. Lamelo Herro attempts a 3Pt. Contested by Damian O'Neal (5.3 feet, MAN). Lamelo Herro misses. Rebound secured by Dwyane Towns.

[01:19] Team_050 possession (Score: 43-37)
Luka Gasol makes the Layup and draws the foul on Giannis Doncic! And-1! Luka Gasol to the line for 1. [BONUS: 5 team fouls] (Giannis Doncic: 2 personal fouls)   FT 1/1: GOOD Luka Gasol makes 1/1 from the line.
Score: 43-40

[01:04] Team_016 possession (Score: 43-40)
FOUL! Reach-in foul on Dwyane Towns during the drive. [Team fouls: 4] No free throws, side out. (Dwyane Towns: 1 personal fouls)

[00:51] Team_016 possession (Score: 43-40)
Lamelo Herro attempts a 3Pt. Contested by Dwyane Towns (3.5 feet, ZONE). Lamelo Herro misses. Rebound secured by Dwyane Towns.

[00:39] Team_050 possession (Score: 43-40)
Damian O'Neal attempts a Layup. Contested by Trae Barnes (4.7 feet, ZONE). Damian O'Neal misses. FOUL! Loose ball foul on Trae Barnes during the rebound battle. [IN THE BONUS! 6 team fouls] Larry Curry to the line for 2 free throws. (Trae Barnes: 3 personal fouls)   FT 1/2: GOOD   FT 2/2: GOOD Larry Curry makes 2/2 from the line.
Score: 43-42

[00:27] Team_016 possession (Score: 43-42)
Giannis Doncic attempts a Layup. Contested by Tyler Smith (4.3 feet, ZONE). GIANNIS DONCIC MAKES IT! Assist: Immanuel Nowitzki
Score: 45-42

[00:16] Team_050 possession (Score: 45-42)
Dwyane Towns attempts a 3Pt. Contested by Immanuel Nowitzki (6.0 feet, MAN). Dwyane Towns misses. Rebound secured by Lamelo Herro.

[00:03] Team_016 possession (Score: 45-42)
Immanuel Nowitzki drives and kicks out. Giannis Doncic attempts a 3Pt. Contested by Luka Gasol (4.0 feet, MAN). Giannis Doncic misses. Rebound secured by Dwyane Towns.

================================================================================
                              2ND QUARTER COMPLETE                              
================================================================================

2ND QUARTER SCORE: Team_016 18, Team_050 19

BOX SCORE:
================================================================================

Team_016
--------------------------------------------------------------------------------
Player                MIN  PTS  REB  AST  TO      FG   FG%      3P   3P%
--------------------------------------------------------------------------------
Lamelo Herro           11   10    3    0   0   4/6    66.7     0/0   0.0
Giannis Doncic         11    6    3    2   0   3/5    60.0     0/0   0.0
Immanuel Nowitzki       8    2    0    1   0   1/2    50.0     0/0   0.0
Vince Quickley         16    0    3    0   0   0/2     0.0     0/0   0.0
Vince Duncan           14    0    3    0   0   0/1     0.0     0/0   0.0
Collin Barnes          14    0    0    0   0   0/1     0.0     0/0   0.0
Giannis Ginobili       16    0    0    0   0   0/1     0.0     0/0   0.0
Trae Barnes            11    0    0    1   0   0/1     0.0     0/0   0.0
Kevin Butler            8    0    0    1   0   0/0     0.0     0/0   0.0

TEAM: FG: 8/19 (42.1%), 3PT: 2/6 (33.3%), REB: 13 (3 off, 10 def), AST: 5, TO: 2
TEAM FOULS: 6 [Team_050 in BONUS]


Team_050
--------------------------------------------------------------------------------
Player                MIN  PTS  REB  AST  TO      FG   FG%      3P   3P%
--------------------------------------------------------------------------------
Luka Gasol             11    5    0    3   0   2/2   100.0     0/0   0.0
Larry Curry            11    4    2    0   0   2/4    50.0     0/0   0.0
Tyler Smith            11    4    3    0   0   2/3    66.7     0/0   0.0
Joel Banchero          14    3    0    0   0   1/2    50.0     0/0   0.0
Dwyane Towns           11    3    5    1   0   1/3    33.3     0/0   0.0
LeBron Bridges         14    0    1    1   0   0/1     0.0     0/0   0.0
Collin Bane            14    0    5    0   0   0/1     0.0     0/0   0.0
Donovan Trent          14    0    0    0   0   0/1     0.0     0/0   0.0
Damian O'Neal          11    0    0    0   0   0/1     0.0     0/0   0.0

TEAM: FG: 8/18 (44.4%), 3PT: 1/6 (16.7%), REB: 15 (5 off, 10 def), AST: 5, TO: 2
TEAM FOULS: 4

================================================================================

================================================================================
                       3RD QUARTER - Team_016 vs Team_050                       
================================================================================

[12:00] Team_016 possession (Score: 45-42)
Collin Barnes attempts a Midrange. Contested by Joel Banchero (3.2 feet, ZONE). Collin Barnes misses. Rebound secured by Collin Bane.

[11:46] Team_050 possession (Score: 45-42)
Collin Bane attempts a 3Pt. Contested by Collin Barnes (5.7 feet, ZONE). Collin Bane misses. Rebound secured by Vince Quickley.

[11:30] Team_016 possession (Score: 45-42)
Vince Quickley drives and kicks out. Vince Duncan attempts a Midrange. Wide open! Donovan Trent is 6.1 feet away. [MAN] Vince Duncan misses. Rebound secured by Joel Banchero.

[11:15] Team_050 possession (Score: 45-42)
Donovan Trent attempts a Layup. Heavily contested by Vince Duncan (0.5 feet, MAN)! DONOVAN TRENT MAKES IT! Assist: Giannis LaVine
Score: 45-44

[11:01] Team_016 possession (Score: 45-44)
Ben Barrett attempts a 3Pt. Contested by Giannis LaVine (2.2 feet, ZONE). BEN BARRETT MAKES IT! Assist: Giannis Ginobili
Score: 48-44

[10:46] Team_050 possession (Score: 48-44)
Joel Banchero attempts a 3Pt. Wide open! Giannis Ginobili is 8.3 feet away. [MAN] JOEL BANCHERO MAKES IT! Assist: Giannis LaVine
Score: 48-47

[10:33] Team_016 possession (Score: 48-47)
Giannis Ginobili attempts a 3Pt. Contested by Giannis LaVine (3.2 feet, ZONE). Giannis Ginobili misses. Offensive rebound by Ben Barrett! Ben Barrett puts it back in!
Score: 50-47

[10:18] Team_050 possession (Score: 50-47)
Joel Banchero attempts a Midrange. Wide open! Giannis Ginobili is 7.4 feet away. [MAN] Joel Banchero misses. FOUL! Loose ball foul on Vince Duncan during the rebound battle. [Team fouls: 1] No free throws, side out. (Vince Duncan: 1 personal fouls)

[10:03] Team_050 possession (Score: 50-47)
Collin Bane attempts a Midrange. Contested by Giannis Ginobili (4.4 feet, ZONE). Collin Bane misses. Rebound secured by Vince Quickley.

[09:52] Team_016 possession (Score: 50-47)
Ben Barrett drives, Donovan Trent stays with him. Ben Barrett attempts a Dunk. Contested by Donovan Trent (3.3 feet, ZONE). BEN BARRETT MAKES IT! Assist: Collin Barnes
Score: 52-47

[09:41] Team_050 possession (Score: 52-47)
LeBron Bridges attempts a Midrange. Contested by Ben Barrett (4.1 feet, MAN). LeBron Bridges misses. Rebound secured by Ben Barrett.

[09:29] Team_016 possession (Score: 52-47)
Vince Quickley attempts a Midrange. Contested by Collin Bane (2.6 feet, MAN). Vince Quickley misses. Rebound secured by Collin Bane.

[09:15] Team_050 possession (Score: 52-47)
Giannis LaVine throws a bad pass! Stolen by Collin Barnes! TURNOVER! (live ball)

[09:00] Team_016 possession (Score: 52-47)
Giannis Ginobili drives to the basket... Giannis Ginobili loses the ball! Stripped by Donovan Trent! TURNOVER! (live ball)

[08:44] Team_050 possession (Score: 52-47)
LeBron Bridges drives, picks up Ben Barrett. Help arrives from Collin Barnes! LeBron Bridges attempts a Layup. Contested by Collin Barnes (3.0 feet, MAN). LeBron Bridges misses. Rebound secured by Vince Duncan.

[08:32] Team_016 possession (Score: 52-47)
Vince Duncan attempts a Midrange. Wide open! Donovan Trent is 6.7 feet away. [MAN] Vince Duncan misses. Rebound secured by Collin Bane.

[08:18] Team_050 possession (Score: 52-47)
Donovan Trent attempts a Midrange. Heavily contested by Vince Duncan (0.8 feet, MAN)! Donovan Trent misses. Rebound secured by Vince Quickley.

[07:59] Team_016 possession (Score: 52-47)
FOUL! Holding foul on Giannis LaVine. [Team fouls: 1] No free throws, side out. (Giannis LaVine: 1 personal fouls)

[07:44] Team_016 possession (Score: 52-47)
Vince Duncan attempts a Layup. Heavily contested by Donovan Trent (0.5 feet, ZONE)! Vince Duncan misses. Rebound secured by Collin Bane.

[07:33] Team_050 possession (Score: 52-47)
Giannis LaVine drives to the basket... Giannis LaVine loses control! Ball rolls out of bounds! TURNOVER! (dead ball)

[07:19] Team_016 possession (Score: 52-47)
Giannis Ginobili attempts a 3Pt. Contested by Giannis LaVine (4.4 feet, ZONE). Giannis Ginobili misses. Rebound secured by LeBron Bridges.

[07:01] Team_050 possession (Score: 52-47)
Giannis LaVine attempts a 3Pt. Heavily contested by Ben Barrett (2.0 feet, ZONE)! Giannis LaVine misses. Rebound secured by Vince Quickley.

[06:48] Team_016 possession (Score: 52-47)
Ben Barrett attempts a Midrange. Contested by Giannis LaVine (3.4 feet, ZONE). BEN BARRETT MAKES IT!
Score: 54-47

[06:32] Team_050 possession (Score: 54-47)
LeBron Bridges attempts a Layup. Contested by Vince Duncan (5.3 feet, ZONE). LeBron Bridges misses. Offensive rebound by LeBron Bridges! LeBron Bridges kicks it out.

[06:19] Team_050 possession (Score: 54-47)
FOUL! Shooting foul on Vince Duncan. Donovan Trent to the line for 2 free throws. [Team fouls: 2] (Vince Duncan: 2 personal fouls)   FT 1/2: GOOD   FT 2/2: GOOD Donovan Trent makes 2/2 from the line.
Score: 54-49

[06:05] Team_016 possession (Score: 54-49)
Ben Barrett attempts a 3Pt. Contested by Collin Bane (4.8 feet, ZONE). BEN BARRETT MAKES IT! Assist: Collin Barnes
Score: 57-49

[05:53] Team_050 possession (Score: 57-49)
Giannis LaVine makes the Dunk and draws the foul on Vince Quickley! And-1! Giannis LaVine to the line for 1. [Team fouls: 3] (Vince Quickley: 1 personal fouls)   FT 1/1: GOOD Giannis LaVine makes 1/1 from the line.
Score: 57-52

[05:38] Team_016 possession (Score: 57-52)
Vince Duncan attempts a Layup. Contested by Donovan Trent (4.9 feet, ZONE). VINCE DUNCAN MAKES IT! Assist: Giannis Ginobili
Score: 59-52

[05:22] Team_050 possession (Score: 59-52)
Giannis LaVine drives, Vince Duncan stays with him. Giannis LaVine attempts a Dunk. Contested by Vince Duncan (4.4 feet, ZONE). Giannis LaVine misses. Rebound secured by Vince Duncan.

[05:08] Team_016 possession (Score: 59-52)
FOUL! Shooting foul on Donovan Trent. Vince Duncan to the line for 2 free throws. [Team fouls: 2] (Donovan Trent: 1 personal fouls)   FT 1/2: GOOD   FT 2/2: GOOD Vince Duncan makes 2/2 from the line.
Score: 61-52

[04:54] Team_050 possession (Score: 61-52)
Collin Bane throws a bad pass out of bounds! TURNOVER! (dead ball)

[04:38] Team_016 possession (Score: 61-52)
FOUL! Reach-in foul on Joel Banchero during the drive. [Team fouls: 3] No free throws, side out. (Joel Banchero: 1 personal fouls)

[04:21] Team_016 possession (Score: 61-52)
Collin Barnes throws a bad pass out of bounds! TURNOVER! (dead ball)

[04:04] Team_050 possession (Score: 61-52)
Giannis LaVine attempts a 3Pt. Heavily contested by Collin Barnes (1.9 feet, ZONE)! Giannis LaVine misses. Offensive rebound by Collin Bane! Collin Bane kicks it out.

[03:51] Team_050 possession (Score: 61-52)
Collin Bane drives, Vince Duncan stays with him. Collin Bane attempts a Dunk. Heavily contested by Vince Duncan (1.0 feet, ZONE)! COLLIN BANE MAKES IT! Assist: Donovan Trent
Score: 61-54

[03:40] Team_016 possession (Score: 61-54)
Ben Barrett attempts a Layup. Wide open! Donovan Trent is 7.4 feet away. [ZONE] BEN BARRETT MAKES IT! Assist: Vince Quickley
Score: 63-54

[03:26] Team_050 possession (Score: 63-54)
LeBron Bridges loses control! Ball rolls out of bounds! TURNOVER! (dead ball)

[03:26] Substitution (Team_050): LeBron Bridges OUT → Luka Gasol IN (stamina_rule2)

[03:09] Team_016 possession (Score: 63-54)
Collin Barnes attempts a Midrange. Wide open! Giannis LaVine is 6.6 feet away. [MAN] Collin Barnes misses. Rebound secured by Donovan Trent.

[02:54] Team_050 possession (Score: 63-54)
Giannis LaVine drives and kicks out. Joel Banchero attempts a 3Pt. Wide open! Giannis Ginobili is 6.1 feet away. [MAN] Joel Banchero misses. Offensive rebound by Collin Bane! Collin Bane kicks it out.

[02:44] Team_050 possession (Score: 63-54)
Luka Gasol drives and kicks out. Joel Banchero attempts a Midrange. Contested by Vince Quickley (4.6 feet, ZONE). Joel Banchero misses. Offensive rebound by Collin Bane! Collin Bane kicks it out.

[02:26] Team_050 possession (Score: 63-54)
Joel Banchero attempts a Layup. BLOCKED BY VINCE DUNCAN! Ball goes out off Vince Duncan. Joel Banchero's ball!

[02:12] Team_050 possession (Score: 63-54)
Collin Bane attempts a 3Pt. Contested by Vince Quickley (4.6 feet, MAN). COLLIN BANE MAKES IT! Assist: Giannis LaVine
Score: 63-57

[02:01] Team_016 possession (Score: 63-57)
Collin Barnes drives, Donovan Trent stays with him. Collin Barnes attempts a Layup. Contested by Donovan Trent (4.4 feet, ZONE). COLLIN BARNES MAKES IT!
Score: 65-57

[01:47] Team_050 possession (Score: 65-57)
Luka Gasol throws a bad pass out of bounds! TURNOVER! (dead ball)

[01:47] Substitution (Team_016): Collin Barnes OUT → Lamelo Herro IN (stamina_rule2)

[01:47] Substitution (Team_016): Giannis Ginobili OUT → Immanuel Nowitzki IN (stamina_rule2)

[01:47] Substitution (Team_016): Vince Quickley OUT → Kevin Butler IN (stamina_rule2)

[01:47] Substitution (Team_016): Ben Barrett OUT → Giannis Doncic IN (stamina_rule2)

[01:47] Substitution (Team_016): Vince Duncan OUT → Trae Barnes IN (stamina_rule2)

[01:47] Substitution (Team_050): Giannis LaVine OUT → Damian O'Neal IN (stamina_rule2)

[01:47] Substitution (Team_050): Joel Banchero OUT → Dwyane Towns IN (stamina_rule2)

[01:47] Substitution (Team_050): Collin Bane OUT → Larry Curry IN (stamina_rule2)

[01:47] Substitution (Team_050): Donovan Trent OUT → Tyler Smith IN (stamina_rule2)

[01:38] Team_016 possession (Score: 65-57)
Immanuel Nowitzki attempts a Midrange. Heavily contested by Luka Gasol (0.5 feet, ZONE)! Immanuel Nowitzki misses. Offensive rebound by Giannis Doncic! Giannis Doncic kicks it out.

[01:24] Team_016 possession (Score: 65-57)
FOUL! Shooting foul on Dwyane Towns. Giannis Doncic to the line for 2 free throws. [Team fouls: 4] (Dwyane Towns: 1 personal fouls)   FT 1/2: GOOD   FT 2/2: GOOD Giannis Doncic makes 2/2 from the line.
Score: 67-57

[01:07] Team_050 possession (Score: 67-57)
Larry Curry commits a violation (traveling/carry)! TURNOVER! (dead ball)

[00:52] Team_016 possession (Score: 67-57)
Giannis Doncic attempts a Midrange. Contested by Luka Gasol (2.3 feet, MAN). Giannis Doncic misses. Rebound secured by Larry Curry.

[00:38] Team_050 possession (Score: 67-57)
Tyler Smith drives to the basket... FOUL! Offensive foul on Tyler Smith! Trae Barnes drew the charge! [Team fouls: 5] (Tyler Smith: 1 personal fouls) TURNOVER! (dead ball)

[00:24] Team_016 possession (Score: 67-57)
Kevin Butler makes the Layup and draws the foul on Dwyane Towns! And-1! Kevin Butler to the line for 1. [BONUS: 6 team fouls] (Dwyane Towns: 2 personal fouls)   FT 1/1: GOOD Kevin Butler makes 1/1 from the line.
Score: 70-57

[00:11] Team_050 possession (Score: 70-57)
Tyler Smith attempts a Midrange. Contested by Trae Barnes (5.7 feet, MAN). Tyler Smith misses. Rebound secured by Giannis Doncic.

================================================================================
                              3RD QUARTER COMPLETE                              
================================================================================

3RD QUARTER SCORE: Team_016 25, Team_050 15

BOX SCORE:
================================================================================

Team_016
--------------------------------------------------------------------------------
Player                MIN  PTS  REB  AST  TO      FG   FG%      3P   3P%
--------------------------------------------------------------------------------
Ben Barrett            24   14    2    0   0   6/6   100.0     0/0   0.0
Vince Duncan           24    4    2    0   0   2/4    50.0     0/0   0.0
Kevin Butler           10    3    0    0   0   1/1   100.0     0/0   0.0
Collin Barnes          24    2    0    2   0   1/3    33.3     0/0   0.0
Giannis Doncic         12    2    2    0   0   1/2    50.0     0/0   0.0
Vince Quickley         26    0    4    1   0   0/2     0.0     0/0   0.0
Giannis Ginobili       26    0    0    2   0   0/1     0.0     0/0   0.0

TEAM: FG: 11/19 (57.9%), 3PT: 3/4 (75.0%), REB: 10 (2 off, 8 def), AST: 5, TO: 2
TEAM FOULS: 3


Team_050
--------------------------------------------------------------------------------
Player                MIN  PTS  REB  AST  TO      FG   FG%      3P   3P%
--------------------------------------------------------------------------------
Collin Bane            24    5    7    0   0   2/4    50.0     0/0   0.0
Donovan Trent          24    4    1    1   0   2/3    66.7     0/0   0.0
Joel Banchero          24    3    1    0   0   1/1   100.0     0/0   0.0
Giannis LaVine         24    3    0    3   0   1/3    33.3     0/0   0.0
LeBron Bridges         22    0    3    0   0   0/2     0.0     0/0   0.0
Larry Curry            12    0    1    0   0   0/0     0.0     0/0   0.0
Tyler Smith            12    0    0    0   0   0/1     0.0     0/0   0.0

TEAM: FG: 6/14 (42.9%), 3PT: 2/4 (50.0%), REB: 13 (5 off, 8 def), AST: 4, TO: 7
TEAM FOULS: 6 [Team_016 in BONUS]

================================================================================

================================================================================
                       4TH QUARTER - Team_016 vs Team_050                       
================================================================================

[12:00] Team_016 possession (Score: 70-57)
Vince Duncan attempts a Layup. Contested by Donovan Trent (3.2 feet, ZONE). VINCE DUNCAN MAKES IT! Assist: Vince Quickley
Score: 72-57

[11:48] Team_050 possession (Score: 72-57)
Collin Bane attempts a Midrange. Contested by Giannis Ginobili (4.8 feet, ZONE). Collin Bane misses. Rebound secured by Vince Quickley.

[11:34] Team_016 possession (Score: 72-57)
Vince Quickley attempts a 3Pt. Contested by Joel Banchero (3.9 feet, ZONE). Vince Quickley misses. Rebound secured by Collin Bane.

[11:15] Team_050 possession (Score: 72-57)
LeBron Bridges attempts a 3Pt. Contested by Ben Barrett (4.7 feet, MAN). LeBron Bridges misses. Offensive rebound by Collin Bane! Collin Bane kicks it out.

[11:00] Team_050 possession (Score: 72-57)
Collin Bane attempts a Layup. Contested by Vince Quickley (3.4 feet, MAN). Collin Bane misses. Rebound secured by Vince Duncan.

[10:47] Team_016 possession (Score: 72-57)
Giannis Ginobili throws a bad pass out of bounds! TURNOVER! (dead ball)

[10:47] Substitution (Team_050): Donovan Trent OUT → Tyler Smith IN (stamina_rule2)

[10:36] Team_050 possession (Score: 72-57)
Giannis LaVine attempts a Layup. Heavily contested by Collin Barnes (1.2 feet, MAN)! GIANNIS LAVINE MAKES IT!
Score: 72-59

[10:23] Team_016 possession (Score: 72-59)
Vince Duncan attempts a Layup. Contested by Tyler Smith (3.5 feet, ZONE). VINCE DUNCAN MAKES IT!
Score: 74-59

[10:11] Team_050 possession (Score: 74-59)
Giannis LaVine attempts a Midrange. Contested by Collin Barnes (5.4 feet, MAN). Giannis LaVine misses. Rebound secured by Vince Quickley.

[09:55] Team_016 possession (Score: 74-59)
Collin Barnes attempts a 3Pt. Contested by Giannis LaVine (3.3 feet, ZONE). Collin Barnes misses. Rebound secured by Collin Bane.

[09:42] Team_050 possession (Score: 74-59)
Tyler Smith makes the Layup and draws the foul on Vince Duncan! And-1! Tyler Smith to the line for 1. [Team fouls: 1] (Vince Duncan: 1 personal fouls)   FT 1/1: GOOD Tyler Smith makes 1/1 from the line.
Score: 74-62

[09:28] Team_016 possession (Score: 74-62)
Vince Quickley attempts a Layup. BLOCKED BY TYLER SMITH! Ball deflects out of bounds off Vince Quickley.

[09:13] Team_050 possession (Score: 74-62)
LeBron Bridges attempts a Midrange. Contested by Giannis Ginobili (5.6 feet, ZONE). LeBron Bridges misses. Rebound secured by Vince Duncan.

[09:00] Team_016 possession (Score: 74-62)
FOUL! Offensive foul on Giannis Ginobili! Joel Banchero drew the charge! [Team fouls: 2] (Giannis Ginobili: 1 personal fouls) TURNOVER! (dead ball)

[08:43] Team_050 possession (Score: 74-62)
LeBron Bridges drives to the basket... FOUL! Offensive foul on LeBron Bridges! Ben Barrett drew the charge! [Team fouls: 1] (LeBron Bridges: 1 personal fouls) TURNOVER! (dead ball)

[08:26] Team_016 possession (Score: 74-62)
Vince Duncan attempts a Midrange. Contested by Joel Banchero (2.4 feet, ZONE). VINCE DUNCAN MAKES IT! Assist: Vince Quickley
Score: 76-62

[08:10] Team_050 possession (Score: 76-62)
LeBron Bridges drives to the basket... LeBron Bridges throws a bad pass! Stolen by Vince Duncan! TURNOVER! (live ball)

[07:56] Team_016 possession (Score: 76-62)
Vince Duncan attempts a Midrange. Wide open! Collin Bane is 6.5 feet away. [ZONE] Vince Duncan misses. Rebound secured by Tyler Smith.

[07:41] Team_050 possession (Score: 76-62)
Joel Banchero attempts a 3Pt. Contested by Giannis Ginobili (3.4 feet, ZONE). JOEL BANCHERO MAKES IT! Assist: Collin Bane
Score: 76-65

[07:28] Team_016 possession (Score: 76-65)
Ben Barrett drives and kicks out. Vince Quickley makes the Midrange and draws the foul on Tyler Smith! And-1! Vince Quickley to the line for 1. [Team fouls: 2] (Tyler Smith: 1 personal fouls)   FT 1/1: GOOD Vince Quickley makes 1/1 from the line.
Score: 79-65

[07:16] Team_050 possession (Score: 79-65)
Tyler Smith attempts a Layup. BLOCKED BY VINCE DUNCAN! Ball is loose! Rebound secured by Ben Barrett.

[07:06] Team_016 possession (Score: 79-65)
Giannis Ginobili attempts a 3Pt. Contested by Joel Banchero (3.5 feet, MAN). GIANNIS GINOBILI MAKES IT! Assist: Collin Barnes
Score: 82-65

[06:52] Team_050 possession (Score: 82-65)
FOUL! Shooting foul on Collin Barnes. Collin Bane to the line for 3 free throws. [Team fouls: 3] (Collin Barnes: 1 personal fouls)   FT 1/3: GOOD   FT 2/3: GOOD   FT 3/3: GOOD Collin Bane makes 3/3 from the line.
Score: 82-68

[06:39] Team_016 possession (Score: 82-68)
Giannis Ginobili attempts a 3Pt. Contested by Giannis LaVine (3.2 feet, ZONE). GIANNIS GINOBILI MAKES IT! Assist: Collin Barnes
Score: 85-68

[06:30] Team_050 possession (Score: 85-68)
Giannis LaVine attempts a 3Pt. Wide open! Collin Barnes is 6.0 feet away. [MAN] Giannis LaVine misses. Rebound secured by Vince Quickley.

[06:15] Team_016 possession (Score: 85-68)
Ben Barrett drives and kicks out. Giannis Ginobili attempts a Midrange. BLOCKED BY JOEL BANCHERO! Ball is loose! Rebound secured by LeBron Bridges.

[06:02] Team_050 possession (Score: 85-68)
Giannis LaVine attempts a Midrange. Contested by Vince Quickley (4.5 feet, ZONE). Giannis LaVine misses. Rebound secured by Ben Barrett.

[05:46] Team_016 possession (Score: 85-68)
Giannis Ginobili attempts a 3Pt. Wide open! Joel Banchero is 7.2 feet away. [MAN] Giannis Ginobili misses. Rebound secured by LeBron Bridges.

[05:34] Team_050 possession (Score: 85-68)
Joel Banchero attempts a 3Pt. Wide open! Giannis Ginobili is 7.3 feet away. [MAN] JOEL BANCHERO MAKES IT! Assist: Tyler Smith
Score: 85-71

[05:19] Team_016 possession (Score: 85-71)
Collin Barnes attempts a 3Pt. Wide open! Giannis LaVine is 7.0 feet away. [MAN] COLLIN BARNES MAKES IT! Assist: Vince Duncan
Score: 88-71

[05:03] Team_050 possession (Score: 88-71)
Giannis LaVine attempts a Midrange. Contested by Collin Barnes (4.3 feet, MAN). GIANNIS LAVINE MAKES IT!
Score: 88-73

[04:46] Team_016 possession (Score: 88-73)
FOUL! Holding foul on LeBron Bridges. [Team fouls: 3] No free throws, side out. (LeBron Bridges: 2 personal fouls)

[04:31] Team_016 possession (Score: 88-73)
Vince Quickley attempts a Midrange. Contested by Collin Bane (4.7 feet, MAN). VINCE QUICKLEY MAKES IT!
Score: 90-73

[04:18] Team_050 possession (Score: 90-73)
Tyler Smith drives and kicks out. LeBron Bridges attempts a Midrange. Contested by Ben Barrett (2.4 feet, ZONE). LEBRON BRIDGES MAKES IT!
Score: 90-75

[04:05] Team_016 possession (Score: 90-75)
Giannis Ginobili attempts a Midrange. Contested by Joel Banchero (6.0 feet, MAN). GIANNIS GINOBILI MAKES IT!
Score: 92-75

[03:50] Team_050 possession (Score: 92-75)
Giannis LaVine attempts a Midrange. Contested by Ben Barrett (5.5 feet, ZONE). GIANNIS LAVINE MAKES IT! Assist: Collin Bane
Score: 92-77

[03:35] Team_016 possession (Score: 92-77)
Giannis Ginobili attempts a Midrange. Contested by Joel Banchero (3.6 feet, ZONE). Giannis Ginobili misses. Offensive rebound by Ben Barrett! Ben Barrett puts it back in!
Score: 94-77

[03:19] Team_050 possession (Score: 94-77)
LeBron Bridges attempts a 3Pt. Contested by Collin Barnes (4.4 feet, ZONE). LeBron Bridges misses. Rebound secured by Ben Barrett.

[03:03] Team_016 possession (Score: 94-77)
Collin Barnes attempts a 3Pt. Wide open! Giannis LaVine is 6.6 feet away. [ZONE] Collin Barnes misses. Rebound secured by Collin Bane.

[02:45] Team_050 possession (Score: 94-77)
FOUL! Reach-in foul on Vince Duncan during the drive. [Team fouls: 4] No free throws, side out. (Vince Duncan: 2 personal fouls)

[02:29] Team_050 possession (Score: 94-77)
Giannis LaVine attempts a 3Pt. Wide open! Vince Quickley is 6.2 feet away. [ZONE] Giannis LaVine misses. FOUL! Loose ball foul on Ben Barrett during the rebound battle. [IN THE BONUS! 5 team fouls] Tyler Smith to the line for 2 free throws. (Ben Barrett: 1 personal fouls)   FT 1/2: MISS   FT 2/2: GOOD Tyler Smith makes 1/2 from the line.
Score: 94-78

[02:18] Team_016 possession (Score: 94-78)
Collin Barnes attempts a Midrange. Wide open! Collin Bane is 6.4 feet away. [ZONE] COLLIN BARNES MAKES IT! Assist: Ben Barrett
Score: 96-78

[02:04] Team_050 possession (Score: 96-78)
Tyler Smith drives to the basket... Tyler Smith throws a bad pass! Stolen by Vince Duncan! TURNOVER! (live ball)

[01:52] Team_016 possession (Score: 96-78)
Ben Barrett attempts a Layup. Contested by Tyler Smith (2.7 feet, ZONE). BEN BARRETT MAKES IT!
Score: 98-78

[01:38] Team_050 possession (Score: 98-78)
Giannis LaVine drives, Collin Barnes stays with him. Giannis LaVine attempts a Layup. Wide open! Collin Barnes is 7.1 feet away. [MAN] GIANNIS LAVINE MAKES IT! Assist: Tyler Smith
Score: 98-80

[01:28] Team_016 possession (Score: 98-80)
Ben Barrett attempts a 3Pt. Wide open! Giannis LaVine is 9.6 feet away. [ZONE] Ben Barrett misses. Rebound secured by Collin Bane.

[01:16] Team_050 possession (Score: 98-80)
Joel Banchero makes the Layup and draws the foul on Giannis Ginobili! And-1! Joel Banchero to the line for 1. [BONUS: 6 team fouls] (Giannis Ginobili: 2 personal fouls)   FT 1/1: GOOD Joel Banchero makes 1/1 from the line.
Score: 98-83

[01:00] Team_016 possession (Score: 98-83)
Collin Barnes attempts a Midrange. Contested by Giannis LaVine (4.5 feet, MAN). COLLIN BARNES MAKES IT! Assist: Vince Duncan
Score: 100-83

[00:42] Team_050 possession (Score: 100-83)
Giannis LaVine attempts a 3Pt. BLOCKED BY COLLIN BARNES! Ball is loose! Rebound secured by Vince Quickley.

[00:26] Team_016 possession (Score: 100-83)
Giannis Ginobili attempts a Midrange. Wide open! Joel Banchero is 6.7 feet away. [MAN] GIANNIS GINOBILI MAKES IT! Assist: Vince Duncan
Score: 102-83

[00:13] Team_050 possession (Score: 102-83)
Joel Banchero attempts a Midrange. Wide open! Giannis Ginobili is 8.4 feet away. [MAN] Joel Banchero misses. Offensive rebound by Tyler Smith! Tyler Smith kicks it out.

================================================================================
                              4TH QUARTER COMPLETE                              
================================================================================

4TH QUARTER SCORE: Team_016 32, Team_050 26

BOX SCORE:
================================================================================

Team_016
--------------------------------------------------------------------------------
Player                MIN  PTS  REB  AST  TO      FG   FG%      3P   3P%
--------------------------------------------------------------------------------
Giannis Ginobili       38   10    0    0   0   4/5    80.0     0/0   0.0
Collin Barnes          36    7    0    2   0   3/5    60.0     0/0   0.0
Vince Duncan           36    6    2    3   0   3/4    75.0     0/0   0.0
Vince Quickley         38    5    4    2   0   2/4    50.0     0/0   0.0
Ben Barrett            36    4    4    1   0   2/4    50.0     0/0   0.0

TEAM: FG: 14/22 (63.6%), 3PT: 3/8 (37.5%), REB: 10 (1 off, 9 def), AST: 8, TO: 2
TEAM FOULS: 6 [Team_050 in BONUS]


Team_050
--------------------------------------------------------------------------------
Player                MIN  PTS  REB  AST  TO      FG   FG%      3P   3P%
--------------------------------------------------------------------------------
Joel Banchero          36    9    0    0   0   3/3   100.0     0/0   0.0
Giannis LaVine         36    8    0    0   0   4/8    50.0     0/0   0.0
Tyler Smith            23    4    2    2   0   2/3    66.7     0/0   0.0
Collin Bane            36    3    5    2   0   1/3    33.3     0/0   0.0
LeBron Bridges         34    2    2    0   0   1/3    33.3     0/0   0.0

TEAM: FG: 11/20 (55.0%), 3PT: 4/7 (57.1%), REB: 9 (2 off, 7 def), AST: 4, TO: 3
TEAM FOULS: 3

================================================================================

================================================================================
                               FULL GAME COMPLETE                               
================================================================================

FINAL SCORE: Team_016 102, Team_050 83

SCORING BY QUARTER:
--------------------------------------------------------------------------------
Team                     Q1     Q2     Q3     Q4    FINAL
--------------------------------------------------------------------------------
Team_016                 27     18     25     32      102
Team_050                 23     19     15     26       83
--------------------------------------------------------------------------------

FULL GAME BOX SCORE:
================================================================================

Team_016
--------------------------------------------------------------------------------
Player                MIN  PTS  REB  AST  TO      FG   FG%      3P   3P%      FT STL BLK
--------------------------------------------------------------------------------
Giannis Ginobili       38   12    0    2   3  10/14   71.4   4/6    66.7   0/0     0   0
Vince Quickley         38    9   11    5   0   4/12   33.3   1/5    20.0   5/5     1   1
Collin Barnes          36   13    0    5   4   4/11   36.4   1/5    20.0   0/0     1   1
Ben Barrett            36   26   10    2   0  10/12   83.3   2/3    66.7   0/0     0   0
Vince Duncan           36   15   13    3   0   6/11   54.5   0/0     0.0   3/3     2   2
Lamelo Herro           12   12    3    0   0   6/8    75.0   2/3    66.7   0/0     0   1
Giannis Doncic         12    8    5    2   0   4/7    57.1   1/1   100.0   4/5     0   0
Trae Barnes            12    2    0    1   1   0/2     0.0   0/1     0.0   2/2     0   0
Immanuel Nowitzki      10    2    0    1   0   1/2    50.0   0/0     0.0   0/0     1   0
Kevin Butler           10    3    0    1   1   1/1   100.0   0/0     0.0   1/1     0   0

TEAM: FG: 46/80 (57.5%), 3PT: 11/24 (45.8%), REB: 44 (10 off, 34 def), AST: 22, TO: 9


Team_050
--------------------------------------------------------------------------------
Player                MIN  PTS  REB  AST  TO      FG   FG%      3P   3P%      FT STL BLK
--------------------------------------------------------------------------------
Giannis LaVine         36   13    0    3   3   7/14   50.0   1/5    20.0   1/1     0   0
Joel Banchero          36   15    5    1   3   5/8    62.5   4/5    80.0   1/1     0   1
Collin Bane            36   13   19    3   3   5/14   35.7   3/7    42.9   3/3     0   1
LeBron Bridges         34    8    9    3   2   2/7    28.6   1/2    50.0   1/1     0   0
Donovan Trent          25    6    1    2   0   3/5    60.0   0/0     0.0   2/2     1   1
Tyler Smith            23   11    5    2   1   5/8    62.5   0/0     0.0   3/4     0   2
Luka Gasol             14    5    0    3   1   2/2   100.0   0/0     0.0   1/1     0   0
Damian O'Neal          12    0    0    1   0   1/2    50.0   0/1     0.0   0/0     0   0
Dwyane Towns           12    6    5    1   1   2/4    50.0   1/2    50.0   1/1     0   0
Larry Curry            12    6    4    0   4   2/4    50.0   0/1     0.0   2/2     1   0

TEAM: FG: 34/68 (50.0%), 3PT: 10/23 (43.5%), REB: 46 (15 off, 31 def), AST: 19, TO: 18

================================================================================
