================================================================================
                        FULL GAME - Team_071 vs Team_079                        
================================================================================

================================================================================
                       1ST QUARTER - Team_071 vs Team_079                       
================================================================================

[12:00] Team_071 possession (Score: 0-0)
Bam Iverson attempts a 3Pt. Contested by Miles Ming (4.3 feet, ZONE). BAM IVERSON MAKES IT! Assist: Dejounte Paul
Score: 3-0

[11:43] Team_079 possession (Score: 3-0)
Khris Embiid drives, picks up Dejounte Paul. Help arrives from Allen Williamson! Khris Embiid attempts a Dunk. Contested by Allen Williamson (3.1 feet, ZONE). Khris Embiid misses. Offensive rebound by Trae Durant! Trae Durant's putback is no good. Offensive rebound by Trae Durant! Trae Durant kicks it out.

[11:30] Team_079 possession (Score: 3-0)
Khris Embiid loses the ball! Stripped by Allen Williamson! TURNOVER! (live ball)

[11:18] Team_071 possession (Score: 3-0)
Dejounte Paul drives, Trae Durant stays with him. Dejounte Paul attempts a Layup. Contested by Trae Durant (4.4 feet, ZONE). DEJOUNTE PAUL MAKES IT! Assist: Allen Williamson
Score: 5-0

[11:02] Team_079 possession (Score: 5-0)
Khris Embiid attempts a 3Pt. Contested by Victor Anunoby (4.8 feet, ZONE). KHRIS EMBIID MAKES IT! Assist: Donovan Randle
Score: 5-3

[10:47] Team_071 possession (Score: 5-3)
Jimmy Simons attempts a Midrange. Contested by Trae Durant (2.1 feet, ZONE). Jimmy Simons misses. FOUL! Loose ball foul on Trae Durant during the rebound battle. [Team fouls: 1] No free throws, side out. (Trae Durant: 1 personal fouls)

[10:36] Team_071 possession (Score: 5-3)
Victor Anunoby drives to the basket... Victor Anunoby throws a bad pass out of bounds! TURNOVER! (dead ball)

[10:24] Team_079 possession (Score: 5-3)
Miles Ming attempts a 3Pt. Wide open! Victor Anunoby is 6.9 feet away. [MAN] MILES MING MAKES IT! Assist: Donovan Randle
Score: 5-6

[10:06] Team_071 possession (Score: 5-6)
Victor Anunoby attempts a 3Pt. Contested by Miles Ming (4.6 feet, MAN). VICTOR ANUNOBY MAKES IT! Assist: Dejounte Paul
Score: 8-6

[09:54] Team_079 possession (Score: 8-6)
Donovan Randle attempts a Layup. BLOCKED BY DEJOUNTE PAUL! Ball is loose! Rebound secured by Dejounte Paul.

[09:42] Team_071 possession (Score: 8-6)
Jimmy Simons attempts a Midrange. Contested by Bam Randle (4.8 feet, ZONE). JIMMY SIMONS MAKES IT! Assist: Allen Williamson
Score: 10-6

[09:29] Team_079 possession (Score: 10-6)
Bam Randle attempts a 3Pt. Contested by Bam Iverson (4.3 feet, MAN). Bam Randle misses. Rebound secured by Jimmy Simons.

[09:17] Team_071 possession (Score: 10-6)
Jimmy Simons attempts a 3Pt. Contested by Bam Randle (4.9 feet, ZONE). Jimmy Simons misses. Offensive rebound by Dejounte Paul! Dejounte Paul kicks it out.

[09:02] Team_071 possession (Score: 10-6)
FOUL! Holding foul on Khris Embiid. [Team fouls: 2] No free throws, side out. (Khris Embiid: 1 personal fouls)

[08:47] Team_071 possession (Score: 10-6)
Victor Anunoby attempts a 3Pt. Heavily contested by Trae Durant (0.5 feet, ZONE)! VICTOR ANUNOBY MAKES IT!
Score: 13-6

[08:32] Team_079 possession (Score: 13-6)
Miles Ming attempts a Midrange. Wide open! Victor Anunoby is 6.5 feet away. [ZONE] MILES MING MAKES IT! Assist: Bam Randle
Score: 13-8

[08:19] Team_071 possession (Score: 13-8)
Jimmy Simons attempts a Midrange. Wide open! Bam Randle is 6.1 feet away. [ZONE] Jimmy Simons misses. Rebound secured by Trae Durant.

[08:05] Team_079 possession (Score: 13-8)
FOUL! Shooting foul on Allen Williamson. Khris Embiid to the line for 2 free throws. [Team fouls: 1] (Allen Williamson: 1 personal fouls)   FT 1/2: GOOD   FT 2/2: GOOD Khris Embiid makes 2/2 from the line.
Score: 13-10

[07:55] Team_071 possession (Score: 13-10)
Victor Anunoby attempts a 3Pt. Contested by Miles Ming (3.8 feet, MAN). Victor Anunoby misses. FOUL! Loose ball foul on Donovan Randle during the rebound battle. [Team fouls: 3] No free throws, side out. (Donovan Randle: 1 personal fouls)

[07:38] Team_071 possession (Score: 13-10)
Dejounte Paul drives, Donovan Randle stays with him. Dejounte Paul attempts a Layup. Contested by Donovan Randle (4.7 feet, MAN). DEJOUNTE PAUL MAKES IT! Assist: Bam Iverson
Score: 15-10

[07:25] Team_079 possession (Score: 15-10)
FOUL! Holding foul on Bam Iverson. [Team fouls: 2] No free throws, side out. (Bam Iverson: 1 personal fouls)

[07:09] Team_079 possession (Score: 15-10)
Miles Ming drives, picks up Victor Anunoby. Help arrives from Bam Iverson! Miles Ming attempts a Dunk. Contested by Bam Iverson (4.8 feet, MAN). MILES MING MAKES IT!
Score: 15-12

[06:53] Team_071 possession (Score: 15-12)
Bam Iverson attempts a 3Pt. Contested by Trae Durant (3.3 feet, ZONE). BAM IVERSON MAKES IT! Assist: Allen Williamson
Score: 18-12

[06:39] Team_079 possession (Score: 18-12)
Bam Randle attempts a Midrange. Contested by Bam Iverson (5.2 feet, MAN). Bam Randle misses. Rebound secured by Bam Iverson.

[06:25] Team_071 possession (Score: 18-12)
Bam Iverson attempts a 3Pt. Contested by Bam Randle (2.5 feet, MAN). Bam Iverson misses. Rebound secured by Donovan Randle.

[06:11] Team_079 possession (Score: 18-12)
Donovan Randle attempts a Layup. Contested by Dejounte Paul (5.5 feet, MAN). DONOVAN RANDLE MAKES IT!
Score: 18-14

[05:54] Team_071 possession (Score: 18-14)
Dejounte Paul drives to the basket... Dejounte Paul commits a violation (traveling/carry)! TURNOVER! (dead ball)

[05:42] Team_079 possession (Score: 18-14)
Donovan Randle attempts a Layup. BLOCKED BY DEJOUNTE PAUL! Ball deflects out of bounds off Donovan Randle.

[05:23] Team_071 possession (Score: 18-14)
FOUL! Shooting foul on Miles Ming. Victor Anunoby to the line for 2 free throws. [Team fouls: 4] (Miles Ming: 1 personal fouls)   FT 1/2: GOOD   FT 2/2: GOOD Victor Anunoby makes 2/2 from the line.
Score: 20-14

[05:14] Team_079 possession (Score: 20-14)
FOUL! Reach-in foul on Jimmy Simons during the drive. [Team fouls: 3] No free throws, side out. (Jimmy Simons: 1 personal fouls)

[05:01] Team_079 possession (Score: 20-14)
Donovan Randle makes the Layup and draws the foul on Allen Williamson! And-1! Donovan Randle to the line for 1. [Team fouls: 4] (Allen Williamson: 2 personal fouls)   FT 1/1: MISS Donovan Randle makes 0/1 from the line. Offensive rebound by Trae Durant! Trae Durant's putback is no good.
Score: 20-16

[04:42] Team_071 possession (Score: 20-16)
Bam Iverson attempts a 3Pt. Wide open! Bam Randle is 7.1 feet away. [MAN] Bam Iverson misses. Rebound secured by Donovan Randle.

[04:25] Team_079 possession (Score: 20-16)
Miles Ming attempts a 3Pt. Contested by Victor Anunoby (5.2 feet, MAN). Miles Ming misses. FOUL! Loose ball foul on Dejounte Paul during the rebound battle. [IN THE BONUS! 5 team fouls] Donovan Randle to the line for 2 free throws. (Dejounte Paul: 1 personal fouls)   FT 1/2: GOOD   FT 2/2: GOOD Donovan Randle makes 2/2 from the line.
Score: 20-18

[04:15] Team_071 possession (Score: 20-18)
Dejounte Paul attempts a Layup. Contested by Donovan Randle (2.1 feet, MAN). DEJOUNTE PAUL MAKES IT! Assist: Bam Iverson
Score: 22-18

[03:56] Team_079 possession (Score: 22-18)
Miles Ming attempts a 3Pt. Contested by Victor Anunoby (3.3 feet, ZONE). Miles Ming misses. Rebound secured by Bam Iverson.

[03:44] Team_071 possession (Score: 22-18)
Dejounte Paul drives to the basket... Dejounte Paul loses control! Ball rolls out of bounds! TURNOVER! (dead ball)

[03:33] Team_079 possession (Score: 22-18)
Donovan Randle drives, Dejounte Paul stays with him. Donovan Randle attempts a Dunk. Contested by Dejounte Paul (5.0 feet, ZONE). DONOVAN RANDLE MAKES IT! Assist: Trae Durant
Score: 22-20

[03:18] Team_071 possession (Score: 22-20)
Bam Iverson attempts a 3Pt. Contested by Trae Durant (2.6 feet, ZONE). BAM IVERSON MAKES IT! Assist: Allen Williamson
Score: 25-20

[03:00] Team_079 possession (Score: 25-20)
Miles Ming attempts a 3Pt. Wide open! Victor Anunoby is 7.1 feet away. [ZONE] Miles Ming misses. Rebound secured by Dejounte Paul.

[02:44] Team_071 possession (Score: 25-20)
Victor Anunoby attempts a 3Pt. Contested by Miles Ming (3.6 feet, MAN). Victor Anunoby misses. Rebound secured by Trae Durant.

[02:31] Team_079 possession (Score: 25-20)
Donovan Randle attempts a Layup. Contested by Dejounte Paul (4.8 feet, MAN). DONOVAN RANDLE MAKES IT! Assist: Khris Embiid
Score: 25-22

[02:16] Team_071 possession (Score: 25-22)
Allen Williamson attempts a Layup. BLOCKED BY KHRIS EMBIID! Ball is loose! Rebound secured by Trae Durant.

[02:00] Team_079 possession (Score: 25-22)
Khris Embiid drives, Allen Williamson stays with him. Khris Embiid attempts a Layup. Wide open! Allen Williamson is 8.2 feet away. [MAN] KHRIS EMBIID MAKES IT!
Score: 25-24

[01:47] Team_071 possession (Score: 25-24)
Dejounte Paul attempts a Midrange. Contested by Donovan Randle (4.1 feet, MAN). Dejounte Paul misses. Rebound secured by Trae Durant.

[01:33] Team_079 possession (Score: 25-24)
Khris Embiid attempts a Layup. Contested by Dejounte Paul (3.2 feet, ZONE). Khris Embiid misses. Rebound secured by Bam Iverson.

[01:15] Team_071 possession (Score: 25-24)
Bam Iverson attempts a Midrange. Contested by Bam Randle (3.9 feet, MAN). BAM IVERSON MAKES IT!
Score: 27-24

[00:59] Team_079 possession (Score: 27-24)
Khris Embiid attempts a Layup. Contested by Dejounte Paul (5.3 feet, ZONE). Khris Embiid misses. Rebound secured by Jimmy Simons.

[00:45] Team_071 possession (Score: 27-24)
Allen Williamson attempts a Layup. Contested by Khris Embiid (4.6 feet, MAN). Allen Williamson misses. Rebound secured by Bam Randle.

[00:26] Team_079 possession (Score: 27-24)
FOUL! Reach-in foul on Dejounte Paul during the drive. [IN THE BONUS! 6 team fouls] Donovan Randle to the line for 2 free throws. (Dejounte Paul: 2 personal fouls)   FT 1/2: GOOD   FT 2/2: MISS Donovan Randle makes 1/2 from the line. Rebound secured by Dejounte Paul.
Score: 27-25

[00:12] Team_071 possession (Score: 27-25)
Allen Williamson attempts a Midrange. Wide open! Bam Randle is 6.6 feet away. [ZONE] ALLEN WILLIAMSON MAKES IT!
Score: 29-25

================================================================================
                              1ST QUARTER COMPLETE                              
================================================================================

1ST QUARTER SCORE: Team_071 29, Team_079 25

BOX SCORE:
================================================================================

Team_071
--------------------------------------------------------------------------------
Player                MIN  PTS  REB  AST  TO      FG   FG%      3P   3P%
--------------------------------------------------------------------------------
Bam Iverson            12   11    3    2   0   4/6    66.7     0/0   0.0
Victor Anunoby         12    8    0    0   0   3/4    75.0     0/0   0.0
Dejounte Paul          12    6    5    2   0   3/4    75.0     0/0   0.0
Allen Williamson       12    2    0    4   0   1/3    33.3     0/0   0.0
Jimmy Simons           12    2    3    0   0   1/2    50.0     0/0   0.0

TEAM: FG: 12/19 (63.2%), 3PT: 5/8 (62.5%), REB: 12 (3 off, 9 def), AST: 8, TO: 3
TEAM FOULS: 6 [Team_079 in BONUS]


Team_079
--------------------------------------------------------------------------------
Player                MIN  PTS  REB  AST  TO      FG   FG%      3P   3P%
--------------------------------------------------------------------------------
Donovan Randle         12    8    2    2   0   4/8    50.0     0/0   0.0
Khris Embiid           12    7    0    1   0   3/5    60.0     0/0   0.0
Miles Ming             12    7    0    0   0   3/5    60.0     0/0   0.0
Trae Durant            12    0    6    1   0   0/0     0.0     0/0   0.0
Bam Randle             12    0    1    1   0   0/2     0.0     0/0   0.0

TEAM: FG: 10/20 (50.0%), 3PT: 3/6 (50.0%), REB: 8 (1 off, 7 def), AST: 5, TO: 1
TEAM FOULS: 4

================================================================================

================================================================================
                       2ND QUARTER - Team_071 vs Team_079                       
================================================================================

[12:00] Team_071 possession (Score: 29-25)
FOUL! Reach-in foul on Trae Durant during the drive. [Team fouls: 1] No free throws, side out. (Trae Durant: 1 personal fouls)

[11:47] Team_071 possession (Score: 29-25)
Jimmy Simons drives and kicks out. Dejounte Paul attempts a 3Pt. Heavily contested by Donovan Randle (0.8 feet, MAN)! Dejounte Paul misses. Rebound secured by Bam Randle.

[11:33] Team_079 possession (Score: 29-25)
Khris Embiid attempts a 3Pt. Contested by Victor Anunoby (4.0 feet, ZONE). KHRIS EMBIID MAKES IT! Assist: Donovan Randle
Score: 29-28

[11:18] Team_071 possession (Score: 29-28)
Victor Anunoby attempts a 3Pt. Contested by Miles Ming (4.1 feet, MAN). VICTOR ANUNOBY MAKES IT! Assist: Jimmy Simons
Score: 32-28

[11:04] Team_079 possession (Score: 32-28)
Khris Embiid loses the ball! Stripped by Allen Williamson! TURNOVER! (live ball)

[10:50] Team_071 possession (Score: 32-28)
Jimmy Simons attempts a Midrange. Contested by Bam Randle (3.6 feet, ZONE). JIMMY SIMONS MAKES IT!
Score: 34-28

[10:36] Team_079 possession (Score: 34-28)
Bam Randle attempts a Midrange. Heavily contested by Jimmy Simons (1.4 feet, ZONE)! Bam Randle misses. Rebound secured by Jimmy Simons.

[10:21] Team_071 possession (Score: 34-28)
Dejounte Paul makes the Layup and draws the foul on Donovan Randle! And-1! Dejounte Paul to the line for 1. [Team fouls: 2] (Donovan Randle: 1 personal fouls)   FT 1/1: GOOD Dejounte Paul makes 1/1 from the line.
Score: 37-28

[10:06] Team_079 possession (Score: 37-28)
FOUL! Offensive foul on Khris Embiid! Allen Williamson drew the charge! [Team fouls: 3] (Khris Embiid: 1 personal fouls) TURNOVER! (dead ball)

[09:51] Team_071 possession (Score: 37-28)
Bam Iverson attempts a 3Pt. Contested by Trae Durant (2.4 feet, ZONE). BAM IVERSON MAKES IT! Assist: Dejounte Paul
Score: 40-28

[09:35] Team_079 possession (Score: 40-28)
Khris Embiid drives to the basket... Khris Embiid throws a bad pass! Stolen by Allen Williamson! TURNOVER! (live ball)

[09:15] Team_071 possession (Score: 40-28)
Dejounte Paul attempts a Midrange. Wide open! Miles Ming is 7.0 feet away. [ZONE] Dejounte Paul misses. Rebound secured by Trae Durant.

[08:56] Team_079 possession (Score: 40-28)
Miles Ming attempts a 3Pt. Contested by Victor Anunoby (5.1 feet, MAN). MILES MING MAKES IT! Assist: Khris Embiid
Score: 40-31

[08:41] Team_071 possession (Score: 40-31)
Jimmy Simons drives to the basket... Jimmy Simons loses control! Ball rolls out of bounds! TURNOVER! (dead ball)

[08:41] Substitution (Team_071): Allen Williamson OUT → Evan Sexton IN (stamina_rule2)

[08:41] Substitution (Team_071): Victor Anunoby OUT → Paul Ball IN (stamina_rule2)

[08:41] Substitution (Team_071): Bam Iverson OUT → Immanuel Ginobili IN (stamina_rule2)

[08:41] Substitution (Team_071): Jimmy Simons OUT → Jordan Durant IN (stamina_rule2)

[08:41] Substitution (Team_071): Dejounte Paul OUT → Tyrese Brogdon IN (stamina_rule2)

[08:41] Substitution (Team_079): Khris Embiid OUT → Evan Mobley IN (stamina_rule2)

[08:41] Substitution (Team_079): Miles Ming OUT → Karl Ingram IN (stamina_rule2)

[08:41] Substitution (Team_079): Bam Randle OUT → Anthony Wade IN (stamina_rule2)

[08:41] Substitution (Team_079): Trae Durant OUT → Kobe Curry IN (stamina_rule2)

[08:41] Substitution (Team_079): Donovan Randle OUT → James LaVine IN (stamina_rule2)

[08:27] Team_079 possession (Score: 40-31)
Kobe Curry attempts a 3Pt. Wide open! Paul Ball is 6.1 feet away. [ZONE] KOBE CURRY MAKES IT! Assist: Anthony Wade
Score: 40-34

[08:13] Team_071 possession (Score: 40-34)
Immanuel Ginobili drives, picks up Anthony Wade. Help arrives from Karl Ingram! Immanuel Ginobili attempts a Layup. Wide open! Karl Ingram is 9.4 feet away. [MAN] Immanuel Ginobili misses. Offensive rebound by Jordan Durant! Jordan Durant kicks it out.

[08:00] Team_071 possession (Score: 40-34)
Tyrese Brogdon attempts a Layup. Contested by James LaVine (4.7 feet, MAN). TYRESE BROGDON MAKES IT!
Score: 42-34

[07:46] Team_079 possession (Score: 42-34)
Evan Mobley attempts a 3Pt. Heavily contested by Paul Ball (1.8 feet, ZONE)! Evan Mobley misses. Rebound secured by Evan Sexton.

[07:33] Team_071 possession (Score: 42-34)
Evan Sexton attempts a Layup. Contested by James LaVine (3.6 feet, ZONE). EVAN SEXTON MAKES IT! Assist: Jordan Durant
Score: 44-34

[07:21] Team_079 possession (Score: 44-34)
James LaVine attempts a Layup. Contested by Tyrese Brogdon (3.7 feet, ZONE). JAMES LAVINE MAKES IT!
Score: 44-36

[07:07] Team_071 possession (Score: 44-36)
Paul Ball attempts a Midrange. Wide open! Karl Ingram is 7.0 feet away. [MAN] Paul Ball misses. Rebound secured by James LaVine.

[06:54] Team_079 possession (Score: 44-36)
Karl Ingram attempts a Layup. Contested by Tyrese Brogdon (2.5 feet, ZONE). KARL INGRAM MAKES IT! Assist: Evan Mobley
Score: 44-38

[06:44] Team_071 possession (Score: 44-38)
Immanuel Ginobili drives, Anthony Wade stays with him. Immanuel Ginobili attempts a Dunk. Contested by Anthony Wade (4.5 feet, MAN). IMMANUEL GINOBILI MAKES IT!
Score: 46-38

[06:31] Team_079 possession (Score: 46-38)
Anthony Wade attempts a 3Pt. Contested by Immanuel Ginobili (3.1 feet, MAN). Anthony Wade misses. Rebound secured by Evan Sexton.

[06:17] Team_071 possession (Score: 46-38)
Tyrese Brogdon attempts a Midrange. Contested by James LaVine (3.1 feet, MAN). TYRESE BROGDON MAKES IT! Assist: Immanuel Ginobili
Score: 48-38

[06:04] Team_079 possession (Score: 48-38)
Evan Mobley attempts a Layup. Contested by Evan Sexton (2.9 feet, MAN). EVAN MOBLEY MAKES IT!
Score: 48-40

[05:52] Team_071 possession (Score: 48-40)
FOUL! Shooting foul on Kobe Curry. Evan Sexton to the line for 2 free throws. [Team fouls: 4] (Kobe Curry: 1 personal fouls)   FT 1/2: GOOD   FT 2/2: GOOD Evan Sexton makes 2/2 from the line.
Score: 50-40

[05:40] Team_079 possession (Score: 50-40)
Anthony Wade loses the ball! Stripped by Immanuel Ginobili! TURNOVER! (live ball)

[05:27] Team_071 possession (Score: 50-40)
Tyrese Brogdon drives, James LaVine stays with him. Tyrese Brogdon attempts a Dunk. Contested by James LaVine (4.4 feet, ZONE). TYRESE BROGDON MAKES IT! Assist: Jordan Durant
Score: 52-40

[05:10] Team_079 possession (Score: 52-40)
James LaVine drives to the basket... James LaVine throws a bad pass! Stolen by Tyrese Brogdon! TURNOVER! (live ball)

[04:51] Team_071 possession (Score: 52-40)
Immanuel Ginobili attempts a Midrange. Contested by Anthony Wade (5.3 feet, MAN). IMMANUEL GINOBILI MAKES IT!
Score: 54-40

[04:36] Team_079 possession (Score: 54-40)
FOUL! Offensive foul on Anthony Wade! Immanuel Ginobili drew the charge! [Team fouls: 5] (Anthony Wade: 1 personal fouls) TURNOVER! (dead ball)

[04:23] Team_071 possession (Score: 54-40)
Immanuel Ginobili attempts a 3Pt. Contested by Anthony Wade (4.9 feet, MAN). IMMANUEL GINOBILI MAKES IT! Assist: Jordan Durant
Score: 57-40

[04:11] Team_079 possession (Score: 57-40)
James LaVine drives and kicks out. Karl Ingram attempts a Midrange. Wide open! Paul Ball is 7.3 feet away. [MAN] KARL INGRAM MAKES IT! Assist: James LaVine
Score: 57-42

[03:56] Team_071 possession (Score: 57-42)
Jordan Durant drives, Kobe Curry stays with him. Jordan Durant attempts a Layup. Contested by Kobe Curry (4.7 feet, MAN). JORDAN DURANT MAKES IT! Assist: Tyrese Brogdon
Score: 59-42

[03:43] Team_079 possession (Score: 59-42)
Karl Ingram attempts a 3Pt. Wide open! Paul Ball is 7.8 feet away. [ZONE] KARL INGRAM MAKES IT! Assist: Anthony Wade
Score: 59-45

[03:30] Team_071 possession (Score: 59-45)
Paul Ball attempts a 3Pt. Wide open! Karl Ingram is 10.0 feet away. [MAN] PAUL BALL MAKES IT! Assist: Jordan Durant
Score: 62-45

[03:12] Team_079 possession (Score: 62-45)
Evan Mobley drives to the basket... Evan Mobley loses the ball! Stripped by Tyrese Brogdon! TURNOVER! (live ball)

[03:01] Team_071 possession (Score: 62-45)
Immanuel Ginobili drives to the basket... Immanuel Ginobili throws a bad pass! Stolen by James LaVine! TURNOVER! (live ball)

[02:45] Team_079 possession (Score: 62-45)
FOUL! Shooting foul on Tyrese Brogdon. James LaVine to the line for 2 free throws. [Team fouls: 1] (Tyrese Brogdon: 1 personal fouls)   FT 1/2: GOOD   FT 2/2: GOOD James LaVine makes 2/2 from the line.
Score: 62-47

[02:28] Team_071 possession (Score: 62-47)
Jordan Durant attempts a Midrange. Contested by Kobe Curry (5.7 feet, MAN). Jordan Durant misses. Rebound secured by Kobe Curry.

[02:13] Team_079 possession (Score: 62-47)
James LaVine drives, Tyrese Brogdon stays with him. James LaVine attempts a Dunk. Contested by Tyrese Brogdon (3.4 feet, MAN). JAMES LAVINE MAKES IT!
Score: 62-49

[01:56] Team_071 possession (Score: 62-49)
Immanuel Ginobili attempts a 3Pt. Contested by Karl Ingram (3.9 feet, ZONE). Immanuel Ginobili misses. Offensive rebound by Immanuel Ginobili! Immanuel Ginobili kicks it out.

[01:42] Team_071 possession (Score: 62-49)
Paul Ball attempts a 3Pt. Contested by Karl Ingram (2.8 feet, ZONE). Paul Ball misses. Offensive rebound by Immanuel Ginobili! Immanuel Ginobili kicks it out.

[01:27] Team_071 possession (Score: 62-49)
Paul Ball attempts a 3Pt. Wide open! Karl Ingram is 7.3 feet away. [MAN] Paul Ball misses. Rebound secured by Kobe Curry.

[01:16] Team_079 possession (Score: 62-49)
Evan Mobley attempts a 3Pt. Contested by Paul Ball (4.7 feet, ZONE). EVAN MOBLEY MAKES IT! Assist: Anthony Wade
Score: 62-52

[01:03] Team_071 possession (Score: 62-52)
Immanuel Ginobili attempts a 3Pt. Contested by Karl Ingram (2.9 feet, ZONE). IMMANUEL GINOBILI MAKES IT!
Score: 65-52

[00:49] Team_079 possession (Score: 65-52)
Kobe Curry drives, Tyrese Brogdon stays with him. Kobe Curry attempts a Dunk. Wide open! Tyrese Brogdon is 8.2 feet away. [ZONE] KOBE CURRY MAKES IT!
Score: 65-54

[00:39] Team_071 possession (Score: 65-54)
Jordan Durant attempts a 3Pt. Contested by Karl Ingram (4.9 feet, ZONE). JORDAN DURANT MAKES IT! Assist: Immanuel Ginobili
Score: 68-54

[00:25] Team_079 possession (Score: 68-54)
Evan Mobley attempts a 3Pt. Contested by Paul Ball (4.6 feet, ZONE). Evan Mobley misses. Rebound secured by Jordan Durant.

[00:14] Team_071 possession (Score: 68-54)
Paul Ball attempts a Midrange. Contested by Kobe Curry (4.5 feet, ZONE). Paul Ball misses. Rebound secured by Kobe Curry.

[00:03] Team_079 possession (Score: 68-54)
James LaVine attempts a Midrange. Heavily contested by Paul Ball (1.6 feet, ZONE)! JAMES LAVINE MAKES IT! Assist: Evan Mobley
Score: 68-56

================================================================================
                              2ND QUARTER COMPLETE                              
================================================================================

2ND QUARTER SCORE: Team_071 39, Team_079 31

BOX SCORE:
================================================================================

Team_071
--------------------------------------------------------------------------------
Player                MIN  PTS  REB  AST  TO      FG   FG%      3P   3P%
--------------------------------------------------------------------------------
Immanuel Ginobili       9   10    2    2   0   4/4   100.0     0/0   0.0
Tyrese Brogdon          9    6    0    1   0   3/3   100.0     0/0   0.0
Jordan Durant           9    5    2    4   0   2/3    66.7     0/0   0.0
Evan Sexton             9    4    2    0   0   2/2   100.0     0/0   0.0
Victor Anunoby         16    3    0    0   0   1/1   100.0     0/0   0.0
Dejounte Paul          16    3    0    1   0   1/2    50.0     0/0   0.0
Bam Iverson            16    3    0    0   0   1/1   100.0     0/0   0.0
Paul Ball               9    3    0    0   0   1/4    25.0     0/0   0.0
Jimmy Simons           16    2    1    1   0   1/2    50.0     0/0   0.0

TEAM: FG: 16/22 (72.7%), 3PT: 6/7 (85.7%), REB: 7 (3 off, 4 def), AST: 9, TO: 2
TEAM FOULS: 1


Team_079
--------------------------------------------------------------------------------
Player                MIN  PTS  REB  AST  TO      FG   FG%      3P   3P%
--------------------------------------------------------------------------------
James LaVine            9    8    1    1   0   4/4   100.0     0/0   0.0
Karl Ingram             9    7    0    0   0   3/3   100.0     0/0   0.0
Kobe Curry              9    5    3    0   0   2/2   100.0     0/0   0.0
Evan Mobley             9    5    0    2   0   2/4    50.0     0/0   0.0
Khris Embiid           16    3    0    1   0   1/1   100.0     0/0   0.0
Miles Ming             16    3    0    0   0   1/1   100.0     0/0   0.0
Bam Randle             16    0    1    0   0   0/1     0.0     0/0   0.0
Donovan Randle         16    0    0    1   0   0/0     0.0     0/0   0.0
Trae Durant            16    0    1    0   0   0/0     0.0     0/0   0.0
Anthony Wade            9    0    0    3   0   0/1     0.0     0/0   0.0

TEAM: FG: 13/17 (76.5%), 3PT: 5/8 (62.5%), REB: 6 (0 off, 6 def), AST: 8, TO: 7
TEAM FOULS: 5 [Team_071 in BONUS]

================================================================================

================================================================================
                       3RD QUARTER - Team_071 vs Team_079                       
================================================================================

[12:00] Team_071 possession (Score: 68-56)
FOUL! Holding foul on Bam Randle. [Team fouls: 1] No free throws, side out. (Bam Randle: 1 personal fouls)

[11:48] Team_071 possession (Score: 68-56)
Bam Iverson attempts a 3Pt. Heavily contested by Bam Randle (1.2 feet, MAN)! Bam Iverson misses. Rebound secured by Trae Durant.

[11:31] Team_079 possession (Score: 68-56)
Trae Durant makes the Midrange and draws the foul on Bam Iverson! And-1! Trae Durant to the line for 1. [Team fouls: 1] (Bam Iverson: 1 personal fouls)   FT 1/1: GOOD Trae Durant makes 1/1 from the line.
Score: 68-59

[11:21] Team_071 possession (Score: 68-59)
Allen Williamson attempts a Midrange. Wide open! Khris Embiid is 6.4 feet away. [MAN] Allen Williamson misses. Rebound secured by Donovan Randle.

[11:08] Team_079 possession (Score: 68-59)
Trae Durant attempts a Midrange. Heavily contested by Jimmy Simons (1.0 feet, MAN)! Trae Durant misses. Rebound secured by Jimmy Simons.

[10:53] Team_071 possession (Score: 68-59)
Bam Iverson drives, picks up Trae Durant. Help arrives from Miles Ming! Bam Iverson attempts a Layup. Contested by Miles Ming (2.3 feet, ZONE). BAM IVERSON MAKES IT! Assist: Dejounte Paul
Score: 70-59

[10:40] Team_079 possession (Score: 70-59)
Donovan Randle drives to the basket... Donovan Randle loses control! Ball rolls out of bounds! TURNOVER! (dead ball)

[10:26] Team_071 possession (Score: 70-59)
Victor Anunoby attempts a 3Pt. Contested by Trae Durant (4.4 feet, ZONE). VICTOR ANUNOBY MAKES IT! Assist: Allen Williamson
Score: 73-59

[10:16] Team_079 possession (Score: 73-59)
Khris Embiid drives, Dejounte Paul stays with him. Khris Embiid attempts a Dunk. Contested by Dejounte Paul (3.6 feet, ZONE). KHRIS EMBIID MAKES IT! Assist: Bam Randle
Score: 73-61

[10:05] Team_071 possession (Score: 73-61)
Jimmy Simons attempts a 3Pt. Contested by Trae Durant (4.3 feet, ZONE). JIMMY SIMONS MAKES IT! Assist: Dejounte Paul
Score: 76-61

[09:52] Team_079 possession (Score: 76-61)
FOUL! Holding foul on Jimmy Simons. [Team fouls: 2] No free throws, side out. (Jimmy Simons: 1 personal fouls)

[09:35] Team_079 possession (Score: 76-61)
Trae Durant attempts a Midrange. Contested by Bam Iverson (4.8 feet, ZONE). TRAE DURANT MAKES IT! Assist: Khris Embiid
Score: 76-63

[09:21] Team_071 possession (Score: 76-63)
Victor Anunoby attempts a Layup. Contested by Miles Ming (4.8 feet, MAN). VICTOR ANUNOBY MAKES IT!
Score: 78-63

[09:11] Team_079 possession (Score: 78-63)
Donovan Randle drives, Dejounte Paul stays with him. Donovan Randle attempts a Layup. Contested by Dejounte Paul (2.4 feet, MAN). DONOVAN RANDLE MAKES IT!
Score: 78-65

[09:00] Team_071 possession (Score: 78-65)
Allen Williamson attempts a 3Pt. Contested by Trae Durant (2.6 feet, ZONE). Allen Williamson misses. Rebound secured by Trae Durant.

[08:45] Team_079 possession (Score: 78-65)
Trae Durant attempts a 3Pt. Heavily contested by Jimmy Simons (0.7 feet, ZONE)! TRAE DURANT MAKES IT! Assist: Donovan Randle
Score: 78-68

[08:29] Team_071 possession (Score: 78-68)
Victor Anunoby attempts a 3Pt. Contested by Trae Durant (4.2 feet, ZONE). Victor Anunoby misses. Rebound secured by Donovan Randle.

[08:14] Team_079 possession (Score: 78-68)
Donovan Randle makes the Layup and draws the foul on Dejounte Paul! And-1! Donovan Randle to the line for 1. [Team fouls: 3] (Dejounte Paul: 1 personal fouls)   FT 1/1: GOOD Donovan Randle makes 1/1 from the line.
Score: 78-71

[07:59] Team_071 possession (Score: 78-71)
Dejounte Paul attempts a Midrange. Heavily contested by Bam Randle (1.5 feet, ZONE)! Dejounte Paul misses. Rebound secured by Donovan Randle.

[07:40] Team_079 possession (Score: 78-71)
Bam Randle drives, Dejounte Paul stays with him. Bam Randle attempts a Dunk. Heavily contested by Dejounte Paul (0.9 feet, ZONE)! Bam Randle misses. Rebound secured by Jimmy Simons.

[07:26] Team_071 possession (Score: 78-71)
FOUL! Reach-in foul on Trae Durant during the drive. [Team fouls: 2] No free throws, side out. (Trae Durant: 1 personal fouls)

[07:15] Team_071 possession (Score: 78-71)
Bam Iverson attempts a Midrange. Heavily contested by Bam Randle (0.5 feet, MAN)! Bam Iverson misses. FOUL! Loose ball foul on Donovan Randle during the rebound battle. [Team fouls: 3] No free throws, side out. (Donovan Randle: 1 personal fouls)

[07:01] Team_071 possession (Score: 78-71)
Allen Williamson attempts a 3Pt. Contested by Trae Durant (5.2 feet, ZONE). ALLEN WILLIAMSON MAKES IT! Assist: Victor Anunoby
Score: 81-71

[06:44] Team_079 possession (Score: 81-71)
Bam Randle attempts a 3Pt. Contested by Victor Anunoby (3.2 feet, ZONE). Bam Randle misses. Rebound secured by Jimmy Simons.

[06:28] Team_071 possession (Score: 81-71)
Victor Anunoby attempts a Midrange. Contested by Miles Ming (3.2 feet, MAN). Victor Anunoby misses. Offensive rebound by Dejounte Paul! Dejounte Paul kicks it out.

[06:14] Team_071 possession (Score: 81-71)
Victor Anunoby attempts a Layup. Heavily contested by Trae Durant (0.9 feet, ZONE)! VICTOR ANUNOBY MAKES IT! Assist: Allen Williamson
Score: 83-71

[05:56] Team_079 possession (Score: 83-71)
Miles Ming attempts a Midrange. Contested by Victor Anunoby (5.3 feet, MAN). Miles Ming misses. Rebound secured by Jimmy Simons.

[05:46] Team_071 possession (Score: 83-71)
Bam Iverson attempts a Midrange. Contested by Trae Durant (4.5 feet, ZONE). Bam Iverson misses. Rebound secured by Donovan Randle.

[05:31] Team_079 possession (Score: 83-71)
Donovan Randle makes the Dunk and draws the foul on Dejounte Paul! And-1! Donovan Randle to the line for 1. [Team fouls: 4] (Dejounte Paul: 2 personal fouls)   FT 1/1: GOOD Donovan Randle makes 1/1 from the line.
Score: 83-74

[05:16] Team_071 possession (Score: 83-74)
Victor Anunoby attempts a 3Pt. Contested by Miles Ming (5.2 feet, MAN). Victor Anunoby misses. Rebound secured by Donovan Randle.

[04:59] Team_079 possession (Score: 83-74)
Trae Durant drives, Jimmy Simons stays with him. Trae Durant attempts a Layup. Heavily contested by Jimmy Simons (1.5 feet, MAN)! TRAE DURANT MAKES IT! Assist: Khris Embiid
Score: 83-76

[04:48] Team_071 possession (Score: 83-76)
Jimmy Simons drives and kicks out. Bam Iverson attempts a 3Pt. Contested by Trae Durant (4.0 feet, ZONE). Bam Iverson misses. Rebound secured by Donovan Randle.

[04:35] Team_079 possession (Score: 83-76)
Bam Randle attempts a 3Pt. Contested by Bam Iverson (2.7 feet, ZONE). Bam Randle misses. Rebound secured by Jimmy Simons.

[04:21] Team_071 possession (Score: 83-76)
FOUL! Shooting foul on Miles Ming. Dejounte Paul to the line for 2 free throws. [Team fouls: 4] (Miles Ming: 1 personal fouls)   FT 1/2: GOOD   FT 2/2: GOOD Dejounte Paul makes 2/2 from the line.
Score: 85-76

[04:03] Team_079 possession (Score: 85-76)
FOUL! Shooting foul on Dejounte Paul. Miles Ming to the line for 2 free throws. [BONUS: 5 team fouls] (Dejounte Paul: 3 personal fouls)   FT 1/2: GOOD   FT 2/2: GOOD Miles Ming makes 2/2 from the line.
Score: 85-78

[03:46] Team_071 possession (Score: 85-78)
Jimmy Simons drives, Trae Durant stays with him. Jimmy Simons attempts a Dunk. Contested by Trae Durant (4.0 feet, MAN). Jimmy Simons misses. Offensive rebound by Dejounte Paul! Dejounte Paul kicks it out.

[03:33] Team_071 possession (Score: 85-78)
Bam Iverson makes the Layup and draws the foul on Trae Durant! And-1! Bam Iverson to the line for 1. [BONUS: 5 team fouls] (Trae Durant: 2 personal fouls)   FT 1/1: GOOD Bam Iverson makes 1/1 from the line.
Score: 88-78

[03:21] Team_079 possession (Score: 88-78)
Miles Ming drives to the basket... FOUL! Offensive foul on Miles Ming! Dejounte Paul drew the charge! [Team fouls: 6] (Miles Ming: 2 personal fouls) TURNOVER! (dead ball)

[03:10] Team_071 possession (Score: 88-78)
Victor Anunoby attempts a 3Pt. Contested by Trae Durant (4.1 feet, ZONE). Victor Anunoby misses. Rebound secured by Trae Durant.

[02:57] Team_079 possession (Score: 88-78)
FOUL! Shooting foul on Jimmy Simons. Trae Durant to the line for 3 free throws. [BONUS: 6 team fouls] (Jimmy Simons: 2 personal fouls)   FT 1/3: GOOD   FT 2/3: GOOD   FT 3/3: MISS Trae Durant makes 2/3 from the line. FOUL! Loose ball foul on Jimmy Simons during the free throw rebound! [IN THE BONUS! 7 team fouls] Trae Durant to the line for 2 free throws. (Jimmy Simons: 3 personal fouls)   FT 1/2: GOOD   FT 2/2: MISS Trae Durant makes 1/2 from the line. Rebound secured by Jimmy Simons.
Score: 88-81

[02:43] Team_071 possession (Score: 88-81)
Jimmy Simons drives, Trae Durant stays with him. Jimmy Simons attempts a Layup. Contested by Trae Durant (4.2 feet, ZONE). JIMMY SIMONS MAKES IT!
Score: 90-81

[02:32] Team_079 possession (Score: 90-81)
Donovan Randle drives, Dejounte Paul stays with him. Donovan Randle attempts a Layup. Heavily contested by Dejounte Paul (0.5 feet, MAN)! DONOVAN RANDLE MAKES IT!
Score: 90-83

[02:17] Team_071 possession (Score: 90-83)
FOUL! Offensive foul on Bam Iverson! Bam Randle drew the charge! [Team fouls: 8] (Bam Iverson: 2 personal fouls) TURNOVER! (dead ball)

[02:04] Team_079 possession (Score: 90-83)
Bam Randle attempts a 3Pt. Contested by Bam Iverson (3.8 feet, MAN). Bam Randle misses. FOUL! Loose ball foul on Bam Iverson during the rebound battle. [IN THE BONUS! 9 team fouls] Trae Durant to the line for 2 free throws. (Bam Iverson: 3 personal fouls)   FT 1/2: MISS   FT 2/2: GOOD Trae Durant makes 1/2 from the line.
Score: 90-84

[01:48] Team_071 possession (Score: 90-84)
Bam Iverson attempts a Layup. Heavily contested by Trae Durant (1.3 feet, ZONE)! BAM IVERSON MAKES IT!
Score: 92-84

[01:33] Team_079 possession (Score: 92-84)
Donovan Randle attempts a Midrange. Contested by Dejounte Paul (5.1 feet, MAN). DONOVAN RANDLE MAKES IT!
Score: 92-86

[01:15] Team_071 possession (Score: 92-86)
Victor Anunoby attempts a Layup. Contested by Trae Durant (4.2 feet, ZONE). VICTOR ANUNOBY MAKES IT! Assist: Dejounte Paul
Score: 94-86

[01:03] Team_079 possession (Score: 94-86)
Khris Embiid attempts a Layup. BLOCKED BY ALLEN WILLIAMSON! Ball is loose! Rebound secured by Dejounte Paul.

[00:48] Team_071 possession (Score: 94-86)
Allen Williamson makes the Layup and draws the foul on Khris Embiid! And-1! Allen Williamson to the line for 1. [BONUS: 7 team fouls] (Khris Embiid: 1 personal fouls)   FT 1/1: MISS Allen Williamson makes 0/1 from the line. Rebound secured by Trae Durant.
Score: 96-86

[00:36] Team_079 possession (Score: 96-86)
FOUL! Shooting foul on Allen Williamson. Khris Embiid to the line for 2 free throws. [BONUS: 10 team fouls] (Allen Williamson: 1 personal fouls)   FT 1/2: MISS   FT 2/2: GOOD Khris Embiid makes 1/2 from the line.
Score: 96-87

[00:18] Team_071 possession (Score: 96-87)
Allen Williamson attempts a Layup. Heavily contested by Trae Durant (1.3 feet, ZONE)! Allen Williamson misses. Rebound secured by Trae Durant.

[00:06] Team_079 possession (Score: 96-87)
Khris Embiid makes the Layup and draws the foul on Dejounte Paul! And-1! Khris Embiid to the line for 1. [BONUS: 11 team fouls] (Dejounte Paul: 4 personal fouls)   FT 1/1: GOOD Khris Embiid makes 1/1 from the line.
Score: 96-90

================================================================================
                              3RD QUARTER COMPLETE                              
================================================================================

3RD QUARTER SCORE: Team_071 28, Team_079 34

BOX SCORE:
================================================================================

Team_071
--------------------------------------------------------------------------------
Player                MIN  PTS  REB  AST  TO      FG   FG%      3P   3P%
--------------------------------------------------------------------------------
Victor Anunoby         28    9    0    1   0   4/7    57.1     0/0   0.0
Bam Iverson            28    7    0    0   0   3/5    60.0     0/0   0.0
Jimmy Simons           28    5    7    0   0   2/3    66.7     0/0   0.0
Allen Williamson       28    3    0    2   0   1/5    20.0     0/0   0.0
Dejounte Paul          28    2    3    3   0   1/2    50.0     0/0   0.0

TEAM: FG: 11/22 (50.0%), 3PT: 3/8 (37.5%), REB: 10 (3 off, 7 def), AST: 6, TO: 1
TEAM FOULS: 11 [Team_079 in BONUS]


Team_079
--------------------------------------------------------------------------------
Player                MIN  PTS  REB  AST  TO      FG   FG%      3P   3P%
--------------------------------------------------------------------------------
Donovan Randle         28   12    6    1   0   5/5   100.0     0/0   0.0
Trae Durant            28   11    5    0   0   5/7    71.4     0/0   0.0
Khris Embiid           28    6    0    2   0   3/4    75.0     0/0   0.0
Miles Ming             28    2    0    0   0   1/2    50.0     0/0   0.0
Bam Randle             28    0    0    1   0   0/3     0.0     0/0   0.0

TEAM: FG: 14/21 (66.7%), 3PT: 2/5 (40.0%), REB: 11 (0 off, 11 def), AST: 4, TO: 2
TEAM FOULS: 7 [Team_071 in BONUS]

================================================================================

================================================================================
                       4TH QUARTER - Team_071 vs Team_079                       
================================================================================

[12:00] Team_071 possession (Score: 96-90)
Bam Iverson drives, Donovan Randle stays with him. Bam Iverson attempts a Layup. Wide open! Donovan Randle is 6.2 feet away. [ZONE] Bam Iverson misses. Rebound secured by Trae Durant.

[11:44] Team_079 possession (Score: 96-90)
FOUL! Shooting foul on Bam Iverson. Bam Randle to the line for 2 free throws. [Team fouls: 1] (Bam Iverson: 1 personal fouls)   FT 1/2: GOOD   FT 2/2: MISS Bam Randle makes 1/2 from the line. Rebound secured by Jimmy Simons.
Score: 96-91

[11:29] Team_071 possession (Score: 96-91)
Jimmy Simons attempts a Layup. BLOCKED BY MILES MING! Ball is loose! Rebound secured by Donovan Randle.

[11:13] Team_079 possession (Score: 96-91)
Trae Durant attempts a Midrange. Contested by Jimmy Simons (3.4 feet, MAN). Trae Durant misses. Rebound secured by Dejounte Paul.

[10:59] Team_071 possession (Score: 96-91)
Bam Iverson drives and kicks out. Allen Williamson attempts a 3Pt. Contested by Khris Embiid (4.0 feet, MAN). Allen Williamson misses. Offensive rebound by Dejounte Paul! Dejounte Paul kicks it out.

[10:46] Team_071 possession (Score: 96-91)
Jimmy Simons drives, picks up Trae Durant. Help arrives from Miles Ming! Jimmy Simons attempts a Layup. Contested by Miles Ming (4.0 feet, MAN). JIMMY SIMONS MAKES IT! Assist: Bam Iverson
Score: 98-91

[10:35] Team_079 possession (Score: 98-91)
Trae Durant attempts a 3Pt. Contested by Jimmy Simons (4.5 feet, MAN). Trae Durant misses. Rebound secured by Jimmy Simons.

[10:20] Team_071 possession (Score: 98-91)
Allen Williamson drives, picks up Khris Embiid. Help arrives from Miles Ming! Allen Williamson attempts a Dunk. Contested by Miles Ming (4.9 feet, MAN). ALLEN WILLIAMSON MAKES IT! Assist: Victor Anunoby
Score: 100-91

[10:06] Team_079 possession (Score: 100-91)
FOUL! Offensive foul on Miles Ming! Victor Anunoby drew the charge! [Team fouls: 1] (Miles Ming: 1 personal fouls) TURNOVER! (dead ball)

[09:46] Team_071 possession (Score: 100-91)
Dejounte Paul drives and kicks out. Bam Iverson attempts a 3Pt. Contested by Trae Durant (2.3 feet, ZONE). Bam Iverson misses. FOUL! Loose ball foul on Bam Randle during the rebound battle. [Team fouls: 2] No free throws, side out. (Bam Randle: 1 personal fouls)

[09:32] Team_071 possession (Score: 100-91)
FOUL! Shooting foul on Trae Durant. Dejounte Paul to the line for 3 free throws. [Team fouls: 3] (Trae Durant: 1 personal fouls)   FT 1/3: GOOD   FT 2/3: GOOD   FT 3/3: MISS Dejounte Paul makes 2/3 from the line. Rebound secured by Bam Randle.
Score: 102-91

[09:18] Team_079 possession (Score: 102-91)
Trae Durant attempts a 3Pt. Wide open! Jimmy Simons is 7.5 feet away. [MAN] Trae Durant misses. Rebound secured by Jimmy Simons.

[09:08] Team_071 possession (Score: 102-91)
Jimmy Simons attempts a 3Pt. Contested by Trae Durant (5.2 feet, MAN). Jimmy Simons misses. Rebound secured by Donovan Randle.

[08:53] Team_079 possession (Score: 102-91)
FOUL! Shooting foul on Dejounte Paul. Bam Randle to the line for 2 free throws. [Team fouls: 2] (Dejounte Paul: 1 personal fouls)   FT 1/2: GOOD   FT 2/2: GOOD Bam Randle makes 2/2 from the line.
Score: 102-93

[08:41] Team_071 possession (Score: 102-93)
Jimmy Simons attempts a 3Pt. Contested by Trae Durant (3.5 feet, MAN). JIMMY SIMONS MAKES IT! Assist: Victor Anunoby
Score: 105-93

[08:31] Team_079 possession (Score: 105-93)
Bam Randle attempts a Layup. Contested by Bam Iverson (4.3 feet, MAN). Bam Randle misses. Rebound secured by Bam Iverson.

[08:20] Team_071 possession (Score: 105-93)
Allen Williamson attempts a Midrange. Contested by Khris Embiid (2.4 feet, MAN). ALLEN WILLIAMSON MAKES IT!
Score: 107-93

[08:06] Team_079 possession (Score: 107-93)
Bam Randle drives, Dejounte Paul stays with him. Bam Randle attempts a Dunk. Contested by Dejounte Paul (5.8 feet, ZONE). BAM RANDLE MAKES IT!
Score: 107-95

[07:53] Team_071 possession (Score: 107-95)
Bam Iverson makes the Layup and draws the foul on Donovan Randle! And-1! Bam Iverson to the line for 1. [Team fouls: 4] (Donovan Randle: 1 personal fouls)   FT 1/1: GOOD Bam Iverson makes 1/1 from the line.
Score: 110-95

[07:43] Team_079 possession (Score: 110-95)
Khris Embiid attempts a 3Pt. Contested by Allen Williamson (5.9 feet, MAN). KHRIS EMBIID MAKES IT! Assist: Bam Randle
Score: 110-98

[07:26] Team_071 possession (Score: 110-98)
FOUL! Shooting foul on Trae Durant. Jimmy Simons to the line for 3 free throws. [BONUS: 5 team fouls] (Trae Durant: 2 personal fouls)   FT 1/3: GOOD   FT 2/3: GOOD   FT 3/3: GOOD Jimmy Simons makes 3/3 from the line.
Score: 113-98

[07:16] Team_079 possession (Score: 113-98)
Bam Randle drives and kicks out. Bam Randle attempts a Midrange. Wide open! Bam Iverson is 6.7 feet away. [MAN] Bam Randle misses. Rebound secured by Dejounte Paul.

[07:03] Team_071 possession (Score: 113-98)
FOUL! Holding foul on Trae Durant. [IN THE BONUS! 6 team fouls] Jimmy Simons to the line for 2 free throws. (Trae Durant: 3 personal fouls)   FT 1/2: MISS   FT 2/2: GOOD Jimmy Simons makes 1/2 from the line.
Score: 114-98

[06:47] Team_079 possession (Score: 114-98)
Trae Durant attempts a Midrange. Wide open! Jimmy Simons is 8.0 feet away. [MAN] TRAE DURANT MAKES IT!
Score: 114-100

[06:36] Team_071 possession (Score: 114-100)
FOUL! Shooting foul on Trae Durant. Victor Anunoby to the line for 2 free throws. [BONUS: 7 team fouls] (Trae Durant: 4 personal fouls)   FT 1/2: GOOD   FT 2/2: GOOD Victor Anunoby makes 2/2 from the line.
Score: 116-100

[06:20] Team_079 possession (Score: 116-100)
FOUL! Offensive foul on Trae Durant! Jimmy Simons drew the charge! [Team fouls: 8] (Trae Durant: 5 personal fouls) TURNOVER! (dead ball)

[06:04] Team_071 possession (Score: 116-100)
Jimmy Simons attempts a Midrange. Contested by Trae Durant (3.6 feet, ZONE). Jimmy Simons misses. Rebound secured by Bam Randle.

[05:54] Team_079 possession (Score: 116-100)
Trae Durant attempts a Midrange. Wide open! Jimmy Simons is 8.8 feet away. [MAN] TRAE DURANT MAKES IT!
Score: 116-102

[05:41] Team_071 possession (Score: 116-102)
Victor Anunoby attempts a Midrange. Wide open! Miles Ming is 6.6 feet away. [ZONE] Victor Anunoby misses. Offensive rebound by Bam Iverson! Bam Iverson kicks it out.

[05:29] Team_071 possession (Score: 116-102)
Victor Anunoby attempts a Midrange. Contested by Miles Ming (4.6 feet, MAN). VICTOR ANUNOBY MAKES IT! Assist: Dejounte Paul
Score: 118-102

[05:16] Team_079 possession (Score: 118-102)
Trae Durant attempts a 3Pt. Heavily contested by Victor Anunoby (1.8 feet, ZONE)! TRAE DURANT MAKES IT! Assist: Miles Ming
Score: 118-105

[05:04] Team_071 possession (Score: 118-105)
Bam Iverson attempts a Midrange. Wide open! Bam Randle is 6.9 feet away. [MAN] Bam Iverson misses. Rebound secured by Donovan Randle.

[04:54] Team_079 possession (Score: 118-105)
Donovan Randle drives to the basket... Donovan Randle throws a bad pass out of bounds! TURNOVER! (dead ball)

[04:54] Substitution (Team_071): Allen Williamson OUT → Evan Sexton IN (stamina_rule2)

[04:54] Substitution (Team_071): Victor Anunoby OUT → Paul Ball IN (stamina_rule2)

[04:54] Substitution (Team_071): Bam Iverson OUT → Immanuel Ginobili IN (stamina_rule2)

[04:54] Substitution (Team_071): Jimmy Simons OUT → Jordan Durant IN (stamina_rule2)

[04:54] Substitution (Team_071): Dejounte Paul OUT → Tyrese Brogdon IN (stamina_rule2)

[04:54] Substitution (Team_079): Khris Embiid OUT → Evan Mobley IN (stamina_rule2)

[04:54] Substitution (Team_079): Miles Ming OUT → Karl Ingram IN (stamina_rule2)

[04:54] Substitution (Team_079): Bam Randle OUT → Anthony Wade IN (stamina_rule2)

[04:54] Substitution (Team_079): Trae Durant OUT → Kobe Curry IN (stamina_rule2)

[04:54] Substitution (Team_079): Donovan Randle OUT → James LaVine IN (stamina_rule2)

[04:39] Team_071 possession (Score: 118-105)
Jordan Durant loses the ball! Stripped by Kobe Curry! TURNOVER! (live ball)

[04:21] Team_079 possession (Score: 118-105)
James LaVine drives to the basket... James LaVine loses control! Ball rolls out of bounds! TURNOVER! (dead ball)

[04:06] Team_071 possession (Score: 118-105)
FOUL! Shooting foul on Kobe Curry. Jordan Durant to the line for 2 free throws. [BONUS: 9 team fouls] (Kobe Curry: 1 personal fouls)   FT 1/2: MISS   FT 2/2: MISS Jordan Durant makes 0/2 from the line. FOUL! Loose ball foul on Anthony Wade during the free throw rebound! [IN THE BONUS! 10 team fouls] Jordan Durant to the line for 2 free throws. (Anthony Wade: 1 personal fouls)   FT 1/2: MISS   FT 2/2: GOOD Jordan Durant makes 1/2 from the line.
Score: 119-105

[03:50] Team_079 possession (Score: 119-105)
Anthony Wade drives, Jordan Durant stays with him. Anthony Wade attempts a Dunk. Contested by Jordan Durant (5.8 feet, ZONE). ANTHONY WADE MAKES IT! Assist: Karl Ingram
Score: 119-107

[03:39] Team_071 possession (Score: 119-107)
Tyrese Brogdon loses control! Ball rolls out of bounds! TURNOVER! (dead ball)

[03:26] Team_079 possession (Score: 119-107)
Evan Mobley attempts a Midrange. Contested by Paul Ball (4.8 feet, ZONE). EVAN MOBLEY MAKES IT!
Score: 119-109

[03:07] Team_071 possession (Score: 119-109)
Evan Sexton makes the Layup and draws the foul on Karl Ingram! And-1! Evan Sexton to the line for 1. [BONUS: 11 team fouls] (Karl Ingram: 1 personal fouls)   FT 1/1: GOOD Evan Sexton makes 1/1 from the line.
Score: 122-109

[02:49] Team_079 possession (Score: 122-109)
James LaVine drives, picks up Tyrese Brogdon. Help arrives from Evan Sexton! James LaVine attempts a Dunk. Contested by Evan Sexton (5.5 feet, MAN). JAMES LAVINE MAKES IT!
Score: 122-111

[02:36] Team_071 possession (Score: 122-111)
FOUL! Shooting foul on James LaVine. Immanuel Ginobili to the line for 2 free throws. [BONUS: 12 team fouls] (James LaVine: 1 personal fouls)   FT 1/2: GOOD   FT 2/2: GOOD Immanuel Ginobili makes 2/2 from the line.
Score: 124-111

[02:24] Team_079 possession (Score: 124-111)
Anthony Wade throws a bad pass out of bounds! TURNOVER! (dead ball)

[02:11] Team_071 possession (Score: 124-111)
Tyrese Brogdon drives to the basket... Tyrese Brogdon throws a bad pass! Stolen by James LaVine! TURNOVER! (live ball)

[02:02] Team_079 possession (Score: 124-111)
James LaVine drives, picks up Tyrese Brogdon. Help arrives from Evan Sexton! James LaVine attempts a Layup. Contested by Evan Sexton (2.9 feet, ZONE). JAMES LAVINE MAKES IT! Assist: Anthony Wade
Score: 124-113

[01:50] Team_071 possession (Score: 124-113)
Tyrese Brogdon attempts a Layup. Contested by James LaVine (2.5 feet, ZONE). TYRESE BROGDON MAKES IT! Assist: Paul Ball
Score: 126-113

[01:35] Team_079 possession (Score: 126-113)
Kobe Curry attempts a 3Pt. Contested by Paul Ball (3.2 feet, ZONE). KOBE CURRY MAKES IT! Assist: Evan Mobley
Score: 126-116

[01:17] Team_071 possession (Score: 126-116)
Tyrese Brogdon attempts a 3Pt. Contested by Kobe Curry (5.8 feet, ZONE). Tyrese Brogdon misses. Rebound secured by Anthony Wade.

[01:04] Team_079 possession (Score: 126-116)
Karl Ingram attempts a 3Pt. Contested by Paul Ball (2.8 feet, ZONE). Karl Ingram misses. Rebound secured by Jordan Durant.

[00:47] Team_071 possession (Score: 126-116)
Immanuel Ginobili throws a bad pass! Stolen by Anthony Wade! TURNOVER! (live ball)

[00:36] Team_079 possession (Score: 126-116)
Kobe Curry attempts a 3Pt. Wide open! Jordan Durant is 8.4 feet away. [MAN] KOBE CURRY MAKES IT! Assist: Karl Ingram
Score: 126-119

[00:23] Team_071 possession (Score: 126-119)
Evan Sexton drives, picks up James LaVine. Help arrives from Karl Ingram! Evan Sexton attempts a Layup. Contested by Karl Ingram (3.4 feet, ZONE). Evan Sexton misses. Rebound secured by James LaVine.

[00:11] Team_079 possession (Score: 126-119)
Evan Mobley attempts a 3Pt. Wide open! Paul Ball is 7.3 feet away. [ZONE] Evan Mobley misses. Rebound secured by Evan Sexton.

================================================================================
                              4TH QUARTER COMPLETE                              
================================================================================

4TH QUARTER SCORE: Team_071 30, Team_079 29

BOX SCORE:
================================================================================

Team_071
--------------------------------------------------------------------------------
Player                MIN  PTS  REB  AST  TO      FG   FG%      3P   3P%
--------------------------------------------------------------------------------
Jimmy Simons           35    9    4    0   0   4/7    57.1     0/0   0.0
Allen Williamson       35    4    0    0   0   2/2   100.0     0/0   0.0
Victor Anunoby         35    4    0    2   0   2/2   100.0     0/0   0.0
Bam Iverson            35    3    2    1   0   1/3    33.3     0/0   0.0
Evan Sexton            13    3    1    0   0   1/2    50.0     0/0   0.0
Immanuel Ginobili      13    2    0    0   0   1/1   100.0     0/0   0.0
Tyrese Brogdon         13    2    0    0   0   1/2    50.0     0/0   0.0
Jordan Durant          13    1    1    0   0   1/1   100.0     0/0   0.0
Dejounte Paul          35    0    3    1   0   0/1     0.0     0/0   0.0
Paul Ball              13    0    0    1   0   0/0     0.0     0/0   0.0

TEAM: FG: 13/21 (61.9%), 3PT: 2/5 (40.0%), REB: 11 (3 off, 8 def), AST: 5, TO: 4
TEAM FOULS: 2


Team_079
--------------------------------------------------------------------------------
Player                MIN  PTS  REB  AST  TO      FG   FG%      3P   3P%
--------------------------------------------------------------------------------
Trae Durant            35    7    1    0   0   3/6    50.0     0/0   0.0
Kobe Curry             13    6    0    0   0   2/2   100.0     0/0   0.0
Bam Randle             35    4    2    1   0   2/5    40.0     0/0   0.0
James LaVine           13    4    1    0   0   2/2   100.0     0/0   0.0
Khris Embiid           35    3    0    0   0   1/1   100.0     0/0   0.0
Anthony Wade           13    2    1    1   0   1/1   100.0     0/0   0.0
Evan Mobley            13    2    0    1   0   1/2    50.0     0/0   0.0
Donovan Randle         35    0    3    0   0   0/0     0.0     0/0   0.0
Miles Ming             35    0    0    1   0   0/0     0.0     0/0   0.0
Karl Ingram            13    0    0    2   0   0/1     0.0     0/0   0.0

TEAM: FG: 12/20 (60.0%), 3PT: 4/8 (50.0%), REB: 8 (0 off, 8 def), AST: 6, TO: 5
TEAM FOULS: 12 [Team_071 in BONUS]

================================================================================

================================================================================
                               FULL GAME COMPLETE                               
================================================================================

FINAL SCORE: Team_071 126, Team_079 119

SCORING BY QUARTER:
--------------------------------------------------------------------------------
Team                     Q1     Q2     Q3     Q4    FINAL
--------------------------------------------------------------------------------
Team_071                 29     39     28     30      126
Team_079                 25     31     34     29      119
--------------------------------------------------------------------------------

FULL GAME BOX SCORE:
================================================================================

Team_071
--------------------------------------------------------------------------------
Player                MIN  PTS  REB  AST  TO      FG   FG%      3P   3P%      FT STL BLK
--------------------------------------------------------------------------------
Allen Williamson       35    9    0    6   2   4/10   40.0   1/2    50.0   0/1     3   1
Victor Anunoby         35   24    0    3   0  10/14   71.4   4/8    50.0   4/4     0   0
Bam Iverson            35   24    5    3   1   9/15   60.0   4/7    57.1   2/2     0   0
Jimmy Simons           35   18   15    1   1   7/13   53.8   3/4    75.0   4/5     0   0
Dejounte Paul          35   11   11    7   1   5/9    55.6   0/1     0.0   5/6     0   2
Evan Sexton            13    7    3    0   0   3/4    75.0   0/0     0.0   3/3     0   0
Paul Ball              13    3    0    1   1   1/4    25.0   1/2    50.0   0/0     0   0
Immanuel Ginobili      13   12    2    2   1   5/5   100.0   2/2   100.0   2/2     1   0
Jordan Durant          13    6    3    4   1   3/4    75.0   1/1   100.0   0/2     0   0
Tyrese Brogdon         13    8    0    1   2   4/5    80.0   0/1     0.0   0/0     2   0

TEAM: FG: 52/84 (61.9%), 3PT: 16/28 (57.1%), REB: 40 (12 off, 28 def), AST: 28, TO: 10


Team_079
--------------------------------------------------------------------------------
Player                MIN  PTS  REB  AST  TO      FG   FG%      3P   3P%      FT STL BLK
--------------------------------------------------------------------------------
Khris Embiid           35   19    0    4   3   8/11   72.7   3/3   100.0   4/5     0   1
Miles Ming             35   12    0    1   2   6/9    66.7   3/5    60.0   2/2     0   1
Bam Randle             35    4    4    3   3   3/12   25.0   1/4    25.0   3/4     0   0
Trae Durant            35   18   13    1   1   7/12   58.3   2/5    40.0   4/6     0   0
Donovan Randle         35   20   11    4   0   8/12   66.7   0/0     0.0   5/7     0   0
Evan Mobley            13    7    0    3   1   3/6    50.0   1/4    25.0   0/0     0   0
Karl Ingram            13    7    0    2   0   2/3    66.7   1/2    50.0   0/0     0   0
Anthony Wade           13    2    1    4   5   1/2    50.0   0/1     0.0   0/0     1   0
Kobe Curry             13   11    3    0   0   4/4   100.0   3/3   100.0   0/0     1   0
James LaVine           13   12    2    1   0   7/7   100.0   0/0     0.0   2/2     2   0

TEAM: FG: 49/78 (62.8%), 3PT: 14/27 (51.9%), REB: 33 (1 off, 32 def), AST: 23, TO: 15

================================================================================
