================================================================================
                        FULL GAME - Team_010 vs Team_008                        
================================================================================

================================================================================
                       1ST QUARTER - Team_010 vs Team_008                       
================================================================================

[12:00] Team_010 possession (Score: 0-0)
Michael Turner attempts a Midrange. Wide open! Jrue Harris is 9.2 feet away. [ZONE] Michael Turner misses. Rebound secured by Tyrese Thompson.

[11:47] Team_008 possession (Score: 0-0)
Khris Hyland attempts a Layup. Contested by RJ Young (2.7 feet, MAN). KHRIS HYLAND MAKES IT! Assist: Magic Young
Score: 0-2

[11:32] Team_010 possession (Score: 0-2)
Desmond Antetokounmpo attempts a Midrange. Contested by Jrue Harris (2.4 feet, ZONE). DESMOND ANTETOKOUNMPO MAKES IT!
Score: 2-2

[11:20] Team_008 possession (Score: 2-2)
Khris Hyland attempts a 3Pt. Wide open! RJ Young is 6.2 feet away. [MAN] Khris Hyland misses. Rebound secured by Desmond Antetokounmpo.

[11:05] Team_010 possession (Score: 2-2)
Anthony Durant attempts a Layup. BLOCKED BY TYRESE THOMPSON! Ball is loose! Rebound secured by Tyrese Thompson.

[10:52] Team_008 possession (Score: 2-2)
Khris Hyland drives and kicks out. Tyrese Thompson attempts a 3Pt. Contested by Cade Morant (2.9 feet, ZONE). Tyrese Thompson misses. Offensive rebound by Tyrese Thompson! Tyrese Thompson kicks it out.

[10:33] Team_008 possession (Score: 2-2)
Tyrese Thompson attempts a 3Pt. Contested by Desmond Antetokounmpo (3.9 feet, ZONE). Tyrese Thompson misses. Rebound secured by Desmond Antetokounmpo.

[10:20] Team_010 possession (Score: 2-2)
Anthony Durant attempts a Layup. Contested by Tyrese Thompson (3.4 feet, ZONE). ANTHONY DURANT MAKES IT! Assist: Cade Morant
Score: 4-2

[10:05] Team_008 possession (Score: 4-2)
Victor Leonard attempts a 3Pt. Contested by Cade Morant (2.9 feet, MAN). Victor Leonard misses. Rebound secured by Anthony Durant.

[09:50] Team_010 possession (Score: 4-2)
Desmond Antetokounmpo drives, picks up Tyrese Thompson. Help arrives from Jrue Harris! Desmond Antetokounmpo attempts a Layup. Wide open! Jrue Harris is 6.3 feet away. [MAN] DESMOND ANTETOKOUNMPO MAKES IT! Assist: Cade Morant
Score: 6-2

[09:40] Team_008 possession (Score: 6-2)
Tyrese Thompson drives, Desmond Antetokounmpo stays with him. Tyrese Thompson attempts a Dunk. Heavily contested by Desmond Antetokounmpo (1.8 feet, ZONE)! Tyrese Thompson misses. Offensive rebound by Magic Young! Magic Young puts it back in!
Score: 6-4

[09:30] Team_010 possession (Score: 6-4)
Cade Morant attempts a Layup. BLOCKED BY TYRESE THOMPSON! Ball is loose! Rebound secured by Tyrese Thompson.

[09:17] Team_008 possession (Score: 6-4)
Tyrese Thompson drives to the basket... Tyrese Thompson throws a bad pass out of bounds! TURNOVER! (dead ball)

[09:03] Team_010 possession (Score: 6-4)
Desmond Antetokounmpo drives, Tyrese Thompson stays with him. Desmond Antetokounmpo attempts a Dunk. Heavily contested by Tyrese Thompson (1.9 feet, ZONE)! Desmond Antetokounmpo misses. Offensive rebound by Anthony Durant! Anthony Durant kicks it out.

[08:52] Team_010 possession (Score: 6-4)
Desmond Antetokounmpo attempts a Midrange. Contested by Jrue Harris (4.8 feet, ZONE). Desmond Antetokounmpo misses. Rebound secured by Tyrese Thompson.

[08:36] Team_008 possession (Score: 6-4)
Magic Young attempts a Midrange. Contested by Desmond Antetokounmpo (3.1 feet, ZONE). MAGIC YOUNG MAKES IT! Assist: Jrue Harris
Score: 6-6

[08:22] Team_010 possession (Score: 6-6)
Desmond Antetokounmpo attempts a Midrange. Contested by Tyrese Thompson (3.7 feet, MAN). Desmond Antetokounmpo misses. Rebound secured by Tyrese Thompson.

[08:05] Team_008 possession (Score: 6-6)
Victor Leonard attempts a Layup. BLOCKED BY CADE MORANT! Ball is loose! Rebound secured by Anthony Durant.

[07:48] Team_010 possession (Score: 6-6)
Cade Morant attempts a 3Pt. Contested by Victor Leonard (4.6 feet, ZONE). CADE MORANT MAKES IT! Assist: Michael Turner
Score: 9-6

[07:33] Team_008 possession (Score: 9-6)
Khris Hyland attempts a 3Pt. Wide open! Cade Morant is 8.0 feet away. [ZONE] Khris Hyland misses. Rebound secured by Cade Morant.

[07:17] Team_010 possession (Score: 9-6)
Michael Turner attempts a 3Pt. Contested by Jrue Harris (5.4 feet, ZONE). MICHAEL TURNER MAKES IT! Assist: Cade Morant
Score: 12-6

[07:04] Team_008 possession (Score: 12-6)
Victor Leonard attempts a 3Pt. Heavily contested by Cade Morant (1.4 feet, ZONE)! Victor Leonard misses. Rebound secured by Cade Morant.

[06:49] Team_010 possession (Score: 12-6)
Desmond Antetokounmpo attempts a 3Pt. Contested by Victor Leonard (4.4 feet, ZONE). DESMOND ANTETOKOUNMPO MAKES IT! Assist: RJ Young
Score: 15-6

[06:36] Team_008 possession (Score: 15-6)
Magic Young attempts a 3Pt. Contested by Anthony Durant (4.7 feet, MAN). Magic Young misses. Offensive rebound by Magic Young! Magic Young puts it back in!
Score: 15-8

[06:18] Team_010 possession (Score: 15-8)
RJ Young attempts a Midrange. Heavily contested by Khris Hyland (0.5 feet, MAN)! RJ YOUNG MAKES IT!
Score: 17-8

[06:04] Team_008 possession (Score: 17-8)
Victor Leonard attempts a Layup. Heavily contested by Cade Morant (0.7 feet, MAN)! VICTOR LEONARD MAKES IT!
Score: 17-10

[05:50] Team_010 possession (Score: 17-10)
FOUL! Holding foul on Victor Leonard. [Team fouls: 1] No free throws, side out. (Victor Leonard: 1 personal fouls)

[05:37] Team_010 possession (Score: 17-10)
RJ Young attempts a 3Pt. Contested by Victor Leonard (5.2 feet, ZONE). RJ Young misses. Rebound secured by Magic Young.

[05:25] Team_008 possession (Score: 17-10)
Khris Hyland attempts a 3Pt. Heavily contested by Cade Morant (2.0 feet, ZONE)! Khris Hyland misses. Rebound secured by Anthony Durant.

[05:07] Team_010 possession (Score: 17-10)
Michael Turner attempts a 3Pt. Contested by Victor Leonard (3.8 feet, ZONE). MICHAEL TURNER MAKES IT! Assist: Anthony Durant
Score: 20-10

[04:54] Team_008 possession (Score: 20-10)
Jrue Harris drives, picks up Anthony Durant. Help arrives from Cade Morant! Jrue Harris attempts a Dunk. Contested by Cade Morant (3.1 feet, ZONE). Jrue Harris misses. Rebound secured by Michael Turner.

[04:42] Team_010 possession (Score: 20-10)
Desmond Antetokounmpo commits a violation (traveling/carry)! TURNOVER! (dead ball)

[04:27] Team_008 possession (Score: 20-10)
Tyrese Thompson attempts a 3Pt. Contested by Desmond Antetokounmpo (4.0 feet, MAN). Tyrese Thompson misses. Rebound secured by Cade Morant.

[04:14] Team_010 possession (Score: 20-10)
FOUL! Reach-in foul on Tyrese Thompson during the drive. [Team fouls: 2] No free throws, side out. (Tyrese Thompson: 1 personal fouls)

[04:02] Team_010 possession (Score: 20-10)
Michael Turner attempts a 3Pt. Contested by Jrue Harris (2.0 feet, MAN). MICHAEL TURNER MAKES IT! Assist: RJ Young
Score: 23-10

[03:45] Team_008 possession (Score: 23-10)
Victor Leonard attempts a Midrange. Contested by Cade Morant (3.7 feet, MAN). VICTOR LEONARD MAKES IT!
Score: 23-12

[03:35] Team_010 possession (Score: 23-12)
Michael Turner attempts a Midrange. Contested by Jrue Harris (3.6 feet, MAN). MICHAEL TURNER MAKES IT! Assist: Desmond Antetokounmpo
Score: 25-12

[03:18] Team_008 possession (Score: 25-12)
FOUL! Reach-in foul on Anthony Durant during the drive. [Team fouls: 1] No free throws, side out. (Anthony Durant: 1 personal fouls)

[03:07] Team_008 possession (Score: 25-12)
Magic Young attempts a Layup. Contested by Anthony Durant (5.9 feet, ZONE). MAGIC YOUNG MAKES IT! Assist: Victor Leonard
Score: 25-14

[02:51] Team_010 possession (Score: 25-14)
Anthony Durant attempts a Midrange. Wide open! Magic Young is 6.3 feet away. [MAN] ANTHONY DURANT MAKES IT! Assist: Cade Morant
Score: 27-14

[02:35] Team_008 possession (Score: 27-14)
Magic Young drives, Anthony Durant stays with him. Magic Young attempts a Layup. Heavily contested by Anthony Durant (0.5 feet, MAN)! Magic Young misses. Rebound secured by Cade Morant.

[02:21] Team_010 possession (Score: 27-14)
Anthony Durant makes the Dunk and draws the foul on Jrue Harris! And-1! Anthony Durant to the line for 1. [Team fouls: 3] (Jrue Harris: 1 personal fouls)   FT 1/1: GOOD Anthony Durant makes 1/1 from the line.
Score: 30-14

[02:05] Team_008 possession (Score: 30-14)
Khris Hyland throws a bad pass! Stolen by RJ Young! TURNOVER! (live ball)

[01:50] Team_010 possession (Score: 30-14)
Desmond Antetokounmpo commits a violation (traveling/carry)! TURNOVER! (dead ball)

[01:50] Substitution (Team_010): Cade Morant OUT → Draymond Leonard IN (stamina_rule2)

[01:50] Substitution (Team_010): Michael Turner OUT → Blake Harden IN (stamina_rule2)

[01:50] Substitution (Team_010): RJ Young OUT → Ben Gilgeous-Alexander IN (stamina_rule2)

[01:50] Substitution (Team_010): Desmond Antetokounmpo OUT → Vince Ingram IN (stamina_rule2)

[01:50] Substitution (Team_010): Anthony Durant OUT → Paolo Wade IN (stamina_rule2)

[01:50] Substitution (Team_008): Victor Leonard OUT → Blake Holiday IN (stamina_rule2)

[01:50] Substitution (Team_008): Jrue Harris OUT → Chris Griffin IN (stamina_rule2)

[01:50] Substitution (Team_008): Khris Hyland OUT → Immanuel Young IN (stamina_rule2)

[01:50] Substitution (Team_008): Tyrese Thompson OUT → Khris Giddey IN (stamina_rule2)

[01:50] Substitution (Team_008): Magic Young OUT → Lamelo Middleton IN (stamina_rule2)

[01:34] Team_008 possession (Score: 30-14)
Lamelo Middleton drives, Paolo Wade stays with him. Lamelo Middleton attempts a Dunk. Wide open! Paolo Wade is 7.0 feet away. [ZONE] LAMELO MIDDLETON MAKES IT! Assist: Blake Holiday
Score: 30-16

[01:18] Team_010 possession (Score: 30-16)
Blake Harden attempts a Midrange. Contested by Lamelo Middleton (2.2 feet, ZONE). Blake Harden misses. Rebound secured by Khris Giddey.

[01:05] Team_008 possession (Score: 30-16)
Lamelo Middleton drives to the basket... Lamelo Middleton throws a bad pass out of bounds! TURNOVER! (dead ball)

[00:49] Team_010 possession (Score: 30-16)
FOUL! Offensive foul on Draymond Leonard! Blake Holiday drew the charge! [Team fouls: 2] (Draymond Leonard: 1 personal fouls) TURNOVER! (dead ball)

[00:37] Team_008 possession (Score: 30-16)
Blake Holiday attempts a Midrange. Contested by Draymond Leonard (2.6 feet, MAN). BLAKE HOLIDAY MAKES IT! Assist: Chris Griffin
Score: 30-18

[00:19] Team_010 possession (Score: 30-18)
Blake Harden attempts a 3Pt. Wide open! Khris Giddey is 6.4 feet away. [ZONE] BLAKE HARDEN MAKES IT! Assist: Ben Gilgeous-Alexander
Score: 33-18

[00:02] Team_008 possession (Score: 33-18)
Blake Holiday attempts a 3Pt. Contested by Draymond Leonard (4.9 feet, ZONE). Blake Holiday misses. Rebound secured by Blake Harden.

================================================================================
                              1ST QUARTER COMPLETE                              
================================================================================

1ST QUARTER SCORE: Team_010 33, Team_008 18

BOX SCORE:
================================================================================

Team_010
--------------------------------------------------------------------------------
Player                MIN  PTS  REB  AST  TO      FG   FG%      3P   3P%
--------------------------------------------------------------------------------
Michael Turner         10   11    1    1   0   4/5    80.0     0/0   0.0
Desmond Antetokounmpo   10    7    2    1   0   3/5    60.0     0/0   0.0
Anthony Durant         10    7    4    1   0   3/4    75.0     0/0   0.0
Cade Morant            10    3    4    4   0   1/2    50.0     0/0   0.0
Blake Harden            2    3    1    0   0   1/2    50.0     0/0   0.0
RJ Young               10    2    0    2   0   1/2    50.0     0/0   0.0
Ben Gilgeous-Alexander    2    0    0    1   0   0/0     0.0     0/0   0.0

TEAM: FG: 13/20 (65.0%), 3PT: 6/7 (85.7%), REB: 12 (1 off, 11 def), AST: 10, TO: 3
TEAM FOULS: 2


Team_008
--------------------------------------------------------------------------------
Player                MIN  PTS  REB  AST  TO      FG   FG%      3P   3P%
--------------------------------------------------------------------------------
Magic Young            10    8    3    1   0   4/5    80.0     0/0   0.0
Victor Leonard         10    4    0    1   0   2/5    40.0     0/0   0.0
Khris Hyland           10    2    0    0   0   1/4    25.0     0/0   0.0
Lamelo Middleton        2    2    0    0   0   1/1   100.0     0/0   0.0
Blake Holiday           2    2    0    1   0   1/2    50.0     0/0   0.0
Tyrese Thompson        10    0    6    0   0   0/2     0.0     0/0   0.0
Jrue Harris            10    0    0    1   0   0/1     0.0     0/0   0.0
Khris Giddey            2    0    1    0   0   0/0     0.0     0/0   0.0
Chris Griffin           2    0    0    1   0   0/0     0.0     0/0   0.0

TEAM: FG: 9/20 (45.0%), 3PT: 1/9 (11.1%), REB: 10 (3 off, 7 def), AST: 5, TO: 3
TEAM FOULS: 3

================================================================================

================================================================================
                       2ND QUARTER - Team_010 vs Team_008                       
================================================================================

[12:00] Team_010 possession (Score: 33-18)
Desmond Antetokounmpo drives and kicks out. Michael Turner attempts a 3Pt. Contested by Jrue Harris (2.8 feet, MAN). Michael Turner misses. Offensive rebound by Cade Morant! Cade Morant kicks it out.

[11:46] Team_010 possession (Score: 33-18)
RJ Young attempts a 3Pt. Contested by Khris Hyland (3.4 feet, MAN). RJ Young misses. Rebound secured by Tyrese Thompson.

[11:26] Team_008 possession (Score: 33-18)
Tyrese Thompson loses control! Ball rolls out of bounds! TURNOVER! (dead ball)

[11:10] Team_010 possession (Score: 33-18)
Desmond Antetokounmpo attempts a 3Pt. Contested by Victor Leonard (3.2 feet, ZONE). Desmond Antetokounmpo misses. Rebound secured by Tyrese Thompson.

[10:51] Team_008 possession (Score: 33-18)
Jrue Harris attempts a 3Pt. Heavily contested by Michael Turner (1.9 feet, MAN)! Jrue Harris misses. Rebound secured by Michael Turner.

[10:39] Team_010 possession (Score: 33-18)
Anthony Durant attempts a Midrange. Contested by Magic Young (4.0 feet, MAN). Anthony Durant misses. FOUL! Loose ball foul on Magic Young during the rebound battle. [Team fouls: 1] No free throws, side out. (Magic Young: 1 personal fouls)

[10:25] Team_010 possession (Score: 33-18)
RJ Young makes the Layup and draws the foul on Tyrese Thompson! And-1! RJ Young to the line for 1. [Team fouls: 2] (Tyrese Thompson: 1 personal fouls)   FT 1/1: GOOD RJ Young makes 1/1 from the line.
Score: 36-18

[10:10] Team_008 possession (Score: 36-18)
Magic Young attempts a 3Pt. Contested by Anthony Durant (5.3 feet, MAN). Magic Young misses. Rebound secured by Michael Turner.

[09:51] Team_010 possession (Score: 36-18)
FOUL! Holding foul on Magic Young. [Team fouls: 3] No free throws, side out. (Magic Young: 2 personal fouls)

[09:35] Team_010 possession (Score: 36-18)
RJ Young attempts a 3Pt. Contested by Jrue Harris (5.9 feet, ZONE). RJ YOUNG MAKES IT!
Score: 39-18

[09:22] Team_008 possession (Score: 39-18)
Jrue Harris makes the Dunk and draws the foul on Anthony Durant! And-1! Jrue Harris to the line for 1. [Team fouls: 1] (Anthony Durant: 1 personal fouls)   FT 1/1: GOOD Jrue Harris makes 1/1 from the line.
Score: 39-21

[09:10] Team_010 possession (Score: 39-21)
RJ Young drives and kicks out. Cade Morant attempts a 3Pt. Wide open! Tyrese Thompson is 6.5 feet away. [ZONE] Cade Morant misses. Offensive rebound by Anthony Durant! Anthony Durant kicks it out.

[08:54] Team_010 possession (Score: 39-21)
Desmond Antetokounmpo drives, picks up Tyrese Thompson. Help arrives from Jrue Harris! Desmond Antetokounmpo attempts a Dunk. Wide open! Jrue Harris is 6.4 feet away. [ZONE] DESMOND ANTETOKOUNMPO MAKES IT! Assist: Michael Turner
Score: 41-21

[08:38] Team_008 possession (Score: 41-21)
Tyrese Thompson attempts a 3Pt. Contested by Desmond Antetokounmpo (4.3 feet, MAN). Tyrese Thompson misses. Rebound secured by Cade Morant.

[08:22] Team_010 possession (Score: 41-21)
RJ Young attempts a 3Pt. Contested by Victor Leonard (5.2 feet, ZONE). RJ Young misses. Rebound secured by Tyrese Thompson.

[08:05] Team_008 possession (Score: 41-21)
Jrue Harris drives and kicks out. Magic Young attempts a 3Pt. Contested by Anthony Durant (3.8 feet, MAN). Magic Young misses. Rebound secured by Anthony Durant.

[07:49] Team_010 possession (Score: 41-21)
Anthony Durant attempts a 3Pt. Contested by Magic Young (4.3 feet, MAN). Anthony Durant misses. Offensive rebound by Cade Morant! Cade Morant kicks it out.

[07:40] Team_010 possession (Score: 41-21)
Anthony Durant attempts a Layup. Contested by Magic Young (5.5 feet, MAN). ANTHONY DURANT MAKES IT! Assist: Cade Morant
Score: 43-21

[07:28] Team_008 possession (Score: 43-21)
Magic Young loses the ball! Stripped by Anthony Durant! TURNOVER! (live ball)

[07:14] Team_010 possession (Score: 43-21)
Desmond Antetokounmpo attempts a 3Pt. Contested by Tyrese Thompson (4.5 feet, MAN). Desmond Antetokounmpo misses. Offensive rebound by Anthony Durant! Anthony Durant kicks it out.

[07:03] Team_010 possession (Score: 43-21)
Michael Turner drives and kicks out. RJ Young attempts a 3Pt. Contested by Victor Leonard (5.9 feet, ZONE). RJ YOUNG MAKES IT! Assist: Anthony Durant
Score: 46-21

[06:51] Team_008 possession (Score: 46-21)
Jrue Harris attempts a 3Pt. Contested by Cade Morant (4.5 feet, ZONE). JRUE HARRIS MAKES IT! Assist: Khris Hyland
Score: 46-24

[06:37] Team_010 possession (Score: 46-24)
Desmond Antetokounmpo attempts a 3Pt. Wide open! Tyrese Thompson is 6.6 feet away. [MAN] Desmond Antetokounmpo misses. Rebound secured by Khris Hyland.

[06:17] Team_008 possession (Score: 46-24)
Magic Young attempts a Midrange. Contested by Anthony Durant (3.2 feet, MAN). Magic Young misses. Offensive rebound by Tyrese Thompson! Tyrese Thompson kicks it out.

[05:59] Team_008 possession (Score: 46-24)
Magic Young throws a bad pass out of bounds! TURNOVER! (dead ball)

[05:59] Substitution (Team_010): Cade Morant OUT → Draymond Leonard IN (stamina_rule2)

[05:59] Substitution (Team_010): Michael Turner OUT → Blake Harden IN (stamina_rule2)

[05:59] Substitution (Team_010): RJ Young OUT → Ben Gilgeous-Alexander IN (stamina_rule2)

[05:59] Substitution (Team_010): Desmond Antetokounmpo OUT → Vince Ingram IN (stamina_rule2)

[05:59] Substitution (Team_010): Anthony Durant OUT → Paolo Wade IN (stamina_rule2)

[05:59] Substitution (Team_008): Victor Leonard OUT → Blake Holiday IN (stamina_rule2)

[05:59] Substitution (Team_008): Jrue Harris OUT → Chris Griffin IN (stamina_rule2)

[05:59] Substitution (Team_008): Khris Hyland OUT → Immanuel Young IN (stamina_rule2)

[05:59] Substitution (Team_008): Tyrese Thompson OUT → Khris Giddey IN (stamina_rule2)

[05:59] Substitution (Team_008): Magic Young OUT → Lamelo Middleton IN (stamina_rule2)

[05:42] Team_010 possession (Score: 46-24)
Blake Harden attempts a Layup. Wide open! Chris Griffin is 6.7 feet away. [MAN] Blake Harden misses. Offensive rebound by Blake Harden! Blake Harden kicks it out.

[05:30] Team_010 possession (Score: 46-24)
Draymond Leonard drives to the basket... Draymond Leonard throws a bad pass! Stolen by Lamelo Middleton! TURNOVER! (live ball)

[05:16] Team_008 possession (Score: 46-24)
Lamelo Middleton attempts a Layup. Wide open! Paolo Wade is 6.2 feet away. [MAN] LAMELO MIDDLETON MAKES IT! Assist: Blake Holiday
Score: 46-26

[05:01] Team_010 possession (Score: 46-26)
Blake Harden attempts a Layup. Heavily contested by Chris Griffin (0.5 feet, MAN)! Blake Harden misses. Rebound secured by Khris Giddey.

[04:48] Team_008 possession (Score: 46-26)
FOUL! Shooting foul on Paolo Wade. Lamelo Middleton to the line for 2 free throws. [Team fouls: 2] (Paolo Wade: 1 personal fouls)   FT 1/2: GOOD   FT 2/2: GOOD Lamelo Middleton makes 2/2 from the line.
Score: 46-28

[04:29] Team_010 possession (Score: 46-28)
FOUL! Holding foul on Khris Giddey. [Team fouls: 4] No free throws, side out. (Khris Giddey: 1 personal fouls)

[04:15] Team_010 possession (Score: 46-28)
Ben Gilgeous-Alexander drives, Lamelo Middleton stays with him. Ben Gilgeous-Alexander attempts a Dunk. Wide open! Lamelo Middleton is 6.2 feet away. [ZONE] BEN GILGEOUS-ALEXANDER MAKES IT!
Score: 48-28

[04:01] Team_008 possession (Score: 48-28)
Chris Griffin attempts a Midrange. Contested by Blake Harden (3.8 feet, ZONE). CHRIS GRIFFIN MAKES IT!
Score: 48-30

[03:52] Team_010 possession (Score: 48-30)
FOUL! Reach-in foul on Lamelo Middleton during the drive. [IN THE BONUS! 5 team fouls] Paolo Wade to the line for 2 free throws. (Lamelo Middleton: 1 personal fouls)   FT 1/2: MISS   FT 2/2: GOOD Paolo Wade makes 1/2 from the line.
Score: 49-30

[03:40] Team_008 possession (Score: 49-30)
Immanuel Young attempts a 3Pt. Contested by Draymond Leonard (3.4 feet, ZONE). IMMANUEL YOUNG MAKES IT!
Score: 49-33

[03:24] Team_010 possession (Score: 49-33)
Paolo Wade drives to the basket... Paolo Wade loses control! Ball rolls out of bounds! TURNOVER! (dead ball)

[03:10] Team_008 possession (Score: 49-33)
Lamelo Middleton makes the Layup and draws the foul on Paolo Wade! And-1! Lamelo Middleton to the line for 1. [Team fouls: 3] (Paolo Wade: 2 personal fouls)   FT 1/1: MISS Lamelo Middleton makes 0/1 from the line. Rebound secured by Paolo Wade.
Score: 49-35

[02:55] Team_010 possession (Score: 49-35)
Draymond Leonard attempts a 3Pt. Wide open! Blake Holiday is 10.0 feet away. [MAN] DRAYMOND LEONARD MAKES IT! Assist: Paolo Wade
Score: 52-35

[02:36] Team_008 possession (Score: 52-35)
Immanuel Young attempts a 3Pt. Contested by Ben Gilgeous-Alexander (5.7 feet, MAN). Immanuel Young misses. Rebound secured by Paolo Wade.

[02:27] Team_010 possession (Score: 52-35)
FOUL! Shooting foul on Khris Giddey. Draymond Leonard to the line for 3 free throws. [BONUS: 6 team fouls] (Khris Giddey: 2 personal fouls)   FT 1/3: GOOD   FT 2/3: GOOD   FT 3/3: GOOD Draymond Leonard makes 3/3 from the line.
Score: 55-35

[02:17] Team_008 possession (Score: 55-35)
FOUL! Reach-in foul on Paolo Wade during the drive. [Team fouls: 4] No free throws, side out. (Paolo Wade: 3 personal fouls)

[02:05] Team_008 possession (Score: 55-35)
FOUL! Reach-in foul on Paolo Wade during the drive. [IN THE BONUS! 5 team fouls] Khris Giddey to the line for 2 free throws. (Paolo Wade: 4 personal fouls)   FT 1/2: GOOD   FT 2/2: GOOD Khris Giddey makes 2/2 from the line.
Score: 55-37

[01:53] Team_010 possession (Score: 55-37)
Draymond Leonard attempts a 3Pt. Wide open! Blake Holiday is 6.2 feet away. [MAN] Draymond Leonard misses. Offensive rebound by Paolo Wade! Paolo Wade kicks it out.

[01:42] Team_010 possession (Score: 55-37)
Ben Gilgeous-Alexander attempts a 3Pt. Wide open! Immanuel Young is 8.0 feet away. [MAN] Ben Gilgeous-Alexander misses. Rebound secured by Khris Giddey.

[01:28] Team_008 possession (Score: 55-37)
FOUL! Holding foul on Blake Harden. [IN THE BONUS! 6 team fouls] Chris Griffin to the line for 2 free throws. (Blake Harden: 1 personal fouls)   FT 1/2: GOOD   FT 2/2: GOOD Chris Griffin makes 2/2 from the line.
Score: 55-39

[01:16] Team_010 possession (Score: 55-39)
Paolo Wade attempts a 3Pt. Contested by Khris Giddey (3.2 feet, ZONE). Paolo Wade misses. FOUL! Loose ball foul on Lamelo Middleton during the rebound battle. [IN THE BONUS! 7 team fouls] Blake Harden to the line for 2 free throws. (Lamelo Middleton: 2 personal fouls)   FT 1/2: GOOD   FT 2/2: GOOD Blake Harden makes 2/2 from the line.
Score: 57-39

[01:06] Team_008 possession (Score: 57-39)
Khris Giddey drives and kicks out. Blake Holiday attempts a 3Pt. Contested by Vince Ingram (3.1 feet, ZONE). Blake Holiday misses. Rebound secured by Paolo Wade.

[00:50] Team_010 possession (Score: 57-39)
Paolo Wade drives and kicks out. Draymond Leonard attempts a 3Pt. Contested by Blake Holiday (3.1 feet, MAN). Draymond Leonard misses. Rebound secured by Lamelo Middleton.

[00:38] Team_008 possession (Score: 57-39)
Chris Griffin attempts a 3Pt. Contested by Blake Harden (5.0 feet, MAN). Chris Griffin misses. Rebound secured by Ben Gilgeous-Alexander.

[00:21] Team_010 possession (Score: 57-39)
Vince Ingram attempts a 3Pt. Contested by Khris Giddey (2.3 feet, ZONE). Vince Ingram misses. Rebound secured by Chris Griffin.

[00:06] Team_008 possession (Score: 57-39)
Immanuel Young attempts a Midrange. Wide open! Draymond Leonard is 7.0 feet away. [ZONE] Immanuel Young misses. Rebound secured by Ben Gilgeous-Alexander.

================================================================================
                              2ND QUARTER COMPLETE                              
================================================================================

2ND QUARTER SCORE: Team_010 24, Team_008 21

BOX SCORE:
================================================================================

Team_010
--------------------------------------------------------------------------------
Player                MIN  PTS  REB  AST  TO      FG   FG%      3P   3P%
--------------------------------------------------------------------------------
RJ Young               17    9    0    0   0   3/5    60.0     0/0   0.0
Draymond Leonard        8    6    0    0   0   2/2   100.0     0/0   0.0
Desmond Antetokounmpo   17    2    0    0   0   1/3    33.3     0/0   0.0
Anthony Durant         17    2    3    1   0   1/1   100.0     0/0   0.0
Blake Harden            8    2    1    0   0   1/2    50.0     0/0   0.0
Ben Gilgeous-Alexander    8    2    2    0   0   1/2    50.0     0/0   0.0
Paolo Wade              8    1    4    1   0   1/2    50.0     0/0   0.0
Cade Morant            17    0    4    1   0   0/0     0.0     0/0   0.0
Michael Turner         17    0    2    1   0   0/0     0.0     0/0   0.0
Vince Ingram            8    0    0    0   0   0/1     0.0     0/0   0.0

TEAM: FG: 10/18 (55.6%), 3PT: 4/10 (40.0%), REB: 16 (7 off, 9 def), AST: 4, TO: 2
TEAM FOULS: 6 [Team_008 in BONUS]


Team_008
--------------------------------------------------------------------------------
Player                MIN  PTS  REB  AST  TO      FG   FG%      3P   3P%
--------------------------------------------------------------------------------
Jrue Harris            17    6    0    0   0   2/4    50.0     0/0   0.0
Lamelo Middleton        8    4    1    0   0   2/3    66.7     0/0   0.0
Chris Griffin           8    4    1    0   0   2/3    66.7     0/0   0.0
Immanuel Young          8    3    0    0   0   1/3    33.3     0/0   0.0
Khris Giddey            8    2    2    0   0   1/2    50.0     0/0   0.0
Tyrese Thompson        17    0    4    0   0   0/1     0.0     0/0   0.0
Magic Young            17    0    0    0   0   0/1     0.0     0/0   0.0
Khris Hyland           17    0    1    1   0   0/0     0.0     0/0   0.0
Blake Holiday           8    0    0    1   0   0/0     0.0     0/0   0.0

TEAM: FG: 8/17 (47.1%), 3PT: 2/7 (28.6%), REB: 9 (1 off, 8 def), AST: 2, TO: 3
TEAM FOULS: 7 [Team_010 in BONUS]

================================================================================

================================================================================
                       3RD QUARTER - Team_010 vs Team_008                       
================================================================================

[12:00] Team_010 possession (Score: 57-39)
Cade Morant attempts a 3Pt. Contested by Victor Leonard (4.5 feet, MAN). CADE MORANT MAKES IT! Assist: Desmond Antetokounmpo
Score: 60-39

[11:46] Team_008 possession (Score: 60-39)
Jrue Harris attempts a Midrange. Contested by Michael Turner (2.8 feet, MAN). JRUE HARRIS MAKES IT! Assist: Victor Leonard
Score: 60-41

[11:28] Team_010 possession (Score: 60-41)
Anthony Durant throws a bad pass! Stolen by Magic Young! TURNOVER! (live ball)

[11:13] Team_008 possession (Score: 60-41)
Jrue Harris attempts a Layup. BLOCKED BY ANTHONY DURANT! Ball goes out off Anthony Durant. Jrue Harris's ball!

[10:54] Team_008 possession (Score: 60-41)
Magic Young drives to the basket... Magic Young loses the ball! Stripped by Anthony Durant! TURNOVER! (live ball)

[10:37] Team_010 possession (Score: 60-41)
Michael Turner attempts a 3Pt. Wide open! Jrue Harris is 8.6 feet away. [MAN] Michael Turner misses. Rebound secured by Magic Young.

[10:26] Team_008 possession (Score: 60-41)
Tyrese Thompson attempts a 3Pt. Contested by RJ Young (5.9 feet, ZONE). Tyrese Thompson misses. Rebound secured by Desmond Antetokounmpo.

[10:10] Team_010 possession (Score: 60-41)
Michael Turner commits a violation (traveling/carry)! TURNOVER! (dead ball)

[09:58] Team_008 possession (Score: 60-41)
Victor Leonard attempts a 3Pt. Wide open! Cade Morant is 6.2 feet away. [MAN] Victor Leonard misses. Rebound secured by Desmond Antetokounmpo.

[09:45] Team_010 possession (Score: 60-41)
FOUL! Shooting foul on Victor Leonard. RJ Young to the line for 3 free throws. [Team fouls: 1] (Victor Leonard: 1 personal fouls)   FT 1/3: GOOD   FT 2/3: GOOD   FT 3/3: GOOD RJ Young makes 3/3 from the line.
Score: 63-41

[09:26] Team_008 possession (Score: 63-41)
Jrue Harris attempts a 3Pt. Contested by Michael Turner (3.5 feet, MAN). JRUE HARRIS MAKES IT! Assist: Victor Leonard
Score: 63-44

[09:10] Team_010 possession (Score: 63-44)
Anthony Durant attempts a Layup. Contested by Magic Young (5.5 feet, MAN). Anthony Durant misses. Rebound secured by Magic Young.

[08:55] Team_008 possession (Score: 63-44)
Magic Young attempts a Layup. BLOCKED BY ANTHONY DURANT! Ball goes out off Anthony Durant. Magic Young's ball!

[08:41] Team_008 possession (Score: 63-44)
FOUL! Holding foul on Michael Turner. [Team fouls: 1] No free throws, side out. (Michael Turner: 1 personal fouls)

[08:31] Team_008 possession (Score: 63-44)
Khris Hyland drives and kicks out. Magic Young attempts a 3Pt. Contested by Cade Morant (5.4 feet, ZONE). Magic Young misses. Offensive rebound by Tyrese Thompson! Tyrese Thompson kicks it out.

[08:15] Team_008 possession (Score: 63-44)
Khris Hyland attempts a 3Pt. Contested by Cade Morant (5.6 feet, ZONE). Khris Hyland misses. Rebound secured by Cade Morant.

[08:04] Team_010 possession (Score: 63-44)
Cade Morant attempts a Layup. Contested by Tyrese Thompson (3.6 feet, ZONE). CADE MORANT MAKES IT! Assist: Desmond Antetokounmpo
Score: 65-44

[07:50] Team_008 possession (Score: 65-44)
Jrue Harris loses the ball! Stripped by Michael Turner! TURNOVER! (live ball)

[07:37] Team_010 possession (Score: 65-44)
FOUL! Reach-in foul on Tyrese Thompson during the drive. [Team fouls: 2] No free throws, side out. (Tyrese Thompson: 1 personal fouls)

[07:21] Team_010 possession (Score: 65-44)
Cade Morant drives and kicks out. Cade Morant attempts a Midrange. Contested by Victor Leonard (5.0 feet, MAN). CADE MORANT MAKES IT! Assist: RJ Young
Score: 67-44

[07:07] Team_008 possession (Score: 67-44)
Tyrese Thompson attempts a 3Pt. Contested by Cade Morant (4.3 feet, ZONE). TYRESE THOMPSON MAKES IT! Assist: Victor Leonard
Score: 67-47

[06:52] Team_010 possession (Score: 67-47)
RJ Young attempts a 3Pt. Contested by Victor Leonard (3.7 feet, ZONE). RJ Young misses. Rebound secured by Magic Young.

[06:42] Team_008 possession (Score: 67-47)
Jrue Harris attempts a 3Pt. Contested by Cade Morant (2.5 feet, ZONE). Jrue Harris misses. Rebound secured by Cade Morant.

[06:26] Team_010 possession (Score: 67-47)
Michael Turner makes the Layup and draws the foul on Tyrese Thompson! And-1! Michael Turner to the line for 1. [Team fouls: 3] (Tyrese Thompson: 2 personal fouls)   FT 1/1: GOOD Michael Turner makes 1/1 from the line.
Score: 70-47

[06:08] Team_008 possession (Score: 70-47)
Magic Young drives and kicks out. Tyrese Thompson attempts a Midrange. Contested by Desmond Antetokounmpo (6.0 feet, MAN). Tyrese Thompson misses. Rebound secured by Anthony Durant.

[05:58] Team_010 possession (Score: 70-47)
RJ Young attempts a Midrange. Wide open! Khris Hyland is 6.0 feet away. [MAN] RJ Young misses. Rebound secured by Magic Young.

[05:46] Team_008 possession (Score: 70-47)
Tyrese Thompson attempts a Midrange. Contested by Desmond Antetokounmpo (5.4 feet, ZONE). Tyrese Thompson misses. Rebound secured by Anthony Durant.

[05:33] Team_010 possession (Score: 70-47)
RJ Young attempts a 3Pt. Contested by Khris Hyland (3.4 feet, MAN). RJ Young misses. Rebound secured by Khris Hyland.

[05:19] Team_008 possession (Score: 70-47)
FOUL! Holding foul on RJ Young. [Team fouls: 2] No free throws, side out. (RJ Young: 1 personal fouls)

[05:09] Team_008 possession (Score: 70-47)
Khris Hyland drives and kicks out. Tyrese Thompson attempts a 3Pt. Contested by Cade Morant (3.5 feet, ZONE). Tyrese Thompson misses. Rebound secured by Cade Morant.

[04:52] Team_010 possession (Score: 70-47)
Michael Turner attempts a 3Pt. Contested by Jrue Harris (4.4 feet, MAN). Michael Turner misses. Offensive rebound by Cade Morant! Cade Morant kicks it out.

[04:35] Team_010 possession (Score: 70-47)
Cade Morant attempts a Midrange. Wide open! Victor Leonard is 6.7 feet away. [MAN] Cade Morant misses. Rebound secured by Magic Young.

[04:21] Team_008 possession (Score: 70-47)
Jrue Harris attempts a 3Pt. Contested by Michael Turner (5.0 feet, MAN). Jrue Harris misses. Offensive rebound by Magic Young! Magic Young puts it back in!
Score: 70-49

[04:05] Team_010 possession (Score: 70-49)
Cade Morant makes the Layup and draws the foul on Jrue Harris! And-1! Cade Morant to the line for 1. [Team fouls: 4] (Jrue Harris: 1 personal fouls)   FT 1/1: GOOD Cade Morant makes 1/1 from the line.
Score: 73-49

[03:53] Team_008 possession (Score: 73-49)
Khris Hyland attempts a Layup. Contested by RJ Young (3.6 feet, MAN). KHRIS HYLAND MAKES IT! Assist: Magic Young
Score: 73-51

[03:41] Team_010 possession (Score: 73-51)
Desmond Antetokounmpo attempts a 3Pt. Wide open! Khris Hyland is 6.1 feet away. [ZONE] DESMOND ANTETOKOUNMPO MAKES IT! Assist: RJ Young
Score: 76-51

[03:28] Team_008 possession (Score: 76-51)
FOUL! Reach-in foul on Anthony Durant during the drive. [Team fouls: 3] No free throws, side out. (Anthony Durant: 1 personal fouls)

[03:11] Team_008 possession (Score: 76-51)
Tyrese Thompson attempts a 3Pt. Heavily contested by Cade Morant (1.4 feet, ZONE)! Tyrese Thompson misses. Rebound secured by Anthony Durant.

[02:56] Team_010 possession (Score: 76-51)
Michael Turner attempts a 3Pt. Wide open! Victor Leonard is 6.7 feet away. [ZONE] MICHAEL TURNER MAKES IT! Assist: Anthony Durant
Score: 79-51

[02:44] Team_008 possession (Score: 79-51)
Magic Young attempts a 3Pt. Contested by Anthony Durant (5.0 feet, MAN). Magic Young misses. Rebound secured by Michael Turner.

[02:29] Team_010 possession (Score: 79-51)
Michael Turner attempts a Midrange. Contested by Jrue Harris (5.7 feet, MAN). Michael Turner misses. Rebound secured by Tyrese Thompson.

[02:10] Team_008 possession (Score: 79-51)
Victor Leonard attempts a Layup. BLOCKED BY DESMOND ANTETOKOUNMPO! Ball deflects out of bounds off Victor Leonard.

[01:52] Team_010 possession (Score: 79-51)
RJ Young attempts a 3Pt. Wide open! Victor Leonard is 6.9 feet away. [ZONE] RJ Young misses. Rebound secured by Tyrese Thompson.

[01:42] Team_008 possession (Score: 79-51)
Khris Hyland attempts a 3Pt. Wide open! RJ Young is 6.9 feet away. [ZONE] KHRIS HYLAND MAKES IT!
Score: 79-54

[01:29] Team_010 possession (Score: 79-54)
Desmond Antetokounmpo attempts a 3Pt. Wide open! Tyrese Thompson is 6.3 feet away. [ZONE] Desmond Antetokounmpo misses. Rebound secured by Tyrese Thompson.

[01:19] Team_008 possession (Score: 79-54)
FOUL! Reach-in foul on Anthony Durant during the drive. [Team fouls: 4] No free throws, side out. (Anthony Durant: 2 personal fouls)

[01:06] Team_008 possession (Score: 79-54)
Tyrese Thompson attempts a 3Pt. Wide open! Cade Morant is 8.1 feet away. [ZONE] Tyrese Thompson misses. FOUL! Loose ball foul on Anthony Durant during the rebound battle. [IN THE BONUS! 5 team fouls] Magic Young to the line for 2 free throws. (Anthony Durant: 3 personal fouls)   FT 1/2: GOOD   FT 2/2: MISS Magic Young makes 1/2 from the line. Rebound secured by Michael Turner.
Score: 79-55

[00:51] Team_010 possession (Score: 79-55)
Michael Turner commits a violation (traveling/carry)! TURNOVER! (dead ball)

[00:51] Substitution (Team_010): Cade Morant OUT → Draymond Leonard IN (stamina_rule2)

[00:51] Substitution (Team_010): Michael Turner OUT → Blake Harden IN (stamina_rule2)

[00:51] Substitution (Team_010): RJ Young OUT → Ben Gilgeous-Alexander IN (stamina_rule2)

[00:51] Substitution (Team_010): Desmond Antetokounmpo OUT → Vince Ingram IN (stamina_rule2)

[00:51] Substitution (Team_010): Anthony Durant OUT → Paolo Wade IN (stamina_rule2)

[00:51] Substitution (Team_008): Victor Leonard OUT → Blake Holiday IN (stamina_rule2)

[00:51] Substitution (Team_008): Jrue Harris OUT → Chris Griffin IN (stamina_rule2)

[00:51] Substitution (Team_008): Khris Hyland OUT → Immanuel Young IN (stamina_rule2)

[00:51] Substitution (Team_008): Tyrese Thompson OUT → Khris Giddey IN (stamina_rule2)

[00:51] Substitution (Team_008): Magic Young OUT → Lamelo Middleton IN (stamina_rule2)

[00:39] Team_008 possession (Score: 79-55)
Lamelo Middleton drives, Paolo Wade stays with him. Lamelo Middleton attempts a Dunk. Heavily contested by Paolo Wade (1.4 feet, MAN)! LAMELO MIDDLETON MAKES IT! Assist: Chris Griffin
Score: 79-57

[00:21] Team_010 possession (Score: 79-57)
Ben Gilgeous-Alexander attempts a 3Pt. Wide open! Immanuel Young is 6.2 feet away. [MAN] Ben Gilgeous-Alexander misses. FOUL! Loose ball foul on Chris Griffin during the rebound battle. [IN THE BONUS! 5 team fouls] Paolo Wade to the line for 2 free throws. (Chris Griffin: 1 personal fouls)   FT 1/2: MISS   FT 2/2: GOOD Paolo Wade makes 1/2 from the line.
Score: 80-57

[00:07] Team_008 possession (Score: 80-57)
Khris Giddey attempts a Midrange. Wide open! Vince Ingram is 7.8 feet away. [MAN] KHRIS GIDDEY MAKES IT! Assist: Lamelo Middleton
Score: 80-59

================================================================================
                              3RD QUARTER COMPLETE                              
================================================================================

3RD QUARTER SCORE: Team_010 23, Team_008 20

BOX SCORE:
================================================================================

Team_010
--------------------------------------------------------------------------------
Player                MIN  PTS  REB  AST  TO      FG   FG%      3P   3P%
--------------------------------------------------------------------------------
Cade Morant            28   10    4    0   0   4/5    80.0     0/0   0.0
Desmond Antetokounmpo   28    3    2    2   0   1/2    50.0     0/0   0.0
RJ Young               28    3    0    2   0   1/5    20.0     0/0   0.0
Paolo Wade              8    1    0    0   0   1/1   100.0     0/0   0.0
Anthony Durant         28    0    3    1   0   0/1     0.0     0/0   0.0

TEAM: FG: 9/18 (50.0%), 3PT: 5/10 (50.0%), REB: 10 (1 off, 9 def), AST: 5, TO: 3
TEAM FOULS: 5 [Team_008 in BONUS]


Team_008
--------------------------------------------------------------------------------
Player                MIN  PTS  REB  AST  TO      FG   FG%      3P   3P%
--------------------------------------------------------------------------------
Michael Turner         28    6    2    0   0   2/4    50.0     0/0   0.0
Jrue Harris            28    5    0    0   0   2/3    66.7     0/0   0.0
Khris Hyland           28    5    1    0   0   2/4    50.0     0/0   0.0
Tyrese Thompson        28    3    4    0   0   1/5    20.0     0/0   0.0
Magic Young            28    2    6    1   0   1/3    33.3     0/0   0.0
Lamelo Middleton        8    2    0    1   0   1/1   100.0     0/0   0.0
Khris Giddey            8    2    0    0   0   1/1   100.0     0/0   0.0
Victor Leonard         28    0    0    3   0   0/2     0.0     0/0   0.0
Chris Griffin           8    0    0    1   0   0/0     0.0     0/0   0.0

TEAM: FG: 8/19 (42.1%), 3PT: 4/11 (36.4%), REB: 12 (3 off, 9 def), AST: 6, TO: 2
TEAM FOULS: 5 [Team_010 in BONUS]

================================================================================

================================================================================
                       4TH QUARTER - Team_010 vs Team_008                       
================================================================================

[12:00] Team_010 possession (Score: 80-59)
FOUL! Shooting foul on Khris Hyland. RJ Young to the line for 2 free throws. [Team fouls: 1] (Khris Hyland: 1 personal fouls)   FT 1/2: MISS   FT 2/2: GOOD RJ Young makes 1/2 from the line.
Score: 81-59

[11:43] Team_008 possession (Score: 81-59)
Khris Hyland drives to the basket... Khris Hyland loses the ball! Stripped by Anthony Durant! TURNOVER! (live ball)

[11:31] Team_010 possession (Score: 81-59)
Michael Turner attempts a Layup. BLOCKED BY JRUE HARRIS! Ball deflects out of bounds off Michael Turner.

[11:17] Team_008 possession (Score: 81-59)
Tyrese Thompson attempts a 3Pt. Contested by Cade Morant (5.7 feet, ZONE). Tyrese Thompson misses. Rebound secured by Cade Morant.

[11:03] Team_010 possession (Score: 81-59)
Cade Morant attempts a Midrange. Heavily contested by Jrue Harris (1.6 feet, ZONE)! Cade Morant misses. Offensive rebound by Anthony Durant! Anthony Durant kicks it out.

[10:49] Team_010 possession (Score: 81-59)
Desmond Antetokounmpo attempts a 3Pt. Contested by Victor Leonard (4.6 feet, ZONE). DESMOND ANTETOKOUNMPO MAKES IT! Assist: Michael Turner
Score: 84-59

[10:36] Team_008 possession (Score: 84-59)
Victor Leonard attempts a Midrange. BLOCKED BY CADE MORANT! Ball is loose! Rebound secured by Anthony Durant.

[10:21] Team_010 possession (Score: 84-59)
Anthony Durant makes the Layup and draws the foul on Magic Young! And-1! Anthony Durant to the line for 1. [Team fouls: 2] (Magic Young: 1 personal fouls)   FT 1/1: GOOD Anthony Durant makes 1/1 from the line.
Score: 87-59

[10:07] Team_008 possession (Score: 87-59)
FOUL! Shooting foul on Cade Morant. Tyrese Thompson to the line for 3 free throws. [Team fouls: 1] (Cade Morant: 1 personal fouls)   FT 1/3: MISS   FT 2/3: MISS   FT 3/3: GOOD Tyrese Thompson makes 1/3 from the line.
Score: 87-60

[09:53] Team_010 possession (Score: 87-60)
FOUL! Offensive foul on Anthony Durant! Magic Young drew the charge! [Team fouls: 2] (Anthony Durant: 1 personal fouls) TURNOVER! (dead ball)

[09:40] Team_008 possession (Score: 87-60)
Tyrese Thompson attempts a 3Pt. Contested by Desmond Antetokounmpo (3.5 feet, MAN). Tyrese Thompson misses. Rebound secured by Cade Morant.

[09:22] Team_010 possession (Score: 87-60)
Anthony Durant drives and kicks out. RJ Young attempts a Midrange. Contested by Jrue Harris (5.6 feet, ZONE). RJ Young misses. Rebound secured by Magic Young.

[09:05] Team_008 possession (Score: 87-60)
Tyrese Thompson attempts a Midrange. Contested by Desmond Antetokounmpo (5.0 feet, ZONE). Tyrese Thompson misses. FOUL! Loose ball foul on Michael Turner during the rebound battle. [Team fouls: 3] No free throws, side out. (Michael Turner: 1 personal fouls)

[08:52] Team_008 possession (Score: 87-60)
Jrue Harris attempts a 3Pt. Contested by Michael Turner (3.7 feet, MAN). Jrue Harris misses. Offensive rebound by Tyrese Thompson! Tyrese Thompson kicks it out.

[08:40] Team_008 possession (Score: 87-60)
Jrue Harris attempts a 3Pt. Wide open! Michael Turner is 6.5 feet away. [MAN] JRUE HARRIS MAKES IT! Assist: Khris Hyland
Score: 87-63

[08:22] Team_010 possession (Score: 87-63)
Cade Morant attempts a 3Pt. Wide open! Victor Leonard is 7.5 feet away. [ZONE] CADE MORANT MAKES IT! Assist: Anthony Durant
Score: 90-63

[08:06] Team_008 possession (Score: 90-63)
Magic Young attempts a 3Pt. Heavily contested by Anthony Durant (1.9 feet, MAN)! Magic Young misses. Rebound secured by Cade Morant.

[07:53] Team_010 possession (Score: 90-63)
Michael Turner attempts a 3Pt. Contested by Victor Leonard (5.0 feet, ZONE). Michael Turner misses. Rebound secured by Magic Young.

[07:35] Team_008 possession (Score: 90-63)
Jrue Harris throws a bad pass! Stolen by Michael Turner! TURNOVER! (live ball)

[07:23] Team_010 possession (Score: 90-63)
Cade Morant drives and kicks out. Desmond Antetokounmpo attempts a Midrange. BLOCKED BY KHRIS HYLAND! Ball is loose! Rebound secured by Khris Hyland.

[07:08] Team_008 possession (Score: 90-63)
Khris Hyland attempts a Midrange. Contested by Desmond Antetokounmpo (5.1 feet, ZONE). Khris Hyland misses. Rebound secured by Michael Turner.

[06:56] Team_010 possession (Score: 90-63)
Cade Morant attempts a 3Pt. Wide open! Victor Leonard is 6.5 feet away. [MAN] CADE MORANT MAKES IT!
Score: 93-63

[06:37] Team_008 possession (Score: 93-63)
FOUL! Holding foul on Michael Turner. [Team fouls: 4] No free throws, side out. (Michael Turner: 2 personal fouls)

[06:25] Team_008 possession (Score: 93-63)
Khris Hyland drives, picks up Anthony Durant. Help arrives from Cade Morant! Khris Hyland attempts a Dunk. Contested by Cade Morant (2.2 feet, ZONE). Khris Hyland misses. Rebound secured by Anthony Durant.

[06:14] Team_010 possession (Score: 93-63)
Desmond Antetokounmpo attempts a 3Pt. Wide open! Victor Leonard is 6.5 feet away. [ZONE] Desmond Antetokounmpo misses. Rebound secured by Tyrese Thompson.

[06:01] Team_008 possession (Score: 93-63)
Tyrese Thompson attempts a 3Pt. Wide open! Desmond Antetokounmpo is 6.6 feet away. [MAN] Tyrese Thompson misses. Rebound secured by Michael Turner.

[05:45] Team_010 possession (Score: 93-63)
Cade Morant attempts a 3Pt. Contested by Victor Leonard (4.6 feet, MAN). CADE MORANT MAKES IT!
Score: 96-63

[05:31] Team_008 possession (Score: 96-63)
Victor Leonard attempts a 3Pt. Contested by Michael Turner (5.6 feet, ZONE). Victor Leonard misses. Offensive rebound by Tyrese Thompson! Tyrese Thompson kicks it out.

[05:18] Team_008 possession (Score: 96-63)
Jrue Harris attempts a 3Pt. Contested by Cade Morant (4.4 feet, ZONE). Jrue Harris misses. Offensive rebound by Khris Hyland! Khris Hyland kicks it out.

[05:00] Team_008 possession (Score: 96-63)
Jrue Harris attempts a 3Pt. Contested by Michael Turner (5.5 feet, MAN). JRUE HARRIS MAKES IT! Assist: Victor Leonard
Score: 96-66

[04:45] Team_010 possession (Score: 96-66)
Cade Morant attempts a 3Pt. Contested by Jrue Harris (4.4 feet, ZONE). Cade Morant misses. Offensive rebound by Cade Morant! Cade Morant kicks it out.

[04:30] Team_010 possession (Score: 96-66)
Michael Turner drives, Tyrese Thompson stays with him. Michael Turner attempts a Layup. Heavily contested by Tyrese Thompson (0.8 feet, ZONE)! MICHAEL TURNER MAKES IT! Assist: RJ Young
Score: 98-66

[04:15] Team_008 possession (Score: 98-66)
Magic Young drives, picks up Anthony Durant. Help arrives from Cade Morant! Magic Young attempts a Dunk. Wide open! Cade Morant is 7.0 feet away. [ZONE] MAGIC YOUNG MAKES IT!
Score: 98-68

[04:04] Team_010 possession (Score: 98-68)
Cade Morant drives and kicks out. Anthony Durant attempts a 3Pt. Wide open! Victor Leonard is 9.4 feet away. [ZONE] Anthony Durant misses. Rebound secured by Magic Young.

[03:52] Team_008 possession (Score: 98-68)
Jrue Harris drives and kicks out. FOUL! Shooting foul on Michael Turner. Jrue Harris to the line for 2 free throws. [BONUS: 5 team fouls] (Michael Turner: 3 personal fouls)   FT 1/2: GOOD   FT 2/2: GOOD Jrue Harris makes 2/2 from the line.
Score: 98-70

[03:41] Team_010 possession (Score: 98-70)
FOUL! Holding foul on Jrue Harris. [Team fouls: 3] No free throws, side out. (Jrue Harris: 1 personal fouls)

[03:30] Team_010 possession (Score: 98-70)
FOUL! Reach-in foul on Victor Leonard during the drive. [Team fouls: 4] No free throws, side out. (Victor Leonard: 1 personal fouls)

[03:12] Team_010 possession (Score: 98-70)
Desmond Antetokounmpo drives, Tyrese Thompson stays with him. Desmond Antetokounmpo attempts a Layup. Contested by Tyrese Thompson (2.8 feet, ZONE). DESMOND ANTETOKOUNMPO MAKES IT!
Score: 100-70

[02:58] Team_008 possession (Score: 100-70)
Khris Hyland drives to the basket... FOUL! Offensive foul on Khris Hyland! Anthony Durant drew the charge! [Team fouls: 5] (Khris Hyland: 2 personal fouls) TURNOVER! (dead ball)

[02:45] Team_010 possession (Score: 100-70)
Desmond Antetokounmpo drives and kicks out. Anthony Durant attempts a Midrange. Wide open! Magic Young is 6.9 feet away. [MAN] ANTHONY DURANT MAKES IT!
Score: 102-70

[02:30] Team_008 possession (Score: 102-70)
Tyrese Thompson attempts a Midrange. Heavily contested by RJ Young (0.5 feet, ZONE)! Tyrese Thompson misses. Offensive rebound by Tyrese Thompson! Tyrese Thompson kicks it out.

[02:17] Team_008 possession (Score: 102-70)
Jrue Harris attempts a 3Pt. Wide open! Cade Morant is 8.4 feet away. [ZONE] Jrue Harris misses. Rebound secured by Michael Turner.

[02:04] Team_010 possession (Score: 102-70)
FOUL! Reach-in foul on Magic Young during the drive. [IN THE BONUS! 6 team fouls] Anthony Durant to the line for 2 free throws. (Magic Young: 2 personal fouls)   FT 1/2: GOOD   FT 2/2: GOOD Anthony Durant makes 2/2 from the line.
Score: 104-70

[01:54] Team_008 possession (Score: 104-70)
Tyrese Thompson attempts a Layup. Contested by Desmond Antetokounmpo (5.4 feet, MAN). Tyrese Thompson misses. Rebound secured by Cade Morant.

[01:40] Team_010 possession (Score: 104-70)
RJ Young attempts a 3Pt. Heavily contested by Khris Hyland (0.5 feet, MAN)! RJ Young misses. Rebound secured by Magic Young.

[01:26] Team_008 possession (Score: 104-70)
Magic Young attempts a Midrange. Contested by Anthony Durant (5.5 feet, ZONE). Magic Young misses. Rebound secured by Cade Morant.

[01:16] Team_010 possession (Score: 104-70)
Desmond Antetokounmpo drives and kicks out. Cade Morant attempts a 3Pt. Wide open! Victor Leonard is 7.2 feet away. [MAN] Cade Morant misses. Rebound secured by Magic Young.

[01:03] Team_008 possession (Score: 104-70)
Khris Hyland attempts a Midrange. Contested by Desmond Antetokounmpo (4.4 feet, ZONE). KHRIS HYLAND MAKES IT! Assist: Jrue Harris
Score: 104-72

[00:52] Team_010 possession (Score: 104-72)
Cade Morant attempts a 3Pt. Wide open! Victor Leonard is 8.1 feet away. [MAN] CADE MORANT MAKES IT! Assist: RJ Young
Score: 107-72

[00:35] Team_008 possession (Score: 107-72)
Jrue Harris attempts a Midrange. Wide open! Michael Turner is 9.0 feet away. [MAN] JRUE HARRIS MAKES IT!
Score: 107-74

[00:18] Team_010 possession (Score: 107-74)
Cade Morant attempts a Midrange. Wide open! Victor Leonard is 7.2 feet away. [MAN] CADE MORANT MAKES IT! Assist: Michael Turner
Score: 109-74

[00:01] Team_008 possession (Score: 109-74)
Khris Hyland attempts a Layup. Contested by RJ Young (3.4 feet, MAN). KHRIS HYLAND MAKES IT!
Score: 109-76

================================================================================
                              4TH QUARTER COMPLETE                              
================================================================================

4TH QUARTER SCORE: Team_010 29, Team_008 17

BOX SCORE:
================================================================================

Team_010
--------------------------------------------------------------------------------
Player                MIN  PTS  REB  AST  TO      FG   FG%      3P   3P%
--------------------------------------------------------------------------------
Cade Morant            40   14    6    0   0   5/7    71.4     0/0   0.0
Anthony Durant         40    7    3    1   0   3/4    75.0     0/0   0.0
Desmond Antetokounmpo   40    5    0    0   0   2/4    50.0     0/0   0.0
Michael Turner         40    2    3    2   0   1/3    33.3     0/0   0.0
RJ Young               40    1    0    2   0   1/2    50.0     0/0   0.0

TEAM: FG: 12/20 (60.0%), 3PT: 5/8 (62.5%), REB: 12 (2 off, 10 def), AST: 5, TO: 1
TEAM FOULS: 5 [Team_008 in BONUS]


Team_008
--------------------------------------------------------------------------------
Player                MIN  PTS  REB  AST  TO      FG   FG%      3P   3P%
--------------------------------------------------------------------------------
Jrue Harris            40   10    0    1   0   4/5    80.0     0/0   0.0
Khris Hyland           40    4    2    1   0   2/4    50.0     0/0   0.0
Magic Young            40    2    6    0   0   1/3    33.3     0/0   0.0
Tyrese Thompson        40    1    4    0   0   1/5    20.0     0/0   0.0
Victor Leonard         40    0    0    1   0   0/1     0.0     0/0   0.0

TEAM: FG: 8/18 (44.4%), 3PT: 3/8 (37.5%), REB: 12 (5 off, 7 def), AST: 3, TO: 3
TEAM FOULS: 6 [Team_010 in BONUS]

================================================================================

================================================================================
                               FULL GAME COMPLETE                               
================================================================================

FINAL SCORE: Team_010 109, Team_008 76

SCORING BY QUARTER:
--------------------------------------------------------------------------------
Team                     Q1     Q2     Q3     Q4    FINAL
--------------------------------------------------------------------------------
Team_010                 33     24     23     29      109
Team_008                 18     21     20     17       76
--------------------------------------------------------------------------------

FULL GAME BOX SCORE:
================================================================================

Team_010
--------------------------------------------------------------------------------
Player                MIN  PTS  REB  AST  TO      FG   FG%      3P   3P%      FT STL BLK
--------------------------------------------------------------------------------
Cade Morant            40   27   18    5   0  10/14   71.4   6/6   100.0   1/1     0   2
Michael Turner         40   19    8    4   2   8/13   61.5   4/6    66.7   1/1     2   0
RJ Young               40   15    0    6   0   5/13   38.5   2/9    22.2   5/6     1   0
Desmond Antetokounmpo   40   17    4    3   2   8/15   53.3   3/7    42.9   0/0     0   1
Anthony Durant         40   16   13    4   2   6/9    66.7   0/0     0.0   4/4     3   2
Draymond Leonard        8    6    0    0   2   2/2   100.0   2/2   100.0   3/3     0   0
Blake Harden            8    5    2    0   0   1/3    33.3   1/1   100.0   2/2     0   0
Ben Gilgeous-Alexander    8    2    2    1   0   2/3    66.7   1/2    50.0   0/0     0   0
Vince Ingram            8    0    0    0   1   0/1     0.0   0/1     0.0   0/0     0   0
Paolo Wade              8    2    4    1   0   2/3    66.7   1/1   100.0   2/4     0   0

TEAM: FG: 44/76 (57.9%), 3PT: 20/35 (57.1%), REB: 50 (11 off, 39 def), AST: 24, TO: 9


Team_008
--------------------------------------------------------------------------------
Player                MIN  PTS  REB  AST  TO      FG   FG%      3P   3P%      FT STL BLK
--------------------------------------------------------------------------------
Victor Leonard         40    4    0    5   0   2/8    25.0   0/3     0.0   0/0     0   0
Jrue Harris            40   21    0    2   3   9/14   64.3   5/8    62.5   3/3     0   1
Khris Hyland           40   11    4    2   3   5/12   41.7   1/5    20.0   0/0     0   1
Tyrese Thompson        40    4   18    0   1   3/14   21.4   2/11   18.2   1/3     0   2
Magic Young            40   12   15    2   3   4/10   40.0   1/4    25.0   1/2     1   0
Blake Holiday           8    2    0    2   0   1/2    50.0   0/1     0.0   0/0     0   0
Chris Griffin           8    4    1    2   0   1/2    50.0   0/1     0.0   2/2     0   0
Immanuel Young          8    3    0    0   1   1/3    33.3   1/2    50.0   0/0     0   0
Khris Giddey            8    4    3    0   0   2/3    66.7   0/0     0.0   2/2     0   0
Lamelo Middleton        8    8    1    1   0   4/5    80.0   0/0     0.0   2/3     1   0

TEAM: FG: 33/74 (44.6%), 3PT: 10/35 (28.6%), REB: 43 (12 off, 31 def), AST: 16, TO: 11

================================================================================
