================================================================================
                        FULL GAME - Team_059 vs Team_031                        
================================================================================

================================================================================
                       1ST QUARTER - Team_059 vs Team_031                       
================================================================================

[12:00] Team_059 possession (Score: 0-0)
FOUL! Offensive foul on John Iverson! Pau Irving drew the charge! [Team fouls: 1] (John Iverson: 1 personal fouls) TURNOVER! (dead ball)

[11:47] Team_031 possession (Score: 0-0)
Gary Morant attempts a 3Pt. Contested by Bam Wade (5.4 feet, ZONE). GARY MORANT MAKES IT! Assist: Immanuel James
Score: 0-3

[11:28] Team_059 possession (Score: 0-3)
Bam Wade attempts a Layup. Heavily contested by Shai Durant (1.6 feet, MAN)! BAM WADE MAKES IT! Assist: Blake Tatum
Score: 2-3

[11:09] Team_031 possession (Score: 2-3)
Luka Sabonis drives and kicks out. Gary Morant attempts a Midrange. Heavily contested by Blake Tatum (0.9 feet, MAN)! GARY MORANT MAKES IT!
Score: 2-5

[10:54] Team_059 possession (Score: 2-5)
John Iverson attempts a Layup. Contested by Pau Irving (2.0 feet, MAN). JOHN IVERSON MAKES IT! Assist: Nikola Jokic
Score: 4-5

[10:38] Team_031 possession (Score: 4-5)
Gary Morant commits a violation (traveling/carry)! TURNOVER! (dead ball)

[10:25] Team_059 possession (Score: 4-5)
Nikola Jokic attempts a Layup. Heavily contested by Immanuel James (1.4 feet, ZONE)! NIKOLA JOKIC MAKES IT! Assist: Bam Wade
Score: 6-5

[10:09] Team_031 possession (Score: 6-5)
Shai Durant attempts a 3Pt. Contested by Bam Wade (2.4 feet, MAN). Shai Durant misses. FOUL! Loose ball foul on Bam Wade during the rebound battle. [Team fouls: 2] No free throws, side out. (Bam Wade: 1 personal fouls)

[09:56] Team_031 possession (Score: 6-5)
Shai Durant attempts a 3Pt. Contested by Bam Wade (3.7 feet, ZONE). Shai Durant misses. Rebound secured by John Iverson.

[09:41] Team_059 possession (Score: 6-5)
Blake Tatum attempts a 3Pt. Heavily contested by Gary Morant (1.7 feet, MAN)! Blake Tatum misses. Offensive rebound by John Iverson! John Iverson kicks it out.

[09:24] Team_059 possession (Score: 6-5)
FOUL! Holding foul on Luka Sabonis. [Team fouls: 1] No free throws, side out. (Luka Sabonis: 1 personal fouls)

[09:08] Team_059 possession (Score: 6-5)
FOUL! Shooting foul on Shai Durant. Bam Wade to the line for 2 free throws. [Team fouls: 2] (Shai Durant: 1 personal fouls)   FT 1/2: GOOD   FT 2/2: GOOD Bam Wade makes 2/2 from the line.
Score: 8-5

[08:54] Team_031 possession (Score: 8-5)
Immanuel James attempts a Midrange. Contested by Nikola Jokic (5.0 feet, MAN). Immanuel James misses. Rebound secured by Bam Wade.

[08:39] Team_059 possession (Score: 8-5)
Jarrett Smith drives, Luka Sabonis stays with him. Jarrett Smith attempts a Dunk. Heavily contested by Luka Sabonis (0.5 feet, MAN)! JARRETT SMITH MAKES IT! Assist: Nikola Jokic
Score: 10-5

[08:25] Team_031 possession (Score: 10-5)
Pau Irving attempts a 3Pt. Wide open! Bam Wade is 6.5 feet away. [ZONE] PAU IRVING MAKES IT!
Score: 10-8

[08:09] Team_059 possession (Score: 10-8)
Jarrett Smith attempts a Midrange. Heavily contested by Luka Sabonis (1.4 feet, MAN)! JARRETT SMITH MAKES IT! Assist: Nikola Jokic
Score: 12-8

[07:51] Team_031 possession (Score: 12-8)
Immanuel James drives, picks up Jarrett Smith. Help arrives from Bam Wade! Immanuel James attempts a Layup. Heavily contested by Bam Wade (1.6 feet, ZONE)! IMMANUEL JAMES MAKES IT! Assist: Pau Irving
Score: 12-10

[07:34] Team_059 possession (Score: 12-10)
Jarrett Smith drives to the basket... Jarrett Smith loses the ball! Stripped by Luka Sabonis! TURNOVER! (live ball)

[07:19] Team_031 possession (Score: 12-10)
Gary Morant attempts a 3Pt. Contested by Blake Tatum (3.3 feet, MAN). Gary Morant misses. Rebound secured by John Iverson.

[07:06] Team_059 possession (Score: 12-10)
Blake Tatum attempts a 3Pt. Heavily contested by Pau Irving (1.3 feet, ZONE)! Blake Tatum misses. Rebound secured by Gary Morant.

[06:52] Team_031 possession (Score: 12-10)
Luka Sabonis drives and kicks out. Immanuel James attempts a 3Pt. Contested by Bam Wade (3.0 feet, ZONE). Immanuel James misses. Rebound secured by Bam Wade.

[06:41] Team_059 possession (Score: 12-10)
Nikola Jokic attempts a Layup. BLOCKED BY LUKA SABONIS! Ball is loose! Rebound secured by Immanuel James.

[06:27] Team_031 possession (Score: 12-10)
Gary Morant attempts a 3Pt. Wide open! Blake Tatum is 6.4 feet away. [MAN] Gary Morant misses. Rebound secured by John Iverson.

[06:14] Team_059 possession (Score: 12-10)
FOUL! Shooting foul on Pau Irving. Bam Wade to the line for 3 free throws. [Team fouls: 3] (Pau Irving: 1 personal fouls)   FT 1/3: GOOD   FT 2/3: GOOD   FT 3/3: GOOD Bam Wade makes 3/3 from the line.
Score: 15-10

[06:03] Team_031 possession (Score: 15-10)
Gary Morant attempts a Layup. Wide open! Blake Tatum is 8.4 feet away. [MAN] GARY MORANT MAKES IT! Assist: Pau Irving
Score: 15-12

[05:50] Team_059 possession (Score: 15-12)
John Iverson attempts a 3Pt. Contested by Pau Irving (4.5 feet, MAN). John Iverson misses. Rebound secured by Luka Sabonis.

[05:37] Team_031 possession (Score: 15-12)
Immanuel James attempts a 3Pt. Contested by Bam Wade (2.9 feet, ZONE). Immanuel James misses. Rebound secured by Bam Wade.

[05:25] Team_059 possession (Score: 15-12)
Bam Wade throws a bad pass out of bounds! TURNOVER! (dead ball)

[05:09] Team_031 possession (Score: 15-12)
Shai Durant attempts a 3Pt. Contested by Bam Wade (4.3 feet, MAN). Shai Durant misses. Rebound secured by Jarrett Smith.

[04:52] Team_059 possession (Score: 15-12)
Nikola Jokic drives and kicks out. Bam Wade makes the Midrange and draws the foul on Pau Irving! And-1! Bam Wade to the line for 1. [Team fouls: 4] (Pau Irving: 2 personal fouls)   FT 1/1: GOOD Bam Wade makes 1/1 from the line.
Score: 18-12

[04:37] Team_031 possession (Score: 18-12)
Gary Morant attempts a Layup. Contested by Blake Tatum (2.4 feet, MAN). Gary Morant misses. FOUL! Loose ball foul on John Iverson during the rebound battle. [Team fouls: 3] No free throws, side out. (John Iverson: 2 personal fouls)

[04:21] Team_031 possession (Score: 18-12)
Luka Sabonis attempts a Dunk. BLOCKED BY JARRETT SMITH! Ball is loose! Offensive rebound by Luka Sabonis! Luka Sabonis kicks it out.

[04:07] Team_031 possession (Score: 18-12)
Luka Sabonis drives to the basket... Luka Sabonis throws a bad pass! Stolen by Jarrett Smith! TURNOVER! (live ball)

[03:50] Team_059 possession (Score: 18-12)
Nikola Jokic makes the Layup and draws the foul on Immanuel James! And-1! Nikola Jokic to the line for 1. [BONUS: 5 team fouls] (Immanuel James: 1 personal fouls)   FT 1/1: GOOD Nikola Jokic makes 1/1 from the line.
Score: 21-12

[03:36] Team_031 possession (Score: 21-12)
Pau Irving makes the Layup and draws the foul on Jarrett Smith! And-1! Pau Irving to the line for 1. [Team fouls: 4] (Jarrett Smith: 1 personal fouls)   FT 1/1: MISS Pau Irving makes 0/1 from the line. Rebound secured by John Iverson.
Score: 21-14

[03:23] Team_059 possession (Score: 21-14)
John Iverson attempts a Layup. BLOCKED BY PAU IRVING! Ball is loose! Rebound secured by Gary Morant.

[03:05] Team_031 possession (Score: 21-14)
Gary Morant drives to the basket... FOUL! Offensive foul on Gary Morant! Blake Tatum drew the charge! [Team fouls: 6] (Gary Morant: 1 personal fouls) TURNOVER! (dead ball)

[02:54] Team_059 possession (Score: 21-14)
Jarrett Smith drives, Immanuel James stays with him. Jarrett Smith attempts a Dunk. Heavily contested by Immanuel James (1.2 feet, ZONE)! JARRETT SMITH MAKES IT!
Score: 23-14

[02:38] Team_031 possession (Score: 23-14)
Shai Durant attempts a 3Pt. Wide open! Bam Wade is 6.2 feet away. [MAN] Shai Durant misses. Rebound secured by Bam Wade.

[02:19] Team_059 possession (Score: 23-14)
Bam Wade attempts a 3Pt. Contested by Shai Durant (4.9 feet, MAN). Bam Wade misses. Rebound secured by Luka Sabonis.

[02:01] Team_031 possession (Score: 23-14)
Immanuel James drives, Nikola Jokic stays with him. Immanuel James attempts a Layup. Contested by Nikola Jokic (5.8 feet, MAN). IMMANUEL JAMES MAKES IT!
Score: 23-16

[01:48] Team_059 possession (Score: 23-16)
FOUL! Shooting foul on Pau Irving. Bam Wade to the line for 3 free throws. [BONUS: 7 team fouls] (Pau Irving: 3 personal fouls)   FT 1/3: GOOD   FT 2/3: MISS   FT 3/3: GOOD Bam Wade makes 2/3 from the line.
Score: 25-16

[01:33] Team_031 possession (Score: 25-16)
Immanuel James attempts a Midrange. Contested by Nikola Jokic (5.6 feet, MAN). Immanuel James misses. Rebound secured by Jarrett Smith.

[01:15] Team_059 possession (Score: 25-16)
FOUL! Shooting foul on Immanuel James. Blake Tatum to the line for 2 free throws. [BONUS: 8 team fouls] (Immanuel James: 2 personal fouls)   FT 1/2: GOOD   FT 2/2: GOOD Blake Tatum makes 2/2 from the line.
Score: 27-16

[01:04] Team_031 possession (Score: 27-16)
Gary Morant attempts a 3Pt. Contested by Nikola Jokic (4.8 feet, ZONE). Gary Morant misses. Rebound secured by John Iverson.

[00:47] Team_059 possession (Score: 27-16)
FOUL! Shooting foul on Pau Irving. John Iverson to the line for 3 free throws. [BONUS: 9 team fouls] (Pau Irving: 4 personal fouls)   FT 1/3: GOOD   FT 2/3: GOOD   FT 3/3: GOOD John Iverson makes 3/3 from the line.
Score: 30-16

[00:35] Team_031 possession (Score: 30-16)
Pau Irving attempts a Layup. BLOCKED BY JOHN IVERSON! Ball deflects out of bounds off Pau Irving.

[00:19] Team_059 possession (Score: 30-16)
John Iverson throws a bad pass out of bounds! TURNOVER! (dead ball)

[00:19] Substitution (Team_059): Bam Wade OUT → Russell Quickley IN (stamina_rule2)

[00:19] Substitution (Team_059): Blake Tatum OUT → Scottie Ginobili IN (stamina_rule2)

[00:19] Substitution (Team_059): John Iverson OUT → Allen Giddey IN (stamina_rule2)

[00:19] Substitution (Team_059): Nikola Jokic OUT → Bones Middleton IN (stamina_rule2)

[00:19] Substitution (Team_059): Jarrett Smith OUT → LeBron Lowry IN (stamina_rule2)

[00:19] Substitution (Team_031): Shai Durant OUT → Kevin Morant IN (stamina_rule2)

[00:19] Substitution (Team_031): Gary Morant OUT → Isaiah Ingram IN (stamina_rule2)

[00:19] Substitution (Team_031): Pau Irving OUT → Miles Stewart IN (stamina_rule2)

[00:19] Substitution (Team_031): Immanuel James OUT → Kobe Randle IN (stamina_rule2)

[00:19] Substitution (Team_031): Luka Sabonis OUT → Jimmy Poole IN (stamina_rule2)

[00:08] Team_031 possession (Score: 30-16)
FOUL! Offensive foul on Isaiah Ingram! Scottie Ginobili drew the charge! [Team fouls: 10] (Isaiah Ingram: 1 personal fouls) TURNOVER! (dead ball)

================================================================================
                              1ST QUARTER COMPLETE                              
================================================================================

1ST QUARTER SCORE: Team_059 30, Team_031 16

BOX SCORE:
================================================================================

Team_059
--------------------------------------------------------------------------------
Player                MIN  PTS  REB  AST  TO      FG   FG%      3P   3P%
--------------------------------------------------------------------------------
Bam Wade               12   12    4    1   0   5/6    83.3     0/0   0.0
Jarrett Smith          12    6    2    0   0   3/3   100.0     0/0   0.0
John Iverson           12    5    6    0   0   2/4    50.0     0/0   0.0
Nikola Jokic           12    5    0    3   0   2/3    66.7     0/0   0.0
Blake Tatum            12    2    0    1   0   1/2    50.0     0/0   0.0

TEAM: FG: 13/18 (72.2%), 3PT: 3/6 (50.0%), REB: 12 (1 off, 11 def), AST: 5, TO: 4
TEAM FOULS: 4


Team_031
--------------------------------------------------------------------------------
Player                MIN  PTS  REB  AST  TO      FG   FG%      3P   3P%
--------------------------------------------------------------------------------
Gary Morant            12    7    2    0   0   3/6    50.0     0/0   0.0
Immanuel James         12    4    3    1   0   2/5    40.0     0/0   0.0
Pau Irving             12    3    0    2   0   1/3    33.3     0/0   0.0
Shai Durant            12    0    0    0   0   0/3     0.0     0/0   0.0
Luka Sabonis           12    0    3    0   0   0/1     0.0     0/0   0.0

TEAM: FG: 6/18 (33.3%), 3PT: 2/9 (22.2%), REB: 8 (3 off, 5 def), AST: 3, TO: 4
TEAM FOULS: 10 [Team_059 in BONUS]

================================================================================

================================================================================
                       2ND QUARTER - Team_059 vs Team_031                       
================================================================================

[12:00] Team_059 possession (Score: 30-16)
Nikola Jokic drives and kicks out. Bam Wade attempts a 3Pt. Contested by Pau Irving (4.8 feet, ZONE). BAM WADE MAKES IT! Assist: John Iverson
Score: 33-16

[11:45] Team_031 possession (Score: 33-16)
Luka Sabonis drives to the basket... Luka Sabonis throws a bad pass out of bounds! TURNOVER! (dead ball)

[11:45] Substitution (Team_059): Bam Wade OUT → Russell Quickley IN (stamina_rule2)

[11:45] Substitution (Team_059): Blake Tatum OUT → Scottie Ginobili IN (stamina_rule2)

[11:45] Substitution (Team_059): John Iverson OUT → Allen Giddey IN (stamina_rule2)

[11:45] Substitution (Team_031): Shai Durant OUT → Kevin Morant IN (stamina_rule2)

[11:45] Substitution (Team_031): Gary Morant OUT → Isaiah Ingram IN (stamina_rule2)

[11:45] Substitution (Team_031): Pau Irving OUT → Miles Stewart IN (stamina_rule2)

[11:45] Substitution (Team_031): Immanuel James OUT → Kobe Randle IN (stamina_rule2)

[11:45] Substitution (Team_031): Luka Sabonis OUT → Jimmy Poole IN (stamina_rule2)

[11:32] Team_059 possession (Score: 33-16)
Scottie Ginobili drives, Isaiah Ingram stays with him. Scottie Ginobili attempts a Layup. Contested by Isaiah Ingram (3.5 feet, MAN). SCOTTIE GINOBILI MAKES IT! Assist: Nikola Jokic
Score: 35-16

[11:21] Team_031 possession (Score: 35-16)
Kobe Randle drives and kicks out. Kevin Morant attempts a Midrange. Wide open! Nikola Jokic is 7.5 feet away. [ZONE] Kevin Morant misses. Rebound secured by Nikola Jokic.

[11:03] Team_059 possession (Score: 35-16)
Scottie Ginobili makes the Layup and draws the foul on Isaiah Ingram! And-1! Scottie Ginobili to the line for 1. [Team fouls: 1] (Isaiah Ingram: 1 personal fouls)   FT 1/1: GOOD Scottie Ginobili makes 1/1 from the line.
Score: 38-16

[10:49] Team_031 possession (Score: 38-16)
Jimmy Poole attempts a Layup. Contested by Jarrett Smith (2.9 feet, ZONE). Jimmy Poole misses. Rebound secured by Nikola Jokic.

[10:38] Team_059 possession (Score: 38-16)
Russell Quickley loses control! Ball rolls out of bounds! TURNOVER! (dead ball)

[10:38] Substitution (Team_059): Nikola Jokic OUT → Bones Middleton IN (stamina_rule2)

[10:38] Substitution (Team_059): Jarrett Smith OUT → LeBron Lowry IN (stamina_rule2)

[10:24] Team_031 possession (Score: 38-16)
Kevin Morant drives, picks up Russell Quickley. Help arrives from Scottie Ginobili! Kevin Morant attempts a Dunk. Heavily contested by Scottie Ginobili (0.5 feet, MAN)! Kevin Morant misses. Rebound secured by LeBron Lowry.

[10:11] Team_059 possession (Score: 38-16)
Allen Giddey attempts a 3Pt. Wide open! Miles Stewart is 6.3 feet away. [MAN] ALLEN GIDDEY MAKES IT! Assist: LeBron Lowry
Score: 41-16

[09:59] Team_031 possession (Score: 41-16)
Kobe Randle attempts a Midrange. Wide open! Bones Middleton is 6.4 feet away. [ZONE] KOBE RANDLE MAKES IT! Assist: Miles Stewart
Score: 41-18

[09:41] Team_059 possession (Score: 41-18)
Bones Middleton attempts a Midrange. Wide open! Miles Stewart is 6.7 feet away. [ZONE] Bones Middleton misses. Rebound secured by Jimmy Poole.

[09:26] Team_031 possession (Score: 41-18)
Jimmy Poole attempts a Layup. Contested by LeBron Lowry (2.5 feet, MAN). JIMMY POOLE MAKES IT!
Score: 41-20

[09:08] Team_059 possession (Score: 41-20)
LeBron Lowry attempts a Midrange. Contested by Miles Stewart (5.1 feet, ZONE). LEBRON LOWRY MAKES IT! Assist: Bones Middleton
Score: 43-20

[08:53] Team_031 possession (Score: 43-20)
Kevin Morant attempts a 3Pt. Wide open! Russell Quickley is 6.9 feet away. [MAN] Kevin Morant misses. FOUL! Loose ball foul on Bones Middleton during the rebound battle. [Team fouls: 1] No free throws, side out. (Bones Middleton: 1 personal fouls)

[08:43] Team_031 possession (Score: 43-20)
Kobe Randle drives, Bones Middleton stays with him. Kobe Randle attempts a Layup. Contested by Bones Middleton (3.2 feet, ZONE). KOBE RANDLE MAKES IT! Assist: Kevin Morant
Score: 43-22

[08:27] Team_059 possession (Score: 43-22)
Bones Middleton attempts a 3Pt. Heavily contested by Miles Stewart (1.5 feet, ZONE)! BONES MIDDLETON MAKES IT! Assist: Russell Quickley
Score: 46-22

[08:13] Team_031 possession (Score: 46-22)
Kobe Randle drives, Bones Middleton stays with him. Kobe Randle attempts a Dunk. Heavily contested by Bones Middleton (0.5 feet, ZONE)! KOBE RANDLE MAKES IT! Assist: Kevin Morant
Score: 46-24

[08:02] Team_059 possession (Score: 46-24)
Scottie Ginobili attempts a Layup. Contested by Isaiah Ingram (2.4 feet, MAN). SCOTTIE GINOBILI MAKES IT! Assist: Russell Quickley
Score: 48-24

[07:51] Team_031 possession (Score: 48-24)
Kobe Randle attempts a 3Pt. Contested by Russell Quickley (4.6 feet, ZONE). KOBE RANDLE MAKES IT!
Score: 48-27

[07:37] Team_059 possession (Score: 48-27)
LeBron Lowry drives to the basket... LeBron Lowry loses control! Ball rolls out of bounds! TURNOVER! (dead ball)

[07:18] Team_031 possession (Score: 48-27)
Isaiah Ingram drives, Bones Middleton stays with him. Isaiah Ingram attempts a Dunk. Contested by Bones Middleton (2.9 feet, ZONE). ISAIAH INGRAM MAKES IT! Assist: Jimmy Poole
Score: 48-29

[07:04] Team_059 possession (Score: 48-29)
Bones Middleton attempts a 3Pt. Contested by Kobe Randle (4.1 feet, MAN). Bones Middleton misses. Rebound secured by Isaiah Ingram.

[06:54] Team_031 possession (Score: 48-29)
Isaiah Ingram attempts a 3Pt. Contested by Russell Quickley (4.1 feet, ZONE). Isaiah Ingram misses. Rebound secured by Scottie Ginobili.

[06:38] Team_059 possession (Score: 48-29)
Russell Quickley loses control! Ball rolls out of bounds! TURNOVER! (dead ball)

[06:26] Team_031 possession (Score: 48-29)
Kobe Randle makes the Layup and draws the foul on Bones Middleton! And-1! Kobe Randle to the line for 1. [Team fouls: 2] (Bones Middleton: 2 personal fouls)   FT 1/1: MISS Kobe Randle makes 0/1 from the line. Rebound secured by LeBron Lowry.
Score: 48-31

[06:08] Team_059 possession (Score: 48-31)
Scottie Ginobili attempts a 3Pt. Contested by Isaiah Ingram (3.0 feet, MAN). SCOTTIE GINOBILI MAKES IT! Assist: Russell Quickley
Score: 51-31

[05:54] Team_031 possession (Score: 51-31)
Kevin Morant attempts a 3Pt. Contested by Russell Quickley (2.7 feet, ZONE). Kevin Morant misses. FOUL! Loose ball foul on LeBron Lowry during the rebound battle. [Team fouls: 3] No free throws, side out. (LeBron Lowry: 1 personal fouls)

[05:43] Team_031 possession (Score: 51-31)
Jimmy Poole attempts a Midrange. Contested by Allen Giddey (4.0 feet, ZONE). JIMMY POOLE MAKES IT!
Score: 51-33

[05:29] Team_059 possession (Score: 51-33)
Russell Quickley attempts a 3Pt. Contested by Kevin Morant (3.9 feet, MAN). RUSSELL QUICKLEY MAKES IT! Assist: Allen Giddey
Score: 54-33

[05:18] Team_031 possession (Score: 54-33)
FOUL! Offensive foul on Kevin Morant! Russell Quickley drew the charge! [Team fouls: 2] (Kevin Morant: 1 personal fouls) TURNOVER! (dead ball)

[05:03] Team_059 possession (Score: 54-33)
LeBron Lowry drives, picks up Kobe Randle. Help arrives from Isaiah Ingram! LeBron Lowry attempts a Dunk. Contested by Isaiah Ingram (3.2 feet, ZONE). LeBron Lowry misses. Rebound secured by Isaiah Ingram.

[04:51] Team_031 possession (Score: 54-33)
Isaiah Ingram attempts a 3Pt. Wide open! Russell Quickley is 6.1 feet away. [ZONE] ISAIAH INGRAM MAKES IT! Assist: Kobe Randle
Score: 54-36

[04:35] Team_059 possession (Score: 54-36)
Allen Giddey attempts a 3Pt. Contested by Kobe Randle (3.7 feet, ZONE). ALLEN GIDDEY MAKES IT! Assist: Russell Quickley
Score: 57-36

[04:21] Team_031 possession (Score: 57-36)
Kobe Randle commits a violation (traveling/carry)! TURNOVER! (dead ball)

[04:03] Team_059 possession (Score: 57-36)
FOUL! Reach-in foul on Kevin Morant during the drive. [Team fouls: 3] No free throws, side out. (Kevin Morant: 2 personal fouls)

[03:49] Team_059 possession (Score: 57-36)
Scottie Ginobili attempts a Layup. Contested by Isaiah Ingram (4.1 feet, MAN). Scottie Ginobili misses. Rebound secured by Kobe Randle.

[03:34] Team_031 possession (Score: 57-36)
Kevin Morant drives, Bones Middleton stays with him. Kevin Morant attempts a Dunk. Contested by Bones Middleton (4.7 feet, ZONE). Kevin Morant misses. Rebound secured by Scottie Ginobili.

[03:18] Team_059 possession (Score: 57-36)
Scottie Ginobili attempts a 3Pt. Contested by Miles Stewart (5.7 feet, ZONE). Scottie Ginobili misses. Rebound secured by Isaiah Ingram.

[03:02] Team_031 possession (Score: 57-36)
Jimmy Poole attempts a Layup. BLOCKED BY SCOTTIE GINOBILI! Ball is loose! Offensive rebound by Jimmy Poole! Jimmy Poole kicks it out.

[02:46] Team_031 possession (Score: 57-36)
Miles Stewart attempts a 3Pt. Wide open! Allen Giddey is 7.9 feet away. [MAN] MILES STEWART MAKES IT! Assist: Isaiah Ingram
Score: 57-39

[02:30] Team_059 possession (Score: 57-39)
Scottie Ginobili loses control! Ball rolls out of bounds! TURNOVER! (dead ball)

[02:19] Team_031 possession (Score: 57-39)
Jimmy Poole attempts a Layup. Wide open! Bones Middleton is 6.4 feet away. [ZONE] Jimmy Poole misses. Offensive rebound by Jimmy Poole! Jimmy Poole kicks it out.

[02:07] Team_031 possession (Score: 57-39)
FOUL! Shooting foul on Bones Middleton. Miles Stewart to the line for 2 free throws. [Team fouls: 4] (Bones Middleton: 3 personal fouls)   FT 1/2: GOOD   FT 2/2: GOOD Miles Stewart makes 2/2 from the line.
Score: 57-41

[01:56] Team_059 possession (Score: 57-41)
Russell Quickley attempts a Midrange. Wide open! Kobe Randle is 6.0 feet away. [ZONE] Russell Quickley misses. Rebound secured by Kobe Randle.

[01:41] Team_031 possession (Score: 57-41)
Kevin Morant attempts a 3Pt. Wide open! Russell Quickley is 7.3 feet away. [MAN] Kevin Morant misses. Rebound secured by Bones Middleton.

[01:24] Team_059 possession (Score: 57-41)
FOUL! Shooting foul on Kobe Randle. Bones Middleton to the line for 2 free throws. [Team fouls: 4] (Kobe Randle: 1 personal fouls)   FT 1/2: MISS   FT 2/2: GOOD Bones Middleton makes 1/2 from the line.
Score: 58-41

[01:09] Team_031 possession (Score: 58-41)
Miles Stewart attempts a Midrange. Wide open! Allen Giddey is 7.0 feet away. [MAN] Miles Stewart misses. Rebound secured by LeBron Lowry.

[00:51] Team_059 possession (Score: 58-41)
FOUL! Shooting foul on Kobe Randle. Russell Quickley to the line for 2 free throws. [BONUS: 5 team fouls] (Kobe Randle: 2 personal fouls)   FT 1/2: MISS   FT 2/2: GOOD Russell Quickley makes 1/2 from the line.
Score: 59-41

[00:37] Team_031 possession (Score: 59-41)
Miles Stewart drives to the basket... Miles Stewart throws a bad pass! Stolen by Allen Giddey! TURNOVER! (live ball)

[00:18] Team_059 possession (Score: 59-41)
Russell Quickley throws a bad pass out of bounds! TURNOVER! (dead ball)

[00:03] Team_031 possession (Score: 59-41)
Kevin Morant attempts a 3Pt. Contested by Russell Quickley (2.8 feet, ZONE). Kevin Morant misses. Offensive rebound by Jimmy Poole! Jimmy Poole kicks it out.

================================================================================
                              2ND QUARTER COMPLETE                              
================================================================================

2ND QUARTER SCORE: Team_059 29, Team_031 25

BOX SCORE:
================================================================================

Team_059
--------------------------------------------------------------------------------
Player                MIN  PTS  REB  AST  TO      FG   FG%      3P   3P%
--------------------------------------------------------------------------------
Scottie Ginobili       12   10    2    0   0   4/6    66.7     0/0   0.0
Allen Giddey           12    6    0    1   0   2/2   100.0     0/0   0.0
Bones Middleton        11    4    1    1   0   2/4    50.0     0/0   0.0
Russell Quickley       12    4    0    4   0   2/3    66.7     0/0   0.0
Bam Wade               12    3    0    0   0   1/1   100.0     0/0   0.0
LeBron Lowry           11    2    3    1   0   1/2    50.0     0/0   0.0
John Iverson           12    0    0    1   0   0/0     0.0     0/0   0.0
Nikola Jokic           13    0    2    1   0   0/0     0.0     0/0   0.0

TEAM: FG: 12/18 (66.7%), 3PT: 5/7 (71.4%), REB: 8 (0 off, 8 def), AST: 9, TO: 5
TEAM FOULS: 4


Team_031
--------------------------------------------------------------------------------
Player                MIN  PTS  REB  AST  TO      FG   FG%      3P   3P%
--------------------------------------------------------------------------------
Kobe Randle            12    9    2    1   0   4/6    66.7     0/0   0.0
Miles Stewart          12    5    0    1   0   2/3    66.7     0/0   0.0
Isaiah Ingram          12    5    4    1   0   2/3    66.7     0/0   0.0
Jimmy Poole            12    4    5    1   0   2/3    66.7     0/0   0.0
Kevin Morant           12    0    0    2   0   0/3     0.0     0/0   0.0

TEAM: FG: 10/18 (55.6%), 3PT: 3/5 (60.0%), REB: 11 (5 off, 6 def), AST: 6, TO: 4
TEAM FOULS: 5 [Team_059 in BONUS]

================================================================================

================================================================================
                       3RD QUARTER - Team_059 vs Team_031                       
================================================================================

[12:00] Team_059 possession (Score: 59-41)
Nikola Jokic drives and kicks out. Jarrett Smith attempts a Midrange. BLOCKED BY GARY MORANT! Ball is loose! Offensive rebound by John Iverson! John Iverson kicks it out.

[11:43] Team_059 possession (Score: 59-41)
Nikola Jokic attempts a Midrange. Contested by Gary Morant (5.3 feet, ZONE). NIKOLA JOKIC MAKES IT!
Score: 61-41

[11:30] Team_031 possession (Score: 61-41)
FOUL! Offensive foul on Gary Morant! Blake Tatum drew the charge! [Team fouls: 2] (Gary Morant: 1 personal fouls) TURNOVER! (dead ball)

[11:17] Team_059 possession (Score: 61-41)
Blake Tatum attempts a 3Pt. Contested by Gary Morant (5.2 feet, MAN). Blake Tatum misses. Rebound secured by Luka Sabonis.

[11:02] Team_031 possession (Score: 61-41)
Immanuel James attempts a Layup. Wide open! Nikola Jokic is 8.8 feet away. [ZONE] IMMANUEL JAMES MAKES IT!
Score: 61-43

[10:45] Team_059 possession (Score: 61-43)
Jarrett Smith throws a bad pass out of bounds! TURNOVER! (dead ball)

[10:34] Team_031 possession (Score: 61-43)
Pau Irving attempts a 3Pt. Contested by Nikola Jokic (3.4 feet, ZONE). PAU IRVING MAKES IT! Assist: Gary Morant
Score: 61-46

[10:14] Team_059 possession (Score: 61-46)
FOUL! Shooting foul on Pau Irving. John Iverson to the line for 2 free throws. [Team fouls: 3] (Pau Irving: 1 personal fouls)   FT 1/2: GOOD   FT 2/2: MISS John Iverson makes 1/2 from the line. Offensive rebound by John Iverson! John Iverson kicks it out.
Score: 62-46

[09:56] Team_059 possession (Score: 62-46)
John Iverson commits a violation (traveling/carry)! TURNOVER! (dead ball)

[09:40] Team_031 possession (Score: 62-46)
FOUL! Shooting foul on Bam Wade. Shai Durant to the line for 2 free throws. [Team fouls: 1] (Bam Wade: 1 personal fouls)   FT 1/2: GOOD   FT 2/2: GOOD Shai Durant makes 2/2 from the line.
Score: 62-48

[09:26] Team_059 possession (Score: 62-48)
Nikola Jokic attempts a 3Pt. Heavily contested by Pau Irving (1.8 feet, ZONE)! Nikola Jokic misses. Rebound secured by Gary Morant.

[09:14] Team_031 possession (Score: 62-48)
Gary Morant drives and kicks out. Shai Durant attempts a Midrange. Wide open! John Iverson is 6.0 feet away. [ZONE] SHAI DURANT MAKES IT! Assist: Luka Sabonis
Score: 62-50

[08:58] Team_059 possession (Score: 62-50)
John Iverson attempts a Midrange. Heavily contested by Immanuel James (1.1 feet, ZONE)! John Iverson misses. Rebound secured by Gary Morant.

[08:42] Team_031 possession (Score: 62-50)
Gary Morant makes the Midrange and draws the foul on John Iverson! And-1! Gary Morant to the line for 1. [Team fouls: 2] (John Iverson: 1 personal fouls)   FT 1/1: MISS Gary Morant makes 0/1 from the line. Rebound secured by John Iverson.
Score: 62-52

[08:26] Team_059 possession (Score: 62-52)
Nikola Jokic drives to the basket... FOUL! Offensive foul on Nikola Jokic! Immanuel James drew the charge! [Team fouls: 3] (Nikola Jokic: 1 personal fouls) TURNOVER! (dead ball)

[08:12] Team_031 possession (Score: 62-52)
Shai Durant attempts a 3Pt. Contested by Bam Wade (4.5 feet, ZONE). Shai Durant misses. Rebound secured by John Iverson.

[07:58] Team_059 possession (Score: 62-52)
Bam Wade throws a bad pass out of bounds! TURNOVER! (dead ball)

[07:39] Team_031 possession (Score: 62-52)
Pau Irving drives, John Iverson stays with him. Pau Irving attempts a Dunk. Contested by John Iverson (3.5 feet, MAN). PAU IRVING MAKES IT! Assist: Luka Sabonis
Score: 62-54

[07:23] Team_059 possession (Score: 62-54)
Bam Wade attempts a 3Pt. Contested by Shai Durant (5.7 feet, MAN). Bam Wade misses. Rebound secured by Luka Sabonis.

[07:11] Team_031 possession (Score: 62-54)
Immanuel James attempts a 3Pt. Contested by Bam Wade (4.0 feet, ZONE). IMMANUEL JAMES MAKES IT! Assist: Luka Sabonis
Score: 62-57

[06:56] Team_059 possession (Score: 62-57)
Nikola Jokic drives to the basket... Nikola Jokic throws a bad pass! Stolen by Immanuel James! TURNOVER! (live ball)

[06:39] Team_031 possession (Score: 62-57)
Luka Sabonis makes the Midrange and draws the foul on Nikola Jokic! And-1! Luka Sabonis to the line for 1. [Team fouls: 4] (Nikola Jokic: 2 personal fouls)   FT 1/1: MISS Luka Sabonis makes 0/1 from the line. Rebound secured by John Iverson.
Score: 62-59

[06:23] Team_059 possession (Score: 62-59)
Jarrett Smith attempts a 3Pt. Contested by Luka Sabonis (3.0 feet, MAN). Jarrett Smith misses. Offensive rebound by John Iverson! John Iverson kicks it out.

[06:12] Team_059 possession (Score: 62-59)
Nikola Jokic attempts a 3Pt. Wide open! Pau Irving is 6.4 feet away. [ZONE] NIKOLA JOKIC MAKES IT! Assist: Jarrett Smith
Score: 65-59

[06:01] Team_031 possession (Score: 65-59)
Pau Irving loses control! Ball rolls out of bounds! TURNOVER! (dead ball)

[05:47] Team_059 possession (Score: 65-59)
John Iverson attempts a Layup. Contested by Pau Irving (4.9 feet, MAN). JOHN IVERSON MAKES IT! Assist: Jarrett Smith
Score: 67-59

[05:28] Team_031 possession (Score: 67-59)
Gary Morant attempts a Midrange. Wide open! John Iverson is 6.4 feet away. [ZONE] GARY MORANT MAKES IT! Assist: Immanuel James
Score: 67-61

[05:11] Team_059 possession (Score: 67-61)
FOUL! Reach-in foul on Luka Sabonis during the drive. [Team fouls: 4] No free throws, side out. (Luka Sabonis: 2 personal fouls)

[05:01] Team_059 possession (Score: 67-61)
FOUL! Holding foul on Shai Durant. [IN THE BONUS! 5 team fouls] Bam Wade to the line for 2 free throws. (Shai Durant: 1 personal fouls)   FT 1/2: GOOD   FT 2/2: GOOD Bam Wade makes 2/2 from the line.
Score: 69-61

[04:47] Team_031 possession (Score: 69-61)
Shai Durant attempts a Midrange. Contested by Bam Wade (5.5 feet, MAN). Shai Durant misses. Rebound secured by Bam Wade.

[04:32] Team_059 possession (Score: 69-61)
FOUL! Shooting foul on Immanuel James. Nikola Jokic to the line for 2 free throws. [BONUS: 6 team fouls] (Immanuel James: 1 personal fouls)   FT 1/2: GOOD   FT 2/2: GOOD Nikola Jokic makes 2/2 from the line.
Score: 71-61

[04:16] Team_031 possession (Score: 71-61)
Luka Sabonis attempts a Midrange. Wide open! Jarrett Smith is 7.2 feet away. [MAN] LUKA SABONIS MAKES IT!
Score: 71-63

[03:59] Team_059 possession (Score: 71-63)
FOUL! Shooting foul on Pau Irving. Bam Wade to the line for 2 free throws. [BONUS: 7 team fouls] (Pau Irving: 2 personal fouls)   FT 1/2: GOOD   FT 2/2: GOOD Bam Wade makes 2/2 from the line.
Score: 73-63

[03:47] Team_031 possession (Score: 73-63)
Pau Irving attempts a Midrange. Contested by John Iverson (5.5 feet, MAN). PAU IRVING MAKES IT! Assist: Luka Sabonis
Score: 73-65

[03:32] Team_059 possession (Score: 73-65)
Nikola Jokic attempts a 3Pt. Contested by Pau Irving (2.1 feet, ZONE). Nikola Jokic misses. Rebound secured by Luka Sabonis.

[03:21] Team_031 possession (Score: 73-65)
Shai Durant attempts a 3Pt. Contested by Bam Wade (3.6 feet, MAN). Shai Durant misses. Rebound secured by Jarrett Smith.

[03:08] Team_059 possession (Score: 73-65)
Bam Wade drives to the basket... Bam Wade loses control! Ball rolls out of bounds! TURNOVER! (dead ball)

[03:08] Substitution (Team_059): John Iverson OUT → Allen Giddey IN (stamina_rule2)

[03:08] Substitution (Team_031): Immanuel James OUT → Kobe Randle IN (stamina_rule2)

[02:53] Team_031 possession (Score: 73-65)
Pau Irving attempts a Midrange. Wide open! Allen Giddey is 8.7 feet away. [MAN] PAU IRVING MAKES IT!
Score: 73-67

[02:40] Team_059 possession (Score: 73-67)
Nikola Jokic attempts a Midrange. Contested by Kobe Randle (3.8 feet, MAN). Nikola Jokic misses. Rebound secured by Kobe Randle.

[02:25] Team_031 possession (Score: 73-67)
Shai Durant attempts a 3Pt. Contested by Bam Wade (4.7 feet, MAN). Shai Durant misses. Rebound secured by Jarrett Smith.

[02:09] Team_059 possession (Score: 73-67)
Blake Tatum drives and kicks out. Allen Giddey attempts a 3Pt. Contested by Pau Irving (4.8 feet, MAN). Allen Giddey misses. Offensive rebound by Jarrett Smith! Jarrett Smith kicks it out.

[01:54] Team_059 possession (Score: 73-67)
Nikola Jokic attempts a Layup. Heavily contested by Luka Sabonis (0.5 feet, ZONE)! NIKOLA JOKIC MAKES IT!
Score: 75-67

[01:42] Team_031 possession (Score: 75-67)
Shai Durant attempts a 3Pt. Contested by Allen Giddey (3.5 feet, ZONE). SHAI DURANT MAKES IT! Assist: Pau Irving
Score: 75-70

[01:29] Team_059 possession (Score: 75-70)
Nikola Jokic attempts a Midrange. Wide open! Kobe Randle is 7.6 feet away. [MAN] Nikola Jokic misses. Rebound secured by Gary Morant.

[01:14] Team_031 possession (Score: 75-70)
Pau Irving drives, Jarrett Smith stays with him. Pau Irving attempts a Layup. Contested by Jarrett Smith (2.5 feet, ZONE). PAU IRVING MAKES IT!
Score: 75-72

[01:01] Team_059 possession (Score: 75-72)
Jarrett Smith attempts a Layup. BLOCKED BY LUKA SABONIS! Ball is loose! Offensive rebound by Jarrett Smith! Jarrett Smith kicks it out.

[00:45] Team_059 possession (Score: 75-72)
Jarrett Smith drives, Luka Sabonis stays with him. Jarrett Smith attempts a Dunk. Heavily contested by Luka Sabonis (0.6 feet, ZONE)! JARRETT SMITH MAKES IT! Assist: Blake Tatum
Score: 77-72

[00:30] Team_031 possession (Score: 77-72)
FOUL! Shooting foul on Jarrett Smith. Kobe Randle to the line for 2 free throws. [BONUS: 5 team fouls] (Jarrett Smith: 1 personal fouls)   FT 1/2: MISS   FT 2/2: GOOD Kobe Randle makes 1/2 from the line.
Score: 77-73

[00:17] Team_059 possession (Score: 77-73)
Allen Giddey attempts a Midrange. Contested by Kobe Randle (5.9 feet, ZONE). ALLEN GIDDEY MAKES IT!
Score: 79-73

[00:02] Team_031 possession (Score: 79-73)
Kobe Randle attempts a 3Pt. Wide open! Bam Wade is 8.2 feet away. [ZONE] Kobe Randle misses. Rebound secured by Nikola Jokic.

================================================================================
                              3RD QUARTER COMPLETE                              
================================================================================

3RD QUARTER SCORE: Team_059 20, Team_031 32

BOX SCORE:
================================================================================

Team_059
--------------------------------------------------------------------------------
Player                MIN  PTS  REB  AST  TO      FG   FG%      3P   3P%
--------------------------------------------------------------------------------
Nikola Jokic           26    9    1    0   0   4/8    50.0     0/0   0.0
Bam Wade               25    4    1    0   0   2/3    66.7     0/0   0.0
John Iverson           21    2    6    0   0   1/2    50.0     0/0   0.0
Jarrett Smith          26    2    4    2   0   1/1   100.0     0/0   0.0
Allen Giddey           15    2    0    0   0   1/1   100.0     0/0   0.0
Blake Tatum            25    0    0    1   0   0/1     0.0     0/0   0.0

TEAM: FG: 9/16 (56.2%), 3PT: 1/5 (20.0%), REB: 12 (5 off, 7 def), AST: 3, TO: 6
TEAM FOULS: 5 [Team_031 in BONUS]


Team_031
--------------------------------------------------------------------------------
Player                MIN  PTS  REB  AST  TO      FG   FG%      3P   3P%
--------------------------------------------------------------------------------
Pau Irving             25   11    0    1   0   5/5   100.0     0/0   0.0
Shai Durant            25    7    0    0   0   3/7    42.9     0/0   0.0
Immanuel James         21    5    0    1   0   2/2   100.0     0/0   0.0
Luka Sabonis           25    2    3    4   0   1/2    50.0     0/0   0.0
Gary Morant            25    2    3    1   0   1/2    50.0     0/0   0.0
Kobe Randle            15    1    1    0   0   1/2    50.0     0/0   0.0

TEAM: FG: 13/20 (65.0%), 3PT: 3/7 (42.9%), REB: 7 (0 off, 7 def), AST: 7, TO: 2
TEAM FOULS: 7 [Team_059 in BONUS]

================================================================================

================================================================================
                       4TH QUARTER - Team_059 vs Team_031                       
================================================================================

[12:00] Team_059 possession (Score: 79-73)
Nikola Jokic attempts a Layup. Heavily contested by Immanuel James (1.4 feet, MAN)! NIKOLA JOKIC MAKES IT! Assist: Bam Wade
Score: 81-73

[11:46] Team_031 possession (Score: 81-73)
Immanuel James attempts a 3Pt. Contested by Bam Wade (5.3 feet, ZONE). Immanuel James misses. Rebound secured by Bam Wade.

[11:31] Team_059 possession (Score: 81-73)
Bam Wade attempts a Midrange. Contested by Luka Sabonis (3.5 feet, ZONE). Bam Wade misses. Rebound secured by Gary Morant.

[11:20] Team_031 possession (Score: 81-73)
Shai Durant drives, Bam Wade stays with him. Shai Durant attempts a Layup. Heavily contested by Bam Wade (0.5 feet, MAN)! SHAI DURANT MAKES IT! Assist: Gary Morant
Score: 81-75

[11:10] Team_059 possession (Score: 81-75)
John Iverson drives, Pau Irving stays with him. John Iverson attempts a Dunk. Contested by Pau Irving (3.1 feet, MAN). JOHN IVERSON MAKES IT! Assist: Nikola Jokic
Score: 83-75

[10:54] Team_031 possession (Score: 83-75)
Luka Sabonis drives to the basket... Luka Sabonis throws a bad pass! Stolen by Jarrett Smith! TURNOVER! (live ball)

[10:41] Team_059 possession (Score: 83-75)
Blake Tatum attempts a 3Pt. Wide open! Gary Morant is 8.9 feet away. [MAN] Blake Tatum misses. Offensive rebound by John Iverson! John Iverson kicks it out.

[10:27] Team_059 possession (Score: 83-75)
Blake Tatum attempts a 3Pt. Contested by Pau Irving (5.3 feet, ZONE). BLAKE TATUM MAKES IT! Assist: Bam Wade
Score: 86-75

[10:15] Team_031 possession (Score: 86-75)
Shai Durant attempts a 3Pt. Contested by Bam Wade (5.9 feet, MAN). Shai Durant misses. Rebound secured by Jarrett Smith.

[10:00] Team_059 possession (Score: 86-75)
Blake Tatum attempts a 3Pt. Contested by Gary Morant (3.8 feet, MAN). Blake Tatum misses. Offensive rebound by John Iverson! John Iverson kicks it out.

[09:47] Team_059 possession (Score: 86-75)
Nikola Jokic attempts a Midrange. Contested by Gary Morant (4.5 feet, ZONE). Nikola Jokic misses. Offensive rebound by John Iverson! John Iverson kicks it out.

[09:29] Team_059 possession (Score: 86-75)
Bam Wade drives and kicks out. Jarrett Smith makes the 3Pt and draws the foul on Luka Sabonis! And-1! Jarrett Smith to the line for 1. [Team fouls: 1] (Luka Sabonis: 1 personal fouls)   FT 1/1: GOOD Jarrett Smith makes 1/1 from the line.
Score: 90-75

[09:12] Team_031 possession (Score: 90-75)
Pau Irving drives, picks up John Iverson. Help arrives from Bam Wade! Pau Irving attempts a Dunk. Wide open! Bam Wade is 6.2 feet away. [MAN] Pau Irving misses. Rebound secured by Jarrett Smith.

[08:59] Team_059 possession (Score: 90-75)
FOUL! Shooting foul on Gary Morant. Blake Tatum to the line for 2 free throws. [Team fouls: 2] (Gary Morant: 1 personal fouls)   FT 1/2: GOOD   FT 2/2: GOOD Blake Tatum makes 2/2 from the line.
Score: 92-75

[08:48] Team_031 possession (Score: 92-75)
Luka Sabonis attempts a Layup. Contested by Jarrett Smith (4.0 feet, ZONE). Luka Sabonis misses. Rebound secured by Nikola Jokic.

[08:35] Team_059 possession (Score: 92-75)
Blake Tatum attempts a 3Pt. Wide open! Pau Irving is 7.0 feet away. [ZONE] Blake Tatum misses. Rebound secured by Gary Morant.

[08:23] Team_031 possession (Score: 92-75)
Gary Morant loses control! Ball rolls out of bounds! TURNOVER! (dead ball)

[08:23] Substitution (Team_059): Bam Wade OUT → Russell Quickley IN (stamina_rule2)

[08:23] Substitution (Team_059): Blake Tatum OUT → Scottie Ginobili IN (stamina_rule2)

[08:23] Substitution (Team_059): John Iverson OUT → Allen Giddey IN (stamina_rule2)

[08:23] Substitution (Team_059): Nikola Jokic OUT → Bones Middleton IN (stamina_rule2)

[08:23] Substitution (Team_059): Jarrett Smith OUT → LeBron Lowry IN (stamina_rule2)

[08:23] Substitution (Team_031): Shai Durant OUT → Kevin Morant IN (stamina_rule2)

[08:23] Substitution (Team_031): Gary Morant OUT → Isaiah Ingram IN (stamina_rule2)

[08:23] Substitution (Team_031): Pau Irving OUT → Miles Stewart IN (stamina_rule2)

[08:23] Substitution (Team_031): Immanuel James OUT → Kobe Randle IN (stamina_rule2)

[08:23] Substitution (Team_031): Luka Sabonis OUT → Jimmy Poole IN (stamina_rule2)

[08:10] Team_059 possession (Score: 92-75)
Scottie Ginobili drives, picks up Kobe Randle. Help arrives from Isaiah Ingram! Scottie Ginobili attempts a Dunk. Contested by Isaiah Ingram (3.3 feet, ZONE). SCOTTIE GINOBILI MAKES IT! Assist: LeBron Lowry
Score: 94-75

[07:58] Team_031 possession (Score: 94-75)
Kevin Morant drives and kicks out. Miles Stewart attempts a Midrange. Wide open! Allen Giddey is 9.4 feet away. [MAN] MILES STEWART MAKES IT! Assist: Jimmy Poole
Score: 94-77

[07:43] Team_059 possession (Score: 94-77)
Bones Middleton attempts a Midrange. Contested by Kobe Randle (4.0 feet, MAN). Bones Middleton misses. Rebound secured by Isaiah Ingram.

[07:30] Team_031 possession (Score: 94-77)
Miles Stewart drives and kicks out. Kevin Morant attempts a Midrange. Wide open! Russell Quickley is 6.5 feet away. [MAN] KEVIN MORANT MAKES IT!
Score: 94-79

[07:16] Team_059 possession (Score: 94-79)
Russell Quickley attempts a 3Pt. Wide open! Miles Stewart is 7.3 feet away. [ZONE] Russell Quickley misses. Rebound secured by Kobe Randle.

[07:01] Team_031 possession (Score: 94-79)
Kevin Morant throws a bad pass out of bounds! TURNOVER! (dead ball)

[06:48] Team_059 possession (Score: 94-79)
Russell Quickley drives and kicks out. Russell Quickley attempts a 3Pt. Contested by Kevin Morant (4.7 feet, MAN). Russell Quickley misses. Rebound secured by Isaiah Ingram.

[06:33] Team_031 possession (Score: 94-79)
Jimmy Poole attempts a 3Pt. Heavily contested by Russell Quickley (1.7 feet, ZONE)! Jimmy Poole misses. Rebound secured by LeBron Lowry.

[06:14] Team_059 possession (Score: 94-79)
Allen Giddey attempts a Layup. Contested by Miles Stewart (3.6 feet, MAN). ALLEN GIDDEY MAKES IT! Assist: LeBron Lowry
Score: 96-79

[06:03] Team_031 possession (Score: 96-79)
Isaiah Ingram attempts a Layup. Wide open! Scottie Ginobili is 6.3 feet away. [MAN] ISAIAH INGRAM MAKES IT!
Score: 96-81

[05:49] Team_059 possession (Score: 96-81)
Russell Quickley attempts a Midrange. Wide open! Kevin Morant is 6.0 feet away. [MAN] RUSSELL QUICKLEY MAKES IT!
Score: 98-81

[05:31] Team_031 possession (Score: 98-81)
Isaiah Ingram attempts a 3Pt. Contested by Russell Quickley (2.7 feet, ZONE). Isaiah Ingram misses. Rebound secured by LeBron Lowry.

[05:16] Team_059 possession (Score: 98-81)
Russell Quickley drives and kicks out. Bones Middleton attempts a Midrange. Contested by Kobe Randle (3.6 feet, ZONE). Bones Middleton misses. Offensive rebound by Scottie Ginobili! Scottie Ginobili kicks it out.

[05:02] Team_059 possession (Score: 98-81)
LeBron Lowry drives to the basket... LeBron Lowry loses control! Ball rolls out of bounds! TURNOVER! (dead ball)

[04:49] Team_031 possession (Score: 98-81)
FOUL! Reach-in foul on Bones Middleton during the drive. [Team fouls: 1] No free throws, side out. (Bones Middleton: 1 personal fouls)

[04:36] Team_031 possession (Score: 98-81)
Kobe Randle attempts a Midrange. Wide open! Allen Giddey is 6.9 feet away. [ZONE] KOBE RANDLE MAKES IT!
Score: 98-83

[04:20] Team_059 possession (Score: 98-83)
Bones Middleton drives to the basket... Bones Middleton throws a bad pass out of bounds! TURNOVER! (dead ball)

[04:06] Team_031 possession (Score: 98-83)
Jimmy Poole loses the ball! Stripped by LeBron Lowry! TURNOVER! (live ball)

[03:48] Team_059 possession (Score: 98-83)
Russell Quickley attempts a 3Pt. Contested by Kevin Morant (2.5 feet, MAN). RUSSELL QUICKLEY MAKES IT! Assist: Allen Giddey
Score: 101-83

[03:34] Team_031 possession (Score: 101-83)
FOUL! Shooting foul on Bones Middleton. Kobe Randle to the line for 2 free throws. [Team fouls: 2] (Bones Middleton: 2 personal fouls)   FT 1/2: GOOD   FT 2/2: GOOD Kobe Randle makes 2/2 from the line.
Score: 101-85

[03:23] Team_059 possession (Score: 101-85)
FOUL! Holding foul on Kevin Morant. [Team fouls: 3] No free throws, side out. (Kevin Morant: 1 personal fouls)

[03:08] Team_059 possession (Score: 101-85)
LeBron Lowry drives, picks up Jimmy Poole. Help arrives from Isaiah Ingram! LeBron Lowry attempts a Dunk. Wide open! Isaiah Ingram is 6.6 feet away. [MAN] LeBron Lowry misses. Rebound secured by Jimmy Poole.

[02:53] Team_031 possession (Score: 101-85)
Isaiah Ingram attempts a 3Pt. Wide open! Russell Quickley is 6.3 feet away. [ZONE] Isaiah Ingram misses. Offensive rebound by Isaiah Ingram! Isaiah Ingram kicks it out.

[02:38] Team_031 possession (Score: 101-85)
Kevin Morant attempts a 3Pt. Contested by Russell Quickley (3.9 feet, MAN). Kevin Morant misses. Offensive rebound by Jimmy Poole! Jimmy Poole kicks it out.

[02:27] Team_031 possession (Score: 101-85)
Miles Stewart attempts a Midrange. Contested by Scottie Ginobili (4.1 feet, ZONE). MILES STEWART MAKES IT!
Score: 101-87

[02:12] Team_059 possession (Score: 101-87)
Scottie Ginobili attempts a 3Pt. Wide open! Miles Stewart is 7.4 feet away. [ZONE] Scottie Ginobili misses. Rebound secured by Jimmy Poole.

[02:01] Team_031 possession (Score: 101-87)
Jimmy Poole attempts a Midrange. BLOCKED BY LEBRON LOWRY! Ball is loose! Rebound secured by Bones Middleton.

[01:48] Team_059 possession (Score: 101-87)
Bones Middleton drives to the basket... Bones Middleton throws a bad pass out of bounds! TURNOVER! (dead ball)

[01:34] Team_031 possession (Score: 101-87)
Kobe Randle attempts a 3Pt. Wide open! Russell Quickley is 8.0 feet away. [ZONE] KOBE RANDLE MAKES IT! Assist: Miles Stewart
Score: 101-90

[01:21] Team_059 possession (Score: 101-90)
Bones Middleton attempts a 3Pt. Contested by Miles Stewart (3.4 feet, ZONE). Bones Middleton misses. Rebound secured by Isaiah Ingram.

[01:10] Team_031 possession (Score: 101-90)
Kevin Morant attempts a Midrange. Wide open! Allen Giddey is 8.1 feet away. [ZONE] KEVIN MORANT MAKES IT! Assist: Kobe Randle
Score: 101-92

[00:54] Team_059 possession (Score: 101-92)
Allen Giddey attempts a 3Pt. Contested by Miles Stewart (5.0 feet, MAN). Allen Giddey misses. Rebound secured by Jimmy Poole.

[00:42] Team_031 possession (Score: 101-92)
Isaiah Ingram drives, Bones Middleton stays with him. Isaiah Ingram attempts a Dunk. Contested by Bones Middleton (5.8 feet, ZONE). Isaiah Ingram misses. Rebound secured by Bones Middleton.

[00:27] Team_059 possession (Score: 101-92)
LeBron Lowry attempts a Midrange. Wide open! Jimmy Poole is 8.5 feet away. [MAN] LeBron Lowry misses. Rebound secured by Kobe Randle.

[00:12] Team_031 possession (Score: 101-92)
Kevin Morant drives, Bones Middleton stays with him. Kevin Morant attempts a Dunk. Wide open! Bones Middleton is 7.0 feet away. [ZONE] KEVIN MORANT MAKES IT! Assist: Isaiah Ingram
Score: 101-94

================================================================================
                              4TH QUARTER COMPLETE                              
================================================================================

4TH QUARTER SCORE: Team_059 22, Team_031 21

BOX SCORE:
================================================================================

Team_059
--------------------------------------------------------------------------------
Player                MIN  PTS  REB  AST  TO      FG   FG%      3P   3P%
--------------------------------------------------------------------------------
Blake Tatum            28    5    0    0   0   2/3    66.7     0/0   0.0
Russell Quickley       20    5    0    0   0   2/4    50.0     0/0   0.0
Jarrett Smith          30    4    2    0   0   1/1   100.0     0/0   0.0
Nikola Jokic           30    2    1    1   0   1/1   100.0     0/0   0.0
John Iverson           25    2    3    0   0   1/1   100.0     0/0   0.0
Scottie Ginobili       20    2    1    0   0   1/2    50.0     0/0   0.0
Allen Giddey           23    2    0    1   0   1/2    50.0     0/0   0.0
Bam Wade               28    0    1    2   0   0/1     0.0     0/0   0.0
LeBron Lowry           19    0    2    2   0   0/2     0.0     0/0   0.0
Bones Middleton        19    0    2    0   0   0/2     0.0     0/0   0.0

TEAM: FG: 9/19 (47.4%), 3PT: 2/7 (28.6%), REB: 12 (4 off, 8 def), AST: 6, TO: 3
TEAM FOULS: 2


Team_031
--------------------------------------------------------------------------------
Player                MIN  PTS  REB  AST  TO      FG   FG%      3P   3P%
--------------------------------------------------------------------------------
Kobe Randle            23    7    2    1   0   3/3   100.0     0/0   0.0
Kevin Morant           20    6    0    0   0   3/3   100.0     0/0   0.0
Miles Stewart          20    4    0    1   0   2/2   100.0     0/0   0.0
Shai Durant            28    2    0    0   0   1/2    50.0     0/0   0.0
Isaiah Ingram          20    2    4    1   0   1/3    33.3     0/0   0.0
Immanuel James         25    0    0    0   0   0/1     0.0     0/0   0.0
Gary Morant            28    0    2    1   0   0/0     0.0     0/0   0.0
Pau Irving             28    0    0    0   0   0/1     0.0     0/0   0.0
Luka Sabonis           28    0    0    0   0   0/1     0.0     0/0   0.0
Jimmy Poole            20    0    4    1   0   0/2     0.0     0/0   0.0

TEAM: FG: 10/18 (55.6%), 3PT: 1/5 (20.0%), REB: 12 (2 off, 10 def), AST: 5, TO: 4
TEAM FOULS: 3

================================================================================

================================================================================
                               FULL GAME COMPLETE                               
================================================================================

FINAL SCORE: Team_059 101, Team_031 94

SCORING BY QUARTER:
--------------------------------------------------------------------------------
Team                     Q1     Q2     Q3     Q4    FINAL
--------------------------------------------------------------------------------
Team_059                 30     29     20     22      101
Team_031                 16     25     32     21       94
--------------------------------------------------------------------------------

FULL GAME BOX SCORE:
================================================================================

Team_059
--------------------------------------------------------------------------------
Player                MIN  PTS  REB  AST  TO      FG   FG%      3P   3P%      FT STL BLK
--------------------------------------------------------------------------------
Nikola Jokic           30   16    4    5   1   9/14   64.3   1/3    33.3   3/3     0   0
Jarrett Smith          30   12    8    2   1   4/4   100.0   0/0     0.0   1/1     2   1
Bam Wade               28   19    6    3   3   6/9    66.7   2/4    50.0  12/13    0   0
Blake Tatum            28    7    0    2   1   3/6    50.0   1/4    25.0   4/4     0   0
John Iverson           25    9   15    1   4   4/7    57.1   1/2    50.0   4/5     0   1
Allen Giddey           23   10    0    2   0   4/5    80.0   2/3    66.7   0/0     1   0
Russell Quickley       20    9    0    4   4   4/7    57.1   2/3    66.7   1/2     0   0
Scottie Ginobili       20   12    3    0   3   5/8    62.5   1/3    33.3   1/1     0   1
Bones Middleton        19    4    3    1   0   2/6    33.3   1/3    33.3   1/2     0   0
LeBron Lowry           19    2    5    3   1   1/4    25.0   0/0     0.0   0/0     1   1

TEAM: FG: 43/71 (60.6%), 3PT: 11/25 (44.0%), REB: 44 (10 off, 34 def), AST: 23, TO: 18


Team_031
--------------------------------------------------------------------------------
Player                MIN  PTS  REB  AST  TO      FG   FG%      3P   3P%      FT STL BLK
--------------------------------------------------------------------------------
Shai Durant            28    9    0    0   2   3/11   27.3   1/8    12.5   2/2     0   0
Gary Morant            28    9    7    2   4   4/8    50.0   1/4    25.0   0/1     0   1
Pau Irving             28   14    0    3   1   6/9    66.7   2/2   100.0   0/1     0   1
Luka Sabonis           28    2    6    4   0   2/5    40.0   0/0     0.0   0/1     1   2
Immanuel James         25    9    3    2   1   4/8    50.0   1/3    33.3   0/0     1   0
Kobe Randle            23   17    5    2   1   8/11   72.7   2/3    66.7   3/5     0   0
Kevin Morant           20    6    0    2   3   3/6    50.0   0/1     0.0   0/0     0   0
Isaiah Ingram          20    7    8    2   1   3/6    50.0   1/3    33.3   0/0     0   0
Miles Stewart          20    9    0    2   0   4/5    80.0   1/1   100.0   2/2     0   0
Jimmy Poole            20    4    9    2   1   2/5    40.0   0/1     0.0   0/0     0   0

TEAM: FG: 39/74 (52.7%), 3PT: 9/26 (34.6%), REB: 38 (10 off, 28 def), AST: 21, TO: 14

================================================================================
