================================================================================
                        FULL GAME - Team_071 vs Team_075                        
================================================================================

================================================================================
                       1ST QUARTER - Team_071 vs Team_075                       
================================================================================

[12:00] Team_071 possession (Score: 0-0)
Victor Anunoby makes the Midrange and draws the foul on Kawhi Ingram! And-1! Victor Anunoby to the line for 1. [Team fouls: 1] (Kawhi Ingram: 1 personal fouls)   FT 1/1: GOOD Victor Anunoby makes 1/1 from the line.
Score: 3-0

[11:43] Team_075 possession (Score: 3-0)
FOUL! Reach-in foul on Jimmy Simons during the drive. [Team fouls: 1] No free throws, side out. (Jimmy Simons: 1 personal fouls)

[11:28] Team_075 possession (Score: 3-0)
Derrick Stewart drives and kicks out. Derrick Stewart attempts a 3Pt. Contested by Victor Anunoby (3.7 feet, ZONE). Derrick Stewart misses. Offensive rebound by Kawhi Ingram! Kawhi Ingram kicks it out.

[11:13] Team_075 possession (Score: 3-0)
Kawhi Ingram attempts a 3Pt. Wide open! Victor Anunoby is 6.3 feet away. [MAN] Kawhi Ingram misses. Offensive rebound by Derrick Stewart! Derrick Stewart kicks it out.

[10:58] Team_075 possession (Score: 3-0)
Kawhi Ingram attempts a 3Pt. Contested by Victor Anunoby (4.5 feet, MAN). Kawhi Ingram misses. Rebound secured by Dejounte Paul.

[10:40] Team_071 possession (Score: 3-0)
FOUL! Reach-in foul on Derrick Stewart during the drive. [Team fouls: 2] No free throws, side out. (Derrick Stewart: 1 personal fouls)

[10:26] Team_071 possession (Score: 3-0)
Victor Anunoby drives to the basket... Victor Anunoby throws a bad pass! Stolen by Derrick Stewart! TURNOVER! (live ball)

[10:15] Team_075 possession (Score: 3-0)
Derrick Stewart attempts a 3Pt. Contested by Victor Anunoby (2.1 feet, ZONE). DERRICK STEWART MAKES IT! Assist: Myles Barrett
Score: 3-3

[10:00] Team_071 possession (Score: 3-3)
FOUL! Shooting foul on Derrick Stewart. Allen Williamson to the line for 2 free throws. [Team fouls: 3] (Derrick Stewart: 2 personal fouls)   FT 1/2: GOOD   FT 2/2: GOOD Allen Williamson makes 2/2 from the line.
Score: 5-3

[09:48] Team_075 possession (Score: 5-3)
Derrick Stewart attempts a 3Pt. Heavily contested by Jimmy Simons (0.8 feet, MAN)! Derrick Stewart misses. FOUL! Loose ball foul on Dejounte Paul during the rebound battle. [Team fouls: 2] No free throws, side out. (Dejounte Paul: 1 personal fouls)

[09:33] Team_075 possession (Score: 5-3)
Klay Jokic drives and kicks out. Larry McCollum attempts a 3Pt. Contested by Allen Williamson (3.9 feet, MAN). Larry McCollum misses. Rebound secured by Jimmy Simons.

[09:19] Team_071 possession (Score: 5-3)
Bam Iverson attempts a Midrange. Contested by Myles Barrett (5.9 feet, ZONE). BAM IVERSON MAKES IT! Assist: Victor Anunoby
Score: 7-3

[09:05] Team_075 possession (Score: 7-3)
Myles Barrett attempts a 3Pt. Contested by Victor Anunoby (3.6 feet, ZONE). Myles Barrett misses. Rebound secured by Bam Iverson.

[08:50] Team_071 possession (Score: 7-3)
Dejounte Paul attempts a Midrange. Contested by Kawhi Ingram (4.1 feet, ZONE). Dejounte Paul misses. Rebound secured by Kawhi Ingram.

[08:34] Team_075 possession (Score: 7-3)
Myles Barrett throws a bad pass out of bounds! TURNOVER! (dead ball)

[08:18] Team_071 possession (Score: 7-3)
Jimmy Simons attempts a Midrange. Contested by Derrick Stewart (5.1 feet, MAN). Jimmy Simons misses. Rebound secured by Derrick Stewart.

[08:04] Team_075 possession (Score: 7-3)
Kawhi Ingram drives and kicks out. Larry McCollum attempts a 3Pt. Wide open! Allen Williamson is 6.4 feet away. [MAN] LARRY MCCOLLUM MAKES IT! Assist: Kawhi Ingram
Score: 7-6

[07:49] Team_071 possession (Score: 7-6)
Victor Anunoby attempts a 3Pt. Wide open! Larry McCollum is 6.5 feet away. [ZONE] VICTOR ANUNOBY MAKES IT! Assist: Bam Iverson
Score: 10-6

[07:38] Team_075 possession (Score: 10-6)
Larry McCollum drives and kicks out. Kawhi Ingram attempts a Midrange. Contested by Victor Anunoby (2.6 feet, MAN). KAWHI INGRAM MAKES IT! Assist: Larry McCollum
Score: 10-8

[07:26] Team_071 possession (Score: 10-8)
Bam Iverson drives to the basket... FOUL! Offensive foul on Bam Iverson! Myles Barrett drew the charge! [Team fouls: 3] (Bam Iverson: 1 personal fouls) TURNOVER! (dead ball)

[07:12] Team_075 possession (Score: 10-8)
Derrick Stewart attempts a 3Pt. Wide open! Jimmy Simons is 6.3 feet away. [MAN] Derrick Stewart misses. Offensive rebound by Derrick Stewart! Derrick Stewart kicks it out.

[06:58] Team_075 possession (Score: 10-8)
Larry McCollum attempts a Layup. BLOCKED BY ALLEN WILLIAMSON! Ball is loose! Offensive rebound by Derrick Stewart! Derrick Stewart kicks it out.

[06:44] Team_075 possession (Score: 10-8)
Larry McCollum attempts a 3Pt. Contested by Jimmy Simons (5.9 feet, ZONE). Larry McCollum misses. Rebound secured by Jimmy Simons.

[06:27] Team_071 possession (Score: 10-8)
Dejounte Paul drives to the basket... Dejounte Paul loses the ball! Stripped by Derrick Stewart! TURNOVER! (live ball)

[06:13] Team_075 possession (Score: 10-8)
Derrick Stewart throws a bad pass! Stolen by Jimmy Simons! TURNOVER! (live ball)

[05:57] Team_071 possession (Score: 10-8)
Allen Williamson attempts a 3Pt. Contested by Larry McCollum (6.0 feet, MAN). ALLEN WILLIAMSON MAKES IT! Assist: Bam Iverson
Score: 13-8

[05:43] Team_075 possession (Score: 13-8)
Myles Barrett drives and kicks out. Larry McCollum attempts a Midrange. Contested by Bam Iverson (2.8 feet, ZONE). LARRY MCCOLLUM MAKES IT!
Score: 13-10

[05:25] Team_071 possession (Score: 13-10)
Bam Iverson attempts a 3Pt. Contested by Larry McCollum (2.7 feet, ZONE). BAM IVERSON MAKES IT! Assist: Allen Williamson
Score: 16-10

[05:12] Team_075 possession (Score: 16-10)
Kawhi Ingram attempts a 3Pt. Wide open! Victor Anunoby is 8.0 feet away. [MAN] KAWHI INGRAM MAKES IT! Assist: Myles Barrett
Score: 16-13

[04:57] Team_071 possession (Score: 16-13)
Jimmy Simons attempts a 3Pt. Contested by Larry McCollum (2.2 feet, ZONE). JIMMY SIMONS MAKES IT! Assist: Victor Anunoby
Score: 19-13

[04:42] Team_075 possession (Score: 19-13)
Klay Jokic drives to the basket... Klay Jokic throws a bad pass out of bounds! TURNOVER! (dead ball)

[04:26] Team_071 possession (Score: 19-13)
FOUL! Holding foul on Myles Barrett. [Team fouls: 4] No free throws, side out. (Myles Barrett: 1 personal fouls)

[04:13] Team_071 possession (Score: 19-13)
Dejounte Paul drives, picks up Derrick Stewart. Help arrives from Larry McCollum! Dejounte Paul attempts a Dunk. Contested by Larry McCollum (4.6 feet, ZONE). DEJOUNTE PAUL MAKES IT! Assist: Jimmy Simons
Score: 21-13

[04:04] Team_075 possession (Score: 21-13)
Klay Jokic attempts a Midrange. Wide open! Victor Anunoby is 6.7 feet away. [ZONE] KLAY JOKIC MAKES IT! Assist: Derrick Stewart
Score: 21-15

[03:45] Team_071 possession (Score: 21-15)
Bam Iverson attempts a 3Pt. BLOCKED BY LARRY MCCOLLUM! Ball goes out off Larry McCollum. Bam Iverson's ball!

[03:30] Team_071 possession (Score: 21-15)
Jimmy Simons attempts a 3Pt. Wide open! Larry McCollum is 7.4 feet away. [ZONE] JIMMY SIMONS MAKES IT! Assist: Dejounte Paul
Score: 24-15

[03:13] Team_075 possession (Score: 24-15)
Kawhi Ingram attempts a Midrange. Contested by Victor Anunoby (5.9 feet, MAN). KAWHI INGRAM MAKES IT! Assist: Klay Jokic
Score: 24-17

[03:04] Team_071 possession (Score: 24-17)
FOUL! Shooting foul on Derrick Stewart. Dejounte Paul to the line for 2 free throws. [BONUS: 5 team fouls] (Derrick Stewart: 3 personal fouls)   FT 1/2: MISS   FT 2/2: GOOD Dejounte Paul makes 1/2 from the line.
Score: 25-17

[02:54] Team_075 possession (Score: 25-17)
Kawhi Ingram makes the Layup and draws the foul on Dejounte Paul! And-1! Kawhi Ingram to the line for 1. [Team fouls: 4] (Dejounte Paul: 2 personal fouls)   FT 1/1: GOOD Kawhi Ingram makes 1/1 from the line.
Score: 25-20

[02:38] Team_071 possession (Score: 25-20)
Allen Williamson attempts a 3Pt. Wide open! Larry McCollum is 10.0 feet away. [MAN] ALLEN WILLIAMSON MAKES IT! Assist: Bam Iverson
Score: 28-20

[02:23] Team_075 possession (Score: 28-20)
Larry McCollum attempts a 3Pt. Contested by Allen Williamson (2.5 feet, ZONE). LARRY MCCOLLUM MAKES IT! Assist: Klay Jokic
Score: 28-23

[02:14] Team_071 possession (Score: 28-23)
Jimmy Simons attempts a 3Pt. Wide open! Myles Barrett is 8.4 feet away. [ZONE] Jimmy Simons misses. Rebound secured by Derrick Stewart.

[01:59] Team_075 possession (Score: 28-23)
Myles Barrett makes the Layup and draws the foul on Bam Iverson! And-1! Myles Barrett to the line for 1. [BONUS: 5 team fouls] (Bam Iverson: 2 personal fouls)   FT 1/1: GOOD Myles Barrett makes 1/1 from the line.
Score: 28-26

[01:47] Team_071 possession (Score: 28-26)
Victor Anunoby attempts a 3Pt. Contested by Myles Barrett (4.7 feet, ZONE). VICTOR ANUNOBY MAKES IT! Assist: Allen Williamson
Score: 31-26

[01:33] Team_075 possession (Score: 31-26)
Klay Jokic attempts a Midrange. Contested by Dejounte Paul (3.5 feet, MAN). KLAY JOKIC MAKES IT! Assist: Kawhi Ingram
Score: 31-28

[01:21] Team_071 possession (Score: 31-28)
Bam Iverson drives, Derrick Stewart stays with him. Bam Iverson attempts a Dunk. Contested by Derrick Stewart (2.4 feet, ZONE). BAM IVERSON MAKES IT! Assist: Victor Anunoby
Score: 33-28

[01:06] Team_075 possession (Score: 33-28)
Klay Jokic drives to the basket... Klay Jokic loses control! Ball rolls out of bounds! TURNOVER! (dead ball)

[01:06] Substitution (Team_071): Allen Williamson OUT → Evan Sexton IN (stamina_rule2)

[01:06] Substitution (Team_071): Victor Anunoby OUT → Paul Ball IN (stamina_rule2)

[01:06] Substitution (Team_071): Bam Iverson OUT → Immanuel Ginobili IN (stamina_rule2)

[01:06] Substitution (Team_071): Jimmy Simons OUT → Jordan Durant IN (stamina_rule2)

[01:06] Substitution (Team_071): Dejounte Paul OUT → Tyrese Brogdon IN (stamina_rule2)

[01:06] Substitution (Team_075): Larry McCollum OUT → D'Angelo Anunoby IN (stamina_rule2)

[01:06] Substitution (Team_075): Kawhi Ingram OUT → LeBron Ginobili IN (stamina_rule2)

[01:06] Substitution (Team_075): Myles Barrett OUT → Donovan Paul IN (stamina_rule2)

[01:06] Substitution (Team_075): Derrick Stewart OUT → Collin Duncan IN (stamina_rule2)

[01:06] Substitution (Team_075): Klay Jokic OUT → Kevin Towns IN (stamina_rule2)

[00:51] Team_071 possession (Score: 33-28)
Paul Ball attempts a 3Pt. Contested by D'Angelo Anunoby (4.6 feet, ZONE). Paul Ball misses. Offensive rebound by Immanuel Ginobili! Immanuel Ginobili kicks it out.

[00:41] Team_071 possession (Score: 33-28)
Jordan Durant attempts a Midrange. Wide open! Collin Duncan is 7.2 feet away. [ZONE] Jordan Durant misses. Rebound secured by Collin Duncan.

[00:24] Team_075 possession (Score: 33-28)
LeBron Ginobili attempts a Midrange. Contested by Immanuel Ginobili (4.0 feet, ZONE). LeBron Ginobili misses. Offensive rebound by Kevin Towns! Kevin Towns kicks it out.

[00:11] Team_075 possession (Score: 33-28)
Donovan Paul attempts a 3Pt. Wide open! Immanuel Ginobili is 7.6 feet away. [MAN] Donovan Paul misses. Rebound secured by Immanuel Ginobili.

[00:01] Team_071 possession (Score: 33-28)
Immanuel Ginobili attempts a 3Pt. Contested by Donovan Paul (3.5 feet, MAN). IMMANUEL GINOBILI MAKES IT! Assist: Paul Ball
Score: 36-28

================================================================================
                              1ST QUARTER COMPLETE                              
================================================================================

1ST QUARTER SCORE: Team_071 36, Team_075 28

BOX SCORE:
================================================================================

Team_071
--------------------------------------------------------------------------------
Player                MIN  PTS  REB  AST  TO      FG   FG%      3P   3P%
--------------------------------------------------------------------------------
Victor Anunoby         11    9    0    3   0   3/3   100.0     0/0   0.0
Allen Williamson       11    8    0    2   0   3/3   100.0     0/0   0.0
Bam Iverson            11    7    1    3   0   3/3   100.0     0/0   0.0
Jimmy Simons           11    6    2    1   0   2/4    50.0     0/0   0.0
Dejounte Paul          11    3    1    1   0   2/3    66.7     0/0   0.0
Immanuel Ginobili       1    3    2    0   0   1/1   100.0     0/0   0.0
Jordan Durant           1    0    0    0   0   0/1     0.0     0/0   0.0
Paul Ball               1    0    0    1   0   0/0     0.0     0/0   0.0

TEAM: FG: 14/18 (77.8%), 3PT: 8/9 (88.9%), REB: 6 (1 off, 5 def), AST: 11, TO: 3
TEAM FOULS: 5 [Team_075 in BONUS]


Team_075
--------------------------------------------------------------------------------
Player                MIN  PTS  REB  AST  TO      FG   FG%      3P   3P%
--------------------------------------------------------------------------------
Kawhi Ingram           11   10    3    2   0   4/5    80.0     0/0   0.0
Larry McCollum         11    8    0    1   0   3/4    75.0     0/0   0.0
Klay Jokic             11    4    0    2   0   2/3    66.7     0/0   0.0
Derrick Stewart        11    3    5    1   0   1/1   100.0     0/0   0.0
Myles Barrett          11    3    0    2   0   1/2    50.0     0/0   0.0
Collin Duncan           1    0    1    0   0   0/0     0.0     0/0   0.0
Kevin Towns             1    0    1    0   0   0/0     0.0     0/0   0.0
Donovan Paul            1    0    0    0   0   0/1     0.0     0/0   0.0

TEAM: FG: 11/16 (68.8%), 3PT: 3/7 (42.9%), REB: 10 (6 off, 4 def), AST: 8, TO: 4
TEAM FOULS: 5 [Team_071 in BONUS]

================================================================================

================================================================================
                       2ND QUARTER - Team_071 vs Team_075                       
================================================================================

[12:00] Team_071 possession (Score: 36-28)
Dejounte Paul throws a bad pass out of bounds! TURNOVER! (dead ball)

[11:44] Team_075 possession (Score: 36-28)
Larry McCollum attempts a 3Pt. Contested by Victor Anunoby (4.8 feet, ZONE). Larry McCollum misses. Rebound secured by Jimmy Simons.

[11:26] Team_071 possession (Score: 36-28)
Allen Williamson drives and kicks out. Allen Williamson attempts a Midrange. Wide open! Larry McCollum is 8.1 feet away. [MAN] ALLEN WILLIAMSON MAKES IT! Assist: Victor Anunoby
Score: 38-28

[11:09] Team_075 possession (Score: 38-28)
FOUL! Holding foul on Allen Williamson. [Team fouls: 1] No free throws, side out. (Allen Williamson: 1 personal fouls)

[10:56] Team_075 possession (Score: 38-28)
Klay Jokic drives and kicks out. Myles Barrett attempts a 3Pt. Heavily contested by Bam Iverson (1.0 feet, MAN)! MYLES BARRETT MAKES IT! Assist: Derrick Stewart
Score: 38-31

[10:44] Team_071 possession (Score: 38-31)
Dejounte Paul attempts a Midrange. Contested by Myles Barrett (4.0 feet, ZONE). DEJOUNTE PAUL MAKES IT!
Score: 40-31

[10:28] Team_075 possession (Score: 40-31)
Larry McCollum loses the ball! Stripped by Allen Williamson! TURNOVER! (live ball)

[10:14] Team_071 possession (Score: 40-31)
Jimmy Simons drives to the basket... Jimmy Simons throws a bad pass out of bounds! TURNOVER! (dead ball)

[10:14] Substitution (Team_071): Allen Williamson OUT → Evan Sexton IN (stamina_rule2)

[10:14] Substitution (Team_071): Victor Anunoby OUT → Paul Ball IN (stamina_rule2)

[10:14] Substitution (Team_071): Bam Iverson OUT → Immanuel Ginobili IN (stamina_rule2)

[10:14] Substitution (Team_071): Jimmy Simons OUT → Jordan Durant IN (stamina_rule2)

[10:14] Substitution (Team_071): Dejounte Paul OUT → Tyrese Brogdon IN (stamina_rule2)

[10:14] Substitution (Team_075): Larry McCollum OUT → D'Angelo Anunoby IN (stamina_rule2)

[10:14] Substitution (Team_075): Kawhi Ingram OUT → LeBron Ginobili IN (stamina_rule2)

[10:14] Substitution (Team_075): Myles Barrett OUT → Donovan Paul IN (stamina_rule2)

[10:14] Substitution (Team_075): Derrick Stewart OUT → Collin Duncan IN (stamina_rule2)

[10:14] Substitution (Team_075): Klay Jokic OUT → Kevin Towns IN (stamina_rule2)

[09:56] Team_075 possession (Score: 40-31)
FOUL! Holding foul on Paul Ball. [Team fouls: 2] No free throws, side out. (Paul Ball: 1 personal fouls)

[09:40] Team_075 possession (Score: 40-31)
LeBron Ginobili attempts a 3Pt. Contested by Paul Ball (3.1 feet, ZONE). LeBron Ginobili misses. Rebound secured by Jordan Durant.

[09:24] Team_071 possession (Score: 40-31)
Tyrese Brogdon drives to the basket... Tyrese Brogdon loses control! Ball rolls out of bounds! TURNOVER! (dead ball)

[09:06] Team_075 possession (Score: 40-31)
Kevin Towns attempts a Midrange. Wide open! Tyrese Brogdon is 8.6 feet away. [MAN] Kevin Towns misses. Rebound secured by Immanuel Ginobili.

[08:53] Team_071 possession (Score: 40-31)
Evan Sexton attempts a 3Pt. Contested by D'Angelo Anunoby (5.6 feet, MAN). Evan Sexton misses. Rebound secured by Collin Duncan.

[08:36] Team_075 possession (Score: 40-31)
Collin Duncan attempts a 3Pt. Wide open! Paul Ball is 7.4 feet away. [ZONE] Collin Duncan misses. Rebound secured by Jordan Durant.

[08:22] Team_071 possession (Score: 40-31)
Evan Sexton attempts a Midrange. Contested by D'Angelo Anunoby (5.9 feet, MAN). Evan Sexton misses. Rebound secured by Kevin Towns.

[08:05] Team_075 possession (Score: 40-31)
Donovan Paul drives, Tyrese Brogdon stays with him. Donovan Paul attempts a Layup. Contested by Tyrese Brogdon (3.9 feet, ZONE). DONOVAN PAUL MAKES IT! Assist: D'Angelo Anunoby
Score: 40-33

[07:52] Team_071 possession (Score: 40-33)
Immanuel Ginobili attempts a Layup. Contested by Donovan Paul (4.5 feet, MAN). IMMANUEL GINOBILI MAKES IT! Assist: Evan Sexton
Score: 42-33

[07:40] Team_075 possession (Score: 42-33)
Collin Duncan drives, picks up Tyrese Brogdon. Help arrives from Evan Sexton! Collin Duncan attempts a Dunk. Wide open! Evan Sexton is 6.4 feet away. [ZONE] COLLIN DUNCAN MAKES IT! Assist: LeBron Ginobili
Score: 42-35

[07:24] Team_071 possession (Score: 42-35)
Paul Ball drives, picks up LeBron Ginobili. Help arrives from D'Angelo Anunoby! Paul Ball attempts a Layup. Contested by D'Angelo Anunoby (3.3 feet, MAN). PAUL BALL MAKES IT!
Score: 44-35

[07:11] Team_075 possession (Score: 44-35)
LeBron Ginobili attempts a 3Pt. Wide open! Paul Ball is 7.2 feet away. [MAN] LeBron Ginobili misses. FOUL! Loose ball foul on Immanuel Ginobili during the rebound battle. [Team fouls: 3] No free throws, side out. (Immanuel Ginobili: 1 personal fouls)

[06:58] Team_075 possession (Score: 44-35)
D'Angelo Anunoby attempts a 3Pt. Contested by Paul Ball (5.5 feet, ZONE). D'Angelo Anunoby misses. Offensive rebound by Collin Duncan! Collin Duncan kicks it out.

[06:40] Team_075 possession (Score: 44-35)
LeBron Ginobili throws a bad pass! Stolen by Paul Ball! TURNOVER! (live ball)

[06:25] Team_071 possession (Score: 44-35)
Immanuel Ginobili drives and kicks out. Paul Ball attempts a 3Pt. Contested by D'Angelo Anunoby (4.8 feet, ZONE). PAUL BALL MAKES IT! Assist: Immanuel Ginobili
Score: 47-35

[06:14] Team_075 possession (Score: 47-35)
FOUL! Holding foul on Immanuel Ginobili. [Team fouls: 4] No free throws, side out. (Immanuel Ginobili: 2 personal fouls)

[05:58] Team_075 possession (Score: 47-35)
FOUL! Reach-in foul on Jordan Durant during the drive. [IN THE BONUS! 5 team fouls] Collin Duncan to the line for 2 free throws. (Jordan Durant: 1 personal fouls)   FT 1/2: MISS   FT 2/2: MISS Collin Duncan makes 0/2 from the line. Offensive rebound by Collin Duncan! Collin Duncan kicks it out.

[05:46] Team_075 possession (Score: 47-35)
Donovan Paul throws a bad pass! Stolen by Immanuel Ginobili! TURNOVER! (live ball)

[05:29] Team_071 possession (Score: 47-35)
FOUL! Shooting foul on LeBron Ginobili. Evan Sexton to the line for 2 free throws. [Team fouls: 1] (LeBron Ginobili: 1 personal fouls)   FT 1/2: GOOD   FT 2/2: GOOD Evan Sexton makes 2/2 from the line.
Score: 49-35

[05:14] Team_075 possession (Score: 49-35)
FOUL! Offensive foul on D'Angelo Anunoby! Evan Sexton drew the charge! [Team fouls: 2] (D'Angelo Anunoby: 1 personal fouls) TURNOVER! (dead ball)

[04:58] Team_071 possession (Score: 49-35)
Evan Sexton throws a bad pass out of bounds! TURNOVER! (dead ball)

[04:44] Team_075 possession (Score: 49-35)
Donovan Paul attempts a 3Pt. Wide open! Immanuel Ginobili is 6.5 feet away. [MAN] DONOVAN PAUL MAKES IT! Assist: LeBron Ginobili
Score: 49-38

[04:27] Team_071 possession (Score: 49-38)
Paul Ball attempts a 3Pt. Contested by LeBron Ginobili (5.7 feet, MAN). Paul Ball misses. Offensive rebound by Jordan Durant! Jordan Durant kicks it out.

[04:14] Team_071 possession (Score: 49-38)
FOUL! Offensive foul on Paul Ball! LeBron Ginobili drew the charge! [Team fouls: 6] (Paul Ball: 2 personal fouls) TURNOVER! (dead ball)

[04:00] Team_075 possession (Score: 49-38)
LeBron Ginobili attempts a Layup. Contested by Paul Ball (3.3 feet, MAN). LEBRON GINOBILI MAKES IT! Assist: Collin Duncan
Score: 49-40

[03:48] Team_071 possession (Score: 49-40)
FOUL! Reach-in foul on Kevin Towns during the drive. [Team fouls: 3] No free throws, side out. (Kevin Towns: 1 personal fouls)

[03:33] Team_071 possession (Score: 49-40)
Jordan Durant drives to the basket... Jordan Durant throws a bad pass! Stolen by Collin Duncan! TURNOVER! (live ball)

[03:20] Team_075 possession (Score: 49-40)
Donovan Paul drives and kicks out. D'Angelo Anunoby attempts a Midrange. Wide open! Jordan Durant is 7.0 feet away. [ZONE] D'Angelo Anunoby misses. Rebound secured by Immanuel Ginobili.

[03:07] Team_071 possession (Score: 49-40)
Jordan Durant attempts a Layup. BLOCKED BY COLLIN DUNCAN! Ball is loose! Rebound secured by Kevin Towns.

[02:53] Team_075 possession (Score: 49-40)
D'Angelo Anunoby drives to the basket... D'Angelo Anunoby commits a violation (traveling/carry)! TURNOVER! (dead ball)

[02:38] Team_071 possession (Score: 49-40)
Jordan Durant drives and kicks out. Jordan Durant makes the 3Pt and draws the foul on Donovan Paul! And-1! Jordan Durant to the line for 1. [Team fouls: 4] (Donovan Paul: 1 personal fouls)   FT 1/1: GOOD Jordan Durant makes 1/1 from the line.
Score: 53-40

[02:23] Team_075 possession (Score: 53-40)
LeBron Ginobili attempts a Midrange. Wide open! Evan Sexton is 8.7 feet away. [ZONE] LEBRON GINOBILI MAKES IT!
Score: 53-42

[02:09] Team_071 possession (Score: 53-42)
Paul Ball attempts a Layup. BLOCKED BY LEBRON GINOBILI! Ball deflects out of bounds off Paul Ball.

[01:57] Team_075 possession (Score: 53-42)
D'Angelo Anunoby attempts a 3Pt. Contested by Paul Ball (5.9 feet, ZONE). D'ANGELO ANUNOBY MAKES IT! Assist: Collin Duncan
Score: 53-45

[01:42] Team_071 possession (Score: 53-45)
Immanuel Ginobili drives and kicks out. Paul Ball attempts a 3Pt. Contested by D'Angelo Anunoby (5.2 feet, ZONE). PAUL BALL MAKES IT! Assist: Evan Sexton
Score: 56-45

[01:25] Team_075 possession (Score: 56-45)
FOUL! Shooting foul on Paul Ball. Donovan Paul to the line for 3 free throws. [BONUS: 7 team fouls] (Paul Ball: 3 personal fouls)   FT 1/3: GOOD   FT 2/3: GOOD   FT 3/3: GOOD Donovan Paul makes 3/3 from the line.
Score: 56-48

[01:15] Team_071 possession (Score: 56-48)
Paul Ball attempts a 3Pt. Contested by D'Angelo Anunoby (3.5 feet, ZONE). PAUL BALL MAKES IT! Assist: Evan Sexton
Score: 59-48

[01:06] Team_075 possession (Score: 59-48)
Collin Duncan drives and kicks out. Kevin Towns attempts a 3Pt. Wide open! Tyrese Brogdon is 7.7 feet away. [MAN] Kevin Towns misses. Rebound secured by Jordan Durant.

[00:57] Team_071 possession (Score: 59-48)
Paul Ball makes the Layup and draws the foul on Kevin Towns! And-1! Paul Ball to the line for 1. [BONUS: 5 team fouls] (Kevin Towns: 2 personal fouls)   FT 1/1: GOOD Paul Ball makes 1/1 from the line.
Score: 62-48

[00:45] Team_075 possession (Score: 62-48)
Collin Duncan attempts a Layup. Contested by Tyrese Brogdon (2.2 feet, ZONE). COLLIN DUNCAN MAKES IT!
Score: 62-50

[00:34] Team_071 possession (Score: 62-50)
Paul Ball drives and kicks out. Tyrese Brogdon attempts a Midrange. Contested by Kevin Towns (4.8 feet, MAN). Tyrese Brogdon misses. Rebound secured by Kevin Towns.

[00:21] Team_075 possession (Score: 62-50)
Donovan Paul drives, picks up Tyrese Brogdon. Help arrives from Evan Sexton! Donovan Paul attempts a Dunk. Heavily contested by Evan Sexton (1.0 feet, ZONE)! DONOVAN PAUL MAKES IT! Assist: Kevin Towns
Score: 62-52

[00:04] Team_071 possession (Score: 62-52)
Evan Sexton attempts a 3Pt. Contested by D'Angelo Anunoby (3.8 feet, ZONE). EVAN SEXTON MAKES IT! Assist: Immanuel Ginobili
Score: 65-52

================================================================================
                              2ND QUARTER COMPLETE                              
================================================================================

2ND QUARTER SCORE: Team_071 29, Team_075 24

BOX SCORE:
================================================================================

Team_071
--------------------------------------------------------------------------------
Player                MIN  PTS  REB  AST  TO      FG   FG%      3P   3P%
--------------------------------------------------------------------------------
Paul Ball              11   14    0    0   0   5/7    71.4     0/0   0.0
Evan Sexton            11    5    0    3   0   2/4    50.0     0/0   0.0
Jordan Durant          11    4    4    0   0   1/2    50.0     0/0   0.0
Allen Williamson       13    2    0    0   0   1/1   100.0     0/0   0.0
Dejounte Paul          13    2    0    0   0   1/1   100.0     0/0   0.0
Immanuel Ginobili      11    2    2    2   0   1/1   100.0     0/0   0.0
Jimmy Simons           13    0    1    0   0   0/0     0.0     0/0   0.0
Victor Anunoby         13    0    0    1   0   0/0     0.0     0/0   0.0

TEAM: FG: 11/16 (68.8%), 3PT: 2/3 (66.7%), REB: 7 (1 off, 6 def), AST: 6, TO: 6
TEAM FOULS: 7 [Team_075 in BONUS]


Team_075
--------------------------------------------------------------------------------
Player                MIN  PTS  REB  AST  TO      FG   FG%      3P   3P%
--------------------------------------------------------------------------------
Donovan Paul           11   10    0    0   0   4/5    80.0     0/0   0.0
LeBron Ginobili        11    4    0    2   0   2/3    66.7     0/0   0.0
Collin Duncan          11    4    4    2   0   2/4    50.0     0/0   0.0
Myles Barrett          13    3    0    0   0   1/1   100.0     0/0   0.0
D'Angelo Anunoby       11    3    0    1   0   1/1   100.0     0/0   0.0
Larry McCollum         13    0    0    0   0   0/1     0.0     0/0   0.0
Derrick Stewart        13    0    0    1   0   0/0     0.0     0/0   0.0
Kevin Towns            11    0    3    1   0   0/1     0.0     0/0   0.0

TEAM: FG: 10/16 (62.5%), 3PT: 3/6 (50.0%), REB: 7 (3 off, 4 def), AST: 7, TO: 5
TEAM FOULS: 5 [Team_071 in BONUS]

================================================================================

================================================================================
                       3RD QUARTER - Team_071 vs Team_075                       
================================================================================

[12:00] Team_071 possession (Score: 65-52)
FOUL! Reach-in foul on Derrick Stewart during the drive. [Team fouls: 1] No free throws, side out. (Derrick Stewart: 1 personal fouls)

[11:43] Team_071 possession (Score: 65-52)
Victor Anunoby attempts a Layup. Heavily contested by Derrick Stewart (0.5 feet, ZONE)! VICTOR ANUNOBY MAKES IT! Assist: Jimmy Simons
Score: 67-52

[11:25] Team_075 possession (Score: 67-52)
FOUL! Holding foul on Bam Iverson. [Team fouls: 1] No free throws, side out. (Bam Iverson: 1 personal fouls)

[11:14] Team_075 possession (Score: 67-52)
FOUL! Offensive foul on Kawhi Ingram! Victor Anunoby drew the charge! [Team fouls: 2] (Kawhi Ingram: 1 personal fouls) TURNOVER! (dead ball)

[10:55] Team_071 possession (Score: 67-52)
Dejounte Paul drives, picks up Derrick Stewart. Help arrives from Larry McCollum! Dejounte Paul attempts a Layup. Contested by Larry McCollum (3.5 feet, ZONE). DEJOUNTE PAUL MAKES IT! Assist: Bam Iverson
Score: 69-52

[10:40] Team_075 possession (Score: 69-52)
Derrick Stewart attempts a Midrange. Wide open! Bam Iverson is 6.9 feet away. [ZONE] DERRICK STEWART MAKES IT!
Score: 69-54

[10:29] Team_071 possession (Score: 69-54)
Bam Iverson attempts a 3Pt. Contested by Larry McCollum (5.6 feet, ZONE). Bam Iverson misses. Offensive rebound by Jimmy Simons! Jimmy Simons kicks it out.

[10:19] Team_071 possession (Score: 69-54)
Bam Iverson drives, picks up Derrick Stewart. Help arrives from Larry McCollum! Bam Iverson attempts a Layup. Contested by Larry McCollum (3.1 feet, ZONE). BAM IVERSON MAKES IT! Assist: Allen Williamson
Score: 71-54

[10:06] Team_075 possession (Score: 71-54)
Kawhi Ingram drives and kicks out. Klay Jokic attempts a 3Pt. Contested by Victor Anunoby (2.7 feet, ZONE). Klay Jokic misses. Rebound secured by Dejounte Paul.

[09:53] Team_071 possession (Score: 71-54)
Allen Williamson throws a bad pass! Stolen by Larry McCollum! TURNOVER! (live ball)

[09:37] Team_075 possession (Score: 71-54)
Kawhi Ingram attempts a 3Pt. Heavily contested by Victor Anunoby (0.5 feet, MAN)! Kawhi Ingram misses. FOUL! Loose ball foul on Dejounte Paul during the rebound battle. [Team fouls: 2] No free throws, side out. (Dejounte Paul: 1 personal fouls)

[09:18] Team_075 possession (Score: 71-54)
Larry McCollum makes the Layup and draws the foul on Allen Williamson! And-1! Larry McCollum to the line for 1. [Team fouls: 3] (Allen Williamson: 1 personal fouls)   FT 1/1: GOOD Larry McCollum makes 1/1 from the line.
Score: 71-57

[09:04] Team_071 possession (Score: 71-57)
Victor Anunoby attempts a Midrange. Wide open! Kawhi Ingram is 6.1 feet away. [MAN] Victor Anunoby misses. Rebound secured by Kawhi Ingram.

[08:53] Team_075 possession (Score: 71-57)
Derrick Stewart attempts a 3Pt. Wide open! Victor Anunoby is 6.6 feet away. [ZONE] Derrick Stewart misses. Rebound secured by Dejounte Paul.

[08:37] Team_071 possession (Score: 71-57)
Dejounte Paul drives and kicks out. Jimmy Simons attempts a 3Pt. BLOCKED BY DERRICK STEWART! Ball is loose! Offensive rebound by Jimmy Simons! Jimmy Simons kicks it out.

[08:19] Team_071 possession (Score: 71-57)
Dejounte Paul drives, Klay Jokic stays with him. Dejounte Paul attempts a Dunk. Contested by Klay Jokic (3.3 feet, MAN). DEJOUNTE PAUL MAKES IT!
Score: 73-57

[08:05] Team_075 possession (Score: 73-57)
Myles Barrett loses the ball! Stripped by Bam Iverson! TURNOVER! (live ball)

[07:53] Team_071 possession (Score: 73-57)
Bam Iverson drives, Myles Barrett stays with him. Bam Iverson attempts a Layup. Wide open! Myles Barrett is 8.2 feet away. [MAN] BAM IVERSON MAKES IT!
Score: 75-57

[07:35] Team_075 possession (Score: 75-57)
Kawhi Ingram attempts a Midrange. Wide open! Victor Anunoby is 6.3 feet away. [ZONE] Kawhi Ingram misses. Offensive rebound by Kawhi Ingram! Kawhi Ingram kicks it out.

[07:22] Team_075 possession (Score: 75-57)
Klay Jokic drives, picks up Dejounte Paul. Help arrives from Allen Williamson! Klay Jokic attempts a Layup. Contested by Allen Williamson (4.9 feet, ZONE). KLAY JOKIC MAKES IT!
Score: 75-59

[07:09] Team_071 possession (Score: 75-59)
FOUL! Reach-in foul on Derrick Stewart during the drive. [Team fouls: 3] No free throws, side out. (Derrick Stewart: 2 personal fouls)

[06:58] Team_071 possession (Score: 75-59)
Bam Iverson attempts a Midrange. Wide open! Myles Barrett is 6.5 feet away. [MAN] Bam Iverson misses. Rebound secured by Klay Jokic.

[06:43] Team_075 possession (Score: 75-59)
Derrick Stewart attempts a Layup. Heavily contested by Jimmy Simons (1.1 feet, MAN)! Derrick Stewart misses. Rebound secured by Jimmy Simons.

[06:30] Team_071 possession (Score: 75-59)
Allen Williamson attempts a 3Pt. Contested by Larry McCollum (5.4 feet, ZONE). Allen Williamson misses. Rebound secured by Klay Jokic.

[06:15] Team_075 possession (Score: 75-59)
Myles Barrett loses the ball! Stripped by Bam Iverson! TURNOVER! (live ball)

[06:04] Team_071 possession (Score: 75-59)
Bam Iverson drives and kicks out. Victor Anunoby attempts a Midrange. Contested by Kawhi Ingram (3.9 feet, MAN). VICTOR ANUNOBY MAKES IT! Assist: Allen Williamson
Score: 77-59

[05:46] Team_075 possession (Score: 77-59)
Larry McCollum attempts a 3Pt. Contested by Victor Anunoby (4.0 feet, ZONE). Larry McCollum misses. Rebound secured by Jimmy Simons.

[05:33] Team_071 possession (Score: 77-59)
Allen Williamson attempts a 3Pt. Wide open! Larry McCollum is 8.2 feet away. [ZONE] ALLEN WILLIAMSON MAKES IT! Assist: Victor Anunoby
Score: 80-59

[05:18] Team_075 possession (Score: 80-59)
Kawhi Ingram attempts a Layup. Heavily contested by Dejounte Paul (1.7 feet, ZONE)! KAWHI INGRAM MAKES IT! Assist: Myles Barrett
Score: 80-61

[05:00] Team_071 possession (Score: 80-61)
Bam Iverson attempts a 3Pt. Contested by Larry McCollum (3.6 feet, ZONE). Bam Iverson misses. Rebound secured by Derrick Stewart.

[04:44] Team_075 possession (Score: 80-61)
Larry McCollum attempts a 3Pt. Wide open! Victor Anunoby is 6.6 feet away. [ZONE] Larry McCollum misses. Rebound secured by Jimmy Simons.

[04:29] Team_071 possession (Score: 80-61)
Victor Anunoby attempts a Midrange. Wide open! Kawhi Ingram is 7.6 feet away. [MAN] Victor Anunoby misses. Rebound secured by Kawhi Ingram.

[04:10] Team_075 possession (Score: 80-61)
Klay Jokic attempts a 3Pt. Wide open! Dejounte Paul is 6.6 feet away. [MAN] KLAY JOKIC MAKES IT! Assist: Myles Barrett
Score: 80-64

[04:00] Team_071 possession (Score: 80-64)
Dejounte Paul throws a bad pass! Stolen by Klay Jokic! TURNOVER! (live ball)

[03:44] Team_075 possession (Score: 80-64)
Klay Jokic drives and kicks out. Kawhi Ingram attempts a 3Pt. Contested by Allen Williamson (4.0 feet, ZONE). Kawhi Ingram misses. Offensive rebound by Derrick Stewart! Derrick Stewart kicks it out.

[03:30] Team_075 possession (Score: 80-64)
Kawhi Ingram loses control! Ball rolls out of bounds! TURNOVER! (dead ball)

[03:17] Team_071 possession (Score: 80-64)
Allen Williamson attempts a 3Pt. Contested by Larry McCollum (5.2 feet, ZONE). ALLEN WILLIAMSON MAKES IT!
Score: 83-64

[03:01] Team_075 possession (Score: 83-64)
Larry McCollum drives, picks up Dejounte Paul. Help arrives from Allen Williamson! Larry McCollum attempts a Layup. Contested by Allen Williamson (4.0 feet, ZONE). LARRY MCCOLLUM MAKES IT!
Score: 83-66

[02:48] Team_071 possession (Score: 83-66)
Victor Anunoby attempts a Layup. Heavily contested by Derrick Stewart (1.9 feet, ZONE)! VICTOR ANUNOBY MAKES IT! Assist: Dejounte Paul
Score: 85-66

[02:33] Team_075 possession (Score: 85-66)
Kawhi Ingram attempts a 3Pt. Contested by Victor Anunoby (2.0 feet, ZONE). Kawhi Ingram misses. Offensive rebound by Derrick Stewart! Derrick Stewart kicks it out.

[02:16] Team_075 possession (Score: 85-66)
Derrick Stewart attempts a 3Pt. Wide open! Victor Anunoby is 7.3 feet away. [ZONE] Derrick Stewart misses. Rebound secured by Jimmy Simons.

[02:03] Team_071 possession (Score: 85-66)
Bam Iverson makes the Layup and draws the foul on Myles Barrett! And-1! Bam Iverson to the line for 1. [Team fouls: 4] (Myles Barrett: 1 personal fouls)   FT 1/1: GOOD Bam Iverson makes 1/1 from the line.
Score: 88-66

[01:46] Team_075 possession (Score: 88-66)
Klay Jokic attempts a Midrange. Contested by Jimmy Simons (5.5 feet, ZONE). Klay Jokic misses. Rebound secured by Bam Iverson.

[01:32] Team_071 possession (Score: 88-66)
Victor Anunoby drives and kicks out. Dejounte Paul attempts a 3Pt. Wide open! Klay Jokic is 7.8 feet away. [MAN] Dejounte Paul misses. Rebound secured by Derrick Stewart.

[01:13] Team_075 possession (Score: 88-66)
Klay Jokic drives, picks up Dejounte Paul. Help arrives from Allen Williamson! Klay Jokic attempts a Layup. Wide open! Allen Williamson is 6.9 feet away. [MAN] Klay Jokic misses. Offensive rebound by Derrick Stewart! Derrick Stewart kicks it out.

[00:58] Team_075 possession (Score: 88-66)
FOUL! Shooting foul on Allen Williamson. Larry McCollum to the line for 2 free throws. [Team fouls: 4] (Allen Williamson: 2 personal fouls)   FT 1/2: GOOD   FT 2/2: GOOD Larry McCollum makes 2/2 from the line.
Score: 88-68

[00:45] Team_071 possession (Score: 88-68)
Jimmy Simons throws a bad pass out of bounds! TURNOVER! (dead ball)

[00:45] Substitution (Team_071): Allen Williamson OUT → Evan Sexton IN (stamina_rule2)

[00:45] Substitution (Team_071): Victor Anunoby OUT → Paul Ball IN (stamina_rule2)

[00:45] Substitution (Team_071): Bam Iverson OUT → Immanuel Ginobili IN (stamina_rule2)

[00:45] Substitution (Team_071): Jimmy Simons OUT → Jordan Durant IN (stamina_rule2)

[00:45] Substitution (Team_071): Dejounte Paul OUT → Tyrese Brogdon IN (stamina_rule2)

[00:45] Substitution (Team_075): Larry McCollum OUT → D'Angelo Anunoby IN (stamina_rule2)

[00:45] Substitution (Team_075): Kawhi Ingram OUT → LeBron Ginobili IN (stamina_rule2)

[00:45] Substitution (Team_075): Myles Barrett OUT → Donovan Paul IN (stamina_rule2)

[00:45] Substitution (Team_075): Derrick Stewart OUT → Collin Duncan IN (stamina_rule2)

[00:45] Substitution (Team_075): Klay Jokic OUT → Kevin Towns IN (stamina_rule2)

[00:35] Team_075 possession (Score: 88-68)
Kevin Towns attempts a Layup. BLOCKED BY TYRESE BROGDON! Ball is loose! Rebound secured by Jordan Durant.

[00:20] Team_071 possession (Score: 88-68)
Tyrese Brogdon attempts a 3Pt. Contested by Kevin Towns (5.7 feet, MAN). Tyrese Brogdon misses. Rebound secured by Kevin Towns.

[00:03] Team_075 possession (Score: 88-68)
Collin Duncan attempts a Midrange. Wide open! Jordan Durant is 6.2 feet away. [MAN] Collin Duncan misses. Rebound secured by Jordan Durant.

================================================================================
                              3RD QUARTER COMPLETE                              
================================================================================

3RD QUARTER SCORE: Team_071 23, Team_075 16

BOX SCORE:
================================================================================

Team_071
--------------------------------------------------------------------------------
Player                MIN  PTS  REB  AST  TO      FG   FG%      3P   3P%
--------------------------------------------------------------------------------
Bam Iverson            25    7    1    1   0   3/5    60.0     0/0   0.0
Victor Anunoby         25    6    0    1   0   3/6    50.0     0/0   0.0
Allen Williamson       25    6    0    2   0   2/3    66.7     0/0   0.0
Dejounte Paul          25    4    2    1   0   2/2   100.0     0/0   0.0
Jimmy Simons           25    0    6    1   0   0/0     0.0     0/0   0.0
Jordan Durant          12    0    2    0   0   0/0     0.0     0/0   0.0
Tyrese Brogdon         12    0    0    0   0   0/1     0.0     0/0   0.0

TEAM: FG: 10/17 (58.8%), 3PT: 2/5 (40.0%), REB: 11 (2 off, 9 def), AST: 6, TO: 3
TEAM FOULS: 4


Team_075
--------------------------------------------------------------------------------
Player                MIN  PTS  REB  AST  TO      FG   FG%      3P   3P%
--------------------------------------------------------------------------------
Larry McCollum         25    7    0    0   0   3/5    60.0     0/0   0.0
Klay Jokic             25    5    2    0   0   2/3    66.7     0/0   0.0
Derrick Stewart        25    2    6    0   0   1/4    25.0     0/0   0.0
Kawhi Ingram           25    2    3    0   0   1/2    50.0     0/0   0.0
Myles Barrett          25    0    0    2   0   0/0     0.0     0/0   0.0
Kevin Towns            12    0    1    0   0   0/1     0.0     0/0   0.0
Collin Duncan          12    0    0    0   0   0/1     0.0     0/0   0.0

TEAM: FG: 7/16 (43.8%), 3PT: 1/5 (20.0%), REB: 12 (5 off, 7 def), AST: 2, TO: 4
TEAM FOULS: 4

================================================================================

================================================================================
                       4TH QUARTER - Team_071 vs Team_075                       
================================================================================

[12:00] Team_071 possession (Score: 88-68)
Jimmy Simons makes the 3Pt and draws the foul on Derrick Stewart! And-1! Jimmy Simons to the line for 1. [Team fouls: 1] (Derrick Stewart: 1 personal fouls)   FT 1/1: MISS Jimmy Simons makes 0/1 from the line. Rebound secured by Kawhi Ingram.
Score: 91-68

[11:42] Team_075 possession (Score: 91-68)
Kawhi Ingram makes the Dunk and draws the foul on Dejounte Paul! And-1! Kawhi Ingram to the line for 1. [Team fouls: 1] (Dejounte Paul: 1 personal fouls)   FT 1/1: GOOD Kawhi Ingram makes 1/1 from the line.
Score: 91-71

[11:26] Team_071 possession (Score: 91-71)
FOUL! Shooting foul on Derrick Stewart. Jimmy Simons to the line for 2 free throws. [Team fouls: 2] (Derrick Stewart: 2 personal fouls)   FT 1/2: GOOD   FT 2/2: GOOD Jimmy Simons makes 2/2 from the line.
Score: 93-71

[11:11] Team_075 possession (Score: 93-71)
Kawhi Ingram drives and kicks out. Kawhi Ingram attempts a Midrange. Contested by Jimmy Simons (4.7 feet, ZONE). Kawhi Ingram misses. Rebound secured by Bam Iverson.

[11:00] Team_071 possession (Score: 93-71)
Allen Williamson drives, Derrick Stewart stays with him. Allen Williamson attempts a Layup. Contested by Derrick Stewart (4.8 feet, ZONE). ALLEN WILLIAMSON MAKES IT!
Score: 95-71

[10:46] Team_075 possession (Score: 95-71)
FOUL! Reach-in foul on Dejounte Paul during the drive. [Team fouls: 2] No free throws, side out. (Dejounte Paul: 2 personal fouls)

[10:32] Team_075 possession (Score: 95-71)
FOUL! Shooting foul on Dejounte Paul. Klay Jokic to the line for 2 free throws. [Team fouls: 3] (Dejounte Paul: 3 personal fouls)   FT 1/2: GOOD   FT 2/2: GOOD Klay Jokic makes 2/2 from the line.
Score: 95-73

[10:16] Team_071 possession (Score: 95-73)
Dejounte Paul attempts a Layup. Contested by Klay Jokic (5.7 feet, MAN). DEJOUNTE PAUL MAKES IT! Assist: Bam Iverson
Score: 97-73

[10:00] Team_075 possession (Score: 97-73)
Kawhi Ingram attempts a Midrange. Contested by Victor Anunoby (3.9 feet, ZONE). Kawhi Ingram misses. Rebound secured by Jimmy Simons.

[09:45] Team_071 possession (Score: 97-73)
FOUL! Holding foul on Larry McCollum. [Team fouls: 3] No free throws, side out. (Larry McCollum: 1 personal fouls)

[09:34] Team_071 possession (Score: 97-73)
FOUL! Shooting foul on Larry McCollum. Jimmy Simons to the line for 3 free throws. [Team fouls: 4] (Larry McCollum: 2 personal fouls)   FT 1/3: GOOD   FT 2/3: GOOD   FT 3/3: MISS Jimmy Simons makes 2/3 from the line. Offensive rebound by Jimmy Simons! Jimmy Simons kicks it out.
Score: 99-73

[09:19] Team_071 possession (Score: 99-73)
Jimmy Simons throws a bad pass! Stolen by Derrick Stewart! TURNOVER! (live ball)

[09:05] Team_075 possession (Score: 99-73)
Klay Jokic attempts a Midrange. Wide open! Victor Anunoby is 6.9 feet away. [ZONE] Klay Jokic misses. Rebound secured by Dejounte Paul.

[08:53] Team_071 possession (Score: 99-73)
Jimmy Simons drives and kicks out. Bam Iverson attempts a 3Pt. Wide open! Myles Barrett is 9.0 feet away. [MAN] Bam Iverson misses. Offensive rebound by Dejounte Paul! Dejounte Paul kicks it out.

[08:41] Team_071 possession (Score: 99-73)
Jimmy Simons drives, picks up Derrick Stewart. Help arrives from Larry McCollum! Jimmy Simons attempts a Layup. Contested by Larry McCollum (4.1 feet, ZONE). JIMMY SIMONS MAKES IT!
Score: 101-73

[08:24] Team_075 possession (Score: 101-73)
Klay Jokic drives and kicks out. FOUL! Shooting foul on Jimmy Simons. Derrick Stewart to the line for 2 free throws. [Team fouls: 4] (Jimmy Simons: 1 personal fouls)   FT 1/2: GOOD   FT 2/2: GOOD Derrick Stewart makes 2/2 from the line.
Score: 101-75

[08:10] Team_071 possession (Score: 101-75)
Dejounte Paul makes the Midrange and draws the foul on Kawhi Ingram! And-1! Dejounte Paul to the line for 1. [BONUS: 5 team fouls] (Kawhi Ingram: 1 personal fouls)   FT 1/1: MISS Dejounte Paul makes 0/1 from the line. Rebound secured by Derrick Stewart.
Score: 103-75

[07:59] Team_075 possession (Score: 103-75)
Larry McCollum attempts a Layup. Heavily contested by Dejounte Paul (1.4 feet, ZONE)! LARRY MCCOLLUM MAKES IT! Assist: Kawhi Ingram
Score: 103-77

[07:46] Team_071 possession (Score: 103-77)
Victor Anunoby attempts a 3Pt. Wide open! Larry McCollum is 6.6 feet away. [ZONE] Victor Anunoby misses. Offensive rebound by Dejounte Paul! Dejounte Paul kicks it out.

[07:32] Team_071 possession (Score: 103-77)
Victor Anunoby attempts a 3Pt. Contested by Kawhi Ingram (5.1 feet, MAN). Victor Anunoby misses. Offensive rebound by Jimmy Simons! Jimmy Simons kicks it out.

[07:14] Team_071 possession (Score: 103-77)
Dejounte Paul attempts a Midrange. Wide open! Kawhi Ingram is 6.6 feet away. [ZONE] DEJOUNTE PAUL MAKES IT! Assist: Bam Iverson
Score: 105-77

[06:59] Team_075 possession (Score: 105-77)
Myles Barrett drives, Bam Iverson stays with him. Myles Barrett attempts a Dunk. Contested by Bam Iverson (3.2 feet, MAN). MYLES BARRETT MAKES IT! Assist: Klay Jokic
Score: 105-79

[06:44] Team_071 possession (Score: 105-79)
Victor Anunoby attempts a Layup. Wide open! Derrick Stewart is 6.9 feet away. [ZONE] VICTOR ANUNOBY MAKES IT! Assist: Bam Iverson
Score: 107-79

[06:27] Team_075 possession (Score: 107-79)
Kawhi Ingram attempts a Layup. Heavily contested by Victor Anunoby (0.5 feet, MAN)! Kawhi Ingram misses. Offensive rebound by Kawhi Ingram! Kawhi Ingram kicks it out.

[06:15] Team_075 possession (Score: 107-79)
Derrick Stewart attempts a 3Pt. Contested by Jimmy Simons (3.3 feet, MAN). Derrick Stewart misses. Rebound secured by Bam Iverson.

[06:02] Team_071 possession (Score: 107-79)
Victor Anunoby makes the Layup and draws the foul on Derrick Stewart! And-1! Victor Anunoby to the line for 1. [BONUS: 6 team fouls] (Derrick Stewart: 3 personal fouls)   FT 1/1: GOOD Victor Anunoby makes 1/1 from the line.
Score: 110-79

[05:49] Team_075 possession (Score: 110-79)
Klay Jokic makes the Layup and draws the foul on Dejounte Paul! And-1! Klay Jokic to the line for 1. [BONUS: 5 team fouls] (Dejounte Paul: 4 personal fouls)   FT 1/1: GOOD Klay Jokic makes 1/1 from the line.
Score: 110-82

[05:34] Team_071 possession (Score: 110-82)
Bam Iverson drives to the basket... Bam Iverson throws a bad pass! Stolen by Myles Barrett! TURNOVER! (live ball)

[05:19] Team_075 possession (Score: 110-82)
Derrick Stewart attempts a Midrange. Wide open! Bam Iverson is 6.4 feet away. [ZONE] Derrick Stewart misses. Rebound secured by Jimmy Simons.

[05:04] Team_071 possession (Score: 110-82)
Dejounte Paul attempts a Layup. BLOCKED BY DERRICK STEWART! Ball is loose! Offensive rebound by Dejounte Paul! Dejounte Paul kicks it out.

[04:52] Team_071 possession (Score: 110-82)
Allen Williamson attempts a Midrange. Wide open! Derrick Stewart is 9.5 feet away. [ZONE] Allen Williamson misses. Rebound secured by Klay Jokic.

[04:34] Team_075 possession (Score: 110-82)
Myles Barrett attempts a Midrange. Contested by Bam Iverson (3.4 feet, ZONE). Myles Barrett misses. Rebound secured by Bam Iverson.

[04:22] Team_071 possession (Score: 110-82)
Jimmy Simons attempts a 3Pt. Wide open! Larry McCollum is 7.9 feet away. [ZONE] Jimmy Simons misses. Rebound secured by Klay Jokic.

[04:09] Team_075 possession (Score: 110-82)
Kawhi Ingram attempts a Midrange. Heavily contested by Bam Iverson (1.4 feet, ZONE)! KAWHI INGRAM MAKES IT! Assist: Myles Barrett
Score: 110-84

[03:55] Team_071 possession (Score: 110-84)
FOUL! Shooting foul on Klay Jokic. Dejounte Paul to the line for 2 free throws. [BONUS: 7 team fouls] (Klay Jokic: 1 personal fouls)   FT 1/2: GOOD   FT 2/2: MISS Dejounte Paul makes 1/2 from the line. Rebound secured by Derrick Stewart.
Score: 111-84

[03:39] Team_075 possession (Score: 111-84)
Kawhi Ingram drives, Victor Anunoby stays with him. Kawhi Ingram attempts a Dunk. Contested by Victor Anunoby (2.9 feet, MAN). Kawhi Ingram misses. Rebound secured by Jimmy Simons.

[03:27] Team_071 possession (Score: 111-84)
Victor Anunoby attempts a Midrange. Wide open! Derrick Stewart is 7.3 feet away. [ZONE] Victor Anunoby misses. Rebound secured by Klay Jokic.

[03:09] Team_075 possession (Score: 111-84)
Kawhi Ingram attempts a 3Pt. Wide open! Victor Anunoby is 7.3 feet away. [MAN] Kawhi Ingram misses. Offensive rebound by Kawhi Ingram! Kawhi Ingram kicks it out.

[02:56] Team_075 possession (Score: 111-84)
Derrick Stewart drives, picks up Dejounte Paul. Help arrives from Allen Williamson! Derrick Stewart attempts a Layup. Wide open! Allen Williamson is 9.0 feet away. [ZONE] Derrick Stewart misses. Rebound secured by Jimmy Simons.

[02:39] Team_071 possession (Score: 111-84)
FOUL! Holding foul on Klay Jokic. [IN THE BONUS! 8 team fouls] Dejounte Paul to the line for 2 free throws. (Klay Jokic: 2 personal fouls)   FT 1/2: GOOD   FT 2/2: MISS Dejounte Paul makes 1/2 from the line. Rebound secured by Derrick Stewart.
Score: 112-84

[02:21] Team_075 possession (Score: 112-84)
Derrick Stewart throws a bad pass! Stolen by Jimmy Simons! TURNOVER! (live ball)

[02:04] Team_071 possession (Score: 112-84)
Jimmy Simons drives to the basket... Jimmy Simons throws a bad pass! Stolen by Derrick Stewart! TURNOVER! (live ball)

[01:54] Team_075 possession (Score: 112-84)
Larry McCollum drives to the basket... Larry McCollum throws a bad pass out of bounds! TURNOVER! (dead ball)

[01:54] Substitution (Team_071): Allen Williamson OUT → Evan Sexton IN (stamina_rule2)

[01:54] Substitution (Team_071): Victor Anunoby OUT → Paul Ball IN (stamina_rule2)

[01:54] Substitution (Team_071): Bam Iverson OUT → Immanuel Ginobili IN (stamina_rule2)

[01:54] Substitution (Team_071): Jimmy Simons OUT → Jordan Durant IN (stamina_rule2)

[01:54] Substitution (Team_071): Dejounte Paul OUT → Tyrese Brogdon IN (stamina_rule2)

[01:54] Substitution (Team_075): Larry McCollum OUT → D'Angelo Anunoby IN (stamina_rule2)

[01:54] Substitution (Team_075): Kawhi Ingram OUT → LeBron Ginobili IN (stamina_rule2)

[01:54] Substitution (Team_075): Myles Barrett OUT → Donovan Paul IN (stamina_rule2)

[01:54] Substitution (Team_075): Derrick Stewart OUT → Collin Duncan IN (stamina_rule2)

[01:54] Substitution (Team_075): Klay Jokic OUT → Kevin Towns IN (stamina_rule2)

[01:38] Team_071 possession (Score: 112-84)
Jordan Durant attempts a 3Pt. Contested by D'Angelo Anunoby (4.6 feet, ZONE). Jordan Durant misses. Offensive rebound by Immanuel Ginobili! Immanuel Ginobili kicks it out.

[01:25] Team_071 possession (Score: 112-84)
Immanuel Ginobili drives to the basket... FOUL! Offensive foul on Immanuel Ginobili! Donovan Paul drew the charge! [Team fouls: 6] (Immanuel Ginobili: 1 personal fouls) TURNOVER! (dead ball)

[01:07] Team_075 possession (Score: 112-84)
LeBron Ginobili attempts a Midrange. Contested by Tyrese Brogdon (5.7 feet, ZONE). LeBron Ginobili misses. Rebound secured by Evan Sexton.

[00:54] Team_071 possession (Score: 112-84)
Immanuel Ginobili drives to the basket... Immanuel Ginobili throws a bad pass out of bounds! TURNOVER! (dead ball)

[00:36] Team_075 possession (Score: 112-84)
D'Angelo Anunoby attempts a Midrange. Contested by Paul Ball (5.5 feet, ZONE). D'Angelo Anunoby misses. Rebound secured by Evan Sexton.

[00:20] Team_071 possession (Score: 112-84)
Immanuel Ginobili attempts a 3Pt. Contested by D'Angelo Anunoby (3.0 feet, ZONE). Immanuel Ginobili misses. FOUL! Loose ball foul on D'Angelo Anunoby during the rebound battle. [IN THE BONUS! 9 team fouls] Jordan Durant to the line for 2 free throws. (D'Angelo Anunoby: 1 personal fouls)   FT 1/2: GOOD   FT 2/2: GOOD Jordan Durant makes 2/2 from the line.
Score: 114-84

[00:06] Team_075 possession (Score: 114-84)
LeBron Ginobili attempts a 3Pt. Contested by Paul Ball (3.3 feet, ZONE). LeBron Ginobili misses. Offensive rebound by Collin Duncan! Collin Duncan kicks it out.

================================================================================
                              4TH QUARTER COMPLETE                              
================================================================================

4TH QUARTER SCORE: Team_071 26, Team_075 16

BOX SCORE:
================================================================================

Team_071
--------------------------------------------------------------------------------
Player                MIN  PTS  REB  AST  TO      FG   FG%      3P   3P%
--------------------------------------------------------------------------------
Victor Anunoby         35    5    0    0   0   2/3    66.7     0/0   0.0
Jimmy Simons           35    4    6    0   0   2/4    50.0     0/0   0.0
Dejounte Paul          35    4    4    0   0   2/4    50.0     0/0   0.0
Allen Williamson       35    2    0    0   0   1/2    50.0     0/0   0.0
Jordan Durant          14    2    0    0   0   1/1   100.0     0/0   0.0
Bam Iverson            35    0    3    3   0   0/0     0.0     0/0   0.0
Immanuel Ginobili      14    0    1    0   0   0/0     0.0     0/0   0.0
Evan Sexton            14    0    2    0   0   0/0     0.0     0/0   0.0

TEAM: FG: 8/15 (53.3%), 3PT: 1/3 (33.3%), REB: 16 (6 off, 10 def), AST: 3, TO: 5
TEAM FOULS: 6 [Team_075 in BONUS]


Team_075
--------------------------------------------------------------------------------
Player                MIN  PTS  REB  AST  TO      FG   FG%      3P   3P%
--------------------------------------------------------------------------------
Kawhi Ingram           35    5    3    1   0   2/5    40.0     0/0   0.0
Klay Jokic             35    5    3    1   0   2/3    66.7     0/0   0.0
Derrick Stewart        35    2    3    0   0   1/4    25.0     0/0   0.0
Larry McCollum         35    2    0    0   0   1/1   100.0     0/0   0.0
Myles Barrett          35    2    0    1   0   1/2    50.0     0/0   0.0
LeBron Ginobili        14    0    0    0   0   0/1     0.0     0/0   0.0
D'Angelo Anunoby       14    0    0    0   0   0/1     0.0     0/0   0.0
Collin Duncan          14    0    1    0   0   0/0     0.0     0/0   0.0

TEAM: FG: 7/17 (41.2%), 3PT: 0/1 (0.0%), REB: 10 (3 off, 7 def), AST: 3, TO: 2
TEAM FOULS: 9 [Team_071 in BONUS]

================================================================================

================================================================================
                               FULL GAME COMPLETE                               
================================================================================

FINAL SCORE: Team_071 114, Team_075 84

SCORING BY QUARTER:
--------------------------------------------------------------------------------
Team                     Q1     Q2     Q3     Q4    FINAL
--------------------------------------------------------------------------------
Team_071                 36     29     23     26      114
Team_075                 28     24     16     16       84
--------------------------------------------------------------------------------

FULL GAME BOX SCORE:
================================================================================

Team_071
--------------------------------------------------------------------------------
Player                MIN  PTS  REB  AST  TO      FG   FG%      3P   3P%      FT STL BLK
--------------------------------------------------------------------------------
Allen Williamson       35   18    0    4   2   7/9    77.8   4/5    80.0   2/2     1   1
Victor Anunoby         35   20    0    5   1   7/11   63.6   2/2   100.0   2/2     0   0
Bam Iverson            35   14    5    7   2   7/9    77.8   1/2    50.0   1/1     2   0
Jimmy Simons           35   10   15    2   2   4/8    50.0   2/5    40.0   4/6     2   0
Dejounte Paul          35   13    7    2   4   7/10   70.0   0/0     0.0   3/7     0   0
Evan Sexton            14    5    2    3   3   2/4    50.0   1/2    50.0   2/2     0   0
Paul Ball              14   14    0    1   1   3/5    60.0   1/1   100.0   1/1     1   0
Immanuel Ginobili      14    5    5    2   1   5/5   100.0   2/2   100.0   0/0     1   0
Jordan Durant          14    6    6    0   0   1/3    33.3   0/0     0.0   3/3     0   0
Tyrese Brogdon         14    0    0    0   1   0/1     0.0   0/1     0.0   0/0     0   1

TEAM: FG: 43/66 (65.2%), 3PT: 13/20 (65.0%), REB: 40 (10 off, 30 def), AST: 26, TO: 17


Team_075
--------------------------------------------------------------------------------
Player                MIN  PTS  REB  AST  TO      FG   FG%      3P   3P%      FT STL BLK
--------------------------------------------------------------------------------
Larry McCollum         35   17    0    1   2   6/10   60.0   1/5    20.0   3/3     1   1
Kawhi Ingram           35   17    9    3   2   7/12   58.3   1/2    50.0   2/2     0   0
Myles Barrett          35    8    0    5   4   3/5    60.0   0/1     0.0   1/1     1   0
Derrick Stewart        35    7   14    2   2   2/8    25.0   1/4    25.0   2/2     4   2
Klay Jokic             35   14    5    3   1   8/11   72.7   1/1   100.0   3/3     1   0
D'Angelo Anunoby       14    3    0    1   1   1/2    50.0   1/1   100.0   0/0     0   0
LeBron Ginobili        14    4    0    2   1   2/4    50.0   0/1     0.0   0/0     0   1
Donovan Paul           14   10    0    0   2   4/6    66.7   2/3    66.7   3/3     0   0
Collin Duncan          14    4    6    2   0   2/5    40.0   0/1     0.0   0/2     1   1
Kevin Towns            14    0    5    1   0   0/2     0.0   0/0     0.0   0/0     0   0

TEAM: FG: 35/65 (53.8%), 3PT: 7/19 (36.8%), REB: 39 (17 off, 22 def), AST: 20, TO: 15

================================================================================
