================================================================================
                        FULL GAME - Team_072 vs Team_099                        
================================================================================

================================================================================
                       1ST QUARTER - Team_072 vs Team_099                       
================================================================================

[12:00] Team_072 possession (Score: 0-0)
Collin Griffin attempts a 3Pt. Wide open! Larry James is 6.3 feet away. [ZONE] Collin Griffin misses. Rebound secured by Damian Ginobili.

[11:50] Team_099 possession (Score: 0-0)
Damian Ginobili drives to the basket... Damian Ginobili loses control! Ball rolls out of bounds! TURNOVER! (dead ball)

[11:34] Team_072 possession (Score: 0-0)
Wendell Anthony attempts a 3Pt. Contested by Ayo Barrett (2.0 feet, ZONE). WENDELL ANTHONY MAKES IT! Assist: Cade Poole
Score: 3-0

[11:19] Team_099 possession (Score: 3-0)
Larry James attempts a 3Pt. Contested by Cade Poole (4.8 feet, MAN). Larry James misses. Rebound secured by Tracy Giddey.

[11:05] Team_072 possession (Score: 3-0)
Collin Griffin attempts a 3Pt. Wide open! Ayo Barrett is 7.1 feet away. [ZONE] COLLIN GRIFFIN MAKES IT! Assist: Tyrese Williamson
Score: 6-0

[10:55] Team_099 possession (Score: 6-0)
Damian Ginobili loses control! Ball rolls out of bounds! TURNOVER! (dead ball)

[10:41] Team_072 possession (Score: 6-0)
Cade Poole attempts a Midrange. Wide open! Larry James is 7.9 feet away. [MAN] CADE POOLE MAKES IT!
Score: 8-0

[10:27] Team_099 possession (Score: 8-0)
Larry James attempts a Midrange. Contested by Cade Poole (4.5 feet, ZONE). LARRY JAMES MAKES IT!
Score: 8-2

[10:11] Team_072 possession (Score: 8-2)
Wendell Anthony attempts a Midrange. Wide open! Damian Ginobili is 6.5 feet away. [MAN] WENDELL ANTHONY MAKES IT! Assist: Tyrese Williamson
Score: 10-2

[09:58] Team_099 possession (Score: 10-2)
Vince Lillard attempts a 3Pt. Contested by Cade Poole (5.5 feet, ZONE). VINCE LILLARD MAKES IT! Assist: Ayo Barrett
Score: 10-5

[09:39] Team_072 possession (Score: 10-5)
Wendell Anthony attempts a 3Pt. Contested by Ayo Barrett (4.7 feet, ZONE). Wendell Anthony misses. Rebound secured by Damian Ginobili.

[09:26] Team_099 possession (Score: 10-5)
Larry Wade drives, Tyrese Williamson stays with him. Larry Wade attempts a Dunk. Contested by Tyrese Williamson (5.0 feet, MAN). LARRY WADE MAKES IT! Assist: Ayo Barrett
Score: 10-7

[09:14] Team_072 possession (Score: 10-7)
Tracy Giddey attempts a 3Pt. Wide open! Vince Lillard is 8.4 feet away. [MAN] Tracy Giddey misses. Rebound secured by Vince Lillard.

[09:04] Team_099 possession (Score: 10-7)
FOUL! Reach-in foul on Tyrese Williamson during the drive. [Team fouls: 1] No free throws, side out. (Tyrese Williamson: 1 personal fouls)

[08:54] Team_099 possession (Score: 10-7)
Larry James drives and kicks out. FOUL! Shooting foul on Cade Poole. Larry James to the line for 2 free throws. [Team fouls: 2] (Cade Poole: 1 personal fouls)   FT 1/2: MISS   FT 2/2: GOOD Larry James makes 1/2 from the line.
Score: 10-8

[08:37] Team_072 possession (Score: 10-8)
Wendell Anthony attempts a 3Pt. Contested by Ayo Barrett (4.6 feet, ZONE). Wendell Anthony misses. Rebound secured by Damian Ginobili.

[08:24] Team_099 possession (Score: 10-8)
Larry Wade drives and kicks out. FOUL! Shooting foul on Cade Poole. Vince Lillard to the line for 2 free throws. [Team fouls: 3] (Cade Poole: 2 personal fouls)   FT 1/2: MISS   FT 2/2: GOOD Vince Lillard makes 1/2 from the line.
Score: 10-9

[08:14] Team_072 possession (Score: 10-9)
Tracy Giddey attempts a Midrange. Contested by Vince Lillard (3.6 feet, MAN). Tracy Giddey misses. Rebound secured by Vince Lillard.

[07:59] Team_099 possession (Score: 10-9)
Larry Wade drives to the basket... Larry Wade loses control! Ball rolls out of bounds! TURNOVER! (dead ball)

[07:42] Team_072 possession (Score: 10-9)
Wendell Anthony drives, picks up Vince Lillard. Help arrives from Ayo Barrett! Wendell Anthony attempts a Dunk. Contested by Ayo Barrett (2.7 feet, ZONE). WENDELL ANTHONY MAKES IT!
Score: 12-9

[07:29] Team_099 possession (Score: 12-9)
Ayo Barrett attempts a Layup. Contested by Tyrese Williamson (2.0 feet, ZONE). AYO BARRETT MAKES IT!
Score: 12-11

[07:12] Team_072 possession (Score: 12-11)
FOUL! Holding foul on Vince Lillard. [Team fouls: 1] No free throws, side out. (Vince Lillard: 1 personal fouls)

[06:56] Team_072 possession (Score: 12-11)
FOUL! Shooting foul on Vince Lillard. Cade Poole to the line for 2 free throws. [Team fouls: 2] (Vince Lillard: 2 personal fouls)   FT 1/2: MISS   FT 2/2: GOOD Cade Poole makes 1/2 from the line.
Score: 13-11

[06:43] Team_099 possession (Score: 13-11)
Larry James drives, Tyrese Williamson stays with him. Larry James attempts a Dunk. Heavily contested by Tyrese Williamson (0.5 feet, ZONE)! LARRY JAMES MAKES IT! Assist: Damian Ginobili
Score: 13-13

[06:28] Team_072 possession (Score: 13-13)
Collin Griffin drives and kicks out. Tracy Giddey attempts a 3Pt. Contested by Vince Lillard (3.9 feet, MAN). Tracy Giddey misses. Offensive rebound by Tyrese Williamson! Tyrese Williamson kicks it out.

[06:16] Team_072 possession (Score: 13-13)
Tyrese Williamson attempts a Layup. Contested by Larry Wade (3.9 feet, MAN). TYRESE WILLIAMSON MAKES IT! Assist: Collin Griffin
Score: 15-13

[05:59] Team_099 possession (Score: 15-13)
Ayo Barrett attempts a Midrange. Contested by Tracy Giddey (5.8 feet, ZONE). Ayo Barrett misses. Offensive rebound by Larry Wade! Larry Wade puts it back in!
Score: 15-15

[05:46] Team_072 possession (Score: 15-15)
Collin Griffin makes the Layup and draws the foul on Vince Lillard! And-1! Collin Griffin to the line for 1. [Team fouls: 3] (Vince Lillard: 3 personal fouls)   FT 1/1: GOOD Collin Griffin makes 1/1 from the line.
Score: 18-15

[05:33] Team_099 possession (Score: 18-15)
Larry James attempts a 3Pt. Contested by Cade Poole (4.5 feet, MAN). Larry James misses. Rebound secured by Tracy Giddey.

[05:22] Team_072 possession (Score: 18-15)
Collin Griffin drives and kicks out. Tyrese Williamson makes the Midrange and draws the foul on Larry James! And-1! Tyrese Williamson to the line for 1. [Team fouls: 4] (Larry James: 1 personal fouls)   FT 1/1: GOOD Tyrese Williamson makes 1/1 from the line.
Score: 21-15

[05:05] Team_099 possession (Score: 21-15)
Larry James attempts a 3Pt. Contested by Cade Poole (5.3 feet, ZONE). Larry James misses. FOUL! Loose ball foul on Tyrese Williamson during the rebound battle. [Team fouls: 4] No free throws, side out. (Tyrese Williamson: 2 personal fouls)

[04:48] Team_099 possession (Score: 21-15)
Damian Ginobili attempts a Midrange. Wide open! Wendell Anthony is 7.8 feet away. [MAN] DAMIAN GINOBILI MAKES IT!
Score: 21-17

[04:37] Team_072 possession (Score: 21-17)
Tyrese Williamson attempts a Layup. BLOCKED BY VINCE LILLARD! Ball is loose! Rebound secured by Vince Lillard.

[04:21] Team_099 possession (Score: 21-17)
FOUL! Holding foul on Tyrese Williamson. [IN THE BONUS! 5 team fouls] Larry Wade to the line for 2 free throws. (Tyrese Williamson: 3 personal fouls)   FT 1/2: GOOD   FT 2/2: MISS Larry Wade makes 1/2 from the line. Rebound secured by Tracy Giddey.
Score: 21-18

[04:06] Team_072 possession (Score: 21-18)
Cade Poole attempts a Midrange. Wide open! Vince Lillard is 7.9 feet away. [ZONE] CADE POOLE MAKES IT! Assist: Tracy Giddey
Score: 23-18

[03:55] Team_099 possession (Score: 23-18)
Ayo Barrett drives to the basket... Ayo Barrett loses the ball! Stripped by Tyrese Williamson! TURNOVER! (live ball)

[03:38] Team_072 possession (Score: 23-18)
Wendell Anthony drives to the basket... Wendell Anthony loses the ball! Stripped by Vince Lillard! TURNOVER! (live ball)

[03:19] Team_099 possession (Score: 23-18)
Larry Wade drives to the basket... Larry Wade loses control! Ball rolls out of bounds! TURNOVER! (dead ball)

[03:01] Team_072 possession (Score: 23-18)
Tracy Giddey drives, Vince Lillard stays with him. Tracy Giddey attempts a Layup. Heavily contested by Vince Lillard (1.5 feet, ZONE)! Tracy Giddey misses. Offensive rebound by Tracy Giddey! Tracy Giddey kicks it out.

[02:47] Team_072 possession (Score: 23-18)
FOUL! Shooting foul on Vince Lillard. Tracy Giddey to the line for 2 free throws. [BONUS: 5 team fouls] (Vince Lillard: 4 personal fouls)   FT 1/2: GOOD   FT 2/2: GOOD Tracy Giddey makes 2/2 from the line.
Score: 25-18

[02:34] Team_099 possession (Score: 25-18)
Larry Wade throws a bad pass out of bounds! TURNOVER! (dead ball)

[02:34] Substitution (Team_072): Cade Poole OUT → CJ Jokic IN (stamina_rule2)

[02:34] Substitution (Team_072): Wendell Anthony OUT → CJ Bane IN (stamina_rule2)

[02:34] Substitution (Team_099): Damian Ginobili OUT → Scottie Quickley IN (stamina_rule2)

[02:34] Substitution (Team_099): Vince Lillard OUT → Donovan Green IN (stamina_rule2)

[02:34] Substitution (Team_099): Larry Wade OUT → Jarrett Fox IN (stamina_rule2)

[02:20] Team_072 possession (Score: 25-18)
Collin Griffin attempts a 3Pt. Wide open! Ayo Barrett is 8.6 feet away. [MAN] COLLIN GRIFFIN MAKES IT! Assist: CJ Jokic
Score: 28-18

[02:06] Team_099 possession (Score: 28-18)
Larry James makes the Layup and draws the foul on CJ Jokic! And-1! Larry James to the line for 1. [BONUS: 6 team fouls] (CJ Jokic: 1 personal fouls)   FT 1/1: GOOD Larry James makes 1/1 from the line.
Score: 28-21

[01:53] Team_072 possession (Score: 28-21)
CJ Jokic loses the ball! Stripped by Larry James! TURNOVER! (live ball)

[01:39] Team_099 possession (Score: 28-21)
Donovan Green drives and kicks out. Larry James attempts a Midrange. Contested by Tracy Giddey (5.7 feet, ZONE). LARRY JAMES MAKES IT!
Score: 28-23

[01:26] Team_072 possession (Score: 28-23)
Tyrese Williamson attempts a Layup. BLOCKED BY JARRETT FOX! Ball deflects out of bounds off Tyrese Williamson.

[01:14] Team_099 possession (Score: 28-23)
Larry James drives and kicks out. Larry James attempts a Midrange. Contested by CJ Bane (4.0 feet, ZONE). Larry James misses. Rebound secured by Tracy Giddey.

[00:59] Team_072 possession (Score: 28-23)
CJ Bane attempts a Midrange. Contested by Donovan Green (5.8 feet, ZONE). CJ Bane misses. Rebound secured by Donovan Green.

[00:44] Team_099 possession (Score: 28-23)
Larry James attempts a Layup. Contested by CJ Jokic (5.9 feet, MAN). LARRY JAMES MAKES IT!
Score: 28-25

[00:29] Team_072 possession (Score: 28-25)
CJ Jokic attempts a 3Pt. Contested by Larry James (4.5 feet, MAN). CJ Jokic misses. Rebound secured by Donovan Green.

[00:17] Team_099 possession (Score: 28-25)
Larry James attempts a 3Pt. Contested by CJ Jokic (2.9 feet, ZONE). LARRY JAMES MAKES IT! Assist: Scottie Quickley
Score: 28-28

[00:01] Team_072 possession (Score: 28-28)
Tyrese Williamson attempts a Midrange. Wide open! Jarrett Fox is 6.1 feet away. [MAN] TYRESE WILLIAMSON MAKES IT! Assist: Tracy Giddey
Score: 30-28

================================================================================
                              1ST QUARTER COMPLETE                              
================================================================================

1ST QUARTER SCORE: Team_072 30, Team_099 28

BOX SCORE:
================================================================================

Team_072
--------------------------------------------------------------------------------
Player                MIN  PTS  REB  AST  TO      FG   FG%      3P   3P%
--------------------------------------------------------------------------------
Collin Griffin         12    9    0    1   0   3/4    75.0     0/0   0.0
Wendell Anthony        10    7    0    0   0   3/5    60.0     0/0   0.0
Tyrese Williamson      12    7    1    2   0   3/5    60.0     0/0   0.0
Cade Poole             10    5    0    1   0   3/3   100.0     0/0   0.0
Tracy Giddey           12    2    5    2   0   1/3    33.3     0/0   0.0
CJ Jokic                3    0    0    1   0   0/1     0.0     0/0   0.0
CJ Bane                 3    0    0    0   0   0/1     0.0     0/0   0.0

TEAM: FG: 13/22 (59.1%), 3PT: 3/8 (37.5%), REB: 6 (2 off, 4 def), AST: 7, TO: 2
TEAM FOULS: 6 [Team_099 in BONUS]


Team_099
--------------------------------------------------------------------------------
Player                MIN  PTS  REB  AST  TO      FG   FG%      3P   3P%
--------------------------------------------------------------------------------
Larry James            12   15    0    0   0   7/10   70.0     0/0   0.0
Vince Lillard          10    4    4    0   0   2/2   100.0     0/0   0.0
Larry Wade             10    4    1    0   0   2/2   100.0     0/0   0.0
Damian Ginobili        10    2    3    1   0   1/1   100.0     0/0   0.0
Ayo Barrett            12    2    0    2   0   1/1   100.0     0/0   0.0
Donovan Green           3    0    2    0   0   0/0     0.0     0/0   0.0
Scottie Quickley        3    0    0    1   0   0/0     0.0     0/0   0.0

TEAM: FG: 13/17 (76.5%), 3PT: 2/4 (50.0%), REB: 10 (2 off, 8 def), AST: 4, TO: 6
TEAM FOULS: 5 [Team_072 in BONUS]

================================================================================

================================================================================
                       2ND QUARTER - Team_072 vs Team_099                       
================================================================================

[12:00] Team_072 possession (Score: 30-28)
Tyrese Williamson drives, Larry Wade stays with him. Tyrese Williamson attempts a Dunk. Contested by Larry Wade (2.1 feet, MAN). TYRESE WILLIAMSON MAKES IT! Assist: Collin Griffin
Score: 32-28

[11:45] Team_099 possession (Score: 32-28)
Vince Lillard attempts a Midrange. Wide open! Tracy Giddey is 6.1 feet away. [MAN] Vince Lillard misses. Offensive rebound by Vince Lillard! Vince Lillard puts it back in!
Score: 32-30

[11:34] Team_072 possession (Score: 32-30)
FOUL! Shooting foul on Ayo Barrett. Collin Griffin to the line for 3 free throws. [Team fouls: 1] (Ayo Barrett: 1 personal fouls)   FT 1/3: GOOD   FT 2/3: GOOD   FT 3/3: GOOD Collin Griffin makes 3/3 from the line.
Score: 35-30

[11:20] Team_099 possession (Score: 35-30)
Vince Lillard attempts a 3Pt. Contested by Cade Poole (3.5 feet, ZONE). Vince Lillard misses. Rebound secured by Wendell Anthony.

[11:04] Team_072 possession (Score: 35-30)
Tyrese Williamson attempts a Midrange. Contested by Larry Wade (5.2 feet, MAN). Tyrese Williamson misses. Offensive rebound by Tracy Giddey! Tracy Giddey kicks it out.

[10:49] Team_072 possession (Score: 35-30)
Collin Griffin attempts a Midrange. Contested by Damian Ginobili (4.9 feet, ZONE). Collin Griffin misses. Rebound secured by Damian Ginobili.

[10:36] Team_099 possession (Score: 35-30)
Larry James drives, Tyrese Williamson stays with him. Larry James attempts a Dunk. Contested by Tyrese Williamson (2.9 feet, ZONE). Larry James misses. Rebound secured by Tyrese Williamson.

[10:22] Team_072 possession (Score: 35-30)
Tracy Giddey throws a bad pass out of bounds! TURNOVER! (dead ball)

[10:22] Substitution (Team_072): Collin Griffin OUT → Giannis Gobert IN (stamina_rule2)

[10:22] Substitution (Team_072): Tracy Giddey OUT → Brandon Durant IN (stamina_rule2)

[10:22] Substitution (Team_072): Tyrese Williamson OUT → Stephen Holiday IN (stamina_rule2)

[10:22] Substitution (Team_099): Ayo Barrett OUT → CJ Cunningham IN (stamina_rule2)

[10:22] Substitution (Team_099): Larry James OUT → Manu Johnson IN (stamina_rule2)

[10:09] Team_099 possession (Score: 35-30)
Damian Ginobili attempts a 3Pt. Wide open! Giannis Gobert is 7.7 feet away. [ZONE] DAMIAN GINOBILI MAKES IT! Assist: CJ Cunningham
Score: 35-33

[09:55] Team_072 possession (Score: 35-33)
Cade Poole attempts a 3Pt. Wide open! Manu Johnson is 7.6 feet away. [MAN] Cade Poole misses. Rebound secured by Larry Wade.

[09:44] Team_099 possession (Score: 35-33)
Manu Johnson attempts a 3Pt. Contested by Giannis Gobert (2.8 feet, ZONE). Manu Johnson misses. Rebound secured by Wendell Anthony.

[09:30] Team_072 possession (Score: 35-33)
Wendell Anthony attempts a Midrange. Wide open! CJ Cunningham is 9.0 feet away. [ZONE] WENDELL ANTHONY MAKES IT!
Score: 37-33

[09:14] Team_099 possession (Score: 37-33)
Larry Wade makes the Dunk and draws the foul on Stephen Holiday! And-1! Larry Wade to the line for 1. [Team fouls: 1] (Stephen Holiday: 1 personal fouls)   FT 1/1: MISS Larry Wade makes 0/1 from the line. Rebound secured by Stephen Holiday.
Score: 37-35

[09:02] Team_072 possession (Score: 37-35)
Wendell Anthony attempts a 3Pt. Contested by Damian Ginobili (3.2 feet, MAN). WENDELL ANTHONY MAKES IT! Assist: Giannis Gobert
Score: 40-35

[08:50] Team_099 possession (Score: 40-35)
CJ Cunningham drives to the basket... CJ Cunningham throws a bad pass! Stolen by Giannis Gobert! TURNOVER! (live ball)

[08:31] Team_072 possession (Score: 40-35)
Stephen Holiday attempts a Layup. Heavily contested by Larry Wade (0.5 feet, MAN)! Stephen Holiday misses. Rebound secured by Larry Wade.

[08:16] Team_099 possession (Score: 40-35)
Larry Wade attempts a Layup. Contested by Stephen Holiday (4.4 feet, ZONE). Larry Wade misses. Offensive rebound by Larry Wade! Larry Wade kicks it out.

[08:03] Team_099 possession (Score: 40-35)
Damian Ginobili drives and kicks out. Vince Lillard attempts a 3Pt. Contested by Brandon Durant (4.5 feet, MAN). Vince Lillard misses. Rebound secured by Stephen Holiday.

[07:48] Team_072 possession (Score: 40-35)
Wendell Anthony attempts a Midrange. Contested by Vince Lillard (4.4 feet, ZONE). Wendell Anthony misses. FOUL! Loose ball foul on Vince Lillard during the rebound battle. [Team fouls: 2] No free throws, side out. (Vince Lillard: 1 personal fouls)

[07:32] Team_072 possession (Score: 40-35)
FOUL! Shooting foul on Vince Lillard. Brandon Durant to the line for 2 free throws. [Team fouls: 3] (Vince Lillard: 2 personal fouls)   FT 1/2: MISS   FT 2/2: GOOD Brandon Durant makes 1/2 from the line.
Score: 41-35

[07:17] Team_099 possession (Score: 41-35)
FOUL! Holding foul on Brandon Durant. [Team fouls: 2] No free throws, side out. (Brandon Durant: 1 personal fouls)

[06:58] Team_099 possession (Score: 41-35)
CJ Cunningham attempts a Midrange. Wide open! Wendell Anthony is 8.1 feet away. [ZONE] CJ CUNNINGHAM MAKES IT!
Score: 41-37

[06:43] Team_072 possession (Score: 41-37)
Brandon Durant attempts a 3Pt. Contested by Vince Lillard (3.2 feet, MAN). BRANDON DURANT MAKES IT! Assist: Stephen Holiday
Score: 44-37

[06:28] Team_099 possession (Score: 44-37)
FOUL! Shooting foul on Wendell Anthony. Damian Ginobili to the line for 2 free throws. [Team fouls: 3] (Wendell Anthony: 1 personal fouls)   FT 1/2: GOOD   FT 2/2: MISS Damian Ginobili makes 1/2 from the line. Rebound secured by Brandon Durant.
Score: 44-38

[06:11] Team_072 possession (Score: 44-38)
Stephen Holiday drives and kicks out. Giannis Gobert attempts a Midrange. Contested by Manu Johnson (4.3 feet, ZONE). Giannis Gobert misses. Rebound secured by Damian Ginobili.

[05:54] Team_099 possession (Score: 44-38)
Vince Lillard attempts a Midrange. Contested by Brandon Durant (2.3 feet, MAN). Vince Lillard misses. Offensive rebound by Vince Lillard! Vince Lillard's putback is no good. Rebound secured by Wendell Anthony.

[05:37] Team_072 possession (Score: 44-38)
Wendell Anthony attempts a Midrange. Heavily contested by Damian Ginobili (1.7 feet, MAN)! Wendell Anthony misses. Rebound secured by Vince Lillard.

[05:23] Team_099 possession (Score: 44-38)
CJ Cunningham drives and kicks out. CJ Cunningham attempts a 3Pt. Contested by Giannis Gobert (4.1 feet, MAN). CJ Cunningham misses. Rebound secured by Stephen Holiday.

[05:08] Team_072 possession (Score: 44-38)
FOUL! Shooting foul on Damian Ginobili. Wendell Anthony to the line for 2 free throws. [Team fouls: 4] (Damian Ginobili: 1 personal fouls)   FT 1/2: GOOD   FT 2/2: GOOD Wendell Anthony makes 2/2 from the line.
Score: 46-38

[04:54] Team_099 possession (Score: 46-38)
CJ Cunningham throws a bad pass! Stolen by Giannis Gobert! TURNOVER! (live ball)

[04:41] Team_072 possession (Score: 46-38)
Stephen Holiday drives, Larry Wade stays with him. Stephen Holiday attempts a Layup. Contested by Larry Wade (5.1 feet, MAN). STEPHEN HOLIDAY MAKES IT! Assist: Wendell Anthony
Score: 48-38

[04:26] Team_099 possession (Score: 48-38)
Damian Ginobili attempts a Midrange. Contested by Cade Poole (5.6 feet, ZONE). Damian Ginobili misses. Rebound secured by Wendell Anthony.

[04:11] Team_072 possession (Score: 48-38)
Brandon Durant drives and kicks out. Stephen Holiday attempts a 3Pt. Contested by Larry Wade (4.4 feet, MAN). Stephen Holiday misses. Rebound secured by Larry Wade.

[03:55] Team_099 possession (Score: 48-38)
Vince Lillard drives and kicks out. CJ Cunningham attempts a 3Pt. Contested by Giannis Gobert (5.6 feet, ZONE). CJ Cunningham misses. Offensive rebound by Larry Wade! Larry Wade kicks it out.

[03:41] Team_099 possession (Score: 48-38)
FOUL! Reach-in foul on Wendell Anthony during the drive. [Team fouls: 4] No free throws, side out. (Wendell Anthony: 2 personal fouls)

[03:27] Team_099 possession (Score: 48-38)
FOUL! Shooting foul on Giannis Gobert. CJ Cunningham to the line for 2 free throws. [BONUS: 5 team fouls] (Giannis Gobert: 1 personal fouls)   FT 1/2: GOOD   FT 2/2: GOOD CJ Cunningham makes 2/2 from the line.
Score: 48-40

[03:13] Team_072 possession (Score: 48-40)
FOUL! Reach-in foul on Vince Lillard during the drive. [IN THE BONUS! 5 team fouls] Wendell Anthony to the line for 2 free throws. (Vince Lillard: 3 personal fouls)   FT 1/2: GOOD   FT 2/2: GOOD Wendell Anthony makes 2/2 from the line.
Score: 50-40

[03:00] Team_099 possession (Score: 50-40)
Vince Lillard throws a bad pass out of bounds! TURNOVER! (dead ball)

[03:00] Substitution (Team_072): Cade Poole OUT → CJ Jokic IN (stamina_rule2)

[03:00] Substitution (Team_072): Wendell Anthony OUT → CJ Bane IN (stamina_rule2)

[03:00] Substitution (Team_099): Damian Ginobili OUT → Scottie Quickley IN (stamina_rule2)

[03:00] Substitution (Team_099): Vince Lillard OUT → Donovan Green IN (stamina_rule2)

[03:00] Substitution (Team_099): Larry Wade OUT → Jarrett Fox IN (stamina_rule2)

[02:44] Team_072 possession (Score: 50-40)
Stephen Holiday attempts a Layup. BLOCKED BY JARRETT FOX! Ball is loose! Rebound secured by Jarrett Fox.

[02:34] Team_099 possession (Score: 50-40)
Scottie Quickley loses the ball! Stripped by CJ Bane! TURNOVER! (live ball)

[02:19] Team_072 possession (Score: 50-40)
CJ Jokic attempts a Midrange. Wide open! Manu Johnson is 7.4 feet away. [MAN] CJ Jokic misses. Rebound secured by Donovan Green.

[02:00] Team_099 possession (Score: 50-40)
Donovan Green drives to the basket... Donovan Green throws a bad pass out of bounds! TURNOVER! (dead ball)

[01:50] Team_072 possession (Score: 50-40)
FOUL! Offensive foul on Brandon Durant! Donovan Green drew the charge! [Team fouls: 6] (Brandon Durant: 2 personal fouls) TURNOVER! (dead ball)

[01:36] Team_099 possession (Score: 50-40)
Jarrett Fox drives, picks up Stephen Holiday. Help arrives from Giannis Gobert! Jarrett Fox attempts a Layup. Contested by Giannis Gobert (5.3 feet, MAN). Jarrett Fox misses. Rebound secured by Brandon Durant.

[01:23] Team_072 possession (Score: 50-40)
Stephen Holiday attempts a Midrange. Contested by Jarrett Fox (2.7 feet, MAN). Stephen Holiday misses. Rebound secured by Donovan Green.

[01:10] Team_099 possession (Score: 50-40)
CJ Cunningham drives and kicks out. Manu Johnson attempts a 3Pt. Heavily contested by CJ Jokic (1.1 feet, MAN)! MANU JOHNSON MAKES IT! Assist: Jarrett Fox
Score: 50-43

[00:58] Team_072 possession (Score: 50-43)
FOUL! Holding foul on Manu Johnson. [IN THE BONUS! 6 team fouls] CJ Jokic to the line for 2 free throws. (Manu Johnson: 1 personal fouls)   FT 1/2: GOOD   FT 2/2: MISS CJ Jokic makes 1/2 from the line. Rebound secured by Scottie Quickley.
Score: 51-43

[00:40] Team_099 possession (Score: 51-43)
Donovan Green drives, picks up Brandon Durant. Help arrives from Giannis Gobert! Donovan Green attempts a Dunk. Contested by Giannis Gobert (2.3 feet, MAN). Donovan Green misses. FOUL! Loose ball foul on Stephen Holiday during the rebound battle. [IN THE BONUS! 7 team fouls] Donovan Green to the line for 2 free throws. (Stephen Holiday: 2 personal fouls)   FT 1/2: MISS   FT 2/2: GOOD Donovan Green makes 1/2 from the line.
Score: 51-44

[00:29] Team_072 possession (Score: 51-44)
CJ Bane attempts a 3Pt. Wide open! Scottie Quickley is 6.5 feet away. [MAN] CJ Bane misses. Rebound secured by Donovan Green.

[00:18] Team_099 possession (Score: 51-44)
Scottie Quickley drives and kicks out. Jarrett Fox attempts a 3Pt. Wide open! Stephen Holiday is 8.4 feet away. [MAN] Jarrett Fox misses. Offensive rebound by Jarrett Fox! Jarrett Fox puts it back in!
Score: 51-46

[00:03] Team_072 possession (Score: 51-46)
CJ Jokic drives, Jarrett Fox stays with him. CJ Jokic attempts a Dunk. Contested by Jarrett Fox (3.6 feet, ZONE). CJ Jokic misses. Offensive rebound by Brandon Durant! Brandon Durant kicks it out.

================================================================================
                              2ND QUARTER COMPLETE                              
================================================================================

2ND QUARTER SCORE: Team_072 21, Team_099 18

BOX SCORE:
================================================================================

Team_072
--------------------------------------------------------------------------------
Player                MIN  PTS  REB  AST  TO      FG   FG%      3P   3P%
--------------------------------------------------------------------------------
Wendell Anthony        19    9    4    1   0   4/5    80.0     0/0   0.0
Brandon Durant         10    4    3    0   0   2/3    66.7     0/0   0.0
Collin Griffin         14    3    0    1   0   1/2    50.0     0/0   0.0
Tyrese Williamson      14    2    1    0   0   1/1   100.0     0/0   0.0
Stephen Holiday        10    2    4    1   0   1/5    20.0     0/0   0.0
Tracy Giddey           14    0    1    0   0   0/0     0.0     0/0   0.0
Cade Poole             19    0    0    0   0   0/1     0.0     0/0   0.0
Giannis Gobert         10    0    0    1   0   0/0     0.0     0/0   0.0
CJ Jokic                6    0    0    0   0   0/1     0.0     0/0   0.0
CJ Bane                 6    0    0    0   0   0/1     0.0     0/0   0.0

TEAM: FG: 9/20 (45.0%), 3PT: 3/5 (60.0%), REB: 12 (3 off, 9 def), AST: 4, TO: 2
TEAM FOULS: 7 [Team_099 in BONUS]


Team_099
--------------------------------------------------------------------------------
Player                MIN  PTS  REB  AST  TO      FG   FG%      3P   3P%
--------------------------------------------------------------------------------
CJ Cunningham          10    4    0    1   0   2/3    66.7     0/0   0.0
Damian Ginobili        19    3    2    0   0   1/4    25.0     0/0   0.0
Manu Johnson           10    3    0    0   0   1/2    50.0     0/0   0.0
Vince Lillard          19    2    2    0   0   1/3    33.3     0/0   0.0
Jarrett Fox             6    2    2    1   0   1/2    50.0     0/0   0.0
Donovan Green           6    1    3    0   0   1/1   100.0     0/0   0.0
Larry James            14    0    0    0   0   0/1     0.0     0/0   0.0
Larry Wade             19    0    5    0   0   0/1     0.0     0/0   0.0
Scottie Quickley        6    0    1    0   0   0/0     0.0     0/0   0.0

TEAM: FG: 7/17 (41.2%), 3PT: 1/3 (33.3%), REB: 16 (5 off, 11 def), AST: 2, TO: 5
TEAM FOULS: 6 [Team_072 in BONUS]

================================================================================

================================================================================
                       3RD QUARTER - Team_072 vs Team_099                       
================================================================================

[12:00] Team_072 possession (Score: 51-46)
Cade Poole drives to the basket... FOUL! Offensive foul on Cade Poole! Larry James drew the charge! [Team fouls: 1] (Cade Poole: 1 personal fouls) TURNOVER! (dead ball)

[11:49] Team_099 possession (Score: 51-46)
Ayo Barrett attempts a Midrange. Contested by Cade Poole (4.7 feet, ZONE). AYO BARRETT MAKES IT! Assist: Larry Wade
Score: 51-48

[11:35] Team_072 possession (Score: 51-48)
Wendell Anthony attempts a 3Pt. Contested by Damian Ginobili (5.0 feet, MAN). Wendell Anthony misses. Offensive rebound by Tracy Giddey! Tracy Giddey kicks it out.

[11:23] Team_072 possession (Score: 51-48)
FOUL! Holding foul on Ayo Barrett. [Team fouls: 1] No free throws, side out. (Ayo Barrett: 1 personal fouls)

[11:07] Team_072 possession (Score: 51-48)
Tyrese Williamson attempts a Layup. BLOCKED BY VINCE LILLARD! Ball is loose! Rebound secured by Larry Wade.

[10:54] Team_099 possession (Score: 51-48)
Larry James attempts a 3Pt. Contested by Cade Poole (2.2 feet, MAN). Larry James misses. Rebound secured by Tyrese Williamson.

[10:37] Team_072 possession (Score: 51-48)
Wendell Anthony loses the ball! Stripped by Damian Ginobili! TURNOVER! (live ball)

[10:22] Team_099 possession (Score: 51-48)
Larry Wade attempts a Midrange. Wide open! Collin Griffin is 7.3 feet away. [ZONE] Larry Wade misses. Rebound secured by Tyrese Williamson.

[10:04] Team_072 possession (Score: 51-48)
Tracy Giddey attempts a 3Pt. Wide open! Ayo Barrett is 7.0 feet away. [ZONE] Tracy Giddey misses. Rebound secured by Vince Lillard.

[09:54] Team_099 possession (Score: 51-48)
Ayo Barrett attempts a Layup. Heavily contested by Collin Griffin (1.8 feet, MAN)! AYO BARRETT MAKES IT! Assist: Larry Wade
Score: 51-50

[09:42] Team_072 possession (Score: 51-50)
Wendell Anthony attempts a 3Pt. Contested by Ayo Barrett (5.4 feet, ZONE). WENDELL ANTHONY MAKES IT! Assist: Tracy Giddey
Score: 54-50

[09:30] Team_099 possession (Score: 54-50)
FOUL! Reach-in foul on Tyrese Williamson during the drive. [Team fouls: 2] No free throws, side out. (Tyrese Williamson: 1 personal fouls)

[09:13] Team_099 possession (Score: 54-50)
Vince Lillard drives, Tyrese Williamson stays with him. Vince Lillard attempts a Dunk. Contested by Tyrese Williamson (2.5 feet, ZONE). VINCE LILLARD MAKES IT! Assist: Ayo Barrett
Score: 54-52

[08:59] Team_072 possession (Score: 54-52)
Collin Griffin drives and kicks out. Tracy Giddey attempts a Midrange. Wide open! Larry James is 6.4 feet away. [ZONE] TRACY GIDDEY MAKES IT! Assist: Cade Poole
Score: 56-52

[08:43] Team_099 possession (Score: 56-52)
Ayo Barrett attempts a 3Pt. Contested by Collin Griffin (3.7 feet, MAN). AYO BARRETT MAKES IT! Assist: Larry Wade
Score: 56-55

[08:25] Team_072 possession (Score: 56-55)
Tyrese Williamson drives and kicks out. Collin Griffin attempts a 3Pt. Contested by Ayo Barrett (2.1 feet, ZONE). COLLIN GRIFFIN MAKES IT! Assist: Cade Poole
Score: 59-55

[08:11] Team_099 possession (Score: 59-55)
Ayo Barrett drives to the basket... Ayo Barrett commits a violation (traveling/carry)! TURNOVER! (dead ball)

[07:55] Team_072 possession (Score: 59-55)
FOUL! Reach-in foul on Larry James during the drive. [Team fouls: 2] No free throws, side out. (Larry James: 1 personal fouls)

[07:44] Team_072 possession (Score: 59-55)
FOUL! Reach-in foul on Vince Lillard during the drive. [Team fouls: 3] No free throws, side out. (Vince Lillard: 1 personal fouls)

[07:28] Team_072 possession (Score: 59-55)
Collin Griffin throws a bad pass out of bounds! TURNOVER! (dead ball)

[07:09] Team_099 possession (Score: 59-55)
Damian Ginobili drives and kicks out. Larry James attempts a 3Pt. Contested by Cade Poole (4.2 feet, ZONE). Larry James misses. Rebound secured by Tyrese Williamson.

[06:53] Team_072 possession (Score: 59-55)
Tyrese Williamson makes the Dunk and draws the foul on Larry Wade! And-1! Tyrese Williamson to the line for 1. [Team fouls: 4] (Larry Wade: 1 personal fouls)   FT 1/1: GOOD Tyrese Williamson makes 1/1 from the line.
Score: 62-55

[06:41] Team_099 possession (Score: 62-55)
Vince Lillard attempts a 3Pt. Contested by Tracy Giddey (3.3 feet, MAN). Vince Lillard misses. Offensive rebound by Larry Wade! Larry Wade puts it back in!
Score: 62-57

[06:27] Team_072 possession (Score: 62-57)
Wendell Anthony attempts a Midrange. Wide open! Ayo Barrett is 8.9 feet away. [ZONE] WENDELL ANTHONY MAKES IT!
Score: 64-57

[06:09] Team_099 possession (Score: 64-57)
Vince Lillard attempts a 3Pt. Contested by Collin Griffin (3.3 feet, ZONE). Vince Lillard misses. Rebound secured by Tyrese Williamson.

[05:52] Team_072 possession (Score: 64-57)
Tyrese Williamson drives and kicks out. FOUL! Shooting foul on Ayo Barrett. Wendell Anthony to the line for 3 free throws. [BONUS: 5 team fouls] (Ayo Barrett: 2 personal fouls)   FT 1/3: MISS   FT 2/3: GOOD   FT 3/3: MISS Wendell Anthony makes 1/3 from the line. Rebound secured by Vince Lillard.
Score: 65-57

[05:35] Team_099 possession (Score: 65-57)
Larry Wade attempts a Layup. Contested by Tyrese Williamson (4.8 feet, ZONE). Larry Wade misses. Rebound secured by Tracy Giddey.

[05:19] Team_072 possession (Score: 65-57)
Tracy Giddey drives, picks up Vince Lillard. Help arrives from Ayo Barrett! Tracy Giddey attempts a Layup. Heavily contested by Ayo Barrett (0.5 feet, ZONE)! TRACY GIDDEY MAKES IT!
Score: 67-57

[05:06] Team_099 possession (Score: 67-57)
Larry James attempts a Midrange. Contested by Cade Poole (4.7 feet, MAN). Larry James misses. Offensive rebound by Vince Lillard! Vince Lillard puts it back in!
Score: 67-59

[04:48] Team_072 possession (Score: 67-59)
Wendell Anthony attempts a Midrange. Contested by Damian Ginobili (4.4 feet, MAN). WENDELL ANTHONY MAKES IT! Assist: Tracy Giddey
Score: 69-59

[04:32] Team_099 possession (Score: 69-59)
Larry James attempts a 3Pt. Wide open! Cade Poole is 6.6 feet away. [ZONE] LARRY JAMES MAKES IT! Assist: Damian Ginobili
Score: 69-62

[04:17] Team_072 possession (Score: 69-62)
Cade Poole drives to the basket... Cade Poole throws a bad pass! Stolen by Vince Lillard! TURNOVER! (live ball)

[03:58] Team_099 possession (Score: 69-62)
Larry Wade attempts a Midrange. Wide open! Tyrese Williamson is 6.0 feet away. [MAN] Larry Wade misses. Rebound secured by Tracy Giddey.

[03:46] Team_072 possession (Score: 69-62)
Wendell Anthony attempts a 3Pt. Contested by Damian Ginobili (4.4 feet, MAN). Wendell Anthony misses. Rebound secured by Larry Wade.

[03:30] Team_099 possession (Score: 69-62)
Larry Wade drives and kicks out. Larry James attempts a 3Pt. Heavily contested by Cade Poole (1.7 feet, MAN)! Larry James misses. Rebound secured by Tyrese Williamson.

[03:15] Team_072 possession (Score: 69-62)
Wendell Anthony attempts a 3Pt. Contested by Damian Ginobili (5.2 feet, MAN). Wendell Anthony misses. Offensive rebound by Tracy Giddey! Tracy Giddey kicks it out.

[02:59] Team_072 possession (Score: 69-62)
Tyrese Williamson drives to the basket... Tyrese Williamson loses the ball! Stripped by Vince Lillard! TURNOVER! (live ball)

[02:41] Team_099 possession (Score: 69-62)
Larry James makes the Layup and draws the foul on Cade Poole! And-1! Larry James to the line for 1. [Team fouls: 3] (Cade Poole: 2 personal fouls)   FT 1/1: GOOD Larry James makes 1/1 from the line.
Score: 69-65

[02:27] Team_072 possession (Score: 69-65)
FOUL! Holding foul on Larry James. [IN THE BONUS! 6 team fouls] Cade Poole to the line for 2 free throws. (Larry James: 2 personal fouls)   FT 1/2: GOOD   FT 2/2: GOOD Cade Poole makes 2/2 from the line.
Score: 71-65

[02:16] Team_099 possession (Score: 71-65)
Larry Wade attempts a Midrange. Wide open! Wendell Anthony is 7.0 feet away. [ZONE] LARRY WADE MAKES IT!
Score: 71-67

[02:07] Team_072 possession (Score: 71-67)
Tracy Giddey attempts a 3Pt. Heavily contested by Vince Lillard (1.4 feet, MAN)! Tracy Giddey misses. Rebound secured by Vince Lillard.

[01:53] Team_099 possession (Score: 71-67)
Larry Wade drives, Tyrese Williamson stays with him. Larry Wade attempts a Layup. Contested by Tyrese Williamson (4.2 feet, ZONE). LARRY WADE MAKES IT! Assist: Damian Ginobili
Score: 71-69

[01:37] Team_072 possession (Score: 71-69)
FOUL! Reach-in foul on Larry Wade during the drive. [IN THE BONUS! 7 team fouls] Tyrese Williamson to the line for 2 free throws. (Larry Wade: 2 personal fouls)   FT 1/2: MISS   FT 2/2: GOOD Tyrese Williamson makes 1/2 from the line.
Score: 72-69

[01:20] Team_099 possession (Score: 72-69)
Vince Lillard attempts a 3Pt. Contested by Cade Poole (3.2 feet, ZONE). VINCE LILLARD MAKES IT! Assist: Ayo Barrett
Score: 72-72

[01:09] Team_072 possession (Score: 72-72)
Cade Poole attempts a 3Pt. Wide open! Ayo Barrett is 6.6 feet away. [ZONE] Cade Poole misses. Offensive rebound by Tracy Giddey! Tracy Giddey kicks it out.

[00:55] Team_072 possession (Score: 72-72)
Cade Poole makes the Layup and draws the foul on Damian Ginobili! And-1! Cade Poole to the line for 1. [BONUS: 8 team fouls] (Damian Ginobili: 1 personal fouls)   FT 1/1: GOOD Cade Poole makes 1/1 from the line.
Score: 75-72

[00:42] Team_099 possession (Score: 75-72)
Larry James makes the Dunk and draws the foul on Wendell Anthony! And-1! Larry James to the line for 1. [Team fouls: 4] (Wendell Anthony: 1 personal fouls)   FT 1/1: GOOD Larry James makes 1/1 from the line.
Score: 75-75

[00:29] Team_072 possession (Score: 75-75)
Cade Poole drives and kicks out. Collin Griffin attempts a Midrange. Contested by Ayo Barrett (3.6 feet, MAN). Collin Griffin misses. Rebound secured by Damian Ginobili.

[00:18] Team_099 possession (Score: 75-75)
FOUL! Holding foul on Collin Griffin. [IN THE BONUS! 5 team fouls] Ayo Barrett to the line for 2 free throws. (Collin Griffin: 1 personal fouls)   FT 1/2: GOOD   FT 2/2: GOOD Ayo Barrett makes 2/2 from the line.
Score: 75-77

[00:04] Team_072 possession (Score: 75-77)
Collin Griffin attempts a 3Pt. Wide open! Ayo Barrett is 6.9 feet away. [MAN] Collin Griffin misses. Rebound secured by Vince Lillard.

================================================================================
                              3RD QUARTER COMPLETE                              
================================================================================

3RD QUARTER SCORE: Team_072 24, Team_099 31

BOX SCORE:
================================================================================

Team_072
--------------------------------------------------------------------------------
Player                MIN  PTS  REB  AST  TO      FG   FG%      3P   3P%
--------------------------------------------------------------------------------
Wendell Anthony        31    7    0    0   0   3/4    75.0     0/0   0.0
Cade Poole             31    5    0    2   0   2/3    66.7     0/0   0.0
Tracy Giddey           26    4    5    2   0   2/4    50.0     0/0   0.0
Tyrese Williamson      26    4    5    0   0   2/4    50.0     0/0   0.0
Collin Griffin         26    3    0    0   0   1/2    50.0     0/0   0.0

TEAM: FG: 10/17 (58.8%), 3PT: 1/5 (20.0%), REB: 10 (3 off, 7 def), AST: 4, TO: 5
TEAM FOULS: 5 [Team_099 in BONUS]


Team_099
--------------------------------------------------------------------------------
Player                MIN  PTS  REB  AST  TO      FG   FG%      3P   3P%
--------------------------------------------------------------------------------
Ayo Barrett            26    9    0    2   0   4/4   100.0     0/0   0.0
Larry James            26    9    0    0   0   3/4    75.0     0/0   0.0
Vince Lillard          31    7    5    0   0   3/4    75.0     0/0   0.0
Larry Wade             31    6    3    3   0   3/7    42.9     0/0   0.0
Damian Ginobili        31    0    1    2   0   0/1     0.0     0/0   0.0

TEAM: FG: 13/20 (65.0%), 3PT: 4/6 (66.7%), REB: 9 (2 off, 7 def), AST: 7, TO: 1
TEAM FOULS: 8 [Team_072 in BONUS]

================================================================================

================================================================================
                       4TH QUARTER - Team_072 vs Team_099                       
================================================================================

[12:00] Team_072 possession (Score: 75-77)
Tyrese Williamson attempts a 3Pt. Contested by Ayo Barrett (5.2 feet, ZONE). Tyrese Williamson misses. Offensive rebound by Tyrese Williamson! Tyrese Williamson kicks it out.

[11:46] Team_072 possession (Score: 75-77)
Collin Griffin drives to the basket... FOUL! Offensive foul on Collin Griffin! Vince Lillard drew the charge! [Team fouls: 1] (Collin Griffin: 1 personal fouls) TURNOVER! (dead ball)

[11:32] Team_099 possession (Score: 75-77)
Larry Wade attempts a Layup. Contested by Tyrese Williamson (5.7 feet, MAN). LARRY WADE MAKES IT!
Score: 75-79

[11:21] Team_072 possession (Score: 75-79)
Tracy Giddey drives, Vince Lillard stays with him. Tracy Giddey attempts a Layup. Heavily contested by Vince Lillard (0.5 feet, ZONE)! TRACY GIDDEY MAKES IT!
Score: 77-79

[11:06] Team_099 possession (Score: 77-79)
FOUL! Holding foul on Wendell Anthony. [Team fouls: 2] No free throws, side out. (Wendell Anthony: 1 personal fouls)

[10:50] Team_099 possession (Score: 77-79)
Larry James attempts a Layup. BLOCKED BY CADE POOLE! Ball is loose! Rebound secured by Tracy Giddey.

[10:33] Team_072 possession (Score: 77-79)
Wendell Anthony makes the Layup and draws the foul on Vince Lillard! And-1! Wendell Anthony to the line for 1. [Team fouls: 1] (Vince Lillard: 1 personal fouls)   FT 1/1: GOOD Wendell Anthony makes 1/1 from the line.
Score: 80-79

[10:19] Team_099 possession (Score: 80-79)
Ayo Barrett attempts a Midrange. Contested by Cade Poole (5.4 feet, ZONE). Ayo Barrett misses. Rebound secured by Wendell Anthony.

[10:07] Team_072 possession (Score: 80-79)
Tracy Giddey makes the Dunk and draws the foul on Ayo Barrett! And-1! Tracy Giddey to the line for 1. [Team fouls: 2] (Ayo Barrett: 1 personal fouls)   FT 1/1: GOOD Tracy Giddey makes 1/1 from the line.
Score: 83-79

[09:53] Team_099 possession (Score: 83-79)
Ayo Barrett drives, picks up Collin Griffin. Help arrives from Wendell Anthony! Ayo Barrett attempts a Layup. Contested by Wendell Anthony (4.1 feet, MAN). AYO BARRETT MAKES IT!
Score: 83-81

[09:40] Team_072 possession (Score: 83-81)
Collin Griffin drives and kicks out. Cade Poole attempts a 3Pt. Wide open! Larry James is 9.0 feet away. [MAN] CADE POOLE MAKES IT! Assist: Wendell Anthony
Score: 86-81

[09:24] Team_099 possession (Score: 86-81)
FOUL! Shooting foul on Collin Griffin. Damian Ginobili to the line for 2 free throws. [Team fouls: 3] (Collin Griffin: 2 personal fouls)   FT 1/2: MISS   FT 2/2: GOOD Damian Ginobili makes 1/2 from the line.
Score: 86-82

[09:07] Team_072 possession (Score: 86-82)
Cade Poole attempts a 3Pt. Wide open! Larry James is 6.3 feet away. [MAN] Cade Poole misses. FOUL! Loose ball foul on Vince Lillard during the rebound battle. [Team fouls: 3] No free throws, side out. (Vince Lillard: 2 personal fouls)

[08:48] Team_072 possession (Score: 86-82)
Cade Poole attempts a 3Pt. Contested by Ayo Barrett (2.1 feet, ZONE). CADE POOLE MAKES IT! Assist: Tyrese Williamson
Score: 89-82

[08:32] Team_099 possession (Score: 89-82)
Vince Lillard attempts a Midrange. Contested by Cade Poole (4.5 feet, ZONE). Vince Lillard misses. Rebound secured by Wendell Anthony.

[08:13] Team_072 possession (Score: 89-82)
Tyrese Williamson attempts a Midrange. Wide open! Damian Ginobili is 8.2 feet away. [ZONE] Tyrese Williamson misses. Offensive rebound by Tyrese Williamson! Tyrese Williamson kicks it out.

[07:55] Team_072 possession (Score: 89-82)
FOUL! Reach-in foul on Vince Lillard during the drive. [Team fouls: 4] No free throws, side out. (Vince Lillard: 3 personal fouls)

[07:41] Team_072 possession (Score: 89-82)
Collin Griffin attempts a Midrange. Heavily contested by Vince Lillard (1.7 feet, ZONE)! COLLIN GRIFFIN MAKES IT! Assist: Wendell Anthony
Score: 91-82

[07:31] Team_099 possession (Score: 91-82)
Ayo Barrett attempts a 3Pt. Wide open! Cade Poole is 6.7 feet away. [ZONE] Ayo Barrett misses. FOUL! Loose ball foul on Tyrese Williamson during the rebound battle. [Team fouls: 4] No free throws, side out. (Tyrese Williamson: 1 personal fouls)

[07:16] Team_099 possession (Score: 91-82)
Damian Ginobili attempts a 3Pt. Contested by Collin Griffin (4.7 feet, ZONE). DAMIAN GINOBILI MAKES IT! Assist: Ayo Barrett
Score: 91-85

[07:02] Team_072 possession (Score: 91-85)
Tyrese Williamson attempts a Layup. Heavily contested by Vince Lillard (0.9 feet, ZONE)! Tyrese Williamson misses. Rebound secured by Larry Wade.

[06:49] Team_099 possession (Score: 91-85)
Ayo Barrett attempts a Midrange. Wide open! Wendell Anthony is 8.6 feet away. [ZONE] Ayo Barrett misses. Rebound secured by Wendell Anthony.

[06:36] Team_072 possession (Score: 91-85)
Cade Poole loses control! Ball rolls out of bounds! TURNOVER! (dead ball)

[06:36] Substitution (Team_072): Collin Griffin OUT → Giannis Gobert IN (stamina_rule2)

[06:36] Substitution (Team_072): Cade Poole OUT → CJ Jokic IN (stamina_rule2)

[06:36] Substitution (Team_072): Wendell Anthony OUT → CJ Bane IN (stamina_rule2)

[06:36] Substitution (Team_072): Tracy Giddey OUT → Brandon Durant IN (stamina_rule2)

[06:36] Substitution (Team_072): Tyrese Williamson OUT → Stephen Holiday IN (stamina_rule2)

[06:36] Substitution (Team_099): Ayo Barrett OUT → CJ Cunningham IN (stamina_rule2)

[06:36] Substitution (Team_099): Larry James OUT → Manu Johnson IN (stamina_rule2)

[06:36] Substitution (Team_099): Damian Ginobili OUT → Scottie Quickley IN (stamina_rule2)

[06:36] Substitution (Team_099): Vince Lillard OUT → Donovan Green IN (stamina_rule2)

[06:36] Substitution (Team_099): Larry Wade OUT → Jarrett Fox IN (stamina_rule2)

[06:18] Team_099 possession (Score: 91-85)
Jarrett Fox attempts a Layup. Contested by Stephen Holiday (5.5 feet, MAN). JARRETT FOX MAKES IT!
Score: 91-87

[06:04] Team_072 possession (Score: 91-87)
CJ Jokic attempts a 3Pt. Contested by Manu Johnson (4.1 feet, MAN). CJ JOKIC MAKES IT! Assist: CJ Bane
Score: 94-87

[05:53] Team_099 possession (Score: 94-87)
Jarrett Fox attempts a Layup. Contested by Stephen Holiday (3.9 feet, MAN). JARRETT FOX MAKES IT!
Score: 94-89

[05:37] Team_072 possession (Score: 94-89)
Brandon Durant attempts a Layup. BLOCKED BY JARRETT FOX! Ball goes out off Jarrett Fox. Brandon Durant's ball!

[05:23] Team_072 possession (Score: 94-89)
Brandon Durant drives, Donovan Green stays with him. Brandon Durant attempts a Dunk. Contested by Donovan Green (5.5 feet, MAN). Brandon Durant misses. Rebound secured by Jarrett Fox.

[05:07] Team_099 possession (Score: 94-89)
Jarrett Fox drives to the basket... Jarrett Fox commits a violation (traveling/carry)! TURNOVER! (dead ball)

[04:52] Team_072 possession (Score: 94-89)
Brandon Durant loses the ball! Stripped by Donovan Green! TURNOVER! (live ball)

[04:37] Team_099 possession (Score: 94-89)
Manu Johnson drives, CJ Jokic stays with him. Manu Johnson attempts a Layup. Wide open! CJ Jokic is 8.8 feet away. [MAN] Manu Johnson misses. Offensive rebound by Jarrett Fox! Jarrett Fox puts it back in!
Score: 94-91

[04:25] Team_072 possession (Score: 94-91)
FOUL! Shooting foul on Manu Johnson. CJ Jokic to the line for 3 free throws. [BONUS: 5 team fouls] (Manu Johnson: 1 personal fouls)   FT 1/3: MISS   FT 2/3: GOOD   FT 3/3: GOOD CJ Jokic makes 2/3 from the line.
Score: 96-91

[04:11] Team_099 possession (Score: 96-91)
Scottie Quickley attempts a 3Pt. Contested by CJ Bane (5.1 feet, MAN). Scottie Quickley misses. Rebound secured by CJ Jokic.

[04:00] Team_072 possession (Score: 96-91)
CJ Jokic attempts a Layup. Contested by Jarrett Fox (2.6 feet, ZONE). CJ JOKIC MAKES IT!
Score: 98-91

[03:45] Team_099 possession (Score: 98-91)
Manu Johnson drives and kicks out. Donovan Green attempts a 3Pt. Contested by Brandon Durant (3.7 feet, MAN). Donovan Green misses. FOUL! Loose ball foul on Stephen Holiday during the rebound battle. [IN THE BONUS! 5 team fouls] Jarrett Fox to the line for 2 free throws. (Stephen Holiday: 1 personal fouls)   FT 1/2: GOOD   FT 2/2: MISS Jarrett Fox makes 1/2 from the line. Rebound secured by Stephen Holiday.
Score: 98-92

[03:31] Team_072 possession (Score: 98-92)
Brandon Durant attempts a Layup. BLOCKED BY MANU JOHNSON! Ball is loose! Rebound secured by Jarrett Fox.

[03:21] Team_099 possession (Score: 98-92)
Scottie Quickley commits a violation (traveling/carry)! TURNOVER! (dead ball)

[03:07] Team_072 possession (Score: 98-92)
Brandon Durant throws a bad pass out of bounds! TURNOVER! (dead ball)

[02:55] Team_099 possession (Score: 98-92)
CJ Cunningham attempts a 3Pt. Contested by Giannis Gobert (3.5 feet, MAN). CJ Cunningham misses. Offensive rebound by Jarrett Fox! Jarrett Fox's putback is no good. Offensive rebound by Jarrett Fox! Jarrett Fox kicks it out.

[02:42] Team_099 possession (Score: 98-92)
Scottie Quickley drives, CJ Bane stays with him. Scottie Quickley attempts a Dunk. Heavily contested by CJ Bane (1.4 feet, MAN)! Scottie Quickley misses. Rebound secured by Brandon Durant.

[02:24] Team_072 possession (Score: 98-92)
Giannis Gobert drives, Jarrett Fox stays with him. Giannis Gobert attempts a Layup. Contested by Jarrett Fox (2.9 feet, ZONE). GIANNIS GOBERT MAKES IT!
Score: 100-92

[02:12] Team_099 possession (Score: 100-92)
Scottie Quickley attempts a Layup. Contested by Stephen Holiday (5.8 feet, ZONE). Scottie Quickley misses. Rebound secured by CJ Jokic.

[01:56] Team_072 possession (Score: 100-92)
Giannis Gobert commits a violation (traveling/carry)! TURNOVER! (dead ball)

[01:43] Team_099 possession (Score: 100-92)
Manu Johnson attempts a Layup. Contested by Stephen Holiday (3.8 feet, ZONE). MANU JOHNSON MAKES IT!
Score: 100-94

[01:33] Team_072 possession (Score: 100-94)
Brandon Durant attempts a 3Pt. Contested by Manu Johnson (4.3 feet, ZONE). Brandon Durant misses. Rebound secured by Donovan Green.

[01:20] Team_099 possession (Score: 100-94)
Scottie Quickley attempts a 3Pt. Wide open! Giannis Gobert is 6.6 feet away. [ZONE] SCOTTIE QUICKLEY MAKES IT! Assist: CJ Cunningham
Score: 100-97

[01:04] Team_072 possession (Score: 100-97)
Giannis Gobert attempts a Layup. Contested by CJ Cunningham (5.9 feet, MAN). GIANNIS GOBERT MAKES IT! Assist: Brandon Durant
Score: 102-97

[00:51] Team_099 possession (Score: 102-97)
CJ Cunningham drives, Giannis Gobert stays with him. CJ Cunningham attempts a Layup. Contested by Giannis Gobert (2.3 feet, MAN). CJ Cunningham misses. Rebound secured by Stephen Holiday.

[00:38] Team_072 possession (Score: 102-97)
Giannis Gobert attempts a Midrange. Contested by CJ Cunningham (4.0 feet, MAN). GIANNIS GOBERT MAKES IT! Assist: CJ Bane
Score: 104-97

[00:23] Team_099 possession (Score: 104-97)
FOUL! Shooting foul on Giannis Gobert. CJ Cunningham to the line for 3 free throws. [BONUS: 6 team fouls] (Giannis Gobert: 1 personal fouls)   FT 1/3: GOOD   FT 2/3: MISS   FT 3/3: GOOD CJ Cunningham makes 2/3 from the line.
Score: 104-99

[00:04] Team_072 possession (Score: 104-99)
Stephen Holiday drives, picks up Jarrett Fox. Help arrives from Manu Johnson! Stephen Holiday attempts a Layup. Contested by Manu Johnson (4.7 feet, ZONE). Stephen Holiday misses. Offensive rebound by Stephen Holiday! Stephen Holiday kicks it out.

================================================================================
                              4TH QUARTER COMPLETE                              
================================================================================

4TH QUARTER SCORE: Team_072 29, Team_099 22

BOX SCORE:
================================================================================

Team_072
--------------------------------------------------------------------------------
Player                MIN  PTS  REB  AST  TO      FG   FG%      3P   3P%
--------------------------------------------------------------------------------
CJ Jokic               12    7    2    0   0   3/3   100.0     0/0   0.0
Cade Poole             37    6    0    0   0   2/2   100.0     0/0   0.0
Giannis Gobert         17    6    0    0   0   3/3   100.0     0/0   0.0
Tracy Giddey           32    5    2    0   0   2/2   100.0     0/0   0.0
Wendell Anthony        37    3    3    2   0   1/1   100.0     0/0   0.0
Collin Griffin         32    2    0    0   0   1/1   100.0     0/0   0.0
Tyrese Williamson      32    0    2    1   0   0/1     0.0     0/0   0.0
CJ Bane                12    0    0    2   0   0/0     0.0     0/0   0.0
Brandon Durant         17    0    1    1   0   0/3     0.0     0/0   0.0
Stephen Holiday        17    0    3    0   0   0/0     0.0     0/0   0.0

TEAM: FG: 12/16 (75.0%), 3PT: 3/4 (75.0%), REB: 12 (4 off, 8 def), AST: 6, TO: 5
TEAM FOULS: 6 [Team_099 in BONUS]


Team_099
--------------------------------------------------------------------------------
Player                MIN  PTS  REB  AST  TO      FG   FG%      3P   3P%
--------------------------------------------------------------------------------
Jarrett Fox            12    6    4    0   0   3/3   100.0     0/0   0.0
Damian Ginobili        37    4    0    0   0   2/2   100.0     0/0   0.0
Scottie Quickley       12    3    0    0   0   1/4    25.0     0/0   0.0
Larry Wade             37    2    2    0   0   1/1   100.0     0/0   0.0
Ayo Barrett            32    2    0    1   0   1/3    33.3     0/0   0.0
Manu Johnson           17    2    0    0   0   1/2    50.0     0/0   0.0
CJ Cunningham          17    2    0    1   0   1/2    50.0     0/0   0.0
Larry James            32    0    0    0   0   0/1     0.0     0/0   0.0
Vince Lillard          37    0    0    0   0   0/1     0.0     0/0   0.0
Donovan Green          12    0    1    0   0   0/0     0.0     0/0   0.0

TEAM: FG: 10/19 (52.6%), 3PT: 3/4 (75.0%), REB: 8 (4 off, 4 def), AST: 2, TO: 2
TEAM FOULS: 5 [Team_072 in BONUS]

================================================================================

================================================================================
                               FULL GAME COMPLETE                               
================================================================================

FINAL SCORE: Team_072 104, Team_099 99

SCORING BY QUARTER:
--------------------------------------------------------------------------------
Team                     Q1     Q2     Q3     Q4    FINAL
--------------------------------------------------------------------------------
Team_072                 30     21     24     29      104
Team_099                 28     18     31     22       99
--------------------------------------------------------------------------------

FULL GAME BOX SCORE:
================================================================================

Team_072
--------------------------------------------------------------------------------
Player                MIN  PTS  REB  AST  TO      FG   FG%      3P   3P%      FT STL BLK
--------------------------------------------------------------------------------
Cade Poole             37   16    0    3   3   5/7    71.4   1/2    50.0   4/5     0   1
Wendell Anthony        37   26    7    3   3  11/15   73.3   3/6    50.0   6/8     0   0
Collin Griffin         32   17    0    2   1   8/11   72.7   3/5    60.0   4/4     0   0
Tracy Giddey           32   11   13    4   2   4/8    50.0   0/3     0.0   3/3     0   0
Tyrese Williamson      32   13    9    3   0   6/11   54.5   0/0     0.0   3/4     1   0
Giannis Gobert         17    6    0    1   1   3/3   100.0   0/0     0.0   0/0     2   0
Brandon Durant         17    4    4    1   3   2/6    33.3   1/2    50.0   1/2     0   0
Stephen Holiday        17    2    7    1   0   1/5    20.0   0/0     0.0   0/0     0   0
CJ Jokic               12    7    2    1   1   3/5    60.0   2/3    66.7   3/5     0   0
CJ Bane                12    0    0    2   0   0/2     0.0   0/1     0.0   0/0     1   0

TEAM: FG: 44/75 (58.7%), 3PT: 10/22 (45.5%), REB: 40 (12 off, 28 def), AST: 21, TO: 14


Team_099
--------------------------------------------------------------------------------
Player                MIN  PTS  REB  AST  TO      FG   FG%      3P   3P%      FT STL BLK
--------------------------------------------------------------------------------
Damian Ginobili        37    9    6    3   1   4/8    50.0   2/2   100.0   2/4     1   0
Vince Lillard          37   13   11    0   1   5/9    55.6   3/5    60.0   1/2     3   2
Larry Wade             37   12   11    3   2   5/10   50.0   0/0     0.0   1/3     0   0
Ayo Barrett            32   13    0    5   1   6/8    75.0   1/1   100.0   2/2     0   0
Larry James            32   24    0    0   4  10/16   62.5   2/5    40.0   4/5     1   0
CJ Cunningham          17    6    0    2   1   4/6    66.7   1/1   100.0   4/5     0   0
Manu Johnson           17    5    0    0   1   2/4    50.0   0/1     0.0   0/0     0   1
Scottie Quickley       12    3    1    1   2   2/5    40.0   1/2    50.0   0/0     0   0
Donovan Green          12    1    6    0   1   2/2   100.0   0/0     0.0   1/2     1   0
Jarrett Fox            12    8    6    1   0   2/3    66.7   0/0     0.0   1/2     0   3

TEAM: FG: 43/73 (58.9%), 3PT: 10/17 (58.8%), REB: 43 (13 off, 30 def), AST: 15, TO: 14

================================================================================
