================================================================================
                        FULL GAME - Team_030 vs Team_023                        
================================================================================

================================================================================
                       1ST QUARTER - Team_030 vs Team_023                       
================================================================================

[12:00] Team_030 possession (Score: 0-0)
Joel Anunoby attempts a 3Pt. Contested by Kyle Paul (3.3 feet, MAN). Joel Anunoby misses. Offensive rebound by Jordan Nowitzki! Jordan Nowitzki puts it back in!
Score: 2-0

[11:49] Team_023 possession (Score: 2-0)
Trae Ingram attempts a 3Pt. Contested by Tyler Beal (2.5 feet, MAN). Trae Ingram misses. Rebound secured by Joel Anunoby.

[11:34] Team_030 possession (Score: 2-0)
Jordan Nowitzki attempts a 3Pt. Contested by Josh Morant (4.1 feet, MAN). Jordan Nowitzki misses. Rebound secured by Kyle Paul.

[11:17] Team_023 possession (Score: 2-0)
FOUL! Reach-in foul on Jaren Green during the drive. [Team fouls: 1] No free throws, side out. (Jaren Green: 1 personal fouls)

[11:01] Team_023 possession (Score: 2-0)
Tim Bane drives and kicks out. Collin Ginobili attempts a 3Pt. Contested by Tyler Beal (5.5 feet, ZONE). COLLIN GINOBILI MAKES IT! Assist: Kyle Paul
Score: 2-3

[10:45] Team_030 possession (Score: 2-3)
Joel Anunoby attempts a 3Pt. Contested by Kyle Paul (2.1 feet, ZONE). Joel Anunoby misses. Rebound secured by Kyle Paul.

[10:34] Team_023 possession (Score: 2-3)
Tim Bane attempts a Midrange. Contested by Jaren Green (2.8 feet, MAN). Tim Bane misses. Rebound secured by Jaren Green.

[10:19] Team_030 possession (Score: 2-3)
Tim Barrett attempts a Layup. BLOCKED BY TIM BANE! Ball deflects out of bounds off Tim Barrett.

[10:10] Team_023 possession (Score: 2-3)
Kyle Paul drives, picks up Jaren Green. Help arrives from Tyler Beal! Kyle Paul attempts a Dunk. Contested by Tyler Beal (4.0 feet, ZONE). KYLE PAUL MAKES IT!
Score: 2-5

[09:55] Team_030 possession (Score: 2-5)
Tyler Beal attempts a Layup. BLOCKED BY TIM BANE! Ball is loose! Offensive rebound by Jordan Nowitzki! Jordan Nowitzki kicks it out.

[09:41] Team_030 possession (Score: 2-5)
Jordan Nowitzki attempts a 3Pt. Contested by Kyle Paul (3.1 feet, ZONE). Jordan Nowitzki misses. Rebound secured by Kyle Paul.

[09:31] Team_023 possession (Score: 2-5)
Kyle Paul attempts a 3Pt. Contested by Tyler Beal (4.2 feet, ZONE). Kyle Paul misses. Offensive rebound by Tim Bane! Tim Bane puts it back in!
Score: 2-7

[09:17] Team_030 possession (Score: 2-7)
Tyler Beal attempts a 3Pt. Contested by Kyle Paul (3.4 feet, ZONE). Tyler Beal misses. Rebound secured by Tim Bane.

[09:04] Team_023 possession (Score: 2-7)
Trae Ingram attempts a Layup. BLOCKED BY JAREN GREEN! Ball deflects out of bounds off Trae Ingram.

[08:52] Team_030 possession (Score: 2-7)
FOUL! Holding foul on Trae Ingram. [Team fouls: 1] No free throws, side out. (Trae Ingram: 1 personal fouls)

[08:41] Team_030 possession (Score: 2-7)
Tyler Beal attempts a 3Pt. Contested by Trae Ingram (2.1 feet, MAN). Tyler Beal misses. Rebound secured by Josh Morant.

[08:25] Team_023 possession (Score: 2-7)
Kyle Paul attempts a Midrange. Contested by Tim Barrett (2.7 feet, ZONE). Kyle Paul misses. Rebound secured by Jaren Green.

[08:07] Team_030 possession (Score: 2-7)
FOUL! Offensive foul on Joel Anunoby! Kyle Paul drew the charge! [Team fouls: 2] (Joel Anunoby: 1 personal fouls) TURNOVER! (dead ball)

[07:56] Team_023 possession (Score: 2-7)
Kyle Paul attempts a Midrange. Wide open! Jordan Nowitzki is 6.5 feet away. [ZONE] Kyle Paul misses. Offensive rebound by Tim Bane! Tim Bane puts it back in!
Score: 2-9

[07:43] Team_030 possession (Score: 2-9)
Tim Barrett attempts a Layup. BLOCKED BY TIM BANE! Ball deflects out of bounds off Tim Barrett.

[07:28] Team_023 possession (Score: 2-9)
Kyle Paul attempts a Layup. Contested by Jaren Green (2.4 feet, ZONE). Kyle Paul misses. Rebound secured by Jordan Nowitzki.

[07:14] Team_030 possession (Score: 2-9)
Tyler Beal attempts a Midrange. Contested by Josh Morant (3.9 feet, ZONE). Tyler Beal misses. Rebound secured by Kyle Paul.

[07:05] Team_023 possession (Score: 2-9)
Kyle Paul drives and kicks out. Tim Bane attempts a Midrange. Contested by Jaren Green (3.1 feet, MAN). TIM BANE MAKES IT!
Score: 2-11

[06:50] Team_030 possession (Score: 2-11)
Jordan Nowitzki makes the Layup and draws the foul on Tim Bane! And-1! Jordan Nowitzki to the line for 1. [Team fouls: 2] (Tim Bane: 1 personal fouls)   FT 1/1: GOOD Jordan Nowitzki makes 1/1 from the line.
Score: 5-11

[06:36] Team_023 possession (Score: 5-11)
Josh Morant drives and kicks out. Trae Ingram attempts a 3Pt. Contested by Tyler Beal (4.9 feet, ZONE). Trae Ingram misses. Rebound secured by Jaren Green.

[06:21] Team_030 possession (Score: 5-11)
Tyler Beal drives to the basket... Tyler Beal loses the ball! Stripped by Tim Bane! TURNOVER! (live ball)

[06:09] Team_023 possession (Score: 5-11)
Tim Bane drives and kicks out. Collin Ginobili attempts a Midrange. Wide open! Jordan Nowitzki is 6.3 feet away. [ZONE] Collin Ginobili misses. Rebound secured by Jaren Green.

[05:52] Team_030 possession (Score: 5-11)
Jordan Nowitzki attempts a Midrange. Contested by Josh Morant (5.3 feet, MAN). Jordan Nowitzki misses. Rebound secured by Josh Morant.

[05:39] Team_023 possession (Score: 5-11)
Kyle Paul attempts a Midrange. Contested by Joel Anunoby (4.5 feet, MAN). Kyle Paul misses. Rebound secured by Joel Anunoby.

[05:23] Team_030 possession (Score: 5-11)
Tim Barrett attempts a 3Pt. Heavily contested by Kyle Paul (1.2 feet, ZONE)! Tim Barrett misses. Rebound secured by Josh Morant.

[05:10] Team_023 possession (Score: 5-11)
FOUL! Shooting foul on Jaren Green. Tim Bane to the line for 2 free throws. [Team fouls: 3] (Jaren Green: 2 personal fouls)   FT 1/2: GOOD   FT 2/2: GOOD Tim Bane makes 2/2 from the line.
Score: 5-13

[04:55] Team_030 possession (Score: 5-13)
Joel Anunoby drives, picks up Kyle Paul. Help arrives from Trae Ingram! Joel Anunoby attempts a Dunk. Contested by Trae Ingram (2.6 feet, MAN). JOEL ANUNOBY MAKES IT! Assist: Tyler Beal
Score: 7-13

[04:39] Team_023 possession (Score: 7-13)
Josh Morant attempts a Midrange. Contested by Jordan Nowitzki (4.5 feet, ZONE). JOSH MORANT MAKES IT! Assist: Trae Ingram
Score: 7-15

[04:29] Team_030 possession (Score: 7-15)
Jaren Green attempts a Layup. Contested by Tim Bane (3.4 feet, MAN). JAREN GREEN MAKES IT!
Score: 9-15

[04:15] Team_023 possession (Score: 9-15)
Collin Ginobili throws a bad pass! Stolen by Tim Barrett! TURNOVER! (live ball)

[03:58] Team_030 possession (Score: 9-15)
Joel Anunoby drives and kicks out. Joel Anunoby attempts a 3Pt. Heavily contested by Kyle Paul (1.7 feet, ZONE)! JOEL ANUNOBY MAKES IT!
Score: 12-15

[03:45] Team_023 possession (Score: 12-15)
Josh Morant drives and kicks out. Kyle Paul attempts a 3Pt. Contested by Tyler Beal (2.7 feet, ZONE). Kyle Paul misses. Rebound secured by Jaren Green.

[03:29] Team_030 possession (Score: 12-15)
Tim Barrett drives, Collin Ginobili stays with him. Tim Barrett attempts a Dunk. Contested by Collin Ginobili (4.6 feet, MAN). TIM BARRETT MAKES IT! Assist: Jordan Nowitzki
Score: 14-15

[03:15] Team_023 possession (Score: 14-15)
Kyle Paul attempts a 3Pt. Wide open! Joel Anunoby is 6.2 feet away. [MAN] Kyle Paul misses. Rebound secured by Jaren Green.

[03:06] Team_030 possession (Score: 14-15)
Tyler Beal attempts a 3Pt. Contested by Trae Ingram (3.1 feet, MAN). Tyler Beal misses. Offensive rebound by Jordan Nowitzki! Jordan Nowitzki kicks it out.

[02:50] Team_030 possession (Score: 14-15)
Jaren Green drives to the basket... Jaren Green throws a bad pass out of bounds! TURNOVER! (dead ball)

[02:50] Substitution (Team_030): Tim Barrett OUT → Josh Smith IN (stamina_rule2)

[02:50] Substitution (Team_030): Jordan Nowitzki OUT → Damian Green IN (stamina_rule2)

[02:50] Substitution (Team_030): Jaren Green OUT → Franz Anunoby IN (stamina_rule2)

[02:50] Substitution (Team_023): Trae Ingram OUT → Tracy Anthony IN (stamina_rule2)

[02:50] Substitution (Team_023): Collin Ginobili OUT → Magic Booker IN (stamina_rule2)

[02:50] Substitution (Team_023): Kyle Paul OUT → Gary Westbrook IN (stamina_rule2)

[02:50] Substitution (Team_023): Josh Morant OUT → Evan Parker IN (stamina_rule2)

[02:50] Substitution (Team_023): Tim Bane OUT → Vince Gasol IN (stamina_rule2)

[02:35] Team_023 possession (Score: 14-15)
Vince Gasol drives to the basket... Vince Gasol commits a violation (traveling/carry)! TURNOVER! (dead ball)

[02:35] Substitution (Team_030): Tyler Beal OUT → RJ Carter IN (stamina_rule2)

[02:19] Team_030 possession (Score: 14-15)
Josh Smith throws a bad pass out of bounds! TURNOVER! (dead ball)

[02:19] Substitution (Team_030): Joel Anunoby OUT → Pau James IN (stamina_rule2)

[02:05] Team_023 possession (Score: 14-15)
Tracy Anthony attempts a Midrange. Wide open! Pau James is 7.8 feet away. [ZONE] Tracy Anthony misses. Rebound secured by Pau James.

[01:50] Team_030 possession (Score: 14-15)
Pau James throws a bad pass out of bounds! TURNOVER! (dead ball)

[01:38] Team_023 possession (Score: 14-15)
Magic Booker attempts a 3Pt. Contested by Josh Smith (2.8 feet, MAN). Magic Booker misses. Rebound secured by Damian Green.

[01:25] Team_030 possession (Score: 14-15)
Josh Smith drives, picks up Magic Booker. Help arrives from Gary Westbrook! Josh Smith attempts a Dunk. Heavily contested by Gary Westbrook (0.5 feet, MAN)! JOSH SMITH MAKES IT! Assist: Damian Green
Score: 16-15

[01:14] Team_023 possession (Score: 16-15)
Evan Parker drives, Damian Green stays with him. Evan Parker attempts a Dunk. Contested by Damian Green (4.9 feet, MAN). EVAN PARKER MAKES IT! Assist: Gary Westbrook
Score: 16-17

[01:02] Team_030 possession (Score: 16-17)
Franz Anunoby attempts a Midrange. Contested by Vince Gasol (4.5 feet, MAN). Franz Anunoby misses. Rebound secured by Vince Gasol.

[00:52] Team_023 possession (Score: 16-17)
Magic Booker commits a violation (traveling/carry)! TURNOVER! (dead ball)

[00:39] Team_030 possession (Score: 16-17)
FOUL! Shooting foul on Vince Gasol. Franz Anunoby to the line for 2 free throws. [Team fouls: 3] (Vince Gasol: 1 personal fouls)   FT 1/2: GOOD   FT 2/2: MISS Franz Anunoby makes 1/2 from the line. Offensive rebound by Damian Green! Damian Green kicks it out.
Score: 17-17

[00:21] Team_030 possession (Score: 17-17)
Franz Anunoby attempts a 3Pt. Wide open! Magic Booker is 6.4 feet away. [ZONE] FRANZ ANUNOBY MAKES IT!
Score: 20-17

[00:03] Team_023 possession (Score: 20-17)
Evan Parker makes the Midrange and draws the foul on Pau James! And-1! Evan Parker to the line for 1. [Team fouls: 4] (Pau James: 1 personal fouls)   FT 1/1: GOOD Evan Parker makes 1/1 from the line.
Score: 20-20

================================================================================
                              1ST QUARTER COMPLETE                              
================================================================================

1ST QUARTER SCORE: Team_030 20, Team_023 20

BOX SCORE:
================================================================================

Team_030
--------------------------------------------------------------------------------
Player                MIN  PTS  REB  AST  TO      FG   FG%      3P   3P%
--------------------------------------------------------------------------------
Jordan Nowitzki         9    5    4    1   0   2/5    40.0     0/0   0.0
Joel Anunoby           10    5    2    0   0   2/3    66.7     0/0   0.0
Franz Anunoby           3    3    0    0   0   1/2    50.0     0/0   0.0
Jaren Green             9    2    6    0   0   1/1   100.0     0/0   0.0
Tim Barrett             9    2    0    0   0   1/4    25.0     0/0   0.0
Josh Smith              3    2    0    0   0   1/1   100.0     0/0   0.0
Tyler Beal             10    0    0    1   0   0/3     0.0     0/0   0.0
Pau James               2    0    1    0   0   0/0     0.0     0/0   0.0
Damian Green            3    0    2    1   0   0/0     0.0     0/0   0.0

TEAM: FG: 8/19 (42.1%), 3PT: 2/8 (25.0%), REB: 15 (4 off, 11 def), AST: 3, TO: 5
TEAM FOULS: 4


Team_023
--------------------------------------------------------------------------------
Player                MIN  PTS  REB  AST  TO      FG   FG%      3P   3P%
--------------------------------------------------------------------------------
Tim Bane                9    8    3    0   0   4/6    66.7     0/0   0.0
Evan Parker             3    5    0    0   0   2/2   100.0     0/0   0.0
Collin Ginobili         9    3    0    0   0   1/1   100.0     0/0   0.0
Kyle Paul               9    2    4    1   0   1/5    20.0     0/0   0.0
Josh Morant             9    2    3    0   0   1/3    33.3     0/0   0.0
Trae Ingram             9    0    0    1   0   0/2     0.0     0/0   0.0
Tracy Anthony           3    0    0    0   0   0/1     0.0     0/0   0.0
Magic Booker            3    0    0    0   0   0/1     0.0     0/0   0.0
Gary Westbrook          3    0    0    1   0   0/0     0.0     0/0   0.0
Vince Gasol             3    0    1    0   0   0/0     0.0     0/0   0.0

TEAM: FG: 9/21 (42.9%), 3PT: 1/4 (25.0%), REB: 11 (2 off, 9 def), AST: 3, TO: 3
TEAM FOULS: 3

================================================================================

================================================================================
                       2ND QUARTER - Team_030 vs Team_023                       
================================================================================

[12:00] Team_030 possession (Score: 20-20)
Jaren Green drives, Tim Bane stays with him. Jaren Green attempts a Layup. Contested by Tim Bane (2.2 feet, MAN). JAREN GREEN MAKES IT! Assist: Tim Barrett
Score: 22-20

[11:45] Team_023 possession (Score: 22-20)
Collin Ginobili attempts a Midrange. Contested by Tim Barrett (2.9 feet, MAN). COLLIN GINOBILI MAKES IT!
Score: 22-22

[11:32] Team_030 possession (Score: 22-22)
Tim Barrett drives, Tim Bane stays with him. Tim Barrett attempts a Layup. Heavily contested by Tim Bane (1.2 feet, ZONE)! Tim Barrett misses. Rebound secured by Tim Bane.

[11:22] Team_023 possession (Score: 22-22)
FOUL! Holding foul on Jaren Green. [Team fouls: 1] No free throws, side out. (Jaren Green: 1 personal fouls)

[11:07] Team_023 possession (Score: 22-22)
Kyle Paul attempts a Midrange. BLOCKED BY JOEL ANUNOBY! Ball is loose! Rebound secured by Jordan Nowitzki.

[10:53] Team_030 possession (Score: 22-22)
Jaren Green attempts a 3Pt. Contested by Kyle Paul (5.1 feet, ZONE). Jaren Green misses. Rebound secured by Kyle Paul.

[10:42] Team_023 possession (Score: 22-22)
Trae Ingram throws a bad pass! Stolen by Tyler Beal! TURNOVER! (live ball)

[10:25] Team_030 possession (Score: 22-22)
Jaren Green attempts a Dunk. BLOCKED BY TIM BANE! Ball is loose! Offensive rebound by Joel Anunoby! Joel Anunoby kicks it out.

[10:14] Team_030 possession (Score: 22-22)
Tim Barrett drives and kicks out. Tyler Beal attempts a 3Pt. Heavily contested by Kyle Paul (1.4 feet, ZONE)! Tyler Beal misses. Rebound secured by Kyle Paul.

[10:01] Team_023 possession (Score: 22-22)
Trae Ingram makes the 3Pt and draws the foul on Tyler Beal! And-1! Trae Ingram to the line for 1. [Team fouls: 2] (Tyler Beal: 1 personal fouls)   FT 1/1: GOOD Trae Ingram makes 1/1 from the line.
Score: 22-26

[09:50] Team_030 possession (Score: 22-26)
Joel Anunoby attempts a Midrange. Heavily contested by Kyle Paul (0.5 feet, MAN)! Joel Anunoby misses. Rebound secured by Josh Morant.

[09:37] Team_023 possession (Score: 22-26)
Kyle Paul attempts a 3Pt. Contested by Joel Anunoby (3.5 feet, MAN). Kyle Paul misses. Rebound secured by Jordan Nowitzki.

[09:25] Team_030 possession (Score: 22-26)
Tyler Beal attempts a Midrange. Wide open! Trae Ingram is 6.1 feet away. [MAN] Tyler Beal misses. Rebound secured by Josh Morant.

[09:09] Team_023 possession (Score: 22-26)
Kyle Paul attempts a Midrange. Wide open! Joel Anunoby is 6.4 feet away. [MAN] Kyle Paul misses. Rebound secured by Jordan Nowitzki.

[08:57] Team_030 possession (Score: 22-26)
FOUL! Reach-in foul on Josh Morant during the drive. [Team fouls: 1] No free throws, side out. (Josh Morant: 1 personal fouls)

[08:45] Team_030 possession (Score: 22-26)
Joel Anunoby drives, Kyle Paul stays with him. Joel Anunoby attempts a Dunk. Heavily contested by Kyle Paul (0.5 feet, MAN)! JOEL ANUNOBY MAKES IT! Assist: Tim Barrett
Score: 24-26

[08:35] Team_023 possession (Score: 24-26)
Josh Morant makes the Layup and draws the foul on Jordan Nowitzki! And-1! Josh Morant to the line for 1. [Team fouls: 3] (Jordan Nowitzki: 1 personal fouls)   FT 1/1: MISS Josh Morant makes 0/1 from the line. Rebound secured by Joel Anunoby.
Score: 24-28

[08:21] Team_030 possession (Score: 24-28)
Joel Anunoby drives to the basket... FOUL! Offensive foul on Joel Anunoby! Tim Bane drew the charge! [Team fouls: 4] (Joel Anunoby: 1 personal fouls) TURNOVER! (dead ball)

[08:04] Team_023 possession (Score: 24-28)
Kyle Paul attempts a 3Pt. Contested by Tyler Beal (5.5 feet, ZONE). KYLE PAUL MAKES IT! Assist: Trae Ingram
Score: 24-31

[07:50] Team_030 possession (Score: 24-31)
FOUL! Shooting foul on Tim Bane. Jordan Nowitzki to the line for 2 free throws. [Team fouls: 2] (Tim Bane: 1 personal fouls)   FT 1/2: GOOD   FT 2/2: GOOD Jordan Nowitzki makes 2/2 from the line.
Score: 26-31

[07:36] Team_023 possession (Score: 26-31)
Collin Ginobili throws a bad pass out of bounds! TURNOVER! (dead ball)

[07:36] Substitution (Team_030): Tyler Beal OUT → RJ Carter IN (stamina_rule2)

[07:36] Substitution (Team_030): Tim Barrett OUT → Josh Smith IN (stamina_rule2)

[07:36] Substitution (Team_030): Joel Anunoby OUT → Pau James IN (stamina_rule2)

[07:36] Substitution (Team_030): Jordan Nowitzki OUT → Damian Green IN (stamina_rule2)

[07:36] Substitution (Team_030): Jaren Green OUT → Franz Anunoby IN (stamina_rule2)

[07:36] Substitution (Team_023): Trae Ingram OUT → Tracy Anthony IN (stamina_rule2)

[07:36] Substitution (Team_023): Collin Ginobili OUT → Magic Booker IN (stamina_rule2)

[07:36] Substitution (Team_023): Kyle Paul OUT → Gary Westbrook IN (stamina_rule2)

[07:36] Substitution (Team_023): Josh Morant OUT → Evan Parker IN (stamina_rule2)

[07:36] Substitution (Team_023): Tim Bane OUT → Vince Gasol IN (stamina_rule2)

[07:22] Team_030 possession (Score: 26-31)
Pau James attempts a 3Pt. Heavily contested by Tracy Anthony (1.1 feet, ZONE)! PAU JAMES MAKES IT! Assist: Josh Smith
Score: 29-31

[07:06] Team_023 possession (Score: 29-31)
Evan Parker attempts a Layup. Contested by Damian Green (5.4 feet, ZONE). Evan Parker misses. FOUL! Loose ball foul on Pau James during the rebound battle. [IN THE BONUS! 5 team fouls] Vince Gasol to the line for 2 free throws. (Pau James: 1 personal fouls)   FT 1/2: MISS   FT 2/2: GOOD Vince Gasol makes 1/2 from the line.
Score: 29-32

[06:50] Team_030 possession (Score: 29-32)
FOUL! Shooting foul on Magic Booker. Damian Green to the line for 2 free throws. [Team fouls: 3] (Magic Booker: 1 personal fouls)   FT 1/2: GOOD   FT 2/2: GOOD Damian Green makes 2/2 from the line.
Score: 31-32

[06:36] Team_023 possession (Score: 31-32)
Tracy Anthony drives and kicks out. Tracy Anthony attempts a 3Pt. Wide open! RJ Carter is 8.3 feet away. [MAN] TRACY ANTHONY MAKES IT! Assist: Gary Westbrook
Score: 31-35

[06:20] Team_030 possession (Score: 31-35)
FOUL! Reach-in foul on Vince Gasol during the drive. [Team fouls: 4] No free throws, side out. (Vince Gasol: 1 personal fouls)

[06:08] Team_030 possession (Score: 31-35)
Damian Green throws a bad pass! Stolen by Evan Parker! TURNOVER! (live ball)

[05:54] Team_023 possession (Score: 31-35)
FOUL! Shooting foul on Pau James. Gary Westbrook to the line for 3 free throws. [BONUS: 6 team fouls] (Pau James: 2 personal fouls)   FT 1/3: GOOD   FT 2/3: GOOD   FT 3/3: GOOD Gary Westbrook makes 3/3 from the line.
Score: 31-38

[05:42] Team_030 possession (Score: 31-38)
Josh Smith attempts a Midrange. Contested by Gary Westbrook (4.1 feet, ZONE). Josh Smith misses. Offensive rebound by Pau James! Pau James kicks it out.

[05:28] Team_030 possession (Score: 31-38)
FOUL! Shooting foul on Tracy Anthony. RJ Carter to the line for 3 free throws. [BONUS: 5 team fouls] (Tracy Anthony: 1 personal fouls)   FT 1/3: GOOD   FT 2/3: GOOD   FT 3/3: GOOD RJ Carter makes 3/3 from the line.
Score: 34-38

[05:18] Team_023 possession (Score: 34-38)
FOUL! Offensive foul on Gary Westbrook! Pau James drew the charge! [Team fouls: 6] (Gary Westbrook: 1 personal fouls) TURNOVER! (dead ball)

[05:06] Team_030 possession (Score: 34-38)
Franz Anunoby attempts a Midrange. Heavily contested by Vince Gasol (1.5 feet, MAN)! Franz Anunoby misses. Rebound secured by Evan Parker.

[04:51] Team_023 possession (Score: 34-38)
FOUL! Holding foul on Josh Smith. [IN THE BONUS! 7 team fouls] Magic Booker to the line for 2 free throws. (Josh Smith: 1 personal fouls)   FT 1/2: GOOD   FT 2/2: GOOD Magic Booker makes 2/2 from the line.
Score: 34-40

[04:34] Team_030 possession (Score: 34-40)
Damian Green attempts a 3Pt. Wide open! Tracy Anthony is 7.7 feet away. [ZONE] Damian Green misses. Rebound secured by Evan Parker.

[04:22] Team_023 possession (Score: 34-40)
Tracy Anthony makes the Dunk and draws the foul on Josh Smith! And-1! Tracy Anthony to the line for 1. [BONUS: 8 team fouls] (Josh Smith: 2 personal fouls)   FT 1/1: GOOD Tracy Anthony makes 1/1 from the line.
Score: 34-43

[04:06] Team_030 possession (Score: 34-43)
Pau James commits a violation (traveling/carry)! TURNOVER! (dead ball)

[03:55] Team_023 possession (Score: 34-43)
Vince Gasol makes the Layup and draws the foul on Josh Smith! And-1! Vince Gasol to the line for 1. [BONUS: 9 team fouls] (Josh Smith: 3 personal fouls)   FT 1/1: GOOD Vince Gasol makes 1/1 from the line.
Score: 34-46

[03:39] Team_030 possession (Score: 34-46)
Franz Anunoby makes the Layup and draws the foul on Magic Booker! And-1! Franz Anunoby to the line for 1. [BONUS: 7 team fouls] (Magic Booker: 2 personal fouls)   FT 1/1: GOOD Franz Anunoby makes 1/1 from the line.
Score: 37-46

[03:25] Team_023 possession (Score: 37-46)
Vince Gasol attempts a Layup. Heavily contested by Franz Anunoby (0.5 feet, MAN)! VINCE GASOL MAKES IT!
Score: 37-48

[03:13] Team_030 possession (Score: 37-48)
FOUL! Shooting foul on Vince Gasol. Franz Anunoby to the line for 2 free throws. [BONUS: 8 team fouls] (Vince Gasol: 2 personal fouls)   FT 1/2: GOOD   FT 2/2: GOOD Franz Anunoby makes 2/2 from the line.
Score: 39-48

[02:59] Team_023 possession (Score: 39-48)
Magic Booker makes the Dunk and draws the foul on Josh Smith! And-1! Magic Booker to the line for 1. [BONUS: 10 team fouls] (Josh Smith: 4 personal fouls)   FT 1/1: GOOD Magic Booker makes 1/1 from the line.
Score: 39-51

[02:42] Team_030 possession (Score: 39-51)
FOUL! Shooting foul on Vince Gasol. Damian Green to the line for 2 free throws. [BONUS: 9 team fouls] (Vince Gasol: 3 personal fouls)   FT 1/2: GOOD   FT 2/2: GOOD Damian Green makes 2/2 from the line.
Score: 41-51

[02:27] Team_023 possession (Score: 41-51)
Tracy Anthony drives and kicks out. Evan Parker attempts a 3Pt. Contested by Damian Green (4.3 feet, MAN). Evan Parker misses. Offensive rebound by Vince Gasol! Vince Gasol puts it back in!
Score: 41-53

[02:14] Team_030 possession (Score: 41-53)
RJ Carter attempts a 3Pt. Contested by Magic Booker (2.9 feet, ZONE). RJ Carter misses. Offensive rebound by Damian Green! Damian Green kicks it out.

[01:57] Team_030 possession (Score: 41-53)
Pau James makes the Dunk and draws the foul on Magic Booker! And-1! Pau James to the line for 1. [BONUS: 10 team fouls] (Magic Booker: 3 personal fouls)   FT 1/1: GOOD Pau James makes 1/1 from the line.
Score: 44-53

[01:40] Team_023 possession (Score: 44-53)
Magic Booker drives and kicks out. Evan Parker attempts a Midrange. Contested by Josh Smith (4.5 feet, ZONE). Evan Parker misses. Offensive rebound by Evan Parker! Evan Parker's putback is no good. Rebound secured by Pau James.

[01:28] Team_030 possession (Score: 44-53)
FOUL! Offensive foul on Pau James! Gary Westbrook drew the charge! [Team fouls: 11] (Pau James: 3 personal fouls) TURNOVER! (dead ball)

[01:09] Team_023 possession (Score: 44-53)
Tracy Anthony attempts a Midrange. Contested by Franz Anunoby (5.1 feet, ZONE). Tracy Anthony misses. Rebound secured by Franz Anunoby.

[00:53] Team_030 possession (Score: 44-53)
Damian Green makes the Dunk and draws the foul on Magic Booker! And-1! Damian Green to the line for 1. [BONUS: 11 team fouls] (Magic Booker: 4 personal fouls)   FT 1/1: GOOD Damian Green makes 1/1 from the line.
Score: 47-53

[00:34] Team_023 possession (Score: 47-53)
Vince Gasol attempts a Layup. Heavily contested by Damian Green (0.5 feet, ZONE)! VINCE GASOL MAKES IT!
Score: 47-55

[00:20] Team_030 possession (Score: 47-55)
RJ Carter attempts a Midrange. Wide open! Gary Westbrook is 6.1 feet away. [ZONE] RJ CARTER MAKES IT! Assist: Pau James
Score: 49-55

[00:04] Team_023 possession (Score: 49-55)
Magic Booker drives and kicks out. Tracy Anthony attempts a Midrange. Wide open! RJ Carter is 6.7 feet away. [MAN] Tracy Anthony misses. Rebound secured by Damian Green.

================================================================================
                              2ND QUARTER COMPLETE                              
================================================================================

2ND QUARTER SCORE: Team_030 29, Team_023 35

BOX SCORE:
================================================================================

Team_030
--------------------------------------------------------------------------------
Player                MIN  PTS  REB  AST  TO      FG   FG%      3P   3P%
--------------------------------------------------------------------------------
Damian Green           10    7    2    0   0   3/4    75.0     0/0   0.0
Pau James              10    6    2    1   0   2/2   100.0     0/0   0.0
RJ Carter              10    5    0    0   0   2/2   100.0     0/0   0.0
Franz Anunoby          10    5    1    0   0   2/3    66.7     0/0   0.0
Jaren Green            14    2    0    0   0   1/2    50.0     0/0   0.0
Jordan Nowitzki        14    2    3    0   0   1/1   100.0     0/0   0.0
Joel Anunoby           15    2    2    0   0   1/2    50.0     0/0   0.0
Tim Barrett            14    0    0    2   0   0/2     0.0     0/0   0.0
Tyler Beal             14    0    0    0   0   0/1     0.0     0/0   0.0
Josh Smith             10    0    0    1   0   0/0     0.0     0/0   0.0

TEAM: FG: 12/19 (63.2%), 3PT: 2/4 (50.0%), REB: 9 (3 off, 6 def), AST: 4, TO: 4
TEAM FOULS: 11 [Team_023 in BONUS]


Team_023
--------------------------------------------------------------------------------
Player                MIN  PTS  REB  AST  TO      FG   FG%      3P   3P%
--------------------------------------------------------------------------------
Vince Gasol            10   10    1    0   0   5/5   100.0     0/0   0.0
Tracy Anthony          10    6    0    0   0   2/3    66.7     0/0   0.0
Magic Booker           10    5    0    0   0   2/4    50.0     0/0   0.0
Trae Ingram            14    4    0    1   0   1/1   100.0     0/0   0.0
Kyle Paul              14    3    2    0   0   1/4    25.0     0/0   0.0
Gary Westbrook         10    3    0    1   0   1/1   100.0     0/0   0.0
Collin Ginobili        14    2    0    0   0   1/1   100.0     0/0   0.0
Tim Bane               14    0    1    0   0   0/0     0.0     0/0   0.0
Josh Morant            14    0    2    0   0   0/1     0.0     0/0   0.0
Evan Parker            10    0    2    0   0   0/0     0.0     0/0   0.0

TEAM: FG: 13/20 (65.0%), 3PT: 3/4 (75.0%), REB: 9 (2 off, 7 def), AST: 2, TO: 3
TEAM FOULS: 11 [Team_030 in BONUS]

================================================================================

================================================================================
                       3RD QUARTER - Team_030 vs Team_023                       
================================================================================

[12:00] Team_030 possession (Score: 49-55)
FOUL! Offensive foul on Tyler Beal! Trae Ingram drew the charge! [Team fouls: 1] (Tyler Beal: 1 personal fouls) TURNOVER! (dead ball)

[11:47] Team_023 possession (Score: 49-55)
Tim Bane drives, Jaren Green stays with him. Tim Bane attempts a Dunk. Heavily contested by Jaren Green (1.4 feet, ZONE)! TIM BANE MAKES IT!
Score: 49-57

[11:34] Team_030 possession (Score: 49-57)
Joel Anunoby attempts a 3Pt. Contested by Kyle Paul (4.0 feet, MAN). Joel Anunoby misses. Rebound secured by Josh Morant.

[11:15] Team_023 possession (Score: 49-57)
Collin Ginobili attempts a Layup. Heavily contested by Tim Barrett (0.9 feet, MAN)! COLLIN GINOBILI MAKES IT! Assist: Trae Ingram
Score: 49-59

[10:55] Team_030 possession (Score: 49-59)
FOUL! Holding foul on Collin Ginobili. [Team fouls: 1] No free throws, side out. (Collin Ginobili: 1 personal fouls)

[10:44] Team_030 possession (Score: 49-59)
Jordan Nowitzki makes the Midrange and draws the foul on Kyle Paul! And-1! Jordan Nowitzki to the line for 1. [Team fouls: 2] (Kyle Paul: 1 personal fouls)   FT 1/1: GOOD Jordan Nowitzki makes 1/1 from the line.
Score: 52-59

[10:26] Team_023 possession (Score: 52-59)
Tim Bane makes the Layup and draws the foul on Jaren Green! And-1! Tim Bane to the line for 1. [Team fouls: 2] (Jaren Green: 1 personal fouls)   FT 1/1: GOOD Tim Bane makes 1/1 from the line.
Score: 52-62

[10:11] Team_030 possession (Score: 52-62)
Jordan Nowitzki attempts a Midrange. Contested by Josh Morant (5.3 feet, MAN). Jordan Nowitzki misses. Offensive rebound by Jordan Nowitzki! Jordan Nowitzki's putback is no good. Rebound secured by Josh Morant.

[10:00] Team_023 possession (Score: 52-62)
Tim Bane drives, Jaren Green stays with him. Tim Bane attempts a Layup. Contested by Jaren Green (4.0 feet, ZONE). TIM BANE MAKES IT! Assist: Trae Ingram
Score: 52-64

[09:46] Team_030 possession (Score: 52-64)
Jordan Nowitzki makes the Dunk and draws the foul on Josh Morant! And-1! Jordan Nowitzki to the line for 1. [Team fouls: 3] (Josh Morant: 1 personal fouls)   FT 1/1: GOOD Jordan Nowitzki makes 1/1 from the line.
Score: 55-64

[09:32] Team_023 possession (Score: 55-64)
Tim Bane attempts a 3Pt. Contested by Jaren Green (4.2 feet, MAN). Tim Bane misses. Rebound secured by Joel Anunoby.

[09:20] Team_030 possession (Score: 55-64)
Tim Barrett attempts a Midrange. Contested by Collin Ginobili (4.5 feet, MAN). TIM BARRETT MAKES IT!
Score: 57-64

[09:01] Team_023 possession (Score: 57-64)
Collin Ginobili drives, Tim Barrett stays with him. Collin Ginobili attempts a Layup. Contested by Tim Barrett (5.9 feet, MAN). Collin Ginobili misses. Offensive rebound by Tim Bane! Tim Bane's putback is no good. Rebound secured by Jordan Nowitzki.

[08:43] Team_030 possession (Score: 57-64)
Jaren Green drives and kicks out. Jaren Green makes the Midrange and draws the foul on Josh Morant! And-1! Jaren Green to the line for 1. [Team fouls: 4] (Josh Morant: 2 personal fouls)   FT 1/1: GOOD Jaren Green makes 1/1 from the line.
Score: 60-64

[08:29] Team_023 possession (Score: 60-64)
Josh Morant throws a bad pass out of bounds! TURNOVER! (dead ball)

[08:12] Team_030 possession (Score: 60-64)
Jordan Nowitzki drives and kicks out. Tyler Beal attempts a 3Pt. Heavily contested by Trae Ingram (0.5 feet, MAN)! Tyler Beal misses. Offensive rebound by Jordan Nowitzki! Jordan Nowitzki puts it back in!
Score: 62-64

[07:58] Team_023 possession (Score: 62-64)
Collin Ginobili attempts a Midrange. Contested by Tyler Beal (2.1 feet, ZONE). Collin Ginobili misses. Rebound secured by Jaren Green.

[07:42] Team_030 possession (Score: 62-64)
Jordan Nowitzki attempts a 3Pt. Heavily contested by Kyle Paul (0.8 feet, ZONE)! Jordan Nowitzki misses. Rebound secured by Kyle Paul.

[07:29] Team_023 possession (Score: 62-64)
FOUL! Offensive foul on Tim Bane! Jaren Green drew the charge! [Team fouls: 5] (Tim Bane: 1 personal fouls) TURNOVER! (dead ball)

[07:18] Team_030 possession (Score: 62-64)
Jaren Green drives to the basket... Jaren Green loses control! Ball rolls out of bounds! TURNOVER! (dead ball)

[07:03] Team_023 possession (Score: 62-64)
FOUL! Shooting foul on Jordan Nowitzki. Josh Morant to the line for 3 free throws. [Team fouls: 3] (Jordan Nowitzki: 1 personal fouls)   FT 1/3: MISS   FT 2/3: GOOD   FT 3/3: GOOD Josh Morant makes 2/3 from the line.
Score: 62-66

[06:47] Team_030 possession (Score: 62-66)
Joel Anunoby attempts a 3Pt. Contested by Kyle Paul (2.3 feet, ZONE). Joel Anunoby misses. Rebound secured by Josh Morant.

[06:34] Team_023 possession (Score: 62-66)
Tim Bane attempts a Layup. Contested by Jaren Green (4.2 feet, ZONE). TIM BANE MAKES IT!
Score: 62-68

[06:18] Team_030 possession (Score: 62-68)
Tyler Beal attempts a 3Pt. Contested by Kyle Paul (3.4 feet, ZONE). Tyler Beal misses. FOUL! Loose ball foul on Tim Bane during the rebound battle. [IN THE BONUS! 6 team fouls] Joel Anunoby to the line for 2 free throws. (Tim Bane: 2 personal fouls)   FT 1/2: GOOD   FT 2/2: MISS Joel Anunoby makes 1/2 from the line. Rebound secured by Tim Bane.
Score: 63-68

[06:00] Team_023 possession (Score: 63-68)
Collin Ginobili attempts a Midrange. Contested by Joel Anunoby (3.1 feet, ZONE). Collin Ginobili misses. Rebound secured by Jordan Nowitzki.

[05:43] Team_030 possession (Score: 63-68)
Joel Anunoby throws a bad pass out of bounds! TURNOVER! (dead ball)

[05:33] Team_023 possession (Score: 63-68)
Kyle Paul attempts a Midrange. Contested by Tim Barrett (6.0 feet, ZONE). Kyle Paul misses. Rebound secured by Jaren Green.

[05:20] Team_030 possession (Score: 63-68)
Jaren Green makes the Dunk and draws the foul on Tim Bane! And-1! Jaren Green to the line for 1. [BONUS: 7 team fouls] (Tim Bane: 3 personal fouls)   FT 1/1: MISS Jaren Green makes 0/1 from the line. Rebound secured by Tim Bane.
Score: 65-68

[05:08] Team_023 possession (Score: 65-68)
Collin Ginobili attempts a Midrange. Contested by Tim Barrett (5.7 feet, MAN). COLLIN GINOBILI MAKES IT!
Score: 65-70

[04:53] Team_030 possession (Score: 65-70)
Jordan Nowitzki drives, Josh Morant stays with him. Jordan Nowitzki attempts a Layup. Contested by Josh Morant (3.0 feet, MAN). JORDAN NOWITZKI MAKES IT! Assist: Jaren Green
Score: 67-70

[04:41] Team_023 possession (Score: 67-70)
FOUL! Reach-in foul on Jaren Green during the drive. [Team fouls: 4] No free throws, side out. (Jaren Green: 2 personal fouls)

[04:27] Team_023 possession (Score: 67-70)
Collin Ginobili attempts a 3Pt. Contested by Tyler Beal (5.3 feet, ZONE). Collin Ginobili misses. Rebound secured by Jordan Nowitzki.

[04:11] Team_030 possession (Score: 67-70)
Joel Anunoby drives and kicks out. Jaren Green attempts a 3Pt. Contested by Kyle Paul (4.7 feet, ZONE). JAREN GREEN MAKES IT! Assist: Tyler Beal
Score: 70-70

[03:55] Team_023 possession (Score: 70-70)
FOUL! Shooting foul on Tyler Beal. Trae Ingram to the line for 2 free throws. [BONUS: 5 team fouls] (Tyler Beal: 2 personal fouls)   FT 1/2: MISS   FT 2/2: GOOD Trae Ingram makes 1/2 from the line.
Score: 70-71

[03:40] Team_030 possession (Score: 70-71)
Tim Barrett attempts a 3Pt. Contested by Collin Ginobili (5.5 feet, MAN). Tim Barrett misses. Rebound secured by Kyle Paul.

[03:25] Team_023 possession (Score: 70-71)
Tim Bane makes the Layup and draws the foul on Jaren Green! And-1! Tim Bane to the line for 1. [BONUS: 6 team fouls] (Jaren Green: 3 personal fouls)   FT 1/1: MISS Tim Bane makes 0/1 from the line. Offensive rebound by Josh Morant! Josh Morant kicks it out.
Score: 70-73

[03:12] Team_023 possession (Score: 70-73)
Tim Bane attempts a Midrange. Contested by Joel Anunoby (4.3 feet, ZONE). Tim Bane misses. Offensive rebound by Tim Bane! Tim Bane's putback is no good. Offensive rebound by Tim Bane! Tim Bane kicks it out.

[02:54] Team_023 possession (Score: 70-73)
FOUL! Shooting foul on Jaren Green. Collin Ginobili to the line for 2 free throws. [BONUS: 7 team fouls] (Jaren Green: 4 personal fouls)   FT 1/2: GOOD   FT 2/2: GOOD Collin Ginobili makes 2/2 from the line.
Score: 70-75

[02:41] Team_030 possession (Score: 70-75)
Joel Anunoby attempts a 3Pt. Contested by Kyle Paul (4.0 feet, ZONE). Joel Anunoby misses. Rebound secured by Kyle Paul.

[02:28] Team_023 possession (Score: 70-75)
Trae Ingram attempts a Midrange. Contested by Tyler Beal (4.3 feet, MAN). TRAE INGRAM MAKES IT! Assist: Josh Morant
Score: 70-77

[02:14] Team_030 possession (Score: 70-77)
FOUL! Reach-in foul on Tim Bane during the drive. [IN THE BONUS! 8 team fouls] Jordan Nowitzki to the line for 2 free throws. (Tim Bane: 4 personal fouls)   FT 1/2: MISS   FT 2/2: GOOD Jordan Nowitzki makes 1/2 from the line.
Score: 71-77

[02:00] Team_023 possession (Score: 71-77)
FOUL! Reach-in foul on Jaren Green during the drive. [IN THE BONUS! 8 team fouls] Tim Bane to the line for 2 free throws. (Jaren Green: 5 personal fouls)   FT 1/2: GOOD   FT 2/2: MISS Tim Bane makes 1/2 from the line. Rebound secured by Jordan Nowitzki.
Score: 71-78

[01:50] Team_030 possession (Score: 71-78)
Joel Anunoby attempts a Midrange. Contested by Kyle Paul (3.5 feet, MAN). Joel Anunoby misses. Rebound secured by Josh Morant.

[01:38] Team_023 possession (Score: 71-78)
Collin Ginobili drives, Jaren Green stays with him. Collin Ginobili attempts a Layup. Contested by Jaren Green (2.4 feet, ZONE). Collin Ginobili misses. FOUL! Loose ball foul on Joel Anunoby during the rebound battle. [IN THE BONUS! 9 team fouls] Tim Bane to the line for 2 free throws. (Joel Anunoby: 1 personal fouls)   FT 1/2: GOOD   FT 2/2: GOOD Tim Bane makes 2/2 from the line.
Score: 71-80

[01:24] Team_030 possession (Score: 71-80)
Tim Barrett attempts a Midrange. Contested by Collin Ginobili (4.9 feet, MAN). TIM BARRETT MAKES IT! Assist: Tyler Beal
Score: 73-80

[01:11] Team_023 possession (Score: 73-80)
Collin Ginobili drives, Jaren Green stays with him. Collin Ginobili attempts a Layup. Contested by Jaren Green (5.0 feet, ZONE). COLLIN GINOBILI MAKES IT! Assist: Josh Morant
Score: 73-82

[00:56] Team_030 possession (Score: 73-82)
Tim Barrett attempts a 3Pt. Contested by Kyle Paul (5.2 feet, ZONE). TIM BARRETT MAKES IT! Assist: Joel Anunoby
Score: 76-82

[00:44] Team_023 possession (Score: 76-82)
Trae Ingram attempts a 3Pt. Contested by Tyler Beal (2.4 feet, ZONE). Trae Ingram misses. Rebound secured by Jaren Green.

[00:30] Team_030 possession (Score: 76-82)
Tim Barrett throws a bad pass out of bounds! TURNOVER! (dead ball)

[00:30] Substitution (Team_030): Tyler Beal OUT → RJ Carter IN (stamina_rule2)

[00:30] Substitution (Team_030): Tim Barrett OUT → Josh Smith IN (stamina_rule2)

[00:30] Substitution (Team_030): Joel Anunoby OUT → Pau James IN (stamina_rule2)

[00:30] Substitution (Team_030): Jordan Nowitzki OUT → Damian Green IN (stamina_rule2)

[00:30] Substitution (Team_030): Jaren Green OUT → Franz Anunoby IN (stamina_rule2)

[00:30] Substitution (Team_023): Trae Ingram OUT → Tracy Anthony IN (stamina_rule2)

[00:30] Substitution (Team_023): Collin Ginobili OUT → Magic Booker IN (stamina_rule2)

[00:30] Substitution (Team_023): Kyle Paul OUT → Gary Westbrook IN (stamina_rule2)

[00:30] Substitution (Team_023): Josh Morant OUT → Evan Parker IN (stamina_rule2)

[00:30] Substitution (Team_023): Tim Bane OUT → Vince Gasol IN (stamina_rule2)

[00:16] Team_023 possession (Score: 76-82)
Evan Parker attempts a 3Pt. Wide open! Pau James is 6.1 feet away. [ZONE] Evan Parker misses. Offensive rebound by Vince Gasol! Vince Gasol's putback is no good. Rebound secured by Pau James.

[00:02] Team_030 possession (Score: 76-82)
Franz Anunoby attempts a 3Pt. Contested by Tracy Anthony (5.1 feet, ZONE). Franz Anunoby misses. Rebound secured by Evan Parker.

================================================================================
                              3RD QUARTER COMPLETE                              
================================================================================

3RD QUARTER SCORE: Team_030 27, Team_023 27

BOX SCORE:
================================================================================

Team_030
--------------------------------------------------------------------------------
Player                MIN  PTS  REB  AST  TO      FG   FG%      3P   3P%
--------------------------------------------------------------------------------
Jordan Nowitzki        26   11    5    0   0   5/7    71.4     0/0   0.0
Tim Barrett            26    7    0    0   0   3/4    75.0     0/0   0.0
Jaren Green            26    6    3    1   0   2/3    66.7     0/0   0.0
Joel Anunoby           26    0    1    1   0   0/4     0.0     0/0   0.0
Tyler Beal             26    0    0    2   0   0/1     0.0     0/0   0.0
Franz Anunoby          11    0    0    0   0   0/1     0.0     0/0   0.0

TEAM: FG: 10/20 (50.0%), 3PT: 1/8 (12.5%), REB: 10 (3 off, 7 def), AST: 4, TO: 4
TEAM FOULS: 9 [Team_023 in BONUS]


Team_023
--------------------------------------------------------------------------------
Player                MIN  PTS  REB  AST  TO      FG   FG%      3P   3P%
--------------------------------------------------------------------------------
Tim Bane               26   11    3    0   0   5/7    71.4     0/0   0.0
Collin Ginobili        26    8    0    0   0   4/8    50.0     0/0   0.0
Trae Ingram            26    3    0    2   0   2/3    66.7     0/0   0.0
Josh Morant            26    2    5    2   0   1/1   100.0     0/0   0.0
Kyle Paul              26    0    3    0   0   0/1     0.0     0/0   0.0
Evan Parker            11    0    1    0   0   0/1     0.0     0/0   0.0
Pau James              10    0    1    0   0   0/0     0.0     0/0   0.0

TEAM: FG: 12/21 (57.1%), 3PT: 1/5 (20.0%), REB: 12 (4 off, 8 def), AST: 4, TO: 2
TEAM FOULS: 8 [Team_030 in BONUS]

================================================================================

================================================================================
                       4TH QUARTER - Team_030 vs Team_023                       
================================================================================

[12:00] Team_030 possession (Score: 76-82)
Tyler Beal drives and kicks out. Jaren Green attempts a Midrange. Contested by Josh Morant (2.8 feet, ZONE). Jaren Green misses. Rebound secured by Kyle Paul.

[11:49] Team_023 possession (Score: 76-82)
Josh Morant drives to the basket... Josh Morant loses control! Ball rolls out of bounds! TURNOVER! (dead ball)

[11:49] Substitution (Team_030): Tim Barrett OUT → Josh Smith IN (stamina_rule2)

[11:49] Substitution (Team_030): Jaren Green OUT → Franz Anunoby IN (stamina_rule2)

[11:49] Substitution (Team_023): Trae Ingram OUT → Tracy Anthony IN (stamina_rule2)

[11:49] Substitution (Team_023): Collin Ginobili OUT → Magic Booker IN (stamina_rule2)

[11:49] Substitution (Team_023): Kyle Paul OUT → Gary Westbrook IN (stamina_rule2)

[11:49] Substitution (Team_023): Tim Bane OUT → Vince Gasol IN (stamina_rule2)

[11:36] Team_030 possession (Score: 76-82)
Tyler Beal attempts a Midrange. Wide open! Magic Booker is 8.7 feet away. [ZONE] TYLER BEAL MAKES IT! Assist: Jordan Nowitzki
Score: 78-82

[11:20] Team_023 possession (Score: 78-82)
Vince Gasol attempts a Layup. Contested by Franz Anunoby (4.5 feet, MAN). Vince Gasol misses. Rebound secured by Jordan Nowitzki.

[11:01] Team_030 possession (Score: 78-82)
Jordan Nowitzki attempts a Layup. Heavily contested by Vince Gasol (0.9 feet, ZONE)! Jordan Nowitzki misses. Rebound secured by Vince Gasol.

[10:42] Team_023 possession (Score: 78-82)
Magic Booker attempts a Midrange. Contested by Josh Smith (3.7 feet, MAN). Magic Booker misses. FOUL! Loose ball foul on Joel Anunoby during the rebound battle. [Team fouls: 1] No free throws, side out. (Joel Anunoby: 1 personal fouls)

[10:27] Team_023 possession (Score: 78-82)
Vince Gasol attempts a Layup. Contested by Franz Anunoby (5.5 feet, MAN). Vince Gasol misses. Rebound secured by Jordan Nowitzki.

[10:12] Team_030 possession (Score: 78-82)
Jordan Nowitzki attempts a Layup. BLOCKED BY MAGIC BOOKER! Ball is loose! Rebound secured by Vince Gasol.

[09:57] Team_023 possession (Score: 78-82)
Magic Booker attempts a 3Pt. Heavily contested by Tyler Beal (0.5 feet, ZONE)! Magic Booker misses. Rebound secured by Franz Anunoby.

[09:43] Team_030 possession (Score: 78-82)
Tyler Beal drives and kicks out. Jordan Nowitzki attempts a Midrange. BLOCKED BY JOSH MORANT! Ball is loose! Rebound secured by Josh Morant.

[09:28] Team_023 possession (Score: 78-82)
Magic Booker attempts a Midrange. Contested by Josh Smith (5.0 feet, ZONE). Magic Booker misses. Rebound secured by Jordan Nowitzki.

[09:15] Team_030 possession (Score: 78-82)
Tyler Beal attempts a Midrange. Contested by Gary Westbrook (4.4 feet, ZONE). TYLER BEAL MAKES IT! Assist: Franz Anunoby
Score: 80-82

[08:59] Team_023 possession (Score: 80-82)
Josh Morant attempts a 3Pt. Contested by Jordan Nowitzki (4.1 feet, MAN). Josh Morant misses. Offensive rebound by Vince Gasol! Vince Gasol puts it back in!
Score: 80-84

[08:44] Team_030 possession (Score: 80-84)
Joel Anunoby attempts a 3Pt. Wide open! Gary Westbrook is 8.0 feet away. [MAN] Joel Anunoby misses. Rebound secured by Vince Gasol.

[08:29] Team_023 possession (Score: 80-84)
Vince Gasol attempts a Midrange. Contested by Franz Anunoby (5.6 feet, MAN). VINCE GASOL MAKES IT!
Score: 80-86

[08:19] Team_030 possession (Score: 80-86)
Jordan Nowitzki attempts a Midrange. Wide open! Josh Morant is 7.9 feet away. [MAN] JORDAN NOWITZKI MAKES IT! Assist: Joel Anunoby
Score: 82-86

[08:06] Team_023 possession (Score: 82-86)
Josh Morant attempts a Layup. Contested by Jordan Nowitzki (3.1 feet, MAN). Josh Morant misses. Rebound secured by Joel Anunoby.

[07:49] Team_030 possession (Score: 82-86)
Joel Anunoby attempts a 3Pt. Contested by Magic Booker (4.0 feet, ZONE). Joel Anunoby misses. Rebound secured by Gary Westbrook.

[07:29] Team_023 possession (Score: 82-86)
Josh Morant makes the Layup and draws the foul on Jordan Nowitzki! And-1! Josh Morant to the line for 1. [Team fouls: 2] (Jordan Nowitzki: 1 personal fouls)   FT 1/1: GOOD Josh Morant makes 1/1 from the line.
Score: 82-89

[07:15] Team_030 possession (Score: 82-89)
Josh Smith drives to the basket... Josh Smith throws a bad pass! Stolen by Vince Gasol! TURNOVER! (live ball)

[07:05] Team_023 possession (Score: 82-89)
Josh Morant attempts a 3Pt. Wide open! Jordan Nowitzki is 6.9 feet away. [MAN] JOSH MORANT MAKES IT! Assist: Tracy Anthony
Score: 82-92

[06:54] Team_030 possession (Score: 82-92)
Franz Anunoby attempts a Midrange. Contested by Tracy Anthony (5.2 feet, ZONE). Franz Anunoby misses. Rebound secured by Vince Gasol.

[06:42] Team_023 possession (Score: 82-92)
Magic Booker attempts a Layup. Contested by Franz Anunoby (3.8 feet, ZONE). Magic Booker misses. FOUL! Loose ball foul on Joel Anunoby during the rebound battle. [Team fouls: 3] No free throws, side out. (Joel Anunoby: 2 personal fouls)

[06:28] Team_023 possession (Score: 82-92)
Tracy Anthony attempts a 3Pt. Contested by Tyler Beal (4.1 feet, MAN). Tracy Anthony misses. Rebound secured by Joel Anunoby.

[06:10] Team_030 possession (Score: 82-92)
Jordan Nowitzki attempts a 3Pt. Heavily contested by Tracy Anthony (1.7 feet, ZONE)! Jordan Nowitzki misses. Offensive rebound by Joel Anunoby! Joel Anunoby kicks it out.

[05:52] Team_030 possession (Score: 82-92)
Josh Smith attempts a Midrange. Contested by Magic Booker (2.7 feet, MAN). JOSH SMITH MAKES IT! Assist: Joel Anunoby
Score: 84-92

[05:38] Team_023 possession (Score: 84-92)
Gary Westbrook makes the Layup and draws the foul on Josh Smith! And-1! Gary Westbrook to the line for 1. [Team fouls: 4] (Josh Smith: 1 personal fouls)   FT 1/1: GOOD Gary Westbrook makes 1/1 from the line.
Score: 84-95

[05:22] Team_030 possession (Score: 84-95)
Tyler Beal attempts a 3Pt. Contested by Tracy Anthony (5.9 feet, ZONE). Tyler Beal misses. Rebound secured by Gary Westbrook.

[05:06] Team_023 possession (Score: 84-95)
Tracy Anthony drives, picks up Tyler Beal. Help arrives from Joel Anunoby! Tracy Anthony attempts a Dunk. Contested by Joel Anunoby (3.4 feet, MAN). Tracy Anthony misses. Rebound secured by Franz Anunoby.

[04:57] Team_030 possession (Score: 84-95)
Tyler Beal drives to the basket... Tyler Beal throws a bad pass! Stolen by Vince Gasol! TURNOVER! (live ball)

[04:41] Team_023 possession (Score: 84-95)
Gary Westbrook attempts a Layup. Contested by Franz Anunoby (3.4 feet, ZONE). Gary Westbrook misses. Rebound secured by Joel Anunoby.

[04:29] Team_030 possession (Score: 84-95)
Franz Anunoby drives, Vince Gasol stays with him. Franz Anunoby attempts a Layup. Wide open! Vince Gasol is 6.0 feet away. [MAN] FRANZ ANUNOBY MAKES IT! Assist: Tyler Beal
Score: 86-95

[04:12] Team_023 possession (Score: 86-95)
Gary Westbrook attempts a 3Pt. Contested by Tyler Beal (4.3 feet, ZONE). Gary Westbrook misses. Rebound secured by Franz Anunoby.

[03:57] Team_030 possession (Score: 86-95)
Franz Anunoby attempts a Midrange. Wide open! Josh Morant is 6.5 feet away. [ZONE] Franz Anunoby misses. Offensive rebound by Franz Anunoby! Franz Anunoby kicks it out.

[03:40] Team_030 possession (Score: 86-95)
Tyler Beal attempts a 3Pt. Contested by Tracy Anthony (3.8 feet, MAN). Tyler Beal misses. Rebound secured by Josh Morant.

[03:23] Team_023 possession (Score: 86-95)
Magic Booker makes the 3Pt and draws the foul on Josh Smith! And-1! Magic Booker to the line for 1. [BONUS: 5 team fouls] (Josh Smith: 2 personal fouls)   FT 1/1: GOOD Magic Booker makes 1/1 from the line.
Score: 86-99

[03:12] Team_030 possession (Score: 86-99)
Franz Anunoby drives to the basket... Franz Anunoby throws a bad pass! Stolen by Vince Gasol! TURNOVER! (live ball)

[02:58] Team_023 possession (Score: 86-99)
Josh Morant attempts a Midrange. Wide open! Jordan Nowitzki is 7.2 feet away. [MAN] Josh Morant misses. Rebound secured by Joel Anunoby.

[02:46] Team_030 possession (Score: 86-99)
Jordan Nowitzki drives to the basket... Jordan Nowitzki loses control! Ball rolls out of bounds! TURNOVER! (dead ball)

[02:46] Substitution (Team_030): Tyler Beal OUT → RJ Carter IN (stamina_rule2)

[02:46] Substitution (Team_030): Joel Anunoby OUT → Pau James IN (stamina_rule2)

[02:46] Substitution (Team_030): Jordan Nowitzki OUT → Damian Green IN (stamina_rule2)

[02:46] Substitution (Team_023): Josh Morant OUT → Evan Parker IN (stamina_rule2)

[02:34] Team_023 possession (Score: 86-99)
Evan Parker attempts a Midrange. Contested by Josh Smith (5.1 feet, ZONE). Evan Parker misses. Offensive rebound by Evan Parker! Evan Parker puts it back in!
Score: 86-101

[02:20] Team_030 possession (Score: 86-101)
Josh Smith drives, Magic Booker stays with him. Josh Smith attempts a Dunk. Contested by Magic Booker (3.2 feet, MAN). JOSH SMITH MAKES IT! Assist: Damian Green
Score: 88-101

[02:07] Team_023 possession (Score: 88-101)
Magic Booker makes the Layup and draws the foul on Damian Green! And-1! Magic Booker to the line for 1. [BONUS: 6 team fouls] (Damian Green: 1 personal fouls)   FT 1/1: GOOD Magic Booker makes 1/1 from the line.
Score: 88-104

[01:49] Team_030 possession (Score: 88-104)
FOUL! Offensive foul on Josh Smith! Magic Booker drew the charge! [Team fouls: 7] (Josh Smith: 3 personal fouls) TURNOVER! (dead ball)

[01:38] Team_023 possession (Score: 88-104)
Tracy Anthony attempts a Layup. Contested by RJ Carter (5.5 feet, MAN). Tracy Anthony misses. Rebound secured by Damian Green.

[01:20] Team_030 possession (Score: 88-104)
Pau James attempts a 3Pt. Contested by Magic Booker (4.1 feet, ZONE). Pau James misses. FOUL! Loose ball foul on Vince Gasol during the rebound battle. [Team fouls: 1] No free throws, side out. (Vince Gasol: 1 personal fouls)

[01:07] Team_030 possession (Score: 88-104)
Damian Green attempts a Midrange. Wide open! Magic Booker is 6.8 feet away. [ZONE] Damian Green misses. Rebound secured by Evan Parker.

[00:51] Team_023 possession (Score: 88-104)
Magic Booker attempts a Layup. Contested by Damian Green (3.7 feet, ZONE). MAGIC BOOKER MAKES IT! Assist: Tracy Anthony
Score: 88-106

[00:40] Team_030 possession (Score: 88-106)
RJ Carter attempts a 3Pt. Contested by Magic Booker (2.7 feet, ZONE). RJ CARTER MAKES IT! Assist: Josh Smith
Score: 91-106

[00:20] Team_023 possession (Score: 91-106)
Gary Westbrook attempts a Midrange. Wide open! Pau James is 6.4 feet away. [MAN] Gary Westbrook misses. Rebound secured by Franz Anunoby.

[00:05] Team_030 possession (Score: 91-106)
Josh Smith attempts a Midrange. Wide open! Magic Booker is 6.2 feet away. [MAN] Josh Smith misses. Rebound secured by Gary Westbrook.

================================================================================
                              4TH QUARTER COMPLETE                              
================================================================================

4TH QUARTER SCORE: Team_030 15, Team_023 24

BOX SCORE:
================================================================================

Team_030
--------------------------------------------------------------------------------
Player                MIN  PTS  REB  AST  TO      FG   FG%      3P   3P%
--------------------------------------------------------------------------------
Tyler Beal             35    4    0    1   0   2/6    33.3     0/0   0.0
Josh Smith             22    4    0    1   0   2/3    66.7     0/0   0.0
RJ Carter              13    3    0    0   0   1/1   100.0     0/0   0.0
Jordan Nowitzki        35    2    3    1   0   1/3    33.3     0/0   0.0
Franz Anunoby          22    2    5    1   0   1/2    50.0     0/0   0.0
Joel Anunoby           36    0    5    2   0   0/2     0.0     0/0   0.0
Damian Green           13    0    1    1   0   0/1     0.0     0/0   0.0
Pau James              13    0    1    0   0   0/0     0.0     0/0   0.0

TEAM: FG: 7/18 (38.9%), 3PT: 1/5 (20.0%), REB: 15 (3 off, 12 def), AST: 7, TO: 5
TEAM FOULS: 7 [Team_023 in BONUS]


Team_023
--------------------------------------------------------------------------------
Player                MIN  PTS  REB  AST  TO      FG   FG%      3P   3P%
--------------------------------------------------------------------------------
Magic Booker           22    9    0    0   0   3/5    60.0     0/0   0.0
Josh Morant            35    6    2    0   0   2/4    50.0     0/0   0.0
Vince Gasol            22    4    7    0   0   2/4    50.0     0/0   0.0
Gary Westbrook         22    3    3    0   0   1/4    25.0     0/0   0.0
Evan Parker            13    2    2    0   0   1/1   100.0     0/0   0.0
Kyle Paul              26    0    1    0   0   0/0     0.0     0/0   0.0
Tracy Anthony          22    0    0    2   0   0/3     0.0     0/0   0.0

TEAM: FG: 9/21 (42.9%), 3PT: 3/6 (50.0%), REB: 15 (4 off, 11 def), AST: 2, TO: 1
TEAM FOULS: 1

================================================================================

================================================================================
                               FULL GAME COMPLETE                               
================================================================================

FINAL SCORE: Team_030 91, Team_023 106

SCORING BY QUARTER:
--------------------------------------------------------------------------------
Team                     Q1     Q2     Q3     Q4    FINAL
--------------------------------------------------------------------------------
Team_030                 20     29     27     15       91
Team_023                 20     35     27     24      106
--------------------------------------------------------------------------------

FULL GAME BOX SCORE:
================================================================================

Team_030
--------------------------------------------------------------------------------
Player                MIN  PTS  REB  AST  TO      FG   FG%      3P   3P%      FT STL BLK
--------------------------------------------------------------------------------
Joel Anunoby           36    7   10    3   5   5/13   38.5   1/7    14.3   1/2     0   1
Tyler Beal             35    4    0    4   3   2/11   18.2   0/5     0.0   0/0     1   0
Jordan Nowitzki        35   20   15    2   1   8/15   53.3   0/3     0.0   6/7     0   0
Tim Barrett            26    9    0    2   1   4/10   40.0   1/3    33.3   0/0     1   0
Jaren Green            26   10    9    1   0   3/5    60.0   0/1     0.0   1/2     0   1
Josh Smith             22    6    0    2   3   3/4    75.0   0/0     0.0   0/0     0   0
Franz Anunoby          22   10    6    1   1   4/8    50.0   1/2    50.0   4/5     0   0
Damian Green           13    7    5    2   1   3/5    60.0   0/1     0.0   5/5     0   0
RJ Carter              13    8    0    0   0   3/3   100.0   2/2   100.0   3/3     0   0
Pau James              13    6    5    1   3   2/2   100.0   1/1   100.0   1/1     0   0

TEAM: FG: 37/76 (48.7%), 3PT: 6/25 (24.0%), REB: 49 (13 off, 36 def), AST: 18, TO: 18


Team_023
--------------------------------------------------------------------------------
Player                MIN  PTS  REB  AST  TO      FG   FG%      3P   3P%      FT STL BLK
--------------------------------------------------------------------------------
Josh Morant            35   10   12    2   1   5/10   50.0   3/3   100.0   3/5     0   1
Trae Ingram            26    7    0    4   1   3/6    50.0   1/3    33.3   2/3     0   0
Collin Ginobili        26   13    0    0   2   6/10   60.0   0/1     0.0   2/2     0   0
Kyle Paul              26    5   10    1   0   5/13   38.5   2/4    50.0   0/0     0   0
Tim Bane               26   19    7    0   2   6/10   60.0   0/1     0.0   6/8     1   4
Tracy Anthony          22    6    0    2   0   3/8    37.5   0/1     0.0   1/1     0   0
Magic Booker           22   14    0    0   2   4/9    44.4   1/3    33.3   5/5     0   1
Gary Westbrook         22    6    3    2   1   2/5    40.0   1/2    50.0   4/4     0   0
Vince Gasol            22   14    9    0   0   4/6    66.7   0/0     0.0   2/3     3   0
Evan Parker            13    7    5    0   0   4/5    80.0   0/1     0.0   1/1     1   0

TEAM: FG: 43/83 (51.8%), 3PT: 8/19 (42.1%), REB: 47 (12 off, 35 def), AST: 11, TO: 9

================================================================================
