================================================================================
                        FULL GAME - Team_014 vs Team_057                        
================================================================================

================================================================================
                       1ST QUARTER - Team_014 vs Team_057                       
================================================================================

[12:00] Team_014 possession (Score: 0-0)
Michael Cunningham attempts a Layup. BLOCKED BY BEN ADEBAYO! Ball is loose! Offensive rebound by DeMar Adebayo! DeMar Adebayo kicks it out.

[11:47] Team_014 possession (Score: 0-0)
Michael Cunningham attempts a 3Pt. Contested by Kobe Ming (4.9 feet, MAN). Michael Cunningham misses. Rebound secured by Anfernee Adebayo.

[11:28] Team_057 possession (Score: 0-0)
Miles Middleton drives, DeMar Adebayo stays with him. Miles Middleton attempts a Layup. Heavily contested by DeMar Adebayo (1.2 feet, ZONE)! MILES MIDDLETON MAKES IT! Assist: Anfernee Adebayo
Score: 0-2

[11:13] Team_014 possession (Score: 0-2)
Lamelo Simmons attempts a 3Pt. Contested by Kobe Ming (4.0 feet, ZONE). Lamelo Simmons misses. Offensive rebound by Ayo Murray! Ayo Murray kicks it out.

[11:04] Team_014 possession (Score: 0-2)
Ayo Murray attempts a 3Pt. Contested by Miles Middleton (3.5 feet, MAN). Ayo Murray misses. Offensive rebound by Ayo Murray! Ayo Murray kicks it out.

[10:49] Team_014 possession (Score: 0-2)
FOUL! Shooting foul on Ben Adebayo. Michael Cunningham to the line for 2 free throws. [Team fouls: 1] (Ben Adebayo: 1 personal fouls)   FT 1/2: GOOD   FT 2/2: GOOD Michael Cunningham makes 2/2 from the line.
Score: 2-2

[10:35] Team_057 possession (Score: 2-2)
Miles Middleton attempts a Midrange. Contested by Ayo Murray (3.5 feet, MAN). Miles Middleton misses. Rebound secured by DeMar Adebayo.

[10:21] Team_014 possession (Score: 2-2)
DeMar Adebayo makes the Layup and draws the foul on Ben Adebayo! And-1! DeMar Adebayo to the line for 1. [Team fouls: 2] (Ben Adebayo: 2 personal fouls)   FT 1/1: GOOD DeMar Adebayo makes 1/1 from the line.
Score: 5-2

[10:07] Team_057 possession (Score: 5-2)
Klay Rozier attempts a 3Pt. Contested by Jordan Anunoby (3.2 feet, ZONE). KLAY ROZIER MAKES IT! Assist: Anfernee Adebayo
Score: 5-5

[09:54] Team_014 possession (Score: 5-5)
Ayo Murray attempts a 3Pt. Contested by Kobe Ming (5.1 feet, ZONE). Ayo Murray misses. Offensive rebound by DeMar Adebayo! DeMar Adebayo kicks it out.

[09:42] Team_014 possession (Score: 5-5)
Ayo Murray attempts a 3Pt. Contested by Kobe Ming (5.5 feet, ZONE). Ayo Murray misses. FOUL! Loose ball foul on Miles Middleton during the rebound battle. [Team fouls: 3] No free throws, side out. (Miles Middleton: 1 personal fouls)

[09:29] Team_014 possession (Score: 5-5)
Jordan Anunoby drives, Ben Adebayo stays with him. Jordan Anunoby attempts a Layup. Heavily contested by Ben Adebayo (0.8 feet, ZONE)! Jordan Anunoby misses. Rebound secured by Anfernee Adebayo.

[09:17] Team_057 possession (Score: 5-5)
Kobe Ming attempts a 3Pt. Contested by Michael Cunningham (5.4 feet, MAN). Kobe Ming misses. Rebound secured by Ayo Murray.

[09:02] Team_014 possession (Score: 5-5)
Jordan Anunoby attempts a 3Pt. Contested by Kobe Ming (4.9 feet, ZONE). Jordan Anunoby misses. FOUL! Loose ball foul on Miles Middleton during the rebound battle. [Team fouls: 4] No free throws, side out. (Miles Middleton: 2 personal fouls)

[08:49] Team_014 possession (Score: 5-5)
Jordan Anunoby drives to the basket... Jordan Anunoby throws a bad pass out of bounds! TURNOVER! (dead ball)

[08:31] Team_057 possession (Score: 5-5)
Ben Adebayo attempts a Layup. Contested by DeMar Adebayo (3.4 feet, MAN). Ben Adebayo misses. Rebound secured by Ayo Murray.

[08:15] Team_014 possession (Score: 5-5)
Ayo Murray attempts a Midrange. Contested by Miles Middleton (5.1 feet, MAN). Ayo Murray misses. Rebound secured by Miles Middleton.

[07:59] Team_057 possession (Score: 5-5)
Ben Adebayo attempts a 3Pt. Contested by Jordan Anunoby (5.6 feet, ZONE). Ben Adebayo misses. Rebound secured by Michael Cunningham.

[07:44] Team_014 possession (Score: 5-5)
Michael Cunningham drives, Kobe Ming stays with him. Michael Cunningham attempts a Layup. Wide open! Kobe Ming is 6.9 feet away. [MAN] MICHAEL CUNNINGHAM MAKES IT! Assist: Jordan Anunoby
Score: 7-5

[07:30] Team_057 possession (Score: 7-5)
Klay Rozier attempts a 3Pt. Contested by Jordan Anunoby (3.5 feet, ZONE). Klay Rozier misses. Rebound secured by DeMar Adebayo.

[07:15] Team_014 possession (Score: 7-5)
Lamelo Simmons drives, Anfernee Adebayo stays with him. Lamelo Simmons attempts a Dunk. Wide open! Anfernee Adebayo is 7.7 feet away. [MAN] LAMELO SIMMONS MAKES IT! Assist: Ayo Murray
Score: 9-5

[07:02] Team_057 possession (Score: 9-5)
Kobe Ming attempts a Layup. Heavily contested by DeMar Adebayo (0.5 feet, ZONE)! KOBE MING MAKES IT!
Score: 9-7

[06:46] Team_014 possession (Score: 9-7)
Jordan Anunoby attempts a 3Pt. Contested by Klay Rozier (2.7 feet, MAN). Jordan Anunoby misses. FOUL! Loose ball foul on Ben Adebayo during the rebound battle. [IN THE BONUS! 5 team fouls] Ayo Murray to the line for 2 free throws. (Ben Adebayo: 3 personal fouls)   FT 1/2: GOOD   FT 2/2: GOOD Ayo Murray makes 2/2 from the line.
Score: 11-7

[06:31] Team_057 possession (Score: 11-7)
Kobe Ming attempts a Midrange. Contested by Michael Cunningham (2.1 feet, MAN). Kobe Ming misses. Rebound secured by DeMar Adebayo.

[06:22] Team_014 possession (Score: 11-7)
Jordan Anunoby attempts a 3Pt. Wide open! Klay Rozier is 6.4 feet away. [MAN] Jordan Anunoby misses. Rebound secured by Miles Middleton.

[06:05] Team_057 possession (Score: 11-7)
Ben Adebayo attempts a 3Pt. Contested by DeMar Adebayo (2.7 feet, ZONE). Ben Adebayo misses. Rebound secured by Ayo Murray.

[05:54] Team_014 possession (Score: 11-7)
Ayo Murray makes the Layup and draws the foul on Miles Middleton! And-1! Ayo Murray to the line for 1. [BONUS: 6 team fouls] (Miles Middleton: 3 personal fouls)   FT 1/1: GOOD Ayo Murray makes 1/1 from the line.
Score: 14-7

[05:42] Team_057 possession (Score: 14-7)
Ben Adebayo attempts a Midrange. Contested by DeMar Adebayo (5.5 feet, MAN). Ben Adebayo misses. Offensive rebound by Miles Middleton! Miles Middleton kicks it out.

[05:33] Team_057 possession (Score: 14-7)
FOUL! Reach-in foul on Jordan Anunoby during the drive. [Team fouls: 1] No free throws, side out. (Jordan Anunoby: 1 personal fouls)

[05:20] Team_057 possession (Score: 14-7)
Miles Middleton drives, DeMar Adebayo stays with him. Miles Middleton attempts a Dunk. Contested by DeMar Adebayo (3.2 feet, ZONE). Miles Middleton misses. Rebound secured by DeMar Adebayo.

[05:06] Team_014 possession (Score: 14-7)
Michael Cunningham attempts a 3Pt. Contested by Kobe Ming (3.6 feet, ZONE). Michael Cunningham misses. Rebound secured by Anfernee Adebayo.

[04:52] Team_057 possession (Score: 14-7)
Miles Middleton drives to the basket... Miles Middleton throws a bad pass! Stolen by DeMar Adebayo! TURNOVER! (live ball)

[04:39] Team_014 possession (Score: 14-7)
Jordan Anunoby drives and kicks out. DeMar Adebayo attempts a 3Pt. Wide open! Ben Adebayo is 6.1 feet away. [MAN] DEMAR ADEBAYO MAKES IT! Assist: Ayo Murray
Score: 17-7

[04:25] Team_057 possession (Score: 17-7)
Ben Adebayo attempts a Midrange. Contested by DeMar Adebayo (2.3 feet, MAN). Ben Adebayo misses. Rebound secured by Ayo Murray.

[04:14] Team_014 possession (Score: 17-7)
DeMar Adebayo drives and kicks out. Lamelo Simmons attempts a 3Pt. Contested by Kobe Ming (5.5 feet, ZONE). Lamelo Simmons misses. Rebound secured by Miles Middleton.

[04:03] Team_057 possession (Score: 17-7)
Kobe Ming drives and kicks out. Ben Adebayo attempts a 3Pt. Contested by DeMar Adebayo (2.9 feet, MAN). Ben Adebayo misses. Rebound secured by DeMar Adebayo.

[03:48] Team_014 possession (Score: 17-7)
Michael Cunningham makes the Layup and draws the foul on Ben Adebayo! And-1! Michael Cunningham to the line for 1. [BONUS: 7 team fouls] (Ben Adebayo: 4 personal fouls)   FT 1/1: MISS Michael Cunningham makes 0/1 from the line. Rebound secured by Ben Adebayo.
Score: 19-7

[03:32] Team_057 possession (Score: 19-7)
Anfernee Adebayo attempts a 3Pt. Contested by Lamelo Simmons (4.5 feet, MAN). ANFERNEE ADEBAYO MAKES IT! Assist: Kobe Ming
Score: 19-10

[03:13] Team_014 possession (Score: 19-10)
FOUL! Offensive foul on Lamelo Simmons! Anfernee Adebayo drew the charge! [Team fouls: 2] (Lamelo Simmons: 1 personal fouls) TURNOVER! (dead ball)

[02:57] Team_057 possession (Score: 19-10)
FOUL! Shooting foul on DeMar Adebayo. Ben Adebayo to the line for 2 free throws. [Team fouls: 3] (DeMar Adebayo: 1 personal fouls)   FT 1/2: GOOD   FT 2/2: GOOD Ben Adebayo makes 2/2 from the line.
Score: 19-12

[02:46] Team_014 possession (Score: 19-12)
Michael Cunningham attempts a 3Pt. Contested by Kobe Ming (3.6 feet, ZONE). Michael Cunningham misses. Offensive rebound by DeMar Adebayo! DeMar Adebayo kicks it out.

[02:34] Team_014 possession (Score: 19-12)
Michael Cunningham attempts a 3Pt. Contested by Kobe Ming (2.1 feet, MAN). Michael Cunningham misses. Rebound secured by Miles Middleton.

[02:15] Team_057 possession (Score: 19-12)
FOUL! Shooting foul on Ayo Murray. Ben Adebayo to the line for 2 free throws. [Team fouls: 4] (Ayo Murray: 1 personal fouls)   FT 1/2: GOOD   FT 2/2: GOOD Ben Adebayo makes 2/2 from the line.
Score: 19-14

[02:02] Team_014 possession (Score: 19-14)
Lamelo Simmons drives, Anfernee Adebayo stays with him. Lamelo Simmons attempts a Dunk. Contested by Anfernee Adebayo (5.4 feet, MAN). LAMELO SIMMONS MAKES IT! Assist: Michael Cunningham
Score: 21-14

[01:48] Team_057 possession (Score: 21-14)
Miles Middleton attempts a Midrange. Wide open! Ayo Murray is 6.2 feet away. [MAN] MILES MIDDLETON MAKES IT! Assist: Kobe Ming
Score: 21-16

[01:35] Team_014 possession (Score: 21-16)
Michael Cunningham attempts a 3Pt. Contested by Kobe Ming (3.4 feet, MAN). Michael Cunningham misses. Rebound secured by Ben Adebayo.

[01:18] Team_057 possession (Score: 21-16)
Klay Rozier attempts a 3Pt. Wide open! Jordan Anunoby is 6.6 feet away. [MAN] KLAY ROZIER MAKES IT! Assist: Ben Adebayo
Score: 21-19

[01:06] Team_014 possession (Score: 21-19)
DeMar Adebayo drives to the basket... FOUL! Offensive foul on DeMar Adebayo! Ben Adebayo drew the charge! [Team fouls: 5] (DeMar Adebayo: 2 personal fouls) TURNOVER! (dead ball)

[00:55] Team_057 possession (Score: 21-19)
Ben Adebayo drives and kicks out. Anfernee Adebayo attempts a Midrange. Wide open! Lamelo Simmons is 9.5 feet away. [MAN] Anfernee Adebayo misses. Offensive rebound by Miles Middleton! Miles Middleton kicks it out.

[00:41] Team_057 possession (Score: 21-19)
FOUL! Holding foul on Ayo Murray. [IN THE BONUS! 6 team fouls] Miles Middleton to the line for 2 free throws. (Ayo Murray: 2 personal fouls)   FT 1/2: GOOD   FT 2/2: MISS Miles Middleton makes 1/2 from the line. Offensive rebound by Miles Middleton! Miles Middleton kicks it out.
Score: 21-20

[00:24] Team_057 possession (Score: 21-20)
Kobe Ming attempts a 3Pt. Contested by Jordan Anunoby (5.2 feet, ZONE). KOBE MING MAKES IT! Assist: Klay Rozier
Score: 21-23

[00:08] Team_014 possession (Score: 21-23)
DeMar Adebayo drives to the basket... DeMar Adebayo loses the ball! Stripped by Ben Adebayo! TURNOVER! (live ball)

================================================================================
                              1ST QUARTER COMPLETE                              
================================================================================

1ST QUARTER SCORE: Team_014 21, Team_057 23

BOX SCORE:
================================================================================

Team_014
--------------------------------------------------------------------------------
Player                MIN  PTS  REB  AST  TO      FG   FG%      3P   3P%
--------------------------------------------------------------------------------
DeMar Adebayo          12    6    8    0   0   2/3    66.7     0/0   0.0
Ayo Murray             12    5    8    2   0   2/3    66.7     0/0   0.0
Michael Cunningham     12    4    1    1   0   2/7    28.6     0/0   0.0
Lamelo Simmons         12    4    0    0   0   2/2   100.0     0/0   0.0
Jordan Anunoby         12    0    0    1   0   0/2     0.0     0/0   0.0

TEAM: FG: 8/17 (47.1%), 3PT: 1/6 (16.7%), REB: 17 (7 off, 10 def), AST: 4, TO: 4
TEAM FOULS: 6 [Team_057 in BONUS]


Team_057
--------------------------------------------------------------------------------
Player                MIN  PTS  REB  AST  TO      FG   FG%      3P   3P%
--------------------------------------------------------------------------------
Klay Rozier            12    6    0    1   0   2/3    66.7     0/0   0.0
Kobe Ming              12    5    0    2   0   2/5    40.0     0/0   0.0
Miles Middleton        12    4    7    0   0   2/4    50.0     0/0   0.0
Ben Adebayo            12    4    2    1   0   2/6    33.3     0/0   0.0
Anfernee Adebayo       12    3    3    2   0   1/1   100.0     0/0   0.0

TEAM: FG: 9/19 (47.4%), 3PT: 4/8 (50.0%), REB: 12 (3 off, 9 def), AST: 6, TO: 1
TEAM FOULS: 7 [Team_014 in BONUS]

================================================================================

================================================================================
                       2ND QUARTER - Team_014 vs Team_057                       
================================================================================

[12:00] Team_014 possession (Score: 21-23)
DeMar Adebayo drives and kicks out. Jordan Anunoby attempts a 3Pt. Contested by Anfernee Adebayo (5.7 feet, ZONE). Jordan Anunoby misses. Rebound secured by Ben Adebayo.

[11:46] Team_057 possession (Score: 21-23)
Kobe Ming makes the Midrange and draws the foul on Michael Cunningham! And-1! Kobe Ming to the line for 1. [Team fouls: 1] (Michael Cunningham: 1 personal fouls)   FT 1/1: GOOD Kobe Ming makes 1/1 from the line.
Score: 21-26

[11:32] Team_014 possession (Score: 21-26)
DeMar Adebayo throws a bad pass! Stolen by Ben Adebayo! TURNOVER! (live ball)

[11:15] Team_057 possession (Score: 21-26)
Klay Rozier throws a bad pass out of bounds! TURNOVER! (dead ball)

[11:15] Substitution (Team_014): Michael Cunningham OUT → Jalen Booker IN (stamina_rule2)

[11:15] Substitution (Team_014): Jordan Anunoby OUT → Bones Quickley IN (stamina_rule2)

[11:15] Substitution (Team_014): Lamelo Simmons OUT → Tracy Westbrook IN (stamina_rule2)

[11:15] Substitution (Team_014): DeMar Adebayo OUT → Nikola James IN (stamina_rule2)

[11:15] Substitution (Team_014): Ayo Murray OUT → Collin Gasol IN (stamina_rule2)

[11:15] Substitution (Team_057): Kobe Ming OUT → Scottie Johnson IN (stamina_rule2)

[11:15] Substitution (Team_057): Klay Rozier OUT → Bradley Ginobili IN (stamina_rule2)

[11:15] Substitution (Team_057): Anfernee Adebayo OUT → Joel Wade IN (stamina_rule2)

[11:15] Substitution (Team_057): Ben Adebayo OUT → Lamelo Irving IN (stamina_rule2)

[11:15] Substitution (Team_057): Miles Middleton OUT → Zion Lillard IN (stamina_rule2)

[11:04] Team_014 possession (Score: 21-26)
Jalen Booker attempts a 3Pt. Contested by Scottie Johnson (5.5 feet, ZONE). Jalen Booker misses. Rebound secured by Zion Lillard.

[10:53] Team_057 possession (Score: 21-26)
Zion Lillard throws a bad pass out of bounds! TURNOVER! (dead ball)

[10:40] Team_014 possession (Score: 21-26)
FOUL! Reach-in foul on Lamelo Irving during the drive. [Team fouls: 1] No free throws, side out. (Lamelo Irving: 1 personal fouls)

[10:24] Team_014 possession (Score: 21-26)
Collin Gasol attempts a Layup. Heavily contested by Zion Lillard (0.5 feet, MAN)! COLLIN GASOL MAKES IT! Assist: Tracy Westbrook
Score: 23-26

[10:10] Team_057 possession (Score: 23-26)
Scottie Johnson attempts a 3Pt. Contested by Jalen Booker (4.6 feet, ZONE). Scottie Johnson misses. Rebound secured by Tracy Westbrook.

[09:56] Team_014 possession (Score: 23-26)
Collin Gasol attempts a Midrange. Contested by Joel Wade (5.9 feet, ZONE). COLLIN GASOL MAKES IT!
Score: 25-26

[09:45] Team_057 possession (Score: 25-26)
Lamelo Irving drives to the basket... Lamelo Irving commits a violation (traveling/carry)! TURNOVER! (dead ball)

[09:33] Team_014 possession (Score: 25-26)
Jalen Booker attempts a Midrange. Contested by Joel Wade (4.3 feet, ZONE). Jalen Booker misses. Rebound secured by Joel Wade.

[09:18] Team_057 possession (Score: 25-26)
Zion Lillard attempts a Layup. BLOCKED BY COLLIN GASOL! Ball is loose! Rebound secured by Nikola James.

[09:03] Team_014 possession (Score: 25-26)
Collin Gasol attempts a Midrange. Contested by Zion Lillard (5.2 feet, MAN). Collin Gasol misses. Rebound secured by Joel Wade.

[08:47] Team_057 possession (Score: 25-26)
Bradley Ginobili makes the Dunk and draws the foul on Bones Quickley! And-1! Bradley Ginobili to the line for 1. [Team fouls: 2] (Bones Quickley: 1 personal fouls)   FT 1/1: GOOD Bradley Ginobili makes 1/1 from the line.
Score: 25-29

[08:37] Team_014 possession (Score: 25-29)
Jalen Booker attempts a 3Pt. Contested by Scottie Johnson (3.4 feet, ZONE). Jalen Booker misses. Rebound secured by Joel Wade.

[08:24] Team_057 possession (Score: 25-29)
Bradley Ginobili attempts a Midrange. Wide open! Bones Quickley is 7.3 feet away. [MAN] BRADLEY GINOBILI MAKES IT!
Score: 25-31

[08:13] Team_014 possession (Score: 25-31)
Collin Gasol attempts a Layup. BLOCKED BY ZION LILLARD! Ball is loose! Rebound secured by Lamelo Irving.

[07:58] Team_057 possession (Score: 25-31)
Zion Lillard makes the Layup and draws the foul on Collin Gasol! And-1! Zion Lillard to the line for 1. [Team fouls: 3] (Collin Gasol: 1 personal fouls)   FT 1/1: MISS Zion Lillard makes 0/1 from the line. FOUL! Loose ball foul on Tracy Westbrook during the free throw rebound! [Team fouls: 4] No free throws, side out. (Tracy Westbrook: 1 personal fouls)
Score: 25-33

[07:45] Team_057 possession (Score: 25-33)
Bradley Ginobili attempts a 3Pt. Contested by Bones Quickley (2.0 feet, MAN). Bradley Ginobili misses. Offensive rebound by Zion Lillard! Zion Lillard's putback is no good. Offensive rebound by Zion Lillard! Zion Lillard kicks it out.

[07:28] Team_057 possession (Score: 25-33)
Zion Lillard attempts a 3Pt. Contested by Jalen Booker (3.7 feet, ZONE). Zion Lillard misses. Offensive rebound by Zion Lillard! Zion Lillard puts it back in!
Score: 25-35

[07:14] Team_014 possession (Score: 25-35)
FOUL! Reach-in foul on Zion Lillard during the drive. [Team fouls: 2] No free throws, side out. (Zion Lillard: 1 personal fouls)

[06:59] Team_014 possession (Score: 25-35)
Nikola James attempts a Layup. BLOCKED BY LAMELO IRVING! Ball deflects out of bounds off Nikola James.

[06:43] Team_057 possession (Score: 25-35)
Joel Wade attempts a 3Pt. Wide open! Jalen Booker is 6.1 feet away. [ZONE] JOEL WADE MAKES IT! Assist: Scottie Johnson
Score: 25-38

[06:31] Team_014 possession (Score: 25-38)
FOUL! Shooting foul on Lamelo Irving. Collin Gasol to the line for 2 free throws. [Team fouls: 3] (Lamelo Irving: 2 personal fouls)   FT 1/2: GOOD   FT 2/2: GOOD Collin Gasol makes 2/2 from the line.
Score: 27-38

[06:18] Team_057 possession (Score: 27-38)
Joel Wade attempts a 3Pt. Contested by Tracy Westbrook (5.2 feet, MAN). Joel Wade misses. Offensive rebound by Zion Lillard! Zion Lillard's putback is no good. Offensive rebound by Zion Lillard! Zion Lillard kicks it out.

[06:04] Team_057 possession (Score: 27-38)
Bradley Ginobili drives, picks up Bones Quickley. Help arrives from Tracy Westbrook! Bradley Ginobili attempts a Layup. Contested by Tracy Westbrook (4.2 feet, MAN). BRADLEY GINOBILI MAKES IT! Assist: Lamelo Irving
Score: 27-40

[05:46] Team_014 possession (Score: 27-40)
Bones Quickley makes the Layup and draws the foul on Bradley Ginobili! And-1! Bones Quickley to the line for 1. [Team fouls: 4] (Bradley Ginobili: 1 personal fouls)   FT 1/1: GOOD Bones Quickley makes 1/1 from the line.
Score: 30-40

[05:35] Team_057 possession (Score: 30-40)
Bradley Ginobili attempts a 3Pt. Contested by Jalen Booker (4.2 feet, ZONE). Bradley Ginobili misses. Rebound secured by Collin Gasol.

[05:17] Team_014 possession (Score: 30-40)
Nikola James attempts a Midrange. Wide open! Bradley Ginobili is 10.0 feet away. [ZONE] Nikola James misses. FOUL! Loose ball foul on Zion Lillard during the rebound battle. [IN THE BONUS! 5 team fouls] Nikola James to the line for 2 free throws. (Zion Lillard: 2 personal fouls)   FT 1/2: GOOD   FT 2/2: GOOD Nikola James makes 2/2 from the line.
Score: 32-40

[04:59] Team_057 possession (Score: 32-40)
Lamelo Irving drives to the basket... Lamelo Irving throws a bad pass out of bounds! TURNOVER! (dead ball)

[04:46] Team_014 possession (Score: 32-40)
Jalen Booker drives and kicks out. Nikola James attempts a Midrange. Contested by Joel Wade (5.7 feet, ZONE). Nikola James misses. Rebound secured by Joel Wade.

[04:29] Team_057 possession (Score: 32-40)
Scottie Johnson drives to the basket... Scottie Johnson loses the ball! Stripped by Collin Gasol! TURNOVER! (live ball)

[04:16] Team_014 possession (Score: 32-40)
Collin Gasol attempts a Midrange. Wide open! Scottie Johnson is 6.6 feet away. [ZONE] COLLIN GASOL MAKES IT! Assist: Bones Quickley
Score: 34-40

[04:04] Team_057 possession (Score: 34-40)
Joel Wade attempts a Midrange. Wide open! Tracy Westbrook is 6.5 feet away. [MAN] JOEL WADE MAKES IT!
Score: 34-42

[03:53] Team_014 possession (Score: 34-42)
Tracy Westbrook attempts a 3Pt. Contested by Scottie Johnson (2.5 feet, ZONE). Tracy Westbrook misses. Rebound secured by Lamelo Irving.

[03:37] Team_057 possession (Score: 34-42)
Scottie Johnson drives and kicks out. Joel Wade attempts a 3Pt. Contested by Jalen Booker (3.4 feet, ZONE). JOEL WADE MAKES IT! Assist: Lamelo Irving
Score: 34-45

[03:26] Team_014 possession (Score: 34-45)
Nikola James attempts a Midrange. Contested by Lamelo Irving (4.6 feet, MAN). NIKOLA JAMES MAKES IT! Assist: Bones Quickley
Score: 36-45

[03:13] Team_057 possession (Score: 36-45)
Zion Lillard attempts a Midrange. Contested by Nikola James (3.7 feet, ZONE). Zion Lillard misses. Rebound secured by Collin Gasol.

[02:55] Team_014 possession (Score: 36-45)
Bones Quickley attempts a 3Pt. Contested by Bradley Ginobili (2.2 feet, ZONE). BONES QUICKLEY MAKES IT! Assist: Tracy Westbrook
Score: 39-45

[02:42] Team_057 possession (Score: 39-45)
Lamelo Irving attempts a 3Pt. Contested by Nikola James (4.1 feet, MAN). Lamelo Irving misses. Rebound secured by Nikola James.

[02:28] Team_014 possession (Score: 39-45)
Nikola James attempts a Layup. BLOCKED BY LAMELO IRVING! Ball is loose! Rebound secured by Joel Wade.

[02:15] Team_057 possession (Score: 39-45)
Joel Wade drives, Tracy Westbrook stays with him. Joel Wade attempts a Layup. Contested by Tracy Westbrook (4.8 feet, MAN). JOEL WADE MAKES IT!
Score: 39-47

[02:01] Team_014 possession (Score: 39-47)
Nikola James attempts a Midrange. Wide open! Lamelo Irving is 10.0 feet away. [ZONE] NIKOLA JAMES MAKES IT! Assist: Tracy Westbrook
Score: 41-47

[01:47] Team_057 possession (Score: 41-47)
Zion Lillard drives, Collin Gasol stays with him. Zion Lillard attempts a Layup. Contested by Collin Gasol (4.2 feet, MAN). ZION LILLARD MAKES IT! Assist: Bradley Ginobili
Score: 41-49

[01:28] Team_014 possession (Score: 41-49)
Collin Gasol drives to the basket... Collin Gasol commits a violation (traveling/carry)! TURNOVER! (dead ball)

[01:13] Team_057 possession (Score: 41-49)
Zion Lillard drives, Collin Gasol stays with him. Zion Lillard attempts a Layup. Wide open! Collin Gasol is 6.3 feet away. [MAN] ZION LILLARD MAKES IT!
Score: 41-51

[00:58] Team_014 possession (Score: 41-51)
Bones Quickley attempts a 3Pt. Wide open! Scottie Johnson is 6.5 feet away. [ZONE] Bones Quickley misses. Rebound secured by Lamelo Irving.

[00:39] Team_057 possession (Score: 41-51)
Lamelo Irving attempts a Midrange. Wide open! Nikola James is 6.5 feet away. [MAN] LAMELO IRVING MAKES IT!
Score: 41-53

[00:20] Team_014 possession (Score: 41-53)
Nikola James attempts a Midrange. Contested by Scottie Johnson (5.2 feet, ZONE). NIKOLA JAMES MAKES IT!
Score: 43-53

[00:07] Team_057 possession (Score: 43-53)
Bradley Ginobili drives to the basket... Bradley Ginobili throws a bad pass! Stolen by Collin Gasol! TURNOVER! (live ball)

================================================================================
                              2ND QUARTER COMPLETE                              
================================================================================

2ND QUARTER SCORE: Team_014 22, Team_057 30

BOX SCORE:
================================================================================

Team_014
--------------------------------------------------------------------------------
Player                MIN  PTS  REB  AST  TO      FG   FG%      3P   3P%
--------------------------------------------------------------------------------
Collin Gasol           11    8    2    0   0   4/6    66.7     0/0   0.0
Nikola James           11    8    2    0   0   4/6    66.7     0/0   0.0
Bones Quickley         11    6    0    2   0   2/3    66.7     0/0   0.0
DeMar Adebayo          13    0    0    0   0   0/1     0.0     0/0   0.0
Jalen Booker           11    0    0    0   0   0/4     0.0     0/0   0.0
Tracy Westbrook        11    0    1    3   0   0/1     0.0     0/0   0.0

TEAM: FG: 10/21 (47.6%), 3PT: 1/5 (20.0%), REB: 5 (0 off, 5 def), AST: 5, TO: 2
TEAM FOULS: 4


Team_057
--------------------------------------------------------------------------------
Player                MIN  PTS  REB  AST  TO      FG   FG%      3P   3P%
--------------------------------------------------------------------------------
Joel Wade              11   10    5    0   0   4/4   100.0     0/0   0.0
Bradley Ginobili       11    7    0    1   0   3/4    75.0     0/0   0.0
Zion Lillard           11    6    5    0   0   3/5    60.0     0/0   0.0
Kobe Ming              13    3    0    0   0   1/1   100.0     0/0   0.0
Lamelo Irving          11    2    3    2   0   1/2    50.0     0/0   0.0
Ben Adebayo            13    0    1    0   0   0/0     0.0     0/0   0.0
Scottie Johnson        11    0    0    1   0   0/1     0.0     0/0   0.0

TEAM: FG: 12/17 (70.6%), 3PT: 2/5 (40.0%), REB: 14 (4 off, 10 def), AST: 4, TO: 6
TEAM FOULS: 5 [Team_014 in BONUS]

================================================================================

================================================================================
                       3RD QUARTER - Team_014 vs Team_057                       
================================================================================

[12:00] Team_014 possession (Score: 43-53)
DeMar Adebayo attempts a 3Pt. Contested by Kobe Ming (2.1 feet, ZONE). DeMar Adebayo misses. Rebound secured by Ben Adebayo.

[11:45] Team_057 possession (Score: 43-53)
Anfernee Adebayo drives, DeMar Adebayo stays with him. Anfernee Adebayo attempts a Layup. Contested by DeMar Adebayo (3.7 feet, ZONE). Anfernee Adebayo misses. Rebound secured by Ayo Murray.

[11:29] Team_014 possession (Score: 43-53)
Ayo Murray attempts a Midrange. Contested by Anfernee Adebayo (4.0 feet, ZONE). Ayo Murray misses. Offensive rebound by Ayo Murray! Ayo Murray kicks it out.

[11:15] Team_014 possession (Score: 43-53)
FOUL! Shooting foul on Ben Adebayo. Jordan Anunoby to the line for 2 free throws. [Team fouls: 1] (Ben Adebayo: 1 personal fouls)   FT 1/2: GOOD   FT 2/2: GOOD Jordan Anunoby makes 2/2 from the line.
Score: 45-53

[10:56] Team_057 possession (Score: 45-53)
Miles Middleton attempts a Layup. Contested by Ayo Murray (3.1 feet, MAN). MILES MIDDLETON MAKES IT! Assist: Klay Rozier
Score: 45-55

[10:42] Team_014 possession (Score: 45-55)
DeMar Adebayo attempts a 3Pt. Wide open! Kobe Ming is 6.9 feet away. [ZONE] DeMar Adebayo misses. Rebound secured by Miles Middleton.

[10:31] Team_057 possession (Score: 45-55)
FOUL! Shooting foul on DeMar Adebayo. Kobe Ming to the line for 2 free throws. [Team fouls: 1] (DeMar Adebayo: 1 personal fouls)   FT 1/2: GOOD   FT 2/2: GOOD Kobe Ming makes 2/2 from the line.
Score: 45-57

[10:18] Team_014 possession (Score: 45-57)
FOUL! Shooting foul on Klay Rozier. Jordan Anunoby to the line for 2 free throws. [Team fouls: 2] (Klay Rozier: 1 personal fouls)   FT 1/2: GOOD   FT 2/2: GOOD Jordan Anunoby makes 2/2 from the line.
Score: 47-57

[10:02] Team_057 possession (Score: 47-57)
Anfernee Adebayo attempts a 3Pt. Contested by Jordan Anunoby (4.3 feet, ZONE). Anfernee Adebayo misses. Rebound secured by Ayo Murray.

[09:50] Team_014 possession (Score: 47-57)
Michael Cunningham attempts a 3Pt. Contested by Kobe Ming (3.2 feet, ZONE). Michael Cunningham misses. Rebound secured by Anfernee Adebayo.

[09:39] Team_057 possession (Score: 47-57)
Ben Adebayo attempts a Midrange. Contested by Jordan Anunoby (4.5 feet, ZONE). Ben Adebayo misses. Rebound secured by Michael Cunningham.

[09:23] Team_014 possession (Score: 47-57)
Jordan Anunoby throws a bad pass out of bounds! TURNOVER! (dead ball)

[09:05] Team_057 possession (Score: 47-57)
FOUL! Reach-in foul on Jordan Anunoby during the drive. [Team fouls: 2] No free throws, side out. (Jordan Anunoby: 1 personal fouls)

[08:49] Team_057 possession (Score: 47-57)
Miles Middleton attempts a Midrange. Wide open! Ayo Murray is 6.8 feet away. [MAN] Miles Middleton misses. Offensive rebound by Ben Adebayo! Ben Adebayo kicks it out.

[08:39] Team_057 possession (Score: 47-57)
FOUL! Offensive foul on Miles Middleton! Ayo Murray drew the charge! [Team fouls: 3] (Miles Middleton: 1 personal fouls) TURNOVER! (dead ball)

[08:22] Team_014 possession (Score: 47-57)
FOUL! Offensive foul on Jordan Anunoby! Klay Rozier drew the charge! [Team fouls: 3] (Jordan Anunoby: 2 personal fouls) TURNOVER! (dead ball)

[08:04] Team_057 possession (Score: 47-57)
Kobe Ming attempts a 3Pt. Contested by Michael Cunningham (3.9 feet, MAN). KOBE MING MAKES IT! Assist: Anfernee Adebayo
Score: 47-60

[07:50] Team_014 possession (Score: 47-60)
FOUL! Reach-in foul on Miles Middleton during the drive. [Team fouls: 4] No free throws, side out. (Miles Middleton: 2 personal fouls)

[07:34] Team_014 possession (Score: 47-60)
Ayo Murray loses control! Ball rolls out of bounds! TURNOVER! (dead ball)

[07:16] Team_057 possession (Score: 47-60)
Klay Rozier attempts a 3Pt. Contested by Jordan Anunoby (5.1 feet, MAN). Klay Rozier misses. Rebound secured by Ayo Murray.

[07:03] Team_014 possession (Score: 47-60)
Michael Cunningham drives, Ben Adebayo stays with him. Michael Cunningham attempts a Dunk. Contested by Ben Adebayo (3.6 feet, ZONE). Michael Cunningham misses. Rebound secured by Anfernee Adebayo.

[06:52] Team_057 possession (Score: 47-60)
Anfernee Adebayo drives, picks up Ayo Murray. Help arrives from Michael Cunningham! Anfernee Adebayo attempts a Dunk. Contested by Michael Cunningham (5.9 feet, ZONE). ANFERNEE ADEBAYO MAKES IT! Assist: Miles Middleton
Score: 47-62

[06:39] Team_014 possession (Score: 47-62)
Ayo Murray drives and kicks out. Lamelo Simmons attempts a 3Pt. Heavily contested by Kobe Ming (1.9 feet, ZONE)! Lamelo Simmons misses. Rebound secured by Anfernee Adebayo.

[06:29] Team_057 possession (Score: 47-62)
FOUL! Shooting foul on DeMar Adebayo. Ben Adebayo to the line for 2 free throws. [Team fouls: 4] (DeMar Adebayo: 2 personal fouls)   FT 1/2: GOOD   FT 2/2: GOOD Ben Adebayo makes 2/2 from the line.
Score: 47-64

[06:16] Team_014 possession (Score: 47-64)
Michael Cunningham drives and kicks out. Michael Cunningham attempts a Midrange. Wide open! Klay Rozier is 8.8 feet away. [ZONE] Michael Cunningham misses. Offensive rebound by DeMar Adebayo! DeMar Adebayo kicks it out.

[05:58] Team_014 possession (Score: 47-64)
Michael Cunningham attempts a Midrange. Contested by Anfernee Adebayo (2.4 feet, ZONE). Michael Cunningham misses. Rebound secured by Anfernee Adebayo.

[05:47] Team_057 possession (Score: 47-64)
Klay Rozier drives, picks up DeMar Adebayo. Help arrives from Michael Cunningham! Klay Rozier attempts a Layup. Heavily contested by Michael Cunningham (0.6 feet, ZONE)! KLAY ROZIER MAKES IT! Assist: Kobe Ming
Score: 47-66

[05:29] Team_014 possession (Score: 47-66)
Jordan Anunoby loses the ball! Stripped by Klay Rozier! TURNOVER! (live ball)

[05:19] Team_057 possession (Score: 47-66)
Ben Adebayo attempts a 3Pt. Contested by DeMar Adebayo (5.7 feet, MAN). BEN ADEBAYO MAKES IT! Assist: Anfernee Adebayo
Score: 47-69

[05:03] Team_014 possession (Score: 47-69)
Jordan Anunoby attempts a 3Pt. Contested by Klay Rozier (5.3 feet, MAN). Jordan Anunoby misses. Rebound secured by Anfernee Adebayo.

[04:46] Team_057 possession (Score: 47-69)
Miles Middleton attempts a Midrange. Contested by Ayo Murray (3.6 feet, MAN). Miles Middleton misses. Offensive rebound by Ben Adebayo! Ben Adebayo kicks it out.

[04:35] Team_057 possession (Score: 47-69)
Kobe Ming attempts a 3Pt. Contested by Michael Cunningham (4.9 feet, MAN). Kobe Ming misses. Offensive rebound by Miles Middleton! Miles Middleton kicks it out.

[04:24] Team_057 possession (Score: 47-69)
Anfernee Adebayo attempts a Layup. Contested by Lamelo Simmons (4.5 feet, MAN). ANFERNEE ADEBAYO MAKES IT! Assist: Kobe Ming
Score: 47-71

[04:05] Team_014 possession (Score: 47-71)
Michael Cunningham attempts a 3Pt. Contested by Kobe Ming (3.5 feet, MAN). Michael Cunningham misses. Rebound secured by Anfernee Adebayo.

[03:53] Team_057 possession (Score: 47-71)
Miles Middleton attempts a Midrange. Contested by Ayo Murray (2.8 feet, MAN). MILES MIDDLETON MAKES IT!
Score: 47-73

[03:37] Team_014 possession (Score: 47-73)
DeMar Adebayo attempts a Midrange. Contested by Ben Adebayo (3.2 feet, MAN). DeMar Adebayo misses. Rebound secured by Ben Adebayo.

[03:18] Team_057 possession (Score: 47-73)
Anfernee Adebayo attempts a 3Pt. Contested by Michael Cunningham (3.5 feet, ZONE). Anfernee Adebayo misses. FOUL! Loose ball foul on Michael Cunningham during the rebound battle. [IN THE BONUS! 5 team fouls] Miles Middleton to the line for 2 free throws. (Michael Cunningham: 1 personal fouls)   FT 1/2: GOOD   FT 2/2: GOOD Miles Middleton makes 2/2 from the line.
Score: 47-75

[03:08] Team_014 possession (Score: 47-75)
Lamelo Simmons attempts a 3Pt. Contested by Anfernee Adebayo (3.9 feet, MAN). Lamelo Simmons misses. Rebound secured by Miles Middleton.

[02:56] Team_057 possession (Score: 47-75)
Miles Middleton drives, picks up Ayo Murray. Help arrives from Michael Cunningham! Miles Middleton attempts a Layup. Contested by Michael Cunningham (2.5 feet, MAN). MILES MIDDLETON MAKES IT!
Score: 47-77

[02:41] Team_014 possession (Score: 47-77)
DeMar Adebayo drives, Ben Adebayo stays with him. DeMar Adebayo attempts a Dunk. Heavily contested by Ben Adebayo (0.6 feet, ZONE)! DEMAR ADEBAYO MAKES IT! Assist: Michael Cunningham
Score: 49-77

[02:29] Team_057 possession (Score: 49-77)
Miles Middleton attempts a Midrange. Contested by DeMar Adebayo (2.2 feet, ZONE). Miles Middleton misses. Rebound secured by DeMar Adebayo.

[02:15] Team_014 possession (Score: 49-77)
Michael Cunningham attempts a 3Pt. Contested by Kobe Ming (5.9 feet, ZONE). Michael Cunningham misses. FOUL! Loose ball foul on Anfernee Adebayo during the rebound battle. [IN THE BONUS! 5 team fouls] DeMar Adebayo to the line for 2 free throws. (Anfernee Adebayo: 1 personal fouls)   FT 1/2: GOOD   FT 2/2: GOOD DeMar Adebayo makes 2/2 from the line.
Score: 51-77

[01:59] Team_057 possession (Score: 51-77)
Miles Middleton attempts a Layup. Contested by DeMar Adebayo (3.2 feet, ZONE). MILES MIDDLETON MAKES IT! Assist: Kobe Ming
Score: 51-79

[01:44] Team_014 possession (Score: 51-79)
DeMar Adebayo attempts a 3Pt. Contested by Kobe Ming (4.0 feet, ZONE). DeMar Adebayo misses. Rebound secured by Anfernee Adebayo.

[01:31] Team_057 possession (Score: 51-79)
FOUL! Reach-in foul on DeMar Adebayo during the drive. [IN THE BONUS! 6 team fouls] Ben Adebayo to the line for 2 free throws. (DeMar Adebayo: 3 personal fouls)   FT 1/2: GOOD   FT 2/2: GOOD Ben Adebayo makes 2/2 from the line.
Score: 51-81

[01:18] Team_014 possession (Score: 51-81)
DeMar Adebayo drives to the basket... DeMar Adebayo throws a bad pass! Stolen by Ben Adebayo! TURNOVER! (live ball)

[01:03] Team_057 possession (Score: 51-81)
Anfernee Adebayo drives, picks up DeMar Adebayo. Help arrives from Michael Cunningham! Anfernee Adebayo attempts a Layup. Heavily contested by Michael Cunningham (0.5 feet, ZONE)! Anfernee Adebayo misses. Rebound secured by DeMar Adebayo.

[00:52] Team_014 possession (Score: 51-81)
DeMar Adebayo attempts a Layup. Contested by Ben Adebayo (2.5 feet, MAN). DEMAR ADEBAYO MAKES IT! Assist: Michael Cunningham
Score: 53-81

[00:34] Team_057 possession (Score: 53-81)
Ben Adebayo drives to the basket... Ben Adebayo loses the ball! Stripped by DeMar Adebayo! TURNOVER! (live ball)

[00:21] Team_014 possession (Score: 53-81)
Ayo Murray drives to the basket... Ayo Murray loses the ball! Stripped by Miles Middleton! TURNOVER! (live ball)

[00:08] Team_057 possession (Score: 53-81)
FOUL! Shooting foul on Ayo Murray. Miles Middleton to the line for 2 free throws. [BONUS: 7 team fouls] (Ayo Murray: 1 personal fouls)   FT 1/2: GOOD   FT 2/2: GOOD Miles Middleton makes 2/2 from the line.
Score: 53-83

================================================================================
                              3RD QUARTER COMPLETE                              
================================================================================

3RD QUARTER SCORE: Team_014 10, Team_057 30

BOX SCORE:
================================================================================

Team_014
--------------------------------------------------------------------------------
Player                MIN  PTS  REB  AST  TO      FG   FG%      3P   3P%
--------------------------------------------------------------------------------
DeMar Adebayo          25    6    3    0   0   3/7    42.9     0/0   0.0
Jordan Anunoby         25    4    0    0   0   2/3    66.7     0/0   0.0
Ayo Murray             25    0    4    0   0   0/1     0.0     0/0   0.0
Michael Cunningham     25    0    1    2   0   0/4     0.0     0/0   0.0
Lamelo Simmons         25    0    0    0   0   0/1     0.0     0/0   0.0

TEAM: FG: 5/16 (31.2%), 3PT: 1/8 (12.5%), REB: 8 (2 off, 6 def), AST: 2, TO: 6
TEAM FOULS: 7 [Team_057 in BONUS]


Team_057
--------------------------------------------------------------------------------
Player                MIN  PTS  REB  AST  TO      FG   FG%      3P   3P%
--------------------------------------------------------------------------------
Miles Middleton        25   12    3    1   0   6/7    85.7     0/0   0.0
Ben Adebayo            25    7    4    0   0   3/4    75.0     0/0   0.0
Kobe Ming              25    5    0    3   0   2/2   100.0     0/0   0.0
Anfernee Adebayo       25    4    7    2   0   2/5    40.0     0/0   0.0
Klay Rozier            25    2    0    1   0   1/2    50.0     0/0   0.0

TEAM: FG: 14/20 (70.0%), 3PT: 3/5 (60.0%), REB: 14 (3 off, 11 def), AST: 7, TO: 2
TEAM FOULS: 5 [Team_014 in BONUS]

================================================================================

================================================================================
                       4TH QUARTER - Team_014 vs Team_057                       
================================================================================

[12:00] Substitution (Team_014): Michael Cunningham OUT (stamina: 69) → Jalen Booker IN (comeback_detected)

[12:00] Substitution (Team_057): Kobe Ming OUT (stamina: 69) → Scottie Johnson IN (comeback_detected)

[12:00] Team_014 possession (Score: 53-83)
Jordan Anunoby attempts a 3Pt. Contested by Klay Rozier (3.2 feet, MAN). JORDAN ANUNOBY MAKES IT! Assist: Ayo Murray
Score: 56-83

[11:45] Team_057 possession (Score: 56-83)
FOUL! Reach-in foul on Jordan Anunoby during the drive. [Team fouls: 1] No free throws, side out. (Jordan Anunoby: 1 personal fouls)

[11:33] Team_057 possession (Score: 56-83)
Miles Middleton attempts a 3Pt. Wide open! Jordan Anunoby is 8.4 feet away. [ZONE] Miles Middleton misses. Rebound secured by Lamelo Simmons.

[11:14] Team_014 possession (Score: 56-83)
DeMar Adebayo drives, Ben Adebayo stays with him. DeMar Adebayo attempts a Layup. Contested by Ben Adebayo (2.7 feet, ZONE). DeMar Adebayo misses. Offensive rebound by DeMar Adebayo! DeMar Adebayo kicks it out.

[11:00] Team_014 possession (Score: 56-83)
FOUL! Shooting foul on Ben Adebayo. Ayo Murray to the line for 2 free throws. [Team fouls: 1] (Ben Adebayo: 1 personal fouls)   FT 1/2: GOOD   FT 2/2: GOOD Ayo Murray makes 2/2 from the line.
Score: 58-83

[10:45] Team_057 possession (Score: 58-83)
Ben Adebayo attempts a 3Pt. Contested by DeMar Adebayo (5.5 feet, MAN). Ben Adebayo misses. Rebound secured by Lamelo Simmons.

[10:26] Team_014 possession (Score: 58-83)
Ayo Murray drives, picks up Miles Middleton. Help arrives from Klay Rozier! Ayo Murray attempts a Layup. Contested by Klay Rozier (4.3 feet, MAN). AYO MURRAY MAKES IT! Assist: Jalen Booker
Score: 60-83

[10:09] Team_057 possession (Score: 60-83)
Anfernee Adebayo attempts a Midrange. Wide open! Lamelo Simmons is 6.0 feet away. [MAN] Anfernee Adebayo misses. FOUL! Loose ball foul on Jalen Booker during the rebound battle. [Team fouls: 2] No free throws, side out. (Jalen Booker: 1 personal fouls)

[09:53] Team_057 possession (Score: 60-83)
Ben Adebayo throws a bad pass out of bounds! TURNOVER! (dead ball)

[09:53] Substitution (Team_014): Jordan Anunoby OUT → Bones Quickley IN (stamina_rule2)

[09:53] Substitution (Team_014): Lamelo Simmons OUT → Tracy Westbrook IN (stamina_rule2)

[09:53] Substitution (Team_014): DeMar Adebayo OUT → Nikola James IN (stamina_rule2)

[09:53] Substitution (Team_014): Ayo Murray OUT → Collin Gasol IN (stamina_rule2)

[09:53] Substitution (Team_057): Klay Rozier OUT → Bradley Ginobili IN (stamina_rule2)

[09:53] Substitution (Team_057): Anfernee Adebayo OUT → Joel Wade IN (stamina_rule2)

[09:53] Substitution (Team_057): Ben Adebayo OUT → Lamelo Irving IN (stamina_rule2)

[09:53] Substitution (Team_057): Miles Middleton OUT → Zion Lillard IN (stamina_rule2)

[09:38] Team_014 possession (Score: 60-83)
Jalen Booker drives and kicks out. Tracy Westbrook attempts a 3Pt. Contested by Joel Wade (5.7 feet, MAN). Tracy Westbrook misses. Rebound secured by Zion Lillard.

[09:26] Team_057 possession (Score: 60-83)
FOUL! Shooting foul on Tracy Westbrook. Joel Wade to the line for 2 free throws. [Team fouls: 3] (Tracy Westbrook: 1 personal fouls)   FT 1/2: MISS   FT 2/2: GOOD Joel Wade makes 1/2 from the line.
Score: 60-84

[09:16] Team_014 possession (Score: 60-84)
Jalen Booker attempts a Midrange. Contested by Zion Lillard (4.6 feet, ZONE). JALEN BOOKER MAKES IT!
Score: 62-84

[09:07] Team_057 possession (Score: 62-84)
Bradley Ginobili attempts a 3Pt. Wide open! Bones Quickley is 7.1 feet away. [MAN] BRADLEY GINOBILI MAKES IT! Assist: Joel Wade
Score: 62-87

[08:56] Team_014 possession (Score: 62-87)
Jalen Booker attempts a 3Pt. Wide open! Scottie Johnson is 7.9 feet away. [MAN] Jalen Booker misses. Rebound secured by Lamelo Irving.

[08:40] Team_057 possession (Score: 62-87)
Lamelo Irving attempts a Layup. Contested by Nikola James (6.0 feet, MAN). Lamelo Irving misses. Rebound secured by Collin Gasol.

[08:25] Team_014 possession (Score: 62-87)
Collin Gasol makes the Midrange and draws the foul on Joel Wade! And-1! Collin Gasol to the line for 1. [Team fouls: 2] (Joel Wade: 1 personal fouls)   FT 1/1: GOOD Collin Gasol makes 1/1 from the line.
Score: 65-87

[08:11] Team_057 possession (Score: 65-87)
Scottie Johnson attempts a 3Pt. Contested by Jalen Booker (4.7 feet, MAN). Scottie Johnson misses. Rebound secured by Collin Gasol.

[07:57] Team_014 possession (Score: 65-87)
FOUL! Offensive foul on Collin Gasol! Zion Lillard drew the charge! [Team fouls: 4] (Collin Gasol: 1 personal fouls) TURNOVER! (dead ball)

[07:38] Team_057 possession (Score: 65-87)
Joel Wade drives and kicks out. Scottie Johnson attempts a 3Pt. Contested by Jalen Booker (4.2 feet, ZONE). SCOTTIE JOHNSON MAKES IT! Assist: Joel Wade
Score: 65-90

[07:25] Team_014 possession (Score: 65-90)
Collin Gasol attempts a Midrange. Contested by Bradley Ginobili (2.9 feet, ZONE). COLLIN GASOL MAKES IT!
Score: 67-90

[07:13] Team_057 possession (Score: 67-90)
Bradley Ginobili loses the ball! Stripped by Bones Quickley! TURNOVER! (live ball)

[07:00] Team_014 possession (Score: 67-90)
Collin Gasol drives to the basket... Collin Gasol loses control! Ball rolls out of bounds! TURNOVER! (dead ball)

[06:44] Team_057 possession (Score: 67-90)
Lamelo Irving attempts a Layup. Contested by Nikola James (3.1 feet, MAN). LAMELO IRVING MAKES IT!
Score: 67-92

[06:31] Team_014 possession (Score: 67-92)
Bones Quickley attempts a Layup. Contested by Lamelo Irving (4.0 feet, ZONE). BONES QUICKLEY MAKES IT!
Score: 69-92

[06:15] Team_057 possession (Score: 69-92)
Scottie Johnson attempts a Midrange. Contested by Jalen Booker (5.3 feet, MAN). Scottie Johnson misses. Rebound secured by Collin Gasol.

[05:58] Team_014 possession (Score: 69-92)
Tracy Westbrook drives to the basket... Tracy Westbrook loses control! Ball rolls out of bounds! TURNOVER! (dead ball)

[05:47] Team_057 possession (Score: 69-92)
Bradley Ginobili attempts a Midrange. Contested by Bones Quickley (5.6 feet, MAN). BRADLEY GINOBILI MAKES IT! Assist: Scottie Johnson
Score: 69-94

[05:34] Team_014 possession (Score: 69-94)
Bones Quickley throws a bad pass out of bounds! TURNOVER! (dead ball)

[05:21] Team_057 possession (Score: 69-94)
Lamelo Irving attempts a Layup. Contested by Collin Gasol (3.3 feet, ZONE). LAMELO IRVING MAKES IT! Assist: Joel Wade
Score: 69-96

[05:10] Team_014 possession (Score: 69-96)
Bones Quickley attempts a Midrange. Contested by Zion Lillard (5.7 feet, ZONE). Bones Quickley misses. FOUL! Loose ball foul on Lamelo Irving during the rebound battle. [Team fouls: 3] No free throws, side out. (Lamelo Irving: 1 personal fouls)

[04:55] Team_014 possession (Score: 69-96)
FOUL! Reach-in foul on Zion Lillard during the drive. [Team fouls: 4] No free throws, side out. (Zion Lillard: 1 personal fouls)

[04:40] Team_014 possession (Score: 69-96)
Tracy Westbrook drives and kicks out. Jalen Booker attempts a 3Pt. Wide open! Scottie Johnson is 8.4 feet away. [ZONE] JALEN BOOKER MAKES IT! Assist: Nikola James
Score: 72-96

[04:22] Team_057 possession (Score: 72-96)
Bradley Ginobili attempts a 3Pt. Contested by Jalen Booker (3.8 feet, ZONE). Bradley Ginobili misses. Rebound secured by Tracy Westbrook.

[04:08] Team_014 possession (Score: 72-96)
Jalen Booker drives, Lamelo Irving stays with him. Jalen Booker attempts a Layup. Wide open! Lamelo Irving is 7.1 feet away. [ZONE] JALEN BOOKER MAKES IT!
Score: 74-96

[03:56] Team_057 possession (Score: 74-96)
Scottie Johnson attempts a Layup. Contested by Jalen Booker (3.6 feet, MAN). Scottie Johnson misses. Rebound secured by Tracy Westbrook.

[03:43] Team_014 possession (Score: 74-96)
Collin Gasol attempts a Midrange. Contested by Zion Lillard (4.4 feet, MAN). Collin Gasol misses. Offensive rebound by Nikola James! Nikola James kicks it out.

[03:29] Team_014 possession (Score: 74-96)
Collin Gasol drives and kicks out. Bones Quickley attempts a Midrange. Contested by Joel Wade (2.6 feet, ZONE). BONES QUICKLEY MAKES IT!
Score: 76-96

[03:18] Team_057 possession (Score: 76-96)
Bradley Ginobili attempts a 3Pt. Wide open! Bones Quickley is 6.6 feet away. [MAN] BRADLEY GINOBILI MAKES IT!
Score: 76-99

[03:07] Team_014 possession (Score: 76-99)
Jalen Booker throws a bad pass! Stolen by Scottie Johnson! TURNOVER! (live ball)

[02:48] Team_057 possession (Score: 76-99)
Joel Wade attempts a 3Pt. Contested by Nikola James (5.0 feet, ZONE). JOEL WADE MAKES IT! Assist: Bradley Ginobili
Score: 76-102

[02:30] Team_014 possession (Score: 76-102)
Tracy Westbrook attempts a 3Pt. Wide open! Scottie Johnson is 7.6 feet away. [ZONE] Tracy Westbrook misses. Rebound secured by Zion Lillard.

[02:14] Team_057 possession (Score: 76-102)
Lamelo Irving attempts a 3Pt. Contested by Nikola James (4.2 feet, MAN). Lamelo Irving misses. Rebound secured by Collin Gasol.

[02:03] Team_014 possession (Score: 76-102)
Bones Quickley attempts a Midrange. Heavily contested by Zion Lillard (0.5 feet, ZONE)! Bones Quickley misses. Offensive rebound by Collin Gasol! Collin Gasol puts it back in!
Score: 78-102

[01:51] Team_057 possession (Score: 78-102)
Zion Lillard drives and kicks out. Joel Wade attempts a Midrange. Contested by Tracy Westbrook (5.4 feet, ZONE). Joel Wade misses. Rebound secured by Collin Gasol.

[01:32] Team_014 possession (Score: 78-102)
Bones Quickley attempts a 3Pt. Wide open! Scottie Johnson is 6.4 feet away. [ZONE] BONES QUICKLEY MAKES IT! Assist: Jalen Booker
Score: 81-102

[01:18] Team_057 possession (Score: 81-102)
Lamelo Irving attempts a Layup. BLOCKED BY COLLIN GASOL! Ball is loose! Rebound secured by Tracy Westbrook.

[01:05] Team_014 possession (Score: 81-102)
Jalen Booker drives and kicks out. Jalen Booker attempts a 3Pt. Wide open! Scottie Johnson is 9.1 feet away. [MAN] JALEN BOOKER MAKES IT! Assist: Collin Gasol
Score: 84-102

[00:49] Team_057 possession (Score: 84-102)
Lamelo Irving makes the 3Pt and draws the foul on Nikola James! And-1! Lamelo Irving to the line for 1. [BONUS: 5 team fouls] (Nikola James: 1 personal fouls)   FT 1/1: MISS Lamelo Irving makes 0/1 from the line. Rebound secured by Nikola James.
Score: 84-105

[00:39] Team_014 possession (Score: 84-105)
Collin Gasol attempts a Layup. BLOCKED BY LAMELO IRVING! Ball is loose! Rebound secured by Lamelo Irving.

[00:23] Team_057 possession (Score: 84-105)
Scottie Johnson drives, Collin Gasol stays with him. Scottie Johnson attempts a Layup. Heavily contested by Collin Gasol (0.5 feet, ZONE)! SCOTTIE JOHNSON MAKES IT! Assist: Bradley Ginobili
Score: 84-107

[00:10] Team_014 possession (Score: 84-107)
Bones Quickley attempts a 3Pt. Wide open! Bradley Ginobili is 7.3 feet away. [MAN] BONES QUICKLEY MAKES IT!
Score: 87-107

================================================================================
                              4TH QUARTER COMPLETE                              
================================================================================

4TH QUARTER SCORE: Team_014 34, Team_057 24

BOX SCORE:
================================================================================

Team_014
--------------------------------------------------------------------------------
Player                MIN  PTS  REB  AST  TO      FG   FG%      3P   3P%
--------------------------------------------------------------------------------
Jalen Booker           23   10    0    2   0   4/6    66.7     0/0   0.0
Bones Quickley         21   10    0    0   0   4/4   100.0     0/0   0.0
Collin Gasol           21    7    7    1   0   3/4    75.0     0/0   0.0
Ayo Murray             28    4    0    1   0   2/2   100.0     0/0   0.0
Jordan Anunoby         28    3    0    0   0   1/1   100.0     0/0   0.0
Lamelo Simmons         28    0    2    0   0   0/0     0.0     0/0   0.0
DeMar Adebayo          28    0    1    0   0   0/0     0.0     0/0   0.0
Nikola James           21    0    2    1   0   0/0     0.0     0/0   0.0
Tracy Westbrook        21    0    3    0   0   0/1     0.0     0/0   0.0

TEAM: FG: 14/18 (77.8%), 3PT: 3/5 (60.0%), REB: 15 (4 off, 11 def), AST: 5, TO: 5
TEAM FOULS: 5 [Team_057 in BONUS]


Team_057
--------------------------------------------------------------------------------
Player                MIN  PTS  REB  AST  TO      FG   FG%      3P   3P%
--------------------------------------------------------------------------------
Bradley Ginobili       21    8    0    2   0   3/4    75.0     0/0   0.0
Scottie Johnson        23    5    0    1   0   2/5    40.0     0/0   0.0
Joel Wade              21    4    0    3   0   2/2   100.0     0/0   0.0
Lamelo Irving          21    4    2    0   0   2/6    33.3     0/0   0.0
Miles Middleton        28    0    1    0   0   0/1     0.0     0/0   0.0
Ben Adebayo            28    0    0    0   0   0/1     0.0     0/0   0.0
Zion Lillard           21    0    2    0   0   0/1     0.0     0/0   0.0

TEAM: FG: 9/20 (45.0%), 3PT: 3/9 (33.3%), REB: 5 (1 off, 4 def), AST: 6, TO: 2
TEAM FOULS: 4

================================================================================

================================================================================
                               FULL GAME COMPLETE                               
================================================================================

FINAL SCORE: Team_014 87, Team_057 107

SCORING BY QUARTER:
--------------------------------------------------------------------------------
Team                     Q1     Q2     Q3     Q4    FINAL
--------------------------------------------------------------------------------
Team_014                 21     22     10     34       87
Team_057                 23     30     30     24      107
--------------------------------------------------------------------------------

FULL GAME BOX SCORE:
================================================================================

Team_014
--------------------------------------------------------------------------------
Player                MIN  PTS  REB  AST  TO      FG   FG%      3P   3P%      FT STL BLK
--------------------------------------------------------------------------------
Jordan Anunoby         28    7    0    1   3   5/8    62.5   2/4    50.0   4/4     0   0
Lamelo Simmons         28    4    2    0   2   2/3    66.7   0/1     0.0   0/0     0   0
DeMar Adebayo          28   12   12    0   4   3/9    33.3   0/3     0.0   3/3     2   0
Ayo Murray             28    9   12    3   1   3/5    60.0   0/0     0.0   5/5     0   0
Michael Cunningham     25    4    2    3   1   3/12   25.0   1/7    14.3   2/3     0   0
Jalen Booker           23   10    0    2   1   3/9    33.3   0/3     0.0   0/0     0   0
Bones Quickley         21   16    0    2   3   6/7    85.7   3/4    75.0   1/1     1   0
Tracy Westbrook        21    0    4    3   0   1/3    33.3   0/2     0.0   0/0     0   0
Nikola James           21    8    4    1   1   4/6    66.7   0/0     0.0   2/2     0   0
Collin Gasol           21   15    9    1   1   7/10   70.0   0/0     0.0   3/3     2   2

TEAM: FG: 37/72 (51.4%), 3PT: 6/24 (25.0%), REB: 45 (13 off, 32 def), AST: 16, TO: 17


Team_057
--------------------------------------------------------------------------------
Player                MIN  PTS  REB  AST  TO      FG   FG%      3P   3P%      FT STL BLK
--------------------------------------------------------------------------------
Klay Rozier            28    8    0    2   1   3/5    60.0   2/4    50.0   0/0     1   0
Anfernee Adebayo       28    7   10    4   1   4/7    57.1   2/3    66.7   0/0     0   0
Ben Adebayo            28   11    7    1   1   5/11   45.5   1/4    25.0   8/8     3   1
Miles Middleton        28   16   11    1   2   7/11   63.6   0/1     0.0   5/6     1   0
Kobe Ming              25   13    0    5   0   5/8    62.5   2/3    66.7   3/3     0   0
Scottie Johnson        23    5    0    2   1   2/6    33.3   0/2     0.0   0/0     1   0
Bradley Ginobili       21   15    0    3   1   6/8    75.0   2/4    50.0   1/1     0   0
Joel Wade              21   14    5    3   0   6/6   100.0   2/2   100.0   1/2     0   0
Lamelo Irving          21    6    5    2   1   3/8    37.5   0/3     0.0   0/1     0   3
Zion Lillard           21    6    7    0   3   3/6    50.0   1/1   100.0   0/1     0   1

TEAM: FG: 44/76 (57.9%), 3PT: 12/27 (44.4%), REB: 45 (11 off, 34 def), AST: 23, TO: 11

================================================================================
