================================================================================
                        FULL GAME - Team_098 vs Team_074                        
================================================================================

================================================================================
                       1ST QUARTER - Team_098 vs Team_074                       
================================================================================

[12:00] Team_098 possession (Score: 0-0)
Pascal Lillard loses the ball! Stripped by Donovan Doncic! TURNOVER! (live ball)

[11:48] Team_074 possession (Score: 0-0)
Donovan Doncic attempts a Midrange. Wide open! Pascal Lillard is 7.8 feet away. [ZONE] Donovan Doncic misses. Rebound secured by Derrick Durant.

[11:36] Team_098 possession (Score: 0-0)
Pascal Lillard commits a violation (traveling/carry)! TURNOVER! (dead ball)

[11:25] Team_074 possession (Score: 0-0)
James Turner attempts a Layup. Heavily contested by Pascal Lillard (0.5 feet, ZONE)! James Turner misses. Rebound secured by Pascal Lillard.

[11:12] Team_098 possession (Score: 0-0)
Blake Murray drives, picks up Donovan Doncic. Help arrives from Chris Carter! Blake Murray attempts a Dunk. Heavily contested by Chris Carter (0.5 feet, ZONE)! BLAKE MURRAY MAKES IT! Assist: Malcolm Tatum
Score: 2-0

[11:00] Team_074 possession (Score: 2-0)
James Turner attempts a Midrange. Wide open! Derrick Durant is 7.3 feet away. [MAN] JAMES TURNER MAKES IT! Assist: Donovan Doncic
Score: 2-2

[10:44] Team_098 possession (Score: 2-2)
Pascal Lillard attempts a Midrange. Contested by Chris Carter (5.9 feet, ZONE). Pascal Lillard misses. Rebound secured by Shai Green.

[10:31] Team_074 possession (Score: 2-2)
Dwyane Quickley drives, Malcolm Tatum stays with him. Dwyane Quickley attempts a Layup. Heavily contested by Malcolm Tatum (1.4 feet, MAN)! DWYANE QUICKLEY MAKES IT! Assist: Chris Carter
Score: 2-4

[10:14] Team_098 possession (Score: 2-4)
Malcolm Tatum attempts a Midrange. Wide open! Dwyane Quickley is 7.4 feet away. [MAN] Malcolm Tatum misses. Rebound secured by Donovan Doncic.

[10:03] Team_074 possession (Score: 2-4)
Chris Carter throws a bad pass out of bounds! TURNOVER! (dead ball)

[09:44] Team_098 possession (Score: 2-4)
Nikola Rose attempts a Layup. BLOCKED BY CHRIS CARTER! Ball deflects out of bounds off Nikola Rose.

[09:27] Team_074 possession (Score: 2-4)
James Turner attempts a Layup. BLOCKED BY PASCAL LILLARD! Ball is loose! Rebound secured by Nikola Rose.

[09:13] Team_098 possession (Score: 2-4)
Malcolm Tatum attempts a 3Pt. Contested by Dwyane Quickley (5.9 feet, MAN). Malcolm Tatum misses. Rebound secured by James Turner.

[08:58] Team_074 possession (Score: 2-4)
FOUL! Shooting foul on Nikola Rose. Chris Carter to the line for 2 free throws. [Team fouls: 1] (Nikola Rose: 1 personal fouls)   FT 1/2: GOOD   FT 2/2: GOOD Chris Carter makes 2/2 from the line.
Score: 2-6

[08:43] Team_098 possession (Score: 2-6)
Nikola Rose makes the Layup and draws the foul on Chris Carter! And-1! Nikola Rose to the line for 1. [Team fouls: 1] (Chris Carter: 1 personal fouls)   FT 1/1: GOOD Nikola Rose makes 1/1 from the line.
Score: 5-6

[08:30] Team_074 possession (Score: 5-6)
James Turner attempts a 3Pt. Contested by Derrick Durant (5.1 feet, MAN). James Turner misses. Offensive rebound by Donovan Doncic! Donovan Doncic kicks it out.

[08:13] Team_074 possession (Score: 5-6)
Dwyane Quickley drives and kicks out. Dwyane Quickley attempts a Midrange. Contested by Malcolm Tatum (4.5 feet, MAN). Dwyane Quickley misses. Offensive rebound by James Turner! James Turner's putback is no good. Offensive rebound by James Turner! James Turner kicks it out.

[07:56] Team_074 possession (Score: 5-6)
James Turner makes the Layup and draws the foul on Derrick Durant! And-1! James Turner to the line for 1. [Team fouls: 3] (Derrick Durant: 1 personal fouls)   FT 1/1: GOOD James Turner makes 1/1 from the line.
Score: 5-9

[07:39] Team_098 possession (Score: 5-9)
FOUL! Reach-in foul on Donovan Doncic during the drive. [Team fouls: 2] No free throws, side out. (Donovan Doncic: 1 personal fouls)

[07:22] Team_098 possession (Score: 5-9)
Blake Murray attempts a Midrange. Wide open! Donovan Doncic is 6.5 feet away. [ZONE] BLAKE MURRAY MAKES IT!
Score: 7-9

[07:05] Team_074 possession (Score: 7-9)
Shai Green attempts a 3Pt. Contested by Blake Murray (2.9 feet, MAN). Shai Green misses. Rebound secured by Nikola Rose.

[06:48] Team_098 possession (Score: 7-9)
Nikola Rose drives and kicks out. Derrick Durant attempts a 3Pt. Contested by James Turner (5.0 feet, MAN). Derrick Durant misses. Rebound secured by James Turner.

[06:30] Team_074 possession (Score: 7-9)
Donovan Doncic attempts a 3Pt. Contested by Nikola Rose (4.6 feet, ZONE). DONOVAN DONCIC MAKES IT!
Score: 7-12

[06:19] Team_098 possession (Score: 7-12)
Malcolm Tatum attempts a 3Pt. Contested by Dwyane Quickley (5.9 feet, ZONE). MALCOLM TATUM MAKES IT! Assist: Nikola Rose
Score: 10-12

[06:07] Team_074 possession (Score: 10-12)
Shai Green attempts a 3Pt. Contested by Nikola Rose (2.2 feet, ZONE). Shai Green misses. Rebound secured by Derrick Durant.

[05:54] Team_098 possession (Score: 10-12)
Pascal Lillard attempts a 3Pt. Wide open! Donovan Doncic is 6.4 feet away. [MAN] Pascal Lillard misses. Offensive rebound by Derrick Durant! Derrick Durant's putback is no good. Rebound secured by Shai Green.

[05:41] Team_074 possession (Score: 10-12)
Shai Green attempts a Midrange. Wide open! Blake Murray is 6.5 feet away. [ZONE] SHAI GREEN MAKES IT!
Score: 10-14

[05:26] Team_098 possession (Score: 10-14)
Pascal Lillard drives to the basket... Pascal Lillard throws a bad pass! Stolen by Donovan Doncic! TURNOVER! (live ball)

[05:11] Team_074 possession (Score: 10-14)
Dwyane Quickley attempts a 3Pt. Contested by Malcolm Tatum (4.4 feet, MAN). Dwyane Quickley misses. Rebound secured by Pascal Lillard.

[04:59] Team_098 possession (Score: 10-14)
Pascal Lillard attempts a Midrange. Contested by Donovan Doncic (4.6 feet, MAN). PASCAL LILLARD MAKES IT! Assist: Nikola Rose
Score: 12-14

[04:45] Team_074 possession (Score: 12-14)
Shai Green attempts a Midrange. Contested by Blake Murray (3.3 feet, MAN). Shai Green misses. Rebound secured by Derrick Durant.

[04:31] Team_098 possession (Score: 12-14)
FOUL! Reach-in foul on Donovan Doncic during the drive. [Team fouls: 3] No free throws, side out. (Donovan Doncic: 2 personal fouls)

[04:15] Team_098 possession (Score: 12-14)
Nikola Rose drives, Donovan Doncic stays with him. Nikola Rose attempts a Dunk. Heavily contested by Donovan Doncic (0.5 feet, ZONE)! Nikola Rose misses. Rebound secured by Shai Green.

[03:58] Team_074 possession (Score: 12-14)
Dwyane Quickley attempts a 3Pt. Contested by Nikola Rose (4.9 feet, ZONE). Dwyane Quickley misses. Rebound secured by Pascal Lillard.

[03:43] Team_098 possession (Score: 12-14)
Blake Murray throws a bad pass! Stolen by Shai Green! TURNOVER! (live ball)

[03:33] Team_074 possession (Score: 12-14)
Donovan Doncic attempts a 3Pt. Contested by Nikola Rose (3.6 feet, ZONE). Donovan Doncic misses. Rebound secured by Nikola Rose.

[03:20] Team_098 possession (Score: 12-14)
Derrick Durant makes the Midrange and draws the foul on Donovan Doncic! And-1! Derrick Durant to the line for 1. [Team fouls: 4] (Donovan Doncic: 3 personal fouls)   FT 1/1: GOOD Derrick Durant makes 1/1 from the line.
Score: 15-14

[03:05] Team_074 possession (Score: 15-14)
James Turner attempts a Layup. BLOCKED BY PASCAL LILLARD! Ball is loose! Offensive rebound by Donovan Doncic! Donovan Doncic kicks it out.

[02:53] Team_074 possession (Score: 15-14)
Dwyane Quickley drives, Pascal Lillard stays with him. Dwyane Quickley attempts a Dunk. Contested by Pascal Lillard (4.7 feet, ZONE). Dwyane Quickley misses. Rebound secured by Nikola Rose.

[02:38] Team_098 possession (Score: 15-14)
Derrick Durant drives, James Turner stays with him. Derrick Durant attempts a Layup. Contested by James Turner (3.2 feet, MAN). Derrick Durant misses. Offensive rebound by Pascal Lillard! Pascal Lillard kicks it out.

[02:26] Team_098 possession (Score: 15-14)
Pascal Lillard attempts a Layup. Contested by Donovan Doncic (4.4 feet, MAN). Pascal Lillard misses. Rebound secured by Donovan Doncic.

[02:13] Team_074 possession (Score: 15-14)
James Turner loses control! Ball rolls out of bounds! TURNOVER! (dead ball)

[02:13] Substitution (Team_098): Malcolm Tatum OUT → Tracy Rose IN (stamina_rule2)

[02:13] Substitution (Team_098): Nikola Rose OUT → Dirk McCollum IN (stamina_rule2)

[02:13] Substitution (Team_098): Blake Murray OUT → Kristaps Iverson IN (stamina_rule2)

[02:13] Substitution (Team_098): Pascal Lillard OUT → Manu Jordan IN (stamina_rule2)

[02:13] Substitution (Team_098): Derrick Durant OUT → Russell McGrady IN (stamina_rule2)

[02:13] Substitution (Team_074): Dwyane Quickley OUT → James Barnes IN (stamina_rule2)

[02:13] Substitution (Team_074): Chris Carter OUT → Giannis Westbrook IN (stamina_rule2)

[02:13] Substitution (Team_074): Shai Green OUT → Ayo Smith IN (stamina_rule2)

[02:13] Substitution (Team_074): James Turner OUT → Jaren Rozier IN (stamina_rule2)

[02:00] Team_098 possession (Score: 15-14)
Dirk McCollum attempts a Midrange. Wide open! Giannis Westbrook is 7.3 feet away. [MAN] Dirk McCollum misses. Rebound secured by Jaren Rozier.

[01:47] Team_074 possession (Score: 15-14)
FOUL! Offensive foul on Ayo Smith! Kristaps Iverson drew the charge! [Team fouls: 5] (Ayo Smith: 1 personal fouls) TURNOVER! (dead ball)

[01:29] Team_098 possession (Score: 15-14)
Dirk McCollum attempts a Midrange. Wide open! Ayo Smith is 7.4 feet away. [ZONE] DIRK MCCOLLUM MAKES IT!
Score: 17-14

[01:18] Team_074 possession (Score: 17-14)
Jaren Rozier attempts a Midrange. Contested by Manu Jordan (5.4 feet, ZONE). JAREN ROZIER MAKES IT!
Score: 17-16

[01:07] Team_098 possession (Score: 17-16)
FOUL! Shooting foul on Donovan Doncic. Russell McGrady to the line for 2 free throws. [BONUS: 6 team fouls] (Donovan Doncic: 4 personal fouls)   FT 1/2: GOOD   FT 2/2: GOOD Russell McGrady makes 2/2 from the line.
Score: 19-16

[00:55] Team_074 possession (Score: 19-16)
Ayo Smith makes the Layup and draws the foul on Kristaps Iverson! And-1! Ayo Smith to the line for 1. [Team fouls: 4] (Kristaps Iverson: 1 personal fouls)   FT 1/1: GOOD Ayo Smith makes 1/1 from the line.
Score: 19-19

[00:40] Team_098 possession (Score: 19-19)
Dirk McCollum attempts a Midrange. Heavily contested by Donovan Doncic (0.8 feet, ZONE)! Dirk McCollum misses. Rebound secured by Donovan Doncic.

[00:24] Team_074 possession (Score: 19-19)
Giannis Westbrook drives to the basket... Giannis Westbrook commits a violation (traveling/carry)! TURNOVER! (dead ball)

[00:24] Substitution (Team_074): Donovan Doncic OUT → Yao Randle IN (stamina_rule2)

[00:11] Team_098 possession (Score: 19-19)
Russell McGrady attempts a Layup. Contested by Jaren Rozier (2.4 feet, MAN). RUSSELL MCGRADY MAKES IT! Assist: Kristaps Iverson
Score: 21-19

================================================================================
                              1ST QUARTER COMPLETE                              
================================================================================

1ST QUARTER SCORE: Team_098 21, Team_074 19

BOX SCORE:
================================================================================

Team_098
--------------------------------------------------------------------------------
Player                MIN  PTS  REB  AST  TO      FG   FG%      3P   3P%
--------------------------------------------------------------------------------
Blake Murray           10    4    0    0   0   2/2   100.0     0/0   0.0
Russell McGrady         2    4    0    0   0   2/2   100.0     0/0   0.0
Derrick Durant         10    3    3    0   0   1/1   100.0     0/0   0.0
Malcolm Tatum          10    3    0    1   0   1/3    33.3     0/0   0.0
Nikola Rose            10    3    4    2   0   1/4    25.0     0/0   0.0
Pascal Lillard         10    2    4    0   0   1/4    25.0     0/0   0.0
Dirk McCollum           2    2    0    0   0   1/3    33.3     0/0   0.0
Kristaps Iverson        2    0    0    1   0   0/0     0.0     0/0   0.0

TEAM: FG: 9/19 (47.4%), 3PT: 1/3 (33.3%), REB: 12 (2 off, 10 def), AST: 4, TO: 4
TEAM FOULS: 4


Team_074
--------------------------------------------------------------------------------
Player                MIN  PTS  REB  AST  TO      FG   FG%      3P   3P%
--------------------------------------------------------------------------------
James Turner           10    5    3    0   0   2/4    50.0     0/0   0.0
Donovan Doncic         12    3    5    1   0   1/3    33.3     0/0   0.0
Ayo Smith               2    3    0    0   0   1/1   100.0     0/0   0.0
Shai Green             10    2    3    0   0   1/4    25.0     0/0   0.0
Dwyane Quickley        10    2    0    0   0   1/4    25.0     0/0   0.0
Chris Carter           10    2    0    1   0   1/1   100.0     0/0   0.0
Jaren Rozier            2    2    1    0   0   1/1   100.0     0/0   0.0

TEAM: FG: 8/18 (44.4%), 3PT: 1/6 (16.7%), REB: 11 (3 off, 8 def), AST: 2, TO: 4
TEAM FOULS: 6 [Team_098 in BONUS]

================================================================================

================================================================================
                       2ND QUARTER - Team_098 vs Team_074                       
================================================================================

[12:00] Team_098 possession (Score: 21-19)
Malcolm Tatum drives, James Turner stays with him. Malcolm Tatum attempts a Layup. Contested by James Turner (2.9 feet, ZONE). MALCOLM TATUM MAKES IT! Assist: Derrick Durant
Score: 23-19

[11:48] Team_074 possession (Score: 23-19)
Chris Carter attempts a 3Pt. Contested by Nikola Rose (4.5 feet, ZONE). CHRIS CARTER MAKES IT! Assist: Shai Green
Score: 23-22

[11:31] Team_098 possession (Score: 23-22)
Derrick Durant attempts a Layup. Contested by James Turner (3.5 feet, ZONE). DERRICK DURANT MAKES IT!
Score: 25-22

[11:15] Team_074 possession (Score: 25-22)
Donovan Doncic attempts a Layup. BLOCKED BY DERRICK DURANT! Ball deflects out of bounds off Donovan Doncic.

[11:05] Team_098 possession (Score: 25-22)
Malcolm Tatum throws a bad pass out of bounds! TURNOVER! (dead ball)

[11:05] Substitution (Team_074): Donovan Doncic OUT → Yao Randle IN (stamina_rule2)

[10:51] Team_074 possession (Score: 25-22)
Shai Green attempts a Layup. Heavily contested by Blake Murray (0.8 feet, MAN)! SHAI GREEN MAKES IT! Assist: James Turner
Score: 25-24

[10:36] Team_098 possession (Score: 25-24)
Nikola Rose drives, Chris Carter stays with him. Nikola Rose attempts a Layup. Contested by Chris Carter (3.8 feet, MAN). NIKOLA ROSE MAKES IT!
Score: 27-24

[10:22] Team_074 possession (Score: 27-24)
Yao Randle drives, picks up Pascal Lillard. Help arrives from Nikola Rose! Yao Randle attempts a Layup. Contested by Nikola Rose (4.5 feet, MAN). Yao Randle misses. Rebound secured by Nikola Rose.

[10:02] Team_098 possession (Score: 27-24)
Blake Murray attempts a Layup. Contested by James Turner (2.7 feet, ZONE). BLAKE MURRAY MAKES IT! Assist: Pascal Lillard
Score: 29-24

[09:48] Team_074 possession (Score: 29-24)
Shai Green drives and kicks out. Yao Randle attempts a 3Pt. Contested by Pascal Lillard (4.9 feet, MAN). Yao Randle misses. Offensive rebound by Shai Green! Shai Green kicks it out.

[09:33] Team_074 possession (Score: 29-24)
James Turner drives and kicks out. Dwyane Quickley attempts a 3Pt. Contested by Nikola Rose (3.5 feet, ZONE). Dwyane Quickley misses. Rebound secured by Nikola Rose.

[09:22] Team_098 possession (Score: 29-24)
Derrick Durant attempts a Midrange. Heavily contested by James Turner (1.3 feet, MAN)! DERRICK DURANT MAKES IT! Assist: Malcolm Tatum
Score: 31-24

[09:10] Team_074 possession (Score: 31-24)
James Turner attempts a Layup. BLOCKED BY PASCAL LILLARD! Ball is loose! Offensive rebound by Shai Green! Shai Green kicks it out.

[08:58] Team_074 possession (Score: 31-24)
Shai Green attempts a 3Pt. Wide open! Pascal Lillard is 7.1 feet away. [ZONE] Shai Green misses. Rebound secured by Nikola Rose.

[08:43] Team_098 possession (Score: 31-24)
Pascal Lillard attempts a 3Pt. Contested by Yao Randle (4.2 feet, MAN). Pascal Lillard misses. Offensive rebound by Derrick Durant! Derrick Durant puts it back in!
Score: 33-24

[08:24] Team_074 possession (Score: 33-24)
James Turner drives to the basket... James Turner loses the ball! Stripped by Pascal Lillard! TURNOVER! (live ball)

[08:12] Team_098 possession (Score: 33-24)
Nikola Rose attempts a Layup. BLOCKED BY CHRIS CARTER! Ball deflects out of bounds off Nikola Rose.

[08:01] Team_074 possession (Score: 33-24)
FOUL! Shooting foul on Pascal Lillard. James Turner to the line for 2 free throws. [Team fouls: 1] (Pascal Lillard: 1 personal fouls)   FT 1/2: GOOD   FT 2/2: GOOD James Turner makes 2/2 from the line.
Score: 33-26

[07:50] Team_098 possession (Score: 33-26)
Derrick Durant makes the Layup and draws the foul on James Turner! And-1! Derrick Durant to the line for 1. [Team fouls: 1] (James Turner: 1 personal fouls)   FT 1/1: GOOD Derrick Durant makes 1/1 from the line.
Score: 36-26

[07:37] Team_074 possession (Score: 36-26)
Dwyane Quickley loses control! Ball rolls out of bounds! TURNOVER! (dead ball)

[07:37] Substitution (Team_098): Malcolm Tatum OUT → Tracy Rose IN (stamina_rule2)

[07:37] Substitution (Team_098): Nikola Rose OUT → Dirk McCollum IN (stamina_rule2)

[07:37] Substitution (Team_098): Blake Murray OUT → Kristaps Iverson IN (stamina_rule2)

[07:37] Substitution (Team_098): Pascal Lillard OUT → Manu Jordan IN (stamina_rule2)

[07:37] Substitution (Team_098): Derrick Durant OUT → Russell McGrady IN (stamina_rule2)

[07:37] Substitution (Team_074): Dwyane Quickley OUT → James Barnes IN (stamina_rule2)

[07:37] Substitution (Team_074): Chris Carter OUT → Giannis Westbrook IN (stamina_rule2)

[07:37] Substitution (Team_074): Shai Green OUT → Ayo Smith IN (stamina_rule2)

[07:37] Substitution (Team_074): James Turner OUT → Jaren Rozier IN (stamina_rule2)

[07:20] Team_098 possession (Score: 36-26)
Kristaps Iverson attempts a Midrange. Wide open! Giannis Westbrook is 8.5 feet away. [ZONE] Kristaps Iverson misses. Rebound secured by Yao Randle.

[07:00] Team_074 possession (Score: 36-26)
Giannis Westbrook drives to the basket... Giannis Westbrook throws a bad pass! Stolen by Russell McGrady! TURNOVER! (live ball)

[06:43] Team_098 possession (Score: 36-26)
Kristaps Iverson attempts a Midrange. Wide open! Ayo Smith is 6.8 feet away. [MAN] KRISTAPS IVERSON MAKES IT! Assist: Manu Jordan
Score: 38-26

[06:31] Team_074 possession (Score: 38-26)
James Barnes attempts a 3Pt. Wide open! Dirk McCollum is 6.4 feet away. [ZONE] JAMES BARNES MAKES IT! Assist: Giannis Westbrook
Score: 38-29

[06:12] Team_098 possession (Score: 38-29)
Russell McGrady attempts a Midrange. Wide open! Jaren Rozier is 9.3 feet away. [MAN] RUSSELL MCGRADY MAKES IT!
Score: 40-29

[05:58] Team_074 possession (Score: 40-29)
James Barnes attempts a 3Pt. Contested by Dirk McCollum (3.9 feet, ZONE). James Barnes misses. Offensive rebound by Yao Randle! Yao Randle kicks it out.

[05:44] Team_074 possession (Score: 40-29)
Giannis Westbrook attempts a Midrange. Contested by Manu Jordan (5.2 feet, ZONE). Giannis Westbrook misses. Rebound secured by Manu Jordan.

[05:30] Team_098 possession (Score: 40-29)
FOUL! Shooting foul on Giannis Westbrook. Kristaps Iverson to the line for 2 free throws. [Team fouls: 2] (Giannis Westbrook: 1 personal fouls)   FT 1/2: GOOD   FT 2/2: GOOD Kristaps Iverson makes 2/2 from the line.
Score: 42-29

[05:16] Team_074 possession (Score: 42-29)
Ayo Smith drives, Kristaps Iverson stays with him. Ayo Smith attempts a Layup. Contested by Kristaps Iverson (3.1 feet, MAN). AYO SMITH MAKES IT! Assist: James Barnes
Score: 42-31

[05:02] Team_098 possession (Score: 42-31)
Manu Jordan loses control! Ball rolls out of bounds! TURNOVER! (dead ball)

[04:49] Team_074 possession (Score: 42-31)
Ayo Smith throws a bad pass out of bounds! TURNOVER! (dead ball)

[04:35] Team_098 possession (Score: 42-31)
Russell McGrady attempts a Midrange. Contested by Jaren Rozier (3.8 feet, MAN). Russell McGrady misses. Rebound secured by Jaren Rozier.

[04:18] Team_074 possession (Score: 42-31)
Jaren Rozier drives, Russell McGrady stays with him. Jaren Rozier attempts a Layup. Heavily contested by Russell McGrady (0.7 feet, MAN)! JAREN ROZIER MAKES IT!
Score: 42-33

[04:05] Team_098 possession (Score: 42-33)
Manu Jordan makes the Layup and draws the foul on Yao Randle! And-1! Manu Jordan to the line for 1. [Team fouls: 3] (Yao Randle: 1 personal fouls)   FT 1/1: GOOD Manu Jordan makes 1/1 from the line.
Score: 45-33

[03:53] Team_074 possession (Score: 45-33)
Giannis Westbrook attempts a 3Pt. Heavily contested by Tracy Rose (1.9 feet, ZONE)! Giannis Westbrook misses. Rebound secured by Manu Jordan.

[03:41] Team_098 possession (Score: 45-33)
FOUL! Offensive foul on Dirk McCollum! Giannis Westbrook drew the charge! [Team fouls: 2] (Dirk McCollum: 1 personal fouls) TURNOVER! (dead ball)

[03:22] Team_074 possession (Score: 45-33)
Yao Randle attempts a 3Pt. Wide open! Dirk McCollum is 7.6 feet away. [ZONE] Yao Randle misses. Rebound secured by Kristaps Iverson.

[03:08] Team_098 possession (Score: 45-33)
Russell McGrady attempts a Midrange. Wide open! Jaren Rozier is 7.6 feet away. [MAN] RUSSELL MCGRADY MAKES IT!
Score: 47-33

[02:55] Team_074 possession (Score: 47-33)
Ayo Smith attempts a Layup. Heavily contested by Russell McGrady (0.5 feet, ZONE)! Ayo Smith misses. Offensive rebound by Yao Randle! Yao Randle kicks it out.

[02:35] Team_074 possession (Score: 47-33)
James Barnes attempts a 3Pt. Contested by Dirk McCollum (3.7 feet, ZONE). James Barnes misses. Offensive rebound by Yao Randle! Yao Randle kicks it out.

[02:20] Team_074 possession (Score: 47-33)
Jaren Rozier attempts a 3Pt. Contested by Russell McGrady (2.5 feet, MAN). Jaren Rozier misses. Rebound secured by Manu Jordan.

[02:11] Team_098 possession (Score: 47-33)
Tracy Rose drives, picks up Jaren Rozier. Help arrives from Giannis Westbrook! Tracy Rose attempts a Layup. Wide open! Giannis Westbrook is 9.3 feet away. [ZONE] TRACY ROSE MAKES IT!
Score: 49-33

[01:57] Team_074 possession (Score: 49-33)
Yao Randle attempts a Midrange. Wide open! Manu Jordan is 6.1 feet away. [MAN] Yao Randle misses. Rebound secured by Manu Jordan.

[01:43] Team_098 possession (Score: 49-33)
Tracy Rose loses control! Ball rolls out of bounds! TURNOVER! (dead ball)

[01:32] Team_074 possession (Score: 49-33)
Yao Randle attempts a Midrange. Contested by Manu Jordan (5.2 feet, ZONE). Yao Randle misses. Rebound secured by Manu Jordan.

[01:18] Team_098 possession (Score: 49-33)
Dirk McCollum drives and kicks out. Dirk McCollum attempts a Midrange. Contested by Giannis Westbrook (5.0 feet, MAN). DIRK MCCOLLUM MAKES IT! Assist: Kristaps Iverson
Score: 51-33

[01:03] Team_074 possession (Score: 51-33)
Giannis Westbrook attempts a 3Pt. Contested by Dirk McCollum (5.2 feet, ZONE). GIANNIS WESTBROOK MAKES IT!
Score: 51-36

[00:45] Team_098 possession (Score: 51-36)
Russell McGrady drives and kicks out. Dirk McCollum attempts a 3Pt. Contested by James Barnes (3.4 feet, ZONE). DIRK MCCOLLUM MAKES IT! Assist: Tracy Rose
Score: 54-36

[00:30] Team_074 possession (Score: 54-36)
Giannis Westbrook attempts a Midrange. Wide open! Kristaps Iverson is 9.4 feet away. [ZONE] Giannis Westbrook misses. Rebound secured by Russell McGrady.

[00:17] Team_098 possession (Score: 54-36)
Tracy Rose attempts a 3Pt. Contested by James Barnes (5.3 feet, MAN). Tracy Rose misses. Offensive rebound by Russell McGrady! Russell McGrady's putback is no good. Rebound secured by Yao Randle.

[00:02] Team_074 possession (Score: 54-36)
James Barnes attempts a Midrange. Contested by Tracy Rose (3.0 feet, MAN). James Barnes misses. Rebound secured by Kristaps Iverson.

================================================================================
                              2ND QUARTER COMPLETE                              
================================================================================

2ND QUARTER SCORE: Team_098 33, Team_074 17

BOX SCORE:
================================================================================

Team_098
--------------------------------------------------------------------------------
Player                MIN  PTS  REB  AST  TO      FG   FG%      3P   3P%
--------------------------------------------------------------------------------
Derrick Durant         15    9    1    1   0   4/4   100.0     0/0   0.0
Dirk McCollum          10    5    0    0   0   2/2   100.0     0/0   0.0
Kristaps Iverson       10    4    2    1   0   2/3    66.7     0/0   0.0
Russell McGrady        10    4    1    0   0   2/3    66.7     0/0   0.0
Manu Jordan            10    3    5    1   0   1/1   100.0     0/0   0.0
Malcolm Tatum          15    2    0    1   0   1/1   100.0     0/0   0.0
Nikola Rose            15    2    3    0   0   1/2    50.0     0/0   0.0
Blake Murray           15    2    0    0   0   1/1   100.0     0/0   0.0
Tracy Rose             10    2    0    1   0   1/2    50.0     0/0   0.0
Yao Randle             11    0    5    0   0   0/4     0.0     0/0   0.0
Pascal Lillard         15    0    0    1   0   0/0     0.0     0/0   0.0

TEAM: FG: 15/19 (78.9%), 3PT: 1/2 (50.0%), REB: 13 (2 off, 11 def), AST: 6, TO: 4
TEAM FOULS: 2


Team_074
--------------------------------------------------------------------------------
Player                MIN  PTS  REB  AST  TO      FG   FG%      3P   3P%
--------------------------------------------------------------------------------
Chris Carter           15    3    0    0   0   1/1   100.0     0/0   0.0
James Barnes           10    3    0    1   0   1/2    50.0     0/0   0.0
Giannis Westbrook      10    3    0    1   0   1/4    25.0     0/0   0.0
Shai Green             15    2    2    1   0   1/2    50.0     0/0   0.0
James Turner           15    2    0    1   0   1/2    50.0     0/0   0.0
Ayo Smith              10    2    0    0   0   1/1   100.0     0/0   0.0
Jaren Rozier           10    2    1    0   0   1/2    50.0     0/0   0.0
Donovan Doncic         13    0    0    0   0   0/1     0.0     0/0   0.0

TEAM: FG: 7/19 (36.8%), 3PT: 3/7 (42.9%), REB: 7 (5 off, 2 def), AST: 4, TO: 4
TEAM FOULS: 3

================================================================================

================================================================================
                       3RD QUARTER - Team_098 vs Team_074                       
================================================================================

[12:00] Team_098 possession (Score: 54-36)
Nikola Rose drives, Donovan Doncic stays with him. Nikola Rose attempts a Dunk. Contested by Donovan Doncic (2.4 feet, ZONE). NIKOLA ROSE MAKES IT! Assist: Pascal Lillard
Score: 56-36

[11:46] Team_074 possession (Score: 56-36)
FOUL! Shooting foul on Pascal Lillard. Donovan Doncic to the line for 2 free throws. [Team fouls: 1] (Pascal Lillard: 1 personal fouls)   FT 1/2: GOOD   FT 2/2: MISS Donovan Doncic makes 1/2 from the line. Rebound secured by Derrick Durant.
Score: 56-37

[11:36] Team_098 possession (Score: 56-37)
FOUL! Holding foul on Donovan Doncic. [Team fouls: 1] No free throws, side out. (Donovan Doncic: 1 personal fouls)

[11:24] Team_098 possession (Score: 56-37)
Derrick Durant attempts a Layup. Contested by James Turner (2.3 feet, MAN). DERRICK DURANT MAKES IT! Assist: Nikola Rose
Score: 58-37

[11:08] Team_074 possession (Score: 58-37)
Donovan Doncic attempts a 3Pt. Contested by Nikola Rose (4.1 feet, ZONE). Donovan Doncic misses. Rebound secured by Derrick Durant.

[10:55] Team_098 possession (Score: 58-37)
Derrick Durant makes the Layup and draws the foul on James Turner! And-1! Derrick Durant to the line for 1. [Team fouls: 2] (James Turner: 1 personal fouls)   FT 1/1: GOOD Derrick Durant makes 1/1 from the line.
Score: 61-37

[10:43] Team_074 possession (Score: 61-37)
Shai Green attempts a 3Pt. Contested by Malcolm Tatum (5.1 feet, ZONE). Shai Green misses. Rebound secured by Pascal Lillard.

[10:29] Team_098 possession (Score: 61-37)
Derrick Durant drives, James Turner stays with him. Derrick Durant attempts a Dunk. Heavily contested by James Turner (1.1 feet, MAN)! Derrick Durant misses. Rebound secured by Shai Green.

[10:16] Team_074 possession (Score: 61-37)
Chris Carter attempts a 3Pt. Contested by Nikola Rose (3.8 feet, MAN). CHRIS CARTER MAKES IT! Assist: Dwyane Quickley
Score: 61-40

[10:02] Team_098 possession (Score: 61-40)
Derrick Durant attempts a Midrange. Contested by James Turner (2.6 feet, MAN). DERRICK DURANT MAKES IT!
Score: 63-40

[09:50] Team_074 possession (Score: 63-40)
James Turner drives and kicks out. Chris Carter makes the Midrange and draws the foul on Blake Murray! And-1! Chris Carter to the line for 1. [Team fouls: 2] (Blake Murray: 1 personal fouls)   FT 1/1: GOOD Chris Carter makes 1/1 from the line.
Score: 63-43

[09:36] Team_098 possession (Score: 63-43)
Pascal Lillard attempts a Layup. Heavily contested by Donovan Doncic (0.9 feet, MAN)! Pascal Lillard misses. Rebound secured by Shai Green.

[09:24] Team_074 possession (Score: 63-43)
James Turner drives to the basket... FOUL! Offensive foul on James Turner! Derrick Durant drew the charge! [Team fouls: 3] (James Turner: 2 personal fouls) TURNOVER! (dead ball)

[09:13] Team_098 possession (Score: 63-43)
Derrick Durant drives, picks up James Turner. Help arrives from Chris Carter! Derrick Durant attempts a Dunk. Heavily contested by Chris Carter (0.5 feet, MAN)! Derrick Durant misses. Rebound secured by James Turner.

[08:59] Team_074 possession (Score: 63-43)
Dwyane Quickley attempts a 3Pt. Contested by Nikola Rose (2.4 feet, ZONE). Dwyane Quickley misses. Rebound secured by Pascal Lillard.

[08:47] Team_098 possession (Score: 63-43)
Derrick Durant drives to the basket... Derrick Durant throws a bad pass! Stolen by Donovan Doncic! TURNOVER! (live ball)

[08:31] Team_074 possession (Score: 63-43)
Shai Green attempts a 3Pt. Wide open! Nikola Rose is 6.4 feet away. [ZONE] SHAI GREEN MAKES IT! Assist: Donovan Doncic
Score: 63-46

[08:18] Team_098 possession (Score: 63-46)
Malcolm Tatum attempts a Layup. Contested by Dwyane Quickley (5.0 feet, MAN). Malcolm Tatum misses. Rebound secured by James Turner.

[08:04] Team_074 possession (Score: 63-46)
Chris Carter attempts a 3Pt. Contested by Nikola Rose (4.8 feet, MAN). Chris Carter misses. Rebound secured by Nikola Rose.

[07:48] Team_098 possession (Score: 63-46)
Nikola Rose loses the ball! Stripped by Chris Carter! TURNOVER! (live ball)

[07:36] Team_074 possession (Score: 63-46)
James Turner attempts a Layup. Contested by Derrick Durant (4.4 feet, MAN). JAMES TURNER MAKES IT!
Score: 63-48

[07:26] Team_098 possession (Score: 63-48)
Malcolm Tatum attempts a 3Pt. Contested by Dwyane Quickley (4.4 feet, ZONE). MALCOLM TATUM MAKES IT! Assist: Blake Murray
Score: 66-48

[07:14] Team_074 possession (Score: 66-48)
Shai Green attempts a 3Pt. Wide open! Nikola Rose is 6.8 feet away. [ZONE] Shai Green misses. Rebound secured by Nikola Rose.

[07:00] Team_098 possession (Score: 66-48)
Nikola Rose attempts a 3Pt. Wide open! Dwyane Quickley is 6.8 feet away. [ZONE] Nikola Rose misses. Offensive rebound by Pascal Lillard! Pascal Lillard kicks it out.

[06:45] Team_098 possession (Score: 66-48)
Nikola Rose attempts a 3Pt. Wide open! Dwyane Quickley is 7.4 feet away. [ZONE] Nikola Rose misses. Offensive rebound by Pascal Lillard! Pascal Lillard kicks it out.

[06:33] Team_098 possession (Score: 66-48)
Derrick Durant loses the ball! Stripped by James Turner! TURNOVER! (live ball)

[06:17] Team_074 possession (Score: 66-48)
Chris Carter attempts a 3Pt. Contested by Nikola Rose (5.1 feet, MAN). Chris Carter misses. Offensive rebound by Donovan Doncic! Donovan Doncic kicks it out.

[06:05] Team_074 possession (Score: 66-48)
Donovan Doncic attempts a Midrange. Wide open! Pascal Lillard is 6.7 feet away. [MAN] Donovan Doncic misses. FOUL! Loose ball foul on Derrick Durant during the rebound battle. [Team fouls: 3] No free throws, side out. (Derrick Durant: 1 personal fouls)

[05:54] Team_074 possession (Score: 66-48)
FOUL! Shooting foul on Blake Murray. Shai Green to the line for 2 free throws. [Team fouls: 4] (Blake Murray: 2 personal fouls)   FT 1/2: GOOD   FT 2/2: GOOD Shai Green makes 2/2 from the line.
Score: 66-50

[05:36] Team_098 possession (Score: 66-50)
Derrick Durant drives and kicks out. Malcolm Tatum attempts a 3Pt. Contested by Dwyane Quickley (3.6 feet, MAN). MALCOLM TATUM MAKES IT! Assist: Nikola Rose
Score: 69-50

[05:21] Team_074 possession (Score: 69-50)
Chris Carter attempts a Layup. BLOCKED BY NIKOLA ROSE! Ball is loose! Offensive rebound by James Turner! James Turner kicks it out.

[05:10] Team_074 possession (Score: 69-50)
Shai Green drives and kicks out. James Turner attempts a Midrange. Contested by Pascal Lillard (3.2 feet, ZONE). James Turner misses. Offensive rebound by Donovan Doncic! Donovan Doncic kicks it out.

[04:59] Team_074 possession (Score: 69-50)
Donovan Doncic drives to the basket... Donovan Doncic commits a violation (traveling/carry)! TURNOVER! (dead ball)

[04:44] Team_098 possession (Score: 69-50)
Blake Murray attempts a 3Pt. Wide open! Dwyane Quickley is 6.1 feet away. [ZONE] Blake Murray misses. Rebound secured by Shai Green.

[04:27] Team_074 possession (Score: 69-50)
Shai Green attempts a Layup. Contested by Blake Murray (3.8 feet, MAN). SHAI GREEN MAKES IT! Assist: Chris Carter
Score: 69-52

[04:12] Team_098 possession (Score: 69-52)
Pascal Lillard attempts a 3Pt. Contested by Donovan Doncic (3.9 feet, MAN). PASCAL LILLARD MAKES IT! Assist: Nikola Rose
Score: 72-52

[03:57] Team_074 possession (Score: 72-52)
Donovan Doncic attempts a 3Pt. Contested by Malcolm Tatum (2.6 feet, ZONE). Donovan Doncic misses. Offensive rebound by Donovan Doncic! Donovan Doncic kicks it out.

[03:47] Team_074 possession (Score: 72-52)
James Turner drives, picks up Pascal Lillard. Help arrives from Nikola Rose! James Turner attempts a Layup. Heavily contested by Nikola Rose (1.9 feet, ZONE)! JAMES TURNER MAKES IT!
Score: 72-54

[03:35] Team_098 possession (Score: 72-54)
FOUL! Holding foul on Shai Green. [Team fouls: 4] No free throws, side out. (Shai Green: 1 personal fouls)

[03:15] Team_098 possession (Score: 72-54)
Malcolm Tatum attempts a Layup. Contested by Dwyane Quickley (2.5 feet, MAN). Malcolm Tatum misses. Rebound secured by Donovan Doncic.

[02:59] Team_074 possession (Score: 72-54)
Dwyane Quickley attempts a 3Pt. Contested by Malcolm Tatum (5.3 feet, MAN). Dwyane Quickley misses. Rebound secured by Pascal Lillard.

[02:45] Team_098 possession (Score: 72-54)
Malcolm Tatum drives to the basket... Malcolm Tatum loses the ball! Stripped by Dwyane Quickley! TURNOVER! (live ball)

[02:30] Team_074 possession (Score: 72-54)
James Turner drives, Derrick Durant stays with him. James Turner attempts a Dunk. Contested by Derrick Durant (3.7 feet, MAN). James Turner misses. Rebound secured by Pascal Lillard.

[02:15] Team_098 possession (Score: 72-54)
Nikola Rose attempts a 3Pt. Wide open! Dwyane Quickley is 6.3 feet away. [ZONE] Nikola Rose misses. Offensive rebound by Derrick Durant! Derrick Durant's putback is no good. Offensive rebound by Pascal Lillard! Pascal Lillard kicks it out.

[01:59] Team_098 possession (Score: 72-54)
Malcolm Tatum attempts a 3Pt. Contested by Dwyane Quickley (3.6 feet, ZONE). Malcolm Tatum misses. Rebound secured by Donovan Doncic.

[01:47] Team_074 possession (Score: 72-54)
James Turner attempts a Layup. Contested by Pascal Lillard (4.2 feet, ZONE). JAMES TURNER MAKES IT!
Score: 72-56

[01:31] Team_098 possession (Score: 72-56)
Blake Murray attempts a Layup. Contested by James Turner (2.9 feet, ZONE). BLAKE MURRAY MAKES IT! Assist: Pascal Lillard
Score: 74-56

[01:12] Team_074 possession (Score: 74-56)
Dwyane Quickley drives, Malcolm Tatum stays with him. Dwyane Quickley attempts a Dunk. Contested by Malcolm Tatum (5.4 feet, MAN). Dwyane Quickley misses. Rebound secured by Derrick Durant.

[00:58] Team_098 possession (Score: 74-56)
Pascal Lillard attempts a 3Pt. Wide open! Dwyane Quickley is 8.3 feet away. [ZONE] Pascal Lillard misses. Rebound secured by Donovan Doncic.

[00:44] Team_074 possession (Score: 74-56)
Dwyane Quickley attempts a Midrange. Contested by Pascal Lillard (4.6 feet, ZONE). Dwyane Quickley misses. Rebound secured by Derrick Durant.

[00:30] Team_098 possession (Score: 74-56)
Malcolm Tatum loses the ball! Stripped by Dwyane Quickley! TURNOVER! (live ball)

[00:18] Team_074 possession (Score: 74-56)
Dwyane Quickley drives, Malcolm Tatum stays with him. Dwyane Quickley attempts a Dunk. Heavily contested by Malcolm Tatum (1.8 feet, MAN)! DWYANE QUICKLEY MAKES IT!
Score: 74-58

[00:04] Team_098 possession (Score: 74-58)
Nikola Rose attempts a 3Pt. Contested by Dwyane Quickley (5.6 feet, ZONE). Nikola Rose misses. FOUL! Loose ball foul on Shai Green during the rebound battle. [IN THE BONUS! 5 team fouls] Pascal Lillard to the line for 2 free throws. (Shai Green: 2 personal fouls)   FT 1/2: GOOD   FT 2/2: GOOD Pascal Lillard makes 2/2 from the line.
Score: 76-58

================================================================================
                              3RD QUARTER COMPLETE                              
================================================================================

3RD QUARTER SCORE: Team_098 22, Team_074 22

BOX SCORE:
================================================================================

Team_098
--------------------------------------------------------------------------------
Player                MIN  PTS  REB  AST  TO      FG   FG%      3P   3P%
--------------------------------------------------------------------------------
Derrick Durant         27    7    4    0   0   3/5    60.0     0/0   0.0
Malcolm Tatum          27    6    0    0   0   2/5    40.0     0/0   0.0
Pascal Lillard         27    5    7    2   0   2/4    50.0     0/0   0.0
Nikola Rose            27    2    2    3   0   1/1   100.0     0/0   0.0
Blake Murray           27    2    0    1   0   1/2    50.0     0/0   0.0

TEAM: FG: 9/17 (52.9%), 3PT: 3/6 (50.0%), REB: 13 (3 off, 10 def), AST: 6, TO: 5
TEAM FOULS: 4


Team_074
--------------------------------------------------------------------------------
Player                MIN  PTS  REB  AST  TO      FG   FG%      3P   3P%
--------------------------------------------------------------------------------
Shai Green             27    7    3    0   0   3/5    60.0     0/0   0.0
Chris Carter           27    6    0    1   0   2/3    66.7     0/0   0.0
James Turner           27    6    3    0   0   3/4    75.0     0/0   0.0
Dwyane Quickley        27    2    0    1   0   1/5    20.0     0/0   0.0
Donovan Doncic         25    0    7    1   0   0/2     0.0     0/0   0.0

TEAM: FG: 9/19 (47.4%), 3PT: 2/8 (25.0%), REB: 13 (5 off, 8 def), AST: 3, TO: 2
TEAM FOULS: 5 [Team_098 in BONUS]

================================================================================

================================================================================
                       4TH QUARTER - Team_098 vs Team_074                       
================================================================================

[12:00] Team_098 possession (Score: 76-58)
Malcolm Tatum attempts a 3Pt. Contested by Dwyane Quickley (3.9 feet, MAN). Malcolm Tatum misses. Rebound secured by James Turner.

[11:47] Team_074 possession (Score: 76-58)
Shai Green attempts a Layup. Contested by Pascal Lillard (5.1 feet, ZONE). Shai Green misses. Rebound secured by Derrick Durant.

[11:32] Team_098 possession (Score: 76-58)
Pascal Lillard attempts a Layup. BLOCKED BY DONOVAN DONCIC! Ball goes out off Donovan Doncic. Pascal Lillard's ball!

[11:16] Team_098 possession (Score: 76-58)
Pascal Lillard attempts a 3Pt. Wide open! Dwyane Quickley is 8.8 feet away. [ZONE] Pascal Lillard misses. Rebound secured by Donovan Doncic.

[11:05] Team_074 possession (Score: 76-58)
FOUL! Reach-in foul on Malcolm Tatum during the drive. [Team fouls: 1] No free throws, side out. (Malcolm Tatum: 1 personal fouls)

[10:49] Team_074 possession (Score: 76-58)
Donovan Doncic drives to the basket... Donovan Doncic loses control! Ball rolls out of bounds! TURNOVER! (dead ball)

[10:49] Substitution (Team_098): Malcolm Tatum OUT → Tracy Rose IN (stamina_rule2)

[10:49] Substitution (Team_098): Nikola Rose OUT → Dirk McCollum IN (stamina_rule2)

[10:49] Substitution (Team_098): Blake Murray OUT → Kristaps Iverson IN (stamina_rule2)

[10:49] Substitution (Team_098): Pascal Lillard OUT → Manu Jordan IN (stamina_rule2)

[10:49] Substitution (Team_098): Derrick Durant OUT → Russell McGrady IN (stamina_rule2)

[10:49] Substitution (Team_074): Dwyane Quickley OUT → James Barnes IN (stamina_rule2)

[10:49] Substitution (Team_074): Chris Carter OUT → Giannis Westbrook IN (stamina_rule2)

[10:49] Substitution (Team_074): Shai Green OUT → Ayo Smith IN (stamina_rule2)

[10:49] Substitution (Team_074): Donovan Doncic OUT → Yao Randle IN (stamina_rule2)

[10:49] Substitution (Team_074): James Turner OUT → Jaren Rozier IN (stamina_rule2)

[10:31] Team_098 possession (Score: 76-58)
Dirk McCollum attempts a 3Pt. Contested by Giannis Westbrook (4.8 feet, MAN). Dirk McCollum misses. FOUL! Loose ball foul on Yao Randle during the rebound battle. [Team fouls: 1] No free throws, side out. (Yao Randle: 1 personal fouls)

[10:20] Team_098 possession (Score: 76-58)
Tracy Rose attempts a 3Pt. Contested by James Barnes (5.0 feet, MAN). Tracy Rose misses. Rebound secured by Yao Randle.

[10:06] Team_074 possession (Score: 76-58)
Ayo Smith drives and kicks out. Yao Randle attempts a Midrange. Wide open! Manu Jordan is 8.0 feet away. [MAN] Yao Randle misses. Rebound secured by Kristaps Iverson.

[09:50] Team_098 possession (Score: 76-58)
Tracy Rose attempts a Midrange. Contested by Ayo Smith (4.8 feet, ZONE). Tracy Rose misses. Rebound secured by Jaren Rozier.

[09:33] Team_074 possession (Score: 76-58)
Jaren Rozier attempts a 3Pt. Contested by Dirk McCollum (3.7 feet, ZONE). Jaren Rozier misses. Rebound secured by Manu Jordan.

[09:16] Team_098 possession (Score: 76-58)
Dirk McCollum drives to the basket... Dirk McCollum loses the ball! Stripped by Giannis Westbrook! TURNOVER! (live ball)

[09:03] Team_074 possession (Score: 76-58)
Yao Randle drives, Manu Jordan stays with him. Yao Randle attempts a Layup. Contested by Manu Jordan (4.6 feet, MAN). YAO RANDLE MAKES IT! Assist: Jaren Rozier
Score: 76-60

[08:47] Team_098 possession (Score: 76-60)
Kristaps Iverson makes the Dunk and draws the foul on Giannis Westbrook! And-1! Kristaps Iverson to the line for 1. [Team fouls: 2] (Giannis Westbrook: 1 personal fouls)   FT 1/1: GOOD Kristaps Iverson makes 1/1 from the line.
Score: 79-60

[08:33] Team_074 possession (Score: 79-60)
Jaren Rozier drives, Russell McGrady stays with him. Jaren Rozier attempts a Dunk. Contested by Russell McGrady (3.0 feet, MAN). Jaren Rozier misses. Rebound secured by Russell McGrady.

[08:16] Team_098 possession (Score: 79-60)
Manu Jordan attempts a Midrange. Heavily contested by Yao Randle (1.2 feet, ZONE)! Manu Jordan misses. Rebound secured by Ayo Smith.

[08:00] Team_074 possession (Score: 79-60)
Giannis Westbrook attempts a Layup. Contested by Dirk McCollum (5.0 feet, MAN). Giannis Westbrook misses. Rebound secured by Russell McGrady.

[07:44] Team_098 possession (Score: 79-60)
Dirk McCollum drives to the basket... Dirk McCollum throws a bad pass! Stolen by Giannis Westbrook! TURNOVER! (live ball)

[07:30] Team_074 possession (Score: 79-60)
James Barnes attempts a 3Pt. Contested by Dirk McCollum (3.4 feet, ZONE). James Barnes misses. Offensive rebound by Jaren Rozier! Jaren Rozier kicks it out.

[07:14] Team_074 possession (Score: 79-60)
Giannis Westbrook attempts a 3Pt. Contested by Dirk McCollum (4.0 feet, MAN). Giannis Westbrook misses. Rebound secured by Russell McGrady.

[06:57] Team_098 possession (Score: 79-60)
Russell McGrady drives and kicks out. Tracy Rose attempts a 3Pt. Contested by Giannis Westbrook (3.2 feet, ZONE). Tracy Rose misses. Rebound secured by Ayo Smith.

[06:42] Team_074 possession (Score: 79-60)
Yao Randle attempts a Midrange. Wide open! Manu Jordan is 7.4 feet away. [MAN] YAO RANDLE MAKES IT!
Score: 79-62

[06:28] Team_098 possession (Score: 79-62)
Kristaps Iverson attempts a Midrange. Contested by Yao Randle (5.2 feet, ZONE). KRISTAPS IVERSON MAKES IT!
Score: 81-62

[06:14] Team_074 possession (Score: 81-62)
FOUL! Reach-in foul on Manu Jordan during the drive. [Team fouls: 2] No free throws, side out. (Manu Jordan: 1 personal fouls)

[06:00] Team_074 possession (Score: 81-62)
Jaren Rozier attempts a Midrange. Contested by Kristaps Iverson (3.7 feet, ZONE). Jaren Rozier misses. Rebound secured by Kristaps Iverson.

[05:50] Team_098 possession (Score: 81-62)
Tracy Rose attempts a 3Pt. Heavily contested by James Barnes (1.9 feet, ZONE)! Tracy Rose misses. FOUL! Loose ball foul on Jaren Rozier during the rebound battle. [Team fouls: 3] No free throws, side out. (Jaren Rozier: 1 personal fouls)

[05:35] Team_098 possession (Score: 81-62)
Dirk McCollum throws a bad pass! Stolen by Giannis Westbrook! TURNOVER! (live ball)

[05:19] Team_074 possession (Score: 81-62)
Giannis Westbrook makes the Layup and draws the foul on Dirk McCollum! And-1! Giannis Westbrook to the line for 1. [Team fouls: 3] (Dirk McCollum: 1 personal fouls)   FT 1/1: GOOD Giannis Westbrook makes 1/1 from the line.
Score: 81-65

[05:07] Team_098 possession (Score: 81-65)
Kristaps Iverson attempts a Layup. Contested by Ayo Smith (3.2 feet, MAN). KRISTAPS IVERSON MAKES IT!
Score: 83-65

[04:56] Team_074 possession (Score: 83-65)
Ayo Smith drives and kicks out. Giannis Westbrook attempts a 3Pt. Heavily contested by Dirk McCollum (1.7 feet, MAN)! Giannis Westbrook misses. Rebound secured by Kristaps Iverson.

[04:46] Team_098 possession (Score: 83-65)
Kristaps Iverson attempts a 3Pt. Wide open! James Barnes is 6.5 feet away. [ZONE] KRISTAPS IVERSON MAKES IT! Assist: Dirk McCollum
Score: 86-65

[04:31] Team_074 possession (Score: 86-65)
FOUL! Reach-in foul on Dirk McCollum during the drive. [Team fouls: 4] No free throws, side out. (Dirk McCollum: 2 personal fouls)

[04:15] Team_074 possession (Score: 86-65)
Yao Randle makes the Layup and draws the foul on Russell McGrady! And-1! Yao Randle to the line for 1. [BONUS: 5 team fouls] (Russell McGrady: 1 personal fouls)   FT 1/1: GOOD Yao Randle makes 1/1 from the line.
Score: 86-68

[04:05] Team_098 possession (Score: 86-68)
Manu Jordan drives, Yao Randle stays with him. Manu Jordan attempts a Dunk. Contested by Yao Randle (4.8 feet, ZONE). Manu Jordan misses. Rebound secured by Ayo Smith.

[03:51] Team_074 possession (Score: 86-68)
Ayo Smith attempts a Layup. Contested by Kristaps Iverson (3.6 feet, MAN). Ayo Smith misses. Rebound secured by Kristaps Iverson.

[03:35] Team_098 possession (Score: 86-68)
FOUL! Holding foul on Jaren Rozier. [Team fouls: 4] No free throws, side out. (Jaren Rozier: 2 personal fouls)

[03:20] Team_098 possession (Score: 86-68)
Kristaps Iverson attempts a 3Pt. Contested by Ayo Smith (4.0 feet, MAN). Kristaps Iverson misses. Rebound secured by Yao Randle.

[03:08] Team_074 possession (Score: 86-68)
James Barnes throws a bad pass out of bounds! TURNOVER! (dead ball)

[02:51] Team_098 possession (Score: 86-68)
Tracy Rose makes the Layup and draws the foul on James Barnes! And-1! Tracy Rose to the line for 1. [BONUS: 5 team fouls] (James Barnes: 1 personal fouls)   FT 1/1: GOOD Tracy Rose makes 1/1 from the line.
Score: 89-68

[02:36] Team_074 possession (Score: 89-68)
Giannis Westbrook attempts a Midrange. Contested by Kristaps Iverson (5.1 feet, ZONE). Giannis Westbrook misses. Rebound secured by Manu Jordan.

[02:26] Team_098 possession (Score: 89-68)
Kristaps Iverson makes the Dunk and draws the foul on Ayo Smith! And-1! Kristaps Iverson to the line for 1. [BONUS: 6 team fouls] (Ayo Smith: 1 personal fouls)   FT 1/1: MISS Kristaps Iverson makes 0/1 from the line. Rebound secured by Jaren Rozier.
Score: 91-68

[02:13] Team_074 possession (Score: 91-68)
Yao Randle attempts a Midrange. Contested by Manu Jordan (4.4 feet, MAN). Yao Randle misses. Offensive rebound by Jaren Rozier! Jaren Rozier kicks it out.

[01:56] Team_074 possession (Score: 91-68)
Giannis Westbrook attempts a 3Pt. Heavily contested by Dirk McCollum (1.8 feet, ZONE)! Giannis Westbrook misses. Offensive rebound by Jaren Rozier! Jaren Rozier kicks it out.

[01:39] Team_074 possession (Score: 91-68)
Ayo Smith makes the Midrange and draws the foul on Kristaps Iverson! And-1! Ayo Smith to the line for 1. [BONUS: 6 team fouls] (Kristaps Iverson: 1 personal fouls)   FT 1/1: GOOD Ayo Smith makes 1/1 from the line.
Score: 91-71

[01:26] Team_098 possession (Score: 91-71)
FOUL! Holding foul on Jaren Rozier. [IN THE BONUS! 7 team fouls] Russell McGrady to the line for 2 free throws. (Jaren Rozier: 3 personal fouls)   FT 1/2: MISS   FT 2/2: GOOD Russell McGrady makes 1/2 from the line.
Score: 92-71

[01:15] Team_074 possession (Score: 92-71)
Yao Randle attempts a Midrange. Contested by Dirk McCollum (5.7 feet, ZONE). Yao Randle misses. Rebound secured by Russell McGrady.

[01:03] Team_098 possession (Score: 92-71)
Tracy Rose attempts a 3Pt. Contested by James Barnes (2.8 feet, MAN). TRACY ROSE MAKES IT! Assist: Manu Jordan
Score: 95-71

[00:48] Team_074 possession (Score: 95-71)
Yao Randle attempts a Midrange. Contested by Dirk McCollum (3.9 feet, ZONE). Yao Randle misses. Rebound secured by Russell McGrady.

[00:34] Team_098 possession (Score: 95-71)
Russell McGrady makes the Layup and draws the foul on Jaren Rozier! And-1! Russell McGrady to the line for 1. [BONUS: 8 team fouls] (Jaren Rozier: 4 personal fouls)   FT 1/1: GOOD Russell McGrady makes 1/1 from the line.
Score: 98-71

[00:22] Team_074 possession (Score: 98-71)
Jaren Rozier drives, Russell McGrady stays with him. Jaren Rozier attempts a Layup. Contested by Russell McGrady (3.9 feet, MAN). JAREN ROZIER MAKES IT! Assist: Giannis Westbrook
Score: 98-73

[00:07] Team_098 possession (Score: 98-73)
Russell McGrady drives to the basket... Russell McGrady loses control! Ball rolls out of bounds! TURNOVER! (dead ball)

================================================================================
                              4TH QUARTER COMPLETE                              
================================================================================

4TH QUARTER SCORE: Team_098 22, Team_074 15

BOX SCORE:
================================================================================

Team_098
--------------------------------------------------------------------------------
Player                MIN  PTS  REB  AST  TO      FG   FG%      3P   3P%
--------------------------------------------------------------------------------
Kristaps Iverson       20   10    6    0   0   4/6    66.7     0/0   0.0
Tracy Rose             20    6    0    0   0   2/4    50.0     0/0   0.0
Russell McGrady        20    4    5    0   0   2/3    66.7     0/0   0.0
Malcolm Tatum          28    0    0    0   0   0/1     0.0     0/0   0.0
Derrick Durant         28    0    1    0   0   0/0     0.0     0/0   0.0
Pascal Lillard         28    0    0    0   0   0/1     0.0     0/0   0.0
Manu Jordan            20    0    2    1   0   0/2     0.0     0/0   0.0
Dirk McCollum          20    0    0    1   0   0/0     0.0     0/0   0.0

TEAM: FG: 8/17 (47.1%), 3PT: 2/6 (33.3%), REB: 14 (2 off, 12 def), AST: 2, TO: 4
TEAM FOULS: 6 [Team_074 in BONUS]


Team_074
--------------------------------------------------------------------------------
Player                MIN  PTS  REB  AST  TO      FG   FG%      3P   3P%
--------------------------------------------------------------------------------
Yao Randle             22    7    2    0   0   3/5    60.0     0/0   0.0
Ayo Smith              20    3    3    0   0   1/4    25.0     0/0   0.0
Giannis Westbrook      20    3    0    1   0   1/4    25.0     0/0   0.0
Jaren Rozier           20    2    5    1   0   1/4    25.0     0/0   0.0
James Turner           28    0    1    0   0   0/0     0.0     0/0   0.0
Shai Green             28    0    0    0   0   0/1     0.0     0/0   0.0
Donovan Doncic         27    0    1    0   0   0/0     0.0     0/0   0.0

TEAM: FG: 6/18 (33.3%), 3PT: 0/2 (0.0%), REB: 12 (3 off, 9 def), AST: 2, TO: 2
TEAM FOULS: 8 [Team_098 in BONUS]

================================================================================

================================================================================
                               FULL GAME COMPLETE                               
================================================================================

FINAL SCORE: Team_098 98, Team_074 73

SCORING BY QUARTER:
--------------------------------------------------------------------------------
Team                     Q1     Q2     Q3     Q4    FINAL
--------------------------------------------------------------------------------
Team_098                 21     33     22     22       98
Team_074                 19     17     22     15       73
--------------------------------------------------------------------------------

FULL GAME BOX SCORE:
================================================================================

Team_098
--------------------------------------------------------------------------------
Player                MIN  PTS  REB  AST  TO      FG   FG%      3P   3P%      FT STL BLK
--------------------------------------------------------------------------------
Malcolm Tatum          28   11    0    2   3   3/9    33.3   2/5    40.0   0/0     0   0
Nikola Rose            28    7    9    5   1   4/8    50.0   1/1   100.0   1/1     0   1
Blake Murray           28    8    0    1   2   4/5    80.0   0/1     0.0   0/0     0   0
Pascal Lillard         28    7   11    3   2   3/9    33.3   2/5    40.0   2/2     1   3
Derrick Durant         28   19    9    1   2   8/10   80.0   0/0     0.0   3/3     0   1
Tracy Rose             20    8    0    1   2   3/6    50.0   1/3    33.3   1/1     0   0
Dirk McCollum          20    7    0    1   2   2/4    50.0   0/0     0.0   0/0     0   0
Kristaps Iverson       20   14    8    2   0   6/9    66.7   1/2    50.0   3/4     0   0
Manu Jordan            20    3    7    2   3   1/3    33.3   0/0     0.0   1/1     0   0
Russell McGrady        20   12    6    0   0   6/8    75.0   0/0     0.0   4/5     1   0

TEAM: FG: 41/72 (56.9%), 3PT: 7/17 (41.2%), REB: 52 (9 off, 43 def), AST: 18, TO: 17


Team_074
--------------------------------------------------------------------------------
Player                MIN  PTS  REB  AST  TO      FG   FG%      3P   3P%      FT STL BLK
--------------------------------------------------------------------------------
Dwyane Quickley        28    4    0    1   1   2/9    22.2   0/4     0.0   0/0     2   0
Chris Carter           28   11    0    2   3   3/4    75.0   2/3    66.7   3/3     1   2
Shai Green             28   11    8    1   0   5/12   41.7   1/6    16.7   2/2     1   0
James Turner           28   13    7    1   2   7/11   63.6   0/0     0.0   3/3     1   0
Donovan Doncic         27    3   13    2   0   1/6    16.7   1/3    33.3   1/2     3   1
Yao Randle             22    7    7    0   1   3/9    33.3   0/1     0.0   1/1     0   0
James Barnes           20    3    0    1   2   1/2    50.0   1/1   100.0   0/0     0   0
Giannis Westbrook      20    6    0    2   0   2/8    25.0   1/3    33.3   1/1     3   0
Ayo Smith              20    8    3    0   2   3/6    50.0   0/0     0.0   2/2     0   0
Jaren Rozier           20    6    7    1   1   3/7    42.9   0/2     0.0   0/0     0   0

TEAM: FG: 30/74 (40.5%), 3PT: 6/23 (26.1%), REB: 43 (16 off, 27 def), AST: 11, TO: 12

================================================================================
