================================================================================
                        FULL GAME - Team_068 vs Team_084                        
================================================================================

================================================================================
                       1ST QUARTER - Team_068 vs Team_084                       
================================================================================

[12:00] Team_068 possession (Score: 0-0)
Zion Anunoby drives, Luka Sexton stays with him. Zion Anunoby attempts a Dunk. Heavily contested by Luka Sexton (0.6 feet, MAN)! Zion Anunoby misses. Rebound secured by Dejounte Ginobili.

[11:46] Team_084 possession (Score: 0-0)
Dejounte Ginobili attempts a 3Pt. Contested by Zion Anunoby (3.8 feet, ZONE). Dejounte Ginobili misses. Rebound secured by Gary Simons.

[11:33] Team_068 possession (Score: 0-0)
Malcolm Herro attempts a 3Pt. Contested by Luka Sexton (3.7 feet, ZONE). Malcolm Herro misses. Rebound secured by Giannis Quickley.

[11:18] Team_084 possession (Score: 0-0)
Klay Thompson drives to the basket... Klay Thompson loses the ball! Stripped by Jaren Johnson! TURNOVER! (live ball)

[11:02] Team_068 possession (Score: 0-0)
Gary Simons drives to the basket... FOUL! Offensive foul on Gary Simons! Jarrett Booker drew the charge! [Team fouls: 1] (Gary Simons: 1 personal fouls) TURNOVER! (dead ball)

[10:52] Team_084 possession (Score: 0-0)
Klay Thompson makes the Dunk and draws the foul on Malcolm Herro! And-1! Klay Thompson to the line for 1. [Team fouls: 2] (Malcolm Herro: 1 personal fouls)   FT 1/1: GOOD Klay Thompson makes 1/1 from the line.
Score: 0-3

[10:36] Team_068 possession (Score: 0-3)
Nikola Ginobili makes the Layup and draws the foul on Giannis Quickley! And-1! Nikola Ginobili to the line for 1. [Team fouls: 1] (Giannis Quickley: 1 personal fouls)   FT 1/1: GOOD Nikola Ginobili makes 1/1 from the line.
Score: 3-3

[10:19] Team_084 possession (Score: 3-3)
Giannis Quickley commits a violation (traveling/carry)! TURNOVER! (dead ball)

[10:04] Team_068 possession (Score: 3-3)
Nikola Ginobili drives to the basket... Nikola Ginobili commits a violation (traveling/carry)! TURNOVER! (dead ball)

[09:51] Team_084 possession (Score: 3-3)
Dejounte Ginobili loses control! Ball rolls out of bounds! TURNOVER! (dead ball)

[09:40] Team_068 possession (Score: 3-3)
FOUL! Offensive foul on Jaren Johnson! Klay Thompson drew the charge! [Team fouls: 3] (Jaren Johnson: 1 personal fouls) TURNOVER! (dead ball)

[09:21] Team_084 possession (Score: 3-3)
Klay Thompson throws a bad pass out of bounds! TURNOVER! (dead ball)

[09:05] Team_068 possession (Score: 3-3)
Gary Simons makes the Layup and draws the foul on Giannis Quickley! And-1! Gary Simons to the line for 1. [Team fouls: 2] (Giannis Quickley: 2 personal fouls)   FT 1/1: GOOD Gary Simons makes 1/1 from the line.
Score: 6-3

[08:55] Team_084 possession (Score: 6-3)
Klay Thompson attempts a Layup. Contested by Gary Simons (2.1 feet, ZONE). Klay Thompson misses. FOUL! Loose ball foul on Jaren Johnson during the rebound battle. [Team fouls: 4] No free throws, side out. (Jaren Johnson: 2 personal fouls)

[08:41] Team_084 possession (Score: 6-3)
Jarrett Booker attempts a Midrange. Contested by Gary Simons (3.8 feet, MAN). JARRETT BOOKER MAKES IT!
Score: 6-5

[08:27] Team_068 possession (Score: 6-5)
Malcolm Herro attempts a Midrange. Wide open! Dejounte Ginobili is 6.3 feet away. [ZONE] MALCOLM HERRO MAKES IT! Assist: Gary Simons
Score: 8-5

[08:10] Team_084 possession (Score: 8-5)
FOUL! Shooting foul on Gary Simons. Jarrett Booker to the line for 2 free throws. [BONUS: 5 team fouls] (Gary Simons: 2 personal fouls)   FT 1/2: GOOD   FT 2/2: MISS Jarrett Booker makes 1/2 from the line. Rebound secured by Jaren Johnson.
Score: 8-6

[07:57] Team_068 possession (Score: 8-6)
Gary Simons attempts a Midrange. Wide open! Klay Thompson is 6.2 feet away. [ZONE] GARY SIMONS MAKES IT!
Score: 10-6

[07:43] Team_084 possession (Score: 10-6)
Luka Sexton attempts a 3Pt. Contested by Zion Anunoby (6.0 feet, ZONE). Luka Sexton misses. Rebound secured by Jaren Johnson.

[07:28] Team_068 possession (Score: 10-6)
Gary Simons attempts a 3Pt. Contested by Luka Sexton (5.4 feet, ZONE). GARY SIMONS MAKES IT! Assist: Nikola Ginobili
Score: 13-6

[07:09] Team_084 possession (Score: 13-6)
Dejounte Ginobili drives and kicks out. Giannis Quickley attempts a 3Pt. Wide open! Zion Anunoby is 8.1 feet away. [ZONE] Giannis Quickley misses. Offensive rebound by Giannis Quickley! Giannis Quickley puts it back in!
Score: 13-8

[06:55] Team_068 possession (Score: 13-8)
Gary Simons attempts a Midrange. Heavily contested by Jarrett Booker (0.5 feet, MAN)! Gary Simons misses. Rebound secured by Dejounte Ginobili.

[06:40] Team_084 possession (Score: 13-8)
Klay Thompson attempts a 3Pt. Contested by Zion Anunoby (5.7 feet, ZONE). Klay Thompson misses. Offensive rebound by Giannis Quickley! Giannis Quickley puts it back in!
Score: 13-10

[06:26] Team_068 possession (Score: 13-10)
Nikola Ginobili drives, Giannis Quickley stays with him. Nikola Ginobili attempts a Dunk. Heavily contested by Giannis Quickley (1.0 feet, MAN)! NIKOLA GINOBILI MAKES IT! Assist: Jaren Johnson
Score: 15-10

[06:16] Team_084 possession (Score: 15-10)
FOUL! Offensive foul on Luka Sexton! Zion Anunoby drew the charge! [Team fouls: 3] (Luka Sexton: 1 personal fouls) TURNOVER! (dead ball)

[06:02] Team_068 possession (Score: 15-10)
Zion Anunoby attempts a 3Pt. Contested by Luka Sexton (3.2 feet, ZONE). ZION ANUNOBY MAKES IT! Assist: Nikola Ginobili
Score: 18-10

[05:51] Team_084 possession (Score: 18-10)
Dejounte Ginobili attempts a Layup. Contested by Malcolm Herro (5.2 feet, MAN). Dejounte Ginobili misses. Rebound secured by Jaren Johnson.

[05:40] Team_068 possession (Score: 18-10)
Jaren Johnson attempts a 3Pt. Wide open! Klay Thompson is 7.1 feet away. [MAN] Jaren Johnson misses. Rebound secured by Dejounte Ginobili.

[05:22] Team_084 possession (Score: 18-10)
Dejounte Ginobili attempts a Layup. Contested by Malcolm Herro (3.8 feet, MAN). DEJOUNTE GINOBILI MAKES IT! Assist: Giannis Quickley
Score: 18-12

[05:08] Team_068 possession (Score: 18-12)
Jaren Johnson drives and kicks out. Nikola Ginobili attempts a 3Pt. Contested by Luka Sexton (4.6 feet, ZONE). Nikola Ginobili misses. Rebound secured by Klay Thompson.

[04:54] Team_084 possession (Score: 18-12)
Jarrett Booker drives, Gary Simons stays with him. Jarrett Booker attempts a Layup. Contested by Gary Simons (2.7 feet, ZONE). JARRETT BOOKER MAKES IT! Assist: Giannis Quickley
Score: 18-14

[04:37] Team_068 possession (Score: 18-14)
Jaren Johnson attempts a 3Pt. Contested by Luka Sexton (5.7 feet, ZONE). Jaren Johnson misses. Rebound secured by Klay Thompson.

[04:23] Team_084 possession (Score: 18-14)
Luka Sexton attempts a Midrange. Contested by Gary Simons (5.1 feet, ZONE). LUKA SEXTON MAKES IT! Assist: Giannis Quickley
Score: 18-16

[04:09] Team_068 possession (Score: 18-16)
Zion Anunoby attempts a Midrange. Contested by Luka Sexton (2.3 feet, MAN). Zion Anunoby misses. Rebound secured by Klay Thompson.

[03:57] Team_084 possession (Score: 18-16)
Klay Thompson drives, Nikola Ginobili stays with him. Klay Thompson attempts a Dunk. Contested by Nikola Ginobili (2.4 feet, ZONE). KLAY THOMPSON MAKES IT!
Score: 18-18

[03:45] Team_068 possession (Score: 18-18)
Malcolm Herro drives to the basket... Malcolm Herro loses the ball! Stripped by Dejounte Ginobili! TURNOVER! (live ball)

[03:29] Team_084 possession (Score: 18-18)
Klay Thompson attempts a 3Pt. Contested by Jaren Johnson (3.9 feet, MAN). Klay Thompson misses. Offensive rebound by Giannis Quickley! Giannis Quickley's putback is no good. Offensive rebound by Dejounte Ginobili! Dejounte Ginobili kicks it out.

[03:14] Team_084 possession (Score: 18-18)
Klay Thompson drives to the basket... Klay Thompson throws a bad pass out of bounds! TURNOVER! (dead ball)

[03:14] Substitution (Team_068): Nikola Ginobili OUT → Franz Curry IN (stamina_rule2)

[03:00] Team_068 possession (Score: 18-18)
Malcolm Herro attempts a 3Pt. Contested by Luka Sexton (5.1 feet, ZONE). Malcolm Herro misses. Rebound secured by Dejounte Ginobili.

[02:50] Team_084 possession (Score: 18-18)
Dejounte Ginobili attempts a 3Pt. Wide open! Malcolm Herro is 7.2 feet away. [MAN] DEJOUNTE GINOBILI MAKES IT! Assist: Klay Thompson
Score: 18-21

[02:34] Team_068 possession (Score: 18-21)
Gary Simons attempts a Midrange. Contested by Jarrett Booker (5.3 feet, MAN). Gary Simons misses. Rebound secured by Klay Thompson.

[02:20] Team_084 possession (Score: 18-21)
Dejounte Ginobili attempts a Midrange. Contested by Malcolm Herro (2.5 feet, MAN). Dejounte Ginobili misses. Rebound secured by Franz Curry.

[02:04] Team_068 possession (Score: 18-21)
Jaren Johnson attempts a 3Pt. Wide open! Klay Thompson is 9.7 feet away. [MAN] Jaren Johnson misses. Rebound secured by Klay Thompson.

[01:50] Team_084 possession (Score: 18-21)
Klay Thompson attempts a 3Pt. Contested by Zion Anunoby (5.2 feet, ZONE). Klay Thompson misses. Rebound secured by Franz Curry.

[01:36] Team_068 possession (Score: 18-21)
Zion Anunoby drives, picks up Luka Sexton. Help arrives from Dejounte Ginobili! Zion Anunoby attempts a Dunk. Heavily contested by Dejounte Ginobili (1.0 feet, MAN)! ZION ANUNOBY MAKES IT!
Score: 20-21

[01:17] Team_084 possession (Score: 20-21)
FOUL! Holding foul on Malcolm Herro. [IN THE BONUS! 6 team fouls] Dejounte Ginobili to the line for 2 free throws. (Malcolm Herro: 2 personal fouls)   FT 1/2: GOOD   FT 2/2: GOOD Dejounte Ginobili makes 2/2 from the line.
Score: 20-23

[01:04] Team_068 possession (Score: 20-23)
Franz Curry drives and kicks out. Jaren Johnson attempts a 3Pt. Wide open! Klay Thompson is 6.2 feet away. [MAN] JAREN JOHNSON MAKES IT! Assist: Gary Simons
Score: 23-23

[00:52] Team_084 possession (Score: 23-23)
Luka Sexton attempts a Midrange. Contested by Jaren Johnson (5.2 feet, ZONE). Luka Sexton misses. Offensive rebound by Giannis Quickley! Giannis Quickley puts it back in!
Score: 23-25

[00:36] Team_068 possession (Score: 23-25)
FOUL! Shooting foul on Jarrett Booker. Malcolm Herro to the line for 2 free throws. [Team fouls: 4] (Jarrett Booker: 1 personal fouls)   FT 1/2: GOOD   FT 2/2: GOOD Malcolm Herro makes 2/2 from the line.
Score: 25-25

[00:20] Team_084 possession (Score: 25-25)
Giannis Quickley makes the Midrange and draws the foul on Franz Curry! And-1! Giannis Quickley to the line for 1. [BONUS: 7 team fouls] (Franz Curry: 1 personal fouls)   FT 1/1: GOOD Giannis Quickley makes 1/1 from the line.
Score: 25-28

[00:06] Team_068 possession (Score: 25-28)
Zion Anunoby attempts a 3Pt. Wide open! Luka Sexton is 6.3 feet away. [MAN] Zion Anunoby misses. Rebound secured by Giannis Quickley.

================================================================================
                              1ST QUARTER COMPLETE                              
================================================================================

1ST QUARTER SCORE: Team_068 25, Team_084 28

BOX SCORE:
================================================================================

Team_068
--------------------------------------------------------------------------------
Player                MIN  PTS  REB  AST  TO      FG   FG%      3P   3P%
--------------------------------------------------------------------------------
Gary Simons            12    8    1    2   0   3/5    60.0     0/0   0.0
Zion Anunoby           12    5    0    0   0   2/5    40.0     0/0   0.0
Nikola Ginobili         9    5    0    2   0   2/2   100.0     0/0   0.0
Malcolm Herro          12    4    0    0   0   2/4    50.0     0/0   0.0
Jaren Johnson          12    3    3    1   0   1/5    20.0     0/0   0.0
Franz Curry             3    0    2    0   0   0/0     0.0     0/0   0.0

TEAM: FG: 10/21 (47.6%), 3PT: 2/8 (25.0%), REB: 6 (0 off, 6 def), AST: 5, TO: 4
TEAM FOULS: 7 [Team_084 in BONUS]


Team_084
--------------------------------------------------------------------------------
Player                MIN  PTS  REB  AST  TO      FG   FG%      3P   3P%
--------------------------------------------------------------------------------
Giannis Quickley       12    9    6    3   0   4/4   100.0     0/0   0.0
Dejounte Ginobili      12    7    5    0   0   3/6    50.0     0/0   0.0
Klay Thompson          12    5    5    1   0   2/3    66.7     0/0   0.0
Jarrett Booker         12    4    0    0   0   2/3    66.7     0/0   0.0
Luka Sexton            12    2    0    0   0   1/2    50.0     0/0   0.0

TEAM: FG: 12/18 (66.7%), 3PT: 2/5 (40.0%), REB: 16 (5 off, 11 def), AST: 4, TO: 6
TEAM FOULS: 4

================================================================================

================================================================================
                       2ND QUARTER - Team_068 vs Team_084                       
================================================================================

[12:00] Team_068 possession (Score: 25-28)
FOUL! Reach-in foul on Giannis Quickley during the drive. [Team fouls: 1] No free throws, side out. (Giannis Quickley: 1 personal fouls)

[11:51] Team_068 possession (Score: 25-28)
Nikola Ginobili drives, Giannis Quickley stays with him. Nikola Ginobili attempts a Dunk. Contested by Giannis Quickley (2.9 feet, MAN). NIKOLA GINOBILI MAKES IT! Assist: Jaren Johnson
Score: 27-28

[11:34] Team_084 possession (Score: 27-28)
Jarrett Booker attempts a Midrange. Contested by Gary Simons (4.9 feet, MAN). Jarrett Booker misses. Offensive rebound by Dejounte Ginobili! Dejounte Ginobili kicks it out.

[11:16] Team_084 possession (Score: 27-28)
Luka Sexton attempts a 3Pt. Wide open! Zion Anunoby is 6.4 feet away. [ZONE] LUKA SEXTON MAKES IT! Assist: Giannis Quickley
Score: 27-31

[11:04] Team_068 possession (Score: 27-31)
Jaren Johnson throws a bad pass out of bounds! TURNOVER! (dead ball)

[11:04] Substitution (Team_068): Zion Anunoby OUT → Cole Anthony IN (stamina_rule2)

[11:04] Substitution (Team_068): Malcolm Herro OUT → Ja Banchero IN (stamina_rule2)

[11:04] Substitution (Team_068): Jaren Johnson OUT → Miles Murray IN (stamina_rule2)

[11:04] Substitution (Team_068): Gary Simons OUT → Jarrett Oladipo IN (stamina_rule2)

[11:04] Substitution (Team_084): Luka Sexton OUT → Magic Bryant IN (stamina_rule2)

[11:04] Substitution (Team_084): Dejounte Ginobili OUT → Chris Parker IN (stamina_rule2)

[11:04] Substitution (Team_084): Klay Thompson OUT → Evan Quickley IN (stamina_rule2)

[11:04] Substitution (Team_084): Jarrett Booker OUT → Pascal Jackson IN (stamina_rule2)

[11:04] Substitution (Team_084): Giannis Quickley OUT → Dejounte Porzingis IN (stamina_rule2)

[10:49] Team_084 possession (Score: 27-31)
Dejounte Porzingis attempts a Midrange. Wide open! Miles Murray is 7.9 feet away. [ZONE] Dejounte Porzingis misses. Offensive rebound by Pascal Jackson! Pascal Jackson kicks it out.

[10:33] Team_084 possession (Score: 27-31)
Chris Parker attempts a 3Pt. Wide open! Ja Banchero is 7.2 feet away. [ZONE] Chris Parker misses. Rebound secured by Jarrett Oladipo.

[10:18] Team_068 possession (Score: 27-31)
Jarrett Oladipo attempts a 3Pt. Wide open! Pascal Jackson is 6.0 feet away. [MAN] JARRETT OLADIPO MAKES IT!
Score: 30-31

[10:01] Team_084 possession (Score: 30-31)
Magic Bryant attempts a 3Pt. Contested by Cole Anthony (4.6 feet, MAN). MAGIC BRYANT MAKES IT! Assist: Evan Quickley
Score: 30-34

[09:47] Team_068 possession (Score: 30-34)
Cole Anthony attempts a 3Pt. Contested by Magic Bryant (3.7 feet, MAN). COLE ANTHONY MAKES IT! Assist: Jarrett Oladipo
Score: 33-34

[09:33] Team_084 possession (Score: 33-34)
FOUL! Reach-in foul on Nikola Ginobili during the drive. [Team fouls: 1] No free throws, side out. (Nikola Ginobili: 1 personal fouls)

[09:19] Team_084 possession (Score: 33-34)
Dejounte Porzingis drives, picks up Nikola Ginobili. Help arrives from Ja Banchero! Dejounte Porzingis attempts a Dunk. Heavily contested by Ja Banchero (0.6 feet, ZONE)! DEJOUNTE PORZINGIS MAKES IT! Assist: Magic Bryant
Score: 33-36

[09:04] Team_068 possession (Score: 33-36)
Jarrett Oladipo drives, Dejounte Porzingis stays with him. Jarrett Oladipo attempts a Layup. Contested by Dejounte Porzingis (4.4 feet, ZONE). Jarrett Oladipo misses. FOUL! Loose ball foul on Dejounte Porzingis during the rebound battle. [Team fouls: 2] No free throws, side out. (Dejounte Porzingis: 1 personal fouls)

[08:53] Team_068 possession (Score: 33-36)
Ja Banchero attempts a 3Pt. Wide open! Chris Parker is 7.0 feet away. [MAN] JA BANCHERO MAKES IT! Assist: Jarrett Oladipo
Score: 36-36

[08:40] Team_084 possession (Score: 36-36)
Magic Bryant attempts a Midrange. Contested by Ja Banchero (6.0 feet, ZONE). MAGIC BRYANT MAKES IT!
Score: 36-38

[08:23] Team_068 possession (Score: 36-38)
Nikola Ginobili attempts a Layup. Heavily contested by Dejounte Porzingis (1.5 feet, ZONE)! Nikola Ginobili misses. Offensive rebound by Jarrett Oladipo! Jarrett Oladipo kicks it out.

[08:11] Team_068 possession (Score: 36-38)
Jarrett Oladipo commits a violation (traveling/carry)! TURNOVER! (dead ball)

[08:11] Substitution (Team_068): Nikola Ginobili OUT → Franz Curry IN (stamina_rule2)

[07:51] Team_084 possession (Score: 36-38)
FOUL! Reach-in foul on Franz Curry during the drive. [Team fouls: 2] No free throws, side out. (Franz Curry: 1 personal fouls)

[07:34] Team_084 possession (Score: 36-38)
Magic Bryant attempts a Midrange. Wide open! Cole Anthony is 6.7 feet away. [MAN] Magic Bryant misses. Rebound secured by Franz Curry.

[07:19] Team_068 possession (Score: 36-38)
Miles Murray drives, Dejounte Porzingis stays with him. Miles Murray attempts a Layup. Contested by Dejounte Porzingis (5.1 feet, ZONE). Miles Murray misses. Offensive rebound by Jarrett Oladipo! Jarrett Oladipo kicks it out.

[07:06] Team_068 possession (Score: 36-38)
Cole Anthony attempts a 3Pt. Contested by Magic Bryant (2.3 feet, ZONE). Cole Anthony misses. Rebound secured by Pascal Jackson.

[06:55] Team_084 possession (Score: 36-38)
Chris Parker attempts a 3Pt. Wide open! Ja Banchero is 6.8 feet away. [MAN] Chris Parker misses. Rebound secured by Ja Banchero.

[06:46] Team_068 possession (Score: 36-38)
Franz Curry makes the Layup and draws the foul on Dejounte Porzingis! And-1! Franz Curry to the line for 1. [Team fouls: 3] (Dejounte Porzingis: 2 personal fouls)   FT 1/1: GOOD Franz Curry makes 1/1 from the line.
Score: 39-38

[06:36] Team_084 possession (Score: 39-38)
Dejounte Porzingis throws a bad pass! Stolen by Franz Curry! TURNOVER! (live ball)

[06:26] Team_068 possession (Score: 39-38)
FOUL! Reach-in foul on Dejounte Porzingis during the drive. [Team fouls: 4] No free throws, side out. (Dejounte Porzingis: 3 personal fouls)

[06:14] Team_068 possession (Score: 39-38)
Franz Curry drives and kicks out. Cole Anthony attempts a Midrange. Contested by Magic Bryant (5.7 feet, ZONE). COLE ANTHONY MAKES IT!
Score: 41-38

[06:02] Team_084 possession (Score: 41-38)
Pascal Jackson attempts a 3Pt. Contested by Jarrett Oladipo (2.5 feet, MAN). Pascal Jackson misses. Rebound secured by Jarrett Oladipo.

[05:50] Team_068 possession (Score: 41-38)
Jarrett Oladipo loses the ball! Stripped by Pascal Jackson! TURNOVER! (live ball)

[05:33] Team_084 possession (Score: 41-38)
Evan Quickley drives, Franz Curry stays with him. Evan Quickley attempts a Dunk. Contested by Franz Curry (4.9 feet, ZONE). Evan Quickley misses. Rebound secured by Franz Curry.

[05:20] Team_068 possession (Score: 41-38)
FOUL! Shooting foul on Chris Parker. Ja Banchero to the line for 2 free throws. [BONUS: 5 team fouls] (Chris Parker: 1 personal fouls)   FT 1/2: GOOD   FT 2/2: MISS Ja Banchero makes 1/2 from the line. Offensive rebound by Franz Curry! Franz Curry's putback is no good.
Score: 42-38

[05:08] Team_084 possession (Score: 42-38)
Chris Parker attempts a Midrange. Contested by Ja Banchero (3.4 feet, MAN). CHRIS PARKER MAKES IT!
Score: 42-40

[04:56] Team_068 possession (Score: 42-40)
Miles Murray attempts a Layup. Contested by Evan Quickley (4.1 feet, MAN). Miles Murray misses. Rebound secured by Evan Quickley.

[04:42] Team_084 possession (Score: 42-40)
Chris Parker attempts a 3Pt. Wide open! Ja Banchero is 7.4 feet away. [MAN] Chris Parker misses. Rebound secured by Ja Banchero.

[04:30] Team_068 possession (Score: 42-40)
Cole Anthony attempts a 3Pt. Heavily contested by Magic Bryant (1.5 feet, MAN)! Cole Anthony misses. Rebound secured by Pascal Jackson.

[04:16] Team_084 possession (Score: 42-40)
Magic Bryant drives, Cole Anthony stays with him. Magic Bryant attempts a Layup. Contested by Cole Anthony (5.4 feet, MAN). MAGIC BRYANT MAKES IT! Assist: Evan Quickley
Score: 42-42

[03:57] Team_068 possession (Score: 42-42)
Franz Curry attempts a Midrange. Contested by Dejounte Porzingis (5.2 feet, MAN). Franz Curry misses. Rebound secured by Dejounte Porzingis.

[03:43] Team_084 possession (Score: 42-42)
Chris Parker drives, Ja Banchero stays with him. Chris Parker attempts a Dunk. Contested by Ja Banchero (4.2 feet, MAN). CHRIS PARKER MAKES IT! Assist: Evan Quickley
Score: 42-44

[03:31] Team_068 possession (Score: 42-44)
Miles Murray attempts a 3Pt. Contested by Magic Bryant (5.1 feet, ZONE). MILES MURRAY MAKES IT! Assist: Franz Curry
Score: 45-44

[03:21] Team_084 possession (Score: 45-44)
Dejounte Porzingis drives, Franz Curry stays with him. Dejounte Porzingis attempts a Layup. Contested by Franz Curry (3.2 feet, MAN). DEJOUNTE PORZINGIS MAKES IT! Assist: Pascal Jackson
Score: 45-46

[03:07] Team_068 possession (Score: 45-46)
Jarrett Oladipo drives, Dejounte Porzingis stays with him. Jarrett Oladipo attempts a Dunk. Contested by Dejounte Porzingis (2.2 feet, ZONE). JARRETT OLADIPO MAKES IT! Assist: Franz Curry
Score: 47-46

[02:53] Team_084 possession (Score: 47-46)
Evan Quickley attempts a Midrange. Contested by Miles Murray (2.0 feet, MAN). EVAN QUICKLEY MAKES IT!
Score: 47-48

[02:40] Team_068 possession (Score: 47-48)
Franz Curry drives, picks up Dejounte Porzingis. Help arrives from Magic Bryant! Franz Curry attempts a Dunk. Contested by Magic Bryant (4.5 feet, ZONE). FRANZ CURRY MAKES IT!
Score: 49-48

[02:25] Team_084 possession (Score: 49-48)
FOUL! Shooting foul on Ja Banchero. Chris Parker to the line for 2 free throws. [Team fouls: 3] (Ja Banchero: 1 personal fouls)   FT 1/2: GOOD   FT 2/2: GOOD Chris Parker makes 2/2 from the line.
Score: 49-50

[02:11] Team_068 possession (Score: 49-50)
Franz Curry attempts a 3Pt. Contested by Magic Bryant (4.8 feet, ZONE). FRANZ CURRY MAKES IT!
Score: 52-50

[01:54] Team_084 possession (Score: 52-50)
Chris Parker attempts a 3Pt. Wide open! Ja Banchero is 6.3 feet away. [ZONE] Chris Parker misses. Rebound secured by Ja Banchero.

[01:40] Team_068 possession (Score: 52-50)
Cole Anthony attempts a Layup. Heavily contested by Magic Bryant (0.5 feet, MAN)! Cole Anthony misses. Rebound secured by Evan Quickley.

[01:26] Team_084 possession (Score: 52-50)
Pascal Jackson attempts a Layup. BLOCKED BY FRANZ CURRY! Ball deflects out of bounds off Pascal Jackson.

[01:13] Team_068 possession (Score: 52-50)
Jarrett Oladipo attempts a 3Pt. Contested by Pascal Jackson (5.9 feet, MAN). Jarrett Oladipo misses. Rebound secured by Pascal Jackson.

[00:56] Team_084 possession (Score: 52-50)
Evan Quickley attempts a Layup. BLOCKED BY FRANZ CURRY! Ball is loose! Rebound secured by Ja Banchero.

[00:45] Team_068 possession (Score: 52-50)
Jarrett Oladipo attempts a Layup. Contested by Pascal Jackson (4.2 feet, MAN). JARRETT OLADIPO MAKES IT! Assist: Cole Anthony
Score: 54-50

[00:29] Team_084 possession (Score: 54-50)
Magic Bryant attempts a 3Pt. Contested by Cole Anthony (3.8 feet, ZONE). Magic Bryant misses. Rebound secured by Jarrett Oladipo.

[00:15] Team_068 possession (Score: 54-50)
Franz Curry loses control! Ball rolls out of bounds! TURNOVER! (dead ball)

[00:03] Team_084 possession (Score: 54-50)
FOUL! Shooting foul on Jarrett Oladipo. Pascal Jackson to the line for 2 free throws. [Team fouls: 4] (Jarrett Oladipo: 1 personal fouls)   FT 1/2: GOOD   FT 2/2: GOOD Pascal Jackson makes 2/2 from the line.
Score: 54-52

================================================================================
                              2ND QUARTER COMPLETE                              
================================================================================

2ND QUARTER SCORE: Team_068 29, Team_084 24

BOX SCORE:
================================================================================

Team_068
--------------------------------------------------------------------------------
Player                MIN  PTS  REB  AST  TO      FG   FG%      3P   3P%
--------------------------------------------------------------------------------
Franz Curry            11    8    3    2   0   3/4    75.0     0/0   0.0
Jarrett Oladipo        11    7    5    2   0   3/4    75.0     0/0   0.0
Cole Anthony           11    5    0    1   0   2/5    40.0     0/0   0.0
Ja Banchero            11    3    4    0   0   1/2    50.0     0/0   0.0
Miles Murray           11    3    0    0   0   1/2    50.0     0/0   0.0
Nikola Ginobili        13    2    1    0   0   1/1   100.0     0/0   0.0
Jaren Johnson          13    0    0    1   0   0/0     0.0     0/0   0.0

TEAM: FG: 11/18 (61.1%), 3PT: 5/8 (62.5%), REB: 12 (3 off, 9 def), AST: 6, TO: 4
TEAM FOULS: 4


Team_084
--------------------------------------------------------------------------------
Player                MIN  PTS  REB  AST  TO      FG   FG%      3P   3P%
--------------------------------------------------------------------------------
Magic Bryant           11    7    0    1   0   3/5    60.0     0/0   0.0
Chris Parker           11    6    0    0   0   3/7    42.9     0/0   0.0
Dejounte Porzingis     11    4    1    0   0   2/2   100.0     0/0   0.0
Luka Sexton            13    3    0    0   0   1/1   100.0     0/0   0.0
Pascal Jackson         11    2    4    1   0   1/3    33.3     0/0   0.0
Evan Quickley          11    2    2    3   0   1/3    33.3     0/0   0.0
Dejounte Ginobili      13    0    1    0   0   0/0     0.0     0/0   0.0
Giannis Quickley       13    0    0    1   0   0/0     0.0     0/0   0.0

TEAM: FG: 11/21 (52.4%), 3PT: 2/8 (25.0%), REB: 9 (2 off, 7 def), AST: 6, TO: 1
TEAM FOULS: 5 [Team_068 in BONUS]

================================================================================

================================================================================
                       3RD QUARTER - Team_068 vs Team_084                       
================================================================================

[12:00] Team_068 possession (Score: 54-52)
FOUL! Reach-in foul on Giannis Quickley during the drive. [Team fouls: 1] No free throws, side out. (Giannis Quickley: 1 personal fouls)

[11:48] Team_068 possession (Score: 54-52)
Jaren Johnson attempts a 3Pt. Contested by Klay Thompson (3.2 feet, MAN). JAREN JOHNSON MAKES IT! Assist: Zion Anunoby
Score: 57-52

[11:33] Team_084 possession (Score: 57-52)
Luka Sexton attempts a 3Pt. Wide open! Zion Anunoby is 9.2 feet away. [MAN] LUKA SEXTON MAKES IT! Assist: Giannis Quickley
Score: 57-55

[11:17] Team_068 possession (Score: 57-55)
Nikola Ginobili loses control! Ball rolls out of bounds! TURNOVER! (dead ball)

[11:06] Team_084 possession (Score: 57-55)
Dejounte Ginobili attempts a 3Pt. Contested by Zion Anunoby (3.0 feet, ZONE). Dejounte Ginobili misses. Rebound secured by Jaren Johnson.

[10:51] Team_068 possession (Score: 57-55)
FOUL! Shooting foul on Luka Sexton. Jaren Johnson to the line for 3 free throws. [Team fouls: 2] (Luka Sexton: 1 personal fouls)   FT 1/3: GOOD   FT 2/3: GOOD   FT 3/3: MISS Jaren Johnson makes 2/3 from the line. Rebound secured by Giannis Quickley.
Score: 59-55

[10:35] Team_084 possession (Score: 59-55)
Klay Thompson attempts a 3Pt. Contested by Zion Anunoby (3.8 feet, ZONE). Klay Thompson misses. Offensive rebound by Giannis Quickley! Giannis Quickley puts it back in!
Score: 59-57

[10:19] Team_068 possession (Score: 59-57)
Gary Simons drives and kicks out. Jaren Johnson attempts a Midrange. Wide open! Klay Thompson is 6.8 feet away. [ZONE] JAREN JOHNSON MAKES IT!
Score: 61-57

[10:09] Team_084 possession (Score: 61-57)
Dejounte Ginobili attempts a 3Pt. Wide open! Malcolm Herro is 7.9 feet away. [MAN] Dejounte Ginobili misses. Rebound secured by Nikola Ginobili.

[09:56] Team_068 possession (Score: 61-57)
FOUL! Reach-in foul on Giannis Quickley during the drive. [Team fouls: 3] No free throws, side out. (Giannis Quickley: 2 personal fouls)

[09:42] Team_068 possession (Score: 61-57)
Gary Simons drives, Giannis Quickley stays with him. Gary Simons attempts a Dunk. Contested by Giannis Quickley (5.7 feet, ZONE). GARY SIMONS MAKES IT! Assist: Nikola Ginobili
Score: 63-57

[09:25] Team_084 possession (Score: 63-57)
Luka Sexton drives and kicks out. Giannis Quickley attempts a 3Pt. Contested by Jaren Johnson (2.6 feet, ZONE). Giannis Quickley misses. Rebound secured by Nikola Ginobili.

[09:13] Team_068 possession (Score: 63-57)
Gary Simons attempts a Midrange. Wide open! Jarrett Booker is 6.0 feet away. [MAN] Gary Simons misses. Rebound secured by Giannis Quickley.

[08:58] Team_084 possession (Score: 63-57)
Luka Sexton drives, picks up Zion Anunoby. Help arrives from Jaren Johnson! Luka Sexton attempts a Layup. Contested by Jaren Johnson (3.0 feet, MAN). LUKA SEXTON MAKES IT!
Score: 63-59

[08:44] Team_068 possession (Score: 63-59)
Nikola Ginobili makes the Layup and draws the foul on Giannis Quickley! And-1! Nikola Ginobili to the line for 1. [Team fouls: 4] (Giannis Quickley: 3 personal fouls)   FT 1/1: GOOD Nikola Ginobili makes 1/1 from the line.
Score: 66-59

[08:30] Team_084 possession (Score: 66-59)
Dejounte Ginobili attempts a 3Pt. Heavily contested by Zion Anunoby (1.3 feet, ZONE)! Dejounte Ginobili misses. Rebound secured by Gary Simons.

[08:17] Team_068 possession (Score: 66-59)
Gary Simons makes the Dunk and draws the foul on Jarrett Booker! And-1! Gary Simons to the line for 1. [BONUS: 5 team fouls] (Jarrett Booker: 1 personal fouls)   FT 1/1: GOOD Gary Simons makes 1/1 from the line.
Score: 69-59

[07:57] Team_084 possession (Score: 69-59)
FOUL! Shooting foul on Gary Simons. Jarrett Booker to the line for 2 free throws. [Team fouls: 1] (Gary Simons: 1 personal fouls)   FT 1/2: MISS   FT 2/2: GOOD Jarrett Booker makes 1/2 from the line.
Score: 69-60

[07:45] Team_068 possession (Score: 69-60)
Malcolm Herro drives and kicks out. Nikola Ginobili attempts a 3Pt. Contested by Giannis Quickley (3.8 feet, MAN). Nikola Ginobili misses. Rebound secured by Dejounte Ginobili.

[07:28] Team_084 possession (Score: 69-60)
Luka Sexton drives and kicks out. Klay Thompson attempts a Midrange. Contested by Jaren Johnson (5.2 feet, MAN). Klay Thompson misses. Rebound secured by Nikola Ginobili.

[07:14] Team_068 possession (Score: 69-60)
Nikola Ginobili attempts a 3Pt. Wide open! Klay Thompson is 8.3 feet away. [ZONE] NIKOLA GINOBILI MAKES IT! Assist: Malcolm Herro
Score: 72-60

[07:01] Team_084 possession (Score: 72-60)
Giannis Quickley attempts a Midrange. Contested by Nikola Ginobili (5.0 feet, MAN). GIANNIS QUICKLEY MAKES IT! Assist: Luka Sexton
Score: 72-62

[06:47] Team_068 possession (Score: 72-62)
Zion Anunoby attempts a 3Pt. Wide open! Dejounte Ginobili is 7.5 feet away. [ZONE] ZION ANUNOBY MAKES IT! Assist: Jaren Johnson
Score: 75-62

[06:30] Team_084 possession (Score: 75-62)
Jarrett Booker loses the ball! Stripped by Gary Simons! TURNOVER! (live ball)

[06:14] Team_068 possession (Score: 75-62)
Gary Simons attempts a 3Pt. Contested by Jarrett Booker (5.4 feet, MAN). GARY SIMONS MAKES IT! Assist: Zion Anunoby
Score: 78-62

[06:03] Team_084 possession (Score: 78-62)
Klay Thompson drives, picks up Gary Simons. Help arrives from Malcolm Herro! Klay Thompson attempts a Layup. Contested by Malcolm Herro (5.9 feet, ZONE). KLAY THOMPSON MAKES IT! Assist: Giannis Quickley
Score: 78-64

[05:47] Team_068 possession (Score: 78-64)
Malcolm Herro drives, Giannis Quickley stays with him. Malcolm Herro attempts a Dunk. Contested by Giannis Quickley (3.9 feet, ZONE). MALCOLM HERRO MAKES IT! Assist: Zion Anunoby
Score: 80-64

[05:36] Team_084 possession (Score: 80-64)
Klay Thompson attempts a Midrange. Contested by Jaren Johnson (3.2 feet, MAN). Klay Thompson misses. Offensive rebound by Dejounte Ginobili! Dejounte Ginobili kicks it out.

[05:22] Team_084 possession (Score: 80-64)
Luka Sexton attempts a Layup. Contested by Zion Anunoby (2.8 feet, MAN). Luka Sexton misses. Rebound secured by Gary Simons.

[05:06] Team_068 possession (Score: 80-64)
Zion Anunoby attempts a Layup. Heavily contested by Luka Sexton (1.9 feet, MAN)! ZION ANUNOBY MAKES IT! Assist: Jaren Johnson
Score: 82-64

[04:49] Team_084 possession (Score: 82-64)
Klay Thompson attempts a Midrange. Heavily contested by Gary Simons (1.3 feet, ZONE)! KLAY THOMPSON MAKES IT!
Score: 82-66

[04:33] Team_068 possession (Score: 82-66)
Gary Simons attempts a 3Pt. Wide open! Jarrett Booker is 7.0 feet away. [MAN] Gary Simons misses. Rebound secured by Giannis Quickley.

[04:23] Team_084 possession (Score: 82-66)
Jarrett Booker drives to the basket... Jarrett Booker throws a bad pass! Stolen by Gary Simons! TURNOVER! (live ball)

[04:09] Team_068 possession (Score: 82-66)
Zion Anunoby attempts a Midrange. Contested by Luka Sexton (3.4 feet, MAN). Zion Anunoby misses. Offensive rebound by Nikola Ginobili! Nikola Ginobili puts it back in!
Score: 84-66

[04:00] Team_084 possession (Score: 84-66)
Jarrett Booker makes the Midrange and draws the foul on Gary Simons! And-1! Jarrett Booker to the line for 1. [Team fouls: 2] (Gary Simons: 2 personal fouls)   FT 1/1: GOOD Jarrett Booker makes 1/1 from the line.
Score: 84-69

[03:46] Team_068 possession (Score: 84-69)
Gary Simons drives, picks up Jarrett Booker. Help arrives from Dejounte Ginobili! Gary Simons attempts a Layup. Contested by Dejounte Ginobili (2.4 feet, MAN). GARY SIMONS MAKES IT!
Score: 86-69

[03:32] Team_084 possession (Score: 86-69)
Dejounte Ginobili attempts a 3Pt. Contested by Zion Anunoby (5.0 feet, ZONE). Dejounte Ginobili misses. Rebound secured by Jaren Johnson.

[03:19] Team_068 possession (Score: 86-69)
Gary Simons attempts a Midrange. Wide open! Dejounte Ginobili is 6.0 feet away. [ZONE] GARY SIMONS MAKES IT!
Score: 88-69

[03:02] Team_084 possession (Score: 88-69)
Dejounte Ginobili attempts a 3Pt. Contested by Jaren Johnson (2.8 feet, ZONE). Dejounte Ginobili misses. Offensive rebound by Dejounte Ginobili! Dejounte Ginobili kicks it out.

[02:45] Team_084 possession (Score: 88-69)
Giannis Quickley attempts a Midrange. Contested by Nikola Ginobili (3.6 feet, MAN). Giannis Quickley misses. Rebound secured by Jaren Johnson.

[02:33] Team_068 possession (Score: 88-69)
Malcolm Herro attempts a Layup. Wide open! Dejounte Ginobili is 6.5 feet away. [MAN] MALCOLM HERRO MAKES IT! Assist: Gary Simons
Score: 90-69

[02:16] Team_084 possession (Score: 90-69)
Jarrett Booker drives, Gary Simons stays with him. Jarrett Booker attempts a Layup. Heavily contested by Gary Simons (1.7 feet, MAN)! Jarrett Booker misses. Rebound secured by Nikola Ginobili.

[02:02] Team_068 possession (Score: 90-69)
FOUL! Shooting foul on Luka Sexton. Zion Anunoby to the line for 2 free throws. [BONUS: 6 team fouls] (Luka Sexton: 2 personal fouls)   FT 1/2: GOOD   FT 2/2: GOOD Zion Anunoby makes 2/2 from the line.
Score: 92-69

[01:46] Team_084 possession (Score: 92-69)
Giannis Quickley attempts a 3Pt. Wide open! Nikola Ginobili is 7.2 feet away. [MAN] Giannis Quickley misses. Rebound secured by Gary Simons.

[01:32] Team_068 possession (Score: 92-69)
Jaren Johnson attempts a Midrange. Wide open! Klay Thompson is 6.8 feet away. [MAN] JAREN JOHNSON MAKES IT!
Score: 94-69

[01:15] Team_084 possession (Score: 94-69)
Klay Thompson attempts a Midrange. Wide open! Malcolm Herro is 8.0 feet away. [ZONE] KLAY THOMPSON MAKES IT!
Score: 94-71

[01:03] Team_068 possession (Score: 94-71)
Malcolm Herro throws a bad pass out of bounds! TURNOVER! (dead ball)

[01:03] Substitution (Team_068): Zion Anunoby OUT → Cole Anthony IN (stamina_rule2)

[01:03] Substitution (Team_068): Malcolm Herro OUT → Ja Banchero IN (stamina_rule2)

[01:03] Substitution (Team_068): Jaren Johnson OUT → Miles Murray IN (stamina_rule2)

[01:03] Substitution (Team_068): Gary Simons OUT → Jarrett Oladipo IN (stamina_rule2)

[01:03] Substitution (Team_068): Nikola Ginobili OUT → Franz Curry IN (stamina_rule2)

[01:03] Substitution (Team_084): Luka Sexton OUT → Magic Bryant IN (stamina_rule2)

[01:03] Substitution (Team_084): Dejounte Ginobili OUT → Chris Parker IN (stamina_rule2)

[01:03] Substitution (Team_084): Klay Thompson OUT → Evan Quickley IN (stamina_rule2)

[01:03] Substitution (Team_084): Jarrett Booker OUT → Pascal Jackson IN (stamina_rule2)

[01:03] Substitution (Team_084): Giannis Quickley OUT → Dejounte Porzingis IN (stamina_rule2)

[00:53] Team_084 possession (Score: 94-71)
Chris Parker drives, picks up Franz Curry. Help arrives from Ja Banchero! Chris Parker attempts a Layup. Contested by Ja Banchero (2.6 feet, ZONE). Chris Parker misses. Offensive rebound by Pascal Jackson! Pascal Jackson kicks it out.

[00:39] Team_084 possession (Score: 94-71)
Magic Bryant makes the Layup and draws the foul on Franz Curry! And-1! Magic Bryant to the line for 1. [Team fouls: 3] (Franz Curry: 1 personal fouls)   FT 1/1: GOOD Magic Bryant makes 1/1 from the line.
Score: 94-74

[00:29] Team_068 possession (Score: 94-74)
Franz Curry drives, Dejounte Porzingis stays with him. Franz Curry attempts a Dunk. Wide open! Dejounte Porzingis is 6.5 feet away. [MAN] FRANZ CURRY MAKES IT!
Score: 96-74

[00:16] Team_084 possession (Score: 96-74)
Pascal Jackson makes the Layup and draws the foul on Jarrett Oladipo! And-1! Pascal Jackson to the line for 1. [Team fouls: 4] (Jarrett Oladipo: 1 personal fouls)   FT 1/1: GOOD Pascal Jackson makes 1/1 from the line.
Score: 96-77

[00:05] Team_068 possession (Score: 96-77)
Cole Anthony attempts a Midrange. Heavily contested by Magic Bryant (1.0 feet, MAN)! COLE ANTHONY MAKES IT!
Score: 98-77

================================================================================
                              3RD QUARTER COMPLETE                              
================================================================================

3RD QUARTER SCORE: Team_068 44, Team_084 25

BOX SCORE:
================================================================================

Team_068
--------------------------------------------------------------------------------
Player                MIN  PTS  REB  AST  TO      FG   FG%      3P   3P%
--------------------------------------------------------------------------------
Gary Simons            24   12    3    1   0   5/7    71.4     0/0   0.0
Nikola Ginobili        24    8    5    1   0   3/3   100.0     0/0   0.0
Jaren Johnson          24    7    3    2   0   3/4    75.0     0/0   0.0
Zion Anunoby           24    7    0    3   0   3/3   100.0     0/0   0.0
Malcolm Herro          24    4    0    1   0   2/3    66.7     0/0   0.0
Franz Curry            12    2    0    0   0   1/1   100.0     0/0   0.0
Cole Anthony           12    2    0    0   0   1/1   100.0     0/0   0.0

TEAM: FG: 18/22 (81.8%), 3PT: 4/6 (66.7%), REB: 11 (1 off, 10 def), AST: 8, TO: 2
TEAM FOULS: 4


Team_084
--------------------------------------------------------------------------------
Player                MIN  PTS  REB  AST  TO      FG   FG%      3P   3P%
--------------------------------------------------------------------------------
Klay Thompson          24    6    0    0   0   3/3   100.0     0/0   0.0
Luka Sexton            24    5    0    1   0   2/5    40.0     0/0   0.0
Giannis Quickley       24    4    4    2   0   2/4    50.0     0/0   0.0
Jarrett Booker         24    4    0    0   0   2/3    66.7     0/0   0.0
Pascal Jackson         12    3    1    0   0   1/1   100.0     0/0   0.0
Magic Bryant           12    3    0    0   0   1/1   100.0     0/0   0.0
Dejounte Ginobili      24    0    3    0   0   0/4     0.0     0/0   0.0

TEAM: FG: 11/21 (52.4%), 3PT: 2/7 (28.6%), REB: 8 (4 off, 4 def), AST: 3, TO: 2
TEAM FOULS: 6 [Team_068 in BONUS]

================================================================================

================================================================================
                       4TH QUARTER - Team_068 vs Team_084                       
================================================================================

[12:00] Team_068 possession (Score: 98-77)
Zion Anunoby attempts a 3Pt. Contested by Luka Sexton (4.6 feet, ZONE). ZION ANUNOBY MAKES IT! Assist: Jaren Johnson
Score: 101-77

[11:44] Team_084 possession (Score: 101-77)
FOUL! Reach-in foul on Nikola Ginobili during the drive. [Team fouls: 1] No free throws, side out. (Nikola Ginobili: 1 personal fouls)

[11:28] Team_084 possession (Score: 101-77)
Luka Sexton drives and kicks out. Jarrett Booker attempts a Midrange. Wide open! Gary Simons is 6.1 feet away. [ZONE] Jarrett Booker misses. Rebound secured by Jaren Johnson.

[11:16] Team_068 possession (Score: 101-77)
Jaren Johnson attempts a 3Pt. Wide open! Jarrett Booker is 7.2 feet away. [ZONE] Jaren Johnson misses. Rebound secured by Klay Thompson.

[11:02] Team_084 possession (Score: 101-77)
Luka Sexton attempts a 3Pt. Contested by Zion Anunoby (5.3 feet, MAN). Luka Sexton misses. Rebound secured by Jaren Johnson.

[10:51] Team_068 possession (Score: 101-77)
Gary Simons attempts a Midrange. Wide open! Jarrett Booker is 9.2 feet away. [ZONE] Gary Simons misses. Rebound secured by Dejounte Ginobili.

[10:32] Team_084 possession (Score: 101-77)
Jarrett Booker drives to the basket... Jarrett Booker loses the ball! Stripped by Gary Simons! TURNOVER! (live ball)

[10:17] Team_068 possession (Score: 101-77)
Nikola Ginobili drives to the basket... FOUL! Offensive foul on Nikola Ginobili! Jarrett Booker drew the charge! [Team fouls: 2] (Nikola Ginobili: 2 personal fouls) TURNOVER! (dead ball)

[10:01] Team_084 possession (Score: 101-77)
Klay Thompson attempts a 3Pt. Contested by Jaren Johnson (4.2 feet, MAN). Klay Thompson misses. Rebound secured by Nikola Ginobili.

[09:48] Team_068 possession (Score: 101-77)
Malcolm Herro attempts a Midrange. Wide open! Dejounte Ginobili is 6.2 feet away. [MAN] Malcolm Herro misses. Rebound secured by Klay Thompson.

[09:34] Team_084 possession (Score: 101-77)
Klay Thompson attempts a Midrange. Contested by Jaren Johnson (3.9 feet, MAN). Klay Thompson misses. Rebound secured by Jaren Johnson.

[09:25] Team_068 possession (Score: 101-77)
FOUL! Reach-in foul on Giannis Quickley during the drive. [Team fouls: 1] No free throws, side out. (Giannis Quickley: 1 personal fouls)

[09:14] Team_068 possession (Score: 101-77)
FOUL! Holding foul on Klay Thompson. [Team fouls: 2] No free throws, side out. (Klay Thompson: 1 personal fouls)

[09:02] Team_068 possession (Score: 101-77)
Malcolm Herro attempts a 3Pt. Contested by Dejounte Ginobili (5.8 feet, MAN). Malcolm Herro misses. Rebound secured by Dejounte Ginobili.

[08:48] Team_084 possession (Score: 101-77)
Jarrett Booker attempts a Midrange. Wide open! Zion Anunoby is 6.4 feet away. [ZONE] JARRETT BOOKER MAKES IT! Assist: Dejounte Ginobili
Score: 101-79

[08:34] Team_068 possession (Score: 101-79)
Jaren Johnson attempts a 3Pt. Contested by Klay Thompson (5.5 feet, MAN). Jaren Johnson misses. Offensive rebound by Jaren Johnson! Jaren Johnson kicks it out.

[08:20] Team_068 possession (Score: 101-79)
Gary Simons drives, picks up Giannis Quickley. Help arrives from Dejounte Ginobili! Gary Simons attempts a Dunk. Contested by Dejounte Ginobili (4.5 feet, ZONE). GARY SIMONS MAKES IT! Assist: Jaren Johnson
Score: 103-79

[08:04] Team_084 possession (Score: 103-79)
Dejounte Ginobili attempts a Midrange. BLOCKED BY GARY SIMONS! Ball is loose! Offensive rebound by Dejounte Ginobili! Dejounte Ginobili kicks it out.

[07:46] Team_084 possession (Score: 103-79)
Klay Thompson attempts a Layup. BLOCKED BY MALCOLM HERRO! Ball is loose! Rebound secured by Jaren Johnson.

[07:34] Team_068 possession (Score: 103-79)
FOUL! Reach-in foul on Dejounte Ginobili during the drive. [Team fouls: 3] No free throws, side out. (Dejounte Ginobili: 1 personal fouls)

[07:23] Team_068 possession (Score: 103-79)
Zion Anunoby makes the Midrange and draws the foul on Klay Thompson! And-1! Zion Anunoby to the line for 1. [Team fouls: 4] (Klay Thompson: 2 personal fouls)   FT 1/1: GOOD Zion Anunoby makes 1/1 from the line.
Score: 106-79

[07:14] Team_084 possession (Score: 106-79)
Dejounte Ginobili drives and kicks out. Luka Sexton attempts a 3Pt. Wide open! Zion Anunoby is 6.8 feet away. [MAN] LUKA SEXTON MAKES IT!
Score: 106-82

[07:04] Team_068 possession (Score: 106-82)
Gary Simons attempts a 3Pt. Wide open! Luka Sexton is 7.5 feet away. [ZONE] Gary Simons misses. FOUL! Loose ball foul on Dejounte Ginobili during the rebound battle. [IN THE BONUS! 5 team fouls] Jaren Johnson to the line for 2 free throws. (Dejounte Ginobili: 2 personal fouls)   FT 1/2: MISS   FT 2/2: GOOD Jaren Johnson makes 1/2 from the line.
Score: 107-82

[06:46] Team_084 possession (Score: 107-82)
Luka Sexton attempts a 3Pt. Wide open! Zion Anunoby is 8.5 feet away. [ZONE] LUKA SEXTON MAKES IT! Assist: Jarrett Booker
Score: 107-85

[06:33] Team_068 possession (Score: 107-85)
Gary Simons attempts a 3Pt. Wide open! Luka Sexton is 6.2 feet away. [ZONE] Gary Simons misses. FOUL! Loose ball foul on Klay Thompson during the rebound battle. [IN THE BONUS! 6 team fouls] Jaren Johnson to the line for 2 free throws. (Klay Thompson: 3 personal fouls)   FT 1/2: GOOD   FT 2/2: GOOD Jaren Johnson makes 2/2 from the line.
Score: 109-85

[06:18] Team_084 possession (Score: 109-85)
Giannis Quickley attempts a 3Pt. Contested by Gary Simons (5.3 feet, ZONE). Giannis Quickley misses. Rebound secured by Nikola Ginobili.

[06:06] Team_068 possession (Score: 109-85)
Malcolm Herro attempts a 3Pt. Contested by Luka Sexton (3.2 feet, ZONE). Malcolm Herro misses. Rebound secured by Giannis Quickley.

[05:48] Team_084 possession (Score: 109-85)
Luka Sexton attempts a 3Pt. Contested by Zion Anunoby (2.0 feet, ZONE). Luka Sexton misses. Offensive rebound by Dejounte Ginobili! Dejounte Ginobili kicks it out.

[05:30] Team_084 possession (Score: 109-85)
Dejounte Ginobili attempts a 3Pt. Wide open! Malcolm Herro is 8.3 feet away. [MAN] Dejounte Ginobili misses. Offensive rebound by Giannis Quickley! Giannis Quickley puts it back in!
Score: 109-87

[05:14] Team_068 possession (Score: 109-87)
Malcolm Herro attempts a 3Pt. Contested by Dejounte Ginobili (4.2 feet, MAN). Malcolm Herro misses. Offensive rebound by Jaren Johnson! Jaren Johnson kicks it out.

[05:01] Team_068 possession (Score: 109-87)
Nikola Ginobili throws a bad pass out of bounds! TURNOVER! (dead ball)

[05:01] Substitution (Team_068): Zion Anunoby OUT → Cole Anthony IN (stamina_rule2)

[05:01] Substitution (Team_068): Malcolm Herro OUT → Ja Banchero IN (stamina_rule2)

[05:01] Substitution (Team_068): Jaren Johnson OUT → Miles Murray IN (stamina_rule2)

[05:01] Substitution (Team_068): Gary Simons OUT → Jarrett Oladipo IN (stamina_rule2)

[05:01] Substitution (Team_068): Nikola Ginobili OUT → Franz Curry IN (stamina_rule2)

[05:01] Substitution (Team_084): Luka Sexton OUT → Magic Bryant IN (stamina_rule2)

[05:01] Substitution (Team_084): Dejounte Ginobili OUT → Chris Parker IN (stamina_rule2)

[05:01] Substitution (Team_084): Klay Thompson OUT → Evan Quickley IN (stamina_rule2)

[05:01] Substitution (Team_084): Jarrett Booker OUT → Pascal Jackson IN (stamina_rule2)

[05:01] Substitution (Team_084): Giannis Quickley OUT → Dejounte Porzingis IN (stamina_rule2)

[04:47] Team_084 possession (Score: 109-87)
Pascal Jackson attempts a 3Pt. Contested by Jarrett Oladipo (4.7 feet, MAN). PASCAL JACKSON MAKES IT! Assist: Chris Parker
Score: 109-90

[04:35] Team_068 possession (Score: 109-90)
Miles Murray attempts a 3Pt. Contested by Evan Quickley (4.5 feet, MAN). Miles Murray misses. Offensive rebound by Jarrett Oladipo! Jarrett Oladipo kicks it out.

[04:19] Team_068 possession (Score: 109-90)
Cole Anthony loses the ball! Stripped by Magic Bryant! TURNOVER! (live ball)

[04:00] Team_084 possession (Score: 109-90)
Evan Quickley attempts a Midrange. Contested by Miles Murray (4.6 feet, MAN). Evan Quickley misses. Offensive rebound by Pascal Jackson! Pascal Jackson kicks it out.

[03:45] Team_084 possession (Score: 109-90)
Chris Parker attempts a Midrange. Contested by Miles Murray (3.1 feet, ZONE). Chris Parker misses. Rebound secured by Franz Curry.

[03:32] Team_068 possession (Score: 109-90)
Miles Murray attempts a 3Pt. Contested by Magic Bryant (3.9 feet, ZONE). MILES MURRAY MAKES IT! Assist: Cole Anthony
Score: 112-90

[03:14] Team_084 possession (Score: 112-90)
Dejounte Porzingis drives, Franz Curry stays with him. Dejounte Porzingis attempts a Layup. Contested by Franz Curry (3.4 feet, ZONE). DEJOUNTE PORZINGIS MAKES IT! Assist: Evan Quickley
Score: 112-92

[02:57] Team_068 possession (Score: 112-92)
Ja Banchero attempts a Midrange. Contested by Chris Parker (5.9 feet, MAN). JA BANCHERO MAKES IT!
Score: 114-92

[02:42] Team_084 possession (Score: 114-92)
Evan Quickley attempts a Midrange. Contested by Miles Murray (2.9 feet, MAN). Evan Quickley misses. Rebound secured by Jarrett Oladipo.

[02:30] Team_068 possession (Score: 114-92)
Franz Curry drives to the basket... Franz Curry loses the ball! Stripped by Dejounte Porzingis! TURNOVER! (live ball)

[02:16] Team_084 possession (Score: 114-92)
Chris Parker attempts a Midrange. Contested by Ja Banchero (4.3 feet, ZONE). Chris Parker misses. Rebound secured by Jarrett Oladipo.

[02:00] Team_068 possession (Score: 114-92)
Franz Curry attempts a Dunk. BLOCKED BY MAGIC BRYANT! Ball is loose! Rebound secured by Dejounte Porzingis.

[01:47] Team_084 possession (Score: 114-92)
Dejounte Porzingis attempts a Dunk. BLOCKED BY FRANZ CURRY! Ball is loose! Rebound secured by Franz Curry.

[01:33] Team_068 possession (Score: 114-92)
Cole Anthony attempts a 3Pt. Wide open! Magic Bryant is 7.7 feet away. [ZONE] Cole Anthony misses. FOUL! Loose ball foul on Evan Quickley during the rebound battle. [IN THE BONUS! 7 team fouls] Jarrett Oladipo to the line for 2 free throws. (Evan Quickley: 1 personal fouls)   FT 1/2: MISS   FT 2/2: GOOD Jarrett Oladipo makes 1/2 from the line.
Score: 115-92

[01:16] Team_084 possession (Score: 115-92)
Pascal Jackson drives to the basket... FOUL! Offensive foul on Pascal Jackson! Franz Curry drew the charge! [Team fouls: 8] (Pascal Jackson: 1 personal fouls) TURNOVER! (dead ball)

[01:04] Team_068 possession (Score: 115-92)
Ja Banchero attempts a 3Pt. Wide open! Chris Parker is 7.6 feet away. [MAN] Ja Banchero misses. Rebound secured by Evan Quickley.

[00:52] Team_084 possession (Score: 115-92)
Chris Parker attempts a 3Pt. Contested by Ja Banchero (5.9 feet, ZONE). CHRIS PARKER MAKES IT! Assist: Magic Bryant
Score: 115-95

[00:36] Team_068 possession (Score: 115-95)
Franz Curry loses control! Ball rolls out of bounds! TURNOVER! (dead ball)

[00:21] Team_084 possession (Score: 115-95)
Pascal Jackson attempts a Midrange. Contested by Jarrett Oladipo (2.9 feet, MAN). Pascal Jackson misses. Offensive rebound by Pascal Jackson! Pascal Jackson kicks it out.

[00:08] Team_084 possession (Score: 115-95)
Dejounte Porzingis attempts a 3Pt. Wide open! Ja Banchero is 6.5 feet away. [ZONE] Dejounte Porzingis misses. Rebound secured by Jarrett Oladipo.

================================================================================
                              4TH QUARTER COMPLETE                              
================================================================================

4TH QUARTER SCORE: Team_068 17, Team_084 18

BOX SCORE:
================================================================================

Team_068
--------------------------------------------------------------------------------
Player                MIN  PTS  REB  AST  TO      FG   FG%      3P   3P%
--------------------------------------------------------------------------------
Zion Anunoby           32    6    0    0   0   2/2   100.0     0/0   0.0
Jaren Johnson          32    3    6    2   0   2/3    66.7     0/0   0.0
Miles Murray           17    3    0    0   0   1/1   100.0     0/0   0.0
Gary Simons            32    2    0    0   0   1/2    50.0     0/0   0.0
Ja Banchero            17    2    0    0   0   1/2    50.0     0/0   0.0
Jarrett Oladipo        17    1    4    0   0   1/1   100.0     0/0   0.0
Nikola Ginobili        31    0    2    0   0   0/0     0.0     0/0   0.0
Malcolm Herro          32    0    0    0   0   0/3     0.0     0/0   0.0
Franz Curry            17    0    2    0   0   0/1     0.0     0/0   0.0
Cole Anthony           17    0    0    1   0   0/0     0.0     0/0   0.0

TEAM: FG: 8/15 (53.3%), 3PT: 5/9 (55.6%), REB: 14 (3 off, 11 def), AST: 3, TO: 5
TEAM FOULS: 2


Team_084
--------------------------------------------------------------------------------
Player                MIN  PTS  REB  AST  TO      FG   FG%      3P   3P%
--------------------------------------------------------------------------------
Luka Sexton            32    6    0    0   0   2/4    50.0     0/0   0.0
Pascal Jackson         17    3    2    0   0   1/1   100.0     0/0   0.0
Chris Parker           17    3    0    1   0   1/3    33.3     0/0   0.0
Jarrett Booker         32    2    0    1   0   1/1   100.0     0/0   0.0
Giannis Quickley       32    2    2    0   0   1/2    50.0     0/0   0.0
Dejounte Porzingis     17    2    1    0   0   1/3    33.3     0/0   0.0
Klay Thompson          32    0    2    0   0   0/3     0.0     0/0   0.0
Dejounte Ginobili      32    0    4    1   0   0/0     0.0     0/0   0.0
Evan Quickley          17    0    1    1   0   0/1     0.0     0/0   0.0
Magic Bryant           17    0    0    1   0   0/0     0.0     0/0   0.0

TEAM: FG: 7/18 (38.9%), 3PT: 4/8 (50.0%), REB: 12 (5 off, 7 def), AST: 5, TO: 2
TEAM FOULS: 8 [Team_068 in BONUS]

================================================================================

================================================================================
                               FULL GAME COMPLETE                               
================================================================================

FINAL SCORE: Team_068 115, Team_084 95

SCORING BY QUARTER:
--------------------------------------------------------------------------------
Team                     Q1     Q2     Q3     Q4    FINAL
--------------------------------------------------------------------------------
Team_068                 25     29     44     17      115
Team_084                 28     24     25     18       95
--------------------------------------------------------------------------------

FULL GAME BOX SCORE:
================================================================================

Team_068
--------------------------------------------------------------------------------
Player                MIN  PTS  REB  AST  TO      FG   FG%      3P   3P%      FT STL BLK
--------------------------------------------------------------------------------
Zion Anunoby           32   18    0    3   1   8/11   72.7   3/4    75.0   3/3     0   0
Malcolm Herro          32    8    0    1   1   4/10   40.0   0/4     0.0   2/2     0   1
Jaren Johnson          32   13   12    6   2   2/8    25.0   1/6    16.7   5/7     1   0
Gary Simons            32   22    4    3   2  12/17   70.6   4/5    80.0   2/2     3   1
Nikola Ginobili        31   15    8    3   3   5/5   100.0   1/1   100.0   2/2     0   0
Franz Curry            17   10    7    2   2   6/8    75.0   1/1   100.0   1/1     1   3
Cole Anthony           17    7    0    2   1   3/6    50.0   2/4    50.0   0/0     0   0
Ja Banchero            17    5    4    0   0   2/4    50.0   1/2    50.0   1/2     0   0
Miles Murray           17    6    0    0   1   2/3    66.7   2/2   100.0   0/0     0   0
Jarrett Oladipo        17    8    9    2   2   3/4    75.0   1/2    50.0   1/2     0   0

TEAM: FG: 47/76 (61.8%), 3PT: 16/31 (51.6%), REB: 43 (7 off, 36 def), AST: 22, TO: 15


Team_084
--------------------------------------------------------------------------------
Player                MIN  PTS  REB  AST  TO      FG   FG%      3P   3P%      FT STL BLK
--------------------------------------------------------------------------------
Luka Sexton            32   16    0    1   2   6/12   50.0   3/5    60.0   0/0     0   0
Dejounte Ginobili      32    7   13    1   3   5/12   41.7   2/7    28.6   2/2     1   0
Klay Thompson          32   11    7    1   1   7/11   63.6   2/4    50.0   1/1     0   0
Jarrett Booker         32   10    0    1   2   5/7    71.4   0/0     0.0   3/5     0   0
Giannis Quickley       32   15   12    6   1   2/5    40.0   0/2     0.0   1/1     0   0
Magic Bryant           17   10    0    2   0   4/6    66.7   1/2    50.0   1/1     1   1
Chris Parker           17    9    0    1   1   4/10   40.0   1/5    20.0   2/2     0   0
Evan Quickley          17    2    3    4   0   1/4    25.0   0/0     0.0   0/0     0   0
Pascal Jackson         17    8    7    1   0   3/5    60.0   1/2    50.0   3/3     1   0
Dejounte Porzingis     17    6    2    0   1   3/5    60.0   0/1     0.0   0/0     1   0

TEAM: FG: 41/78 (52.6%), 3PT: 10/28 (35.7%), REB: 45 (16 off, 29 def), AST: 18, TO: 11

================================================================================
