================================================================================
                        FULL GAME - Team_014 vs Team_100                        
================================================================================

================================================================================
                       1ST QUARTER - Team_014 vs Team_100                       
================================================================================

[12:00] Team_014 possession (Score: 0-0)
Ayo Murray attempts a Layup. BLOCKED BY MANU BALL! Ball goes out off Manu Ball. Ayo Murray's ball!

[11:46] Team_014 possession (Score: 0-0)
DeMar Adebayo attempts a Midrange. Wide open! Tyler Griffin is 6.6 feet away. [ZONE] DEMAR ADEBAYO MAKES IT!
Score: 2-0

[11:27] Team_100 possession (Score: 2-0)
Manu Ball attempts a Midrange. Wide open! Ayo Murray is 9.2 feet away. [ZONE] MANU BALL MAKES IT! Assist: Pau LaVine
Score: 2-2

[11:13] Team_014 possession (Score: 2-2)
Ayo Murray attempts a Layup. BLOCKED BY PAU LAVINE! Ball is loose! Rebound secured by Tyler Griffin.

[10:57] Team_100 possession (Score: 2-2)
Luka Green attempts a 3Pt. Contested by Michael Cunningham (6.0 feet, MAN). Luka Green misses. Rebound secured by Ayo Murray.

[10:47] Team_014 possession (Score: 2-2)
Ayo Murray attempts a Midrange. Wide open! Tyler Griffin is 6.7 feet away. [ZONE] Ayo Murray misses. Rebound secured by Pau LaVine.

[10:28] Team_100 possession (Score: 2-2)
Luka Green drives and kicks out. Luka Green attempts a 3Pt. Contested by Jordan Anunoby (5.2 feet, ZONE). LUKA GREEN MAKES IT! Assist: Manu Ball
Score: 2-5

[10:12] Team_014 possession (Score: 2-5)
Lamelo Simmons attempts a 3Pt. Wide open! Tyler Griffin is 7.6 feet away. [MAN] LAMELO SIMMONS MAKES IT!
Score: 5-5

[09:54] Team_100 possession (Score: 5-5)
Manu Ball attempts a 3Pt. Heavily contested by Jordan Anunoby (0.6 feet, ZONE)! Manu Ball misses. Rebound secured by DeMar Adebayo.

[09:41] Team_014 possession (Score: 5-5)
FOUL! Reach-in foul on Pau LaVine during the drive. [Team fouls: 1] No free throws, side out. (Pau LaVine: 1 personal fouls)

[09:29] Team_014 possession (Score: 5-5)
Lamelo Simmons makes the Dunk and draws the foul on Manu Ball! And-1! Lamelo Simmons to the line for 1. [Team fouls: 2] (Manu Ball: 1 personal fouls)   FT 1/1: GOOD Lamelo Simmons makes 1/1 from the line.
Score: 8-5

[09:15] Team_100 possession (Score: 8-5)
Manu Ball attempts a 3Pt. Contested by Jordan Anunoby (4.1 feet, ZONE). MANU BALL MAKES IT! Assist: Luka Green
Score: 8-8

[09:02] Team_014 possession (Score: 8-8)
Lamelo Simmons drives to the basket... FOUL! Offensive foul on Lamelo Simmons! Pau LaVine drew the charge! [Team fouls: 1] (Lamelo Simmons: 1 personal fouls) TURNOVER! (dead ball)

[08:47] Team_100 possession (Score: 8-8)
Tyler Griffin attempts a 3Pt. Contested by Lamelo Simmons (3.9 feet, ZONE). Tyler Griffin misses. Rebound secured by Michael Cunningham.

[08:36] Team_014 possession (Score: 8-8)
Michael Cunningham attempts a 3Pt. Wide open! Luka Green is 8.1 feet away. [MAN] MICHAEL CUNNINGHAM MAKES IT! Assist: Ayo Murray
Score: 11-8

[08:21] Team_100 possession (Score: 11-8)
Tyler Griffin drives, DeMar Adebayo stays with him. Tyler Griffin attempts a Layup. Heavily contested by DeMar Adebayo (0.5 feet, ZONE)! Tyler Griffin misses. Offensive rebound by Chris Mobley! Chris Mobley kicks it out.

[08:09] Team_100 possession (Score: 11-8)
Manu Ball attempts a Midrange. Contested by Lamelo Simmons (3.4 feet, ZONE). Manu Ball misses. FOUL! Loose ball foul on Michael Cunningham during the rebound battle. [Team fouls: 2] No free throws, side out. (Michael Cunningham: 1 personal fouls)

[07:54] Team_100 possession (Score: 11-8)
Manu Ball drives, picks up Jordan Anunoby. Help arrives from Michael Cunningham! Manu Ball attempts a Layup. Contested by Michael Cunningham (4.1 feet, MAN). MANU BALL MAKES IT! Assist: Pau LaVine
Score: 11-10

[07:39] Team_014 possession (Score: 11-10)
DeMar Adebayo attempts a Layup. Wide open! Pau LaVine is 6.4 feet away. [ZONE] DEMAR ADEBAYO MAKES IT! Assist: Michael Cunningham
Score: 13-10

[07:23] Team_100 possession (Score: 13-10)
Pau LaVine attempts a 3Pt. Contested by DeMar Adebayo (3.8 feet, ZONE). Pau LaVine misses. Rebound secured by DeMar Adebayo.

[07:11] Team_014 possession (Score: 13-10)
Jordan Anunoby attempts a Midrange. Wide open! Manu Ball is 10.0 feet away. [MAN] JORDAN ANUNOBY MAKES IT!
Score: 15-10

[06:58] Team_100 possession (Score: 15-10)
Luka Green attempts a 3Pt. Contested by DeMar Adebayo (3.2 feet, ZONE). LUKA GREEN MAKES IT! Assist: Tyler Griffin
Score: 15-13

[06:47] Team_014 possession (Score: 15-13)
Jordan Anunoby attempts a 3Pt. Contested by Manu Ball (4.0 feet, MAN). Jordan Anunoby misses. Rebound secured by Chris Mobley.

[06:32] Team_100 possession (Score: 15-13)
Chris Mobley drives, picks up DeMar Adebayo. Help arrives from Michael Cunningham! Chris Mobley attempts a Dunk. Contested by Michael Cunningham (3.3 feet, ZONE). CHRIS MOBLEY MAKES IT!
Score: 15-15

[06:16] Team_014 possession (Score: 15-15)
Lamelo Simmons attempts a 3Pt. Contested by Tyler Griffin (5.3 feet, MAN). Lamelo Simmons misses. Rebound secured by Chris Mobley.

[06:04] Team_100 possession (Score: 15-15)
Manu Ball attempts a 3Pt. Contested by Jordan Anunoby (3.7 feet, MAN). Manu Ball misses. Rebound secured by DeMar Adebayo.

[05:53] Team_014 possession (Score: 15-15)
Michael Cunningham attempts a 3Pt. Wide open! Luka Green is 7.0 feet away. [MAN] Michael Cunningham misses. Offensive rebound by Ayo Murray! Ayo Murray kicks it out.

[05:38] Team_014 possession (Score: 15-15)
Ayo Murray drives and kicks out. DeMar Adebayo attempts a 3Pt. Contested by Luka Green (5.4 feet, ZONE). DeMar Adebayo misses. Rebound secured by Tyler Griffin.

[05:23] Team_100 possession (Score: 15-15)
Pau LaVine attempts a 3Pt. Contested by Jordan Anunoby (4.1 feet, ZONE). Pau LaVine misses. Rebound secured by DeMar Adebayo.

[05:11] Team_014 possession (Score: 15-15)
Lamelo Simmons attempts a Midrange. Contested by Tyler Griffin (5.6 feet, MAN). Lamelo Simmons misses. Offensive rebound by Ayo Murray! Ayo Murray kicks it out.

[04:54] Team_014 possession (Score: 15-15)
DeMar Adebayo loses the ball! Stripped by Pau LaVine! TURNOVER! (live ball)

[04:40] Team_100 possession (Score: 15-15)
Luka Green attempts a 3Pt. Wide open! Lamelo Simmons is 6.8 feet away. [ZONE] LUKA GREEN MAKES IT! Assist: Chris Mobley
Score: 15-18

[04:25] Team_014 possession (Score: 15-18)
DeMar Adebayo drives, Pau LaVine stays with him. DeMar Adebayo attempts a Layup. Heavily contested by Pau LaVine (1.9 feet, ZONE)! DEMAR ADEBAYO MAKES IT!
Score: 17-18

[04:09] Team_100 possession (Score: 17-18)
Pau LaVine attempts a 3Pt. Contested by DeMar Adebayo (3.6 feet, MAN). Pau LaVine misses. Offensive rebound by Pau LaVine! Pau LaVine kicks it out.

[03:58] Team_100 possession (Score: 17-18)
Tyler Griffin loses the ball! Stripped by Lamelo Simmons! TURNOVER! (live ball)

[03:43] Team_014 possession (Score: 17-18)
FOUL! Offensive foul on Lamelo Simmons! Tyler Griffin drew the charge! [Team fouls: 3] (Lamelo Simmons: 2 personal fouls) TURNOVER! (dead ball)

[03:29] Team_100 possession (Score: 17-18)
Pau LaVine drives, DeMar Adebayo stays with him. Pau LaVine attempts a Layup. Contested by DeMar Adebayo (2.5 feet, ZONE). PAU LAVINE MAKES IT!
Score: 17-20

[03:14] Team_014 possession (Score: 17-20)
Ayo Murray attempts a Midrange. Wide open! Chris Mobley is 6.3 feet away. [MAN] Ayo Murray misses. Rebound secured by Pau LaVine.

[02:58] Team_100 possession (Score: 17-20)
Tyler Griffin makes the Layup and draws the foul on Lamelo Simmons! And-1! Tyler Griffin to the line for 1. [Team fouls: 4] (Lamelo Simmons: 3 personal fouls)   FT 1/1: MISS Tyler Griffin makes 0/1 from the line. Rebound secured by DeMar Adebayo.
Score: 17-22

[02:41] Team_014 possession (Score: 17-22)
Jordan Anunoby attempts a 3Pt. Wide open! Luka Green is 6.8 feet away. [ZONE] Jordan Anunoby misses. Rebound secured by Chris Mobley.

[02:26] Team_100 possession (Score: 17-22)
Pau LaVine attempts a 3Pt. Contested by DeMar Adebayo (3.2 feet, MAN). Pau LaVine misses. Rebound secured by DeMar Adebayo.

[02:07] Team_014 possession (Score: 17-22)
Ayo Murray attempts a 3Pt. Contested by Chris Mobley (5.3 feet, MAN). AYO MURRAY MAKES IT! Assist: Lamelo Simmons
Score: 20-22

[01:53] Team_100 possession (Score: 20-22)
Pau LaVine drives and kicks out. FOUL! Shooting foul on Lamelo Simmons. Luka Green to the line for 3 free throws. [BONUS: 5 team fouls] (Lamelo Simmons: 4 personal fouls)   FT 1/3: GOOD   FT 2/3: GOOD   FT 3/3: GOOD Luka Green makes 3/3 from the line.
Score: 20-25

[01:39] Team_014 possession (Score: 20-25)
Jordan Anunoby attempts a Layup. Contested by Pau LaVine (2.6 feet, ZONE). JORDAN ANUNOBY MAKES IT! Assist: Ayo Murray
Score: 22-25

[01:24] Team_100 possession (Score: 22-25)
Luka Green drives and kicks out. Luka Green attempts a 3Pt. Wide open! Michael Cunningham is 6.2 feet away. [MAN] LUKA GREEN MAKES IT! Assist: Pau LaVine
Score: 22-28

[01:14] Team_014 possession (Score: 22-28)
Ayo Murray drives, picks up Pau LaVine. Help arrives from Manu Ball! Ayo Murray attempts a Layup. Contested by Manu Ball (2.9 feet, ZONE). AYO MURRAY MAKES IT! Assist: DeMar Adebayo
Score: 24-28

[00:57] Team_100 possession (Score: 24-28)
Tyler Griffin attempts a 3Pt. Contested by Jordan Anunoby (5.0 feet, ZONE). Tyler Griffin misses. Rebound secured by Michael Cunningham.

[00:38] Team_014 possession (Score: 24-28)
Michael Cunningham attempts a Midrange. Wide open! Luka Green is 7.3 feet away. [MAN] MICHAEL CUNNINGHAM MAKES IT!
Score: 26-28

[00:26] Team_100 possession (Score: 26-28)
Luka Green throws a bad pass! Stolen by Michael Cunningham! TURNOVER! (live ball)

[00:09] Team_014 possession (Score: 26-28)
Michael Cunningham attempts a Layup. Contested by Pau LaVine (4.7 feet, ZONE). MICHAEL CUNNINGHAM MAKES IT!
Score: 28-28

================================================================================
                              1ST QUARTER COMPLETE                              
================================================================================

1ST QUARTER SCORE: Team_014 28, Team_100 28

BOX SCORE:
================================================================================

Team_014
--------------------------------------------------------------------------------
Player                MIN  PTS  REB  AST  TO      FG   FG%      3P   3P%
--------------------------------------------------------------------------------
Michael Cunningham     12    7    2    1   0   3/3   100.0     0/0   0.0
DeMar Adebayo          12    6    6    1   0   3/3   100.0     0/0   0.0
Lamelo Simmons         12    6    0    1   0   2/3    66.7     0/0   0.0
Ayo Murray             12    5    3    2   0   2/6    33.3     0/0   0.0
Jordan Anunoby         12    4    0    0   0   2/4    50.0     0/0   0.0

TEAM: FG: 12/19 (63.2%), 3PT: 3/6 (50.0%), REB: 11 (2 off, 9 def), AST: 5, TO: 3
TEAM FOULS: 5 [Team_100 in BONUS]


Team_100
--------------------------------------------------------------------------------
Player                MIN  PTS  REB  AST  TO      FG   FG%      3P   3P%
--------------------------------------------------------------------------------
Luka Green             12   15    0    1   0   5/6    83.3     0/0   0.0
Manu Ball              12    7    0    1   0   3/5    60.0     0/0   0.0
Pau LaVine             12    2    3    3   0   1/4    25.0     0/0   0.0
Chris Mobley           12    2    5    1   0   1/1   100.0     0/0   0.0
Tyler Griffin          12    0    2    1   0   0/3     0.0     0/0   0.0

TEAM: FG: 10/19 (52.6%), 3PT: 3/11 (27.3%), REB: 10 (3 off, 7 def), AST: 7, TO: 2
TEAM FOULS: 2

================================================================================

================================================================================
                       2ND QUARTER - Team_014 vs Team_100                       
================================================================================

[12:00] Team_014 possession (Score: 28-28)
Lamelo Simmons attempts a Midrange. Wide open! Tyler Griffin is 6.7 feet away. [MAN] Lamelo Simmons misses. Rebound secured by Pau LaVine.

[11:43] Team_100 possession (Score: 28-28)
Chris Mobley attempts a Layup. Contested by Ayo Murray (5.0 feet, MAN). CHRIS MOBLEY MAKES IT!
Score: 28-30

[11:28] Team_014 possession (Score: 28-30)
Jordan Anunoby attempts a 3Pt. Wide open! Manu Ball is 8.3 feet away. [MAN] Jordan Anunoby misses. Offensive rebound by DeMar Adebayo! DeMar Adebayo kicks it out.

[11:13] Team_014 possession (Score: 28-30)
Lamelo Simmons throws a bad pass out of bounds! TURNOVER! (dead ball)

[11:13] Substitution (Team_014): Michael Cunningham OUT → Jalen Booker IN (stamina_rule2)

[11:13] Substitution (Team_014): Jordan Anunoby OUT → Bones Quickley IN (stamina_rule2)

[11:13] Substitution (Team_014): Lamelo Simmons OUT → Tracy Westbrook IN (stamina_rule2)

[11:13] Substitution (Team_014): DeMar Adebayo OUT → Nikola James IN (stamina_rule2)

[11:13] Substitution (Team_014): Ayo Murray OUT → Collin Gasol IN (stamina_rule2)

[11:13] Substitution (Team_100): Luka Green OUT → Dirk Sabonis IN (stamina_rule2)

[11:13] Substitution (Team_100): Manu Ball OUT → Evan Butler IN (stamina_rule2)

[11:13] Substitution (Team_100): Tyler Griffin OUT → Tyrese Wade IN (stamina_rule2)

[11:13] Substitution (Team_100): Pau LaVine OUT → Carmelo Ginobili IN (stamina_rule2)

[11:13] Substitution (Team_100): Chris Mobley OUT → John Rozier IN (stamina_rule2)

[10:56] Team_100 possession (Score: 28-30)
Dirk Sabonis attempts a 3Pt. Contested by Jalen Booker (3.7 feet, MAN). DIRK SABONIS MAKES IT! Assist: Carmelo Ginobili
Score: 28-33

[10:38] Team_014 possession (Score: 28-33)
FOUL! Holding foul on Evan Butler. [Team fouls: 1] No free throws, side out. (Evan Butler: 1 personal fouls)

[10:27] Team_014 possession (Score: 28-33)
Jalen Booker drives and kicks out. Bones Quickley attempts a 3Pt. Wide open! Tyrese Wade is 7.6 feet away. [ZONE] Bones Quickley misses. Rebound secured by Carmelo Ginobili.

[10:11] Team_100 possession (Score: 28-33)
Carmelo Ginobili attempts a 3Pt. Wide open! Nikola James is 7.0 feet away. [MAN] CARMELO GINOBILI MAKES IT! Assist: Evan Butler
Score: 28-36

[09:56] Team_014 possession (Score: 28-36)
Jalen Booker drives and kicks out. Tracy Westbrook attempts a 3Pt. Wide open! Carmelo Ginobili is 7.0 feet away. [ZONE] Tracy Westbrook misses. Rebound secured by Carmelo Ginobili.

[09:39] Team_100 possession (Score: 28-36)
Dirk Sabonis attempts a 3Pt. Contested by Jalen Booker (4.3 feet, MAN). Dirk Sabonis misses. Rebound secured by Tracy Westbrook.

[09:21] Team_014 possession (Score: 28-36)
Bones Quickley makes the Layup and draws the foul on John Rozier! And-1! Bones Quickley to the line for 1. [Team fouls: 2] (John Rozier: 1 personal fouls)   FT 1/1: GOOD Bones Quickley makes 1/1 from the line.
Score: 31-36

[09:05] Team_100 possession (Score: 31-36)
Tyrese Wade attempts a Layup. Contested by Collin Gasol (2.0 feet, ZONE). Tyrese Wade misses. Rebound secured by Collin Gasol.

[08:53] Team_014 possession (Score: 31-36)
Tracy Westbrook attempts a 3Pt. Wide open! Tyrese Wade is 6.5 feet away. [MAN] Tracy Westbrook misses. Offensive rebound by Collin Gasol! Collin Gasol's putback is no good. Offensive rebound by Collin Gasol! Collin Gasol kicks it out.

[08:36] Team_014 possession (Score: 31-36)
Jalen Booker attempts a Layup. Contested by John Rozier (2.8 feet, ZONE). JALEN BOOKER MAKES IT!
Score: 33-36

[08:26] Team_100 possession (Score: 33-36)
John Rozier drives and kicks out. Carmelo Ginobili attempts a 3Pt. Contested by Nikola James (5.3 feet, MAN). Carmelo Ginobili misses. Rebound secured by Nikola James.

[08:08] Team_014 possession (Score: 33-36)
Bones Quickley attempts a 3Pt. Contested by Evan Butler (5.3 feet, MAN). Bones Quickley misses. Rebound secured by John Rozier.

[07:55] Team_100 possession (Score: 33-36)
Carmelo Ginobili drives and kicks out. Tyrese Wade attempts a 3Pt. Contested by Jalen Booker (3.9 feet, ZONE). Tyrese Wade misses. Rebound secured by Nikola James.

[07:41] Team_014 possession (Score: 33-36)
Bones Quickley attempts a 3Pt. Contested by Tyrese Wade (2.8 feet, ZONE). Bones Quickley misses. Offensive rebound by Collin Gasol! Collin Gasol puts it back in!
Score: 35-36

[07:25] Team_100 possession (Score: 35-36)
Tyrese Wade attempts a Midrange. Contested by Tracy Westbrook (3.8 feet, MAN). TYRESE WADE MAKES IT! Assist: Dirk Sabonis
Score: 35-38

[07:13] Team_014 possession (Score: 35-38)
Tracy Westbrook drives, picks up Tyrese Wade. Help arrives from Evan Butler! Tracy Westbrook attempts a Dunk. Contested by Evan Butler (2.2 feet, MAN). Tracy Westbrook misses. Offensive rebound by Nikola James! Nikola James kicks it out.

[06:56] Team_014 possession (Score: 35-38)
Tracy Westbrook drives, Tyrese Wade stays with him. Tracy Westbrook attempts a Layup. Heavily contested by Tyrese Wade (0.5 feet, MAN)! Tracy Westbrook misses. Rebound secured by John Rozier.

[06:41] Team_100 possession (Score: 35-38)
Carmelo Ginobili attempts a Midrange. Contested by Bones Quickley (5.9 feet, ZONE). CARMELO GINOBILI MAKES IT!
Score: 35-40

[06:26] Team_014 possession (Score: 35-40)
Jalen Booker attempts a Midrange. Contested by Tyrese Wade (4.3 feet, ZONE). Jalen Booker misses. Rebound secured by Carmelo Ginobili.

[06:13] Team_100 possession (Score: 35-40)
Carmelo Ginobili makes the 3Pt and draws the foul on Jalen Booker! And-1! Carmelo Ginobili to the line for 1. [Team fouls: 1] (Jalen Booker: 1 personal fouls)   FT 1/1: GOOD Carmelo Ginobili makes 1/1 from the line.
Score: 35-44

[05:56] Team_014 possession (Score: 35-44)
Jalen Booker makes the Layup and draws the foul on Dirk Sabonis! And-1! Jalen Booker to the line for 1. [Team fouls: 3] (Dirk Sabonis: 1 personal fouls)   FT 1/1: GOOD Jalen Booker makes 1/1 from the line.
Score: 38-44

[05:40] Team_100 possession (Score: 38-44)
Tyrese Wade attempts a 3Pt. Contested by Jalen Booker (4.1 feet, ZONE). Tyrese Wade misses. Rebound secured by Nikola James.

[05:28] Team_014 possession (Score: 38-44)
Collin Gasol drives, John Rozier stays with him. Collin Gasol attempts a Dunk. Wide open! John Rozier is 7.0 feet away. [MAN] COLLIN GASOL MAKES IT!
Score: 40-44

[05:10] Team_100 possession (Score: 40-44)
Tyrese Wade drives to the basket... Tyrese Wade throws a bad pass! Stolen by Collin Gasol! TURNOVER! (live ball)

[04:51] Team_014 possession (Score: 40-44)
Bones Quickley attempts a Midrange. Wide open! Evan Butler is 6.2 feet away. [ZONE] Bones Quickley misses. Rebound secured by Tyrese Wade.

[04:32] Team_100 possession (Score: 40-44)
Tyrese Wade attempts a Layup. Contested by Tracy Westbrook (3.2 feet, MAN). Tyrese Wade misses. Rebound secured by Collin Gasol.

[04:18] Team_014 possession (Score: 40-44)
Nikola James attempts a 3Pt. Contested by Tyrese Wade (5.5 feet, ZONE). NIKOLA JAMES MAKES IT! Assist: Bones Quickley
Score: 43-44

[04:05] Team_100 possession (Score: 43-44)
Tyrese Wade throws a bad pass out of bounds! TURNOVER! (dead ball)

[03:49] Team_014 possession (Score: 43-44)
Bones Quickley drives and kicks out. Nikola James attempts a Midrange. Wide open! Carmelo Ginobili is 7.5 feet away. [MAN] NIKOLA JAMES MAKES IT! Assist: Jalen Booker
Score: 45-44

[03:36] Team_100 possession (Score: 45-44)
John Rozier attempts a 3Pt. Wide open! Collin Gasol is 7.7 feet away. [MAN] JOHN ROZIER MAKES IT! Assist: Tyrese Wade
Score: 45-47

[03:21] Team_014 possession (Score: 45-47)
Tracy Westbrook attempts a 3Pt. Heavily contested by Tyrese Wade (1.9 feet, MAN)! Tracy Westbrook misses. Rebound secured by Carmelo Ginobili.

[03:03] Team_100 possession (Score: 45-47)
John Rozier attempts a 3Pt. Wide open! Jalen Booker is 6.2 feet away. [ZONE] John Rozier misses. Rebound secured by Collin Gasol.

[02:46] Team_014 possession (Score: 45-47)
Jalen Booker attempts a 3Pt. Contested by Dirk Sabonis (5.1 feet, MAN). Jalen Booker misses. Rebound secured by John Rozier.

[02:34] Team_100 possession (Score: 45-47)
Tyrese Wade attempts a 3Pt. Wide open! Tracy Westbrook is 8.7 feet away. [MAN] Tyrese Wade misses. Rebound secured by Collin Gasol.

[02:20] Team_014 possession (Score: 45-47)
Nikola James drives and kicks out. Nikola James attempts a 3Pt. Contested by Tyrese Wade (2.6 feet, ZONE). Nikola James misses. Rebound secured by Tyrese Wade.

[02:04] Team_100 possession (Score: 45-47)
Dirk Sabonis makes the 3Pt and draws the foul on Jalen Booker! And-1! Dirk Sabonis to the line for 1. [Team fouls: 2] (Jalen Booker: 2 personal fouls)   FT 1/1: GOOD Dirk Sabonis makes 1/1 from the line.
Score: 45-51

[01:52] Team_014 possession (Score: 45-51)
Jalen Booker attempts a 3Pt. Wide open! Dirk Sabonis is 6.5 feet away. [MAN] Jalen Booker misses. Rebound secured by Tyrese Wade.

[01:33] Team_100 possession (Score: 45-51)
FOUL! Holding foul on Bones Quickley. [Team fouls: 3] No free throws, side out. (Bones Quickley: 1 personal fouls)

[01:15] Team_100 possession (Score: 45-51)
Dirk Sabonis attempts a 3Pt. Wide open! Jalen Booker is 8.2 feet away. [ZONE] Dirk Sabonis misses. Rebound secured by Nikola James.

[01:01] Team_014 possession (Score: 45-51)
Tracy Westbrook attempts a Midrange. Contested by Tyrese Wade (4.9 feet, ZONE). Tracy Westbrook misses. FOUL! Loose ball foul on Tyrese Wade during the rebound battle. [Team fouls: 4] No free throws, side out. (Tyrese Wade: 1 personal fouls)

[00:47] Team_014 possession (Score: 45-51)
Tracy Westbrook attempts a Midrange. Wide open! Carmelo Ginobili is 6.7 feet away. [ZONE] Tracy Westbrook misses. Offensive rebound by Collin Gasol! Collin Gasol puts it back in!
Score: 47-51

[00:32] Team_100 possession (Score: 47-51)
Evan Butler attempts a 3Pt. Wide open! Bones Quickley is 6.2 feet away. [MAN] EVAN BUTLER MAKES IT! Assist: Dirk Sabonis
Score: 47-54

[00:22] Team_014 possession (Score: 47-54)
Nikola James loses control! Ball rolls out of bounds! TURNOVER! (dead ball)

[00:04] Team_100 possession (Score: 47-54)
Dirk Sabonis attempts a Layup. Contested by Collin Gasol (5.2 feet, ZONE). DIRK SABONIS MAKES IT!
Score: 47-56

================================================================================
                              2ND QUARTER COMPLETE                              
================================================================================

2ND QUARTER SCORE: Team_014 19, Team_100 28

BOX SCORE:
================================================================================

Team_014
--------------------------------------------------------------------------------
Player                MIN  PTS  REB  AST  TO      FG   FG%      3P   3P%
--------------------------------------------------------------------------------
Collin Gasol           11    6    8    0   0   3/3   100.0     0/0   0.0
Jalen Booker           11    5    0    1   0   2/7    28.6     0/0   0.0
Nikola James           11    5    5    0   0   2/3    66.7     0/0   0.0
Bones Quickley         11    3    0    1   0   1/3    33.3     0/0   0.0
Lamelo Simmons         13    0    0    0   0   0/1     0.0     0/0   0.0
DeMar Adebayo          13    0    1    0   0   0/0     0.0     0/0   0.0
Tracy Westbrook        11    0    1    0   0   0/2     0.0     0/0   0.0

TEAM: FG: 8/19 (42.1%), 3PT: 2/6 (33.3%), REB: 15 (6 off, 9 def), AST: 2, TO: 2
TEAM FOULS: 3


Team_100
--------------------------------------------------------------------------------
Player                MIN  PTS  REB  AST  TO      FG   FG%      3P   3P%
--------------------------------------------------------------------------------
Dirk Sabonis           11    9    0    2   0   3/5    60.0     0/0   0.0
Carmelo Ginobili       11    9    4    1   0   3/4    75.0     0/0   0.0
Evan Butler            11    3    0    1   0   1/1   100.0     0/0   0.0
John Rozier            11    3    3    0   0   1/3    33.3     0/0   0.0
Chris Mobley           13    2    0    0   0   1/1   100.0     0/0   0.0
Tyrese Wade            11    2    3    1   0   1/5    20.0     0/0   0.0
Pau LaVine             13    0    1    0   0   0/0     0.0     0/0   0.0

TEAM: FG: 10/19 (52.6%), 3PT: 6/11 (54.5%), REB: 11 (0 off, 11 def), AST: 5, TO: 2
TEAM FOULS: 4

================================================================================

================================================================================
                       3RD QUARTER - Team_014 vs Team_100                       
================================================================================

[12:00] Team_014 possession (Score: 47-56)
Jordan Anunoby attempts a 3Pt. Heavily contested by Tyler Griffin (0.9 feet, ZONE)! Jordan Anunoby misses. Rebound secured by Chris Mobley.

[11:46] Team_100 possession (Score: 47-56)
Pau LaVine drives, DeMar Adebayo stays with him. Pau LaVine attempts a Dunk. Contested by DeMar Adebayo (2.7 feet, ZONE). PAU LAVINE MAKES IT! Assist: Luka Green
Score: 47-58

[11:30] Team_014 possession (Score: 47-58)
DeMar Adebayo drives and kicks out. Jordan Anunoby attempts a 3Pt. Contested by Manu Ball (3.3 feet, MAN). Jordan Anunoby misses. Rebound secured by Tyler Griffin.

[11:17] Team_100 possession (Score: 47-58)
Manu Ball drives, Jordan Anunoby stays with him. Manu Ball attempts a Layup. Heavily contested by Jordan Anunoby (1.1 feet, MAN)! MANU BALL MAKES IT!
Score: 47-60

[11:00] Team_014 possession (Score: 47-60)
DeMar Adebayo drives and kicks out. DeMar Adebayo attempts a 3Pt. Wide open! Pau LaVine is 6.3 feet away. [MAN] DeMar Adebayo misses. Rebound secured by Chris Mobley.

[10:41] Team_100 possession (Score: 47-60)
Manu Ball attempts a 3Pt. Contested by Jordan Anunoby (2.7 feet, ZONE). Manu Ball misses. Rebound secured by Ayo Murray.

[10:25] Team_014 possession (Score: 47-60)
Lamelo Simmons attempts a Midrange. Contested by Chris Mobley (4.5 feet, ZONE). Lamelo Simmons misses. Rebound secured by Tyler Griffin.

[10:13] Team_100 possession (Score: 47-60)
FOUL! Offensive foul on Chris Mobley! Ayo Murray drew the charge! [Team fouls: 1] (Chris Mobley: 1 personal fouls) TURNOVER! (dead ball)

[09:55] Team_014 possession (Score: 47-60)
Jordan Anunoby attempts a 3Pt. Wide open! Luka Green is 7.7 feet away. [ZONE] Jordan Anunoby misses. Offensive rebound by DeMar Adebayo! DeMar Adebayo kicks it out.

[09:38] Team_014 possession (Score: 47-60)
Ayo Murray attempts a Layup. Heavily contested by Chris Mobley (0.7 feet, MAN)! Ayo Murray misses. Rebound secured by Pau LaVine.

[09:28] Team_100 possession (Score: 47-60)
Luka Green attempts a 3Pt. Contested by Lamelo Simmons (5.6 feet, ZONE). Luka Green misses. Offensive rebound by Pau LaVine! Pau LaVine kicks it out.

[09:11] Team_100 possession (Score: 47-60)
Chris Mobley attempts a Midrange. Contested by Jordan Anunoby (3.4 feet, ZONE). Chris Mobley misses. Rebound secured by Ayo Murray.

[08:57] Team_014 possession (Score: 47-60)
DeMar Adebayo attempts a Midrange. Contested by Manu Ball (3.3 feet, ZONE). DEMAR ADEBAYO MAKES IT!
Score: 49-60

[08:46] Team_100 possession (Score: 49-60)
Manu Ball attempts a Midrange. Heavily contested by Lamelo Simmons (0.5 feet, ZONE)! MANU BALL MAKES IT!
Score: 49-62

[08:32] Team_014 possession (Score: 49-62)
Ayo Murray drives, Pau LaVine stays with him. Ayo Murray attempts a Layup. Contested by Pau LaVine (2.9 feet, ZONE). AYO MURRAY MAKES IT! Assist: DeMar Adebayo
Score: 51-62

[08:22] Team_100 possession (Score: 51-62)
Luka Green attempts a 3Pt. Contested by Michael Cunningham (3.7 feet, MAN). LUKA GREEN MAKES IT! Assist: Tyler Griffin
Score: 51-65

[08:06] Team_014 possession (Score: 51-65)
Jordan Anunoby attempts a 3Pt. Wide open! Manu Ball is 9.3 feet away. [MAN] Jordan Anunoby misses. Offensive rebound by DeMar Adebayo! DeMar Adebayo kicks it out.

[07:55] Team_014 possession (Score: 51-65)
Lamelo Simmons makes the Layup and draws the foul on Manu Ball! And-1! Lamelo Simmons to the line for 1. [Team fouls: 2] (Manu Ball: 1 personal fouls)   FT 1/1: GOOD Lamelo Simmons makes 1/1 from the line.
Score: 54-65

[07:40] Team_100 possession (Score: 54-65)
Pau LaVine drives, DeMar Adebayo stays with him. Pau LaVine attempts a Layup. Heavily contested by DeMar Adebayo (1.5 feet, ZONE)! PAU LAVINE MAKES IT! Assist: Manu Ball
Score: 54-67

[07:28] Team_014 possession (Score: 54-67)
Ayo Murray attempts a Midrange. Contested by Chris Mobley (5.2 feet, ZONE). Ayo Murray misses. Rebound secured by Tyler Griffin.

[07:15] Team_100 possession (Score: 54-67)
Luka Green drives and kicks out. Pau LaVine attempts a 3Pt. Contested by Jordan Anunoby (2.9 feet, ZONE). Pau LaVine misses. Rebound secured by Michael Cunningham.

[06:58] Team_014 possession (Score: 54-67)
Jordan Anunoby attempts a 3Pt. Wide open! Luka Green is 7.4 feet away. [ZONE] Jordan Anunoby misses. Rebound secured by Chris Mobley.

[06:45] Team_100 possession (Score: 54-67)
Chris Mobley attempts a Midrange. Contested by Ayo Murray (5.9 feet, MAN). Chris Mobley misses. Rebound secured by Ayo Murray.

[06:31] Team_014 possession (Score: 54-67)
Jordan Anunoby attempts a 3Pt. Wide open! Manu Ball is 6.0 feet away. [MAN] Jordan Anunoby misses. Rebound secured by Chris Mobley.

[06:17] Team_100 possession (Score: 54-67)
Chris Mobley attempts a Layup. BLOCKED BY AYO MURRAY! Ball deflects out of bounds off Chris Mobley.

[06:03] Team_014 possession (Score: 54-67)
Michael Cunningham attempts a Midrange. Wide open! Manu Ball is 7.0 feet away. [ZONE] Michael Cunningham misses. Rebound secured by Tyler Griffin.

[05:47] Team_100 possession (Score: 54-67)
Pau LaVine drives to the basket... Pau LaVine loses the ball! Stripped by DeMar Adebayo! TURNOVER! (live ball)

[05:35] Team_014 possession (Score: 54-67)
Lamelo Simmons attempts a Midrange. Contested by Tyler Griffin (5.7 feet, MAN). LAMELO SIMMONS MAKES IT!
Score: 56-67

[05:21] Team_100 possession (Score: 56-67)
Pau LaVine attempts a 3Pt. Wide open! Jordan Anunoby is 6.7 feet away. [ZONE] PAU LAVINE MAKES IT! Assist: Chris Mobley
Score: 56-70

[05:06] Team_014 possession (Score: 56-70)
DeMar Adebayo attempts a Midrange. Contested by Tyler Griffin (4.1 feet, ZONE). DeMar Adebayo misses. Rebound secured by Pau LaVine.

[04:49] Team_100 possession (Score: 56-70)
Chris Mobley attempts a Layup. Heavily contested by DeMar Adebayo (0.5 feet, ZONE)! CHRIS MOBLEY MAKES IT! Assist: Pau LaVine
Score: 56-72

[04:38] Team_014 possession (Score: 56-72)
DeMar Adebayo attempts a Midrange. Wide open! Pau LaVine is 6.4 feet away. [MAN] DEMAR ADEBAYO MAKES IT!
Score: 58-72

[04:24] Team_100 possession (Score: 58-72)
Tyler Griffin attempts a 3Pt. Contested by Lamelo Simmons (4.9 feet, MAN). Tyler Griffin misses. Rebound secured by Michael Cunningham.

[04:04] Team_014 possession (Score: 58-72)
Ayo Murray makes the Layup and draws the foul on Manu Ball! And-1! Ayo Murray to the line for 1. [Team fouls: 3] (Manu Ball: 2 personal fouls)   FT 1/1: GOOD Ayo Murray makes 1/1 from the line.
Score: 61-72

[03:50] Team_100 possession (Score: 61-72)
Pau LaVine attempts a Layup. Heavily contested by DeMar Adebayo (0.5 feet, ZONE)! Pau LaVine misses. Rebound secured by Ayo Murray.

[03:35] Team_014 possession (Score: 61-72)
Ayo Murray makes the Dunk and draws the foul on Manu Ball! And-1! Ayo Murray to the line for 1. [Team fouls: 4] (Manu Ball: 3 personal fouls)   FT 1/1: GOOD Ayo Murray makes 1/1 from the line.
Score: 64-72

[03:24] Team_100 possession (Score: 64-72)
Pau LaVine drives to the basket... Pau LaVine throws a bad pass! Stolen by DeMar Adebayo! TURNOVER! (live ball)

[03:07] Team_014 possession (Score: 64-72)
Ayo Murray drives to the basket... FOUL! Offensive foul on Ayo Murray! Pau LaVine drew the charge! [Team fouls: 1] (Ayo Murray: 1 personal fouls) TURNOVER! (dead ball)

[02:51] Team_100 possession (Score: 64-72)
Tyler Griffin attempts a 3Pt. Wide open! Jordan Anunoby is 6.5 feet away. [ZONE] TYLER GRIFFIN MAKES IT! Assist: Pau LaVine
Score: 64-75

[02:41] Team_014 possession (Score: 64-75)
DeMar Adebayo attempts a Layup. BLOCKED BY PAU LAVINE! Ball is loose! Offensive rebound by DeMar Adebayo! DeMar Adebayo kicks it out.

[02:30] Team_014 possession (Score: 64-75)
Ayo Murray attempts a 3Pt. Contested by Pau LaVine (3.2 feet, ZONE). Ayo Murray misses. Rebound secured by Chris Mobley.

[02:16] Team_100 possession (Score: 64-75)
Luka Green drives, DeMar Adebayo stays with him. Luka Green attempts a Layup. Contested by DeMar Adebayo (4.9 feet, ZONE). Luka Green misses. Offensive rebound by Pau LaVine! Pau LaVine kicks it out.

[02:00] Team_100 possession (Score: 64-75)
Manu Ball attempts a 3Pt. Contested by Jordan Anunoby (2.1 feet, ZONE). Manu Ball misses. Rebound secured by Ayo Murray.

[01:46] Team_014 possession (Score: 64-75)
Ayo Murray drives and kicks out. Lamelo Simmons attempts a Midrange. Contested by Tyler Griffin (4.9 feet, MAN). LAMELO SIMMONS MAKES IT!
Score: 66-75

[01:32] Team_100 possession (Score: 66-75)
Tyler Griffin drives to the basket... Tyler Griffin throws a bad pass! Stolen by Lamelo Simmons! TURNOVER! (live ball)

[01:15] Team_014 possession (Score: 66-75)
Ayo Murray attempts a 3Pt. Wide open! Luka Green is 6.1 feet away. [ZONE] Ayo Murray misses. Rebound secured by Tyler Griffin.

[00:59] Team_100 possession (Score: 66-75)
Chris Mobley attempts a Midrange. Contested by Ayo Murray (5.5 feet, ZONE). CHRIS MOBLEY MAKES IT! Assist: Pau LaVine
Score: 66-77

[00:43] Team_014 possession (Score: 66-77)
Jordan Anunoby attempts a 3Pt. Contested by Manu Ball (4.6 feet, MAN). JORDAN ANUNOBY MAKES IT! Assist: Ayo Murray
Score: 69-77

[00:28] Team_100 possession (Score: 69-77)
Tyler Griffin attempts a Layup. Heavily contested by DeMar Adebayo (1.1 feet, ZONE)! TYLER GRIFFIN MAKES IT! Assist: Pau LaVine
Score: 69-79

[00:14] Team_014 possession (Score: 69-79)
DeMar Adebayo attempts a 3Pt. Wide open! Luka Green is 9.1 feet away. [ZONE] DEMAR ADEBAYO MAKES IT! Assist: Michael Cunningham
Score: 72-79

================================================================================
                              3RD QUARTER COMPLETE                              
================================================================================

3RD QUARTER SCORE: Team_014 25, Team_100 23

BOX SCORE:
================================================================================

Team_014
--------------------------------------------------------------------------------
Player                MIN  PTS  REB  AST  TO      FG   FG%      3P   3P%
--------------------------------------------------------------------------------
Ayo Murray             25    8    5    1   0   3/7    42.9     0/0   0.0
DeMar Adebayo          25    7    3    1   0   3/6    50.0     0/0   0.0
Lamelo Simmons         25    7    0    0   0   3/4    75.0     0/0   0.0
Jordan Anunoby         25    3    0    0   0   1/4    25.0     0/0   0.0
Michael Cunningham     25    0    2    1   0   0/1     0.0     0/0   0.0

TEAM: FG: 10/22 (45.5%), 3PT: 2/7 (28.6%), REB: 10 (3 off, 7 def), AST: 3, TO: 1
TEAM FOULS: 1


Team_100
--------------------------------------------------------------------------------
Player                MIN  PTS  REB  AST  TO      FG   FG%      3P   3P%
--------------------------------------------------------------------------------
Pau LaVine             25    7    4    4   0   3/4    75.0     0/0   0.0
Tyler Griffin          25    5    5    1   0   2/3    66.7     0/0   0.0
Chris Mobley           25    4    5    1   0   2/5    40.0     0/0   0.0
Manu Ball              25    4    0    1   0   2/4    50.0     0/0   0.0
Luka Green             25    3    0    1   0   1/2    50.0     0/0   0.0

TEAM: FG: 10/18 (55.6%), 3PT: 3/6 (50.0%), REB: 14 (2 off, 12 def), AST: 8, TO: 4
TEAM FOULS: 4

================================================================================

================================================================================
                       4TH QUARTER - Team_014 vs Team_100                       
================================================================================

[12:00] Team_014 possession (Score: 72-79)
Jordan Anunoby attempts a Midrange. Wide open! Manu Ball is 8.5 feet away. [ZONE] JORDAN ANUNOBY MAKES IT! Assist: Michael Cunningham
Score: 74-79

[11:45] Team_100 possession (Score: 74-79)
Manu Ball drives and kicks out. Manu Ball attempts a 3Pt. Wide open! Jordan Anunoby is 7.8 feet away. [MAN] Manu Ball misses. Rebound secured by Michael Cunningham.

[11:30] Team_014 possession (Score: 74-79)
DeMar Adebayo drives and kicks out. DeMar Adebayo attempts a Midrange. Wide open! Pau LaVine is 8.0 feet away. [MAN] DeMar Adebayo misses. Offensive rebound by Ayo Murray! Ayo Murray kicks it out.

[11:13] Team_014 possession (Score: 74-79)
DeMar Adebayo attempts a Layup. BLOCKED BY PAU LAVINE! Ball is loose! Offensive rebound by Ayo Murray! Ayo Murray kicks it out.

[10:58] Team_014 possession (Score: 74-79)
Lamelo Simmons attempts a 3Pt. Wide open! Luka Green is 7.8 feet away. [ZONE] Lamelo Simmons misses. Rebound secured by Pau LaVine.

[10:46] Team_100 possession (Score: 74-79)
Manu Ball attempts a 3Pt. Contested by Jordan Anunoby (5.4 feet, MAN). Manu Ball misses. Rebound secured by Michael Cunningham.

[10:32] Team_014 possession (Score: 74-79)
FOUL! Holding foul on Tyler Griffin. [Team fouls: 1] No free throws, side out. (Tyler Griffin: 1 personal fouls)

[10:14] Team_014 possession (Score: 74-79)
DeMar Adebayo attempts a Layup. Contested by Pau LaVine (3.9 feet, ZONE). DEMAR ADEBAYO MAKES IT! Assist: Ayo Murray
Score: 76-79

[10:00] Team_100 possession (Score: 76-79)
Luka Green attempts a Midrange. Contested by Jordan Anunoby (3.9 feet, ZONE). Luka Green misses. FOUL! Loose ball foul on Michael Cunningham during the rebound battle. [Team fouls: 1] No free throws, side out. (Michael Cunningham: 1 personal fouls)

[09:44] Team_100 possession (Score: 76-79)
Luka Green attempts a 3Pt. Contested by Michael Cunningham (4.3 feet, MAN). Luka Green misses. Offensive rebound by Pau LaVine! Pau LaVine kicks it out.

[09:30] Team_100 possession (Score: 76-79)
Pau LaVine drives, picks up Ayo Murray. Help arrives from Michael Cunningham! Pau LaVine attempts a Layup. Contested by Michael Cunningham (3.8 feet, ZONE). Pau LaVine misses. Rebound secured by DeMar Adebayo.

[09:15] Team_014 possession (Score: 76-79)
Michael Cunningham throws a bad pass out of bounds! TURNOVER! (dead ball)

[09:15] Substitution (Team_014): Michael Cunningham OUT → Jalen Booker IN (stamina_rule2)

[09:15] Substitution (Team_014): Jordan Anunoby OUT → Bones Quickley IN (stamina_rule2)

[09:15] Substitution (Team_014): Lamelo Simmons OUT → Tracy Westbrook IN (stamina_rule2)

[09:15] Substitution (Team_014): DeMar Adebayo OUT → Nikola James IN (stamina_rule2)

[09:15] Substitution (Team_014): Ayo Murray OUT → Collin Gasol IN (stamina_rule2)

[09:15] Substitution (Team_100): Luka Green OUT → Dirk Sabonis IN (stamina_rule2)

[09:15] Substitution (Team_100): Manu Ball OUT → Evan Butler IN (stamina_rule2)

[09:15] Substitution (Team_100): Tyler Griffin OUT → Tyrese Wade IN (stamina_rule2)

[09:15] Substitution (Team_100): Pau LaVine OUT → Carmelo Ginobili IN (stamina_rule2)

[09:15] Substitution (Team_100): Chris Mobley OUT → John Rozier IN (stamina_rule2)

[09:01] Team_100 possession (Score: 76-79)
Evan Butler attempts a 3Pt. Contested by Jalen Booker (5.8 feet, ZONE). Evan Butler misses. Rebound secured by Nikola James.

[08:43] Team_014 possession (Score: 76-79)
Tracy Westbrook attempts a 3Pt. Contested by Tyrese Wade (4.6 feet, MAN). Tracy Westbrook misses. Rebound secured by Carmelo Ginobili.

[08:29] Team_100 possession (Score: 76-79)
Tyrese Wade drives, Tracy Westbrook stays with him. Tyrese Wade attempts a Layup. Heavily contested by Tracy Westbrook (1.9 feet, MAN)! Tyrese Wade misses. Offensive rebound by John Rozier! John Rozier puts it back in!
Score: 76-81

[08:19] Team_014 possession (Score: 76-81)
Jalen Booker drives, Dirk Sabonis stays with him. Jalen Booker attempts a Layup. Wide open! Dirk Sabonis is 6.9 feet away. [MAN] JALEN BOOKER MAKES IT! Assist: Tracy Westbrook
Score: 78-81

[08:05] Team_100 possession (Score: 78-81)
Tyrese Wade attempts a 3Pt. Contested by Tracy Westbrook (4.9 feet, MAN). TYRESE WADE MAKES IT! Assist: Evan Butler
Score: 78-84

[07:50] Team_014 possession (Score: 78-84)
Bones Quickley commits a violation (traveling/carry)! TURNOVER! (dead ball)

[07:36] Team_100 possession (Score: 78-84)
Dirk Sabonis drives to the basket... Dirk Sabonis throws a bad pass out of bounds! TURNOVER! (dead ball)

[07:22] Team_014 possession (Score: 78-84)
Tracy Westbrook attempts a Midrange. Contested by Carmelo Ginobili (3.4 feet, ZONE). TRACY WESTBROOK MAKES IT!
Score: 80-84

[07:11] Team_100 possession (Score: 80-84)
Evan Butler drives and kicks out. John Rozier attempts a 3Pt. Wide open! Collin Gasol is 8.5 feet away. [MAN] John Rozier misses. Offensive rebound by John Rozier! John Rozier puts it back in!
Score: 80-86

[07:02] Team_014 possession (Score: 80-86)
Collin Gasol drives, John Rozier stays with him. Collin Gasol attempts a Layup. Contested by John Rozier (4.4 feet, MAN). Collin Gasol misses. Rebound secured by John Rozier.

[06:43] Team_100 possession (Score: 80-86)
Dirk Sabonis attempts a Midrange. Wide open! Bones Quickley is 8.8 feet away. [ZONE] Dirk Sabonis misses. Rebound secured by Nikola James.

[06:24] Team_014 possession (Score: 80-86)
Nikola James attempts a 3Pt. Contested by Carmelo Ginobili (4.6 feet, MAN). NIKOLA JAMES MAKES IT! Assist: Bones Quickley
Score: 83-86

[06:12] Team_100 possession (Score: 83-86)
Tyrese Wade drives and kicks out. Carmelo Ginobili attempts a 3Pt. Contested by Nikola James (3.1 feet, MAN). CARMELO GINOBILI MAKES IT! Assist: John Rozier
Score: 83-89

[05:57] Team_014 possession (Score: 83-89)
FOUL! Offensive foul on Tracy Westbrook! Tyrese Wade drew the charge! [Team fouls: 2] (Tracy Westbrook: 1 personal fouls) TURNOVER! (dead ball)

[05:45] Team_100 possession (Score: 83-89)
John Rozier attempts a 3Pt. Contested by Collin Gasol (4.6 feet, MAN). John Rozier misses. Rebound secured by Nikola James.

[05:33] Team_014 possession (Score: 83-89)
Collin Gasol attempts a Layup. Contested by John Rozier (4.3 feet, MAN). COLLIN GASOL MAKES IT! Assist: Jalen Booker
Score: 85-89

[05:20] Team_100 possession (Score: 85-89)
John Rozier attempts a 3Pt. Wide open! Jalen Booker is 8.0 feet away. [ZONE] JOHN ROZIER MAKES IT! Assist: Tyrese Wade
Score: 85-92

[05:09] Team_014 possession (Score: 85-92)
Nikola James attempts a 3Pt. Wide open! Tyrese Wade is 6.6 feet away. [ZONE] Nikola James misses. Rebound secured by Carmelo Ginobili.

[04:58] Team_100 possession (Score: 85-92)
FOUL! Holding foul on Nikola James. [Team fouls: 3] No free throws, side out. (Nikola James: 1 personal fouls)

[04:47] Team_100 possession (Score: 85-92)
John Rozier attempts a Layup. Contested by Collin Gasol (4.9 feet, ZONE). JOHN ROZIER MAKES IT! Assist: Dirk Sabonis
Score: 85-94

[04:33] Team_014 possession (Score: 85-94)
Bones Quickley attempts a Midrange. Wide open! Evan Butler is 8.2 feet away. [MAN] BONES QUICKLEY MAKES IT!
Score: 87-94

[04:19] Team_100 possession (Score: 87-94)
John Rozier attempts a Layup. BLOCKED BY COLLIN GASOL! Ball deflects out of bounds off John Rozier.

[04:02] Team_014 possession (Score: 87-94)
Bones Quickley throws a bad pass out of bounds! TURNOVER! (dead ball)

[03:50] Team_100 possession (Score: 87-94)
Dirk Sabonis drives to the basket... Dirk Sabonis throws a bad pass! Stolen by Jalen Booker! TURNOVER! (live ball)

[03:34] Team_014 possession (Score: 87-94)
Nikola James attempts a 3Pt. Contested by Carmelo Ginobili (5.2 feet, MAN). Nikola James misses. Rebound secured by Carmelo Ginobili.

[03:21] Team_100 possession (Score: 87-94)
Dirk Sabonis attempts a 3Pt. Contested by Jalen Booker (5.7 feet, MAN). Dirk Sabonis misses. Rebound secured by Collin Gasol.

[03:04] Team_014 possession (Score: 87-94)
Bones Quickley attempts a Layup. Contested by Evan Butler (5.1 feet, MAN). BONES QUICKLEY MAKES IT!
Score: 89-94

[02:47] Team_100 possession (Score: 89-94)
Evan Butler attempts a 3Pt. Wide open! Bones Quickley is 9.2 feet away. [MAN] Evan Butler misses. Rebound secured by Nikola James.

[02:30] Team_014 possession (Score: 89-94)
Collin Gasol drives, John Rozier stays with him. Collin Gasol attempts a Dunk. Contested by John Rozier (3.5 feet, MAN). COLLIN GASOL MAKES IT! Assist: Tracy Westbrook
Score: 91-94

[02:17] Team_100 possession (Score: 91-94)
Tyrese Wade throws a bad pass! Stolen by Tracy Westbrook! TURNOVER! (live ball)

[02:05] Team_014 possession (Score: 91-94)
Tracy Westbrook attempts a 3Pt. Contested by Tyrese Wade (2.8 feet, ZONE). TRACY WESTBROOK MAKES IT! Assist: Bones Quickley
Score: 94-94

[01:56] Team_100 possession (Score: 94-94)
FOUL! Shooting foul on Jalen Booker. John Rozier to the line for 2 free throws. [Team fouls: 4] (Jalen Booker: 1 personal fouls)   FT 1/2: MISS   FT 2/2: GOOD John Rozier makes 1/2 from the line.
Score: 94-95

[01:38] Team_014 possession (Score: 94-95)
Collin Gasol attempts a Layup. BLOCKED BY JOHN ROZIER! Ball goes out off John Rozier. Collin Gasol's ball!

[01:24] Team_014 possession (Score: 94-95)
Collin Gasol attempts a Layup. Contested by John Rozier (5.9 feet, ZONE). Collin Gasol misses. Offensive rebound by Nikola James! Nikola James kicks it out.

[01:05] Team_014 possession (Score: 94-95)
Bones Quickley attempts a 3Pt. Contested by Evan Butler (4.5 feet, MAN). Bones Quickley misses. Rebound secured by Tyrese Wade.

[00:50] Team_100 possession (Score: 94-95)
Tyrese Wade attempts a 3Pt. Contested by Tracy Westbrook (4.4 feet, MAN). Tyrese Wade misses. Rebound secured by Collin Gasol.

[00:34] Team_014 possession (Score: 94-95)
Nikola James attempts a 3Pt. Contested by Tyrese Wade (4.7 feet, ZONE). Nikola James misses. Rebound secured by Tyrese Wade.

[00:18] Team_100 possession (Score: 94-95)
FOUL! Shooting foul on Nikola James. Carmelo Ginobili to the line for 2 free throws. [BONUS: 5 team fouls] (Nikola James: 2 personal fouls)   FT 1/2: GOOD   FT 2/2: GOOD Carmelo Ginobili makes 2/2 from the line.
Score: 94-97

[00:07] Team_014 possession (Score: 94-97)
Jalen Booker drives, picks up Dirk Sabonis. Help arrives from Tyrese Wade! Jalen Booker attempts a Dunk. Contested by Tyrese Wade (3.8 feet, MAN). JALEN BOOKER MAKES IT! Assist: Collin Gasol
Score: 96-97

================================================================================
                              4TH QUARTER COMPLETE                              
================================================================================

4TH QUARTER SCORE: Team_014 24, Team_100 18

BOX SCORE:
================================================================================

Team_014
--------------------------------------------------------------------------------
Player                MIN  PTS  REB  AST  TO      FG   FG%      3P   3P%
--------------------------------------------------------------------------------
Tracy Westbrook        20    5    0    2   0   2/3    66.7     0/0   0.0
Jalen Booker           20    4    0    1   0   2/2   100.0     0/0   0.0
Collin Gasol           20    4    2    1   0   2/3    66.7     0/0   0.0
Bones Quickley         20    4    0    2   0   2/3    66.7     0/0   0.0
Nikola James           20    3    5    0   0   1/4    25.0     0/0   0.0
Jordan Anunoby         28    2    0    0   0   1/1   100.0     0/0   0.0
DeMar Adebayo          28    2    1    0   0   1/1   100.0     0/0   0.0
Michael Cunningham     28    0    2    1   0   0/0     0.0     0/0   0.0
Ayo Murray             28    0    2    1   0   0/0     0.0     0/0   0.0
Lamelo Simmons         28    0    0    0   0   0/1     0.0     0/0   0.0

TEAM: FG: 11/18 (61.1%), 3PT: 2/8 (25.0%), REB: 12 (3 off, 9 def), AST: 8, TO: 4
TEAM FOULS: 5 [Team_100 in BONUS]


Team_100
--------------------------------------------------------------------------------
Player                MIN  PTS  REB  AST  TO      FG   FG%      3P   3P%
--------------------------------------------------------------------------------
John Rozier            20   10    3    1   0   5/7    71.4     0/0   0.0
Carmelo Ginobili       20    5    3    0   0   2/2   100.0     0/0   0.0
Tyrese Wade            20    3    2    1   0   1/2    50.0     0/0   0.0
Manu Ball              28    0    0    0   0   0/2     0.0     0/0   0.0
Pau LaVine             28    0    3    0   0   0/1     0.0     0/0   0.0
Evan Butler            20    0    0    1   0   0/2     0.0     0/0   0.0
Dirk Sabonis           20    0    0    1   0   0/2     0.0     0/0   0.0

TEAM: FG: 8/18 (44.4%), 3PT: 2/8 (25.0%), REB: 11 (4 off, 7 def), AST: 4, TO: 3
TEAM FOULS: 1

================================================================================

================================================================================
                               FULL GAME COMPLETE                               
================================================================================

FINAL SCORE: Team_014 96, Team_100 97

SCORING BY QUARTER:
--------------------------------------------------------------------------------
Team                     Q1     Q2     Q3     Q4    FINAL
--------------------------------------------------------------------------------
Team_014                 28     19     25     24       96
Team_100                 28     28     23     18       97
--------------------------------------------------------------------------------

FULL GAME BOX SCORE:
================================================================================

Team_014
--------------------------------------------------------------------------------
Player                MIN  PTS  REB  AST  TO      FG   FG%      3P   3P%      FT STL BLK
--------------------------------------------------------------------------------
Michael Cunningham     28    7    6    3   1   3/4    75.0   1/1   100.0   0/0     1   0
Jordan Anunoby         28    9    0    0   0   4/9    44.4   1/6    16.7   0/0     0   0
Lamelo Simmons         28   13    0    1   3   4/8    50.0   1/3    33.3   2/2     2   0
DeMar Adebayo          28   15   11    2   2   7/10   70.0   1/1   100.0   0/0     2   0
Ayo Murray             28   13   10    4   0   6/14   42.9   1/3    33.3   2/2     0   1
Jalen Booker           20    9    0    2   0   4/9    44.4   0/2     0.0   1/1     1   0
Bones Quickley         20    7    0    3   2   5/8    62.5   1/3    33.3   1/1     0   0
Tracy Westbrook        20    5    1    2   1   3/6    50.0   1/3    33.3   0/0     1   0
Nikola James           20    8   10    0   1   2/6    33.3   2/5    40.0   0/0     0   0
Collin Gasol           20   10   10    1   0   3/4    75.0   0/0     0.0   0/0     1   1

TEAM: FG: 41/78 (52.6%), 3PT: 9/27 (33.3%), REB: 48 (14 off, 34 def), AST: 18, TO: 10


Team_100
--------------------------------------------------------------------------------
Player                MIN  PTS  REB  AST  TO      FG   FG%      3P   3P%      FT STL BLK
--------------------------------------------------------------------------------
Luka Green             28   18    0    2   1   5/7    71.4   3/4    75.0   3/3     0   0
Manu Ball              28   11    0    2   1   5/11   45.5   1/6    16.7   0/0     0   1
Tyler Griffin          28    5    7    2   2   2/6    33.3   1/4    25.0   0/1     0   0
Pau LaVine             28    9   11    7   1   5/10   50.0   1/4    25.0   0/0     1   3
Chris Mobley           28    8   10    2   1   4/7    57.1   0/0     0.0   0/0     0   0
Dirk Sabonis           20    9    0    3   0   3/7    42.9   2/5    40.0   1/1     0   0
Evan Butler            20    3    0    2   1   2/4    50.0   1/3    33.3   0/0     0   0
Tyrese Wade            20    5    5    2   3   4/9    44.4   1/4    25.0   0/0     0   0
Carmelo Ginobili       20   14    7    1   0   4/5    80.0   2/2   100.0   3/3     0   0
John Rozier            20   13    6    1   1   4/8    50.0   2/4    50.0   1/2     0   1

TEAM: FG: 38/74 (51.4%), 3PT: 14/36 (38.9%), REB: 46 (9 off, 37 def), AST: 24, TO: 11

================================================================================
