================================================================================
                        FULL GAME - Team_095 vs Team_039                        
================================================================================

================================================================================
                       1ST QUARTER - Team_095 vs Team_039                       
================================================================================

[12:00] Team_095 possession (Score: 0-0)
Evan Carter attempts a 3Pt. Contested by Austin O'Neal (5.4 feet, MAN). EVAN CARTER MAKES IT!
Score: 3-0

[11:46] Team_039 possession (Score: 3-0)
Donovan Markkanen makes the Dunk and draws the foul on Shaquille Ball! And-1! Donovan Markkanen to the line for 1. [Team fouls: 1] (Shaquille Ball: 1 personal fouls)   FT 1/1: GOOD Donovan Markkanen makes 1/1 from the line.
Score: 3-3

[11:33] Team_095 possession (Score: 3-3)
Kyrie Ming drives and kicks out. Immanuel Middleton attempts a 3Pt. Contested by Klay Wade (2.4 feet, MAN). Immanuel Middleton misses. Offensive rebound by Dejounte Hyland! Dejounte Hyland kicks it out.

[11:16] Team_095 possession (Score: 3-3)
Dejounte Hyland attempts a 3Pt. Heavily contested by Jrue Bridges (1.4 feet, ZONE)! DEJOUNTE HYLAND MAKES IT! Assist: Kyrie Ming
Score: 6-3

[11:04] Team_039 possession (Score: 6-3)
Jrue Bridges attempts a 3Pt. Contested by Dejounte Hyland (4.2 feet, ZONE). Jrue Bridges misses. Rebound secured by Dejounte Hyland.

[10:50] Team_095 possession (Score: 6-3)
Dejounte Hyland attempts a 3Pt. Contested by Jrue Bridges (5.1 feet, MAN). Dejounte Hyland misses. Rebound secured by Donovan Markkanen.

[10:35] Team_039 possession (Score: 6-3)
Anfernee Carter drives and kicks out. Jrue Bridges attempts a 3Pt. Wide open! Dejounte Hyland is 10.0 feet away. [MAN] Jrue Bridges misses. Offensive rebound by Klay Wade! Klay Wade kicks it out.

[10:22] Team_039 possession (Score: 6-3)
Donovan Markkanen attempts a 3Pt. Contested by Evan Carter (3.9 feet, ZONE). DONOVAN MARKKANEN MAKES IT! Assist: Klay Wade
Score: 6-6

[10:09] Team_095 possession (Score: 6-6)
Kyrie Ming drives and kicks out. Immanuel Middleton attempts a 3Pt. Contested by Jrue Bridges (2.6 feet, ZONE). IMMANUEL MIDDLETON MAKES IT! Assist: Dejounte Hyland
Score: 9-6

[09:51] Team_039 possession (Score: 9-6)
Donovan Markkanen attempts a 3Pt. Contested by Evan Carter (4.0 feet, ZONE). Donovan Markkanen misses. Rebound secured by Evan Carter.

[09:40] Team_095 possession (Score: 9-6)
FOUL! Offensive foul on Evan Carter! Austin O'Neal drew the charge! [Team fouls: 2] (Evan Carter: 1 personal fouls) TURNOVER! (dead ball)

[09:26] Team_039 possession (Score: 9-6)
Austin O'Neal attempts a 3Pt. Contested by Evan Carter (2.5 feet, ZONE). Austin O'Neal misses. Rebound secured by Shaquille Ball.

[09:09] Team_095 possession (Score: 9-6)
FOUL! Shooting foul on Klay Wade. Kyrie Ming to the line for 2 free throws. [Team fouls: 1] (Klay Wade: 1 personal fouls)   FT 1/2: MISS   FT 2/2: GOOD Kyrie Ming makes 1/2 from the line.
Score: 10-6

[08:58] Team_039 possession (Score: 10-6)
Austin O'Neal drives and kicks out. Jrue Bridges attempts a 3Pt. Contested by Dejounte Hyland (4.5 feet, MAN). JRUE BRIDGES MAKES IT! Assist: Donovan Markkanen
Score: 10-9

[08:45] Team_095 possession (Score: 10-9)
Shaquille Ball attempts a 3Pt. Contested by Jrue Bridges (4.6 feet, ZONE). SHAQUILLE BALL MAKES IT! Assist: Immanuel Middleton
Score: 13-9

[08:34] Team_039 possession (Score: 13-9)
Austin O'Neal attempts a Midrange. Contested by Shaquille Ball (5.6 feet, ZONE). Austin O'Neal misses. Rebound secured by Dejounte Hyland.

[08:21] Team_095 possession (Score: 13-9)
Kyrie Ming drives, Klay Wade stays with him. Kyrie Ming attempts a Layup. Heavily contested by Klay Wade (0.5 feet, MAN)! KYRIE MING MAKES IT! Assist: Shaquille Ball
Score: 15-9

[08:04] Team_039 possession (Score: 15-9)
FOUL! Offensive foul on Anfernee Carter! Immanuel Middleton drew the charge! [Team fouls: 2] (Anfernee Carter: 1 personal fouls) TURNOVER! (dead ball)

[07:49] Team_095 possession (Score: 15-9)
FOUL! Reach-in foul on Donovan Markkanen during the drive. [Team fouls: 3] No free throws, side out. (Donovan Markkanen: 1 personal fouls)

[07:35] Team_095 possession (Score: 15-9)
Immanuel Middleton attempts a Layup. Contested by Klay Wade (5.2 feet, MAN). IMMANUEL MIDDLETON MAKES IT! Assist: Kyrie Ming
Score: 17-9

[07:21] Team_039 possession (Score: 17-9)
Donovan Markkanen attempts a 3Pt. Contested by Shaquille Ball (4.3 feet, MAN). Donovan Markkanen misses. Rebound secured by Dejounte Hyland.

[07:06] Team_095 possession (Score: 17-9)
Shaquille Ball attempts a 3Pt. Wide open! Donovan Markkanen is 6.2 feet away. [MAN] SHAQUILLE BALL MAKES IT! Assist: Kyrie Ming
Score: 20-9

[06:51] Team_039 possession (Score: 20-9)
Jrue Bridges drives and kicks out. Austin O'Neal attempts a 3Pt. Heavily contested by Evan Carter (1.5 feet, ZONE)! Austin O'Neal misses. Rebound secured by Shaquille Ball.

[06:41] Team_095 possession (Score: 20-9)
Shaquille Ball drives to the basket... Shaquille Ball loses the ball! Stripped by Donovan Markkanen! TURNOVER! (live ball)

[06:26] Team_039 possession (Score: 20-9)
FOUL! Shooting foul on Shaquille Ball. Klay Wade to the line for 2 free throws. [Team fouls: 3] (Shaquille Ball: 2 personal fouls)   FT 1/2: GOOD   FT 2/2: GOOD Klay Wade makes 2/2 from the line.
Score: 20-11

[06:14] Team_095 possession (Score: 20-11)
FOUL! Offensive foul on Dejounte Hyland! Jrue Bridges drew the charge! [Team fouls: 4] (Dejounte Hyland: 1 personal fouls) TURNOVER! (dead ball)

[06:02] Team_039 possession (Score: 20-11)
Jrue Bridges attempts a 3Pt. Contested by Evan Carter (4.5 feet, ZONE). JRUE BRIDGES MAKES IT! Assist: Austin O'Neal
Score: 20-14

[05:45] Team_095 possession (Score: 20-14)
FOUL! Reach-in foul on Klay Wade during the drive. [Team fouls: 4] No free throws, side out. (Klay Wade: 2 personal fouls)

[05:25] Team_095 possession (Score: 20-14)
Kyrie Ming attempts a Midrange. Contested by Klay Wade (3.3 feet, MAN). KYRIE MING MAKES IT!
Score: 22-14

[05:11] Team_039 possession (Score: 22-14)
Jrue Bridges drives to the basket... Jrue Bridges loses the ball! Stripped by Dejounte Hyland! TURNOVER! (live ball)

[04:55] Team_095 possession (Score: 22-14)
Evan Carter attempts a 3Pt. Contested by Jrue Bridges (3.3 feet, ZONE). Evan Carter misses. Rebound secured by Klay Wade.

[04:39] Team_039 possession (Score: 22-14)
Jrue Bridges attempts a 3Pt. Contested by Immanuel Middleton (5.3 feet, ZONE). JRUE BRIDGES MAKES IT! Assist: Klay Wade
Score: 22-17

[04:22] Team_095 possession (Score: 22-17)
Dejounte Hyland attempts a Midrange. Contested by Donovan Markkanen (2.3 feet, ZONE). DEJOUNTE HYLAND MAKES IT! Assist: Evan Carter
Score: 24-17

[04:08] Team_039 possession (Score: 24-17)
Jrue Bridges attempts a 3Pt. Contested by Evan Carter (4.5 feet, ZONE). JRUE BRIDGES MAKES IT! Assist: Donovan Markkanen
Score: 24-20

[03:50] Team_095 possession (Score: 24-20)
Shaquille Ball attempts a Layup. Contested by Klay Wade (3.5 feet, ZONE). Shaquille Ball misses. Rebound secured by Donovan Markkanen.

[03:35] Team_039 possession (Score: 24-20)
Klay Wade attempts a Midrange. Wide open! Kyrie Ming is 10.0 feet away. [MAN] KLAY WADE MAKES IT! Assist: Donovan Markkanen
Score: 24-22

[03:22] Team_095 possession (Score: 24-22)
Shaquille Ball attempts a 3Pt. Contested by Jrue Bridges (6.0 feet, ZONE). Shaquille Ball misses. Rebound secured by Austin O'Neal.

[03:10] Team_039 possession (Score: 24-22)
Anfernee Carter attempts a 3Pt. Contested by Evan Carter (4.9 feet, ZONE). ANFERNEE CARTER MAKES IT! Assist: Klay Wade
Score: 24-25

[02:54] Team_095 possession (Score: 24-25)
Evan Carter attempts a 3Pt. Wide open! Austin O'Neal is 6.8 feet away. [MAN] EVAN CARTER MAKES IT! Assist: Kyrie Ming
Score: 27-25

[02:36] Team_039 possession (Score: 27-25)
Jrue Bridges attempts a Layup. Contested by Immanuel Middleton (3.8 feet, ZONE). JRUE BRIDGES MAKES IT!
Score: 27-27

[02:20] Team_095 possession (Score: 27-27)
Immanuel Middleton attempts a 3Pt. Contested by Jrue Bridges (3.4 feet, ZONE). IMMANUEL MIDDLETON MAKES IT! Assist: Evan Carter
Score: 30-27

[02:08] Team_039 possession (Score: 30-27)
Austin O'Neal makes the Layup and draws the foul on Immanuel Middleton! And-1! Austin O'Neal to the line for 1. [BONUS: 5 team fouls] (Immanuel Middleton: 1 personal fouls)   FT 1/1: GOOD Austin O'Neal makes 1/1 from the line.
Score: 30-30

[01:51] Team_095 possession (Score: 30-30)
Immanuel Middleton drives and kicks out. FOUL! Shooting foul on Austin O'Neal. Evan Carter to the line for 2 free throws. [BONUS: 5 team fouls] (Austin O'Neal: 1 personal fouls)   FT 1/2: GOOD   FT 2/2: GOOD Evan Carter makes 2/2 from the line.
Score: 32-30

[01:35] Team_039 possession (Score: 32-30)
Klay Wade drives, Kyrie Ming stays with him. Klay Wade attempts a Layup. Contested by Kyrie Ming (3.4 feet, MAN). KLAY WADE MAKES IT!
Score: 32-32

[01:18] Team_095 possession (Score: 32-32)
Shaquille Ball drives and kicks out. Evan Carter attempts a Midrange. Contested by Donovan Markkanen (5.0 feet, ZONE). Evan Carter misses. Rebound secured by Donovan Markkanen.

[01:06] Team_039 possession (Score: 32-32)
Austin O'Neal attempts a Layup. Contested by Immanuel Middleton (3.4 feet, ZONE). AUSTIN O'NEAL MAKES IT!
Score: 32-34

[00:49] Team_095 possession (Score: 32-34)
Dejounte Hyland attempts a 3Pt. Wide open! Anfernee Carter is 6.7 feet away. [ZONE] DEJOUNTE HYLAND MAKES IT! Assist: Immanuel Middleton
Score: 35-34

[00:35] Team_039 possession (Score: 35-34)
Anfernee Carter drives and kicks out. Jrue Bridges attempts a 3Pt. Contested by Evan Carter (4.3 feet, ZONE). Jrue Bridges misses. Rebound secured by Dejounte Hyland.

[00:23] Team_095 possession (Score: 35-34)
FOUL! Shooting foul on Klay Wade. Kyrie Ming to the line for 2 free throws. [BONUS: 6 team fouls] (Klay Wade: 3 personal fouls)   FT 1/2: GOOD   FT 2/2: GOOD Kyrie Ming makes 2/2 from the line.
Score: 37-34

[00:13] Team_039 possession (Score: 37-34)
Austin O'Neal drives and kicks out. Anfernee Carter attempts a Midrange. Wide open! Immanuel Middleton is 7.9 feet away. [MAN] Anfernee Carter misses. Rebound secured by Shaquille Ball.

================================================================================
                              1ST QUARTER COMPLETE                              
================================================================================

1ST QUARTER SCORE: Team_095 37, Team_039 34

BOX SCORE:
================================================================================

Team_095
--------------------------------------------------------------------------------
Player                MIN  PTS  REB  AST  TO      FG   FG%      3P   3P%
--------------------------------------------------------------------------------
Evan Carter            12    8    1    2   0   3/4    75.0     0/0   0.0
Dejounte Hyland        12    8    5    1   0   3/4    75.0     0/0   0.0
Immanuel Middleton     12    8    0    2   0   3/3   100.0     0/0   0.0
Kyrie Ming             12    7    0    4   0   4/4   100.0     0/0   0.0
Shaquille Ball         12    6    3    1   0   2/5    40.0     0/0   0.0

TEAM: FG: 15/20 (75.0%), 3PT: 7/10 (70.0%), REB: 9 (1 off, 8 def), AST: 10, TO: 3
TEAM FOULS: 5 [Team_039 in BONUS]


Team_039
--------------------------------------------------------------------------------
Player                MIN  PTS  REB  AST  TO      FG   FG%      3P   3P%
--------------------------------------------------------------------------------
Jrue Bridges           12   14    0    0   0   5/7    71.4     0/0   0.0
Donovan Markkanen      12    6    3    3   0   2/4    50.0     0/0   0.0
Klay Wade              12    6    2    3   0   3/3   100.0     0/0   0.0
Austin O'Neal          12    5    1    1   0   2/5    40.0     0/0   0.0
Anfernee Carter        12    3    0    0   0   1/2    50.0     0/0   0.0

TEAM: FG: 13/21 (61.9%), 3PT: 5/9 (55.6%), REB: 6 (1 off, 5 def), AST: 7, TO: 2
TEAM FOULS: 6 [Team_095 in BONUS]

================================================================================

================================================================================
                       2ND QUARTER - Team_095 vs Team_039                       
================================================================================

[12:00] Team_095 possession (Score: 37-34)
Immanuel Middleton attempts a 3Pt. Heavily contested by Klay Wade (1.9 feet, MAN)! IMMANUEL MIDDLETON MAKES IT! Assist: Kyrie Ming
Score: 40-34

[11:48] Team_039 possession (Score: 40-34)
Jrue Bridges drives and kicks out. Klay Wade attempts a 3Pt. Contested by Evan Carter (5.5 feet, ZONE). Klay Wade misses. Offensive rebound by Austin O'Neal! Austin O'Neal kicks it out.

[11:34] Team_039 possession (Score: 40-34)
Donovan Markkanen drives to the basket... Donovan Markkanen throws a bad pass out of bounds! TURNOVER! (dead ball)

[11:34] Substitution (Team_095): Dejounte Hyland OUT → Kyle Poole IN (stamina_rule2)

[11:34] Substitution (Team_095): Shaquille Ball OUT → Cade Beal IN (stamina_rule2)

[11:34] Substitution (Team_095): Evan Carter OUT → Tobias Wagner IN (stamina_rule2)

[11:34] Substitution (Team_095): Immanuel Middleton OUT → Gary Davis IN (stamina_rule2)

[11:34] Substitution (Team_095): Kyrie Ming OUT → DeMar McCollum IN (stamina_rule2)

[11:34] Substitution (Team_039): Jrue Bridges OUT → Tracy Mitchell IN (stamina_rule2)

[11:34] Substitution (Team_039): Donovan Markkanen OUT → Jayson Cunningham IN (stamina_rule2)

[11:34] Substitution (Team_039): Austin O'Neal OUT → Yao Carter IN (stamina_rule2)

[11:34] Substitution (Team_039): Anfernee Carter OUT → Victor Gasol IN (stamina_rule2)

[11:34] Substitution (Team_039): Klay Wade OUT → Bam Booker IN (stamina_rule2)

[11:22] Team_095 possession (Score: 40-34)
Cade Beal attempts a 3Pt. Wide open! Jayson Cunningham is 7.0 feet away. [MAN] CADE BEAL MAKES IT! Assist: Gary Davis
Score: 43-34

[11:03] Team_039 possession (Score: 43-34)
Tracy Mitchell drives and kicks out. Yao Carter attempts a 3Pt. Contested by Tobias Wagner (4.6 feet, MAN). Yao Carter misses. Offensive rebound by Yao Carter! Yao Carter kicks it out.

[10:50] Team_039 possession (Score: 43-34)
Tracy Mitchell drives and kicks out. Victor Gasol attempts a 3Pt. Contested by Cade Beal (5.6 feet, ZONE). VICTOR GASOL MAKES IT! Assist: Bam Booker
Score: 43-37

[10:31] Team_095 possession (Score: 43-37)
Gary Davis drives and kicks out. Cade Beal attempts a Midrange. Wide open! Jayson Cunningham is 6.3 feet away. [MAN] CADE BEAL MAKES IT!
Score: 45-37

[10:20] Team_039 possession (Score: 45-37)
Yao Carter drives, Tobias Wagner stays with him. Yao Carter attempts a Layup. Wide open! Tobias Wagner is 6.7 feet away. [MAN] YAO CARTER MAKES IT! Assist: Tracy Mitchell
Score: 45-39

[10:11] Team_095 possession (Score: 45-39)
Kyle Poole attempts a Layup. Heavily contested by Tracy Mitchell (1.5 feet, MAN)! KYLE POOLE MAKES IT! Assist: Tobias Wagner
Score: 47-39

[09:57] Team_039 possession (Score: 47-39)
Tracy Mitchell attempts a Layup. Contested by Kyle Poole (2.9 feet, MAN). TRACY MITCHELL MAKES IT! Assist: Victor Gasol
Score: 47-41

[09:45] Team_095 possession (Score: 47-41)
Cade Beal drives, Victor Gasol stays with him. Cade Beal attempts a Dunk. Heavily contested by Victor Gasol (1.7 feet, ZONE)! CADE BEAL MAKES IT!
Score: 49-41

[09:31] Team_039 possession (Score: 49-41)
Yao Carter loses the ball! Stripped by Tobias Wagner! TURNOVER! (live ball)

[09:16] Team_095 possession (Score: 49-41)
Kyle Poole attempts a 3Pt. Wide open! Tracy Mitchell is 9.2 feet away. [MAN] Kyle Poole misses. Rebound secured by Victor Gasol.

[09:04] Team_039 possession (Score: 49-41)
Yao Carter attempts a 3Pt. Wide open! Tobias Wagner is 7.7 feet away. [MAN] Yao Carter misses. Rebound secured by Tobias Wagner.

[08:47] Team_095 possession (Score: 49-41)
Tobias Wagner attempts a 3Pt. Contested by Tracy Mitchell (5.5 feet, ZONE). Tobias Wagner misses. Rebound secured by Victor Gasol.

[08:34] Team_039 possession (Score: 49-41)
FOUL! Reach-in foul on DeMar McCollum during the drive. [Team fouls: 1] No free throws, side out. (DeMar McCollum: 1 personal fouls)

[08:21] Team_039 possession (Score: 49-41)
Yao Carter attempts a 3Pt. Contested by Cade Beal (3.5 feet, ZONE). Yao Carter misses. Rebound secured by DeMar McCollum.

[08:05] Team_095 possession (Score: 49-41)
Kyle Poole attempts a 3Pt. Wide open! Tracy Mitchell is 6.9 feet away. [MAN] Kyle Poole misses. Rebound secured by Bam Booker.

[07:55] Team_039 possession (Score: 49-41)
Jayson Cunningham attempts a 3Pt. Contested by Cade Beal (3.4 feet, ZONE). Jayson Cunningham misses. Rebound secured by DeMar McCollum.

[07:41] Team_095 possession (Score: 49-41)
Kyle Poole attempts a 3Pt. Contested by Tracy Mitchell (4.5 feet, ZONE). KYLE POOLE MAKES IT! Assist: Gary Davis
Score: 52-41

[07:23] Team_039 possession (Score: 52-41)
Bam Booker drives and kicks out. Jayson Cunningham attempts a 3Pt. Contested by Cade Beal (5.3 feet, MAN). Jayson Cunningham misses. Rebound secured by DeMar McCollum.

[07:04] Team_095 possession (Score: 52-41)
Tobias Wagner makes the Layup and draws the foul on Victor Gasol! And-1! Tobias Wagner to the line for 1. [Team fouls: 1] (Victor Gasol: 1 personal fouls)   FT 1/1: GOOD Tobias Wagner makes 1/1 from the line.
Score: 55-41

[06:52] Team_039 possession (Score: 55-41)
Bam Booker attempts a Layup. BLOCKED BY DEMAR MCCOLLUM! Ball deflects out of bounds off Bam Booker.

[06:43] Team_095 possession (Score: 55-41)
FOUL! Holding foul on Tracy Mitchell. [Team fouls: 2] No free throws, side out. (Tracy Mitchell: 1 personal fouls)

[06:29] Team_095 possession (Score: 55-41)
Tobias Wagner attempts a Midrange. Contested by Victor Gasol (4.9 feet, ZONE). Tobias Wagner misses. Offensive rebound by Tobias Wagner! Tobias Wagner kicks it out.

[06:13] Team_095 possession (Score: 55-41)
DeMar McCollum attempts a Layup. BLOCKED BY VICTOR GASOL! Ball is loose! Rebound secured by Yao Carter.

[05:55] Team_039 possession (Score: 55-41)
Bam Booker attempts a Midrange. Wide open! DeMar McCollum is 7.3 feet away. [MAN] Bam Booker misses. Offensive rebound by Victor Gasol! Victor Gasol kicks it out.

[05:38] Team_039 possession (Score: 55-41)
Bam Booker throws a bad pass! Stolen by DeMar McCollum! TURNOVER! (live ball)

[05:23] Team_095 possession (Score: 55-41)
DeMar McCollum drives to the basket... DeMar McCollum loses the ball! Stripped by Bam Booker! TURNOVER! (live ball)

[05:11] Team_039 possession (Score: 55-41)
Bam Booker drives and kicks out. Jayson Cunningham attempts a 3Pt. Contested by Cade Beal (4.5 feet, MAN). JAYSON CUNNINGHAM MAKES IT! Assist: Yao Carter
Score: 55-44

[04:59] Team_095 possession (Score: 55-44)
Cade Beal attempts a 3Pt. Contested by Jayson Cunningham (3.1 feet, MAN). Cade Beal misses. Rebound secured by Victor Gasol.

[04:45] Team_039 possession (Score: 55-44)
Bam Booker drives and kicks out. Yao Carter attempts a 3Pt. Heavily contested by Tobias Wagner (0.5 feet, MAN)! YAO CARTER MAKES IT! Assist: Victor Gasol
Score: 55-47

[04:30] Team_095 possession (Score: 55-47)
Cade Beal drives and kicks out. Tobias Wagner attempts a 3Pt. Contested by Tracy Mitchell (4.5 feet, ZONE). TOBIAS WAGNER MAKES IT! Assist: Kyle Poole
Score: 58-47

[04:11] Team_039 possession (Score: 58-47)
Jayson Cunningham attempts a 3Pt. Heavily contested by Kyle Poole (1.5 feet, ZONE)! Jayson Cunningham misses. Rebound secured by DeMar McCollum.

[03:56] Team_095 possession (Score: 58-47)
Tobias Wagner attempts a 3Pt. Contested by Tracy Mitchell (5.8 feet, ZONE). TOBIAS WAGNER MAKES IT! Assist: Cade Beal
Score: 61-47

[03:46] Team_039 possession (Score: 61-47)
Jayson Cunningham drives and kicks out. Victor Gasol attempts a 3Pt. Contested by Gary Davis (5.7 feet, MAN). Victor Gasol misses. FOUL! Loose ball foul on Tobias Wagner during the rebound battle. [Team fouls: 2] No free throws, side out. (Tobias Wagner: 1 personal fouls)

[03:29] Team_039 possession (Score: 61-47)
Victor Gasol loses the ball! Stripped by Gary Davis! TURNOVER! (live ball)

[03:18] Team_095 possession (Score: 61-47)
Gary Davis attempts a Midrange. Contested by Jayson Cunningham (3.3 feet, ZONE). Gary Davis misses. Rebound secured by Victor Gasol.

[03:04] Team_039 possession (Score: 61-47)
Tracy Mitchell attempts a Midrange. Contested by Kyle Poole (4.3 feet, MAN). TRACY MITCHELL MAKES IT! Assist: Yao Carter
Score: 61-49

[02:49] Team_095 possession (Score: 61-49)
Tobias Wagner attempts a 3Pt. Wide open! Tracy Mitchell is 9.6 feet away. [ZONE] Tobias Wagner misses. Rebound secured by Bam Booker.

[02:34] Team_039 possession (Score: 61-49)
FOUL! Offensive foul on Yao Carter! Tobias Wagner drew the charge! [Team fouls: 3] (Yao Carter: 1 personal fouls) TURNOVER! (dead ball)

[02:20] Team_095 possession (Score: 61-49)
Tobias Wagner attempts a 3Pt. Contested by Tracy Mitchell (4.1 feet, ZONE). Tobias Wagner misses. Rebound secured by Victor Gasol.

[02:04] Team_039 possession (Score: 61-49)
Bam Booker attempts a Layup. Wide open! DeMar McCollum is 6.1 feet away. [MAN] BAM BOOKER MAKES IT! Assist: Tracy Mitchell
Score: 61-51

[01:49] Team_095 possession (Score: 61-51)
Gary Davis drives to the basket... Gary Davis throws a bad pass out of bounds! TURNOVER! (dead ball)

[01:35] Team_039 possession (Score: 61-51)
Jayson Cunningham attempts a Midrange. BLOCKED BY CADE BEAL! Ball deflects out of bounds off Jayson Cunningham.

[01:24] Team_095 possession (Score: 61-51)
Tobias Wagner attempts a Layup. Contested by Yao Carter (4.9 feet, MAN). Tobias Wagner misses. Rebound secured by Victor Gasol.

[01:10] Team_039 possession (Score: 61-51)
Yao Carter attempts a 3Pt. Contested by Tobias Wagner (5.2 feet, MAN). YAO CARTER MAKES IT! Assist: Bam Booker
Score: 61-54

[00:54] Team_095 possession (Score: 61-54)
Gary Davis attempts a 3Pt. Heavily contested by Victor Gasol (0.7 feet, MAN)! Gary Davis misses. Offensive rebound by DeMar McCollum! DeMar McCollum kicks it out.

[00:36] Team_095 possession (Score: 61-54)
Cade Beal attempts a 3Pt. Wide open! Tracy Mitchell is 8.6 feet away. [ZONE] CADE BEAL MAKES IT! Assist: Kyle Poole
Score: 64-54

[00:19] Team_039 possession (Score: 64-54)
Tracy Mitchell attempts a 3Pt. Contested by Cade Beal (4.1 feet, ZONE). Tracy Mitchell misses. Rebound secured by Tobias Wagner.

[00:05] Team_095 possession (Score: 64-54)
Cade Beal drives to the basket... Cade Beal commits a violation (traveling/carry)! TURNOVER! (dead ball)

================================================================================
                              2ND QUARTER COMPLETE                              
================================================================================

2ND QUARTER SCORE: Team_095 27, Team_039 20

BOX SCORE:
================================================================================

Team_095
--------------------------------------------------------------------------------
Player                MIN  PTS  REB  AST  TO      FG   FG%      3P   3P%
--------------------------------------------------------------------------------
Cade Beal              12   10    0    1   0   4/5    80.0     0/0   0.0
Tobias Wagner          12    9    3    1   0   3/7    42.9     0/0   0.0
Kyle Poole             12    5    0    2   0   2/4    50.0     0/0   0.0
Immanuel Middleton     13    3    0    0   0   1/1   100.0     0/0   0.0
Kyrie Ming             13    0    0    1   0   0/0     0.0     0/0   0.0
Gary Davis             12    0    0    2   0   0/1     0.0     0/0   0.0
DeMar McCollum         12    0    5    0   0   0/1     0.0     0/0   0.0

TEAM: FG: 10/19 (52.6%), 3PT: 5/11 (45.5%), REB: 8 (2 off, 6 def), AST: 7, TO: 3
TEAM FOULS: 2


Team_039
--------------------------------------------------------------------------------
Player                MIN  PTS  REB  AST  TO      FG   FG%      3P   3P%
--------------------------------------------------------------------------------
Yao Carter             12    8    2    2   0   3/5    60.0     0/0   0.0
Tracy Mitchell         12    4    0    2   0   2/3    66.7     0/0   0.0
Victor Gasol           12    3    8    2   0   1/1   100.0     0/0   0.0
Jayson Cunningham      12    3    0    0   0   1/4    25.0     0/0   0.0
Bam Booker             12    2    2    2   0   1/3    33.3     0/0   0.0
Austin O'Neal          13    0    1    0   0   0/0     0.0     0/0   0.0

TEAM: FG: 8/16 (50.0%), 3PT: 1/6 (16.7%), REB: 13 (4 off, 9 def), AST: 8, TO: 5
TEAM FOULS: 3

================================================================================

================================================================================
                       3RD QUARTER - Team_095 vs Team_039                       
================================================================================

[12:00] Team_095 possession (Score: 64-54)
Shaquille Ball attempts a 3Pt. Contested by Donovan Markkanen (2.8 feet, MAN). Shaquille Ball misses. Offensive rebound by Evan Carter! Evan Carter puts it back in!
Score: 66-54

[11:45] Team_039 possession (Score: 66-54)
Klay Wade drives to the basket... Klay Wade throws a bad pass! Stolen by Kyrie Ming! TURNOVER! (live ball)

[11:29] Team_095 possession (Score: 66-54)
Shaquille Ball drives, Klay Wade stays with him. Shaquille Ball attempts a Layup. Heavily contested by Klay Wade (1.2 feet, ZONE)! Shaquille Ball misses. Offensive rebound by Dejounte Hyland! Dejounte Hyland kicks it out.

[11:15] Team_095 possession (Score: 66-54)
Dejounte Hyland attempts a 3Pt. Contested by Jrue Bridges (3.5 feet, ZONE). Dejounte Hyland misses. Rebound secured by Austin O'Neal.

[11:02] Team_039 possession (Score: 66-54)
Donovan Markkanen attempts a 3Pt. Wide open! Shaquille Ball is 7.4 feet away. [MAN] Donovan Markkanen misses. Rebound secured by Shaquille Ball.

[10:51] Team_095 possession (Score: 66-54)
FOUL! Offensive foul on Immanuel Middleton! Klay Wade drew the charge! [Team fouls: 1] (Immanuel Middleton: 1 personal fouls) TURNOVER! (dead ball)

[10:38] Team_039 possession (Score: 66-54)
Austin O'Neal attempts a 3Pt. Contested by Evan Carter (5.4 feet, MAN). AUSTIN O'NEAL MAKES IT! Assist: Anfernee Carter
Score: 66-57

[10:25] Team_095 possession (Score: 66-57)
Kyrie Ming attempts a 3Pt. Wide open! Klay Wade is 6.6 feet away. [MAN] Kyrie Ming misses. Rebound secured by Klay Wade.

[10:12] Team_039 possession (Score: 66-57)
Jrue Bridges attempts a 3Pt. Contested by Dejounte Hyland (5.8 feet, MAN). Jrue Bridges misses. Rebound secured by Dejounte Hyland.

[09:58] Team_095 possession (Score: 66-57)
Dejounte Hyland attempts a Midrange. Contested by Jrue Bridges (4.4 feet, MAN). Dejounte Hyland misses. Offensive rebound by Evan Carter! Evan Carter puts it back in!
Score: 68-57

[09:44] Team_039 possession (Score: 68-57)
Jrue Bridges drives to the basket... Jrue Bridges loses control! Ball rolls out of bounds! TURNOVER! (dead ball)

[09:30] Team_095 possession (Score: 68-57)
Immanuel Middleton drives to the basket... FOUL! Offensive foul on Immanuel Middleton! Klay Wade drew the charge! [Team fouls: 2] (Immanuel Middleton: 2 personal fouls) TURNOVER! (dead ball)

[09:17] Team_039 possession (Score: 68-57)
Anfernee Carter drives and kicks out. Austin O'Neal attempts a 3Pt. Contested by Evan Carter (4.3 feet, MAN). AUSTIN O'NEAL MAKES IT! Assist: Klay Wade
Score: 68-60

[09:05] Team_095 possession (Score: 68-60)
Kyrie Ming drives to the basket... Kyrie Ming loses the ball! Stripped by Klay Wade! TURNOVER! (live ball)

[08:52] Team_039 possession (Score: 68-60)
Klay Wade drives, picks up Kyrie Ming. Help arrives from Dejounte Hyland! Klay Wade attempts a Layup. Contested by Dejounte Hyland (4.0 feet, MAN). KLAY WADE MAKES IT!
Score: 68-62

[08:35] Team_095 possession (Score: 68-62)
Evan Carter drives, picks up Austin O'Neal. Help arrives from Donovan Markkanen! Evan Carter attempts a Dunk. Heavily contested by Donovan Markkanen (0.7 feet, MAN)! EVAN CARTER MAKES IT! Assist: Kyrie Ming
Score: 70-62

[08:21] Team_039 possession (Score: 70-62)
FOUL! Shooting foul on Immanuel Middleton. Donovan Markkanen to the line for 2 free throws. [Team fouls: 3] (Immanuel Middleton: 3 personal fouls)   FT 1/2: MISS   FT 2/2: GOOD Donovan Markkanen makes 1/2 from the line.
Score: 70-63

[08:06] Team_095 possession (Score: 70-63)
FOUL! Offensive foul on Shaquille Ball! Donovan Markkanen drew the charge! [Team fouls: 4] (Shaquille Ball: 1 personal fouls) TURNOVER! (dead ball)

[07:51] Team_039 possession (Score: 70-63)
Donovan Markkanen attempts a Midrange. Wide open! Shaquille Ball is 7.9 feet away. [MAN] DONOVAN MARKKANEN MAKES IT! Assist: Anfernee Carter
Score: 70-65

[07:39] Team_095 possession (Score: 70-65)
Evan Carter attempts a 3Pt. Contested by Austin O'Neal (4.8 feet, MAN). Evan Carter misses. Rebound secured by Donovan Markkanen.

[07:21] Team_039 possession (Score: 70-65)
Anfernee Carter attempts a Layup. Contested by Immanuel Middleton (4.8 feet, ZONE). ANFERNEE CARTER MAKES IT! Assist: Donovan Markkanen
Score: 70-67

[07:03] Team_095 possession (Score: 70-67)
Kyrie Ming attempts a Midrange. Wide open! Anfernee Carter is 8.3 feet away. [ZONE] Kyrie Ming misses. Rebound secured by Austin O'Neal.

[06:49] Team_039 possession (Score: 70-67)
FOUL! Shooting foul on Evan Carter. Donovan Markkanen to the line for 3 free throws. [BONUS: 5 team fouls] (Evan Carter: 1 personal fouls)   FT 1/3: MISS   FT 2/3: GOOD   FT 3/3: GOOD Donovan Markkanen makes 2/3 from the line.
Score: 70-69

[06:33] Team_095 possession (Score: 70-69)
Kyrie Ming attempts a 3Pt. BLOCKED BY JRUE BRIDGES! Ball deflects out of bounds off Kyrie Ming.

[06:20] Team_039 possession (Score: 70-69)
Klay Wade attempts a Midrange. Wide open! Kyrie Ming is 7.8 feet away. [MAN] KLAY WADE MAKES IT!
Score: 70-71

[06:10] Team_095 possession (Score: 70-71)
Immanuel Middleton drives to the basket... Immanuel Middleton throws a bad pass out of bounds! TURNOVER! (dead ball)

[05:53] Team_039 possession (Score: 70-71)
Klay Wade makes the Midrange and draws the foul on Kyrie Ming! And-1! Klay Wade to the line for 1. [BONUS: 6 team fouls] (Kyrie Ming: 1 personal fouls)   FT 1/1: GOOD Klay Wade makes 1/1 from the line.
Score: 70-74

[05:36] Team_095 possession (Score: 70-74)
Immanuel Middleton drives, picks up Klay Wade. Help arrives from Donovan Markkanen! Immanuel Middleton attempts a Layup. Contested by Donovan Markkanen (4.3 feet, ZONE). IMMANUEL MIDDLETON MAKES IT!
Score: 72-74

[05:26] Team_039 possession (Score: 72-74)
Donovan Markkanen attempts a 3Pt. Heavily contested by Shaquille Ball (0.8 feet, MAN)! Donovan Markkanen misses. Rebound secured by Dejounte Hyland.

[05:09] Team_095 possession (Score: 72-74)
Immanuel Middleton attempts a Midrange. Contested by Anfernee Carter (2.5 feet, ZONE). IMMANUEL MIDDLETON MAKES IT! Assist: Kyrie Ming
Score: 74-74

[04:55] Team_039 possession (Score: 74-74)
Anfernee Carter attempts a Midrange. Contested by Shaquille Ball (4.5 feet, ZONE). Anfernee Carter misses. Offensive rebound by Klay Wade! Klay Wade kicks it out.

[04:44] Team_039 possession (Score: 74-74)
Austin O'Neal attempts a 3Pt. Contested by Evan Carter (3.4 feet, MAN). Austin O'Neal misses. Rebound secured by Dejounte Hyland.

[04:28] Team_095 possession (Score: 74-74)
Kyrie Ming attempts a Layup. BLOCKED BY KLAY WADE! Ball deflects out of bounds off Kyrie Ming.

[04:14] Team_039 possession (Score: 74-74)
Donovan Markkanen attempts a 3Pt. Contested by Shaquille Ball (3.6 feet, MAN). DONOVAN MARKKANEN MAKES IT! Assist: Jrue Bridges
Score: 74-77

[03:59] Team_095 possession (Score: 74-77)
Dejounte Hyland drives to the basket... Dejounte Hyland loses the ball! Stripped by Klay Wade! TURNOVER! (live ball)

[03:44] Team_039 possession (Score: 74-77)
Anfernee Carter attempts a Midrange. Contested by Immanuel Middleton (4.8 feet, ZONE). Anfernee Carter misses. Rebound secured by Evan Carter.

[03:28] Team_095 possession (Score: 74-77)
FOUL! Reach-in foul on Klay Wade during the drive. [Team fouls: 1] No free throws, side out. (Klay Wade: 1 personal fouls)

[03:13] Team_095 possession (Score: 74-77)
Immanuel Middleton attempts a Midrange. Contested by Austin O'Neal (3.0 feet, ZONE). IMMANUEL MIDDLETON MAKES IT!
Score: 76-77

[02:59] Team_039 possession (Score: 76-77)
Anfernee Carter attempts a Midrange. Contested by Shaquille Ball (2.8 feet, ZONE). Anfernee Carter misses. FOUL! Loose ball foul on Evan Carter during the rebound battle. [IN THE BONUS! 7 team fouls] Austin O'Neal to the line for 2 free throws. (Evan Carter: 2 personal fouls)   FT 1/2: GOOD   FT 2/2: GOOD Austin O'Neal makes 2/2 from the line.
Score: 76-79

[02:47] Team_095 possession (Score: 76-79)
Shaquille Ball attempts a 3Pt. Contested by Jrue Bridges (2.0 feet, ZONE). SHAQUILLE BALL MAKES IT! Assist: Dejounte Hyland
Score: 79-79

[02:33] Team_039 possession (Score: 79-79)
Jrue Bridges attempts a 3Pt. Wide open! Dejounte Hyland is 6.9 feet away. [MAN] Jrue Bridges misses. Rebound secured by Evan Carter.

[02:21] Team_095 possession (Score: 79-79)
Dejounte Hyland attempts a Midrange. Contested by Austin O'Neal (2.2 feet, ZONE). DEJOUNTE HYLAND MAKES IT!
Score: 81-79

[02:06] Team_039 possession (Score: 81-79)
Donovan Markkanen attempts a Midrange. Contested by Evan Carter (4.0 feet, ZONE). Donovan Markkanen misses. Rebound secured by Dejounte Hyland.

[01:56] Team_095 possession (Score: 81-79)
Evan Carter drives, picks up Austin O'Neal. Help arrives from Donovan Markkanen! Evan Carter attempts a Layup. Wide open! Donovan Markkanen is 6.3 feet away. [MAN] Evan Carter misses. Rebound secured by Klay Wade.

[01:43] Team_039 possession (Score: 81-79)
Austin O'Neal attempts a Midrange. Wide open! Evan Carter is 7.4 feet away. [MAN] Austin O'Neal misses. FOUL! Loose ball foul on Evan Carter during the rebound battle. [IN THE BONUS! 8 team fouls] Austin O'Neal to the line for 2 free throws. (Evan Carter: 3 personal fouls)   FT 1/2: MISS   FT 2/2: GOOD Austin O'Neal makes 1/2 from the line.
Score: 81-80

[01:28] Team_095 possession (Score: 81-80)
Shaquille Ball drives to the basket... Shaquille Ball throws a bad pass! Stolen by Donovan Markkanen! TURNOVER! (live ball)

[01:10] Team_039 possession (Score: 81-80)
Anfernee Carter attempts a 3Pt. Wide open! Immanuel Middleton is 8.8 feet away. [MAN] Anfernee Carter misses. Rebound secured by Dejounte Hyland.

[00:57] Team_095 possession (Score: 81-80)
Dejounte Hyland drives, Klay Wade stays with him. Dejounte Hyland attempts a Layup. Contested by Klay Wade (5.2 feet, ZONE). DEJOUNTE HYLAND MAKES IT!
Score: 83-80

[00:42] Team_039 possession (Score: 83-80)
Klay Wade drives to the basket... Klay Wade loses the ball! Stripped by Immanuel Middleton! TURNOVER! (live ball)

[00:31] Team_095 possession (Score: 83-80)
Evan Carter attempts a Layup. Wide open! Austin O'Neal is 7.6 feet away. [MAN] EVAN CARTER MAKES IT! Assist: Dejounte Hyland
Score: 85-80

[00:17] Team_039 possession (Score: 85-80)
FOUL! Offensive foul on Klay Wade! Kyrie Ming drew the charge! [Team fouls: 2] (Klay Wade: 2 personal fouls) TURNOVER! (dead ball)

[00:05] Team_095 possession (Score: 85-80)
Evan Carter attempts a Midrange. Wide open! Austin O'Neal is 6.7 feet away. [MAN] EVAN CARTER MAKES IT!
Score: 87-80

================================================================================
                              3RD QUARTER COMPLETE                              
================================================================================

3RD QUARTER SCORE: Team_095 23, Team_039 26

BOX SCORE:
================================================================================

Team_095
--------------------------------------------------------------------------------
Player                MIN  PTS  REB  AST  TO      FG   FG%      3P   3P%
--------------------------------------------------------------------------------
Evan Carter            25   10    4    0   0   5/7    71.4     0/0   0.0
Immanuel Middleton     25    6    0    0   0   3/3   100.0     0/0   0.0
Dejounte Hyland        25    4    6    2   0   2/3    66.7     0/0   0.0
Shaquille Ball         25    3    1    0   0   1/1   100.0     0/0   0.0
Kyrie Ming             25    0    0    2   0   0/4     0.0     0/0   0.0

TEAM: FG: 11/18 (61.1%), 3PT: 2/6 (33.3%), REB: 11 (3 off, 8 def), AST: 4, TO: 7
TEAM FOULS: 8 [Team_039 in BONUS]


Team_039
--------------------------------------------------------------------------------
Player                MIN  PTS  REB  AST  TO      FG   FG%      3P   3P%
--------------------------------------------------------------------------------
Austin O'Neal          25    9    2    0   0   4/5    80.0     0/0   0.0
Donovan Markkanen      25    8    1    1   0   4/7    57.1     0/0   0.0
Klay Wade              25    7    3    1   0   3/3   100.0     0/0   0.0
Anfernee Carter        25    2    0    2   0   1/3    33.3     0/0   0.0
Jrue Bridges           25    0    0    1   0   0/2     0.0     0/0   0.0

TEAM: FG: 12/20 (60.0%), 3PT: 3/9 (33.3%), REB: 6 (1 off, 5 def), AST: 5, TO: 4
TEAM FOULS: 2

================================================================================

================================================================================
                       4TH QUARTER - Team_095 vs Team_039                       
================================================================================

[12:00] Substitution (Team_095): Dejounte Hyland OUT → Kyle Poole IN (stamina_rule2)

[12:00] Substitution (Team_095): Shaquille Ball OUT → Cade Beal IN (stamina_rule2)

[12:00] Substitution (Team_095): Evan Carter OUT → Tobias Wagner IN (stamina_rule2)

[12:00] Substitution (Team_095): Immanuel Middleton OUT → Gary Davis IN (stamina_rule2)

[12:00] Substitution (Team_095): Kyrie Ming OUT → DeMar McCollum IN (stamina_rule2)

[12:00] Substitution (Team_039): Jrue Bridges OUT → Tracy Mitchell IN (stamina_rule2)

[12:00] Substitution (Team_039): Donovan Markkanen OUT → Jayson Cunningham IN (stamina_rule2)

[12:00] Substitution (Team_039): Austin O'Neal OUT → Yao Carter IN (stamina_rule2)

[12:00] Substitution (Team_039): Anfernee Carter OUT → Victor Gasol IN (stamina_rule2)

[12:00] Substitution (Team_039): Klay Wade OUT → Bam Booker IN (stamina_rule2)

[12:00] Team_095 possession (Score: 87-80)
Evan Carter drives to the basket... Evan Carter loses control! Ball rolls out of bounds! TURNOVER! (dead ball)

[11:41] Team_039 possession (Score: 87-80)
Yao Carter drives, Tobias Wagner stays with him. Yao Carter attempts a Dunk. Heavily contested by Tobias Wagner (0.7 feet, MAN)! YAO CARTER MAKES IT! Assist: Bam Booker
Score: 87-82

[11:26] Team_095 possession (Score: 87-82)
Cade Beal attempts a Midrange. Contested by Yao Carter (2.8 feet, ZONE). Cade Beal misses. Rebound secured by Bam Booker.

[11:13] Team_039 possession (Score: 87-82)
Yao Carter attempts a 3Pt. Contested by Cade Beal (3.4 feet, ZONE). Yao Carter misses. Rebound secured by DeMar McCollum.

[11:00] Team_095 possession (Score: 87-82)
Gary Davis attempts a Midrange. Contested by Victor Gasol (4.3 feet, ZONE). GARY DAVIS MAKES IT! Assist: Tobias Wagner
Score: 89-82

[10:45] Team_039 possession (Score: 89-82)
Jayson Cunningham attempts a 3Pt. Contested by Cade Beal (4.3 feet, MAN). Jayson Cunningham misses. Rebound secured by Gary Davis.

[10:30] Team_095 possession (Score: 89-82)
Tobias Wagner attempts a 3Pt. Wide open! Tracy Mitchell is 6.5 feet away. [ZONE] TOBIAS WAGNER MAKES IT! Assist: DeMar McCollum
Score: 92-82

[10:17] Team_039 possession (Score: 92-82)
Victor Gasol attempts a 3Pt. Heavily contested by Tobias Wagner (1.7 feet, ZONE)! Victor Gasol misses. Rebound secured by Gary Davis.

[10:05] Team_095 possession (Score: 92-82)
FOUL! Holding foul on Jayson Cunningham. [Team fouls: 1] No free throws, side out. (Jayson Cunningham: 1 personal fouls)

[09:48] Team_095 possession (Score: 92-82)
Tobias Wagner attempts a Midrange. Wide open! Tracy Mitchell is 8.4 feet away. [ZONE] TOBIAS WAGNER MAKES IT! Assist: Kyle Poole
Score: 94-82

[09:32] Team_039 possession (Score: 94-82)
Jayson Cunningham attempts a 3Pt. Contested by Tobias Wagner (2.8 feet, ZONE). JAYSON CUNNINGHAM MAKES IT! Assist: Tracy Mitchell
Score: 94-85

[09:21] Team_095 possession (Score: 94-85)
Tobias Wagner attempts a 3Pt. Wide open! Tracy Mitchell is 6.5 feet away. [ZONE] TOBIAS WAGNER MAKES IT! Assist: Gary Davis
Score: 97-85

[09:04] Team_039 possession (Score: 97-85)
FOUL! Holding foul on Tobias Wagner. [Team fouls: 1] No free throws, side out. (Tobias Wagner: 1 personal fouls)

[08:54] Team_039 possession (Score: 97-85)
Bam Booker drives to the basket... Bam Booker loses the ball! Stripped by DeMar McCollum! TURNOVER! (live ball)

[08:41] Team_095 possession (Score: 97-85)
DeMar McCollum drives, Bam Booker stays with him. DeMar McCollum attempts a Dunk. Wide open! Bam Booker is 6.2 feet away. [MAN] DEMAR MCCOLLUM MAKES IT! Assist: Gary Davis
Score: 99-85

[08:26] Team_039 possession (Score: 99-85)
Tracy Mitchell attempts a 3Pt. Wide open! Kyle Poole is 7.1 feet away. [MAN] Tracy Mitchell misses. Rebound secured by DeMar McCollum.

[08:08] Team_095 possession (Score: 99-85)
FOUL! Reach-in foul on Victor Gasol during the drive. [Team fouls: 2] No free throws, side out. (Victor Gasol: 1 personal fouls)

[07:56] Team_095 possession (Score: 99-85)
Tobias Wagner makes the 3Pt and draws the foul on Tracy Mitchell! And-1! Tobias Wagner to the line for 1. [Team fouls: 3] (Tracy Mitchell: 1 personal fouls)   FT 1/1: GOOD Tobias Wagner makes 1/1 from the line.
Score: 103-85

[07:43] Team_039 possession (Score: 103-85)
Bam Booker attempts a Midrange. Contested by DeMar McCollum (5.3 feet, MAN). Bam Booker misses. Rebound secured by Gary Davis.

[07:26] Team_095 possession (Score: 103-85)
Tobias Wagner attempts a 3Pt. Wide open! Jayson Cunningham is 9.5 feet away. [ZONE] Tobias Wagner misses. Rebound secured by Victor Gasol.

[07:16] Team_039 possession (Score: 103-85)
Jayson Cunningham attempts a 3Pt. Wide open! Cade Beal is 7.3 feet away. [MAN] JAYSON CUNNINGHAM MAKES IT! Assist: Yao Carter
Score: 103-88

[07:02] Team_095 possession (Score: 103-88)
Tobias Wagner throws a bad pass! Stolen by Yao Carter! TURNOVER! (live ball)

[06:46] Team_039 possession (Score: 103-88)
Bam Booker attempts a Layup. Contested by Gary Davis (5.9 feet, ZONE). BAM BOOKER MAKES IT!
Score: 103-90

[06:31] Team_095 possession (Score: 103-90)
Gary Davis attempts a Midrange. Wide open! Jayson Cunningham is 8.0 feet away. [ZONE] GARY DAVIS MAKES IT!
Score: 105-90

[06:18] Team_039 possession (Score: 105-90)
Tracy Mitchell attempts a 3Pt. Wide open! Kyle Poole is 8.9 feet away. [MAN] TRACY MITCHELL MAKES IT! Assist: Victor Gasol
Score: 105-93

[06:04] Team_095 possession (Score: 105-93)
Gary Davis attempts a 3Pt. Heavily contested by Victor Gasol (0.5 feet, MAN)! Gary Davis misses. Rebound secured by Victor Gasol.

[05:48] Team_039 possession (Score: 105-93)
Yao Carter drives to the basket... Yao Carter throws a bad pass out of bounds! TURNOVER! (dead ball)

[05:34] Team_095 possession (Score: 105-93)
Tobias Wagner attempts a Layup. Contested by Yao Carter (4.5 feet, MAN). TOBIAS WAGNER MAKES IT! Assist: Gary Davis
Score: 107-93

[05:18] Team_039 possession (Score: 107-93)
FOUL! Reach-in foul on Gary Davis during the drive. [Team fouls: 2] No free throws, side out. (Gary Davis: 1 personal fouls)

[05:05] Team_039 possession (Score: 107-93)
Tracy Mitchell attempts a 3Pt. Contested by Kyle Poole (4.3 feet, MAN). Tracy Mitchell misses. Rebound secured by Tobias Wagner.

[04:52] Team_095 possession (Score: 107-93)
Kyle Poole throws a bad pass! Stolen by Tracy Mitchell! TURNOVER! (live ball)

[04:36] Team_039 possession (Score: 107-93)
Tracy Mitchell drives and kicks out. Tracy Mitchell attempts a Midrange. Contested by Tobias Wagner (4.3 feet, ZONE). Tracy Mitchell misses. Rebound secured by Gary Davis.

[04:24] Team_095 possession (Score: 107-93)
DeMar McCollum makes the Dunk and draws the foul on Tracy Mitchell! And-1! DeMar McCollum to the line for 1. [Team fouls: 4] (Tracy Mitchell: 2 personal fouls)   FT 1/1: GOOD DeMar McCollum makes 1/1 from the line.
Score: 110-93

[04:09] Team_039 possession (Score: 110-93)
Yao Carter attempts a Layup. Heavily contested by Tobias Wagner (0.8 feet, MAN)! Yao Carter misses. Rebound secured by Tobias Wagner.

[03:57] Team_095 possession (Score: 110-93)
DeMar McCollum drives and kicks out. Kyle Poole attempts a 3Pt. Wide open! Jayson Cunningham is 8.5 feet away. [ZONE] Kyle Poole misses. FOUL! Loose ball foul on Victor Gasol during the rebound battle. [IN THE BONUS! 5 team fouls] DeMar McCollum to the line for 2 free throws. (Victor Gasol: 2 personal fouls)   FT 1/2: GOOD   FT 2/2: GOOD DeMar McCollum makes 2/2 from the line.
Score: 112-93

[03:42] Team_039 possession (Score: 112-93)
Jayson Cunningham attempts a Layup. Contested by DeMar McCollum (5.6 feet, ZONE). JAYSON CUNNINGHAM MAKES IT!
Score: 112-95

[03:24] Team_095 possession (Score: 112-95)
Tobias Wagner attempts a 3Pt. Contested by Yao Carter (2.3 feet, MAN). Tobias Wagner misses. Offensive rebound by Tobias Wagner! Tobias Wagner kicks it out.

[03:07] Team_095 possession (Score: 112-95)
DeMar McCollum throws a bad pass out of bounds! TURNOVER! (dead ball)

[02:56] Team_039 possession (Score: 112-95)
Victor Gasol attempts a Midrange. Contested by Gary Davis (4.9 feet, MAN). Victor Gasol misses. Offensive rebound by Yao Carter! Yao Carter kicks it out.

[02:45] Team_039 possession (Score: 112-95)
FOUL! Holding foul on Tobias Wagner. [Team fouls: 3] No free throws, side out. (Tobias Wagner: 2 personal fouls)

[02:29] Team_039 possession (Score: 112-95)
Bam Booker attempts a Midrange. Contested by DeMar McCollum (5.4 feet, MAN). Bam Booker misses. Rebound secured by DeMar McCollum.

[02:16] Team_095 possession (Score: 112-95)
DeMar McCollum drives and kicks out. Cade Beal attempts a Midrange. Wide open! Jayson Cunningham is 9.1 feet away. [ZONE] CADE BEAL MAKES IT! Assist: Kyle Poole
Score: 114-95

[02:00] Team_039 possession (Score: 114-95)
Bam Booker drives to the basket... FOUL! Offensive foul on Bam Booker! DeMar McCollum drew the charge! [Team fouls: 6] (Bam Booker: 1 personal fouls) TURNOVER! (dead ball)

[01:43] Team_095 possession (Score: 114-95)
Kyle Poole attempts a 3Pt. Wide open! Tracy Mitchell is 8.6 feet away. [MAN] Kyle Poole misses. Rebound secured by Yao Carter.

[01:32] Team_039 possession (Score: 114-95)
Yao Carter attempts a Layup. BLOCKED BY TOBIAS WAGNER! Ball goes out off Tobias Wagner. Yao Carter's ball!

[01:17] Team_039 possession (Score: 114-95)
Yao Carter attempts a 3Pt. Wide open! Cade Beal is 7.0 feet away. [ZONE] Yao Carter misses. Offensive rebound by Yao Carter! Yao Carter kicks it out.

[01:04] Team_039 possession (Score: 114-95)
Victor Gasol attempts a Midrange. Contested by Gary Davis (3.4 feet, MAN). Victor Gasol misses. Rebound secured by DeMar McCollum.

[00:53] Team_095 possession (Score: 114-95)
Cade Beal drives, picks up Jayson Cunningham. Help arrives from Yao Carter! Cade Beal attempts a Layup. Contested by Yao Carter (5.1 feet, MAN). Cade Beal misses. Rebound secured by Yao Carter.

[00:42] Team_039 possession (Score: 114-95)
Jayson Cunningham attempts a 3Pt. Contested by Cade Beal (2.4 feet, ZONE). JAYSON CUNNINGHAM MAKES IT! Assist: Bam Booker
Score: 114-98

[00:25] Team_095 possession (Score: 114-98)
Kyle Poole attempts a Layup. Contested by Tracy Mitchell (3.0 feet, MAN). Kyle Poole misses. Rebound secured by Yao Carter.

[00:12] Team_039 possession (Score: 114-98)
Tracy Mitchell attempts a 3Pt. Wide open! Cade Beal is 6.6 feet away. [ZONE] TRACY MITCHELL MAKES IT! Assist: Jayson Cunningham
Score: 114-101

================================================================================
                              4TH QUARTER COMPLETE                              
================================================================================

4TH QUARTER SCORE: Team_095 27, Team_039 21

BOX SCORE:
================================================================================

Team_095
--------------------------------------------------------------------------------
Player                MIN  PTS  REB  AST  TO      FG   FG%      3P   3P%
--------------------------------------------------------------------------------
Tobias Wagner          23   14    3    1   0   5/6    83.3     0/0   0.0
DeMar McCollum         23    7    4    1   0   3/3   100.0     0/0   0.0
Gary Davis             23    4    4    3   0   2/3    66.7     0/0   0.0
Cade Beal              23    2    0    0   0   1/3    33.3     0/0   0.0
Kyle Poole             23    0    0    2   0   0/2     0.0     0/0   0.0

TEAM: FG: 11/17 (64.7%), 3PT: 3/6 (50.0%), REB: 11 (1 off, 10 def), AST: 7, TO: 4
TEAM FOULS: 3


Team_039
--------------------------------------------------------------------------------
Player                MIN  PTS  REB  AST  TO      FG   FG%      3P   3P%
--------------------------------------------------------------------------------
Jayson Cunningham      23   11    0    1   0   4/5    80.0     0/0   0.0
Tracy Mitchell         23    6    0    1   0   2/5    40.0     0/0   0.0
Yao Carter             23    2    5    1   0   1/3    33.3     0/0   0.0
Bam Booker             23    2    1    2   0   1/3    33.3     0/0   0.0
Victor Gasol           23    0    2    1   0   0/2     0.0     0/0   0.0

TEAM: FG: 8/18 (44.4%), 3PT: 5/10 (50.0%), REB: 8 (2 off, 6 def), AST: 6, TO: 3
TEAM FOULS: 6 [Team_095 in BONUS]

================================================================================

================================================================================
                               FULL GAME COMPLETE                               
================================================================================

FINAL SCORE: Team_095 114, Team_039 101

SCORING BY QUARTER:
--------------------------------------------------------------------------------
Team                     Q1     Q2     Q3     Q4    FINAL
--------------------------------------------------------------------------------
Team_095                 37     27     23     27      114
Team_039                 34     20     26     21      101
--------------------------------------------------------------------------------

FULL GAME BOX SCORE:
================================================================================

Team_095
--------------------------------------------------------------------------------
Player                MIN  PTS  REB  AST  TO      FG   FG%      3P   3P%      FT STL BLK
--------------------------------------------------------------------------------
Dejounte Hyland        25   12   11    3   2   6/8    75.0   2/4    50.0   0/0     1   0
Shaquille Ball         25    9    4    1   5   4/7    57.1   4/5    80.0   0/0     0   0
Evan Carter            25   18    5    2   1   5/8    62.5   2/4    50.0   2/2     0   0
Immanuel Middleton     25   17    0    2   2   7/7   100.0   2/2   100.0   0/0     1   0
Kyrie Ming             25    7    0    7   1   5/9    55.6   0/2     0.0   3/4     1   0
Kyle Poole             23    5    0    4   1   2/6    33.3   1/4    25.0   0/0     0   0
Cade Beal              23   12    0    1   0   4/7    57.1   2/3    66.7   0/0     0   1
Tobias Wagner          23   23    6    2   1   7/12   58.3   4/8    50.0   2/2     1   1
Gary Davis             23    4    4    5   0   3/5    60.0   0/1     0.0   0/0     1   0
DeMar McCollum         23    7    9    1   4   4/5    80.0   0/0     0.0   3/3     2   1

TEAM: FG: 47/74 (63.5%), 3PT: 17/33 (51.5%), REB: 39 (7 off, 32 def), AST: 28, TO: 17


Team_039
--------------------------------------------------------------------------------
Player                MIN  PTS  REB  AST  TO      FG   FG%      3P   3P%      FT STL BLK
--------------------------------------------------------------------------------
Jrue Bridges           25   14    0    1   1   4/8    50.0   3/6    50.0   0/0     0   1
Donovan Markkanen      25   14    4    4   2   6/11   54.5   3/7    42.9   4/6     2   0
Austin O'Neal          25   14    4    1   2   5/9    55.6   1/3    33.3   4/5     0   0
Anfernee Carter        25    5    0    2   1   4/7    57.1   1/2    50.0   0/0     0   0
Klay Wade              25   13    5    4   1   6/6   100.0   0/0     0.0   3/3     2   1
Tracy Mitchell         23   10    0    3   1   5/9    55.6   2/5    40.0   0/0     1   0
Jayson Cunningham      23   14    0    1   0   4/8    50.0   3/6    50.0   0/0     0   0
Yao Carter             23   10    7    3   4   3/7    42.9   1/4    25.0   0/0     1   0
Victor Gasol           23    3   10    3   1   0/2     0.0   0/1     0.0   0/0     0   1
Bam Booker             23    4    3    4   1   4/8    50.0   0/0     0.0   0/0     1   0

TEAM: FG: 41/75 (54.7%), 3PT: 14/34 (41.2%), REB: 33 (8 off, 25 def), AST: 26, TO: 14

================================================================================
