================================================================================
                        FULL GAME - Team_046 vs Team_076                        
================================================================================

================================================================================
                       1ST QUARTER - Team_046 vs Team_076                       
================================================================================

[12:00] Team_046 possession (Score: 0-0)
D'Angelo O'Neal drives, picks up Cade Barnes. Help arrives from Tobias Mitchell! D'Angelo O'Neal attempts a Layup. Contested by Tobias Mitchell (2.6 feet, ZONE). D'ANGELO O'NEAL MAKES IT! Assist: Victor Nowitzki
Score: 2-0

[11:46] Team_076 possession (Score: 2-0)
D'Angelo Tatum makes the Midrange and draws the foul on Kevin Allen! And-1! D'Angelo Tatum to the line for 1. [Team fouls: 1] (Kevin Allen: 1 personal fouls)   FT 1/1: GOOD D'Angelo Tatum makes 1/1 from the line.
Score: 2-3

[11:31] Team_046 possession (Score: 2-3)
FOUL! Shooting foul on Cade Barnes. D'Angelo O'Neal to the line for 3 free throws. [Team fouls: 1] (Cade Barnes: 1 personal fouls)   FT 1/3: GOOD   FT 2/3: GOOD   FT 3/3: MISS D'Angelo O'Neal makes 2/3 from the line. Rebound secured by D'Angelo Tatum.
Score: 4-3

[11:14] Team_076 possession (Score: 4-3)
D'Angelo Tatum drives to the basket... D'Angelo Tatum throws a bad pass! Stolen by Kevin Allen! TURNOVER! (live ball)

[11:00] Team_046 possession (Score: 4-3)
Kevin Allen drives and kicks out. Cade Wall attempts a 3Pt. Contested by Cade Barnes (5.1 feet, ZONE). Cade Wall misses. Offensive rebound by Cade Wall! Cade Wall kicks it out.

[10:43] Team_046 possession (Score: 4-3)
Lauri Carter attempts a 3Pt. Wide open! Paul Leonard is 6.8 feet away. [MAN] LAURI CARTER MAKES IT! Assist: Victor Nowitzki
Score: 7-3

[10:28] Team_076 possession (Score: 7-3)
Cade Barnes attempts a Layup. Contested by Kevin Allen (3.7 feet, ZONE). CADE BARNES MAKES IT! Assist: D'Angelo Tatum
Score: 7-5

[10:17] Team_046 possession (Score: 7-5)
Lauri Carter drives and kicks out. Lauri Carter attempts a Midrange. Wide open! Paul Leonard is 6.5 feet away. [MAN] Lauri Carter misses. Rebound secured by Cade Barnes.

[10:04] Team_076 possession (Score: 7-5)
Cade Barnes makes the Dunk and draws the foul on Cade Wall! And-1! Cade Barnes to the line for 1. [Team fouls: 2] (Cade Wall: 1 personal fouls)   FT 1/1: GOOD Cade Barnes makes 1/1 from the line.
Score: 7-8

[09:46] Team_046 possession (Score: 7-8)
Kevin Allen drives and kicks out. Victor Nowitzki attempts a Midrange. Contested by Tobias Mitchell (5.3 feet, MAN). Victor Nowitzki misses. Rebound secured by D'Angelo Tatum.

[09:32] Team_076 possession (Score: 7-8)
Tobias Mitchell loses control! Ball rolls out of bounds! TURNOVER! (dead ball)

[09:15] Team_046 possession (Score: 7-8)
D'Angelo O'Neal attempts a 3Pt. Contested by Dejounte LaVine (5.0 feet, ZONE). D'Angelo O'Neal misses. FOUL! Loose ball foul on D'Angelo Tatum during the rebound battle. [Team fouls: 2] No free throws, side out. (D'Angelo Tatum: 1 personal fouls)

[09:01] Team_046 possession (Score: 7-8)
Kevin Allen commits a violation (traveling/carry)! TURNOVER! (dead ball)

[08:45] Team_076 possession (Score: 7-8)
Tobias Mitchell attempts a 3Pt. Contested by Victor Nowitzki (3.1 feet, MAN). TOBIAS MITCHELL MAKES IT!
Score: 7-11

[08:31] Team_046 possession (Score: 7-11)
FOUL! Shooting foul on Cade Barnes. Cade Wall to the line for 2 free throws. [Team fouls: 3] (Cade Barnes: 2 personal fouls)   FT 1/2: GOOD   FT 2/2: GOOD Cade Wall makes 2/2 from the line.
Score: 9-11

[08:16] Team_076 possession (Score: 9-11)
D'Angelo Tatum drives and kicks out. Tobias Mitchell attempts a 3Pt. Contested by Victor Nowitzki (4.7 feet, MAN). Tobias Mitchell misses. Rebound secured by Kevin Allen.

[08:05] Team_046 possession (Score: 9-11)
Cade Wall attempts a 3Pt. Contested by Cade Barnes (4.5 feet, ZONE). Cade Wall misses. Rebound secured by D'Angelo Tatum.

[07:48] Team_076 possession (Score: 9-11)
Dejounte LaVine makes the Layup and draws the foul on Kevin Allen! And-1! Dejounte LaVine to the line for 1. [Team fouls: 3] (Kevin Allen: 2 personal fouls)   FT 1/1: GOOD Dejounte LaVine makes 1/1 from the line.
Score: 9-14

[07:32] Team_046 possession (Score: 9-14)
Cade Wall attempts a Layup. Contested by Cade Barnes (6.0 feet, MAN). Cade Wall misses. Rebound secured by D'Angelo Tatum.

[07:20] Team_076 possession (Score: 9-14)
Dejounte LaVine drives, Kevin Allen stays with him. Dejounte LaVine attempts a Dunk. Heavily contested by Kevin Allen (0.9 feet, ZONE)! Dejounte LaVine misses. Offensive rebound by D'Angelo Tatum! D'Angelo Tatum kicks it out.

[07:11] Team_076 possession (Score: 9-14)
Dejounte LaVine attempts a 3Pt. Heavily contested by D'Angelo O'Neal (1.8 feet, MAN)! Dejounte LaVine misses. Rebound secured by Cade Wall.

[06:52] Team_046 possession (Score: 9-14)
Cade Wall attempts a 3Pt. Contested by Cade Barnes (4.5 feet, ZONE). CADE WALL MAKES IT! Assist: Lauri Carter
Score: 12-14

[06:35] Team_076 possession (Score: 12-14)
Cade Barnes attempts a Midrange. Wide open! Cade Wall is 6.0 feet away. [MAN] CADE BARNES MAKES IT! Assist: D'Angelo Tatum
Score: 12-16

[06:19] Team_046 possession (Score: 12-16)
Cade Wall drives and kicks out. Victor Nowitzki attempts a 3Pt. Contested by Tobias Mitchell (2.8 feet, MAN). Victor Nowitzki misses. Rebound secured by Tobias Mitchell.

[06:08] Team_076 possession (Score: 12-16)
Paul Leonard attempts a 3Pt. Contested by Lauri Carter (3.7 feet, MAN). Paul Leonard misses. Rebound secured by Cade Wall.

[05:54] Team_046 possession (Score: 12-16)
D'Angelo O'Neal drives, Dejounte LaVine stays with him. D'Angelo O'Neal attempts a Layup. Wide open! Dejounte LaVine is 7.5 feet away. [MAN] D'Angelo O'Neal misses. Rebound secured by Tobias Mitchell.

[05:39] Team_076 possession (Score: 12-16)
Cade Barnes drives and kicks out. Dejounte LaVine attempts a Midrange. Contested by D'Angelo O'Neal (4.5 feet, MAN). Dejounte LaVine misses. Rebound secured by Kevin Allen.

[05:24] Team_046 possession (Score: 12-16)
Cade Wall makes the Layup and draws the foul on D'Angelo Tatum! And-1! Cade Wall to the line for 1. [Team fouls: 4] (D'Angelo Tatum: 2 personal fouls)   FT 1/1: GOOD Cade Wall makes 1/1 from the line.
Score: 15-16

[05:08] Team_076 possession (Score: 15-16)
Dejounte LaVine makes the Layup and draws the foul on D'Angelo O'Neal! And-1! Dejounte LaVine to the line for 1. [Team fouls: 4] (D'Angelo O'Neal: 1 personal fouls)   FT 1/1: MISS Dejounte LaVine makes 0/1 from the line. Offensive rebound by D'Angelo Tatum! D'Angelo Tatum kicks it out.
Score: 15-18

[04:54] Team_076 possession (Score: 15-18)
Dejounte LaVine attempts a Midrange. Wide open! D'Angelo O'Neal is 6.6 feet away. [MAN] Dejounte LaVine misses. Rebound secured by Lauri Carter.

[04:40] Team_046 possession (Score: 15-18)
Victor Nowitzki attempts a 3Pt. Contested by Tobias Mitchell (5.9 feet, MAN). Victor Nowitzki misses. Rebound secured by Tobias Mitchell.

[04:27] Team_076 possession (Score: 15-18)
Dejounte LaVine attempts a 3Pt. Wide open! D'Angelo O'Neal is 8.4 feet away. [MAN] DEJOUNTE LAVINE MAKES IT! Assist: Tobias Mitchell
Score: 15-21

[04:13] Team_046 possession (Score: 15-21)
Victor Nowitzki attempts a 3Pt. Contested by Cade Barnes (5.8 feet, ZONE). Victor Nowitzki misses. Rebound secured by Tobias Mitchell.

[04:01] Team_076 possession (Score: 15-21)
Tobias Mitchell attempts a Layup. Heavily contested by Victor Nowitzki (1.0 feet, MAN)! TOBIAS MITCHELL MAKES IT!
Score: 15-23

[03:50] Team_046 possession (Score: 15-23)
Cade Wall drives, picks up Cade Barnes. Help arrives from Tobias Mitchell! Cade Wall attempts a Dunk. Contested by Tobias Mitchell (4.0 feet, ZONE). CADE WALL MAKES IT! Assist: Lauri Carter
Score: 17-23

[03:38] Team_076 possession (Score: 17-23)
Paul Leonard attempts a Midrange. Wide open! Lauri Carter is 6.4 feet away. [MAN] Paul Leonard misses. Offensive rebound by Cade Barnes! Cade Barnes kicks it out.

[03:24] Team_076 possession (Score: 17-23)
Dejounte LaVine attempts a 3Pt. Contested by D'Angelo O'Neal (5.4 feet, ZONE). Dejounte LaVine misses. Rebound secured by Cade Wall.

[03:05] Team_046 possession (Score: 17-23)
Victor Nowitzki attempts a 3Pt. Contested by Cade Barnes (2.0 feet, ZONE). VICTOR NOWITZKI MAKES IT! Assist: Lauri Carter
Score: 20-23

[02:50] Team_076 possession (Score: 20-23)
D'Angelo Tatum drives to the basket... D'Angelo Tatum loses the ball! Stripped by Kevin Allen! TURNOVER! (live ball)

[02:32] Team_046 possession (Score: 20-23)
Lauri Carter attempts a Midrange. Contested by Paul Leonard (5.5 feet, MAN). Lauri Carter misses. Rebound secured by Tobias Mitchell.

[02:18] Team_076 possession (Score: 20-23)
Dejounte LaVine attempts a Midrange. Contested by D'Angelo O'Neal (3.4 feet, MAN). Dejounte LaVine misses. Rebound secured by Lauri Carter.

[02:05] Team_046 possession (Score: 20-23)
Victor Nowitzki makes the Dunk and draws the foul on D'Angelo Tatum! And-1! Victor Nowitzki to the line for 1. [BONUS: 5 team fouls] (D'Angelo Tatum: 3 personal fouls)   FT 1/1: GOOD Victor Nowitzki makes 1/1 from the line.
Score: 23-23

[01:49] Team_076 possession (Score: 23-23)
D'Angelo Tatum drives, Kevin Allen stays with him. D'Angelo Tatum attempts a Dunk. Contested by Kevin Allen (3.2 feet, ZONE). D'ANGELO TATUM MAKES IT!
Score: 23-25

[01:37] Team_046 possession (Score: 23-25)
Cade Wall attempts a Layup. Contested by Cade Barnes (3.5 feet, ZONE). Cade Wall misses. Rebound secured by Cade Barnes.

[01:25] Team_076 possession (Score: 23-25)
Dejounte LaVine drives, D'Angelo O'Neal stays with him. Dejounte LaVine attempts a Layup. Wide open! D'Angelo O'Neal is 6.4 feet away. [MAN] DEJOUNTE LAVINE MAKES IT! Assist: Paul Leonard
Score: 23-27

[01:11] Team_046 possession (Score: 23-27)
Victor Nowitzki attempts a 3Pt. Contested by Cade Barnes (3.1 feet, ZONE). Victor Nowitzki misses. Rebound secured by Cade Barnes.

[00:54] Team_076 possession (Score: 23-27)
FOUL! Shooting foul on D'Angelo O'Neal. Dejounte LaVine to the line for 2 free throws. [BONUS: 5 team fouls] (D'Angelo O'Neal: 2 personal fouls)   FT 1/2: GOOD   FT 2/2: GOOD Dejounte LaVine makes 2/2 from the line.
Score: 23-29

[00:37] Team_046 possession (Score: 23-29)
FOUL! Shooting foul on D'Angelo Tatum. Kevin Allen to the line for 2 free throws. [BONUS: 6 team fouls] (D'Angelo Tatum: 4 personal fouls)   FT 1/2: GOOD   FT 2/2: GOOD Kevin Allen makes 2/2 from the line.
Score: 25-29

[00:25] Team_076 possession (Score: 25-29)
Paul Leonard drives, Kevin Allen stays with him. Paul Leonard attempts a Dunk. Contested by Kevin Allen (5.6 feet, ZONE). PAUL LEONARD MAKES IT! Assist: D'Angelo Tatum
Score: 25-31

[00:12] Team_046 possession (Score: 25-31)
Cade Wall drives and kicks out. Lauri Carter attempts a Midrange. Wide open! Paul Leonard is 8.0 feet away. [MAN] Lauri Carter misses. Rebound secured by Tobias Mitchell.

================================================================================
                              1ST QUARTER COMPLETE                              
================================================================================

1ST QUARTER SCORE: Team_046 25, Team_076 31

BOX SCORE:
================================================================================

Team_046
--------------------------------------------------------------------------------
Player                MIN  PTS  REB  AST  TO      FG   FG%      3P   3P%
--------------------------------------------------------------------------------
Cade Wall              12   10    4    0   0   4/9    44.4     0/0   0.0
Victor Nowitzki        12    6    0    2   0   2/5    40.0     0/0   0.0
Lauri Carter           12    3    2    3   0   1/3    33.3     0/0   0.0
D'Angelo O'Neal        12    2    0    0   0   1/3    33.3     0/0   0.0
Kevin Allen            12    2    3    0   0   1/2    50.0     0/0   0.0

TEAM: FG: 9/22 (40.9%), 3PT: 3/8 (37.5%), REB: 9 (2 off, 7 def), AST: 5, TO: 1
TEAM FOULS: 5 [Team_076 in BONUS]


Team_076
--------------------------------------------------------------------------------
Player                MIN  PTS  REB  AST  TO      FG   FG%      3P   3P%
--------------------------------------------------------------------------------
Dejounte LaVine        12   10    0    0   0   4/8    50.0     0/0   0.0
Cade Barnes            12    7    4    0   0   3/4    75.0     0/0   0.0
D'Angelo Tatum         12    5    6    3   0   2/3    66.7     0/0   0.0
Tobias Mitchell        12    5    6    1   0   2/2   100.0     0/0   0.0
Paul Leonard           12    2    0    1   0   1/2    50.0     0/0   0.0

TEAM: FG: 12/19 (63.2%), 3PT: 2/5 (40.0%), REB: 16 (3 off, 13 def), AST: 5, TO: 3
TEAM FOULS: 6 [Team_046 in BONUS]

================================================================================

================================================================================
                       2ND QUARTER - Team_046 vs Team_076                       
================================================================================

[12:00] Team_046 possession (Score: 25-31)
Kevin Allen attempts a Midrange. Contested by Paul Leonard (5.6 feet, ZONE). Kevin Allen misses. Rebound secured by Tobias Mitchell.

[11:48] Team_076 possession (Score: 25-31)
D'Angelo Tatum drives, Kevin Allen stays with him. D'Angelo Tatum attempts a Dunk. Contested by Kevin Allen (3.6 feet, ZONE). D'Angelo Tatum misses. Rebound secured by Lauri Carter.

[11:35] Team_046 possession (Score: 25-31)
Cade Wall drives and kicks out. Cade Wall attempts a 3Pt. Wide open! Cade Barnes is 8.0 feet away. [ZONE] Cade Wall misses. FOUL! Loose ball foul on Tobias Mitchell during the rebound battle. [Team fouls: 1] No free throws, side out. (Tobias Mitchell: 1 personal fouls)

[11:23] Team_046 possession (Score: 25-31)
D'Angelo O'Neal attempts a Midrange. Contested by Dejounte LaVine (4.0 feet, MAN). D'ANGELO O'NEAL MAKES IT!
Score: 27-31

[11:08] Team_076 possession (Score: 27-31)
Dejounte LaVine attempts a Layup. Wide open! D'Angelo O'Neal is 7.3 feet away. [MAN] DEJOUNTE LAVINE MAKES IT! Assist: Tobias Mitchell
Score: 27-33

[10:52] Team_046 possession (Score: 27-33)
Victor Nowitzki attempts a Midrange. Contested by Tobias Mitchell (4.4 feet, MAN). VICTOR NOWITZKI MAKES IT!
Score: 29-33

[10:38] Team_076 possession (Score: 29-33)
D'Angelo Tatum attempts a 3Pt. Wide open! Lauri Carter is 7.9 feet away. [ZONE] D'ANGELO TATUM MAKES IT! Assist: Dejounte LaVine
Score: 29-36

[10:25] Team_046 possession (Score: 29-36)
Lauri Carter loses the ball! Stripped by Paul Leonard! TURNOVER! (live ball)

[10:13] Team_076 possession (Score: 29-36)
Dejounte LaVine attempts a Midrange. Contested by D'Angelo O'Neal (5.4 feet, MAN). DEJOUNTE LAVINE MAKES IT!
Score: 29-38

[09:59] Team_046 possession (Score: 29-38)
D'Angelo O'Neal attempts a 3Pt. Wide open! Cade Barnes is 6.4 feet away. [ZONE] D'Angelo O'Neal misses. Rebound secured by D'Angelo Tatum.

[09:45] Team_076 possession (Score: 29-38)
FOUL! Shooting foul on Kevin Allen. D'Angelo Tatum to the line for 2 free throws. [Team fouls: 1] (Kevin Allen: 1 personal fouls)   FT 1/2: GOOD   FT 2/2: GOOD D'Angelo Tatum makes 2/2 from the line.
Score: 29-40

[09:27] Team_046 possession (Score: 29-40)
Cade Wall makes the Layup and draws the foul on Cade Barnes! And-1! Cade Wall to the line for 1. [Team fouls: 2] (Cade Barnes: 1 personal fouls)   FT 1/1: GOOD Cade Wall makes 1/1 from the line.
Score: 32-40

[09:12] Team_076 possession (Score: 32-40)
FOUL! Reach-in foul on Kevin Allen during the drive. [Team fouls: 2] No free throws, side out. (Kevin Allen: 2 personal fouls)

[09:00] Team_076 possession (Score: 32-40)
Tobias Mitchell drives and kicks out. Cade Barnes attempts a Midrange. Wide open! Cade Wall is 6.3 feet away. [ZONE] CADE BARNES MAKES IT! Assist: Paul Leonard
Score: 32-42

[08:42] Team_046 possession (Score: 32-42)
Victor Nowitzki attempts a Midrange. Wide open! D'Angelo Tatum is 6.8 feet away. [ZONE] VICTOR NOWITZKI MAKES IT! Assist: Cade Wall
Score: 34-42

[08:23] Team_076 possession (Score: 34-42)
Cade Barnes drives, Cade Wall stays with him. Cade Barnes attempts a Layup. Heavily contested by Cade Wall (1.1 feet, MAN)! Cade Barnes misses. Rebound secured by Kevin Allen.

[08:07] Team_046 possession (Score: 34-42)
Cade Wall attempts a 3Pt. Contested by Cade Barnes (5.6 feet, ZONE). Cade Wall misses. Rebound secured by Cade Barnes.

[07:54] Team_076 possession (Score: 34-42)
Tobias Mitchell makes the Layup and draws the foul on Kevin Allen! And-1! Tobias Mitchell to the line for 1. [Team fouls: 3] (Kevin Allen: 3 personal fouls)   FT 1/1: GOOD Tobias Mitchell makes 1/1 from the line.
Score: 34-45

[07:45] Team_046 possession (Score: 34-45)
Lauri Carter loses the ball! Stripped by Paul Leonard! TURNOVER! (live ball)

[07:32] Team_076 possession (Score: 34-45)
Paul Leonard attempts a 3Pt. Wide open! Lauri Carter is 6.7 feet away. [ZONE] Paul Leonard misses. Rebound secured by Lauri Carter.

[07:23] Team_046 possession (Score: 34-45)
D'Angelo O'Neal attempts a Layup. Contested by Dejounte LaVine (5.6 feet, MAN). D'ANGELO O'NEAL MAKES IT! Assist: Lauri Carter
Score: 36-45

[07:04] Team_076 possession (Score: 36-45)
Cade Barnes makes the Layup and draws the foul on Cade Wall! And-1! Cade Barnes to the line for 1. [Team fouls: 4] (Cade Wall: 1 personal fouls)   FT 1/1: GOOD Cade Barnes makes 1/1 from the line.
Score: 36-48

[06:47] Team_046 possession (Score: 36-48)
Lauri Carter commits a violation (traveling/carry)! TURNOVER! (dead ball)

[06:47] Substitution (Team_046): D'Angelo O'Neal OUT → Collin Butler IN (stamina_rule2)

[06:47] Substitution (Team_046): Victor Nowitzki OUT → Manu Dosunmu IN (stamina_rule2)

[06:47] Substitution (Team_046): Lauri Carter OUT → Josh Barrett IN (stamina_rule2)

[06:47] Substitution (Team_046): Cade Wall OUT → Chris LaVine IN (stamina_rule2)

[06:47] Substitution (Team_046): Kevin Allen OUT → Paul DeRozan IN (stamina_rule2)

[06:47] Substitution (Team_076): Dejounte LaVine OUT → Pascal Lowry IN (stamina_rule2)

[06:47] Substitution (Team_076): Tobias Mitchell OUT → Jalen Poole IN (stamina_rule2)

[06:47] Substitution (Team_076): Paul Leonard OUT → Vince Lowry IN (stamina_rule2)

[06:47] Substitution (Team_076): Cade Barnes OUT → Kevin Nowitzki IN (stamina_rule2)

[06:47] Substitution (Team_076): D'Angelo Tatum OUT → Jordan Doncic IN (stamina_rule2)

[06:37] Team_076 possession (Score: 36-48)
Jalen Poole makes the Midrange and draws the foul on Manu Dosunmu! And-1! Jalen Poole to the line for 1. [BONUS: 5 team fouls] (Manu Dosunmu: 1 personal fouls)   FT 1/1: GOOD Jalen Poole makes 1/1 from the line.
Score: 36-51

[06:24] Team_046 possession (Score: 36-51)
FOUL! Shooting foul on Jordan Doncic. Paul DeRozan to the line for 2 free throws. [Team fouls: 3] (Jordan Doncic: 1 personal fouls)   FT 1/2: MISS   FT 2/2: MISS Paul DeRozan makes 0/2 from the line. Rebound secured by Vince Lowry.

[06:08] Team_076 possession (Score: 36-51)
Kevin Nowitzki attempts a Midrange. Contested by Chris LaVine (4.1 feet, MAN). Kevin Nowitzki misses. Rebound secured by Paul DeRozan.

[05:50] Team_046 possession (Score: 36-51)
Chris LaVine attempts a 3Pt. Contested by Kevin Nowitzki (2.4 feet, MAN). Chris LaVine misses. Rebound secured by Kevin Nowitzki.

[05:37] Team_076 possession (Score: 36-51)
Jordan Doncic attempts a Midrange. Contested by Chris LaVine (2.4 feet, MAN). Jordan Doncic misses. Rebound secured by Paul DeRozan.

[05:17] Team_046 possession (Score: 36-51)
FOUL! Holding foul on Pascal Lowry. [Team fouls: 4] No free throws, side out. (Pascal Lowry: 1 personal fouls)

[05:02] Team_046 possession (Score: 36-51)
Josh Barrett attempts a Midrange. Contested by Vince Lowry (5.7 feet, MAN). JOSH BARRETT MAKES IT! Assist: Manu Dosunmu
Score: 38-51

[04:48] Team_076 possession (Score: 38-51)
Jalen Poole drives, Chris LaVine stays with him. Jalen Poole attempts a Dunk. Contested by Chris LaVine (3.2 feet, ZONE). Jalen Poole misses. Rebound secured by Chris LaVine.

[04:35] Team_046 possession (Score: 38-51)
Collin Butler attempts a 3Pt. Contested by Pascal Lowry (5.9 feet, MAN). COLLIN BUTLER MAKES IT! Assist: Paul DeRozan
Score: 41-51

[04:22] Team_076 possession (Score: 41-51)
Jalen Poole attempts a 3Pt. Contested by Josh Barrett (4.3 feet, ZONE). JALEN POOLE MAKES IT! Assist: Jordan Doncic
Score: 41-54

[04:11] Team_046 possession (Score: 41-54)
Josh Barrett attempts a Midrange. Contested by Jordan Doncic (5.7 feet, ZONE). Josh Barrett misses. Rebound secured by Jordan Doncic.

[03:57] Team_076 possession (Score: 41-54)
Kevin Nowitzki attempts a Midrange. Contested by Josh Barrett (2.3 feet, ZONE). Kevin Nowitzki misses. Offensive rebound by Kevin Nowitzki! Kevin Nowitzki kicks it out.

[03:43] Team_076 possession (Score: 41-54)
Pascal Lowry attempts a 3Pt. Contested by Collin Butler (4.6 feet, MAN). PASCAL LOWRY MAKES IT! Assist: Jordan Doncic
Score: 41-57

[03:26] Team_046 possession (Score: 41-57)
Collin Butler attempts a Midrange. Wide open! Pascal Lowry is 7.3 feet away. [MAN] COLLIN BUTLER MAKES IT!
Score: 43-57

[03:11] Team_076 possession (Score: 43-57)
FOUL! Reach-in foul on Chris LaVine during the drive. [IN THE BONUS! 6 team fouls] Kevin Nowitzki to the line for 2 free throws. (Chris LaVine: 1 personal fouls)   FT 1/2: GOOD   FT 2/2: MISS Kevin Nowitzki makes 1/2 from the line. Rebound secured by Manu Dosunmu.
Score: 43-58

[02:58] Team_046 possession (Score: 43-58)
Manu Dosunmu drives, picks up Jalen Poole. Help arrives from Vince Lowry! Manu Dosunmu attempts a Dunk. Wide open! Vince Lowry is 6.2 feet away. [MAN] Manu Dosunmu misses. Rebound secured by Jordan Doncic.

[02:41] Team_076 possession (Score: 43-58)
Pascal Lowry loses control! Ball rolls out of bounds! TURNOVER! (dead ball)

[02:31] Team_046 possession (Score: 43-58)
Josh Barrett attempts a Midrange. Contested by Vince Lowry (3.1 feet, MAN). Josh Barrett misses. Rebound secured by Kevin Nowitzki.

[02:17] Team_076 possession (Score: 43-58)
Vince Lowry throws a bad pass out of bounds! TURNOVER! (dead ball)

[02:03] Team_046 possession (Score: 43-58)
Collin Butler attempts a 3Pt. Contested by Vince Lowry (3.6 feet, ZONE). Collin Butler misses. Rebound secured by Kevin Nowitzki.

[01:52] Team_076 possession (Score: 43-58)
Jalen Poole attempts a 3Pt. Contested by Manu Dosunmu (5.1 feet, MAN). Jalen Poole misses. Offensive rebound by Kevin Nowitzki! Kevin Nowitzki kicks it out.

[01:38] Team_076 possession (Score: 43-58)
Jalen Poole attempts a 3Pt. Wide open! Manu Dosunmu is 7.6 feet away. [MAN] Jalen Poole misses. Rebound secured by Chris LaVine.

[01:20] Team_046 possession (Score: 43-58)
Paul DeRozan drives, Jordan Doncic stays with him. Paul DeRozan attempts a Dunk. Heavily contested by Jordan Doncic (1.8 feet, ZONE)! PAUL DEROZAN MAKES IT! Assist: Collin Butler
Score: 45-58

[01:06] Team_076 possession (Score: 45-58)
Vince Lowry throws a bad pass out of bounds! TURNOVER! (dead ball)

[00:53] Team_046 possession (Score: 45-58)
Paul DeRozan drives, picks up Kevin Nowitzki. Help arrives from Jalen Poole! Paul DeRozan attempts a Dunk. Heavily contested by Jalen Poole (1.9 feet, ZONE)! PAUL DEROZAN MAKES IT!
Score: 47-58

[00:38] Team_076 possession (Score: 47-58)
Kevin Nowitzki attempts a 3Pt. Contested by Chris LaVine (6.0 feet, MAN). Kevin Nowitzki misses. Rebound secured by Paul DeRozan.

[00:21] Team_046 possession (Score: 47-58)
Manu Dosunmu attempts a Layup. BLOCKED BY JORDAN DONCIC! Ball deflects out of bounds off Manu Dosunmu.

[00:06] Team_076 possession (Score: 47-58)
Pascal Lowry drives and kicks out. Jordan Doncic attempts a Midrange. Contested by Manu Dosunmu (4.0 feet, ZONE). Jordan Doncic misses. Rebound secured by Manu Dosunmu.

================================================================================
                              2ND QUARTER COMPLETE                              
================================================================================

2ND QUARTER SCORE: Team_046 22, Team_076 27

BOX SCORE:
================================================================================

Team_046
--------------------------------------------------------------------------------
Player                MIN  PTS  REB  AST  TO      FG   FG%      3P   3P%
--------------------------------------------------------------------------------
Collin Butler           7    5    0    1   0   2/3    66.7     0/0   0.0
D'Angelo O'Neal        17    4    0    0   0   2/3    66.7     0/0   0.0
Victor Nowitzki        17    4    0    0   0   2/2   100.0     0/0   0.0
Paul DeRozan            7    4    3    1   0   2/3    66.7     0/0   0.0
Cade Wall              17    3    0    1   0   1/2    50.0     0/0   0.0
Josh Barrett            7    2    0    0   0   1/3    33.3     0/0   0.0
Kevin Allen            17    0    1    0   0   0/1     0.0     0/0   0.0
Lauri Carter           17    0    3    1   0   0/0     0.0     0/0   0.0
Chris LaVine            7    0    2    0   0   0/1     0.0     0/0   0.0
Manu Dosunmu            7    0    2    1   0   0/2     0.0     0/0   0.0

TEAM: FG: 10/20 (50.0%), 3PT: 1/5 (20.0%), REB: 11 (1 off, 10 def), AST: 5, TO: 3
TEAM FOULS: 6 [Team_076 in BONUS]


Team_076
--------------------------------------------------------------------------------
Player                MIN  PTS  REB  AST  TO      FG   FG%      3P   3P%
--------------------------------------------------------------------------------
Jalen Poole             7    6    0    0   0   2/4    50.0     0/0   0.0
D'Angelo Tatum         17    5    1    0   0   2/3    66.7     0/0   0.0
Cade Barnes            17    5    1    0   0   2/3    66.7     0/0   0.0
Dejounte LaVine        17    4    0    1   0   2/2   100.0     0/0   0.0
Tobias Mitchell        17    3    1    1   0   1/1   100.0     0/0   0.0
Pascal Lowry            7    3    0    0   0   1/2    50.0     0/0   0.0
Paul Leonard           17    0    0    1   0   0/1     0.0     0/0   0.0
Vince Lowry             7    0    1    0   0   0/0     0.0     0/0   0.0
Kevin Nowitzki          7    0    5    0   0   0/3     0.0     0/0   0.0
Jordan Doncic           7    0    2    2   0   0/1     0.0     0/0   0.0

TEAM: FG: 10/20 (50.0%), 3PT: 3/6 (50.0%), REB: 11 (2 off, 9 def), AST: 5, TO: 3
TEAM FOULS: 4

================================================================================

================================================================================
                       3RD QUARTER - Team_046 vs Team_076                       
================================================================================

[12:00] Team_046 possession (Score: 47-58)
Victor Nowitzki attempts a Midrange. Contested by Cade Barnes (4.5 feet, ZONE). VICTOR NOWITZKI MAKES IT!
Score: 49-58

[11:44] Team_076 possession (Score: 49-58)
D'Angelo Tatum loses control! Ball rolls out of bounds! TURNOVER! (dead ball)

[11:26] Team_046 possession (Score: 49-58)
Kevin Allen drives, D'Angelo Tatum stays with him. Kevin Allen attempts a Dunk. Heavily contested by D'Angelo Tatum (0.5 feet, MAN)! Kevin Allen misses. Rebound secured by D'Angelo Tatum.

[11:11] Team_076 possession (Score: 49-58)
Cade Barnes throws a bad pass! Stolen by Cade Wall! TURNOVER! (live ball)

[10:57] Team_046 possession (Score: 49-58)
Cade Wall attempts a Midrange. Contested by Cade Barnes (3.1 feet, MAN). Cade Wall misses. Offensive rebound by Kevin Allen! Kevin Allen kicks it out.

[10:46] Team_046 possession (Score: 49-58)
FOUL! Holding foul on Tobias Mitchell. [Team fouls: 1] No free throws, side out. (Tobias Mitchell: 1 personal fouls)

[10:32] Team_046 possession (Score: 49-58)
Cade Wall attempts a Midrange. Contested by Cade Barnes (5.2 feet, ZONE). CADE WALL MAKES IT!
Score: 51-58

[10:18] Team_076 possession (Score: 51-58)
Paul Leonard makes the Dunk and draws the foul on D'Angelo O'Neal! And-1! Paul Leonard to the line for 1. [Team fouls: 1] (D'Angelo O'Neal: 1 personal fouls)   FT 1/1: GOOD Paul Leonard makes 1/1 from the line.
Score: 51-61

[10:01] Team_046 possession (Score: 51-61)
Kevin Allen attempts a Layup. Contested by Cade Barnes (2.8 feet, ZONE). Kevin Allen misses. Rebound secured by Tobias Mitchell.

[09:45] Team_076 possession (Score: 51-61)
Tobias Mitchell attempts a Layup. Wide open! Victor Nowitzki is 7.0 feet away. [MAN] Tobias Mitchell misses. Rebound secured by Cade Wall.

[09:31] Team_046 possession (Score: 51-61)
Cade Wall attempts a Midrange. Contested by Cade Barnes (4.1 feet, MAN). Cade Wall misses. Rebound secured by D'Angelo Tatum.

[09:18] Team_076 possession (Score: 51-61)
FOUL! Shooting foul on D'Angelo O'Neal. Paul Leonard to the line for 2 free throws. [Team fouls: 2] (D'Angelo O'Neal: 2 personal fouls)   FT 1/2: GOOD   FT 2/2: GOOD Paul Leonard makes 2/2 from the line.
Score: 51-63

[09:05] Team_046 possession (Score: 51-63)
Kevin Allen drives, picks up Cade Barnes. Help arrives from Tobias Mitchell! Kevin Allen attempts a Dunk. Contested by Tobias Mitchell (2.3 feet, ZONE). KEVIN ALLEN MAKES IT!
Score: 53-63

[08:47] Team_076 possession (Score: 53-63)
Tobias Mitchell drives, picks up Kevin Allen. Help arrives from D'Angelo O'Neal! Tobias Mitchell attempts a Dunk. Contested by D'Angelo O'Neal (4.4 feet, ZONE). Tobias Mitchell misses. Rebound secured by Kevin Allen.

[08:34] Team_046 possession (Score: 53-63)
D'Angelo O'Neal drives to the basket... D'Angelo O'Neal loses control! Ball rolls out of bounds! TURNOVER! (dead ball)

[08:19] Team_076 possession (Score: 53-63)
FOUL! Shooting foul on Cade Wall. Paul Leonard to the line for 2 free throws. [Team fouls: 3] (Cade Wall: 1 personal fouls)   FT 1/2: MISS   FT 2/2: GOOD Paul Leonard makes 1/2 from the line.
Score: 53-64

[08:09] Team_046 possession (Score: 53-64)
Cade Wall attempts a 3Pt. Wide open! Cade Barnes is 6.6 feet away. [MAN] CADE WALL MAKES IT! Assist: Lauri Carter
Score: 56-64

[07:55] Team_076 possession (Score: 56-64)
Dejounte LaVine attempts a Midrange. Contested by D'Angelo O'Neal (4.5 feet, MAN). Dejounte LaVine misses. Rebound secured by Kevin Allen.

[07:42] Team_046 possession (Score: 56-64)
Victor Nowitzki attempts a 3Pt. Wide open! Tobias Mitchell is 6.5 feet away. [MAN] Victor Nowitzki misses. Rebound secured by Tobias Mitchell.

[07:27] Team_076 possession (Score: 56-64)
D'Angelo Tatum attempts a Midrange. BLOCKED BY LAURI CARTER! Ball is loose! Rebound secured by Cade Wall.

[07:13] Team_046 possession (Score: 56-64)
Victor Nowitzki attempts a 3Pt. Contested by Tobias Mitchell (5.4 feet, MAN). Victor Nowitzki misses. Rebound secured by Tobias Mitchell.

[07:00] Team_076 possession (Score: 56-64)
Cade Barnes drives, Cade Wall stays with him. Cade Barnes attempts a Dunk. Contested by Cade Wall (2.0 feet, MAN). CADE BARNES MAKES IT!
Score: 56-66

[06:46] Team_046 possession (Score: 56-66)
FOUL! Holding foul on Paul Leonard. [Team fouls: 2] No free throws, side out. (Paul Leonard: 1 personal fouls)

[06:33] Team_046 possession (Score: 56-66)
D'Angelo O'Neal attempts a Layup. Wide open! Dejounte LaVine is 6.6 feet away. [MAN] D'ANGELO O'NEAL MAKES IT! Assist: Victor Nowitzki
Score: 58-66

[06:19] Team_076 possession (Score: 58-66)
D'Angelo Tatum attempts a Layup. BLOCKED BY KEVIN ALLEN! Ball is loose! Rebound secured by Lauri Carter.

[06:04] Team_046 possession (Score: 58-66)
Victor Nowitzki attempts a 3Pt. Contested by Tobias Mitchell (2.5 feet, MAN). Victor Nowitzki misses. Rebound secured by D'Angelo Tatum.

[05:48] Team_076 possession (Score: 58-66)
Cade Barnes drives and kicks out. Tobias Mitchell attempts a 3Pt. Contested by Lauri Carter (3.9 feet, ZONE). Tobias Mitchell misses. Rebound secured by Kevin Allen.

[05:34] Team_046 possession (Score: 58-66)
D'Angelo O'Neal attempts a 3Pt. Wide open! Dejounte LaVine is 6.9 feet away. [MAN] D'Angelo O'Neal misses. Rebound secured by D'Angelo Tatum.

[05:17] Team_076 possession (Score: 58-66)
Cade Barnes attempts a 3Pt. Contested by Lauri Carter (4.0 feet, ZONE). Cade Barnes misses. Rebound secured by Kevin Allen.

[05:01] Team_046 possession (Score: 58-66)
Kevin Allen attempts a Layup. BLOCKED BY TOBIAS MITCHELL! Ball is loose! Rebound secured by D'Angelo Tatum.

[04:48] Team_076 possession (Score: 58-66)
FOUL! Holding foul on Lauri Carter. [Team fouls: 4] No free throws, side out. (Lauri Carter: 1 personal fouls)

[04:35] Team_076 possession (Score: 58-66)
Tobias Mitchell attempts a 3Pt. Wide open! Lauri Carter is 6.3 feet away. [ZONE] Tobias Mitchell misses. Rebound secured by Cade Wall.

[04:20] Team_046 possession (Score: 58-66)
Cade Wall attempts a Midrange. Contested by Cade Barnes (2.3 feet, MAN). CADE WALL MAKES IT! Assist: Victor Nowitzki
Score: 60-66

[04:11] Team_076 possession (Score: 60-66)
Cade Barnes makes the Dunk and draws the foul on Cade Wall! And-1! Cade Barnes to the line for 1. [BONUS: 5 team fouls] (Cade Wall: 2 personal fouls)   FT 1/1: GOOD Cade Barnes makes 1/1 from the line.
Score: 60-69

[04:00] Team_046 possession (Score: 60-69)
Kevin Allen attempts a Layup. Wide open! D'Angelo Tatum is 6.4 feet away. [MAN] Kevin Allen misses. Offensive rebound by Kevin Allen! Kevin Allen kicks it out.

[03:44] Team_046 possession (Score: 60-69)
D'Angelo O'Neal drives and kicks out. Lauri Carter attempts a Midrange. Heavily contested by Paul Leonard (1.6 feet, MAN)! Lauri Carter misses. Rebound secured by Tobias Mitchell.

[03:27] Team_076 possession (Score: 60-69)
D'Angelo Tatum attempts a 3Pt. Contested by Lauri Carter (5.1 feet, ZONE). D'Angelo Tatum misses. Rebound secured by Kevin Allen.

[03:12] Team_046 possession (Score: 60-69)
Cade Wall attempts a 3Pt. Contested by Cade Barnes (5.6 feet, ZONE). Cade Wall misses. Rebound secured by Cade Barnes.

[02:54] Team_076 possession (Score: 60-69)
FOUL! Holding foul on D'Angelo O'Neal. [IN THE BONUS! 6 team fouls] Dejounte LaVine to the line for 2 free throws. (D'Angelo O'Neal: 3 personal fouls)   FT 1/2: GOOD   FT 2/2: GOOD Dejounte LaVine makes 2/2 from the line.
Score: 60-71

[02:39] Team_046 possession (Score: 60-71)
Cade Wall attempts a 3Pt. Contested by Cade Barnes (5.8 feet, ZONE). Cade Wall misses. Offensive rebound by Cade Wall! Cade Wall kicks it out.

[02:22] Team_046 possession (Score: 60-71)
Lauri Carter attempts a Layup. Contested by Cade Barnes (3.5 feet, ZONE). LAURI CARTER MAKES IT! Assist: D'Angelo O'Neal
Score: 62-71

[02:04] Team_076 possession (Score: 62-71)
FOUL! Holding foul on Kevin Allen. [IN THE BONUS! 7 team fouls] D'Angelo Tatum to the line for 2 free throws. (Kevin Allen: 1 personal fouls)   FT 1/2: MISS   FT 2/2: GOOD D'Angelo Tatum makes 1/2 from the line.
Score: 62-72

[01:49] Team_046 possession (Score: 62-72)
Cade Wall attempts a Midrange. Contested by Tobias Mitchell (3.2 feet, ZONE). Cade Wall misses. FOUL! Loose ball foul on Tobias Mitchell during the rebound battle. [Team fouls: 3] No free throws, side out. (Tobias Mitchell: 2 personal fouls)

[01:31] Team_046 possession (Score: 62-72)
D'Angelo O'Neal attempts a 3Pt. Contested by Dejounte LaVine (3.4 feet, MAN). D'Angelo O'Neal misses. Rebound secured by Tobias Mitchell.

[01:16] Team_076 possession (Score: 62-72)
D'Angelo Tatum attempts a Midrange. Contested by Cade Wall (4.0 feet, ZONE). D'ANGELO TATUM MAKES IT! Assist: Cade Barnes
Score: 62-74

[01:05] Team_046 possession (Score: 62-74)
FOUL! Reach-in foul on Cade Barnes during the drive. [Team fouls: 4] No free throws, side out. (Cade Barnes: 1 personal fouls)

[00:49] Team_046 possession (Score: 62-74)
Lauri Carter drives, D'Angelo Tatum stays with him. Lauri Carter attempts a Dunk. Contested by D'Angelo Tatum (4.1 feet, ZONE). Lauri Carter misses. Rebound secured by D'Angelo Tatum.

[00:31] Team_076 possession (Score: 62-74)
Dejounte LaVine attempts a 3Pt. Contested by Lauri Carter (3.7 feet, ZONE). Dejounte LaVine misses. Rebound secured by Kevin Allen.

[00:17] Team_046 possession (Score: 62-74)
Lauri Carter attempts a Layup. Wide open! Paul Leonard is 6.6 feet away. [MAN] LAURI CARTER MAKES IT! Assist: Kevin Allen
Score: 64-74

[00:02] Team_076 possession (Score: 64-74)
Cade Barnes attempts a 3Pt. Contested by Cade Wall (5.3 feet, MAN). Cade Barnes misses. Rebound secured by Kevin Allen.

================================================================================
                              3RD QUARTER COMPLETE                              
================================================================================

3RD QUARTER SCORE: Team_046 17, Team_076 16

BOX SCORE:
================================================================================

Team_046
--------------------------------------------------------------------------------
Player                MIN  PTS  REB  AST  TO      FG   FG%      3P   3P%
--------------------------------------------------------------------------------
Cade Wall              30    7    4    0   0   3/5    60.0     0/0   0.0
Lauri Carter           30    4    2    1   0   2/3    66.7     0/0   0.0
Victor Nowitzki        30    2    0    2   0   1/4    25.0     0/0   0.0
Kevin Allen            30    2    9    1   0   1/4    25.0     0/0   0.0
D'Angelo O'Neal        30    2    0    1   0   1/4    25.0     0/0   0.0

TEAM: FG: 8/20 (40.0%), 3PT: 1/7 (14.3%), REB: 15 (4 off, 11 def), AST: 5, TO: 1
TEAM FOULS: 7 [Team_076 in BONUS]


Team_076
--------------------------------------------------------------------------------
Player                MIN  PTS  REB  AST  TO      FG   FG%      3P   3P%
--------------------------------------------------------------------------------
Paul Leonard           30    6    0    0   0   3/3   100.0     0/0   0.0
Cade Barnes            30    5    1    1   0   2/5    40.0     0/0   0.0
D'Angelo Tatum         30    3    6    0   0   2/5    40.0     0/0   0.0
Dejounte LaVine        30    2    0    0   0   1/3    33.3     0/0   0.0
Tobias Mitchell        30    0    5    0   0   0/3     0.0     0/0   0.0

TEAM: FG: 8/19 (42.1%), 3PT: 0/5 (0.0%), REB: 12 (0 off, 12 def), AST: 1, TO: 2
TEAM FOULS: 4

================================================================================

================================================================================
                       4TH QUARTER - Team_046 vs Team_076                       
================================================================================

[12:00] Substitution (Team_046): D'Angelo O'Neal OUT (stamina: 68) → Collin Butler IN (comeback_detected)

[12:00] Substitution (Team_076): Dejounte LaVine OUT (stamina: 69) → Pascal Lowry IN (comeback_detected)

[12:00] Team_046 possession (Score: 64-74)
Victor Nowitzki attempts a Midrange. Wide open! Pascal Lowry is 7.4 feet away. [ZONE] VICTOR NOWITZKI MAKES IT!
Score: 66-74

[11:46] Team_076 possession (Score: 66-74)
D'Angelo Tatum attempts a 3Pt. Contested by Kevin Allen (4.5 feet, MAN). D'Angelo Tatum misses. FOUL! Loose ball foul on Lauri Carter during the rebound battle. [Team fouls: 1] No free throws, side out. (Lauri Carter: 1 personal fouls)

[11:33] Team_076 possession (Score: 66-74)
Pascal Lowry attempts a Layup. Contested by Kevin Allen (4.4 feet, ZONE). PASCAL LOWRY MAKES IT!
Score: 66-76

[11:21] Team_046 possession (Score: 66-76)
Collin Butler drives to the basket... FOUL! Offensive foul on Collin Butler! Cade Barnes drew the charge! [Team fouls: 2] (Collin Butler: 1 personal fouls) TURNOVER! (dead ball)

[11:03] Team_076 possession (Score: 66-76)
D'Angelo Tatum drives, Cade Wall stays with him. D'Angelo Tatum attempts a Layup. Heavily contested by Cade Wall (1.0 feet, ZONE)! D'ANGELO TATUM MAKES IT! Assist: Paul Leonard
Score: 66-78

[10:53] Team_046 possession (Score: 66-78)
Cade Wall attempts a 3Pt. Wide open! Cade Barnes is 7.9 feet away. [MAN] Cade Wall misses. Rebound secured by Cade Barnes.

[10:40] Team_076 possession (Score: 66-78)
Cade Barnes attempts a Midrange. Contested by Cade Wall (5.5 feet, ZONE). CADE BARNES MAKES IT!
Score: 66-80

[10:20] Team_046 possession (Score: 66-80)
Kevin Allen attempts a Midrange. Contested by Cade Barnes (3.2 feet, ZONE). KEVIN ALLEN MAKES IT! Assist: Collin Butler
Score: 68-80

[10:02] Team_076 possession (Score: 68-80)
D'Angelo Tatum attempts a 3Pt. Wide open! Collin Butler is 6.6 feet away. [ZONE] D'Angelo Tatum misses. Offensive rebound by D'Angelo Tatum! D'Angelo Tatum kicks it out.

[09:53] Team_076 possession (Score: 68-80)
Paul Leonard attempts a Midrange. Contested by Lauri Carter (4.9 feet, MAN). Paul Leonard misses. Rebound secured by Cade Wall.

[09:37] Team_046 possession (Score: 68-80)
Cade Wall attempts a Layup. Contested by Cade Barnes (4.1 feet, ZONE). CADE WALL MAKES IT!
Score: 70-80

[09:25] Team_076 possession (Score: 70-80)
Tobias Mitchell attempts a Midrange. Wide open! Victor Nowitzki is 7.6 feet away. [ZONE] Tobias Mitchell misses. Rebound secured by Cade Wall.

[09:12] Team_046 possession (Score: 70-80)
Collin Butler drives to the basket... Collin Butler throws a bad pass out of bounds! TURNOVER! (dead ball)

[09:12] Substitution (Team_046): Victor Nowitzki OUT → Manu Dosunmu IN (stamina_rule2)

[09:12] Substitution (Team_046): Lauri Carter OUT → Josh Barrett IN (stamina_rule2)

[09:12] Substitution (Team_046): Cade Wall OUT → Chris LaVine IN (stamina_rule2)

[09:12] Substitution (Team_046): Kevin Allen OUT → Paul DeRozan IN (stamina_rule2)

[09:12] Substitution (Team_076): Tobias Mitchell OUT → Jalen Poole IN (stamina_rule2)

[09:12] Substitution (Team_076): Paul Leonard OUT → Vince Lowry IN (stamina_rule2)

[09:12] Substitution (Team_076): Cade Barnes OUT → Kevin Nowitzki IN (stamina_rule2)

[09:12] Substitution (Team_076): D'Angelo Tatum OUT → Jordan Doncic IN (stamina_rule2)

[09:02] Team_076 possession (Score: 70-80)
FOUL! Offensive foul on Jordan Doncic! Chris LaVine drew the charge! [Team fouls: 1] (Jordan Doncic: 1 personal fouls) TURNOVER! (dead ball)

[08:50] Team_046 possession (Score: 70-80)
Josh Barrett attempts a Layup. Contested by Jordan Doncic (4.1 feet, ZONE). Josh Barrett misses. Rebound secured by Jordan Doncic.

[08:34] Team_076 possession (Score: 70-80)
Pascal Lowry attempts a 3Pt. Contested by Collin Butler (2.7 feet, ZONE). Pascal Lowry misses. Offensive rebound by Kevin Nowitzki! Kevin Nowitzki kicks it out.

[08:18] Team_076 possession (Score: 70-80)
Vince Lowry drives to the basket... Vince Lowry throws a bad pass! Stolen by Josh Barrett! TURNOVER! (live ball)

[07:58] Team_046 possession (Score: 70-80)
Paul DeRozan attempts a 3Pt. Contested by Jordan Doncic (3.4 feet, MAN). Paul DeRozan misses. Rebound secured by Kevin Nowitzki.

[07:44] Team_076 possession (Score: 70-80)
Jalen Poole attempts a 3Pt. Contested by Collin Butler (4.7 feet, ZONE). Jalen Poole misses. Rebound secured by Paul DeRozan.

[07:26] Team_046 possession (Score: 70-80)
Josh Barrett attempts a 3Pt. Contested by Vince Lowry (4.3 feet, ZONE). Josh Barrett misses. Rebound secured by Jordan Doncic.

[07:09] Team_076 possession (Score: 70-80)
FOUL! Reach-in foul on Chris LaVine during the drive. [Team fouls: 3] No free throws, side out. (Chris LaVine: 1 personal fouls)

[06:53] Team_076 possession (Score: 70-80)
Pascal Lowry commits a violation (traveling/carry)! TURNOVER! (dead ball)

[06:40] Team_046 possession (Score: 70-80)
Josh Barrett attempts a Layup. Contested by Vince Lowry (2.9 feet, MAN). JOSH BARRETT MAKES IT! Assist: Collin Butler
Score: 72-80

[06:26] Team_076 possession (Score: 72-80)
FOUL! Holding foul on Collin Butler. [Team fouls: 4] No free throws, side out. (Collin Butler: 2 personal fouls)

[06:08] Team_076 possession (Score: 72-80)
Pascal Lowry attempts a 3Pt. Contested by Collin Butler (3.4 feet, ZONE). Pascal Lowry misses. Rebound secured by Manu Dosunmu.

[05:54] Team_046 possession (Score: 72-80)
Paul DeRozan drives and kicks out. Chris LaVine attempts a 3Pt. Contested by Kevin Nowitzki (3.9 feet, MAN). Chris LaVine misses. Rebound secured by Jordan Doncic.

[05:37] Team_076 possession (Score: 72-80)
Vince Lowry attempts a 3Pt. Contested by Josh Barrett (5.9 feet, MAN). Vince Lowry misses. Offensive rebound by Jordan Doncic! Jordan Doncic kicks it out.

[05:27] Team_076 possession (Score: 72-80)
Jalen Poole attempts a 3Pt. Contested by Collin Butler (3.7 feet, ZONE). Jalen Poole misses. Rebound secured by Paul DeRozan.

[05:09] Team_046 possession (Score: 72-80)
FOUL! Holding foul on Pascal Lowry. [Team fouls: 2] No free throws, side out. (Pascal Lowry: 1 personal fouls)

[04:52] Team_046 possession (Score: 72-80)
FOUL! Holding foul on Pascal Lowry. [Team fouls: 3] No free throws, side out. (Pascal Lowry: 2 personal fouls)

[04:35] Team_046 possession (Score: 72-80)
Josh Barrett attempts a 3Pt. Heavily contested by Vince Lowry (1.9 feet, ZONE)! Josh Barrett misses. Rebound secured by Kevin Nowitzki.

[04:24] Team_076 possession (Score: 72-80)
Vince Lowry drives and kicks out. Pascal Lowry attempts a Midrange. Contested by Collin Butler (4.7 feet, MAN). Pascal Lowry misses. Rebound secured by Paul DeRozan.

[04:09] Team_046 possession (Score: 72-80)
Paul DeRozan drives, picks up Jordan Doncic. Help arrives from Jalen Poole! Paul DeRozan attempts a Dunk. Heavily contested by Jalen Poole (0.9 feet, MAN)! PAUL DEROZAN MAKES IT!
Score: 74-80

[03:56] Team_076 possession (Score: 74-80)
Pascal Lowry drives, Chris LaVine stays with him. Pascal Lowry attempts a Dunk. Heavily contested by Chris LaVine (0.5 feet, ZONE)! PASCAL LOWRY MAKES IT! Assist: Kevin Nowitzki
Score: 74-82

[03:40] Team_046 possession (Score: 74-82)
Josh Barrett attempts a 3Pt. Contested by Kevin Nowitzki (4.8 feet, ZONE). Josh Barrett misses. Rebound secured by Jordan Doncic.

[03:27] Team_076 possession (Score: 74-82)
Vince Lowry attempts a Midrange. Contested by Josh Barrett (3.5 feet, MAN). Vince Lowry misses. FOUL! Loose ball foul on Manu Dosunmu during the rebound battle. [IN THE BONUS! 5 team fouls] Kevin Nowitzki to the line for 2 free throws. (Manu Dosunmu: 1 personal fouls)   FT 1/2: GOOD   FT 2/2: GOOD Kevin Nowitzki makes 2/2 from the line.
Score: 74-84

[03:16] Team_046 possession (Score: 74-84)
Chris LaVine attempts a Midrange. Wide open! Jalen Poole is 6.9 feet away. [ZONE] Chris LaVine misses. Offensive rebound by Paul DeRozan! Paul DeRozan puts it back in!
Score: 76-84

[03:03] Team_076 possession (Score: 76-84)
Jalen Poole attempts a 3Pt. Wide open! Manu Dosunmu is 7.1 feet away. [MAN] JALEN POOLE MAKES IT!
Score: 76-87

[02:51] Team_046 possession (Score: 76-87)
Manu Dosunmu drives, Jordan Doncic stays with him. Manu Dosunmu attempts a Dunk. Heavily contested by Jordan Doncic (1.9 feet, ZONE)! Manu Dosunmu misses. Rebound secured by Kevin Nowitzki.

[02:38] Team_076 possession (Score: 76-87)
Kevin Nowitzki attempts a 3Pt. Wide open! Collin Butler is 8.2 feet away. [ZONE] Kevin Nowitzki misses. Rebound secured by Paul DeRozan.

[02:26] Team_046 possession (Score: 76-87)
Manu Dosunmu attempts a 3Pt. Wide open! Jalen Poole is 7.4 feet away. [MAN] MANU DOSUNMU MAKES IT! Assist: Paul DeRozan
Score: 79-87

[02:10] Team_076 possession (Score: 79-87)
Pascal Lowry attempts a Midrange. Contested by Manu Dosunmu (5.3 feet, ZONE). PASCAL LOWRY MAKES IT! Assist: Kevin Nowitzki
Score: 79-89

[01:59] Team_046 possession (Score: 79-89)
Josh Barrett drives, picks up Vince Lowry. Help arrives from Jalen Poole! Josh Barrett attempts a Layup. Heavily contested by Jalen Poole (1.7 feet, MAN)! JOSH BARRETT MAKES IT! Assist: Paul DeRozan
Score: 81-89

[01:46] Team_076 possession (Score: 81-89)
Vince Lowry attempts a 3Pt. Contested by Chris LaVine (5.7 feet, ZONE). VINCE LOWRY MAKES IT! Assist: Jalen Poole
Score: 81-92

[01:34] Team_046 possession (Score: 81-92)
Manu Dosunmu attempts a 3Pt. Wide open! Pascal Lowry is 6.7 feet away. [ZONE] MANU DOSUNMU MAKES IT! Assist: Josh Barrett
Score: 84-92

[01:17] Team_076 possession (Score: 84-92)
Jordan Doncic attempts a Midrange. Contested by Josh Barrett (5.1 feet, ZONE). Jordan Doncic misses. Rebound secured by Chris LaVine.

[01:04] Team_046 possession (Score: 84-92)
Chris LaVine attempts a 3Pt. Wide open! Kevin Nowitzki is 6.5 feet away. [MAN] CHRIS LAVINE MAKES IT! Assist: Manu Dosunmu
Score: 87-92

[00:48] Team_076 possession (Score: 87-92)
Jordan Doncic drives to the basket... Jordan Doncic throws a bad pass! Stolen by Chris LaVine! TURNOVER! (live ball)

[00:32] Team_046 possession (Score: 87-92)
Josh Barrett commits a violation (traveling/carry)! TURNOVER! (dead ball)

[00:17] Team_076 possession (Score: 87-92)
Vince Lowry attempts a Layup. Contested by Josh Barrett (2.4 feet, MAN). Vince Lowry misses. Rebound secured by Paul DeRozan.

[00:06] Team_046 possession (Score: 87-92)
FOUL! Shooting foul on Jalen Poole. Josh Barrett to the line for 2 free throws. [Team fouls: 4] (Jalen Poole: 1 personal fouls)   FT 1/2: GOOD   FT 2/2: MISS Josh Barrett makes 1/2 from the line. Offensive rebound by Chris LaVine! Chris LaVine kicks it out.
Score: 88-92

================================================================================
                              4TH QUARTER COMPLETE                              
================================================================================

4TH QUARTER SCORE: Team_046 24, Team_076 18

BOX SCORE:
================================================================================

Team_046
--------------------------------------------------------------------------------
Player                MIN  PTS  REB  AST  TO      FG   FG%      3P   3P%
--------------------------------------------------------------------------------
Manu Dosunmu           16    6    1    1   0   2/3    66.7     0/0   0.0
Josh Barrett           16    4    0    1   0   2/6    33.3     0/0   0.0
Paul DeRozan           16    4    6    2   0   2/4    50.0     0/0   0.0
Chris LaVine           16    3    2    0   0   1/1   100.0     0/0   0.0
Victor Nowitzki        33    2    0    0   0   1/1   100.0     0/0   0.0
Cade Wall              33    2    2    0   0   1/2    50.0     0/0   0.0
Kevin Allen            33    2    0    0   0   1/1   100.0     0/0   0.0
Collin Butler          19    0    0    2   0   0/0     0.0     0/0   0.0

TEAM: FG: 10/18 (55.6%), 3PT: 3/8 (37.5%), REB: 11 (2 off, 9 def), AST: 6, TO: 3
TEAM FOULS: 5 [Team_076 in BONUS]


Team_076
--------------------------------------------------------------------------------
Player                MIN  PTS  REB  AST  TO      FG   FG%      3P   3P%
--------------------------------------------------------------------------------
Pascal Lowry           19    6    0    0   0   3/4    75.0     0/0   0.0
Jalen Poole            16    3    0    1   0   1/3    33.3     0/0   0.0
Vince Lowry            16    3    0    0   0   1/3    33.3     0/0   0.0
D'Angelo Tatum         33    2    2    0   0   1/1   100.0     0/0   0.0
Cade Barnes            33    2    1    0   0   1/1   100.0     0/0   0.0
Kevin Nowitzki         16    2    4    2   0   1/2    50.0     0/0   0.0
Paul Leonard           33    0    0    1   0   0/1     0.0     0/0   0.0
Tobias Mitchell        33    0    0    0   0   0/1     0.0     0/0   0.0
Jordan Doncic          16    0    5    0   0   0/1     0.0     0/0   0.0

TEAM: FG: 8/17 (47.1%), 3PT: 2/6 (33.3%), REB: 12 (4 off, 8 def), AST: 4, TO: 4
TEAM FOULS: 4

================================================================================

================================================================================
                               FULL GAME COMPLETE                               
================================================================================

FINAL SCORE: Team_046 88, Team_076 92

SCORING BY QUARTER:
--------------------------------------------------------------------------------
Team                     Q1     Q2     Q3     Q4    FINAL
--------------------------------------------------------------------------------
Team_046                 25     22     17     24       88
Team_076                 31     27     16     18       92
--------------------------------------------------------------------------------

FULL GAME BOX SCORE:
================================================================================

Team_046
--------------------------------------------------------------------------------
Player                MIN  PTS  REB  AST  TO      FG   FG%      3P   3P%      FT STL BLK
--------------------------------------------------------------------------------
Victor Nowitzki        33   14    0    4   0   6/12   50.0   1/7    14.3   1/1     0   0
Lauri Carter           33    7    7    5   3   3/6    50.0   1/1   100.0   0/0     0   1
Cade Wall              33   22   10    1   0   9/18   50.0   2/6    33.3   4/4     1   0
Kevin Allen            33    6   13    1   2   3/8    37.5   0/0     0.0   2/2     2   1
D'Angelo O'Neal        30    8    0    1   0   4/10   40.0   0/4     0.0   2/3     0   0
Collin Butler          19    5    0    3   2   2/3    66.7   1/2    50.0   0/0     0   0
Manu Dosunmu           16    6    3    2   0   2/5    40.0   2/2   100.0   0/0     0   0
Josh Barrett           16    6    0    1   1   3/9    33.3   0/3     0.0   1/2     1   0
Chris LaVine           16    3    4    0   0   2/3    66.7   1/2    50.0   0/0     1   0
Paul DeRozan           16    8    9    3   0   3/6    50.0   0/1     0.0   0/2     0   0

TEAM: FG: 37/80 (46.2%), 3PT: 8/28 (28.6%), REB: 46 (9 off, 37 def), AST: 21, TO: 8


Team_076
--------------------------------------------------------------------------------
Player                MIN  PTS  REB  AST  TO      FG   FG%      3P   3P%      FT STL BLK
--------------------------------------------------------------------------------
Tobias Mitchell        33    8   12    2   1   4/8    50.0   1/2    50.0   1/1     0   1
Paul Leonard           33    8    0    3   1   4/7    57.1   0/2     0.0   4/5     2   0
Cade Barnes            33   19    7    1   1   7/12   58.3   0/2     0.0   3/3     0   0
D'Angelo Tatum         33   15   15    3   1   6/11   54.5   1/2    50.0   4/5     0   0
Dejounte LaVine        30   16    0    1   1   6/12   50.0   1/4    25.0   5/6     0   0
Pascal Lowry           19    9    0    0   2   4/6    66.7   1/2    50.0   0/0     0   0
Jalen Poole            16    9    0    1   0   3/7    42.9   2/5    40.0   1/1     0   0
Vince Lowry            16    3    1    0   3   2/4    50.0   1/1   100.0   0/0     0   0
Kevin Nowitzki         16    2    9    2   1   0/4     0.0   0/2     0.0   3/4     0   0
Jordan Doncic          16    0    7    2   1   0/2     0.0   0/0     0.0   0/0     0   1

TEAM: FG: 38/75 (50.7%), 3PT: 7/22 (31.8%), REB: 51 (9 off, 42 def), AST: 15, TO: 12

================================================================================
