================================================================================
                        FULL GAME - Team_049 vs Team_058                        
================================================================================

================================================================================
                       1ST QUARTER - Team_049 vs Team_058                       
================================================================================

[12:00] Team_049 possession (Score: 0-0)
Shai Bird attempts a Layup. Heavily contested by Bradley Sexton (0.5 feet, MAN)! SHAI BIRD MAKES IT! Assist: Shai Mobley
Score: 2-0

[11:50] Team_058 possession (Score: 2-0)
Tyrese Doncic attempts a 3Pt. Contested by Ja Oladipo (4.3 feet, ZONE). Tyrese Doncic misses. Rebound secured by De'Aaron Allen.

[11:37] Team_049 possession (Score: 2-0)
Shai Bird attempts a Layup. Contested by Stephen Haliburton (4.9 feet, ZONE). SHAI BIRD MAKES IT!
Score: 4-0

[11:20] Team_058 possession (Score: 4-0)
Stephen Haliburton loses control! Ball rolls out of bounds! TURNOVER! (dead ball)

[11:06] Team_049 possession (Score: 4-0)
Ja Oladipo attempts a 3Pt. Heavily contested by Kyle Westbrook (1.7 feet, MAN)! Ja Oladipo misses. Rebound secured by Stephen Haliburton.

[10:57] Team_058 possession (Score: 4-0)
Stephen Haliburton drives, picks up De'Aaron Allen. Help arrives from Ja Oladipo! Stephen Haliburton attempts a Layup. Heavily contested by Ja Oladipo (1.1 feet, MAN)! Stephen Haliburton misses. Rebound secured by Jimmy Griffin.

[10:41] Team_049 possession (Score: 4-0)
Ja Oladipo attempts a Layup. Wide open! Tyrese Doncic is 7.4 feet away. [ZONE] JA OLADIPO MAKES IT! Assist: Jimmy Griffin
Score: 6-0

[10:26] Team_058 possession (Score: 6-0)
Stephen Haliburton attempts a 3Pt. Contested by De'Aaron Allen (2.9 feet, MAN). Stephen Haliburton misses. Rebound secured by De'Aaron Allen.

[10:14] Team_049 possession (Score: 6-0)
Jimmy Griffin attempts a Layup. Heavily contested by Vince Hyland (1.3 feet, MAN)! JIMMY GRIFFIN MAKES IT!
Score: 8-0

[09:58] Team_058 possession (Score: 8-0)
Tyrese Doncic attempts a Layup. Wide open! Shai Mobley is 6.1 feet away. [MAN] Tyrese Doncic misses. Rebound secured by Shai Mobley.

[09:48] Team_049 possession (Score: 8-0)
Shai Mobley makes the Layup and draws the foul on Tyrese Doncic! And-1! Shai Mobley to the line for 1. [Team fouls: 1] (Tyrese Doncic: 1 personal fouls)   FT 1/1: GOOD Shai Mobley makes 1/1 from the line.
Score: 11-0

[09:37] Team_058 possession (Score: 11-0)
Kyle Westbrook attempts a Midrange. Contested by De'Aaron Allen (2.3 feet, ZONE). Kyle Westbrook misses. Rebound secured by Jimmy Griffin.

[09:22] Team_049 possession (Score: 11-0)
Shai Bird makes the Layup and draws the foul on Stephen Haliburton! And-1! Shai Bird to the line for 1. [Team fouls: 2] (Stephen Haliburton: 1 personal fouls)   FT 1/1: GOOD Shai Bird makes 1/1 from the line.
Score: 14-0

[09:10] Team_058 possession (Score: 14-0)
Bradley Sexton attempts a 3Pt. Contested by Ja Oladipo (4.1 feet, ZONE). Bradley Sexton misses. Rebound secured by Jimmy Griffin.

[08:54] Team_049 possession (Score: 14-0)
Shai Bird makes the Layup and draws the foul on Bradley Sexton! And-1! Shai Bird to the line for 1. [Team fouls: 3] (Bradley Sexton: 1 personal fouls)   FT 1/1: GOOD Shai Bird makes 1/1 from the line.
Score: 17-0

[08:43] Team_058 possession (Score: 17-0)
Vince Hyland throws a bad pass! Stolen by Jimmy Griffin! TURNOVER! (live ball)

[08:29] Team_049 possession (Score: 17-0)
Shai Bird attempts a 3Pt. Contested by Kyle Westbrook (4.6 feet, ZONE). Shai Bird misses. Rebound secured by Bradley Sexton.

[08:15] Team_058 possession (Score: 17-0)
Kyle Westbrook attempts a 3Pt. Contested by Ja Oladipo (4.2 feet, ZONE). Kyle Westbrook misses. Rebound secured by Shai Mobley.

[07:57] Team_049 possession (Score: 17-0)
FOUL! Holding foul on Bradley Sexton. [Team fouls: 4] No free throws, side out. (Bradley Sexton: 2 personal fouls)

[07:42] Team_049 possession (Score: 17-0)
De'Aaron Allen attempts a 3Pt. Heavily contested by Bradley Sexton (0.5 feet, ZONE)! De'Aaron Allen misses. Rebound secured by Tyrese Doncic.

[07:30] Team_058 possession (Score: 17-0)
Tyrese Doncic drives to the basket... FOUL! Offensive foul on Tyrese Doncic! Shai Mobley drew the charge! [Team fouls: 5] (Tyrese Doncic: 2 personal fouls) TURNOVER! (dead ball)

[07:15] Team_049 possession (Score: 17-0)
Shai Mobley throws a bad pass! Stolen by Tyrese Doncic! TURNOVER! (live ball)

[07:02] Team_058 possession (Score: 17-0)
Kyle Westbrook attempts a 3Pt. Contested by Ja Oladipo (4.0 feet, MAN). KYLE WESTBROOK MAKES IT! Assist: Bradley Sexton
Score: 17-3

[06:50] Team_049 possession (Score: 17-3)
Jimmy Griffin attempts a 3Pt. Contested by Vince Hyland (2.0 feet, MAN). Jimmy Griffin misses. Rebound secured by Tyrese Doncic.

[06:36] Team_058 possession (Score: 17-3)
Tyrese Doncic attempts a Midrange. Contested by Shai Mobley (4.0 feet, MAN). TYRESE DONCIC MAKES IT! Assist: Vince Hyland
Score: 17-5

[06:20] Team_049 possession (Score: 17-5)
Jimmy Griffin attempts a 3Pt. Heavily contested by Kyle Westbrook (1.9 feet, ZONE)! Jimmy Griffin misses. Rebound secured by Tyrese Doncic.

[06:00] Team_058 possession (Score: 17-5)
FOUL! Reach-in foul on Shai Mobley during the drive. [Team fouls: 1] No free throws, side out. (Shai Mobley: 1 personal fouls)

[05:46] Team_058 possession (Score: 17-5)
Bradley Sexton attempts a Layup. Contested by Shai Bird (4.7 feet, MAN). Bradley Sexton misses. Rebound secured by Shai Mobley.

[05:33] Team_049 possession (Score: 17-5)
Shai Mobley attempts a Midrange. Wide open! Vince Hyland is 7.6 feet away. [ZONE] SHAI MOBLEY MAKES IT! Assist: Jimmy Griffin
Score: 19-5

[05:20] Team_058 possession (Score: 19-5)
Bradley Sexton attempts a 3Pt. Contested by De'Aaron Allen (3.1 feet, ZONE). Bradley Sexton misses. Rebound secured by De'Aaron Allen.

[05:09] Team_049 possession (Score: 19-5)
Shai Mobley drives to the basket... FOUL! Offensive foul on Shai Mobley! Stephen Haliburton drew the charge! [Team fouls: 2] (Shai Mobley: 2 personal fouls) TURNOVER! (dead ball)

[04:54] Team_058 possession (Score: 19-5)
FOUL! Holding foul on Shai Bird. [Team fouls: 3] No free throws, side out. (Shai Bird: 1 personal fouls)

[04:44] Team_058 possession (Score: 19-5)
Tyrese Doncic drives and kicks out. Bradley Sexton attempts a 3Pt. Wide open! Ja Oladipo is 6.3 feet away. [ZONE] Bradley Sexton misses. Rebound secured by Jimmy Griffin.

[04:25] Team_049 possession (Score: 19-5)
Jimmy Griffin drives and kicks out. De'Aaron Allen attempts a 3Pt. Wide open! Stephen Haliburton is 7.1 feet away. [MAN] DE'AARON ALLEN MAKES IT! Assist: Ja Oladipo
Score: 22-5

[04:13] Team_058 possession (Score: 22-5)
Kyle Westbrook makes the Layup and draws the foul on Ja Oladipo! And-1! Kyle Westbrook to the line for 1. [Team fouls: 4] (Ja Oladipo: 1 personal fouls)   FT 1/1: MISS Kyle Westbrook makes 0/1 from the line. Rebound secured by De'Aaron Allen.
Score: 22-7

[04:00] Team_049 possession (Score: 22-7)
Jimmy Griffin attempts a 3Pt. Contested by Vince Hyland (5.1 feet, MAN). JIMMY GRIFFIN MAKES IT! Assist: Shai Mobley
Score: 25-7

[03:44] Team_058 possession (Score: 25-7)
Vince Hyland attempts a Midrange. Wide open! Jimmy Griffin is 8.0 feet away. [MAN] VINCE HYLAND MAKES IT!
Score: 25-9

[03:29] Team_049 possession (Score: 25-9)
Ja Oladipo makes the Dunk and draws the foul on Kyle Westbrook! And-1! Ja Oladipo to the line for 1. [BONUS: 6 team fouls] (Kyle Westbrook: 1 personal fouls)   FT 1/1: MISS Ja Oladipo makes 0/1 from the line. Rebound secured by Tyrese Doncic.
Score: 27-9

[03:15] Team_058 possession (Score: 27-9)
Vince Hyland attempts a Midrange. Wide open! Jimmy Griffin is 9.1 feet away. [ZONE] Vince Hyland misses. FOUL! Loose ball foul on Shai Mobley during the rebound battle. [IN THE BONUS! 5 team fouls] Tyrese Doncic to the line for 2 free throws. (Shai Mobley: 3 personal fouls)   FT 1/2: GOOD   FT 2/2: GOOD Tyrese Doncic makes 2/2 from the line.
Score: 27-11

[03:00] Team_049 possession (Score: 27-11)
Jimmy Griffin attempts a 3Pt. Contested by Bradley Sexton (4.5 feet, ZONE). JIMMY GRIFFIN MAKES IT! Assist: Ja Oladipo
Score: 30-11

[02:41] Team_058 possession (Score: 30-11)
Vince Hyland drives and kicks out. FOUL! Shooting foul on Shai Bird. Bradley Sexton to the line for 3 free throws. [BONUS: 6 team fouls] (Shai Bird: 2 personal fouls)   FT 1/3: GOOD   FT 2/3: GOOD   FT 3/3: MISS Bradley Sexton makes 2/3 from the line. Offensive rebound by Stephen Haliburton! Stephen Haliburton puts it back in!
Score: 30-15

[02:22] Team_049 possession (Score: 30-15)
Ja Oladipo attempts a 3Pt. Wide open! Kyle Westbrook is 9.3 feet away. [MAN] Ja Oladipo misses. Rebound secured by Stephen Haliburton.

[02:07] Team_058 possession (Score: 30-15)
Stephen Haliburton attempts a Layup. Wide open! De'Aaron Allen is 6.3 feet away. [MAN] STEPHEN HALIBURTON MAKES IT! Assist: Tyrese Doncic
Score: 30-17

[01:52] Team_049 possession (Score: 30-17)
Jimmy Griffin drives and kicks out. FOUL! Shooting foul on Stephen Haliburton. De'Aaron Allen to the line for 2 free throws. [BONUS: 7 team fouls] (Stephen Haliburton: 2 personal fouls)   FT 1/2: GOOD   FT 2/2: GOOD De'Aaron Allen makes 2/2 from the line.
Score: 32-17

[01:36] Team_058 possession (Score: 32-17)
Tyrese Doncic drives to the basket... Tyrese Doncic throws a bad pass! Stolen by Shai Mobley! TURNOVER! (live ball)

[01:23] Team_049 possession (Score: 32-17)
Shai Bird attempts a 3Pt. Contested by Bradley Sexton (4.4 feet, ZONE). Shai Bird misses. Offensive rebound by De'Aaron Allen! De'Aaron Allen kicks it out.

[01:05] Team_049 possession (Score: 32-17)
Ja Oladipo attempts a 3Pt. Contested by Bradley Sexton (4.9 feet, ZONE). Ja Oladipo misses. Offensive rebound by Shai Mobley! Shai Mobley puts it back in!
Score: 34-17

[00:51] Team_058 possession (Score: 34-17)
Bradley Sexton attempts a 3Pt. Contested by Ja Oladipo (3.8 feet, ZONE). Bradley Sexton misses. Rebound secured by De'Aaron Allen.

[00:36] Team_049 possession (Score: 34-17)
Shai Mobley attempts a Midrange. Wide open! Kyle Westbrook is 6.6 feet away. [ZONE] Shai Mobley misses. Rebound secured by Tyrese Doncic.

[00:22] Team_058 possession (Score: 34-17)
Stephen Haliburton attempts a 3Pt. Contested by Ja Oladipo (2.5 feet, ZONE). STEPHEN HALIBURTON MAKES IT! Assist: Vince Hyland
Score: 34-20

[00:11] Team_049 possession (Score: 34-20)
Shai Mobley throws a bad pass! Stolen by Tyrese Doncic! TURNOVER! (live ball)

[00:01] Team_058 possession (Score: 34-20)
Bradley Sexton attempts a 3Pt. Contested by Shai Bird (5.0 feet, MAN). BRADLEY SEXTON MAKES IT! Assist: Vince Hyland
Score: 34-23

================================================================================
                              1ST QUARTER COMPLETE                              
================================================================================

1ST QUARTER SCORE: Team_049 34, Team_058 23

BOX SCORE:
================================================================================

Team_049
--------------------------------------------------------------------------------
Player                MIN  PTS  REB  AST  TO      FG   FG%      3P   3P%
--------------------------------------------------------------------------------
Shai Bird              12   10    0    0   0   4/5    80.0     0/0   0.0
Jimmy Griffin          12    8    4    2   0   3/5    60.0     0/0   0.0
Shai Mobley            12    7    4    2   0   3/4    75.0     0/0   0.0
De'Aaron Allen         12    5    6    0   0   2/3    66.7     0/0   0.0
Ja Oladipo             12    2    0    2   0   1/4    25.0     0/0   0.0

TEAM: FG: 13/21 (61.9%), 3PT: 3/9 (33.3%), REB: 14 (2 off, 12 def), AST: 6, TO: 3
TEAM FOULS: 6 [Team_058 in BONUS]


Team_058
--------------------------------------------------------------------------------
Player                MIN  PTS  REB  AST  TO      FG   FG%      3P   3P%
--------------------------------------------------------------------------------
Stephen Haliburton     12    9    2    0   0   3/5    60.0     0/0   0.0
Tyrese Doncic          12    4    5    1   0   2/5    40.0     0/0   0.0
Kyle Westbrook         12    3    0    0   0   1/4    25.0     0/0   0.0
Bradley Sexton         12    3    1    1   0   1/5    20.0     0/0   0.0
Vince Hyland           12    2    0    3   0   1/1   100.0     0/0   0.0

TEAM: FG: 8/20 (40.0%), 3PT: 3/9 (33.3%), REB: 8 (0 off, 8 def), AST: 5, TO: 4
TEAM FOULS: 7 [Team_049 in BONUS]

================================================================================

================================================================================
                       2ND QUARTER - Team_049 vs Team_058                       
================================================================================

[12:00] Team_049 possession (Score: 34-23)
Shai Mobley makes the Layup and draws the foul on Tyrese Doncic! And-1! Shai Mobley to the line for 1. [Team fouls: 1] (Tyrese Doncic: 1 personal fouls)   FT 1/1: GOOD Shai Mobley makes 1/1 from the line.
Score: 37-23

[11:46] Team_058 possession (Score: 37-23)
Vince Hyland attempts a 3Pt. Wide open! Jimmy Griffin is 7.4 feet away. [MAN] Vince Hyland misses. Rebound secured by Jimmy Griffin.

[11:35] Team_049 possession (Score: 37-23)
Shai Bird attempts a 3Pt. Wide open! Bradley Sexton is 7.1 feet away. [MAN] Shai Bird misses. Rebound secured by Bradley Sexton.

[11:22] Team_058 possession (Score: 37-23)
FOUL! Shooting foul on Shai Bird. Bradley Sexton to the line for 2 free throws. [Team fouls: 1] (Shai Bird: 1 personal fouls)   FT 1/2: GOOD   FT 2/2: GOOD Bradley Sexton makes 2/2 from the line.
Score: 37-25

[11:11] Team_049 possession (Score: 37-25)
Jimmy Griffin attempts a 3Pt. Contested by Vince Hyland (3.9 feet, MAN). JIMMY GRIFFIN MAKES IT! Assist: De'Aaron Allen
Score: 40-25

[11:02] Team_058 possession (Score: 40-25)
Kyle Westbrook attempts a 3Pt. Contested by Ja Oladipo (5.8 feet, MAN). Kyle Westbrook misses. Offensive rebound by Stephen Haliburton! Stephen Haliburton's putback is no good. Rebound secured by Jimmy Griffin.

[10:46] Team_049 possession (Score: 40-25)
Ja Oladipo attempts a 3Pt. Wide open! Kyle Westbrook is 6.9 feet away. [MAN] JA OLADIPO MAKES IT! Assist: Shai Bird
Score: 43-25

[10:32] Team_058 possession (Score: 43-25)
Stephen Haliburton attempts a Midrange. Contested by De'Aaron Allen (2.9 feet, ZONE). Stephen Haliburton misses. Rebound secured by Jimmy Griffin.

[10:19] Team_049 possession (Score: 43-25)
Shai Bird attempts a Midrange. Contested by Kyle Westbrook (2.9 feet, ZONE). Shai Bird misses. Rebound secured by Bradley Sexton.

[10:03] Team_058 possession (Score: 43-25)
FOUL! Offensive foul on Tyrese Doncic! Shai Mobley drew the charge! [Team fouls: 2] (Tyrese Doncic: 2 personal fouls) TURNOVER! (dead ball)

[09:47] Team_049 possession (Score: 43-25)
De'Aaron Allen attempts a Layup. Heavily contested by Stephen Haliburton (1.2 feet, MAN)! DE'AARON ALLEN MAKES IT!
Score: 45-25

[09:34] Team_058 possession (Score: 45-25)
Bradley Sexton makes the Layup and draws the foul on Jimmy Griffin! And-1! Bradley Sexton to the line for 1. [Team fouls: 2] (Jimmy Griffin: 1 personal fouls)   FT 1/1: GOOD Bradley Sexton makes 1/1 from the line.
Score: 45-28

[09:20] Team_049 possession (Score: 45-28)
FOUL! Holding foul on Stephen Haliburton. [Team fouls: 3] No free throws, side out. (Stephen Haliburton: 1 personal fouls)

[09:08] Team_049 possession (Score: 45-28)
Ja Oladipo throws a bad pass! Stolen by Kyle Westbrook! TURNOVER! (live ball)

[08:51] Team_058 possession (Score: 45-28)
Stephen Haliburton attempts a 3Pt. Contested by De'Aaron Allen (4.3 feet, MAN). STEPHEN HALIBURTON MAKES IT! Assist: Tyrese Doncic
Score: 45-31

[08:34] Team_049 possession (Score: 45-31)
FOUL! Shooting foul on Bradley Sexton. Shai Bird to the line for 2 free throws. [Team fouls: 4] (Bradley Sexton: 1 personal fouls)   FT 1/2: GOOD   FT 2/2: MISS Shai Bird makes 1/2 from the line. Rebound secured by Stephen Haliburton.
Score: 46-31

[08:23] Team_058 possession (Score: 46-31)
Stephen Haliburton attempts a 3Pt. Contested by Ja Oladipo (5.4 feet, ZONE). Stephen Haliburton misses. Rebound secured by Jimmy Griffin.

[08:09] Team_049 possession (Score: 46-31)
Shai Bird attempts a Midrange. Contested by Bradley Sexton (2.7 feet, MAN). SHAI BIRD MAKES IT! Assist: Shai Mobley
Score: 48-31

[07:51] Team_058 possession (Score: 48-31)
Tyrese Doncic attempts a 3Pt. Wide open! Ja Oladipo is 9.1 feet away. [ZONE] Tyrese Doncic misses. Rebound secured by Shai Mobley.

[07:37] Team_049 possession (Score: 48-31)
FOUL! Shooting foul on Tyrese Doncic. Shai Mobley to the line for 2 free throws. [BONUS: 5 team fouls] (Tyrese Doncic: 3 personal fouls)   FT 1/2: GOOD   FT 2/2: MISS Shai Mobley makes 1/2 from the line. Rebound secured by Vince Hyland.
Score: 49-31

[07:24] Team_058 possession (Score: 49-31)
Tyrese Doncic drives to the basket... Tyrese Doncic throws a bad pass out of bounds! TURNOVER! (dead ball)

[07:24] Substitution (Team_049): Shai Bird OUT → Shaquille Lillard IN (stamina_rule2)

[07:24] Substitution (Team_049): Ja Oladipo OUT → Shai Jordan IN (stamina_rule2)

[07:24] Substitution (Team_049): Jimmy Griffin OUT → Desmond Towns IN (stamina_rule2)

[07:24] Substitution (Team_049): De'Aaron Allen OUT → Giannis Anunoby IN (stamina_rule2)

[07:24] Substitution (Team_049): Shai Mobley OUT → Miles Jackson IN (stamina_rule2)

[07:24] Substitution (Team_058): Bradley Sexton OUT → Draymond Williamson IN (stamina_rule2)

[07:24] Substitution (Team_058): Kyle Westbrook OUT → Jordan Ingram IN (stamina_rule2)

[07:24] Substitution (Team_058): Vince Hyland OUT → Pascal Holiday IN (stamina_rule2)

[07:24] Substitution (Team_058): Stephen Haliburton OUT → Shai Lowry IN (stamina_rule2)

[07:24] Substitution (Team_058): Tyrese Doncic OUT → Jarrett Gilgeous-Alexander IN (stamina_rule2)

[07:08] Team_049 possession (Score: 49-31)
Miles Jackson drives and kicks out. Shai Jordan attempts a 3Pt. Wide open! Jordan Ingram is 7.9 feet away. [MAN] SHAI JORDAN MAKES IT! Assist: Desmond Towns
Score: 52-31

[06:54] Team_058 possession (Score: 52-31)
Shai Lowry loses the ball! Stripped by Giannis Anunoby! TURNOVER! (live ball)

[06:40] Team_049 possession (Score: 52-31)
Shai Jordan attempts a Layup. Contested by Shai Lowry (3.6 feet, ZONE). Shai Jordan misses. Rebound secured by Shai Lowry.

[06:26] Team_058 possession (Score: 52-31)
Pascal Holiday attempts a 3Pt. Contested by Desmond Towns (3.4 feet, MAN). Pascal Holiday misses. Rebound secured by Giannis Anunoby.

[06:09] Team_049 possession (Score: 52-31)
Shai Jordan drives and kicks out. Shai Jordan attempts a Midrange. Wide open! Shai Lowry is 6.9 feet away. [ZONE] Shai Jordan misses. Rebound secured by Jarrett Gilgeous-Alexander.

[05:51] Team_058 possession (Score: 52-31)
Jarrett Gilgeous-Alexander drives to the basket... Jarrett Gilgeous-Alexander throws a bad pass! Stolen by Miles Jackson! TURNOVER! (live ball)

[05:35] Team_049 possession (Score: 52-31)
Desmond Towns attempts a 3Pt. Contested by Pascal Holiday (5.3 feet, MAN). Desmond Towns misses. Rebound secured by Pascal Holiday.

[05:16] Team_058 possession (Score: 52-31)
Pascal Holiday drives, picks up Miles Jackson. Help arrives from Shai Jordan! Pascal Holiday attempts a Dunk. Contested by Shai Jordan (2.4 feet, ZONE). PASCAL HOLIDAY MAKES IT! Assist: Jarrett Gilgeous-Alexander
Score: 52-33

[05:04] Team_049 possession (Score: 52-33)
Shaquille Lillard attempts a 3Pt. Contested by Draymond Williamson (3.6 feet, MAN). Shaquille Lillard misses. Rebound secured by Pascal Holiday.

[04:53] Team_058 possession (Score: 52-33)
Shai Lowry attempts a Layup. Contested by Giannis Anunoby (5.4 feet, MAN). SHAI LOWRY MAKES IT!
Score: 52-35

[04:40] Team_049 possession (Score: 52-35)
Miles Jackson attempts a Midrange. Contested by Jarrett Gilgeous-Alexander (4.0 feet, MAN). MILES JACKSON MAKES IT! Assist: Shaquille Lillard
Score: 54-35

[04:24] Team_058 possession (Score: 54-35)
Jarrett Gilgeous-Alexander attempts a Layup. BLOCKED BY MILES JACKSON! Ball deflects out of bounds off Jarrett Gilgeous-Alexander.

[04:07] Team_049 possession (Score: 54-35)
Shai Jordan attempts a 3Pt. Wide open! Draymond Williamson is 8.8 feet away. [ZONE] SHAI JORDAN MAKES IT! Assist: Miles Jackson
Score: 57-35

[03:51] Team_058 possession (Score: 57-35)
Jarrett Gilgeous-Alexander attempts a Midrange. Wide open! Giannis Anunoby is 8.8 feet away. [ZONE] Jarrett Gilgeous-Alexander misses. Rebound secured by Miles Jackson.

[03:39] Team_049 possession (Score: 57-35)
Desmond Towns attempts a 3Pt. Contested by Draymond Williamson (5.4 feet, ZONE). Desmond Towns misses. FOUL! Loose ball foul on Shai Lowry during the rebound battle. [IN THE BONUS! 6 team fouls] Miles Jackson to the line for 2 free throws. (Shai Lowry: 1 personal fouls)   FT 1/2: GOOD   FT 2/2: GOOD Miles Jackson makes 2/2 from the line.
Score: 59-35

[03:28] Team_058 possession (Score: 59-35)
FOUL! Reach-in foul on Miles Jackson during the drive. [Team fouls: 3] No free throws, side out. (Miles Jackson: 1 personal fouls)

[03:13] Team_058 possession (Score: 59-35)
Shai Lowry drives, Miles Jackson stays with him. Shai Lowry attempts a Layup. Heavily contested by Miles Jackson (1.4 feet, ZONE)! SHAI LOWRY MAKES IT! Assist: Draymond Williamson
Score: 59-37

[02:57] Team_049 possession (Score: 59-37)
Shaquille Lillard drives, picks up Shai Lowry. Help arrives from Jordan Ingram! Shaquille Lillard attempts a Dunk. Heavily contested by Jordan Ingram (1.7 feet, ZONE)! Shaquille Lillard misses. Rebound secured by Pascal Holiday.

[02:41] Team_058 possession (Score: 59-37)
Jarrett Gilgeous-Alexander attempts a 3Pt. Wide open! Shaquille Lillard is 6.5 feet away. [ZONE] JARRETT GILGEOUS-ALEXANDER MAKES IT! Assist: Jordan Ingram
Score: 59-40

[02:22] Team_049 possession (Score: 59-40)
FOUL! Holding foul on Pascal Holiday. [IN THE BONUS! 7 team fouls] Desmond Towns to the line for 2 free throws. (Pascal Holiday: 1 personal fouls)   FT 1/2: GOOD   FT 2/2: GOOD Desmond Towns makes 2/2 from the line.
Score: 61-40

[02:10] Team_058 possession (Score: 61-40)
Draymond Williamson attempts a 3Pt. Contested by Shaquille Lillard (5.9 feet, MAN). DRAYMOND WILLIAMSON MAKES IT!
Score: 61-43

[01:57] Team_049 possession (Score: 61-43)
Shai Jordan attempts a 3Pt. Contested by Draymond Williamson (3.9 feet, ZONE). SHAI JORDAN MAKES IT! Assist: Giannis Anunoby
Score: 64-43

[01:43] Team_058 possession (Score: 64-43)
Jarrett Gilgeous-Alexander drives and kicks out. Pascal Holiday attempts a Midrange. Contested by Desmond Towns (5.0 feet, ZONE). PASCAL HOLIDAY MAKES IT!
Score: 64-45

[01:27] Team_049 possession (Score: 64-45)
Shaquille Lillard drives and kicks out. Shai Jordan attempts a 3Pt. Wide open! Draymond Williamson is 10.0 feet away. [ZONE] Shai Jordan misses. Offensive rebound by Miles Jackson! Miles Jackson puts it back in!
Score: 66-45

[01:14] Team_058 possession (Score: 66-45)
Shai Lowry makes the Dunk and draws the foul on Giannis Anunoby! And-1! Shai Lowry to the line for 1. [Team fouls: 4] (Giannis Anunoby: 1 personal fouls)   FT 1/1: GOOD Shai Lowry makes 1/1 from the line.
Score: 66-48

[00:59] Team_049 possession (Score: 66-48)
FOUL! Holding foul on Jordan Ingram. [IN THE BONUS! 8 team fouls] Shai Jordan to the line for 2 free throws. (Jordan Ingram: 1 personal fouls)   FT 1/2: GOOD   FT 2/2: GOOD Shai Jordan makes 2/2 from the line.
Score: 68-48

[00:45] Team_058 possession (Score: 68-48)
Pascal Holiday attempts a 3Pt. Wide open! Desmond Towns is 6.3 feet away. [MAN] Pascal Holiday misses. Rebound secured by Giannis Anunoby.

[00:30] Team_049 possession (Score: 68-48)
Miles Jackson attempts a Midrange. Contested by Jarrett Gilgeous-Alexander (5.3 feet, MAN). MILES JACKSON MAKES IT!
Score: 70-48

[00:19] Team_058 possession (Score: 70-48)
Draymond Williamson attempts a 3Pt. Wide open! Shaquille Lillard is 9.3 feet away. [ZONE] Draymond Williamson misses. Rebound secured by Miles Jackson.

[00:01] Team_049 possession (Score: 70-48)
Giannis Anunoby attempts a Layup. Contested by Shai Lowry (5.9 feet, MAN). GIANNIS ANUNOBY MAKES IT!
Score: 72-48

================================================================================
                              2ND QUARTER COMPLETE                              
================================================================================

2ND QUARTER SCORE: Team_049 38, Team_058 25

BOX SCORE:
================================================================================

Team_049
--------------------------------------------------------------------------------
Player                MIN  PTS  REB  AST  TO      FG   FG%      3P   3P%
--------------------------------------------------------------------------------
Shai Jordan             7   11    0    0   0   4/6    66.7     0/0   0.0
Miles Jackson           7    8    3    1   0   4/4   100.0     0/0   0.0
Shai Mobley            17    3    1    1   0   1/2    50.0     0/0   0.0
Jimmy Griffin          17    3    4    0   0   1/1   100.0     0/0   0.0
Ja Oladipo             17    3    0    0   0   1/1   100.0     0/0   0.0
Shai Bird              17    2    0    1   0   1/4    25.0     0/0   0.0
De'Aaron Allen         17    2    0    1   0   1/1   100.0     0/0   0.0
Desmond Towns           7    2    0    1   0   1/2    50.0     0/0   0.0
Giannis Anunoby         7    2    2    1   0   1/1   100.0     0/0   0.0
Shaquille Lillard       7    0    0    1   0   0/2     0.0     0/0   0.0

TEAM: FG: 15/24 (62.5%), 3PT: 5/8 (62.5%), REB: 9 (1 off, 8 def), AST: 7, TO: 1
TEAM FOULS: 4


Team_058
--------------------------------------------------------------------------------
Player                MIN  PTS  REB  AST  TO      FG   FG%      3P   3P%
--------------------------------------------------------------------------------
Shai Lowry              7    7    1    0   0   3/3   100.0     0/0   0.0
Bradley Sexton         17    5    2    0   0   2/2   100.0     0/0   0.0
Pascal Holiday          7    4    3    0   0   2/4    50.0     0/0   0.0
Stephen Haliburton     17    3    1    0   0   1/3    33.3     0/0   0.0
Jarrett Gilgeous-Alexander    7    3    1    1   0   1/3    33.3     0/0   0.0
Draymond Williamson     7    3    0    1   0   1/2    50.0     0/0   0.0
Vince Hyland           17    0    1    0   0   0/1     0.0     0/0   0.0
Kyle Westbrook         17    0    0    0   0   0/1     0.0     0/0   0.0
Tyrese Doncic          17    0    0    1   0   0/1     0.0     0/0   0.0
Jordan Ingram           7    0    0    1   0   0/0     0.0     0/0   0.0

TEAM: FG: 10/20 (50.0%), 3PT: 3/10 (30.0%), REB: 10 (1 off, 9 def), AST: 4, TO: 4
TEAM FOULS: 8 [Team_049 in BONUS]

================================================================================

================================================================================
                       3RD QUARTER - Team_049 vs Team_058                       
================================================================================

[12:00] Team_049 possession (Score: 72-48)
Shai Mobley throws a bad pass out of bounds! TURNOVER! (dead ball)

[11:43] Team_058 possession (Score: 72-48)
Vince Hyland drives, picks up Jimmy Griffin. Help arrives from Ja Oladipo! Vince Hyland attempts a Dunk. Contested by Ja Oladipo (3.1 feet, MAN). VINCE HYLAND MAKES IT! Assist: Bradley Sexton
Score: 72-50

[11:30] Team_049 possession (Score: 72-50)
Shai Bird drives, Stephen Haliburton stays with him. Shai Bird attempts a Layup. Contested by Stephen Haliburton (5.0 feet, ZONE). Shai Bird misses. Offensive rebound by Jimmy Griffin! Jimmy Griffin kicks it out.

[11:16] Team_049 possession (Score: 72-50)
Jimmy Griffin attempts a 3Pt. Contested by Bradley Sexton (3.9 feet, ZONE). Jimmy Griffin misses. Rebound secured by Tyrese Doncic.

[11:01] Team_058 possession (Score: 72-50)
Stephen Haliburton throws a bad pass out of bounds! TURNOVER! (dead ball)

[10:47] Team_049 possession (Score: 72-50)
Shai Bird attempts a 3Pt. Contested by Bradley Sexton (2.6 feet, ZONE). SHAI BIRD MAKES IT! Assist: Jimmy Griffin
Score: 75-50

[10:35] Team_058 possession (Score: 75-50)
Tyrese Doncic attempts a Midrange. Wide open! Shai Mobley is 6.5 feet away. [MAN] TYRESE DONCIC MAKES IT! Assist: Bradley Sexton
Score: 75-52

[10:18] Team_049 possession (Score: 75-52)
De'Aaron Allen makes the Layup and draws the foul on Stephen Haliburton! And-1! De'Aaron Allen to the line for 1. [Team fouls: 1] (Stephen Haliburton: 1 personal fouls)   FT 1/1: GOOD De'Aaron Allen makes 1/1 from the line.
Score: 78-52

[10:00] Team_058 possession (Score: 78-52)
Kyle Westbrook loses control! Ball rolls out of bounds! TURNOVER! (dead ball)

[09:44] Team_049 possession (Score: 78-52)
Ja Oladipo attempts a 3Pt. Wide open! Bradley Sexton is 6.1 feet away. [ZONE] Ja Oladipo misses. FOUL! Loose ball foul on Tyrese Doncic during the rebound battle. [Team fouls: 2] No free throws, side out. (Tyrese Doncic: 1 personal fouls)

[09:31] Team_049 possession (Score: 78-52)
Jimmy Griffin attempts a Midrange. Wide open! Vince Hyland is 7.6 feet away. [ZONE] Jimmy Griffin misses. Rebound secured by Tyrese Doncic.

[09:18] Team_058 possession (Score: 78-52)
Kyle Westbrook attempts a 3Pt. Contested by Ja Oladipo (4.7 feet, ZONE). Kyle Westbrook misses. Offensive rebound by Stephen Haliburton! Stephen Haliburton puts it back in!
Score: 78-54

[09:05] Team_049 possession (Score: 78-54)
Ja Oladipo drives to the basket... Ja Oladipo throws a bad pass! Stolen by Kyle Westbrook! TURNOVER! (live ball)

[08:52] Team_058 possession (Score: 78-54)
Vince Hyland attempts a 3Pt. Contested by Jimmy Griffin (4.4 feet, MAN). Vince Hyland misses. Offensive rebound by Tyrese Doncic! Tyrese Doncic kicks it out.

[08:35] Team_058 possession (Score: 78-54)
Bradley Sexton makes the Layup and draws the foul on Shai Bird! And-1! Bradley Sexton to the line for 1. [Team fouls: 1] (Shai Bird: 1 personal fouls)   FT 1/1: GOOD Bradley Sexton makes 1/1 from the line.
Score: 78-57

[08:22] Team_049 possession (Score: 78-57)
Jimmy Griffin attempts a 3Pt. Heavily contested by Vince Hyland (1.0 feet, MAN)! Jimmy Griffin misses. Rebound secured by Stephen Haliburton.

[08:06] Team_058 possession (Score: 78-57)
Vince Hyland makes the Dunk and draws the foul on Ja Oladipo! And-1! Vince Hyland to the line for 1. [Team fouls: 2] (Ja Oladipo: 1 personal fouls)   FT 1/1: MISS Vince Hyland makes 0/1 from the line. Offensive rebound by Tyrese Doncic! Tyrese Doncic kicks it out.
Score: 78-59

[07:47] Team_058 possession (Score: 78-59)
Stephen Haliburton attempts a Layup. BLOCKED BY DE'AARON ALLEN! Ball is loose! Rebound secured by De'Aaron Allen.

[07:32] Team_049 possession (Score: 78-59)
Jimmy Griffin attempts a 3Pt. Wide open! Bradley Sexton is 7.2 feet away. [ZONE] Jimmy Griffin misses. Offensive rebound by Jimmy Griffin! Jimmy Griffin kicks it out.

[07:18] Team_049 possession (Score: 78-59)
Shai Mobley drives and kicks out. De'Aaron Allen attempts a Midrange. Contested by Stephen Haliburton (5.7 feet, MAN). DE'AARON ALLEN MAKES IT! Assist: Ja Oladipo
Score: 80-59

[07:06] Team_058 possession (Score: 80-59)
Vince Hyland attempts a Midrange. Wide open! Jimmy Griffin is 6.3 feet away. [ZONE] Vince Hyland misses. Rebound secured by Shai Mobley.

[06:51] Team_049 possession (Score: 80-59)
Shai Mobley drives to the basket... Shai Mobley throws a bad pass! Stolen by Stephen Haliburton! TURNOVER! (live ball)

[06:37] Team_058 possession (Score: 80-59)
Kyle Westbrook attempts a Midrange. Wide open! Ja Oladipo is 6.0 feet away. [ZONE] Kyle Westbrook misses. Rebound secured by Jimmy Griffin.

[06:24] Team_049 possession (Score: 80-59)
De'Aaron Allen drives, picks up Stephen Haliburton. Help arrives from Bradley Sexton! De'Aaron Allen attempts a Dunk. Contested by Bradley Sexton (5.4 feet, MAN). DE'AARON ALLEN MAKES IT! Assist: Ja Oladipo
Score: 82-59

[06:09] Team_058 possession (Score: 82-59)
Bradley Sexton attempts a Midrange. Contested by Shai Bird (3.4 feet, MAN). Bradley Sexton misses. Rebound secured by Jimmy Griffin.

[05:54] Team_049 possession (Score: 82-59)
Jimmy Griffin drives and kicks out. Shai Mobley attempts a Midrange. Contested by Vince Hyland (5.7 feet, ZONE). Shai Mobley misses. Rebound secured by Bradley Sexton.

[05:41] Team_058 possession (Score: 82-59)
Tyrese Doncic drives, De'Aaron Allen stays with him. Tyrese Doncic attempts a Dunk. Heavily contested by De'Aaron Allen (1.3 feet, ZONE)! TYRESE DONCIC MAKES IT!
Score: 82-61

[05:27] Team_049 possession (Score: 82-61)
FOUL! Reach-in foul on Stephen Haliburton during the drive. [Team fouls: 3] No free throws, side out. (Stephen Haliburton: 2 personal fouls)

[05:13] Team_049 possession (Score: 82-61)
Shai Bird attempts a 3Pt. Contested by Bradley Sexton (4.6 feet, ZONE). Shai Bird misses. Rebound secured by Stephen Haliburton.

[04:59] Team_058 possession (Score: 82-61)
FOUL! Offensive foul on Stephen Haliburton! De'Aaron Allen drew the charge! [Team fouls: 4] (Stephen Haliburton: 3 personal fouls) TURNOVER! (dead ball)

[04:44] Team_049 possession (Score: 82-61)
De'Aaron Allen attempts a Midrange. Contested by Stephen Haliburton (2.1 feet, MAN). De'Aaron Allen misses. Offensive rebound by Shai Mobley! Shai Mobley's putback is no good. Rebound secured by Bradley Sexton.

[04:29] Team_058 possession (Score: 82-61)
Stephen Haliburton drives, De'Aaron Allen stays with him. Stephen Haliburton attempts a Layup. Contested by De'Aaron Allen (2.6 feet, MAN). Stephen Haliburton misses. Rebound secured by De'Aaron Allen.

[04:14] Team_049 possession (Score: 82-61)
Jimmy Griffin attempts a 3Pt. Contested by Bradley Sexton (2.5 feet, ZONE). Jimmy Griffin misses. Rebound secured by Stephen Haliburton.

[04:02] Team_058 possession (Score: 82-61)
FOUL! Reach-in foul on Shai Bird during the drive. [Team fouls: 3] No free throws, side out. (Shai Bird: 2 personal fouls)

[03:49] Team_058 possession (Score: 82-61)
Tyrese Doncic drives, picks up De'Aaron Allen. Help arrives from Ja Oladipo! Tyrese Doncic attempts a Dunk. Heavily contested by Ja Oladipo (0.5 feet, ZONE)! TYRESE DONCIC MAKES IT! Assist: Kyle Westbrook
Score: 82-63

[03:37] Team_049 possession (Score: 82-63)
Shai Mobley drives, Tyrese Doncic stays with him. Shai Mobley attempts a Layup. Heavily contested by Tyrese Doncic (1.8 feet, MAN)! Shai Mobley misses. Rebound secured by Tyrese Doncic.

[03:26] Team_058 possession (Score: 82-63)
Tyrese Doncic attempts a Layup. BLOCKED BY JA OLADIPO! Ball is loose! Rebound secured by Shai Mobley.

[03:09] Team_049 possession (Score: 82-63)
De'Aaron Allen attempts a 3Pt. Heavily contested by Stephen Haliburton (1.1 feet, MAN)! De'Aaron Allen misses. Rebound secured by Stephen Haliburton.

[02:57] Team_058 possession (Score: 82-63)
Stephen Haliburton makes the Midrange and draws the foul on Ja Oladipo! And-1! Stephen Haliburton to the line for 1. [Team fouls: 4] (Ja Oladipo: 2 personal fouls)   FT 1/1: GOOD Stephen Haliburton makes 1/1 from the line.
Score: 82-66

[02:41] Team_049 possession (Score: 82-66)
Jimmy Griffin throws a bad pass! Stolen by Vince Hyland! TURNOVER! (live ball)

[02:22] Team_058 possession (Score: 82-66)
Bradley Sexton attempts a 3Pt. Contested by De'Aaron Allen (5.2 feet, ZONE). Bradley Sexton misses. Rebound secured by De'Aaron Allen.

[02:07] Team_049 possession (Score: 82-66)
Shai Mobley attempts a Layup. Heavily contested by Stephen Haliburton (0.5 feet, ZONE)! SHAI MOBLEY MAKES IT! Assist: Shai Bird
Score: 84-66

[01:50] Team_058 possession (Score: 84-66)
Tyrese Doncic attempts a Midrange. Contested by Shai Mobley (5.1 feet, MAN). TYRESE DONCIC MAKES IT! Assist: Vince Hyland
Score: 84-68

[01:34] Team_049 possession (Score: 84-68)
Ja Oladipo throws a bad pass! Stolen by Kyle Westbrook! TURNOVER! (live ball)

[01:25] Team_058 possession (Score: 84-68)
Stephen Haliburton attempts a Layup. BLOCKED BY DE'AARON ALLEN! Ball is loose! Rebound secured by Shai Mobley.

[01:09] Team_049 possession (Score: 84-68)
De'Aaron Allen makes the Layup and draws the foul on Stephen Haliburton! And-1! De'Aaron Allen to the line for 1. [BONUS: 5 team fouls] (Stephen Haliburton: 4 personal fouls)   FT 1/1: GOOD De'Aaron Allen makes 1/1 from the line.
Score: 87-68

[00:52] Team_058 possession (Score: 87-68)
Bradley Sexton attempts a Layup. Contested by Shai Bird (2.1 feet, MAN). BRADLEY SEXTON MAKES IT! Assist: Tyrese Doncic
Score: 87-70

[00:36] Team_049 possession (Score: 87-70)
Shai Bird attempts a 3Pt. Wide open! Vince Hyland is 7.0 feet away. [ZONE] SHAI BIRD MAKES IT! Assist: Shai Mobley
Score: 90-70

[00:24] Team_058 possession (Score: 90-70)
Kyle Westbrook attempts a Midrange. Wide open! Ja Oladipo is 7.0 feet away. [ZONE] KYLE WESTBROOK MAKES IT!
Score: 90-72

[00:12] Team_049 possession (Score: 90-72)
Ja Oladipo attempts a 3Pt. Contested by Bradley Sexton (4.2 feet, ZONE). Ja Oladipo misses. FOUL! Loose ball foul on Bradley Sexton during the rebound battle. [IN THE BONUS! 6 team fouls] Shai Mobley to the line for 2 free throws. (Bradley Sexton: 1 personal fouls)   FT 1/2: GOOD   FT 2/2: GOOD Shai Mobley makes 2/2 from the line.
Score: 92-72

================================================================================
                              3RD QUARTER COMPLETE                              
================================================================================

3RD QUARTER SCORE: Team_049 20, Team_058 24

BOX SCORE:
================================================================================

Team_049
--------------------------------------------------------------------------------
Player                MIN  PTS  REB  AST  TO      FG   FG%      3P   3P%
--------------------------------------------------------------------------------
De'Aaron Allen         29   10    3    0   0   4/6    66.7     0/0   0.0
Shai Bird              29    6    0    1   0   2/3    66.7     0/0   0.0
Shai Mobley            29    4    3    1   0   2/3    66.7     0/0   0.0
Jimmy Griffin          29    0    5    1   0   0/5     0.0     0/0   0.0
Ja Oladipo             29    0    0    2   0   0/0     0.0     0/0   0.0

TEAM: FG: 8/17 (47.1%), 3PT: 3/8 (37.5%), REB: 12 (4 off, 8 def), AST: 5, TO: 5
TEAM FOULS: 4


Team_058
--------------------------------------------------------------------------------
Player                MIN  PTS  REB  AST  TO      FG   FG%      3P   3P%
--------------------------------------------------------------------------------
Tyrese Doncic          29    8    5    1   0   4/5    80.0     0/0   0.0
Bradley Sexton         29    5    2    2   0   2/4    50.0     0/0   0.0
Stephen Haliburton     29    5    5    0   0   2/5    40.0     0/0   0.0
Vince Hyland           29    2    0    1   0   1/2    50.0     0/0   0.0
Kyle Westbrook         29    2    0    1   0   1/2    50.0     0/0   0.0

TEAM: FG: 10/18 (55.6%), 3PT: 1/2 (50.0%), REB: 11 (3 off, 8 def), AST: 5, TO: 3
TEAM FOULS: 6 [Team_049 in BONUS]

================================================================================

================================================================================
                       4TH QUARTER - Team_049 vs Team_058                       
================================================================================

[12:00] Team_049 possession (Score: 92-72)
FOUL! Reach-in foul on Stephen Haliburton during the drive. [Team fouls: 1] No free throws, side out. (Stephen Haliburton: 1 personal fouls)

[11:45] Team_049 possession (Score: 92-72)
Ja Oladipo attempts a 3Pt. Contested by Bradley Sexton (4.8 feet, ZONE). Ja Oladipo misses. Rebound secured by Bradley Sexton.

[11:31] Team_058 possession (Score: 92-72)
FOUL! Shooting foul on De'Aaron Allen. Stephen Haliburton to the line for 2 free throws. [Team fouls: 1] (De'Aaron Allen: 1 personal fouls)   FT 1/2: GOOD   FT 2/2: GOOD Stephen Haliburton makes 2/2 from the line.
Score: 92-74

[11:18] Team_049 possession (Score: 92-74)
Jimmy Griffin attempts a Layup. Contested by Vince Hyland (3.3 feet, MAN). JIMMY GRIFFIN MAKES IT!
Score: 94-74

[11:06] Team_058 possession (Score: 94-74)
Vince Hyland attempts a 3Pt. Contested by Jimmy Griffin (5.1 feet, MAN). Vince Hyland misses. Rebound secured by Shai Mobley.

[10:54] Team_049 possession (Score: 94-74)
Shai Mobley attempts a Layup. BLOCKED BY STEPHEN HALIBURTON! Ball is loose! Offensive rebound by Shai Mobley! Shai Mobley kicks it out.

[10:40] Team_049 possession (Score: 94-74)
Jimmy Griffin attempts a Midrange. Wide open! Vince Hyland is 7.5 feet away. [ZONE] Jimmy Griffin misses. Offensive rebound by De'Aaron Allen! De'Aaron Allen kicks it out.

[10:25] Team_049 possession (Score: 94-74)
Ja Oladipo attempts a 3Pt. Contested by Bradley Sexton (5.0 feet, ZONE). JA OLADIPO MAKES IT! Assist: Shai Mobley
Score: 97-74

[10:10] Team_058 possession (Score: 97-74)
Stephen Haliburton drives, De'Aaron Allen stays with him. Stephen Haliburton attempts a Dunk. Contested by De'Aaron Allen (2.9 feet, MAN). STEPHEN HALIBURTON MAKES IT! Assist: Tyrese Doncic
Score: 97-76

[09:55] Team_049 possession (Score: 97-76)
Shai Mobley attempts a Layup. Contested by Tyrese Doncic (4.6 feet, MAN). SHAI MOBLEY MAKES IT! Assist: De'Aaron Allen
Score: 99-76

[09:38] Team_058 possession (Score: 99-76)
Kyle Westbrook attempts a Layup. Contested by Ja Oladipo (2.1 feet, MAN). Kyle Westbrook misses. Rebound secured by Shai Mobley.

[09:20] Team_049 possession (Score: 99-76)
Jimmy Griffin attempts a 3Pt. Contested by Bradley Sexton (3.6 feet, ZONE). JIMMY GRIFFIN MAKES IT! Assist: Shai Mobley
Score: 102-76

[09:09] Team_058 possession (Score: 102-76)
Stephen Haliburton drives, De'Aaron Allen stays with him. Stephen Haliburton attempts a Dunk. Contested by De'Aaron Allen (3.6 feet, MAN). Stephen Haliburton misses. Rebound secured by Jimmy Griffin.

[08:55] Team_049 possession (Score: 102-76)
Jimmy Griffin attempts a Midrange. Wide open! Vince Hyland is 7.9 feet away. [ZONE] Jimmy Griffin misses. Rebound secured by Stephen Haliburton.

[08:39] Team_058 possession (Score: 102-76)
Stephen Haliburton drives, De'Aaron Allen stays with him. Stephen Haliburton attempts a Dunk. Contested by De'Aaron Allen (4.7 feet, MAN). STEPHEN HALIBURTON MAKES IT!
Score: 102-78

[08:28] Team_049 possession (Score: 102-78)
De'Aaron Allen attempts a Midrange. Wide open! Vince Hyland is 6.9 feet away. [ZONE] De'Aaron Allen misses. Offensive rebound by De'Aaron Allen! De'Aaron Allen kicks it out.

[08:13] Team_049 possession (Score: 102-78)
FOUL! Holding foul on Kyle Westbrook. [Team fouls: 2] No free throws, side out. (Kyle Westbrook: 1 personal fouls)

[07:58] Team_049 possession (Score: 102-78)
De'Aaron Allen commits a violation (traveling/carry)! TURNOVER! (dead ball)

[07:58] Substitution (Team_049): Shai Bird OUT → Shaquille Lillard IN (stamina_rule2)

[07:58] Substitution (Team_049): Ja Oladipo OUT → Shai Jordan IN (stamina_rule2)

[07:58] Substitution (Team_049): Jimmy Griffin OUT → Desmond Towns IN (stamina_rule2)

[07:58] Substitution (Team_049): De'Aaron Allen OUT → Giannis Anunoby IN (stamina_rule2)

[07:58] Substitution (Team_049): Shai Mobley OUT → Miles Jackson IN (stamina_rule2)

[07:58] Substitution (Team_058): Bradley Sexton OUT → Draymond Williamson IN (stamina_rule2)

[07:58] Substitution (Team_058): Kyle Westbrook OUT → Jordan Ingram IN (stamina_rule2)

[07:58] Substitution (Team_058): Vince Hyland OUT → Pascal Holiday IN (stamina_rule2)

[07:58] Substitution (Team_058): Stephen Haliburton OUT → Shai Lowry IN (stamina_rule2)

[07:58] Substitution (Team_058): Tyrese Doncic OUT → Jarrett Gilgeous-Alexander IN (stamina_rule2)

[07:41] Team_058 possession (Score: 102-78)
Draymond Williamson attempts a Midrange. Wide open! Shaquille Lillard is 6.6 feet away. [MAN] Draymond Williamson misses. Offensive rebound by Pascal Holiday! Pascal Holiday's putback is no good. Rebound secured by Giannis Anunoby.

[07:24] Team_049 possession (Score: 102-78)
Shaquille Lillard attempts a 3Pt. Wide open! Draymond Williamson is 8.4 feet away. [ZONE] Shaquille Lillard misses. Offensive rebound by Miles Jackson! Miles Jackson puts it back in!
Score: 104-78

[07:14] Team_058 possession (Score: 104-78)
Jordan Ingram attempts a 3Pt. Contested by Shaquille Lillard (3.2 feet, ZONE). Jordan Ingram misses. Rebound secured by Giannis Anunoby.

[07:04] Team_049 possession (Score: 104-78)
Giannis Anunoby attempts a 3Pt. Wide open! Shai Lowry is 6.4 feet away. [MAN] GIANNIS ANUNOBY MAKES IT! Assist: Shaquille Lillard
Score: 107-78

[06:51] Team_058 possession (Score: 107-78)
Jordan Ingram attempts a 3Pt. Contested by Shaquille Lillard (5.0 feet, ZONE). Jordan Ingram misses. Rebound secured by Shai Jordan.

[06:40] Team_049 possession (Score: 107-78)
Desmond Towns drives, Pascal Holiday stays with him. Desmond Towns attempts a Dunk. Heavily contested by Pascal Holiday (1.7 feet, MAN)! Desmond Towns misses. Rebound secured by Jarrett Gilgeous-Alexander.

[06:25] Team_058 possession (Score: 107-78)
Pascal Holiday attempts a 3Pt. Wide open! Desmond Towns is 7.3 feet away. [MAN] Pascal Holiday misses. FOUL! Loose ball foul on Giannis Anunoby during the rebound battle. [Team fouls: 2] No free throws, side out. (Giannis Anunoby: 1 personal fouls)

[06:13] Team_058 possession (Score: 107-78)
Jarrett Gilgeous-Alexander throws a bad pass! Stolen by Miles Jackson! TURNOVER! (live ball)

[05:57] Team_049 possession (Score: 107-78)
Shai Jordan attempts a Layup. Wide open! Shai Lowry is 6.1 feet away. [ZONE] SHAI JORDAN MAKES IT!
Score: 109-78

[05:44] Team_058 possession (Score: 109-78)
Jarrett Gilgeous-Alexander drives to the basket... Jarrett Gilgeous-Alexander throws a bad pass out of bounds! TURNOVER! (dead ball)

[05:34] Team_049 possession (Score: 109-78)
Giannis Anunoby attempts a Midrange. Contested by Shai Lowry (5.0 feet, MAN). GIANNIS ANUNOBY MAKES IT!
Score: 111-78

[05:15] Team_058 possession (Score: 111-78)
Shai Lowry attempts a Layup. Heavily contested by Miles Jackson (1.2 feet, ZONE)! Shai Lowry misses. Rebound secured by Shai Jordan.

[05:04] Team_049 possession (Score: 111-78)
Shaquille Lillard makes the Layup and draws the foul on Draymond Williamson! And-1! Shaquille Lillard to the line for 1. [Team fouls: 3] (Draymond Williamson: 1 personal fouls)   FT 1/1: GOOD Shaquille Lillard makes 1/1 from the line.
Score: 114-78

[04:54] Team_058 possession (Score: 114-78)
Pascal Holiday attempts a 3Pt. Wide open! Desmond Towns is 6.2 feet away. [MAN] PASCAL HOLIDAY MAKES IT! Assist: Draymond Williamson
Score: 114-81

[04:43] Team_049 possession (Score: 114-81)
Miles Jackson attempts a Layup. Contested by Jarrett Gilgeous-Alexander (2.9 feet, MAN). Miles Jackson misses. Offensive rebound by Miles Jackson! Miles Jackson puts it back in!
Score: 116-81

[04:23] Team_058 possession (Score: 116-81)
Jarrett Gilgeous-Alexander makes the 3Pt and draws the foul on Shaquille Lillard! And-1! Jarrett Gilgeous-Alexander to the line for 1. [Team fouls: 3] (Shaquille Lillard: 1 personal fouls)   FT 1/1: GOOD Jarrett Gilgeous-Alexander makes 1/1 from the line.
Score: 116-85

[04:09] Team_049 possession (Score: 116-85)
Miles Jackson drives, picks up Shai Lowry. Help arrives from Jordan Ingram! Miles Jackson attempts a Layup. Contested by Jordan Ingram (4.6 feet, ZONE). Miles Jackson misses. Rebound secured by Jarrett Gilgeous-Alexander.

[03:57] Team_058 possession (Score: 116-85)
Pascal Holiday attempts a Midrange. Contested by Desmond Towns (4.6 feet, MAN). Pascal Holiday misses. Rebound secured by Giannis Anunoby.

[03:43] Team_049 possession (Score: 116-85)
Giannis Anunoby drives and kicks out. Desmond Towns attempts a 3Pt. Heavily contested by Pascal Holiday (1.7 feet, MAN)! Desmond Towns misses. Offensive rebound by Miles Jackson! Miles Jackson's putback is no good. Rebound secured by Jarrett Gilgeous-Alexander.

[03:31] Team_058 possession (Score: 116-85)
Jordan Ingram makes the Layup and draws the foul on Shai Jordan! And-1! Jordan Ingram to the line for 1. [Team fouls: 4] (Shai Jordan: 1 personal fouls)   FT 1/1: GOOD Jordan Ingram makes 1/1 from the line.
Score: 116-88

[03:16] Team_049 possession (Score: 116-88)
Shai Jordan attempts a 3Pt. Wide open! Jordan Ingram is 6.4 feet away. [MAN] SHAI JORDAN MAKES IT! Assist: Miles Jackson
Score: 119-88

[02:58] Team_058 possession (Score: 119-88)
Pascal Holiday makes the Layup and draws the foul on Desmond Towns! And-1! Pascal Holiday to the line for 1. [BONUS: 5 team fouls] (Desmond Towns: 1 personal fouls)   FT 1/1: GOOD Pascal Holiday makes 1/1 from the line.
Score: 119-91

[02:42] Team_049 possession (Score: 119-91)
Shaquille Lillard drives to the basket... Shaquille Lillard throws a bad pass out of bounds! TURNOVER! (dead ball)

[02:24] Team_058 possession (Score: 119-91)
Shai Lowry makes the Layup and draws the foul on Shai Jordan! And-1! Shai Lowry to the line for 1. [BONUS: 6 team fouls] (Shai Jordan: 2 personal fouls)   FT 1/1: MISS Shai Lowry makes 0/1 from the line. Rebound secured by Miles Jackson.
Score: 119-93

[02:11] Team_049 possession (Score: 119-93)
Miles Jackson attempts a Layup. Contested by Jarrett Gilgeous-Alexander (2.8 feet, MAN). MILES JACKSON MAKES IT!
Score: 121-93

[01:59] Team_058 possession (Score: 121-93)
Jarrett Gilgeous-Alexander attempts a Midrange. BLOCKED BY GIANNIS ANUNOBY! Ball is loose! Offensive rebound by Pascal Holiday! Pascal Holiday kicks it out.

[01:44] Team_058 possession (Score: 121-93)
Jarrett Gilgeous-Alexander drives and kicks out. Shai Lowry attempts a 3Pt. Contested by Shaquille Lillard (3.5 feet, ZONE). Shai Lowry misses. Rebound secured by Miles Jackson.

[01:27] Team_049 possession (Score: 121-93)
Shaquille Lillard drives to the basket... Shaquille Lillard commits a violation (traveling/carry)! TURNOVER! (dead ball)

[01:12] Team_058 possession (Score: 121-93)
FOUL! Shooting foul on Miles Jackson. Shai Lowry to the line for 2 free throws. [BONUS: 7 team fouls] (Miles Jackson: 1 personal fouls)   FT 1/2: GOOD   FT 2/2: GOOD Shai Lowry makes 2/2 from the line.
Score: 121-95

[00:58] Team_049 possession (Score: 121-95)
Desmond Towns attempts a Layup. Wide open! Pascal Holiday is 6.6 feet away. [MAN] Desmond Towns misses. FOUL! Loose ball foul on Pascal Holiday during the rebound battle. [Team fouls: 4] No free throws, side out. (Pascal Holiday: 1 personal fouls)

[00:42] Team_049 possession (Score: 121-95)
Desmond Towns attempts a 3Pt. Contested by Pascal Holiday (4.5 feet, MAN). Desmond Towns misses. Rebound secured by Pascal Holiday.

[00:29] Team_058 possession (Score: 121-95)
Shai Lowry attempts a 3Pt. Contested by Shaquille Lillard (3.1 feet, ZONE). Shai Lowry misses. Rebound secured by Giannis Anunoby.

[00:18] Team_049 possession (Score: 121-95)
Giannis Anunoby attempts a Layup. BLOCKED BY SHAI LOWRY! Ball goes out off Shai Lowry. Giannis Anunoby's ball!

[00:02] Team_049 possession (Score: 121-95)
Shaquille Lillard attempts a 3Pt. Contested by Shai Lowry (5.3 feet, ZONE). Shaquille Lillard misses. Rebound secured by Pascal Holiday.

================================================================================
                              4TH QUARTER COMPLETE                              
================================================================================

4TH QUARTER SCORE: Team_049 29, Team_058 23

BOX SCORE:
================================================================================

Team_049
--------------------------------------------------------------------------------
Player                MIN  PTS  REB  AST  TO      FG   FG%      3P   3P%
--------------------------------------------------------------------------------
Miles Jackson          15    6    5    1   0   3/4    75.0     0/0   0.0
Jimmy Griffin          33    5    1    0   0   2/3    66.7     0/0   0.0
Giannis Anunoby        15    5    4    0   0   2/3    66.7     0/0   0.0
Shai Jordan            15    5    2    0   0   2/2   100.0     0/0   0.0
Ja Oladipo             33    3    0    0   0   1/2    50.0     0/0   0.0
Shaquille Lillard      15    3    0    1   0   1/2    50.0     0/0   0.0
Shai Mobley            33    2    3    2   0   1/1   100.0     0/0   0.0
De'Aaron Allen         33    0    2    1   0   0/0     0.0     0/0   0.0
Desmond Towns          15    0    0    0   0   0/2     0.0     0/0   0.0

TEAM: FG: 12/19 (63.2%), 3PT: 5/8 (62.5%), REB: 17 (7 off, 10 def), AST: 5, TO: 3
TEAM FOULS: 7 [Team_058 in BONUS]


Team_058
--------------------------------------------------------------------------------
Player                MIN  PTS  REB  AST  TO      FG   FG%      3P   3P%
--------------------------------------------------------------------------------
Stephen Haliburton     33    6    1    0   0   3/4    75.0     0/0   0.0
Pascal Holiday         15    6    4    0   0   2/3    66.7     0/0   0.0
Jarrett Gilgeous-Alexander   15    4    3    0   0   1/2    50.0     0/0   0.0
Jordan Ingram          15    3    0    0   0   1/3    33.3     0/0   0.0
Shai Lowry             15    2    0    0   0   1/4    25.0     0/0   0.0
Bradley Sexton         33    0    1    0   0   0/0     0.0     0/0   0.0
Vince Hyland           33    0    0    0   0   0/1     0.0     0/0   0.0
Tyrese Doncic          33    0    0    1   0   0/0     0.0     0/0   0.0
Kyle Westbrook         33    0    0    0   0   0/1     0.0     0/0   0.0
Draymond Williamson    15    0    0    1   0   0/1     0.0     0/0   0.0

TEAM: FG: 8/19 (42.1%), 3PT: 2/6 (33.3%), REB: 9 (3 off, 6 def), AST: 2, TO: 2
TEAM FOULS: 4

================================================================================

================================================================================
                               FULL GAME COMPLETE                               
================================================================================

FINAL SCORE: Team_049 121, Team_058 95

SCORING BY QUARTER:
--------------------------------------------------------------------------------
Team                     Q1     Q2     Q3     Q4    FINAL
--------------------------------------------------------------------------------
Team_049                 34     38     20     29      121
Team_058                 23     25     24     23       95
--------------------------------------------------------------------------------

FULL GAME BOX SCORE:
================================================================================

Team_049
--------------------------------------------------------------------------------
Player                MIN  PTS  REB  AST  TO      FG   FG%      3P   3P%      FT STL BLK
--------------------------------------------------------------------------------
Shai Bird              33   18    0    2   0   7/12   58.3   2/5    40.0   3/4     0   0
Ja Oladipo             33    8    0    4   4   5/9    55.6   4/7    57.1   0/1     0   1
Jimmy Griffin          33   16   14    3   1   8/16   50.0   4/9    44.4   0/0     1   0
De'Aaron Allen         33   17   11    2   2   4/7    57.1   0/2     0.0   4/4     0   2
Shai Mobley            33   16   11    6   3   6/9    66.7   0/0     0.0   5/6     1   0
Shaquille Lillard      15    3    0    2   0   3/6    50.0   1/3    33.3   1/1     0   0
Shai Jordan            15   16    2    0   0   4/6    66.7   3/3   100.0   2/2     0   0
Desmond Towns          15    2    0    1   1   1/4    25.0   1/3    33.3   2/2     0   0
Giannis Anunoby        15    7    6    1   0   3/4    75.0   1/1   100.0   0/0     1   1
Miles Jackson          15   14    8    2   1   5/6    83.3   0/0     0.0   2/2     2   1

TEAM: FG: 48/81 (59.3%), 3PT: 16/33 (48.5%), REB: 52 (14 off, 38 def), AST: 23, TO: 12


Team_058
--------------------------------------------------------------------------------
Player                MIN  PTS  REB  AST  TO      FG   FG%      3P   3P%      FT STL BLK
--------------------------------------------------------------------------------
Bradley Sexton         33   13    6    3   1   5/11   45.5   1/5    20.0   6/7     0   0
Kyle Westbrook         33    5    0    1   2   3/9    33.3   2/4    50.0   0/1     3   0
Vince Hyland           33    4    1    4   1   4/7    57.1   0/2     0.0   0/1     1   0
Stephen Haliburton     33   23   10    0   4   7/15   46.7   2/4    50.0   3/3     1   1
Tyrese Doncic          33   12   10    4   1   5/10   50.0   0/2     0.0   2/2     2   0
Draymond Williamson    15    3    0    2   0   1/3    33.3   1/2    50.0   0/0     0   0
Jordan Ingram          15    3    0    1   1   1/3    33.3   0/2     0.0   1/1     0   0
Pascal Holiday         15   10    7    0   0   3/6    50.0   1/3    33.3   1/1     0   0
Shai Lowry             15    9    1    0   2   4/7    57.1   0/1     0.0   3/4     0   1
Jarrett Gilgeous-Alexander   15    7    4    1   1   3/6    50.0   2/2   100.0   1/1     0   0

TEAM: FG: 36/77 (46.8%), 3PT: 9/27 (33.3%), REB: 38 (7 off, 31 def), AST: 16, TO: 13

================================================================================
