================================================================================
                        FULL GAME - Team_031 vs Team_074                        
================================================================================

================================================================================
                       1ST QUARTER - Team_031 vs Team_074                       
================================================================================

[12:00] Team_031 possession (Score: 0-0)
Shai Durant drives to the basket... FOUL! Offensive foul on Shai Durant! Dwyane Quickley drew the charge! [Team fouls: 1] (Shai Durant: 1 personal fouls) TURNOVER! (dead ball)

[11:44] Team_074 possession (Score: 0-0)
FOUL! Offensive foul on Shai Green! Pau Irving drew the charge! [Team fouls: 1] (Shai Green: 1 personal fouls) TURNOVER! (dead ball)

[11:30] Team_031 possession (Score: 0-0)
Immanuel James drives, picks up Donovan Doncic. Help arrives from Chris Carter! Immanuel James attempts a Layup. Contested by Chris Carter (3.7 feet, ZONE). IMMANUEL JAMES MAKES IT! Assist: Luka Sabonis
Score: 2-0

[11:19] Team_074 possession (Score: 2-0)
Chris Carter attempts a 3Pt. Contested by Pau Irving (3.5 feet, ZONE). CHRIS CARTER MAKES IT! Assist: Dwyane Quickley
Score: 2-3

[11:00] Team_031 possession (Score: 2-3)
Shai Durant drives, picks up Dwyane Quickley. Help arrives from Shai Green! Shai Durant attempts a Layup. Wide open! Shai Green is 6.0 feet away. [MAN] SHAI DURANT MAKES IT! Assist: Luka Sabonis
Score: 4-3

[10:46] Team_074 possession (Score: 4-3)
James Turner drives, picks up Immanuel James. Help arrives from Shai Durant! James Turner attempts a Dunk. Heavily contested by Shai Durant (0.5 feet, ZONE)! James Turner misses. Rebound secured by Gary Morant.

[10:29] Team_031 possession (Score: 4-3)
Gary Morant attempts a 3Pt. Contested by Chris Carter (5.4 feet, MAN). Gary Morant misses. Rebound secured by Shai Green.

[10:11] Team_074 possession (Score: 4-3)
Donovan Doncic attempts a Midrange. Contested by Immanuel James (3.5 feet, MAN). Donovan Doncic misses. Rebound secured by Gary Morant.

[09:56] Team_031 possession (Score: 4-3)
Immanuel James attempts a Midrange. Contested by Donovan Doncic (5.6 feet, MAN). Immanuel James misses. Offensive rebound by Immanuel James! Immanuel James puts it back in!
Score: 6-3

[09:37] Team_074 possession (Score: 6-3)
Dwyane Quickley attempts a 3Pt. Wide open! Shai Durant is 7.1 feet away. [ZONE] DWYANE QUICKLEY MAKES IT! Assist: James Turner
Score: 6-6

[09:23] Team_031 possession (Score: 6-6)
Shai Durant attempts a 3Pt. Contested by Chris Carter (4.6 feet, ZONE). Shai Durant misses. Rebound secured by Shai Green.

[09:08] Team_074 possession (Score: 6-6)
Donovan Doncic drives to the basket... Donovan Doncic throws a bad pass! Stolen by Immanuel James! TURNOVER! (live ball)

[08:51] Team_031 possession (Score: 6-6)
Shai Durant attempts a 3Pt. Contested by Dwyane Quickley (5.5 feet, MAN). Shai Durant misses. Offensive rebound by Luka Sabonis! Luka Sabonis puts it back in!
Score: 8-6

[08:36] Team_074 possession (Score: 8-6)
James Turner drives and kicks out. Donovan Doncic attempts a 3Pt. Heavily contested by Immanuel James (0.5 feet, MAN)! Donovan Doncic misses. Rebound secured by Gary Morant.

[08:23] Team_031 possession (Score: 8-6)
FOUL! Reach-in foul on Dwyane Quickley during the drive. [Team fouls: 2] No free throws, side out. (Dwyane Quickley: 1 personal fouls)

[08:11] Team_031 possession (Score: 8-6)
Pau Irving attempts a 3Pt. Contested by Dwyane Quickley (5.7 feet, ZONE). PAU IRVING MAKES IT! Assist: Luka Sabonis
Score: 11-6

[07:57] Team_074 possession (Score: 11-6)
Dwyane Quickley attempts a 3Pt. Contested by Pau Irving (5.5 feet, ZONE). Dwyane Quickley misses. Rebound secured by Immanuel James.

[07:44] Team_031 possession (Score: 11-6)
Immanuel James attempts a 3Pt. Heavily contested by Shai Green (1.6 feet, ZONE)! IMMANUEL JAMES MAKES IT! Assist: Gary Morant
Score: 14-6

[07:32] Team_074 possession (Score: 14-6)
Donovan Doncic attempts a 3Pt. Contested by Pau Irving (3.7 feet, ZONE). DONOVAN DONCIC MAKES IT! Assist: Chris Carter
Score: 14-9

[07:15] Team_031 possession (Score: 14-9)
Gary Morant drives and kicks out. Immanuel James attempts a 3Pt. Contested by Dwyane Quickley (4.5 feet, ZONE). Immanuel James misses. Rebound secured by James Turner.

[07:03] Team_074 possession (Score: 14-9)
Donovan Doncic attempts a Layup. BLOCKED BY IMMANUEL JAMES! Ball is loose! Rebound secured by Luka Sabonis.

[06:53] Team_031 possession (Score: 14-9)
Gary Morant attempts a 3Pt. Wide open! Chris Carter is 6.1 feet away. [MAN] GARY MORANT MAKES IT! Assist: Luka Sabonis
Score: 17-9

[06:38] Team_074 possession (Score: 17-9)
Dwyane Quickley drives to the basket... FOUL! Offensive foul on Dwyane Quickley! Immanuel James drew the charge! [Team fouls: 3] (Dwyane Quickley: 2 personal fouls) TURNOVER! (dead ball)

[06:24] Team_031 possession (Score: 17-9)
FOUL! Reach-in foul on James Turner during the drive. [Team fouls: 4] No free throws, side out. (James Turner: 1 personal fouls)

[06:11] Team_031 possession (Score: 17-9)
Shai Durant attempts a 3Pt. Wide open! Dwyane Quickley is 10.0 feet away. [ZONE] Shai Durant misses. Rebound secured by James Turner.

[05:57] Team_074 possession (Score: 17-9)
Donovan Doncic attempts a 3Pt. Heavily contested by Immanuel James (1.1 feet, MAN)! DONOVAN DONCIC MAKES IT! Assist: Dwyane Quickley
Score: 17-12

[05:41] Team_031 possession (Score: 17-12)
Immanuel James makes the Dunk and draws the foul on Donovan Doncic! And-1! Immanuel James to the line for 1. [BONUS: 5 team fouls] (Donovan Doncic: 1 personal fouls)   FT 1/1: MISS Immanuel James makes 0/1 from the line. Rebound secured by Donovan Doncic.
Score: 19-12

[05:29] Team_074 possession (Score: 19-12)
Dwyane Quickley drives, picks up Shai Durant. Help arrives from Pau Irving! Dwyane Quickley attempts a Dunk. Contested by Pau Irving (2.2 feet, MAN). Dwyane Quickley misses. Rebound secured by Luka Sabonis.

[05:10] Team_031 possession (Score: 19-12)
Luka Sabonis attempts a Midrange. Wide open! James Turner is 6.7 feet away. [MAN] Luka Sabonis misses. Rebound secured by Donovan Doncic.

[04:55] Team_074 possession (Score: 19-12)
FOUL! Holding foul on Pau Irving. [Team fouls: 2] No free throws, side out. (Pau Irving: 1 personal fouls)

[04:43] Team_074 possession (Score: 19-12)
Donovan Doncic attempts a Midrange. Contested by Immanuel James (4.5 feet, MAN). Donovan Doncic misses. Rebound secured by Immanuel James.

[04:29] Team_031 possession (Score: 19-12)
Luka Sabonis attempts a Dunk. BLOCKED BY DONOVAN DONCIC! Ball deflects out of bounds off Luka Sabonis.

[04:13] Team_074 possession (Score: 19-12)
Shai Green drives to the basket... Shai Green throws a bad pass! Stolen by Immanuel James! TURNOVER! (live ball)

[03:57] Team_031 possession (Score: 19-12)
Shai Durant attempts a 3Pt. Contested by Dwyane Quickley (6.0 feet, MAN). SHAI DURANT MAKES IT! Assist: Luka Sabonis
Score: 22-12

[03:42] Team_074 possession (Score: 22-12)
James Turner throws a bad pass out of bounds! TURNOVER! (dead ball)

[03:32] Team_031 possession (Score: 22-12)
Luka Sabonis attempts a Midrange. Contested by James Turner (4.0 feet, MAN). LUKA SABONIS MAKES IT!
Score: 24-12

[03:21] Team_074 possession (Score: 24-12)
FOUL! Offensive foul on Chris Carter! Gary Morant drew the charge! [Team fouls: 6] (Chris Carter: 1 personal fouls) TURNOVER! (dead ball)

[03:03] Team_031 possession (Score: 24-12)
Luka Sabonis drives and kicks out. Immanuel James attempts a 3Pt. Contested by Donovan Doncic (3.6 feet, MAN). Immanuel James misses. Offensive rebound by Luka Sabonis! Luka Sabonis puts it back in!
Score: 26-12

[02:46] Team_074 possession (Score: 26-12)
James Turner attempts a Midrange. Contested by Luka Sabonis (5.3 feet, ZONE). JAMES TURNER MAKES IT! Assist: Shai Green
Score: 26-14

[02:31] Team_031 possession (Score: 26-14)
Immanuel James attempts a Layup. BLOCKED BY CHRIS CARTER! Ball is loose! Offensive rebound by Luka Sabonis! Luka Sabonis kicks it out.

[02:13] Team_031 possession (Score: 26-14)
Shai Durant attempts a 3Pt. Contested by Dwyane Quickley (4.0 feet, ZONE). Shai Durant misses. Offensive rebound by Immanuel James! Immanuel James puts it back in!
Score: 28-14

[02:01] Team_074 possession (Score: 28-14)
Shai Green attempts a 3Pt. Contested by Pau Irving (3.3 feet, ZONE). SHAI GREEN MAKES IT! Assist: Donovan Doncic
Score: 28-17

[01:49] Team_031 possession (Score: 28-17)
Immanuel James commits a violation (traveling/carry)! TURNOVER! (dead ball)

[01:49] Substitution (Team_031): Shai Durant OUT → Kevin Morant IN (stamina_rule2)

[01:49] Substitution (Team_031): Gary Morant OUT → Isaiah Ingram IN (stamina_rule2)

[01:49] Substitution (Team_031): Pau Irving OUT → Miles Stewart IN (stamina_rule2)

[01:49] Substitution (Team_031): Immanuel James OUT → Kobe Randle IN (stamina_rule2)

[01:49] Substitution (Team_031): Luka Sabonis OUT → Jimmy Poole IN (stamina_rule2)

[01:49] Substitution (Team_074): Dwyane Quickley OUT → James Barnes IN (stamina_rule2)

[01:49] Substitution (Team_074): Chris Carter OUT → Giannis Westbrook IN (stamina_rule2)

[01:49] Substitution (Team_074): Shai Green OUT → Ayo Smith IN (stamina_rule2)

[01:49] Substitution (Team_074): Donovan Doncic OUT → Yao Randle IN (stamina_rule2)

[01:49] Substitution (Team_074): James Turner OUT → Jaren Rozier IN (stamina_rule2)

[01:30] Team_074 possession (Score: 28-17)
Giannis Westbrook attempts a Layup. Contested by Kobe Randle (3.9 feet, ZONE). GIANNIS WESTBROOK MAKES IT! Assist: Yao Randle
Score: 28-19

[01:19] Team_031 possession (Score: 28-19)
Isaiah Ingram attempts a 3Pt. Heavily contested by Giannis Westbrook (1.8 feet, MAN)! Isaiah Ingram misses. Offensive rebound by Isaiah Ingram! Isaiah Ingram kicks it out.

[01:06] Team_031 possession (Score: 28-19)
Miles Stewart attempts a 3Pt. Contested by Ayo Smith (5.8 feet, MAN). Miles Stewart misses. Rebound secured by Yao Randle.

[00:50] Team_074 possession (Score: 28-19)
Giannis Westbrook makes the Layup and draws the foul on Kobe Randle! And-1! Giannis Westbrook to the line for 1. [Team fouls: 3] (Kobe Randle: 1 personal fouls)   FT 1/1: GOOD Giannis Westbrook makes 1/1 from the line.
Score: 28-22

[00:35] Team_031 possession (Score: 28-22)
Jimmy Poole attempts a Layup. Contested by Jaren Rozier (5.2 feet, MAN). Jimmy Poole misses. Rebound secured by Yao Randle.

[00:23] Team_074 possession (Score: 28-22)
Jaren Rozier attempts a Layup. Contested by Jimmy Poole (4.7 feet, MAN). JAREN ROZIER MAKES IT! Assist: Giannis Westbrook
Score: 28-24

[00:08] Team_031 possession (Score: 28-24)
Kobe Randle attempts a 3Pt. Heavily contested by Yao Randle (0.8 feet, MAN)! Kobe Randle misses. Rebound secured by Yao Randle.

================================================================================
                              1ST QUARTER COMPLETE                              
================================================================================

1ST QUARTER SCORE: Team_031 28, Team_074 24

BOX SCORE:
================================================================================

Team_031
--------------------------------------------------------------------------------
Player                MIN  PTS  REB  AST  TO      FG   FG%      3P   3P%
--------------------------------------------------------------------------------
Immanuel James         10    9    4    0   0   4/5    80.0     0/0   0.0
Luka Sabonis           10    6    5    5   0   3/5    60.0     0/0   0.0
Shai Durant            10    5    0    0   0   2/4    50.0     0/0   0.0
Gary Morant            10    3    3    1   0   1/3    33.3     0/0   0.0
Pau Irving             10    3    0    0   0   1/1   100.0     0/0   0.0
Isaiah Ingram           2    0    1    0   0   0/0     0.0     0/0   0.0
Miles Stewart           2    0    0    0   0   0/1     0.0     0/0   0.0
Jimmy Poole             2    0    0    0   0   0/1     0.0     0/0   0.0
Kobe Randle             2    0    0    0   0   0/1     0.0     0/0   0.0

TEAM: FG: 11/21 (52.4%), 3PT: 6/11 (54.5%), REB: 13 (6 off, 7 def), AST: 6, TO: 2
TEAM FOULS: 3


Team_074
--------------------------------------------------------------------------------
Player                MIN  PTS  REB  AST  TO      FG   FG%      3P   3P%
--------------------------------------------------------------------------------
Donovan Doncic         10    6    2    1   0   2/5    40.0     0/0   0.0
Giannis Westbrook       2    5    0    1   0   2/2   100.0     0/0   0.0
Chris Carter           10    3    0    1   0   1/1   100.0     0/0   0.0
Dwyane Quickley        10    3    0    2   0   1/3    33.3     0/0   0.0
Shai Green             10    3    2    1   0   1/1   100.0     0/0   0.0
James Turner           10    2    2    1   0   1/3    33.3     0/0   0.0
Jaren Rozier            2    2    0    0   0   1/1   100.0     0/0   0.0
Yao Randle              2    0    3    1   0   0/0     0.0     0/0   0.0

TEAM: FG: 9/16 (56.2%), 3PT: 5/6 (83.3%), REB: 9 (0 off, 9 def), AST: 8, TO: 6
TEAM FOULS: 6 [Team_031 in BONUS]

================================================================================

================================================================================
                       2ND QUARTER - Team_031 vs Team_074                       
================================================================================

[12:00] Team_031 possession (Score: 28-24)
Gary Morant attempts a 3Pt. Contested by Chris Carter (4.1 feet, MAN). Gary Morant misses. Rebound secured by Shai Green.

[11:43] Team_074 possession (Score: 28-24)
James Turner attempts a Midrange. Contested by Luka Sabonis (3.2 feet, MAN). James Turner misses. Rebound secured by Immanuel James.

[11:24] Team_031 possession (Score: 28-24)
Immanuel James drives, picks up James Turner. Help arrives from Chris Carter! Immanuel James attempts a Dunk. Heavily contested by Chris Carter (0.5 feet, ZONE)! IMMANUEL JAMES MAKES IT! Assist: Gary Morant
Score: 30-24

[11:08] Team_074 possession (Score: 30-24)
Shai Green attempts a Midrange. Contested by Gary Morant (5.5 feet, ZONE). Shai Green misses. Rebound secured by Immanuel James.

[10:52] Team_031 possession (Score: 30-24)
Pau Irving drives and kicks out. Immanuel James attempts a Midrange. Contested by Shai Green (4.4 feet, ZONE). Immanuel James misses. Rebound secured by Donovan Doncic.

[10:41] Team_074 possession (Score: 30-24)
Donovan Doncic attempts a Layup. BLOCKED BY IMMANUEL JAMES! Ball deflects out of bounds off Donovan Doncic.

[10:26] Team_031 possession (Score: 30-24)
FOUL! Holding foul on Shai Green. [Team fouls: 1] No free throws, side out. (Shai Green: 1 personal fouls)

[10:13] Team_031 possession (Score: 30-24)
FOUL! Shooting foul on Shai Green. Pau Irving to the line for 2 free throws. [Team fouls: 2] (Shai Green: 2 personal fouls)   FT 1/2: GOOD   FT 2/2: GOOD Pau Irving makes 2/2 from the line.
Score: 32-24

[09:57] Team_074 possession (Score: 32-24)
Shai Green attempts a Midrange. Contested by Pau Irving (3.6 feet, ZONE). Shai Green misses. FOUL! Loose ball foul on Immanuel James during the rebound battle. [Team fouls: 1] No free throws, side out. (Immanuel James: 1 personal fouls)

[09:43] Team_074 possession (Score: 32-24)
James Turner drives, Luka Sabonis stays with him. James Turner attempts a Dunk. Heavily contested by Luka Sabonis (1.9 feet, MAN)! JAMES TURNER MAKES IT! Assist: Shai Green
Score: 32-26

[09:26] Team_031 possession (Score: 32-26)
Pau Irving drives and kicks out. Pau Irving attempts a 3Pt. Wide open! Shai Green is 7.4 feet away. [MAN] PAU IRVING MAKES IT! Assist: Shai Durant
Score: 35-26

[09:08] Team_074 possession (Score: 35-26)
James Turner attempts a Layup. Contested by Luka Sabonis (2.4 feet, MAN). JAMES TURNER MAKES IT! Assist: Chris Carter
Score: 35-28

[08:55] Team_031 possession (Score: 35-28)
Immanuel James attempts a 3Pt. Contested by Dwyane Quickley (4.4 feet, ZONE). IMMANUEL JAMES MAKES IT! Assist: Luka Sabonis
Score: 38-28

[08:46] Team_074 possession (Score: 38-28)
FOUL! Holding foul on Luka Sabonis. [Team fouls: 2] No free throws, side out. (Luka Sabonis: 1 personal fouls)

[08:30] Team_074 possession (Score: 38-28)
James Turner drives, Immanuel James stays with him. James Turner attempts a Dunk. Heavily contested by Immanuel James (0.5 feet, ZONE)! James Turner misses. Rebound secured by Gary Morant.

[08:13] Team_031 possession (Score: 38-28)
Luka Sabonis attempts a Midrange. Heavily contested by James Turner (0.5 feet, MAN)! Luka Sabonis misses. Rebound secured by Shai Green.

[07:57] Team_074 possession (Score: 38-28)
FOUL! Shooting foul on Gary Morant. Shai Green to the line for 2 free throws. [Team fouls: 3] (Gary Morant: 1 personal fouls)   FT 1/2: GOOD   FT 2/2: GOOD Shai Green makes 2/2 from the line.
Score: 38-30

[07:46] Team_031 possession (Score: 38-30)
Immanuel James attempts a Midrange. Heavily contested by Donovan Doncic (1.2 feet, ZONE)! Immanuel James misses. Offensive rebound by Luka Sabonis! Luka Sabonis puts it back in!
Score: 40-30

[07:30] Team_074 possession (Score: 40-30)
James Turner attempts a Midrange. BLOCKED BY GARY MORANT! Ball deflects out of bounds off James Turner.

[07:17] Team_031 possession (Score: 40-30)
Pau Irving attempts a Layup. Contested by Donovan Doncic (3.3 feet, ZONE). PAU IRVING MAKES IT! Assist: Luka Sabonis
Score: 42-30

[07:04] Team_074 possession (Score: 42-30)
James Turner attempts a Midrange. Wide open! Gary Morant is 6.1 feet away. [ZONE] JAMES TURNER MAKES IT! Assist: Dwyane Quickley
Score: 42-32

[06:48] Team_031 possession (Score: 42-32)
Gary Morant throws a bad pass out of bounds! TURNOVER! (dead ball)

[06:48] Substitution (Team_031): Shai Durant OUT → Kevin Morant IN (stamina_rule2)

[06:48] Substitution (Team_031): Gary Morant OUT → Isaiah Ingram IN (stamina_rule2)

[06:48] Substitution (Team_031): Pau Irving OUT → Miles Stewart IN (stamina_rule2)

[06:48] Substitution (Team_031): Immanuel James OUT → Kobe Randle IN (stamina_rule2)

[06:48] Substitution (Team_031): Luka Sabonis OUT → Jimmy Poole IN (stamina_rule2)

[06:48] Substitution (Team_074): Dwyane Quickley OUT → James Barnes IN (stamina_rule2)

[06:48] Substitution (Team_074): Chris Carter OUT → Giannis Westbrook IN (stamina_rule2)

[06:48] Substitution (Team_074): Shai Green OUT → Ayo Smith IN (stamina_rule2)

[06:48] Substitution (Team_074): Donovan Doncic OUT → Yao Randle IN (stamina_rule2)

[06:48] Substitution (Team_074): James Turner OUT → Jaren Rozier IN (stamina_rule2)

[06:33] Team_074 possession (Score: 42-32)
Jaren Rozier attempts a 3Pt. Wide open! Miles Stewart is 6.6 feet away. [ZONE] Jaren Rozier misses. Rebound secured by Jimmy Poole.

[06:17] Team_031 possession (Score: 42-32)
Kevin Morant attempts a Layup. Contested by James Barnes (3.0 feet, MAN). KEVIN MORANT MAKES IT!
Score: 44-32

[06:00] Team_074 possession (Score: 44-32)
Jaren Rozier attempts a Midrange. Wide open! Jimmy Poole is 6.8 feet away. [MAN] Jaren Rozier misses. Rebound secured by Jimmy Poole.

[05:46] Team_031 possession (Score: 44-32)
FOUL! Reach-in foul on Ayo Smith during the drive. [Team fouls: 3] No free throws, side out. (Ayo Smith: 1 personal fouls)

[05:29] Team_031 possession (Score: 44-32)
Kevin Morant attempts a 3Pt. Contested by James Barnes (3.3 feet, ZONE). Kevin Morant misses. Rebound secured by Yao Randle.

[05:13] Team_074 possession (Score: 44-32)
Ayo Smith attempts a Layup. Contested by Kobe Randle (2.1 feet, ZONE). AYO SMITH MAKES IT!
Score: 44-34

[05:01] Team_031 possession (Score: 44-34)
Jimmy Poole attempts a Midrange. Wide open! Jaren Rozier is 6.2 feet away. [ZONE] Jimmy Poole misses. Rebound secured by Yao Randle.

[04:43] Team_074 possession (Score: 44-34)
FOUL! Reach-in foul on Kobe Randle during the drive. [Team fouls: 4] No free throws, side out. (Kobe Randle: 1 personal fouls)

[04:25] Team_074 possession (Score: 44-34)
Jaren Rozier throws a bad pass out of bounds! TURNOVER! (dead ball)

[04:11] Team_031 possession (Score: 44-34)
Kobe Randle attempts a Midrange. Wide open! Yao Randle is 6.8 feet away. [MAN] Kobe Randle misses. Rebound secured by Yao Randle.

[04:01] Team_074 possession (Score: 44-34)
Ayo Smith drives and kicks out. Jaren Rozier attempts a Midrange. Contested by Jimmy Poole (4.8 feet, MAN). JAREN ROZIER MAKES IT!
Score: 44-36

[03:47] Team_031 possession (Score: 44-36)
FOUL! Offensive foul on Isaiah Ingram! Giannis Westbrook drew the charge! [Team fouls: 5] (Isaiah Ingram: 1 personal fouls) TURNOVER! (dead ball)

[03:30] Team_074 possession (Score: 44-36)
Jaren Rozier loses control! Ball rolls out of bounds! TURNOVER! (dead ball)

[03:16] Team_031 possession (Score: 44-36)
Kevin Morant attempts a 3Pt. Wide open! James Barnes is 6.7 feet away. [MAN] Kevin Morant misses. Offensive rebound by Jimmy Poole! Jimmy Poole kicks it out.

[03:03] Team_031 possession (Score: 44-36)
Kevin Morant attempts a 3Pt. Contested by James Barnes (3.3 feet, MAN). Kevin Morant misses. Rebound secured by Yao Randle.

[02:47] Team_074 possession (Score: 44-36)
Giannis Westbrook drives, picks up Kobe Randle. Help arrives from Isaiah Ingram! Giannis Westbrook attempts a Layup. Contested by Isaiah Ingram (3.0 feet, ZONE). Giannis Westbrook misses. Rebound secured by Kobe Randle.

[02:31] Team_031 possession (Score: 44-36)
Isaiah Ingram drives, Giannis Westbrook stays with him. Isaiah Ingram attempts a Layup. Heavily contested by Giannis Westbrook (1.5 feet, MAN)! Isaiah Ingram misses. Rebound secured by Yao Randle.

[02:18] Team_074 possession (Score: 44-36)
Yao Randle drives, Kobe Randle stays with him. Yao Randle attempts a Dunk. Contested by Kobe Randle (5.9 feet, MAN). YAO RANDLE MAKES IT! Assist: Giannis Westbrook
Score: 44-38

[02:02] Team_031 possession (Score: 44-38)
Kobe Randle attempts a Midrange. Wide open! Yao Randle is 6.5 feet away. [MAN] KOBE RANDLE MAKES IT! Assist: Kevin Morant
Score: 46-38

[01:46] Team_074 possession (Score: 46-38)
James Barnes makes the Layup and draws the foul on Kobe Randle! And-1! James Barnes to the line for 1. [BONUS: 6 team fouls] (Kobe Randle: 2 personal fouls)   FT 1/1: GOOD James Barnes makes 1/1 from the line.
Score: 46-41

[01:36] Team_031 possession (Score: 46-41)
Miles Stewart drives to the basket... Miles Stewart throws a bad pass out of bounds! TURNOVER! (dead ball)

[01:20] Team_074 possession (Score: 46-41)
FOUL! Shooting foul on Kobe Randle. Yao Randle to the line for 2 free throws. [BONUS: 7 team fouls] (Kobe Randle: 3 personal fouls)   FT 1/2: MISS   FT 2/2: GOOD Yao Randle makes 1/2 from the line.
Score: 46-42

[01:08] Team_031 possession (Score: 46-42)
Miles Stewart attempts a 3Pt. Wide open! James Barnes is 9.5 feet away. [ZONE] MILES STEWART MAKES IT! Assist: Kevin Morant
Score: 49-42

[00:56] Team_074 possession (Score: 49-42)
Ayo Smith attempts a Layup. Wide open! Kobe Randle is 6.5 feet away. [ZONE] Ayo Smith misses. Rebound secured by Isaiah Ingram.

[00:43] Team_031 possession (Score: 49-42)
Miles Stewart throws a bad pass out of bounds! TURNOVER! (dead ball)

[00:24] Team_074 possession (Score: 49-42)
Ayo Smith drives and kicks out. James Barnes attempts a Midrange. Wide open! Miles Stewart is 8.4 feet away. [ZONE] James Barnes misses. Rebound secured by Kobe Randle.

[00:08] Team_031 possession (Score: 49-42)
Kobe Randle attempts a 3Pt. Wide open! James Barnes is 8.4 feet away. [ZONE] KOBE RANDLE MAKES IT!
Score: 52-42

================================================================================
                              2ND QUARTER COMPLETE                              
================================================================================

2ND QUARTER SCORE: Team_031 24, Team_074 18

BOX SCORE:
================================================================================

Team_031
--------------------------------------------------------------------------------
Player                MIN  PTS  REB  AST  TO      FG   FG%      3P   3P%
--------------------------------------------------------------------------------
Pau Irving             16    7    0    0   0   3/4    75.0     0/0   0.0
Immanuel James         16    5    2    0   0   2/2   100.0     0/0   0.0
Kobe Randle             8    5    2    0   0   2/3    66.7     0/0   0.0
Miles Stewart           8    3    0    0   0   1/1   100.0     0/0   0.0
Luka Sabonis           16    2    1    2   0   1/2    50.0     0/0   0.0
Kevin Morant            8    2    0    2   0   1/3    33.3     0/0   0.0
Gary Morant            16    0    1    1   0   0/1     0.0     0/0   0.0
Shai Durant            16    0    0    1   0   0/0     0.0     0/0   0.0
Jimmy Poole             8    0    3    0   0   0/1     0.0     0/0   0.0
Isaiah Ingram           8    0    1    0   0   0/1     0.0     0/0   0.0

TEAM: FG: 10/18 (55.6%), 3PT: 3/6 (50.0%), REB: 10 (2 off, 8 def), AST: 6, TO: 4
TEAM FOULS: 7 [Team_074 in BONUS]


Team_074
--------------------------------------------------------------------------------
Player                MIN  PTS  REB  AST  TO      FG   FG%      3P   3P%
--------------------------------------------------------------------------------
James Turner           16    6    0    0   0   3/6    50.0     0/0   0.0
Yao Randle              8    3    5    0   0   2/2   100.0     0/0   0.0
James Barnes            8    3    0    0   0   1/1   100.0     0/0   0.0
Shai Green             16    2    2    1   0   1/2    50.0     0/0   0.0
Jaren Rozier            8    2    0    0   0   1/3    33.3     0/0   0.0
Ayo Smith               8    2    0    0   0   1/3    33.3     0/0   0.0
Donovan Doncic         16    0    2    0   0   0/1     0.0     0/0   0.0
Chris Carter           16    0    0    1   0   0/0     0.0     0/0   0.0
Dwyane Quickley        16    0    0    1   0   0/0     0.0     0/0   0.0
Giannis Westbrook       8    0    0    1   0   0/1     0.0     0/0   0.0

TEAM: FG: 9/19 (47.4%), 3PT: 0/1 (0.0%), REB: 9 (1 off, 8 def), AST: 4, TO: 2
TEAM FOULS: 3

================================================================================

================================================================================
                       3RD QUARTER - Team_031 vs Team_074                       
================================================================================

[12:00] Team_031 possession (Score: 52-42)
Pau Irving drives and kicks out. Shai Durant attempts a Midrange. Contested by Donovan Doncic (4.0 feet, ZONE). SHAI DURANT MAKES IT!
Score: 54-42

[11:46] Team_074 possession (Score: 54-42)
Chris Carter drives and kicks out. James Turner attempts a Midrange. Contested by Luka Sabonis (3.1 feet, MAN). JAMES TURNER MAKES IT!
Score: 54-44

[11:36] Team_031 possession (Score: 54-44)
Shai Durant drives, Donovan Doncic stays with him. Shai Durant attempts a Layup. Contested by Donovan Doncic (3.3 feet, ZONE). Shai Durant misses. Rebound secured by Shai Green.

[11:23] Team_074 possession (Score: 54-44)
Donovan Doncic attempts a Layup. BLOCKED BY IMMANUEL JAMES! Ball is loose! Rebound secured by Gary Morant.

[11:10] Team_031 possession (Score: 54-44)
Gary Morant attempts a 3Pt. Contested by Chris Carter (4.5 feet, MAN). Gary Morant misses. Rebound secured by Shai Green.

[10:53] Team_074 possession (Score: 54-44)
Chris Carter attempts a Midrange. Contested by Immanuel James (4.6 feet, ZONE). Chris Carter misses. Rebound secured by Immanuel James.

[10:34] Team_031 possession (Score: 54-44)
Pau Irving attempts a Midrange. Contested by Chris Carter (4.3 feet, ZONE). PAU IRVING MAKES IT! Assist: Shai Durant
Score: 56-44

[10:20] Team_074 possession (Score: 56-44)
Dwyane Quickley attempts a Midrange. Contested by Shai Durant (4.1 feet, MAN). DWYANE QUICKLEY MAKES IT! Assist: James Turner
Score: 56-46

[10:09] Team_031 possession (Score: 56-46)
Shai Durant attempts a 3Pt. Contested by Dwyane Quickley (3.5 feet, MAN). Shai Durant misses. Rebound secured by Shai Green.

[09:52] Team_074 possession (Score: 56-46)
Donovan Doncic attempts a Midrange. Heavily contested by Immanuel James (1.0 feet, MAN)! Donovan Doncic misses. Rebound secured by Immanuel James.

[09:42] Team_031 possession (Score: 56-46)
Luka Sabonis drives and kicks out. Shai Durant attempts a 3Pt. Contested by Dwyane Quickley (5.0 feet, ZONE). Shai Durant misses. Rebound secured by James Turner.

[09:26] Team_074 possession (Score: 56-46)
Donovan Doncic drives, picks up Immanuel James. Help arrives from Shai Durant! Donovan Doncic attempts a Dunk. Heavily contested by Shai Durant (1.7 feet, MAN)! DONOVAN DONCIC MAKES IT! Assist: Shai Green
Score: 56-48

[09:08] Team_031 possession (Score: 56-48)
FOUL! Offensive foul on Luka Sabonis! James Turner drew the charge! [Team fouls: 1] (Luka Sabonis: 1 personal fouls) TURNOVER! (dead ball)

[08:51] Team_074 possession (Score: 56-48)
Donovan Doncic drives, Immanuel James stays with him. Donovan Doncic attempts a Layup. Contested by Immanuel James (2.1 feet, ZONE). Donovan Doncic misses. Rebound secured by Immanuel James.

[08:36] Team_031 possession (Score: 56-48)
Pau Irving attempts a Midrange. Contested by Shai Green (5.1 feet, ZONE). Pau Irving misses. Offensive rebound by Luka Sabonis! Luka Sabonis's putback is no good. Offensive rebound by Luka Sabonis! Luka Sabonis kicks it out.

[08:21] Team_031 possession (Score: 56-48)
FOUL! Shooting foul on Chris Carter. Luka Sabonis to the line for 2 free throws. [Team fouls: 1] (Chris Carter: 1 personal fouls)   FT 1/2: MISS   FT 2/2: GOOD Luka Sabonis makes 1/2 from the line.
Score: 57-48

[08:10] Team_074 possession (Score: 57-48)
Shai Green drives and kicks out. Donovan Doncic attempts a Midrange. Contested by Pau Irving (2.1 feet, ZONE). Donovan Doncic misses. Rebound secured by Gary Morant.

[07:56] Team_031 possession (Score: 57-48)
Pau Irving drives and kicks out. Pau Irving attempts a 3Pt. Wide open! Dwyane Quickley is 7.0 feet away. [ZONE] PAU IRVING MAKES IT! Assist: Luka Sabonis
Score: 60-48

[07:40] Team_074 possession (Score: 60-48)
James Turner drives, picks up Luka Sabonis. Help arrives from Shai Durant! James Turner attempts a Dunk. Heavily contested by Shai Durant (0.5 feet, MAN)! JAMES TURNER MAKES IT! Assist: Shai Green
Score: 60-50

[07:23] Team_031 possession (Score: 60-50)
Shai Durant attempts a 3Pt. Wide open! Dwyane Quickley is 9.0 feet away. [MAN] Shai Durant misses. Rebound secured by Donovan Doncic.

[07:06] Team_074 possession (Score: 60-50)
James Turner drives and kicks out. James Turner attempts a 3Pt. Contested by Pau Irving (2.7 feet, ZONE). James Turner misses. Rebound secured by Gary Morant.

[06:54] Team_031 possession (Score: 60-50)
Gary Morant attempts a 3Pt. Contested by Dwyane Quickley (5.2 feet, ZONE). Gary Morant misses. Rebound secured by James Turner.

[06:39] Team_074 possession (Score: 60-50)
Donovan Doncic drives and kicks out. Donovan Doncic attempts a Midrange. Heavily contested by Immanuel James (0.5 feet, MAN)! Donovan Doncic misses. Rebound secured by Gary Morant.

[06:26] Team_031 possession (Score: 60-50)
Luka Sabonis attempts a Midrange. Contested by James Turner (3.7 feet, MAN). Luka Sabonis misses. Rebound secured by James Turner.

[06:12] Team_074 possession (Score: 60-50)
Dwyane Quickley makes the Layup and draws the foul on Luka Sabonis! And-1! Dwyane Quickley to the line for 1. [Team fouls: 2] (Luka Sabonis: 2 personal fouls)   FT 1/1: GOOD Dwyane Quickley makes 1/1 from the line.
Score: 60-53

[05:57] Team_031 possession (Score: 60-53)
Luka Sabonis attempts a Midrange. Contested by James Turner (2.4 feet, MAN). Luka Sabonis misses. Rebound secured by James Turner.

[05:39] Team_074 possession (Score: 60-53)
Chris Carter throws a bad pass out of bounds! TURNOVER! (dead ball)

[05:20] Team_031 possession (Score: 60-53)
Gary Morant drives, Chris Carter stays with him. Gary Morant attempts a Dunk. Heavily contested by Chris Carter (1.3 feet, MAN)! GARY MORANT MAKES IT!
Score: 62-53

[05:02] Team_074 possession (Score: 62-53)
Donovan Doncic drives, picks up Immanuel James. Help arrives from Shai Durant! Donovan Doncic attempts a Layup. Contested by Shai Durant (2.3 feet, MAN). Donovan Doncic misses. Rebound secured by Luka Sabonis.

[04:45] Team_031 possession (Score: 62-53)
Luka Sabonis drives and kicks out. Gary Morant attempts a Midrange. Contested by Chris Carter (4.2 feet, MAN). Gary Morant misses. Offensive rebound by Immanuel James! Immanuel James puts it back in!
Score: 64-53

[04:29] Team_074 possession (Score: 64-53)
Donovan Doncic attempts a 3Pt. Contested by Immanuel James (5.8 feet, MAN). Donovan Doncic misses. Rebound secured by Luka Sabonis.

[04:12] Team_031 possession (Score: 64-53)
Luka Sabonis attempts a 3Pt. Contested by Dwyane Quickley (2.8 feet, ZONE). LUKA SABONIS MAKES IT! Assist: Gary Morant
Score: 67-53

[03:57] Team_074 possession (Score: 67-53)
Donovan Doncic attempts a 3Pt. Wide open! Pau Irving is 7.6 feet away. [ZONE] Donovan Doncic misses. Rebound secured by Gary Morant.

[03:41] Team_031 possession (Score: 67-53)
Immanuel James attempts a 3Pt. Wide open! Dwyane Quickley is 7.0 feet away. [ZONE] IMMANUEL JAMES MAKES IT! Assist: Shai Durant
Score: 70-53

[03:27] Team_074 possession (Score: 70-53)
James Turner attempts a 3Pt. Contested by Pau Irving (5.6 feet, ZONE). James Turner misses. Rebound secured by Luka Sabonis.

[03:15] Team_031 possession (Score: 70-53)
FOUL! Shooting foul on Shai Green. Pau Irving to the line for 3 free throws. [Team fouls: 2] (Shai Green: 1 personal fouls)   FT 1/3: GOOD   FT 2/3: GOOD   FT 3/3: GOOD Pau Irving makes 3/3 from the line.
Score: 73-53

[03:05] Team_074 possession (Score: 73-53)
Shai Green attempts a Midrange. Wide open! Gary Morant is 6.0 feet away. [ZONE] Shai Green misses. Rebound secured by Gary Morant.

[02:49] Team_031 possession (Score: 73-53)
Shai Durant attempts a 3Pt. Contested by Dwyane Quickley (4.0 feet, MAN). SHAI DURANT MAKES IT! Assist: Luka Sabonis
Score: 76-53

[02:36] Team_074 possession (Score: 76-53)
Chris Carter attempts a Layup. BLOCKED BY GARY MORANT! Ball goes out off Gary Morant. Chris Carter's ball!

[02:25] Team_074 possession (Score: 76-53)
Shai Green attempts a 3Pt. Contested by Pau Irving (4.7 feet, ZONE). SHAI GREEN MAKES IT! Assist: Dwyane Quickley
Score: 76-56

[02:07] Team_031 possession (Score: 76-56)
Luka Sabonis drives and kicks out. Gary Morant attempts a 3Pt. Contested by Dwyane Quickley (5.8 feet, ZONE). Gary Morant misses. Rebound secured by James Turner.

[01:52] Team_074 possession (Score: 76-56)
Dwyane Quickley attempts a 3Pt. Contested by Shai Durant (5.3 feet, MAN). Dwyane Quickley misses. Rebound secured by Immanuel James.

[01:35] Team_031 possession (Score: 76-56)
Luka Sabonis drives, picks up Donovan Doncic. Help arrives from Chris Carter! Luka Sabonis attempts a Dunk. Contested by Chris Carter (3.2 feet, ZONE). LUKA SABONIS MAKES IT! Assist: Shai Durant
Score: 78-56

[01:23] Team_074 possession (Score: 78-56)
Dwyane Quickley attempts a Midrange. Wide open! Shai Durant is 7.6 feet away. [MAN] DWYANE QUICKLEY MAKES IT!
Score: 78-58

[01:06] Team_031 possession (Score: 78-58)
Shai Durant drives, Donovan Doncic stays with him. Shai Durant attempts a Layup. Contested by Donovan Doncic (4.2 feet, ZONE). Shai Durant misses. Rebound secured by Shai Green.

[00:55] Team_074 possession (Score: 78-58)
FOUL! Holding foul on Shai Durant. [Team fouls: 3] No free throws, side out. (Shai Durant: 1 personal fouls)

[00:36] Team_074 possession (Score: 78-58)
Shai Green attempts a 3Pt. Contested by Immanuel James (3.5 feet, ZONE). Shai Green misses. Offensive rebound by James Turner! James Turner kicks it out.

[00:20] Team_074 possession (Score: 78-58)
Shai Green attempts a 3Pt. Contested by Pau Irving (4.0 feet, ZONE). Shai Green misses. Rebound secured by Immanuel James.

[00:06] Team_031 possession (Score: 78-58)
Gary Morant attempts a 3Pt. Wide open! Chris Carter is 6.9 feet away. [MAN] GARY MORANT MAKES IT!
Score: 81-58

================================================================================
                              3RD QUARTER COMPLETE                              
================================================================================

3RD QUARTER SCORE: Team_031 29, Team_074 16

BOX SCORE:
================================================================================

Team_031
--------------------------------------------------------------------------------
Player                MIN  PTS  REB  AST  TO      FG   FG%      3P   3P%
--------------------------------------------------------------------------------
Pau Irving             28    8    0    0   0   3/3   100.0     0/0   0.0
Luka Sabonis           28    6    4    2   0   3/7    42.9     0/0   0.0
Shai Durant            28    5    0    3   0   2/6    33.3     0/0   0.0
Gary Morant            28    5    6    1   0   2/4    50.0     0/0   0.0
Immanuel James         28    5    6    0   0   2/2   100.0     0/0   0.0

TEAM: FG: 12/22 (54.5%), 3PT: 5/9 (55.6%), REB: 16 (2 off, 14 def), AST: 6, TO: 1
TEAM FOULS: 3


Team_074
--------------------------------------------------------------------------------
Player                MIN  PTS  REB  AST  TO      FG   FG%      3P   3P%
--------------------------------------------------------------------------------
Dwyane Quickley        28    7    0    1   0   3/4    75.0     0/0   0.0
James Turner           28    4    6    1   0   2/4    50.0     0/0   0.0
Shai Green             28    3    4    2   0   1/4    25.0     0/0   0.0
Donovan Doncic         28    2    1    0   0   1/8    12.5     0/0   0.0
Chris Carter           28    0    0    0   0   0/1     0.0     0/0   0.0

TEAM: FG: 7/21 (33.3%), 3PT: 1/6 (16.7%), REB: 11 (1 off, 10 def), AST: 4, TO: 1
TEAM FOULS: 2

================================================================================

================================================================================
                       4TH QUARTER - Team_031 vs Team_074                       
================================================================================

[12:00] Team_031 possession (Score: 81-58)
Pau Irving drives, Donovan Doncic stays with him. Pau Irving attempts a Layup. Contested by Donovan Doncic (4.5 feet, ZONE). PAU IRVING MAKES IT! Assist: Shai Durant
Score: 83-58

[11:45] Team_074 possession (Score: 83-58)
Shai Green attempts a 3Pt. Contested by Pau Irving (5.5 feet, ZONE). SHAI GREEN MAKES IT! Assist: Dwyane Quickley
Score: 83-61

[11:35] Team_031 possession (Score: 83-61)
Immanuel James attempts a 3Pt. Wide open! Dwyane Quickley is 6.7 feet away. [ZONE] IMMANUEL JAMES MAKES IT! Assist: Pau Irving
Score: 86-61

[11:17] Team_074 possession (Score: 86-61)
Chris Carter attempts a 3Pt. Contested by Pau Irving (4.9 feet, ZONE). CHRIS CARTER MAKES IT! Assist: Shai Green
Score: 86-64

[11:04] Team_031 possession (Score: 86-64)
Luka Sabonis drives to the basket... Luka Sabonis loses control! Ball rolls out of bounds! TURNOVER! (dead ball)

[11:04] Substitution (Team_031): Shai Durant OUT → Kevin Morant IN (stamina_rule2)

[11:04] Substitution (Team_031): Gary Morant OUT → Isaiah Ingram IN (stamina_rule2)

[11:04] Substitution (Team_031): Pau Irving OUT → Miles Stewart IN (stamina_rule2)

[11:04] Substitution (Team_031): Immanuel James OUT → Kobe Randle IN (stamina_rule2)

[11:04] Substitution (Team_031): Luka Sabonis OUT → Jimmy Poole IN (stamina_rule2)

[11:04] Substitution (Team_074): Dwyane Quickley OUT → James Barnes IN (stamina_rule2)

[11:04] Substitution (Team_074): Chris Carter OUT → Giannis Westbrook IN (stamina_rule2)

[11:04] Substitution (Team_074): Shai Green OUT → Ayo Smith IN (stamina_rule2)

[11:04] Substitution (Team_074): Donovan Doncic OUT → Yao Randle IN (stamina_rule2)

[11:04] Substitution (Team_074): James Turner OUT → Jaren Rozier IN (stamina_rule2)

[10:54] Team_074 possession (Score: 86-64)
Giannis Westbrook attempts a 3Pt. Wide open! Isaiah Ingram is 6.1 feet away. [MAN] Giannis Westbrook misses. Offensive rebound by Yao Randle! Yao Randle kicks it out.

[10:36] Team_074 possession (Score: 86-64)
Yao Randle drives, Kobe Randle stays with him. Yao Randle attempts a Dunk. Contested by Kobe Randle (5.0 feet, MAN). YAO RANDLE MAKES IT! Assist: James Barnes
Score: 86-66

[10:24] Team_031 possession (Score: 86-66)
Isaiah Ingram attempts a 3Pt. Contested by James Barnes (4.6 feet, ZONE). ISAIAH INGRAM MAKES IT! Assist: Jimmy Poole
Score: 89-66

[10:10] Team_074 possession (Score: 89-66)
FOUL! Offensive foul on James Barnes! Kevin Morant drew the charge! [Team fouls: 1] (James Barnes: 1 personal fouls) TURNOVER! (dead ball)

[09:53] Team_031 possession (Score: 89-66)
Jimmy Poole attempts a 3Pt. Contested by Jaren Rozier (4.6 feet, MAN). JIMMY POOLE MAKES IT! Assist: Isaiah Ingram
Score: 92-66

[09:37] Team_074 possession (Score: 92-66)
James Barnes attempts a Layup. Contested by Kevin Morant (4.6 feet, MAN). JAMES BARNES MAKES IT! Assist: Ayo Smith
Score: 92-68

[09:25] Team_031 possession (Score: 92-68)
FOUL! Shooting foul on Yao Randle. Kevin Morant to the line for 2 free throws. [Team fouls: 2] (Yao Randle: 1 personal fouls)   FT 1/2: GOOD   FT 2/2: GOOD Kevin Morant makes 2/2 from the line.
Score: 94-68

[09:13] Team_074 possession (Score: 94-68)
Ayo Smith drives and kicks out. Yao Randle attempts a Midrange. Wide open! Kobe Randle is 7.5 feet away. [MAN] Yao Randle misses. Rebound secured by Kobe Randle.

[08:57] Team_031 possession (Score: 94-68)
Kevin Morant attempts a Midrange. Contested by James Barnes (2.4 feet, MAN). KEVIN MORANT MAKES IT!
Score: 96-68

[08:44] Team_074 possession (Score: 96-68)
Jaren Rozier attempts a Midrange. Contested by Jimmy Poole (4.2 feet, MAN). Jaren Rozier misses. Rebound secured by Kobe Randle.

[08:29] Team_031 possession (Score: 96-68)
FOUL! Shooting foul on Jaren Rozier. Jimmy Poole to the line for 2 free throws. [Team fouls: 3] (Jaren Rozier: 1 personal fouls)   FT 1/2: MISS   FT 2/2: GOOD Jimmy Poole makes 1/2 from the line.
Score: 97-68

[08:16] Team_074 possession (Score: 97-68)
Jaren Rozier drives, Kobe Randle stays with him. Jaren Rozier attempts a Dunk. Contested by Kobe Randle (2.2 feet, ZONE). JAREN ROZIER MAKES IT!
Score: 97-70

[08:02] Team_031 possession (Score: 97-70)
Isaiah Ingram drives and kicks out. Jimmy Poole attempts a 3Pt. Contested by Jaren Rozier (5.3 feet, MAN). Jimmy Poole misses. Rebound secured by Ayo Smith.

[07:46] Team_074 possession (Score: 97-70)
Jaren Rozier throws a bad pass! Stolen by Jimmy Poole! TURNOVER! (live ball)

[07:32] Team_031 possession (Score: 97-70)
Jimmy Poole attempts a 3Pt. Contested by Jaren Rozier (5.1 feet, MAN). Jimmy Poole misses. Rebound secured by Jaren Rozier.

[07:20] Team_074 possession (Score: 97-70)
Giannis Westbrook attempts a 3Pt. Heavily contested by Miles Stewart (0.5 feet, ZONE)! GIANNIS WESTBROOK MAKES IT! Assist: Yao Randle
Score: 97-73

[07:04] Team_031 possession (Score: 97-73)
Isaiah Ingram drives, picks up Yao Randle. Help arrives from Giannis Westbrook! Isaiah Ingram attempts a Dunk. Contested by Giannis Westbrook (5.5 feet, ZONE). Isaiah Ingram misses. Offensive rebound by Isaiah Ingram! Isaiah Ingram kicks it out.

[06:49] Team_031 possession (Score: 97-73)
Kevin Morant attempts a Midrange. Contested by James Barnes (3.3 feet, MAN). Kevin Morant misses. Rebound secured by Yao Randle.

[06:32] Team_074 possession (Score: 97-73)
Yao Randle makes the Layup and draws the foul on Kobe Randle! And-1! Yao Randle to the line for 1. [Team fouls: 1] (Kobe Randle: 1 personal fouls)   FT 1/1: GOOD Yao Randle makes 1/1 from the line.
Score: 97-76

[06:18] Team_031 possession (Score: 97-76)
Isaiah Ingram attempts a 3Pt. Contested by Giannis Westbrook (4.5 feet, MAN). Isaiah Ingram misses. Rebound secured by Yao Randle.

[06:05] Team_074 possession (Score: 97-76)
Jaren Rozier attempts a Midrange. Wide open! Kobe Randle is 6.2 feet away. [ZONE] JAREN ROZIER MAKES IT! Assist: James Barnes
Score: 97-78

[05:54] Team_031 possession (Score: 97-78)
Jimmy Poole attempts a Midrange. Heavily contested by Jaren Rozier (1.5 feet, MAN)! Jimmy Poole misses. Rebound secured by Jaren Rozier.

[05:39] Team_074 possession (Score: 97-78)
Ayo Smith attempts a Midrange. Wide open! Isaiah Ingram is 6.5 feet away. [ZONE] Ayo Smith misses. Rebound secured by Kobe Randle.

[05:24] Team_031 possession (Score: 97-78)
Jimmy Poole attempts a 3Pt. Contested by Jaren Rozier (5.7 feet, MAN). JIMMY POOLE MAKES IT! Assist: Kobe Randle
Score: 100-78

[05:07] Team_074 possession (Score: 100-78)
Giannis Westbrook attempts a 3Pt. Contested by Miles Stewart (4.3 feet, ZONE). Giannis Westbrook misses. Rebound secured by Jimmy Poole.

[04:52] Team_031 possession (Score: 100-78)
Kobe Randle attempts a Midrange. Heavily contested by Yao Randle (1.2 feet, MAN)! Kobe Randle misses. Rebound secured by Ayo Smith.

[04:34] Team_074 possession (Score: 100-78)
Jaren Rozier drives, Jimmy Poole stays with him. Jaren Rozier attempts a Dunk. Contested by Jimmy Poole (4.8 feet, MAN). JAREN ROZIER MAKES IT! Assist: Giannis Westbrook
Score: 100-80

[04:23] Team_031 possession (Score: 100-80)
Jimmy Poole throws a bad pass! Stolen by Jaren Rozier! TURNOVER! (live ball)

[04:05] Team_074 possession (Score: 100-80)
Jaren Rozier makes the Dunk and draws the foul on Isaiah Ingram! And-1! Jaren Rozier to the line for 1. [Team fouls: 2] (Isaiah Ingram: 1 personal fouls)   FT 1/1: GOOD Jaren Rozier makes 1/1 from the line.
Score: 100-83

[03:51] Team_031 possession (Score: 100-83)
Miles Stewart attempts a 3Pt. Contested by Ayo Smith (4.6 feet, MAN). Miles Stewart misses. Rebound secured by Ayo Smith.

[03:36] Team_074 possession (Score: 100-83)
Giannis Westbrook attempts a 3Pt. Contested by Miles Stewart (3.8 feet, ZONE). GIANNIS WESTBROOK MAKES IT!
Score: 100-86

[03:20] Team_031 possession (Score: 100-86)
Isaiah Ingram drives, picks up Giannis Westbrook. Help arrives from James Barnes! Isaiah Ingram attempts a Layup. Contested by James Barnes (4.0 feet, MAN). ISAIAH INGRAM MAKES IT! Assist: Miles Stewart
Score: 102-86

[03:07] Team_074 possession (Score: 102-86)
Jaren Rozier drives, picks up Jimmy Poole. Help arrives from Isaiah Ingram! Jaren Rozier attempts a Layup. Contested by Isaiah Ingram (3.5 feet, MAN). Jaren Rozier misses. Rebound secured by Isaiah Ingram.

[02:53] Team_031 possession (Score: 102-86)
Kevin Morant attempts a 3Pt. Contested by James Barnes (2.9 feet, ZONE). Kevin Morant misses. Rebound secured by Ayo Smith.

[02:36] Team_074 possession (Score: 102-86)
Giannis Westbrook attempts a Midrange. Wide open! Isaiah Ingram is 9.9 feet away. [ZONE] GIANNIS WESTBROOK MAKES IT!
Score: 102-88

[02:20] Team_031 possession (Score: 102-88)
Miles Stewart drives and kicks out. Kobe Randle attempts a 3Pt. Contested by Yao Randle (5.2 feet, MAN). Kobe Randle misses. Offensive rebound by Isaiah Ingram! Isaiah Ingram kicks it out.

[02:04] Team_031 possession (Score: 102-88)
Kobe Randle attempts a 3Pt. Contested by Ayo Smith (4.9 feet, ZONE). KOBE RANDLE MAKES IT! Assist: Miles Stewart
Score: 105-88

[01:50] Team_074 possession (Score: 105-88)
James Barnes attempts a Midrange. Contested by Kevin Morant (4.9 feet, MAN). James Barnes misses. Offensive rebound by Jaren Rozier! Jaren Rozier kicks it out.

[01:34] Team_074 possession (Score: 105-88)
Ayo Smith attempts a 3Pt. Wide open! Miles Stewart is 6.4 feet away. [MAN] AYO SMITH MAKES IT! Assist: James Barnes
Score: 105-91

[01:20] Team_031 possession (Score: 105-91)
Kevin Morant attempts a Midrange. Wide open! Ayo Smith is 7.0 feet away. [ZONE] Kevin Morant misses. Rebound secured by Yao Randle.

[01:05] Team_074 possession (Score: 105-91)
Yao Randle attempts a 3Pt. Wide open! Miles Stewart is 6.4 feet away. [ZONE] Yao Randle misses. Rebound secured by Kobe Randle.

[00:50] Team_031 possession (Score: 105-91)
Isaiah Ingram attempts a 3Pt. Contested by Giannis Westbrook (2.8 feet, ZONE). Isaiah Ingram misses. Rebound secured by Ayo Smith.

[00:35] Team_074 possession (Score: 105-91)
Jaren Rozier attempts a Layup. Heavily contested by Kobe Randle (1.3 feet, ZONE)! JAREN ROZIER MAKES IT! Assist: Ayo Smith
Score: 105-93

[00:19] Team_031 possession (Score: 105-93)
Kobe Randle drives and kicks out. Isaiah Ingram attempts a 3Pt. Contested by Giannis Westbrook (5.5 feet, MAN). Isaiah Ingram misses. Rebound secured by Yao Randle.

[00:08] Team_074 possession (Score: 105-93)
FOUL! Shooting foul on Kobe Randle. Yao Randle to the line for 2 free throws. [Team fouls: 3] (Kobe Randle: 2 personal fouls)   FT 1/2: GOOD   FT 2/2: MISS Yao Randle makes 1/2 from the line. FOUL! Loose ball foul on Isaiah Ingram during the free throw rebound! [Team fouls: 4] No free throws, side out. (Isaiah Ingram: 2 personal fouls)
Score: 105-94

================================================================================
                              4TH QUARTER COMPLETE                              
================================================================================

4TH QUARTER SCORE: Team_031 24, Team_074 36

BOX SCORE:
================================================================================

Team_031
--------------------------------------------------------------------------------
Player                MIN  PTS  REB  AST  TO      FG   FG%      3P   3P%
--------------------------------------------------------------------------------
Jimmy Poole            19    7    1    1   0   3/5    60.0     0/0   0.0
Isaiah Ingram          19    5    3    1   0   2/5    40.0     0/0   0.0
Kevin Morant           19    4    0    0   0   2/5    40.0     0/0   0.0
Immanuel James         29    3    0    0   0   1/1   100.0     0/0   0.0
Kobe Randle            19    3    4    1   0   1/3    33.3     0/0   0.0
Pau Irving             29    2    0    1   0   1/1   100.0     0/0   0.0
Shai Durant            29    0    0    1   0   0/0     0.0     0/0   0.0
Miles Stewart          19    0    0    2   0   0/1     0.0     0/0   0.0

TEAM: FG: 10/21 (47.6%), 3PT: 5/10 (50.0%), REB: 8 (2 off, 6 def), AST: 7, TO: 2
TEAM FOULS: 4


Team_074
--------------------------------------------------------------------------------
Player                MIN  PTS  REB  AST  TO      FG   FG%      3P   3P%
--------------------------------------------------------------------------------
Jaren Rozier           19   11    3    0   0   5/7    71.4     0/0   0.0
Giannis Westbrook      19    8    0    1   0   3/4    75.0     0/0   0.0
Yao Randle             19    5    6    1   0   2/3    66.7     0/0   0.0
Shai Green             29    3    0    1   0   1/1   100.0     0/0   0.0
Chris Carter           29    3    0    0   0   1/1   100.0     0/0   0.0
Ayo Smith              19    3    5    2   0   1/3    33.3     0/0   0.0
James Barnes           19    2    0    3   0   1/1   100.0     0/0   0.0
Dwyane Quickley        29    0    0    1   0   0/0     0.0     0/0   0.0

TEAM: FG: 14/20 (70.0%), 3PT: 5/7 (71.4%), REB: 14 (3 off, 11 def), AST: 9, TO: 2
TEAM FOULS: 3

================================================================================

================================================================================
                               FULL GAME COMPLETE                               
================================================================================

FINAL SCORE: Team_031 105, Team_074 94

SCORING BY QUARTER:
--------------------------------------------------------------------------------
Team                     Q1     Q2     Q3     Q4    FINAL
--------------------------------------------------------------------------------
Team_031                 28     24     29     24      105
Team_074                 24     18     16     36       94
--------------------------------------------------------------------------------

FULL GAME BOX SCORE:
================================================================================

Team_031
--------------------------------------------------------------------------------
Player                MIN  PTS  REB  AST  TO      FG   FG%      3P   3P%      FT STL BLK
--------------------------------------------------------------------------------
Shai Durant            29   10    0    5   1   5/11   45.5   4/8    50.0   0/0     0   0
Gary Morant            29    8   10    3   1   3/8    37.5   2/6    33.3   0/0     0   2
Pau Irving             29   20    0    1   1   9/10   90.0   2/2   100.0   5/5     0   0
Immanuel James         29   22   12    0   1   8/9    88.9   4/4   100.0   0/1     2   3
Luka Sabonis           29   14   10    9   1   6/13   46.2   1/1   100.0   1/2     0   0
Kevin Morant           19    6    0    2   1   3/8    37.5   0/3     0.0   2/2     0   0
Isaiah Ingram          19    5    5    1   1   2/6    33.3   1/3    33.3   0/0     0   0
Miles Stewart          19    3    0    2   1   1/3    33.3   1/3    33.3   0/0     0   0
Kobe Randle            19    8    6    1   0   3/7    42.9   2/3    66.7   0/0     0   0
Jimmy Poole            19    7    4    1   1   3/7    42.9   2/3    66.7   1/2     1   0

TEAM: FG: 43/82 (52.4%), 3PT: 19/36 (52.8%), REB: 47 (12 off, 35 def), AST: 25, TO: 9


Team_074
--------------------------------------------------------------------------------
Player                MIN  PTS  REB  AST  TO      FG   FG%      3P   3P%      FT STL BLK
--------------------------------------------------------------------------------
Dwyane Quickley        29   10    0    5   1   4/7    57.1   1/3    33.3   1/1     0   0
Chris Carter           29    6    0    2   2   3/4    75.0   2/2   100.0   0/0     0   1
Shai Green             29   11    8    5   1   4/8    50.0   3/4    75.0   2/2     0   0
Donovan Doncic         29    8    5    1   2   3/14   21.4   2/4    50.0   0/0     0   1
James Turner           29   12    8    2   1   5/12   41.7   0/1     0.0   0/0     0   0
James Barnes           19    5    0    3   1   2/2   100.0   0/0     0.0   1/1     0   0
Giannis Westbrook      19   13    0    3   0   5/7    71.4   2/3    66.7   1/1     0   0
Ayo Smith              19    5    5    2   0   3/7    42.9   1/1   100.0   0/0     0   0
Yao Randle             19    8   14    2   0   4/5    80.0   0/1     0.0   3/5     0   0
Jaren Rozier           19   15    3    0   3   6/10   60.0   0/1     0.0   1/1     1   0

TEAM: FG: 39/76 (51.3%), 3PT: 11/20 (55.0%), REB: 43 (5 off, 38 def), AST: 25, TO: 11

================================================================================
