================================================================================
                        FULL GAME - Team_061 vs Team_044                        
================================================================================

================================================================================
                       1ST QUARTER - Team_061 vs Team_044                       
================================================================================

[12:00] Team_061 possession (Score: 0-0)
FOUL! Offensive foul on Jayson Holiday! Isaiah Murray drew the charge! [Team fouls: 1] (Jayson Holiday: 1 personal fouls) TURNOVER! (dead ball)

[11:50] Team_044 possession (Score: 0-0)
FOUL! Holding foul on Brandon Russell. [Team fouls: 2] No free throws, side out. (Brandon Russell: 1 personal fouls)

[11:34] Team_044 possession (Score: 0-0)
Zach McGrady attempts a Midrange. Contested by Brandon Russell (4.1 feet, MAN). Zach McGrady misses. Rebound secured by Bam Sexton.

[11:18] Team_061 possession (Score: 0-0)
Bam Sexton drives, Karl Fox stays with him. Bam Sexton attempts a Dunk. Contested by Karl Fox (4.9 feet, MAN). Bam Sexton misses. Rebound secured by Victor Westbrook.

[11:02] Team_044 possession (Score: 0-0)
FOUL! Shooting foul on Bam Sexton. Karl Fox to the line for 2 free throws. [Team fouls: 3] (Bam Sexton: 1 personal fouls)   FT 1/2: GOOD   FT 2/2: GOOD Karl Fox makes 2/2 from the line.
Score: 0-2

[10:49] Team_061 possession (Score: 0-2)
Brandon Russell attempts a 3Pt. Contested by Isaiah Murray (5.2 feet, ZONE). BRANDON RUSSELL MAKES IT! Assist: Bam Sexton
Score: 3-2

[10:34] Team_044 possession (Score: 3-2)
Zach McGrady drives and kicks out. Karl Fox attempts a 3Pt. Contested by Michael Russell (3.0 feet, ZONE). Karl Fox misses. Rebound secured by Michael Russell.

[10:24] Team_061 possession (Score: 3-2)
Draymond Banchero attempts a Midrange. Wide open! Ayo McCollum is 6.9 feet away. [MAN] Draymond Banchero misses. Rebound secured by Karl Fox.

[10:08] Team_044 possession (Score: 3-2)
Karl Fox loses control! Ball rolls out of bounds! TURNOVER! (dead ball)

[09:52] Team_061 possession (Score: 3-2)
Bam Sexton attempts a 3Pt. Contested by Isaiah Murray (4.8 feet, ZONE). Bam Sexton misses. FOUL! Loose ball foul on Victor Westbrook during the rebound battle. [Team fouls: 1] No free throws, side out. (Victor Westbrook: 1 personal fouls)

[09:40] Team_061 possession (Score: 3-2)
Jayson Holiday attempts a 3Pt. Wide open! Isaiah Murray is 8.1 feet away. [MAN] Jayson Holiday misses. Rebound secured by Victor Westbrook.

[09:29] Team_044 possession (Score: 3-2)
Isaiah Murray attempts a 3Pt. Wide open! Bam Sexton is 6.8 feet away. [ZONE] Isaiah Murray misses. Rebound secured by Bam Sexton.

[09:16] Team_061 possession (Score: 3-2)
Jayson Holiday attempts a 3Pt. Contested by Isaiah Murray (5.3 feet, ZONE). Jayson Holiday misses. Rebound secured by Karl Fox.

[09:04] Team_044 possession (Score: 3-2)
FOUL! Shooting foul on Jayson Holiday. Karl Fox to the line for 2 free throws. [Team fouls: 4] (Jayson Holiday: 2 personal fouls)   FT 1/2: GOOD   FT 2/2: GOOD Karl Fox makes 2/2 from the line.
Score: 3-4

[08:49] Team_061 possession (Score: 3-4)
Draymond Banchero makes the Midrange and draws the foul on Ayo McCollum! And-1! Draymond Banchero to the line for 1. [Team fouls: 2] (Ayo McCollum: 1 personal fouls)   FT 1/1: GOOD Draymond Banchero makes 1/1 from the line.
Score: 6-4

[08:35] Team_044 possession (Score: 6-4)
Isaiah Murray attempts a 3Pt. Wide open! Jayson Holiday is 7.9 feet away. [MAN] Isaiah Murray misses. Rebound secured by Michael Russell.

[08:17] Team_061 possession (Score: 6-4)
Bam Sexton throws a bad pass! Stolen by Karl Fox! TURNOVER! (live ball)

[08:03] Team_044 possession (Score: 6-4)
Victor Westbrook drives, Michael Russell stays with him. Victor Westbrook attempts a Layup. Heavily contested by Michael Russell (1.0 feet, MAN)! VICTOR WESTBROOK MAKES IT! Assist: Karl Fox
Score: 6-6

[07:46] Team_061 possession (Score: 6-6)
Michael Russell attempts a 3Pt. Wide open! Zach McGrady is 6.1 feet away. [ZONE] MICHAEL RUSSELL MAKES IT! Assist: Jayson Holiday
Score: 9-6

[07:27] Team_044 possession (Score: 9-6)
Victor Westbrook makes the Layup and draws the foul on Michael Russell! And-1! Victor Westbrook to the line for 1. [BONUS: 5 team fouls] (Michael Russell: 1 personal fouls)   FT 1/1: GOOD Victor Westbrook makes 1/1 from the line.
Score: 9-9

[07:16] Team_061 possession (Score: 9-9)
FOUL! Shooting foul on Victor Westbrook. Michael Russell to the line for 2 free throws. [Team fouls: 3] (Victor Westbrook: 2 personal fouls)   FT 1/2: GOOD   FT 2/2: GOOD Michael Russell makes 2/2 from the line.
Score: 11-9

[06:57] Team_044 possession (Score: 11-9)
Isaiah Murray attempts a 3Pt. Wide open! Brandon Russell is 6.6 feet away. [ZONE] Isaiah Murray misses. Rebound secured by Draymond Banchero.

[06:43] Team_061 possession (Score: 11-9)
Michael Russell attempts a 3Pt. Wide open! Isaiah Murray is 6.1 feet away. [ZONE] MICHAEL RUSSELL MAKES IT! Assist: Brandon Russell
Score: 14-9

[06:26] Team_044 possession (Score: 14-9)
Victor Westbrook attempts a Midrange. Contested by Jayson Holiday (5.1 feet, ZONE). Victor Westbrook misses. Rebound secured by Draymond Banchero.

[06:09] Team_061 possession (Score: 14-9)
Bam Sexton attempts a 3Pt. Contested by Isaiah Murray (5.5 feet, ZONE). Bam Sexton misses. Rebound secured by Ayo McCollum.

[05:54] Team_044 possession (Score: 14-9)
Victor Westbrook commits a violation (traveling/carry)! TURNOVER! (dead ball)

[05:42] Team_061 possession (Score: 14-9)
Michael Russell attempts a Midrange. Contested by Victor Westbrook (5.1 feet, MAN). Michael Russell misses. Rebound secured by Ayo McCollum.

[05:29] Team_044 possession (Score: 14-9)
Victor Westbrook drives, picks up Draymond Banchero. Help arrives from Jayson Holiday! Victor Westbrook attempts a Layup. Heavily contested by Jayson Holiday (0.5 feet, ZONE)! Victor Westbrook misses. Rebound secured by Michael Russell.

[05:11] Team_061 possession (Score: 14-9)
Brandon Russell attempts a 3Pt. Contested by Zach McGrady (4.9 feet, MAN). BRANDON RUSSELL MAKES IT! Assist: Draymond Banchero
Score: 17-9

[04:57] Team_044 possession (Score: 17-9)
Karl Fox drives, Draymond Banchero stays with him. Karl Fox attempts a Layup. Contested by Draymond Banchero (3.0 feet, ZONE). Karl Fox misses. Rebound secured by Bam Sexton.

[04:39] Team_061 possession (Score: 17-9)
FOUL! Offensive foul on Brandon Russell! Zach McGrady drew the charge! [Team fouls: 6] (Brandon Russell: 2 personal fouls) TURNOVER! (dead ball)

[04:28] Team_044 possession (Score: 17-9)
Zach McGrady commits a violation (traveling/carry)! TURNOVER! (dead ball)

[04:11] Team_061 possession (Score: 17-9)
Michael Russell attempts a Midrange. Wide open! Victor Westbrook is 7.7 feet away. [MAN] MICHAEL RUSSELL MAKES IT! Assist: Bam Sexton
Score: 19-9

[03:59] Team_044 possession (Score: 19-9)
Isaiah Murray throws a bad pass! Stolen by Jayson Holiday! TURNOVER! (live ball)

[03:47] Team_061 possession (Score: 19-9)
Draymond Banchero attempts a Midrange. Wide open! Isaiah Murray is 6.7 feet away. [ZONE] DRAYMOND BANCHERO MAKES IT!
Score: 21-9

[03:34] Team_044 possession (Score: 21-9)
Karl Fox attempts a Midrange. Wide open! Michael Russell is 6.8 feet away. [ZONE] Karl Fox misses. Rebound secured by Draymond Banchero.

[03:24] Team_061 possession (Score: 21-9)
Bam Sexton attempts a Midrange. Contested by Karl Fox (2.9 feet, MAN). Bam Sexton misses. Offensive rebound by Draymond Banchero! Draymond Banchero puts it back in!
Score: 23-9

[03:12] Team_044 possession (Score: 23-9)
FOUL! Shooting foul on Brandon Russell. Victor Westbrook to the line for 3 free throws. [BONUS: 7 team fouls] (Brandon Russell: 3 personal fouls)   FT 1/3: GOOD   FT 2/3: MISS   FT 3/3: GOOD Victor Westbrook makes 2/3 from the line.
Score: 23-11

[03:02] Team_061 possession (Score: 23-11)
Bam Sexton drives and kicks out. Bam Sexton attempts a 3Pt. BLOCKED BY KARL FOX! Ball is loose! Rebound secured by Victor Westbrook.

[02:45] Team_044 possession (Score: 23-11)
Zach McGrady attempts a 3Pt. Contested by Brandon Russell (3.0 feet, MAN). ZACH MCGRADY MAKES IT! Assist: Karl Fox
Score: 23-14

[02:31] Team_061 possession (Score: 23-14)
Draymond Banchero makes the Layup and draws the foul on Ayo McCollum! And-1! Draymond Banchero to the line for 1. [Team fouls: 4] (Ayo McCollum: 2 personal fouls)   FT 1/1: GOOD Draymond Banchero makes 1/1 from the line.
Score: 26-14

[02:17] Team_044 possession (Score: 26-14)
FOUL! Shooting foul on Michael Russell. Victor Westbrook to the line for 2 free throws. [BONUS: 8 team fouls] (Michael Russell: 2 personal fouls)   FT 1/2: GOOD   FT 2/2: MISS Victor Westbrook makes 1/2 from the line. Rebound secured by Michael Russell.
Score: 26-15

[01:59] Team_061 possession (Score: 26-15)
Brandon Russell drives and kicks out. Draymond Banchero attempts a Midrange. Contested by Zach McGrady (2.4 feet, ZONE). DRAYMOND BANCHERO MAKES IT!
Score: 28-15

[01:42] Team_044 possession (Score: 28-15)
Victor Westbrook attempts a 3Pt. Wide open! Michael Russell is 7.2 feet away. [MAN] VICTOR WESTBROOK MAKES IT! Assist: Isaiah Murray
Score: 28-18

[01:26] Team_061 possession (Score: 28-18)
Draymond Banchero attempts a Midrange. Wide open! Victor Westbrook is 6.6 feet away. [ZONE] Draymond Banchero misses. Rebound secured by Victor Westbrook.

[01:08] Team_044 possession (Score: 28-18)
Ayo McCollum attempts a Midrange. Contested by Michael Russell (5.6 feet, ZONE). AYO MCCOLLUM MAKES IT! Assist: Victor Westbrook
Score: 28-20

[00:54] Team_061 possession (Score: 28-20)
Bam Sexton drives and kicks out. Jayson Holiday attempts a Midrange. Wide open! Isaiah Murray is 7.3 feet away. [MAN] JAYSON HOLIDAY MAKES IT!
Score: 30-20

[00:44] Team_044 possession (Score: 30-20)
Ayo McCollum attempts a Midrange. Contested by Jayson Holiday (5.1 feet, ZONE). AYO MCCOLLUM MAKES IT!
Score: 30-22

[00:29] Team_061 possession (Score: 30-22)
Bam Sexton attempts a 3Pt. Wide open! Victor Westbrook is 8.5 feet away. [ZONE] BAM SEXTON MAKES IT! Assist: Michael Russell
Score: 33-22

[00:15] Team_044 possession (Score: 33-22)
Isaiah Murray drives to the basket... Isaiah Murray loses control! Ball rolls out of bounds! TURNOVER! (dead ball)

[00:15] Substitution (Team_061): Brandon Russell OUT → Evan Rose IN (stamina_rule2)

[00:15] Substitution (Team_061): Jayson Holiday OUT → Gary Fox IN (stamina_rule2)

[00:15] Substitution (Team_061): Michael Russell OUT → Desmond Morant IN (stamina_rule2)

[00:15] Substitution (Team_061): Bam Sexton OUT → Stephen Towns IN (stamina_rule2)

[00:15] Substitution (Team_061): Draymond Banchero OUT → Tim Durant IN (stamina_rule2)

[00:15] Substitution (Team_044): Zach McGrady OUT → Kyrie Poole IN (stamina_rule2)

[00:15] Substitution (Team_044): Isaiah Murray OUT → Tim Towns IN (stamina_rule2)

[00:15] Substitution (Team_044): Victor Westbrook OUT → Tim Siakam IN (stamina_rule2)

[00:15] Substitution (Team_044): Karl Fox OUT → Pau Quickley IN (stamina_rule2)

[00:15] Substitution (Team_044): Ayo McCollum OUT → Victor Anthony IN (stamina_rule2)

[00:03] Team_061 possession (Score: 33-22)
Desmond Morant attempts a 3Pt. Wide open! Tim Siakam is 7.1 feet away. [MAN] DESMOND MORANT MAKES IT! Assist: Stephen Towns
Score: 36-22

================================================================================
                              1ST QUARTER COMPLETE                              
================================================================================

1ST QUARTER SCORE: Team_061 36, Team_044 22

BOX SCORE:
================================================================================

Team_061
--------------------------------------------------------------------------------
Player                MIN  PTS  REB  AST  TO      FG   FG%      3P   3P%
--------------------------------------------------------------------------------
Draymond Banchero      12   12    4    1   0   5/7    71.4     0/0   0.0
Michael Russell        12   10    5    1   0   4/5    80.0     0/0   0.0
Brandon Russell        12    6    0    1   0   2/2   100.0     0/0   0.0
Bam Sexton             12    3    3    2   0   1/4    25.0     0/0   0.0
Desmond Morant          0    3    0    0   0   1/1   100.0     0/0   0.0
Jayson Holiday         12    2    0    1   0   1/3    33.3     0/0   0.0
Stephen Towns           0    0    0    1   0   0/0     0.0     0/0   0.0

TEAM: FG: 14/22 (63.6%), 3PT: 6/9 (66.7%), REB: 12 (2 off, 10 def), AST: 7, TO: 3
TEAM FOULS: 8 [Team_044 in BONUS]


Team_044
--------------------------------------------------------------------------------
Player                MIN  PTS  REB  AST  TO      FG   FG%      3P   3P%
--------------------------------------------------------------------------------
Victor Westbrook       12   10    4    1   0   4/7    57.1     0/0   0.0
Karl Fox               12    4    2    2   0   2/4    50.0     0/0   0.0
Ayo McCollum           12    4    2    0   0   2/2   100.0     0/0   0.0
Zach McGrady           12    3    0    0   0   1/3    33.3     0/0   0.0
Isaiah Murray          12    0    0    1   0   0/3     0.0     0/0   0.0

TEAM: FG: 9/19 (47.4%), 3PT: 3/6 (50.0%), REB: 8 (0 off, 8 def), AST: 4, TO: 5
TEAM FOULS: 4

================================================================================

================================================================================
                       2ND QUARTER - Team_061 vs Team_044                       
================================================================================

[12:00] Team_061 possession (Score: 36-22)
Brandon Russell drives and kicks out. Draymond Banchero attempts a 3Pt. Contested by Ayo McCollum (4.3 feet, MAN). DRAYMOND BANCHERO MAKES IT! Assist: Brandon Russell
Score: 39-22

[11:43] Team_044 possession (Score: 39-22)
Isaiah Murray drives to the basket... Isaiah Murray loses the ball! Stripped by Jayson Holiday! TURNOVER! (live ball)

[11:26] Team_061 possession (Score: 39-22)
Brandon Russell attempts a Midrange. Contested by Isaiah Murray (5.3 feet, ZONE). Brandon Russell misses. Rebound secured by Ayo McCollum.

[11:11] Team_044 possession (Score: 39-22)
FOUL! Shooting foul on Bam Sexton. Karl Fox to the line for 2 free throws. [Team fouls: 1] (Bam Sexton: 1 personal fouls)   FT 1/2: MISS   FT 2/2: MISS Karl Fox makes 0/2 from the line. Offensive rebound by Ayo McCollum! Ayo McCollum kicks it out.

[10:53] Team_044 possession (Score: 39-22)
Isaiah Murray attempts a 3Pt. Contested by Jayson Holiday (3.6 feet, MAN). Isaiah Murray misses. Offensive rebound by Victor Westbrook! Victor Westbrook kicks it out.

[10:38] Team_044 possession (Score: 39-22)
Isaiah Murray drives, picks up Bam Sexton. Help arrives from Jayson Holiday! Isaiah Murray attempts a Dunk. Wide open! Jayson Holiday is 6.1 feet away. [ZONE] Isaiah Murray misses. Rebound secured by Michael Russell.

[10:25] Team_061 possession (Score: 39-22)
Michael Russell drives and kicks out. Jayson Holiday attempts a 3Pt. Wide open! Isaiah Murray is 8.0 feet away. [MAN] Jayson Holiday misses. Rebound secured by Victor Westbrook.

[10:06] Team_044 possession (Score: 39-22)
FOUL! Reach-in foul on Michael Russell during the drive. [Team fouls: 2] No free throws, side out. (Michael Russell: 1 personal fouls)

[09:53] Team_044 possession (Score: 39-22)
Karl Fox attempts a 3Pt. Contested by Bam Sexton (3.6 feet, MAN). Karl Fox misses. Rebound secured by Michael Russell.

[09:39] Team_061 possession (Score: 39-22)
Michael Russell makes the Layup and draws the foul on Victor Westbrook! And-1! Michael Russell to the line for 1. [Team fouls: 1] (Victor Westbrook: 1 personal fouls)   FT 1/1: GOOD Michael Russell makes 1/1 from the line.
Score: 42-22

[09:25] Team_044 possession (Score: 42-22)
Zach McGrady attempts a 3Pt. Contested by Brandon Russell (2.8 feet, MAN). Zach McGrady misses. Rebound secured by Draymond Banchero.

[09:10] Team_061 possession (Score: 42-22)
Jayson Holiday attempts a Midrange. Wide open! Karl Fox is 6.9 feet away. [ZONE] JAYSON HOLIDAY MAKES IT! Assist: Brandon Russell
Score: 44-22

[08:56] Team_044 possession (Score: 44-22)
Zach McGrady attempts a 3Pt. Wide open! Brandon Russell is 6.7 feet away. [ZONE] ZACH MCGRADY MAKES IT! Assist: Victor Westbrook
Score: 44-25

[08:40] Team_061 possession (Score: 44-25)
Jayson Holiday attempts a 3Pt. Contested by Isaiah Murray (5.3 feet, MAN). Jayson Holiday misses. Rebound secured by Victor Westbrook.

[08:25] Team_044 possession (Score: 44-25)
Zach McGrady makes the Midrange and draws the foul on Michael Russell! And-1! Zach McGrady to the line for 1. [Team fouls: 3] (Michael Russell: 2 personal fouls)   FT 1/1: GOOD Zach McGrady makes 1/1 from the line.
Score: 44-28

[08:11] Team_061 possession (Score: 44-28)
Jayson Holiday commits a violation (traveling/carry)! TURNOVER! (dead ball)

[08:11] Substitution (Team_061): Brandon Russell OUT → Evan Rose IN (stamina_rule2)

[08:11] Substitution (Team_061): Jayson Holiday OUT → Gary Fox IN (stamina_rule2)

[08:11] Substitution (Team_061): Michael Russell OUT → Desmond Morant IN (stamina_rule2)

[08:11] Substitution (Team_061): Bam Sexton OUT → Stephen Towns IN (stamina_rule2)

[08:11] Substitution (Team_061): Draymond Banchero OUT → Tim Durant IN (stamina_rule2)

[08:11] Substitution (Team_044): Zach McGrady OUT → Kyrie Poole IN (stamina_rule2)

[08:11] Substitution (Team_044): Isaiah Murray OUT → Tim Towns IN (stamina_rule2)

[08:11] Substitution (Team_044): Victor Westbrook OUT → Tim Siakam IN (stamina_rule2)

[08:11] Substitution (Team_044): Karl Fox OUT → Pau Quickley IN (stamina_rule2)

[08:11] Substitution (Team_044): Ayo McCollum OUT → Victor Anthony IN (stamina_rule2)

[07:56] Team_044 possession (Score: 44-28)
Tim Siakam attempts a 3Pt. Contested by Desmond Morant (5.8 feet, ZONE). Tim Siakam misses. Rebound secured by Desmond Morant.

[07:38] Team_061 possession (Score: 44-28)
Desmond Morant attempts a 3Pt. Wide open! Tim Siakam is 9.3 feet away. [ZONE] DESMOND MORANT MAKES IT! Assist: Gary Fox
Score: 47-28

[07:23] Team_044 possession (Score: 47-28)
FOUL! Reach-in foul on Stephen Towns during the drive. [Team fouls: 4] No free throws, side out. (Stephen Towns: 1 personal fouls)

[07:06] Team_044 possession (Score: 47-28)
Kyrie Poole attempts a Midrange. Contested by Evan Rose (4.7 feet, ZONE). KYRIE POOLE MAKES IT! Assist: Tim Siakam
Score: 47-30

[06:54] Team_061 possession (Score: 47-30)
Desmond Morant attempts a 3Pt. Contested by Tim Siakam (2.7 feet, MAN). Desmond Morant misses. Rebound secured by Pau Quickley.

[06:41] Team_044 possession (Score: 47-30)
Victor Anthony drives, Stephen Towns stays with him. Victor Anthony attempts a Dunk. Contested by Stephen Towns (2.7 feet, ZONE). Victor Anthony misses. Rebound secured by Stephen Towns.

[06:23] Team_061 possession (Score: 47-30)
Tim Durant attempts a Midrange. Contested by Tim Siakam (5.4 feet, ZONE). Tim Durant misses. Rebound secured by Victor Anthony.

[06:09] Team_044 possession (Score: 47-30)
Pau Quickley attempts a Layup. BLOCKED BY STEPHEN TOWNS! Ball is loose! Rebound secured by Stephen Towns.

[05:52] Team_061 possession (Score: 47-30)
Desmond Morant attempts a 3Pt. Wide open! Tim Siakam is 6.7 feet away. [MAN] Desmond Morant misses. Rebound secured by Tim Siakam.

[05:42] Team_044 possession (Score: 47-30)
Kyrie Poole attempts a Midrange. Contested by Evan Rose (5.8 feet, MAN). KYRIE POOLE MAKES IT!
Score: 47-32

[05:25] Team_061 possession (Score: 47-32)
FOUL! Reach-in foul on Pau Quickley during the drive. [Team fouls: 2] No free throws, side out. (Pau Quickley: 1 personal fouls)

[05:13] Team_061 possession (Score: 47-32)
Stephen Towns drives to the basket... Stephen Towns throws a bad pass! Stolen by Pau Quickley! TURNOVER! (live ball)

[04:55] Team_044 possession (Score: 47-32)
Pau Quickley attempts a Layup. Wide open! Tim Durant is 7.7 feet away. [ZONE] PAU QUICKLEY MAKES IT! Assist: Victor Anthony
Score: 47-34

[04:42] Team_061 possession (Score: 47-34)
Tim Durant attempts a Layup. BLOCKED BY PAU QUICKLEY! Ball is loose! Rebound secured by Victor Anthony.

[04:29] Team_044 possession (Score: 47-34)
Pau Quickley attempts a Midrange. Wide open! Evan Rose is 6.1 feet away. [ZONE] PAU QUICKLEY MAKES IT!
Score: 47-36

[04:16] Team_061 possession (Score: 47-36)
Evan Rose attempts a 3Pt. Heavily contested by Tim Siakam (0.8 feet, ZONE)! Evan Rose misses. Rebound secured by Pau Quickley.

[04:02] Team_044 possession (Score: 47-36)
Tim Towns drives and kicks out. Tim Siakam attempts a 3Pt. Wide open! Evan Rose is 7.5 feet away. [ZONE] TIM SIAKAM MAKES IT! Assist: Tim Towns
Score: 47-39

[03:46] Team_061 possession (Score: 47-39)
Stephen Towns attempts a 3Pt. Heavily contested by Pau Quickley (1.7 feet, ZONE)! Stephen Towns misses. Rebound secured by Tim Siakam.

[03:28] Team_044 possession (Score: 47-39)
Pau Quickley attempts a Midrange. Wide open! Stephen Towns is 10.0 feet away. [MAN] Pau Quickley misses. Rebound secured by Tim Durant.

[03:11] Team_061 possession (Score: 47-39)
FOUL! Reach-in foul on Pau Quickley during the drive. [Team fouls: 3] No free throws, side out. (Pau Quickley: 2 personal fouls)

[02:57] Team_061 possession (Score: 47-39)
Tim Durant attempts a Layup. BLOCKED BY VICTOR ANTHONY! Ball deflects out of bounds off Tim Durant.

[02:40] Team_044 possession (Score: 47-39)
Kyrie Poole loses control! Ball rolls out of bounds! TURNOVER! (dead ball)

[02:28] Team_061 possession (Score: 47-39)
Desmond Morant attempts a 3Pt. Contested by Tim Siakam (5.4 feet, MAN). Desmond Morant misses. Rebound secured by Victor Anthony.

[02:17] Team_044 possession (Score: 47-39)
Tim Siakam attempts a 3Pt. Wide open! Desmond Morant is 7.6 feet away. [ZONE] TIM SIAKAM MAKES IT! Assist: Pau Quickley
Score: 47-42

[02:01] Team_061 possession (Score: 47-42)
Stephen Towns attempts a Midrange. Wide open! Tim Towns is 7.5 feet away. [ZONE] Stephen Towns misses. Rebound secured by Victor Anthony.

[01:45] Team_044 possession (Score: 47-42)
Kyrie Poole attempts a 3Pt. Wide open! Evan Rose is 6.9 feet away. [MAN] Kyrie Poole misses. Rebound secured by Stephen Towns.

[01:30] Team_061 possession (Score: 47-42)
Gary Fox attempts a Midrange. Contested by Pau Quickley (4.0 feet, ZONE). Gary Fox misses. Rebound secured by Victor Anthony.

[01:14] Team_044 possession (Score: 47-42)
Victor Anthony attempts a Layup. Contested by Tim Durant (3.0 feet, MAN). Victor Anthony misses. Rebound secured by Stephen Towns.

[01:02] Team_061 possession (Score: 47-42)
Stephen Towns attempts a 3Pt. Contested by Pau Quickley (4.1 feet, MAN). Stephen Towns misses. Rebound secured by Victor Anthony.

[00:47] Team_044 possession (Score: 47-42)
FOUL! Reach-in foul on Tim Durant during the drive. [IN THE BONUS! 5 team fouls] Pau Quickley to the line for 2 free throws. (Tim Durant: 1 personal fouls)   FT 1/2: GOOD   FT 2/2: MISS Pau Quickley makes 1/2 from the line. Rebound secured by Tim Durant.
Score: 47-43

[00:36] Team_061 possession (Score: 47-43)
Stephen Towns throws a bad pass! Stolen by Pau Quickley! TURNOVER! (live ball)

[00:22] Team_044 possession (Score: 47-43)
FOUL! Reach-in foul on Tim Durant during the drive. [IN THE BONUS! 6 team fouls] Tim Towns to the line for 2 free throws. (Tim Durant: 2 personal fouls)   FT 1/2: GOOD   FT 2/2: GOOD Tim Towns makes 2/2 from the line.
Score: 47-45

[00:06] Team_061 possession (Score: 47-45)
FOUL! Reach-in foul on Victor Anthony during the drive. [Team fouls: 4] No free throws, side out. (Victor Anthony: 1 personal fouls)

================================================================================
                              2ND QUARTER COMPLETE                              
================================================================================

2ND QUARTER SCORE: Team_061 11, Team_044 23

BOX SCORE:
================================================================================

Team_061
--------------------------------------------------------------------------------
Player                MIN  PTS  REB  AST  TO      FG   FG%      3P   3P%
--------------------------------------------------------------------------------
Draymond Banchero      16    3    1    0   0   1/1   100.0     0/0   0.0
Michael Russell        16    3    2    0   0   1/2    50.0     0/0   0.0
Desmond Morant          8    3    1    0   0   1/4    25.0     0/0   0.0
Jayson Holiday         16    2    0    0   0   1/2    50.0     0/0   0.0
Brandon Russell        16    0    0    2   0   0/1     0.0     0/0   0.0
Gary Fox                8    0    0    1   0   0/1     0.0     0/0   0.0
Stephen Towns           8    0    4    0   0   0/3     0.0     0/0   0.0
Tim Durant              8    0    2    0   0   0/3     0.0     0/0   0.0
Evan Rose               8    0    0    0   0   0/1     0.0     0/0   0.0

TEAM: FG: 4/18 (22.2%), 3PT: 1/8 (12.5%), REB: 10 (0 off, 10 def), AST: 3, TO: 3
TEAM FOULS: 6 [Team_044 in BONUS]


Team_044
--------------------------------------------------------------------------------
Player                MIN  PTS  REB  AST  TO      FG   FG%      3P   3P%
--------------------------------------------------------------------------------
Zach McGrady           16    6    0    0   0   2/3    66.7     0/0   0.0
Tim Siakam              8    6    2    1   0   2/3    66.7     0/0   0.0
Kyrie Poole             8    4    0    0   0   2/3    66.7     0/0   0.0
Pau Quickley            8    4    2    1   0   2/5    40.0     0/0   0.0
Tim Towns               8    2    0    1   0   1/1   100.0     0/0   0.0
Ayo McCollum           16    0    2    0   0   0/0     0.0     0/0   0.0
Victor Westbrook       16    0    3    1   0   0/0     0.0     0/0   0.0
Isaiah Murray          16    0    0    0   0   0/1     0.0     0/0   0.0
Karl Fox               16    0    0    0   0   0/1     0.0     0/0   0.0
Victor Anthony          8    0    6    1   0   0/2     0.0     0/0   0.0

TEAM: FG: 9/19 (47.4%), 3PT: 2/6 (33.3%), REB: 15 (2 off, 13 def), AST: 5, TO: 2
TEAM FOULS: 4

================================================================================

================================================================================
                       3RD QUARTER - Team_061 vs Team_044                       
================================================================================

[12:00] Team_061 possession (Score: 47-45)
Jayson Holiday attempts a Layup. Wide open! Isaiah Murray is 7.9 feet away. [MAN] JAYSON HOLIDAY MAKES IT!
Score: 49-45

[11:44] Team_044 possession (Score: 49-45)
Zach McGrady attempts a 3Pt. Contested by Brandon Russell (4.1 feet, ZONE). ZACH MCGRADY MAKES IT! Assist: Isaiah Murray
Score: 49-48

[11:33] Team_061 possession (Score: 49-48)
Brandon Russell throws a bad pass out of bounds! TURNOVER! (dead ball)

[11:16] Team_044 possession (Score: 49-48)
Karl Fox drives and kicks out. Karl Fox attempts a Midrange. Contested by Bam Sexton (5.3 feet, MAN). KARL FOX MAKES IT!
Score: 49-50

[11:00] Team_061 possession (Score: 49-50)
Draymond Banchero attempts a 3Pt. Contested by Ayo McCollum (5.7 feet, MAN). Draymond Banchero misses. Rebound secured by Ayo McCollum.

[10:44] Team_044 possession (Score: 49-50)
Ayo McCollum makes the Dunk and draws the foul on Jayson Holiday! And-1! Ayo McCollum to the line for 1. [Team fouls: 1] (Jayson Holiday: 1 personal fouls)   FT 1/1: MISS Ayo McCollum makes 0/1 from the line. Rebound secured by Bam Sexton.
Score: 49-52

[10:29] Team_061 possession (Score: 49-52)
Michael Russell makes the Layup and draws the foul on Victor Westbrook! And-1! Michael Russell to the line for 1. [Team fouls: 1] (Victor Westbrook: 1 personal fouls)   FT 1/1: GOOD Michael Russell makes 1/1 from the line.
Score: 52-52

[10:12] Team_044 possession (Score: 52-52)
Karl Fox drives, Bam Sexton stays with him. Karl Fox attempts a Layup. Contested by Bam Sexton (4.2 feet, MAN). KARL FOX MAKES IT!
Score: 52-54

[09:57] Team_061 possession (Score: 52-54)
Brandon Russell attempts a Midrange. Wide open! Victor Westbrook is 7.5 feet away. [ZONE] Brandon Russell misses. Rebound secured by Victor Westbrook.

[09:43] Team_044 possession (Score: 52-54)
Ayo McCollum attempts a Midrange. Contested by Draymond Banchero (3.1 feet, MAN). AYO MCCOLLUM MAKES IT!
Score: 52-56

[09:29] Team_061 possession (Score: 52-56)
Jayson Holiday attempts a 3Pt. Contested by Isaiah Murray (3.5 feet, MAN). JAYSON HOLIDAY MAKES IT! Assist: Michael Russell
Score: 55-56

[09:13] Team_044 possession (Score: 55-56)
Isaiah Murray drives, Draymond Banchero stays with him. Isaiah Murray attempts a Dunk. Heavily contested by Draymond Banchero (1.8 feet, ZONE)! Isaiah Murray misses. Rebound secured by Draymond Banchero.

[08:53] Team_061 possession (Score: 55-56)
Michael Russell attempts a Midrange. Contested by Victor Westbrook (5.5 feet, ZONE). MICHAEL RUSSELL MAKES IT!
Score: 57-56

[08:37] Team_044 possession (Score: 57-56)
Isaiah Murray drives, picks up Jayson Holiday. Help arrives from Michael Russell! Isaiah Murray attempts a Layup. Contested by Michael Russell (5.7 feet, MAN). ISAIAH MURRAY MAKES IT!
Score: 57-58

[08:22] Team_061 possession (Score: 57-58)
Jayson Holiday drives, Ayo McCollum stays with him. Jayson Holiday attempts a Layup. Contested by Ayo McCollum (4.7 feet, ZONE). JAYSON HOLIDAY MAKES IT! Assist: Draymond Banchero
Score: 59-58

[08:04] Team_044 possession (Score: 59-58)
Isaiah Murray attempts a 3Pt. Wide open! Michael Russell is 7.0 feet away. [ZONE] Isaiah Murray misses. Rebound secured by Bam Sexton.

[07:49] Team_061 possession (Score: 59-58)
Bam Sexton attempts a Midrange. Contested by Karl Fox (3.7 feet, MAN). BAM SEXTON MAKES IT!
Score: 61-58

[07:33] Team_044 possession (Score: 61-58)
Isaiah Murray attempts a 3Pt. Heavily contested by Brandon Russell (0.6 feet, ZONE)! Isaiah Murray misses. Rebound secured by Bam Sexton.

[07:17] Team_061 possession (Score: 61-58)
Brandon Russell attempts a Midrange. Contested by Zach McGrady (4.3 feet, ZONE). BRANDON RUSSELL MAKES IT!
Score: 63-58

[07:03] Team_044 possession (Score: 63-58)
Victor Westbrook attempts a Midrange. Contested by Michael Russell (2.6 feet, ZONE). Victor Westbrook misses. Offensive rebound by Ayo McCollum! Ayo McCollum's putback is no good. Offensive rebound by Victor Westbrook! Victor Westbrook kicks it out.

[06:49] Team_044 possession (Score: 63-58)
Karl Fox drives, Bam Sexton stays with him. Karl Fox attempts a Layup. Contested by Bam Sexton (3.8 feet, MAN). Karl Fox misses. Rebound secured by Michael Russell.

[06:38] Team_061 possession (Score: 63-58)
Draymond Banchero drives, Ayo McCollum stays with him. Draymond Banchero attempts a Layup. Heavily contested by Ayo McCollum (1.9 feet, MAN)! DRAYMOND BANCHERO MAKES IT! Assist: Jayson Holiday
Score: 65-58

[06:23] Team_044 possession (Score: 65-58)
Isaiah Murray drives to the basket... FOUL! Offensive foul on Isaiah Murray! Draymond Banchero drew the charge! [Team fouls: 2] (Isaiah Murray: 1 personal fouls) TURNOVER! (dead ball)

[06:10] Team_061 possession (Score: 65-58)
Draymond Banchero drives, Ayo McCollum stays with him. Draymond Banchero attempts a Dunk. Wide open! Ayo McCollum is 6.3 feet away. [ZONE] Draymond Banchero misses. Rebound secured by Ayo McCollum.

[05:56] Team_044 possession (Score: 65-58)
Victor Westbrook attempts a 3Pt. Contested by Michael Russell (4.0 feet, MAN). Victor Westbrook misses. Offensive rebound by Ayo McCollum! Ayo McCollum puts it back in!
Score: 65-60

[05:39] Team_061 possession (Score: 65-60)
Brandon Russell attempts a 3Pt. Contested by Zach McGrady (3.0 feet, MAN). Brandon Russell misses. Rebound secured by Ayo McCollum.

[05:23] Team_044 possession (Score: 65-60)
Victor Westbrook makes the Layup and draws the foul on Draymond Banchero! And-1! Victor Westbrook to the line for 1. [Team fouls: 2] (Draymond Banchero: 1 personal fouls)   FT 1/1: GOOD Victor Westbrook makes 1/1 from the line.
Score: 65-63

[05:04] Team_061 possession (Score: 65-63)
Bam Sexton makes the Dunk and draws the foul on Karl Fox! And-1! Bam Sexton to the line for 1. [Team fouls: 3] (Karl Fox: 1 personal fouls)   FT 1/1: GOOD Bam Sexton makes 1/1 from the line.
Score: 68-63

[04:53] Team_044 possession (Score: 68-63)
Karl Fox attempts a Midrange. Wide open! Bam Sexton is 6.5 feet away. [MAN] KARL FOX MAKES IT!
Score: 68-65

[04:37] Team_061 possession (Score: 68-65)
Michael Russell drives, Victor Westbrook stays with him. Michael Russell attempts a Layup. Contested by Victor Westbrook (3.4 feet, MAN). Michael Russell misses. Rebound secured by Victor Westbrook.

[04:25] Team_044 possession (Score: 68-65)
Zach McGrady attempts a 3Pt. Contested by Brandon Russell (5.5 feet, MAN). Zach McGrady misses. Rebound secured by Bam Sexton.

[04:11] Team_061 possession (Score: 68-65)
Michael Russell attempts a 3Pt. Contested by Isaiah Murray (2.7 feet, ZONE). MICHAEL RUSSELL MAKES IT! Assist: Draymond Banchero
Score: 71-65

[03:55] Team_044 possession (Score: 71-65)
Victor Westbrook drives, picks up Michael Russell. Help arrives from Jayson Holiday! Victor Westbrook attempts a Layup. Contested by Jayson Holiday (5.2 feet, MAN). Victor Westbrook misses. Rebound secured by Bam Sexton.

[03:41] Team_061 possession (Score: 71-65)
Bam Sexton drives, Ayo McCollum stays with him. Bam Sexton attempts a Layup. Contested by Ayo McCollum (3.5 feet, ZONE). BAM SEXTON MAKES IT! Assist: Draymond Banchero
Score: 73-65

[03:29] Team_044 possession (Score: 73-65)
FOUL! Shooting foul on Draymond Banchero. Zach McGrady to the line for 2 free throws. [Team fouls: 3] (Draymond Banchero: 2 personal fouls)   FT 1/2: GOOD   FT 2/2: GOOD Zach McGrady makes 2/2 from the line.
Score: 73-67

[03:12] Team_061 possession (Score: 73-67)
Draymond Banchero makes the Dunk and draws the foul on Zach McGrady! And-1! Draymond Banchero to the line for 1. [Team fouls: 4] (Zach McGrady: 1 personal fouls)   FT 1/1: GOOD Draymond Banchero makes 1/1 from the line.
Score: 76-67

[02:59] Team_044 possession (Score: 76-67)
Ayo McCollum attempts a Midrange. Wide open! Jayson Holiday is 6.9 feet away. [ZONE] AYO MCCOLLUM MAKES IT! Assist: Zach McGrady
Score: 76-69

[02:45] Team_061 possession (Score: 76-69)
Bam Sexton attempts a 3Pt. Contested by Karl Fox (3.0 feet, MAN). Bam Sexton misses. Offensive rebound by Draymond Banchero! Draymond Banchero puts it back in!
Score: 78-69

[02:32] Team_044 possession (Score: 78-69)
Karl Fox loses the ball! Stripped by Bam Sexton! TURNOVER! (live ball)

[02:18] Team_061 possession (Score: 78-69)
Brandon Russell attempts a 3Pt. Contested by Zach McGrady (4.8 feet, MAN). BRANDON RUSSELL MAKES IT! Assist: Bam Sexton
Score: 81-69

[02:02] Team_044 possession (Score: 81-69)
Victor Westbrook attempts a 3Pt. Contested by Brandon Russell (2.1 feet, ZONE). Victor Westbrook misses. Offensive rebound by Ayo McCollum! Ayo McCollum kicks it out.

[01:50] Team_044 possession (Score: 81-69)
Karl Fox throws a bad pass out of bounds! TURNOVER! (dead ball)

[01:50] Substitution (Team_061): Jayson Holiday OUT → Gary Fox IN (stamina_rule2)

[01:50] Substitution (Team_061): Michael Russell OUT → Desmond Morant IN (stamina_rule2)

[01:50] Substitution (Team_044): Zach McGrady OUT → Kyrie Poole IN (stamina_rule2)

[01:50] Substitution (Team_044): Isaiah Murray OUT → Tim Towns IN (stamina_rule2)

[01:50] Substitution (Team_044): Victor Westbrook OUT → Tim Siakam IN (stamina_rule2)

[01:50] Substitution (Team_044): Karl Fox OUT → Pau Quickley IN (stamina_rule2)

[01:50] Substitution (Team_044): Ayo McCollum OUT → Victor Anthony IN (stamina_rule2)

[01:37] Team_061 possession (Score: 81-69)
FOUL! Reach-in foul on Pau Quickley during the drive. [IN THE BONUS! 5 team fouls] Brandon Russell to the line for 2 free throws. (Pau Quickley: 1 personal fouls)   FT 1/2: GOOD   FT 2/2: GOOD Brandon Russell makes 2/2 from the line.
Score: 83-69

[01:19] Team_044 possession (Score: 83-69)
Pau Quickley throws a bad pass! Stolen by Bam Sexton! TURNOVER! (live ball)

[01:06] Team_061 possession (Score: 83-69)
Desmond Morant attempts a Layup. BLOCKED BY PAU QUICKLEY! Ball is loose! Offensive rebound by Draymond Banchero! Draymond Banchero kicks it out.

[00:52] Team_061 possession (Score: 83-69)
Draymond Banchero attempts a Midrange. Contested by Victor Anthony (4.7 feet, MAN). Draymond Banchero misses. Offensive rebound by Draymond Banchero! Draymond Banchero puts it back in!
Score: 85-69

[00:43] Team_044 possession (Score: 85-69)
Pau Quickley drives, picks up Draymond Banchero. Help arrives from Brandon Russell! Pau Quickley attempts a Layup. Heavily contested by Brandon Russell (1.6 feet, ZONE)! PAU QUICKLEY MAKES IT! Assist: Tim Towns
Score: 85-71

[00:33] Team_061 possession (Score: 85-71)
Draymond Banchero attempts a 3Pt. Contested by Victor Anthony (3.0 feet, MAN). DRAYMOND BANCHERO MAKES IT! Assist: Bam Sexton
Score: 88-71

[00:17] Team_044 possession (Score: 88-71)
Tim Towns drives and kicks out. Tim Towns attempts a 3Pt. Contested by Gary Fox (3.9 feet, MAN). Tim Towns misses. Rebound secured by Desmond Morant.

[00:02] Team_061 possession (Score: 88-71)
Gary Fox attempts a 3Pt. Contested by Tim Siakam (4.2 feet, ZONE). Gary Fox misses. Rebound secured by Victor Anthony.

================================================================================
                              3RD QUARTER COMPLETE                              
================================================================================

3RD QUARTER SCORE: Team_061 41, Team_044 26

BOX SCORE:
================================================================================

Team_061
--------------------------------------------------------------------------------
Player                MIN  PTS  REB  AST  TO      FG   FG%      3P   3P%
--------------------------------------------------------------------------------
Draymond Banchero      28   12    4    3   0   5/7    71.4     0/0   0.0
Michael Russell        26    8    1    1   0   3/4    75.0     0/0   0.0
Jayson Holiday         26    7    0    1   0   3/3   100.0     0/0   0.0
Bam Sexton             28    7    5    2   0   3/3   100.0     0/0   0.0
Brandon Russell        28    7    0    0   0   3/5    60.0     0/0   0.0
Desmond Morant         10    0    1    0   0   0/0     0.0     0/0   0.0
Gary Fox               10    0    0    0   0   0/1     0.0     0/0   0.0

TEAM: FG: 17/23 (73.9%), 3PT: 5/8 (62.5%), REB: 11 (3 off, 8 def), AST: 7, TO: 1
TEAM FOULS: 3


Team_044
--------------------------------------------------------------------------------
Player                MIN  PTS  REB  AST  TO      FG   FG%      3P   3P%
--------------------------------------------------------------------------------
Karl Fox               26    6    0    0   0   3/4    75.0     0/0   0.0
Ayo McCollum           26    6    5    0   0   3/4    75.0     0/0   0.0
Zach McGrady           26    5    0    1   0   2/3    66.7     0/0   0.0
Victor Westbrook       26    3    3    0   0   1/2    50.0     0/0   0.0
Isaiah Murray          26    2    0    1   0   1/4    25.0     0/0   0.0
Pau Quickley           10    2    0    0   0   1/1   100.0     0/0   0.0
Tim Towns              10    0    0    1   0   0/1     0.0     0/0   0.0
Victor Anthony         10    0    1    0   0   0/0     0.0     0/0   0.0

TEAM: FG: 11/19 (57.9%), 3PT: 2/5 (40.0%), REB: 9 (3 off, 6 def), AST: 3, TO: 4
TEAM FOULS: 5 [Team_061 in BONUS]

================================================================================

================================================================================
                       4TH QUARTER - Team_061 vs Team_044                       
================================================================================

[12:00] Team_061 possession (Score: 88-71)
Michael Russell drives and kicks out. Draymond Banchero attempts a Midrange. Contested by Isaiah Murray (5.9 feet, ZONE). DRAYMOND BANCHERO MAKES IT!
Score: 90-71

[11:49] Team_044 possession (Score: 90-71)
Isaiah Murray attempts a 3Pt. BLOCKED BY JAYSON HOLIDAY! Ball is loose! Rebound secured by Michael Russell.

[11:39] Team_061 possession (Score: 90-71)
FOUL! Reach-in foul on Ayo McCollum during the drive. [Team fouls: 1] No free throws, side out. (Ayo McCollum: 1 personal fouls)

[11:21] Team_061 possession (Score: 90-71)
FOUL! Shooting foul on Ayo McCollum. Draymond Banchero to the line for 2 free throws. [Team fouls: 2] (Ayo McCollum: 2 personal fouls)   FT 1/2: GOOD   FT 2/2: GOOD Draymond Banchero makes 2/2 from the line.
Score: 92-71

[11:08] Team_044 possession (Score: 92-71)
Isaiah Murray drives to the basket... Isaiah Murray loses the ball! Stripped by Jayson Holiday! TURNOVER! (live ball)

[10:54] Team_061 possession (Score: 92-71)
Brandon Russell attempts a Layup. BLOCKED BY AYO MCCOLLUM! Ball is loose! Rebound secured by Victor Westbrook.

[10:39] Team_044 possession (Score: 92-71)
Victor Westbrook drives to the basket... Victor Westbrook loses control! Ball rolls out of bounds! TURNOVER! (dead ball)

[10:39] Substitution (Team_061): Brandon Russell OUT → Evan Rose IN (stamina_rule2)

[10:39] Substitution (Team_061): Bam Sexton OUT → Stephen Towns IN (stamina_rule2)

[10:39] Substitution (Team_061): Draymond Banchero OUT → Tim Durant IN (stamina_rule2)

[10:39] Substitution (Team_044): Victor Westbrook OUT → Tim Siakam IN (stamina_rule2)

[10:39] Substitution (Team_044): Ayo McCollum OUT → Victor Anthony IN (stamina_rule2)

[10:24] Team_061 possession (Score: 92-71)
Stephen Towns attempts a Layup. Contested by Karl Fox (2.7 feet, MAN). STEPHEN TOWNS MAKES IT! Assist: Jayson Holiday
Score: 94-71

[10:13] Team_044 possession (Score: 94-71)
Victor Anthony attempts a 3Pt. Contested by Michael Russell (4.5 feet, ZONE). Victor Anthony misses. FOUL! Loose ball foul on Stephen Towns during the rebound battle. [Team fouls: 1] No free throws, side out. (Stephen Towns: 1 personal fouls)

[09:55] Team_044 possession (Score: 94-71)
Isaiah Murray attempts a 3Pt. Contested by Michael Russell (3.0 feet, ZONE). ISAIAH MURRAY MAKES IT! Assist: Tim Siakam
Score: 94-74

[09:44] Team_061 possession (Score: 94-74)
Stephen Towns drives, Karl Fox stays with him. Stephen Towns attempts a Dunk. Heavily contested by Karl Fox (1.8 feet, MAN)! STEPHEN TOWNS MAKES IT! Assist: Tim Durant
Score: 96-74

[09:29] Team_044 possession (Score: 96-74)
Zach McGrady attempts a 3Pt. Wide open! Jayson Holiday is 8.4 feet away. [ZONE] Zach McGrady misses. Rebound secured by Michael Russell.

[09:13] Team_061 possession (Score: 96-74)
Evan Rose attempts a Midrange. Contested by Tim Siakam (5.4 feet, ZONE). Evan Rose misses. FOUL! Loose ball foul on Karl Fox during the rebound battle. [Team fouls: 3] No free throws, side out. (Karl Fox: 1 personal fouls)

[08:59] Team_061 possession (Score: 96-74)
Jayson Holiday attempts a 3Pt. Contested by Tim Siakam (4.7 feet, ZONE). Jayson Holiday misses. Rebound secured by Tim Siakam.

[08:44] Team_044 possession (Score: 96-74)
Karl Fox attempts a Layup. Contested by Stephen Towns (3.7 feet, MAN). Karl Fox misses. Offensive rebound by Tim Siakam! Tim Siakam kicks it out.

[08:34] Team_044 possession (Score: 96-74)
Zach McGrady throws a bad pass out of bounds! TURNOVER! (dead ball)

[08:34] Substitution (Team_061): Jayson Holiday OUT → Gary Fox IN (stamina_rule2)

[08:34] Substitution (Team_061): Michael Russell OUT → Desmond Morant IN (stamina_rule2)

[08:34] Substitution (Team_044): Zach McGrady OUT → Kyrie Poole IN (stamina_rule2)

[08:34] Substitution (Team_044): Isaiah Murray OUT → Tim Towns IN (stamina_rule2)

[08:34] Substitution (Team_044): Karl Fox OUT → Pau Quickley IN (stamina_rule2)

[08:19] Team_061 possession (Score: 96-74)
FOUL! Shooting foul on Tim Siakam. Evan Rose to the line for 2 free throws. [Team fouls: 4] (Tim Siakam: 1 personal fouls)   FT 1/2: GOOD   FT 2/2: MISS Evan Rose makes 1/2 from the line. Rebound secured by Victor Anthony.
Score: 97-74

[08:03] Team_044 possession (Score: 97-74)
Pau Quickley drives and kicks out. Kyrie Poole attempts a Midrange. Contested by Desmond Morant (3.3 feet, ZONE). KYRIE POOLE MAKES IT!
Score: 97-76

[07:50] Team_061 possession (Score: 97-76)
Desmond Morant drives and kicks out. FOUL! Shooting foul on Tim Siakam. Gary Fox to the line for 3 free throws. [BONUS: 5 team fouls] (Tim Siakam: 2 personal fouls)   FT 1/3: GOOD   FT 2/3: GOOD   FT 3/3: GOOD Gary Fox makes 3/3 from the line.
Score: 100-76

[07:31] Team_044 possession (Score: 100-76)
FOUL! Shooting foul on Tim Durant. Victor Anthony to the line for 2 free throws. [Team fouls: 2] (Tim Durant: 1 personal fouls)   FT 1/2: GOOD   FT 2/2: GOOD Victor Anthony makes 2/2 from the line.
Score: 100-78

[07:17] Team_061 possession (Score: 100-78)
Tim Durant attempts a 3Pt. Contested by Tim Siakam (3.6 feet, ZONE). Tim Durant misses. Rebound secured by Pau Quickley.

[07:04] Team_044 possession (Score: 100-78)
Tim Towns attempts a 3Pt. Wide open! Gary Fox is 9.2 feet away. [MAN] TIM TOWNS MAKES IT! Assist: Kyrie Poole
Score: 100-81

[06:48] Team_061 possession (Score: 100-81)
Gary Fox attempts a 3Pt. Heavily contested by Tim Towns (0.8 feet, MAN)! Gary Fox misses. Rebound secured by Pau Quickley.

[06:30] Team_044 possession (Score: 100-81)
Pau Quickley drives, Stephen Towns stays with him. Pau Quickley attempts a Dunk. Contested by Stephen Towns (3.3 feet, MAN). PAU QUICKLEY MAKES IT! Assist: Kyrie Poole
Score: 100-83

[06:18] Team_061 possession (Score: 100-83)
Tim Durant attempts a Layup. Wide open! Pau Quickley is 6.5 feet away. [ZONE] Tim Durant misses. Rebound secured by Tim Siakam.

[06:05] Team_044 possession (Score: 100-83)
Tim Siakam attempts a Midrange. Contested by Stephen Towns (6.0 feet, ZONE). Tim Siakam misses. Rebound secured by Desmond Morant.

[05:54] Team_061 possession (Score: 100-83)
Stephen Towns attempts a 3Pt. Wide open! Pau Quickley is 6.9 feet away. [MAN] Stephen Towns misses. Offensive rebound by Tim Durant! Tim Durant's putback is no good. Rebound secured by Pau Quickley.

[05:37] Team_044 possession (Score: 100-83)
Tim Siakam attempts a 3Pt. Contested by Desmond Morant (5.0 feet, ZONE). Tim Siakam misses. Offensive rebound by Tim Siakam! Tim Siakam kicks it out.

[05:25] Team_044 possession (Score: 100-83)
Kyrie Poole attempts a 3Pt. Wide open! Evan Rose is 6.5 feet away. [MAN] Kyrie Poole misses. Rebound secured by Tim Durant.

[05:13] Team_061 possession (Score: 100-83)
Stephen Towns attempts a Layup. Heavily contested by Pau Quickley (0.5 feet, MAN)! STEPHEN TOWNS MAKES IT! Assist: Gary Fox
Score: 102-83

[04:57] Team_044 possession (Score: 102-83)
Kyrie Poole attempts a Midrange. Contested by Stephen Towns (4.6 feet, ZONE). KYRIE POOLE MAKES IT!
Score: 102-85

[04:44] Team_061 possession (Score: 102-85)
Gary Fox attempts a 3Pt. Contested by Tim Siakam (4.8 feet, ZONE). Gary Fox misses. FOUL! Loose ball foul on Tim Siakam during the rebound battle. [IN THE BONUS! 6 team fouls] Tim Durant to the line for 2 free throws. (Tim Siakam: 3 personal fouls)   FT 1/2: MISS   FT 2/2: GOOD Tim Durant makes 1/2 from the line.
Score: 103-85

[04:31] Team_044 possession (Score: 103-85)
FOUL! Holding foul on Gary Fox. [Team fouls: 3] No free throws, side out. (Gary Fox: 1 personal fouls)

[04:15] Team_044 possession (Score: 103-85)
Pau Quickley drives to the basket... Pau Quickley loses control! Ball rolls out of bounds! TURNOVER! (dead ball)

[04:03] Team_061 possession (Score: 103-85)
Gary Fox drives, picks up Pau Quickley. Help arrives from Tim Towns! Gary Fox attempts a Dunk. Contested by Tim Towns (2.5 feet, ZONE). Gary Fox misses. Rebound secured by Victor Anthony.

[03:47] Team_044 possession (Score: 103-85)
Victor Anthony attempts a Midrange. Contested by Stephen Towns (2.1 feet, ZONE). VICTOR ANTHONY MAKES IT! Assist: Kyrie Poole
Score: 103-87

[03:34] Team_061 possession (Score: 103-87)
Stephen Towns attempts a Midrange. Contested by Pau Quickley (4.2 feet, MAN). Stephen Towns misses. Rebound secured by Pau Quickley.

[03:20] Team_044 possession (Score: 103-87)
Victor Anthony attempts a 3Pt. Contested by Tim Durant (4.3 feet, MAN). VICTOR ANTHONY MAKES IT! Assist: Kyrie Poole
Score: 103-90

[03:09] Team_061 possession (Score: 103-90)
Desmond Morant attempts a Layup. Heavily contested by Pau Quickley (1.2 feet, ZONE)! DESMOND MORANT MAKES IT! Assist: Tim Durant
Score: 105-90

[02:55] Team_044 possession (Score: 105-90)
Victor Anthony attempts a Midrange. Contested by Stephen Towns (5.2 feet, ZONE). VICTOR ANTHONY MAKES IT! Assist: Tim Siakam
Score: 105-92

[02:39] Team_061 possession (Score: 105-92)
Gary Fox attempts a 3Pt. Contested by Tim Towns (3.2 feet, MAN). GARY FOX MAKES IT! Assist: Evan Rose
Score: 108-92

[02:19] Team_044 possession (Score: 108-92)
Pau Quickley throws a bad pass out of bounds! TURNOVER! (dead ball)

[02:04] Team_061 possession (Score: 108-92)
Stephen Towns attempts a Midrange. Contested by Pau Quickley (2.4 feet, MAN). STEPHEN TOWNS MAKES IT!
Score: 110-92

[01:46] Team_044 possession (Score: 110-92)
Tim Towns attempts a Midrange. Wide open! Gary Fox is 7.4 feet away. [ZONE] TIM TOWNS MAKES IT! Assist: Tim Siakam
Score: 110-94

[01:35] Team_061 possession (Score: 110-94)
Stephen Towns attempts a 3Pt. Contested by Pau Quickley (4.5 feet, MAN). Stephen Towns misses. Offensive rebound by Stephen Towns! Stephen Towns kicks it out.

[01:22] Team_061 possession (Score: 110-94)
Gary Fox attempts a 3Pt. Contested by Tim Towns (5.2 feet, MAN). GARY FOX MAKES IT!
Score: 113-94

[01:06] Team_044 possession (Score: 113-94)
Victor Anthony attempts a Midrange. Wide open! Tim Durant is 6.6 feet away. [MAN] VICTOR ANTHONY MAKES IT! Assist: Pau Quickley
Score: 113-96

[00:48] Team_061 possession (Score: 113-96)
Stephen Towns attempts a 3Pt. Contested by Pau Quickley (5.8 feet, MAN). Stephen Towns misses. Rebound secured by Tim Siakam.

[00:31] Team_044 possession (Score: 113-96)
Pau Quickley drives to the basket... FOUL! Offensive foul on Pau Quickley! Tim Durant drew the charge! [Team fouls: 7] (Pau Quickley: 1 personal fouls) TURNOVER! (dead ball)

[00:16] Team_061 possession (Score: 113-96)
Desmond Morant attempts a 3Pt. Contested by Tim Siakam (5.0 feet, MAN). Desmond Morant misses. Rebound secured by Pau Quickley.

[00:01] Team_044 possession (Score: 113-96)
Tim Towns attempts a 3Pt. Wide open! Gary Fox is 10.0 feet away. [MAN] TIM TOWNS MAKES IT! Assist: Pau Quickley
Score: 113-99

================================================================================
                              4TH QUARTER COMPLETE                              
================================================================================

4TH QUARTER SCORE: Team_061 25, Team_044 28

BOX SCORE:
================================================================================

Team_061
--------------------------------------------------------------------------------
Player                MIN  PTS  REB  AST  TO      FG   FG%      3P   3P%
--------------------------------------------------------------------------------
Gary Fox               19    9    0    1   0   3/5    60.0     0/0   0.0
Stephen Towns          19    8    1    0   0   4/7    57.1     0/0   0.0
Draymond Banchero      30    4    0    0   0   2/2   100.0     0/0   0.0
Desmond Morant         19    2    1    0   0   1/2    50.0     0/0   0.0
Tim Durant             19    1    1    2   0   1/3    33.3     0/0   0.0
Michael Russell        30    0    3    0   0   0/0     0.0     0/0   0.0
Brandon Russell        30    0    0    0   0   0/1     0.0     0/0   0.0
Jayson Holiday         30    0    0    1   0   0/1     0.0     0/0   0.0
Evan Rose              19    0    0    1   0   0/1     0.0     0/0   0.0

TEAM: FG: 11/22 (50.0%), 3PT: 3/9 (33.3%), REB: 7 (3 off, 4 def), AST: 5, TO: 0
TEAM FOULS: 3


Team_044
--------------------------------------------------------------------------------
Player                MIN  PTS  REB  AST  TO      FG   FG%      3P   3P%
--------------------------------------------------------------------------------
Victor Anthony         21   11    2    0   0   5/5   100.0     0/0   0.0
Tim Towns              19    8    0    0   0   3/3   100.0     0/0   0.0
Kyrie Poole            19    4    0    4   0   2/3    66.7     0/0   0.0
Isaiah Murray          30    3    0    0   0   1/2    50.0     0/0   0.0
Pau Quickley           19    2    5    2   0   1/1   100.0     0/0   0.0
Victor Westbrook       28    0    1    0   0   0/0     0.0     0/0   0.0
Karl Fox               30    0    1    0   0   0/0     0.0     0/0   0.0
Tim Siakam             21    0    5    3   0   0/1     0.0     0/0   0.0
Zach McGrady           30    0    0    0   0   0/1     0.0     0/0   0.0

TEAM: FG: 12/16 (75.0%), 3PT: 4/7 (57.1%), REB: 13 (3 off, 10 def), AST: 9, TO: 6
TEAM FOULS: 7 [Team_061 in BONUS]

================================================================================

================================================================================
                               FULL GAME COMPLETE                               
================================================================================

FINAL SCORE: Team_061 113, Team_044 99

SCORING BY QUARTER:
--------------------------------------------------------------------------------
Team                     Q1     Q2     Q3     Q4    FINAL
--------------------------------------------------------------------------------
Team_061                 36     11     41     25      113
Team_044                 22     23     26     28       99
--------------------------------------------------------------------------------

FULL GAME BOX SCORE:
================================================================================

Team_061
--------------------------------------------------------------------------------
Player                MIN  PTS  REB  AST  TO      FG   FG%      3P   3P%      FT STL BLK
--------------------------------------------------------------------------------
Jayson Holiday         30   11    0    3   2   4/8    50.0   1/5    20.0   0/0     3   1
Michael Russell        30   21   11    2   0   9/12   75.0   3/3   100.0   4/4     0   0
Brandon Russell        30   13    0    3   2   7/11   63.6   3/4    75.0   2/2     0   0
Bam Sexton             30   10    8    4   1   7/10   70.0   2/3    66.7   1/1     2   0
Draymond Banchero      30   31    9    4   0   8/12   66.7   1/2    50.0   5/5     0   0
Evan Rose              19    0    0    1   0   0/2     0.0   0/1     0.0   1/2     0   0
Stephen Towns          19    8    5    1   1   4/10   40.0   0/4     0.0   0/0     0   1
Tim Durant             19    1    3    2   1   0/5     0.0   0/1     0.0   1/2     0   0
Gary Fox               19    9    0    2   0   3/7    42.9   3/5    60.0   3/3     0   0
Desmond Morant         19    8    3    0   0   4/8    50.0   2/6    33.3   0/0     0   0

TEAM: FG: 46/85 (54.1%), 3PT: 15/34 (44.1%), REB: 40 (8 off, 32 def), AST: 22, TO: 7


Team_044
--------------------------------------------------------------------------------
Player                MIN  PTS  REB  AST  TO      FG   FG%      3P   3P%      FT STL BLK
--------------------------------------------------------------------------------
Zach McGrady           30   14    0    1   2   5/10   50.0   3/6    50.0   3/3     0   0
Isaiah Murray          30    5    0    2   4   2/10   20.0   1/7    14.3   0/0     0   0
Karl Fox               30   10    3    2   4   5/9    55.6   0/1     0.0   4/6     1   1
Victor Westbrook       28   13   11    2   2   6/10   60.0   3/3   100.0   5/7     0   0
Ayo McCollum           28   10    9    0   0   4/5    80.0   0/0     0.0   0/1     0   1
Tim Siakam             21    6    7    4   1   1/3    33.3   1/2    50.0   0/0     0   0
Victor Anthony         21   11    9    1   0   5/7    71.4   1/1   100.0   2/2     0   1
Kyrie Poole            19    8    0    4   1   3/5    60.0   0/2     0.0   0/0     0   0
Tim Towns              19   10    0    2   1   5/6    83.3   2/2   100.0   2/2     0   0
Pau Quickley           19    8    7    3   2   5/8    62.5   0/0     0.0   1/2     2   2

TEAM: FG: 41/73 (56.2%), 3PT: 11/24 (45.8%), REB: 45 (8 off, 37 def), AST: 21, TO: 17

================================================================================
