================================================================================
                        FULL GAME - Team_014 vs Team_061                        
================================================================================

================================================================================
                       1ST QUARTER - Team_014 vs Team_061                       
================================================================================

[12:00] Team_014 possession (Score: 0-0)
DeMar Adebayo drives to the basket... DeMar Adebayo throws a bad pass out of bounds! TURNOVER! (dead ball)

[11:45] Team_061 possession (Score: 0-0)
Bam Sexton attempts a Midrange. Contested by Lamelo Simmons (2.8 feet, ZONE). Bam Sexton misses. Rebound secured by DeMar Adebayo.

[11:30] Team_014 possession (Score: 0-0)
Michael Cunningham attempts a 3Pt. Contested by Brandon Russell (5.3 feet, ZONE). MICHAEL CUNNINGHAM MAKES IT! Assist: Lamelo Simmons
Score: 3-0

[11:14] Team_061 possession (Score: 3-0)
Michael Russell makes the Layup and draws the foul on DeMar Adebayo! And-1! Michael Russell to the line for 1. [Team fouls: 1] (DeMar Adebayo: 1 personal fouls)   FT 1/1: GOOD Michael Russell makes 1/1 from the line.
Score: 3-3

[10:56] Team_014 possession (Score: 3-3)
Michael Cunningham attempts a 3Pt. Contested by Brandon Russell (2.8 feet, MAN). Michael Cunningham misses. Rebound secured by Draymond Banchero.

[10:39] Team_061 possession (Score: 3-3)
Draymond Banchero makes the Midrange and draws the foul on Lamelo Simmons! And-1! Draymond Banchero to the line for 1. [Team fouls: 2] (Lamelo Simmons: 1 personal fouls)   FT 1/1: GOOD Draymond Banchero makes 1/1 from the line.
Score: 3-6

[10:26] Team_014 possession (Score: 3-6)
Ayo Murray drives to the basket... FOUL! Offensive foul on Ayo Murray! Draymond Banchero drew the charge! [Team fouls: 3] (Ayo Murray: 1 personal fouls) TURNOVER! (dead ball)

[10:10] Team_061 possession (Score: 3-6)
Jayson Holiday attempts a 3Pt. Wide open! Jordan Anunoby is 6.2 feet away. [ZONE] Jayson Holiday misses. Rebound secured by Michael Cunningham.

[09:55] Team_014 possession (Score: 3-6)
Lamelo Simmons attempts a Layup. BLOCKED BY DRAYMOND BANCHERO! Ball is loose! Rebound secured by Michael Russell.

[09:39] Team_061 possession (Score: 3-6)
Draymond Banchero drives and kicks out. Jayson Holiday attempts a 3Pt. Contested by Jordan Anunoby (4.2 feet, MAN). JAYSON HOLIDAY MAKES IT! Assist: Michael Russell
Score: 3-9

[09:26] Team_014 possession (Score: 3-9)
Ayo Murray attempts a Midrange. Contested by Draymond Banchero (3.0 feet, MAN). AYO MURRAY MAKES IT! Assist: Michael Cunningham
Score: 5-9

[09:14] Team_061 possession (Score: 5-9)
FOUL! Reach-in foul on Ayo Murray during the drive. [Team fouls: 4] No free throws, side out. (Ayo Murray: 2 personal fouls)

[09:02] Team_061 possession (Score: 5-9)
Bam Sexton drives and kicks out. Bam Sexton attempts a 3Pt. Wide open! Jordan Anunoby is 8.6 feet away. [ZONE] Bam Sexton misses. Rebound secured by Ayo Murray.

[08:52] Team_014 possession (Score: 5-9)
Jordan Anunoby attempts a Midrange. Contested by Jayson Holiday (2.2 feet, ZONE). Jordan Anunoby misses. Rebound secured by Michael Russell.

[08:37] Team_061 possession (Score: 5-9)
Brandon Russell drives to the basket... FOUL! Offensive foul on Brandon Russell! Michael Cunningham drew the charge! [Team fouls: 1] (Brandon Russell: 1 personal fouls) TURNOVER! (dead ball)

[08:21] Team_014 possession (Score: 5-9)
FOUL! Shooting foul on Draymond Banchero. Ayo Murray to the line for 2 free throws. [Team fouls: 2] (Draymond Banchero: 1 personal fouls)   FT 1/2: GOOD   FT 2/2: GOOD Ayo Murray makes 2/2 from the line.
Score: 7-9

[08:10] Team_061 possession (Score: 7-9)
Bam Sexton makes the Layup and draws the foul on DeMar Adebayo! And-1! Bam Sexton to the line for 1. [BONUS: 5 team fouls] (DeMar Adebayo: 2 personal fouls)   FT 1/1: GOOD Bam Sexton makes 1/1 from the line.
Score: 7-12

[07:52] Team_014 possession (Score: 7-12)
Michael Cunningham attempts a Midrange. Contested by Jayson Holiday (4.6 feet, ZONE). MICHAEL CUNNINGHAM MAKES IT!
Score: 9-12

[07:39] Team_061 possession (Score: 9-12)
Bam Sexton attempts a Midrange. Wide open! DeMar Adebayo is 6.2 feet away. [MAN] BAM SEXTON MAKES IT!
Score: 9-14

[07:28] Team_014 possession (Score: 9-14)
DeMar Adebayo drives to the basket... DeMar Adebayo throws a bad pass! Stolen by Draymond Banchero! TURNOVER! (live ball)

[07:09] Team_061 possession (Score: 9-14)
Jayson Holiday drives, Jordan Anunoby stays with him. Jayson Holiday attempts a Dunk. Contested by Jordan Anunoby (4.5 feet, MAN). Jayson Holiday misses. Rebound secured by Michael Cunningham.

[06:51] Team_014 possession (Score: 9-14)
DeMar Adebayo attempts a 3Pt. Contested by Brandon Russell (4.5 feet, ZONE). DEMAR ADEBAYO MAKES IT!
Score: 12-14

[06:38] Team_061 possession (Score: 12-14)
Bam Sexton attempts a Layup. BLOCKED BY DEMAR ADEBAYO! Ball goes out off DeMar Adebayo. Bam Sexton's ball!

[06:24] Team_061 possession (Score: 12-14)
Brandon Russell attempts a Layup. BLOCKED BY JORDAN ANUNOBY! Ball is loose! Rebound secured by Michael Cunningham.

[06:08] Team_014 possession (Score: 12-14)
Michael Cunningham attempts a 3Pt. Contested by Brandon Russell (4.4 feet, ZONE). MICHAEL CUNNINGHAM MAKES IT! Assist: Jordan Anunoby
Score: 15-14

[05:55] Team_061 possession (Score: 15-14)
Michael Russell attempts a Dunk. BLOCKED BY DEMAR ADEBAYO! Ball is loose! Rebound secured by Michael Cunningham.

[05:39] Team_014 possession (Score: 15-14)
Ayo Murray attempts a 3Pt. Contested by Brandon Russell (4.8 feet, ZONE). Ayo Murray misses. Rebound secured by Draymond Banchero.

[05:28] Team_061 possession (Score: 15-14)
Jayson Holiday makes the Layup and draws the foul on Michael Cunningham! And-1! Jayson Holiday to the line for 1. [BONUS: 6 team fouls] (Michael Cunningham: 1 personal fouls)   FT 1/1: GOOD Jayson Holiday makes 1/1 from the line.
Score: 15-17

[05:15] Team_014 possession (Score: 15-17)
Lamelo Simmons drives, Draymond Banchero stays with him. Lamelo Simmons attempts a Dunk. Heavily contested by Draymond Banchero (1.1 feet, ZONE)! LAMELO SIMMONS MAKES IT! Assist: Michael Cunningham
Score: 17-17

[05:00] Team_061 possession (Score: 17-17)
Bam Sexton attempts a Layup. BLOCKED BY DEMAR ADEBAYO! Ball deflects out of bounds off Bam Sexton.

[04:43] Team_014 possession (Score: 17-17)
Michael Cunningham attempts a Midrange. Contested by Michael Russell (4.6 feet, ZONE). Michael Cunningham misses. Rebound secured by Draymond Banchero.

[04:25] Team_061 possession (Score: 17-17)
Michael Russell attempts a Midrange. Wide open! Lamelo Simmons is 6.5 feet away. [ZONE] Michael Russell misses. Offensive rebound by Michael Russell! Michael Russell puts it back in!
Score: 17-19

[04:10] Team_014 possession (Score: 17-19)
Lamelo Simmons attempts a 3Pt. Contested by Brandon Russell (3.3 feet, ZONE). Lamelo Simmons misses. Rebound secured by Michael Russell.

[03:55] Team_061 possession (Score: 17-19)
Michael Russell attempts a 3Pt. Contested by Lamelo Simmons (5.0 feet, MAN). Michael Russell misses. Rebound secured by Ayo Murray.

[03:41] Team_014 possession (Score: 17-19)
Lamelo Simmons attempts a 3Pt. Wide open! Brandon Russell is 7.6 feet away. [ZONE] Lamelo Simmons misses. Offensive rebound by Ayo Murray! Ayo Murray kicks it out.

[03:28] Team_014 possession (Score: 17-19)
Lamelo Simmons makes the 3Pt and draws the foul on Brandon Russell! And-1! Lamelo Simmons to the line for 1. [Team fouls: 3] (Brandon Russell: 2 personal fouls)   FT 1/1: GOOD Lamelo Simmons makes 1/1 from the line.
Score: 21-19

[03:09] Team_061 possession (Score: 21-19)
Bam Sexton attempts a 3Pt. Contested by DeMar Adebayo (4.7 feet, MAN). BAM SEXTON MAKES IT! Assist: Draymond Banchero
Score: 21-22

[02:55] Team_014 possession (Score: 21-22)
Jordan Anunoby drives, picks up Jayson Holiday. Help arrives from Michael Russell! Jordan Anunoby attempts a Dunk. Heavily contested by Michael Russell (1.2 feet, MAN)! JORDAN ANUNOBY MAKES IT! Assist: DeMar Adebayo
Score: 23-22

[02:38] Team_061 possession (Score: 23-22)
FOUL! Reach-in foul on Michael Cunningham during the drive. [IN THE BONUS! 7 team fouls] Brandon Russell to the line for 2 free throws. (Michael Cunningham: 2 personal fouls)   FT 1/2: GOOD   FT 2/2: GOOD Brandon Russell makes 2/2 from the line.
Score: 23-24

[02:28] Team_014 possession (Score: 23-24)
Ayo Murray makes the Dunk and draws the foul on Jayson Holiday! And-1! Ayo Murray to the line for 1. [Team fouls: 4] (Jayson Holiday: 1 personal fouls)   FT 1/1: GOOD Ayo Murray makes 1/1 from the line.
Score: 26-24

[02:10] Team_061 possession (Score: 26-24)
Draymond Banchero attempts a Midrange. Contested by Ayo Murray (5.7 feet, MAN). Draymond Banchero misses. Offensive rebound by Michael Russell! Michael Russell's putback is no good. Rebound secured by Ayo Murray.

[01:53] Team_014 possession (Score: 26-24)
Lamelo Simmons attempts a Layup. BLOCKED BY DRAYMOND BANCHERO! Ball is loose! Rebound secured by Michael Russell.

[01:37] Team_061 possession (Score: 26-24)
Draymond Banchero attempts a Midrange. Wide open! Ayo Murray is 7.6 feet away. [MAN] Draymond Banchero misses. Rebound secured by DeMar Adebayo.

[01:27] Team_014 possession (Score: 26-24)
DeMar Adebayo attempts a Midrange. Contested by Bam Sexton (4.5 feet, ZONE). DeMar Adebayo misses. Rebound secured by Bam Sexton.

[01:16] Team_061 possession (Score: 26-24)
Jayson Holiday throws a bad pass! Stolen by Jordan Anunoby! TURNOVER! (live ball)

[01:02] Team_014 possession (Score: 26-24)
DeMar Adebayo attempts a 3Pt. Contested by Brandon Russell (4.5 feet, ZONE). DeMar Adebayo misses. Rebound secured by Bam Sexton.

[00:45] Team_061 possession (Score: 26-24)
Draymond Banchero attempts a Midrange. Wide open! Ayo Murray is 6.4 feet away. [MAN] DRAYMOND BANCHERO MAKES IT!
Score: 26-26

[00:30] Team_014 possession (Score: 26-26)
Ayo Murray attempts a Layup. BLOCKED BY DRAYMOND BANCHERO! Ball goes out off Draymond Banchero. Ayo Murray's ball!

[00:18] Team_014 possession (Score: 26-26)
Ayo Murray attempts a Layup. Contested by Draymond Banchero (3.6 feet, ZONE). Ayo Murray misses. Rebound secured by Draymond Banchero.

[00:02] Team_061 possession (Score: 26-26)
Brandon Russell drives, Michael Cunningham stays with him. Brandon Russell attempts a Dunk. Heavily contested by Michael Cunningham (1.1 feet, MAN)! BRANDON RUSSELL MAKES IT!
Score: 26-28

================================================================================
                              1ST QUARTER COMPLETE                              
================================================================================

1ST QUARTER SCORE: Team_014 26, Team_061 28

BOX SCORE:
================================================================================

Team_014
--------------------------------------------------------------------------------
Player                MIN  PTS  REB  AST  TO      FG   FG%      3P   3P%
--------------------------------------------------------------------------------
Michael Cunningham     12    8    4    2   0   3/5    60.0     0/0   0.0
Ayo Murray             12    7    4    0   0   3/5    60.0     0/0   0.0
Lamelo Simmons         12    6    0    1   0   2/5    40.0     0/0   0.0
DeMar Adebayo          12    3    2    1   0   1/3    33.3     0/0   0.0
Jordan Anunoby         12    2    0    1   0   1/2    50.0     0/0   0.0

TEAM: FG: 10/20 (50.0%), 3PT: 4/8 (50.0%), REB: 9 (1 off, 8 def), AST: 5, TO: 3
TEAM FOULS: 7 [Team_061 in BONUS]


Team_061
--------------------------------------------------------------------------------
Player                MIN  PTS  REB  AST  TO      FG   FG%      3P   3P%
--------------------------------------------------------------------------------
Bam Sexton             12    8    2    0   0   3/6    50.0     0/0   0.0
Jayson Holiday         12    6    0    0   0   2/4    50.0     0/0   0.0
Michael Russell        12    5    5    1   0   2/4    50.0     0/0   0.0
Draymond Banchero      12    5    4    1   0   2/4    50.0     0/0   0.0
Brandon Russell        12    4    0    0   0   2/3    66.7     0/0   0.0

TEAM: FG: 11/21 (52.4%), 3PT: 1/3 (33.3%), REB: 12 (2 off, 10 def), AST: 2, TO: 2
TEAM FOULS: 4

================================================================================

================================================================================
                       2ND QUARTER - Team_014 vs Team_061                       
================================================================================

[12:00] Team_014 possession (Score: 26-28)
DeMar Adebayo drives, picks up Bam Sexton. Help arrives from Jayson Holiday! DeMar Adebayo attempts a Dunk. Wide open! Jayson Holiday is 6.7 feet away. [MAN] DeMar Adebayo misses. Rebound secured by Bam Sexton.

[11:46] Team_061 possession (Score: 26-28)
Brandon Russell attempts a Layup. Contested by DeMar Adebayo (2.1 feet, ZONE). BRANDON RUSSELL MAKES IT! Assist: Michael Russell
Score: 26-30

[11:36] Team_014 possession (Score: 26-30)
Ayo Murray attempts a Layup. Contested by Draymond Banchero (5.7 feet, MAN). Ayo Murray misses. Rebound secured by Bam Sexton.

[11:22] Team_061 possession (Score: 26-30)
Brandon Russell attempts a Midrange. Contested by DeMar Adebayo (2.4 feet, ZONE). BRANDON RUSSELL MAKES IT!
Score: 26-32

[11:05] Team_014 possession (Score: 26-32)
Michael Cunningham attempts a 3Pt. Wide open! Brandon Russell is 6.0 feet away. [MAN] Michael Cunningham misses. Rebound secured by Bam Sexton.

[10:48] Team_061 possession (Score: 26-32)
Jayson Holiday makes the Layup and draws the foul on Jordan Anunoby! And-1! Jayson Holiday to the line for 1. [Team fouls: 1] (Jordan Anunoby: 1 personal fouls)   FT 1/1: GOOD Jayson Holiday makes 1/1 from the line.
Score: 26-35

[10:30] Team_014 possession (Score: 26-35)
Jordan Anunoby drives to the basket... Jordan Anunoby commits a violation (traveling/carry)! TURNOVER! (dead ball)

[10:30] Substitution (Team_014): Michael Cunningham OUT → Jalen Booker IN (stamina_rule2)

[10:30] Substitution (Team_014): Jordan Anunoby OUT → Bones Quickley IN (stamina_rule2)

[10:30] Substitution (Team_014): Lamelo Simmons OUT → Tracy Westbrook IN (stamina_rule2)

[10:30] Substitution (Team_014): DeMar Adebayo OUT → Nikola James IN (stamina_rule2)

[10:30] Substitution (Team_014): Ayo Murray OUT → Collin Gasol IN (stamina_rule2)

[10:30] Substitution (Team_061): Brandon Russell OUT → Evan Rose IN (stamina_rule2)

[10:30] Substitution (Team_061): Jayson Holiday OUT → Gary Fox IN (stamina_rule2)

[10:30] Substitution (Team_061): Michael Russell OUT → Desmond Morant IN (stamina_rule2)

[10:30] Substitution (Team_061): Bam Sexton OUT → Stephen Towns IN (stamina_rule2)

[10:30] Substitution (Team_061): Draymond Banchero OUT → Tim Durant IN (stamina_rule2)

[10:17] Team_061 possession (Score: 26-35)
Tim Durant drives and kicks out. Evan Rose attempts a 3Pt. Wide open! Jalen Booker is 6.5 feet away. [ZONE] Evan Rose misses. Rebound secured by Nikola James.

[10:03] Team_014 possession (Score: 26-35)
Tracy Westbrook attempts a 3Pt. Wide open! Desmond Morant is 8.5 feet away. [MAN] Tracy Westbrook misses. Rebound secured by Stephen Towns.

[09:48] Team_061 possession (Score: 26-35)
Stephen Towns drives and kicks out. Gary Fox attempts a 3Pt. Contested by Bones Quickley (4.0 feet, MAN). Gary Fox misses. Rebound secured by Tracy Westbrook.

[09:35] Team_014 possession (Score: 26-35)
Nikola James throws a bad pass out of bounds! TURNOVER! (dead ball)

[09:18] Team_061 possession (Score: 26-35)
Gary Fox throws a bad pass out of bounds! TURNOVER! (dead ball)

[09:05] Team_014 possession (Score: 26-35)
Jalen Booker attempts a Layup. BLOCKED BY EVAN ROSE! Ball is loose! Rebound secured by Desmond Morant.

[08:53] Team_061 possession (Score: 26-35)
Gary Fox attempts a 3Pt. Contested by Tracy Westbrook (5.9 feet, ZONE). Gary Fox misses. Rebound secured by Collin Gasol.

[08:37] Team_014 possession (Score: 26-35)
Collin Gasol attempts a 3Pt. Wide open! Desmond Morant is 7.4 feet away. [ZONE] COLLIN GASOL MAKES IT! Assist: Bones Quickley
Score: 29-35

[08:21] Team_061 possession (Score: 29-35)
Stephen Towns loses the ball! Stripped by Nikola James! TURNOVER! (live ball)

[08:09] Team_014 possession (Score: 29-35)
Bones Quickley attempts a 3Pt. Contested by Desmond Morant (5.0 feet, ZONE). Bones Quickley misses. Rebound secured by Stephen Towns.

[07:56] Team_061 possession (Score: 29-35)
Gary Fox attempts a 3Pt. Wide open! Bones Quickley is 9.6 feet away. [MAN] GARY FOX MAKES IT!
Score: 29-38

[07:46] Team_014 possession (Score: 29-38)
Nikola James attempts a Midrange. Contested by Stephen Towns (2.6 feet, MAN). NIKOLA JAMES MAKES IT! Assist: Collin Gasol
Score: 31-38

[07:31] Team_061 possession (Score: 31-38)
FOUL! Shooting foul on Collin Gasol. Tim Durant to the line for 2 free throws. [Team fouls: 2] (Collin Gasol: 1 personal fouls)   FT 1/2: GOOD   FT 2/2: GOOD Tim Durant makes 2/2 from the line.
Score: 31-40

[07:19] Team_014 possession (Score: 31-40)
Tracy Westbrook attempts a Midrange. Contested by Desmond Morant (3.3 feet, MAN). TRACY WESTBROOK MAKES IT! Assist: Bones Quickley
Score: 33-40

[07:03] Team_061 possession (Score: 33-40)
Desmond Morant attempts a 3Pt. Contested by Jalen Booker (5.3 feet, ZONE). Desmond Morant misses. Rebound secured by Nikola James.

[06:50] Team_014 possession (Score: 33-40)
Tracy Westbrook attempts a Layup. Heavily contested by Desmond Morant (1.9 feet, MAN)! Tracy Westbrook misses. Rebound secured by Tim Durant.

[06:36] Team_061 possession (Score: 33-40)
FOUL! Holding foul on Bones Quickley. [Team fouls: 3] No free throws, side out. (Bones Quickley: 1 personal fouls)

[06:23] Team_061 possession (Score: 33-40)
Stephen Towns makes the Layup and draws the foul on Nikola James! And-1! Stephen Towns to the line for 1. [Team fouls: 4] (Nikola James: 1 personal fouls)   FT 1/1: GOOD Stephen Towns makes 1/1 from the line.
Score: 33-43

[06:10] Team_014 possession (Score: 33-43)
Collin Gasol attempts a Layup. BLOCKED BY TIM DURANT! Ball is loose! Rebound secured by Desmond Morant.

[05:54] Team_061 possession (Score: 33-43)
Evan Rose attempts a 3Pt. Contested by Jalen Booker (4.5 feet, MAN). Evan Rose misses. Rebound secured by Tracy Westbrook.

[05:40] Team_014 possession (Score: 33-43)
FOUL! Shooting foul on Tim Durant. Jalen Booker to the line for 2 free throws. [Team fouls: 1] (Tim Durant: 1 personal fouls)   FT 1/2: GOOD   FT 2/2: GOOD Jalen Booker makes 2/2 from the line.
Score: 35-43

[05:27] Team_061 possession (Score: 35-43)
Tim Durant attempts a Layup. Contested by Collin Gasol (5.5 feet, MAN). TIM DURANT MAKES IT!
Score: 35-45

[05:14] Team_014 possession (Score: 35-45)
Nikola James attempts a 3Pt. Contested by Desmond Morant (3.9 feet, ZONE). Nikola James misses. Offensive rebound by Nikola James! Nikola James kicks it out.

[04:57] Team_014 possession (Score: 35-45)
Nikola James throws a bad pass! Stolen by Stephen Towns! TURNOVER! (live ball)

[04:44] Team_061 possession (Score: 35-45)
Evan Rose drives and kicks out. Gary Fox attempts a Midrange. Contested by Tracy Westbrook (4.9 feet, ZONE). GARY FOX MAKES IT!
Score: 35-47

[04:29] Team_014 possession (Score: 35-47)
Collin Gasol loses the ball! Stripped by Tim Durant! TURNOVER! (live ball)

[04:17] Team_061 possession (Score: 35-47)
Tim Durant attempts a Midrange. Contested by Collin Gasol (5.6 feet, MAN). Tim Durant misses. Offensive rebound by Tim Durant! Tim Durant's putback is no good. Rebound secured by Tracy Westbrook.

[04:01] Team_014 possession (Score: 35-47)
Collin Gasol attempts a Layup. BLOCKED BY TIM DURANT! Ball is loose! Offensive rebound by Nikola James! Nikola James kicks it out.

[03:45] Team_014 possession (Score: 35-47)
Bones Quickley attempts a 3Pt. Contested by Gary Fox (5.5 feet, MAN). BONES QUICKLEY MAKES IT! Assist: Tracy Westbrook
Score: 38-47

[03:26] Team_061 possession (Score: 38-47)
FOUL! Shooting foul on Collin Gasol. Gary Fox to the line for 2 free throws. [BONUS: 5 team fouls] (Collin Gasol: 2 personal fouls)   FT 1/2: MISS   FT 2/2: MISS Gary Fox makes 0/2 from the line. Offensive rebound by Stephen Towns! Stephen Towns kicks it out.

[03:08] Team_061 possession (Score: 38-47)
Tim Durant attempts a Midrange. Contested by Collin Gasol (5.3 feet, MAN). Tim Durant misses. Rebound secured by Nikola James.

[02:57] Team_014 possession (Score: 38-47)
Collin Gasol attempts a 3Pt. Contested by Desmond Morant (5.2 feet, ZONE). Collin Gasol misses. Rebound secured by Stephen Towns.

[02:46] Team_061 possession (Score: 38-47)
Gary Fox makes the Layup and draws the foul on Collin Gasol! And-1! Gary Fox to the line for 1. [BONUS: 6 team fouls] (Collin Gasol: 3 personal fouls)   FT 1/1: GOOD Gary Fox makes 1/1 from the line.
Score: 38-50

[02:33] Team_014 possession (Score: 38-50)
Collin Gasol attempts a Midrange. Contested by Tim Durant (4.7 feet, MAN). Collin Gasol misses. Rebound secured by Tim Durant.

[02:18] Team_061 possession (Score: 38-50)
Desmond Morant attempts a 3Pt. Contested by Jalen Booker (3.6 feet, ZONE). Desmond Morant misses. Rebound secured by Tracy Westbrook.

[02:04] Team_014 possession (Score: 38-50)
Nikola James drives to the basket... Nikola James loses control! Ball rolls out of bounds! TURNOVER! (dead ball)

[01:53] Team_061 possession (Score: 38-50)
Stephen Towns makes the Layup and draws the foul on Collin Gasol! And-1! Stephen Towns to the line for 1. [BONUS: 7 team fouls] (Collin Gasol: 4 personal fouls)   FT 1/1: GOOD Stephen Towns makes 1/1 from the line.
Score: 38-53

[01:39] Team_014 possession (Score: 38-53)
FOUL! Offensive foul on Collin Gasol! Tim Durant drew the charge! [Team fouls: 8] (Collin Gasol: 5 personal fouls) TURNOVER! (dead ball)

[01:29] Team_061 possession (Score: 38-53)
Tim Durant makes the Layup and draws the foul on Collin Gasol! And-1! Tim Durant to the line for 1. [BONUS: 9 team fouls] (Collin Gasol: 6 personal fouls) Collin Gasol FOULS OUT!   FT 1/1: GOOD Tim Durant makes 1/1 from the line.
Score: 38-56

[01:29] Substitution (Team_014): Collin Gasol OUT (stamina: 70) → Michael Cunningham IN (foul_out)

[01:13] Team_014 possession (Score: 38-56)
Nikola James attempts a Midrange. Wide open! Stephen Towns is 7.8 feet away. [MAN] Nikola James misses. Rebound secured by Tim Durant.

[00:59] Team_061 possession (Score: 38-56)
Desmond Morant drives, Tracy Westbrook stays with him. Desmond Morant attempts a Dunk. Wide open! Tracy Westbrook is 8.4 feet away. [MAN] DESMOND MORANT MAKES IT! Assist: Evan Rose
Score: 38-58

[00:41] Team_014 possession (Score: 38-58)
Michael Cunningham attempts a Midrange. Contested by Evan Rose (5.5 feet, MAN). MICHAEL CUNNINGHAM MAKES IT! Assist: Jalen Booker
Score: 40-58

[00:30] Team_061 possession (Score: 40-58)
Gary Fox drives, picks up Nikola James. Help arrives from Jalen Booker! Gary Fox attempts a Layup. Contested by Jalen Booker (3.1 feet, ZONE). GARY FOX MAKES IT! Assist: Tim Durant
Score: 40-60

[00:12] Team_014 possession (Score: 40-60)
Bones Quickley throws a bad pass! Stolen by Gary Fox! TURNOVER! (live ball)

================================================================================
                              2ND QUARTER COMPLETE                              
================================================================================

2ND QUARTER SCORE: Team_014 14, Team_061 32

BOX SCORE:
================================================================================

Team_014
--------------------------------------------------------------------------------
Player                MIN  PTS  REB  AST  TO      FG   FG%      3P   3P%
--------------------------------------------------------------------------------
Collin Gasol            9    3    1    1   0   1/4    25.0     0/0   0.0
Bones Quickley         10    3    0    2   0   1/2    50.0     0/0   0.0
Michael Cunningham     15    2    0    0   0   1/2    50.0     0/0   0.0
Nikola James           10    2    5    0   0   1/2    50.0     0/0   0.0
Tracy Westbrook        10    2    4    1   0   1/3    33.3     0/0   0.0
Jalen Booker           10    2    0    1   0   1/2    50.0     0/0   0.0
DeMar Adebayo          14    0    0    0   0   0/1     0.0     0/0   0.0
Ayo Murray             14    0    0    0   0   0/1     0.0     0/0   0.0

TEAM: FG: 6/17 (35.3%), 3PT: 2/6 (33.3%), REB: 9 (2 off, 7 def), AST: 5, TO: 7
TEAM FOULS: 9 [Team_061 in BONUS]


Team_061
--------------------------------------------------------------------------------
Player                MIN  PTS  REB  AST  TO      FG   FG%      3P   3P%
--------------------------------------------------------------------------------
Gary Fox               10   10    0    0   0   4/5    80.0     0/0   0.0
Tim Durant             10    7    3    1   0   3/6    50.0     0/0   0.0
Stephen Towns          10    6    4    0   0   2/3    66.7     0/0   0.0
Brandon Russell        14    4    0    0   0   2/2   100.0     0/0   0.0
Jayson Holiday         14    3    0    0   0   1/1   100.0     0/0   0.0
Desmond Morant         10    2    2    0   0   1/3    33.3     0/0   0.0
Bam Sexton             14    0    3    0   0   0/0     0.0     0/0   0.0
Michael Russell        14    0    0    1   0   0/0     0.0     0/0   0.0
Evan Rose              10    0    0    1   0   0/1     0.0     0/0   0.0

TEAM: FG: 13/21 (61.9%), 3PT: 1/5 (20.0%), REB: 13 (2 off, 11 def), AST: 3, TO: 2
TEAM FOULS: 1

================================================================================

================================================================================
                       3RD QUARTER - Team_014 vs Team_061                       
================================================================================

[12:00] Team_014 possession (Score: 40-60)
Michael Cunningham attempts a 3Pt. Heavily contested by Brandon Russell (1.3 feet, MAN)! Michael Cunningham misses. Rebound secured by Draymond Banchero.

[11:47] Team_061 possession (Score: 40-60)
Draymond Banchero drives, Ayo Murray stays with him. Draymond Banchero attempts a Dunk. Contested by Ayo Murray (4.0 feet, MAN). Draymond Banchero misses. Rebound secured by Ayo Murray.

[11:32] Team_014 possession (Score: 40-60)
DeMar Adebayo attempts a 3Pt. Contested by Bam Sexton (2.4 feet, MAN). DeMar Adebayo misses. Rebound secured by Bam Sexton.

[11:15] Team_061 possession (Score: 40-60)
Draymond Banchero drives, Ayo Murray stays with him. Draymond Banchero attempts a Layup. Contested by Ayo Murray (3.2 feet, MAN). DRAYMOND BANCHERO MAKES IT!
Score: 40-62

[11:00] Team_014 possession (Score: 40-62)
Lamelo Simmons attempts a Midrange. Contested by Michael Russell (4.3 feet, MAN). LAMELO SIMMONS MAKES IT!
Score: 42-62

[10:45] Team_061 possession (Score: 42-62)
Brandon Russell attempts a Midrange. Wide open! Michael Cunningham is 6.0 feet away. [MAN] Brandon Russell misses. Rebound secured by Ayo Murray.

[10:26] Team_014 possession (Score: 42-62)
DeMar Adebayo attempts a Layup. Heavily contested by Draymond Banchero (1.6 feet, ZONE)! DEMAR ADEBAYO MAKES IT! Assist: Ayo Murray
Score: 44-62

[10:12] Team_061 possession (Score: 44-62)
Jayson Holiday drives to the basket... Jayson Holiday loses control! Ball rolls out of bounds! TURNOVER! (dead ball)

[09:57] Team_014 possession (Score: 44-62)
Michael Cunningham attempts a 3Pt. Heavily contested by Brandon Russell (1.9 feet, ZONE)! Michael Cunningham misses. Rebound secured by Bam Sexton.

[09:45] Team_061 possession (Score: 44-62)
FOUL! Reach-in foul on DeMar Adebayo during the drive. [Team fouls: 1] No free throws, side out. (DeMar Adebayo: 1 personal fouls)

[09:30] Team_061 possession (Score: 44-62)
Michael Russell attempts a Dunk. BLOCKED BY LAMELO SIMMONS! Ball is loose! Offensive rebound by Draymond Banchero! Draymond Banchero kicks it out.

[09:12] Team_061 possession (Score: 44-62)
Michael Russell drives and kicks out. Draymond Banchero attempts a 3Pt. Wide open! Ayo Murray is 8.2 feet away. [MAN] DRAYMOND BANCHERO MAKES IT! Assist: Michael Russell
Score: 44-65

[08:57] Team_014 possession (Score: 44-65)
FOUL! Offensive foul on Ayo Murray! Draymond Banchero drew the charge! [Team fouls: 2] (Ayo Murray: 1 personal fouls) TURNOVER! (dead ball)

[08:41] Team_061 possession (Score: 44-65)
Michael Russell drives and kicks out. Bam Sexton attempts a Midrange. Contested by DeMar Adebayo (2.7 feet, MAN). BAM SEXTON MAKES IT! Assist: Michael Russell
Score: 44-67

[08:25] Team_014 possession (Score: 44-67)
Lamelo Simmons drives, picks up Draymond Banchero. Help arrives from Jayson Holiday! Lamelo Simmons attempts a Layup. Heavily contested by Jayson Holiday (0.6 feet, ZONE)! LAMELO SIMMONS MAKES IT! Assist: DeMar Adebayo
Score: 46-67

[08:13] Team_061 possession (Score: 46-67)
Michael Russell attempts a 3Pt. Contested by Jordan Anunoby (3.2 feet, ZONE). Michael Russell misses. Rebound secured by DeMar Adebayo.

[07:59] Team_014 possession (Score: 46-67)
FOUL! Offensive foul on DeMar Adebayo! Bam Sexton drew the charge! [Team fouls: 3] (DeMar Adebayo: 2 personal fouls) TURNOVER! (dead ball)

[07:44] Team_061 possession (Score: 46-67)
Brandon Russell attempts a Layup. BLOCKED BY DEMAR ADEBAYO! Ball is loose! Offensive rebound by Draymond Banchero! Draymond Banchero kicks it out.

[07:24] Team_061 possession (Score: 46-67)
Brandon Russell drives, picks up Michael Cunningham. Help arrives from Jordan Anunoby! Brandon Russell attempts a Dunk. Contested by Jordan Anunoby (3.3 feet, MAN). BRANDON RUSSELL MAKES IT! Assist: Jayson Holiday
Score: 46-69

[07:08] Team_014 possession (Score: 46-69)
Jordan Anunoby attempts a Midrange. Contested by Bam Sexton (4.7 feet, ZONE). JORDAN ANUNOBY MAKES IT! Assist: Michael Cunningham
Score: 48-69

[06:55] Team_061 possession (Score: 48-69)
Jayson Holiday drives and kicks out. Draymond Banchero attempts a Midrange. Contested by Ayo Murray (5.2 feet, MAN). Draymond Banchero misses. Rebound secured by Ayo Murray.

[06:39] Team_014 possession (Score: 48-69)
Ayo Murray drives, picks up Draymond Banchero. Help arrives from Jayson Holiday! Ayo Murray attempts a Dunk. Heavily contested by Jayson Holiday (0.5 feet, MAN)! AYO MURRAY MAKES IT!
Score: 50-69

[06:23] Team_061 possession (Score: 50-69)
Draymond Banchero attempts a 3Pt. Wide open! Ayo Murray is 6.8 feet away. [MAN] Draymond Banchero misses. Rebound secured by Ayo Murray.

[06:06] Team_014 possession (Score: 50-69)
Ayo Murray drives to the basket... Ayo Murray commits a violation (traveling/carry)! TURNOVER! (dead ball)

[05:51] Team_061 possession (Score: 50-69)
Brandon Russell makes the Midrange and draws the foul on Jordan Anunoby! And-1! Brandon Russell to the line for 1. [Team fouls: 4] (Jordan Anunoby: 1 personal fouls)   FT 1/1: GOOD Brandon Russell makes 1/1 from the line.
Score: 50-72

[05:34] Team_014 possession (Score: 50-72)
DeMar Adebayo attempts a Layup. Heavily contested by Draymond Banchero (0.5 feet, ZONE)! DeMar Adebayo misses. Offensive rebound by DeMar Adebayo! DeMar Adebayo kicks it out.

[05:21] Team_014 possession (Score: 50-72)
Ayo Murray drives, Draymond Banchero stays with him. Ayo Murray attempts a Layup. Heavily contested by Draymond Banchero (1.7 feet, MAN)! Ayo Murray misses. Rebound secured by Bam Sexton.

[05:10] Team_061 possession (Score: 50-72)
Jayson Holiday attempts a 3Pt. Contested by Michael Cunningham (4.8 feet, ZONE). Jayson Holiday misses. Rebound secured by Ayo Murray.

[04:53] Team_014 possession (Score: 50-72)
DeMar Adebayo drives, Draymond Banchero stays with him. DeMar Adebayo attempts a Layup. Contested by Draymond Banchero (3.9 feet, ZONE). DeMar Adebayo misses. Rebound secured by Bam Sexton.

[04:36] Team_061 possession (Score: 50-72)
FOUL! Shooting foul on Lamelo Simmons. Jayson Holiday to the line for 2 free throws. [BONUS: 5 team fouls] (Lamelo Simmons: 1 personal fouls)   FT 1/2: GOOD   FT 2/2: GOOD Jayson Holiday makes 2/2 from the line.
Score: 50-74

[04:18] Team_014 possession (Score: 50-74)
Michael Cunningham attempts a Layup. Contested by Brandon Russell (2.1 feet, MAN). MICHAEL CUNNINGHAM MAKES IT!
Score: 52-74

[04:01] Team_061 possession (Score: 52-74)
Brandon Russell attempts a Layup. Contested by DeMar Adebayo (4.6 feet, ZONE). BRANDON RUSSELL MAKES IT! Assist: Jayson Holiday
Score: 52-76

[03:49] Team_014 possession (Score: 52-76)
Jordan Anunoby drives and kicks out. FOUL! Shooting foul on Brandon Russell. Lamelo Simmons to the line for 3 free throws. [Team fouls: 1] (Brandon Russell: 1 personal fouls)   FT 1/3: GOOD   FT 2/3: MISS   FT 3/3: GOOD Lamelo Simmons makes 2/3 from the line.
Score: 54-76

[03:32] Team_061 possession (Score: 54-76)
Michael Russell drives to the basket... Michael Russell throws a bad pass out of bounds! TURNOVER! (dead ball)

[03:18] Team_014 possession (Score: 54-76)
DeMar Adebayo attempts a Midrange. Contested by Brandon Russell (4.5 feet, ZONE). DeMar Adebayo misses. Rebound secured by Draymond Banchero.

[03:01] Team_061 possession (Score: 54-76)
Draymond Banchero throws a bad pass! Stolen by Ayo Murray! TURNOVER! (live ball)

[02:43] Team_014 possession (Score: 54-76)
FOUL! Reach-in foul on Draymond Banchero during the drive. [Team fouls: 2] No free throws, side out. (Draymond Banchero: 1 personal fouls)

[02:33] Team_014 possession (Score: 54-76)
FOUL! Reach-in foul on Draymond Banchero during the drive. [Team fouls: 3] No free throws, side out. (Draymond Banchero: 2 personal fouls)

[02:20] Team_014 possession (Score: 54-76)
Ayo Murray drives, Draymond Banchero stays with him. Ayo Murray attempts a Layup. Heavily contested by Draymond Banchero (1.5 feet, MAN)! Ayo Murray misses. Rebound secured by Draymond Banchero.

[02:07] Team_061 possession (Score: 54-76)
Brandon Russell attempts a 3Pt. Wide open! Michael Cunningham is 6.8 feet away. [MAN] BRANDON RUSSELL MAKES IT!
Score: 54-79

[01:54] Team_014 possession (Score: 54-79)
Lamelo Simmons drives, picks up Draymond Banchero. Help arrives from Jayson Holiday! Lamelo Simmons attempts a Layup. Heavily contested by Jayson Holiday (1.4 feet, ZONE)! Lamelo Simmons misses. Rebound secured by Michael Russell.

[01:40] Team_061 possession (Score: 54-79)
Jayson Holiday attempts a Midrange. Wide open! Jordan Anunoby is 6.4 feet away. [MAN] Jayson Holiday misses. Rebound secured by Ayo Murray.

[01:27] Team_014 possession (Score: 54-79)
FOUL! Shooting foul on Michael Russell. Lamelo Simmons to the line for 2 free throws. [Team fouls: 4] (Michael Russell: 1 personal fouls)   FT 1/2: GOOD   FT 2/2: GOOD Lamelo Simmons makes 2/2 from the line.
Score: 56-79

[01:14] Team_061 possession (Score: 56-79)
Brandon Russell attempts a 3Pt. Contested by Jordan Anunoby (4.7 feet, ZONE). Brandon Russell misses. Rebound secured by DeMar Adebayo.

[00:56] Team_014 possession (Score: 56-79)
FOUL! Shooting foul on Draymond Banchero. Lamelo Simmons to the line for 2 free throws. [BONUS: 5 team fouls] (Draymond Banchero: 3 personal fouls)   FT 1/2: MISS   FT 2/2: GOOD Lamelo Simmons makes 1/2 from the line.
Score: 57-79

[00:40] Team_061 possession (Score: 57-79)
Bam Sexton makes the Layup and draws the foul on DeMar Adebayo! And-1! Bam Sexton to the line for 1. [BONUS: 6 team fouls] (DeMar Adebayo: 3 personal fouls)   FT 1/1: GOOD Bam Sexton makes 1/1 from the line.
Score: 57-82

[00:25] Team_014 possession (Score: 57-82)
DeMar Adebayo attempts a 3Pt. Contested by Brandon Russell (5.1 feet, ZONE). DEMAR ADEBAYO MAKES IT! Assist: Michael Cunningham
Score: 60-82

[00:11] Team_061 possession (Score: 60-82)
Brandon Russell attempts a Midrange. Wide open! Michael Cunningham is 9.1 feet away. [MAN] BRANDON RUSSELL MAKES IT! Assist: Draymond Banchero
Score: 60-84

================================================================================
                              3RD QUARTER COMPLETE                              
================================================================================

3RD QUARTER SCORE: Team_014 20, Team_061 24

BOX SCORE:
================================================================================

Team_014
--------------------------------------------------------------------------------
Player                MIN  PTS  REB  AST  TO      FG   FG%      3P   3P%
--------------------------------------------------------------------------------
Lamelo Simmons         26    9    0    0   0   5/6    83.3     0/0   0.0
DeMar Adebayo          26    5    3    1   0   2/5    40.0     0/0   0.0
Michael Cunningham     27    2    0    2   0   1/3    33.3     0/0   0.0
Ayo Murray             26    2    6    1   0   1/3    33.3     0/0   0.0
Jordan Anunoby         26    2    0    0   0   1/1   100.0     0/0   0.0

TEAM: FG: 10/18 (55.6%), 3PT: 1/4 (25.0%), REB: 9 (1 off, 8 def), AST: 4, TO: 3
TEAM FOULS: 6 [Team_061 in BONUS]


Team_061
--------------------------------------------------------------------------------
Player                MIN  PTS  REB  AST  TO      FG   FG%      3P   3P%
--------------------------------------------------------------------------------
Brandon Russell        26   12    0    0   0   5/7    71.4     0/0   0.0
Draymond Banchero      26    5    5    1   0   2/4    50.0     0/0   0.0
Bam Sexton             26    5    4    0   0   2/2   100.0     0/0   0.0
Jayson Holiday         26    2    0    2   0   1/4    25.0     0/0   0.0
Michael Russell        26    0    1    2   0   0/1     0.0     0/0   0.0

TEAM: FG: 10/18 (55.6%), 3PT: 1/5 (20.0%), REB: 10 (2 off, 8 def), AST: 5, TO: 3
TEAM FOULS: 5 [Team_014 in BONUS]

================================================================================

================================================================================
                       4TH QUARTER - Team_014 vs Team_061                       
================================================================================

[12:00] Substitution (Team_014): Michael Cunningham OUT (stamina: 71) → Jalen Booker IN (comeback_detected)

[12:00] Substitution (Team_061): Brandon Russell OUT (stamina: 73) → Evan Rose IN (comeback_detected)

[12:00] Team_014 possession (Score: 60-84)
DeMar Adebayo attempts a 3Pt. Contested by Michael Russell (3.6 feet, ZONE). DeMar Adebayo misses. Rebound secured by Draymond Banchero.

[11:51] Team_061 possession (Score: 60-84)
Jayson Holiday attempts a 3Pt. Contested by Jordan Anunoby (5.8 feet, ZONE). JAYSON HOLIDAY MAKES IT!
Score: 60-87

[11:38] Team_014 possession (Score: 60-87)
Ayo Murray commits a violation (traveling/carry)! TURNOVER! (dead ball)

[11:38] Substitution (Team_014): Jordan Anunoby OUT → Bones Quickley IN (stamina_rule2)

[11:38] Substitution (Team_014): Lamelo Simmons OUT → Tracy Westbrook IN (stamina_rule2)

[11:38] Substitution (Team_014): DeMar Adebayo OUT → Nikola James IN (stamina_rule2)

[11:38] Substitution (Team_014): Ayo Murray OUT → Collin Gasol IN (stamina_rule2)

[11:38] Substitution (Team_061): Jayson Holiday OUT → Gary Fox IN (stamina_rule2)

[11:38] Substitution (Team_061): Michael Russell OUT → Desmond Morant IN (stamina_rule2)

[11:28] Team_061 possession (Score: 60-87)
Evan Rose attempts a Layup. BLOCKED BY JALEN BOOKER! Ball is loose! Rebound secured by Collin Gasol.

[11:10] Team_014 possession (Score: 60-87)
Collin Gasol attempts a Layup. Heavily contested by Draymond Banchero (2.0 feet, ZONE)! COLLIN GASOL MAKES IT! Assist: Bones Quickley
Score: 62-87

[10:54] Team_061 possession (Score: 62-87)
Gary Fox attempts a Midrange. Wide open! Bones Quickley is 6.7 feet away. [MAN] GARY FOX MAKES IT! Assist: Evan Rose
Score: 62-89

[10:35] Team_014 possession (Score: 62-89)
Jalen Booker attempts a 3Pt. Contested by Desmond Morant (5.0 feet, ZONE). Jalen Booker misses. Rebound secured by Desmond Morant.

[10:19] Team_061 possession (Score: 62-89)
Desmond Morant drives, Collin Gasol stays with him. Desmond Morant attempts a Dunk. Heavily contested by Collin Gasol (1.3 feet, ZONE)! DESMOND MORANT MAKES IT! Assist: Draymond Banchero
Score: 62-91

[10:01] Team_014 possession (Score: 62-91)
Collin Gasol loses control! Ball rolls out of bounds! TURNOVER! (dead ball)

[10:01] Substitution (Team_061): Bam Sexton OUT → Stephen Towns IN (stamina_rule2)

[10:01] Substitution (Team_061): Draymond Banchero OUT → Tim Durant IN (stamina_rule2)

[09:44] Team_061 possession (Score: 62-91)
Desmond Morant drives and kicks out. Stephen Towns attempts a 3Pt. Contested by Nikola James (5.1 feet, MAN). STEPHEN TOWNS MAKES IT! Assist: Evan Rose
Score: 62-94

[09:32] Team_014 possession (Score: 62-94)
Bones Quickley attempts a Midrange. Wide open! Gary Fox is 7.6 feet away. [MAN] BONES QUICKLEY MAKES IT!
Score: 64-94

[09:18] Team_061 possession (Score: 64-94)
Desmond Morant throws a bad pass! Stolen by Tracy Westbrook! TURNOVER! (live ball)

[09:05] Team_014 possession (Score: 64-94)
Jalen Booker attempts a Midrange. Wide open! Stephen Towns is 7.1 feet away. [ZONE] Jalen Booker misses. Rebound secured by Tim Durant.

[08:51] Team_061 possession (Score: 64-94)
Stephen Towns attempts a Layup. Contested by Nikola James (3.4 feet, MAN). STEPHEN TOWNS MAKES IT! Assist: Desmond Morant
Score: 64-96

[08:39] Team_014 possession (Score: 64-96)
FOUL! Reach-in foul on Tim Durant during the drive. [Team fouls: 1] No free throws, side out. (Tim Durant: 1 personal fouls)

[08:25] Team_014 possession (Score: 64-96)
FOUL! Shooting foul on Tim Durant. Bones Quickley to the line for 2 free throws. [Team fouls: 2] (Tim Durant: 2 personal fouls)   FT 1/2: GOOD   FT 2/2: GOOD Bones Quickley makes 2/2 from the line.
Score: 66-96

[08:15] Team_061 possession (Score: 66-96)
Evan Rose attempts a 3Pt. Contested by Jalen Booker (2.6 feet, ZONE). EVAN ROSE MAKES IT!
Score: 66-99

[07:56] Team_014 possession (Score: 66-99)
Collin Gasol attempts a Layup. Heavily contested by Tim Durant (1.0 feet, MAN)! Collin Gasol misses. Rebound secured by Tim Durant.

[07:42] Team_061 possession (Score: 66-99)
Stephen Towns drives to the basket... Stephen Towns throws a bad pass! Stolen by Collin Gasol! TURNOVER! (live ball)

[07:28] Team_014 possession (Score: 66-99)
Tracy Westbrook attempts a 3Pt. Contested by Stephen Towns (5.1 feet, ZONE). Tracy Westbrook misses. Rebound secured by Tim Durant.

[07:18] Team_061 possession (Score: 66-99)
Desmond Morant drives, picks up Collin Gasol. Help arrives from Jalen Booker! Desmond Morant attempts a Layup. Contested by Jalen Booker (4.7 feet, ZONE). DESMOND MORANT MAKES IT!
Score: 66-101

[07:06] Team_014 possession (Score: 66-101)
Tracy Westbrook attempts a Midrange. Heavily contested by Desmond Morant (0.8 feet, MAN)! Tracy Westbrook misses. FOUL! Loose ball foul on Tim Durant during the rebound battle. [Team fouls: 3] No free throws, side out. (Tim Durant: 3 personal fouls)

[06:52] Team_014 possession (Score: 66-101)
Nikola James attempts a Midrange. Contested by Stephen Towns (4.8 feet, ZONE). Nikola James misses. Rebound secured by Stephen Towns.

[06:42] Team_061 possession (Score: 66-101)
Evan Rose attempts a Midrange. Contested by Jalen Booker (2.7 feet, MAN). Evan Rose misses. Rebound secured by Collin Gasol.

[06:26] Team_014 possession (Score: 66-101)
Bones Quickley attempts a Midrange. Contested by Gary Fox (3.3 feet, MAN). Bones Quickley misses. Rebound secured by Stephen Towns.

[06:10] Team_061 possession (Score: 66-101)
FOUL! Shooting foul on Collin Gasol. Tim Durant to the line for 2 free throws. [Team fouls: 1] (Collin Gasol: 1 personal fouls)   FT 1/2: MISS   FT 2/2: GOOD Tim Durant makes 1/2 from the line.
Score: 66-102

[05:56] Team_014 possession (Score: 66-102)
FOUL! Shooting foul on Desmond Morant. Bones Quickley to the line for 3 free throws. [Team fouls: 4] (Desmond Morant: 1 personal fouls)   FT 1/3: GOOD   FT 2/3: MISS   FT 3/3: GOOD Bones Quickley makes 2/3 from the line.
Score: 68-102

[05:42] Team_061 possession (Score: 68-102)
Evan Rose drives, Collin Gasol stays with him. Evan Rose attempts a Dunk. Contested by Collin Gasol (5.7 feet, ZONE). EVAN ROSE MAKES IT! Assist: Stephen Towns
Score: 68-104

[05:29] Team_014 possession (Score: 68-104)
Collin Gasol attempts a Layup. Contested by Tim Durant (5.5 feet, ZONE). COLLIN GASOL MAKES IT!
Score: 70-104

[05:11] Team_061 possession (Score: 70-104)
Gary Fox attempts a 3Pt. Contested by Bones Quickley (5.1 feet, MAN). Gary Fox misses. Rebound secured by Nikola James.

[04:57] Team_014 possession (Score: 70-104)
Bones Quickley attempts a Layup. BLOCKED BY GARY FOX! Ball is loose! Rebound secured by Desmond Morant.

[04:44] Team_061 possession (Score: 70-104)
Evan Rose attempts a Midrange. Contested by Jalen Booker (3.0 feet, MAN). Evan Rose misses. Offensive rebound by Stephen Towns! Stephen Towns kicks it out.

[04:33] Team_061 possession (Score: 70-104)
Stephen Towns attempts a Midrange. Wide open! Nikola James is 6.6 feet away. [MAN] STEPHEN TOWNS MAKES IT! Assist: Tim Durant
Score: 70-106

[04:16] Team_014 possession (Score: 70-106)
Bones Quickley drives and kicks out. Tracy Westbrook attempts a 3Pt. Contested by Desmond Morant (5.9 feet, MAN). Tracy Westbrook misses. Rebound secured by Tim Durant.

[03:57] Team_061 possession (Score: 70-106)
FOUL! Shooting foul on Jalen Booker. Gary Fox to the line for 3 free throws. [Team fouls: 2] (Jalen Booker: 1 personal fouls)   FT 1/3: MISS   FT 2/3: MISS   FT 3/3: GOOD Gary Fox makes 1/3 from the line.
Score: 70-107

[03:46] Team_014 possession (Score: 70-107)
Bones Quickley drives to the basket... Bones Quickley throws a bad pass out of bounds! TURNOVER! (dead ball)

[03:29] Team_061 possession (Score: 70-107)
Gary Fox attempts a Layup. Wide open! Bones Quickley is 6.2 feet away. [MAN] GARY FOX MAKES IT!
Score: 70-109

[03:12] Team_014 possession (Score: 70-109)
Collin Gasol makes the Dunk and draws the foul on Tim Durant! And-1! Collin Gasol to the line for 1. [BONUS: 5 team fouls] (Tim Durant: 4 personal fouls)   FT 1/1: MISS Collin Gasol makes 0/1 from the line. Rebound secured by Tim Durant.
Score: 72-109

[02:57] Team_061 possession (Score: 72-109)
Tim Durant drives and kicks out. Tim Durant attempts a Midrange. Contested by Tracy Westbrook (4.5 feet, ZONE). Tim Durant misses. Rebound secured by Nikola James.

[02:41] Team_014 possession (Score: 72-109)
FOUL! Shooting foul on Gary Fox. Bones Quickley to the line for 2 free throws. [BONUS: 6 team fouls] (Gary Fox: 1 personal fouls)   FT 1/2: GOOD   FT 2/2: GOOD Bones Quickley makes 2/2 from the line.
Score: 74-109

[02:27] Team_061 possession (Score: 74-109)
Tim Durant attempts a Midrange. Contested by Collin Gasol (5.7 feet, MAN). TIM DURANT MAKES IT!
Score: 74-111

[02:12] Team_014 possession (Score: 74-111)
Bones Quickley attempts a 3Pt. Wide open! Gary Fox is 6.1 feet away. [MAN] Bones Quickley misses. Rebound secured by Tim Durant.

[01:59] Team_061 possession (Score: 74-111)
FOUL! Reach-in foul on Collin Gasol during the drive. [Team fouls: 3] No free throws, side out. (Collin Gasol: 2 personal fouls)

[01:43] Team_061 possession (Score: 74-111)
FOUL! Shooting foul on Collin Gasol. Evan Rose to the line for 2 free throws. [Team fouls: 4] (Collin Gasol: 3 personal fouls)   FT 1/2: GOOD   FT 2/2: MISS Evan Rose makes 1/2 from the line. Rebound secured by Nikola James.
Score: 74-112

[01:24] Team_014 possession (Score: 74-112)
Bones Quickley attempts a 3Pt. Wide open! Desmond Morant is 6.3 feet away. [ZONE] Bones Quickley misses. FOUL! Loose ball foul on Tim Durant during the rebound battle. [IN THE BONUS! 7 team fouls] Nikola James to the line for 2 free throws. (Tim Durant: 5 personal fouls)   FT 1/2: GOOD   FT 2/2: GOOD Nikola James makes 2/2 from the line.
Score: 76-112

[01:06] Team_061 possession (Score: 76-112)
Evan Rose attempts a Midrange. Contested by Jalen Booker (3.9 feet, MAN). EVAN ROSE MAKES IT!
Score: 76-114

[00:50] Team_014 possession (Score: 76-114)
Tracy Westbrook attempts a Layup. Contested by Desmond Morant (2.9 feet, MAN). Tracy Westbrook misses. Rebound secured by Desmond Morant.

[00:37] Team_061 possession (Score: 76-114)
Stephen Towns attempts a Midrange. Contested by Bones Quickley (4.2 feet, ZONE). Stephen Towns misses. Rebound secured by Tracy Westbrook.

[00:23] Team_014 possession (Score: 76-114)
Jalen Booker drives and kicks out. Tracy Westbrook attempts a 3Pt. Contested by Desmond Morant (3.0 feet, ZONE). TRACY WESTBROOK MAKES IT! Assist: Jalen Booker
Score: 79-114

[00:06] Team_061 possession (Score: 79-114)
Evan Rose makes the Layup and draws the foul on Bones Quickley! And-1! Evan Rose to the line for 1. [BONUS: 5 team fouls] (Bones Quickley: 1 personal fouls)   FT 1/1: GOOD Evan Rose makes 1/1 from the line.
Score: 79-117

================================================================================
                              4TH QUARTER COMPLETE                              
================================================================================

4TH QUARTER SCORE: Team_014 19, Team_061 33

BOX SCORE:
================================================================================

Team_014
--------------------------------------------------------------------------------
Player                MIN  PTS  REB  AST  TO      FG   FG%      3P   3P%
--------------------------------------------------------------------------------
Bones Quickley         22    8    0    1   0   4/8    50.0     0/0   0.0
Collin Gasol           21    4    3    0   0   2/4    50.0     0/0   0.0
Tracy Westbrook        22    3    1    0   0   1/3    33.3     0/0   0.0
Nikola James           22    2    3    0   0   1/2    50.0     0/0   0.0
DeMar Adebayo          27    0    0    0   0   0/1     0.0     0/0   0.0
Jalen Booker           23    0    0    1   0   0/2     0.0     0/0   0.0

TEAM: FG: 8/20 (40.0%), 3PT: 2/6 (33.3%), REB: 7 (1 off, 6 def), AST: 2, TO: 3
TEAM FOULS: 5 [Team_061 in BONUS]


Team_061
--------------------------------------------------------------------------------
Player                MIN  PTS  REB  AST  TO      FG   FG%      3P   3P%
--------------------------------------------------------------------------------
Evan Rose              23   10    0    2   0   4/7    57.1     0/0   0.0
Stephen Towns          20    7    3    1   0   3/4    75.0     0/0   0.0
Gary Fox               22    5    0    0   0   3/4    75.0     0/0   0.0
Desmond Morant         22    4    3    1   0   2/2   100.0     0/0   0.0
Jayson Holiday         27    3    0    0   0   1/1   100.0     0/0   0.0
Tim Durant             20    3    6    1   0   2/3    66.7     0/0   0.0
Draymond Banchero      28    0    1    1   0   0/0     0.0     0/0   0.0

TEAM: FG: 15/21 (71.4%), 3PT: 3/4 (75.0%), REB: 13 (1 off, 12 def), AST: 6, TO: 2
TEAM FOULS: 7 [Team_014 in BONUS]

================================================================================

================================================================================
                               FULL GAME COMPLETE                               
================================================================================

FINAL SCORE: Team_014 79, Team_061 117

SCORING BY QUARTER:
--------------------------------------------------------------------------------
Team                     Q1     Q2     Q3     Q4    FINAL
--------------------------------------------------------------------------------
Team_014                 26     14     20     19       79
Team_061                 28     32     24     33      117
--------------------------------------------------------------------------------

FULL GAME BOX SCORE:
================================================================================

Team_014
--------------------------------------------------------------------------------
Player                MIN  PTS  REB  AST  TO      FG   FG%      3P   3P%      FT STL BLK
--------------------------------------------------------------------------------
Michael Cunningham     27   12    4    4   0   5/10   50.0   2/6    33.3   0/0     0   0
Jordan Anunoby         27    4    0    1   2   3/4    75.0   0/0     0.0   0/0     1   1
Lamelo Simmons         27   15    0    1   2   6/10   60.0   1/2    50.0   6/8     0   1
DeMar Adebayo          27    8    5    2   2   3/10   30.0   2/5    40.0   0/0     0   4
Ayo Murray             27    9   10    1   2   4/9    44.4   0/1     0.0   3/3     1   0
Jalen Booker           23    2    0    2   0   2/5    40.0   0/1     0.0   2/2     0   1
Bones Quickley         22   11    0    3   2   6/11   54.5   3/5    60.0   6/7     0   0
Tracy Westbrook        22    5    5    1   1   1/5    20.0   0/2     0.0   0/0     1   0
Nikola James           22    4    8    0   2   1/3    33.3   0/0     0.0   2/2     1   0
Collin Gasol           21    7    4    1   3   3/8    37.5   1/2    50.0   0/1     1   0

TEAM: FG: 34/75 (45.3%), 3PT: 9/24 (37.5%), REB: 34 (5 off, 29 def), AST: 16, TO: 16


Team_061
--------------------------------------------------------------------------------
Player                MIN  PTS  REB  AST  TO      FG   FG%      3P   3P%      FT STL BLK
--------------------------------------------------------------------------------
Bam Sexton             28   13    9    0   1   4/7    57.1   1/1   100.0   2/2     0   0
Draymond Banchero      28   10   10    3   2   4/8    50.0   0/1     0.0   1/1     1   3
Jayson Holiday         27   14    0    2   2   4/9    44.4   1/3    33.3   4/4     0   0
Michael Russell        27    5    6    4   0   4/7    57.1   0/2     0.0   1/1     0   0
Brandon Russell        26   20    0    0   0   9/12   75.0   1/2    50.0   3/3     0   0
Evan Rose              23   10    0    3   0   5/9    55.6   1/2    50.0   2/3     0   1
Gary Fox               22   15    0    0   1   6/8    75.0   2/4    50.0   2/6     1   1
Desmond Morant         22    6    5    1   1   4/6    66.7   0/2     0.0   0/0     0   0
Stephen Towns          20   13    7    1   2   4/6    66.7   0/0     0.0   2/2     1   0
Tim Durant             20   10    9    2   0   5/9    55.6   0/0     0.0   4/5     1   2

TEAM: FG: 49/81 (60.5%), 3PT: 6/17 (35.3%), REB: 48 (7 off, 41 def), AST: 16, TO: 9

================================================================================
