================================================================================
                        FULL GAME - Team_061 vs Team_072                        
================================================================================

================================================================================
                       1ST QUARTER - Team_061 vs Team_072                       
================================================================================

[12:00] Team_061 possession (Score: 0-0)
Brandon Russell attempts a Midrange. Wide open! Collin Griffin is 6.2 feet away. [MAN] Brandon Russell misses. Offensive rebound by Michael Russell! Michael Russell's putback is no good. Rebound secured by Wendell Anthony.

[11:49] Team_072 possession (Score: 0-0)
Tyrese Williamson drives, picks up Draymond Banchero. Help arrives from Jayson Holiday! Tyrese Williamson attempts a Dunk. Heavily contested by Jayson Holiday (0.5 feet, ZONE)! TYRESE WILLIAMSON MAKES IT! Assist: Wendell Anthony
Score: 0-2

[11:38] Team_061 possession (Score: 0-2)
Draymond Banchero drives and kicks out. Michael Russell attempts a Midrange. Contested by Cade Poole (4.2 feet, ZONE). MICHAEL RUSSELL MAKES IT! Assist: Brandon Russell
Score: 2-2

[11:28] Team_072 possession (Score: 2-2)
Wendell Anthony attempts a 3Pt. Heavily contested by Brandon Russell (1.1 feet, ZONE)! WENDELL ANTHONY MAKES IT! Assist: Collin Griffin
Score: 2-5

[11:18] Team_061 possession (Score: 2-5)
Michael Russell drives and kicks out. Michael Russell attempts a Midrange. Wide open! Wendell Anthony is 7.9 feet away. [MAN] Michael Russell misses. Rebound secured by Wendell Anthony.

[11:01] Team_072 possession (Score: 2-5)
Tyrese Williamson makes the Dunk and draws the foul on Draymond Banchero! And-1! Tyrese Williamson to the line for 1. [Team fouls: 1] (Draymond Banchero: 1 personal fouls)   FT 1/1: GOOD Tyrese Williamson makes 1/1 from the line.
Score: 2-8

[10:47] Team_061 possession (Score: 2-8)
Bam Sexton makes the Layup and draws the foul on Tyrese Williamson! And-1! Bam Sexton to the line for 1. [Team fouls: 1] (Tyrese Williamson: 1 personal fouls)   FT 1/1: GOOD Bam Sexton makes 1/1 from the line.
Score: 5-8

[10:32] Team_072 possession (Score: 5-8)
Tracy Giddey attempts a Midrange. Wide open! Bam Sexton is 8.7 feet away. [MAN] Tracy Giddey misses. Offensive rebound by Tyrese Williamson! Tyrese Williamson kicks it out.

[10:23] Team_072 possession (Score: 5-8)
Cade Poole drives to the basket... Cade Poole loses the ball! Stripped by Draymond Banchero! TURNOVER! (live ball)

[10:08] Team_061 possession (Score: 5-8)
Bam Sexton attempts a Midrange. Wide open! Wendell Anthony is 8.1 feet away. [ZONE] BAM SEXTON MAKES IT!
Score: 7-8

[09:57] Team_072 possession (Score: 7-8)
Tracy Giddey commits a violation (traveling/carry)! TURNOVER! (dead ball)

[09:40] Team_061 possession (Score: 7-8)
Michael Russell drives and kicks out. Jayson Holiday attempts a 3Pt. Contested by Cade Poole (4.1 feet, ZONE). JAYSON HOLIDAY MAKES IT! Assist: Bam Sexton
Score: 10-8

[09:26] Team_072 possession (Score: 10-8)
Tracy Giddey drives and kicks out. Cade Poole attempts a Midrange. Contested by Jayson Holiday (5.2 feet, MAN). CADE POOLE MAKES IT!
Score: 10-10

[09:14] Team_061 possession (Score: 10-10)
Jayson Holiday attempts a Midrange. Contested by Collin Griffin (5.3 feet, ZONE). Jayson Holiday misses. Rebound secured by Tyrese Williamson.

[09:01] Team_072 possession (Score: 10-10)
Wendell Anthony attempts a 3Pt. Heavily contested by Brandon Russell (2.0 feet, ZONE)! Wendell Anthony misses. FOUL! Loose ball foul on Michael Russell during the rebound battle. [Team fouls: 2] No free throws, side out. (Michael Russell: 1 personal fouls)

[08:49] Team_072 possession (Score: 10-10)
Tracy Giddey attempts a Midrange. Contested by Bam Sexton (4.3 feet, MAN). TRACY GIDDEY MAKES IT! Assist: Cade Poole
Score: 10-12

[08:35] Team_061 possession (Score: 10-12)
Brandon Russell attempts a 3Pt. Contested by Collin Griffin (5.9 feet, ZONE). Brandon Russell misses. Rebound secured by Tyrese Williamson.

[08:18] Team_072 possession (Score: 10-12)
Tracy Giddey drives to the basket... Tracy Giddey commits a violation (traveling/carry)! TURNOVER! (dead ball)

[08:04] Team_061 possession (Score: 10-12)
FOUL! Holding foul on Collin Griffin. [Team fouls: 2] No free throws, side out. (Collin Griffin: 1 personal fouls)

[07:46] Team_061 possession (Score: 10-12)
FOUL! Shooting foul on Wendell Anthony. Michael Russell to the line for 2 free throws. [Team fouls: 3] (Wendell Anthony: 1 personal fouls)   FT 1/2: GOOD   FT 2/2: GOOD Michael Russell makes 2/2 from the line.
Score: 12-12

[07:30] Team_072 possession (Score: 12-12)
Wendell Anthony drives, Draymond Banchero stays with him. Wendell Anthony attempts a Dunk. Heavily contested by Draymond Banchero (0.5 feet, ZONE)! WENDELL ANTHONY MAKES IT! Assist: Cade Poole
Score: 12-14

[07:17] Team_061 possession (Score: 12-14)
Draymond Banchero drives to the basket... Draymond Banchero loses the ball! Stripped by Tyrese Williamson! TURNOVER! (live ball)

[07:02] Team_072 possession (Score: 12-14)
Wendell Anthony drives to the basket... FOUL! Offensive foul on Wendell Anthony! Michael Russell drew the charge! [Team fouls: 4] (Wendell Anthony: 2 personal fouls) TURNOVER! (dead ball)

[06:47] Team_061 possession (Score: 12-14)
FOUL! Shooting foul on Wendell Anthony. Bam Sexton to the line for 2 free throws. [BONUS: 5 team fouls] (Wendell Anthony: 3 personal fouls)   FT 1/2: GOOD   FT 2/2: MISS Bam Sexton makes 1/2 from the line. Rebound secured by Tyrese Williamson.
Score: 13-14

[06:31] Team_072 possession (Score: 13-14)
Tyrese Williamson drives, Draymond Banchero stays with him. Tyrese Williamson attempts a Dunk. Contested by Draymond Banchero (2.4 feet, ZONE). TYRESE WILLIAMSON MAKES IT! Assist: Wendell Anthony
Score: 13-16

[06:16] Team_061 possession (Score: 13-16)
Bam Sexton drives and kicks out. Brandon Russell attempts a Midrange. Heavily contested by Wendell Anthony (1.2 feet, ZONE)! BRANDON RUSSELL MAKES IT!
Score: 15-16

[06:00] Team_072 possession (Score: 15-16)
Tyrese Williamson makes the Layup and draws the foul on Draymond Banchero! And-1! Tyrese Williamson to the line for 1. [Team fouls: 3] (Draymond Banchero: 2 personal fouls)   FT 1/1: GOOD Tyrese Williamson makes 1/1 from the line.
Score: 15-19

[05:45] Team_061 possession (Score: 15-19)
Jayson Holiday makes the 3Pt and draws the foul on Cade Poole! And-1! Jayson Holiday to the line for 1. [BONUS: 6 team fouls] (Cade Poole: 1 personal fouls)   FT 1/1: GOOD Jayson Holiday makes 1/1 from the line.
Score: 19-19

[05:31] Team_072 possession (Score: 19-19)
Collin Griffin attempts a 3Pt. Contested by Brandon Russell (2.4 feet, ZONE). COLLIN GRIFFIN MAKES IT! Assist: Tyrese Williamson
Score: 19-22

[05:15] Team_061 possession (Score: 19-22)
Brandon Russell attempts a Midrange. Contested by Wendell Anthony (5.8 feet, ZONE). BRANDON RUSSELL MAKES IT!
Score: 21-22

[04:57] Team_072 possession (Score: 21-22)
Collin Griffin attempts a Midrange. Contested by Michael Russell (3.7 feet, ZONE). Collin Griffin misses. Rebound secured by Draymond Banchero.

[04:45] Team_061 possession (Score: 21-22)
Brandon Russell throws a bad pass! Stolen by Collin Griffin! TURNOVER! (live ball)

[04:31] Team_072 possession (Score: 21-22)
Wendell Anthony attempts a 3Pt. Contested by Michael Russell (3.0 feet, MAN). Wendell Anthony misses. Offensive rebound by Tyrese Williamson! Tyrese Williamson kicks it out.

[04:17] Team_072 possession (Score: 21-22)
Cade Poole attempts a 3Pt. Contested by Brandon Russell (3.8 feet, ZONE). Cade Poole misses. Rebound secured by Bam Sexton.

[04:05] Team_061 possession (Score: 21-22)
Brandon Russell loses the ball! Stripped by Collin Griffin! TURNOVER! (live ball)

[03:48] Team_072 possession (Score: 21-22)
FOUL! Shooting foul on Michael Russell. Wendell Anthony to the line for 2 free throws. [Team fouls: 4] (Michael Russell: 2 personal fouls)   FT 1/2: GOOD   FT 2/2: MISS Wendell Anthony makes 1/2 from the line. Rebound secured by Bam Sexton.
Score: 21-23

[03:31] Team_061 possession (Score: 21-23)
Michael Russell attempts a 3Pt. Contested by Wendell Anthony (5.0 feet, ZONE). Michael Russell misses. FOUL! Loose ball foul on Tracy Giddey during the rebound battle. [IN THE BONUS! 7 team fouls] Michael Russell to the line for 2 free throws. (Tracy Giddey: 1 personal fouls)   FT 1/2: GOOD   FT 2/2: GOOD Michael Russell makes 2/2 from the line.
Score: 23-23

[03:17] Team_072 possession (Score: 23-23)
Cade Poole drives and kicks out. Wendell Anthony attempts a Midrange. Contested by Brandon Russell (3.9 feet, ZONE). Wendell Anthony misses. Rebound secured by Bam Sexton.

[02:59] Team_061 possession (Score: 23-23)
Bam Sexton attempts a Midrange. Contested by Cade Poole (5.2 feet, ZONE). BAM SEXTON MAKES IT! Assist: Michael Russell
Score: 25-23

[02:43] Team_072 possession (Score: 25-23)
Collin Griffin attempts a Midrange. Contested by Draymond Banchero (4.9 feet, ZONE). Collin Griffin misses. Rebound secured by Draymond Banchero.

[02:24] Team_061 possession (Score: 25-23)
Brandon Russell attempts a Midrange. Contested by Collin Griffin (3.9 feet, MAN). Brandon Russell misses. FOUL! Loose ball foul on Wendell Anthony during the rebound battle. [IN THE BONUS! 8 team fouls] Michael Russell to the line for 2 free throws. (Wendell Anthony: 4 personal fouls)   FT 1/2: GOOD   FT 2/2: GOOD Michael Russell makes 2/2 from the line.
Score: 27-23

[02:08] Team_072 possession (Score: 27-23)
Wendell Anthony attempts a 3Pt. Wide open! Michael Russell is 8.6 feet away. [MAN] Wendell Anthony misses. Rebound secured by Bam Sexton.

[01:58] Team_061 possession (Score: 27-23)
Jayson Holiday drives, picks up Tyrese Williamson. Help arrives from Collin Griffin! Jayson Holiday attempts a Dunk. Contested by Collin Griffin (2.3 feet, ZONE). JAYSON HOLIDAY MAKES IT! Assist: Draymond Banchero
Score: 29-23

[01:44] Team_072 possession (Score: 29-23)
FOUL! Reach-in foul on Draymond Banchero during the drive. [IN THE BONUS! 5 team fouls] Tracy Giddey to the line for 2 free throws. (Draymond Banchero: 3 personal fouls)   FT 1/2: GOOD   FT 2/2: MISS Tracy Giddey makes 1/2 from the line. Rebound secured by Draymond Banchero.
Score: 29-24

[01:28] Team_061 possession (Score: 29-24)
Jayson Holiday attempts a Midrange. Wide open! Tyrese Williamson is 6.1 feet away. [ZONE] Jayson Holiday misses. Rebound secured by Wendell Anthony.

[01:19] Team_072 possession (Score: 29-24)
Tyrese Williamson attempts a Midrange. Contested by Bam Sexton (5.0 feet, ZONE). Tyrese Williamson misses. Rebound secured by Michael Russell.

[01:06] Team_061 possession (Score: 29-24)
FOUL! Shooting foul on Wendell Anthony. Brandon Russell to the line for 2 free throws. [BONUS: 9 team fouls] (Wendell Anthony: 5 personal fouls)   FT 1/2: GOOD   FT 2/2: GOOD Brandon Russell makes 2/2 from the line.
Score: 31-24

[00:54] Team_072 possession (Score: 31-24)
Cade Poole attempts a Midrange. Wide open! Bam Sexton is 9.5 feet away. [ZONE] Cade Poole misses. Rebound secured by Draymond Banchero.

[00:40] Team_061 possession (Score: 31-24)
Brandon Russell attempts a 3Pt. Contested by Collin Griffin (5.3 feet, MAN). BRANDON RUSSELL MAKES IT! Assist: Bam Sexton
Score: 34-24

[00:26] Team_072 possession (Score: 34-24)
Tyrese Williamson attempts a Midrange. Contested by Bam Sexton (4.2 feet, ZONE). Tyrese Williamson misses. Rebound secured by Michael Russell.

[00:09] Team_061 possession (Score: 34-24)
Michael Russell attempts a 3Pt. Contested by Tracy Giddey (5.8 feet, ZONE). Michael Russell misses. Rebound secured by Tyrese Williamson.

================================================================================
                              1ST QUARTER COMPLETE                              
================================================================================

1ST QUARTER SCORE: Team_061 34, Team_072 24

BOX SCORE:
================================================================================

Team_061
--------------------------------------------------------------------------------
Player                MIN  PTS  REB  AST  TO      FG   FG%      3P   3P%
--------------------------------------------------------------------------------
Brandon Russell        12    9    0    1   0   4/6    66.7     0/0   0.0
Jayson Holiday         12    9    0    0   0   3/5    60.0     0/0   0.0
Michael Russell        12    8    2    1   0   4/6    66.7     0/0   0.0
Bam Sexton             12    7    4    2   0   3/4    75.0     0/0   0.0
Draymond Banchero      12    0    4    1   0   0/0     0.0     0/0   0.0

TEAM: FG: 14/21 (66.7%), 3PT: 3/5 (60.0%), REB: 11 (1 off, 10 def), AST: 5, TO: 3
TEAM FOULS: 5 [Team_072 in BONUS]


Team_072
--------------------------------------------------------------------------------
Player                MIN  PTS  REB  AST  TO      FG   FG%      3P   3P%
--------------------------------------------------------------------------------
Tyrese Williamson      12   10    6    1   0   4/6    66.7     0/0   0.0
Wendell Anthony        12    5    3    2   0   2/4    50.0     0/0   0.0
Collin Griffin         12    3    0    1   0   1/3    33.3     0/0   0.0
Cade Poole             12    2    0    2   0   1/4    25.0     0/0   0.0
Tracy Giddey           12    2    1    0   0   1/2    50.0     0/0   0.0

TEAM: FG: 9/19 (47.4%), 3PT: 2/4 (50.0%), REB: 9 (3 off, 6 def), AST: 6, TO: 4
TEAM FOULS: 9 [Team_061 in BONUS]

================================================================================

================================================================================
                       2ND QUARTER - Team_061 vs Team_072                       
================================================================================

[12:00] Team_061 possession (Score: 34-24)
Brandon Russell attempts a 3Pt. Heavily contested by Cade Poole (0.7 feet, ZONE)! Brandon Russell misses. Rebound secured by Tracy Giddey.

[11:49] Team_072 possession (Score: 34-24)
Collin Griffin drives and kicks out. Collin Griffin attempts a 3Pt. Contested by Brandon Russell (3.9 feet, MAN). Collin Griffin misses. Rebound secured by Michael Russell.

[11:33] Team_061 possession (Score: 34-24)
Michael Russell attempts a 3Pt. Contested by Wendell Anthony (4.5 feet, MAN). Michael Russell misses. Offensive rebound by Michael Russell! Michael Russell puts it back in!
Score: 36-24

[11:23] Team_072 possession (Score: 36-24)
Collin Griffin drives and kicks out. Collin Griffin attempts a 3Pt. Heavily contested by Brandon Russell (1.0 feet, ZONE)! Collin Griffin misses. Rebound secured by Michael Russell.

[11:10] Team_061 possession (Score: 36-24)
Michael Russell drives to the basket... Michael Russell throws a bad pass out of bounds! TURNOVER! (dead ball)

[11:10] Substitution (Team_061): Brandon Russell OUT → Evan Rose IN (stamina_rule2)

[11:10] Substitution (Team_061): Jayson Holiday OUT → Gary Fox IN (stamina_rule2)

[11:10] Substitution (Team_061): Michael Russell OUT → Desmond Morant IN (stamina_rule2)

[11:10] Substitution (Team_061): Bam Sexton OUT → Stephen Towns IN (stamina_rule2)

[11:10] Substitution (Team_061): Draymond Banchero OUT → Tim Durant IN (stamina_rule2)

[11:10] Substitution (Team_072): Collin Griffin OUT → Giannis Gobert IN (stamina_rule2)

[11:10] Substitution (Team_072): Cade Poole OUT → CJ Jokic IN (stamina_rule2)

[11:10] Substitution (Team_072): Wendell Anthony OUT → CJ Bane IN (stamina_rule2)

[11:10] Substitution (Team_072): Tracy Giddey OUT → Brandon Durant IN (stamina_rule2)

[11:10] Substitution (Team_072): Tyrese Williamson OUT → Stephen Holiday IN (stamina_rule2)

[10:59] Team_072 possession (Score: 36-24)
Giannis Gobert attempts a 3Pt. Contested by Evan Rose (3.7 feet, MAN). Giannis Gobert misses. Rebound secured by Desmond Morant.

[10:46] Team_061 possession (Score: 36-24)
Desmond Morant attempts a 3Pt. Contested by CJ Bane (4.0 feet, MAN). Desmond Morant misses. Offensive rebound by Tim Durant! Tim Durant puts it back in!
Score: 38-24

[10:27] Team_072 possession (Score: 38-24)
CJ Jokic attempts a 3Pt. Contested by Desmond Morant (5.0 feet, ZONE). CJ JOKIC MAKES IT! Assist: Brandon Durant
Score: 38-27

[10:15] Team_061 possession (Score: 38-27)
Gary Fox drives, CJ Jokic stays with him. Gary Fox attempts a Layup. Contested by CJ Jokic (3.4 feet, MAN). Gary Fox misses. Offensive rebound by Stephen Towns! Stephen Towns kicks it out.

[09:59] Team_061 possession (Score: 38-27)
Evan Rose attempts a Midrange. Heavily contested by CJ Bane (1.9 feet, ZONE)! EVAN ROSE MAKES IT! Assist: Gary Fox
Score: 40-27

[09:47] Team_072 possession (Score: 40-27)
Brandon Durant drives to the basket... Brandon Durant throws a bad pass! Stolen by Stephen Towns! TURNOVER! (live ball)

[09:36] Team_061 possession (Score: 40-27)
Gary Fox loses the ball! Stripped by CJ Jokic! TURNOVER! (live ball)

[09:20] Team_072 possession (Score: 40-27)
CJ Bane attempts a Layup. Heavily contested by Desmond Morant (0.5 feet, MAN)! CJ BANE MAKES IT! Assist: Stephen Holiday
Score: 40-29

[09:07] Team_061 possession (Score: 40-29)
Evan Rose attempts a Midrange. Contested by Giannis Gobert (4.9 feet, MAN). Evan Rose misses. Rebound secured by Stephen Holiday.

[08:55] Team_072 possession (Score: 40-29)
CJ Bane makes the 3Pt and draws the foul on Desmond Morant! And-1! CJ Bane to the line for 1. [Team fouls: 1] (Desmond Morant: 1 personal fouls)   FT 1/1: GOOD CJ Bane makes 1/1 from the line.
Score: 40-33

[08:37] Team_061 possession (Score: 40-33)
Evan Rose attempts a 3Pt. Contested by Giannis Gobert (5.3 feet, MAN). EVAN ROSE MAKES IT!
Score: 43-33

[08:21] Team_072 possession (Score: 43-33)
Stephen Holiday attempts a Layup. Contested by Tim Durant (3.9 feet, MAN). STEPHEN HOLIDAY MAKES IT!
Score: 43-35

[08:10] Team_061 possession (Score: 43-35)
Stephen Towns drives, picks up Stephen Holiday. Help arrives from Giannis Gobert! Stephen Towns attempts a Dunk. Wide open! Giannis Gobert is 8.2 feet away. [ZONE] Stephen Towns misses. Rebound secured by Brandon Durant.

[07:57] Team_072 possession (Score: 43-35)
Brandon Durant drives, Stephen Towns stays with him. Brandon Durant attempts a Dunk. Contested by Stephen Towns (3.7 feet, MAN). Brandon Durant misses. Offensive rebound by Brandon Durant! Brandon Durant kicks it out.

[07:41] Team_072 possession (Score: 43-35)
Brandon Durant attempts a 3Pt. Contested by Stephen Towns (3.7 feet, MAN). BRANDON DURANT MAKES IT! Assist: Stephen Holiday
Score: 43-38

[07:28] Team_061 possession (Score: 43-38)
Stephen Towns drives and kicks out. Stephen Towns attempts a Midrange. Wide open! Brandon Durant is 6.9 feet away. [MAN] STEPHEN TOWNS MAKES IT! Assist: Evan Rose
Score: 45-38

[07:14] Team_072 possession (Score: 45-38)
FOUL! Reach-in foul on Evan Rose during the drive. [Team fouls: 2] No free throws, side out. (Evan Rose: 1 personal fouls)

[06:59] Team_072 possession (Score: 45-38)
FOUL! Shooting foul on Desmond Morant. CJ Bane to the line for 3 free throws. [Team fouls: 3] (Desmond Morant: 2 personal fouls)   FT 1/3: GOOD   FT 2/3: GOOD   FT 3/3: MISS CJ Bane makes 2/3 from the line. Offensive rebound by Stephen Holiday! Stephen Holiday kicks it out.
Score: 45-40

[06:44] Team_072 possession (Score: 45-40)
Stephen Holiday attempts a Midrange. Wide open! Gary Fox is 7.1 feet away. [ZONE] STEPHEN HOLIDAY MAKES IT! Assist: Giannis Gobert
Score: 45-42

[06:28] Team_061 possession (Score: 45-42)
Desmond Morant attempts a 3Pt. Wide open! CJ Bane is 6.9 feet away. [MAN] DESMOND MORANT MAKES IT!
Score: 48-42

[06:10] Team_072 possession (Score: 48-42)
Giannis Gobert attempts a Layup. BLOCKED BY TIM DURANT! Ball is loose! Rebound secured by Desmond Morant.

[05:57] Team_061 possession (Score: 48-42)
Stephen Towns attempts a Midrange. Wide open! Brandon Durant is 6.3 feet away. [MAN] Stephen Towns misses. Rebound secured by Stephen Holiday.

[05:43] Team_072 possession (Score: 48-42)
CJ Jokic drives, Gary Fox stays with him. CJ Jokic attempts a Layup. Wide open! Gary Fox is 6.2 feet away. [MAN] CJ JOKIC MAKES IT! Assist: CJ Bane
Score: 48-44

[05:29] Team_061 possession (Score: 48-44)
Desmond Morant attempts a Midrange. Wide open! CJ Jokic is 7.6 feet away. [ZONE] DESMOND MORANT MAKES IT! Assist: Stephen Towns
Score: 50-44

[05:14] Team_072 possession (Score: 50-44)
FOUL! Shooting foul on Desmond Morant. CJ Jokic to the line for 3 free throws. [Team fouls: 4] (Desmond Morant: 3 personal fouls)   FT 1/3: GOOD   FT 2/3: GOOD   FT 3/3: MISS CJ Jokic makes 2/3 from the line. Rebound secured by Stephen Towns.
Score: 50-46

[05:01] Team_061 possession (Score: 50-46)
Stephen Towns attempts a Layup. Contested by Brandon Durant (4.4 feet, MAN). STEPHEN TOWNS MAKES IT! Assist: Desmond Morant
Score: 52-46

[04:46] Team_072 possession (Score: 52-46)
Giannis Gobert attempts a 3Pt. Contested by Desmond Morant (2.7 feet, ZONE). Giannis Gobert misses. Rebound secured by Desmond Morant.

[04:31] Team_061 possession (Score: 52-46)
Tim Durant drives to the basket... Tim Durant throws a bad pass out of bounds! TURNOVER! (dead ball)

[04:11] Team_072 possession (Score: 52-46)
Stephen Holiday loses the ball! Stripped by Tim Durant! TURNOVER! (live ball)

[03:56] Team_061 possession (Score: 52-46)
Tim Durant drives, Stephen Holiday stays with him. Tim Durant attempts a Layup. Contested by Stephen Holiday (2.7 feet, ZONE). TIM DURANT MAKES IT! Assist: Evan Rose
Score: 54-46

[03:41] Team_072 possession (Score: 54-46)
CJ Bane attempts a 3Pt. Wide open! Desmond Morant is 7.8 feet away. [ZONE] CJ Bane misses. Rebound secured by Desmond Morant.

[03:27] Team_061 possession (Score: 54-46)
Stephen Towns attempts a Midrange. Wide open! CJ Bane is 8.1 feet away. [ZONE] STEPHEN TOWNS MAKES IT!
Score: 56-46

[03:12] Team_072 possession (Score: 56-46)
Stephen Holiday attempts a Layup. Contested by Tim Durant (5.2 feet, MAN). Stephen Holiday misses. Rebound secured by Stephen Towns.

[02:55] Team_061 possession (Score: 56-46)
FOUL! Shooting foul on CJ Bane. Desmond Morant to the line for 3 free throws. [Team fouls: 1] (CJ Bane: 1 personal fouls)   FT 1/3: GOOD   FT 2/3: GOOD   FT 3/3: MISS Desmond Morant makes 2/3 from the line. Rebound secured by CJ Jokic.
Score: 58-46

[02:39] Team_072 possession (Score: 58-46)
Stephen Holiday attempts a Midrange. Wide open! Stephen Towns is 6.1 feet away. [ZONE] STEPHEN HOLIDAY MAKES IT!
Score: 58-48

[02:21] Team_061 possession (Score: 58-48)
FOUL! Reach-in foul on Giannis Gobert during the drive. [Team fouls: 2] No free throws, side out. (Giannis Gobert: 1 personal fouls)

[02:07] Team_061 possession (Score: 58-48)
Desmond Morant drives and kicks out. Gary Fox attempts a 3Pt. Wide open! Giannis Gobert is 7.0 feet away. [ZONE] Gary Fox misses. Offensive rebound by Stephen Towns! Stephen Towns kicks it out.

[01:53] Team_061 possession (Score: 58-48)
Tim Durant drives, Stephen Holiday stays with him. Tim Durant attempts a Layup. Heavily contested by Stephen Holiday (1.2 feet, MAN)! Tim Durant misses. Rebound secured by Stephen Holiday.

[01:40] Team_072 possession (Score: 58-48)
Giannis Gobert attempts a Layup. BLOCKED BY EVAN ROSE! Ball is loose! Rebound secured by Stephen Towns.

[01:29] Team_061 possession (Score: 58-48)
Tim Durant drives and kicks out. Tim Durant attempts a Midrange. Wide open! Stephen Holiday is 10.0 feet away. [MAN] Tim Durant misses. Rebound secured by Brandon Durant.

[01:15] Team_072 possession (Score: 58-48)
CJ Bane drives and kicks out. Stephen Holiday attempts a 3Pt. Contested by Tim Durant (2.9 feet, MAN). Stephen Holiday misses. Rebound secured by Desmond Morant.

[01:03] Team_061 possession (Score: 58-48)
Tim Durant drives to the basket... Tim Durant commits a violation (traveling/carry)! TURNOVER! (dead ball)

[00:47] Team_072 possession (Score: 58-48)
Brandon Durant attempts a 3Pt. Contested by Stephen Towns (4.4 feet, MAN). Brandon Durant misses. FOUL! Loose ball foul on Tim Durant during the rebound battle. [IN THE BONUS! 5 team fouls] Stephen Holiday to the line for 2 free throws. (Tim Durant: 1 personal fouls)   FT 1/2: MISS   FT 2/2: GOOD Stephen Holiday makes 1/2 from the line.
Score: 58-49

[00:33] Team_061 possession (Score: 58-49)
Gary Fox attempts a 3Pt. Wide open! CJ Jokic is 6.2 feet away. [MAN] Gary Fox misses. Offensive rebound by Tim Durant! Tim Durant puts it back in!
Score: 60-49

[00:18] Team_072 possession (Score: 60-49)
Giannis Gobert drives, picks up Evan Rose. Help arrives from Desmond Morant! Giannis Gobert attempts a Layup. Wide open! Desmond Morant is 6.1 feet away. [MAN] GIANNIS GOBERT MAKES IT! Assist: Stephen Holiday
Score: 60-51

[00:01] Team_061 possession (Score: 60-51)
Gary Fox drives, Stephen Holiday stays with him. Gary Fox attempts a Layup. Contested by Stephen Holiday (5.6 feet, ZONE). Gary Fox misses. Rebound secured by CJ Jokic.

================================================================================
                              2ND QUARTER COMPLETE                              
================================================================================

2ND QUARTER SCORE: Team_061 26, Team_072 27

BOX SCORE:
================================================================================

Team_061
--------------------------------------------------------------------------------
Player                MIN  PTS  REB  AST  TO      FG   FG%      3P   3P%
--------------------------------------------------------------------------------
Tim Durant             11    6    2    0   0   3/5    60.0     0/0   0.0
Stephen Towns          11    6    5    1   0   3/5    60.0     0/0   0.0
Desmond Morant         11    5    5    1   0   2/3    66.7     0/0   0.0
Evan Rose              11    5    0    2   0   2/3    66.7     0/0   0.0
Michael Russell        13    2    3    0   0   1/1   100.0     0/0   0.0
Brandon Russell        13    0    0    0   0   0/1     0.0     0/0   0.0
Gary Fox               11    0    0    1   0   0/1     0.0     0/0   0.0

TEAM: FG: 11/19 (57.9%), 3PT: 5/7 (71.4%), REB: 15 (5 off, 10 def), AST: 5, TO: 4
TEAM FOULS: 5 [Team_072 in BONUS]


Team_072
--------------------------------------------------------------------------------
Player                MIN  PTS  REB  AST  TO      FG   FG%      3P   3P%
--------------------------------------------------------------------------------
Stephen Holiday        11    7    4    3   0   4/5    80.0     0/0   0.0
CJ Bane                11    6    0    1   0   2/4    50.0     0/0   0.0
CJ Jokic               11    5    2    0   0   2/3    66.7     0/0   0.0
Brandon Durant         11    3    3    1   0   1/1   100.0     0/0   0.0
Giannis Gobert         11    2    0    1   0   1/5    20.0     0/0   0.0
Tracy Giddey           13    0    1    0   0   0/0     0.0     0/0   0.0
Collin Griffin         13    0    0    0   0   0/2     0.0     0/0   0.0

TEAM: FG: 10/20 (50.0%), 3PT: 4/8 (50.0%), REB: 10 (2 off, 8 def), AST: 6, TO: 2
TEAM FOULS: 2

================================================================================

================================================================================
                       3RD QUARTER - Team_061 vs Team_072                       
================================================================================

[12:00] Team_061 possession (Score: 60-51)
Michael Russell attempts a Dunk. BLOCKED BY WENDELL ANTHONY! Ball goes out off Wendell Anthony. Michael Russell's ball!

[11:45] Team_061 possession (Score: 60-51)
FOUL! Reach-in foul on Tyrese Williamson during the drive. [Team fouls: 1] No free throws, side out. (Tyrese Williamson: 1 personal fouls)

[11:30] Team_061 possession (Score: 60-51)
FOUL! Reach-in foul on Tyrese Williamson during the drive. [Team fouls: 2] No free throws, side out. (Tyrese Williamson: 2 personal fouls)

[11:14] Team_061 possession (Score: 60-51)
Jayson Holiday drives to the basket... Jayson Holiday loses the ball! Stripped by Tyrese Williamson! TURNOVER! (live ball)

[11:01] Team_072 possession (Score: 60-51)
Wendell Anthony throws a bad pass! Stolen by Michael Russell! TURNOVER! (live ball)

[10:46] Team_061 possession (Score: 60-51)
Brandon Russell attempts a 3Pt. Contested by Collin Griffin (5.8 feet, MAN). Brandon Russell misses. Offensive rebound by Draymond Banchero! Draymond Banchero's putback is no good. Rebound secured by Tyrese Williamson.

[10:34] Team_072 possession (Score: 60-51)
Tyrese Williamson drives and kicks out. Collin Griffin attempts a 3Pt. Contested by Brandon Russell (4.1 feet, MAN). Collin Griffin misses. Rebound secured by Bam Sexton.

[10:17] Team_061 possession (Score: 60-51)
FOUL! Holding foul on Wendell Anthony. [Team fouls: 3] No free throws, side out. (Wendell Anthony: 1 personal fouls)

[09:59] Team_061 possession (Score: 60-51)
FOUL! Shooting foul on Cade Poole. Jayson Holiday to the line for 2 free throws. [Team fouls: 4] (Cade Poole: 1 personal fouls)   FT 1/2: GOOD   FT 2/2: GOOD Jayson Holiday makes 2/2 from the line.
Score: 62-51

[09:48] Team_072 possession (Score: 62-51)
Cade Poole drives, picks up Jayson Holiday. Help arrives from Michael Russell! Cade Poole attempts a Layup. Contested by Michael Russell (3.4 feet, MAN). Cade Poole misses. FOUL! Loose ball foul on Draymond Banchero during the rebound battle. [Team fouls: 1] No free throws, side out. (Draymond Banchero: 1 personal fouls)

[09:33] Team_072 possession (Score: 62-51)
Wendell Anthony attempts a 3Pt. Contested by Michael Russell (3.0 feet, MAN). WENDELL ANTHONY MAKES IT! Assist: Cade Poole
Score: 62-54

[09:23] Team_061 possession (Score: 62-54)
Bam Sexton drives and kicks out. FOUL! Shooting foul on Cade Poole. Brandon Russell to the line for 2 free throws. [BONUS: 5 team fouls] (Cade Poole: 2 personal fouls)   FT 1/2: MISS   FT 2/2: MISS Brandon Russell makes 0/2 from the line. Offensive rebound by Draymond Banchero! Draymond Banchero puts it back in!
Score: 64-54

[09:07] Team_072 possession (Score: 64-54)
Tracy Giddey drives, Draymond Banchero stays with him. Tracy Giddey attempts a Dunk. Heavily contested by Draymond Banchero (1.2 feet, ZONE)! Tracy Giddey misses. Rebound secured by Draymond Banchero.

[08:48] Team_061 possession (Score: 64-54)
Jayson Holiday attempts a 3Pt. Contested by Cade Poole (5.4 feet, MAN). Jayson Holiday misses. Rebound secured by Tyrese Williamson.

[08:34] Team_072 possession (Score: 64-54)
Wendell Anthony attempts a 3Pt. Contested by Brandon Russell (4.7 feet, ZONE). Wendell Anthony misses. FOUL! Loose ball foul on Draymond Banchero during the rebound battle. [Team fouls: 2] No free throws, side out. (Draymond Banchero: 2 personal fouls)

[08:24] Team_072 possession (Score: 64-54)
Cade Poole attempts a 3Pt. Wide open! Jayson Holiday is 7.9 feet away. [MAN] Cade Poole misses. Rebound secured by Draymond Banchero.

[08:12] Team_061 possession (Score: 64-54)
Draymond Banchero drives to the basket... Draymond Banchero throws a bad pass out of bounds! TURNOVER! (dead ball)

[08:02] Team_072 possession (Score: 64-54)
Tyrese Williamson attempts a Midrange. Contested by Jayson Holiday (2.6 feet, ZONE). Tyrese Williamson misses. Rebound secured by Bam Sexton.

[07:48] Team_061 possession (Score: 64-54)
Bam Sexton attempts a Midrange. Contested by Tracy Giddey (4.9 feet, MAN). Bam Sexton misses. Rebound secured by Wendell Anthony.

[07:31] Team_072 possession (Score: 64-54)
Collin Griffin drives, picks up Brandon Russell. Help arrives from Michael Russell! Collin Griffin attempts a Dunk. Wide open! Michael Russell is 6.5 feet away. [MAN] COLLIN GRIFFIN MAKES IT!
Score: 64-56

[07:20] Team_061 possession (Score: 64-56)
Bam Sexton attempts a Midrange. Contested by Cade Poole (5.1 feet, ZONE). Bam Sexton misses. Rebound secured by Wendell Anthony.

[07:05] Team_072 possession (Score: 64-56)
Tyrese Williamson commits a violation (traveling/carry)! TURNOVER! (dead ball)

[06:53] Team_061 possession (Score: 64-56)
Draymond Banchero attempts a Layup. Contested by Tyrese Williamson (4.6 feet, ZONE). Draymond Banchero misses. Rebound secured by Tracy Giddey.

[06:38] Team_072 possession (Score: 64-56)
Cade Poole attempts a Midrange. Wide open! Bam Sexton is 8.1 feet away. [ZONE] Cade Poole misses. Rebound secured by Bam Sexton.

[06:26] Team_061 possession (Score: 64-56)
Draymond Banchero makes the Layup and draws the foul on Tyrese Williamson! And-1! Draymond Banchero to the line for 1. [BONUS: 6 team fouls] (Tyrese Williamson: 3 personal fouls)   FT 1/1: GOOD Draymond Banchero makes 1/1 from the line.
Score: 67-56

[06:14] Team_072 possession (Score: 67-56)
Cade Poole attempts a 3Pt. Contested by Jayson Holiday (4.6 feet, MAN). CADE POOLE MAKES IT! Assist: Tyrese Williamson
Score: 67-59

[06:01] Team_061 possession (Score: 67-59)
Draymond Banchero throws a bad pass! Stolen by Tyrese Williamson! TURNOVER! (live ball)

[05:44] Team_072 possession (Score: 67-59)
Cade Poole attempts a Midrange. Contested by Jayson Holiday (3.6 feet, MAN). CADE POOLE MAKES IT!
Score: 67-61

[05:26] Team_061 possession (Score: 67-61)
Brandon Russell makes the 3Pt and draws the foul on Collin Griffin! And-1! Brandon Russell to the line for 1. [BONUS: 7 team fouls] (Collin Griffin: 1 personal fouls)   FT 1/1: GOOD Brandon Russell makes 1/1 from the line.
Score: 71-61

[05:11] Team_072 possession (Score: 71-61)
Wendell Anthony drives, picks up Draymond Banchero. Help arrives from Jayson Holiday! Wendell Anthony attempts a Layup. Contested by Jayson Holiday (2.1 feet, ZONE). WENDELL ANTHONY MAKES IT! Assist: Cade Poole
Score: 71-63

[04:56] Team_061 possession (Score: 71-63)
Brandon Russell commits a violation (traveling/carry)! TURNOVER! (dead ball)

[04:41] Team_072 possession (Score: 71-63)
Wendell Anthony throws a bad pass! Stolen by Michael Russell! TURNOVER! (live ball)

[04:29] Team_061 possession (Score: 71-63)
Michael Russell makes the Dunk and draws the foul on Wendell Anthony! And-1! Michael Russell to the line for 1. [BONUS: 8 team fouls] (Wendell Anthony: 2 personal fouls)   FT 1/1: MISS Michael Russell makes 0/1 from the line. Rebound secured by Tyrese Williamson.
Score: 73-63

[04:12] Team_072 possession (Score: 73-63)
FOUL! Reach-in foul on Draymond Banchero during the drive. [Team fouls: 3] No free throws, side out. (Draymond Banchero: 3 personal fouls)

[03:59] Team_072 possession (Score: 73-63)
Tyrese Williamson attempts a Midrange. Contested by Draymond Banchero (3.3 feet, MAN). Tyrese Williamson misses. Rebound secured by Bam Sexton.

[03:47] Team_061 possession (Score: 73-63)
FOUL! Shooting foul on Cade Poole. Jayson Holiday to the line for 2 free throws. [BONUS: 9 team fouls] (Cade Poole: 3 personal fouls)   FT 1/2: GOOD   FT 2/2: GOOD Jayson Holiday makes 2/2 from the line.
Score: 75-63

[03:30] Team_072 possession (Score: 75-63)
Wendell Anthony attempts a 3Pt. Contested by Michael Russell (5.1 feet, MAN). WENDELL ANTHONY MAKES IT!
Score: 75-66

[03:15] Team_061 possession (Score: 75-66)
Bam Sexton throws a bad pass! Stolen by Tracy Giddey! TURNOVER! (live ball)

[02:59] Team_072 possession (Score: 75-66)
Tracy Giddey drives, picks up Draymond Banchero. Help arrives from Jayson Holiday! Tracy Giddey attempts a Layup. Heavily contested by Jayson Holiday (1.4 feet, ZONE)! TRACY GIDDEY MAKES IT! Assist: Tyrese Williamson
Score: 75-68

[02:48] Team_061 possession (Score: 75-68)
Bam Sexton throws a bad pass! Stolen by Tracy Giddey! TURNOVER! (live ball)

[02:32] Team_072 possession (Score: 75-68)
FOUL! Offensive foul on Tyrese Williamson! Draymond Banchero drew the charge! [Team fouls: 10] (Tyrese Williamson: 4 personal fouls) TURNOVER! (dead ball)

[02:19] Team_061 possession (Score: 75-68)
Michael Russell drives and kicks out. Bam Sexton attempts a 3Pt. Contested by Wendell Anthony (5.5 feet, ZONE). Bam Sexton misses. FOUL! Loose ball foul on Tracy Giddey during the rebound battle. [IN THE BONUS! 11 team fouls] Draymond Banchero to the line for 2 free throws. (Tracy Giddey: 1 personal fouls)   FT 1/2: MISS   FT 2/2: GOOD Draymond Banchero makes 1/2 from the line.
Score: 76-68

[02:03] Team_072 possession (Score: 76-68)
Cade Poole drives, picks up Jayson Holiday. Help arrives from Michael Russell! Cade Poole attempts a Layup. Heavily contested by Michael Russell (0.5 feet, MAN)! Cade Poole misses. Offensive rebound by Tracy Giddey! Tracy Giddey kicks it out.

[01:49] Team_072 possession (Score: 76-68)
Cade Poole attempts a Layup. BLOCKED BY MICHAEL RUSSELL! Ball deflects out of bounds off Cade Poole.

[01:33] Team_061 possession (Score: 76-68)
Jayson Holiday throws a bad pass! Stolen by Cade Poole! TURNOVER! (live ball)

[01:24] Team_072 possession (Score: 76-68)
Collin Griffin makes the Layup and draws the foul on Draymond Banchero! And-1! Collin Griffin to the line for 1. [Team fouls: 4] (Draymond Banchero: 4 personal fouls)   FT 1/1: GOOD Collin Griffin makes 1/1 from the line.
Score: 76-71

[01:08] Team_061 possession (Score: 76-71)
Brandon Russell drives, Tyrese Williamson stays with him. Brandon Russell attempts a Dunk. Heavily contested by Tyrese Williamson (0.9 feet, ZONE)! Brandon Russell misses. Offensive rebound by Michael Russell! Michael Russell's putback is no good. Rebound secured by Wendell Anthony.

[00:50] Team_072 possession (Score: 76-71)
Collin Griffin drives to the basket... Collin Griffin loses the ball! Stripped by Draymond Banchero! TURNOVER! (live ball)

[00:35] Team_061 possession (Score: 76-71)
Michael Russell attempts a Layup. Contested by Tyrese Williamson (4.2 feet, ZONE). Michael Russell misses. Rebound secured by Tyrese Williamson.

[00:21] Team_072 possession (Score: 76-71)
Tyrese Williamson makes the Dunk and draws the foul on Jayson Holiday! And-1! Tyrese Williamson to the line for 1. [BONUS: 5 team fouls] (Jayson Holiday: 1 personal fouls)   FT 1/1: GOOD Tyrese Williamson makes 1/1 from the line.
Score: 76-74

[00:05] Team_061 possession (Score: 76-74)
Draymond Banchero drives and kicks out. Draymond Banchero attempts a 3Pt. Contested by Cade Poole (5.4 feet, ZONE). DRAYMOND BANCHERO MAKES IT! Assist: Jayson Holiday
Score: 79-74

================================================================================
                              3RD QUARTER COMPLETE                              
================================================================================

3RD QUARTER SCORE: Team_061 19, Team_072 23

BOX SCORE:
================================================================================

Team_061
--------------------------------------------------------------------------------
Player                MIN  PTS  REB  AST  TO      FG   FG%      3P   3P%
--------------------------------------------------------------------------------
Draymond Banchero      25    9    2    0   0   4/5    80.0     0/0   0.0
Wendell Anthony        25    8    3    0   0   3/3   100.0     0/0   0.0
Brandon Russell        25    4    0    0   0   1/3    33.3     0/0   0.0
Jayson Holiday         25    4    0    1   0   2/3    66.7     0/0   0.0
Bam Sexton             25    0    4    0   0   0/2     0.0     0/0   0.0
Michael Russell        25    0    0    0   0   0/2     0.0     0/0   0.0

TEAM: FG: 7/15 (46.7%), 3PT: 1/3 (33.3%), REB: 8 (2 off, 6 def), AST: 1, TO: 7
TEAM FOULS: 5 [Team_072 in BONUS]


Team_072
--------------------------------------------------------------------------------
Player                MIN  PTS  REB  AST  TO      FG   FG%      3P   3P%
--------------------------------------------------------------------------------
Cade Poole             25    5    0    2   0   2/5    40.0     0/0   0.0
Collin Griffin         25    5    0    0   0   2/2   100.0     0/0   0.0
Tyrese Williamson      25    3    4    2   0   1/4    25.0     0/0   0.0
Tracy Giddey           25    2    4    0   0   1/2    50.0     0/0   0.0

TEAM: FG: 9/16 (56.2%), 3PT: 3/4 (75.0%), REB: 9 (3 off, 6 def), AST: 4, TO: 5
TEAM FOULS: 11 [Team_061 in BONUS]

================================================================================

================================================================================
                       4TH QUARTER - Team_061 vs Team_072                       
================================================================================

[12:00] Team_061 possession (Score: 79-74)
Brandon Russell drives, Collin Griffin stays with him. Brandon Russell attempts a Layup. Contested by Collin Griffin (2.4 feet, MAN). Brandon Russell misses. Rebound secured by Tyrese Williamson.

[11:46] Team_072 possession (Score: 79-74)
Tyrese Williamson drives to the basket... FOUL! Offensive foul on Tyrese Williamson! Draymond Banchero drew the charge! [Team fouls: 1] (Tyrese Williamson: 1 personal fouls) TURNOVER! (dead ball)

[11:33] Team_061 possession (Score: 79-74)
Michael Russell attempts a 3Pt. Wide open! Wendell Anthony is 6.4 feet away. [MAN] Michael Russell misses. Rebound secured by Tyrese Williamson.

[11:21] Team_072 possession (Score: 79-74)
Collin Griffin attempts a Midrange. Wide open! Brandon Russell is 6.4 feet away. [MAN] Collin Griffin misses. Offensive rebound by Tracy Giddey! Tracy Giddey kicks it out.

[11:06] Team_072 possession (Score: 79-74)
Wendell Anthony attempts a 3Pt. Wide open! Brandon Russell is 6.9 feet away. [ZONE] Wendell Anthony misses. Rebound secured by Bam Sexton.

[10:53] Team_061 possession (Score: 79-74)
Jayson Holiday attempts a 3Pt. Wide open! Cade Poole is 10.0 feet away. [MAN] Jayson Holiday misses. Rebound secured by Tracy Giddey.

[10:37] Team_072 possession (Score: 79-74)
Wendell Anthony attempts a 3Pt. Contested by Brandon Russell (3.3 feet, ZONE). Wendell Anthony misses. Rebound secured by Draymond Banchero.

[10:23] Team_061 possession (Score: 79-74)
Jayson Holiday commits a violation (traveling/carry)! TURNOVER! (dead ball)

[10:23] Substitution (Team_061): Brandon Russell OUT → Evan Rose IN (stamina_rule2)

[10:23] Substitution (Team_061): Jayson Holiday OUT → Gary Fox IN (stamina_rule2)

[10:23] Substitution (Team_061): Michael Russell OUT → Desmond Morant IN (stamina_rule2)

[10:23] Substitution (Team_061): Bam Sexton OUT → Stephen Towns IN (stamina_rule2)

[10:23] Substitution (Team_061): Draymond Banchero OUT → Tim Durant IN (stamina_rule2)

[10:23] Substitution (Team_072): Collin Griffin OUT → Giannis Gobert IN (stamina_rule2)

[10:23] Substitution (Team_072): Cade Poole OUT → CJ Jokic IN (stamina_rule2)

[10:23] Substitution (Team_072): Wendell Anthony OUT → CJ Bane IN (stamina_rule2)

[10:23] Substitution (Team_072): Tracy Giddey OUT → Brandon Durant IN (stamina_rule2)

[10:23] Substitution (Team_072): Tyrese Williamson OUT → Stephen Holiday IN (stamina_rule2)

[10:05] Team_072 possession (Score: 79-74)
FOUL! Holding foul on Stephen Towns. [Team fouls: 1] No free throws, side out. (Stephen Towns: 1 personal fouls)

[09:48] Team_072 possession (Score: 79-74)
FOUL! Shooting foul on Evan Rose. Giannis Gobert to the line for 2 free throws. [Team fouls: 2] (Evan Rose: 1 personal fouls)   FT 1/2: MISS   FT 2/2: GOOD Giannis Gobert makes 1/2 from the line.
Score: 79-75

[09:32] Team_061 possession (Score: 79-75)
Desmond Morant attempts a 3Pt. Contested by Giannis Gobert (3.4 feet, ZONE). DESMOND MORANT MAKES IT! Assist: Evan Rose
Score: 82-75

[09:17] Team_072 possession (Score: 82-75)
CJ Bane drives, picks up Desmond Morant. Help arrives from Evan Rose! CJ Bane attempts a Dunk. Contested by Evan Rose (3.9 feet, MAN). CJ Bane misses. Offensive rebound by Brandon Durant! Brandon Durant kicks it out.

[09:03] Team_072 possession (Score: 82-75)
Stephen Holiday attempts a Layup. Heavily contested by Tim Durant (1.2 feet, MAN)! Stephen Holiday misses. Rebound secured by Tim Durant.

[08:51] Team_061 possession (Score: 82-75)
Desmond Morant makes the Layup and draws the foul on Stephen Holiday! And-1! Desmond Morant to the line for 1. [Team fouls: 2] (Stephen Holiday: 1 personal fouls)   FT 1/1: GOOD Desmond Morant makes 1/1 from the line.
Score: 85-75

[08:37] Team_072 possession (Score: 85-75)
Giannis Gobert drives, Tim Durant stays with him. Giannis Gobert attempts a Layup. Contested by Tim Durant (3.5 feet, ZONE). Giannis Gobert misses. Rebound secured by Desmond Morant.

[08:21] Team_061 possession (Score: 85-75)
Gary Fox attempts a 3Pt. Wide open! Giannis Gobert is 6.2 feet away. [ZONE] Gary Fox misses. Rebound secured by Brandon Durant.

[08:08] Team_072 possession (Score: 85-75)
CJ Jokic drives, picks up Gary Fox. Help arrives from Desmond Morant! CJ Jokic attempts a Dunk. Wide open! Desmond Morant is 8.2 feet away. [MAN] CJ JOKIC MAKES IT! Assist: Brandon Durant
Score: 85-77

[07:53] Team_061 possession (Score: 85-77)
Gary Fox makes the Layup and draws the foul on CJ Jokic! And-1! Gary Fox to the line for 1. [Team fouls: 3] (CJ Jokic: 1 personal fouls)   FT 1/1: GOOD Gary Fox makes 1/1 from the line.
Score: 88-77

[07:37] Team_072 possession (Score: 88-77)
CJ Bane drives, picks up Tim Durant. Help arrives from Evan Rose! CJ Bane attempts a Layup. Contested by Evan Rose (4.7 feet, ZONE). CJ Bane misses. Rebound secured by Tim Durant.

[07:20] Team_061 possession (Score: 88-77)
Gary Fox drives, picks up Stephen Holiday. Help arrives from Giannis Gobert! Gary Fox attempts a Layup. Contested by Giannis Gobert (3.2 feet, ZONE). GARY FOX MAKES IT! Assist: Desmond Morant
Score: 90-77

[07:07] Team_072 possession (Score: 90-77)
CJ Jokic throws a bad pass! Stolen by Gary Fox! TURNOVER! (live ball)

[06:49] Team_061 possession (Score: 90-77)
Desmond Morant drives and kicks out. Stephen Towns attempts a Midrange. Contested by Brandon Durant (4.2 feet, MAN). Stephen Towns misses. Rebound secured by CJ Jokic.

[06:37] Team_072 possession (Score: 90-77)
CJ Jokic attempts a Layup. Wide open! Gary Fox is 6.8 feet away. [MAN] CJ JOKIC MAKES IT! Assist: Brandon Durant
Score: 90-79

[06:23] Team_061 possession (Score: 90-79)
Desmond Morant attempts a 3Pt. Wide open! Giannis Gobert is 7.9 feet away. [ZONE] Desmond Morant misses. Rebound secured by Brandon Durant.

[06:04] Team_072 possession (Score: 90-79)
CJ Jokic attempts a Layup. BLOCKED BY GARY FOX! Ball deflects out of bounds off CJ Jokic.

[05:52] Team_061 possession (Score: 90-79)
Gary Fox attempts a 3Pt. Wide open! CJ Jokic is 7.6 feet away. [MAN] Gary Fox misses. Rebound secured by CJ Jokic.

[05:41] Team_072 possession (Score: 90-79)
CJ Jokic drives to the basket... CJ Jokic throws a bad pass! Stolen by Gary Fox! TURNOVER! (live ball)

[05:28] Team_061 possession (Score: 90-79)
Desmond Morant drives, picks up CJ Bane. Help arrives from Giannis Gobert! Desmond Morant attempts a Dunk. Contested by Giannis Gobert (4.5 feet, MAN). DESMOND MORANT MAKES IT! Assist: Stephen Towns
Score: 92-79

[05:12] Team_072 possession (Score: 92-79)
CJ Jokic attempts a Midrange. Wide open! Gary Fox is 7.9 feet away. [MAN] CJ Jokic misses. Rebound secured by Stephen Towns.

[04:59] Team_061 possession (Score: 92-79)
Stephen Towns attempts a Midrange. Contested by Brandon Durant (5.6 feet, MAN). Stephen Towns misses. Rebound secured by Stephen Holiday.

[04:47] Team_072 possession (Score: 92-79)
Brandon Durant makes the Midrange and draws the foul on Gary Fox! And-1! Brandon Durant to the line for 1. [Team fouls: 3] (Gary Fox: 1 personal fouls)   FT 1/1: GOOD Brandon Durant makes 1/1 from the line.
Score: 92-82

[04:33] Team_061 possession (Score: 92-82)
FOUL! Reach-in foul on Stephen Holiday during the drive. [Team fouls: 4] No free throws, side out. (Stephen Holiday: 2 personal fouls)

[04:15] Team_061 possession (Score: 92-82)
FOUL! Offensive foul on Gary Fox! CJ Jokic drew the charge! [Team fouls: 4] (Gary Fox: 2 personal fouls) TURNOVER! (dead ball)

[03:58] Team_072 possession (Score: 92-82)
Giannis Gobert drives and kicks out. CJ Bane attempts a 3Pt. Contested by Desmond Morant (2.9 feet, MAN). CJ Bane misses. Rebound secured by Tim Durant.

[03:42] Team_061 possession (Score: 92-82)
Gary Fox loses control! Ball rolls out of bounds! TURNOVER! (dead ball)

[03:29] Team_072 possession (Score: 92-82)
FOUL! Holding foul on Gary Fox. [IN THE BONUS! 5 team fouls] CJ Jokic to the line for 2 free throws. (Gary Fox: 3 personal fouls)   FT 1/2: GOOD   FT 2/2: GOOD CJ Jokic makes 2/2 from the line.
Score: 92-84

[03:11] Team_061 possession (Score: 92-84)
Tim Durant attempts a Layup. Wide open! Stephen Holiday is 6.2 feet away. [ZONE] Tim Durant misses. Rebound secured by Stephen Holiday.

[02:57] Team_072 possession (Score: 92-84)
Stephen Holiday drives, Tim Durant stays with him. Stephen Holiday attempts a Dunk. Wide open! Tim Durant is 7.6 feet away. [MAN] Stephen Holiday misses. Rebound secured by Desmond Morant.

[02:41] Team_061 possession (Score: 92-84)
Stephen Towns attempts a 3Pt. Wide open! Giannis Gobert is 6.6 feet away. [ZONE] Stephen Towns misses. Rebound secured by Stephen Holiday.

[02:25] Team_072 possession (Score: 92-84)
CJ Bane attempts a Midrange. Heavily contested by Desmond Morant (1.9 feet, MAN)! CJ Bane misses. Rebound secured by Tim Durant.

[02:14] Team_061 possession (Score: 92-84)
Desmond Morant attempts a Layup. BLOCKED BY GIANNIS GOBERT! Ball is loose! Offensive rebound by Tim Durant! Tim Durant kicks it out.

[02:03] Team_061 possession (Score: 92-84)
Desmond Morant attempts a Midrange. Contested by CJ Bane (4.5 feet, MAN). Desmond Morant misses. FOUL! Loose ball foul on CJ Jokic during the rebound battle. [IN THE BONUS! 5 team fouls] Stephen Towns to the line for 2 free throws. (CJ Jokic: 2 personal fouls)   FT 1/2: GOOD   FT 2/2: MISS Stephen Towns makes 1/2 from the line. Rebound secured by Stephen Holiday.
Score: 93-84

[01:49] Team_072 possession (Score: 93-84)
FOUL! Holding foul on Desmond Morant. [IN THE BONUS! 6 team fouls] CJ Bane to the line for 2 free throws. (Desmond Morant: 1 personal fouls)   FT 1/2: GOOD   FT 2/2: MISS CJ Bane makes 1/2 from the line. FOUL! Loose ball foul on Desmond Morant during the free throw rebound! [IN THE BONUS! 7 team fouls] Stephen Holiday to the line for 2 free throws. (Desmond Morant: 2 personal fouls)   FT 1/2: GOOD   FT 2/2: GOOD Stephen Holiday makes 2/2 from the line.
Score: 93-87

[01:32] Team_061 possession (Score: 93-87)
Gary Fox attempts a 3Pt. Contested by Giannis Gobert (3.9 feet, ZONE). GARY FOX MAKES IT! Assist: Stephen Towns
Score: 96-87

[01:15] Team_072 possession (Score: 96-87)
CJ Bane attempts a 3Pt. Wide open! Desmond Morant is 6.3 feet away. [MAN] CJ Bane misses. Rebound secured by Tim Durant.

[01:02] Team_061 possession (Score: 96-87)
Evan Rose attempts a Midrange. Contested by CJ Jokic (3.8 feet, ZONE). Evan Rose misses. Rebound secured by Stephen Holiday.

[00:46] Team_072 possession (Score: 96-87)
Giannis Gobert attempts a 3Pt. Wide open! Desmond Morant is 7.0 feet away. [ZONE] Giannis Gobert misses. Offensive rebound by Stephen Holiday! Stephen Holiday kicks it out.

[00:32] Team_072 possession (Score: 96-87)
Giannis Gobert attempts a Midrange. Contested by Evan Rose (3.7 feet, ZONE). Giannis Gobert misses. FOUL! Loose ball foul on Stephen Towns during the rebound battle. [IN THE BONUS! 8 team fouls] Brandon Durant to the line for 2 free throws. (Stephen Towns: 2 personal fouls)   FT 1/2: GOOD   FT 2/2: GOOD Brandon Durant makes 2/2 from the line.
Score: 96-89

[00:22] Team_061 possession (Score: 96-89)
Gary Fox attempts a 3Pt. Contested by Brandon Durant (5.7 feet, ZONE). Gary Fox misses. Rebound secured by CJ Jokic.

[00:07] Team_072 possession (Score: 96-89)
FOUL! Reach-in foul on Desmond Morant during the drive. [IN THE BONUS! 9 team fouls] CJ Bane to the line for 2 free throws. (Desmond Morant: 3 personal fouls)   FT 1/2: MISS   FT 2/2: MISS CJ Bane makes 0/2 from the line. Rebound secured by Desmond Morant.

================================================================================
                              4TH QUARTER COMPLETE                              
================================================================================

4TH QUARTER SCORE: Team_061 17, Team_072 15

BOX SCORE:
================================================================================

Team_061
--------------------------------------------------------------------------------
Player                MIN  PTS  REB  AST  TO      FG   FG%      3P   3P%
--------------------------------------------------------------------------------
Desmond Morant         21    8    3    1   0   3/6    50.0     0/0   0.0
Gary Fox               21    8    0    0   0   3/6    50.0     0/0   0.0
Brandon Russell        27    0    0    0   0   0/1     0.0     0/0   0.0
Michael Russell        27    0    0    0   0   0/1     0.0     0/0   0.0
Bam Sexton             27    0    1    0   0   0/0     0.0     0/0   0.0
Jayson Holiday         27    0    0    0   0   0/1     0.0     0/0   0.0
Draymond Banchero      27    0    1    0   0   0/0     0.0     0/0   0.0
Evan Rose              21    0    0    1   0   0/1     0.0     0/0   0.0
Tim Durant             21    0    6    0   0   0/1     0.0     0/0   0.0
Stephen Towns          21    0    1    2   0   0/2     0.0     0/0   0.0

TEAM: FG: 6/19 (31.6%), 3PT: 2/9 (22.2%), REB: 13 (2 off, 11 def), AST: 4, TO: 3
TEAM FOULS: 9 [Team_072 in BONUS]


Team_072
--------------------------------------------------------------------------------
Player                MIN  PTS  REB  AST  TO      FG   FG%      3P   3P%
--------------------------------------------------------------------------------
CJ Jokic               21    6    3    0   0   3/5    60.0     0/0   0.0
Brandon Durant         21    5    3    2   0   2/2   100.0     0/0   0.0
Stephen Holiday        21    3    6    0   0   1/3    33.3     0/0   0.0
Giannis Gobert         21    1    0    0   0   1/3    33.3     0/0   0.0
Tyrese Williamson      27    0    2    0   0   0/0     0.0     0/0   0.0
Tracy Giddey           27    0    2    0   0   0/0     0.0     0/0   0.0
Wendell Anthony        27    0    0    0   0   0/2     0.0     0/0   0.0
CJ Bane                21    0    0    0   0   0/4     0.0     0/0   0.0

TEAM: FG: 7/19 (36.8%), 3PT: 0/3 (0.0%), REB: 15 (3 off, 12 def), AST: 2, TO: 3
TEAM FOULS: 5 [Team_061 in BONUS]

================================================================================

================================================================================
                               FULL GAME COMPLETE                               
================================================================================

FINAL SCORE: Team_061 96, Team_072 89

SCORING BY QUARTER:
--------------------------------------------------------------------------------
Team                     Q1     Q2     Q3     Q4    FINAL
--------------------------------------------------------------------------------
Team_061                 34     26     19     17       96
Team_072                 24     27     23     15       89
--------------------------------------------------------------------------------

FULL GAME BOX SCORE:
================================================================================

Team_061
--------------------------------------------------------------------------------
Player                MIN  PTS  REB  AST  TO      FG   FG%      3P   3P%      FT STL BLK
--------------------------------------------------------------------------------
Brandon Russell        27   13    0    1   4   5/11   45.5   2/5    40.0   3/5     0   0
Jayson Holiday         27   13    0    1   4   4/8    50.0   1/3    33.3   5/5     0   0
Michael Russell        27   10    5    1   0   5/10   50.0   2/4    50.0   6/7     2   1
Bam Sexton             27    7    9    2   3   5/8    62.5   0/0     0.0   2/3     0   0
Draymond Banchero      27    9    8    1   1   3/4    75.0   0/0     0.0   2/3     2   0
Evan Rose              21    5    0    3   1   2/4    50.0   1/1   100.0   0/0     0   1
Gary Fox               21    8    0    1   4   4/8    50.0   2/5    40.0   1/1     2   1
Desmond Morant         21   13    8    2   0   6/10   60.0   3/5    60.0   3/4     0   0
Stephen Towns          21    6    6    3   0   3/7    42.9   0/1     0.0   1/2     1   0
Tim Durant             21    6    8    0   0   1/4    25.0   0/0     0.0   0/0     1   1

TEAM: FG: 38/74 (51.4%), 3PT: 11/24 (45.8%), REB: 47 (10 off, 37 def), AST: 15, TO: 17


Team_072
--------------------------------------------------------------------------------
Player                MIN  PTS  REB  AST  TO      FG   FG%      3P   3P%      FT STL BLK
--------------------------------------------------------------------------------
Collin Griffin         27    8    0    1   2   3/7    42.9   1/1   100.0   1/1     2   0
Cade Poole             27    7    0    4   1   2/8    25.0   1/3    33.3   0/0     1   0
Wendell Anthony        27   13    6    2   3   5/9    55.6   3/6    50.0   1/2     0   1
Tracy Giddey           27    4    8    0   2   3/5    60.0   0/0     0.0   1/2     2   0
Tyrese Williamson      27   13   12    3   2   5/10   50.0   0/0     0.0   3/3     3   0
Giannis Gobert         21    3    0    1   0   3/9    33.3   0/2     0.0   1/2     0   1
CJ Jokic               21   11    5    0   2   4/7    57.1   1/2    50.0   4/5     1   0
CJ Bane                21    6    0    1   0   2/8    25.0   1/3    33.3   4/8     0   0
Brandon Durant         21    8    6    3   0   3/3   100.0   2/2   100.0   3/3     0   0
Stephen Holiday        21   10   10    3   2   3/6    50.0   0/0     0.0   1/2     0   0

TEAM: FG: 35/74 (47.3%), 3PT: 9/19 (47.4%), REB: 43 (11 off, 32 def), AST: 18, TO: 14

================================================================================
