================================================================================
                        FULL GAME - Team_036 vs Team_093                        
================================================================================

================================================================================
                       1ST QUARTER - Team_036 vs Team_093                       
================================================================================

[12:00] Team_036 possession (Score: 0-0)
Anthony Poole attempts a Layup. Contested by Carmelo Wagner (2.5 feet, MAN). ANTHONY POOLE MAKES IT! Assist: Michael Westbrook
Score: 2-0

[11:44] Team_093 possession (Score: 2-0)
Ben Cunningham attempts a 3Pt. Contested by Kobe Simmons (3.1 feet, MAN). Ben Cunningham misses. Rebound secured by Terry Durant.

[11:29] Team_036 possession (Score: 2-0)
Terry Durant attempts a 3Pt. Wide open! Vince Barnes is 6.1 feet away. [MAN] Terry Durant misses. FOUL! Loose ball foul on Ben Cunningham during the rebound battle. [Team fouls: 1] No free throws, side out. (Ben Cunningham: 1 personal fouls)

[11:18] Team_036 possession (Score: 2-0)
Terry Durant drives to the basket... Terry Durant throws a bad pass! Stolen by Vince Barnes! TURNOVER! (live ball)

[11:02] Team_093 possession (Score: 2-0)
Trae Westbrook makes the 3Pt and draws the foul on Giannis Booker! And-1! Trae Westbrook to the line for 1. [Team fouls: 1] (Giannis Booker: 1 personal fouls)   FT 1/1: GOOD Trae Westbrook makes 1/1 from the line.
Score: 2-4

[10:49] Team_036 possession (Score: 2-4)
Giannis Booker attempts a 3Pt. Contested by Carmelo Wagner (4.3 feet, ZONE). Giannis Booker misses. Offensive rebound by Terry Durant! Terry Durant puts it back in!
Score: 4-4

[10:38] Team_093 possession (Score: 4-4)
FOUL! Shooting foul on Giannis Booker. Vince Barnes to the line for 2 free throws. [Team fouls: 2] (Giannis Booker: 2 personal fouls)   FT 1/2: GOOD   FT 2/2: MISS Vince Barnes makes 1/2 from the line. Rebound secured by Kobe Simmons.
Score: 4-5

[10:19] Team_036 possession (Score: 4-5)
FOUL! Shooting foul on Carmelo Wagner. Michael Westbrook to the line for 2 free throws. [Team fouls: 2] (Carmelo Wagner: 1 personal fouls)   FT 1/2: GOOD   FT 2/2: GOOD Michael Westbrook makes 2/2 from the line.
Score: 6-5

[10:09] Team_093 possession (Score: 6-5)
FOUL! Reach-in foul on Terry Durant during the drive. [Team fouls: 3] No free throws, side out. (Terry Durant: 1 personal fouls)

[09:55] Team_093 possession (Score: 6-5)
Trae Westbrook drives, Giannis Booker stays with him. Trae Westbrook attempts a Layup. Contested by Giannis Booker (2.9 feet, MAN). TRAE WESTBROOK MAKES IT! Assist: Ben Cunningham
Score: 6-7

[09:44] Team_036 possession (Score: 6-7)
Michael Westbrook attempts a 3Pt. Contested by Carmelo Wagner (2.1 feet, ZONE). Michael Westbrook misses. Rebound secured by Ben Cunningham.

[09:29] Team_093 possession (Score: 6-7)
Trae Westbrook attempts a Midrange. Wide open! Giannis Booker is 7.3 feet away. [ZONE] Trae Westbrook misses. Offensive rebound by Carmelo Wagner! Carmelo Wagner kicks it out.

[09:15] Team_093 possession (Score: 6-7)
FOUL! Offensive foul on Vince Barnes! Terry Durant drew the charge! [Team fouls: 3] (Vince Barnes: 1 personal fouls) TURNOVER! (dead ball)

[09:01] Team_036 possession (Score: 6-7)
Michael Westbrook throws a bad pass out of bounds! TURNOVER! (dead ball)

[08:45] Team_093 possession (Score: 6-7)
Damian Williamson attempts a 3Pt. Contested by Michael Westbrook (3.0 feet, MAN). Damian Williamson misses. Rebound secured by Kobe Simmons.

[08:29] Team_036 possession (Score: 6-7)
Giannis Booker drives, picks up Trae Westbrook. Help arrives from Carmelo Wagner! Giannis Booker attempts a Dunk. Contested by Carmelo Wagner (4.3 feet, MAN). GIANNIS BOOKER MAKES IT! Assist: Anthony Poole
Score: 8-7

[08:14] Team_093 possession (Score: 8-7)
Vince Barnes attempts a Midrange. Wide open! Terry Durant is 7.3 feet away. [MAN] VINCE BARNES MAKES IT!
Score: 8-9

[07:59] Team_036 possession (Score: 8-9)
Anthony Poole attempts a 3Pt. Contested by Carmelo Wagner (5.6 feet, ZONE). Anthony Poole misses. Rebound secured by Ben Cunningham.

[07:44] Team_093 possession (Score: 8-9)
Trae Westbrook drives to the basket... Trae Westbrook commits a violation (traveling/carry)! TURNOVER! (dead ball)

[07:29] Team_036 possession (Score: 8-9)
Kobe Simmons drives, picks up Ben Cunningham. Help arrives from Trae Westbrook! Kobe Simmons attempts a Dunk. Wide open! Trae Westbrook is 6.8 feet away. [ZONE] KOBE SIMMONS MAKES IT! Assist: Anthony Poole
Score: 10-9

[07:15] Team_093 possession (Score: 10-9)
Carmelo Wagner loses control! Ball rolls out of bounds! TURNOVER! (dead ball)

[07:00] Team_036 possession (Score: 10-9)
Anthony Poole attempts a Layup. Heavily contested by Ben Cunningham (1.5 feet, ZONE)! ANTHONY POOLE MAKES IT! Assist: Kobe Simmons
Score: 12-9

[06:42] Team_093 possession (Score: 12-9)
Damian Williamson makes the Layup and draws the foul on Terry Durant! And-1! Damian Williamson to the line for 1. [Team fouls: 4] (Terry Durant: 2 personal fouls)   FT 1/1: GOOD Damian Williamson makes 1/1 from the line.
Score: 12-12

[06:25] Team_036 possession (Score: 12-12)
Terry Durant attempts a Layup. Contested by Ben Cunningham (4.9 feet, ZONE). TERRY DURANT MAKES IT! Assist: Michael Westbrook
Score: 14-12

[06:09] Team_093 possession (Score: 14-12)
Vince Barnes attempts a Midrange. Contested by Terry Durant (2.9 feet, MAN). Vince Barnes misses. Rebound secured by Terry Durant.

[05:55] Team_036 possession (Score: 14-12)
Giannis Booker attempts a Layup. Contested by Trae Westbrook (4.5 feet, MAN). GIANNIS BOOKER MAKES IT! Assist: Michael Westbrook
Score: 16-12

[05:39] Team_093 possession (Score: 16-12)
Vince Barnes attempts a 3Pt. Contested by Anthony Poole (2.5 feet, ZONE). VINCE BARNES MAKES IT! Assist: Trae Westbrook
Score: 16-15

[05:29] Team_036 possession (Score: 16-15)
Terry Durant attempts a 3Pt. Contested by Carmelo Wagner (3.7 feet, ZONE). Terry Durant misses. Rebound secured by Ben Cunningham.

[05:13] Team_093 possession (Score: 16-15)
Vince Barnes makes the Dunk and draws the foul on Giannis Booker! And-1! Vince Barnes to the line for 1. [BONUS: 5 team fouls] (Giannis Booker: 3 personal fouls)   FT 1/1: GOOD Vince Barnes makes 1/1 from the line.
Score: 16-18

[05:02] Team_036 possession (Score: 16-18)
Michael Westbrook attempts a 3Pt. Contested by Damian Williamson (4.6 feet, ZONE). Michael Westbrook misses. Rebound secured by Vince Barnes.

[04:48] Team_093 possession (Score: 16-18)
Vince Barnes attempts a Layup. BLOCKED BY KOBE SIMMONS! Ball is loose! Rebound secured by Kobe Simmons.

[04:36] Team_036 possession (Score: 16-18)
Giannis Booker attempts a Layup. Contested by Ben Cunningham (5.7 feet, ZONE). GIANNIS BOOKER MAKES IT! Assist: Michael Westbrook
Score: 18-18

[04:21] Team_093 possession (Score: 18-18)
Vince Barnes attempts a Layup. BLOCKED BY GIANNIS BOOKER! Ball is loose! Rebound secured by Giannis Booker.

[04:05] Team_036 possession (Score: 18-18)
FOUL! Shooting foul on Ben Cunningham. Kobe Simmons to the line for 2 free throws. [Team fouls: 4] (Ben Cunningham: 2 personal fouls)   FT 1/2: GOOD   FT 2/2: MISS Kobe Simmons makes 1/2 from the line. Offensive rebound by Terry Durant! Terry Durant puts it back in!
Score: 21-18

[03:50] Team_093 possession (Score: 21-18)
Damian Williamson drives, Michael Westbrook stays with him. Damian Williamson attempts a Layup. Contested by Michael Westbrook (4.8 feet, MAN). DAMIAN WILLIAMSON MAKES IT! Assist: Trae Westbrook
Score: 21-20

[03:34] Team_036 possession (Score: 21-20)
FOUL! Shooting foul on Carmelo Wagner. Anthony Poole to the line for 2 free throws. [BONUS: 5 team fouls] (Carmelo Wagner: 2 personal fouls)   FT 1/2: GOOD   FT 2/2: GOOD Anthony Poole makes 2/2 from the line.
Score: 23-20

[03:21] Team_093 possession (Score: 23-20)
Trae Westbrook attempts a 3Pt. Contested by Giannis Booker (2.6 feet, MAN). Trae Westbrook misses. Rebound secured by Kobe Simmons.

[03:07] Team_036 possession (Score: 23-20)
Terry Durant attempts a 3Pt. Contested by Carmelo Wagner (4.3 feet, ZONE). Terry Durant misses. Rebound secured by Ben Cunningham.

[02:53] Team_093 possession (Score: 23-20)
FOUL! Holding foul on Terry Durant. [IN THE BONUS! 6 team fouls] Vince Barnes to the line for 2 free throws. (Terry Durant: 3 personal fouls)   FT 1/2: MISS   FT 2/2: MISS Vince Barnes makes 0/2 from the line. Rebound secured by Giannis Booker.

[02:35] Team_036 possession (Score: 23-20)
Kobe Simmons attempts a Midrange. Contested by Ben Cunningham (4.7 feet, MAN). Kobe Simmons misses. FOUL! Loose ball foul on Ben Cunningham during the rebound battle. [IN THE BONUS! 6 team fouls] Kobe Simmons to the line for 2 free throws. (Ben Cunningham: 3 personal fouls)   FT 1/2: GOOD   FT 2/2: GOOD Kobe Simmons makes 2/2 from the line.
Score: 25-20

[02:21] Team_093 possession (Score: 25-20)
Carmelo Wagner attempts a 3Pt. Wide open! Anthony Poole is 7.6 feet away. [MAN] Carmelo Wagner misses. Offensive rebound by Carmelo Wagner! Carmelo Wagner kicks it out.

[02:09] Team_093 possession (Score: 25-20)
Carmelo Wagner attempts a Midrange. Contested by Anthony Poole (5.6 feet, MAN). Carmelo Wagner misses. Rebound secured by Kobe Simmons.

[01:54] Team_036 possession (Score: 25-20)
Giannis Booker throws a bad pass! Stolen by Trae Westbrook! TURNOVER! (live ball)

[01:43] Team_093 possession (Score: 25-20)
Vince Barnes attempts a Midrange. Contested by Terry Durant (6.0 feet, MAN). Vince Barnes misses. Rebound secured by Kobe Simmons.

[01:31] Team_036 possession (Score: 25-20)
Anthony Poole attempts a Midrange. Wide open! Carmelo Wagner is 7.1 feet away. [MAN] Anthony Poole misses. Rebound secured by Vince Barnes.

[01:20] Team_093 possession (Score: 25-20)
Ben Cunningham drives, Kobe Simmons stays with him. Ben Cunningham attempts a Dunk. Heavily contested by Kobe Simmons (1.6 feet, MAN)! BEN CUNNINGHAM MAKES IT! Assist: Trae Westbrook
Score: 25-22

[01:08] Team_036 possession (Score: 25-22)
Terry Durant attempts a 3Pt. Contested by Vince Barnes (4.1 feet, MAN). TERRY DURANT MAKES IT! Assist: Michael Westbrook
Score: 28-22

[00:57] Team_093 possession (Score: 28-22)
Ben Cunningham attempts a Midrange. Contested by Giannis Booker (5.5 feet, ZONE). BEN CUNNINGHAM MAKES IT!
Score: 28-24

[00:39] Team_036 possession (Score: 28-24)
Giannis Booker attempts a Midrange. Wide open! Vince Barnes is 6.3 feet away. [ZONE] GIANNIS BOOKER MAKES IT! Assist: Kobe Simmons
Score: 30-24

[00:22] Team_093 possession (Score: 30-24)
Carmelo Wagner throws a bad pass! Stolen by Anthony Poole! TURNOVER! (live ball)

[00:06] Team_036 possession (Score: 30-24)
Giannis Booker attempts a 3Pt. Contested by Carmelo Wagner (5.7 feet, ZONE). Giannis Booker misses. Rebound secured by Ben Cunningham.

================================================================================
                              1ST QUARTER COMPLETE                              
================================================================================

1ST QUARTER SCORE: Team_036 30, Team_093 24

BOX SCORE:
================================================================================

Team_036
--------------------------------------------------------------------------------
Player                MIN  PTS  REB  AST  TO      FG   FG%      3P   3P%
--------------------------------------------------------------------------------
Terry Durant           12   10    3    0   0   4/6    66.7     0/0   0.0
Giannis Booker         12    8    2    0   0   4/5    80.0     0/0   0.0
Anthony Poole          12    6    0    2   0   3/5    60.0     0/0   0.0
Kobe Simmons           12    4    7    2   0   2/2   100.0     0/0   0.0
Michael Westbrook      12    2    0    5   0   1/3    33.3     0/0   0.0

TEAM: FG: 14/21 (66.7%), 3PT: 2/8 (25.0%), REB: 12 (2 off, 10 def), AST: 9, TO: 3
TEAM FOULS: 6 [Team_093 in BONUS]


Team_093
--------------------------------------------------------------------------------
Player                MIN  PTS  REB  AST  TO      FG   FG%      3P   3P%
--------------------------------------------------------------------------------
Vince Barnes           12    8    2    0   0   3/8    37.5     0/0   0.0
Trae Westbrook         12    6    0    3   0   2/3    66.7     0/0   0.0
Damian Williamson      12    5    0    0   0   2/3    66.7     0/0   0.0
Ben Cunningham         12    4    5    1   0   2/3    66.7     0/0   0.0
Carmelo Wagner         12    0    2    0   0   0/1     0.0     0/0   0.0

TEAM: FG: 9/19 (47.4%), 3PT: 2/5 (40.0%), REB: 9 (2 off, 7 def), AST: 4, TO: 4
TEAM FOULS: 6 [Team_036 in BONUS]

================================================================================

================================================================================
                       2ND QUARTER - Team_036 vs Team_093                       
================================================================================

[12:00] Team_036 possession (Score: 30-24)
Giannis Booker attempts a 3Pt. Contested by Trae Westbrook (4.3 feet, MAN). Giannis Booker misses. Rebound secured by Ben Cunningham.

[11:47] Team_093 possession (Score: 30-24)
Vince Barnes attempts a Layup. Contested by Kobe Simmons (2.2 feet, ZONE). VINCE BARNES MAKES IT! Assist: Trae Westbrook
Score: 30-26

[11:35] Team_036 possession (Score: 30-26)
Anthony Poole makes the Layup and draws the foul on Carmelo Wagner! And-1! Anthony Poole to the line for 1. [Team fouls: 1] (Carmelo Wagner: 1 personal fouls)   FT 1/1: GOOD Anthony Poole makes 1/1 from the line.
Score: 33-26

[11:19] Team_093 possession (Score: 33-26)
Vince Barnes attempts a 3Pt. Contested by Michael Westbrook (5.9 feet, ZONE). Vince Barnes misses. Rebound secured by Giannis Booker.

[11:04] Team_036 possession (Score: 33-26)
Kobe Simmons attempts a Layup. Wide open! Ben Cunningham is 6.2 feet away. [MAN] KOBE SIMMONS MAKES IT!
Score: 35-26

[10:52] Team_093 possession (Score: 35-26)
Vince Barnes attempts a 3Pt. Contested by Terry Durant (4.1 feet, MAN). Vince Barnes misses. Offensive rebound by Ben Cunningham! Ben Cunningham kicks it out.

[10:35] Team_093 possession (Score: 35-26)
FOUL! Shooting foul on Giannis Booker. Carmelo Wagner to the line for 2 free throws. [Team fouls: 1] (Giannis Booker: 1 personal fouls)   FT 1/2: GOOD   FT 2/2: GOOD Carmelo Wagner makes 2/2 from the line.
Score: 35-28

[10:18] Team_036 possession (Score: 35-28)
Kobe Simmons drives, Ben Cunningham stays with him. Kobe Simmons attempts a Dunk. Contested by Ben Cunningham (4.9 feet, ZONE). Kobe Simmons misses. FOUL! Loose ball foul on Vince Barnes during the rebound battle. [Team fouls: 2] No free throws, side out. (Vince Barnes: 1 personal fouls)

[10:04] Team_036 possession (Score: 35-28)
FOUL! Shooting foul on Damian Williamson. Michael Westbrook to the line for 2 free throws. [Team fouls: 3] (Damian Williamson: 1 personal fouls)   FT 1/2: GOOD   FT 2/2: GOOD Michael Westbrook makes 2/2 from the line.
Score: 37-28

[09:50] Team_093 possession (Score: 37-28)
Carmelo Wagner drives, Kobe Simmons stays with him. Carmelo Wagner attempts a Dunk. Contested by Kobe Simmons (2.5 feet, ZONE). CARMELO WAGNER MAKES IT! Assist: Damian Williamson
Score: 37-30

[09:38] Team_036 possession (Score: 37-30)
Giannis Booker drives to the basket... Giannis Booker loses control! Ball rolls out of bounds! TURNOVER! (dead ball)

[09:38] Substitution (Team_036): Michael Westbrook OUT → Dirk Anunoby IN (stamina_rule2)

[09:38] Substitution (Team_036): Giannis Booker OUT → Tobias Fox IN (stamina_rule2)

[09:38] Substitution (Team_036): Anthony Poole OUT → Pascal Antetokounmpo IN (stamina_rule2)

[09:38] Substitution (Team_036): Terry Durant OUT → Devin Simmons IN (stamina_rule2)

[09:38] Substitution (Team_036): Kobe Simmons OUT → Bradley Murray IN (stamina_rule2)

[09:38] Substitution (Team_093): Damian Williamson OUT → Shaquille George IN (stamina_rule2)

[09:38] Substitution (Team_093): Trae Westbrook OUT → Immanuel Cunningham IN (stamina_rule2)

[09:38] Substitution (Team_093): Carmelo Wagner OUT → Lauri Parker IN (stamina_rule2)

[09:38] Substitution (Team_093): Vince Barnes OUT → Kobe Murray IN (stamina_rule2)

[09:38] Substitution (Team_093): Ben Cunningham OUT → Cade O'Neal IN (stamina_rule2)

[09:24] Team_093 possession (Score: 37-30)
Immanuel Cunningham attempts a Midrange. Contested by Devin Simmons (2.7 feet, ZONE). Immanuel Cunningham misses. Rebound secured by Devin Simmons.

[09:09] Team_036 possession (Score: 37-30)
Bradley Murray attempts a Midrange. Contested by Kobe Murray (4.4 feet, MAN). Bradley Murray misses. Rebound secured by Lauri Parker.

[08:59] Team_093 possession (Score: 37-30)
Kobe Murray attempts a Midrange. Contested by Devin Simmons (5.5 feet, MAN). Kobe Murray misses. Offensive rebound by Kobe Murray! Kobe Murray puts it back in!
Score: 37-32

[08:47] Team_036 possession (Score: 37-32)
FOUL! Holding foul on Kobe Murray. [Team fouls: 4] No free throws, side out. (Kobe Murray: 1 personal fouls)

[08:35] Team_036 possession (Score: 37-32)
FOUL! Shooting foul on Kobe Murray. Devin Simmons to the line for 2 free throws. [BONUS: 5 team fouls] (Kobe Murray: 2 personal fouls)   FT 1/2: GOOD   FT 2/2: GOOD Devin Simmons makes 2/2 from the line.
Score: 39-32

[08:20] Team_093 possession (Score: 39-32)
Immanuel Cunningham attempts a Layup. Wide open! Devin Simmons is 6.5 feet away. [ZONE] IMMANUEL CUNNINGHAM MAKES IT! Assist: Shaquille George
Score: 39-34

[08:04] Team_036 possession (Score: 39-34)
FOUL! Holding foul on Lauri Parker. [IN THE BONUS! 6 team fouls] Pascal Antetokounmpo to the line for 2 free throws. (Lauri Parker: 1 personal fouls)   FT 1/2: GOOD   FT 2/2: GOOD Pascal Antetokounmpo makes 2/2 from the line.
Score: 41-34

[07:51] Team_093 possession (Score: 41-34)
Lauri Parker attempts a Layup. Heavily contested by Bradley Murray (1.5 feet, ZONE)! Lauri Parker misses. Rebound secured by Bradley Murray.

[07:37] Team_036 possession (Score: 41-34)
Dirk Anunoby attempts a Midrange. Contested by Shaquille George (5.3 feet, MAN). Dirk Anunoby misses. Rebound secured by Cade O'Neal.

[07:21] Team_093 possession (Score: 41-34)
Shaquille George attempts a 3Pt. Wide open! Dirk Anunoby is 8.5 feet away. [MAN] SHAQUILLE GEORGE MAKES IT! Assist: Lauri Parker
Score: 41-37

[07:05] Team_036 possession (Score: 41-37)
Devin Simmons attempts a Midrange. Wide open! Kobe Murray is 6.3 feet away. [MAN] DEVIN SIMMONS MAKES IT! Assist: Dirk Anunoby
Score: 43-37

[06:53] Team_093 possession (Score: 43-37)
Kobe Murray drives and kicks out. Cade O'Neal attempts a 3Pt. Contested by Tobias Fox (2.8 feet, ZONE). Cade O'Neal misses. Rebound secured by Devin Simmons.

[06:37] Team_036 possession (Score: 43-37)
Bradley Murray drives to the basket... Bradley Murray throws a bad pass! Stolen by Kobe Murray! TURNOVER! (live ball)

[06:22] Team_093 possession (Score: 43-37)
Shaquille George drives and kicks out. Kobe Murray attempts a 3Pt. Contested by Devin Simmons (3.4 feet, MAN). KOBE MURRAY MAKES IT! Assist: Lauri Parker
Score: 43-40

[06:04] Team_036 possession (Score: 43-40)
Pascal Antetokounmpo attempts a 3Pt. Contested by Lauri Parker (4.7 feet, MAN). Pascal Antetokounmpo misses. Offensive rebound by Bradley Murray! Bradley Murray kicks it out.

[05:50] Team_036 possession (Score: 43-40)
Bradley Murray attempts a Layup. Heavily contested by Kobe Murray (0.5 feet, ZONE)! BRADLEY MURRAY MAKES IT! Assist: Dirk Anunoby
Score: 45-40

[05:32] Team_093 possession (Score: 45-40)
FOUL! Offensive foul on Lauri Parker! Pascal Antetokounmpo drew the charge! [Team fouls: 7] (Lauri Parker: 2 personal fouls) TURNOVER! (dead ball)

[05:16] Team_036 possession (Score: 45-40)
Bradley Murray attempts a 3Pt. Contested by Shaquille George (5.4 feet, ZONE). Bradley Murray misses. Rebound secured by Kobe Murray.

[05:02] Team_093 possession (Score: 45-40)
Kobe Murray drives and kicks out. Shaquille George attempts a Midrange. Contested by Dirk Anunoby (5.7 feet, MAN). Shaquille George misses. Rebound secured by Bradley Murray.

[04:48] Team_036 possession (Score: 45-40)
Tobias Fox drives, Immanuel Cunningham stays with him. Tobias Fox attempts a Dunk. Contested by Immanuel Cunningham (2.8 feet, MAN). TOBIAS FOX MAKES IT! Assist: Pascal Antetokounmpo
Score: 47-40

[04:32] Team_093 possession (Score: 47-40)
Immanuel Cunningham attempts a Layup. BLOCKED BY DEVIN SIMMONS! Ball is loose! Rebound secured by Devin Simmons.

[04:16] Team_036 possession (Score: 47-40)
Dirk Anunoby attempts a Midrange. Contested by Shaquille George (4.2 feet, MAN). DIRK ANUNOBY MAKES IT!
Score: 49-40

[04:05] Team_093 possession (Score: 49-40)
Cade O'Neal loses control! Ball rolls out of bounds! TURNOVER! (dead ball)

[03:53] Team_036 possession (Score: 49-40)
FOUL! Reach-in foul on Immanuel Cunningham during the drive. [IN THE BONUS! 8 team fouls] Tobias Fox to the line for 2 free throws. (Immanuel Cunningham: 1 personal fouls)   FT 1/2: GOOD   FT 2/2: GOOD Tobias Fox makes 2/2 from the line.
Score: 51-40

[03:40] Team_093 possession (Score: 51-40)
FOUL! Reach-in foul on Tobias Fox during the drive. [Team fouls: 2] No free throws, side out. (Tobias Fox: 1 personal fouls)

[03:26] Team_093 possession (Score: 51-40)
FOUL! Shooting foul on Devin Simmons. Immanuel Cunningham to the line for 2 free throws. [Team fouls: 3] (Devin Simmons: 1 personal fouls)   FT 1/2: GOOD   FT 2/2: GOOD Immanuel Cunningham makes 2/2 from the line.
Score: 51-42

[03:13] Team_036 possession (Score: 51-42)
Pascal Antetokounmpo attempts a Layup. Contested by Cade O'Neal (3.9 feet, ZONE). PASCAL ANTETOKOUNMPO MAKES IT! Assist: Devin Simmons
Score: 53-42

[03:02] Team_093 possession (Score: 53-42)
Immanuel Cunningham attempts a 3Pt. Contested by Devin Simmons (4.5 feet, ZONE). Immanuel Cunningham misses. Rebound secured by Bradley Murray.

[02:48] Team_036 possession (Score: 53-42)
Pascal Antetokounmpo attempts a 3Pt. Contested by Lauri Parker (4.6 feet, MAN). Pascal Antetokounmpo misses. Rebound secured by Lauri Parker.

[02:31] Team_093 possession (Score: 53-42)
Lauri Parker attempts a Layup. Contested by Pascal Antetokounmpo (5.8 feet, MAN). Lauri Parker misses. Rebound secured by Devin Simmons.

[02:17] Team_036 possession (Score: 53-42)
Dirk Anunoby drives to the basket... Dirk Anunoby loses the ball! Stripped by Kobe Murray! TURNOVER! (live ball)

[01:58] Team_093 possession (Score: 53-42)
Lauri Parker throws a bad pass! Stolen by Pascal Antetokounmpo! TURNOVER! (live ball)

[01:43] Team_036 possession (Score: 53-42)
Dirk Anunoby attempts a Layup. Contested by Shaquille George (4.8 feet, MAN). DIRK ANUNOBY MAKES IT! Assist: Tobias Fox
Score: 55-42

[01:31] Team_093 possession (Score: 55-42)
Kobe Murray attempts a 3Pt. Contested by Tobias Fox (2.5 feet, ZONE). Kobe Murray misses. Rebound secured by Pascal Antetokounmpo.

[01:18] Team_036 possession (Score: 55-42)
Dirk Anunoby attempts a 3Pt. Contested by Shaquille George (4.2 feet, MAN). DIRK ANUNOBY MAKES IT! Assist: Pascal Antetokounmpo
Score: 58-42

[01:04] Team_093 possession (Score: 58-42)
Kobe Murray attempts a 3Pt. Contested by Tobias Fox (4.8 feet, ZONE). Kobe Murray misses. Offensive rebound by Kobe Murray! Kobe Murray puts it back in!
Score: 58-44

[00:48] Team_036 possession (Score: 58-44)
Tobias Fox attempts a Layup. BLOCKED BY IMMANUEL CUNNINGHAM! Ball is loose! Offensive rebound by Bradley Murray! Bradley Murray kicks it out.

[00:29] Team_036 possession (Score: 58-44)
FOUL! Offensive foul on Pascal Antetokounmpo! Lauri Parker drew the charge! [Team fouls: 4] (Pascal Antetokounmpo: 1 personal fouls) TURNOVER! (dead ball)

[00:15] Team_093 possession (Score: 58-44)
Lauri Parker attempts a 3Pt. Contested by Tobias Fox (4.2 feet, ZONE). Lauri Parker misses. Rebound secured by Bradley Murray.

================================================================================
                              2ND QUARTER COMPLETE                              
================================================================================

2ND QUARTER SCORE: Team_036 28, Team_093 20

BOX SCORE:
================================================================================

Team_036
--------------------------------------------------------------------------------
Player                MIN  PTS  REB  AST  TO      FG   FG%      3P   3P%
--------------------------------------------------------------------------------
Dirk Anunoby            9    7    0    2   0   3/4    75.0     0/0   0.0
Devin Simmons           9    4    4    1   0   2/2   100.0     0/0   0.0
Pascal Antetokounmpo    9    4    1    2   0   2/3    66.7     0/0   0.0
Tobias Fox              9    4    0    1   0   2/2   100.0     0/0   0.0
Anthony Poole          15    3    0    0   0   1/1   100.0     0/0   0.0
Kobe Simmons           15    2    0    0   0   1/1   100.0     0/0   0.0
Michael Westbrook      15    2    0    0   0   1/1   100.0     0/0   0.0
Bradley Murray          9    2    6    0   0   1/3    33.3     0/0   0.0
Giannis Booker         15    0    1    0   0   0/1     0.0     0/0   0.0
Terry Durant           15    0    1    0   0   0/0     0.0     0/0   0.0

TEAM: FG: 13/18 (72.2%), 3PT: 1/4 (25.0%), REB: 13 (3 off, 10 def), AST: 6, TO: 4
TEAM FOULS: 4


Team_093
--------------------------------------------------------------------------------
Player                MIN  PTS  REB  AST  TO      FG   FG%      3P   3P%
--------------------------------------------------------------------------------
Kobe Murray             9    7    3    0   0   3/6    50.0     0/0   0.0
Carmelo Wagner         15    4    0    0   0   2/2   100.0     0/0   0.0
Immanuel Cunningham     9    4    0    0   0   2/5    40.0     0/0   0.0
Shaquille George        9    3    0    1   0   1/1   100.0     0/0   0.0
Vince Barnes           15    2    0    0   0   1/2    50.0     0/0   0.0
Ben Cunningham         15    0    2    0   0   0/0     0.0     0/0   0.0
Trae Westbrook         15    0    0    1   0   0/0     0.0     0/0   0.0
Damian Williamson      15    0    0    1   0   0/0     0.0     0/0   0.0
Lauri Parker            9    0    2    2   0   0/3     0.0     0/0   0.0
Cade O'Neal             9    0    1    0   0   0/0     0.0     0/0   0.0

TEAM: FG: 9/19 (47.4%), 3PT: 2/6 (33.3%), REB: 8 (3 off, 5 def), AST: 5, TO: 3
TEAM FOULS: 8 [Team_036 in BONUS]

================================================================================

================================================================================
                       3RD QUARTER - Team_036 vs Team_093                       
================================================================================

[12:00] Team_036 possession (Score: 58-44)
Anthony Poole makes the Midrange and draws the foul on Carmelo Wagner! And-1! Anthony Poole to the line for 1. [Team fouls: 1] (Carmelo Wagner: 1 personal fouls)   FT 1/1: GOOD Anthony Poole makes 1/1 from the line.
Score: 61-44

[11:44] Team_093 possession (Score: 61-44)
Damian Williamson drives to the basket... Damian Williamson loses control! Ball rolls out of bounds! TURNOVER! (dead ball)

[11:29] Team_036 possession (Score: 61-44)
Michael Westbrook attempts a 3Pt. Contested by Carmelo Wagner (5.3 feet, ZONE). Michael Westbrook misses. Rebound secured by Ben Cunningham.

[11:15] Team_093 possession (Score: 61-44)
Vince Barnes attempts a Layup. Heavily contested by Kobe Simmons (0.5 feet, ZONE)! VINCE BARNES MAKES IT!
Score: 61-46

[11:03] Team_036 possession (Score: 61-46)
Anthony Poole attempts a 3Pt. Contested by Carmelo Wagner (5.5 feet, MAN). Anthony Poole misses. Rebound secured by Vince Barnes.

[10:50] Team_093 possession (Score: 61-46)
Carmelo Wagner drives to the basket... Carmelo Wagner loses the ball! Stripped by Anthony Poole! TURNOVER! (live ball)

[10:35] Team_036 possession (Score: 61-46)
Giannis Booker attempts a Midrange. Contested by Vince Barnes (5.8 feet, ZONE). GIANNIS BOOKER MAKES IT! Assist: Terry Durant
Score: 63-46

[10:22] Team_093 possession (Score: 63-46)
Damian Williamson drives, picks up Michael Westbrook. Help arrives from Anthony Poole! Damian Williamson attempts a Dunk. Wide open! Anthony Poole is 7.0 feet away. [MAN] Damian Williamson misses. Rebound secured by Giannis Booker.

[10:10] Team_036 possession (Score: 63-46)
FOUL! Reach-in foul on Carmelo Wagner during the drive. [Team fouls: 2] No free throws, side out. (Carmelo Wagner: 2 personal fouls)

[09:51] Team_036 possession (Score: 63-46)
Kobe Simmons attempts a Midrange. Wide open! Vince Barnes is 7.7 feet away. [ZONE] KOBE SIMMONS MAKES IT!
Score: 65-46

[09:34] Team_093 possession (Score: 65-46)
Damian Williamson attempts a Midrange. Contested by Michael Westbrook (3.6 feet, MAN). Damian Williamson misses. Rebound secured by Kobe Simmons.

[09:16] Team_036 possession (Score: 65-46)
Michael Westbrook attempts a Midrange. Wide open! Damian Williamson is 9.3 feet away. [MAN] MICHAEL WESTBROOK MAKES IT! Assist: Terry Durant
Score: 67-46

[09:00] Team_093 possession (Score: 67-46)
Ben Cunningham drives and kicks out. Trae Westbrook attempts a Midrange. Wide open! Anthony Poole is 8.8 feet away. [ZONE] Trae Westbrook misses. Rebound secured by Giannis Booker.

[08:44] Team_036 possession (Score: 67-46)
Terry Durant attempts a Midrange. Wide open! Ben Cunningham is 6.3 feet away. [ZONE] Terry Durant misses. Rebound secured by Carmelo Wagner.

[08:32] Team_093 possession (Score: 67-46)
Vince Barnes attempts a Midrange. Contested by Terry Durant (5.6 feet, MAN). VINCE BARNES MAKES IT! Assist: Carmelo Wagner
Score: 67-48

[08:20] Team_036 possession (Score: 67-48)
Kobe Simmons attempts a Layup. Contested by Ben Cunningham (4.2 feet, MAN). KOBE SIMMONS MAKES IT! Assist: Michael Westbrook
Score: 69-48

[08:06] Team_093 possession (Score: 69-48)
Carmelo Wagner drives and kicks out. Carmelo Wagner attempts a 3Pt. Contested by Michael Westbrook (2.2 feet, ZONE). CARMELO WAGNER MAKES IT! Assist: Damian Williamson
Score: 69-51

[07:51] Team_036 possession (Score: 69-51)
Terry Durant attempts a Midrange. Wide open! Carmelo Wagner is 6.7 feet away. [ZONE] Terry Durant misses. Rebound secured by Vince Barnes.

[07:39] Team_093 possession (Score: 69-51)
Ben Cunningham attempts a Midrange. Contested by Kobe Simmons (3.2 feet, MAN). Ben Cunningham misses. Rebound secured by Terry Durant.

[07:25] Team_036 possession (Score: 69-51)
Kobe Simmons attempts a 3Pt. Contested by Ben Cunningham (4.6 feet, MAN). KOBE SIMMONS MAKES IT! Assist: Michael Westbrook
Score: 72-51

[07:11] Team_093 possession (Score: 72-51)
Carmelo Wagner attempts a 3Pt. Wide open! Giannis Booker is 6.1 feet away. [ZONE] CARMELO WAGNER MAKES IT! Assist: Ben Cunningham
Score: 72-54

[06:57] Team_036 possession (Score: 72-54)
Terry Durant attempts a 3Pt. Wide open! Vince Barnes is 7.8 feet away. [MAN] Terry Durant misses. Rebound secured by Vince Barnes.

[06:43] Team_093 possession (Score: 72-54)
Ben Cunningham attempts a Layup. Contested by Kobe Simmons (4.4 feet, MAN). BEN CUNNINGHAM MAKES IT! Assist: Carmelo Wagner
Score: 72-56

[06:24] Team_036 possession (Score: 72-56)
Terry Durant attempts a 3Pt. Wide open! Carmelo Wagner is 7.6 feet away. [ZONE] TERRY DURANT MAKES IT! Assist: Kobe Simmons
Score: 75-56

[06:06] Team_093 possession (Score: 75-56)
Damian Williamson attempts a 3Pt. Contested by Michael Westbrook (4.1 feet, MAN). Damian Williamson misses. Rebound secured by Kobe Simmons.

[05:48] Team_036 possession (Score: 75-56)
Terry Durant attempts a 3Pt. Contested by Carmelo Wagner (4.0 feet, ZONE). TERRY DURANT MAKES IT! Assist: Michael Westbrook
Score: 78-56

[05:37] Team_093 possession (Score: 78-56)
Vince Barnes attempts a Layup. Wide open! Terry Durant is 6.3 feet away. [MAN] VINCE BARNES MAKES IT! Assist: Trae Westbrook
Score: 78-58

[05:19] Team_036 possession (Score: 78-58)
FOUL! Holding foul on Damian Williamson. [Team fouls: 3] No free throws, side out. (Damian Williamson: 1 personal fouls)

[05:05] Team_036 possession (Score: 78-58)
Giannis Booker attempts a 3Pt. Contested by Trae Westbrook (4.8 feet, MAN). GIANNIS BOOKER MAKES IT! Assist: Kobe Simmons
Score: 81-58

[04:48] Team_093 possession (Score: 81-58)
FOUL! Shooting foul on Michael Westbrook. Damian Williamson to the line for 3 free throws. [Team fouls: 1] (Michael Westbrook: 1 personal fouls)   FT 1/3: GOOD   FT 2/3: GOOD   FT 3/3: GOOD Damian Williamson makes 3/3 from the line.
Score: 81-61

[04:34] Team_036 possession (Score: 81-61)
Terry Durant attempts a 3Pt. Contested by Carmelo Wagner (2.8 feet, ZONE). TERRY DURANT MAKES IT! Assist: Michael Westbrook
Score: 84-61

[04:23] Team_093 possession (Score: 84-61)
Trae Westbrook drives to the basket... FOUL! Offensive foul on Trae Westbrook! Giannis Booker drew the charge! [Team fouls: 4] (Trae Westbrook: 1 personal fouls) TURNOVER! (dead ball)

[04:09] Team_036 possession (Score: 84-61)
FOUL! Holding foul on Trae Westbrook. [IN THE BONUS! 5 team fouls] Giannis Booker to the line for 2 free throws. (Trae Westbrook: 2 personal fouls)   FT 1/2: GOOD   FT 2/2: GOOD Giannis Booker makes 2/2 from the line.
Score: 86-61

[03:53] Team_093 possession (Score: 86-61)
Vince Barnes attempts a Layup. Contested by Terry Durant (4.4 feet, MAN). Vince Barnes misses. Offensive rebound by Ben Cunningham! Ben Cunningham kicks it out.

[03:38] Team_093 possession (Score: 86-61)
Vince Barnes drives and kicks out. Trae Westbrook attempts a Midrange. Contested by Giannis Booker (5.4 feet, MAN). TRAE WESTBROOK MAKES IT! Assist: Damian Williamson
Score: 86-63

[03:27] Team_036 possession (Score: 86-63)
Anthony Poole attempts a 3Pt. Contested by Carmelo Wagner (4.4 feet, MAN). Anthony Poole misses. Rebound secured by Carmelo Wagner.

[03:12] Team_093 possession (Score: 86-63)
FOUL! Holding foul on Giannis Booker. [Team fouls: 2] No free throws, side out. (Giannis Booker: 1 personal fouls)

[02:56] Team_093 possession (Score: 86-63)
Vince Barnes attempts a 3Pt. Wide open! Terry Durant is 6.5 feet away. [MAN] Vince Barnes misses. Rebound secured by Kobe Simmons.

[02:42] Team_036 possession (Score: 86-63)
Michael Westbrook attempts a Midrange. Contested by Vince Barnes (4.3 feet, ZONE). Michael Westbrook misses. Rebound secured by Vince Barnes.

[02:24] Team_093 possession (Score: 86-63)
Vince Barnes attempts a Midrange. Contested by Terry Durant (3.0 feet, MAN). Vince Barnes misses. Offensive rebound by Ben Cunningham! Ben Cunningham kicks it out.

[02:05] Team_093 possession (Score: 86-63)
Damian Williamson attempts a Midrange. Contested by Terry Durant (2.8 feet, ZONE). DAMIAN WILLIAMSON MAKES IT!
Score: 86-65

[01:50] Team_036 possession (Score: 86-65)
Giannis Booker attempts a 3Pt. Contested by Carmelo Wagner (5.1 feet, ZONE). Giannis Booker misses. Rebound secured by Carmelo Wagner.

[01:38] Team_093 possession (Score: 86-65)
Trae Westbrook attempts a Layup. Heavily contested by Giannis Booker (1.6 feet, MAN)! TRAE WESTBROOK MAKES IT!
Score: 86-67

[01:23] Team_036 possession (Score: 86-67)
Terry Durant attempts a Midrange. Wide open! Vince Barnes is 7.9 feet away. [MAN] TERRY DURANT MAKES IT! Assist: Anthony Poole
Score: 88-67

[01:08] Team_093 possession (Score: 88-67)
Trae Westbrook attempts a 3Pt. Wide open! Giannis Booker is 9.1 feet away. [MAN] Trae Westbrook misses. Rebound secured by Terry Durant.

[00:51] Team_036 possession (Score: 88-67)
Giannis Booker attempts a Layup. Contested by Trae Westbrook (5.0 feet, MAN). GIANNIS BOOKER MAKES IT! Assist: Anthony Poole
Score: 90-67

[00:34] Team_093 possession (Score: 90-67)
Damian Williamson drives and kicks out. Vince Barnes attempts a 3Pt. Contested by Michael Westbrook (3.5 feet, ZONE). Vince Barnes misses. Rebound secured by Terry Durant.

[00:19] Team_036 possession (Score: 90-67)
Kobe Simmons makes the Layup and draws the foul on Ben Cunningham! And-1! Kobe Simmons to the line for 1. [BONUS: 6 team fouls] (Ben Cunningham: 1 personal fouls)   FT 1/1: GOOD Kobe Simmons makes 1/1 from the line.
Score: 93-67

[00:06] Team_093 possession (Score: 93-67)
Damian Williamson attempts a Midrange. Contested by Michael Westbrook (4.9 feet, MAN). Damian Williamson misses. Rebound secured by Kobe Simmons.

================================================================================
                              3RD QUARTER COMPLETE                              
================================================================================

3RD QUARTER SCORE: Team_036 35, Team_093 23

BOX SCORE:
================================================================================

Team_036
--------------------------------------------------------------------------------
Player                MIN  PTS  REB  AST  TO      FG   FG%      3P   3P%
--------------------------------------------------------------------------------
Terry Durant           27   11    3    2   0   4/7    57.1     0/0   0.0
Kobe Simmons           27   10    4    2   0   4/4   100.0     0/0   0.0
Giannis Booker         27    9    2    0   0   4/5    80.0     0/0   0.0
Anthony Poole          27    3    0    2   0   1/3    33.3     0/0   0.0
Michael Westbrook      27    2    0    4   0   1/3    33.3     0/0   0.0

TEAM: FG: 14/22 (63.6%), 3PT: 5/10 (50.0%), REB: 9 (0 off, 9 def), AST: 10, TO: 0
TEAM FOULS: 2


Team_093
--------------------------------------------------------------------------------
Player                MIN  PTS  REB  AST  TO      FG   FG%      3P   3P%
--------------------------------------------------------------------------------
Vince Barnes           27    6    4    0   0   3/4    75.0     0/0   0.0
Carmelo Wagner         27    6    3    2   0   2/2   100.0     0/0   0.0
Damian Williamson      27    5    0    2   0   2/7    28.6     0/0   0.0
Trae Westbrook         27    4    0    1   0   2/3    66.7     0/0   0.0
Ben Cunningham         27    2    3    1   0   1/3    33.3     0/0   0.0

TEAM: FG: 10/19 (52.6%), 3PT: 2/5 (40.0%), REB: 10 (2 off, 8 def), AST: 6, TO: 3
TEAM FOULS: 6 [Team_036 in BONUS]

================================================================================

================================================================================
                       4TH QUARTER - Team_036 vs Team_093                       
================================================================================

[12:00] Team_036 possession (Score: 93-67)
Michael Westbrook attempts a Midrange. Contested by Carmelo Wagner (3.1 feet, ZONE). Michael Westbrook misses. Offensive rebound by Terry Durant! Terry Durant puts it back in!
Score: 95-67

[11:47] Team_093 possession (Score: 95-67)
Carmelo Wagner attempts a 3Pt. Contested by Anthony Poole (5.5 feet, MAN). Carmelo Wagner misses. Rebound secured by Giannis Booker.

[11:29] Team_036 possession (Score: 95-67)
Michael Westbrook attempts a 3Pt. Contested by Damian Williamson (6.0 feet, MAN). Michael Westbrook misses. Offensive rebound by Kobe Simmons! Kobe Simmons's putback is no good. Offensive rebound by Terry Durant! Terry Durant kicks it out.

[11:17] Team_036 possession (Score: 95-67)
Giannis Booker attempts a Layup. Contested by Ben Cunningham (4.9 feet, ZONE). GIANNIS BOOKER MAKES IT! Assist: Kobe Simmons
Score: 97-67

[10:59] Team_093 possession (Score: 97-67)
Damian Williamson attempts a Layup. Contested by Michael Westbrook (4.1 feet, MAN). DAMIAN WILLIAMSON MAKES IT!
Score: 97-69

[10:43] Team_036 possession (Score: 97-69)
FOUL! Holding foul on Ben Cunningham. [Team fouls: 1] No free throws, side out. (Ben Cunningham: 1 personal fouls)

[10:31] Team_036 possession (Score: 97-69)
FOUL! Reach-in foul on Ben Cunningham during the drive. [Team fouls: 2] No free throws, side out. (Ben Cunningham: 2 personal fouls)

[10:18] Team_036 possession (Score: 97-69)
Michael Westbrook attempts a Layup. Contested by Ben Cunningham (4.3 feet, ZONE). MICHAEL WESTBROOK MAKES IT!
Score: 99-69

[10:00] Team_093 possession (Score: 99-69)
Carmelo Wagner attempts a 3Pt. Wide open! Michael Westbrook is 7.4 feet away. [ZONE] CARMELO WAGNER MAKES IT! Assist: Ben Cunningham
Score: 99-72

[09:45] Team_036 possession (Score: 99-72)
Kobe Simmons makes the Layup and draws the foul on Ben Cunningham! And-1! Kobe Simmons to the line for 1. [Team fouls: 3] (Ben Cunningham: 3 personal fouls)   FT 1/1: GOOD Kobe Simmons makes 1/1 from the line.
Score: 102-72

[09:29] Team_093 possession (Score: 102-72)
Ben Cunningham attempts a Midrange. Contested by Anthony Poole (5.1 feet, ZONE). BEN CUNNINGHAM MAKES IT!
Score: 102-74

[09:13] Team_036 possession (Score: 102-74)
Kobe Simmons drives and kicks out. Michael Westbrook attempts a 3Pt. Wide open! Carmelo Wagner is 7.2 feet away. [ZONE] Michael Westbrook misses. Offensive rebound by Kobe Simmons! Kobe Simmons puts it back in!
Score: 104-74

[09:01] Team_093 possession (Score: 104-74)
Damian Williamson drives, picks up Kobe Simmons. Help arrives from Giannis Booker! Damian Williamson attempts a Dunk. Contested by Giannis Booker (3.7 feet, ZONE). DAMIAN WILLIAMSON MAKES IT! Assist: Vince Barnes
Score: 104-76

[08:47] Team_036 possession (Score: 104-76)
Kobe Simmons attempts a 3Pt. Wide open! Ben Cunningham is 6.4 feet away. [MAN] Kobe Simmons misses. Rebound secured by Vince Barnes.

[08:32] Team_093 possession (Score: 104-76)
Trae Westbrook attempts a 3Pt. Contested by Michael Westbrook (5.5 feet, ZONE). TRAE WESTBROOK MAKES IT!
Score: 104-79

[08:16] Team_036 possession (Score: 104-79)
Kobe Simmons makes the Layup and draws the foul on Ben Cunningham! And-1! Kobe Simmons to the line for 1. [Team fouls: 4] (Ben Cunningham: 4 personal fouls)   FT 1/1: MISS Kobe Simmons makes 0/1 from the line. Rebound secured by Ben Cunningham.
Score: 106-79

[07:59] Team_093 possession (Score: 106-79)
Damian Williamson attempts a Midrange. Contested by Kobe Simmons (4.9 feet, ZONE). Damian Williamson misses. Rebound secured by Kobe Simmons.

[07:44] Team_036 possession (Score: 106-79)
Kobe Simmons makes the Layup and draws the foul on Ben Cunningham! And-1! Kobe Simmons to the line for 1. [BONUS: 5 team fouls] (Ben Cunningham: 5 personal fouls)   FT 1/1: GOOD Kobe Simmons makes 1/1 from the line.
Score: 109-79

[07:32] Team_093 possession (Score: 109-79)
Carmelo Wagner drives and kicks out. Carmelo Wagner attempts a 3Pt. Contested by Michael Westbrook (5.3 feet, ZONE). Carmelo Wagner misses. Rebound secured by Kobe Simmons.

[07:18] Team_036 possession (Score: 109-79)
Giannis Booker attempts a 3Pt. Wide open! Trae Westbrook is 10.0 feet away. [MAN] GIANNIS BOOKER MAKES IT! Assist: Kobe Simmons
Score: 112-79

[07:07] Team_093 possession (Score: 112-79)
Vince Barnes attempts a Midrange. Wide open! Terry Durant is 10.0 feet away. [MAN] Vince Barnes misses. Rebound secured by Kobe Simmons.

[06:50] Team_036 possession (Score: 112-79)
Anthony Poole attempts a Midrange. Wide open! Carmelo Wagner is 6.1 feet away. [MAN] ANTHONY POOLE MAKES IT! Assist: Kobe Simmons
Score: 114-79

[06:34] Team_093 possession (Score: 114-79)
FOUL! Shooting foul on Anthony Poole. Carmelo Wagner to the line for 3 free throws. [Team fouls: 1] (Anthony Poole: 1 personal fouls)   FT 1/3: GOOD   FT 2/3: GOOD   FT 3/3: GOOD Carmelo Wagner makes 3/3 from the line.
Score: 114-82

[06:18] Team_036 possession (Score: 114-82)
Michael Westbrook attempts a 3Pt. Wide open! Damian Williamson is 10.0 feet away. [MAN] Michael Westbrook misses. Rebound secured by Ben Cunningham.

[06:02] Team_093 possession (Score: 114-82)
FOUL! Offensive foul on Ben Cunningham! Kobe Simmons drew the charge! [Team fouls: 6] (Ben Cunningham: 6 personal fouls) TURNOVER! (dead ball)

[06:02] Substitution (Team_093): Ben Cunningham OUT (stamina: 47) → Shaquille George IN (foul_out)

[05:49] Team_036 possession (Score: 114-82)
Kobe Simmons throws a bad pass! Stolen by Vince Barnes! TURNOVER! (live ball)

[05:34] Team_093 possession (Score: 114-82)
Carmelo Wagner attempts a 3Pt. Contested by Anthony Poole (4.7 feet, MAN). Carmelo Wagner misses. Offensive rebound by Shaquille George! Shaquille George kicks it out.

[05:17] Team_093 possession (Score: 114-82)
Vince Barnes drives, picks up Terry Durant. Help arrives from Giannis Booker! Vince Barnes attempts a Layup. Contested by Giannis Booker (5.6 feet, MAN). Vince Barnes misses. Rebound secured by Kobe Simmons.

[05:04] Team_036 possession (Score: 114-82)
Michael Westbrook throws a bad pass out of bounds! TURNOVER! (dead ball)

[05:04] Substitution (Team_036): Michael Westbrook OUT → Dirk Anunoby IN (stamina_rule2)

[05:04] Substitution (Team_036): Giannis Booker OUT → Tobias Fox IN (stamina_rule2)

[05:04] Substitution (Team_036): Anthony Poole OUT → Pascal Antetokounmpo IN (stamina_rule2)

[05:04] Substitution (Team_036): Terry Durant OUT → Devin Simmons IN (stamina_rule2)

[05:04] Substitution (Team_036): Kobe Simmons OUT → Bradley Murray IN (stamina_rule2)

[05:04] Substitution (Team_093): Damian Williamson OUT → Immanuel Cunningham IN (stamina_rule2)

[05:04] Substitution (Team_093): Trae Westbrook OUT → Damian Williamson IN (stamina_rule2)

[05:04] Substitution (Team_093): Carmelo Wagner OUT → Lauri Parker IN (stamina_rule2)

[05:04] Substitution (Team_093): Vince Barnes OUT → Kobe Murray IN (stamina_rule2)

[04:51] Team_093 possession (Score: 114-82)
Lauri Parker attempts a 3Pt. Contested by Pascal Antetokounmpo (5.3 feet, ZONE). Lauri Parker misses. Rebound secured by Devin Simmons.

[04:35] Team_036 possession (Score: 114-82)
Bradley Murray makes the Layup and draws the foul on Immanuel Cunningham! And-1! Bradley Murray to the line for 1. [BONUS: 7 team fouls] (Immanuel Cunningham: 1 personal fouls)   FT 1/1: MISS Bradley Murray makes 0/1 from the line. Rebound secured by Lauri Parker.
Score: 116-82

[04:17] Team_093 possession (Score: 116-82)
Lauri Parker drives, picks up Devin Simmons. Help arrives from Dirk Anunoby! Lauri Parker attempts a Dunk. Contested by Dirk Anunoby (3.4 feet, ZONE). LAURI PARKER MAKES IT! Assist: Immanuel Cunningham
Score: 116-84

[04:02] Team_036 possession (Score: 116-84)
Tobias Fox attempts a 3Pt. Contested by Shaquille George (5.1 feet, ZONE). Tobias Fox misses. Offensive rebound by Bradley Murray! Bradley Murray kicks it out.

[03:49] Team_036 possession (Score: 116-84)
Devin Simmons attempts a 3Pt. Heavily contested by Kobe Murray (1.3 feet, MAN)! Devin Simmons misses. Rebound secured by Kobe Murray.

[03:37] Team_093 possession (Score: 116-84)
Shaquille George attempts a 3Pt. Contested by Dirk Anunoby (5.6 feet, MAN). Shaquille George misses. Rebound secured by Pascal Antetokounmpo.

[03:18] Team_036 possession (Score: 116-84)
Tobias Fox attempts a 3Pt. Contested by Immanuel Cunningham (5.6 feet, MAN). TOBIAS FOX MAKES IT! Assist: Pascal Antetokounmpo
Score: 119-84

[02:59] Team_093 possession (Score: 119-84)
Lauri Parker drives, Pascal Antetokounmpo stays with him. Lauri Parker attempts a Layup. Contested by Pascal Antetokounmpo (2.7 feet, MAN). LAURI PARKER MAKES IT! Assist: Kobe Murray
Score: 119-86

[02:47] Team_036 possession (Score: 119-86)
Pascal Antetokounmpo drives and kicks out. Tobias Fox attempts a Midrange. Contested by Lauri Parker (4.2 feet, ZONE). TOBIAS FOX MAKES IT!
Score: 121-86

[02:34] Team_093 possession (Score: 121-86)
Kobe Murray attempts a 3Pt. Contested by Devin Simmons (4.6 feet, ZONE). Kobe Murray misses. Rebound secured by Bradley Murray.

[02:20] Team_036 possession (Score: 121-86)
Tobias Fox attempts a Midrange. Contested by Immanuel Cunningham (4.7 feet, MAN). TOBIAS FOX MAKES IT!
Score: 123-86

[02:06] Team_093 possession (Score: 123-86)
FOUL! Holding foul on Dirk Anunoby. [Team fouls: 2] No free throws, side out. (Dirk Anunoby: 1 personal fouls)

[01:55] Team_093 possession (Score: 123-86)
Damian Williamson attempts a Layup. Contested by Dirk Anunoby (2.3 feet, MAN). DAMIAN WILLIAMSON MAKES IT! Assist: Lauri Parker
Score: 123-88

[01:37] Team_036 possession (Score: 123-88)
Dirk Anunoby drives and kicks out. Devin Simmons attempts a 3Pt. Contested by Shaquille George (3.3 feet, ZONE). Devin Simmons misses. Rebound secured by Shaquille George.

[01:24] Team_093 possession (Score: 123-88)
Lauri Parker drives, Devin Simmons stays with him. Lauri Parker attempts a Dunk. Wide open! Devin Simmons is 7.4 feet away. [ZONE] Lauri Parker misses. Offensive rebound by Kobe Murray! Kobe Murray puts it back in!
Score: 123-90

[01:08] Team_036 possession (Score: 123-90)
Bradley Murray drives and kicks out. FOUL! Shooting foul on Lauri Parker. Pascal Antetokounmpo to the line for 3 free throws. [BONUS: 8 team fouls] (Lauri Parker: 1 personal fouls)   FT 1/3: GOOD   FT 2/3: GOOD   FT 3/3: GOOD Pascal Antetokounmpo makes 3/3 from the line.
Score: 126-90

[00:51] Team_093 possession (Score: 126-90)
Lauri Parker attempts a 3Pt. Contested by Pascal Antetokounmpo (4.2 feet, MAN). LAURI PARKER MAKES IT! Assist: Immanuel Cunningham
Score: 126-93

[00:35] Team_036 possession (Score: 126-93)
Pascal Antetokounmpo attempts a 3Pt. Wide open! Shaquille George is 6.6 feet away. [ZONE] PASCAL ANTETOKOUNMPO MAKES IT! Assist: Devin Simmons
Score: 129-93

[00:22] Team_093 possession (Score: 129-93)
Immanuel Cunningham attempts a 3Pt. Contested by Tobias Fox (5.0 feet, ZONE). Immanuel Cunningham misses. Rebound secured by Pascal Antetokounmpo.

[00:11] Team_036 possession (Score: 129-93)
Dirk Anunoby drives to the basket... FOUL! Offensive foul on Dirk Anunoby! Kobe Murray drew the charge! [Team fouls: 3] (Dirk Anunoby: 2 personal fouls) TURNOVER! (dead ball)

================================================================================
                              4TH QUARTER COMPLETE                              
================================================================================

4TH QUARTER SCORE: Team_036 36, Team_093 26

BOX SCORE:
================================================================================

Team_036
--------------------------------------------------------------------------------
Player                MIN  PTS  REB  AST  TO      FG   FG%      3P   3P%
--------------------------------------------------------------------------------
Kobe Simmons           34    8    5    3   0   3/5    60.0     0/0   0.0
Tobias Fox             14    7    0    0   0   3/3   100.0     0/0   0.0
Pascal Antetokounmpo   14    6    2    1   0   2/2   100.0     0/0   0.0
Giannis Booker         34    5    1    0   0   2/2   100.0     0/0   0.0
Terry Durant           34    2    2    0   0   1/1   100.0     0/0   0.0
Michael Westbrook      34    2    0    0   0   1/2    50.0     0/0   0.0
Anthony Poole          34    2    0    0   0   1/1   100.0     0/0   0.0
Devin Simmons          14    0    1    1   0   0/1     0.0     0/0   0.0
Bradley Murray         14    0    2    0   0   0/1     0.0     0/0   0.0
Dirk Anunoby           14    0    0    0   0   0/1     0.0     0/0   0.0

TEAM: FG: 13/19 (68.4%), 3PT: 3/6 (50.0%), REB: 13 (4 off, 9 def), AST: 5, TO: 3
TEAM FOULS: 3


Team_093
--------------------------------------------------------------------------------
Player                MIN  PTS  REB  AST  TO      FG   FG%      3P   3P%
--------------------------------------------------------------------------------
Lauri Parker           14    7    1    1   0   3/4    75.0     0/0   0.0
Carmelo Wagner         34    6    0    0   0   2/4    50.0     0/0   0.0
Damian Williamson      39    6    0    0   0   3/4    75.0     0/0   0.0
Trae Westbrook         34    3    0    0   0   1/1   100.0     0/0   0.0
Ben Cunningham         33    2    2    1   0   1/1   100.0     0/0   0.0
Kobe Murray            14    2    2    1   0   1/2    50.0     0/0   0.0
Vince Barnes           34    0    1    1   0   0/2     0.0     0/0   0.0
Shaquille George       15    0    2    0   0   0/1     0.0     0/0   0.0
Immanuel Cunningham    14    0    0    2   0   0/1     0.0     0/0   0.0

TEAM: FG: 11/20 (55.0%), 3PT: 4/9 (44.4%), REB: 8 (2 off, 6 def), AST: 6, TO: 1
TEAM FOULS: 8 [Team_036 in BONUS]

================================================================================

================================================================================
                               FULL GAME COMPLETE                               
================================================================================

FINAL SCORE: Team_036 129, Team_093 93

SCORING BY QUARTER:
--------------------------------------------------------------------------------
Team                     Q1     Q2     Q3     Q4    FINAL
--------------------------------------------------------------------------------
Team_036                 30     28     35     36      129
Team_093                 24     20     23     26       93
--------------------------------------------------------------------------------

FULL GAME BOX SCORE:
================================================================================

Team_036
--------------------------------------------------------------------------------
Player                MIN  PTS  REB  AST  TO      FG   FG%      3P   3P%      FT STL BLK
--------------------------------------------------------------------------------
Michael Westbrook      34    8    0    9   2   5/10   50.0   0/4     0.0   4/4     0   0
Giannis Booker         34   22    6    0   2  10/13   76.9   3/6    50.0   2/2     0   1
Anthony Poole          34   14    0    4   0   6/10   60.0   0/3     0.0   4/4     2   0
Terry Durant           34   23   10    2   0   6/11   54.5   4/7    57.1   0/0     0   0
Kobe Simmons           34   24   16    7   2  11/13   84.6   1/2    50.0   6/8     0   1
Dirk Anunoby           14    7    0    2   1   3/5    60.0   1/1   100.0   0/0     0   0
Tobias Fox             14   11    0    1   0   4/4   100.0   1/1   100.0   2/2     0   0
Pascal Antetokounmpo   14   10    3    3   2   3/4    75.0   1/2    50.0   5/5     1   0
Devin Simmons          14    4    5    2   0   2/3    66.7   0/1     0.0   2/2     0   1
Bradley Murray         14    2    8    0   1   2/5    40.0   0/1     0.0   0/1     0   0

TEAM: FG: 54/80 (67.5%), 3PT: 11/28 (39.3%), REB: 47 (9 off, 38 def), AST: 30, TO: 10


Team_093
--------------------------------------------------------------------------------
Player                MIN  PTS  REB  AST  TO      FG   FG%      3P   3P%      FT STL BLK
--------------------------------------------------------------------------------
Damian Williamson      39   16    0    3   0   7/14   50.0   1/3    33.3   4/4     0   0
Trae Westbrook         34   13    0    5   2   4/6    66.7   2/4    50.0   1/1     1   0
Carmelo Wagner         34   16    5    2   2   6/9    66.7   3/4    75.0   5/5     0   0
Vince Barnes           34   16    7    1   1   8/17   47.1   1/3    33.3   2/5     2   0
Ben Cunningham         33    8   12    3   3   4/7    57.1   0/1     0.0   0/0     0   0
Shaquille George       15    3    2    1   0   2/3    66.7   1/2    50.0   0/0     0   0
Immanuel Cunningham    14    4    0    2   0   2/6    33.3   0/2     0.0   2/2     0   1
Lauri Parker           14    7    3    3   2   4/8    50.0   1/3    33.3   0/0     0   0
Kobe Murray            14    9    5    1   0   2/6    33.3   1/3    33.3   0/0     2   0
Cade O'Neal             9    0    1    0   1   0/0     0.0   0/0     0.0   0/0     0   0

TEAM: FG: 39/77 (50.6%), 3PT: 10/25 (40.0%), REB: 35 (9 off, 26 def), AST: 21, TO: 11

================================================================================
