================================================================================
                        FULL GAME - Team_015 vs Team_051                        
================================================================================

================================================================================
                       1ST QUARTER - Team_015 vs Team_051                       
================================================================================

[12:00] Team_015 possession (Score: 0-0)
Michael Simmons makes the Dunk and draws the foul on OG Siakam! And-1! Michael Simmons to the line for 1. [Team fouls: 1] (OG Siakam: 1 personal fouls)   FT 1/1: GOOD Michael Simmons makes 1/1 from the line.
Score: 3-0

[11:44] Team_051 possession (Score: 3-0)
Austin Sexton attempts a Layup. Contested by Manu Anthony (3.0 feet, MAN). AUSTIN SEXTON MAKES IT! Assist: Franz Simmons
Score: 3-2

[11:31] Team_015 possession (Score: 3-2)
CJ Banchero attempts a 3Pt. Contested by Austin Sexton (4.7 feet, ZONE). CJ Banchero misses. Rebound secured by Shaquille Harden.

[11:16] Team_051 possession (Score: 3-2)
Franz Simmons attempts a Dunk. BLOCKED BY SCOTTIE GASOL! Ball is loose! Rebound secured by Michael Simmons.

[11:00] Team_015 possession (Score: 3-2)
FOUL! Reach-in foul on Shaquille Harden during the drive. [Team fouls: 2] No free throws, side out. (Shaquille Harden: 1 personal fouls)

[10:50] Team_015 possession (Score: 3-2)
CJ Banchero drives to the basket... CJ Banchero loses control! Ball rolls out of bounds! TURNOVER! (dead ball)

[10:38] Team_051 possession (Score: 3-2)
Shaquille Harden drives and kicks out. Larry McGrady attempts a 3Pt. Wide open! Michael Simmons is 6.2 feet away. [MAN] LARRY MCGRADY MAKES IT! Assist: Austin Sexton
Score: 3-5

[10:22] Team_015 possession (Score: 3-5)
Manu Anthony drives, Franz Simmons stays with him. Manu Anthony attempts a Dunk. Contested by Franz Simmons (3.6 feet, ZONE). Manu Anthony misses. Rebound secured by Shaquille Harden.

[10:09] Team_051 possession (Score: 3-5)
Franz Simmons attempts a Layup. Wide open! Scottie Gasol is 8.4 feet away. [MAN] Franz Simmons misses. Rebound secured by CJ Banchero.

[09:54] Team_015 possession (Score: 3-5)
Michael Simmons makes the Layup and draws the foul on Franz Simmons! And-1! Michael Simmons to the line for 1. [Team fouls: 3] (Franz Simmons: 1 personal fouls)   FT 1/1: GOOD Michael Simmons makes 1/1 from the line.
Score: 6-5

[09:39] Team_051 possession (Score: 6-5)
Franz Simmons attempts a Midrange. Wide open! Michael Simmons is 8.0 feet away. [ZONE] Franz Simmons misses. Rebound secured by Michael Simmons.

[09:28] Team_015 possession (Score: 6-5)
Scottie Gasol drives and kicks out. Manu Anthony attempts a Midrange. Contested by Austin Sexton (4.6 feet, MAN). MANU ANTHONY MAKES IT!
Score: 8-5

[09:12] Team_051 possession (Score: 8-5)
Austin Sexton drives to the basket... Austin Sexton loses the ball! Stripped by Scottie Gasol! TURNOVER! (live ball)

[09:01] Team_015 possession (Score: 8-5)
Michael Simmons attempts a 3Pt. Contested by OG Siakam (3.8 feet, ZONE). Michael Simmons misses. Rebound secured by Shaquille Harden.

[08:47] Team_051 possession (Score: 8-5)
Shaquille Harden attempts a 3Pt. Heavily contested by Manu Anthony (1.2 feet, ZONE)! Shaquille Harden misses. Rebound secured by CJ Banchero.

[08:36] Team_015 possession (Score: 8-5)
Scottie Gasol attempts a 3Pt. Wide open! Franz Simmons is 7.7 feet away. [MAN] SCOTTIE GASOL MAKES IT! Assist: CJ Banchero
Score: 11-5

[08:22] Team_051 possession (Score: 11-5)
OG Siakam loses control! Ball rolls out of bounds! TURNOVER! (dead ball)

[08:07] Team_015 possession (Score: 11-5)
Michael Simmons attempts a Layup. BLOCKED BY FRANZ SIMMONS! Ball deflects out of bounds off Michael Simmons.

[07:51] Team_051 possession (Score: 11-5)
Franz Simmons attempts a Midrange. Contested by Scottie Gasol (3.8 feet, MAN). Franz Simmons misses. Offensive rebound by Shaquille Harden! Shaquille Harden's putback is no good. Rebound secured by CJ Banchero.

[07:36] Team_015 possession (Score: 11-5)
Michael Simmons attempts a 3Pt. Wide open! OG Siakam is 7.4 feet away. [ZONE] MICHAEL SIMMONS MAKES IT! Assist: CJ Banchero
Score: 14-5

[07:22] Team_051 possession (Score: 14-5)
OG Siakam attempts a 3Pt. Contested by Manu Anthony (2.6 feet, ZONE). OG Siakam misses. Rebound secured by Michael Simmons.

[07:08] Team_015 possession (Score: 14-5)
Trae Turner drives to the basket... Trae Turner loses the ball! Stripped by Franz Simmons! TURNOVER! (live ball)

[06:51] Team_051 possession (Score: 14-5)
Larry McGrady drives and kicks out. Austin Sexton attempts a Midrange. Contested by Manu Anthony (5.4 feet, MAN). Austin Sexton misses. Offensive rebound by Shaquille Harden! Shaquille Harden puts it back in!
Score: 14-7

[06:39] Team_015 possession (Score: 14-7)
Manu Anthony attempts a 3Pt. Contested by Austin Sexton (3.6 feet, ZONE). MANU ANTHONY MAKES IT! Assist: Trae Turner
Score: 17-7

[06:29] Team_051 possession (Score: 17-7)
Austin Sexton attempts a 3Pt. Heavily contested by Manu Anthony (1.3 feet, ZONE)! Austin Sexton misses. Rebound secured by Michael Simmons.

[06:14] Team_015 possession (Score: 17-7)
CJ Banchero attempts a 3Pt. Contested by OG Siakam (3.7 feet, MAN). CJ BANCHERO MAKES IT! Assist: Scottie Gasol
Score: 20-7

[06:01] Team_051 possession (Score: 20-7)
Franz Simmons attempts a Midrange. Contested by Scottie Gasol (2.1 feet, MAN). Franz Simmons misses. Rebound secured by CJ Banchero.

[05:47] Team_015 possession (Score: 20-7)
Trae Turner drives, Franz Simmons stays with him. Trae Turner attempts a Layup. Contested by Franz Simmons (2.6 feet, ZONE). TRAE TURNER MAKES IT! Assist: Scottie Gasol
Score: 22-7

[05:33] Team_051 possession (Score: 22-7)
Austin Sexton loses the ball! Stripped by Manu Anthony! TURNOVER! (live ball)

[05:16] Team_015 possession (Score: 22-7)
Michael Simmons attempts a Midrange. Contested by Larry McGrady (5.6 feet, ZONE). Michael Simmons misses. Rebound secured by Shaquille Harden.

[05:07] Team_051 possession (Score: 22-7)
Shaquille Harden drives, Trae Turner stays with him. Shaquille Harden attempts a Dunk. Wide open! Trae Turner is 6.1 feet away. [MAN] Shaquille Harden misses. Rebound secured by Trae Turner.

[04:48] Team_015 possession (Score: 22-7)
FOUL! Shooting foul on Shaquille Harden. Trae Turner to the line for 2 free throws. [Team fouls: 4] (Shaquille Harden: 2 personal fouls)   FT 1/2: GOOD   FT 2/2: GOOD Trae Turner makes 2/2 from the line.
Score: 24-7

[04:31] Team_051 possession (Score: 24-7)
Larry McGrady attempts a 3Pt. Contested by Manu Anthony (2.4 feet, ZONE). LARRY MCGRADY MAKES IT! Assist: OG Siakam
Score: 24-10

[04:14] Team_015 possession (Score: 24-10)
FOUL! Shooting foul on Shaquille Harden. Trae Turner to the line for 2 free throws. [BONUS: 5 team fouls] (Shaquille Harden: 3 personal fouls)   FT 1/2: MISS   FT 2/2: MISS Trae Turner makes 0/2 from the line. Rebound secured by Franz Simmons.

[04:05] Team_051 possession (Score: 24-10)
Austin Sexton attempts a 3Pt. Wide open! Scottie Gasol is 6.4 feet away. [ZONE] Austin Sexton misses. Rebound secured by CJ Banchero.

[03:53] Team_015 possession (Score: 24-10)
Scottie Gasol drives, Franz Simmons stays with him. Scottie Gasol attempts a Layup. Contested by Franz Simmons (4.4 feet, MAN). SCOTTIE GASOL MAKES IT! Assist: CJ Banchero
Score: 26-10

[03:40] Team_051 possession (Score: 26-10)
OG Siakam attempts a Layup. Contested by Scottie Gasol (2.8 feet, ZONE). OG SIAKAM MAKES IT! Assist: Franz Simmons
Score: 26-12

[03:31] Team_015 possession (Score: 26-12)
CJ Banchero drives, Franz Simmons stays with him. CJ Banchero attempts a Layup. Heavily contested by Franz Simmons (1.5 feet, ZONE)! CJ BANCHERO MAKES IT!
Score: 28-12

[03:19] Team_051 possession (Score: 28-12)
Austin Sexton attempts a 3Pt. Wide open! Manu Anthony is 7.3 feet away. [ZONE] Austin Sexton misses. Rebound secured by CJ Banchero.

[03:07] Team_015 possession (Score: 28-12)
Trae Turner loses the ball! Stripped by Shaquille Harden! TURNOVER! (live ball)

[02:51] Team_051 possession (Score: 28-12)
OG Siakam attempts a 3Pt. Contested by Manu Anthony (3.2 feet, ZONE). OG Siakam misses. Rebound secured by Trae Turner.

[02:38] Team_015 possession (Score: 28-12)
Trae Turner loses control! Ball rolls out of bounds! TURNOVER! (dead ball)

[02:38] Substitution (Team_015): Manu Anthony OUT → Dwyane Sabonis IN (stamina_rule2)

[02:38] Substitution (Team_015): Michael Simmons OUT → Paolo Jokic IN (stamina_rule2)

[02:38] Substitution (Team_015): CJ Banchero OUT → Magic Wagner IN (stamina_rule2)

[02:38] Substitution (Team_015): Scottie Gasol OUT → Rudy Paul IN (stamina_rule2)

[02:38] Substitution (Team_015): Trae Turner OUT → Allen Curry IN (stamina_rule2)

[02:38] Substitution (Team_051): Larry McGrady OUT → Zion Morant IN (stamina_rule2)

[02:38] Substitution (Team_051): OG Siakam OUT → Jrue Carter IN (stamina_rule2)

[02:38] Substitution (Team_051): Franz Simmons OUT → Tobias Jokic IN (stamina_rule2)

[02:38] Substitution (Team_051): Shaquille Harden OUT → Pau Tatum IN (stamina_rule2)

[02:28] Team_051 possession (Score: 28-12)
Zion Morant attempts a Layup. Contested by Rudy Paul (4.7 feet, ZONE). ZION MORANT MAKES IT! Assist: Jrue Carter
Score: 28-14

[02:18] Team_015 possession (Score: 28-14)
Paolo Jokic throws a bad pass! Stolen by Zion Morant! TURNOVER! (live ball)

[02:05] Team_051 possession (Score: 28-14)
Pau Tatum attempts a Midrange. Contested by Rudy Paul (2.1 feet, MAN). Pau Tatum misses. FOUL! Loose ball foul on Allen Curry during the rebound battle. [Team fouls: 1] No free throws, side out. (Allen Curry: 1 personal fouls)

[01:51] Team_051 possession (Score: 28-14)
Zion Morant makes the 3Pt and draws the foul on Paolo Jokic! And-1! Zion Morant to the line for 1. [Team fouls: 2] (Paolo Jokic: 1 personal fouls)   FT 1/1: GOOD Zion Morant makes 1/1 from the line.
Score: 28-18

[01:38] Team_015 possession (Score: 28-18)
Allen Curry drives, picks up Pau Tatum. Help arrives from Austin Sexton! Allen Curry attempts a Layup. Contested by Austin Sexton (2.9 feet, ZONE). ALLEN CURRY MAKES IT!
Score: 30-18

[01:20] Team_051 possession (Score: 30-18)
Tobias Jokic drives and kicks out. Austin Sexton attempts a 3Pt. Wide open! Dwyane Sabonis is 6.5 feet away. [MAN] Austin Sexton misses. Offensive rebound by Tobias Jokic! Tobias Jokic kicks it out.

[01:03] Team_051 possession (Score: 30-18)
Zion Morant attempts a Layup. Wide open! Allen Curry is 6.7 feet away. [ZONE] Zion Morant misses. Rebound secured by Rudy Paul.

[00:51] Team_015 possession (Score: 30-18)
Rudy Paul drives to the basket... Rudy Paul loses the ball! Stripped by Pau Tatum! TURNOVER! (live ball)

[00:40] Team_051 possession (Score: 30-18)
Zion Morant attempts a 3Pt. Wide open! Paolo Jokic is 7.7 feet away. [MAN] Zion Morant misses. Rebound secured by Allen Curry.

[00:29] Team_015 possession (Score: 30-18)
Paolo Jokic drives and kicks out. Dwyane Sabonis attempts a 3Pt. Contested by Austin Sexton (5.5 feet, MAN). Dwyane Sabonis misses. FOUL! Loose ball foul on Tobias Jokic during the rebound battle. [IN THE BONUS! 6 team fouls] Allen Curry to the line for 2 free throws. (Tobias Jokic: 1 personal fouls)   FT 1/2: MISS   FT 2/2: GOOD Allen Curry makes 1/2 from the line.
Score: 31-18

[00:14] Team_051 possession (Score: 31-18)
Austin Sexton attempts a Midrange. Contested by Dwyane Sabonis (3.4 feet, MAN). Austin Sexton misses. Rebound secured by Magic Wagner.

================================================================================
                              1ST QUARTER COMPLETE                              
================================================================================

1ST QUARTER SCORE: Team_015 31, Team_051 18

BOX SCORE:
================================================================================

Team_015
--------------------------------------------------------------------------------
Player                MIN  PTS  REB  AST  TO      FG   FG%      3P   3P%
--------------------------------------------------------------------------------
Michael Simmons        10    9    4    0   0   3/6    50.0     0/0   0.0
CJ Banchero            10    5    6    3   0   2/3    66.7     0/0   0.0
Manu Anthony           10    5    0    0   0   2/3    66.7     0/0   0.0
Scottie Gasol          10    5    0    2   0   2/2   100.0     0/0   0.0
Trae Turner            10    4    2    1   0   2/3    66.7     0/0   0.0
Allen Curry             2    3    1    0   0   2/2   100.0     0/0   0.0
Rudy Paul               2    0    1    0   0   0/0     0.0     0/0   0.0
Magic Wagner            2    0    1    0   0   0/0     0.0     0/0   0.0

TEAM: FG: 13/19 (68.4%), 3PT: 4/6 (66.7%), REB: 14 (0 off, 14 def), AST: 6, TO: 6
TEAM FOULS: 2


Team_051
--------------------------------------------------------------------------------
Player                MIN  PTS  REB  AST  TO      FG   FG%      3P   3P%
--------------------------------------------------------------------------------
Larry McGrady          10    6    0    0   0   2/2   100.0     0/0   0.0
Zion Morant             2    6    0    0   0   2/4    50.0     0/0   0.0
Austin Sexton          12    2    0    1   0   1/5    20.0     0/0   0.0
Shaquille Harden       10    2    5    0   0   1/3    33.3     0/0   0.0
OG Siakam              10    2    0    1   0   1/3    33.3     0/0   0.0
Franz Simmons          10    0    1    2   0   0/5     0.0     0/0   0.0
Jrue Carter             2    0    0    1   0   0/0     0.0     0/0   0.0
Tobias Jokic            2    0    2    0   0   0/0     0.0     0/0   0.0

TEAM: FG: 7/22 (31.8%), 3PT: 2/9 (22.2%), REB: 9 (4 off, 5 def), AST: 5, TO: 3
TEAM FOULS: 6 [Team_015 in BONUS]

================================================================================

================================================================================
                       2ND QUARTER - Team_015 vs Team_051                       
================================================================================

[12:00] Team_015 possession (Score: 31-18)
Michael Simmons attempts a Midrange. Wide open! Larry McGrady is 6.9 feet away. [MAN] MICHAEL SIMMONS MAKES IT!
Score: 33-18

[11:50] Team_051 possession (Score: 33-18)
Austin Sexton drives, Scottie Gasol stays with him. Austin Sexton attempts a Layup. Contested by Scottie Gasol (3.3 feet, ZONE). AUSTIN SEXTON MAKES IT!
Score: 33-20

[11:32] Team_015 possession (Score: 33-20)
Scottie Gasol loses the ball! Stripped by Franz Simmons! TURNOVER! (live ball)

[11:20] Team_051 possession (Score: 33-20)
Larry McGrady attempts a 3Pt. Heavily contested by Manu Anthony (1.5 feet, ZONE)! LARRY MCGRADY MAKES IT! Assist: Austin Sexton
Score: 33-23

[11:01] Team_015 possession (Score: 33-23)
Michael Simmons drives to the basket... Michael Simmons throws a bad pass out of bounds! TURNOVER! (dead ball)

[11:01] Substitution (Team_051): Austin Sexton OUT → Myles Harden IN (stamina_rule2)

[10:43] Team_051 possession (Score: 33-23)
Franz Simmons attempts a Midrange. Contested by Scottie Gasol (3.2 feet, MAN). Franz Simmons misses. Rebound secured by CJ Banchero.

[10:26] Team_015 possession (Score: 33-23)
Scottie Gasol attempts a Midrange. Heavily contested by Franz Simmons (0.5 feet, MAN)! Scottie Gasol misses. Rebound secured by Shaquille Harden.

[10:14] Team_051 possession (Score: 33-23)
Shaquille Harden throws a bad pass! Stolen by Trae Turner! TURNOVER! (live ball)

[09:59] Team_015 possession (Score: 33-23)
Scottie Gasol attempts a Midrange. BLOCKED BY FRANZ SIMMONS! Ball is loose! Rebound secured by Shaquille Harden.

[09:43] Team_051 possession (Score: 33-23)
Franz Simmons drives and kicks out. Shaquille Harden attempts a Midrange. Contested by Trae Turner (3.8 feet, MAN). Shaquille Harden misses. Rebound secured by Michael Simmons.

[09:30] Team_015 possession (Score: 33-23)
Scottie Gasol drives to the basket... Scottie Gasol commits a violation (traveling/carry)! TURNOVER! (dead ball)

[09:30] Substitution (Team_015): Trae Turner OUT → Allen Curry IN (stamina_rule2)

[09:30] Substitution (Team_051): Larry McGrady OUT → Zion Morant IN (stamina_rule2)

[09:30] Substitution (Team_051): OG Siakam OUT → Jrue Carter IN (stamina_rule2)

[09:16] Team_051 possession (Score: 33-23)
Jrue Carter drives, Scottie Gasol stays with him. Jrue Carter attempts a Dunk. Contested by Scottie Gasol (2.9 feet, ZONE). Jrue Carter misses. Rebound secured by CJ Banchero.

[09:04] Team_015 possession (Score: 33-23)
Scottie Gasol makes the Midrange and draws the foul on Franz Simmons! And-1! Scottie Gasol to the line for 1. [Team fouls: 1] (Franz Simmons: 1 personal fouls)   FT 1/1: GOOD Scottie Gasol makes 1/1 from the line.
Score: 36-23

[08:49] Team_051 possession (Score: 36-23)
Shaquille Harden attempts a Layup. BLOCKED BY SCOTTIE GASOL! Ball is loose! Rebound secured by Michael Simmons.

[08:33] Team_015 possession (Score: 36-23)
FOUL! Shooting foul on Shaquille Harden. Allen Curry to the line for 2 free throws. [Team fouls: 2] (Shaquille Harden: 1 personal fouls)   FT 1/2: GOOD   FT 2/2: MISS Allen Curry makes 1/2 from the line. Rebound secured by Myles Harden.
Score: 37-23

[08:18] Team_051 possession (Score: 37-23)
FOUL! Holding foul on Scottie Gasol. [Team fouls: 1] No free throws, side out. (Scottie Gasol: 1 personal fouls)

[08:07] Team_051 possession (Score: 37-23)
Myles Harden drives and kicks out. Shaquille Harden attempts a 3Pt. Contested by Allen Curry (2.9 feet, MAN). Shaquille Harden misses. Rebound secured by Allen Curry.

[07:54] Team_015 possession (Score: 37-23)
FOUL! Offensive foul on Manu Anthony! Myles Harden drew the charge! [Team fouls: 2] (Manu Anthony: 1 personal fouls) TURNOVER! (dead ball)

[07:41] Team_051 possession (Score: 37-23)
FOUL! Shooting foul on Allen Curry. Franz Simmons to the line for 2 free throws. [Team fouls: 3] (Allen Curry: 1 personal fouls)   FT 1/2: GOOD   FT 2/2: GOOD Franz Simmons makes 2/2 from the line.
Score: 37-25

[07:27] Team_015 possession (Score: 37-25)
Michael Simmons loses control! Ball rolls out of bounds! TURNOVER! (dead ball)

[07:27] Substitution (Team_015): Manu Anthony OUT → Dwyane Sabonis IN (stamina_rule2)

[07:27] Substitution (Team_015): Michael Simmons OUT → Paolo Jokic IN (stamina_rule2)

[07:27] Substitution (Team_015): CJ Banchero OUT → Magic Wagner IN (stamina_rule2)

[07:27] Substitution (Team_015): Scottie Gasol OUT → Rudy Paul IN (stamina_rule2)

[07:27] Substitution (Team_051): Franz Simmons OUT → Tobias Jokic IN (stamina_rule2)

[07:27] Substitution (Team_051): Shaquille Harden OUT → Pau Tatum IN (stamina_rule2)

[07:15] Team_051 possession (Score: 37-25)
Pau Tatum attempts a Dunk. BLOCKED BY RUDY PAUL! Ball is loose! Offensive rebound by Tobias Jokic! Tobias Jokic kicks it out.

[06:59] Team_051 possession (Score: 37-25)
Pau Tatum attempts a Dunk. BLOCKED BY ALLEN CURRY! Ball is loose! Offensive rebound by Pau Tatum! Pau Tatum kicks it out.

[06:44] Team_051 possession (Score: 37-25)
FOUL! Reach-in foul on Rudy Paul during the drive. [Team fouls: 4] No free throws, side out. (Rudy Paul: 1 personal fouls)

[06:28] Team_051 possession (Score: 37-25)
FOUL! Offensive foul on Zion Morant! Paolo Jokic drew the charge! [Team fouls: 3] (Zion Morant: 1 personal fouls) TURNOVER! (dead ball)

[06:15] Team_015 possession (Score: 37-25)
Dwyane Sabonis attempts a 3Pt. Contested by Myles Harden (4.2 feet, ZONE). Dwyane Sabonis misses. Rebound secured by Tobias Jokic.

[05:57] Team_051 possession (Score: 37-25)
Jrue Carter drives, Magic Wagner stays with him. Jrue Carter attempts a Dunk. Contested by Magic Wagner (5.4 feet, MAN). JRUE CARTER MAKES IT! Assist: Pau Tatum
Score: 37-27

[05:44] Team_015 possession (Score: 37-27)
Dwyane Sabonis drives to the basket... Dwyane Sabonis throws a bad pass! Stolen by Myles Harden! TURNOVER! (live ball)

[05:30] Team_051 possession (Score: 37-27)
FOUL! Offensive foul on Zion Morant! Paolo Jokic drew the charge! [Team fouls: 4] (Zion Morant: 2 personal fouls) TURNOVER! (dead ball)

[05:20] Team_015 possession (Score: 37-27)
Paolo Jokic attempts a 3Pt. Wide open! Zion Morant is 7.4 feet away. [MAN] PAOLO JOKIC MAKES IT! Assist: Allen Curry
Score: 40-27

[05:05] Team_051 possession (Score: 40-27)
Tobias Jokic attempts a 3Pt. Contested by Rudy Paul (4.5 feet, ZONE). Tobias Jokic misses. Rebound secured by Rudy Paul.

[04:48] Team_015 possession (Score: 40-27)
Dwyane Sabonis loses the ball! Stripped by Myles Harden! TURNOVER! (live ball)

[04:37] Team_051 possession (Score: 40-27)
Myles Harden throws a bad pass out of bounds! TURNOVER! (dead ball)

[04:18] Team_015 possession (Score: 40-27)
Rudy Paul throws a bad pass out of bounds! TURNOVER! (dead ball)

[04:03] Team_051 possession (Score: 40-27)
Jrue Carter attempts a 3Pt. Contested by Rudy Paul (3.0 feet, ZONE). JRUE CARTER MAKES IT! Assist: Tobias Jokic
Score: 40-30

[03:48] Team_015 possession (Score: 40-30)
Rudy Paul drives and kicks out. Magic Wagner attempts a 3Pt. Wide open! Myles Harden is 7.3 feet away. [ZONE] MAGIC WAGNER MAKES IT! Assist: Allen Curry
Score: 43-30

[03:37] Team_051 possession (Score: 43-30)
Pau Tatum attempts a Layup. Contested by Rudy Paul (3.9 feet, ZONE). PAU TATUM MAKES IT! Assist: Tobias Jokic
Score: 43-32

[03:20] Team_015 possession (Score: 43-32)
Rudy Paul attempts a 3Pt. Contested by Myles Harden (5.1 feet, ZONE). RUDY PAUL MAKES IT! Assist: Allen Curry
Score: 46-32

[03:06] Team_051 possession (Score: 46-32)
Pau Tatum drives and kicks out. Myles Harden attempts a 3Pt. Contested by Rudy Paul (5.6 feet, ZONE). Myles Harden misses. FOUL! Loose ball foul on Allen Curry during the rebound battle. [IN THE BONUS! 5 team fouls] Pau Tatum to the line for 2 free throws. (Allen Curry: 2 personal fouls)   FT 1/2: GOOD   FT 2/2: MISS Pau Tatum makes 1/2 from the line. Rebound secured by Rudy Paul.
Score: 46-33

[02:55] Team_015 possession (Score: 46-33)
FOUL! Shooting foul on Pau Tatum. Paolo Jokic to the line for 2 free throws. [BONUS: 5 team fouls] (Pau Tatum: 1 personal fouls)   FT 1/2: GOOD   FT 2/2: GOOD Paolo Jokic makes 2/2 from the line.
Score: 48-33

[02:37] Team_051 possession (Score: 48-33)
Zion Morant attempts a 3Pt. Heavily contested by Rudy Paul (0.5 feet, ZONE)! Zion Morant misses. Offensive rebound by Tobias Jokic! Tobias Jokic kicks it out.

[02:25] Team_051 possession (Score: 48-33)
Tobias Jokic attempts a 3Pt. Contested by Rudy Paul (2.8 feet, MAN). Tobias Jokic misses. Rebound secured by Allen Curry.

[02:11] Team_015 possession (Score: 48-33)
Rudy Paul drives and kicks out. Dwyane Sabonis attempts a Midrange. Contested by Jrue Carter (3.7 feet, ZONE). DWYANE SABONIS MAKES IT!
Score: 50-33

[01:59] Team_051 possession (Score: 50-33)
Zion Morant attempts a Layup. BLOCKED BY RUDY PAUL! Ball is loose! Rebound secured by Rudy Paul.

[01:47] Team_015 possession (Score: 50-33)
Rudy Paul attempts a Layup. Wide open! Tobias Jokic is 8.3 feet away. [MAN] RUDY PAUL MAKES IT! Assist: Paolo Jokic
Score: 52-33

[01:32] Team_051 possession (Score: 52-33)
Jrue Carter attempts a 3Pt. Wide open! Magic Wagner is 7.3 feet away. [MAN] JRUE CARTER MAKES IT! Assist: Zion Morant
Score: 52-36

[01:20] Team_015 possession (Score: 52-36)
Rudy Paul attempts a Midrange. Contested by Tobias Jokic (5.2 feet, ZONE). RUDY PAUL MAKES IT! Assist: Allen Curry
Score: 54-36

[01:05] Team_051 possession (Score: 54-36)
FOUL! Holding foul on Rudy Paul. [IN THE BONUS! 6 team fouls] Pau Tatum to the line for 2 free throws. (Rudy Paul: 2 personal fouls)   FT 1/2: GOOD   FT 2/2: MISS Pau Tatum makes 1/2 from the line. Offensive rebound by Tobias Jokic! Tobias Jokic kicks it out.
Score: 54-37

[00:52] Team_051 possession (Score: 54-37)
Myles Harden attempts a Midrange. Wide open! Dwyane Sabonis is 9.3 feet away. [MAN] MYLES HARDEN MAKES IT! Assist: Pau Tatum
Score: 54-39

[00:37] Team_015 possession (Score: 54-39)
Allen Curry attempts a Midrange. Contested by Zion Morant (3.9 feet, ZONE). ALLEN CURRY MAKES IT!
Score: 56-39

[00:21] Team_051 possession (Score: 56-39)
Myles Harden attempts a 3Pt. Contested by Magic Wagner (2.7 feet, ZONE). Myles Harden misses. Rebound secured by Allen Curry.

[00:08] Team_015 possession (Score: 56-39)
Rudy Paul attempts a 3Pt. Contested by Myles Harden (4.7 feet, ZONE). Rudy Paul misses. Offensive rebound by Allen Curry! Allen Curry kicks it out.

================================================================================
                              2ND QUARTER COMPLETE                              
================================================================================

2ND QUARTER SCORE: Team_015 25, Team_051 21

BOX SCORE:
================================================================================

Team_015
--------------------------------------------------------------------------------
Player                MIN  PTS  REB  AST  TO      FG   FG%      3P   3P%
--------------------------------------------------------------------------------
Rudy Paul              10    7    3    0   0   3/3   100.0     0/0   0.0
Paolo Jokic            10    5    0    1   0   2/2   100.0     0/0   0.0
Scottie Gasol          14    3    0    0   0   1/3    33.3     0/0   0.0
Magic Wagner           10    3    0    0   0   1/1   100.0     0/0   0.0
Michael Simmons        14    2    2    0   0   1/1   100.0     0/0   0.0
Allen Curry            12    2    4    4   0   1/2    50.0     0/0   0.0
Dwyane Sabonis         10    2    0    0   0   1/2    50.0     0/0   0.0
CJ Banchero            14    0    2    0   0   0/0     0.0     0/0   0.0

TEAM: FG: 10/14 (71.4%), 3PT: 2/3 (66.7%), REB: 10 (1 off, 9 def), AST: 5, TO: 8
TEAM FOULS: 6 [Team_051 in BONUS]


Team_051
--------------------------------------------------------------------------------
Player                MIN  PTS  REB  AST  TO      FG   FG%      3P   3P%
--------------------------------------------------------------------------------
Jrue Carter            12    8    0    0   0   3/4    75.0     0/0   0.0
Larry McGrady          12    3    0    0   0   1/1   100.0     0/0   0.0
Austin Sexton          13    2    0    1   0   1/1   100.0     0/0   0.0
Franz Simmons          14    2    0    0   0   1/3    33.3     0/0   0.0
Myles Harden           11    2    1    0   0   1/3    33.3     0/0   0.0
Pau Tatum              10    2    1    2   0   1/2    50.0     0/0   0.0
Shaquille Harden       14    0    2    0   0   0/1     0.0     0/0   0.0
Tobias Jokic           10    0    4    2   0   0/2     0.0     0/0   0.0
Zion Morant            12    0    0    1   0   0/1     0.0     0/0   0.0

TEAM: FG: 8/18 (44.4%), 3PT: 3/6 (50.0%), REB: 9 (5 off, 4 def), AST: 6, TO: 4
TEAM FOULS: 5 [Team_015 in BONUS]

================================================================================

================================================================================
                       3RD QUARTER - Team_015 vs Team_051                       
================================================================================

[12:00] Team_015 possession (Score: 56-39)
CJ Banchero drives to the basket... CJ Banchero commits a violation (traveling/carry)! TURNOVER! (dead ball)

[11:47] Team_051 possession (Score: 56-39)
FOUL! Shooting foul on CJ Banchero. Franz Simmons to the line for 2 free throws. [Team fouls: 1] (CJ Banchero: 1 personal fouls)   FT 1/2: GOOD   FT 2/2: GOOD Franz Simmons makes 2/2 from the line.
Score: 56-41

[11:33] Team_015 possession (Score: 56-41)
Michael Simmons attempts a 3Pt. Heavily contested by Austin Sexton (0.5 feet, ZONE)! Michael Simmons misses. FOUL! Loose ball foul on OG Siakam during the rebound battle. [Team fouls: 1] No free throws, side out. (OG Siakam: 1 personal fouls)

[11:20] Team_015 possession (Score: 56-41)
CJ Banchero attempts a 3Pt. Contested by OG Siakam (2.8 feet, MAN). CJ BANCHERO MAKES IT! Assist: Michael Simmons
Score: 59-41

[11:07] Team_051 possession (Score: 59-41)
Austin Sexton drives, Scottie Gasol stays with him. Austin Sexton attempts a Layup. Contested by Scottie Gasol (3.7 feet, ZONE). Austin Sexton misses. Rebound secured by CJ Banchero.

[10:52] Team_015 possession (Score: 59-41)
Scottie Gasol drives, Franz Simmons stays with him. Scottie Gasol attempts a Dunk. Heavily contested by Franz Simmons (1.8 feet, MAN)! SCOTTIE GASOL MAKES IT!
Score: 61-41

[10:40] Team_051 possession (Score: 61-41)
Austin Sexton attempts a Midrange. Contested by Manu Anthony (4.7 feet, MAN). Austin Sexton misses. Offensive rebound by Franz Simmons! Franz Simmons kicks it out.

[10:22] Team_051 possession (Score: 61-41)
Larry McGrady attempts a 3Pt. Heavily contested by Michael Simmons (1.9 feet, ZONE)! Larry McGrady misses. Rebound secured by Trae Turner.

[10:08] Team_015 possession (Score: 61-41)
Michael Simmons attempts a 3Pt. Wide open! Larry McGrady is 7.9 feet away. [MAN] MICHAEL SIMMONS MAKES IT!
Score: 64-41

[09:53] Team_051 possession (Score: 64-41)
Franz Simmons attempts a 3Pt. Contested by Scottie Gasol (4.3 feet, MAN). Franz Simmons misses. Rebound secured by Michael Simmons.

[09:39] Team_015 possession (Score: 64-41)
Manu Anthony attempts a 3Pt. Contested by Austin Sexton (4.7 feet, ZONE). MANU ANTHONY MAKES IT! Assist: Scottie Gasol
Score: 67-41

[09:21] Team_051 possession (Score: 67-41)
Austin Sexton attempts a Midrange. Contested by Scottie Gasol (4.8 feet, ZONE). Austin Sexton misses. Rebound secured by CJ Banchero.

[09:05] Team_015 possession (Score: 67-41)
Michael Simmons makes the 3Pt and draws the foul on Larry McGrady! And-1! Michael Simmons to the line for 1. [Team fouls: 2] (Larry McGrady: 1 personal fouls)   FT 1/1: GOOD Michael Simmons makes 1/1 from the line.
Score: 71-41

[08:51] Team_051 possession (Score: 71-41)
OG Siakam attempts a 3Pt. Heavily contested by Manu Anthony (1.9 feet, ZONE)! OG Siakam misses. Rebound secured by Trae Turner.

[08:40] Team_015 possession (Score: 71-41)
Scottie Gasol drives, Franz Simmons stays with him. Scottie Gasol attempts a Layup. Contested by Franz Simmons (3.1 feet, MAN). SCOTTIE GASOL MAKES IT! Assist: Trae Turner
Score: 73-41

[08:26] Team_051 possession (Score: 73-41)
OG Siakam drives and kicks out. FOUL! Shooting foul on Michael Simmons. Austin Sexton to the line for 2 free throws. [Team fouls: 2] (Michael Simmons: 1 personal fouls)   FT 1/2: GOOD   FT 2/2: GOOD Austin Sexton makes 2/2 from the line.
Score: 73-43

[08:11] Team_015 possession (Score: 73-43)
Trae Turner attempts a Midrange. Contested by Larry McGrady (2.7 feet, ZONE). Trae Turner misses. Rebound secured by Shaquille Harden.

[07:56] Team_051 possession (Score: 73-43)
Shaquille Harden attempts a Layup. BLOCKED BY MICHAEL SIMMONS! Ball deflects out of bounds off Shaquille Harden.

[07:42] Team_015 possession (Score: 73-43)
CJ Banchero attempts a Midrange. Contested by OG Siakam (3.3 feet, MAN). CJ Banchero misses. Offensive rebound by CJ Banchero! CJ Banchero's putback is no good. Rebound secured by Franz Simmons.

[07:26] Team_051 possession (Score: 73-43)
OG Siakam drives and kicks out. OG Siakam attempts a Midrange. Contested by CJ Banchero (5.1 feet, MAN). OG Siakam misses. Rebound secured by CJ Banchero.

[07:13] Team_015 possession (Score: 73-43)
Trae Turner attempts a Layup. Contested by Shaquille Harden (2.9 feet, MAN). TRAE TURNER MAKES IT! Assist: Scottie Gasol
Score: 75-43

[07:00] Team_051 possession (Score: 75-43)
Larry McGrady drives and kicks out. Shaquille Harden attempts a Midrange. Contested by Trae Turner (2.0 feet, MAN). Shaquille Harden misses. Rebound secured by Michael Simmons.

[06:47] Team_015 possession (Score: 75-43)
CJ Banchero attempts a Midrange. Heavily contested by OG Siakam (1.9 feet, ZONE)! CJ BANCHERO MAKES IT!
Score: 77-43

[06:32] Team_051 possession (Score: 77-43)
Franz Simmons makes the Layup and draws the foul on Michael Simmons! And-1! Franz Simmons to the line for 1. [Team fouls: 3] (Michael Simmons: 2 personal fouls)   FT 1/1: GOOD Franz Simmons makes 1/1 from the line.
Score: 77-46

[06:17] Team_015 possession (Score: 77-46)
Manu Anthony attempts a 3Pt. Contested by Austin Sexton (2.6 feet, ZONE). MANU ANTHONY MAKES IT! Assist: Trae Turner
Score: 80-46

[06:02] Team_051 possession (Score: 80-46)
Austin Sexton attempts a Layup. Heavily contested by Scottie Gasol (1.7 feet, ZONE)! AUSTIN SEXTON MAKES IT! Assist: Shaquille Harden
Score: 80-48

[05:48] Team_015 possession (Score: 80-48)
Scottie Gasol attempts a 3Pt. Contested by Franz Simmons (3.3 feet, MAN). SCOTTIE GASOL MAKES IT! Assist: Trae Turner
Score: 83-48

[05:31] Team_051 possession (Score: 83-48)
Shaquille Harden attempts a Midrange. Contested by Trae Turner (4.1 feet, MAN). Shaquille Harden misses. Offensive rebound by Shaquille Harden! Shaquille Harden's putback is no good. Rebound secured by CJ Banchero.

[05:15] Team_015 possession (Score: 83-48)
CJ Banchero attempts a Layup. Heavily contested by Franz Simmons (0.5 feet, ZONE)! CJ BANCHERO MAKES IT!
Score: 85-48

[04:58] Team_051 possession (Score: 85-48)
Franz Simmons attempts a Midrange. Wide open! CJ Banchero is 7.6 feet away. [ZONE] FRANZ SIMMONS MAKES IT!
Score: 85-50

[04:41] Team_015 possession (Score: 85-50)
CJ Banchero attempts a 3Pt. Wide open! Larry McGrady is 6.4 feet away. [ZONE] CJ BANCHERO MAKES IT! Assist: Scottie Gasol
Score: 88-50

[04:27] Team_051 possession (Score: 88-50)
OG Siakam attempts a 3Pt. Contested by CJ Banchero (3.7 feet, MAN). OG Siakam misses. Rebound secured by Michael Simmons.

[04:14] Team_015 possession (Score: 88-50)
Michael Simmons attempts a 3Pt. Wide open! Larry McGrady is 7.1 feet away. [MAN] Michael Simmons misses. Offensive rebound by Trae Turner! Trae Turner kicks it out.

[03:57] Team_015 possession (Score: 88-50)
Manu Anthony attempts a 3Pt. Wide open! Austin Sexton is 6.4 feet away. [MAN] Manu Anthony misses. Rebound secured by OG Siakam.

[03:41] Team_051 possession (Score: 88-50)
Shaquille Harden makes the Midrange and draws the foul on Scottie Gasol! And-1! Shaquille Harden to the line for 1. [Team fouls: 4] (Scottie Gasol: 1 personal fouls)   FT 1/1: GOOD Shaquille Harden makes 1/1 from the line.
Score: 88-53

[03:28] Team_015 possession (Score: 88-53)
CJ Banchero drives, picks up OG Siakam. Help arrives from Austin Sexton! CJ Banchero attempts a Layup. Contested by Austin Sexton (4.1 feet, MAN). CJ BANCHERO MAKES IT! Assist: Manu Anthony
Score: 90-53

[03:12] Team_051 possession (Score: 90-53)
OG Siakam attempts a 3Pt. Contested by CJ Banchero (4.2 feet, MAN). OG SIAKAM MAKES IT! Assist: Austin Sexton
Score: 90-56

[02:57] Team_015 possession (Score: 90-56)
FOUL! Shooting foul on Franz Simmons. Scottie Gasol to the line for 2 free throws. [Team fouls: 3] (Franz Simmons: 1 personal fouls)   FT 1/2: GOOD   FT 2/2: MISS Scottie Gasol makes 1/2 from the line. Rebound secured by Shaquille Harden.
Score: 91-56

[02:40] Team_051 possession (Score: 91-56)
FOUL! Holding foul on Trae Turner. [IN THE BONUS! 5 team fouls] Shaquille Harden to the line for 2 free throws. (Trae Turner: 1 personal fouls)   FT 1/2: MISS   FT 2/2: GOOD Shaquille Harden makes 1/2 from the line.
Score: 91-57

[02:27] Team_015 possession (Score: 91-57)
FOUL! Reach-in foul on OG Siakam during the drive. [Team fouls: 4] No free throws, side out. (OG Siakam: 2 personal fouls)

[02:14] Team_015 possession (Score: 91-57)
FOUL! Reach-in foul on Franz Simmons during the drive. [IN THE BONUS! 5 team fouls] Michael Simmons to the line for 2 free throws. (Franz Simmons: 2 personal fouls)   FT 1/2: GOOD   FT 2/2: GOOD Michael Simmons makes 2/2 from the line.
Score: 93-57

[02:03] Team_051 possession (Score: 93-57)
Austin Sexton attempts a Layup. BLOCKED BY SCOTTIE GASOL! Ball deflects out of bounds off Austin Sexton.

[01:50] Team_015 possession (Score: 93-57)
Trae Turner drives and kicks out. Scottie Gasol attempts a 3Pt. Heavily contested by Franz Simmons (1.9 feet, MAN)! Scottie Gasol misses. Offensive rebound by Trae Turner! Trae Turner kicks it out.

[01:36] Team_015 possession (Score: 93-57)
Manu Anthony attempts a 3Pt. Contested by Austin Sexton (5.8 feet, ZONE). MANU ANTHONY MAKES IT! Assist: Scottie Gasol
Score: 96-57

[01:19] Team_051 possession (Score: 96-57)
FOUL! Shooting foul on CJ Banchero. Larry McGrady to the line for 2 free throws. [BONUS: 6 team fouls] (CJ Banchero: 2 personal fouls)   FT 1/2: GOOD   FT 2/2: GOOD Larry McGrady makes 2/2 from the line.
Score: 96-59

[01:07] Team_015 possession (Score: 96-59)
FOUL! Holding foul on Larry McGrady. [IN THE BONUS! 6 team fouls] Michael Simmons to the line for 2 free throws. (Larry McGrady: 2 personal fouls)   FT 1/2: MISS   FT 2/2: GOOD Michael Simmons makes 1/2 from the line.
Score: 97-59

[00:52] Team_051 possession (Score: 97-59)
Franz Simmons drives to the basket... Franz Simmons loses the ball! Stripped by Scottie Gasol! TURNOVER! (live ball)

[00:36] Team_015 possession (Score: 97-59)
Manu Anthony drives to the basket... FOUL! Offensive foul on Manu Anthony! Austin Sexton drew the charge! [Team fouls: 7] (Manu Anthony: 1 personal fouls) TURNOVER! (dead ball)

[00:24] Team_051 possession (Score: 97-59)
OG Siakam drives and kicks out. Franz Simmons attempts a 3Pt. Contested by Scottie Gasol (5.6 feet, MAN). Franz Simmons misses. Rebound secured by Trae Turner.

[00:13] Team_015 possession (Score: 97-59)
Trae Turner attempts a 3Pt. Contested by Austin Sexton (5.0 feet, ZONE). TRAE TURNER MAKES IT!
Score: 100-59

================================================================================
                              3RD QUARTER COMPLETE                              
================================================================================

3RD QUARTER SCORE: Team_015 44, Team_051 20

BOX SCORE:
================================================================================

Team_015
--------------------------------------------------------------------------------
Player                MIN  PTS  REB  AST  TO      FG   FG%      3P   3P%
--------------------------------------------------------------------------------
CJ Banchero            26   12    4    0   0   5/6    83.3     0/0   0.0
Michael Simmons        26   10    3    1   0   4/4   100.0     0/0   0.0
Manu Anthony           26    9    0    1   0   3/4    75.0     0/0   0.0
Scottie Gasol          26    7    0    4   0   3/4    75.0     0/0   0.0
Trae Turner            24    5    6    3   0   2/3    66.7     0/0   0.0

TEAM: FG: 17/21 (81.0%), 3PT: 9/10 (90.0%), REB: 13 (4 off, 9 def), AST: 9, TO: 2
TEAM FOULS: 7 [Team_051 in BONUS]


Team_051
--------------------------------------------------------------------------------
Player                MIN  PTS  REB  AST  TO      FG   FG%      3P   3P%
--------------------------------------------------------------------------------
Franz Simmons          26    7    2    0   0   3/4    75.0     0/0   0.0
Austin Sexton          25    4    0    1   0   2/5    40.0     0/0   0.0
Shaquille Harden       26    4    2    1   0   2/4    50.0     0/0   0.0
OG Siakam              24    3    1    0   0   1/5    20.0     0/0   0.0
Larry McGrady          24    2    0    0   0   1/3    33.3     0/0   0.0

TEAM: FG: 9/21 (42.9%), 3PT: 1/5 (20.0%), REB: 5 (2 off, 3 def), AST: 2, TO: 1
TEAM FOULS: 6 [Team_015 in BONUS]

================================================================================

================================================================================
                       4TH QUARTER - Team_015 vs Team_051                       
================================================================================

[12:00] Team_015 possession (Score: 100-59)
FOUL! Reach-in foul on Franz Simmons during the drive. [Team fouls: 1] No free throws, side out. (Franz Simmons: 1 personal fouls)

[11:48] Team_015 possession (Score: 100-59)
Michael Simmons attempts a Layup. Wide open! Larry McGrady is 7.3 feet away. [MAN] Michael Simmons misses. Rebound secured by OG Siakam.

[11:32] Team_051 possession (Score: 100-59)
FOUL! Shooting foul on Trae Turner. Shaquille Harden to the line for 2 free throws. [Team fouls: 1] (Trae Turner: 1 personal fouls)   FT 1/2: GOOD   FT 2/2: GOOD Shaquille Harden makes 2/2 from the line.
Score: 100-61

[11:22] Team_015 possession (Score: 100-61)
Manu Anthony attempts a Layup. BLOCKED BY SHAQUILLE HARDEN! Ball deflects out of bounds off Manu Anthony.

[11:03] Team_051 possession (Score: 100-61)
Franz Simmons attempts a Layup. Heavily contested by Scottie Gasol (1.9 feet, ZONE)! Franz Simmons misses. Rebound secured by Trae Turner.

[10:48] Team_015 possession (Score: 100-61)
CJ Banchero makes the Midrange and draws the foul on Franz Simmons! And-1! CJ Banchero to the line for 1. [Team fouls: 2] (Franz Simmons: 2 personal fouls)   FT 1/1: GOOD CJ Banchero makes 1/1 from the line.
Score: 103-61

[10:36] Team_051 possession (Score: 103-61)
OG Siakam attempts a 3Pt. Contested by Manu Anthony (4.3 feet, ZONE). OG Siakam misses. Offensive rebound by Franz Simmons! Franz Simmons kicks it out.

[10:24] Team_051 possession (Score: 103-61)
FOUL! Offensive foul on Franz Simmons! Scottie Gasol drew the charge! [Team fouls: 3] (Franz Simmons: 3 personal fouls) TURNOVER! (dead ball)

[10:09] Team_015 possession (Score: 103-61)
CJ Banchero attempts a 3Pt. Contested by OG Siakam (2.4 feet, MAN). CJ Banchero misses. FOUL! Loose ball foul on Franz Simmons during the rebound battle. [Team fouls: 4] No free throws, side out. (Franz Simmons: 4 personal fouls)

[09:51] Team_015 possession (Score: 103-61)
Scottie Gasol attempts a 3Pt. Contested by Franz Simmons (2.8 feet, MAN). Scottie Gasol misses. Rebound secured by Shaquille Harden.

[09:36] Team_051 possession (Score: 103-61)
FOUL! Shooting foul on CJ Banchero. Shaquille Harden to the line for 2 free throws. [Team fouls: 2] (CJ Banchero: 1 personal fouls)   FT 1/2: MISS   FT 2/2: GOOD Shaquille Harden makes 1/2 from the line.
Score: 103-62

[09:19] Team_015 possession (Score: 103-62)
Manu Anthony attempts a 3Pt. Heavily contested by Larry McGrady (1.5 feet, ZONE)! MANU ANTHONY MAKES IT! Assist: Michael Simmons
Score: 106-62

[09:06] Team_051 possession (Score: 106-62)
Austin Sexton drives to the basket... FOUL! Offensive foul on Austin Sexton! Scottie Gasol drew the charge! [Team fouls: 5] (Austin Sexton: 1 personal fouls) TURNOVER! (dead ball)

[08:50] Team_015 possession (Score: 106-62)
Trae Turner loses the ball! Stripped by Shaquille Harden! TURNOVER! (live ball)

[08:33] Team_051 possession (Score: 106-62)
Austin Sexton attempts a 3Pt. Wide open! Manu Anthony is 9.3 feet away. [ZONE] Austin Sexton misses. Offensive rebound by Shaquille Harden! Shaquille Harden's putback is no good. Rebound secured by CJ Banchero.

[08:20] Team_015 possession (Score: 106-62)
FOUL! Holding foul on OG Siakam. [IN THE BONUS! 6 team fouls] CJ Banchero to the line for 2 free throws. (OG Siakam: 1 personal fouls)   FT 1/2: GOOD   FT 2/2: GOOD CJ Banchero makes 2/2 from the line.
Score: 108-62

[08:03] Team_051 possession (Score: 108-62)
Franz Simmons attempts a Midrange. Heavily contested by Scottie Gasol (1.0 feet, MAN)! FRANZ SIMMONS MAKES IT!
Score: 108-64

[07:49] Team_015 possession (Score: 108-64)
Manu Anthony drives and kicks out. Manu Anthony attempts a Midrange. Wide open! Austin Sexton is 7.9 feet away. [ZONE] MANU ANTHONY MAKES IT!
Score: 110-64

[07:39] Team_051 possession (Score: 110-64)
Larry McGrady attempts a Midrange. Wide open! Michael Simmons is 7.9 feet away. [MAN] Larry McGrady misses. Rebound secured by Scottie Gasol.

[07:24] Team_015 possession (Score: 110-64)
CJ Banchero drives, picks up Franz Simmons. Help arrives from Austin Sexton! CJ Banchero attempts a Dunk. Contested by Austin Sexton (4.7 feet, ZONE). CJ BANCHERO MAKES IT! Assist: Scottie Gasol
Score: 112-64

[07:08] Team_051 possession (Score: 112-64)
Shaquille Harden attempts a Layup. BLOCKED BY MICHAEL SIMMONS! Ball is loose! Rebound secured by CJ Banchero.

[06:53] Team_015 possession (Score: 112-64)
Manu Anthony attempts a 3Pt. Wide open! Austin Sexton is 8.2 feet away. [MAN] Manu Anthony misses. FOUL! Loose ball foul on Shaquille Harden during the rebound battle. [IN THE BONUS! 7 team fouls] CJ Banchero to the line for 2 free throws. (Shaquille Harden: 1 personal fouls)   FT 1/2: MISS   FT 2/2: GOOD CJ Banchero makes 1/2 from the line.
Score: 113-64

[06:41] Team_051 possession (Score: 113-64)
Larry McGrady attempts a Layup. Contested by Scottie Gasol (4.7 feet, ZONE). LARRY MCGRADY MAKES IT! Assist: Franz Simmons
Score: 113-66

[06:27] Team_015 possession (Score: 113-66)
Michael Simmons attempts a 3Pt. Contested by Larry McGrady (5.7 feet, MAN). Michael Simmons misses. Rebound secured by Shaquille Harden.

[06:13] Team_051 possession (Score: 113-66)
Austin Sexton drives to the basket... Austin Sexton loses the ball! Stripped by Scottie Gasol! TURNOVER! (live ball)

[05:56] Team_015 possession (Score: 113-66)
CJ Banchero drives, Franz Simmons stays with him. CJ Banchero attempts a Layup. Contested by Franz Simmons (3.3 feet, ZONE). CJ BANCHERO MAKES IT!
Score: 115-66

[05:44] Team_051 possession (Score: 115-66)
Franz Simmons attempts a 3Pt. Contested by Manu Anthony (5.5 feet, ZONE). FRANZ SIMMONS MAKES IT! Assist: OG Siakam
Score: 115-69

[05:28] Team_015 possession (Score: 115-69)
Scottie Gasol attempts a Layup. Heavily contested by Franz Simmons (2.0 feet, ZONE)! Scottie Gasol misses. Offensive rebound by Michael Simmons! Michael Simmons kicks it out.

[05:14] Team_015 possession (Score: 115-69)
FOUL! Shooting foul on Larry McGrady. Michael Simmons to the line for 2 free throws. [BONUS: 8 team fouls] (Larry McGrady: 1 personal fouls)   FT 1/2: GOOD   FT 2/2: MISS Michael Simmons makes 1/2 from the line. Rebound secured by OG Siakam.
Score: 116-69

[05:01] Team_051 possession (Score: 116-69)
Franz Simmons attempts a 3Pt. Wide open! Michael Simmons is 6.4 feet away. [ZONE] Franz Simmons misses. Rebound secured by Scottie Gasol.

[04:46] Team_015 possession (Score: 116-69)
Michael Simmons attempts a Midrange. Wide open! Franz Simmons is 6.9 feet away. [ZONE] Michael Simmons misses. Rebound secured by Shaquille Harden.

[04:33] Team_051 possession (Score: 116-69)
OG Siakam attempts a 3Pt. Contested by CJ Banchero (4.0 feet, MAN). OG Siakam misses. Rebound secured by Scottie Gasol.

[04:18] Team_015 possession (Score: 116-69)
Scottie Gasol drives and kicks out. Manu Anthony attempts a 3Pt. Contested by Austin Sexton (4.2 feet, ZONE). MANU ANTHONY MAKES IT! Assist: Michael Simmons
Score: 119-69

[04:06] Team_051 possession (Score: 119-69)
Shaquille Harden throws a bad pass out of bounds! TURNOVER! (dead ball)

[04:06] Substitution (Team_015): Manu Anthony OUT → Dwyane Sabonis IN (stamina_rule2)

[04:06] Substitution (Team_015): Michael Simmons OUT → Paolo Jokic IN (stamina_rule2)

[04:06] Substitution (Team_015): CJ Banchero OUT → Magic Wagner IN (stamina_rule2)

[04:06] Substitution (Team_015): Scottie Gasol OUT → Rudy Paul IN (stamina_rule2)

[04:06] Substitution (Team_015): Trae Turner OUT → Allen Curry IN (stamina_rule2)

[04:06] Substitution (Team_051): Austin Sexton OUT → Myles Harden IN (stamina_rule2)

[04:06] Substitution (Team_051): Larry McGrady OUT → Zion Morant IN (stamina_rule2)

[04:06] Substitution (Team_051): OG Siakam OUT → Jrue Carter IN (stamina_rule2)

[04:06] Substitution (Team_051): Franz Simmons OUT → Tobias Jokic IN (stamina_rule2)

[04:06] Substitution (Team_051): Shaquille Harden OUT → Pau Tatum IN (stamina_rule2)

[03:56] Team_015 possession (Score: 119-69)
Magic Wagner attempts a Layup. Wide open! Jrue Carter is 8.0 feet away. [MAN] MAGIC WAGNER MAKES IT! Assist: Allen Curry
Score: 121-69

[03:41] Team_051 possession (Score: 121-69)
Zion Morant drives and kicks out. FOUL! Shooting foul on Rudy Paul. Tobias Jokic to the line for 3 free throws. [Team fouls: 3] (Rudy Paul: 1 personal fouls)   FT 1/3: MISS   FT 2/3: GOOD   FT 3/3: GOOD Tobias Jokic makes 2/3 from the line.
Score: 121-71

[03:23] Team_015 possession (Score: 121-71)
Rudy Paul attempts a Midrange. Wide open! Tobias Jokic is 7.1 feet away. [MAN] Rudy Paul misses. Rebound secured by Myles Harden.

[03:11] Team_051 possession (Score: 121-71)
FOUL! Reach-in foul on Rudy Paul during the drive. [Team fouls: 4] No free throws, side out. (Rudy Paul: 2 personal fouls)

[02:57] Team_051 possession (Score: 121-71)
FOUL! Shooting foul on Rudy Paul. Jrue Carter to the line for 3 free throws. [BONUS: 5 team fouls] (Rudy Paul: 3 personal fouls)   FT 1/3: GOOD   FT 2/3: GOOD   FT 3/3: GOOD Jrue Carter makes 3/3 from the line.
Score: 121-74

[02:45] Team_015 possession (Score: 121-74)
Magic Wagner attempts a Midrange. Heavily contested by Tobias Jokic (1.5 feet, ZONE)! MAGIC WAGNER MAKES IT! Assist: Paolo Jokic
Score: 123-74

[02:35] Team_051 possession (Score: 123-74)
FOUL! Reach-in foul on Rudy Paul during the drive. [IN THE BONUS! 6 team fouls] Tobias Jokic to the line for 2 free throws. (Rudy Paul: 4 personal fouls)   FT 1/2: GOOD   FT 2/2: MISS Tobias Jokic makes 1/2 from the line. Rebound secured by Allen Curry.
Score: 123-75

[02:20] Team_015 possession (Score: 123-75)
Paolo Jokic attempts a Midrange. Wide open! Zion Morant is 7.6 feet away. [MAN] Paolo Jokic misses. Rebound secured by Tobias Jokic.

[02:07] Team_051 possession (Score: 123-75)
Pau Tatum attempts a Midrange. Wide open! Rudy Paul is 8.2 feet away. [MAN] Pau Tatum misses. Rebound secured by Magic Wagner.

[01:52] Team_015 possession (Score: 123-75)
Allen Curry attempts a 3Pt. Contested by Pau Tatum (4.0 feet, MAN). ALLEN CURRY MAKES IT!
Score: 126-75

[01:37] Team_051 possession (Score: 126-75)
Zion Morant attempts a 3Pt. Contested by Rudy Paul (5.6 feet, ZONE). Zion Morant misses. Rebound secured by Allen Curry.

[01:20] Team_015 possession (Score: 126-75)
Dwyane Sabonis attempts a Midrange. Contested by Tobias Jokic (4.1 feet, ZONE). Dwyane Sabonis misses. Rebound secured by Pau Tatum.

[01:08] Team_051 possession (Score: 126-75)
Tobias Jokic attempts a 3Pt. BLOCKED BY RUDY PAUL! Ball deflects out of bounds off Tobias Jokic.

[00:52] Team_015 possession (Score: 126-75)
Allen Curry drives and kicks out. Rudy Paul attempts a Midrange. BLOCKED BY TOBIAS JOKIC! Ball deflects out of bounds off Rudy Paul.

[00:38] Team_051 possession (Score: 126-75)
FOUL! Offensive foul on Tobias Jokic! Rudy Paul drew the charge! [Team fouls: 9] (Tobias Jokic: 1 personal fouls) TURNOVER! (dead ball)

[00:25] Team_015 possession (Score: 126-75)
Allen Curry attempts a Layup. BLOCKED BY PAU TATUM! Ball goes out off Pau Tatum. Allen Curry's ball!

[00:15] Team_015 possession (Score: 126-75)
Rudy Paul attempts a 3Pt. Contested by Tobias Jokic (5.7 feet, MAN). Rudy Paul misses. Rebound secured by Pau Tatum.

[00:02] Team_051 possession (Score: 126-75)
Jrue Carter drives and kicks out. Zion Morant attempts a 3Pt. Contested by Rudy Paul (5.5 feet, ZONE). Zion Morant misses. Rebound secured by Magic Wagner.

================================================================================
                              4TH QUARTER COMPLETE                              
================================================================================

4TH QUARTER SCORE: Team_015 26, Team_051 16

BOX SCORE:
================================================================================

Team_015
--------------------------------------------------------------------------------
Player                MIN  PTS  REB  AST  TO      FG   FG%      3P   3P%
--------------------------------------------------------------------------------
CJ Banchero            34   10    2    0   0   5/5   100.0     0/0   0.0
Manu Anthony           34    8    0    0   0   3/4    75.0     0/0   0.0
Magic Wagner           14    4    2    0   0   2/2   100.0     0/0   0.0
Allen Curry            16    3    2    1   0   1/2    50.0     0/0   0.0
Michael Simmons        34    0    2    2   0   0/4     0.0     0/0   0.0
Trae Turner            32    0    1    0   0   0/0     0.0     0/0   0.0
Scottie Gasol          34    0    3    1   0   0/1     0.0     0/0   0.0
Rudy Paul              14    0    0    0   0   0/2     0.0     0/0   0.0
Paolo Jokic            14    0    0    1   0   0/1     0.0     0/0   0.0
Dwyane Sabonis         14    0    0    0   0   0/1     0.0     0/0   0.0

TEAM: FG: 11/22 (50.0%), 3PT: 3/6 (50.0%), REB: 11 (2 off, 9 def), AST: 5, TO: 1
TEAM FOULS: 6 [Team_051 in BONUS]


Team_051
--------------------------------------------------------------------------------
Player                MIN  PTS  REB  AST  TO      FG   FG%      3P   3P%
--------------------------------------------------------------------------------
Franz Simmons          34    5    1    1   0   2/4    50.0     0/0   0.0
Shaquille Harden       34    3    3    0   0   2/3    66.7     0/0   0.0
Jrue Carter            16    3    0    0   0   1/2    50.0     0/0   0.0
Larry McGrady          32    2    0    0   0   1/2    50.0     0/0   0.0
Tobias Jokic           14    2    1    0   0   1/3    33.3     0/0   0.0
OG Siakam              32    0    2    1   0   0/1     0.0     0/0   0.0
Austin Sexton          33    0    0    0   0   0/1     0.0     0/0   0.0
Myles Harden           15    0    1    0   0   0/0     0.0     0/0   0.0
Pau Tatum              14    0    2    0   0   0/1     0.0     0/0   0.0
Zion Morant            16    0    0    0   0   0/1     0.0     0/0   0.0

TEAM: FG: 7/18 (38.9%), 3PT: 2/7 (28.6%), REB: 11 (2 off, 9 def), AST: 2, TO: 5
TEAM FOULS: 9 [Team_015 in BONUS]

================================================================================

================================================================================
                               FULL GAME COMPLETE                               
================================================================================

FINAL SCORE: Team_015 126, Team_051 75

SCORING BY QUARTER:
--------------------------------------------------------------------------------
Team                     Q1     Q2     Q3     Q4    FINAL
--------------------------------------------------------------------------------
Team_015                 31     25     44     26      126
Team_051                 18     21     20     16       75
--------------------------------------------------------------------------------

FULL GAME BOX SCORE:
================================================================================

Team_015
--------------------------------------------------------------------------------
Player                MIN  PTS  REB  AST  TO      FG   FG%      3P   3P%      FT STL BLK
--------------------------------------------------------------------------------
Manu Anthony           34   22    0    1   4   7/10   70.0   6/7    85.7   0/0     1   0
Michael Simmons        34   21   11    3   2   7/14   50.0   3/5    60.0   7/9     0   2
CJ Banchero            34   27   14    3   1  10/12   83.3   3/4    75.0   4/5     0   0
Scottie Gasol          34   15    3    7   2   8/12   66.7   2/3    66.7   2/3     3   3
Trae Turner            32    9    9    4   3   4/6    66.7   1/1   100.0   2/4     1   0
Allen Curry            16    8    7    5   0   3/5    60.0   1/1   100.0   2/4     0   1
Dwyane Sabonis         14    2    0    0   2   0/2     0.0   0/1     0.0   0/0     0   0
Paolo Jokic            14    5    0    2   2   3/4    75.0   1/1   100.0   2/2     0   0
Magic Wagner           14    7    3    0   0   2/2   100.0   0/0     0.0   0/0     0   0
Rudy Paul              14    7    4    0   1   5/7    71.4   1/2    50.0   0/0     0   3

TEAM: FG: 51/76 (67.1%), 3PT: 18/25 (72.0%), REB: 48 (7 off, 41 def), AST: 25, TO: 17


Team_051
--------------------------------------------------------------------------------
Player                MIN  PTS  REB  AST  TO      FG   FG%      3P   3P%      FT STL BLK
--------------------------------------------------------------------------------
Franz Simmons          34   14    4    3   1   6/16   37.5   1/3    33.3   5/5     2   2
Shaquille Harden       34    9   12    1   3   4/10   40.0   0/1     0.0   5/7     2   1
Austin Sexton          33    8    0    3   2   3/11   27.3   0/4     0.0   2/2     0   0
Larry McGrady          32   13    0    0   2   5/8    62.5   2/3    66.7   2/2     0   0
OG Siakam              32    5    3    2   1   3/10   30.0   1/6    16.7   0/0     0   0
Zion Morant            16    6    0    1   2   3/7    42.9   1/3    33.3   1/1     1   0
Jrue Carter            16   11    0    1   0   4/6    66.7   3/3   100.0   3/3     0   0
Myles Harden           15    2    2    0   1   1/3    33.3   0/1     0.0   0/0     2   0
Tobias Jokic           14    2    7    2   1   0/4     0.0   0/3     0.0   3/5     0   1
Pau Tatum              14    2    3    2   0   1/3    33.3   0/0     0.0   2/4     1   1

TEAM: FG: 31/79 (39.2%), 3PT: 8/27 (29.6%), REB: 34 (13 off, 21 def), AST: 15, TO: 13

================================================================================
