================================================================================
                        FULL GAME - Team_025 vs Team_096                        
================================================================================

================================================================================
                       1ST QUARTER - Team_025 vs Team_096                       
================================================================================

[12:00] Team_025 possession (Score: 0-0)
Desmond Jordan attempts a 3Pt. Heavily contested by Cole Griffin (0.5 feet, ZONE)! Desmond Jordan misses. Offensive rebound by Desmond Jordan! Desmond Jordan puts it back in!
Score: 2-0

[11:43] Team_096 possession (Score: 2-0)
Kyrie Adebayo attempts a 3Pt. Wide open! Cade Anthony is 6.5 feet away. [ZONE] Kyrie Adebayo misses. Rebound secured by Desmond Jordan.

[11:30] Team_025 possession (Score: 2-0)
Desmond Jordan attempts a 3Pt. Contested by Cole Griffin (3.6 feet, MAN). DESMOND JORDAN MAKES IT! Assist: Ben Giddey
Score: 5-0

[11:10] Team_096 possession (Score: 5-0)
FOUL! Shooting foul on Ben Giddey. Lamelo Quickley to the line for 3 free throws. [Team fouls: 1] (Ben Giddey: 1 personal fouls)   FT 1/3: GOOD   FT 2/3: GOOD   FT 3/3: MISS Lamelo Quickley makes 2/3 from the line. Rebound secured by Desmond Jordan.
Score: 5-2

[10:55] Team_025 possession (Score: 5-2)
Allen Embiid attempts a Layup. Heavily contested by Kyrie Adebayo (1.8 feet, MAN)! ALLEN EMBIID MAKES IT! Assist: Cade Anthony
Score: 7-2

[10:44] Team_096 possession (Score: 7-2)
Kyrie Adebayo drives and kicks out. Kyrie Adebayo attempts a Midrange. Heavily contested by Desmond Jordan (0.5 feet, ZONE)! Kyrie Adebayo misses. Rebound secured by Cade Anthony.

[10:29] Team_025 possession (Score: 7-2)
Paolo Lowry makes the Layup and draws the foul on Lamelo Quickley! And-1! Paolo Lowry to the line for 1. [Team fouls: 1] (Lamelo Quickley: 1 personal fouls)   FT 1/1: GOOD Paolo Lowry makes 1/1 from the line.
Score: 10-2

[10:13] Team_096 possession (Score: 10-2)
Cole Griffin drives, Desmond Jordan stays with him. Cole Griffin attempts a Dunk. Heavily contested by Desmond Jordan (0.5 feet, MAN)! COLE GRIFFIN MAKES IT! Assist: Lamelo Quickley
Score: 10-4

[09:58] Team_025 possession (Score: 10-4)
Desmond Jordan attempts a Layup. Wide open! Kyrie Adebayo is 7.1 feet away. [ZONE] Desmond Jordan misses. Rebound secured by Kyrie Adebayo.

[09:43] Team_096 possession (Score: 10-4)
Kyrie Adebayo attempts a Midrange. Wide open! Desmond Jordan is 6.9 feet away. [ZONE] Kyrie Adebayo misses. Rebound secured by Desmond Jordan.

[09:27] Team_025 possession (Score: 10-4)
Paolo Lowry attempts a 3Pt. Contested by Cole Griffin (5.4 feet, ZONE). Paolo Lowry misses. Offensive rebound by Desmond Jordan! Desmond Jordan puts it back in!
Score: 12-4

[09:08] Team_096 possession (Score: 12-4)
Kyrie Adebayo drives and kicks out. Kyrie Adebayo attempts a Midrange. Heavily contested by Desmond Jordan (1.3 feet, ZONE)! Kyrie Adebayo misses. Rebound secured by Cade Anthony.

[08:53] Team_025 possession (Score: 12-4)
Desmond Jordan drives and kicks out. Desmond Jordan attempts a 3Pt. Contested by Cole Griffin (2.2 feet, MAN). Desmond Jordan misses. Rebound secured by Kyrie Adebayo.

[08:37] Team_096 possession (Score: 12-4)
Lamelo Quickley attempts a Midrange. Contested by Ben Giddey (3.7 feet, MAN). LAMELO QUICKLEY MAKES IT!
Score: 12-6

[08:24] Team_025 possession (Score: 12-6)
Ben Giddey drives, picks up Kyrie Adebayo. Help arrives from Lamelo Quickley! Ben Giddey attempts a Dunk. Contested by Lamelo Quickley (4.4 feet, ZONE). BEN GIDDEY MAKES IT! Assist: Paolo Lowry
Score: 14-6

[08:05] Team_096 possession (Score: 14-6)
Cole Griffin attempts a Layup. Contested by Desmond Jordan (5.5 feet, MAN). Cole Griffin misses. Rebound secured by Allen Embiid.

[07:46] Team_025 possession (Score: 14-6)
Cade Anthony drives to the basket... Cade Anthony throws a bad pass! Stolen by Scottie Herro! TURNOVER! (live ball)

[07:30] Team_096 possession (Score: 14-6)
FOUL! Reach-in foul on Cade Anthony during the drive. [Team fouls: 2] No free throws, side out. (Cade Anthony: 1 personal fouls)

[07:21] Team_096 possession (Score: 14-6)
Lamelo Quickley drives, Allen Embiid stays with him. Lamelo Quickley attempts a Layup. Contested by Allen Embiid (3.3 feet, ZONE). LAMELO QUICKLEY MAKES IT! Assist: Scottie Herro
Score: 14-8

[07:05] Team_025 possession (Score: 14-8)
Desmond Jordan drives, picks up Cole Griffin. Help arrives from Lamelo Quickley! Desmond Jordan attempts a Layup. Contested by Lamelo Quickley (3.0 feet, MAN). Desmond Jordan misses. Rebound secured by Scottie Herro.

[06:46] Team_096 possession (Score: 14-8)
Kyrie Adebayo attempts a Midrange. Heavily contested by Allen Embiid (1.2 feet, MAN)! Kyrie Adebayo misses. FOUL! Loose ball foul on Allen Embiid during the rebound battle. [Team fouls: 3] No free throws, side out. (Allen Embiid: 1 personal fouls)

[06:27] Team_096 possession (Score: 14-8)
Scottie Herro attempts a 3Pt. Wide open! Paolo Lowry is 6.3 feet away. [ZONE] Scottie Herro misses. Rebound secured by Cade Anthony.

[06:14] Team_025 possession (Score: 14-8)
Paolo Lowry attempts a 3Pt. Contested by Terry Mobley (4.3 feet, MAN). PAOLO LOWRY MAKES IT! Assist: Cade Anthony
Score: 17-8

[06:02] Team_096 possession (Score: 17-8)
Cole Griffin attempts a 3Pt. Contested by Desmond Jordan (2.6 feet, MAN). Cole Griffin misses. Rebound secured by Desmond Jordan.

[05:53] Team_025 possession (Score: 17-8)
Allen Embiid attempts a Layup. Contested by Kyrie Adebayo (3.3 feet, ZONE). ALLEN EMBIID MAKES IT!
Score: 19-8

[05:37] Team_096 possession (Score: 19-8)
Cole Griffin attempts a 3Pt. Heavily contested by Desmond Jordan (1.2 feet, MAN)! Cole Griffin misses. Rebound secured by Desmond Jordan.

[05:22] Team_025 possession (Score: 19-8)
Allen Embiid drives, Kyrie Adebayo stays with him. Allen Embiid attempts a Dunk. Contested by Kyrie Adebayo (2.1 feet, MAN). ALLEN EMBIID MAKES IT! Assist: Cade Anthony
Score: 21-8

[05:11] Team_096 possession (Score: 21-8)
Cole Griffin attempts a 3Pt. Wide open! Ben Giddey is 7.2 feet away. [ZONE] COLE GRIFFIN MAKES IT! Assist: Scottie Herro
Score: 21-11

[04:57] Team_025 possession (Score: 21-11)
Allen Embiid drives, picks up Kyrie Adebayo. Help arrives from Lamelo Quickley! Allen Embiid attempts a Dunk. Contested by Lamelo Quickley (3.3 feet, MAN). ALLEN EMBIID MAKES IT! Assist: Cade Anthony
Score: 23-11

[04:45] Team_096 possession (Score: 23-11)
Cole Griffin makes the Layup and draws the foul on Allen Embiid! And-1! Cole Griffin to the line for 1. [Team fouls: 4] (Allen Embiid: 2 personal fouls)   FT 1/1: GOOD Cole Griffin makes 1/1 from the line.
Score: 23-14

[04:30] Team_025 possession (Score: 23-14)
Cade Anthony attempts a Layup. Contested by Kyrie Adebayo (4.2 feet, ZONE). CADE ANTHONY MAKES IT! Assist: Desmond Jordan
Score: 25-14

[04:18] Team_096 possession (Score: 25-14)
Kyrie Adebayo drives and kicks out. Kyrie Adebayo attempts a Midrange. Contested by Desmond Jordan (4.3 feet, ZONE). Kyrie Adebayo misses. Rebound secured by Cade Anthony.

[04:05] Team_025 possession (Score: 25-14)
FOUL! Holding foul on Kyrie Adebayo. [Team fouls: 2] No free throws, side out. (Kyrie Adebayo: 1 personal fouls)

[03:48] Team_025 possession (Score: 25-14)
Paolo Lowry attempts a Midrange. Wide open! Cole Griffin is 7.8 feet away. [ZONE] Paolo Lowry misses. Rebound secured by Cole Griffin.

[03:30] Team_096 possession (Score: 25-14)
Cole Griffin drives to the basket... Cole Griffin throws a bad pass! Stolen by Allen Embiid! TURNOVER! (live ball)

[03:13] Team_025 possession (Score: 25-14)
Ben Giddey attempts a Midrange. Contested by Scottie Herro (4.0 feet, ZONE). Ben Giddey misses. Rebound secured by Kyrie Adebayo.

[03:01] Team_096 possession (Score: 25-14)
Cole Griffin drives to the basket... Cole Griffin throws a bad pass! Stolen by Desmond Jordan! TURNOVER! (live ball)

[02:44] Team_025 possession (Score: 25-14)
Ben Giddey attempts a 3Pt. Wide open! Cole Griffin is 6.6 feet away. [ZONE] Ben Giddey misses. Offensive rebound by Allen Embiid! Allen Embiid's putback is no good. Rebound secured by Kyrie Adebayo.

[02:34] Team_096 possession (Score: 25-14)
FOUL! Offensive foul on Cole Griffin! Desmond Jordan drew the charge! [Team fouls: 3] (Cole Griffin: 1 personal fouls) TURNOVER! (dead ball)

[02:16] Team_025 possession (Score: 25-14)
Paolo Lowry makes the Midrange and draws the foul on Lamelo Quickley! And-1! Paolo Lowry to the line for 1. [Team fouls: 4] (Lamelo Quickley: 2 personal fouls)   FT 1/1: MISS Paolo Lowry makes 0/1 from the line. Rebound secured by Kyrie Adebayo.
Score: 27-14

[02:01] Team_096 possession (Score: 27-14)
Scottie Herro attempts a 3Pt. Contested by Ben Giddey (5.6 feet, ZONE). SCOTTIE HERRO MAKES IT! Assist: Terry Mobley
Score: 27-17

[01:47] Team_025 possession (Score: 27-17)
Ben Giddey attempts a Layup. Contested by Kyrie Adebayo (2.9 feet, ZONE). BEN GIDDEY MAKES IT! Assist: Paolo Lowry
Score: 29-17

[01:33] Team_096 possession (Score: 29-17)
Kyrie Adebayo attempts a Midrange. Contested by Allen Embiid (3.0 feet, MAN). Kyrie Adebayo misses. Offensive rebound by Kyrie Adebayo! Kyrie Adebayo's putback is no good. Rebound secured by Desmond Jordan.

[01:18] Team_025 possession (Score: 29-17)
Allen Embiid makes the Layup and draws the foul on Kyrie Adebayo! And-1! Allen Embiid to the line for 1. [BONUS: 5 team fouls] (Kyrie Adebayo: 2 personal fouls)   FT 1/1: GOOD Allen Embiid makes 1/1 from the line.
Score: 32-17

[01:07] Team_096 possession (Score: 32-17)
Kyrie Adebayo attempts a Midrange. Contested by Allen Embiid (3.4 feet, MAN). Kyrie Adebayo misses. Rebound secured by Allen Embiid.

[00:57] Team_025 possession (Score: 32-17)
Paolo Lowry attempts a Layup. Contested by Terry Mobley (3.3 feet, MAN). Paolo Lowry misses. Rebound secured by Cole Griffin.

[00:43] Team_096 possession (Score: 32-17)
Cole Griffin commits a violation (traveling/carry)! TURNOVER! (dead ball)

[00:43] Substitution (Team_025): Paolo Lowry OUT → LeBron Griffin IN (stamina_rule2)

[00:43] Substitution (Team_025): Ben Giddey OUT → Dirk Gilgeous-Alexander IN (stamina_rule2)

[00:43] Substitution (Team_025): Desmond Jordan OUT → Immanuel LaVine IN (stamina_rule2)

[00:43] Substitution (Team_025): Cade Anthony OUT → Damian Adebayo IN (stamina_rule2)

[00:43] Substitution (Team_025): Allen Embiid OUT → Nikola Lillard IN (stamina_rule2)

[00:43] Substitution (Team_096): Terry Mobley OUT → Cade Jokic IN (stamina_rule2)

[00:43] Substitution (Team_096): Lamelo Quickley OUT → Jarrett Markkanen IN (stamina_rule2)

[00:43] Substitution (Team_096): Cole Griffin OUT → Cole Holiday IN (stamina_rule2)

[00:43] Substitution (Team_096): Scottie Herro OUT → Tyler Haliburton IN (stamina_rule2)

[00:43] Substitution (Team_096): Kyrie Adebayo OUT → Devin Griffin IN (stamina_rule2)

[00:33] Team_025 possession (Score: 32-17)
Immanuel LaVine attempts a 3Pt. Contested by Cade Jokic (6.0 feet, ZONE). Immanuel LaVine misses. Rebound secured by Jarrett Markkanen.

[00:22] Team_096 possession (Score: 32-17)
FOUL! Reach-in foul on Damian Adebayo during the drive. [IN THE BONUS! 5 team fouls] Tyler Haliburton to the line for 2 free throws. (Damian Adebayo: 1 personal fouls)   FT 1/2: MISS   FT 2/2: GOOD Tyler Haliburton makes 1/2 from the line.
Score: 32-18

[00:10] Team_025 possession (Score: 32-18)
Immanuel LaVine attempts a 3Pt. Contested by Cade Jokic (4.1 feet, ZONE). Immanuel LaVine misses. Rebound secured by Tyler Haliburton.

================================================================================
                              1ST QUARTER COMPLETE                              
================================================================================

1ST QUARTER SCORE: Team_025 32, Team_096 18

BOX SCORE:
================================================================================

Team_025
--------------------------------------------------------------------------------
Player                MIN  PTS  REB  AST  TO      FG   FG%      3P   3P%
--------------------------------------------------------------------------------
Allen Embiid           11   11    2    0   0   5/5   100.0     0/0   0.0
Paolo Lowry            11    6    0    2   0   2/5    40.0     0/0   0.0
Ben Giddey             11    4    0    1   0   2/4    50.0     0/0   0.0
Cade Anthony           11    2    4    4   0   1/1   100.0     0/0   0.0
Immanuel LaVine         1    0    0    0   0   0/2     0.0     0/0   0.0

TEAM: FG: 13/23 (56.5%), 3PT: 4/7 (57.1%), REB: 14 (3 off, 11 def), AST: 8, TO: 1
TEAM FOULS: 5 [Team_096 in BONUS]


Team_096
--------------------------------------------------------------------------------
Player                MIN  PTS  REB  AST  TO      FG   FG%      3P   3P%
--------------------------------------------------------------------------------
Cole Griffin           11    8    2    0   0   3/6    50.0     0/0   0.0
Desmond Jordan         11    7    8    1   0   3/6    50.0     0/0   0.0
Lamelo Quickley        11    4    0    1   0   2/3    66.7     0/0   0.0
Scottie Herro          11    3    1    2   0   1/2    50.0     0/0   0.0
Tyler Haliburton        1    1    1    0   0   1/1   100.0     0/0   0.0
Kyrie Adebayo          11    0    6    0   0   0/7     0.0     0/0   0.0
Terry Mobley           11    0    0    1   0   0/0     0.0     0/0   0.0
Jarrett Markkanen       1    0    1    0   0   0/0     0.0     0/0   0.0

TEAM: FG: 7/19 (36.8%), 3PT: 2/7 (28.6%), REB: 11 (2 off, 9 def), AST: 4, TO: 4
TEAM FOULS: 5 [Team_025 in BONUS]

================================================================================

================================================================================
                       2ND QUARTER - Team_025 vs Team_096                       
================================================================================

[12:00] Team_025 possession (Score: 32-18)
FOUL! Reach-in foul on Scottie Herro during the drive. [Team fouls: 1] No free throws, side out. (Scottie Herro: 1 personal fouls)

[11:47] Team_025 possession (Score: 32-18)
Desmond Jordan drives, Cole Griffin stays with him. Desmond Jordan attempts a Layup. Contested by Cole Griffin (3.1 feet, MAN). Desmond Jordan misses. Rebound secured by Kyrie Adebayo.

[11:33] Team_096 possession (Score: 32-18)
Terry Mobley attempts a 3Pt. Heavily contested by Ben Giddey (0.9 feet, ZONE)! Terry Mobley misses. Rebound secured by Cade Anthony.

[11:20] Team_025 possession (Score: 32-18)
Paolo Lowry attempts a Layup. BLOCKED BY LAMELO QUICKLEY! Ball is loose! Rebound secured by Scottie Herro.

[11:07] Team_096 possession (Score: 32-18)
Cole Griffin attempts a Layup. BLOCKED BY DESMOND JORDAN! Ball is loose! Rebound secured by Cade Anthony.

[10:50] Team_025 possession (Score: 32-18)
Desmond Jordan attempts a Midrange. Wide open! Lamelo Quickley is 6.8 feet away. [ZONE] DESMOND JORDAN MAKES IT!
Score: 34-18

[10:32] Team_096 possession (Score: 34-18)
Cole Griffin drives to the basket... Cole Griffin throws a bad pass out of bounds! TURNOVER! (dead ball)

[10:32] Substitution (Team_025): Paolo Lowry OUT → LeBron Griffin IN (stamina_rule2)

[10:32] Substitution (Team_025): Ben Giddey OUT → Dirk Gilgeous-Alexander IN (stamina_rule2)

[10:32] Substitution (Team_025): Desmond Jordan OUT → Immanuel LaVine IN (stamina_rule2)

[10:32] Substitution (Team_025): Cade Anthony OUT → Damian Adebayo IN (stamina_rule2)

[10:32] Substitution (Team_025): Allen Embiid OUT → Nikola Lillard IN (stamina_rule2)

[10:32] Substitution (Team_096): Terry Mobley OUT → Cade Jokic IN (stamina_rule2)

[10:32] Substitution (Team_096): Lamelo Quickley OUT → Jarrett Markkanen IN (stamina_rule2)

[10:32] Substitution (Team_096): Cole Griffin OUT → Cole Holiday IN (stamina_rule2)

[10:32] Substitution (Team_096): Scottie Herro OUT → Tyler Haliburton IN (stamina_rule2)

[10:32] Substitution (Team_096): Kyrie Adebayo OUT → Devin Griffin IN (stamina_rule2)

[10:18] Team_025 possession (Score: 34-18)
Immanuel LaVine attempts a Midrange. Contested by Cole Holiday (3.9 feet, MAN). IMMANUEL LAVINE MAKES IT! Assist: LeBron Griffin
Score: 36-18

[10:05] Team_096 possession (Score: 36-18)
FOUL! Reach-in foul on Nikola Lillard during the drive. [Team fouls: 1] No free throws, side out. (Nikola Lillard: 1 personal fouls)

[09:49] Team_096 possession (Score: 36-18)
Tyler Haliburton drives, picks up Nikola Lillard. Help arrives from LeBron Griffin! Tyler Haliburton attempts a Layup. Contested by LeBron Griffin (2.6 feet, ZONE). Tyler Haliburton misses. Offensive rebound by Tyler Haliburton! Tyler Haliburton kicks it out.

[09:36] Team_096 possession (Score: 36-18)
Cade Jokic attempts a 3Pt. Contested by LeBron Griffin (4.5 feet, MAN). CADE JOKIC MAKES IT!
Score: 36-21

[09:23] Team_025 possession (Score: 36-21)
Damian Adebayo attempts a 3Pt. Wide open! Cade Jokic is 8.1 feet away. [ZONE] DAMIAN ADEBAYO MAKES IT! Assist: Dirk Gilgeous-Alexander
Score: 39-21

[09:05] Team_096 possession (Score: 39-21)
Devin Griffin drives and kicks out. Jarrett Markkanen attempts a Midrange. Contested by Dirk Gilgeous-Alexander (5.3 feet, ZONE). Jarrett Markkanen misses. Rebound secured by Immanuel LaVine.

[08:54] Team_025 possession (Score: 39-21)
LeBron Griffin attempts a 3Pt. Wide open! Cade Jokic is 6.5 feet away. [ZONE] LeBron Griffin misses. Offensive rebound by Nikola Lillard! Nikola Lillard kicks it out.

[08:42] Team_025 possession (Score: 39-21)
Immanuel LaVine attempts a 3Pt. Contested by Cade Jokic (5.1 feet, ZONE). Immanuel LaVine misses. Rebound secured by Devin Griffin.

[08:29] Team_096 possession (Score: 39-21)
Cade Jokic attempts a 3Pt. Contested by LeBron Griffin (4.8 feet, MAN). Cade Jokic misses. Offensive rebound by Tyler Haliburton! Tyler Haliburton kicks it out.

[08:14] Team_096 possession (Score: 39-21)
FOUL! Reach-in foul on Damian Adebayo during the drive. [Team fouls: 2] No free throws, side out. (Damian Adebayo: 1 personal fouls)

[08:02] Team_096 possession (Score: 39-21)
Jarrett Markkanen attempts a Layup. Heavily contested by Nikola Lillard (0.5 feet, ZONE)! JARRETT MARKKANEN MAKES IT! Assist: Tyler Haliburton
Score: 39-23

[07:47] Team_025 possession (Score: 39-23)
Immanuel LaVine attempts a 3Pt. Wide open! Cade Jokic is 6.4 feet away. [ZONE] IMMANUEL LAVINE MAKES IT!
Score: 42-23

[07:34] Team_096 possession (Score: 42-23)
Devin Griffin attempts a 3Pt. Wide open! Nikola Lillard is 6.5 feet away. [MAN] Devin Griffin misses. Rebound secured by Dirk Gilgeous-Alexander.

[07:18] Team_025 possession (Score: 42-23)
Dirk Gilgeous-Alexander drives and kicks out. Dirk Gilgeous-Alexander makes the 3Pt and draws the foul on Jarrett Markkanen! And-1! Dirk Gilgeous-Alexander to the line for 1. [Team fouls: 2] (Jarrett Markkanen: 1 personal fouls)   FT 1/1: MISS Dirk Gilgeous-Alexander makes 0/1 from the line. Rebound secured by Tyler Haliburton.
Score: 45-23

[07:05] Team_096 possession (Score: 45-23)
Cade Jokic attempts a 3Pt. Wide open! Dirk Gilgeous-Alexander is 7.5 feet away. [ZONE] Cade Jokic misses. Rebound secured by Nikola Lillard.

[06:52] Team_025 possession (Score: 45-23)
FOUL! Reach-in foul on Devin Griffin during the drive. [Team fouls: 3] No free throws, side out. (Devin Griffin: 1 personal fouls)

[06:38] Team_025 possession (Score: 45-23)
Dirk Gilgeous-Alexander drives to the basket... FOUL! Offensive foul on Dirk Gilgeous-Alexander! Devin Griffin drew the charge! [Team fouls: 3] (Dirk Gilgeous-Alexander: 1 personal fouls) TURNOVER! (dead ball)

[06:26] Team_096 possession (Score: 45-23)
Cade Jokic attempts a 3Pt. Wide open! LeBron Griffin is 7.1 feet away. [ZONE] Cade Jokic misses. Rebound secured by Immanuel LaVine.

[06:11] Team_025 possession (Score: 45-23)
FOUL! Holding foul on Cade Jokic. [Team fouls: 4] No free throws, side out. (Cade Jokic: 1 personal fouls)

[06:00] Team_025 possession (Score: 45-23)
Damian Adebayo drives and kicks out. LeBron Griffin attempts a 3Pt. Contested by Cade Jokic (5.9 feet, MAN). LEBRON GRIFFIN MAKES IT! Assist: Nikola Lillard
Score: 48-23

[05:47] Team_096 possession (Score: 48-23)
Cade Jokic attempts a Midrange. Wide open! LeBron Griffin is 6.6 feet away. [MAN] CADE JOKIC MAKES IT! Assist: Devin Griffin
Score: 48-25

[05:34] Team_025 possession (Score: 48-25)
LeBron Griffin drives and kicks out. Immanuel LaVine attempts a 3Pt. Contested by Cade Jokic (4.0 feet, ZONE). IMMANUEL LAVINE MAKES IT! Assist: Damian Adebayo
Score: 51-25

[05:19] Team_096 possession (Score: 51-25)
Devin Griffin attempts a Layup. Contested by Nikola Lillard (2.5 feet, ZONE). DEVIN GRIFFIN MAKES IT!
Score: 51-27

[05:04] Team_025 possession (Score: 51-27)
Dirk Gilgeous-Alexander drives to the basket... Dirk Gilgeous-Alexander throws a bad pass! Stolen by Jarrett Markkanen! TURNOVER! (live ball)

[04:51] Team_096 possession (Score: 51-27)
Cade Jokic attempts a 3Pt. Contested by LeBron Griffin (5.8 feet, MAN). Cade Jokic misses. Offensive rebound by Devin Griffin! Devin Griffin kicks it out.

[04:38] Team_096 possession (Score: 51-27)
Cade Jokic attempts a 3Pt. Contested by LeBron Griffin (5.8 feet, MAN). CADE JOKIC MAKES IT! Assist: Jarrett Markkanen
Score: 51-30

[04:24] Team_025 possession (Score: 51-30)
FOUL! Reach-in foul on Devin Griffin during the drive. [IN THE BONUS! 5 team fouls] Immanuel LaVine to the line for 2 free throws. (Devin Griffin: 2 personal fouls)   FT 1/2: GOOD   FT 2/2: GOOD Immanuel LaVine makes 2/2 from the line.
Score: 53-30

[04:10] Team_096 possession (Score: 53-30)
Devin Griffin attempts a Midrange. Contested by Dirk Gilgeous-Alexander (4.7 feet, ZONE). Devin Griffin misses. Rebound secured by Immanuel LaVine.

[03:57] Team_025 possession (Score: 53-30)
Damian Adebayo drives and kicks out. Damian Adebayo attempts a Midrange. Contested by Tyler Haliburton (5.6 feet, MAN). DAMIAN ADEBAYO MAKES IT!
Score: 55-30

[03:45] Team_096 possession (Score: 55-30)
Cole Holiday attempts a Layup. Contested by Immanuel LaVine (3.1 feet, MAN). Cole Holiday misses. Rebound secured by Nikola Lillard.

[03:30] Team_025 possession (Score: 55-30)
Immanuel LaVine attempts a 3Pt. Wide open! Cole Holiday is 7.1 feet away. [MAN] Immanuel LaVine misses. Rebound secured by Jarrett Markkanen.

[03:13] Team_096 possession (Score: 55-30)
Tyler Haliburton attempts a Midrange. Contested by Damian Adebayo (5.2 feet, MAN). Tyler Haliburton misses. Rebound secured by Immanuel LaVine.

[02:56] Team_025 possession (Score: 55-30)
Dirk Gilgeous-Alexander makes the Midrange and draws the foul on Jarrett Markkanen! And-1! Dirk Gilgeous-Alexander to the line for 1. [BONUS: 6 team fouls] (Jarrett Markkanen: 2 personal fouls)   FT 1/1: GOOD Dirk Gilgeous-Alexander makes 1/1 from the line.
Score: 58-30

[02:42] Team_096 possession (Score: 58-30)
Jarrett Markkanen attempts a Midrange. Wide open! Dirk Gilgeous-Alexander is 6.1 feet away. [MAN] JARRETT MARKKANEN MAKES IT!
Score: 58-32

[02:28] Team_025 possession (Score: 58-32)
Immanuel LaVine makes the Layup and draws the foul on Cole Holiday! And-1! Immanuel LaVine to the line for 1. [BONUS: 7 team fouls] (Cole Holiday: 1 personal fouls)   FT 1/1: MISS Immanuel LaVine makes 0/1 from the line. Rebound secured by Tyler Haliburton.
Score: 60-32

[02:16] Team_096 possession (Score: 60-32)
Tyler Haliburton attempts a 3Pt. Contested by Damian Adebayo (4.7 feet, ZONE). Tyler Haliburton misses. Rebound secured by Dirk Gilgeous-Alexander.

[01:59] Team_025 possession (Score: 60-32)
Damian Adebayo attempts a Midrange. Wide open! Tyler Haliburton is 6.8 feet away. [MAN] Damian Adebayo misses. Rebound secured by Jarrett Markkanen.

[01:44] Team_096 possession (Score: 60-32)
FOUL! Holding foul on Damian Adebayo. [Team fouls: 4] No free throws, side out. (Damian Adebayo: 2 personal fouls)

[01:33] Team_096 possession (Score: 60-32)
Jarrett Markkanen loses control! Ball rolls out of bounds! TURNOVER! (dead ball)

[01:22] Team_025 possession (Score: 60-32)
Damian Adebayo attempts a Layup. Contested by Tyler Haliburton (3.6 feet, MAN). DAMIAN ADEBAYO MAKES IT!
Score: 62-32

[01:05] Team_096 possession (Score: 62-32)
Devin Griffin attempts a Layup. BLOCKED BY NIKOLA LILLARD! Ball is loose! Rebound secured by Immanuel LaVine.

[00:48] Team_025 possession (Score: 62-32)
Nikola Lillard makes the Layup and draws the foul on Devin Griffin! And-1! Nikola Lillard to the line for 1. [BONUS: 8 team fouls] (Devin Griffin: 3 personal fouls)   FT 1/1: GOOD Nikola Lillard makes 1/1 from the line.
Score: 65-32

[00:38] Team_096 possession (Score: 65-32)
Tyler Haliburton attempts a Layup. Contested by Damian Adebayo (5.8 feet, MAN). Tyler Haliburton misses. Rebound secured by Dirk Gilgeous-Alexander.

[00:28] Team_025 possession (Score: 65-32)
LeBron Griffin attempts a Layup. BLOCKED BY CADE JOKIC! Ball is loose! Offensive rebound by Nikola Lillard! Nikola Lillard kicks it out.

[00:12] Team_025 possession (Score: 65-32)
LeBron Griffin attempts a Midrange. Contested by Cade Jokic (5.5 feet, MAN). LeBron Griffin misses. FOUL! Loose ball foul on Jarrett Markkanen during the rebound battle. [IN THE BONUS! 9 team fouls] Nikola Lillard to the line for 2 free throws. (Jarrett Markkanen: 3 personal fouls)   FT 1/2: MISS   FT 2/2: GOOD Nikola Lillard makes 1/2 from the line.
Score: 66-32

================================================================================
                              2ND QUARTER COMPLETE                              
================================================================================

2ND QUARTER SCORE: Team_025 34, Team_096 14

BOX SCORE:
================================================================================

Team_025
--------------------------------------------------------------------------------
Player                MIN  PTS  REB  AST  TO      FG   FG%      3P   3P%
--------------------------------------------------------------------------------
Immanuel LaVine        11   10    5    0   0   4/7    57.1     0/0   0.0
Damian Adebayo         11    7    0    1   0   3/4    75.0     0/0   0.0
Nikola Lillard         11    4    4    1   0   2/2   100.0     0/0   0.0
LeBron Griffin         11    3    0    1   0   1/1   100.0     0/0   0.0
Dirk Gilgeous-Alexander   11    3    3    1   0   1/2    50.0     0/0   0.0
Desmond Jordan         13    2    0    0   0   1/2    50.0     0/0   0.0
Cade Anthony           13    0    2    0   0   0/0     0.0     0/0   0.0
Paolo Lowry            13    0    0    0   0   0/1     0.0     0/0   0.0

TEAM: FG: 12/19 (63.2%), 3PT: 2/4 (50.0%), REB: 14 (2 off, 12 def), AST: 4, TO: 2
TEAM FOULS: 4


Team_096
--------------------------------------------------------------------------------
Player                MIN  PTS  REB  AST  TO      FG   FG%      3P   3P%
--------------------------------------------------------------------------------
Cade Jokic             11    8    0    0   0   3/5    60.0     0/0   0.0
Jarrett Markkanen      11    4    2    1   0   2/2   100.0     0/0   0.0
Devin Griffin          11    2    2    1   0   1/5    20.0     0/0   0.0
Kyrie Adebayo          13    0    1    0   0   0/0     0.0     0/0   0.0
Terry Mobley           13    0    0    0   0   0/1     0.0     0/0   0.0
Scottie Herro          13    0    1    0   0   0/0     0.0     0/0   0.0
Cole Griffin           13    0    0    0   0   0/1     0.0     0/0   0.0
Tyler Haliburton       11    0    4    1   0   0/3     0.0     0/0   0.0
Cole Holiday           11    0    0    0   0   0/1     0.0     0/0   0.0

TEAM: FG: 6/18 (33.3%), 3PT: 2/7 (28.6%), REB: 10 (3 off, 7 def), AST: 3, TO: 2
TEAM FOULS: 9 [Team_025 in BONUS]

================================================================================

================================================================================
                       3RD QUARTER - Team_025 vs Team_096                       
================================================================================

[12:00] Team_025 possession (Score: 66-32)
Desmond Jordan attempts a 3Pt. Contested by Cole Griffin (2.1 feet, MAN). DESMOND JORDAN MAKES IT! Assist: Cade Anthony
Score: 69-32

[11:42] Team_096 possession (Score: 69-32)
Cole Griffin attempts a 3Pt. Contested by Desmond Jordan (3.9 feet, MAN). Cole Griffin misses. Rebound secured by Cade Anthony.

[11:29] Team_025 possession (Score: 69-32)
FOUL! Holding foul on Kyrie Adebayo. [Team fouls: 1] No free throws, side out. (Kyrie Adebayo: 1 personal fouls)

[11:19] Team_025 possession (Score: 69-32)
Allen Embiid attempts a Midrange. Contested by Kyrie Adebayo (4.4 feet, MAN). ALLEN EMBIID MAKES IT!
Score: 71-32

[11:00] Team_096 possession (Score: 71-32)
Scottie Herro attempts a Layup. Heavily contested by Cade Anthony (0.5 feet, MAN)! SCOTTIE HERRO MAKES IT!
Score: 71-34

[10:43] Team_025 possession (Score: 71-34)
Ben Giddey drives and kicks out. Ben Giddey attempts a 3Pt. Heavily contested by Cole Griffin (0.5 feet, ZONE)! Ben Giddey misses. Rebound secured by Kyrie Adebayo.

[10:30] Team_096 possession (Score: 71-34)
Terry Mobley drives, picks up Allen Embiid. Help arrives from Ben Giddey! Terry Mobley attempts a Dunk. Heavily contested by Ben Giddey (0.5 feet, ZONE)! TERRY MOBLEY MAKES IT! Assist: Cole Griffin
Score: 71-36

[10:18] Team_025 possession (Score: 71-36)
Ben Giddey drives, picks up Lamelo Quickley. Help arrives from Cole Griffin! Ben Giddey attempts a Layup. Contested by Cole Griffin (3.6 feet, MAN). Ben Giddey misses. Rebound secured by Scottie Herro.

[10:05] Team_096 possession (Score: 71-36)
Terry Mobley attempts a 3Pt. Wide open! Paolo Lowry is 8.5 feet away. [MAN] Terry Mobley misses. Rebound secured by Allen Embiid.

[09:49] Team_025 possession (Score: 71-36)
Allen Embiid makes the Layup and draws the foul on Kyrie Adebayo! And-1! Allen Embiid to the line for 1. [Team fouls: 2] (Kyrie Adebayo: 2 personal fouls)   FT 1/1: GOOD Allen Embiid makes 1/1 from the line.
Score: 74-36

[09:37] Team_096 possession (Score: 74-36)
Cole Griffin attempts a Midrange. Wide open! Cade Anthony is 6.5 feet away. [ZONE] COLE GRIFFIN MAKES IT! Assist: Terry Mobley
Score: 74-38

[09:23] Team_025 possession (Score: 74-38)
Cade Anthony makes the Dunk and draws the foul on Scottie Herro! And-1! Cade Anthony to the line for 1. [Team fouls: 3] (Scottie Herro: 1 personal fouls)   FT 1/1: GOOD Cade Anthony makes 1/1 from the line.
Score: 77-38

[09:08] Team_096 possession (Score: 77-38)
Scottie Herro attempts a 3Pt. Wide open! Cade Anthony is 7.0 feet away. [MAN] SCOTTIE HERRO MAKES IT! Assist: Terry Mobley
Score: 77-41

[08:57] Team_025 possession (Score: 77-41)
Ben Giddey attempts a 3Pt. Contested by Cole Griffin (2.9 feet, ZONE). Ben Giddey misses. FOUL! Loose ball foul on Kyrie Adebayo during the rebound battle. [Team fouls: 4] No free throws, side out. (Kyrie Adebayo: 3 personal fouls)

[08:42] Team_025 possession (Score: 77-41)
Paolo Lowry attempts a 3Pt. Contested by Terry Mobley (2.9 feet, MAN). Paolo Lowry misses. Rebound secured by Scottie Herro.

[08:28] Team_096 possession (Score: 77-41)
Kyrie Adebayo drives and kicks out. Cole Griffin attempts a Midrange. Wide open! Desmond Jordan is 7.1 feet away. [ZONE] COLE GRIFFIN MAKES IT! Assist: Scottie Herro
Score: 77-43

[08:14] Team_025 possession (Score: 77-43)
Cade Anthony attempts a 3Pt. Contested by Cole Griffin (4.3 feet, ZONE). Cade Anthony misses. Rebound secured by Cole Griffin.

[07:56] Team_096 possession (Score: 77-43)
Scottie Herro attempts a Midrange. Wide open! Desmond Jordan is 6.5 feet away. [ZONE] Scottie Herro misses. Rebound secured by Cade Anthony.

[07:46] Team_025 possession (Score: 77-43)
Allen Embiid attempts a Layup. Contested by Kyrie Adebayo (3.1 feet, MAN). Allen Embiid misses. Offensive rebound by Desmond Jordan! Desmond Jordan's putback is no good. Offensive rebound by Allen Embiid! Allen Embiid kicks it out.

[07:30] Team_025 possession (Score: 77-43)
Cade Anthony attempts a 3Pt. Contested by Cole Griffin (2.9 feet, ZONE). CADE ANTHONY MAKES IT! Assist: Allen Embiid
Score: 80-43

[07:13] Team_096 possession (Score: 80-43)
Lamelo Quickley attempts a Layup. Heavily contested by Allen Embiid (0.5 feet, ZONE)! Lamelo Quickley misses. Rebound secured by Cade Anthony.

[07:01] Team_025 possession (Score: 80-43)
Desmond Jordan attempts a 3Pt. Contested by Cole Griffin (2.3 feet, MAN). DESMOND JORDAN MAKES IT! Assist: Allen Embiid
Score: 83-43

[06:42] Team_096 possession (Score: 83-43)
Cole Griffin drives and kicks out. Scottie Herro attempts a 3Pt. Contested by Cade Anthony (5.0 feet, MAN). SCOTTIE HERRO MAKES IT! Assist: Terry Mobley
Score: 83-46

[06:26] Team_025 possession (Score: 83-46)
Cade Anthony attempts a 3Pt. Contested by Cole Griffin (3.9 feet, ZONE). Cade Anthony misses. Offensive rebound by Allen Embiid! Allen Embiid's putback is no good. Rebound secured by Kyrie Adebayo.

[06:12] Team_096 possession (Score: 83-46)
Terry Mobley drives, Allen Embiid stays with him. Terry Mobley attempts a Layup. Contested by Allen Embiid (3.6 feet, ZONE). Terry Mobley misses. Rebound secured by Allen Embiid.

[05:56] Team_025 possession (Score: 83-46)
Desmond Jordan drives, Cole Griffin stays with him. Desmond Jordan attempts a Layup. Contested by Cole Griffin (3.6 feet, MAN). Desmond Jordan misses. Rebound secured by Kyrie Adebayo.

[05:37] Team_096 possession (Score: 83-46)
Scottie Herro attempts a Layup. Heavily contested by Allen Embiid (0.5 feet, ZONE)! SCOTTIE HERRO MAKES IT! Assist: Terry Mobley
Score: 83-48

[05:21] Team_025 possession (Score: 83-48)
Paolo Lowry attempts a 3Pt. Wide open! Cole Griffin is 8.4 feet away. [ZONE] Paolo Lowry misses. Offensive rebound by Desmond Jordan! Desmond Jordan puts it back in!
Score: 85-48

[05:05] Team_096 possession (Score: 85-48)
Kyrie Adebayo attempts a Layup. Contested by Allen Embiid (2.9 feet, MAN). Kyrie Adebayo misses. Rebound secured by Allen Embiid.

[04:55] Team_025 possession (Score: 85-48)
Desmond Jordan attempts a 3Pt. Heavily contested by Cole Griffin (0.5 feet, MAN)! DESMOND JORDAN MAKES IT! Assist: Ben Giddey
Score: 88-48

[04:43] Team_096 possession (Score: 88-48)
Lamelo Quickley attempts a 3Pt. Contested by Ben Giddey (3.1 feet, ZONE). LAMELO QUICKLEY MAKES IT! Assist: Kyrie Adebayo
Score: 88-51

[04:33] Team_025 possession (Score: 88-51)
Paolo Lowry attempts a 3Pt. Wide open! Cole Griffin is 6.0 feet away. [ZONE] Paolo Lowry misses. Rebound secured by Scottie Herro.

[04:19] Team_096 possession (Score: 88-51)
FOUL! Reach-in foul on Allen Embiid during the drive. [Team fouls: 1] No free throws, side out. (Allen Embiid: 1 personal fouls)

[04:05] Team_096 possession (Score: 88-51)
Lamelo Quickley drives, picks up Allen Embiid. Help arrives from Ben Giddey! Lamelo Quickley attempts a Layup. Contested by Ben Giddey (4.2 feet, ZONE). LAMELO QUICKLEY MAKES IT!
Score: 88-53

[03:50] Team_025 possession (Score: 88-53)
Allen Embiid makes the Layup and draws the foul on Kyrie Adebayo! And-1! Allen Embiid to the line for 1. [BONUS: 5 team fouls] (Kyrie Adebayo: 4 personal fouls)   FT 1/1: GOOD Allen Embiid makes 1/1 from the line.
Score: 91-53

[03:41] Team_096 possession (Score: 91-53)
Scottie Herro attempts a 3Pt. Wide open! Cade Anthony is 6.3 feet away. [MAN] Scottie Herro misses. Rebound secured by Allen Embiid.

[03:23] Team_025 possession (Score: 91-53)
Cade Anthony attempts a Layup. BLOCKED BY KYRIE ADEBAYO! Ball is loose! Rebound secured by Scottie Herro.

[03:08] Team_096 possession (Score: 91-53)
Scottie Herro attempts a Layup. Heavily contested by Allen Embiid (0.5 feet, ZONE)! SCOTTIE HERRO MAKES IT! Assist: Terry Mobley
Score: 91-55

[02:52] Team_025 possession (Score: 91-55)
Allen Embiid drives, Kyrie Adebayo stays with him. Allen Embiid attempts a Layup. Contested by Kyrie Adebayo (2.9 feet, MAN). ALLEN EMBIID MAKES IT! Assist: Paolo Lowry
Score: 93-55

[02:34] Team_096 possession (Score: 93-55)
Lamelo Quickley drives, Ben Giddey stays with him. Lamelo Quickley attempts a Layup. Contested by Ben Giddey (2.7 feet, MAN). LAMELO QUICKLEY MAKES IT! Assist: Cole Griffin
Score: 93-57

[02:19] Team_025 possession (Score: 93-57)
Allen Embiid drives and kicks out. Desmond Jordan attempts a Midrange. Contested by Cole Griffin (2.9 feet, MAN). DESMOND JORDAN MAKES IT!
Score: 95-57

[02:01] Team_096 possession (Score: 95-57)
Scottie Herro drives to the basket... Scottie Herro throws a bad pass! Stolen by Allen Embiid! TURNOVER! (live ball)

[01:50] Team_025 possession (Score: 95-57)
Allen Embiid drives, picks up Kyrie Adebayo. Help arrives from Lamelo Quickley! Allen Embiid attempts a Dunk. Contested by Lamelo Quickley (4.9 feet, MAN). Allen Embiid misses. Rebound secured by Kyrie Adebayo.

[01:33] Team_096 possession (Score: 95-57)
Kyrie Adebayo attempts a 3Pt. Wide open! Allen Embiid is 7.7 feet away. [MAN] Kyrie Adebayo misses. Rebound secured by Desmond Jordan.

[01:14] Team_025 possession (Score: 95-57)
Ben Giddey attempts a 3Pt. Contested by Lamelo Quickley (4.7 feet, MAN). Ben Giddey misses. Rebound secured by Scottie Herro.

[01:01] Team_096 possession (Score: 95-57)
FOUL! Holding foul on Cade Anthony. [Team fouls: 2] No free throws, side out. (Cade Anthony: 1 personal fouls)

[00:47] Team_096 possession (Score: 95-57)
Kyrie Adebayo attempts a Midrange. Contested by Allen Embiid (3.7 feet, MAN). KYRIE ADEBAYO MAKES IT! Assist: Lamelo Quickley
Score: 95-59

[00:30] Team_025 possession (Score: 95-59)
Paolo Lowry attempts a Midrange. Wide open! Terry Mobley is 9.0 feet away. [MAN] PAOLO LOWRY MAKES IT! Assist: Ben Giddey
Score: 97-59

[00:18] Team_096 possession (Score: 97-59)
Cole Griffin drives and kicks out. Lamelo Quickley attempts a Midrange. Contested by Cade Anthony (6.0 feet, ZONE). LAMELO QUICKLEY MAKES IT! Assist: Terry Mobley
Score: 97-61

[00:03] Team_025 possession (Score: 97-61)
Cade Anthony attempts a 3Pt. Contested by Cole Griffin (5.2 feet, ZONE). Cade Anthony misses. FOUL! Loose ball foul on Kyrie Adebayo during the rebound battle. [IN THE BONUS! 6 team fouls] Desmond Jordan to the line for 2 free throws. (Kyrie Adebayo: 5 personal fouls)   FT 1/2: GOOD   FT 2/2: GOOD Desmond Jordan makes 2/2 from the line.
Score: 99-61

================================================================================
                              3RD QUARTER COMPLETE                              
================================================================================

3RD QUARTER SCORE: Team_025 33, Team_096 29

BOX SCORE:
================================================================================

Team_025
--------------------------------------------------------------------------------
Player                MIN  PTS  REB  AST  TO      FG   FG%      3P   3P%
--------------------------------------------------------------------------------
Desmond Jordan         25   15    3    0   0   6/7    85.7     0/0   0.0
Allen Embiid           25   10    5    2   0   4/5    80.0     0/0   0.0
Cade Anthony           25    6    3    1   0   2/5    40.0     0/0   0.0
Paolo Lowry            25    2    0    1   0   1/3    33.3     0/0   0.0
Ben Giddey             25    0    0    2   0   0/3     0.0     0/0   0.0

TEAM: FG: 13/23 (56.5%), 3PT: 6/11 (54.5%), REB: 12 (4 off, 8 def), AST: 6, TO: 0
TEAM FOULS: 2


Team_096
--------------------------------------------------------------------------------
Player                MIN  PTS  REB  AST  TO      FG   FG%      3P   3P%
--------------------------------------------------------------------------------
Scottie Herro          25   12    5    1   0   5/7    71.4     0/0   0.0
Lamelo Quickley        25    9    0    1   0   4/5    80.0     0/0   0.0
Cole Griffin           25    4    1    2   0   2/3    66.7     0/0   0.0
Kyrie Adebayo          25    2    4    1   0   1/3    33.3     0/0   0.0
Terry Mobley           25    2    0    6   0   1/3    33.3     0/0   0.0

TEAM: FG: 13/21 (61.9%), 3PT: 2/6 (33.3%), REB: 9 (0 off, 9 def), AST: 11, TO: 1
TEAM FOULS: 6 [Team_025 in BONUS]

================================================================================

================================================================================
                       4TH QUARTER - Team_025 vs Team_096                       
================================================================================

[12:00] Team_025 possession (Score: 99-61)
Ben Giddey attempts a 3Pt. Contested by Lamelo Quickley (4.9 feet, MAN). Ben Giddey misses. Rebound secured by Cole Griffin.

[11:45] Team_096 possession (Score: 99-61)
Lamelo Quickley attempts a Midrange. Contested by Ben Giddey (3.6 feet, ZONE). Lamelo Quickley misses. Offensive rebound by Scottie Herro! Scottie Herro kicks it out.

[11:35] Team_096 possession (Score: 99-61)
Kyrie Adebayo attempts a Midrange. Contested by Allen Embiid (5.4 feet, MAN). KYRIE ADEBAYO MAKES IT! Assist: Terry Mobley
Score: 99-63

[11:20] Team_025 possession (Score: 99-63)
Cade Anthony attempts a 3Pt. Wide open! Lamelo Quickley is 7.5 feet away. [ZONE] Cade Anthony misses. Offensive rebound by Desmond Jordan! Desmond Jordan's putback is no good. Rebound secured by Scottie Herro.

[11:07] Team_096 possession (Score: 99-63)
Lamelo Quickley attempts a 3Pt. Wide open! Ben Giddey is 6.3 feet away. [MAN] Lamelo Quickley misses. Rebound secured by Allen Embiid.

[10:53] Team_025 possession (Score: 99-63)
Desmond Jordan attempts a Midrange. Contested by Scottie Herro (4.7 feet, ZONE). Desmond Jordan misses. Rebound secured by Kyrie Adebayo.

[10:43] Team_096 possession (Score: 99-63)
Scottie Herro attempts a Layup. Heavily contested by Cade Anthony (1.3 feet, MAN)! SCOTTIE HERRO MAKES IT! Assist: Lamelo Quickley
Score: 99-65

[10:25] Team_025 possession (Score: 99-65)
Cade Anthony attempts a 3Pt. Contested by Cole Griffin (4.4 feet, ZONE). CADE ANTHONY MAKES IT! Assist: Ben Giddey
Score: 102-65

[10:08] Team_096 possession (Score: 102-65)
Lamelo Quickley attempts a Layup. BLOCKED BY BEN GIDDEY! Ball is loose! Rebound secured by Allen Embiid.

[09:52] Team_025 possession (Score: 102-65)
FOUL! Shooting foul on Cole Griffin. Ben Giddey to the line for 3 free throws. [Team fouls: 1] (Cole Griffin: 1 personal fouls)   FT 1/3: GOOD   FT 2/3: GOOD   FT 3/3: GOOD Ben Giddey makes 3/3 from the line.
Score: 105-65

[09:37] Team_096 possession (Score: 105-65)
FOUL! Shooting foul on Ben Giddey. Cole Griffin to the line for 2 free throws. [Team fouls: 1] (Ben Giddey: 1 personal fouls)   FT 1/2: GOOD   FT 2/2: GOOD Cole Griffin makes 2/2 from the line.
Score: 105-67

[09:25] Team_025 possession (Score: 105-67)
Allen Embiid attempts a Midrange. Wide open! Kyrie Adebayo is 6.2 feet away. [MAN] Allen Embiid misses. Rebound secured by Kyrie Adebayo.

[09:11] Team_096 possession (Score: 105-67)
Lamelo Quickley drives to the basket... Lamelo Quickley throws a bad pass! Stolen by Ben Giddey! TURNOVER! (live ball)

[08:55] Team_025 possession (Score: 105-67)
Paolo Lowry attempts a Layup. BLOCKED BY LAMELO QUICKLEY! Ball is loose! Rebound secured by Kyrie Adebayo.

[08:38] Team_096 possession (Score: 105-67)
Terry Mobley attempts a 3Pt. Wide open! Paolo Lowry is 6.4 feet away. [MAN] Terry Mobley misses. Offensive rebound by Kyrie Adebayo! Kyrie Adebayo puts it back in!
Score: 105-69

[08:20] Team_025 possession (Score: 105-69)
Paolo Lowry attempts a 3Pt. Contested by Terry Mobley (5.5 feet, MAN). Paolo Lowry misses. Rebound secured by Scottie Herro.

[08:06] Team_096 possession (Score: 105-69)
Lamelo Quickley attempts a 3Pt. Contested by Cade Anthony (2.8 feet, ZONE). Lamelo Quickley misses. Rebound secured by Desmond Jordan.

[07:52] Team_025 possession (Score: 105-69)
Ben Giddey attempts a 3Pt. Wide open! Cole Griffin is 6.3 feet away. [ZONE] Ben Giddey misses. FOUL! Loose ball foul on Kyrie Adebayo during the rebound battle. [Team fouls: 2] No free throws, side out. (Kyrie Adebayo: 1 personal fouls)

[07:38] Team_025 possession (Score: 105-69)
FOUL! Reach-in foul on Lamelo Quickley during the drive. [Team fouls: 3] No free throws, side out. (Lamelo Quickley: 1 personal fouls)

[07:26] Team_025 possession (Score: 105-69)
Desmond Jordan attempts a 3Pt. Contested by Cole Griffin (2.8 feet, ZONE). DESMOND JORDAN MAKES IT! Assist: Allen Embiid
Score: 108-69

[07:11] Team_096 possession (Score: 108-69)
Kyrie Adebayo throws a bad pass! Stolen by Allen Embiid! TURNOVER! (live ball)

[06:57] Team_025 possession (Score: 108-69)
Cade Anthony attempts a 3Pt. Contested by Cole Griffin (5.2 feet, ZONE). CADE ANTHONY MAKES IT! Assist: Paolo Lowry
Score: 111-69

[06:45] Team_096 possession (Score: 111-69)
FOUL! Offensive foul on Scottie Herro! Cade Anthony drew the charge! [Team fouls: 4] (Scottie Herro: 1 personal fouls) TURNOVER! (dead ball)

[06:31] Team_025 possession (Score: 111-69)
Allen Embiid makes the Dunk and draws the foul on Lamelo Quickley! And-1! Allen Embiid to the line for 1. [BONUS: 5 team fouls] (Lamelo Quickley: 2 personal fouls)   FT 1/1: GOOD Allen Embiid makes 1/1 from the line.
Score: 114-69

[06:18] Team_096 possession (Score: 114-69)
Scottie Herro attempts a Layup. Contested by Allen Embiid (4.3 feet, ZONE). SCOTTIE HERRO MAKES IT! Assist: Cole Griffin
Score: 114-71

[06:02] Team_025 possession (Score: 114-71)
Desmond Jordan drives to the basket... Desmond Jordan throws a bad pass out of bounds! TURNOVER! (dead ball)

[06:02] Substitution (Team_025): Paolo Lowry OUT → LeBron Griffin IN (stamina_rule2)

[06:02] Substitution (Team_025): Ben Giddey OUT → Dirk Gilgeous-Alexander IN (stamina_rule2)

[06:02] Substitution (Team_025): Desmond Jordan OUT → Immanuel LaVine IN (stamina_rule2)

[06:02] Substitution (Team_025): Cade Anthony OUT → Damian Adebayo IN (stamina_rule2)

[06:02] Substitution (Team_025): Allen Embiid OUT → Nikola Lillard IN (stamina_rule2)

[06:02] Substitution (Team_096): Terry Mobley OUT → Cade Jokic IN (stamina_rule2)

[06:02] Substitution (Team_096): Lamelo Quickley OUT → Jarrett Markkanen IN (stamina_rule2)

[06:02] Substitution (Team_096): Cole Griffin OUT → Cole Holiday IN (stamina_rule2)

[06:02] Substitution (Team_096): Scottie Herro OUT → Tyler Haliburton IN (stamina_rule2)

[06:02] Substitution (Team_096): Kyrie Adebayo OUT → Devin Griffin IN (stamina_rule2)

[05:45] Team_096 possession (Score: 114-71)
Cade Jokic attempts a Midrange. Wide open! Damian Adebayo is 9.1 feet away. [ZONE] CADE JOKIC MAKES IT!
Score: 114-73

[05:30] Team_025 possession (Score: 114-73)
Damian Adebayo drives to the basket... Damian Adebayo throws a bad pass out of bounds! TURNOVER! (dead ball)

[05:15] Team_096 possession (Score: 114-73)
FOUL! Offensive foul on Devin Griffin! Nikola Lillard drew the charge! [Team fouls: 6] (Devin Griffin: 1 personal fouls) TURNOVER! (dead ball)

[05:04] Team_025 possession (Score: 114-73)
LeBron Griffin drives and kicks out. Immanuel LaVine attempts a 3Pt. Wide open! Cade Jokic is 8.3 feet away. [ZONE] Immanuel LaVine misses. Rebound secured by Jarrett Markkanen.

[04:51] Team_096 possession (Score: 114-73)
Cole Holiday attempts a Layup. Contested by Nikola Lillard (5.1 feet, ZONE). COLE HOLIDAY MAKES IT! Assist: Devin Griffin
Score: 114-75

[04:35] Team_025 possession (Score: 114-75)
FOUL! Holding foul on Jarrett Markkanen. [IN THE BONUS! 7 team fouls] Dirk Gilgeous-Alexander to the line for 2 free throws. (Jarrett Markkanen: 1 personal fouls)   FT 1/2: MISS   FT 2/2: MISS Dirk Gilgeous-Alexander makes 0/2 from the line. FOUL! Loose ball foul on Tyler Haliburton during the free throw rebound! [IN THE BONUS! 8 team fouls] Nikola Lillard to the line for 2 free throws. (Tyler Haliburton: 1 personal fouls)   FT 1/2: GOOD   FT 2/2: GOOD Nikola Lillard makes 2/2 from the line.
Score: 116-75

[04:21] Team_096 possession (Score: 116-75)
Jarrett Markkanen drives and kicks out. Devin Griffin attempts a 3Pt. Wide open! Damian Adebayo is 6.3 feet away. [ZONE] Devin Griffin misses. Rebound secured by Immanuel LaVine.

[04:06] Team_025 possession (Score: 116-75)
FOUL! Holding foul on Tyler Haliburton. [IN THE BONUS! 9 team fouls] Damian Adebayo to the line for 2 free throws. (Tyler Haliburton: 2 personal fouls)   FT 1/2: GOOD   FT 2/2: GOOD Damian Adebayo makes 2/2 from the line.
Score: 118-75

[03:49] Team_096 possession (Score: 118-75)
Devin Griffin attempts a 3Pt. Wide open! Nikola Lillard is 8.6 feet away. [MAN] DEVIN GRIFFIN MAKES IT! Assist: Tyler Haliburton
Score: 118-78

[03:38] Team_025 possession (Score: 118-78)
Damian Adebayo attempts a 3Pt. Contested by Tyler Haliburton (5.7 feet, MAN). Damian Adebayo misses. Rebound secured by Devin Griffin.

[03:26] Team_096 possession (Score: 118-78)
FOUL! Reach-in foul on Damian Adebayo during the drive. [Team fouls: 2] No free throws, side out. (Damian Adebayo: 1 personal fouls)

[03:14] Team_096 possession (Score: 118-78)
Cole Holiday drives, picks up Immanuel LaVine. Help arrives from LeBron Griffin! Cole Holiday attempts a Layup. Contested by LeBron Griffin (4.9 feet, MAN). Cole Holiday misses. Rebound secured by Dirk Gilgeous-Alexander.

[02:56] Team_025 possession (Score: 118-78)
Immanuel LaVine attempts a 3Pt. Wide open! Cade Jokic is 8.1 feet away. [ZONE] Immanuel LaVine misses. Rebound secured by Jarrett Markkanen.

[02:45] Team_096 possession (Score: 118-78)
Jarrett Markkanen attempts a 3Pt. Wide open! Dirk Gilgeous-Alexander is 9.1 feet away. [MAN] Jarrett Markkanen misses. Rebound secured by Immanuel LaVine.

[02:33] Team_025 possession (Score: 118-78)
Dirk Gilgeous-Alexander drives to the basket... FOUL! Offensive foul on Dirk Gilgeous-Alexander! Devin Griffin drew the charge! [Team fouls: 3] (Dirk Gilgeous-Alexander: 1 personal fouls) TURNOVER! (dead ball)

[02:18] Team_096 possession (Score: 118-78)
Cole Holiday attempts a 3Pt. Contested by Immanuel LaVine (4.2 feet, MAN). Cole Holiday misses. Rebound secured by Nikola Lillard.

[02:00] Team_025 possession (Score: 118-78)
Damian Adebayo throws a bad pass! Stolen by Tyler Haliburton! TURNOVER! (live ball)

[01:45] Team_096 possession (Score: 118-78)
Cade Jokic attempts a 3Pt. Wide open! LeBron Griffin is 7.4 feet away. [ZONE] CADE JOKIC MAKES IT! Assist: Jarrett Markkanen
Score: 118-81

[01:33] Team_025 possession (Score: 118-81)
Immanuel LaVine attempts a 3Pt. Contested by Cole Holiday (2.4 feet, MAN). Immanuel LaVine misses. Rebound secured by Devin Griffin.

[01:20] Team_096 possession (Score: 118-81)
Devin Griffin attempts a Layup. Wide open! Nikola Lillard is 7.0 feet away. [MAN] Devin Griffin misses. Offensive rebound by Tyler Haliburton! Tyler Haliburton kicks it out.

[01:07] Team_096 possession (Score: 118-81)
Tyler Haliburton attempts a Midrange. Contested by Damian Adebayo (2.9 feet, MAN). TYLER HALIBURTON MAKES IT! Assist: Jarrett Markkanen
Score: 118-83

[00:49] Team_025 possession (Score: 118-83)
Dirk Gilgeous-Alexander attempts a 3Pt. Contested by Cade Jokic (2.4 feet, ZONE). DIRK GILGEOUS-ALEXANDER MAKES IT! Assist: LeBron Griffin
Score: 121-83

[00:37] Team_096 possession (Score: 121-83)
Devin Griffin attempts a 3Pt. Contested by LeBron Griffin (3.7 feet, ZONE). DEVIN GRIFFIN MAKES IT! Assist: Cole Holiday
Score: 121-86

[00:25] Team_025 possession (Score: 121-86)
FOUL! Holding foul on Devin Griffin. [IN THE BONUS! 10 team fouls] Nikola Lillard to the line for 2 free throws. (Devin Griffin: 2 personal fouls)   FT 1/2: GOOD   FT 2/2: GOOD Nikola Lillard makes 2/2 from the line.
Score: 123-86

[00:08] Team_096 possession (Score: 123-86)
Cole Holiday drives and kicks out. Jarrett Markkanen attempts a Midrange. Wide open! Dirk Gilgeous-Alexander is 8.2 feet away. [MAN] JARRETT MARKKANEN MAKES IT!
Score: 123-88

================================================================================
                              4TH QUARTER COMPLETE                              
================================================================================

4TH QUARTER SCORE: Team_025 24, Team_096 27

BOX SCORE:
================================================================================

Team_025
--------------------------------------------------------------------------------
Player                MIN  PTS  REB  AST  TO      FG   FG%      3P   3P%
--------------------------------------------------------------------------------
Cade Anthony           32    6    0    0   0   2/3    66.7     0/0   0.0
Nikola Lillard         17    4    1    0   0   2/2   100.0     0/0   0.0
Ben Giddey             32    3    0    1   0   1/2    50.0     0/0   0.0
Allen Embiid           32    3    2    1   0   1/2    50.0     0/0   0.0
Desmond Jordan         32    3    2    0   0   1/2    50.0     0/0   0.0
Dirk Gilgeous-Alexander   17    3    1    0   0   1/1   100.0     0/0   0.0
Damian Adebayo         17    2    0    0   0   1/2    50.0     0/0   0.0
Paolo Lowry            32    0    0    1   0   0/2     0.0     0/0   0.0
LeBron Griffin         17    0    0    1   0   0/1     0.0     0/0   0.0
Immanuel LaVine        17    0    2    0   0   0/2     0.0     0/0   0.0

TEAM: FG: 9/19 (47.4%), 3PT: 5/11 (45.5%), REB: 9 (2 off, 7 def), AST: 4, TO: 4
TEAM FOULS: 3


Team_096
--------------------------------------------------------------------------------
Player                MIN  PTS  REB  AST  TO      FG   FG%      3P   3P%
--------------------------------------------------------------------------------
Devin Griffin          17    6    2    1   0   2/2   100.0     0/0   0.0
Cade Jokic             17    5    0    0   0   2/2   100.0     0/0   0.0
Scottie Herro          32    4    3    0   0   2/2   100.0     0/0   0.0
Kyrie Adebayo          32    4    4    0   0   2/2   100.0     0/0   0.0
Cole Griffin           32    2    1    1   0   1/1   100.0     0/0   0.0
Jarrett Markkanen      17    2    2    2   0   1/3    33.3     0/0   0.0
Cole Holiday           17    2    0    1   0   1/3    33.3     0/0   0.0
Tyler Haliburton       17    2    1    1   0   1/1   100.0     0/0   0.0
Terry Mobley           32    0    0    1   0   0/0     0.0     0/0   0.0
Lamelo Quickley        32    0    0    1   0   0/3     0.0     0/0   0.0

TEAM: FG: 12/19 (63.2%), 3PT: 4/8 (50.0%), REB: 12 (3 off, 9 def), AST: 8, TO: 4
TEAM FOULS: 10 [Team_025 in BONUS]

================================================================================

================================================================================
                               FULL GAME COMPLETE                               
================================================================================

FINAL SCORE: Team_025 123, Team_096 88

SCORING BY QUARTER:
--------------------------------------------------------------------------------
Team                     Q1     Q2     Q3     Q4    FINAL
--------------------------------------------------------------------------------
Team_025                 32     34     33     24      123
Team_096                 18     14     29     27       88
--------------------------------------------------------------------------------

FULL GAME BOX SCORE:
================================================================================

Team_025
--------------------------------------------------------------------------------
Player                MIN  PTS  REB  AST  TO      FG   FG%      3P   3P%      FT STL BLK
--------------------------------------------------------------------------------
Paolo Lowry            32    8    0    4   0   5/13   38.5   3/6    50.0   1/2     0   0
Ben Giddey             32    7    0    4   1   3/9    33.3   1/4    25.0   3/3     1   1
Desmond Jordan         32   27   13    1   0   7/13   53.8   6/6   100.0   2/2     1   1
Cade Anthony           32   14    9    5   0   6/10   60.0   4/7    57.1   1/1     0   0
Allen Embiid           32   24    9    3   1  11/13   84.6   0/0     0.0   4/4     3   0
LeBron Griffin         17    3    0    2   0   2/3    66.7   0/0     0.0   0/0     0   0
Dirk Gilgeous-Alexander   17    6    4    1   0   2/3    66.7   1/1   100.0   1/4     0   0
Immanuel LaVine        17   10    7    0   2   3/10   30.0   1/7    14.3   2/3     0   0
Damian Adebayo         17    9    0    1   1   4/6    66.7   1/2    50.0   2/2     0   0
Nikola Lillard         17    8    5    1   2   1/1   100.0   0/0     0.0   4/5     0   1

TEAM: FG: 47/84 (56.0%), 3PT: 17/33 (51.5%), REB: 49 (11 off, 38 def), AST: 22, TO: 7


Team_096
--------------------------------------------------------------------------------
Player                MIN  PTS  REB  AST  TO      FG   FG%      3P   3P%      FT STL BLK
--------------------------------------------------------------------------------
Terry Mobley           32    2    0    8   1   2/5    40.0   1/3    33.3   0/0     0   0
Lamelo Quickley        32   13    0    3   1   5/10   50.0   1/4    25.0   2/3     0   2
Cole Griffin           32   14    4    3   3   7/12   58.3   1/4    25.0   3/3     0   0
Scottie Herro          32   19   10    3   2   7/10   70.0   2/4    50.0   0/0     1   0
Kyrie Adebayo          32    6   15    1   2   3/12   25.0   0/2     0.0   0/0     0   1
Cade Jokic             17   13    0    0   0   5/7    71.4   3/5    60.0   0/0     0   1
Jarrett Markkanen      17    6    5    3   1   2/4    50.0   0/1     0.0   0/0     1   0
Cole Holiday           17    2    0    1   0   2/5    40.0   0/1     0.0   0/0     0   0
Tyler Haliburton       17    3    6    2   0   2/5    40.0   0/1     0.0   1/2     1   0
Devin Griffin          17    8    4    2   1   3/7    42.9   2/3    66.7   0/0     0   0

TEAM: FG: 38/77 (49.4%), 3PT: 10/28 (35.7%), REB: 42 (8 off, 34 def), AST: 26, TO: 11

================================================================================
