GAME 4: Team_018 vs Team_096
====================================================================================================

================================================================================
                        FULL GAME - Team_018 vs Team_096                        
================================================================================

================================================================================
                       1ST QUARTER - Team_018 vs Team_096                       
================================================================================

[12:00] Team_018 possession (Score: 0-0)
Tracy Bryant throws a bad pass! Stolen by Lamelo Quickley! TURNOVER! (live ball)

[11:44] Team_096 possession (Score: 0-0)
Lamelo Quickley attempts a Layup. Contested by Tracy Bryant (3.3 feet, MAN). Lamelo Quickley misses. Rebound secured by Domantas Wall.

[11:30] Team_018 possession (Score: 0-0)
Domantas Wall drives, Kyrie Adebayo stays with him. Domantas Wall attempts a Layup. Heavily contested by Kyrie Adebayo (0.5 feet, ZONE)! DOMANTAS WALL MAKES IT! Assist: Klay Stewart
Score: 2-0

[11:13] Team_096 possession (Score: 2-0)
Scottie Herro attempts a 3Pt. Wide open! Klay Stewart is 8.3 feet away. [ZONE] Scottie Herro misses. Rebound secured by Allen Markkanen.

[11:02] Team_018 possession (Score: 2-0)
Tracy Bryant attempts a 3Pt. Contested by Cole Griffin (5.6 feet, ZONE). Tracy Bryant misses. Rebound secured by Kyrie Adebayo.

[10:50] Team_096 possession (Score: 2-0)
Scottie Herro loses the ball! Stripped by Bones Anunoby! TURNOVER! (live ball)

[10:37] Team_018 possession (Score: 2-0)
Tracy Bryant attempts a Layup. BLOCKED BY SCOTTIE HERRO! Ball is loose! Offensive rebound by Domantas Wall! Domantas Wall kicks it out.

[10:23] Team_018 possession (Score: 2-0)
Tracy Bryant drives, picks up Lamelo Quickley. Help arrives from Cole Griffin! Tracy Bryant attempts a Layup. Contested by Cole Griffin (3.5 feet, MAN). Tracy Bryant misses. Rebound secured by Kyrie Adebayo.

[10:11] Team_096 possession (Score: 2-0)
Cole Griffin drives and kicks out. Cole Griffin attempts a 3Pt. Wide open! Allen Markkanen is 6.4 feet away. [MAN] Cole Griffin misses. Rebound secured by Allen Markkanen.

[09:56] Team_018 possession (Score: 2-0)
Domantas Wall attempts a Layup. Wide open! Kyrie Adebayo is 7.5 feet away. [MAN] DOMANTAS WALL MAKES IT!
Score: 4-0

[09:41] Team_096 possession (Score: 4-0)
Kyrie Adebayo attempts a Midrange. Wide open! Tracy Bryant is 6.6 feet away. [ZONE] KYRIE ADEBAYO MAKES IT!
Score: 4-2

[09:26] Team_018 possession (Score: 4-2)
Bones Anunoby attempts a Midrange. Wide open! Lamelo Quickley is 7.1 feet away. [ZONE] BONES ANUNOBY MAKES IT! Assist: Klay Stewart
Score: 6-2

[09:09] Team_096 possession (Score: 6-2)
Cole Griffin attempts a 3Pt. Contested by Bones Anunoby (5.2 feet, ZONE). Cole Griffin misses. Offensive rebound by Kyrie Adebayo! Kyrie Adebayo puts it back in!
Score: 6-4

[08:54] Team_018 possession (Score: 6-4)
Allen Markkanen attempts a 3Pt. Contested by Cole Griffin (5.5 feet, MAN). ALLEN MARKKANEN MAKES IT! Assist: Klay Stewart
Score: 9-4

[08:39] Team_096 possession (Score: 9-4)
Cole Griffin attempts a 3Pt. Wide open! Klay Stewart is 7.2 feet away. [ZONE] COLE GRIFFIN MAKES IT! Assist: Terry Mobley
Score: 9-7

[08:21] Team_018 possession (Score: 9-7)
Allen Markkanen attempts a 3Pt. Contested by Cole Griffin (2.5 feet, MAN). Allen Markkanen misses. Rebound secured by Kyrie Adebayo.

[08:03] Team_096 possession (Score: 9-7)
Lamelo Quickley attempts a Layup. BLOCKED BY ALLEN MARKKANEN! Ball is loose! Rebound secured by Allen Markkanen.

[07:51] Team_018 possession (Score: 9-7)
Domantas Wall attempts a 3Pt. Contested by Cole Griffin (2.4 feet, ZONE). Domantas Wall misses. Rebound secured by Kyrie Adebayo.

[07:38] Team_096 possession (Score: 9-7)
Lamelo Quickley drives, picks up Tracy Bryant. Help arrives from Allen Markkanen! Lamelo Quickley attempts a Dunk. Heavily contested by Allen Markkanen (0.5 feet, MAN)! Lamelo Quickley misses. Rebound secured by Bones Anunoby.

[07:19] Team_018 possession (Score: 9-7)
Allen Markkanen attempts a Midrange. Contested by Scottie Herro (5.8 feet, ZONE). ALLEN MARKKANEN MAKES IT!
Score: 11-7

[07:00] Team_096 possession (Score: 11-7)
Lamelo Quickley throws a bad pass! Stolen by Tracy Bryant! TURNOVER! (live ball)

[06:41] Team_018 possession (Score: 11-7)
Domantas Wall attempts a Layup. Heavily contested by Kyrie Adebayo (1.9 feet, MAN)! DOMANTAS WALL MAKES IT! Assist: Allen Markkanen
Score: 13-7

[06:24] Team_096 possession (Score: 13-7)
Lamelo Quickley attempts a Midrange. Contested by Allen Markkanen (3.9 feet, ZONE). LAMELO QUICKLEY MAKES IT! Assist: Terry Mobley
Score: 13-9

[06:09] Team_018 possession (Score: 13-9)
FOUL! Holding foul on Terry Mobley. [Team fouls: 2] No free throws, side out. (Terry Mobley: 1 personal fouls)

[05:51] Team_018 possession (Score: 13-9)
Bones Anunoby drives, picks up Scottie Herro. Help arrives from Lamelo Quickley! Bones Anunoby attempts a Layup. Contested by Lamelo Quickley (4.7 feet, MAN). BONES ANUNOBY MAKES IT! Assist: Domantas Wall
Score: 15-9

[05:35] Team_096 possession (Score: 15-9)
Scottie Herro attempts a Midrange. Wide open! Klay Stewart is 7.6 feet away. [ZONE] Scottie Herro misses. Rebound secured by Domantas Wall.

[05:20] Team_018 possession (Score: 15-9)
Allen Markkanen attempts a 3Pt. Heavily contested by Cole Griffin (1.4 feet, MAN)! Allen Markkanen misses. Rebound secured by Scottie Herro.

[05:10] Team_096 possession (Score: 15-9)
FOUL! Reach-in foul on Domantas Wall during the drive. [Team fouls: 1] No free throws, side out. (Domantas Wall: 1 personal fouls)

[04:56] Team_096 possession (Score: 15-9)
Scottie Herro drives, Bones Anunoby stays with him. Scottie Herro attempts a Dunk. Contested by Bones Anunoby (4.0 feet, MAN). Scottie Herro misses. Rebound secured by Domantas Wall.

[04:43] Team_018 possession (Score: 15-9)
Allen Markkanen attempts a 3Pt. Contested by Lamelo Quickley (2.4 feet, ZONE). ALLEN MARKKANEN MAKES IT! Assist: Domantas Wall
Score: 18-9

[04:34] Team_096 possession (Score: 18-9)
Scottie Herro attempts a 3Pt. Heavily contested by Tracy Bryant (1.7 feet, ZONE)! Scottie Herro misses. Rebound secured by Domantas Wall.

[04:19] Team_018 possession (Score: 18-9)
Klay Stewart drives to the basket... Klay Stewart loses control! Ball rolls out of bounds! TURNOVER! (dead ball)

[04:04] Team_096 possession (Score: 18-9)
Cole Griffin attempts a 3Pt. Contested by Allen Markkanen (4.6 feet, MAN). COLE GRIFFIN MAKES IT! Assist: Terry Mobley
Score: 18-12

[03:51] Team_018 possession (Score: 18-12)
Allen Markkanen attempts a 3Pt. Contested by Cole Griffin (4.9 feet, MAN). ALLEN MARKKANEN MAKES IT! Assist: Tracy Bryant
Score: 21-12

[03:38] Team_096 possession (Score: 21-12)
Terry Mobley drives, Klay Stewart stays with him. Terry Mobley attempts a Dunk. Wide open! Klay Stewart is 9.2 feet away. [MAN] TERRY MOBLEY MAKES IT! Assist: Scottie Herro
Score: 21-14

[03:25] Team_018 possession (Score: 21-14)
Klay Stewart makes the Dunk and draws the foul on Kyrie Adebayo! And-1! Klay Stewart to the line for 1. [Team fouls: 3] (Kyrie Adebayo: 1 personal fouls)   FT 1/1: GOOD Klay Stewart makes 1/1 from the line.
Score: 24-14

[03:11] Team_096 possession (Score: 24-14)
Lamelo Quickley attempts a Midrange. Contested by Tracy Bryant (3.5 feet, MAN). LAMELO QUICKLEY MAKES IT!
Score: 24-16

[03:00] Team_018 possession (Score: 24-16)
FOUL! Shooting foul on Lamelo Quickley. Domantas Wall to the line for 2 free throws. [Team fouls: 4] (Lamelo Quickley: 1 personal fouls)   FT 1/2: GOOD   FT 2/2: GOOD Domantas Wall makes 2/2 from the line.
Score: 26-16

[02:49] Team_096 possession (Score: 26-16)
FOUL! Shooting foul on Domantas Wall. Kyrie Adebayo to the line for 2 free throws. [Team fouls: 2] (Domantas Wall: 2 personal fouls)   FT 1/2: GOOD   FT 2/2: GOOD Kyrie Adebayo makes 2/2 from the line.
Score: 26-18

[02:33] Team_018 possession (Score: 26-18)
Allen Markkanen attempts a 3Pt. Contested by Cole Griffin (2.3 feet, ZONE). Allen Markkanen misses. Offensive rebound by Bones Anunoby! Bones Anunoby kicks it out.

[02:14] Team_018 possession (Score: 26-18)
Allen Markkanen attempts a Midrange. Contested by Cole Griffin (3.7 feet, MAN). ALLEN MARKKANEN MAKES IT!
Score: 28-18

[01:55] Team_096 possession (Score: 28-18)
Kyrie Adebayo attempts a Layup. Contested by Domantas Wall (5.8 feet, ZONE). KYRIE ADEBAYO MAKES IT!
Score: 28-20

[01:43] Team_018 possession (Score: 28-20)
Allen Markkanen attempts a 3Pt. Contested by Cole Griffin (4.4 feet, MAN). ALLEN MARKKANEN MAKES IT! Assist: Domantas Wall
Score: 31-20

[01:31] Team_096 possession (Score: 31-20)
Shot clock violation! Cole Griffin couldn't get a shot off in time! TURNOVER! (dead ball)

[01:31] Substitution (Team_018): Bones Anunoby OUT → Shai Wade IN (stamina_rule2)

[01:31] Substitution (Team_018): Domantas Wall OUT → Julius Jackson IN (stamina_rule2)

[01:31] Substitution (Team_096): Terry Mobley OUT → Cade Jokic IN (stamina_rule2)

[01:14] Team_018 possession (Score: 31-20)
Tracy Bryant makes the 3Pt and draws the foul on Scottie Herro! And-1! Tracy Bryant to the line for 1. [BONUS: 5 team fouls] (Scottie Herro: 1 personal fouls)   FT 1/1: GOOD Tracy Bryant makes 1/1 from the line.
Score: 35-20

[00:58] Team_096 possession (Score: 35-20)
Cade Jokic attempts a 3Pt. Contested by Klay Stewart (5.4 feet, MAN). CADE JOKIC MAKES IT! Assist: Cole Griffin
Score: 35-23

[00:44] Team_018 possession (Score: 35-23)
Klay Stewart attempts a 3Pt. Contested by Cole Griffin (4.1 feet, ZONE). Klay Stewart misses. Rebound secured by Cole Griffin.

[00:27] Team_096 possession (Score: 35-23)
FOUL! Reach-in foul on Julius Jackson during the drive. [Team fouls: 3] No free throws, side out. (Julius Jackson: 1 personal fouls)

[00:27] Substitution (Team_096): Scottie Herro OUT → Tyler Haliburton IN (stamina_rule2)

[00:10] Team_096 possession (Score: 35-23)
Kyrie Adebayo attempts a Midrange. Contested by Julius Jackson (3.9 feet, MAN). KYRIE ADEBAYO MAKES IT! Assist: Tyler Haliburton
Score: 35-25

================================================================================
                              1ST QUARTER COMPLETE                              
================================================================================

1ST QUARTER SCORE: Team_018 35, Team_096 25

BOX SCORE:
================================================================================

Team_018
--------------------------------------------------------------------------------
Player                MIN  PTS  REB  AST  TO      FG   FG%      3P   3P%
--------------------------------------------------------------------------------
Allen Markkanen        12   16    3    1   0   6/8    75.0     0/0   0.0
Domantas Wall          11    8    5    3   0   4/5    80.0     0/0   0.0
Tracy Bryant           12    4    0    1   0   1/3    33.3     0/0   0.0
Bones Anunoby          11    4    2    0   0   2/2   100.0     0/0   0.0
Klay Stewart           12    3    0    3   0   1/2    50.0     0/0   0.0

TEAM: FG: 14/20 (70.0%), 3PT: 5/10 (50.0%), REB: 10 (2 off, 8 def), AST: 8, TO: 2
TEAM FOULS: 3


Team_096
--------------------------------------------------------------------------------
Player                MIN  PTS  REB  AST  TO      FG   FG%      3P   3P%
--------------------------------------------------------------------------------
Kyrie Adebayo          12   10    5    0   0   5/5   100.0     0/0   0.0
Cole Griffin           12    6    1    1   0   2/3    66.7     0/0   0.0
Lamelo Quickley        12    4    0    0   0   2/5    40.0     0/0   0.0
Cade Jokic              1    3    0    0   0   1/1   100.0     0/0   0.0
Terry Mobley           11    2    0    3   0   1/1   100.0     0/0   0.0
Scottie Herro          12    0    1    1   0   0/4     0.0     0/0   0.0
Tyler Haliburton        0    0    0    1   0   0/0     0.0     0/0   0.0

TEAM: FG: 11/19 (57.9%), 3PT: 4/6 (66.7%), REB: 7 (1 off, 6 def), AST: 6, TO: 3
TEAM FOULS: 5 [Team_018 in BONUS]

================================================================================

================================================================================
                       2ND QUARTER - Team_018 vs Team_096                       
================================================================================

[12:00] Team_018 possession (Score: 35-25)
Tracy Bryant throws a bad pass! Stolen by Lamelo Quickley! TURNOVER! (live ball)

[11:44] Team_096 possession (Score: 35-25)
Lamelo Quickley attempts a Layup. Contested by Tracy Bryant (3.3 feet, MAN). Lamelo Quickley misses. Rebound secured by Allen Markkanen.

[11:30] Team_018 possession (Score: 35-25)
Julius Jackson attempts a Layup. BLOCKED BY KYRIE ADEBAYO! Ball is loose! Rebound secured by Kyrie Adebayo.

[11:13] Team_096 possession (Score: 35-25)
Tyler Haliburton attempts a 3Pt. Wide open! Klay Stewart is 8.3 feet away. [ZONE] Tyler Haliburton misses. Rebound secured by Julius Jackson.

[11:02] Team_018 possession (Score: 35-25)
Tracy Bryant attempts a 3Pt. Contested by Cole Griffin (5.7 feet, ZONE). Tracy Bryant misses. Rebound secured by Kyrie Adebayo.

[10:50] Team_096 possession (Score: 35-25)
Tyler Haliburton loses the ball! Stripped by Shai Wade! TURNOVER! (live ball)

[10:37] Team_018 possession (Score: 35-25)
Tracy Bryant attempts a Layup. BLOCKED BY TYLER HALIBURTON! Ball is loose! Offensive rebound by Allen Markkanen! Allen Markkanen kicks it out.

[10:23] Team_018 possession (Score: 35-25)
Tracy Bryant drives, picks up Lamelo Quickley. Help arrives from Cole Griffin! Tracy Bryant attempts a Layup. Contested by Cole Griffin (3.8 feet, MAN). Tracy Bryant misses. Rebound secured by Kyrie Adebayo.

[10:11] Team_096 possession (Score: 35-25)
Cole Griffin drives and kicks out. Cole Griffin attempts a 3Pt. Wide open! Allen Markkanen is 6.4 feet away. [MAN] Cole Griffin misses. Rebound secured by Julius Jackson.

[09:56] Team_018 possession (Score: 35-25)
Julius Jackson attempts a Layup. Wide open! Kyrie Adebayo is 7.8 feet away. [MAN] JULIUS JACKSON MAKES IT!
Score: 37-25

[09:41] Team_096 possession (Score: 37-25)
Kyrie Adebayo attempts a Midrange. Wide open! Tracy Bryant is 6.7 feet away. [ZONE] KYRIE ADEBAYO MAKES IT!
Score: 37-27

[09:26] Team_018 possession (Score: 37-27)
Shai Wade attempts a Midrange. Wide open! Lamelo Quickley is 6.7 feet away. [ZONE] SHAI WADE MAKES IT! Assist: Klay Stewart
Score: 39-27

[09:09] Team_096 possession (Score: 39-27)
Cole Griffin attempts a 3Pt. Wide open! Shai Wade is 6.8 feet away. [ZONE] Cole Griffin misses. Offensive rebound by Kyrie Adebayo! Kyrie Adebayo puts it back in!
Score: 39-29

[08:53] Team_018 possession (Score: 39-29)
Allen Markkanen attempts a 3Pt. Contested by Cole Griffin (2.5 feet, MAN). Allen Markkanen misses. Rebound secured by Tyler Haliburton.

[08:42] Team_096 possession (Score: 39-29)
FOUL! Shooting foul on Tracy Bryant. Lamelo Quickley to the line for 3 free throws. [Team fouls: 1] (Tracy Bryant: 1 personal fouls)   FT 1/3: MISS   FT 2/3: MISS   FT 3/3: GOOD Lamelo Quickley makes 1/3 from the line.
Score: 39-30

[08:24] Team_018 possession (Score: 39-30)
Allen Markkanen drives, Kyrie Adebayo stays with him. Allen Markkanen attempts a Layup. Heavily contested by Kyrie Adebayo (0.9 feet, ZONE)! ALLEN MARKKANEN MAKES IT! Assist: Klay Stewart
Score: 41-30

[08:06] Team_096 possession (Score: 41-30)
Cole Griffin attempts a Midrange. Contested by Allen Markkanen (5.5 feet, ZONE). Cole Griffin misses. Rebound secured by Julius Jackson.

[07:49] Team_018 possession (Score: 41-30)
Julius Jackson attempts a Midrange. Contested by Kyrie Adebayo (3.6 feet, MAN). Julius Jackson misses. Rebound secured by Tyler Haliburton.

[07:39] Team_096 possession (Score: 41-30)
FOUL! Reach-in foul on Julius Jackson during the drive. [Team fouls: 2] No free throws, side out. (Julius Jackson: 2 personal fouls)

[07:39] Substitution (Team_018): Klay Stewart OUT → Michael Simons IN (stamina_rule2)

[07:39] Substitution (Team_018): Tracy Bryant OUT → Miles Herro IN (stamina_rule2)

[07:39] Substitution (Team_096): Lamelo Quickley OUT → Jarrett Markkanen IN (stamina_rule2)

[07:39] Substitution (Team_096): Cole Griffin OUT → Cole Holiday IN (stamina_rule2)

[07:39] Substitution (Team_096): Kyrie Adebayo OUT → Devin Griffin IN (stamina_rule2)

[07:20] Team_096 possession (Score: 41-30)
Jarrett Markkanen attempts a 3Pt. Wide open! Miles Herro is 9.0 feet away. [MAN] JARRETT MARKKANEN MAKES IT!
Score: 41-33

[07:08] Team_018 possession (Score: 41-33)
Allen Markkanen attempts a 3Pt. Contested by Cole Holiday (3.4 feet, MAN). Allen Markkanen misses. Offensive rebound by Julius Jackson! Julius Jackson kicks it out.

[06:52] Team_018 possession (Score: 41-33)
Allen Markkanen drives, picks up Cole Holiday. Help arrives from Jarrett Markkanen! Allen Markkanen attempts a Layup. Heavily contested by Jarrett Markkanen (1.5 feet, MAN)! ALLEN MARKKANEN MAKES IT!
Score: 43-33

[06:39] Team_096 possession (Score: 43-33)
Jarrett Markkanen commits a violation (traveling/carry)! TURNOVER! (dead ball)

[06:27] Team_018 possession (Score: 43-33)
Allen Markkanen drives to the basket... FOUL! Offensive foul on Allen Markkanen! Cole Holiday drew the charge! [Team fouls: 3] (Allen Markkanen: 1 personal fouls) TURNOVER! (dead ball)

[06:09] Team_096 possession (Score: 43-33)
Cade Jokic attempts a Midrange. Wide open! Allen Markkanen is 7.6 feet away. [ZONE] Cade Jokic misses. Rebound secured by Allen Markkanen.

[05:52] Team_018 possession (Score: 43-33)
Allen Markkanen attempts a 3Pt. Contested by Cole Holiday (3.6 feet, MAN). ALLEN MARKKANEN MAKES IT! Assist: Miles Herro
Score: 46-33

[05:37] Team_096 possession (Score: 46-33)
Tyler Haliburton attempts a 3Pt. Wide open! Michael Simons is 6.9 feet away. [ZONE] Tyler Haliburton misses. Rebound secured by Allen Markkanen.

[05:24] Team_018 possession (Score: 46-33)
Miles Herro attempts a 3Pt. Wide open! Cade Jokic is 6.5 feet away. [ZONE] Miles Herro misses. Rebound secured by Tyler Haliburton.

[05:12] Team_096 possession (Score: 46-33)
Jarrett Markkanen attempts a Midrange. Wide open! Miles Herro is 6.3 feet away. [MAN] Jarrett Markkanen misses. Rebound secured by Allen Markkanen.

[04:56] Team_018 possession (Score: 46-33)
Julius Jackson attempts a Layup. Contested by Devin Griffin (2.4 feet, MAN). JULIUS JACKSON MAKES IT! Assist: Shai Wade
Score: 48-33

[04:43] Team_096 possession (Score: 48-33)
Cole Holiday attempts a Layup. BLOCKED BY JULIUS JACKSON! Ball deflects out of bounds off Cole Holiday.

[04:43] Substitution (Team_018): Allen Markkanen OUT → Austin Antetokounmpo IN (stamina_rule2)

[04:31] Team_018 possession (Score: 48-33)
Austin Antetokounmpo attempts a 3Pt. Contested by Jarrett Markkanen (2.9 feet, ZONE). AUSTIN ANTETOKOUNMPO MAKES IT!
Score: 51-33

[04:15] Team_096 possession (Score: 51-33)
Tyler Haliburton attempts a Midrange. Contested by Shai Wade (3.6 feet, MAN). TYLER HALIBURTON MAKES IT! Assist: Cade Jokic
Score: 51-35

[04:02] Team_018 possession (Score: 51-35)
Austin Antetokounmpo attempts a 3Pt. Contested by Cole Holiday (2.9 feet, MAN). AUSTIN ANTETOKOUNMPO MAKES IT! Assist: Michael Simons
Score: 54-35

[03:49] Team_096 possession (Score: 54-35)
FOUL! Reach-in foul on Julius Jackson during the drive. [Team fouls: 4] No free throws, side out. (Julius Jackson: 3 personal fouls)

[03:33] Team_096 possession (Score: 54-35)
Jarrett Markkanen makes the Midrange and draws the foul on Miles Herro! And-1! Jarrett Markkanen to the line for 1. [BONUS: 5 team fouls] (Miles Herro: 1 personal fouls)   FT 1/1: GOOD Jarrett Markkanen makes 1/1 from the line.
Score: 54-38

[03:20] Team_018 possession (Score: 54-38)
Austin Antetokounmpo attempts a 3Pt. Contested by Cole Holiday (3.2 feet, MAN). Austin Antetokounmpo misses. Rebound secured by Cole Holiday.

[03:10] Team_096 possession (Score: 54-38)
Cade Jokic attempts a Midrange. Contested by Michael Simons (4.8 feet, MAN). CADE JOKIC MAKES IT! Assist: Cole Holiday
Score: 54-40

[02:52] Team_018 possession (Score: 54-40)
Austin Antetokounmpo attempts a 3Pt. Contested by Cole Holiday (4.8 feet, ZONE). Austin Antetokounmpo misses. FOUL! Loose ball foul on Devin Griffin during the rebound battle. [Team fouls: 2] No free throws, side out. (Devin Griffin: 1 personal fouls)

[02:37] Team_018 possession (Score: 54-40)
Julius Jackson loses the ball! Stripped by Devin Griffin! TURNOVER! (live ball)

[02:20] Team_096 possession (Score: 54-40)
Devin Griffin attempts a 3Pt. Wide open! Julius Jackson is 7.7 feet away. [MAN] Devin Griffin misses. Rebound secured by Julius Jackson.

[02:05] Team_018 possession (Score: 54-40)
Michael Simons attempts a 3Pt. Wide open! Cade Jokic is 6.2 feet away. [MAN] MICHAEL SIMONS MAKES IT! Assist: Miles Herro
Score: 57-40

[01:54] Team_096 possession (Score: 57-40)
Jarrett Markkanen attempts a 3Pt. Contested by Michael Simons (3.6 feet, ZONE). JARRETT MARKKANEN MAKES IT! Assist: Cade Jokic
Score: 57-43

[01:39] Team_018 possession (Score: 57-43)
Austin Antetokounmpo attempts a Midrange. Wide open! Cole Holiday is 6.2 feet away. [MAN] AUSTIN ANTETOKOUNMPO MAKES IT! Assist: Michael Simons
Score: 59-43

[01:25] Team_096 possession (Score: 59-43)
Tyler Haliburton attempts a 3Pt. Contested by Miles Herro (5.1 feet, ZONE). Tyler Haliburton misses. Offensive rebound by Devin Griffin! Devin Griffin kicks it out.

[01:07] Team_096 possession (Score: 59-43)
Jarrett Markkanen attempts a Midrange. Contested by Miles Herro (5.1 feet, MAN). JARRETT MARKKANEN MAKES IT! Assist: Cade Jokic
Score: 59-45

[00:53] Team_018 possession (Score: 59-45)
Miles Herro attempts a 3Pt. Contested by Jarrett Markkanen (5.2 feet, MAN). Miles Herro misses. Offensive rebound by Julius Jackson! Julius Jackson kicks it out.

[00:42] Team_018 possession (Score: 59-45)
Miles Herro attempts a 3Pt. Wide open! Cade Jokic is 7.1 feet away. [ZONE] Miles Herro misses. Rebound secured by Cole Holiday.

[00:28] Team_096 possession (Score: 59-45)
Cole Holiday attempts a Midrange. Heavily contested by Austin Antetokounmpo (1.9 feet, MAN)! Cole Holiday misses. Rebound secured by Michael Simons.

[00:13] Team_018 possession (Score: 59-45)
Julius Jackson drives to the basket... Shot clock violation! Julius Jackson couldn't get a shot off in time! TURNOVER! (dead ball)

[00:13] Substitution (Team_018): Shai Wade OUT → Bones Anunoby IN (starter_return_rule1)

[00:13] Substitution (Team_096): Cade Jokic OUT → Terry Mobley IN (starter_return_rule1)

[00:13] Substitution (Team_096): Cole Holiday OUT → Scottie Herro IN (starter_return_rule1)

================================================================================
                              2ND QUARTER COMPLETE                              
================================================================================

2ND QUARTER SCORE: Team_018 24, Team_096 20

BOX SCORE:
================================================================================

Team_018
--------------------------------------------------------------------------------
Player                MIN  PTS  REB  AST  TO      FG   FG%      3P   3P%
--------------------------------------------------------------------------------
Austin Antetokounmpo    5    8    0    0   0   3/4    75.0     0/0   0.0
Allen Markkanen        20    7    5    0   0   3/4    75.0     0/0   0.0
Julius Jackson         13    4    7    0   0   2/4    50.0     0/0   0.0
Michael Simons          7    3    1    2   0   1/1   100.0     0/0   0.0
Shai Wade              13    2    0    1   0   1/1   100.0     0/0   0.0
Tracy Bryant           17    0    0    0   0   0/2     0.0     0/0   0.0
Klay Stewart           17    0    0    2   0   0/0     0.0     0/0   0.0
Miles Herro             7    0    0    2   0   0/2     0.0     0/0   0.0

TEAM: FG: 10/18 (55.6%), 3PT: 4/9 (44.4%), REB: 13 (4 off, 9 def), AST: 7, TO: 4
TEAM FOULS: 5 [Team_096 in BONUS]


Team_096
--------------------------------------------------------------------------------
Player                MIN  PTS  REB  AST  TO      FG   FG%      3P   3P%
--------------------------------------------------------------------------------
Jarrett Markkanen       7   11    0    0   0   4/5    80.0     0/0   0.0
Kyrie Adebayo          17    4    4    0   0   2/2   100.0     0/0   0.0
Tyler Haliburton       12    2    3    0   0   1/3    33.3     0/0   0.0
Cade Jokic             13    2    0    3   0   1/2    50.0     0/0   0.0
Lamelo Quickley        17    1    0    0   0   1/2    50.0     0/0   0.0
Cole Griffin           17    0    0    0   0   0/2     0.0     0/0   0.0
Cole Holiday            7    0    2    1   0   0/2     0.0     0/0   0.0
Devin Griffin           7    0    1    0   0   0/1     0.0     0/0   0.0

TEAM: FG: 9/19 (47.4%), 3PT: 4/7 (57.1%), REB: 10 (2 off, 8 def), AST: 4, TO: 2
TEAM FOULS: 2

================================================================================

================================================================================
                       3RD QUARTER - Team_018 vs Team_096                       
================================================================================

[12:00] Team_018 possession (Score: 59-45)
Miles Herro throws a bad pass! Stolen by Jarrett Markkanen! TURNOVER! (live ball)

[11:44] Team_096 possession (Score: 59-45)
Terry Mobley attempts a Layup. Contested by Michael Simons (5.9 feet, MAN). TERRY MOBLEY MAKES IT!
Score: 59-47

[11:33] Team_018 possession (Score: 59-47)
Michael Simons attempts a Layup. Heavily contested by Terry Mobley (0.6 feet, MAN)! Michael Simons misses. Rebound secured by Scottie Herro.

[11:19] Team_096 possession (Score: 59-47)
Devin Griffin attempts a Midrange. Heavily contested by Bones Anunoby (0.5 feet, ZONE)! Devin Griffin misses. Rebound secured by Austin Antetokounmpo.

[11:08] Team_018 possession (Score: 59-47)
Miles Herro attempts a 3Pt. Wide open! Terry Mobley is 10.0 feet away. [ZONE] Miles Herro misses. Rebound secured by Scottie Herro.

[10:56] Team_096 possession (Score: 59-47)
Scottie Herro loses the ball! Stripped by Bones Anunoby! TURNOVER! (live ball)

[10:43] Team_018 possession (Score: 59-47)
Miles Herro drives, picks up Devin Griffin. Help arrives from Jarrett Markkanen! Miles Herro attempts a Dunk. Wide open! Jarrett Markkanen is 8.1 feet away. [ZONE] Miles Herro misses. Offensive rebound by Julius Jackson! Julius Jackson kicks it out.

[10:32] Team_018 possession (Score: 59-47)
Miles Herro attempts a 3Pt. Wide open! Jarrett Markkanen is 7.8 feet away. [MAN] Miles Herro misses. Rebound secured by Scottie Herro.

[10:19] Team_096 possession (Score: 59-47)
Devin Griffin attempts a Midrange. Wide open! Julius Jackson is 6.9 feet away. [MAN] Devin Griffin misses. Offensive rebound by Devin Griffin! Devin Griffin kicks it out.

[10:04] Team_096 possession (Score: 59-47)
Jarrett Markkanen attempts a 3Pt. Contested by Bones Anunoby (4.8 feet, ZONE). Jarrett Markkanen misses. Rebound secured by Bones Anunoby.

[09:46] Team_018 possession (Score: 59-47)
FOUL! Reach-in foul on Scottie Herro during the drive. [Team fouls: 1] No free throws, side out. (Scottie Herro: 2 personal fouls)

[09:28] Team_018 possession (Score: 59-47)
Julius Jackson attempts a Layup. BLOCKED BY DEVIN GRIFFIN! Ball deflects out of bounds off Julius Jackson.

[09:15] Team_096 possession (Score: 59-47)
Devin Griffin throws a bad pass! Stolen by Julius Jackson! TURNOVER! (live ball)

[08:58] Team_018 possession (Score: 59-47)
Michael Simons attempts a Midrange. Wide open! Terry Mobley is 7.1 feet away. [ZONE] MICHAEL SIMONS MAKES IT! Assist: Bones Anunoby
Score: 61-47

[08:47] Team_096 possession (Score: 61-47)
Tyler Haliburton attempts a Midrange. Contested by Bones Anunoby (3.0 feet, MAN). Tyler Haliburton misses. Offensive rebound by Scottie Herro! Scottie Herro kicks it out.

[08:35] Team_096 possession (Score: 61-47)
Terry Mobley attempts a 3Pt. Heavily contested by Bones Anunoby (0.7 feet, ZONE)! Terry Mobley misses. FOUL! Loose ball foul on Austin Antetokounmpo during the rebound battle. [Team fouls: 1] No free throws, side out. (Austin Antetokounmpo: 1 personal fouls)

[08:25] Team_096 possession (Score: 61-47)
Devin Griffin attempts a Midrange. Contested by Julius Jackson (5.3 feet, MAN). DEVIN GRIFFIN MAKES IT! Assist: Tyler Haliburton
Score: 61-49

[08:11] Team_018 possession (Score: 61-49)
Michael Simons attempts a Midrange. Contested by Terry Mobley (3.3 feet, MAN). MICHAEL SIMONS MAKES IT!
Score: 63-49

[07:56] Team_096 possession (Score: 63-49)
Terry Mobley attempts a 3Pt. Contested by Michael Simons (2.3 feet, MAN). Terry Mobley misses. Rebound secured by Julius Jackson.

[07:40] Team_018 possession (Score: 63-49)
Austin Antetokounmpo drives and kicks out. Julius Jackson attempts a Midrange. Contested by Devin Griffin (3.3 feet, MAN). JULIUS JACKSON MAKES IT! Assist: Michael Simons
Score: 65-49

[07:25] Team_096 possession (Score: 65-49)
Terry Mobley attempts a 3Pt. Wide open! Michael Simons is 10.0 feet away. [MAN] Terry Mobley misses. Offensive rebound by Devin Griffin! Devin Griffin kicks it out.

[07:07] Team_096 possession (Score: 65-49)
Terry Mobley attempts a Layup. BLOCKED BY BONES ANUNOBY! Ball is loose! Offensive rebound by Scottie Herro! Scottie Herro kicks it out.

[06:48] Team_096 possession (Score: 65-49)
Devin Griffin makes the Layup and draws the foul on Julius Jackson! And-1! Devin Griffin to the line for 1. [Team fouls: 2] (Julius Jackson: 4 personal fouls)   FT 1/1: GOOD Devin Griffin makes 1/1 from the line.
Score: 65-52

[06:37] Team_018 possession (Score: 65-52)
FOUL! Shooting foul on Devin Griffin. Julius Jackson to the line for 2 free throws. [Team fouls: 2] (Devin Griffin: 2 personal fouls)   FT 1/2: GOOD   FT 2/2: MISS Julius Jackson makes 1/2 from the line. Rebound secured by Devin Griffin.
Score: 66-52

[06:21] Team_096 possession (Score: 66-52)
Devin Griffin attempts a Midrange. Wide open! Julius Jackson is 7.2 feet away. [MAN] Devin Griffin misses. Rebound secured by Austin Antetokounmpo.

[06:09] Team_018 possession (Score: 66-52)
Bones Anunoby drives, picks up Scottie Herro. Help arrives from Jarrett Markkanen! Bones Anunoby attempts a Layup. Heavily contested by Jarrett Markkanen (1.1 feet, MAN)! BONES ANUNOBY MAKES IT!
Score: 68-52

[05:57] Team_096 possession (Score: 68-52)
Terry Mobley loses the ball! Stripped by Michael Simons! TURNOVER! (live ball)

[05:45] Team_018 possession (Score: 68-52)
Michael Simons attempts a 3Pt. Contested by Terry Mobley (4.4 feet, MAN). MICHAEL SIMONS MAKES IT! Assist: Miles Herro
Score: 71-52

[05:29] Team_096 possession (Score: 71-52)
Terry Mobley attempts a 3Pt. Wide open! Michael Simons is 10.0 feet away. [MAN] Terry Mobley misses. Rebound secured by Julius Jackson.

[05:17] Team_018 possession (Score: 71-52)
Miles Herro attempts a Midrange. Contested by Jarrett Markkanen (5.6 feet, MAN). MILES HERRO MAKES IT!
Score: 73-52

[05:05] Team_096 possession (Score: 73-52)
Terry Mobley attempts a Layup. Heavily contested by Bones Anunoby (0.9 feet, ZONE)! TERRY MOBLEY MAKES IT! Assist: Devin Griffin
Score: 73-54

[04:52] Team_018 possession (Score: 73-54)
FOUL! Reach-in foul on Scottie Herro during the drive. [Team fouls: 3] No free throws, side out. (Scottie Herro: 3 personal fouls)

[04:52] Substitution (Team_018): Michael Simons OUT → Klay Stewart IN (starter_return_rule1)

[04:52] Substitution (Team_018): Miles Herro OUT → Tracy Bryant IN (starter_return_rule1)

[04:52] Substitution (Team_018): Austin Antetokounmpo OUT → Allen Markkanen IN (starter_return_rule1)

[04:52] Substitution (Team_018): Julius Jackson OUT → Domantas Wall IN (starter_return_rule1)

[04:52] Substitution (Team_096): Terry Mobley OUT → Lamelo Quickley IN (starter_return_rule1)

[04:52] Substitution (Team_096): Scottie Herro OUT → Cole Griffin IN (starter_return_rule1)

[04:52] Substitution (Team_096): Devin Griffin OUT → Kyrie Adebayo IN (starter_return_rule1)

[04:36] Team_018 possession (Score: 73-54)
Domantas Wall attempts a Layup. Heavily contested by Kyrie Adebayo (2.0 feet, ZONE)! Domantas Wall misses. Rebound secured by Tyler Haliburton.

[04:21] Team_096 possession (Score: 73-54)
Cole Griffin attempts a 3Pt. Contested by Klay Stewart (4.5 feet, ZONE). COLE GRIFFIN MAKES IT! Assist: Lamelo Quickley
Score: 73-57

[04:09] Team_018 possession (Score: 73-57)
Klay Stewart attempts a 3Pt. Heavily contested by Jarrett Markkanen (1.1 feet, ZONE)! Klay Stewart misses. Rebound secured by Tyler Haliburton.

[03:52] Team_096 possession (Score: 73-57)
Lamelo Quickley loses the ball! Stripped by Tracy Bryant! TURNOVER! (live ball)

[03:34] Team_018 possession (Score: 73-57)
Bones Anunoby throws a bad pass! Stolen by Tyler Haliburton! TURNOVER! (live ball)

[03:23] Team_096 possession (Score: 73-57)
Jarrett Markkanen attempts a 3Pt. Contested by Klay Stewart (3.2 feet, ZONE). Jarrett Markkanen misses. Rebound secured by Bones Anunoby.

[03:08] Team_018 possession (Score: 73-57)
Allen Markkanen makes the Dunk and draws the foul on Cole Griffin! And-1! Allen Markkanen to the line for 1. [Team fouls: 4] (Cole Griffin: 2 personal fouls)   FT 1/1: GOOD Allen Markkanen makes 1/1 from the line.
Score: 76-57

[02:55] Team_096 possession (Score: 76-57)
Lamelo Quickley attempts a Midrange. Contested by Tracy Bryant (2.1 feet, MAN). Lamelo Quickley misses. Offensive rebound by Kyrie Adebayo! Kyrie Adebayo's putback is no good. Rebound secured by Bones Anunoby.

[02:38] Team_018 possession (Score: 76-57)
Klay Stewart attempts a Midrange. Wide open! Lamelo Quickley is 8.2 feet away. [ZONE] KLAY STEWART MAKES IT! Assist: Allen Markkanen
Score: 78-57

[02:27] Team_096 possession (Score: 78-57)
Tyler Haliburton attempts a 3Pt. Contested by Bones Anunoby (3.0 feet, MAN). Tyler Haliburton misses. Rebound secured by Domantas Wall.

[02:09] Team_018 possession (Score: 78-57)
Tracy Bryant drives, Lamelo Quickley stays with him. Tracy Bryant attempts a Dunk. Contested by Lamelo Quickley (3.4 feet, MAN). Tracy Bryant misses. Rebound secured by Cole Griffin.

[01:53] Team_096 possession (Score: 78-57)
Jarrett Markkanen attempts a 3Pt. Contested by Klay Stewart (2.4 feet, ZONE). Jarrett Markkanen misses. Rebound secured by Domantas Wall.

[01:42] Team_018 possession (Score: 78-57)
FOUL! Holding foul on Kyrie Adebayo. [IN THE BONUS! 5 team fouls] Domantas Wall to the line for 2 free throws. (Kyrie Adebayo: 2 personal fouls)   FT 1/2: GOOD   FT 2/2: GOOD Domantas Wall makes 2/2 from the line.
Score: 80-57

[01:30] Team_096 possession (Score: 80-57)
Tyler Haliburton attempts a 3Pt. Contested by Bones Anunoby (4.2 feet, MAN). TYLER HALIBURTON MAKES IT!
Score: 80-60

[01:16] Team_018 possession (Score: 80-60)
Bones Anunoby attempts a 3Pt. Contested by Tyler Haliburton (3.8 feet, MAN). Bones Anunoby misses. Rebound secured by Cole Griffin.

[01:04] Team_096 possession (Score: 80-60)
Tyler Haliburton attempts a Layup. BLOCKED BY DOMANTAS WALL! Ball deflects out of bounds off Tyler Haliburton.

[01:04] Substitution (Team_018): Bones Anunoby OUT → Shai Wade IN (stamina_rule2)

[00:47] Team_018 possession (Score: 80-60)
Domantas Wall makes the Dunk and draws the foul on Kyrie Adebayo! And-1! Domantas Wall to the line for 1. [BONUS: 6 team fouls] (Kyrie Adebayo: 3 personal fouls)   FT 1/1: MISS Domantas Wall makes 0/1 from the line. Rebound secured by Lamelo Quickley.
Score: 82-60

[00:36] Team_096 possession (Score: 82-60)
Tyler Haliburton attempts a 3Pt. Heavily contested by Klay Stewart (1.3 feet, ZONE)! Tyler Haliburton misses. Rebound secured by Tracy Bryant.

[00:18] Team_018 possession (Score: 82-60)
Domantas Wall makes the Dunk and draws the foul on Jarrett Markkanen! And-1! Domantas Wall to the line for 1. [BONUS: 7 team fouls] (Jarrett Markkanen: 1 personal fouls)   FT 1/1: GOOD Domantas Wall makes 1/1 from the line.
Score: 85-60

[00:06] Team_096 possession (Score: 85-60)
Kyrie Adebayo throws a bad pass! Stolen by Domantas Wall! TURNOVER! (live ball)

================================================================================
                              3RD QUARTER COMPLETE                              
================================================================================

3RD QUARTER SCORE: Team_018 26, Team_096 15

BOX SCORE:
================================================================================

Team_018
--------------------------------------------------------------------------------
Player                MIN  PTS  REB  AST  TO      FG   FG%      3P   3P%
--------------------------------------------------------------------------------
Michael Simons         15    7    0    1   0   3/4    75.0     0/0   0.0
Domantas Wall          16    5    2    0   0   2/4    50.0     0/0   0.0
Allen Markkanen        24    3    0    1   0   1/1   100.0     0/0   0.0
Miles Herro            15    2    0    1   0   1/3    33.3     0/0   0.0
Julius Jackson         21    2    3    0   0   1/3    33.3     0/0   0.0
Bones Anunoby          22    2    3    1   0   1/2    50.0     0/0   0.0
Klay Stewart           22    2    0    0   0   1/2    50.0     0/0   0.0
Austin Antetokounmpo   12    0    2    0   0   0/0     0.0     0/0   0.0
Tracy Bryant           22    0    1    0   0   0/1     0.0     0/0   0.0

TEAM: FG: 10/20 (50.0%), 3PT: 1/5 (20.0%), REB: 10 (1 off, 9 def), AST: 4, TO: 2
TEAM FOULS: 2


Team_096
--------------------------------------------------------------------------------
Player                MIN  PTS  REB  AST  TO      FG   FG%      3P   3P%
--------------------------------------------------------------------------------
Devin Griffin          15    5    3    1   0   2/4    50.0     0/0   0.0
Terry Mobley           18    4    0    0   0   2/4    50.0     0/0   0.0
Tyler Haliburton       25    3    2    1   0   1/4    25.0     0/0   0.0
Cole Griffin           22    3    2    0   0   1/1   100.0     0/0   0.0
Scottie Herro          19    0    6    0   0   0/0     0.0     0/0   0.0
Jarrett Markkanen      20    0    0    0   0   0/3     0.0     0/0   0.0
Lamelo Quickley        22    0    1    1   0   0/1     0.0     0/0   0.0

TEAM: FG: 6/17 (35.3%), 3PT: 2/9 (22.2%), REB: 15 (6 off, 9 def), AST: 3, TO: 5
TEAM FOULS: 7 [Team_018 in BONUS]

================================================================================

================================================================================
                       4TH QUARTER - Team_018 vs Team_096                       
================================================================================

[12:00] Team_018 possession (Score: 85-60)
Tracy Bryant throws a bad pass! Stolen by Lamelo Quickley! TURNOVER! (live ball)

[11:44] Team_096 possession (Score: 85-60)
Lamelo Quickley attempts a Layup. Contested by Tracy Bryant (3.3 feet, MAN). Lamelo Quickley misses. Rebound secured by Domantas Wall.

[11:30] Team_018 possession (Score: 85-60)
Domantas Wall drives, Kyrie Adebayo stays with him. Domantas Wall attempts a Layup. Heavily contested by Kyrie Adebayo (0.5 feet, ZONE)! DOMANTAS WALL MAKES IT! Assist: Klay Stewart
Score: 87-60

[11:13] Team_096 possession (Score: 87-60)
Tyler Haliburton attempts a 3Pt. Wide open! Klay Stewart is 8.1 feet away. [ZONE] Tyler Haliburton misses. Rebound secured by Tracy Bryant.

[11:02] Team_018 possession (Score: 87-60)
Tracy Bryant attempts a 3Pt. Contested by Cole Griffin (5.6 feet, ZONE). Tracy Bryant misses. Rebound secured by Kyrie Adebayo.

[10:50] Team_096 possession (Score: 87-60)
Tyler Haliburton loses the ball! Stripped by Shai Wade! TURNOVER! (live ball)

[10:37] Team_018 possession (Score: 87-60)
Tracy Bryant attempts a Layup. Contested by Tyler Haliburton (3.3 feet, ZONE). Tracy Bryant misses. Rebound secured by Kyrie Adebayo.

[10:17] Team_096 possession (Score: 87-60)
Cole Griffin attempts a 3Pt. Contested by Allen Markkanen (4.9 feet, MAN). Cole Griffin misses. Rebound secured by Domantas Wall.

[10:04] Team_018 possession (Score: 87-60)
Domantas Wall attempts a Midrange. Wide open! Kyrie Adebayo is 6.3 feet away. [MAN] Domantas Wall misses. Offensive rebound by Allen Markkanen! Allen Markkanen's putback is no good. Offensive rebound by Allen Markkanen! Allen Markkanen kicks it out.

[09:52] Team_018 possession (Score: 87-60)
Domantas Wall attempts a Midrange. Wide open! Kyrie Adebayo is 6.1 feet away. [MAN] DOMANTAS WALL MAKES IT! Assist: Allen Markkanen
Score: 89-60

[09:35] Team_096 possession (Score: 89-60)
Jarrett Markkanen drives, Tracy Bryant stays with him. Jarrett Markkanen attempts a Layup. Contested by Tracy Bryant (2.0 feet, MAN). JARRETT MARKKANEN MAKES IT! Assist: Lamelo Quickley
Score: 89-62

[09:18] Team_018 possession (Score: 89-62)
Shai Wade attempts a 3Pt. Wide open! Tyler Haliburton is 6.4 feet away. [MAN] SHAI WADE MAKES IT! Assist: Klay Stewart
Score: 92-62

[09:01] Team_096 possession (Score: 92-62)
Cole Griffin attempts a 3Pt. Contested by Shai Wade (5.7 feet, ZONE). COLE GRIFFIN MAKES IT! Assist: Kyrie Adebayo
Score: 92-65

[08:47] Team_018 possession (Score: 92-65)
Tracy Bryant drives, Lamelo Quickley stays with him. Tracy Bryant attempts a Dunk. Contested by Lamelo Quickley (5.2 feet, MAN). TRACY BRYANT MAKES IT!
Score: 94-65

[08:31] Team_096 possession (Score: 94-65)
Cole Griffin attempts a 3Pt. Contested by Klay Stewart (5.7 feet, ZONE). Cole Griffin misses. Rebound secured by Allen Markkanen.

[08:13] Team_018 possession (Score: 94-65)
Klay Stewart attempts a Layup. BLOCKED BY JARRETT MARKKANEN! Ball deflects out of bounds off Klay Stewart.

[08:01] Team_096 possession (Score: 94-65)
Lamelo Quickley attempts a 3Pt. Contested by Tracy Bryant (2.3 feet, ZONE). Lamelo Quickley misses. Rebound secured by Tracy Bryant.

[07:49] Team_018 possession (Score: 94-65)
Domantas Wall attempts a 3Pt. Contested by Cole Griffin (5.4 feet, ZONE). Domantas Wall misses. Rebound secured by Cole Griffin.

[07:37] Team_096 possession (Score: 94-65)
Kyrie Adebayo drives, Domantas Wall stays with him. Kyrie Adebayo attempts a Dunk. Contested by Domantas Wall (4.8 feet, MAN). KYRIE ADEBAYO MAKES IT! Assist: Jarrett Markkanen
Score: 94-67

[07:23] Team_018 possession (Score: 94-67)
Domantas Wall attempts a Dunk. BLOCKED BY KYRIE ADEBAYO! Ball goes out off Kyrie Adebayo. Domantas Wall's ball!

[07:12] Team_018 possession (Score: 94-67)
Shai Wade attempts a Midrange. Contested by Jarrett Markkanen (5.3 feet, ZONE). SHAI WADE MAKES IT!
Score: 96-67

[06:56] Team_096 possession (Score: 96-67)
Cole Griffin attempts a Midrange. Contested by Allen Markkanen (5.1 feet, MAN). COLE GRIFFIN MAKES IT! Assist: Jarrett Markkanen
Score: 96-69

[06:44] Team_018 possession (Score: 96-69)
Tracy Bryant attempts a 3Pt. Wide open! Cole Griffin is 7.8 feet away. [ZONE] Tracy Bryant misses. Offensive rebound by Domantas Wall! Domantas Wall's putback is no good. Rebound secured by Lamelo Quickley.

[06:26] Team_096 possession (Score: 96-69)
Cole Griffin drives to the basket... Cole Griffin loses the ball! Stripped by Allen Markkanen! TURNOVER! (live ball)

[06:13] Team_018 possession (Score: 96-69)
Tracy Bryant attempts a Layup. Wide open! Lamelo Quickley is 6.3 feet away. [MAN] Tracy Bryant misses. Rebound secured by Kyrie Adebayo.

[05:58] Team_096 possession (Score: 96-69)
Cole Griffin attempts a 3Pt. Heavily contested by Allen Markkanen (1.8 feet, MAN)! Cole Griffin misses. Rebound secured by Allen Markkanen.

[05:48] Team_018 possession (Score: 96-69)
FOUL! Reach-in foul on Kyrie Adebayo during the drive. [Team fouls: 1] No free throws, side out. (Kyrie Adebayo: 4 personal fouls)

[05:48] Substitution (Team_018): Domantas Wall OUT → Julius Jackson IN (stamina_rule2)

[05:48] Substitution (Team_096): Lamelo Quickley OUT → Terry Mobley IN (starter_return_rule1)

[05:48] Substitution (Team_096): Cole Griffin OUT → Scottie Herro IN (starter_return_rule1)

[05:34] Team_018 possession (Score: 96-69)
Shai Wade drives, Scottie Herro stays with him. Shai Wade attempts a Dunk. Contested by Scottie Herro (5.0 feet, MAN). Shai Wade misses. Rebound secured by Kyrie Adebayo.

[05:21] Team_096 possession (Score: 96-69)
Scottie Herro attempts a 3Pt. Heavily contested by Tracy Bryant (1.7 feet, ZONE)! Scottie Herro misses. Rebound secured by Julius Jackson.

[05:09] Team_018 possession (Score: 96-69)
Allen Markkanen attempts a Midrange. Contested by Scottie Herro (3.6 feet, MAN). ALLEN MARKKANEN MAKES IT!
Score: 98-69

[04:57] Team_096 possession (Score: 98-69)
Scottie Herro attempts a 3Pt. Contested by Tracy Bryant (3.9 feet, ZONE). Scottie Herro misses. Rebound secured by Tracy Bryant.

[04:43] Team_018 possession (Score: 98-69)
Tracy Bryant attempts a 3Pt. Contested by Jarrett Markkanen (5.4 feet, MAN). Tracy Bryant misses. Rebound secured by Terry Mobley.

[04:25] Team_096 possession (Score: 98-69)
Kyrie Adebayo attempts a 3Pt. Wide open! Klay Stewart is 6.2 feet away. [ZONE] Kyrie Adebayo misses. Rebound secured by Julius Jackson.

[04:13] Team_018 possession (Score: 98-69)
Tracy Bryant attempts a Layup. Contested by Jarrett Markkanen (4.7 feet, MAN). TRACY BRYANT MAKES IT! Assist: Klay Stewart
Score: 100-69

[04:01] Team_096 possession (Score: 100-69)
Terry Mobley attempts a Midrange. Contested by Tracy Bryant (4.3 feet, ZONE). TERRY MOBLEY MAKES IT! Assist: Scottie Herro
Score: 100-71

[03:48] Team_018 possession (Score: 100-71)
Tracy Bryant attempts a 3Pt. Contested by Jarrett Markkanen (5.1 feet, MAN). Tracy Bryant misses. Rebound secured by Scottie Herro.

[03:29] Team_096 possession (Score: 100-71)
Kyrie Adebayo attempts a 3Pt. Wide open! Julius Jackson is 8.8 feet away. [MAN] Kyrie Adebayo misses. Offensive rebound by Kyrie Adebayo! Kyrie Adebayo's putback is no good. Rebound secured by Allen Markkanen.

[03:16] Team_018 possession (Score: 100-71)
Shai Wade drives and kicks out. Klay Stewart attempts a 3Pt. Contested by Terry Mobley (4.1 feet, MAN). Klay Stewart misses. Rebound secured by Scottie Herro.

[03:01] Team_096 possession (Score: 100-71)
Scottie Herro loses the ball! Stripped by Shai Wade! TURNOVER! (live ball)

[02:45] Team_018 possession (Score: 100-71)
Allen Markkanen attempts a 3Pt. Contested by Jarrett Markkanen (3.2 feet, ZONE). Allen Markkanen misses. Rebound secured by Scottie Herro.

[02:26] Team_096 possession (Score: 100-71)
Scottie Herro loses the ball! Stripped by Shai Wade! TURNOVER! (live ball)

[02:11] Team_018 possession (Score: 100-71)
Klay Stewart drives, Terry Mobley stays with him. Klay Stewart attempts a Layup. Contested by Terry Mobley (5.2 feet, MAN). KLAY STEWART MAKES IT! Assist: Allen Markkanen
Score: 102-71

[01:57] Team_096 possession (Score: 102-71)
Kyrie Adebayo attempts a Layup. Heavily contested by Julius Jackson (1.8 feet, ZONE)! KYRIE ADEBAYO MAKES IT! Assist: Tyler Haliburton
Score: 102-73

[01:43] Team_018 possession (Score: 102-73)
Klay Stewart attempts a Midrange. Wide open! Jarrett Markkanen is 8.0 feet away. [ZONE] KLAY STEWART MAKES IT!
Score: 104-73

[01:29] Team_096 possession (Score: 104-73)
Jarrett Markkanen attempts a 3Pt. Contested by Klay Stewart (4.1 feet, ZONE). Jarrett Markkanen misses. Rebound secured by Allen Markkanen.

[01:13] Team_018 possession (Score: 104-73)
Allen Markkanen attempts a 3Pt. Heavily contested by Scottie Herro (0.5 feet, MAN)! Allen Markkanen misses. Rebound secured by Kyrie Adebayo.

[00:57] Team_096 possession (Score: 104-73)
Scottie Herro drives and kicks out. Scottie Herro attempts a Midrange. Wide open! Shai Wade is 6.9 feet away. [MAN] Scottie Herro misses. Rebound secured by Tracy Bryant.

[00:39] Team_018 possession (Score: 104-73)
FOUL! Shooting foul on Terry Mobley. Tracy Bryant to the line for 3 free throws. [Team fouls: 2] (Terry Mobley: 2 personal fouls)   FT 1/3: GOOD   FT 2/3: GOOD   FT 3/3: GOOD Tracy Bryant makes 3/3 from the line.
Score: 107-73

[00:22] Team_096 possession (Score: 107-73)
Scottie Herro throws a bad pass! Stolen by Shai Wade! TURNOVER! (live ball)

[00:09] Team_018 possession (Score: 107-73)
Allen Markkanen throws a bad pass! Stolen by Scottie Herro! TURNOVER! (live ball)

================================================================================
                              4TH QUARTER COMPLETE                              
================================================================================

4TH QUARTER SCORE: Team_018 22, Team_096 13

BOX SCORE:
================================================================================

Team_018
--------------------------------------------------------------------------------
Player                MIN  PTS  REB  AST  TO      FG   FG%      3P   3P%
--------------------------------------------------------------------------------
Tracy Bryant           34    7    4    0   0   3/9    33.3     0/0   0.0
Shai Wade              26    5    0    0   0   2/4    50.0     0/0   0.0
Domantas Wall          22    4    2    0   0   2/3    66.7     0/0   0.0
Klay Stewart           34    4    0    3   0   2/3    66.7     0/0   0.0
Allen Markkanen        36    2    5    2   0   1/3    33.3     0/0   0.0
Lamelo Quickley        28    0    1    1   0   0/2     0.0     0/0   0.0
Julius Jackson         26    0    2    0   0   0/0     0.0     0/0   0.0

TEAM: FG: 10/22 (45.5%), 3PT: 2/9 (22.2%), REB: 13 (2 off, 11 def), AST: 5, TO: 2
TEAM FOULS: 0


Team_096
--------------------------------------------------------------------------------
Player                MIN  PTS  REB  AST  TO      FG   FG%      3P   3P%
--------------------------------------------------------------------------------
Cole Griffin           28    5    1    0   0   2/5    40.0     0/0   0.0
Kyrie Adebayo          34    4    5    1   0   2/4    50.0     0/0   0.0
Jarrett Markkanen      32    2    0    2   0   1/2    50.0     0/0   0.0
Terry Mobley           24    2    1    0   0   1/1   100.0     0/0   0.0
Tyler Haliburton       37    0    0    1   0   0/1     0.0     0/0   0.0
Scottie Herro          25    0    3    1   0   0/3     0.0     0/0   0.0

TEAM: FG: 6/18 (33.3%), 3PT: 1/11 (9.1%), REB: 11 (1 off, 10 def), AST: 6, TO: 5
TEAM FOULS: 2

================================================================================

================================================================================
                               FULL GAME COMPLETE                               
================================================================================

FINAL SCORE: Team_018 107, Team_096 73

SCORING BY QUARTER:
--------------------------------------------------------------------------------
Team                     Q1     Q2     Q3     Q4    FINAL
--------------------------------------------------------------------------------
Team_018                 35     24     26     22      107
Team_096                 25     20     15     13       73
--------------------------------------------------------------------------------

FULL GAME BOX SCORE:
================================================================================

Team_018
--------------------------------------------------------------------------------
Player                MIN  PTS  REB  AST  TO      FG   FG%      3P   3P%      FT STL BLK
--------------------------------------------------------------------------------
Allen Markkanen        36   28   13    4   1  11/16   68.8   5/10   50.0   1/1     1   1
Klay Stewart           34    9    0    8   0   4/7    57.1   0/2     0.0   1/1     0   0
Tracy Bryant           34   11    5    1   3   4/15   26.7   2/8    25.0   4/4     2   0
Julius Jackson         26    6   12    0   1   2/6    33.3   0/0     0.0   1/2     1   1
Shai Wade              26    7    0    1   0   3/5    60.0   1/1   100.0   0/0     5   0
Bones Anunoby          22    6    5    1   2   3/4    75.0   0/1     0.0   0/0     2   1
Domantas Wall          22   17    9    3   0   7/11   63.6   0/2     0.0   5/6     1   1
Michael Simons         15   10    1    3   1   4/5    80.0   2/2   100.0   0/0     1   0
Miles Herro            15    2    0    3   1   1/5    20.0   0/4     0.0   0/0     0   0
Austin Antetokounmpo   12    8    2    0   1   4/5    80.0   2/3    66.7   0/0     0   0

TEAM: FG: 44/80 (55.0%), 3PT: 12/33 (36.4%), REB: 46 (9 off, 37 def), AST: 24, TO: 10


Team_096
--------------------------------------------------------------------------------
Player                MIN  PTS  REB  AST  TO      FG   FG%      3P   3P%      FT STL BLK
--------------------------------------------------------------------------------
Tyler Haliburton       37    5    5    3   2   2/8    25.0   1/6    16.7   0/0     1   1
Kyrie Adebayo          34   18   14    1   1   7/9    77.8   0/2     0.0   2/2     0   2
Jarrett Markkanen      32   13    0    2   2   5/10   50.0   2/6    33.3   1/1     1   1
Lamelo Quickley        28    5    2    2   2   3/10   30.0   1/2    50.0   1/3     3   0
Cole Griffin           28   14    4    1   1   7/13   53.8   6/9    66.7   0/0     0   0
Scottie Herro          25    0   10    2   5   0/7     0.0   0/4     0.0   0/0     1   1
Terry Mobley           24    8    1    3   1   4/6    66.7   0/2     0.0   0/0     0   0
Devin Griffin          15    5    4    1   1   2/5    40.0   0/1     0.0   1/1     1   1
Cade Jokic             13    5    0    3   0   2/3    66.7   1/1   100.0   0/0     0   0
Cole Holiday            7    0    2    1   0   0/2     0.0   0/0     0.0   0/0     0   0

TEAM: FG: 32/73 (43.8%), 3PT: 11/33 (33.3%), REB: 43 (10 off, 33 def), AST: 19, TO: 15

================================================================================
