GAME 5: Team_069 vs Team_009
====================================================================================================

================================================================================
                        FULL GAME - Team_069 vs Team_009                        
================================================================================

================================================================================
                       1ST QUARTER - Team_069 vs Team_009                       
================================================================================

[12:00] Team_069 possession (Score: 0-0)
CJ Fox attempts a 3Pt. Heavily contested by Kyle Brogdon (0.9 feet, MAN)! CJ FOX MAKES IT! Assist: Domantas Lowry
Score: 3-0

[11:45] Team_009 possession (Score: 3-0)
Miles Sabonis drives, Domantas Towns stays with him. Miles Sabonis attempts a Dunk. Contested by Domantas Towns (4.1 feet, ZONE). Miles Sabonis misses. Rebound secured by Pau Middleton.

[11:33] Team_069 possession (Score: 3-0)
CJ Fox throws a bad pass! Stolen by Kyle Brogdon! TURNOVER! (live ball)

[11:20] Team_009 possession (Score: 3-0)
Kyle Brogdon throws a bad pass! Stolen by CJ Fox! TURNOVER! (live ball)

[11:08] Team_069 possession (Score: 3-0)
Domantas Lowry attempts a 3Pt. Contested by Miles Sabonis (3.9 feet, ZONE). Domantas Lowry misses. Rebound secured by Anfernee Anunoby.

[10:55] Team_009 possession (Score: 3-0)
Cole Mitchell drives, picks up Domantas Towns. Help arrives from James Sexton! Cole Mitchell attempts a Dunk. Contested by James Sexton (4.1 feet, MAN). COLE MITCHELL MAKES IT! Assist: Desmond Harden
Score: 3-2

[10:42] Team_069 possession (Score: 3-2)
James Sexton attempts a 3Pt. Wide open! Cole Mitchell is 8.4 feet away. [ZONE] JAMES SEXTON MAKES IT!
Score: 6-2

[10:27] Team_009 possession (Score: 6-2)
FOUL! Shooting foul on Domantas Towns. Miles Sabonis to the line for 2 free throws. [Team fouls: 1] (Domantas Towns: 1 personal fouls)   FT 1/2: MISS   FT 2/2: GOOD Miles Sabonis makes 1/2 from the line.
Score: 6-3

[10:14] Team_069 possession (Score: 6-3)
James Sexton drives and kicks out. FOUL! Shooting foul on Anfernee Anunoby. Pau Middleton to the line for 3 free throws. [Team fouls: 1] (Anfernee Anunoby: 1 personal fouls)   FT 1/3: GOOD   FT 2/3: MISS   FT 3/3: MISS Pau Middleton makes 1/3 from the line. Rebound secured by Anfernee Anunoby.
Score: 7-3

[10:00] Team_009 possession (Score: 7-3)
Cole Mitchell attempts a 3Pt. Heavily contested by James Sexton (1.0 feet, ZONE)! Cole Mitchell misses. Rebound secured by Pau Middleton.

[09:48] Team_069 possession (Score: 7-3)
Domantas Towns attempts a 3Pt. Wide open! Cole Mitchell is 8.6 feet away. [MAN] Domantas Towns misses. Rebound secured by Kyle Brogdon.

[09:33] Team_009 possession (Score: 7-3)
Kyle Brogdon attempts a Layup. Contested by Domantas Towns (3.6 feet, ZONE). KYLE BROGDON MAKES IT! Assist: Anfernee Anunoby
Score: 7-5

[09:21] Team_069 possession (Score: 7-5)
CJ Fox attempts a Layup. Contested by Kyle Brogdon (3.3 feet, ZONE). CJ FOX MAKES IT! Assist: Domantas Towns
Score: 9-5

[09:08] Team_009 possession (Score: 9-5)
Miles Sabonis attempts a 3Pt. Contested by James Sexton (3.7 feet, ZONE). Miles Sabonis misses. Rebound secured by CJ Fox.

[08:54] Team_069 possession (Score: 9-5)
CJ Fox makes the Layup and draws the foul on Kyle Brogdon! And-1! CJ Fox to the line for 1. [Team fouls: 2] (Kyle Brogdon: 1 personal fouls)   FT 1/1: GOOD CJ Fox makes 1/1 from the line.
Score: 12-5

[08:39] Team_009 possession (Score: 12-5)
Anfernee Anunoby loses control! Ball rolls out of bounds! TURNOVER! (dead ball)

[08:23] Team_069 possession (Score: 12-5)
Pau Middleton attempts a 3Pt. Contested by Miles Sabonis (3.3 feet, ZONE). Pau Middleton misses. Rebound secured by Cole Mitchell.

[08:09] Team_009 possession (Score: 12-5)
FOUL! Reach-in foul on CJ Fox during the drive. [Team fouls: 2] No free throws, side out. (CJ Fox: 1 personal fouls)

[07:53] Team_009 possession (Score: 12-5)
Kyle Brogdon attempts a Midrange. Contested by CJ Fox (2.3 feet, MAN). KYLE BROGDON MAKES IT! Assist: Anfernee Anunoby
Score: 12-7

[07:40] Team_069 possession (Score: 12-7)
Pau Middleton attempts a 3Pt. Wide open! Anfernee Anunoby is 8.0 feet away. [MAN] Pau Middleton misses. Offensive rebound by Pau Middleton! Pau Middleton kicks it out.

[07:25] Team_069 possession (Score: 12-7)
James Sexton attempts a Layup. Contested by Miles Sabonis (5.2 feet, MAN). JAMES SEXTON MAKES IT! Assist: Pau Middleton
Score: 14-7

[07:11] Team_009 possession (Score: 14-7)
Miles Sabonis attempts a 3Pt. Wide open! James Sexton is 6.1 feet away. [MAN] Miles Sabonis misses. Offensive rebound by Cole Mitchell! Cole Mitchell kicks it out.

[06:57] Team_009 possession (Score: 14-7)
Anfernee Anunoby attempts a 3Pt. Contested by Domantas Lowry (4.4 feet, ZONE). Anfernee Anunoby misses. Rebound secured by Domantas Towns.

[06:41] Team_069 possession (Score: 14-7)
Pau Middleton attempts a 3Pt. Wide open! Cole Mitchell is 7.4 feet away. [ZONE] PAU MIDDLETON MAKES IT! Assist: Domantas Towns
Score: 17-7

[06:24] Team_009 possession (Score: 17-7)
Kyle Brogdon attempts a Midrange. Contested by Domantas Towns (3.2 feet, ZONE). KYLE BROGDON MAKES IT!
Score: 17-9

[06:09] Team_069 possession (Score: 17-9)
Pau Middleton attempts a Midrange. Contested by Desmond Harden (4.1 feet, ZONE). Pau Middleton misses. Rebound secured by Kyle Brogdon.

[05:51] Team_009 possession (Score: 17-9)
Miles Sabonis drives, picks up CJ Fox. Help arrives from James Sexton! Miles Sabonis attempts a Layup. Contested by James Sexton (4.8 feet, ZONE). Miles Sabonis misses. Rebound secured by Pau Middleton.

[05:39] Team_069 possession (Score: 17-9)
James Sexton drives to the basket... FOUL! Offensive foul on James Sexton! Kyle Brogdon drew the charge! [Team fouls: 3] (James Sexton: 1 personal fouls) TURNOVER! (dead ball)

[05:23] Team_009 possession (Score: 17-9)
Cole Mitchell attempts a 3Pt. Contested by James Sexton (6.0 feet, ZONE). Cole Mitchell misses. FOUL! Loose ball foul on Domantas Towns during the rebound battle. [Team fouls: 4] No free throws, side out. (Domantas Towns: 2 personal fouls)

[05:06] Team_009 possession (Score: 17-9)
Cole Mitchell attempts a 3Pt. Contested by Domantas Towns (5.6 feet, MAN). Cole Mitchell misses. Rebound secured by CJ Fox.

[04:51] Team_069 possession (Score: 17-9)
James Sexton attempts a 3Pt. Wide open! Miles Sabonis is 9.2 feet away. [MAN] James Sexton misses. FOUL! Loose ball foul on Anfernee Anunoby during the rebound battle. [Team fouls: 3] No free throws, side out. (Anfernee Anunoby: 2 personal fouls)

[04:36] Team_069 possession (Score: 17-9)
CJ Fox attempts a Midrange. Contested by Kyle Brogdon (3.9 feet, MAN). CJ FOX MAKES IT!
Score: 19-9

[04:19] Team_009 possession (Score: 19-9)
FOUL! Shooting foul on Domantas Lowry. Anfernee Anunoby to the line for 2 free throws. [BONUS: 5 team fouls] (Domantas Lowry: 1 personal fouls)   FT 1/2: GOOD   FT 2/2: GOOD Anfernee Anunoby makes 2/2 from the line.
Score: 19-11

[04:06] Team_069 possession (Score: 19-11)
Domantas Towns attempts a 3Pt. Contested by Miles Sabonis (5.9 feet, ZONE). Domantas Towns misses. Rebound secured by Cole Mitchell.

[03:53] Team_009 possession (Score: 19-11)
Kyle Brogdon attempts a Dunk. BLOCKED BY CJ FOX! Ball is loose! Offensive rebound by Kyle Brogdon! Kyle Brogdon kicks it out.

[03:34] Team_009 possession (Score: 19-11)
Anfernee Anunoby attempts a 3Pt. Contested by Pau Middleton (5.1 feet, MAN). ANFERNEE ANUNOBY MAKES IT! Assist: Miles Sabonis
Score: 19-14

[03:19] Team_069 possession (Score: 19-14)
CJ Fox drives, Kyle Brogdon stays with him. CJ Fox attempts a Layup. Wide open! Kyle Brogdon is 8.2 feet away. [ZONE] CJ Fox misses. Rebound secured by Kyle Brogdon.

[03:00] Team_009 possession (Score: 19-14)
Cole Mitchell attempts a Midrange. Contested by Domantas Towns (5.1 feet, MAN). Cole Mitchell misses. Offensive rebound by Cole Mitchell! Cole Mitchell kicks it out.

[02:45] Team_009 possession (Score: 19-14)
FOUL! Holding foul on Domantas Towns. [IN THE BONUS! 6 team fouls] Cole Mitchell to the line for 2 free throws. (Domantas Towns: 3 personal fouls)   FT 1/2: GOOD   FT 2/2: GOOD Cole Mitchell makes 2/2 from the line.
Score: 19-16

[02:32] Team_069 possession (Score: 19-16)
Domantas Lowry drives to the basket... Domantas Lowry throws a bad pass! Stolen by Kyle Brogdon! TURNOVER! (live ball)

[02:17] Team_009 possession (Score: 19-16)
Cole Mitchell attempts a Layup. Contested by Domantas Towns (2.4 feet, ZONE). COLE MITCHELL MAKES IT!
Score: 19-18

[01:59] Team_069 possession (Score: 19-18)
Pau Middleton drives, Anfernee Anunoby stays with him. Pau Middleton attempts a Dunk. Contested by Anfernee Anunoby (4.6 feet, MAN). Pau Middleton misses. Rebound secured by Cole Mitchell.

[01:44] Team_009 possession (Score: 19-18)
Desmond Harden attempts a Midrange. Wide open! Domantas Lowry is 9.8 feet away. [ZONE] DESMOND HARDEN MAKES IT!
Score: 19-20

[01:29] Team_069 possession (Score: 19-20)
Domantas Lowry attempts a 3Pt. Wide open! Miles Sabonis is 7.0 feet away. [ZONE] DOMANTAS LOWRY MAKES IT! Assist: Domantas Towns
Score: 22-20

[01:15] Team_009 possession (Score: 22-20)
Shot clock violation! Desmond Harden couldn't get a shot off in time! TURNOVER! (dead ball)

[01:15] Substitution (Team_069): James Sexton OUT → Jarrett Murray IN (stamina_rule2)

[01:15] Substitution (Team_069): Pau Middleton OUT → Tyrese Simons IN (stamina_rule2)

[01:15] Substitution (Team_069): Domantas Towns OUT → Devin Giddey IN (stamina_rule2)

[01:15] Substitution (Team_009): Miles Sabonis OUT → Paul Trent IN (stamina_rule2)

[01:15] Substitution (Team_009): Desmond Harden OUT → Evan Curry IN (stamina_rule2)

[01:15] Substitution (Team_009): Anfernee Anunoby OUT → RJ Jokic IN (stamina_rule2)

[01:15] Substitution (Team_009): Cole Mitchell OUT → Kawhi Herro IN (stamina_rule2)

[01:15] Substitution (Team_009): Kyle Brogdon OUT → Shaquille Green IN (stamina_rule2)

[01:03] Team_069 possession (Score: 22-20)
FOUL! Shooting foul on Kawhi Herro. CJ Fox to the line for 2 free throws. [Team fouls: 4] (Kawhi Herro: 1 personal fouls)   FT 1/2: GOOD   FT 2/2: GOOD CJ Fox makes 2/2 from the line.
Score: 24-20

[00:49] Team_009 possession (Score: 24-20)
RJ Jokic attempts a Layup. Contested by Tyrese Simons (5.0 feet, MAN). RJ JOKIC MAKES IT!
Score: 24-22

[00:36] Team_069 possession (Score: 24-22)
FOUL! Holding foul on Shaquille Green. [IN THE BONUS! 5 team fouls] CJ Fox to the line for 2 free throws. (Shaquille Green: 1 personal fouls)   FT 1/2: MISS   FT 2/2: GOOD CJ Fox makes 1/2 from the line.
Score: 25-22

[00:22] Team_009 possession (Score: 25-22)
Paul Trent attempts a Midrange. Contested by Jarrett Murray (3.5 feet, MAN). PAUL TRENT MAKES IT!
Score: 25-24

[00:06] Team_069 possession (Score: 25-24)
Jarrett Murray throws a bad pass out of bounds! TURNOVER! (dead ball)

[00:06] Substitution (Team_069): CJ Fox OUT → Shai Quickley IN (stamina_rule2)

================================================================================
                              1ST QUARTER COMPLETE                              
================================================================================

1ST QUARTER SCORE: Team_069 25, Team_009 24

BOX SCORE:
================================================================================

Team_069
--------------------------------------------------------------------------------
Player                MIN  PTS  REB  AST  TO      FG   FG%      3P   3P%
--------------------------------------------------------------------------------
CJ Fox                 12   13    2    0   0   6/7    85.7     0/0   0.0
James Sexton           11    5    0    0   0   2/3    66.7     0/0   0.0
Domantas Lowry         12    3    0    1   0   1/2    50.0     0/0   0.0
Pau Middleton          11    3    4    1   0   1/4    25.0     0/0   0.0
Domantas Towns         11    0    2    3   0   0/2     0.0     0/0   0.0

TEAM: FG: 10/18 (55.6%), 3PT: 4/8 (50.0%), REB: 8 (2 off, 6 def), AST: 5, TO: 4
TEAM FOULS: 6 [Team_009 in BONUS]


Team_009
--------------------------------------------------------------------------------
Player                MIN  PTS  REB  AST  TO      FG   FG%      3P   3P%
--------------------------------------------------------------------------------
Cole Mitchell          11    6    5    0   0   3/5    60.0     0/0   0.0
Kyle Brogdon           11    6    5    0   0   3/3   100.0     0/0   0.0
Anfernee Anunoby       11    5    2    2   0   2/3    66.7     0/0   0.0
Desmond Harden         11    2    0    1   0   1/1   100.0     0/0   0.0
RJ Jokic                1    2    0    0   0   1/1   100.0     0/0   0.0
Paul Trent              1    2    0    0   0   1/1   100.0     0/0   0.0
Miles Sabonis          11    1    0    1   0   1/4    25.0     0/0   0.0

TEAM: FG: 12/18 (66.7%), 3PT: 1/5 (20.0%), REB: 12 (4 off, 8 def), AST: 4, TO: 3
TEAM FOULS: 5 [Team_069 in BONUS]

================================================================================

================================================================================
                       2ND QUARTER - Team_069 vs Team_009                       
================================================================================

[12:00] Team_069 possession (Score: 25-24)
Shai Quickley attempts a 3Pt. Heavily contested by Shaquille Green (0.9 feet, MAN)! SHAI QUICKLEY MAKES IT! Assist: Jarrett Murray
Score: 28-24

[11:45] Team_009 possession (Score: 28-24)
Paul Trent attempts a Midrange. Contested by Devin Giddey (5.7 feet, ZONE). PAUL TRENT MAKES IT! Assist: Shaquille Green
Score: 28-26

[11:33] Team_069 possession (Score: 28-26)
Shai Quickley attempts a Midrange. Contested by Kawhi Herro (3.6 feet, ZONE). SHAI QUICKLEY MAKES IT!
Score: 30-26

[11:20] Team_009 possession (Score: 30-26)
Kawhi Herro attempts a 3Pt. Wide open! Devin Giddey is 7.3 feet away. [MAN] KAWHI HERRO MAKES IT! Assist: Shaquille Green
Score: 30-29

[11:04] Team_069 possession (Score: 30-29)
FOUL! Holding foul on Evan Curry. [Team fouls: 1] No free throws, side out. (Evan Curry: 1 personal fouls)

[10:54] Team_069 possession (Score: 30-29)
Shai Quickley attempts a Midrange. Contested by Shaquille Green (3.9 feet, MAN). Shai Quickley misses. Offensive rebound by Tyrese Simons! Tyrese Simons kicks it out.

[10:36] Team_069 possession (Score: 30-29)
Jarrett Murray attempts a 3Pt. Wide open! Paul Trent is 8.0 feet away. [MAN] Jarrett Murray misses. Offensive rebound by Tyrese Simons! Tyrese Simons kicks it out.

[10:22] Team_069 possession (Score: 30-29)
Jarrett Murray attempts a Layup. Wide open! Paul Trent is 6.9 feet away. [MAN] Jarrett Murray misses. Rebound secured by Kawhi Herro.

[10:11] Team_009 possession (Score: 30-29)
RJ Jokic makes the Layup and draws the foul on Devin Giddey! And-1! RJ Jokic to the line for 1. [Team fouls: 1] (Devin Giddey: 1 personal fouls)   FT 1/1: MISS RJ Jokic makes 0/1 from the line. Offensive rebound by Shaquille Green! Shaquille Green kicks it out.
Score: 30-31

[09:57] Team_009 possession (Score: 30-31)
Paul Trent throws a bad pass! Stolen by Jarrett Murray! TURNOVER! (live ball)

[09:40] Team_069 possession (Score: 30-31)
Jarrett Murray drives, Paul Trent stays with him. Jarrett Murray attempts a Layup. Heavily contested by Paul Trent (1.5 feet, MAN)! JARRETT MURRAY MAKES IT! Assist: Shai Quickley
Score: 32-31

[09:22] Team_009 possession (Score: 32-31)
Paul Trent drives to the basket... Paul Trent throws a bad pass! Stolen by Jarrett Murray! TURNOVER! (live ball)

[09:08] Team_069 possession (Score: 32-31)
Tyrese Simons drives and kicks out. Jarrett Murray attempts a Midrange. Wide open! Paul Trent is 10.0 feet away. [MAN] Jarrett Murray misses. Offensive rebound by Shai Quickley! Shai Quickley puts it back in!
Score: 34-31

[08:54] Team_009 possession (Score: 34-31)
FOUL! Shooting foul on Jarrett Murray. Paul Trent to the line for 3 free throws. [Team fouls: 2] (Jarrett Murray: 1 personal fouls)   FT 1/3: GOOD   FT 2/3: GOOD   FT 3/3: MISS Paul Trent makes 2/3 from the line. Rebound secured by Tyrese Simons.
Score: 34-33

[08:40] Team_069 possession (Score: 34-33)
Tyrese Simons attempts a 3Pt. Wide open! RJ Jokic is 7.0 feet away. [MAN] TYRESE SIMONS MAKES IT! Assist: Domantas Lowry
Score: 37-33

[08:28] Team_009 possession (Score: 37-33)
Evan Curry attempts a Layup. Heavily contested by Domantas Lowry (0.5 feet, MAN)! Evan Curry misses. Rebound secured by Shai Quickley.

[08:14] Team_069 possession (Score: 37-33)
Devin Giddey attempts a 3Pt. Wide open! Kawhi Herro is 7.0 feet away. [MAN] Devin Giddey misses. Rebound secured by Kawhi Herro.

[07:55] Team_009 possession (Score: 37-33)
Kawhi Herro attempts a 3Pt. Contested by Devin Giddey (5.7 feet, MAN). Kawhi Herro misses. Rebound secured by Tyrese Simons.

[07:45] Team_069 possession (Score: 37-33)
Jarrett Murray attempts a Midrange. Contested by Kawhi Herro (2.5 feet, ZONE). Jarrett Murray misses. Rebound secured by RJ Jokic.

[07:32] Team_009 possession (Score: 37-33)
Evan Curry attempts a 3Pt. Contested by Domantas Lowry (3.8 feet, MAN). Evan Curry misses. Offensive rebound by Shaquille Green! Shaquille Green kicks it out.

[07:17] Team_009 possession (Score: 37-33)
FOUL! Shooting foul on Jarrett Murray. Paul Trent to the line for 2 free throws. [Team fouls: 3] (Jarrett Murray: 2 personal fouls)   FT 1/2: MISS   FT 2/2: GOOD Paul Trent makes 1/2 from the line.
Score: 37-34

[07:03] Team_069 possession (Score: 37-34)
Jarrett Murray attempts a 3Pt. Contested by Paul Trent (3.4 feet, MAN). Jarrett Murray misses. Rebound secured by Kawhi Herro.

[06:52] Team_009 possession (Score: 37-34)
RJ Jokic attempts a Midrange. Contested by Devin Giddey (3.8 feet, ZONE). RJ Jokic misses. Rebound secured by Shai Quickley.

[06:42] Team_069 possession (Score: 37-34)
Tyrese Simons attempts a 3Pt. Heavily contested by RJ Jokic (0.5 feet, MAN)! Tyrese Simons misses. Rebound secured by RJ Jokic.

[06:31] Team_009 possession (Score: 37-34)
Shaquille Green attempts a Midrange. Wide open! Tyrese Simons is 6.8 feet away. [ZONE] Shaquille Green misses. Rebound secured by Tyrese Simons.

[06:16] Team_069 possession (Score: 37-34)
Jarrett Murray drives and kicks out. Tyrese Simons attempts a 3Pt. Contested by Paul Trent (5.8 feet, ZONE). Tyrese Simons misses. Rebound secured by Kawhi Herro.

[06:04] Team_009 possession (Score: 37-34)
Evan Curry attempts a Midrange. Contested by Devin Giddey (2.1 feet, ZONE). Evan Curry misses. Rebound secured by Tyrese Simons.

[05:49] Team_069 possession (Score: 37-34)
Domantas Lowry attempts a 3Pt. Wide open! Evan Curry is 6.5 feet away. [MAN] Domantas Lowry misses. Offensive rebound by Shai Quickley! Shai Quickley puts it back in!
Score: 39-34

[05:38] Team_009 possession (Score: 39-34)
RJ Jokic attempts a 3Pt. Wide open! Tyrese Simons is 8.9 feet away. [ZONE] RJ Jokic misses. Rebound secured by Shai Quickley.

[05:25] Team_069 possession (Score: 39-34)
Jarrett Murray attempts a 3Pt. Wide open! Paul Trent is 8.0 feet away. [ZONE] JARRETT MURRAY MAKES IT! Assist: Domantas Lowry
Score: 42-34

[05:07] Team_009 possession (Score: 42-34)
RJ Jokic attempts a Midrange. Contested by Tyrese Simons (3.4 feet, MAN). RJ Jokic misses. Rebound secured by Shai Quickley.

[04:51] Team_069 possession (Score: 42-34)
Jarrett Murray attempts a 3Pt. Wide open! Paul Trent is 8.1 feet away. [ZONE] JARRETT MURRAY MAKES IT! Assist: Domantas Lowry
Score: 45-34

[04:38] Team_009 possession (Score: 45-34)
RJ Jokic drives and kicks out. Shaquille Green attempts a Midrange. Contested by Tyrese Simons (3.1 feet, ZONE). SHAQUILLE GREEN MAKES IT! Assist: Paul Trent
Score: 45-36

[04:25] Team_069 possession (Score: 45-36)
Shai Quickley attempts a Layup. BLOCKED BY SHAQUILLE GREEN! Ball is loose! Offensive rebound by Shai Quickley! Shai Quickley kicks it out.

[04:06] Team_069 possession (Score: 45-36)
Tyrese Simons attempts a 3Pt. Contested by RJ Jokic (5.6 feet, MAN). TYRESE SIMONS MAKES IT! Assist: Jarrett Murray
Score: 48-36

[03:51] Team_009 possession (Score: 48-36)
Shaquille Green drives, Shai Quickley stays with him. Shaquille Green attempts a Layup. Wide open! Shai Quickley is 7.3 feet away. [ZONE] Shaquille Green misses. Rebound secured by Shai Quickley.

[03:32] Team_069 possession (Score: 48-36)
Shai Quickley drives, Shaquille Green stays with him. Shai Quickley attempts a Dunk. Contested by Shaquille Green (4.2 feet, MAN). Shai Quickley misses. Rebound secured by Kawhi Herro.

[03:18] Team_009 possession (Score: 48-36)
RJ Jokic throws a bad pass! Stolen by Tyrese Simons! TURNOVER! (live ball)

[03:02] Team_069 possession (Score: 48-36)
FOUL! Shooting foul on Kawhi Herro. Devin Giddey to the line for 2 free throws. [Team fouls: 2] (Kawhi Herro: 2 personal fouls)   FT 1/2: GOOD   FT 2/2: GOOD Devin Giddey makes 2/2 from the line.
Score: 50-36

[02:46] Team_009 possession (Score: 50-36)
FOUL! Offensive foul on Evan Curry! Domantas Lowry drew the charge! [Team fouls: 3] (Evan Curry: 2 personal fouls) TURNOVER! (dead ball)

[02:46] Substitution (Team_069): Domantas Lowry OUT → Trae Antetokounmpo IN (stamina_rule2)

[02:31] Team_069 possession (Score: 50-36)
Tyrese Simons attempts a 3Pt. Contested by RJ Jokic (3.4 feet, MAN). TYRESE SIMONS MAKES IT! Assist: Trae Antetokounmpo
Score: 53-36

[02:22] Team_009 possession (Score: 53-36)
RJ Jokic attempts a 3Pt. Contested by Tyrese Simons (4.5 feet, ZONE). RJ Jokic misses. Rebound secured by Trae Antetokounmpo.

[02:11] Team_069 possession (Score: 53-36)
Tyrese Simons attempts a 3Pt. Contested by Paul Trent (4.2 feet, ZONE). Tyrese Simons misses. Rebound secured by Kawhi Herro.

[01:57] Team_009 possession (Score: 53-36)
Evan Curry attempts a 3Pt. Contested by Tyrese Simons (5.4 feet, ZONE). EVAN CURRY MAKES IT! Assist: Paul Trent
Score: 53-39

[01:43] Team_069 possession (Score: 53-39)
Jarrett Murray attempts a Midrange. Wide open! Paul Trent is 7.1 feet away. [MAN] JARRETT MURRAY MAKES IT! Assist: Tyrese Simons
Score: 55-39

[01:30] Team_009 possession (Score: 55-39)
Shaquille Green drives to the basket... Shaquille Green commits a violation (traveling/carry)! TURNOVER! (dead ball)

[01:30] Substitution (Team_009): Paul Trent OUT → Miles Sabonis IN (starter_return_rule1)

[01:30] Substitution (Team_009): RJ Jokic OUT → Anfernee Anunoby IN (starter_return_rule1)

[01:14] Team_069 possession (Score: 55-39)
Shai Quickley attempts a Midrange. BLOCKED BY SHAQUILLE GREEN! Ball is loose! Rebound secured by Shaquille Green.

[01:01] Team_009 possession (Score: 55-39)
Evan Curry attempts a 3Pt. Contested by Tyrese Simons (4.7 feet, ZONE). EVAN CURRY MAKES IT! Assist: Anfernee Anunoby
Score: 55-42

[00:47] Team_069 possession (Score: 55-42)
Tyrese Simons drives to the basket... Tyrese Simons throws a bad pass out of bounds! TURNOVER! (dead ball)

[00:47] Substitution (Team_069): Jarrett Murray OUT → James Sexton IN (starter_return_rule1)

[00:38] Team_009 possession (Score: 55-42)
FOUL! Holding foul on Devin Giddey. [Team fouls: 4] No free throws, side out. (Devin Giddey: 2 personal fouls)

[00:38] Substitution (Team_069): Shai Quickley OUT → CJ Fox IN (starter_return_rule1)

[00:38] Substitution (Team_009): Shaquille Green OUT → Kyle Brogdon IN (starter_return_rule1)

[00:25] Team_009 possession (Score: 55-42)
Kyle Brogdon attempts a Midrange. Wide open! Trae Antetokounmpo is 7.8 feet away. [ZONE] KYLE BROGDON MAKES IT! Assist: Anfernee Anunoby
Score: 55-44

[00:08] Team_069 possession (Score: 55-44)
FOUL! Shooting foul on Evan Curry. Trae Antetokounmpo to the line for 2 free throws. [Team fouls: 4] (Evan Curry: 3 personal fouls)   FT 1/2: GOOD   FT 2/2: GOOD Trae Antetokounmpo makes 2/2 from the line.
Score: 57-44

================================================================================
                              2ND QUARTER COMPLETE                              
================================================================================

2ND QUARTER SCORE: Team_069 32, Team_009 20

BOX SCORE:
================================================================================

Team_069
--------------------------------------------------------------------------------
Player                MIN  PTS  REB  AST  TO      FG   FG%      3P   3P%
--------------------------------------------------------------------------------
Jarrett Murray         13   10    0    2   0   4/8    50.0     0/0   0.0
Shai Quickley          12    9    8    1   0   4/6    66.7     0/0   0.0
Tyrese Simons          13    9    6    1   0   3/5    60.0     0/0   0.0
Devin Giddey           13    2    0    0   0   1/2    50.0     0/0   0.0
Trae Antetokounmpo      3    2    1    1   0   1/1   100.0     0/0   0.0
Domantas Lowry         22    0    0    3   0   0/0     0.0     0/0   0.0

TEAM: FG: 13/22 (59.1%), 3PT: 7/11 (63.6%), REB: 15 (5 off, 10 def), AST: 8, TO: 1
TEAM FOULS: 4


Team_009
--------------------------------------------------------------------------------
Player                MIN  PTS  REB  AST  TO      FG   FG%      3P   3P%
--------------------------------------------------------------------------------
Evan Curry             13    6    0    0   0   2/4    50.0     0/0   0.0
Paul Trent             12    3    0    2   0   2/3    66.7     0/0   0.0
Kawhi Herro            13    3    6    0   0   1/2    50.0     0/0   0.0
Shaquille Green        13    2    3    2   0   1/3    33.3     0/0   0.0
Kyle Brogdon           11    2    0    0   0   1/1   100.0     0/0   0.0
RJ Jokic               12    0    2    0   0   0/4     0.0     0/0   0.0
Anfernee Anunoby       12    0    0    2   0   0/0     0.0     0/0   0.0

TEAM: FG: 7/17 (41.2%), 3PT: 3/7 (42.9%), REB: 11 (2 off, 9 def), AST: 6, TO: 5
TEAM FOULS: 4

================================================================================

================================================================================
                       3RD QUARTER - Team_069 vs Team_009                       
================================================================================

[12:00] Team_069 possession (Score: 57-44)
CJ Fox attempts a 3Pt. Heavily contested by Kawhi Herro (0.5 feet, MAN)! CJ FOX MAKES IT! Assist: Trae Antetokounmpo
Score: 60-44

[11:45] Team_009 possession (Score: 60-44)
Miles Sabonis drives, Devin Giddey stays with him. Miles Sabonis attempts a Dunk. Contested by Devin Giddey (4.8 feet, ZONE). Miles Sabonis misses. Rebound secured by Tyrese Simons.

[11:33] Team_069 possession (Score: 60-44)
CJ Fox throws a bad pass! Stolen by Kawhi Herro! TURNOVER! (live ball)

[11:20] Team_009 possession (Score: 60-44)
Kyle Brogdon throws a bad pass! Stolen by CJ Fox! TURNOVER! (live ball)

[11:08] Team_069 possession (Score: 60-44)
Trae Antetokounmpo attempts a 3Pt. Contested by Miles Sabonis (4.1 feet, ZONE). Trae Antetokounmpo misses. Rebound secured by Anfernee Anunoby.

[10:55] Team_009 possession (Score: 60-44)
Kawhi Herro drives, picks up Devin Giddey. Help arrives from James Sexton! Kawhi Herro attempts a Dunk. Contested by James Sexton (5.0 feet, MAN). KAWHI HERRO MAKES IT! Assist: Anfernee Anunoby
Score: 60-46

[10:42] Team_069 possession (Score: 60-46)
James Sexton attempts a 3Pt. Wide open! Kawhi Herro is 7.5 feet away. [ZONE] James Sexton misses. Offensive rebound by CJ Fox! CJ Fox kicks it out.

[10:23] Team_069 possession (Score: 60-46)
Trae Antetokounmpo attempts a 3Pt. Wide open! Miles Sabonis is 6.4 feet away. [ZONE] Trae Antetokounmpo misses. Offensive rebound by CJ Fox! CJ Fox kicks it out.

[10:10] Team_069 possession (Score: 60-46)
James Sexton drives and kicks out. FOUL! Shooting foul on Anfernee Anunoby. Tyrese Simons to the line for 3 free throws. [Team fouls: 1] (Anfernee Anunoby: 3 personal fouls)   FT 1/3: GOOD   FT 2/3: MISS   FT 3/3: MISS Tyrese Simons makes 1/3 from the line. Rebound secured by Anfernee Anunoby.
Score: 61-46

[09:56] Team_009 possession (Score: 61-46)
Kawhi Herro attempts a 3Pt. Heavily contested by James Sexton (1.1 feet, ZONE)! Kawhi Herro misses. Rebound secured by Tyrese Simons.

[09:44] Team_069 possession (Score: 61-46)
Devin Giddey attempts a 3Pt. Wide open! Kawhi Herro is 7.4 feet away. [MAN] Devin Giddey misses. Rebound secured by Kyle Brogdon.

[09:29] Team_009 possession (Score: 61-46)
Kyle Brogdon attempts a Layup. Contested by Devin Giddey (4.3 feet, ZONE). KYLE BROGDON MAKES IT! Assist: Anfernee Anunoby
Score: 61-48

[09:17] Team_069 possession (Score: 61-48)
CJ Fox attempts a Layup. Heavily contested by Kawhi Herro (2.0 feet, ZONE)! CJ FOX MAKES IT! Assist: Devin Giddey
Score: 63-48

[09:04] Team_009 possession (Score: 63-48)
Miles Sabonis attempts a 3Pt. Contested by James Sexton (3.7 feet, ZONE). Miles Sabonis misses. Rebound secured by James Sexton.

[08:50] Team_069 possession (Score: 63-48)
FOUL! Shooting foul on Kawhi Herro. CJ Fox to the line for 2 free throws. [Team fouls: 2] (Kawhi Herro: 3 personal fouls)   FT 1/2: GOOD   FT 2/2: GOOD CJ Fox makes 2/2 from the line.
Score: 65-48

[08:37] Team_009 possession (Score: 65-48)
FOUL! Holding foul on Devin Giddey. [Team fouls: 1] No free throws, side out. (Devin Giddey: 3 personal fouls)

[08:22] Team_009 possession (Score: 65-48)
Miles Sabonis drives and kicks out. Kawhi Herro attempts a 3Pt. Wide open! Devin Giddey is 8.0 feet away. [MAN] Kawhi Herro misses. Rebound secured by Tyrese Simons.

[08:08] Team_069 possession (Score: 65-48)
CJ Fox attempts a Layup. Contested by Kawhi Herro (2.2 feet, MAN). CJ Fox misses. Rebound secured by Anfernee Anunoby.

[07:56] Team_009 possession (Score: 65-48)
Anfernee Anunoby attempts a 3Pt. Contested by Tyrese Simons (5.4 feet, MAN). ANFERNEE ANUNOBY MAKES IT! Assist: Evan Curry
Score: 65-51

[07:43] Team_069 possession (Score: 65-51)
FOUL! Shooting foul on Kawhi Herro. Devin Giddey to the line for 2 free throws. [Team fouls: 3] (Kawhi Herro: 4 personal fouls)   FT 1/2: GOOD   FT 2/2: MISS Devin Giddey makes 1/2 from the line. Rebound secured by Kawhi Herro.
Score: 66-51

[07:31] Team_009 possession (Score: 66-51)
Kawhi Herro drives, Devin Giddey stays with him. Kawhi Herro attempts a Dunk. Contested by Devin Giddey (3.7 feet, MAN). KAWHI HERRO MAKES IT! Assist: Evan Curry
Score: 66-53

[07:16] Team_069 possession (Score: 66-53)
Trae Antetokounmpo drives, Kawhi Herro stays with him. Trae Antetokounmpo attempts a Layup. Contested by Kawhi Herro (2.7 feet, ZONE). TRAE ANTETOKOUNMPO MAKES IT! Assist: James Sexton
Score: 68-53

[07:03] Team_009 possession (Score: 68-53)
Evan Curry attempts a 3Pt. Contested by James Sexton (4.3 feet, ZONE). Evan Curry misses. Offensive rebound by Kawhi Herro! Kawhi Herro's putback is no good. Rebound secured by Tyrese Simons.

[06:46] Team_069 possession (Score: 68-53)
Devin Giddey attempts a Midrange. Contested by Kawhi Herro (2.9 feet, MAN). Devin Giddey misses. FOUL! Loose ball foul on Kyle Brogdon during the rebound battle. [Team fouls: 4] No free throws, side out. (Kyle Brogdon: 2 personal fouls)

[06:34] Team_069 possession (Score: 68-53)
Tyrese Simons attempts a 3Pt. Wide open! Kawhi Herro is 6.8 feet away. [ZONE] Tyrese Simons misses. Rebound secured by Anfernee Anunoby.

[06:20] Team_009 possession (Score: 68-53)
FOUL! Reach-in foul on Devin Giddey during the drive. [Team fouls: 2] No free throws, side out. (Devin Giddey: 4 personal fouls)

[06:06] Team_009 possession (Score: 68-53)
Evan Curry attempts a Layup. Contested by Devin Giddey (2.5 feet, ZONE). Evan Curry misses. Rebound secured by CJ Fox.

[05:50] Team_069 possession (Score: 68-53)
Devin Giddey attempts a Midrange. Contested by Miles Sabonis (3.4 feet, ZONE). Devin Giddey misses. Rebound secured by Anfernee Anunoby.

[05:36] Team_009 possession (Score: 68-53)
Miles Sabonis attempts a 3Pt. Contested by James Sexton (3.9 feet, ZONE). MILES SABONIS MAKES IT! Assist: Evan Curry
Score: 68-56

[05:22] Team_069 possession (Score: 68-56)
CJ Fox drives and kicks out. Tyrese Simons attempts a 3Pt. Contested by Miles Sabonis (4.1 feet, ZONE). Tyrese Simons misses. Rebound secured by Anfernee Anunoby.

[05:09] Team_009 possession (Score: 68-56)
Kawhi Herro drives and kicks out. Kyle Brogdon attempts a Midrange. Wide open! Tyrese Simons is 7.7 feet away. [ZONE] KYLE BROGDON MAKES IT! Assist: Kawhi Herro
Score: 68-58

[04:59] Team_069 possession (Score: 68-58)
James Sexton loses the ball! Stripped by Miles Sabonis! TURNOVER! (live ball)

[04:44] Team_009 possession (Score: 68-58)
Miles Sabonis attempts a Midrange. Contested by James Sexton (4.1 feet, ZONE). Miles Sabonis misses. Rebound secured by CJ Fox.

[04:34] Team_069 possession (Score: 68-58)
James Sexton drives and kicks out. James Sexton attempts a 3Pt. Wide open! Miles Sabonis is 7.4 feet away. [MAN] James Sexton misses. Rebound secured by Kawhi Herro.

[04:17] Team_009 possession (Score: 68-58)
Anfernee Anunoby drives, Devin Giddey stays with him. Anfernee Anunoby attempts a Dunk. Contested by Devin Giddey (3.1 feet, ZONE). ANFERNEE ANUNOBY MAKES IT!
Score: 68-60

[04:00] Team_069 possession (Score: 68-60)
Tyrese Simons attempts a 3Pt. Wide open! Anfernee Anunoby is 6.2 feet away. [MAN] Tyrese Simons misses. Rebound secured by Anfernee Anunoby.

[03:45] Team_009 possession (Score: 68-60)
FOUL! Holding foul on Devin Giddey. [Team fouls: 3] No free throws, side out. (Devin Giddey: 5 personal fouls)

[03:45] Substitution (Team_069): James Sexton OUT → Domantas Lowry IN (starter_return_rule1)

[03:45] Substitution (Team_069): Tyrese Simons OUT → Pau Middleton IN (starter_return_rule1)

[03:45] Substitution (Team_069): Devin Giddey OUT → Domantas Towns IN (starter_return_rule1)

[03:45] Substitution (Team_009): Miles Sabonis OUT → Desmond Harden IN (starter_return_rule1)

[03:45] Substitution (Team_009): Anfernee Anunoby OUT → Cole Mitchell IN (starter_return_rule1)

[03:31] Team_009 possession (Score: 68-60)
Cole Mitchell throws a bad pass! Stolen by Domantas Towns! TURNOVER! (live ball)

[03:15] Team_069 possession (Score: 68-60)
Domantas Towns attempts a Midrange. Contested by Kawhi Herro (4.9 feet, MAN). Domantas Towns misses. Rebound secured by Cole Mitchell.

[03:00] Team_009 possession (Score: 68-60)
Kawhi Herro attempts a 3Pt. Contested by Domantas Towns (5.0 feet, MAN). Kawhi Herro misses. Rebound secured by CJ Fox.

[02:47] Team_069 possession (Score: 68-60)
Domantas Lowry makes the Midrange and draws the foul on Evan Curry! And-1! Domantas Lowry to the line for 1. [BONUS: 5 team fouls] (Evan Curry: 4 personal fouls)   FT 1/1: GOOD Domantas Lowry makes 1/1 from the line.
Score: 71-60

[02:31] Team_009 possession (Score: 71-60)
Cole Mitchell attempts a Layup. Contested by Domantas Towns (4.6 feet, MAN). COLE MITCHELL MAKES IT!
Score: 71-62

[02:17] Team_069 possession (Score: 71-62)
FOUL! Reach-in foul on Kawhi Herro during the drive. [IN THE BONUS! 6 team fouls] Domantas Towns to the line for 2 free throws. (Kawhi Herro: 5 personal fouls)   FT 1/2: GOOD   FT 2/2: GOOD Domantas Towns makes 2/2 from the line.
Score: 73-62

[02:05] Team_009 possession (Score: 73-62)
Cole Mitchell loses control! Ball rolls out of bounds! TURNOVER! (dead ball)

[02:05] Substitution (Team_009): Kyle Brogdon OUT → Shaquille Green IN (stamina_rule2)

[01:52] Team_069 possession (Score: 73-62)
CJ Fox attempts a Midrange. Wide open! Shaquille Green is 6.2 feet away. [MAN] CJ FOX MAKES IT!
Score: 75-62

[01:36] Team_009 possession (Score: 75-62)
Cole Mitchell drives, picks up Domantas Towns. Help arrives from Domantas Lowry! Cole Mitchell attempts a Dunk. Contested by Domantas Lowry (4.0 feet, MAN). COLE MITCHELL MAKES IT! Assist: Desmond Harden
Score: 75-64

[01:21] Team_069 possession (Score: 75-64)
FOUL! Reach-in foul on Cole Mitchell during the drive. [IN THE BONUS! 7 team fouls] Pau Middleton to the line for 2 free throws. (Cole Mitchell: 1 personal fouls)   FT 1/2: MISS   FT 2/2: GOOD Pau Middleton makes 1/2 from the line.
Score: 76-64

[01:08] Team_009 possession (Score: 76-64)
Desmond Harden attempts a 3Pt. Contested by Domantas Lowry (4.9 feet, MAN). Desmond Harden misses. Rebound secured by Domantas Towns.

[00:49] Team_069 possession (Score: 76-64)
Trae Antetokounmpo attempts a 3Pt. Wide open! Cole Mitchell is 7.8 feet away. [ZONE] Trae Antetokounmpo misses. Rebound secured by Shaquille Green.

[00:37] Team_009 possession (Score: 76-64)
Shaquille Green attempts a Midrange. Wide open! Trae Antetokounmpo is 8.1 feet away. [ZONE] SHAQUILLE GREEN MAKES IT!
Score: 76-66

[00:22] Team_069 possession (Score: 76-66)
Domantas Towns attempts a Layup. Wide open! Kawhi Herro is 6.1 feet away. [ZONE] DOMANTAS TOWNS MAKES IT!
Score: 78-66

[00:10] Team_009 possession (Score: 78-66)
Desmond Harden attempts a 3Pt. Contested by Pau Middleton (4.2 feet, ZONE). Desmond Harden misses. Rebound secured by CJ Fox.

================================================================================
                              3RD QUARTER COMPLETE                              
================================================================================

3RD QUARTER SCORE: Team_069 21, Team_009 22

BOX SCORE:
================================================================================

Team_069
--------------------------------------------------------------------------------
Player                MIN  PTS  REB  AST  TO      FG   FG%      3P   3P%
--------------------------------------------------------------------------------
CJ Fox                 25    9    7    0   0   4/6    66.7     0/0   0.0
Domantas Towns         15    4    1    0   0   2/3    66.7     0/0   0.0
Domantas Lowry         25    3    0    0   0   1/1   100.0     0/0   0.0
Trae Antetokounmpo     15    2    0    1   0   1/3    33.3     0/0   0.0
Pau Middleton          15    1    0    0   0   1/1   100.0     0/0   0.0
Tyrese Simons          22    0    4    0   0   0/2     0.0     0/0   0.0
James Sexton           20    0    1    1   0   0/2     0.0     0/0   0.0
Devin Giddey           22    0    0    1   0   0/3     0.0     0/0   0.0

TEAM: FG: 9/21 (42.9%), 3PT: 1/6 (16.7%), REB: 12 (3 off, 9 def), AST: 3, TO: 2
TEAM FOULS: 3


Team_009
--------------------------------------------------------------------------------
Player                MIN  PTS  REB  AST  TO      FG   FG%      3P   3P%
--------------------------------------------------------------------------------
Anfernee Anunoby       21    5    7    2   0   2/2   100.0     0/0   0.0
Kawhi Herro            25    4    2    1   0   2/4    50.0     0/0   0.0
Kyle Brogdon           22    4    1    0   0   2/2   100.0     0/0   0.0
Cole Mitchell          15    4    1    0   0   2/2   100.0     0/0   0.0
Miles Sabonis          21    3    0    0   0   1/5    20.0     0/0   0.0
Shaquille Green        15    2    1    0   0   1/1   100.0     0/0   0.0
Evan Curry             25    0    0    3   0   0/2     0.0     0/0   0.0
Desmond Harden         15    0    0    1   0   0/2     0.0     0/0   0.0

TEAM: FG: 10/20 (50.0%), 3PT: 2/8 (25.0%), REB: 13 (1 off, 12 def), AST: 7, TO: 3
TEAM FOULS: 7 [Team_069 in BONUS]

================================================================================

================================================================================
                       4TH QUARTER - Team_069 vs Team_009                       
================================================================================

[12:00] Team_069 possession (Score: 78-66)
CJ Fox attempts a 3Pt. Heavily contested by Shaquille Green (0.7 feet, MAN)! CJ FOX MAKES IT! Assist: Trae Antetokounmpo
Score: 81-66

[11:45] Team_009 possession (Score: 81-66)
Desmond Harden drives, Domantas Towns stays with him. Desmond Harden attempts a Dunk. Contested by Domantas Towns (4.3 feet, ZONE). Desmond Harden misses. Rebound secured by Pau Middleton.

[11:33] Team_069 possession (Score: 81-66)
CJ Fox throws a bad pass! Stolen by Shaquille Green! TURNOVER! (live ball)

[11:20] Team_009 possession (Score: 81-66)
Kawhi Herro throws a bad pass! Stolen by Domantas Towns! TURNOVER! (live ball)

[11:08] Team_069 possession (Score: 81-66)
Trae Antetokounmpo attempts a 3Pt. Contested by Cole Mitchell (3.2 feet, ZONE). Trae Antetokounmpo misses. Rebound secured by Shaquille Green.

[10:55] Team_009 possession (Score: 81-66)
Kawhi Herro drives, picks up Domantas Towns. Help arrives from Domantas Lowry! Kawhi Herro attempts a Dunk. Contested by Domantas Lowry (4.3 feet, MAN). KAWHI HERRO MAKES IT! Assist: Evan Curry
Score: 81-68

[10:42] Team_069 possession (Score: 81-68)
Domantas Lowry attempts a 3Pt. Wide open! Kawhi Herro is 7.2 feet away. [ZONE] DOMANTAS LOWRY MAKES IT!
Score: 84-68

[10:27] Team_009 possession (Score: 84-68)
FOUL! Shooting foul on Domantas Towns. Desmond Harden to the line for 2 free throws. [Team fouls: 1] (Domantas Towns: 4 personal fouls)   FT 1/2: MISS   FT 2/2: GOOD Desmond Harden makes 1/2 from the line.
Score: 84-69

[10:14] Team_069 possession (Score: 84-69)
Domantas Lowry attempts a Layup. BLOCKED BY DESMOND HARDEN! Ball deflects out of bounds off Domantas Lowry.

[10:14] Substitution (Team_069): CJ Fox OUT → Shai Quickley IN (stamina_rule2)

[10:01] Team_009 possession (Score: 84-69)
Shaquille Green attempts a Midrange. Contested by Pau Middleton (3.4 feet, ZONE). Shaquille Green misses. Rebound secured by Domantas Towns.

[09:47] Team_069 possession (Score: 84-69)
FOUL! Shooting foul on Kawhi Herro. Pau Middleton to the line for 2 free throws. [Team fouls: 1] (Kawhi Herro: 6 personal fouls) Kawhi Herro FOULS OUT!   FT 1/2: GOOD   FT 2/2: GOOD Pau Middleton makes 2/2 from the line.
Score: 86-69

[09:47] Substitution (Team_009): Kawhi Herro OUT (stamina: 68) → Miles Sabonis IN (foul_out)

[09:29] Team_009 possession (Score: 86-69)
Evan Curry drives and kicks out. FOUL! Shooting foul on Domantas Lowry. Desmond Harden to the line for 2 free throws. [Team fouls: 2] (Domantas Lowry: 2 personal fouls)   FT 1/2: GOOD   FT 2/2: GOOD Desmond Harden makes 2/2 from the line.
Score: 86-71

[09:16] Team_069 possession (Score: 86-71)
Trae Antetokounmpo drives to the basket... Trae Antetokounmpo loses the ball! Stripped by Cole Mitchell! TURNOVER! (live ball)

[09:02] Team_009 possession (Score: 86-71)
Cole Mitchell attempts a Midrange. Contested by Trae Antetokounmpo (4.3 feet, ZONE). COLE MITCHELL MAKES IT! Assist: Desmond Harden
Score: 86-73

[08:47] Team_069 possession (Score: 86-73)
Pau Middleton attempts a 3Pt. Contested by Miles Sabonis (4.4 feet, ZONE). Pau Middleton misses. Rebound secured by Shaquille Green.

[08:33] Team_009 possession (Score: 86-73)
Desmond Harden attempts a Midrange. Contested by Domantas Lowry (3.2 feet, MAN). Desmond Harden misses. Rebound secured by Shai Quickley.

[08:17] Team_069 possession (Score: 86-73)
Shai Quickley drives and kicks out. Domantas Towns attempts a Midrange. Contested by Evan Curry (4.4 feet, ZONE). DOMANTAS TOWNS MAKES IT!
Score: 88-73

[08:07] Team_009 possession (Score: 88-73)
Cole Mitchell drives, picks up Domantas Towns. Help arrives from Domantas Lowry! Cole Mitchell attempts a Dunk. Contested by Domantas Lowry (5.8 feet, ZONE). Cole Mitchell misses. Rebound secured by Pau Middleton.

[07:55] Team_069 possession (Score: 88-73)
Pau Middleton attempts a Layup. Contested by Cole Mitchell (4.8 feet, MAN). PAU MIDDLETON MAKES IT!
Score: 90-73

[07:39] Team_009 possession (Score: 90-73)
Miles Sabonis attempts a 3Pt. Contested by Domantas Lowry (5.0 feet, MAN). MILES SABONIS MAKES IT! Assist: Evan Curry
Score: 90-76

[07:24] Team_069 possession (Score: 90-76)
Domantas Lowry loses control! Ball rolls out of bounds! TURNOVER! (dead ball)

[07:24] Substitution (Team_069): Pau Middleton OUT → Tyrese Simons IN (stamina_rule2)

[07:24] Substitution (Team_069): Domantas Towns OUT → Devin Giddey IN (stamina_rule2)

[07:12] Team_009 possession (Score: 90-76)
Evan Curry attempts a 3Pt. Wide open! Tyrese Simons is 7.0 feet away. [ZONE] Evan Curry misses. Rebound secured by Shai Quickley.

[06:56] Team_069 possession (Score: 90-76)
Domantas Lowry attempts a Midrange. Wide open! Desmond Harden is 7.4 feet away. [ZONE] Domantas Lowry misses. Rebound secured by Cole Mitchell.

[06:40] Team_009 possession (Score: 90-76)
Miles Sabonis attempts a 3Pt. Wide open! Domantas Lowry is 8.3 feet away. [MAN] Miles Sabonis misses. Rebound secured by Domantas Lowry.

[06:24] Team_069 possession (Score: 90-76)
Devin Giddey drives, picks up Cole Mitchell. Help arrives from Desmond Harden! Devin Giddey attempts a Dunk. Wide open! Desmond Harden is 6.7 feet away. [ZONE] DEVIN GIDDEY MAKES IT! Assist: Trae Antetokounmpo
Score: 92-76

[06:06] Team_009 possession (Score: 92-76)
Shaquille Green attempts a Midrange. Wide open! Trae Antetokounmpo is 7.5 feet away. [ZONE] Shaquille Green misses. Rebound secured by Tyrese Simons.

[05:56] Team_069 possession (Score: 92-76)
Shai Quickley throws a bad pass out of bounds! TURNOVER! (dead ball)

[05:56] Substitution (Team_009): Desmond Harden OUT → Paul Trent IN (stamina_rule2)

[05:56] Substitution (Team_009): Cole Mitchell OUT → RJ Jokic IN (stamina_rule2)

[05:44] Team_009 possession (Score: 92-76)
Paul Trent attempts a Midrange. Contested by Domantas Lowry (4.9 feet, ZONE). Paul Trent misses. Rebound secured by Tyrese Simons.

[05:28] Team_069 possession (Score: 92-76)
Trae Antetokounmpo attempts a Midrange. Contested by RJ Jokic (5.0 feet, ZONE). Trae Antetokounmpo misses. Rebound secured by Shaquille Green.

[05:15] Team_009 possession (Score: 92-76)
Evan Curry attempts a 3Pt. Contested by Tyrese Simons (5.8 feet, ZONE). Evan Curry misses. Rebound secured by Shai Quickley.

[04:56] Team_069 possession (Score: 92-76)
Trae Antetokounmpo attempts a Midrange. Contested by Shaquille Green (3.1 feet, ZONE). Trae Antetokounmpo misses. Offensive rebound by Tyrese Simons! Tyrese Simons kicks it out.

[04:39] Team_069 possession (Score: 92-76)
Tyrese Simons attempts a 3Pt. Contested by Miles Sabonis (3.9 feet, ZONE). TYRESE SIMONS MAKES IT! Assist: Domantas Lowry
Score: 95-76

[04:28] Team_009 possession (Score: 95-76)
Miles Sabonis drives and kicks out. Miles Sabonis attempts a 3Pt. Wide open! Devin Giddey is 6.7 feet away. [ZONE] Miles Sabonis misses. Offensive rebound by Shaquille Green! Shaquille Green kicks it out.

[04:13] Team_009 possession (Score: 95-76)
RJ Jokic attempts a 3Pt. Contested by Domantas Lowry (4.7 feet, ZONE). RJ JOKIC MAKES IT! Assist: Shaquille Green
Score: 95-79

[04:02] Team_069 possession (Score: 95-79)
Devin Giddey attempts a 3Pt. Wide open! Miles Sabonis is 7.6 feet away. [ZONE] Devin Giddey misses. Rebound secured by Miles Sabonis.

[03:53] Team_009 possession (Score: 95-79)
Shot clock violation! Paul Trent couldn't get a shot off in time! TURNOVER! (dead ball)

[03:53] Substitution (Team_069): Domantas Lowry OUT → James Sexton IN (starter_return_rule1)

[03:53] Substitution (Team_009): Miles Sabonis OUT → Anfernee Anunoby IN (stamina_rule2)

[03:40] Team_069 possession (Score: 95-79)
Trae Antetokounmpo attempts a Midrange. Contested by Evan Curry (4.8 feet, ZONE). TRAE ANTETOKOUNMPO MAKES IT! Assist: Tyrese Simons
Score: 97-79

[03:27] Team_009 possession (Score: 97-79)
Shaquille Green drives and kicks out. Paul Trent attempts a 3Pt. Contested by James Sexton (5.6 feet, ZONE). PAUL TRENT MAKES IT! Assist: Anfernee Anunoby
Score: 97-82

[03:13] Team_069 possession (Score: 97-82)
Shai Quickley attempts a Layup. BLOCKED BY SHAQUILLE GREEN! Ball deflects out of bounds off Shai Quickley.

[03:01] Team_009 possession (Score: 97-82)
Shaquille Green attempts a Midrange. Contested by James Sexton (3.2 feet, ZONE). Shaquille Green misses. Rebound secured by James Sexton.

[02:48] Team_069 possession (Score: 97-82)
James Sexton attempts a Layup. Wide open! Paul Trent is 8.0 feet away. [MAN] JAMES SEXTON MAKES IT! Assist: Tyrese Simons
Score: 99-82

[02:33] Team_009 possession (Score: 99-82)
Evan Curry attempts a Midrange. Wide open! Trae Antetokounmpo is 8.7 feet away. [ZONE] Evan Curry misses. Rebound secured by Tyrese Simons.

[02:18] Team_069 possession (Score: 99-82)
Tyrese Simons attempts a 3Pt. Wide open! Paul Trent is 7.1 feet away. [ZONE] Tyrese Simons misses. Rebound secured by Anfernee Anunoby.

[02:07] Team_009 possession (Score: 99-82)
RJ Jokic attempts a 3Pt. Contested by Devin Giddey (5.6 feet, ZONE). RJ Jokic misses. Rebound secured by James Sexton.

[01:55] Team_069 possession (Score: 99-82)
Trae Antetokounmpo attempts a Midrange. Wide open! Evan Curry is 7.3 feet away. [MAN] TRAE ANTETOKOUNMPO MAKES IT!
Score: 101-82

[01:42] Team_009 possession (Score: 101-82)
FOUL! Holding foul on Shai Quickley. [Team fouls: 3] No free throws, side out. (Shai Quickley: 1 personal fouls)

[01:42] Substitution (Team_009): Shaquille Green OUT → Kyle Brogdon IN (starter_return_rule1)

[01:23] Team_009 possession (Score: 101-82)
FOUL! Holding foul on Shai Quickley. [Team fouls: 4] No free throws, side out. (Shai Quickley: 2 personal fouls)

[01:09] Team_009 possession (Score: 101-82)
Paul Trent attempts a Midrange. Wide open! James Sexton is 6.0 feet away. [MAN] PAUL TRENT MAKES IT!
Score: 101-84

[00:58] Team_069 possession (Score: 101-84)
James Sexton drives to the basket... James Sexton loses the ball! Stripped by Kyle Brogdon! TURNOVER! (live ball)

[00:41] Team_009 possession (Score: 101-84)
Kyle Brogdon attempts a 3Pt. Contested by James Sexton (3.1 feet, ZONE). KYLE BROGDON MAKES IT! Assist: Anfernee Anunoby
Score: 101-87

[00:27] Team_069 possession (Score: 101-87)
James Sexton attempts a 3Pt. Wide open! Paul Trent is 8.7 feet away. [ZONE] James Sexton misses. FOUL! Loose ball foul on Kyle Brogdon during the rebound battle. [Team fouls: 2] No free throws, side out. (Kyle Brogdon: 3 personal fouls)

[00:11] Team_069 possession (Score: 101-87)
FOUL! Shooting foul on Kyle Brogdon. Shai Quickley to the line for 2 free throws. [Team fouls: 3] (Kyle Brogdon: 4 personal fouls)   FT 1/2: GOOD   FT 2/2: GOOD Shai Quickley makes 2/2 from the line.
Score: 103-87

================================================================================
                              4TH QUARTER COMPLETE                              
================================================================================

4TH QUARTER SCORE: Team_069 25, Team_009 21

BOX SCORE:
================================================================================

Team_069
--------------------------------------------------------------------------------
Player                MIN  PTS  REB  AST  TO      FG   FG%      3P   3P%
--------------------------------------------------------------------------------
Trae Antetokounmpo     27    4    0    2   0   2/4    50.0     0/0   0.0
Pau Middleton          19    4    2    0   0   2/3    66.7     0/0   0.0
CJ Fox                 27    3    0    0   0   1/1   100.0     0/0   0.0
Domantas Lowry         34    3    1    1   0   1/3    33.3     0/0   0.0
Tyrese Simons          29    3    4    2   0   1/2    50.0     0/0   0.0
Domantas Towns         19    2    1    0   0   1/1   100.0     0/0   0.0
Shai Quickley          22    2    4    0   0   1/2    50.0     0/0   0.0
Devin Giddey           29    2    0    0   0   1/2    50.0     0/0   0.0
James Sexton           24    2    2    0   0   1/1   100.0     0/0   0.0

TEAM: FG: 11/19 (57.9%), 3PT: 3/7 (42.9%), REB: 14 (2 off, 12 def), AST: 5, TO: 5
TEAM FOULS: 4


Team_009
--------------------------------------------------------------------------------
Player                MIN  PTS  REB  AST  TO      FG   FG%      3P   3P%
--------------------------------------------------------------------------------
Paul Trent             18    5    0    0   0   2/3    66.7     0/0   0.0
Desmond Harden         21    3    0    1   0   2/4    50.0     0/0   0.0
Miles Sabonis          27    3    1    0   0   1/2    50.0     0/0   0.0
RJ Jokic               18    3    0    0   0   1/2    50.0     0/0   0.0
Kyle Brogdon           23    3    0    0   0   1/1   100.0     0/0   0.0
Kawhi Herro            28    2    0    0   0   1/1   100.0     0/0   0.0
Cole Mitchell          21    2    1    0   0   1/2    50.0     0/0   0.0
Shaquille Green        25    0    4    1   0   0/3     0.0     0/0   0.0
Evan Curry             37    0    0    2   0   0/3     0.0     0/0   0.0
Anfernee Anunoby       24    0    1    2   0   0/0     0.0     0/0   0.0

TEAM: FG: 9/21 (42.9%), 3PT: 3/7 (42.9%), REB: 7 (1 off, 6 def), AST: 6, TO: 2
TEAM FOULS: 3

================================================================================

================================================================================
                               FULL GAME COMPLETE                               
================================================================================

FINAL SCORE: Team_069 103, Team_009 87

SCORING BY QUARTER:
--------------------------------------------------------------------------------
Team                     Q1     Q2     Q3     Q4    FINAL
--------------------------------------------------------------------------------
Team_069                 25     32     21     25      103
Team_009                 24     20     22     21       87
--------------------------------------------------------------------------------

FULL GAME BOX SCORE:
================================================================================

Team_069
--------------------------------------------------------------------------------
Player                MIN  PTS  REB  AST  TO      FG   FG%      3P   3P%      FT STL BLK
--------------------------------------------------------------------------------
Domantas Lowry         34    9    1    5   1   4/7    57.1   3/4    75.0   1/1     0   0
Tyrese Simons          29   12   14    3   0   5/10   50.0   4/9    44.4   1/3     1   0
Devin Giddey           29    4    0    1   0   2/7    28.6   0/3     0.0   3/4     0   0
Trae Antetokounmpo     27    8    1    4   1   4/8    50.0   0/3     0.0   2/2     0   0
CJ Fox                 27   25    9    0   3  10/13   76.9   3/3   100.0   6/7     2   1
James Sexton           24    7    3    1   3   3/6    50.0   1/1   100.0   0/0     0   0
Shai Quickley          22   11   12    1   1   4/7    57.1   1/1   100.0   2/2     0   0
Pau Middleton          19    8    6    1   0   4/8    50.0   1/3    33.3   4/7     0   0
Domantas Towns         19    6    4    3   2   2/5    40.0   0/2     0.0   2/2     2   0
Jarrett Murray         13   10    0    2   1   4/8    50.0   2/3    66.7   0/0     2   0

TEAM: FG: 43/80 (53.8%), 3PT: 15/32 (46.9%), REB: 49 (12 off, 37 def), AST: 21, TO: 12


Team_009
--------------------------------------------------------------------------------
Player                MIN  PTS  REB  AST  TO      FG   FG%      3P   3P%      FT STL BLK
--------------------------------------------------------------------------------
Evan Curry             37    6    0    5   1   3/10   30.0   2/5    40.0   0/0     0   0
Kawhi Herro            28    9    8    1   2   5/8    62.5   1/4    25.0   0/0     1   0
Miles Sabonis          27    7    1    1   0   3/11   27.3   2/5    40.0   1/2     1   0
Shaquille Green        25    4    8    3   0   2/7    28.6   0/0     0.0   0/0     1   3
Anfernee Anunoby       24   10   10    8   1   4/5    80.0   2/3    66.7   2/2     0   0
Kyle Brogdon           23   15    6    0   2   6/6   100.0   1/1   100.0   0/0     3   0
Desmond Harden         21    5    0    3   1   2/6    33.3   0/2     0.0   3/4     0   1
Cole Mitchell          21   12    7    0   2   5/8    62.5   0/2     0.0   2/2     1   0
Paul Trent             18   10    0    2   3   4/6    66.7   0/1     0.0   3/5     0   0
RJ Jokic               18    5    2    0   1   3/8    37.5   1/4    25.0   0/1     0   0

TEAM: FG: 38/76 (50.0%), 3PT: 9/27 (33.3%), REB: 43 (8 off, 35 def), AST: 23, TO: 13

================================================================================
