GAME 1: Team_086 vs Team_098
====================================================================================================

================================================================================
                        FULL GAME - Team_086 vs Team_098                        
================================================================================

================================================================================
                       1ST QUARTER - Team_086 vs Team_098                       
================================================================================

[12:00] Team_086 possession (Score: 0-0)
FOUL! Shooting foul on Nikola Rose. Anfernee Harris to the line for 2 free throws. [Team fouls: 1] (Nikola Rose: 1 personal fouls)   FT 1/2: GOOD   FT 2/2: MISS Anfernee Harris makes 1/2 from the line. FOUL! Loose ball foul on Derrick Durant during the free throw rebound! [Team fouls: 2] No free throws, side out. (Derrick Durant: 1 personal fouls)
Score: 1-0

[11:45] Team_086 possession (Score: 1-0)
Rudy Rose throws a bad pass! Stolen by Derrick Durant! TURNOVER! (live ball)

[11:32] Team_098 possession (Score: 1-0)
FOUL! Offensive foul on Nikola Rose! Anfernee Harris drew the charge! [Team fouls: 3] (Nikola Rose: 2 personal fouls) TURNOVER! (dead ball)

[11:17] Team_086 possession (Score: 1-0)
Anfernee Harris attempts a Midrange. Contested by Pascal Lillard (4.0 feet, ZONE). ANFERNEE HARRIS MAKES IT!
Score: 3-0

[11:03] Team_098 possession (Score: 3-0)
Nikola Rose drives, Rudy Rose stays with him. Nikola Rose attempts a Dunk. Contested by Rudy Rose (2.7 feet, ZONE). NIKOLA ROSE MAKES IT! Assist: Derrick Durant
Score: 3-2

[10:48] Team_086 possession (Score: 3-2)
Rudy Rose drives, Pascal Lillard stays with him. Rudy Rose attempts a Layup. Contested by Pascal Lillard (2.3 feet, ZONE). RUDY ROSE MAKES IT!
Score: 5-2

[10:30] Team_098 possession (Score: 5-2)
FOUL! Shooting foul on Lauri Johnson. Blake Murray to the line for 3 free throws. [Team fouls: 1] (Lauri Johnson: 1 personal fouls)   FT 1/3: GOOD   FT 2/3: GOOD   FT 3/3: GOOD Blake Murray makes 3/3 from the line.
Score: 5-5

[10:15] Team_086 possession (Score: 5-5)
Lauri Johnson makes the Layup and draws the foul on Pascal Lillard! And-1! Lauri Johnson to the line for 1. [Team fouls: 4] (Pascal Lillard: 1 personal fouls)   FT 1/1: GOOD Lauri Johnson makes 1/1 from the line.
Score: 8-5

[10:02] Team_098 possession (Score: 8-5)
Nikola Rose attempts a Midrange. Wide open! Anfernee Harris is 6.7 feet away. [ZONE] NIKOLA ROSE MAKES IT! Assist: Pascal Lillard
Score: 8-7

[09:47] Team_086 possession (Score: 8-7)
FOUL! Holding foul on Derrick Durant. [IN THE BONUS! 5 team fouls] Rudy Rose to the line for 2 free throws. (Derrick Durant: 2 personal fouls)   FT 1/2: GOOD   FT 2/2: GOOD Rudy Rose makes 2/2 from the line.
Score: 10-7

[09:31] Team_098 possession (Score: 10-7)
FOUL! Shooting foul on Bones Ginobili. Nikola Rose to the line for 2 free throws. [Team fouls: 2] (Bones Ginobili: 1 personal fouls)   FT 1/2: GOOD   FT 2/2: GOOD Nikola Rose makes 2/2 from the line.
Score: 10-9

[09:13] Team_086 possession (Score: 10-9)
Rudy Rose makes the Layup and draws the foul on Pascal Lillard! And-1! Rudy Rose to the line for 1. [BONUS: 6 team fouls] (Pascal Lillard: 2 personal fouls)   FT 1/1: GOOD Rudy Rose makes 1/1 from the line.
Score: 13-9

[08:58] Team_098 possession (Score: 13-9)
Blake Murray attempts a 3Pt. Contested by Miles Gobert (2.7 feet, MAN). Blake Murray misses. Rebound secured by Rudy Rose.

[08:47] Team_086 possession (Score: 13-9)
Bones Ginobili attempts a Midrange. Contested by Pascal Lillard (5.2 feet, MAN). BONES GINOBILI MAKES IT! Assist: Anfernee Harris
Score: 15-9

[08:34] Team_098 possession (Score: 15-9)
Blake Murray attempts a Midrange. Contested by Miles Gobert (4.2 feet, ZONE). Blake Murray misses. Rebound secured by Rudy Rose.

[08:23] Team_086 possession (Score: 15-9)
FOUL! Reach-in foul on Nikola Rose during the drive. [IN THE BONUS! 7 team fouls] Anfernee Harris to the line for 2 free throws. (Nikola Rose: 3 personal fouls)   FT 1/2: MISS   FT 2/2: GOOD Anfernee Harris makes 1/2 from the line.
Score: 16-9

[08:04] Team_098 possession (Score: 16-9)
Malcolm Tatum attempts a Layup. Contested by Rudy Rose (2.4 feet, ZONE). MALCOLM TATUM MAKES IT! Assist: Nikola Rose
Score: 16-11

[07:54] Team_086 possession (Score: 16-11)
Anfernee Harris attempts a 3Pt. Wide open! Nikola Rose is 8.3 feet away. [MAN] ANFERNEE HARRIS MAKES IT!
Score: 19-11

[07:39] Team_098 possession (Score: 19-11)
Nikola Rose attempts a 3Pt. Contested by Anfernee Harris (2.2 feet, MAN). NIKOLA ROSE MAKES IT! Assist: Pascal Lillard
Score: 19-14

[07:25] Team_086 possession (Score: 19-14)
FOUL! Shooting foul on Nikola Rose. Anfernee Harris to the line for 3 free throws. [BONUS: 8 team fouls] (Nikola Rose: 4 personal fouls)   FT 1/3: GOOD   FT 2/3: GOOD   FT 3/3: GOOD Anfernee Harris makes 3/3 from the line.
Score: 22-14

[07:11] Team_098 possession (Score: 22-14)
Shot clock violation! Derrick Durant couldn't get a shot off in time! TURNOVER! (dead ball)

[06:59] Team_086 possession (Score: 22-14)
Miles Gobert attempts a Dunk. BLOCKED BY BLAKE MURRAY! Ball is loose! Rebound secured by Pascal Lillard.

[06:49] Team_098 possession (Score: 22-14)
Blake Murray attempts a 3Pt. Contested by Lauri Johnson (4.6 feet, ZONE). BLAKE MURRAY MAKES IT!
Score: 22-17

[06:39] Team_086 possession (Score: 22-17)
Anfernee Harris attempts a Midrange. Contested by Nikola Rose (3.9 feet, MAN). ANFERNEE HARRIS MAKES IT!
Score: 24-17

[06:21] Team_098 possession (Score: 24-17)
Pascal Lillard attempts a 3Pt. Contested by Lauri Johnson (4.8 feet, ZONE). Pascal Lillard misses. Rebound secured by Bones Ginobili.

[06:09] Team_086 possession (Score: 24-17)
Miles Gobert attempts a 3Pt. Heavily contested by Nikola Rose (0.9 feet, ZONE)! Miles Gobert misses. Rebound secured by Nikola Rose.

[05:56] Team_098 possession (Score: 24-17)
Pascal Lillard drives to the basket... Pascal Lillard loses the ball! Stripped by Rudy Rose! TURNOVER! (live ball)

[05:38] Team_086 possession (Score: 24-17)
Anfernee Harris attempts a 3Pt. Heavily contested by Nikola Rose (1.5 feet, ZONE)! Anfernee Harris misses. Rebound secured by Derrick Durant.

[05:26] Team_098 possession (Score: 24-17)
Malcolm Tatum attempts a 3Pt. Contested by Lauri Johnson (4.5 feet, ZONE). Malcolm Tatum misses. Rebound secured by Rudy Rose.

[05:14] Team_086 possession (Score: 24-17)
Rudy Rose loses the ball! Stripped by Derrick Durant! TURNOVER! (live ball)

[04:58] Team_098 possession (Score: 24-17)
Blake Murray attempts a Layup. Contested by Miles Gobert (4.9 feet, MAN). Blake Murray misses. Rebound secured by Miles Gobert.

[04:43] Team_086 possession (Score: 24-17)
FOUL! Holding foul on Nikola Rose. [IN THE BONUS! 9 team fouls] Anfernee Harris to the line for 2 free throws. (Nikola Rose: 5 personal fouls)   FT 1/2: GOOD   FT 2/2: MISS Anfernee Harris makes 1/2 from the line. Rebound secured by Pascal Lillard.
Score: 25-17

[04:27] Team_098 possession (Score: 25-17)
Nikola Rose attempts a 3Pt. Contested by Lauri Johnson (3.2 feet, ZONE). Nikola Rose misses. Rebound secured by Bones Ginobili.

[04:14] Team_086 possession (Score: 25-17)
Anfernee Harris attempts a 3Pt. Contested by Nikola Rose (4.9 feet, MAN). ANFERNEE HARRIS MAKES IT! Assist: Bones Ginobili
Score: 28-17

[03:58] Team_098 possession (Score: 28-17)
Nikola Rose attempts a 3Pt. Contested by Lauri Johnson (5.6 feet, ZONE). Nikola Rose misses. Offensive rebound by Pascal Lillard! Pascal Lillard kicks it out.

[03:45] Team_098 possession (Score: 28-17)
Blake Murray attempts a Midrange. Contested by Miles Gobert (4.2 feet, ZONE). BLAKE MURRAY MAKES IT! Assist: Nikola Rose
Score: 28-19

[03:33] Team_086 possession (Score: 28-19)
Bones Ginobili drives, Pascal Lillard stays with him. Bones Ginobili attempts a Layup. Wide open! Pascal Lillard is 7.2 feet away. [MAN] BONES GINOBILI MAKES IT!
Score: 30-19

[03:19] Team_098 possession (Score: 30-19)
Malcolm Tatum attempts a 3Pt. Contested by Lauri Johnson (5.7 feet, MAN). Malcolm Tatum misses. Rebound secured by Miles Gobert.

[03:05] Team_086 possession (Score: 30-19)
Lauri Johnson attempts a 3Pt. Contested by Nikola Rose (5.7 feet, ZONE). Lauri Johnson misses. Rebound secured by Pascal Lillard.

[02:51] Team_098 possession (Score: 30-19)
Malcolm Tatum drives to the basket... Malcolm Tatum throws a bad pass! Stolen by Rudy Rose! TURNOVER! (live ball)

[02:38] Team_086 possession (Score: 30-19)
Bones Ginobili attempts a 3Pt. Contested by Pascal Lillard (5.1 feet, MAN). BONES GINOBILI MAKES IT! Assist: Lauri Johnson
Score: 33-19

[02:21] Team_098 possession (Score: 33-19)
Derrick Durant throws a bad pass! Stolen by Rudy Rose! TURNOVER! (live ball)

[02:11] Team_086 possession (Score: 33-19)
Anfernee Harris attempts a Midrange. Contested by Nikola Rose (3.9 feet, MAN). ANFERNEE HARRIS MAKES IT! Assist: Miles Gobert
Score: 35-19

[01:56] Team_098 possession (Score: 35-19)
Malcolm Tatum drives and kicks out. Pascal Lillard attempts a 3Pt. Wide open! Bones Ginobili is 6.6 feet away. [MAN] PASCAL LILLARD MAKES IT! Assist: Derrick Durant
Score: 35-22

[01:46] Team_086 possession (Score: 35-22)
FOUL! Shooting foul on Malcolm Tatum. Lauri Johnson to the line for 3 free throws. [BONUS: 10 team fouls] (Malcolm Tatum: 1 personal fouls)   FT 1/3: GOOD   FT 2/3: GOOD   FT 3/3: GOOD Lauri Johnson makes 3/3 from the line.
Score: 38-22

[01:30] Team_098 possession (Score: 38-22)
Nikola Rose attempts a 3Pt. Contested by Lauri Johnson (5.5 feet, ZONE). NIKOLA ROSE MAKES IT! Assist: Derrick Durant
Score: 38-25

[01:19] Team_086 possession (Score: 38-25)
Bones Ginobili makes the Midrange and draws the foul on Blake Murray! And-1! Bones Ginobili to the line for 1. [BONUS: 11 team fouls] (Blake Murray: 1 personal fouls)   FT 1/1: GOOD Bones Ginobili makes 1/1 from the line.
Score: 41-25

[01:04] Team_098 possession (Score: 41-25)
Malcolm Tatum attempts a 3Pt. Contested by Lauri Johnson (3.8 feet, ZONE). MALCOLM TATUM MAKES IT! Assist: Nikola Rose
Score: 41-28

[00:50] Team_086 possession (Score: 41-28)
Lauri Johnson attempts a 3Pt. Contested by Nikola Rose (4.8 feet, ZONE). Lauri Johnson misses. Rebound secured by Derrick Durant.

[00:37] Team_098 possession (Score: 41-28)
Malcolm Tatum makes the Layup and draws the foul on Bones Ginobili! And-1! Malcolm Tatum to the line for 1. [Team fouls: 3] (Bones Ginobili: 2 personal fouls)   FT 1/1: GOOD Malcolm Tatum makes 1/1 from the line.
Score: 41-31

[00:22] Team_086 possession (Score: 41-31)
Anfernee Harris attempts a Midrange. Wide open! Nikola Rose is 6.0 feet away. [MAN] ANFERNEE HARRIS MAKES IT! Assist: Rudy Rose
Score: 43-31

[00:08] Team_098 possession (Score: 43-31)
FOUL! Offensive foul on Nikola Rose! Anfernee Harris drew the charge! [Team fouls: 12] (Nikola Rose: 6 personal fouls) TURNOVER! (dead ball)

[00:08] Substitution (Team_098): Nikola Rose OUT (stamina: 69) → Tracy Rose IN (foul_out)

[00:08] Substitution (Team_086): Lauri Johnson OUT → Anfernee Green IN (stamina_rule2)

[00:08] Substitution (Team_086): Anfernee Harris OUT → Anthony James IN (stamina_rule2)

[00:08] Substitution (Team_086): Bones Ginobili OUT → Kyle McCollum IN (stamina_rule2)

[00:08] Substitution (Team_098): Malcolm Tatum OUT → Dirk McCollum IN (stamina_rule2)

[00:08] Substitution (Team_098): Blake Murray OUT → Kristaps Iverson IN (stamina_rule2)

[00:08] Substitution (Team_098): Pascal Lillard OUT → Manu Jordan IN (stamina_rule2)

[00:08] Substitution (Team_098): Derrick Durant OUT → Russell McGrady IN (stamina_rule2)

================================================================================
                              1ST QUARTER COMPLETE                              
================================================================================

1ST QUARTER SCORE: Team_086 43, Team_098 31

BOX SCORE:
================================================================================

Team_086
--------------------------------------------------------------------------------
Player                MIN  PTS  REB  AST  TO      FG   FG%      3P   3P%
--------------------------------------------------------------------------------
Anfernee Harris        12   18    0    1   0   8/9    88.9     0/0   0.0
Bones Ginobili         12   10    2    1   0   4/4   100.0     0/0   0.0
Rudy Rose              12    7    4    1   0   3/3   100.0     0/0   0.0
Lauri Johnson          12    6    0    1   0   2/4    50.0     0/0   0.0
Miles Gobert           12    0    2    1   0   0/2     0.0     0/0   0.0

TEAM: FG: 17/23 (73.9%), 3PT: 5/9 (55.6%), REB: 8 (1 off, 7 def), AST: 5, TO: 2
TEAM FOULS: 3


Team_098
--------------------------------------------------------------------------------
Player                MIN  PTS  REB  AST  TO      FG   FG%      3P   3P%
--------------------------------------------------------------------------------
Nikola Rose            12   12    1    3   0   5/6    83.3     0/0   0.0
Blake Murray           12    8    0    0   0   3/6    50.0     0/0   0.0
Malcolm Tatum          12    8    0    0   0   3/5    60.0     0/0   0.0
Pascal Lillard         12    3    4    2   0   1/2    50.0     0/0   0.0
Derrick Durant         12    0    2    3   0   0/0     0.0     0/0   0.0

TEAM: FG: 12/19 (63.2%), 3PT: 5/10 (50.0%), REB: 7 (1 off, 6 def), AST: 8, TO: 6
TEAM FOULS: 12 [Team_086 in BONUS]

================================================================================

================================================================================
                       2ND QUARTER - Team_086 vs Team_098                       
================================================================================

[12:00] Team_086 possession (Score: 43-31)
Miles Gobert attempts a Dunk. BLOCKED BY KRISTAPS IVERSON! Ball is loose! Rebound secured by Manu Jordan.

[11:50] Team_098 possession (Score: 43-31)
Kristaps Iverson attempts a 3Pt. Contested by Miles Gobert (3.1 feet, MAN). Kristaps Iverson misses. Rebound secured by Anfernee Green.

[11:36] Team_086 possession (Score: 43-31)
Anthony James drives, Dirk McCollum stays with him. Anthony James attempts a Layup. Wide open! Dirk McCollum is 7.7 feet away. [MAN] ANTHONY JAMES MAKES IT!
Score: 45-31

[11:22] Team_098 possession (Score: 45-31)
FOUL! Reach-in foul on Rudy Rose during the drive. [Team fouls: 1] No free throws, side out. (Rudy Rose: 1 personal fouls)

[11:07] Team_098 possession (Score: 45-31)
Kristaps Iverson attempts a 3Pt. Contested by Kyle McCollum (4.9 feet, ZONE). KRISTAPS IVERSON MAKES IT! Assist: Manu Jordan
Score: 45-34

[10:54] Team_086 possession (Score: 45-34)
Kyle McCollum attempts a 3Pt. Contested by Tracy Rose (2.6 feet, ZONE). Kyle McCollum misses. Rebound secured by Manu Jordan.

[10:40] Team_098 possession (Score: 45-34)
Russell McGrady drives to the basket... Shot clock violation! Russell McGrady couldn't get a shot off in time! TURNOVER! (dead ball)

[10:30] Team_086 possession (Score: 45-34)
Anthony James attempts a 3Pt. Contested by Dirk McCollum (4.7 feet, ZONE). ANTHONY JAMES MAKES IT! Assist: Rudy Rose
Score: 48-34

[10:15] Team_098 possession (Score: 48-34)
Tracy Rose attempts a Midrange. Contested by Anfernee Green (4.3 feet, MAN). Tracy Rose misses. FOUL! Loose ball foul on Rudy Rose during the rebound battle. [Team fouls: 2] No free throws, side out. (Rudy Rose: 2 personal fouls)

[09:56] Team_098 possession (Score: 48-34)
Manu Jordan drives, Kyle McCollum stays with him. Manu Jordan attempts a Dunk. Contested by Kyle McCollum (5.7 feet, MAN). MANU JORDAN MAKES IT! Assist: Tracy Rose
Score: 48-36

[09:46] Team_086 possession (Score: 48-36)
Miles Gobert attempts a 3Pt. Wide open! Dirk McCollum is 6.1 feet away. [ZONE] Miles Gobert misses. Rebound secured by Kristaps Iverson.

[09:31] Team_098 possession (Score: 48-36)
Kristaps Iverson attempts a 3Pt. Contested by Miles Gobert (2.0 feet, MAN). Kristaps Iverson misses. Rebound secured by Rudy Rose.

[09:20] Team_086 possession (Score: 48-36)
Kyle McCollum attempts a Midrange. Contested by Manu Jordan (5.5 feet, MAN). KYLE MCCOLLUM MAKES IT! Assist: Miles Gobert
Score: 50-36

[09:07] Team_098 possession (Score: 50-36)
Kristaps Iverson attempts a Midrange. Contested by Miles Gobert (4.3 feet, ZONE). Kristaps Iverson misses. Rebound secured by Rudy Rose.

[08:56] Team_086 possession (Score: 50-36)
FOUL! Reach-in foul on Dirk McCollum during the drive. [Team fouls: 1] No free throws, side out. (Dirk McCollum: 1 personal fouls)

[08:56] Substitution (Team_086): Rudy Rose OUT → Lamelo Towns IN (stamina_rule2)

[08:45] Team_086 possession (Score: 50-36)
Anfernee Green attempts a 3Pt. Contested by Dirk McCollum (4.4 feet, ZONE). Anfernee Green misses. Rebound secured by Russell McGrady.

[08:34] Team_098 possession (Score: 50-36)
FOUL! Holding foul on Kyle McCollum. [Team fouls: 3] No free throws, side out. (Kyle McCollum: 1 personal fouls)

[08:34] Substitution (Team_086): Miles Gobert OUT → Franz McGrady IN (stamina_rule2)

[08:15] Team_098 possession (Score: 50-36)
Shot clock violation! Tracy Rose couldn't get a shot off in time! TURNOVER! (dead ball)

[07:56] Team_086 possession (Score: 50-36)
Franz McGrady attempts a Midrange. Contested by Kristaps Iverson (4.9 feet, ZONE). FRANZ MCGRADY MAKES IT!
Score: 52-36

[07:43] Team_098 possession (Score: 52-36)
Kristaps Iverson drives and kicks out. Russell McGrady attempts a 3Pt. Wide open! Lamelo Towns is 6.2 feet away. [MAN] RUSSELL MCGRADY MAKES IT! Assist: Kristaps Iverson
Score: 52-39

[07:34] Team_086 possession (Score: 52-39)
Kyle McCollum attempts a 3Pt. Wide open! Dirk McCollum is 7.8 feet away. [ZONE] KYLE MCCOLLUM MAKES IT! Assist: Anfernee Green
Score: 55-39

[07:21] Team_098 possession (Score: 55-39)
Kristaps Iverson drives and kicks out. Russell McGrady attempts a Midrange. Contested by Lamelo Towns (2.1 feet, MAN). RUSSELL MCGRADY MAKES IT!
Score: 55-41

[07:05] Team_086 possession (Score: 55-41)
Anfernee Green attempts a Layup. Heavily contested by Russell McGrady (0.5 feet, ZONE)! Anfernee Green misses. Rebound secured by Kristaps Iverson.

[06:50] Team_098 possession (Score: 55-41)
Russell McGrady drives, picks up Kyle McCollum. Help arrives from Anfernee Green! Russell McGrady attempts a Layup. Contested by Anfernee Green (4.2 feet, ZONE). Russell McGrady misses. Rebound secured by Kyle McCollum.

[06:35] Team_086 possession (Score: 55-41)
Anthony James attempts a Midrange. Wide open! Dirk McCollum is 6.6 feet away. [MAN] ANTHONY JAMES MAKES IT! Assist: Franz McGrady
Score: 57-41

[06:23] Team_098 possession (Score: 57-41)
Tracy Rose attempts a Midrange. Wide open! Anfernee Green is 7.0 feet away. [MAN] Tracy Rose misses. Rebound secured by Lamelo Towns.

[06:05] Team_086 possession (Score: 57-41)
Kyle McCollum attempts a Midrange. Wide open! Manu Jordan is 8.8 feet away. [ZONE] KYLE MCCOLLUM MAKES IT! Assist: Anthony James
Score: 59-41

[05:51] Team_098 possession (Score: 59-41)
Kristaps Iverson makes the Dunk and draws the foul on Franz McGrady! And-1! Kristaps Iverson to the line for 1. [Team fouls: 4] (Franz McGrady: 1 personal fouls)   FT 1/1: GOOD Kristaps Iverson makes 1/1 from the line.
Score: 59-44

[05:35] Team_086 possession (Score: 59-44)
Anthony James attempts a 3Pt. Wide open! Dirk McCollum is 6.1 feet away. [ZONE] Anthony James misses. Offensive rebound by Anfernee Green! Anfernee Green kicks it out.

[05:19] Team_086 possession (Score: 59-44)
Kyle McCollum drives, Russell McGrady stays with him. Kyle McCollum attempts a Layup. Wide open! Russell McGrady is 6.3 feet away. [ZONE] Kyle McCollum misses. Offensive rebound by Lamelo Towns! Lamelo Towns kicks it out.

[05:06] Team_086 possession (Score: 59-44)
Franz McGrady attempts a Layup. Heavily contested by Kristaps Iverson (0.5 feet, MAN)! Franz McGrady misses. Rebound secured by Kristaps Iverson.

[04:52] Team_098 possession (Score: 59-44)
Kristaps Iverson drives and kicks out. Kristaps Iverson attempts a Midrange. Contested by Franz McGrady (2.2 feet, MAN). Kristaps Iverson misses. Rebound secured by Anfernee Green.

[04:39] Team_086 possession (Score: 59-44)
Anfernee Green attempts a Midrange. Heavily contested by Dirk McCollum (1.3 feet, ZONE)! Anfernee Green misses. Rebound secured by Kristaps Iverson.

[04:26] Team_098 possession (Score: 59-44)
Kristaps Iverson attempts a Midrange. Contested by Franz McGrady (3.6 feet, ZONE). KRISTAPS IVERSON MAKES IT!
Score: 59-46

[04:09] Team_086 possession (Score: 59-46)
Anfernee Green drives and kicks out. Kyle McCollum attempts a 3Pt. Wide open! Dirk McCollum is 7.0 feet away. [ZONE] Kyle McCollum misses. Rebound secured by Russell McGrady.

[03:57] Team_098 possession (Score: 59-46)
Manu Jordan attempts a 3Pt. Wide open! Anfernee Green is 9.1 feet away. [ZONE] Manu Jordan misses. FOUL! Loose ball foul on Franz McGrady during the rebound battle. [IN THE BONUS! 5 team fouls] Russell McGrady to the line for 2 free throws. (Franz McGrady: 2 personal fouls)   FT 1/2: GOOD   FT 2/2: GOOD Russell McGrady makes 2/2 from the line.
Score: 59-48

[03:41] Team_086 possession (Score: 59-48)
Anfernee Green attempts a 3Pt. Heavily contested by Dirk McCollum (1.6 feet, ZONE)! Anfernee Green misses. Rebound secured by Kristaps Iverson.

[03:30] Team_098 possession (Score: 59-48)
FOUL! Holding foul on Anfernee Green. [IN THE BONUS! 6 team fouls] Tracy Rose to the line for 2 free throws. (Anfernee Green: 1 personal fouls)   FT 1/2: GOOD   FT 2/2: MISS Tracy Rose makes 1/2 from the line. Rebound secured by Franz McGrady.
Score: 59-49

[03:15] Team_086 possession (Score: 59-49)
Franz McGrady attempts a 3Pt. Contested by Dirk McCollum (5.6 feet, ZONE). FRANZ MCGRADY MAKES IT! Assist: Anthony James
Score: 62-49

[02:57] Team_098 possession (Score: 62-49)
Tracy Rose attempts a Midrange. Contested by Franz McGrady (3.2 feet, ZONE). TRACY ROSE MAKES IT! Assist: Kristaps Iverson
Score: 62-51

[02:42] Team_086 possession (Score: 62-51)
Anfernee Green drives and kicks out. Kyle McCollum attempts a Midrange. Contested by Manu Jordan (5.1 feet, MAN). Kyle McCollum misses. Offensive rebound by Lamelo Towns! Lamelo Towns kicks it out.

[02:23] Team_086 possession (Score: 62-51)
Kyle McCollum attempts a Layup. BLOCKED BY MANU JORDAN! Ball is loose! Rebound secured by Russell McGrady.

[02:09] Team_098 possession (Score: 62-51)
Tracy Rose attempts a Layup. Heavily contested by Anfernee Green (1.3 feet, MAN)! Tracy Rose misses. Rebound secured by Lamelo Towns.

[01:55] Team_086 possession (Score: 62-51)
Kyle McCollum attempts a Midrange. Contested by Kristaps Iverson (4.7 feet, ZONE). Kyle McCollum misses. Offensive rebound by Lamelo Towns! Lamelo Towns kicks it out.

[01:42] Team_086 possession (Score: 62-51)
Anfernee Green attempts a Midrange. Contested by Dirk McCollum (2.3 feet, ZONE). Anfernee Green misses. Rebound secured by Kristaps Iverson.

[01:29] Team_098 possession (Score: 62-51)
FOUL! Shooting foul on Kyle McCollum. Dirk McCollum to the line for 2 free throws. [BONUS: 7 team fouls] (Kyle McCollum: 2 personal fouls)   FT 1/2: GOOD   FT 2/2: MISS Dirk McCollum makes 1/2 from the line. Rebound secured by Anfernee Green.
Score: 62-52

[01:15] Team_086 possession (Score: 62-52)
Anthony James attempts a 3Pt. Wide open! Dirk McCollum is 6.3 feet away. [MAN] Anthony James misses. Offensive rebound by Anfernee Green! Anfernee Green kicks it out.

[00:56] Team_086 possession (Score: 62-52)
Anfernee Green attempts a Midrange. Contested by Manu Jordan (4.5 feet, ZONE). ANFERNEE GREEN MAKES IT!
Score: 64-52

[00:47] Team_098 possession (Score: 64-52)
Kristaps Iverson attempts a Midrange. Contested by Kyle McCollum (2.3 feet, ZONE). Kristaps Iverson misses. Offensive rebound by Kristaps Iverson! Kristaps Iverson kicks it out.

[00:28] Team_098 possession (Score: 64-52)
Tracy Rose throws a bad pass! Stolen by Anfernee Green! TURNOVER! (live ball)

[00:12] Team_086 possession (Score: 64-52)
Anthony James attempts a Midrange. Wide open! Kristaps Iverson is 8.1 feet away. [ZONE] Anthony James misses. Offensive rebound by Anfernee Green! Anfernee Green kicks it out.

================================================================================
                              2ND QUARTER COMPLETE                              
================================================================================

2ND QUARTER SCORE: Team_086 21, Team_098 21

BOX SCORE:
================================================================================

Team_086
--------------------------------------------------------------------------------
Player                MIN  PTS  REB  AST  TO      FG   FG%      3P   3P%
--------------------------------------------------------------------------------
Anthony James          12    7    0    2   0   3/3   100.0     0/0   0.0
Kyle McCollum          12    7    1    0   0   3/5    60.0     0/0   0.0
Franz McGrady           8    5    1    1   0   2/3    66.7     0/0   0.0
Anfernee Green         12    2    6    1   0   1/7    14.3     0/0   0.0
Miles Gobert           16    0    0    1   0   0/2     0.0     0/0   0.0
Rudy Rose              15    0    2    1   0   0/0     0.0     0/0   0.0
Lamelo Towns            9    0    5    0   0   0/0     0.0     0/0   0.0

TEAM: FG: 9/20 (45.0%), 3PT: 3/7 (42.9%), REB: 15 (6 off, 9 def), AST: 6, TO: 0
TEAM FOULS: 7 [Team_098 in BONUS]


Team_098
--------------------------------------------------------------------------------
Player                MIN  PTS  REB  AST  TO      FG   FG%      3P   3P%
--------------------------------------------------------------------------------
Kristaps Iverson       12    8    7    2   0   3/7    42.9     0/0   0.0
Russell McGrady        12    7    4    0   0   3/4    75.0     0/0   0.0
Manu Jordan            12    2    2    1   0   1/1   100.0     0/0   0.0
Tracy Rose             12    2    0    1   0   1/3    33.3     0/0   0.0
Dirk McCollum          12    0    0    0   0   0/1     0.0     0/0   0.0

TEAM: FG: 8/17 (47.1%), 3PT: 2/4 (50.0%), REB: 13 (2 off, 11 def), AST: 4, TO: 3
TEAM FOULS: 1

================================================================================

================================================================================
                       3RD QUARTER - Team_086 vs Team_098                       
================================================================================

[12:00] Team_086 possession (Score: 64-52)
FOUL! Shooting foul on Kristaps Iverson. Franz McGrady to the line for 2 free throws. [Team fouls: 1] (Kristaps Iverson: 1 personal fouls)   FT 1/2: GOOD   FT 2/2: MISS Franz McGrady makes 1/2 from the line. FOUL! Loose ball foul on Kristaps Iverson during the free throw rebound! [Team fouls: 2] No free throws, side out. (Kristaps Iverson: 2 personal fouls)
Score: 65-52

[11:45] Team_086 possession (Score: 65-52)
Lamelo Towns throws a bad pass! Stolen by Russell McGrady! TURNOVER! (live ball)

[11:32] Team_098 possession (Score: 65-52)
FOUL! Offensive foul on Tracy Rose! Anfernee Green drew the charge! [Team fouls: 3] (Tracy Rose: 1 personal fouls) TURNOVER! (dead ball)

[11:17] Team_086 possession (Score: 65-52)
Anthony James attempts a Midrange. Contested by Manu Jordan (4.8 feet, ZONE). ANTHONY JAMES MAKES IT!
Score: 67-52

[11:03] Team_098 possession (Score: 67-52)
Tracy Rose drives, Lamelo Towns stays with him. Tracy Rose attempts a Dunk. Contested by Lamelo Towns (4.1 feet, ZONE). TRACY ROSE MAKES IT! Assist: Russell McGrady
Score: 67-54

[10:48] Team_086 possession (Score: 67-54)
Lamelo Towns drives, Russell McGrady stays with him. Lamelo Towns attempts a Layup. Heavily contested by Russell McGrady (1.5 feet, ZONE)! Lamelo Towns misses. Rebound secured by Kristaps Iverson.

[10:30] Team_098 possession (Score: 67-54)
Russell McGrady attempts a Midrange. Contested by Kyle McCollum (3.5 feet, ZONE). RUSSELL MCGRADY MAKES IT!
Score: 67-56

[10:13] Team_086 possession (Score: 67-56)
Anfernee Green attempts a 3Pt. Contested by Dirk McCollum (2.8 feet, ZONE). Anfernee Green misses. Offensive rebound by Lamelo Towns! Lamelo Towns kicks it out.

[10:00] Team_086 possession (Score: 67-56)
Kyle McCollum throws a bad pass! Stolen by Manu Jordan! TURNOVER! (live ball)

[09:49] Team_098 possession (Score: 67-56)
Dirk McCollum attempts a 3Pt. Wide open! Anthony James is 6.3 feet away. [MAN] Dirk McCollum misses. Rebound secured by Anfernee Green.

[09:37] Team_086 possession (Score: 67-56)
Anfernee Green attempts a 3Pt. Wide open! Dirk McCollum is 7.1 feet away. [ZONE] Anfernee Green misses. Rebound secured by Kristaps Iverson.

[09:22] Team_098 possession (Score: 67-56)
Russell McGrady drives, Lamelo Towns stays with him. Russell McGrady attempts a Dunk. Contested by Lamelo Towns (4.4 feet, MAN). RUSSELL MCGRADY MAKES IT! Assist: Kristaps Iverson
Score: 67-58

[09:12] Team_086 possession (Score: 67-58)
Kyle McCollum attempts a Midrange. Heavily contested by Kristaps Iverson (1.6 feet, ZONE)! Kyle McCollum misses. Rebound secured by Manu Jordan.

[09:01] Team_098 possession (Score: 67-58)
Russell McGrady attempts a Midrange. Contested by Lamelo Towns (4.6 feet, MAN). Russell McGrady misses. FOUL! Loose ball foul on Anfernee Green during the rebound battle. [Team fouls: 1] No free throws, side out. (Anfernee Green: 2 personal fouls)

[08:50] Team_098 possession (Score: 67-58)
Manu Jordan attempts a Midrange. Wide open! Kyle McCollum is 7.1 feet away. [MAN] MANU JORDAN MAKES IT!
Score: 67-60

[08:32] Team_086 possession (Score: 67-60)
Franz McGrady loses the ball! Stripped by Kristaps Iverson! TURNOVER! (live ball)

[08:15] Team_098 possession (Score: 67-60)
Dirk McCollum attempts a 3Pt. Wide open! Anfernee Green is 7.8 feet away. [ZONE] Dirk McCollum misses. Rebound secured by Lamelo Towns.

[08:00] Team_086 possession (Score: 67-60)
Franz McGrady attempts a 3Pt. Wide open! Dirk McCollum is 7.1 feet away. [ZONE] Franz McGrady misses. Offensive rebound by Anfernee Green! Anfernee Green kicks it out.

[07:43] Team_086 possession (Score: 67-60)
Anthony James attempts a Layup. BLOCKED BY RUSSELL MCGRADY! Ball is loose! Rebound secured by Russell McGrady.

[07:28] Team_098 possession (Score: 67-60)
FOUL! Holding foul on Franz McGrady. [Team fouls: 2] No free throws, side out. (Franz McGrady: 3 personal fouls)

[07:15] Team_098 possession (Score: 67-60)
Tracy Rose attempts a Midrange. Contested by Anfernee Green (3.6 feet, MAN). Tracy Rose misses. Offensive rebound by Russell McGrady! Russell McGrady puts it back in!
Score: 67-62

[07:04] Team_086 possession (Score: 67-62)
Lamelo Towns attempts a 3Pt. Contested by Russell McGrady (2.2 feet, MAN). Lamelo Towns misses. Rebound secured by Kristaps Iverson.

[06:48] Team_098 possession (Score: 67-62)
Kristaps Iverson attempts a Midrange. Wide open! Kyle McCollum is 9.4 feet away. [ZONE] KRISTAPS IVERSON MAKES IT!
Score: 67-64

[06:29] Team_086 possession (Score: 67-64)
Lamelo Towns attempts a Midrange. Contested by Russell McGrady (2.8 feet, MAN). LAMELO TOWNS MAKES IT!
Score: 69-64

[06:14] Team_098 possession (Score: 69-64)
Tracy Rose attempts a 3Pt. Contested by Anfernee Green (4.0 feet, ZONE). TRACY ROSE MAKES IT! Assist: Manu Jordan
Score: 69-67

[06:00] Team_086 possession (Score: 69-67)
Franz McGrady attempts a 3Pt. Contested by Kristaps Iverson (3.7 feet, MAN). Franz McGrady misses. Rebound secured by Manu Jordan.

[05:44] Team_098 possession (Score: 69-67)
Russell McGrady attempts a Layup. Heavily contested by Kyle McCollum (1.9 feet, ZONE)! Russell McGrady misses. Offensive rebound by Kristaps Iverson! Kristaps Iverson kicks it out.

[05:27] Team_098 possession (Score: 69-67)
Manu Jordan attempts a Midrange. Wide open! Kyle McCollum is 6.3 feet away. [MAN] Manu Jordan misses. Rebound secured by Anfernee Green.

[05:17] Team_086 possession (Score: 69-67)
Anfernee Green attempts a 3Pt. Wide open! Dirk McCollum is 6.6 feet away. [ZONE] ANFERNEE GREEN MAKES IT! Assist: Lamelo Towns
Score: 72-67

[05:03] Team_098 possession (Score: 72-67)
Russell McGrady drives and kicks out. Manu Jordan attempts a 3Pt. Contested by Anfernee Green (4.2 feet, ZONE). Manu Jordan misses. Rebound secured by Lamelo Towns.

[04:48] Team_086 possession (Score: 72-67)
Anthony James attempts a Midrange. Wide open! Dirk McCollum is 7.8 feet away. [MAN] Anthony James misses. Rebound secured by Manu Jordan.

[04:32] Team_098 possession (Score: 72-67)
Kristaps Iverson drives to the basket... Kristaps Iverson loses the ball! Stripped by Franz McGrady! TURNOVER! (live ball)

[04:13] Team_086 possession (Score: 72-67)
FOUL! Reach-in foul on Tracy Rose during the drive. [Team fouls: 4] No free throws, side out. (Tracy Rose: 2 personal fouls)

[04:13] Substitution (Team_086): Anfernee Green OUT → Lauri Johnson IN (starter_return_rule1)

[04:13] Substitution (Team_086): Anthony James OUT → Anfernee Harris IN (starter_return_rule1)

[04:13] Substitution (Team_086): Franz McGrady OUT → Miles Gobert IN (starter_return_rule1)

[04:13] Substitution (Team_086): Kyle McCollum OUT → Bones Ginobili IN (starter_return_rule1)

[04:13] Substitution (Team_086): Lamelo Towns OUT → Rudy Rose IN (starter_return_rule1)

[04:13] Substitution (Team_098): Dirk McCollum OUT → Malcolm Tatum IN (starter_return_rule1)

[04:13] Substitution (Team_098): Tracy Rose OUT → Nikola Rose IN (starter_return_rule1)

[04:13] Substitution (Team_098): Kristaps Iverson OUT → Blake Murray IN (starter_return_rule1)

[04:13] Substitution (Team_098): Manu Jordan OUT → Pascal Lillard IN (starter_return_rule1)

[04:13] Substitution (Team_098): Russell McGrady OUT → Derrick Durant IN (starter_return_rule1)

[03:57] Team_086 possession (Score: 72-67)
Anfernee Harris attempts a 3Pt. Contested by Nikola Rose (4.9 feet, MAN). Anfernee Harris misses. Offensive rebound by Miles Gobert! Miles Gobert kicks it out.

[03:47] Team_086 possession (Score: 72-67)
Miles Gobert attempts a 3Pt. Contested by Blake Murray (6.0 feet, MAN). Miles Gobert misses. Rebound secured by Nikola Rose.

[03:27] Team_098 possession (Score: 72-67)
Blake Murray attempts a 3Pt. Wide open! Lauri Johnson is 8.7 feet away. [ZONE] BLAKE MURRAY MAKES IT! Assist: Nikola Rose
Score: 72-70

[03:10] Team_086 possession (Score: 72-70)
Anfernee Harris attempts a 3Pt. Contested by Nikola Rose (5.7 feet, ZONE). ANFERNEE HARRIS MAKES IT! Assist: Miles Gobert
Score: 75-70

[02:54] Team_098 possession (Score: 75-70)
Malcolm Tatum makes the Midrange and draws the foul on Anfernee Harris! And-1! Malcolm Tatum to the line for 1. [Team fouls: 3] (Anfernee Harris: 1 personal fouls)   FT 1/1: MISS Malcolm Tatum makes 0/1 from the line. Offensive rebound by Pascal Lillard! Pascal Lillard kicks it out.
Score: 75-72

[02:35] Team_098 possession (Score: 75-72)
Malcolm Tatum attempts a 3Pt. Contested by Lauri Johnson (4.0 feet, ZONE). Malcolm Tatum misses. Rebound secured by Rudy Rose.

[02:23] Team_086 possession (Score: 75-72)
FOUL! Holding foul on Malcolm Tatum. [IN THE BONUS! 5 team fouls] Lauri Johnson to the line for 2 free throws. (Malcolm Tatum: 2 personal fouls)   FT 1/2: MISS   FT 2/2: GOOD Lauri Johnson makes 1/2 from the line.
Score: 76-72

[02:11] Team_098 possession (Score: 76-72)
Malcolm Tatum throws a bad pass! Stolen by Lauri Johnson! TURNOVER! (live ball)

[01:56] Team_086 possession (Score: 76-72)
Anfernee Harris loses the ball! Stripped by Nikola Rose! TURNOVER! (live ball)

[01:38] Team_098 possession (Score: 76-72)
Nikola Rose drives, picks up Rudy Rose. Help arrives from Anfernee Harris! Nikola Rose attempts a Layup. Contested by Anfernee Harris (3.6 feet, ZONE). Nikola Rose misses. Offensive rebound by Pascal Lillard! Pascal Lillard kicks it out.

[01:19] Team_098 possession (Score: 76-72)
Derrick Durant attempts a 3Pt. Contested by Rudy Rose (3.9 feet, MAN). Derrick Durant misses. Offensive rebound by Derrick Durant! Derrick Durant's putback is no good. Rebound secured by Rudy Rose.

[01:04] Team_086 possession (Score: 76-72)
Lauri Johnson attempts a 3Pt. Wide open! Nikola Rose is 6.2 feet away. [ZONE] LAURI JOHNSON MAKES IT! Assist: Anfernee Harris
Score: 79-72

[00:51] Team_098 possession (Score: 79-72)
Blake Murray attempts a 3Pt. Contested by Miles Gobert (2.3 feet, MAN). Blake Murray misses. Offensive rebound by Pascal Lillard! Pascal Lillard kicks it out.

[00:34] Team_098 possession (Score: 79-72)
Malcolm Tatum attempts a 3Pt. Contested by Lauri Johnson (4.3 feet, MAN). Malcolm Tatum misses. Offensive rebound by Derrick Durant! Derrick Durant's putback is no good. Rebound secured by Bones Ginobili.

[00:18] Team_086 possession (Score: 79-72)
Bones Ginobili attempts a Midrange. Wide open! Malcolm Tatum is 7.6 feet away. [ZONE] Bones Ginobili misses. Rebound secured by Nikola Rose.

[00:04] Team_098 possession (Score: 79-72)
Nikola Rose throws a bad pass! Stolen by Anfernee Harris! TURNOVER! (live ball)

================================================================================
                              3RD QUARTER COMPLETE                              
================================================================================

3RD QUARTER SCORE: Team_086 15, Team_098 20

BOX SCORE:
================================================================================

Team_086
--------------------------------------------------------------------------------
Player                MIN  PTS  REB  AST  TO      FG   FG%      3P   3P%
--------------------------------------------------------------------------------
Lauri Johnson          16    4    0    0   0   2/2   100.0     0/0   0.0
Anfernee Green         20    3    3    0   0   1/2    50.0     0/0   0.0
Anfernee Harris        16    3    0    1   0   1/1   100.0     0/0   0.0
Lamelo Towns           17    2    4    1   0   1/3    33.3     0/0   0.0
Anthony James          20    2    0    0   0   1/3    33.3     0/0   0.0
Kyle McCollum          20    0    0    0   0   0/1     0.0     0/0   0.0
Franz McGrady          16    0    0    0   0   0/1     0.0     0/0   0.0
Miles Gobert           20    0    1    1   0   0/1     0.0     0/0   0.0
Bones Ginobili         16    0    1    0   0   0/1     0.0     0/0   0.0

TEAM: FG: 6/15 (40.0%), 3PT: 3/7 (42.9%), REB: 9 (4 off, 5 def), AST: 3, TO: 4
TEAM FOULS: 3


Team_098
--------------------------------------------------------------------------------
Player                MIN  PTS  REB  AST  TO      FG   FG%      3P   3P%
--------------------------------------------------------------------------------
Russell McGrady        20    6    2    1   0   3/4    75.0     0/0   0.0
Tracy Rose             20    5    0    0   0   2/2   100.0     0/0   0.0
Blake Murray           16    3    0    0   0   1/1   100.0     0/0   0.0
Kristaps Iverson       20    2    5    1   0   1/1   100.0     0/0   0.0
Manu Jordan            20    2    3    1   0   1/2    50.0     0/0   0.0
Dirk McCollum          20    0    0    0   0   0/2     0.0     0/0   0.0
Nikola Rose            16    0    2    1   0   0/0     0.0     0/0   0.0
Pascal Lillard         16    0    3    0   0   0/0     0.0     0/0   0.0
Malcolm Tatum          16    0    0    0   0   0/2     0.0     0/0   0.0
Rudy Rose              19    0    2    0   0   0/0     0.0     0/0   0.0
Derrick Durant         16    0    0    0   0   0/1     0.0     0/0   0.0

TEAM: FG: 8/15 (53.3%), 3PT: 2/7 (28.6%), REB: 17 (8 off, 9 def), AST: 4, TO: 4
TEAM FOULS: 5 [Team_086 in BONUS]

================================================================================

================================================================================
                       4TH QUARTER - Team_086 vs Team_098                       
================================================================================

[12:00] Substitution (Team_098): Nikola Rose OUT (stamina: 92) → Tracy Rose IN (foul_out)

[12:00] Team_086 possession (Score: 79-72)
FOUL! Shooting foul on Nikola Rose. Anfernee Harris to the line for 2 free throws. [Team fouls: 1] (Nikola Rose: 7 personal fouls) Nikola Rose FOULS OUT!   FT 1/2: GOOD   FT 2/2: MISS Anfernee Harris makes 1/2 from the line. FOUL! Loose ball foul on Derrick Durant during the free throw rebound! [Team fouls: 2] No free throws, side out. (Derrick Durant: 3 personal fouls)
Score: 80-72

[11:45] Team_086 possession (Score: 80-72)
Rudy Rose throws a bad pass! Stolen by Derrick Durant! TURNOVER! (live ball)

[11:32] Team_098 possession (Score: 80-72)
FOUL! Offensive foul on Tracy Rose! Lauri Johnson drew the charge! [Team fouls: 3] (Tracy Rose: 3 personal fouls) TURNOVER! (dead ball)

[11:32] Substitution (Team_098): Malcolm Tatum OUT → Nikola Rose IN (starter_return_rule1)

[11:17] Team_086 possession (Score: 80-72)
Anfernee Harris attempts a Midrange. Contested by Pascal Lillard (4.0 feet, ZONE). ANFERNEE HARRIS MAKES IT!
Score: 82-72

[11:03] Team_098 possession (Score: 82-72)
Tracy Rose drives, Rudy Rose stays with him. Tracy Rose attempts a Dunk. Contested by Rudy Rose (2.5 feet, ZONE). TRACY ROSE MAKES IT! Assist: Derrick Durant
Score: 82-74

[10:48] Team_086 possession (Score: 82-74)
Rudy Rose drives, Pascal Lillard stays with him. Rudy Rose attempts a Layup. Contested by Pascal Lillard (2.3 feet, ZONE). RUDY ROSE MAKES IT!
Score: 84-74

[10:30] Team_098 possession (Score: 84-74)
FOUL! Shooting foul on Lauri Johnson. Blake Murray to the line for 3 free throws. [Team fouls: 1] (Lauri Johnson: 2 personal fouls)   FT 1/3: GOOD   FT 2/3: GOOD   FT 3/3: GOOD Blake Murray makes 3/3 from the line.
Score: 84-77

[10:15] Team_086 possession (Score: 84-77)
Lauri Johnson makes the Layup and draws the foul on Pascal Lillard! And-1! Lauri Johnson to the line for 1. [Team fouls: 4] (Pascal Lillard: 3 personal fouls)   FT 1/1: GOOD Lauri Johnson makes 1/1 from the line.
Score: 87-77

[10:02] Team_098 possession (Score: 87-77)
Tracy Rose attempts a Midrange. Wide open! Anfernee Harris is 6.4 feet away. [ZONE] TRACY ROSE MAKES IT! Assist: Pascal Lillard
Score: 87-79

[09:47] Team_086 possession (Score: 87-79)
FOUL! Holding foul on Derrick Durant. [IN THE BONUS! 5 team fouls] Rudy Rose to the line for 2 free throws. (Derrick Durant: 4 personal fouls)   FT 1/2: GOOD   FT 2/2: GOOD Rudy Rose makes 2/2 from the line.
Score: 89-79

[09:31] Team_098 possession (Score: 89-79)
FOUL! Shooting foul on Bones Ginobili. Tracy Rose to the line for 2 free throws. [Team fouls: 2] (Bones Ginobili: 3 personal fouls)   FT 1/2: GOOD   FT 2/2: GOOD Tracy Rose makes 2/2 from the line.
Score: 89-81

[09:13] Team_086 possession (Score: 89-81)
Rudy Rose makes the Layup and draws the foul on Pascal Lillard! And-1! Rudy Rose to the line for 1. [BONUS: 6 team fouls] (Pascal Lillard: 4 personal fouls)   FT 1/1: GOOD Rudy Rose makes 1/1 from the line.
Score: 92-81

[08:58] Team_098 possession (Score: 92-81)
Blake Murray attempts a 3Pt. Contested by Miles Gobert (2.7 feet, MAN). Blake Murray misses. Rebound secured by Rudy Rose.

[08:47] Team_086 possession (Score: 92-81)
Bones Ginobili attempts a Midrange. Contested by Pascal Lillard (5.2 feet, MAN). BONES GINOBILI MAKES IT! Assist: Anfernee Harris
Score: 94-81

[08:34] Team_098 possession (Score: 94-81)
Blake Murray attempts a Midrange. Contested by Miles Gobert (4.2 feet, ZONE). Blake Murray misses. Rebound secured by Rudy Rose.

[08:23] Team_086 possession (Score: 94-81)
FOUL! Reach-in foul on Nikola Rose during the drive. [IN THE BONUS! 7 team fouls] Anfernee Harris to the line for 2 free throws. (Nikola Rose: 8 personal fouls) Nikola Rose FOULS OUT!   FT 1/2: MISS   FT 2/2: GOOD Anfernee Harris makes 1/2 from the line.
Score: 95-81

[08:23] Substitution (Team_098): Nikola Rose OUT (stamina: 85) → Dirk McCollum IN (foul_out)

[08:04] Team_098 possession (Score: 95-81)
Dirk McCollum attempts a Layup. Contested by Rudy Rose (2.3 feet, ZONE). DIRK MCCOLLUM MAKES IT! Assist: Tracy Rose
Score: 95-83

[07:54] Team_086 possession (Score: 95-83)
Anfernee Harris attempts a 3Pt. Wide open! Dirk McCollum is 9.3 feet away. [MAN] ANFERNEE HARRIS MAKES IT!
Score: 98-83

[07:39] Team_098 possession (Score: 98-83)
Tracy Rose attempts a 3Pt. Contested by Lauri Johnson (2.1 feet, MAN). TRACY ROSE MAKES IT! Assist: Pascal Lillard
Score: 98-86

[07:25] Team_086 possession (Score: 98-86)
Anfernee Harris attempts a 3Pt. Contested by Dirk McCollum (2.7 feet, ZONE). Anfernee Harris misses. Rebound secured by Pascal Lillard.

[07:12] Team_098 possession (Score: 98-86)
Pascal Lillard attempts a 3Pt. Contested by Anfernee Harris (3.9 feet, ZONE). PASCAL LILLARD MAKES IT! Assist: Tracy Rose
Score: 98-89

[06:55] Team_086 possession (Score: 98-89)
Bones Ginobili attempts a Layup. Contested by Pascal Lillard (2.1 feet, ZONE). BONES GINOBILI MAKES IT!
Score: 100-89

[06:42] Team_098 possession (Score: 100-89)
Blake Murray attempts a Midrange. BLOCKED BY MILES GOBERT! Ball deflects out of bounds off Blake Murray.

[06:30] Team_086 possession (Score: 100-89)
Miles Gobert loses the ball! Stripped by Blake Murray! TURNOVER! (live ball)

[06:18] Team_098 possession (Score: 100-89)
Blake Murray attempts a 3Pt. Wide open! Lauri Johnson is 8.2 feet away. [ZONE] Blake Murray misses. Rebound secured by Rudy Rose.

[06:03] Team_086 possession (Score: 100-89)
Bones Ginobili drives and kicks out. Lauri Johnson attempts a 3Pt. Contested by Tracy Rose (3.2 feet, MAN). Lauri Johnson misses. Offensive rebound by Rudy Rose! Rudy Rose's putback is no good. Rebound secured by Pascal Lillard.

[05:49] Team_098 possession (Score: 100-89)
Tracy Rose attempts a 3Pt. Wide open! Lauri Johnson is 7.0 feet away. [MAN] TRACY ROSE MAKES IT! Assist: Derrick Durant
Score: 100-92

[05:30] Team_086 possession (Score: 100-92)
Rudy Rose makes the Dunk and draws the foul on Pascal Lillard! And-1! Rudy Rose to the line for 1. [BONUS: 8 team fouls] (Pascal Lillard: 5 personal fouls)   FT 1/1: GOOD Rudy Rose makes 1/1 from the line.
Score: 103-92

[05:11] Team_098 possession (Score: 103-92)
Tracy Rose attempts a 3Pt. Contested by Lauri Johnson (3.7 feet, MAN). Tracy Rose misses. Rebound secured by Miles Gobert.

[04:54] Team_086 possession (Score: 103-92)
Rudy Rose attempts a Midrange. Contested by Derrick Durant (5.2 feet, MAN). RUDY ROSE MAKES IT! Assist: Anfernee Harris
Score: 105-92

[04:40] Team_098 possession (Score: 105-92)
FOUL! Holding foul on Lauri Johnson. [Team fouls: 3] No free throws, side out. (Lauri Johnson: 3 personal fouls)

[04:40] Substitution (Team_086): Anfernee Harris OUT → Anthony James IN (stamina_rule2)

[04:40] Substitution (Team_086): Bones Ginobili OUT → Kyle McCollum IN (stamina_rule2)

[04:40] Substitution (Team_098): Blake Murray OUT → Kristaps Iverson IN (stamina_rule2)

[04:40] Substitution (Team_098): Derrick Durant OUT → Russell McGrady IN (stamina_rule2)

[04:40] Substitution (Team_098): Tracy Rose OUT → Malcolm Tatum IN (starter_return_rule1)

[04:26] Team_098 possession (Score: 105-92)
Kristaps Iverson attempts a Midrange. Contested by Anthony James (2.0 feet, ZONE). Kristaps Iverson misses. Rebound secured by Miles Gobert.

[04:08] Team_086 possession (Score: 105-92)
Lauri Johnson attempts a 3Pt. Contested by Malcolm Tatum (3.3 feet, MAN). Lauri Johnson misses. Rebound secured by Pascal Lillard.

[03:49] Team_098 possession (Score: 105-92)
Kristaps Iverson attempts a 3Pt. Contested by Lauri Johnson (2.7 feet, ZONE). KRISTAPS IVERSON MAKES IT! Assist: Pascal Lillard
Score: 105-95

[03:33] Team_086 possession (Score: 105-95)
Anthony James attempts a 3Pt. Contested by Malcolm Tatum (5.5 feet, ZONE). Anthony James misses. Offensive rebound by Miles Gobert! Miles Gobert kicks it out.

[03:20] Team_086 possession (Score: 105-95)
Miles Gobert attempts a Midrange. Contested by Kristaps Iverson (4.7 feet, ZONE). MILES GOBERT MAKES IT!
Score: 107-95

[03:08] Team_098 possession (Score: 107-95)
Pascal Lillard drives, Kyle McCollum stays with him. Pascal Lillard attempts a Layup. Wide open! Kyle McCollum is 8.5 feet away. [MAN] PASCAL LILLARD MAKES IT!
Score: 107-97

[02:54] Team_086 possession (Score: 107-97)
Lauri Johnson attempts a 3Pt. Contested by Malcolm Tatum (5.1 feet, MAN). Lauri Johnson misses. Rebound secured by Kristaps Iverson.

[02:40] Team_098 possession (Score: 107-97)
Malcolm Tatum attempts a 3Pt. Wide open! Lauri Johnson is 7.2 feet away. [ZONE] Malcolm Tatum misses. Offensive rebound by Pascal Lillard! Pascal Lillard kicks it out.

[02:26] Team_098 possession (Score: 107-97)
Malcolm Tatum attempts a 3Pt. Heavily contested by Lauri Johnson (0.7 feet, MAN)! MALCOLM TATUM MAKES IT! Assist: Dirk McCollum
Score: 107-100

[02:17] Team_086 possession (Score: 107-100)
Lauri Johnson drives to the basket... Lauri Johnson loses the ball! Stripped by Malcolm Tatum! TURNOVER! (live ball)

[02:06] Team_098 possession (Score: 107-100)
FOUL! Holding foul on Kyle McCollum. [Team fouls: 4] No free throws, side out. (Kyle McCollum: 3 personal fouls)

[02:06] Substitution (Team_098): Dirk McCollum OUT → Nikola Rose IN (starter_return_rule1)

[01:51] Team_098 possession (Score: 107-100)
Nikola Rose attempts a 3Pt. Contested by Lauri Johnson (2.7 feet, ZONE). NIKOLA ROSE MAKES IT! Assist: Kristaps Iverson
Score: 107-103

[01:38] Team_086 possession (Score: 107-103)
Anthony James attempts a Midrange. Wide open! Nikola Rose is 6.1 feet away. [ZONE] Anthony James misses. Offensive rebound by Miles Gobert! Miles Gobert kicks it out.

[01:27] Team_086 possession (Score: 107-103)
Lauri Johnson attempts a 3Pt. Contested by Pascal Lillard (3.6 feet, ZONE). Lauri Johnson misses. Offensive rebound by Miles Gobert! Miles Gobert kicks it out.

[01:13] Team_086 possession (Score: 107-103)
Rudy Rose attempts a 3Pt. Contested by Nikola Rose (3.5 feet, ZONE). Rudy Rose misses. Rebound secured by Kristaps Iverson.

[00:59] Team_098 possession (Score: 107-103)
FOUL! Reach-in foul on Rudy Rose during the drive. [IN THE BONUS! 5 team fouls] Kristaps Iverson to the line for 2 free throws. (Rudy Rose: 3 personal fouls)   FT 1/2: MISS   FT 2/2: GOOD Kristaps Iverson makes 1/2 from the line.
Score: 107-104

[00:45] Team_086 possession (Score: 107-104)
Kyle McCollum attempts a Midrange. Contested by Kristaps Iverson (3.3 feet, ZONE). KYLE MCCOLLUM MAKES IT! Assist: Anthony James
Score: 109-104

[00:34] Team_098 possession (Score: 109-104)
Pascal Lillard drives and kicks out. Russell McGrady attempts a Midrange. Heavily contested by Miles Gobert (1.2 feet, ZONE)! Russell McGrady misses. Offensive rebound by Kristaps Iverson! Kristaps Iverson kicks it out.

[00:16] Team_098 possession (Score: 109-104)
Kristaps Iverson attempts a 3Pt. Wide open! Lauri Johnson is 8.8 feet away. [ZONE] Kristaps Iverson misses. Offensive rebound by Pascal Lillard! Pascal Lillard kicks it out.

================================================================================
                              4TH QUARTER COMPLETE                              
================================================================================

4TH QUARTER SCORE: Team_086 30, Team_098 32

BOX SCORE:
================================================================================

Team_086
--------------------------------------------------------------------------------
Player                MIN  PTS  REB  AST  TO      FG   FG%      3P   3P%
--------------------------------------------------------------------------------
Rudy Rose              32   12    4    0   0   5/6    83.3     0/0   0.0
Anfernee Harris        24    6    0    2   0   3/4    75.0     0/0   0.0
Bones Ginobili         24    4    0    0   0   2/3    66.7     0/0   0.0
Lauri Johnson          28    3    0    0   0   1/3    33.3     0/0   0.0
Miles Gobert           32    2    5    0   0   1/1   100.0     0/0   0.0
Kyle McCollum          25    2    0    0   0   1/1   100.0     0/0   0.0
Anthony James          25    0    0    1   0   0/0     0.0     0/0   0.0

TEAM: FG: 13/18 (72.2%), 3PT: 1/5 (20.0%), REB: 10 (5 off, 5 def), AST: 3, TO: 3
TEAM FOULS: 5 [Team_098 in BONUS]


Team_098
--------------------------------------------------------------------------------
Player                MIN  PTS  REB  AST  TO      FG   FG%      3P   3P%
--------------------------------------------------------------------------------
Tracy Rose             27   12    0    2   0   5/6    83.3     0/0   0.0
Pascal Lillard         28    5    5    3   0   2/2   100.0     0/0   0.0
Kristaps Iverson       25    4    3    1   0   2/3    66.7     0/0   0.0
Blake Murray           24    3    0    0   0   1/5    20.0     0/0   0.0
Malcolm Tatum          21    3    0    0   0   1/1   100.0     0/0   0.0
Nikola Rose            22    3    0    0   0   1/1   100.0     0/0   0.0
Dirk McCollum          26    2    0    1   0   1/1   100.0     0/0   0.0
Derrick Durant         24    0    0    2   0   0/0     0.0     0/0   0.0

TEAM: FG: 13/19 (68.4%), 3PT: 7/10 (70.0%), REB: 7 (3 off, 4 def), AST: 9, TO: 1
TEAM FOULS: 8 [Team_086 in BONUS]

================================================================================

================================================================================
                               FULL GAME COMPLETE                               
================================================================================

FINAL SCORE: Team_086 109, Team_098 104

SCORING BY QUARTER:
--------------------------------------------------------------------------------
Team                     Q1     Q2     Q3     Q4    FINAL
--------------------------------------------------------------------------------
Team_086                 43     21     15     30      109
Team_098                 31     21     20     32      104
--------------------------------------------------------------------------------

FULL GAME BOX SCORE:
================================================================================

Team_086
--------------------------------------------------------------------------------
Player                MIN  PTS  REB  AST  TO      FG   FG%      3P   3P%      FT STL BLK
--------------------------------------------------------------------------------
Miles Gobert           32    2    8    3   2   1/6    16.7   0/3     0.0   0/0     0   1
Rudy Rose              32   19   12    2   3   6/7    85.7   0/1     0.0   7/7     3   0
Lauri Johnson          28   13    0    1   0   4/8    50.0   2/6    33.3   6/7     1   0
Anthony James          25    9    0    3   0   4/6    66.7   1/1   100.0   0/0     0   0
Kyle McCollum          25    9    1    0   1   4/7    57.1   1/2    50.0   0/0     0   0
Anfernee Harris        24   27    0    4   1  12/14   85.7   5/7    71.4   8/13    1   0
Bones Ginobili         24   14    3    1   0   6/8    75.0   1/1   100.0   1/1     0   0
Anfernee Green         20    5    9    1   0   2/9    22.2   1/4    25.0   0/0     1   0
Lamelo Towns           17    2    9    1   1   1/3    33.3   0/1     0.0   0/0     0   0
Franz McGrady          16    5    1    1   1   2/4    50.0   1/2    50.0   1/2     1   0

TEAM: FG: 45/76 (59.2%), 3PT: 12/28 (42.9%), REB: 42 (16 off, 26 def), AST: 17, TO: 9


Team_098
--------------------------------------------------------------------------------
Player                MIN  PTS  REB  AST  TO      FG   FG%      3P   3P%      FT STL BLK
--------------------------------------------------------------------------------
Pascal Lillard         28    8   12    5   0   2/3    66.7   1/2    50.0   0/0     0   0
Tracy Rose             27   19    0    3   4   9/12   75.0   3/4    75.0   3/4     0   0
Dirk McCollum          26    2    0    1   1   1/4    25.0   0/2     0.0   1/2     0   0
Kristaps Iverson       25   14   15    4   1   8/13   61.5   2/4    50.0   2/3     1   1
Russell McGrady        25   13    6    1   0   2/4    50.0   0/0     0.0   2/2     1   1
Blake Murray           24   14    0    0   1   5/12   41.7   4/7    57.1   6/6     1   1
Derrick Durant         24    0    2    5   2   0/1     0.0   0/1     0.0   0/0     3   0
Nikola Rose            22   15    3    4   3   6/7    85.7   3/4    75.0   2/2     1   0
Malcolm Tatum          21   11    0    0   2   5/9    55.6   2/6    33.3   1/2     1   0
Manu Jordan            20    4    5    2   0   3/4    75.0   1/1   100.0   0/0     1   1

TEAM: FG: 41/70 (58.6%), 3PT: 16/31 (51.6%), REB: 44 (14 off, 30 def), AST: 25, TO: 14

================================================================================
