GAME 3: Team_023 vs Team_096
====================================================================================================

================================================================================
                        FULL GAME - Team_023 vs Team_096                        
================================================================================

================================================================================
                       1ST QUARTER - Team_023 vs Team_096                       
================================================================================

[12:00] Team_023 possession (Score: 0-0)
Trae Ingram attempts a 3Pt. Contested by Terry Mobley (5.5 feet, MAN). Trae Ingram misses. Rebound secured by Cole Griffin.

[11:45] Team_096 possession (Score: 0-0)
Lamelo Quickley attempts a 3Pt. Contested by Collin Ginobili (3.4 feet, MAN). Lamelo Quickley misses. Rebound secured by Josh Morant.

[11:26] Team_023 possession (Score: 0-0)
Josh Morant drives and kicks out. Tim Bane attempts a Midrange. Contested by Cole Griffin (3.5 feet, ZONE). Tim Bane misses. Rebound secured by Scottie Herro.

[11:07] Team_096 possession (Score: 0-0)
FOUL! Shooting foul on Trae Ingram. Lamelo Quickley to the line for 3 free throws. [Team fouls: 1] (Trae Ingram: 1 personal fouls)   FT 1/3: GOOD   FT 2/3: MISS   FT 3/3: MISS Lamelo Quickley makes 1/3 from the line. Rebound secured by Tim Bane.
Score: 0-1

[10:55] Team_023 possession (Score: 0-1)
Collin Ginobili attempts a Layup. Wide open! Lamelo Quickley is 6.3 feet away. [MAN] COLLIN GINOBILI MAKES IT! Assist: Kyle Paul
Score: 2-1

[10:40] Team_096 possession (Score: 2-1)
Lamelo Quickley attempts a 3Pt. Wide open! Collin Ginobili is 6.9 feet away. [MAN] LAMELO QUICKLEY MAKES IT! Assist: Scottie Herro
Score: 2-4

[10:25] Team_023 possession (Score: 2-4)
Collin Ginobili attempts a Midrange. Contested by Terry Mobley (5.0 feet, ZONE). COLLIN GINOBILI MAKES IT!
Score: 4-4

[10:13] Team_096 possession (Score: 4-4)
Terry Mobley drives and kicks out. Lamelo Quickley attempts a 3Pt. Contested by Collin Ginobili (4.6 feet, MAN). LAMELO QUICKLEY MAKES IT! Assist: Kyrie Adebayo
Score: 4-7

[10:01] Team_023 possession (Score: 4-7)
Kyle Paul attempts a 3Pt. Contested by Cole Griffin (4.0 feet, MAN). Kyle Paul misses. Rebound secured by Scottie Herro.

[09:46] Team_096 possession (Score: 4-7)
Lamelo Quickley attempts a 3Pt. Contested by Collin Ginobili (4.2 feet, MAN). LAMELO QUICKLEY MAKES IT! Assist: Scottie Herro
Score: 4-10

[09:32] Team_023 possession (Score: 4-10)
Josh Morant attempts a Layup. Wide open! Scottie Herro is 6.2 feet away. [MAN] JOSH MORANT MAKES IT! Assist: Trae Ingram
Score: 6-10

[09:22] Team_096 possession (Score: 6-10)
FOUL! Shooting foul on Trae Ingram. Terry Mobley to the line for 3 free throws. [Team fouls: 2] (Trae Ingram: 2 personal fouls)   FT 1/3: GOOD   FT 2/3: GOOD   FT 3/3: MISS Terry Mobley makes 2/3 from the line. Rebound secured by Tim Bane.
Score: 6-12

[09:05] Team_023 possession (Score: 6-12)
Tim Bane drives, picks up Kyrie Adebayo. Help arrives from Lamelo Quickley! Tim Bane attempts a Layup. Heavily contested by Lamelo Quickley (0.6 feet, ZONE)! Tim Bane misses. Offensive rebound by Tim Bane! Tim Bane's putback is no good. Rebound secured by Scottie Herro.

[08:51] Team_096 possession (Score: 6-12)
Terry Mobley attempts a Midrange. Wide open! Tim Bane is 6.1 feet away. [ZONE] Terry Mobley misses. Rebound secured by Tim Bane.

[08:36] Team_023 possession (Score: 6-12)
Josh Morant throws a bad pass! Stolen by Scottie Herro! TURNOVER! (live ball)

[08:19] Team_096 possession (Score: 6-12)
FOUL! Holding foul on Collin Ginobili. [Team fouls: 3] No free throws, side out. (Collin Ginobili: 1 personal fouls)

[08:06] Team_096 possession (Score: 6-12)
Kyrie Adebayo makes the Layup and draws the foul on Tim Bane! And-1! Kyrie Adebayo to the line for 1. [Team fouls: 4] (Tim Bane: 1 personal fouls)   FT 1/1: GOOD Kyrie Adebayo makes 1/1 from the line.
Score: 6-15

[07:51] Team_023 possession (Score: 6-15)
Trae Ingram attempts a 3Pt. Heavily contested by Cole Griffin (1.6 feet, ZONE)! TRAE INGRAM MAKES IT! Assist: Tim Bane
Score: 9-15

[07:36] Team_096 possession (Score: 9-15)
Kyrie Adebayo attempts a Midrange. Wide open! Tim Bane is 10.0 feet away. [MAN] Kyrie Adebayo misses. Rebound secured by Kyle Paul.

[07:22] Team_023 possession (Score: 9-15)
Kyle Paul attempts a Midrange. Wide open! Cole Griffin is 7.1 feet away. [MAN] KYLE PAUL MAKES IT! Assist: Tim Bane
Score: 11-15

[07:08] Team_096 possession (Score: 11-15)
Terry Mobley attempts a Layup. Contested by Trae Ingram (3.7 feet, MAN). Terry Mobley misses. Rebound secured by Tim Bane.

[06:51] Team_023 possession (Score: 11-15)
Collin Ginobili drives and kicks out. Tim Bane attempts a Midrange. Wide open! Kyrie Adebayo is 10.0 feet away. [MAN] Tim Bane misses. Offensive rebound by Josh Morant! Josh Morant kicks it out.

[06:40] Team_023 possession (Score: 11-15)
Kyle Paul attempts a Midrange. Contested by Cole Griffin (5.0 feet, ZONE). KYLE PAUL MAKES IT! Assist: Trae Ingram
Score: 13-15

[06:22] Team_096 possession (Score: 13-15)
Terry Mobley throws a bad pass! Stolen by Trae Ingram! TURNOVER! (live ball)

[06:07] Team_023 possession (Score: 13-15)
Trae Ingram attempts a 3Pt. Contested by Cole Griffin (2.1 feet, ZONE). Trae Ingram misses. Rebound secured by Cole Griffin.

[05:51] Team_096 possession (Score: 13-15)
Scottie Herro attempts a Midrange. Contested by Josh Morant (4.2 feet, ZONE). Scottie Herro misses. Offensive rebound by Scottie Herro! Scottie Herro kicks it out.

[05:37] Team_096 possession (Score: 13-15)
Terry Mobley attempts a 3Pt. Heavily contested by Kyle Paul (1.5 feet, ZONE)! TERRY MOBLEY MAKES IT! Assist: Cole Griffin
Score: 13-18

[05:21] Team_023 possession (Score: 13-18)
Trae Ingram attempts a 3Pt. Contested by Terry Mobley (3.9 feet, MAN). Trae Ingram misses. Rebound secured by Scottie Herro.

[05:06] Team_096 possession (Score: 13-18)
Scottie Herro attempts a Midrange. Contested by Josh Morant (5.0 feet, MAN). Scottie Herro misses. Rebound secured by Josh Morant.

[04:51] Team_023 possession (Score: 13-18)
Kyle Paul drives and kicks out. Kyle Paul attempts a 3Pt. Contested by Cole Griffin (2.4 feet, MAN). Kyle Paul misses. Rebound secured by Kyrie Adebayo.

[04:35] Team_096 possession (Score: 13-18)
Cole Griffin loses the ball! Stripped by Kyle Paul! TURNOVER! (live ball)

[04:18] Team_023 possession (Score: 13-18)
Josh Morant attempts a Layup. Contested by Kyrie Adebayo (3.2 feet, ZONE). JOSH MORANT MAKES IT! Assist: Collin Ginobili
Score: 15-18

[04:08] Team_096 possession (Score: 15-18)
Cole Griffin attempts a 3Pt. Contested by Kyle Paul (2.7 feet, ZONE). COLE GRIFFIN MAKES IT! Assist: Scottie Herro
Score: 15-21

[03:54] Team_023 possession (Score: 15-21)
Josh Morant attempts a 3Pt. Wide open! Scottie Herro is 7.4 feet away. [MAN] JOSH MORANT MAKES IT! Assist: Trae Ingram
Score: 18-21

[03:42] Team_096 possession (Score: 18-21)
Terry Mobley throws a bad pass! Stolen by Trae Ingram! TURNOVER! (live ball)

[03:26] Team_023 possession (Score: 18-21)
Trae Ingram attempts a 3Pt. Contested by Cole Griffin (4.9 feet, ZONE). TRAE INGRAM MAKES IT! Assist: Kyle Paul
Score: 21-21

[03:12] Team_096 possession (Score: 21-21)
Scottie Herro attempts a 3Pt. Wide open! Trae Ingram is 6.1 feet away. [ZONE] Scottie Herro misses. Offensive rebound by Kyrie Adebayo! Kyrie Adebayo puts it back in!
Score: 21-23

[02:57] Team_023 possession (Score: 21-23)
Tim Bane attempts a Dunk. BLOCKED BY KYRIE ADEBAYO! Ball is loose! Rebound secured by Kyrie Adebayo.

[02:41] Team_096 possession (Score: 21-23)
Cole Griffin drives and kicks out. Cole Griffin attempts a 3Pt. Contested by Trae Ingram (3.3 feet, ZONE). Cole Griffin misses. Rebound secured by Kyle Paul.

[02:26] Team_023 possession (Score: 21-23)
FOUL! Shooting foul on Terry Mobley. Trae Ingram to the line for 3 free throws. [Team fouls: 1] (Terry Mobley: 1 personal fouls)   FT 1/3: GOOD   FT 2/3: GOOD   FT 3/3: GOOD Trae Ingram makes 3/3 from the line.
Score: 24-23

[02:09] Team_096 possession (Score: 24-23)
Kyrie Adebayo attempts a 3Pt. Contested by Tim Bane (4.8 feet, MAN). Kyrie Adebayo misses. Rebound secured by Tim Bane.

[01:52] Team_023 possession (Score: 24-23)
Trae Ingram attempts a 3Pt. Contested by Cole Griffin (4.8 feet, ZONE). Trae Ingram misses. Rebound secured by Scottie Herro.

[01:41] Team_096 possession (Score: 24-23)
Cole Griffin attempts a Midrange. Contested by Kyle Paul (5.3 feet, MAN). Cole Griffin misses. Rebound secured by Kyle Paul.

[01:28] Team_023 possession (Score: 24-23)
Josh Morant attempts a Layup. Contested by Kyrie Adebayo (3.7 feet, ZONE). Josh Morant misses. Rebound secured by Scottie Herro.

[01:18] Team_096 possession (Score: 24-23)
Cole Griffin attempts a 3Pt. Contested by Trae Ingram (4.7 feet, ZONE). Cole Griffin misses. Rebound secured by Kyle Paul.

[01:04] Team_023 possession (Score: 24-23)
Josh Morant drives and kicks out. Kyle Paul attempts a 3Pt. Contested by Cole Griffin (5.5 feet, ZONE). Kyle Paul misses. Rebound secured by Kyrie Adebayo.

[00:54] Team_096 possession (Score: 24-23)
FOUL! Shooting foul on Kyle Paul. Kyrie Adebayo to the line for 2 free throws. [BONUS: 5 team fouls] (Kyle Paul: 1 personal fouls)   FT 1/2: GOOD   FT 2/2: GOOD Kyrie Adebayo makes 2/2 from the line.
Score: 24-25

[00:37] Team_023 possession (Score: 24-25)
Josh Morant attempts a Layup. Contested by Kyrie Adebayo (3.0 feet, ZONE). Josh Morant misses. FOUL! Loose ball foul on Kyrie Adebayo during the rebound battle. [Team fouls: 2] No free throws, side out. (Kyrie Adebayo: 1 personal fouls)

[00:22] Team_023 possession (Score: 24-25)
Josh Morant drives, picks up Scottie Herro. Help arrives from Lamelo Quickley! Josh Morant attempts a Dunk. Contested by Lamelo Quickley (5.2 feet, MAN). JOSH MORANT MAKES IT! Assist: Collin Ginobili
Score: 26-25

[00:05] Team_096 possession (Score: 26-25)
FOUL! Reach-in foul on Kyle Paul during the drive. [IN THE BONUS! 6 team fouls] Cole Griffin to the line for 2 free throws. (Kyle Paul: 2 personal fouls)   FT 1/2: GOOD   FT 2/2: GOOD Cole Griffin makes 2/2 from the line.
Score: 26-27

================================================================================
                              1ST QUARTER COMPLETE                              
================================================================================

1ST QUARTER SCORE: Team_023 26, Team_096 27

BOX SCORE:
================================================================================

Team_023
--------------------------------------------------------------------------------
Player                MIN  PTS  REB  AST  TO      FG   FG%      3P   3P%
--------------------------------------------------------------------------------
Trae Ingram            12    9    0    3   0   3/7    42.9     0/0   0.0
Josh Morant            12    9    3    0   0   4/7    57.1     0/0   0.0
Collin Ginobili        12    4    0    2   0   2/2   100.0     0/0   0.0
Kyle Paul              12    4    4    2   0   2/4    50.0     0/0   0.0
Tim Bane               12    0    6    2   0   0/2     0.0     0/0   0.0

TEAM: FG: 11/22 (50.0%), 3PT: 4/9 (44.4%), REB: 14 (3 off, 11 def), AST: 9, TO: 1
TEAM FOULS: 6 [Team_096 in BONUS]


Team_096
--------------------------------------------------------------------------------
Player                MIN  PTS  REB  AST  TO      FG   FG%      3P   3P%
--------------------------------------------------------------------------------
Lamelo Quickley        12    9    0    0   0   3/5    60.0     0/0   0.0
Kyrie Adebayo          12    7    4    1   0   3/5    60.0     0/0   0.0
Cole Griffin           12    5    2    1   0   2/5    40.0     0/0   0.0
Terry Mobley           12    3    0    0   0   1/4    25.0     0/0   0.0
Scottie Herro          12    0    7    3   0   0/1     0.0     0/0   0.0

TEAM: FG: 9/20 (45.0%), 3PT: 5/10 (50.0%), REB: 12 (2 off, 10 def), AST: 5, TO: 3
TEAM FOULS: 2

================================================================================

================================================================================
                       2ND QUARTER - Team_023 vs Team_096                       
================================================================================

[12:00] Team_023 possession (Score: 26-27)
Trae Ingram attempts a 3Pt. Contested by Terry Mobley (5.7 feet, MAN). Trae Ingram misses. Rebound secured by Cole Griffin.

[11:45] Team_096 possession (Score: 26-27)
Lamelo Quickley attempts a 3Pt. Contested by Collin Ginobili (3.6 feet, MAN). Lamelo Quickley misses. Rebound secured by Josh Morant.

[11:26] Team_023 possession (Score: 26-27)
Josh Morant drives and kicks out. Tim Bane attempts a Midrange. Contested by Cole Griffin (3.6 feet, ZONE). Tim Bane misses. Rebound secured by Scottie Herro.

[11:07] Team_096 possession (Score: 26-27)
FOUL! Shooting foul on Trae Ingram. Lamelo Quickley to the line for 3 free throws. [Team fouls: 1] (Trae Ingram: 3 personal fouls)   FT 1/3: GOOD   FT 2/3: MISS   FT 3/3: MISS Lamelo Quickley makes 1/3 from the line. Rebound secured by Tim Bane.
Score: 26-28

[10:55] Team_023 possession (Score: 26-28)
Collin Ginobili attempts a Layup. Wide open! Lamelo Quickley is 6.5 feet away. [MAN] COLLIN GINOBILI MAKES IT! Assist: Kyle Paul
Score: 28-28

[10:40] Team_096 possession (Score: 28-28)
Lamelo Quickley attempts a 3Pt. Wide open! Collin Ginobili is 7.2 feet away. [MAN] LAMELO QUICKLEY MAKES IT! Assist: Scottie Herro
Score: 28-31

[10:25] Team_023 possession (Score: 28-31)
Collin Ginobili attempts a Midrange. Contested by Terry Mobley (5.3 feet, ZONE). COLLIN GINOBILI MAKES IT!
Score: 30-31

[10:13] Team_096 possession (Score: 30-31)
Terry Mobley drives and kicks out. Lamelo Quickley attempts a 3Pt. Contested by Collin Ginobili (4.9 feet, MAN). LAMELO QUICKLEY MAKES IT! Assist: Kyrie Adebayo
Score: 30-34

[10:01] Team_023 possession (Score: 30-34)
Kyle Paul attempts a 3Pt. Contested by Cole Griffin (4.2 feet, MAN). Kyle Paul misses. Rebound secured by Scottie Herro.

[09:46] Team_096 possession (Score: 30-34)
Lamelo Quickley attempts a Midrange. Contested by Collin Ginobili (4.5 feet, MAN). LAMELO QUICKLEY MAKES IT! Assist: Scottie Herro
Score: 30-36

[09:31] Team_023 possession (Score: 30-36)
Josh Morant makes the Layup and draws the foul on Scottie Herro! And-1! Josh Morant to the line for 1. [Team fouls: 1] (Scottie Herro: 1 personal fouls)   FT 1/1: GOOD Josh Morant makes 1/1 from the line.
Score: 33-36

[09:17] Team_096 possession (Score: 33-36)
Terry Mobley attempts a 3Pt. Contested by Trae Ingram (3.2 feet, MAN). Terry Mobley misses. Rebound secured by Kyle Paul.

[09:02] Team_023 possession (Score: 33-36)
Trae Ingram attempts a 3Pt. Contested by Cole Griffin (4.5 feet, ZONE). Trae Ingram misses. Rebound secured by Scottie Herro.

[08:52] Team_096 possession (Score: 33-36)
Lamelo Quickley throws a bad pass! Stolen by Collin Ginobili! TURNOVER! (live ball)

[08:36] Team_023 possession (Score: 33-36)
Collin Ginobili makes the 3Pt and draws the foul on Cole Griffin! And-1! Collin Ginobili to the line for 1. [Team fouls: 2] (Cole Griffin: 1 personal fouls)   FT 1/1: GOOD Collin Ginobili makes 1/1 from the line.
Score: 37-36

[08:21] Team_096 possession (Score: 37-36)
Terry Mobley attempts a Layup. BLOCKED BY TRAE INGRAM! Ball is loose! Rebound secured by Kyle Paul.

[08:03] Team_023 possession (Score: 37-36)
Trae Ingram drives and kicks out. FOUL! Shooting foul on Scottie Herro. Josh Morant to the line for 2 free throws. [Team fouls: 3] (Scottie Herro: 2 personal fouls)   FT 1/2: GOOD   FT 2/2: GOOD Josh Morant makes 2/2 from the line.
Score: 39-36

[07:53] Team_096 possession (Score: 39-36)
FOUL! Shooting foul on Tim Bane. Kyrie Adebayo to the line for 2 free throws. [Team fouls: 2] (Tim Bane: 2 personal fouls)   FT 1/2: GOOD   FT 2/2: GOOD Kyrie Adebayo makes 2/2 from the line.
Score: 39-38

[07:41] Team_023 possession (Score: 39-38)
Collin Ginobili attempts a 3Pt. Contested by Lamelo Quickley (4.5 feet, MAN). Collin Ginobili misses. Offensive rebound by Josh Morant! Josh Morant kicks it out.

[07:29] Team_023 possession (Score: 39-38)
Josh Morant attempts a 3Pt. Wide open! Scottie Herro is 6.3 feet away. [MAN] JOSH MORANT MAKES IT! Assist: Trae Ingram
Score: 42-38

[07:13] Team_096 possession (Score: 42-38)
Cole Griffin attempts a 3Pt. Wide open! Trae Ingram is 6.9 feet away. [ZONE] COLE GRIFFIN MAKES IT! Assist: Lamelo Quickley
Score: 42-41

[07:01] Team_023 possession (Score: 42-41)
Josh Morant attempts a Midrange. Wide open! Scottie Herro is 6.3 feet away. [ZONE] Josh Morant misses. Offensive rebound by Josh Morant! Josh Morant kicks it out.

[06:50] Team_023 possession (Score: 42-41)
Kyle Paul attempts a Midrange. Contested by Cole Griffin (4.6 feet, ZONE). KYLE PAUL MAKES IT! Assist: Tim Bane
Score: 44-41

[06:36] Team_096 possession (Score: 44-41)
Terry Mobley attempts a Midrange. Contested by Josh Morant (5.6 feet, ZONE). TERRY MOBLEY MAKES IT!
Score: 44-43

[06:18] Team_023 possession (Score: 44-43)
Collin Ginobili attempts a Midrange. Contested by Lamelo Quickley (3.3 feet, MAN). Collin Ginobili misses. Offensive rebound by Josh Morant! Josh Morant kicks it out.

[06:02] Team_023 possession (Score: 44-43)
Tim Bane attempts a Dunk. BLOCKED BY KYRIE ADEBAYO! Ball is loose! Rebound secured by Kyrie Adebayo.

[05:48] Team_096 possession (Score: 44-43)
Cole Griffin attempts a 3Pt. Contested by Kyle Paul (5.8 feet, MAN). Cole Griffin misses. Rebound secured by Josh Morant.

[05:31] Team_023 possession (Score: 44-43)
Josh Morant attempts a Midrange. Wide open! Terry Mobley is 6.8 feet away. [ZONE] JOSH MORANT MAKES IT!
Score: 46-43

[05:16] Team_096 possession (Score: 46-43)
Lamelo Quickley attempts a 3Pt. Wide open! Trae Ingram is 7.6 feet away. [ZONE] Lamelo Quickley misses. Rebound secured by Josh Morant.

[05:00] Team_023 possession (Score: 46-43)
Trae Ingram drives and kicks out. Trae Ingram attempts a Midrange. Wide open! Terry Mobley is 6.8 feet away. [MAN] TRAE INGRAM MAKES IT! Assist: Josh Morant
Score: 48-43

[04:46] Team_096 possession (Score: 48-43)
FOUL! Holding foul on Trae Ingram. [Team fouls: 3] No free throws, side out. (Trae Ingram: 4 personal fouls)

[04:46] Substitution (Team_023): Trae Ingram OUT → Tracy Anthony IN (stamina_rule2)

[04:46] Substitution (Team_023): Collin Ginobili OUT → Magic Booker IN (stamina_rule2)

[04:46] Substitution (Team_023): Kyle Paul OUT → Gary Westbrook IN (stamina_rule2)

[04:46] Substitution (Team_023): Josh Morant OUT → Evan Parker IN (stamina_rule2)

[04:46] Substitution (Team_023): Tim Bane OUT → Vince Gasol IN (stamina_rule2)

[04:46] Substitution (Team_096): Terry Mobley OUT → Cade Jokic IN (stamina_rule2)

[04:46] Substitution (Team_096): Lamelo Quickley OUT → Jarrett Markkanen IN (stamina_rule2)

[04:46] Substitution (Team_096): Cole Griffin OUT → Cole Holiday IN (stamina_rule2)

[04:46] Substitution (Team_096): Scottie Herro OUT → Tyler Haliburton IN (stamina_rule2)

[04:46] Substitution (Team_096): Kyrie Adebayo OUT → Devin Griffin IN (stamina_rule2)

[04:31] Team_096 possession (Score: 48-43)
FOUL! Holding foul on Gary Westbrook. [Team fouls: 4] No free throws, side out. (Gary Westbrook: 1 personal fouls)

[04:18] Team_096 possession (Score: 48-43)
Tyler Haliburton attempts a 3Pt. Wide open! Tracy Anthony is 7.2 feet away. [ZONE] Tyler Haliburton misses. Offensive rebound by Devin Griffin! Devin Griffin kicks it out.

[04:05] Team_096 possession (Score: 48-43)
Cole Holiday attempts a 3Pt. Contested by Magic Booker (3.8 feet, ZONE). Cole Holiday misses. Rebound secured by Vince Gasol.

[03:51] Team_023 possession (Score: 48-43)
FOUL! Reach-in foul on Devin Griffin during the drive. [Team fouls: 4] No free throws, side out. (Devin Griffin: 1 personal fouls)

[03:36] Team_023 possession (Score: 48-43)
FOUL! Shooting foul on Jarrett Markkanen. Tracy Anthony to the line for 2 free throws. [BONUS: 5 team fouls] (Jarrett Markkanen: 1 personal fouls)   FT 1/2: GOOD   FT 2/2: GOOD Tracy Anthony makes 2/2 from the line.
Score: 50-43

[03:18] Team_096 possession (Score: 50-43)
Tyler Haliburton drives, picks up Evan Parker. Help arrives from Magic Booker! Tyler Haliburton attempts a Dunk. Contested by Magic Booker (2.7 feet, MAN). TYLER HALIBURTON MAKES IT! Assist: Cade Jokic
Score: 50-45

[03:07] Team_023 possession (Score: 50-45)
Gary Westbrook attempts a 3Pt. Contested by Tyler Haliburton (4.5 feet, ZONE). Gary Westbrook misses. Rebound secured by Devin Griffin.

[02:53] Team_096 possession (Score: 50-45)
Tyler Haliburton drives, picks up Evan Parker. Help arrives from Magic Booker! Tyler Haliburton attempts a Layup. Contested by Magic Booker (3.6 feet, MAN). TYLER HALIBURTON MAKES IT!
Score: 50-47

[02:39] Team_023 possession (Score: 50-47)
Evan Parker throws a bad pass! Stolen by Tyler Haliburton! TURNOVER! (live ball)

[02:28] Team_096 possession (Score: 50-47)
Cade Jokic attempts a Midrange. Contested by Tracy Anthony (5.9 feet, MAN). CADE JOKIC MAKES IT!
Score: 50-49

[02:15] Team_023 possession (Score: 50-49)
Vince Gasol attempts a Layup. Contested by Devin Griffin (4.1 feet, ZONE). VINCE GASOL MAKES IT! Assist: Magic Booker
Score: 52-49

[01:57] Team_096 possession (Score: 52-49)
FOUL! Shooting foul on Gary Westbrook. Cade Jokic to the line for 2 free throws. [BONUS: 5 team fouls] (Gary Westbrook: 2 personal fouls)   FT 1/2: GOOD   FT 2/2: GOOD Cade Jokic makes 2/2 from the line.
Score: 52-51

[01:42] Team_023 possession (Score: 52-51)
Tracy Anthony attempts a 3Pt. Contested by Cade Jokic (3.5 feet, ZONE). TRACY ANTHONY MAKES IT! Assist: Vince Gasol
Score: 55-51

[01:28] Team_096 possession (Score: 55-51)
Cade Jokic attempts a 3Pt. Contested by Tracy Anthony (3.9 feet, ZONE). Cade Jokic misses. Rebound secured by Vince Gasol.

[01:10] Team_023 possession (Score: 55-51)
Vince Gasol drives, picks up Devin Griffin. Help arrives from Jarrett Markkanen! Vince Gasol attempts a Dunk. Contested by Jarrett Markkanen (5.2 feet, MAN). VINCE GASOL MAKES IT!
Score: 57-51

[00:57] Team_096 possession (Score: 57-51)
Cade Jokic attempts a 3Pt. Contested by Tracy Anthony (4.9 feet, ZONE). Cade Jokic misses. Rebound secured by Gary Westbrook.

[00:43] Team_023 possession (Score: 57-51)
Vince Gasol throws a bad pass out of bounds! TURNOVER! (dead ball)

[00:27] Team_096 possession (Score: 57-51)
FOUL! Holding foul on Vince Gasol. [IN THE BONUS! 6 team fouls] Devin Griffin to the line for 2 free throws. (Vince Gasol: 1 personal fouls)   FT 1/2: GOOD   FT 2/2: MISS Devin Griffin makes 1/2 from the line. Offensive rebound by Tyler Haliburton! Tyler Haliburton kicks it out.
Score: 57-52

[00:08] Team_096 possession (Score: 57-52)
FOUL! Holding foul on Tracy Anthony. [IN THE BONUS! 7 team fouls] Cade Jokic to the line for 2 free throws. (Tracy Anthony: 1 personal fouls)   FT 1/2: GOOD   FT 2/2: GOOD Cade Jokic makes 2/2 from the line.
Score: 57-54

================================================================================
                              2ND QUARTER COMPLETE                              
================================================================================

2ND QUARTER SCORE: Team_023 31, Team_096 27

BOX SCORE:
================================================================================

Team_023
--------------------------------------------------------------------------------
Player                MIN  PTS  REB  AST  TO      FG   FG%      3P   3P%
--------------------------------------------------------------------------------
Josh Morant            20   10    6    1   0   4/5    80.0     0/0   0.0
Collin Ginobili        20    8    0    0   0   3/3   100.0     0/0   0.0
Tracy Anthony           5    5    0    0   0   2/2   100.0     0/0   0.0
Vince Gasol             5    4    2    1   0   2/2   100.0     0/0   0.0
Trae Ingram            20    2    0    1   0   1/3    33.3     0/0   0.0
Kyle Paul              20    2    2    1   0   1/2    50.0     0/0   0.0
Tim Bane               20    0    1    1   0   0/1     0.0     0/0   0.0
Gary Westbrook          5    0    1    0   0   0/1     0.0     0/0   0.0
Magic Booker            5    0    0    1   0   0/0     0.0     0/0   0.0

TEAM: FG: 13/19 (68.4%), 3PT: 3/7 (42.9%), REB: 12 (3 off, 9 def), AST: 6, TO: 2
TEAM FOULS: 7 [Team_096 in BONUS]


Team_096
--------------------------------------------------------------------------------
Player                MIN  PTS  REB  AST  TO      FG   FG%      3P   3P%
--------------------------------------------------------------------------------
Lamelo Quickley        20    8    0    1   0   3/6    50.0     0/0   0.0
Cade Jokic              5    6    0    1   0   3/5    60.0     0/0   0.0
Tyler Haliburton        5    4    1    0   0   2/2   100.0     0/0   0.0
Cole Griffin           20    3    1    0   0   1/2    50.0     0/0   0.0
Kyrie Adebayo          20    2    1    1   0   1/1   100.0     0/0   0.0
Terry Mobley           20    2    0    0   0   1/3    33.3     0/0   0.0
Scottie Herro          20    0    3    2   0   0/0     0.0     0/0   0.0
Devin Griffin           5    0    2    0   0   0/0     0.0     0/0   0.0
Cole Holiday            5    0    0    0   0   0/1     0.0     0/0   0.0

TEAM: FG: 11/20 (55.0%), 3PT: 2/10 (20.0%), REB: 8 (2 off, 6 def), AST: 5, TO: 1
TEAM FOULS: 5 [Team_023 in BONUS]

================================================================================

================================================================================
                       3RD QUARTER - Team_023 vs Team_096                       
================================================================================

[12:00] Team_023 possession (Score: 57-54)
Tracy Anthony attempts a 3Pt. Wide open! Cade Jokic is 6.4 feet away. [MAN] Tracy Anthony misses. Rebound secured by Devin Griffin.

[11:45] Team_096 possession (Score: 57-54)
FOUL! Offensive foul on Devin Griffin! Vince Gasol drew the charge! [Team fouls: 1] (Devin Griffin: 2 personal fouls) TURNOVER! (dead ball)

[11:30] Team_023 possession (Score: 57-54)
Vince Gasol attempts a Layup. Contested by Devin Griffin (2.3 feet, ZONE). VINCE GASOL MAKES IT! Assist: Tracy Anthony
Score: 59-54

[11:17] Team_096 possession (Score: 59-54)
Cole Holiday attempts a Midrange. Contested by Gary Westbrook (3.2 feet, MAN). COLE HOLIDAY MAKES IT!
Score: 59-56

[11:04] Team_023 possession (Score: 59-56)
Vince Gasol attempts a Midrange. Contested by Devin Griffin (5.8 feet, MAN). Vince Gasol misses. Offensive rebound by Vince Gasol! Vince Gasol puts it back in!
Score: 61-56

[10:49] Team_096 possession (Score: 61-56)
FOUL! Reach-in foul on Gary Westbrook during the drive. [Team fouls: 1] No free throws, side out. (Gary Westbrook: 3 personal fouls)

[10:37] Team_096 possession (Score: 61-56)
Jarrett Markkanen attempts a Layup. Contested by Magic Booker (3.4 feet, MAN). JARRETT MARKKANEN MAKES IT! Assist: Tyler Haliburton
Score: 61-58

[10:22] Team_023 possession (Score: 61-58)
Magic Booker drives and kicks out. Tracy Anthony attempts a Midrange. Contested by Cade Jokic (5.3 feet, MAN). TRACY ANTHONY MAKES IT!
Score: 63-58

[10:06] Team_096 possession (Score: 63-58)
Jarrett Markkanen attempts a Midrange. Contested by Gary Westbrook (5.1 feet, ZONE). JARRETT MARKKANEN MAKES IT!
Score: 63-60

[09:54] Team_023 possession (Score: 63-60)
Evan Parker attempts a 3Pt. Wide open! Tyler Haliburton is 8.3 feet away. [MAN] Evan Parker misses. Rebound secured by Tyler Haliburton.

[09:37] Team_096 possession (Score: 63-60)
Tyler Haliburton drives, picks up Vince Gasol. Help arrives from Magic Booker! Tyler Haliburton attempts a Layup. Heavily contested by Magic Booker (1.7 feet, ZONE)! TYLER HALIBURTON MAKES IT! Assist: Jarrett Markkanen
Score: 63-62

[09:23] Team_023 possession (Score: 63-62)
FOUL! Holding foul on Devin Griffin. [Team fouls: 2] No free throws, side out. (Devin Griffin: 3 personal fouls)

[09:05] Team_023 possession (Score: 63-62)
Tracy Anthony attempts a Midrange. Wide open! Cade Jokic is 9.1 feet away. [MAN] Tracy Anthony misses. Rebound secured by Jarrett Markkanen.

[08:54] Team_096 possession (Score: 63-62)
Devin Griffin attempts a Midrange. Contested by Gary Westbrook (4.2 feet, ZONE). Devin Griffin misses. Rebound secured by Gary Westbrook.

[08:40] Team_023 possession (Score: 63-62)
FOUL! Shooting foul on Jarrett Markkanen. Tracy Anthony to the line for 2 free throws. [Team fouls: 3] (Jarrett Markkanen: 2 personal fouls)   FT 1/2: GOOD   FT 2/2: GOOD Tracy Anthony makes 2/2 from the line.
Score: 65-62

[08:26] Team_096 possession (Score: 65-62)
FOUL! Reach-in foul on Evan Parker during the drive. [Team fouls: 2] No free throws, side out. (Evan Parker: 1 personal fouls)

[08:12] Team_096 possession (Score: 65-62)
Cade Jokic attempts a 3Pt. Contested by Tracy Anthony (3.7 feet, ZONE). CADE JOKIC MAKES IT! Assist: Tyler Haliburton
Score: 65-65

[07:57] Team_023 possession (Score: 65-65)
Magic Booker drives and kicks out. Evan Parker attempts a 3Pt. Contested by Tyler Haliburton (5.5 feet, MAN). Evan Parker misses. Rebound secured by Devin Griffin.

[07:40] Team_096 possession (Score: 65-65)
Cole Holiday attempts a 3Pt. Contested by Gary Westbrook (4.2 feet, MAN). COLE HOLIDAY MAKES IT! Assist: Cade Jokic
Score: 65-68

[07:28] Team_023 possession (Score: 65-68)
Evan Parker drives, Tyler Haliburton stays with him. Evan Parker attempts a Dunk. Contested by Tyler Haliburton (3.8 feet, MAN). EVAN PARKER MAKES IT! Assist: Vince Gasol
Score: 67-68

[07:15] Team_096 possession (Score: 67-68)
Cole Holiday drives, picks up Gary Westbrook. Help arrives from Magic Booker! Cole Holiday attempts a Layup. Heavily contested by Magic Booker (1.5 feet, MAN)! Cole Holiday misses. Offensive rebound by Tyler Haliburton! Tyler Haliburton kicks it out.

[07:03] Team_096 possession (Score: 67-68)
Tyler Haliburton attempts a 3Pt. Contested by Evan Parker (4.4 feet, MAN). Tyler Haliburton misses. Rebound secured by Vince Gasol.

[06:46] Team_023 possession (Score: 67-68)
Magic Booker attempts a 3Pt. Contested by Cade Jokic (3.9 feet, ZONE). Magic Booker misses. Rebound secured by Devin Griffin.

[06:28] Team_096 possession (Score: 67-68)
Cole Holiday drives, Gary Westbrook stays with him. Cole Holiday attempts a Dunk. Contested by Gary Westbrook (5.9 feet, MAN). Cole Holiday misses. Offensive rebound by Devin Griffin! Devin Griffin kicks it out.

[06:14] Team_096 possession (Score: 67-68)
Jarrett Markkanen attempts a Midrange. Contested by Magic Booker (5.8 feet, ZONE). Jarrett Markkanen misses. Offensive rebound by Devin Griffin! Devin Griffin kicks it out.

[06:00] Team_096 possession (Score: 67-68)
Tyler Haliburton attempts a Midrange. Contested by Evan Parker (3.6 feet, MAN). Tyler Haliburton misses. Offensive rebound by Tyler Haliburton! Tyler Haliburton kicks it out.

[05:45] Team_096 possession (Score: 67-68)
Cole Holiday drives and kicks out. Devin Griffin attempts a Midrange. Wide open! Gary Westbrook is 7.2 feet away. [ZONE] Devin Griffin misses. Offensive rebound by Tyler Haliburton! Tyler Haliburton kicks it out.

[05:30] Team_096 possession (Score: 67-68)
Cade Jokic attempts a 3Pt. Contested by Magic Booker (4.8 feet, ZONE). Cade Jokic misses. Rebound secured by Evan Parker.

[05:19] Team_023 possession (Score: 67-68)
Evan Parker makes the Layup and draws the foul on Tyler Haliburton! And-1! Evan Parker to the line for 1. [Team fouls: 4] (Tyler Haliburton: 1 personal fouls)   FT 1/1: GOOD Evan Parker makes 1/1 from the line.
Score: 70-68

[05:07] Team_096 possession (Score: 70-68)
Devin Griffin attempts a Midrange. Heavily contested by Vince Gasol (1.5 feet, MAN)! Devin Griffin misses. Rebound secured by Evan Parker.

[04:51] Team_023 possession (Score: 70-68)
Tracy Anthony attempts a Midrange. Contested by Tyler Haliburton (4.5 feet, ZONE). TRACY ANTHONY MAKES IT!
Score: 72-68

[04:41] Team_096 possession (Score: 72-68)
Jarrett Markkanen attempts a 3Pt. Contested by Magic Booker (3.9 feet, MAN). JARRETT MARKKANEN MAKES IT!
Score: 72-71

[04:29] Team_023 possession (Score: 72-71)
Evan Parker attempts a Midrange. Contested by Jarrett Markkanen (3.9 feet, ZONE). Evan Parker misses. Rebound secured by Jarrett Markkanen.

[04:15] Team_096 possession (Score: 72-71)
Jarrett Markkanen makes the 3Pt and draws the foul on Magic Booker! And-1! Jarrett Markkanen to the line for 1. [Team fouls: 3] (Magic Booker: 1 personal fouls)   FT 1/1: GOOD Jarrett Markkanen makes 1/1 from the line.
Score: 72-75

[04:00] Team_023 possession (Score: 72-75)
Magic Booker attempts a 3Pt. Wide open! Jarrett Markkanen is 6.1 feet away. [MAN] Magic Booker misses. Offensive rebound by Vince Gasol! Vince Gasol puts it back in!
Score: 74-75

[03:48] Team_096 possession (Score: 74-75)
Jarrett Markkanen drives to the basket... Jarrett Markkanen throws a bad pass! Stolen by Vince Gasol! TURNOVER! (live ball)

[03:37] Team_023 possession (Score: 74-75)
Gary Westbrook attempts a 3Pt. Wide open! Cade Jokic is 6.1 feet away. [ZONE] Gary Westbrook misses. Rebound secured by Devin Griffin.

[03:24] Team_096 possession (Score: 74-75)
Cade Jokic attempts a 3Pt. Contested by Tracy Anthony (2.9 feet, MAN). Cade Jokic misses. Rebound secured by Vince Gasol.

[03:11] Team_023 possession (Score: 74-75)
Gary Westbrook drives and kicks out. Tracy Anthony attempts a 3Pt. Contested by Cade Jokic (5.3 feet, ZONE). Tracy Anthony misses. Rebound secured by Jarrett Markkanen.

[02:58] Team_096 possession (Score: 74-75)
Cole Holiday attempts a 3Pt. Contested by Magic Booker (4.0 feet, ZONE). COLE HOLIDAY MAKES IT! Assist: Tyler Haliburton
Score: 74-78

[02:49] Team_023 possession (Score: 74-78)
FOUL! Shooting foul on Tyler Haliburton. Evan Parker to the line for 2 free throws. [BONUS: 5 team fouls] (Tyler Haliburton: 2 personal fouls)   FT 1/2: GOOD   FT 2/2: GOOD Evan Parker makes 2/2 from the line.
Score: 76-78

[02:32] Team_096 possession (Score: 76-78)
Cole Holiday attempts a 3Pt. Contested by Gary Westbrook (2.4 feet, MAN). Cole Holiday misses. Rebound secured by Vince Gasol.

[02:19] Team_023 possession (Score: 76-78)
Evan Parker attempts a 3Pt. Contested by Tyler Haliburton (4.2 feet, MAN). Evan Parker misses. Rebound secured by Devin Griffin.

[02:07] Team_096 possession (Score: 76-78)
Jarrett Markkanen attempts a 3Pt. Contested by Magic Booker (4.1 feet, MAN). Jarrett Markkanen misses. Rebound secured by Evan Parker.

[01:49] Team_023 possession (Score: 76-78)
Tracy Anthony attempts a 3Pt. Wide open! Cade Jokic is 7.8 feet away. [ZONE] Tracy Anthony misses. Rebound secured by Devin Griffin.

[01:33] Team_096 possession (Score: 76-78)
Cade Jokic attempts a 3Pt. Contested by Tracy Anthony (5.2 feet, MAN). Cade Jokic misses. Rebound secured by Gary Westbrook.

[01:16] Team_023 possession (Score: 76-78)
Gary Westbrook attempts a Midrange. Wide open! Jarrett Markkanen is 10.0 feet away. [ZONE] Gary Westbrook misses. Rebound secured by Devin Griffin.

[00:58] Team_096 possession (Score: 76-78)
Cole Holiday attempts a Midrange. Contested by Gary Westbrook (4.9 feet, MAN). COLE HOLIDAY MAKES IT!
Score: 76-80

[00:43] Team_023 possession (Score: 76-80)
Magic Booker attempts a 3Pt. Contested by Jarrett Markkanen (5.1 feet, MAN). Magic Booker misses. Rebound secured by Devin Griffin.

[00:31] Team_096 possession (Score: 76-80)
Jarrett Markkanen drives, picks up Magic Booker. Help arrives from Gary Westbrook! Jarrett Markkanen attempts a Dunk. Contested by Gary Westbrook (3.0 feet, MAN). Jarrett Markkanen misses. Rebound secured by Vince Gasol.

[00:20] Team_023 possession (Score: 76-80)
Tracy Anthony attempts a 3Pt. Contested by Cade Jokic (2.7 feet, MAN). Tracy Anthony misses. Rebound secured by Devin Griffin.

[00:10] Team_096 possession (Score: 76-80)
Jarrett Markkanen drives and kicks out. Tyler Haliburton attempts a 3Pt. Contested by Evan Parker (3.2 feet, MAN). Tyler Haliburton misses. Rebound secured by Vince Gasol.

================================================================================
                              3RD QUARTER COMPLETE                              
================================================================================

3RD QUARTER SCORE: Team_023 19, Team_096 26

BOX SCORE:
================================================================================

Team_023
--------------------------------------------------------------------------------
Player                MIN  PTS  REB  AST  TO      FG   FG%      3P   3P%
--------------------------------------------------------------------------------
Evan Parker            17    7    3    0   0   3/6    50.0     0/0   0.0
Tracy Anthony          17    6    0    1   0   3/7    42.9     0/0   0.0
Vince Gasol            17    6    7    1   0   3/3   100.0     0/0   0.0
Gary Westbrook         17    0    2    0   0   0/3     0.0     0/0   0.0
Magic Booker           17    0    0    0   0   0/3     0.0     0/0   0.0

TEAM: FG: 9/22 (40.9%), 3PT: 1/9 (11.1%), REB: 12 (2 off, 10 def), AST: 2, TO: 0
TEAM FOULS: 3


Team_096
--------------------------------------------------------------------------------
Player                MIN  PTS  REB  AST  TO      FG   FG%      3P   3P%
--------------------------------------------------------------------------------
Jarrett Markkanen      17   11    3    1   0   4/7    57.1     0/0   0.0
Cole Holiday           17   10    0    0   0   4/5    80.0     0/0   0.0
Cade Jokic             17    3    0    1   0   1/4    25.0     0/0   0.0
Tyler Haliburton       17    2    4    3   0   1/2    50.0     0/0   0.0
Devin Griffin          17    0   11    0   0   0/2     0.0     0/0   0.0

TEAM: FG: 10/20 (50.0%), 3PT: 5/11 (45.5%), REB: 18 (5 off, 13 def), AST: 5, TO: 2
TEAM FOULS: 5 [Team_023 in BONUS]

================================================================================

================================================================================
                       4TH QUARTER - Team_023 vs Team_096                       
================================================================================

[12:00] Team_023 possession (Score: 76-80)
Tracy Anthony attempts a 3Pt. Wide open! Cade Jokic is 6.5 feet away. [MAN] Tracy Anthony misses. Rebound secured by Devin Griffin.

[11:45] Team_096 possession (Score: 76-80)
FOUL! Offensive foul on Devin Griffin! Vince Gasol drew the charge! [Team fouls: 1] (Devin Griffin: 4 personal fouls) TURNOVER! (dead ball)

[11:45] Substitution (Team_023): Tracy Anthony OUT → Trae Ingram IN (starter_return_rule1)

[11:45] Substitution (Team_023): Trae Ingram OUT → Collin Ginobili IN (starter_return_rule1)

[11:45] Substitution (Team_023): Gary Westbrook OUT → Kyle Paul IN (starter_return_rule1)

[11:45] Substitution (Team_023): Kyle Paul OUT → Josh Morant IN (starter_return_rule1)

[11:45] Substitution (Team_023): Vince Gasol OUT → Tim Bane IN (starter_return_rule1)

[11:45] Substitution (Team_096): Cade Jokic OUT → Terry Mobley IN (starter_return_rule1)

[11:45] Substitution (Team_096): Terry Mobley OUT → Lamelo Quickley IN (starter_return_rule1)

[11:45] Substitution (Team_096): Cole Holiday OUT → Cole Griffin IN (starter_return_rule1)

[11:45] Substitution (Team_096): Cole Griffin OUT → Scottie Herro IN (starter_return_rule1)

[11:45] Substitution (Team_096): Devin Griffin OUT → Kyrie Adebayo IN (starter_return_rule1)

[11:30] Team_023 possession (Score: 76-80)
Tim Bane attempts a Layup. Contested by Tyler Haliburton (3.3 feet, ZONE). TIM BANE MAKES IT! Assist: Collin Ginobili
Score: 78-80

[11:17] Team_096 possession (Score: 78-80)
Scottie Herro attempts a Midrange. Contested by Josh Morant (3.3 feet, MAN). SCOTTIE HERRO MAKES IT!
Score: 78-82

[11:04] Team_023 possession (Score: 78-82)
Tim Bane attempts a Midrange. Contested by Kyrie Adebayo (5.4 feet, MAN). Tim Bane misses. Offensive rebound by Josh Morant! Josh Morant kicks it out.

[10:47] Team_023 possession (Score: 78-82)
FOUL! Reach-in foul on Kyrie Adebayo during the drive. [Team fouls: 2] No free throws, side out. (Kyrie Adebayo: 2 personal fouls)

[10:47] Substitution (Team_023): Collin Ginobili OUT → Trae Ingram IN (starter_return_rule1)

[10:47] Substitution (Team_023): Josh Morant OUT → Kyle Paul IN (starter_return_rule1)

[10:47] Substitution (Team_096): Lamelo Quickley OUT → Terry Mobley IN (starter_return_rule1)

[10:47] Substitution (Team_096): Scottie Herro OUT → Cole Griffin IN (starter_return_rule1)

[10:32] Team_023 possession (Score: 78-82)
Trae Ingram attempts a Layup. Contested by Kyrie Adebayo (2.4 feet, ZONE). TRAE INGRAM MAKES IT! Assist: Kyle Paul
Score: 80-82

[10:17] Team_096 possession (Score: 80-82)
Jarrett Markkanen attempts a 3Pt. Wide open! Magic Booker is 6.7 feet away. [MAN] JARRETT MARKKANEN MAKES IT! Assist: Cole Griffin
Score: 80-85

[10:02] Team_023 possession (Score: 80-85)
Magic Booker attempts a Midrange. Contested by Terry Mobley (4.2 feet, ZONE). MAGIC BOOKER MAKES IT!
Score: 82-85

[09:50] Team_096 possession (Score: 82-85)
Terry Mobley drives and kicks out. Jarrett Markkanen attempts a 3Pt. Contested by Magic Booker (4.3 feet, MAN). JARRETT MARKKANEN MAKES IT! Assist: Kyrie Adebayo
Score: 82-88

[09:38] Team_023 possession (Score: 82-88)
Kyle Paul attempts a 3Pt. Contested by Cole Griffin (4.0 feet, MAN). Kyle Paul misses. Rebound secured by Cole Griffin.

[09:23] Team_096 possession (Score: 82-88)
Jarrett Markkanen attempts a Midrange. Contested by Magic Booker (4.0 feet, MAN). Jarrett Markkanen misses. Rebound secured by Kyle Paul.

[09:11] Team_023 possession (Score: 82-88)
Magic Booker attempts a 3Pt. Wide open! Jarrett Markkanen is 7.0 feet away. [MAN] Magic Booker misses. Rebound secured by Kyrie Adebayo.

[08:55] Team_096 possession (Score: 82-88)
Kyrie Adebayo drives, Tim Bane stays with him. Kyrie Adebayo attempts a Layup. Contested by Tim Bane (4.3 feet, ZONE). KYRIE ADEBAYO MAKES IT!
Score: 82-90

[08:37] Team_023 possession (Score: 82-90)
FOUL! Holding foul on Kyrie Adebayo. [Team fouls: 3] No free throws, side out. (Kyrie Adebayo: 3 personal fouls)

[08:37] Substitution (Team_023): Trae Ingram OUT → Collin Ginobili IN (starter_return_rule1)

[08:37] Substitution (Team_023): Kyle Paul OUT → Josh Morant IN (starter_return_rule1)

[08:37] Substitution (Team_096): Terry Mobley OUT → Lamelo Quickley IN (starter_return_rule1)

[08:37] Substitution (Team_096): Cole Griffin OUT → Scottie Herro IN (starter_return_rule1)

[08:22] Team_023 possession (Score: 82-90)
Josh Morant attempts a Midrange. Wide open! Lamelo Quickley is 6.4 feet away. [ZONE] JOSH MORANT MAKES IT!
Score: 84-90

[08:08] Team_096 possession (Score: 84-90)
FOUL! Reach-in foul on Tim Bane during the drive. [Team fouls: 1] No free throws, side out. (Tim Bane: 3 personal fouls)

[08:08] Substitution (Team_023): Collin Ginobili OUT → Trae Ingram IN (starter_return_rule1)

[08:08] Substitution (Team_023): Josh Morant OUT → Kyle Paul IN (starter_return_rule1)

[08:08] Substitution (Team_096): Lamelo Quickley OUT → Terry Mobley IN (starter_return_rule1)

[08:08] Substitution (Team_096): Scottie Herro OUT → Cole Griffin IN (starter_return_rule1)

[07:52] Team_096 possession (Score: 84-90)
Cole Griffin attempts a Midrange. Wide open! Kyle Paul is 7.2 feet away. [MAN] Cole Griffin misses. FOUL! Loose ball foul on Kyle Paul during the rebound battle. [Team fouls: 2] No free throws, side out. (Kyle Paul: 3 personal fouls)

[07:40] Team_096 possession (Score: 84-90)
Terry Mobley attempts a 3Pt. Contested by Trae Ingram (4.8 feet, MAN). Terry Mobley misses. Rebound secured by Tim Bane.

[07:25] Team_023 possession (Score: 84-90)
Kyle Paul makes the Midrange and draws the foul on Cole Griffin! And-1! Kyle Paul to the line for 1. [Team fouls: 4] (Cole Griffin: 2 personal fouls)   FT 1/1: GOOD Kyle Paul makes 1/1 from the line.
Score: 87-90

[07:12] Team_096 possession (Score: 87-90)
Jarrett Markkanen attempts a Midrange. Contested by Evan Parker (2.3 feet, ZONE). Jarrett Markkanen misses. Offensive rebound by Cole Griffin! Cole Griffin kicks it out.

[06:58] Team_096 possession (Score: 87-90)
Cole Griffin drives and kicks out. Cole Griffin attempts a 3Pt. Heavily contested by Kyle Paul (1.9 feet, ZONE)! COLE GRIFFIN MAKES IT! Assist: Kyrie Adebayo
Score: 87-93

[06:44] Team_023 possession (Score: 87-93)
Magic Booker attempts a 3Pt. Contested by Cole Griffin (4.8 feet, ZONE). Magic Booker misses. FOUL! Loose ball foul on Cole Griffin during the rebound battle. [IN THE BONUS! 5 team fouls] Tim Bane to the line for 2 free throws. (Cole Griffin: 3 personal fouls)   FT 1/2: GOOD   FT 2/2: GOOD Tim Bane makes 2/2 from the line.
Score: 89-93

[06:31] Team_096 possession (Score: 89-93)
Cole Griffin drives and kicks out. Kyrie Adebayo attempts a 3Pt. Contested by Kyle Paul (5.1 feet, ZONE). Kyrie Adebayo misses. Rebound secured by Trae Ingram.

[06:19] Team_023 possession (Score: 89-93)
Trae Ingram attempts a 3Pt. Contested by Terry Mobley (4.2 feet, MAN). TRAE INGRAM MAKES IT! Assist: Tim Bane
Score: 92-93

[06:05] Team_096 possession (Score: 92-93)
Terry Mobley attempts a Midrange. Contested by Evan Parker (2.7 feet, ZONE). TERRY MOBLEY MAKES IT! Assist: Kyrie Adebayo
Score: 92-95

[05:47] Team_023 possession (Score: 92-95)
Kyle Paul drives to the basket... Kyle Paul loses the ball! Stripped by Cole Griffin! TURNOVER! (live ball)

[05:33] Team_096 possession (Score: 92-95)
Tyler Haliburton attempts a Midrange. Wide open! Evan Parker is 6.1 feet away. [MAN] Tyler Haliburton misses. Rebound secured by Tim Bane.

[05:19] Team_023 possession (Score: 92-95)
Kyle Paul attempts a 3Pt. Wide open! Cole Griffin is 7.5 feet away. [MAN] Kyle Paul misses. Offensive rebound by Kyle Paul! Kyle Paul kicks it out.

[05:05] Team_023 possession (Score: 92-95)
Tim Bane loses the ball! Stripped by Kyrie Adebayo! TURNOVER! (live ball)

[04:50] Team_096 possession (Score: 92-95)
Cole Griffin attempts a Midrange. Heavily contested by Kyle Paul (0.5 feet, MAN)! Cole Griffin misses. Offensive rebound by Kyrie Adebayo! Kyrie Adebayo's putback is no good. Rebound secured by Trae Ingram.

[04:37] Team_023 possession (Score: 92-95)
Trae Ingram attempts a 3Pt. Wide open! Terry Mobley is 8.2 feet away. [MAN] TRAE INGRAM MAKES IT! Assist: Kyle Paul
Score: 95-95

[04:22] Team_096 possession (Score: 95-95)
Kyrie Adebayo attempts a 3Pt. Contested by Tim Bane (4.2 feet, MAN). KYRIE ADEBAYO MAKES IT! Assist: Terry Mobley
Score: 95-98

[04:08] Team_023 possession (Score: 95-98)
Evan Parker attempts a 3Pt. Wide open! Terry Mobley is 7.4 feet away. [ZONE] Evan Parker misses. Rebound secured by Terry Mobley.

[03:54] Team_096 possession (Score: 95-98)
Cole Griffin attempts a Midrange. BLOCKED BY KYLE PAUL! Ball is loose! Rebound secured by Tim Bane.

[03:41] Team_023 possession (Score: 95-98)
Tim Bane attempts a Midrange. Wide open! Cole Griffin is 6.1 feet away. [ZONE] TIM BANE MAKES IT!
Score: 97-98

[03:29] Team_096 possession (Score: 97-98)
Jarrett Markkanen attempts a 3Pt. Contested by Kyle Paul (2.6 feet, ZONE). Jarrett Markkanen misses. Rebound secured by Tim Bane.

[03:11] Team_023 possession (Score: 97-98)
Evan Parker drives, picks up Cole Griffin. Help arrives from Terry Mobley! Evan Parker attempts a Dunk. Contested by Terry Mobley (2.5 feet, MAN). EVAN PARKER MAKES IT! Assist: Trae Ingram
Score: 99-98

[03:00] Team_096 possession (Score: 99-98)
Cole Griffin attempts a 3Pt. Contested by Evan Parker (4.1 feet, ZONE). Cole Griffin misses. Rebound secured by Tim Bane.

[02:46] Team_023 possession (Score: 99-98)
Tim Bane drives, picks up Kyrie Adebayo. Help arrives from Terry Mobley! Tim Bane attempts a Layup. Contested by Terry Mobley (4.9 feet, MAN). TIM BANE MAKES IT!
Score: 101-98

[02:32] Team_096 possession (Score: 101-98)
Tyler Haliburton throws a bad pass out of bounds! TURNOVER! (dead ball)

[02:32] Substitution (Team_023): Tim Bane OUT → Vince Gasol IN (stamina_rule2)

[02:32] Substitution (Team_023): Trae Ingram OUT → Collin Ginobili IN (starter_return_rule1)

[02:32] Substitution (Team_023): Kyle Paul OUT → Josh Morant IN (starter_return_rule1)

[02:32] Substitution (Team_023): Vince Gasol OUT → Tim Bane IN (starter_return_rule1)

[02:32] Substitution (Team_096): Terry Mobley OUT → Lamelo Quickley IN (starter_return_rule1)

[02:32] Substitution (Team_096): Cole Griffin OUT → Scottie Herro IN (starter_return_rule1)

[02:21] Team_023 possession (Score: 101-98)
FOUL! Shooting foul on Lamelo Quickley. Collin Ginobili to the line for 2 free throws. [BONUS: 6 team fouls] (Lamelo Quickley: 1 personal fouls)   FT 1/2: GOOD   FT 2/2: GOOD Collin Ginobili makes 2/2 from the line.
Score: 103-98

[02:08] Team_096 possession (Score: 103-98)
Kyrie Adebayo attempts a 3Pt. Contested by Tim Bane (5.7 feet, MAN). KYRIE ADEBAYO MAKES IT! Assist: Scottie Herro
Score: 103-101

[01:54] Team_023 possession (Score: 103-101)
Josh Morant attempts a 3Pt. Contested by Lamelo Quickley (4.9 feet, ZONE). JOSH MORANT MAKES IT! Assist: Tim Bane
Score: 106-101

[01:43] Team_096 possession (Score: 106-101)
Kyrie Adebayo makes the Midrange and draws the foul on Tim Bane! And-1! Kyrie Adebayo to the line for 1. [Team fouls: 3] (Tim Bane: 4 personal fouls)   FT 1/1: GOOD Kyrie Adebayo makes 1/1 from the line.
Score: 106-104

[01:30] Team_023 possession (Score: 106-104)
Tim Bane attempts a 3Pt. Contested by Kyrie Adebayo (3.2 feet, MAN). Tim Bane misses. Rebound secured by Kyrie Adebayo.

[01:18] Team_096 possession (Score: 106-104)
Jarrett Markkanen attempts a 3Pt. Contested by Collin Ginobili (4.4 feet, MAN). Jarrett Markkanen misses. Rebound secured by Tim Bane.

[01:00] Team_023 possession (Score: 106-104)
Collin Ginobili attempts a 3Pt. Wide open! Lamelo Quickley is 6.8 feet away. [ZONE] Collin Ginobili misses. Rebound secured by Kyrie Adebayo.

[00:44] Team_096 possession (Score: 106-104)
Lamelo Quickley attempts a 3Pt. Contested by Collin Ginobili (5.1 feet, MAN). Lamelo Quickley misses. Rebound secured by Collin Ginobili.

[00:27] Team_023 possession (Score: 106-104)
Josh Morant attempts a Midrange. Wide open! Lamelo Quickley is 9.8 feet away. [ZONE] Josh Morant misses. Rebound secured by Kyrie Adebayo.

[00:09] Team_096 possession (Score: 106-104)
Tyler Haliburton attempts a Midrange. Contested by Josh Morant (4.1 feet, MAN). TYLER HALIBURTON MAKES IT!
Score: 106-106

================================================================================
                              4TH QUARTER COMPLETE                              
================================================================================

4TH QUARTER SCORE: Team_023 30, Team_096 26

BOX SCORE:
================================================================================

Team_023
--------------------------------------------------------------------------------
Player                MIN  PTS  REB  AST  TO      FG   FG%      3P   3P%
--------------------------------------------------------------------------------
Tim Bane               31    8    6    2   0   4/5    80.0     0/0   0.0
Trae Ingram            27    8    2    1   0   3/3   100.0     0/0   0.0
Josh Morant            24    5    1    0   0   2/3    66.7     0/0   0.0
Kyle Paul              27    3    2    2   0   1/2    50.0     0/0   0.0
Collin Ginobili        24    2    1    1   0   1/2    50.0     0/0   0.0
Magic Booker           29    2    0    0   0   1/2    50.0     0/0   0.0
Evan Parker            29    2    0    0   0   1/2    50.0     0/0   0.0
Tracy Anthony          17    0    0    0   0   0/1     0.0     0/0   0.0

TEAM: FG: 13/20 (65.0%), 3PT: 4/10 (40.0%), REB: 11 (2 off, 9 def), AST: 6, TO: 2
TEAM FOULS: 3


Team_096
--------------------------------------------------------------------------------
Player                MIN  PTS  REB  AST  TO      FG   FG%      3P   3P%
--------------------------------------------------------------------------------
Kyrie Adebayo          31   11    4    3   0   4/4   100.0     0/0   0.0
Jarrett Markkanen      29    6    0    0   0   2/5    40.0     0/0   0.0
Cole Griffin           27    3    3    1   0   1/5    20.0     0/0   0.0
Scottie Herro          24    2    0    1   0   1/1   100.0     0/0   0.0
Terry Mobley           27    2    1    1   0   1/2    50.0     0/0   0.0
Tyler Haliburton       29    2    0    0   0   1/2    50.0     0/0   0.0
Devin Griffin          17    0    1    0   0   0/0     0.0     0/0   0.0
Lamelo Quickley        24    0    0    0   0   0/1     0.0     0/0   0.0

TEAM: FG: 10/20 (50.0%), 3PT: 3/8 (37.5%), REB: 10 (3 off, 7 def), AST: 6, TO: 2
TEAM FOULS: 6 [Team_023 in BONUS]

================================================================================

================================================================================
                               FULL GAME COMPLETE                               
================================================================================

FINAL SCORE: Team_023 106, Team_096 106

SCORING BY QUARTER:
--------------------------------------------------------------------------------
Team                     Q1     Q2     Q3     Q4    FINAL
--------------------------------------------------------------------------------
Team_023                 26     31     19     30      106
Team_096                 27     27     26     26      106
--------------------------------------------------------------------------------

FULL GAME BOX SCORE:
================================================================================

Team_023
--------------------------------------------------------------------------------
Player                MIN  PTS  REB  AST  TO      FG   FG%      3P   3P%      FT STL BLK
--------------------------------------------------------------------------------
Tim Bane               31    8   13    5   1   3/7    42.9   0/1     0.0   2/2     0   0
Magic Booker           29    2    0    1   1   4/8    50.0   2/5    40.0   0/0     0   0
Evan Parker            29    9    3    0   1   4/8    50.0   0/3     0.0   3/3     0   0
Trae Ingram            27   19    2    5   0   8/14   57.1   5/11   45.5   3/3     2   1
Kyle Paul              27    9    8    5   0   4/8    50.0   0/3     0.0   1/1     1   1
Collin Ginobili        24   14    1    3   0   6/7    85.7   1/2    50.0   3/3     1   0
Josh Morant            24   24   10    1   1   9/14   64.3   3/3   100.0   3/3     0   0
Tracy Anthony          17   11    0    1   0   4/9    44.4   1/5    20.0   4/4     0   0
Gary Westbrook         17    0    3    0   0   0/4     0.0   0/2     0.0   0/0     0   0
Vince Gasol            17   10    9    2   1   4/4   100.0   0/0     0.0   0/0     1   0

TEAM: FG: 46/83 (55.4%), 3PT: 12/35 (34.3%), REB: 49 (10 off, 39 def), AST: 23, TO: 5


Team_096
--------------------------------------------------------------------------------
Player                MIN  PTS  REB  AST  TO      FG   FG%      3P   3P%      FT STL BLK
--------------------------------------------------------------------------------
Kyrie Adebayo          31   20    9    5   0   7/9    77.8   2/3    66.7   6/6     1   2
Jarrett Markkanen      29   17    3    1   1   5/11   45.5   3/6    50.0   1/1     0   0
Tyler Haliburton       29    8    5    3   1   4/6    66.7   0/1     0.0   0/0     1   0
Terry Mobley           27    7    1    1   2   6/12   50.0   1/4    25.0   2/3     0   0
Cole Griffin           27   11    6    2   1   4/12   33.3   2/5    40.0   2/2     1   0
Lamelo Quickley        24   17    0    1   1   4/10   40.0   3/9    33.3   2/6     0   0
Scottie Herro          24    2   10    6   0   2/3    66.7   1/1   100.0   0/0     1   0
Cade Jokic             17    9    0    2   0   3/8    37.5   1/6    16.7   4/4     0   0
Cole Holiday           17   10    0    0   0   4/6    66.7   2/4    50.0   0/0     0   0
Devin Griffin          17    0   14    0   2   0/2     0.0   0/0     0.0   1/2     0   0

TEAM: FG: 40/80 (50.0%), 3PT: 15/39 (38.5%), REB: 48 (12 off, 36 def), AST: 21, TO: 8

================================================================================
