GAME 2: Team_003 vs Team_076
====================================================================================================

================================================================================
                        FULL GAME - Team_003 vs Team_076                        
================================================================================

================================================================================
                       1ST QUARTER - Team_003 vs Team_076                       
================================================================================

[12:00] Team_003 possession (Score: 0-0)
Giannis Turner drives, Cade Barnes stays with him. Giannis Turner attempts a Dunk. Heavily contested by Cade Barnes (1.6 feet, MAN)! Giannis Turner misses. Rebound secured by Cade Barnes.

[11:50] Team_076 possession (Score: 0-0)
Paul Leonard attempts a 3Pt. Contested by Giannis Turner (5.8 feet, ZONE). Paul Leonard misses. Rebound secured by Giannis Turner.

[11:32] Team_003 possession (Score: 0-0)
Ayo Jackson drives to the basket... Ayo Jackson loses the ball! Stripped by Dejounte LaVine! TURNOVER! (live ball)

[11:15] Team_076 possession (Score: 0-0)
Paul Leonard attempts a 3Pt. Heavily contested by Giannis Turner (1.3 feet, ZONE)! Paul Leonard misses. Rebound secured by Giannis Turner.

[11:01] Team_003 possession (Score: 0-0)
Rudy Haliburton attempts a Layup. Contested by Paul Leonard (3.3 feet, MAN). RUDY HALIBURTON MAKES IT! Assist: Ayo Jackson
Score: 2-0

[10:48] Team_076 possession (Score: 2-0)
FOUL! Shooting foul on Nikola Bryant. Tobias Mitchell to the line for 3 free throws. [Team fouls: 1] (Nikola Bryant: 1 personal fouls)   FT 1/3: GOOD   FT 2/3: GOOD   FT 3/3: GOOD Tobias Mitchell makes 3/3 from the line.
Score: 2-3

[10:32] Team_003 possession (Score: 2-3)
Giannis Turner attempts a Midrange. Contested by Tobias Mitchell (4.9 feet, ZONE). GIANNIS TURNER MAKES IT! Assist: Ayo Jackson
Score: 4-3

[10:16] Team_076 possession (Score: 4-3)
Paul Leonard attempts a 3Pt. Contested by Rudy Haliburton (4.3 feet, MAN). PAUL LEONARD MAKES IT! Assist: D'Angelo Tatum
Score: 4-6

[10:01] Team_003 possession (Score: 4-6)
Rudy Haliburton attempts a 3Pt. Wide open! Paul Leonard is 7.8 feet away. [MAN] RUDY HALIBURTON MAKES IT! Assist: Ayo Jackson
Score: 7-6

[09:46] Team_076 possession (Score: 7-6)
Paul Leonard attempts a 3Pt. Contested by Rudy Haliburton (4.1 feet, MAN). Paul Leonard misses. Rebound secured by Rudy Haliburton.

[09:36] Team_003 possession (Score: 7-6)
Ayo Jackson attempts a 3Pt. Heavily contested by Cade Barnes (1.9 feet, ZONE)! Ayo Jackson misses. Rebound secured by D'Angelo Tatum.

[09:26] Team_076 possession (Score: 7-6)
Tobias Mitchell attempts a 3Pt. Contested by Nikola Bryant (4.4 feet, MAN). Tobias Mitchell misses. Rebound secured by Rudy Haliburton.

[09:14] Team_003 possession (Score: 7-6)
Rudy Haliburton drives and kicks out. Nikola Bryant attempts a 3Pt. Contested by Tobias Mitchell (4.2 feet, MAN). Nikola Bryant misses. Rebound secured by Cade Barnes.

[08:57] Team_076 possession (Score: 7-6)
Cade Barnes drives, Giannis Turner stays with him. Cade Barnes attempts a Dunk. Heavily contested by Giannis Turner (0.5 feet, MAN)! Cade Barnes misses. Rebound secured by Victor O'Neal.

[08:44] Team_003 possession (Score: 7-6)
Ayo Jackson attempts a 3Pt. Contested by Dejounte LaVine (5.4 feet, MAN). Ayo Jackson misses. Offensive rebound by Rudy Haliburton! Rudy Haliburton's putback is no good. Rebound secured by Cade Barnes.

[08:25] Team_076 possession (Score: 7-6)
Dejounte LaVine attempts a 3Pt. Heavily contested by Nikola Bryant (0.5 feet, ZONE)! DEJOUNTE LAVINE MAKES IT! Assist: Tobias Mitchell
Score: 7-9

[08:08] Team_003 possession (Score: 7-9)
FOUL! Shooting foul on D'Angelo Tatum. Victor O'Neal to the line for 2 free throws. [Team fouls: 1] (D'Angelo Tatum: 1 personal fouls)   FT 1/2: GOOD   FT 2/2: MISS Victor O'Neal makes 1/2 from the line. Rebound secured by Tobias Mitchell.
Score: 8-9

[07:51] Team_076 possession (Score: 8-9)
FOUL! Holding foul on Giannis Turner. [Team fouls: 2] No free throws, side out. (Giannis Turner: 1 personal fouls)

[07:33] Team_076 possession (Score: 8-9)
D'Angelo Tatum drives and kicks out. Dejounte LaVine attempts a Midrange. Wide open! Ayo Jackson is 8.5 feet away. [MAN] Dejounte LaVine misses. FOUL! Loose ball foul on Victor O'Neal during the rebound battle. [Team fouls: 3] No free throws, side out. (Victor O'Neal: 1 personal fouls)

[07:19] Team_076 possession (Score: 8-9)
Tobias Mitchell attempts a 3Pt. Contested by Nikola Bryant (4.2 feet, MAN). TOBIAS MITCHELL MAKES IT! Assist: Cade Barnes
Score: 8-12

[07:03] Team_003 possession (Score: 8-12)
Rudy Haliburton attempts a 3Pt. Contested by Paul Leonard (5.4 feet, MAN). Rudy Haliburton misses. Rebound secured by Tobias Mitchell.

[06:50] Team_076 possession (Score: 8-12)
FOUL! Offensive foul on Cade Barnes! Giannis Turner drew the charge! [Team fouls: 2] (Cade Barnes: 1 personal fouls) TURNOVER! (dead ball)

[06:37] Team_003 possession (Score: 8-12)
Ayo Jackson attempts a Midrange. Contested by Dejounte LaVine (3.5 feet, MAN). AYO JACKSON MAKES IT! Assist: Rudy Haliburton
Score: 10-12

[06:24] Team_076 possession (Score: 10-12)
Tobias Mitchell attempts a 3Pt. Contested by Giannis Turner (4.9 feet, ZONE). Tobias Mitchell misses. Rebound secured by Rudy Haliburton.

[06:12] Team_003 possession (Score: 10-12)
Ayo Jackson attempts a 3Pt. Contested by Cade Barnes (2.3 feet, ZONE). Ayo Jackson misses. Rebound secured by Tobias Mitchell.

[05:56] Team_076 possession (Score: 10-12)
Dejounte LaVine attempts a 3Pt. Contested by Ayo Jackson (4.9 feet, MAN). Dejounte LaVine misses. Offensive rebound by Cade Barnes! Cade Barnes kicks it out.

[05:46] Team_076 possession (Score: 10-12)
Paul Leonard attempts a 3Pt. Contested by Giannis Turner (4.3 feet, ZONE). PAUL LEONARD MAKES IT! Assist: D'Angelo Tatum
Score: 10-15

[05:34] Team_003 possession (Score: 10-15)
Nikola Bryant attempts a 3Pt. Contested by Cade Barnes (2.4 feet, ZONE). Nikola Bryant misses. Offensive rebound by Rudy Haliburton! Rudy Haliburton's putback is no good. Offensive rebound by Rudy Haliburton! Rudy Haliburton kicks it out.

[05:21] Team_003 possession (Score: 10-15)
FOUL! Reach-in foul on D'Angelo Tatum during the drive. [Team fouls: 3] No free throws, side out. (D'Angelo Tatum: 2 personal fouls)

[05:10] Team_003 possession (Score: 10-15)
Ayo Jackson attempts a 3Pt. Contested by Cade Barnes (4.6 feet, ZONE). Ayo Jackson misses. Offensive rebound by Victor O'Neal! Victor O'Neal kicks it out.

[05:00] Team_003 possession (Score: 10-15)
Rudy Haliburton attempts a 3Pt. Wide open! Cade Barnes is 6.9 feet away. [ZONE] Rudy Haliburton misses. Offensive rebound by Rudy Haliburton! Rudy Haliburton puts it back in!
Score: 12-15

[04:50] Team_076 possession (Score: 12-15)
Cade Barnes attempts a Midrange. Contested by Nikola Bryant (2.7 feet, ZONE). Cade Barnes misses. Offensive rebound by Cade Barnes! Cade Barnes kicks it out.

[04:37] Team_076 possession (Score: 12-15)
Paul Leonard attempts a 3Pt. Contested by Giannis Turner (5.0 feet, ZONE). Paul Leonard misses. Rebound secured by Rudy Haliburton.

[04:24] Team_003 possession (Score: 12-15)
Ayo Jackson attempts a 3Pt. Wide open! Dejounte LaVine is 7.2 feet away. [MAN] Ayo Jackson misses. Rebound secured by Tobias Mitchell.

[04:10] Team_076 possession (Score: 12-15)
D'Angelo Tatum drives, Giannis Turner stays with him. D'Angelo Tatum attempts a Dunk. Heavily contested by Giannis Turner (0.5 feet, ZONE)! D'ANGELO TATUM MAKES IT! Assist: Paul Leonard
Score: 12-17

[03:55] Team_003 possession (Score: 12-17)
Rudy Haliburton attempts a 3Pt. Contested by Cade Barnes (5.4 feet, ZONE). RUDY HALIBURTON MAKES IT! Assist: Ayo Jackson
Score: 15-17

[03:40] Team_076 possession (Score: 15-17)
Cade Barnes attempts a Layup. Contested by Victor O'Neal (4.8 feet, ZONE). CADE BARNES MAKES IT! Assist: Dejounte LaVine
Score: 15-19

[03:24] Team_003 possession (Score: 15-19)
Nikola Bryant attempts a Midrange. Contested by Tobias Mitchell (3.0 feet, MAN). Nikola Bryant misses. Rebound secured by D'Angelo Tatum.

[03:08] Team_076 possession (Score: 15-19)
Cade Barnes drives and kicks out. Paul Leonard attempts a 3Pt. Contested by Rudy Haliburton (5.8 feet, MAN). Paul Leonard misses. Offensive rebound by D'Angelo Tatum! D'Angelo Tatum kicks it out.

[02:55] Team_076 possession (Score: 15-19)
Paul Leonard attempts a 3Pt. Contested by Giannis Turner (2.3 feet, ZONE). Paul Leonard misses. Rebound secured by Giannis Turner.

[02:42] Team_003 possession (Score: 15-19)
Ayo Jackson attempts a 3Pt. Contested by Cade Barnes (4.8 feet, ZONE). Ayo Jackson misses. Offensive rebound by Victor O'Neal! Victor O'Neal kicks it out.

[02:28] Team_003 possession (Score: 15-19)
FOUL! Shooting foul on Cade Barnes. Ayo Jackson to the line for 2 free throws. [Team fouls: 4] (Cade Barnes: 2 personal fouls)   FT 1/2: MISS   FT 2/2: GOOD Ayo Jackson makes 1/2 from the line.
Score: 16-19

[02:08] Team_076 possession (Score: 16-19)
Paul Leonard attempts a 3Pt. Contested by Rudy Haliburton (3.0 feet, MAN). PAUL LEONARD MAKES IT! Assist: D'Angelo Tatum
Score: 16-22

[01:52] Team_003 possession (Score: 16-22)
Victor O'Neal makes the Midrange and draws the foul on D'Angelo Tatum! And-1! Victor O'Neal to the line for 1. [BONUS: 5 team fouls] (D'Angelo Tatum: 3 personal fouls)   FT 1/1: GOOD Victor O'Neal makes 1/1 from the line.
Score: 19-22

[01:39] Team_076 possession (Score: 19-22)
D'Angelo Tatum attempts a 3Pt. Contested by Giannis Turner (3.1 feet, ZONE). D'Angelo Tatum misses. Rebound secured by Giannis Turner.

[01:22] Team_003 possession (Score: 19-22)
Nikola Bryant attempts a 3Pt. Contested by Cade Barnes (2.0 feet, ZONE). NIKOLA BRYANT MAKES IT! Assist: Giannis Turner
Score: 22-22

[01:07] Team_076 possession (Score: 22-22)
FOUL! Shooting foul on Giannis Turner. Dejounte LaVine to the line for 2 free throws. [Team fouls: 4] (Giannis Turner: 2 personal fouls)   FT 1/2: GOOD   FT 2/2: MISS Dejounte LaVine makes 1/2 from the line. Rebound secured by Rudy Haliburton.
Score: 22-23

[00:48] Team_003 possession (Score: 22-23)
Ayo Jackson makes the Midrange and draws the foul on Cade Barnes! And-1! Ayo Jackson to the line for 1. [BONUS: 6 team fouls] (Cade Barnes: 3 personal fouls)   FT 1/1: GOOD Ayo Jackson makes 1/1 from the line.
Score: 25-23

[00:34] Team_076 possession (Score: 25-23)
Paul Leonard attempts a 3Pt. Heavily contested by Rudy Haliburton (1.8 feet, MAN)! Paul Leonard misses. FOUL! Loose ball foul on Giannis Turner during the rebound battle. [IN THE BONUS! 5 team fouls] D'Angelo Tatum to the line for 2 free throws. (Giannis Turner: 3 personal fouls)   FT 1/2: GOOD   FT 2/2: GOOD D'Angelo Tatum makes 2/2 from the line.
Score: 25-25

[00:19] Team_003 possession (Score: 25-25)
Rudy Haliburton attempts a 3Pt. Wide open! Cade Barnes is 6.2 feet away. [ZONE] RUDY HALIBURTON MAKES IT! Assist: Giannis Turner
Score: 28-25

[00:05] Team_076 possession (Score: 28-25)
FOUL! Holding foul on Giannis Turner. [IN THE BONUS! 6 team fouls] Cade Barnes to the line for 2 free throws. (Giannis Turner: 4 personal fouls)   FT 1/2: MISS   FT 2/2: GOOD Cade Barnes makes 1/2 from the line.
Score: 28-26

================================================================================
                              1ST QUARTER COMPLETE                              
================================================================================

1ST QUARTER SCORE: Team_003 28, Team_076 26

BOX SCORE:
================================================================================

Team_003
--------------------------------------------------------------------------------
Player                MIN  PTS  REB  AST  TO      FG   FG%      3P   3P%
--------------------------------------------------------------------------------
Rudy Haliburton        12   13    7    1   0   5/7    71.4     0/0   0.0
Ayo Jackson            12    6    0    4   0   3/7    42.9     0/0   0.0
Victor O'Neal          12    3    3    0   0   1/2    50.0     0/0   0.0
Nikola Bryant          12    3    0    0   0   1/2    50.0     0/0   0.0
Giannis Turner         12    2    4    2   0   1/2    50.0     0/0   0.0

TEAM: FG: 11/20 (55.0%), 3PT: 5/10 (50.0%), REB: 15 (5 off, 10 def), AST: 7, TO: 1
TEAM FOULS: 6 [Team_076 in BONUS]


Team_076
--------------------------------------------------------------------------------
Player                MIN  PTS  REB  AST  TO      FG   FG%      3P   3P%
--------------------------------------------------------------------------------
Paul Leonard           12    9    0    1   0   3/8    37.5     0/0   0.0
Tobias Mitchell        12    6    4    1   0   2/4    50.0     0/0   0.0
D'Angelo Tatum         12    4    3    3   0   2/3    66.7     0/0   0.0
Cade Barnes            12    3    6    1   0   2/3    66.7     0/0   0.0
Dejounte LaVine        12    3    0    1   0   1/2    50.0     0/0   0.0

TEAM: FG: 10/20 (50.0%), 3PT: 7/15 (46.7%), REB: 12 (4 off, 8 def), AST: 7, TO: 1
TEAM FOULS: 6 [Team_003 in BONUS]

================================================================================

================================================================================
                       2ND QUARTER - Team_003 vs Team_076                       
================================================================================

[12:00] Team_003 possession (Score: 28-26)
Giannis Turner drives, Cade Barnes stays with him. Giannis Turner attempts a Dunk. Heavily contested by Cade Barnes (1.8 feet, MAN)! Giannis Turner misses. Rebound secured by Cade Barnes.

[11:50] Team_076 possession (Score: 28-26)
Paul Leonard attempts a 3Pt. Wide open! Giannis Turner is 6.0 feet away. [ZONE] PAUL LEONARD MAKES IT! Assist: D'Angelo Tatum
Score: 28-29

[11:38] Team_003 possession (Score: 28-29)
Giannis Turner attempts a Midrange. Wide open! Cade Barnes is 9.1 feet away. [MAN] Giannis Turner misses. Rebound secured by D'Angelo Tatum.

[11:21] Team_076 possession (Score: 28-29)
D'Angelo Tatum drives, Giannis Turner stays with him. D'Angelo Tatum attempts a Layup. Heavily contested by Giannis Turner (1.5 feet, MAN)! D'ANGELO TATUM MAKES IT!
Score: 28-31

[11:05] Team_003 possession (Score: 28-31)
Nikola Bryant attempts a 3Pt. Wide open! Tobias Mitchell is 7.4 feet away. [MAN] Nikola Bryant misses. Rebound secured by D'Angelo Tatum.

[10:55] Team_076 possession (Score: 28-31)
Tobias Mitchell attempts a Layup. BLOCKED BY NIKOLA BRYANT! Ball deflects out of bounds off Tobias Mitchell.

[10:55] Substitution (Team_003): Ayo Jackson OUT → Miles Towns IN (stamina_rule2)

[10:55] Substitution (Team_003): Nikola Bryant OUT → Pau Williamson IN (stamina_rule2)

[10:55] Substitution (Team_003): Giannis Turner OUT → Anfernee Jordan IN (stamina_rule2)

[10:55] Substitution (Team_076): Dejounte LaVine OUT → Pascal Lowry IN (stamina_rule2)

[10:55] Substitution (Team_076): Tobias Mitchell OUT → Jalen Poole IN (stamina_rule2)

[10:55] Substitution (Team_076): Paul Leonard OUT → Vince Lowry IN (stamina_rule2)

[10:55] Substitution (Team_076): Cade Barnes OUT → Kevin Nowitzki IN (stamina_rule2)

[10:55] Substitution (Team_076): D'Angelo Tatum OUT → Jordan Doncic IN (stamina_rule2)

[10:39] Team_003 possession (Score: 28-31)
Miles Towns attempts a 3Pt. Contested by Vince Lowry (4.2 feet, ZONE). Miles Towns misses. Offensive rebound by Rudy Haliburton! Rudy Haliburton kicks it out.

[10:21] Team_003 possession (Score: 28-31)
Rudy Haliburton attempts a Midrange. Wide open! Vince Lowry is 8.0 feet away. [MAN] RUDY HALIBURTON MAKES IT!
Score: 30-31

[10:10] Team_076 possession (Score: 30-31)
FOUL! Holding foul on Anfernee Jordan. [Team fouls: 1] No free throws, side out. (Anfernee Jordan: 1 personal fouls)

[10:10] Substitution (Team_003): Victor O'Neal OUT → Bam Gilgeous-Alexander IN (stamina_rule2)

[09:54] Team_076 possession (Score: 30-31)
Jordan Doncic attempts a Midrange. Contested by Bam Gilgeous-Alexander (2.3 feet, MAN). Jordan Doncic misses. Offensive rebound by Jordan Doncic! Jordan Doncic kicks it out.

[09:36] Team_076 possession (Score: 30-31)
Kevin Nowitzki throws a bad pass! Stolen by Bam Gilgeous-Alexander! TURNOVER! (live ball)

[09:21] Team_003 possession (Score: 30-31)
Pau Williamson attempts a 3Pt. Wide open! Jalen Poole is 10.0 feet away. [MAN] PAU WILLIAMSON MAKES IT! Assist: Miles Towns
Score: 33-31

[09:10] Team_076 possession (Score: 33-31)
FOUL! Reach-in foul on Bam Gilgeous-Alexander during the drive. [Team fouls: 2] No free throws, side out. (Bam Gilgeous-Alexander: 1 personal fouls)

[08:55] Team_076 possession (Score: 33-31)
Vince Lowry attempts a 3Pt. Wide open! Rudy Haliburton is 7.0 feet away. [MAN] VINCE LOWRY MAKES IT!
Score: 33-34

[08:42] Team_003 possession (Score: 33-34)
Bam Gilgeous-Alexander attempts a Layup. Heavily contested by Jordan Doncic (1.4 feet, ZONE)! BAM GILGEOUS-ALEXANDER MAKES IT! Assist: Rudy Haliburton
Score: 35-34

[08:28] Team_076 possession (Score: 35-34)
FOUL! Shooting foul on Anfernee Jordan. Jordan Doncic to the line for 2 free throws. [Team fouls: 3] (Anfernee Jordan: 2 personal fouls)   FT 1/2: GOOD   FT 2/2: GOOD Jordan Doncic makes 2/2 from the line.
Score: 35-36

[08:14] Team_003 possession (Score: 35-36)
Bam Gilgeous-Alexander drives, picks up Jordan Doncic. Help arrives from Jalen Poole! Bam Gilgeous-Alexander attempts a Layup. Wide open! Jalen Poole is 6.0 feet away. [MAN] BAM GILGEOUS-ALEXANDER MAKES IT!
Score: 37-36

[08:03] Team_076 possession (Score: 37-36)
Jalen Poole throws a bad pass out of bounds! TURNOVER! (dead ball)

[08:03] Substitution (Team_003): Rudy Haliburton OUT → Collin Mitchell IN (stamina_rule2)

[07:48] Team_003 possession (Score: 37-36)
Collin Mitchell attempts a 3Pt. Contested by Vince Lowry (3.2 feet, ZONE). Collin Mitchell misses. Rebound secured by Kevin Nowitzki.

[07:32] Team_076 possession (Score: 37-36)
Vince Lowry attempts a 3Pt. Heavily contested by Collin Mitchell (1.0 feet, MAN)! Vince Lowry misses. Rebound secured by Bam Gilgeous-Alexander.

[07:17] Team_003 possession (Score: 37-36)
Collin Mitchell attempts a 3Pt. Contested by Vince Lowry (2.4 feet, MAN). Collin Mitchell misses. Rebound secured by Jordan Doncic.

[07:03] Team_076 possession (Score: 37-36)
Jalen Poole attempts a Midrange. Wide open! Pau Williamson is 6.2 feet away. [MAN] Jalen Poole misses. Offensive rebound by Kevin Nowitzki! Kevin Nowitzki kicks it out.

[06:49] Team_076 possession (Score: 37-36)
Jordan Doncic makes the Layup and draws the foul on Bam Gilgeous-Alexander! And-1! Jordan Doncic to the line for 1. [Team fouls: 4] (Bam Gilgeous-Alexander: 2 personal fouls)   FT 1/1: GOOD Jordan Doncic makes 1/1 from the line.
Score: 37-39

[06:38] Team_003 possession (Score: 37-39)
Anfernee Jordan attempts a Layup. Contested by Kevin Nowitzki (4.9 feet, ZONE). ANFERNEE JORDAN MAKES IT! Assist: Miles Towns
Score: 39-39

[06:21] Team_076 possession (Score: 39-39)
Kevin Nowitzki drives, Bam Gilgeous-Alexander stays with him. Kevin Nowitzki attempts a Layup. Contested by Bam Gilgeous-Alexander (2.7 feet, ZONE). KEVIN NOWITZKI MAKES IT! Assist: Jalen Poole
Score: 39-41

[06:06] Team_003 possession (Score: 39-41)
Shot clock violation! Bam Gilgeous-Alexander couldn't get a shot off in time! TURNOVER! (dead ball)

[05:51] Team_076 possession (Score: 39-41)
Jordan Doncic attempts a Midrange. Contested by Collin Mitchell (2.6 feet, ZONE). Jordan Doncic misses. Rebound secured by Anfernee Jordan.

[05:37] Team_003 possession (Score: 39-41)
Pau Williamson attempts a 3Pt. Contested by Jalen Poole (5.8 feet, MAN). Pau Williamson misses. Rebound secured by Vince Lowry.

[05:21] Team_076 possession (Score: 39-41)
Pascal Lowry attempts a 3Pt. Contested by Miles Towns (3.7 feet, MAN). PASCAL LOWRY MAKES IT! Assist: Vince Lowry
Score: 39-44

[05:02] Team_003 possession (Score: 39-44)
Anfernee Jordan attempts a 3Pt. Contested by Vince Lowry (4.4 feet, ZONE). Anfernee Jordan misses. Rebound secured by Kevin Nowitzki.

[04:43] Team_076 possession (Score: 39-44)
Pascal Lowry attempts a Midrange. Contested by Miles Towns (4.2 feet, ZONE). Pascal Lowry misses. Rebound secured by Anfernee Jordan.

[04:30] Team_003 possession (Score: 39-44)
Collin Mitchell attempts a Midrange. Wide open! Vince Lowry is 6.2 feet away. [MAN] Collin Mitchell misses. Rebound secured by Kevin Nowitzki.

[04:16] Team_076 possession (Score: 39-44)
Jordan Doncic drives and kicks out. Pascal Lowry attempts a 3Pt. Wide open! Miles Towns is 6.8 feet away. [ZONE] PASCAL LOWRY MAKES IT! Assist: Vince Lowry
Score: 39-47

[04:02] Team_003 possession (Score: 39-47)
Miles Towns makes the 3Pt and draws the foul on Vince Lowry! And-1! Miles Towns to the line for 1. [Team fouls: 1] (Vince Lowry: 1 personal fouls)   FT 1/1: GOOD Miles Towns makes 1/1 from the line.
Score: 43-47

[03:48] Team_076 possession (Score: 43-47)
Jalen Poole drives and kicks out. Vince Lowry attempts a Midrange. Wide open! Collin Mitchell is 7.1 feet away. [MAN] VINCE LOWRY MAKES IT! Assist: Pascal Lowry
Score: 43-49

[03:35] Team_003 possession (Score: 43-49)
Pau Williamson attempts a 3Pt. Wide open! Vince Lowry is 8.2 feet away. [ZONE] PAU WILLIAMSON MAKES IT! Assist: Collin Mitchell
Score: 46-49

[03:21] Team_076 possession (Score: 46-49)
FOUL! Holding foul on Miles Towns. [IN THE BONUS! 5 team fouls] Pascal Lowry to the line for 2 free throws. (Miles Towns: 1 personal fouls)   FT 1/2: GOOD   FT 2/2: GOOD Pascal Lowry makes 2/2 from the line.
Score: 46-51

[03:04] Team_003 possession (Score: 46-51)
Miles Towns attempts a Midrange. Wide open! Pascal Lowry is 10.0 feet away. [ZONE] MILES TOWNS MAKES IT! Assist: Collin Mitchell
Score: 48-51

[02:46] Team_076 possession (Score: 48-51)
Kevin Nowitzki attempts a 3Pt. Contested by Miles Towns (5.2 feet, ZONE). KEVIN NOWITZKI MAKES IT! Assist: Jalen Poole
Score: 48-54

[02:31] Team_003 possession (Score: 48-54)
Collin Mitchell attempts a 3Pt. Contested by Vince Lowry (3.2 feet, ZONE). COLLIN MITCHELL MAKES IT! Assist: Pau Williamson
Score: 51-54

[02:19] Team_076 possession (Score: 51-54)
Jordan Doncic drives to the basket... Jordan Doncic throws a bad pass! Stolen by Bam Gilgeous-Alexander! TURNOVER! (live ball)

[02:07] Team_003 possession (Score: 51-54)
Collin Mitchell attempts a 3Pt. Wide open! Pascal Lowry is 6.3 feet away. [ZONE] COLLIN MITCHELL MAKES IT! Assist: Pau Williamson
Score: 54-54

[01:53] Team_076 possession (Score: 54-54)
Vince Lowry drives to the basket... Vince Lowry loses the ball! Stripped by Anfernee Jordan! TURNOVER! (live ball)

[01:40] Team_003 possession (Score: 54-54)
Pau Williamson attempts a 3Pt. Heavily contested by Kevin Nowitzki (0.7 feet, ZONE)! PAU WILLIAMSON MAKES IT! Assist: Bam Gilgeous-Alexander
Score: 57-54

[01:25] Team_076 possession (Score: 57-54)
Jalen Poole attempts a 3Pt. Wide open! Anfernee Jordan is 8.1 feet away. [ZONE] Jalen Poole misses. Rebound secured by Bam Gilgeous-Alexander.

[01:13] Team_003 possession (Score: 57-54)
Miles Towns attempts a Midrange. Wide open! Pascal Lowry is 8.9 feet away. [MAN] MILES TOWNS MAKES IT!
Score: 59-54

[01:00] Team_076 possession (Score: 59-54)
Jalen Poole drives to the basket... Jalen Poole loses the ball! Stripped by Pau Williamson! TURNOVER! (live ball)

[00:47] Team_003 possession (Score: 59-54)
Bam Gilgeous-Alexander makes the 3Pt and draws the foul on Vince Lowry! And-1! Bam Gilgeous-Alexander to the line for 1. [Team fouls: 2] (Vince Lowry: 2 personal fouls)   FT 1/1: MISS Bam Gilgeous-Alexander makes 0/1 from the line. FOUL! Loose ball foul on Kevin Nowitzki during the free throw rebound! [Team fouls: 3] No free throws, side out. (Kevin Nowitzki: 1 personal fouls)
Score: 62-54

[00:30] Team_003 possession (Score: 62-54)
Bam Gilgeous-Alexander throws a bad pass out of bounds! TURNOVER! (dead ball)

[00:17] Team_076 possession (Score: 62-54)
Vince Lowry attempts a 3Pt. Contested by Miles Towns (4.3 feet, ZONE). Vince Lowry misses. Offensive rebound by Jordan Doncic! Jordan Doncic kicks it out.

================================================================================
                              2ND QUARTER COMPLETE                              
================================================================================

2ND QUARTER SCORE: Team_003 34, Team_076 28

BOX SCORE:
================================================================================

Team_003
--------------------------------------------------------------------------------
Player                MIN  PTS  REB  AST  TO      FG   FG%      3P   3P%
--------------------------------------------------------------------------------
Pau Williamson         11    9    0    2   0   3/4    75.0     0/0   0.0
Miles Towns            11    8    0    2   0   3/3   100.0     0/0   0.0
Collin Mitchell         8    6    0    2   0   2/5    40.0     0/0   0.0
Bam Gilgeous-Alexander   10    4    3    1   0   2/2   100.0     0/0   0.0
Rudy Haliburton        16    2    1    1   0   1/1   100.0     0/0   0.0
Anfernee Jordan        11    2    2    0   0   1/2    50.0     0/0   0.0
Giannis Turner         13    0    0    0   0   0/2     0.0     0/0   0.0
Nikola Bryant          13    0    0    0   0   0/1     0.0     0/0   0.0

TEAM: FG: 12/20 (60.0%), 3PT: 6/11 (54.5%), REB: 6 (2 off, 4 def), AST: 8, TO: 2
TEAM FOULS: 5 [Team_076 in BONUS]


Team_076
--------------------------------------------------------------------------------
Player                MIN  PTS  REB  AST  TO      FG   FG%      3P   3P%
--------------------------------------------------------------------------------
Pascal Lowry           11    8    0    1   0   3/4    75.0     0/0   0.0
Jordan Doncic          11    5    3    0   0   2/3    66.7     0/0   0.0
Vince Lowry            11    5    1    2   0   2/3    66.7     0/0   0.0
Kevin Nowitzki         11    5    4    0   0   2/2   100.0     0/0   0.0
Paul Leonard           13    3    0    0   0   1/1   100.0     0/0   0.0
D'Angelo Tatum         13    2    2    1   0   1/1   100.0     0/0   0.0
Cade Barnes            13    0    1    0   0   0/0     0.0     0/0   0.0
Tobias Mitchell        13    0    0    0   0   0/1     0.0     0/0   0.0
Jalen Poole            11    0    0    2   0   0/1     0.0     0/0   0.0

TEAM: FG: 11/16 (68.8%), 3PT: 4/6 (66.7%), REB: 11 (3 off, 8 def), AST: 6, TO: 5
TEAM FOULS: 3

================================================================================

================================================================================
                       3RD QUARTER - Team_003 vs Team_076                       
================================================================================

[12:00] Team_003 possession (Score: 62-54)
Anfernee Jordan drives, Kevin Nowitzki stays with him. Anfernee Jordan attempts a Dunk. Heavily contested by Kevin Nowitzki (1.9 feet, MAN)! Anfernee Jordan misses. Rebound secured by Jordan Doncic.

[11:50] Team_076 possession (Score: 62-54)
Vince Lowry attempts a 3Pt. Wide open! Miles Towns is 7.8 feet away. [ZONE] VINCE LOWRY MAKES IT! Assist: Jordan Doncic
Score: 62-57

[11:38] Team_003 possession (Score: 62-57)
Bam Gilgeous-Alexander attempts a Midrange. Wide open! Jordan Doncic is 9.1 feet away. [MAN] Bam Gilgeous-Alexander misses. Rebound secured by Kevin Nowitzki.

[11:21] Team_076 possession (Score: 62-57)
Jordan Doncic drives, Bam Gilgeous-Alexander stays with him. Jordan Doncic attempts a Layup. Heavily contested by Bam Gilgeous-Alexander (0.6 feet, MAN)! JORDAN DONCIC MAKES IT!
Score: 62-59

[11:05] Team_003 possession (Score: 62-59)
Miles Towns attempts a 3Pt. Wide open! Pascal Lowry is 8.9 feet away. [MAN] Miles Towns misses. Rebound secured by Kevin Nowitzki.

[10:55] Team_076 possession (Score: 62-59)
Jalen Poole attempts a Layup. BLOCKED BY PAU WILLIAMSON! Ball deflects out of bounds off Jalen Poole.

[10:39] Team_003 possession (Score: 62-59)
Miles Towns attempts a 3Pt. Contested by Vince Lowry (4.2 feet, ZONE). Miles Towns misses. Offensive rebound by Bam Gilgeous-Alexander! Bam Gilgeous-Alexander's putback is no good. Rebound secured by Jordan Doncic.

[10:24] Team_076 possession (Score: 62-59)
Pascal Lowry drives, Bam Gilgeous-Alexander stays with him. Pascal Lowry attempts a Dunk. Contested by Bam Gilgeous-Alexander (4.8 feet, ZONE). Pascal Lowry misses. Rebound secured by Anfernee Jordan.

[10:09] Team_003 possession (Score: 62-59)
Miles Towns attempts a 3Pt. Wide open! Pascal Lowry is 6.9 feet away. [MAN] MILES TOWNS MAKES IT! Assist: Collin Mitchell
Score: 65-59

[09:58] Team_076 possession (Score: 65-59)
Jalen Poole makes the Dunk and draws the foul on Pau Williamson! And-1! Jalen Poole to the line for 1. [Team fouls: 1] (Pau Williamson: 1 personal fouls)   FT 1/1: GOOD Jalen Poole makes 1/1 from the line.
Score: 65-62

[09:48] Team_003 possession (Score: 65-62)
Anfernee Jordan attempts a 3Pt. Heavily contested by Kevin Nowitzki (1.8 feet, ZONE)! Anfernee Jordan misses. FOUL! Loose ball foul on Kevin Nowitzki during the rebound battle. [Team fouls: 1] No free throws, side out. (Kevin Nowitzki: 2 personal fouls)

[09:29] Team_003 possession (Score: 65-62)
Bam Gilgeous-Alexander attempts a Midrange. Wide open! Jalen Poole is 6.2 feet away. [ZONE] BAM GILGEOUS-ALEXANDER MAKES IT! Assist: Pau Williamson
Score: 67-62

[09:17] Team_076 possession (Score: 67-62)
Pascal Lowry makes the Midrange and draws the foul on Anfernee Jordan! And-1! Pascal Lowry to the line for 1. [Team fouls: 2] (Anfernee Jordan: 3 personal fouls)   FT 1/1: GOOD Pascal Lowry makes 1/1 from the line.
Score: 67-65

[09:03] Team_003 possession (Score: 67-65)
Miles Towns loses control! Ball rolls out of bounds! TURNOVER! (dead ball)

[08:51] Team_076 possession (Score: 67-65)
Jalen Poole attempts a 3Pt. Wide open! Miles Towns is 8.0 feet away. [ZONE] JALEN POOLE MAKES IT! Assist: Vince Lowry
Score: 67-68

[08:35] Team_003 possession (Score: 67-68)
Collin Mitchell attempts a Layup. Contested by Vince Lowry (5.9 feet, MAN). COLLIN MITCHELL MAKES IT!
Score: 69-68

[08:18] Team_076 possession (Score: 69-68)
Jordan Doncic attempts a Midrange. Contested by Pau Williamson (2.7 feet, ZONE). JORDAN DONCIC MAKES IT!
Score: 69-70

[08:02] Team_003 possession (Score: 69-70)
Bam Gilgeous-Alexander attempts a 3Pt. Contested by Vince Lowry (3.2 feet, ZONE). Bam Gilgeous-Alexander misses. Rebound secured by Kevin Nowitzki.

[07:46] Team_076 possession (Score: 69-70)
Jordan Doncic drives to the basket... Jordan Doncic loses the ball! Stripped by Bam Gilgeous-Alexander! TURNOVER! (live ball)

[07:28] Team_003 possession (Score: 69-70)
Bam Gilgeous-Alexander drives and kicks out. Miles Towns attempts a Midrange. Wide open! Pascal Lowry is 9.5 feet away. [MAN] MILES TOWNS MAKES IT!
Score: 71-70

[07:17] Team_076 possession (Score: 71-70)
Vince Lowry attempts a Midrange. Contested by Collin Mitchell (5.7 feet, ZONE). Vince Lowry misses. Rebound secured by Anfernee Jordan.

[07:01] Team_003 possession (Score: 71-70)
Pau Williamson attempts a 3Pt. Contested by Vince Lowry (2.9 feet, ZONE). Pau Williamson misses. Rebound secured by Kevin Nowitzki.

[06:45] Team_076 possession (Score: 71-70)
FOUL! Shooting foul on Pau Williamson. Jalen Poole to the line for 2 free throws. [Team fouls: 3] (Pau Williamson: 2 personal fouls)   FT 1/2: MISS   FT 2/2: GOOD Jalen Poole makes 1/2 from the line.
Score: 71-71

[06:34] Team_003 possession (Score: 71-71)
Pau Williamson attempts a 3Pt. Contested by Jalen Poole (5.5 feet, MAN). Pau Williamson misses. Offensive rebound by Bam Gilgeous-Alexander! Bam Gilgeous-Alexander's putback is no good. Rebound secured by Vince Lowry.

[06:21] Team_076 possession (Score: 71-71)
Jordan Doncic attempts a Layup. Heavily contested by Bam Gilgeous-Alexander (0.5 feet, MAN)! Jordan Doncic misses. Rebound secured by Collin Mitchell.

[06:07] Team_003 possession (Score: 71-71)
Bam Gilgeous-Alexander attempts a Midrange. Wide open! Jalen Poole is 6.3 feet away. [ZONE] BAM GILGEOUS-ALEXANDER MAKES IT!
Score: 73-71

[05:52] Team_076 possession (Score: 73-71)
Vince Lowry attempts a Layup. Contested by Bam Gilgeous-Alexander (2.3 feet, ZONE). VINCE LOWRY MAKES IT! Assist: Pascal Lowry
Score: 73-73

[05:36] Team_003 possession (Score: 73-73)
Bam Gilgeous-Alexander attempts a 3Pt. Wide open! Vince Lowry is 7.3 feet away. [ZONE] BAM GILGEOUS-ALEXANDER MAKES IT! Assist: Collin Mitchell
Score: 76-73

[05:21] Team_076 possession (Score: 76-73)
Vince Lowry drives and kicks out. Vince Lowry attempts a 3Pt. Contested by Collin Mitchell (3.6 feet, MAN). Vince Lowry misses. Rebound secured by Anfernee Jordan.

[05:05] Team_003 possession (Score: 76-73)
Bam Gilgeous-Alexander throws a bad pass! Stolen by Jordan Doncic! TURNOVER! (live ball)

[04:53] Team_076 possession (Score: 76-73)
FOUL! Offensive foul on Kevin Nowitzki! Bam Gilgeous-Alexander drew the charge! [Team fouls: 2] (Kevin Nowitzki: 3 personal fouls) TURNOVER! (dead ball)

[04:53] Substitution (Team_003): Miles Towns OUT → Ayo Jackson IN (starter_return_rule1)

[04:53] Substitution (Team_003): Pau Williamson OUT → Nikola Bryant IN (starter_return_rule1)

[04:53] Substitution (Team_003): Collin Mitchell OUT → Rudy Haliburton IN (starter_return_rule1)

[04:53] Substitution (Team_003): Anfernee Jordan OUT → Giannis Turner IN (starter_return_rule1)

[04:53] Substitution (Team_003): Bam Gilgeous-Alexander OUT → Victor O'Neal IN (starter_return_rule1)

[04:53] Substitution (Team_076): Pascal Lowry OUT → Dejounte LaVine IN (starter_return_rule1)

[04:53] Substitution (Team_076): Jalen Poole OUT → Tobias Mitchell IN (starter_return_rule1)

[04:53] Substitution (Team_076): Vince Lowry OUT → Paul Leonard IN (starter_return_rule1)

[04:53] Substitution (Team_076): Kevin Nowitzki OUT → Cade Barnes IN (starter_return_rule1)

[04:53] Substitution (Team_076): Jordan Doncic OUT → D'Angelo Tatum IN (starter_return_rule1)

[04:40] Team_003 possession (Score: 76-73)
Rudy Haliburton throws a bad pass! Stolen by Paul Leonard! TURNOVER! (live ball)

[04:25] Team_076 possession (Score: 76-73)
Dejounte LaVine attempts a 3Pt. Contested by Ayo Jackson (5.6 feet, MAN). Dejounte LaVine misses. Rebound secured by Giannis Turner.

[04:10] Team_003 possession (Score: 76-73)
Nikola Bryant drives, Cade Barnes stays with him. Nikola Bryant attempts a Layup. Contested by Cade Barnes (3.1 feet, ZONE). Nikola Bryant misses. Rebound secured by Cade Barnes.

[03:58] Team_076 possession (Score: 76-73)
Paul Leonard attempts a 3Pt. Contested by Rudy Haliburton (4.4 feet, MAN). PAUL LEONARD MAKES IT! Assist: Dejounte LaVine
Score: 76-76

[03:43] Team_003 possession (Score: 76-76)
Nikola Bryant attempts a 3Pt. Heavily contested by Tobias Mitchell (1.1 feet, MAN)! NIKOLA BRYANT MAKES IT! Assist: Rudy Haliburton
Score: 79-76

[03:29] Team_076 possession (Score: 79-76)
Tobias Mitchell drives to the basket... Tobias Mitchell throws a bad pass! Stolen by Giannis Turner! TURNOVER! (live ball)

[03:13] Team_003 possession (Score: 79-76)
Ayo Jackson attempts a 3Pt. Wide open! Cade Barnes is 6.1 feet away. [ZONE] Ayo Jackson misses. Offensive rebound by Victor O'Neal! Victor O'Neal kicks it out.

[02:58] Team_003 possession (Score: 79-76)
Ayo Jackson drives and kicks out. Giannis Turner attempts a Midrange. Contested by Cade Barnes (4.8 feet, MAN). GIANNIS TURNER MAKES IT! Assist: Ayo Jackson
Score: 81-76

[02:42] Team_076 possession (Score: 81-76)
Paul Leonard attempts a Layup. Contested by Rudy Haliburton (2.6 feet, MAN). Paul Leonard misses. Rebound secured by Victor O'Neal.

[02:27] Team_003 possession (Score: 81-76)
Ayo Jackson attempts a 3Pt. Wide open! Cade Barnes is 6.5 feet away. [ZONE] Ayo Jackson misses. Offensive rebound by Victor O'Neal! Victor O'Neal kicks it out.

[02:16] Team_003 possession (Score: 81-76)
FOUL! Reach-in foul on Cade Barnes during the drive. [Team fouls: 3] No free throws, side out. (Cade Barnes: 4 personal fouls)

[02:02] Team_003 possession (Score: 81-76)
FOUL! Reach-in foul on Cade Barnes during the drive. [Team fouls: 4] No free throws, side out. (Cade Barnes: 5 personal fouls)

[01:47] Team_003 possession (Score: 81-76)
Victor O'Neal attempts a Midrange. Contested by Tobias Mitchell (3.6 feet, ZONE). Victor O'Neal misses. FOUL! Loose ball foul on Cade Barnes during the rebound battle. [IN THE BONUS! 5 team fouls] Rudy Haliburton to the line for 2 free throws. (Cade Barnes: 6 personal fouls) Cade Barnes FOULS OUT!   FT 1/2: GOOD   FT 2/2: MISS Rudy Haliburton makes 1/2 from the line. Rebound secured by D'Angelo Tatum.
Score: 82-76

[01:47] Substitution (Team_076): Cade Barnes OUT (stamina: 92) → Pascal Lowry IN (foul_out)

[01:32] Team_076 possession (Score: 82-76)
Paul Leonard loses the ball! Stripped by Rudy Haliburton! TURNOVER! (live ball)

[01:16] Team_003 possession (Score: 82-76)
Victor O'Neal attempts a Midrange. Contested by D'Angelo Tatum (3.3 feet, MAN). VICTOR O'NEAL MAKES IT! Assist: Ayo Jackson
Score: 84-76

[01:02] Team_076 possession (Score: 84-76)
Paul Leonard attempts a 3Pt. Contested by Nikola Bryant (5.2 feet, ZONE). Paul Leonard misses. Rebound secured by Giannis Turner.

[00:47] Team_003 possession (Score: 84-76)
FOUL! Offensive foul on Ayo Jackson! Dejounte LaVine drew the charge! [Team fouls: 4] (Ayo Jackson: 1 personal fouls) TURNOVER! (dead ball)

[00:28] Team_076 possession (Score: 84-76)
Paul Leonard attempts a 3Pt. Contested by Rudy Haliburton (4.7 feet, MAN). Paul Leonard misses. Rebound secured by Giannis Turner.

[00:09] Team_003 possession (Score: 84-76)
Nikola Bryant drives, Tobias Mitchell stays with him. Nikola Bryant attempts a Layup. Heavily contested by Tobias Mitchell (0.5 feet, MAN)! NIKOLA BRYANT MAKES IT! Assist: Rudy Haliburton
Score: 86-76

================================================================================
                              3RD QUARTER COMPLETE                              
================================================================================

3RD QUARTER SCORE: Team_003 24, Team_076 22

BOX SCORE:
================================================================================

Team_003
--------------------------------------------------------------------------------
Player                MIN  PTS  REB  AST  TO      FG   FG%      3P   3P%
--------------------------------------------------------------------------------
Bam Gilgeous-Alexander   17    7    0    0   0   3/5    60.0     0/0   0.0
Miles Towns            18    5    0    0   0   2/4    50.0     0/0   0.0
Nikola Bryant          18    5    0    0   0   2/3    66.7     0/0   0.0
Collin Mitchell        15    2    2    2   0   1/1   100.0     0/0   0.0
Giannis Turner         18    2    3    0   0   1/1   100.0     0/0   0.0
Victor O'Neal          19    2    3    0   0   1/2    50.0     0/0   0.0
Anfernee Jordan        18    0    3    0   0   0/1     0.0     0/0   0.0
Pau Williamson         18    0    0    1   0   0/2     0.0     0/0   0.0
Rudy Haliburton        21    0    0    2   0   0/0     0.0     0/0   0.0
Ayo Jackson            18    0    0    2   0   0/0     0.0     0/0   0.0
D'Angelo Tatum         18    0    1    0   0   0/0     0.0     0/0   0.0

TEAM: FG: 10/19 (52.6%), 3PT: 3/8 (37.5%), REB: 14 (6 off, 8 def), AST: 7, TO: 4
TEAM FOULS: 4


Team_076
--------------------------------------------------------------------------------
Player                MIN  PTS  REB  AST  TO      FG   FG%      3P   3P%
--------------------------------------------------------------------------------
Jalen Poole            18    7    0    0   0   3/4    75.0     0/0   0.0
Vince Lowry            18    5    1    1   0   2/4    50.0     0/0   0.0
Jordan Doncic          18    4    2    1   0   2/3    66.7     0/0   0.0
Pascal Lowry           20    3    0    1   0   1/2    50.0     0/0   0.0
Paul Leonard           18    3    0    0   0   1/4    25.0     0/0   0.0
Kevin Nowitzki         18    0    4    0   0   0/0     0.0     0/0   0.0
Dejounte LaVine        18    0    0    1   0   0/1     0.0     0/0   0.0
Cade Barnes            17    0    1    0   0   0/0     0.0     0/0   0.0

TEAM: FG: 9/18 (50.0%), 3PT: 3/6 (50.0%), REB: 6 (0 off, 6 def), AST: 4, TO: 4
TEAM FOULS: 5 [Team_003 in BONUS]

================================================================================

================================================================================
                       4TH QUARTER - Team_003 vs Team_076                       
================================================================================

[12:00] Team_003 possession (Score: 86-76)
Giannis Turner drives, D'Angelo Tatum stays with him. Giannis Turner attempts a Dunk. Heavily contested by D'Angelo Tatum (1.8 feet, MAN)! Giannis Turner misses. Rebound secured by D'Angelo Tatum.

[11:50] Team_076 possession (Score: 86-76)
Paul Leonard attempts a 3Pt. Contested by Giannis Turner (5.8 feet, ZONE). Paul Leonard misses. Rebound secured by Giannis Turner.

[11:32] Team_003 possession (Score: 86-76)
Ayo Jackson drives to the basket... Ayo Jackson loses the ball! Stripped by Dejounte LaVine! TURNOVER! (live ball)

[11:15] Team_076 possession (Score: 86-76)
Paul Leonard attempts a 3Pt. Heavily contested by Giannis Turner (1.3 feet, ZONE)! Paul Leonard misses. Rebound secured by Giannis Turner.

[11:01] Team_003 possession (Score: 86-76)
Rudy Haliburton attempts a Layup. Contested by Paul Leonard (3.3 feet, MAN). RUDY HALIBURTON MAKES IT! Assist: Ayo Jackson
Score: 88-76

[10:48] Team_076 possession (Score: 88-76)
FOUL! Shooting foul on Nikola Bryant. Tobias Mitchell to the line for 3 free throws. [Team fouls: 1] (Nikola Bryant: 2 personal fouls)   FT 1/3: GOOD   FT 2/3: GOOD   FT 3/3: GOOD Tobias Mitchell makes 3/3 from the line.
Score: 88-79

[10:32] Team_003 possession (Score: 88-79)
Giannis Turner attempts a Midrange. Contested by Tobias Mitchell (4.9 feet, ZONE). GIANNIS TURNER MAKES IT! Assist: Ayo Jackson
Score: 90-79

[10:16] Team_076 possession (Score: 90-79)
Paul Leonard attempts a 3Pt. Contested by Rudy Haliburton (4.3 feet, MAN). PAUL LEONARD MAKES IT! Assist: D'Angelo Tatum
Score: 90-82

[10:01] Team_003 possession (Score: 90-82)
Rudy Haliburton attempts a 3Pt. Wide open! Paul Leonard is 7.8 feet away. [MAN] RUDY HALIBURTON MAKES IT! Assist: Ayo Jackson
Score: 93-82

[09:46] Team_076 possession (Score: 93-82)
Paul Leonard attempts a 3Pt. Contested by Rudy Haliburton (4.1 feet, MAN). Paul Leonard misses. Rebound secured by Rudy Haliburton.

[09:36] Team_003 possession (Score: 93-82)
Ayo Jackson attempts a 3Pt. Contested by Dejounte LaVine (3.3 feet, ZONE). AYO JACKSON MAKES IT! Assist: Victor O'Neal
Score: 96-82

[09:22] Team_076 possession (Score: 96-82)
Dejounte LaVine attempts a 3Pt. Contested by Ayo Jackson (5.2 feet, MAN). Dejounte LaVine misses. Rebound secured by Victor O'Neal.

[09:12] Team_003 possession (Score: 96-82)
Ayo Jackson attempts a 3Pt. Contested by Dejounte LaVine (4.1 feet, ZONE). AYO JACKSON MAKES IT! Assist: Victor O'Neal
Score: 99-82

[08:56] Team_076 possession (Score: 99-82)
Tobias Mitchell attempts a 3Pt. Contested by Nikola Bryant (4.8 feet, MAN). Tobias Mitchell misses. Rebound secured by Victor O'Neal.

[08:46] Team_003 possession (Score: 99-82)
Rudy Haliburton drives, picks up D'Angelo Tatum. Help arrives from Tobias Mitchell! Rudy Haliburton attempts a Layup. Contested by Tobias Mitchell (2.2 feet, ZONE). RUDY HALIBURTON MAKES IT!
Score: 101-82

[08:31] Team_076 possession (Score: 101-82)
Pascal Lowry attempts a Layup. BLOCKED BY GIANNIS TURNER! Ball goes out off Giannis Turner. Pascal Lowry's ball!

[08:17] Team_076 possession (Score: 101-82)
Dejounte LaVine drives and kicks out. Dejounte LaVine attempts a 3Pt. Contested by Ayo Jackson (5.2 feet, MAN). Dejounte LaVine misses. Rebound secured by Rudy Haliburton.

[08:02] Team_003 possession (Score: 101-82)
Giannis Turner drives and kicks out. FOUL! Shooting foul on Tobias Mitchell. Giannis Turner to the line for 2 free throws. [Team fouls: 1] (Tobias Mitchell: 1 personal fouls)   FT 1/2: GOOD   FT 2/2: GOOD Giannis Turner makes 2/2 from the line.
Score: 103-82

[07:45] Team_076 possession (Score: 103-82)
D'Angelo Tatum attempts a 3Pt. Contested by Giannis Turner (4.6 feet, MAN). D'Angelo Tatum misses. Rebound secured by Victor O'Neal.

[07:32] Team_003 possession (Score: 103-82)
Rudy Haliburton throws a bad pass! Stolen by Paul Leonard! TURNOVER! (live ball)

[07:17] Team_076 possession (Score: 103-82)
Paul Leonard attempts a 3Pt. Heavily contested by Giannis Turner (0.5 feet, ZONE)! Paul Leonard misses. Rebound secured by Victor O'Neal.

[07:03] Team_003 possession (Score: 103-82)
Rudy Haliburton attempts a 3Pt. Wide open! Dejounte LaVine is 6.4 feet away. [ZONE] Rudy Haliburton misses. Rebound secured by D'Angelo Tatum.

[06:48] Team_076 possession (Score: 103-82)
Pascal Lowry attempts a 3Pt. Contested by Ayo Jackson (4.1 feet, MAN). Pascal Lowry misses. Rebound secured by Victor O'Neal.

[06:37] Team_003 possession (Score: 103-82)
Nikola Bryant attempts a 3Pt. Contested by Tobias Mitchell (3.3 feet, MAN). NIKOLA BRYANT MAKES IT! Assist: Victor O'Neal
Score: 106-82

[06:24] Team_076 possession (Score: 106-82)
Dejounte LaVine attempts a 3Pt. Wide open! Ayo Jackson is 7.3 feet away. [MAN] DEJOUNTE LAVINE MAKES IT! Assist: Paul Leonard
Score: 106-85

[06:08] Team_003 possession (Score: 106-85)
Nikola Bryant attempts a 3Pt. Contested by Tobias Mitchell (4.1 feet, MAN). Nikola Bryant misses. Rebound secured by Tobias Mitchell.

[05:55] Team_076 possession (Score: 106-85)
FOUL! Reach-in foul on Giannis Turner during the drive. [Team fouls: 2] No free throws, side out. (Giannis Turner: 5 personal fouls)

[05:55] Substitution (Team_003): Ayo Jackson OUT → Miles Towns IN (stamina_rule2)

[05:55] Substitution (Team_076): Dejounte LaVine OUT → Jalen Poole IN (stamina_rule2)

[05:55] Substitution (Team_076): Tobias Mitchell OUT → Cade Barnes IN (stamina_rule2)

[05:38] Team_076 possession (Score: 106-85)
FOUL! Holding foul on Miles Towns. [Team fouls: 3] No free throws, side out. (Miles Towns: 2 personal fouls)

[05:25] Team_076 possession (Score: 106-85)
Cade Barnes attempts a 3Pt. Heavily contested by Giannis Turner (0.5 feet, MAN)! CADE BARNES MAKES IT! Assist: Jalen Poole
Score: 106-88

[05:09] Team_003 possession (Score: 106-88)
Victor O'Neal attempts a 3Pt. Contested by Cade Barnes (3.7 feet, ZONE). Victor O'Neal misses. Offensive rebound by Rudy Haliburton! Rudy Haliburton's putback is no good. Rebound secured by D'Angelo Tatum.

[04:55] Team_076 possession (Score: 106-88)
D'Angelo Tatum attempts a Midrange. Contested by Giannis Turner (2.8 feet, MAN). D'ANGELO TATUM MAKES IT! Assist: Paul Leonard
Score: 106-90

[04:40] Team_003 possession (Score: 106-90)
Giannis Turner attempts a Midrange. Wide open! Pascal Lowry is 6.7 feet away. [ZONE] GIANNIS TURNER MAKES IT! Assist: Rudy Haliburton
Score: 108-90

[04:28] Team_076 possession (Score: 108-90)
Jalen Poole attempts a Midrange. Contested by Nikola Bryant (5.5 feet, MAN). JALEN POOLE MAKES IT!
Score: 108-92

[04:10] Team_003 possession (Score: 108-92)
Giannis Turner drives, Cade Barnes stays with him. Giannis Turner attempts a Layup. Contested by Cade Barnes (3.2 feet, MAN). Giannis Turner misses. Rebound secured by Jalen Poole.

[03:51] Team_076 possession (Score: 108-92)
Cade Barnes loses the ball! Stripped by Giannis Turner! TURNOVER! (live ball)

[03:36] Team_003 possession (Score: 108-92)
FOUL! Reach-in foul on Pascal Lowry during the drive. [Team fouls: 2] No free throws, side out. (Pascal Lowry: 1 personal fouls)

[03:36] Substitution (Team_003): Nikola Bryant OUT → Pau Williamson IN (stamina_rule2)

[03:36] Substitution (Team_003): Giannis Turner OUT → Anfernee Jordan IN (stamina_rule2)

[03:36] Substitution (Team_003): Victor O'Neal OUT → Bam Gilgeous-Alexander IN (stamina_rule2)

[03:36] Substitution (Team_076): Paul Leonard OUT → Vince Lowry IN (stamina_rule2)

[03:36] Substitution (Team_076): D'Angelo Tatum OUT → Jordan Doncic IN (stamina_rule2)

[03:24] Team_003 possession (Score: 108-92)
Bam Gilgeous-Alexander drives, Jordan Doncic stays with him. Bam Gilgeous-Alexander attempts a Dunk. Heavily contested by Jordan Doncic (0.5 feet, MAN)! Bam Gilgeous-Alexander misses. Rebound secured by Jordan Doncic.

[03:09] Team_076 possession (Score: 108-92)
Cade Barnes attempts a Midrange. Heavily contested by Bam Gilgeous-Alexander (1.6 feet, MAN)! Cade Barnes misses. Rebound secured by Rudy Haliburton.

[02:54] Team_003 possession (Score: 108-92)
Miles Towns attempts a 3Pt. Contested by Cade Barnes (5.1 feet, ZONE). Miles Towns misses. Offensive rebound by Rudy Haliburton! Rudy Haliburton kicks it out.

[02:43] Team_003 possession (Score: 108-92)
Bam Gilgeous-Alexander drives and kicks out. Pau Williamson attempts a 3Pt. Contested by Cade Barnes (4.7 feet, ZONE). Pau Williamson misses. Offensive rebound by Bam Gilgeous-Alexander! Bam Gilgeous-Alexander's putback is no good. Offensive rebound by Bam Gilgeous-Alexander! Bam Gilgeous-Alexander kicks it out.

[02:28] Team_003 possession (Score: 108-92)
Miles Towns attempts a 3Pt. Contested by Cade Barnes (5.1 feet, ZONE). Miles Towns misses. Rebound secured by Jordan Doncic.

[02:15] Team_076 possession (Score: 108-92)
Jalen Poole attempts a 3Pt. Contested by Miles Towns (5.4 feet, ZONE). JALEN POOLE MAKES IT! Assist: Cade Barnes
Score: 108-95

[02:05] Team_003 possession (Score: 108-95)
Anfernee Jordan attempts a 3Pt. Contested by Cade Barnes (5.8 feet, ZONE). Anfernee Jordan misses. Rebound secured by Jordan Doncic.

[01:52] Team_076 possession (Score: 108-95)
Vince Lowry attempts a 3Pt. Contested by Rudy Haliburton (4.2 feet, MAN). Vince Lowry misses. Rebound secured by Rudy Haliburton.

[01:37] Team_003 possession (Score: 108-95)
Rudy Haliburton loses the ball! Stripped by Vince Lowry! TURNOVER! (live ball)

[01:21] Team_076 possession (Score: 108-95)
Jordan Doncic makes the Midrange and draws the foul on Bam Gilgeous-Alexander! And-1! Jordan Doncic to the line for 1. [Team fouls: 4] (Bam Gilgeous-Alexander: 3 personal fouls)   FT 1/1: GOOD Jordan Doncic makes 1/1 from the line.
Score: 108-98

[01:08] Team_003 possession (Score: 108-98)
Bam Gilgeous-Alexander attempts a 3Pt. Contested by Cade Barnes (3.9 feet, ZONE). Bam Gilgeous-Alexander misses. Rebound secured by Vince Lowry.

[00:51] Team_076 possession (Score: 108-98)
Cade Barnes attempts a 3Pt. Contested by Miles Towns (3.4 feet, ZONE). CADE BARNES MAKES IT! Assist: Pascal Lowry
Score: 108-101

[00:36] Team_003 possession (Score: 108-101)
Miles Towns drives and kicks out. Rudy Haliburton attempts a 3Pt. Contested by Cade Barnes (4.9 feet, ZONE). Rudy Haliburton misses. Rebound secured by Cade Barnes.

[00:17] Team_076 possession (Score: 108-101)
Jalen Poole drives and kicks out. Pascal Lowry attempts a Midrange. Wide open! Pau Williamson is 7.1 feet away. [ZONE] Pascal Lowry misses. Rebound secured by Rudy Haliburton.

[00:03] Team_003 possession (Score: 108-101)
Pau Williamson attempts a 3Pt. Wide open! Jalen Poole is 7.8 feet away. [MAN] PAU WILLIAMSON MAKES IT! Assist: Rudy Haliburton
Score: 111-101

================================================================================
                              4TH QUARTER COMPLETE                              
================================================================================

4TH QUARTER SCORE: Team_003 25, Team_076 25

BOX SCORE:
================================================================================

Team_003
--------------------------------------------------------------------------------
Player                MIN  PTS  REB  AST  TO      FG   FG%      3P   3P%
--------------------------------------------------------------------------------
Rudy Haliburton        33    7    6    2   0   3/4    75.0     0/0   0.0
Giannis Turner         27    6    2    0   0   3/5    60.0     0/0   0.0
Ayo Jackson            25    6    0    3   0   2/2   100.0     0/0   0.0
Nikola Bryant          27    3    0    0   0   1/2    50.0     0/0   0.0
Pau Williamson         22    3    0    0   0   1/1   100.0     0/0   0.0
Victor O'Neal          28    0    5    3   0   0/1     0.0     0/0   0.0
Bam Gilgeous-Alexander   21    0    1    0   0   0/2     0.0     0/0   0.0
Miles Towns            24    0    0    0   0   0/2     0.0     0/0   0.0
Anfernee Jordan        22    0    0    0   0   0/1     0.0     0/0   0.0

TEAM: FG: 10/20 (50.0%), 3PT: 5/11 (45.5%), REB: 15 (3 off, 12 def), AST: 8, TO: 3
TEAM FOULS: 4


Team_076
--------------------------------------------------------------------------------
Player                MIN  PTS  REB  AST  TO      FG   FG%      3P   3P%
--------------------------------------------------------------------------------
Cade Barnes            22    6    1    1   0   2/3    66.7     0/0   0.0
Jalen Poole            24    5    1    1   0   2/3    66.7     0/0   0.0
Paul Leonard           27    3    0    2   0   1/5    20.0     0/0   0.0
Tobias Mitchell        25    3    1    0   0   1/2    50.0     0/0   0.0
Dejounte LaVine        25    3    0    0   0   1/3    33.3     0/0   0.0
Jordan Doncic          22    3    3    0   0   1/1   100.0     0/0   0.0
D'Angelo Tatum         27    2    3    1   0   1/2    50.0     0/0   0.0
Pascal Lowry           32    0    0    1   0   0/1     0.0     0/0   0.0
Vince Lowry            22    0    1    0   0   0/1     0.0     0/0   0.0

TEAM: FG: 9/21 (42.9%), 3PT: 6/15 (40.0%), REB: 9 (0 off, 9 def), AST: 6, TO: 1
TEAM FOULS: 2

================================================================================

================================================================================
                               FULL GAME COMPLETE                               
================================================================================

FINAL SCORE: Team_003 111, Team_076 101

SCORING BY QUARTER:
--------------------------------------------------------------------------------
Team                     Q1     Q2     Q3     Q4    FINAL
--------------------------------------------------------------------------------
Team_003                 28     34     24     25      111
Team_076                 26     28     22     25      101
--------------------------------------------------------------------------------

FULL GAME BOX SCORE:
================================================================================

Team_003
--------------------------------------------------------------------------------
Player                MIN  PTS  REB  AST  TO      FG   FG%      3P   3P%      FT STL BLK
--------------------------------------------------------------------------------
Rudy Haliburton        33   22   14    6   3   9/12   75.0   5/7    71.4   1/2     1   0
Victor O'Neal          28    5   11    3   0   2/5    40.0   0/1     0.0   2/3     0   0
Nikola Bryant          27   11    0    0   0   4/8    50.0   3/5    60.0   0/0     0   1
Giannis Turner         27   10    9    2   2   4/9    44.4   0/0     0.0   2/2     2   1
Ayo Jackson            25   12    0    9   1   6/10   60.0   2/6    33.3   2/3     0   0
Miles Towns            24   13    0    2   1   4/8    50.0   2/5    40.0   1/1     0   0
Pau Williamson         22   12    0    3   0   4/7    57.1   4/7    57.1   0/0     1   1
Anfernee Jordan        22    2    5    0   0   1/4    25.0   0/2     0.0   0/0     1   0
Bam Gilgeous-Alexander   21   11    4    1   3   6/10   60.0   1/3    33.3   0/1     3   0
Collin Mitchell        15    8    2    4   0   3/6    50.0   2/4    50.0   0/0     0   0

TEAM: FG: 43/79 (54.4%), 3PT: 19/40 (47.5%), REB: 50 (16 off, 34 def), AST: 30, TO: 10


Team_076
--------------------------------------------------------------------------------
Player                MIN  PTS  REB  AST  TO      FG   FG%      3P   3P%      FT STL BLK
--------------------------------------------------------------------------------
Pascal Lowry           32   11    0    3   0   2/5    40.0   1/2    50.0   3/3     0   0
Paul Leonard           27   18    0    3   1   7/19   36.8   7/18   38.9   0/0     2   0
D'Angelo Tatum         27    8    9    5   0   3/5    60.0   0/2     0.0   2/2     0   0
Dejounte LaVine        25    6    0    2   0   2/6    33.3   2/4    50.0   1/2     2   0
Tobias Mitchell        25    9    5    1   0   3/7    42.9   3/6    50.0   6/6     0   0
Jalen Poole            24   12    1    3   3   6/9    66.7   2/3    66.7   2/3     0   0
Cade Barnes            22    9    9    2   3   3/5    60.0   2/2   100.0   1/2     0   0
Vince Lowry            22   10    3    3   1   3/7    42.9   2/4    50.0   0/0     1   0
Jordan Doncic          22   12    8    1   1   6/8    75.0   0/0     0.0   4/4     1   0
Kevin Nowitzki         18    5    8    0   2   2/2   100.0   1/1   100.0   0/0     0   0

TEAM: FG: 39/75 (52.0%), 3PT: 20/42 (47.6%), REB: 38 (7 off, 31 def), AST: 23, TO: 11

================================================================================
