================================================================================
                        FULL GAME - Team_073 vs Team_079                        
================================================================================

================================================================================
                       1ST QUARTER - Team_073 vs Team_079                       
================================================================================

[12:00] Team_073 possession (Score: 0-0)
FOUL! Offensive foul on Karl Williamson! Bam Randle drew the charge! [Team fouls: 1] (Karl Williamson: 1 personal fouls) TURNOVER! (dead ball)

[11:48] Team_079 possession (Score: 0-0)
Bam Randle attempts a Midrange. Contested by Karl Williamson (3.3 feet, MAN). Bam Randle misses. Rebound secured by Carmelo Porzingis.

[11:37] Team_073 possession (Score: 0-0)
Karl Williamson drives, Bam Randle stays with him. Karl Williamson attempts a Dunk. Contested by Bam Randle (3.3 feet, MAN). Karl Williamson misses. Rebound secured by Bam Randle.

[11:23] Team_079 possession (Score: 0-0)
Miles Ming attempts a 3Pt. Contested by Isaiah Smith (2.4 feet, MAN). Miles Ming misses. Rebound secured by Isaiah Smith.

[11:07] Team_073 possession (Score: 0-0)
Bradley Morant drives and kicks out. Isaiah Smith attempts a Midrange. Contested by Miles Ming (5.6 feet, MAN). Isaiah Smith misses. Rebound secured by Bam Randle.

[10:56] Team_079 possession (Score: 0-0)
Donovan Randle attempts a Layup. Contested by Bradley Morant (4.6 feet, MAN). Donovan Randle misses. Offensive rebound by Donovan Randle! Donovan Randle kicks it out.

[10:44] Team_079 possession (Score: 0-0)
Khris Embiid attempts a 3Pt. Contested by Carmelo Young (4.6 feet, MAN). KHRIS EMBIID MAKES IT! Assist: Bam Randle
Score: 0-3

[10:31] Team_073 possession (Score: 0-3)
Carmelo Young attempts a 3Pt. Contested by Trae Durant (2.1 feet, ZONE). Carmelo Young misses. Rebound secured by Trae Durant.

[10:19] Team_079 possession (Score: 0-3)
Bam Randle attempts a 3Pt. Wide open! Karl Williamson is 6.2 feet away. [ZONE] Bam Randle misses. FOUL! Loose ball foul on Carmelo Porzingis during the rebound battle. [Team fouls: 2] No free throws, side out. (Carmelo Porzingis: 1 personal fouls)

[10:02] Team_079 possession (Score: 0-3)
Trae Durant attempts a Dunk. BLOCKED BY CARMELO PORZINGIS! Ball is loose! Rebound secured by Isaiah Smith.

[09:47] Team_073 possession (Score: 0-3)
Karl Williamson attempts a 3Pt. Heavily contested by Trae Durant (0.5 feet, ZONE)! Karl Williamson misses. Offensive rebound by Carmelo Porzingis! Carmelo Porzingis kicks it out.

[09:33] Team_073 possession (Score: 0-3)
Carmelo Porzingis attempts a Midrange. Contested by Miles Ming (5.2 feet, ZONE). Carmelo Porzingis misses. Offensive rebound by Bradley Morant! Bradley Morant kicks it out.

[09:18] Team_073 possession (Score: 0-3)
FOUL! Reach-in foul on Trae Durant during the drive. [Team fouls: 1] No free throws, side out. (Trae Durant: 1 personal fouls)

[09:02] Team_073 possession (Score: 0-3)
FOUL! Holding foul on Trae Durant. [Team fouls: 2] No free throws, side out. (Trae Durant: 2 personal fouls)

[08:47] Team_073 possession (Score: 0-3)
Carmelo Young attempts a Midrange. Contested by Miles Ming (3.0 feet, ZONE). Carmelo Young misses. Rebound secured by Trae Durant.

[08:37] Team_079 possession (Score: 0-3)
Donovan Randle drives, Bradley Morant stays with him. Donovan Randle attempts a Layup. Contested by Bradley Morant (3.7 feet, MAN). DONOVAN RANDLE MAKES IT! Assist: Miles Ming
Score: 0-5

[08:25] Team_073 possession (Score: 0-5)
FOUL! Reach-in foul on Khris Embiid during the drive. [Team fouls: 3] No free throws, side out. (Khris Embiid: 1 personal fouls)

[08:16] Team_073 possession (Score: 0-5)
Karl Williamson drives, picks up Bam Randle. Help arrives from Miles Ming! Karl Williamson attempts a Layup. Wide open! Miles Ming is 6.1 feet away. [MAN] KARL WILLIAMSON MAKES IT!
Score: 2-5

[07:58] Team_079 possession (Score: 2-5)
Donovan Randle attempts a Midrange. Contested by Bradley Morant (4.3 feet, MAN). Donovan Randle misses. Offensive rebound by Donovan Randle! Donovan Randle kicks it out.

[07:44] Team_079 possession (Score: 2-5)
Miles Ming attempts a 3Pt. Wide open! Isaiah Smith is 7.7 feet away. [MAN] Miles Ming misses. Rebound secured by Bradley Morant.

[07:31] Team_073 possession (Score: 2-5)
Karl Williamson attempts a 3Pt. Contested by Bam Randle (4.3 feet, MAN). Karl Williamson misses. Rebound secured by Bam Randle.

[07:18] Team_079 possession (Score: 2-5)
Khris Embiid drives, Bradley Morant stays with him. Khris Embiid attempts a Layup. Contested by Bradley Morant (5.0 feet, ZONE). Khris Embiid misses. Rebound secured by Bradley Morant.

[07:05] Team_073 possession (Score: 2-5)
Carmelo Porzingis drives, Trae Durant stays with him. Carmelo Porzingis attempts a Layup. Contested by Trae Durant (2.7 feet, MAN). CARMELO PORZINGIS MAKES IT!
Score: 4-5

[06:53] Team_079 possession (Score: 4-5)
Donovan Randle attempts a Layup. Wide open! Bradley Morant is 7.6 feet away. [MAN] Donovan Randle misses. Rebound secured by Carmelo Porzingis.

[06:38] Team_073 possession (Score: 4-5)
Carmelo Porzingis attempts a Midrange. Contested by Trae Durant (2.9 feet, MAN). Carmelo Porzingis misses. Offensive rebound by Carmelo Porzingis! Carmelo Porzingis kicks it out.

[06:27] Team_073 possession (Score: 4-5)
Bradley Morant drives, Donovan Randle stays with him. Bradley Morant attempts a Dunk. Heavily contested by Donovan Randle (0.5 feet, MAN)! BRADLEY MORANT MAKES IT!
Score: 6-5

[06:16] Team_079 possession (Score: 6-5)
Trae Durant makes the Midrange and draws the foul on Carmelo Porzingis! And-1! Trae Durant to the line for 1. [Team fouls: 3] (Carmelo Porzingis: 2 personal fouls)   FT 1/1: GOOD Trae Durant makes 1/1 from the line.
Score: 6-8

[06:02] Team_073 possession (Score: 6-8)
Bradley Morant makes the Layup and draws the foul on Donovan Randle! And-1! Bradley Morant to the line for 1. [Team fouls: 4] (Donovan Randle: 1 personal fouls)   FT 1/1: GOOD Bradley Morant makes 1/1 from the line.
Score: 9-8

[05:43] Team_079 possession (Score: 9-8)
Bam Randle attempts a 3Pt. Contested by Karl Williamson (5.4 feet, MAN). Bam Randle misses. Rebound secured by Carmelo Porzingis.

[05:25] Team_073 possession (Score: 9-8)
Carmelo Young drives to the basket... Carmelo Young loses the ball! Stripped by Trae Durant! TURNOVER! (live ball)

[05:11] Team_079 possession (Score: 9-8)
FOUL! Holding foul on Bradley Morant. [Team fouls: 4] No free throws, side out. (Bradley Morant: 1 personal fouls)

[04:59] Team_079 possession (Score: 9-8)
Miles Ming loses the ball! Stripped by Isaiah Smith! TURNOVER! (live ball)

[04:42] Team_073 possession (Score: 9-8)
Bradley Morant attempts a Midrange. Wide open! Bam Randle is 8.2 feet away. [ZONE] Bradley Morant misses. Rebound secured by Bam Randle.

[04:29] Team_079 possession (Score: 9-8)
Trae Durant drives, Bradley Morant stays with him. Trae Durant attempts a Layup. Contested by Bradley Morant (3.0 feet, ZONE). TRAE DURANT MAKES IT! Assist: Khris Embiid
Score: 9-10

[04:20] Team_073 possession (Score: 9-10)
Karl Williamson drives, Donovan Randle stays with him. Karl Williamson attempts a Layup. Wide open! Donovan Randle is 7.8 feet away. [ZONE] KARL WILLIAMSON MAKES IT!
Score: 11-10

[04:05] Team_079 possession (Score: 11-10)
Trae Durant drives, Carmelo Porzingis stays with him. Trae Durant attempts a Layup. Wide open! Carmelo Porzingis is 7.5 feet away. [MAN] TRAE DURANT MAKES IT! Assist: Miles Ming
Score: 11-12

[03:52] Team_073 possession (Score: 11-12)
Karl Williamson drives, Trae Durant stays with him. Karl Williamson attempts a Layup. Heavily contested by Trae Durant (0.8 feet, ZONE)! Karl Williamson misses. Rebound secured by Donovan Randle.

[03:37] Team_079 possession (Score: 11-12)
FOUL! Holding foul on Karl Williamson. [IN THE BONUS! 5 team fouls] Bam Randle to the line for 2 free throws. (Karl Williamson: 2 personal fouls)   FT 1/2: GOOD   FT 2/2: GOOD Bam Randle makes 2/2 from the line.
Score: 11-14

[03:20] Team_073 possession (Score: 11-14)
Isaiah Smith drives and kicks out. Isaiah Smith attempts a 3Pt. Wide open! Miles Ming is 6.0 feet away. [MAN] Isaiah Smith misses. Rebound secured by Bam Randle.

[03:06] Team_079 possession (Score: 11-14)
Trae Durant drives, Carmelo Porzingis stays with him. Trae Durant attempts a Layup. Contested by Carmelo Porzingis (3.3 feet, MAN). TRAE DURANT MAKES IT! Assist: Donovan Randle
Score: 11-16

[02:52] Team_073 possession (Score: 11-16)
Carmelo Young attempts a 3Pt. Contested by Khris Embiid (5.3 feet, MAN). Carmelo Young misses. Offensive rebound by Carmelo Porzingis! Carmelo Porzingis kicks it out.

[02:35] Team_073 possession (Score: 11-16)
Carmelo Young attempts a 3Pt. Contested by Trae Durant (5.8 feet, ZONE). Carmelo Young misses. Offensive rebound by Carmelo Porzingis! Carmelo Porzingis kicks it out.

[02:21] Team_073 possession (Score: 11-16)
Carmelo Young attempts a 3Pt. Contested by Trae Durant (5.4 feet, ZONE). Carmelo Young misses. Offensive rebound by Bradley Morant! Bradley Morant kicks it out.

[02:10] Team_073 possession (Score: 11-16)
Karl Williamson throws a bad pass out of bounds! TURNOVER! (dead ball)

[02:10] Substitution (Team_073): Carmelo Young OUT → Zach Quickley IN (stamina_rule2)

[02:10] Substitution (Team_073): Isaiah Smith OUT → Luka Butler IN (stamina_rule2)

[02:10] Substitution (Team_073): Karl Williamson OUT → Dwyane McCollum IN (stamina_rule2)

[02:10] Substitution (Team_073): Carmelo Porzingis OUT → Shai Thompson IN (stamina_rule2)

[02:10] Substitution (Team_073): Bradley Morant OUT → Ja Rose IN (stamina_rule2)

[02:10] Substitution (Team_079): Khris Embiid OUT → Evan Mobley IN (stamina_rule2)

[02:10] Substitution (Team_079): Miles Ming OUT → Karl Ingram IN (stamina_rule2)

[02:10] Substitution (Team_079): Bam Randle OUT → Anthony Wade IN (stamina_rule2)

[02:10] Substitution (Team_079): Trae Durant OUT → Kobe Curry IN (stamina_rule2)

[02:10] Substitution (Team_079): Donovan Randle OUT → James LaVine IN (stamina_rule2)

[01:51] Team_079 possession (Score: 11-16)
FOUL! Offensive foul on Kobe Curry! Shai Thompson drew the charge! [Team fouls: 5] (Kobe Curry: 1 personal fouls) TURNOVER! (dead ball)

[01:37] Team_073 possession (Score: 11-16)
Dwyane McCollum attempts a Layup. Contested by Anthony Wade (5.4 feet, MAN). Dwyane McCollum misses. Rebound secured by James LaVine.

[01:21] Team_079 possession (Score: 11-16)
Evan Mobley drives to the basket... FOUL! Offensive foul on Evan Mobley! Zach Quickley drew the charge! [Team fouls: 6] (Evan Mobley: 1 personal fouls) TURNOVER! (dead ball)

[01:09] Team_073 possession (Score: 11-16)
Luka Butler attempts a 3Pt. Contested by Evan Mobley (5.2 feet, ZONE). Luka Butler misses. Rebound secured by Kobe Curry.

[00:55] Team_079 possession (Score: 11-16)
Kobe Curry drives and kicks out. Kobe Curry attempts a 3Pt. Heavily contested by Shai Thompson (0.5 feet, MAN)! Kobe Curry misses. Rebound secured by Ja Rose.

[00:44] Team_073 possession (Score: 11-16)
FOUL! Holding foul on Anthony Wade. [IN THE BONUS! 7 team fouls] Dwyane McCollum to the line for 2 free throws. (Anthony Wade: 1 personal fouls)   FT 1/2: MISS   FT 2/2: GOOD Dwyane McCollum makes 1/2 from the line.
Score: 12-16

[00:29] Team_079 possession (Score: 12-16)
Anthony Wade attempts a 3Pt. Contested by Dwyane McCollum (3.8 feet, MAN). ANTHONY WADE MAKES IT! Assist: Karl Ingram
Score: 12-19

[00:13] Team_073 possession (Score: 12-19)
Ja Rose attempts a Midrange. Wide open! Karl Ingram is 8.4 feet away. [ZONE] Ja Rose misses. Rebound secured by James LaVine.

================================================================================
                              1ST QUARTER COMPLETE                              
================================================================================

1ST QUARTER SCORE: Team_073 12, Team_079 19

BOX SCORE:
================================================================================

Team_073
--------------------------------------------------------------------------------
Player                MIN  PTS  REB  AST  TO      FG   FG%      3P   3P%
--------------------------------------------------------------------------------
Bradley Morant         10    5    4    0   0   2/4    50.0     0/0   0.0
Karl Williamson        10    4    0    0   0   2/5    40.0     0/0   0.0
Carmelo Porzingis      10    2    7    0   0   1/1   100.0     0/0   0.0
Dwyane McCollum         2    1    0    0   0   1/2    50.0     0/0   0.0
Isaiah Smith           10    0    2    0   0   0/1     0.0     0/0   0.0
Carmelo Young          10    0    0    0   0   0/2     0.0     0/0   0.0
Luka Butler             2    0    0    0   0   0/1     0.0     0/0   0.0
Ja Rose                 2    0    1    0   0   0/1     0.0     0/0   0.0

TEAM: FG: 6/17 (35.3%), 3PT: 0/3 (0.0%), REB: 14 (6 off, 8 def), AST: 0, TO: 3
TEAM FOULS: 5 [Team_079 in BONUS]


Team_079
--------------------------------------------------------------------------------
Player                MIN  PTS  REB  AST  TO      FG   FG%      3P   3P%
--------------------------------------------------------------------------------
Trae Durant            10    9    3    0   0   4/5    80.0     0/0   0.0
Khris Embiid           10    3    0    1   0   1/2    50.0     0/0   0.0
Anthony Wade            2    3    0    0   0   1/1   100.0     0/0   0.0
Bam Randle             10    2    5    1   0   1/3    33.3     0/0   0.0
Donovan Randle         10    2    3    1   0   1/2    50.0     0/0   0.0
Miles Ming             10    0    0    2   0   0/2     0.0     0/0   0.0
James LaVine            2    0    2    0   0   0/0     0.0     0/0   0.0
Kobe Curry              2    0    1    0   0   0/1     0.0     0/0   0.0
Karl Ingram             2    0    0    1   0   0/0     0.0     0/0   0.0

TEAM: FG: 8/16 (50.0%), 3PT: 2/5 (40.0%), REB: 14 (3 off, 11 def), AST: 6, TO: 3
TEAM FOULS: 7 [Team_073 in BONUS]

================================================================================

================================================================================
                       2ND QUARTER - Team_073 vs Team_079                       
================================================================================

[12:00] Team_073 possession (Score: 12-19)
Bradley Morant attempts a Midrange. Contested by Donovan Randle (2.1 feet, MAN). Bradley Morant misses. Offensive rebound by Bradley Morant! Bradley Morant kicks it out.

[11:47] Team_073 possession (Score: 12-19)
FOUL! Reach-in foul on Trae Durant during the drive. [Team fouls: 1] No free throws, side out. (Trae Durant: 1 personal fouls)

[11:36] Team_073 possession (Score: 12-19)
Bradley Morant drives, Trae Durant stays with him. Bradley Morant attempts a Layup. Heavily contested by Trae Durant (1.0 feet, ZONE)! Bradley Morant misses. Offensive rebound by Bradley Morant! Bradley Morant kicks it out.

[11:20] Team_073 possession (Score: 12-19)
Isaiah Smith loses the ball! Stripped by Miles Ming! TURNOVER! (live ball)

[11:05] Team_079 possession (Score: 12-19)
Donovan Randle attempts a Layup. Contested by Carmelo Porzingis (3.7 feet, ZONE). DONOVAN RANDLE MAKES IT! Assist: Bam Randle
Score: 12-21

[10:51] Team_073 possession (Score: 12-21)
Karl Williamson attempts a Midrange. Wide open! Bam Randle is 8.9 feet away. [MAN] KARL WILLIAMSON MAKES IT!
Score: 14-21

[10:35] Team_079 possession (Score: 14-21)
Donovan Randle makes the Dunk and draws the foul on Isaiah Smith! And-1! Donovan Randle to the line for 1. [Team fouls: 1] (Isaiah Smith: 1 personal fouls)   FT 1/1: GOOD Donovan Randle makes 1/1 from the line.
Score: 14-24

[10:22] Team_073 possession (Score: 14-24)
FOUL! Shooting foul on Bam Randle. Karl Williamson to the line for 2 free throws. [Team fouls: 2] (Bam Randle: 1 personal fouls)   FT 1/2: GOOD   FT 2/2: GOOD Karl Williamson makes 2/2 from the line.
Score: 16-24

[10:08] Team_079 possession (Score: 16-24)
Bam Randle drives and kicks out. Trae Durant attempts a Midrange. Contested by Carmelo Porzingis (4.3 feet, MAN). TRAE DURANT MAKES IT! Assist: Miles Ming
Score: 16-26

[09:57] Team_073 possession (Score: 16-26)
Bradley Morant attempts a Dunk. BLOCKED BY TRAE DURANT! Ball deflects out of bounds off Bradley Morant.

[09:46] Team_079 possession (Score: 16-26)
Bam Randle drives and kicks out. Bam Randle attempts a Midrange. Contested by Karl Williamson (4.5 feet, MAN). BAM RANDLE MAKES IT! Assist: Miles Ming
Score: 16-28

[09:34] Team_073 possession (Score: 16-28)
Carmelo Young attempts a Layup. Contested by Trae Durant (3.1 feet, ZONE). CARMELO YOUNG MAKES IT! Assist: Bradley Morant
Score: 18-28

[09:20] Team_079 possession (Score: 18-28)
Khris Embiid attempts a Midrange. Contested by Carmelo Young (3.0 feet, MAN). Khris Embiid misses. FOUL! Loose ball foul on Isaiah Smith during the rebound battle. [Team fouls: 2] No free throws, side out. (Isaiah Smith: 2 personal fouls)

[09:08] Team_079 possession (Score: 18-28)
Donovan Randle attempts a Layup. BLOCKED BY BRADLEY MORANT! Ball is loose! Rebound secured by Isaiah Smith.

[08:51] Team_073 possession (Score: 18-28)
Bradley Morant attempts a Dunk. BLOCKED BY DONOVAN RANDLE! Ball deflects out of bounds off Bradley Morant.

[08:35] Team_079 possession (Score: 18-28)
Bam Randle attempts a Layup. BLOCKED BY KARL WILLIAMSON! Ball goes out off Karl Williamson. Bam Randle's ball!

[08:21] Team_079 possession (Score: 18-28)
Miles Ming attempts a 3Pt. Contested by Isaiah Smith (3.7 feet, MAN). Miles Ming misses. Rebound secured by Carmelo Porzingis.

[08:06] Team_073 possession (Score: 18-28)
Bradley Morant drives, Donovan Randle stays with him. Bradley Morant attempts a Dunk. Wide open! Donovan Randle is 7.1 feet away. [MAN] BRADLEY MORANT MAKES IT! Assist: Carmelo Young
Score: 20-28

[07:51] Team_079 possession (Score: 20-28)
Khris Embiid attempts a Midrange. Wide open! Carmelo Young is 6.1 feet away. [MAN] KHRIS EMBIID MAKES IT! Assist: Donovan Randle
Score: 20-30

[07:39] Team_073 possession (Score: 20-30)
Carmelo Young makes the Layup and draws the foul on Khris Embiid! And-1! Carmelo Young to the line for 1. [Team fouls: 3] (Khris Embiid: 1 personal fouls)   FT 1/1: GOOD Carmelo Young makes 1/1 from the line.
Score: 23-30

[07:20] Team_079 possession (Score: 23-30)
Trae Durant attempts a Midrange. Contested by Carmelo Porzingis (3.7 feet, MAN). Trae Durant misses. Offensive rebound by Donovan Randle! Donovan Randle kicks it out.

[07:06] Team_079 possession (Score: 23-30)
Donovan Randle drives, picks up Bradley Morant. Help arrives from Isaiah Smith! Donovan Randle attempts a Dunk. Contested by Isaiah Smith (3.5 feet, ZONE). Donovan Randle misses. Rebound secured by Bradley Morant.

[06:51] Team_073 possession (Score: 23-30)
Karl Williamson attempts a 3Pt. Contested by Bam Randle (5.0 feet, MAN). Karl Williamson misses. Rebound secured by Donovan Randle.

[06:32] Team_079 possession (Score: 23-30)
Trae Durant drives, Bradley Morant stays with him. Trae Durant attempts a Layup. Contested by Bradley Morant (5.2 feet, ZONE). TRAE DURANT MAKES IT!
Score: 23-32

[06:16] Team_073 possession (Score: 23-32)
Karl Williamson drives to the basket... Karl Williamson commits a violation (traveling/carry)! TURNOVER! (dead ball)

[06:16] Substitution (Team_073): Carmelo Young OUT → Zach Quickley IN (stamina_rule2)

[06:16] Substitution (Team_073): Isaiah Smith OUT → Luka Butler IN (stamina_rule2)

[06:16] Substitution (Team_073): Karl Williamson OUT → Dwyane McCollum IN (stamina_rule2)

[06:16] Substitution (Team_073): Carmelo Porzingis OUT → Shai Thompson IN (stamina_rule2)

[06:16] Substitution (Team_073): Bradley Morant OUT → Ja Rose IN (stamina_rule2)

[06:16] Substitution (Team_079): Khris Embiid OUT → Evan Mobley IN (stamina_rule2)

[06:16] Substitution (Team_079): Miles Ming OUT → Karl Ingram IN (stamina_rule2)

[06:16] Substitution (Team_079): Bam Randle OUT → Anthony Wade IN (stamina_rule2)

[06:16] Substitution (Team_079): Trae Durant OUT → Kobe Curry IN (stamina_rule2)

[06:16] Substitution (Team_079): Donovan Randle OUT → James LaVine IN (stamina_rule2)

[06:00] Team_079 possession (Score: 23-32)
Kobe Curry attempts a Midrange. Contested by Shai Thompson (5.4 feet, ZONE). Kobe Curry misses. Offensive rebound by James LaVine! James LaVine's putback is no good. Rebound secured by Shai Thompson.

[05:43] Team_073 possession (Score: 23-32)
Ja Rose makes the Layup and draws the foul on James LaVine! And-1! Ja Rose to the line for 1. [Team fouls: 4] (James LaVine: 1 personal fouls)   FT 1/1: GOOD Ja Rose makes 1/1 from the line.
Score: 26-32

[05:32] Team_079 possession (Score: 26-32)
Karl Ingram attempts a Midrange. Contested by Shai Thompson (2.9 feet, ZONE). KARL INGRAM MAKES IT! Assist: Anthony Wade
Score: 26-34

[05:18] Team_073 possession (Score: 26-34)
Dwyane McCollum attempts a 3Pt. Contested by Evan Mobley (2.8 feet, ZONE). Dwyane McCollum misses. Rebound secured by Anthony Wade.

[05:02] Team_079 possession (Score: 26-34)
Anthony Wade attempts a Midrange. Contested by Dwyane McCollum (4.0 feet, ZONE). Anthony Wade misses. Rebound secured by Shai Thompson.

[04:43] Team_073 possession (Score: 26-34)
Shai Thompson attempts a Midrange. Wide open! James LaVine is 7.9 feet away. [ZONE] SHAI THOMPSON MAKES IT!
Score: 28-34

[04:27] Team_079 possession (Score: 28-34)
FOUL! Reach-in foul on Shai Thompson during the drive. [Team fouls: 3] No free throws, side out. (Shai Thompson: 1 personal fouls)

[04:15] Team_079 possession (Score: 28-34)
Karl Ingram loses the ball! Stripped by Luka Butler! TURNOVER! (live ball)

[03:58] Team_073 possession (Score: 28-34)
Shai Thompson drives and kicks out. Shai Thompson attempts a 3Pt. Contested by Kobe Curry (2.5 feet, MAN). Shai Thompson misses. Rebound secured by Kobe Curry.

[03:44] Team_079 possession (Score: 28-34)
Karl Ingram drives and kicks out. Kobe Curry attempts a 3Pt. Contested by Shai Thompson (4.4 feet, MAN). Kobe Curry misses. Rebound secured by Ja Rose.

[03:27] Team_073 possession (Score: 28-34)
Shai Thompson drives to the basket... Shai Thompson commits a violation (traveling/carry)! TURNOVER! (dead ball)

[03:13] Team_079 possession (Score: 28-34)
Kobe Curry attempts a 3Pt. Contested by Luka Butler (4.8 feet, ZONE). Kobe Curry misses. Rebound secured by Ja Rose.

[03:01] Team_073 possession (Score: 28-34)
Shai Thompson attempts a Midrange. Contested by Kobe Curry (3.9 feet, MAN). Shai Thompson misses. Rebound secured by Anthony Wade.

[02:44] Team_079 possession (Score: 28-34)
Karl Ingram throws a bad pass out of bounds! TURNOVER! (dead ball)

[02:26] Team_073 possession (Score: 28-34)
Luka Butler attempts a Midrange. Contested by Karl Ingram (4.0 feet, MAN). LUKA BUTLER MAKES IT!
Score: 30-34

[02:11] Team_079 possession (Score: 30-34)
Anthony Wade drives to the basket... Anthony Wade throws a bad pass! Stolen by Shai Thompson! TURNOVER! (live ball)

[02:02] Team_073 possession (Score: 30-34)
Ja Rose attempts a Layup. Contested by James LaVine (6.0 feet, MAN). JA ROSE MAKES IT!
Score: 32-34

[01:50] Team_079 possession (Score: 32-34)
Karl Ingram attempts a 3Pt. Wide open! Luka Butler is 6.4 feet away. [MAN] Karl Ingram misses. Rebound secured by Shai Thompson.

[01:41] Team_073 possession (Score: 32-34)
Zach Quickley drives to the basket... Zach Quickley loses control! Ball rolls out of bounds! TURNOVER! (dead ball)

[01:28] Team_079 possession (Score: 32-34)
Kobe Curry attempts a Midrange. Contested by Dwyane McCollum (6.0 feet, ZONE). KOBE CURRY MAKES IT! Assist: Karl Ingram
Score: 32-36

[01:16] Team_073 possession (Score: 32-36)
Luka Butler drives, picks up Karl Ingram. Help arrives from Anthony Wade! Luka Butler attempts a Layup. Wide open! Anthony Wade is 6.2 feet away. [MAN] Luka Butler misses. Rebound secured by Kobe Curry.

[01:03] Team_079 possession (Score: 32-36)
Kobe Curry drives, picks up Shai Thompson. Help arrives from Luka Butler! Kobe Curry attempts a Layup. Contested by Luka Butler (3.3 feet, MAN). KOBE CURRY MAKES IT!
Score: 32-38

[00:47] Team_073 possession (Score: 32-38)
Shai Thompson attempts a Midrange. Contested by Karl Ingram (3.3 feet, ZONE). Shai Thompson misses. Offensive rebound by Dwyane McCollum! Dwyane McCollum puts it back in!
Score: 34-38

[00:36] Team_079 possession (Score: 34-38)
Anthony Wade attempts a 3Pt. Contested by Luka Butler (4.6 feet, ZONE). Anthony Wade misses. Offensive rebound by Kobe Curry! Kobe Curry kicks it out.

[00:25] Team_079 possession (Score: 34-38)
FOUL! Shooting foul on Luka Butler. Kobe Curry to the line for 2 free throws. [Team fouls: 4] (Luka Butler: 1 personal fouls)   FT 1/2: GOOD   FT 2/2: GOOD Kobe Curry makes 2/2 from the line.
Score: 34-40

[00:09] Team_073 possession (Score: 34-40)
Shai Thompson attempts a 3Pt. Contested by Kobe Curry (5.5 feet, MAN). Shai Thompson misses. Rebound secured by James LaVine.

================================================================================
                              2ND QUARTER COMPLETE                              
================================================================================

2ND QUARTER SCORE: Team_073 22, Team_079 21

BOX SCORE:
================================================================================

Team_073
--------------------------------------------------------------------------------
Player                MIN  PTS  REB  AST  TO      FG   FG%      3P   3P%
--------------------------------------------------------------------------------
Carmelo Young          16    5    0    1   0   2/2   100.0     0/0   0.0
Ja Rose                 8    5    2    0   0   2/2   100.0     0/0   0.0
Karl Williamson        16    4    0    0   0   2/3    66.7     0/0   0.0
Bradley Morant         16    2    3    1   0   1/3    33.3     0/0   0.0
Shai Thompson           8    2    3    0   0   1/4    25.0     0/0   0.0
Dwyane McCollum         8    2    1    0   0   1/2    50.0     0/0   0.0
Luka Butler             8    2    0    0   0   1/2    50.0     0/0   0.0
Isaiah Smith           16    0    1    0   0   0/0     0.0     0/0   0.0
Carmelo Porzingis      16    0    1    0   0   0/0     0.0     0/0   0.0

TEAM: FG: 10/18 (55.6%), 3PT: 0/3 (0.0%), REB: 10 (3 off, 7 def), AST: 2, TO: 4
TEAM FOULS: 4


Team_079
--------------------------------------------------------------------------------
Player                MIN  PTS  REB  AST  TO      FG   FG%      3P   3P%
--------------------------------------------------------------------------------
Kobe Curry              8    6    3    0   0   3/5    60.0     0/0   0.0
Donovan Randle         16    5    3    1   0   2/4    50.0     0/0   0.0
Trae Durant            16    4    0    0   0   2/2   100.0     0/0   0.0
Bam Randle             16    2    0    1   0   1/1   100.0     0/0   0.0
Khris Embiid           16    2    0    0   0   1/1   100.0     0/0   0.0
Karl Ingram             8    2    0    1   0   1/3    33.3     0/0   0.0
Miles Ming             16    0    0    2   0   0/1     0.0     0/0   0.0
Anthony Wade            8    0    2    1   0   0/1     0.0     0/0   0.0
James LaVine            8    0    1    0   0   0/0     0.0     0/0   0.0

TEAM: FG: 10/18 (55.6%), 3PT: 0/3 (0.0%), REB: 10 (4 off, 6 def), AST: 6, TO: 3
TEAM FOULS: 4

================================================================================

================================================================================
                       3RD QUARTER - Team_073 vs Team_079                       
================================================================================

[12:00] Team_073 possession (Score: 34-40)
Carmelo Young drives to the basket... Carmelo Young commits a violation (traveling/carry)! TURNOVER! (dead ball)

[11:47] Team_079 possession (Score: 34-40)
Trae Durant drives, Bradley Morant stays with him. Trae Durant attempts a Layup. Contested by Bradley Morant (2.2 feet, ZONE). TRAE DURANT MAKES IT! Assist: Bam Randle
Score: 34-42

[11:36] Team_073 possession (Score: 34-42)
FOUL! Reach-in foul on Donovan Randle during the drive. [Team fouls: 1] No free throws, side out. (Donovan Randle: 1 personal fouls)

[11:23] Team_073 possession (Score: 34-42)
Isaiah Smith drives, Miles Ming stays with him. Isaiah Smith attempts a Layup. Heavily contested by Miles Ming (1.3 feet, MAN)! ISAIAH SMITH MAKES IT! Assist: Carmelo Porzingis
Score: 36-42

[11:13] Team_079 possession (Score: 36-42)
Khris Embiid attempts a Layup. Contested by Carmelo Young (5.6 feet, MAN). KHRIS EMBIID MAKES IT!
Score: 36-44

[10:59] Team_073 possession (Score: 36-44)
Karl Williamson attempts a 3Pt. Contested by Miles Ming (4.7 feet, ZONE). Karl Williamson misses. Offensive rebound by Carmelo Porzingis! Carmelo Porzingis kicks it out.

[10:44] Team_073 possession (Score: 36-44)
Carmelo Porzingis attempts a Layup. Contested by Trae Durant (4.6 feet, MAN). CARMELO PORZINGIS MAKES IT!
Score: 38-44

[10:25] Team_079 possession (Score: 38-44)
Bam Randle drives and kicks out. Khris Embiid attempts a Midrange. Contested by Carmelo Young (5.1 feet, MAN). Khris Embiid misses. Rebound secured by Bradley Morant.

[10:10] Team_073 possession (Score: 38-44)
Isaiah Smith attempts a Midrange. Wide open! Miles Ming is 6.4 feet away. [MAN] ISAIAH SMITH MAKES IT!
Score: 40-44

[09:57] Team_079 possession (Score: 40-44)
Donovan Randle makes the Layup and draws the foul on Bradley Morant! And-1! Donovan Randle to the line for 1. [Team fouls: 1] (Bradley Morant: 1 personal fouls)   FT 1/1: GOOD Donovan Randle makes 1/1 from the line.
Score: 40-47

[09:43] Team_073 possession (Score: 40-47)
Bradley Morant attempts a 3Pt. Heavily contested by Donovan Randle (1.9 feet, MAN)! Bradley Morant misses. Rebound secured by Trae Durant.

[09:32] Team_079 possession (Score: 40-47)
Bam Randle drives and kicks out. Donovan Randle attempts a 3Pt. Contested by Karl Williamson (3.9 feet, ZONE). Donovan Randle misses. Offensive rebound by Donovan Randle! Donovan Randle kicks it out.

[09:20] Team_079 possession (Score: 40-47)
Donovan Randle attempts a Layup. Contested by Bradley Morant (3.2 feet, ZONE). Donovan Randle misses. Rebound secured by Carmelo Porzingis.

[09:07] Team_073 possession (Score: 40-47)
Bradley Morant attempts a Layup. Heavily contested by Donovan Randle (1.7 feet, MAN)! BRADLEY MORANT MAKES IT!
Score: 42-47

[08:53] Team_079 possession (Score: 42-47)
Bam Randle attempts a Midrange. Heavily contested by Karl Williamson (1.3 feet, MAN)! Bam Randle misses. Rebound secured by Isaiah Smith.

[08:36] Team_073 possession (Score: 42-47)
Carmelo Porzingis drives, Trae Durant stays with him. Carmelo Porzingis attempts a Layup. Wide open! Trae Durant is 6.5 feet away. [MAN] CARMELO PORZINGIS MAKES IT!
Score: 44-47

[08:21] Team_079 possession (Score: 44-47)
Miles Ming attempts a 3Pt. Contested by Isaiah Smith (3.0 feet, MAN). Miles Ming misses. Rebound secured by Carmelo Porzingis.

[08:08] Team_073 possession (Score: 44-47)
Bradley Morant attempts a Midrange. Contested by Donovan Randle (5.0 feet, MAN). BRADLEY MORANT MAKES IT!
Score: 46-47

[07:51] Team_079 possession (Score: 46-47)
Bam Randle attempts a 3Pt. Heavily contested by Karl Williamson (0.5 feet, MAN)! BAM RANDLE MAKES IT! Assist: Khris Embiid
Score: 46-50

[07:39] Team_073 possession (Score: 46-50)
FOUL! Holding foul on Donovan Randle. [Team fouls: 2] No free throws, side out. (Donovan Randle: 2 personal fouls)

[07:23] Team_073 possession (Score: 46-50)
Bradley Morant drives and kicks out. Bradley Morant attempts a 3Pt. Contested by Donovan Randle (2.6 feet, MAN). Bradley Morant misses. Rebound secured by Trae Durant.

[07:09] Team_079 possession (Score: 46-50)
Khris Embiid attempts a Layup. BLOCKED BY ISAIAH SMITH! Ball is loose! Rebound secured by Isaiah Smith.

[06:52] Team_073 possession (Score: 46-50)
Carmelo Young attempts a 3Pt. Heavily contested by Trae Durant (0.5 feet, ZONE)! CARMELO YOUNG MAKES IT! Assist: Karl Williamson
Score: 49-50

[06:35] Team_079 possession (Score: 49-50)
FOUL! Holding foul on Carmelo Porzingis. [Team fouls: 2] No free throws, side out. (Carmelo Porzingis: 1 personal fouls)

[06:19] Team_079 possession (Score: 49-50)
Trae Durant attempts a Layup. Wide open! Bradley Morant is 8.0 feet away. [ZONE] Trae Durant misses. Offensive rebound by Trae Durant! Trae Durant puts it back in!
Score: 49-52

[06:05] Team_073 possession (Score: 49-52)
Bradley Morant drives, Trae Durant stays with him. Bradley Morant attempts a Dunk. Contested by Trae Durant (2.9 feet, ZONE). BRADLEY MORANT MAKES IT! Assist: Karl Williamson
Score: 51-52

[05:53] Team_079 possession (Score: 51-52)
Bam Randle attempts a Midrange. Contested by Isaiah Smith (4.9 feet, ZONE). Bam Randle misses. Rebound secured by Carmelo Porzingis.

[05:38] Team_073 possession (Score: 51-52)
Carmelo Porzingis attempts a Layup. Heavily contested by Trae Durant (1.7 feet, MAN)! Carmelo Porzingis misses. Rebound secured by Donovan Randle.

[05:24] Team_079 possession (Score: 51-52)
FOUL! Reach-in foul on Carmelo Young during the drive. [Team fouls: 3] No free throws, side out. (Carmelo Young: 1 personal fouls)

[05:10] Team_079 possession (Score: 51-52)
Donovan Randle loses the ball! Stripped by Bradley Morant! TURNOVER! (live ball)

[04:57] Team_073 possession (Score: 51-52)
Carmelo Young attempts a Midrange. Contested by Trae Durant (3.4 feet, ZONE). CARMELO YOUNG MAKES IT! Assist: Karl Williamson
Score: 53-52

[04:43] Team_079 possession (Score: 53-52)
Trae Durant attempts a Layup. Contested by Carmelo Porzingis (3.9 feet, MAN). TRAE DURANT MAKES IT! Assist: Donovan Randle
Score: 53-54

[04:26] Team_073 possession (Score: 53-54)
Carmelo Porzingis attempts a 3Pt. Contested by Trae Durant (4.8 feet, ZONE). CARMELO PORZINGIS MAKES IT! Assist: Karl Williamson
Score: 56-54

[04:11] Team_079 possession (Score: 56-54)
Donovan Randle drives to the basket... Donovan Randle loses the ball! Stripped by Bradley Morant! TURNOVER! (live ball)

[03:57] Team_073 possession (Score: 56-54)
Bradley Morant attempts a Layup. Heavily contested by Trae Durant (0.5 feet, ZONE)! BRADLEY MORANT MAKES IT!
Score: 58-54

[03:39] Team_079 possession (Score: 58-54)
Khris Embiid attempts a Layup. BLOCKED BY CARMELO YOUNG! Ball is loose! Rebound secured by Bradley Morant.

[03:25] Team_073 possession (Score: 58-54)
Isaiah Smith attempts a Layup. Contested by Miles Ming (3.5 feet, MAN). ISAIAH SMITH MAKES IT! Assist: Bradley Morant
Score: 60-54

[03:07] Team_079 possession (Score: 60-54)
Miles Ming attempts a Midrange. Contested by Isaiah Smith (4.7 feet, MAN). MILES MING MAKES IT!
Score: 60-56

[02:51] Team_073 possession (Score: 60-56)
Carmelo Young attempts a 3Pt. Contested by Trae Durant (5.6 feet, ZONE). Carmelo Young misses. Rebound secured by Trae Durant.

[02:37] Team_079 possession (Score: 60-56)
Khris Embiid attempts a Midrange. Contested by Carmelo Young (5.1 feet, MAN). Khris Embiid misses. Offensive rebound by Trae Durant! Trae Durant puts it back in!
Score: 60-58

[02:22] Team_073 possession (Score: 60-58)
Carmelo Porzingis attempts a 3Pt. Contested by Trae Durant (2.1 feet, MAN). Carmelo Porzingis misses. Rebound secured by Bam Randle.

[02:06] Team_079 possession (Score: 60-58)
Donovan Randle drives, Bradley Morant stays with him. Donovan Randle attempts a Dunk. Contested by Bradley Morant (4.9 feet, ZONE). DONOVAN RANDLE MAKES IT! Assist: Khris Embiid
Score: 60-60

[01:53] Team_073 possession (Score: 60-60)
Carmelo Young attempts a Midrange. Wide open! Khris Embiid is 8.1 feet away. [MAN] Carmelo Young misses. Rebound secured by Bam Randle.

[01:42] Team_079 possession (Score: 60-60)
FOUL! Shooting foul on Carmelo Porzingis. Trae Durant to the line for 2 free throws. [Team fouls: 4] (Carmelo Porzingis: 2 personal fouls)   FT 1/2: GOOD   FT 2/2: GOOD Trae Durant makes 2/2 from the line.
Score: 60-62

[01:30] Team_073 possession (Score: 60-62)
Bradley Morant drives and kicks out. Bradley Morant attempts a 3Pt. Wide open! Donovan Randle is 6.6 feet away. [MAN] Bradley Morant misses. Rebound secured by Bam Randle.

[01:15] Team_079 possession (Score: 60-62)
Miles Ming attempts a Layup. BLOCKED BY BRADLEY MORANT! Ball is loose! Offensive rebound by Trae Durant! Trae Durant kicks it out.

[01:00] Team_079 possession (Score: 60-62)
Miles Ming attempts a Layup. BLOCKED BY CARMELO PORZINGIS! Ball deflects out of bounds off Miles Ming.

[00:46] Team_073 possession (Score: 60-62)
Carmelo Porzingis attempts a Midrange. Contested by Trae Durant (3.3 feet, ZONE). CARMELO PORZINGIS MAKES IT!
Score: 62-62

[00:34] Team_079 possession (Score: 62-62)
Bam Randle attempts a Layup. Contested by Bradley Morant (5.8 feet, ZONE). BAM RANDLE MAKES IT! Assist: Miles Ming
Score: 62-64

[00:22] Team_073 possession (Score: 62-64)
Karl Williamson attempts a 3Pt. Contested by Bam Randle (5.9 feet, MAN). Karl Williamson misses. Rebound secured by Bam Randle.

[00:05] Team_079 possession (Score: 62-64)
Trae Durant throws a bad pass! Stolen by Carmelo Porzingis! TURNOVER! (live ball)

================================================================================
                              3RD QUARTER COMPLETE                              
================================================================================

3RD QUARTER SCORE: Team_073 28, Team_079 24

BOX SCORE:
================================================================================

Team_073
--------------------------------------------------------------------------------
Player                MIN  PTS  REB  AST  TO      FG   FG%      3P   3P%
--------------------------------------------------------------------------------
Carmelo Porzingis      28    9    4    1   0   4/6    66.7     0/0   0.0
Bradley Morant         28    8    2    1   0   4/7    57.1     0/0   0.0
Isaiah Smith           28    6    2    0   0   3/3   100.0     0/0   0.0
Carmelo Young          28    5    0    0   0   2/4    50.0     0/0   0.0
Karl Williamson        28    0    0    4   0   0/1     0.0     0/0   0.0

TEAM: FG: 13/21 (61.9%), 3PT: 2/6 (33.3%), REB: 8 (1 off, 7 def), AST: 6, TO: 1
TEAM FOULS: 4


Team_079
--------------------------------------------------------------------------------
Player                MIN  PTS  REB  AST  TO      FG   FG%      3P   3P%
--------------------------------------------------------------------------------
Trae Durant            28   10    6    0   0   5/5   100.0     0/0   0.0
Bam Randle             28    5    4    1   0   2/5    40.0     0/0   0.0
Donovan Randle         28    5    2    1   0   2/3    66.7     0/0   0.0
Khris Embiid           28    2    0    2   0   1/3    33.3     0/0   0.0
Miles Ming             28    2    0    1   0   1/3    33.3     0/0   0.0

TEAM: FG: 11/19 (57.9%), 3PT: 1/2 (50.0%), REB: 12 (4 off, 8 def), AST: 5, TO: 3
TEAM FOULS: 2

================================================================================

================================================================================
                       4TH QUARTER - Team_073 vs Team_079                       
================================================================================

[12:00] Team_073 possession (Score: 62-64)
Bradley Morant attempts a Layup. Contested by Donovan Randle (5.1 feet, MAN). BRADLEY MORANT MAKES IT! Assist: Carmelo Porzingis
Score: 64-64

[11:46] Team_079 possession (Score: 64-64)
Khris Embiid drives and kicks out. FOUL! Shooting foul on Karl Williamson. Bam Randle to the line for 2 free throws. [Team fouls: 1] (Karl Williamson: 1 personal fouls)   FT 1/2: GOOD   FT 2/2: MISS Bam Randle makes 1/2 from the line. Rebound secured by Isaiah Smith.
Score: 64-65

[11:32] Team_073 possession (Score: 64-65)
Karl Williamson drives to the basket... Karl Williamson loses the ball! Stripped by Bam Randle! TURNOVER! (live ball)

[11:20] Team_079 possession (Score: 64-65)
Trae Durant attempts a 3Pt. Contested by Karl Williamson (5.5 feet, ZONE). TRAE DURANT MAKES IT! Assist: Khris Embiid
Score: 64-68

[11:04] Team_073 possession (Score: 64-68)
Bradley Morant attempts a Layup. Contested by Trae Durant (3.6 feet, ZONE). BRADLEY MORANT MAKES IT! Assist: Isaiah Smith
Score: 66-68

[10:55] Team_079 possession (Score: 66-68)
Donovan Randle drives and kicks out. Bam Randle attempts a Midrange. Wide open! Karl Williamson is 7.5 feet away. [MAN] Bam Randle misses. Offensive rebound by Trae Durant! Trae Durant kicks it out.

[10:43] Team_079 possession (Score: 66-68)
Donovan Randle throws a bad pass! Stolen by Bradley Morant! TURNOVER! (live ball)

[10:28] Team_073 possession (Score: 66-68)
Karl Williamson throws a bad pass out of bounds! TURNOVER! (dead ball)

[10:28] Substitution (Team_073): Carmelo Young OUT → Zach Quickley IN (stamina_rule2)

[10:28] Substitution (Team_073): Isaiah Smith OUT → Luka Butler IN (stamina_rule2)

[10:28] Substitution (Team_073): Karl Williamson OUT → Dwyane McCollum IN (stamina_rule2)

[10:28] Substitution (Team_073): Carmelo Porzingis OUT → Shai Thompson IN (stamina_rule2)

[10:28] Substitution (Team_073): Bradley Morant OUT → Ja Rose IN (stamina_rule2)

[10:28] Substitution (Team_079): Khris Embiid OUT → Evan Mobley IN (stamina_rule2)

[10:28] Substitution (Team_079): Miles Ming OUT → Karl Ingram IN (stamina_rule2)

[10:28] Substitution (Team_079): Bam Randle OUT → Anthony Wade IN (stamina_rule2)

[10:28] Substitution (Team_079): Trae Durant OUT → Kobe Curry IN (stamina_rule2)

[10:28] Substitution (Team_079): Donovan Randle OUT → James LaVine IN (stamina_rule2)

[10:13] Team_079 possession (Score: 66-68)
Anthony Wade drives, picks up Dwyane McCollum. Help arrives from Luka Butler! Anthony Wade attempts a Layup. Contested by Luka Butler (4.6 feet, MAN). ANTHONY WADE MAKES IT! Assist: James LaVine
Score: 66-70

[09:57] Team_073 possession (Score: 66-70)
Ja Rose drives, picks up James LaVine. Help arrives from Karl Ingram! Ja Rose attempts a Dunk. Contested by Karl Ingram (5.3 feet, MAN). JA ROSE MAKES IT!
Score: 68-70

[09:41] Team_079 possession (Score: 68-70)
James LaVine attempts a Layup. Contested by Ja Rose (3.5 feet, MAN). JAMES LAVINE MAKES IT!
Score: 68-72

[09:25] Team_073 possession (Score: 68-72)
Luka Butler attempts a 3Pt. Contested by Evan Mobley (4.6 feet, ZONE). LUKA BUTLER MAKES IT! Assist: Ja Rose
Score: 71-72

[09:06] Team_079 possession (Score: 71-72)
James LaVine attempts a Midrange. Wide open! Ja Rose is 9.6 feet away. [MAN] James LaVine misses. Rebound secured by Dwyane McCollum.

[08:53] Team_073 possession (Score: 71-72)
FOUL! Holding foul on James LaVine. [Team fouls: 1] No free throws, side out. (James LaVine: 1 personal fouls)

[08:40] Team_073 possession (Score: 71-72)
Dwyane McCollum attempts a 3Pt. Contested by Anthony Wade (5.3 feet, MAN). Dwyane McCollum misses. Rebound secured by James LaVine.

[08:28] Team_079 possession (Score: 71-72)
Evan Mobley attempts a 3Pt. Contested by Luka Butler (4.1 feet, ZONE). EVAN MOBLEY MAKES IT! Assist: Karl Ingram
Score: 71-75

[08:12] Team_073 possession (Score: 71-75)
FOUL! Reach-in foul on James LaVine during the drive. [Team fouls: 2] No free throws, side out. (James LaVine: 2 personal fouls)

[07:56] Team_073 possession (Score: 71-75)
Shai Thompson drives, picks up James LaVine. Help arrives from Karl Ingram! Shai Thompson attempts a Layup. Wide open! Karl Ingram is 6.3 feet away. [ZONE] SHAI THOMPSON MAKES IT!
Score: 73-75

[07:44] Team_079 possession (Score: 73-75)
Anthony Wade attempts a Midrange. Contested by Dwyane McCollum (4.9 feet, MAN). ANTHONY WADE MAKES IT! Assist: Evan Mobley
Score: 73-77

[07:28] Team_073 possession (Score: 73-77)
Luka Butler attempts a 3Pt. Wide open! Evan Mobley is 7.4 feet away. [ZONE] LUKA BUTLER MAKES IT! Assist: Dwyane McCollum
Score: 76-77

[07:15] Team_079 possession (Score: 76-77)
Kobe Curry attempts a 3Pt. Heavily contested by Shai Thompson (0.5 feet, MAN)! Kobe Curry misses. Rebound secured by Ja Rose.

[07:03] Team_073 possession (Score: 76-77)
Dwyane McCollum drives to the basket... Dwyane McCollum commits a violation (traveling/carry)! TURNOVER! (dead ball)

[06:45] Team_079 possession (Score: 76-77)
Karl Ingram attempts a 3Pt. Contested by Luka Butler (2.5 feet, ZONE). Karl Ingram misses. Rebound secured by Shai Thompson.

[06:30] Team_073 possession (Score: 76-77)
Shai Thompson attempts a 3Pt. Contested by Evan Mobley (4.0 feet, ZONE). Shai Thompson misses. Rebound secured by James LaVine.

[06:16] Team_079 possession (Score: 76-77)
Anthony Wade attempts a Layup. Contested by Dwyane McCollum (5.5 feet, MAN). Anthony Wade misses. Rebound secured by Ja Rose.

[06:04] Team_073 possession (Score: 76-77)
Luka Butler drives, Karl Ingram stays with him. Luka Butler attempts a Layup. Contested by Karl Ingram (5.3 feet, MAN). LUKA BUTLER MAKES IT! Assist: Dwyane McCollum
Score: 78-77

[05:47] Team_079 possession (Score: 78-77)
Anthony Wade attempts a 3Pt. Contested by Dwyane McCollum (3.7 feet, MAN). ANTHONY WADE MAKES IT!
Score: 78-80

[05:32] Team_073 possession (Score: 78-80)
Shai Thompson attempts a Midrange. Wide open! Kobe Curry is 9.5 feet away. [ZONE] Shai Thompson misses. Rebound secured by James LaVine.

[05:21] Team_079 possession (Score: 78-80)
Kobe Curry attempts a Midrange. Contested by Shai Thompson (4.9 feet, MAN). KOBE CURRY MAKES IT! Assist: James LaVine
Score: 78-82

[05:05] Team_073 possession (Score: 78-82)
Dwyane McCollum attempts a 3Pt. Contested by Anthony Wade (5.4 feet, MAN). Dwyane McCollum misses. Rebound secured by James LaVine.

[04:51] Team_079 possession (Score: 78-82)
Kobe Curry attempts a 3Pt. Heavily contested by Luka Butler (0.5 feet, ZONE)! Kobe Curry misses. Rebound secured by Ja Rose.

[04:39] Team_073 possession (Score: 78-82)
Luka Butler drives to the basket... FOUL! Offensive foul on Luka Butler! James LaVine drew the charge! [Team fouls: 2] (Luka Butler: 1 personal fouls) TURNOVER! (dead ball)

[04:24] Team_079 possession (Score: 78-82)
Evan Mobley attempts a 3Pt. Contested by Zach Quickley (2.7 feet, MAN). EVAN MOBLEY MAKES IT! Assist: Kobe Curry
Score: 78-85

[04:10] Team_073 possession (Score: 78-85)
Dwyane McCollum attempts a 3Pt. Wide open! Anthony Wade is 8.4 feet away. [MAN] Dwyane McCollum misses. Rebound secured by Anthony Wade.

[03:58] Team_079 possession (Score: 78-85)
Evan Mobley attempts a Midrange. Wide open! Zach Quickley is 8.1 feet away. [MAN] EVAN MOBLEY MAKES IT!
Score: 78-87

[03:43] Team_073 possession (Score: 78-87)
Luka Butler attempts a Midrange. Wide open! Karl Ingram is 9.3 feet away. [MAN] LUKA BUTLER MAKES IT!
Score: 80-87

[03:31] Team_079 possession (Score: 80-87)
Kobe Curry drives and kicks out. Karl Ingram attempts a 3Pt. Contested by Luka Butler (4.0 feet, ZONE). Karl Ingram misses. Rebound secured by Ja Rose.

[03:17] Team_073 possession (Score: 80-87)
Luka Butler attempts a 3Pt. Wide open! Karl Ingram is 6.6 feet away. [MAN] LUKA BUTLER MAKES IT! Assist: Shai Thompson
Score: 83-87

[03:01] Team_079 possession (Score: 83-87)
Anthony Wade attempts a 3Pt. Contested by Luka Butler (5.9 feet, ZONE). Anthony Wade misses. Rebound secured by Shai Thompson.

[02:48] Team_073 possession (Score: 83-87)
Shai Thompson attempts a 3Pt. Contested by Kobe Curry (5.5 feet, MAN). SHAI THOMPSON MAKES IT! Assist: Luka Butler
Score: 86-87

[02:34] Team_079 possession (Score: 86-87)
James LaVine attempts a Layup. Wide open! Ja Rose is 8.0 feet away. [MAN] JAMES LAVINE MAKES IT!
Score: 86-89

[02:18] Team_073 possession (Score: 86-89)
Ja Rose drives to the basket... Ja Rose loses the ball! Stripped by Kobe Curry! TURNOVER! (live ball)

[02:03] Team_079 possession (Score: 86-89)
Karl Ingram loses the ball! Stripped by Luka Butler! TURNOVER! (live ball)

[01:48] Team_073 possession (Score: 86-89)
FOUL! Holding foul on Evan Mobley. [Team fouls: 3] No free throws, side out. (Evan Mobley: 1 personal fouls)

[01:36] Team_073 possession (Score: 86-89)
FOUL! Shooting foul on Kobe Curry. Shai Thompson to the line for 2 free throws. [Team fouls: 4] (Kobe Curry: 1 personal fouls)   FT 1/2: MISS   FT 2/2: MISS Shai Thompson makes 0/2 from the line. Rebound secured by Anthony Wade.

[01:19] Team_079 possession (Score: 86-89)
James LaVine attempts a Layup. Wide open! Ja Rose is 6.8 feet away. [MAN] JAMES LAVINE MAKES IT! Assist: Kobe Curry
Score: 86-91

[01:01] Team_073 possession (Score: 86-91)
Zach Quickley drives, Evan Mobley stays with him. Zach Quickley attempts a Layup. Wide open! Evan Mobley is 7.1 feet away. [MAN] ZACH QUICKLEY MAKES IT!
Score: 88-91

[00:48] Team_079 possession (Score: 88-91)
Karl Ingram attempts a Midrange. Heavily contested by Luka Butler (1.0 feet, MAN)! Karl Ingram misses. Rebound secured by Shai Thompson.

[00:31] Team_073 possession (Score: 88-91)
Zach Quickley drives, picks up James LaVine. Help arrives from Karl Ingram! Zach Quickley attempts a Dunk. Contested by Karl Ingram (4.4 feet, ZONE). Zach Quickley misses. Rebound secured by Kobe Curry.

[00:12] Team_079 possession (Score: 88-91)
Kobe Curry attempts a Midrange. Wide open! Ja Rose is 6.2 feet away. [ZONE] KOBE CURRY MAKES IT! Assist: James LaVine
Score: 88-93

================================================================================
                              4TH QUARTER COMPLETE                              
================================================================================

4TH QUARTER SCORE: Team_073 26, Team_079 29

BOX SCORE:
================================================================================

Team_073
--------------------------------------------------------------------------------
Player                MIN  PTS  REB  AST  TO      FG   FG%      3P   3P%
--------------------------------------------------------------------------------
Luka Butler            18   13    0    1   0   5/5   100.0     0/0   0.0
Shai Thompson          18    5    3    1   0   2/5    40.0     0/0   0.0
Bradley Morant         30    4    0    0   0   2/2   100.0     0/0   0.0
Ja Rose                18    2    4    1   0   1/1   100.0     0/0   0.0
Zach Quickley          18    2    0    0   0   1/2    50.0     0/0   0.0
Carmelo Porzingis      30    0    0    1   0   0/0     0.0     0/0   0.0
Isaiah Smith           30    0    1    1   0   0/0     0.0     0/0   0.0
Dwyane McCollum        18    0    1    2   0   0/3     0.0     0/0   0.0

TEAM: FG: 11/18 (61.1%), 3PT: 4/8 (50.0%), REB: 9 (0 off, 9 def), AST: 7, TO: 5
TEAM FOULS: 2


Team_079
--------------------------------------------------------------------------------
Player                MIN  PTS  REB  AST  TO      FG   FG%      3P   3P%
--------------------------------------------------------------------------------
Evan Mobley            18    8    0    1   0   3/3   100.0     0/0   0.0
Anthony Wade           18    7    2    0   0   3/5    60.0     0/0   0.0
James LaVine           18    6    4    3   0   3/4    75.0     0/0   0.0
Kobe Curry             18    4    1    2   0   2/5    40.0     0/0   0.0
Trae Durant            30    3    1    0   0   1/1   100.0     0/0   0.0
Khris Embiid           30    0    0    1   0   0/1     0.0     0/0   0.0
Karl Ingram            18    0    0    1   0   0/2     0.0     0/0   0.0

TEAM: FG: 12/21 (57.1%), 3PT: 4/8 (50.0%), REB: 8 (1 off, 7 def), AST: 8, TO: 2
TEAM FOULS: 4

================================================================================

================================================================================
                               FULL GAME COMPLETE                               
================================================================================

FINAL SCORE: Team_073 88, Team_079 93

SCORING BY QUARTER:
--------------------------------------------------------------------------------
Team                     Q1     Q2     Q3     Q4    FINAL
--------------------------------------------------------------------------------
Team_073                 12     22     28     26       88
Team_079                 19     21     24     29       93
--------------------------------------------------------------------------------

FULL GAME BOX SCORE:
================================================================================

Team_073
--------------------------------------------------------------------------------
Player                MIN  PTS  REB  AST  TO      FG   FG%      3P   3P%      FT STL BLK
--------------------------------------------------------------------------------
Carmelo Young          30   10    0    1   0   4/8    50.0   1/3    33.3   1/1     0   1
Isaiah Smith           30    6    6    1   3   3/4    75.0   0/0     0.0   0/0     1   1
Karl Williamson        30    8    0    4   3   4/9    44.4   0/3     0.0   2/2     0   1
Carmelo Porzingis      30   11   12    2   2   5/7    71.4   1/2    50.0   0/0     1   2
Bradley Morant         30   19    9    2   0   9/16   56.2   0/1     0.0   1/1     3   2
Zach Quickley          18    2    0    0   2   1/2    50.0   0/0     0.0   0/0     0   0
Luka Butler            18   15    0    1   0   6/8    75.0   3/4    75.0   0/0     2   0
Dwyane McCollum        18    3    2    2   2   0/5     0.0   0/4     0.0   1/2     0   0
Shai Thompson          18    7    6    1   1   4/10   40.0   1/3    33.3   0/2     1   0
Ja Rose                18    7    7    1   0   3/4    75.0   0/0     0.0   1/1     0   0

TEAM: FG: 40/74 (54.1%), 3PT: 6/20 (30.0%), REB: 41 (10 off, 31 def), AST: 15, TO: 13


Team_079
--------------------------------------------------------------------------------
Player                MIN  PTS  REB  AST  TO      FG   FG%      3P   3P%      FT STL BLK
--------------------------------------------------------------------------------
Khris Embiid           30    7    0    4   0   4/8    50.0   1/1   100.0   0/0     0   0
Miles Ming             30    2    0    5   2   1/6    16.7   0/4     0.0   0/0     1   0
Bam Randle             30    9    9    3   0   4/9    44.4   1/2    50.0   3/4     1   0
Trae Durant            30   26   10    0   1  10/11   90.9   1/1   100.0   3/3     1   1
Donovan Randle         30   12    8    3   2   5/9    55.6   0/0     0.0   2/2     0   1
Evan Mobley            18    8    0    1   0   3/3   100.0   2/2   100.0   0/0     0   0
Karl Ingram            18    2    0    3   3   1/5    20.0   0/2     0.0   0/0     0   0
Anthony Wade           18   10    4    1   2   4/7    57.1   2/3    66.7   0/0     0   0
Kobe Curry             18   10    5    2   1   5/11   45.5   0/3     0.0   2/2     1   0
James LaVine           18    6    7    3   0   3/4    75.0   0/0     0.0   0/0     0   0

TEAM: FG: 41/74 (55.4%), 3PT: 7/18 (38.9%), REB: 44 (12 off, 32 def), AST: 25, TO: 11

================================================================================
