================================================================================
                        FULL GAME - Team_041 vs Team_044                        
================================================================================

================================================================================
                       1ST QUARTER - Team_041 vs Team_044                       
================================================================================

[12:00] Team_041 possession (Score: 0-0)
Scottie Turner drives, Zach McGrady stays with him. Scottie Turner attempts a Layup. Heavily contested by Zach McGrady (1.2 feet, MAN)! SCOTTIE TURNER MAKES IT! Assist: Jarrett Anunoby
Score: 2-0

[11:45] Team_044 possession (Score: 2-0)
Ayo McCollum attempts a 3Pt. Contested by Scottie Turner (3.0 feet, ZONE). Ayo McCollum misses. Rebound secured by Terry Barrett.

[11:28] Team_041 possession (Score: 2-0)
FOUL! Shooting foul on Isaiah Murray. Scottie Turner to the line for 3 free throws. [Team fouls: 1] (Isaiah Murray: 1 personal fouls)   FT 1/3: MISS   FT 2/3: GOOD   FT 3/3: GOOD Scottie Turner makes 2/3 from the line.
Score: 4-0

[11:16] Team_044 possession (Score: 4-0)
Karl Fox attempts a 3Pt. Contested by Scottie Turner (4.7 feet, ZONE). Karl Fox misses. Offensive rebound by Ayo McCollum! Ayo McCollum's putback is no good. Rebound secured by Terry Barrett.

[11:05] Team_041 possession (Score: 4-0)
Dejounte Griffin drives to the basket... Dejounte Griffin throws a bad pass! Stolen by Ayo McCollum! TURNOVER! (live ball)

[10:50] Team_044 possession (Score: 4-0)
Karl Fox attempts a Midrange. Wide open! Stephen Ingram is 6.1 feet away. [MAN] KARL FOX MAKES IT! Assist: Zach McGrady
Score: 4-2

[10:33] Team_041 possession (Score: 4-2)
Terry Barrett attempts a Layup. Contested by Ayo McCollum (5.9 feet, ZONE). TERRY BARRETT MAKES IT! Assist: Scottie Turner
Score: 6-2

[10:19] Team_044 possession (Score: 6-2)
Victor Westbrook attempts a Layup. Contested by Dejounte Griffin (2.5 feet, MAN). VICTOR WESTBROOK MAKES IT! Assist: Karl Fox
Score: 6-4

[10:05] Team_041 possession (Score: 6-4)
Terry Barrett attempts a Dunk. BLOCKED BY AYO MCCOLLUM! Ball is loose! Rebound secured by Karl Fox.

[09:50] Team_044 possession (Score: 6-4)
Victor Westbrook throws a bad pass! Stolen by Dejounte Griffin! TURNOVER! (live ball)

[09:33] Team_041 possession (Score: 6-4)
Stephen Ingram attempts a Midrange. Contested by Karl Fox (4.9 feet, MAN). Stephen Ingram misses. Rebound secured by Ayo McCollum.

[09:18] Team_044 possession (Score: 6-4)
Ayo McCollum attempts a Midrange. Contested by Terry Barrett (3.9 feet, MAN). AYO MCCOLLUM MAKES IT!
Score: 6-6

[09:01] Team_041 possession (Score: 6-6)
Dejounte Griffin attempts a Midrange. Contested by Karl Fox (4.3 feet, ZONE). DEJOUNTE GRIFFIN MAKES IT! Assist: Stephen Ingram
Score: 8-6

[08:43] Team_044 possession (Score: 8-6)
Isaiah Murray throws a bad pass! Stolen by Jarrett Anunoby! TURNOVER! (live ball)

[08:30] Team_041 possession (Score: 8-6)
Jarrett Anunoby drives, picks up Isaiah Murray. Help arrives from Victor Westbrook! Jarrett Anunoby attempts a Dunk. Contested by Victor Westbrook (5.1 feet, MAN). JARRETT ANUNOBY MAKES IT! Assist: Scottie Turner
Score: 10-6

[08:18] Team_044 possession (Score: 10-6)
Victor Westbrook attempts a Layup. Wide open! Terry Barrett is 7.2 feet away. [ZONE] VICTOR WESTBROOK MAKES IT! Assist: Ayo McCollum
Score: 10-8

[07:59] Team_041 possession (Score: 10-8)
Scottie Turner attempts a 3Pt. Contested by Zach McGrady (2.2 feet, MAN). Scottie Turner misses. Rebound secured by Karl Fox.

[07:46] Team_044 possession (Score: 10-8)
Ayo McCollum attempts a Midrange. Contested by Terry Barrett (4.2 feet, MAN). Ayo McCollum misses. Rebound secured by Dejounte Griffin.

[07:31] Team_041 possession (Score: 10-8)
Dejounte Griffin throws a bad pass! Stolen by Victor Westbrook! TURNOVER! (live ball)

[07:17] Team_044 possession (Score: 10-8)
Isaiah Murray attempts a 3Pt. Contested by Jarrett Anunoby (5.2 feet, MAN). Isaiah Murray misses. Rebound secured by Terry Barrett.

[06:59] Team_041 possession (Score: 10-8)
Scottie Turner attempts a Midrange. Contested by Isaiah Murray (5.2 feet, ZONE). Scottie Turner misses. Rebound secured by Ayo McCollum.

[06:46] Team_044 possession (Score: 10-8)
Zach McGrady attempts a 3Pt. Contested by Scottie Turner (4.9 feet, MAN). ZACH MCGRADY MAKES IT! Assist: Karl Fox
Score: 10-11

[06:34] Team_041 possession (Score: 10-11)
FOUL! Shooting foul on Isaiah Murray. Terry Barrett to the line for 2 free throws. [Team fouls: 2] (Isaiah Murray: 2 personal fouls)   FT 1/2: MISS   FT 2/2: GOOD Terry Barrett makes 1/2 from the line.
Score: 11-11

[06:20] Team_044 possession (Score: 11-11)
FOUL! Reach-in foul on Terry Barrett during the drive. [Team fouls: 1] No free throws, side out. (Terry Barrett: 1 personal fouls)

[06:09] Team_044 possession (Score: 11-11)
Zach McGrady attempts a 3Pt. Contested by Scottie Turner (4.7 feet, MAN). ZACH MCGRADY MAKES IT! Assist: Isaiah Murray
Score: 11-14

[05:57] Team_041 possession (Score: 11-14)
Jarrett Anunoby attempts a Layup. Heavily contested by Ayo McCollum (1.7 feet, ZONE)! JARRETT ANUNOBY MAKES IT! Assist: Stephen Ingram
Score: 13-14

[05:39] Team_044 possession (Score: 13-14)
Victor Westbrook throws a bad pass out of bounds! TURNOVER! (dead ball)

[05:25] Team_041 possession (Score: 13-14)
Dejounte Griffin attempts a Midrange. Contested by Karl Fox (5.1 feet, ZONE). DEJOUNTE GRIFFIN MAKES IT!
Score: 15-14

[05:15] Team_044 possession (Score: 15-14)
Zach McGrady attempts a 3Pt. Contested by Scottie Turner (4.3 feet, MAN). Zach McGrady misses. Offensive rebound by Victor Westbrook! Victor Westbrook kicks it out.

[05:03] Team_044 possession (Score: 15-14)
Isaiah Murray attempts a 3Pt. Wide open! Jarrett Anunoby is 6.4 feet away. [MAN] ISAIAH MURRAY MAKES IT!
Score: 15-17

[04:45] Team_041 possession (Score: 15-17)
Dejounte Griffin attempts a 3Pt. Wide open! Victor Westbrook is 6.4 feet away. [MAN] DEJOUNTE GRIFFIN MAKES IT! Assist: Jarrett Anunoby
Score: 18-17

[04:32] Team_044 possession (Score: 18-17)
Isaiah Murray attempts a Midrange. Contested by Jarrett Anunoby (3.9 feet, MAN). Isaiah Murray misses. Rebound secured by Stephen Ingram.

[04:14] Team_041 possession (Score: 18-17)
Jarrett Anunoby attempts a 3Pt. Heavily contested by Isaiah Murray (0.7 feet, ZONE)! JARRETT ANUNOBY MAKES IT! Assist: Scottie Turner
Score: 21-17

[04:02] Team_044 possession (Score: 21-17)
Isaiah Murray drives to the basket... FOUL! Offensive foul on Isaiah Murray! Terry Barrett drew the charge! [Team fouls: 3] (Isaiah Murray: 3 personal fouls) TURNOVER! (dead ball)

[03:48] Team_041 possession (Score: 21-17)
Dejounte Griffin drives to the basket... Dejounte Griffin throws a bad pass! Stolen by Victor Westbrook! TURNOVER! (live ball)

[03:31] Team_044 possession (Score: 21-17)
Isaiah Murray attempts a 3Pt. Contested by Scottie Turner (3.4 feet, ZONE). ISAIAH MURRAY MAKES IT! Assist: Victor Westbrook
Score: 21-20

[03:19] Team_041 possession (Score: 21-20)
FOUL! Shooting foul on Isaiah Murray. Jarrett Anunoby to the line for 3 free throws. [Team fouls: 4] (Isaiah Murray: 4 personal fouls)   FT 1/3: GOOD   FT 2/3: GOOD   FT 3/3: MISS Jarrett Anunoby makes 2/3 from the line. Rebound secured by Ayo McCollum.
Score: 23-20

[02:59] Team_044 possession (Score: 23-20)
Zach McGrady attempts a 3Pt. Wide open! Scottie Turner is 7.3 feet away. [ZONE] ZACH MCGRADY MAKES IT! Assist: Isaiah Murray
Score: 23-23

[02:46] Team_041 possession (Score: 23-23)
Scottie Turner attempts a 3Pt. Contested by Zach McGrady (6.0 feet, MAN). Scottie Turner misses. Rebound secured by Victor Westbrook.

[02:31] Team_044 possession (Score: 23-23)
Ayo McCollum drives and kicks out. Isaiah Murray attempts a Midrange. Contested by Jarrett Anunoby (5.5 feet, MAN). Isaiah Murray misses. Rebound secured by Dejounte Griffin.

[02:18] Team_041 possession (Score: 23-23)
Scottie Turner attempts a 3Pt. Contested by Zach McGrady (2.9 feet, MAN). SCOTTIE TURNER MAKES IT! Assist: Jarrett Anunoby
Score: 26-23

[02:02] Team_044 possession (Score: 26-23)
Karl Fox drives, Stephen Ingram stays with him. Karl Fox attempts a Layup. Contested by Stephen Ingram (5.8 feet, MAN). Karl Fox misses. Offensive rebound by Victor Westbrook! Victor Westbrook kicks it out.

[01:49] Team_044 possession (Score: 26-23)
Isaiah Murray attempts a 3Pt. Contested by Jarrett Anunoby (4.0 feet, MAN). ISAIAH MURRAY MAKES IT! Assist: Zach McGrady
Score: 26-26

[01:37] Team_041 possession (Score: 26-26)
Jarrett Anunoby drives, Ayo McCollum stays with him. Jarrett Anunoby attempts a Layup. Wide open! Ayo McCollum is 7.4 feet away. [ZONE] JARRETT ANUNOBY MAKES IT! Assist: Dejounte Griffin
Score: 28-26

[01:23] Team_044 possession (Score: 28-26)
FOUL! Shooting foul on Terry Barrett. Ayo McCollum to the line for 2 free throws. [Team fouls: 2] (Terry Barrett: 2 personal fouls)   FT 1/2: GOOD   FT 2/2: GOOD Ayo McCollum makes 2/2 from the line.
Score: 28-28

[01:07] Team_041 possession (Score: 28-28)
Jarrett Anunoby attempts a Layup. Contested by Isaiah Murray (4.2 feet, MAN). JARRETT ANUNOBY MAKES IT! Assist: Scottie Turner
Score: 30-28

[00:56] Team_044 possession (Score: 30-28)
Isaiah Murray attempts a 3Pt. Contested by Scottie Turner (5.5 feet, ZONE). Isaiah Murray misses. Rebound secured by Stephen Ingram.

[00:43] Team_041 possession (Score: 30-28)
Dejounte Griffin drives to the basket... FOUL! Offensive foul on Dejounte Griffin! Victor Westbrook drew the charge! [Team fouls: 3] (Dejounte Griffin: 1 personal fouls) TURNOVER! (dead ball)

[00:31] Team_044 possession (Score: 30-28)
Isaiah Murray attempts a 3Pt. Contested by Scottie Turner (4.8 feet, ZONE). Isaiah Murray misses. Rebound secured by Stephen Ingram.

[00:19] Team_041 possession (Score: 30-28)
Dejounte Griffin attempts a Midrange. Wide open! Victor Westbrook is 6.2 feet away. [MAN] Dejounte Griffin misses. Rebound secured by Karl Fox.

[00:03] Team_044 possession (Score: 30-28)
Isaiah Murray drives to the basket... Isaiah Murray throws a bad pass out of bounds! TURNOVER! (dead ball)

[00:03] Substitution (Team_041): Scottie Turner OUT → Franz Rose IN (stamina_rule2)

[00:03] Substitution (Team_041): Jarrett Anunoby OUT → Kyrie Booker IN (stamina_rule2)

[00:03] Substitution (Team_041): Dejounte Griffin OUT → Bam McCollum IN (stamina_rule2)

[00:03] Substitution (Team_041): Stephen Ingram OUT → Tobias McCollum IN (stamina_rule2)

[00:03] Substitution (Team_041): Terry Barrett OUT → De'Aaron Poole IN (stamina_rule2)

[00:03] Substitution (Team_044): Zach McGrady OUT → Kyrie Poole IN (stamina_rule2)

[00:03] Substitution (Team_044): Isaiah Murray OUT → Tim Towns IN (stamina_rule2)

[00:03] Substitution (Team_044): Victor Westbrook OUT → Tim Siakam IN (stamina_rule2)

[00:03] Substitution (Team_044): Karl Fox OUT → Pau Quickley IN (stamina_rule2)

[00:03] Substitution (Team_044): Ayo McCollum OUT → Victor Anthony IN (stamina_rule2)

================================================================================
                              1ST QUARTER COMPLETE                              
================================================================================

1ST QUARTER SCORE: Team_041 30, Team_044 28

BOX SCORE:
================================================================================

Team_041
--------------------------------------------------------------------------------
Player                MIN  PTS  REB  AST  TO      FG   FG%      3P   3P%
--------------------------------------------------------------------------------
Jarrett Anunoby        12   11    0    3   0   5/6    83.3     0/0   0.0
Scottie Turner         12    7    0    4   0   3/6    50.0     0/0   0.0
Dejounte Griffin       12    7    2    1   0   3/4    75.0     0/0   0.0
Terry Barrett          12    3    3    0   0   2/3    66.7     0/0   0.0
Stephen Ingram         12    0    3    2   0   0/1     0.0     0/0   0.0

TEAM: FG: 13/20 (65.0%), 3PT: 4/7 (57.1%), REB: 7 (0 off, 7 def), AST: 10, TO: 4
TEAM FOULS: 3


Team_044
--------------------------------------------------------------------------------
Player                MIN  PTS  REB  AST  TO      FG   FG%      3P   3P%
--------------------------------------------------------------------------------
Zach McGrady           12    9    0    2   0   3/3   100.0     0/0   0.0
Isaiah Murray          12    9    0    2   0   3/7    42.9     0/0   0.0
Ayo McCollum           12    4    3    1   0   2/5    40.0     0/0   0.0
Victor Westbrook       12    4    3    1   0   2/2   100.0     0/0   0.0
Karl Fox               12    2    3    2   0   1/2    50.0     0/0   0.0

TEAM: FG: 11/19 (57.9%), 3PT: 6/11 (54.5%), REB: 10 (3 off, 7 def), AST: 8, TO: 5
TEAM FOULS: 4

================================================================================

================================================================================
                       2ND QUARTER - Team_041 vs Team_044                       
================================================================================

[12:00] Team_041 possession (Score: 30-28)
Terry Barrett attempts a Midrange. Contested by Zach McGrady (2.6 feet, ZONE). Terry Barrett misses. Rebound secured by Ayo McCollum.

[11:44] Team_044 possession (Score: 30-28)
Karl Fox attempts a Layup. BLOCKED BY TERRY BARRETT! Ball deflects out of bounds off Karl Fox.

[11:30] Team_041 possession (Score: 30-28)
Scottie Turner drives, Zach McGrady stays with him. Scottie Turner attempts a Dunk. Contested by Zach McGrady (2.8 feet, MAN). SCOTTIE TURNER MAKES IT! Assist: Stephen Ingram
Score: 32-28

[11:16] Team_044 possession (Score: 32-28)
Zach McGrady attempts a Midrange. Wide open! Scottie Turner is 7.2 feet away. [MAN] Zach McGrady misses. Rebound secured by Stephen Ingram.

[11:03] Team_041 possession (Score: 32-28)
Jarrett Anunoby drives, Ayo McCollum stays with him. Jarrett Anunoby attempts a Dunk. Contested by Ayo McCollum (4.5 feet, ZONE). JARRETT ANUNOBY MAKES IT!
Score: 34-28

[10:45] Team_044 possession (Score: 34-28)
Isaiah Murray drives to the basket... Isaiah Murray throws a bad pass! Stolen by Terry Barrett! TURNOVER! (live ball)

[10:27] Team_041 possession (Score: 34-28)
Terry Barrett drives to the basket... Terry Barrett throws a bad pass! Stolen by Karl Fox! TURNOVER! (live ball)

[10:13] Team_044 possession (Score: 34-28)
Zach McGrady attempts a 3Pt. Contested by Scottie Turner (3.2 feet, MAN). Zach McGrady misses. Rebound secured by Terry Barrett.

[10:00] Team_041 possession (Score: 34-28)
Dejounte Griffin attempts a 3Pt. Wide open! Victor Westbrook is 6.1 feet away. [MAN] Dejounte Griffin misses. FOUL! Loose ball foul on Karl Fox during the rebound battle. [Team fouls: 1] No free throws, side out. (Karl Fox: 1 personal fouls)

[09:45] Team_041 possession (Score: 34-28)
Jarrett Anunoby attempts a 3Pt. Wide open! Isaiah Murray is 8.1 feet away. [ZONE] JARRETT ANUNOBY MAKES IT! Assist: Stephen Ingram
Score: 37-28

[09:28] Team_044 possession (Score: 37-28)
Isaiah Murray attempts a 3Pt. Contested by Jarrett Anunoby (3.9 feet, MAN). Isaiah Murray misses. Offensive rebound by Ayo McCollum! Ayo McCollum kicks it out.

[09:16] Team_044 possession (Score: 37-28)
Victor Westbrook drives to the basket... Victor Westbrook loses control! Ball rolls out of bounds! TURNOVER! (dead ball)

[09:16] Substitution (Team_041): Scottie Turner OUT → Franz Rose IN (stamina_rule2)

[09:16] Substitution (Team_041): Jarrett Anunoby OUT → Kyrie Booker IN (stamina_rule2)

[09:16] Substitution (Team_041): Dejounte Griffin OUT → Bam McCollum IN (stamina_rule2)

[09:16] Substitution (Team_041): Stephen Ingram OUT → Tobias McCollum IN (stamina_rule2)

[09:16] Substitution (Team_041): Terry Barrett OUT → De'Aaron Poole IN (stamina_rule2)

[09:16] Substitution (Team_044): Zach McGrady OUT → Kyrie Poole IN (stamina_rule2)

[09:16] Substitution (Team_044): Isaiah Murray OUT → Tim Towns IN (stamina_rule2)

[09:16] Substitution (Team_044): Victor Westbrook OUT → Tim Siakam IN (stamina_rule2)

[09:16] Substitution (Team_044): Karl Fox OUT → Pau Quickley IN (stamina_rule2)

[09:16] Substitution (Team_044): Ayo McCollum OUT → Victor Anthony IN (stamina_rule2)

[09:04] Team_041 possession (Score: 37-28)
Kyrie Booker attempts a Layup. BLOCKED BY PAU QUICKLEY! Ball is loose! Offensive rebound by Tobias McCollum! Tobias McCollum kicks it out.

[08:51] Team_041 possession (Score: 37-28)
Kyrie Booker attempts a 3Pt. Contested by Tim Siakam (4.6 feet, ZONE). Kyrie Booker misses. Offensive rebound by Tobias McCollum! Tobias McCollum kicks it out.

[08:34] Team_041 possession (Score: 37-28)
Kyrie Booker attempts a 3Pt. Contested by Kyrie Poole (4.9 feet, ZONE). Kyrie Booker misses. Rebound secured by Victor Anthony.

[08:24] Team_044 possession (Score: 37-28)
FOUL! Reach-in foul on Tobias McCollum during the drive. [Team fouls: 1] No free throws, side out. (Tobias McCollum: 1 personal fouls)

[08:08] Team_044 possession (Score: 37-28)
Victor Anthony attempts a 3Pt. Wide open! De'Aaron Poole is 8.0 feet away. [MAN] Victor Anthony misses. Offensive rebound by Victor Anthony! Victor Anthony kicks it out.

[07:56] Team_044 possession (Score: 37-28)
FOUL! Holding foul on De'Aaron Poole. [Team fouls: 2] No free throws, side out. (De'Aaron Poole: 1 personal fouls)

[07:39] Team_044 possession (Score: 37-28)
Pau Quickley attempts a Midrange. Wide open! Franz Rose is 7.5 feet away. [ZONE] Pau Quickley misses. Rebound secured by Tobias McCollum.

[07:28] Team_041 possession (Score: 37-28)
FOUL! Shooting foul on Tim Siakam. Bam McCollum to the line for 2 free throws. [Team fouls: 2] (Tim Siakam: 1 personal fouls)   FT 1/2: MISS   FT 2/2: MISS Bam McCollum makes 0/2 from the line. Rebound secured by Victor Anthony.

[07:12] Team_044 possession (Score: 37-28)
FOUL! Offensive foul on Kyrie Poole! Franz Rose drew the charge! [Team fouls: 3] (Kyrie Poole: 1 personal fouls) TURNOVER! (dead ball)

[06:54] Team_041 possession (Score: 37-28)
Franz Rose attempts a 3Pt. Contested by Kyrie Poole (5.4 feet, MAN). Franz Rose misses. Offensive rebound by Tobias McCollum! Tobias McCollum kicks it out.

[06:38] Team_041 possession (Score: 37-28)
Tobias McCollum attempts a 3Pt. Contested by Pau Quickley (4.7 feet, MAN). Tobias McCollum misses. Offensive rebound by Tobias McCollum! Tobias McCollum kicks it out.

[06:22] Team_041 possession (Score: 37-28)
Tobias McCollum attempts a Midrange. Contested by Pau Quickley (4.8 feet, ZONE). Tobias McCollum misses. Rebound secured by Pau Quickley.

[06:10] Team_044 possession (Score: 37-28)
Tim Siakam drives, picks up Tobias McCollum. Help arrives from Kyrie Booker! Tim Siakam attempts a Dunk. Wide open! Kyrie Booker is 6.6 feet away. [ZONE] TIM SIAKAM MAKES IT! Assist: Kyrie Poole
Score: 37-30

[06:00] Team_041 possession (Score: 37-30)
Tobias McCollum throws a bad pass! Stolen by Pau Quickley! TURNOVER! (live ball)

[05:47] Team_044 possession (Score: 37-30)
Tim Towns attempts a 3Pt. Wide open! Kyrie Booker is 6.7 feet away. [ZONE] Tim Towns misses. Offensive rebound by Tim Siakam! Tim Siakam kicks it out.

[05:29] Team_044 possession (Score: 37-30)
FOUL! Reach-in foul on De'Aaron Poole during the drive. [Team fouls: 3] No free throws, side out. (De'Aaron Poole: 2 personal fouls)

[05:15] Team_044 possession (Score: 37-30)
Pau Quickley attempts a Midrange. Wide open! Tobias McCollum is 7.5 feet away. [ZONE] Pau Quickley misses. Offensive rebound by Victor Anthony! Victor Anthony kicks it out.

[05:00] Team_044 possession (Score: 37-30)
Victor Anthony attempts a Midrange. Contested by De'Aaron Poole (4.0 feet, MAN). Victor Anthony misses. Rebound secured by Tobias McCollum.

[04:45] Team_041 possession (Score: 37-30)
FOUL! Shooting foul on Pau Quickley. De'Aaron Poole to the line for 2 free throws. [Team fouls: 4] (Pau Quickley: 1 personal fouls)   FT 1/2: GOOD   FT 2/2: GOOD De'Aaron Poole makes 2/2 from the line.
Score: 39-30

[04:34] Team_044 possession (Score: 39-30)
Tim Siakam drives to the basket... FOUL! Offensive foul on Tim Siakam! Bam McCollum drew the charge! [Team fouls: 5] (Tim Siakam: 2 personal fouls) TURNOVER! (dead ball)

[04:17] Team_041 possession (Score: 39-30)
Franz Rose attempts a Midrange. Contested by Kyrie Poole (5.8 feet, MAN). Franz Rose misses. Rebound secured by Pau Quickley.

[04:04] Team_044 possession (Score: 39-30)
Victor Anthony attempts a Midrange. Contested by De'Aaron Poole (5.9 feet, MAN). VICTOR ANTHONY MAKES IT! Assist: Pau Quickley
Score: 39-32

[03:49] Team_041 possession (Score: 39-32)
Bam McCollum drives, Tim Siakam stays with him. Bam McCollum attempts a Layup. Contested by Tim Siakam (2.3 feet, MAN). Bam McCollum misses. Rebound secured by Pau Quickley.

[03:35] Team_044 possession (Score: 39-32)
Tim Towns attempts a 3Pt. Contested by Kyrie Booker (4.3 feet, ZONE). Tim Towns misses. Rebound secured by De'Aaron Poole.

[03:24] Team_041 possession (Score: 39-32)
De'Aaron Poole attempts a Midrange. Contested by Tim Siakam (5.7 feet, ZONE). De'Aaron Poole misses. Rebound secured by Pau Quickley.

[03:12] Team_044 possession (Score: 39-32)
FOUL! Reach-in foul on Franz Rose during the drive. [Team fouls: 4] No free throws, side out. (Franz Rose: 1 personal fouls)

[03:00] Team_044 possession (Score: 39-32)
Pau Quickley attempts a 3Pt. Contested by Kyrie Booker (5.1 feet, ZONE). PAU QUICKLEY MAKES IT! Assist: Tim Siakam
Score: 39-35

[02:44] Team_041 possession (Score: 39-35)
Kyrie Booker attempts a 3Pt. Contested by Tim Towns (3.9 feet, ZONE). Kyrie Booker misses. Rebound secured by Victor Anthony.

[02:28] Team_044 possession (Score: 39-35)
Victor Anthony drives to the basket... Victor Anthony throws a bad pass! Stolen by De'Aaron Poole! TURNOVER! (live ball)

[02:10] Team_041 possession (Score: 39-35)
Bam McCollum drives and kicks out. Franz Rose attempts a 3Pt. Contested by Kyrie Poole (3.4 feet, MAN). Franz Rose misses. Rebound secured by Pau Quickley.

[01:57] Team_044 possession (Score: 39-35)
Tim Siakam attempts a 3Pt. Contested by Bam McCollum (5.4 feet, MAN). Tim Siakam misses. Rebound secured by De'Aaron Poole.

[01:43] Team_041 possession (Score: 39-35)
FOUL! Offensive foul on Tobias McCollum! Pau Quickley drew the charge! [Team fouls: 5] (Tobias McCollum: 2 personal fouls) TURNOVER! (dead ball)

[01:29] Team_044 possession (Score: 39-35)
Tim Siakam attempts a 3Pt. Wide open! Kyrie Booker is 8.0 feet away. [ZONE] Tim Siakam misses. FOUL! Loose ball foul on De'Aaron Poole during the rebound battle. [IN THE BONUS! 6 team fouls] Victor Anthony to the line for 2 free throws. (De'Aaron Poole: 3 personal fouls)   FT 1/2: GOOD   FT 2/2: GOOD Victor Anthony makes 2/2 from the line.
Score: 39-37

[01:16] Team_041 possession (Score: 39-37)
Bam McCollum attempts a Midrange. Heavily contested by Tim Siakam (0.6 feet, ZONE)! Bam McCollum misses. FOUL! Loose ball foul on Pau Quickley during the rebound battle. [IN THE BONUS! 6 team fouls] De'Aaron Poole to the line for 2 free throws. (Pau Quickley: 2 personal fouls)   FT 1/2: MISS   FT 2/2: GOOD De'Aaron Poole makes 1/2 from the line.
Score: 40-37

[01:01] Team_044 possession (Score: 40-37)
FOUL! Holding foul on Tobias McCollum. [IN THE BONUS! 7 team fouls] Pau Quickley to the line for 2 free throws. (Tobias McCollum: 3 personal fouls)   FT 1/2: GOOD   FT 2/2: GOOD Pau Quickley makes 2/2 from the line.
Score: 40-39

[00:46] Team_041 possession (Score: 40-39)
Franz Rose attempts a 3Pt. Contested by Kyrie Poole (5.5 feet, MAN). FRANZ ROSE MAKES IT! Assist: Tobias McCollum
Score: 43-39

[00:28] Team_044 possession (Score: 43-39)
Victor Anthony drives and kicks out. FOUL! Shooting foul on Kyrie Booker. Tim Siakam to the line for 3 free throws. [BONUS: 8 team fouls] (Kyrie Booker: 1 personal fouls)   FT 1/3: MISS   FT 2/3: MISS   FT 3/3: GOOD Tim Siakam makes 1/3 from the line.
Score: 43-40

[00:17] Team_041 possession (Score: 43-40)
Franz Rose attempts a 3Pt. Contested by Kyrie Poole (3.9 feet, MAN). FRANZ ROSE MAKES IT! Assist: Tobias McCollum
Score: 46-40

================================================================================
                              2ND QUARTER COMPLETE                              
================================================================================

2ND QUARTER SCORE: Team_041 16, Team_044 12

BOX SCORE:
================================================================================

Team_041
--------------------------------------------------------------------------------
Player                MIN  PTS  REB  AST  TO      FG   FG%      3P   3P%
--------------------------------------------------------------------------------
Franz Rose              9    6    0    0   0   2/3    66.7     0/0   0.0
Jarrett Anunoby        15    5    0    0   0   2/2   100.0     0/0   0.0
De'Aaron Poole          9    3    2    0   0   2/3    66.7     0/0   0.0
Scottie Turner         15    2    0    0   0   1/1   100.0     0/0   0.0
Terry Barrett          15    0    1    0   0   0/1     0.0     0/0   0.0
Stephen Ingram         15    0    2    2   0   0/0     0.0     0/0   0.0
Tobias McCollum         9    0    6    2   0   0/1     0.0     0/0   0.0
Kyrie Booker            9    0    0    0   0   0/2     0.0     0/0   0.0
Bam McCollum            9    0    0    0   0   0/3     0.0     0/0   0.0

TEAM: FG: 7/16 (43.8%), 3PT: 3/5 (60.0%), REB: 11 (5 off, 6 def), AST: 4, TO: 3
TEAM FOULS: 8 [Team_044 in BONUS]


Team_044
--------------------------------------------------------------------------------
Player                MIN  PTS  REB  AST  TO      FG   FG%      3P   3P%
--------------------------------------------------------------------------------
Pau Quickley            9    5    5    1   0   2/3    66.7     0/0   0.0
Victor Anthony          9    4    5    0   0   2/3    66.7     0/0   0.0
Tim Siakam              9    3    1    1   0   2/3    66.7     0/0   0.0
Ayo McCollum           15    0    2    0   0   0/0     0.0     0/0   0.0
Karl Fox               15    0    0    0   0   0/1     0.0     0/0   0.0
Zach McGrady           15    0    0    0   0   0/2     0.0     0/0   0.0
Kyrie Poole             9    0    0    1   0   0/0     0.0     0/0   0.0
Tim Towns               9    0    0    0   0   0/1     0.0     0/0   0.0

TEAM: FG: 6/13 (46.2%), 3PT: 2/5 (40.0%), REB: 13 (4 off, 9 def), AST: 3, TO: 5
TEAM FOULS: 6 [Team_041 in BONUS]

================================================================================

================================================================================
                       3RD QUARTER - Team_041 vs Team_044                       
================================================================================

[12:00] Team_041 possession (Score: 46-40)
Dejounte Griffin drives, Ayo McCollum stays with him. Dejounte Griffin attempts a Layup. Contested by Ayo McCollum (4.6 feet, ZONE). Dejounte Griffin misses. Offensive rebound by Stephen Ingram! Stephen Ingram kicks it out.

[11:49] Team_041 possession (Score: 46-40)
Jarrett Anunoby attempts a 3Pt. Wide open! Isaiah Murray is 9.0 feet away. [MAN] Jarrett Anunoby misses. Offensive rebound by Terry Barrett! Terry Barrett's putback is no good. Rebound secured by Victor Westbrook.

[11:40] Team_044 possession (Score: 46-40)
Ayo McCollum throws a bad pass out of bounds! TURNOVER! (dead ball)

[11:27] Team_041 possession (Score: 46-40)
Jarrett Anunoby attempts a 3Pt. Contested by Karl Fox (5.9 feet, ZONE). JARRETT ANUNOBY MAKES IT! Assist: Stephen Ingram
Score: 49-40

[11:14] Team_044 possession (Score: 49-40)
Isaiah Murray attempts a 3Pt. Contested by Jarrett Anunoby (4.6 feet, MAN). ISAIAH MURRAY MAKES IT! Assist: Victor Westbrook
Score: 49-43

[10:54] Team_041 possession (Score: 49-43)
Terry Barrett drives to the basket... FOUL! Offensive foul on Terry Barrett! Ayo McCollum drew the charge! [Team fouls: 1] (Terry Barrett: 1 personal fouls) TURNOVER! (dead ball)

[10:45] Team_044 possession (Score: 49-43)
Ayo McCollum attempts a Dunk. BLOCKED BY JARRETT ANUNOBY! Ball is loose! Rebound secured by Dejounte Griffin.

[10:32] Team_041 possession (Score: 49-43)
Stephen Ingram attempts a 3Pt. Contested by Karl Fox (2.6 feet, ZONE). STEPHEN INGRAM MAKES IT! Assist: Terry Barrett
Score: 52-43

[10:18] Team_044 possession (Score: 52-43)
Ayo McCollum attempts a Midrange. Contested by Terry Barrett (5.4 feet, MAN). Ayo McCollum misses. Offensive rebound by Ayo McCollum! Ayo McCollum puts it back in!
Score: 52-45

[10:04] Team_041 possession (Score: 52-45)
Dejounte Griffin makes the Dunk and draws the foul on Zach McGrady! And-1! Dejounte Griffin to the line for 1. [Team fouls: 1] (Zach McGrady: 1 personal fouls)   FT 1/1: MISS Dejounte Griffin makes 0/1 from the line. Rebound secured by Victor Westbrook.
Score: 54-45

[09:49] Team_044 possession (Score: 54-45)
Isaiah Murray attempts a 3Pt. Wide open! Jarrett Anunoby is 6.4 feet away. [MAN] Isaiah Murray misses. Rebound secured by Dejounte Griffin.

[09:37] Team_041 possession (Score: 54-45)
Jarrett Anunoby drives, Isaiah Murray stays with him. Jarrett Anunoby attempts a Layup. Wide open! Isaiah Murray is 7.6 feet away. [MAN] JARRETT ANUNOBY MAKES IT!
Score: 56-45

[09:22] Team_044 possession (Score: 56-45)
Isaiah Murray throws a bad pass! Stolen by Jarrett Anunoby! TURNOVER! (live ball)

[09:09] Team_041 possession (Score: 56-45)
Dejounte Griffin attempts a 3Pt. Contested by Victor Westbrook (5.7 feet, MAN). DEJOUNTE GRIFFIN MAKES IT! Assist: Terry Barrett
Score: 59-45

[08:55] Team_044 possession (Score: 59-45)
Victor Westbrook throws a bad pass out of bounds! TURNOVER! (dead ball)

[08:41] Team_041 possession (Score: 59-45)
Jarrett Anunoby attempts a Midrange. Contested by Victor Westbrook (4.1 feet, ZONE). Jarrett Anunoby misses. Rebound secured by Karl Fox.

[08:27] Team_044 possession (Score: 59-45)
Karl Fox attempts a 3Pt. BLOCKED BY SCOTTIE TURNER! Ball deflects out of bounds off Karl Fox.

[08:18] Team_041 possession (Score: 59-45)
FOUL! Reach-in foul on Ayo McCollum during the drive. [Team fouls: 2] No free throws, side out. (Ayo McCollum: 1 personal fouls)

[08:02] Team_041 possession (Score: 59-45)
Terry Barrett attempts a 3Pt. Contested by Zach McGrady (4.0 feet, ZONE). TERRY BARRETT MAKES IT! Assist: Scottie Turner
Score: 62-45

[07:47] Team_044 possession (Score: 62-45)
Victor Westbrook attempts a 3Pt. Heavily contested by Scottie Turner (1.4 feet, ZONE)! Victor Westbrook misses. Rebound secured by Terry Barrett.

[07:32] Team_041 possession (Score: 62-45)
Jarrett Anunoby drives to the basket... FOUL! Offensive foul on Jarrett Anunoby! Isaiah Murray drew the charge! [Team fouls: 2] (Jarrett Anunoby: 1 personal fouls) TURNOVER! (dead ball)

[07:16] Team_044 possession (Score: 62-45)
Victor Westbrook attempts a 3Pt. BLOCKED BY DEJOUNTE GRIFFIN! Ball is loose! Rebound secured by Dejounte Griffin.

[07:04] Team_041 possession (Score: 62-45)
Stephen Ingram drives and kicks out. Stephen Ingram attempts a 3Pt. Contested by Karl Fox (2.9 feet, MAN). Stephen Ingram misses. Rebound secured by Victor Westbrook.

[06:50] Team_044 possession (Score: 62-45)
Victor Westbrook drives and kicks out. Karl Fox attempts a 3Pt. Wide open! Stephen Ingram is 6.4 feet away. [MAN] Karl Fox misses. Offensive rebound by Victor Westbrook! Victor Westbrook kicks it out.

[06:38] Team_044 possession (Score: 62-45)
Isaiah Murray attempts a 3Pt. Contested by Jarrett Anunoby (2.9 feet, MAN). Isaiah Murray misses. Offensive rebound by Victor Westbrook! Victor Westbrook kicks it out.

[06:27] Team_044 possession (Score: 62-45)
Karl Fox drives, picks up Stephen Ingram. Help arrives from Jarrett Anunoby! Karl Fox attempts a Layup. Contested by Jarrett Anunoby (4.1 feet, MAN). Karl Fox misses. Rebound secured by Dejounte Griffin.

[06:11] Team_041 possession (Score: 62-45)
Jarrett Anunoby attempts a 3Pt. Wide open! Isaiah Murray is 6.6 feet away. [ZONE] JARRETT ANUNOBY MAKES IT! Assist: Scottie Turner
Score: 65-45

[05:58] Team_044 possession (Score: 65-45)
Karl Fox drives, Stephen Ingram stays with him. Karl Fox attempts a Layup. Contested by Stephen Ingram (3.1 feet, MAN). KARL FOX MAKES IT! Assist: Isaiah Murray
Score: 65-47

[05:39] Team_041 possession (Score: 65-47)
Scottie Turner drives and kicks out. FOUL! Shooting foul on Karl Fox. Stephen Ingram to the line for 3 free throws. [Team fouls: 3] (Karl Fox: 1 personal fouls)   FT 1/3: GOOD   FT 2/3: GOOD   FT 3/3: GOOD Stephen Ingram makes 3/3 from the line.
Score: 68-47

[05:24] Team_044 possession (Score: 68-47)
Victor Westbrook makes the Layup and draws the foul on Terry Barrett! And-1! Victor Westbrook to the line for 1. [Team fouls: 3] (Terry Barrett: 2 personal fouls)   FT 1/1: GOOD Victor Westbrook makes 1/1 from the line.
Score: 68-50

[05:09] Team_041 possession (Score: 68-50)
Jarrett Anunoby attempts a 3Pt. Contested by Zach McGrady (2.8 feet, ZONE). Jarrett Anunoby misses. Rebound secured by Karl Fox.

[04:58] Team_044 possession (Score: 68-50)
Zach McGrady makes the Dunk and draws the foul on Scottie Turner! And-1! Zach McGrady to the line for 1. [Team fouls: 4] (Scottie Turner: 1 personal fouls)   FT 1/1: MISS Zach McGrady makes 0/1 from the line. Rebound secured by Stephen Ingram.
Score: 68-52

[04:41] Team_041 possession (Score: 68-52)
Jarrett Anunoby attempts a 3Pt. Contested by Isaiah Murray (3.8 feet, MAN). Jarrett Anunoby misses. Rebound secured by Karl Fox.

[04:28] Team_044 possession (Score: 68-52)
Ayo McCollum attempts a 3Pt. Contested by Terry Barrett (4.2 feet, MAN). Ayo McCollum misses. Offensive rebound by Victor Westbrook! Victor Westbrook kicks it out.

[04:17] Team_044 possession (Score: 68-52)
Zach McGrady drives, Scottie Turner stays with him. Zach McGrady attempts a Layup. Contested by Scottie Turner (5.2 feet, MAN). Zach McGrady misses. Rebound secured by Dejounte Griffin.

[04:07] Team_041 possession (Score: 68-52)
Jarrett Anunoby attempts a 3Pt. Wide open! Isaiah Murray is 8.8 feet away. [MAN] JARRETT ANUNOBY MAKES IT! Assist: Scottie Turner
Score: 71-52

[03:54] Team_044 possession (Score: 71-52)
Victor Westbrook attempts a Layup. Contested by Dejounte Griffin (2.1 feet, MAN). VICTOR WESTBROOK MAKES IT! Assist: Zach McGrady
Score: 71-54

[03:42] Team_041 possession (Score: 71-54)
Scottie Turner drives and kicks out. Dejounte Griffin attempts a Midrange. Wide open! Victor Westbrook is 7.1 feet away. [MAN] DEJOUNTE GRIFFIN MAKES IT! Assist: Jarrett Anunoby
Score: 73-54

[03:27] Team_044 possession (Score: 73-54)
Zach McGrady attempts a Midrange. Contested by Stephen Ingram (3.5 feet, ZONE). Zach McGrady misses. Offensive rebound by Victor Westbrook! Victor Westbrook kicks it out.

[03:15] Team_044 possession (Score: 73-54)
Ayo McCollum makes the Midrange and draws the foul on Terry Barrett! And-1! Ayo McCollum to the line for 1. [BONUS: 5 team fouls] (Terry Barrett: 3 personal fouls)   FT 1/1: GOOD Ayo McCollum makes 1/1 from the line.
Score: 73-57

[02:58] Team_041 possession (Score: 73-57)
Stephen Ingram attempts a Midrange. Contested by Karl Fox (4.8 feet, MAN). Stephen Ingram misses. Rebound secured by Victor Westbrook.

[02:42] Team_044 possession (Score: 73-57)
Zach McGrady attempts a 3Pt. Contested by Scottie Turner (4.6 feet, MAN). ZACH MCGRADY MAKES IT! Assist: Ayo McCollum
Score: 73-60

[02:24] Team_041 possession (Score: 73-60)
Jarrett Anunoby drives and kicks out. Jarrett Anunoby attempts a 3Pt. Wide open! Isaiah Murray is 6.5 feet away. [MAN] JARRETT ANUNOBY MAKES IT! Assist: Dejounte Griffin
Score: 76-60

[02:08] Team_044 possession (Score: 76-60)
Karl Fox attempts a Layup. Contested by Terry Barrett (5.0 feet, ZONE). KARL FOX MAKES IT! Assist: Ayo McCollum
Score: 76-62

[01:50] Team_041 possession (Score: 76-62)
Terry Barrett makes the Dunk and draws the foul on Ayo McCollum! And-1! Terry Barrett to the line for 1. [Team fouls: 4] (Ayo McCollum: 2 personal fouls)   FT 1/1: GOOD Terry Barrett makes 1/1 from the line.
Score: 79-62

[01:36] Team_044 possession (Score: 79-62)
Karl Fox throws a bad pass! Stolen by Stephen Ingram! TURNOVER! (live ball)

[01:18] Team_041 possession (Score: 79-62)
Stephen Ingram attempts a 3Pt. Contested by Karl Fox (5.5 feet, MAN). Stephen Ingram misses. Rebound secured by Victor Westbrook.

[01:06] Team_044 possession (Score: 79-62)
Karl Fox drives and kicks out. Isaiah Murray attempts a 3Pt. Contested by Jarrett Anunoby (4.5 feet, MAN). Isaiah Murray misses. Rebound secured by Stephen Ingram.

[00:49] Team_041 possession (Score: 79-62)
Dejounte Griffin attempts a Layup. Contested by Ayo McCollum (5.8 feet, ZONE). Dejounte Griffin misses. Rebound secured by Victor Westbrook.

[00:35] Team_044 possession (Score: 79-62)
Ayo McCollum attempts a Layup. BLOCKED BY STEPHEN INGRAM! Ball is loose! Offensive rebound by Victor Westbrook! Victor Westbrook kicks it out.

[00:19] Team_044 possession (Score: 79-62)
Ayo McCollum attempts a Layup. BLOCKED BY TERRY BARRETT! Ball goes out off Terry Barrett. Ayo McCollum's ball!

[00:05] Team_044 possession (Score: 79-62)
Victor Westbrook attempts a 3Pt. Contested by Dejounte Griffin (3.9 feet, MAN). Victor Westbrook misses. Rebound secured by Stephen Ingram.

================================================================================
                              3RD QUARTER COMPLETE                              
================================================================================

3RD QUARTER SCORE: Team_041 33, Team_044 22

BOX SCORE:
================================================================================

Team_041
--------------------------------------------------------------------------------
Player                MIN  PTS  REB  AST  TO      FG   FG%      3P   3P%
--------------------------------------------------------------------------------
Jarrett Anunoby        27   14    0    1   0   5/9    55.6     0/0   0.0
Stephen Ingram         27    6    4    1   0   2/5    40.0     0/0   0.0
Terry Barrett          27    6    1    2   0   2/2   100.0     0/0   0.0
Dejounte Griffin       27    5    5    1   0   2/4    50.0     0/0   0.0
Scottie Turner         27    0    0    3   0   0/0     0.0     0/0   0.0

TEAM: FG: 11/20 (55.0%), 3PT: 6/10 (60.0%), REB: 11 (2 off, 9 def), AST: 8, TO: 2
TEAM FOULS: 6 [Team_044 in BONUS]


Team_044
--------------------------------------------------------------------------------
Player                MIN  PTS  REB  AST  TO      FG   FG%      3P   3P%
--------------------------------------------------------------------------------
Victor Westbrook       27    5   11    1   0   2/5    40.0     0/0   0.0
Ayo McCollum           27    5    1    2   0   2/3    66.7     0/0   0.0
Karl Fox               27    4    3    0   0   2/5    40.0     0/0   0.0
Isaiah Murray          27    3    0    1   0   1/2    50.0     0/0   0.0
Zach McGrady           27    3    0    1   0   1/3    33.3     0/0   0.0

TEAM: FG: 8/18 (44.4%), 3PT: 2/7 (28.6%), REB: 14 (6 off, 8 def), AST: 5, TO: 4
TEAM FOULS: 4

================================================================================

================================================================================
                       4TH QUARTER - Team_041 vs Team_044                       
================================================================================

[12:00] Team_041 possession (Score: 79-62)
Dejounte Griffin attempts a Layup. Contested by Ayo McCollum (4.8 feet, ZONE). DEJOUNTE GRIFFIN MAKES IT! Assist: Stephen Ingram
Score: 81-62

[11:46] Team_044 possession (Score: 81-62)
Zach McGrady attempts a 3Pt. Contested by Scottie Turner (3.2 feet, MAN). Zach McGrady misses. Rebound secured by Dejounte Griffin.

[11:32] Team_041 possession (Score: 81-62)
FOUL! Holding foul on Karl Fox. [Team fouls: 1] No free throws, side out. (Karl Fox: 1 personal fouls)

[11:19] Team_041 possession (Score: 81-62)
Stephen Ingram attempts a Layup. Contested by Karl Fox (2.9 feet, MAN). Stephen Ingram misses. Rebound secured by Victor Westbrook.

[11:01] Team_044 possession (Score: 81-62)
FOUL! Holding foul on Stephen Ingram. [Team fouls: 1] No free throws, side out. (Stephen Ingram: 1 personal fouls)

[10:45] Team_044 possession (Score: 81-62)
Ayo McCollum drives, picks up Terry Barrett. Help arrives from Jarrett Anunoby! Ayo McCollum attempts a Layup. Heavily contested by Jarrett Anunoby (1.9 feet, ZONE)! AYO MCCOLLUM MAKES IT! Assist: Karl Fox
Score: 81-64

[10:32] Team_041 possession (Score: 81-64)
Jarrett Anunoby attempts a Layup. Wide open! Karl Fox is 8.0 feet away. [ZONE] Jarrett Anunoby misses. Rebound secured by Karl Fox.

[10:19] Team_044 possession (Score: 81-64)
Karl Fox attempts a 3Pt. Heavily contested by Dejounte Griffin (0.5 feet, ZONE)! Karl Fox misses. Offensive rebound by Ayo McCollum! Ayo McCollum kicks it out.

[10:05] Team_044 possession (Score: 81-64)
Ayo McCollum attempts a Layup. Contested by Terry Barrett (5.1 feet, MAN). AYO MCCOLLUM MAKES IT! Assist: Isaiah Murray
Score: 81-66

[09:53] Team_041 possession (Score: 81-66)
Terry Barrett attempts a Midrange. Contested by Karl Fox (3.9 feet, ZONE). TERRY BARRETT MAKES IT! Assist: Jarrett Anunoby
Score: 83-66

[09:36] Team_044 possession (Score: 83-66)
FOUL! Reach-in foul on Terry Barrett during the drive. [Team fouls: 2] No free throws, side out. (Terry Barrett: 1 personal fouls)

[09:22] Team_044 possession (Score: 83-66)
Zach McGrady attempts a 3Pt. Contested by Scottie Turner (2.0 feet, ZONE). Zach McGrady misses. Rebound secured by Stephen Ingram.

[09:03] Team_041 possession (Score: 83-66)
FOUL! Reach-in foul on Karl Fox during the drive. [Team fouls: 2] No free throws, side out. (Karl Fox: 2 personal fouls)

[08:53] Team_041 possession (Score: 83-66)
FOUL! Shooting foul on Isaiah Murray. Terry Barrett to the line for 2 free throws. [Team fouls: 3] (Isaiah Murray: 1 personal fouls)   FT 1/2: GOOD   FT 2/2: GOOD Terry Barrett makes 2/2 from the line.
Score: 85-66

[08:37] Team_044 possession (Score: 85-66)
FOUL! Shooting foul on Terry Barrett. Karl Fox to the line for 2 free throws. [Team fouls: 3] (Terry Barrett: 2 personal fouls)   FT 1/2: MISS   FT 2/2: MISS Karl Fox makes 0/2 from the line. Rebound secured by Terry Barrett.

[08:22] Team_041 possession (Score: 85-66)
Terry Barrett attempts a 3Pt. Contested by Isaiah Murray (5.8 feet, ZONE). Terry Barrett misses. Offensive rebound by Terry Barrett! Terry Barrett's putback is no good. Rebound secured by Karl Fox.

[08:08] Team_044 possession (Score: 85-66)
Isaiah Murray attempts a 3Pt. Contested by Jarrett Anunoby (4.2 feet, MAN). Isaiah Murray misses. Rebound secured by Terry Barrett.

[07:57] Team_041 possession (Score: 85-66)
Scottie Turner attempts a 3Pt. Contested by Zach McGrady (4.2 feet, MAN). Scottie Turner misses. Rebound secured by Victor Westbrook.

[07:43] Team_044 possession (Score: 85-66)
Ayo McCollum drives, picks up Terry Barrett. Help arrives from Jarrett Anunoby! Ayo McCollum attempts a Layup. Wide open! Jarrett Anunoby is 6.5 feet away. [ZONE] AYO MCCOLLUM MAKES IT! Assist: Karl Fox
Score: 85-68

[07:29] Team_041 possession (Score: 85-68)
Stephen Ingram attempts a 3Pt. Contested by Victor Westbrook (4.9 feet, ZONE). Stephen Ingram misses. Rebound secured by Victor Westbrook.

[07:11] Team_044 possession (Score: 85-68)
Isaiah Murray attempts a 3Pt. Contested by Jarrett Anunoby (4.5 feet, MAN). Isaiah Murray misses. Rebound secured by Stephen Ingram.

[06:55] Team_041 possession (Score: 85-68)
Dejounte Griffin drives, picks up Ayo McCollum. Help arrives from Zach McGrady! Dejounte Griffin attempts a Layup. Wide open! Zach McGrady is 9.7 feet away. [ZONE] DEJOUNTE GRIFFIN MAKES IT!
Score: 87-68

[06:42] Team_044 possession (Score: 87-68)
Victor Westbrook attempts a 3Pt. Contested by Scottie Turner (4.2 feet, ZONE). Victor Westbrook misses. Rebound secured by Stephen Ingram.

[06:28] Team_041 possession (Score: 87-68)
Scottie Turner attempts a Midrange. Contested by Zach McGrady (4.1 feet, MAN). Scottie Turner misses. Offensive rebound by Stephen Ingram! Stephen Ingram kicks it out.

[06:09] Team_041 possession (Score: 87-68)
Jarrett Anunoby attempts a 3Pt. Contested by Isaiah Murray (3.4 feet, MAN). Jarrett Anunoby misses. Rebound secured by Ayo McCollum.

[05:56] Team_044 possession (Score: 87-68)
Zach McGrady attempts a Midrange. Contested by Scottie Turner (5.0 feet, MAN). ZACH MCGRADY MAKES IT! Assist: Isaiah Murray
Score: 87-70

[05:40] Team_041 possession (Score: 87-70)
Jarrett Anunoby attempts a Layup. Wide open! Isaiah Murray is 6.9 feet away. [MAN] JARRETT ANUNOBY MAKES IT!
Score: 89-70

[05:22] Team_044 possession (Score: 89-70)
Karl Fox drives, picks up Stephen Ingram. Help arrives from Jarrett Anunoby! Karl Fox attempts a Dunk. Contested by Jarrett Anunoby (5.3 feet, MAN). Karl Fox misses. Rebound secured by Dejounte Griffin.

[05:06] Team_041 possession (Score: 89-70)
Stephen Ingram makes the Layup and draws the foul on Karl Fox! And-1! Stephen Ingram to the line for 1. [Team fouls: 4] (Karl Fox: 3 personal fouls)   FT 1/1: GOOD Stephen Ingram makes 1/1 from the line.
Score: 92-70

[04:53] Team_044 possession (Score: 92-70)
Isaiah Murray drives to the basket... Isaiah Murray throws a bad pass! Stolen by Terry Barrett! TURNOVER! (live ball)

[04:38] Team_041 possession (Score: 92-70)
Stephen Ingram drives to the basket... Stephen Ingram loses control! Ball rolls out of bounds! TURNOVER! (dead ball)

[04:38] Substitution (Team_041): Scottie Turner OUT → Franz Rose IN (stamina_rule2)

[04:38] Substitution (Team_041): Jarrett Anunoby OUT → Kyrie Booker IN (stamina_rule2)

[04:38] Substitution (Team_041): Dejounte Griffin OUT → Bam McCollum IN (stamina_rule2)

[04:38] Substitution (Team_041): Stephen Ingram OUT → Tobias McCollum IN (stamina_rule2)

[04:38] Substitution (Team_041): Terry Barrett OUT → De'Aaron Poole IN (stamina_rule2)

[04:38] Substitution (Team_044): Zach McGrady OUT → Kyrie Poole IN (stamina_rule2)

[04:38] Substitution (Team_044): Isaiah Murray OUT → Tim Towns IN (stamina_rule2)

[04:38] Substitution (Team_044): Victor Westbrook OUT → Tim Siakam IN (stamina_rule2)

[04:38] Substitution (Team_044): Karl Fox OUT → Pau Quickley IN (stamina_rule2)

[04:38] Substitution (Team_044): Ayo McCollum OUT → Victor Anthony IN (stamina_rule2)

[04:26] Team_044 possession (Score: 92-70)
Victor Anthony drives to the basket... Victor Anthony commits a violation (traveling/carry)! TURNOVER! (dead ball)

[04:14] Team_041 possession (Score: 92-70)
Franz Rose drives and kicks out. Tobias McCollum attempts a Midrange. Heavily contested by Pau Quickley (0.5 feet, MAN)! Tobias McCollum misses. Rebound secured by Tim Siakam.

[03:57] Team_044 possession (Score: 92-70)
Tim Towns drives to the basket... Tim Towns throws a bad pass out of bounds! TURNOVER! (dead ball)

[03:40] Team_041 possession (Score: 92-70)
Kyrie Booker attempts a 3Pt. Contested by Tim Towns (4.4 feet, MAN). KYRIE BOOKER MAKES IT! Assist: De'Aaron Poole
Score: 95-70

[03:26] Team_044 possession (Score: 95-70)
Tim Siakam drives, picks up Tobias McCollum. Help arrives from Kyrie Booker! Tim Siakam attempts a Layup. Contested by Kyrie Booker (5.8 feet, ZONE). TIM SIAKAM MAKES IT! Assist: Kyrie Poole
Score: 95-72

[03:13] Team_041 possession (Score: 95-72)
FOUL! Shooting foul on Tim Towns. Kyrie Booker to the line for 2 free throws. [BONUS: 5 team fouls] (Tim Towns: 1 personal fouls)   FT 1/2: GOOD   FT 2/2: GOOD Kyrie Booker makes 2/2 from the line.
Score: 97-72

[03:03] Team_044 possession (Score: 97-72)
Tim Towns attempts a 3Pt. Wide open! Kyrie Booker is 6.4 feet away. [ZONE] Tim Towns misses. Rebound secured by Kyrie Booker.

[02:47] Team_041 possession (Score: 97-72)
Bam McCollum attempts a 3Pt. Contested by Tim Siakam (2.8 feet, ZONE). Bam McCollum misses. Rebound secured by Victor Anthony.

[02:36] Team_044 possession (Score: 97-72)
Tim Siakam attempts a 3Pt. Contested by Bam McCollum (4.3 feet, MAN). Tim Siakam misses. Rebound secured by Kyrie Booker.

[02:22] Team_041 possession (Score: 97-72)
De'Aaron Poole attempts a Midrange. Contested by Tim Siakam (2.2 feet, ZONE). DE'AARON POOLE MAKES IT! Assist: Franz Rose
Score: 99-72

[02:07] Team_044 possession (Score: 99-72)
Victor Anthony attempts a Midrange. Heavily contested by De'Aaron Poole (1.6 feet, MAN)! Victor Anthony misses. Rebound secured by Tobias McCollum.

[01:50] Team_041 possession (Score: 99-72)
Tobias McCollum attempts a 3Pt. Contested by Pau Quickley (3.2 feet, MAN). Tobias McCollum misses. Offensive rebound by De'Aaron Poole! De'Aaron Poole's putback is no good. Rebound secured by Pau Quickley.

[01:34] Team_044 possession (Score: 99-72)
Pau Quickley drives to the basket... Pau Quickley commits a violation (traveling/carry)! TURNOVER! (dead ball)

[01:20] Team_041 possession (Score: 99-72)
Tobias McCollum attempts a Midrange. Contested by Tim Siakam (2.2 feet, ZONE). Tobias McCollum misses. Rebound secured by Victor Anthony.

[01:06] Team_044 possession (Score: 99-72)
Victor Anthony attempts a Layup. Contested by De'Aaron Poole (5.8 feet, MAN). VICTOR ANTHONY MAKES IT! Assist: Kyrie Poole
Score: 99-74

[00:49] Team_041 possession (Score: 99-74)
Kyrie Booker attempts a 3Pt. Contested by Tim Siakam (4.8 feet, ZONE). Kyrie Booker misses. Rebound secured by Tim Siakam.

[00:36] Team_044 possession (Score: 99-74)
Kyrie Poole attempts a 3Pt. Contested by Kyrie Booker (4.9 feet, ZONE). Kyrie Poole misses. Rebound secured by De'Aaron Poole.

[00:23] Team_041 possession (Score: 99-74)
Franz Rose attempts a 3Pt. Contested by Tim Siakam (2.2 feet, ZONE). Franz Rose misses. Rebound secured by Pau Quickley.

[00:06] Team_044 possession (Score: 99-74)
Victor Anthony drives and kicks out. Tim Siakam attempts a 3Pt. Contested by Kyrie Booker (5.6 feet, ZONE). Tim Siakam misses. Rebound secured by Tobias McCollum.

================================================================================
                              4TH QUARTER COMPLETE                              
================================================================================

4TH QUARTER SCORE: Team_041 20, Team_044 12

BOX SCORE:
================================================================================

Team_041
--------------------------------------------------------------------------------
Player                MIN  PTS  REB  AST  TO      FG   FG%      3P   3P%
--------------------------------------------------------------------------------
Kyrie Booker           14    5    2    0   0   2/3    66.7     0/0   0.0
Dejounte Griffin       35    4    2    0   0   2/2   100.0     0/0   0.0
Terry Barrett          35    4    2    0   0   2/3    66.7     0/0   0.0
Stephen Ingram         35    3    4    1   0   1/3    33.3     0/0   0.0
Jarrett Anunoby        35    2    0    1   0   1/3    33.3     0/0   0.0
De'Aaron Poole         14    2    1    1   0   1/1   100.0     0/0   0.0
Scottie Turner         35    0    0    0   0   0/1     0.0     0/0   0.0
Franz Rose             14    0    0    1   0   0/2     0.0     0/0   0.0
Bam McCollum           14    0    0    0   0   0/1     0.0     0/0   0.0
Tobias McCollum        14    0    2    0   0   0/2     0.0     0/0   0.0

TEAM: FG: 9/21 (42.9%), 3PT: 1/9 (11.1%), REB: 15 (3 off, 12 def), AST: 4, TO: 1
TEAM FOULS: 3


Team_044
--------------------------------------------------------------------------------
Player                MIN  PTS  REB  AST  TO      FG   FG%      3P   3P%
--------------------------------------------------------------------------------
Ayo McCollum           35    6    2    0   0   3/3   100.0     0/0   0.0
Zach McGrady           35    2    0    0   0   1/3    33.3     0/0   0.0
Tim Siakam             14    2    2    0   0   1/2    50.0     0/0   0.0
Victor Anthony         14    2    2    0   0   1/3    33.3     0/0   0.0
Victor Westbrook       35    0    3    0   0   0/1     0.0     0/0   0.0
Karl Fox               35    0    2    2   0   0/2     0.0     0/0   0.0
Isaiah Murray          35    0    0    2   0   0/2     0.0     0/0   0.0
Kyrie Poole            14    0    0    2   0   0/1     0.0     0/0   0.0
Tim Towns              14    0    0    0   0   0/1     0.0     0/0   0.0
Pau Quickley           14    0    2    0   0   0/0     0.0     0/0   0.0

TEAM: FG: 6/18 (33.3%), 3PT: 0/8 (0.0%), REB: 11 (1 off, 10 def), AST: 6, TO: 4
TEAM FOULS: 5 [Team_041 in BONUS]

================================================================================

================================================================================
                               FULL GAME COMPLETE                               
================================================================================

FINAL SCORE: Team_041 99, Team_044 74

SCORING BY QUARTER:
--------------------------------------------------------------------------------
Team                     Q1     Q2     Q3     Q4    FINAL
--------------------------------------------------------------------------------
Team_041                 30     16     33     20       99
Team_044                 28     12     22     12       74
--------------------------------------------------------------------------------

FULL GAME BOX SCORE:
================================================================================

Team_041
--------------------------------------------------------------------------------
Player                MIN  PTS  REB  AST  TO      FG   FG%      3P   3P%      FT STL BLK
--------------------------------------------------------------------------------
Scottie Turner         35    9    0    7   0   6/10   60.0   2/5    40.0   2/3     0   1
Jarrett Anunoby        35   32    0    5   2  13/20   65.0   5/10   50.0   2/3     2   1
Dejounte Griffin       35   16    9    2   3   6/9    66.7   2/2   100.0   0/1     1   1
Stephen Ingram         35    9   13    6   1   2/8    25.0   1/3    33.3   4/4     1   1
Terry Barrett          35   13    7    2   2   6/9    66.7   1/2    50.0   4/5     2   2
Franz Rose             14    6    0    1   0   2/5    40.0   2/3    66.7   0/0     0   0
Kyrie Booker           14    5    2    0   0   2/5    40.0   1/4    25.0   2/2     0   0
Bam McCollum           14    0    0    0   0   1/5    20.0   0/1     0.0   0/2     0   0
Tobias McCollum        14    0    8    2   2   0/3     0.0   0/1     0.0   0/0     0   0
De'Aaron Poole         14    5    3    1   0   2/3    66.7   0/0     0.0   3/4     1   0

TEAM: FG: 40/77 (51.9%), 3PT: 14/31 (45.2%), REB: 44 (10 off, 34 def), AST: 26, TO: 10


Team_044
--------------------------------------------------------------------------------
Player                MIN  PTS  REB  AST  TO      FG   FG%      3P   3P%      FT STL BLK
--------------------------------------------------------------------------------
Zach McGrady           35   14    0    3   2   5/11   45.5   4/7    57.1   0/1     0   0
Isaiah Murray          35   12    0    5   3   4/11   36.4   4/10   40.0   0/0     0   0
Victor Westbrook       35    9   17    2   3   4/8    50.0   0/4     0.0   1/1     2   0
Karl Fox               35    6    8    4   1   3/10   30.0   0/2     0.0   0/2     1   0
Ayo McCollum           35   15    8    3   3   7/11   63.6   0/1     0.0   3/3     1   1
Kyrie Poole            14    0    0    3   1   0/1     0.0   0/1     0.0   0/0     0   0
Tim Towns              14    0    0    0   1   0/2     0.0   0/2     0.0   0/0     0   0
Tim Siakam             14    5    3    1   2   3/5    60.0   1/3    33.3   1/3     0   0
Pau Quickley           14    5    7    1   2   1/2    50.0   1/1   100.0   2/2     1   1
Victor Anthony         14    6    7    0   0   3/6    50.0   0/0     0.0   2/2     0   0

TEAM: FG: 31/68 (45.6%), 3PT: 10/31 (32.3%), REB: 48 (14 off, 34 def), AST: 22, TO: 18

================================================================================
