================================================================================
                        FULL GAME - Team_018 vs Team_041                        
================================================================================

================================================================================
                       1ST QUARTER - Team_018 vs Team_041                       
================================================================================

[12:00] Team_018 possession (Score: 0-0)
Klay Stewart drives and kicks out. Klay Stewart makes the 3Pt and draws the foul on Scottie Turner! And-1! Klay Stewart to the line for 1. [Team fouls: 1] (Scottie Turner: 1 personal fouls)   FT 1/1: GOOD Klay Stewart makes 1/1 from the line.
Score: 4-0

[11:49] Team_041 possession (Score: 4-0)
Dejounte Griffin drives and kicks out. Scottie Turner attempts a 3Pt. Heavily contested by Allen Markkanen (0.5 feet, ZONE)! Scottie Turner misses. Rebound secured by Allen Markkanen.

[11:37] Team_018 possession (Score: 4-0)
FOUL! Shooting foul on Scottie Turner. Bones Anunoby to the line for 3 free throws. [Team fouls: 2] (Scottie Turner: 2 personal fouls)   FT 1/3: GOOD   FT 2/3: GOOD   FT 3/3: GOOD Bones Anunoby makes 3/3 from the line.
Score: 7-0

[11:25] Team_041 possession (Score: 7-0)
Jarrett Anunoby makes the Midrange and draws the foul on Tracy Bryant! And-1! Jarrett Anunoby to the line for 1. [Team fouls: 1] (Tracy Bryant: 1 personal fouls)   FT 1/1: MISS Jarrett Anunoby makes 0/1 from the line. Rebound secured by Bones Anunoby.
Score: 7-2

[11:10] Team_018 possession (Score: 7-2)
Klay Stewart attempts a Midrange. Contested by Terry Barrett (2.7 feet, ZONE). KLAY STEWART MAKES IT! Assist: Bones Anunoby
Score: 9-2

[10:54] Team_041 possession (Score: 9-2)
Terry Barrett attempts a Layup. Wide open! Domantas Wall is 8.4 feet away. [MAN] TERRY BARRETT MAKES IT! Assist: Jarrett Anunoby
Score: 9-4

[10:43] Team_018 possession (Score: 9-4)
Domantas Wall attempts a Midrange. Contested by Terry Barrett (2.5 feet, MAN). DOMANTAS WALL MAKES IT! Assist: Klay Stewart
Score: 11-4

[10:30] Team_041 possession (Score: 11-4)
Dejounte Griffin makes the Layup and draws the foul on Domantas Wall! And-1! Dejounte Griffin to the line for 1. [Team fouls: 2] (Domantas Wall: 1 personal fouls)   FT 1/1: GOOD Dejounte Griffin makes 1/1 from the line.
Score: 11-7

[10:17] Team_018 possession (Score: 11-7)
Domantas Wall loses the ball! Stripped by Terry Barrett! TURNOVER! (live ball)

[10:02] Team_041 possession (Score: 11-7)
FOUL! Shooting foul on Domantas Wall. Stephen Ingram to the line for 2 free throws. [Team fouls: 3] (Domantas Wall: 2 personal fouls)   FT 1/2: GOOD   FT 2/2: MISS Stephen Ingram makes 1/2 from the line. Rebound secured by Allen Markkanen.
Score: 11-8

[09:49] Team_018 possession (Score: 11-8)
Bones Anunoby attempts a Layup. Heavily contested by Stephen Ingram (1.7 feet, MAN)! BONES ANUNOBY MAKES IT! Assist: Allen Markkanen
Score: 13-8

[09:40] Team_041 possession (Score: 13-8)
FOUL! Shooting foul on Bones Anunoby. Dejounte Griffin to the line for 2 free throws. [Team fouls: 4] (Bones Anunoby: 1 personal fouls)   FT 1/2: GOOD   FT 2/2: GOOD Dejounte Griffin makes 2/2 from the line.
Score: 13-10

[09:26] Team_018 possession (Score: 13-10)
Klay Stewart attempts a 3Pt. Contested by Scottie Turner (3.4 feet, MAN). Klay Stewart misses. Offensive rebound by Bones Anunoby! Bones Anunoby kicks it out.

[09:14] Team_018 possession (Score: 13-10)
Bones Anunoby attempts a Midrange. Heavily contested by Jarrett Anunoby (1.7 feet, ZONE)! Bones Anunoby misses. Rebound secured by Terry Barrett.

[09:02] Team_041 possession (Score: 13-10)
Jarrett Anunoby attempts a 3Pt. Contested by Tracy Bryant (5.3 feet, MAN). Jarrett Anunoby misses. Rebound secured by Domantas Wall.

[08:48] Team_018 possession (Score: 13-10)
Domantas Wall attempts a Layup. Contested by Terry Barrett (4.5 feet, MAN). DOMANTAS WALL MAKES IT!
Score: 15-10

[08:32] Team_041 possession (Score: 15-10)
Terry Barrett makes the Layup and draws the foul on Domantas Wall! And-1! Terry Barrett to the line for 1. [BONUS: 5 team fouls] (Domantas Wall: 3 personal fouls)   FT 1/1: MISS Terry Barrett makes 0/1 from the line. Rebound secured by Allen Markkanen.
Score: 15-12

[08:21] Team_018 possession (Score: 15-12)
Allen Markkanen commits a violation (traveling/carry)! TURNOVER! (dead ball)

[08:05] Team_041 possession (Score: 15-12)
FOUL! Reach-in foul on Domantas Wall during the drive. [IN THE BONUS! 6 team fouls] Terry Barrett to the line for 2 free throws. (Domantas Wall: 4 personal fouls)   FT 1/2: MISS   FT 2/2: MISS Terry Barrett makes 0/2 from the line. Offensive rebound by Terry Barrett! Terry Barrett's putback is no good.

[07:48] Team_018 possession (Score: 15-12)
Klay Stewart attempts a 3Pt. Contested by Scottie Turner (3.9 feet, MAN). KLAY STEWART MAKES IT!
Score: 18-12

[07:34] Team_041 possession (Score: 18-12)
Scottie Turner drives, Klay Stewart stays with him. Scottie Turner attempts a Dunk. Contested by Klay Stewart (3.1 feet, MAN). SCOTTIE TURNER MAKES IT!
Score: 18-14

[07:22] Team_018 possession (Score: 18-14)
Allen Markkanen makes the Layup and draws the foul on Dejounte Griffin! And-1! Allen Markkanen to the line for 1. [Team fouls: 3] (Dejounte Griffin: 1 personal fouls)   FT 1/1: GOOD Allen Markkanen makes 1/1 from the line.
Score: 21-14

[07:09] Team_041 possession (Score: 21-14)
Stephen Ingram drives, Bones Anunoby stays with him. Stephen Ingram attempts a Dunk. Contested by Bones Anunoby (3.2 feet, ZONE). STEPHEN INGRAM MAKES IT! Assist: Dejounte Griffin
Score: 21-16

[06:54] Team_018 possession (Score: 21-16)
Domantas Wall makes the Dunk and draws the foul on Terry Barrett! And-1! Domantas Wall to the line for 1. [Team fouls: 4] (Terry Barrett: 1 personal fouls)   FT 1/1: GOOD Domantas Wall makes 1/1 from the line.
Score: 24-16

[06:43] Team_041 possession (Score: 24-16)
Jarrett Anunoby attempts a Midrange. Contested by Tracy Bryant (5.0 feet, MAN). Jarrett Anunoby misses. Rebound secured by Allen Markkanen.

[06:25] Team_018 possession (Score: 24-16)
Allen Markkanen makes the Layup and draws the foul on Terry Barrett! And-1! Allen Markkanen to the line for 1. [BONUS: 5 team fouls] (Terry Barrett: 2 personal fouls)   FT 1/1: GOOD Allen Markkanen makes 1/1 from the line.
Score: 27-16

[06:11] Team_041 possession (Score: 27-16)
Jarrett Anunoby drives and kicks out. Dejounte Griffin attempts a 3Pt. Wide open! Allen Markkanen is 7.0 feet away. [MAN] Dejounte Griffin misses. Rebound secured by Domantas Wall.

[05:58] Team_018 possession (Score: 27-16)
Bones Anunoby attempts a Midrange. Contested by Jarrett Anunoby (3.5 feet, ZONE). Bones Anunoby misses. Rebound secured by Stephen Ingram.

[05:44] Team_041 possession (Score: 27-16)
Stephen Ingram attempts a 3Pt. Contested by Klay Stewart (5.8 feet, ZONE). STEPHEN INGRAM MAKES IT! Assist: Scottie Turner
Score: 27-19

[05:29] Team_018 possession (Score: 27-19)
Klay Stewart makes the 3Pt and draws the foul on Scottie Turner! And-1! Klay Stewart to the line for 1. [BONUS: 6 team fouls] (Scottie Turner: 3 personal fouls)   FT 1/1: GOOD Klay Stewart makes 1/1 from the line.
Score: 31-19

[05:16] Team_041 possession (Score: 31-19)
Jarrett Anunoby drives, Tracy Bryant stays with him. Jarrett Anunoby attempts a Dunk. Contested by Tracy Bryant (5.9 feet, MAN). JARRETT ANUNOBY MAKES IT! Assist: Dejounte Griffin
Score: 31-21

[04:57] Team_018 possession (Score: 31-21)
Tracy Bryant attempts a 3Pt. Contested by Scottie Turner (4.7 feet, ZONE). Tracy Bryant misses. Rebound secured by Stephen Ingram.

[04:39] Team_041 possession (Score: 31-21)
FOUL! Shooting foul on Domantas Wall. Jarrett Anunoby to the line for 2 free throws. [BONUS: 7 team fouls] (Domantas Wall: 5 personal fouls)   FT 1/2: GOOD   FT 2/2: GOOD Jarrett Anunoby makes 2/2 from the line.
Score: 31-23

[04:26] Team_018 possession (Score: 31-23)
Domantas Wall drives and kicks out. Klay Stewart attempts a 3Pt. Contested by Scottie Turner (4.4 feet, MAN). Klay Stewart misses. Rebound secured by Terry Barrett.

[04:11] Team_041 possession (Score: 31-23)
Stephen Ingram drives, Domantas Wall stays with him. Stephen Ingram attempts a Layup. Contested by Domantas Wall (5.8 feet, ZONE). STEPHEN INGRAM MAKES IT! Assist: Terry Barrett
Score: 31-25

[03:59] Team_018 possession (Score: 31-25)
Tracy Bryant drives to the basket... Tracy Bryant throws a bad pass out of bounds! TURNOVER! (dead ball)

[03:46] Team_041 possession (Score: 31-25)
Jarrett Anunoby attempts a 3Pt. Contested by Bones Anunoby (2.2 feet, ZONE). Jarrett Anunoby misses. Rebound secured by Allen Markkanen.

[03:34] Team_018 possession (Score: 31-25)
Domantas Wall drives, Terry Barrett stays with him. Domantas Wall attempts a Dunk. Heavily contested by Terry Barrett (0.5 feet, MAN)! DOMANTAS WALL MAKES IT! Assist: Allen Markkanen
Score: 33-25

[03:18] Team_041 possession (Score: 33-25)
Terry Barrett drives to the basket... FOUL! Offensive foul on Terry Barrett! Domantas Wall drew the charge! [Team fouls: 7] (Terry Barrett: 3 personal fouls) TURNOVER! (dead ball)

[03:04] Team_018 possession (Score: 33-25)
Klay Stewart attempts a 3Pt. Wide open! Scottie Turner is 9.8 feet away. [ZONE] Klay Stewart misses. Rebound secured by Dejounte Griffin.

[02:51] Team_041 possession (Score: 33-25)
Terry Barrett drives, Domantas Wall stays with him. Terry Barrett attempts a Layup. Contested by Domantas Wall (5.4 feet, MAN). TERRY BARRETT MAKES IT!
Score: 33-27

[02:36] Team_018 possession (Score: 33-27)
Tracy Bryant attempts a 3Pt. Contested by Scottie Turner (3.1 feet, ZONE). TRACY BRYANT MAKES IT! Assist: Klay Stewart
Score: 36-27

[02:19] Team_041 possession (Score: 36-27)
Terry Barrett drives to the basket... Terry Barrett loses the ball! Stripped by Domantas Wall! TURNOVER! (live ball)

[02:07] Team_018 possession (Score: 36-27)
Domantas Wall makes the Layup and draws the foul on Terry Barrett! And-1! Domantas Wall to the line for 1. [BONUS: 8 team fouls] (Terry Barrett: 4 personal fouls)   FT 1/1: GOOD Domantas Wall makes 1/1 from the line.
Score: 39-27

[01:52] Team_041 possession (Score: 39-27)
Terry Barrett drives, picks up Domantas Wall. Help arrives from Klay Stewart! Terry Barrett attempts a Dunk. Contested by Klay Stewart (3.6 feet, MAN). TERRY BARRETT MAKES IT! Assist: Jarrett Anunoby
Score: 39-29

[01:37] Team_018 possession (Score: 39-29)
Tracy Bryant attempts a Layup. Heavily contested by Jarrett Anunoby (1.2 feet, MAN)! TRACY BRYANT MAKES IT!
Score: 41-29

[01:22] Team_041 possession (Score: 41-29)
Terry Barrett drives to the basket... Terry Barrett loses control! Ball rolls out of bounds! TURNOVER! (dead ball)

[01:22] Substitution (Team_018): Klay Stewart OUT → Michael Simons IN (stamina_rule2)

[01:22] Substitution (Team_018): Tracy Bryant OUT → Miles Herro IN (stamina_rule2)

[01:22] Substitution (Team_018): Allen Markkanen OUT → Austin Antetokounmpo IN (stamina_rule2)

[01:22] Substitution (Team_018): Bones Anunoby OUT → Shai Wade IN (stamina_rule2)

[01:22] Substitution (Team_018): Domantas Wall OUT → Julius Jackson IN (stamina_rule2)

[01:22] Substitution (Team_041): Scottie Turner OUT → Franz Rose IN (stamina_rule2)

[01:22] Substitution (Team_041): Jarrett Anunoby OUT → Kyrie Booker IN (stamina_rule2)

[01:22] Substitution (Team_041): Dejounte Griffin OUT → Bam McCollum IN (stamina_rule2)

[01:22] Substitution (Team_041): Stephen Ingram OUT → Tobias McCollum IN (stamina_rule2)

[01:22] Substitution (Team_041): Terry Barrett OUT → De'Aaron Poole IN (stamina_rule2)

[01:08] Team_018 possession (Score: 41-29)
Julius Jackson drives to the basket... Julius Jackson throws a bad pass! Stolen by Tobias McCollum! TURNOVER! (live ball)

[00:51] Team_041 possession (Score: 41-29)
Tobias McCollum commits a violation (traveling/carry)! TURNOVER! (dead ball)

[00:35] Team_018 possession (Score: 41-29)
Austin Antetokounmpo attempts a Midrange. Wide open! Bam McCollum is 6.7 feet away. [ZONE] Austin Antetokounmpo misses. Rebound secured by Tobias McCollum.

[00:20] Team_041 possession (Score: 41-29)
Tobias McCollum makes the Midrange and draws the foul on Michael Simons! And-1! Tobias McCollum to the line for 1. [BONUS: 8 team fouls] (Michael Simons: 1 personal fouls)   FT 1/1: GOOD Tobias McCollum makes 1/1 from the line.
Score: 41-32

[00:07] Team_018 possession (Score: 41-32)
Austin Antetokounmpo attempts a 3Pt. Contested by Bam McCollum (4.1 feet, MAN). Austin Antetokounmpo misses. Rebound secured by Kyrie Booker.

================================================================================
                              1ST QUARTER COMPLETE                              
================================================================================

1ST QUARTER SCORE: Team_018 41, Team_041 32

BOX SCORE:
================================================================================

Team_018
--------------------------------------------------------------------------------
Player                MIN  PTS  REB  AST  TO      FG   FG%      3P   3P%
--------------------------------------------------------------------------------
Klay Stewart           11   13    0    2   0   4/5    80.0     0/0   0.0
Domantas Wall          11   12    2    0   0   5/6    83.3     0/0   0.0
Allen Markkanen        11    6    5    2   0   2/2   100.0     0/0   0.0
Bones Anunoby          11    5    2    1   0   2/4    50.0     0/0   0.0
Tracy Bryant           11    5    0    0   0   2/3    66.7     0/0   0.0
Austin Antetokounmpo    1    0    0    0   0   0/2     0.0     0/0   0.0

TEAM: FG: 15/22 (68.2%), 3PT: 4/7 (57.1%), REB: 10 (1 off, 9 def), AST: 5, TO: 4
TEAM FOULS: 8 [Team_041 in BONUS]


Team_041
--------------------------------------------------------------------------------
Player                MIN  PTS  REB  AST  TO      FG   FG%      3P   3P%
--------------------------------------------------------------------------------
Stephen Ingram         11    7    2    0   0   3/4    75.0     0/0   0.0
Terry Barrett          11    6    3    1   0   3/5    60.0     0/0   0.0
Dejounte Griffin       11    5    1    2   0   2/3    66.7     0/0   0.0
Jarrett Anunoby        11    4    0    2   0   2/7    28.6     0/0   0.0
Tobias McCollum         1    3    1    0   0   1/1   100.0     0/0   0.0
Scottie Turner         11    2    0    1   0   1/1   100.0     0/0   0.0
Kyrie Booker            1    0    1    0   0   0/0     0.0     0/0   0.0

TEAM: FG: 12/21 (57.1%), 3PT: 1/3 (33.3%), REB: 7 (0 off, 7 def), AST: 6, TO: 4
TEAM FOULS: 8 [Team_018 in BONUS]

================================================================================

================================================================================
                       2ND QUARTER - Team_018 vs Team_041                       
================================================================================

[12:00] Team_018 possession (Score: 41-32)
Domantas Wall makes the Dunk and draws the foul on Terry Barrett! And-1! Domantas Wall to the line for 1. [Team fouls: 1] (Terry Barrett: 1 personal fouls)   FT 1/1: GOOD Domantas Wall makes 1/1 from the line.
Score: 44-32

[11:44] Team_041 possession (Score: 44-32)
Terry Barrett attempts a Layup. Contested by Domantas Wall (3.4 feet, MAN). TERRY BARRETT MAKES IT!
Score: 44-34

[11:30] Team_018 possession (Score: 44-34)
FOUL! Shooting foul on Terry Barrett. Domantas Wall to the line for 2 free throws. [Team fouls: 2] (Terry Barrett: 2 personal fouls)   FT 1/2: GOOD   FT 2/2: GOOD Domantas Wall makes 2/2 from the line.
Score: 46-34

[11:16] Team_041 possession (Score: 46-34)
Stephen Ingram attempts a 3Pt. Contested by Klay Stewart (6.0 feet, ZONE). Stephen Ingram misses. Rebound secured by Bones Anunoby.

[11:03] Team_018 possession (Score: 46-34)
Bones Anunoby attempts a Midrange. Contested by Stephen Ingram (3.3 feet, MAN). Bones Anunoby misses. Rebound secured by Dejounte Griffin.

[10:46] Team_041 possession (Score: 46-34)
FOUL! Reach-in foul on Klay Stewart during the drive. [Team fouls: 1] No free throws, side out. (Klay Stewart: 1 personal fouls)

[10:33] Team_041 possession (Score: 46-34)
Terry Barrett drives, Domantas Wall stays with him. Terry Barrett attempts a Layup. Contested by Domantas Wall (4.1 feet, ZONE). Terry Barrett misses. Rebound secured by Allen Markkanen.

[10:21] Team_018 possession (Score: 46-34)
FOUL! Reach-in foul on Jarrett Anunoby during the drive. [Team fouls: 3] No free throws, side out. (Jarrett Anunoby: 1 personal fouls)

[10:07] Team_018 possession (Score: 46-34)
Tracy Bryant drives to the basket... Tracy Bryant throws a bad pass! Stolen by Jarrett Anunoby! TURNOVER! (live ball)

[09:54] Team_041 possession (Score: 46-34)
Terry Barrett attempts a Midrange. Contested by Allen Markkanen (3.8 feet, ZONE). Terry Barrett misses. Rebound secured by Allen Markkanen.

[09:35] Team_018 possession (Score: 46-34)
Tracy Bryant drives, picks up Terry Barrett. Help arrives from Jarrett Anunoby! Tracy Bryant attempts a Layup. Contested by Jarrett Anunoby (5.1 feet, ZONE). TRACY BRYANT MAKES IT!
Score: 48-34

[09:19] Team_041 possession (Score: 48-34)
Stephen Ingram attempts a Midrange. Contested by Bones Anunoby (4.1 feet, ZONE). Stephen Ingram misses. Rebound secured by Bones Anunoby.

[09:09] Team_018 possession (Score: 48-34)
Klay Stewart attempts a 3Pt. Contested by Scottie Turner (5.5 feet, ZONE). Klay Stewart misses. Rebound secured by Dejounte Griffin.

[08:59] Team_041 possession (Score: 48-34)
Stephen Ingram drives, picks up Domantas Wall. Help arrives from Klay Stewart! Stephen Ingram attempts a Dunk. Contested by Klay Stewart (3.5 feet, ZONE). STEPHEN INGRAM MAKES IT! Assist: Dejounte Griffin
Score: 48-36

[08:46] Team_018 possession (Score: 48-36)
FOUL! Holding foul on Stephen Ingram. [Team fouls: 4] No free throws, side out. (Stephen Ingram: 1 personal fouls)

[08:36] Team_018 possession (Score: 48-36)
Allen Markkanen attempts a 3Pt. Heavily contested by Stephen Ingram (1.2 feet, ZONE)! ALLEN MARKKANEN MAKES IT! Assist: Domantas Wall
Score: 51-36

[08:22] Team_041 possession (Score: 51-36)
FOUL! Shooting foul on Domantas Wall. Terry Barrett to the line for 2 free throws. [Team fouls: 2] (Domantas Wall: 1 personal fouls)   FT 1/2: GOOD   FT 2/2: MISS Terry Barrett makes 1/2 from the line. Rebound secured by Bones Anunoby.
Score: 51-37

[08:11] Team_018 possession (Score: 51-37)
Bones Anunoby attempts a Midrange. Contested by Stephen Ingram (3.6 feet, MAN). Bones Anunoby misses. Rebound secured by Terry Barrett.

[08:00] Team_041 possession (Score: 51-37)
Stephen Ingram drives to the basket... Stephen Ingram throws a bad pass! Stolen by Domantas Wall! TURNOVER! (live ball)

[07:42] Team_018 possession (Score: 51-37)
Bones Anunoby drives, Stephen Ingram stays with him. Bones Anunoby attempts a Layup. Contested by Stephen Ingram (4.5 feet, MAN). BONES ANUNOBY MAKES IT! Assist: Allen Markkanen
Score: 53-37

[07:27] Team_041 possession (Score: 53-37)
Scottie Turner loses the ball! Stripped by Klay Stewart! TURNOVER! (live ball)

[07:10] Team_018 possession (Score: 53-37)
Bones Anunoby drives, Stephen Ingram stays with him. Bones Anunoby attempts a Layup. Contested by Stephen Ingram (5.7 feet, MAN). BONES ANUNOBY MAKES IT!
Score: 55-37

[07:00] Team_041 possession (Score: 55-37)
Stephen Ingram drives, picks up Domantas Wall. Help arrives from Klay Stewart! Stephen Ingram attempts a Dunk. Contested by Klay Stewart (3.2 feet, ZONE). STEPHEN INGRAM MAKES IT!
Score: 55-39

[06:46] Team_018 possession (Score: 55-39)
Klay Stewart attempts a 3Pt. Contested by Scottie Turner (4.8 feet, ZONE). Klay Stewart misses. Rebound secured by Terry Barrett.

[06:29] Team_041 possession (Score: 55-39)
FOUL! Holding foul on Allen Markkanen. [Team fouls: 3] No free throws, side out. (Allen Markkanen: 1 personal fouls)

[06:16] Team_041 possession (Score: 55-39)
Scottie Turner drives, Klay Stewart stays with him. Scottie Turner attempts a Layup. Contested by Klay Stewart (5.8 feet, MAN). SCOTTIE TURNER MAKES IT! Assist: Stephen Ingram
Score: 55-41

[06:01] Team_018 possession (Score: 55-41)
Domantas Wall drives to the basket... Domantas Wall throws a bad pass out of bounds! TURNOVER! (dead ball)

[06:01] Substitution (Team_018): Klay Stewart OUT → Michael Simons IN (stamina_rule2)

[06:01] Substitution (Team_018): Tracy Bryant OUT → Miles Herro IN (stamina_rule2)

[06:01] Substitution (Team_018): Allen Markkanen OUT → Austin Antetokounmpo IN (stamina_rule2)

[06:01] Substitution (Team_018): Bones Anunoby OUT → Shai Wade IN (stamina_rule2)

[06:01] Substitution (Team_018): Domantas Wall OUT → Julius Jackson IN (stamina_rule2)

[06:01] Substitution (Team_041): Scottie Turner OUT → Franz Rose IN (stamina_rule2)

[06:01] Substitution (Team_041): Jarrett Anunoby OUT → Kyrie Booker IN (stamina_rule2)

[06:01] Substitution (Team_041): Dejounte Griffin OUT → Bam McCollum IN (stamina_rule2)

[06:01] Substitution (Team_041): Stephen Ingram OUT → Tobias McCollum IN (stamina_rule2)

[06:01] Substitution (Team_041): Terry Barrett OUT → De'Aaron Poole IN (stamina_rule2)

[05:47] Team_041 possession (Score: 55-41)
De'Aaron Poole attempts a Layup. Wide open! Julius Jackson is 9.5 feet away. [ZONE] DE'AARON POOLE MAKES IT! Assist: Franz Rose
Score: 55-43

[05:31] Team_018 possession (Score: 55-43)
Julius Jackson attempts a Layup. Contested by De'Aaron Poole (5.1 feet, MAN). JULIUS JACKSON MAKES IT!
Score: 57-43

[05:20] Team_041 possession (Score: 57-43)
De'Aaron Poole drives to the basket... De'Aaron Poole throws a bad pass! Stolen by Julius Jackson! TURNOVER! (live ball)

[05:04] Team_018 possession (Score: 57-43)
Michael Simons attempts a 3Pt. Wide open! Franz Rose is 7.0 feet away. [MAN] Michael Simons misses. Rebound secured by Tobias McCollum.

[04:52] Team_041 possession (Score: 57-43)
Tobias McCollum attempts a 3Pt. Contested by Shai Wade (5.0 feet, MAN). TOBIAS MCCOLLUM MAKES IT! Assist: Franz Rose
Score: 57-46

[04:41] Team_018 possession (Score: 57-46)
Miles Herro attempts a Layup. Contested by Kyrie Booker (3.3 feet, MAN). MILES HERRO MAKES IT!
Score: 59-46

[04:27] Team_041 possession (Score: 59-46)
Tobias McCollum loses the ball! Stripped by Shai Wade! TURNOVER! (live ball)

[04:13] Team_018 possession (Score: 59-46)
Austin Antetokounmpo attempts a Midrange. Contested by Bam McCollum (5.4 feet, MAN). Austin Antetokounmpo misses. Rebound secured by De'Aaron Poole.

[04:00] Team_041 possession (Score: 59-46)
Kyrie Booker drives to the basket... Kyrie Booker loses the ball! Stripped by Julius Jackson! TURNOVER! (live ball)

[03:48] Team_018 possession (Score: 59-46)
Julius Jackson attempts a Midrange. Contested by Bam McCollum (5.3 feet, ZONE). Julius Jackson misses. Rebound secured by De'Aaron Poole.

[03:34] Team_041 possession (Score: 59-46)
Tobias McCollum attempts a Layup. Contested by Julius Jackson (5.2 feet, ZONE). Tobias McCollum misses. Rebound secured by Julius Jackson.

[03:20] Team_018 possession (Score: 59-46)
Austin Antetokounmpo attempts a Layup. BLOCKED BY BAM MCCOLLUM! Ball is loose! Offensive rebound by Julius Jackson! Julius Jackson kicks it out.

[03:07] Team_018 possession (Score: 59-46)
Michael Simons makes the Dunk and draws the foul on Franz Rose! And-1! Michael Simons to the line for 1. [BONUS: 5 team fouls] (Franz Rose: 1 personal fouls)   FT 1/1: GOOD Michael Simons makes 1/1 from the line.
Score: 62-46

[02:53] Team_041 possession (Score: 62-46)
Tobias McCollum drives, picks up Julius Jackson. Help arrives from Miles Herro! Tobias McCollum attempts a Layup. Contested by Miles Herro (3.7 feet, ZONE). Tobias McCollum misses. FOUL! Loose ball foul on Shai Wade during the rebound battle. [Team fouls: 4] No free throws, side out. (Shai Wade: 1 personal fouls)

[02:41] Team_041 possession (Score: 62-46)
Tobias McCollum attempts a 3Pt. Wide open! Michael Simons is 6.9 feet away. [ZONE] Tobias McCollum misses. Rebound secured by Shai Wade.

[02:27] Team_018 possession (Score: 62-46)
Julius Jackson drives, De'Aaron Poole stays with him. Julius Jackson attempts a Dunk. Wide open! De'Aaron Poole is 6.1 feet away. [MAN] Julius Jackson misses. Rebound secured by De'Aaron Poole.

[02:10] Team_041 possession (Score: 62-46)
Bam McCollum drives to the basket... Bam McCollum throws a bad pass out of bounds! TURNOVER! (dead ball)

[01:57] Team_018 possession (Score: 62-46)
Austin Antetokounmpo attempts a Layup. Contested by Bam McCollum (5.8 feet, MAN). Austin Antetokounmpo misses. Rebound secured by De'Aaron Poole.

[01:38] Team_041 possession (Score: 62-46)
FOUL! Holding foul on Austin Antetokounmpo. [IN THE BONUS! 5 team fouls] Bam McCollum to the line for 2 free throws. (Austin Antetokounmpo: 1 personal fouls)   FT 1/2: GOOD   FT 2/2: GOOD Bam McCollum makes 2/2 from the line.
Score: 62-48

[01:24] Team_018 possession (Score: 62-48)
Julius Jackson attempts a Layup. Contested by De'Aaron Poole (4.0 feet, MAN). JULIUS JACKSON MAKES IT!
Score: 64-48

[01:11] Team_041 possession (Score: 64-48)
Kyrie Booker drives and kicks out. De'Aaron Poole attempts a 3Pt. Contested by Julius Jackson (5.2 feet, MAN). De'Aaron Poole misses. Rebound secured by Shai Wade.

[00:53] Team_018 possession (Score: 64-48)
Julius Jackson attempts a Midrange. Contested by De'Aaron Poole (5.4 feet, MAN). Julius Jackson misses. Offensive rebound by Shai Wade! Shai Wade kicks it out.

[00:40] Team_018 possession (Score: 64-48)
Shai Wade attempts a 3Pt. Contested by Kyrie Booker (4.4 feet, ZONE). Shai Wade misses. Rebound secured by De'Aaron Poole.

[00:24] Team_041 possession (Score: 64-48)
Franz Rose attempts a Midrange. Contested by Michael Simons (3.7 feet, MAN). Franz Rose misses. Rebound secured by Julius Jackson.

[00:10] Team_018 possession (Score: 64-48)
Julius Jackson drives, De'Aaron Poole stays with him. Julius Jackson attempts a Dunk. Contested by De'Aaron Poole (4.8 feet, MAN). JULIUS JACKSON MAKES IT! Assist: Shai Wade
Score: 66-48

================================================================================
                              2ND QUARTER COMPLETE                              
================================================================================

2ND QUARTER SCORE: Team_018 25, Team_041 16

BOX SCORE:
================================================================================

Team_018
--------------------------------------------------------------------------------
Player                MIN  PTS  REB  AST  TO      FG   FG%      3P   3P%
--------------------------------------------------------------------------------
Julius Jackson          7    6    3    0   0   3/5    60.0     0/0   0.0
Domantas Wall          17    5    0    1   0   2/2   100.0     0/0   0.0
Bones Anunoby          17    4    3    0   0   2/4    50.0     0/0   0.0
Allen Markkanen        17    3    2    1   0   1/1   100.0     0/0   0.0
Michael Simons          7    3    0    0   0   1/2    50.0     0/0   0.0
Tracy Bryant           17    2    0    0   0   1/1   100.0     0/0   0.0
Miles Herro             7    2    0    0   0   1/1   100.0     0/0   0.0
Klay Stewart           17    0    0    0   0   0/2     0.0     0/0   0.0
Austin Antetokounmpo    7    0    0    0   0   0/2     0.0     0/0   0.0
Shai Wade               7    0    3    1   0   0/1     0.0     0/0   0.0

TEAM: FG: 11/21 (52.4%), 3PT: 1/5 (20.0%), REB: 11 (2 off, 9 def), AST: 3, TO: 2
TEAM FOULS: 5 [Team_041 in BONUS]


Team_041
--------------------------------------------------------------------------------
Player                MIN  PTS  REB  AST  TO      FG   FG%      3P   3P%
--------------------------------------------------------------------------------
Stephen Ingram         17    4    0    1   0   2/4    50.0     0/0   0.0
Tobias McCollum         7    3    1    0   0   1/3    33.3     0/0   0.0
Terry Barrett          17    2    2    0   0   1/4    25.0     0/0   0.0
Scottie Turner         17    2    0    0   0   1/1   100.0     0/0   0.0
De'Aaron Poole          7    2    6    0   0   1/1   100.0     0/0   0.0
Bam McCollum            7    2    0    0   0   1/1   100.0     0/0   0.0
Dejounte Griffin       17    0    2    1   0   0/0     0.0     0/0   0.0
Franz Rose              7    0    0    2   0   0/1     0.0     0/0   0.0
Kyrie Booker            7    0    0    0   0   0/1     0.0     0/0   0.0

TEAM: FG: 7/16 (43.8%), 3PT: 1/3 (33.3%), REB: 11 (1 off, 10 def), AST: 4, TO: 6
TEAM FOULS: 5 [Team_018 in BONUS]

================================================================================

================================================================================
                       3RD QUARTER - Team_018 vs Team_041                       
================================================================================

[12:00] Team_018 possession (Score: 66-48)
Domantas Wall drives, picks up Terry Barrett. Help arrives from Jarrett Anunoby! Domantas Wall attempts a Dunk. Wide open! Jarrett Anunoby is 6.2 feet away. [MAN] DOMANTAS WALL MAKES IT! Assist: Allen Markkanen
Score: 68-48

[11:45] Team_041 possession (Score: 68-48)
FOUL! Holding foul on Allen Markkanen. [Team fouls: 1] No free throws, side out. (Allen Markkanen: 1 personal fouls)

[11:30] Team_041 possession (Score: 68-48)
Jarrett Anunoby attempts a Midrange. Contested by Bones Anunoby (5.2 feet, ZONE). Jarrett Anunoby misses. Rebound secured by Bones Anunoby.

[11:13] Team_018 possession (Score: 68-48)
Allen Markkanen drives, picks up Dejounte Griffin. Help arrives from Jarrett Anunoby! Allen Markkanen attempts a Layup. Wide open! Jarrett Anunoby is 6.2 feet away. [MAN] ALLEN MARKKANEN MAKES IT!
Score: 70-48

[10:59] Team_041 possession (Score: 70-48)
Stephen Ingram drives and kicks out. Terry Barrett attempts a 3Pt. Wide open! Klay Stewart is 6.1 feet away. [ZONE] Terry Barrett misses. Rebound secured by Bones Anunoby.

[10:42] Team_018 possession (Score: 70-48)
Allen Markkanen drives to the basket... Allen Markkanen throws a bad pass! Stolen by Terry Barrett! TURNOVER! (live ball)

[10:29] Team_041 possession (Score: 70-48)
Dejounte Griffin attempts a 3Pt. Heavily contested by Klay Stewart (1.7 feet, ZONE)! Dejounte Griffin misses. Rebound secured by Domantas Wall.

[10:15] Team_018 possession (Score: 70-48)
Klay Stewart drives, Terry Barrett stays with him. Klay Stewart attempts a Layup. Contested by Terry Barrett (2.8 feet, ZONE). KLAY STEWART MAKES IT! Assist: Bones Anunoby
Score: 72-48

[10:00] Team_041 possession (Score: 72-48)
Dejounte Griffin drives and kicks out. Jarrett Anunoby attempts a Midrange. Contested by Bones Anunoby (2.1 feet, ZONE). Jarrett Anunoby misses. Rebound secured by Domantas Wall.

[09:46] Team_018 possession (Score: 72-48)
Tracy Bryant drives, picks up Jarrett Anunoby. Help arrives from Dejounte Griffin! Tracy Bryant attempts a Layup. Heavily contested by Dejounte Griffin (1.6 feet, MAN)! Tracy Bryant misses. Rebound secured by Stephen Ingram.

[09:29] Team_041 possession (Score: 72-48)
Dejounte Griffin attempts a Layup. Heavily contested by Allen Markkanen (0.5 feet, MAN)! DEJOUNTE GRIFFIN MAKES IT! Assist: Stephen Ingram
Score: 72-50

[09:12] Team_018 possession (Score: 72-50)
Allen Markkanen commits a violation (traveling/carry)! TURNOVER! (dead ball)

[09:02] Team_041 possession (Score: 72-50)
Terry Barrett attempts a Layup. Contested by Domantas Wall (3.8 feet, ZONE). TERRY BARRETT MAKES IT!
Score: 72-52

[08:47] Team_018 possession (Score: 72-52)
Tracy Bryant attempts a 3Pt. Contested by Scottie Turner (5.4 feet, ZONE). Tracy Bryant misses. Rebound secured by Terry Barrett.

[08:32] Team_041 possession (Score: 72-52)
Dejounte Griffin makes the Layup and draws the foul on Allen Markkanen! And-1! Dejounte Griffin to the line for 1. [Team fouls: 2] (Allen Markkanen: 2 personal fouls)   FT 1/1: GOOD Dejounte Griffin makes 1/1 from the line.
Score: 72-55

[08:21] Team_018 possession (Score: 72-55)
Bones Anunoby attempts a 3Pt. Contested by Scottie Turner (5.6 feet, ZONE). Bones Anunoby misses. Offensive rebound by Bones Anunoby! Bones Anunoby kicks it out.

[08:05] Team_018 possession (Score: 72-55)
Tracy Bryant loses the ball! Stripped by Jarrett Anunoby! TURNOVER! (live ball)

[07:48] Team_041 possession (Score: 72-55)
Scottie Turner attempts a Layup. Contested by Domantas Wall (4.4 feet, ZONE). SCOTTIE TURNER MAKES IT!
Score: 72-57

[07:35] Team_018 possession (Score: 72-57)
Bones Anunoby attempts a 3Pt. Wide open! Scottie Turner is 6.4 feet away. [ZONE] Bones Anunoby misses. Offensive rebound by Bones Anunoby! Bones Anunoby kicks it out.

[07:22] Team_018 possession (Score: 72-57)
Klay Stewart makes the 3Pt and draws the foul on Scottie Turner! And-1! Klay Stewart to the line for 1. [Team fouls: 1] (Scottie Turner: 1 personal fouls)   FT 1/1: MISS Klay Stewart makes 0/1 from the line. Offensive rebound by Bones Anunoby! Bones Anunoby kicks it out.
Score: 75-57

[07:06] Team_018 possession (Score: 75-57)
Bones Anunoby attempts a Layup. Contested by Terry Barrett (2.2 feet, ZONE). BONES ANUNOBY MAKES IT! Assist: Tracy Bryant
Score: 77-57

[06:52] Team_041 possession (Score: 77-57)
Dejounte Griffin drives, picks up Domantas Wall. Help arrives from Klay Stewart! Dejounte Griffin attempts a Layup. Wide open! Klay Stewart is 6.7 feet away. [ZONE] DEJOUNTE GRIFFIN MAKES IT!
Score: 77-59

[06:38] Team_018 possession (Score: 77-59)
Domantas Wall drives, Terry Barrett stays with him. Domantas Wall attempts a Layup. Contested by Terry Barrett (4.3 feet, MAN). DOMANTAS WALL MAKES IT! Assist: Tracy Bryant
Score: 79-59

[06:26] Team_041 possession (Score: 79-59)
Terry Barrett attempts a 3Pt. Contested by Klay Stewart (5.4 feet, ZONE). Terry Barrett misses. Rebound secured by Bones Anunoby.

[06:14] Team_018 possession (Score: 79-59)
Bones Anunoby attempts a Layup. Contested by Stephen Ingram (5.1 feet, MAN). BONES ANUNOBY MAKES IT! Assist: Tracy Bryant
Score: 81-59

[05:57] Team_041 possession (Score: 81-59)
Scottie Turner attempts a 3Pt. Contested by Tracy Bryant (3.8 feet, ZONE). SCOTTIE TURNER MAKES IT! Assist: Stephen Ingram
Score: 81-62

[05:39] Team_018 possession (Score: 81-62)
Allen Markkanen drives, picks up Dejounte Griffin. Help arrives from Jarrett Anunoby! Allen Markkanen attempts a Dunk. Contested by Jarrett Anunoby (5.1 feet, MAN). Allen Markkanen misses. Rebound secured by Dejounte Griffin.

[05:25] Team_041 possession (Score: 81-62)
FOUL! Shooting foul on Allen Markkanen. Stephen Ingram to the line for 3 free throws. [Team fouls: 3] (Allen Markkanen: 3 personal fouls)   FT 1/3: MISS   FT 2/3: MISS   FT 3/3: GOOD Stephen Ingram makes 1/3 from the line.
Score: 81-63

[05:12] Team_018 possession (Score: 81-63)
Klay Stewart attempts a Midrange. Contested by Jarrett Anunoby (4.8 feet, ZONE). KLAY STEWART MAKES IT!
Score: 83-63

[04:54] Team_041 possession (Score: 83-63)
Stephen Ingram attempts a Layup. Wide open! Bones Anunoby is 6.5 feet away. [MAN] Stephen Ingram misses. Offensive rebound by Terry Barrett! Terry Barrett's putback is no good. Rebound secured by Domantas Wall.

[04:40] Team_018 possession (Score: 83-63)
Domantas Wall attempts a Layup. Contested by Terry Barrett (4.3 feet, MAN). Domantas Wall misses. Rebound secured by Stephen Ingram.

[04:25] Team_041 possession (Score: 83-63)
Dejounte Griffin attempts a Midrange. Contested by Allen Markkanen (4.2 feet, MAN). DEJOUNTE GRIFFIN MAKES IT!
Score: 83-65

[04:11] Team_018 possession (Score: 83-65)
FOUL! Offensive foul on Domantas Wall! Terry Barrett drew the charge! [Team fouls: 4] (Domantas Wall: 1 personal fouls) TURNOVER! (dead ball)

[03:58] Team_041 possession (Score: 83-65)
Jarrett Anunoby attempts a 3Pt. Contested by Tracy Bryant (3.9 feet, MAN). Jarrett Anunoby misses. Rebound secured by Bones Anunoby.

[03:44] Team_018 possession (Score: 83-65)
Klay Stewart drives, Terry Barrett stays with him. Klay Stewart attempts a Layup. Heavily contested by Terry Barrett (1.0 feet, ZONE)! Klay Stewart misses. Rebound secured by Stephen Ingram.

[03:31] Team_041 possession (Score: 83-65)
Dejounte Griffin attempts a Midrange. Contested by Allen Markkanen (2.6 feet, MAN). DEJOUNTE GRIFFIN MAKES IT! Assist: Scottie Turner
Score: 83-67

[03:17] Team_018 possession (Score: 83-67)
Bones Anunoby drives and kicks out. Bones Anunoby attempts a Midrange. Contested by Jarrett Anunoby (3.6 feet, ZONE). Bones Anunoby misses. Rebound secured by Dejounte Griffin.

[03:02] Team_041 possession (Score: 83-67)
Terry Barrett drives to the basket... Terry Barrett loses control! Ball rolls out of bounds! TURNOVER! (dead ball)

[03:02] Substitution (Team_018): Domantas Wall OUT → Julius Jackson IN (stamina_rule2)

[03:02] Substitution (Team_041): Dejounte Griffin OUT → Bam McCollum IN (stamina_rule2)

[02:48] Team_018 possession (Score: 83-67)
Bones Anunoby attempts a 3Pt. Wide open! Stephen Ingram is 6.5 feet away. [MAN] Bones Anunoby misses. Rebound secured by Stephen Ingram.

[02:34] Team_041 possession (Score: 83-67)
Scottie Turner attempts a 3Pt. Contested by Klay Stewart (4.5 feet, MAN). SCOTTIE TURNER MAKES IT! Assist: Jarrett Anunoby
Score: 83-70

[02:17] Team_018 possession (Score: 83-70)
Julius Jackson drives, Terry Barrett stays with him. Julius Jackson attempts a Layup. Contested by Terry Barrett (3.5 feet, ZONE). Julius Jackson misses. Offensive rebound by Allen Markkanen! Allen Markkanen's putback is no good. Rebound secured by Terry Barrett.

[02:03] Team_041 possession (Score: 83-70)
Stephen Ingram attempts a 3Pt. Contested by Bones Anunoby (2.5 feet, MAN). Stephen Ingram misses. Rebound secured by Bones Anunoby.

[01:47] Team_018 possession (Score: 83-70)
Allen Markkanen attempts a 3Pt. Wide open! Scottie Turner is 6.7 feet away. [ZONE] Allen Markkanen misses. Rebound secured by Stephen Ingram.

[01:36] Team_041 possession (Score: 83-70)
Jarrett Anunoby attempts a 3Pt. Contested by Tracy Bryant (5.8 feet, MAN). Jarrett Anunoby misses. Rebound secured by Julius Jackson.

[01:19] Team_018 possession (Score: 83-70)
Klay Stewart attempts a 3Pt. Wide open! Stephen Ingram is 8.1 feet away. [ZONE] Klay Stewart misses. Rebound secured by Jarrett Anunoby.

[01:04] Team_041 possession (Score: 83-70)
Stephen Ingram drives, picks up Bones Anunoby. Help arrives from Klay Stewart! Stephen Ingram attempts a Dunk. Wide open! Klay Stewart is 6.6 feet away. [MAN] Stephen Ingram misses. Rebound secured by Allen Markkanen.

[00:44] Team_018 possession (Score: 83-70)
Allen Markkanen attempts a Midrange. Heavily contested by Bam McCollum (1.5 feet, MAN)! ALLEN MARKKANEN MAKES IT!
Score: 85-70

[00:33] Team_041 possession (Score: 85-70)
FOUL! Shooting foul on Bones Anunoby. Jarrett Anunoby to the line for 2 free throws. [BONUS: 5 team fouls] (Bones Anunoby: 1 personal fouls)   FT 1/2: GOOD   FT 2/2: GOOD Jarrett Anunoby makes 2/2 from the line.
Score: 85-72

[00:22] Team_018 possession (Score: 85-72)
Klay Stewart attempts a Layup. Contested by Scottie Turner (3.1 feet, MAN). KLAY STEWART MAKES IT! Assist: Bones Anunoby
Score: 87-72

[00:10] Team_041 possession (Score: 87-72)
Jarrett Anunoby attempts a Midrange. Contested by Bones Anunoby (2.3 feet, ZONE). JARRETT ANUNOBY MAKES IT! Assist: Stephen Ingram
Score: 87-74

================================================================================
                              3RD QUARTER COMPLETE                              
================================================================================

3RD QUARTER SCORE: Team_018 21, Team_041 26

BOX SCORE:
================================================================================

Team_018
--------------------------------------------------------------------------------
Player                MIN  PTS  REB  AST  TO      FG   FG%      3P   3P%
--------------------------------------------------------------------------------
Klay Stewart           29    6    0    0   0   3/5    60.0     0/0   0.0
Domantas Wall          26    4    3    0   0   2/3    66.7     0/0   0.0
Allen Markkanen        29    4    1    1   0   2/4    50.0     0/0   0.0
Bones Anunoby          29    4    8    2   0   2/4    50.0     0/0   0.0
Terry Barrett          29    2    2    0   0   1/2    50.0     0/0   0.0
Tracy Bryant           29    0    0    3   0   0/2     0.0     0/0   0.0
Julius Jackson         10    0    1    0   0   0/1     0.0     0/0   0.0

TEAM: FG: 9/19 (47.4%), 3PT: 0/4 (0.0%), REB: 13 (4 off, 9 def), AST: 6, TO: 4
TEAM FOULS: 5 [Team_041 in BONUS]


Team_041
--------------------------------------------------------------------------------
Player                MIN  PTS  REB  AST  TO      FG   FG%      3P   3P%
--------------------------------------------------------------------------------
Dejounte Griffin       26   11    2    0   0   5/7    71.4     0/0   0.0
Scottie Turner         29    8    0    1   0   3/3   100.0     0/0   0.0
Jarrett Anunoby        29    4    1    1   0   2/5    40.0     0/0   0.0
Stephen Ingram         29    1    5    3   0   1/5    20.0     0/0   0.0

TEAM: FG: 12/22 (54.5%), 3PT: 3/8 (37.5%), REB: 10 (1 off, 9 def), AST: 5, TO: 1
TEAM FOULS: 1

================================================================================

================================================================================
                       4TH QUARTER - Team_018 vs Team_041                       
================================================================================

[12:00] Team_018 possession (Score: 87-74)
Klay Stewart attempts a 3Pt. Contested by Scottie Turner (4.4 feet, MAN). Klay Stewart misses. Rebound secured by Stephen Ingram.

[11:44] Team_041 possession (Score: 87-74)
Dejounte Griffin drives, picks up Allen Markkanen. Help arrives from Klay Stewart! Dejounte Griffin attempts a Dunk. Contested by Klay Stewart (3.9 feet, MAN). DEJOUNTE GRIFFIN MAKES IT! Assist: Jarrett Anunoby
Score: 87-76

[11:32] Team_018 possession (Score: 87-76)
Bones Anunoby drives and kicks out. Klay Stewart attempts a 3Pt. Contested by Scottie Turner (4.9 feet, ZONE). Klay Stewart misses. Offensive rebound by Bones Anunoby! Bones Anunoby kicks it out.

[11:16] Team_018 possession (Score: 87-76)
FOUL! Reach-in foul on Jarrett Anunoby during the drive. [Team fouls: 1] No free throws, side out. (Jarrett Anunoby: 1 personal fouls)

[11:05] Team_018 possession (Score: 87-76)
Domantas Wall attempts a Layup. Contested by Terry Barrett (5.6 feet, ZONE). DOMANTAS WALL MAKES IT! Assist: Klay Stewart
Score: 89-76

[10:52] Team_041 possession (Score: 89-76)
Terry Barrett attempts a Midrange. Contested by Bones Anunoby (2.3 feet, ZONE). Terry Barrett misses. Rebound secured by Domantas Wall.

[10:35] Team_018 possession (Score: 89-76)
Allen Markkanen attempts a 3Pt. Contested by Dejounte Griffin (4.5 feet, MAN). Allen Markkanen misses. Rebound secured by Terry Barrett.

[10:20] Team_041 possession (Score: 89-76)
Jarrett Anunoby attempts a 3Pt. Contested by Klay Stewart (4.4 feet, ZONE). JARRETT ANUNOBY MAKES IT! Assist: Scottie Turner
Score: 89-79

[10:10] Team_018 possession (Score: 89-79)
Domantas Wall drives, Terry Barrett stays with him. Domantas Wall attempts a Dunk. Contested by Terry Barrett (3.1 feet, ZONE). DOMANTAS WALL MAKES IT!
Score: 91-79

[09:57] Team_041 possession (Score: 91-79)
Terry Barrett makes the Layup and draws the foul on Domantas Wall! And-1! Terry Barrett to the line for 1. [Team fouls: 1] (Domantas Wall: 1 personal fouls)   FT 1/1: GOOD Terry Barrett makes 1/1 from the line.
Score: 91-82

[09:44] Team_018 possession (Score: 91-82)
Bones Anunoby attempts a Layup. Contested by Terry Barrett (4.0 feet, ZONE). BONES ANUNOBY MAKES IT!
Score: 93-82

[09:29] Team_041 possession (Score: 93-82)
Jarrett Anunoby attempts a Midrange. Contested by Tracy Bryant (5.0 feet, MAN). JARRETT ANUNOBY MAKES IT! Assist: Terry Barrett
Score: 93-84

[09:17] Team_018 possession (Score: 93-84)
FOUL! Holding foul on Jarrett Anunoby. [Team fouls: 2] No free throws, side out. (Jarrett Anunoby: 2 personal fouls)

[09:04] Team_018 possession (Score: 93-84)
Bones Anunoby attempts a 3Pt. Contested by Stephen Ingram (4.2 feet, MAN). Bones Anunoby misses. Offensive rebound by Domantas Wall! Domantas Wall's putback is no good. Rebound secured by Terry Barrett.

[08:50] Team_041 possession (Score: 93-84)
Stephen Ingram drives to the basket... Stephen Ingram throws a bad pass out of bounds! TURNOVER! (dead ball)

[08:50] Substitution (Team_018): Klay Stewart OUT → Michael Simons IN (stamina_rule2)

[08:50] Substitution (Team_018): Tracy Bryant OUT → Miles Herro IN (stamina_rule2)

[08:50] Substitution (Team_018): Allen Markkanen OUT → Austin Antetokounmpo IN (stamina_rule2)

[08:50] Substitution (Team_018): Bones Anunoby OUT → Shai Wade IN (stamina_rule2)

[08:50] Substitution (Team_018): Domantas Wall OUT → Julius Jackson IN (stamina_rule2)

[08:50] Substitution (Team_041): Scottie Turner OUT → Franz Rose IN (stamina_rule2)

[08:50] Substitution (Team_041): Jarrett Anunoby OUT → Kyrie Booker IN (stamina_rule2)

[08:50] Substitution (Team_041): Dejounte Griffin OUT → Bam McCollum IN (stamina_rule2)

[08:50] Substitution (Team_041): Stephen Ingram OUT → Tobias McCollum IN (stamina_rule2)

[08:50] Substitution (Team_041): Terry Barrett OUT → De'Aaron Poole IN (stamina_rule2)

[08:35] Team_018 possession (Score: 93-84)
Michael Simons drives, Franz Rose stays with him. Michael Simons attempts a Layup. Wide open! Franz Rose is 9.0 feet away. [MAN] MICHAEL SIMONS MAKES IT!
Score: 95-84

[08:21] Team_041 possession (Score: 95-84)
Franz Rose attempts a 3Pt. Wide open! Michael Simons is 7.8 feet away. [ZONE] Franz Rose misses. Rebound secured by Shai Wade.

[08:11] Team_018 possession (Score: 95-84)
Shai Wade drives to the basket... Shai Wade loses the ball! Stripped by Tobias McCollum! TURNOVER! (live ball)

[07:59] Team_041 possession (Score: 95-84)
FOUL! Reach-in foul on Julius Jackson during the drive. [Team fouls: 2] No free throws, side out. (Julius Jackson: 1 personal fouls)

[07:41] Team_041 possession (Score: 95-84)
Tobias McCollum attempts a Layup. Wide open! Julius Jackson is 8.9 feet away. [ZONE] TOBIAS MCCOLLUM MAKES IT!
Score: 95-86

[07:26] Team_018 possession (Score: 95-86)
Miles Herro drives, Kyrie Booker stays with him. Miles Herro attempts a Layup. Wide open! Kyrie Booker is 6.3 feet away. [MAN] MILES HERRO MAKES IT! Assist: Shai Wade
Score: 97-86

[07:16] Team_041 possession (Score: 97-86)
Tobias McCollum attempts a Midrange. Wide open! Miles Herro is 6.2 feet away. [ZONE] TOBIAS MCCOLLUM MAKES IT!
Score: 97-88

[06:59] Team_018 possession (Score: 97-88)
Michael Simons attempts a 3Pt. Wide open! Franz Rose is 7.5 feet away. [MAN] Michael Simons misses. Rebound secured by Tobias McCollum.

[06:46] Team_041 possession (Score: 97-88)
Franz Rose attempts a 3Pt. Wide open! Shai Wade is 6.8 feet away. [ZONE] Franz Rose misses. Rebound secured by Shai Wade.

[06:31] Team_018 possession (Score: 97-88)
Shai Wade attempts a Midrange. Contested by Kyrie Booker (4.3 feet, ZONE). SHAI WADE MAKES IT!
Score: 99-88

[06:20] Team_041 possession (Score: 99-88)
Kyrie Booker commits a violation (traveling/carry)! TURNOVER! (dead ball)

[06:03] Team_018 possession (Score: 99-88)
FOUL! Shooting foul on De'Aaron Poole. Julius Jackson to the line for 2 free throws. [Team fouls: 3] (De'Aaron Poole: 1 personal fouls)   FT 1/2: GOOD   FT 2/2: GOOD Julius Jackson makes 2/2 from the line.
Score: 101-88

[05:46] Team_041 possession (Score: 101-88)
Franz Rose attempts a 3Pt. Contested by Michael Simons (4.4 feet, MAN). Franz Rose misses. Rebound secured by Julius Jackson.

[05:35] Team_018 possession (Score: 101-88)
Michael Simons attempts a Layup. Contested by Tobias McCollum (5.8 feet, ZONE). MICHAEL SIMONS MAKES IT!
Score: 103-88

[05:18] Team_041 possession (Score: 103-88)
Franz Rose drives, picks up Michael Simons. Help arrives from Miles Herro! Franz Rose attempts a Dunk. Wide open! Miles Herro is 8.6 feet away. [MAN] FRANZ ROSE MAKES IT! Assist: Bam McCollum
Score: 103-90

[05:03] Team_018 possession (Score: 103-90)
Austin Antetokounmpo drives, Tobias McCollum stays with him. Austin Antetokounmpo attempts a Layup. Contested by Tobias McCollum (5.5 feet, ZONE). Austin Antetokounmpo misses. Offensive rebound by Shai Wade! Shai Wade kicks it out.

[04:46] Team_018 possession (Score: 103-90)
Austin Antetokounmpo attempts a 3Pt. Contested by Bam McCollum (3.7 feet, MAN). Austin Antetokounmpo misses. Rebound secured by Kyrie Booker.

[04:34] Team_041 possession (Score: 103-90)
FOUL! Reach-in foul on Miles Herro during the drive. [Team fouls: 3] No free throws, side out. (Miles Herro: 1 personal fouls)

[04:22] Team_041 possession (Score: 103-90)
Franz Rose attempts a 3Pt. Contested by Michael Simons (4.8 feet, MAN). Franz Rose misses. Rebound secured by Austin Antetokounmpo.

[04:11] Team_018 possession (Score: 103-90)
Julius Jackson makes the Dunk and draws the foul on Tobias McCollum! And-1! Julius Jackson to the line for 1. [Team fouls: 4] (Tobias McCollum: 1 personal fouls)   FT 1/1: GOOD Julius Jackson makes 1/1 from the line.
Score: 106-90

[03:56] Team_041 possession (Score: 106-90)
FOUL! Shooting foul on Miles Herro. Bam McCollum to the line for 2 free throws. [Team fouls: 4] (Miles Herro: 2 personal fouls)   FT 1/2: GOOD   FT 2/2: GOOD Bam McCollum makes 2/2 from the line.
Score: 106-92

[03:41] Team_018 possession (Score: 106-92)
Michael Simons attempts a Midrange. Wide open! Bam McCollum is 7.4 feet away. [ZONE] MICHAEL SIMONS MAKES IT!
Score: 108-92

[03:28] Team_041 possession (Score: 108-92)
De'Aaron Poole drives and kicks out. Franz Rose attempts a Midrange. Contested by Austin Antetokounmpo (4.3 feet, ZONE). Franz Rose misses. Rebound secured by Austin Antetokounmpo.

[03:12] Team_018 possession (Score: 108-92)
Michael Simons drives to the basket... Michael Simons loses the ball! Stripped by Franz Rose! TURNOVER! (live ball)

[03:00] Team_041 possession (Score: 108-92)
De'Aaron Poole drives to the basket... De'Aaron Poole throws a bad pass out of bounds! TURNOVER! (dead ball)

[02:41] Team_018 possession (Score: 108-92)
Michael Simons attempts a 3Pt. Contested by Franz Rose (5.1 feet, ZONE). MICHAEL SIMONS MAKES IT! Assist: Miles Herro
Score: 111-92

[02:29] Team_041 possession (Score: 111-92)
Tobias McCollum attempts a 3Pt. Contested by Michael Simons (5.8 feet, ZONE). Tobias McCollum misses. Rebound secured by Austin Antetokounmpo.

[02:13] Team_018 possession (Score: 111-92)
Julius Jackson attempts a Layup. Contested by De'Aaron Poole (2.6 feet, MAN). JULIUS JACKSON MAKES IT! Assist: Shai Wade
Score: 113-92

[01:54] Team_041 possession (Score: 113-92)
De'Aaron Poole makes the Dunk and draws the foul on Julius Jackson! And-1! De'Aaron Poole to the line for 1. [BONUS: 5 team fouls] (Julius Jackson: 2 personal fouls)   FT 1/1: GOOD De'Aaron Poole makes 1/1 from the line.
Score: 113-95

[01:41] Team_018 possession (Score: 113-95)
Michael Simons attempts a 3Pt. Wide open! Franz Rose is 7.0 feet away. [MAN] Michael Simons misses. Rebound secured by Kyrie Booker.

[01:22] Team_041 possession (Score: 113-95)
Kyrie Booker attempts a 3Pt. Heavily contested by Miles Herro (1.9 feet, MAN)! KYRIE BOOKER MAKES IT! Assist: De'Aaron Poole
Score: 113-98

[01:06] Team_018 possession (Score: 113-98)
Miles Herro attempts a Midrange. Contested by Kyrie Booker (4.3 feet, ZONE). Miles Herro misses. Rebound secured by Tobias McCollum.

[00:52] Team_041 possession (Score: 113-98)
Tobias McCollum drives, Shai Wade stays with him. Tobias McCollum attempts a Layup. Wide open! Shai Wade is 6.2 feet away. [MAN] TOBIAS MCCOLLUM MAKES IT! Assist: Bam McCollum
Score: 113-100

[00:40] Team_018 possession (Score: 113-100)
Miles Herro attempts a 3Pt. Heavily contested by Kyrie Booker (1.5 feet, ZONE)! Miles Herro misses. Offensive rebound by Austin Antetokounmpo! Austin Antetokounmpo kicks it out.

[00:26] Team_018 possession (Score: 113-100)
Michael Simons attempts a 3Pt. Wide open! Franz Rose is 7.9 feet away. [MAN] MICHAEL SIMONS MAKES IT! Assist: Austin Antetokounmpo
Score: 116-100

[00:16] Team_041 possession (Score: 116-100)
Bam McCollum attempts a 3Pt. Wide open! Michael Simons is 6.4 feet away. [ZONE] BAM MCCOLLUM MAKES IT! Assist: Franz Rose
Score: 116-103

================================================================================
                              4TH QUARTER COMPLETE                              
================================================================================

4TH QUARTER SCORE: Team_018 29, Team_041 29

BOX SCORE:
================================================================================

Team_018
--------------------------------------------------------------------------------
Player                MIN  PTS  REB  AST  TO      FG   FG%      3P   3P%
--------------------------------------------------------------------------------
Michael Simons         16   12    0    0   0   5/7    71.4     0/0   0.0
Julius Jackson         19    7    1    0   0   3/3   100.0     0/0   0.0
Domantas Wall          30    4    1    0   0   2/2   100.0     0/0   0.0
Terry Barrett          33    3    2    1   0   1/2    50.0     0/0   0.0
Bones Anunoby          33    2    1    0   0   1/2    50.0     0/0   0.0
Shai Wade              16    2    3    2   0   1/1   100.0     0/0   0.0
Miles Herro            16    2    0    1   0   1/2    50.0     0/0   0.0
Klay Stewart           33    0    0    1   0   0/1     0.0     0/0   0.0
Allen Markkanen        33    0    0    0   0   0/1     0.0     0/0   0.0
Austin Antetokounmpo   16    0    4    1   0   0/1     0.0     0/0   0.0

TEAM: FG: 13/20 (65.0%), 3PT: 2/8 (25.0%), REB: 11 (4 off, 7 def), AST: 5, TO: 2
TEAM FOULS: 5 [Team_041 in BONUS]


Team_041
--------------------------------------------------------------------------------
Player                MIN  PTS  REB  AST  TO      FG   FG%      3P   3P%
--------------------------------------------------------------------------------
Tobias McCollum        16    6    2    0   0   3/4    75.0     0/0   0.0
Jarrett Anunoby        33    5    0    1   0   2/2   100.0     0/0   0.0
Bam McCollum           19    5    0    2   0   2/2   100.0     0/0   0.0
Kyrie Booker           16    3    2    0   0   1/1   100.0     0/0   0.0
De'Aaron Poole         16    3    0    1   0   1/2    50.0     0/0   0.0
Dejounte Griffin       30    2    0    0   0   1/1   100.0     0/0   0.0
Franz Rose             16    2    0    1   0   1/5    20.0     0/0   0.0
Stephen Ingram         33    0    1    0   0   0/0     0.0     0/0   0.0
Scottie Turner         33    0    0    1   0   0/0     0.0     0/0   0.0

TEAM: FG: 12/19 (63.2%), 3PT: 3/8 (37.5%), REB: 6 (0 off, 6 def), AST: 7, TO: 3
TEAM FOULS: 4

================================================================================

================================================================================
                               FULL GAME COMPLETE                               
================================================================================

FINAL SCORE: Team_018 116, Team_041 103

SCORING BY QUARTER:
--------------------------------------------------------------------------------
Team                     Q1     Q2     Q3     Q4    FINAL
--------------------------------------------------------------------------------
Team_018                 41     25     21     29      116
Team_041                 32     16     26     29      103
--------------------------------------------------------------------------------

FULL GAME BOX SCORE:
================================================================================

Team_018
--------------------------------------------------------------------------------
Player                MIN  PTS  REB  AST  TO      FG   FG%      3P   3P%      FT STL BLK
--------------------------------------------------------------------------------
Klay Stewart           33   19    0    3   1   7/13   53.8   2/7    28.6   2/3     1   0
Tracy Bryant           33    7    0    3   2   3/6    50.0   1/3    33.3   0/0     0   0
Allen Markkanen        33   13    8    4   3   5/8    62.5   1/3    33.3   2/2     0   0
Bones Anunoby          33   15   14    3   1   7/14   50.0   1/3    33.3   3/3     0   0
Domantas Wall          30   25    6    1   2  11/13   84.6   0/0     0.0   5/5     2   0
Julius Jackson         19   13    5    0   1   6/9    66.7   0/0     0.0   3/3     2   0
Michael Simons         16   15    0    0   1   6/9    66.7   2/5    40.0   1/1     0   0
Miles Herro            16    4    0    1   0   2/3    66.7   0/0     0.0   0/0     0   0
Austin Antetokounmpo   16    0    4    1   0   0/5     0.0   0/2     0.0   0/0     0   0
Shai Wade              16    2    6    3   1   1/2    50.0   0/1     0.0   0/0     1   0

TEAM: FG: 48/82 (58.5%), 3PT: 7/24 (29.2%), REB: 45 (11 off, 34 def), AST: 19, TO: 12


Team_041
--------------------------------------------------------------------------------
Player                MIN  PTS  REB  AST  TO      FG   FG%      3P   3P%      FT STL BLK
--------------------------------------------------------------------------------
Scottie Turner         33   12    0    3   2   5/5   100.0   2/2   100.0   0/0     0   0
Jarrett Anunoby        33   13    1    4   2   6/14   42.9   1/5    20.0   4/5     2   0
Stephen Ingram         33   12    8    4   0   6/13   46.2   2/4    50.0   2/5     0   0
Terry Barrett          33   13    9    2   2   6/13   46.2   0/1     0.0   2/6     2   0
Dejounte Griffin       30   18    5    3   1   8/11   72.7   0/1     0.0   4/4     0   0
Bam McCollum           19    7    0    2   2   2/2   100.0   1/1   100.0   4/4     0   1
Franz Rose             16    2    0    3   0   1/6    16.7   0/4     0.0   0/0     1   0
Kyrie Booker           16    3    3    0   2   1/2    50.0   1/1   100.0   0/0     0   0
Tobias McCollum        16   12    4    0   3   5/8    62.5   1/3    33.3   1/1     2   0
De'Aaron Poole         16    5    6    1   0   2/3    66.7   0/0     0.0   1/1     0   0

TEAM: FG: 43/78 (55.1%), 3PT: 8/22 (36.4%), REB: 34 (2 off, 32 def), AST: 22, TO: 14

================================================================================
