================================================================================
                        FULL GAME - Team_081 vs Team_048                        
================================================================================

================================================================================
                       1ST QUARTER - Team_081 vs Team_048                       
================================================================================

[12:00] Team_081 possession (Score: 0-0)
FOUL! Holding foul on Kevin Fox. [Team fouls: 1] No free throws, side out. (Kevin Fox: 1 personal fouls)

[11:43] Team_081 possession (Score: 0-0)
Bradley Leonard attempts a 3Pt. Heavily contested by Karl Johnson (1.8 feet, MAN)! BRADLEY LEONARD MAKES IT! Assist: Vince Adebayo
Score: 3-0

[11:26] Team_048 possession (Score: 3-0)
Dejounte Sexton attempts a 3Pt. Contested by Vince Adebayo (5.1 feet, MAN). DEJOUNTE SEXTON MAKES IT! Assist: Paolo Rozier
Score: 3-3

[11:16] Team_081 possession (Score: 3-3)
Bradley Sabonis attempts a Midrange. Contested by Dejounte Sexton (4.4 feet, ZONE). Bradley Sabonis misses. Rebound secured by Dejounte Sexton.

[10:57] Team_048 possession (Score: 3-3)
Paolo Rozier drives, Julius Durant stays with him. Paolo Rozier attempts a Dunk. Wide open! Julius Durant is 8.1 feet away. [MAN] PAOLO ROZIER MAKES IT! Assist: Karl Johnson
Score: 3-5

[10:47] Team_081 possession (Score: 3-5)
Vince Adebayo attempts a 3Pt. Contested by Dejounte Sexton (4.4 feet, MAN). Vince Adebayo misses. Rebound secured by Dejounte Sexton.

[10:35] Team_048 possession (Score: 3-5)
FOUL! Offensive foul on Damian Mobley! Franz Antetokounmpo drew the charge! [Team fouls: 2] (Damian Mobley: 1 personal fouls) TURNOVER! (dead ball)

[10:25] Team_081 possession (Score: 3-5)
FOUL! Shooting foul on Dejounte Sexton. Vince Adebayo to the line for 3 free throws. [Team fouls: 3] (Dejounte Sexton: 1 personal fouls)   FT 1/3: GOOD   FT 2/3: GOOD   FT 3/3: GOOD Vince Adebayo makes 3/3 from the line.
Score: 6-5

[10:13] Team_048 possession (Score: 6-5)
Paolo Rozier attempts a Midrange. Contested by Vince Adebayo (5.6 feet, ZONE). PAOLO ROZIER MAKES IT! Assist: Dejounte Sexton
Score: 6-7

[09:55] Team_081 possession (Score: 6-7)
Julius Durant attempts a Layup. Contested by Paolo Rozier (5.5 feet, MAN). Julius Durant misses. Rebound secured by Kevin Fox.

[09:36] Team_048 possession (Score: 6-7)
Karl Johnson attempts a Layup. Contested by Franz Antetokounmpo (3.7 feet, ZONE). KARL JOHNSON MAKES IT! Assist: Damian Mobley
Score: 6-9

[09:25] Team_081 possession (Score: 6-9)
Bradley Sabonis attempts a 3Pt. Contested by Kevin Fox (3.4 feet, MAN). Bradley Sabonis misses. Rebound secured by Kevin Fox.

[09:10] Team_048 possession (Score: 6-9)
Paolo Rozier drives and kicks out. Paolo Rozier attempts a 3Pt. Contested by Julius Durant (3.1 feet, MAN). PAOLO ROZIER MAKES IT! Assist: Damian Mobley
Score: 6-12

[08:56] Team_081 possession (Score: 6-12)
Bradley Sabonis attempts a Midrange. Contested by Kevin Fox (2.6 feet, MAN). BRADLEY SABONIS MAKES IT! Assist: Bradley Leonard
Score: 8-12

[08:45] Team_048 possession (Score: 8-12)
Kevin Fox drives, picks up Franz Antetokounmpo. Help arrives from Bradley Leonard! Kevin Fox attempts a Layup. Wide open! Bradley Leonard is 6.1 feet away. [ZONE] Kevin Fox misses. Offensive rebound by Damian Mobley! Damian Mobley puts it back in!
Score: 8-14

[08:26] Team_081 possession (Score: 8-14)
Julius Durant attempts a Midrange. BLOCKED BY KARL JOHNSON! Ball is loose! Rebound secured by Kevin Fox.

[08:16] Team_048 possession (Score: 8-14)
Damian Mobley attempts a 3Pt. Contested by Vince Adebayo (3.5 feet, ZONE). DAMIAN MOBLEY MAKES IT! Assist: Kevin Fox
Score: 8-17

[08:01] Team_081 possession (Score: 8-17)
Vince Adebayo attempts a 3Pt. Contested by Dejounte Sexton (2.7 feet, MAN). Vince Adebayo misses. Rebound secured by Kevin Fox.

[07:46] Team_048 possession (Score: 8-17)
Paolo Rozier makes the Dunk and draws the foul on Bradley Leonard! And-1! Paolo Rozier to the line for 1. [Team fouls: 1] (Bradley Leonard: 1 personal fouls)   FT 1/1: GOOD Paolo Rozier makes 1/1 from the line.
Score: 8-20

[07:32] Team_081 possession (Score: 8-20)
Franz Antetokounmpo drives to the basket... Franz Antetokounmpo loses control! Ball rolls out of bounds! TURNOVER! (dead ball)

[07:19] Team_048 possession (Score: 8-20)
Dejounte Sexton attempts a 3Pt. Heavily contested by Vince Adebayo (0.7 feet, MAN)! Dejounte Sexton misses. Rebound secured by Franz Antetokounmpo.

[07:02] Team_081 possession (Score: 8-20)
Julius Durant attempts a 3Pt. Wide open! Paolo Rozier is 6.6 feet away. [MAN] Julius Durant misses. Rebound secured by Kevin Fox.

[06:47] Team_048 possession (Score: 8-20)
FOUL! Holding foul on Bradley Sabonis. [Team fouls: 2] No free throws, side out. (Bradley Sabonis: 1 personal fouls)

[06:34] Team_048 possession (Score: 8-20)
Kevin Fox attempts a Layup. Contested by Franz Antetokounmpo (5.2 feet, ZONE). Kevin Fox misses. Offensive rebound by Kevin Fox! Kevin Fox kicks it out.

[06:20] Team_048 possession (Score: 8-20)
Karl Johnson attempts a Midrange. Contested by Bradley Sabonis (4.0 feet, ZONE). Karl Johnson misses. Rebound secured by Bradley Sabonis.

[06:04] Team_081 possession (Score: 8-20)
Bradley Sabonis attempts a Layup. Heavily contested by Kevin Fox (0.5 feet, MAN)! Bradley Sabonis misses. Rebound secured by Kevin Fox.

[05:53] Team_048 possession (Score: 8-20)
Paolo Rozier attempts a 3Pt. Contested by Julius Durant (4.0 feet, MAN). Paolo Rozier misses. Rebound secured by Franz Antetokounmpo.

[05:42] Team_081 possession (Score: 8-20)
Bradley Sabonis attempts a Layup. Contested by Kevin Fox (3.7 feet, MAN). Bradley Sabonis misses. Offensive rebound by Bradley Sabonis! Bradley Sabonis kicks it out.

[05:25] Team_081 possession (Score: 8-20)
Bradley Leonard commits a violation (traveling/carry)! TURNOVER! (dead ball)

[05:12] Team_048 possession (Score: 8-20)
Paolo Rozier attempts a Midrange. Contested by Julius Durant (5.1 feet, MAN). PAOLO ROZIER MAKES IT!
Score: 8-22

[04:56] Team_081 possession (Score: 8-22)
Franz Antetokounmpo makes the Dunk and draws the foul on Karl Johnson! And-1! Franz Antetokounmpo to the line for 1. [Team fouls: 4] (Karl Johnson: 1 personal fouls)   FT 1/1: GOOD Franz Antetokounmpo makes 1/1 from the line.
Score: 11-22

[04:42] Team_048 possession (Score: 11-22)
Paolo Rozier attempts a 3Pt. Contested by Julius Durant (5.2 feet, MAN). Paolo Rozier misses. Rebound secured by Franz Antetokounmpo.

[04:30] Team_081 possession (Score: 11-22)
Bradley Leonard attempts a Layup. Contested by Kevin Fox (4.6 feet, ZONE). Bradley Leonard misses. Rebound secured by Dejounte Sexton.

[04:15] Team_048 possession (Score: 11-22)
Kevin Fox attempts a Layup. Contested by Franz Antetokounmpo (3.8 feet, ZONE). KEVIN FOX MAKES IT!
Score: 11-24

[04:01] Team_081 possession (Score: 11-24)
FOUL! Shooting foul on Dejounte Sexton. Julius Durant to the line for 3 free throws. [BONUS: 5 team fouls] (Dejounte Sexton: 2 personal fouls)   FT 1/3: GOOD   FT 2/3: MISS   FT 3/3: GOOD Julius Durant makes 2/3 from the line.
Score: 13-24

[03:50] Team_048 possession (Score: 13-24)
Damian Mobley drives and kicks out. Kevin Fox attempts a 3Pt. Contested by Bradley Leonard (4.6 feet, ZONE). KEVIN FOX MAKES IT!
Score: 13-27

[03:37] Team_081 possession (Score: 13-27)
Bradley Sabonis drives and kicks out. Bradley Leonard attempts a Midrange. Contested by Karl Johnson (2.1 feet, ZONE). BRADLEY LEONARD MAKES IT!
Score: 15-27

[03:24] Team_048 possession (Score: 15-27)
Kevin Fox attempts a Midrange. Contested by Vince Adebayo (2.1 feet, ZONE). Kevin Fox misses. Rebound secured by Franz Antetokounmpo.

[03:08] Team_081 possession (Score: 15-27)
Julius Durant throws a bad pass! Stolen by Paolo Rozier! TURNOVER! (live ball)

[02:55] Team_048 possession (Score: 15-27)
FOUL! Shooting foul on Bradley Leonard. Kevin Fox to the line for 2 free throws. [Team fouls: 3] (Bradley Leonard: 2 personal fouls)   FT 1/2: GOOD   FT 2/2: GOOD Kevin Fox makes 2/2 from the line.
Score: 15-29

[02:37] Team_081 possession (Score: 15-29)
Julius Durant attempts a Midrange. Contested by Paolo Rozier (5.5 feet, MAN). JULIUS DURANT MAKES IT! Assist: Bradley Sabonis
Score: 17-29

[02:24] Team_048 possession (Score: 17-29)
Paolo Rozier makes the 3Pt and draws the foul on Bradley Leonard! And-1! Paolo Rozier to the line for 1. [Team fouls: 4] (Bradley Leonard: 3 personal fouls)   FT 1/1: GOOD Paolo Rozier makes 1/1 from the line.
Score: 17-33

[02:14] Team_081 possession (Score: 17-33)
Bradley Leonard drives, Karl Johnson stays with him. Bradley Leonard attempts a Layup. Contested by Karl Johnson (3.9 feet, MAN). Bradley Leonard misses. Rebound secured by Kevin Fox.

[02:00] Team_048 possession (Score: 17-33)
Paolo Rozier attempts a 3Pt. Contested by Julius Durant (5.4 feet, MAN). PAOLO ROZIER MAKES IT! Assist: Damian Mobley
Score: 17-36

[01:45] Team_081 possession (Score: 17-36)
FOUL! Holding foul on Kevin Fox. [IN THE BONUS! 6 team fouls] Franz Antetokounmpo to the line for 2 free throws. (Kevin Fox: 2 personal fouls)   FT 1/2: GOOD   FT 2/2: GOOD Franz Antetokounmpo makes 2/2 from the line.
Score: 19-36

[01:32] Team_048 possession (Score: 19-36)
Damian Mobley attempts a Midrange. Wide open! Franz Antetokounmpo is 7.3 feet away. [MAN] DAMIAN MOBLEY MAKES IT!
Score: 19-38

[01:19] Team_081 possession (Score: 19-38)
Franz Antetokounmpo drives, picks up Kevin Fox. Help arrives from Karl Johnson! Franz Antetokounmpo attempts a Layup. Contested by Karl Johnson (5.4 feet, MAN). FRANZ ANTETOKOUNMPO MAKES IT! Assist: Vince Adebayo
Score: 21-38

[01:02] Team_048 possession (Score: 21-38)
FOUL! Reach-in foul on Franz Antetokounmpo during the drive. [IN THE BONUS! 5 team fouls] Paolo Rozier to the line for 2 free throws. (Franz Antetokounmpo: 1 personal fouls)   FT 1/2: GOOD   FT 2/2: GOOD Paolo Rozier makes 2/2 from the line.
Score: 21-40

[00:49] Team_081 possession (Score: 21-40)
Franz Antetokounmpo attempts a Midrange. Heavily contested by Kevin Fox (0.5 feet, MAN)! Franz Antetokounmpo misses. Rebound secured by Damian Mobley.

[00:34] Team_048 possession (Score: 21-40)
Dejounte Sexton attempts a 3Pt. Wide open! Vince Adebayo is 6.9 feet away. [MAN] Dejounte Sexton misses. Rebound secured by Bradley Sabonis.

[00:19] Team_081 possession (Score: 21-40)
Bradley Sabonis attempts a 3Pt. Contested by Kevin Fox (5.5 feet, MAN). Bradley Sabonis misses. Rebound secured by Damian Mobley.

================================================================================
                              1ST QUARTER COMPLETE                              
================================================================================

1ST QUARTER SCORE: Team_081 21, Team_048 40

BOX SCORE:
================================================================================

Team_081
--------------------------------------------------------------------------------
Player                MIN  PTS  REB  AST  TO      FG   FG%      3P   3P%
--------------------------------------------------------------------------------
Franz Antetokounmpo    12    7    4    0   0   3/4    75.0     0/0   0.0
Bradley Leonard        12    5    0    1   0   2/4    50.0     0/0   0.0
Julius Durant          12    4    0    0   0   2/5    40.0     0/0   0.0
Vince Adebayo          12    3    0    2   0   1/3    33.3     0/0   0.0
Bradley Sabonis        12    2    3    1   0   1/5    20.0     0/0   0.0

TEAM: FG: 9/21 (42.9%), 3PT: 3/8 (37.5%), REB: 7 (1 off, 6 def), AST: 4, TO: 3
TEAM FOULS: 5 [Team_048 in BONUS]


Team_048
--------------------------------------------------------------------------------
Player                MIN  PTS  REB  AST  TO      FG   FG%      3P   3P%
--------------------------------------------------------------------------------
Paolo Rozier           12   21    0    1   0   8/10   80.0     0/0   0.0
Kevin Fox              12    7    8    1   0   3/4    75.0     0/0   0.0
Damian Mobley          12    7    3    3   0   3/3   100.0     0/0   0.0
Dejounte Sexton        12    3    3    1   0   1/3    33.3     0/0   0.0
Karl Johnson           12    2    0    1   0   1/2    50.0     0/0   0.0

TEAM: FG: 16/22 (72.7%), 3PT: 4/8 (50.0%), REB: 14 (2 off, 12 def), AST: 7, TO: 1
TEAM FOULS: 6 [Team_081 in BONUS]

================================================================================

================================================================================
                       2ND QUARTER - Team_081 vs Team_048                       
================================================================================

[12:00] Team_081 possession (Score: 21-40)
Franz Antetokounmpo attempts a Dunk. BLOCKED BY KARL JOHNSON! Ball is loose! Rebound secured by Dejounte Sexton.

[11:46] Team_048 possession (Score: 21-40)
Dejounte Sexton attempts a Layup. Contested by Vince Adebayo (5.0 feet, MAN). DEJOUNTE SEXTON MAKES IT! Assist: Karl Johnson
Score: 21-42

[11:33] Team_081 possession (Score: 21-42)
Bradley Sabonis attempts a 3Pt. Wide open! Paolo Rozier is 9.1 feet away. [ZONE] Bradley Sabonis misses. Rebound secured by Dejounte Sexton.

[11:19] Team_048 possession (Score: 21-42)
Karl Johnson attempts a 3Pt. Contested by Bradley Leonard (4.9 feet, ZONE). KARL JOHNSON MAKES IT! Assist: Kevin Fox
Score: 21-45

[11:05] Team_081 possession (Score: 21-45)
Franz Antetokounmpo makes the Layup and draws the foul on Kevin Fox! And-1! Franz Antetokounmpo to the line for 1. [Team fouls: 1] (Kevin Fox: 1 personal fouls)   FT 1/1: GOOD Franz Antetokounmpo makes 1/1 from the line.
Score: 24-45

[10:55] Team_048 possession (Score: 24-45)
Dejounte Sexton attempts a Layup. Wide open! Franz Antetokounmpo is 6.1 feet away. [ZONE] DEJOUNTE SEXTON MAKES IT!
Score: 24-47

[10:42] Team_081 possession (Score: 24-47)
Franz Antetokounmpo attempts a 3Pt. Wide open! Kevin Fox is 9.8 feet away. [MAN] Franz Antetokounmpo misses. Rebound secured by Damian Mobley.

[10:23] Team_048 possession (Score: 24-47)
Paolo Rozier makes the Dunk and draws the foul on Franz Antetokounmpo! And-1! Paolo Rozier to the line for 1. [Team fouls: 1] (Franz Antetokounmpo: 1 personal fouls)   FT 1/1: GOOD Paolo Rozier makes 1/1 from the line.
Score: 24-50

[10:12] Team_081 possession (Score: 24-50)
Julius Durant attempts a 3Pt. Contested by Dejounte Sexton (3.4 feet, ZONE). Julius Durant misses. Rebound secured by Damian Mobley.

[09:56] Team_048 possession (Score: 24-50)
Kevin Fox attempts a 3Pt. Contested by Bradley Sabonis (3.9 feet, MAN). Kevin Fox misses. Rebound secured by Vince Adebayo.

[09:44] Team_081 possession (Score: 24-50)
Bradley Sabonis attempts a Midrange. Contested by Karl Johnson (5.5 feet, ZONE). Bradley Sabonis misses. Rebound secured by Damian Mobley.

[09:30] Team_048 possession (Score: 24-50)
Kevin Fox drives, Bradley Sabonis stays with him. Kevin Fox attempts a Layup. Wide open! Bradley Sabonis is 8.4 feet away. [MAN] Kevin Fox misses. Offensive rebound by Kevin Fox! Kevin Fox kicks it out.

[09:17] Team_048 possession (Score: 24-50)
Kevin Fox attempts a Layup. Wide open! Franz Antetokounmpo is 10.0 feet away. [ZONE] KEVIN FOX MAKES IT! Assist: Karl Johnson
Score: 24-52

[09:03] Team_081 possession (Score: 24-52)
Bradley Leonard drives, Kevin Fox stays with him. Bradley Leonard attempts a Layup. Wide open! Kevin Fox is 6.9 feet away. [ZONE] Bradley Leonard misses. Rebound secured by Damian Mobley.

[08:44] Team_048 possession (Score: 24-52)
Kevin Fox makes the Dunk and draws the foul on Bradley Leonard! And-1! Kevin Fox to the line for 1. [Team fouls: 2] (Bradley Leonard: 1 personal fouls)   FT 1/1: MISS Kevin Fox makes 0/1 from the line. Rebound secured by Vince Adebayo.
Score: 24-54

[08:30] Team_081 possession (Score: 24-54)
Vince Adebayo attempts a 3Pt. Contested by Dejounte Sexton (2.9 feet, ZONE). Vince Adebayo misses. Offensive rebound by Franz Antetokounmpo! Franz Antetokounmpo's putback is no good. Rebound secured by Dejounte Sexton.

[08:15] Team_048 possession (Score: 24-54)
Damian Mobley attempts a 3Pt. Contested by Franz Antetokounmpo (5.5 feet, MAN). Damian Mobley misses. FOUL! Loose ball foul on Bradley Sabonis during the rebound battle. [Team fouls: 3] No free throws, side out. (Bradley Sabonis: 1 personal fouls)

[08:02] Team_048 possession (Score: 24-54)
Karl Johnson attempts a Layup. Wide open! Bradley Leonard is 7.4 feet away. [MAN] KARL JOHNSON MAKES IT! Assist: Kevin Fox
Score: 24-56

[07:50] Team_081 possession (Score: 24-56)
Bradley Leonard attempts a 3Pt. Contested by Karl Johnson (5.2 feet, MAN). Bradley Leonard misses. Rebound secured by Damian Mobley.

[07:38] Team_048 possession (Score: 24-56)
Karl Johnson drives, Franz Antetokounmpo stays with him. Karl Johnson attempts a Layup. Wide open! Franz Antetokounmpo is 8.4 feet away. [ZONE] KARL JOHNSON MAKES IT!
Score: 24-58

[07:24] Team_081 possession (Score: 24-58)
Bradley Leonard drives, picks up Karl Johnson. Help arrives from Dejounte Sexton! Bradley Leonard attempts a Layup. Contested by Dejounte Sexton (5.6 feet, MAN). Bradley Leonard misses. Rebound secured by Kevin Fox.

[07:11] Team_048 possession (Score: 24-58)
Kevin Fox attempts a Midrange. Contested by Bradley Sabonis (4.6 feet, MAN). Kevin Fox misses. Rebound secured by Vince Adebayo.

[06:55] Team_081 possession (Score: 24-58)
Bradley Sabonis attempts a Midrange. Contested by Kevin Fox (3.6 feet, MAN). Bradley Sabonis misses. Rebound secured by Kevin Fox.

[06:37] Team_048 possession (Score: 24-58)
Dejounte Sexton attempts a Layup. Contested by Vince Adebayo (5.6 feet, MAN). Dejounte Sexton misses. Rebound secured by Franz Antetokounmpo.

[06:20] Team_081 possession (Score: 24-58)
Julius Durant attempts a Midrange. Contested by Paolo Rozier (4.6 feet, MAN). JULIUS DURANT MAKES IT! Assist: Bradley Leonard
Score: 26-58

[06:07] Team_048 possession (Score: 26-58)
Dejounte Sexton attempts a 3Pt. Contested by Bradley Leonard (5.4 feet, ZONE). Dejounte Sexton misses. Rebound secured by Vince Adebayo.

[05:55] Team_081 possession (Score: 26-58)
Franz Antetokounmpo attempts a Midrange. Wide open! Karl Johnson is 7.8 feet away. [ZONE] FRANZ ANTETOKOUNMPO MAKES IT!
Score: 28-58

[05:37] Team_048 possession (Score: 28-58)
Damian Mobley attempts a Layup. Wide open! Franz Antetokounmpo is 8.5 feet away. [ZONE] Damian Mobley misses. Rebound secured by Bradley Sabonis.

[05:22] Team_081 possession (Score: 28-58)
Vince Adebayo attempts a 3Pt. Contested by Dejounte Sexton (2.8 feet, ZONE). Vince Adebayo misses. Offensive rebound by Bradley Sabonis! Bradley Sabonis kicks it out.

[05:07] Team_081 possession (Score: 28-58)
Bradley Leonard attempts a 3Pt. Wide open! Karl Johnson is 8.1 feet away. [MAN] BRADLEY LEONARD MAKES IT! Assist: Vince Adebayo
Score: 31-58

[04:57] Team_048 possession (Score: 31-58)
Paolo Rozier attempts a Midrange. Contested by Julius Durant (3.7 feet, MAN). PAOLO ROZIER MAKES IT!
Score: 31-60

[04:41] Team_081 possession (Score: 31-60)
Bradley Sabonis attempts a 3Pt. Contested by Dejounte Sexton (4.8 feet, ZONE). Bradley Sabonis misses. Rebound secured by Kevin Fox.

[04:27] Team_048 possession (Score: 31-60)
Dejounte Sexton attempts a 3Pt. Contested by Vince Adebayo (5.9 feet, MAN). Dejounte Sexton misses. Rebound secured by Vince Adebayo.

[04:13] Team_081 possession (Score: 31-60)
FOUL! Offensive foul on Julius Durant! Paolo Rozier drew the charge! [Team fouls: 4] (Julius Durant: 1 personal fouls) TURNOVER! (dead ball)

[04:03] Team_048 possession (Score: 31-60)
Kevin Fox drives, Bradley Sabonis stays with him. Kevin Fox attempts a Dunk. Contested by Bradley Sabonis (3.6 feet, MAN). Kevin Fox misses. Rebound secured by Franz Antetokounmpo.

[03:52] Team_081 possession (Score: 31-60)
Bradley Leonard attempts a 3Pt. Heavily contested by Karl Johnson (0.8 feet, MAN)! BRADLEY LEONARD MAKES IT! Assist: Bradley Sabonis
Score: 34-60

[03:37] Team_048 possession (Score: 34-60)
FOUL! Shooting foul on Franz Antetokounmpo. Karl Johnson to the line for 2 free throws. [BONUS: 5 team fouls] (Franz Antetokounmpo: 2 personal fouls)   FT 1/2: GOOD   FT 2/2: GOOD Karl Johnson makes 2/2 from the line.
Score: 34-62

[03:20] Team_081 possession (Score: 34-62)
Bradley Sabonis drives, Kevin Fox stays with him. Bradley Sabonis attempts a Layup. Contested by Kevin Fox (4.1 feet, ZONE). BRADLEY SABONIS MAKES IT! Assist: Vince Adebayo
Score: 36-62

[03:08] Team_048 possession (Score: 36-62)
FOUL! Holding foul on Vince Adebayo. [IN THE BONUS! 6 team fouls] Dejounte Sexton to the line for 2 free throws. (Vince Adebayo: 1 personal fouls)   FT 1/2: MISS   FT 2/2: GOOD Dejounte Sexton makes 1/2 from the line.
Score: 36-63

[02:53] Team_081 possession (Score: 36-63)
Julius Durant drives, picks up Paolo Rozier. Help arrives from Dejounte Sexton! Julius Durant attempts a Dunk. Wide open! Dejounte Sexton is 7.6 feet away. [MAN] JULIUS DURANT MAKES IT! Assist: Vince Adebayo
Score: 38-63

[02:40] Team_048 possession (Score: 38-63)
Paolo Rozier attempts a Midrange. Wide open! Vince Adebayo is 6.2 feet away. [ZONE] Paolo Rozier misses. Rebound secured by Vince Adebayo.

[02:25] Team_081 possession (Score: 38-63)
Bradley Leonard attempts a 3Pt. Contested by Paolo Rozier (4.8 feet, ZONE). Bradley Leonard misses. Rebound secured by Dejounte Sexton.

[02:13] Team_048 possession (Score: 38-63)
FOUL! Holding foul on Bradley Sabonis. [IN THE BONUS! 7 team fouls] Kevin Fox to the line for 2 free throws. (Bradley Sabonis: 2 personal fouls)   FT 1/2: GOOD   FT 2/2: GOOD Kevin Fox makes 2/2 from the line.
Score: 38-65

[01:59] Team_081 possession (Score: 38-65)
FOUL! Offensive foul on Franz Antetokounmpo! Damian Mobley drew the charge! [Team fouls: 8] (Franz Antetokounmpo: 3 personal fouls) TURNOVER! (dead ball)

[01:46] Team_048 possession (Score: 38-65)
Karl Johnson drives, picks up Franz Antetokounmpo. Help arrives from Bradley Leonard! Karl Johnson attempts a Layup. Wide open! Bradley Leonard is 6.9 feet away. [ZONE] Karl Johnson misses. Offensive rebound by Dejounte Sexton! Dejounte Sexton kicks it out.

[01:35] Team_048 possession (Score: 38-65)
Dejounte Sexton attempts a Layup. Contested by Franz Antetokounmpo (4.3 feet, ZONE). DEJOUNTE SEXTON MAKES IT!
Score: 38-67

[01:24] Team_081 possession (Score: 38-67)
Julius Durant drives, Kevin Fox stays with him. Julius Durant attempts a Dunk. Wide open! Kevin Fox is 7.4 feet away. [ZONE] JULIUS DURANT MAKES IT! Assist: Bradley Leonard
Score: 40-67

[01:09] Team_048 possession (Score: 40-67)
Karl Johnson drives, Bradley Leonard stays with him. Karl Johnson attempts a Layup. Wide open! Bradley Leonard is 6.4 feet away. [MAN] Karl Johnson misses. Rebound secured by Vince Adebayo.

[00:58] Team_081 possession (Score: 40-67)
Bradley Leonard attempts a 3Pt. Wide open! Karl Johnson is 6.8 feet away. [MAN] Bradley Leonard misses. Rebound secured by Dejounte Sexton.

[00:39] Team_048 possession (Score: 40-67)
Damian Mobley drives to the basket... Damian Mobley throws a bad pass out of bounds! TURNOVER! (dead ball)

[00:39] Substitution (Team_081): Julius Durant OUT → Dejounte Bane IN (stamina_rule2)

[00:39] Substitution (Team_081): Bradley Leonard OUT → Lamelo Wade IN (stamina_rule2)

[00:39] Substitution (Team_081): Vince Adebayo OUT → Larry Adebayo IN (stamina_rule2)

[00:39] Substitution (Team_081): Bradley Sabonis OUT → Chris Holiday IN (stamina_rule2)

[00:39] Substitution (Team_081): Franz Antetokounmpo OUT → D'Angelo Markkanen IN (stamina_rule2)

[00:39] Substitution (Team_048): Paolo Rozier OUT → Lauri Curry IN (stamina_rule2)

[00:39] Substitution (Team_048): Karl Johnson OUT → Yao Booker IN (stamina_rule2)

[00:39] Substitution (Team_048): Dejounte Sexton OUT → Kyle Irving IN (stamina_rule2)

[00:39] Substitution (Team_048): Kevin Fox OUT → DeMar Hyland IN (stamina_rule2)

[00:39] Substitution (Team_048): Damian Mobley OUT → Gary Giddey IN (stamina_rule2)

[00:21] Team_081 possession (Score: 40-67)
Larry Adebayo attempts a 3Pt. Wide open! Kyle Irving is 6.3 feet away. [MAN] Larry Adebayo misses. Offensive rebound by Lamelo Wade! Lamelo Wade kicks it out.

[00:08] Team_081 possession (Score: 40-67)
D'Angelo Markkanen attempts a Layup. Heavily contested by DeMar Hyland (1.5 feet, ZONE)! D'ANGELO MARKKANEN MAKES IT!
Score: 42-67

================================================================================
                              2ND QUARTER COMPLETE                              
================================================================================

2ND QUARTER SCORE: Team_081 21, Team_048 27

BOX SCORE:
================================================================================

Team_081
--------------------------------------------------------------------------------
Player                MIN  PTS  REB  AST  TO      FG   FG%      3P   3P%
--------------------------------------------------------------------------------
Julius Durant          24    6    0    0   0   3/4    75.0     0/0   0.0
Bradley Leonard        24    6    0    2   0   2/7    28.6     0/0   0.0
Franz Antetokounmpo    24    5    2    0   0   2/4    50.0     0/0   0.0
Bradley Sabonis        24    2    2    1   0   1/5    20.0     0/0   0.0
D'Angelo Markkanen      0    2    0    0   0   1/1   100.0     0/0   0.0
Vince Adebayo          24    0    7    3   0   0/1     0.0     0/0   0.0
Lamelo Wade             0    0    1    0   0   0/0     0.0     0/0   0.0

TEAM: FG: 9/22 (40.9%), 3PT: 2/10 (20.0%), REB: 13 (3 off, 10 def), AST: 6, TO: 2
TEAM FOULS: 8 [Team_048 in BONUS]


Team_048
--------------------------------------------------------------------------------
Player                MIN  PTS  REB  AST  TO      FG   FG%      3P   3P%
--------------------------------------------------------------------------------
Karl Johnson           24    9    0    2   0   4/5    80.0     0/0   0.0
Dejounte Sexton        24    7    6    0   0   4/7    57.1     0/0   0.0
Paolo Rozier           24    5    0    0   0   2/3    66.7     0/0   0.0
Kevin Fox              24    4    4    2   0   2/6    33.3     0/0   0.0
Damian Mobley          24    0    6    0   0   0/1     0.0     0/0   0.0

TEAM: FG: 12/22 (54.5%), 3PT: 1/4 (25.0%), REB: 15 (3 off, 12 def), AST: 4, TO: 1
TEAM FOULS: 1

================================================================================

================================================================================
                       3RD QUARTER - Team_081 vs Team_048                       
================================================================================

[12:00] Team_081 possession (Score: 42-67)
Bradley Sabonis drives, Kevin Fox stays with him. Bradley Sabonis attempts a Layup. Contested by Kevin Fox (5.4 feet, MAN). BRADLEY SABONIS MAKES IT! Assist: Vince Adebayo
Score: 44-67

[11:45] Team_048 possession (Score: 44-67)
Dejounte Sexton drives and kicks out. Damian Mobley attempts a 3Pt. Contested by Vince Adebayo (3.4 feet, ZONE). Damian Mobley misses. Rebound secured by Vince Adebayo.

[11:32] Team_081 possession (Score: 44-67)
Vince Adebayo drives, picks up Dejounte Sexton. Help arrives from Karl Johnson! Vince Adebayo attempts a Dunk. Contested by Karl Johnson (2.9 feet, MAN). VINCE ADEBAYO MAKES IT! Assist: Franz Antetokounmpo
Score: 46-67

[11:17] Team_048 possession (Score: 46-67)
Karl Johnson attempts a Midrange. Contested by Bradley Leonard (2.1 feet, MAN). Karl Johnson misses. Rebound secured by Vince Adebayo.

[11:00] Team_081 possession (Score: 46-67)
Bradley Sabonis attempts a Layup. Contested by Kevin Fox (4.5 feet, ZONE). Bradley Sabonis misses. Rebound secured by Kevin Fox.

[10:45] Team_048 possession (Score: 46-67)
Karl Johnson attempts a 3Pt. Contested by Bradley Leonard (5.1 feet, MAN). Karl Johnson misses. Rebound secured by Franz Antetokounmpo.

[10:27] Team_081 possession (Score: 46-67)
Bradley Leonard attempts a 3Pt. Contested by Karl Johnson (3.3 feet, MAN). BRADLEY LEONARD MAKES IT! Assist: Bradley Sabonis
Score: 49-67

[10:13] Team_048 possession (Score: 49-67)
Paolo Rozier makes the Midrange and draws the foul on Bradley Sabonis! And-1! Paolo Rozier to the line for 1. [Team fouls: 1] (Bradley Sabonis: 1 personal fouls)   FT 1/1: GOOD Paolo Rozier makes 1/1 from the line.
Score: 49-70

[09:55] Team_081 possession (Score: 49-70)
Vince Adebayo drives, picks up Dejounte Sexton. Help arrives from Karl Johnson! Vince Adebayo attempts a Layup. Contested by Karl Johnson (2.9 feet, MAN). VINCE ADEBAYO MAKES IT! Assist: Julius Durant
Score: 51-70

[09:39] Team_048 possession (Score: 51-70)
Dejounte Sexton attempts a 3Pt. Contested by Vince Adebayo (3.6 feet, MAN). Dejounte Sexton misses. Rebound secured by Vince Adebayo.

[09:25] Team_081 possession (Score: 51-70)
Bradley Sabonis attempts a Midrange. Wide open! Kevin Fox is 9.2 feet away. [MAN] Bradley Sabonis misses. FOUL! Loose ball foul on Kevin Fox during the rebound battle. [Team fouls: 1] No free throws, side out. (Kevin Fox: 1 personal fouls)

[09:15] Team_081 possession (Score: 51-70)
Vince Adebayo attempts a 3Pt. Wide open! Dejounte Sexton is 6.5 feet away. [MAN] Vince Adebayo misses. Rebound secured by Dejounte Sexton.

[08:57] Team_048 possession (Score: 51-70)
Karl Johnson attempts a Midrange. Wide open! Bradley Leonard is 8.2 feet away. [MAN] Karl Johnson misses. Offensive rebound by Damian Mobley! Damian Mobley's putback is no good. Offensive rebound by Damian Mobley! Damian Mobley kicks it out.

[08:43] Team_048 possession (Score: 51-70)
Damian Mobley drives to the basket... Damian Mobley loses control! Ball rolls out of bounds! TURNOVER! (dead ball)

[08:25] Team_081 possession (Score: 51-70)
Bradley Sabonis attempts a Midrange. Contested by Kevin Fox (3.1 feet, MAN). Bradley Sabonis misses. Offensive rebound by Bradley Sabonis! Bradley Sabonis kicks it out.

[08:08] Team_081 possession (Score: 51-70)
Vince Adebayo attempts a 3Pt. Contested by Dejounte Sexton (4.2 feet, ZONE). Vince Adebayo misses. Offensive rebound by Bradley Sabonis! Bradley Sabonis kicks it out.

[07:55] Team_081 possession (Score: 51-70)
Franz Antetokounmpo attempts a Layup. Wide open! Kevin Fox is 6.9 feet away. [MAN] FRANZ ANTETOKOUNMPO MAKES IT! Assist: Vince Adebayo
Score: 53-70

[07:40] Team_048 possession (Score: 53-70)
Kevin Fox attempts a Midrange. Contested by Bradley Sabonis (3.4 feet, ZONE). Kevin Fox misses. Rebound secured by Bradley Sabonis.

[07:27] Team_081 possession (Score: 53-70)
FOUL! Shooting foul on Kevin Fox. Bradley Sabonis to the line for 2 free throws. [Team fouls: 2] (Kevin Fox: 2 personal fouls)   FT 1/2: GOOD   FT 2/2: MISS Bradley Sabonis makes 1/2 from the line. Offensive rebound by Bradley Sabonis! Bradley Sabonis kicks it out.
Score: 54-70

[07:09] Team_081 possession (Score: 54-70)
Julius Durant attempts a Layup. Contested by Paolo Rozier (2.7 feet, MAN). Julius Durant misses. Rebound secured by Damian Mobley.

[06:50] Team_048 possession (Score: 54-70)
Damian Mobley attempts a Layup. Heavily contested by Franz Antetokounmpo (0.6 feet, ZONE)! Damian Mobley misses. Rebound secured by Bradley Sabonis.

[06:35] Team_081 possession (Score: 54-70)
Franz Antetokounmpo drives, picks up Kevin Fox. Help arrives from Karl Johnson! Franz Antetokounmpo attempts a Dunk. Contested by Karl Johnson (4.8 feet, ZONE). FRANZ ANTETOKOUNMPO MAKES IT!
Score: 56-70

[06:20] Team_048 possession (Score: 56-70)
FOUL! Holding foul on Vince Adebayo. [Team fouls: 2] No free throws, side out. (Vince Adebayo: 1 personal fouls)

[06:08] Team_048 possession (Score: 56-70)
Dejounte Sexton drives, picks up Vince Adebayo. Help arrives from Bradley Leonard! Dejounte Sexton attempts a Dunk. Contested by Bradley Leonard (6.0 feet, MAN). DEJOUNTE SEXTON MAKES IT! Assist: Kevin Fox
Score: 56-72

[05:57] Team_081 possession (Score: 56-72)
FOUL! Holding foul on Kevin Fox. [Team fouls: 3] No free throws, side out. (Kevin Fox: 3 personal fouls)

[05:41] Team_081 possession (Score: 56-72)
Vince Adebayo drives, picks up Kevin Fox. Help arrives from Karl Johnson! Vince Adebayo attempts a Dunk. Contested by Karl Johnson (3.1 feet, ZONE). VINCE ADEBAYO MAKES IT!
Score: 58-72

[05:27] Team_048 possession (Score: 58-72)
FOUL! Holding foul on Bradley Leonard. [Team fouls: 3] No free throws, side out. (Bradley Leonard: 1 personal fouls)

[05:13] Team_048 possession (Score: 58-72)
Damian Mobley attempts a Layup. Contested by Franz Antetokounmpo (4.9 feet, MAN). DAMIAN MOBLEY MAKES IT! Assist: Paolo Rozier
Score: 58-74

[04:57] Team_081 possession (Score: 58-74)
Bradley Leonard attempts a Midrange. Heavily contested by Dejounte Sexton (1.8 feet, ZONE)! Bradley Leonard misses. Rebound secured by Dejounte Sexton.

[04:38] Team_048 possession (Score: 58-74)
Damian Mobley attempts a Midrange. Wide open! Franz Antetokounmpo is 6.5 feet away. [MAN] DAMIAN MOBLEY MAKES IT! Assist: Karl Johnson
Score: 58-76

[04:21] Team_081 possession (Score: 58-76)
Julius Durant attempts a 3Pt. Contested by Paolo Rozier (2.7 feet, MAN). Julius Durant misses. Rebound secured by Dejounte Sexton.

[04:08] Team_048 possession (Score: 58-76)
Dejounte Sexton attempts a 3Pt. Wide open! Vince Adebayo is 7.2 feet away. [MAN] Dejounte Sexton misses. Rebound secured by Franz Antetokounmpo.

[03:52] Team_081 possession (Score: 58-76)
Bradley Sabonis makes the Layup and draws the foul on Kevin Fox! And-1! Bradley Sabonis to the line for 1. [Team fouls: 4] (Kevin Fox: 4 personal fouls)   FT 1/1: GOOD Bradley Sabonis makes 1/1 from the line.
Score: 61-76

[03:38] Team_048 possession (Score: 61-76)
Paolo Rozier attempts a 3Pt. Contested by Vince Adebayo (5.1 feet, ZONE). Paolo Rozier misses. Rebound secured by Vince Adebayo.

[03:24] Team_081 possession (Score: 61-76)
Bradley Leonard attempts a 3Pt. Contested by Karl Johnson (4.5 feet, MAN). Bradley Leonard misses. Offensive rebound by Franz Antetokounmpo! Franz Antetokounmpo puts it back in!
Score: 63-76

[03:06] Team_048 possession (Score: 63-76)
Kevin Fox makes the Layup and draws the foul on Bradley Sabonis! And-1! Kevin Fox to the line for 1. [Team fouls: 4] (Bradley Sabonis: 2 personal fouls)   FT 1/1: GOOD Kevin Fox makes 1/1 from the line.
Score: 63-79

[02:53] Team_081 possession (Score: 63-79)
Bradley Sabonis drives to the basket... Bradley Sabonis loses the ball! Stripped by Kevin Fox! TURNOVER! (live ball)

[02:42] Team_048 possession (Score: 63-79)
Karl Johnson makes the Layup and draws the foul on Vince Adebayo! And-1! Karl Johnson to the line for 1. [BONUS: 5 team fouls] (Vince Adebayo: 2 personal fouls)   FT 1/1: GOOD Karl Johnson makes 1/1 from the line.
Score: 63-82

[02:27] Team_081 possession (Score: 63-82)
Vince Adebayo loses control! Ball rolls out of bounds! TURNOVER! (dead ball)

[02:27] Substitution (Team_081): Vince Adebayo OUT → Larry Adebayo IN (stamina_rule2)

[02:27] Substitution (Team_048): Karl Johnson OUT → Yao Booker IN (stamina_rule2)

[02:27] Substitution (Team_048): Damian Mobley OUT → Gary Giddey IN (stamina_rule2)

[02:17] Team_048 possession (Score: 63-82)
Paolo Rozier attempts a Layup. Contested by Julius Durant (3.4 feet, MAN). PAOLO ROZIER MAKES IT!
Score: 63-84

[02:03] Team_081 possession (Score: 63-84)
FOUL! Offensive foul on Bradley Sabonis! Kevin Fox drew the charge! [Team fouls: 6] (Bradley Sabonis: 3 personal fouls) TURNOVER! (dead ball)

[01:47] Team_048 possession (Score: 63-84)
Yao Booker attempts a 3Pt. Contested by Bradley Leonard (2.2 feet, MAN). Yao Booker misses. Rebound secured by Franz Antetokounmpo.

[01:31] Team_081 possession (Score: 63-84)
Bradley Sabonis throws a bad pass out of bounds! TURNOVER! (dead ball)

[01:31] Substitution (Team_081): Julius Durant OUT → Dejounte Bane IN (stamina_rule2)

[01:31] Substitution (Team_081): Bradley Leonard OUT → Lamelo Wade IN (stamina_rule2)

[01:31] Substitution (Team_081): Bradley Sabonis OUT → Chris Holiday IN (stamina_rule2)

[01:31] Substitution (Team_081): Franz Antetokounmpo OUT → D'Angelo Markkanen IN (stamina_rule2)

[01:31] Substitution (Team_048): Paolo Rozier OUT → Lauri Curry IN (stamina_rule2)

[01:31] Substitution (Team_048): Dejounte Sexton OUT → Kyle Irving IN (stamina_rule2)

[01:31] Substitution (Team_048): Kevin Fox OUT → DeMar Hyland IN (stamina_rule2)

[01:20] Team_048 possession (Score: 63-84)
Yao Booker drives, Chris Holiday stays with him. Yao Booker attempts a Dunk. Contested by Chris Holiday (2.7 feet, ZONE). Yao Booker misses. Offensive rebound by DeMar Hyland! DeMar Hyland kicks it out.

[01:05] Team_048 possession (Score: 63-84)
Lauri Curry attempts a 3Pt. Wide open! Dejounte Bane is 7.1 feet away. [MAN] Lauri Curry misses. Rebound secured by Chris Holiday.

[00:48] Team_081 possession (Score: 63-84)
Chris Holiday attempts a 3Pt. Heavily contested by DeMar Hyland (1.9 feet, MAN)! Chris Holiday misses. Rebound secured by Gary Giddey.

[00:31] Team_048 possession (Score: 63-84)
DeMar Hyland attempts a Midrange. Contested by Lamelo Wade (3.3 feet, ZONE). DeMar Hyland misses. Rebound secured by Chris Holiday.

[00:18] Team_081 possession (Score: 63-84)
Larry Adebayo loses control! Ball rolls out of bounds! TURNOVER! (dead ball)

[00:08] Team_048 possession (Score: 63-84)
Kyle Irving attempts a Layup. BLOCKED BY LARRY ADEBAYO! Ball is loose! Offensive rebound by Kyle Irving! Kyle Irving kicks it out.

================================================================================
                              3RD QUARTER COMPLETE                              
================================================================================

3RD QUARTER SCORE: Team_081 21, Team_048 17

BOX SCORE:
================================================================================

Team_081
--------------------------------------------------------------------------------
Player                MIN  PTS  REB  AST  TO      FG   FG%      3P   3P%
--------------------------------------------------------------------------------
Vince Adebayo          33    6    4    2   0   3/4    75.0     0/0   0.0
Franz Antetokounmpo    34    6    4    1   0   3/3   100.0     0/0   0.0
Bradley Sabonis        34    5    6    1   0   2/3    66.7     0/0   0.0
Bradley Leonard        34    3    0    0   0   1/2    50.0     0/0   0.0
Julius Durant          34    0    0    1   0   0/2     0.0     0/0   0.0
Chris Holiday           2    0    2    0   0   0/1     0.0     0/0   0.0

TEAM: FG: 9/15 (60.0%), 3PT: 2/5 (40.0%), REB: 16 (5 off, 11 def), AST: 5, TO: 5
TEAM FOULS: 6 [Team_048 in BONUS]


Team_048
--------------------------------------------------------------------------------
Player                MIN  PTS  REB  AST  TO      FG   FG%      3P   3P%
--------------------------------------------------------------------------------
Paolo Rozier           34    5    0    1   0   2/3    66.7     0/0   0.0
Damian Mobley          33    4    2    0   0   2/3    66.7     0/0   0.0
Karl Johnson           33    3    0    1   0   1/3    33.3     0/0   0.0
Kevin Fox              34    3    1    1   0   1/2    50.0     0/0   0.0
Dejounte Sexton        34    2    3    0   0   1/4    25.0     0/0   0.0
Yao Booker              3    0    0    0   0   0/1     0.0     0/0   0.0
DeMar Hyland            2    0    1    0   0   0/1     0.0     0/0   0.0
Lauri Curry             2    0    0    0   0   0/1     0.0     0/0   0.0
Gary Giddey             3    0    1    0   0   0/0     0.0     0/0   0.0
Kyle Irving             2    0    1    0   0   0/0     0.0     0/0   0.0

TEAM: FG: 7/18 (38.9%), 3PT: 0/6 (0.0%), REB: 9 (3 off, 6 def), AST: 3, TO: 1
TEAM FOULS: 4

================================================================================

================================================================================
                       4TH QUARTER - Team_081 vs Team_048                       
================================================================================

[12:00] Substitution (Team_081): Julius Durant OUT (stamina: 77) → Dejounte Bane IN (comeback_detected)

[12:00] Substitution (Team_048): Paolo Rozier OUT (stamina: 76) → Lauri Curry IN (comeback_detected)

[12:00] Team_081 possession (Score: 63-84)
Dejounte Bane makes the Midrange and draws the foul on Lauri Curry! And-1! Dejounte Bane to the line for 1. [Team fouls: 1] (Lauri Curry: 1 personal fouls)   FT 1/1: GOOD Dejounte Bane makes 1/1 from the line.
Score: 66-84

[11:46] Team_048 possession (Score: 66-84)
Kevin Fox attempts a Layup. Wide open! Bradley Sabonis is 6.2 feet away. [MAN] KEVIN FOX MAKES IT!
Score: 66-86

[11:35] Team_081 possession (Score: 66-86)
Franz Antetokounmpo attempts a Layup. Contested by Kevin Fox (5.4 feet, MAN). FRANZ ANTETOKOUNMPO MAKES IT! Assist: Dejounte Bane
Score: 68-86

[11:18] Team_048 possession (Score: 68-86)
Dejounte Sexton attempts a 3Pt. Contested by Vince Adebayo (2.8 feet, MAN). Dejounte Sexton misses. Rebound secured by Franz Antetokounmpo.

[11:01] Team_081 possession (Score: 68-86)
Dejounte Bane attempts a 3Pt. Heavily contested by Lauri Curry (1.8 feet, MAN)! Dejounte Bane misses. Rebound secured by Kevin Fox.

[10:45] Team_048 possession (Score: 68-86)
Dejounte Sexton attempts a 3Pt. Contested by Vince Adebayo (5.8 feet, MAN). Dejounte Sexton misses. Rebound secured by Vince Adebayo.

[10:35] Team_081 possession (Score: 68-86)
Dejounte Bane drives to the basket... Dejounte Bane loses control! Ball rolls out of bounds! TURNOVER! (dead ball)

[10:21] Team_048 possession (Score: 68-86)
FOUL! Holding foul on Franz Antetokounmpo. [Team fouls: 1] No free throws, side out. (Franz Antetokounmpo: 1 personal fouls)

[10:03] Team_048 possession (Score: 68-86)
Karl Johnson loses the ball! Stripped by Bradley Leonard! TURNOVER! (live ball)

[09:49] Team_081 possession (Score: 68-86)
Franz Antetokounmpo makes the Layup and draws the foul on Damian Mobley! And-1! Franz Antetokounmpo to the line for 1. [Team fouls: 2] (Damian Mobley: 1 personal fouls)   FT 1/1: MISS Franz Antetokounmpo makes 0/1 from the line. Rebound secured by Kevin Fox.
Score: 70-86

[09:37] Team_048 possession (Score: 70-86)
Dejounte Sexton attempts a Midrange. Contested by Bradley Sabonis (4.0 feet, ZONE). Dejounte Sexton misses. Rebound secured by Bradley Sabonis.

[09:26] Team_081 possession (Score: 70-86)
Vince Adebayo attempts a 3Pt. Contested by Dejounte Sexton (4.6 feet, MAN). VINCE ADEBAYO MAKES IT! Assist: Bradley Leonard
Score: 73-86

[09:07] Team_048 possession (Score: 73-86)
Dejounte Sexton makes the Layup and draws the foul on Vince Adebayo! And-1! Dejounte Sexton to the line for 1. [Team fouls: 2] (Vince Adebayo: 1 personal fouls)   FT 1/1: MISS Dejounte Sexton makes 0/1 from the line. Rebound secured by Franz Antetokounmpo.
Score: 73-88

[08:57] Team_081 possession (Score: 73-88)
Franz Antetokounmpo drives to the basket... Franz Antetokounmpo throws a bad pass! Stolen by Kevin Fox! TURNOVER! (live ball)

[08:43] Team_048 possession (Score: 73-88)
Kevin Fox makes the 3Pt and draws the foul on Vince Adebayo! And-1! Kevin Fox to the line for 1. [Team fouls: 3] (Vince Adebayo: 2 personal fouls)   FT 1/1: MISS Kevin Fox makes 0/1 from the line. Rebound secured by Bradley Sabonis.
Score: 73-91

[08:29] Team_081 possession (Score: 73-91)
Bradley Leonard attempts a 3Pt. Contested by Dejounte Sexton (5.6 feet, ZONE). BRADLEY LEONARD MAKES IT! Assist: Vince Adebayo
Score: 76-91

[08:15] Team_048 possession (Score: 76-91)
Dejounte Sexton attempts a 3Pt. Contested by Vince Adebayo (3.9 feet, ZONE). Dejounte Sexton misses. Rebound secured by Vince Adebayo.

[08:04] Team_081 possession (Score: 76-91)
Bradley Sabonis attempts a Layup. Wide open! Kevin Fox is 6.2 feet away. [MAN] BRADLEY SABONIS MAKES IT! Assist: Vince Adebayo
Score: 78-91

[07:51] Team_048 possession (Score: 78-91)
Dejounte Sexton attempts a 3Pt. Contested by Vince Adebayo (2.9 feet, ZONE). DEJOUNTE SEXTON MAKES IT! Assist: Damian Mobley
Score: 78-94

[07:38] Team_081 possession (Score: 78-94)
Franz Antetokounmpo drives and kicks out. Bradley Leonard attempts a 3Pt. Wide open! Dejounte Sexton is 6.2 feet away. [ZONE] BRADLEY LEONARD MAKES IT! Assist: Vince Adebayo
Score: 81-94

[07:25] Team_048 possession (Score: 81-94)
Dejounte Sexton loses the ball! Stripped by Vince Adebayo! TURNOVER! (live ball)

[07:10] Team_081 possession (Score: 81-94)
Dejounte Bane attempts a 3Pt. Contested by Dejounte Sexton (4.5 feet, ZONE). Dejounte Bane misses. Rebound secured by Kevin Fox.

[06:58] Team_048 possession (Score: 81-94)
FOUL! Holding foul on Bradley Leonard. [Team fouls: 4] No free throws, side out. (Bradley Leonard: 1 personal fouls)

[06:45] Team_048 possession (Score: 81-94)
Lauri Curry attempts a 3Pt. Contested by Dejounte Bane (4.5 feet, MAN). LAURI CURRY MAKES IT! Assist: Karl Johnson
Score: 81-97

[06:31] Team_081 possession (Score: 81-97)
Bradley Leonard drives, picks up Karl Johnson. Help arrives from Dejounte Sexton! Bradley Leonard attempts a Dunk. Contested by Dejounte Sexton (3.3 feet, MAN). Bradley Leonard misses. Rebound secured by Dejounte Sexton.

[06:21] Team_048 possession (Score: 81-97)
Kevin Fox attempts a Midrange. Wide open! Bradley Sabonis is 6.6 feet away. [MAN] KEVIN FOX MAKES IT! Assist: Dejounte Sexton
Score: 81-99

[06:06] Team_081 possession (Score: 81-99)
Dejounte Bane attempts a Midrange. Wide open! Karl Johnson is 7.2 feet away. [ZONE] DEJOUNTE BANE MAKES IT!
Score: 83-99

[05:47] Team_048 possession (Score: 83-99)
Lauri Curry drives, Bradley Sabonis stays with him. Lauri Curry attempts a Layup. Wide open! Bradley Sabonis is 7.2 feet away. [ZONE] LAURI CURRY MAKES IT! Assist: Karl Johnson
Score: 83-101

[05:30] Team_081 possession (Score: 83-101)
Bradley Sabonis drives to the basket... Bradley Sabonis loses the ball! Stripped by Kevin Fox! TURNOVER! (live ball)

[05:18] Team_048 possession (Score: 83-101)
Karl Johnson throws a bad pass out of bounds! TURNOVER! (dead ball)

[05:18] Substitution (Team_081): Bradley Leonard OUT → Lamelo Wade IN (stamina_rule2)

[05:18] Substitution (Team_081): Vince Adebayo OUT → Larry Adebayo IN (stamina_rule2)

[05:18] Substitution (Team_081): Bradley Sabonis OUT → Chris Holiday IN (stamina_rule2)

[05:18] Substitution (Team_081): Franz Antetokounmpo OUT → D'Angelo Markkanen IN (stamina_rule2)

[05:18] Substitution (Team_048): Karl Johnson OUT → Yao Booker IN (stamina_rule2)

[05:18] Substitution (Team_048): Dejounte Sexton OUT → Kyle Irving IN (stamina_rule2)

[05:18] Substitution (Team_048): Kevin Fox OUT → DeMar Hyland IN (stamina_rule2)

[05:18] Substitution (Team_048): Damian Mobley OUT → Gary Giddey IN (stamina_rule2)

[05:04] Team_081 possession (Score: 83-101)
Dejounte Bane attempts a 3Pt. Wide open! Lauri Curry is 6.6 feet away. [MAN] Dejounte Bane misses. Offensive rebound by Chris Holiday! Chris Holiday kicks it out.

[04:50] Team_081 possession (Score: 83-101)
Dejounte Bane attempts a Midrange. Contested by DeMar Hyland (3.5 feet, ZONE). DEJOUNTE BANE MAKES IT!
Score: 85-101

[04:36] Team_048 possession (Score: 85-101)
DeMar Hyland attempts a 3Pt. Contested by Chris Holiday (5.6 feet, ZONE). DeMar Hyland misses. Rebound secured by Lamelo Wade.

[04:23] Team_081 possession (Score: 85-101)
D'Angelo Markkanen makes the Layup and draws the foul on DeMar Hyland! And-1! D'Angelo Markkanen to the line for 1. [Team fouls: 3] (DeMar Hyland: 1 personal fouls)   FT 1/1: GOOD D'Angelo Markkanen makes 1/1 from the line.
Score: 88-101

[04:13] Team_048 possession (Score: 88-101)
FOUL! Shooting foul on Chris Holiday. Yao Booker to the line for 2 free throws. [BONUS: 5 team fouls] (Chris Holiday: 1 personal fouls)   FT 1/2: GOOD   FT 2/2: MISS Yao Booker makes 1/2 from the line. FOUL! Loose ball foul on Larry Adebayo during the free throw rebound! [IN THE BONUS! 6 team fouls] DeMar Hyland to the line for 2 free throws. (Larry Adebayo: 1 personal fouls)   FT 1/2: GOOD   FT 2/2: GOOD DeMar Hyland makes 2/2 from the line.
Score: 88-104

[04:01] Team_081 possession (Score: 88-104)
Chris Holiday attempts a 3Pt. Contested by DeMar Hyland (2.1 feet, MAN). Chris Holiday misses. FOUL! Loose ball foul on DeMar Hyland during the rebound battle. [Team fouls: 4] No free throws, side out. (DeMar Hyland: 2 personal fouls)

[03:47] Team_081 possession (Score: 88-104)
FOUL! Holding foul on Kyle Irving. [IN THE BONUS! 5 team fouls] Larry Adebayo to the line for 2 free throws. (Kyle Irving: 1 personal fouls)   FT 1/2: GOOD   FT 2/2: GOOD Larry Adebayo makes 2/2 from the line.
Score: 90-104

[03:29] Team_048 possession (Score: 90-104)
FOUL! Reach-in foul on Chris Holiday during the drive. [IN THE BONUS! 7 team fouls] Kyle Irving to the line for 2 free throws. (Chris Holiday: 2 personal fouls)   FT 1/2: GOOD   FT 2/2: GOOD Kyle Irving makes 2/2 from the line.
Score: 90-106

[03:17] Team_081 possession (Score: 90-106)
Lamelo Wade attempts a 3Pt. Wide open! Yao Booker is 6.4 feet away. [MAN] Lamelo Wade misses. Rebound secured by Gary Giddey.

[03:04] Team_048 possession (Score: 90-106)
Yao Booker attempts a 3Pt. Contested by Chris Holiday (4.7 feet, ZONE). Yao Booker misses. Rebound secured by Larry Adebayo.

[02:50] Team_081 possession (Score: 90-106)
D'Angelo Markkanen drives and kicks out. Dejounte Bane attempts a Midrange. Contested by Yao Booker (4.2 feet, ZONE). Dejounte Bane misses. Rebound secured by Gary Giddey.

[02:33] Team_048 possession (Score: 90-106)
Kyle Irving attempts a 3Pt. Wide open! Chris Holiday is 7.7 feet away. [ZONE] Kyle Irving misses. Rebound secured by Chris Holiday.

[02:19] Team_081 possession (Score: 90-106)
Chris Holiday drives and kicks out. Larry Adebayo attempts a 3Pt. Contested by DeMar Hyland (2.3 feet, ZONE). Larry Adebayo misses. Rebound secured by DeMar Hyland.

[02:05] Team_048 possession (Score: 90-106)
Lauri Curry drives, Dejounte Bane stays with him. Lauri Curry attempts a Dunk. Contested by Dejounte Bane (5.4 feet, MAN). Lauri Curry misses. Rebound secured by Chris Holiday.

[01:47] Team_081 possession (Score: 90-106)
Larry Adebayo drives to the basket... Larry Adebayo loses control! Ball rolls out of bounds! TURNOVER! (dead ball)

[01:47] Substitution (Team_081): Dejounte Bane OUT → Julius Durant IN (starter_return_rule1)

[01:32] Team_048 possession (Score: 90-106)
DeMar Hyland drives and kicks out. DeMar Hyland makes the Midrange and draws the foul on Chris Holiday! And-1! DeMar Hyland to the line for 1. [BONUS: 8 team fouls] (Chris Holiday: 3 personal fouls)   FT 1/1: GOOD DeMar Hyland makes 1/1 from the line.
Score: 90-109

[01:16] Team_081 possession (Score: 90-109)
Larry Adebayo attempts a 3Pt. Contested by Kyle Irving (5.0 feet, MAN). Larry Adebayo misses. Rebound secured by Kyle Irving.

[01:02] Team_048 possession (Score: 90-109)
Gary Giddey makes the Dunk and draws the foul on Chris Holiday! And-1! Gary Giddey to the line for 1. [BONUS: 9 team fouls] (Chris Holiday: 4 personal fouls)   FT 1/1: MISS Gary Giddey makes 0/1 from the line. FOUL! Loose ball foul on Chris Holiday during the free throw rebound! [IN THE BONUS! 10 team fouls] DeMar Hyland to the line for 2 free throws. (Chris Holiday: 5 personal fouls)   FT 1/2: GOOD   FT 2/2: GOOD DeMar Hyland makes 2/2 from the line.
Score: 90-113

[00:45] Team_081 possession (Score: 90-113)
Chris Holiday attempts a Midrange. Contested by DeMar Hyland (5.7 feet, MAN). CHRIS HOLIDAY MAKES IT! Assist: Larry Adebayo
Score: 92-113

[00:28] Team_048 possession (Score: 92-113)
Kyle Irving attempts a 3Pt. Wide open! Larry Adebayo is 8.2 feet away. [MAN] Kyle Irving misses. Offensive rebound by DeMar Hyland! DeMar Hyland kicks it out.

[00:15] Team_048 possession (Score: 92-113)
FOUL! Holding foul on Larry Adebayo. [IN THE BONUS! 11 team fouls] Kyle Irving to the line for 2 free throws. (Larry Adebayo: 2 personal fouls)   FT 1/2: GOOD   FT 2/2: GOOD Kyle Irving makes 2/2 from the line.
Score: 92-115

[00:04] Team_081 possession (Score: 92-115)
Larry Adebayo attempts a 3Pt. Wide open! Kyle Irving is 6.9 feet away. [MAN] Larry Adebayo misses. Rebound secured by DeMar Hyland.

================================================================================
                              4TH QUARTER COMPLETE                              
================================================================================

4TH QUARTER SCORE: Team_081 29, Team_048 31

BOX SCORE:
================================================================================

Team_081
--------------------------------------------------------------------------------
Player                MIN  PTS  REB  AST  TO      FG   FG%      3P   3P%
--------------------------------------------------------------------------------
Dejounte Bane          12    7    0    1   0   3/5    60.0     0/0   0.0
Bradley Leonard        41    6    0    1   0   2/3    66.7     0/0   0.0
Vince Adebayo          40    3    2    3   0   1/1   100.0     0/0   0.0
D'Angelo Markkanen      7    3    0    0   0   1/2    50.0     0/0   0.0
Franz Antetokounmpo    41    2    2    0   0   1/2    50.0     0/0   0.0
Bradley Sabonis        41    2    2    0   0   1/1   100.0     0/0   0.0
Chris Holiday           7    2    3    0   0   1/2    50.0     0/0   0.0
Larry Adebayo           8    2    1    1   0   1/3    33.3     0/0   0.0
Lamelo Wade             7    0    2    0   0   0/1     0.0     0/0   0.0

TEAM: FG: 11/20 (55.0%), 3PT: 2/7 (28.6%), REB: 12 (2 off, 10 def), AST: 6, TO: 4
TEAM FOULS: 11 [Team_048 in BONUS]


Team_048
--------------------------------------------------------------------------------
Player                MIN  PTS  REB  AST  TO      FG   FG%      3P   3P%
--------------------------------------------------------------------------------
DeMar Hyland            7   10    3    0   0   3/4    75.0     0/0   0.0
Lauri Curry            14    5    0    0   0   2/3    66.7     0/0   0.0
Kevin Fox              41    4    3    0   0   2/3    66.7     0/0   0.0
Kyle Irving             7    4    1    0   0   2/3    66.7     0/0   0.0
Dejounte Sexton        41    3    1    1   0   1/6    16.7     0/0   0.0
Damian Mobley          40    0    0    1   0   0/0     0.0     0/0   0.0
Karl Johnson           40    0    0    2   0   0/0     0.0     0/0   0.0
Gary Giddey             8    0    2    0   0   0/0     0.0     0/0   0.0
Yao Booker              8    0    0    0   0   0/1     0.0     0/0   0.0

TEAM: FG: 10/20 (50.0%), 3PT: 2/9 (22.2%), REB: 10 (1 off, 9 def), AST: 4, TO: 3
TEAM FOULS: 5 [Team_081 in BONUS]

================================================================================

================================================================================
                               FULL GAME COMPLETE                               
================================================================================

FINAL SCORE: Team_081 92, Team_048 115

SCORING BY QUARTER:
--------------------------------------------------------------------------------
Team                     Q1     Q2     Q3     Q4    FINAL
--------------------------------------------------------------------------------
Team_081                 21     21     21     29       92
Team_048                 40     27     17     31      115
--------------------------------------------------------------------------------

FULL GAME BOX SCORE:
================================================================================

Team_081
--------------------------------------------------------------------------------
Player                MIN  PTS  REB  AST  TO      FG   FG%      3P   3P%      FT STL BLK
--------------------------------------------------------------------------------
Bradley Leonard        41   20    0    4   3   6/15   40.0   6/9    66.7   0/0     1   0
Bradley Sabonis        41   11   13    3   3   6/15   40.0   0/4     0.0   2/3     0   0
Franz Antetokounmpo    41   20   12    1   2   8/12   66.7   0/1     0.0   4/5     0   0
Vince Adebayo          40   12   13   10   1   5/9    55.6   2/6    33.3   3/3     1   0
Julius Durant          36   10    0    1   3   5/11   45.5   1/4    25.0   2/3     0   0
Dejounte Bane          12    7    0    1   0   3/5    60.0   0/2     0.0   1/1     0   0
Larry Adebayo           8    2    1    1   1   0/2     0.0   0/2     0.0   2/2     0   1
Lamelo Wade             7    0    3    0   1   0/1     0.0   0/1     0.0   0/0     0   0
Chris Holiday           7    2    5    0   0   1/3    33.3   0/1     0.0   0/0     0   0
D'Angelo Markkanen      7    5    0    0   0   2/3    66.7   0/0     0.0   1/1     0   0

TEAM: FG: 38/78 (48.7%), 3PT: 9/30 (30.0%), REB: 48 (11 off, 37 def), AST: 21, TO: 14


Team_048
--------------------------------------------------------------------------------
Player                MIN  PTS  REB  AST  TO      FG   FG%      3P   3P%      FT STL BLK
--------------------------------------------------------------------------------
Dejounte Sexton        41   15   13    2   1   6/19   31.6   2/11   18.2   1/3     0   0
Kevin Fox              41   18   16    4   1   7/14   50.0   0/2     0.0   5/7     3   0
Karl Johnson           40   14    0    6   3   6/10   60.0   1/2    50.0   3/3     0   2
Damian Mobley          40   11   11    4   1   5/7    71.4   1/1   100.0   0/0     0   0
Paolo Rozier           34   31    0    2   0  12/16   75.0   2/5    40.0   6/6     1   0
Lauri Curry            14    5    0    0   0   2/4    50.0   1/2    50.0   0/0     0   0
Yao Booker              8    0    0    0   0   1/3    33.3   0/2     0.0   1/2     0   0
Gary Giddey             8    0    3    0   0   1/1   100.0   0/0     0.0   0/1     0   0
Kyle Irving             7    4    2    0   0   1/2    50.0   0/1     0.0   4/4     0   0
DeMar Hyland            7   10    4    0   0   1/3    33.3   0/1     0.0   1/1     0   0

TEAM: FG: 45/82 (54.9%), 3PT: 7/27 (25.9%), REB: 48 (9 off, 39 def), AST: 18, TO: 6

================================================================================
