================================================================================
                        FULL GAME - Team_077 vs Team_060                        
================================================================================

================================================================================
                       1ST QUARTER - Team_077 vs Team_060                       
================================================================================

[12:00] Team_077 possession (Score: 0-0)
Chris Ginobili makes the Layup and draws the foul on Jaren George! And-1! Chris Ginobili to the line for 1. [Team fouls: 1] (Jaren George: 1 personal fouls)   FT 1/1: GOOD Chris Ginobili makes 1/1 from the line.
Score: 3-0

[11:46] Team_060 possession (Score: 3-0)
Jaren George attempts a Layup. Wide open! Draymond Dosunmu is 6.1 feet away. [MAN] JAREN GEORGE MAKES IT!
Score: 3-2

[11:34] Team_077 possession (Score: 3-2)
Russell Harden attempts a 3Pt. Wide open! Larry Westbrook is 6.1 feet away. [MAN] RUSSELL HARDEN MAKES IT! Assist: Dejounte Allen
Score: 6-2

[11:18] Team_060 possession (Score: 6-2)
Jaren George makes the Layup and draws the foul on Draymond Dosunmu! And-1! Jaren George to the line for 1. [Team fouls: 1] (Draymond Dosunmu: 1 personal fouls)   FT 1/1: GOOD Jaren George makes 1/1 from the line.
Score: 6-5

[11:04] Team_077 possession (Score: 6-5)
Ja Ball attempts a 3Pt. Contested by Joel Morant (5.6 feet, MAN). Ja Ball misses. Rebound secured by Larry Westbrook.

[10:51] Team_060 possession (Score: 6-5)
Larry Westbrook attempts a Layup. Contested by Draymond Dosunmu (4.9 feet, ZONE). LARRY WESTBROOK MAKES IT! Assist: Immanuel Ming
Score: 6-7

[10:42] Team_077 possession (Score: 6-7)
Chris Ginobili attempts a Midrange. Contested by Immanuel Ming (5.9 feet, ZONE). CHRIS GINOBILI MAKES IT!
Score: 8-7

[10:33] Team_060 possession (Score: 8-7)
Julius Green attempts a Layup. Contested by Draymond Dosunmu (4.5 feet, ZONE). JULIUS GREEN MAKES IT! Assist: Immanuel Ming
Score: 8-9

[10:20] Team_077 possession (Score: 8-9)
Draymond Dosunmu attempts a Midrange. Heavily contested by Immanuel Ming (0.5 feet, ZONE)! DRAYMOND DOSUNMU MAKES IT!
Score: 10-9

[10:04] Team_060 possession (Score: 10-9)
Immanuel Ming attempts a 3Pt. Heavily contested by Dejounte Allen (1.4 feet, ZONE)! IMMANUEL MING MAKES IT! Assist: Jaren George
Score: 10-12

[09:50] Team_077 possession (Score: 10-12)
Ja Ball attempts a 3Pt. Contested by Joel Morant (5.9 feet, MAN). Ja Ball misses. Offensive rebound by Draymond Dosunmu! Draymond Dosunmu kicks it out.

[09:35] Team_077 possession (Score: 10-12)
Dejounte Allen attempts a 3Pt. Contested by Julius Green (4.4 feet, ZONE). DEJOUNTE ALLEN MAKES IT! Assist: Ja Ball
Score: 13-12

[09:18] Team_060 possession (Score: 13-12)
Immanuel Ming attempts a Midrange. Heavily contested by Dejounte Allen (1.9 feet, ZONE)! IMMANUEL MING MAKES IT! Assist: Julius Green
Score: 13-14

[09:04] Team_077 possession (Score: 13-14)
Ja Ball drives and kicks out. Chris Ginobili attempts a 3Pt. Contested by Immanuel Ming (2.7 feet, MAN). Chris Ginobili misses. Rebound secured by Larry Westbrook.

[08:54] Team_060 possession (Score: 13-14)
Joel Morant attempts a 3Pt. Heavily contested by Ja Ball (0.5 feet, MAN)! Joel Morant misses. Rebound secured by Draymond Dosunmu.

[08:43] Team_077 possession (Score: 13-14)
Dejounte Allen attempts a 3Pt. Wide open! Julius Green is 7.0 feet away. [MAN] DEJOUNTE ALLEN MAKES IT! Assist: Russell Harden
Score: 16-14

[08:30] Team_060 possession (Score: 16-14)
Julius Green throws a bad pass! Stolen by Dejounte Allen! TURNOVER! (live ball)

[08:14] Team_077 possession (Score: 16-14)
Chris Ginobili attempts a 3Pt. Contested by Immanuel Ming (3.6 feet, MAN). Chris Ginobili misses. Rebound secured by Jaren George.

[08:04] Team_060 possession (Score: 16-14)
FOUL! Shooting foul on Russell Harden. Immanuel Ming to the line for 2 free throws. [Team fouls: 2] (Russell Harden: 1 personal fouls)   FT 1/2: GOOD   FT 2/2: GOOD Immanuel Ming makes 2/2 from the line.
Score: 16-16

[07:51] Team_077 possession (Score: 16-16)
FOUL! Reach-in foul on Jaren George during the drive. [Team fouls: 2] No free throws, side out. (Jaren George: 2 personal fouls)

[07:35] Team_077 possession (Score: 16-16)
Draymond Dosunmu drives and kicks out. Ja Ball attempts a Midrange. Contested by Joel Morant (5.4 feet, MAN). JA BALL MAKES IT! Assist: Draymond Dosunmu
Score: 18-16

[07:24] Team_060 possession (Score: 18-16)
Immanuel Ming attempts a 3Pt. Contested by Chris Ginobili (3.1 feet, MAN). Immanuel Ming misses. Rebound secured by Russell Harden.

[07:05] Team_077 possession (Score: 18-16)
Chris Ginobili drives, picks up Jaren George. Help arrives from Julius Green! Chris Ginobili attempts a Layup. Contested by Julius Green (5.3 feet, ZONE). CHRIS GINOBILI MAKES IT! Assist: Draymond Dosunmu
Score: 20-16

[06:55] Team_060 possession (Score: 20-16)
Julius Green attempts a Layup. Heavily contested by Dejounte Allen (1.8 feet, MAN)! JULIUS GREEN MAKES IT! Assist: Larry Westbrook
Score: 20-18

[06:41] Team_077 possession (Score: 20-18)
Draymond Dosunmu attempts a 3Pt. Heavily contested by Joel Morant (1.5 feet, ZONE)! Draymond Dosunmu misses. Rebound secured by Immanuel Ming.

[06:26] Team_060 possession (Score: 20-18)
Julius Green drives to the basket... Julius Green loses control! Ball rolls out of bounds! TURNOVER! (dead ball)

[06:14] Team_077 possession (Score: 20-18)
FOUL! Holding foul on Julius Green. [Team fouls: 3] No free throws, side out. (Julius Green: 1 personal fouls)

[06:01] Team_077 possession (Score: 20-18)
Ja Ball attempts a Midrange. Contested by Julius Green (3.9 feet, ZONE). Ja Ball misses. Offensive rebound by Draymond Dosunmu! Draymond Dosunmu kicks it out.

[05:44] Team_077 possession (Score: 20-18)
Chris Ginobili drives and kicks out. Russell Harden attempts a Midrange. Contested by Larry Westbrook (2.3 feet, MAN). RUSSELL HARDEN MAKES IT!
Score: 22-18

[05:28] Team_060 possession (Score: 22-18)
Larry Westbrook drives and kicks out. Julius Green attempts a 3Pt. Heavily contested by Dejounte Allen (1.1 feet, MAN)! Julius Green misses. Rebound secured by Russell Harden.

[05:14] Team_077 possession (Score: 22-18)
Chris Ginobili drives, Jaren George stays with him. Chris Ginobili attempts a Dunk. Wide open! Jaren George is 7.3 feet away. [ZONE] CHRIS GINOBILI MAKES IT! Assist: Ja Ball
Score: 24-18

[05:03] Team_060 possession (Score: 24-18)
Julius Green drives to the basket... Julius Green loses the ball! Stripped by Draymond Dosunmu! TURNOVER! (live ball)

[04:46] Team_077 possession (Score: 24-18)
Draymond Dosunmu attempts a Layup. Wide open! Jaren George is 6.6 feet away. [ZONE] DRAYMOND DOSUNMU MAKES IT! Assist: Dejounte Allen
Score: 26-18

[04:30] Team_060 possession (Score: 26-18)
Joel Morant makes the Layup and draws the foul on Draymond Dosunmu! And-1! Joel Morant to the line for 1. [Team fouls: 3] (Draymond Dosunmu: 2 personal fouls)   FT 1/1: GOOD Joel Morant makes 1/1 from the line.
Score: 26-21

[04:18] Team_077 possession (Score: 26-21)
Draymond Dosunmu attempts a Layup. Wide open! Jaren George is 6.4 feet away. [ZONE] DRAYMOND DOSUNMU MAKES IT!
Score: 28-21

[04:01] Team_060 possession (Score: 28-21)
FOUL! Shooting foul on Chris Ginobili. Immanuel Ming to the line for 2 free throws. [Team fouls: 4] (Chris Ginobili: 1 personal fouls)   FT 1/2: GOOD   FT 2/2: GOOD Immanuel Ming makes 2/2 from the line.
Score: 28-23

[03:50] Team_077 possession (Score: 28-23)
FOUL! Shooting foul on Immanuel Ming. Chris Ginobili to the line for 2 free throws. [Team fouls: 4] (Immanuel Ming: 1 personal fouls)   FT 1/2: MISS   FT 2/2: MISS Chris Ginobili makes 0/2 from the line. Rebound secured by Immanuel Ming.

[03:34] Team_060 possession (Score: 28-23)
Julius Green attempts a Layup. Contested by Russell Harden (3.0 feet, ZONE). JULIUS GREEN MAKES IT!
Score: 28-25

[03:16] Team_077 possession (Score: 28-25)
Ja Ball attempts a Midrange. Contested by Jaren George (2.2 feet, ZONE). Ja Ball misses. FOUL! Loose ball foul on Larry Westbrook during the rebound battle. [IN THE BONUS! 5 team fouls] Russell Harden to the line for 2 free throws. (Larry Westbrook: 1 personal fouls)   FT 1/2: GOOD   FT 2/2: GOOD Russell Harden makes 2/2 from the line.
Score: 30-25

[02:57] Team_060 possession (Score: 30-25)
FOUL! Reach-in foul on Draymond Dosunmu during the drive. [IN THE BONUS! 5 team fouls] Jaren George to the line for 2 free throws. (Draymond Dosunmu: 3 personal fouls)   FT 1/2: GOOD   FT 2/2: GOOD Jaren George makes 2/2 from the line.
Score: 30-27

[02:43] Team_077 possession (Score: 30-27)
Ja Ball drives, Joel Morant stays with him. Ja Ball attempts a Dunk. Contested by Joel Morant (5.0 feet, MAN). JA BALL MAKES IT!
Score: 32-27

[02:32] Team_060 possession (Score: 32-27)
Jaren George drives to the basket... Jaren George loses the ball! Stripped by Draymond Dosunmu! TURNOVER! (live ball)

[02:16] Team_077 possession (Score: 32-27)
Chris Ginobili drives and kicks out. Chris Ginobili attempts a 3Pt. Contested by Immanuel Ming (3.1 feet, MAN). Chris Ginobili misses. FOUL! Loose ball foul on Jaren George during the rebound battle. [IN THE BONUS! 6 team fouls] Draymond Dosunmu to the line for 2 free throws. (Jaren George: 3 personal fouls)   FT 1/2: GOOD   FT 2/2: GOOD Draymond Dosunmu makes 2/2 from the line.
Score: 34-27

[02:01] Team_060 possession (Score: 34-27)
Julius Green attempts a 3Pt. Heavily contested by Dejounte Allen (1.9 feet, ZONE)! Julius Green misses. Rebound secured by Draymond Dosunmu.

[01:50] Team_077 possession (Score: 34-27)
Ja Ball attempts a 3Pt. Wide open! Julius Green is 6.1 feet away. [ZONE] Ja Ball misses. Offensive rebound by Draymond Dosunmu! Draymond Dosunmu kicks it out.

[01:36] Team_077 possession (Score: 34-27)
Dejounte Allen attempts a Midrange. Contested by Julius Green (3.3 feet, MAN). Dejounte Allen misses. Rebound secured by Immanuel Ming.

[01:20] Team_060 possession (Score: 34-27)
Immanuel Ming attempts a 3Pt. Contested by Chris Ginobili (4.7 feet, MAN). Immanuel Ming misses. Rebound secured by Russell Harden.

[01:02] Team_077 possession (Score: 34-27)
Russell Harden drives to the basket... FOUL! Offensive foul on Russell Harden! Jaren George drew the charge! [Team fouls: 6] (Russell Harden: 2 personal fouls) TURNOVER! (dead ball)

[00:48] Team_060 possession (Score: 34-27)
Joel Morant attempts a Midrange. Contested by Ja Ball (4.3 feet, MAN). Joel Morant misses. Rebound secured by Chris Ginobili.

[00:38] Team_077 possession (Score: 34-27)
Dejounte Allen attempts a 3Pt. Contested by Julius Green (4.1 feet, ZONE). DEJOUNTE ALLEN MAKES IT! Assist: Chris Ginobili
Score: 37-27

[00:23] Team_060 possession (Score: 37-27)
Immanuel Ming attempts a 3Pt. Contested by Dejounte Allen (4.6 feet, ZONE). Immanuel Ming misses. Rebound secured by Chris Ginobili.

[00:09] Team_077 possession (Score: 37-27)
Dejounte Allen attempts a Midrange. Contested by Julius Green (2.8 feet, ZONE). Dejounte Allen misses. Rebound secured by Jaren George.

================================================================================
                              1ST QUARTER COMPLETE                              
================================================================================

1ST QUARTER SCORE: Team_077 37, Team_060 27

BOX SCORE:
================================================================================

Team_077
--------------------------------------------------------------------------------
Player                MIN  PTS  REB  AST  TO      FG   FG%      3P   3P%
--------------------------------------------------------------------------------
Chris Ginobili         12    9    2    1   0   4/6    66.7     0/0   0.0
Dejounte Allen         12    9    0    2   0   3/5    60.0     0/0   0.0
Draymond Dosunmu       12    8    5    2   0   4/5    80.0     0/0   0.0
Russell Harden         12    7    3    1   0   3/3   100.0     0/0   0.0
Ja Ball                12    4    0    2   0   2/4    50.0     0/0   0.0

TEAM: FG: 16/23 (69.6%), 3PT: 4/7 (57.1%), REB: 10 (3 off, 7 def), AST: 8, TO: 1
TEAM FOULS: 6 [Team_060 in BONUS]


Team_060
--------------------------------------------------------------------------------
Player                MIN  PTS  REB  AST  TO      FG   FG%      3P   3P%
--------------------------------------------------------------------------------
Immanuel Ming          12    9    3    2   0   4/7    57.1     0/0   0.0
Jaren George           12    7    2    1   0   3/3   100.0     0/0   0.0
Julius Green           12    6    0    1   0   3/4    75.0     0/0   0.0
Joel Morant            12    3    0    0   0   1/3    33.3     0/0   0.0
Larry Westbrook        12    2    2    1   0   1/2    50.0     0/0   0.0

TEAM: FG: 12/19 (63.2%), 3PT: 1/6 (16.7%), REB: 7 (0 off, 7 def), AST: 5, TO: 4
TEAM FOULS: 6 [Team_077 in BONUS]

================================================================================

================================================================================
                       2ND QUARTER - Team_077 vs Team_060                       
================================================================================

[12:00] Team_077 possession (Score: 37-27)
Russell Harden attempts a Midrange. Wide open! Larry Westbrook is 7.0 feet away. [MAN] Russell Harden misses. Rebound secured by Jaren George.

[11:43] Team_060 possession (Score: 37-27)
FOUL! Shooting foul on Ja Ball. Joel Morant to the line for 2 free throws. [Team fouls: 1] (Ja Ball: 1 personal fouls)   FT 1/2: GOOD   FT 2/2: GOOD Joel Morant makes 2/2 from the line.
Score: 37-29

[11:30] Team_077 possession (Score: 37-29)
Ja Ball attempts a Midrange. Wide open! Joel Morant is 7.6 feet away. [MAN] Ja Ball misses. Rebound secured by Larry Westbrook.

[11:16] Team_060 possession (Score: 37-29)
Larry Westbrook attempts a Layup. Contested by Russell Harden (4.3 feet, MAN). LARRY WESTBROOK MAKES IT!
Score: 37-31

[11:03] Team_077 possession (Score: 37-31)
Dejounte Allen attempts a 3Pt. Wide open! Larry Westbrook is 10.0 feet away. [ZONE] Dejounte Allen misses. Rebound secured by Larry Westbrook.

[10:49] Team_060 possession (Score: 37-31)
Immanuel Ming attempts a 3Pt. Contested by Chris Ginobili (3.7 feet, MAN). IMMANUEL MING MAKES IT! Assist: Joel Morant
Score: 37-34

[10:34] Team_077 possession (Score: 37-34)
Chris Ginobili attempts a 3Pt. Contested by Immanuel Ming (4.7 feet, MAN). Chris Ginobili misses. FOUL! Loose ball foul on Jaren George during the rebound battle. [Team fouls: 1] No free throws, side out. (Jaren George: 1 personal fouls)

[10:18] Team_077 possession (Score: 37-34)
Russell Harden drives, Larry Westbrook stays with him. Russell Harden attempts a Dunk. Contested by Larry Westbrook (5.3 feet, MAN). RUSSELL HARDEN MAKES IT! Assist: Dejounte Allen
Score: 39-34

[10:04] Team_060 possession (Score: 39-34)
Larry Westbrook attempts a 3Pt. Wide open! Ja Ball is 7.5 feet away. [ZONE] Larry Westbrook misses. Offensive rebound by Immanuel Ming! Immanuel Ming kicks it out.

[09:52] Team_060 possession (Score: 39-34)
Joel Morant attempts a 3Pt. Wide open! Ja Ball is 7.9 feet away. [MAN] Joel Morant misses. Offensive rebound by Immanuel Ming! Immanuel Ming kicks it out.

[09:38] Team_060 possession (Score: 39-34)
Immanuel Ming attempts a 3Pt. Heavily contested by Chris Ginobili (0.5 feet, MAN)! Immanuel Ming misses. Rebound secured by Russell Harden.

[09:22] Team_077 possession (Score: 39-34)
FOUL! Shooting foul on Immanuel Ming. Ja Ball to the line for 2 free throws. [Team fouls: 2] (Immanuel Ming: 1 personal fouls)   FT 1/2: GOOD   FT 2/2: GOOD Ja Ball makes 2/2 from the line.
Score: 41-34

[09:09] Team_060 possession (Score: 41-34)
Immanuel Ming attempts a Midrange. Contested by Russell Harden (3.3 feet, ZONE). Immanuel Ming misses. Rebound secured by Chris Ginobili.

[08:56] Team_077 possession (Score: 41-34)
Russell Harden attempts a Midrange. Wide open! Larry Westbrook is 6.7 feet away. [MAN] RUSSELL HARDEN MAKES IT!
Score: 43-34

[08:45] Team_060 possession (Score: 43-34)
Immanuel Ming attempts a 3Pt. Contested by Chris Ginobili (3.2 feet, MAN). Immanuel Ming misses. FOUL! Loose ball foul on Chris Ginobili during the rebound battle. [Team fouls: 2] No free throws, side out. (Chris Ginobili: 1 personal fouls)

[08:28] Team_060 possession (Score: 43-34)
FOUL! Shooting foul on Ja Ball. Larry Westbrook to the line for 2 free throws. [Team fouls: 3] (Ja Ball: 2 personal fouls)   FT 1/2: GOOD   FT 2/2: MISS Larry Westbrook makes 1/2 from the line. Rebound secured by Chris Ginobili.
Score: 43-35

[08:11] Team_077 possession (Score: 43-35)
Draymond Dosunmu attempts a Layup. Wide open! Jaren George is 6.6 feet away. [MAN] DRAYMOND DOSUNMU MAKES IT!
Score: 45-35

[07:57] Team_060 possession (Score: 45-35)
Immanuel Ming attempts a 3Pt. Contested by Dejounte Allen (4.5 feet, ZONE). Immanuel Ming misses. FOUL! Loose ball foul on Draymond Dosunmu during the rebound battle. [Team fouls: 4] No free throws, side out. (Draymond Dosunmu: 1 personal fouls)

[07:47] Team_060 possession (Score: 45-35)
Larry Westbrook drives to the basket... FOUL! Offensive foul on Larry Westbrook! Russell Harden drew the charge! [Team fouls: 3] (Larry Westbrook: 1 personal fouls) TURNOVER! (dead ball)

[07:30] Team_077 possession (Score: 45-35)
FOUL! Reach-in foul on Jaren George during the drive. [Team fouls: 4] No free throws, side out. (Jaren George: 2 personal fouls)

[07:15] Team_077 possession (Score: 45-35)
Russell Harden throws a bad pass! Stolen by Larry Westbrook! TURNOVER! (live ball)

[07:00] Team_060 possession (Score: 45-35)
Jaren George drives, Draymond Dosunmu stays with him. Jaren George attempts a Layup. Wide open! Draymond Dosunmu is 6.7 feet away. [MAN] JAREN GEORGE MAKES IT!
Score: 45-37

[06:42] Team_077 possession (Score: 45-37)
Draymond Dosunmu attempts a Midrange. Contested by Jaren George (5.4 feet, MAN). Draymond Dosunmu misses. Rebound secured by Jaren George.

[06:25] Team_060 possession (Score: 45-37)
Jaren George attempts a 3Pt. Contested by Draymond Dosunmu (4.3 feet, MAN). Jaren George misses. Rebound secured by Draymond Dosunmu.

[06:12] Team_077 possession (Score: 45-37)
FOUL! Reach-in foul on Jaren George during the drive. [IN THE BONUS! 5 team fouls] Ja Ball to the line for 2 free throws. (Jaren George: 3 personal fouls)   FT 1/2: GOOD   FT 2/2: GOOD Ja Ball makes 2/2 from the line.
Score: 47-37

[06:00] Team_060 possession (Score: 47-37)
Jaren George attempts a Layup. BLOCKED BY DRAYMOND DOSUNMU! Ball is loose! Offensive rebound by Jaren George! Jaren George kicks it out.

[05:48] Team_060 possession (Score: 47-37)
Jaren George makes the Layup and draws the foul on Draymond Dosunmu! And-1! Jaren George to the line for 1. [BONUS: 5 team fouls] (Draymond Dosunmu: 2 personal fouls)   FT 1/1: GOOD Jaren George makes 1/1 from the line.
Score: 47-40

[05:33] Team_077 possession (Score: 47-40)
Draymond Dosunmu attempts a Layup. Wide open! Jaren George is 7.3 feet away. [ZONE] DRAYMOND DOSUNMU MAKES IT!
Score: 49-40

[05:17] Team_060 possession (Score: 49-40)
Larry Westbrook attempts a Layup. Contested by Russell Harden (5.6 feet, ZONE). LARRY WESTBROOK MAKES IT! Assist: Immanuel Ming
Score: 49-42

[05:04] Team_077 possession (Score: 49-42)
Draymond Dosunmu drives to the basket... Draymond Dosunmu throws a bad pass out of bounds! TURNOVER! (dead ball)

[05:04] Substitution (Team_077): Ja Ball OUT → Bam Bryant IN (stamina_rule2)

[05:04] Substitution (Team_077): Dejounte Allen OUT → Dejounte Quickley IN (stamina_rule2)

[05:04] Substitution (Team_077): Chris Ginobili OUT → Tyler Poole IN (stamina_rule2)

[05:04] Substitution (Team_077): Russell Harden OUT → Jordan Simmons IN (stamina_rule2)

[05:04] Substitution (Team_077): Draymond Dosunmu OUT → Ayo Griffin IN (stamina_rule2)

[05:04] Substitution (Team_060): Joel Morant OUT → Domantas Barnes IN (stamina_rule2)

[05:04] Substitution (Team_060): Julius Green OUT → Rudy Ginobili IN (stamina_rule2)

[05:04] Substitution (Team_060): Immanuel Ming OUT → Jarrett Wagner IN (stamina_rule2)

[05:04] Substitution (Team_060): Larry Westbrook OUT → Yao Tatum IN (stamina_rule2)

[05:04] Substitution (Team_060): Jaren George OUT → Klay Haliburton IN (stamina_rule2)

[04:52] Team_060 possession (Score: 49-42)
Rudy Ginobili attempts a 3Pt. Contested by Dejounte Quickley (3.2 feet, ZONE). RUDY GINOBILI MAKES IT! Assist: Klay Haliburton
Score: 49-45

[04:34] Team_077 possession (Score: 49-45)
Tyler Poole drives, Klay Haliburton stays with him. Tyler Poole attempts a Dunk. Contested by Klay Haliburton (2.5 feet, ZONE). Tyler Poole misses. Offensive rebound by Jordan Simmons! Jordan Simmons kicks it out.

[04:21] Team_077 possession (Score: 49-45)
Dejounte Quickley attempts a 3Pt. Contested by Domantas Barnes (5.6 feet, ZONE). Dejounte Quickley misses. Rebound secured by Klay Haliburton.

[04:10] Team_060 possession (Score: 49-45)
Domantas Barnes attempts a 3Pt. Contested by Dejounte Quickley (5.6 feet, ZONE). Domantas Barnes misses. Rebound secured by Jordan Simmons.

[03:59] Team_077 possession (Score: 49-45)
Ayo Griffin attempts a Midrange. Contested by Rudy Ginobili (3.2 feet, ZONE). Ayo Griffin misses. Offensive rebound by Ayo Griffin! Ayo Griffin's putback is no good. Rebound secured by Rudy Ginobili.

[03:43] Team_060 possession (Score: 49-45)
Rudy Ginobili attempts a Midrange. Heavily contested by Dejounte Quickley (1.7 feet, MAN)! RUDY GINOBILI MAKES IT! Assist: Klay Haliburton
Score: 49-47

[03:32] Team_077 possession (Score: 49-47)
Tyler Poole drives, Jarrett Wagner stays with him. Tyler Poole attempts a Layup. Contested by Jarrett Wagner (5.6 feet, MAN). TYLER POOLE MAKES IT!
Score: 51-47

[03:18] Team_060 possession (Score: 51-47)
Jarrett Wagner drives and kicks out. Rudy Ginobili attempts a 3Pt. Contested by Dejounte Quickley (3.6 feet, ZONE). RUDY GINOBILI MAKES IT! Assist: Domantas Barnes
Score: 51-50

[03:00] Team_077 possession (Score: 51-50)
Bam Bryant attempts a 3Pt. Contested by Domantas Barnes (5.5 feet, ZONE). Bam Bryant misses. Rebound secured by Klay Haliburton.

[02:46] Team_060 possession (Score: 51-50)
Domantas Barnes drives and kicks out. Domantas Barnes attempts a Midrange. Contested by Jordan Simmons (5.0 feet, ZONE). Domantas Barnes misses. Rebound secured by Jordan Simmons.

[02:30] Team_077 possession (Score: 51-50)
Bam Bryant attempts a 3Pt. Contested by Jarrett Wagner (5.3 feet, ZONE). Bam Bryant misses. Offensive rebound by Ayo Griffin! Ayo Griffin puts it back in!
Score: 53-50

[02:12] Team_060 possession (Score: 53-50)
Rudy Ginobili drives and kicks out. Klay Haliburton attempts a 3Pt. Wide open! Dejounte Quickley is 6.8 feet away. [ZONE] KLAY HALIBURTON MAKES IT! Assist: Domantas Barnes
Score: 53-53

[02:00] Team_077 possession (Score: 53-53)
FOUL! Shooting foul on Jarrett Wagner. Bam Bryant to the line for 2 free throws. [BONUS: 6 team fouls] (Jarrett Wagner: 1 personal fouls)   FT 1/2: GOOD   FT 2/2: GOOD Bam Bryant makes 2/2 from the line.
Score: 55-53

[01:44] Team_060 possession (Score: 55-53)
Rudy Ginobili attempts a 3Pt. Contested by Dejounte Quickley (4.5 feet, MAN). RUDY GINOBILI MAKES IT! Assist: Domantas Barnes
Score: 55-56

[01:29] Team_077 possession (Score: 55-56)
FOUL! Reach-in foul on Yao Tatum during the drive. [IN THE BONUS! 7 team fouls] Jordan Simmons to the line for 2 free throws. (Yao Tatum: 1 personal fouls)   FT 1/2: MISS   FT 2/2: GOOD Jordan Simmons makes 1/2 from the line.
Score: 56-56

[01:15] Team_060 possession (Score: 56-56)
Rudy Ginobili attempts a 3Pt. Wide open! Dejounte Quickley is 9.0 feet away. [MAN] RUDY GINOBILI MAKES IT! Assist: Domantas Barnes
Score: 56-59

[01:01] Team_077 possession (Score: 56-59)
Tyler Poole attempts a Layup. Contested by Klay Haliburton (2.6 feet, ZONE). Tyler Poole misses. FOUL! Loose ball foul on Domantas Barnes during the rebound battle. [IN THE BONUS! 8 team fouls] Jordan Simmons to the line for 2 free throws. (Domantas Barnes: 1 personal fouls)   FT 1/2: GOOD   FT 2/2: MISS Jordan Simmons makes 1/2 from the line. Rebound secured by Domantas Barnes.
Score: 57-59

[00:44] Team_060 possession (Score: 57-59)
FOUL! Shooting foul on Jordan Simmons. Jarrett Wagner to the line for 2 free throws. [BONUS: 6 team fouls] (Jordan Simmons: 1 personal fouls)   FT 1/2: GOOD   FT 2/2: GOOD Jarrett Wagner makes 2/2 from the line.
Score: 57-61

[00:33] Team_077 possession (Score: 57-61)
Ayo Griffin attempts a Midrange. Contested by Rudy Ginobili (3.4 feet, ZONE). AYO GRIFFIN MAKES IT!
Score: 59-61

[00:16] Team_060 possession (Score: 59-61)
Domantas Barnes attempts a 3Pt. Wide open! Bam Bryant is 6.8 feet away. [MAN] Domantas Barnes misses. Offensive rebound by Klay Haliburton! Klay Haliburton puts it back in!
Score: 59-63

[00:04] Team_077 possession (Score: 59-63)
Dejounte Quickley drives to the basket... FOUL! Offensive foul on Dejounte Quickley! Rudy Ginobili drew the charge! [Team fouls: 7] (Dejounte Quickley: 1 personal fouls) TURNOVER! (dead ball)

================================================================================
                              2ND QUARTER COMPLETE                              
================================================================================

2ND QUARTER SCORE: Team_077 22, Team_060 36

BOX SCORE:
================================================================================

Team_077
--------------------------------------------------------------------------------
Player                MIN  PTS  REB  AST  TO      FG   FG%      3P   3P%
--------------------------------------------------------------------------------
Russell Harden         19    4    2    0   0   2/3    66.7     0/0   0.0
Ja Ball                19    4    0    0   0   2/3    66.7     0/0   0.0
Draymond Dosunmu       19    4    1    0   0   2/3    66.7     0/0   0.0
Ayo Griffin             5    4    1    0   0   2/3    66.7     0/0   0.0
Tyler Poole             5    2    0    0   0   1/2    50.0     0/0   0.0
Bam Bryant              5    2    0    0   0   1/2    50.0     0/0   0.0
Jordan Simmons          5    1    3    0   0   1/1   100.0     0/0   0.0
Dejounte Allen         19    0    0    1   0   0/1     0.0     0/0   0.0
Chris Ginobili         19    0    2    0   0   0/0     0.0     0/0   0.0
Dejounte Quickley       5    0    0    0   0   0/1     0.0     0/0   0.0
Domantas Barnes         5    0    1    4   0   0/2     0.0     0/0   0.0

TEAM: FG: 11/19 (57.9%), 3PT: 1/4 (25.0%), REB: 11 (5 off, 6 def), AST: 1, TO: 3
TEAM FOULS: 7 [Team_060 in BONUS]


Team_060
--------------------------------------------------------------------------------
Player                MIN  PTS  REB  AST  TO      FG   FG%      3P   3P%
--------------------------------------------------------------------------------
Rudy Ginobili           5   14    1    0   0   5/5   100.0     0/0   0.0
Jaren George           19    5    4    0   0   2/3    66.7     0/0   0.0
Klay Haliburton         5    5    3    2   0   2/2   100.0     0/0   0.0
Larry Westbrook        19    4    2    0   0   2/3    66.7     0/0   0.0
Immanuel Ming          19    3    3    1   0   1/3    33.3     0/0   0.0
Joel Morant            19    2    0    1   0   1/1   100.0     0/0   0.0
Jarrett Wagner          5    2    0    0   0   1/1   100.0     0/0   0.0

TEAM: FG: 14/20 (70.0%), 3PT: 5/8 (62.5%), REB: 12 (6 off, 6 def), AST: 8, TO: 1
TEAM FOULS: 8 [Team_077 in BONUS]

================================================================================

================================================================================
                       3RD QUARTER - Team_077 vs Team_060                       
================================================================================

[12:00] Team_077 possession (Score: 59-63)
Dejounte Allen attempts a Layup. Wide open! Jaren George is 6.1 feet away. [ZONE] Dejounte Allen misses. Rebound secured by Jaren George.

[11:42] Team_060 possession (Score: 59-63)
Julius Green attempts a Layup. Contested by Draymond Dosunmu (3.6 feet, ZONE). JULIUS GREEN MAKES IT!
Score: 59-65

[11:31] Team_077 possession (Score: 59-65)
Ja Ball drives, picks up Jaren George. Help arrives from Julius Green! Ja Ball attempts a Layup. Contested by Julius Green (3.9 feet, ZONE). JA BALL MAKES IT!
Score: 61-65

[11:18] Team_060 possession (Score: 61-65)
Jaren George drives, Draymond Dosunmu stays with him. Jaren George attempts a Layup. Contested by Draymond Dosunmu (2.4 feet, ZONE). Jaren George misses. Offensive rebound by Jaren George! Jaren George puts it back in!
Score: 61-67

[11:03] Team_077 possession (Score: 61-67)
Chris Ginobili attempts a Midrange. Wide open! Immanuel Ming is 7.7 feet away. [ZONE] CHRIS GINOBILI MAKES IT! Assist: Russell Harden
Score: 63-67

[10:47] Team_060 possession (Score: 63-67)
Julius Green attempts a 3Pt. Contested by Dejounte Allen (2.5 feet, ZONE). Julius Green misses. Rebound secured by Draymond Dosunmu.

[10:29] Team_077 possession (Score: 63-67)
Russell Harden attempts a 3Pt. Contested by Larry Westbrook (6.0 feet, MAN). Russell Harden misses. Offensive rebound by Draymond Dosunmu! Draymond Dosunmu kicks it out.

[10:16] Team_077 possession (Score: 63-67)
Russell Harden attempts a 3Pt. Contested by Larry Westbrook (4.3 feet, MAN). RUSSELL HARDEN MAKES IT!
Score: 66-67

[10:01] Team_060 possession (Score: 66-67)
Joel Morant attempts a Midrange. Contested by Ja Ball (2.3 feet, MAN). Joel Morant misses. Rebound secured by Draymond Dosunmu.

[09:42] Team_077 possession (Score: 66-67)
Draymond Dosunmu attempts a 3Pt. Contested by Jaren George (4.3 feet, MAN). Draymond Dosunmu misses. Rebound secured by Immanuel Ming.

[09:28] Team_060 possession (Score: 66-67)
Larry Westbrook attempts a Layup. Wide open! Russell Harden is 7.5 feet away. [MAN] LARRY WESTBROOK MAKES IT!
Score: 66-69

[09:09] Team_077 possession (Score: 66-69)
Ja Ball attempts a Midrange. Contested by Julius Green (3.8 feet, ZONE). JA BALL MAKES IT!
Score: 68-69

[08:58] Team_060 possession (Score: 68-69)
Julius Green attempts a Midrange. Contested by Draymond Dosunmu (2.3 feet, ZONE). Julius Green misses. Rebound secured by Chris Ginobili.

[08:41] Team_077 possession (Score: 68-69)
Russell Harden attempts a Midrange. Wide open! Larry Westbrook is 6.6 feet away. [MAN] Russell Harden misses. Offensive rebound by Draymond Dosunmu! Draymond Dosunmu kicks it out.

[08:26] Team_077 possession (Score: 68-69)
Ja Ball loses the ball! Stripped by Joel Morant! TURNOVER! (live ball)

[08:12] Team_060 possession (Score: 68-69)
Jaren George drives and kicks out. Jaren George attempts a Midrange. Heavily contested by Draymond Dosunmu (0.5 feet, MAN)! Jaren George misses. Rebound secured by Chris Ginobili.

[07:59] Team_077 possession (Score: 68-69)
Russell Harden attempts a Midrange. Contested by Julius Green (5.0 feet, ZONE). Russell Harden misses. Rebound secured by Immanuel Ming.

[07:48] Team_060 possession (Score: 68-69)
Immanuel Ming attempts a 3Pt. Contested by Chris Ginobili (2.9 feet, MAN). Immanuel Ming misses. Rebound secured by Chris Ginobili.

[07:36] Team_077 possession (Score: 68-69)
Russell Harden attempts a Layup. Wide open! Larry Westbrook is 6.8 feet away. [MAN] RUSSELL HARDEN MAKES IT! Assist: Draymond Dosunmu
Score: 70-69

[07:21] Team_060 possession (Score: 70-69)
Julius Green drives, picks up Dejounte Allen. Help arrives from Chris Ginobili! Julius Green attempts a Dunk. Contested by Chris Ginobili (2.9 feet, MAN). Julius Green misses. Rebound secured by Draymond Dosunmu.

[07:07] Team_077 possession (Score: 70-69)
Russell Harden attempts a 3Pt. Wide open! Larry Westbrook is 8.3 feet away. [MAN] Russell Harden misses. Rebound secured by Larry Westbrook.

[06:55] Team_060 possession (Score: 70-69)
Jaren George drives and kicks out. Larry Westbrook attempts a 3Pt. Contested by Russell Harden (5.3 feet, MAN). Larry Westbrook misses. Rebound secured by Chris Ginobili.

[06:43] Team_077 possession (Score: 70-69)
Ja Ball attempts a 3Pt. Wide open! Joel Morant is 10.0 feet away. [MAN] Ja Ball misses. Rebound secured by Jaren George.

[06:24] Team_060 possession (Score: 70-69)
Joel Morant attempts a Layup. BLOCKED BY JA BALL! Ball is loose! Rebound secured by Draymond Dosunmu.

[06:07] Team_077 possession (Score: 70-69)
Dejounte Allen drives and kicks out. Dejounte Allen attempts a 3Pt. Wide open! Julius Green is 6.7 feet away. [ZONE] Dejounte Allen misses. Rebound secured by Immanuel Ming.

[05:54] Team_060 possession (Score: 70-69)
Jaren George attempts a Layup. Wide open! Draymond Dosunmu is 7.6 feet away. [MAN] JAREN GEORGE MAKES IT! Assist: Julius Green
Score: 70-71

[05:44] Team_077 possession (Score: 70-71)
Russell Harden drives to the basket... Russell Harden throws a bad pass out of bounds! TURNOVER! (dead ball)

[05:28] Team_060 possession (Score: 70-71)
Larry Westbrook attempts a 3Pt. Wide open! Chris Ginobili is 6.1 feet away. [ZONE] Larry Westbrook misses. Rebound secured by Chris Ginobili.

[05:13] Team_077 possession (Score: 70-71)
Russell Harden attempts a 3Pt. Wide open! Julius Green is 7.5 feet away. [ZONE] Russell Harden misses. Rebound secured by Immanuel Ming.

[05:01] Team_060 possession (Score: 70-71)
Jaren George drives, picks up Draymond Dosunmu. Help arrives from Ja Ball! Jaren George attempts a Layup. Wide open! Ja Ball is 9.2 feet away. [MAN] Jaren George misses. Offensive rebound by Jaren George! Jaren George puts it back in!
Score: 70-73

[04:52] Team_077 possession (Score: 70-73)
Chris Ginobili attempts a 3Pt. Contested by Julius Green (3.6 feet, ZONE). Chris Ginobili misses. Rebound secured by Immanuel Ming.

[04:42] Team_060 possession (Score: 70-73)
Julius Green attempts a 3Pt. BLOCKED BY DEJOUNTE ALLEN! Ball is loose! Rebound secured by Chris Ginobili.

[04:28] Team_077 possession (Score: 70-73)
Dejounte Allen attempts a Layup. Heavily contested by Julius Green (1.8 feet, MAN)! DEJOUNTE ALLEN MAKES IT! Assist: Draymond Dosunmu
Score: 72-73

[04:12] Team_060 possession (Score: 72-73)
Jaren George drives and kicks out. Jaren George attempts a 3Pt. Contested by Dejounte Allen (2.9 feet, ZONE). Jaren George misses. Rebound secured by Russell Harden.

[03:55] Team_077 possession (Score: 72-73)
Draymond Dosunmu attempts a Layup. Contested by Jaren George (5.2 feet, MAN). Draymond Dosunmu misses. Rebound secured by Larry Westbrook.

[03:41] Team_060 possession (Score: 72-73)
FOUL! Holding foul on Draymond Dosunmu. [Team fouls: 1] No free throws, side out. (Draymond Dosunmu: 1 personal fouls)

[03:25] Team_060 possession (Score: 72-73)
FOUL! Holding foul on Chris Ginobili. [Team fouls: 2] No free throws, side out. (Chris Ginobili: 1 personal fouls)

[03:06] Team_060 possession (Score: 72-73)
Larry Westbrook attempts a 3Pt. Contested by Russell Harden (3.7 feet, MAN). Larry Westbrook misses. Rebound secured by Draymond Dosunmu.

[02:48] Team_077 possession (Score: 72-73)
Draymond Dosunmu drives, Jaren George stays with him. Draymond Dosunmu attempts a Dunk. Wide open! Jaren George is 8.3 feet away. [ZONE] DRAYMOND DOSUNMU MAKES IT! Assist: Dejounte Allen
Score: 74-73

[02:30] Team_060 possession (Score: 74-73)
Larry Westbrook attempts a Layup. Wide open! Russell Harden is 6.3 feet away. [MAN] Larry Westbrook misses. Rebound secured by Draymond Dosunmu.

[02:16] Team_077 possession (Score: 74-73)
Russell Harden attempts a Layup. Wide open! Larry Westbrook is 6.9 feet away. [MAN] RUSSELL HARDEN MAKES IT! Assist: Draymond Dosunmu
Score: 76-73

[01:59] Team_060 possession (Score: 76-73)
Jaren George drives, Draymond Dosunmu stays with him. Jaren George attempts a Layup. Contested by Draymond Dosunmu (3.2 feet, ZONE). Jaren George misses. Rebound secured by Chris Ginobili.

[01:43] Team_077 possession (Score: 76-73)
Russell Harden attempts a 3Pt. Wide open! Julius Green is 8.9 feet away. [ZONE] Russell Harden misses. Rebound secured by Immanuel Ming.

[01:25] Team_060 possession (Score: 76-73)
Jaren George attempts a Midrange. Contested by Draymond Dosunmu (2.9 feet, MAN). JAREN GEORGE MAKES IT!
Score: 76-75

[01:09] Team_077 possession (Score: 76-75)
Ja Ball commits a violation (traveling/carry)! TURNOVER! (dead ball)

[01:09] Substitution (Team_077): Ja Ball OUT → Bam Bryant IN (stamina_rule2)

[01:09] Substitution (Team_077): Dejounte Allen OUT → Dejounte Quickley IN (stamina_rule2)

[01:09] Substitution (Team_077): Chris Ginobili OUT → Tyler Poole IN (stamina_rule2)

[01:09] Substitution (Team_077): Russell Harden OUT → Jordan Simmons IN (stamina_rule2)

[01:09] Substitution (Team_077): Draymond Dosunmu OUT → Ayo Griffin IN (stamina_rule2)

[01:09] Substitution (Team_060): Joel Morant OUT → Domantas Barnes IN (stamina_rule2)

[01:09] Substitution (Team_060): Julius Green OUT → Rudy Ginobili IN (stamina_rule2)

[01:09] Substitution (Team_060): Immanuel Ming OUT → Jarrett Wagner IN (stamina_rule2)

[01:09] Substitution (Team_060): Larry Westbrook OUT → Yao Tatum IN (stamina_rule2)

[01:09] Substitution (Team_060): Jaren George OUT → Klay Haliburton IN (stamina_rule2)

[00:53] Team_060 possession (Score: 76-75)
FOUL! Reach-in foul on Jordan Simmons during the drive. [Team fouls: 3] No free throws, side out. (Jordan Simmons: 1 personal fouls)

[00:36] Team_060 possession (Score: 76-75)
Rudy Ginobili attempts a 3Pt. Contested by Dejounte Quickley (3.4 feet, ZONE). Rudy Ginobili misses. Offensive rebound by Klay Haliburton! Klay Haliburton puts it back in!
Score: 76-77

[00:21] Team_077 possession (Score: 76-77)
Dejounte Quickley attempts a Midrange. Heavily contested by Rudy Ginobili (1.6 feet, MAN)! Dejounte Quickley misses. Rebound secured by Domantas Barnes.

[00:10] Team_060 possession (Score: 76-77)
Rudy Ginobili attempts a Midrange. Contested by Dejounte Quickley (4.3 feet, MAN). Rudy Ginobili misses. Rebound secured by Jordan Simmons.

================================================================================
                              3RD QUARTER COMPLETE                              
================================================================================

3RD QUARTER SCORE: Team_077 17, Team_060 14

BOX SCORE:
================================================================================

Team_077
--------------------------------------------------------------------------------
Player                MIN  PTS  REB  AST  TO      FG   FG%      3P   3P%
--------------------------------------------------------------------------------
Russell Harden         30    7    1    1   0   3/7    42.9     0/0   0.0
Ja Ball                30    4    0    0   0   2/3    66.7     0/0   0.0
Dejounte Allen         30    2    0    1   0   1/3    33.3     0/0   0.0
Chris Ginobili         30    2    7    0   0   1/2    50.0     0/0   0.0
Draymond Dosunmu       30    2    8    3   0   1/3    33.3     0/0   0.0
Dejounte Quickley       6    0    0    0   0   0/1     0.0     0/0   0.0
Jordan Simmons          6    0    1    0   0   0/0     0.0     0/0   0.0

TEAM: FG: 8/19 (42.1%), 3PT: 1/7 (14.3%), REB: 17 (2 off, 15 def), AST: 5, TO: 3
TEAM FOULS: 3


Team_060
--------------------------------------------------------------------------------
Player                MIN  PTS  REB  AST  TO      FG   FG%      3P   3P%
--------------------------------------------------------------------------------
Jaren George           30    8    4    0   0   4/8    50.0     0/0   0.0
Julius Green           30    2    0    1   0   1/5    20.0     0/0   0.0
Larry Westbrook        30    2    2    0   0   1/4    25.0     0/0   0.0
Klay Haliburton         6    2    1    0   0   1/1   100.0     0/0   0.0
Joel Morant            30    0    0    0   0   0/2     0.0     0/0   0.0
Immanuel Ming          30    0    6    0   0   0/1     0.0     0/0   0.0
Domantas Barnes         6    0    1    0   0   0/0     0.0     0/0   0.0
Rudy Ginobili           6    0    0    0   0   0/1     0.0     0/0   0.0

TEAM: FG: 7/22 (31.8%), 3PT: 1/6 (16.7%), REB: 14 (3 off, 11 def), AST: 1, TO: 0
TEAM FOULS: 0

================================================================================

================================================================================
                       4TH QUARTER - Team_077 vs Team_060                       
================================================================================

[12:00] Team_077 possession (Score: 76-77)
Chris Ginobili attempts a Layup. Wide open! Jaren George is 6.3 feet away. [ZONE] CHRIS GINOBILI MAKES IT! Assist: Russell Harden
Score: 78-77

[11:46] Team_060 possession (Score: 78-77)
Jaren George attempts a Layup. Contested by Russell Harden (5.2 feet, ZONE). JAREN GEORGE MAKES IT!
Score: 78-79

[11:30] Team_077 possession (Score: 78-79)
Draymond Dosunmu attempts a Midrange. Heavily contested by Julius Green (0.5 feet, ZONE)! DRAYMOND DOSUNMU MAKES IT!
Score: 80-79

[11:18] Team_060 possession (Score: 80-79)
Jaren George throws a bad pass out of bounds! TURNOVER! (dead ball)

[11:18] Substitution (Team_060): Joel Morant OUT → Domantas Barnes IN (stamina_rule2)

[11:18] Substitution (Team_060): Larry Westbrook OUT → Yao Tatum IN (stamina_rule2)

[11:18] Substitution (Team_060): Jaren George OUT → Klay Haliburton IN (stamina_rule2)

[11:04] Team_077 possession (Score: 80-79)
Dejounte Allen attempts a Layup. BLOCKED BY IMMANUEL MING! Ball goes out off Immanuel Ming. Dejounte Allen's ball!

[10:48] Team_077 possession (Score: 80-79)
Draymond Dosunmu attempts a 3Pt. Wide open! Domantas Barnes is 6.2 feet away. [ZONE] Draymond Dosunmu misses. Rebound secured by Immanuel Ming.

[10:33] Team_060 possession (Score: 80-79)
Immanuel Ming attempts a 3Pt. Contested by Chris Ginobili (4.3 feet, MAN). IMMANUEL MING MAKES IT! Assist: Julius Green
Score: 80-82

[10:22] Team_077 possession (Score: 80-82)
Dejounte Allen attempts a 3Pt. Wide open! Domantas Barnes is 6.2 feet away. [ZONE] DEJOUNTE ALLEN MAKES IT! Assist: Chris Ginobili
Score: 83-82

[10:10] Team_060 possession (Score: 83-82)
Klay Haliburton drives and kicks out. Julius Green attempts a 3Pt. Contested by Dejounte Allen (4.1 feet, MAN). Julius Green misses. Rebound secured by Russell Harden.

[09:55] Team_077 possession (Score: 83-82)
Ja Ball attempts a 3Pt. Contested by Domantas Barnes (2.9 feet, ZONE). JA BALL MAKES IT! Assist: Dejounte Allen
Score: 86-82

[09:45] Team_060 possession (Score: 86-82)
Immanuel Ming attempts a Layup. Wide open! Draymond Dosunmu is 6.0 feet away. [ZONE] IMMANUEL MING MAKES IT!
Score: 86-84

[09:32] Team_077 possession (Score: 86-84)
Dejounte Allen attempts a Midrange. Wide open! Julius Green is 8.6 feet away. [MAN] Dejounte Allen misses. Rebound secured by Immanuel Ming.

[09:18] Team_060 possession (Score: 86-84)
Julius Green drives, Dejounte Allen stays with him. Julius Green attempts a Layup. Contested by Dejounte Allen (3.7 feet, MAN). Julius Green misses. Offensive rebound by Klay Haliburton! Klay Haliburton's putback is no good. Rebound secured by Russell Harden.

[09:00] Team_077 possession (Score: 86-84)
Draymond Dosunmu attempts a Layup. Heavily contested by Klay Haliburton (1.0 feet, MAN)! DRAYMOND DOSUNMU MAKES IT!
Score: 88-84

[08:45] Team_060 possession (Score: 88-84)
Julius Green attempts a 3Pt. Contested by Dejounte Allen (4.4 feet, ZONE). Julius Green misses. FOUL! Loose ball foul on Russell Harden during the rebound battle. [Team fouls: 1] No free throws, side out. (Russell Harden: 1 personal fouls)

[08:33] Team_060 possession (Score: 88-84)
Julius Green attempts a Layup. Wide open! Draymond Dosunmu is 7.9 feet away. [ZONE] Julius Green misses. Rebound secured by Chris Ginobili.

[08:18] Team_077 possession (Score: 88-84)
Dejounte Allen drives, picks up Klay Haliburton. Help arrives from Julius Green! Dejounte Allen attempts a Dunk. Wide open! Julius Green is 7.7 feet away. [ZONE] Dejounte Allen misses. Rebound secured by Immanuel Ming.

[08:03] Team_060 possession (Score: 88-84)
Immanuel Ming attempts a Layup. Contested by Chris Ginobili (2.2 feet, MAN). IMMANUEL MING MAKES IT! Assist: Klay Haliburton
Score: 88-86

[07:50] Team_077 possession (Score: 88-86)
FOUL! Offensive foul on Chris Ginobili! Immanuel Ming drew the charge! [Team fouls: 2] (Chris Ginobili: 1 personal fouls) TURNOVER! (dead ball)

[07:31] Team_060 possession (Score: 88-86)
Immanuel Ming drives, Chris Ginobili stays with him. Immanuel Ming attempts a Dunk. Wide open! Chris Ginobili is 7.4 feet away. [MAN] IMMANUEL MING MAKES IT! Assist: Domantas Barnes
Score: 88-88

[07:16] Team_077 possession (Score: 88-88)
Russell Harden attempts a Layup. Wide open! Yao Tatum is 6.7 feet away. [MAN] Russell Harden misses. Rebound secured by Domantas Barnes.

[07:02] Team_060 possession (Score: 88-88)
Yao Tatum attempts a Layup. Wide open! Draymond Dosunmu is 7.5 feet away. [ZONE] YAO TATUM MAKES IT! Assist: Domantas Barnes
Score: 88-90

[06:49] Team_077 possession (Score: 88-90)
Russell Harden attempts a 3Pt. Contested by Domantas Barnes (2.6 feet, ZONE). Russell Harden misses. Rebound secured by Immanuel Ming.

[06:31] Team_060 possession (Score: 88-90)
Domantas Barnes drives and kicks out. Domantas Barnes attempts a 3Pt. Contested by Ja Ball (5.4 feet, MAN). DOMANTAS BARNES MAKES IT! Assist: Yao Tatum
Score: 88-93

[06:16] Team_077 possession (Score: 88-93)
Russell Harden drives, picks up Yao Tatum. Help arrives from Domantas Barnes! Russell Harden attempts a Dunk. Wide open! Domantas Barnes is 7.9 feet away. [MAN] RUSSELL HARDEN MAKES IT!
Score: 90-93

[06:05] Team_060 possession (Score: 90-93)
Julius Green attempts a 3Pt. Wide open! Ja Ball is 6.8 feet away. [ZONE] Julius Green misses. Rebound secured by Russell Harden.

[05:52] Team_077 possession (Score: 90-93)
Chris Ginobili drives, Klay Haliburton stays with him. Chris Ginobili attempts a Layup. Contested by Klay Haliburton (5.9 feet, ZONE). CHRIS GINOBILI MAKES IT! Assist: Ja Ball
Score: 92-93

[05:38] Team_060 possession (Score: 92-93)
Yao Tatum attempts a 3Pt. Wide open! Russell Harden is 6.4 feet away. [MAN] Yao Tatum misses. Rebound secured by Chris Ginobili.

[05:23] Team_077 possession (Score: 92-93)
Draymond Dosunmu attempts a Layup. Heavily contested by Klay Haliburton (1.5 feet, MAN)! DRAYMOND DOSUNMU MAKES IT! Assist: Russell Harden
Score: 94-93

[05:06] Team_060 possession (Score: 94-93)
Julius Green drives, Draymond Dosunmu stays with him. Julius Green attempts a Layup. Contested by Draymond Dosunmu (4.1 feet, ZONE). JULIUS GREEN MAKES IT! Assist: Domantas Barnes
Score: 94-95

[04:51] Team_077 possession (Score: 94-95)
Russell Harden drives to the basket... Russell Harden throws a bad pass! Stolen by Yao Tatum! TURNOVER! (live ball)

[04:37] Team_060 possession (Score: 94-95)
Klay Haliburton attempts a Layup. Contested by Draymond Dosunmu (4.5 feet, MAN). KLAY HALIBURTON MAKES IT!
Score: 94-97

[04:25] Team_077 possession (Score: 94-97)
Ja Ball attempts a 3Pt. Contested by Domantas Barnes (2.1 feet, MAN). Ja Ball misses. Rebound secured by Domantas Barnes.

[04:11] Team_060 possession (Score: 94-97)
Yao Tatum attempts a 3Pt. Contested by Russell Harden (4.9 feet, MAN). YAO TATUM MAKES IT! Assist: Klay Haliburton
Score: 94-100

[03:58] Team_077 possession (Score: 94-100)
Dejounte Allen attempts a Layup. Wide open! Julius Green is 6.3 feet away. [MAN] DEJOUNTE ALLEN MAKES IT! Assist: Draymond Dosunmu
Score: 96-100

[03:47] Team_060 possession (Score: 96-100)
Julius Green attempts a Midrange. Contested by Dejounte Allen (5.9 feet, MAN). Julius Green misses. Rebound secured by Russell Harden.

[03:36] Team_077 possession (Score: 96-100)
Chris Ginobili drives to the basket... Chris Ginobili commits a violation (traveling/carry)! TURNOVER! (dead ball)

[03:36] Substitution (Team_077): Ja Ball OUT → Bam Bryant IN (stamina_rule2)

[03:36] Substitution (Team_077): Dejounte Allen OUT → Dejounte Quickley IN (stamina_rule2)

[03:36] Substitution (Team_077): Chris Ginobili OUT → Tyler Poole IN (stamina_rule2)

[03:36] Substitution (Team_077): Russell Harden OUT → Jordan Simmons IN (stamina_rule2)

[03:36] Substitution (Team_077): Draymond Dosunmu OUT → Ayo Griffin IN (stamina_rule2)

[03:36] Substitution (Team_060): Julius Green OUT → Rudy Ginobili IN (stamina_rule2)

[03:36] Substitution (Team_060): Immanuel Ming OUT → Jarrett Wagner IN (stamina_rule2)

[03:18] Team_060 possession (Score: 96-100)
Klay Haliburton attempts a Layup. Contested by Ayo Griffin (2.1 feet, MAN). Klay Haliburton misses. Rebound secured by Jordan Simmons.

[03:05] Team_077 possession (Score: 96-100)
Tyler Poole makes the Layup and draws the foul on Jarrett Wagner! And-1! Tyler Poole to the line for 1. [Team fouls: 1] (Jarrett Wagner: 1 personal fouls)   FT 1/1: GOOD Tyler Poole makes 1/1 from the line.
Score: 99-100

[02:50] Team_060 possession (Score: 99-100)
FOUL! Reach-in foul on Tyler Poole during the drive. [Team fouls: 3] No free throws, side out. (Tyler Poole: 1 personal fouls)

[02:36] Team_060 possession (Score: 99-100)
Rudy Ginobili attempts a 3Pt. Contested by Jordan Simmons (5.2 feet, ZONE). Rudy Ginobili misses. Rebound secured by Ayo Griffin.

[02:19] Team_077 possession (Score: 99-100)
Tyler Poole attempts a Midrange. Contested by Jarrett Wagner (2.1 feet, MAN). TYLER POOLE MAKES IT! Assist: Bam Bryant
Score: 101-100

[02:06] Team_060 possession (Score: 101-100)
Yao Tatum attempts a 3Pt. Contested by Dejounte Quickley (3.1 feet, ZONE). Yao Tatum misses. Offensive rebound by Domantas Barnes! Domantas Barnes kicks it out.

[01:57] Team_060 possession (Score: 101-100)
Rudy Ginobili attempts a 3Pt. Wide open! Dejounte Quickley is 6.3 feet away. [MAN] RUDY GINOBILI MAKES IT! Assist: Klay Haliburton
Score: 101-103

[01:43] Team_077 possession (Score: 101-103)
Bam Bryant attempts a Midrange. Contested by Yao Tatum (3.2 feet, ZONE). Bam Bryant misses. Rebound secured by Klay Haliburton.

[01:26] Team_060 possession (Score: 101-103)
Domantas Barnes attempts a 3Pt. Wide open! Bam Bryant is 7.1 feet away. [MAN] Domantas Barnes misses. Rebound secured by Ayo Griffin.

[01:12] Team_077 possession (Score: 101-103)
Jordan Simmons attempts a Midrange. Contested by Rudy Ginobili (2.5 feet, ZONE). Jordan Simmons misses. Rebound secured by Rudy Ginobili.

[00:59] Team_060 possession (Score: 101-103)
Klay Haliburton attempts a Layup. Contested by Ayo Griffin (5.2 feet, MAN). Klay Haliburton misses. Rebound secured by Jordan Simmons.

[00:41] Team_077 possession (Score: 101-103)
Bam Bryant attempts a Midrange. Wide open! Jarrett Wagner is 6.9 feet away. [ZONE] Bam Bryant misses. Rebound secured by Domantas Barnes.

[00:29] Team_060 possession (Score: 101-103)
Domantas Barnes attempts a Layup. Contested by Jordan Simmons (4.9 feet, ZONE). DOMANTAS BARNES MAKES IT! Assist: Klay Haliburton
Score: 101-105

[00:14] Team_077 possession (Score: 101-105)
Jordan Simmons attempts a Midrange. Contested by Yao Tatum (5.5 feet, ZONE). Jordan Simmons misses. Rebound secured by Domantas Barnes.

================================================================================
                              4TH QUARTER COMPLETE                              
================================================================================

4TH QUARTER SCORE: Team_077 25, Team_060 28

BOX SCORE:
================================================================================

Team_077
--------------------------------------------------------------------------------
Player                MIN  PTS  REB  AST  TO      FG   FG%      3P   3P%
--------------------------------------------------------------------------------
Draymond Dosunmu       39    6    0    1   0   3/4    75.0     0/0   0.0
Dejounte Allen         39    5    0    1   0   2/4    50.0     0/0   0.0
Tyler Poole             9    5    0    0   0   2/2   100.0     0/0   0.0
Chris Ginobili         39    4    2    1   0   2/2   100.0     0/0   0.0
Ja Ball                39    3    0    1   0   1/2    50.0     0/0   0.0
Russell Harden         39    2    4    2   0   1/3    33.3     0/0   0.0
Jordan Simmons          9    0    2    0   0   0/2     0.0     0/0   0.0
Ayo Griffin             9    0    2    0   0   0/0     0.0     0/0   0.0
Bam Bryant              9    0    0    1   0   0/2     0.0     0/0   0.0

TEAM: FG: 11/21 (52.4%), 3PT: 2/5 (40.0%), REB: 9 (0 off, 9 def), AST: 7, TO: 3
TEAM FOULS: 3


Team_060
--------------------------------------------------------------------------------
Player                MIN  PTS  REB  AST  TO      FG   FG%      3P   3P%
--------------------------------------------------------------------------------
Immanuel Ming          39    9    4    0   0   4/4   100.0     0/0   0.0
Domantas Barnes        17    5    5    3   0   2/3    66.7     0/0   0.0
Yao Tatum              17    5    0    1   0   2/3    66.7     0/0   0.0
Rudy Ginobili           9    3    1    0   0   1/2    50.0     0/0   0.0
Jaren George           31    2    0    0   0   1/1   100.0     0/0   0.0
Julius Green           39    2    0    1   0   1/5    20.0     0/0   0.0
Klay Haliburton        17    2    2    4   0   1/4    25.0     0/0   0.0

TEAM: FG: 12/22 (54.5%), 3PT: 3/7 (42.9%), REB: 13 (3 off, 10 def), AST: 9, TO: 1
TEAM FOULS: 1

================================================================================

================================================================================
                               FULL GAME COMPLETE                               
================================================================================

FINAL SCORE: Team_077 101, Team_060 105

SCORING BY QUARTER:
--------------------------------------------------------------------------------
Team                     Q1     Q2     Q3     Q4    FINAL
--------------------------------------------------------------------------------
Team_077                 37     22     17     25      101
Team_060                 27     36     14     28      105
--------------------------------------------------------------------------------

FULL GAME BOX SCORE:
================================================================================

Team_077
--------------------------------------------------------------------------------
Player                MIN  PTS  REB  AST  TO      FG   FG%      3P   3P%      FT STL BLK
--------------------------------------------------------------------------------
Ja Ball                39   15    0    3   2   7/12   58.3   1/4    25.0   4/4     0   1
Dejounte Allen         39   16    0    5   0   6/13   46.2   4/5    80.0   0/0     1   1
Chris Ginobili         39   15   13    2   3   9/12   75.0   0/2     0.0   1/3     0   0
Russell Harden         39   20   10    4   3   7/14   50.0   2/6    33.3   2/2     0   0
Draymond Dosunmu       39   20   14    6   1  10/15   66.7   0/3     0.0   2/2     2   1
Bam Bryant              9    2    0    1   0   2/5    40.0   1/2    50.0   2/2     0   0
Dejounte Quickley       9    0    0    0   0   0/2     0.0   0/1     0.0   0/0     0   0
Tyler Poole             9    7    0    0   0   3/4    75.0   0/0     0.0   1/1     0   0
Jordan Simmons          9    1    6    0   0   1/3    33.3   0/0     0.0   2/4     0   0
Ayo Griffin             9    4    3    0   1   1/2    50.0   0/0     0.0   0/0     0   0

TEAM: FG: 46/82 (56.1%), 3PT: 8/23 (34.8%), REB: 47 (10 off, 37 def), AST: 21, TO: 10


Team_060
--------------------------------------------------------------------------------
Player                MIN  PTS  REB  AST  TO      FG   FG%      3P   3P%      FT STL BLK
--------------------------------------------------------------------------------
Julius Green           39   10    0    3   1   5/14   35.7   0/4     0.0   0/0     0   0
Immanuel Ming          39   21   16    3   2   9/15   60.0   3/8    37.5   4/4     0   1
Joel Morant            31    5    0    1   1   2/6    33.3   0/1     0.0   3/3     1   0
Larry Westbrook        31    8    6    1   1   4/9    44.4   0/2     0.0   1/2     1   0
Jaren George           31   22   10    1   1  10/15   66.7   0/1     0.0   4/4     0   0
Domantas Barnes        17    5    7    7   0   3/6    50.0   1/3    33.3   0/0     0   0
Yao Tatum              17    5    0    1   0   2/3    66.7   1/2    50.0   0/0     1   0
Klay Haliburton        17    9    6    6   0   1/4    25.0   0/0     0.0   0/0     0   0
Rudy Ginobili           9   17    2    0   0   7/9    77.8   5/6    83.3   0/0     0   0
Jarrett Wagner          9    2    0    0   0   2/2   100.0   0/0     0.0   2/2     0   0

TEAM: FG: 45/83 (54.2%), 3PT: 10/27 (37.0%), REB: 46 (12 off, 34 def), AST: 23, TO: 6

================================================================================
