================================================================================
                        FULL GAME - Team_032 vs Team_092                        
================================================================================

================================================================================
                       1ST QUARTER - Team_032 vs Team_092                       
================================================================================

[12:00] Team_032 possession (Score: 0-0)
DeMar Giddey attempts a Layup. Wide open! John Giddey is 6.1 feet away. [ZONE] DeMar Giddey misses. Rebound secured by John Giddey.

[11:47] Team_092 possession (Score: 0-0)
Karl Gobert drives, Anfernee Butler stays with him. Karl Gobert attempts a Layup. Heavily contested by Anfernee Butler (0.5 feet, ZONE)! KARL GOBERT MAKES IT! Assist: John Giddey
Score: 0-2

[11:36] Team_032 possession (Score: 0-2)
DeMar Giddey attempts a Layup. Contested by Karl Gobert (2.9 feet, MAN). DEMAR GIDDEY MAKES IT! Assist: Tobias Bane
Score: 2-2

[11:25] Team_092 possession (Score: 2-2)
Karl Gobert throws a bad pass! Stolen by DeMar Giddey! TURNOVER! (live ball)

[11:10] Team_032 possession (Score: 2-2)
Tobias Bane attempts a Layup. Contested by Austin Bridges (4.3 feet, MAN). TOBIAS BANE MAKES IT! Assist: DeMar Giddey
Score: 4-2

[10:57] Team_092 possession (Score: 4-2)
Karl Gobert attempts a 3Pt. Contested by Tobias Bane (5.2 feet, ZONE). KARL GOBERT MAKES IT! Assist: John Giddey
Score: 4-5

[10:45] Team_032 possession (Score: 4-5)
Jalen Westbrook attempts a 3Pt. Heavily contested by John Giddey (0.7 feet, ZONE)! Jalen Westbrook misses. Rebound secured by John Giddey.

[10:29] Team_092 possession (Score: 4-5)
John Giddey attempts a Midrange. Wide open! Jalen Westbrook is 6.1 feet away. [ZONE] John Giddey misses. Rebound secured by Malcolm Lillard.

[10:15] Team_032 possession (Score: 4-5)
Tobias Bane makes the Layup and draws the foul on John Giddey! And-1! Tobias Bane to the line for 1. [Team fouls: 1] (John Giddey: 1 personal fouls)   FT 1/1: GOOD Tobias Bane makes 1/1 from the line.
Score: 7-5

[09:56] Team_092 possession (Score: 7-5)
John Giddey drives to the basket... FOUL! Offensive foul on John Giddey! Malcolm Lillard drew the charge! [Team fouls: 2] (John Giddey: 2 personal fouls) TURNOVER! (dead ball)

[09:39] Team_032 possession (Score: 7-5)
DeMar Giddey attempts a Layup. Contested by Karl Gobert (4.5 feet, MAN). DEMAR GIDDEY MAKES IT!
Score: 9-5

[09:21] Team_092 possession (Score: 9-5)
Immanuel Ingram attempts a 3Pt. Contested by Malcolm Lillard (4.8 feet, MAN). IMMANUEL INGRAM MAKES IT! Assist: Paul James
Score: 9-8

[09:06] Team_032 possession (Score: 9-8)
DeMar Giddey attempts a 3Pt. Contested by Karl Gobert (4.1 feet, MAN). DeMar Giddey misses. Rebound secured by Immanuel Ingram.

[08:51] Team_092 possession (Score: 9-8)
Austin Bridges drives, Tobias Bane stays with him. Austin Bridges attempts a Layup. Contested by Tobias Bane (2.3 feet, MAN). Austin Bridges misses. Rebound secured by Tobias Bane.

[08:37] Team_032 possession (Score: 9-8)
Anfernee Butler attempts a 3Pt. Contested by John Giddey (5.3 feet, ZONE). Anfernee Butler misses. Rebound secured by Paul James.

[08:23] Team_092 possession (Score: 9-8)
John Giddey drives, picks up Malcolm Lillard. Help arrives from DeMar Giddey! John Giddey attempts a Layup. Wide open! DeMar Giddey is 6.0 feet away. [ZONE] John Giddey misses. Rebound secured by Anfernee Butler.

[08:13] Team_032 possession (Score: 9-8)
Malcolm Lillard attempts a Midrange. Contested by Immanuel Ingram (2.6 feet, MAN). MALCOLM LILLARD MAKES IT!
Score: 11-8

[07:59] Team_092 possession (Score: 11-8)
Immanuel Ingram attempts a Midrange. Wide open! Malcolm Lillard is 7.4 feet away. [ZONE] IMMANUEL INGRAM MAKES IT! Assist: Austin Bridges
Score: 11-10

[07:49] Team_032 possession (Score: 11-10)
FOUL! Offensive foul on Anfernee Butler! John Giddey drew the charge! [Team fouls: 1] (Anfernee Butler: 1 personal fouls) TURNOVER! (dead ball)

[07:36] Team_092 possession (Score: 11-10)
Paul James attempts a 3Pt. Wide open! Tobias Bane is 8.1 feet away. [ZONE] Paul James misses. Rebound secured by Malcolm Lillard.

[07:20] Team_032 possession (Score: 11-10)
DeMar Giddey attempts a 3Pt. Contested by John Giddey (3.0 feet, ZONE). DEMAR GIDDEY MAKES IT! Assist: Tobias Bane
Score: 14-10

[07:05] Team_092 possession (Score: 14-10)
Paul James attempts a Midrange. Contested by Jalen Westbrook (5.2 feet, MAN). PAUL JAMES MAKES IT!
Score: 14-12

[06:51] Team_032 possession (Score: 14-12)
Jalen Westbrook loses the ball! Stripped by Paul James! TURNOVER! (live ball)

[06:36] Team_092 possession (Score: 14-12)
Paul James attempts a Midrange. Contested by Jalen Westbrook (3.6 feet, MAN). Paul James misses. Rebound secured by Anfernee Butler.

[06:20] Team_032 possession (Score: 14-12)
Malcolm Lillard drives to the basket... Malcolm Lillard throws a bad pass! Stolen by John Giddey! TURNOVER! (live ball)

[06:07] Team_092 possession (Score: 14-12)
John Giddey drives, picks up Malcolm Lillard. Help arrives from DeMar Giddey! John Giddey attempts a Layup. Wide open! DeMar Giddey is 8.8 feet away. [ZONE] JOHN GIDDEY MAKES IT! Assist: Karl Gobert
Score: 14-14

[05:54] Team_032 possession (Score: 14-14)
Malcolm Lillard attempts a 3Pt. Wide open! Immanuel Ingram is 6.1 feet away. [MAN] Malcolm Lillard misses. Rebound secured by Paul James.

[05:39] Team_092 possession (Score: 14-14)
Karl Gobert attempts a 3Pt. Contested by DeMar Giddey (3.0 feet, MAN). KARL GOBERT MAKES IT! Assist: Immanuel Ingram
Score: 14-17

[05:24] Team_032 possession (Score: 14-17)
Tobias Bane attempts a Layup. Contested by Austin Bridges (3.6 feet, MAN). TOBIAS BANE MAKES IT! Assist: DeMar Giddey
Score: 16-17

[05:06] Team_092 possession (Score: 16-17)
Karl Gobert attempts a 3Pt. Contested by Tobias Bane (3.7 feet, ZONE). Karl Gobert misses. Rebound secured by Tobias Bane.

[04:50] Team_032 possession (Score: 16-17)
Tobias Bane attempts a 3Pt. Contested by John Giddey (3.6 feet, ZONE). Tobias Bane misses. Offensive rebound by Anfernee Butler! Anfernee Butler kicks it out.

[04:37] Team_032 possession (Score: 16-17)
Malcolm Lillard attempts a Layup. Contested by John Giddey (6.0 feet, ZONE). MALCOLM LILLARD MAKES IT!
Score: 18-17

[04:20] Team_092 possession (Score: 18-17)
Immanuel Ingram attempts a 3Pt. Contested by Tobias Bane (4.9 feet, ZONE). Immanuel Ingram misses. Rebound secured by Malcolm Lillard.

[04:05] Team_032 possession (Score: 18-17)
Malcolm Lillard drives, Immanuel Ingram stays with him. Malcolm Lillard attempts a Dunk. Contested by Immanuel Ingram (5.2 feet, MAN). MALCOLM LILLARD MAKES IT! Assist: Anfernee Butler
Score: 20-17

[03:47] Team_092 possession (Score: 20-17)
Paul James makes the Layup and draws the foul on Malcolm Lillard! And-1! Paul James to the line for 1. [Team fouls: 2] (Malcolm Lillard: 1 personal fouls)   FT 1/1: MISS Paul James makes 0/1 from the line. Rebound secured by Malcolm Lillard.
Score: 20-19

[03:31] Team_032 possession (Score: 20-19)
Anfernee Butler drives and kicks out. Anfernee Butler attempts a 3Pt. Wide open! John Giddey is 6.6 feet away. [MAN] Anfernee Butler misses. Rebound secured by John Giddey.

[03:13] Team_092 possession (Score: 20-19)
Paul James drives, Jalen Westbrook stays with him. Paul James attempts a Dunk. Heavily contested by Jalen Westbrook (1.5 feet, MAN)! Paul James misses. Rebound secured by Malcolm Lillard.

[02:59] Team_032 possession (Score: 20-19)
Malcolm Lillard attempts a Midrange. Contested by Paul James (5.0 feet, ZONE). Malcolm Lillard misses. Rebound secured by Immanuel Ingram.

[02:44] Team_092 possession (Score: 20-19)
Immanuel Ingram attempts a 3Pt. Contested by Malcolm Lillard (5.8 feet, MAN). Immanuel Ingram misses. Rebound secured by Anfernee Butler.

[02:25] Team_032 possession (Score: 20-19)
Malcolm Lillard drives, John Giddey stays with him. Malcolm Lillard attempts a Layup. Wide open! John Giddey is 7.7 feet away. [ZONE] Malcolm Lillard misses. Offensive rebound by Malcolm Lillard! Malcolm Lillard kicks it out.

[02:07] Team_032 possession (Score: 20-19)
Tobias Bane attempts a 3Pt. Contested by Paul James (5.0 feet, ZONE). TOBIAS BANE MAKES IT! Assist: Anfernee Butler
Score: 23-19

[01:54] Team_092 possession (Score: 23-19)
Paul James attempts a 3Pt. Contested by Tobias Bane (4.1 feet, ZONE). Paul James misses. Rebound secured by Malcolm Lillard.

[01:37] Team_032 possession (Score: 23-19)
Malcolm Lillard attempts a Layup. Contested by John Giddey (3.9 feet, ZONE). MALCOLM LILLARD MAKES IT! Assist: DeMar Giddey
Score: 25-19

[01:21] Team_092 possession (Score: 25-19)
Austin Bridges drives, picks up Malcolm Lillard. Help arrives from DeMar Giddey! Austin Bridges attempts a Layup. Wide open! DeMar Giddey is 6.9 feet away. [ZONE] Austin Bridges misses. Rebound secured by Malcolm Lillard.

[01:10] Team_032 possession (Score: 25-19)
Jalen Westbrook attempts a Midrange. Contested by Paul James (5.6 feet, ZONE). JALEN WESTBROOK MAKES IT! Assist: Malcolm Lillard
Score: 27-19

[00:54] Team_092 possession (Score: 27-19)
Karl Gobert attempts a 3Pt. Contested by DeMar Giddey (5.1 feet, MAN). Karl Gobert misses. Rebound secured by Malcolm Lillard.

[00:36] Team_032 possession (Score: 27-19)
Tobias Bane attempts a Midrange. Contested by Austin Bridges (5.6 feet, MAN). TOBIAS BANE MAKES IT! Assist: Jalen Westbrook
Score: 29-19

[00:22] Team_092 possession (Score: 29-19)
John Giddey drives to the basket... John Giddey throws a bad pass! Stolen by Anfernee Butler! TURNOVER! (live ball)

[00:08] Team_032 possession (Score: 29-19)
Malcolm Lillard drives and kicks out. DeMar Giddey attempts a 3Pt. Contested by Karl Gobert (4.0 feet, MAN). DeMar Giddey misses. Rebound secured by John Giddey.

================================================================================
                              1ST QUARTER COMPLETE                              
================================================================================

1ST QUARTER SCORE: Team_032 29, Team_092 19

BOX SCORE:
================================================================================

Team_032
--------------------------------------------------------------------------------
Player                MIN  PTS  REB  AST  TO      FG   FG%      3P   3P%
--------------------------------------------------------------------------------
Tobias Bane            12   12    2    2   0   5/5   100.0     0/0   0.0
Malcolm Lillard        12    8    9    1   0   4/7    57.1     0/0   0.0
DeMar Giddey           12    7    0    3   0   3/5    60.0     0/0   0.0
Jalen Westbrook        12    2    0    1   0   1/2    50.0     0/0   0.0
Anfernee Butler        12    0    4    2   0   0/2     0.0     0/0   0.0

TEAM: FG: 13/21 (61.9%), 3PT: 2/6 (33.3%), REB: 15 (2 off, 13 def), AST: 9, TO: 3
TEAM FOULS: 2


Team_092
--------------------------------------------------------------------------------
Player                MIN  PTS  REB  AST  TO      FG   FG%      3P   3P%
--------------------------------------------------------------------------------
Karl Gobert            12    8    0    1   0   3/5    60.0     0/0   0.0
Immanuel Ingram        12    5    2    1   0   2/4    50.0     0/0   0.0
John Giddey            12    2    4    2   0   1/3    33.3     0/0   0.0
Paul James             12    2    2    1   0   1/6    16.7     0/0   0.0
Austin Bridges         12    0    0    1   0   0/2     0.0     0/0   0.0

TEAM: FG: 7/20 (35.0%), 3PT: 3/9 (33.3%), REB: 8 (0 off, 8 def), AST: 6, TO: 3
TEAM FOULS: 2

================================================================================

================================================================================
                       2ND QUARTER - Team_032 vs Team_092                       
================================================================================

[12:00] Team_032 possession (Score: 29-19)
DeMar Giddey attempts a 3Pt. Contested by Karl Gobert (6.0 feet, MAN). DEMAR GIDDEY MAKES IT! Assist: Tobias Bane
Score: 32-19

[11:43] Team_092 possession (Score: 32-19)
FOUL! Offensive foul on John Giddey! Anfernee Butler drew the charge! [Team fouls: 1] (John Giddey: 1 personal fouls) TURNOVER! (dead ball)

[11:31] Team_032 possession (Score: 32-19)
Malcolm Lillard attempts a 3Pt. Contested by Immanuel Ingram (5.5 feet, MAN). Malcolm Lillard misses. Offensive rebound by Anfernee Butler! Anfernee Butler kicks it out.

[11:20] Team_032 possession (Score: 32-19)
Tobias Bane drives and kicks out. Tobias Bane attempts a 3Pt. Contested by John Giddey (5.6 feet, ZONE). Tobias Bane misses. Rebound secured by Paul James.

[11:07] Team_092 possession (Score: 32-19)
John Giddey attempts a 3Pt. Contested by Tobias Bane (4.3 feet, ZONE). John Giddey misses. Rebound secured by Malcolm Lillard.

[10:54] Team_032 possession (Score: 32-19)
Malcolm Lillard drives and kicks out. Jalen Westbrook attempts a Midrange. Contested by John Giddey (4.5 feet, ZONE). Jalen Westbrook misses. Rebound secured by Immanuel Ingram.

[10:42] Team_092 possession (Score: 32-19)
Immanuel Ingram attempts a Midrange. Contested by DeMar Giddey (4.0 feet, ZONE). IMMANUEL INGRAM MAKES IT!
Score: 32-21

[10:30] Team_032 possession (Score: 32-21)
Tobias Bane makes the Dunk and draws the foul on Austin Bridges! And-1! Tobias Bane to the line for 1. [Team fouls: 2] (Austin Bridges: 1 personal fouls)   FT 1/1: GOOD Tobias Bane makes 1/1 from the line.
Score: 35-21

[10:19] Team_092 possession (Score: 35-21)
Karl Gobert attempts a 3Pt. Contested by DeMar Giddey (5.5 feet, MAN). Karl Gobert misses. Offensive rebound by Paul James! Paul James kicks it out.

[10:01] Team_092 possession (Score: 35-21)
Karl Gobert attempts a Layup. Contested by Malcolm Lillard (4.5 feet, ZONE). KARL GOBERT MAKES IT! Assist: Austin Bridges
Score: 35-23

[09:46] Team_032 possession (Score: 35-23)
DeMar Giddey attempts a Midrange. Contested by Karl Gobert (3.7 feet, MAN). DeMar Giddey misses. Offensive rebound by Malcolm Lillard! Malcolm Lillard kicks it out.

[09:32] Team_032 possession (Score: 35-23)
DeMar Giddey drives to the basket... DeMar Giddey throws a bad pass out of bounds! TURNOVER! (dead ball)

[09:32] Substitution (Team_032): Tobias Bane OUT → Anfernee Griffin IN (stamina_rule2)

[09:32] Substitution (Team_032): DeMar Giddey OUT → Myles Herro IN (stamina_rule2)

[09:32] Substitution (Team_032): Jalen Westbrook OUT → Jrue Simmons IN (stamina_rule2)

[09:32] Substitution (Team_032): Anfernee Butler OUT → Jayson O'Neal IN (stamina_rule2)

[09:32] Substitution (Team_032): Malcolm Lillard OUT → Lauri Towns IN (stamina_rule2)

[09:32] Substitution (Team_092): Austin Bridges OUT → Bones Giddey IN (stamina_rule2)

[09:32] Substitution (Team_092): Karl Gobert OUT → Shaquille Russell IN (stamina_rule2)

[09:32] Substitution (Team_092): Paul James OUT → Vince Harris IN (stamina_rule2)

[09:32] Substitution (Team_092): John Giddey OUT → Shaquille Paul IN (stamina_rule2)

[09:32] Substitution (Team_092): Immanuel Ingram OUT → Pau Reaves IN (stamina_rule2)

[09:15] Team_092 possession (Score: 35-23)
Bones Giddey attempts a 3Pt. Contested by Anfernee Griffin (5.8 feet, ZONE). BONES GIDDEY MAKES IT! Assist: Vince Harris
Score: 35-26

[09:01] Team_032 possession (Score: 35-26)
Lauri Towns attempts a Layup. Wide open! Pau Reaves is 6.7 feet away. [MAN] LAURI TOWNS MAKES IT! Assist: Jayson O'Neal
Score: 37-26

[08:46] Team_092 possession (Score: 37-26)
Shaquille Paul makes the Layup and draws the foul on Jayson O'Neal! And-1! Shaquille Paul to the line for 1. [Team fouls: 1] (Jayson O'Neal: 1 personal fouls)   FT 1/1: GOOD Shaquille Paul makes 1/1 from the line.
Score: 37-29

[08:32] Team_032 possession (Score: 37-29)
Anfernee Griffin drives, picks up Pau Reaves. Help arrives from Shaquille Russell! Anfernee Griffin attempts a Dunk. Contested by Shaquille Russell (5.8 feet, ZONE). ANFERNEE GRIFFIN MAKES IT! Assist: Lauri Towns
Score: 39-29

[08:20] Team_092 possession (Score: 39-29)
Shaquille Paul attempts a 3Pt. Contested by Jayson O'Neal (5.0 feet, MAN). Shaquille Paul misses. Rebound secured by Myles Herro.

[08:06] Team_032 possession (Score: 39-29)
Myles Herro attempts a Midrange. Contested by Shaquille Russell (5.1 feet, MAN). MYLES HERRO MAKES IT!
Score: 41-29

[07:54] Team_092 possession (Score: 41-29)
Vince Harris attempts a Layup. Wide open! Lauri Towns is 6.3 feet away. [ZONE] VINCE HARRIS MAKES IT!
Score: 41-31

[07:37] Team_032 possession (Score: 41-31)
Myles Herro makes the Layup and draws the foul on Shaquille Russell! And-1! Myles Herro to the line for 1. [Team fouls: 3] (Shaquille Russell: 1 personal fouls)   FT 1/1: GOOD Myles Herro makes 1/1 from the line.
Score: 44-31

[07:27] Team_092 possession (Score: 44-31)
Vince Harris drives to the basket... FOUL! Offensive foul on Vince Harris! Jrue Simmons drew the charge! [Team fouls: 4] (Vince Harris: 1 personal fouls) TURNOVER! (dead ball)

[07:09] Team_032 possession (Score: 44-31)
FOUL! Reach-in foul on Pau Reaves during the drive. [IN THE BONUS! 5 team fouls] Lauri Towns to the line for 2 free throws. (Pau Reaves: 1 personal fouls)   FT 1/2: MISS   FT 2/2: GOOD Lauri Towns makes 1/2 from the line.
Score: 45-31

[06:50] Team_092 possession (Score: 45-31)
Shaquille Paul attempts a Layup. BLOCKED BY JAYSON O'NEAL! Ball goes out off Jayson O'Neal. Shaquille Paul's ball!

[06:34] Team_092 possession (Score: 45-31)
Pau Reaves drives to the basket... Pau Reaves throws a bad pass! Stolen by Lauri Towns! TURNOVER! (live ball)

[06:21] Team_032 possession (Score: 45-31)
Anfernee Griffin attempts a Midrange. Heavily contested by Pau Reaves (0.5 feet, ZONE)! Anfernee Griffin misses. Rebound secured by Shaquille Paul.

[06:10] Team_092 possession (Score: 45-31)
Pau Reaves attempts a 3Pt. Wide open! Anfernee Griffin is 6.7 feet away. [ZONE] PAU REAVES MAKES IT!
Score: 45-34

[05:56] Team_032 possession (Score: 45-34)
Myles Herro drives to the basket... Myles Herro throws a bad pass! Stolen by Shaquille Russell! TURNOVER! (live ball)

[05:39] Team_092 possession (Score: 45-34)
Pau Reaves attempts a 3Pt. Contested by Anfernee Griffin (5.2 feet, ZONE). Pau Reaves misses. Rebound secured by Myles Herro.

[05:27] Team_032 possession (Score: 45-34)
Lauri Towns drives to the basket... Lauri Towns loses the ball! Stripped by Shaquille Paul! TURNOVER! (live ball)

[05:10] Team_092 possession (Score: 45-34)
Shaquille Paul drives and kicks out. Pau Reaves attempts a 3Pt. Contested by Anfernee Griffin (5.8 feet, ZONE). Pau Reaves misses. Rebound secured by Myles Herro.

[04:57] Team_032 possession (Score: 45-34)
Jayson O'Neal attempts a Layup. Contested by Pau Reaves (2.4 feet, ZONE). Jayson O'Neal misses. Rebound secured by Pau Reaves.

[04:43] Team_092 possession (Score: 45-34)
Vince Harris attempts a Layup. BLOCKED BY JRUE SIMMONS! Ball is loose! Rebound secured by Myles Herro.

[04:26] Team_032 possession (Score: 45-34)
Myles Herro attempts a 3Pt. Heavily contested by Vince Harris (0.5 feet, ZONE)! MYLES HERRO MAKES IT! Assist: Jrue Simmons
Score: 48-34

[04:13] Team_092 possession (Score: 48-34)
Shaquille Russell attempts a Layup. Wide open! Myles Herro is 9.2 feet away. [MAN] SHAQUILLE RUSSELL MAKES IT! Assist: Bones Giddey
Score: 48-36

[03:58] Team_032 possession (Score: 48-36)
FOUL! Shooting foul on Vince Harris. Jrue Simmons to the line for 2 free throws. [BONUS: 6 team fouls] (Vince Harris: 2 personal fouls)   FT 1/2: MISS   FT 2/2: MISS Jrue Simmons makes 0/2 from the line. Offensive rebound by Jayson O'Neal! Jayson O'Neal puts it back in!
Score: 50-36

[03:48] Team_092 possession (Score: 50-36)
Pau Reaves attempts a Layup. Contested by Lauri Towns (5.3 feet, ZONE). Pau Reaves misses. Rebound secured by Myles Herro.

[03:36] Team_032 possession (Score: 50-36)
FOUL! Holding foul on Shaquille Russell. [IN THE BONUS! 7 team fouls] Myles Herro to the line for 2 free throws. (Shaquille Russell: 2 personal fouls)   FT 1/2: GOOD   FT 2/2: GOOD Myles Herro makes 2/2 from the line.
Score: 52-36

[03:22] Team_092 possession (Score: 52-36)
Pau Reaves attempts a Layup. Contested by Lauri Towns (4.5 feet, MAN). PAU REAVES MAKES IT! Assist: Shaquille Paul
Score: 52-38

[03:08] Team_032 possession (Score: 52-38)
Myles Herro attempts a 3Pt. Contested by Vince Harris (5.0 feet, ZONE). Myles Herro misses. Rebound secured by Shaquille Russell.

[02:53] Team_092 possession (Score: 52-38)
Shaquille Paul attempts a Midrange. Wide open! Myles Herro is 8.3 feet away. [ZONE] SHAQUILLE PAUL MAKES IT!
Score: 52-40

[02:38] Team_032 possession (Score: 52-40)
Jayson O'Neal drives, Shaquille Paul stays with him. Jayson O'Neal attempts a Layup. Wide open! Shaquille Paul is 7.8 feet away. [MAN] JAYSON O'NEAL MAKES IT! Assist: Myles Herro
Score: 54-40

[02:24] Team_092 possession (Score: 54-40)
Bones Giddey attempts a Midrange. Contested by Jayson O'Neal (3.8 feet, ZONE). BONES GIDDEY MAKES IT! Assist: Pau Reaves
Score: 54-42

[02:12] Team_032 possession (Score: 54-42)
Myles Herro attempts a Midrange. Contested by Pau Reaves (5.6 feet, ZONE). Myles Herro misses. Offensive rebound by Jayson O'Neal! Jayson O'Neal puts it back in!
Score: 56-42

[01:54] Team_092 possession (Score: 56-42)
Vince Harris attempts a 3Pt. Contested by Anfernee Griffin (4.8 feet, ZONE). Vince Harris misses. Rebound secured by Lauri Towns.

[01:37] Team_032 possession (Score: 56-42)
Anfernee Griffin attempts a Midrange. Wide open! Shaquille Paul is 6.3 feet away. [ZONE] Anfernee Griffin misses. Rebound secured by Pau Reaves.

[01:26] Team_092 possession (Score: 56-42)
Vince Harris attempts a 3Pt. Contested by Jrue Simmons (5.1 feet, MAN). Vince Harris misses. Rebound secured by Lauri Towns.

[01:12] Team_032 possession (Score: 56-42)
Myles Herro attempts a 3Pt. Contested by Vince Harris (5.5 feet, ZONE). Myles Herro misses. Rebound secured by Pau Reaves.

[01:00] Team_092 possession (Score: 56-42)
FOUL! Shooting foul on Myles Herro. Shaquille Russell to the line for 2 free throws. [Team fouls: 2] (Myles Herro: 1 personal fouls)   FT 1/2: MISS   FT 2/2: GOOD Shaquille Russell makes 1/2 from the line.
Score: 56-43

[00:48] Team_032 possession (Score: 56-43)
Lauri Towns drives, Pau Reaves stays with him. Lauri Towns attempts a Dunk. Contested by Pau Reaves (5.2 feet, MAN). Lauri Towns misses. Offensive rebound by Lauri Towns! Lauri Towns kicks it out.

[00:38] Team_032 possession (Score: 56-43)
Myles Herro attempts a 3Pt. Contested by Vince Harris (3.0 feet, ZONE). Myles Herro misses. Rebound secured by Shaquille Paul.

[00:23] Team_092 possession (Score: 56-43)
FOUL! Holding foul on Jayson O'Neal. [Team fouls: 3] No free throws, side out. (Jayson O'Neal: 2 personal fouls)

[00:13] Team_092 possession (Score: 56-43)
Pau Reaves attempts a Layup. Wide open! Lauri Towns is 6.1 feet away. [MAN] Pau Reaves misses. Offensive rebound by Pau Reaves! Pau Reaves kicks it out.

================================================================================
                              2ND QUARTER COMPLETE                              
================================================================================

2ND QUARTER SCORE: Team_032 27, Team_092 24

BOX SCORE:
================================================================================

Team_032
--------------------------------------------------------------------------------
Player                MIN  PTS  REB  AST  TO      FG   FG%      3P   3P%
--------------------------------------------------------------------------------
Myles Herro             9   10    5    1   0   4/7    57.1     0/0   0.0
Jayson O'Neal           9    6    1    1   0   3/4    75.0     0/0   0.0
DeMar Giddey           15    3    0    0   0   1/1   100.0     0/0   0.0
Tobias Bane            15    3    0    1   0   1/2    50.0     0/0   0.0
Lauri Towns             9    3    3    1   0   2/2   100.0     0/0   0.0
Anfernee Griffin        9    2    0    0   0   1/3    33.3     0/0   0.0
Anfernee Butler        15    0    1    0   0   0/0     0.0     0/0   0.0
Malcolm Lillard        15    0    2    0   0   0/1     0.0     0/0   0.0
Jrue Simmons            9    0    0    1   0   0/0     0.0     0/0   0.0

TEAM: FG: 12/20 (60.0%), 3PT: 2/5 (40.0%), REB: 12 (4 off, 8 def), AST: 5, TO: 3
TEAM FOULS: 3


Team_092
--------------------------------------------------------------------------------
Player                MIN  PTS  REB  AST  TO      FG   FG%      3P   3P%
--------------------------------------------------------------------------------
Bones Giddey            9    5    0    1   0   2/2   100.0     0/0   0.0
Shaquille Paul          9    5    2    1   0   2/4    50.0     0/0   0.0
Pau Reaves              9    5    4    1   0   2/4    50.0     0/0   0.0
Shaquille Russell       9    3    1    0   0   2/2   100.0     0/0   0.0
Immanuel Ingram        15    2    1    0   0   1/1   100.0     0/0   0.0
Karl Gobert            15    2    0    0   0   1/1   100.0     0/0   0.0
Vince Harris            9    2    0    1   0   1/4    25.0     0/0   0.0
Paul James             15    0    2    0   0   0/0     0.0     0/0   0.0
John Giddey            15    0    0    0   0   0/1     0.0     0/0   0.0
Austin Bridges         15    0    0    1   0   0/0     0.0     0/0   0.0

TEAM: FG: 11/19 (57.9%), 3PT: 2/7 (28.6%), REB: 10 (2 off, 8 def), AST: 5, TO: 3
TEAM FOULS: 7 [Team_032 in BONUS]

================================================================================

================================================================================
                       3RD QUARTER - Team_032 vs Team_092                       
================================================================================

[12:00] Team_032 possession (Score: 56-43)
DeMar Giddey attempts a 3Pt. Contested by Karl Gobert (4.3 feet, ZONE). DeMar Giddey misses. Rebound secured by Paul James.

[11:43] Team_092 possession (Score: 56-43)
Paul James drives, picks up Jalen Westbrook. Help arrives from DeMar Giddey! Paul James attempts a Dunk. Contested by DeMar Giddey (4.8 feet, MAN). PAUL JAMES MAKES IT! Assist: Immanuel Ingram
Score: 56-45

[11:26] Team_032 possession (Score: 56-45)
FOUL! Reach-in foul on John Giddey during the drive. [Team fouls: 1] No free throws, side out. (John Giddey: 1 personal fouls)

[11:08] Team_032 possession (Score: 56-45)
Anfernee Butler makes the Dunk and draws the foul on John Giddey! And-1! Anfernee Butler to the line for 1. [Team fouls: 2] (John Giddey: 2 personal fouls)   FT 1/1: GOOD Anfernee Butler makes 1/1 from the line.
Score: 59-45

[10:50] Team_092 possession (Score: 59-45)
Immanuel Ingram attempts a Midrange. Contested by Malcolm Lillard (5.9 feet, ZONE). Immanuel Ingram misses. Rebound secured by Tobias Bane.

[10:35] Team_032 possession (Score: 59-45)
Jalen Westbrook attempts a Midrange. Contested by Paul James (5.5 feet, MAN). JALEN WESTBROOK MAKES IT!
Score: 61-45

[10:22] Team_092 possession (Score: 61-45)
John Giddey attempts a Layup. Wide open! Malcolm Lillard is 6.6 feet away. [ZONE] John Giddey misses. Rebound secured by Tobias Bane.

[10:07] Team_032 possession (Score: 61-45)
Anfernee Butler attempts a Midrange. Contested by Karl Gobert (3.3 feet, ZONE). Anfernee Butler misses. Rebound secured by Paul James.

[09:56] Team_092 possession (Score: 61-45)
Austin Bridges attempts a 3Pt. Heavily contested by Tobias Bane (0.7 feet, MAN)! AUSTIN BRIDGES MAKES IT! Assist: Karl Gobert
Score: 61-48

[09:40] Team_032 possession (Score: 61-48)
Tobias Bane attempts a Layup. Contested by Austin Bridges (4.6 feet, MAN). TOBIAS BANE MAKES IT! Assist: Jalen Westbrook
Score: 63-48

[09:22] Team_092 possession (Score: 63-48)
Paul James attempts a 3Pt. Contested by Tobias Bane (5.6 feet, ZONE). Paul James misses. Rebound secured by Tobias Bane.

[09:08] Team_032 possession (Score: 63-48)
Jalen Westbrook attempts a 3Pt. Contested by Austin Bridges (6.0 feet, ZONE). JALEN WESTBROOK MAKES IT! Assist: Malcolm Lillard
Score: 66-48

[08:52] Team_092 possession (Score: 66-48)
Immanuel Ingram attempts a Midrange. Wide open! Jalen Westbrook is 7.3 feet away. [ZONE] Immanuel Ingram misses. Rebound secured by Malcolm Lillard.

[08:39] Team_032 possession (Score: 66-48)
Anfernee Butler drives, John Giddey stays with him. Anfernee Butler attempts a Dunk. Contested by John Giddey (2.6 feet, MAN). ANFERNEE BUTLER MAKES IT! Assist: Malcolm Lillard
Score: 68-48

[08:25] Team_092 possession (Score: 68-48)
Austin Bridges attempts a 3Pt. Heavily contested by Tobias Bane (1.0 feet, ZONE)! AUSTIN BRIDGES MAKES IT! Assist: Immanuel Ingram
Score: 68-51

[08:13] Team_032 possession (Score: 68-51)
FOUL! Reach-in foul on John Giddey during the drive. [Team fouls: 3] No free throws, side out. (John Giddey: 3 personal fouls)

[08:03] Team_032 possession (Score: 68-51)
Anfernee Butler attempts a 3Pt. Contested by John Giddey (4.0 feet, MAN). Anfernee Butler misses. Rebound secured by Paul James.

[07:48] Team_092 possession (Score: 68-51)
John Giddey drives, picks up Malcolm Lillard. Help arrives from DeMar Giddey! John Giddey attempts a Layup. Wide open! DeMar Giddey is 6.2 feet away. [ZONE] John Giddey misses. Rebound secured by Tobias Bane.

[07:34] Team_032 possession (Score: 68-51)
Jalen Westbrook attempts a Midrange. Contested by Karl Gobert (2.3 feet, ZONE). Jalen Westbrook misses. FOUL! Loose ball foul on John Giddey during the rebound battle. [Team fouls: 4] No free throws, side out. (John Giddey: 4 personal fouls)

[07:21] Team_032 possession (Score: 68-51)
Jalen Westbrook attempts a 3Pt. Wide open! Austin Bridges is 8.3 feet away. [ZONE] JALEN WESTBROOK MAKES IT! Assist: DeMar Giddey
Score: 71-51

[07:03] Team_092 possession (Score: 71-51)
Karl Gobert drives and kicks out. Karl Gobert attempts a Midrange. BLOCKED BY DEMAR GIDDEY! Ball is loose! Rebound secured by Malcolm Lillard.

[06:51] Team_032 possession (Score: 71-51)
DeMar Giddey attempts a 3Pt. BLOCKED BY KARL GOBERT! Ball deflects out of bounds off DeMar Giddey.

[06:36] Team_092 possession (Score: 71-51)
Karl Gobert drives, picks up Malcolm Lillard. Help arrives from DeMar Giddey! Karl Gobert attempts a Layup. Contested by DeMar Giddey (3.3 feet, ZONE). KARL GOBERT MAKES IT! Assist: Paul James
Score: 71-53

[06:24] Team_032 possession (Score: 71-53)
Jalen Westbrook attempts a Midrange. Contested by John Giddey (3.4 feet, ZONE). Jalen Westbrook misses. Rebound secured by John Giddey.

[06:11] Team_092 possession (Score: 71-53)
Immanuel Ingram makes the Layup and draws the foul on Malcolm Lillard! And-1! Immanuel Ingram to the line for 1. [Team fouls: 1] (Malcolm Lillard: 1 personal fouls)   FT 1/1: GOOD Immanuel Ingram makes 1/1 from the line.
Score: 71-56

[05:57] Team_032 possession (Score: 71-56)
Anfernee Butler attempts a Midrange. Contested by John Giddey (4.1 feet, MAN). Anfernee Butler misses. Rebound secured by Paul James.

[05:47] Team_092 possession (Score: 71-56)
John Giddey attempts a Midrange. Contested by Anfernee Butler (3.0 feet, MAN). John Giddey misses. Rebound secured by Anfernee Butler.

[05:35] Team_032 possession (Score: 71-56)
Tobias Bane attempts a Midrange. Wide open! Paul James is 6.7 feet away. [ZONE] Tobias Bane misses. Rebound secured by Immanuel Ingram.

[05:20] Team_092 possession (Score: 71-56)
Austin Bridges attempts a 3Pt. Contested by Jalen Westbrook (3.7 feet, ZONE). Austin Bridges misses. Rebound secured by Tobias Bane.

[05:02] Team_032 possession (Score: 71-56)
FOUL! Holding foul on Immanuel Ingram. [IN THE BONUS! 5 team fouls] Malcolm Lillard to the line for 2 free throws. (Immanuel Ingram: 1 personal fouls)   FT 1/2: GOOD   FT 2/2: GOOD Malcolm Lillard makes 2/2 from the line.
Score: 73-56

[04:49] Team_092 possession (Score: 73-56)
Austin Bridges drives, picks up Tobias Bane. Help arrives from Jalen Westbrook! Austin Bridges attempts a Dunk. Contested by Jalen Westbrook (2.9 feet, MAN). AUSTIN BRIDGES MAKES IT! Assist: Karl Gobert
Score: 73-58

[04:39] Team_032 possession (Score: 73-58)
FOUL! Shooting foul on Karl Gobert. DeMar Giddey to the line for 3 free throws. [BONUS: 6 team fouls] (Karl Gobert: 1 personal fouls)   FT 1/3: GOOD   FT 2/3: MISS   FT 3/3: GOOD DeMar Giddey makes 2/3 from the line.
Score: 75-58

[04:27] Team_092 possession (Score: 75-58)
Paul James drives to the basket... FOUL! Offensive foul on Paul James! Jalen Westbrook drew the charge! [Team fouls: 7] (Paul James: 1 personal fouls) TURNOVER! (dead ball)

[04:09] Team_032 possession (Score: 75-58)
Jalen Westbrook attempts a 3Pt. Wide open! Paul James is 6.1 feet away. [MAN] Jalen Westbrook misses. Rebound secured by Paul James.

[03:57] Team_092 possession (Score: 75-58)
Karl Gobert attempts a Midrange. Contested by Anfernee Butler (3.0 feet, ZONE). Karl Gobert misses. Offensive rebound by John Giddey! John Giddey kicks it out.

[03:40] Team_092 possession (Score: 75-58)
Paul James attempts a 3Pt. Wide open! Jalen Westbrook is 6.7 feet away. [MAN] Paul James misses. Offensive rebound by Paul James! Paul James kicks it out.

[03:23] Team_092 possession (Score: 75-58)
FOUL! Reach-in foul on Malcolm Lillard during the drive. [Team fouls: 2] No free throws, side out. (Malcolm Lillard: 2 personal fouls)

[03:10] Team_092 possession (Score: 75-58)
Austin Bridges attempts a Layup. Contested by Malcolm Lillard (4.7 feet, ZONE). Austin Bridges misses. FOUL! Loose ball foul on Anfernee Butler during the rebound battle. [Team fouls: 3] No free throws, side out. (Anfernee Butler: 1 personal fouls)

[02:56] Team_092 possession (Score: 75-58)
Paul James attempts a 3Pt. Contested by Jalen Westbrook (4.1 feet, MAN). Paul James misses. Rebound secured by Tobias Bane.

[02:44] Team_032 possession (Score: 75-58)
Anfernee Butler attempts a 3Pt. Contested by John Giddey (5.6 feet, MAN). Anfernee Butler misses. Offensive rebound by Malcolm Lillard! Malcolm Lillard kicks it out.

[02:30] Team_032 possession (Score: 75-58)
Tobias Bane attempts a Midrange. Heavily contested by Austin Bridges (1.9 feet, MAN)! Tobias Bane misses. Rebound secured by John Giddey.

[02:12] Team_092 possession (Score: 75-58)
John Giddey attempts a Midrange. Contested by DeMar Giddey (4.0 feet, ZONE). John Giddey misses. Offensive rebound by John Giddey! John Giddey kicks it out.

[01:56] Team_092 possession (Score: 75-58)
Immanuel Ingram attempts a 3Pt. Contested by Malcolm Lillard (4.4 feet, MAN). Immanuel Ingram misses. Rebound secured by Anfernee Butler.

[01:45] Team_032 possession (Score: 75-58)
Jalen Westbrook drives, John Giddey stays with him. Jalen Westbrook attempts a Dunk. Wide open! John Giddey is 7.0 feet away. [ZONE] JALEN WESTBROOK MAKES IT! Assist: Malcolm Lillard
Score: 77-58

[01:29] Team_092 possession (Score: 77-58)
Austin Bridges attempts a Midrange. Contested by Malcolm Lillard (5.0 feet, ZONE). Austin Bridges misses. Offensive rebound by Paul James! Paul James kicks it out.

[01:15] Team_092 possession (Score: 77-58)
FOUL! Reach-in foul on Tobias Bane during the drive. [Team fouls: 4] No free throws, side out. (Tobias Bane: 1 personal fouls)

[01:00] Team_092 possession (Score: 77-58)
Austin Bridges attempts a 3Pt. Contested by Tobias Bane (4.7 feet, MAN). Austin Bridges misses. Rebound secured by Malcolm Lillard.

[00:42] Team_032 possession (Score: 77-58)
DeMar Giddey drives and kicks out. Anfernee Butler attempts a 3Pt. Contested by Karl Gobert (5.9 feet, ZONE). Anfernee Butler misses. Rebound secured by John Giddey.

[00:26] Team_092 possession (Score: 77-58)
Immanuel Ingram commits a violation (traveling/carry)! TURNOVER! (dead ball)

[00:26] Substitution (Team_032): Tobias Bane OUT → Anfernee Griffin IN (stamina_rule2)

[00:26] Substitution (Team_032): DeMar Giddey OUT → Myles Herro IN (stamina_rule2)

[00:26] Substitution (Team_032): Jalen Westbrook OUT → Jrue Simmons IN (stamina_rule2)

[00:26] Substitution (Team_032): Anfernee Butler OUT → Jayson O'Neal IN (stamina_rule2)

[00:26] Substitution (Team_032): Malcolm Lillard OUT → Lauri Towns IN (stamina_rule2)

[00:26] Substitution (Team_092): Austin Bridges OUT → Bones Giddey IN (stamina_rule2)

[00:26] Substitution (Team_092): Karl Gobert OUT → Shaquille Russell IN (stamina_rule2)

[00:26] Substitution (Team_092): Paul James OUT → Vince Harris IN (stamina_rule2)

[00:26] Substitution (Team_092): John Giddey OUT → Shaquille Paul IN (stamina_rule2)

[00:26] Substitution (Team_092): Immanuel Ingram OUT → Pau Reaves IN (stamina_rule2)

[00:11] Team_032 possession (Score: 77-58)
Lauri Towns attempts a 3Pt. Wide open! Pau Reaves is 6.4 feet away. [MAN] Lauri Towns misses. Offensive rebound by Jayson O'Neal! Jayson O'Neal's putback is no good. Rebound secured by Pau Reaves.

================================================================================
                              3RD QUARTER COMPLETE                              
================================================================================

3RD QUARTER SCORE: Team_032 21, Team_092 15

BOX SCORE:
================================================================================

Team_032
--------------------------------------------------------------------------------
Player                MIN  PTS  REB  AST  TO      FG   FG%      3P   3P%
--------------------------------------------------------------------------------
Jalen Westbrook        27   10    0    1   0   4/6    66.7     0/0   0.0
Anfernee Butler        27    5    2    0   0   2/5    40.0     0/0   0.0
DeMar Giddey           27    2    0    1   0   1/4    25.0     0/0   0.0
Tobias Bane            27    2    6    0   0   1/3    33.3     0/0   0.0
Malcolm Lillard        27    2    5    3   0   1/1   100.0     0/0   0.0
Lauri Towns            10    0    0    0   0   0/1     0.0     0/0   0.0
Pau Reaves             10    0    1    0   0   0/0     0.0     0/0   0.0

TEAM: FG: 9/20 (45.0%), 3PT: 3/8 (37.5%), REB: 14 (3 off, 11 def), AST: 5, TO: 0
TEAM FOULS: 4


Team_092
--------------------------------------------------------------------------------
Player                MIN  PTS  REB  AST  TO      FG   FG%      3P   3P%
--------------------------------------------------------------------------------
Austin Bridges         27    8    0    0   0   3/5    60.0     0/0   0.0
Immanuel Ingram        27    3    1    2   0   1/4    25.0     0/0   0.0
Paul James             27    2    7    1   0   1/3    33.3     0/0   0.0
Karl Gobert            27    2    0    2   0   1/2    50.0     0/0   0.0
John Giddey            27    0    6    0   0   0/3     0.0     0/0   0.0

TEAM: FG: 6/17 (35.3%), 3PT: 2/7 (28.6%), REB: 14 (5 off, 9 def), AST: 5, TO: 2
TEAM FOULS: 7 [Team_032 in BONUS]

================================================================================

================================================================================
                       4TH QUARTER - Team_032 vs Team_092                       
================================================================================

[12:00] Team_032 possession (Score: 77-58)
FOUL! Shooting foul on John Giddey. Jalen Westbrook to the line for 3 free throws. [Team fouls: 1] (John Giddey: 1 personal fouls)   FT 1/3: GOOD   FT 2/3: GOOD   FT 3/3: GOOD Jalen Westbrook makes 3/3 from the line.
Score: 80-58

[11:46] Team_092 possession (Score: 80-58)
Austin Bridges drives and kicks out. Immanuel Ingram attempts a 3Pt. Contested by Malcolm Lillard (2.8 feet, MAN). Immanuel Ingram misses. Rebound secured by Tobias Bane.

[11:31] Team_032 possession (Score: 80-58)
Jalen Westbrook drives to the basket... Jalen Westbrook throws a bad pass! Stolen by Paul James! TURNOVER! (live ball)

[11:16] Team_092 possession (Score: 80-58)
FOUL! Reach-in foul on Malcolm Lillard during the drive. [Team fouls: 1] No free throws, side out. (Malcolm Lillard: 1 personal fouls)

[11:03] Team_092 possession (Score: 80-58)
Paul James drives, Jalen Westbrook stays with him. Paul James attempts a Dunk. Wide open! Jalen Westbrook is 7.1 feet away. [MAN] PAUL JAMES MAKES IT! Assist: Karl Gobert
Score: 80-60

[10:49] Team_032 possession (Score: 80-60)
FOUL! Shooting foul on John Giddey. DeMar Giddey to the line for 3 free throws. [Team fouls: 2] (John Giddey: 2 personal fouls)   FT 1/3: GOOD   FT 2/3: GOOD   FT 3/3: GOOD DeMar Giddey makes 3/3 from the line.
Score: 83-60

[10:29] Team_092 possession (Score: 83-60)
Immanuel Ingram drives and kicks out. Immanuel Ingram attempts a 3Pt. Contested by Tobias Bane (4.4 feet, ZONE). Immanuel Ingram misses. FOUL! Loose ball foul on Malcolm Lillard during the rebound battle. [Team fouls: 2] No free throws, side out. (Malcolm Lillard: 2 personal fouls)

[10:12] Team_092 possession (Score: 83-60)
John Giddey drives and kicks out. John Giddey attempts a 3Pt. Contested by Anfernee Butler (2.9 feet, MAN). John Giddey misses. Rebound secured by Tobias Bane.

[09:57] Team_032 possession (Score: 83-60)
Jalen Westbrook drives, Paul James stays with him. Jalen Westbrook attempts a Layup. Wide open! Paul James is 9.9 feet away. [MAN] JALEN WESTBROOK MAKES IT! Assist: Anfernee Butler
Score: 85-60

[09:40] Team_092 possession (Score: 85-60)
FOUL! Holding foul on Anfernee Butler. [Team fouls: 3] No free throws, side out. (Anfernee Butler: 1 personal fouls)

[09:20] Team_092 possession (Score: 85-60)
Immanuel Ingram drives, Malcolm Lillard stays with him. Immanuel Ingram attempts a Dunk. Wide open! Malcolm Lillard is 7.5 feet away. [MAN] Immanuel Ingram misses. Rebound secured by Anfernee Butler.

[09:07] Team_032 possession (Score: 85-60)
FOUL! Holding foul on Immanuel Ingram. [Team fouls: 3] No free throws, side out. (Immanuel Ingram: 1 personal fouls)

[08:52] Team_032 possession (Score: 85-60)
Anfernee Butler drives to the basket... Anfernee Butler throws a bad pass out of bounds! TURNOVER! (dead ball)

[08:52] Substitution (Team_032): Tobias Bane OUT → Anfernee Griffin IN (stamina_rule2)

[08:52] Substitution (Team_032): DeMar Giddey OUT → Myles Herro IN (stamina_rule2)

[08:52] Substitution (Team_032): Jalen Westbrook OUT → Jrue Simmons IN (stamina_rule2)

[08:52] Substitution (Team_032): Anfernee Butler OUT → Jayson O'Neal IN (stamina_rule2)

[08:52] Substitution (Team_032): Malcolm Lillard OUT → Lauri Towns IN (stamina_rule2)

[08:52] Substitution (Team_092): Austin Bridges OUT → Bones Giddey IN (stamina_rule2)

[08:52] Substitution (Team_092): Karl Gobert OUT → Shaquille Russell IN (stamina_rule2)

[08:52] Substitution (Team_092): Paul James OUT → Vince Harris IN (stamina_rule2)

[08:52] Substitution (Team_092): John Giddey OUT → Shaquille Paul IN (stamina_rule2)

[08:52] Substitution (Team_092): Immanuel Ingram OUT → Pau Reaves IN (stamina_rule2)

[08:38] Team_092 possession (Score: 85-60)
FOUL! Shooting foul on Anfernee Griffin. Pau Reaves to the line for 3 free throws. [Team fouls: 4] (Anfernee Griffin: 1 personal fouls)   FT 1/3: GOOD   FT 2/3: GOOD   FT 3/3: GOOD Pau Reaves makes 3/3 from the line.
Score: 85-63

[08:20] Team_032 possession (Score: 85-63)
Lauri Towns drives, Pau Reaves stays with him. Lauri Towns attempts a Dunk. Contested by Pau Reaves (4.8 feet, ZONE). LAURI TOWNS MAKES IT! Assist: Jayson O'Neal
Score: 87-63

[08:08] Team_092 possession (Score: 87-63)
Pau Reaves drives to the basket... Pau Reaves throws a bad pass out of bounds! TURNOVER! (dead ball)

[07:51] Team_032 possession (Score: 87-63)
Myles Herro attempts a 3Pt. Contested by Vince Harris (2.9 feet, ZONE). Myles Herro misses. Rebound secured by Shaquille Russell.

[07:40] Team_092 possession (Score: 87-63)
FOUL! Shooting foul on Lauri Towns. Bones Giddey to the line for 2 free throws. [BONUS: 5 team fouls] (Lauri Towns: 1 personal fouls)   FT 1/2: GOOD   FT 2/2: GOOD Bones Giddey makes 2/2 from the line.
Score: 87-65

[07:27] Team_032 possession (Score: 87-65)
Lauri Towns drives to the basket... Lauri Towns loses the ball! Stripped by Pau Reaves! TURNOVER! (live ball)

[07:12] Team_092 possession (Score: 87-65)
Shaquille Paul attempts a Layup. Contested by Lauri Towns (5.3 feet, ZONE). Shaquille Paul misses. Offensive rebound by Shaquille Paul! Shaquille Paul kicks it out.

[06:54] Team_092 possession (Score: 87-65)
Shaquille Paul attempts a 3Pt. Contested by Anfernee Griffin (2.6 feet, ZONE). Shaquille Paul misses. Rebound secured by Lauri Towns.

[06:39] Team_032 possession (Score: 87-65)
Anfernee Griffin attempts a 3Pt. Contested by Bones Giddey (4.3 feet, MAN). Anfernee Griffin misses. Rebound secured by Shaquille Paul.

[06:27] Team_092 possession (Score: 87-65)
Vince Harris attempts a 3Pt. Wide open! Anfernee Griffin is 6.8 feet away. [ZONE] Vince Harris misses. Rebound secured by Lauri Towns.

[06:11] Team_032 possession (Score: 87-65)
Anfernee Griffin attempts a 3Pt. Heavily contested by Vince Harris (1.8 feet, ZONE)! ANFERNEE GRIFFIN MAKES IT! Assist: Jayson O'Neal
Score: 90-65

[05:53] Team_092 possession (Score: 90-65)
Bones Giddey attempts a 3Pt. Contested by Anfernee Griffin (5.3 feet, ZONE). Bones Giddey misses. Rebound secured by Myles Herro.

[05:38] Team_032 possession (Score: 90-65)
Jayson O'Neal drives, Pau Reaves stays with him. Jayson O'Neal attempts a Dunk. Contested by Pau Reaves (4.8 feet, ZONE). JAYSON O'NEAL MAKES IT! Assist: Anfernee Griffin
Score: 92-65

[05:24] Team_092 possession (Score: 92-65)
Pau Reaves drives to the basket... FOUL! Offensive foul on Pau Reaves! Lauri Towns drew the charge! [Team fouls: 4] (Pau Reaves: 1 personal fouls) TURNOVER! (dead ball)

[05:09] Team_032 possession (Score: 92-65)
Jrue Simmons attempts a 3Pt. Contested by Vince Harris (3.7 feet, ZONE). JRUE SIMMONS MAKES IT! Assist: Myles Herro
Score: 95-65

[04:57] Team_092 possession (Score: 95-65)
Vince Harris attempts a 3Pt. Wide open! Jrue Simmons is 7.6 feet away. [MAN] Vince Harris misses. Rebound secured by Myles Herro.

[04:42] Team_032 possession (Score: 95-65)
Jayson O'Neal attempts a 3Pt. Wide open! Shaquille Paul is 8.3 feet away. [MAN] Jayson O'Neal misses. Rebound secured by Shaquille Russell.

[04:33] Team_092 possession (Score: 95-65)
Pau Reaves drives, picks up Lauri Towns. Help arrives from Myles Herro! Pau Reaves attempts a Layup. Wide open! Myles Herro is 6.8 feet away. [ZONE] PAU REAVES MAKES IT! Assist: Bones Giddey
Score: 95-67

[04:19] Team_032 possession (Score: 95-67)
Jrue Simmons drives, Vince Harris stays with him. Jrue Simmons attempts a Layup. Contested by Vince Harris (3.7 feet, MAN). JRUE SIMMONS MAKES IT!
Score: 97-67

[04:02] Team_092 possession (Score: 97-67)
Shaquille Russell attempts a 3Pt. Wide open! Anfernee Griffin is 6.3 feet away. [ZONE] Shaquille Russell misses. Rebound secured by Jayson O'Neal.

[03:46] Team_032 possession (Score: 97-67)
Myles Herro attempts a 3Pt. Contested by Shaquille Russell (5.5 feet, MAN). Myles Herro misses. Rebound secured by Shaquille Russell.

[03:33] Team_092 possession (Score: 97-67)
Bones Giddey attempts a 3Pt. Contested by Anfernee Griffin (3.6 feet, MAN). Bones Giddey misses. Rebound secured by Myles Herro.

[03:17] Team_032 possession (Score: 97-67)
Lauri Towns drives and kicks out. Myles Herro attempts a Midrange. Contested by Shaquille Russell (5.4 feet, MAN). MYLES HERRO MAKES IT! Assist: Jayson O'Neal
Score: 99-67

[03:06] Team_092 possession (Score: 99-67)
Vince Harris drives to the basket... Vince Harris commits a violation (traveling/carry)! TURNOVER! (dead ball)

[02:51] Team_032 possession (Score: 99-67)
Anfernee Griffin attempts a 3Pt. Heavily contested by Vince Harris (1.3 feet, ZONE)! Anfernee Griffin misses. FOUL! Loose ball foul on Shaquille Russell during the rebound battle. [IN THE BONUS! 5 team fouls] Lauri Towns to the line for 2 free throws. (Shaquille Russell: 1 personal fouls)   FT 1/2: MISS   FT 2/2: GOOD Lauri Towns makes 1/2 from the line.
Score: 100-67

[02:34] Team_092 possession (Score: 100-67)
Pau Reaves makes the Layup and draws the foul on Lauri Towns! And-1! Pau Reaves to the line for 1. [BONUS: 6 team fouls] (Lauri Towns: 2 personal fouls)   FT 1/1: GOOD Pau Reaves makes 1/1 from the line.
Score: 100-70

[02:20] Team_032 possession (Score: 100-70)
Jayson O'Neal attempts a 3Pt. Contested by Vince Harris (2.8 feet, ZONE). Jayson O'Neal misses. Rebound secured by Shaquille Paul.

[02:02] Team_092 possession (Score: 100-70)
Shaquille Russell drives, picks up Myles Herro. Help arrives from Jrue Simmons! Shaquille Russell attempts a Layup. Wide open! Jrue Simmons is 10.0 feet away. [MAN] SHAQUILLE RUSSELL MAKES IT! Assist: Bones Giddey
Score: 100-72

[01:48] Team_032 possession (Score: 100-72)
FOUL! Holding foul on Vince Harris. [IN THE BONUS! 6 team fouls] Jrue Simmons to the line for 2 free throws. (Vince Harris: 1 personal fouls)   FT 1/2: GOOD   FT 2/2: GOOD Jrue Simmons makes 2/2 from the line.
Score: 102-72

[01:33] Team_092 possession (Score: 102-72)
Bones Giddey attempts a 3Pt. Contested by Anfernee Griffin (5.0 feet, ZONE). Bones Giddey misses. Rebound secured by Myles Herro.

[01:19] Team_032 possession (Score: 102-72)
Myles Herro attempts a Layup. Wide open! Shaquille Russell is 6.8 feet away. [MAN] MYLES HERRO MAKES IT!
Score: 104-72

[01:06] Team_092 possession (Score: 104-72)
Shaquille Russell throws a bad pass out of bounds! TURNOVER! (dead ball)

[00:50] Team_032 possession (Score: 104-72)
Lauri Towns drives and kicks out. Jayson O'Neal attempts a 3Pt. Wide open! Shaquille Paul is 7.4 feet away. [MAN] Jayson O'Neal misses. Rebound secured by Pau Reaves.

[00:36] Team_092 possession (Score: 104-72)
Bones Giddey drives and kicks out. Shaquille Russell attempts a 3Pt. Wide open! Jrue Simmons is 7.3 feet away. [ZONE] SHAQUILLE RUSSELL MAKES IT! Assist: Bones Giddey
Score: 104-75

[00:20] Team_032 possession (Score: 104-75)
Jrue Simmons attempts a Midrange. Wide open! Vince Harris is 6.4 feet away. [MAN] JRUE SIMMONS MAKES IT!
Score: 106-75

[00:07] Team_092 possession (Score: 106-75)
Bones Giddey attempts a 3Pt. Contested by Anfernee Griffin (4.2 feet, MAN). Bones Giddey misses. Rebound secured by Lauri Towns.

================================================================================
                              4TH QUARTER COMPLETE                              
================================================================================

4TH QUARTER SCORE: Team_032 29, Team_092 17

BOX SCORE:
================================================================================

Team_032
--------------------------------------------------------------------------------
Player                MIN  PTS  REB  AST  TO      FG   FG%      3P   3P%
--------------------------------------------------------------------------------
Jrue Simmons           18    9    0    0   0   4/4   100.0     0/0   0.0
Jalen Westbrook        30    5    0    0   0   2/2   100.0     0/0   0.0
Myles Herro            18    4    4    1   0   2/4    50.0     0/0   0.0
DeMar Giddey           30    3    0    0   0   1/1   100.0     0/0   0.0
Lauri Towns            18    3    3    0   0   2/3    66.7     0/0   0.0
Anfernee Griffin       18    3    0    1   0   1/2    50.0     0/0   0.0
Jayson O'Neal          18    2    1    3   0   1/3    33.3     0/0   0.0
Tobias Bane            30    0    2    0   0   0/0     0.0     0/0   0.0
Anfernee Butler        30    0    1    1   0   0/0     0.0     0/0   0.0

TEAM: FG: 13/19 (68.4%), 3PT: 5/10 (50.0%), REB: 11 (0 off, 11 def), AST: 6, TO: 3
TEAM FOULS: 6 [Team_092 in BONUS]


Team_092
--------------------------------------------------------------------------------
Player                MIN  PTS  REB  AST  TO      FG   FG%      3P   3P%
--------------------------------------------------------------------------------
Pau Reaves             18    8    1    0   0   3/3   100.0     0/0   0.0
Shaquille Russell      18    5    3    0   0   2/3    66.7     0/0   0.0
Paul James             30    2    0    0   0   1/1   100.0     0/0   0.0
Bones Giddey           18    2    0    3   0   1/5    20.0     0/0   0.0
Austin Bridges         30    0    0    0   0   0/1     0.0     0/0   0.0
Karl Gobert            30    0    0    1   0   0/0     0.0     0/0   0.0
John Giddey            30    0    1    0   0   0/1     0.0     0/0   0.0
Immanuel Ingram        30    0    0    0   0   0/1     0.0     0/0   0.0
Shaquille Paul         18    0    3    0   0   0/1     0.0     0/0   0.0
Vince Harris           18    0    0    0   0   0/2     0.0     0/0   0.0

TEAM: FG: 7/18 (38.9%), 3PT: 1/9 (11.1%), REB: 8 (2 off, 6 def), AST: 4, TO: 4
TEAM FOULS: 6 [Team_032 in BONUS]

================================================================================

================================================================================
                               FULL GAME COMPLETE                               
================================================================================

FINAL SCORE: Team_032 106, Team_092 75

SCORING BY QUARTER:
--------------------------------------------------------------------------------
Team                     Q1     Q2     Q3     Q4    FINAL
--------------------------------------------------------------------------------
Team_032                 29     27     21     29      106
Team_092                 19     24     15     17       75
--------------------------------------------------------------------------------

FULL GAME BOX SCORE:
================================================================================

Team_032
--------------------------------------------------------------------------------
Player                MIN  PTS  REB  AST  TO      FG   FG%      3P   3P%      FT STL BLK
--------------------------------------------------------------------------------
Tobias Bane            30   17   10    3   0   7/10   70.0   1/1   100.0   2/2     0   0
DeMar Giddey           30   15    0    4   1   6/11   54.5   4/7    57.1   5/6     1   1
Jalen Westbrook        30   17    0    2   2   7/10   70.0   3/5    60.0   3/3     0   0
Anfernee Butler        30    5    8    3   2   2/7    28.6   0/2     0.0   1/1     1   0
Malcolm Lillard        30   10   16    4   1   4/8    50.0   0/1     0.0   2/2     0   0
Anfernee Griffin       18    5    0    1   2   3/6    50.0   2/3    66.7   0/0     0   0
Myles Herro            18   14    9    2   0   5/10   50.0   1/6    16.7   3/3     0   0
Jrue Simmons           18    9    0    1   0   4/4   100.0   1/1   100.0   2/4     0   1
Jayson O'Neal          18    8    3    4   0   2/5    40.0   0/2     0.0   0/0     0   1
Lauri Towns            18    6    6    1   1   4/6    66.7   0/1     0.0   2/4     1   0

TEAM: FG: 47/80 (58.8%), 3PT: 12/29 (41.4%), REB: 52 (9 off, 43 def), AST: 25, TO: 9


Team_092
--------------------------------------------------------------------------------
Player                MIN  PTS  REB  AST  TO      FG   FG%      3P   3P%      FT STL BLK
--------------------------------------------------------------------------------
Austin Bridges         30    8    0    2   1   3/8    37.5   2/4    50.0   0/0     0   0
Karl Gobert            30   12    0    4   2   5/8    62.5   2/4    50.0   0/0     0   1
Paul James             30    6   11    2   1   3/10   30.0   0/4     0.0   0/1     2   0
John Giddey            30    2   11    2   1   1/8    12.5   0/1     0.0   0/0     1   0
Immanuel Ingram        30   10    4    3   1   4/10   40.0   1/4    25.0   1/1     0   0
Bones Giddey           18    7    0    4   2   4/8    50.0   1/5    20.0   2/2     0   0
Shaquille Russell      18    8    4    0   2   3/4    75.0   0/1     0.0   1/2     1   0
Vince Harris           18    2    0    1   0   1/6    16.7   0/4     0.0   0/0     0   0
Shaquille Paul         18    5    5    1   0   2/5    40.0   0/2     0.0   1/1     1   0
Pau Reaves             18   13    6    1   2   5/7    71.4   2/3    66.7   4/4     1   0

TEAM: FG: 31/74 (41.9%), 3PT: 8/32 (25.0%), REB: 40 (9 off, 31 def), AST: 20, TO: 12

================================================================================
