================================================================================
                        FULL GAME - Team_084 vs Team_010                        
================================================================================

================================================================================
                       1ST QUARTER - Team_084 vs Team_010                       
================================================================================

[12:00] Team_084 possession (Score: 0-0)
Klay Thompson drives to the basket... Klay Thompson loses the ball! Stripped by RJ Young! TURNOVER! (live ball)

[11:44] Team_010 possession (Score: 0-0)
RJ Young makes the 3Pt and draws the foul on Luka Sexton! And-1! RJ Young to the line for 1. [Team fouls: 1] (Luka Sexton: 1 personal fouls)   FT 1/1: GOOD RJ Young makes 1/1 from the line.
Score: 0-4

[11:32] Team_084 possession (Score: 0-4)
Klay Thompson drives, Anthony Durant stays with him. Klay Thompson attempts a Layup. Contested by Anthony Durant (5.1 feet, ZONE). KLAY THOMPSON MAKES IT!
Score: 2-4

[11:15] Team_010 possession (Score: 2-4)
Anthony Durant attempts a Layup. Contested by Giannis Quickley (5.6 feet, MAN). ANTHONY DURANT MAKES IT!
Score: 2-6

[10:57] Team_084 possession (Score: 2-6)
Klay Thompson makes the Layup and draws the foul on Cade Morant! And-1! Klay Thompson to the line for 1. [Team fouls: 1] (Cade Morant: 1 personal fouls)   FT 1/1: GOOD Klay Thompson makes 1/1 from the line.
Score: 5-6

[10:43] Team_010 possession (Score: 5-6)
FOUL! Reach-in foul on Klay Thompson during the drive. [Team fouls: 2] No free throws, side out. (Klay Thompson: 1 personal fouls)

[10:27] Team_010 possession (Score: 5-6)
Anthony Durant attempts a Layup. Wide open! Giannis Quickley is 6.1 feet away. [ZONE] ANTHONY DURANT MAKES IT!
Score: 5-8

[10:14] Team_084 possession (Score: 5-8)
Jarrett Booker attempts a Midrange. Contested by Desmond Antetokounmpo (4.7 feet, MAN). Jarrett Booker misses. Rebound secured by Cade Morant.

[09:57] Team_010 possession (Score: 5-8)
Cade Morant attempts a 3Pt. Contested by Luka Sexton (4.3 feet, MAN). Cade Morant misses. Rebound secured by Giannis Quickley.

[09:39] Team_084 possession (Score: 5-8)
Giannis Quickley makes the 3Pt and draws the foul on Cade Morant! And-1! Giannis Quickley to the line for 1. [Team fouls: 2] (Cade Morant: 2 personal fouls)   FT 1/1: GOOD Giannis Quickley makes 1/1 from the line.
Score: 9-8

[09:23] Team_010 possession (Score: 9-8)
Cade Morant attempts a Midrange. Contested by Dejounte Ginobili (4.9 feet, ZONE). Cade Morant misses. Rebound secured by Giannis Quickley.

[09:12] Team_084 possession (Score: 9-8)
Dejounte Ginobili attempts a 3Pt. Contested by Michael Turner (5.7 feet, MAN). DEJOUNTE GINOBILI MAKES IT! Assist: Klay Thompson
Score: 12-8

[08:59] Team_010 possession (Score: 12-8)
FOUL! Reach-in foul on Giannis Quickley during the drive. [Team fouls: 3] No free throws, side out. (Giannis Quickley: 1 personal fouls)

[08:45] Team_010 possession (Score: 12-8)
Michael Turner attempts a Midrange. Wide open! Dejounte Ginobili is 7.0 feet away. [ZONE] Michael Turner misses. Rebound secured by Klay Thompson.

[08:27] Team_084 possession (Score: 12-8)
Giannis Quickley attempts a Midrange. Contested by Anthony Durant (4.0 feet, MAN). Giannis Quickley misses. Rebound secured by Cade Morant.

[08:10] Team_010 possession (Score: 12-8)
Anthony Durant attempts a Midrange. Wide open! Giannis Quickley is 6.0 feet away. [MAN] Anthony Durant misses. Offensive rebound by Cade Morant! Cade Morant kicks it out.

[07:54] Team_010 possession (Score: 12-8)
Cade Morant drives, picks up Giannis Quickley. Help arrives from Dejounte Ginobili! Cade Morant attempts a Layup. Contested by Dejounte Ginobili (4.8 feet, ZONE). Cade Morant misses. Rebound secured by Dejounte Ginobili.

[07:41] Team_084 possession (Score: 12-8)
Luka Sexton attempts a Midrange. Contested by Cade Morant (4.1 feet, MAN). Luka Sexton misses. Rebound secured by Anthony Durant.

[07:26] Team_010 possession (Score: 12-8)
RJ Young attempts a 3Pt. Wide open! Luka Sexton is 7.0 feet away. [ZONE] RJ Young misses. Rebound secured by Giannis Quickley.

[07:16] Team_084 possession (Score: 12-8)
Klay Thompson drives, Anthony Durant stays with him. Klay Thompson attempts a Dunk. Contested by Anthony Durant (2.9 feet, ZONE). KLAY THOMPSON MAKES IT! Assist: Luka Sexton
Score: 14-8

[07:04] Team_010 possession (Score: 14-8)
FOUL! Holding foul on Jarrett Booker. [Team fouls: 4] No free throws, side out. (Jarrett Booker: 1 personal fouls)

[06:52] Team_010 possession (Score: 14-8)
Anthony Durant attempts a Midrange. Contested by Giannis Quickley (5.1 feet, MAN). Anthony Durant misses. Rebound secured by Dejounte Ginobili.

[06:37] Team_084 possession (Score: 14-8)
Luka Sexton attempts a 3Pt. Contested by Cade Morant (5.2 feet, ZONE). Luka Sexton misses. Rebound secured by Anthony Durant.

[06:25] Team_010 possession (Score: 14-8)
Anthony Durant attempts a Midrange. Contested by Dejounte Ginobili (2.4 feet, ZONE). Anthony Durant misses. Rebound secured by Klay Thompson.

[06:12] Team_084 possession (Score: 14-8)
Luka Sexton attempts a Midrange. Contested by Michael Turner (5.5 feet, ZONE). Luka Sexton misses. Rebound secured by Desmond Antetokounmpo.

[05:58] Team_010 possession (Score: 14-8)
FOUL! Holding foul on Luka Sexton. [IN THE BONUS! 5 team fouls] Cade Morant to the line for 2 free throws. (Luka Sexton: 2 personal fouls)   FT 1/2: MISS   FT 2/2: MISS Cade Morant makes 0/2 from the line. Rebound secured by Giannis Quickley.

[05:42] Team_084 possession (Score: 14-8)
FOUL! Holding foul on Michael Turner. [Team fouls: 3] No free throws, side out. (Michael Turner: 1 personal fouls)

[05:26] Team_084 possession (Score: 14-8)
Jarrett Booker attempts a 3Pt. Wide open! Cade Morant is 6.7 feet away. [ZONE] JARRETT BOOKER MAKES IT! Assist: Dejounte Ginobili
Score: 17-8

[05:15] Team_010 possession (Score: 17-8)
Desmond Antetokounmpo loses control! Ball rolls out of bounds! TURNOVER! (dead ball)

[04:58] Team_084 possession (Score: 17-8)
Giannis Quickley attempts a Midrange. Wide open! Desmond Antetokounmpo is 6.5 feet away. [ZONE] Giannis Quickley misses. Rebound secured by Cade Morant.

[04:45] Team_010 possession (Score: 17-8)
Anthony Durant attempts a Layup. Contested by Giannis Quickley (5.2 feet, MAN). ANTHONY DURANT MAKES IT! Assist: Desmond Antetokounmpo
Score: 17-10

[04:33] Team_084 possession (Score: 17-10)
Jarrett Booker attempts a 3Pt. Contested by Michael Turner (4.9 feet, ZONE). Jarrett Booker misses. Rebound secured by Anthony Durant.

[04:19] Team_010 possession (Score: 17-10)
RJ Young drives, picks up Klay Thompson. Help arrives from Dejounte Ginobili! RJ Young attempts a Layup. Contested by Dejounte Ginobili (5.4 feet, MAN). RJ Young misses. FOUL! Loose ball foul on Klay Thompson during the rebound battle. [IN THE BONUS! 6 team fouls] Cade Morant to the line for 2 free throws. (Klay Thompson: 2 personal fouls)   FT 1/2: GOOD   FT 2/2: GOOD Cade Morant makes 2/2 from the line.
Score: 17-12

[04:02] Team_084 possession (Score: 17-12)
Jarrett Booker loses control! Ball rolls out of bounds! TURNOVER! (dead ball)

[03:48] Team_010 possession (Score: 17-12)
Michael Turner drives and kicks out. RJ Young attempts a 3Pt. Wide open! Luka Sexton is 7.2 feet away. [ZONE] RJ Young misses. Offensive rebound by Cade Morant! Cade Morant kicks it out.

[03:34] Team_010 possession (Score: 17-12)
Anthony Durant drives, Giannis Quickley stays with him. Anthony Durant attempts a Layup. Contested by Giannis Quickley (5.3 feet, ZONE). ANTHONY DURANT MAKES IT!
Score: 17-14

[03:19] Team_084 possession (Score: 17-14)
Klay Thompson attempts a 3Pt. Contested by RJ Young (2.3 feet, MAN). Klay Thompson misses. Rebound secured by Anthony Durant.

[03:04] Team_010 possession (Score: 17-14)
Michael Turner attempts a 3Pt. Contested by Luka Sexton (2.4 feet, ZONE). Michael Turner misses. Rebound secured by Giannis Quickley.

[02:48] Team_084 possession (Score: 17-14)
Giannis Quickley attempts a Midrange. Wide open! Michael Turner is 6.8 feet away. [ZONE] Giannis Quickley misses. Offensive rebound by Giannis Quickley! Giannis Quickley puts it back in!
Score: 19-14

[02:29] Team_010 possession (Score: 19-14)
Desmond Antetokounmpo attempts a 3Pt. Wide open! Jarrett Booker is 7.3 feet away. [MAN] Desmond Antetokounmpo misses. Rebound secured by Klay Thompson.

[02:14] Team_084 possession (Score: 19-14)
Dejounte Ginobili loses the ball! Stripped by Michael Turner! TURNOVER! (live ball)

[01:59] Team_010 possession (Score: 19-14)
Anthony Durant attempts a 3Pt. Contested by Giannis Quickley (3.7 feet, MAN). Anthony Durant misses. Rebound secured by Giannis Quickley.

[01:44] Team_084 possession (Score: 19-14)
Luka Sexton attempts a Layup. Contested by Anthony Durant (5.9 feet, ZONE). LUKA SEXTON MAKES IT! Assist: Jarrett Booker
Score: 21-14

[01:33] Team_010 possession (Score: 21-14)
Cade Morant makes the Dunk and draws the foul on Luka Sexton! And-1! Cade Morant to the line for 1. [BONUS: 7 team fouls] (Luka Sexton: 3 personal fouls)   FT 1/1: MISS Cade Morant makes 0/1 from the line. Rebound secured by Klay Thompson.
Score: 21-16

[01:21] Team_084 possession (Score: 21-16)
Dejounte Ginobili attempts a 3Pt. Contested by Cade Morant (4.2 feet, ZONE). Dejounte Ginobili misses. Rebound secured by Cade Morant.

[01:08] Team_010 possession (Score: 21-16)
RJ Young drives to the basket... RJ Young loses control! Ball rolls out of bounds! TURNOVER! (dead ball)

[01:08] Substitution (Team_084): Luka Sexton OUT → Magic Bryant IN (stamina_rule2)

[01:08] Substitution (Team_084): Dejounte Ginobili OUT → Chris Parker IN (stamina_rule2)

[01:08] Substitution (Team_084): Klay Thompson OUT → Evan Quickley IN (stamina_rule2)

[01:08] Substitution (Team_084): Jarrett Booker OUT → Pascal Jackson IN (stamina_rule2)

[01:08] Substitution (Team_084): Giannis Quickley OUT → Dejounte Porzingis IN (stamina_rule2)

[01:08] Substitution (Team_010): Cade Morant OUT → Draymond Leonard IN (stamina_rule2)

[01:08] Substitution (Team_010): Michael Turner OUT → Blake Harden IN (stamina_rule2)

[01:08] Substitution (Team_010): RJ Young OUT → Ben Gilgeous-Alexander IN (stamina_rule2)

[01:08] Substitution (Team_010): Desmond Antetokounmpo OUT → Vince Ingram IN (stamina_rule2)

[01:08] Substitution (Team_010): Anthony Durant OUT → Paolo Wade IN (stamina_rule2)

[00:57] Team_084 possession (Score: 21-16)
Dejounte Porzingis attempts a Midrange. Heavily contested by Ben Gilgeous-Alexander (0.7 feet, ZONE)! DEJOUNTE PORZINGIS MAKES IT! Assist: Evan Quickley
Score: 23-16

[00:39] Team_010 possession (Score: 23-16)
Vince Ingram throws a bad pass out of bounds! TURNOVER! (dead ball)

[00:20] Team_084 possession (Score: 23-16)
Pascal Jackson attempts a Midrange. Wide open! Blake Harden is 6.7 feet away. [ZONE] PASCAL JACKSON MAKES IT!
Score: 25-16

[00:07] Team_010 possession (Score: 25-16)
Blake Harden attempts a 3Pt. Contested by Magic Bryant (5.1 feet, ZONE). Blake Harden misses. Rebound secured by Dejounte Porzingis.

================================================================================
                              1ST QUARTER COMPLETE                              
================================================================================

1ST QUARTER SCORE: Team_084 25, Team_010 16

BOX SCORE:
================================================================================

Team_084
--------------------------------------------------------------------------------
Player                MIN  PTS  REB  AST  TO      FG   FG%      3P   3P%
--------------------------------------------------------------------------------
Klay Thompson          11    7    4    1   0   3/4    75.0     0/0   0.0
Giannis Quickley       11    6    7    0   0   2/4    50.0     0/0   0.0
Jarrett Booker         11    3    0    1   0   1/3    33.3     0/0   0.0
Dejounte Ginobili      11    3    2    1   0   1/2    50.0     0/0   0.0
Luka Sexton            11    2    0    1   0   1/4    25.0     0/0   0.0
Dejounte Porzingis      1    2    1    0   0   1/1   100.0     0/0   0.0
Pascal Jackson          1    2    0    0   0   1/1   100.0     0/0   0.0
Evan Quickley           1    0    0    1   0   0/0     0.0     0/0   0.0

TEAM: FG: 10/19 (52.6%), 3PT: 3/7 (42.9%), REB: 14 (1 off, 13 def), AST: 5, TO: 3
TEAM FOULS: 7 [Team_010 in BONUS]


Team_010
--------------------------------------------------------------------------------
Player                MIN  PTS  REB  AST  TO      FG   FG%      3P   3P%
--------------------------------------------------------------------------------
Anthony Durant         11    8    4    0   0   4/7    57.1     0/0   0.0
RJ Young               11    4    0    0   0   1/2    50.0     0/0   0.0
Cade Morant            11    2    6    0   0   1/5    20.0     0/0   0.0
Michael Turner         11    0    0    0   0   0/2     0.0     0/0   0.0
Desmond Antetokounmpo   11    0    1    1   0   0/1     0.0     0/0   0.0
Blake Harden            1    0    0    0   0   0/1     0.0     0/0   0.0

TEAM: FG: 6/19 (31.6%), 3PT: 1/7 (14.3%), REB: 11 (2 off, 9 def), AST: 1, TO: 3
TEAM FOULS: 3

================================================================================

================================================================================
                       2ND QUARTER - Team_084 vs Team_010                       
================================================================================

[12:00] Team_084 possession (Score: 25-16)
FOUL! Shooting foul on Anthony Durant. Giannis Quickley to the line for 2 free throws. [Team fouls: 1] (Anthony Durant: 1 personal fouls)   FT 1/2: GOOD   FT 2/2: GOOD Giannis Quickley makes 2/2 from the line.
Score: 27-16

[11:42] Team_010 possession (Score: 27-16)
Cade Morant attempts a Layup. Wide open! Luka Sexton is 6.5 feet away. [MAN] Cade Morant misses. Rebound secured by Giannis Quickley.

[11:28] Team_084 possession (Score: 27-16)
Dejounte Ginobili drives and kicks out. Dejounte Ginobili attempts a 3Pt. Contested by Michael Turner (2.4 feet, ZONE). Dejounte Ginobili misses. Offensive rebound by Giannis Quickley! Giannis Quickley puts it back in!
Score: 29-16

[11:14] Team_010 possession (Score: 29-16)
Michael Turner throws a bad pass! Stolen by Dejounte Ginobili! TURNOVER! (live ball)

[11:00] Team_084 possession (Score: 29-16)
Jarrett Booker attempts a 3Pt. Contested by Desmond Antetokounmpo (3.5 feet, MAN). JARRETT BOOKER MAKES IT! Assist: Klay Thompson
Score: 32-16

[10:47] Team_010 possession (Score: 32-16)
Cade Morant drives, Luka Sexton stays with him. Cade Morant attempts a Dunk. Contested by Luka Sexton (5.1 feet, MAN). CADE MORANT MAKES IT!
Score: 32-18

[10:34] Team_084 possession (Score: 32-18)
Klay Thompson drives and kicks out. Jarrett Booker attempts a 3Pt. Contested by Cade Morant (4.2 feet, ZONE). Jarrett Booker misses. Offensive rebound by Giannis Quickley! Giannis Quickley puts it back in!
Score: 34-18

[10:18] Team_010 possession (Score: 34-18)
RJ Young drives, picks up Klay Thompson. Help arrives from Dejounte Ginobili! RJ Young attempts a Layup. Contested by Dejounte Ginobili (4.1 feet, MAN). RJ Young misses. FOUL! Loose ball foul on Giannis Quickley during the rebound battle. [Team fouls: 1] No free throws, side out. (Giannis Quickley: 1 personal fouls)

[10:02] Team_010 possession (Score: 34-18)
Desmond Antetokounmpo throws a bad pass! Stolen by Jarrett Booker! TURNOVER! (live ball)

[09:47] Team_084 possession (Score: 34-18)
Luka Sexton makes the Layup and draws the foul on Michael Turner! And-1! Luka Sexton to the line for 1. [Team fouls: 2] (Michael Turner: 1 personal fouls)   FT 1/1: MISS Luka Sexton makes 0/1 from the line. Rebound secured by Michael Turner.
Score: 36-18

[09:33] Team_010 possession (Score: 36-18)
RJ Young attempts a Layup. Contested by Giannis Quickley (5.6 feet, ZONE). RJ Young misses. Rebound secured by Giannis Quickley.

[09:18] Team_084 possession (Score: 36-18)
Klay Thompson attempts a Layup. Wide open! RJ Young is 8.6 feet away. [MAN] KLAY THOMPSON MAKES IT! Assist: Luka Sexton
Score: 38-18

[09:07] Team_010 possession (Score: 38-18)
RJ Young attempts a Layup. BLOCKED BY DEJOUNTE GINOBILI! Ball deflects out of bounds off RJ Young.

[08:48] Team_084 possession (Score: 38-18)
Luka Sexton attempts a 3Pt. Contested by Cade Morant (6.0 feet, MAN). Luka Sexton misses. Offensive rebound by Giannis Quickley! Giannis Quickley's putback is no good. Rebound secured by Cade Morant.

[08:35] Team_010 possession (Score: 38-18)
Anthony Durant loses control! Ball rolls out of bounds! TURNOVER! (dead ball)

[08:35] Substitution (Team_084): Luka Sexton OUT → Magic Bryant IN (stamina_rule2)

[08:35] Substitution (Team_084): Dejounte Ginobili OUT → Chris Parker IN (stamina_rule2)

[08:35] Substitution (Team_084): Klay Thompson OUT → Evan Quickley IN (stamina_rule2)

[08:35] Substitution (Team_084): Jarrett Booker OUT → Pascal Jackson IN (stamina_rule2)

[08:35] Substitution (Team_084): Giannis Quickley OUT → Dejounte Porzingis IN (stamina_rule2)

[08:35] Substitution (Team_010): Cade Morant OUT → Draymond Leonard IN (stamina_rule2)

[08:35] Substitution (Team_010): Michael Turner OUT → Blake Harden IN (stamina_rule2)

[08:35] Substitution (Team_010): RJ Young OUT → Ben Gilgeous-Alexander IN (stamina_rule2)

[08:35] Substitution (Team_010): Desmond Antetokounmpo OUT → Vince Ingram IN (stamina_rule2)

[08:35] Substitution (Team_010): Anthony Durant OUT → Paolo Wade IN (stamina_rule2)

[08:21] Team_084 possession (Score: 38-18)
Dejounte Porzingis drives, picks up Paolo Wade. Help arrives from Blake Harden! Dejounte Porzingis attempts a Dunk. Contested by Blake Harden (5.6 feet, MAN). DEJOUNTE PORZINGIS MAKES IT! Assist: Magic Bryant
Score: 40-18

[08:06] Team_010 possession (Score: 40-18)
Draymond Leonard attempts a Midrange. Contested by Magic Bryant (5.5 feet, MAN). DRAYMOND LEONARD MAKES IT!
Score: 40-20

[07:50] Team_084 possession (Score: 40-20)
Evan Quickley attempts a 3Pt. Contested by Ben Gilgeous-Alexander (5.0 feet, MAN). EVAN QUICKLEY MAKES IT! Assist: Magic Bryant
Score: 43-20

[07:37] Team_010 possession (Score: 43-20)
Draymond Leonard attempts a 3Pt. Contested by Magic Bryant (3.2 feet, ZONE). Draymond Leonard misses. Offensive rebound by Paolo Wade! Paolo Wade kicks it out.

[07:25] Team_010 possession (Score: 43-20)
Draymond Leonard attempts a 3Pt. Heavily contested by Magic Bryant (0.7 feet, ZONE)! Draymond Leonard misses. FOUL! Loose ball foul on Pascal Jackson during the rebound battle. [Team fouls: 2] No free throws, side out. (Pascal Jackson: 1 personal fouls)

[07:11] Team_010 possession (Score: 43-20)
FOUL! Shooting foul on Pascal Jackson. Vince Ingram to the line for 2 free throws. [Team fouls: 3] (Pascal Jackson: 2 personal fouls)   FT 1/2: GOOD   FT 2/2: MISS Vince Ingram makes 1/2 from the line. Rebound secured by Dejounte Porzingis.
Score: 43-21

[06:58] Team_084 possession (Score: 43-21)
Pascal Jackson attempts a Layup. Wide open! Paolo Wade is 8.2 feet away. [ZONE] Pascal Jackson misses. Rebound secured by Ben Gilgeous-Alexander.

[06:47] Team_010 possession (Score: 43-21)
Paolo Wade drives and kicks out. Blake Harden attempts a Midrange. Contested by Chris Parker (5.6 feet, MAN). Blake Harden misses. Rebound secured by Evan Quickley.

[06:34] Team_084 possession (Score: 43-21)
Dejounte Porzingis attempts a Midrange. Contested by Blake Harden (3.6 feet, ZONE). DEJOUNTE PORZINGIS MAKES IT! Assist: Magic Bryant
Score: 45-21

[06:19] Team_010 possession (Score: 45-21)
Vince Ingram attempts a Midrange. Wide open! Pascal Jackson is 6.7 feet away. [ZONE] VINCE INGRAM MAKES IT!
Score: 45-23

[06:09] Team_084 possession (Score: 45-23)
Magic Bryant attempts a 3Pt. Wide open! Draymond Leonard is 7.9 feet away. [ZONE] MAGIC BRYANT MAKES IT! Assist: Pascal Jackson
Score: 48-23

[05:53] Team_010 possession (Score: 48-23)
Blake Harden attempts a Midrange. Contested by Chris Parker (3.7 feet, MAN). Blake Harden misses. Rebound secured by Dejounte Porzingis.

[05:38] Team_084 possession (Score: 48-23)
Evan Quickley drives, Ben Gilgeous-Alexander stays with him. Evan Quickley attempts a Dunk. Wide open! Ben Gilgeous-Alexander is 6.6 feet away. [MAN] EVAN QUICKLEY MAKES IT! Assist: Magic Bryant
Score: 50-23

[05:26] Team_010 possession (Score: 50-23)
Ben Gilgeous-Alexander attempts a Midrange. Wide open! Evan Quickley is 6.8 feet away. [MAN] BEN GILGEOUS-ALEXANDER MAKES IT!
Score: 50-25

[05:11] Team_084 possession (Score: 50-25)
Chris Parker attempts a 3Pt. Contested by Blake Harden (4.5 feet, MAN). Chris Parker misses. Rebound secured by Paolo Wade.

[04:59] Team_010 possession (Score: 50-25)
Paolo Wade attempts a Layup. Heavily contested by Dejounte Porzingis (1.5 feet, MAN)! PAOLO WADE MAKES IT!
Score: 50-27

[04:46] Team_084 possession (Score: 50-27)
Chris Parker attempts a 3Pt. Contested by Blake Harden (4.1 feet, MAN). Chris Parker misses. Rebound secured by Ben Gilgeous-Alexander.

[04:32] Team_010 possession (Score: 50-27)
Draymond Leonard attempts a 3Pt. Contested by Magic Bryant (5.6 feet, ZONE). Draymond Leonard misses. Rebound secured by Evan Quickley.

[04:14] Team_084 possession (Score: 50-27)
Evan Quickley drives and kicks out. Magic Bryant attempts a Midrange. Contested by Vince Ingram (2.8 feet, ZONE). Magic Bryant misses. Rebound secured by Blake Harden.

[04:00] Team_010 possession (Score: 50-27)
Paolo Wade drives and kicks out. Paolo Wade attempts a Midrange. Contested by Chris Parker (5.9 feet, ZONE). Paolo Wade misses. Rebound secured by Dejounte Porzingis.

[03:46] Team_084 possession (Score: 50-27)
Evan Quickley drives and kicks out. Evan Quickley attempts a 3Pt. Contested by Draymond Leonard (2.8 feet, ZONE). Evan Quickley misses. Rebound secured by Ben Gilgeous-Alexander.

[03:31] Team_010 possession (Score: 50-27)
Draymond Leonard attempts a 3Pt. Heavily contested by Magic Bryant (1.8 feet, MAN)! Draymond Leonard misses. FOUL! Loose ball foul on Evan Quickley during the rebound battle. [Team fouls: 4] No free throws, side out. (Evan Quickley: 1 personal fouls)

[03:13] Team_010 possession (Score: 50-27)
Paolo Wade drives and kicks out. FOUL! Shooting foul on Chris Parker. Blake Harden to the line for 3 free throws. [BONUS: 5 team fouls] (Chris Parker: 1 personal fouls)   FT 1/3: GOOD   FT 2/3: GOOD   FT 3/3: GOOD Blake Harden makes 3/3 from the line.
Score: 50-30

[02:58] Team_084 possession (Score: 50-30)
FOUL! Reach-in foul on Paolo Wade during the drive. [Team fouls: 3] No free throws, side out. (Paolo Wade: 1 personal fouls)

[02:41] Team_084 possession (Score: 50-30)
Dejounte Porzingis attempts a Midrange. Contested by Paolo Wade (4.7 feet, MAN). DEJOUNTE PORZINGIS MAKES IT! Assist: Magic Bryant
Score: 52-30

[02:25] Team_010 possession (Score: 52-30)
Vince Ingram attempts a Layup. Wide open! Pascal Jackson is 7.2 feet away. [ZONE] Vince Ingram misses. Rebound secured by Pascal Jackson.

[02:07] Team_084 possession (Score: 52-30)
Evan Quickley drives and kicks out. Chris Parker makes the 3Pt and draws the foul on Blake Harden! And-1! Chris Parker to the line for 1. [Team fouls: 4] (Blake Harden: 1 personal fouls)   FT 1/1: GOOD Chris Parker makes 1/1 from the line.
Score: 56-30

[01:52] Team_010 possession (Score: 56-30)
Blake Harden makes the Midrange and draws the foul on Chris Parker! And-1! Blake Harden to the line for 1. [BONUS: 6 team fouls] (Chris Parker: 2 personal fouls)   FT 1/1: GOOD Blake Harden makes 1/1 from the line.
Score: 56-33

[01:38] Team_084 possession (Score: 56-33)
FOUL! Reach-in foul on Vince Ingram during the drive. [IN THE BONUS! 5 team fouls] Pascal Jackson to the line for 2 free throws. (Vince Ingram: 1 personal fouls)   FT 1/2: GOOD   FT 2/2: GOOD Pascal Jackson makes 2/2 from the line.
Score: 58-33

[01:24] Team_010 possession (Score: 58-33)
Vince Ingram drives to the basket... FOUL! Offensive foul on Vince Ingram! Dejounte Porzingis drew the charge! [Team fouls: 6] (Vince Ingram: 2 personal fouls) TURNOVER! (dead ball)

[01:14] Team_084 possession (Score: 58-33)
Dejounte Porzingis attempts a Midrange. Contested by Paolo Wade (5.8 feet, MAN). Dejounte Porzingis misses. Offensive rebound by Pascal Jackson! Pascal Jackson kicks it out.

[00:58] Team_084 possession (Score: 58-33)
Pascal Jackson attempts a Midrange. Wide open! Paolo Wade is 8.5 feet away. [ZONE] PASCAL JACKSON MAKES IT! Assist: Dejounte Porzingis
Score: 60-33

[00:41] Team_010 possession (Score: 60-33)
Vince Ingram attempts a 3Pt. Wide open! Pascal Jackson is 7.2 feet away. [MAN] VINCE INGRAM MAKES IT! Assist: Draymond Leonard
Score: 60-36

[00:24] Team_084 possession (Score: 60-36)
Dejounte Porzingis attempts a Layup. Wide open! Paolo Wade is 7.4 feet away. [ZONE] DEJOUNTE PORZINGIS MAKES IT! Assist: Magic Bryant
Score: 62-36

[00:12] Team_010 possession (Score: 62-36)
Vince Ingram drives, Dejounte Porzingis stays with him. Vince Ingram attempts a Dunk. Wide open! Dejounte Porzingis is 7.5 feet away. [ZONE] VINCE INGRAM MAKES IT!
Score: 62-38

================================================================================
                              2ND QUARTER COMPLETE                              
================================================================================

2ND QUARTER SCORE: Team_084 37, Team_010 22

BOX SCORE:
================================================================================

Team_084
--------------------------------------------------------------------------------
Player                MIN  PTS  REB  AST  TO      FG   FG%      3P   3P%
--------------------------------------------------------------------------------
Dejounte Porzingis      9    8    3    1   0   4/4   100.0     0/0   0.0
Giannis Quickley       15    6    4    0   0   3/3   100.0     0/0   0.0
Evan Quickley           9    5    2    0   0   2/4    50.0     0/0   0.0
Pascal Jackson          9    4    2    1   0   2/3    66.7     0/0   0.0
Chris Parker            9    4    0    0   0   1/3    33.3     0/0   0.0
Jarrett Booker         15    3    0    0   0   1/1   100.0     0/0   0.0
Magic Bryant            9    3    0    6   0   1/1   100.0     0/0   0.0
Cade Morant            15    2    2    0   0   1/2    50.0     0/0   0.0
Klay Thompson          15    2    0    1   0   1/1   100.0     0/0   0.0
Luka Sexton            15    0    0    1   0   0/2     0.0     0/0   0.0

TEAM: FG: 15/22 (68.2%), 3PT: 3/6 (50.0%), REB: 12 (4 off, 8 def), AST: 10, TO: 0
TEAM FOULS: 6 [Team_010 in BONUS]


Team_010
--------------------------------------------------------------------------------
Player                MIN  PTS  REB  AST  TO      FG   FG%      3P   3P%
--------------------------------------------------------------------------------
Vince Ingram            9    7    0    0   0   3/5    60.0     0/0   0.0
Blake Harden            9    6    2    0   0   2/3    66.7     0/0   0.0
Draymond Leonard        9    2    0    1   0   1/2    50.0     0/0   0.0
Paolo Wade              9    2    3    0   0   1/3    33.3     0/0   0.0
Ben Gilgeous-Alexander    9    2    3    0   0   1/1   100.0     0/0   0.0
Michael Turner         15    0    1    0   0   0/0     0.0     0/0   0.0
RJ Young               15    0    0    0   0   0/2     0.0     0/0   0.0

TEAM: FG: 9/18 (50.0%), 3PT: 1/2 (50.0%), REB: 10 (4 off, 6 def), AST: 1, TO: 4
TEAM FOULS: 6 [Team_084 in BONUS]

================================================================================

================================================================================
                       3RD QUARTER - Team_084 vs Team_010                       
================================================================================

[12:00] Team_084 possession (Score: 62-38)
Giannis Quickley drives and kicks out. FOUL! Shooting foul on Anthony Durant. Giannis Quickley to the line for 3 free throws. [Team fouls: 1] (Anthony Durant: 1 personal fouls)   FT 1/3: MISS   FT 2/3: GOOD   FT 3/3: GOOD Giannis Quickley makes 2/3 from the line.
Score: 64-38

[11:44] Team_010 possession (Score: 64-38)
Cade Morant drives and kicks out. Anthony Durant attempts a Midrange. Wide open! Jarrett Booker is 7.5 feet away. [ZONE] ANTHONY DURANT MAKES IT!
Score: 64-40

[11:28] Team_084 possession (Score: 64-40)
Klay Thompson drives, picks up Anthony Durant. Help arrives from Cade Morant! Klay Thompson attempts a Layup. Contested by Cade Morant (2.1 feet, ZONE). KLAY THOMPSON MAKES IT! Assist: Jarrett Booker
Score: 66-40

[11:14] Team_010 possession (Score: 66-40)
FOUL! Reach-in foul on Giannis Quickley during the drive. [Team fouls: 1] No free throws, side out. (Giannis Quickley: 1 personal fouls)

[10:55] Team_010 possession (Score: 66-40)
FOUL! Reach-in foul on Giannis Quickley during the drive. [Team fouls: 2] No free throws, side out. (Giannis Quickley: 2 personal fouls)

[10:37] Team_010 possession (Score: 66-40)
Cade Morant attempts a 3Pt. Contested by Dejounte Ginobili (5.8 feet, ZONE). CADE MORANT MAKES IT! Assist: Michael Turner
Score: 66-43

[10:25] Team_084 possession (Score: 66-43)
Luka Sexton attempts a 3Pt. Wide open! Cade Morant is 6.5 feet away. [ZONE] LUKA SEXTON MAKES IT! Assist: Klay Thompson
Score: 69-43

[10:13] Team_010 possession (Score: 69-43)
Michael Turner attempts a 3Pt. Contested by Dejounte Ginobili (3.8 feet, MAN). Michael Turner misses. Offensive rebound by Cade Morant! Cade Morant kicks it out.

[10:01] Team_010 possession (Score: 69-43)
Cade Morant attempts a 3Pt. Wide open! Luka Sexton is 6.2 feet away. [MAN] Cade Morant misses. FOUL! Loose ball foul on Giannis Quickley during the rebound battle. [Team fouls: 3] No free throws, side out. (Giannis Quickley: 3 personal fouls)

[09:47] Team_010 possession (Score: 69-43)
FOUL! Shooting foul on Klay Thompson. RJ Young to the line for 3 free throws. [Team fouls: 4] (Klay Thompson: 1 personal fouls)   FT 1/3: MISS   FT 2/3: GOOD   FT 3/3: GOOD RJ Young makes 2/3 from the line.
Score: 69-45

[09:35] Team_084 possession (Score: 69-45)
Dejounte Ginobili attempts a 3Pt. Heavily contested by Michael Turner (1.0 feet, MAN)! Dejounte Ginobili misses. Rebound secured by Anthony Durant.

[09:26] Team_010 possession (Score: 69-45)
Desmond Antetokounmpo attempts a Midrange. Wide open! Dejounte Ginobili is 6.5 feet away. [ZONE] Desmond Antetokounmpo misses. Offensive rebound by Cade Morant! Cade Morant kicks it out.

[09:07] Team_010 possession (Score: 69-45)
FOUL! Offensive foul on Anthony Durant! Giannis Quickley drew the charge! [Team fouls: 2] (Anthony Durant: 2 personal fouls) TURNOVER! (dead ball)

[08:51] Team_084 possession (Score: 69-45)
Giannis Quickley drives, picks up Anthony Durant. Help arrives from Cade Morant! Giannis Quickley attempts a Layup. Contested by Cade Morant (3.4 feet, MAN). GIANNIS QUICKLEY MAKES IT! Assist: Jarrett Booker
Score: 71-45

[08:35] Team_010 possession (Score: 71-45)
Cade Morant makes the Midrange and draws the foul on Luka Sexton! And-1! Cade Morant to the line for 1. [BONUS: 5 team fouls] (Luka Sexton: 1 personal fouls)   FT 1/1: GOOD Cade Morant makes 1/1 from the line.
Score: 71-48

[08:22] Team_084 possession (Score: 71-48)
Giannis Quickley attempts a Midrange. Heavily contested by Anthony Durant (1.4 feet, MAN)! Giannis Quickley misses. Rebound secured by Anthony Durant.

[08:11] Team_010 possession (Score: 71-48)
Anthony Durant attempts a 3Pt. Contested by Luka Sexton (3.8 feet, ZONE). Anthony Durant misses. Rebound secured by Giannis Quickley.

[07:56] Team_084 possession (Score: 71-48)
Giannis Quickley drives, picks up Anthony Durant. Help arrives from Cade Morant! Giannis Quickley attempts a Dunk. Contested by Cade Morant (5.1 feet, ZONE). GIANNIS QUICKLEY MAKES IT! Assist: Jarrett Booker
Score: 73-48

[07:39] Team_010 possession (Score: 73-48)
FOUL! Shooting foul on Giannis Quickley. RJ Young to the line for 2 free throws. [BONUS: 6 team fouls] (Giannis Quickley: 4 personal fouls)   FT 1/2: GOOD   FT 2/2: GOOD RJ Young makes 2/2 from the line.
Score: 73-50

[07:21] Team_084 possession (Score: 73-50)
Jarrett Booker throws a bad pass! Stolen by Desmond Antetokounmpo! TURNOVER! (live ball)

[07:05] Team_010 possession (Score: 73-50)
Desmond Antetokounmpo attempts a 3Pt. Contested by Jarrett Booker (3.5 feet, MAN). DESMOND ANTETOKOUNMPO MAKES IT!
Score: 73-53

[06:51] Team_084 possession (Score: 73-53)
Giannis Quickley drives to the basket... Giannis Quickley loses the ball! Stripped by Anthony Durant! TURNOVER! (live ball)

[06:36] Team_010 possession (Score: 73-53)
Cade Morant attempts a Layup. Contested by Giannis Quickley (4.2 feet, ZONE). Cade Morant misses. Rebound secured by Dejounte Ginobili.

[06:23] Team_084 possession (Score: 73-53)
Jarrett Booker attempts a 3Pt. Contested by Desmond Antetokounmpo (4.6 feet, MAN). Jarrett Booker misses. FOUL! Loose ball foul on Desmond Antetokounmpo during the rebound battle. [Team fouls: 3] No free throws, side out. (Desmond Antetokounmpo: 1 personal fouls)

[06:11] Team_084 possession (Score: 73-53)
Luka Sexton drives and kicks out. Klay Thompson attempts a 3Pt. Contested by RJ Young (4.7 feet, MAN). Klay Thompson misses. Rebound secured by Anthony Durant.

[05:58] Team_010 possession (Score: 73-53)
Desmond Antetokounmpo attempts a Midrange. Contested by Jarrett Booker (5.7 feet, MAN). Desmond Antetokounmpo misses. Rebound secured by Dejounte Ginobili.

[05:43] Team_084 possession (Score: 73-53)
Luka Sexton attempts a Midrange. Contested by Cade Morant (2.3 feet, MAN). LUKA SEXTON MAKES IT!
Score: 75-53

[05:25] Team_010 possession (Score: 75-53)
Michael Turner attempts a 3Pt. Wide open! Dejounte Ginobili is 7.2 feet away. [MAN] Michael Turner misses. Offensive rebound by Cade Morant! Cade Morant kicks it out.

[05:13] Team_010 possession (Score: 75-53)
Anthony Durant drives, picks up Giannis Quickley. Help arrives from Dejounte Ginobili! Anthony Durant attempts a Layup. Contested by Dejounte Ginobili (5.8 feet, MAN). Anthony Durant misses. Rebound secured by Klay Thompson.

[04:58] Team_084 possession (Score: 75-53)
Dejounte Ginobili attempts a Midrange. Contested by Michael Turner (2.2 feet, MAN). Dejounte Ginobili misses. Offensive rebound by Dejounte Ginobili! Dejounte Ginobili kicks it out.

[04:46] Team_084 possession (Score: 75-53)
Dejounte Ginobili attempts a 3Pt. Wide open! Michael Turner is 8.0 feet away. [MAN] DEJOUNTE GINOBILI MAKES IT! Assist: Luka Sexton
Score: 78-53

[04:32] Team_010 possession (Score: 78-53)
Desmond Antetokounmpo attempts a Layup. Wide open! Jarrett Booker is 6.4 feet away. [MAN] DESMOND ANTETOKOUNMPO MAKES IT! Assist: RJ Young
Score: 78-55

[04:23] Team_084 possession (Score: 78-55)
Klay Thompson attempts a Layup. Contested by RJ Young (3.8 feet, MAN). KLAY THOMPSON MAKES IT! Assist: Jarrett Booker
Score: 80-55

[04:06] Team_010 possession (Score: 80-55)
Michael Turner attempts a 3Pt. Contested by Dejounte Ginobili (5.1 feet, MAN). Michael Turner misses. Rebound secured by Klay Thompson.

[03:54] Team_084 possession (Score: 80-55)
Luka Sexton drives, Anthony Durant stays with him. Luka Sexton attempts a Layup. Heavily contested by Anthony Durant (0.9 feet, ZONE)! Luka Sexton misses. Offensive rebound by Giannis Quickley! Giannis Quickley's putback is no good. Rebound secured by Michael Turner.

[03:40] Team_010 possession (Score: 80-55)
Michael Turner makes the Dunk and draws the foul on Dejounte Ginobili! And-1! Michael Turner to the line for 1. [BONUS: 7 team fouls] (Dejounte Ginobili: 1 personal fouls)   FT 1/1: GOOD Michael Turner makes 1/1 from the line.
Score: 80-58

[03:21] Team_084 possession (Score: 80-58)
Klay Thompson drives, picks up RJ Young. Help arrives from Cade Morant! Klay Thompson attempts a Dunk. Contested by Cade Morant (5.1 feet, MAN). KLAY THOMPSON MAKES IT! Assist: Dejounte Ginobili
Score: 82-58

[03:09] Team_010 possession (Score: 82-58)
RJ Young drives, Klay Thompson stays with him. RJ Young attempts a Layup. Contested by Klay Thompson (5.0 feet, MAN). RJ YOUNG MAKES IT! Assist: Michael Turner
Score: 82-60

[02:56] Team_084 possession (Score: 82-60)
Giannis Quickley drives, Anthony Durant stays with him. Giannis Quickley attempts a Layup. Wide open! Anthony Durant is 6.5 feet away. [MAN] GIANNIS QUICKLEY MAKES IT! Assist: Dejounte Ginobili
Score: 84-60

[02:44] Team_010 possession (Score: 84-60)
Michael Turner drives to the basket... Michael Turner commits a violation (traveling/carry)! TURNOVER! (dead ball)

[02:44] Substitution (Team_084): Klay Thompson OUT → Evan Quickley IN (stamina_rule2)

[02:44] Substitution (Team_084): Jarrett Booker OUT → Pascal Jackson IN (stamina_rule2)

[02:44] Substitution (Team_084): Giannis Quickley OUT → Dejounte Porzingis IN (stamina_rule2)

[02:44] Substitution (Team_010): Cade Morant OUT → Draymond Leonard IN (stamina_rule2)

[02:44] Substitution (Team_010): RJ Young OUT → Ben Gilgeous-Alexander IN (stamina_rule2)

[02:44] Substitution (Team_010): Desmond Antetokounmpo OUT → Vince Ingram IN (stamina_rule2)

[02:44] Substitution (Team_010): Anthony Durant OUT → Paolo Wade IN (stamina_rule2)

[02:31] Team_084 possession (Score: 84-60)
Dejounte Porzingis attempts a 3Pt. Contested by Draymond Leonard (3.8 feet, ZONE). Dejounte Porzingis misses. Rebound secured by Ben Gilgeous-Alexander.

[02:17] Team_010 possession (Score: 84-60)
Vince Ingram attempts a Midrange. Heavily contested by Pascal Jackson (1.2 feet, MAN)! Vince Ingram misses. Rebound secured by Pascal Jackson.

[02:01] Team_084 possession (Score: 84-60)
Dejounte Ginobili attempts a 3Pt. Contested by Michael Turner (4.5 feet, MAN). Dejounte Ginobili misses. Offensive rebound by Dejounte Porzingis! Dejounte Porzingis kicks it out.

[01:43] Team_084 possession (Score: 84-60)
Luka Sexton attempts a 3Pt. Wide open! Ben Gilgeous-Alexander is 6.5 feet away. [ZONE] LUKA SEXTON MAKES IT! Assist: Dejounte Porzingis
Score: 87-60

[01:29] Team_010 possession (Score: 87-60)
Paolo Wade attempts a 3Pt. Wide open! Luka Sexton is 7.5 feet away. [ZONE] Paolo Wade misses. Rebound secured by Dejounte Porzingis.

[01:17] Team_084 possession (Score: 87-60)
Dejounte Ginobili attempts a Midrange. Contested by Michael Turner (3.9 feet, MAN). Dejounte Ginobili misses. Rebound secured by Paolo Wade.

[01:08] Team_010 possession (Score: 87-60)
Vince Ingram drives, Dejounte Porzingis stays with him. Vince Ingram attempts a Layup. Contested by Dejounte Porzingis (4.3 feet, ZONE). Vince Ingram misses. Rebound secured by Dejounte Porzingis.

[00:54] Team_084 possession (Score: 87-60)
Pascal Jackson attempts a 3Pt. Contested by Draymond Leonard (5.7 feet, ZONE). Pascal Jackson misses. Offensive rebound by Dejounte Porzingis! Dejounte Porzingis kicks it out.

[00:40] Team_084 possession (Score: 87-60)
Dejounte Porzingis drives, Paolo Wade stays with him. Dejounte Porzingis attempts a Dunk. Wide open! Paolo Wade is 7.9 feet away. [MAN] DEJOUNTE PORZINGIS MAKES IT!
Score: 89-60

[00:28] Team_010 possession (Score: 89-60)
Vince Ingram makes the Layup and draws the foul on Pascal Jackson! And-1! Vince Ingram to the line for 1. [BONUS: 8 team fouls] (Pascal Jackson: 1 personal fouls)   FT 1/1: GOOD Vince Ingram makes 1/1 from the line.
Score: 89-63

[00:15] Team_084 possession (Score: 89-63)
FOUL! Shooting foul on Ben Gilgeous-Alexander. Dejounte Porzingis to the line for 2 free throws. [Team fouls: 4] (Ben Gilgeous-Alexander: 1 personal fouls)   FT 1/2: GOOD   FT 2/2: GOOD Dejounte Porzingis makes 2/2 from the line.
Score: 91-63

================================================================================
                              3RD QUARTER COMPLETE                              
================================================================================

3RD QUARTER SCORE: Team_084 29, Team_010 25

BOX SCORE:
================================================================================

Team_084
--------------------------------------------------------------------------------
Player                MIN  PTS  REB  AST  TO      FG   FG%      3P   3P%
--------------------------------------------------------------------------------
Giannis Quickley       24    8    2    0   0   4/5    80.0     0/0   0.0
Luka Sexton            27    8    0    1   0   3/5    60.0     0/0   0.0
Klay Thompson          24    6    2    1   0   3/3   100.0     0/0   0.0
Dejounte Porzingis     12    4    4    1   0   2/3    66.7     0/0   0.0
Dejounte Ginobili      27    3    3    2   0   1/3    33.3     0/0   0.0
Jarrett Booker         24    0    0    4   0   0/0     0.0     0/0   0.0
Pascal Jackson         12    0    1    0   0   0/0     0.0     0/0   0.0

TEAM: FG: 13/19 (68.4%), 3PT: 3/5 (60.0%), REB: 13 (5 off, 8 def), AST: 9, TO: 2
TEAM FOULS: 8 [Team_010 in BONUS]


Team_010
--------------------------------------------------------------------------------
Player                MIN  PTS  REB  AST  TO      FG   FG%      3P   3P%
--------------------------------------------------------------------------------
Cade Morant            24    6    4    0   0   2/3    66.7     0/0   0.0
RJ Young               24    6    0    1   0   3/3   100.0     0/0   0.0
Desmond Antetokounmpo   24    5    0    0   0   2/3    66.7     0/0   0.0
Michael Turner         27    3    1    2   0   1/2    50.0     0/0   0.0
Vince Ingram           12    3    0    0   0   1/3    33.3     0/0   0.0
Anthony Durant         24    2    3    0   0   1/3    33.3     0/0   0.0
Ben Gilgeous-Alexander   12    0    1    0   0   0/0     0.0     0/0   0.0
Paolo Wade             12    0    1    0   0   0/1     0.0     0/0   0.0

TEAM: FG: 10/18 (55.6%), 3PT: 3/6 (50.0%), REB: 9 (4 off, 5 def), AST: 3, TO: 2
TEAM FOULS: 4

================================================================================

================================================================================
                       4TH QUARTER - Team_084 vs Team_010                       
================================================================================

[12:00] Team_084 possession (Score: 91-63)
Jarrett Booker attempts a Layup. Contested by Desmond Antetokounmpo (2.1 feet, MAN). Jarrett Booker misses. Rebound secured by Cade Morant.

[11:45] Team_010 possession (Score: 91-63)
Cade Morant attempts a 3Pt. Wide open! Luka Sexton is 7.9 feet away. [ZONE] Cade Morant misses. Rebound secured by Dejounte Ginobili.

[11:28] Team_084 possession (Score: 91-63)
Klay Thompson attempts a Layup. Heavily contested by RJ Young (1.7 feet, MAN)! KLAY THOMPSON MAKES IT!
Score: 93-63

[11:18] Team_010 possession (Score: 93-63)
FOUL! Reach-in foul on Giannis Quickley during the drive. [Team fouls: 1] No free throws, side out. (Giannis Quickley: 1 personal fouls)

[11:08] Team_010 possession (Score: 93-63)
Cade Morant attempts a Layup. BLOCKED BY GIANNIS QUICKLEY! Ball is loose! Rebound secured by Jarrett Booker.

[10:57] Team_084 possession (Score: 93-63)
Luka Sexton attempts a 3Pt. Contested by Cade Morant (4.9 feet, MAN). LUKA SEXTON MAKES IT! Assist: Dejounte Ginobili
Score: 96-63

[10:41] Team_010 possession (Score: 96-63)
RJ Young drives and kicks out. FOUL! Shooting foul on Luka Sexton. Michael Turner to the line for 3 free throws. [Team fouls: 2] (Luka Sexton: 1 personal fouls)   FT 1/3: GOOD   FT 2/3: GOOD   FT 3/3: GOOD Michael Turner makes 3/3 from the line.
Score: 96-66

[10:28] Team_084 possession (Score: 96-66)
Jarrett Booker drives to the basket... FOUL! Offensive foul on Jarrett Booker! Desmond Antetokounmpo drew the charge! [Team fouls: 3] (Jarrett Booker: 1 personal fouls) TURNOVER! (dead ball)

[10:11] Team_010 possession (Score: 96-66)
FOUL! Shooting foul on Jarrett Booker. Desmond Antetokounmpo to the line for 2 free throws. [Team fouls: 4] (Jarrett Booker: 2 personal fouls)   FT 1/2: GOOD   FT 2/2: GOOD Desmond Antetokounmpo makes 2/2 from the line.
Score: 96-68

[09:57] Team_084 possession (Score: 96-68)
Dejounte Ginobili throws a bad pass out of bounds! TURNOVER! (dead ball)

[09:57] Substitution (Team_084): Luka Sexton OUT → Magic Bryant IN (stamina_rule2)

[09:57] Substitution (Team_084): Dejounte Ginobili OUT → Chris Parker IN (stamina_rule2)

[09:57] Substitution (Team_010): Michael Turner OUT → Blake Harden IN (stamina_rule2)

[09:44] Team_010 possession (Score: 96-68)
Desmond Antetokounmpo attempts a Midrange. Wide open! Chris Parker is 6.7 feet away. [ZONE] Desmond Antetokounmpo misses. FOUL! Loose ball foul on Giannis Quickley during the rebound battle. [IN THE BONUS! 5 team fouls] Anthony Durant to the line for 2 free throws. (Giannis Quickley: 2 personal fouls)   FT 1/2: GOOD   FT 2/2: GOOD Anthony Durant makes 2/2 from the line.
Score: 96-70

[09:31] Team_084 possession (Score: 96-70)
FOUL! Shooting foul on Blake Harden. Chris Parker to the line for 2 free throws. [Team fouls: 1] (Blake Harden: 1 personal fouls)   FT 1/2: MISS   FT 2/2: GOOD Chris Parker makes 1/2 from the line.
Score: 97-70

[09:19] Team_010 possession (Score: 97-70)
Blake Harden drives and kicks out. Desmond Antetokounmpo attempts a 3Pt. Wide open! Jarrett Booker is 7.5 feet away. [MAN] DESMOND ANTETOKOUNMPO MAKES IT! Assist: Blake Harden
Score: 97-73

[09:06] Team_084 possession (Score: 97-73)
Magic Bryant attempts a Midrange. Wide open! Cade Morant is 8.2 feet away. [MAN] MAGIC BRYANT MAKES IT! Assist: Chris Parker
Score: 99-73

[08:50] Team_010 possession (Score: 99-73)
Blake Harden drives to the basket... Blake Harden throws a bad pass! Stolen by Giannis Quickley! TURNOVER! (live ball)

[08:37] Team_084 possession (Score: 99-73)
Chris Parker attempts a 3Pt. Contested by RJ Young (3.2 feet, ZONE). Chris Parker misses. Rebound secured by Cade Morant.

[08:26] Team_010 possession (Score: 99-73)
RJ Young attempts a 3Pt. Contested by Klay Thompson (3.2 feet, ZONE). RJ YOUNG MAKES IT! Assist: Cade Morant
Score: 99-76

[08:10] Team_084 possession (Score: 99-76)
Chris Parker attempts a 3Pt. Heavily contested by Cade Morant (1.0 feet, ZONE)! Chris Parker misses. Rebound secured by Cade Morant.

[07:55] Team_010 possession (Score: 99-76)
RJ Young attempts a Layup. Wide open! Klay Thompson is 10.0 feet away. [MAN] RJ YOUNG MAKES IT!
Score: 99-78

[07:38] Team_084 possession (Score: 99-78)
Giannis Quickley attempts a Layup. Contested by Anthony Durant (3.3 feet, MAN). GIANNIS QUICKLEY MAKES IT! Assist: Jarrett Booker
Score: 101-78

[07:25] Team_010 possession (Score: 101-78)
RJ Young drives, Klay Thompson stays with him. RJ Young attempts a Dunk. Wide open! Klay Thompson is 8.3 feet away. [MAN] RJ YOUNG MAKES IT!
Score: 101-80

[07:08] Team_084 possession (Score: 101-80)
Jarrett Booker attempts a 3Pt. Contested by Desmond Antetokounmpo (4.0 feet, MAN). JARRETT BOOKER MAKES IT! Assist: Magic Bryant
Score: 104-80

[06:52] Team_010 possession (Score: 104-80)
Cade Morant throws a bad pass! Stolen by Magic Bryant! TURNOVER! (live ball)

[06:38] Team_084 possession (Score: 104-80)
Chris Parker attempts a 3Pt. Contested by Blake Harden (3.2 feet, MAN). Chris Parker misses. Rebound secured by Blake Harden.

[06:25] Team_010 possession (Score: 104-80)
Blake Harden attempts a 3Pt. Contested by Chris Parker (2.7 feet, MAN). Blake Harden misses. Rebound secured by Jarrett Booker.

[06:09] Team_084 possession (Score: 104-80)
Klay Thompson attempts a 3Pt. Contested by Cade Morant (5.5 feet, ZONE). Klay Thompson misses. Rebound secured by Anthony Durant.

[05:50] Team_010 possession (Score: 104-80)
Desmond Antetokounmpo attempts a 3Pt. Wide open! Magic Bryant is 6.6 feet away. [ZONE] Desmond Antetokounmpo misses. Rebound secured by Klay Thompson.

[05:37] Team_084 possession (Score: 104-80)
Klay Thompson attempts a Layup. Wide open! RJ Young is 7.4 feet away. [MAN] Klay Thompson misses. Offensive rebound by Giannis Quickley! Giannis Quickley's putback is no good. Offensive rebound by Giannis Quickley! Giannis Quickley kicks it out.

[05:23] Team_084 possession (Score: 104-80)
Klay Thompson attempts a Midrange. Contested by Blake Harden (3.0 feet, ZONE). KLAY THOMPSON MAKES IT!
Score: 106-80

[05:06] Team_010 possession (Score: 106-80)
Cade Morant attempts a 3Pt. Contested by Magic Bryant (2.9 feet, MAN). Cade Morant misses. Rebound secured by Giannis Quickley.

[04:49] Team_084 possession (Score: 106-80)
Giannis Quickley drives, Anthony Durant stays with him. Giannis Quickley attempts a Dunk. Contested by Anthony Durant (5.0 feet, ZONE). Giannis Quickley misses. Rebound secured by Blake Harden.

[04:31] Team_010 possession (Score: 106-80)
Desmond Antetokounmpo attempts a Midrange. Contested by Jarrett Booker (3.3 feet, MAN). DESMOND ANTETOKOUNMPO MAKES IT! Assist: Cade Morant
Score: 106-82

[04:18] Team_084 possession (Score: 106-82)
Jarrett Booker attempts a Layup. Wide open! Desmond Antetokounmpo is 6.5 feet away. [MAN] JARRETT BOOKER MAKES IT! Assist: Chris Parker
Score: 108-82

[04:03] Team_010 possession (Score: 108-82)
Desmond Antetokounmpo attempts a Layup. Contested by Jarrett Booker (5.0 feet, MAN). DESMOND ANTETOKOUNMPO MAKES IT! Assist: Cade Morant
Score: 108-84

[03:49] Team_084 possession (Score: 108-84)
Chris Parker attempts a Midrange. Contested by Blake Harden (2.4 feet, MAN). Chris Parker misses. Rebound secured by Blake Harden.

[03:32] Team_010 possession (Score: 108-84)
Anthony Durant attempts a Midrange. Wide open! Giannis Quickley is 9.2 feet away. [MAN] Anthony Durant misses. Rebound secured by Jarrett Booker.

[03:12] Team_084 possession (Score: 108-84)
Magic Bryant attempts a 3Pt. Contested by Cade Morant (4.7 feet, MAN). Magic Bryant misses. Rebound secured by Blake Harden.

[02:56] Team_010 possession (Score: 108-84)
Anthony Durant drives, Giannis Quickley stays with him. Anthony Durant attempts a Dunk. Wide open! Giannis Quickley is 7.2 feet away. [MAN] ANTHONY DURANT MAKES IT! Assist: Cade Morant
Score: 108-86

[02:46] Team_084 possession (Score: 108-86)
FOUL! Shooting foul on Blake Harden. Chris Parker to the line for 2 free throws. [Team fouls: 2] (Blake Harden: 2 personal fouls)   FT 1/2: GOOD   FT 2/2: GOOD Chris Parker makes 2/2 from the line.
Score: 110-86

[02:31] Team_010 possession (Score: 110-86)
Cade Morant attempts a 3Pt. Contested by Magic Bryant (5.0 feet, MAN). Cade Morant misses. Rebound secured by Klay Thompson.

[02:16] Team_084 possession (Score: 110-86)
Jarrett Booker attempts a Layup. Contested by Desmond Antetokounmpo (4.5 feet, MAN). JARRETT BOOKER MAKES IT! Assist: Chris Parker
Score: 112-86

[02:00] Team_010 possession (Score: 112-86)
RJ Young attempts a Layup. BLOCKED BY KLAY THOMPSON! Ball is loose! Offensive rebound by Anthony Durant! Anthony Durant kicks it out.

[01:45] Team_010 possession (Score: 112-86)
Anthony Durant attempts a Midrange. Wide open! Chris Parker is 7.3 feet away. [ZONE] Anthony Durant misses. Rebound secured by Giannis Quickley.

[01:27] Team_084 possession (Score: 112-86)
FOUL! Shooting foul on RJ Young. Klay Thompson to the line for 3 free throws. [Team fouls: 3] (RJ Young: 1 personal fouls)   FT 1/3: MISS   FT 2/3: GOOD   FT 3/3: MISS Klay Thompson makes 1/3 from the line. Rebound secured by Blake Harden.
Score: 113-86

[01:12] Team_010 possession (Score: 113-86)
Anthony Durant drives, picks up Giannis Quickley. Help arrives from Magic Bryant! Anthony Durant attempts a Layup. Contested by Magic Bryant (4.1 feet, ZONE). Anthony Durant misses. Rebound secured by Jarrett Booker.

[00:57] Team_084 possession (Score: 113-86)
Chris Parker attempts a Midrange. Contested by Blake Harden (5.3 feet, MAN). CHRIS PARKER MAKES IT!
Score: 115-86

[00:43] Team_010 possession (Score: 115-86)
RJ Young attempts a 3Pt. Contested by Klay Thompson (5.1 feet, MAN). RJ Young misses. Rebound secured by Jarrett Booker.

[00:28] Team_084 possession (Score: 115-86)
Jarrett Booker attempts a Midrange. Wide open! RJ Young is 7.0 feet away. [ZONE] Jarrett Booker misses. Rebound secured by Cade Morant.

[00:14] Team_010 possession (Score: 115-86)
FOUL! Reach-in foul on Jarrett Booker during the drive. [IN THE BONUS! 6 team fouls] Desmond Antetokounmpo to the line for 2 free throws. (Jarrett Booker: 3 personal fouls)   FT 1/2: GOOD   FT 2/2: GOOD Desmond Antetokounmpo makes 2/2 from the line.
Score: 115-88

================================================================================
                              4TH QUARTER COMPLETE                              
================================================================================

4TH QUARTER SCORE: Team_084 24, Team_010 25

BOX SCORE:
================================================================================

Team_084
--------------------------------------------------------------------------------
Player                MIN  PTS  REB  AST  TO      FG   FG%      3P   3P%
--------------------------------------------------------------------------------
Jarrett Booker         36    7    5    1   0   3/5    60.0     0/0   0.0
Chris Parker           19    5    0    3   0   3/7    42.9     0/0   0.0
Klay Thompson          36    4    2    0   0   2/4    50.0     0/0   0.0
Luka Sexton            29    3    0    0   0   1/1   100.0     0/0   0.0
Magic Bryant           19    2    0    1   0   1/2    50.0     0/0   0.0
Giannis Quickley       36    2    3    0   0   1/2    50.0     0/0   0.0
Dejounte Ginobili      29    0    1    1   0   0/0     0.0     0/0   0.0

TEAM: FG: 11/21 (52.4%), 3PT: 2/8 (25.0%), REB: 11 (1 off, 10 def), AST: 6, TO: 2
TEAM FOULS: 6 [Team_010 in BONUS]


Team_010
--------------------------------------------------------------------------------
Player                MIN  PTS  REB  AST  TO      FG   FG%      3P   3P%
--------------------------------------------------------------------------------
Desmond Antetokounmpo   36   11    0    0   0   5/6    83.3     0/0   0.0
RJ Young               36    7    0    0   0   3/4    75.0     0/0   0.0
Anthony Durant         36    4    2    0   0   2/5    40.0     0/0   0.0
Michael Turner         29    3    0    0   0   1/1   100.0     0/0   0.0
Cade Morant            36    0    4    4   0   0/4     0.0     0/0   0.0
Blake Harden           19    0    5    1   0   0/1     0.0     0/0   0.0

TEAM: FG: 11/21 (52.4%), 3PT: 1/7 (14.3%), REB: 11 (1 off, 10 def), AST: 5, TO: 2
TEAM FOULS: 3

================================================================================

================================================================================
                               FULL GAME COMPLETE                               
================================================================================

FINAL SCORE: Team_084 115, Team_010 88

SCORING BY QUARTER:
--------------------------------------------------------------------------------
Team                     Q1     Q2     Q3     Q4    FINAL
--------------------------------------------------------------------------------
Team_084                 25     37     29     24      115
Team_010                 16     22     25     25       88
--------------------------------------------------------------------------------

FULL GAME BOX SCORE:
================================================================================

Team_084
--------------------------------------------------------------------------------
Player                MIN  PTS  REB  AST  TO      FG   FG%      3P   3P%      FT STL BLK
--------------------------------------------------------------------------------
Klay Thompson          36   19    8    3   0  10/13   76.9   0/3     0.0   2/4     0   1
Jarrett Booker         36   13    5    6   2   5/9    55.6   3/4    75.0   0/0     1   0
Giannis Quickley       36   22   16    0   2   8/12   66.7   1/1   100.0   5/6     1   1
Luka Sexton            29   13    0    3   0   5/12   41.7   3/5    60.0   0/1     0   0
Dejounte Ginobili      29    6    6    4   3   3/6    50.0   2/4    50.0   0/0     1   1
Magic Bryant           19    5    0    7   0   2/3    66.7   1/2    50.0   0/0     1   0
Chris Parker           19    9    0    3   0   3/9    33.3   0/5     0.0   4/5     0   0
Evan Quickley          12    5    2    1   0   3/5    60.0   1/1   100.0   0/0     0   0
Pascal Jackson         12    6    3    1   0   3/4    75.0   0/0     0.0   2/2     0   0
Dejounte Porzingis     12   14    8    2   0   7/8    87.5   0/1     0.0   2/2     0   0

TEAM: FG: 49/81 (60.5%), 3PT: 11/26 (42.3%), REB: 50 (11 off, 39 def), AST: 30, TO: 7


Team_010
--------------------------------------------------------------------------------
Player                MIN  PTS  REB  AST  TO      FG   FG%      3P   3P%      FT STL BLK
--------------------------------------------------------------------------------
Cade Morant            36   10   16    4   1   4/14   28.6   1/5    20.0   3/6     0   0
RJ Young               36   17    0    1   1   9/13   69.2   3/5    60.0   5/6     1   0
Desmond Antetokounmpo   36   16    1    1   2   7/10   70.0   1/3    33.3   4/4     1   0
Anthony Durant         36   14    9    0   3   5/13   38.5   0/2     0.0   2/2     1   0
Michael Turner         29    6    2    2   2   1/4    25.0   0/2     0.0   4/4     1   0
Blake Harden           19    6    7    1   0   2/5    40.0   0/2     0.0   4/4     0   0
Draymond Leonard       12    2    0    1   0   1/2    50.0   0/1     0.0   0/0     0   0
Ben Gilgeous-Alexander   12    2    4    0   0   1/1   100.0   0/0     0.0   0/0     0   0
Vince Ingram           12   10    0    0   2   4/8    50.0   1/1   100.0   2/3     0   0
Paolo Wade             12    2    4    0   0   2/5    40.0   0/1     0.0   0/0     0   0

TEAM: FG: 36/76 (47.4%), 3PT: 6/22 (27.3%), REB: 41 (11 off, 30 def), AST: 10, TO: 11

================================================================================
