================================================================================
                        FULL GAME - Team_090 vs Team_082                        
================================================================================

================================================================================
                       1ST QUARTER - Team_090 vs Team_082                       
================================================================================

[12:00] Team_090 possession (Score: 0-0)
Gary Brogdon attempts a Midrange. Contested by Jrue Green (2.9 feet, ZONE). Gary Brogdon misses. Rebound secured by Jrue Green.

[11:42] Team_082 possession (Score: 0-0)
Jrue Green attempts a 3Pt. Contested by Derrick Mitchell (3.0 feet, ZONE). JRUE GREEN MAKES IT! Assist: Dwyane O'Neal
Score: 0-3

[11:30] Team_090 possession (Score: 0-3)
Zach Wall attempts a Midrange. Contested by Dwyane O'Neal (4.4 feet, ZONE). Zach Wall misses. Rebound secured by Dwyane O'Neal.

[11:15] Team_082 possession (Score: 0-3)
Julius Carter attempts a 3Pt. Contested by Derrick Mitchell (5.8 feet, ZONE). Julius Carter misses. Rebound secured by Zach Wall.

[10:59] Team_090 possession (Score: 0-3)
Zach Wall attempts a 3Pt. Wide open! Kristaps Fox is 7.1 feet away. [MAN] Zach Wall misses. Rebound secured by Dwyane O'Neal.

[10:41] Team_082 possession (Score: 0-3)
Jrue Green attempts a Midrange. Wide open! Zach Wall is 7.6 feet away. [ZONE] Jrue Green misses. Rebound secured by Gary Brogdon.

[10:24] Team_090 possession (Score: 0-3)
Derrick Mitchell attempts a 3Pt. Heavily contested by Kristaps Fox (0.5 feet, ZONE)! Derrick Mitchell misses. Rebound secured by Julius Carter.

[10:13] Team_082 possession (Score: 0-3)
Jrue Green throws a bad pass out of bounds! TURNOVER! (dead ball)

[10:00] Team_090 possession (Score: 0-3)
Tracy Adebayo attempts a 3Pt. Wide open! Dwyane O'Neal is 7.4 feet away. [ZONE] TRACY ADEBAYO MAKES IT! Assist: Larry Bridges
Score: 3-3

[09:48] Team_082 possession (Score: 3-3)
Dwyane O'Neal drives to the basket... Dwyane O'Neal loses control! Ball rolls out of bounds! TURNOVER! (dead ball)

[09:30] Team_090 possession (Score: 3-3)
Gary Brogdon drives, picks up Jrue Green. Help arrives from Dwyane O'Neal! Gary Brogdon attempts a Layup. Contested by Dwyane O'Neal (4.9 feet, ZONE). Gary Brogdon misses. Rebound secured by Dwyane O'Neal.

[09:16] Team_082 possession (Score: 3-3)
Dwyane O'Neal attempts a 3Pt. Heavily contested by Larry Bridges (1.4 feet, MAN)! DWYANE O'NEAL MAKES IT! Assist: Jrue Green
Score: 3-6

[09:01] Team_090 possession (Score: 3-6)
Tracy Adebayo drives to the basket... Tracy Adebayo throws a bad pass out of bounds! TURNOVER! (dead ball)

[08:45] Team_082 possession (Score: 3-6)
Dwyane O'Neal attempts a 3Pt. Heavily contested by Derrick Mitchell (1.8 feet, ZONE)! Dwyane O'Neal misses. Rebound secured by Zach Wall.

[08:28] Team_090 possession (Score: 3-6)
Tracy Adebayo throws a bad pass! Stolen by Julius Carter! TURNOVER! (live ball)

[08:11] Team_082 possession (Score: 3-6)
Julius Carter attempts a Midrange. Contested by Tracy Adebayo (4.7 feet, MAN). Julius Carter misses. Rebound secured by Gary Brogdon.

[07:57] Team_090 possession (Score: 3-6)
Tracy Adebayo attempts a Layup. Contested by Julius Carter (5.2 feet, MAN). TRACY ADEBAYO MAKES IT! Assist: Zach Wall
Score: 5-6

[07:42] Team_082 possession (Score: 5-6)
Dwyane O'Neal drives, Gary Brogdon stays with him. Dwyane O'Neal attempts a Layup. Heavily contested by Gary Brogdon (0.5 feet, ZONE)! DWYANE O'NEAL MAKES IT!
Score: 5-8

[07:26] Team_090 possession (Score: 5-8)
Larry Bridges throws a bad pass! Stolen by Dwyane O'Neal! TURNOVER! (live ball)

[07:14] Team_082 possession (Score: 5-8)
Jrue Green attempts a Layup. Wide open! Gary Brogdon is 6.8 feet away. [MAN] Jrue Green misses. Rebound secured by Tracy Adebayo.

[07:03] Team_090 possession (Score: 5-8)
Zach Wall attempts a 3Pt. Contested by Dwyane O'Neal (4.9 feet, ZONE). Zach Wall misses. Rebound secured by Julius Carter.

[06:48] Team_082 possession (Score: 5-8)
Kristaps Fox attempts a Layup. Heavily contested by Gary Brogdon (0.9 feet, ZONE)! Kristaps Fox misses. Rebound secured by Tracy Adebayo.

[06:37] Team_090 possession (Score: 5-8)
Tracy Adebayo drives, picks up Jrue Green. Help arrives from Dwyane O'Neal! Tracy Adebayo attempts a Layup. Contested by Dwyane O'Neal (4.1 feet, ZONE). TRACY ADEBAYO MAKES IT! Assist: Zach Wall
Score: 7-8

[06:18] Team_082 possession (Score: 7-8)
Kristaps Fox attempts a 3Pt. Contested by Derrick Mitchell (2.9 feet, ZONE). Kristaps Fox misses. Rebound secured by Gary Brogdon.

[06:00] Team_090 possession (Score: 7-8)
Zach Wall attempts a Midrange. Contested by Kristaps Fox (2.6 feet, MAN). Zach Wall misses. Rebound secured by Jrue Green.

[05:47] Team_082 possession (Score: 7-8)
Kristaps Fox attempts a Midrange. Wide open! Zach Wall is 6.6 feet away. [ZONE] Kristaps Fox misses. Rebound secured by Tracy Adebayo.

[05:31] Team_090 possession (Score: 7-8)
Gary Brogdon drives, Jrue Green stays with him. Gary Brogdon attempts a Layup. Contested by Jrue Green (4.2 feet, MAN). GARY BROGDON MAKES IT! Assist: Derrick Mitchell
Score: 9-8

[05:15] Team_082 possession (Score: 9-8)
Julius Carter makes the Layup and draws the foul on Larry Bridges! And-1! Julius Carter to the line for 1. [Team fouls: 1] (Larry Bridges: 1 personal fouls)   FT 1/1: GOOD Julius Carter makes 1/1 from the line.
Score: 9-11

[04:58] Team_090 possession (Score: 9-11)
Tracy Adebayo attempts a Midrange. Contested by Dwyane O'Neal (4.3 feet, ZONE). Tracy Adebayo misses. Rebound secured by Jrue Green.

[04:43] Team_082 possession (Score: 9-11)
FOUL! Reach-in foul on Tracy Adebayo during the drive. [Team fouls: 2] No free throws, side out. (Tracy Adebayo: 1 personal fouls)

[04:27] Team_082 possession (Score: 9-11)
FOUL! Holding foul on Tracy Adebayo. [Team fouls: 3] No free throws, side out. (Tracy Adebayo: 2 personal fouls)

[04:12] Team_082 possession (Score: 9-11)
Julius Anthony throws a bad pass out of bounds! TURNOVER! (dead ball)

[03:54] Team_090 possession (Score: 9-11)
Larry Bridges drives, Julius Carter stays with him. Larry Bridges attempts a Layup. Contested by Julius Carter (3.8 feet, ZONE). LARRY BRIDGES MAKES IT! Assist: Gary Brogdon
Score: 11-11

[03:37] Team_082 possession (Score: 11-11)
Dwyane O'Neal attempts a Layup. BLOCKED BY LARRY BRIDGES! Ball deflects out of bounds off Dwyane O'Neal.

[03:19] Team_090 possession (Score: 11-11)
Larry Bridges drives and kicks out. Larry Bridges attempts a 3Pt. Contested by Dwyane O'Neal (4.3 feet, MAN). Larry Bridges misses. Rebound secured by Jrue Green.

[03:05] Team_082 possession (Score: 11-11)
Julius Carter attempts a Layup. Contested by Gary Brogdon (2.9 feet, ZONE). JULIUS CARTER MAKES IT! Assist: Jrue Green
Score: 11-13

[02:47] Team_090 possession (Score: 11-13)
Tracy Adebayo attempts a Midrange. Contested by Julius Carter (4.9 feet, MAN). Tracy Adebayo misses. Offensive rebound by Zach Wall! Zach Wall kicks it out.

[02:37] Team_090 possession (Score: 11-13)
Derrick Mitchell drives and kicks out. Gary Brogdon attempts a 3Pt. Contested by Dwyane O'Neal (3.4 feet, ZONE). GARY BROGDON MAKES IT! Assist: Zach Wall
Score: 14-13

[02:27] Team_082 possession (Score: 14-13)
Kristaps Fox attempts a Layup. Heavily contested by Zach Wall (0.5 feet, MAN)! KRISTAPS FOX MAKES IT! Assist: Jrue Green
Score: 14-15

[02:11] Team_090 possession (Score: 14-15)
Zach Wall attempts a 3Pt. Contested by Kristaps Fox (3.5 feet, MAN). ZACH WALL MAKES IT! Assist: Tracy Adebayo
Score: 17-15

[01:52] Team_082 possession (Score: 17-15)
Kristaps Fox attempts a 3Pt. Wide open! Derrick Mitchell is 7.0 feet away. [ZONE] Kristaps Fox misses. Rebound secured by Tracy Adebayo.

[01:39] Team_090 possession (Score: 17-15)
Gary Brogdon attempts a Midrange. Contested by Jrue Green (4.7 feet, ZONE). Gary Brogdon misses. Rebound secured by Dwyane O'Neal.

[01:28] Team_082 possession (Score: 17-15)
FOUL! Reach-in foul on Gary Brogdon during the drive. [Team fouls: 4] No free throws, side out. (Gary Brogdon: 1 personal fouls)

[01:13] Team_082 possession (Score: 17-15)
FOUL! Shooting foul on Larry Bridges. Dwyane O'Neal to the line for 3 free throws. [BONUS: 5 team fouls] (Larry Bridges: 2 personal fouls)   FT 1/3: GOOD   FT 2/3: MISS   FT 3/3: GOOD Dwyane O'Neal makes 2/3 from the line.
Score: 17-17

[00:59] Team_090 possession (Score: 17-17)
Tracy Adebayo attempts a Midrange. Contested by Kristaps Fox (3.7 feet, ZONE). TRACY ADEBAYO MAKES IT! Assist: Zach Wall
Score: 19-17

[00:41] Team_082 possession (Score: 19-17)
FOUL! Reach-in foul on Gary Brogdon during the drive. [IN THE BONUS! 6 team fouls] Kristaps Fox to the line for 2 free throws. (Gary Brogdon: 2 personal fouls)   FT 1/2: MISS   FT 2/2: GOOD Kristaps Fox makes 1/2 from the line.
Score: 19-18

[00:27] Team_090 possession (Score: 19-18)
Gary Brogdon attempts a 3Pt. Contested by Dwyane O'Neal (4.7 feet, ZONE). GARY BROGDON MAKES IT! Assist: Larry Bridges
Score: 22-18

[00:14] Team_082 possession (Score: 22-18)
Julius Carter drives, Gary Brogdon stays with him. Julius Carter attempts a Dunk. Contested by Gary Brogdon (3.3 feet, ZONE). Julius Carter misses. Rebound secured by Tracy Adebayo.

================================================================================
                              1ST QUARTER COMPLETE                              
================================================================================

1ST QUARTER SCORE: Team_090 22, Team_082 18

BOX SCORE:
================================================================================

Team_090
--------------------------------------------------------------------------------
Player                MIN  PTS  REB  AST  TO      FG   FG%      3P   3P%
--------------------------------------------------------------------------------
Tracy Adebayo          12    9    5    1   0   4/5    80.0     0/0   0.0
Gary Brogdon           12    8    3    1   0   3/6    50.0     0/0   0.0
Zach Wall              12    3    3    4   0   1/5    20.0     0/0   0.0
Larry Bridges          12    2    0    2   0   1/2    50.0     0/0   0.0
Derrick Mitchell       12    0    0    1   0   0/1     0.0     0/0   0.0

TEAM: FG: 9/19 (47.4%), 3PT: 3/6 (50.0%), REB: 11 (1 off, 10 def), AST: 9, TO: 3
TEAM FOULS: 6 [Team_082 in BONUS]


Team_082
--------------------------------------------------------------------------------
Player                MIN  PTS  REB  AST  TO      FG   FG%      3P   3P%
--------------------------------------------------------------------------------
Dwyane O'Neal          12    7    4    1   0   3/5    60.0     0/0   0.0
Julius Carter          12    5    2    0   0   2/5    40.0     0/0   0.0
Jrue Green             12    3    4    3   0   1/3    33.3     0/0   0.0
Kristaps Fox           12    3    0    0   0   2/6    33.3     0/0   0.0

TEAM: FG: 8/19 (42.1%), 3PT: 3/7 (42.9%), REB: 10 (0 off, 10 def), AST: 4, TO: 3
TEAM FOULS: 0

================================================================================

================================================================================
                       2ND QUARTER - Team_090 vs Team_082                       
================================================================================

[12:00] Team_090 possession (Score: 22-18)
Derrick Mitchell attempts a 3Pt. Heavily contested by Dwyane O'Neal (1.8 feet, ZONE)! Derrick Mitchell misses. Rebound secured by Jrue Green.

[11:49] Team_082 possession (Score: 22-18)
Jrue Green attempts a Midrange. Contested by Larry Bridges (3.6 feet, ZONE). JRUE GREEN MAKES IT! Assist: Julius Anthony
Score: 22-20

[11:34] Team_090 possession (Score: 22-20)
Derrick Mitchell attempts a 3Pt. Wide open! Julius Anthony is 7.3 feet away. [MAN] DERRICK MITCHELL MAKES IT! Assist: Zach Wall
Score: 25-20

[11:16] Team_082 possession (Score: 25-20)
Jrue Green attempts a 3Pt. Contested by Gary Brogdon (4.8 feet, MAN). Jrue Green misses. Rebound secured by Tracy Adebayo.

[11:02] Team_090 possession (Score: 25-20)
Zach Wall attempts a Midrange. Contested by Kristaps Fox (5.5 feet, MAN). Zach Wall misses. Rebound secured by Jrue Green.

[10:47] Team_082 possession (Score: 25-20)
Kristaps Fox attempts a 3Pt. Contested by Derrick Mitchell (2.6 feet, ZONE). Kristaps Fox misses. Rebound secured by Zach Wall.

[10:33] Team_090 possession (Score: 25-20)
FOUL! Holding foul on Dwyane O'Neal. [Team fouls: 1] No free throws, side out. (Dwyane O'Neal: 1 personal fouls)

[10:14] Team_090 possession (Score: 25-20)
Gary Brogdon makes the Midrange and draws the foul on Jrue Green! And-1! Gary Brogdon to the line for 1. [Team fouls: 2] (Jrue Green: 1 personal fouls)   FT 1/1: GOOD Gary Brogdon makes 1/1 from the line.
Score: 28-20

[10:00] Team_082 possession (Score: 28-20)
Kristaps Fox loses the ball! Stripped by Zach Wall! TURNOVER! (live ball)

[09:47] Team_090 possession (Score: 28-20)
Zach Wall attempts a 3Pt. Contested by Dwyane O'Neal (2.7 feet, ZONE). ZACH WALL MAKES IT! Assist: Derrick Mitchell
Score: 31-20

[09:31] Team_082 possession (Score: 31-20)
Jrue Green drives, picks up Gary Brogdon. Help arrives from Larry Bridges! Jrue Green attempts a Dunk. Wide open! Larry Bridges is 7.1 feet away. [ZONE] JRUE GREEN MAKES IT! Assist: Kristaps Fox
Score: 31-22

[09:18] Team_090 possession (Score: 31-22)
Gary Brogdon attempts a Midrange. Contested by Jrue Green (5.1 feet, ZONE). Gary Brogdon misses. Rebound secured by Jrue Green.

[09:00] Team_082 possession (Score: 31-22)
Dwyane O'Neal attempts a 3Pt. Contested by Derrick Mitchell (5.3 feet, ZONE). Dwyane O'Neal misses. Rebound secured by Tracy Adebayo.

[08:47] Team_090 possession (Score: 31-22)
Gary Brogdon drives, picks up Jrue Green. Help arrives from Dwyane O'Neal! Gary Brogdon attempts a Layup. Wide open! Dwyane O'Neal is 7.8 feet away. [MAN] GARY BROGDON MAKES IT!
Score: 33-22

[08:32] Team_082 possession (Score: 33-22)
Julius Carter attempts a 3Pt. Wide open! Derrick Mitchell is 6.4 feet away. [ZONE] Julius Carter misses. Rebound secured by Zach Wall.

[08:14] Team_090 possession (Score: 33-22)
Larry Bridges drives to the basket... Larry Bridges throws a bad pass! Stolen by Dwyane O'Neal! TURNOVER! (live ball)

[08:01] Team_082 possession (Score: 33-22)
Kristaps Fox attempts a 3Pt. Contested by Derrick Mitchell (3.0 feet, ZONE). Kristaps Fox misses. Rebound secured by Gary Brogdon.

[07:47] Team_090 possession (Score: 33-22)
Gary Brogdon drives, picks up Jrue Green. Help arrives from Dwyane O'Neal! Gary Brogdon attempts a Dunk. Wide open! Dwyane O'Neal is 8.7 feet away. [ZONE] GARY BROGDON MAKES IT!
Score: 35-22

[07:31] Team_082 possession (Score: 35-22)
Julius Anthony attempts a 3Pt. Contested by Derrick Mitchell (4.8 feet, MAN). Julius Anthony misses. Rebound secured by Tracy Adebayo.

[07:20] Team_090 possession (Score: 35-22)
Derrick Mitchell drives, Julius Anthony stays with him. Derrick Mitchell attempts a Layup. Wide open! Julius Anthony is 9.2 feet away. [MAN] Derrick Mitchell misses. Offensive rebound by Tracy Adebayo! Tracy Adebayo kicks it out.

[07:05] Team_090 possession (Score: 35-22)
Derrick Mitchell attempts a Midrange. Contested by Julius Anthony (4.2 feet, MAN). Derrick Mitchell misses. Rebound secured by Dwyane O'Neal.

[06:52] Team_082 possession (Score: 35-22)
FOUL! Reach-in foul on Gary Brogdon during the drive. [Team fouls: 1] No free throws, side out. (Gary Brogdon: 1 personal fouls)

[06:33] Team_082 possession (Score: 35-22)
Kristaps Fox drives and kicks out. Dwyane O'Neal attempts a 3Pt. Wide open! Larry Bridges is 7.7 feet away. [MAN] Dwyane O'Neal misses. Rebound secured by Tracy Adebayo.

[06:16] Team_090 possession (Score: 35-22)
Gary Brogdon drives and kicks out. Tracy Adebayo attempts a 3Pt. Contested by Dwyane O'Neal (5.4 feet, ZONE). Tracy Adebayo misses. Rebound secured by Dwyane O'Neal.

[05:58] Team_082 possession (Score: 35-22)
Jrue Green drives to the basket... Jrue Green loses control! Ball rolls out of bounds! TURNOVER! (dead ball)

[05:58] Substitution (Team_090): Derrick Mitchell OUT → OG Anunoby IN (stamina_rule2)

[05:58] Substitution (Team_090): Larry Bridges OUT → Josh Wall IN (stamina_rule2)

[05:58] Substitution (Team_090): Zach Wall OUT → Russell Smith IN (stamina_rule2)

[05:58] Substitution (Team_090): Gary Brogdon OUT → Derrick Nowitzki IN (stamina_rule2)

[05:58] Substitution (Team_090): Tracy Adebayo OUT → Tobias Tatum IN (stamina_rule2)

[05:58] Substitution (Team_082): Julius Anthony OUT → Jordan Rozier IN (stamina_rule2)

[05:58] Substitution (Team_082): Dwyane O'Neal OUT → Kawhi Poole IN (stamina_rule2)

[05:58] Substitution (Team_082): Kristaps Fox OUT → Shaquille Griffin IN (stamina_rule2)

[05:58] Substitution (Team_082): Jrue Green OUT → Tony Jokic IN (stamina_rule2)

[05:58] Substitution (Team_082): Julius Carter OUT → D'Angelo Parker IN (stamina_rule2)

[05:45] Team_090 possession (Score: 35-22)
FOUL! Reach-in foul on D'Angelo Parker during the drive. [Team fouls: 3] No free throws, side out. (D'Angelo Parker: 1 personal fouls)

[05:32] Team_090 possession (Score: 35-22)
OG Anunoby attempts a 3Pt. Wide open! Kawhi Poole is 8.8 feet away. [ZONE] OG Anunoby misses. Rebound secured by Tony Jokic.

[05:13] Team_082 possession (Score: 35-22)
Jordan Rozier attempts a Midrange. Wide open! Tobias Tatum is 6.2 feet away. [ZONE] Jordan Rozier misses. Rebound secured by Tobias Tatum.

[04:57] Team_090 possession (Score: 35-22)
FOUL! Shooting foul on D'Angelo Parker. Tobias Tatum to the line for 2 free throws. [Team fouls: 4] (D'Angelo Parker: 2 personal fouls)   FT 1/2: GOOD   FT 2/2: GOOD Tobias Tatum makes 2/2 from the line.
Score: 37-22

[04:42] Team_082 possession (Score: 37-22)
FOUL! Shooting foul on Tobias Tatum. Shaquille Griffin to the line for 2 free throws. [Team fouls: 2] (Tobias Tatum: 1 personal fouls)   FT 1/2: GOOD   FT 2/2: MISS Shaquille Griffin makes 1/2 from the line. Rebound secured by Russell Smith.
Score: 37-23

[04:25] Team_090 possession (Score: 37-23)
OG Anunoby attempts a 3Pt. Contested by Jordan Rozier (5.3 feet, MAN). OG ANUNOBY MAKES IT! Assist: Tobias Tatum
Score: 40-23

[04:13] Team_082 possession (Score: 40-23)
D'Angelo Parker attempts a Layup. Contested by Tobias Tatum (5.3 feet, MAN). D'Angelo Parker misses. Rebound secured by Tobias Tatum.

[03:56] Team_090 possession (Score: 40-23)
Russell Smith attempts a 3Pt. Contested by Shaquille Griffin (4.8 feet, MAN). Russell Smith misses. Rebound secured by Shaquille Griffin.

[03:39] Team_082 possession (Score: 40-23)
Jordan Rozier attempts a 3Pt. Contested by Russell Smith (5.5 feet, ZONE). JORDAN ROZIER MAKES IT! Assist: Shaquille Griffin
Score: 40-26

[03:25] Team_090 possession (Score: 40-26)
Tobias Tatum attempts a 3Pt. Contested by Kawhi Poole (5.4 feet, ZONE). TOBIAS TATUM MAKES IT! Assist: Josh Wall
Score: 43-26

[03:07] Team_082 possession (Score: 43-26)
Jordan Rozier attempts a 3Pt. Contested by OG Anunoby (4.4 feet, MAN). JORDAN ROZIER MAKES IT! Assist: D'Angelo Parker
Score: 43-29

[02:57] Team_090 possession (Score: 43-29)
Josh Wall drives to the basket... Josh Wall loses the ball! Stripped by D'Angelo Parker! TURNOVER! (live ball)

[02:40] Team_082 possession (Score: 43-29)
Shaquille Griffin attempts a Midrange. Contested by Russell Smith (4.3 feet, MAN). Shaquille Griffin misses. Rebound secured by Tobias Tatum.

[02:22] Team_090 possession (Score: 43-29)
Josh Wall throws a bad pass! Stolen by Kawhi Poole! TURNOVER! (live ball)

[02:04] Team_082 possession (Score: 43-29)
Shaquille Griffin attempts a 3Pt. Heavily contested by Russell Smith (1.3 feet, MAN)! Shaquille Griffin misses. Rebound secured by Derrick Nowitzki.

[01:53] Team_090 possession (Score: 43-29)
Josh Wall attempts a 3Pt. Contested by Kawhi Poole (2.9 feet, MAN). JOSH WALL MAKES IT! Assist: Derrick Nowitzki
Score: 46-29

[01:36] Team_082 possession (Score: 46-29)
D'Angelo Parker attempts a Midrange. Contested by Tobias Tatum (3.8 feet, MAN). D'Angelo Parker misses. Offensive rebound by Shaquille Griffin! Shaquille Griffin kicks it out.

[01:25] Team_082 possession (Score: 46-29)
D'Angelo Parker drives to the basket... D'Angelo Parker loses control! Ball rolls out of bounds! TURNOVER! (dead ball)

[01:09] Team_090 possession (Score: 46-29)
OG Anunoby attempts a Midrange. Wide open! Jordan Rozier is 6.8 feet away. [MAN] OG ANUNOBY MAKES IT! Assist: Josh Wall
Score: 48-29

[00:49] Team_082 possession (Score: 48-29)
D'Angelo Parker attempts a Layup. BLOCKED BY TOBIAS TATUM! Ball is loose! Rebound secured by Russell Smith.

[00:38] Team_090 possession (Score: 48-29)
Tobias Tatum drives, D'Angelo Parker stays with him. Tobias Tatum attempts a Dunk. Wide open! D'Angelo Parker is 9.1 feet away. [MAN] TOBIAS TATUM MAKES IT!
Score: 50-29

[00:24] Team_082 possession (Score: 50-29)
D'Angelo Parker attempts a 3Pt. Contested by Tobias Tatum (4.8 feet, MAN). D'Angelo Parker misses. Offensive rebound by Shaquille Griffin! Shaquille Griffin kicks it out.

[00:11] Team_082 possession (Score: 50-29)
Jordan Rozier attempts a Midrange. Wide open! OG Anunoby is 7.2 feet away. [MAN] JORDAN ROZIER MAKES IT! Assist: Shaquille Griffin
Score: 50-31

================================================================================
                              2ND QUARTER COMPLETE                              
================================================================================

2ND QUARTER SCORE: Team_090 28, Team_082 13

BOX SCORE:
================================================================================

Team_090
--------------------------------------------------------------------------------
Player                MIN  PTS  REB  AST  TO      FG   FG%      3P   3P%
--------------------------------------------------------------------------------
Gary Brogdon           18    7    1    0   0   3/5    60.0     0/0   0.0
Tobias Tatum            6    7    3    1   0   3/3   100.0     0/0   0.0
OG Anunoby              6    5    0    0   0   2/3    66.7     0/0   0.0
Derrick Mitchell       18    3    0    1   0   1/3    33.3     0/0   0.0
Zach Wall              18    3    2    1   0   1/2    50.0     0/0   0.0
Josh Wall               6    3    0    2   0   1/1   100.0     0/0   0.0
Tracy Adebayo          18    0    5    0   0   0/0     0.0     0/0   0.0
Russell Smith           6    0    2    0   0   0/1     0.0     0/0   0.0
Derrick Nowitzki        6    0    1    1   0   0/0     0.0     0/0   0.0

TEAM: FG: 11/18 (61.1%), 3PT: 5/8 (62.5%), REB: 14 (1 off, 13 def), AST: 6, TO: 3
TEAM FOULS: 2


Team_082
--------------------------------------------------------------------------------
Player                MIN  PTS  REB  AST  TO      FG   FG%      3P   3P%
--------------------------------------------------------------------------------
Jordan Rozier           6    8    0    0   0   3/4    75.0     0/0   0.0
Jrue Green             18    4    3    0   0   2/3    66.7     0/0   0.0
Julius Anthony         18    0    0    1   0   0/1     0.0     0/0   0.0
Kristaps Fox           18    0    0    1   0   0/3     0.0     0/0   0.0
Dwyane O'Neal          18    0    2    0   0   0/1     0.0     0/0   0.0
Julius Carter          18    0    0    0   0   0/1     0.0     0/0   0.0
Tony Jokic              6    0    1    0   0   0/0     0.0     0/0   0.0
Shaquille Griffin       6    0    3    2   0   0/3     0.0     0/0   0.0
D'Angelo Parker         6    0    0    1   0   0/2     0.0     0/0   0.0

TEAM: FG: 5/18 (27.8%), 3PT: 2/9 (22.2%), REB: 9 (2 off, 7 def), AST: 5, TO: 3
TEAM FOULS: 4

================================================================================

================================================================================
                       3RD QUARTER - Team_090 vs Team_082                       
================================================================================

[12:00] Team_090 possession (Score: 50-31)
Zach Wall drives and kicks out. FOUL! Shooting foul on Kristaps Fox. Zach Wall to the line for 2 free throws. [Team fouls: 1] (Kristaps Fox: 1 personal fouls)   FT 1/2: GOOD   FT 2/2: GOOD Zach Wall makes 2/2 from the line.
Score: 52-31

[11:46] Team_082 possession (Score: 52-31)
Julius Anthony drives to the basket... Julius Anthony throws a bad pass out of bounds! TURNOVER! (dead ball)

[11:33] Team_090 possession (Score: 52-31)
Derrick Mitchell drives, picks up Julius Anthony. Help arrives from Dwyane O'Neal! Derrick Mitchell attempts a Dunk. Wide open! Dwyane O'Neal is 9.1 feet away. [MAN] DERRICK MITCHELL MAKES IT! Assist: Gary Brogdon
Score: 54-31

[11:17] Team_082 possession (Score: 54-31)
Kristaps Fox attempts a Layup. Contested by Gary Brogdon (5.6 feet, ZONE). KRISTAPS FOX MAKES IT! Assist: Dwyane O'Neal
Score: 54-33

[11:01] Team_090 possession (Score: 54-33)
FOUL! Offensive foul on Larry Bridges! Dwyane O'Neal drew the charge! [Team fouls: 1] (Larry Bridges: 1 personal fouls) TURNOVER! (dead ball)

[10:48] Team_082 possession (Score: 54-33)
Dwyane O'Neal attempts a 3Pt. Wide open! Derrick Mitchell is 6.2 feet away. [ZONE] Dwyane O'Neal misses. Offensive rebound by Jrue Green! Jrue Green kicks it out.

[10:35] Team_082 possession (Score: 54-33)
Julius Anthony attempts a 3Pt. Contested by Derrick Mitchell (4.2 feet, MAN). JULIUS ANTHONY MAKES IT! Assist: Dwyane O'Neal
Score: 54-36

[10:20] Team_090 possession (Score: 54-36)
Derrick Mitchell attempts a Midrange. Contested by Julius Anthony (6.0 feet, MAN). Derrick Mitchell misses. Rebound secured by Jrue Green.

[10:07] Team_082 possession (Score: 54-36)
Julius Anthony attempts a 3Pt. Wide open! Derrick Mitchell is 6.2 feet away. [MAN] JULIUS ANTHONY MAKES IT! Assist: Dwyane O'Neal
Score: 54-39

[09:51] Team_090 possession (Score: 54-39)
Tracy Adebayo attempts a Midrange. Contested by Julius Carter (5.5 feet, MAN). Tracy Adebayo misses. Offensive rebound by Tracy Adebayo! Tracy Adebayo kicks it out.

[09:36] Team_090 possession (Score: 54-39)
Larry Bridges attempts a Midrange. Contested by Kristaps Fox (5.2 feet, ZONE). Larry Bridges misses. Rebound secured by Dwyane O'Neal.

[09:19] Team_082 possession (Score: 54-39)
Julius Anthony drives, picks up Gary Brogdon. Help arrives from Larry Bridges! Julius Anthony attempts a Dunk. Contested by Larry Bridges (4.8 feet, ZONE). Julius Anthony misses. Offensive rebound by Julius Carter! Julius Carter kicks it out.

[09:04] Team_082 possession (Score: 54-39)
Jrue Green attempts a Midrange. Heavily contested by Gary Brogdon (0.5 feet, MAN)! Jrue Green misses. Offensive rebound by Jrue Green! Jrue Green kicks it out.

[08:51] Team_082 possession (Score: 54-39)
Julius Anthony attempts a Layup. Contested by Gary Brogdon (4.6 feet, ZONE). JULIUS ANTHONY MAKES IT! Assist: Dwyane O'Neal
Score: 54-41

[08:37] Team_090 possession (Score: 54-41)
FOUL! Reach-in foul on Kristaps Fox during the drive. [Team fouls: 2] No free throws, side out. (Kristaps Fox: 2 personal fouls)

[08:23] Team_090 possession (Score: 54-41)
Zach Wall attempts a 3Pt. Contested by Kristaps Fox (3.1 feet, MAN). Zach Wall misses. Rebound secured by Jrue Green.

[08:06] Team_082 possession (Score: 54-41)
Kristaps Fox throws a bad pass out of bounds! TURNOVER! (dead ball)

[07:48] Team_090 possession (Score: 54-41)
Tracy Adebayo makes the Layup and draws the foul on Dwyane O'Neal! And-1! Tracy Adebayo to the line for 1. [Team fouls: 3] (Dwyane O'Neal: 1 personal fouls)   FT 1/1: MISS Tracy Adebayo makes 0/1 from the line. Rebound secured by Jrue Green.
Score: 56-41

[07:32] Team_082 possession (Score: 56-41)
Julius Anthony attempts a Layup. BLOCKED BY DERRICK MITCHELL! Ball is loose! Rebound secured by Tracy Adebayo.

[07:20] Team_090 possession (Score: 56-41)
Larry Bridges drives, Jrue Green stays with him. Larry Bridges attempts a Layup. Contested by Jrue Green (5.9 feet, ZONE). LARRY BRIDGES MAKES IT! Assist: Zach Wall
Score: 58-41

[07:05] Team_082 possession (Score: 58-41)
Dwyane O'Neal drives, Gary Brogdon stays with him. Dwyane O'Neal attempts a Dunk. Contested by Gary Brogdon (4.5 feet, ZONE). DWYANE O'NEAL MAKES IT! Assist: Kristaps Fox
Score: 58-43

[06:55] Team_090 possession (Score: 58-43)
FOUL! Reach-in foul on Dwyane O'Neal during the drive. [Team fouls: 4] No free throws, side out. (Dwyane O'Neal: 2 personal fouls)

[06:38] Team_090 possession (Score: 58-43)
Zach Wall drives and kicks out. Derrick Mitchell attempts a Midrange. Contested by Jrue Green (4.2 feet, ZONE). DERRICK MITCHELL MAKES IT!
Score: 60-43

[06:19] Team_082 possession (Score: 60-43)
Julius Anthony throws a bad pass! Stolen by Derrick Mitchell! TURNOVER! (live ball)

[06:05] Team_090 possession (Score: 60-43)
Derrick Mitchell attempts a Layup. Heavily contested by Julius Anthony (1.8 feet, MAN)! Derrick Mitchell misses. Offensive rebound by Gary Brogdon! Gary Brogdon kicks it out.

[05:49] Team_090 possession (Score: 60-43)
Zach Wall attempts a 3Pt. Contested by Kristaps Fox (5.8 feet, MAN). ZACH WALL MAKES IT! Assist: Derrick Mitchell
Score: 63-43

[05:36] Team_082 possession (Score: 63-43)
Julius Carter drives to the basket... Julius Carter loses the ball! Stripped by Gary Brogdon! TURNOVER! (live ball)

[05:21] Team_090 possession (Score: 63-43)
Gary Brogdon attempts a 3Pt. Contested by Dwyane O'Neal (3.1 feet, ZONE). Gary Brogdon misses. Rebound secured by Jrue Green.

[05:07] Team_082 possession (Score: 63-43)
Kristaps Fox attempts a Midrange. Contested by Zach Wall (4.3 feet, MAN). KRISTAPS FOX MAKES IT!
Score: 63-45

[04:54] Team_090 possession (Score: 63-45)
Tracy Adebayo attempts a Midrange. Wide open! Jrue Green is 7.2 feet away. [ZONE] TRACY ADEBAYO MAKES IT! Assist: Larry Bridges
Score: 65-45

[04:39] Team_082 possession (Score: 65-45)
Kristaps Fox drives to the basket... FOUL! Offensive foul on Kristaps Fox! Gary Brogdon drew the charge! [Team fouls: 5] (Kristaps Fox: 3 personal fouls) TURNOVER! (dead ball)

[04:27] Team_090 possession (Score: 65-45)
Derrick Mitchell makes the Dunk and draws the foul on Dwyane O'Neal! And-1! Derrick Mitchell to the line for 1. [BONUS: 6 team fouls] (Dwyane O'Neal: 3 personal fouls)   FT 1/1: GOOD Derrick Mitchell makes 1/1 from the line.
Score: 68-45

[04:10] Team_082 possession (Score: 68-45)
Julius Anthony attempts a Midrange. Wide open! Gary Brogdon is 6.1 feet away. [ZONE] JULIUS ANTHONY MAKES IT!
Score: 68-47

[03:55] Team_090 possession (Score: 68-47)
FOUL! Shooting foul on Dwyane O'Neal. Larry Bridges to the line for 3 free throws. [BONUS: 7 team fouls] (Dwyane O'Neal: 4 personal fouls)   FT 1/3: GOOD   FT 2/3: MISS   FT 3/3: GOOD Larry Bridges makes 2/3 from the line.
Score: 70-47

[03:40] Team_082 possession (Score: 70-47)
Jrue Green attempts a 3Pt. Contested by Zach Wall (5.8 feet, ZONE). JRUE GREEN MAKES IT! Assist: Dwyane O'Neal
Score: 70-50

[03:27] Team_090 possession (Score: 70-50)
Gary Brogdon drives and kicks out. Derrick Mitchell attempts a Midrange. Contested by Julius Anthony (4.1 feet, MAN). Derrick Mitchell misses. Offensive rebound by Tracy Adebayo! Tracy Adebayo kicks it out.

[03:15] Team_090 possession (Score: 70-50)
Gary Brogdon drives, Jrue Green stays with him. Gary Brogdon attempts a Layup. Wide open! Jrue Green is 7.2 feet away. [MAN] GARY BROGDON MAKES IT! Assist: Zach Wall
Score: 72-50

[02:56] Team_082 possession (Score: 72-50)
Dwyane O'Neal attempts a 3Pt. Contested by Larry Bridges (4.4 feet, MAN). DWYANE O'NEAL MAKES IT! Assist: Jrue Green
Score: 72-53

[02:40] Team_090 possession (Score: 72-53)
Tracy Adebayo attempts a 3Pt. Wide open! Julius Carter is 7.5 feet away. [MAN] TRACY ADEBAYO MAKES IT! Assist: Derrick Mitchell
Score: 75-53

[02:29] Team_082 possession (Score: 75-53)
Julius Carter attempts a Layup. Wide open! Tracy Adebayo is 8.6 feet away. [MAN] Julius Carter misses. Rebound secured by Zach Wall.

[02:16] Team_090 possession (Score: 75-53)
Larry Bridges attempts a 3Pt. Contested by Dwyane O'Neal (5.8 feet, ZONE). Larry Bridges misses. Rebound secured by Dwyane O'Neal.

[02:03] Team_082 possession (Score: 75-53)
FOUL! Shooting foul on Gary Brogdon. Dwyane O'Neal to the line for 2 free throws. [Team fouls: 2] (Gary Brogdon: 1 personal fouls)   FT 1/2: GOOD   FT 2/2: GOOD Dwyane O'Neal makes 2/2 from the line.
Score: 75-55

[01:50] Team_090 possession (Score: 75-55)
Tracy Adebayo drives to the basket... Tracy Adebayo commits a violation (traveling/carry)! TURNOVER! (dead ball)

[01:50] Substitution (Team_090): Larry Bridges OUT → Josh Wall IN (stamina_rule2)

[01:50] Substitution (Team_090): Gary Brogdon OUT → Derrick Nowitzki IN (stamina_rule2)

[01:50] Substitution (Team_090): Tracy Adebayo OUT → Tobias Tatum IN (stamina_rule2)

[01:50] Substitution (Team_082): Julius Anthony OUT → Jordan Rozier IN (stamina_rule2)

[01:50] Substitution (Team_082): Dwyane O'Neal OUT → Kawhi Poole IN (stamina_rule2)

[01:50] Substitution (Team_082): Kristaps Fox OUT → Shaquille Griffin IN (stamina_rule2)

[01:50] Substitution (Team_082): Jrue Green OUT → Tony Jokic IN (stamina_rule2)

[01:50] Substitution (Team_082): Julius Carter OUT → D'Angelo Parker IN (stamina_rule2)

[01:39] Team_082 possession (Score: 75-55)
D'Angelo Parker makes the Dunk and draws the foul on Josh Wall! And-1! D'Angelo Parker to the line for 1. [Team fouls: 3] (Josh Wall: 1 personal fouls)   FT 1/1: GOOD D'Angelo Parker makes 1/1 from the line.
Score: 75-58

[01:28] Team_090 possession (Score: 75-58)
Zach Wall makes the Layup and draws the foul on Tony Jokic! And-1! Zach Wall to the line for 1. [BONUS: 8 team fouls] (Tony Jokic: 1 personal fouls)   FT 1/1: GOOD Zach Wall makes 1/1 from the line.
Score: 78-58

[01:14] Team_082 possession (Score: 78-58)
FOUL! Offensive foul on Shaquille Griffin! Zach Wall drew the charge! [Team fouls: 9] (Shaquille Griffin: 1 personal fouls) TURNOVER! (dead ball)

[01:00] Team_090 possession (Score: 78-58)
Derrick Mitchell attempts a 3Pt. Wide open! Jordan Rozier is 6.0 feet away. [MAN] Derrick Mitchell misses. Rebound secured by Shaquille Griffin.

[00:46] Team_082 possession (Score: 78-58)
Kawhi Poole attempts a 3Pt. Heavily contested by Josh Wall (0.9 feet, MAN)! Kawhi Poole misses. Rebound secured by Tobias Tatum.

[00:28] Team_090 possession (Score: 78-58)
FOUL! Reach-in foul on D'Angelo Parker during the drive. [IN THE BONUS! 10 team fouls] Tobias Tatum to the line for 2 free throws. (D'Angelo Parker: 1 personal fouls)   FT 1/2: GOOD   FT 2/2: GOOD Tobias Tatum makes 2/2 from the line.
Score: 80-58

[00:10] Team_082 possession (Score: 80-58)
Shaquille Griffin attempts a 3Pt. Contested by Zach Wall (3.8 feet, MAN). Shaquille Griffin misses. Rebound secured by Derrick Nowitzki.

================================================================================
                              3RD QUARTER COMPLETE                              
================================================================================

3RD QUARTER SCORE: Team_090 30, Team_082 27

BOX SCORE:
================================================================================

Team_090
--------------------------------------------------------------------------------
Player                MIN  PTS  REB  AST  TO      FG   FG%      3P   3P%
--------------------------------------------------------------------------------
Zach Wall              30    8    1    2   0   3/4    75.0     0/0   0.0
Derrick Mitchell       30    7    0    2   0   3/5    60.0     0/0   0.0
Tracy Adebayo          29    5    3    0   0   2/3    66.7     0/0   0.0
Larry Bridges          29    4    0    1   0   2/4    50.0     0/0   0.0
Gary Brogdon           29    2    1    1   0   1/2    50.0     0/0   0.0
Tobias Tatum            8    2    1    0   0   1/1   100.0     0/0   0.0
Derrick Nowitzki        8    0    1    0   0   0/0     0.0     0/0   0.0

TEAM: FG: 12/19 (63.2%), 3PT: 3/7 (42.9%), REB: 7 (3 off, 4 def), AST: 6, TO: 2
TEAM FOULS: 3


Team_082
--------------------------------------------------------------------------------
Player                MIN  PTS  REB  AST  TO      FG   FG%      3P   3P%
--------------------------------------------------------------------------------
Julius Anthony         29   10    0    0   0   4/5    80.0     0/0   0.0
Dwyane O'Neal          29    7    2    5   0   3/3   100.0     0/0   0.0
Kristaps Fox           29    4    0    1   0   2/2   100.0     0/0   0.0
Jrue Green             29    3    6    1   0   1/1   100.0     0/0   0.0
D'Angelo Parker         8    3    0    0   0   1/1   100.0     0/0   0.0
Julius Carter          29    0    1    0   0   0/1     0.0     0/0   0.0
Shaquille Griffin       8    0    1    0   0   0/1     0.0     0/0   0.0
Kawhi Poole             8    0    0    0   0   0/1     0.0     0/0   0.0

TEAM: FG: 11/15 (73.3%), 3PT: 4/6 (66.7%), REB: 10 (3 off, 7 def), AST: 7, TO: 6
TEAM FOULS: 10 [Team_090 in BONUS]

================================================================================

================================================================================
                       4TH QUARTER - Team_090 vs Team_082                       
================================================================================

[12:00] Team_090 possession (Score: 80-58)
Gary Brogdon attempts a Midrange. Contested by Jrue Green (5.6 feet, MAN). Gary Brogdon misses. Rebound secured by Julius Carter.

[11:49] Team_082 possession (Score: 80-58)
Julius Anthony drives and kicks out. Julius Anthony attempts a Midrange. Contested by Derrick Mitchell (3.9 feet, MAN). Julius Anthony misses. Rebound secured by Gary Brogdon.

[11:29] Team_090 possession (Score: 80-58)
Zach Wall drives and kicks out. Larry Bridges attempts a Midrange. Contested by Jrue Green (4.1 feet, ZONE). LARRY BRIDGES MAKES IT!
Score: 82-58

[11:13] Team_082 possession (Score: 82-58)
Julius Carter makes the Layup and draws the foul on Tracy Adebayo! And-1! Julius Carter to the line for 1. [Team fouls: 1] (Tracy Adebayo: 1 personal fouls)   FT 1/1: GOOD Julius Carter makes 1/1 from the line.
Score: 82-61

[11:01] Team_090 possession (Score: 82-61)
Larry Bridges attempts a 3Pt. Wide open! Dwyane O'Neal is 6.4 feet away. [ZONE] LARRY BRIDGES MAKES IT! Assist: Zach Wall
Score: 85-61

[10:46] Team_082 possession (Score: 85-61)
Jrue Green loses the ball! Stripped by Gary Brogdon! TURNOVER! (live ball)

[10:31] Team_090 possession (Score: 85-61)
Derrick Mitchell drives, Julius Anthony stays with him. Derrick Mitchell attempts a Layup. Contested by Julius Anthony (3.5 feet, MAN). Derrick Mitchell misses. Rebound secured by Dwyane O'Neal.

[10:16] Team_082 possession (Score: 85-61)
Jrue Green attempts a Midrange. Wide open! Zach Wall is 6.5 feet away. [ZONE] Jrue Green misses. Rebound secured by Tracy Adebayo.

[10:01] Team_090 possession (Score: 85-61)
FOUL! Reach-in foul on Dwyane O'Neal during the drive. [Team fouls: 1] No free throws, side out. (Dwyane O'Neal: 1 personal fouls)

[09:44] Team_090 possession (Score: 85-61)
Tracy Adebayo attempts a Midrange. Contested by Julius Carter (5.7 feet, MAN). Tracy Adebayo misses. Rebound secured by Jrue Green.

[09:29] Team_082 possession (Score: 85-61)
Dwyane O'Neal attempts a 3Pt. Contested by Zach Wall (4.7 feet, ZONE). Dwyane O'Neal misses. Rebound secured by Tracy Adebayo.

[09:14] Team_090 possession (Score: 85-61)
Gary Brogdon attempts a Layup. Contested by Julius Carter (5.2 feet, ZONE). GARY BROGDON MAKES IT! Assist: Tracy Adebayo
Score: 87-61

[08:58] Team_082 possession (Score: 87-61)
Kristaps Fox throws a bad pass out of bounds! TURNOVER! (dead ball)

[08:58] Substitution (Team_090): Derrick Mitchell OUT → OG Anunoby IN (stamina_rule2)

[08:58] Substitution (Team_090): Larry Bridges OUT → Josh Wall IN (stamina_rule2)

[08:58] Substitution (Team_090): Zach Wall OUT → Russell Smith IN (stamina_rule2)

[08:58] Substitution (Team_090): Gary Brogdon OUT → Derrick Nowitzki IN (stamina_rule2)

[08:58] Substitution (Team_090): Tracy Adebayo OUT → Tobias Tatum IN (stamina_rule2)

[08:58] Substitution (Team_082): Julius Anthony OUT → Jordan Rozier IN (stamina_rule2)

[08:58] Substitution (Team_082): Dwyane O'Neal OUT → Kawhi Poole IN (stamina_rule2)

[08:58] Substitution (Team_082): Kristaps Fox OUT → Shaquille Griffin IN (stamina_rule2)

[08:58] Substitution (Team_082): Jrue Green OUT → Tony Jokic IN (stamina_rule2)

[08:58] Substitution (Team_082): Julius Carter OUT → D'Angelo Parker IN (stamina_rule2)

[08:45] Team_090 possession (Score: 87-61)
Derrick Nowitzki attempts a 3Pt. Heavily contested by Kawhi Poole (0.5 feet, ZONE)! Derrick Nowitzki misses. Rebound secured by Shaquille Griffin.

[08:33] Team_082 possession (Score: 87-61)
Jordan Rozier attempts a Midrange. Contested by Josh Wall (2.6 feet, ZONE). Jordan Rozier misses. Rebound secured by Derrick Nowitzki.

[08:22] Team_090 possession (Score: 87-61)
Russell Smith attempts a Midrange. Wide open! Shaquille Griffin is 7.1 feet away. [MAN] Russell Smith misses. Rebound secured by D'Angelo Parker.

[08:09] Team_082 possession (Score: 87-61)
Kawhi Poole drives to the basket... Kawhi Poole loses the ball! Stripped by Derrick Nowitzki! TURNOVER! (live ball)

[07:52] Team_090 possession (Score: 87-61)
Derrick Nowitzki drives, Tony Jokic stays with him. Derrick Nowitzki attempts a Layup. Wide open! Tony Jokic is 6.5 feet away. [ZONE] Derrick Nowitzki misses. Rebound secured by Tony Jokic.

[07:41] Team_082 possession (Score: 87-61)
Tony Jokic throws a bad pass out of bounds! TURNOVER! (dead ball)

[07:28] Team_090 possession (Score: 87-61)
Josh Wall attempts a 3Pt. Contested by Kawhi Poole (3.1 feet, ZONE). JOSH WALL MAKES IT! Assist: Tobias Tatum
Score: 90-61

[07:15] Team_082 possession (Score: 90-61)
Shaquille Griffin drives to the basket... Shaquille Griffin throws a bad pass! Stolen by Derrick Nowitzki! TURNOVER! (live ball)

[06:59] Team_090 possession (Score: 90-61)
Russell Smith attempts a 3Pt. Wide open! Shaquille Griffin is 7.6 feet away. [MAN] Russell Smith misses. Offensive rebound by Tobias Tatum! Tobias Tatum kicks it out.

[06:45] Team_090 possession (Score: 90-61)
OG Anunoby attempts a Midrange. Contested by Shaquille Griffin (4.9 feet, ZONE). OG Anunoby misses. Offensive rebound by Russell Smith! Russell Smith kicks it out.

[06:31] Team_090 possession (Score: 90-61)
Josh Wall makes the Midrange and draws the foul on Kawhi Poole! And-1! Josh Wall to the line for 1. [Team fouls: 2] (Kawhi Poole: 1 personal fouls)   FT 1/1: GOOD Josh Wall makes 1/1 from the line.
Score: 93-61

[06:19] Team_082 possession (Score: 93-61)
FOUL! Holding foul on Derrick Nowitzki. [Team fouls: 2] No free throws, side out. (Derrick Nowitzki: 1 personal fouls)

[06:02] Team_082 possession (Score: 93-61)
Shaquille Griffin attempts a 3Pt. Contested by Russell Smith (2.6 feet, MAN). Shaquille Griffin misses. Rebound secured by Russell Smith.

[05:50] Team_090 possession (Score: 93-61)
Derrick Nowitzki drives to the basket... Derrick Nowitzki loses control! Ball rolls out of bounds! TURNOVER! (dead ball)

[05:36] Team_082 possession (Score: 93-61)
Kawhi Poole attempts a 3Pt. Contested by Russell Smith (4.8 feet, ZONE). KAWHI POOLE MAKES IT! Assist: Tony Jokic
Score: 93-64

[05:16] Team_090 possession (Score: 93-64)
Tobias Tatum attempts a Midrange. Contested by D'Angelo Parker (4.6 feet, MAN). TOBIAS TATUM MAKES IT! Assist: Derrick Nowitzki
Score: 95-64

[04:59] Team_082 possession (Score: 95-64)
D'Angelo Parker drives and kicks out. Shaquille Griffin attempts a 3Pt. Contested by Russell Smith (3.0 feet, MAN). Shaquille Griffin misses. Offensive rebound by Shaquille Griffin! Shaquille Griffin kicks it out.

[04:47] Team_082 possession (Score: 95-64)
Jordan Rozier attempts a Layup. Wide open! OG Anunoby is 6.9 feet away. [MAN] JORDAN ROZIER MAKES IT! Assist: Shaquille Griffin
Score: 95-66

[04:36] Team_090 possession (Score: 95-66)
FOUL! Reach-in foul on D'Angelo Parker during the drive. [Team fouls: 3] No free throws, side out. (D'Angelo Parker: 1 personal fouls)

[04:21] Team_090 possession (Score: 95-66)
Tobias Tatum attempts a Layup. Wide open! D'Angelo Parker is 9.5 feet away. [ZONE] TOBIAS TATUM MAKES IT! Assist: Josh Wall
Score: 97-66

[04:07] Team_082 possession (Score: 97-66)
Tony Jokic attempts a Midrange. Wide open! Tobias Tatum is 9.0 feet away. [ZONE] TONY JOKIC MAKES IT!
Score: 97-68

[03:53] Team_090 possession (Score: 97-68)
Tobias Tatum drives and kicks out. Tobias Tatum attempts a 3Pt. Wide open! Kawhi Poole is 6.7 feet away. [ZONE] Tobias Tatum misses. Rebound secured by D'Angelo Parker.

[03:40] Team_082 possession (Score: 97-68)
FOUL! Shooting foul on Derrick Nowitzki. Kawhi Poole to the line for 2 free throws. [Team fouls: 3] (Derrick Nowitzki: 2 personal fouls)   FT 1/2: GOOD   FT 2/2: MISS Kawhi Poole makes 1/2 from the line. Offensive rebound by Shaquille Griffin! Shaquille Griffin kicks it out.
Score: 97-69

[03:23] Team_082 possession (Score: 97-69)
Jordan Rozier attempts a 3Pt. Contested by Josh Wall (5.9 feet, ZONE). Jordan Rozier misses. Rebound secured by Tobias Tatum.

[03:07] Team_090 possession (Score: 97-69)
Josh Wall makes the Midrange and draws the foul on Kawhi Poole! And-1! Josh Wall to the line for 1. [Team fouls: 4] (Kawhi Poole: 2 personal fouls)   FT 1/1: GOOD Josh Wall makes 1/1 from the line.
Score: 100-69

[02:52] Team_082 possession (Score: 100-69)
Jordan Rozier attempts a 3Pt. Wide open! OG Anunoby is 6.2 feet away. [MAN] Jordan Rozier misses. Rebound secured by Russell Smith.

[02:38] Team_090 possession (Score: 100-69)
Tobias Tatum drives, picks up D'Angelo Parker. Help arrives from Kawhi Poole! Tobias Tatum attempts a Layup. Wide open! Kawhi Poole is 8.5 feet away. [ZONE] Tobias Tatum misses. Offensive rebound by Russell Smith! Russell Smith kicks it out.

[02:26] Team_090 possession (Score: 100-69)
OG Anunoby attempts a 3Pt. Wide open! Jordan Rozier is 7.2 feet away. [MAN] OG ANUNOBY MAKES IT! Assist: Russell Smith
Score: 103-69

[02:16] Team_082 possession (Score: 103-69)
Tony Jokic attempts a Midrange. Contested by OG Anunoby (4.1 feet, ZONE). Tony Jokic misses. Offensive rebound by Tony Jokic! Tony Jokic kicks it out.

[02:03] Team_082 possession (Score: 103-69)
Shaquille Griffin attempts a 3Pt. Contested by Russell Smith (3.3 feet, MAN). Shaquille Griffin misses. Rebound secured by Derrick Nowitzki.

[01:45] Team_090 possession (Score: 103-69)
Josh Wall attempts a 3Pt. Contested by Kawhi Poole (5.7 feet, ZONE). Josh Wall misses. Rebound secured by Shaquille Griffin.

[01:32] Team_082 possession (Score: 103-69)
Kawhi Poole attempts a 3Pt. Contested by Russell Smith (3.7 feet, ZONE). Kawhi Poole misses. Rebound secured by Derrick Nowitzki.

[01:19] Team_090 possession (Score: 103-69)
Derrick Nowitzki attempts a 3Pt. Contested by Tony Jokic (3.0 feet, MAN). DERRICK NOWITZKI MAKES IT! Assist: Josh Wall
Score: 106-69

[01:01] Team_082 possession (Score: 106-69)
Jordan Rozier attempts a Midrange. Contested by OG Anunoby (5.1 feet, MAN). Jordan Rozier misses. Rebound secured by Russell Smith.

[00:47] Team_090 possession (Score: 106-69)
Derrick Nowitzki attempts a Layup. Contested by Tony Jokic (3.9 feet, MAN). Derrick Nowitzki misses. Rebound secured by Shaquille Griffin.

[00:34] Team_082 possession (Score: 106-69)
D'Angelo Parker attempts a Midrange. Wide open! Tobias Tatum is 6.2 feet away. [MAN] D'Angelo Parker misses. Rebound secured by Derrick Nowitzki.

[00:17] Team_090 possession (Score: 106-69)
Josh Wall drives and kicks out. Tobias Tatum attempts a Midrange. Wide open! Tony Jokic is 6.3 feet away. [ZONE] TOBIAS TATUM MAKES IT!
Score: 108-69

[00:05] Team_082 possession (Score: 108-69)
Shaquille Griffin attempts a Layup. BLOCKED BY DERRICK NOWITZKI! Ball goes out off Derrick Nowitzki. Shaquille Griffin's ball!

================================================================================
                              4TH QUARTER COMPLETE                              
================================================================================

4TH QUARTER SCORE: Team_090 28, Team_082 11

BOX SCORE:
================================================================================

Team_090
--------------------------------------------------------------------------------
Player                MIN  PTS  REB  AST  TO      FG   FG%      3P   3P%
--------------------------------------------------------------------------------
Josh Wall              17    9    0    2   0   3/4    75.0     0/0   0.0
Tobias Tatum           17    6    2    1   0   3/4    75.0     0/0   0.0
Larry Bridges          32    5    0    0   0   2/2   100.0     0/0   0.0
Derrick Nowitzki       17    3    4    1   0   1/4    25.0     0/0   0.0
OG Anunoby             15    3    0    0   0   1/1   100.0     0/0   0.0
Gary Brogdon           32    2    1    0   0   1/2    50.0     0/0   0.0
Zach Wall              34    0    0    1   0   0/0     0.0     0/0   0.0
Derrick Mitchell       34    0    0    0   0   0/1     0.0     0/0   0.0
Tracy Adebayo          32    0    2    1   0   0/1     0.0     0/0   0.0
Russell Smith          15    0    5    1   0   0/1     0.0     0/0   0.0

TEAM: FG: 11/20 (55.0%), 3PT: 4/6 (66.7%), REB: 14 (3 off, 11 def), AST: 7, TO: 1
TEAM FOULS: 3


Team_082
--------------------------------------------------------------------------------
Player                MIN  PTS  REB  AST  TO      FG   FG%      3P   3P%
--------------------------------------------------------------------------------
Julius Carter          32    3    1    0   0   1/1   100.0     0/0   0.0
Kawhi Poole            17    3    0    0   0   1/2    50.0     0/0   0.0
Jordan Rozier          17    2    0    0   0   1/5    20.0     0/0   0.0
Tony Jokic             17    2    2    1   0   1/1   100.0     0/0   0.0
Julius Anthony         32    0    0    0   0   0/1     0.0     0/0   0.0
Dwyane O'Neal          32    0    1    0   0   0/1     0.0     0/0   0.0
Jrue Green             32    0    1    0   0   0/1     0.0     0/0   0.0
Shaquille Griffin      17    0    5    1   0   0/2     0.0     0/0   0.0
D'Angelo Parker        17    0    2    0   0   0/1     0.0     0/0   0.0

TEAM: FG: 4/15 (26.7%), 3PT: 1/7 (14.3%), REB: 12 (3 off, 9 def), AST: 2, TO: 5
TEAM FOULS: 4

================================================================================

================================================================================
                               FULL GAME COMPLETE                               
================================================================================

FINAL SCORE: Team_090 108, Team_082 69

SCORING BY QUARTER:
--------------------------------------------------------------------------------
Team                     Q1     Q2     Q3     Q4    FINAL
--------------------------------------------------------------------------------
Team_090                 22     28     30     28      108
Team_082                 18     13     27     11       69
--------------------------------------------------------------------------------

FULL GAME BOX SCORE:
================================================================================

Team_090
--------------------------------------------------------------------------------
Player                MIN  PTS  REB  AST  TO      FG   FG%      3P   3P%      FT STL BLK
--------------------------------------------------------------------------------
Derrick Mitchell       34   10    0    4   1   4/10   40.0   1/4    25.0   1/1     1   1
Zach Wall              34   14    6    8   0   7/13   53.8   3/6    50.0   3/3     1   0
Larry Bridges          32   11    0    3   4   4/7    57.1   2/3    66.7   2/3     0   1
Gary Brogdon           32   19    6    2   0   7/14   50.0   1/2    50.0   1/1     2   0
Tracy Adebayo          32   14   15    2   1   6/9    66.7   2/2   100.0   0/1     0   0
Josh Wall              17   12    0    4   2   5/6    83.3   2/3    66.7   2/2     0   0
Derrick Nowitzki       17    3    6    2   0   1/4    25.0   1/2    50.0   0/0     2   1
Tobias Tatum           17   15    6    2   0   6/7    85.7   1/1   100.0   4/4     0   1
OG Anunoby             15    8    0    0   0   3/4    75.0   2/3    66.7   0/0     0   0
Russell Smith          15    0    7    1   1   0/2     0.0   0/1     0.0   0/0     0   0

TEAM: FG: 43/76 (56.6%), 3PT: 15/27 (55.6%), REB: 46 (8 off, 38 def), AST: 28, TO: 9


Team_082
--------------------------------------------------------------------------------
Player                MIN  PTS  REB  AST  TO      FG   FG%      3P   3P%      FT STL BLK
--------------------------------------------------------------------------------
Julius Anthony         32   10    0    1   4   4/7    57.1   2/3    66.7   0/0     0   0
Dwyane O'Neal          32   14    9    6   0   6/10   60.0   3/6    50.0   4/5     2   0
Kristaps Fox           32    7    0    2   5   4/11   36.4   0/4     0.0   1/2     0   0
Jrue Green             32   10   14    4   3   4/8    50.0   2/3    66.7   0/0     0   0
Julius Carter          32    8    4    0   0   3/8    37.5   0/2     0.0   2/2     1   0
Jordan Rozier          17   10    0    0   0   4/9    44.4   2/4    50.0   0/0     0   0
Kawhi Poole            17    3    0    0   0   1/3    33.3   1/3    33.3   1/2     1   0
Shaquille Griffin      17    0    9    3   2   0/6     0.0   0/4     0.0   1/2     0   0
Tony Jokic             17    2    3    1   3   1/1   100.0   0/0     0.0   0/0     0   0
D'Angelo Parker        17    3    2    1   0   1/4    25.0   0/0     0.0   1/1     1   0

TEAM: FG: 28/67 (41.8%), 3PT: 10/29 (34.5%), REB: 41 (8 off, 33 def), AST: 18, TO: 17

================================================================================
