================================================================================
                        FULL GAME - Team_073 vs Team_097                        
================================================================================

================================================================================
                       1ST QUARTER - Team_073 vs Team_097                       
================================================================================

[12:00] Team_073 possession (Score: 0-0)
Karl Williamson makes the Layup and draws the foul on Shai Poole! And-1! Karl Williamson to the line for 1. [Team fouls: 1] (Shai Poole: 1 personal fouls)   FT 1/1: GOOD Karl Williamson makes 1/1 from the line.
Score: 3-0

[11:41] Team_097 possession (Score: 3-0)
Shai Poole drives to the basket... Shai Poole loses control! Ball rolls out of bounds! TURNOVER! (dead ball)

[11:26] Team_073 possession (Score: 3-0)
Carmelo Young attempts a Layup. Contested by Evan Brogdon (5.9 feet, MAN). CARMELO YOUNG MAKES IT! Assist: Carmelo Porzingis
Score: 5-0

[11:11] Team_097 possession (Score: 5-0)
FOUL! Holding foul on Karl Williamson. [Team fouls: 1] No free throws, side out. (Karl Williamson: 1 personal fouls)

[10:56] Team_097 possession (Score: 5-0)
Evan Brogdon attempts a 3Pt. Wide open! Carmelo Young is 6.2 feet away. [MAN] EVAN BROGDON MAKES IT! Assist: Anthony Haliburton
Score: 5-3

[10:40] Team_073 possession (Score: 5-3)
Bradley Morant drives and kicks out. Bradley Morant attempts a 3Pt. Heavily contested by Anthony Haliburton (1.4 feet, MAN)! Bradley Morant misses. Rebound secured by Shai Poole.

[10:23] Team_097 possession (Score: 5-3)
Evan Brogdon attempts a 3Pt. Contested by Carmelo Young (2.8 feet, MAN). EVAN BROGDON MAKES IT! Assist: Shai Poole
Score: 5-6

[10:04] Team_073 possession (Score: 5-6)
Carmelo Porzingis attempts a 3Pt. Wide open! Anthony Haliburton is 6.4 feet away. [MAN] Carmelo Porzingis misses. Rebound secured by Shai Poole.

[09:50] Team_097 possession (Score: 5-6)
Anthony Haliburton attempts a Midrange. Wide open! Isaiah Smith is 7.6 feet away. [ZONE] ANTHONY HALIBURTON MAKES IT! Assist: Shai Poole
Score: 5-8

[09:35] Team_073 possession (Score: 5-8)
FOUL! Holding foul on Anthony Haliburton. [Team fouls: 2] No free throws, side out. (Anthony Haliburton: 1 personal fouls)

[09:17] Team_073 possession (Score: 5-8)
Carmelo Porzingis attempts a 3Pt. Heavily contested by Jrue Haliburton (1.5 feet, ZONE)! CARMELO PORZINGIS MAKES IT! Assist: Bradley Morant
Score: 8-8

[09:05] Team_097 possession (Score: 8-8)
Tyrese Stewart loses control! Ball rolls out of bounds! TURNOVER! (dead ball)

[08:48] Team_073 possession (Score: 8-8)
Bradley Morant attempts a Midrange. Contested by Anthony Haliburton (4.5 feet, MAN). Bradley Morant misses. Offensive rebound by Bradley Morant! Bradley Morant kicks it out.

[08:35] Team_073 possession (Score: 8-8)
FOUL! Holding foul on Shai Poole. [Team fouls: 3] No free throws, side out. (Shai Poole: 2 personal fouls)

[08:19] Team_073 possession (Score: 8-8)
Karl Williamson attempts a 3Pt. Contested by Shai Poole (3.3 feet, MAN). Karl Williamson misses. Offensive rebound by Carmelo Porzingis! Carmelo Porzingis kicks it out.

[08:07] Team_073 possession (Score: 8-8)
Bradley Morant makes the Layup and draws the foul on Anthony Haliburton! And-1! Bradley Morant to the line for 1. [Team fouls: 4] (Anthony Haliburton: 2 personal fouls)   FT 1/1: GOOD Bradley Morant makes 1/1 from the line.
Score: 11-8

[07:55] Team_097 possession (Score: 11-8)
Evan Brogdon drives to the basket... Evan Brogdon throws a bad pass! Stolen by Carmelo Young! TURNOVER! (live ball)

[07:42] Team_073 possession (Score: 11-8)
Carmelo Porzingis attempts a Layup. Contested by Tyrese Stewart (3.3 feet, ZONE). CARMELO PORZINGIS MAKES IT! Assist: Karl Williamson
Score: 13-8

[07:24] Team_097 possession (Score: 13-8)
Shai Poole drives to the basket... FOUL! Offensive foul on Shai Poole! Karl Williamson drew the charge! [Team fouls: 5] (Shai Poole: 3 personal fouls) TURNOVER! (dead ball)

[07:07] Team_073 possession (Score: 13-8)
Carmelo Young drives and kicks out. Karl Williamson attempts a Midrange. Heavily contested by Shai Poole (1.0 feet, MAN)! Karl Williamson misses. Offensive rebound by Bradley Morant! Bradley Morant kicks it out.

[06:53] Team_073 possession (Score: 13-8)
Bradley Morant drives and kicks out. Isaiah Smith attempts a 3Pt. Contested by Jrue Haliburton (4.9 feet, MAN). ISAIAH SMITH MAKES IT! Assist: Carmelo Young
Score: 16-8

[06:36] Team_097 possession (Score: 16-8)
Evan Brogdon drives, Carmelo Young stays with him. Evan Brogdon attempts a Dunk. Contested by Carmelo Young (2.6 feet, MAN). EVAN BROGDON MAKES IT! Assist: Jrue Haliburton
Score: 16-10

[06:22] Team_073 possession (Score: 16-10)
Carmelo Young attempts a 3Pt. Contested by Evan Brogdon (5.5 feet, MAN). Carmelo Young misses. Rebound secured by Anthony Haliburton.

[06:06] Team_097 possession (Score: 16-10)
Evan Brogdon attempts a 3Pt. Contested by Karl Williamson (3.5 feet, ZONE). Evan Brogdon misses. FOUL! Loose ball foul on Carmelo Porzingis during the rebound battle. [Team fouls: 2] No free throws, side out. (Carmelo Porzingis: 1 personal fouls)

[05:53] Team_097 possession (Score: 16-10)
Tyrese Stewart drives and kicks out. Tyrese Stewart attempts a 3Pt. Wide open! Bradley Morant is 6.5 feet away. [MAN] Tyrese Stewart misses. Rebound secured by Isaiah Smith.

[05:41] Team_073 possession (Score: 16-10)
FOUL! Holding foul on Shai Poole. [IN THE BONUS! 6 team fouls] Karl Williamson to the line for 2 free throws. (Shai Poole: 4 personal fouls)   FT 1/2: GOOD   FT 2/2: GOOD Karl Williamson makes 2/2 from the line.
Score: 18-10

[05:29] Team_097 possession (Score: 18-10)
Evan Brogdon throws a bad pass out of bounds! TURNOVER! (dead ball)

[05:15] Team_073 possession (Score: 18-10)
Isaiah Smith loses the ball! Stripped by Jrue Haliburton! TURNOVER! (live ball)

[05:00] Team_097 possession (Score: 18-10)
Anthony Haliburton attempts a Midrange. Wide open! Carmelo Porzingis is 9.7 feet away. [MAN] Anthony Haliburton misses. FOUL! Loose ball foul on Isaiah Smith during the rebound battle. [Team fouls: 3] No free throws, side out. (Isaiah Smith: 1 personal fouls)

[04:46] Team_097 possession (Score: 18-10)
Evan Brogdon attempts a 3Pt. Contested by Karl Williamson (5.0 feet, ZONE). Evan Brogdon misses. Rebound secured by Bradley Morant.

[04:31] Team_073 possession (Score: 18-10)
Karl Williamson attempts a Layup. Contested by Shai Poole (5.8 feet, MAN). KARL WILLIAMSON MAKES IT!
Score: 20-10

[04:18] Team_097 possession (Score: 20-10)
Jrue Haliburton attempts a 3Pt. Contested by Isaiah Smith (3.2 feet, MAN). Jrue Haliburton misses. Rebound secured by Isaiah Smith.

[04:02] Team_073 possession (Score: 20-10)
Karl Williamson attempts a Layup. Wide open! Anthony Haliburton is 6.6 feet away. [ZONE] Karl Williamson misses. Rebound secured by Tyrese Stewart.

[03:45] Team_097 possession (Score: 20-10)
Jrue Haliburton drives to the basket... Jrue Haliburton throws a bad pass out of bounds! TURNOVER! (dead ball)

[03:28] Team_073 possession (Score: 20-10)
Isaiah Smith drives and kicks out. Carmelo Young attempts a Midrange. Contested by Evan Brogdon (5.3 feet, MAN). Carmelo Young misses. Rebound secured by Shai Poole.

[03:10] Team_097 possession (Score: 20-10)
Evan Brogdon attempts a 3Pt. Contested by Carmelo Young (4.1 feet, MAN). EVAN BROGDON MAKES IT! Assist: Shai Poole
Score: 20-13

[02:56] Team_073 possession (Score: 20-13)
Bradley Morant attempts a Midrange. Contested by Anthony Haliburton (5.0 feet, MAN). Bradley Morant misses. Rebound secured by Shai Poole.

[02:41] Team_097 possession (Score: 20-13)
Anthony Haliburton attempts a Midrange. Wide open! Carmelo Young is 7.2 feet away. [ZONE] ANTHONY HALIBURTON MAKES IT! Assist: Evan Brogdon
Score: 20-15

[02:21] Team_073 possession (Score: 20-15)
Karl Williamson drives and kicks out. FOUL! Shooting foul on Anthony Haliburton. Karl Williamson to the line for 2 free throws. [BONUS: 7 team fouls] (Anthony Haliburton: 3 personal fouls)   FT 1/2: MISS   FT 2/2: MISS Karl Williamson makes 0/2 from the line. Rebound secured by Shai Poole.

[02:09] Team_097 possession (Score: 20-15)
Shai Poole drives, Carmelo Porzingis stays with him. Shai Poole attempts a Layup. Contested by Carmelo Porzingis (5.9 feet, ZONE). SHAI POOLE MAKES IT! Assist: Anthony Haliburton
Score: 20-17

[01:52] Team_073 possession (Score: 20-17)
Carmelo Porzingis attempts a 3Pt. Contested by Anthony Haliburton (2.3 feet, MAN). Carmelo Porzingis misses. Rebound secured by Anthony Haliburton.

[01:34] Team_097 possession (Score: 20-17)
Evan Brogdon drives and kicks out. Evan Brogdon attempts a Midrange. Contested by Isaiah Smith (3.0 feet, ZONE). Evan Brogdon misses. Offensive rebound by Tyrese Stewart! Tyrese Stewart kicks it out.

[01:15] Team_097 possession (Score: 20-17)
Jrue Haliburton loses the ball! Stripped by Isaiah Smith! TURNOVER! (live ball)

[00:59] Team_073 possession (Score: 20-17)
Carmelo Porzingis drives and kicks out. Carmelo Young attempts a 3Pt. Contested by Shai Poole (2.8 feet, ZONE). Carmelo Young misses. Offensive rebound by Carmelo Porzingis! Carmelo Porzingis kicks it out.

[00:44] Team_073 possession (Score: 20-17)
Bradley Morant attempts a 3Pt. Wide open! Anthony Haliburton is 6.5 feet away. [MAN] BRADLEY MORANT MAKES IT! Assist: Isaiah Smith
Score: 23-17

[00:29] Team_097 possession (Score: 23-17)
FOUL! Holding foul on Carmelo Porzingis. [Team fouls: 4] No free throws, side out. (Carmelo Porzingis: 2 personal fouls)

[00:17] Team_097 possession (Score: 23-17)
Anthony Haliburton drives, Bradley Morant stays with him. Anthony Haliburton attempts a Layup. Contested by Bradley Morant (5.4 feet, ZONE). Anthony Haliburton misses. Rebound secured by Bradley Morant.

[00:01] Team_073 possession (Score: 23-17)
Isaiah Smith attempts a Midrange. Heavily contested by Anthony Haliburton (0.7 feet, ZONE)! Isaiah Smith misses. Rebound secured by Shai Poole.

================================================================================
                              1ST QUARTER COMPLETE                              
================================================================================

1ST QUARTER SCORE: Team_073 23, Team_097 17

BOX SCORE:
================================================================================

Team_073
--------------------------------------------------------------------------------
Player                MIN  PTS  REB  AST  TO      FG   FG%      3P   3P%
--------------------------------------------------------------------------------
Karl Williamson        12    7    0    1   0   3/5    60.0     0/0   0.0
Bradley Morant         12    6    4    1   0   2/4    50.0     0/0   0.0
Carmelo Porzingis      12    5    2    1   0   2/4    50.0     0/0   0.0
Isaiah Smith           12    3    2    1   0   1/3    33.3     0/0   0.0
Carmelo Young          12    2    0    1   0   1/2    50.0     0/0   0.0

TEAM: FG: 9/18 (50.0%), 3PT: 2/5 (40.0%), REB: 8 (4 off, 4 def), AST: 5, TO: 1
TEAM FOULS: 4


Team_097
--------------------------------------------------------------------------------
Player                MIN  PTS  REB  AST  TO      FG   FG%      3P   3P%
--------------------------------------------------------------------------------
Evan Brogdon           12   11    0    1   0   4/5    80.0     0/0   0.0
Anthony Haliburton     12    4    4    2   0   2/3    66.7     0/0   0.0
Shai Poole             12    2    6    3   0   1/1   100.0     0/0   0.0
Jrue Haliburton        12    0    0    1   0   0/1     0.0     0/0   0.0
Tyrese Stewart         12    0    2    0   0   0/1     0.0     0/0   0.0

TEAM: FG: 7/11 (63.6%), 3PT: 3/5 (60.0%), REB: 12 (3 off, 9 def), AST: 7, TO: 7
TEAM FOULS: 7 [Team_073 in BONUS]

================================================================================

================================================================================
                       2ND QUARTER - Team_073 vs Team_097                       
================================================================================

[12:00] Team_073 possession (Score: 23-17)
Carmelo Young attempts a Layup. Contested by Evan Brogdon (4.3 feet, MAN). CARMELO YOUNG MAKES IT!
Score: 25-17

[11:46] Team_097 possession (Score: 25-17)
Shai Poole attempts a 3Pt. Contested by Karl Williamson (5.6 feet, ZONE). SHAI POOLE MAKES IT! Assist: Evan Brogdon
Score: 25-20

[11:28] Team_073 possession (Score: 25-20)
FOUL! Reach-in foul on Shai Poole during the drive. [Team fouls: 1] No free throws, side out. (Shai Poole: 1 personal fouls)

[11:17] Team_073 possession (Score: 25-20)
Karl Williamson drives, Shai Poole stays with him. Karl Williamson attempts a Dunk. Contested by Shai Poole (5.0 feet, MAN). KARL WILLIAMSON MAKES IT!
Score: 27-20

[11:05] Team_097 possession (Score: 27-20)
Anthony Haliburton attempts a Midrange. Contested by Isaiah Smith (2.9 feet, ZONE). ANTHONY HALIBURTON MAKES IT! Assist: Jrue Haliburton
Score: 27-22

[10:49] Team_073 possession (Score: 27-22)
Carmelo Porzingis drives and kicks out. Carmelo Young attempts a 3Pt. Contested by Shai Poole (3.6 feet, ZONE). Carmelo Young misses. Rebound secured by Tyrese Stewart.

[10:31] Team_097 possession (Score: 27-22)
Shai Poole drives, picks up Karl Williamson. Help arrives from Isaiah Smith! Shai Poole attempts a Dunk. Wide open! Isaiah Smith is 6.7 feet away. [MAN] SHAI POOLE MAKES IT! Assist: Jrue Haliburton
Score: 27-24

[10:19] Team_073 possession (Score: 27-24)
Karl Williamson attempts a 3Pt. Contested by Shai Poole (4.9 feet, ZONE). KARL WILLIAMSON MAKES IT! Assist: Isaiah Smith
Score: 30-24

[10:10] Team_097 possession (Score: 30-24)
Anthony Haliburton drives, picks up Carmelo Porzingis. Help arrives from Isaiah Smith! Anthony Haliburton attempts a Dunk. Wide open! Isaiah Smith is 7.6 feet away. [MAN] Anthony Haliburton misses. Rebound secured by Carmelo Porzingis.

[09:58] Team_073 possession (Score: 30-24)
Karl Williamson drives and kicks out. Isaiah Smith attempts a 3Pt. Wide open! Jrue Haliburton is 6.2 feet away. [MAN] Isaiah Smith misses. Rebound secured by Tyrese Stewart.

[09:48] Team_097 possession (Score: 30-24)
Anthony Haliburton makes the Midrange and draws the foul on Isaiah Smith! And-1! Anthony Haliburton to the line for 1. [Team fouls: 1] (Isaiah Smith: 1 personal fouls)   FT 1/1: MISS Anthony Haliburton makes 0/1 from the line. Offensive rebound by Tyrese Stewart! Tyrese Stewart kicks it out.
Score: 30-26

[09:33] Team_097 possession (Score: 30-26)
Shai Poole attempts a Layup. Contested by Karl Williamson (3.5 feet, MAN). Shai Poole misses. Rebound secured by Isaiah Smith.

[09:18] Team_073 possession (Score: 30-26)
Carmelo Young attempts a 3Pt. Contested by Evan Brogdon (5.5 feet, MAN). CARMELO YOUNG MAKES IT! Assist: Karl Williamson
Score: 33-26

[09:02] Team_097 possession (Score: 33-26)
Anthony Haliburton attempts a 3Pt. Contested by Carmelo Porzingis (3.2 feet, MAN). ANTHONY HALIBURTON MAKES IT! Assist: Tyrese Stewart
Score: 33-29

[08:49] Team_073 possession (Score: 33-29)
Karl Williamson attempts a 3Pt. Wide open! Shai Poole is 6.1 feet away. [MAN] Karl Williamson misses. Offensive rebound by Bradley Morant! Bradley Morant kicks it out.

[08:37] Team_073 possession (Score: 33-29)
Karl Williamson loses the ball! Stripped by Shai Poole! TURNOVER! (live ball)

[08:22] Team_097 possession (Score: 33-29)
Jrue Haliburton attempts a Midrange. Heavily contested by Karl Williamson (0.5 feet, ZONE)! Jrue Haliburton misses. Rebound secured by Carmelo Porzingis.

[08:07] Team_073 possession (Score: 33-29)
Isaiah Smith attempts a 3Pt. Wide open! Anthony Haliburton is 7.3 feet away. [ZONE] Isaiah Smith misses. Rebound secured by Shai Poole.

[07:52] Team_097 possession (Score: 33-29)
Shai Poole attempts a 3Pt. Contested by Karl Williamson (2.3 feet, MAN). Shai Poole misses. Offensive rebound by Anthony Haliburton! Anthony Haliburton kicks it out.

[07:38] Team_097 possession (Score: 33-29)
Jrue Haliburton drives, picks up Isaiah Smith. Help arrives from Karl Williamson! Jrue Haliburton attempts a Dunk. Contested by Karl Williamson (3.7 feet, MAN). Jrue Haliburton misses. Rebound secured by Bradley Morant.

[07:27] Team_073 possession (Score: 33-29)
Karl Williamson attempts a 3Pt. Contested by Shai Poole (4.0 feet, ZONE). Karl Williamson misses. Rebound secured by Shai Poole.

[07:11] Team_097 possession (Score: 33-29)
Anthony Haliburton attempts a Layup. Wide open! Bradley Morant is 6.5 feet away. [ZONE] ANTHONY HALIBURTON MAKES IT! Assist: Shai Poole
Score: 33-31

[06:56] Team_073 possession (Score: 33-31)
Karl Williamson drives, picks up Anthony Haliburton. Help arrives from Jrue Haliburton! Karl Williamson attempts a Dunk. Contested by Jrue Haliburton (5.2 feet, ZONE). Karl Williamson misses. Rebound secured by Shai Poole.

[06:46] Team_097 possession (Score: 33-31)
Anthony Haliburton attempts a Midrange. Contested by Carmelo Porzingis (4.1 feet, MAN). Anthony Haliburton misses. Rebound secured by Bradley Morant.

[06:30] Team_073 possession (Score: 33-31)
FOUL! Shooting foul on Anthony Haliburton. Carmelo Porzingis to the line for 2 free throws. [Team fouls: 2] (Anthony Haliburton: 1 personal fouls)   FT 1/2: MISS   FT 2/2: GOOD Carmelo Porzingis makes 1/2 from the line.
Score: 34-31

[06:18] Team_097 possession (Score: 34-31)
Jrue Haliburton attempts a 3Pt. Contested by Carmelo Porzingis (3.1 feet, ZONE). JRUE HALIBURTON MAKES IT! Assist: Evan Brogdon
Score: 34-34

[05:59] Team_073 possession (Score: 34-34)
FOUL! Shooting foul on Anthony Haliburton. Carmelo Young to the line for 2 free throws. [Team fouls: 3] (Anthony Haliburton: 2 personal fouls)   FT 1/2: GOOD   FT 2/2: GOOD Carmelo Young makes 2/2 from the line.
Score: 36-34

[05:46] Team_097 possession (Score: 36-34)
Anthony Haliburton throws a bad pass out of bounds! TURNOVER! (dead ball)

[05:46] Substitution (Team_073): Carmelo Young OUT → Zach Quickley IN (stamina_rule2)

[05:46] Substitution (Team_073): Isaiah Smith OUT → Luka Butler IN (stamina_rule2)

[05:46] Substitution (Team_073): Karl Williamson OUT → Dwyane McCollum IN (stamina_rule2)

[05:46] Substitution (Team_073): Carmelo Porzingis OUT → Shai Thompson IN (stamina_rule2)

[05:46] Substitution (Team_073): Bradley Morant OUT → Ja Rose IN (stamina_rule2)

[05:46] Substitution (Team_097): Evan Brogdon OUT → Gary Carter IN (stamina_rule2)

[05:46] Substitution (Team_097): Jrue Haliburton OUT → Dwyane Ginobili IN (stamina_rule2)

[05:46] Substitution (Team_097): Shai Poole OUT → Miles Dosunmu IN (stamina_rule2)

[05:46] Substitution (Team_097): Anthony Haliburton OUT → Joel Simons IN (stamina_rule2)

[05:46] Substitution (Team_097): Tyrese Stewart OUT → Miles Banchero IN (stamina_rule2)

[05:32] Team_073 possession (Score: 36-34)
FOUL! Shooting foul on Joel Simons. Dwyane McCollum to the line for 3 free throws. [Team fouls: 4] (Joel Simons: 1 personal fouls)   FT 1/3: GOOD   FT 2/3: GOOD   FT 3/3: GOOD Dwyane McCollum makes 3/3 from the line.
Score: 39-34

[05:16] Team_097 possession (Score: 39-34)
FOUL! Shooting foul on Ja Rose. Gary Carter to the line for 2 free throws. [Team fouls: 2] (Ja Rose: 1 personal fouls)   FT 1/2: GOOD   FT 2/2: MISS Gary Carter makes 1/2 from the line. Rebound secured by Ja Rose.
Score: 39-35

[05:05] Team_073 possession (Score: 39-35)
FOUL! Reach-in foul on Miles Dosunmu during the drive. [IN THE BONUS! 5 team fouls] Dwyane McCollum to the line for 2 free throws. (Miles Dosunmu: 1 personal fouls)   FT 1/2: MISS   FT 2/2: GOOD Dwyane McCollum makes 1/2 from the line.
Score: 40-35

[04:51] Team_097 possession (Score: 40-35)
Gary Carter attempts a Layup. BLOCKED BY ZACH QUICKLEY! Ball is loose! Offensive rebound by Miles Dosunmu! Miles Dosunmu kicks it out.

[04:32] Team_097 possession (Score: 40-35)
FOUL! Holding foul on Ja Rose. [Team fouls: 3] No free throws, side out. (Ja Rose: 2 personal fouls)

[04:22] Team_097 possession (Score: 40-35)
Dwyane Ginobili attempts a Midrange. Contested by Luka Butler (3.3 feet, MAN). DWYANE GINOBILI MAKES IT! Assist: Miles Dosunmu
Score: 40-37

[04:08] Team_073 possession (Score: 40-37)
Zach Quickley attempts a 3Pt. Contested by Miles Dosunmu (5.9 feet, ZONE). Zach Quickley misses. Rebound secured by Joel Simons.

[03:51] Team_097 possession (Score: 40-37)
Joel Simons makes the Dunk and draws the foul on Luka Butler! And-1! Joel Simons to the line for 1. [Team fouls: 4] (Luka Butler: 1 personal fouls)   FT 1/1: GOOD Joel Simons makes 1/1 from the line.
Score: 40-40

[03:34] Team_073 possession (Score: 40-40)
Ja Rose attempts a 3Pt. Contested by Joel Simons (3.7 feet, ZONE). Ja Rose misses. Offensive rebound by Dwyane McCollum! Dwyane McCollum puts it back in!
Score: 42-40

[03:20] Team_097 possession (Score: 42-40)
Miles Banchero attempts a Midrange. Contested by Luka Butler (2.8 feet, ZONE). Miles Banchero misses. Rebound secured by Dwyane McCollum.

[03:04] Team_073 possession (Score: 42-40)
Zach Quickley makes the Layup and draws the foul on Dwyane Ginobili! And-1! Zach Quickley to the line for 1. [BONUS: 6 team fouls] (Dwyane Ginobili: 1 personal fouls)   FT 1/1: MISS Zach Quickley makes 0/1 from the line. Rebound secured by Joel Simons.
Score: 44-40

[02:49] Team_097 possession (Score: 44-40)
Miles Banchero drives and kicks out. Joel Simons attempts a Midrange. BLOCKED BY SHAI THOMPSON! Ball deflects out of bounds off Joel Simons.

[02:31] Team_073 possession (Score: 44-40)
Luka Butler attempts a Midrange. Wide open! Dwyane Ginobili is 8.1 feet away. [ZONE] LUKA BUTLER MAKES IT! Assist: Shai Thompson
Score: 46-40

[02:17] Team_097 possession (Score: 46-40)
Gary Carter makes the Midrange and draws the foul on Luka Butler! And-1! Gary Carter to the line for 1. [BONUS: 5 team fouls] (Luka Butler: 2 personal fouls)   FT 1/1: GOOD Gary Carter makes 1/1 from the line.
Score: 46-43

[02:00] Team_073 possession (Score: 46-43)
Ja Rose attempts a Layup. Contested by Joel Simons (2.4 feet, MAN). Ja Rose misses. Offensive rebound by Dwyane McCollum! Dwyane McCollum's putback is no good. Offensive rebound by Ja Rose! Ja Rose kicks it out.

[01:46] Team_073 possession (Score: 46-43)
Dwyane McCollum attempts a 3Pt. Contested by Miles Dosunmu (3.2 feet, MAN). Dwyane McCollum misses. Rebound secured by Joel Simons.

[01:36] Team_097 possession (Score: 46-43)
Miles Dosunmu attempts a 3Pt. Wide open! Luka Butler is 6.7 feet away. [ZONE] Miles Dosunmu misses. Rebound secured by Dwyane McCollum.

[01:25] Team_073 possession (Score: 46-43)
FOUL! Holding foul on Miles Dosunmu. [IN THE BONUS! 7 team fouls] Dwyane McCollum to the line for 2 free throws. (Miles Dosunmu: 2 personal fouls)   FT 1/2: GOOD   FT 2/2: GOOD Dwyane McCollum makes 2/2 from the line.
Score: 48-43

[01:10] Team_097 possession (Score: 48-43)
Miles Banchero drives, Ja Rose stays with him. Miles Banchero attempts a Dunk. Contested by Ja Rose (5.9 feet, MAN). MILES BANCHERO MAKES IT!
Score: 48-45

[00:51] Team_073 possession (Score: 48-45)
Dwyane McCollum attempts a Layup. Contested by Joel Simons (2.4 feet, ZONE). DWYANE MCCOLLUM MAKES IT! Assist: Luka Butler
Score: 50-45

[00:39] Team_097 possession (Score: 50-45)
Miles Banchero drives to the basket... Miles Banchero throws a bad pass! Stolen by Shai Thompson! TURNOVER! (live ball)

[00:30] Team_073 possession (Score: 50-45)
Dwyane McCollum attempts a 3Pt. Contested by Miles Dosunmu (2.6 feet, MAN). Dwyane McCollum misses. Rebound secured by Joel Simons.

[00:16] Team_097 possession (Score: 50-45)
Joel Simons attempts a 3Pt. Contested by Shai Thompson (2.2 feet, MAN). Joel Simons misses. Rebound secured by Ja Rose.

================================================================================
                              2ND QUARTER COMPLETE                              
================================================================================

2ND QUARTER SCORE: Team_073 27, Team_097 28

BOX SCORE:
================================================================================

Team_073
--------------------------------------------------------------------------------
Player                MIN  PTS  REB  AST  TO      FG   FG%      3P   3P%
--------------------------------------------------------------------------------
Dwyane McCollum         6   10    3    0   0   5/7    71.4     0/0   0.0
Carmelo Young          19    7    0    0   0   3/3   100.0     0/0   0.0
Karl Williamson        19    5    0    1   0   2/5    40.0     0/0   0.0
Luka Butler             6    2    0    1   0   1/1   100.0     0/0   0.0
Carmelo Porzingis      19    1    2    0   0   1/2    50.0     0/0   0.0
Isaiah Smith           19    0    1    1   0   0/1     0.0     0/0   0.0
Bradley Morant         19    0    3    0   0   0/0     0.0     0/0   0.0
Ja Rose                 6    0    3    0   0   0/0     0.0     0/0   0.0
Zach Quickley           6    0    0    0   0   0/2     0.0     0/0   0.0
Shai Thompson           6    0    0    1   0   0/0     0.0     0/0   0.0

TEAM: FG: 12/21 (57.1%), 3PT: 4/9 (44.4%), REB: 12 (3 off, 9 def), AST: 4, TO: 1
TEAM FOULS: 5 [Team_097 in BONUS]


Team_097
--------------------------------------------------------------------------------
Player                MIN  PTS  REB  AST  TO      FG   FG%      3P   3P%
--------------------------------------------------------------------------------
Anthony Haliburton     19    7    1    0   0   3/5    60.0     0/0   0.0
Shai Poole             19    5    3    1   0   2/3    66.7     0/0   0.0
Jrue Haliburton        19    3    0    2   0   1/3    33.3     0/0   0.0
Gary Carter             6    3    0    0   0   1/2    50.0     0/0   0.0
Joel Simons             6    3    4    0   0   1/2    50.0     0/0   0.0
Dwyane Ginobili         6    2    0    0   0   1/1   100.0     0/0   0.0
Miles Banchero          6    2    0    0   0   1/3    33.3     0/0   0.0
Evan Brogdon           19    0    0    2   0   0/0     0.0     0/0   0.0
Tyrese Stewart         19    0    3    1   0   0/0     0.0     0/0   0.0
Miles Dosunmu           6    0    1    1   0   0/1     0.0     0/0   0.0

TEAM: FG: 10/20 (50.0%), 3PT: 3/5 (60.0%), REB: 12 (3 off, 9 def), AST: 7, TO: 2
TEAM FOULS: 7 [Team_073 in BONUS]

================================================================================

================================================================================
                       3RD QUARTER - Team_073 vs Team_097                       
================================================================================

[12:00] Team_073 possession (Score: 50-45)
Karl Williamson attempts a 3Pt. Contested by Jrue Haliburton (4.2 feet, ZONE). Karl Williamson misses. Offensive rebound by Bradley Morant! Bradley Morant kicks it out.

[11:50] Team_073 possession (Score: 50-45)
Isaiah Smith attempts a 3Pt. Contested by Shai Poole (5.5 feet, ZONE). Isaiah Smith misses. Rebound secured by Anthony Haliburton.

[11:38] Team_097 possession (Score: 50-45)
Tyrese Stewart attempts a 3Pt. Wide open! Bradley Morant is 8.1 feet away. [MAN] TYRESE STEWART MAKES IT! Assist: Shai Poole
Score: 50-48

[11:28] Team_073 possession (Score: 50-48)
Karl Williamson attempts a Midrange. Wide open! Jrue Haliburton is 6.1 feet away. [ZONE] Karl Williamson misses. Rebound secured by Anthony Haliburton.

[11:11] Team_097 possession (Score: 50-48)
FOUL! Reach-in foul on Carmelo Porzingis during the drive. [Team fouls: 1] No free throws, side out. (Carmelo Porzingis: 1 personal fouls)

[10:56] Team_097 possession (Score: 50-48)
FOUL! Holding foul on Karl Williamson. [Team fouls: 2] No free throws, side out. (Karl Williamson: 1 personal fouls)

[10:41] Team_097 possession (Score: 50-48)
Anthony Haliburton attempts a 3Pt. Contested by Carmelo Porzingis (4.0 feet, MAN). Anthony Haliburton misses. Rebound secured by Carmelo Porzingis.

[10:31] Team_073 possession (Score: 50-48)
Bradley Morant attempts a 3Pt. Contested by Shai Poole (3.0 feet, ZONE). Bradley Morant misses. Rebound secured by Anthony Haliburton.

[10:19] Team_097 possession (Score: 50-48)
Tyrese Stewart attempts a Layup. Contested by Bradley Morant (5.9 feet, MAN). TYRESE STEWART MAKES IT! Assist: Anthony Haliburton
Score: 50-50

[10:02] Team_073 possession (Score: 50-50)
Karl Williamson attempts a 3Pt. Contested by Shai Poole (2.2 feet, MAN). Karl Williamson misses. Rebound secured by Tyrese Stewart.

[09:51] Team_097 possession (Score: 50-50)
Evan Brogdon attempts a 3Pt. Contested by Karl Williamson (5.3 feet, ZONE). Evan Brogdon misses. Rebound secured by Isaiah Smith.

[09:36] Team_073 possession (Score: 50-50)
Carmelo Young makes the Layup and draws the foul on Jrue Haliburton! And-1! Carmelo Young to the line for 1. [Team fouls: 1] (Jrue Haliburton: 1 personal fouls)   FT 1/1: GOOD Carmelo Young makes 1/1 from the line.
Score: 53-50

[09:23] Team_097 possession (Score: 53-50)
Shai Poole attempts a 3Pt. Contested by Karl Williamson (4.5 feet, MAN). SHAI POOLE MAKES IT! Assist: Tyrese Stewart
Score: 53-53

[09:11] Team_073 possession (Score: 53-53)
Isaiah Smith attempts a 3Pt. Contested by Jrue Haliburton (5.2 feet, MAN). Isaiah Smith misses. Offensive rebound by Bradley Morant! Bradley Morant kicks it out.

[09:00] Team_073 possession (Score: 53-53)
Carmelo Porzingis attempts a Layup. Heavily contested by Anthony Haliburton (0.5 feet, ZONE)! CARMELO PORZINGIS MAKES IT! Assist: Karl Williamson
Score: 55-53

[08:45] Team_097 possession (Score: 55-53)
FOUL! Reach-in foul on Bradley Morant during the drive. [Team fouls: 3] No free throws, side out. (Bradley Morant: 1 personal fouls)

[08:31] Team_097 possession (Score: 55-53)
FOUL! Shooting foul on Karl Williamson. Jrue Haliburton to the line for 3 free throws. [Team fouls: 4] (Karl Williamson: 2 personal fouls)   FT 1/3: GOOD   FT 2/3: GOOD   FT 3/3: GOOD Jrue Haliburton makes 3/3 from the line.
Score: 55-56

[08:15] Team_073 possession (Score: 55-56)
Carmelo Young drives and kicks out. Carmelo Young attempts a 3Pt. Contested by Shai Poole (4.7 feet, ZONE). Carmelo Young misses. Rebound secured by Shai Poole.

[08:03] Team_097 possession (Score: 55-56)
Tyrese Stewart attempts a Midrange. Wide open! Bradley Morant is 7.1 feet away. [MAN] TYRESE STEWART MAKES IT!
Score: 55-58

[07:44] Team_073 possession (Score: 55-58)
Isaiah Smith attempts a 3Pt. Contested by Jrue Haliburton (5.7 feet, MAN). ISAIAH SMITH MAKES IT! Assist: Carmelo Young
Score: 58-58

[07:30] Team_097 possession (Score: 58-58)
Evan Brogdon attempts a 3Pt. Wide open! Karl Williamson is 7.8 feet away. [ZONE] Evan Brogdon misses. Rebound secured by Carmelo Porzingis.

[07:16] Team_073 possession (Score: 58-58)
FOUL! Reach-in foul on Tyrese Stewart during the drive. [Team fouls: 2] No free throws, side out. (Tyrese Stewart: 1 personal fouls)

[07:06] Team_073 possession (Score: 58-58)
Bradley Morant makes the Layup and draws the foul on Anthony Haliburton! And-1! Bradley Morant to the line for 1. [Team fouls: 3] (Anthony Haliburton: 1 personal fouls)   FT 1/1: GOOD Bradley Morant makes 1/1 from the line.
Score: 61-58

[06:55] Team_097 possession (Score: 61-58)
Tyrese Stewart attempts a 3Pt. Contested by Karl Williamson (3.4 feet, ZONE). Tyrese Stewart misses. Rebound secured by Isaiah Smith.

[06:38] Team_073 possession (Score: 61-58)
Karl Williamson attempts a 3Pt. Heavily contested by Shai Poole (1.8 feet, MAN)! Karl Williamson misses. Offensive rebound by Carmelo Porzingis! Carmelo Porzingis kicks it out.

[06:24] Team_073 possession (Score: 61-58)
Isaiah Smith attempts a 3Pt. Wide open! Jrue Haliburton is 7.7 feet away. [MAN] Isaiah Smith misses. Rebound secured by Anthony Haliburton.

[06:10] Team_097 possession (Score: 61-58)
Jrue Haliburton drives, picks up Bradley Morant. Help arrives from Isaiah Smith! Jrue Haliburton attempts a Dunk. Contested by Isaiah Smith (5.4 feet, ZONE). JRUE HALIBURTON MAKES IT! Assist: Evan Brogdon
Score: 61-60

[05:56] Team_073 possession (Score: 61-60)
Carmelo Porzingis drives, Anthony Haliburton stays with him. Carmelo Porzingis attempts a Dunk. Heavily contested by Anthony Haliburton (1.4 feet, ZONE)! CARMELO PORZINGIS MAKES IT!
Score: 63-60

[05:46] Team_097 possession (Score: 63-60)
Jrue Haliburton attempts a 3Pt. Contested by Karl Williamson (2.7 feet, ZONE). Jrue Haliburton misses. FOUL! Loose ball foul on Isaiah Smith during the rebound battle. [IN THE BONUS! 5 team fouls] Anthony Haliburton to the line for 2 free throws. (Isaiah Smith: 1 personal fouls)   FT 1/2: GOOD   FT 2/2: MISS Anthony Haliburton makes 1/2 from the line. Rebound secured by Bradley Morant.
Score: 63-61

[05:34] Team_073 possession (Score: 63-61)
Isaiah Smith drives, Jrue Haliburton stays with him. Isaiah Smith attempts a Layup. Wide open! Jrue Haliburton is 7.4 feet away. [MAN] ISAIAH SMITH MAKES IT! Assist: Carmelo Porzingis
Score: 65-61

[05:20] Team_097 possession (Score: 65-61)
Anthony Haliburton drives, Bradley Morant stays with him. Anthony Haliburton attempts a Dunk. Contested by Bradley Morant (4.4 feet, ZONE). Anthony Haliburton misses. Rebound secured by Carmelo Porzingis.

[05:06] Team_073 possession (Score: 65-61)
Carmelo Porzingis attempts a 3Pt. Wide open! Anthony Haliburton is 7.8 feet away. [MAN] Carmelo Porzingis misses. Offensive rebound by Carmelo Porzingis! Carmelo Porzingis kicks it out.

[04:49] Team_073 possession (Score: 65-61)
Isaiah Smith attempts a 3Pt. Heavily contested by Shai Poole (0.5 feet, ZONE)! Isaiah Smith misses. Rebound secured by Anthony Haliburton.

[04:35] Team_097 possession (Score: 65-61)
Shai Poole attempts a 3Pt. Contested by Karl Williamson (5.1 feet, ZONE). Shai Poole misses. Rebound secured by Isaiah Smith.

[04:23] Team_073 possession (Score: 65-61)
Isaiah Smith attempts a 3Pt. Wide open! Jrue Haliburton is 8.4 feet away. [MAN] ISAIAH SMITH MAKES IT! Assist: Karl Williamson
Score: 68-61

[04:04] Team_097 possession (Score: 68-61)
Jrue Haliburton attempts a 3Pt. Contested by Isaiah Smith (4.2 feet, MAN). Jrue Haliburton misses. Rebound secured by Carmelo Porzingis.

[03:49] Team_073 possession (Score: 68-61)
Isaiah Smith attempts a Midrange. Wide open! Jrue Haliburton is 7.8 feet away. [MAN] ISAIAH SMITH MAKES IT!
Score: 70-61

[03:33] Team_097 possession (Score: 70-61)
Anthony Haliburton attempts a Midrange. Contested by Isaiah Smith (3.9 feet, ZONE). Anthony Haliburton misses. Rebound secured by Carmelo Porzingis.

[03:19] Team_073 possession (Score: 70-61)
Carmelo Young throws a bad pass! Stolen by Evan Brogdon! TURNOVER! (live ball)

[03:06] Team_097 possession (Score: 70-61)
Anthony Haliburton drives, Bradley Morant stays with him. Anthony Haliburton attempts a Dunk. Wide open! Bradley Morant is 8.0 feet away. [ZONE] ANTHONY HALIBURTON MAKES IT! Assist: Evan Brogdon
Score: 70-63

[02:55] Team_073 possession (Score: 70-63)
FOUL! Holding foul on Anthony Haliburton. [Team fouls: 4] No free throws, side out. (Anthony Haliburton: 2 personal fouls)

[02:38] Team_073 possession (Score: 70-63)
FOUL! Shooting foul on Jrue Haliburton. Carmelo Young to the line for 2 free throws. [BONUS: 5 team fouls] (Jrue Haliburton: 2 personal fouls)   FT 1/2: GOOD   FT 2/2: GOOD Carmelo Young makes 2/2 from the line.
Score: 72-63

[02:23] Team_097 possession (Score: 72-63)
Shai Poole makes the Dunk and draws the foul on Karl Williamson! And-1! Shai Poole to the line for 1. [BONUS: 6 team fouls] (Karl Williamson: 3 personal fouls)   FT 1/1: MISS Shai Poole makes 0/1 from the line. Rebound secured by Bradley Morant.
Score: 72-65

[02:09] Team_073 possession (Score: 72-65)
Carmelo Porzingis attempts a 3Pt. Contested by Shai Poole (5.0 feet, ZONE). Carmelo Porzingis misses. Offensive rebound by Bradley Morant! Bradley Morant kicks it out.

[01:52] Team_073 possession (Score: 72-65)
Carmelo Young attempts a Midrange. Contested by Anthony Haliburton (4.8 feet, ZONE). Carmelo Young misses. Rebound secured by Tyrese Stewart.

[01:39] Team_097 possession (Score: 72-65)
Shai Poole attempts a 3Pt. Heavily contested by Karl Williamson (1.2 feet, ZONE)! Shai Poole misses. Rebound secured by Isaiah Smith.

[01:22] Team_073 possession (Score: 72-65)
Carmelo Young drives and kicks out. Carmelo Young attempts a Midrange. Wide open! Evan Brogdon is 7.8 feet away. [MAN] CARMELO YOUNG MAKES IT!
Score: 74-65

[01:10] Team_097 possession (Score: 74-65)
Jrue Haliburton attempts a Layup. Contested by Isaiah Smith (2.5 feet, MAN). JRUE HALIBURTON MAKES IT! Assist: Tyrese Stewart
Score: 74-67

[00:59] Team_073 possession (Score: 74-67)
FOUL! Shooting foul on Anthony Haliburton. Isaiah Smith to the line for 2 free throws. [BONUS: 6 team fouls] (Anthony Haliburton: 3 personal fouls)   FT 1/2: GOOD   FT 2/2: MISS Isaiah Smith makes 1/2 from the line. Rebound secured by Anthony Haliburton.
Score: 75-67

[00:44] Team_097 possession (Score: 75-67)
Evan Brogdon attempts a Layup. BLOCKED BY BRADLEY MORANT! Ball is loose! Rebound secured by Isaiah Smith.

[00:31] Team_073 possession (Score: 75-67)
Carmelo Young drives to the basket... Carmelo Young loses the ball! Stripped by Evan Brogdon! TURNOVER! (live ball)

[00:18] Team_097 possession (Score: 75-67)
Tyrese Stewart attempts a Layup. Contested by Bradley Morant (3.1 feet, ZONE). Tyrese Stewart misses. Rebound secured by Bradley Morant.

================================================================================
                              3RD QUARTER COMPLETE                              
================================================================================

3RD QUARTER SCORE: Team_073 25, Team_097 22

BOX SCORE:
================================================================================

Team_073
--------------------------------------------------------------------------------
Player                MIN  PTS  REB  AST  TO      FG   FG%      3P   3P%
--------------------------------------------------------------------------------
Isaiah Smith           31   10    5    0   0   4/8    50.0     0/0   0.0
Carmelo Young          31    7    0    1   0   3/5    60.0     0/0   0.0
Carmelo Porzingis      31    4    7    1   0   2/2   100.0     0/0   0.0
Bradley Morant         31    3    6    0   0   1/2    50.0     0/0   0.0
Karl Williamson        31    0    0    2   0   0/2     0.0     0/0   0.0

TEAM: FG: 10/19 (52.6%), 3PT: 2/7 (28.6%), REB: 17 (5 off, 12 def), AST: 4, TO: 2
TEAM FOULS: 6 [Team_097 in BONUS]


Team_097
--------------------------------------------------------------------------------
Player                MIN  PTS  REB  AST  TO      FG   FG%      3P   3P%
--------------------------------------------------------------------------------
Tyrese Stewart         31    7    2    2   0   3/5    60.0     0/0   0.0
Jrue Haliburton        31    7    0    0   0   3/5    60.0     0/0   0.0
Shai Poole             31    3    1    1   0   1/4    25.0     0/0   0.0
Anthony Haliburton     31    2    6    1   0   1/4    25.0     0/0   0.0
Evan Brogdon           31    0    0    2   0   0/3     0.0     0/0   0.0

TEAM: FG: 8/21 (38.1%), 3PT: 3/11 (27.3%), REB: 10 (1 off, 9 def), AST: 6, TO: 0
TEAM FOULS: 6 [Team_073 in BONUS]

================================================================================

================================================================================
                       4TH QUARTER - Team_073 vs Team_097                       
================================================================================

[12:00] Team_073 possession (Score: 75-67)
Carmelo Young attempts a 3Pt. Contested by Evan Brogdon (3.7 feet, MAN). Carmelo Young misses. Rebound secured by Tyrese Stewart.

[11:46] Team_097 possession (Score: 75-67)
Anthony Haliburton attempts a Layup. Wide open! Carmelo Porzingis is 6.5 feet away. [MAN] ANTHONY HALIBURTON MAKES IT! Assist: Shai Poole
Score: 75-69

[11:31] Team_073 possession (Score: 75-69)
Carmelo Young attempts a 3Pt. Contested by Evan Brogdon (2.3 feet, MAN). CARMELO YOUNG MAKES IT! Assist: Isaiah Smith
Score: 78-69

[11:17] Team_097 possession (Score: 78-69)
FOUL! Reach-in foul on Bradley Morant during the drive. [Team fouls: 1] No free throws, side out. (Bradley Morant: 1 personal fouls)

[11:04] Team_097 possession (Score: 78-69)
Shai Poole attempts a Layup. Wide open! Bradley Morant is 6.9 feet away. [ZONE] SHAI POOLE MAKES IT!
Score: 78-71

[10:49] Team_073 possession (Score: 78-71)
FOUL! Shooting foul on Shai Poole. Karl Williamson to the line for 2 free throws. [Team fouls: 1] (Shai Poole: 1 personal fouls)   FT 1/2: GOOD   FT 2/2: GOOD Karl Williamson makes 2/2 from the line.
Score: 80-71

[10:34] Team_097 possession (Score: 80-71)
Tyrese Stewart drives and kicks out. Evan Brogdon attempts a Midrange. Wide open! Carmelo Young is 9.5 feet away. [ZONE] Evan Brogdon misses. Rebound secured by Carmelo Porzingis.

[10:18] Team_073 possession (Score: 80-71)
Bradley Morant drives, Tyrese Stewart stays with him. Bradley Morant attempts a Dunk. Contested by Tyrese Stewart (3.5 feet, MAN). Bradley Morant misses. Rebound secured by Anthony Haliburton.

[10:05] Team_097 possession (Score: 80-71)
Anthony Haliburton makes the Dunk and draws the foul on Bradley Morant! And-1! Anthony Haliburton to the line for 1. [Team fouls: 2] (Bradley Morant: 2 personal fouls)   FT 1/1: MISS Anthony Haliburton makes 0/1 from the line. Rebound secured by Isaiah Smith.
Score: 80-73

[09:49] Team_073 possession (Score: 80-73)
Carmelo Young drives to the basket... FOUL! Offensive foul on Carmelo Young! Anthony Haliburton drew the charge! [Team fouls: 3] (Carmelo Young: 1 personal fouls) TURNOVER! (dead ball)

[09:33] Team_097 possession (Score: 80-73)
Tyrese Stewart attempts a Midrange. Contested by Karl Williamson (2.6 feet, ZONE). Tyrese Stewart misses. Rebound secured by Bradley Morant.

[09:19] Team_073 possession (Score: 80-73)
Bradley Morant drives, Tyrese Stewart stays with him. Bradley Morant attempts a Dunk. Contested by Tyrese Stewart (5.8 feet, ZONE). BRADLEY MORANT MAKES IT! Assist: Isaiah Smith
Score: 82-73

[09:09] Team_097 possession (Score: 82-73)
Jrue Haliburton throws a bad pass! Stolen by Isaiah Smith! TURNOVER! (live ball)

[08:55] Team_073 possession (Score: 82-73)
Bradley Morant drives to the basket... Bradley Morant loses control! Ball rolls out of bounds! TURNOVER! (dead ball)

[08:55] Substitution (Team_073): Carmelo Young OUT → Zach Quickley IN (stamina_rule2)

[08:55] Substitution (Team_073): Isaiah Smith OUT → Luka Butler IN (stamina_rule2)

[08:55] Substitution (Team_073): Karl Williamson OUT → Dwyane McCollum IN (stamina_rule2)

[08:55] Substitution (Team_073): Carmelo Porzingis OUT → Shai Thompson IN (stamina_rule2)

[08:55] Substitution (Team_073): Bradley Morant OUT → Ja Rose IN (stamina_rule2)

[08:55] Substitution (Team_097): Evan Brogdon OUT → Gary Carter IN (stamina_rule2)

[08:55] Substitution (Team_097): Jrue Haliburton OUT → Dwyane Ginobili IN (stamina_rule2)

[08:55] Substitution (Team_097): Shai Poole OUT → Miles Dosunmu IN (stamina_rule2)

[08:55] Substitution (Team_097): Anthony Haliburton OUT → Joel Simons IN (stamina_rule2)

[08:55] Substitution (Team_097): Tyrese Stewart OUT → Miles Banchero IN (stamina_rule2)

[08:43] Team_097 possession (Score: 82-73)
Dwyane Ginobili attempts a Layup. Contested by Shai Thompson (4.9 feet, ZONE). Dwyane Ginobili misses. Rebound secured by Ja Rose.

[08:26] Team_073 possession (Score: 82-73)
Dwyane McCollum attempts a Layup. Contested by Miles Dosunmu (2.1 feet, MAN). DWYANE MCCOLLUM MAKES IT!
Score: 84-73

[08:11] Team_097 possession (Score: 84-73)
Miles Banchero loses control! Ball rolls out of bounds! TURNOVER! (dead ball)

[07:57] Team_073 possession (Score: 84-73)
Luka Butler attempts a 3Pt. Heavily contested by Dwyane Ginobili (1.2 feet, MAN)! LUKA BUTLER MAKES IT! Assist: Ja Rose
Score: 87-73

[07:47] Team_097 possession (Score: 87-73)
Miles Banchero drives to the basket... Miles Banchero throws a bad pass out of bounds! TURNOVER! (dead ball)

[07:34] Team_073 possession (Score: 87-73)
Ja Rose attempts a Layup. Contested by Joel Simons (3.5 feet, ZONE). Ja Rose misses. FOUL! Loose ball foul on Joel Simons during the rebound battle. [Team fouls: 2] No free throws, side out. (Joel Simons: 1 personal fouls)

[07:22] Team_073 possession (Score: 87-73)
Shai Thompson attempts a 3Pt. Contested by Joel Simons (5.3 feet, MAN). Shai Thompson misses. Rebound secured by Miles Banchero.

[07:08] Team_097 possession (Score: 87-73)
Miles Dosunmu attempts a 3Pt. Contested by Luka Butler (5.9 feet, ZONE). Miles Dosunmu misses. Rebound secured by Shai Thompson.

[06:49] Team_073 possession (Score: 87-73)
Zach Quickley attempts a Layup. Contested by Gary Carter (3.4 feet, MAN). ZACH QUICKLEY MAKES IT! Assist: Dwyane McCollum
Score: 89-73

[06:35] Team_097 possession (Score: 89-73)
Gary Carter attempts a 3Pt. Wide open! Luka Butler is 7.7 feet away. [ZONE] Gary Carter misses. Rebound secured by Dwyane McCollum.

[06:20] Team_073 possession (Score: 89-73)
Ja Rose drives, picks up Joel Simons. Help arrives from Dwyane Ginobili! Ja Rose attempts a Dunk. Wide open! Dwyane Ginobili is 6.4 feet away. [MAN] JA ROSE MAKES IT! Assist: Dwyane McCollum
Score: 91-73

[06:06] Team_097 possession (Score: 91-73)
FOUL! Reach-in foul on Dwyane McCollum during the drive. [Team fouls: 4] No free throws, side out. (Dwyane McCollum: 1 personal fouls)

[05:50] Team_097 possession (Score: 91-73)
Miles Dosunmu attempts a 3Pt. Wide open! Dwyane McCollum is 6.9 feet away. [MAN] MILES DOSUNMU MAKES IT! Assist: Joel Simons
Score: 91-76

[05:35] Team_073 possession (Score: 91-76)
Shai Thompson drives, picks up Joel Simons. Help arrives from Dwyane Ginobili! Shai Thompson attempts a Layup. Contested by Dwyane Ginobili (4.7 feet, ZONE). SHAI THOMPSON MAKES IT!
Score: 93-76

[05:15] Team_097 possession (Score: 93-76)
Gary Carter attempts a 3Pt. Contested by Luka Butler (3.5 feet, ZONE). GARY CARTER MAKES IT! Assist: Miles Dosunmu
Score: 93-79

[04:57] Team_073 possession (Score: 93-79)
Zach Quickley attempts a Layup. Contested by Joel Simons (3.4 feet, ZONE). Zach Quickley misses. Offensive rebound by Ja Rose! Ja Rose kicks it out.

[04:46] Team_073 possession (Score: 93-79)
Ja Rose attempts a 3Pt. Contested by Joel Simons (2.7 feet, ZONE). Ja Rose misses. FOUL! Loose ball foul on Miles Dosunmu during the rebound battle. [Team fouls: 3] No free throws, side out. (Miles Dosunmu: 1 personal fouls)

[04:30] Team_073 possession (Score: 93-79)
Zach Quickley drives, Gary Carter stays with him. Zach Quickley attempts a Dunk. Wide open! Gary Carter is 8.0 feet away. [MAN] ZACH QUICKLEY MAKES IT! Assist: Ja Rose
Score: 95-79

[04:16] Team_097 possession (Score: 95-79)
Joel Simons loses control! Ball rolls out of bounds! TURNOVER! (dead ball)

[04:00] Team_073 possession (Score: 95-79)
Shai Thompson attempts a Midrange. Contested by Joel Simons (2.0 feet, MAN). Shai Thompson misses. Rebound secured by Miles Dosunmu.

[03:49] Team_097 possession (Score: 95-79)
Joel Simons attempts a 3Pt. Heavily contested by Dwyane McCollum (1.9 feet, ZONE)! Joel Simons misses. Rebound secured by Dwyane McCollum.

[03:32] Team_073 possession (Score: 95-79)
Zach Quickley makes the 3Pt and draws the foul on Gary Carter! And-1! Zach Quickley to the line for 1. [Team fouls: 4] (Gary Carter: 1 personal fouls)   FT 1/1: GOOD Zach Quickley makes 1/1 from the line.
Score: 99-79

[03:16] Team_097 possession (Score: 99-79)
FOUL! Shooting foul on Shai Thompson. Gary Carter to the line for 2 free throws. [BONUS: 5 team fouls] (Shai Thompson: 1 personal fouls)   FT 1/2: GOOD   FT 2/2: GOOD Gary Carter makes 2/2 from the line.
Score: 99-81

[02:58] Team_073 possession (Score: 99-81)
Shai Thompson drives and kicks out. Ja Rose attempts a Midrange. Contested by Joel Simons (4.5 feet, MAN). Ja Rose misses. Offensive rebound by Ja Rose! Ja Rose kicks it out.

[02:46] Team_073 possession (Score: 99-81)
Dwyane McCollum attempts a Midrange. Contested by Gary Carter (4.6 feet, ZONE). Dwyane McCollum misses. Rebound secured by Joel Simons.

[02:29] Team_097 possession (Score: 99-81)
Miles Dosunmu attempts a 3Pt. Wide open! Dwyane McCollum is 7.3 feet away. [MAN] Miles Dosunmu misses. Rebound secured by Dwyane McCollum.

[02:15] Team_073 possession (Score: 99-81)
Ja Rose attempts a Layup. Contested by Joel Simons (4.2 feet, ZONE). Ja Rose misses. Rebound secured by Miles Dosunmu.

[02:00] Team_097 possession (Score: 99-81)
Dwyane Ginobili attempts a Layup. Contested by Luka Butler (5.5 feet, MAN). Dwyane Ginobili misses. Rebound secured by Dwyane McCollum.

[01:43] Team_073 possession (Score: 99-81)
Ja Rose attempts a Layup. Contested by Joel Simons (5.7 feet, MAN). JA ROSE MAKES IT! Assist: Luka Butler
Score: 101-81

[01:25] Team_097 possession (Score: 101-81)
Gary Carter attempts a 3Pt. Contested by Zach Quickley (4.1 feet, MAN). Gary Carter misses. Rebound secured by Shai Thompson.

[01:10] Team_073 possession (Score: 101-81)
Luka Butler drives and kicks out. Luka Butler attempts a Midrange. Wide open! Dwyane Ginobili is 8.0 feet away. [MAN] LUKA BUTLER MAKES IT!
Score: 103-81

[00:57] Team_097 possession (Score: 103-81)
Miles Dosunmu attempts a 3Pt. Contested by Dwyane McCollum (2.6 feet, MAN). MILES DOSUNMU MAKES IT! Assist: Miles Banchero
Score: 103-84

[00:43] Team_073 possession (Score: 103-84)
Ja Rose attempts a Layup. BLOCKED BY DWYANE GINOBILI! Ball is loose! Rebound secured by Miles Dosunmu.

[00:29] Team_097 possession (Score: 103-84)
Dwyane Ginobili attempts a Midrange. Contested by Luka Butler (4.8 feet, MAN). Dwyane Ginobili misses. Rebound secured by Shai Thompson.

[00:18] Team_073 possession (Score: 103-84)
Ja Rose drives, Miles Banchero stays with him. Ja Rose attempts a Dunk. Contested by Miles Banchero (3.9 feet, ZONE). JA ROSE MAKES IT! Assist: Shai Thompson
Score: 105-84

[00:07] Team_097 possession (Score: 105-84)
Miles Banchero attempts a Layup. Contested by Shai Thompson (2.1 feet, ZONE). MILES BANCHERO MAKES IT! Assist: Dwyane Ginobili
Score: 105-86

================================================================================
                              4TH QUARTER COMPLETE                              
================================================================================

4TH QUARTER SCORE: Team_073 30, Team_097 19

BOX SCORE:
================================================================================

Team_073
--------------------------------------------------------------------------------
Player                MIN  PTS  REB  AST  TO      FG   FG%      3P   3P%
--------------------------------------------------------------------------------
Zach Quickley          14    8    0    0   0   3/3   100.0     0/0   0.0
Ja Rose                14    6    5    2   0   3/5    60.0     0/0   0.0
Luka Butler            14    5    0    1   0   2/2   100.0     0/0   0.0
Carmelo Young          34    3    0    0   0   1/2    50.0     0/0   0.0
Karl Williamson        34    2    0    0   0   1/1   100.0     0/0   0.0
Bradley Morant         34    2    1    0   0   1/2    50.0     0/0   0.0
Dwyane McCollum        14    2    4    2   0   1/2    50.0     0/0   0.0
Shai Thompson          14    2    3    1   0   1/3    33.3     0/0   0.0
Isaiah Smith           34    0    1    2   0   0/0     0.0     0/0   0.0
Carmelo Porzingis      34    0    1    0   0   0/0     0.0     0/0   0.0

TEAM: FG: 13/20 (65.0%), 3PT: 3/5 (60.0%), REB: 15 (4 off, 11 def), AST: 8, TO: 2
TEAM FOULS: 5 [Team_097 in BONUS]


Team_097
--------------------------------------------------------------------------------
Player                MIN  PTS  REB  AST  TO      FG   FG%      3P   3P%
--------------------------------------------------------------------------------
Miles Dosunmu          14    6    3    1   0   2/4    50.0     0/0   0.0
Gary Carter            14    5    0    0   0   2/4    50.0     0/0   0.0
Anthony Haliburton     34    2    1    0   0   1/2    50.0     0/0   0.0
Shai Poole             34    2    0    1   0   1/1   100.0     0/0   0.0
Miles Banchero         14    2    1    1   0   1/1   100.0     0/0   0.0
Tyrese Stewart         34    0    1    0   0   0/2     0.0     0/0   0.0
Dwyane Ginobili        14    0    0    1   0   0/3     0.0     0/0   0.0
Joel Simons            14    0    1    1   0   0/1     0.0     0/0   0.0

TEAM: FG: 7/18 (38.9%), 3PT: 3/8 (37.5%), REB: 7 (0 off, 7 def), AST: 5, TO: 4
TEAM FOULS: 4

================================================================================

================================================================================
                               FULL GAME COMPLETE                               
================================================================================

FINAL SCORE: Team_073 105, Team_097 86

SCORING BY QUARTER:
--------------------------------------------------------------------------------
Team                     Q1     Q2     Q3     Q4    FINAL
--------------------------------------------------------------------------------
Team_073                 23     27     25     30      105
Team_097                 17     28     22     19       86
--------------------------------------------------------------------------------

FULL GAME BOX SCORE:
================================================================================

Team_073
--------------------------------------------------------------------------------
Player                MIN  PTS  REB  AST  TO      FG   FG%      3P   3P%      FT STL BLK
--------------------------------------------------------------------------------
Carmelo Young          34   19    0    2   1   8/12   66.7   2/4    50.0   5/5     1   0
Isaiah Smith           34   13    9    4   1   4/11   36.4   2/6    33.3   1/2     2   0
Karl Williamson        34   14    0    4   2   5/12   41.7   1/3    33.3   5/7     0   0
Carmelo Porzingis      34   10   12    2   1   5/8    62.5   1/3    33.3   1/2     0   0
Bradley Morant         34   11   14    1   1   5/9    55.6   1/2    50.0   2/2     0   1
Zach Quickley          14    8    0    0   0   3/5    60.0   1/2    50.0   1/2     0   1
Luka Butler            14    7    0    2   0   3/3   100.0   1/1   100.0   0/0     0   0
Dwyane McCollum        14   12    7    2   0   4/7    57.1   1/3    33.3   6/7     0   0
Shai Thompson          14    2    3    2   0   1/3    33.3   0/1     0.0   0/0     1   1
Ja Rose                14    6    8    2   0   4/6    66.7   1/1   100.0   0/0     0   0

TEAM: FG: 44/78 (56.4%), 3PT: 11/26 (42.3%), REB: 52 (16 off, 36 def), AST: 21, TO: 6


Team_097
--------------------------------------------------------------------------------
Player                MIN  PTS  REB  AST  TO      FG   FG%      3P   3P%      FT STL BLK
--------------------------------------------------------------------------------
Evan Brogdon           34   11    0    5   2   4/8    50.0   3/6    50.0   0/0     2   0
Jrue Haliburton        34   10    0    3   2   4/9    44.4   2/5    40.0   3/3     1   0
Shai Poole             34   12   10    6   0   5/9    55.6   2/4    50.0   0/1     1   0
Anthony Haliburton     34   15   12    3   4   7/14   50.0   1/2    50.0   1/4     0   0
Tyrese Stewart         34    7    8    3   1   3/8    37.5   1/2    50.0   0/0     0   0
Gary Carter            14    8    0    0   1   3/6    50.0   1/3    33.3   4/5     0   0
Dwyane Ginobili        14    2    0    1   0   1/4    25.0   0/0     0.0   0/0     0   1
Miles Dosunmu          14    6    4    2   0   2/5    40.0   2/5    40.0   0/0     0   0
Joel Simons            14    3    5    1   2   1/3    33.3   0/2     0.0   1/1     0   0
Miles Banchero         14    4    1    1   1   2/4    50.0   0/0     0.0   0/0     0   0

TEAM: FG: 32/70 (45.7%), 3PT: 12/29 (41.4%), REB: 41 (7 off, 34 def), AST: 25, TO: 13

================================================================================
