================================================================================
                        FULL GAME - Team_056 vs Team_034                        
================================================================================

================================================================================
                       1ST QUARTER - Team_056 vs Team_034                       
================================================================================

[12:00] Team_056 possession (Score: 0-0)
Magic Russell drives and kicks out. FOUL! Shooting foul on Ben Hyland. Giannis Jokic to the line for 2 free throws. [Team fouls: 1] (Ben Hyland: 1 personal fouls)   FT 1/2: MISS   FT 2/2: MISS Giannis Jokic makes 0/2 from the line. FOUL! Loose ball foul on Anthony Bane during the free throw rebound! [Team fouls: 2] No free throws, side out. (Anthony Bane: 1 personal fouls)

[11:40] Team_056 possession (Score: 0-0)
FOUL! Shooting foul on Ben Hyland. Magic Russell to the line for 2 free throws. [Team fouls: 3] (Ben Hyland: 2 personal fouls)   FT 1/2: GOOD   FT 2/2: GOOD Magic Russell makes 2/2 from the line.
Score: 2-0

[11:26] Team_034 possession (Score: 2-0)
Ben Hyland makes the Layup and draws the foul on Giannis Jokic! And-1! Ben Hyland to the line for 1. [Team fouls: 1] (Giannis Jokic: 1 personal fouls)   FT 1/1: GOOD Ben Hyland makes 1/1 from the line.
Score: 2-3

[11:16] Team_056 possession (Score: 2-3)
Giannis Jokic attempts a 3Pt. Contested by Devin Poole (5.3 feet, MAN). GIANNIS JOKIC MAKES IT! Assist: Tony Carter
Score: 5-3

[11:02] Team_034 possession (Score: 5-3)
Terry Doncic attempts a Midrange. Contested by Jrue Lillard (3.1 feet, MAN). Terry Doncic misses. Rebound secured by Jrue Lillard.

[10:52] Team_056 possession (Score: 5-3)
Jrue Lillard attempts a 3Pt. Contested by Terry Doncic (4.2 feet, MAN). Jrue Lillard misses. Rebound secured by Cole Antetokounmpo.

[10:40] Team_034 possession (Score: 5-3)
Devin Poole drives and kicks out. Ben Hyland attempts a Midrange. Wide open! Magic Russell is 7.0 feet away. [MAN] BEN HYLAND MAKES IT! Assist: Devin Poole
Score: 5-5

[10:23] Team_056 possession (Score: 5-5)
Tony Carter drives to the basket... Tony Carter throws a bad pass out of bounds! TURNOVER! (dead ball)

[10:08] Team_034 possession (Score: 5-5)
Terry Doncic makes the Layup and draws the foul on Yao Poole! And-1! Terry Doncic to the line for 1. [Team fouls: 2] (Yao Poole: 1 personal fouls)   FT 1/1: GOOD Terry Doncic makes 1/1 from the line.
Score: 5-8

[09:49] Team_056 possession (Score: 5-8)
Tony Carter attempts a 3Pt. Contested by Cole Antetokounmpo (5.4 feet, MAN). Tony Carter misses. Rebound secured by Anthony Bane.

[09:38] Team_034 possession (Score: 5-8)
Devin Poole attempts a Midrange. Contested by Tony Carter (3.8 feet, ZONE). DEVIN POOLE MAKES IT!
Score: 5-10

[09:22] Team_056 possession (Score: 5-10)
Yao Poole attempts a Midrange. Contested by Anthony Bane (3.9 feet, MAN). Yao Poole misses. FOUL! Loose ball foul on Anthony Bane during the rebound battle. [Team fouls: 4] No free throws, side out. (Anthony Bane: 2 personal fouls)

[09:04] Team_056 possession (Score: 5-10)
Magic Russell attempts a 3Pt. Contested by Ben Hyland (2.8 feet, MAN). MAGIC RUSSELL MAKES IT! Assist: Tony Carter
Score: 8-10

[08:52] Team_034 possession (Score: 8-10)
Devin Poole attempts a 3Pt. Contested by Giannis Jokic (4.1 feet, MAN). Devin Poole misses. Rebound secured by Yao Poole.

[08:38] Team_056 possession (Score: 8-10)
Yao Poole attempts a Layup. Contested by Terry Doncic (2.2 feet, ZONE). YAO POOLE MAKES IT! Assist: Magic Russell
Score: 10-10

[08:21] Team_034 possession (Score: 10-10)
Anthony Bane attempts a Midrange. Contested by Yao Poole (5.7 feet, MAN). Anthony Bane misses. Rebound secured by Tony Carter.

[08:08] Team_056 possession (Score: 10-10)
Magic Russell attempts a Layup. Contested by Terry Doncic (5.8 feet, ZONE). MAGIC RUSSELL MAKES IT! Assist: Giannis Jokic
Score: 12-10

[07:56] Team_034 possession (Score: 12-10)
Cole Antetokounmpo drives to the basket... Cole Antetokounmpo loses the ball! Stripped by Tony Carter! TURNOVER! (live ball)

[07:43] Team_056 possession (Score: 12-10)
Yao Poole drives and kicks out. Tony Carter attempts a 3Pt. Contested by Terry Doncic (2.8 feet, ZONE). Tony Carter misses. Offensive rebound by Yao Poole! Yao Poole kicks it out.

[07:33] Team_056 possession (Score: 12-10)
Magic Russell attempts a 3Pt. Wide open! Devin Poole is 9.4 feet away. [ZONE] Magic Russell misses. Rebound secured by Cole Antetokounmpo.

[07:22] Team_034 possession (Score: 12-10)
FOUL! Offensive foul on Terry Doncic! Jrue Lillard drew the charge! [Team fouls: 5] (Terry Doncic: 1 personal fouls) TURNOVER! (dead ball)

[07:07] Team_056 possession (Score: 12-10)
Giannis Jokic drives and kicks out. Giannis Jokic attempts a Midrange. Contested by Devin Poole (3.9 feet, ZONE). GIANNIS JOKIC MAKES IT! Assist: Tony Carter
Score: 14-10

[06:55] Team_034 possession (Score: 14-10)
Cole Antetokounmpo attempts a 3Pt. Contested by Tony Carter (3.1 feet, MAN). Cole Antetokounmpo misses. Offensive rebound by Anthony Bane! Anthony Bane kicks it out.

[06:42] Team_034 possession (Score: 14-10)
FOUL! Shooting foul on Yao Poole. Anthony Bane to the line for 2 free throws. [Team fouls: 3] (Yao Poole: 2 personal fouls)   FT 1/2: GOOD   FT 2/2: MISS Anthony Bane makes 1/2 from the line. Rebound secured by Tony Carter.
Score: 14-11

[06:27] Team_056 possession (Score: 14-11)
Jrue Lillard drives to the basket... FOUL! Offensive foul on Jrue Lillard! Terry Doncic drew the charge! [Team fouls: 4] (Jrue Lillard: 1 personal fouls) TURNOVER! (dead ball)

[06:13] Team_034 possession (Score: 14-11)
Ben Hyland attempts a 3Pt. Contested by Magic Russell (2.1 feet, MAN). Ben Hyland misses. Rebound secured by Yao Poole.

[06:04] Team_056 possession (Score: 14-11)
Magic Russell attempts a 3Pt. Contested by Ben Hyland (5.8 feet, ZONE). MAGIC RUSSELL MAKES IT! Assist: Tony Carter
Score: 17-11

[05:53] Team_034 possession (Score: 17-11)
Ben Hyland attempts a Layup. Contested by Jrue Lillard (3.6 feet, ZONE). BEN HYLAND MAKES IT! Assist: Devin Poole
Score: 17-13

[05:36] Team_056 possession (Score: 17-13)
Tony Carter attempts a 3Pt. Contested by Devin Poole (4.1 feet, ZONE). Tony Carter misses. Rebound secured by Anthony Bane.

[05:23] Team_034 possession (Score: 17-13)
Cole Antetokounmpo attempts a Midrange. Contested by Tony Carter (3.0 feet, MAN). COLE ANTETOKOUNMPO MAKES IT! Assist: Anthony Bane
Score: 17-15

[05:06] Team_056 possession (Score: 17-15)
Jrue Lillard attempts a 3Pt. Contested by Terry Doncic (2.9 feet, MAN). Jrue Lillard misses. Rebound secured by Terry Doncic.

[04:50] Team_034 possession (Score: 17-15)
Ben Hyland makes the Dunk and draws the foul on Jrue Lillard! And-1! Ben Hyland to the line for 1. [BONUS: 5 team fouls] (Jrue Lillard: 2 personal fouls)   FT 1/1: GOOD Ben Hyland makes 1/1 from the line.
Score: 17-18

[04:34] Team_056 possession (Score: 17-18)
Giannis Jokic attempts a 3Pt. Heavily contested by Devin Poole (1.5 feet, MAN)! Giannis Jokic misses. Rebound secured by Terry Doncic.

[04:20] Team_034 possession (Score: 17-18)
Devin Poole drives, picks up Giannis Jokic. Help arrives from Tony Carter! Devin Poole attempts a Layup. Wide open! Tony Carter is 8.0 feet away. [MAN] DEVIN POOLE MAKES IT! Assist: Anthony Bane
Score: 17-20

[04:05] Team_056 possession (Score: 17-20)
Yao Poole makes the Dunk and draws the foul on Anthony Bane! And-1! Yao Poole to the line for 1. [BONUS: 6 team fouls] (Anthony Bane: 3 personal fouls)   FT 1/1: GOOD Yao Poole makes 1/1 from the line.
Score: 20-20

[03:50] Team_034 possession (Score: 20-20)
Terry Doncic attempts a Layup. Contested by Jrue Lillard (4.5 feet, ZONE). TERRY DONCIC MAKES IT! Assist: Cole Antetokounmpo
Score: 20-22

[03:36] Team_056 possession (Score: 20-22)
Yao Poole attempts a Midrange. Contested by Cole Antetokounmpo (3.8 feet, ZONE). Yao Poole misses. FOUL! Loose ball foul on Anthony Bane during the rebound battle. [IN THE BONUS! 7 team fouls] Yao Poole to the line for 2 free throws. (Anthony Bane: 4 personal fouls)   FT 1/2: GOOD   FT 2/2: GOOD Yao Poole makes 2/2 from the line.
Score: 22-22

[03:22] Team_034 possession (Score: 22-22)
FOUL! Shooting foul on Jrue Lillard. Cole Antetokounmpo to the line for 2 free throws. [BONUS: 6 team fouls] (Jrue Lillard: 3 personal fouls)   FT 1/2: GOOD   FT 2/2: GOOD Cole Antetokounmpo makes 2/2 from the line.
Score: 22-24

[03:07] Team_056 possession (Score: 22-24)
Jrue Lillard attempts a 3Pt. Contested by Terry Doncic (4.1 feet, MAN). Jrue Lillard misses. Offensive rebound by Jrue Lillard! Jrue Lillard's putback is no good. Offensive rebound by Jrue Lillard! Jrue Lillard kicks it out.

[02:55] Team_056 possession (Score: 22-24)
Yao Poole attempts a Midrange. Contested by Cole Antetokounmpo (4.3 feet, ZONE). YAO POOLE MAKES IT! Assist: Jrue Lillard
Score: 24-24

[02:40] Team_034 possession (Score: 24-24)
FOUL! Reach-in foul on Giannis Jokic during the drive. [IN THE BONUS! 7 team fouls] Devin Poole to the line for 2 free throws. (Giannis Jokic: 2 personal fouls)   FT 1/2: GOOD   FT 2/2: GOOD Devin Poole makes 2/2 from the line.
Score: 24-26

[02:25] Team_056 possession (Score: 24-26)
Tony Carter attempts a 3Pt. Wide open! Cole Antetokounmpo is 6.0 feet away. [MAN] Tony Carter misses. Rebound secured by Anthony Bane.

[02:06] Team_034 possession (Score: 24-26)
FOUL! Reach-in foul on Jrue Lillard during the drive. [IN THE BONUS! 8 team fouls] Anthony Bane to the line for 2 free throws. (Jrue Lillard: 4 personal fouls)   FT 1/2: GOOD   FT 2/2: GOOD Anthony Bane makes 2/2 from the line.
Score: 24-28

[01:54] Team_056 possession (Score: 24-28)
FOUL! Shooting foul on Terry Doncic. Yao Poole to the line for 2 free throws. [BONUS: 8 team fouls] (Terry Doncic: 2 personal fouls)   FT 1/2: GOOD   FT 2/2: GOOD Yao Poole makes 2/2 from the line.
Score: 26-28

[01:38] Team_034 possession (Score: 26-28)
Cole Antetokounmpo drives to the basket... Cole Antetokounmpo loses the ball! Stripped by Tony Carter! TURNOVER! (live ball)

[01:20] Team_056 possession (Score: 26-28)
Giannis Jokic attempts a Layup. Wide open! Devin Poole is 8.3 feet away. [MAN] Giannis Jokic misses. Rebound secured by Anthony Bane.

[01:07] Team_034 possession (Score: 26-28)
Terry Doncic attempts a Layup. Wide open! Jrue Lillard is 8.8 feet away. [ZONE] TERRY DONCIC MAKES IT! Assist: Ben Hyland
Score: 26-30

[00:53] Team_056 possession (Score: 26-30)
Jrue Lillard attempts a Layup. Wide open! Terry Doncic is 6.3 feet away. [MAN] JRUE LILLARD MAKES IT! Assist: Tony Carter
Score: 28-30

[00:39] Team_034 possession (Score: 28-30)
FOUL! Shooting foul on Jrue Lillard. Terry Doncic to the line for 2 free throws. [BONUS: 9 team fouls] (Jrue Lillard: 5 personal fouls)   FT 1/2: GOOD   FT 2/2: GOOD Terry Doncic makes 2/2 from the line.
Score: 28-32

[00:22] Team_056 possession (Score: 28-32)
Magic Russell makes the Dunk and draws the foul on Cole Antetokounmpo! And-1! Magic Russell to the line for 1. [BONUS: 9 team fouls] (Cole Antetokounmpo: 1 personal fouls)   FT 1/1: GOOD Magic Russell makes 1/1 from the line.
Score: 31-32

[00:08] Team_034 possession (Score: 31-32)
Terry Doncic drives to the basket... Terry Doncic throws a bad pass! Stolen by Jrue Lillard! TURNOVER! (live ball)

================================================================================
                              1ST QUARTER COMPLETE                              
================================================================================

1ST QUARTER SCORE: Team_056 31, Team_034 32

BOX SCORE:
================================================================================

Team_056
--------------------------------------------------------------------------------
Player                MIN  PTS  REB  AST  TO      FG   FG%      3P   3P%
--------------------------------------------------------------------------------
Magic Russell          12   13    0    1   0   5/6    83.3     0/0   0.0
Yao Poole              12   11    4    0   0   5/5   100.0     0/0   0.0
Giannis Jokic          12    5    0    1   0   2/4    50.0     0/0   0.0
Jrue Lillard           12    2    3    1   0   1/3    33.3     0/0   0.0
Tony Carter            12    0    2    5   0   0/3     0.0     0/0   0.0

TEAM: FG: 13/21 (61.9%), 3PT: 3/10 (30.0%), REB: 9 (4 off, 5 def), AST: 8, TO: 2
TEAM FOULS: 9 [Team_034 in BONUS]


Team_034
--------------------------------------------------------------------------------
Player                MIN  PTS  REB  AST  TO      FG   FG%      3P   3P%
--------------------------------------------------------------------------------
Ben Hyland             12   10    0    1   0   4/5    80.0     0/0   0.0
Terry Doncic           12    9    2    0   0   4/5    80.0     0/0   0.0
Devin Poole            12    6    0    2   0   3/4    75.0     0/0   0.0
Cole Antetokounmpo     12    4    2    1   0   2/2   100.0     0/0   0.0
Anthony Bane           12    2    5    2   0   1/3    33.3     0/0   0.0

TEAM: FG: 14/19 (73.7%), 3PT: 0/2 (0.0%), REB: 9 (1 off, 8 def), AST: 6, TO: 4
TEAM FOULS: 9 [Team_056 in BONUS]

================================================================================

================================================================================
                       2ND QUARTER - Team_056 vs Team_034                       
================================================================================

[12:00] Team_056 possession (Score: 31-32)
Jrue Lillard attempts a Midrange. Contested by Ben Hyland (5.7 feet, ZONE). Jrue Lillard misses. Rebound secured by Cole Antetokounmpo.

[11:45] Team_034 possession (Score: 31-32)
Terry Doncic attempts a 3Pt. Heavily contested by Jrue Lillard (1.0 feet, MAN)! TERRY DONCIC MAKES IT! Assist: Cole Antetokounmpo
Score: 31-35

[11:33] Team_056 possession (Score: 31-35)
FOUL! Holding foul on Devin Poole. [Team fouls: 1] No free throws, side out. (Devin Poole: 1 personal fouls)

[11:20] Team_056 possession (Score: 31-35)
Yao Poole makes the Layup and draws the foul on Terry Doncic! And-1! Yao Poole to the line for 1. [Team fouls: 2] (Terry Doncic: 1 personal fouls)   FT 1/1: GOOD Yao Poole makes 1/1 from the line.
Score: 34-35

[11:08] Team_034 possession (Score: 34-35)
Devin Poole throws a bad pass! Stolen by Giannis Jokic! TURNOVER! (live ball)

[10:54] Team_056 possession (Score: 34-35)
FOUL! Offensive foul on Yao Poole! Anthony Bane drew the charge! [Team fouls: 1] (Yao Poole: 1 personal fouls) TURNOVER! (dead ball)

[10:41] Team_034 possession (Score: 34-35)
Cole Antetokounmpo attempts a 3Pt. Contested by Tony Carter (5.1 feet, MAN). Cole Antetokounmpo misses. Offensive rebound by Anthony Bane! Anthony Bane kicks it out.

[10:25] Team_034 possession (Score: 34-35)
Anthony Bane attempts a Layup. Wide open! Yao Poole is 6.0 feet away. [ZONE] ANTHONY BANE MAKES IT! Assist: Ben Hyland
Score: 34-37

[10:10] Team_056 possession (Score: 34-37)
Jrue Lillard attempts a 3Pt. Wide open! Terry Doncic is 6.5 feet away. [MAN] JRUE LILLARD MAKES IT! Assist: Yao Poole
Score: 37-37

[09:57] Team_034 possession (Score: 37-37)
Terry Doncic attempts a 3Pt. Wide open! Jrue Lillard is 10.0 feet away. [MAN] TERRY DONCIC MAKES IT! Assist: Anthony Bane
Score: 37-40

[09:41] Team_056 possession (Score: 37-40)
FOUL! Reach-in foul on Devin Poole during the drive. [Team fouls: 3] No free throws, side out. (Devin Poole: 2 personal fouls)

[09:25] Team_056 possession (Score: 37-40)
Magic Russell drives to the basket... Magic Russell throws a bad pass! Stolen by Terry Doncic! TURNOVER! (live ball)

[09:08] Team_034 possession (Score: 37-40)
Terry Doncic attempts a 3Pt. Wide open! Giannis Jokic is 6.7 feet away. [ZONE] Terry Doncic misses. Rebound secured by Jrue Lillard.

[08:53] Team_056 possession (Score: 37-40)
Yao Poole attempts a Midrange. Contested by Ben Hyland (2.6 feet, ZONE). Yao Poole misses. Offensive rebound by Yao Poole! Yao Poole kicks it out.

[08:36] Team_056 possession (Score: 37-40)
Giannis Jokic drives, picks up Devin Poole. Help arrives from Ben Hyland! Giannis Jokic attempts a Layup. Contested by Ben Hyland (4.3 feet, MAN). GIANNIS JOKIC MAKES IT! Assist: Magic Russell
Score: 39-40

[08:17] Team_034 possession (Score: 39-40)
Devin Poole attempts a 3Pt. Heavily contested by Giannis Jokic (1.9 feet, ZONE)! DEVIN POOLE MAKES IT! Assist: Terry Doncic
Score: 39-43

[08:04] Team_056 possession (Score: 39-43)
Magic Russell attempts a 3Pt. Contested by Ben Hyland (2.5 feet, ZONE). Magic Russell misses. Offensive rebound by Jrue Lillard! Jrue Lillard puts it back in!
Score: 41-43

[07:49] Team_034 possession (Score: 41-43)
Terry Doncic drives, picks up Jrue Lillard. Help arrives from Giannis Jokic! Terry Doncic attempts a Dunk. Wide open! Giannis Jokic is 6.3 feet away. [MAN] TERRY DONCIC MAKES IT!
Score: 41-45

[07:34] Team_056 possession (Score: 41-45)
Jrue Lillard attempts a Midrange. Wide open! Cole Antetokounmpo is 8.5 feet away. [ZONE] Jrue Lillard misses. Rebound secured by Terry Doncic.

[07:18] Team_034 possession (Score: 41-45)
Anthony Bane attempts a Midrange. Contested by Yao Poole (5.0 feet, MAN). Anthony Bane misses. Offensive rebound by Anthony Bane! Anthony Bane kicks it out.

[07:03] Team_034 possession (Score: 41-45)
Anthony Bane attempts a Midrange. Contested by Magic Russell (4.2 feet, ZONE). ANTHONY BANE MAKES IT!
Score: 41-47

[06:47] Team_056 possession (Score: 41-47)
FOUL! Offensive foul on Yao Poole! Anthony Bane drew the charge! [Team fouls: 2] (Yao Poole: 2 personal fouls) TURNOVER! (dead ball)

[06:33] Team_034 possession (Score: 41-47)
Terry Doncic attempts a 3Pt. Contested by Jrue Lillard (4.2 feet, MAN). Terry Doncic misses. Rebound secured by Tony Carter.

[06:16] Team_056 possession (Score: 41-47)
Yao Poole attempts a 3Pt. Contested by Anthony Bane (3.2 feet, MAN). Yao Poole misses. Offensive rebound by Jrue Lillard! Jrue Lillard puts it back in!
Score: 43-47

[06:00] Team_034 possession (Score: 43-47)
Devin Poole attempts a Midrange. Contested by Giannis Jokic (4.3 feet, MAN). Devin Poole misses. Rebound secured by Tony Carter.

[05:45] Team_056 possession (Score: 43-47)
Tony Carter attempts a 3Pt. Wide open! Devin Poole is 7.4 feet away. [ZONE] Tony Carter misses. Offensive rebound by Jrue Lillard! Jrue Lillard kicks it out.

[05:29] Team_056 possession (Score: 43-47)
Tony Carter drives and kicks out. Giannis Jokic attempts a 3Pt. Contested by Devin Poole (2.7 feet, MAN). GIANNIS JOKIC MAKES IT! Assist: Tony Carter
Score: 46-47

[05:14] Team_034 possession (Score: 46-47)
Cole Antetokounmpo attempts a Layup. Wide open! Jrue Lillard is 6.3 feet away. [ZONE] COLE ANTETOKOUNMPO MAKES IT!
Score: 46-49

[04:58] Team_056 possession (Score: 46-49)
FOUL! Reach-in foul on Anthony Bane during the drive. [Team fouls: 4] No free throws, side out. (Anthony Bane: 1 personal fouls)

[04:44] Team_056 possession (Score: 46-49)
Yao Poole drives, picks up Anthony Bane. Help arrives from Ben Hyland! Yao Poole attempts a Dunk. Contested by Ben Hyland (4.3 feet, MAN). YAO POOLE MAKES IT! Assist: Magic Russell
Score: 48-49

[04:30] Team_034 possession (Score: 48-49)
Ben Hyland makes the 3Pt and draws the foul on Magic Russell! And-1! Ben Hyland to the line for 1. [Team fouls: 3] (Magic Russell: 1 personal fouls)   FT 1/1: GOOD Ben Hyland makes 1/1 from the line.
Score: 48-53

[04:16] Team_056 possession (Score: 48-53)
Magic Russell attempts a 3Pt. Contested by Devin Poole (4.4 feet, ZONE). MAGIC RUSSELL MAKES IT! Assist: Giannis Jokic
Score: 51-53

[03:58] Team_034 possession (Score: 51-53)
Terry Doncic attempts a Midrange. Wide open! Magic Russell is 6.2 feet away. [ZONE] TERRY DONCIC MAKES IT!
Score: 51-55

[03:41] Team_056 possession (Score: 51-55)
Yao Poole attempts a 3Pt. Contested by Terry Doncic (3.5 feet, ZONE). Yao Poole misses. Rebound secured by Anthony Bane.

[03:27] Team_034 possession (Score: 51-55)
Anthony Bane attempts a 3Pt. Wide open! Giannis Jokic is 7.5 feet away. [ZONE] ANTHONY BANE MAKES IT! Assist: Cole Antetokounmpo
Score: 51-58

[03:13] Team_056 possession (Score: 51-58)
Yao Poole attempts a Midrange. Contested by Anthony Bane (4.9 feet, MAN). Yao Poole misses. Rebound secured by Anthony Bane.

[02:53] Team_034 possession (Score: 51-58)
FOUL! Reach-in foul on Jrue Lillard during the drive. [Team fouls: 4] No free throws, side out. (Jrue Lillard: 1 personal fouls)

[02:35] Team_034 possession (Score: 51-58)
Devin Poole attempts a 3Pt. Heavily contested by Jrue Lillard (0.5 feet, ZONE)! Devin Poole misses. Rebound secured by Jrue Lillard.

[02:23] Team_056 possession (Score: 51-58)
Giannis Jokic attempts a 3Pt. Wide open! Devin Poole is 7.3 feet away. [ZONE] GIANNIS JOKIC MAKES IT! Assist: Yao Poole
Score: 54-58

[02:08] Team_034 possession (Score: 54-58)
Cole Antetokounmpo attempts a 3Pt. Contested by Tony Carter (2.6 feet, MAN). Cole Antetokounmpo misses. Rebound secured by Tony Carter.

[01:54] Team_056 possession (Score: 54-58)
Jrue Lillard attempts a Layup. Wide open! Terry Doncic is 8.9 feet away. [MAN] JRUE LILLARD MAKES IT! Assist: Giannis Jokic
Score: 56-58

[01:42] Team_034 possession (Score: 56-58)
FOUL! Reach-in foul on Jrue Lillard during the drive. [IN THE BONUS! 5 team fouls] Devin Poole to the line for 2 free throws. (Jrue Lillard: 2 personal fouls)   FT 1/2: MISS   FT 2/2: GOOD Devin Poole makes 1/2 from the line.
Score: 56-59

[01:29] Team_056 possession (Score: 56-59)
FOUL! Holding foul on Devin Poole. [IN THE BONUS! 5 team fouls] Giannis Jokic to the line for 2 free throws. (Devin Poole: 3 personal fouls)   FT 1/2: GOOD   FT 2/2: GOOD Giannis Jokic makes 2/2 from the line.
Score: 58-59

[01:17] Team_034 possession (Score: 58-59)
Devin Poole attempts a 3Pt. Wide open! Giannis Jokic is 10.0 feet away. [MAN] Devin Poole misses. Rebound secured by Yao Poole.

[01:03] Team_056 possession (Score: 58-59)
Tony Carter attempts a 3Pt. Wide open! Cole Antetokounmpo is 6.3 feet away. [MAN] Tony Carter misses. Rebound secured by Anthony Bane.

[00:51] Team_034 possession (Score: 58-59)
Anthony Bane drives and kicks out. Terry Doncic attempts a 3Pt. Contested by Jrue Lillard (5.9 feet, MAN). Terry Doncic misses. Rebound secured by Tony Carter.

[00:32] Team_056 possession (Score: 58-59)
Magic Russell attempts a 3Pt. Wide open! Devin Poole is 9.8 feet away. [ZONE] MAGIC RUSSELL MAKES IT! Assist: Tony Carter
Score: 61-59

[00:17] Team_034 possession (Score: 61-59)
Ben Hyland drives, picks up Magic Russell. Help arrives from Tony Carter! Ben Hyland attempts a Dunk. Wide open! Tony Carter is 10.0 feet away. [MAN] Ben Hyland misses. FOUL! Loose ball foul on Tony Carter during the rebound battle. [IN THE BONUS! 6 team fouls] Terry Doncic to the line for 2 free throws. (Tony Carter: 1 personal fouls)   FT 1/2: MISS   FT 2/2: GOOD Terry Doncic makes 1/2 from the line.
Score: 61-60

[00:06] Team_056 possession (Score: 61-60)
Yao Poole drives to the basket... FOUL! Offensive foul on Yao Poole! Terry Doncic drew the charge! [Team fouls: 7] (Yao Poole: 3 personal fouls) TURNOVER! (dead ball)

================================================================================
                              2ND QUARTER COMPLETE                              
================================================================================

2ND QUARTER SCORE: Team_056 30, Team_034 28

BOX SCORE:
================================================================================

Team_056
--------------------------------------------------------------------------------
Player                MIN  PTS  REB  AST  TO      FG   FG%      3P   3P%
--------------------------------------------------------------------------------
Giannis Jokic          24   10    0    2   0   4/4   100.0     0/0   0.0
Jrue Lillard           24    9    5    0   0   4/6    66.7     0/0   0.0
Magic Russell          24    6    0    2   0   2/2   100.0     0/0   0.0
Yao Poole              24    5    2    2   0   2/4    50.0     0/0   0.0
Tony Carter            24    0    4    2   0   0/1     0.0     0/0   0.0

TEAM: FG: 12/17 (70.6%), 3PT: 6/8 (75.0%), REB: 11 (4 off, 7 def), AST: 8, TO: 4
TEAM FOULS: 7 [Team_034 in BONUS]


Team_034
--------------------------------------------------------------------------------
Player                MIN  PTS  REB  AST  TO      FG   FG%      3P   3P%
--------------------------------------------------------------------------------
Terry Doncic           24   11    1    1   0   5/7    71.4     0/0   0.0
Anthony Bane           24    7    5    1   0   3/4    75.0     0/0   0.0
Ben Hyland             24    4    0    1   0   1/1   100.0     0/0   0.0
Devin Poole            24    4    0    0   0   2/5    40.0     0/0   0.0
Cole Antetokounmpo     24    2    1    2   0   1/2    50.0     0/0   0.0

TEAM: FG: 12/19 (63.2%), 3PT: 5/10 (50.0%), REB: 7 (2 off, 5 def), AST: 5, TO: 1
TEAM FOULS: 5 [Team_056 in BONUS]

================================================================================

================================================================================
                       3RD QUARTER - Team_056 vs Team_034                       
================================================================================

[12:00] Team_056 possession (Score: 61-60)
Yao Poole attempts a Midrange. Contested by Anthony Bane (4.5 feet, MAN). Yao Poole misses. Rebound secured by Terry Doncic.

[11:46] Team_034 possession (Score: 61-60)
Devin Poole attempts a 3Pt. Contested by Giannis Jokic (5.6 feet, ZONE). DEVIN POOLE MAKES IT! Assist: Cole Antetokounmpo
Score: 61-63

[11:31] Team_056 possession (Score: 61-63)
Jrue Lillard attempts a Midrange. Wide open! Terry Doncic is 9.9 feet away. [MAN] Jrue Lillard misses. Rebound secured by Cole Antetokounmpo.

[11:16] Team_034 possession (Score: 61-63)
Terry Doncic attempts a Midrange. Contested by Tony Carter (3.2 feet, ZONE). Terry Doncic misses. Offensive rebound by Anthony Bane! Anthony Bane kicks it out.

[10:58] Team_034 possession (Score: 61-63)
Terry Doncic drives and kicks out. Cole Antetokounmpo attempts a 3Pt. Wide open! Magic Russell is 6.8 feet away. [ZONE] COLE ANTETOKOUNMPO MAKES IT! Assist: Anthony Bane
Score: 61-66

[10:47] Team_056 possession (Score: 61-66)
FOUL! Holding foul on Terry Doncic. [Team fouls: 1] No free throws, side out. (Terry Doncic: 1 personal fouls)

[10:34] Team_056 possession (Score: 61-66)
Tony Carter attempts a 3Pt. Wide open! Devin Poole is 6.2 feet away. [ZONE] TONY CARTER MAKES IT! Assist: Giannis Jokic
Score: 64-66

[10:19] Team_034 possession (Score: 64-66)
Anthony Bane throws a bad pass out of bounds! TURNOVER! (dead ball)

[10:07] Team_056 possession (Score: 64-66)
Magic Russell attempts a Midrange. Contested by Ben Hyland (2.2 feet, MAN). MAGIC RUSSELL MAKES IT!
Score: 66-66

[09:57] Team_034 possession (Score: 66-66)
FOUL! Reach-in foul on Jrue Lillard during the drive. [Team fouls: 1] No free throws, side out. (Jrue Lillard: 1 personal fouls)

[09:41] Team_034 possession (Score: 66-66)
Ben Hyland attempts a 3Pt. Heavily contested by Giannis Jokic (0.5 feet, ZONE)! Ben Hyland misses. Rebound secured by Yao Poole.

[09:28] Team_056 possession (Score: 66-66)
FOUL! Shooting foul on Cole Antetokounmpo. Yao Poole to the line for 2 free throws. [Team fouls: 2] (Cole Antetokounmpo: 1 personal fouls)   FT 1/2: GOOD   FT 2/2: GOOD Yao Poole makes 2/2 from the line.
Score: 68-66

[09:08] Team_034 possession (Score: 68-66)
Devin Poole drives and kicks out. Cole Antetokounmpo attempts a 3Pt. Heavily contested by Tony Carter (1.1 feet, MAN)! Cole Antetokounmpo misses. Rebound secured by Yao Poole.

[08:50] Team_056 possession (Score: 68-66)
FOUL! Reach-in foul on Terry Doncic during the drive. [Team fouls: 3] No free throws, side out. (Terry Doncic: 2 personal fouls)

[08:36] Team_056 possession (Score: 68-66)
Yao Poole attempts a Midrange. Contested by Anthony Bane (5.9 feet, MAN). YAO POOLE MAKES IT!
Score: 70-66

[08:23] Team_034 possession (Score: 70-66)
FOUL! Shooting foul on Yao Poole. Anthony Bane to the line for 2 free throws. [Team fouls: 2] (Yao Poole: 1 personal fouls)   FT 1/2: GOOD   FT 2/2: GOOD Anthony Bane makes 2/2 from the line.
Score: 70-68

[08:11] Team_056 possession (Score: 70-68)
FOUL! Reach-in foul on Anthony Bane during the drive. [Team fouls: 4] No free throws, side out. (Anthony Bane: 1 personal fouls)

[07:55] Team_056 possession (Score: 70-68)
Yao Poole attempts a Midrange. Contested by Cole Antetokounmpo (2.3 feet, ZONE). YAO POOLE MAKES IT!
Score: 72-68

[07:41] Team_034 possession (Score: 72-68)
Terry Doncic attempts a Midrange. Contested by Magic Russell (3.6 feet, ZONE). Terry Doncic misses. Rebound secured by Jrue Lillard.

[07:23] Team_056 possession (Score: 72-68)
Magic Russell attempts a 3Pt. Contested by Ben Hyland (5.2 feet, MAN). Magic Russell misses. Rebound secured by Cole Antetokounmpo.

[07:07] Team_034 possession (Score: 72-68)
Terry Doncic attempts a 3Pt. Contested by Giannis Jokic (3.0 feet, ZONE). TERRY DONCIC MAKES IT! Assist: Anthony Bane
Score: 72-71

[06:51] Team_056 possession (Score: 72-71)
Jrue Lillard attempts a 3Pt. Contested by Devin Poole (3.7 feet, ZONE). Jrue Lillard misses. Rebound secured by Anthony Bane.

[06:34] Team_034 possession (Score: 72-71)
Cole Antetokounmpo attempts a Midrange. Contested by Tony Carter (5.4 feet, MAN). Cole Antetokounmpo misses. Rebound secured by Tony Carter.

[06:21] Team_056 possession (Score: 72-71)
FOUL! Reach-in foul on Terry Doncic during the drive. [IN THE BONUS! 5 team fouls] Yao Poole to the line for 2 free throws. (Terry Doncic: 3 personal fouls)   FT 1/2: GOOD   FT 2/2: GOOD Yao Poole makes 2/2 from the line.
Score: 74-71

[06:10] Team_034 possession (Score: 74-71)
Anthony Bane drives to the basket... Anthony Bane throws a bad pass! Stolen by Yao Poole! TURNOVER! (live ball)

[05:59] Team_056 possession (Score: 74-71)
Magic Russell attempts a Midrange. Wide open! Ben Hyland is 7.4 feet away. [MAN] Magic Russell misses. Rebound secured by Terry Doncic.

[05:43] Team_034 possession (Score: 74-71)
Terry Doncic throws a bad pass! Stolen by Jrue Lillard! TURNOVER! (live ball)

[05:30] Team_056 possession (Score: 74-71)
Tony Carter attempts a Layup. BLOCKED BY TERRY DONCIC! Ball deflects out of bounds off Tony Carter.

[05:19] Team_034 possession (Score: 74-71)
FOUL! Reach-in foul on Jrue Lillard during the drive. [Team fouls: 3] No free throws, side out. (Jrue Lillard: 2 personal fouls)

[05:04] Team_034 possession (Score: 74-71)
FOUL! Shooting foul on Magic Russell. Cole Antetokounmpo to the line for 2 free throws. [Team fouls: 4] (Magic Russell: 1 personal fouls)   FT 1/2: MISS   FT 2/2: GOOD Cole Antetokounmpo makes 1/2 from the line.
Score: 74-72

[04:53] Team_056 possession (Score: 74-72)
FOUL! Reach-in foul on Terry Doncic during the drive. [IN THE BONUS! 6 team fouls] Tony Carter to the line for 2 free throws. (Terry Doncic: 4 personal fouls)   FT 1/2: MISS   FT 2/2: GOOD Tony Carter makes 1/2 from the line.
Score: 75-72

[04:38] Team_034 possession (Score: 75-72)
FOUL! Shooting foul on Giannis Jokic. Anthony Bane to the line for 2 free throws. [BONUS: 5 team fouls] (Giannis Jokic: 1 personal fouls)   FT 1/2: GOOD   FT 2/2: GOOD Anthony Bane makes 2/2 from the line.
Score: 75-74

[04:25] Team_056 possession (Score: 75-74)
Jrue Lillard attempts a Layup. Contested by Terry Doncic (4.7 feet, MAN). JRUE LILLARD MAKES IT!
Score: 77-74

[04:14] Team_034 possession (Score: 77-74)
Cole Antetokounmpo attempts a Midrange. Wide open! Tony Carter is 6.9 feet away. [MAN] Cole Antetokounmpo misses. Offensive rebound by Terry Doncic! Terry Doncic's putback is no good. Offensive rebound by Terry Doncic! Terry Doncic kicks it out.

[04:02] Team_034 possession (Score: 77-74)
Devin Poole drives to the basket... Devin Poole throws a bad pass out of bounds! TURNOVER! (dead ball)

[03:45] Team_056 possession (Score: 77-74)
Giannis Jokic drives to the basket... Giannis Jokic loses the ball! Stripped by Devin Poole! TURNOVER! (live ball)

[03:33] Team_034 possession (Score: 77-74)
Anthony Bane drives, picks up Jrue Lillard. Help arrives from Giannis Jokic! Anthony Bane attempts a Layup. Contested by Giannis Jokic (4.4 feet, ZONE). Anthony Bane misses. Rebound secured by Yao Poole.

[03:20] Team_056 possession (Score: 77-74)
FOUL! Reach-in foul on Terry Doncic during the drive. [IN THE BONUS! 7 team fouls] Tony Carter to the line for 2 free throws. (Terry Doncic: 5 personal fouls)   FT 1/2: GOOD   FT 2/2: GOOD Tony Carter makes 2/2 from the line.
Score: 79-74

[03:08] Team_034 possession (Score: 79-74)
FOUL! Holding foul on Tony Carter. [IN THE BONUS! 6 team fouls] Cole Antetokounmpo to the line for 2 free throws. (Tony Carter: 1 personal fouls)   FT 1/2: GOOD   FT 2/2: MISS Cole Antetokounmpo makes 1/2 from the line. Rebound secured by Tony Carter.
Score: 79-75

[02:49] Team_056 possession (Score: 79-75)
Jrue Lillard attempts a Midrange. Contested by Terry Doncic (4.0 feet, MAN). JRUE LILLARD MAKES IT!
Score: 81-75

[02:40] Team_034 possession (Score: 81-75)
Terry Doncic attempts a 3Pt. Contested by Giannis Jokic (5.7 feet, ZONE). TERRY DONCIC MAKES IT! Assist: Cole Antetokounmpo
Score: 81-78

[02:29] Team_056 possession (Score: 81-78)
Magic Russell attempts a 3Pt. Wide open! Ben Hyland is 8.1 feet away. [MAN] Magic Russell misses. Offensive rebound by Yao Poole! Yao Poole kicks it out.

[02:11] Team_056 possession (Score: 81-78)
FOUL! Shooting foul on Anthony Bane. Yao Poole to the line for 2 free throws. [BONUS: 8 team fouls] (Anthony Bane: 2 personal fouls)   FT 1/2: GOOD   FT 2/2: GOOD Yao Poole makes 2/2 from the line.
Score: 83-78

[01:58] Team_034 possession (Score: 83-78)
Anthony Bane drives, picks up Yao Poole. Help arrives from Giannis Jokic! Anthony Bane attempts a Dunk. Wide open! Giannis Jokic is 6.6 feet away. [MAN] ANTHONY BANE MAKES IT! Assist: Ben Hyland
Score: 83-80

[01:43] Team_056 possession (Score: 83-80)
Jrue Lillard drives, Terry Doncic stays with him. Jrue Lillard attempts a Dunk. Wide open! Terry Doncic is 7.3 feet away. [MAN] JRUE LILLARD MAKES IT!
Score: 85-80

[01:29] Team_034 possession (Score: 85-80)
Anthony Bane drives to the basket... Anthony Bane throws a bad pass! Stolen by Jrue Lillard! TURNOVER! (live ball)

[01:17] Team_056 possession (Score: 85-80)
Giannis Jokic attempts a Midrange. Heavily contested by Cole Antetokounmpo (2.0 feet, ZONE)! Giannis Jokic misses. Rebound secured by Cole Antetokounmpo.

[01:01] Team_034 possession (Score: 85-80)
Terry Doncic drives and kicks out. Anthony Bane attempts a Midrange. Contested by Giannis Jokic (3.5 feet, ZONE). Anthony Bane misses. FOUL! Loose ball foul on Yao Poole during the rebound battle. [IN THE BONUS! 7 team fouls] Terry Doncic to the line for 2 free throws. (Yao Poole: 2 personal fouls)   FT 1/2: MISS   FT 2/2: MISS Terry Doncic makes 0/2 from the line. Rebound secured by Yao Poole.

[00:44] Team_056 possession (Score: 85-80)
Yao Poole drives, picks up Anthony Bane. Help arrives from Ben Hyland! Yao Poole attempts a Layup. Contested by Ben Hyland (3.8 feet, MAN). YAO POOLE MAKES IT! Assist: Giannis Jokic
Score: 87-80

[00:30] Team_034 possession (Score: 87-80)
Ben Hyland attempts a Layup. Contested by Jrue Lillard (2.1 feet, ZONE). BEN HYLAND MAKES IT! Assist: Cole Antetokounmpo
Score: 87-82

[00:17] Team_056 possession (Score: 87-82)
Magic Russell attempts a Midrange. Wide open! Ben Hyland is 6.6 feet away. [MAN] MAGIC RUSSELL MAKES IT! Assist: Yao Poole
Score: 89-82

[00:05] Team_034 possession (Score: 89-82)
FOUL! Reach-in foul on Jrue Lillard during the drive. [IN THE BONUS! 8 team fouls] Ben Hyland to the line for 2 free throws. (Jrue Lillard: 3 personal fouls)   FT 1/2: GOOD   FT 2/2: GOOD Ben Hyland makes 2/2 from the line.
Score: 89-84

================================================================================
                              3RD QUARTER COMPLETE                              
================================================================================

3RD QUARTER SCORE: Team_056 28, Team_034 24

BOX SCORE:
================================================================================

Team_056
--------------------------------------------------------------------------------
Player                MIN  PTS  REB  AST  TO      FG   FG%      3P   3P%
--------------------------------------------------------------------------------
Yao Poole              36   12    5    1   0   6/7    85.7     0/0   0.0
Jrue Lillard           36    6    1    0   0   3/5    60.0     0/0   0.0
Tony Carter            36    6    2    0   0   3/4    75.0     0/0   0.0
Magic Russell          36    4    0    0   0   2/4    50.0     0/0   0.0
Giannis Jokic          36    0    0    2   0   0/1     0.0     0/0   0.0

TEAM: FG: 14/21 (66.7%), 3PT: 1/3 (33.3%), REB: 7 (1 off, 6 def), AST: 3, TO: 1
TEAM FOULS: 8 [Team_034 in BONUS]


Team_034
--------------------------------------------------------------------------------
Player                MIN  PTS  REB  AST  TO      FG   FG%      3P   3P%
--------------------------------------------------------------------------------
Terry Doncic           36    6    3    0   0   2/4    50.0     0/0   0.0
Anthony Bane           36    6    2    2   0   3/4    75.0     0/0   0.0
Cole Antetokounmpo     36    4    3    3   0   2/3    66.7     0/0   0.0
Ben Hyland             36    4    0    1   0   2/3    66.7     0/0   0.0
Devin Poole            36    3    0    0   0   1/2    50.0     0/0   0.0

TEAM: FG: 10/17 (58.8%), 3PT: 3/4 (75.0%), REB: 9 (3 off, 6 def), AST: 6, TO: 5
TEAM FOULS: 8 [Team_056 in BONUS]

================================================================================

================================================================================
                       4TH QUARTER - Team_056 vs Team_034                       
================================================================================

[12:00] Team_056 possession (Score: 89-84)
FOUL! Reach-in foul on Terry Doncic during the drive. [Team fouls: 1] No free throws, side out. (Terry Doncic: 1 personal fouls)

[11:48] Team_056 possession (Score: 89-84)
Jrue Lillard attempts a Midrange. Wide open! Terry Doncic is 6.3 feet away. [MAN] JRUE LILLARD MAKES IT! Assist: Giannis Jokic
Score: 91-84

[11:33] Team_034 possession (Score: 91-84)
FOUL! Reach-in foul on Jrue Lillard during the drive. [Team fouls: 1] No free throws, side out. (Jrue Lillard: 1 personal fouls)

[11:19] Team_034 possession (Score: 91-84)
Devin Poole attempts a 3Pt. Contested by Giannis Jokic (4.6 feet, MAN). DEVIN POOLE MAKES IT! Assist: Anthony Bane
Score: 91-87

[11:04] Team_056 possession (Score: 91-87)
Tony Carter attempts a 3Pt. Contested by Cole Antetokounmpo (4.8 feet, MAN). Tony Carter misses. Rebound secured by Terry Doncic.

[10:48] Team_034 possession (Score: 91-87)
Devin Poole attempts a Midrange. Contested by Giannis Jokic (2.9 feet, MAN). DEVIN POOLE MAKES IT!
Score: 91-89

[10:32] Team_056 possession (Score: 91-89)
Jrue Lillard loses control! Ball rolls out of bounds! TURNOVER! (dead ball)

[10:32] Substitution (Team_056): Giannis Jokic OUT → De'Aaron Murray IN (stamina_rule2)

[10:32] Substitution (Team_056): Magic Russell OUT → Damian Barrett IN (stamina_rule2)

[10:32] Substitution (Team_056): Tony Carter OUT → CJ Anthony IN (stamina_rule2)

[10:32] Substitution (Team_056): Jrue Lillard OUT → RJ Johnson IN (stamina_rule2)

[10:32] Substitution (Team_056): Yao Poole OUT → Derrick Bane IN (stamina_rule2)

[10:32] Substitution (Team_034): Devin Poole OUT → Manu Jokic IN (stamina_rule2)

[10:32] Substitution (Team_034): Ben Hyland OUT → Damian Turner IN (stamina_rule2)

[10:32] Substitution (Team_034): Cole Antetokounmpo OUT → Vince Paul IN (stamina_rule2)

[10:32] Substitution (Team_034): Terry Doncic OUT → Nikola Wagner IN (stamina_rule2)

[10:32] Substitution (Team_034): Anthony Bane OUT → Carmelo Anunoby IN (stamina_rule2)

[10:20] Team_034 possession (Score: 91-89)
Carmelo Anunoby attempts a Midrange. Contested by RJ Johnson (4.3 feet, ZONE). Carmelo Anunoby misses. Rebound secured by RJ Johnson.

[10:04] Team_056 possession (Score: 91-89)
CJ Anthony attempts a Midrange. Contested by Nikola Wagner (4.7 feet, ZONE). CJ Anthony misses. Rebound secured by Carmelo Anunoby.

[09:54] Team_034 possession (Score: 91-89)
Carmelo Anunoby attempts a 3Pt. Heavily contested by Derrick Bane (0.5 feet, MAN)! Carmelo Anunoby misses. Rebound secured by CJ Anthony.

[09:38] Team_056 possession (Score: 91-89)
Damian Barrett attempts a 3Pt. Contested by Damian Turner (3.3 feet, MAN). Damian Barrett misses. Rebound secured by Vince Paul.

[09:23] Team_034 possession (Score: 91-89)
Manu Jokic attempts a 3Pt. Wide open! De'Aaron Murray is 6.2 feet away. [ZONE] Manu Jokic misses. Rebound secured by Derrick Bane.

[09:11] Team_056 possession (Score: 91-89)
Derrick Bane drives, Carmelo Anunoby stays with him. Derrick Bane attempts a Layup. Wide open! Carmelo Anunoby is 7.0 feet away. [MAN] Derrick Bane misses. Rebound secured by Nikola Wagner.

[08:59] Team_034 possession (Score: 91-89)
Nikola Wagner drives, RJ Johnson stays with him. Nikola Wagner attempts a Layup. Wide open! RJ Johnson is 9.1 feet away. [MAN] NIKOLA WAGNER MAKES IT! Assist: Damian Turner
Score: 91-91

[08:46] Team_056 possession (Score: 91-91)
De'Aaron Murray attempts a Midrange. Contested by Damian Turner (3.7 feet, ZONE). DE'AARON MURRAY MAKES IT!
Score: 93-91

[08:30] Team_034 possession (Score: 93-91)
Nikola Wagner attempts a Layup. Contested by RJ Johnson (3.8 feet, MAN). NIKOLA WAGNER MAKES IT! Assist: Manu Jokic
Score: 93-93

[08:15] Team_056 possession (Score: 93-93)
RJ Johnson attempts a Midrange. Wide open! Damian Turner is 6.2 feet away. [ZONE] RJ JOHNSON MAKES IT! Assist: De'Aaron Murray
Score: 95-93

[08:04] Team_034 possession (Score: 95-93)
Carmelo Anunoby attempts a Layup. Heavily contested by RJ Johnson (1.3 feet, ZONE)! CARMELO ANUNOBY MAKES IT! Assist: Manu Jokic
Score: 95-95

[07:47] Team_056 possession (Score: 95-95)
CJ Anthony attempts a Midrange. Contested by Vince Paul (2.6 feet, MAN). CJ ANTHONY MAKES IT! Assist: De'Aaron Murray
Score: 97-95

[07:30] Team_034 possession (Score: 97-95)
Carmelo Anunoby drives, Derrick Bane stays with him. Carmelo Anunoby attempts a Dunk. Wide open! Derrick Bane is 6.0 feet away. [MAN] CARMELO ANUNOBY MAKES IT! Assist: Vince Paul
Score: 97-97

[07:12] Team_056 possession (Score: 97-97)
CJ Anthony attempts a 3Pt. Contested by Vince Paul (3.6 feet, ZONE). CJ Anthony misses. Rebound secured by Vince Paul.

[06:57] Team_034 possession (Score: 97-97)
Manu Jokic attempts a Midrange. Wide open! De'Aaron Murray is 6.1 feet away. [MAN] MANU JOKIC MAKES IT! Assist: Vince Paul
Score: 97-99

[06:39] Team_056 possession (Score: 97-99)
De'Aaron Murray attempts a 3Pt. Contested by Manu Jokic (4.4 feet, MAN). DE'AARON MURRAY MAKES IT! Assist: RJ Johnson
Score: 100-99

[06:23] Team_034 possession (Score: 100-99)
Carmelo Anunoby drives and kicks out. Manu Jokic attempts a 3Pt. Wide open! Damian Barrett is 7.3 feet away. [ZONE] Manu Jokic misses. Rebound secured by CJ Anthony.

[06:13] Team_056 possession (Score: 100-99)
Damian Barrett attempts a 3Pt. Wide open! Vince Paul is 6.9 feet away. [ZONE] Damian Barrett misses. Rebound secured by Nikola Wagner.

[05:56] Team_034 possession (Score: 100-99)
Carmelo Anunoby attempts a 3Pt. Contested by De'Aaron Murray (5.5 feet, ZONE). Carmelo Anunoby misses. Offensive rebound by Vince Paul! Vince Paul puts it back in!
Score: 100-101

[05:44] Team_056 possession (Score: 100-101)
Derrick Bane makes the Layup and draws the foul on Carmelo Anunoby! And-1! Derrick Bane to the line for 1. [Team fouls: 2] (Carmelo Anunoby: 1 personal fouls)   FT 1/1: GOOD Derrick Bane makes 1/1 from the line.
Score: 103-101

[05:28] Team_034 possession (Score: 103-101)
Damian Turner attempts a Layup. Wide open! RJ Johnson is 6.8 feet away. [ZONE] Damian Turner misses. Offensive rebound by Vince Paul! Vince Paul puts it back in!
Score: 103-103

[05:10] Team_056 possession (Score: 103-103)
FOUL! Holding foul on Nikola Wagner. [Team fouls: 3] No free throws, side out. (Nikola Wagner: 1 personal fouls)

[04:58] Team_056 possession (Score: 103-103)
CJ Anthony attempts a Midrange. Wide open! Vince Paul is 6.1 feet away. [MAN] CJ Anthony misses. Rebound secured by Vince Paul.

[04:48] Team_034 possession (Score: 103-103)
Damian Turner attempts a Midrange. Contested by Damian Barrett (5.9 feet, MAN). DAMIAN TURNER MAKES IT! Assist: Vince Paul
Score: 103-105

[04:32] Team_056 possession (Score: 103-105)
CJ Anthony attempts a Midrange. Contested by Vince Paul (2.2 feet, MAN). CJ Anthony misses. Rebound secured by Vince Paul.

[04:18] Team_034 possession (Score: 103-105)
Vince Paul attempts a 3Pt. Wide open! CJ Anthony is 6.3 feet away. [ZONE] Vince Paul misses. Rebound secured by CJ Anthony.

[04:08] Team_056 possession (Score: 103-105)
Damian Barrett attempts a 3Pt. Wide open! Vince Paul is 6.8 feet away. [ZONE] DAMIAN BARRETT MAKES IT! Assist: De'Aaron Murray
Score: 106-105

[03:52] Team_034 possession (Score: 106-105)
Carmelo Anunoby drives, Derrick Bane stays with him. Carmelo Anunoby attempts a Dunk. Contested by Derrick Bane (4.0 feet, ZONE). Carmelo Anunoby misses. Offensive rebound by Vince Paul! Vince Paul's putback is no good. Rebound secured by CJ Anthony.

[03:37] Team_056 possession (Score: 106-105)
RJ Johnson makes the Layup and draws the foul on Carmelo Anunoby! And-1! RJ Johnson to the line for 1. [Team fouls: 4] (Carmelo Anunoby: 2 personal fouls)   FT 1/1: GOOD RJ Johnson makes 1/1 from the line.
Score: 109-105

[03:21] Team_034 possession (Score: 109-105)
Vince Paul attempts a 3Pt. Wide open! De'Aaron Murray is 6.7 feet away. [ZONE] VINCE PAUL MAKES IT! Assist: Manu Jokic
Score: 109-108

[03:09] Team_056 possession (Score: 109-108)
CJ Anthony attempts a 3Pt. Wide open! Vince Paul is 6.7 feet away. [MAN] CJ Anthony misses. FOUL! Loose ball foul on Vince Paul during the rebound battle. [IN THE BONUS! 5 team fouls] CJ Anthony to the line for 2 free throws. (Vince Paul: 1 personal fouls)   FT 1/2: GOOD   FT 2/2: GOOD CJ Anthony makes 2/2 from the line.
Score: 111-108

[02:55] Team_034 possession (Score: 111-108)
Nikola Wagner attempts a Layup. BLOCKED BY DAMIAN BARRETT! Ball is loose! Rebound secured by RJ Johnson.

[02:43] Team_056 possession (Score: 111-108)
Derrick Bane attempts a Layup. Contested by Carmelo Anunoby (5.6 feet, MAN). DERRICK BANE MAKES IT! Assist: RJ Johnson
Score: 113-108

[02:32] Team_034 possession (Score: 113-108)
Damian Turner drives, picks up RJ Johnson. Help arrives from Damian Barrett! Damian Turner attempts a Dunk. Contested by Damian Barrett (4.6 feet, ZONE). Damian Turner misses. Rebound secured by Derrick Bane.

[02:18] Team_056 possession (Score: 113-108)
CJ Anthony attempts a Layup. Wide open! Vince Paul is 7.4 feet away. [MAN] CJ Anthony misses. Rebound secured by Vince Paul.

[02:07] Team_034 possession (Score: 113-108)
Carmelo Anunoby drives to the basket... Carmelo Anunoby loses the ball! Stripped by Derrick Bane! TURNOVER! (live ball)

[01:48] Team_056 possession (Score: 113-108)
CJ Anthony attempts a 3Pt. Contested by Vince Paul (4.3 feet, MAN). CJ Anthony misses. Offensive rebound by RJ Johnson! RJ Johnson kicks it out.

[01:37] Team_056 possession (Score: 113-108)
CJ Anthony drives, picks up Vince Paul. Help arrives from Damian Turner! CJ Anthony attempts a Dunk. Wide open! Damian Turner is 6.4 feet away. [MAN] CJ Anthony misses. Rebound secured by Nikola Wagner.

[01:23] Team_034 possession (Score: 113-108)
Vince Paul attempts a 3Pt. Contested by CJ Anthony (4.3 feet, MAN). Vince Paul misses. Rebound secured by CJ Anthony.

[01:13] Team_056 possession (Score: 113-108)
Damian Barrett attempts a 3Pt. Contested by Damian Turner (5.2 feet, MAN). Damian Barrett misses. Offensive rebound by CJ Anthony! CJ Anthony kicks it out.

[00:58] Team_056 possession (Score: 113-108)
CJ Anthony attempts a Midrange. Contested by Vince Paul (2.4 feet, ZONE). CJ Anthony misses. Rebound secured by Vince Paul.

[00:48] Team_034 possession (Score: 113-108)
Manu Jokic attempts a Midrange. Contested by RJ Johnson (5.4 feet, ZONE). Manu Jokic misses. Offensive rebound by Vince Paul! Vince Paul kicks it out.

[00:34] Team_034 possession (Score: 113-108)
Manu Jokic attempts a Layup. Wide open! De'Aaron Murray is 6.4 feet away. [MAN] MANU JOKIC MAKES IT! Assist: Vince Paul
Score: 113-110

[00:16] Team_056 possession (Score: 113-110)
CJ Anthony attempts a 3Pt. Contested by Vince Paul (4.4 feet, MAN). CJ Anthony misses. Rebound secured by Nikola Wagner.

[00:03] Team_034 possession (Score: 113-110)
Vince Paul throws a bad pass out of bounds! TURNOVER! (dead ball)

================================================================================
                              4TH QUARTER COMPLETE                              
================================================================================

4TH QUARTER SCORE: Team_056 24, Team_034 26

BOX SCORE:
================================================================================

Team_056
--------------------------------------------------------------------------------
Player                MIN  PTS  REB  AST  TO      FG   FG%      3P   3P%
--------------------------------------------------------------------------------
RJ Johnson             11    5    3    2   0   2/2   100.0     0/0   0.0
Derrick Bane           11    5    2    0   0   2/3    66.7     0/0   0.0
De'Aaron Murray        11    5    0    3   0   2/2   100.0     0/0   0.0
CJ Anthony             11    4    6    0   0   2/10   20.0     0/0   0.0
Damian Barrett         11    3    0    0   0   1/3    33.3     0/0   0.0
Jrue Lillard           38    2    0    0   0   1/1   100.0     0/0   0.0
Giannis Jokic          38    0    0    1   0   0/0     0.0     0/0   0.0
Tony Carter            38    0    0    0   0   0/1     0.0     0/0   0.0

TEAM: FG: 10/22 (45.5%), 3PT: 3/8 (37.5%), REB: 10 (2 off, 8 def), AST: 6, TO: 1
TEAM FOULS: 1


Team_034
--------------------------------------------------------------------------------
Player                MIN  PTS  REB  AST  TO      FG   FG%      3P   3P%
--------------------------------------------------------------------------------
Vince Paul             11    7    9    4   0   3/5    60.0     0/0   0.0
Devin Poole            38    5    0    0   0   2/2   100.0     0/0   0.0
Carmelo Anunoby        11    4    1    0   0   2/6    33.3     0/0   0.0
Manu Jokic             11    4    0    3   0   2/3    66.7     0/0   0.0
Nikola Wagner          11    4    4    0   0   2/3    66.7     0/0   0.0
Damian Turner          11    2    0    1   0   1/2    50.0     0/0   0.0
Anthony Bane           38    0    0    1   0   0/0     0.0     0/0   0.0
Terry Doncic           38    0    1    0   0   0/0     0.0     0/0   0.0

TEAM: FG: 12/21 (57.1%), 3PT: 3/7 (42.9%), REB: 16 (4 off, 12 def), AST: 9, TO: 2
TEAM FOULS: 5 [Team_056 in BONUS]

================================================================================

================================================================================
                               FULL GAME COMPLETE                               
================================================================================

FINAL SCORE: Team_056 113, Team_034 110

SCORING BY QUARTER:
--------------------------------------------------------------------------------
Team                     Q1     Q2     Q3     Q4    FINAL
--------------------------------------------------------------------------------
Team_056                 31     30     28     24      113
Team_034                 32     28     24     26      110
--------------------------------------------------------------------------------

FULL GAME BOX SCORE:
================================================================================

Team_056
--------------------------------------------------------------------------------
Player                MIN  PTS  REB  AST  TO      FG   FG%      3P   3P%      FT STL BLK
--------------------------------------------------------------------------------
Giannis Jokic          38   15    0    6   1   4/7    57.1   2/3    66.7   2/4     1   0
Magic Russell          38   23    0    3   2  10/13   76.9   5/7    71.4   3/3     0   0
Tony Carter            38    6    8    7   1   4/10   40.0   1/6    16.7   3/4     2   0
Jrue Lillard           38   19    9    1   1   7/13   53.8   1/4    25.0   0/0     3   0
Yao Poole              38   28   11    3   3  14/17   82.4   1/2    50.0  12/12    1   0
De'Aaron Murray        11    5    0    3   0   2/2   100.0   1/1   100.0   0/0     0   0
Damian Barrett         11    3    0    0   0   1/3    33.3   1/3    33.3   0/0     0   1
CJ Anthony             11    4    6    0   0   2/10   20.0   1/3    33.3   2/2     0   0
RJ Johnson             11    5    3    2   0   2/2   100.0   0/0     0.0   1/1     0   0
Derrick Bane           11    5    2    0   0   2/3    66.7   0/0     0.0   1/1     1   0

TEAM: FG: 49/81 (60.5%), 3PT: 13/29 (44.8%), REB: 37 (11 off, 26 def), AST: 25, TO: 8


Team_034
--------------------------------------------------------------------------------
Player                MIN  PTS  REB  AST  TO      FG   FG%      3P   3P%      FT STL BLK
--------------------------------------------------------------------------------
Devin Poole            38   18    0    2   2   9/14   64.3   3/6    50.0   3/4     1   0
Ben Hyland             38   18    0    3   4   7/9    77.8   1/3    33.3   5/5     0   0
Cole Antetokounmpo     38   10    6    6   0   4/6    66.7   0/1     0.0   4/6     0   0
Terry Doncic           38   26    7    1   3  11/16   68.8   4/6    66.7   4/7     1   1
Anthony Bane           38   15   12    6   1   7/11   63.6   1/1   100.0   7/8     0   0
Manu Jokic             11    4    0    3   0   2/3    66.7   0/1     0.0   0/0     0   0
Damian Turner          11    2    0    1   1   2/3    66.7   0/0     0.0   0/0     0   0
Vince Paul             11    7    9    4   1   1/3    33.3   1/3    33.3   0/0     0   0
Nikola Wagner          11    4    4    0   0   2/3    66.7   0/0     0.0   0/0     0   0
Carmelo Anunoby        11    4    1    0   0   3/7    42.9   1/2    50.0   0/0     0   0

TEAM: FG: 48/76 (63.2%), 3PT: 11/23 (47.8%), REB: 41 (10 off, 31 def), AST: 26, TO: 12

================================================================================
