================================================================================
                        FULL GAME - Team_056 vs Team_059                        
================================================================================

================================================================================
                       1ST QUARTER - Team_056 vs Team_059                       
================================================================================

[12:00] Team_056 possession (Score: 0-0)
Tony Carter attempts a Midrange. Wide open! John Iverson is 7.9 feet away. [MAN] Tony Carter misses. Rebound secured by Bam Wade.

[11:46] Team_059 possession (Score: 0-0)
Blake Tatum attempts a 3Pt. Contested by Giannis Jokic (5.4 feet, ZONE). Blake Tatum misses. FOUL! Loose ball foul on Yao Poole during the rebound battle. [Team fouls: 1] No free throws, side out. (Yao Poole: 1 personal fouls)

[11:33] Team_059 possession (Score: 0-0)
Blake Tatum attempts a 3Pt. Contested by Giannis Jokic (2.6 feet, ZONE). BLAKE TATUM MAKES IT!
Score: 0-3

[11:17] Team_056 possession (Score: 0-3)
Jrue Lillard attempts a Layup. Wide open! Jarrett Smith is 6.3 feet away. [ZONE] JRUE LILLARD MAKES IT! Assist: Yao Poole
Score: 2-3

[11:04] Team_059 possession (Score: 2-3)
John Iverson drives and kicks out. Jarrett Smith attempts a 3Pt. Wide open! Tony Carter is 6.6 feet away. [ZONE] JARRETT SMITH MAKES IT! Assist: Blake Tatum
Score: 2-6

[10:48] Team_056 possession (Score: 2-6)
Magic Russell attempts a Midrange. Contested by Blake Tatum (5.0 feet, MAN). Magic Russell misses. Rebound secured by Bam Wade.

[10:31] Team_059 possession (Score: 2-6)
Bam Wade loses the ball! Stripped by Giannis Jokic! TURNOVER! (live ball)

[10:14] Team_056 possession (Score: 2-6)
Yao Poole attempts a Midrange. Wide open! Blake Tatum is 6.5 feet away. [ZONE] YAO POOLE MAKES IT!
Score: 4-6

[10:00] Team_059 possession (Score: 4-6)
Jarrett Smith attempts a Layup. Contested by Jrue Lillard (3.5 feet, ZONE). Jarrett Smith misses. Rebound secured by Jrue Lillard.

[09:46] Team_056 possession (Score: 4-6)
Giannis Jokic attempts a 3Pt. Contested by Bam Wade (4.8 feet, ZONE). Giannis Jokic misses. Offensive rebound by Jrue Lillard! Jrue Lillard's putback is no good. Rebound secured by John Iverson.

[09:35] Team_059 possession (Score: 4-6)
Nikola Jokic attempts a 3Pt. Contested by Jrue Lillard (4.0 feet, MAN). Nikola Jokic misses. Rebound secured by Yao Poole.

[09:24] Team_056 possession (Score: 4-6)
Giannis Jokic attempts a 3Pt. Contested by Bam Wade (5.4 feet, ZONE). Giannis Jokic misses. Rebound secured by Bam Wade.

[09:11] Team_059 possession (Score: 4-6)
Nikola Jokic attempts a Layup. Heavily contested by Jrue Lillard (1.0 feet, MAN)! NIKOLA JOKIC MAKES IT! Assist: John Iverson
Score: 4-8

[08:56] Team_056 possession (Score: 4-8)
FOUL! Holding foul on Blake Tatum. [Team fouls: 1] No free throws, side out. (Blake Tatum: 1 personal fouls)

[08:37] Team_056 possession (Score: 4-8)
Tony Carter attempts a 3Pt. Contested by Bam Wade (4.7 feet, ZONE). TONY CARTER MAKES IT! Assist: Giannis Jokic
Score: 7-8

[08:20] Team_059 possession (Score: 7-8)
Blake Tatum drives and kicks out. Blake Tatum attempts a 3Pt. Contested by Magic Russell (4.3 feet, MAN). Blake Tatum misses. Rebound secured by Yao Poole.

[08:06] Team_056 possession (Score: 7-8)
Jrue Lillard drives and kicks out. Jrue Lillard attempts a 3Pt. Wide open! Nikola Jokic is 6.2 feet away. [MAN] Jrue Lillard misses. Rebound secured by Jarrett Smith.

[07:50] Team_059 possession (Score: 7-8)
FOUL! Reach-in foul on Magic Russell during the drive. [Team fouls: 2] No free throws, side out. (Magic Russell: 1 personal fouls)

[07:32] Team_059 possession (Score: 7-8)
FOUL! Reach-in foul on Jrue Lillard during the drive. [Team fouls: 3] No free throws, side out. (Jrue Lillard: 1 personal fouls)

[07:15] Team_059 possession (Score: 7-8)
Jarrett Smith drives and kicks out. FOUL! Shooting foul on Jrue Lillard. Nikola Jokic to the line for 2 free throws. [Team fouls: 4] (Jrue Lillard: 2 personal fouls)   FT 1/2: GOOD   FT 2/2: GOOD Nikola Jokic makes 2/2 from the line.
Score: 7-10

[06:57] Team_056 possession (Score: 7-10)
FOUL! Reach-in foul on John Iverson during the drive. [Team fouls: 2] No free throws, side out. (John Iverson: 1 personal fouls)

[06:40] Team_056 possession (Score: 7-10)
Giannis Jokic attempts a Layup. BLOCKED BY BAM WADE! Ball deflects out of bounds off Giannis Jokic.

[06:22] Team_059 possession (Score: 7-10)
Jarrett Smith drives to the basket... Jarrett Smith commits a violation (traveling/carry)! TURNOVER! (dead ball)

[06:09] Team_056 possession (Score: 7-10)
Yao Poole attempts a Layup. Wide open! Jarrett Smith is 7.5 feet away. [MAN] YAO POOLE MAKES IT! Assist: Giannis Jokic
Score: 9-10

[05:58] Team_059 possession (Score: 9-10)
John Iverson drives and kicks out. Nikola Jokic attempts a Midrange. Contested by Jrue Lillard (3.1 feet, MAN). Nikola Jokic misses. Rebound secured by Yao Poole.

[05:49] Team_056 possession (Score: 9-10)
Tony Carter attempts a 3Pt. Wide open! Bam Wade is 8.7 feet away. [ZONE] Tony Carter misses. Rebound secured by Bam Wade.

[05:37] Team_059 possession (Score: 9-10)
Bam Wade attempts a 3Pt. Wide open! Giannis Jokic is 7.1 feet away. [ZONE] Bam Wade misses. Rebound secured by Yao Poole.

[05:20] Team_056 possession (Score: 9-10)
Yao Poole attempts a Midrange. Contested by John Iverson (4.3 feet, ZONE). Yao Poole misses. Offensive rebound by Yao Poole! Yao Poole kicks it out.

[05:07] Team_056 possession (Score: 9-10)
FOUL! Reach-in foul on Blake Tatum during the drive. [Team fouls: 3] No free throws, side out. (Blake Tatum: 2 personal fouls)

[04:51] Team_056 possession (Score: 9-10)
Jrue Lillard commits a violation (traveling/carry)! TURNOVER! (dead ball)

[04:36] Team_059 possession (Score: 9-10)
Blake Tatum attempts a 3Pt. Contested by Magic Russell (5.5 feet, MAN). BLAKE TATUM MAKES IT! Assist: John Iverson
Score: 9-13

[04:20] Team_056 possession (Score: 9-13)
Giannis Jokic drives, Jarrett Smith stays with him. Giannis Jokic attempts a Dunk. Wide open! Jarrett Smith is 8.0 feet away. [ZONE] GIANNIS JOKIC MAKES IT! Assist: Magic Russell
Score: 11-13

[04:06] Team_059 possession (Score: 11-13)
John Iverson drives and kicks out. FOUL! Shooting foul on Magic Russell. Bam Wade to the line for 2 free throws. [BONUS: 5 team fouls] (Magic Russell: 2 personal fouls)   FT 1/2: MISS   FT 2/2: GOOD Bam Wade makes 1/2 from the line.
Score: 11-14

[03:51] Team_056 possession (Score: 11-14)
Giannis Jokic attempts a Midrange. Wide open! Bam Wade is 7.8 feet away. [MAN] Giannis Jokic misses. Rebound secured by John Iverson.

[03:35] Team_059 possession (Score: 11-14)
Nikola Jokic makes the 3Pt and draws the foul on Jrue Lillard! And-1! Nikola Jokic to the line for 1. [BONUS: 6 team fouls] (Jrue Lillard: 3 personal fouls)   FT 1/1: GOOD Nikola Jokic makes 1/1 from the line.
Score: 11-18

[03:21] Team_056 possession (Score: 11-18)
FOUL! Reach-in foul on Jarrett Smith during the drive. [Team fouls: 4] No free throws, side out. (Jarrett Smith: 1 personal fouls)

[03:03] Team_056 possession (Score: 11-18)
Magic Russell drives, Blake Tatum stays with him. Magic Russell attempts a Layup. Contested by Blake Tatum (4.8 feet, MAN). Magic Russell misses. Rebound secured by Jarrett Smith.

[02:46] Team_059 possession (Score: 11-18)
Blake Tatum attempts a 3Pt. Contested by Giannis Jokic (2.4 feet, ZONE). BLAKE TATUM MAKES IT! Assist: John Iverson
Score: 11-21

[02:29] Team_056 possession (Score: 11-21)
Yao Poole attempts a Layup. Contested by Jarrett Smith (5.6 feet, ZONE). Yao Poole misses. Rebound secured by Bam Wade.

[02:10] Team_059 possession (Score: 11-21)
Jarrett Smith throws a bad pass! Stolen by Yao Poole! TURNOVER! (live ball)

[01:53] Team_056 possession (Score: 11-21)
FOUL! Holding foul on Jarrett Smith. [IN THE BONUS! 5 team fouls] Yao Poole to the line for 2 free throws. (Jarrett Smith: 2 personal fouls)   FT 1/2: GOOD   FT 2/2: GOOD Yao Poole makes 2/2 from the line.
Score: 13-21

[01:43] Team_059 possession (Score: 13-21)
Bam Wade attempts a 3Pt. Wide open! Giannis Jokic is 8.9 feet away. [MAN] Bam Wade misses. Rebound secured by Jrue Lillard.

[01:29] Team_056 possession (Score: 13-21)
Yao Poole attempts a 3Pt. Contested by Bam Wade (2.6 feet, ZONE). Yao Poole misses. Rebound secured by Jarrett Smith.

[01:14] Team_059 possession (Score: 13-21)
John Iverson attempts a Midrange. Wide open! Tony Carter is 7.0 feet away. [MAN] JOHN IVERSON MAKES IT! Assist: Nikola Jokic
Score: 13-23

[00:55] Team_056 possession (Score: 13-23)
Giannis Jokic attempts a Midrange. Contested by John Iverson (4.0 feet, ZONE). GIANNIS JOKIC MAKES IT!
Score: 15-23

[00:39] Team_059 possession (Score: 15-23)
FOUL! Shooting foul on Giannis Jokic. Bam Wade to the line for 3 free throws. [BONUS: 7 team fouls] (Giannis Jokic: 1 personal fouls)   FT 1/3: MISS   FT 2/3: GOOD   FT 3/3: GOOD Bam Wade makes 2/3 from the line.
Score: 15-25

[00:24] Team_056 possession (Score: 15-25)
Jrue Lillard attempts a Layup. BLOCKED BY JARRETT SMITH! Ball goes out off Jarrett Smith. Jrue Lillard's ball!

[00:08] Team_056 possession (Score: 15-25)
Giannis Jokic drives to the basket... Giannis Jokic throws a bad pass out of bounds! TURNOVER! (dead ball)

[00:08] Substitution (Team_056): Giannis Jokic OUT → De'Aaron Murray IN (stamina_rule2)

[00:08] Substitution (Team_056): Magic Russell OUT → Damian Barrett IN (stamina_rule2)

[00:08] Substitution (Team_056): Tony Carter OUT → CJ Anthony IN (stamina_rule2)

[00:08] Substitution (Team_056): Jrue Lillard OUT → RJ Johnson IN (stamina_rule2)

[00:08] Substitution (Team_056): Yao Poole OUT → Derrick Bane IN (stamina_rule2)

[00:08] Substitution (Team_059): Bam Wade OUT → Russell Quickley IN (stamina_rule2)

[00:08] Substitution (Team_059): Blake Tatum OUT → Scottie Ginobili IN (stamina_rule2)

[00:08] Substitution (Team_059): John Iverson OUT → Allen Giddey IN (stamina_rule2)

[00:08] Substitution (Team_059): Nikola Jokic OUT → Bones Middleton IN (stamina_rule2)

[00:08] Substitution (Team_059): Jarrett Smith OUT → LeBron Lowry IN (stamina_rule2)

================================================================================
                              1ST QUARTER COMPLETE                              
================================================================================

1ST QUARTER SCORE: Team_056 15, Team_059 25

BOX SCORE:
================================================================================

Team_056
--------------------------------------------------------------------------------
Player                MIN  PTS  REB  AST  TO      FG   FG%      3P   3P%
--------------------------------------------------------------------------------
Yao Poole              12    6    5    1   0   3/5    60.0     0/0   0.0
Giannis Jokic          12    4    0    2   0   2/6    33.3     0/0   0.0
Tony Carter            12    3    0    0   0   1/3    33.3     0/0   0.0
Jrue Lillard           12    2    2    0   0   1/2    50.0     0/0   0.0
Magic Russell          12    0    0    1   0   0/2     0.0     0/0   0.0

TEAM: FG: 7/18 (38.9%), 3PT: 1/5 (20.0%), REB: 8 (2 off, 6 def), AST: 4, TO: 2
TEAM FOULS: 7 [Team_059 in BONUS]


Team_059
--------------------------------------------------------------------------------
Player                MIN  PTS  REB  AST  TO      FG   FG%      3P   3P%
--------------------------------------------------------------------------------
Blake Tatum            12    9    0    1   0   3/4    75.0     0/0   0.0
Nikola Jokic           12    8    0    1   0   3/4    75.0     0/0   0.0
Bam Wade               12    3    5    0   0   2/4    50.0     0/0   0.0
Jarrett Smith          12    3    3    0   0   1/2    50.0     0/0   0.0
John Iverson           12    2    3    3   0   1/2    50.0     0/0   0.0

TEAM: FG: 10/16 (62.5%), 3PT: 5/8 (62.5%), REB: 10 (1 off, 9 def), AST: 5, TO: 3
TEAM FOULS: 5 [Team_056 in BONUS]

================================================================================

================================================================================
                       2ND QUARTER - Team_056 vs Team_059                       
================================================================================

[12:00] Team_056 possession (Score: 15-25)
Tony Carter attempts a Midrange. Contested by Nikola Jokic (4.7 feet, ZONE). TONY CARTER MAKES IT! Assist: Yao Poole
Score: 17-25

[11:41] Team_059 possession (Score: 17-25)
Blake Tatum loses the ball! Stripped by Magic Russell! TURNOVER! (live ball)

[11:28] Team_056 possession (Score: 17-25)
Tony Carter attempts a Midrange. Wide open! John Iverson is 10.0 feet away. [MAN] Tony Carter misses. Offensive rebound by Yao Poole! Yao Poole kicks it out.

[11:15] Team_056 possession (Score: 17-25)
Magic Russell drives, picks up Blake Tatum. Help arrives from Bam Wade! Magic Russell attempts a Dunk. Contested by Bam Wade (3.7 feet, MAN). Magic Russell misses. Rebound secured by Jarrett Smith.

[11:01] Team_059 possession (Score: 17-25)
Nikola Jokic drives to the basket... Nikola Jokic loses control! Ball rolls out of bounds! TURNOVER! (dead ball)

[11:01] Substitution (Team_056): Giannis Jokic OUT → De'Aaron Murray IN (stamina_rule2)

[11:01] Substitution (Team_056): Magic Russell OUT → Damian Barrett IN (stamina_rule2)

[11:01] Substitution (Team_056): Tony Carter OUT → CJ Anthony IN (stamina_rule2)

[11:01] Substitution (Team_056): Jrue Lillard OUT → RJ Johnson IN (stamina_rule2)

[11:01] Substitution (Team_056): Yao Poole OUT → Derrick Bane IN (stamina_rule2)

[11:01] Substitution (Team_059): Bam Wade OUT → Russell Quickley IN (stamina_rule2)

[11:01] Substitution (Team_059): Blake Tatum OUT → Scottie Ginobili IN (stamina_rule2)

[11:01] Substitution (Team_059): John Iverson OUT → Allen Giddey IN (stamina_rule2)

[11:01] Substitution (Team_059): Nikola Jokic OUT → Bones Middleton IN (stamina_rule2)

[11:01] Substitution (Team_059): Jarrett Smith OUT → LeBron Lowry IN (stamina_rule2)

[10:45] Team_056 possession (Score: 17-25)
De'Aaron Murray drives, Bones Middleton stays with him. De'Aaron Murray attempts a Dunk. Contested by Bones Middleton (4.1 feet, ZONE). De'Aaron Murray misses. Rebound secured by Bones Middleton.

[10:26] Team_059 possession (Score: 17-25)
Scottie Ginobili attempts a 3Pt. Wide open! Damian Barrett is 8.2 feet away. [MAN] Scottie Ginobili misses. Rebound secured by RJ Johnson.

[10:10] Team_056 possession (Score: 17-25)
De'Aaron Murray attempts a Midrange. Contested by Allen Giddey (5.8 feet, ZONE). De'Aaron Murray misses. Offensive rebound by CJ Anthony! CJ Anthony kicks it out.

[09:57] Team_056 possession (Score: 17-25)
Damian Barrett attempts a Midrange. Contested by Scottie Ginobili (4.1 feet, MAN). Damian Barrett misses. Rebound secured by LeBron Lowry.

[09:44] Team_059 possession (Score: 17-25)
Russell Quickley attempts a 3Pt. Contested by De'Aaron Murray (5.1 feet, MAN). Russell Quickley misses. Offensive rebound by Scottie Ginobili! Scottie Ginobili kicks it out.

[09:34] Team_059 possession (Score: 17-25)
LeBron Lowry drives, picks up Derrick Bane. Help arrives from Damian Barrett! LeBron Lowry attempts a Dunk. Contested by Damian Barrett (3.6 feet, MAN). LEBRON LOWRY MAKES IT! Assist: Bones Middleton
Score: 17-27

[09:21] Team_056 possession (Score: 17-27)
CJ Anthony attempts a Layup. Wide open! Bones Middleton is 7.0 feet away. [ZONE] CJ ANTHONY MAKES IT! Assist: RJ Johnson
Score: 19-27

[09:02] Team_059 possession (Score: 19-27)
Scottie Ginobili makes the Layup and draws the foul on RJ Johnson! And-1! Scottie Ginobili to the line for 1. [Team fouls: 1] (RJ Johnson: 1 personal fouls)   FT 1/1: GOOD Scottie Ginobili makes 1/1 from the line.
Score: 19-30

[08:44] Team_056 possession (Score: 19-30)
Damian Barrett attempts a Midrange. Contested by Scottie Ginobili (3.1 feet, MAN). Damian Barrett misses. Rebound secured by Bones Middleton.

[08:31] Team_059 possession (Score: 19-30)
Allen Giddey attempts a 3Pt. Contested by CJ Anthony (5.1 feet, MAN). Allen Giddey misses. FOUL! Loose ball foul on Derrick Bane during the rebound battle. [Team fouls: 2] No free throws, side out. (Derrick Bane: 1 personal fouls)

[08:18] Team_059 possession (Score: 19-30)
Scottie Ginobili attempts a 3Pt. Wide open! De'Aaron Murray is 6.7 feet away. [ZONE] SCOTTIE GINOBILI MAKES IT! Assist: Allen Giddey
Score: 19-33

[08:06] Team_056 possession (Score: 19-33)
CJ Anthony attempts a Layup. Wide open! Allen Giddey is 7.9 feet away. [MAN] CJ ANTHONY MAKES IT! Assist: RJ Johnson
Score: 21-33

[07:51] Team_059 possession (Score: 21-33)
Allen Giddey attempts a 3Pt. Contested by De'Aaron Murray (5.6 feet, ZONE). ALLEN GIDDEY MAKES IT! Assist: Russell Quickley
Score: 21-36

[07:37] Team_056 possession (Score: 21-36)
CJ Anthony drives, picks up Allen Giddey. Help arrives from Scottie Ginobili! CJ Anthony attempts a Layup. Wide open! Scottie Ginobili is 6.4 feet away. [MAN] CJ Anthony misses. Rebound secured by Bones Middleton.

[07:22] Team_059 possession (Score: 21-36)
LeBron Lowry drives, RJ Johnson stays with him. LeBron Lowry attempts a Dunk. Wide open! RJ Johnson is 6.4 feet away. [ZONE] LEBRON LOWRY MAKES IT!
Score: 21-38

[07:05] Team_056 possession (Score: 21-38)
Damian Barrett drives, Scottie Ginobili stays with him. Damian Barrett attempts a Dunk. Heavily contested by Scottie Ginobili (0.9 feet, MAN)! DAMIAN BARRETT MAKES IT!
Score: 23-38

[06:48] Team_059 possession (Score: 23-38)
LeBron Lowry attempts a Layup. Wide open! Derrick Bane is 7.9 feet away. [MAN] LEBRON LOWRY MAKES IT! Assist: Scottie Ginobili
Score: 23-40

[06:33] Team_056 possession (Score: 23-40)
Damian Barrett throws a bad pass! Stolen by Scottie Ginobili! TURNOVER! (live ball)

[06:19] Team_059 possession (Score: 23-40)
Bones Middleton attempts a Layup. Wide open! RJ Johnson is 9.5 feet away. [ZONE] BONES MIDDLETON MAKES IT! Assist: Allen Giddey
Score: 23-42

[06:01] Team_056 possession (Score: 23-42)
De'Aaron Murray attempts a 3Pt. Wide open! Russell Quickley is 9.3 feet away. [ZONE] De'Aaron Murray misses. Rebound secured by Scottie Ginobili.

[05:48] Team_059 possession (Score: 23-42)
Allen Giddey attempts a 3Pt. Contested by De'Aaron Murray (4.6 feet, ZONE). Allen Giddey misses. Rebound secured by CJ Anthony.

[05:30] Team_056 possession (Score: 23-42)
Derrick Bane drives, LeBron Lowry stays with him. Derrick Bane attempts a Layup. Contested by LeBron Lowry (3.6 feet, MAN). Derrick Bane misses. Rebound secured by Scottie Ginobili.

[05:16] Team_059 possession (Score: 23-42)
Allen Giddey attempts a 3Pt. Contested by CJ Anthony (4.5 feet, MAN). Allen Giddey misses. Rebound secured by CJ Anthony.

[05:02] Team_056 possession (Score: 23-42)
Derrick Bane attempts a Midrange. Contested by LeBron Lowry (4.3 feet, MAN). Derrick Bane misses. Rebound secured by LeBron Lowry.

[04:44] Team_059 possession (Score: 23-42)
LeBron Lowry attempts a Midrange. Contested by RJ Johnson (4.5 feet, ZONE). LeBron Lowry misses. Rebound secured by CJ Anthony.

[04:31] Team_056 possession (Score: 23-42)
RJ Johnson attempts a Layup. Contested by Bones Middleton (5.4 feet, MAN). RJ JOHNSON MAKES IT! Assist: Damian Barrett
Score: 25-42

[04:19] Team_059 possession (Score: 25-42)
Allen Giddey attempts a Midrange. Wide open! CJ Anthony is 6.9 feet away. [MAN] Allen Giddey misses. FOUL! Loose ball foul on CJ Anthony during the rebound battle. [Team fouls: 3] No free throws, side out. (CJ Anthony: 1 personal fouls)

[04:05] Team_059 possession (Score: 25-42)
Russell Quickley attempts a 3Pt. Wide open! Damian Barrett is 7.1 feet away. [ZONE] Russell Quickley misses. Rebound secured by CJ Anthony.

[03:50] Team_056 possession (Score: 25-42)
CJ Anthony attempts a 3Pt. Wide open! Allen Giddey is 7.8 feet away. [MAN] CJ Anthony misses. Rebound secured by Scottie Ginobili.

[03:35] Team_059 possession (Score: 25-42)
Scottie Ginobili attempts a Midrange. Contested by RJ Johnson (5.8 feet, ZONE). SCOTTIE GINOBILI MAKES IT!
Score: 25-44

[03:24] Team_056 possession (Score: 25-44)
Derrick Bane makes the Layup and draws the foul on LeBron Lowry! And-1! Derrick Bane to the line for 1. [Team fouls: 1] (LeBron Lowry: 1 personal fouls)   FT 1/1: GOOD Derrick Bane makes 1/1 from the line.
Score: 28-44

[03:09] Team_059 possession (Score: 28-44)
LeBron Lowry attempts a Layup. Contested by Derrick Bane (5.1 feet, MAN). LEBRON LOWRY MAKES IT! Assist: Bones Middleton
Score: 28-46

[02:52] Team_056 possession (Score: 28-46)
CJ Anthony drives to the basket... CJ Anthony throws a bad pass! Stolen by Bones Middleton! TURNOVER! (live ball)

[02:40] Team_059 possession (Score: 28-46)
Russell Quickley attempts a Layup. Wide open! De'Aaron Murray is 10.0 feet away. [MAN] RUSSELL QUICKLEY MAKES IT! Assist: Bones Middleton
Score: 28-48

[02:25] Team_056 possession (Score: 28-48)
RJ Johnson attempts a Layup. Contested by Bones Middleton (4.9 feet, MAN). RJ Johnson misses. Offensive rebound by RJ Johnson! RJ Johnson kicks it out.

[02:12] Team_056 possession (Score: 28-48)
CJ Anthony attempts a 3Pt. Wide open! Allen Giddey is 9.7 feet away. [MAN] CJ Anthony misses. Rebound secured by Bones Middleton.

[01:59] Team_059 possession (Score: 28-48)
FOUL! Reach-in foul on RJ Johnson during the drive. [Team fouls: 4] No free throws, side out. (RJ Johnson: 2 personal fouls)

[01:44] Team_059 possession (Score: 28-48)
LeBron Lowry drives and kicks out. Russell Quickley attempts a Midrange. Contested by De'Aaron Murray (4.8 feet, MAN). Russell Quickley misses. Rebound secured by CJ Anthony.

[01:24] Team_056 possession (Score: 28-48)
CJ Anthony drives and kicks out. Derrick Bane makes the Midrange and draws the foul on LeBron Lowry! And-1! Derrick Bane to the line for 1. [Team fouls: 2] (LeBron Lowry: 2 personal fouls)   FT 1/1: GOOD Derrick Bane makes 1/1 from the line.
Score: 31-48

[01:10] Team_059 possession (Score: 31-48)
Bones Middleton drives and kicks out. Allen Giddey attempts a 3Pt. Wide open! CJ Anthony is 6.1 feet away. [MAN] Allen Giddey misses. Rebound secured by RJ Johnson.

[00:55] Team_056 possession (Score: 31-48)
CJ Anthony attempts a 3Pt. Contested by Allen Giddey (6.0 feet, MAN). CJ ANTHONY MAKES IT! Assist: Derrick Bane
Score: 34-48

[00:39] Team_059 possession (Score: 34-48)
LeBron Lowry drives, Derrick Bane stays with him. LeBron Lowry attempts a Layup. Wide open! Derrick Bane is 6.2 feet away. [MAN] LEBRON LOWRY MAKES IT! Assist: Bones Middleton
Score: 34-50

[00:25] Team_056 possession (Score: 34-50)
CJ Anthony drives and kicks out. Derrick Bane attempts a 3Pt. Contested by Russell Quickley (4.1 feet, ZONE). Derrick Bane misses. FOUL! Loose ball foul on LeBron Lowry during the rebound battle. [Team fouls: 3] No free throws, side out. (LeBron Lowry: 3 personal fouls)

[00:11] Team_056 possession (Score: 34-50)
CJ Anthony attempts a 3Pt. Contested by Allen Giddey (5.7 feet, MAN). CJ Anthony misses. Rebound secured by Bones Middleton.

================================================================================
                              2ND QUARTER COMPLETE                              
================================================================================

2ND QUARTER SCORE: Team_056 19, Team_059 25

BOX SCORE:
================================================================================

Team_056
--------------------------------------------------------------------------------
Player                MIN  PTS  REB  AST  TO      FG   FG%      3P   3P%
--------------------------------------------------------------------------------
CJ Anthony             11    7    7    0   0   3/7    42.9     0/0   0.0
Derrick Bane           11    6    0    1   0   2/4    50.0     0/0   0.0
Tony Carter            13    2    0    0   0   1/1   100.0     0/0   0.0
RJ Johnson             11    2    3    2   0   1/1   100.0     0/0   0.0
Damian Barrett         11    2    0    1   0   1/3    33.3     0/0   0.0
Yao Poole              13    0    1    1   0   0/0     0.0     0/0   0.0
Magic Russell          13    0    0    0   0   0/1     0.0     0/0   0.0
De'Aaron Murray        11    0    0    0   0   0/2     0.0     0/0   0.0

TEAM: FG: 8/19 (42.1%), 3PT: 1/5 (20.0%), REB: 11 (4 off, 7 def), AST: 5, TO: 2
TEAM FOULS: 4


Team_059
--------------------------------------------------------------------------------
Player                MIN  PTS  REB  AST  TO      FG   FG%      3P   3P%
--------------------------------------------------------------------------------
LeBron Lowry           11   10    2    0   0   5/7    71.4     0/0   0.0
Scottie Ginobili       11    8    5    1   0   3/4    75.0     0/0   0.0
Allen Giddey           11    3    0    2   0   1/3    33.3     0/0   0.0
Bones Middleton        11    2    6    4   0   1/2    50.0     0/0   0.0
Russell Quickley       11    2    0    1   0   1/2    50.0     0/0   0.0
Jarrett Smith          13    0    1    0   0   0/0     0.0     0/0   0.0

TEAM: FG: 11/18 (61.1%), 3PT: 2/6 (33.3%), REB: 14 (3 off, 11 def), AST: 8, TO: 2
TEAM FOULS: 3

================================================================================

================================================================================
                       3RD QUARTER - Team_056 vs Team_059                       
================================================================================

[12:00] Team_056 possession (Score: 34-50)
Yao Poole attempts a Layup. BLOCKED BY JARRETT SMITH! Ball deflects out of bounds off Yao Poole.

[11:49] Team_059 possession (Score: 34-50)
FOUL! Offensive foul on Blake Tatum! Magic Russell drew the charge! [Team fouls: 1] (Blake Tatum: 1 personal fouls) TURNOVER! (dead ball)

[11:37] Team_056 possession (Score: 34-50)
FOUL! Reach-in foul on Bam Wade during the drive. [Team fouls: 2] No free throws, side out. (Bam Wade: 1 personal fouls)

[11:27] Team_056 possession (Score: 34-50)
Yao Poole attempts a Layup. Wide open! Jarrett Smith is 6.4 feet away. [MAN] YAO POOLE MAKES IT! Assist: Tony Carter
Score: 36-50

[11:16] Team_059 possession (Score: 36-50)
Blake Tatum makes the Dunk and draws the foul on Magic Russell! And-1! Blake Tatum to the line for 1. [Team fouls: 1] (Magic Russell: 1 personal fouls)   FT 1/1: GOOD Blake Tatum makes 1/1 from the line.
Score: 36-53

[10:59] Team_056 possession (Score: 36-53)
Magic Russell attempts a 3Pt. Contested by Blake Tatum (3.0 feet, MAN). Magic Russell misses. Rebound secured by Jarrett Smith.

[10:44] Team_059 possession (Score: 36-53)
FOUL! Shooting foul on Jrue Lillard. Nikola Jokic to the line for 2 free throws. [Team fouls: 2] (Jrue Lillard: 1 personal fouls)   FT 1/2: MISS   FT 2/2: MISS Nikola Jokic makes 0/2 from the line. Rebound secured by Yao Poole.

[10:28] Team_056 possession (Score: 36-53)
Giannis Jokic attempts a 3Pt. Contested by Nikola Jokic (3.6 feet, ZONE). Giannis Jokic misses. Rebound secured by Jarrett Smith.

[10:13] Team_059 possession (Score: 36-53)
FOUL! Reach-in foul on Giannis Jokic during the drive. [Team fouls: 3] No free throws, side out. (Giannis Jokic: 1 personal fouls)

[09:57] Team_059 possession (Score: 36-53)
Nikola Jokic drives, Jrue Lillard stays with him. Nikola Jokic attempts a Layup. Contested by Jrue Lillard (4.1 feet, ZONE). Nikola Jokic misses. Rebound secured by Yao Poole.

[09:46] Team_056 possession (Score: 36-53)
Yao Poole drives and kicks out. Tony Carter attempts a Midrange. Wide open! John Iverson is 6.4 feet away. [MAN] TONY CARTER MAKES IT! Assist: Magic Russell
Score: 38-53

[09:34] Team_059 possession (Score: 38-53)
Bam Wade attempts a 3Pt. Wide open! Giannis Jokic is 6.1 feet away. [MAN] Bam Wade misses. Rebound secured by Tony Carter.

[09:20] Team_056 possession (Score: 38-53)
FOUL! Shooting foul on Bam Wade. Giannis Jokic to the line for 2 free throws. [Team fouls: 3] (Bam Wade: 2 personal fouls)   FT 1/2: GOOD   FT 2/2: GOOD Giannis Jokic makes 2/2 from the line.
Score: 40-53

[09:05] Team_059 possession (Score: 40-53)
Bam Wade attempts a 3Pt. Contested by Giannis Jokic (4.8 feet, ZONE). Bam Wade misses. Rebound secured by Jrue Lillard.

[08:47] Team_056 possession (Score: 40-53)
Jrue Lillard attempts a Layup. Wide open! Nikola Jokic is 6.4 feet away. [MAN] Jrue Lillard misses. Offensive rebound by Jrue Lillard! Jrue Lillard puts it back in!
Score: 42-53

[08:35] Team_059 possession (Score: 42-53)
FOUL! Reach-in foul on Jrue Lillard during the drive. [Team fouls: 4] No free throws, side out. (Jrue Lillard: 2 personal fouls)

[08:24] Team_059 possession (Score: 42-53)
Blake Tatum attempts a 3Pt. Contested by Giannis Jokic (3.2 feet, ZONE). Blake Tatum misses. Rebound secured by Yao Poole.

[08:10] Team_056 possession (Score: 42-53)
Tony Carter attempts a Midrange. Wide open! John Iverson is 6.0 feet away. [ZONE] Tony Carter misses. Rebound secured by John Iverson.

[07:53] Team_059 possession (Score: 42-53)
Nikola Jokic attempts a Midrange. Contested by Jrue Lillard (5.2 feet, MAN). Nikola Jokic misses. Offensive rebound by John Iverson! John Iverson kicks it out.

[07:37] Team_059 possession (Score: 42-53)
John Iverson drives to the basket... John Iverson throws a bad pass! Stolen by Tony Carter! TURNOVER! (live ball)

[07:22] Team_056 possession (Score: 42-53)
Jrue Lillard drives, Nikola Jokic stays with him. Jrue Lillard attempts a Dunk. Wide open! Nikola Jokic is 7.6 feet away. [MAN] JRUE LILLARD MAKES IT! Assist: Tony Carter
Score: 44-53

[07:08] Team_059 possession (Score: 44-53)
Nikola Jokic makes the Dunk and draws the foul on Jrue Lillard! And-1! Nikola Jokic to the line for 1. [BONUS: 5 team fouls] (Jrue Lillard: 3 personal fouls)   FT 1/1: GOOD Nikola Jokic makes 1/1 from the line.
Score: 44-56

[06:53] Team_056 possession (Score: 44-56)
FOUL! Holding foul on John Iverson. [Team fouls: 4] No free throws, side out. (John Iverson: 1 personal fouls)

[06:34] Team_056 possession (Score: 44-56)
Tony Carter attempts a 3Pt. Contested by John Iverson (4.4 feet, MAN). TONY CARTER MAKES IT!
Score: 47-56

[06:22] Team_059 possession (Score: 47-56)
Blake Tatum attempts a Midrange. Contested by Tony Carter (4.4 feet, ZONE). Blake Tatum misses. Rebound secured by Jrue Lillard.

[06:07] Team_056 possession (Score: 47-56)
Tony Carter drives and kicks out. Giannis Jokic attempts a 3Pt. Heavily contested by Bam Wade (0.5 feet, MAN)! Giannis Jokic misses. Offensive rebound by Jrue Lillard! Jrue Lillard's putback is no good. Rebound secured by Bam Wade.

[05:51] Team_059 possession (Score: 47-56)
Blake Tatum attempts a 3Pt. Contested by Giannis Jokic (5.2 feet, ZONE). BLAKE TATUM MAKES IT! Assist: Nikola Jokic
Score: 47-59

[05:38] Team_056 possession (Score: 47-59)
Giannis Jokic attempts a 3Pt. Contested by Bam Wade (2.7 feet, MAN). Giannis Jokic misses. Rebound secured by Jarrett Smith.

[05:21] Team_059 possession (Score: 47-59)
FOUL! Offensive foul on Bam Wade! Giannis Jokic drew the charge! [Team fouls: 5] (Bam Wade: 3 personal fouls) TURNOVER! (dead ball)

[05:10] Team_056 possession (Score: 47-59)
Jrue Lillard attempts a 3Pt. Wide open! Nikola Jokic is 9.2 feet away. [MAN] JRUE LILLARD MAKES IT! Assist: Giannis Jokic
Score: 50-59

[05:00] Team_059 possession (Score: 50-59)
FOUL! Shooting foul on Giannis Jokic. Bam Wade to the line for 2 free throws. [BONUS: 6 team fouls] (Giannis Jokic: 2 personal fouls)   FT 1/2: GOOD   FT 2/2: GOOD Bam Wade makes 2/2 from the line.
Score: 50-61

[04:42] Team_056 possession (Score: 50-61)
Magic Russell attempts a 3Pt. Contested by Blake Tatum (2.8 feet, MAN). Magic Russell misses. FOUL! Loose ball foul on Jarrett Smith during the rebound battle. [IN THE BONUS! 6 team fouls] Yao Poole to the line for 2 free throws. (Jarrett Smith: 1 personal fouls)   FT 1/2: GOOD   FT 2/2: GOOD Yao Poole makes 2/2 from the line.
Score: 52-61

[04:29] Team_059 possession (Score: 52-61)
FOUL! Shooting foul on Jrue Lillard. Blake Tatum to the line for 2 free throws. [BONUS: 7 team fouls] (Jrue Lillard: 4 personal fouls)   FT 1/2: GOOD   FT 2/2: MISS Blake Tatum makes 1/2 from the line. Rebound secured by Jrue Lillard.
Score: 52-62

[04:19] Team_056 possession (Score: 52-62)
FOUL! Shooting foul on Bam Wade. Magic Russell to the line for 3 free throws. [BONUS: 7 team fouls] (Bam Wade: 4 personal fouls)   FT 1/3: GOOD   FT 2/3: GOOD   FT 3/3: GOOD Magic Russell makes 3/3 from the line.
Score: 55-62

[04:06] Team_059 possession (Score: 55-62)
Nikola Jokic attempts a 3Pt. Contested by Jrue Lillard (4.0 feet, MAN). Nikola Jokic misses. Rebound secured by Jrue Lillard.

[03:54] Team_056 possession (Score: 55-62)
Giannis Jokic attempts a 3Pt. Wide open! Bam Wade is 6.9 feet away. [ZONE] Giannis Jokic misses. Rebound secured by John Iverson.

[03:41] Team_059 possession (Score: 55-62)
Blake Tatum drives and kicks out. Nikola Jokic attempts a Midrange. Contested by Tony Carter (4.6 feet, ZONE). Nikola Jokic misses. FOUL! Loose ball foul on Jrue Lillard during the rebound battle. [IN THE BONUS! 8 team fouls] John Iverson to the line for 2 free throws. (Jrue Lillard: 5 personal fouls)   FT 1/2: GOOD   FT 2/2: GOOD John Iverson makes 2/2 from the line.
Score: 55-64

[03:27] Team_056 possession (Score: 55-64)
Tony Carter drives to the basket... Tony Carter loses control! Ball rolls out of bounds! TURNOVER! (dead ball)

[03:27] Substitution (Team_056): Magic Russell OUT → Damian Barrett IN (stamina_rule2)

[03:27] Substitution (Team_056): Yao Poole OUT → Derrick Bane IN (stamina_rule2)

[03:27] Substitution (Team_059): John Iverson OUT → Allen Giddey IN (stamina_rule2)

[03:13] Team_059 possession (Score: 55-64)
Bam Wade attempts a Midrange. Wide open! Damian Barrett is 6.8 feet away. [ZONE] Bam Wade misses. Rebound secured by Derrick Bane.

[02:55] Team_056 possession (Score: 55-64)
FOUL! Reach-in foul on Jarrett Smith during the drive. [IN THE BONUS! 8 team fouls] Giannis Jokic to the line for 2 free throws. (Jarrett Smith: 2 personal fouls)   FT 1/2: GOOD   FT 2/2: GOOD Giannis Jokic makes 2/2 from the line.
Score: 57-64

[02:45] Team_059 possession (Score: 57-64)
Jarrett Smith loses the ball! Stripped by Derrick Bane! TURNOVER! (live ball)

[02:32] Team_056 possession (Score: 57-64)
Tony Carter attempts a 3Pt. Contested by Bam Wade (2.9 feet, ZONE). Tony Carter misses. Rebound secured by Nikola Jokic.

[02:18] Team_059 possession (Score: 57-64)
Bam Wade attempts a 3Pt. Contested by Giannis Jokic (5.2 feet, MAN). BAM WADE MAKES IT!
Score: 57-67

[02:01] Team_056 possession (Score: 57-67)
Derrick Bane attempts a Midrange. Contested by Jarrett Smith (2.6 feet, MAN). Derrick Bane misses. Rebound secured by Bam Wade.

[01:48] Team_059 possession (Score: 57-67)
Bam Wade loses control! Ball rolls out of bounds! TURNOVER! (dead ball)

[01:48] Substitution (Team_056): Giannis Jokic OUT → De'Aaron Murray IN (stamina_rule2)

[01:48] Substitution (Team_056): Tony Carter OUT → CJ Anthony IN (stamina_rule2)

[01:48] Substitution (Team_056): Jrue Lillard OUT → RJ Johnson IN (stamina_rule2)

[01:48] Substitution (Team_059): Bam Wade OUT → Russell Quickley IN (stamina_rule2)

[01:48] Substitution (Team_059): Blake Tatum OUT → Scottie Ginobili IN (stamina_rule2)

[01:48] Substitution (Team_059): Nikola Jokic OUT → Bones Middleton IN (stamina_rule2)

[01:48] Substitution (Team_059): Jarrett Smith OUT → LeBron Lowry IN (stamina_rule2)

[01:30] Team_056 possession (Score: 57-67)
CJ Anthony attempts a 3Pt. Contested by Allen Giddey (3.1 feet, MAN). CJ ANTHONY MAKES IT! Assist: Derrick Bane
Score: 60-67

[01:17] Team_059 possession (Score: 60-67)
Allen Giddey throws a bad pass out of bounds! TURNOVER! (dead ball)

[01:02] Team_056 possession (Score: 60-67)
Derrick Bane drives, LeBron Lowry stays with him. Derrick Bane attempts a Dunk. Contested by LeBron Lowry (3.1 feet, MAN). Derrick Bane misses. Rebound secured by LeBron Lowry.

[00:46] Team_059 possession (Score: 60-67)
Russell Quickley attempts a Midrange. Contested by De'Aaron Murray (2.9 feet, MAN). Russell Quickley misses. Rebound secured by Derrick Bane.

[00:31] Team_056 possession (Score: 60-67)
Damian Barrett drives to the basket... FOUL! Offensive foul on Damian Barrett! Bones Middleton drew the charge! [Team fouls: 9] (Damian Barrett: 1 personal fouls) TURNOVER! (dead ball)

[00:18] Team_059 possession (Score: 60-67)
Bones Middleton drives to the basket... Bones Middleton loses the ball! Stripped by RJ Johnson! TURNOVER! (live ball)

[00:04] Team_056 possession (Score: 60-67)
RJ Johnson attempts a 3Pt. Contested by Russell Quickley (2.7 feet, ZONE). RJ Johnson misses. Rebound secured by Scottie Ginobili.

================================================================================
                              3RD QUARTER COMPLETE                              
================================================================================

3RD QUARTER SCORE: Team_056 26, Team_059 17

BOX SCORE:
================================================================================

Team_056
--------------------------------------------------------------------------------
Player                MIN  PTS  REB  AST  TO      FG   FG%      3P   3P%
--------------------------------------------------------------------------------
Jrue Lillard           24    7    5    0   0   3/3   100.0     0/0   0.0
Tony Carter            24    5    1    2   0   2/5    40.0     0/0   0.0
Yao Poole              22    4    3    0   0   2/3    66.7     0/0   0.0
Giannis Jokic          24    4    0    1   0   2/5    40.0     0/0   0.0
Magic Russell          22    3    0    1   0   1/2    50.0     0/0   0.0
CJ Anthony             12    3    0    0   0   1/1   100.0     0/0   0.0
Derrick Bane           14    0    2    1   0   0/2     0.0     0/0   0.0
RJ Johnson             12    0    0    0   0   0/1     0.0     0/0   0.0

TEAM: FG: 11/22 (50.0%), 3PT: 5/11 (45.5%), REB: 12 (2 off, 10 def), AST: 5, TO: 2
TEAM FOULS: 9 [Team_059 in BONUS]


Team_059
--------------------------------------------------------------------------------
Player                MIN  PTS  REB  AST  TO      FG   FG%      3P   3P%
--------------------------------------------------------------------------------
Blake Tatum            24    6    0    0   0   2/5    40.0     0/0   0.0
Bam Wade               24    5    2    0   0   2/5    40.0     0/0   0.0
Nikola Jokic           24    3    1    1   0   1/4    25.0     0/0   0.0
John Iverson           22    2    3    0   0   1/1   100.0     0/0   0.0
Jarrett Smith          24    0    3    0   0   0/0     0.0     0/0   0.0
LeBron Lowry           12    0    1    0   0   0/0     0.0     0/0   0.0
Russell Quickley       12    0    0    0   0   0/1     0.0     0/0   0.0
Scottie Ginobili       12    0    1    0   0   0/0     0.0     0/0   0.0

TEAM: FG: 6/16 (37.5%), 3PT: 2/6 (33.3%), REB: 10 (1 off, 9 def), AST: 1, TO: 7
TEAM FOULS: 8 [Team_056 in BONUS]

================================================================================

================================================================================
                       4TH QUARTER - Team_056 vs Team_059                       
================================================================================

[12:00] Team_056 possession (Score: 60-67)
Jrue Lillard attempts a Midrange. Wide open! Jarrett Smith is 7.5 feet away. [ZONE] Jrue Lillard misses. Rebound secured by Jarrett Smith.

[11:43] Team_059 possession (Score: 60-67)
John Iverson attempts a 3Pt. Contested by Tony Carter (5.7 feet, ZONE). John Iverson misses. Rebound secured by Jrue Lillard.

[11:32] Team_056 possession (Score: 60-67)
Jrue Lillard throws a bad pass! Stolen by Nikola Jokic! TURNOVER! (live ball)

[11:16] Team_059 possession (Score: 60-67)
Blake Tatum drives, Yao Poole stays with him. Blake Tatum attempts a Layup. Wide open! Yao Poole is 8.7 feet away. [ZONE] BLAKE TATUM MAKES IT! Assist: Bam Wade
Score: 60-69

[11:01] Team_056 possession (Score: 60-69)
Jrue Lillard throws a bad pass! Stolen by Nikola Jokic! TURNOVER! (live ball)

[10:45] Team_059 possession (Score: 60-69)
Bam Wade drives and kicks out. Nikola Jokic attempts a 3Pt. Contested by Magic Russell (2.4 feet, ZONE). NIKOLA JOKIC MAKES IT!
Score: 60-72

[10:28] Team_056 possession (Score: 60-72)
Giannis Jokic attempts a 3Pt. Contested by Bam Wade (3.2 feet, MAN). GIANNIS JOKIC MAKES IT! Assist: Tony Carter
Score: 63-72

[10:08] Team_059 possession (Score: 63-72)
Nikola Jokic attempts a 3Pt. Contested by Giannis Jokic (3.6 feet, ZONE). NIKOLA JOKIC MAKES IT! Assist: Jarrett Smith
Score: 63-75

[09:53] Team_056 possession (Score: 63-75)
Jrue Lillard attempts a Layup. Contested by Nikola Jokic (4.6 feet, MAN). JRUE LILLARD MAKES IT! Assist: Tony Carter
Score: 65-75

[09:39] Team_059 possession (Score: 65-75)
FOUL! Shooting foul on Giannis Jokic. Bam Wade to the line for 3 free throws. [Team fouls: 1] (Giannis Jokic: 1 personal fouls)   FT 1/3: GOOD   FT 2/3: GOOD   FT 3/3: GOOD Bam Wade makes 3/3 from the line.
Score: 65-78

[09:26] Team_056 possession (Score: 65-78)
Tony Carter attempts a 3Pt. Contested by Bam Wade (4.7 feet, ZONE). Tony Carter misses. Rebound secured by Nikola Jokic.

[09:07] Team_059 possession (Score: 65-78)
John Iverson attempts a 3Pt. Contested by Tony Carter (3.1 feet, MAN). JOHN IVERSON MAKES IT! Assist: Bam Wade
Score: 65-81

[08:55] Team_056 possession (Score: 65-81)
Jrue Lillard makes the Layup and draws the foul on Nikola Jokic! And-1! Jrue Lillard to the line for 1. [Team fouls: 1] (Nikola Jokic: 1 personal fouls)   FT 1/1: GOOD Jrue Lillard makes 1/1 from the line.
Score: 68-81

[08:45] Team_059 possession (Score: 68-81)
Jarrett Smith drives to the basket... Jarrett Smith throws a bad pass! Stolen by Jrue Lillard! TURNOVER! (live ball)

[08:31] Team_056 possession (Score: 68-81)
Tony Carter drives, Jarrett Smith stays with him. Tony Carter attempts a Dunk. Contested by Jarrett Smith (5.4 feet, ZONE). TONY CARTER MAKES IT!
Score: 70-81

[08:19] Team_059 possession (Score: 70-81)
John Iverson attempts a Midrange. Heavily contested by Tony Carter (1.8 feet, MAN)! JOHN IVERSON MAKES IT!
Score: 70-83

[08:05] Team_056 possession (Score: 70-83)
Jrue Lillard drives, Nikola Jokic stays with him. Jrue Lillard attempts a Layup. Wide open! Nikola Jokic is 7.8 feet away. [MAN] Jrue Lillard misses. Offensive rebound by Yao Poole! Yao Poole kicks it out.

[07:50] Team_056 possession (Score: 70-83)
Tony Carter attempts a Midrange. Wide open! John Iverson is 7.8 feet away. [MAN] TONY CARTER MAKES IT! Assist: Giannis Jokic
Score: 72-83

[07:33] Team_059 possession (Score: 72-83)
Bam Wade attempts a 3Pt. Wide open! Giannis Jokic is 8.1 feet away. [MAN] Bam Wade misses. FOUL! Loose ball foul on Magic Russell during the rebound battle. [Team fouls: 2] No free throws, side out. (Magic Russell: 1 personal fouls)

[07:20] Team_059 possession (Score: 72-83)
Nikola Jokic drives, Jrue Lillard stays with him. Nikola Jokic attempts a Layup. Contested by Jrue Lillard (5.9 feet, ZONE). Nikola Jokic misses. Rebound secured by Magic Russell.

[07:05] Team_056 possession (Score: 72-83)
FOUL! Holding foul on John Iverson. [Team fouls: 2] No free throws, side out. (John Iverson: 1 personal fouls)

[06:51] Team_056 possession (Score: 72-83)
Giannis Jokic attempts a 3Pt. Contested by Bam Wade (5.0 feet, MAN). Giannis Jokic misses. Rebound secured by John Iverson.

[06:37] Team_059 possession (Score: 72-83)
Bam Wade attempts a 3Pt. Contested by Jrue Lillard (3.4 feet, ZONE). Bam Wade misses. Rebound secured by Magic Russell.

[06:20] Team_056 possession (Score: 72-83)
FOUL! Holding foul on Bam Wade. [Team fouls: 3] No free throws, side out. (Bam Wade: 1 personal fouls)

[06:10] Team_056 possession (Score: 72-83)
Yao Poole drives, Jarrett Smith stays with him. Yao Poole attempts a Dunk. Contested by Jarrett Smith (2.1 feet, ZONE). YAO POOLE MAKES IT! Assist: Magic Russell
Score: 74-83

[05:57] Team_059 possession (Score: 74-83)
John Iverson attempts a Midrange. Wide open! Tony Carter is 6.0 feet away. [MAN] John Iverson misses. Rebound secured by Yao Poole.

[05:42] Team_056 possession (Score: 74-83)
Tony Carter drives to the basket... FOUL! Offensive foul on Tony Carter! John Iverson drew the charge! [Team fouls: 3] (Tony Carter: 1 personal fouls) TURNOVER! (dead ball)

[05:31] Team_059 possession (Score: 74-83)
Bam Wade attempts a 3Pt. Contested by Giannis Jokic (4.9 feet, ZONE). Bam Wade misses. Rebound secured by Magic Russell.

[05:19] Team_056 possession (Score: 74-83)
Magic Russell drives and kicks out. Magic Russell attempts a Midrange. Contested by Blake Tatum (3.6 feet, MAN). Magic Russell misses. Rebound secured by Jarrett Smith.

[05:04] Team_059 possession (Score: 74-83)
Bam Wade attempts a Layup. Wide open! Jrue Lillard is 8.4 feet away. [ZONE] BAM WADE MAKES IT! Assist: John Iverson
Score: 74-85

[04:50] Team_056 possession (Score: 74-85)
Yao Poole attempts a Midrange. Contested by Jarrett Smith (3.3 feet, MAN). YAO POOLE MAKES IT!
Score: 76-85

[04:33] Team_059 possession (Score: 76-85)
John Iverson drives, Tony Carter stays with him. John Iverson attempts a Dunk. Contested by Tony Carter (3.9 feet, MAN). JOHN IVERSON MAKES IT! Assist: Bam Wade
Score: 76-87

[04:17] Team_056 possession (Score: 76-87)
Yao Poole makes the Layup and draws the foul on Jarrett Smith! And-1! Yao Poole to the line for 1. [Team fouls: 4] (Jarrett Smith: 1 personal fouls)   FT 1/1: GOOD Yao Poole makes 1/1 from the line.
Score: 79-87

[03:59] Team_059 possession (Score: 79-87)
Bam Wade attempts a 3Pt. Contested by Giannis Jokic (5.6 feet, ZONE). BAM WADE MAKES IT! Assist: Nikola Jokic
Score: 79-90

[03:46] Team_056 possession (Score: 79-90)
Yao Poole attempts a Layup. Wide open! Jarrett Smith is 6.2 feet away. [ZONE] YAO POOLE MAKES IT!
Score: 81-90

[03:36] Team_059 possession (Score: 81-90)
Bam Wade drives, Giannis Jokic stays with him. Bam Wade attempts a Layup. Wide open! Giannis Jokic is 6.9 feet away. [MAN] BAM WADE MAKES IT!
Score: 81-92

[03:21] Team_056 possession (Score: 81-92)
Tony Carter attempts a Midrange. Wide open! John Iverson is 10.0 feet away. [MAN] Tony Carter misses. Rebound secured by John Iverson.

[03:07] Team_059 possession (Score: 81-92)
Blake Tatum attempts a 3Pt. Wide open! Magic Russell is 6.1 feet away. [MAN] BLAKE TATUM MAKES IT! Assist: Jarrett Smith
Score: 81-95

[02:55] Team_056 possession (Score: 81-95)
Giannis Jokic attempts a 3Pt. Contested by Bam Wade (5.8 feet, ZONE). Giannis Jokic misses. Rebound secured by John Iverson.

[02:42] Team_059 possession (Score: 81-95)
Bam Wade attempts a 3Pt. Contested by Giannis Jokic (4.6 feet, MAN). BAM WADE MAKES IT! Assist: Nikola Jokic
Score: 81-98

[02:24] Team_056 possession (Score: 81-98)
Magic Russell attempts a 3Pt. Contested by Blake Tatum (4.4 feet, MAN). MAGIC RUSSELL MAKES IT! Assist: Giannis Jokic
Score: 84-98

[02:13] Team_059 possession (Score: 84-98)
Bam Wade attempts a 3Pt. Wide open! Tony Carter is 7.6 feet away. [ZONE] BAM WADE MAKES IT! Assist: Nikola Jokic
Score: 84-101

[01:54] Team_056 possession (Score: 84-101)
Yao Poole drives to the basket... Yao Poole loses the ball! Stripped by Jarrett Smith! TURNOVER! (live ball)

[01:39] Team_059 possession (Score: 84-101)
Jarrett Smith drives and kicks out. Blake Tatum attempts a Midrange. Wide open! Magic Russell is 7.2 feet away. [ZONE] Blake Tatum misses. Rebound secured by Tony Carter.

[01:27] Team_056 possession (Score: 84-101)
Jrue Lillard attempts a 3Pt. Wide open! Bam Wade is 8.0 feet away. [ZONE] Jrue Lillard misses. Rebound secured by John Iverson.

[01:14] Team_059 possession (Score: 84-101)
Nikola Jokic attempts a Layup. Contested by Jrue Lillard (2.3 feet, MAN). NIKOLA JOKIC MAKES IT! Assist: Bam Wade
Score: 84-103

[00:59] Team_056 possession (Score: 84-103)
Yao Poole attempts a Layup. Contested by Jarrett Smith (3.2 feet, ZONE). Yao Poole misses. Rebound secured by Jarrett Smith.

[00:43] Team_059 possession (Score: 84-103)
Blake Tatum attempts a 3Pt. Wide open! Magic Russell is 6.2 feet away. [ZONE] Blake Tatum misses. Rebound secured by Jrue Lillard.

[00:33] Team_056 possession (Score: 84-103)
Jrue Lillard attempts a Midrange. Contested by Blake Tatum (5.7 feet, ZONE). Jrue Lillard misses. Rebound secured by Nikola Jokic.

[00:18] Team_059 possession (Score: 84-103)
FOUL! Holding foul on Jrue Lillard. [Team fouls: 4] No free throws, side out. (Jrue Lillard: 1 personal fouls)

[00:03] Team_059 possession (Score: 84-103)
Jarrett Smith makes the Layup and draws the foul on Yao Poole! And-1! Jarrett Smith to the line for 1. [BONUS: 5 team fouls] (Yao Poole: 1 personal fouls)   FT 1/1: GOOD Jarrett Smith makes 1/1 from the line.
Score: 84-106

================================================================================
                              4TH QUARTER COMPLETE                              
================================================================================

4TH QUARTER SCORE: Team_056 24, Team_059 39

BOX SCORE:
================================================================================

Team_056
--------------------------------------------------------------------------------
Player                MIN  PTS  REB  AST  TO      FG   FG%      3P   3P%
--------------------------------------------------------------------------------
Yao Poole              34    9    2    0   0   4/5    80.0     0/0   0.0
Jrue Lillard           36    5    2    0   0   2/5    40.0     0/0   0.0
Tony Carter            36    4    1    2   0   2/4    50.0     0/0   0.0
Giannis Jokic          36    3    0    2   0   1/3    33.3     0/0   0.0
Magic Russell          34    3    3    1   0   1/2    50.0     0/0   0.0

TEAM: FG: 10/19 (52.6%), 3PT: 2/6 (33.3%), REB: 8 (1 off, 7 def), AST: 5, TO: 4
TEAM FOULS: 5 [Team_059 in BONUS]


Team_059
--------------------------------------------------------------------------------
Player                MIN  PTS  REB  AST  TO      FG   FG%      3P   3P%
--------------------------------------------------------------------------------
Bam Wade               36   16    0    4   0   6/8    75.0     0/0   0.0
Nikola Jokic           36    8    2    3   0   3/4    75.0     0/0   0.0
John Iverson           34    7    4    1   0   3/5    60.0     0/0   0.0
Blake Tatum            36    5    0    0   0   2/3    66.7     0/0   0.0
Jarrett Smith          36    3    4    2   0   1/2    50.0     0/0   0.0

TEAM: FG: 15/22 (68.2%), 3PT: 7/11 (63.6%), REB: 10 (1 off, 9 def), AST: 10, TO: 1
TEAM FOULS: 4

================================================================================

================================================================================
                               FULL GAME COMPLETE                               
================================================================================

FINAL SCORE: Team_056 84, Team_059 106

SCORING BY QUARTER:
--------------------------------------------------------------------------------
Team                     Q1     Q2     Q3     Q4    FINAL
--------------------------------------------------------------------------------
Team_056                 15     19     26     24       84
Team_059                 25     25     17     39      106
--------------------------------------------------------------------------------

FULL GAME BOX SCORE:
================================================================================

Team_056
--------------------------------------------------------------------------------
Player                MIN  PTS  REB  AST  TO      FG   FG%      3P   3P%      FT STL BLK
--------------------------------------------------------------------------------
Giannis Jokic          36   11    0    5   3   5/14   35.7   1/8    12.5   4/4     1   0
Tony Carter            36   14    2    4   0   5/12   41.7   2/5    40.0   0/0     1   0
Jrue Lillard           36   14    9    0   3   6/10   60.0   1/2    50.0   1/1     1   0
Magic Russell          34    6    3    3   0   3/8    37.5   3/4    75.0   3/3     1   0
Yao Poole              34   19   11    2   1   8/12   66.7   0/1     0.0   5/5     1   0
Damian Barrett         14    2    0    1   1   1/3    33.3   0/0     0.0   0/0     0   0
Derrick Bane           14    6    2    2   0   1/5    20.0   0/0     0.0   2/2     1   0
De'Aaron Murray        12    0    0    0   1   0/2     0.0   0/1     0.0   0/0     0   0
CJ Anthony             12   10    7    0   0   5/9    55.6   2/5    40.0   0/0     0   0
RJ Johnson             12    2    3    2   1   1/2    50.0   0/1     0.0   0/0     1   0

TEAM: FG: 36/78 (46.2%), 3PT: 9/27 (33.3%), REB: 39 (9 off, 30 def), AST: 19, TO: 10


Team_059
--------------------------------------------------------------------------------
Player                MIN  PTS  REB  AST  TO      FG   FG%      3P   3P%      FT STL BLK
--------------------------------------------------------------------------------
Bam Wade               36   24    7    4   5  10/17   58.8   6/12   50.0   8/10    0   1
Blake Tatum            36   20    0    1   2   8/13   61.5   5/7    71.4   2/3     0   0
Nikola Jokic           36   19    3    5   2   5/10   50.0   2/4    50.0   4/6     2   0
Jarrett Smith          36    6   11    2   2   2/4    50.0   0/0     0.0   1/1     1   2
John Iverson           34   11   10    4   0   6/9    66.7   1/2    50.0   2/2     0   0
Allen Giddey           14    3    0    2   2   1/3    33.3   1/3    33.3   0/0     0   0
Russell Quickley       12    2    0    1   0   1/3    33.3   0/1     0.0   0/0     0   0
Scottie Ginobili       12    8    6    1   0   3/4    75.0   1/2    50.0   1/1     1   0
Bones Middleton        12    2    6    4   0   1/2    50.0   0/0     0.0   0/0     1   0
LeBron Lowry           12   10    3    0   0   5/7    71.4   0/0     0.0   0/0     0   0

TEAM: FG: 42/72 (58.3%), 3PT: 16/31 (51.6%), REB: 44 (6 off, 38 def), AST: 24, TO: 13

================================================================================
