================================================================================
                        FULL GAME - Team_073 vs Team_045                        
================================================================================

================================================================================
                       1ST QUARTER - Team_073 vs Team_045                       
================================================================================

[12:00] Team_073 possession (Score: 0-0)
Isaiah Smith attempts a 3Pt. Contested by Cole Simons (4.2 feet, ZONE). Isaiah Smith misses. Rebound secured by Zion Butler.

[11:44] Team_045 possession (Score: 0-0)
Cole Simons attempts a 3Pt. Contested by Carmelo Porzingis (4.7 feet, ZONE). COLE SIMONS MAKES IT! Assist: DeMar Turner
Score: 0-3

[11:31] Team_073 possession (Score: 0-3)
Isaiah Smith attempts a 3Pt. Contested by Cole Simons (2.2 feet, ZONE). ISAIAH SMITH MAKES IT! Assist: Carmelo Young
Score: 3-3

[11:14] Team_045 possession (Score: 3-3)
Rudy Antetokounmpo drives, Carmelo Young stays with him. Rudy Antetokounmpo attempts a Layup. Wide open! Carmelo Young is 6.5 feet away. [MAN] RUDY ANTETOKOUNMPO MAKES IT! Assist: Trae Russell
Score: 3-5

[10:59] Team_073 possession (Score: 3-5)
Bradley Morant attempts a Midrange. Contested by Trae Russell (3.4 feet, ZONE). Bradley Morant misses. Offensive rebound by Bradley Morant! Bradley Morant kicks it out.

[10:45] Team_073 possession (Score: 3-5)
FOUL! Shooting foul on Rudy Antetokounmpo. Carmelo Porzingis to the line for 2 free throws. [Team fouls: 1] (Rudy Antetokounmpo: 1 personal fouls)   FT 1/2: MISS   FT 2/2: GOOD Carmelo Porzingis makes 1/2 from the line.
Score: 4-5

[10:27] Team_045 possession (Score: 4-5)
DeMar Turner attempts a Midrange. Contested by Isaiah Smith (3.0 feet, ZONE). DEMAR TURNER MAKES IT! Assist: Rudy Antetokounmpo
Score: 4-7

[10:15] Team_073 possession (Score: 4-7)
Isaiah Smith attempts a Layup. Wide open! Cole Simons is 6.3 feet away. [MAN] ISAIAH SMITH MAKES IT!
Score: 6-7

[10:03] Team_045 possession (Score: 6-7)
FOUL! Reach-in foul on Bradley Morant during the drive. [Team fouls: 1] No free throws, side out. (Bradley Morant: 1 personal fouls)

[09:47] Team_045 possession (Score: 6-7)
FOUL! Shooting foul on Bradley Morant. Zion Butler to the line for 2 free throws. [Team fouls: 2] (Bradley Morant: 2 personal fouls)   FT 1/2: GOOD   FT 2/2: GOOD Zion Butler makes 2/2 from the line.
Score: 6-9

[09:30] Team_073 possession (Score: 6-9)
FOUL! Holding foul on Cole Simons. [Team fouls: 2] No free throws, side out. (Cole Simons: 1 personal fouls)

[09:16] Team_073 possession (Score: 6-9)
Isaiah Smith attempts a 3Pt. Contested by Cole Simons (4.8 feet, MAN). Isaiah Smith misses. Rebound secured by Cole Simons.

[09:03] Team_045 possession (Score: 6-9)
Rudy Antetokounmpo attempts a 3Pt. Contested by Karl Williamson (2.7 feet, ZONE). Rudy Antetokounmpo misses. Rebound secured by Bradley Morant.

[08:46] Team_073 possession (Score: 6-9)
Isaiah Smith drives and kicks out. Isaiah Smith attempts a 3Pt. Contested by Cole Simons (2.8 feet, MAN). Isaiah Smith misses. Offensive rebound by Bradley Morant! Bradley Morant kicks it out.

[08:35] Team_073 possession (Score: 6-9)
Karl Williamson attempts a 3Pt. Contested by Cole Simons (2.4 feet, ZONE). KARL WILLIAMSON MAKES IT! Assist: Carmelo Young
Score: 9-9

[08:24] Team_045 possession (Score: 9-9)
Rudy Antetokounmpo attempts a 3Pt. Contested by Karl Williamson (4.9 feet, ZONE). Rudy Antetokounmpo misses. Rebound secured by Isaiah Smith.

[08:05] Team_073 possession (Score: 9-9)
Carmelo Porzingis drives and kicks out. Isaiah Smith attempts a Midrange. Wide open! Trae Russell is 8.9 feet away. [ZONE] ISAIAH SMITH MAKES IT! Assist: Carmelo Young
Score: 11-9

[07:49] Team_045 possession (Score: 11-9)
Zion Butler attempts a Layup. Contested by Bradley Morant (3.9 feet, ZONE). ZION BUTLER MAKES IT!
Score: 11-11

[07:35] Team_073 possession (Score: 11-11)
Carmelo Porzingis drives, picks up Zion Butler. Help arrives from Rudy Antetokounmpo! Carmelo Porzingis attempts a Dunk. Heavily contested by Rudy Antetokounmpo (2.0 feet, MAN)! CARMELO PORZINGIS MAKES IT! Assist: Bradley Morant
Score: 13-11

[07:24] Team_045 possession (Score: 13-11)
FOUL! Holding foul on Carmelo Porzingis. [Team fouls: 3] No free throws, side out. (Carmelo Porzingis: 1 personal fouls)

[07:07] Team_045 possession (Score: 13-11)
Cole Simons drives and kicks out. DeMar Turner attempts a 3Pt. Contested by Carmelo Porzingis (2.3 feet, MAN). DeMar Turner misses. Rebound secured by Isaiah Smith.

[06:53] Team_073 possession (Score: 13-11)
Carmelo Young attempts a 3Pt. Wide open! Cole Simons is 7.4 feet away. [ZONE] Carmelo Young misses. Rebound secured by Cole Simons.

[06:41] Team_045 possession (Score: 13-11)
Cole Simons attempts a 3Pt. Contested by Karl Williamson (4.5 feet, ZONE). COLE SIMONS MAKES IT! Assist: DeMar Turner
Score: 13-14

[06:31] Team_073 possession (Score: 13-14)
Isaiah Smith attempts a 3Pt. Contested by Cole Simons (4.2 feet, ZONE). Isaiah Smith misses. Rebound secured by Cole Simons.

[06:19] Team_045 possession (Score: 13-14)
Trae Russell throws a bad pass! Stolen by Isaiah Smith! TURNOVER! (live ball)

[06:06] Team_073 possession (Score: 13-14)
Bradley Morant drives, picks up Zion Butler. Help arrives from Rudy Antetokounmpo! Bradley Morant attempts a Layup. Heavily contested by Rudy Antetokounmpo (0.9 feet, ZONE)! BRADLEY MORANT MAKES IT! Assist: Carmelo Porzingis
Score: 15-14

[05:49] Team_045 possession (Score: 15-14)
Trae Russell attempts a 3Pt. Contested by Karl Williamson (2.3 feet, ZONE). Trae Russell misses. Offensive rebound by Zion Butler! Zion Butler's putback is no good. Rebound secured by Carmelo Porzingis.

[05:36] Team_073 possession (Score: 15-14)
Karl Williamson attempts a 3Pt. Wide open! Cole Simons is 6.4 feet away. [MAN] Karl Williamson misses. Rebound secured by Cole Simons.

[05:22] Team_045 possession (Score: 15-14)
FOUL! Shooting foul on Carmelo Young. Rudy Antetokounmpo to the line for 3 free throws. [Team fouls: 4] (Carmelo Young: 1 personal fouls)   FT 1/3: GOOD   FT 2/3: GOOD   FT 3/3: GOOD Rudy Antetokounmpo makes 3/3 from the line.
Score: 15-17

[05:10] Team_073 possession (Score: 15-17)
Bradley Morant attempts a Midrange. Contested by Zion Butler (5.1 feet, MAN). BRADLEY MORANT MAKES IT!
Score: 17-17

[04:58] Team_045 possession (Score: 17-17)
DeMar Turner attempts a 3Pt. Contested by Carmelo Porzingis (2.2 feet, MAN). DeMar Turner misses. FOUL! Loose ball foul on Bradley Morant during the rebound battle. [IN THE BONUS! 5 team fouls] DeMar Turner to the line for 2 free throws. (Bradley Morant: 3 personal fouls)   FT 1/2: GOOD   FT 2/2: GOOD DeMar Turner makes 2/2 from the line.
Score: 17-19

[04:44] Team_073 possession (Score: 17-19)
Isaiah Smith attempts a Layup. Wide open! Zion Butler is 6.5 feet away. [ZONE] ISAIAH SMITH MAKES IT!
Score: 19-19

[04:27] Team_045 possession (Score: 19-19)
Rudy Antetokounmpo drives, Carmelo Young stays with him. Rudy Antetokounmpo attempts a Dunk. Wide open! Carmelo Young is 6.1 feet away. [MAN] RUDY ANTETOKOUNMPO MAKES IT! Assist: Trae Russell
Score: 19-21

[04:12] Team_073 possession (Score: 19-21)
Karl Williamson attempts a 3Pt. Contested by Cole Simons (4.0 feet, ZONE). Karl Williamson misses. FOUL! Loose ball foul on Zion Butler during the rebound battle. [Team fouls: 3] No free throws, side out. (Zion Butler: 1 personal fouls)

[03:58] Team_073 possession (Score: 19-21)
Karl Williamson makes the Midrange and draws the foul on Cole Simons! And-1! Karl Williamson to the line for 1. [Team fouls: 4] (Cole Simons: 2 personal fouls)   FT 1/1: GOOD Karl Williamson makes 1/1 from the line.
Score: 22-21

[03:41] Team_045 possession (Score: 22-21)
Zion Butler drives and kicks out. DeMar Turner attempts a 3Pt. Contested by Carmelo Porzingis (3.7 feet, MAN). DeMar Turner misses. Rebound secured by Carmelo Porzingis.

[03:26] Team_073 possession (Score: 22-21)
Carmelo Young attempts a 3Pt. Wide open! Rudy Antetokounmpo is 6.3 feet away. [MAN] CARMELO YOUNG MAKES IT! Assist: Carmelo Porzingis
Score: 25-21

[03:14] Team_045 possession (Score: 25-21)
Trae Russell attempts a 3Pt. Wide open! Karl Williamson is 6.7 feet away. [ZONE] Trae Russell misses. Offensive rebound by Zion Butler! Zion Butler's putback is no good. Rebound secured by Carmelo Porzingis.

[03:00] Team_073 possession (Score: 25-21)
FOUL! Reach-in foul on Zion Butler during the drive. [IN THE BONUS! 5 team fouls] Bradley Morant to the line for 2 free throws. (Zion Butler: 2 personal fouls)   FT 1/2: GOOD   FT 2/2: MISS Bradley Morant makes 1/2 from the line. Rebound secured by Cole Simons.
Score: 26-21

[02:45] Team_045 possession (Score: 26-21)
DeMar Turner attempts a Midrange. Contested by Carmelo Porzingis (2.6 feet, MAN). DeMar Turner misses. Rebound secured by Carmelo Porzingis.

[02:32] Team_073 possession (Score: 26-21)
Bradley Morant attempts a Dunk. BLOCKED BY ZION BUTLER! Ball goes out off Zion Butler. Bradley Morant's ball!

[02:17] Team_073 possession (Score: 26-21)
Isaiah Smith attempts a 3Pt. Contested by Cole Simons (4.2 feet, MAN). ISAIAH SMITH MAKES IT!
Score: 29-21

[02:05] Team_045 possession (Score: 29-21)
Cole Simons drives and kicks out. Rudy Antetokounmpo attempts a 3Pt. Contested by Carmelo Young (5.3 feet, MAN). Rudy Antetokounmpo misses. Rebound secured by Carmelo Porzingis.

[01:49] Team_073 possession (Score: 29-21)
Carmelo Young drives and kicks out. Carmelo Young attempts a 3Pt. Contested by DeMar Turner (5.7 feet, ZONE). CARMELO YOUNG MAKES IT! Assist: Isaiah Smith
Score: 32-21

[01:36] Team_045 possession (Score: 32-21)
FOUL! Offensive foul on Trae Russell! Isaiah Smith drew the charge! [Team fouls: 6] (Trae Russell: 1 personal fouls) TURNOVER! (dead ball)

[01:20] Team_073 possession (Score: 32-21)
Isaiah Smith attempts a 3Pt. Contested by Cole Simons (2.7 feet, ZONE). Isaiah Smith misses. Offensive rebound by Bradley Morant! Bradley Morant kicks it out.

[01:01] Team_073 possession (Score: 32-21)
Bradley Morant attempts a 3Pt. Contested by Cole Simons (2.7 feet, ZONE). Bradley Morant misses. Rebound secured by DeMar Turner.

[00:48] Team_045 possession (Score: 32-21)
Zion Butler drives to the basket... Zion Butler throws a bad pass! Stolen by Bradley Morant! TURNOVER! (live ball)

[00:35] Team_073 possession (Score: 32-21)
Isaiah Smith makes the Layup and draws the foul on Cole Simons! And-1! Isaiah Smith to the line for 1. [BONUS: 7 team fouls] (Cole Simons: 3 personal fouls)   FT 1/1: GOOD Isaiah Smith makes 1/1 from the line.
Score: 35-21

[00:19] Team_045 possession (Score: 35-21)
DeMar Turner attempts a Layup. Contested by Carmelo Porzingis (5.3 feet, MAN). DEMAR TURNER MAKES IT! Assist: Trae Russell
Score: 35-23

[00:01] Team_073 possession (Score: 35-23)
Bradley Morant attempts a Midrange. Wide open! Trae Russell is 6.2 feet away. [ZONE] Bradley Morant misses. Rebound secured by Zion Butler.

================================================================================
                              1ST QUARTER COMPLETE                              
================================================================================

1ST QUARTER SCORE: Team_073 35, Team_045 23

BOX SCORE:
================================================================================

Team_073
--------------------------------------------------------------------------------
Player                MIN  PTS  REB  AST  TO      FG   FG%      3P   3P%
--------------------------------------------------------------------------------
Isaiah Smith           12   15    2    1   0   6/9    66.7     0/0   0.0
Carmelo Young          12    6    0    3   0   2/3    66.7     0/0   0.0
Karl Williamson        12    6    0    0   0   2/3    66.7     0/0   0.0
Bradley Morant         12    4    4    1   0   2/5    40.0     0/0   0.0
Carmelo Porzingis      12    3    6    2   0   2/2   100.0     0/0   0.0

TEAM: FG: 14/22 (63.6%), 3PT: 4/10 (40.0%), REB: 10 (4 off, 6 def), AST: 7, TO: 0
TEAM FOULS: 5 [Team_045 in BONUS]


Team_045
--------------------------------------------------------------------------------
Player                MIN  PTS  REB  AST  TO      FG   FG%      3P   3P%
--------------------------------------------------------------------------------
Rudy Antetokounmpo     12    7    0    1   0   3/5    60.0     0/0   0.0
Cole Simons            12    6    5    0   0   2/4    50.0     0/0   0.0
DeMar Turner           12    6    1    2   0   3/4    75.0     0/0   0.0
Zion Butler            12    4    2    0   0   2/3    66.7     0/0   0.0
Trae Russell           12    0    0    3   0   0/2     0.0     0/0   0.0

TEAM: FG: 10/18 (55.6%), 3PT: 4/8 (50.0%), REB: 10 (2 off, 8 def), AST: 6, TO: 3
TEAM FOULS: 7 [Team_073 in BONUS]

================================================================================

================================================================================
                       2ND QUARTER - Team_073 vs Team_045                       
================================================================================

[12:00] Team_073 possession (Score: 35-23)
FOUL! Shooting foul on Rudy Antetokounmpo. Carmelo Young to the line for 2 free throws. [Team fouls: 1] (Rudy Antetokounmpo: 1 personal fouls)   FT 1/2: MISS   FT 2/2: GOOD Carmelo Young makes 1/2 from the line.
Score: 36-23

[11:47] Team_045 possession (Score: 36-23)
Zion Butler attempts a Layup. Contested by Bradley Morant (3.6 feet, MAN). ZION BUTLER MAKES IT! Assist: Cole Simons
Score: 36-25

[11:34] Team_073 possession (Score: 36-25)
Carmelo Young attempts a 3Pt. Contested by Cole Simons (4.5 feet, ZONE). Carmelo Young misses. Rebound secured by DeMar Turner.

[11:17] Team_045 possession (Score: 36-25)
FOUL! Shooting foul on Isaiah Smith. DeMar Turner to the line for 2 free throws. [Team fouls: 1] (Isaiah Smith: 1 personal fouls)   FT 1/2: GOOD   FT 2/2: MISS DeMar Turner makes 1/2 from the line. Rebound secured by Bradley Morant.
Score: 36-26

[10:59] Team_073 possession (Score: 36-26)
Karl Williamson attempts a Midrange. Contested by Cole Simons (4.5 feet, ZONE). KARL WILLIAMSON MAKES IT! Assist: Isaiah Smith
Score: 38-26

[10:43] Team_045 possession (Score: 38-26)
Cole Simons attempts a Midrange. Heavily contested by Karl Williamson (1.8 feet, MAN)! COLE SIMONS MAKES IT! Assist: Zion Butler
Score: 38-28

[10:27] Team_073 possession (Score: 38-28)
Carmelo Young attempts a 3Pt. Contested by Cole Simons (2.3 feet, ZONE). Carmelo Young misses. Rebound secured by Zion Butler.

[10:13] Team_045 possession (Score: 38-28)
Cole Simons attempts a 3Pt. Wide open! Karl Williamson is 6.1 feet away. [ZONE] Cole Simons misses. Rebound secured by Isaiah Smith.

[09:56] Team_073 possession (Score: 38-28)
Isaiah Smith attempts a 3Pt. Contested by Cole Simons (5.0 feet, MAN). Isaiah Smith misses. Rebound secured by Zion Butler.

[09:45] Team_045 possession (Score: 38-28)
FOUL! Shooting foul on Bradley Morant. Cole Simons to the line for 2 free throws. [Team fouls: 2] (Bradley Morant: 1 personal fouls)   FT 1/2: GOOD   FT 2/2: GOOD Cole Simons makes 2/2 from the line.
Score: 38-30

[09:33] Team_073 possession (Score: 38-30)
Bradley Morant makes the Layup and draws the foul on Zion Butler! And-1! Bradley Morant to the line for 1. [Team fouls: 2] (Zion Butler: 1 personal fouls)   FT 1/1: GOOD Bradley Morant makes 1/1 from the line.
Score: 41-30

[09:18] Team_045 possession (Score: 41-30)
Cole Simons attempts a Layup. Heavily contested by Karl Williamson (0.5 feet, MAN)! Cole Simons misses. Rebound secured by Carmelo Porzingis.

[09:07] Team_073 possession (Score: 41-30)
FOUL! Shooting foul on Zion Butler. Isaiah Smith to the line for 2 free throws. [Team fouls: 3] (Zion Butler: 2 personal fouls)   FT 1/2: GOOD   FT 2/2: GOOD Isaiah Smith makes 2/2 from the line.
Score: 43-30

[08:51] Team_045 possession (Score: 43-30)
FOUL! Shooting foul on Isaiah Smith. Trae Russell to the line for 2 free throws. [Team fouls: 3] (Isaiah Smith: 2 personal fouls)   FT 1/2: GOOD   FT 2/2: GOOD Trae Russell makes 2/2 from the line.
Score: 43-32

[08:33] Team_073 possession (Score: 43-32)
Bradley Morant attempts a Layup. BLOCKED BY ZION BUTLER! Ball deflects out of bounds off Bradley Morant.

[08:21] Team_045 possession (Score: 43-32)
FOUL! Reach-in foul on Isaiah Smith during the drive. [Team fouls: 4] No free throws, side out. (Isaiah Smith: 3 personal fouls)

[08:07] Team_045 possession (Score: 43-32)
Cole Simons attempts a Midrange. Contested by Karl Williamson (4.5 feet, MAN). Cole Simons misses. Rebound secured by Bradley Morant.

[07:53] Team_073 possession (Score: 43-32)
Karl Williamson attempts a 3Pt. Contested by Cole Simons (4.5 feet, MAN). Karl Williamson misses. Rebound secured by Zion Butler.

[07:36] Team_045 possession (Score: 43-32)
Zion Butler drives, Bradley Morant stays with him. Zion Butler attempts a Layup. Contested by Bradley Morant (5.7 feet, MAN). ZION BUTLER MAKES IT!
Score: 43-34

[07:22] Team_073 possession (Score: 43-34)
FOUL! Offensive foul on Carmelo Young! Rudy Antetokounmpo drew the charge! [Team fouls: 5] (Carmelo Young: 1 personal fouls) TURNOVER! (dead ball)

[07:04] Team_045 possession (Score: 43-34)
Zion Butler drives, Bradley Morant stays with him. Zion Butler attempts a Layup. Contested by Bradley Morant (4.9 feet, ZONE). ZION BUTLER MAKES IT! Assist: Trae Russell
Score: 43-36

[06:47] Team_073 possession (Score: 43-36)
Bradley Morant drives, Zion Butler stays with him. Bradley Morant attempts a Layup. Wide open! Zion Butler is 6.6 feet away. [ZONE] BRADLEY MORANT MAKES IT! Assist: Carmelo Porzingis
Score: 45-36

[06:36] Team_045 possession (Score: 45-36)
DeMar Turner attempts a 3Pt. Contested by Carmelo Porzingis (4.9 feet, MAN). DEMAR TURNER MAKES IT! Assist: Zion Butler
Score: 45-39

[06:23] Team_073 possession (Score: 45-39)
Carmelo Porzingis attempts a 3Pt. Wide open! Trae Russell is 7.5 feet away. [ZONE] CARMELO PORZINGIS MAKES IT! Assist: Karl Williamson
Score: 48-39

[06:12] Team_045 possession (Score: 48-39)
Rudy Antetokounmpo drives to the basket... Rudy Antetokounmpo loses control! Ball rolls out of bounds! TURNOVER! (dead ball)

[06:12] Substitution (Team_073): Carmelo Young OUT → Zach Quickley IN (stamina_rule2)

[06:12] Substitution (Team_073): Isaiah Smith OUT → Luka Butler IN (stamina_rule2)

[06:12] Substitution (Team_073): Karl Williamson OUT → Dwyane McCollum IN (stamina_rule2)

[06:12] Substitution (Team_073): Carmelo Porzingis OUT → Shai Thompson IN (stamina_rule2)

[06:12] Substitution (Team_073): Bradley Morant OUT → Ja Rose IN (stamina_rule2)

[06:12] Substitution (Team_045): Rudy Antetokounmpo OUT → John Wagner IN (stamina_rule2)

[06:12] Substitution (Team_045): Trae Russell OUT → Julius James IN (stamina_rule2)

[06:12] Substitution (Team_045): Cole Simons OUT → Gary Towns IN (stamina_rule2)

[06:12] Substitution (Team_045): DeMar Turner OUT → Tim Sexton IN (stamina_rule2)

[06:12] Substitution (Team_045): Zion Butler OUT → Stephen Paul IN (stamina_rule2)

[05:56] Team_073 possession (Score: 48-39)
Dwyane McCollum attempts a 3Pt. Heavily contested by John Wagner (0.5 feet, ZONE)! Dwyane McCollum misses. Offensive rebound by Ja Rose! Ja Rose kicks it out.

[05:43] Team_073 possession (Score: 48-39)
Ja Rose attempts a Layup. Contested by Stephen Paul (4.1 feet, ZONE). JA ROSE MAKES IT! Assist: Dwyane McCollum
Score: 50-39

[05:30] Team_045 possession (Score: 50-39)
Gary Towns commits a violation (traveling/carry)! TURNOVER! (dead ball)

[05:18] Team_073 possession (Score: 50-39)
Dwyane McCollum throws a bad pass out of bounds! TURNOVER! (dead ball)

[05:05] Team_045 possession (Score: 50-39)
Julius James drives to the basket... Julius James throws a bad pass out of bounds! TURNOVER! (dead ball)

[04:51] Team_073 possession (Score: 50-39)
FOUL! Reach-in foul on Stephen Paul during the drive. [Team fouls: 4] No free throws, side out. (Stephen Paul: 1 personal fouls)

[04:39] Team_073 possession (Score: 50-39)
FOUL! Shooting foul on Stephen Paul. Zach Quickley to the line for 2 free throws. [BONUS: 5 team fouls] (Stephen Paul: 2 personal fouls)   FT 1/2: MISS   FT 2/2: GOOD Zach Quickley makes 1/2 from the line.
Score: 51-39

[04:23] Team_045 possession (Score: 51-39)
Tim Sexton attempts a 3Pt. Wide open! Luka Butler is 6.3 feet away. [ZONE] Tim Sexton misses. Rebound secured by Dwyane McCollum.

[04:05] Team_073 possession (Score: 51-39)
Ja Rose attempts a Midrange. Contested by Stephen Paul (5.7 feet, MAN). Ja Rose misses. Offensive rebound by Dwyane McCollum! Dwyane McCollum's putback is no good. Rebound secured by Tim Sexton.

[03:52] Team_045 possession (Score: 51-39)
FOUL! Holding foul on Luka Butler. [IN THE BONUS! 6 team fouls] Julius James to the line for 2 free throws. (Luka Butler: 1 personal fouls)   FT 1/2: GOOD   FT 2/2: MISS Julius James makes 1/2 from the line. Offensive rebound by Julius James! Julius James kicks it out.
Score: 51-40

[03:36] Team_045 possession (Score: 51-40)
Gary Towns attempts a 3Pt. Contested by Luka Butler (5.5 feet, ZONE). Gary Towns misses. Rebound secured by Shai Thompson.

[03:23] Team_073 possession (Score: 51-40)
FOUL! Shooting foul on Gary Towns. Dwyane McCollum to the line for 2 free throws. [BONUS: 6 team fouls] (Gary Towns: 1 personal fouls)   FT 1/2: GOOD   FT 2/2: MISS Dwyane McCollum makes 1/2 from the line. Rebound secured by Tim Sexton.
Score: 52-40

[03:09] Team_045 possession (Score: 52-40)
Stephen Paul attempts a Layup. BLOCKED BY SHAI THOMPSON! Ball is loose! Rebound secured by Shai Thompson.

[02:54] Team_073 possession (Score: 52-40)
Dwyane McCollum drives to the basket... FOUL! Offensive foul on Dwyane McCollum! Stephen Paul drew the charge! [Team fouls: 7] (Dwyane McCollum: 1 personal fouls) TURNOVER! (dead ball)

[02:37] Team_045 possession (Score: 52-40)
John Wagner drives and kicks out. John Wagner makes the Midrange and draws the foul on Zach Quickley! And-1! John Wagner to the line for 1. [BONUS: 8 team fouls] (Zach Quickley: 1 personal fouls)   FT 1/1: GOOD John Wagner makes 1/1 from the line.
Score: 52-43

[02:20] Team_073 possession (Score: 52-43)
Luka Butler attempts a 3Pt. Contested by Julius James (5.1 feet, MAN). LUKA BUTLER MAKES IT! Assist: Shai Thompson
Score: 55-43

[02:01] Team_045 possession (Score: 55-43)
John Wagner drives, picks up Zach Quickley. Help arrives from Luka Butler! John Wagner attempts a Dunk. Contested by Luka Butler (3.8 feet, MAN). JOHN WAGNER MAKES IT!
Score: 55-45

[01:50] Team_073 possession (Score: 55-45)
Dwyane McCollum attempts a Layup. BLOCKED BY GARY TOWNS! Ball is loose! Rebound secured by Stephen Paul.

[01:37] Team_045 possession (Score: 55-45)
Gary Towns attempts a 3Pt. Contested by Luka Butler (5.3 feet, ZONE). Gary Towns misses. Rebound secured by Dwyane McCollum.

[01:23] Team_073 possession (Score: 55-45)
Ja Rose drives and kicks out. Shai Thompson attempts a 3Pt. Contested by John Wagner (4.9 feet, ZONE). SHAI THOMPSON MAKES IT! Assist: Ja Rose
Score: 58-45

[01:07] Team_045 possession (Score: 58-45)
Tim Sexton attempts a 3Pt. Contested by Shai Thompson (5.1 feet, MAN). Tim Sexton misses. Rebound secured by Shai Thompson.

[00:53] Team_073 possession (Score: 58-45)
Luka Butler throws a bad pass out of bounds! TURNOVER! (dead ball)

[00:40] Team_045 possession (Score: 58-45)
John Wagner drives and kicks out. John Wagner attempts a Midrange. Contested by Luka Butler (5.7 feet, ZONE). JOHN WAGNER MAKES IT! Assist: Gary Towns
Score: 58-47

[00:27] Team_073 possession (Score: 58-47)
Luka Butler attempts a 3Pt. Heavily contested by Julius James (1.6 feet, MAN)! Luka Butler misses. Rebound secured by Stephen Paul.

[00:14] Team_045 possession (Score: 58-47)
Stephen Paul makes the Layup and draws the foul on Luka Butler! And-1! Stephen Paul to the line for 1. [BONUS: 9 team fouls] (Luka Butler: 2 personal fouls)   FT 1/1: MISS Stephen Paul makes 0/1 from the line. Rebound secured by Shai Thompson.
Score: 58-49

[00:01] Team_073 possession (Score: 58-49)
Luka Butler attempts a Layup. Wide open! Stephen Paul is 7.5 feet away. [ZONE] LUKA BUTLER MAKES IT! Assist: Shai Thompson
Score: 60-49

================================================================================
                              2ND QUARTER COMPLETE                              
================================================================================

2ND QUARTER SCORE: Team_073 25, Team_045 26

BOX SCORE:
================================================================================

Team_073
--------------------------------------------------------------------------------
Player                MIN  PTS  REB  AST  TO      FG   FG%      3P   3P%
--------------------------------------------------------------------------------
Bradley Morant         18    5    2    0   0   2/3    66.7     0/0   0.0
Luka Butler             6    5    0    0   0   2/3    66.7     0/0   0.0
Carmelo Porzingis      18    3    1    1   0   1/1   100.0     0/0   0.0
Shai Thompson           6    3    4    2   0   1/1   100.0     0/0   0.0
Karl Williamson        18    2    0    1   0   1/2    50.0     0/0   0.0
Isaiah Smith           18    2    1    1   0   1/2    50.0     0/0   0.0
Ja Rose                 6    2    1    1   0   1/2    50.0     0/0   0.0
Carmelo Young          18    1    0    0   0   1/3    33.3     0/0   0.0
Zach Quickley           6    1    0    0   0   1/1   100.0     0/0   0.0
Dwyane McCollum         6    0    2    1   0   0/2     0.0     0/0   0.0

TEAM: FG: 11/20 (55.0%), 3PT: 2/7 (28.6%), REB: 12 (2 off, 10 def), AST: 7, TO: 4
TEAM FOULS: 9 [Team_045 in BONUS]


Team_045
--------------------------------------------------------------------------------
Player                MIN  PTS  REB  AST  TO      FG   FG%      3P   3P%
--------------------------------------------------------------------------------
John Wagner             6    7    0    0   0   3/3   100.0     0/0   0.0
Zion Butler            18    6    3    2   0   3/3   100.0     0/0   0.0
Cole Simons            18    4    0    1   0   2/5    40.0     0/0   0.0
DeMar Turner           18    3    1    0   0   1/2    50.0     0/0   0.0
Trae Russell           18    2    0    1   0   1/1   100.0     0/0   0.0
Tim Sexton              6    0    2    0   0   0/2     0.0     0/0   0.0
Julius James            6    0    1    0   0   0/0     0.0     0/0   0.0
Gary Towns              6    0    0    1   0   0/2     0.0     0/0   0.0
Stephen Paul            6    0    2    0   0   0/2     0.0     0/0   0.0

TEAM: FG: 10/20 (50.0%), 3PT: 1/6 (16.7%), REB: 8 (1 off, 7 def), AST: 5, TO: 3
TEAM FOULS: 6 [Team_073 in BONUS]

================================================================================

================================================================================
                       3RD QUARTER - Team_073 vs Team_045                       
================================================================================

[12:00] Team_073 possession (Score: 60-49)
Bradley Morant attempts a Layup. Contested by Zion Butler (2.0 feet, MAN). BRADLEY MORANT MAKES IT! Assist: Karl Williamson
Score: 62-49

[11:43] Team_045 possession (Score: 62-49)
Rudy Antetokounmpo attempts a 3Pt. Contested by Karl Williamson (4.3 feet, ZONE). RUDY ANTETOKOUNMPO MAKES IT! Assist: Zion Butler
Score: 62-52

[11:29] Team_073 possession (Score: 62-52)
Carmelo Porzingis attempts a Midrange. Contested by DeMar Turner (3.0 feet, ZONE). Carmelo Porzingis misses. Offensive rebound by Bradley Morant! Bradley Morant kicks it out.

[11:10] Team_073 possession (Score: 62-52)
Carmelo Porzingis throws a bad pass! Stolen by Zion Butler! TURNOVER! (live ball)

[10:58] Team_045 possession (Score: 62-52)
Cole Simons attempts a Layup. Wide open! Bradley Morant is 6.4 feet away. [ZONE] COLE SIMONS MAKES IT! Assist: Rudy Antetokounmpo
Score: 62-54

[10:42] Team_073 possession (Score: 62-54)
Karl Williamson attempts a 3Pt. Contested by Cole Simons (3.3 feet, ZONE). Karl Williamson misses. Rebound secured by DeMar Turner.

[10:28] Team_045 possession (Score: 62-54)
FOUL! Reach-in foul on Carmelo Porzingis during the drive. [Team fouls: 1] No free throws, side out. (Carmelo Porzingis: 1 personal fouls)

[10:17] Team_045 possession (Score: 62-54)
Zion Butler drives, Bradley Morant stays with him. Zion Butler attempts a Layup. Wide open! Bradley Morant is 8.5 feet away. [MAN] ZION BUTLER MAKES IT! Assist: Cole Simons
Score: 62-56

[10:05] Team_073 possession (Score: 62-56)
Carmelo Porzingis attempts a Layup. BLOCKED BY ZION BUTLER! Ball is loose! Offensive rebound by Bradley Morant! Bradley Morant kicks it out.

[09:50] Team_073 possession (Score: 62-56)
Carmelo Young attempts a 3Pt. Contested by Cole Simons (5.5 feet, ZONE). CARMELO YOUNG MAKES IT! Assist: Isaiah Smith
Score: 65-56

[09:36] Team_045 possession (Score: 65-56)
FOUL! Shooting foul on Bradley Morant. Zion Butler to the line for 2 free throws. [Team fouls: 2] (Bradley Morant: 1 personal fouls)   FT 1/2: GOOD   FT 2/2: GOOD Zion Butler makes 2/2 from the line.
Score: 65-58

[09:22] Team_073 possession (Score: 65-58)
Bradley Morant makes the Dunk and draws the foul on Zion Butler! And-1! Bradley Morant to the line for 1. [Team fouls: 1] (Zion Butler: 1 personal fouls)   FT 1/1: MISS Bradley Morant makes 0/1 from the line. Rebound secured by Cole Simons.
Score: 67-58

[09:07] Team_045 possession (Score: 67-58)
DeMar Turner attempts a Midrange. Contested by Carmelo Porzingis (4.1 feet, MAN). DeMar Turner misses. Rebound secured by Bradley Morant.

[08:54] Team_073 possession (Score: 67-58)
Karl Williamson attempts a 3Pt. Contested by Cole Simons (2.4 feet, ZONE). Karl Williamson misses. FOUL! Loose ball foul on Cole Simons during the rebound battle. [Team fouls: 2] No free throws, side out. (Cole Simons: 1 personal fouls)

[08:39] Team_073 possession (Score: 67-58)
FOUL! Holding foul on Rudy Antetokounmpo. [Team fouls: 3] No free throws, side out. (Rudy Antetokounmpo: 1 personal fouls)

[08:24] Team_073 possession (Score: 67-58)
FOUL! Shooting foul on Cole Simons. Isaiah Smith to the line for 3 free throws. [Team fouls: 4] (Cole Simons: 2 personal fouls)   FT 1/3: GOOD   FT 2/3: GOOD   FT 3/3: GOOD Isaiah Smith makes 3/3 from the line.
Score: 70-58

[08:09] Team_045 possession (Score: 70-58)
Rudy Antetokounmpo attempts a 3Pt. Wide open! Karl Williamson is 8.6 feet away. [ZONE] Rudy Antetokounmpo misses. Rebound secured by Bradley Morant.

[07:54] Team_073 possession (Score: 70-58)
FOUL! Reach-in foul on Cole Simons during the drive. [IN THE BONUS! 5 team fouls] Karl Williamson to the line for 2 free throws. (Cole Simons: 3 personal fouls)   FT 1/2: GOOD   FT 2/2: MISS Karl Williamson makes 1/2 from the line. Rebound secured by Zion Butler.
Score: 71-58

[07:39] Team_045 possession (Score: 71-58)
Rudy Antetokounmpo drives and kicks out. Trae Russell attempts a 3Pt. Contested by Isaiah Smith (2.7 feet, MAN). TRAE RUSSELL MAKES IT! Assist: Rudy Antetokounmpo
Score: 71-61

[07:24] Team_073 possession (Score: 71-61)
Bradley Morant attempts a 3Pt. Contested by Rudy Antetokounmpo (5.8 feet, ZONE). Bradley Morant misses. Offensive rebound by Carmelo Porzingis! Carmelo Porzingis kicks it out.

[07:06] Team_073 possession (Score: 71-61)
Carmelo Porzingis drives, picks up Zion Butler. Help arrives from Rudy Antetokounmpo! Carmelo Porzingis attempts a Layup. Contested by Rudy Antetokounmpo (3.5 feet, ZONE). Carmelo Porzingis misses. Rebound secured by DeMar Turner.

[06:48] Team_045 possession (Score: 71-61)
Zion Butler attempts a Midrange. Contested by Karl Williamson (5.0 feet, ZONE). Zion Butler misses. Rebound secured by Bradley Morant.

[06:32] Team_073 possession (Score: 71-61)
Carmelo Young attempts a Layup. BLOCKED BY ZION BUTLER! Ball is loose! Rebound secured by Zion Butler.

[06:17] Team_045 possession (Score: 71-61)
DeMar Turner attempts a Midrange. BLOCKED BY CARMELO PORZINGIS! Ball is loose! Offensive rebound by Zion Butler! Zion Butler kicks it out.

[06:01] Team_045 possession (Score: 71-61)
DeMar Turner attempts a 3Pt. Contested by Carmelo Porzingis (3.4 feet, MAN). DeMar Turner misses. Offensive rebound by Zion Butler! Zion Butler's putback is no good. Offensive rebound by Zion Butler! Zion Butler kicks it out.

[05:48] Team_045 possession (Score: 71-61)
Trae Russell attempts a 3Pt. Wide open! Isaiah Smith is 6.7 feet away. [MAN] TRAE RUSSELL MAKES IT! Assist: Zion Butler
Score: 71-64

[05:33] Team_073 possession (Score: 71-64)
Karl Williamson attempts a 3Pt. Wide open! Rudy Antetokounmpo is 6.2 feet away. [ZONE] Karl Williamson misses. Rebound secured by Zion Butler.

[05:21] Team_045 possession (Score: 71-64)
Zion Butler drives, Bradley Morant stays with him. Zion Butler attempts a Layup. Contested by Bradley Morant (4.5 feet, ZONE). ZION BUTLER MAKES IT! Assist: Trae Russell
Score: 71-66

[05:06] Team_073 possession (Score: 71-66)
Carmelo Young attempts a 3Pt. Heavily contested by Cole Simons (1.6 feet, ZONE)! Carmelo Young misses. Rebound secured by Zion Butler.

[04:52] Team_045 possession (Score: 71-66)
Zion Butler loses control! Ball rolls out of bounds! TURNOVER! (dead ball)

[04:37] Team_073 possession (Score: 71-66)
FOUL! Reach-in foul on Zion Butler during the drive. [IN THE BONUS! 6 team fouls] Bradley Morant to the line for 2 free throws. (Zion Butler: 2 personal fouls)   FT 1/2: MISS   FT 2/2: GOOD Bradley Morant makes 1/2 from the line.
Score: 72-66

[04:23] Team_045 possession (Score: 72-66)
FOUL! Shooting foul on Isaiah Smith. Zion Butler to the line for 2 free throws. [Team fouls: 3] (Isaiah Smith: 1 personal fouls)   FT 1/2: MISS   FT 2/2: GOOD Zion Butler makes 1/2 from the line.
Score: 72-67

[04:11] Team_073 possession (Score: 72-67)
Bradley Morant drives, Zion Butler stays with him. Bradley Morant attempts a Dunk. Contested by Zion Butler (2.7 feet, ZONE). BRADLEY MORANT MAKES IT! Assist: Carmelo Young
Score: 74-67

[03:52] Team_045 possession (Score: 74-67)
Zion Butler attempts a Midrange. BLOCKED BY BRADLEY MORANT! Ball is loose! Rebound secured by Isaiah Smith.

[03:42] Team_073 possession (Score: 74-67)
Carmelo Young drives, Rudy Antetokounmpo stays with him. Carmelo Young attempts a Layup. Wide open! Rudy Antetokounmpo is 6.8 feet away. [MAN] CARMELO YOUNG MAKES IT!
Score: 76-67

[03:28] Team_045 possession (Score: 76-67)
Cole Simons attempts a 3Pt. Contested by Karl Williamson (4.0 feet, MAN). COLE SIMONS MAKES IT! Assist: Zion Butler
Score: 76-70

[03:13] Team_073 possession (Score: 76-70)
FOUL! Offensive foul on Isaiah Smith! Cole Simons drew the charge! [Team fouls: 4] (Isaiah Smith: 2 personal fouls) TURNOVER! (dead ball)

[03:02] Team_045 possession (Score: 76-70)
Zion Butler makes the Layup and draws the foul on Bradley Morant! And-1! Zion Butler to the line for 1. [BONUS: 5 team fouls] (Bradley Morant: 2 personal fouls)   FT 1/1: GOOD Zion Butler makes 1/1 from the line.
Score: 76-73

[02:46] Team_073 possession (Score: 76-73)
Isaiah Smith attempts a 3Pt. Contested by Cole Simons (4.8 feet, MAN). ISAIAH SMITH MAKES IT!
Score: 79-73

[02:32] Team_045 possession (Score: 79-73)
Zion Butler attempts a Dunk. BLOCKED BY BRADLEY MORANT! Ball is loose! Rebound secured by Isaiah Smith.

[02:15] Team_073 possession (Score: 79-73)
Karl Williamson drives, Zion Butler stays with him. Karl Williamson attempts a Layup. Wide open! Zion Butler is 6.8 feet away. [ZONE] Karl Williamson misses. Rebound secured by Cole Simons.

[02:00] Team_045 possession (Score: 79-73)
Trae Russell attempts a 3Pt. Contested by Karl Williamson (2.4 feet, ZONE). Trae Russell misses. Offensive rebound by DeMar Turner! DeMar Turner kicks it out.

[01:43] Team_045 possession (Score: 79-73)
Trae Russell attempts a 3Pt. Wide open! Isaiah Smith is 6.1 feet away. [MAN] Trae Russell misses. Offensive rebound by DeMar Turner! DeMar Turner kicks it out.

[01:27] Team_045 possession (Score: 79-73)
Cole Simons attempts a 3Pt. Wide open! Karl Williamson is 6.5 feet away. [MAN] Cole Simons misses. Rebound secured by Isaiah Smith.

[01:17] Team_073 possession (Score: 79-73)
FOUL! Reach-in foul on Zion Butler during the drive. [IN THE BONUS! 7 team fouls] Bradley Morant to the line for 2 free throws. (Zion Butler: 3 personal fouls)   FT 1/2: GOOD   FT 2/2: GOOD Bradley Morant makes 2/2 from the line.
Score: 81-73

[01:02] Team_045 possession (Score: 81-73)
Cole Simons attempts a 3Pt. Heavily contested by Karl Williamson (0.5 feet, MAN)! Cole Simons misses. Rebound secured by Carmelo Porzingis.

[00:46] Team_073 possession (Score: 81-73)
Bradley Morant attempts a Midrange. Contested by Zion Butler (2.8 feet, MAN). Bradley Morant misses. Rebound secured by Cole Simons.

[00:31] Team_045 possession (Score: 81-73)
Rudy Antetokounmpo attempts a 3Pt. Heavily contested by Karl Williamson (0.5 feet, ZONE)! Rudy Antetokounmpo misses. Offensive rebound by Zion Butler! Zion Butler's putback is no good. Offensive rebound by Zion Butler! Zion Butler kicks it out.

[00:17] Team_045 possession (Score: 81-73)
Rudy Antetokounmpo attempts a 3Pt. Contested by Karl Williamson (5.4 feet, ZONE). Rudy Antetokounmpo misses. Offensive rebound by Zion Butler! Zion Butler's putback is no good. Offensive rebound by Zion Butler! Zion Butler kicks it out.

[00:03] Team_045 possession (Score: 81-73)
Cole Simons drives and kicks out. Trae Russell attempts a Midrange. Wide open! Isaiah Smith is 6.3 feet away. [ZONE] Trae Russell misses. Rebound secured by Bradley Morant.

================================================================================
                              3RD QUARTER COMPLETE                              
================================================================================

3RD QUARTER SCORE: Team_073 21, Team_045 24

BOX SCORE:
================================================================================

Team_073
--------------------------------------------------------------------------------
Player                MIN  PTS  REB  AST  TO      FG   FG%      3P   3P%
--------------------------------------------------------------------------------
Bradley Morant         30    7    7    0   0   4/6    66.7     0/0   0.0
Isaiah Smith           30    6    3    1   0   2/2   100.0     0/0   0.0
Carmelo Young          30    5    0    1   0   2/4    50.0     0/0   0.0
Karl Williamson        30    0    0    1   0   0/4     0.0     0/0   0.0
Carmelo Porzingis      30    0    2    0   0   0/1     0.0     0/0   0.0

TEAM: FG: 8/17 (47.1%), 3PT: 3/6 (50.0%), REB: 12 (4 off, 8 def), AST: 3, TO: 2
TEAM FOULS: 5 [Team_045 in BONUS]


Team_045
--------------------------------------------------------------------------------
Player                MIN  PTS  REB  AST  TO      FG   FG%      3P   3P%
--------------------------------------------------------------------------------
Zion Butler            30   10    8    3   0   5/8    62.5     0/0   0.0
Trae Russell           30    6    0    1   0   2/2   100.0     0/0   0.0
Cole Simons            30    5    3    1   0   2/5    40.0     0/0   0.0
Rudy Antetokounmpo     30    3    0    2   0   1/2    50.0     0/0   0.0
DeMar Turner           30    0    4    0   0   0/1     0.0     0/0   0.0

TEAM: FG: 10/18 (55.6%), 3PT: 3/6 (50.0%), REB: 15 (6 off, 9 def), AST: 7, TO: 1
TEAM FOULS: 7 [Team_073 in BONUS]

================================================================================

================================================================================
                       4TH QUARTER - Team_073 vs Team_045                       
================================================================================

[12:00] Team_073 possession (Score: 81-73)
Carmelo Young makes the Midrange and draws the foul on Rudy Antetokounmpo! And-1! Carmelo Young to the line for 1. [Team fouls: 1] (Rudy Antetokounmpo: 1 personal fouls)   FT 1/1: GOOD Carmelo Young makes 1/1 from the line.
Score: 84-73

[11:45] Team_045 possession (Score: 84-73)
FOUL! Shooting foul on Isaiah Smith. Zion Butler to the line for 2 free throws. [Team fouls: 1] (Isaiah Smith: 1 personal fouls)   FT 1/2: GOOD   FT 2/2: MISS Zion Butler makes 1/2 from the line. Rebound secured by Bradley Morant.
Score: 84-74

[11:32] Team_073 possession (Score: 84-74)
Bradley Morant drives, Zion Butler stays with him. Bradley Morant attempts a Dunk. Contested by Zion Butler (4.0 feet, MAN). Bradley Morant misses. Rebound secured by Cole Simons.

[11:21] Team_045 possession (Score: 84-74)
Rudy Antetokounmpo attempts a Midrange. Contested by Bradley Morant (5.2 feet, ZONE). Rudy Antetokounmpo misses. FOUL! Loose ball foul on Isaiah Smith during the rebound battle. [Team fouls: 2] No free throws, side out. (Isaiah Smith: 2 personal fouls)

[11:06] Team_045 possession (Score: 84-74)
FOUL! Shooting foul on Isaiah Smith. Trae Russell to the line for 2 free throws. [Team fouls: 3] (Isaiah Smith: 3 personal fouls)   FT 1/2: GOOD   FT 2/2: GOOD Trae Russell makes 2/2 from the line.
Score: 84-76

[10:53] Team_073 possession (Score: 84-76)
FOUL! Reach-in foul on DeMar Turner during the drive. [Team fouls: 2] No free throws, side out. (DeMar Turner: 1 personal fouls)

[10:36] Team_073 possession (Score: 84-76)
Carmelo Young drives to the basket... Carmelo Young commits a violation (traveling/carry)! TURNOVER! (dead ball)

[10:36] Substitution (Team_073): Carmelo Young OUT → Zach Quickley IN (stamina_rule2)

[10:36] Substitution (Team_073): Isaiah Smith OUT → Luka Butler IN (stamina_rule2)

[10:36] Substitution (Team_073): Karl Williamson OUT → Dwyane McCollum IN (stamina_rule2)

[10:36] Substitution (Team_073): Carmelo Porzingis OUT → Shai Thompson IN (stamina_rule2)

[10:36] Substitution (Team_073): Bradley Morant OUT → Ja Rose IN (stamina_rule2)

[10:36] Substitution (Team_045): Rudy Antetokounmpo OUT → John Wagner IN (stamina_rule2)

[10:36] Substitution (Team_045): Trae Russell OUT → Julius James IN (stamina_rule2)

[10:36] Substitution (Team_045): Cole Simons OUT → Gary Towns IN (stamina_rule2)

[10:36] Substitution (Team_045): DeMar Turner OUT → Tim Sexton IN (stamina_rule2)

[10:36] Substitution (Team_045): Zion Butler OUT → Stephen Paul IN (stamina_rule2)

[10:23] Team_045 possession (Score: 84-76)
Gary Towns attempts a 3Pt. Wide open! Shai Thompson is 7.8 feet away. [ZONE] Gary Towns misses. Offensive rebound by Tim Sexton! Tim Sexton kicks it out.

[10:08] Team_045 possession (Score: 84-76)
Stephen Paul attempts a Midrange. Contested by Ja Rose (5.1 feet, MAN). STEPHEN PAUL MAKES IT!
Score: 84-78

[09:52] Team_073 possession (Score: 84-78)
Dwyane McCollum attempts a Midrange. Wide open! Gary Towns is 6.9 feet away. [MAN] DWYANE MCCOLLUM MAKES IT! Assist: Luka Butler
Score: 86-78

[09:42] Team_045 possession (Score: 86-78)
Gary Towns attempts a 3Pt. Contested by Luka Butler (3.7 feet, ZONE). Gary Towns misses. Offensive rebound by Julius James! Julius James kicks it out.

[09:28] Team_045 possession (Score: 86-78)
FOUL! Shooting foul on Shai Thompson. Tim Sexton to the line for 2 free throws. [Team fouls: 4] (Shai Thompson: 1 personal fouls)   FT 1/2: MISS   FT 2/2: GOOD Tim Sexton makes 1/2 from the line.
Score: 86-79

[09:14] Team_073 possession (Score: 86-79)
Shai Thompson attempts a Layup. Wide open! Tim Sexton is 7.2 feet away. [MAN] SHAI THOMPSON MAKES IT!
Score: 88-79

[09:00] Team_045 possession (Score: 88-79)
Stephen Paul drives, Shai Thompson stays with him. Stephen Paul attempts a Dunk. Contested by Shai Thompson (2.6 feet, ZONE). Stephen Paul misses. FOUL! Loose ball foul on Shai Thompson during the rebound battle. [IN THE BONUS! 5 team fouls] Julius James to the line for 2 free throws. (Shai Thompson: 2 personal fouls)   FT 1/2: GOOD   FT 2/2: GOOD Julius James makes 2/2 from the line.
Score: 88-81

[08:46] Team_073 possession (Score: 88-81)
Zach Quickley attempts a Midrange. Contested by Julius James (4.9 feet, ZONE). Zach Quickley misses. Rebound secured by Julius James.

[08:33] Team_045 possession (Score: 88-81)
Stephen Paul drives and kicks out. Tim Sexton attempts a 3Pt. Contested by Shai Thompson (3.8 feet, MAN). TIM SEXTON MAKES IT! Assist: John Wagner
Score: 88-84

[08:17] Team_073 possession (Score: 88-84)
Zach Quickley attempts a Midrange. Wide open! Gary Towns is 8.0 feet away. [ZONE] ZACH QUICKLEY MAKES IT!
Score: 90-84

[08:00] Team_045 possession (Score: 90-84)
Stephen Paul drives, Shai Thompson stays with him. Stephen Paul attempts a Dunk. Heavily contested by Shai Thompson (0.5 feet, ZONE)! Stephen Paul misses. Rebound secured by Shai Thompson.

[07:43] Team_073 possession (Score: 90-84)
Luka Butler makes the Layup and draws the foul on Stephen Paul! And-1! Luka Butler to the line for 1. [Team fouls: 3] (Stephen Paul: 1 personal fouls)   FT 1/1: GOOD Luka Butler makes 1/1 from the line.
Score: 93-84

[07:27] Team_045 possession (Score: 93-84)
FOUL! Shooting foul on Shai Thompson. Stephen Paul to the line for 2 free throws. [BONUS: 6 team fouls] (Shai Thompson: 3 personal fouls)   FT 1/2: MISS   FT 2/2: MISS Stephen Paul makes 0/2 from the line. Rebound secured by Ja Rose.

[07:16] Team_073 possession (Score: 93-84)
FOUL! Reach-in foul on Julius James during the drive. [Team fouls: 4] No free throws, side out. (Julius James: 1 personal fouls)

[07:02] Team_073 possession (Score: 93-84)
Luka Butler attempts a 3Pt. Heavily contested by Julius James (1.8 feet, ZONE)! Luka Butler misses. Rebound secured by Stephen Paul.

[06:47] Team_045 possession (Score: 93-84)
FOUL! Holding foul on Dwyane McCollum. [IN THE BONUS! 7 team fouls] Gary Towns to the line for 2 free throws. (Dwyane McCollum: 1 personal fouls)   FT 1/2: GOOD   FT 2/2: GOOD Gary Towns makes 2/2 from the line.
Score: 93-86

[06:33] Team_073 possession (Score: 93-86)
Zach Quickley attempts a Midrange. Wide open! Gary Towns is 7.4 feet away. [ZONE] Zach Quickley misses. Rebound secured by Stephen Paul.

[06:21] Team_045 possession (Score: 93-86)
Gary Towns attempts a 3Pt. Wide open! Luka Butler is 6.6 feet away. [ZONE] GARY TOWNS MAKES IT! Assist: Tim Sexton
Score: 93-89

[06:11] Team_073 possession (Score: 93-89)
Zach Quickley drives to the basket... Zach Quickley throws a bad pass out of bounds! TURNOVER! (dead ball)

[05:59] Team_045 possession (Score: 93-89)
Gary Towns attempts a Layup. Contested by Dwyane McCollum (5.1 feet, MAN). Gary Towns misses. Rebound secured by Dwyane McCollum.

[05:45] Team_073 possession (Score: 93-89)
Shai Thompson attempts a Layup. Wide open! Tim Sexton is 6.7 feet away. [MAN] Shai Thompson misses. Offensive rebound by Ja Rose! Ja Rose kicks it out.

[05:30] Team_073 possession (Score: 93-89)
FOUL! Shooting foul on Julius James. Zach Quickley to the line for 2 free throws. [BONUS: 5 team fouls] (Julius James: 2 personal fouls)   FT 1/2: GOOD   FT 2/2: MISS Zach Quickley makes 1/2 from the line. Rebound secured by Stephen Paul.
Score: 94-89

[05:12] Team_045 possession (Score: 94-89)
Julius James makes the Midrange and draws the foul on Luka Butler! And-1! Julius James to the line for 1. [BONUS: 8 team fouls] (Luka Butler: 1 personal fouls)   FT 1/1: GOOD Julius James makes 1/1 from the line.
Score: 94-92

[05:00] Team_073 possession (Score: 94-92)
Ja Rose attempts a Midrange. Wide open! Stephen Paul is 7.2 feet away. [MAN] Ja Rose misses. Rebound secured by Tim Sexton.

[04:45] Team_045 possession (Score: 94-92)
Julius James attempts a Layup. Wide open! Luka Butler is 7.6 feet away. [MAN] Julius James misses. Rebound secured by Shai Thompson.

[04:35] Team_073 possession (Score: 94-92)
Ja Rose attempts a Midrange. Contested by Gary Towns (5.4 feet, ZONE). Ja Rose misses. Rebound secured by Julius James.

[04:16] Team_045 possession (Score: 94-92)
Stephen Paul attempts a Midrange. Heavily contested by Luka Butler (1.8 feet, ZONE)! Stephen Paul misses. Rebound secured by Shai Thompson.

[04:01] Team_073 possession (Score: 94-92)
Ja Rose attempts a Layup. Wide open! Stephen Paul is 6.4 feet away. [ZONE] JA ROSE MAKES IT!
Score: 96-92

[03:49] Team_045 possession (Score: 96-92)
Stephen Paul attempts a Layup. BLOCKED BY JA ROSE! Ball is loose! Rebound secured by Dwyane McCollum.

[03:35] Team_073 possession (Score: 96-92)
Luka Butler attempts a 3Pt. Contested by Julius James (4.7 feet, MAN). LUKA BUTLER MAKES IT! Assist: Ja Rose
Score: 99-92

[03:23] Team_045 possession (Score: 99-92)
John Wagner loses the ball! Stripped by Zach Quickley! TURNOVER! (live ball)

[03:09] Team_073 possession (Score: 99-92)
Shai Thompson drives, picks up Stephen Paul. Help arrives from Julius James! Shai Thompson attempts a Dunk. Contested by Julius James (3.1 feet, ZONE). Shai Thompson misses. Rebound secured by Tim Sexton.

[02:57] Team_045 possession (Score: 99-92)
Tim Sexton drives, picks up Shai Thompson. Help arrives from Luka Butler! Tim Sexton attempts a Dunk. Contested by Luka Butler (2.1 feet, ZONE). TIM SEXTON MAKES IT! Assist: Julius James
Score: 99-94

[02:45] Team_073 possession (Score: 99-94)
Shai Thompson attempts a Midrange. Wide open! Julius James is 7.1 feet away. [ZONE] Shai Thompson misses. Rebound secured by Tim Sexton.

[02:35] Team_045 possession (Score: 99-94)
Tim Sexton makes the Dunk and draws the foul on Luka Butler! And-1! Tim Sexton to the line for 1. [BONUS: 9 team fouls] (Luka Butler: 2 personal fouls)   FT 1/1: GOOD Tim Sexton makes 1/1 from the line.
Score: 99-97

[02:19] Team_073 possession (Score: 99-97)
Zach Quickley attempts a Layup. Contested by John Wagner (5.5 feet, MAN). ZACH QUICKLEY MAKES IT! Assist: Luka Butler
Score: 101-97

[02:03] Team_045 possession (Score: 101-97)
John Wagner drives to the basket... John Wagner throws a bad pass! Stolen by Zach Quickley! TURNOVER! (live ball)

[01:52] Team_073 possession (Score: 101-97)
Ja Rose attempts a Layup. Wide open! Stephen Paul is 7.4 feet away. [MAN] JA ROSE MAKES IT!
Score: 103-97

[01:36] Team_045 possession (Score: 103-97)
John Wagner makes the Midrange and draws the foul on Zach Quickley! And-1! John Wagner to the line for 1. [BONUS: 10 team fouls] (Zach Quickley: 1 personal fouls)   FT 1/1: GOOD John Wagner makes 1/1 from the line.
Score: 103-100

[01:19] Team_073 possession (Score: 103-100)
Ja Rose attempts a 3Pt. Contested by John Wagner (2.5 feet, ZONE). Ja Rose misses. Rebound secured by Julius James.

[01:04] Team_045 possession (Score: 103-100)
Stephen Paul attempts a Midrange. Contested by Ja Rose (5.9 feet, MAN). Stephen Paul misses. Rebound secured by Dwyane McCollum.

[00:52] Team_073 possession (Score: 103-100)
Zach Quickley attempts a Midrange. Contested by Stephen Paul (4.9 feet, ZONE). ZACH QUICKLEY MAKES IT!
Score: 105-100

[00:35] Team_045 possession (Score: 105-100)
Tim Sexton throws a bad pass! Stolen by Shai Thompson! TURNOVER! (live ball)

[00:19] Team_073 possession (Score: 105-100)
FOUL! Reach-in foul on Tim Sexton during the drive. [IN THE BONUS! 6 team fouls] Ja Rose to the line for 2 free throws. (Tim Sexton: 1 personal fouls)   FT 1/2: MISS   FT 2/2: GOOD Ja Rose makes 1/2 from the line.
Score: 106-100

[00:09] Team_045 possession (Score: 106-100)
Stephen Paul drives, Ja Rose stays with him. Stephen Paul attempts a Dunk. Wide open! Ja Rose is 6.3 feet away. [MAN] Stephen Paul misses. Rebound secured by Shai Thompson.

================================================================================
                              4TH QUARTER COMPLETE                              
================================================================================

4TH QUARTER SCORE: Team_073 25, Team_045 27

BOX SCORE:
================================================================================

Team_073
--------------------------------------------------------------------------------
Player                MIN  PTS  REB  AST  TO      FG   FG%      3P   3P%
--------------------------------------------------------------------------------
Luka Butler            17    6    0    2   0   2/3    66.7     0/0   0.0
Zach Quickley          17    6    0    0   0   3/6    50.0     0/0   0.0
Ja Rose                17    5    2    1   0   3/6    50.0     0/0   0.0
Carmelo Young          32    3    0    0   0   1/1   100.0     0/0   0.0
Dwyane McCollum        17    2    3    0   0   1/1   100.0     0/0   0.0
Shai Thompson          17    2    4    0   0   1/3    33.3     0/0   0.0
Bradley Morant         32    0    1    0   0   0/1     0.0     0/0   0.0

TEAM: FG: 11/21 (52.4%), 3PT: 1/3 (33.3%), REB: 10 (1 off, 9 def), AST: 3, TO: 2
TEAM FOULS: 10 [Team_045 in BONUS]


Team_045
--------------------------------------------------------------------------------
Player                MIN  PTS  REB  AST  TO      FG   FG%      3P   3P%
--------------------------------------------------------------------------------
Tim Sexton             17    9    4    1   0   4/4   100.0     0/0   0.0
Julius James           17    5    4    1   0   2/3    66.7     0/0   0.0
Gary Towns             17    5    0    0   0   2/3    66.7     0/0   0.0
John Wagner            17    3    0    1   0   1/1   100.0     0/0   0.0
Trae Russell           32    2    0    0   0   1/1   100.0     0/0   0.0
Stephen Paul           17    2    3    0   0   1/7    14.3     0/0   0.0
Zion Butler            32    0    1    0   0   0/1     0.0     0/0   0.0
Cole Simons            32    0    1    0   0   0/0     0.0     0/0   0.0

TEAM: FG: 11/20 (55.0%), 3PT: 1/1 (100.0%), REB: 13 (3 off, 10 def), AST: 3, TO: 3
TEAM FOULS: 6 [Team_073 in BONUS]

================================================================================

================================================================================
                               FULL GAME COMPLETE                               
================================================================================

FINAL SCORE: Team_073 106, Team_045 100

SCORING BY QUARTER:
--------------------------------------------------------------------------------
Team                     Q1     Q2     Q3     Q4    FINAL
--------------------------------------------------------------------------------
Team_073                 35     25     21     25      106
Team_045                 23     26     24     27      100
--------------------------------------------------------------------------------

FULL GAME BOX SCORE:
================================================================================

Team_073
--------------------------------------------------------------------------------
Player                MIN  PTS  REB  AST  TO      FG   FG%      3P   3P%      FT STL BLK
--------------------------------------------------------------------------------
Carmelo Young          32   15    0    4   1   6/11   54.5   2/6    33.3   2/3     0   0
Isaiah Smith           32   23    6    3   2   8/12   66.7   4/8    50.0   6/6     1   0
Karl Williamson        32    8    0    2   0   3/9    33.3   1/5    20.0   2/3     0   0
Carmelo Porzingis      32    6    9    3   1   4/5    80.0   1/1   100.0   1/2     0   1
Bradley Morant         32   16   14    1   0   8/15   53.3   0/1     0.0   5/8     1   2
Zach Quickley          17    7    0    0   0   4/7    57.1   0/0     0.0   2/4     2   0
Luka Butler            17   11    0    2   1   4/6    66.7   2/4    50.0   1/1     0   0
Dwyane McCollum        17    2    5    1   2   1/3    33.3   0/0     0.0   1/2     0   0
Shai Thompson          17    5    8    2   0   1/3    33.3   0/0     0.0   0/0     1   1
Ja Rose                17    7    3    2   1   5/9    55.6   0/1     0.0   1/2     0   1

TEAM: FG: 44/80 (55.0%), 3PT: 10/26 (38.5%), REB: 44 (11 off, 33 def), AST: 20, TO: 8


Team_045
--------------------------------------------------------------------------------
Player                MIN  PTS  REB  AST  TO      FG   FG%      3P   3P%      FT STL BLK
--------------------------------------------------------------------------------
Rudy Antetokounmpo     32   10    0    3   1   5/8    62.5   2/5    40.0   3/3     0   0
Trae Russell           32   10    0    5   2   3/5    60.0   1/3    33.3   4/4     0   0
Cole Simons            32   15    9    2   0   6/14   42.9   3/6    50.0   2/2     0   0
DeMar Turner           32    9    6    2   0   4/7    57.1   2/2   100.0   3/4     0   0
Zion Butler            32   20   14    5   2  10/15   66.7   0/0     0.0   7/9     1   4
John Wagner            17   10    0    1   2   4/4   100.0   0/0     0.0   2/2     0   0
Julius James           17    5    5    1   0   1/2    50.0   0/0     0.0   4/5     0   0
Gary Towns             17    5    0    1   2   1/4    25.0   1/3    33.3   2/2     0   1
Tim Sexton             17    9    6    1   1   3/5    60.0   0/2     0.0   2/3     0   0
Stephen Paul           17    2    5    0   0   3/11   27.3   0/0     0.0   0/3     0   0

TEAM: FG: 41/76 (53.9%), 3PT: 9/21 (42.9%), REB: 46 (12 off, 34 def), AST: 21, TO: 10

================================================================================
