================================================================================
                        FULL GAME - Team_013 vs Team_044                        
================================================================================

================================================================================
                       1ST QUARTER - Team_013 vs Team_044                       
================================================================================

[12:00] Team_013 possession (Score: 0-0)
Pau Mobley drives, Ayo McCollum stays with him. Pau Mobley attempts a Layup. Contested by Ayo McCollum (3.8 feet, ZONE). Pau Mobley misses. Rebound secured by Victor Westbrook.

[11:43] Team_044 possession (Score: 0-0)
Karl Fox makes the Layup and draws the foul on Desmond Ginobili! And-1! Karl Fox to the line for 1. [Team fouls: 1] (Desmond Ginobili: 1 personal fouls)   FT 1/1: GOOD Karl Fox makes 1/1 from the line.
Score: 0-3

[11:26] Team_013 possession (Score: 0-3)
Manu Smith attempts a 3Pt. Contested by Isaiah Murray (5.7 feet, ZONE). Manu Smith misses. Rebound secured by Victor Westbrook.

[11:10] Team_044 possession (Score: 0-3)
FOUL! Offensive foul on Isaiah Murray! Pau Mobley drew the charge! [Team fouls: 1] (Isaiah Murray: 1 personal fouls) TURNOVER! (dead ball)

[10:55] Team_013 possession (Score: 0-3)
Jayson Morant attempts a 3Pt. Wide open! Isaiah Murray is 7.2 feet away. [ZONE] JAYSON MORANT MAKES IT! Assist: Pau Mobley
Score: 3-3

[10:43] Team_044 possession (Score: 3-3)
Zach McGrady drives, Desmond Ginobili stays with him. Zach McGrady attempts a Layup. Wide open! Desmond Ginobili is 6.7 feet away. [ZONE] Zach McGrady misses. Rebound secured by Pau Mobley.

[10:25] Team_013 possession (Score: 3-3)
Pau Mobley attempts a 3Pt. Contested by Isaiah Murray (2.3 feet, MAN). PAU MOBLEY MAKES IT!
Score: 6-3

[10:07] Team_044 possession (Score: 6-3)
FOUL! Holding foul on Desmond Ginobili. [Team fouls: 2] No free throws, side out. (Desmond Ginobili: 2 personal fouls)

[09:50] Team_044 possession (Score: 6-3)
Isaiah Murray attempts a 3Pt. Contested by Pau Mobley (2.4 feet, ZONE). Isaiah Murray misses. Rebound secured by Desmond Ginobili.

[09:34] Team_013 possession (Score: 6-3)
FOUL! Reach-in foul on Ayo McCollum during the drive. [Team fouls: 2] No free throws, side out. (Ayo McCollum: 1 personal fouls)

[09:21] Team_013 possession (Score: 6-3)
Manu Smith attempts a 3Pt. Wide open! Zach McGrady is 9.1 feet away. [MAN] MANU SMITH MAKES IT! Assist: Jayson Morant
Score: 9-3

[09:07] Team_044 possession (Score: 9-3)
Zach McGrady drives, Desmond Ginobili stays with him. Zach McGrady attempts a Layup. Contested by Desmond Ginobili (2.1 feet, ZONE). ZACH MCGRADY MAKES IT! Assist: Isaiah Murray
Score: 9-5

[08:54] Team_013 possession (Score: 9-5)
Desmond Ginobili attempts a 3Pt. Contested by Karl Fox (4.9 feet, MAN). Desmond Ginobili misses. Rebound secured by Ayo McCollum.

[08:36] Team_044 possession (Score: 9-5)
Karl Fox attempts a 3Pt. Contested by Pau Mobley (4.9 feet, ZONE). Karl Fox misses. Rebound secured by Pau Mobley.

[08:22] Team_013 possession (Score: 9-5)
Nikola Curry attempts a Layup. Wide open! Ayo McCollum is 6.2 feet away. [ZONE] NIKOLA CURRY MAKES IT! Assist: Manu Smith
Score: 11-5

[08:10] Team_044 possession (Score: 11-5)
Victor Westbrook attempts a 3Pt. Contested by Jayson Morant (2.6 feet, MAN). Victor Westbrook misses. Rebound secured by Pau Mobley.

[07:56] Team_013 possession (Score: 11-5)
Jayson Morant attempts a 3Pt. Contested by Victor Westbrook (4.9 feet, MAN). Jayson Morant misses. Offensive rebound by Desmond Ginobili! Desmond Ginobili kicks it out.

[07:46] Team_013 possession (Score: 11-5)
FOUL! Shooting foul on Ayo McCollum. Manu Smith to the line for 2 free throws. [Team fouls: 3] (Ayo McCollum: 2 personal fouls)   FT 1/2: GOOD   FT 2/2: GOOD Manu Smith makes 2/2 from the line.
Score: 13-5

[07:32] Team_044 possession (Score: 13-5)
Ayo McCollum drives and kicks out. Karl Fox attempts a 3Pt. Heavily contested by Pau Mobley (1.1 feet, ZONE)! KARL FOX MAKES IT! Assist: Isaiah Murray
Score: 13-8

[07:16] Team_013 possession (Score: 13-8)
Nikola Curry loses control! Ball rolls out of bounds! TURNOVER! (dead ball)

[07:03] Team_044 possession (Score: 13-8)
Isaiah Murray attempts a 3Pt. Contested by Pau Mobley (3.1 feet, ZONE). Isaiah Murray misses. Rebound secured by Nikola Curry.

[06:52] Team_013 possession (Score: 13-8)
Jayson Morant attempts a Midrange. Contested by Karl Fox (3.1 feet, ZONE). Jayson Morant misses. Rebound secured by Victor Westbrook.

[06:38] Team_044 possession (Score: 13-8)
Karl Fox drives, Desmond Ginobili stays with him. Karl Fox attempts a Layup. Wide open! Desmond Ginobili is 9.5 feet away. [MAN] Karl Fox misses. Offensive rebound by Victor Westbrook! Victor Westbrook kicks it out.

[06:22] Team_044 possession (Score: 13-8)
Ayo McCollum attempts a Midrange. Wide open! Nikola Curry is 6.7 feet away. [MAN] AYO MCCOLLUM MAKES IT!
Score: 13-10

[06:08] Team_013 possession (Score: 13-10)
Manu Smith attempts a 3Pt. Wide open! Zach McGrady is 7.8 feet away. [MAN] Manu Smith misses. Rebound secured by Ayo McCollum.

[05:55] Team_044 possession (Score: 13-10)
Zach McGrady loses the ball! Stripped by Manu Smith! TURNOVER! (live ball)

[05:44] Team_013 possession (Score: 13-10)
Desmond Ginobili makes the Layup and draws the foul on Ayo McCollum! And-1! Desmond Ginobili to the line for 1. [Team fouls: 4] (Ayo McCollum: 3 personal fouls)   FT 1/1: MISS Desmond Ginobili makes 0/1 from the line. FOUL! Loose ball foul on Ayo McCollum during the free throw rebound! [IN THE BONUS! 5 team fouls] Desmond Ginobili to the line for 2 free throws. (Ayo McCollum: 4 personal fouls)   FT 1/2: GOOD   FT 2/2: GOOD Desmond Ginobili makes 2/2 from the line.
Score: 17-10

[05:33] Team_044 possession (Score: 17-10)
Ayo McCollum drives and kicks out. Ayo McCollum attempts a 3Pt. Contested by Pau Mobley (4.6 feet, ZONE). Ayo McCollum misses. Rebound secured by Pau Mobley.

[05:18] Team_013 possession (Score: 17-10)
Manu Smith attempts a Layup. Contested by Ayo McCollum (5.5 feet, ZONE). Manu Smith misses. Rebound secured by Ayo McCollum.

[05:08] Team_044 possession (Score: 17-10)
Ayo McCollum attempts a Layup. Contested by Nikola Curry (5.1 feet, MAN). Ayo McCollum misses. Rebound secured by Nikola Curry.

[04:57] Team_013 possession (Score: 17-10)
Nikola Curry attempts a Midrange. Wide open! Victor Westbrook is 9.8 feet away. [ZONE] NIKOLA CURRY MAKES IT! Assist: Desmond Ginobili
Score: 19-10

[04:40] Team_044 possession (Score: 19-10)
Victor Westbrook attempts a Midrange. Wide open! Jayson Morant is 7.6 feet away. [MAN] Victor Westbrook misses. Rebound secured by Nikola Curry.

[04:25] Team_013 possession (Score: 19-10)
Nikola Curry makes the Layup and draws the foul on Ayo McCollum! And-1! Nikola Curry to the line for 1. [BONUS: 6 team fouls] (Ayo McCollum: 5 personal fouls)   FT 1/1: GOOD Nikola Curry makes 1/1 from the line.
Score: 22-10

[04:10] Team_044 possession (Score: 22-10)
Ayo McCollum drives to the basket... Ayo McCollum loses the ball! Stripped by Desmond Ginobili! TURNOVER! (live ball)

[04:00] Team_013 possession (Score: 22-10)
Jayson Morant attempts a Midrange. Contested by Isaiah Murray (5.7 feet, ZONE). Jayson Morant misses. Rebound secured by Ayo McCollum.

[03:42] Team_044 possession (Score: 22-10)
Victor Westbrook attempts a Midrange. Wide open! Nikola Curry is 7.9 feet away. [ZONE] VICTOR WESTBROOK MAKES IT!
Score: 22-12

[03:24] Team_013 possession (Score: 22-12)
Manu Smith attempts a Midrange. Wide open! Karl Fox is 6.2 feet away. [ZONE] Manu Smith misses. FOUL! Loose ball foul on Victor Westbrook during the rebound battle. [IN THE BONUS! 7 team fouls] Desmond Ginobili to the line for 2 free throws. (Victor Westbrook: 1 personal fouls)   FT 1/2: GOOD   FT 2/2: GOOD Desmond Ginobili makes 2/2 from the line.
Score: 24-12

[03:08] Team_044 possession (Score: 24-12)
Victor Westbrook drives and kicks out. Ayo McCollum attempts a Midrange. Wide open! Nikola Curry is 8.2 feet away. [MAN] Ayo McCollum misses. Rebound secured by Desmond Ginobili.

[02:49] Team_013 possession (Score: 24-12)
Nikola Curry attempts a Layup. Contested by Ayo McCollum (4.1 feet, MAN). Nikola Curry misses. Offensive rebound by Desmond Ginobili! Desmond Ginobili kicks it out.

[02:32] Team_013 possession (Score: 24-12)
Jayson Morant throws a bad pass! Stolen by Victor Westbrook! TURNOVER! (live ball)

[02:19] Team_044 possession (Score: 24-12)
Karl Fox attempts a 3Pt. Contested by Desmond Ginobili (4.3 feet, MAN). Karl Fox misses. Offensive rebound by Victor Westbrook! Victor Westbrook kicks it out.

[02:06] Team_044 possession (Score: 24-12)
Zach McGrady attempts a 3Pt. Wide open! Pau Mobley is 7.7 feet away. [ZONE] ZACH MCGRADY MAKES IT! Assist: Karl Fox
Score: 24-15

[01:52] Team_013 possession (Score: 24-15)
FOUL! Shooting foul on Victor Westbrook. Manu Smith to the line for 2 free throws. [BONUS: 8 team fouls] (Victor Westbrook: 2 personal fouls)   FT 1/2: GOOD   FT 2/2: GOOD Manu Smith makes 2/2 from the line.
Score: 26-15

[01:34] Team_044 possession (Score: 26-15)
Victor Westbrook attempts a 3Pt. Contested by Pau Mobley (3.8 feet, ZONE). Victor Westbrook misses. Offensive rebound by Victor Westbrook! Victor Westbrook kicks it out.

[01:20] Team_044 possession (Score: 26-15)
Ayo McCollum attempts a Layup. Contested by Nikola Curry (4.7 feet, ZONE). AYO MCCOLLUM MAKES IT!
Score: 26-17

[01:08] Team_013 possession (Score: 26-17)
Jayson Morant commits a violation (traveling/carry)! TURNOVER! (dead ball)

[01:08] Substitution (Team_013): Manu Smith OUT → Gary Iverson IN (stamina_rule2)

[01:08] Substitution (Team_013): Pau Mobley OUT → Chris Bryant IN (stamina_rule2)

[01:08] Substitution (Team_013): Jayson Morant OUT → Vince Nowitzki IN (stamina_rule2)

[01:08] Substitution (Team_013): Desmond Ginobili OUT → Dirk Booker IN (stamina_rule2)

[01:08] Substitution (Team_013): Nikola Curry OUT → Jayson Nowitzki IN (stamina_rule2)

[01:08] Substitution (Team_044): Zach McGrady OUT → Kyrie Poole IN (stamina_rule2)

[01:08] Substitution (Team_044): Isaiah Murray OUT → Tim Towns IN (stamina_rule2)

[01:08] Substitution (Team_044): Victor Westbrook OUT → Tim Siakam IN (stamina_rule2)

[01:08] Substitution (Team_044): Karl Fox OUT → Pau Quickley IN (stamina_rule2)

[01:08] Substitution (Team_044): Ayo McCollum OUT → Victor Anthony IN (stamina_rule2)

[00:51] Team_044 possession (Score: 26-17)
Victor Anthony attempts a Midrange. Contested by Dirk Booker (4.9 feet, MAN). Victor Anthony misses. Offensive rebound by Victor Anthony! Victor Anthony kicks it out.

[00:37] Team_044 possession (Score: 26-17)
Victor Anthony drives and kicks out. Kyrie Poole attempts a 3Pt. Contested by Gary Iverson (3.2 feet, MAN). KYRIE POOLE MAKES IT! Assist: Tim Siakam
Score: 26-20

[00:19] Team_013 possession (Score: 26-20)
Dirk Booker makes the Layup and draws the foul on Pau Quickley! And-1! Dirk Booker to the line for 1. [BONUS: 9 team fouls] (Pau Quickley: 1 personal fouls)   FT 1/1: MISS Dirk Booker makes 0/1 from the line. Rebound secured by Pau Quickley.
Score: 28-20

[00:04] Team_044 possession (Score: 28-20)
Tim Towns attempts a Layup. Contested by Chris Bryant (5.1 feet, MAN). TIM TOWNS MAKES IT! Assist: Kyrie Poole
Score: 28-22

================================================================================
                              1ST QUARTER COMPLETE                              
================================================================================

1ST QUARTER SCORE: Team_013 28, Team_044 22

BOX SCORE:
================================================================================

Team_013
--------------------------------------------------------------------------------
Player                MIN  PTS  REB  AST  TO      FG   FG%      3P   3P%
--------------------------------------------------------------------------------
Manu Smith             11    7    0    1   0   3/6    50.0     0/0   0.0
Nikola Curry           11    7    3    0   0   3/3   100.0     0/0   0.0
Desmond Ginobili       11    6    4    1   0   2/3    66.7     0/0   0.0
Pau Mobley             11    3    4    1   0   1/2    50.0     0/0   0.0
Jayson Morant          11    3    0    1   0   1/3    33.3     0/0   0.0
Dirk Booker             1    0    0    0   0   0/1     0.0     0/0   0.0

TEAM: FG: 10/18 (55.6%), 3PT: 3/6 (50.0%), REB: 11 (2 off, 9 def), AST: 4, TO: 3
TEAM FOULS: 2


Team_044
--------------------------------------------------------------------------------
Player                MIN  PTS  REB  AST  TO      FG   FG%      3P   3P%
--------------------------------------------------------------------------------
Karl Fox               11    6    0    1   0   2/3    66.7     0/0   0.0
Zach McGrady           11    5    0    0   0   2/3    66.7     0/0   0.0
Ayo McCollum           11    4    4    0   0   2/4    50.0     0/0   0.0
Kyrie Poole             1    3    0    1   0   1/1   100.0     0/0   0.0
Victor Westbrook       11    2    6    0   0   1/4    25.0     0/0   0.0
Tim Towns               1    2    0    0   0   1/1   100.0     0/0   0.0
Isaiah Murray          11    0    0    2   0   0/2     0.0     0/0   0.0
Victor Anthony          1    0    1    0   0   0/0     0.0     0/0   0.0
Tim Siakam              1    0    0    1   0   0/0     0.0     0/0   0.0
Pau Quickley            1    0    1    0   0   0/0     0.0     0/0   0.0

TEAM: FG: 9/18 (50.0%), 3PT: 1/5 (20.0%), REB: 12 (4 off, 8 def), AST: 5, TO: 3
TEAM FOULS: 9 [Team_013 in BONUS]

================================================================================

================================================================================
                       2ND QUARTER - Team_013 vs Team_044                       
================================================================================

[12:00] Team_013 possession (Score: 28-22)
Jayson Morant attempts a Midrange. Wide open! Victor Westbrook is 8.6 feet away. [MAN] JAYSON MORANT MAKES IT!
Score: 30-22

[11:44] Team_044 possession (Score: 30-22)
Victor Westbrook attempts a Layup. Contested by Jayson Morant (4.7 feet, MAN). Victor Westbrook misses. Rebound secured by Pau Mobley.

[11:29] Team_013 possession (Score: 30-22)
Nikola Curry attempts a Midrange. Contested by Ayo McCollum (2.8 feet, MAN). Nikola Curry misses. Rebound secured by Victor Westbrook.

[11:15] Team_044 possession (Score: 30-22)
Karl Fox attempts a Midrange. Heavily contested by Pau Mobley (1.5 feet, ZONE)! Karl Fox misses. Rebound secured by Desmond Ginobili.

[11:01] Team_013 possession (Score: 30-22)
Nikola Curry drives, picks up Ayo McCollum. Help arrives from Zach McGrady! Nikola Curry attempts a Layup. Contested by Zach McGrady (3.1 feet, ZONE). NIKOLA CURRY MAKES IT! Assist: Desmond Ginobili
Score: 32-22

[10:46] Team_044 possession (Score: 32-22)
Victor Westbrook attempts a 3Pt. Contested by Pau Mobley (3.5 feet, ZONE). VICTOR WESTBROOK MAKES IT! Assist: Karl Fox
Score: 32-25

[10:31] Team_013 possession (Score: 32-25)
FOUL! Shooting foul on Zach McGrady. Manu Smith to the line for 2 free throws. [Team fouls: 1] (Zach McGrady: 1 personal fouls)   FT 1/2: MISS   FT 2/2: MISS Manu Smith makes 0/2 from the line. Rebound secured by Karl Fox.

[10:18] Team_044 possession (Score: 32-25)
Ayo McCollum drives and kicks out. Karl Fox attempts a 3Pt. Contested by Desmond Ginobili (4.9 feet, MAN). Karl Fox misses. Rebound secured by Nikola Curry.

[10:07] Team_013 possession (Score: 32-25)
Desmond Ginobili drives and kicks out. Desmond Ginobili attempts a 3Pt. Heavily contested by Isaiah Murray (0.8 feet, ZONE)! Desmond Ginobili misses. Rebound secured by Karl Fox.

[09:50] Team_044 possession (Score: 32-25)
Zach McGrady attempts a Midrange. Wide open! Manu Smith is 6.3 feet away. [MAN] ZACH MCGRADY MAKES IT! Assist: Ayo McCollum
Score: 32-27

[09:36] Team_013 possession (Score: 32-27)
Pau Mobley attempts a Midrange. Contested by Karl Fox (2.1 feet, ZONE). Pau Mobley misses. Rebound secured by Karl Fox.

[09:25] Team_044 possession (Score: 32-27)
Isaiah Murray drives and kicks out. Zach McGrady attempts a 3Pt. Wide open! Pau Mobley is 6.9 feet away. [ZONE] Zach McGrady misses. Rebound secured by Desmond Ginobili.

[09:08] Team_013 possession (Score: 32-27)
Desmond Ginobili drives to the basket... FOUL! Offensive foul on Desmond Ginobili! Karl Fox drew the charge! [Team fouls: 1] (Desmond Ginobili: 1 personal fouls) TURNOVER! (dead ball)

[08:55] Team_044 possession (Score: 32-27)
Karl Fox attempts a 3Pt. Contested by Pau Mobley (5.8 feet, ZONE). Karl Fox misses. Rebound secured by Nikola Curry.

[08:42] Team_013 possession (Score: 32-27)
Pau Mobley attempts a 3Pt. Contested by Isaiah Murray (5.3 feet, MAN). PAU MOBLEY MAKES IT! Assist: Manu Smith
Score: 35-27

[08:25] Team_044 possession (Score: 35-27)
FOUL! Shooting foul on Jayson Morant. Victor Westbrook to the line for 2 free throws. [Team fouls: 2] (Jayson Morant: 1 personal fouls)   FT 1/2: GOOD   FT 2/2: GOOD Victor Westbrook makes 2/2 from the line.
Score: 35-29

[08:11] Team_013 possession (Score: 35-29)
Jayson Morant drives, Victor Westbrook stays with him. Jayson Morant attempts a Layup. Wide open! Victor Westbrook is 6.9 feet away. [MAN] JAYSON MORANT MAKES IT! Assist: Nikola Curry
Score: 37-29

[07:54] Team_044 possession (Score: 37-29)
Zach McGrady attempts a 3Pt. Wide open! Manu Smith is 6.3 feet away. [ZONE] Zach McGrady misses. Rebound secured by Pau Mobley.

[07:38] Team_013 possession (Score: 37-29)
FOUL! Holding foul on Ayo McCollum. [Team fouls: 2] No free throws, side out. (Ayo McCollum: 1 personal fouls)

[07:20] Team_013 possession (Score: 37-29)
Pau Mobley attempts a 3Pt. Contested by Karl Fox (5.6 feet, ZONE). Pau Mobley misses. Rebound secured by Karl Fox.

[07:06] Team_044 possession (Score: 37-29)
Victor Westbrook drives to the basket... Victor Westbrook loses the ball! Stripped by Jayson Morant! TURNOVER! (live ball)

[06:51] Team_013 possession (Score: 37-29)
Desmond Ginobili attempts a Midrange. Wide open! Victor Westbrook is 6.8 feet away. [ZONE] Desmond Ginobili misses. Offensive rebound by Nikola Curry! Nikola Curry kicks it out.

[06:41] Team_013 possession (Score: 37-29)
Nikola Curry attempts a Layup. Wide open! Karl Fox is 7.5 feet away. [ZONE] NIKOLA CURRY MAKES IT! Assist: Manu Smith
Score: 39-29

[06:27] Team_044 possession (Score: 39-29)
Isaiah Murray attempts a Layup. Contested by Desmond Ginobili (5.7 feet, ZONE). ISAIAH MURRAY MAKES IT! Assist: Karl Fox
Score: 39-31

[06:12] Team_013 possession (Score: 39-31)
Jayson Morant attempts a Midrange. Wide open! Victor Westbrook is 6.1 feet away. [MAN] Jayson Morant misses. Rebound secured by Victor Westbrook.

[05:59] Team_044 possession (Score: 39-31)
Victor Westbrook attempts a Midrange. Contested by Jayson Morant (3.5 feet, MAN). VICTOR WESTBROOK MAKES IT!
Score: 39-33

[05:41] Team_013 possession (Score: 39-33)
Desmond Ginobili attempts a Midrange. Wide open! Victor Westbrook is 7.7 feet away. [ZONE] DESMOND GINOBILI MAKES IT! Assist: Jayson Morant
Score: 41-33

[05:26] Team_044 possession (Score: 41-33)
Karl Fox attempts a 3Pt. Contested by Pau Mobley (2.9 feet, ZONE). KARL FOX MAKES IT! Assist: Zach McGrady
Score: 41-36

[05:11] Team_013 possession (Score: 41-36)
Manu Smith attempts a 3Pt. Contested by Isaiah Murray (5.7 feet, ZONE). MANU SMITH MAKES IT! Assist: Pau Mobley
Score: 44-36

[04:57] Team_044 possession (Score: 44-36)
FOUL! Shooting foul on Desmond Ginobili. Karl Fox to the line for 2 free throws. [Team fouls: 3] (Desmond Ginobili: 2 personal fouls)   FT 1/2: GOOD   FT 2/2: GOOD Karl Fox makes 2/2 from the line.
Score: 44-38

[04:41] Team_013 possession (Score: 44-38)
Desmond Ginobili attempts a Layup. BLOCKED BY KARL FOX! Ball deflects out of bounds off Desmond Ginobili.

[04:29] Team_044 possession (Score: 44-38)
FOUL! Reach-in foul on Desmond Ginobili during the drive. [Team fouls: 4] No free throws, side out. (Desmond Ginobili: 3 personal fouls)

[04:12] Team_044 possession (Score: 44-38)
Karl Fox attempts a 3Pt. Contested by Desmond Ginobili (3.8 feet, MAN). Karl Fox misses. Rebound secured by Desmond Ginobili.

[03:58] Team_013 possession (Score: 44-38)
Manu Smith attempts a 3Pt. Wide open! Isaiah Murray is 6.4 feet away. [ZONE] MANU SMITH MAKES IT!
Score: 47-38

[03:43] Team_044 possession (Score: 47-38)
Karl Fox attempts a Midrange. Wide open! Desmond Ginobili is 7.4 feet away. [MAN] KARL FOX MAKES IT! Assist: Zach McGrady
Score: 47-40

[03:27] Team_013 possession (Score: 47-40)
Jayson Morant loses control! Ball rolls out of bounds! TURNOVER! (dead ball)

[03:27] Substitution (Team_013): Manu Smith OUT → Gary Iverson IN (stamina_rule2)

[03:27] Substitution (Team_013): Pau Mobley OUT → Chris Bryant IN (stamina_rule2)

[03:27] Substitution (Team_013): Jayson Morant OUT → Vince Nowitzki IN (stamina_rule2)

[03:27] Substitution (Team_013): Desmond Ginobili OUT → Dirk Booker IN (stamina_rule2)

[03:27] Substitution (Team_013): Nikola Curry OUT → Jayson Nowitzki IN (stamina_rule2)

[03:27] Substitution (Team_044): Zach McGrady OUT → Kyrie Poole IN (stamina_rule2)

[03:27] Substitution (Team_044): Isaiah Murray OUT → Tim Towns IN (stamina_rule2)

[03:27] Substitution (Team_044): Victor Westbrook OUT → Tim Siakam IN (stamina_rule2)

[03:27] Substitution (Team_044): Karl Fox OUT → Pau Quickley IN (stamina_rule2)

[03:27] Substitution (Team_044): Ayo McCollum OUT → Victor Anthony IN (stamina_rule2)

[03:14] Team_044 possession (Score: 47-40)
Kyrie Poole drives, Gary Iverson stays with him. Kyrie Poole attempts a Layup. Contested by Gary Iverson (4.6 feet, MAN). Kyrie Poole misses. FOUL! Loose ball foul on Jayson Nowitzki during the rebound battle. [IN THE BONUS! 5 team fouls] Victor Anthony to the line for 2 free throws. (Jayson Nowitzki: 1 personal fouls)   FT 1/2: GOOD   FT 2/2: GOOD Victor Anthony makes 2/2 from the line.
Score: 47-42

[02:58] Team_013 possession (Score: 47-42)
Gary Iverson makes the Dunk and draws the foul on Tim Towns! And-1! Gary Iverson to the line for 1. [Team fouls: 3] (Tim Towns: 1 personal fouls)   FT 1/1: MISS Gary Iverson makes 0/1 from the line. Offensive rebound by Dirk Booker! Dirk Booker kicks it out.
Score: 49-42

[02:44] Team_013 possession (Score: 49-42)
Chris Bryant drives and kicks out. Gary Iverson attempts a Midrange. Contested by Kyrie Poole (3.7 feet, MAN). Gary Iverson misses. Rebound secured by Tim Siakam.

[02:29] Team_044 possession (Score: 49-42)
Tim Siakam attempts a 3Pt. Contested by Chris Bryant (5.2 feet, ZONE). TIM SIAKAM MAKES IT! Assist: Pau Quickley
Score: 49-45

[02:15] Team_013 possession (Score: 49-45)
Gary Iverson attempts a 3Pt. Contested by Tim Siakam (5.0 feet, ZONE). GARY IVERSON MAKES IT! Assist: Jayson Nowitzki
Score: 52-45

[02:02] Team_044 possession (Score: 52-45)
Tim Towns attempts a Midrange. Wide open! Chris Bryant is 7.2 feet away. [MAN] TIM TOWNS MAKES IT!
Score: 52-47

[01:48] Team_013 possession (Score: 52-47)
Chris Bryant drives, Pau Quickley stays with him. Chris Bryant attempts a Layup. Heavily contested by Pau Quickley (0.5 feet, ZONE)! Chris Bryant misses. Rebound secured by Pau Quickley.

[01:34] Team_044 possession (Score: 52-47)
Kyrie Poole attempts a 3Pt. Wide open! Chris Bryant is 6.8 feet away. [ZONE] KYRIE POOLE MAKES IT! Assist: Pau Quickley
Score: 52-50

[01:18] Team_013 possession (Score: 52-50)
Jayson Nowitzki attempts a Layup. Contested by Victor Anthony (2.7 feet, MAN). Jayson Nowitzki misses. Rebound secured by Victor Anthony.

[01:02] Team_044 possession (Score: 52-50)
Pau Quickley drives and kicks out. Tim Towns attempts a Midrange. Wide open! Vince Nowitzki is 8.2 feet away. [ZONE] Tim Towns misses. Rebound secured by Dirk Booker.

[00:48] Team_013 possession (Score: 52-50)
Chris Bryant makes the Dunk and draws the foul on Pau Quickley! And-1! Chris Bryant to the line for 1. [Team fouls: 4] (Pau Quickley: 1 personal fouls)   FT 1/1: GOOD Chris Bryant makes 1/1 from the line.
Score: 55-50

[00:38] Team_044 possession (Score: 55-50)
Victor Anthony attempts a Midrange. Wide open! Gary Iverson is 7.5 feet away. [ZONE] VICTOR ANTHONY MAKES IT!
Score: 55-52

[00:29] Team_013 possession (Score: 55-52)
FOUL! Holding foul on Victor Anthony. [IN THE BONUS! 5 team fouls] Jayson Nowitzki to the line for 2 free throws. (Victor Anthony: 1 personal fouls)   FT 1/2: GOOD   FT 2/2: MISS Jayson Nowitzki makes 1/2 from the line. Rebound secured by Victor Anthony.
Score: 56-52

[00:12] Team_044 possession (Score: 56-52)
Victor Anthony attempts a Layup. Contested by Dirk Booker (3.7 feet, ZONE). VICTOR ANTHONY MAKES IT! Assist: Kyrie Poole
Score: 56-54

================================================================================
                              2ND QUARTER COMPLETE                              
================================================================================

2ND QUARTER SCORE: Team_013 28, Team_044 32

BOX SCORE:
================================================================================

Team_013
--------------------------------------------------------------------------------
Player                MIN  PTS  REB  AST  TO      FG   FG%      3P   3P%
--------------------------------------------------------------------------------
Manu Smith             20    6    0    2   0   2/3    66.7     0/0   0.0
Jayson Morant          20    4    0    1   0   2/3    66.7     0/0   0.0
Nikola Curry           20    4    3    1   0   2/3    66.7     0/0   0.0
Pau Mobley             20    3    2    1   0   1/3    33.3     0/0   0.0
Chris Bryant            4    3    0    0   0   1/3    33.3     0/0   0.0
Gary Iverson            4    3    0    0   0   1/1   100.0     0/0   0.0
Desmond Ginobili       20    2    3    1   0   1/3    33.3     0/0   0.0
Dirk Booker             4    0    2    0   0   0/0     0.0     0/0   0.0
Jayson Nowitzki         4    0    0    1   0   0/1     0.0     0/0   0.0

TEAM: FG: 10/21 (47.6%), 3PT: 4/5 (80.0%), REB: 10 (2 off, 8 def), AST: 7, TO: 2
TEAM FOULS: 5 [Team_044 in BONUS]


Team_044
--------------------------------------------------------------------------------
Player                MIN  PTS  REB  AST  TO      FG   FG%      3P   3P%
--------------------------------------------------------------------------------
Victor Westbrook       20    7    2    0   0   3/4    75.0     0/0   0.0
Karl Fox               20    7    4    2   0   3/6    50.0     0/0   0.0
Victor Anthony          4    6    2    0   0   3/3   100.0     0/0   0.0
Tim Siakam              4    3    1    0   0   1/1   100.0     0/0   0.0
Kyrie Poole             4    3    0    1   0   1/1   100.0     0/0   0.0
Zach McGrady           20    2    0    2   0   1/2    50.0     0/0   0.0
Isaiah Murray          20    2    0    0   0   1/2    50.0     0/0   0.0
Tim Towns               4    2    0    0   0   1/1   100.0     0/0   0.0
Ayo McCollum           20    0    0    1   0   0/1     0.0     0/0   0.0
Pau Quickley            4    0    1    2   0   0/1     0.0     0/0   0.0

TEAM: FG: 14/22 (63.6%), 3PT: 4/7 (57.1%), REB: 10 (0 off, 10 def), AST: 8, TO: 1
TEAM FOULS: 5 [Team_013 in BONUS]

================================================================================

================================================================================
                       3RD QUARTER - Team_013 vs Team_044                       
================================================================================

[12:00] Team_013 possession (Score: 56-54)
Desmond Ginobili attempts a Layup. Contested by Ayo McCollum (3.3 feet, ZONE). DESMOND GINOBILI MAKES IT! Assist: Manu Smith
Score: 58-54

[11:46] Team_044 possession (Score: 58-54)
Zach McGrady attempts a 3Pt. Contested by Pau Mobley (4.2 feet, ZONE). Zach McGrady misses. Rebound secured by Pau Mobley.

[11:33] Team_013 possession (Score: 58-54)
Pau Mobley attempts a Midrange. Contested by Isaiah Murray (5.9 feet, MAN). Pau Mobley misses. Offensive rebound by Nikola Curry! Nikola Curry kicks it out.

[11:18] Team_013 possession (Score: 58-54)
Desmond Ginobili drives to the basket... Desmond Ginobili throws a bad pass out of bounds! TURNOVER! (dead ball)

[11:00] Team_044 possession (Score: 58-54)
FOUL! Reach-in foul on Desmond Ginobili during the drive. [Team fouls: 1] No free throws, side out. (Desmond Ginobili: 1 personal fouls)

[10:44] Team_044 possession (Score: 58-54)
Karl Fox drives, picks up Desmond Ginobili. Help arrives from Pau Mobley! Karl Fox attempts a Dunk. Contested by Pau Mobley (5.4 feet, MAN). KARL FOX MAKES IT! Assist: Zach McGrady
Score: 58-56

[10:33] Team_013 possession (Score: 58-56)
Jayson Morant attempts a Midrange. Contested by Victor Westbrook (5.9 feet, MAN). Jayson Morant misses. Rebound secured by Victor Westbrook.

[10:22] Team_044 possession (Score: 58-56)
Isaiah Murray drives and kicks out. Ayo McCollum attempts a Midrange. Contested by Nikola Curry (4.5 feet, MAN). Ayo McCollum misses. Rebound secured by Nikola Curry.

[10:07] Team_013 possession (Score: 58-56)
Manu Smith attempts a 3Pt. Contested by Isaiah Murray (5.3 feet, ZONE). Manu Smith misses. Offensive rebound by Desmond Ginobili! Desmond Ginobili kicks it out.

[09:51] Team_013 possession (Score: 58-56)
Desmond Ginobili loses the ball! Stripped by Karl Fox! TURNOVER! (live ball)

[09:32] Team_044 possession (Score: 58-56)
Zach McGrady drives, picks up Manu Smith. Help arrives from Pau Mobley! Zach McGrady attempts a Layup. Contested by Pau Mobley (5.7 feet, MAN). ZACH MCGRADY MAKES IT!
Score: 58-58

[09:16] Team_013 possession (Score: 58-58)
Jayson Morant attempts a Midrange. Wide open! Victor Westbrook is 6.3 feet away. [MAN] Jayson Morant misses. Rebound secured by Ayo McCollum.

[09:02] Team_044 possession (Score: 58-58)
FOUL! Reach-in foul on Desmond Ginobili during the drive. [Team fouls: 2] No free throws, side out. (Desmond Ginobili: 2 personal fouls)

[08:45] Team_044 possession (Score: 58-58)
Victor Westbrook attempts a 3Pt. Contested by Jayson Morant (5.7 feet, MAN). Victor Westbrook misses. Offensive rebound by Ayo McCollum! Ayo McCollum's putback is no good. Rebound secured by Pau Mobley.

[08:27] Team_013 possession (Score: 58-58)
Manu Smith attempts a Layup. Contested by Zach McGrady (4.3 feet, MAN). MANU SMITH MAKES IT! Assist: Pau Mobley
Score: 60-58

[08:15] Team_044 possession (Score: 60-58)
Zach McGrady drives, Desmond Ginobili stays with him. Zach McGrady attempts a Layup. Wide open! Desmond Ginobili is 7.6 feet away. [ZONE] ZACH MCGRADY MAKES IT! Assist: Isaiah Murray
Score: 60-60

[07:58] Team_013 possession (Score: 60-60)
Nikola Curry drives and kicks out. Desmond Ginobili attempts a 3Pt. Contested by Isaiah Murray (5.1 feet, ZONE). Desmond Ginobili misses. Rebound secured by Ayo McCollum.

[07:45] Team_044 possession (Score: 60-60)
Ayo McCollum drives and kicks out. Victor Westbrook attempts a 3Pt. Contested by Jayson Morant (3.1 feet, MAN). VICTOR WESTBROOK MAKES IT! Assist: Ayo McCollum
Score: 60-63

[07:35] Team_013 possession (Score: 60-63)
Pau Mobley attempts a Midrange. Contested by Isaiah Murray (2.9 feet, ZONE). Pau Mobley misses. Rebound secured by Karl Fox.

[07:18] Team_044 possession (Score: 60-63)
Ayo McCollum throws a bad pass out of bounds! TURNOVER! (dead ball)

[07:01] Team_013 possession (Score: 60-63)
Jayson Morant throws a bad pass! Stolen by Victor Westbrook! TURNOVER! (live ball)

[06:47] Team_044 possession (Score: 60-63)
Victor Westbrook makes the Layup and draws the foul on Jayson Morant! And-1! Victor Westbrook to the line for 1. [Team fouls: 3] (Jayson Morant: 1 personal fouls)   FT 1/1: GOOD Victor Westbrook makes 1/1 from the line.
Score: 60-66

[06:34] Team_013 possession (Score: 60-66)
Manu Smith drives, picks up Ayo McCollum. Help arrives from Zach McGrady! Manu Smith attempts a Layup. Contested by Zach McGrady (4.2 feet, ZONE). Manu Smith misses. Rebound secured by Karl Fox.

[06:18] Team_044 possession (Score: 60-66)
Zach McGrady attempts a 3Pt. Contested by Pau Mobley (4.7 feet, ZONE). Zach McGrady misses. Rebound secured by Nikola Curry.

[06:05] Team_013 possession (Score: 60-66)
Manu Smith drives and kicks out. Nikola Curry attempts a 3Pt. Contested by Ayo McCollum (3.7 feet, MAN). Nikola Curry misses. Offensive rebound by Nikola Curry! Nikola Curry kicks it out.

[05:51] Team_013 possession (Score: 60-66)
Jayson Morant attempts a 3Pt. Wide open! Victor Westbrook is 6.3 feet away. [MAN] JAYSON MORANT MAKES IT! Assist: Pau Mobley
Score: 63-66

[05:39] Team_044 possession (Score: 63-66)
Karl Fox attempts a Layup. Contested by Desmond Ginobili (5.4 feet, MAN). KARL FOX MAKES IT!
Score: 63-68

[05:28] Team_013 possession (Score: 63-68)
Pau Mobley makes the Layup and draws the foul on Victor Westbrook! And-1! Pau Mobley to the line for 1. [Team fouls: 1] (Victor Westbrook: 1 personal fouls)   FT 1/1: GOOD Pau Mobley makes 1/1 from the line.
Score: 66-68

[05:17] Team_044 possession (Score: 66-68)
Karl Fox attempts a Midrange. Contested by Desmond Ginobili (4.8 feet, MAN). Karl Fox misses. Rebound secured by Desmond Ginobili.

[05:02] Team_013 possession (Score: 66-68)
Jayson Morant attempts a Midrange. Contested by Victor Westbrook (4.3 feet, MAN). Jayson Morant misses. FOUL! Loose ball foul on Victor Westbrook during the rebound battle. [Team fouls: 2] No free throws, side out. (Victor Westbrook: 2 personal fouls)

[04:48] Team_013 possession (Score: 66-68)
Pau Mobley attempts a Midrange. Contested by Isaiah Murray (4.9 feet, MAN). Pau Mobley misses. Rebound secured by Karl Fox.

[04:36] Team_044 possession (Score: 66-68)
FOUL! Offensive foul on Zach McGrady! Manu Smith drew the charge! [Team fouls: 3] (Zach McGrady: 1 personal fouls) TURNOVER! (dead ball)

[04:24] Team_013 possession (Score: 66-68)
Jayson Morant attempts a 3Pt. Wide open! Isaiah Murray is 6.8 feet away. [ZONE] JAYSON MORANT MAKES IT! Assist: Pau Mobley
Score: 69-68

[04:10] Team_044 possession (Score: 69-68)
Victor Westbrook attempts a Layup. Wide open! Desmond Ginobili is 8.5 feet away. [ZONE] VICTOR WESTBROOK MAKES IT!
Score: 69-70

[03:58] Team_013 possession (Score: 69-70)
Pau Mobley makes the Layup and draws the foul on Ayo McCollum! And-1! Pau Mobley to the line for 1. [Team fouls: 4] (Ayo McCollum: 1 personal fouls)   FT 1/1: GOOD Pau Mobley makes 1/1 from the line.
Score: 72-70

[03:43] Team_044 possession (Score: 72-70)
Ayo McCollum attempts a 3Pt. Contested by Pau Mobley (4.7 feet, ZONE). Ayo McCollum misses. Rebound secured by Nikola Curry.

[03:30] Team_013 possession (Score: 72-70)
Jayson Morant attempts a 3Pt. Contested by Victor Westbrook (2.9 feet, MAN). Jayson Morant misses. Offensive rebound by Desmond Ginobili! Desmond Ginobili kicks it out.

[03:17] Team_013 possession (Score: 72-70)
FOUL! Offensive foul on Pau Mobley! Isaiah Murray drew the charge! [Team fouls: 4] (Pau Mobley: 1 personal fouls) TURNOVER! (dead ball)

[03:00] Team_044 possession (Score: 72-70)
Karl Fox attempts a Layup. Wide open! Desmond Ginobili is 7.1 feet away. [ZONE] Karl Fox misses. Rebound secured by Pau Mobley.

[02:45] Team_013 possession (Score: 72-70)
FOUL! Reach-in foul on Zach McGrady during the drive. [IN THE BONUS! 5 team fouls] Manu Smith to the line for 2 free throws. (Zach McGrady: 2 personal fouls)   FT 1/2: GOOD   FT 2/2: GOOD Manu Smith makes 2/2 from the line.
Score: 74-70

[02:27] Team_044 possession (Score: 74-70)
Victor Westbrook attempts a 3Pt. Contested by Jayson Morant (3.8 feet, MAN). Victor Westbrook misses. Rebound secured by Pau Mobley.

[02:17] Team_013 possession (Score: 74-70)
Manu Smith attempts a Midrange. Wide open! Zach McGrady is 6.8 feet away. [MAN] MANU SMITH MAKES IT! Assist: Pau Mobley
Score: 76-70

[02:05] Team_044 possession (Score: 76-70)
Ayo McCollum attempts a Midrange. Contested by Nikola Curry (3.1 feet, ZONE). Ayo McCollum misses. Rebound secured by Desmond Ginobili.

[01:50] Team_013 possession (Score: 76-70)
Manu Smith attempts a Midrange. Wide open! Zach McGrady is 6.5 feet away. [MAN] MANU SMITH MAKES IT! Assist: Nikola Curry
Score: 78-70

[01:37] Team_044 possession (Score: 78-70)
Zach McGrady drives and kicks out. Victor Westbrook attempts a 3Pt. Wide open! Jayson Morant is 6.1 feet away. [MAN] VICTOR WESTBROOK MAKES IT!
Score: 78-73

[01:23] Team_013 possession (Score: 78-73)
Pau Mobley attempts a 3Pt. Wide open! Isaiah Murray is 6.6 feet away. [MAN] PAU MOBLEY MAKES IT! Assist: Manu Smith
Score: 81-73

[01:05] Team_044 possession (Score: 81-73)
Karl Fox attempts a Midrange. Contested by Jayson Morant (5.3 feet, ZONE). Karl Fox misses. Rebound secured by Nikola Curry.

[00:51] Team_013 possession (Score: 81-73)
Nikola Curry attempts a Midrange. Wide open! Ayo McCollum is 7.0 feet away. [MAN] Nikola Curry misses. Rebound secured by Karl Fox.

[00:39] Team_044 possession (Score: 81-73)
Isaiah Murray makes the Dunk and draws the foul on Desmond Ginobili! And-1! Isaiah Murray to the line for 1. [BONUS: 5 team fouls] (Desmond Ginobili: 3 personal fouls)   FT 1/1: GOOD Isaiah Murray makes 1/1 from the line.
Score: 81-76

[00:24] Team_013 possession (Score: 81-76)
Pau Mobley attempts a Midrange. Wide open! Isaiah Murray is 7.7 feet away. [MAN] PAU MOBLEY MAKES IT! Assist: Manu Smith
Score: 83-76

[00:11] Team_044 possession (Score: 83-76)
FOUL! Shooting foul on Jayson Morant. Victor Westbrook to the line for 2 free throws. [BONUS: 6 team fouls] (Jayson Morant: 2 personal fouls)   FT 1/2: MISS   FT 2/2: GOOD Victor Westbrook makes 1/2 from the line.
Score: 83-77

================================================================================
                              3RD QUARTER COMPLETE                              
================================================================================

3RD QUARTER SCORE: Team_013 27, Team_044 23

BOX SCORE:
================================================================================

Team_013
--------------------------------------------------------------------------------
Player                MIN  PTS  REB  AST  TO      FG   FG%      3P   3P%
--------------------------------------------------------------------------------
Pau Mobley             32   11    4    4   0   4/6    66.7     0/0   0.0
Manu Smith             32    8    0    3   0   4/5    80.0     0/0   0.0
Jayson Morant          32    6    0    0   0   2/4    50.0     0/0   0.0
Desmond Ginobili       32    2    4    0   0   1/1   100.0     0/0   0.0
Nikola Curry           32    0    7    1   0   0/2     0.0     0/0   0.0

TEAM: FG: 11/18 (61.1%), 3PT: 3/3 (100.0%), REB: 14 (5 off, 9 def), AST: 8, TO: 4
TEAM FOULS: 6 [Team_044 in BONUS]


Team_044
--------------------------------------------------------------------------------
Player                MIN  PTS  REB  AST  TO      FG   FG%      3P   3P%
--------------------------------------------------------------------------------
Victor Westbrook       32   12    1    0   0   5/7    71.4     0/0   0.0
Zach McGrady           32    4    0    1   0   2/4    50.0     0/0   0.0
Karl Fox               32    4    4    0   0   2/5    40.0     0/0   0.0
Isaiah Murray          32    3    0    1   0   1/2    50.0     0/0   0.0
Ayo McCollum           32    0    2    1   0   0/2     0.0     0/0   0.0

TEAM: FG: 10/20 (50.0%), 3PT: 0/5 (0.0%), REB: 8 (1 off, 7 def), AST: 3, TO: 2
TEAM FOULS: 5 [Team_013 in BONUS]

================================================================================

================================================================================
                       4TH QUARTER - Team_013 vs Team_044                       
================================================================================

[12:00] Team_013 possession (Score: 83-77)
FOUL! Reach-in foul on Ayo McCollum during the drive. [Team fouls: 1] No free throws, side out. (Ayo McCollum: 1 personal fouls)

[11:45] Team_013 possession (Score: 83-77)
Jayson Morant attempts a 3Pt. Contested by Isaiah Murray (5.3 feet, ZONE). Jayson Morant misses. Rebound secured by Ayo McCollum.

[11:32] Team_044 possession (Score: 83-77)
Victor Westbrook drives, Jayson Morant stays with him. Victor Westbrook attempts a Dunk. Contested by Jayson Morant (5.2 feet, MAN). VICTOR WESTBROOK MAKES IT! Assist: Isaiah Murray
Score: 83-79

[11:17] Team_013 possession (Score: 83-79)
Desmond Ginobili makes the Layup and draws the foul on Zach McGrady! And-1! Desmond Ginobili to the line for 1. [Team fouls: 2] (Zach McGrady: 1 personal fouls)   FT 1/1: MISS Desmond Ginobili makes 0/1 from the line. Offensive rebound by Desmond Ginobili! Desmond Ginobili kicks it out.
Score: 85-79

[11:02] Team_013 possession (Score: 85-79)
Nikola Curry attempts a Layup. Contested by Ayo McCollum (3.0 feet, ZONE). NIKOLA CURRY MAKES IT!
Score: 87-79

[10:50] Team_044 possession (Score: 87-79)
Ayo McCollum drives and kicks out. Isaiah Murray attempts a 3Pt. Contested by Pau Mobley (5.2 feet, MAN). Isaiah Murray misses. Rebound secured by Desmond Ginobili.

[10:34] Team_013 possession (Score: 87-79)
Jayson Morant attempts a 3Pt. Contested by Victor Westbrook (3.7 feet, MAN). Jayson Morant misses. Rebound secured by Victor Westbrook.

[10:24] Team_044 possession (Score: 87-79)
Victor Westbrook drives and kicks out. Ayo McCollum attempts a Midrange. Wide open! Nikola Curry is 9.0 feet away. [MAN] Ayo McCollum misses. Rebound secured by Desmond Ginobili.

[10:11] Team_013 possession (Score: 87-79)
FOUL! Shooting foul on Karl Fox. Nikola Curry to the line for 2 free throws. [Team fouls: 3] (Karl Fox: 1 personal fouls)   FT 1/2: GOOD   FT 2/2: GOOD Nikola Curry makes 2/2 from the line.
Score: 89-79

[09:58] Team_044 possession (Score: 89-79)
Zach McGrady drives, Desmond Ginobili stays with him. Zach McGrady attempts a Dunk. Wide open! Desmond Ginobili is 6.7 feet away. [ZONE] ZACH MCGRADY MAKES IT! Assist: Isaiah Murray
Score: 89-81

[09:43] Team_013 possession (Score: 89-81)
FOUL! Reach-in foul on Karl Fox during the drive. [Team fouls: 4] No free throws, side out. (Karl Fox: 2 personal fouls)

[09:27] Team_013 possession (Score: 89-81)
FOUL! Holding foul on Isaiah Murray. [IN THE BONUS! 5 team fouls] Pau Mobley to the line for 2 free throws. (Isaiah Murray: 1 personal fouls)   FT 1/2: MISS   FT 2/2: GOOD Pau Mobley makes 1/2 from the line.
Score: 90-81

[09:12] Team_044 possession (Score: 90-81)
Isaiah Murray drives, Pau Mobley stays with him. Isaiah Murray attempts a Dunk. Contested by Pau Mobley (3.2 feet, MAN). Isaiah Murray misses. Rebound secured by Desmond Ginobili.

[08:58] Team_013 possession (Score: 90-81)
Pau Mobley attempts a Midrange. Wide open! Isaiah Murray is 7.5 feet away. [MAN] PAU MOBLEY MAKES IT!
Score: 92-81

[08:46] Team_044 possession (Score: 92-81)
FOUL! Reach-in foul on Nikola Curry during the drive. [Team fouls: 1] No free throws, side out. (Nikola Curry: 1 personal fouls)

[08:34] Team_044 possession (Score: 92-81)
Karl Fox attempts a 3Pt. Contested by Desmond Ginobili (4.2 feet, MAN). Karl Fox misses. Rebound secured by Pau Mobley.

[08:22] Team_013 possession (Score: 92-81)
Pau Mobley attempts a Layup. Wide open! Isaiah Murray is 8.8 feet away. [MAN] PAU MOBLEY MAKES IT! Assist: Manu Smith
Score: 94-81

[08:08] Team_044 possession (Score: 94-81)
Victor Westbrook attempts a 3Pt. Wide open! Jayson Morant is 6.1 feet away. [ZONE] Victor Westbrook misses. Rebound secured by Nikola Curry.

[07:56] Team_013 possession (Score: 94-81)
Jayson Morant attempts a 3Pt. Contested by Isaiah Murray (5.2 feet, ZONE). JAYSON MORANT MAKES IT! Assist: Manu Smith
Score: 97-81

[07:38] Team_044 possession (Score: 97-81)
Karl Fox drives and kicks out. Karl Fox attempts a 3Pt. Contested by Pau Mobley (3.6 feet, ZONE). Karl Fox misses. Offensive rebound by Victor Westbrook! Victor Westbrook kicks it out.

[07:25] Team_044 possession (Score: 97-81)
Victor Westbrook attempts a 3Pt. Wide open! Jayson Morant is 8.5 feet away. [MAN] VICTOR WESTBROOK MAKES IT! Assist: Karl Fox
Score: 97-84

[07:06] Team_013 possession (Score: 97-84)
Pau Mobley attempts a Midrange. Contested by Isaiah Murray (6.0 feet, MAN). Pau Mobley misses. Rebound secured by Karl Fox.

[06:51] Team_044 possession (Score: 97-84)
Victor Westbrook drives, picks up Desmond Ginobili. Help arrives from Pau Mobley! Victor Westbrook attempts a Dunk. Contested by Pau Mobley (4.6 feet, ZONE). VICTOR WESTBROOK MAKES IT!
Score: 97-86

[06:38] Team_013 possession (Score: 97-86)
FOUL! Offensive foul on Pau Mobley! Isaiah Murray drew the charge! [Team fouls: 2] (Pau Mobley: 1 personal fouls) TURNOVER! (dead ball)

[06:25] Team_044 possession (Score: 97-86)
Isaiah Murray drives, picks up Pau Mobley. Help arrives from Jayson Morant! Isaiah Murray attempts a Layup. Contested by Jayson Morant (4.5 feet, MAN). ISAIAH MURRAY MAKES IT!
Score: 97-88

[06:11] Team_013 possession (Score: 97-88)
Desmond Ginobili attempts a 3Pt. Wide open! Isaiah Murray is 7.3 feet away. [ZONE] Desmond Ginobili misses. Rebound secured by Victor Westbrook.

[05:59] Team_044 possession (Score: 97-88)
Ayo McCollum attempts a Layup. Heavily contested by Desmond Ginobili (0.9 feet, ZONE)! Ayo McCollum misses. Offensive rebound by Ayo McCollum! Ayo McCollum kicks it out.

[05:43] Team_044 possession (Score: 97-88)
Karl Fox throws a bad pass out of bounds! TURNOVER! (dead ball)

[05:43] Substitution (Team_013): Manu Smith OUT → Gary Iverson IN (stamina_rule2)

[05:43] Substitution (Team_013): Pau Mobley OUT → Chris Bryant IN (stamina_rule2)

[05:43] Substitution (Team_013): Jayson Morant OUT → Vince Nowitzki IN (stamina_rule2)

[05:43] Substitution (Team_013): Desmond Ginobili OUT → Dirk Booker IN (stamina_rule2)

[05:43] Substitution (Team_013): Nikola Curry OUT → Jayson Nowitzki IN (stamina_rule2)

[05:43] Substitution (Team_044): Zach McGrady OUT → Kyrie Poole IN (stamina_rule2)

[05:43] Substitution (Team_044): Isaiah Murray OUT → Tim Towns IN (stamina_rule2)

[05:43] Substitution (Team_044): Victor Westbrook OUT → Tim Siakam IN (stamina_rule2)

[05:43] Substitution (Team_044): Karl Fox OUT → Pau Quickley IN (stamina_rule2)

[05:43] Substitution (Team_044): Ayo McCollum OUT → Victor Anthony IN (stamina_rule2)

[05:28] Team_013 possession (Score: 97-88)
Jayson Nowitzki drives to the basket... Jayson Nowitzki loses control! Ball rolls out of bounds! TURNOVER! (dead ball)

[05:13] Team_044 possession (Score: 97-88)
Tim Towns attempts a Midrange. Contested by Dirk Booker (5.2 feet, ZONE). Tim Towns misses. Rebound secured by Dirk Booker.

[04:58] Team_013 possession (Score: 97-88)
Vince Nowitzki attempts a 3Pt. Contested by Tim Siakam (3.1 feet, MAN). Vince Nowitzki misses. Rebound secured by Victor Anthony.

[04:44] Team_044 possession (Score: 97-88)
Tim Towns makes the Dunk and draws the foul on Chris Bryant! And-1! Tim Towns to the line for 1. [Team fouls: 3] (Chris Bryant: 1 personal fouls)   FT 1/1: GOOD Tim Towns makes 1/1 from the line.
Score: 97-91

[04:33] Team_013 possession (Score: 97-91)
Chris Bryant attempts a Layup. Contested by Tim Towns (5.7 feet, MAN). CHRIS BRYANT MAKES IT!
Score: 99-91

[04:19] Team_044 possession (Score: 99-91)
Tim Siakam attempts a 3Pt. Wide open! Vince Nowitzki is 7.8 feet away. [MAN] Tim Siakam misses. FOUL! Loose ball foul on Dirk Booker during the rebound battle. [Team fouls: 4] No free throws, side out. (Dirk Booker: 1 personal fouls)

[04:05] Team_044 possession (Score: 99-91)
Tim Towns attempts a Layup. BLOCKED BY CHRIS BRYANT! Ball is loose! Rebound secured by Chris Bryant.

[03:49] Team_013 possession (Score: 99-91)
Jayson Nowitzki throws a bad pass out of bounds! TURNOVER! (dead ball)

[03:31] Team_044 possession (Score: 99-91)
FOUL! Reach-in foul on Dirk Booker during the drive. [IN THE BONUS! 5 team fouls] Tim Siakam to the line for 2 free throws. (Dirk Booker: 2 personal fouls)   FT 1/2: GOOD   FT 2/2: GOOD Tim Siakam makes 2/2 from the line.
Score: 99-93

[03:16] Team_013 possession (Score: 99-93)
Gary Iverson drives to the basket... Gary Iverson throws a bad pass out of bounds! TURNOVER! (dead ball)

[02:58] Team_044 possession (Score: 99-93)
Pau Quickley drives, Dirk Booker stays with him. Pau Quickley attempts a Layup. Wide open! Dirk Booker is 7.1 feet away. [MAN] PAU QUICKLEY MAKES IT!
Score: 99-95

[02:40] Team_013 possession (Score: 99-95)
Jayson Nowitzki attempts a 3Pt. Contested by Tim Siakam (4.8 feet, ZONE). Jayson Nowitzki misses. Rebound secured by Victor Anthony.

[02:23] Team_044 possession (Score: 99-95)
Tim Siakam drives, picks up Vince Nowitzki. Help arrives from Gary Iverson! Tim Siakam attempts a Layup. Wide open! Gary Iverson is 7.0 feet away. [MAN] TIM SIAKAM MAKES IT!
Score: 99-97

[02:11] Team_013 possession (Score: 99-97)
Chris Bryant drives, picks up Tim Towns. Help arrives from Tim Siakam! Chris Bryant attempts a Layup. Contested by Tim Siakam (5.0 feet, MAN). CHRIS BRYANT MAKES IT! Assist: Jayson Nowitzki
Score: 101-97

[01:56] Team_044 possession (Score: 101-97)
FOUL! Offensive foul on Tim Towns! Chris Bryant drew the charge! [Team fouls: 6] (Tim Towns: 1 personal fouls) TURNOVER! (dead ball)

[01:42] Team_013 possession (Score: 101-97)
Jayson Nowitzki attempts a Layup. Contested by Pau Quickley (3.6 feet, ZONE). JAYSON NOWITZKI MAKES IT!
Score: 103-97

[01:25] Team_044 possession (Score: 103-97)
FOUL! Reach-in foul on Vince Nowitzki during the drive. [IN THE BONUS! 6 team fouls] Tim Siakam to the line for 2 free throws. (Vince Nowitzki: 1 personal fouls)   FT 1/2: GOOD   FT 2/2: GOOD Tim Siakam makes 2/2 from the line.
Score: 103-99

[01:14] Team_013 possession (Score: 103-99)
Vince Nowitzki attempts a Midrange. Contested by Kyrie Poole (5.1 feet, ZONE). Vince Nowitzki misses. Offensive rebound by Dirk Booker! Dirk Booker kicks it out.

[00:58] Team_013 possession (Score: 103-99)
Gary Iverson attempts a 3Pt. Heavily contested by Tim Siakam (1.3 feet, ZONE)! Gary Iverson misses. Rebound secured by Pau Quickley.

[00:44] Team_044 possession (Score: 103-99)
Kyrie Poole attempts a Midrange. Contested by Gary Iverson (4.5 feet, MAN). Kyrie Poole misses. Rebound secured by Chris Bryant.

[00:31] Team_013 possession (Score: 103-99)
Chris Bryant attempts a Midrange. Contested by Tim Towns (5.9 feet, MAN). Chris Bryant misses. Offensive rebound by Dirk Booker! Dirk Booker kicks it out.

[00:18] Team_013 possession (Score: 103-99)
Chris Bryant attempts a Layup. Contested by Pau Quickley (4.7 feet, ZONE). CHRIS BRYANT MAKES IT!
Score: 105-99

[00:01] Team_044 possession (Score: 105-99)
Kyrie Poole attempts a 3Pt. Contested by Gary Iverson (5.2 feet, MAN). Kyrie Poole misses. Rebound secured by Dirk Booker.

================================================================================
                              4TH QUARTER COMPLETE                              
================================================================================

4TH QUARTER SCORE: Team_013 22, Team_044 22

BOX SCORE:
================================================================================

Team_013
--------------------------------------------------------------------------------
Player                MIN  PTS  REB  AST  TO      FG   FG%      3P   3P%
--------------------------------------------------------------------------------
Chris Bryant           10    6    2    0   0   3/3   100.0     0/0   0.0
Pau Mobley             38    5    1    0   0   3/4    75.0     0/0   0.0
Nikola Curry           38    4    1    0   0   2/2   100.0     0/0   0.0
Jayson Morant          38    3    0    0   0   1/3    33.3     0/0   0.0
Jayson Nowitzki        10    2    0    1   0   1/2    50.0     0/0   0.0
Desmond Ginobili       38    0    4    0   0   0/1     0.0     0/0   0.0
Manu Smith             38    0    0    2   0   0/0     0.0     0/0   0.0
Dirk Booker            10    0    4    0   0   0/0     0.0     0/0   0.0
Vince Nowitzki         10    0    0    0   0   0/1     0.0     0/0   0.0
Gary Iverson           10    0    0    0   0   0/1     0.0     0/0   0.0

TEAM: FG: 10/17 (58.8%), 3PT: 1/7 (14.3%), REB: 12 (3 off, 9 def), AST: 3, TO: 4
TEAM FOULS: 6 [Team_044 in BONUS]


Team_044
--------------------------------------------------------------------------------
Player                MIN  PTS  REB  AST  TO      FG   FG%      3P   3P%
--------------------------------------------------------------------------------
Victor Westbrook       38    7    3    0   0   3/5    60.0     0/0   0.0
Tim Siakam             10    6    0    0   0   3/3   100.0     0/0   0.0
Tim Towns              10    3    0    0   0   1/3    33.3     0/0   0.0
Isaiah Murray          38    2    0    2   0   1/2    50.0     0/0   0.0
Zach McGrady           38    2    0    0   0   1/1   100.0     0/0   0.0
Pau Quickley           10    2    1    0   0   1/1   100.0     0/0   0.0
Ayo McCollum           38    0    2    0   0   0/1     0.0     0/0   0.0
Karl Fox               38    0    1    1   0   0/1     0.0     0/0   0.0
Victor Anthony         10    0    3    0   0   0/0     0.0     0/0   0.0
Kyrie Poole            10    0    0    0   0   0/2     0.0     0/0   0.0

TEAM: FG: 10/19 (52.6%), 3PT: 1/4 (25.0%), REB: 10 (3 off, 7 def), AST: 3, TO: 2
TEAM FOULS: 6 [Team_013 in BONUS]

================================================================================

================================================================================
                               FULL GAME COMPLETE                               
================================================================================

FINAL SCORE: Team_013 105, Team_044 99

SCORING BY QUARTER:
--------------------------------------------------------------------------------
Team                     Q1     Q2     Q3     Q4    FINAL
--------------------------------------------------------------------------------
Team_013                 28     28     27     22      105
Team_044                 22     32     23     22       99
--------------------------------------------------------------------------------

FULL GAME BOX SCORE:
================================================================================

Team_013
--------------------------------------------------------------------------------
Player                MIN  PTS  REB  AST  TO      FG   FG%      3P   3P%      FT STL BLK
--------------------------------------------------------------------------------
Manu Smith             38   21    0    8   0  10/15   66.7   3/5    60.0   6/8     1   0
Pau Mobley             38   22   11    6   3   8/14   57.1   3/4    75.0   3/4     0   0
Jayson Morant          38   16    0    2   4   6/13   46.2   4/6    66.7   0/0     1   0
Desmond Ginobili       38   10   15    2   1   3/7    42.9   0/2     0.0   2/4     1   0
Nikola Curry           38   15   14    2   2   7/10   70.0   0/0     0.0   3/3     0   0
Gary Iverson           10    3    0    0   0   1/2    50.0   1/2    50.0   0/1     0   0
Chris Bryant           10    9    2    0   0   4/6    66.7   0/0     0.0   1/1     0   1
Vince Nowitzki         10    0    0    0   1   0/1     0.0   0/1     0.0   0/0     0   0
Dirk Booker            10    0    6    0   1   0/1     0.0   0/0     0.0   0/1     0   0
Jayson Nowitzki        10    2    0    2   1   1/3    33.3   0/1     0.0   1/2     0   0

TEAM: FG: 41/74 (55.4%), 3PT: 11/21 (52.4%), REB: 47 (12 off, 35 def), AST: 22, TO: 13


Team_044
--------------------------------------------------------------------------------
Player                MIN  PTS  REB  AST  TO      FG   FG%      3P   3P%      FT STL BLK
--------------------------------------------------------------------------------
Zach McGrady           38   13    0    3   2   7/11   63.6   1/4    25.0   0/0     0   0
Isaiah Murray          38    7    0    5   2   3/8    37.5   0/2     0.0   1/1     0   0
Victor Westbrook       38   28   12    0   0  10/18   55.6   2/6    33.3   4/5     2   0
Karl Fox               38   17    9    4   1   6/14   42.9   1/5    20.0   3/3     1   1
Ayo McCollum           38    4    8    2   2   4/10   40.0   0/1     0.0   0/0     0   0
Kyrie Poole            10    6    0    2   0   2/4    50.0   1/2    50.0   0/0     0   0
Tim Towns              10    7    0    0   1   3/5    60.0   0/0     0.0   1/1     0   0
Tim Siakam             10    9    1    1   0   4/4   100.0   1/1   100.0   4/4     0   0
Pau Quickley           10    2    3    2   0   1/2    50.0   0/0     0.0   0/0     0   0
Victor Anthony         10    6    6    0   0   3/3   100.0   0/0     0.0   2/2     0   0

TEAM: FG: 43/79 (54.4%), 3PT: 6/21 (28.6%), REB: 40 (8 off, 32 def), AST: 19, TO: 8

================================================================================
