================================================================================
                        FULL GAME - Team_086 vs Team_088                        
================================================================================

================================================================================
                       1ST QUARTER - Team_086 vs Team_088                       
================================================================================

[12:00] Team_086 possession (Score: 0-0)
Bones Ginobili attempts a Midrange. Contested by Giannis Smith (3.5 feet, ZONE). Bones Ginobili misses. Rebound secured by Tyler Hyland.

[11:42] Team_088 possession (Score: 0-0)
Tobias Haliburton drives to the basket... Tobias Haliburton loses the ball! Stripped by Anfernee Harris! TURNOVER! (live ball)

[11:27] Team_086 possession (Score: 0-0)
Miles Gobert loses control! Ball rolls out of bounds! TURNOVER! (dead ball)

[11:15] Team_088 possession (Score: 0-0)
Tobias Haliburton attempts a Layup. Contested by Rudy Rose (4.3 feet, ZONE). TOBIAS HALIBURTON MAKES IT! Assist: Tyler Hyland
Score: 0-2

[10:58] Team_086 possession (Score: 0-2)
Rudy Rose makes the Layup and draws the foul on Tobias Haliburton! And-1! Rudy Rose to the line for 1. [Team fouls: 1] (Tobias Haliburton: 1 personal fouls)   FT 1/1: GOOD Rudy Rose makes 1/1 from the line.
Score: 3-2

[10:43] Team_088 possession (Score: 3-2)
Tyler Hyland attempts a Layup. Heavily contested by Miles Gobert (0.9 feet, MAN)! Tyler Hyland misses. Rebound secured by Rudy Rose.

[10:31] Team_086 possession (Score: 3-2)
Miles Gobert attempts a 3Pt. Contested by Tyler Hyland (4.2 feet, MAN). Miles Gobert misses. Rebound secured by Tyler Hyland.

[10:17] Team_088 possession (Score: 3-2)
Tyler Hyland drives to the basket... Tyler Hyland throws a bad pass! Stolen by Miles Gobert! TURNOVER! (live ball)

[09:58] Team_086 possession (Score: 3-2)
Bones Ginobili attempts a Midrange. Contested by Giannis Smith (2.5 feet, MAN). BONES GINOBILI MAKES IT!
Score: 5-2

[09:42] Team_088 possession (Score: 5-2)
Josh Duncan loses control! Ball rolls out of bounds! TURNOVER! (dead ball)

[09:26] Team_086 possession (Score: 5-2)
FOUL! Shooting foul on Tobias Haliburton. Anfernee Harris to the line for 2 free throws. [Team fouls: 2] (Tobias Haliburton: 2 personal fouls)   FT 1/2: GOOD   FT 2/2: MISS Anfernee Harris makes 1/2 from the line. Rebound secured by Giannis Smith.
Score: 6-2

[09:09] Team_088 possession (Score: 6-2)
FOUL! Reach-in foul on Bones Ginobili during the drive. [Team fouls: 1] No free throws, side out. (Bones Ginobili: 1 personal fouls)

[08:52] Team_088 possession (Score: 6-2)
Giannis Smith drives to the basket... Giannis Smith loses the ball! Stripped by Bones Ginobili! TURNOVER! (live ball)

[08:40] Team_086 possession (Score: 6-2)
Anfernee Harris drives, Tobias Haliburton stays with him. Anfernee Harris attempts a Layup. Contested by Tobias Haliburton (4.0 feet, MAN). Anfernee Harris misses. Rebound secured by Giannis Smith.

[08:23] Team_088 possession (Score: 6-2)
Tyler Hyland drives and kicks out. Tobias Haliburton attempts a Midrange. Wide open! Bones Ginobili is 7.7 feet away. [ZONE] Tobias Haliburton misses. Rebound secured by Bones Ginobili.

[08:09] Team_086 possession (Score: 6-2)
Rudy Rose drives to the basket... Rudy Rose throws a bad pass! Stolen by Allen Ming! TURNOVER! (live ball)

[07:54] Team_088 possession (Score: 6-2)
Tyler Hyland attempts a 3Pt. Contested by Lauri Johnson (5.6 feet, ZONE). Tyler Hyland misses. Rebound secured by Miles Gobert.

[07:42] Team_086 possession (Score: 6-2)
Rudy Rose attempts a 3Pt. Contested by Tobias Haliburton (4.9 feet, ZONE). Rudy Rose misses. Rebound secured by Giannis Smith.

[07:28] Team_088 possession (Score: 6-2)
Tyler Hyland attempts a 3Pt. Wide open! Lauri Johnson is 7.2 feet away. [ZONE] Tyler Hyland misses. Rebound secured by Miles Gobert.

[07:16] Team_086 possession (Score: 6-2)
Rudy Rose attempts a 3Pt. Contested by Allen Ming (4.7 feet, MAN). Rudy Rose misses. Offensive rebound by Miles Gobert! Miles Gobert kicks it out.

[07:00] Team_086 possession (Score: 6-2)
Rudy Rose drives and kicks out. Miles Gobert attempts a 3Pt. Contested by Tyler Hyland (3.4 feet, MAN). MILES GOBERT MAKES IT! Assist: Lauri Johnson
Score: 9-2

[06:50] Team_088 possession (Score: 9-2)
Josh Duncan attempts a 3Pt. Contested by Lauri Johnson (5.9 feet, ZONE). JOSH DUNCAN MAKES IT! Assist: Tobias Haliburton
Score: 9-5

[06:38] Team_086 possession (Score: 9-5)
Miles Gobert attempts a 3Pt. Contested by Tyler Hyland (3.3 feet, MAN). Miles Gobert misses. Rebound secured by Allen Ming.

[06:26] Team_088 possession (Score: 9-5)
Tobias Haliburton attempts a Midrange. Contested by Anfernee Harris (4.3 feet, ZONE). TOBIAS HALIBURTON MAKES IT!
Score: 9-7

[06:11] Team_086 possession (Score: 9-7)
Lauri Johnson attempts a Midrange. Wide open! Tyler Hyland is 6.2 feet away. [ZONE] LAURI JOHNSON MAKES IT!
Score: 11-7

[05:54] Team_088 possession (Score: 11-7)
Tobias Haliburton attempts a Midrange. Contested by Anfernee Harris (4.4 feet, MAN). Tobias Haliburton misses. Rebound secured by Bones Ginobili.

[05:39] Team_086 possession (Score: 11-7)
Rudy Rose attempts a Midrange. Contested by Tyler Hyland (4.1 feet, ZONE). Rudy Rose misses. Rebound secured by Giannis Smith.

[05:25] Team_088 possession (Score: 11-7)
Josh Duncan drives and kicks out. Allen Ming attempts a 3Pt. Contested by Rudy Rose (3.8 feet, MAN). Allen Ming misses. Rebound secured by Rudy Rose.

[05:12] Team_086 possession (Score: 11-7)
Bones Ginobili attempts a 3Pt. Contested by Tobias Haliburton (3.4 feet, ZONE). BONES GINOBILI MAKES IT! Assist: Rudy Rose
Score: 14-7

[04:57] Team_088 possession (Score: 14-7)
FOUL! Shooting foul on Rudy Rose. Giannis Smith to the line for 2 free throws. [Team fouls: 2] (Rudy Rose: 1 personal fouls)   FT 1/2: GOOD   FT 2/2: GOOD Giannis Smith makes 2/2 from the line.
Score: 14-9

[04:39] Team_086 possession (Score: 14-9)
Bones Ginobili attempts a Layup. Contested by Allen Ming (4.5 feet, ZONE). Bones Ginobili misses. Rebound secured by Allen Ming.

[04:28] Team_088 possession (Score: 14-9)
Josh Duncan attempts a 3Pt. Contested by Lauri Johnson (5.8 feet, MAN). Josh Duncan misses. Rebound secured by Miles Gobert.

[04:11] Team_086 possession (Score: 14-9)
Rudy Rose drives, Allen Ming stays with him. Rudy Rose attempts a Layup. Wide open! Allen Ming is 6.0 feet away. [MAN] Rudy Rose misses. Offensive rebound by Miles Gobert! Miles Gobert kicks it out.

[03:56] Team_086 possession (Score: 14-9)
FOUL! Shooting foul on Allen Ming. Rudy Rose to the line for 2 free throws. [Team fouls: 3] (Allen Ming: 1 personal fouls)   FT 1/2: GOOD   FT 2/2: GOOD Rudy Rose makes 2/2 from the line.
Score: 16-9

[03:43] Team_088 possession (Score: 16-9)
Tobias Haliburton attempts a Layup. BLOCKED BY ANFERNEE HARRIS! Ball is loose! Rebound secured by Bones Ginobili.

[03:29] Team_086 possession (Score: 16-9)
Bones Ginobili drives, picks up Allen Ming. Help arrives from Tobias Haliburton! Bones Ginobili attempts a Layup. Wide open! Tobias Haliburton is 6.9 feet away. [ZONE] BONES GINOBILI MAKES IT! Assist: Anfernee Harris
Score: 18-9

[03:14] Team_088 possession (Score: 18-9)
Tobias Haliburton attempts a Midrange. Wide open! Anfernee Harris is 6.7 feet away. [ZONE] Tobias Haliburton misses. Rebound secured by Bones Ginobili.

[02:59] Team_086 possession (Score: 18-9)
Anfernee Harris attempts a 3Pt. Heavily contested by Tobias Haliburton (1.5 feet, MAN)! Anfernee Harris misses. Rebound secured by Giannis Smith.

[02:42] Team_088 possession (Score: 18-9)
Giannis Smith drives, Rudy Rose stays with him. Giannis Smith attempts a Dunk. Contested by Rudy Rose (4.1 feet, ZONE). GIANNIS SMITH MAKES IT! Assist: Allen Ming
Score: 18-11

[02:25] Team_086 possession (Score: 18-11)
Rudy Rose attempts a Midrange. Contested by Allen Ming (4.3 feet, MAN). Rudy Rose misses. Rebound secured by Tyler Hyland.

[02:09] Team_088 possession (Score: 18-11)
Tobias Haliburton attempts a Layup. Contested by Anfernee Harris (3.9 feet, MAN). Tobias Haliburton misses. Offensive rebound by Giannis Smith! Giannis Smith puts it back in!
Score: 18-13

[01:57] Team_086 possession (Score: 18-13)
FOUL! Reach-in foul on Giannis Smith during the drive. [Team fouls: 4] No free throws, side out. (Giannis Smith: 1 personal fouls)

[01:40] Team_086 possession (Score: 18-13)
Anfernee Harris drives and kicks out. Rudy Rose attempts a 3Pt. Wide open! Tobias Haliburton is 8.6 feet away. [ZONE] RUDY ROSE MAKES IT! Assist: Miles Gobert
Score: 21-13

[01:21] Team_088 possession (Score: 21-13)
Tobias Haliburton attempts a Layup. Contested by Rudy Rose (2.1 feet, ZONE). TOBIAS HALIBURTON MAKES IT! Assist: Josh Duncan
Score: 21-15

[01:06] Team_086 possession (Score: 21-15)
Rudy Rose drives and kicks out. Miles Gobert attempts a 3Pt. BLOCKED BY TYLER HYLAND! Ball is loose! Rebound secured by Giannis Smith.

[00:48] Team_088 possession (Score: 21-15)
Tyler Hyland drives, Miles Gobert stays with him. Tyler Hyland attempts a Layup. Contested by Miles Gobert (5.0 feet, MAN). TYLER HYLAND MAKES IT!
Score: 21-17

[00:35] Team_086 possession (Score: 21-17)
Miles Gobert drives and kicks out. Miles Gobert attempts a 3Pt. Contested by Tyler Hyland (3.6 feet, MAN). Miles Gobert misses. Rebound secured by Tyler Hyland.

[00:22] Team_088 possession (Score: 21-17)
Tobias Haliburton drives, Anfernee Harris stays with him. Tobias Haliburton attempts a Layup. Contested by Anfernee Harris (4.1 feet, MAN). Tobias Haliburton misses. Rebound secured by Miles Gobert.

[00:04] Team_086 possession (Score: 21-17)
Bones Ginobili drives and kicks out. Miles Gobert attempts a 3Pt. Heavily contested by Tyler Hyland (1.7 feet, MAN)! Miles Gobert misses. Rebound secured by Giannis Smith.

================================================================================
                              1ST QUARTER COMPLETE                              
================================================================================

1ST QUARTER SCORE: Team_086 21, Team_088 17

BOX SCORE:
================================================================================

Team_086
--------------------------------------------------------------------------------
Player                MIN  PTS  REB  AST  TO      FG   FG%      3P   3P%
--------------------------------------------------------------------------------
Rudy Rose              12    8    2    1   0   3/7    42.9     0/0   0.0
Bones Ginobili         12    7    4    0   0   3/6    50.0     0/0   0.0
Miles Gobert           12    3    6    1   0   1/4    25.0     0/0   0.0
Lauri Johnson          12    2    0    1   0   1/1   100.0     0/0   0.0
Anfernee Harris        12    0    0    1   0   0/3     0.0     0/0   0.0

TEAM: FG: 8/21 (38.1%), 3PT: 1/5 (20.0%), REB: 12 (2 off, 10 def), AST: 4, TO: 2
TEAM FOULS: 2


Team_088
--------------------------------------------------------------------------------
Player                MIN  PTS  REB  AST  TO      FG   FG%      3P   3P%
--------------------------------------------------------------------------------
Tobias Haliburton      12    6    0    1   0   3/7    42.9     0/0   0.0
Giannis Smith          12    6    8    0   0   3/3   100.0     0/0   0.0
Josh Duncan            12    3    0    1   0   1/3    33.3     0/0   0.0
Tyler Hyland           12    2    4    1   0   1/5    20.0     0/0   0.0
Allen Ming             12    0    2    1   0   0/0     0.0     0/0   0.0

TEAM: FG: 8/18 (44.4%), 3PT: 1/4 (25.0%), REB: 14 (1 off, 13 def), AST: 4, TO: 4
TEAM FOULS: 4

================================================================================

================================================================================
                       2ND QUARTER - Team_086 vs Team_088                       
================================================================================

[12:00] Team_086 possession (Score: 21-17)
Lauri Johnson attempts a 3Pt. Wide open! Tobias Haliburton is 7.9 feet away. [ZONE] LAURI JOHNSON MAKES IT! Assist: Rudy Rose
Score: 24-17

[11:48] Team_088 possession (Score: 24-17)
Tobias Haliburton attempts a 3Pt. Contested by Anfernee Harris (4.9 feet, ZONE). Tobias Haliburton misses. FOUL! Loose ball foul on Bones Ginobili during the rebound battle. [Team fouls: 1] No free throws, side out. (Bones Ginobili: 1 personal fouls)

[11:34] Team_088 possession (Score: 24-17)
FOUL! Holding foul on Rudy Rose. [Team fouls: 2] No free throws, side out. (Rudy Rose: 1 personal fouls)

[11:23] Team_088 possession (Score: 24-17)
Tobias Haliburton makes the Layup and draws the foul on Anfernee Harris! And-1! Tobias Haliburton to the line for 1. [Team fouls: 3] (Anfernee Harris: 1 personal fouls)   FT 1/1: MISS Tobias Haliburton makes 0/1 from the line. Rebound secured by Rudy Rose.
Score: 24-19

[11:10] Team_086 possession (Score: 24-19)
Lauri Johnson makes the Layup and draws the foul on Tobias Haliburton! And-1! Lauri Johnson to the line for 1. [Team fouls: 1] (Tobias Haliburton: 1 personal fouls)   FT 1/1: GOOD Lauri Johnson makes 1/1 from the line.
Score: 27-19

[10:59] Team_088 possession (Score: 27-19)
Giannis Smith attempts a Layup. Wide open! Bones Ginobili is 8.0 feet away. [MAN] GIANNIS SMITH MAKES IT! Assist: Allen Ming
Score: 27-21

[10:46] Team_086 possession (Score: 27-21)
Lauri Johnson attempts a 3Pt. Wide open! Josh Duncan is 8.5 feet away. [MAN] LAURI JOHNSON MAKES IT! Assist: Bones Ginobili
Score: 30-21

[10:30] Team_088 possession (Score: 30-21)
Tobias Haliburton loses control! Ball rolls out of bounds! TURNOVER! (dead ball)

[10:30] Substitution (Team_086): Lauri Johnson OUT → Anfernee Green IN (stamina_rule2)

[10:30] Substitution (Team_086): Anfernee Harris OUT → Anthony James IN (stamina_rule2)

[10:30] Substitution (Team_086): Miles Gobert OUT → Franz McGrady IN (stamina_rule2)

[10:30] Substitution (Team_086): Bones Ginobili OUT → Kyle McCollum IN (stamina_rule2)

[10:30] Substitution (Team_086): Rudy Rose OUT → Lamelo Towns IN (stamina_rule2)

[10:30] Substitution (Team_088): Josh Duncan OUT → Klay Quickley IN (stamina_rule2)

[10:30] Substitution (Team_088): Tobias Haliburton OUT → Vince Carter IN (stamina_rule2)

[10:30] Substitution (Team_088): Tyler Hyland OUT → Pau Bird IN (stamina_rule2)

[10:30] Substitution (Team_088): Giannis Smith OUT → Zion Harris IN (stamina_rule2)

[10:30] Substitution (Team_088): Allen Ming OUT → Josh Embiid IN (stamina_rule2)

[10:19] Team_086 possession (Score: 30-21)
Anthony James attempts a 3Pt. Wide open! Pau Bird is 8.7 feet away. [ZONE] Anthony James misses. Rebound secured by Zion Harris.

[10:04] Team_088 possession (Score: 30-21)
Vince Carter attempts a Midrange. Contested by Lamelo Towns (2.5 feet, ZONE). Vince Carter misses. Rebound secured by Anfernee Green.

[09:46] Team_086 possession (Score: 30-21)
Kyle McCollum attempts a 3Pt. Wide open! Zion Harris is 6.4 feet away. [MAN] Kyle McCollum misses. Rebound secured by Pau Bird.

[09:31] Team_088 possession (Score: 30-21)
Zion Harris drives, Kyle McCollum stays with him. Zion Harris attempts a Layup. Contested by Kyle McCollum (4.3 feet, MAN). ZION HARRIS MAKES IT! Assist: Vince Carter
Score: 30-23

[09:18] Team_086 possession (Score: 30-23)
Lamelo Towns attempts a Midrange. Contested by Josh Embiid (4.1 feet, MAN). Lamelo Towns misses. Rebound secured by Josh Embiid.

[09:06] Team_088 possession (Score: 30-23)
Vince Carter attempts a 3Pt. Heavily contested by Anfernee Green (1.6 feet, ZONE)! Vince Carter misses. Rebound secured by Kyle McCollum.

[08:50] Team_086 possession (Score: 30-23)
Franz McGrady attempts a 3Pt. Contested by Pau Bird (2.6 feet, ZONE). FRANZ MCGRADY MAKES IT! Assist: Anthony James
Score: 33-23

[08:37] Team_088 possession (Score: 33-23)
Josh Embiid attempts a Layup. BLOCKED BY LAMELO TOWNS! Ball is loose! Rebound secured by Anfernee Green.

[08:23] Team_086 possession (Score: 33-23)
Anfernee Green attempts a Midrange. Wide open! Klay Quickley is 6.2 feet away. [MAN] ANFERNEE GREEN MAKES IT!
Score: 35-23

[08:13] Team_088 possession (Score: 35-23)
Josh Embiid attempts a Layup. Wide open! Lamelo Towns is 6.2 feet away. [ZONE] Josh Embiid misses. Rebound secured by Lamelo Towns.

[08:00] Team_086 possession (Score: 35-23)
Anthony James attempts a 3Pt. Wide open! Pau Bird is 8.2 feet away. [ZONE] ANTHONY JAMES MAKES IT! Assist: Anfernee Green
Score: 38-23

[07:44] Team_088 possession (Score: 38-23)
Zion Harris attempts a Midrange. Contested by Anthony James (4.1 feet, ZONE). Zion Harris misses. Rebound secured by Lamelo Towns.

[07:31] Team_086 possession (Score: 38-23)
Kyle McCollum attempts a Midrange. Wide open! Zion Harris is 6.7 feet away. [MAN] Kyle McCollum misses. Rebound secured by Josh Embiid.

[07:15] Team_088 possession (Score: 38-23)
FOUL! Reach-in foul on Franz McGrady during the drive. [Team fouls: 4] No free throws, side out. (Franz McGrady: 1 personal fouls)

[07:00] Team_088 possession (Score: 38-23)
Pau Bird attempts a 3Pt. Wide open! Anfernee Green is 6.7 feet away. [ZONE] Pau Bird misses. Rebound secured by Kyle McCollum.

[06:44] Team_086 possession (Score: 38-23)
Franz McGrady attempts a 3Pt. Contested by Pau Bird (3.8 feet, ZONE). Franz McGrady misses. Rebound secured by Josh Embiid.

[06:26] Team_088 possession (Score: 38-23)
Pau Bird drives to the basket... Pau Bird throws a bad pass out of bounds! TURNOVER! (dead ball)

[06:07] Team_086 possession (Score: 38-23)
Anthony James attempts a Midrange. Wide open! Zion Harris is 6.7 feet away. [ZONE] ANTHONY JAMES MAKES IT!
Score: 40-23

[05:52] Team_088 possession (Score: 40-23)
Vince Carter attempts a 3Pt. Contested by Franz McGrady (3.2 feet, ZONE). Vince Carter misses. Rebound secured by Anfernee Green.

[05:41] Team_086 possession (Score: 40-23)
Kyle McCollum attempts a 3Pt. Wide open! Pau Bird is 6.9 feet away. [ZONE] Kyle McCollum misses. Offensive rebound by Lamelo Towns! Lamelo Towns kicks it out.

[05:27] Team_086 possession (Score: 40-23)
FOUL! Holding foul on Zion Harris. [Team fouls: 2] No free throws, side out. (Zion Harris: 1 personal fouls)

[05:15] Team_086 possession (Score: 40-23)
Kyle McCollum drives and kicks out. Kyle McCollum attempts a 3Pt. Contested by Zion Harris (5.1 feet, MAN). Kyle McCollum misses. Offensive rebound by Anfernee Green! Anfernee Green kicks it out.

[05:00] Team_086 possession (Score: 40-23)
Kyle McCollum attempts a 3Pt. Wide open! Pau Bird is 7.1 feet away. [ZONE] Kyle McCollum misses. Rebound secured by Pau Bird.

[04:48] Team_088 possession (Score: 40-23)
FOUL! Reach-in foul on Lamelo Towns during the drive. [IN THE BONUS! 5 team fouls] Josh Embiid to the line for 2 free throws. (Lamelo Towns: 1 personal fouls)   FT 1/2: GOOD   FT 2/2: GOOD Josh Embiid makes 2/2 from the line.
Score: 40-25

[04:29] Team_086 possession (Score: 40-25)
Anfernee Green loses control! Ball rolls out of bounds! TURNOVER! (dead ball)

[04:11] Team_088 possession (Score: 40-25)
Josh Embiid attempts a Midrange. Contested by Anthony James (2.8 feet, ZONE). Josh Embiid misses. Rebound secured by Anfernee Green.

[03:52] Team_086 possession (Score: 40-25)
Franz McGrady drives, Zion Harris stays with him. Franz McGrady attempts a Layup. Wide open! Zion Harris is 8.2 feet away. [ZONE] FRANZ MCGRADY MAKES IT! Assist: Lamelo Towns
Score: 42-25

[03:39] Team_088 possession (Score: 42-25)
Klay Quickley drives to the basket... Klay Quickley loses control! Ball rolls out of bounds! TURNOVER! (dead ball)

[03:23] Team_086 possession (Score: 42-25)
Anthony James attempts a Layup. Contested by Vince Carter (5.2 feet, MAN). ANTHONY JAMES MAKES IT!
Score: 44-25

[03:10] Team_088 possession (Score: 44-25)
Klay Quickley drives, Anfernee Green stays with him. Klay Quickley attempts a Layup. Contested by Anfernee Green (3.4 feet, MAN). Klay Quickley misses. Offensive rebound by Josh Embiid! Josh Embiid kicks it out.

[02:56] Team_088 possession (Score: 44-25)
Klay Quickley attempts a Midrange. Contested by Anfernee Green (4.7 feet, MAN). Klay Quickley misses. Rebound secured by Anfernee Green.

[02:42] Team_086 possession (Score: 44-25)
FOUL! Reach-in foul on Vince Carter during the drive. [Team fouls: 3] No free throws, side out. (Vince Carter: 1 personal fouls)

[02:26] Team_086 possession (Score: 44-25)
Anfernee Green attempts a 3Pt. Contested by Pau Bird (5.5 feet, ZONE). Anfernee Green misses. Offensive rebound by Lamelo Towns! Lamelo Towns kicks it out.

[02:11] Team_086 possession (Score: 44-25)
Anfernee Green attempts a 3Pt. Wide open! Pau Bird is 8.8 feet away. [ZONE] Anfernee Green misses. Rebound secured by Zion Harris.

[01:59] Team_088 possession (Score: 44-25)
Pau Bird attempts a Layup. Contested by Franz McGrady (5.4 feet, MAN). Pau Bird misses. Rebound secured by Anfernee Green.

[01:46] Team_086 possession (Score: 44-25)
Anfernee Green attempts a 3Pt. Wide open! Klay Quickley is 7.2 feet away. [MAN] ANFERNEE GREEN MAKES IT! Assist: Lamelo Towns
Score: 47-25

[01:30] Team_088 possession (Score: 47-25)
Zion Harris drives to the basket... Zion Harris commits a violation (traveling/carry)! TURNOVER! (dead ball)

[01:20] Team_086 possession (Score: 47-25)
Anfernee Green drives and kicks out. Anthony James attempts a Midrange. Wide open! Vince Carter is 6.9 feet away. [MAN] Anthony James misses. Rebound secured by Pau Bird.

[01:09] Team_088 possession (Score: 47-25)
Klay Quickley attempts a 3Pt. Contested by Anfernee Green (4.5 feet, MAN). KLAY QUICKLEY MAKES IT! Assist: Pau Bird
Score: 47-28

[00:55] Team_086 possession (Score: 47-28)
Anfernee Green attempts a 3Pt. Contested by Klay Quickley (4.8 feet, MAN). Anfernee Green misses. Rebound secured by Josh Embiid.

[00:40] Team_088 possession (Score: 47-28)
Pau Bird attempts a 3Pt. Contested by Anfernee Green (5.0 feet, ZONE). Pau Bird misses. Rebound secured by Kyle McCollum.

[00:23] Team_086 possession (Score: 47-28)
Franz McGrady attempts a Layup. Wide open! Pau Bird is 7.1 feet away. [MAN] FRANZ MCGRADY MAKES IT! Assist: Kyle McCollum
Score: 49-28

[00:06] Team_088 possession (Score: 49-28)
Klay Quickley attempts a 3Pt. BLOCKED BY ANFERNEE GREEN! Ball is loose! Rebound secured by Anfernee Green.

================================================================================
                              2ND QUARTER COMPLETE                              
================================================================================

2ND QUARTER SCORE: Team_086 28, Team_088 11

BOX SCORE:
================================================================================

Team_086
--------------------------------------------------------------------------------
Player                MIN  PTS  REB  AST  TO      FG   FG%      3P   3P%
--------------------------------------------------------------------------------
Lauri Johnson          14    9    0    0   0   3/3   100.0     0/0   0.0
Anthony James          10    7    0    1   0   3/4    75.0     0/0   0.0
Franz McGrady          10    7    0    0   0   3/4    75.0     0/0   0.0
Anfernee Green         10    5    8    1   0   2/5    40.0     0/0   0.0
Rudy Rose              14    0    1    1   0   0/0     0.0     0/0   0.0
Bones Ginobili         14    0    0    1   0   0/0     0.0     0/0   0.0
Kyle McCollum          10    0    3    1   0   0/3     0.0     0/0   0.0
Lamelo Towns           10    0    4    2   0   0/1     0.0     0/0   0.0

TEAM: FG: 11/20 (55.0%), 3PT: 5/11 (45.5%), REB: 16 (3 off, 13 def), AST: 7, TO: 1
TEAM FOULS: 5 [Team_088 in BONUS]


Team_088
--------------------------------------------------------------------------------
Player                MIN  PTS  REB  AST  TO      FG   FG%      3P   3P%
--------------------------------------------------------------------------------
Klay Quickley          10    3    0    0   0   1/3    33.3     0/0   0.0
Giannis Smith          14    2    0    0   0   1/1   100.0     0/0   0.0
Zion Harris            10    2    2    0   0   1/2    50.0     0/0   0.0
Josh Embiid            10    2    5    0   0   1/4    25.0     0/0   0.0
Allen Ming             14    0    1    1   0   0/0     0.0     0/0   0.0
Tobias Haliburton      14    0    0    0   0   0/1     0.0     0/0   0.0
Vince Carter           10    0    0    1   0   0/3     0.0     0/0   0.0
Pau Bird               10    0    3    1   0   0/3     0.0     0/0   0.0

TEAM: FG: 4/17 (23.5%), 3PT: 1/6 (16.7%), REB: 11 (2 off, 9 def), AST: 3, TO: 4
TEAM FOULS: 3

================================================================================

================================================================================
                       3RD QUARTER - Team_086 vs Team_088                       
================================================================================

[12:00] Team_086 possession (Score: 49-28)
Lauri Johnson attempts a 3Pt. Contested by Josh Duncan (2.5 feet, MAN). LAURI JOHNSON MAKES IT! Assist: Anfernee Harris
Score: 52-28

[11:42] Team_088 possession (Score: 52-28)
Allen Ming drives and kicks out. Allen Ming attempts a Midrange. Wide open! Bones Ginobili is 8.9 feet away. [ZONE] Allen Ming misses. Rebound secured by Rudy Rose.

[11:25] Team_086 possession (Score: 52-28)
FOUL! Reach-in foul on Giannis Smith during the drive. [Team fouls: 1] No free throws, side out. (Giannis Smith: 1 personal fouls)

[11:11] Team_086 possession (Score: 52-28)
Bones Ginobili loses control! Ball rolls out of bounds! TURNOVER! (dead ball)

[10:53] Team_088 possession (Score: 52-28)
Allen Ming loses control! Ball rolls out of bounds! TURNOVER! (dead ball)

[10:40] Team_086 possession (Score: 52-28)
Rudy Rose makes the Layup and draws the foul on Giannis Smith! And-1! Rudy Rose to the line for 1. [Team fouls: 2] (Giannis Smith: 2 personal fouls)   FT 1/1: GOOD Rudy Rose makes 1/1 from the line.
Score: 55-28

[10:26] Team_088 possession (Score: 55-28)
Giannis Smith drives and kicks out. FOUL! Shooting foul on Lauri Johnson. Josh Duncan to the line for 2 free throws. [Team fouls: 1] (Lauri Johnson: 1 personal fouls)   FT 1/2: MISS   FT 2/2: GOOD Josh Duncan makes 1/2 from the line.
Score: 55-29

[10:15] Team_086 possession (Score: 55-29)
Miles Gobert attempts a Midrange. Wide open! Tobias Haliburton is 6.3 feet away. [ZONE] Miles Gobert misses. Offensive rebound by Miles Gobert! Miles Gobert kicks it out.

[10:04] Team_086 possession (Score: 55-29)
Bones Ginobili drives to the basket... FOUL! Offensive foul on Bones Ginobili! Giannis Smith drew the charge! [Team fouls: 2] (Bones Ginobili: 1 personal fouls) TURNOVER! (dead ball)

[09:54] Team_088 possession (Score: 55-29)
Josh Duncan makes the Dunk and draws the foul on Bones Ginobili! And-1! Josh Duncan to the line for 1. [Team fouls: 3] (Bones Ginobili: 2 personal fouls)   FT 1/1: MISS Josh Duncan makes 0/1 from the line. Rebound secured by Miles Gobert.
Score: 55-31

[09:41] Team_086 possession (Score: 55-31)
Miles Gobert drives, picks up Giannis Smith. Help arrives from Tobias Haliburton! Miles Gobert attempts a Layup. Heavily contested by Tobias Haliburton (1.5 feet, ZONE)! MILES GOBERT MAKES IT! Assist: Rudy Rose
Score: 57-31

[09:26] Team_088 possession (Score: 57-31)
Tyler Hyland attempts a 3Pt. Heavily contested by Miles Gobert (1.3 feet, MAN)! TYLER HYLAND MAKES IT! Assist: Allen Ming
Score: 57-34

[09:14] Team_086 possession (Score: 57-34)
Anfernee Harris drives, Tobias Haliburton stays with him. Anfernee Harris attempts a Layup. Contested by Tobias Haliburton (4.8 feet, MAN). ANFERNEE HARRIS MAKES IT! Assist: Rudy Rose
Score: 59-34

[08:57] Team_088 possession (Score: 59-34)
Allen Ming drives to the basket... Allen Ming commits a violation (traveling/carry)! TURNOVER! (dead ball)

[08:44] Team_086 possession (Score: 59-34)
Lauri Johnson drives and kicks out. Miles Gobert attempts a 3Pt. Contested by Tyler Hyland (4.7 feet, MAN). Miles Gobert misses. Rebound secured by Giannis Smith.

[08:31] Team_088 possession (Score: 59-34)
FOUL! Shooting foul on Bones Ginobili. Giannis Smith to the line for 2 free throws. [Team fouls: 4] (Bones Ginobili: 3 personal fouls)   FT 1/2: MISS   FT 2/2: GOOD Giannis Smith makes 1/2 from the line.
Score: 59-35

[08:21] Team_086 possession (Score: 59-35)
Bones Ginobili attempts a 3Pt. Contested by Giannis Smith (2.8 feet, MAN). Bones Ginobili misses. Rebound secured by Allen Ming.

[08:04] Team_088 possession (Score: 59-35)
Tyler Hyland makes the Layup and draws the foul on Rudy Rose! And-1! Tyler Hyland to the line for 1. [BONUS: 5 team fouls] (Rudy Rose: 1 personal fouls)   FT 1/1: GOOD Tyler Hyland makes 1/1 from the line.
Score: 59-38

[07:55] Team_086 possession (Score: 59-38)
Bones Ginobili makes the Layup and draws the foul on Giannis Smith! And-1! Bones Ginobili to the line for 1. [Team fouls: 3] (Giannis Smith: 3 personal fouls)   FT 1/1: GOOD Bones Ginobili makes 1/1 from the line.
Score: 62-38

[07:45] Team_088 possession (Score: 62-38)
Tobias Haliburton attempts a 3Pt. Wide open! Anfernee Harris is 6.4 feet away. [MAN] TOBIAS HALIBURTON MAKES IT! Assist: Giannis Smith
Score: 62-41

[07:34] Team_086 possession (Score: 62-41)
Anfernee Harris attempts a 3Pt. Contested by Tobias Haliburton (6.0 feet, MAN). ANFERNEE HARRIS MAKES IT! Assist: Rudy Rose
Score: 65-41

[07:17] Team_088 possession (Score: 65-41)
Tyler Hyland attempts a Layup. Contested by Miles Gobert (3.2 feet, MAN). TYLER HYLAND MAKES IT! Assist: Allen Ming
Score: 65-43

[07:03] Team_086 possession (Score: 65-43)
Miles Gobert drives to the basket... Miles Gobert throws a bad pass! Stolen by Tyler Hyland! TURNOVER! (live ball)

[06:49] Team_088 possession (Score: 65-43)
Tyler Hyland attempts a 3Pt. Contested by Miles Gobert (2.5 feet, MAN). Tyler Hyland misses. Rebound secured by Rudy Rose.

[06:33] Team_086 possession (Score: 65-43)
Miles Gobert attempts a Midrange. Heavily contested by Tyler Hyland (1.5 feet, MAN)! Miles Gobert misses. Offensive rebound by Miles Gobert! Miles Gobert kicks it out.

[06:19] Team_086 possession (Score: 65-43)
Rudy Rose attempts a Midrange. Heavily contested by Allen Ming (1.8 feet, MAN)! Rudy Rose misses. Rebound secured by Tyler Hyland.

[06:04] Team_088 possession (Score: 65-43)
Allen Ming attempts a Dunk. BLOCKED BY RUDY ROSE! Ball deflects out of bounds off Allen Ming.

[05:51] Team_086 possession (Score: 65-43)
Rudy Rose attempts a Midrange. Contested by Allen Ming (3.7 feet, MAN). Rudy Rose misses. Rebound secured by Tyler Hyland.

[05:39] Team_088 possession (Score: 65-43)
Allen Ming drives to the basket... Allen Ming commits a violation (traveling/carry)! TURNOVER! (dead ball)

[05:23] Team_086 possession (Score: 65-43)
Miles Gobert attempts a 3Pt. Contested by Tyler Hyland (4.4 feet, MAN). Miles Gobert misses. Rebound secured by Giannis Smith.

[05:11] Team_088 possession (Score: 65-43)
Giannis Smith attempts a 3Pt. Contested by Lauri Johnson (5.8 feet, ZONE). Giannis Smith misses. Rebound secured by Miles Gobert.

[04:56] Team_086 possession (Score: 65-43)
Rudy Rose attempts a 3Pt. Contested by Allen Ming (5.7 feet, MAN). Rudy Rose misses. Rebound secured by Giannis Smith.

[04:46] Team_088 possession (Score: 65-43)
Tyler Hyland attempts a 3Pt. Wide open! Lauri Johnson is 6.6 feet away. [ZONE] Tyler Hyland misses. Rebound secured by Bones Ginobili.

[04:28] Team_086 possession (Score: 65-43)
Miles Gobert drives and kicks out. Rudy Rose attempts a Midrange. Contested by Allen Ming (4.3 feet, MAN). Rudy Rose misses. Rebound secured by Allen Ming.

[04:14] Team_088 possession (Score: 65-43)
Allen Ming drives and kicks out. Allen Ming attempts a 3Pt. Heavily contested by Rudy Rose (0.5 feet, MAN)! Allen Ming misses. Rebound secured by Miles Gobert.

[03:56] Team_086 possession (Score: 65-43)
FOUL! Holding foul on Tobias Haliburton. [Team fouls: 4] No free throws, side out. (Tobias Haliburton: 1 personal fouls)

[03:42] Team_086 possession (Score: 65-43)
Anfernee Harris attempts a Midrange. Wide open! Giannis Smith is 7.2 feet away. [ZONE] ANFERNEE HARRIS MAKES IT! Assist: Miles Gobert
Score: 67-43

[03:28] Team_088 possession (Score: 67-43)
Tyler Hyland attempts a 3Pt. Contested by Lauri Johnson (4.5 feet, ZONE). Tyler Hyland misses. Offensive rebound by Giannis Smith! Giannis Smith puts it back in!
Score: 67-45

[03:17] Team_086 possession (Score: 67-45)
Lauri Johnson drives and kicks out. Anfernee Harris attempts a 3Pt. Contested by Tobias Haliburton (4.2 feet, ZONE). Anfernee Harris misses. Rebound secured by Giannis Smith.

[03:00] Team_088 possession (Score: 67-45)
FOUL! Holding foul on Bones Ginobili. [IN THE BONUS! 6 team fouls] Giannis Smith to the line for 2 free throws. (Bones Ginobili: 4 personal fouls)   FT 1/2: GOOD   FT 2/2: GOOD Giannis Smith makes 2/2 from the line.
Score: 67-47

[02:47] Team_086 possession (Score: 67-47)
Miles Gobert drives, Giannis Smith stays with him. Miles Gobert attempts a Dunk. Contested by Giannis Smith (2.8 feet, ZONE). MILES GOBERT MAKES IT!
Score: 69-47

[02:37] Team_088 possession (Score: 69-47)
Tobias Haliburton attempts a 3Pt. Contested by Lauri Johnson (5.0 feet, ZONE). Tobias Haliburton misses. Offensive rebound by Giannis Smith! Giannis Smith puts it back in!
Score: 69-49

[02:18] Team_086 possession (Score: 69-49)
Anfernee Harris drives to the basket... Anfernee Harris throws a bad pass! Stolen by Giannis Smith! TURNOVER! (live ball)

[02:02] Team_088 possession (Score: 69-49)
Allen Ming drives to the basket... FOUL! Offensive foul on Allen Ming! Bones Ginobili drew the charge! [Team fouls: 5] (Allen Ming: 1 personal fouls) TURNOVER! (dead ball)

[01:45] Team_086 possession (Score: 69-49)
Lauri Johnson attempts a 3Pt. Wide open! Josh Duncan is 7.0 feet away. [MAN] LAURI JOHNSON MAKES IT! Assist: Bones Ginobili
Score: 72-49

[01:33] Team_088 possession (Score: 72-49)
Allen Ming makes the Midrange and draws the foul on Miles Gobert! And-1! Allen Ming to the line for 1. [BONUS: 7 team fouls] (Miles Gobert: 1 personal fouls)   FT 1/1: GOOD Allen Ming makes 1/1 from the line.
Score: 72-52

[01:21] Team_086 possession (Score: 72-52)
Lauri Johnson attempts a 3Pt. Wide open! Tobias Haliburton is 6.6 feet away. [ZONE] Lauri Johnson misses. Rebound secured by Giannis Smith.

[01:04] Team_088 possession (Score: 72-52)
Tyler Hyland drives to the basket... Tyler Hyland commits a violation (traveling/carry)! TURNOVER! (dead ball)

[01:04] Substitution (Team_086): Lauri Johnson OUT → Anfernee Green IN (stamina_rule2)

[01:04] Substitution (Team_086): Anfernee Harris OUT → Anthony James IN (stamina_rule2)

[01:04] Substitution (Team_086): Miles Gobert OUT → Franz McGrady IN (stamina_rule2)

[01:04] Substitution (Team_086): Bones Ginobili OUT → Kyle McCollum IN (stamina_rule2)

[01:04] Substitution (Team_086): Rudy Rose OUT → Lamelo Towns IN (stamina_rule2)

[01:04] Substitution (Team_088): Josh Duncan OUT → Klay Quickley IN (stamina_rule2)

[01:04] Substitution (Team_088): Tobias Haliburton OUT → Vince Carter IN (stamina_rule2)

[01:04] Substitution (Team_088): Tyler Hyland OUT → Pau Bird IN (stamina_rule2)

[01:04] Substitution (Team_088): Giannis Smith OUT → Zion Harris IN (stamina_rule2)

[01:04] Substitution (Team_088): Allen Ming OUT → Josh Embiid IN (stamina_rule2)

[00:49] Team_086 possession (Score: 72-52)
Lamelo Towns drives and kicks out. Lamelo Towns attempts a 3Pt. Contested by Pau Bird (4.7 feet, ZONE). Lamelo Towns misses. Rebound secured by Josh Embiid.

[00:35] Team_088 possession (Score: 72-52)
Pau Bird attempts a Midrange. BLOCKED BY FRANZ MCGRADY! Ball is loose! Rebound secured by Anfernee Green.

[00:25] Team_086 possession (Score: 72-52)
Anfernee Green attempts a 3Pt. Wide open! Klay Quickley is 8.6 feet away. [MAN] ANFERNEE GREEN MAKES IT! Assist: Kyle McCollum
Score: 75-52

[00:14] Team_088 possession (Score: 75-52)
Zion Harris attempts a Midrange. Wide open! Kyle McCollum is 7.1 feet away. [MAN] Zion Harris misses. Rebound secured by Lamelo Towns.

[00:04] Team_086 possession (Score: 75-52)
Lamelo Towns attempts a Midrange. Wide open! Josh Embiid is 6.4 feet away. [ZONE] LAMELO TOWNS MAKES IT! Assist: Franz McGrady
Score: 77-52

================================================================================
                              3RD QUARTER COMPLETE                              
================================================================================

3RD QUARTER SCORE: Team_086 28, Team_088 24

BOX SCORE:
================================================================================

Team_086
--------------------------------------------------------------------------------
Player                MIN  PTS  REB  AST  TO      FG   FG%      3P   3P%
--------------------------------------------------------------------------------
Anfernee Harris        25    7    0    1   0   3/3   100.0     0/0   0.0
Lauri Johnson          25    6    0    0   0   2/5    40.0     0/0   0.0
Miles Gobert           25    4    5    1   0   2/4    50.0     0/0   0.0
Rudy Rose              25    3    2    3   0   1/4    25.0     0/0   0.0
Bones Ginobili         25    3    1    1   0   1/2    50.0     0/0   0.0
Anfernee Green         11    3    1    0   0   1/1   100.0     0/0   0.0
Lamelo Towns           11    2    1    0   0   1/2    50.0     0/0   0.0
Kyle McCollum          11    0    0    1   0   0/0     0.0     0/0   0.0
Franz McGrady          11    0    0    1   0   0/0     0.0     0/0   0.0

TEAM: FG: 11/21 (52.4%), 3PT: 4/8 (50.0%), REB: 10 (2 off, 8 def), AST: 8, TO: 4
TEAM FOULS: 7 [Team_088 in BONUS]


Team_088
--------------------------------------------------------------------------------
Player                MIN  PTS  REB  AST  TO      FG   FG%      3P   3P%
--------------------------------------------------------------------------------
Tyler Hyland           25    8    2    0   0   3/5    60.0     0/0   0.0
Giannis Smith          25    7    7    1   0   4/5    80.0     0/0   0.0
Allen Ming             25    3    2    2   0   1/4    25.0     0/0   0.0
Tobias Haliburton      25    3    0    0   0   1/1   100.0     0/0   0.0
Josh Duncan            25    1    0    0   0   1/2    50.0     0/0   0.0
Josh Embiid            11    0    1    0   0   0/0     0.0     0/0   0.0
Pau Bird               11    0    0    0   0   0/1     0.0     0/0   0.0
Zion Harris            11    0    0    0   0   0/1     0.0     0/0   0.0

TEAM: FG: 10/19 (52.6%), 3PT: 4/7 (57.1%), REB: 12 (2 off, 10 def), AST: 3, TO: 5
TEAM FOULS: 5 [Team_086 in BONUS]

================================================================================

================================================================================
                       4TH QUARTER - Team_086 vs Team_088                       
================================================================================

[12:00] Team_086 possession (Score: 77-52)
Anfernee Harris drives and kicks out. Anfernee Harris attempts a Midrange. Contested by Tyler Hyland (2.1 feet, ZONE). Anfernee Harris misses. Rebound secured by Tyler Hyland.

[11:47] Team_088 possession (Score: 77-52)
Allen Ming drives, picks up Rudy Rose. Help arrives from Anfernee Harris! Allen Ming attempts a Layup. Contested by Anfernee Harris (3.1 feet, ZONE). Allen Ming misses. Rebound secured by Miles Gobert.

[11:35] Team_086 possession (Score: 77-52)
Anfernee Harris attempts a Midrange. Wide open! Giannis Smith is 6.2 feet away. [ZONE] Anfernee Harris misses. Rebound secured by Tyler Hyland.

[11:23] Team_088 possession (Score: 77-52)
Allen Ming attempts a Midrange. Contested by Rudy Rose (3.2 feet, MAN). Allen Ming misses. Rebound secured by Miles Gobert.

[11:09] Team_086 possession (Score: 77-52)
Rudy Rose attempts a Midrange. Contested by Tobias Haliburton (5.3 feet, ZONE). RUDY ROSE MAKES IT!
Score: 79-52

[10:56] Team_088 possession (Score: 79-52)
FOUL! Offensive foul on Giannis Smith! Bones Ginobili drew the charge! [Team fouls: 1] (Giannis Smith: 1 personal fouls) TURNOVER! (dead ball)

[10:42] Team_086 possession (Score: 79-52)
Rudy Rose attempts a Midrange. Contested by Allen Ming (5.5 feet, MAN). Rudy Rose misses. Rebound secured by Giannis Smith.

[10:28] Team_088 possession (Score: 79-52)
FOUL! Shooting foul on Bones Ginobili. Giannis Smith to the line for 2 free throws. [Team fouls: 1] (Bones Ginobili: 1 personal fouls)   FT 1/2: MISS   FT 2/2: GOOD Giannis Smith makes 1/2 from the line.
Score: 79-53

[10:13] Team_086 possession (Score: 79-53)
Bones Ginobili drives, Giannis Smith stays with him. Bones Ginobili attempts a Layup. Wide open! Giannis Smith is 7.4 feet away. [MAN] Bones Ginobili misses. Rebound secured by Allen Ming.

[09:57] Team_088 possession (Score: 79-53)
Giannis Smith drives and kicks out. FOUL! Shooting foul on Bones Ginobili. Giannis Smith to the line for 3 free throws. [Team fouls: 2] (Bones Ginobili: 2 personal fouls)   FT 1/3: GOOD   FT 2/3: GOOD   FT 3/3: GOOD Giannis Smith makes 3/3 from the line.
Score: 79-56

[09:38] Team_086 possession (Score: 79-56)
Miles Gobert attempts a Midrange. Contested by Giannis Smith (3.1 feet, ZONE). MILES GOBERT MAKES IT! Assist: Anfernee Harris
Score: 81-56

[09:23] Team_088 possession (Score: 81-56)
Tyler Hyland makes the Layup and draws the foul on Anfernee Harris! And-1! Tyler Hyland to the line for 1. [Team fouls: 3] (Anfernee Harris: 1 personal fouls)   FT 1/1: GOOD Tyler Hyland makes 1/1 from the line.
Score: 81-59

[09:08] Team_086 possession (Score: 81-59)
Lauri Johnson attempts a 3Pt. Contested by Josh Duncan (3.4 feet, MAN). LAURI JOHNSON MAKES IT! Assist: Bones Ginobili
Score: 84-59

[08:49] Team_088 possession (Score: 84-59)
Tobias Haliburton attempts a 3Pt. Contested by Lauri Johnson (2.8 feet, ZONE). TOBIAS HALIBURTON MAKES IT! Assist: Allen Ming
Score: 84-62

[08:32] Team_086 possession (Score: 84-62)
Miles Gobert drives to the basket... Miles Gobert throws a bad pass! Stolen by Giannis Smith! TURNOVER! (live ball)

[08:15] Team_088 possession (Score: 84-62)
Tobias Haliburton attempts a 3Pt. Wide open! Lauri Johnson is 6.9 feet away. [ZONE] TOBIAS HALIBURTON MAKES IT! Assist: Tyler Hyland
Score: 84-65

[08:02] Team_086 possession (Score: 84-65)
Rudy Rose drives, picks up Giannis Smith. Help arrives from Tobias Haliburton! Rudy Rose attempts a Layup. Contested by Tobias Haliburton (5.3 feet, ZONE). Rudy Rose misses. Offensive rebound by Miles Gobert! Miles Gobert kicks it out.

[07:49] Team_086 possession (Score: 84-65)
Anfernee Harris drives and kicks out. Lauri Johnson attempts a Midrange. Wide open! Josh Duncan is 8.0 feet away. [MAN] Lauri Johnson misses. Rebound secured by Giannis Smith.

[07:33] Team_088 possession (Score: 84-65)
Tyler Hyland attempts a 3Pt. Contested by Miles Gobert (4.9 feet, MAN). Tyler Hyland misses. Offensive rebound by Giannis Smith! Giannis Smith kicks it out.

[07:14] Team_088 possession (Score: 84-65)
Allen Ming drives and kicks out. Allen Ming attempts a 3Pt. Wide open! Rudy Rose is 6.4 feet away. [MAN] Allen Ming misses. Offensive rebound by Allen Ming! Allen Ming kicks it out.

[07:01] Team_088 possession (Score: 84-65)
Tyler Hyland drives, Rudy Rose stays with him. Tyler Hyland attempts a Layup. Wide open! Rudy Rose is 6.6 feet away. [ZONE] TYLER HYLAND MAKES IT!
Score: 84-67

[06:46] Team_086 possession (Score: 84-67)
Bones Ginobili attempts a 3Pt. Wide open! Tobias Haliburton is 7.3 feet away. [ZONE] Bones Ginobili misses. Rebound secured by Allen Ming.

[06:30] Team_088 possession (Score: 84-67)
Allen Ming attempts a Layup. Contested by Rudy Rose (5.7 feet, ZONE). Allen Ming misses. Rebound secured by Miles Gobert.

[06:18] Team_086 possession (Score: 84-67)
Lauri Johnson attempts a Layup. Wide open! Josh Duncan is 7.0 feet away. [MAN] LAURI JOHNSON MAKES IT!
Score: 86-67

[06:07] Team_088 possession (Score: 86-67)
Tyler Hyland attempts a 3Pt. Contested by Lauri Johnson (4.9 feet, ZONE). Tyler Hyland misses. Offensive rebound by Giannis Smith! Giannis Smith kicks it out.

[05:55] Team_088 possession (Score: 86-67)
FOUL! Shooting foul on Miles Gobert. Tyler Hyland to the line for 2 free throws. [Team fouls: 4] (Miles Gobert: 1 personal fouls)   FT 1/2: GOOD   FT 2/2: GOOD Tyler Hyland makes 2/2 from the line.
Score: 86-69

[05:38] Team_086 possession (Score: 86-69)
FOUL! Offensive foul on Miles Gobert! Tyler Hyland drew the charge! [Team fouls: 5] (Miles Gobert: 2 personal fouls) TURNOVER! (dead ball)

[05:19] Team_088 possession (Score: 86-69)
Josh Duncan drives, Lauri Johnson stays with him. Josh Duncan attempts a Layup. Contested by Lauri Johnson (3.5 feet, MAN). JOSH DUNCAN MAKES IT!
Score: 86-71

[05:05] Team_086 possession (Score: 86-71)
Lauri Johnson throws a bad pass out of bounds! TURNOVER! (dead ball)

[05:05] Substitution (Team_086): Lauri Johnson OUT → Anfernee Green IN (stamina_rule2)

[05:05] Substitution (Team_086): Anfernee Harris OUT → Anthony James IN (stamina_rule2)

[05:05] Substitution (Team_086): Miles Gobert OUT → Franz McGrady IN (stamina_rule2)

[05:05] Substitution (Team_086): Bones Ginobili OUT → Kyle McCollum IN (stamina_rule2)

[05:05] Substitution (Team_086): Rudy Rose OUT → Lamelo Towns IN (stamina_rule2)

[05:05] Substitution (Team_088): Josh Duncan OUT → Klay Quickley IN (stamina_rule2)

[05:05] Substitution (Team_088): Tobias Haliburton OUT → Vince Carter IN (stamina_rule2)

[05:05] Substitution (Team_088): Tyler Hyland OUT → Pau Bird IN (stamina_rule2)

[05:05] Substitution (Team_088): Giannis Smith OUT → Zion Harris IN (stamina_rule2)

[05:05] Substitution (Team_088): Allen Ming OUT → Josh Embiid IN (stamina_rule2)

[04:50] Team_088 possession (Score: 86-71)
Klay Quickley attempts a 3Pt. Contested by Anfernee Green (2.1 feet, MAN). Klay Quickley misses. Rebound secured by Anfernee Green.

[04:34] Team_086 possession (Score: 86-71)
Kyle McCollum drives, Zion Harris stays with him. Kyle McCollum attempts a Dunk. Wide open! Zion Harris is 7.0 feet away. [MAN] Kyle McCollum misses. Rebound secured by Josh Embiid.

[04:22] Team_088 possession (Score: 86-71)
FOUL! Holding foul on Kyle McCollum. [IN THE BONUS! 6 team fouls] Zion Harris to the line for 2 free throws. (Kyle McCollum: 1 personal fouls)   FT 1/2: GOOD   FT 2/2: GOOD Zion Harris makes 2/2 from the line.
Score: 86-73

[04:08] Team_086 possession (Score: 86-73)
Lamelo Towns makes the Layup and draws the foul on Josh Embiid! And-1! Lamelo Towns to the line for 1. [Team fouls: 2] (Josh Embiid: 1 personal fouls)   FT 1/1: GOOD Lamelo Towns makes 1/1 from the line.
Score: 89-73

[03:52] Team_088 possession (Score: 89-73)
Klay Quickley attempts a 3Pt. Contested by Anfernee Green (3.7 feet, ZONE). Klay Quickley misses. FOUL! Loose ball foul on Anfernee Green during the rebound battle. [IN THE BONUS! 7 team fouls] Pau Bird to the line for 2 free throws. (Anfernee Green: 1 personal fouls)   FT 1/2: GOOD   FT 2/2: GOOD Pau Bird makes 2/2 from the line.
Score: 89-75

[03:36] Team_086 possession (Score: 89-75)
Lamelo Towns drives and kicks out. Anfernee Green attempts a 3Pt. Wide open! Klay Quickley is 10.0 feet away. [MAN] Anfernee Green misses. Rebound secured by Zion Harris.

[03:23] Team_088 possession (Score: 89-75)
Vince Carter drives, Lamelo Towns stays with him. Vince Carter attempts a Dunk. Wide open! Lamelo Towns is 8.0 feet away. [ZONE] VINCE CARTER MAKES IT!
Score: 89-77

[03:11] Team_086 possession (Score: 89-77)
Lamelo Towns attempts a Layup. Contested by Zion Harris (3.9 feet, ZONE). LAMELO TOWNS MAKES IT! Assist: Anfernee Green
Score: 91-77

[02:59] Team_088 possession (Score: 91-77)
FOUL! Offensive foul on Pau Bird! Franz McGrady drew the charge! [Team fouls: 3] (Pau Bird: 1 personal fouls) TURNOVER! (dead ball)

[02:45] Team_086 possession (Score: 91-77)
Kyle McCollum attempts a Layup. Wide open! Zion Harris is 7.7 feet away. [ZONE] Kyle McCollum misses. Rebound secured by Josh Embiid.

[02:33] Team_088 possession (Score: 91-77)
Klay Quickley loses the ball! Stripped by Anfernee Green! TURNOVER! (live ball)

[02:18] Team_086 possession (Score: 91-77)
Franz McGrady attempts a Midrange. Wide open! Vince Carter is 6.0 feet away. [ZONE] FRANZ MCGRADY MAKES IT!
Score: 93-77

[02:07] Team_088 possession (Score: 93-77)
Pau Bird attempts a 3Pt. Contested by Anfernee Green (3.7 feet, ZONE). Pau Bird misses. Rebound secured by Lamelo Towns.

[01:53] Team_086 possession (Score: 93-77)
Kyle McCollum drives to the basket... Kyle McCollum throws a bad pass out of bounds! TURNOVER! (dead ball)

[01:41] Team_088 possession (Score: 93-77)
Vince Carter attempts a Layup. Wide open! Lamelo Towns is 6.6 feet away. [ZONE] Vince Carter misses. Rebound secured by Anfernee Green.

[01:22] Team_086 possession (Score: 93-77)
FOUL! Shooting foul on Josh Embiid. Lamelo Towns to the line for 2 free throws. [Team fouls: 4] (Josh Embiid: 2 personal fouls)   FT 1/2: GOOD   FT 2/2: GOOD Lamelo Towns makes 2/2 from the line.
Score: 95-77

[01:06] Team_088 possession (Score: 95-77)
Josh Embiid attempts a 3Pt. Wide open! Lamelo Towns is 8.7 feet away. [MAN] JOSH EMBIID MAKES IT! Assist: Vince Carter
Score: 95-80

[00:53] Team_086 possession (Score: 95-80)
Franz McGrady drives and kicks out. Kyle McCollum attempts a 3Pt. Contested by Pau Bird (4.0 feet, ZONE). KYLE MCCOLLUM MAKES IT! Assist: Anfernee Green
Score: 98-80

[00:40] Team_088 possession (Score: 98-80)
Klay Quickley attempts a Layup. Contested by Lamelo Towns (5.5 feet, ZONE). Klay Quickley misses. Rebound secured by Anfernee Green.

[00:24] Team_086 possession (Score: 98-80)
Franz McGrady drives, picks up Zion Harris. Help arrives from Klay Quickley! Franz McGrady attempts a Layup. Contested by Klay Quickley (4.3 feet, ZONE). FRANZ MCGRADY MAKES IT!
Score: 100-80

[00:09] Team_088 possession (Score: 100-80)
FOUL! Offensive foul on Vince Carter! Anthony James drew the charge! [Team fouls: 5] (Vince Carter: 1 personal fouls) TURNOVER! (dead ball)

================================================================================
                              4TH QUARTER COMPLETE                              
================================================================================

4TH QUARTER SCORE: Team_086 23, Team_088 28

BOX SCORE:
================================================================================

Team_086
--------------------------------------------------------------------------------
Player                MIN  PTS  REB  AST  TO      FG   FG%      3P   3P%
--------------------------------------------------------------------------------
Lamelo Towns           16    7    1    0   0   3/4    75.0     0/0   0.0
Lauri Johnson          32    5    0    0   0   2/2   100.0     0/0   0.0
Franz McGrady          16    4    0    0   0   2/2   100.0     0/0   0.0
Kyle McCollum          16    3    0    0   0   1/3    33.3     0/0   0.0
Miles Gobert           32    2    4    0   0   1/1   100.0     0/0   0.0
Rudy Rose              32    2    0    0   0   1/2    50.0     0/0   0.0
Anfernee Harris        32    0    0    1   0   0/3     0.0     0/0   0.0
Bones Ginobili         32    0    0    1   0   0/2     0.0     0/0   0.0
Anfernee Green         16    0    3    2   0   0/0     0.0     0/0   0.0

TEAM: FG: 10/19 (52.6%), 3PT: 1/2 (50.0%), REB: 8 (1 off, 7 def), AST: 4, TO: 4
TEAM FOULS: 7 [Team_088 in BONUS]


Team_088
--------------------------------------------------------------------------------
Player                MIN  PTS  REB  AST  TO      FG   FG%      3P   3P%
--------------------------------------------------------------------------------
Tyler Hyland           32    7    2    1   0   3/3   100.0     0/0   0.0
Tobias Haliburton      32    6    0    0   0   2/2   100.0     0/0   0.0
Giannis Smith          32    4    4    0   0   2/2   100.0     0/0   0.0
Josh Embiid            16    3    2    0   0   1/1   100.0     0/0   0.0
Josh Duncan            32    2    0    0   0   1/1   100.0     0/0   0.0
Zion Harris            16    2    1    0   0   1/1   100.0     0/0   0.0
Pau Bird               16    2    0    0   0   1/2    50.0     0/0   0.0
Vince Carter           16    2    0    1   0   1/2    50.0     0/0   0.0
Allen Ming             32    0    3    1   0   0/3     0.0     0/0   0.0
Klay Quickley          16    0    0    0   0   0/2     0.0     0/0   0.0

TEAM: FG: 12/19 (63.2%), 3PT: 4/6 (66.7%), REB: 12 (3 off, 9 def), AST: 3, TO: 4
TEAM FOULS: 5 [Team_086 in BONUS]

================================================================================

================================================================================
                               FULL GAME COMPLETE                               
================================================================================

FINAL SCORE: Team_086 100, Team_088 80

SCORING BY QUARTER:
--------------------------------------------------------------------------------
Team                     Q1     Q2     Q3     Q4    FINAL
--------------------------------------------------------------------------------
Team_086                 21     28     28     23      100
Team_088                 17     11     24     28       80
--------------------------------------------------------------------------------

FULL GAME BOX SCORE:
================================================================================

Team_086
--------------------------------------------------------------------------------
Player                MIN  PTS  REB  AST  TO      FG   FG%      3P   3P%      FT STL BLK
--------------------------------------------------------------------------------
Lauri Johnson          32   22    0    1   2   8/11   72.7   5/6    83.3   1/1     0   0
Anfernee Harris        32    7    0    3   1   4/10   40.0   1/2    50.0   1/2     1   1
Miles Gobert           32    9   15    2   3   3/8    37.5   0/3     0.0   0/0     1   0
Bones Ginobili         32   10    5    3   1   4/10   40.0   1/3    33.3   1/1     1   0
Rudy Rose              32   13    5    5   2   5/13   38.5   0/2     0.0   4/4     0   1
Anfernee Green         16    8   12    3   1   3/6    50.0   2/4    50.0   0/0     1   1
Anthony James          16    7    0    1   1   3/4    75.0   1/2    50.0   0/0     0   0
Franz McGrady          16   11    0    1   0   6/7    85.7   1/2    50.0   0/0     0   1
Kyle McCollum          16    3    3    2   0   0/5     0.0   0/2     0.0   0/0     0   0
Lamelo Towns           16    9    6    2   0   4/7    57.1   0/0     0.0   3/3     0   1

TEAM: FG: 40/81 (49.4%), 3PT: 11/26 (42.3%), REB: 46 (8 off, 38 def), AST: 23, TO: 11


Team_088
--------------------------------------------------------------------------------
Player                MIN  PTS  REB  AST  TO      FG   FG%      3P   3P%      FT STL BLK
--------------------------------------------------------------------------------
Josh Duncan            32    6    0    1   3   2/5    40.0   1/2    50.0   1/3     0   0
Tobias Haliburton      32   15    0    1   3   8/13   61.5   4/4   100.0   0/1     0   0
Tyler Hyland           32   17    8    2   3   8/14   57.1   2/6    33.3   4/4     1   1
Giannis Smith          32   19   19    1   1   7/8    87.5   0/1     0.0   9/11    2   0
Allen Ming             32    3    8    5   1   1/7    14.3   0/0     0.0   1/1     1   0
Klay Quickley          16    3    0    0   1   2/6    33.3   2/4    50.0   0/0     0   0
Vince Carter           16    2    0    2   2   1/5    20.0   0/2     0.0   0/0     0   0
Pau Bird               16    2    3    1   2   0/5     0.0   0/3     0.0   2/2     0   0
Zion Harris            16    4    3    0   1   1/3    33.3   0/0     0.0   2/2     0   0
Josh Embiid            16    5    8    0   0   2/5    40.0   1/1   100.0   2/2     0   0

TEAM: FG: 34/73 (46.6%), 3PT: 10/23 (43.5%), REB: 49 (8 off, 41 def), AST: 13, TO: 17

================================================================================
