================================================================================
                        FULL GAME - Team_025 vs Team_100                        
================================================================================

================================================================================
                       1ST QUARTER - Team_025 vs Team_100                       
================================================================================

[12:00] Team_025 possession (Score: 0-0)
Allen Embiid attempts a Midrange. Contested by Chris Mobley (5.8 feet, MAN). Allen Embiid misses. Rebound secured by Pau LaVine.

[11:47] Team_100 possession (Score: 0-0)
FOUL! Shooting foul on Allen Embiid. Chris Mobley to the line for 2 free throws. [Team fouls: 1] (Allen Embiid: 1 personal fouls)   FT 1/2: GOOD   FT 2/2: GOOD Chris Mobley makes 2/2 from the line.
Score: 0-2

[11:33] Team_025 possession (Score: 0-2)
Ben Giddey attempts a 3Pt. Wide open! Manu Ball is 9.3 feet away. [MAN] Ben Giddey misses. Offensive rebound by Allen Embiid! Allen Embiid's putback is no good. Rebound secured by Chris Mobley.

[11:15] Team_100 possession (Score: 0-2)
Pau LaVine drives, picks up Allen Embiid. Help arrives from Ben Giddey! Pau LaVine attempts a Dunk. Heavily contested by Ben Giddey (1.4 feet, ZONE)! PAU LAVINE MAKES IT!
Score: 0-4

[11:01] Team_025 possession (Score: 0-4)
Paolo Lowry makes the Layup and draws the foul on Luka Green! And-1! Paolo Lowry to the line for 1. [Team fouls: 1] (Luka Green: 1 personal fouls)   FT 1/1: GOOD Paolo Lowry makes 1/1 from the line.
Score: 3-4

[10:47] Team_100 possession (Score: 3-4)
Manu Ball attempts a 3Pt. Contested by Ben Giddey (4.2 feet, MAN). Manu Ball misses. Rebound secured by Cade Anthony.

[10:30] Team_025 possession (Score: 3-4)
Desmond Jordan attempts a Midrange. Wide open! Pau LaVine is 8.2 feet away. [ZONE] Desmond Jordan misses. Rebound secured by Pau LaVine.

[10:12] Team_100 possession (Score: 3-4)
Chris Mobley attempts a Midrange. Contested by Desmond Jordan (5.7 feet, ZONE). Chris Mobley misses. Rebound secured by Desmond Jordan.

[09:57] Team_025 possession (Score: 3-4)
Desmond Jordan drives to the basket... Desmond Jordan loses the ball! Stripped by Pau LaVine! TURNOVER! (live ball)

[09:43] Team_100 possession (Score: 3-4)
Pau LaVine attempts a Midrange. Contested by Ben Giddey (5.0 feet, ZONE). Pau LaVine misses. Rebound secured by Cade Anthony.

[09:28] Team_025 possession (Score: 3-4)
FOUL! Shooting foul on Pau LaVine. Ben Giddey to the line for 2 free throws. [Team fouls: 2] (Pau LaVine: 1 personal fouls)   FT 1/2: GOOD   FT 2/2: GOOD Ben Giddey makes 2/2 from the line.
Score: 5-4

[09:12] Team_100 possession (Score: 5-4)
FOUL! Shooting foul on Desmond Jordan. Luka Green to the line for 2 free throws. [Team fouls: 2] (Desmond Jordan: 1 personal fouls)   FT 1/2: GOOD   FT 2/2: GOOD Luka Green makes 2/2 from the line.
Score: 5-6

[08:58] Team_025 possession (Score: 5-6)
Paolo Lowry attempts a 3Pt. Contested by Luka Green (3.4 feet, MAN). Paolo Lowry misses. Rebound secured by Pau LaVine.

[08:43] Team_100 possession (Score: 5-6)
Tyler Griffin attempts a Midrange. BLOCKED BY DESMOND JORDAN! Ball is loose! Offensive rebound by Pau LaVine! Pau LaVine kicks it out.

[08:26] Team_100 possession (Score: 5-6)
Manu Ball attempts a Layup. Contested by Ben Giddey (5.7 feet, MAN). Manu Ball misses. Offensive rebound by Pau LaVine! Pau LaVine kicks it out.

[08:11] Team_100 possession (Score: 5-6)
Luka Green attempts a 3Pt. Wide open! Ben Giddey is 7.0 feet away. [ZONE] Luka Green misses. Rebound secured by Cade Anthony.

[07:55] Team_025 possession (Score: 5-6)
Allen Embiid attempts a 3Pt. Contested by Luka Green (2.6 feet, ZONE). Allen Embiid misses. Rebound secured by Pau LaVine.

[07:40] Team_100 possession (Score: 5-6)
Tyler Griffin loses the ball! Stripped by Desmond Jordan! TURNOVER! (live ball)

[07:23] Team_025 possession (Score: 5-6)
Allen Embiid attempts a Midrange. BLOCKED BY CHRIS MOBLEY! Ball deflects out of bounds off Allen Embiid.

[07:05] Team_100 possession (Score: 5-6)
Manu Ball drives, Allen Embiid stays with him. Manu Ball attempts a Dunk. Contested by Allen Embiid (3.4 feet, ZONE). Manu Ball misses. Rebound secured by Allen Embiid.

[06:53] Team_025 possession (Score: 5-6)
Ben Giddey attempts a Midrange. Wide open! Tyler Griffin is 6.1 feet away. [ZONE] Ben Giddey misses. Offensive rebound by Desmond Jordan! Desmond Jordan's putback is no good. Offensive rebound by Allen Embiid! Allen Embiid kicks it out.

[06:38] Team_025 possession (Score: 5-6)
Allen Embiid attempts a Midrange. Contested by Pau LaVine (3.6 feet, ZONE). Allen Embiid misses. Rebound secured by Tyler Griffin.

[06:23] Team_100 possession (Score: 5-6)
Manu Ball attempts a Midrange. Heavily contested by Ben Giddey (0.5 feet, MAN)! Manu Ball misses. Rebound secured by Cade Anthony.

[06:08] Team_025 possession (Score: 5-6)
Paolo Lowry attempts a Layup. Wide open! Luka Green is 6.2 feet away. [MAN] Paolo Lowry misses. Rebound secured by Chris Mobley.

[05:54] Team_100 possession (Score: 5-6)
Pau LaVine attempts a Layup. BLOCKED BY ALLEN EMBIID! Ball deflects out of bounds off Pau LaVine.

[05:40] Team_025 possession (Score: 5-6)
Cade Anthony loses control! Ball rolls out of bounds! TURNOVER! (dead ball)

[05:28] Team_100 possession (Score: 5-6)
Tyler Griffin attempts a Layup. BLOCKED BY BEN GIDDEY! Ball deflects out of bounds off Tyler Griffin.

[05:16] Team_025 possession (Score: 5-6)
Desmond Jordan attempts a Midrange. Contested by Tyler Griffin (4.6 feet, MAN). DESMOND JORDAN MAKES IT!
Score: 7-6

[05:04] Team_100 possession (Score: 7-6)
Manu Ball attempts a 3Pt. Contested by Ben Giddey (5.4 feet, ZONE). Manu Ball misses. Rebound secured by Cade Anthony.

[04:51] Team_025 possession (Score: 7-6)
Cade Anthony attempts a 3Pt. Wide open! Pau LaVine is 8.6 feet away. [MAN] Cade Anthony misses. Rebound secured by Tyler Griffin.

[04:36] Team_100 possession (Score: 7-6)
Tyler Griffin attempts a Midrange. Contested by Desmond Jordan (2.7 feet, MAN). TYLER GRIFFIN MAKES IT! Assist: Luka Green
Score: 7-8

[04:27] Team_025 possession (Score: 7-8)
Allen Embiid throws a bad pass out of bounds! TURNOVER! (dead ball)

[04:09] Team_100 possession (Score: 7-8)
Chris Mobley drives to the basket... Chris Mobley loses control! Ball rolls out of bounds! TURNOVER! (dead ball)

[03:55] Team_025 possession (Score: 7-8)
Desmond Jordan drives, Tyler Griffin stays with him. Desmond Jordan attempts a Layup. Contested by Tyler Griffin (3.4 feet, MAN). DESMOND JORDAN MAKES IT! Assist: Paolo Lowry
Score: 9-8

[03:37] Team_100 possession (Score: 9-8)
Chris Mobley drives, Allen Embiid stays with him. Chris Mobley attempts a Layup. Contested by Allen Embiid (3.0 feet, ZONE). Chris Mobley misses. Rebound secured by Cade Anthony.

[03:20] Team_025 possession (Score: 9-8)
Cade Anthony attempts a 3Pt. Contested by Pau LaVine (2.4 feet, ZONE). Cade Anthony misses. FOUL! Loose ball foul on Tyler Griffin during the rebound battle. [Team fouls: 3] No free throws, side out. (Tyler Griffin: 1 personal fouls)

[03:10] Team_025 possession (Score: 9-8)
Desmond Jordan makes the Layup and draws the foul on Tyler Griffin! And-1! Desmond Jordan to the line for 1. [Team fouls: 4] (Tyler Griffin: 2 personal fouls)   FT 1/1: GOOD Desmond Jordan makes 1/1 from the line.
Score: 12-8

[03:00] Team_100 possession (Score: 12-8)
Luka Green throws a bad pass out of bounds! TURNOVER! (dead ball)

[03:00] Substitution (Team_100): Chris Mobley OUT → John Rozier IN (stamina_rule2)

[02:49] Team_025 possession (Score: 12-8)
Desmond Jordan drives to the basket... Desmond Jordan throws a bad pass! Stolen by John Rozier! TURNOVER! (live ball)

[02:30] Team_100 possession (Score: 12-8)
Manu Ball attempts a 3Pt. Contested by Ben Giddey (5.4 feet, MAN). Manu Ball misses. Rebound secured by Cade Anthony.

[02:11] Team_025 possession (Score: 12-8)
Paolo Lowry attempts a 3Pt. Contested by Luka Green (5.3 feet, MAN). PAOLO LOWRY MAKES IT! Assist: Ben Giddey
Score: 15-8

[02:00] Team_100 possession (Score: 15-8)
Manu Ball attempts a 3Pt. Wide open! Ben Giddey is 6.9 feet away. [ZONE] Manu Ball misses. Rebound secured by Cade Anthony.

[01:45] Team_025 possession (Score: 15-8)
Ben Giddey drives, John Rozier stays with him. Ben Giddey attempts a Dunk. Contested by John Rozier (4.3 feet, ZONE). BEN GIDDEY MAKES IT!
Score: 17-8

[01:34] Team_100 possession (Score: 17-8)
Luka Green throws a bad pass out of bounds! TURNOVER! (dead ball)

[01:34] Substitution (Team_025): Paolo Lowry OUT → LeBron Griffin IN (stamina_rule2)

[01:34] Substitution (Team_025): Ben Giddey OUT → Dirk Gilgeous-Alexander IN (stamina_rule2)

[01:34] Substitution (Team_025): Desmond Jordan OUT → Immanuel LaVine IN (stamina_rule2)

[01:34] Substitution (Team_025): Cade Anthony OUT → Damian Adebayo IN (stamina_rule2)

[01:34] Substitution (Team_025): Allen Embiid OUT → Nikola Lillard IN (stamina_rule2)

[01:34] Substitution (Team_100): Luka Green OUT → Dirk Sabonis IN (stamina_rule2)

[01:34] Substitution (Team_100): Manu Ball OUT → Evan Butler IN (stamina_rule2)

[01:34] Substitution (Team_100): Tyler Griffin OUT → Tyrese Wade IN (stamina_rule2)

[01:34] Substitution (Team_100): Pau LaVine OUT → Carmelo Ginobili IN (stamina_rule2)

[01:19] Team_025 possession (Score: 17-8)
Damian Adebayo drives, picks up John Rozier. Help arrives from Evan Butler! Damian Adebayo attempts a Layup. Contested by Evan Butler (5.5 feet, ZONE). DAMIAN ADEBAYO MAKES IT! Assist: Dirk Gilgeous-Alexander
Score: 19-8

[01:01] Team_100 possession (Score: 19-8)
Tyrese Wade attempts a 3Pt. Contested by Immanuel LaVine (4.0 feet, MAN). TYRESE WADE MAKES IT! Assist: John Rozier
Score: 19-11

[00:44] Team_025 possession (Score: 19-11)
Nikola Lillard drives, John Rozier stays with him. Nikola Lillard attempts a Layup. Contested by John Rozier (2.2 feet, ZONE). NIKOLA LILLARD MAKES IT! Assist: LeBron Griffin
Score: 21-11

[00:26] Team_100 possession (Score: 21-11)
Dirk Sabonis loses the ball! Stripped by LeBron Griffin! TURNOVER! (live ball)

[00:15] Team_025 possession (Score: 21-11)
Immanuel LaVine throws a bad pass out of bounds! TURNOVER! (dead ball)

================================================================================
                              1ST QUARTER COMPLETE                              
================================================================================

1ST QUARTER SCORE: Team_025 21, Team_100 11

BOX SCORE:
================================================================================

Team_025
--------------------------------------------------------------------------------
Player                MIN  PTS  REB  AST  TO      FG   FG%      3P   3P%
--------------------------------------------------------------------------------
Desmond Jordan         11    7    2    0   0   3/4    75.0     0/0   0.0
Paolo Lowry            11    6    0    1   0   2/4    50.0     0/0   0.0
Ben Giddey             11    4    0    1   0   2/3    66.7     0/0   0.0
Damian Adebayo          1    2    0    0   0   1/1   100.0     0/0   0.0
Nikola Lillard          1    2    0    0   0   1/1   100.0     0/0   0.0
Allen Embiid           11    0    2    0   0   0/4     0.0     0/0   0.0
Cade Anthony           11    0    8    0   0   0/1     0.0     0/0   0.0
Dirk Gilgeous-Alexander    1    0    0    1   0   0/0     0.0     0/0   0.0
LeBron Griffin          1    0    0    1   0   0/0     0.0     0/0   0.0

TEAM: FG: 9/18 (50.0%), 3PT: 1/5 (20.0%), REB: 13 (3 off, 10 def), AST: 4, TO: 5
TEAM FOULS: 2


Team_100
--------------------------------------------------------------------------------
Player                MIN  PTS  REB  AST  TO      FG   FG%      3P   3P%
--------------------------------------------------------------------------------
Tyrese Wade             1    3    0    0   0   1/1   100.0     0/0   0.0
Pau LaVine             11    2    6    0   0   1/3    33.3     0/0   0.0
Chris Mobley            9    2    2    0   0   1/3    33.3     0/0   0.0
Luka Green             11    2    0    1   0   1/2    50.0     0/0   0.0
Tyler Griffin          11    2    2    0   0   1/2    50.0     0/0   0.0
Manu Ball              11    0    0    0   0   0/6     0.0     0/0   0.0
John Rozier             3    0    0    1   0   0/0     0.0     0/0   0.0

TEAM: FG: 5/17 (29.4%), 3PT: 1/6 (16.7%), REB: 9 (2 off, 7 def), AST: 2, TO: 5
TEAM FOULS: 4

================================================================================

================================================================================
                       2ND QUARTER - Team_025 vs Team_100                       
================================================================================

[12:00] Team_025 possession (Score: 21-11)
Cade Anthony attempts a 3Pt. Contested by Tyler Griffin (3.5 feet, ZONE). Cade Anthony misses. Rebound secured by Chris Mobley.

[11:46] Team_100 possession (Score: 21-11)
Pau LaVine attempts a Layup. Contested by Cade Anthony (4.2 feet, MAN). PAU LAVINE MAKES IT! Assist: Manu Ball
Score: 21-13

[11:32] Team_025 possession (Score: 21-13)
Cade Anthony drives, Chris Mobley stays with him. Cade Anthony attempts a Dunk. Wide open! Chris Mobley is 7.2 feet away. [ZONE] CADE ANTHONY MAKES IT! Assist: Ben Giddey
Score: 23-13

[11:17] Team_100 possession (Score: 23-13)
Luka Green attempts a 3Pt. Wide open! Paolo Lowry is 6.6 feet away. [MAN] Luka Green misses. Rebound secured by Desmond Jordan.

[10:59] Team_025 possession (Score: 23-13)
Allen Embiid makes the Layup and draws the foul on Chris Mobley! And-1! Allen Embiid to the line for 1. [Team fouls: 1] (Chris Mobley: 1 personal fouls)   FT 1/1: GOOD Allen Embiid makes 1/1 from the line.
Score: 26-13

[10:48] Team_100 possession (Score: 26-13)
Tyler Griffin attempts a 3Pt. Wide open! Desmond Jordan is 8.7 feet away. [MAN] TYLER GRIFFIN MAKES IT! Assist: Chris Mobley
Score: 26-16

[10:34] Team_025 possession (Score: 26-16)
Ben Giddey attempts a 3Pt. Contested by Manu Ball (5.0 feet, MAN). Ben Giddey misses. Rebound secured by Chris Mobley.

[10:18] Team_100 possession (Score: 26-16)
Chris Mobley attempts a Layup. Contested by Allen Embiid (5.6 feet, ZONE). Chris Mobley misses. FOUL! Loose ball foul on Desmond Jordan during the rebound battle. [Team fouls: 1] No free throws, side out. (Desmond Jordan: 1 personal fouls)

[10:06] Team_100 possession (Score: 26-16)
Luka Green attempts a 3Pt. Heavily contested by Ben Giddey (1.4 feet, ZONE)! Luka Green misses. Rebound secured by Allen Embiid.

[09:50] Team_025 possession (Score: 26-16)
Desmond Jordan drives and kicks out. Cade Anthony attempts a 3Pt. Contested by Pau LaVine (4.1 feet, MAN). CADE ANTHONY MAKES IT! Assist: Paolo Lowry
Score: 29-16

[09:36] Team_100 possession (Score: 29-16)
Pau LaVine attempts a Midrange. Wide open! Ben Giddey is 6.9 feet away. [ZONE] PAU LAVINE MAKES IT!
Score: 29-18

[09:18] Team_025 possession (Score: 29-18)
Paolo Lowry drives, Luka Green stays with him. Paolo Lowry attempts a Dunk. Wide open! Luka Green is 8.1 feet away. [MAN] PAOLO LOWRY MAKES IT! Assist: Ben Giddey
Score: 31-18

[09:03] Team_100 possession (Score: 31-18)
Pau LaVine drives to the basket... Pau LaVine loses control! Ball rolls out of bounds! TURNOVER! (dead ball)

[09:03] Substitution (Team_025): Paolo Lowry OUT → LeBron Griffin IN (stamina_rule2)

[09:03] Substitution (Team_025): Ben Giddey OUT → Dirk Gilgeous-Alexander IN (stamina_rule2)

[09:03] Substitution (Team_025): Desmond Jordan OUT → Immanuel LaVine IN (stamina_rule2)

[09:03] Substitution (Team_025): Cade Anthony OUT → Damian Adebayo IN (stamina_rule2)

[09:03] Substitution (Team_025): Allen Embiid OUT → Nikola Lillard IN (stamina_rule2)

[09:03] Substitution (Team_100): Luka Green OUT → Dirk Sabonis IN (stamina_rule2)

[09:03] Substitution (Team_100): Manu Ball OUT → Evan Butler IN (stamina_rule2)

[09:03] Substitution (Team_100): Tyler Griffin OUT → Tyrese Wade IN (stamina_rule2)

[09:03] Substitution (Team_100): Pau LaVine OUT → Carmelo Ginobili IN (stamina_rule2)

[09:03] Substitution (Team_100): Chris Mobley OUT → John Rozier IN (stamina_rule2)

[08:47] Team_025 possession (Score: 31-18)
Nikola Lillard makes the Layup and draws the foul on John Rozier! And-1! Nikola Lillard to the line for 1. [Team fouls: 2] (John Rozier: 1 personal fouls)   FT 1/1: GOOD Nikola Lillard makes 1/1 from the line.
Score: 34-18

[08:32] Team_100 possession (Score: 34-18)
Evan Butler makes the Midrange and draws the foul on Dirk Gilgeous-Alexander! And-1! Evan Butler to the line for 1. [Team fouls: 2] (Dirk Gilgeous-Alexander: 1 personal fouls)   FT 1/1: GOOD Evan Butler makes 1/1 from the line.
Score: 34-21

[08:16] Team_025 possession (Score: 34-21)
Nikola Lillard attempts a Layup. BLOCKED BY JOHN ROZIER! Ball is loose! Rebound secured by John Rozier.

[08:04] Team_100 possession (Score: 34-21)
Tyrese Wade makes the Layup and draws the foul on Immanuel LaVine! And-1! Tyrese Wade to the line for 1. [Team fouls: 3] (Immanuel LaVine: 1 personal fouls)   FT 1/1: GOOD Tyrese Wade makes 1/1 from the line.
Score: 34-24

[07:49] Team_025 possession (Score: 34-24)
Damian Adebayo attempts a 3Pt. Contested by Tyrese Wade (2.0 feet, ZONE). DAMIAN ADEBAYO MAKES IT! Assist: Nikola Lillard
Score: 37-24

[07:36] Team_100 possession (Score: 37-24)
Evan Butler attempts a Midrange. Contested by Dirk Gilgeous-Alexander (3.2 feet, MAN). Evan Butler misses. Rebound secured by Immanuel LaVine.

[07:25] Team_025 possession (Score: 37-24)
LeBron Griffin attempts a 3Pt. Contested by Tyrese Wade (2.7 feet, ZONE). LEBRON GRIFFIN MAKES IT! Assist: Immanuel LaVine
Score: 40-24

[07:09] Team_100 possession (Score: 40-24)
Tyrese Wade attempts a Midrange. Wide open! Immanuel LaVine is 6.2 feet away. [MAN] TYRESE WADE MAKES IT! Assist: Evan Butler
Score: 40-26

[06:54] Team_025 possession (Score: 40-26)
Nikola Lillard drives, John Rozier stays with him. Nikola Lillard attempts a Layup. Wide open! John Rozier is 7.4 feet away. [MAN] Nikola Lillard misses. Offensive rebound by Nikola Lillard! Nikola Lillard kicks it out.

[06:38] Team_025 possession (Score: 40-26)
LeBron Griffin drives and kicks out. LeBron Griffin attempts a 3Pt. Contested by Dirk Sabonis (4.7 feet, MAN). LEBRON GRIFFIN MAKES IT! Assist: Nikola Lillard
Score: 43-26

[06:23] Team_100 possession (Score: 43-26)
Evan Butler attempts a Midrange. Contested by Damian Adebayo (4.0 feet, ZONE). Evan Butler misses. Rebound secured by Dirk Gilgeous-Alexander.

[06:09] Team_025 possession (Score: 43-26)
Damian Adebayo attempts a 3Pt. Wide open! Tyrese Wade is 7.9 feet away. [ZONE] Damian Adebayo misses. Rebound secured by John Rozier.

[05:53] Team_100 possession (Score: 43-26)
Carmelo Ginobili drives, Nikola Lillard stays with him. Carmelo Ginobili attempts a Dunk. Contested by Nikola Lillard (5.7 feet, ZONE). Carmelo Ginobili misses. Rebound secured by Dirk Gilgeous-Alexander.

[05:38] Team_025 possession (Score: 43-26)
Immanuel LaVine drives and kicks out. LeBron Griffin attempts a 3Pt. Contested by Tyrese Wade (2.7 feet, ZONE). LeBron Griffin misses. Rebound secured by John Rozier.

[05:23] Team_100 possession (Score: 43-26)
FOUL! Holding foul on Nikola Lillard. [Team fouls: 4] No free throws, side out. (Nikola Lillard: 1 personal fouls)

[05:12] Team_100 possession (Score: 43-26)
John Rozier attempts a 3Pt. Contested by LeBron Griffin (3.5 feet, ZONE). John Rozier misses. Rebound secured by Dirk Gilgeous-Alexander.

[04:56] Team_025 possession (Score: 43-26)
Immanuel LaVine drives to the basket... FOUL! Offensive foul on Immanuel LaVine! John Rozier drew the charge! [Team fouls: 5] (Immanuel LaVine: 2 personal fouls) TURNOVER! (dead ball)

[04:42] Team_100 possession (Score: 43-26)
John Rozier drives to the basket... John Rozier throws a bad pass! Stolen by Nikola Lillard! TURNOVER! (live ball)

[04:31] Team_025 possession (Score: 43-26)
Damian Adebayo loses control! Ball rolls out of bounds! TURNOVER! (dead ball)

[04:18] Team_100 possession (Score: 43-26)
FOUL! Holding foul on Immanuel LaVine. [IN THE BONUS! 6 team fouls] Tyrese Wade to the line for 2 free throws. (Immanuel LaVine: 3 personal fouls)   FT 1/2: GOOD   FT 2/2: MISS Tyrese Wade makes 1/2 from the line. Rebound secured by Nikola Lillard.
Score: 43-27

[04:06] Team_025 possession (Score: 43-27)
Nikola Lillard drives, John Rozier stays with him. Nikola Lillard attempts a Dunk. Contested by John Rozier (3.6 feet, ZONE). NIKOLA LILLARD MAKES IT! Assist: Dirk Gilgeous-Alexander
Score: 45-27

[03:56] Team_100 possession (Score: 45-27)
Tyrese Wade attempts a Midrange. Contested by Immanuel LaVine (4.0 feet, MAN). Tyrese Wade misses. Rebound secured by Nikola Lillard.

[03:43] Team_025 possession (Score: 45-27)
FOUL! Shooting foul on John Rozier. Nikola Lillard to the line for 2 free throws. [Team fouls: 3] (John Rozier: 2 personal fouls)   FT 1/2: MISS   FT 2/2: GOOD Nikola Lillard makes 1/2 from the line.
Score: 46-27

[03:32] Team_100 possession (Score: 46-27)
Carmelo Ginobili makes the Layup and draws the foul on LeBron Griffin! And-1! Carmelo Ginobili to the line for 1. [BONUS: 7 team fouls] (LeBron Griffin: 1 personal fouls)   FT 1/1: GOOD Carmelo Ginobili makes 1/1 from the line.
Score: 46-30

[03:20] Team_025 possession (Score: 46-30)
LeBron Griffin attempts a 3Pt. Contested by Tyrese Wade (3.3 feet, ZONE). LeBron Griffin misses. Offensive rebound by Nikola Lillard! Nikola Lillard kicks it out.

[03:07] Team_025 possession (Score: 46-30)
Immanuel LaVine drives, Tyrese Wade stays with him. Immanuel LaVine attempts a Layup. Heavily contested by Tyrese Wade (0.5 feet, MAN)! IMMANUEL LAVINE MAKES IT! Assist: Damian Adebayo
Score: 48-30

[02:58] Team_100 possession (Score: 48-30)
Dirk Sabonis makes the Layup and draws the foul on Nikola Lillard! And-1! Dirk Sabonis to the line for 1. [BONUS: 8 team fouls] (Nikola Lillard: 2 personal fouls)   FT 1/1: MISS Dirk Sabonis makes 0/1 from the line. Rebound secured by Immanuel LaVine.
Score: 48-32

[02:42] Team_025 possession (Score: 48-32)
LeBron Griffin attempts a Midrange. Contested by Dirk Sabonis (4.4 feet, MAN). LeBron Griffin misses. Offensive rebound by Immanuel LaVine! Immanuel LaVine kicks it out.

[02:28] Team_025 possession (Score: 48-32)
Immanuel LaVine attempts a 3Pt. Wide open! Tyrese Wade is 7.4 feet away. [MAN] Immanuel LaVine misses. Rebound secured by Carmelo Ginobili.

[02:12] Team_100 possession (Score: 48-32)
Evan Butler attempts a 3Pt. Contested by LeBron Griffin (2.8 feet, ZONE). Evan Butler misses. Rebound secured by Dirk Gilgeous-Alexander.

[01:53] Team_025 possession (Score: 48-32)
Dirk Gilgeous-Alexander attempts a 3Pt. Wide open! Evan Butler is 7.4 feet away. [MAN] Dirk Gilgeous-Alexander misses. Rebound secured by Carmelo Ginobili.

[01:39] Team_100 possession (Score: 48-32)
FOUL! Shooting foul on Damian Adebayo. Carmelo Ginobili to the line for 2 free throws. [BONUS: 9 team fouls] (Damian Adebayo: 1 personal fouls)   FT 1/2: GOOD   FT 2/2: GOOD Carmelo Ginobili makes 2/2 from the line.
Score: 48-34

[01:26] Team_025 possession (Score: 48-34)
Damian Adebayo throws a bad pass! Stolen by Carmelo Ginobili! TURNOVER! (live ball)

[01:14] Team_100 possession (Score: 48-34)
Evan Butler throws a bad pass out of bounds! TURNOVER! (dead ball)

[01:04] Team_025 possession (Score: 48-34)
Nikola Lillard drives to the basket... Nikola Lillard throws a bad pass! Stolen by John Rozier! TURNOVER! (live ball)

[00:46] Team_100 possession (Score: 48-34)
Tyrese Wade attempts a 3Pt. Contested by Immanuel LaVine (5.4 feet, MAN). Tyrese Wade misses. Rebound secured by Dirk Gilgeous-Alexander.

[00:33] Team_025 possession (Score: 48-34)
Immanuel LaVine attempts a 3Pt. Contested by Tyrese Wade (5.0 feet, MAN). Immanuel LaVine misses. Rebound secured by Carmelo Ginobili.

[00:22] Team_100 possession (Score: 48-34)
Carmelo Ginobili attempts a 3Pt. Wide open! LeBron Griffin is 6.4 feet away. [ZONE] Carmelo Ginobili misses. Offensive rebound by John Rozier! John Rozier's putback is no good. Rebound secured by Dirk Gilgeous-Alexander.

[00:09] Team_025 possession (Score: 48-34)
Damian Adebayo drives and kicks out. Immanuel LaVine attempts a Midrange. Wide open! Tyrese Wade is 6.4 feet away. [MAN] Immanuel LaVine misses. Offensive rebound by Nikola Lillard! Nikola Lillard kicks it out.

================================================================================
                              2ND QUARTER COMPLETE                              
================================================================================

2ND QUARTER SCORE: Team_025 27, Team_100 23

BOX SCORE:
================================================================================

Team_025
--------------------------------------------------------------------------------
Player                MIN  PTS  REB  AST  TO      FG   FG%      3P   3P%
--------------------------------------------------------------------------------
Nikola Lillard         10    6    5    2   0   3/4    75.0     0/0   0.0
LeBron Griffin         10    6    0    0   0   2/2   100.0     0/0   0.0
Cade Anthony           14    5    0    0   0   2/3    66.7     0/0   0.0
Allen Embiid           14    3    1    0   0   1/1   100.0     0/0   0.0
Damian Adebayo         10    3    0    1   0   1/2    50.0     0/0   0.0
Paolo Lowry            14    2    0    1   0   1/1   100.0     0/0   0.0
Immanuel LaVine        10    2    3    1   0   1/4    25.0     0/0   0.0
Ben Giddey             14    0    0    2   0   0/1     0.0     0/0   0.0
Desmond Jordan         14    0    1    0   0   0/0     0.0     0/0   0.0

TEAM: FG: 11/19 (57.9%), 3PT: 2/8 (25.0%), REB: 15 (4 off, 11 def), AST: 8, TO: 4
TEAM FOULS: 9 [Team_100 in BONUS]


Team_100
--------------------------------------------------------------------------------
Player                MIN  PTS  REB  AST  TO      FG   FG%      3P   3P%
--------------------------------------------------------------------------------
Tyrese Wade            10    5    0    0   0   2/4    50.0     0/0   0.0
Carmelo Ginobili       10    5    3    0   0   2/4    50.0     0/0   0.0
Pau LaVine             14    4    0    0   0   2/2   100.0     0/0   0.0
Tyler Griffin          14    3    0    0   0   1/1   100.0     0/0   0.0
Evan Butler            10    3    0    1   0   1/4    25.0     0/0   0.0
Chris Mobley           12    0    3    1   0   0/0     0.0     0/0   0.0
Manu Ball              14    0    0    1   0   0/0     0.0     0/0   0.0
Luka Green             14    0    0    0   0   0/2     0.0     0/0   0.0
John Rozier            12    0    3    0   0   0/1     0.0     0/0   0.0
Dirk Gilgeous-Alexander   10    0    6    1   0   0/1     0.0     0/0   0.0
Dirk Sabonis           10    0    0    0   0   0/1     0.0     0/0   0.0

TEAM: FG: 8/20 (40.0%), 3PT: 1/7 (14.3%), REB: 10 (2 off, 8 def), AST: 3, TO: 3
TEAM FOULS: 3

================================================================================

================================================================================
                       3RD QUARTER - Team_025 vs Team_100                       
================================================================================

[12:00] Team_025 possession (Score: 48-34)
Paolo Lowry drives, Pau LaVine stays with him. Paolo Lowry attempts a Layup. Contested by Pau LaVine (3.4 feet, ZONE). Paolo Lowry misses. Rebound secured by Pau LaVine.

[11:47] Team_100 possession (Score: 48-34)
Luka Green attempts a 3Pt. Contested by Paolo Lowry (3.3 feet, MAN). LUKA GREEN MAKES IT! Assist: Chris Mobley
Score: 48-37

[11:30] Team_025 possession (Score: 48-37)
Allen Embiid attempts a Layup. Contested by Chris Mobley (5.8 feet, MAN). Allen Embiid misses. Rebound secured by Chris Mobley.

[11:16] Team_100 possession (Score: 48-37)
Chris Mobley attempts a Midrange. Heavily contested by Paolo Lowry (0.5 feet, ZONE)! Chris Mobley misses. Rebound secured by Desmond Jordan.

[11:02] Team_025 possession (Score: 48-37)
Allen Embiid drives and kicks out. Paolo Lowry attempts a 3Pt. Wide open! Luka Green is 6.3 feet away. [ZONE] Paolo Lowry misses. Rebound secured by Tyler Griffin.

[10:47] Team_100 possession (Score: 48-37)
Luka Green drives to the basket... FOUL! Offensive foul on Luka Green! Paolo Lowry drew the charge! [Team fouls: 1] (Luka Green: 1 personal fouls) TURNOVER! (dead ball)

[10:34] Team_025 possession (Score: 48-37)
Cade Anthony drives and kicks out. Allen Embiid attempts a 3Pt. Wide open! Luka Green is 6.4 feet away. [ZONE] Allen Embiid misses. Rebound secured by Chris Mobley.

[10:21] Team_100 possession (Score: 48-37)
Chris Mobley drives and kicks out. Chris Mobley attempts a 3Pt. Wide open! Allen Embiid is 6.4 feet away. [MAN] Chris Mobley misses. Offensive rebound by Chris Mobley! Chris Mobley kicks it out.

[10:11] Team_100 possession (Score: 48-37)
Luka Green attempts a 3Pt. Contested by Paolo Lowry (5.9 feet, MAN). LUKA GREEN MAKES IT! Assist: Manu Ball
Score: 48-40

[09:58] Team_025 possession (Score: 48-40)
Desmond Jordan attempts a Midrange. Contested by Manu Ball (5.8 feet, ZONE). Desmond Jordan misses. Rebound secured by Pau LaVine.

[09:46] Team_100 possession (Score: 48-40)
FOUL! Shooting foul on Cade Anthony. Manu Ball to the line for 2 free throws. [Team fouls: 1] (Cade Anthony: 1 personal fouls)   FT 1/2: GOOD   FT 2/2: GOOD Manu Ball makes 2/2 from the line.
Score: 48-42

[09:30] Team_025 possession (Score: 48-42)
Cade Anthony makes the Layup and draws the foul on Pau LaVine! And-1! Cade Anthony to the line for 1. [Team fouls: 2] (Pau LaVine: 1 personal fouls)   FT 1/1: GOOD Cade Anthony makes 1/1 from the line.
Score: 51-42

[09:16] Team_100 possession (Score: 51-42)
Tyler Griffin attempts a Layup. Contested by Allen Embiid (2.3 feet, ZONE). Tyler Griffin misses. Rebound secured by Cade Anthony.

[08:56] Team_025 possession (Score: 51-42)
Paolo Lowry attempts a Layup. Contested by Pau LaVine (5.1 feet, ZONE). PAOLO LOWRY MAKES IT! Assist: Desmond Jordan
Score: 53-42

[08:39] Team_100 possession (Score: 53-42)
Pau LaVine drives, picks up Allen Embiid. Help arrives from Ben Giddey! Pau LaVine attempts a Dunk. Wide open! Ben Giddey is 6.3 feet away. [ZONE] PAU LAVINE MAKES IT! Assist: Manu Ball
Score: 53-44

[08:20] Team_025 possession (Score: 53-44)
Cade Anthony attempts a Midrange. Contested by Tyler Griffin (4.6 feet, ZONE). CADE ANTHONY MAKES IT!
Score: 55-44

[08:05] Team_100 possession (Score: 55-44)
Luka Green drives, Allen Embiid stays with him. Luka Green attempts a Layup. Heavily contested by Allen Embiid (0.9 feet, ZONE)! LUKA GREEN MAKES IT!
Score: 55-46

[07:49] Team_025 possession (Score: 55-46)
Ben Giddey drives to the basket... Ben Giddey throws a bad pass! Stolen by Manu Ball! TURNOVER! (live ball)

[07:37] Team_100 possession (Score: 55-46)
Chris Mobley drives, picks up Allen Embiid. Help arrives from Ben Giddey! Chris Mobley attempts a Dunk. Contested by Ben Giddey (2.3 feet, MAN). CHRIS MOBLEY MAKES IT!
Score: 55-48

[07:19] Team_025 possession (Score: 55-48)
Cade Anthony attempts a 3Pt. Wide open! Pau LaVine is 6.1 feet away. [MAN] Cade Anthony misses. Rebound secured by Chris Mobley.

[07:02] Team_100 possession (Score: 55-48)
Chris Mobley drives and kicks out. Luka Green attempts a 3Pt. Wide open! Paolo Lowry is 9.2 feet away. [MAN] LUKA GREEN MAKES IT! Assist: Chris Mobley
Score: 55-51

[06:49] Team_025 possession (Score: 55-51)
Allen Embiid drives, picks up Chris Mobley. Help arrives from Manu Ball! Allen Embiid attempts a Dunk. Wide open! Manu Ball is 9.5 feet away. [MAN] ALLEN EMBIID MAKES IT! Assist: Paolo Lowry
Score: 57-51

[06:33] Team_100 possession (Score: 57-51)
Tyler Griffin attempts a 3Pt. Contested by Desmond Jordan (4.8 feet, MAN). Tyler Griffin misses. Rebound secured by Allen Embiid.

[06:18] Team_025 possession (Score: 57-51)
Allen Embiid throws a bad pass! Stolen by Chris Mobley! TURNOVER! (live ball)

[06:05] Team_100 possession (Score: 57-51)
Luka Green attempts a 3Pt. Wide open! Paolo Lowry is 7.4 feet away. [MAN] Luka Green misses. Rebound secured by Desmond Jordan.

[05:46] Team_025 possession (Score: 57-51)
Allen Embiid throws a bad pass! Stolen by Chris Mobley! TURNOVER! (live ball)

[05:30] Team_100 possession (Score: 57-51)
Pau LaVine attempts a 3Pt. Contested by Paolo Lowry (3.4 feet, ZONE). Pau LaVine misses. Offensive rebound by Pau LaVine! Pau LaVine kicks it out.

[05:13] Team_100 possession (Score: 57-51)
Manu Ball attempts a 3Pt. Contested by Ben Giddey (3.3 feet, ZONE). MANU BALL MAKES IT!
Score: 57-54

[04:56] Team_025 possession (Score: 57-54)
Paolo Lowry attempts a 3Pt. Wide open! Luka Green is 9.4 feet away. [MAN] PAOLO LOWRY MAKES IT! Assist: Desmond Jordan
Score: 60-54

[04:43] Team_100 possession (Score: 60-54)
Luka Green attempts a 3Pt. Contested by Ben Giddey (3.8 feet, ZONE). Luka Green misses. FOUL! Loose ball foul on Allen Embiid during the rebound battle. [Team fouls: 2] No free throws, side out. (Allen Embiid: 1 personal fouls)

[04:26] Team_100 possession (Score: 60-54)
Chris Mobley attempts a Layup. BLOCKED BY BEN GIDDEY! Ball goes out off Ben Giddey. Chris Mobley's ball!

[04:15] Team_100 possession (Score: 60-54)
Tyler Griffin attempts a 3Pt. Contested by Paolo Lowry (3.8 feet, ZONE). Tyler Griffin misses. Offensive rebound by Chris Mobley! Chris Mobley kicks it out.

[03:55] Team_100 possession (Score: 60-54)
Chris Mobley attempts a Layup. Contested by Allen Embiid (2.9 feet, ZONE). CHRIS MOBLEY MAKES IT! Assist: Luka Green
Score: 60-56

[03:41] Team_025 possession (Score: 60-56)
Desmond Jordan attempts a Midrange. Contested by Tyler Griffin (4.6 feet, ZONE). Desmond Jordan misses. Rebound secured by Pau LaVine.

[03:26] Team_100 possession (Score: 60-56)
Manu Ball commits a violation (traveling/carry)! TURNOVER! (dead ball)

[03:13] Team_025 possession (Score: 60-56)
FOUL! Reach-in foul on Pau LaVine during the drive. [Team fouls: 3] No free throws, side out. (Pau LaVine: 2 personal fouls)

[02:59] Team_025 possession (Score: 60-56)
Desmond Jordan attempts a 3Pt. Contested by Tyler Griffin (2.5 feet, MAN). Desmond Jordan misses. Rebound secured by Tyler Griffin.

[02:47] Team_100 possession (Score: 60-56)
Chris Mobley attempts a Midrange. Contested by Desmond Jordan (2.8 feet, ZONE). Chris Mobley misses. Rebound secured by Desmond Jordan.

[02:31] Team_025 possession (Score: 60-56)
Desmond Jordan drives and kicks out. Allen Embiid attempts a 3Pt. Contested by Chris Mobley (3.6 feet, MAN). Allen Embiid misses. Rebound secured by Tyler Griffin.

[02:18] Team_100 possession (Score: 60-56)
Manu Ball attempts a 3Pt. Contested by Ben Giddey (3.8 feet, ZONE). MANU BALL MAKES IT!
Score: 60-59

[02:02] Team_025 possession (Score: 60-59)
FOUL! Reach-in foul on Pau LaVine during the drive. [Team fouls: 4] No free throws, side out. (Pau LaVine: 3 personal fouls)

[01:48] Team_025 possession (Score: 60-59)
Ben Giddey attempts a 3Pt. Wide open! Luka Green is 9.8 feet away. [ZONE] Ben Giddey misses. Offensive rebound by Allen Embiid! Allen Embiid's putback is no good. Rebound secured by Chris Mobley.

[01:33] Team_100 possession (Score: 60-59)
Pau LaVine attempts a 3Pt. Heavily contested by Cade Anthony (1.3 feet, ZONE)! PAU LAVINE MAKES IT! Assist: Tyler Griffin
Score: 60-62

[01:23] Team_025 possession (Score: 60-62)
Allen Embiid attempts a Midrange. Wide open! Pau LaVine is 7.7 feet away. [ZONE] ALLEN EMBIID MAKES IT! Assist: Cade Anthony
Score: 62-62

[01:08] Team_100 possession (Score: 62-62)
FOUL! Reach-in foul on Allen Embiid during the drive. [Team fouls: 3] No free throws, side out. (Allen Embiid: 2 personal fouls)

[00:52] Team_100 possession (Score: 62-62)
Pau LaVine attempts a Layup. Wide open! Cade Anthony is 6.1 feet away. [MAN] PAU LAVINE MAKES IT!
Score: 62-64

[00:37] Team_025 possession (Score: 62-64)
Ben Giddey attempts a 3Pt. Contested by Manu Ball (5.8 feet, MAN). Ben Giddey misses. Rebound secured by Pau LaVine.

[00:18] Team_100 possession (Score: 62-64)
Chris Mobley attempts a Midrange. Contested by Allen Embiid (3.7 feet, MAN). Chris Mobley misses. Offensive rebound by Pau LaVine! Pau LaVine kicks it out.

[00:01] Team_100 possession (Score: 62-64)
Manu Ball drives, picks up Ben Giddey. Help arrives from Desmond Jordan! Manu Ball attempts a Layup. Heavily contested by Desmond Jordan (0.7 feet, MAN)! Manu Ball misses. FOUL! Loose ball foul on Desmond Jordan during the rebound battle. [Team fouls: 4] No free throws, side out. (Desmond Jordan: 1 personal fouls)

================================================================================
                              3RD QUARTER COMPLETE                              
================================================================================

3RD QUARTER SCORE: Team_025 14, Team_100 30

BOX SCORE:
================================================================================

Team_025
--------------------------------------------------------------------------------
Player                MIN  PTS  REB  AST  TO      FG   FG%      3P   3P%
--------------------------------------------------------------------------------
Paolo Lowry            26    5    0    1   0   2/3    66.7     0/0   0.0
Cade Anthony           26    5    1    1   0   2/4    50.0     0/0   0.0
Allen Embiid           26    4    1    0   0   2/4    50.0     0/0   0.0
Desmond Jordan         26    0    3    2   0   0/4     0.0     0/0   0.0
Ben Giddey             26    0    0    0   0   0/2     0.0     0/0   0.0

TEAM: FG: 6/17 (35.3%), 3PT: 1/5 (20.0%), REB: 6 (1 off, 5 def), AST: 4, TO: 3
TEAM FOULS: 4


Team_100
--------------------------------------------------------------------------------
Player                MIN  PTS  REB  AST  TO      FG   FG%      3P   3P%
--------------------------------------------------------------------------------
Luka Green             26   11    0    1   0   4/5    80.0     0/0   0.0
Manu Ball              26    8    0    2   0   3/3   100.0     0/0   0.0
Pau LaVine             26    7    7    0   0   3/3   100.0     0/0   0.0
Chris Mobley           25    4    7    2   0   2/4    50.0     0/0   0.0
Tyler Griffin          26    0    3    1   0   0/2     0.0     0/0   0.0

TEAM: FG: 12/17 (70.6%), 3PT: 5/7 (71.4%), REB: 16 (6 off, 10 def), AST: 6, TO: 2
TEAM FOULS: 4

================================================================================

================================================================================
                       4TH QUARTER - Team_025 vs Team_100                       
================================================================================

[12:00] Team_025 possession (Score: 62-64)
Ben Giddey loses the ball! Stripped by Manu Ball! TURNOVER! (live ball)

[11:45] Team_100 possession (Score: 62-64)
Manu Ball attempts a Layup. Contested by Ben Giddey (6.0 feet, MAN). MANU BALL MAKES IT!
Score: 62-66

[11:32] Team_025 possession (Score: 62-66)
Ben Giddey attempts a 3Pt. Contested by Tyler Griffin (3.6 feet, ZONE). BEN GIDDEY MAKES IT! Assist: Desmond Jordan
Score: 65-66

[11:17] Team_100 possession (Score: 65-66)
FOUL! Holding foul on Paolo Lowry. [Team fouls: 1] No free throws, side out. (Paolo Lowry: 1 personal fouls)

[11:00] Team_100 possession (Score: 65-66)
Luka Green attempts a 3Pt. Heavily contested by Ben Giddey (1.5 feet, ZONE)! Luka Green misses. FOUL! Loose ball foul on Allen Embiid during the rebound battle. [Team fouls: 2] No free throws, side out. (Allen Embiid: 1 personal fouls)

[10:49] Team_100 possession (Score: 65-66)
Manu Ball attempts a 3Pt. Contested by Ben Giddey (5.9 feet, MAN). Manu Ball misses. Rebound secured by Allen Embiid.

[10:39] Team_025 possession (Score: 65-66)
FOUL! Reach-in foul on Tyler Griffin during the drive. [Team fouls: 1] No free throws, side out. (Tyler Griffin: 1 personal fouls)

[10:25] Team_025 possession (Score: 65-66)
Allen Embiid drives, Chris Mobley stays with him. Allen Embiid attempts a Layup. Wide open! Chris Mobley is 8.1 feet away. [MAN] Allen Embiid misses. Rebound secured by Chris Mobley.

[10:12] Team_100 possession (Score: 65-66)
Pau LaVine drives, picks up Allen Embiid. Help arrives from Ben Giddey! Pau LaVine attempts a Dunk. Contested by Ben Giddey (4.6 feet, ZONE). Pau LaVine misses. Rebound secured by Allen Embiid.

[09:58] Team_025 possession (Score: 65-66)
Cade Anthony drives, picks up Pau LaVine. Help arrives from Manu Ball! Cade Anthony attempts a Layup. Wide open! Manu Ball is 6.6 feet away. [ZONE] Cade Anthony misses. Rebound secured by Chris Mobley.

[09:46] Team_100 possession (Score: 65-66)
FOUL! Reach-in foul on Allen Embiid during the drive. [Team fouls: 3] No free throws, side out. (Allen Embiid: 2 personal fouls)

[09:30] Team_100 possession (Score: 65-66)
Manu Ball drives, Allen Embiid stays with him. Manu Ball attempts a Dunk. Contested by Allen Embiid (4.6 feet, ZONE). Manu Ball misses. Offensive rebound by Pau LaVine! Pau LaVine kicks it out.

[09:15] Team_100 possession (Score: 65-66)
FOUL! Holding foul on Paolo Lowry. [Team fouls: 4] No free throws, side out. (Paolo Lowry: 2 personal fouls)

[08:57] Team_100 possession (Score: 65-66)
Luka Green attempts a Layup. Contested by Allen Embiid (3.9 feet, ZONE). Luka Green misses. Rebound secured by Allen Embiid.

[08:42] Team_025 possession (Score: 65-66)
Desmond Jordan attempts a 3Pt. Wide open! Tyler Griffin is 6.5 feet away. [MAN] DESMOND JORDAN MAKES IT! Assist: Ben Giddey
Score: 68-66

[08:27] Team_100 possession (Score: 68-66)
Manu Ball attempts a Layup. Contested by Ben Giddey (4.6 feet, MAN). Manu Ball misses. Rebound secured by Allen Embiid.

[08:13] Team_025 possession (Score: 68-66)
Ben Giddey drives, Manu Ball stays with him. Ben Giddey attempts a Dunk. Contested by Manu Ball (4.0 feet, MAN). Ben Giddey misses. Rebound secured by Pau LaVine.

[07:57] Team_100 possession (Score: 68-66)
Manu Ball makes the Midrange and draws the foul on Ben Giddey! And-1! Manu Ball to the line for 1. [BONUS: 5 team fouls] (Ben Giddey: 1 personal fouls)   FT 1/1: GOOD Manu Ball makes 1/1 from the line.
Score: 68-69

[07:44] Team_025 possession (Score: 68-69)
Allen Embiid attempts a 3Pt. Wide open! Luka Green is 6.6 feet away. [ZONE] Allen Embiid misses. Rebound secured by Tyler Griffin.

[07:32] Team_100 possession (Score: 68-69)
Luka Green drives, Paolo Lowry stays with him. Luka Green attempts a Layup. Wide open! Paolo Lowry is 6.5 feet away. [MAN] Luka Green misses. Rebound secured by Allen Embiid.

[07:22] Team_025 possession (Score: 68-69)
Ben Giddey attempts a Midrange. Wide open! Manu Ball is 6.3 feet away. [MAN] Ben Giddey misses. Offensive rebound by Allen Embiid! Allen Embiid's putback is no good. Rebound secured by Chris Mobley.

[07:07] Team_100 possession (Score: 68-69)
Tyler Griffin attempts a 3Pt. Contested by Desmond Jordan (3.0 feet, MAN). TYLER GRIFFIN MAKES IT! Assist: Manu Ball
Score: 68-72

[06:58] Team_025 possession (Score: 68-72)
Allen Embiid drives and kicks out. Cade Anthony attempts a 3Pt. Contested by Pau LaVine (3.8 feet, MAN). CADE ANTHONY MAKES IT! Assist: Ben Giddey
Score: 71-72

[06:45] Team_100 possession (Score: 71-72)
Chris Mobley drives, picks up Allen Embiid. Help arrives from Ben Giddey! Chris Mobley attempts a Dunk. Contested by Ben Giddey (3.4 feet, ZONE). Chris Mobley misses. Rebound secured by Allen Embiid.

[06:33] Team_025 possession (Score: 71-72)
Allen Embiid attempts a 3Pt. Wide open! Chris Mobley is 6.7 feet away. [MAN] Allen Embiid misses. Offensive rebound by Allen Embiid! Allen Embiid puts it back in!
Score: 73-72

[06:22] Team_100 possession (Score: 73-72)
Manu Ball attempts a 3Pt. Contested by Ben Giddey (2.6 feet, MAN). MANU BALL MAKES IT! Assist: Chris Mobley
Score: 73-75

[06:07] Team_025 possession (Score: 73-75)
Paolo Lowry attempts a 3Pt. Contested by Luka Green (5.1 feet, MAN). Paolo Lowry misses. Rebound secured by Tyler Griffin.

[05:56] Team_100 possession (Score: 73-75)
Pau LaVine attempts a 3Pt. Wide open! Cade Anthony is 7.2 feet away. [ZONE] Pau LaVine misses. Rebound secured by Desmond Jordan.

[05:42] Team_025 possession (Score: 73-75)
Desmond Jordan attempts a 3Pt. Wide open! Tyler Griffin is 6.6 feet away. [MAN] DESMOND JORDAN MAKES IT! Assist: Allen Embiid
Score: 76-75

[05:26] Team_100 possession (Score: 76-75)
Luka Green attempts a Midrange. Contested by Paolo Lowry (3.8 feet, MAN). LUKA GREEN MAKES IT! Assist: Tyler Griffin
Score: 76-77

[05:09] Team_025 possession (Score: 76-77)
Paolo Lowry attempts a 3Pt. Contested by Luka Green (5.2 feet, ZONE). Paolo Lowry misses. Rebound secured by Tyler Griffin.

[04:54] Team_100 possession (Score: 76-77)
Chris Mobley attempts a Midrange. Wide open! Desmond Jordan is 6.6 feet away. [ZONE] CHRIS MOBLEY MAKES IT!
Score: 76-79

[04:38] Team_025 possession (Score: 76-79)
Paolo Lowry attempts a 3Pt. Contested by Luka Green (5.1 feet, ZONE). Paolo Lowry misses. Rebound secured by Tyler Griffin.

[04:24] Team_100 possession (Score: 76-79)
FOUL! Reach-in foul on Ben Giddey during the drive. [IN THE BONUS! 6 team fouls] Manu Ball to the line for 2 free throws. (Ben Giddey: 2 personal fouls)   FT 1/2: GOOD   FT 2/2: MISS Manu Ball makes 1/2 from the line. FOUL! Loose ball foul on Cade Anthony during the free throw rebound! [IN THE BONUS! 7 team fouls] Chris Mobley to the line for 2 free throws. (Cade Anthony: 1 personal fouls)   FT 1/2: GOOD   FT 2/2: GOOD Chris Mobley makes 2/2 from the line.
Score: 76-82

[04:12] Team_025 possession (Score: 76-82)
Cade Anthony attempts a 3Pt. Contested by Luka Green (5.3 feet, ZONE). CADE ANTHONY MAKES IT! Assist: Desmond Jordan
Score: 79-82

[03:56] Team_100 possession (Score: 79-82)
Pau LaVine attempts a Midrange. Contested by Desmond Jordan (3.4 feet, ZONE). Pau LaVine misses. Rebound secured by Cade Anthony.

[03:39] Team_025 possession (Score: 79-82)
Paolo Lowry attempts a 3Pt. Wide open! Luka Green is 8.3 feet away. [ZONE] PAOLO LOWRY MAKES IT!
Score: 82-82

[03:25] Team_100 possession (Score: 82-82)
Tyler Griffin makes the Midrange and draws the foul on Desmond Jordan! And-1! Tyler Griffin to the line for 1. [BONUS: 8 team fouls] (Desmond Jordan: 1 personal fouls)   FT 1/1: MISS Tyler Griffin makes 0/1 from the line. Rebound secured by Allen Embiid.
Score: 82-84

[03:15] Team_025 possession (Score: 82-84)
FOUL! Holding foul on Pau LaVine. [Team fouls: 2] No free throws, side out. (Pau LaVine: 1 personal fouls)

[03:03] Team_025 possession (Score: 82-84)
Cade Anthony drives to the basket... Cade Anthony loses control! Ball rolls out of bounds! TURNOVER! (dead ball)

[03:03] Substitution (Team_025): Paolo Lowry OUT → LeBron Griffin IN (stamina_rule2)

[03:03] Substitution (Team_025): Ben Giddey OUT → Dirk Gilgeous-Alexander IN (stamina_rule2)

[03:03] Substitution (Team_025): Desmond Jordan OUT → Immanuel LaVine IN (stamina_rule2)

[03:03] Substitution (Team_025): Cade Anthony OUT → Damian Adebayo IN (stamina_rule2)

[03:03] Substitution (Team_025): Allen Embiid OUT → Nikola Lillard IN (stamina_rule2)

[03:03] Substitution (Team_100): Luka Green OUT → Dirk Sabonis IN (stamina_rule2)

[03:03] Substitution (Team_100): Manu Ball OUT → Evan Butler IN (stamina_rule2)

[03:03] Substitution (Team_100): Tyler Griffin OUT → Tyrese Wade IN (stamina_rule2)

[03:03] Substitution (Team_100): Pau LaVine OUT → Carmelo Ginobili IN (stamina_rule2)

[03:03] Substitution (Team_100): Chris Mobley OUT → John Rozier IN (stamina_rule2)

[02:46] Team_100 possession (Score: 82-84)
Carmelo Ginobili attempts a 3Pt. Contested by Damian Adebayo (4.9 feet, MAN). Carmelo Ginobili misses. Rebound secured by Immanuel LaVine.

[02:37] Team_025 possession (Score: 82-84)
Nikola Lillard drives and kicks out. LeBron Griffin attempts a 3Pt. Contested by Dirk Sabonis (3.5 feet, MAN). LeBron Griffin misses. Rebound secured by John Rozier.

[02:22] Team_100 possession (Score: 82-84)
Dirk Sabonis throws a bad pass! Stolen by LeBron Griffin! TURNOVER! (live ball)

[02:07] Team_025 possession (Score: 82-84)
Immanuel LaVine attempts a 3Pt. Contested by Tyrese Wade (5.3 feet, MAN). Immanuel LaVine misses. Rebound secured by Tyrese Wade.

[01:53] Team_100 possession (Score: 82-84)
John Rozier attempts a 3Pt. Contested by Damian Adebayo (5.6 feet, ZONE). JOHN ROZIER MAKES IT! Assist: Evan Butler
Score: 82-87

[01:38] Team_025 possession (Score: 82-87)
LeBron Griffin throws a bad pass! Stolen by Dirk Sabonis! TURNOVER! (live ball)

[01:26] Team_100 possession (Score: 82-87)
Tyrese Wade attempts a 3Pt. Contested by Damian Adebayo (4.7 feet, ZONE). TYRESE WADE MAKES IT! Assist: Dirk Sabonis
Score: 82-90

[01:14] Team_025 possession (Score: 82-90)
LeBron Griffin attempts a 3Pt. Wide open! Tyrese Wade is 8.5 feet away. [ZONE] LeBron Griffin misses. Rebound secured by Carmelo Ginobili.

[00:56] Team_100 possession (Score: 82-90)
Evan Butler attempts a Midrange. Wide open! Dirk Gilgeous-Alexander is 6.8 feet away. [MAN] Evan Butler misses. Rebound secured by Immanuel LaVine.

[00:40] Team_025 possession (Score: 82-90)
LeBron Griffin attempts a Layup. Heavily contested by John Rozier (0.5 feet, ZONE)! LEBRON GRIFFIN MAKES IT! Assist: Damian Adebayo
Score: 84-90

[00:25] Team_100 possession (Score: 84-90)
FOUL! Holding foul on Nikola Lillard. [IN THE BONUS! 9 team fouls] John Rozier to the line for 2 free throws. (Nikola Lillard: 1 personal fouls)   FT 1/2: GOOD   FT 2/2: GOOD John Rozier makes 2/2 from the line.
Score: 84-92

[00:08] Team_025 possession (Score: 84-92)
Immanuel LaVine attempts a 3Pt. Wide open! Evan Butler is 8.4 feet away. [ZONE] Immanuel LaVine misses. Offensive rebound by Immanuel LaVine! Immanuel LaVine kicks it out.

================================================================================
                              4TH QUARTER COMPLETE                              
================================================================================

4TH QUARTER SCORE: Team_025 22, Team_100 28

BOX SCORE:
================================================================================

Team_025
--------------------------------------------------------------------------------
Player                MIN  PTS  REB  AST  TO      FG   FG%      3P   3P%
--------------------------------------------------------------------------------
Desmond Jordan         35    6    1    2   0   2/2   100.0     0/0   0.0
Cade Anthony           35    6    1    0   0   2/3    66.7     0/0   0.0
Ben Giddey             35    3    0    2   0   1/3    33.3     0/0   0.0
Paolo Lowry            35    3    0    0   0   1/4    25.0     0/0   0.0
Allen Embiid           35    2    8    1   0   1/3    33.3     0/0   0.0
LeBron Griffin         13    2    0    0   0   1/2    50.0     0/0   0.0
Immanuel LaVine        13    0    3    0   0   0/1     0.0     0/0   0.0
Nikola Lillard         13    0    0    0   0   0/1     0.0     0/0   0.0
Damian Adebayo         13    0    0    1   0   0/0     0.0     0/0   0.0

TEAM: FG: 8/19 (42.1%), 3PT: 6/12 (50.0%), REB: 14 (3 off, 11 def), AST: 6, TO: 3
TEAM FOULS: 9 [Team_100 in BONUS]


Team_100
--------------------------------------------------------------------------------
Player                MIN  PTS  REB  AST  TO      FG   FG%      3P   3P%
--------------------------------------------------------------------------------
Manu Ball              35    8    0    1   0   3/5    60.0     0/0   0.0
Chris Mobley           34    5    4    1   0   2/3    66.7     0/0   0.0
John Rozier            15    5    1    0   0   2/2   100.0     0/0   0.0
Tyler Griffin          35    3    4    1   0   1/2    50.0     0/0   0.0
Tyrese Wade            13    3    1    0   0   1/1   100.0     0/0   0.0
Luka Green             35    2    0    0   0   1/3    33.3     0/0   0.0
Pau LaVine             35    0    2    0   0   0/3     0.0     0/0   0.0
Carmelo Ginobili       13    0    1    0   0   0/1     0.0     0/0   0.0
Evan Butler            13    0    0    1   0   0/1     0.0     0/0   0.0
Dirk Sabonis           13    0    0    1   0   0/0     0.0     0/0   0.0

TEAM: FG: 10/21 (47.6%), 3PT: 4/7 (57.1%), REB: 12 (2 off, 10 def), AST: 5, TO: 1
TEAM FOULS: 2

================================================================================

================================================================================
                               FULL GAME COMPLETE                               
================================================================================

FINAL SCORE: Team_025 84, Team_100 92

SCORING BY QUARTER:
--------------------------------------------------------------------------------
Team                     Q1     Q2     Q3     Q4    FINAL
--------------------------------------------------------------------------------
Team_025                 21     27     14     22       84
Team_100                 11     23     30     28       92
--------------------------------------------------------------------------------

FULL GAME BOX SCORE:
================================================================================

Team_025
--------------------------------------------------------------------------------
Player                MIN  PTS  REB  AST  TO      FG   FG%      3P   3P%      FT STL BLK
--------------------------------------------------------------------------------
Paolo Lowry            35   16    0    3   0   6/12   50.0   3/7    42.9   1/1     0   0
Ben Giddey             35    7    0    5   1   3/9    33.3   1/5    20.0   2/2     0   2
Desmond Jordan         35   13    7    4   1   6/11   54.5   2/3    66.7   1/1     1   1
Cade Anthony           35   16   10    1   1   4/9    44.4   1/4    25.0   1/1     0   0
Allen Embiid           35    9   12    1   6   5/13   38.5   1/3    33.3   1/1     0   1
LeBron Griffin         13    8    0    1   1   3/4    75.0   1/2    50.0   0/0     2   0
Dirk Gilgeous-Alexander   13    0    6    2   1   0/1     0.0   0/1     0.0   0/0     0   0
Immanuel LaVine        13    2    6    1   2   1/5    20.0   0/3     0.0   0/0     0   0
Damian Adebayo         13    5    0    2   2   2/3    66.7   1/2    50.0   0/0     0   0
Nikola Lillard         13    8    5    2   0   4/6    66.7   0/0     0.0   2/3     1   0

TEAM: FG: 34/73 (46.6%), 3PT: 10/30 (33.3%), REB: 48 (11 off, 37 def), AST: 22, TO: 15


Team_100
--------------------------------------------------------------------------------
Player                MIN  PTS  REB  AST  TO      FG   FG%      3P   3P%      FT STL BLK
--------------------------------------------------------------------------------
Luka Green             35   15    0    2   3   5/11   45.5   2/6    33.3   2/2     0   0
Manu Ball              35   16    0    4   3   7/15   46.7   3/8    37.5   4/5     2   0
Tyler Griffin          35    8    9    2   1   3/7    42.9   2/3    66.7   0/1     0   0
Pau LaVine             35   13   15    0   0   6/11   54.5   1/2    50.0   0/0     1   0
Chris Mobley           34   11   16    4   0   5/10   50.0   0/0     0.0   2/2     2   1
John Rozier            15    5    4    1   0   1/2    50.0   1/2    50.0   2/2     2   1
Dirk Sabonis           13    0    0    1   2   0/1     0.0   0/0     0.0   0/1     1   0
Evan Butler            13    3    0    2   1   1/5    20.0   0/1     0.0   1/1     0   0
Tyrese Wade            13   11    1    0   1   4/6    66.7   2/3    66.7   2/3     0   0
Carmelo Ginobili       13    5    4    0   0   2/5    40.0   0/2     0.0   3/3     1   0

TEAM: FG: 35/75 (46.7%), 3PT: 11/27 (40.7%), REB: 47 (12 off, 35 def), AST: 16, TO: 11

================================================================================
