================================================================================
                        FULL GAME - Team_007 vs Team_091                        
================================================================================

================================================================================
                       1ST QUARTER - Team_007 vs Team_091                       
================================================================================

[12:00] Team_007 possession (Score: 0-0)
FOUL! Reach-in foul on Kevin Simons during the drive. [Team fouls: 1] No free throws, side out. (Kevin Simons: 1 personal fouls)

[11:45] Team_007 possession (Score: 0-0)
Carmelo Siakam attempts a Layup. Wide open! Kevin Simons is 6.2 feet away. [ZONE] CARMELO SIAKAM MAKES IT!
Score: 2-0

[11:31] Team_091 possession (Score: 2-0)
Kyrie Rozier attempts a 3Pt. Contested by John Quickley (4.7 feet, ZONE). Kyrie Rozier misses. Rebound secured by Bones Siakam.

[11:17] Team_007 possession (Score: 2-0)
Jaren Dosunmu drives to the basket... FOUL! Offensive foul on Jaren Dosunmu! Kevin Simons drew the charge! [Team fouls: 1] (Jaren Dosunmu: 1 personal fouls) TURNOVER! (dead ball)

[11:03] Team_091 possession (Score: 2-0)
Kyrie Rozier drives to the basket... Kyrie Rozier throws a bad pass out of bounds! TURNOVER! (dead ball)

[10:50] Team_007 possession (Score: 2-0)
John Quickley attempts a Layup. Contested by Kevin Simons (5.7 feet, ZONE). JOHN QUICKLEY MAKES IT! Assist: Carmelo Siakam
Score: 4-0

[10:38] Team_091 possession (Score: 4-0)
Kyrie Rozier attempts a 3Pt. Contested by John Quickley (3.1 feet, ZONE). KYRIE ROZIER MAKES IT! Assist: D'Angelo Ingram
Score: 4-3

[10:26] Team_007 possession (Score: 4-3)
FOUL! Holding foul on Kyrie Rozier. [Team fouls: 2] No free throws, side out. (Kyrie Rozier: 1 personal fouls)

[10:13] Team_007 possession (Score: 4-3)
Carmelo Siakam drives and kicks out. John Quickley attempts a Midrange. Contested by D'Angelo Ingram (4.0 feet, ZONE). John Quickley misses. Rebound secured by Kyrie Rozier.

[10:04] Team_091 possession (Score: 4-3)
FOUL! Reach-in foul on John Quickley during the drive. [Team fouls: 2] No free throws, side out. (John Quickley: 1 personal fouls)

[09:51] Team_091 possession (Score: 4-3)
FOUL! Holding foul on Jaren Dosunmu. [Team fouls: 3] No free throws, side out. (Jaren Dosunmu: 2 personal fouls)

[09:38] Team_091 possession (Score: 4-3)
Kyrie Rozier attempts a Layup. Contested by Tobias Johnson (3.9 feet, MAN). KYRIE ROZIER MAKES IT! Assist: Isaiah Siakam
Score: 4-5

[09:27] Team_007 possession (Score: 4-5)
Jaren Dosunmu drives, picks up Kevin Simons. Help arrives from Kyrie Rozier! Jaren Dosunmu attempts a Layup. Contested by Kyrie Rozier (4.9 feet, ZONE). JAREN DOSUNMU MAKES IT! Assist: Tobias Johnson
Score: 6-5

[09:08] Team_091 possession (Score: 6-5)
D'Angelo Ingram drives and kicks out. Kyrie Rozier attempts a Midrange. Contested by Bones Siakam (4.4 feet, ZONE). Kyrie Rozier misses. Rebound secured by Carmelo Siakam.

[08:51] Team_007 possession (Score: 6-5)
Tobias Johnson attempts a Midrange. Contested by D'Angelo Ingram (5.0 feet, ZONE). Tobias Johnson misses. Rebound secured by Kevin Simons.

[08:37] Team_091 possession (Score: 6-5)
D'Angelo Ingram drives, John Quickley stays with him. D'Angelo Ingram attempts a Layup. Contested by John Quickley (5.0 feet, ZONE). D'ANGELO INGRAM MAKES IT! Assist: Rudy Bridges
Score: 6-7

[08:20] Team_007 possession (Score: 6-7)
Jaren Dosunmu drives, Isaiah Siakam stays with him. Jaren Dosunmu attempts a Dunk. Wide open! Isaiah Siakam is 6.5 feet away. [MAN] JAREN DOSUNMU MAKES IT!
Score: 8-7

[08:07] Team_091 possession (Score: 8-7)
Kyrie Rozier attempts a 3Pt. Contested by Tobias Johnson (5.4 feet, MAN). Kyrie Rozier misses. Rebound secured by Carmelo Siakam.

[07:57] Team_007 possession (Score: 8-7)
Bones Siakam attempts a 3Pt. Wide open! Rudy Bridges is 7.7 feet away. [ZONE] Bones Siakam misses. Rebound secured by Kyrie Rozier.

[07:39] Team_091 possession (Score: 8-7)
Kyrie Rozier attempts a Midrange. Contested by Bones Siakam (4.9 feet, ZONE). KYRIE ROZIER MAKES IT!
Score: 8-9

[07:19] Team_007 possession (Score: 8-9)
Tobias Johnson drives and kicks out. John Quickley attempts a 3Pt. Wide open! Kyrie Rozier is 6.4 feet away. [ZONE] John Quickley misses. Rebound secured by Kevin Simons.

[07:09] Team_091 possession (Score: 8-9)
Rudy Bridges drives, John Quickley stays with him. Rudy Bridges attempts a Dunk. Contested by John Quickley (2.0 feet, ZONE). RUDY BRIDGES MAKES IT!
Score: 8-11

[06:52] Team_007 possession (Score: 8-11)
Bones Siakam attempts a 3Pt. Wide open! Rudy Bridges is 6.0 feet away. [MAN] BONES SIAKAM MAKES IT! Assist: John Quickley
Score: 11-11

[06:36] Team_091 possession (Score: 11-11)
Kyrie Rozier attempts a 3Pt. Contested by John Quickley (3.4 feet, ZONE). Kyrie Rozier misses. Rebound secured by John Quickley.

[06:18] Team_007 possession (Score: 11-11)
John Quickley attempts a Midrange. Contested by D'Angelo Ingram (4.1 feet, MAN). John Quickley misses. Rebound secured by Kevin Simons.

[06:03] Team_091 possession (Score: 11-11)
Rudy Bridges attempts a 3Pt. Contested by John Quickley (2.5 feet, ZONE). Rudy Bridges misses. Offensive rebound by Kevin Simons! Kevin Simons's putback is no good. Rebound secured by Carmelo Siakam.

[05:51] Team_007 possession (Score: 11-11)
Carmelo Siakam makes the Dunk and draws the foul on Kyrie Rozier! And-1! Carmelo Siakam to the line for 1. [Team fouls: 3] (Kyrie Rozier: 2 personal fouls)   FT 1/1: GOOD Carmelo Siakam makes 1/1 from the line.
Score: 14-11

[05:36] Team_091 possession (Score: 14-11)
D'Angelo Ingram attempts a 3Pt. Heavily contested by John Quickley (1.3 feet, MAN)! D'Angelo Ingram misses. Rebound secured by Bones Siakam.

[05:26] Team_007 possession (Score: 14-11)
Tobias Johnson attempts a Layup. Contested by Kyrie Rozier (4.9 feet, MAN). TOBIAS JOHNSON MAKES IT!
Score: 16-11

[05:11] Team_091 possession (Score: 16-11)
Isaiah Siakam attempts a 3Pt. Heavily contested by John Quickley (1.9 feet, ZONE)! Isaiah Siakam misses. Rebound secured by John Quickley.

[04:56] Team_007 possession (Score: 16-11)
Bones Siakam attempts a Midrange. Contested by D'Angelo Ingram (4.5 feet, ZONE). Bones Siakam misses. Rebound secured by Kevin Simons.

[04:40] Team_091 possession (Score: 16-11)
FOUL! Shooting foul on Carmelo Siakam. Isaiah Siakam to the line for 2 free throws. [Team fouls: 4] (Carmelo Siakam: 1 personal fouls)   FT 1/2: GOOD   FT 2/2: GOOD Isaiah Siakam makes 2/2 from the line.
Score: 16-13

[04:27] Team_007 possession (Score: 16-13)
Jaren Dosunmu attempts a Midrange. BLOCKED BY D'ANGELO INGRAM! Ball is loose! Rebound secured by Kyrie Rozier.

[04:15] Team_091 possession (Score: 16-13)
Kyrie Rozier makes the Layup and draws the foul on Bones Siakam! And-1! Kyrie Rozier to the line for 1. [BONUS: 5 team fouls] (Bones Siakam: 1 personal fouls)   FT 1/1: GOOD Kyrie Rozier makes 1/1 from the line.
Score: 16-16

[04:01] Team_007 possession (Score: 16-16)
Jaren Dosunmu attempts a Midrange. Wide open! Isaiah Siakam is 7.8 feet away. [MAN] JAREN DOSUNMU MAKES IT! Assist: Tobias Johnson
Score: 18-16

[03:47] Team_091 possession (Score: 18-16)
D'Angelo Ingram attempts a 3Pt. Wide open! John Quickley is 7.9 feet away. [ZONE] D'ANGELO INGRAM MAKES IT! Assist: Kevin Simons
Score: 18-19

[03:31] Team_007 possession (Score: 18-19)
Jaren Dosunmu attempts a Midrange. Wide open! D'Angelo Ingram is 8.1 feet away. [ZONE] JAREN DOSUNMU MAKES IT! Assist: Carmelo Siakam
Score: 20-19

[03:14] Team_091 possession (Score: 20-19)
Kyrie Rozier drives to the basket... FOUL! Offensive foul on Kyrie Rozier! John Quickley drew the charge! [Team fouls: 4] (Kyrie Rozier: 3 personal fouls) TURNOVER! (dead ball)

[02:58] Team_007 possession (Score: 20-19)
Carmelo Siakam drives to the basket... FOUL! Offensive foul on Carmelo Siakam! Kevin Simons drew the charge! [Team fouls: 6] (Carmelo Siakam: 2 personal fouls) TURNOVER! (dead ball)

[02:47] Team_091 possession (Score: 20-19)
Isaiah Siakam drives and kicks out. D'Angelo Ingram attempts a 3Pt. Wide open! John Quickley is 7.1 feet away. [ZONE] D'Angelo Ingram misses. Rebound secured by Bones Siakam.

[02:35] Team_007 possession (Score: 20-19)
Bones Siakam attempts a 3Pt. Contested by Rudy Bridges (3.9 feet, MAN). BONES SIAKAM MAKES IT!
Score: 23-19

[02:19] Team_091 possession (Score: 23-19)
Kyrie Rozier attempts a Midrange. Contested by Bones Siakam (3.5 feet, ZONE). Kyrie Rozier misses. FOUL! Loose ball foul on Bones Siakam during the rebound battle. [IN THE BONUS! 7 team fouls] Rudy Bridges to the line for 2 free throws. (Bones Siakam: 2 personal fouls)   FT 1/2: GOOD   FT 2/2: GOOD Rudy Bridges makes 2/2 from the line.
Score: 23-21

[02:10] Team_007 possession (Score: 23-21)
John Quickley attempts a Midrange. Contested by D'Angelo Ingram (4.9 feet, MAN). JOHN QUICKLEY MAKES IT!
Score: 25-21

[01:51] Team_091 possession (Score: 25-21)
Isaiah Siakam drives, Jaren Dosunmu stays with him. Isaiah Siakam attempts a Layup. Wide open! Jaren Dosunmu is 7.2 feet away. [MAN] ISAIAH SIAKAM MAKES IT! Assist: Rudy Bridges
Score: 25-23

[01:39] Team_007 possession (Score: 25-23)
John Quickley attempts a Layup. Contested by Kevin Simons (3.4 feet, ZONE). John Quickley misses. Rebound secured by Kevin Simons.

[01:25] Team_091 possession (Score: 25-23)
Isaiah Siakam attempts a Layup. Contested by John Quickley (3.3 feet, ZONE). Isaiah Siakam misses. Rebound secured by Carmelo Siakam.

[01:11] Team_007 possession (Score: 25-23)
Jaren Dosunmu drives, Kevin Simons stays with him. Jaren Dosunmu attempts a Layup. Contested by Kevin Simons (2.9 feet, ZONE). JAREN DOSUNMU MAKES IT! Assist: Bones Siakam
Score: 27-23

[00:53] Team_091 possession (Score: 27-23)
Kyrie Rozier attempts a 3Pt. Wide open! Tobias Johnson is 6.7 feet away. [MAN] Kyrie Rozier misses. Rebound secured by Carmelo Siakam.

[00:40] Team_007 possession (Score: 27-23)
Tobias Johnson attempts a Midrange. Wide open! Kyrie Rozier is 6.6 feet away. [MAN] TOBIAS JOHNSON MAKES IT!
Score: 29-23

[00:25] Team_091 possession (Score: 29-23)
D'Angelo Ingram makes the Layup and draws the foul on John Quickley! And-1! D'Angelo Ingram to the line for 1. [BONUS: 8 team fouls] (John Quickley: 2 personal fouls)   FT 1/1: GOOD D'Angelo Ingram makes 1/1 from the line.
Score: 29-26

[00:11] Team_007 possession (Score: 29-26)
John Quickley attempts a Layup. Heavily contested by D'Angelo Ingram (2.0 feet, MAN)! JOHN QUICKLEY MAKES IT!
Score: 31-26

================================================================================
                              1ST QUARTER COMPLETE                              
================================================================================

1ST QUARTER SCORE: Team_007 31, Team_091 26

BOX SCORE:
================================================================================

Team_007
--------------------------------------------------------------------------------
Player                MIN  PTS  REB  AST  TO      FG   FG%      3P   3P%
--------------------------------------------------------------------------------
Jaren Dosunmu          12   10    0    0   0   5/6    83.3     0/0   0.0
Bones Siakam           12    6    3    1   0   2/4    50.0     0/0   0.0
John Quickley          12    6    2    1   0   3/5    60.0     0/0   0.0
Carmelo Siakam         12    5    5    2   0   2/3    66.7     0/0   0.0
Tobias Johnson         12    4    0    2   0   2/4    50.0     0/0   0.0

TEAM: FG: 14/22 (63.6%), 3PT: 2/3 (66.7%), REB: 9 (0 off, 9 def), AST: 6, TO: 2
TEAM FOULS: 8 [Team_091 in BONUS]


Team_091
--------------------------------------------------------------------------------
Player                MIN  PTS  REB  AST  TO      FG   FG%      3P   3P%
--------------------------------------------------------------------------------
Kyrie Rozier           12   10    3    0   0   4/8    50.0     0/0   0.0
D'Angelo Ingram        12    8    0    1   0   3/5    60.0     0/0   0.0
Isaiah Siakam          12    4    0    1   0   2/5    40.0     0/0   0.0
Rudy Bridges           12    4    0    2   0   2/3    66.7     0/0   0.0
Kevin Simons           12    0    5    1   0   0/0     0.0     0/0   0.0

TEAM: FG: 11/21 (52.4%), 3PT: 2/9 (22.2%), REB: 9 (1 off, 8 def), AST: 5, TO: 2
TEAM FOULS: 4

================================================================================

================================================================================
                       2ND QUARTER - Team_007 vs Team_091                       
================================================================================

[12:00] Team_007 possession (Score: 31-26)
John Quickley drives to the basket... John Quickley throws a bad pass! Stolen by Kevin Simons! TURNOVER! (live ball)

[11:43] Team_091 possession (Score: 31-26)
Kevin Simons attempts a Layup. Wide open! Carmelo Siakam is 7.5 feet away. [ZONE] KEVIN SIMONS MAKES IT! Assist: D'Angelo Ingram
Score: 31-28

[11:31] Team_007 possession (Score: 31-28)
John Quickley loses the ball! Stripped by D'Angelo Ingram! TURNOVER! (live ball)

[11:17] Team_091 possession (Score: 31-28)
Rudy Bridges attempts a Layup. Contested by Bones Siakam (3.3 feet, MAN). Rudy Bridges misses. Rebound secured by John Quickley.

[11:04] Team_007 possession (Score: 31-28)
Carmelo Siakam drives to the basket... Carmelo Siakam loses the ball! Stripped by Kevin Simons! TURNOVER! (live ball)

[10:47] Team_091 possession (Score: 31-28)
Kyrie Rozier drives to the basket... Kyrie Rozier commits a violation (traveling/carry)! TURNOVER! (dead ball)

[10:47] Substitution (Team_007): Tobias Johnson OUT → Wendell Poole IN (stamina_rule2)

[10:47] Substitution (Team_007): Jaren Dosunmu OUT → OG Porzingis IN (stamina_rule2)

[10:47] Substitution (Team_007): Bones Siakam OUT → Gary LaVine IN (stamina_rule2)

[10:47] Substitution (Team_007): John Quickley OUT → Austin Simons IN (stamina_rule2)

[10:47] Substitution (Team_007): Carmelo Siakam OUT → Draymond Harris IN (stamina_rule2)

[10:47] Substitution (Team_091): Kyrie Rozier OUT → Karl Morant IN (stamina_rule2)

[10:47] Substitution (Team_091): Isaiah Siakam OUT → Julius Barnes IN (stamina_rule2)

[10:47] Substitution (Team_091): Rudy Bridges OUT → Tim Antetokounmpo IN (stamina_rule2)

[10:47] Substitution (Team_091): D'Angelo Ingram OUT → Zion Mitchell IN (stamina_rule2)

[10:47] Substitution (Team_091): Kevin Simons OUT → Ja George IN (stamina_rule2)

[10:34] Team_007 possession (Score: 31-28)
FOUL! Reach-in foul on Ja George during the drive. [Team fouls: 1] No free throws, side out. (Ja George: 1 personal fouls)

[10:20] Team_007 possession (Score: 31-28)
Gary LaVine attempts a Midrange. Contested by Karl Morant (2.0 feet, ZONE). GARY LAVINE MAKES IT!
Score: 33-28

[10:03] Team_091 possession (Score: 33-28)
Zion Mitchell drives, Austin Simons stays with him. Zion Mitchell attempts a Layup. Contested by Austin Simons (2.8 feet, ZONE). ZION MITCHELL MAKES IT!
Score: 33-30

[09:49] Team_007 possession (Score: 33-30)
Gary LaVine attempts a 3Pt. Wide open! Tim Antetokounmpo is 7.7 feet away. [MAN] Gary LaVine misses. FOUL! Loose ball foul on Ja George during the rebound battle. [Team fouls: 2] No free throws, side out. (Ja George: 2 personal fouls)

[09:30] Team_007 possession (Score: 33-30)
Gary LaVine attempts a Midrange. Contested by Tim Antetokounmpo (4.3 feet, MAN). GARY LAVINE MAKES IT! Assist: OG Porzingis
Score: 35-30

[09:15] Team_091 possession (Score: 35-30)
Karl Morant attempts a Midrange. Wide open! Wendell Poole is 6.5 feet away. [MAN] KARL MORANT MAKES IT! Assist: Tim Antetokounmpo
Score: 35-32

[09:00] Team_007 possession (Score: 35-32)
FOUL! Holding foul on Karl Morant. [Team fouls: 3] No free throws, side out. (Karl Morant: 1 personal fouls)

[08:46] Team_007 possession (Score: 35-32)
Austin Simons makes the Layup and draws the foul on Zion Mitchell! And-1! Austin Simons to the line for 1. [Team fouls: 4] (Zion Mitchell: 1 personal fouls)   FT 1/1: GOOD Austin Simons makes 1/1 from the line.
Score: 38-32

[08:31] Team_091 possession (Score: 38-32)
Tim Antetokounmpo drives and kicks out. Tim Antetokounmpo attempts a Midrange. Contested by Gary LaVine (4.3 feet, MAN). Tim Antetokounmpo misses. FOUL! Loose ball foul on Gary LaVine during the rebound battle. [Team fouls: 1] No free throws, side out. (Gary LaVine: 1 personal fouls)

[08:20] Team_091 possession (Score: 38-32)
Karl Morant attempts a 3Pt. Wide open! Wendell Poole is 6.4 feet away. [MAN] Karl Morant misses. Rebound secured by Gary LaVine.

[08:08] Team_007 possession (Score: 38-32)
Austin Simons drives, Zion Mitchell stays with him. Austin Simons attempts a Layup. Wide open! Zion Mitchell is 8.3 feet away. [ZONE] AUSTIN SIMONS MAKES IT!
Score: 40-32

[07:58] Team_091 possession (Score: 40-32)
Julius Barnes attempts a Midrange. Contested by OG Porzingis (2.4 feet, MAN). Julius Barnes misses. Rebound secured by Austin Simons.

[07:41] Team_007 possession (Score: 40-32)
Draymond Harris drives to the basket... FOUL! Offensive foul on Draymond Harris! Zion Mitchell drew the charge! [Team fouls: 2] (Draymond Harris: 1 personal fouls) TURNOVER! (dead ball)

[07:23] Team_091 possession (Score: 40-32)
Julius Barnes attempts a Midrange. Contested by Gary LaVine (4.9 feet, ZONE). JULIUS BARNES MAKES IT! Assist: Karl Morant
Score: 40-34

[07:07] Team_007 possession (Score: 40-34)
Gary LaVine makes the Layup and draws the foul on Zion Mitchell! And-1! Gary LaVine to the line for 1. [BONUS: 5 team fouls] (Zion Mitchell: 2 personal fouls)   FT 1/1: GOOD Gary LaVine makes 1/1 from the line.
Score: 43-34

[06:53] Team_091 possession (Score: 43-34)
Tim Antetokounmpo attempts a Layup. Contested by Gary LaVine (3.4 feet, MAN). TIM ANTETOKOUNMPO MAKES IT! Assist: Zion Mitchell
Score: 43-36

[06:37] Team_007 possession (Score: 43-36)
Wendell Poole drives and kicks out. OG Porzingis attempts a 3Pt. Contested by Julius Barnes (4.0 feet, MAN). OG Porzingis misses. Rebound secured by Ja George.

[06:23] Team_091 possession (Score: 43-36)
Ja George throws a bad pass out of bounds! TURNOVER! (dead ball)

[06:07] Team_007 possession (Score: 43-36)
Austin Simons attempts a Layup. Wide open! Zion Mitchell is 7.2 feet away. [ZONE] AUSTIN SIMONS MAKES IT! Assist: Draymond Harris
Score: 45-36

[05:49] Team_091 possession (Score: 45-36)
Karl Morant drives, Wendell Poole stays with him. Karl Morant attempts a Dunk. Contested by Wendell Poole (5.2 feet, MAN). KARL MORANT MAKES IT! Assist: Tim Antetokounmpo
Score: 45-38

[05:33] Team_007 possession (Score: 45-38)
OG Porzingis drives and kicks out. Draymond Harris attempts a Midrange. Contested by Ja George (5.9 feet, ZONE). Draymond Harris misses. Rebound secured by Zion Mitchell.

[05:18] Team_091 possession (Score: 45-38)
Karl Morant attempts a 3Pt. Contested by Wendell Poole (4.8 feet, MAN). Karl Morant misses. Rebound secured by Gary LaVine.

[05:02] Team_007 possession (Score: 45-38)
Draymond Harris attempts a Layup. BLOCKED BY JA GEORGE! Ball is loose! Rebound secured by Tim Antetokounmpo.

[04:48] Team_091 possession (Score: 45-38)
Zion Mitchell attempts a 3Pt. Wide open! OG Porzingis is 6.5 feet away. [ZONE] Zion Mitchell misses. Offensive rebound by Ja George! Ja George kicks it out.

[04:29] Team_091 possession (Score: 45-38)
Julius Barnes loses the ball! Stripped by OG Porzingis! TURNOVER! (live ball)

[04:13] Team_007 possession (Score: 45-38)
Gary LaVine attempts a 3Pt. Contested by Karl Morant (4.1 feet, ZONE). Gary LaVine misses. Rebound secured by Zion Mitchell.

[03:58] Team_091 possession (Score: 45-38)
FOUL! Reach-in foul on OG Porzingis during the drive. [Team fouls: 3] No free throws, side out. (OG Porzingis: 1 personal fouls)

[03:47] Team_091 possession (Score: 45-38)
Ja George drives and kicks out. Ja George attempts a Midrange. Wide open! Draymond Harris is 6.2 feet away. [MAN] JA GEORGE MAKES IT!
Score: 45-40

[03:36] Team_007 possession (Score: 45-40)
Austin Simons makes the Dunk and draws the foul on Karl Morant! And-1! Austin Simons to the line for 1. [BONUS: 6 team fouls] (Karl Morant: 2 personal fouls)   FT 1/1: GOOD Austin Simons makes 1/1 from the line.
Score: 48-40

[03:21] Team_091 possession (Score: 48-40)
Karl Morant drives, picks up Wendell Poole. Help arrives from OG Porzingis! Karl Morant attempts a Layup. Contested by OG Porzingis (3.6 feet, MAN). KARL MORANT MAKES IT!
Score: 48-42

[03:08] Team_007 possession (Score: 48-42)
Austin Simons attempts a Layup. Contested by Zion Mitchell (3.3 feet, ZONE). AUSTIN SIMONS MAKES IT!
Score: 50-42

[02:51] Team_091 possession (Score: 50-42)
Julius Barnes attempts a 3Pt. Wide open! OG Porzingis is 8.1 feet away. [MAN] Julius Barnes misses. Offensive rebound by Ja George! Ja George kicks it out.

[02:40] Team_091 possession (Score: 50-42)
Julius Barnes throws a bad pass out of bounds! TURNOVER! (dead ball)

[02:22] Team_007 possession (Score: 50-42)
Gary LaVine attempts a 3Pt. Contested by Karl Morant (4.8 feet, ZONE). Gary LaVine misses. Rebound secured by Tim Antetokounmpo.

[02:07] Team_091 possession (Score: 50-42)
Karl Morant attempts a 3Pt. Contested by Wendell Poole (3.7 feet, MAN). Karl Morant misses. Offensive rebound by Ja George! Ja George kicks it out.

[01:57] Team_091 possession (Score: 50-42)
Zion Mitchell attempts a 3Pt. Contested by Austin Simons (3.3 feet, MAN). Zion Mitchell misses. FOUL! Loose ball foul on Austin Simons during the rebound battle. [Team fouls: 4] No free throws, side out. (Austin Simons: 1 personal fouls)

[01:38] Team_091 possession (Score: 50-42)
Ja George drives to the basket... FOUL! Offensive foul on Ja George! Draymond Harris drew the charge! [Team fouls: 7] (Ja George: 3 personal fouls) TURNOVER! (dead ball)

[01:28] Team_007 possession (Score: 50-42)
OG Porzingis drives and kicks out. Austin Simons attempts a 3Pt. Heavily contested by Karl Morant (0.7 feet, ZONE)! AUSTIN SIMONS MAKES IT! Assist: OG Porzingis
Score: 53-42

[01:14] Team_091 possession (Score: 53-42)
FOUL! Reach-in foul on Austin Simons during the drive. [IN THE BONUS! 5 team fouls] Zion Mitchell to the line for 2 free throws. (Austin Simons: 2 personal fouls)   FT 1/2: GOOD   FT 2/2: GOOD Zion Mitchell makes 2/2 from the line.
Score: 53-44

[01:01] Team_007 possession (Score: 53-44)
FOUL! Holding foul on Zion Mitchell. [IN THE BONUS! 8 team fouls] Austin Simons to the line for 2 free throws. (Zion Mitchell: 3 personal fouls)   FT 1/2: GOOD   FT 2/2: MISS Austin Simons makes 1/2 from the line. Rebound secured by Zion Mitchell.
Score: 54-44

[00:47] Team_091 possession (Score: 54-44)
Zion Mitchell attempts a Layup. Contested by Austin Simons (2.2 feet, ZONE). Zion Mitchell misses. Offensive rebound by Zion Mitchell! Zion Mitchell kicks it out.

[00:34] Team_091 possession (Score: 54-44)
Zion Mitchell drives to the basket... Zion Mitchell commits a violation (traveling/carry)! TURNOVER! (dead ball)

[00:19] Team_007 possession (Score: 54-44)
Wendell Poole attempts a 3Pt. Contested by Karl Morant (3.3 feet, ZONE). WENDELL POOLE MAKES IT! Assist: Gary LaVine
Score: 57-44

[00:10] Team_091 possession (Score: 57-44)
Zion Mitchell drives, Austin Simons stays with him. Zion Mitchell attempts a Dunk. Contested by Austin Simons (3.8 feet, ZONE). ZION MITCHELL MAKES IT!
Score: 57-46

================================================================================
                              2ND QUARTER COMPLETE                              
================================================================================

2ND QUARTER SCORE: Team_007 26, Team_091 20

BOX SCORE:
================================================================================

Team_007
--------------------------------------------------------------------------------
Player                MIN  PTS  REB  AST  TO      FG   FG%      3P   3P%
--------------------------------------------------------------------------------
Austin Simons          11   15    1    0   0   6/6   100.0     0/0   0.0
Gary LaVine            11    7    2    1   0   3/5    60.0     0/0   0.0
Wendell Poole          11    3    0    0   0   1/2    50.0     0/0   0.0
John Quickley          13    0    1    0   0   0/0     0.0     0/0   0.0
Draymond Harris        11    0    1    1   0   0/1     0.0     0/0   0.0
OG Porzingis           11    0    0    2   0   0/1     0.0     0/0   0.0

TEAM: FG: 10/16 (62.5%), 3PT: 1/3 (33.3%), REB: 5 (1 off, 4 def), AST: 4, TO: 4
TEAM FOULS: 5 [Team_091 in BONUS]


Team_091
--------------------------------------------------------------------------------
Player                MIN  PTS  REB  AST  TO      FG   FG%      3P   3P%
--------------------------------------------------------------------------------
Zion Mitchell          11    6    6    1   0   3/3   100.0     0/0   0.0
Karl Morant            11    6    0    1   0   3/5    60.0     0/0   0.0
Kevin Simons           13    2    0    0   0   1/1   100.0     0/0   0.0
Tim Antetokounmpo      11    2    2    2   0   1/1   100.0     0/0   0.0
Julius Barnes          11    2    0    0   0   1/2    50.0     0/0   0.0
Ja George              11    2    4    0   0   1/1   100.0     0/0   0.0
D'Angelo Ingram        13    0    0    1   0   0/0     0.0     0/0   0.0
Rudy Bridges           13    0    0    0   0   0/1     0.0     0/0   0.0

TEAM: FG: 10/14 (71.4%), 3PT: 0/2 (0.0%), REB: 12 (6 off, 6 def), AST: 5, TO: 6
TEAM FOULS: 8 [Team_007 in BONUS]

================================================================================

================================================================================
                       3RD QUARTER - Team_007 vs Team_091                       
================================================================================

[12:00] Team_007 possession (Score: 57-46)
Tobias Johnson attempts a 3Pt. Contested by Kyrie Rozier (3.1 feet, MAN). Tobias Johnson misses. Offensive rebound by Bones Siakam! Bones Siakam puts it back in!
Score: 59-46

[11:49] Team_091 possession (Score: 59-46)
Kyrie Rozier attempts a Midrange. Contested by Jaren Dosunmu (3.4 feet, ZONE). Kyrie Rozier misses. Offensive rebound by Rudy Bridges! Rudy Bridges kicks it out.

[11:35] Team_091 possession (Score: 59-46)
Rudy Bridges drives and kicks out. Kyrie Rozier attempts a Midrange. Wide open! Jaren Dosunmu is 9.7 feet away. [ZONE] Kyrie Rozier misses. Rebound secured by Bones Siakam.

[11:22] Team_007 possession (Score: 59-46)
Jaren Dosunmu attempts a 3Pt. Wide open! Isaiah Siakam is 7.7 feet away. [MAN] Jaren Dosunmu misses. Rebound secured by Rudy Bridges.

[11:04] Team_091 possession (Score: 59-46)
Isaiah Siakam drives and kicks out. Rudy Bridges attempts a 3Pt. Contested by John Quickley (3.1 feet, ZONE). Rudy Bridges misses. Rebound secured by Bones Siakam.

[10:46] Team_007 possession (Score: 59-46)
John Quickley makes the Midrange and draws the foul on D'Angelo Ingram! And-1! John Quickley to the line for 1. [Team fouls: 1] (D'Angelo Ingram: 1 personal fouls)   FT 1/1: GOOD John Quickley makes 1/1 from the line.
Score: 62-46

[10:29] Team_091 possession (Score: 62-46)
Rudy Bridges attempts a 3Pt. Contested by Bones Siakam (4.8 feet, MAN). Rudy Bridges misses. Rebound secured by Bones Siakam.

[10:10] Team_007 possession (Score: 62-46)
Carmelo Siakam attempts a Midrange. Contested by Kevin Simons (5.3 feet, MAN). Carmelo Siakam misses. Rebound secured by Kyrie Rozier.

[09:56] Team_091 possession (Score: 62-46)
Kevin Simons drives to the basket... Kevin Simons loses control! Ball rolls out of bounds! TURNOVER! (dead ball)

[09:42] Team_007 possession (Score: 62-46)
FOUL! Shooting foul on Kyrie Rozier. Bones Siakam to the line for 3 free throws. [Team fouls: 2] (Kyrie Rozier: 1 personal fouls)   FT 1/3: GOOD   FT 2/3: GOOD   FT 3/3: GOOD Bones Siakam makes 3/3 from the line.
Score: 65-46

[09:28] Team_091 possession (Score: 65-46)
Isaiah Siakam drives, picks up Jaren Dosunmu. Help arrives from Bones Siakam! Isaiah Siakam attempts a Layup. Wide open! Bones Siakam is 6.5 feet away. [MAN] ISAIAH SIAKAM MAKES IT! Assist: D'Angelo Ingram
Score: 65-48

[09:15] Team_007 possession (Score: 65-48)
FOUL! Shooting foul on Rudy Bridges. Jaren Dosunmu to the line for 2 free throws. [Team fouls: 3] (Rudy Bridges: 1 personal fouls)   FT 1/2: GOOD   FT 2/2: GOOD Jaren Dosunmu makes 2/2 from the line.
Score: 67-48

[09:00] Team_091 possession (Score: 67-48)
D'Angelo Ingram drives to the basket... D'Angelo Ingram throws a bad pass! Stolen by John Quickley! TURNOVER! (live ball)

[08:42] Team_007 possession (Score: 67-48)
Jaren Dosunmu attempts a 3Pt. Contested by Isaiah Siakam (3.4 feet, MAN). Jaren Dosunmu misses. Rebound secured by Kyrie Rozier.

[08:26] Team_091 possession (Score: 67-48)
Kyrie Rozier attempts a 3Pt. Contested by Tobias Johnson (4.0 feet, MAN). Kyrie Rozier misses. Rebound secured by Carmelo Siakam.

[08:09] Team_007 possession (Score: 67-48)
Carmelo Siakam attempts a Midrange. Contested by Rudy Bridges (4.0 feet, ZONE). CARMELO SIAKAM MAKES IT!
Score: 69-48

[07:53] Team_091 possession (Score: 69-48)
Kevin Simons attempts a 3Pt. Heavily contested by John Quickley (0.5 feet, MAN)! Kevin Simons misses. Rebound secured by Bones Siakam.

[07:35] Team_007 possession (Score: 69-48)
Bones Siakam attempts a Midrange. Heavily contested by Rudy Bridges (1.6 feet, MAN)! BONES SIAKAM MAKES IT! Assist: Jaren Dosunmu
Score: 71-48

[07:25] Team_091 possession (Score: 71-48)
Rudy Bridges attempts a Layup. Heavily contested by Bones Siakam (0.6 feet, MAN)! Rudy Bridges misses. FOUL! Loose ball foul on John Quickley during the rebound battle. [Team fouls: 1] No free throws, side out. (John Quickley: 1 personal fouls)

[07:13] Team_091 possession (Score: 71-48)
FOUL! Offensive foul on Kevin Simons! John Quickley drew the charge! [Team fouls: 4] (Kevin Simons: 1 personal fouls) TURNOVER! (dead ball)

[06:57] Team_007 possession (Score: 71-48)
John Quickley attempts a Midrange. Contested by D'Angelo Ingram (4.5 feet, MAN). JOHN QUICKLEY MAKES IT!
Score: 73-48

[06:42] Team_091 possession (Score: 73-48)
Kyrie Rozier makes the 3Pt and draws the foul on Tobias Johnson! And-1! Kyrie Rozier to the line for 1. [Team fouls: 2] (Tobias Johnson: 1 personal fouls)   FT 1/1: GOOD Kyrie Rozier makes 1/1 from the line.
Score: 73-52

[06:28] Team_007 possession (Score: 73-52)
John Quickley makes the Layup and draws the foul on D'Angelo Ingram! And-1! John Quickley to the line for 1. [BONUS: 5 team fouls] (D'Angelo Ingram: 2 personal fouls)   FT 1/1: GOOD John Quickley makes 1/1 from the line.
Score: 76-52

[06:13] Team_091 possession (Score: 76-52)
FOUL! Offensive foul on D'Angelo Ingram! John Quickley drew the charge! [Team fouls: 6] (D'Angelo Ingram: 3 personal fouls) TURNOVER! (dead ball)

[05:54] Team_007 possession (Score: 76-52)
John Quickley drives, D'Angelo Ingram stays with him. John Quickley attempts a Dunk. Wide open! D'Angelo Ingram is 6.8 feet away. [MAN] John Quickley misses. Rebound secured by Kyrie Rozier.

[05:36] Team_091 possession (Score: 76-52)
Rudy Bridges attempts a Midrange. Contested by John Quickley (5.3 feet, ZONE). Rudy Bridges misses. Rebound secured by Carmelo Siakam.

[05:20] Team_007 possession (Score: 76-52)
FOUL! Offensive foul on Bones Siakam! Rudy Bridges drew the charge! [Team fouls: 3] (Bones Siakam: 1 personal fouls) TURNOVER! (dead ball)

[05:07] Team_091 possession (Score: 76-52)
D'Angelo Ingram drives, John Quickley stays with him. D'Angelo Ingram attempts a Layup. Contested by John Quickley (2.4 feet, ZONE). D'Angelo Ingram misses. Offensive rebound by Rudy Bridges! Rudy Bridges kicks it out.

[04:55] Team_091 possession (Score: 76-52)
FOUL! Reach-in foul on Jaren Dosunmu during the drive. [Team fouls: 4] No free throws, side out. (Jaren Dosunmu: 1 personal fouls)

[04:41] Team_091 possession (Score: 76-52)
Rudy Bridges makes the Layup and draws the foul on Jaren Dosunmu! And-1! Rudy Bridges to the line for 1. [BONUS: 5 team fouls] (Jaren Dosunmu: 2 personal fouls)   FT 1/1: GOOD Rudy Bridges makes 1/1 from the line.
Score: 76-55

[04:23] Team_007 possession (Score: 76-55)
Tobias Johnson attempts a 3Pt. Contested by Kyrie Rozier (3.7 feet, MAN). Tobias Johnson misses. Rebound secured by Rudy Bridges.

[04:09] Team_091 possession (Score: 76-55)
Rudy Bridges attempts a Midrange. Contested by John Quickley (4.6 feet, ZONE). RUDY BRIDGES MAKES IT! Assist: D'Angelo Ingram
Score: 76-57

[03:55] Team_007 possession (Score: 76-57)
Carmelo Siakam drives to the basket... Carmelo Siakam loses control! Ball rolls out of bounds! TURNOVER! (dead ball)

[03:40] Team_091 possession (Score: 76-57)
Kevin Simons drives, John Quickley stays with him. Kevin Simons attempts a Dunk. Wide open! John Quickley is 6.1 feet away. [ZONE] KEVIN SIMONS MAKES IT! Assist: Rudy Bridges
Score: 76-59

[03:26] Team_007 possession (Score: 76-59)
Tobias Johnson attempts a 3Pt. Heavily contested by Kyrie Rozier (0.5 feet, ZONE)! Tobias Johnson misses. Rebound secured by Rudy Bridges.

[03:12] Team_091 possession (Score: 76-59)
Kevin Simons drives, John Quickley stays with him. Kevin Simons attempts a Dunk. Contested by John Quickley (3.5 feet, ZONE). KEVIN SIMONS MAKES IT!
Score: 76-61

[02:55] Team_007 possession (Score: 76-61)
Bones Siakam attempts a Layup. Heavily contested by Rudy Bridges (1.6 feet, MAN)! Bones Siakam misses. Rebound secured by Kevin Simons.

[02:38] Team_091 possession (Score: 76-61)
D'Angelo Ingram attempts a Midrange. Contested by John Quickley (5.5 feet, ZONE). D'Angelo Ingram misses. Offensive rebound by Rudy Bridges! Rudy Bridges kicks it out.

[02:23] Team_091 possession (Score: 76-61)
D'Angelo Ingram throws a bad pass! Stolen by John Quickley! TURNOVER! (live ball)

[02:08] Team_007 possession (Score: 76-61)
Jaren Dosunmu attempts a 3Pt. Wide open! Isaiah Siakam is 6.1 feet away. [MAN] Jaren Dosunmu misses. Rebound secured by Kevin Simons.

[01:51] Team_091 possession (Score: 76-61)
D'Angelo Ingram drives to the basket... FOUL! Offensive foul on D'Angelo Ingram! John Quickley drew the charge! [Team fouls: 7] (D'Angelo Ingram: 4 personal fouls) TURNOVER! (dead ball)

[01:37] Team_007 possession (Score: 76-61)
Carmelo Siakam makes the Layup and draws the foul on Kevin Simons! And-1! Carmelo Siakam to the line for 1. [BONUS: 8 team fouls] (Kevin Simons: 2 personal fouls)   FT 1/1: GOOD Carmelo Siakam makes 1/1 from the line.
Score: 79-61

[01:24] Team_091 possession (Score: 79-61)
Isaiah Siakam drives and kicks out. Kevin Simons makes the 3Pt and draws the foul on Jaren Dosunmu! And-1! Kevin Simons to the line for 1. [BONUS: 6 team fouls] (Jaren Dosunmu: 3 personal fouls)   FT 1/1: GOOD Kevin Simons makes 1/1 from the line.
Score: 79-65

[01:14] Team_007 possession (Score: 79-65)
John Quickley drives, D'Angelo Ingram stays with him. John Quickley attempts a Dunk. Wide open! D'Angelo Ingram is 6.3 feet away. [MAN] JOHN QUICKLEY MAKES IT!
Score: 81-65

[01:03] Team_091 possession (Score: 81-65)
D'Angelo Ingram attempts a Midrange. Contested by John Quickley (5.9 feet, MAN). D'ANGELO INGRAM MAKES IT!
Score: 81-67

[00:47] Team_007 possession (Score: 81-67)
FOUL! Shooting foul on Kevin Simons. Carmelo Siakam to the line for 3 free throws. [BONUS: 9 team fouls] (Kevin Simons: 3 personal fouls)   FT 1/3: GOOD   FT 2/3: GOOD   FT 3/3: GOOD Carmelo Siakam makes 3/3 from the line.
Score: 84-67

[00:33] Team_091 possession (Score: 84-67)
D'Angelo Ingram attempts a 3Pt. Wide open! John Quickley is 7.4 feet away. [ZONE] D'Angelo Ingram misses. Rebound secured by Carmelo Siakam.

[00:20] Team_007 possession (Score: 84-67)
Tobias Johnson attempts a 3Pt. BLOCKED BY KYRIE ROZIER! Ball is loose! Rebound secured by Kevin Simons.

[00:08] Team_091 possession (Score: 84-67)
Rudy Bridges drives, John Quickley stays with him. Rudy Bridges attempts a Layup. Heavily contested by John Quickley (1.9 feet, ZONE)! RUDY BRIDGES MAKES IT!
Score: 84-69

================================================================================
                              3RD QUARTER COMPLETE                              
================================================================================

3RD QUARTER SCORE: Team_007 27, Team_091 23

BOX SCORE:
================================================================================

Team_007
--------------------------------------------------------------------------------
Player                MIN  PTS  REB  AST  TO      FG   FG%      3P   3P%
--------------------------------------------------------------------------------
John Quickley          26   10    0    0   0   4/5    80.0     0/0   0.0
Carmelo Siakam         26    8    3    0   0   3/4    75.0     0/0   0.0
Bones Siakam           26    7    5    0   0   3/4    75.0     0/0   0.0
Jaren Dosunmu          26    2    0    1   0   1/4    25.0     0/0   0.0
Tobias Johnson         26    0    0    0   0   0/3     0.0     0/0   0.0

TEAM: FG: 11/20 (55.0%), 3PT: 3/9 (33.3%), REB: 8 (1 off, 7 def), AST: 1, TO: 2
TEAM FOULS: 6 [Team_091 in BONUS]


Team_091
--------------------------------------------------------------------------------
Player                MIN  PTS  REB  AST  TO      FG   FG%      3P   3P%
--------------------------------------------------------------------------------
Kevin Simons           26    8    3    0   0   3/4    75.0     0/0   0.0
Rudy Bridges           26    7    7    1   0   3/6    50.0     0/0   0.0
Kyrie Rozier           26    4    3    0   0   1/2    50.0     0/0   0.0
Isaiah Siakam          26    2    0    0   0   1/2    50.0     0/0   0.0
D'Angelo Ingram        26    2    0    2   0   1/2    50.0     0/0   0.0

TEAM: FG: 9/16 (56.2%), 3PT: 1/5 (20.0%), REB: 13 (4 off, 9 def), AST: 3, TO: 6
TEAM FOULS: 9 [Team_007 in BONUS]

================================================================================

================================================================================
                       4TH QUARTER - Team_007 vs Team_091                       
================================================================================

[12:00] Team_007 possession (Score: 84-69)
Jaren Dosunmu attempts a Layup. Contested by Isaiah Siakam (5.0 feet, MAN). Jaren Dosunmu misses. Rebound secured by Rudy Bridges.

[11:45] Team_091 possession (Score: 84-69)
Kevin Simons attempts a 3Pt. Wide open! John Quickley is 6.7 feet away. [MAN] KEVIN SIMONS MAKES IT! Assist: Rudy Bridges
Score: 84-72

[11:29] Team_007 possession (Score: 84-72)
Bones Siakam attempts a Midrange. Wide open! Rudy Bridges is 9.1 feet away. [MAN] Bones Siakam misses. FOUL! Loose ball foul on Rudy Bridges during the rebound battle. [Team fouls: 1] No free throws, side out. (Rudy Bridges: 1 personal fouls)

[11:15] Team_007 possession (Score: 84-72)
Tobias Johnson throws a bad pass! Stolen by Kyrie Rozier! TURNOVER! (live ball)

[10:58] Team_091 possession (Score: 84-72)
Kevin Simons attempts a 3Pt. Contested by John Quickley (5.4 feet, MAN). Kevin Simons misses. Offensive rebound by Kevin Simons! Kevin Simons puts it back in!
Score: 84-74

[10:40] Team_007 possession (Score: 84-74)
Bones Siakam drives to the basket... Bones Siakam throws a bad pass out of bounds! TURNOVER! (dead ball)

[10:40] Substitution (Team_007): Tobias Johnson OUT → Wendell Poole IN (stamina_rule2)

[10:40] Substitution (Team_007): Jaren Dosunmu OUT → OG Porzingis IN (stamina_rule2)

[10:40] Substitution (Team_007): Bones Siakam OUT → Gary LaVine IN (stamina_rule2)

[10:40] Substitution (Team_007): John Quickley OUT → Austin Simons IN (stamina_rule2)

[10:40] Substitution (Team_007): Carmelo Siakam OUT → Draymond Harris IN (stamina_rule2)

[10:40] Substitution (Team_091): Kyrie Rozier OUT → Karl Morant IN (stamina_rule2)

[10:40] Substitution (Team_091): Isaiah Siakam OUT → Julius Barnes IN (stamina_rule2)

[10:40] Substitution (Team_091): Rudy Bridges OUT → Tim Antetokounmpo IN (stamina_rule2)

[10:40] Substitution (Team_091): D'Angelo Ingram OUT → Zion Mitchell IN (stamina_rule2)

[10:40] Substitution (Team_091): Kevin Simons OUT → Ja George IN (stamina_rule2)

[10:28] Team_091 possession (Score: 84-74)
Karl Morant attempts a 3Pt. Wide open! OG Porzingis is 7.0 feet away. [ZONE] Karl Morant misses. Rebound secured by Gary LaVine.

[10:12] Team_007 possession (Score: 84-74)
Gary LaVine attempts a Midrange. Contested by Tim Antetokounmpo (3.8 feet, MAN). Gary LaVine misses. Rebound secured by Zion Mitchell.

[09:59] Team_091 possession (Score: 84-74)
Ja George attempts a Midrange. Heavily contested by Draymond Harris (1.2 feet, MAN)! JA GEORGE MAKES IT!
Score: 84-76

[09:46] Team_007 possession (Score: 84-76)
Austin Simons drives to the basket... Austin Simons throws a bad pass out of bounds! TURNOVER! (dead ball)

[09:31] Team_091 possession (Score: 84-76)
Julius Barnes makes the Layup and draws the foul on Gary LaVine! And-1! Julius Barnes to the line for 1. [Team fouls: 1] (Gary LaVine: 1 personal fouls)   FT 1/1: MISS Julius Barnes makes 0/1 from the line. Rebound secured by Gary LaVine.
Score: 84-78

[09:12] Team_007 possession (Score: 84-78)
Draymond Harris drives and kicks out. Austin Simons attempts a 3Pt. Wide open! Karl Morant is 8.6 feet away. [ZONE] Austin Simons misses. Offensive rebound by Draymond Harris! Draymond Harris kicks it out.

[08:59] Team_007 possession (Score: 84-78)
Austin Simons attempts a Midrange. Wide open! Tim Antetokounmpo is 7.5 feet away. [ZONE] AUSTIN SIMONS MAKES IT!
Score: 86-78

[08:49] Team_091 possession (Score: 86-78)
Tim Antetokounmpo attempts a Layup. Contested by Gary LaVine (4.0 feet, MAN). TIM ANTETOKOUNMPO MAKES IT! Assist: Julius Barnes
Score: 86-80

[08:36] Team_007 possession (Score: 86-80)
Draymond Harris drives to the basket... Draymond Harris loses control! Ball rolls out of bounds! TURNOVER! (dead ball)

[08:18] Team_091 possession (Score: 86-80)
Karl Morant drives and kicks out. Ja George attempts a 3Pt. Heavily contested by Austin Simons (1.0 feet, ZONE)! Ja George misses. Rebound secured by Draymond Harris.

[08:03] Team_007 possession (Score: 86-80)
Austin Simons attempts a Midrange. Wide open! Zion Mitchell is 6.8 feet away. [MAN] AUSTIN SIMONS MAKES IT! Assist: Wendell Poole
Score: 88-80

[07:46] Team_091 possession (Score: 88-80)
Tim Antetokounmpo attempts a 3Pt. Contested by OG Porzingis (2.1 feet, ZONE). Tim Antetokounmpo misses. Rebound secured by Draymond Harris.

[07:28] Team_007 possession (Score: 88-80)
Wendell Poole attempts a Midrange. Wide open! Karl Morant is 7.1 feet away. [MAN] WENDELL POOLE MAKES IT! Assist: Austin Simons
Score: 90-80

[07:18] Team_091 possession (Score: 90-80)
Ja George makes the Dunk and draws the foul on OG Porzingis! And-1! Ja George to the line for 1. [Team fouls: 2] (OG Porzingis: 1 personal fouls)   FT 1/1: GOOD Ja George makes 1/1 from the line.
Score: 90-83

[07:03] Team_007 possession (Score: 90-83)
Austin Simons drives, Zion Mitchell stays with him. Austin Simons attempts a Layup. Wide open! Zion Mitchell is 7.5 feet away. [MAN] AUSTIN SIMONS MAKES IT!
Score: 92-83

[06:49] Team_091 possession (Score: 92-83)
Julius Barnes attempts a 3Pt. Heavily contested by OG Porzingis (1.0 feet, MAN)! JULIUS BARNES MAKES IT! Assist: Tim Antetokounmpo
Score: 92-86

[06:39] Team_007 possession (Score: 92-86)
Wendell Poole attempts a 3Pt. Contested by Karl Morant (4.9 feet, MAN). Wendell Poole misses. FOUL! Loose ball foul on Tim Antetokounmpo during the rebound battle. [Team fouls: 2] No free throws, side out. (Tim Antetokounmpo: 1 personal fouls)

[06:22] Team_007 possession (Score: 92-86)
Draymond Harris attempts a Midrange. Contested by Ja George (5.2 feet, MAN). Draymond Harris misses. Rebound secured by Tim Antetokounmpo.

[06:06] Team_091 possession (Score: 92-86)
FOUL! Holding foul on Wendell Poole. [Team fouls: 3] No free throws, side out. (Wendell Poole: 1 personal fouls)

[05:49] Team_091 possession (Score: 92-86)
Tim Antetokounmpo attempts a 3Pt. Contested by Gary LaVine (5.8 feet, MAN). Tim Antetokounmpo misses. Offensive rebound by Zion Mitchell! Zion Mitchell kicks it out.

[05:34] Team_091 possession (Score: 92-86)
Julius Barnes attempts a 3Pt. Contested by OG Porzingis (5.0 feet, ZONE). Julius Barnes misses. Rebound secured by Draymond Harris.

[05:17] Team_007 possession (Score: 92-86)
OG Porzingis attempts a 3Pt. Contested by Julius Barnes (3.8 feet, MAN). OG Porzingis misses. Offensive rebound by Austin Simons! Austin Simons puts it back in!
Score: 94-86

[05:04] Team_091 possession (Score: 94-86)
FOUL! Shooting foul on Austin Simons. Zion Mitchell to the line for 2 free throws. [Team fouls: 4] (Austin Simons: 1 personal fouls)   FT 1/2: GOOD   FT 2/2: GOOD Zion Mitchell makes 2/2 from the line.
Score: 94-88

[04:52] Team_007 possession (Score: 94-88)
Draymond Harris attempts a 3Pt. Heavily contested by Karl Morant (1.7 feet, ZONE)! Draymond Harris misses. Rebound secured by Zion Mitchell.

[04:39] Team_091 possession (Score: 94-88)
Zion Mitchell makes the Layup and draws the foul on Austin Simons! And-1! Zion Mitchell to the line for 1. [BONUS: 5 team fouls] (Austin Simons: 2 personal fouls)   FT 1/1: GOOD Zion Mitchell makes 1/1 from the line.
Score: 94-91

[04:23] Team_007 possession (Score: 94-91)
Austin Simons attempts a 3Pt. Wide open! Karl Morant is 8.2 feet away. [ZONE] Austin Simons misses. Rebound secured by Ja George.

[04:05] Team_091 possession (Score: 94-91)
Karl Morant attempts a Layup. BLOCKED BY AUSTIN SIMONS! Ball deflects out of bounds off Karl Morant.

[03:48] Team_007 possession (Score: 94-91)
Wendell Poole attempts a 3Pt. Wide open! Karl Morant is 8.3 feet away. [MAN] Wendell Poole misses. Offensive rebound by Austin Simons! Austin Simons puts it back in!
Score: 96-91

[03:29] Team_091 possession (Score: 96-91)
Julius Barnes drives, picks up Austin Simons. Help arrives from OG Porzingis! Julius Barnes attempts a Dunk. Contested by OG Porzingis (4.9 feet, ZONE). JULIUS BARNES MAKES IT! Assist: Ja George
Score: 96-93

[03:16] Team_007 possession (Score: 96-93)
Gary LaVine drives to the basket... Gary LaVine loses control! Ball rolls out of bounds! TURNOVER! (dead ball)

[03:01] Team_091 possession (Score: 96-93)
Ja George attempts a 3Pt. Contested by OG Porzingis (3.7 feet, ZONE). JA GEORGE MAKES IT! Assist: Karl Morant
Score: 96-96

[02:45] Team_007 possession (Score: 96-96)
OG Porzingis attempts a 3Pt. Wide open! Karl Morant is 7.4 feet away. [ZONE] OG Porzingis misses. Rebound secured by Ja George.

[02:28] Team_091 possession (Score: 96-96)
Julius Barnes attempts a Midrange. Contested by OG Porzingis (2.8 feet, MAN). Julius Barnes misses. Rebound secured by Austin Simons.

[02:14] Team_007 possession (Score: 96-96)
Gary LaVine attempts a 3Pt. Wide open! Karl Morant is 7.7 feet away. [ZONE] GARY LAVINE MAKES IT!
Score: 99-96

[01:57] Team_091 possession (Score: 99-96)
Julius Barnes attempts a 3Pt. Contested by OG Porzingis (5.4 feet, MAN). Julius Barnes misses. Rebound secured by Draymond Harris.

[01:40] Team_007 possession (Score: 99-96)
OG Porzingis attempts a Midrange. Contested by Julius Barnes (4.2 feet, MAN). OG Porzingis misses. Rebound secured by Ja George.

[01:26] Team_091 possession (Score: 99-96)
Tim Antetokounmpo throws a bad pass out of bounds! TURNOVER! (dead ball)

[01:11] Team_007 possession (Score: 99-96)
Wendell Poole throws a bad pass! Stolen by Karl Morant! TURNOVER! (live ball)

[00:56] Team_091 possession (Score: 99-96)
Julius Barnes drives to the basket... FOUL! Offensive foul on Julius Barnes! Austin Simons drew the charge! [Team fouls: 3] (Julius Barnes: 1 personal fouls) TURNOVER! (dead ball)

[00:39] Team_007 possession (Score: 99-96)
Gary LaVine attempts a Midrange. Contested by Tim Antetokounmpo (3.4 feet, ZONE). GARY LAVINE MAKES IT! Assist: OG Porzingis
Score: 101-96

[00:25] Team_091 possession (Score: 101-96)
Zion Mitchell drives to the basket... FOUL! Offensive foul on Zion Mitchell! Austin Simons drew the charge! [Team fouls: 4] (Zion Mitchell: 1 personal fouls) TURNOVER! (dead ball)

[00:13] Team_007 possession (Score: 101-96)
OG Porzingis attempts a Midrange. Wide open! Julius Barnes is 6.9 feet away. [MAN] OG Porzingis misses. FOUL! Loose ball foul on Tim Antetokounmpo during the rebound battle. [IN THE BONUS! 5 team fouls] Austin Simons to the line for 2 free throws. (Tim Antetokounmpo: 2 personal fouls)   FT 1/2: GOOD   FT 2/2: GOOD Austin Simons makes 2/2 from the line.
Score: 103-96

================================================================================
                              4TH QUARTER COMPLETE                              
================================================================================

4TH QUARTER SCORE: Team_007 19, Team_091 27

BOX SCORE:
================================================================================

Team_007
--------------------------------------------------------------------------------
Player                MIN  PTS  REB  AST  TO      FG   FG%      3P   3P%
--------------------------------------------------------------------------------
Austin Simons          21   12    4    1   0   6/7    85.7     0/0   0.0
Gary LaVine            21    5    2    0   0   2/3    66.7     0/0   0.0
Wendell Poole          21    2    0    1   0   1/1   100.0     0/0   0.0
Jaren Dosunmu          27    0    0    0   0   0/1     0.0     0/0   0.0
Bones Siakam           27    0    1    0   0   0/0     0.0     0/0   0.0
Draymond Harris        21    0    5    0   0   0/2     0.0     0/0   0.0
OG Porzingis           21    0    0    1   0   0/2     0.0     0/0   0.0

TEAM: FG: 9/16 (56.2%), 3PT: 3/6 (50.0%), REB: 12 (5 off, 7 def), AST: 3, TO: 6
TEAM FOULS: 5 [Team_091 in BONUS]


Team_091
--------------------------------------------------------------------------------
Player                MIN  PTS  REB  AST  TO      FG   FG%      3P   3P%
--------------------------------------------------------------------------------
Ja George              21    8    3    1   0   3/3   100.0     0/0   0.0
Kevin Simons           27    5    1    0   0   2/2   100.0     0/0   0.0
Zion Mitchell          21    5    3    0   0   2/2   100.0     0/0   0.0
Julius Barnes          21    5    0    1   0   2/6    33.3     0/0   0.0
Tim Antetokounmpo      21    2    1    1   0   1/2    50.0     0/0   0.0
Rudy Bridges           27    0    1    1   0   0/0     0.0     0/0   0.0
Karl Morant            21    0    0    1   0   0/3     0.0     0/0   0.0

TEAM: FG: 10/18 (55.6%), 3PT: 4/8 (50.0%), REB: 9 (2 off, 7 def), AST: 5, TO: 3
TEAM FOULS: 5 [Team_007 in BONUS]

================================================================================

================================================================================
                               FULL GAME COMPLETE                               
================================================================================

FINAL SCORE: Team_007 103, Team_091 96

SCORING BY QUARTER:
--------------------------------------------------------------------------------
Team                     Q1     Q2     Q3     Q4    FINAL
--------------------------------------------------------------------------------
Team_007                 31     26     27     19      103
Team_091                 26     20     23     27       96
--------------------------------------------------------------------------------

FULL GAME BOX SCORE:
================================================================================

Team_007
--------------------------------------------------------------------------------
Player                MIN  PTS  REB  AST  TO      FG   FG%      3P   3P%      FT STL BLK
--------------------------------------------------------------------------------
Tobias Johnson         27    4    0    2   1   3/8    37.5   1/4    25.0   0/0     0   0
Jaren Dosunmu          27   12    0    1   1   6/11   54.5   0/3     0.0   2/2     0   0
Bones Siakam           27   13    9    1   3   4/7    57.1   3/4    75.0   3/3     0   0
John Quickley          27   16    3    1   2   7/10   70.0   0/0     0.0   2/2     2   0
Carmelo Siakam         27   13    8    2   2   5/7    71.4   1/1   100.0   5/5     0   0
Wendell Poole          21    5    0    1   1   3/4    75.0   2/2   100.0   0/0     0   0
OG Porzingis           21    0    0    3   1   3/6    50.0   1/2    50.0   0/0     1   0
Gary LaVine            21   12    4    1   1   5/8    62.5   1/3    33.3   1/1     0   0
Austin Simons          21   27    5    1   1   8/9    88.9   0/1     0.0   5/6     0   1
Draymond Harris        21    0    6    1   1   0/3     0.0   0/1     0.0   0/0     0   0

TEAM: FG: 44/74 (59.5%), 3PT: 9/21 (42.9%), REB: 34 (7 off, 27 def), AST: 14, TO: 14


Team_091
--------------------------------------------------------------------------------
Player                MIN  PTS  REB  AST  TO      FG   FG%      3P   3P%      FT STL BLK
--------------------------------------------------------------------------------
Kyrie Rozier           27   14    6    0   1   6/11   54.5   2/7    28.6   2/2     1   1
Isaiah Siakam          27    6    0    1   0   4/8    50.0   0/1     0.0   2/2     0   0
Rudy Bridges           27   11    8    4   2   4/9    44.4   0/2     0.0   3/3     0   0
D'Angelo Ingram        27   10    0    4   3   4/7    57.1   1/3    33.3   1/1     1   1
Kevin Simons           27   15    9    1   3   5/6    83.3   2/3    66.7   1/1     2   0
Karl Morant            21    6    0    2   0   3/8    37.5   0/3     0.0   0/0     1   0
Julius Barnes          21    7    0    1   3   3/8    37.5   1/3    33.3   0/1     0   0
Tim Antetokounmpo      21    4    3    3   3   2/3    66.7   0/1     0.0   0/0     0   0
Zion Mitchell          21   11    9    1   1   5/5   100.0   0/0     0.0   5/5     0   0
Ja George              21   10    7    1   1   4/4   100.0   1/1   100.0   1/1     0   1

TEAM: FG: 40/69 (58.0%), 3PT: 7/24 (29.2%), REB: 43 (13 off, 30 def), AST: 18, TO: 17

================================================================================
