================================================================================
                        FULL GAME - Team_017 vs Team_013                        
================================================================================

================================================================================
                       1ST QUARTER - Team_017 vs Team_013                       
================================================================================

[12:00] Team_017 possession (Score: 0-0)
Tony Smith attempts a 3Pt. Contested by Desmond Ginobili (5.9 feet, ZONE). Tony Smith misses. FOUL! Loose ball foul on Desmond Ginobili during the rebound battle. [Team fouls: 1] No free throws, side out. (Desmond Ginobili: 1 personal fouls)

[11:43] Team_017 possession (Score: 0-0)
Kyrie Middleton drives, Desmond Ginobili stays with him. Kyrie Middleton attempts a Layup. Wide open! Desmond Ginobili is 6.8 feet away. [ZONE] KYRIE MIDDLETON MAKES IT! Assist: Vince Banchero
Score: 2-0

[11:30] Team_013 possession (Score: 2-0)
Jayson Morant drives, Tony Smith stays with him. Jayson Morant attempts a Dunk. Heavily contested by Tony Smith (0.8 feet, MAN)! Jayson Morant misses. Rebound secured by Bam Williamson.

[11:17] Team_017 possession (Score: 2-0)
FOUL! Reach-in foul on Desmond Ginobili during the drive. [Team fouls: 2] No free throws, side out. (Desmond Ginobili: 2 personal fouls)

[11:03] Team_017 possession (Score: 2-0)
Tony Smith attempts a Midrange. Wide open! Jayson Morant is 7.0 feet away. [MAN] TONY SMITH MAKES IT! Assist: Kyrie Middleton
Score: 4-0

[10:48] Team_013 possession (Score: 4-0)
FOUL! Shooting foul on Kyrie Middleton. Desmond Ginobili to the line for 2 free throws. [Team fouls: 1] (Kyrie Middleton: 1 personal fouls)   FT 1/2: GOOD   FT 2/2: GOOD Desmond Ginobili makes 2/2 from the line.
Score: 4-2

[10:34] Team_017 possession (Score: 4-2)
Desmond Reaves attempts a Layup. Contested by Desmond Ginobili (5.9 feet, ZONE). DESMOND REAVES MAKES IT! Assist: Bam Williamson
Score: 6-2

[10:25] Team_013 possession (Score: 6-2)
Nikola Curry drives, Bam Williamson stays with him. Nikola Curry attempts a Layup. Wide open! Bam Williamson is 9.6 feet away. [MAN] Nikola Curry misses. Rebound secured by Kyrie Middleton.

[10:13] Team_017 possession (Score: 6-2)
Kyrie Middleton loses the ball! Stripped by Desmond Ginobili! TURNOVER! (live ball)

[09:58] Team_013 possession (Score: 6-2)
FOUL! Offensive foul on Nikola Curry! Bam Williamson drew the charge! [Team fouls: 3] (Nikola Curry: 1 personal fouls) TURNOVER! (dead ball)

[09:44] Team_017 possession (Score: 6-2)
Kyrie Middleton attempts a 3Pt. Contested by Pau Mobley (2.5 feet, ZONE). KYRIE MIDDLETON MAKES IT! Assist: Desmond Reaves
Score: 9-2

[09:29] Team_013 possession (Score: 9-2)
Manu Smith drives to the basket... FOUL! Offensive foul on Manu Smith! Desmond Reaves drew the charge! [Team fouls: 4] (Manu Smith: 1 personal fouls) TURNOVER! (dead ball)

[09:14] Team_017 possession (Score: 9-2)
Bam Williamson attempts a 3Pt. Wide open! Pau Mobley is 6.6 feet away. [ZONE] Bam Williamson misses. Rebound secured by Pau Mobley.

[08:57] Team_013 possession (Score: 9-2)
Desmond Ginobili drives, picks up Bam Williamson. Help arrives from Vince Banchero! Desmond Ginobili attempts a Dunk. Contested by Vince Banchero (5.4 feet, ZONE). Desmond Ginobili misses. Rebound secured by Bam Williamson.

[08:40] Team_017 possession (Score: 9-2)
Bam Williamson makes the Layup and draws the foul on Desmond Ginobili! And-1! Bam Williamson to the line for 1. [BONUS: 5 team fouls] (Desmond Ginobili: 3 personal fouls)   FT 1/1: GOOD Bam Williamson makes 1/1 from the line.
Score: 12-2

[08:26] Team_013 possession (Score: 12-2)
Nikola Curry drives and kicks out. Manu Smith attempts a 3Pt. Wide open! Desmond Reaves is 6.1 feet away. [ZONE] MANU SMITH MAKES IT! Assist: Pau Mobley
Score: 12-5

[08:14] Team_017 possession (Score: 12-5)
Bam Williamson attempts a Midrange. Contested by Jayson Morant (3.7 feet, ZONE). Bam Williamson misses. Rebound secured by Pau Mobley.

[08:01] Team_013 possession (Score: 12-5)
Manu Smith attempts a 3Pt. Wide open! Desmond Reaves is 7.7 feet away. [MAN] Manu Smith misses. Rebound secured by Bam Williamson.

[07:47] Team_017 possession (Score: 12-5)
Vince Banchero attempts a 3Pt. Contested by Pau Mobley (2.4 feet, ZONE). Vince Banchero misses. Offensive rebound by Bam Williamson! Bam Williamson puts it back in!
Score: 14-5

[07:30] Team_013 possession (Score: 14-5)
Manu Smith attempts a Layup. Contested by Desmond Reaves (3.6 feet, MAN). MANU SMITH MAKES IT!
Score: 14-7

[07:18] Team_017 possession (Score: 14-7)
Tony Smith drives, picks up Jayson Morant. Help arrives from Pau Mobley! Tony Smith attempts a Layup. Contested by Pau Mobley (5.2 feet, MAN). Tony Smith misses. Rebound secured by Desmond Ginobili.

[07:03] Team_013 possession (Score: 14-7)
Nikola Curry drives, picks up Bam Williamson. Help arrives from Vince Banchero! Nikola Curry attempts a Dunk. Contested by Vince Banchero (5.1 feet, ZONE). NIKOLA CURRY MAKES IT!
Score: 14-9

[06:47] Team_017 possession (Score: 14-9)
Desmond Reaves attempts a 3Pt. Contested by Jayson Morant (5.2 feet, ZONE). Desmond Reaves misses. Rebound secured by Desmond Ginobili.

[06:29] Team_013 possession (Score: 14-9)
Manu Smith attempts a Midrange. Contested by Desmond Reaves (3.3 feet, MAN). Manu Smith misses. Rebound secured by Tony Smith.

[06:13] Team_017 possession (Score: 14-9)
Tony Smith drives and kicks out. Bam Williamson attempts a 3Pt. Contested by Pau Mobley (3.8 feet, ZONE). BAM WILLIAMSON MAKES IT! Assist: Tony Smith
Score: 17-9

[05:56] Team_013 possession (Score: 17-9)
Pau Mobley attempts a 3Pt. Contested by Desmond Reaves (4.5 feet, ZONE). Pau Mobley misses. Rebound secured by Kyrie Middleton.

[05:40] Team_017 possession (Score: 17-9)
Tony Smith attempts a 3Pt. Heavily contested by Jayson Morant (1.4 feet, MAN)! Tony Smith misses. Rebound secured by Nikola Curry.

[05:30] Team_013 possession (Score: 17-9)
Pau Mobley attempts a Layup. Contested by Vince Banchero (2.9 feet, MAN). PAU MOBLEY MAKES IT! Assist: Manu Smith
Score: 17-11

[05:16] Team_017 possession (Score: 17-11)
Kyrie Middleton makes the Layup and draws the foul on Desmond Ginobili! And-1! Kyrie Middleton to the line for 1. [BONUS: 6 team fouls] (Desmond Ginobili: 4 personal fouls)   FT 1/1: MISS Kyrie Middleton makes 0/1 from the line. Rebound secured by Nikola Curry.
Score: 19-11

[04:58] Team_013 possession (Score: 19-11)
FOUL! Shooting foul on Tony Smith. Manu Smith to the line for 3 free throws. [Team fouls: 2] (Tony Smith: 1 personal fouls)   FT 1/3: GOOD   FT 2/3: GOOD   FT 3/3: GOOD Manu Smith makes 3/3 from the line.
Score: 19-14

[04:44] Team_017 possession (Score: 19-14)
Kyrie Middleton drives to the basket... FOUL! Offensive foul on Kyrie Middleton! Desmond Ginobili drew the charge! [Team fouls: 3] (Kyrie Middleton: 2 personal fouls) TURNOVER! (dead ball)

[04:26] Team_013 possession (Score: 19-14)
Nikola Curry attempts a Layup. Contested by Bam Williamson (5.7 feet, ZONE). Nikola Curry misses. Rebound secured by Tony Smith.

[04:14] Team_017 possession (Score: 19-14)
Bam Williamson drives, picks up Desmond Ginobili. Help arrives from Pau Mobley! Bam Williamson attempts a Layup. Wide open! Pau Mobley is 8.3 feet away. [ZONE] BAM WILLIAMSON MAKES IT! Assist: Tony Smith
Score: 21-14

[03:58] Team_013 possession (Score: 21-14)
Nikola Curry attempts a Midrange. Contested by Vince Banchero (2.2 feet, ZONE). Nikola Curry misses. Rebound secured by Bam Williamson.

[03:41] Team_017 possession (Score: 21-14)
Tony Smith drives and kicks out. FOUL! Shooting foul on Pau Mobley. Vince Banchero to the line for 2 free throws. [BONUS: 7 team fouls] (Pau Mobley: 1 personal fouls)   FT 1/2: GOOD   FT 2/2: GOOD Vince Banchero makes 2/2 from the line.
Score: 23-14

[03:25] Team_013 possession (Score: 23-14)
Manu Smith attempts a 3Pt. Heavily contested by Tony Smith (0.5 feet, ZONE)! Manu Smith misses. Rebound secured by Bam Williamson.

[03:10] Team_017 possession (Score: 23-14)
FOUL! Holding foul on Jayson Morant. [IN THE BONUS! 8 team fouls] Tony Smith to the line for 2 free throws. (Jayson Morant: 1 personal fouls)   FT 1/2: MISS   FT 2/2: GOOD Tony Smith makes 1/2 from the line.
Score: 24-14

[02:55] Team_013 possession (Score: 24-14)
Pau Mobley throws a bad pass out of bounds! TURNOVER! (dead ball)

[02:42] Team_017 possession (Score: 24-14)
Vince Banchero attempts a 3Pt. Contested by Pau Mobley (3.4 feet, ZONE). Vince Banchero misses. Rebound secured by Pau Mobley.

[02:28] Team_013 possession (Score: 24-14)
Desmond Ginobili attempts a Layup. Wide open! Kyrie Middleton is 6.3 feet away. [MAN] DESMOND GINOBILI MAKES IT!
Score: 24-16

[02:11] Team_017 possession (Score: 24-16)
Tony Smith attempts a Midrange. Contested by Pau Mobley (2.1 feet, ZONE). TONY SMITH MAKES IT!
Score: 26-16

[01:59] Team_013 possession (Score: 26-16)
Pau Mobley drives to the basket... Pau Mobley throws a bad pass out of bounds! TURNOVER! (dead ball)

[01:59] Substitution (Team_017): Desmond Reaves OUT → Blake Reaves IN (stamina_rule2)

[01:59] Substitution (Team_017): Vince Banchero OUT → Tobias Bridges IN (stamina_rule2)

[01:59] Substitution (Team_017): Tony Smith OUT → Shaquille Stewart IN (stamina_rule2)

[01:59] Substitution (Team_017): Kyrie Middleton OUT → Ja Stewart IN (stamina_rule2)

[01:59] Substitution (Team_017): Bam Williamson OUT → Klay Holiday IN (stamina_rule2)

[01:59] Substitution (Team_013): Pau Mobley OUT → Chris Bryant IN (stamina_rule2)

[01:59] Substitution (Team_013): Jayson Morant OUT → Vince Nowitzki IN (stamina_rule2)

[01:59] Substitution (Team_013): Desmond Ginobili OUT → Dirk Booker IN (stamina_rule2)

[01:59] Substitution (Team_013): Nikola Curry OUT → Jayson Nowitzki IN (stamina_rule2)

[01:43] Team_017 possession (Score: 26-16)
Blake Reaves attempts a Midrange. Contested by Manu Smith (4.7 feet, MAN). BLAKE REAVES MAKES IT! Assist: Shaquille Stewart
Score: 28-16

[01:27] Team_013 possession (Score: 28-16)
Vince Nowitzki commits a violation (traveling/carry)! TURNOVER! (dead ball)

[01:27] Substitution (Team_013): Manu Smith OUT → Gary Iverson IN (stamina_rule2)

[01:10] Team_017 possession (Score: 28-16)
Tobias Bridges attempts a 3Pt. Contested by Chris Bryant (2.8 feet, MAN). TOBIAS BRIDGES MAKES IT! Assist: Klay Holiday
Score: 31-16

[00:59] Team_013 possession (Score: 31-16)
Chris Bryant drives, picks up Ja Stewart. Help arrives from Tobias Bridges! Chris Bryant attempts a Layup. Wide open! Tobias Bridges is 6.2 feet away. [ZONE] CHRIS BRYANT MAKES IT!
Score: 31-18

[00:43] Team_017 possession (Score: 31-18)
Klay Holiday attempts a Layup. Wide open! Dirk Booker is 9.0 feet away. [ZONE] KLAY HOLIDAY MAKES IT!
Score: 33-18

[00:34] Team_013 possession (Score: 33-18)
FOUL! Shooting foul on Klay Holiday. Jayson Nowitzki to the line for 2 free throws. [Team fouls: 4] (Klay Holiday: 1 personal fouls)   FT 1/2: MISS   FT 2/2: GOOD Jayson Nowitzki makes 1/2 from the line.
Score: 33-19

[00:20] Team_017 possession (Score: 33-19)
Ja Stewart attempts a 3Pt. Wide open! Dirk Booker is 6.5 feet away. [ZONE] Ja Stewart misses. Offensive rebound by Ja Stewart! Ja Stewart kicks it out.

[00:07] Team_017 possession (Score: 33-19)
Ja Stewart attempts a 3Pt. Contested by Chris Bryant (4.8 feet, ZONE). Ja Stewart misses. Rebound secured by Jayson Nowitzki.

================================================================================
                              1ST QUARTER COMPLETE                              
================================================================================

1ST QUARTER SCORE: Team_017 33, Team_013 19

BOX SCORE:
================================================================================

Team_017
--------------------------------------------------------------------------------
Player                MIN  PTS  REB  AST  TO      FG   FG%      3P   3P%
--------------------------------------------------------------------------------
Bam Williamson         10   10    7    1   0   4/6    66.7     0/0   0.0
Kyrie Middleton        10    5    2    1   0   2/3    66.7     0/0   0.0
Tony Smith             10    5    2    2   0   3/5    60.0     0/0   0.0
Tobias Bridges          2    3    0    0   0   1/1   100.0     0/0   0.0
Vince Banchero         10    2    0    1   0   1/2    50.0     0/0   0.0
Desmond Reaves         10    2    0    1   0   1/2    50.0     0/0   0.0
Blake Reaves            2    2    0    0   0   1/1   100.0     0/0   0.0
Klay Holiday            2    2    0    1   0   1/1   100.0     0/0   0.0
Shaquille Stewart       2    0    0    1   0   0/0     0.0     0/0   0.0
Ja Stewart              2    0    1    0   0   0/1     0.0     0/0   0.0

TEAM: FG: 14/22 (63.6%), 3PT: 3/8 (37.5%), REB: 12 (3 off, 9 def), AST: 8, TO: 2
TEAM FOULS: 4


Team_013
--------------------------------------------------------------------------------
Player                MIN  PTS  REB  AST  TO      FG   FG%      3P   3P%
--------------------------------------------------------------------------------
Manu Smith             11    8    0    1   0   3/6    50.0     0/0   0.0
Desmond Ginobili       10    4    2    0   0   2/3    66.7     0/0   0.0
Nikola Curry           10    2    2    0   0   1/4    25.0     0/0   0.0
Pau Mobley             10    2    3    1   0   1/2    50.0     0/0   0.0
Chris Bryant            2    2    0    0   0   1/1   100.0     0/0   0.0
Jayson Nowitzki         2    1    1    0   0   1/1   100.0     0/0   0.0
Jayson Morant          10    0    0    0   0   0/1     0.0     0/0   0.0

TEAM: FG: 9/18 (50.0%), 3PT: 1/4 (25.0%), REB: 8 (0 off, 8 def), AST: 2, TO: 5
TEAM FOULS: 8 [Team_017 in BONUS]

================================================================================

================================================================================
                       2ND QUARTER - Team_017 vs Team_013                       
================================================================================

[12:00] Team_017 possession (Score: 33-19)
Tony Smith attempts a 3Pt. Heavily contested by Pau Mobley (1.6 feet, ZONE)! TONY SMITH MAKES IT! Assist: Vince Banchero
Score: 36-19

[11:50] Team_013 possession (Score: 36-19)
Nikola Curry loses the ball! Stripped by Bam Williamson! TURNOVER! (live ball)

[11:38] Team_017 possession (Score: 36-19)
FOUL! Shooting foul on Pau Mobley. Tony Smith to the line for 3 free throws. [Team fouls: 1] (Pau Mobley: 1 personal fouls)   FT 1/3: MISS   FT 2/3: GOOD   FT 3/3: GOOD Tony Smith makes 2/3 from the line.
Score: 38-19

[11:24] Team_013 possession (Score: 38-19)
Pau Mobley attempts a 3Pt. Contested by Tony Smith (4.8 feet, ZONE). Pau Mobley misses. Offensive rebound by Desmond Ginobili! Desmond Ginobili kicks it out.

[11:10] Team_013 possession (Score: 38-19)
FOUL! Offensive foul on Pau Mobley! Vince Banchero drew the charge! [Team fouls: 2] (Pau Mobley: 2 personal fouls) TURNOVER! (dead ball)

[10:58] Team_017 possession (Score: 38-19)
Tony Smith drives, Desmond Ginobili stays with him. Tony Smith attempts a Layup. Contested by Desmond Ginobili (3.5 feet, ZONE). TONY SMITH MAKES IT!
Score: 40-19

[10:45] Team_013 possession (Score: 40-19)
Desmond Ginobili attempts a 3Pt. Contested by Kyrie Middleton (4.9 feet, MAN). Desmond Ginobili misses. Rebound secured by Tony Smith.

[10:30] Team_017 possession (Score: 40-19)
Vince Banchero attempts a 3Pt. Wide open! Pau Mobley is 7.4 feet away. [ZONE] Vince Banchero misses. Rebound secured by Desmond Ginobili.

[10:15] Team_013 possession (Score: 40-19)
Nikola Curry throws a bad pass! Stolen by Bam Williamson! TURNOVER! (live ball)

[09:58] Team_017 possession (Score: 40-19)
Tony Smith attempts a 3Pt. Contested by Jayson Morant (4.6 feet, MAN). TONY SMITH MAKES IT! Assist: Vince Banchero
Score: 43-19

[09:45] Team_013 possession (Score: 43-19)
Pau Mobley attempts a 3Pt. Wide open! Tony Smith is 6.3 feet away. [ZONE] Pau Mobley misses. Rebound secured by Kyrie Middleton.

[09:26] Team_017 possession (Score: 43-19)
Vince Banchero drives and kicks out. Desmond Reaves attempts a 3Pt. Contested by Manu Smith (2.8 feet, ZONE). DESMOND REAVES MAKES IT! Assist: Kyrie Middleton
Score: 46-19

[09:16] Team_013 possession (Score: 46-19)
Pau Mobley makes the Layup and draws the foul on Bam Williamson! And-1! Pau Mobley to the line for 1. [Team fouls: 1] (Bam Williamson: 1 personal fouls)   FT 1/1: GOOD Pau Mobley makes 1/1 from the line.
Score: 46-22

[09:04] Team_017 possession (Score: 46-22)
Vince Banchero drives, picks up Pau Mobley. Help arrives from Jayson Morant! Vince Banchero attempts a Layup. Contested by Jayson Morant (4.4 feet, MAN). VINCE BANCHERO MAKES IT! Assist: Desmond Reaves
Score: 48-22

[08:47] Team_013 possession (Score: 48-22)
Pau Mobley attempts a Layup. Wide open! Bam Williamson is 6.1 feet away. [ZONE] Pau Mobley misses. Rebound secured by Kyrie Middleton.

[08:35] Team_017 possession (Score: 48-22)
Bam Williamson attempts a Midrange. Contested by Nikola Curry (3.4 feet, MAN). Bam Williamson misses. Offensive rebound by Kyrie Middleton! Kyrie Middleton kicks it out.

[08:22] Team_017 possession (Score: 48-22)
Desmond Reaves attempts a 3Pt. Heavily contested by Manu Smith (0.7 feet, MAN)! Desmond Reaves misses. Rebound secured by Nikola Curry.

[08:06] Team_013 possession (Score: 48-22)
FOUL! Shooting foul on Bam Williamson. Nikola Curry to the line for 2 free throws. [Team fouls: 2] (Bam Williamson: 2 personal fouls)   FT 1/2: MISS   FT 2/2: GOOD Nikola Curry makes 1/2 from the line.
Score: 48-23

[07:50] Team_017 possession (Score: 48-23)
Bam Williamson attempts a Midrange. Contested by Pau Mobley (3.3 feet, ZONE). Bam Williamson misses. Rebound secured by Nikola Curry.

[07:34] Team_013 possession (Score: 48-23)
Pau Mobley drives, Bam Williamson stays with him. Pau Mobley attempts a Dunk. Wide open! Bam Williamson is 6.1 feet away. [ZONE] PAU MOBLEY MAKES IT! Assist: Jayson Morant
Score: 48-25

[07:22] Team_017 possession (Score: 48-25)
FOUL! Reach-in foul on Nikola Curry during the drive. [Team fouls: 3] No free throws, side out. (Nikola Curry: 1 personal fouls)

[07:03] Team_017 possession (Score: 48-25)
Bam Williamson drives and kicks out. Desmond Reaves attempts a 3Pt. Contested by Manu Smith (5.5 feet, MAN). Desmond Reaves misses. Offensive rebound by Kyrie Middleton! Kyrie Middleton kicks it out.

[06:48] Team_017 possession (Score: 48-25)
Vince Banchero drives to the basket... Vince Banchero throws a bad pass out of bounds! TURNOVER! (dead ball)

[06:48] Substitution (Team_017): Desmond Reaves OUT → Blake Reaves IN (stamina_rule2)

[06:48] Substitution (Team_017): Vince Banchero OUT → Tobias Bridges IN (stamina_rule2)

[06:48] Substitution (Team_017): Tony Smith OUT → Shaquille Stewart IN (stamina_rule2)

[06:48] Substitution (Team_017): Kyrie Middleton OUT → Ja Stewart IN (stamina_rule2)

[06:48] Substitution (Team_017): Bam Williamson OUT → Klay Holiday IN (stamina_rule2)

[06:48] Substitution (Team_013): Manu Smith OUT → Gary Iverson IN (stamina_rule2)

[06:48] Substitution (Team_013): Pau Mobley OUT → Chris Bryant IN (stamina_rule2)

[06:48] Substitution (Team_013): Jayson Morant OUT → Vince Nowitzki IN (stamina_rule2)

[06:48] Substitution (Team_013): Desmond Ginobili OUT → Dirk Booker IN (stamina_rule2)

[06:48] Substitution (Team_013): Nikola Curry OUT → Jayson Nowitzki IN (stamina_rule2)

[06:38] Team_013 possession (Score: 48-25)
Gary Iverson loses control! Ball rolls out of bounds! TURNOVER! (dead ball)

[06:20] Team_017 possession (Score: 48-25)
Tobias Bridges attempts a 3Pt. Contested by Chris Bryant (3.3 feet, ZONE). Tobias Bridges misses. Rebound secured by Jayson Nowitzki.

[06:09] Team_013 possession (Score: 48-25)
FOUL! Shooting foul on Tobias Bridges. Chris Bryant to the line for 2 free throws. [Team fouls: 3] (Tobias Bridges: 1 personal fouls)   FT 1/2: MISS   FT 2/2: GOOD Chris Bryant makes 1/2 from the line.
Score: 48-26

[05:53] Team_017 possession (Score: 48-26)
Blake Reaves attempts a Layup. Wide open! Jayson Nowitzki is 7.2 feet away. [ZONE] Blake Reaves misses. Rebound secured by Dirk Booker.

[05:38] Team_013 possession (Score: 48-26)
Jayson Nowitzki attempts a Layup. Wide open! Klay Holiday is 6.4 feet away. [MAN] JAYSON NOWITZKI MAKES IT! Assist: Vince Nowitzki
Score: 48-28

[05:27] Team_017 possession (Score: 48-28)
Klay Holiday attempts a Layup. BLOCKED BY DIRK BOOKER! Ball goes out off Dirk Booker. Klay Holiday's ball!

[05:14] Team_017 possession (Score: 48-28)
Shaquille Stewart attempts a Layup. Contested by Vince Nowitzki (4.5 feet, MAN). Shaquille Stewart misses. FOUL! Loose ball foul on Jayson Nowitzki during the rebound battle. [Team fouls: 4] No free throws, side out. (Jayson Nowitzki: 1 personal fouls)

[04:59] Team_017 possession (Score: 48-28)
Ja Stewart attempts a 3Pt. Contested by Chris Bryant (3.5 feet, ZONE). Ja Stewart misses. Rebound secured by Chris Bryant.

[04:43] Team_013 possession (Score: 48-28)
Gary Iverson attempts a 3Pt. Heavily contested by Tobias Bridges (1.4 feet, ZONE)! Gary Iverson misses. Rebound secured by Klay Holiday.

[04:31] Team_017 possession (Score: 48-28)
FOUL! Holding foul on Dirk Booker. [IN THE BONUS! 5 team fouls] Ja Stewart to the line for 2 free throws. (Dirk Booker: 1 personal fouls)   FT 1/2: GOOD   FT 2/2: MISS Ja Stewart makes 1/2 from the line. Rebound secured by Dirk Booker.
Score: 49-28

[04:13] Team_013 possession (Score: 49-28)
Jayson Nowitzki drives to the basket... Jayson Nowitzki throws a bad pass out of bounds! TURNOVER! (dead ball)

[03:56] Team_017 possession (Score: 49-28)
Blake Reaves attempts a 3Pt. Contested by Gary Iverson (3.8 feet, MAN). BLAKE REAVES MAKES IT! Assist: Klay Holiday
Score: 52-28

[03:46] Team_013 possession (Score: 52-28)
Jayson Nowitzki drives to the basket... Jayson Nowitzki throws a bad pass out of bounds! TURNOVER! (dead ball)

[03:32] Team_017 possession (Score: 52-28)
Klay Holiday drives, Dirk Booker stays with him. Klay Holiday attempts a Layup. Wide open! Dirk Booker is 7.0 feet away. [MAN] KLAY HOLIDAY MAKES IT! Assist: Blake Reaves
Score: 54-28

[03:20] Team_013 possession (Score: 54-28)
Dirk Booker drives, picks up Ja Stewart. Help arrives from Tobias Bridges! Dirk Booker attempts a Dunk. Contested by Tobias Bridges (5.6 feet, MAN). Dirk Booker misses. Rebound secured by Klay Holiday.

[03:10] Team_017 possession (Score: 54-28)
Tobias Bridges attempts a 3Pt. Contested by Chris Bryant (5.9 feet, ZONE). Tobias Bridges misses. Offensive rebound by Shaquille Stewart! Shaquille Stewart kicks it out.

[02:54] Team_017 possession (Score: 54-28)
Blake Reaves attempts a 3Pt. Contested by Chris Bryant (4.4 feet, ZONE). Blake Reaves misses. Rebound secured by Chris Bryant.

[02:40] Team_013 possession (Score: 54-28)
Vince Nowitzki makes the Layup and draws the foul on Ja Stewart! And-1! Vince Nowitzki to the line for 1. [Team fouls: 4] (Ja Stewart: 1 personal fouls)   FT 1/1: GOOD Vince Nowitzki makes 1/1 from the line.
Score: 54-31

[02:25] Team_017 possession (Score: 54-31)
Tobias Bridges attempts a 3Pt. Contested by Chris Bryant (2.1 feet, MAN). Tobias Bridges misses. Rebound secured by Jayson Nowitzki.

[02:09] Team_013 possession (Score: 54-31)
Jayson Nowitzki attempts a Midrange. Contested by Tobias Bridges (5.1 feet, ZONE). JAYSON NOWITZKI MAKES IT! Assist: Vince Nowitzki
Score: 54-33

[01:51] Team_017 possession (Score: 54-33)
Shaquille Stewart drives, Jayson Nowitzki stays with him. Shaquille Stewart attempts a Layup. Wide open! Jayson Nowitzki is 7.0 feet away. [ZONE] SHAQUILLE STEWART MAKES IT! Assist: Blake Reaves
Score: 56-33

[01:36] Team_013 possession (Score: 56-33)
Jayson Nowitzki drives to the basket... Jayson Nowitzki loses control! Ball rolls out of bounds! TURNOVER! (dead ball)

[01:18] Team_017 possession (Score: 56-33)
Klay Holiday drives, Jayson Nowitzki stays with him. Klay Holiday attempts a Layup. Wide open! Jayson Nowitzki is 6.1 feet away. [ZONE] Klay Holiday misses. Offensive rebound by Ja Stewart! Ja Stewart kicks it out.

[01:07] Team_017 possession (Score: 56-33)
Tobias Bridges attempts a Midrange. Heavily contested by Chris Bryant (1.7 feet, MAN)! Tobias Bridges misses. Rebound secured by Jayson Nowitzki.

[00:56] Team_013 possession (Score: 56-33)
Jayson Nowitzki attempts a 3Pt. Wide open! Blake Reaves is 8.9 feet away. [ZONE] Jayson Nowitzki misses. Rebound secured by Klay Holiday.

[00:39] Team_017 possession (Score: 56-33)
Ja Stewart drives and kicks out. Klay Holiday makes the Midrange and draws the foul on Dirk Booker! And-1! Klay Holiday to the line for 1. [BONUS: 6 team fouls] (Dirk Booker: 2 personal fouls)   FT 1/1: GOOD Klay Holiday makes 1/1 from the line.
Score: 59-33

[00:27] Team_013 possession (Score: 59-33)
Chris Bryant drives and kicks out. Gary Iverson attempts a 3Pt. Contested by Blake Reaves (5.5 feet, MAN). Gary Iverson misses. Rebound secured by Klay Holiday.

[00:12] Team_017 possession (Score: 59-33)
Blake Reaves commits a violation (traveling/carry)! TURNOVER! (dead ball)

================================================================================
                              2ND QUARTER COMPLETE                              
================================================================================

2ND QUARTER SCORE: Team_017 26, Team_013 14

BOX SCORE:
================================================================================

Team_017
--------------------------------------------------------------------------------
Player                MIN  PTS  REB  AST  TO      FG   FG%      3P   3P%
--------------------------------------------------------------------------------
Tony Smith             16   10    1    0   0   4/4   100.0     0/0   0.0
Klay Holiday            9    5    4    1   0   2/2   100.0     0/0   0.0
Desmond Reaves         16    3    0    1   0   1/2    50.0     0/0   0.0
Blake Reaves            9    3    0    2   0   1/3    33.3     0/0   0.0
Vince Banchero         16    2    0    2   0   1/2    50.0     0/0   0.0
Shaquille Stewart       9    2    2    0   0   1/1   100.0     0/0   0.0
Kyrie Middleton        16    0    4    1   0   0/0     0.0     0/0   0.0
Bam Williamson         16    0    0    0   0   0/1     0.0     0/0   0.0
Tobias Bridges          9    0    0    0   0   0/3     0.0     0/0   0.0
Ja Stewart              9    0    1    0   0   0/1     0.0     0/0   0.0

TEAM: FG: 10/20 (50.0%), 3PT: 4/10 (40.0%), REB: 12 (5 off, 7 def), AST: 7, TO: 2
TEAM FOULS: 4


Team_013
--------------------------------------------------------------------------------
Player                MIN  PTS  REB  AST  TO      FG   FG%      3P   3P%
--------------------------------------------------------------------------------
Pau Mobley             16    5    0    0   0   2/4    50.0     0/0   0.0
Jayson Nowitzki         9    4    3    0   0   2/3    66.7     0/0   0.0
Vince Nowitzki          9    3    0    2   0   1/1   100.0     0/0   0.0
Nikola Curry           16    1    2    0   0   1/1   100.0     0/0   0.0
Chris Bryant            9    1    2    0   0   1/2    50.0     0/0   0.0
Desmond Ginobili       16    0    2    0   0   0/1     0.0     0/0   0.0
Jayson Morant          16    0    0    1   0   0/0     0.0     0/0   0.0
Dirk Booker             9    0    2    0   0   0/1     0.0     0/0   0.0
Gary Iverson            8    0    0    0   0   0/1     0.0     0/0   0.0

TEAM: FG: 7/14 (50.0%), 3PT: 0/4 (0.0%), REB: 11 (1 off, 10 def), AST: 3, TO: 7
TEAM FOULS: 6 [Team_017 in BONUS]

================================================================================

================================================================================
                       3RD QUARTER - Team_017 vs Team_013                       
================================================================================

[12:00] Team_017 possession (Score: 59-33)
Bam Williamson drives, Desmond Ginobili stays with him. Bam Williamson attempts a Dunk. Wide open! Desmond Ginobili is 8.3 feet away. [ZONE] BAM WILLIAMSON MAKES IT! Assist: Desmond Reaves
Score: 61-33

[11:45] Team_013 possession (Score: 61-33)
Nikola Curry drives, Bam Williamson stays with him. Nikola Curry attempts a Layup. Contested by Bam Williamson (2.8 feet, ZONE). NIKOLA CURRY MAKES IT! Assist: Pau Mobley
Score: 61-35

[11:34] Team_017 possession (Score: 61-35)
Vince Banchero drives, picks up Desmond Ginobili. Help arrives from Pau Mobley! Vince Banchero attempts a Layup. Contested by Pau Mobley (4.9 feet, ZONE). VINCE BANCHERO MAKES IT! Assist: Tony Smith
Score: 63-35

[11:17] Team_013 possession (Score: 63-35)
Jayson Morant attempts a Layup. Contested by Tony Smith (4.8 feet, MAN). JAYSON MORANT MAKES IT! Assist: Desmond Ginobili
Score: 63-37

[11:02] Team_017 possession (Score: 63-37)
Desmond Reaves attempts a Midrange. Contested by Desmond Ginobili (3.8 feet, ZONE). Desmond Reaves misses. Rebound secured by Pau Mobley.

[10:50] Team_013 possession (Score: 63-37)
Pau Mobley attempts a 3Pt. Contested by Vince Banchero (5.5 feet, MAN). Pau Mobley misses. Rebound secured by Kyrie Middleton.

[10:34] Team_017 possession (Score: 63-37)
Desmond Reaves attempts a 3Pt. Contested by Pau Mobley (4.2 feet, ZONE). Desmond Reaves misses. Rebound secured by Pau Mobley.

[10:20] Team_013 possession (Score: 63-37)
Desmond Ginobili attempts a 3Pt. Contested by Desmond Reaves (4.0 feet, ZONE). DESMOND GINOBILI MAKES IT! Assist: Manu Smith
Score: 63-40

[10:06] Team_017 possession (Score: 63-40)
Tony Smith attempts a Midrange. Contested by Jayson Morant (5.0 feet, MAN). Tony Smith misses. Rebound secured by Desmond Ginobili.

[09:50] Team_013 possession (Score: 63-40)
Nikola Curry attempts a Midrange. Contested by Desmond Reaves (3.0 feet, ZONE). Nikola Curry misses. Rebound secured by Tony Smith.

[09:33] Team_017 possession (Score: 63-40)
Bam Williamson attempts a Layup. Wide open! Nikola Curry is 8.4 feet away. [MAN] BAM WILLIAMSON MAKES IT!
Score: 65-40

[09:15] Team_013 possession (Score: 65-40)
Desmond Ginobili drives, Bam Williamson stays with him. Desmond Ginobili attempts a Layup. Wide open! Bam Williamson is 6.4 feet away. [ZONE] DESMOND GINOBILI MAKES IT! Assist: Jayson Morant
Score: 65-42

[09:01] Team_017 possession (Score: 65-42)
Bam Williamson attempts a Midrange. Wide open! Desmond Ginobili is 6.9 feet away. [ZONE] BAM WILLIAMSON MAKES IT! Assist: Tony Smith
Score: 67-42

[08:49] Team_013 possession (Score: 67-42)
Nikola Curry attempts a Midrange. Wide open! Bam Williamson is 6.0 feet away. [MAN] Nikola Curry misses. Rebound secured by Bam Williamson.

[08:32] Team_017 possession (Score: 67-42)
Tony Smith attempts a Midrange. Wide open! Jayson Morant is 6.7 feet away. [MAN] TONY SMITH MAKES IT! Assist: Kyrie Middleton
Score: 69-42

[08:22] Team_013 possession (Score: 69-42)
Pau Mobley attempts a 3Pt. Contested by Vince Banchero (2.1 feet, MAN). Pau Mobley misses. Rebound secured by Kyrie Middleton.

[08:09] Team_017 possession (Score: 69-42)
Tony Smith attempts a Midrange. Contested by Jayson Morant (3.8 feet, MAN). Tony Smith misses. Rebound secured by Pau Mobley.

[07:55] Team_013 possession (Score: 69-42)
Desmond Ginobili drives and kicks out. Pau Mobley attempts a Midrange. Contested by Kyrie Middleton (6.0 feet, ZONE). Pau Mobley misses. Rebound secured by Tony Smith.

[07:38] Team_017 possession (Score: 69-42)
Kyrie Middleton drives and kicks out. Bam Williamson attempts a Midrange. Contested by Nikola Curry (4.0 feet, MAN). Bam Williamson misses. Rebound secured by Nikola Curry.

[07:27] Team_013 possession (Score: 69-42)
FOUL! Shooting foul on Bam Williamson. Desmond Ginobili to the line for 2 free throws. [Team fouls: 1] (Bam Williamson: 1 personal fouls)   FT 1/2: GOOD   FT 2/2: GOOD Desmond Ginobili makes 2/2 from the line.
Score: 69-44

[07:12] Team_017 possession (Score: 69-44)
Desmond Reaves attempts a 3Pt. Contested by Pau Mobley (3.9 feet, ZONE). DESMOND REAVES MAKES IT! Assist: Tony Smith
Score: 72-44

[07:00] Team_013 possession (Score: 72-44)
Desmond Ginobili attempts a Midrange. Contested by Kyrie Middleton (5.8 feet, ZONE). Desmond Ginobili misses. Offensive rebound by Nikola Curry! Nikola Curry kicks it out.

[06:42] Team_013 possession (Score: 72-44)
Nikola Curry drives and kicks out. Desmond Ginobili attempts a Midrange. Heavily contested by Tony Smith (1.5 feet, ZONE)! Desmond Ginobili misses. Rebound secured by Kyrie Middleton.

[06:26] Team_017 possession (Score: 72-44)
Kyrie Middleton attempts a 3Pt. Wide open! Desmond Ginobili is 6.4 feet away. [MAN] KYRIE MIDDLETON MAKES IT! Assist: Desmond Reaves
Score: 75-44

[06:12] Team_013 possession (Score: 75-44)
Jayson Morant throws a bad pass out of bounds! TURNOVER! (dead ball)

[06:03] Team_017 possession (Score: 75-44)
FOUL! Reach-in foul on Manu Smith during the drive. [Team fouls: 1] No free throws, side out. (Manu Smith: 1 personal fouls)

[05:46] Team_017 possession (Score: 75-44)
Kyrie Middleton drives, Desmond Ginobili stays with him. Kyrie Middleton attempts a Dunk. Wide open! Desmond Ginobili is 6.8 feet away. [ZONE] KYRIE MIDDLETON MAKES IT! Assist: Tony Smith
Score: 77-44

[05:30] Team_013 possession (Score: 77-44)
Desmond Ginobili attempts a 3Pt. Contested by Kyrie Middleton (5.4 feet, MAN). Desmond Ginobili misses. Rebound secured by Kyrie Middleton.

[05:18] Team_017 possession (Score: 77-44)
Tony Smith makes the Dunk and draws the foul on Desmond Ginobili! And-1! Tony Smith to the line for 1. [Team fouls: 2] (Desmond Ginobili: 1 personal fouls)   FT 1/1: GOOD Tony Smith makes 1/1 from the line.
Score: 80-44

[05:02] Team_013 possession (Score: 80-44)
Jayson Morant attempts a Layup. BLOCKED BY TONY SMITH! Ball deflects out of bounds off Jayson Morant.

[04:48] Team_017 possession (Score: 80-44)
FOUL! Shooting foul on Pau Mobley. Vince Banchero to the line for 3 free throws. [Team fouls: 3] (Pau Mobley: 1 personal fouls)   FT 1/3: GOOD   FT 2/3: MISS   FT 3/3: MISS Vince Banchero makes 1/3 from the line. Rebound secured by Nikola Curry.
Score: 81-44

[04:30] Team_013 possession (Score: 81-44)
Pau Mobley attempts a 3Pt. Contested by Tony Smith (2.8 feet, ZONE). Pau Mobley misses. Rebound secured by Kyrie Middleton.

[04:18] Team_017 possession (Score: 81-44)
Vince Banchero drives and kicks out. Vince Banchero attempts a 3Pt. Heavily contested by Desmond Ginobili (1.1 feet, ZONE)! Vince Banchero misses. Rebound secured by Nikola Curry.

[04:08] Team_013 possession (Score: 81-44)
Jayson Morant attempts a Layup. BLOCKED BY TONY SMITH! Ball deflects out of bounds off Jayson Morant.

[03:51] Team_017 possession (Score: 81-44)
FOUL! Reach-in foul on Desmond Ginobili during the drive. [Team fouls: 4] No free throws, side out. (Desmond Ginobili: 2 personal fouls)

[03:37] Team_017 possession (Score: 81-44)
Bam Williamson drives, picks up Nikola Curry. Help arrives from Pau Mobley! Bam Williamson attempts a Dunk. Wide open! Pau Mobley is 7.1 feet away. [MAN] BAM WILLIAMSON MAKES IT! Assist: Vince Banchero
Score: 83-44

[03:23] Team_013 possession (Score: 83-44)
Manu Smith drives and kicks out. Desmond Ginobili attempts a 3Pt. Heavily contested by Tony Smith (1.4 feet, ZONE)! DESMOND GINOBILI MAKES IT!
Score: 83-47

[03:11] Team_017 possession (Score: 83-47)
Bam Williamson attempts a 3Pt. Wide open! Nikola Curry is 6.4 feet away. [MAN] Bam Williamson misses. Rebound secured by Desmond Ginobili.

[02:59] Team_013 possession (Score: 83-47)
Desmond Ginobili attempts a 3Pt. Contested by Kyrie Middleton (4.2 feet, MAN). Desmond Ginobili misses. Rebound secured by Bam Williamson.

[02:40] Team_017 possession (Score: 83-47)
Desmond Reaves drives to the basket... Desmond Reaves throws a bad pass! Stolen by Desmond Ginobili! TURNOVER! (live ball)

[02:23] Team_013 possession (Score: 83-47)
Nikola Curry drives, picks up Bam Williamson. Help arrives from Vince Banchero! Nikola Curry attempts a Dunk. Wide open! Vince Banchero is 6.2 feet away. [ZONE] Nikola Curry misses. Rebound secured by Bam Williamson.

[02:11] Team_017 possession (Score: 83-47)
Tony Smith attempts a Midrange. Contested by Pau Mobley (3.0 feet, ZONE). Tony Smith misses. Rebound secured by Desmond Ginobili.

[01:53] Team_013 possession (Score: 83-47)
Pau Mobley attempts a Midrange. Contested by Kyrie Middleton (3.5 feet, ZONE). PAU MOBLEY MAKES IT!
Score: 83-49

[01:36] Team_017 possession (Score: 83-49)
Desmond Reaves attempts a 3Pt. Wide open! Manu Smith is 6.7 feet away. [MAN] DESMOND REAVES MAKES IT! Assist: Tony Smith
Score: 86-49

[01:21] Team_013 possession (Score: 86-49)
Jayson Morant attempts a 3Pt. Contested by Tony Smith (4.7 feet, MAN). JAYSON MORANT MAKES IT! Assist: Pau Mobley
Score: 86-52

[01:08] Team_017 possession (Score: 86-52)
Bam Williamson attempts a Midrange. Contested by Nikola Curry (5.8 feet, MAN). BAM WILLIAMSON MAKES IT!
Score: 88-52

[00:54] Team_013 possession (Score: 88-52)
Jayson Morant attempts a 3Pt. Heavily contested by Tony Smith (0.5 feet, ZONE)! Jayson Morant misses. Rebound secured by Kyrie Middleton.

[00:37] Team_017 possession (Score: 88-52)
Vince Banchero attempts a 3Pt. Contested by Manu Smith (4.9 feet, ZONE). Vince Banchero misses. Rebound secured by Nikola Curry.

[00:26] Team_013 possession (Score: 88-52)
Jayson Morant attempts a 3Pt. Contested by Tony Smith (3.6 feet, MAN). Jayson Morant misses. Rebound secured by Bam Williamson.

[00:08] Team_017 possession (Score: 88-52)
Desmond Reaves attempts a Midrange. Contested by Pau Mobley (4.7 feet, ZONE). Desmond Reaves misses. Rebound secured by Pau Mobley.

================================================================================
                              3RD QUARTER COMPLETE                              
================================================================================

3RD QUARTER SCORE: Team_017 29, Team_013 19

BOX SCORE:
================================================================================

Team_017
--------------------------------------------------------------------------------
Player                MIN  PTS  REB  AST  TO      FG   FG%      3P   3P%
--------------------------------------------------------------------------------
Bam Williamson         28   10    4    0   0   5/6    83.3     0/0   0.0
Desmond Reaves         28    6    0    2   0   2/5    40.0     0/0   0.0
Tony Smith             28    5    2    5   0   2/5    40.0     0/0   0.0
Kyrie Middleton        28    5    6    1   0   2/3    66.7     0/0   0.0
Vince Banchero         28    2    0    1   0   1/4    25.0     0/0   0.0

TEAM: FG: 12/23 (52.2%), 3PT: 3/7 (42.9%), REB: 12 (0 off, 12 def), AST: 9, TO: 1
TEAM FOULS: 1


Team_013
--------------------------------------------------------------------------------
Player                MIN  PTS  REB  AST  TO      FG   FG%      3P   3P%
--------------------------------------------------------------------------------
Desmond Ginobili       28   10    3    1   0   4/7    57.1     0/0   0.0
Jayson Morant          28    5    0    1   0   2/6    33.3     0/0   0.0
Nikola Curry           28    2    5    0   0   1/5    20.0     0/0   0.0
Pau Mobley             28    2    4    2   0   1/4    25.0     0/0   0.0
Manu Smith             28    0    0    1   0   0/0     0.0     0/0   0.0

TEAM: FG: 8/22 (36.4%), 3PT: 2/9 (22.2%), REB: 12 (1 off, 11 def), AST: 5, TO: 1
TEAM FOULS: 4

================================================================================

================================================================================
                       4TH QUARTER - Team_017 vs Team_013                       
================================================================================

[12:00] Team_017 possession (Score: 88-52)
Tony Smith drives, picks up Jayson Morant. Help arrives from Pau Mobley! Tony Smith attempts a Dunk. Wide open! Pau Mobley is 8.6 feet away. [MAN] TONY SMITH MAKES IT! Assist: Bam Williamson
Score: 90-52

[11:48] Team_013 possession (Score: 90-52)
Jayson Morant loses control! Ball rolls out of bounds! TURNOVER! (dead ball)

[11:48] Substitution (Team_017): Desmond Reaves OUT → Blake Reaves IN (stamina_rule2)

[11:48] Substitution (Team_017): Vince Banchero OUT → Tobias Bridges IN (stamina_rule2)

[11:48] Substitution (Team_017): Tony Smith OUT → Shaquille Stewart IN (stamina_rule2)

[11:48] Substitution (Team_017): Kyrie Middleton OUT → Ja Stewart IN (stamina_rule2)

[11:48] Substitution (Team_017): Bam Williamson OUT → Klay Holiday IN (stamina_rule2)

[11:48] Substitution (Team_013): Pau Mobley OUT → Chris Bryant IN (stamina_rule2)

[11:48] Substitution (Team_013): Jayson Morant OUT → Vince Nowitzki IN (stamina_rule2)

[11:48] Substitution (Team_013): Desmond Ginobili OUT → Dirk Booker IN (stamina_rule2)

[11:48] Substitution (Team_013): Nikola Curry OUT → Jayson Nowitzki IN (stamina_rule2)

[11:33] Team_017 possession (Score: 90-52)
Tobias Bridges throws a bad pass! Stolen by Chris Bryant! TURNOVER! (live ball)

[11:23] Team_013 possession (Score: 90-52)
Chris Bryant makes the Dunk and draws the foul on Klay Holiday! And-1! Chris Bryant to the line for 1. [Team fouls: 1] (Klay Holiday: 1 personal fouls)   FT 1/1: GOOD Chris Bryant makes 1/1 from the line.
Score: 90-55

[11:08] Team_017 possession (Score: 90-55)
FOUL! Offensive foul on Tobias Bridges! Chris Bryant drew the charge! [Team fouls: 2] (Tobias Bridges: 1 personal fouls) TURNOVER! (dead ball)

[10:51] Team_013 possession (Score: 90-55)
Chris Bryant attempts a 3Pt. Contested by Tobias Bridges (5.9 feet, ZONE). CHRIS BRYANT MAKES IT! Assist: Jayson Nowitzki
Score: 90-58

[10:38] Team_017 possession (Score: 90-58)
Ja Stewart attempts a Midrange. Contested by Dirk Booker (5.7 feet, MAN). JA STEWART MAKES IT! Assist: Blake Reaves
Score: 92-58

[10:26] Team_013 possession (Score: 92-58)
Vince Nowitzki drives, picks up Shaquille Stewart. Help arrives from Tobias Bridges! Vince Nowitzki attempts a Layup. Wide open! Tobias Bridges is 7.9 feet away. [MAN] VINCE NOWITZKI MAKES IT!
Score: 92-60

[10:11] Team_017 possession (Score: 92-60)
Ja Stewart attempts a Midrange. Contested by Dirk Booker (5.0 feet, MAN). JA STEWART MAKES IT!
Score: 94-60

[09:58] Team_013 possession (Score: 94-60)
Manu Smith attempts a 3Pt. Wide open! Tobias Bridges is 8.3 feet away. [ZONE] Manu Smith misses. Rebound secured by Shaquille Stewart.

[09:40] Team_017 possession (Score: 94-60)
Blake Reaves attempts a 3Pt. Contested by Chris Bryant (5.3 feet, ZONE). Blake Reaves misses. Rebound secured by Jayson Nowitzki.

[09:25] Team_013 possession (Score: 94-60)
Dirk Booker attempts a Layup. Wide open! Ja Stewart is 6.3 feet away. [ZONE] DIRK BOOKER MAKES IT! Assist: Manu Smith
Score: 94-62

[09:08] Team_017 possession (Score: 94-62)
Tobias Bridges attempts a Midrange. Contested by Chris Bryant (3.6 feet, MAN). Tobias Bridges misses. Rebound secured by Dirk Booker.

[08:56] Team_013 possession (Score: 94-62)
Vince Nowitzki drives to the basket... Vince Nowitzki loses the ball! Stripped by Shaquille Stewart! TURNOVER! (live ball)

[08:43] Team_017 possession (Score: 94-62)
Tobias Bridges drives and kicks out. Ja Stewart attempts a 3Pt. Wide open! Dirk Booker is 9.4 feet away. [MAN] Ja Stewart misses. Offensive rebound by Shaquille Stewart! Shaquille Stewart kicks it out.

[08:31] Team_017 possession (Score: 94-62)
Blake Reaves attempts a Layup. Wide open! Manu Smith is 6.9 feet away. [MAN] Blake Reaves misses. FOUL! Loose ball foul on Jayson Nowitzki during the rebound battle. [Team fouls: 1] No free throws, side out. (Jayson Nowitzki: 1 personal fouls)

[08:17] Team_017 possession (Score: 94-62)
Ja Stewart attempts a Midrange. Wide open! Vince Nowitzki is 6.6 feet away. [ZONE] JA STEWART MAKES IT!
Score: 96-62

[07:58] Team_013 possession (Score: 96-62)
Vince Nowitzki drives, Shaquille Stewart stays with him. Vince Nowitzki attempts a Dunk. Contested by Shaquille Stewart (5.7 feet, MAN). VINCE NOWITZKI MAKES IT! Assist: Dirk Booker
Score: 96-64

[07:42] Team_017 possession (Score: 96-64)
Shaquille Stewart attempts a Midrange. Contested by Vince Nowitzki (5.1 feet, MAN). SHAQUILLE STEWART MAKES IT!
Score: 98-64

[07:27] Team_013 possession (Score: 98-64)
FOUL! Shooting foul on Tobias Bridges. Chris Bryant to the line for 2 free throws. [Team fouls: 3] (Tobias Bridges: 2 personal fouls)   FT 1/2: GOOD   FT 2/2: MISS Chris Bryant makes 1/2 from the line. Offensive rebound by Dirk Booker! Dirk Booker kicks it out.
Score: 98-65

[07:13] Team_013 possession (Score: 98-65)
Vince Nowitzki attempts a Layup. BLOCKED BY SHAQUILLE STEWART! Ball is loose! Rebound secured by Ja Stewart.

[07:00] Team_017 possession (Score: 98-65)
Klay Holiday drives to the basket... Klay Holiday throws a bad pass! Stolen by Dirk Booker! TURNOVER! (live ball)

[06:44] Team_013 possession (Score: 98-65)
Manu Smith attempts a Midrange. Wide open! Blake Reaves is 6.5 feet away. [MAN] Manu Smith misses. Rebound secured by Ja Stewart.

[06:31] Team_017 possession (Score: 98-65)
FOUL! Reach-in foul on Dirk Booker during the drive. [Team fouls: 2] No free throws, side out. (Dirk Booker: 1 personal fouls)

[06:18] Team_017 possession (Score: 98-65)
Tobias Bridges attempts a Midrange. Contested by Chris Bryant (5.0 feet, MAN). TOBIAS BRIDGES MAKES IT! Assist: Klay Holiday
Score: 100-65

[06:01] Team_013 possession (Score: 100-65)
Vince Nowitzki attempts a 3Pt. Contested by Shaquille Stewart (2.4 feet, MAN). Vince Nowitzki misses. Rebound secured by Shaquille Stewart.

[05:48] Team_017 possession (Score: 100-65)
Shaquille Stewart attempts a 3Pt. Contested by Chris Bryant (4.2 feet, ZONE). Shaquille Stewart misses. Rebound secured by Dirk Booker.

[05:34] Team_013 possession (Score: 100-65)
Vince Nowitzki drives, Shaquille Stewart stays with him. Vince Nowitzki attempts a Dunk. Contested by Shaquille Stewart (5.2 feet, MAN). Vince Nowitzki misses. Rebound secured by Shaquille Stewart.

[05:23] Team_017 possession (Score: 100-65)
Tobias Bridges drives to the basket... Tobias Bridges throws a bad pass out of bounds! TURNOVER! (dead ball)

[05:23] Substitution (Team_013): Manu Smith OUT → Gary Iverson IN (stamina_rule2)

[05:06] Team_013 possession (Score: 100-65)
Gary Iverson attempts a 3Pt. Contested by Tobias Bridges (2.7 feet, ZONE). Gary Iverson misses. FOUL! Loose ball foul on Shaquille Stewart during the rebound battle. [Team fouls: 4] No free throws, side out. (Shaquille Stewart: 1 personal fouls)

[04:53] Team_013 possession (Score: 100-65)
Chris Bryant attempts a 3Pt. Contested by Tobias Bridges (4.9 feet, MAN). CHRIS BRYANT MAKES IT! Assist: Jayson Nowitzki
Score: 100-68

[04:41] Team_017 possession (Score: 100-68)
Blake Reaves attempts a Midrange. Contested by Chris Bryant (6.0 feet, ZONE). Blake Reaves misses. Rebound secured by Jayson Nowitzki.

[04:29] Team_013 possession (Score: 100-68)
Dirk Booker attempts a 3Pt. Contested by Blake Reaves (5.6 feet, ZONE). DIRK BOOKER MAKES IT! Assist: Chris Bryant
Score: 100-71

[04:15] Team_017 possession (Score: 100-71)
Ja Stewart attempts a 3Pt. Wide open! Dirk Booker is 6.7 feet away. [MAN] JA STEWART MAKES IT!
Score: 103-71

[04:01] Team_013 possession (Score: 103-71)
Jayson Nowitzki drives to the basket... Jayson Nowitzki loses the ball! Stripped by Ja Stewart! TURNOVER! (live ball)

[03:48] Team_017 possession (Score: 103-71)
Shaquille Stewart attempts a 3Pt. Wide open! Chris Bryant is 6.9 feet away. [ZONE] SHAQUILLE STEWART MAKES IT! Assist: Klay Holiday
Score: 106-71

[03:34] Team_013 possession (Score: 106-71)
Vince Nowitzki attempts a 3Pt. Contested by Shaquille Stewart (4.9 feet, MAN). VINCE NOWITZKI MAKES IT! Assist: Gary Iverson
Score: 106-74

[03:18] Team_017 possession (Score: 106-74)
Blake Reaves attempts a 3Pt. Contested by Chris Bryant (5.9 feet, ZONE). Blake Reaves misses. Offensive rebound by Ja Stewart! Ja Stewart kicks it out.

[03:03] Team_017 possession (Score: 106-74)
Shaquille Stewart attempts a Midrange. Contested by Vince Nowitzki (4.9 feet, MAN). Shaquille Stewart misses. Rebound secured by Chris Bryant.

[02:49] Team_013 possession (Score: 106-74)
Chris Bryant attempts a 3Pt. Contested by Tobias Bridges (5.3 feet, MAN). Chris Bryant misses. Rebound secured by Ja Stewart.

[02:37] Team_017 possession (Score: 106-74)
Klay Holiday attempts a Layup. Heavily contested by Dirk Booker (1.1 feet, MAN)! KLAY HOLIDAY MAKES IT! Assist: Shaquille Stewart
Score: 108-74

[02:27] Team_013 possession (Score: 108-74)
Chris Bryant loses control! Ball rolls out of bounds! TURNOVER! (dead ball)

[02:13] Team_017 possession (Score: 108-74)
Ja Stewart attempts a Layup. Wide open! Jayson Nowitzki is 7.6 feet away. [ZONE] JA STEWART MAKES IT! Assist: Blake Reaves
Score: 110-74

[02:01] Team_013 possession (Score: 110-74)
FOUL! Reach-in foul on Klay Holiday during the drive. [IN THE BONUS! 5 team fouls] Jayson Nowitzki to the line for 2 free throws. (Klay Holiday: 2 personal fouls)   FT 1/2: GOOD   FT 2/2: GOOD Jayson Nowitzki makes 2/2 from the line.
Score: 110-76

[01:46] Team_017 possession (Score: 110-76)
Shaquille Stewart attempts a 3Pt. Wide open! Vince Nowitzki is 6.4 feet away. [MAN] SHAQUILLE STEWART MAKES IT! Assist: Blake Reaves
Score: 113-76

[01:28] Team_013 possession (Score: 113-76)
Dirk Booker attempts a 3Pt. Wide open! Tobias Bridges is 8.1 feet away. [ZONE] Dirk Booker misses. Rebound secured by Klay Holiday.

[01:16] Team_017 possession (Score: 113-76)
Klay Holiday drives and kicks out. Tobias Bridges attempts a Midrange. Contested by Vince Nowitzki (5.5 feet, ZONE). Tobias Bridges misses. Rebound secured by Jayson Nowitzki.

[01:03] Team_013 possession (Score: 113-76)
Chris Bryant drives and kicks out. Chris Bryant attempts a 3Pt. Contested by Tobias Bridges (3.1 feet, MAN). Chris Bryant misses. Rebound secured by Shaquille Stewart.

[00:50] Team_017 possession (Score: 113-76)
Ja Stewart attempts a 3Pt. Wide open! Dirk Booker is 7.9 feet away. [MAN] Ja Stewart misses. Rebound secured by Jayson Nowitzki.

[00:37] Team_013 possession (Score: 113-76)
Gary Iverson drives and kicks out. Dirk Booker attempts a Midrange. Wide open! Shaquille Stewart is 7.5 feet away. [ZONE] Dirk Booker misses. Rebound secured by Klay Holiday.

[00:27] Team_017 possession (Score: 113-76)
FOUL! Reach-in foul on Chris Bryant during the drive. [Team fouls: 3] No free throws, side out. (Chris Bryant: 1 personal fouls)

[00:16] Team_017 possession (Score: 113-76)
Ja Stewart drives to the basket... Ja Stewart loses the ball! Stripped by Jayson Nowitzki! TURNOVER! (live ball)

[00:05] Team_013 possession (Score: 113-76)
Vince Nowitzki attempts a 3Pt. Contested by Tobias Bridges (4.5 feet, ZONE). Vince Nowitzki misses. Rebound secured by Shaquille Stewart.

================================================================================
                              4TH QUARTER COMPLETE                              
================================================================================

4TH QUARTER SCORE: Team_017 25, Team_013 24

BOX SCORE:
================================================================================

Team_017
--------------------------------------------------------------------------------
Player                MIN  PTS  REB  AST  TO      FG   FG%      3P   3P%
--------------------------------------------------------------------------------
Ja Stewart             20   11    4    0   0   5/6    83.3     0/0   0.0
Shaquille Stewart      20    8    7    1   0   3/5    60.0     0/0   0.0
Tony Smith             28    2    0    0   0   1/1   100.0     0/0   0.0
Tobias Bridges         20    2    0    0   0   1/2    50.0     0/0   0.0
Klay Holiday           20    2    2    2   0   1/2    50.0     0/0   0.0
Bam Williamson         28    0    0    1   0   0/0     0.0     0/0   0.0
Blake Reaves           20    0    0    3   0   0/2     0.0     0/0   0.0

TEAM: FG: 11/18 (61.1%), 3PT: 3/6 (50.0%), REB: 13 (3 off, 10 def), AST: 7, TO: 5
TEAM FOULS: 5 [Team_013 in BONUS]


Team_013
--------------------------------------------------------------------------------
Player                MIN  PTS  REB  AST  TO      FG   FG%      3P   3P%
--------------------------------------------------------------------------------
Chris Bryant           20    9    1    1   0   3/5    60.0     0/0   0.0
Vince Nowitzki         20    7    0    0   0   3/7    42.9     0/0   0.0
Dirk Booker            20    5    3    1   0   2/3    66.7     0/0   0.0
Jayson Nowitzki        20    2    5    2   0   1/1   100.0     0/0   0.0
Manu Smith             35    0    0    1   0   0/2     0.0     0/0   0.0
Gary Iverson           13    0    0    1   0   0/1     0.0     0/0   0.0

TEAM: FG: 9/19 (47.4%), 3PT: 4/9 (44.4%), REB: 9 (2 off, 7 def), AST: 6, TO: 4
TEAM FOULS: 3

================================================================================

================================================================================
                               FULL GAME COMPLETE                               
================================================================================

FINAL SCORE: Team_017 113, Team_013 76

SCORING BY QUARTER:
--------------------------------------------------------------------------------
Team                     Q1     Q2     Q3     Q4    FINAL
--------------------------------------------------------------------------------
Team_017                 33     26     29     25      113
Team_013                 19     14     19     24       76
--------------------------------------------------------------------------------

FULL GAME BOX SCORE:
================================================================================

Team_017
--------------------------------------------------------------------------------
Player                MIN  PTS  REB  AST  TO      FG   FG%      3P   3P%      FT STL BLK
--------------------------------------------------------------------------------
Desmond Reaves         28   11    0    4   0   3/8    37.5   2/5    40.0   0/0     0   0
Vince Banchero         28    6    0    4   3   4/9    44.4   1/5    20.0   3/5     0   0
Tony Smith             28   22    5    7   0  11/16   68.8   3/4    75.0   4/6     0   2
Kyrie Middleton        28   10   12    3   1   4/6    66.7   2/2   100.0   0/1     0   0
Bam Williamson         28   20   11    2   0   7/11   63.6   0/2     0.0   1/1     2   0
Blake Reaves           20    5    0    5   2   2/6    33.3   1/3    33.3   0/0     0   0
Tobias Bridges         20    5    0    0   2   2/6    33.3   1/3    33.3   0/0     0   0
Shaquille Stewart      20   10    9    2   2   4/6    66.7   2/3    66.7   0/0     1   1
Ja Stewart             20   11    6    0   0   6/9    66.7   1/4    25.0   1/2     1   0
Klay Holiday           20    9    6    4   0   3/4    75.0   0/0     0.0   1/1     0   0

TEAM: FG: 47/83 (56.6%), 3PT: 13/31 (41.9%), REB: 49 (11 off, 38 def), AST: 31, TO: 10


Team_013
--------------------------------------------------------------------------------
Player                MIN  PTS  REB  AST  TO      FG   FG%      3P   3P%      FT STL BLK
--------------------------------------------------------------------------------
Manu Smith             35    8    0    3   0   3/8    37.5   1/4    25.0   3/3     0   0
Pau Mobley             28    9    7    3   4   4/10   40.0   0/5     0.0   1/1     0   0
Jayson Morant          28    5    0    2   2   2/7    28.6   1/3    33.3   0/0     0   0
Desmond Ginobili       28   14    7    1   0   5/10   50.0   1/4    25.0   4/4     2   0
Nikola Curry           28    5    9    0   3   4/11   36.4   0/0     0.0   1/2     0   0
Chris Bryant           20   12    3    1   1   5/8    62.5   2/3    66.7   3/5     1   0
Vince Nowitzki         20   10    0    2   1   4/8    50.0   1/3    33.3   1/1     0   0
Dirk Booker            20    5    5    1   0   2/4    50.0   1/2    50.0   0/0     1   1
Jayson Nowitzki        20    7    9    2   2   4/5    80.0   0/1     0.0   3/4     1   0
Gary Iverson           13    0    0    1   4   0/2     0.0   0/1     0.0   0/0     0   0

TEAM: FG: 33/73 (45.2%), 3PT: 7/26 (26.9%), REB: 40 (4 off, 36 def), AST: 16, TO: 17

================================================================================
