================================================================================
                        FULL GAME - Team_028 vs Team_010                        
================================================================================

================================================================================
                       1ST QUARTER - Team_028 vs Team_010                       
================================================================================

[12:00] Team_028 possession (Score: 0-0)
Austin Russell attempts a 3Pt. Wide open! Cade Morant is 8.0 feet away. [ZONE] AUSTIN RUSSELL MAKES IT! Assist: Jimmy Brogdon
Score: 3-0

[11:46] Team_010 possession (Score: 3-0)
Cade Morant attempts a Layup. BLOCKED BY CARMELO CARTER! Ball deflects out of bounds off Cade Morant.

[11:33] Team_028 possession (Score: 3-0)
Myles Haliburton attempts a 3Pt. Contested by Cade Morant (4.8 feet, ZONE). Myles Haliburton misses. Rebound secured by Desmond Antetokounmpo.

[11:18] Team_010 possession (Score: 3-0)
RJ Young makes the 3Pt and draws the foul on Myles Haliburton! And-1! RJ Young to the line for 1. [Team fouls: 1] (Myles Haliburton: 1 personal fouls)   FT 1/1: MISS RJ Young makes 0/1 from the line. Rebound secured by Carmelo Carter.
Score: 3-3

[11:03] Team_028 possession (Score: 3-3)
Jimmy Brogdon drives and kicks out. Kawhi Ball attempts a 3Pt. Contested by Cade Morant (2.9 feet, ZONE). KAWHI BALL MAKES IT! Assist: Jimmy Brogdon
Score: 6-3

[10:49] Team_010 possession (Score: 6-3)
RJ Young attempts a 3Pt. Contested by Austin Russell (3.5 feet, ZONE). RJ Young misses. Rebound secured by Jimmy Brogdon.

[10:34] Team_028 possession (Score: 6-3)
Kawhi Ball attempts a Midrange. Wide open! Michael Turner is 8.0 feet away. [ZONE] Kawhi Ball misses. Rebound secured by Cade Morant.

[10:16] Team_010 possession (Score: 6-3)
Michael Turner attempts a Midrange. Contested by Carmelo Carter (2.2 feet, ZONE). MICHAEL TURNER MAKES IT!
Score: 6-5

[10:01] Team_028 possession (Score: 6-5)
Kawhi Ball attempts a Midrange. Heavily contested by Desmond Antetokounmpo (1.3 feet, ZONE)! Kawhi Ball misses. Offensive rebound by Jimmy Brogdon! Jimmy Brogdon kicks it out.

[09:50] Team_028 possession (Score: 6-5)
Jimmy Brogdon attempts a Midrange. BLOCKED BY ANTHONY DURANT! Ball is loose! Offensive rebound by Jimmy Brogdon! Jimmy Brogdon kicks it out.

[09:31] Team_028 possession (Score: 6-5)
Jimmy Brogdon drives, Anthony Durant stays with him. Jimmy Brogdon attempts a Dunk. Wide open! Anthony Durant is 6.7 feet away. [ZONE] Jimmy Brogdon misses. Rebound secured by Cade Morant.

[09:13] Team_010 possession (Score: 6-5)
Desmond Antetokounmpo attempts a Midrange. Heavily contested by Myles Haliburton (0.9 feet, ZONE)! Desmond Antetokounmpo misses. FOUL! Loose ball foul on Carmelo Carter during the rebound battle. [Team fouls: 2] No free throws, side out. (Carmelo Carter: 1 personal fouls)

[08:56] Team_010 possession (Score: 6-5)
Cade Morant attempts a Midrange. Wide open! Austin Russell is 8.4 feet away. [MAN] Cade Morant misses. Offensive rebound by Cade Morant! Cade Morant kicks it out.

[08:40] Team_010 possession (Score: 6-5)
Michael Turner attempts a 3Pt. Contested by Carmelo Carter (5.1 feet, MAN). Michael Turner misses. FOUL! Loose ball foul on Jimmy Brogdon during the rebound battle. [Team fouls: 3] No free throws, side out. (Jimmy Brogdon: 1 personal fouls)

[08:29] Team_010 possession (Score: 6-5)
Michael Turner attempts a Layup. BLOCKED BY KAWHI BALL! Ball goes out off Kawhi Ball. Michael Turner's ball!

[08:19] Team_010 possession (Score: 6-5)
RJ Young drives and kicks out. Desmond Antetokounmpo attempts a 3Pt. Wide open! Kawhi Ball is 7.1 feet away. [MAN] Desmond Antetokounmpo misses. Offensive rebound by Anthony Durant! Anthony Durant kicks it out.

[08:02] Team_010 possession (Score: 6-5)
RJ Young attempts a Midrange. Contested by Kawhi Ball (4.2 feet, ZONE). RJ YOUNG MAKES IT!
Score: 6-7

[07:44] Team_028 possession (Score: 6-7)
Myles Haliburton attempts a 3Pt. Contested by RJ Young (2.9 feet, MAN). MYLES HALIBURTON MAKES IT! Assist: Kawhi Ball
Score: 9-7

[07:30] Team_010 possession (Score: 9-7)
Michael Turner drives, Carmelo Carter stays with him. Michael Turner attempts a Dunk. Wide open! Carmelo Carter is 7.9 feet away. [MAN] Michael Turner misses. Rebound secured by Jimmy Brogdon.

[07:15] Team_028 possession (Score: 9-7)
Myles Haliburton attempts a 3Pt. Contested by RJ Young (2.6 feet, MAN). Myles Haliburton misses. Rebound secured by Desmond Antetokounmpo.

[06:59] Team_010 possession (Score: 9-7)
Desmond Antetokounmpo attempts a Layup. Wide open! Kawhi Ball is 6.8 feet away. [ZONE] DESMOND ANTETOKOUNMPO MAKES IT! Assist: Anthony Durant
Score: 9-9

[06:43] Team_028 possession (Score: 9-9)
Myles Haliburton attempts a 3Pt. Contested by RJ Young (3.7 feet, MAN). Myles Haliburton misses. Rebound secured by Anthony Durant.

[06:31] Team_010 possession (Score: 9-9)
Desmond Antetokounmpo drives, picks up Kawhi Ball. Help arrives from Carmelo Carter! Desmond Antetokounmpo attempts a Layup. Contested by Carmelo Carter (5.3 feet, MAN). DESMOND ANTETOKOUNMPO MAKES IT! Assist: RJ Young
Score: 9-11

[06:14] Team_028 possession (Score: 9-11)
Myles Haliburton drives and kicks out. Kawhi Ball attempts a 3Pt. Contested by Cade Morant (4.9 feet, ZONE). Kawhi Ball misses. Rebound secured by Cade Morant.

[06:01] Team_010 possession (Score: 9-11)
FOUL! Offensive foul on Anthony Durant! Jimmy Brogdon drew the charge! [Team fouls: 1] (Anthony Durant: 1 personal fouls) TURNOVER! (dead ball)

[05:46] Team_028 possession (Score: 9-11)
Carmelo Carter attempts a 3Pt. Contested by Michael Turner (4.4 feet, MAN). CARMELO CARTER MAKES IT! Assist: Myles Haliburton
Score: 12-11

[05:33] Team_010 possession (Score: 12-11)
FOUL! Reach-in foul on Carmelo Carter during the drive. [Team fouls: 4] No free throws, side out. (Carmelo Carter: 2 personal fouls)

[05:18] Team_010 possession (Score: 12-11)
FOUL! Shooting foul on Kawhi Ball. Desmond Antetokounmpo to the line for 2 free throws. [BONUS: 5 team fouls] (Kawhi Ball: 1 personal fouls)   FT 1/2: GOOD   FT 2/2: GOOD Desmond Antetokounmpo makes 2/2 from the line.
Score: 12-13

[05:04] Team_028 possession (Score: 12-13)
Austin Russell attempts a 3Pt. Heavily contested by Cade Morant (1.9 feet, MAN)! Austin Russell misses. Offensive rebound by Kawhi Ball! Kawhi Ball kicks it out.

[04:52] Team_028 possession (Score: 12-13)
Carmelo Carter attempts a Layup. Contested by Michael Turner (3.1 feet, MAN). CARMELO CARTER MAKES IT!
Score: 14-13

[04:35] Team_010 possession (Score: 14-13)
Cade Morant drives, Kawhi Ball stays with him. Cade Morant attempts a Layup. Contested by Kawhi Ball (5.3 feet, ZONE). CADE MORANT MAKES IT! Assist: RJ Young
Score: 14-15

[04:23] Team_028 possession (Score: 14-15)
Myles Haliburton commits a violation (traveling/carry)! TURNOVER! (dead ball)

[04:11] Team_010 possession (Score: 14-15)
Cade Morant makes the Layup and draws the foul on Kawhi Ball! And-1! Cade Morant to the line for 1. [BONUS: 6 team fouls] (Kawhi Ball: 2 personal fouls)   FT 1/1: MISS Cade Morant makes 0/1 from the line. Rebound secured by Kawhi Ball.
Score: 14-17

[03:55] Team_028 possession (Score: 14-17)
Jimmy Brogdon drives, picks up Anthony Durant. Help arrives from Cade Morant! Jimmy Brogdon attempts a Dunk. Heavily contested by Cade Morant (0.5 feet, ZONE)! JIMMY BROGDON MAKES IT! Assist: Myles Haliburton
Score: 16-17

[03:39] Team_010 possession (Score: 16-17)
Anthony Durant attempts a Midrange. Contested by Kawhi Ball (2.4 feet, ZONE). Anthony Durant misses. Rebound secured by Jimmy Brogdon.

[03:25] Team_028 possession (Score: 16-17)
Kawhi Ball attempts a 3Pt. Wide open! Cade Morant is 6.6 feet away. [ZONE] Kawhi Ball misses. Rebound secured by Michael Turner.

[03:10] Team_010 possession (Score: 16-17)
Anthony Durant drives and kicks out. Michael Turner attempts a 3Pt. Contested by Carmelo Carter (4.3 feet, MAN). Michael Turner misses. Offensive rebound by Cade Morant! Cade Morant kicks it out.

[02:57] Team_010 possession (Score: 16-17)
Desmond Antetokounmpo attempts a Midrange. Contested by Kawhi Ball (5.1 feet, MAN). Desmond Antetokounmpo misses. Rebound secured by Kawhi Ball.

[02:40] Team_028 possession (Score: 16-17)
FOUL! Holding foul on Michael Turner. [Team fouls: 2] No free throws, side out. (Michael Turner: 1 personal fouls)

[02:28] Team_028 possession (Score: 16-17)
Carmelo Carter drives, Michael Turner stays with him. Carmelo Carter attempts a Layup. Contested by Michael Turner (2.4 feet, MAN). CARMELO CARTER MAKES IT! Assist: Myles Haliburton
Score: 18-17

[02:12] Team_010 possession (Score: 18-17)
Michael Turner makes the Midrange and draws the foul on Carmelo Carter! And-1! Michael Turner to the line for 1. [BONUS: 7 team fouls] (Carmelo Carter: 3 personal fouls)   FT 1/1: GOOD Michael Turner makes 1/1 from the line.
Score: 18-20

[01:55] Team_028 possession (Score: 18-20)
Carmelo Carter attempts a Midrange. Heavily contested by RJ Young (1.6 feet, ZONE)! Carmelo Carter misses. Rebound secured by Michael Turner.

[01:42] Team_010 possession (Score: 18-20)
Anthony Durant attempts a 3Pt. Wide open! Jimmy Brogdon is 7.8 feet away. [MAN] Anthony Durant misses. Rebound secured by Jimmy Brogdon.

[01:26] Team_028 possession (Score: 18-20)
Jimmy Brogdon drives and kicks out. Kawhi Ball attempts a 3Pt. Contested by Desmond Antetokounmpo (5.6 feet, MAN). KAWHI BALL MAKES IT! Assist: Carmelo Carter
Score: 21-20

[01:07] Team_010 possession (Score: 21-20)
RJ Young drives, Myles Haliburton stays with him. RJ Young attempts a Dunk. Contested by Myles Haliburton (4.4 feet, MAN). RJ Young misses. Offensive rebound by Anthony Durant! Anthony Durant kicks it out.

[00:53] Team_010 possession (Score: 21-20)
Anthony Durant drives and kicks out. Desmond Antetokounmpo attempts a 3Pt. Contested by Austin Russell (5.7 feet, ZONE). Desmond Antetokounmpo misses. Rebound secured by Jimmy Brogdon.

[00:38] Team_028 possession (Score: 21-20)
Kawhi Ball attempts a Midrange. Contested by Desmond Antetokounmpo (2.5 feet, MAN). Kawhi Ball misses. Rebound secured by Cade Morant.

[00:21] Team_010 possession (Score: 21-20)
Michael Turner attempts a 3Pt. Wide open! Carmelo Carter is 7.1 feet away. [MAN] Michael Turner misses. Rebound secured by Carmelo Carter.

[00:02] Team_028 possession (Score: 21-20)
FOUL! Offensive foul on Kawhi Ball! Desmond Antetokounmpo drew the charge! [Team fouls: 8] (Kawhi Ball: 3 personal fouls) TURNOVER! (dead ball)

================================================================================
                              1ST QUARTER COMPLETE                              
================================================================================

1ST QUARTER SCORE: Team_028 21, Team_010 20

BOX SCORE:
================================================================================

Team_028
--------------------------------------------------------------------------------
Player                MIN  PTS  REB  AST  TO      FG   FG%      3P   3P%
--------------------------------------------------------------------------------
Carmelo Carter         12    7    2    1   0   3/4    75.0     0/0   0.0
Kawhi Ball             12    6    3    1   0   2/5    40.0     0/0   0.0
Austin Russell         12    3    0    0   0   1/1   100.0     0/0   0.0
Myles Haliburton       12    3    0    3   0   1/5    20.0     0/0   0.0
Jimmy Brogdon          12    2    7    2   0   1/2    50.0     0/0   0.0

TEAM: FG: 8/17 (47.1%), 3PT: 3/7 (42.9%), REB: 12 (3 off, 9 def), AST: 7, TO: 2
TEAM FOULS: 8 [Team_010 in BONUS]


Team_010
--------------------------------------------------------------------------------
Player                MIN  PTS  REB  AST  TO      FG   FG%      3P   3P%
--------------------------------------------------------------------------------
Desmond Antetokounmpo   12    6    2    0   0   3/4    75.0     0/0   0.0
Michael Turner         12    5    2    0   0   2/4    50.0     0/0   0.0
Cade Morant            12    2    7    0   0   1/3    33.3     0/0   0.0
RJ Young               12    2    0    2   0   1/3    33.3     0/0   0.0
Anthony Durant         12    0    4    1   0   0/3     0.0     0/0   0.0

TEAM: FG: 7/17 (41.2%), 3PT: 0/4 (0.0%), REB: 15 (6 off, 9 def), AST: 3, TO: 1
TEAM FOULS: 2

================================================================================

================================================================================
                       2ND QUARTER - Team_028 vs Team_010                       
================================================================================

[12:00] Team_028 possession (Score: 21-20)
Carmelo Carter attempts a 3Pt. Contested by Michael Turner (5.3 feet, MAN). CARMELO CARTER MAKES IT! Assist: Jimmy Brogdon
Score: 24-20

[11:45] Team_010 possession (Score: 24-20)
Anthony Durant attempts a 3Pt. Contested by Jimmy Brogdon (4.5 feet, MAN). Anthony Durant misses. Rebound secured by Kawhi Ball.

[11:29] Team_028 possession (Score: 24-20)
Kawhi Ball attempts a Midrange. Contested by Desmond Antetokounmpo (3.7 feet, MAN). Kawhi Ball misses. Rebound secured by Cade Morant.

[11:15] Team_010 possession (Score: 24-20)
Anthony Durant attempts a 3Pt. Heavily contested by Austin Russell (0.5 feet, ZONE)! Anthony Durant misses. Rebound secured by Carmelo Carter.

[11:00] Team_028 possession (Score: 24-20)
Myles Haliburton attempts a 3Pt. Wide open! RJ Young is 7.3 feet away. [MAN] MYLES HALIBURTON MAKES IT! Assist: Austin Russell
Score: 27-20

[10:44] Team_010 possession (Score: 27-20)
Michael Turner attempts a 3Pt. Contested by Austin Russell (4.1 feet, ZONE). Michael Turner misses. Rebound secured by Carmelo Carter.

[10:30] Team_028 possession (Score: 27-20)
Jimmy Brogdon drives and kicks out. Austin Russell attempts a Midrange. Contested by Desmond Antetokounmpo (5.6 feet, ZONE). Austin Russell misses. FOUL! Loose ball foul on Cade Morant during the rebound battle. [Team fouls: 1] No free throws, side out. (Cade Morant: 1 personal fouls)

[10:15] Team_028 possession (Score: 27-20)
Myles Haliburton attempts a 3Pt. Wide open! Cade Morant is 6.6 feet away. [ZONE] Myles Haliburton misses. Rebound secured by Anthony Durant.

[10:00] Team_010 possession (Score: 27-20)
FOUL! Shooting foul on Austin Russell. Michael Turner to the line for 3 free throws. [Team fouls: 1] (Austin Russell: 1 personal fouls)   FT 1/3: GOOD   FT 2/3: MISS   FT 3/3: GOOD Michael Turner makes 2/3 from the line.
Score: 27-22

[09:45] Team_028 possession (Score: 27-22)
Kawhi Ball attempts a 3Pt. Wide open! Cade Morant is 6.9 feet away. [ZONE] KAWHI BALL MAKES IT! Assist: Jimmy Brogdon
Score: 30-22

[09:31] Team_010 possession (Score: 30-22)
Anthony Durant attempts a Midrange. Contested by Kawhi Ball (3.7 feet, ZONE). Anthony Durant misses. Offensive rebound by Anthony Durant! Anthony Durant kicks it out.

[09:17] Team_010 possession (Score: 30-22)
Cade Morant loses control! Ball rolls out of bounds! TURNOVER! (dead ball)

[09:17] Substitution (Team_028): Austin Russell OUT → Scottie Ingram IN (stamina_rule2)

[09:17] Substitution (Team_028): Carmelo Carter OUT → Tyrese Quickley IN (stamina_rule2)

[09:17] Substitution (Team_028): Myles Haliburton OUT → Miles Booker IN (stamina_rule2)

[09:17] Substitution (Team_028): Kawhi Ball OUT → Bam Towns IN (stamina_rule2)

[09:17] Substitution (Team_028): Jimmy Brogdon OUT → Collin Bridges IN (stamina_rule2)

[09:17] Substitution (Team_010): Cade Morant OUT → Draymond Leonard IN (stamina_rule2)

[09:17] Substitution (Team_010): Michael Turner OUT → Blake Harden IN (stamina_rule2)

[09:17] Substitution (Team_010): RJ Young OUT → Ben Gilgeous-Alexander IN (stamina_rule2)

[09:17] Substitution (Team_010): Desmond Antetokounmpo OUT → Vince Ingram IN (stamina_rule2)

[09:17] Substitution (Team_010): Anthony Durant OUT → Paolo Wade IN (stamina_rule2)

[09:03] Team_028 possession (Score: 30-22)
Miles Booker attempts a 3Pt. Contested by Ben Gilgeous-Alexander (2.8 feet, MAN). Miles Booker misses. Rebound secured by Ben Gilgeous-Alexander.

[08:50] Team_010 possession (Score: 30-22)
Draymond Leonard makes the Midrange and draws the foul on Scottie Ingram! And-1! Draymond Leonard to the line for 1. [Team fouls: 2] (Scottie Ingram: 1 personal fouls)   FT 1/1: GOOD Draymond Leonard makes 1/1 from the line.
Score: 30-25

[08:37] Team_028 possession (Score: 30-25)
Miles Booker drives to the basket... Miles Booker throws a bad pass out of bounds! TURNOVER! (dead ball)

[08:23] Team_010 possession (Score: 30-25)
FOUL! Shooting foul on Collin Bridges. Paolo Wade to the line for 2 free throws. [Team fouls: 3] (Collin Bridges: 1 personal fouls)   FT 1/2: MISS   FT 2/2: GOOD Paolo Wade makes 1/2 from the line.
Score: 30-26

[08:09] Team_028 possession (Score: 30-26)
Scottie Ingram drives and kicks out. Scottie Ingram attempts a 3Pt. Contested by Blake Harden (3.0 feet, ZONE). Scottie Ingram misses. Offensive rebound by Bam Towns! Bam Towns kicks it out.

[07:53] Team_028 possession (Score: 30-26)
Tyrese Quickley attempts a 3Pt. Wide open! Blake Harden is 7.0 feet away. [MAN] Tyrese Quickley misses. Rebound secured by Ben Gilgeous-Alexander.

[07:37] Team_010 possession (Score: 30-26)
Vince Ingram attempts a 3Pt. Wide open! Scottie Ingram is 8.2 feet away. [ZONE] VINCE INGRAM MAKES IT! Assist: Blake Harden
Score: 30-29

[07:26] Team_028 possession (Score: 30-29)
Bam Towns attempts a Layup. Contested by Vince Ingram (5.7 feet, MAN). Bam Towns misses. Rebound secured by Blake Harden.

[07:10] Team_010 possession (Score: 30-29)
Draymond Leonard drives and kicks out. Blake Harden attempts a Midrange. Wide open! Miles Booker is 6.2 feet away. [ZONE] Blake Harden misses. Rebound secured by Bam Towns.

[06:58] Team_028 possession (Score: 30-29)
Bam Towns attempts a Layup. Contested by Paolo Wade (4.2 feet, ZONE). Bam Towns misses. Rebound secured by Paolo Wade.

[06:42] Team_010 possession (Score: 30-29)
FOUL! Shooting foul on Tyrese Quickley. Blake Harden to the line for 3 free throws. [Team fouls: 4] (Tyrese Quickley: 1 personal fouls)   FT 1/3: GOOD   FT 2/3: MISS   FT 3/3: GOOD Blake Harden makes 2/3 from the line.
Score: 30-31

[06:27] Team_028 possession (Score: 30-31)
FOUL! Shooting foul on Blake Harden. Tyrese Quickley to the line for 2 free throws. [Team fouls: 2] (Blake Harden: 1 personal fouls)   FT 1/2: GOOD   FT 2/2: GOOD Tyrese Quickley makes 2/2 from the line.
Score: 32-31

[06:12] Team_010 possession (Score: 32-31)
Ben Gilgeous-Alexander loses the ball! Stripped by Miles Booker! TURNOVER! (live ball)

[05:57] Team_028 possession (Score: 32-31)
Bam Towns attempts a 3Pt. Contested by Draymond Leonard (3.8 feet, ZONE). BAM TOWNS MAKES IT!
Score: 35-31

[05:42] Team_010 possession (Score: 35-31)
Draymond Leonard attempts a 3Pt. Contested by Scottie Ingram (4.2 feet, ZONE). DRAYMOND LEONARD MAKES IT! Assist: Vince Ingram
Score: 35-34

[05:26] Team_028 possession (Score: 35-34)
Collin Bridges drives, Paolo Wade stays with him. Collin Bridges attempts a Layup. Wide open! Paolo Wade is 10.0 feet away. [MAN] COLLIN BRIDGES MAKES IT! Assist: Scottie Ingram
Score: 37-34

[05:08] Team_010 possession (Score: 37-34)
Blake Harden attempts a Midrange. Heavily contested by Bam Towns (0.9 feet, ZONE)! Blake Harden misses. Rebound secured by Bam Towns.

[04:55] Team_028 possession (Score: 37-34)
Bam Towns attempts a 3Pt. Wide open! Vince Ingram is 6.2 feet away. [MAN] Bam Towns misses. Rebound secured by Paolo Wade.

[04:40] Team_010 possession (Score: 37-34)
Blake Harden attempts a Midrange. Wide open! Tyrese Quickley is 6.8 feet away. [MAN] BLAKE HARDEN MAKES IT!
Score: 37-36

[04:23] Team_028 possession (Score: 37-36)
Scottie Ingram attempts a Layup. BLOCKED BY BEN GILGEOUS-ALEXANDER! Ball is loose! Rebound secured by Paolo Wade.

[04:08] Team_010 possession (Score: 37-36)
Vince Ingram drives to the basket... Vince Ingram throws a bad pass out of bounds! TURNOVER! (dead ball)

[03:53] Team_028 possession (Score: 37-36)
FOUL! Reach-in foul on Paolo Wade during the drive. [Team fouls: 3] No free throws, side out. (Paolo Wade: 1 personal fouls)

[03:37] Team_028 possession (Score: 37-36)
Miles Booker attempts a 3Pt. Heavily contested by Draymond Leonard (0.5 feet, ZONE)! MILES BOOKER MAKES IT! Assist: Scottie Ingram
Score: 40-36

[03:20] Team_010 possession (Score: 40-36)
Blake Harden attempts a 3Pt. Wide open! Scottie Ingram is 6.4 feet away. [ZONE] BLAKE HARDEN MAKES IT! Assist: Ben Gilgeous-Alexander
Score: 40-39

[03:03] Team_028 possession (Score: 40-39)
Scottie Ingram attempts a Layup. BLOCKED BY BEN GILGEOUS-ALEXANDER! Ball is loose! Rebound secured by Ben Gilgeous-Alexander.

[02:52] Team_010 possession (Score: 40-39)
Vince Ingram attempts a Midrange. Wide open! Miles Booker is 9.2 feet away. [ZONE] VINCE INGRAM MAKES IT!
Score: 40-41

[02:40] Team_028 possession (Score: 40-41)
Miles Booker attempts a Layup. Wide open! Paolo Wade is 6.5 feet away. [ZONE] MILES BOOKER MAKES IT!
Score: 42-41

[02:22] Team_010 possession (Score: 42-41)
Blake Harden drives, Collin Bridges stays with him. Blake Harden attempts a Dunk. Wide open! Collin Bridges is 6.3 feet away. [ZONE] Blake Harden misses. Rebound secured by Bam Towns.

[02:04] Team_028 possession (Score: 42-41)
Collin Bridges attempts a Midrange. Wide open! Paolo Wade is 7.6 feet away. [MAN] COLLIN BRIDGES MAKES IT! Assist: Miles Booker
Score: 44-41

[01:48] Team_010 possession (Score: 44-41)
Ben Gilgeous-Alexander attempts a 3Pt. Contested by Scottie Ingram (5.2 feet, ZONE). Ben Gilgeous-Alexander misses. Rebound secured by Tyrese Quickley.

[01:39] Team_028 possession (Score: 44-41)
FOUL! Offensive foul on Tyrese Quickley! Blake Harden drew the charge! [Team fouls: 5] (Tyrese Quickley: 2 personal fouls) TURNOVER! (dead ball)

[01:26] Team_010 possession (Score: 44-41)
Paolo Wade drives and kicks out. Vince Ingram attempts a Midrange. Contested by Tyrese Quickley (3.0 feet, ZONE). VINCE INGRAM MAKES IT!
Score: 44-43

[01:14] Team_028 possession (Score: 44-43)
Miles Booker attempts a 3Pt. Contested by Ben Gilgeous-Alexander (3.1 feet, MAN). Miles Booker misses. Rebound secured by Paolo Wade.

[01:01] Team_010 possession (Score: 44-43)
Draymond Leonard drives to the basket... Draymond Leonard loses the ball! Stripped by Bam Towns! TURNOVER! (live ball)

[00:45] Team_028 possession (Score: 44-43)
Scottie Ingram attempts a Midrange. BLOCKED BY BEN GILGEOUS-ALEXANDER! Ball is loose! Rebound secured by Paolo Wade.

[00:31] Team_010 possession (Score: 44-43)
Blake Harden makes the Layup and draws the foul on Collin Bridges! And-1! Blake Harden to the line for 1. [BONUS: 6 team fouls] (Collin Bridges: 2 personal fouls)   FT 1/1: GOOD Blake Harden makes 1/1 from the line.
Score: 44-46

[00:14] Team_028 possession (Score: 44-46)
Collin Bridges drives and kicks out. Collin Bridges attempts a 3Pt. Wide open! Paolo Wade is 7.7 feet away. [MAN] Collin Bridges misses. FOUL! Loose ball foul on Ben Gilgeous-Alexander during the rebound battle. [Team fouls: 4] No free throws, side out. (Ben Gilgeous-Alexander: 1 personal fouls)

================================================================================
                              2ND QUARTER COMPLETE                              
================================================================================

2ND QUARTER SCORE: Team_028 23, Team_010 26

BOX SCORE:
================================================================================

Team_028
--------------------------------------------------------------------------------
Player                MIN  PTS  REB  AST  TO      FG   FG%      3P   3P%
--------------------------------------------------------------------------------
Miles Booker            9    5    0    1   0   2/4    50.0     0/0   0.0
Collin Bridges          9    4    0    0   0   2/2   100.0     0/0   0.0
Carmelo Carter         15    3    2    0   0   1/1   100.0     0/0   0.0
Kawhi Ball             15    3    2    0   0   1/2    50.0     0/0   0.0
Myles Haliburton       15    3    0    0   0   1/2    50.0     0/0   0.0
Bam Towns               9    3    5    0   0   1/4    25.0     0/0   0.0
Tyrese Quickley         9    2    1    0   0   1/2    50.0     0/0   0.0
Jimmy Brogdon          15    0    0    2   0   0/0     0.0     0/0   0.0
Austin Russell         15    0    0    1   0   0/0     0.0     0/0   0.0
Scottie Ingram          9    0    0    2   0   0/3     0.0     0/0   0.0

TEAM: FG: 9/20 (45.0%), 3PT: 5/10 (50.0%), REB: 10 (3 off, 7 def), AST: 6, TO: 2
TEAM FOULS: 6 [Team_010 in BONUS]


Team_010
--------------------------------------------------------------------------------
Player                MIN  PTS  REB  AST  TO      FG   FG%      3P   3P%
--------------------------------------------------------------------------------
Blake Harden            9   10    1    1   0   4/6    66.7     0/0   0.0
Vince Ingram            9    7    0    1   0   3/3   100.0     0/0   0.0
Draymond Leonard        9    6    0    0   0   2/3    66.7     0/0   0.0
Michael Turner         15    2    0    0   0   1/2    50.0     0/0   0.0
Paolo Wade              9    1    5    0   0   1/1   100.0     0/0   0.0
Anthony Durant         15    0    2    0   0   0/2     0.0     0/0   0.0
Cade Morant            15    0    1    0   0   0/0     0.0     0/0   0.0
Ben Gilgeous-Alexander    9    0    3    1   0   0/1     0.0     0/0   0.0

TEAM: FG: 11/18 (61.1%), 3PT: 5/9 (55.6%), REB: 12 (1 off, 11 def), AST: 3, TO: 4
TEAM FOULS: 4

================================================================================

================================================================================
                       3RD QUARTER - Team_028 vs Team_010                       
================================================================================

[12:00] Team_028 possession (Score: 44-46)
Kawhi Ball drives and kicks out. Jimmy Brogdon attempts a Midrange. Contested by Anthony Durant (2.3 feet, MAN). Jimmy Brogdon misses. Rebound secured by Desmond Antetokounmpo.

[11:45] Team_010 possession (Score: 44-46)
Cade Morant attempts a 3Pt. Wide open! Austin Russell is 7.1 feet away. [MAN] CADE MORANT MAKES IT! Assist: Anthony Durant
Score: 44-49

[11:31] Team_028 possession (Score: 44-49)
Myles Haliburton loses the ball! Stripped by RJ Young! TURNOVER! (live ball)

[11:17] Team_010 possession (Score: 44-49)
Anthony Durant attempts a Midrange. Contested by Jimmy Brogdon (2.1 feet, MAN). Anthony Durant misses. Rebound secured by Kawhi Ball.

[11:05] Team_028 possession (Score: 44-49)
Jimmy Brogdon drives, picks up Anthony Durant. Help arrives from Cade Morant! Jimmy Brogdon attempts a Layup. Heavily contested by Cade Morant (1.8 feet, ZONE)! JIMMY BROGDON MAKES IT!
Score: 46-49

[10:48] Team_010 possession (Score: 46-49)
RJ Young attempts a 3Pt. Contested by Myles Haliburton (3.0 feet, MAN). RJ Young misses. Offensive rebound by Cade Morant! Cade Morant kicks it out.

[10:33] Team_010 possession (Score: 46-49)
Cade Morant drives and kicks out. Michael Turner attempts a 3Pt. Contested by Austin Russell (5.0 feet, ZONE). MICHAEL TURNER MAKES IT! Assist: Anthony Durant
Score: 46-52

[10:16] Team_028 possession (Score: 46-52)
Kawhi Ball loses the ball! Stripped by Desmond Antetokounmpo! TURNOVER! (live ball)

[10:03] Team_010 possession (Score: 46-52)
FOUL! Holding foul on Kawhi Ball. [Team fouls: 1] No free throws, side out. (Kawhi Ball: 1 personal fouls)

[09:48] Team_010 possession (Score: 46-52)
Anthony Durant attempts a Midrange. Contested by Kawhi Ball (5.6 feet, ZONE). Anthony Durant misses. FOUL! Loose ball foul on Carmelo Carter during the rebound battle. [Team fouls: 2] No free throws, side out. (Carmelo Carter: 1 personal fouls)

[09:37] Team_010 possession (Score: 46-52)
Cade Morant loses the ball! Stripped by Austin Russell! TURNOVER! (live ball)

[09:25] Team_028 possession (Score: 46-52)
Carmelo Carter attempts a Midrange. Heavily contested by Michael Turner (0.5 feet, MAN)! Carmelo Carter misses. Rebound secured by Anthony Durant.

[09:08] Team_010 possession (Score: 46-52)
RJ Young attempts a 3Pt. Contested by Austin Russell (4.6 feet, ZONE). RJ YOUNG MAKES IT! Assist: Michael Turner
Score: 46-55

[08:56] Team_028 possession (Score: 46-55)
Jimmy Brogdon drives and kicks out. Myles Haliburton attempts a 3Pt. Heavily contested by Cade Morant (0.5 feet, ZONE)! MYLES HALIBURTON MAKES IT! Assist: Carmelo Carter
Score: 49-55

[08:44] Team_010 possession (Score: 49-55)
FOUL! Reach-in foul on Jimmy Brogdon during the drive. [Team fouls: 3] No free throws, side out. (Jimmy Brogdon: 1 personal fouls)

[08:32] Team_010 possession (Score: 49-55)
Anthony Durant makes the Layup and draws the foul on Jimmy Brogdon! And-1! Anthony Durant to the line for 1. [Team fouls: 4] (Jimmy Brogdon: 2 personal fouls)   FT 1/1: MISS Anthony Durant makes 0/1 from the line. Rebound secured by Carmelo Carter.
Score: 49-57

[08:18] Team_028 possession (Score: 49-57)
Kawhi Ball drives, Anthony Durant stays with him. Kawhi Ball attempts a Dunk. Contested by Anthony Durant (3.8 feet, ZONE). KAWHI BALL MAKES IT!
Score: 51-57

[08:08] Team_010 possession (Score: 51-57)
Anthony Durant drives and kicks out. RJ Young makes the Midrange and draws the foul on Jimmy Brogdon! And-1! RJ Young to the line for 1. [BONUS: 5 team fouls] (Jimmy Brogdon: 3 personal fouls)   FT 1/1: GOOD RJ Young makes 1/1 from the line.
Score: 51-60

[07:49] Team_028 possession (Score: 51-60)
Austin Russell makes the Layup and draws the foul on Anthony Durant! And-1! Austin Russell to the line for 1. [Team fouls: 1] (Anthony Durant: 1 personal fouls)   FT 1/1: GOOD Austin Russell makes 1/1 from the line.
Score: 54-60

[07:36] Team_010 possession (Score: 54-60)
FOUL! Offensive foul on Cade Morant! Austin Russell drew the charge! [Team fouls: 2] (Cade Morant: 1 personal fouls) TURNOVER! (dead ball)

[07:24] Team_028 possession (Score: 54-60)
Kawhi Ball drives, Desmond Antetokounmpo stays with him. Kawhi Ball attempts a Layup. Contested by Desmond Antetokounmpo (5.0 feet, MAN). KAWHI BALL MAKES IT! Assist: Austin Russell
Score: 56-60

[07:09] Team_010 possession (Score: 56-60)
Desmond Antetokounmpo attempts a Midrange. Contested by Kawhi Ball (3.0 feet, MAN). DESMOND ANTETOKOUNMPO MAKES IT! Assist: RJ Young
Score: 56-62

[06:57] Team_028 possession (Score: 56-62)
Kawhi Ball attempts a Layup. Contested by Desmond Antetokounmpo (4.7 feet, ZONE). KAWHI BALL MAKES IT! Assist: Myles Haliburton
Score: 58-62

[06:43] Team_010 possession (Score: 58-62)
Anthony Durant attempts a 3Pt. Wide open! Austin Russell is 8.7 feet away. [ZONE] Anthony Durant misses. Rebound secured by Jimmy Brogdon.

[06:31] Team_028 possession (Score: 58-62)
Carmelo Carter attempts a Layup. BLOCKED BY ANTHONY DURANT! Ball deflects out of bounds off Carmelo Carter.

[06:21] Team_010 possession (Score: 58-62)
RJ Young attempts a 3Pt. Contested by Austin Russell (2.4 feet, ZONE). RJ Young misses. Offensive rebound by Cade Morant! Cade Morant kicks it out.

[06:09] Team_010 possession (Score: 58-62)
RJ Young attempts a 3Pt. Contested by Myles Haliburton (3.4 feet, MAN). RJ Young misses. Rebound secured by Kawhi Ball.

[05:52] Team_028 possession (Score: 58-62)
Kawhi Ball attempts a Dunk. BLOCKED BY DESMOND ANTETOKOUNMPO! Ball is loose! Rebound secured by Cade Morant.

[05:39] Team_010 possession (Score: 58-62)
FOUL! Shooting foul on Kawhi Ball. Desmond Antetokounmpo to the line for 3 free throws. [BONUS: 6 team fouls] (Kawhi Ball: 2 personal fouls)   FT 1/3: GOOD   FT 2/3: GOOD   FT 3/3: GOOD Desmond Antetokounmpo makes 3/3 from the line.
Score: 58-65

[05:24] Team_028 possession (Score: 58-65)
Kawhi Ball drives and kicks out. Carmelo Carter attempts a 3Pt. Contested by Cade Morant (3.9 feet, ZONE). CARMELO CARTER MAKES IT! Assist: Jimmy Brogdon
Score: 61-65

[05:11] Team_010 possession (Score: 61-65)
Desmond Antetokounmpo attempts a 3Pt. Contested by Kawhi Ball (4.7 feet, MAN). DESMOND ANTETOKOUNMPO MAKES IT! Assist: Cade Morant
Score: 61-68

[04:55] Team_028 possession (Score: 61-68)
Jimmy Brogdon drives to the basket... Jimmy Brogdon loses the ball! Stripped by Anthony Durant! TURNOVER! (live ball)

[04:41] Team_010 possession (Score: 61-68)
RJ Young drives and kicks out. FOUL! Shooting foul on Jimmy Brogdon. Anthony Durant to the line for 3 free throws. [BONUS: 7 team fouls] (Jimmy Brogdon: 4 personal fouls)   FT 1/3: GOOD   FT 2/3: GOOD   FT 3/3: GOOD Anthony Durant makes 3/3 from the line.
Score: 61-71

[04:26] Team_028 possession (Score: 61-71)
Austin Russell drives to the basket... Austin Russell loses control! Ball rolls out of bounds! TURNOVER! (dead ball)

[04:16] Team_010 possession (Score: 61-71)
Cade Morant attempts a Layup. Wide open! Kawhi Ball is 7.2 feet away. [ZONE] Cade Morant misses. Rebound secured by Kawhi Ball.

[04:03] Team_028 possession (Score: 61-71)
Austin Russell attempts a Midrange. Contested by Cade Morant (3.9 feet, MAN). Austin Russell misses. Rebound secured by Michael Turner.

[03:53] Team_010 possession (Score: 61-71)
Desmond Antetokounmpo attempts a 3Pt. Wide open! Carmelo Carter is 6.2 feet away. [ZONE] Desmond Antetokounmpo misses. Rebound secured by Jimmy Brogdon.

[03:44] Team_028 possession (Score: 61-71)
Austin Russell attempts a Midrange. Contested by Cade Morant (2.3 feet, MAN). AUSTIN RUSSELL MAKES IT! Assist: Jimmy Brogdon
Score: 63-71

[03:29] Team_010 possession (Score: 63-71)
Michael Turner attempts a 3Pt. Wide open! Austin Russell is 7.4 feet away. [ZONE] MICHAEL TURNER MAKES IT! Assist: Cade Morant
Score: 63-74

[03:20] Team_028 possession (Score: 63-74)
Kawhi Ball attempts a Dunk. BLOCKED BY ANTHONY DURANT! Ball is loose! Rebound secured by Cade Morant.

[03:06] Team_010 possession (Score: 63-74)
FOUL! Reach-in foul on Kawhi Ball during the drive. [IN THE BONUS! 8 team fouls] RJ Young to the line for 2 free throws. (Kawhi Ball: 3 personal fouls)   FT 1/2: GOOD   FT 2/2: GOOD RJ Young makes 2/2 from the line.
Score: 63-76

[02:53] Team_028 possession (Score: 63-76)
Carmelo Carter attempts a Midrange. Wide open! Michael Turner is 7.1 feet away. [ZONE] CARMELO CARTER MAKES IT! Assist: Myles Haliburton
Score: 65-76

[02:37] Team_010 possession (Score: 65-76)
Desmond Antetokounmpo attempts a 3Pt. Contested by Austin Russell (5.4 feet, ZONE). Desmond Antetokounmpo misses. Rebound secured by Kawhi Ball.

[02:24] Team_028 possession (Score: 65-76)
Jimmy Brogdon drives and kicks out. FOUL! Shooting foul on Cade Morant. Austin Russell to the line for 3 free throws. [Team fouls: 3] (Cade Morant: 2 personal fouls)   FT 1/3: GOOD   FT 2/3: GOOD   FT 3/3: MISS Austin Russell makes 2/3 from the line. Rebound secured by Anthony Durant.
Score: 67-76

[02:08] Team_010 possession (Score: 67-76)
Anthony Durant drives and kicks out. Cade Morant attempts a Midrange. Heavily contested by Austin Russell (1.9 feet, ZONE)! Cade Morant misses. Rebound secured by Jimmy Brogdon.

[01:55] Team_028 possession (Score: 67-76)
Austin Russell attempts a Layup. Contested by Anthony Durant (3.1 feet, ZONE). AUSTIN RUSSELL MAKES IT!
Score: 69-76

[01:39] Team_010 possession (Score: 69-76)
RJ Young makes the Layup and draws the foul on Kawhi Ball! And-1! RJ Young to the line for 1. [BONUS: 9 team fouls] (Kawhi Ball: 4 personal fouls)   FT 1/1: GOOD RJ Young makes 1/1 from the line.
Score: 69-79

[01:21] Team_028 possession (Score: 69-79)
Kawhi Ball attempts a Layup. BLOCKED BY DESMOND ANTETOKOUNMPO! Ball deflects out of bounds off Kawhi Ball.

[01:07] Team_010 possession (Score: 69-79)
Cade Morant attempts a 3Pt. Wide open! Austin Russell is 8.4 feet away. [ZONE] Cade Morant misses. Rebound secured by Carmelo Carter.

[00:56] Team_028 possession (Score: 69-79)
Austin Russell attempts a 3Pt. Contested by Cade Morant (4.0 feet, MAN). AUSTIN RUSSELL MAKES IT!
Score: 72-79

[00:41] Team_010 possession (Score: 72-79)
RJ Young attempts a 3Pt. Wide open! Austin Russell is 7.1 feet away. [ZONE] RJ Young misses. Rebound secured by Kawhi Ball.

[00:23] Team_028 possession (Score: 72-79)
Kawhi Ball attempts a Midrange. Wide open! Desmond Antetokounmpo is 9.1 feet away. [MAN] Kawhi Ball misses. Rebound secured by Cade Morant.

[00:12] Team_010 possession (Score: 72-79)
Anthony Durant drives to the basket... Anthony Durant loses the ball! Stripped by Kawhi Ball! TURNOVER! (live ball)

================================================================================
                              3RD QUARTER COMPLETE                              
================================================================================

3RD QUARTER SCORE: Team_028 28, Team_010 33

BOX SCORE:
================================================================================

Team_028
--------------------------------------------------------------------------------
Player                MIN  PTS  REB  AST  TO      FG   FG%      3P   3P%
--------------------------------------------------------------------------------
Austin Russell         27   10    0    1   0   4/5    80.0     0/0   0.0
Kawhi Ball             27    6    5    0   0   3/8    37.5     0/0   0.0
Carmelo Carter         27    5    2    1   0   2/4    50.0     0/0   0.0
Myles Haliburton       27    3    0    2   0   1/1   100.0     0/0   0.0
Jimmy Brogdon          27    2    3    2   0   1/2    50.0     0/0   0.0

TEAM: FG: 11/20 (55.0%), 3PT: 1/1 (100.0%), REB: 10 (0 off, 10 def), AST: 6, TO: 4
TEAM FOULS: 9 [Team_010 in BONUS]


Team_010
--------------------------------------------------------------------------------
Player                MIN  PTS  REB  AST  TO      FG   FG%      3P   3P%
--------------------------------------------------------------------------------
RJ Young               27   11    0    1   0   4/6    66.7     0/0   0.0
Desmond Antetokounmpo   27    8    1    0   0   3/5    60.0     0/0   0.0
Michael Turner         27    6    1    1   0   2/2   100.0     0/0   0.0
Cade Morant            27    3    5    2   0   1/3    33.3     0/0   0.0
Anthony Durant         27    3    3    2   0   1/5    20.0     0/0   0.0

TEAM: FG: 11/21 (52.4%), 3PT: 5/11 (45.5%), REB: 10 (3 off, 7 def), AST: 6, TO: 3
TEAM FOULS: 3

================================================================================

================================================================================
                       4TH QUARTER - Team_028 vs Team_010                       
================================================================================

[12:00] Team_028 possession (Score: 72-79)
Carmelo Carter drives, picks up Michael Turner. Help arrives from Cade Morant! Carmelo Carter attempts a Dunk. Contested by Cade Morant (5.2 feet, MAN). Carmelo Carter misses. Rebound secured by Cade Morant.

[11:44] Team_010 possession (Score: 72-79)
Desmond Antetokounmpo drives and kicks out. Michael Turner makes the Midrange and draws the foul on Carmelo Carter! And-1! Michael Turner to the line for 1. [Team fouls: 1] (Carmelo Carter: 1 personal fouls)   FT 1/1: GOOD Michael Turner makes 1/1 from the line.
Score: 72-82

[11:31] Team_028 possession (Score: 72-82)
Kawhi Ball drives to the basket... Kawhi Ball throws a bad pass! Stolen by Desmond Antetokounmpo! TURNOVER! (live ball)

[11:14] Team_010 possession (Score: 72-82)
RJ Young drives and kicks out. Desmond Antetokounmpo attempts a Midrange. Contested by Myles Haliburton (4.4 feet, ZONE). Desmond Antetokounmpo misses. Rebound secured by Kawhi Ball.

[10:56] Team_028 possession (Score: 72-82)
Myles Haliburton attempts a Midrange. Contested by Desmond Antetokounmpo (3.0 feet, ZONE). MYLES HALIBURTON MAKES IT! Assist: Kawhi Ball
Score: 74-82

[10:37] Team_010 possession (Score: 74-82)
Desmond Antetokounmpo drives, Kawhi Ball stays with him. Desmond Antetokounmpo attempts a Dunk. Contested by Kawhi Ball (3.4 feet, ZONE). DESMOND ANTETOKOUNMPO MAKES IT! Assist: Anthony Durant
Score: 74-84

[10:26] Team_028 possession (Score: 74-84)
Jimmy Brogdon attempts a Layup. Contested by Anthony Durant (2.5 feet, ZONE). JIMMY BROGDON MAKES IT!
Score: 76-84

[10:09] Team_010 possession (Score: 76-84)
Michael Turner attempts a Layup. Contested by Kawhi Ball (4.5 feet, ZONE). MICHAEL TURNER MAKES IT! Assist: RJ Young
Score: 76-86

[09:55] Team_028 possession (Score: 76-86)
Jimmy Brogdon drives to the basket... Jimmy Brogdon loses the ball! Stripped by Anthony Durant! TURNOVER! (live ball)

[09:40] Team_010 possession (Score: 76-86)
Cade Morant attempts a 3Pt. Wide open! Austin Russell is 6.3 feet away. [MAN] CADE MORANT MAKES IT! Assist: Michael Turner
Score: 76-89

[09:26] Team_028 possession (Score: 76-89)
FOUL! Reach-in foul on Cade Morant during the drive. [Team fouls: 1] No free throws, side out. (Cade Morant: 1 personal fouls)

[09:13] Team_028 possession (Score: 76-89)
Carmelo Carter attempts a 3Pt. Contested by Cade Morant (5.3 feet, ZONE). Carmelo Carter misses. Rebound secured by Michael Turner.

[09:02] Team_010 possession (Score: 76-89)
FOUL! Shooting foul on Jimmy Brogdon. Anthony Durant to the line for 2 free throws. [Team fouls: 2] (Jimmy Brogdon: 1 personal fouls)   FT 1/2: GOOD   FT 2/2: MISS Anthony Durant makes 1/2 from the line. Rebound secured by Jimmy Brogdon.
Score: 76-90

[08:47] Team_028 possession (Score: 76-90)
Austin Russell drives, Cade Morant stays with him. Austin Russell attempts a Dunk. Wide open! Cade Morant is 8.1 feet away. [MAN] AUSTIN RUSSELL MAKES IT! Assist: Kawhi Ball
Score: 78-90

[08:33] Team_010 possession (Score: 78-90)
Desmond Antetokounmpo drives and kicks out. Michael Turner attempts a Midrange. Wide open! Myles Haliburton is 7.1 feet away. [ZONE] MICHAEL TURNER MAKES IT!
Score: 78-92

[08:22] Team_028 possession (Score: 78-92)
FOUL! Offensive foul on Austin Russell! Cade Morant drew the charge! [Team fouls: 3] (Austin Russell: 1 personal fouls) TURNOVER! (dead ball)

[08:11] Team_010 possession (Score: 78-92)
Michael Turner drives, Kawhi Ball stays with him. Michael Turner attempts a Layup. Wide open! Kawhi Ball is 6.1 feet away. [ZONE] Michael Turner misses. Offensive rebound by Cade Morant! Cade Morant kicks it out.

[07:58] Team_010 possession (Score: 78-92)
RJ Young attempts a 3Pt. Wide open! Myles Haliburton is 6.2 feet away. [MAN] RJ YOUNG MAKES IT! Assist: Anthony Durant
Score: 78-95

[07:44] Team_028 possession (Score: 78-95)
Jimmy Brogdon attempts a Midrange. Wide open! Michael Turner is 6.6 feet away. [ZONE] Jimmy Brogdon misses. Rebound secured by Anthony Durant.

[07:27] Team_010 possession (Score: 78-95)
FOUL! Offensive foul on Cade Morant! Austin Russell drew the charge! [Team fouls: 2] (Cade Morant: 2 personal fouls) TURNOVER! (dead ball)

[07:12] Team_028 possession (Score: 78-95)
Carmelo Carter attempts a Midrange. Wide open! Cade Morant is 6.0 feet away. [ZONE] CARMELO CARTER MAKES IT! Assist: Austin Russell
Score: 80-95

[06:58] Team_010 possession (Score: 80-95)
RJ Young attempts a 3Pt. Contested by Myles Haliburton (5.0 feet, MAN). RJ Young misses. Rebound secured by Jimmy Brogdon.

[06:43] Team_028 possession (Score: 80-95)
Jimmy Brogdon drives and kicks out. Myles Haliburton attempts a 3Pt. Wide open! RJ Young is 6.4 feet away. [MAN] Myles Haliburton misses. Rebound secured by Michael Turner.

[06:29] Team_010 possession (Score: 80-95)
Anthony Durant drives, Kawhi Ball stays with him. Anthony Durant attempts a Dunk. Wide open! Kawhi Ball is 7.6 feet away. [ZONE] ANTHONY DURANT MAKES IT!
Score: 80-97

[06:13] Team_028 possession (Score: 80-97)
FOUL! Holding foul on RJ Young. [Team fouls: 3] No free throws, side out. (RJ Young: 1 personal fouls)

[05:57] Team_028 possession (Score: 80-97)
Kawhi Ball drives to the basket... FOUL! Offensive foul on Kawhi Ball! Desmond Antetokounmpo drew the charge! [Team fouls: 4] (Kawhi Ball: 1 personal fouls) TURNOVER! (dead ball)

[05:42] Team_010 possession (Score: 80-97)
Anthony Durant attempts a Layup. Contested by Kawhi Ball (4.6 feet, ZONE). Anthony Durant misses. Rebound secured by Carmelo Carter.

[05:32] Team_028 possession (Score: 80-97)
Carmelo Carter attempts a Midrange. Wide open! Michael Turner is 8.6 feet away. [ZONE] CARMELO CARTER MAKES IT!
Score: 82-97

[05:14] Team_010 possession (Score: 82-97)
FOUL! Shooting foul on Kawhi Ball. Anthony Durant to the line for 2 free throws. [BONUS: 5 team fouls] (Kawhi Ball: 2 personal fouls)   FT 1/2: MISS   FT 2/2: GOOD Anthony Durant makes 1/2 from the line.
Score: 82-98

[05:02] Team_028 possession (Score: 82-98)
Carmelo Carter drives and kicks out. Carmelo Carter attempts a 3Pt. Wide open! Cade Morant is 6.9 feet away. [ZONE] CARMELO CARTER MAKES IT! Assist: Myles Haliburton
Score: 85-98

[04:48] Team_010 possession (Score: 85-98)
FOUL! Shooting foul on Austin Russell. Cade Morant to the line for 2 free throws. [BONUS: 6 team fouls] (Austin Russell: 2 personal fouls)   FT 1/2: GOOD   FT 2/2: MISS Cade Morant makes 1/2 from the line. Rebound secured by Kawhi Ball.
Score: 85-99

[04:38] Team_028 possession (Score: 85-99)
Jimmy Brogdon attempts a 3Pt. Contested by Cade Morant (4.2 feet, ZONE). JIMMY BROGDON MAKES IT! Assist: Austin Russell
Score: 88-99

[04:24] Team_010 possession (Score: 88-99)
RJ Young drives and kicks out. Michael Turner attempts a 3Pt. Contested by Carmelo Carter (4.7 feet, MAN). Michael Turner misses. Rebound secured by Kawhi Ball.

[04:12] Team_028 possession (Score: 88-99)
Carmelo Carter attempts a 3Pt. Wide open! Michael Turner is 6.6 feet away. [MAN] CARMELO CARTER MAKES IT! Assist: Kawhi Ball
Score: 91-99

[03:57] Team_010 possession (Score: 91-99)
Desmond Antetokounmpo drives, Kawhi Ball stays with him. Desmond Antetokounmpo attempts a Dunk. Wide open! Kawhi Ball is 7.8 feet away. [ZONE] Desmond Antetokounmpo misses. Offensive rebound by Cade Morant! Cade Morant kicks it out.

[03:46] Team_010 possession (Score: 91-99)
Michael Turner attempts a Midrange. Wide open! Kawhi Ball is 7.1 feet away. [ZONE] MICHAEL TURNER MAKES IT!
Score: 91-101

[03:33] Team_028 possession (Score: 91-101)
Kawhi Ball attempts a Midrange. Wide open! Desmond Antetokounmpo is 7.8 feet away. [ZONE] KAWHI BALL MAKES IT! Assist: Myles Haliburton
Score: 93-101

[03:18] Team_010 possession (Score: 93-101)
FOUL! Shooting foul on Myles Haliburton. Michael Turner to the line for 2 free throws. [BONUS: 7 team fouls] (Myles Haliburton: 1 personal fouls)   FT 1/2: GOOD   FT 2/2: GOOD Michael Turner makes 2/2 from the line.
Score: 93-103

[03:08] Team_028 possession (Score: 93-103)
Kawhi Ball attempts a 3Pt. Wide open! Desmond Antetokounmpo is 8.0 feet away. [MAN] Kawhi Ball misses. Rebound secured by Anthony Durant.

[02:51] Team_010 possession (Score: 93-103)
Cade Morant drives, Austin Russell stays with him. Cade Morant attempts a Layup. Wide open! Austin Russell is 6.7 feet away. [MAN] CADE MORANT MAKES IT! Assist: Anthony Durant
Score: 93-105

[02:33] Team_028 possession (Score: 93-105)
FOUL! Holding foul on RJ Young. [Team fouls: 4] No free throws, side out. (RJ Young: 2 personal fouls)

[02:20] Team_028 possession (Score: 93-105)
Austin Russell attempts a 3Pt. Contested by Cade Morant (4.6 feet, ZONE). Austin Russell misses. Rebound secured by Cade Morant.

[02:05] Team_010 possession (Score: 93-105)
Anthony Durant drives, Jimmy Brogdon stays with him. Anthony Durant attempts a Dunk. Wide open! Jimmy Brogdon is 9.1 feet away. [MAN] Anthony Durant misses. FOUL! Loose ball foul on Jimmy Brogdon during the rebound battle. [IN THE BONUS! 8 team fouls] Anthony Durant to the line for 2 free throws. (Jimmy Brogdon: 2 personal fouls)   FT 1/2: GOOD   FT 2/2: GOOD Anthony Durant makes 2/2 from the line.
Score: 93-107

[01:51] Team_028 possession (Score: 93-107)
Carmelo Carter loses control! Ball rolls out of bounds! TURNOVER! (dead ball)

[01:51] Substitution (Team_028): Austin Russell OUT → Scottie Ingram IN (stamina_rule2)

[01:51] Substitution (Team_028): Carmelo Carter OUT → Tyrese Quickley IN (stamina_rule2)

[01:51] Substitution (Team_028): Myles Haliburton OUT → Miles Booker IN (stamina_rule2)

[01:51] Substitution (Team_028): Kawhi Ball OUT → Bam Towns IN (stamina_rule2)

[01:51] Substitution (Team_028): Jimmy Brogdon OUT → Collin Bridges IN (stamina_rule2)

[01:51] Substitution (Team_010): Cade Morant OUT → Draymond Leonard IN (stamina_rule2)

[01:51] Substitution (Team_010): Michael Turner OUT → Blake Harden IN (stamina_rule2)

[01:51] Substitution (Team_010): RJ Young OUT → Ben Gilgeous-Alexander IN (stamina_rule2)

[01:51] Substitution (Team_010): Desmond Antetokounmpo OUT → Vince Ingram IN (stamina_rule2)

[01:51] Substitution (Team_010): Anthony Durant OUT → Paolo Wade IN (stamina_rule2)

[01:41] Team_010 possession (Score: 93-107)
Draymond Leonard attempts a 3Pt. Wide open! Bam Towns is 6.8 feet away. [ZONE] Draymond Leonard misses. Rebound secured by Bam Towns.

[01:24] Team_028 possession (Score: 93-107)
Bam Towns drives to the basket... FOUL! Offensive foul on Bam Towns! Vince Ingram drew the charge! [Team fouls: 9] (Bam Towns: 1 personal fouls) TURNOVER! (dead ball)

[01:08] Team_010 possession (Score: 93-107)
Blake Harden attempts a 3Pt. Wide open! Scottie Ingram is 7.6 feet away. [ZONE] Blake Harden misses. Rebound secured by Tyrese Quickley.

[00:51] Team_028 possession (Score: 93-107)
Miles Booker attempts a 3Pt. Contested by Draymond Leonard (4.5 feet, ZONE). MILES BOOKER MAKES IT! Assist: Scottie Ingram
Score: 96-107

[00:38] Team_010 possession (Score: 96-107)
FOUL! Reach-in foul on Collin Bridges during the drive. [IN THE BONUS! 10 team fouls] Paolo Wade to the line for 2 free throws. (Collin Bridges: 1 personal fouls)   FT 1/2: GOOD   FT 2/2: GOOD Paolo Wade makes 2/2 from the line.
Score: 96-109

[00:25] Team_028 possession (Score: 96-109)
Scottie Ingram drives to the basket... Scottie Ingram throws a bad pass out of bounds! TURNOVER! (dead ball)

[00:10] Team_010 possession (Score: 96-109)
Draymond Leonard attempts a 3Pt. Contested by Scottie Ingram (3.8 feet, MAN). DRAYMOND LEONARD MAKES IT! Assist: Blake Harden
Score: 96-112

================================================================================
                              4TH QUARTER COMPLETE                              
================================================================================

4TH QUARTER SCORE: Team_028 24, Team_010 33

BOX SCORE:
================================================================================

Team_028
--------------------------------------------------------------------------------
Player                MIN  PTS  REB  AST  TO      FG   FG%      3P   3P%
--------------------------------------------------------------------------------
Carmelo Carter         37   10    1    0   0   4/6    66.7     0/0   0.0
Jimmy Brogdon          37    5    2    0   0   2/4    50.0     0/0   0.0
Miles Booker           11    3    0    0   0   1/1   100.0     0/0   0.0
Kawhi Ball             37    2    3    3   0   1/2    50.0     0/0   0.0
Myles Haliburton       37    2    0    2   0   1/1   100.0     0/0   0.0
Austin Russell         37    2    0    2   0   1/2    50.0     0/0   0.0
Bam Towns              11    0    1    0   0   0/0     0.0     0/0   0.0
Tyrese Quickley        11    0    1    0   0   0/0     0.0     0/0   0.0
Scottie Ingram         11    0    0    1   0   0/0     0.0     0/0   0.0

TEAM: FG: 10/16 (62.5%), 3PT: 3/6 (50.0%), REB: 8 (0 off, 8 def), AST: 8, TO: 7
TEAM FOULS: 10 [Team_010 in BONUS]


Team_010
--------------------------------------------------------------------------------
Player                MIN  PTS  REB  AST  TO      FG   FG%      3P   3P%
--------------------------------------------------------------------------------
Michael Turner         37   11    2    1   0   5/5   100.0     0/0   0.0
Cade Morant            37    5    4    0   0   2/3    66.7     0/0   0.0
Anthony Durant         37    5    2    3   0   3/5    60.0     0/0   0.0
RJ Young               37    3    0    1   0   1/4    25.0     0/0   0.0
Draymond Leonard       11    3    0    0   0   1/2    50.0     0/0   0.0
Desmond Antetokounmpo   37    2    0    0   0   1/1   100.0     0/0   0.0
Paolo Wade             11    2    0    0   0   1/1   100.0     0/0   0.0
Blake Harden           11    0    0    1   0   0/1     0.0     0/0   0.0

TEAM: FG: 14/22 (63.6%), 3PT: 3/6 (50.0%), REB: 8 (2 off, 6 def), AST: 6, TO: 1
TEAM FOULS: 4

================================================================================

================================================================================
                               FULL GAME COMPLETE                               
================================================================================

FINAL SCORE: Team_028 96, Team_010 112

SCORING BY QUARTER:
--------------------------------------------------------------------------------
Team                     Q1     Q2     Q3     Q4    FINAL
--------------------------------------------------------------------------------
Team_028                 21     23     28     24       96
Team_010                 20     26     33     33      112
--------------------------------------------------------------------------------

FULL GAME BOX SCORE:
================================================================================

Team_028
--------------------------------------------------------------------------------
Player                MIN  PTS  REB  AST  TO      FG   FG%      3P   3P%      FT STL BLK
--------------------------------------------------------------------------------
Austin Russell         37   15    0    4   1   6/8    75.0   2/3    66.7   3/4     1   0
Carmelo Carter         37   25    7    2   1   9/14   64.3   3/4    75.0   0/0     0   1
Myles Haliburton       37   11    0    7   5   3/8    37.5   2/6    33.3   0/0     0   0
Kawhi Ball             37   17   13    4   3   6/16   37.5   1/3    33.3   0/0     1   1
Jimmy Brogdon          37    9   12    6   1   7/11   63.6   1/1   100.0   0/0     0   0
Scottie Ingram         11    0    0    3   0   0/3     0.0   0/0     0.0   0/0     0   0
Tyrese Quickley        11    2    2    0   1   1/2    50.0   0/1     0.0   2/2     0   0
Miles Booker           11    8    0    1   1   3/5    60.0   2/4    50.0   0/0     1   0
Bam Towns              11    3    6    0   2   1/4    25.0   1/2    50.0   0/0     1   0
Collin Bridges         11    4    0    0   0   2/2   100.0   0/0     0.0   0/0     0   0

TEAM: FG: 38/73 (52.1%), 3PT: 12/24 (50.0%), REB: 40 (6 off, 34 def), AST: 27, TO: 15


Team_010
--------------------------------------------------------------------------------
Player                MIN  PTS  REB  AST  TO      FG   FG%      3P   3P%      FT STL BLK
--------------------------------------------------------------------------------
Cade Morant            37   10   17    2   4   5/10   50.0   2/3    66.7   1/3     0   0
Michael Turner         37   24    5    2   0   7/10   70.0   2/4    50.0   6/7     0   0
RJ Young               37   16    0    4   1   6/13   46.2   2/7    28.6   4/5     1   0
Desmond Antetokounmpo   37   16    3    0   0   9/12   75.0   2/4    50.0   5/5     2   2
Anthony Durant         37    8   11    6   1   4/15   26.7   0/4     0.0   7/10    2   3
Draymond Leonard       11    9    0    0   0   3/5    60.0   2/3    66.7   1/1     0   0
Blake Harden           11   10    1    2   1   4/7    57.1   2/3    66.7   3/4     0   0
Ben Gilgeous-Alexander   11    0    3    1   1   0/1     0.0   0/1     0.0   0/0     0   3
Vince Ingram           11    7    0    1   0   2/2   100.0   1/1   100.0   0/0     0   0
Paolo Wade             11    3    5    0   1   3/3   100.0   0/0     0.0   3/4     0   0

TEAM: FG: 43/78 (55.1%), 3PT: 13/30 (43.3%), REB: 45 (12 off, 33 def), AST: 18, TO: 9

================================================================================
