================================================================================
                        FULL GAME - Team_095 vs Team_023                        
================================================================================

================================================================================
                       1ST QUARTER - Team_095 vs Team_023                       
================================================================================

[12:00] Team_095 possession (Score: 0-0)
Immanuel Middleton attempts a Midrange. Contested by Josh Morant (4.3 feet, ZONE). Immanuel Middleton misses. Rebound secured by Tim Bane.

[11:44] Team_023 possession (Score: 0-0)
Collin Ginobili attempts a 3Pt. Contested by Evan Carter (3.5 feet, ZONE). COLLIN GINOBILI MAKES IT! Assist: Tim Bane
Score: 0-3

[11:33] Team_095 possession (Score: 0-3)
Kyrie Ming makes the Dunk and draws the foul on Trae Ingram! And-1! Kyrie Ming to the line for 1. [Team fouls: 1] (Trae Ingram: 1 personal fouls)   FT 1/1: GOOD Kyrie Ming makes 1/1 from the line.
Score: 3-3

[11:17] Team_023 possession (Score: 3-3)
Trae Ingram attempts a Midrange. Wide open! Dejounte Hyland is 7.9 feet away. [MAN] TRAE INGRAM MAKES IT!
Score: 3-5

[11:03] Team_095 possession (Score: 3-5)
Kyrie Ming attempts a Midrange. Contested by Kyle Paul (2.5 feet, ZONE). Kyrie Ming misses. Rebound secured by Tim Bane.

[10:50] Team_023 possession (Score: 3-5)
Collin Ginobili attempts a 3Pt. Contested by Shaquille Ball (5.2 feet, MAN). COLLIN GINOBILI MAKES IT! Assist: Kyle Paul
Score: 3-8

[10:33] Team_095 possession (Score: 3-8)
Shaquille Ball drives, picks up Tim Bane. Help arrives from Trae Ingram! Shaquille Ball attempts a Dunk. Contested by Trae Ingram (4.3 feet, ZONE). Shaquille Ball misses. Rebound secured by Josh Morant.

[10:19] Team_023 possession (Score: 3-8)
Trae Ingram attempts a Midrange. Contested by Dejounte Hyland (5.2 feet, MAN). TRAE INGRAM MAKES IT! Assist: Josh Morant
Score: 3-10

[10:09] Team_095 possession (Score: 3-10)
Evan Carter throws a bad pass out of bounds! TURNOVER! (dead ball)

[09:55] Team_023 possession (Score: 3-10)
FOUL! Shooting foul on Evan Carter. Kyle Paul to the line for 3 free throws. [Team fouls: 1] (Evan Carter: 1 personal fouls)   FT 1/3: GOOD   FT 2/3: GOOD   FT 3/3: GOOD Kyle Paul makes 3/3 from the line.
Score: 3-13

[09:40] Team_095 possession (Score: 3-13)
Dejounte Hyland attempts a 3Pt. Heavily contested by Trae Ingram (1.9 feet, MAN)! DEJOUNTE HYLAND MAKES IT! Assist: Immanuel Middleton
Score: 6-13

[09:24] Team_023 possession (Score: 6-13)
Collin Ginobili throws a bad pass out of bounds! TURNOVER! (dead ball)

[09:10] Team_095 possession (Score: 6-13)
Kyrie Ming attempts a Layup. Contested by Tim Bane (4.8 feet, MAN). Kyrie Ming misses. Offensive rebound by Dejounte Hyland! Dejounte Hyland kicks it out.

[08:52] Team_095 possession (Score: 6-13)
Shaquille Ball drives to the basket... Shaquille Ball throws a bad pass! Stolen by Collin Ginobili! TURNOVER! (live ball)

[08:38] Team_023 possession (Score: 6-13)
Kyle Paul attempts a 3Pt. Contested by Evan Carter (5.9 feet, MAN). KYLE PAUL MAKES IT! Assist: Trae Ingram
Score: 6-16

[08:27] Team_095 possession (Score: 6-16)
Shaquille Ball makes the Dunk and draws the foul on Kyle Paul! And-1! Shaquille Ball to the line for 1. [Team fouls: 2] (Kyle Paul: 1 personal fouls)   FT 1/1: GOOD Shaquille Ball makes 1/1 from the line.
Score: 9-16

[08:15] Team_023 possession (Score: 9-16)
Collin Ginobili attempts a 3Pt. Contested by Shaquille Ball (2.2 feet, MAN). Collin Ginobili misses. Offensive rebound by Josh Morant! Josh Morant kicks it out.

[08:02] Team_023 possession (Score: 9-16)
Tim Bane makes the Layup and draws the foul on Kyrie Ming! And-1! Tim Bane to the line for 1. [Team fouls: 2] (Kyrie Ming: 1 personal fouls)   FT 1/1: GOOD Tim Bane makes 1/1 from the line.
Score: 9-19

[07:45] Team_095 possession (Score: 9-19)
Kyrie Ming attempts a 3Pt. Contested by Tim Bane (2.8 feet, MAN). Kyrie Ming misses. Rebound secured by Tim Bane.

[07:27] Team_023 possession (Score: 9-19)
Kyle Paul attempts a Midrange. Contested by Evan Carter (4.0 feet, MAN). KYLE PAUL MAKES IT!
Score: 9-21

[07:12] Team_095 possession (Score: 9-21)
Immanuel Middleton attempts a 3Pt. Contested by Josh Morant (5.8 feet, MAN). Immanuel Middleton misses. Rebound secured by Tim Bane.

[06:53] Team_023 possession (Score: 9-21)
Collin Ginobili drives, Immanuel Middleton stays with him. Collin Ginobili attempts a Dunk. Contested by Immanuel Middleton (2.1 feet, ZONE). Collin Ginobili misses. Rebound secured by Shaquille Ball.

[06:39] Team_095 possession (Score: 9-21)
Shaquille Ball drives and kicks out. Dejounte Hyland attempts a 3Pt. Contested by Trae Ingram (2.9 feet, MAN). DEJOUNTE HYLAND MAKES IT! Assist: Evan Carter
Score: 12-21

[06:23] Team_023 possession (Score: 12-21)
Kyle Paul makes the Midrange and draws the foul on Evan Carter! And-1! Kyle Paul to the line for 1. [Team fouls: 3] (Evan Carter: 2 personal fouls)   FT 1/1: GOOD Kyle Paul makes 1/1 from the line.
Score: 12-24

[06:07] Team_095 possession (Score: 12-24)
FOUL! Holding foul on Collin Ginobili. [Team fouls: 3] No free throws, side out. (Collin Ginobili: 1 personal fouls)

[05:51] Team_095 possession (Score: 12-24)
Evan Carter attempts a Midrange. Contested by Tim Bane (4.5 feet, ZONE). Evan Carter misses. FOUL! Loose ball foul on Josh Morant during the rebound battle. [Team fouls: 4] No free throws, side out. (Josh Morant: 1 personal fouls)

[05:36] Team_095 possession (Score: 12-24)
Kyrie Ming attempts a 3Pt. Contested by Kyle Paul (4.8 feet, ZONE). KYRIE MING MAKES IT! Assist: Dejounte Hyland
Score: 15-24

[05:20] Team_023 possession (Score: 15-24)
Josh Morant attempts a Layup. Contested by Immanuel Middleton (4.3 feet, MAN). Josh Morant misses. Rebound secured by Evan Carter.

[05:02] Team_095 possession (Score: 15-24)
Immanuel Middleton drives and kicks out. Shaquille Ball attempts a Midrange. Wide open! Collin Ginobili is 6.1 feet away. [MAN] SHAQUILLE BALL MAKES IT!
Score: 17-24

[04:47] Team_023 possession (Score: 17-24)
Trae Ingram drives, picks up Immanuel Middleton. Help arrives from Dejounte Hyland! Trae Ingram attempts a Dunk. Contested by Dejounte Hyland (5.5 feet, ZONE). TRAE INGRAM MAKES IT! Assist: Collin Ginobili
Score: 17-26

[04:38] Team_095 possession (Score: 17-26)
Kyrie Ming drives, Tim Bane stays with him. Kyrie Ming attempts a Layup. Wide open! Tim Bane is 6.2 feet away. [ZONE] Kyrie Ming misses. Rebound secured by Josh Morant.

[04:23] Team_023 possession (Score: 17-26)
Collin Ginobili drives, Immanuel Middleton stays with him. Collin Ginobili attempts a Dunk. Contested by Immanuel Middleton (5.4 feet, ZONE). Collin Ginobili misses. Rebound secured by Shaquille Ball.

[04:09] Team_095 possession (Score: 17-26)
Shaquille Ball attempts a 3Pt. Heavily contested by Trae Ingram (0.5 feet, ZONE)! Shaquille Ball misses. Rebound secured by Josh Morant.

[03:52] Team_023 possession (Score: 17-26)
Trae Ingram drives, picks up Dejounte Hyland. Help arrives from Evan Carter! Trae Ingram attempts a Dunk. Wide open! Evan Carter is 6.0 feet away. [MAN] TRAE INGRAM MAKES IT!
Score: 17-28

[03:37] Team_095 possession (Score: 17-28)
FOUL! Reach-in foul on Tim Bane during the drive. [IN THE BONUS! 5 team fouls] Kyrie Ming to the line for 2 free throws. (Tim Bane: 1 personal fouls)   FT 1/2: GOOD   FT 2/2: GOOD Kyrie Ming makes 2/2 from the line.
Score: 19-28

[03:27] Team_023 possession (Score: 19-28)
Josh Morant attempts a Midrange. Wide open! Immanuel Middleton is 7.1 feet away. [ZONE] JOSH MORANT MAKES IT!
Score: 19-30

[03:16] Team_095 possession (Score: 19-30)
Immanuel Middleton drives, Josh Morant stays with him. Immanuel Middleton attempts a Layup. Contested by Josh Morant (2.7 feet, MAN). IMMANUEL MIDDLETON MAKES IT! Assist: Kyrie Ming
Score: 21-30

[03:03] Team_023 possession (Score: 21-30)
Josh Morant makes the Layup and draws the foul on Dejounte Hyland! And-1! Josh Morant to the line for 1. [Team fouls: 4] (Dejounte Hyland: 1 personal fouls)   FT 1/1: GOOD Josh Morant makes 1/1 from the line.
Score: 21-33

[02:50] Team_095 possession (Score: 21-33)
Immanuel Middleton throws a bad pass! Stolen by Josh Morant! TURNOVER! (live ball)

[02:32] Team_023 possession (Score: 21-33)
Kyle Paul attempts a 3Pt. Contested by Evan Carter (3.2 feet, ZONE). Kyle Paul misses. FOUL! Loose ball foul on Dejounte Hyland during the rebound battle. [IN THE BONUS! 5 team fouls] Tim Bane to the line for 2 free throws. (Dejounte Hyland: 2 personal fouls)   FT 1/2: MISS   FT 2/2: MISS Tim Bane makes 0/2 from the line. Rebound secured by Evan Carter.

[02:18] Team_095 possession (Score: 21-33)
Evan Carter throws a bad pass! Stolen by Kyle Paul! TURNOVER! (live ball)

[02:04] Team_023 possession (Score: 21-33)
Trae Ingram drives, picks up Immanuel Middleton. Help arrives from Dejounte Hyland! Trae Ingram attempts a Layup. Heavily contested by Dejounte Hyland (1.8 feet, ZONE)! Trae Ingram misses. Offensive rebound by Tim Bane! Tim Bane puts it back in!
Score: 21-35

[01:48] Team_095 possession (Score: 21-35)
Immanuel Middleton drives, picks up Josh Morant. Help arrives from Trae Ingram! Immanuel Middleton attempts a Layup. Wide open! Trae Ingram is 6.7 feet away. [MAN] Immanuel Middleton misses. Offensive rebound by Evan Carter! Evan Carter's putback is no good. Offensive rebound by Evan Carter! Evan Carter kicks it out.

[01:34] Team_095 possession (Score: 21-35)
Shaquille Ball loses control! Ball rolls out of bounds! TURNOVER! (dead ball)

[01:34] Substitution (Team_095): Dejounte Hyland OUT → Kyle Poole IN (stamina_rule2)

[01:34] Substitution (Team_095): Shaquille Ball OUT → Cade Beal IN (stamina_rule2)

[01:34] Substitution (Team_095): Evan Carter OUT → Tobias Wagner IN (stamina_rule2)

[01:34] Substitution (Team_095): Immanuel Middleton OUT → Gary Davis IN (stamina_rule2)

[01:34] Substitution (Team_095): Kyrie Ming OUT → DeMar McCollum IN (stamina_rule2)

[01:34] Substitution (Team_023): Trae Ingram OUT → Tracy Anthony IN (stamina_rule2)

[01:34] Substitution (Team_023): Collin Ginobili OUT → Magic Booker IN (stamina_rule2)

[01:34] Substitution (Team_023): Kyle Paul OUT → Gary Westbrook IN (stamina_rule2)

[01:34] Substitution (Team_023): Josh Morant OUT → Evan Parker IN (stamina_rule2)

[01:34] Substitution (Team_023): Tim Bane OUT → Vince Gasol IN (stamina_rule2)

[01:16] Team_023 possession (Score: 21-35)
Evan Parker attempts a 3Pt. Contested by Cade Beal (5.3 feet, ZONE). Evan Parker misses. Rebound secured by Tobias Wagner.

[01:01] Team_095 possession (Score: 21-35)
Tobias Wagner attempts a Midrange. Wide open! Gary Westbrook is 7.5 feet away. [MAN] Tobias Wagner misses. FOUL! Loose ball foul on Evan Parker during the rebound battle. [IN THE BONUS! 7 team fouls] DeMar McCollum to the line for 2 free throws. (Evan Parker: 1 personal fouls)   FT 1/2: MISS   FT 2/2: GOOD DeMar McCollum makes 1/2 from the line.
Score: 22-35

[00:47] Team_023 possession (Score: 22-35)
Vince Gasol attempts a Layup. Wide open! DeMar McCollum is 6.4 feet away. [ZONE] Vince Gasol misses. Offensive rebound by Vince Gasol! Vince Gasol's putback is no good. Rebound secured by Tobias Wagner.

[00:33] Team_095 possession (Score: 22-35)
Gary Davis makes the Layup and draws the foul on Vince Gasol! And-1! Gary Davis to the line for 1. [BONUS: 8 team fouls] (Vince Gasol: 1 personal fouls)   FT 1/1: GOOD Gary Davis makes 1/1 from the line.
Score: 25-35

[00:22] Team_023 possession (Score: 25-35)
Tracy Anthony attempts a 3Pt. Contested by Cade Beal (2.2 feet, ZONE). TRACY ANTHONY MAKES IT! Assist: Vince Gasol
Score: 25-38

[00:07] Team_095 possession (Score: 25-38)
Gary Davis attempts a 3Pt. Heavily contested by Tracy Anthony (1.1 feet, ZONE)! Gary Davis misses. Rebound secured by Evan Parker.

================================================================================
                              1ST QUARTER COMPLETE                              
================================================================================

1ST QUARTER SCORE: Team_095 25, Team_023 38

BOX SCORE:
================================================================================

Team_095
--------------------------------------------------------------------------------
Player                MIN  PTS  REB  AST  TO      FG   FG%      3P   3P%
--------------------------------------------------------------------------------
Kyrie Ming             11    8    0    1   0   3/6    50.0     0/0   0.0
Dejounte Hyland        11    6    2    1   0   2/2   100.0     0/0   0.0
Shaquille Ball         11    5    2    0   0   2/4    50.0     0/0   0.0
Gary Davis              1    3    0    0   0   1/2    50.0     0/0   0.0
Immanuel Middleton     11    2    0    1   0   1/3    33.3     0/0   0.0
DeMar McCollum          1    1    0    0   0   1/1   100.0     0/0   0.0
Evan Carter            11    0    3    1   0   0/0     0.0     0/0   0.0

TEAM: FG: 10/18 (55.6%), 3PT: 2/6 (33.3%), REB: 7 (3 off, 4 def), AST: 4, TO: 5
TEAM FOULS: 5 [Team_023 in BONUS]


Team_023
--------------------------------------------------------------------------------
Player                MIN  PTS  REB  AST  TO      FG   FG%      3P   3P%
--------------------------------------------------------------------------------
Kyle Paul              11   11    0    1   0   4/5    80.0     0/0   0.0
Trae Ingram            11    8    0    1   0   4/4   100.0     0/0   0.0
Collin Ginobili        11    6    0    1   0   2/4    50.0     0/0   0.0
Tim Bane               11    5    5    1   0   2/2   100.0     0/0   0.0
Josh Morant            11    5    4    1   0   2/3    66.7     0/0   0.0
Tracy Anthony           1    3    0    0   0   1/1   100.0     0/0   0.0
Evan Parker             1    0    1    0   0   0/1     0.0     0/0   0.0
Tobias Wagner           1    0    2    0   0   0/0     0.0     0/0   0.0
Vince Gasol             1    0    0    1   0   0/1     0.0     0/0   0.0

TEAM: FG: 15/21 (71.4%), 3PT: 5/7 (71.4%), REB: 12 (4 off, 8 def), AST: 6, TO: 1
TEAM FOULS: 8 [Team_095 in BONUS]

================================================================================

================================================================================
                       2ND QUARTER - Team_095 vs Team_023                       
================================================================================

[12:00] Team_095 possession (Score: 25-38)
Evan Carter drives, picks up Tim Bane. Help arrives from Trae Ingram! Evan Carter attempts a Dunk. Contested by Trae Ingram (3.6 feet, ZONE). EVAN CARTER MAKES IT! Assist: Immanuel Middleton
Score: 27-38

[11:46] Team_023 possession (Score: 27-38)
Trae Ingram drives to the basket... Trae Ingram throws a bad pass out of bounds! TURNOVER! (dead ball)

[11:36] Team_095 possession (Score: 27-38)
Dejounte Hyland attempts a 3Pt. Contested by Kyle Paul (3.3 feet, ZONE). Dejounte Hyland misses. Offensive rebound by Evan Carter! Evan Carter's putback is no good. Rebound secured by Kyle Paul.

[11:18] Team_023 possession (Score: 27-38)
Trae Ingram attempts a 3Pt. Contested by Dejounte Hyland (3.9 feet, MAN). Trae Ingram misses. Rebound secured by Dejounte Hyland.

[11:00] Team_095 possession (Score: 27-38)
Kyrie Ming makes the Layup and draws the foul on Tim Bane! And-1! Kyrie Ming to the line for 1. [Team fouls: 1] (Tim Bane: 1 personal fouls)   FT 1/1: GOOD Kyrie Ming makes 1/1 from the line.
Score: 30-38

[10:49] Team_023 possession (Score: 30-38)
Collin Ginobili attempts a 3Pt. Heavily contested by Evan Carter (2.0 feet, ZONE)! Collin Ginobili misses. Rebound secured by Shaquille Ball.

[10:38] Team_095 possession (Score: 30-38)
Immanuel Middleton attempts a 3Pt. Contested by Josh Morant (5.9 feet, MAN). Immanuel Middleton misses. Rebound secured by Josh Morant.

[10:25] Team_023 possession (Score: 30-38)
Trae Ingram attempts a Layup. Wide open! Kyrie Ming is 6.0 feet away. [ZONE] TRAE INGRAM MAKES IT! Assist: Josh Morant
Score: 30-40

[10:12] Team_095 possession (Score: 30-40)
Kyrie Ming attempts a Midrange. Contested by Tim Bane (3.7 feet, MAN). KYRIE MING MAKES IT!
Score: 32-40

[09:54] Team_023 possession (Score: 32-40)
Collin Ginobili attempts a 3Pt. Contested by Shaquille Ball (5.4 feet, MAN). Collin Ginobili misses. FOUL! Loose ball foul on Shaquille Ball during the rebound battle. [Team fouls: 1] No free throws, side out. (Shaquille Ball: 1 personal fouls)

[09:41] Team_023 possession (Score: 32-40)
Kyle Paul drives and kicks out. Trae Ingram attempts a Midrange. Contested by Dejounte Hyland (3.8 feet, MAN). TRAE INGRAM MAKES IT!
Score: 32-42

[09:28] Team_095 possession (Score: 32-42)
Dejounte Hyland attempts a Layup. Contested by Tim Bane (4.1 feet, ZONE). DEJOUNTE HYLAND MAKES IT!
Score: 34-42

[09:11] Team_023 possession (Score: 34-42)
Tim Bane makes the Layup and draws the foul on Kyrie Ming! And-1! Tim Bane to the line for 1. [Team fouls: 2] (Kyrie Ming: 1 personal fouls)   FT 1/1: MISS Tim Bane makes 0/1 from the line. Offensive rebound by Tim Bane! Tim Bane's putback is no good.
Score: 34-44

[09:00] Team_095 possession (Score: 34-44)
Evan Carter attempts a 3Pt. Contested by Collin Ginobili (5.0 feet, ZONE). Evan Carter misses. Rebound secured by Kyle Paul.

[08:42] Team_023 possession (Score: 34-44)
FOUL! Reach-in foul on Immanuel Middleton during the drive. [Team fouls: 3] No free throws, side out. (Immanuel Middleton: 1 personal fouls)

[08:29] Team_023 possession (Score: 34-44)
FOUL! Reach-in foul on Kyrie Ming during the drive. [Team fouls: 4] No free throws, side out. (Kyrie Ming: 2 personal fouls)

[08:12] Team_023 possession (Score: 34-44)
Trae Ingram attempts a Midrange. Contested by Dejounte Hyland (3.9 feet, ZONE). Trae Ingram misses. Rebound secured by Evan Carter.

[07:54] Team_095 possession (Score: 34-44)
Shaquille Ball attempts a 3Pt. Contested by Trae Ingram (3.6 feet, ZONE). Shaquille Ball misses. Offensive rebound by Evan Carter! Evan Carter puts it back in!
Score: 36-44

[07:40] Team_023 possession (Score: 36-44)
Collin Ginobili drives to the basket... FOUL! Offensive foul on Collin Ginobili! Shaquille Ball drew the charge! [Team fouls: 2] (Collin Ginobili: 1 personal fouls) TURNOVER! (dead ball)

[07:25] Team_095 possession (Score: 36-44)
Shaquille Ball attempts a Layup. Wide open! Tim Bane is 8.7 feet away. [ZONE] SHAQUILLE BALL MAKES IT! Assist: Kyrie Ming
Score: 38-44

[07:11] Team_023 possession (Score: 38-44)
Tim Bane makes the Layup and draws the foul on Immanuel Middleton! And-1! Tim Bane to the line for 1. [BONUS: 5 team fouls] (Immanuel Middleton: 2 personal fouls)   FT 1/1: GOOD Tim Bane makes 1/1 from the line.
Score: 38-47

[06:58] Team_095 possession (Score: 38-47)
Dejounte Hyland drives to the basket... FOUL! Offensive foul on Dejounte Hyland! Trae Ingram drew the charge! [Team fouls: 6] (Dejounte Hyland: 1 personal fouls) TURNOVER! (dead ball)

[06:44] Team_023 possession (Score: 38-47)
Josh Morant attempts a 3Pt. Contested by Immanuel Middleton (2.3 feet, ZONE). Josh Morant misses. Rebound secured by Evan Carter.

[06:26] Team_095 possession (Score: 38-47)
Immanuel Middleton attempts a Layup. BLOCKED BY TIM BANE! Ball deflects out of bounds off Immanuel Middleton.

[06:09] Team_023 possession (Score: 38-47)
Josh Morant drives to the basket... Josh Morant throws a bad pass out of bounds! TURNOVER! (dead ball)

[06:09] Substitution (Team_095): Dejounte Hyland OUT → Kyle Poole IN (stamina_rule2)

[06:09] Substitution (Team_095): Shaquille Ball OUT → Cade Beal IN (stamina_rule2)

[06:09] Substitution (Team_095): Evan Carter OUT → Tobias Wagner IN (stamina_rule2)

[06:09] Substitution (Team_095): Immanuel Middleton OUT → Gary Davis IN (stamina_rule2)

[06:09] Substitution (Team_095): Kyrie Ming OUT → DeMar McCollum IN (stamina_rule2)

[06:09] Substitution (Team_023): Trae Ingram OUT → Tracy Anthony IN (stamina_rule2)

[06:09] Substitution (Team_023): Collin Ginobili OUT → Magic Booker IN (stamina_rule2)

[06:09] Substitution (Team_023): Kyle Paul OUT → Gary Westbrook IN (stamina_rule2)

[06:09] Substitution (Team_023): Josh Morant OUT → Evan Parker IN (stamina_rule2)

[06:09] Substitution (Team_023): Tim Bane OUT → Vince Gasol IN (stamina_rule2)

[05:53] Team_095 possession (Score: 38-47)
Kyle Poole attempts a 3Pt. Wide open! Gary Westbrook is 8.4 feet away. [ZONE] KYLE POOLE MAKES IT! Assist: Cade Beal
Score: 41-47

[05:36] Team_023 possession (Score: 41-47)
Gary Westbrook drives, Tobias Wagner stays with him. Gary Westbrook attempts a Layup. Wide open! Tobias Wagner is 6.6 feet away. [MAN] GARY WESTBROOK MAKES IT!
Score: 41-49

[05:21] Team_095 possession (Score: 41-49)
Tobias Wagner loses control! Ball rolls out of bounds! TURNOVER! (dead ball)

[05:06] Team_023 possession (Score: 41-49)
Magic Booker makes the Midrange and draws the foul on Cade Beal! And-1! Magic Booker to the line for 1. [BONUS: 7 team fouls] (Cade Beal: 1 personal fouls)   FT 1/1: GOOD Magic Booker makes 1/1 from the line.
Score: 41-52

[04:53] Team_095 possession (Score: 41-52)
Tobias Wagner drives, Gary Westbrook stays with him. Tobias Wagner attempts a Dunk. Contested by Gary Westbrook (5.9 feet, MAN). TOBIAS WAGNER MAKES IT!
Score: 43-52

[04:40] Team_023 possession (Score: 43-52)
Vince Gasol attempts a 3Pt. Contested by Cade Beal (3.7 feet, ZONE). Vince Gasol misses. Rebound secured by Gary Davis.

[04:27] Team_095 possession (Score: 43-52)
Cade Beal attempts a Midrange. Contested by Magic Booker (2.8 feet, MAN). CADE BEAL MAKES IT! Assist: DeMar McCollum
Score: 45-52

[04:11] Team_023 possession (Score: 45-52)
Tracy Anthony attempts a 3Pt. Contested by Kyle Poole (5.2 feet, MAN). Tracy Anthony misses. Rebound secured by DeMar McCollum.

[03:56] Team_095 possession (Score: 45-52)
Cade Beal attempts a 3Pt. Wide open! Magic Booker is 6.1 feet away. [MAN] Cade Beal misses. Rebound secured by Vince Gasol.

[03:41] Team_023 possession (Score: 45-52)
Magic Booker drives, Cade Beal stays with him. Magic Booker attempts a Dunk. Contested by Cade Beal (2.4 feet, MAN). MAGIC BOOKER MAKES IT! Assist: Tracy Anthony
Score: 45-54

[03:29] Team_095 possession (Score: 45-54)
Gary Davis attempts a 3Pt. Contested by Tracy Anthony (5.5 feet, ZONE). Gary Davis misses. Rebound secured by Vince Gasol.

[03:14] Team_023 possession (Score: 45-54)
Vince Gasol drives, DeMar McCollum stays with him. Vince Gasol attempts a Layup. Contested by DeMar McCollum (2.8 feet, MAN). VINCE GASOL MAKES IT! Assist: Magic Booker
Score: 45-56

[03:05] Team_095 possession (Score: 45-56)
Kyle Poole makes the Midrange and draws the foul on Gary Westbrook! And-1! Kyle Poole to the line for 1. [Team fouls: 3] (Gary Westbrook: 1 personal fouls)   FT 1/1: GOOD Kyle Poole makes 1/1 from the line.
Score: 48-56

[02:51] Team_023 possession (Score: 48-56)
Magic Booker attempts a Midrange. Contested by Cade Beal (3.8 feet, MAN). Magic Booker misses. Rebound secured by Tobias Wagner.

[02:37] Team_095 possession (Score: 48-56)
Kyle Poole attempts a 3Pt. Contested by Tracy Anthony (4.5 feet, ZONE). Kyle Poole misses. Rebound secured by Vince Gasol.

[02:24] Team_023 possession (Score: 48-56)
Tracy Anthony drives, Kyle Poole stays with him. Tracy Anthony attempts a Dunk. Wide open! Kyle Poole is 7.0 feet away. [MAN] TRACY ANTHONY MAKES IT! Assist: Magic Booker
Score: 48-58

[02:10] Team_095 possession (Score: 48-58)
Kyle Poole attempts a 3Pt. Contested by Tracy Anthony (3.8 feet, MAN). Kyle Poole misses. Rebound secured by Gary Westbrook.

[01:54] Team_023 possession (Score: 48-58)
Magic Booker attempts a Midrange. BLOCKED BY CADE BEAL! Ball is loose! Offensive rebound by Evan Parker! Evan Parker kicks it out.

[01:39] Team_023 possession (Score: 48-58)
Gary Westbrook attempts a 3Pt. Contested by Cade Beal (5.1 feet, ZONE). GARY WESTBROOK MAKES IT! Assist: Evan Parker
Score: 48-61

[01:24] Team_095 possession (Score: 48-61)
Tobias Wagner attempts a 3Pt. Contested by Gary Westbrook (5.8 feet, MAN). Tobias Wagner misses. Offensive rebound by Tobias Wagner! Tobias Wagner kicks it out.

[01:13] Team_095 possession (Score: 48-61)
Gary Davis attempts a Midrange. Heavily contested by Gary Westbrook (0.5 feet, ZONE)! Gary Davis misses. Rebound secured by Vince Gasol.

[00:58] Team_023 possession (Score: 48-61)
Magic Booker attempts a 3Pt. Wide open! Cade Beal is 8.3 feet away. [MAN] Magic Booker misses. Rebound secured by Gary Davis.

[00:40] Team_095 possession (Score: 48-61)
FOUL! Shooting foul on Vince Gasol. Gary Davis to the line for 2 free throws. [Team fouls: 4] (Vince Gasol: 1 personal fouls)   FT 1/2: GOOD   FT 2/2: GOOD Gary Davis makes 2/2 from the line.
Score: 50-61

[00:25] Team_023 possession (Score: 50-61)
Magic Booker makes the Dunk and draws the foul on Cade Beal! And-1! Magic Booker to the line for 1. [BONUS: 8 team fouls] (Cade Beal: 2 personal fouls)   FT 1/1: GOOD Magic Booker makes 1/1 from the line.
Score: 50-64

[00:09] Team_095 possession (Score: 50-64)
Kyle Poole drives and kicks out. Kyle Poole attempts a 3Pt. Contested by Tracy Anthony (3.1 feet, MAN). Kyle Poole misses. Rebound secured by Evan Parker.

================================================================================
                              2ND QUARTER COMPLETE                              
================================================================================

2ND QUARTER SCORE: Team_095 25, Team_023 26

BOX SCORE:
================================================================================

Team_095
--------------------------------------------------------------------------------
Player                MIN  PTS  REB  AST  TO      FG   FG%      3P   3P%
--------------------------------------------------------------------------------
Kyle Poole              7    6    0    0   0   2/5    40.0     0/0   0.0
Kyrie Ming             17    5    0    1   0   2/2   100.0     0/0   0.0
Evan Carter            17    4    3    0   0   2/3    66.7     0/0   0.0
Dejounte Hyland        17    2    1    0   0   1/2    50.0     0/0   0.0
Shaquille Ball         17    2    1    0   0   1/1   100.0     0/0   0.0
Cade Beal               7    2    0    1   0   1/2    50.0     0/0   0.0
Tobias Wagner           7    2    2    0   0   1/1   100.0     0/0   0.0
Gary Davis              7    2    2    0   0   1/3    33.3     0/0   0.0
Immanuel Middleton     17    0    0    1   0   0/2     0.0     0/0   0.0
DeMar McCollum          7    0    1    1   0   0/0     0.0     0/0   0.0

TEAM: FG: 11/21 (52.4%), 3PT: 2/9 (22.2%), REB: 12 (3 off, 9 def), AST: 4, TO: 2
TEAM FOULS: 8 [Team_023 in BONUS]


Team_023
--------------------------------------------------------------------------------
Player                MIN  PTS  REB  AST  TO      FG   FG%      3P   3P%
--------------------------------------------------------------------------------
Magic Booker            7    8    0    2   0   3/5    60.0     0/0   0.0
Gary Westbrook          7    5    1    0   0   2/2   100.0     0/0   0.0
Trae Ingram            17    4    0    0   0   2/4    50.0     0/0   0.0
Tim Bane               17    3    1    0   0   1/2    50.0     0/0   0.0
Vince Gasol             7    2    4    0   0   1/2    50.0     0/0   0.0
Tracy Anthony           7    2    0    1   0   1/2    50.0     0/0   0.0
Kyle Paul              17    0    2    0   0   0/0     0.0     0/0   0.0
Collin Ginobili        17    0    0    0   0   0/1     0.0     0/0   0.0
Josh Morant            17    0    2    1   0   0/1     0.0     0/0   0.0
Evan Parker             7    0    2    1   0   0/0     0.0     0/0   0.0

TEAM: FG: 10/19 (52.6%), 3PT: 1/7 (14.3%), REB: 10 (2 off, 8 def), AST: 5, TO: 3
TEAM FOULS: 4

================================================================================

================================================================================
                       3RD QUARTER - Team_095 vs Team_023                       
================================================================================

[12:00] Team_095 possession (Score: 50-64)
Dejounte Hyland attempts a Layup. BLOCKED BY TRAE INGRAM! Ball goes out off Trae Ingram. Dejounte Hyland's ball!

[11:46] Team_095 possession (Score: 50-64)
FOUL! Shooting foul on Josh Morant. Shaquille Ball to the line for 2 free throws. [Team fouls: 1] (Josh Morant: 1 personal fouls)   FT 1/2: MISS   FT 2/2: GOOD Shaquille Ball makes 1/2 from the line.
Score: 51-64

[11:31] Team_023 possession (Score: 51-64)
Josh Morant drives and kicks out. Collin Ginobili attempts a Midrange. Contested by Immanuel Middleton (5.4 feet, ZONE). Collin Ginobili misses. Offensive rebound by Tim Bane! Tim Bane's putback is no good. Rebound secured by Dejounte Hyland.

[11:17] Team_095 possession (Score: 51-64)
Kyrie Ming attempts a Layup. Wide open! Tim Bane is 7.3 feet away. [ZONE] KYRIE MING MAKES IT! Assist: Shaquille Ball
Score: 53-64

[11:00] Team_023 possession (Score: 53-64)
Trae Ingram makes the Layup and draws the foul on Dejounte Hyland! And-1! Trae Ingram to the line for 1. [Team fouls: 1] (Dejounte Hyland: 1 personal fouls)   FT 1/1: MISS Trae Ingram makes 0/1 from the line. Rebound secured by Shaquille Ball.
Score: 53-66

[10:47] Team_095 possession (Score: 53-66)
Dejounte Hyland attempts a 3Pt. Contested by Trae Ingram (4.5 feet, MAN). Dejounte Hyland misses. Rebound secured by Kyle Paul.

[10:31] Team_023 possession (Score: 53-66)
Trae Ingram drives and kicks out. Collin Ginobili attempts a 3Pt. Contested by Evan Carter (2.3 feet, ZONE). Collin Ginobili misses. FOUL! Loose ball foul on Evan Carter during the rebound battle. [Team fouls: 2] No free throws, side out. (Evan Carter: 1 personal fouls)

[10:17] Team_023 possession (Score: 53-66)
Kyle Paul attempts a 3Pt. Contested by Evan Carter (2.0 feet, ZONE). Kyle Paul misses. Rebound secured by Evan Carter.

[10:00] Team_095 possession (Score: 53-66)
Evan Carter loses the ball! Stripped by Kyle Paul! TURNOVER! (live ball)

[09:46] Team_023 possession (Score: 53-66)
Trae Ingram attempts a Midrange. Contested by Dejounte Hyland (3.6 feet, MAN). Trae Ingram misses. Offensive rebound by Tim Bane! Tim Bane's putback is no good. Rebound secured by Evan Carter.

[09:31] Team_095 possession (Score: 53-66)
Shaquille Ball attempts a 3Pt. Heavily contested by Collin Ginobili (1.9 feet, MAN)! SHAQUILLE BALL MAKES IT! Assist: Kyrie Ming
Score: 56-66

[09:18] Team_023 possession (Score: 56-66)
Trae Ingram attempts a Layup. Contested by Kyrie Ming (2.6 feet, ZONE). TRAE INGRAM MAKES IT! Assist: Josh Morant
Score: 56-68

[09:07] Team_095 possession (Score: 56-68)
Immanuel Middleton drives and kicks out. Dejounte Hyland attempts a Midrange. Contested by Trae Ingram (5.3 feet, MAN). DEJOUNTE HYLAND MAKES IT! Assist: Shaquille Ball
Score: 58-68

[08:54] Team_023 possession (Score: 58-68)
Trae Ingram attempts a 3Pt. Heavily contested by Evan Carter (1.0 feet, ZONE)! Trae Ingram misses. Offensive rebound by Tim Bane! Tim Bane puts it back in!
Score: 58-70

[08:42] Team_095 possession (Score: 58-70)
Evan Carter makes the Layup and draws the foul on Tim Bane! And-1! Evan Carter to the line for 1. [Team fouls: 2] (Tim Bane: 1 personal fouls)   FT 1/1: GOOD Evan Carter makes 1/1 from the line.
Score: 61-70

[08:27] Team_023 possession (Score: 61-70)
FOUL! Reach-in foul on Evan Carter during the drive. [Team fouls: 3] No free throws, side out. (Evan Carter: 2 personal fouls)

[08:11] Team_023 possession (Score: 61-70)
Josh Morant throws a bad pass! Stolen by Immanuel Middleton! TURNOVER! (live ball)

[07:58] Team_095 possession (Score: 61-70)
Evan Carter attempts a 3Pt. Heavily contested by Kyle Paul (0.5 feet, MAN)! Evan Carter misses. Offensive rebound by Evan Carter! Evan Carter's putback is no good. Rebound secured by Josh Morant.

[07:43] Team_023 possession (Score: 61-70)
Tim Bane drives and kicks out. Josh Morant makes the Midrange and draws the foul on Immanuel Middleton! And-1! Josh Morant to the line for 1. [Team fouls: 4] (Immanuel Middleton: 1 personal fouls)   FT 1/1: GOOD Josh Morant makes 1/1 from the line.
Score: 61-73

[07:28] Team_095 possession (Score: 61-73)
Immanuel Middleton attempts a Midrange. Contested by Josh Morant (2.7 feet, MAN). Immanuel Middleton misses. Rebound secured by Josh Morant.

[07:15] Team_023 possession (Score: 61-73)
Tim Bane attempts a Midrange. Wide open! Kyrie Ming is 8.0 feet away. [MAN] Tim Bane misses. Offensive rebound by Josh Morant! Josh Morant kicks it out.

[06:59] Team_023 possession (Score: 61-73)
Kyle Paul attempts a 3Pt. Contested by Evan Carter (4.8 feet, MAN). KYLE PAUL MAKES IT! Assist: Trae Ingram
Score: 61-76

[06:45] Team_095 possession (Score: 61-76)
FOUL! Shooting foul on Kyle Paul. Dejounte Hyland to the line for 2 free throws. [Team fouls: 3] (Kyle Paul: 1 personal fouls)   FT 1/2: GOOD   FT 2/2: GOOD Dejounte Hyland makes 2/2 from the line.
Score: 63-76

[06:30] Team_023 possession (Score: 63-76)
Kyle Paul attempts a 3Pt. Contested by Evan Carter (3.2 feet, ZONE). Kyle Paul misses. Offensive rebound by Tim Bane! Tim Bane puts it back in!
Score: 63-78

[06:14] Team_095 possession (Score: 63-78)
Immanuel Middleton throws a bad pass out of bounds! TURNOVER! (dead ball)

[06:01] Team_023 possession (Score: 63-78)
Trae Ingram drives, picks up Dejounte Hyland. Help arrives from Evan Carter! Trae Ingram attempts a Layup. Wide open! Evan Carter is 6.5 feet away. [MAN] TRAE INGRAM MAKES IT!
Score: 63-80

[05:46] Team_095 possession (Score: 63-80)
Kyrie Ming drives, Tim Bane stays with him. Kyrie Ming attempts a Dunk. Contested by Tim Bane (4.2 feet, MAN). KYRIE MING MAKES IT! Assist: Evan Carter
Score: 65-80

[05:32] Team_023 possession (Score: 65-80)
FOUL! Shooting foul on Dejounte Hyland. Josh Morant to the line for 2 free throws. [BONUS: 5 team fouls] (Dejounte Hyland: 2 personal fouls)   FT 1/2: GOOD   FT 2/2: MISS Josh Morant makes 1/2 from the line. Rebound secured by Shaquille Ball.
Score: 65-81

[05:19] Team_095 possession (Score: 65-81)
Dejounte Hyland attempts a Midrange. Heavily contested by Kyle Paul (1.5 feet, ZONE)! Dejounte Hyland misses. Rebound secured by Josh Morant.

[05:05] Team_023 possession (Score: 65-81)
Collin Ginobili makes the Layup and draws the foul on Immanuel Middleton! And-1! Collin Ginobili to the line for 1. [BONUS: 6 team fouls] (Immanuel Middleton: 2 personal fouls)   FT 1/1: GOOD Collin Ginobili makes 1/1 from the line.
Score: 65-84

[04:48] Team_095 possession (Score: 65-84)
Immanuel Middleton throws a bad pass! Stolen by Josh Morant! TURNOVER! (live ball)

[04:30] Team_023 possession (Score: 65-84)
Kyle Paul drives, picks up Evan Carter. Help arrives from Dejounte Hyland! Kyle Paul attempts a Dunk. Contested by Dejounte Hyland (4.2 feet, MAN). Kyle Paul misses. Rebound secured by Dejounte Hyland.

[04:14] Team_095 possession (Score: 65-84)
FOUL! Shooting foul on Kyle Paul. Shaquille Ball to the line for 3 free throws. [Team fouls: 4] (Kyle Paul: 2 personal fouls)   FT 1/3: MISS   FT 2/3: GOOD   FT 3/3: GOOD Shaquille Ball makes 2/3 from the line.
Score: 67-84

[04:00] Team_023 possession (Score: 67-84)
Kyle Paul drives and kicks out. Collin Ginobili attempts a Midrange. Contested by Kyrie Ming (3.7 feet, ZONE). Collin Ginobili misses. Rebound secured by Shaquille Ball.

[03:48] Team_095 possession (Score: 67-84)
Kyrie Ming attempts a Midrange. Contested by Collin Ginobili (2.2 feet, ZONE). Kyrie Ming misses. Rebound secured by Tim Bane.

[03:36] Team_023 possession (Score: 67-84)
Trae Ingram attempts a Layup. Wide open! Kyrie Ming is 6.5 feet away. [ZONE] TRAE INGRAM MAKES IT!
Score: 67-86

[03:24] Team_095 possession (Score: 67-86)
Evan Carter attempts a 3Pt. Contested by Kyle Paul (3.7 feet, ZONE). Evan Carter misses. Offensive rebound by Evan Carter! Evan Carter puts it back in!
Score: 69-86

[03:10] Team_023 possession (Score: 69-86)
Collin Ginobili drives and kicks out. Trae Ingram attempts a Midrange. Contested by Dejounte Hyland (4.8 feet, MAN). Trae Ingram misses. Rebound secured by Dejounte Hyland.

[02:59] Team_095 possession (Score: 69-86)
Dejounte Hyland attempts a 3Pt. Contested by Kyle Paul (5.2 feet, ZONE). DEJOUNTE HYLAND MAKES IT! Assist: Immanuel Middleton
Score: 72-86

[02:49] Team_023 possession (Score: 72-86)
Tim Bane attempts a Midrange. Wide open! Kyrie Ming is 7.2 feet away. [MAN] Tim Bane misses. Rebound secured by Shaquille Ball.

[02:37] Team_095 possession (Score: 72-86)
FOUL! Shooting foul on Josh Morant. Shaquille Ball to the line for 3 free throws. [BONUS: 5 team fouls] (Josh Morant: 2 personal fouls)   FT 1/3: MISS   FT 2/3: GOOD   FT 3/3: GOOD Shaquille Ball makes 2/3 from the line.
Score: 74-86

[02:25] Team_023 possession (Score: 74-86)
Trae Ingram drives, picks up Immanuel Middleton. Help arrives from Dejounte Hyland! Trae Ingram attempts a Layup. Contested by Dejounte Hyland (4.4 feet, ZONE). TRAE INGRAM MAKES IT! Assist: Tim Bane
Score: 74-88

[02:09] Team_095 possession (Score: 74-88)
Evan Carter attempts a Midrange. Contested by Kyle Paul (3.2 feet, MAN). EVAN CARTER MAKES IT! Assist: Dejounte Hyland
Score: 76-88

[01:58] Team_023 possession (Score: 76-88)
Josh Morant drives, Immanuel Middleton stays with him. Josh Morant attempts a Dunk. Wide open! Immanuel Middleton is 6.1 feet away. [MAN] JOSH MORANT MAKES IT! Assist: Collin Ginobili
Score: 76-90

[01:44] Team_095 possession (Score: 76-90)
Shaquille Ball throws a bad pass! Stolen by Collin Ginobili! TURNOVER! (live ball)

[01:28] Team_023 possession (Score: 76-90)
Tim Bane attempts a Midrange. Contested by Evan Carter (3.0 feet, ZONE). Tim Bane misses. Rebound secured by Evan Carter.

[01:17] Team_095 possession (Score: 76-90)
Shaquille Ball attempts a 3Pt. Contested by Kyle Paul (3.6 feet, ZONE). Shaquille Ball misses. FOUL! Loose ball foul on Tim Bane during the rebound battle. [IN THE BONUS! 6 team fouls] Evan Carter to the line for 2 free throws. (Tim Bane: 2 personal fouls)   FT 1/2: MISS   FT 2/2: GOOD Evan Carter makes 1/2 from the line.
Score: 77-90

[01:05] Team_023 possession (Score: 77-90)
Trae Ingram attempts a Layup. Wide open! Dejounte Hyland is 6.8 feet away. [MAN] TRAE INGRAM MAKES IT! Assist: Collin Ginobili
Score: 77-92

[00:48] Team_095 possession (Score: 77-92)
FOUL! Reach-in foul on Collin Ginobili during the drive. [IN THE BONUS! 7 team fouls] Shaquille Ball to the line for 2 free throws. (Collin Ginobili: 1 personal fouls)   FT 1/2: GOOD   FT 2/2: MISS Shaquille Ball makes 1/2 from the line. Rebound secured by Kyle Paul.
Score: 78-92

[00:36] Team_023 possession (Score: 78-92)
Collin Ginobili drives, Shaquille Ball stays with him. Collin Ginobili attempts a Layup. Contested by Shaquille Ball (3.6 feet, MAN). COLLIN GINOBILI MAKES IT! Assist: Trae Ingram
Score: 78-94

[00:25] Team_095 possession (Score: 78-94)
FOUL! Shooting foul on Tim Bane. Kyrie Ming to the line for 2 free throws. [BONUS: 8 team fouls] (Tim Bane: 3 personal fouls)   FT 1/2: GOOD   FT 2/2: GOOD Kyrie Ming makes 2/2 from the line.
Score: 80-94

[00:12] Team_023 possession (Score: 80-94)
Trae Ingram attempts a Layup. Contested by Immanuel Middleton (4.0 feet, ZONE). TRAE INGRAM MAKES IT! Assist: Josh Morant
Score: 80-96

================================================================================
                              3RD QUARTER COMPLETE                              
================================================================================

3RD QUARTER SCORE: Team_095 30, Team_023 32

BOX SCORE:
================================================================================

Team_095
--------------------------------------------------------------------------------
Player                MIN  PTS  REB  AST  TO      FG   FG%      3P   3P%
--------------------------------------------------------------------------------
Shaquille Ball         29    8    4    2   0   4/5    80.0     0/0   0.0
Evan Carter            29    8    4    1   0   4/5    80.0     0/0   0.0
Dejounte Hyland        29    7    3    1   0   3/5    60.0     0/0   0.0
Kyrie Ming             29    6    0    1   0   3/4    75.0     0/0   0.0
Immanuel Middleton     29    0    0    1   0   0/1     0.0     0/0   0.0

TEAM: FG: 14/20 (70.0%), 3PT: 6/8 (75.0%), REB: 10 (2 off, 8 def), AST: 6, TO: 4
TEAM FOULS: 6 [Team_023 in BONUS]


Team_023
--------------------------------------------------------------------------------
Player                MIN  PTS  REB  AST  TO      FG   FG%      3P   3P%
--------------------------------------------------------------------------------
Trae Ingram            29   12    0    2   0   6/8    75.0     0/0   0.0
Josh Morant            29    5    5    2   0   2/4    50.0     0/0   0.0
Collin Ginobili        29    5    0    2   0   2/3    66.7     0/0   0.0
Tim Bane               29    4    3    1   0   2/4    50.0     0/0   0.0
Kyle Paul              29    3    2    0   0   1/4    25.0     0/0   0.0

TEAM: FG: 13/23 (56.5%), 3PT: 3/4 (75.0%), REB: 11 (6 off, 5 def), AST: 7, TO: 1
TEAM FOULS: 8 [Team_095 in BONUS]

================================================================================

================================================================================
                       4TH QUARTER - Team_095 vs Team_023                       
================================================================================

[12:00] Substitution (Team_095): Dejounte Hyland OUT (stamina: 68) → Kyle Poole IN (comeback_detected)

[12:00] Substitution (Team_023): Trae Ingram OUT (stamina: 68) → Tracy Anthony IN (comeback_detected)

[12:00] Team_095 possession (Score: 80-96)
Kyle Poole attempts a Layup. Wide open! Tracy Anthony is 6.0 feet away. [MAN] Kyle Poole misses. Rebound secured by Kyle Paul.

[11:47] Team_023 possession (Score: 80-96)
Collin Ginobili attempts a 3Pt. Contested by Shaquille Ball (4.4 feet, MAN). Collin Ginobili misses. Rebound secured by Shaquille Ball.

[11:32] Team_095 possession (Score: 80-96)
Evan Carter attempts a 3Pt. Contested by Tracy Anthony (2.4 feet, ZONE). Evan Carter misses. Rebound secured by Tim Bane.

[11:20] Team_023 possession (Score: 80-96)
FOUL! Holding foul on Shaquille Ball. [Team fouls: 1] No free throws, side out. (Shaquille Ball: 1 personal fouls)

[11:09] Team_023 possession (Score: 80-96)
FOUL! Holding foul on Kyrie Ming. [Team fouls: 2] No free throws, side out. (Kyrie Ming: 1 personal fouls)

[10:57] Team_023 possession (Score: 80-96)
Collin Ginobili drives, Immanuel Middleton stays with him. Collin Ginobili attempts a Layup. Wide open! Immanuel Middleton is 9.0 feet away. [ZONE] COLLIN GINOBILI MAKES IT! Assist: Tim Bane
Score: 80-98

[10:42] Team_095 possession (Score: 80-98)
FOUL! Shooting foul on Tracy Anthony. Shaquille Ball to the line for 3 free throws. [Team fouls: 1] (Tracy Anthony: 1 personal fouls)   FT 1/3: GOOD   FT 2/3: MISS   FT 3/3: GOOD Shaquille Ball makes 2/3 from the line.
Score: 82-98

[10:31] Team_023 possession (Score: 82-98)
Josh Morant attempts a Layup. Wide open! Immanuel Middleton is 7.4 feet away. [ZONE] JOSH MORANT MAKES IT!
Score: 82-100

[10:16] Team_095 possession (Score: 82-100)
Immanuel Middleton drives to the basket... Immanuel Middleton loses the ball! Stripped by Tim Bane! TURNOVER! (live ball)

[10:03] Team_023 possession (Score: 82-100)
Collin Ginobili drives and kicks out. Josh Morant attempts a Midrange. Heavily contested by Immanuel Middleton (1.4 feet, MAN)! Josh Morant misses. Rebound secured by Evan Carter.

[09:46] Team_095 possession (Score: 82-100)
Kyrie Ming attempts a 3Pt. Contested by Tracy Anthony (5.6 feet, ZONE). Kyrie Ming misses. Rebound secured by Josh Morant.

[09:31] Team_023 possession (Score: 82-100)
Josh Morant makes the Midrange and draws the foul on Evan Carter! And-1! Josh Morant to the line for 1. [Team fouls: 3] (Evan Carter: 1 personal fouls)   FT 1/1: GOOD Josh Morant makes 1/1 from the line.
Score: 82-103

[09:19] Team_095 possession (Score: 82-103)
Kyrie Ming drives, picks up Tim Bane. Help arrives from Tracy Anthony! Kyrie Ming attempts a Layup. Contested by Tracy Anthony (4.7 feet, MAN). Kyrie Ming misses. Rebound secured by Josh Morant.

[09:03] Team_023 possession (Score: 82-103)
Collin Ginobili drives to the basket... FOUL! Offensive foul on Collin Ginobili! Immanuel Middleton drew the charge! [Team fouls: 2] (Collin Ginobili: 1 personal fouls) TURNOVER! (dead ball)

[08:48] Team_095 possession (Score: 82-103)
Evan Carter drives, Kyle Paul stays with him. Evan Carter attempts a Dunk. Contested by Kyle Paul (4.3 feet, MAN). EVAN CARTER MAKES IT!
Score: 84-103

[08:32] Team_023 possession (Score: 84-103)
Tim Bane attempts a Layup. Contested by Kyrie Ming (5.2 feet, MAN). TIM BANE MAKES IT! Assist: Tracy Anthony
Score: 84-105

[08:23] Team_095 possession (Score: 84-105)
Kyrie Ming drives to the basket... Kyrie Ming throws a bad pass out of bounds! TURNOVER! (dead ball)

[08:23] Substitution (Team_095): Shaquille Ball OUT → Cade Beal IN (stamina_rule2)

[08:23] Substitution (Team_095): Evan Carter OUT → Tobias Wagner IN (stamina_rule2)

[08:23] Substitution (Team_095): Immanuel Middleton OUT → Gary Davis IN (stamina_rule2)

[08:23] Substitution (Team_095): Kyrie Ming OUT → DeMar McCollum IN (stamina_rule2)

[08:23] Substitution (Team_023): Collin Ginobili OUT → Magic Booker IN (stamina_rule2)

[08:23] Substitution (Team_023): Kyle Paul OUT → Gary Westbrook IN (stamina_rule2)

[08:23] Substitution (Team_023): Josh Morant OUT → Evan Parker IN (stamina_rule2)

[08:23] Substitution (Team_023): Tim Bane OUT → Vince Gasol IN (stamina_rule2)

[08:10] Team_023 possession (Score: 84-105)
Vince Gasol drives and kicks out. Gary Westbrook attempts a Midrange. Heavily contested by Tobias Wagner (1.7 feet, MAN)! Gary Westbrook misses. Rebound secured by Gary Davis.

[07:58] Team_095 possession (Score: 84-105)
Tobias Wagner attempts a 3Pt. Contested by Tracy Anthony (5.0 feet, ZONE). Tobias Wagner misses. Offensive rebound by Tobias Wagner! Tobias Wagner kicks it out.

[07:48] Team_095 possession (Score: 84-105)
FOUL! Reach-in foul on Gary Westbrook during the drive. [Team fouls: 3] No free throws, side out. (Gary Westbrook: 1 personal fouls)

[07:31] Team_095 possession (Score: 84-105)
FOUL! Shooting foul on Evan Parker. Gary Davis to the line for 2 free throws. [Team fouls: 4] (Evan Parker: 1 personal fouls)   FT 1/2: GOOD   FT 2/2: GOOD Gary Davis makes 2/2 from the line.
Score: 86-105

[07:17] Team_023 possession (Score: 86-105)
Tracy Anthony drives, picks up Gary Davis. Help arrives from Kyle Poole! Tracy Anthony attempts a Layup. Contested by Kyle Poole (3.9 feet, ZONE). Tracy Anthony misses. Offensive rebound by Evan Parker! Evan Parker's putback is no good. Rebound secured by Tobias Wagner.

[07:03] Team_095 possession (Score: 86-105)
Cade Beal attempts a Midrange. Contested by Magic Booker (2.3 feet, MAN). Cade Beal misses. Rebound secured by Vince Gasol.

[06:52] Team_023 possession (Score: 86-105)
FOUL! Shooting foul on DeMar McCollum. Vince Gasol to the line for 2 free throws. [Team fouls: 4] (DeMar McCollum: 1 personal fouls)   FT 1/2: GOOD   FT 2/2: GOOD Vince Gasol makes 2/2 from the line.
Score: 86-107

[06:39] Team_095 possession (Score: 86-107)
Gary Davis attempts a 3Pt. Contested by Evan Parker (2.5 feet, MAN). Gary Davis misses. Offensive rebound by DeMar McCollum! DeMar McCollum kicks it out.

[06:25] Team_095 possession (Score: 86-107)
Gary Davis drives, Evan Parker stays with him. Gary Davis attempts a Layup. Heavily contested by Evan Parker (1.1 feet, MAN)! Gary Davis misses. Rebound secured by Evan Parker.

[06:15] Team_023 possession (Score: 86-107)
Evan Parker attempts a 3Pt. Wide open! Gary Davis is 9.3 feet away. [MAN] Evan Parker misses. Rebound secured by Tobias Wagner.

[05:59] Team_095 possession (Score: 86-107)
Cade Beal attempts a 3Pt. Wide open! Magic Booker is 6.7 feet away. [ZONE] Cade Beal misses. Rebound secured by Gary Westbrook.

[05:45] Team_023 possession (Score: 86-107)
Vince Gasol attempts a 3Pt. Contested by Cade Beal (3.7 feet, ZONE). Vince Gasol misses. Rebound secured by Tobias Wagner.

[05:26] Team_095 possession (Score: 86-107)
Gary Davis makes the Layup and draws the foul on Evan Parker! And-1! Gary Davis to the line for 1. [BONUS: 5 team fouls] (Evan Parker: 2 personal fouls)   FT 1/1: GOOD Gary Davis makes 1/1 from the line.
Score: 89-107

[05:12] Team_023 possession (Score: 89-107)
Magic Booker drives to the basket... Magic Booker loses control! Ball rolls out of bounds! TURNOVER! (dead ball)

[04:56] Team_095 possession (Score: 89-107)
Cade Beal attempts a 3Pt. Contested by Magic Booker (4.6 feet, ZONE). Cade Beal misses. Rebound secured by Gary Westbrook.

[04:41] Team_023 possession (Score: 89-107)
Evan Parker attempts a 3Pt. Wide open! Gary Davis is 6.1 feet away. [MAN] EVAN PARKER MAKES IT! Assist: Vince Gasol
Score: 89-110

[04:22] Team_095 possession (Score: 89-110)
DeMar McCollum attempts a Midrange. Contested by Vince Gasol (3.8 feet, MAN). DEMAR MCCOLLUM MAKES IT! Assist: Kyle Poole
Score: 91-110

[04:05] Team_023 possession (Score: 91-110)
Tracy Anthony attempts a 3Pt. Contested by Kyle Poole (4.0 feet, MAN). Tracy Anthony misses. Rebound secured by Tobias Wagner.

[03:48] Team_095 possession (Score: 91-110)
Kyle Poole attempts a Layup. BLOCKED BY VINCE GASOL! Ball deflects out of bounds off Kyle Poole.

[03:32] Team_023 possession (Score: 91-110)
Evan Parker drives, picks up DeMar McCollum. Help arrives from Cade Beal! Evan Parker attempts a Dunk. Contested by Cade Beal (4.8 feet, ZONE). EVAN PARKER MAKES IT! Assist: Vince Gasol
Score: 91-112

[03:17] Team_095 possession (Score: 91-112)
Tobias Wagner attempts a Layup. Contested by Gary Westbrook (3.9 feet, MAN). TOBIAS WAGNER MAKES IT! Assist: Cade Beal
Score: 93-112

[03:03] Team_023 possession (Score: 93-112)
Gary Westbrook drives, Tobias Wagner stays with him. Gary Westbrook attempts a Layup. Contested by Tobias Wagner (3.8 feet, MAN). GARY WESTBROOK MAKES IT! Assist: Evan Parker
Score: 93-114

[02:47] Team_095 possession (Score: 93-114)
Gary Davis drives and kicks out. Tobias Wagner attempts a 3Pt. Contested by Gary Westbrook (2.3 feet, MAN). Tobias Wagner misses. FOUL! Loose ball foul on Evan Parker during the rebound battle. [IN THE BONUS! 6 team fouls] Tobias Wagner to the line for 2 free throws. (Evan Parker: 3 personal fouls)   FT 1/2: GOOD   FT 2/2: GOOD Tobias Wagner makes 2/2 from the line.
Score: 95-114

[02:33] Team_023 possession (Score: 95-114)
Tracy Anthony attempts a 3Pt. Contested by Cade Beal (4.5 feet, ZONE). Tracy Anthony misses. FOUL! Loose ball foul on Gary Davis during the rebound battle. [IN THE BONUS! 5 team fouls] Evan Parker to the line for 2 free throws. (Gary Davis: 1 personal fouls)   FT 1/2: GOOD   FT 2/2: MISS Evan Parker makes 1/2 from the line. Rebound secured by Tobias Wagner.
Score: 95-115

[02:22] Team_095 possession (Score: 95-115)
DeMar McCollum drives, picks up Vince Gasol. Help arrives from Magic Booker! DeMar McCollum attempts a Dunk. Wide open! Magic Booker is 7.8 feet away. [MAN] DEMAR MCCOLLUM MAKES IT!
Score: 97-115

[02:05] Team_023 possession (Score: 97-115)
Magic Booker attempts a 3Pt. Wide open! Cade Beal is 6.1 feet away. [MAN] Magic Booker misses. Rebound secured by Tobias Wagner.

[01:52] Team_095 possession (Score: 97-115)
FOUL! Offensive foul on Gary Davis! Evan Parker drew the charge! [Team fouls: 6] (Gary Davis: 2 personal fouls) TURNOVER! (dead ball)

[01:37] Team_023 possession (Score: 97-115)
Vince Gasol attempts a 3Pt. Contested by Cade Beal (5.9 feet, ZONE). VINCE GASOL MAKES IT! Assist: Gary Westbrook
Score: 97-118

[01:21] Team_095 possession (Score: 97-118)
Cade Beal attempts a Layup. BLOCKED BY MAGIC BOOKER! Ball is loose! Rebound secured by Vince Gasol.

[01:08] Team_023 possession (Score: 97-118)
Magic Booker attempts a 3Pt. Wide open! Cade Beal is 7.3 feet away. [MAN] Magic Booker misses. Rebound secured by Tobias Wagner.

[00:53] Team_095 possession (Score: 97-118)
Tobias Wagner attempts a 3Pt. Contested by Gary Westbrook (2.7 feet, MAN). TOBIAS WAGNER MAKES IT! Assist: Gary Davis
Score: 100-118

[00:38] Team_023 possession (Score: 100-118)
Gary Westbrook attempts a Layup. BLOCKED BY DEMAR MCCOLLUM! Ball is loose! Rebound secured by Gary Davis.

[00:20] Team_095 possession (Score: 100-118)
FOUL! Shooting foul on Magic Booker. Cade Beal to the line for 3 free throws. [BONUS: 7 team fouls] (Magic Booker: 1 personal fouls)   FT 1/3: GOOD   FT 2/3: GOOD   FT 3/3: GOOD Cade Beal makes 3/3 from the line.
Score: 103-118

[00:02] Team_023 possession (Score: 103-118)
Vince Gasol makes the Layup and draws the foul on DeMar McCollum! And-1! Vince Gasol to the line for 1. [BONUS: 7 team fouls] (DeMar McCollum: 2 personal fouls)   FT 1/1: GOOD Vince Gasol makes 1/1 from the line.
Score: 103-121

================================================================================
                              4TH QUARTER COMPLETE                              
================================================================================

4TH QUARTER SCORE: Team_095 23, Team_023 25

BOX SCORE:
================================================================================

Team_095
--------------------------------------------------------------------------------
Player                MIN  PTS  REB  AST  TO      FG   FG%      3P   3P%
--------------------------------------------------------------------------------
Tobias Wagner          16    7    8    0   0   3/3   100.0     0/0   0.0
Gary Davis             16    5    2    1   0   2/3    66.7     0/0   0.0
DeMar McCollum         16    4    1    0   0   2/2   100.0     0/0   0.0
Cade Beal              16    3    0    1   0   1/5    20.0     0/0   0.0
Shaquille Ball         33    2    1    0   0   1/1   100.0     0/0   0.0
Evan Carter            33    2    1    0   0   1/2    50.0     0/0   0.0
Kyle Poole             19    0    0    1   0   0/2     0.0     0/0   0.0
Kyrie Ming             33    0    0    0   0   0/2     0.0     0/0   0.0

TEAM: FG: 10/20 (50.0%), 3PT: 3/7 (42.9%), REB: 11 (2 off, 9 def), AST: 3, TO: 3
TEAM FOULS: 7 [Team_023 in BONUS]


Team_023
--------------------------------------------------------------------------------
Player                MIN  PTS  REB  AST  TO      FG   FG%      3P   3P%
--------------------------------------------------------------------------------
Vince Gasol            16    8    2    2   0   3/5    60.0     0/0   0.0
Josh Morant            33    5    2    0   0   2/2   100.0     0/0   0.0
Evan Parker            16    5    1    1   0   2/3    66.7     0/0   0.0
Collin Ginobili        33    2    0    0   0   1/3    33.3     0/0   0.0
Tim Bane               33    2    1    1   0   1/1   100.0     0/0   0.0
Gary Westbrook         16    2    2    1   0   1/2    50.0     0/0   0.0
Kyle Paul              33    0    1    0   0   0/0     0.0     0/0   0.0
Tracy Anthony          19    0    0    1   0   0/3     0.0     0/0   0.0
Magic Booker           16    0    0    0   0   0/2     0.0     0/0   0.0

TEAM: FG: 10/21 (47.6%), 3PT: 2/9 (22.2%), REB: 11 (2 off, 9 def), AST: 6, TO: 2
TEAM FOULS: 7 [Team_095 in BONUS]

================================================================================

================================================================================
                               FULL GAME COMPLETE                               
================================================================================

FINAL SCORE: Team_095 103, Team_023 121

SCORING BY QUARTER:
--------------------------------------------------------------------------------
Team                     Q1     Q2     Q3     Q4    FINAL
--------------------------------------------------------------------------------
Team_095                 25     25     30     23      103
Team_023                 38     26     32     25      121
--------------------------------------------------------------------------------

FULL GAME BOX SCORE:
================================================================================

Team_095
--------------------------------------------------------------------------------
Player                MIN  PTS  REB  AST  TO      FG   FG%      3P   3P%      FT STL BLK
--------------------------------------------------------------------------------
Shaquille Ball         33   17    8    2   3  10/13   76.9   6/7    85.7   9/14    0   0
Evan Carter            33   14   11    2   4   5/8    62.5   1/4    25.0   2/3     0   0
Immanuel Middleton     33    2    0    3   5   3/8    37.5   0/2     0.0   0/0     1   0
Kyrie Ming             33   19    0    3   0   8/14   57.1   1/3    33.3   6/6     0   0
Dejounte Hyland        29   15    6    2   0   4/7    57.1   2/4    50.0   2/2     0   0
Kyle Poole             19    6    0    1   0   2/7    28.6   1/3    33.3   1/1     0   0
Cade Beal              16    5    0    2   0   2/7    28.6   1/4    25.0   3/3     0   1
Tobias Wagner          16    9   12    0   1   4/4   100.0   1/1   100.0   2/2     0   0
Gary Davis             16   10    4    1   1   5/9    55.6   0/2     0.0   6/6     0   0
DeMar McCollum         16    5    2    1   0   2/2   100.0   0/0     0.0   1/2     0   1

TEAM: FG: 45/79 (57.0%), 3PT: 13/30 (43.3%), REB: 40 (10 off, 30 def), AST: 17, TO: 14


Team_023
--------------------------------------------------------------------------------
Player                MIN  PTS  REB  AST  TO      FG   FG%      3P   3P%      FT STL BLK
--------------------------------------------------------------------------------
Collin Ginobili        33   13    0    3   1   5/11   45.5   2/4    50.0   1/1     2   0
Kyle Paul              33   14    5    1   2   7/11   63.6   4/6    66.7   4/4     2   0
Josh Morant            33   15   13    4   1   5/9    55.6   0/1     0.0   4/5     2   0
Tim Bane               33   14   10    3   1   4/7    57.1   0/0     0.0   2/5     1   1
Trae Ingram            29   24    0    3   0  13/17   76.5   1/2    50.0   0/1     0   1
Tracy Anthony          19    5    0    2   1   2/6    33.3   1/4    25.0   0/0     0   0
Magic Booker           16    8    0    2   0   3/7    42.9   0/3     0.0   2/2     0   1
Gary Westbrook         16    7    3    1   0   3/4    75.0   1/1   100.0   0/0     0   0
Evan Parker            16    5    4    2   1   2/4    50.0   1/3    33.3   1/2     0   0
Vince Gasol            16   10    6    3   0   4/8    50.0   1/3    33.3   3/3     0   1

TEAM: FG: 48/84 (57.1%), 3PT: 11/27 (40.7%), REB: 44 (14 off, 30 def), AST: 24, TO: 7

================================================================================
