================================================================================
                        FULL GAME - Team_068 vs Team_063                        
================================================================================

================================================================================
                       1ST QUARTER - Team_068 vs Team_063                       
================================================================================

[12:00] Team_068 possession (Score: 0-0)
FOUL! Holding foul on Tyler Harris. [Team fouls: 1] No free throws, side out. (Tyler Harris: 1 personal fouls)

[11:48] Team_068 possession (Score: 0-0)
FOUL! Holding foul on Terry Reaves. [Team fouls: 2] No free throws, side out. (Terry Reaves: 1 personal fouls)

[11:35] Team_068 possession (Score: 0-0)
Jaren Johnson loses control! Ball rolls out of bounds! TURNOVER! (dead ball)

[11:18] Team_063 possession (Score: 0-0)
Tyler Harris attempts a Layup. Contested by Nikola Ginobili (3.1 feet, MAN). Tyler Harris misses. Rebound secured by Gary Simons.

[11:03] Team_068 possession (Score: 0-0)
FOUL! Reach-in foul on Tyler Harris during the drive. [Team fouls: 3] No free throws, side out. (Tyler Harris: 2 personal fouls)

[10:51] Team_068 possession (Score: 0-0)
Jaren Johnson attempts a Midrange. Contested by Malcolm Quickley (2.9 feet, ZONE). Jaren Johnson misses. Offensive rebound by Jaren Johnson! Jaren Johnson kicks it out.

[10:38] Team_068 possession (Score: 0-0)
FOUL! Offensive foul on Gary Simons! Dirk Reaves drew the charge! [Team fouls: 1] (Gary Simons: 1 personal fouls) TURNOVER! (dead ball)

[10:23] Team_063 possession (Score: 0-0)
Tyler Harris attempts a Midrange. Heavily contested by Gary Simons (1.0 feet, ZONE)! Tyler Harris misses. Rebound secured by Jaren Johnson.

[10:07] Team_068 possession (Score: 0-0)
Zion Anunoby attempts a Layup. Wide open! Tyler Harris is 6.5 feet away. [ZONE] ZION ANUNOBY MAKES IT! Assist: Gary Simons
Score: 2-0

[09:53] Team_063 possession (Score: 2-0)
Dirk Reaves attempts a Midrange. Wide open! Gary Simons is 7.5 feet away. [MAN] DIRK REAVES MAKES IT!
Score: 2-2

[09:39] Team_068 possession (Score: 2-2)
Gary Simons drives and kicks out. Gary Simons attempts a 3Pt. Contested by Dirk Reaves (5.5 feet, MAN). Gary Simons misses. Rebound secured by Tyler Harris.

[09:25] Team_063 possession (Score: 2-2)
Tyler Harris drives, Nikola Ginobili stays with him. Tyler Harris attempts a Dunk. Contested by Nikola Ginobili (5.8 feet, MAN). TYLER HARRIS MAKES IT! Assist: Dirk Reaves
Score: 2-4

[09:15] Team_068 possession (Score: 2-4)
Nikola Ginobili makes the Dunk and draws the foul on Tyler Harris! And-1! Nikola Ginobili to the line for 1. [Team fouls: 4] (Tyler Harris: 3 personal fouls)   FT 1/1: MISS Nikola Ginobili makes 0/1 from the line. Offensive rebound by Jaren Johnson! Jaren Johnson kicks it out.
Score: 4-4

[09:00] Team_068 possession (Score: 4-4)
FOUL! Shooting foul on Malcolm Quickley. Gary Simons to the line for 2 free throws. [BONUS: 5 team fouls] (Malcolm Quickley: 1 personal fouls)   FT 1/2: GOOD   FT 2/2: GOOD Gary Simons makes 2/2 from the line.
Score: 6-4

[08:44] Team_063 possession (Score: 6-4)
Terry Reaves attempts a 3Pt. Contested by Jaren Johnson (3.4 feet, MAN). Terry Reaves misses. Rebound secured by Gary Simons.

[08:29] Team_068 possession (Score: 6-4)
Zion Anunoby drives, picks up Tyler Harris. Help arrives from Malcolm Quickley! Zion Anunoby attempts a Layup. Wide open! Malcolm Quickley is 7.1 feet away. [ZONE] ZION ANUNOBY MAKES IT!
Score: 8-4

[08:16] Team_063 possession (Score: 8-4)
Bradley Davis attempts a Midrange. Contested by Jaren Johnson (5.6 feet, ZONE). BRADLEY DAVIS MAKES IT! Assist: Tyler Harris
Score: 8-6

[08:01] Team_068 possession (Score: 8-6)
Malcolm Herro attempts a Midrange. Contested by Malcolm Quickley (2.8 feet, MAN). MALCOLM HERRO MAKES IT!
Score: 10-6

[07:47] Team_063 possession (Score: 10-6)
FOUL! Holding foul on Nikola Ginobili. [Team fouls: 2] No free throws, side out. (Nikola Ginobili: 1 personal fouls)

[07:37] Team_063 possession (Score: 10-6)
Dirk Reaves makes the Layup and draws the foul on Malcolm Herro! And-1! Dirk Reaves to the line for 1. [Team fouls: 3] (Malcolm Herro: 1 personal fouls)   FT 1/1: GOOD Dirk Reaves makes 1/1 from the line.
Score: 10-9

[07:22] Team_068 possession (Score: 10-9)
Malcolm Herro loses the ball! Stripped by Malcolm Quickley! TURNOVER! (live ball)

[07:09] Team_063 possession (Score: 10-9)
Terry Reaves attempts a 3Pt. Contested by Jaren Johnson (2.8 feet, MAN). TERRY REAVES MAKES IT! Assist: Dirk Reaves
Score: 10-12

[06:57] Team_068 possession (Score: 10-12)
Malcolm Herro attempts a Midrange. Contested by Dirk Reaves (2.5 feet, ZONE). Malcolm Herro misses. Offensive rebound by Nikola Ginobili! Nikola Ginobili puts it back in!
Score: 12-12

[06:38] Team_063 possession (Score: 12-12)
Tyler Harris attempts a Layup. Contested by Nikola Ginobili (5.4 feet, MAN). Tyler Harris misses. Rebound secured by Gary Simons.

[06:20] Team_068 possession (Score: 12-12)
Jaren Johnson attempts a Layup. Contested by Tyler Harris (4.4 feet, ZONE). Jaren Johnson misses. FOUL! Loose ball foul on Malcolm Quickley during the rebound battle. [IN THE BONUS! 6 team fouls] Nikola Ginobili to the line for 2 free throws. (Malcolm Quickley: 2 personal fouls)   FT 1/2: GOOD   FT 2/2: MISS Nikola Ginobili makes 1/2 from the line. Rebound secured by Dirk Reaves.
Score: 13-12

[06:09] Team_063 possession (Score: 13-12)
Terry Reaves attempts a 3Pt. Contested by Jaren Johnson (2.6 feet, MAN). Terry Reaves misses. Rebound secured by Gary Simons.

[05:54] Team_068 possession (Score: 13-12)
Malcolm Herro attempts a 3Pt. Heavily contested by Malcolm Quickley (1.4 feet, MAN)! Malcolm Herro misses. Rebound secured by Tyler Harris.

[05:40] Team_063 possession (Score: 13-12)
Dirk Reaves attempts a Layup. BLOCKED BY GARY SIMONS! Ball is loose! Rebound secured by Nikola Ginobili.

[05:23] Team_068 possession (Score: 13-12)
Nikola Ginobili attempts a 3Pt. Contested by Tyler Harris (5.9 feet, MAN). Nikola Ginobili misses. Offensive rebound by Jaren Johnson! Jaren Johnson kicks it out.

[05:08] Team_068 possession (Score: 13-12)
Nikola Ginobili attempts a Midrange. Contested by Tyler Harris (3.8 feet, MAN). NIKOLA GINOBILI MAKES IT!
Score: 15-12

[04:54] Team_063 possession (Score: 15-12)
Terry Reaves attempts a 3Pt. Contested by Jaren Johnson (3.9 feet, MAN). Terry Reaves misses. Rebound secured by Nikola Ginobili.

[04:37] Team_068 possession (Score: 15-12)
Gary Simons commits a violation (traveling/carry)! TURNOVER! (dead ball)

[04:25] Team_063 possession (Score: 15-12)
Malcolm Quickley attempts a 3Pt. Wide open! Zion Anunoby is 6.8 feet away. [ZONE] MALCOLM QUICKLEY MAKES IT! Assist: Dirk Reaves
Score: 15-15

[04:07] Team_068 possession (Score: 15-15)
FOUL! Offensive foul on Jaren Johnson! Terry Reaves drew the charge! [Team fouls: 4] (Jaren Johnson: 1 personal fouls) TURNOVER! (dead ball)

[03:47] Team_063 possession (Score: 15-15)
Terry Reaves makes the Layup and draws the foul on Gary Simons! And-1! Terry Reaves to the line for 1. [BONUS: 5 team fouls] (Gary Simons: 2 personal fouls)   FT 1/1: GOOD Terry Reaves makes 1/1 from the line.
Score: 15-18

[03:35] Team_068 possession (Score: 15-18)
Gary Simons attempts a Midrange. Contested by Dirk Reaves (2.9 feet, MAN). Gary Simons misses. Rebound secured by Dirk Reaves.

[03:18] Team_063 possession (Score: 15-18)
Terry Reaves drives, Jaren Johnson stays with him. Terry Reaves attempts a Dunk. Heavily contested by Jaren Johnson (1.7 feet, MAN)! Terry Reaves misses. Offensive rebound by Tyler Harris! Tyler Harris's putback is no good. Rebound secured by Jaren Johnson.

[03:08] Team_068 possession (Score: 15-18)
Jaren Johnson drives and kicks out. Nikola Ginobili attempts a 3Pt. Contested by Dirk Reaves (5.8 feet, ZONE). Nikola Ginobili misses. Rebound secured by Malcolm Quickley.

[02:58] Team_063 possession (Score: 15-18)
Tyler Harris drives and kicks out. Bradley Davis attempts a 3Pt. Contested by Zion Anunoby (3.4 feet, MAN). BRADLEY DAVIS MAKES IT! Assist: Malcolm Quickley
Score: 15-21

[02:44] Team_068 possession (Score: 15-21)
Jaren Johnson attempts a 3Pt. Wide open! Malcolm Quickley is 7.1 feet away. [ZONE] Jaren Johnson misses. Rebound secured by Malcolm Quickley.

[02:29] Team_063 possession (Score: 15-21)
Malcolm Quickley attempts a 3Pt. Contested by Zion Anunoby (5.4 feet, ZONE). MALCOLM QUICKLEY MAKES IT! Assist: Dirk Reaves
Score: 15-24

[02:17] Team_068 possession (Score: 15-24)
Zion Anunoby attempts a Midrange. Contested by Malcolm Quickley (4.2 feet, ZONE). Zion Anunoby misses. Rebound secured by Dirk Reaves.

[02:03] Team_063 possession (Score: 15-24)
Dirk Reaves loses the ball! Stripped by Gary Simons! TURNOVER! (live ball)

[01:53] Team_068 possession (Score: 15-24)
Jaren Johnson attempts a Midrange. Contested by Terry Reaves (5.7 feet, MAN). Jaren Johnson misses. Rebound secured by Dirk Reaves.

[01:39] Team_063 possession (Score: 15-24)
Tyler Harris attempts a 3Pt. Wide open! Zion Anunoby is 8.4 feet away. [ZONE] TYLER HARRIS MAKES IT! Assist: Malcolm Quickley
Score: 15-27

[01:26] Team_068 possession (Score: 15-27)
Gary Simons attempts a Midrange. Contested by Dirk Reaves (4.5 feet, MAN). Gary Simons misses. Rebound secured by Dirk Reaves.

[01:13] Team_063 possession (Score: 15-27)
Dirk Reaves attempts a 3Pt. Contested by Zion Anunoby (5.7 feet, ZONE). DIRK REAVES MAKES IT! Assist: Tyler Harris
Score: 15-30

[00:59] Team_068 possession (Score: 15-30)
Zion Anunoby attempts a Layup. BLOCKED BY TYLER HARRIS! Ball deflects out of bounds off Zion Anunoby.

[00:44] Team_063 possession (Score: 15-30)
Terry Reaves attempts a 3Pt. Heavily contested by Jaren Johnson (0.8 feet, MAN)! Terry Reaves misses. Rebound secured by Gary Simons.

[00:34] Team_068 possession (Score: 15-30)
Zion Anunoby attempts a 3Pt. Wide open! Bradley Davis is 6.4 feet away. [MAN] ZION ANUNOBY MAKES IT! Assist: Nikola Ginobili
Score: 18-30

[00:21] Team_063 possession (Score: 18-30)
Malcolm Quickley attempts a 3Pt. BLOCKED BY ZION ANUNOBY! Ball is loose! Rebound secured by Gary Simons.

[00:08] Team_068 possession (Score: 18-30)
Zion Anunoby drives, Bradley Davis stays with him. Zion Anunoby attempts a Dunk. Wide open! Bradley Davis is 6.6 feet away. [MAN] ZION ANUNOBY MAKES IT! Assist: Gary Simons
Score: 20-30

================================================================================
                              1ST QUARTER COMPLETE                              
================================================================================

1ST QUARTER SCORE: Team_068 20, Team_063 30

BOX SCORE:
================================================================================

Team_068
--------------------------------------------------------------------------------
Player                MIN  PTS  REB  AST  TO      FG   FG%      3P   3P%
--------------------------------------------------------------------------------
Zion Anunoby           12    9    0    0   0   4/6    66.7     0/0   0.0
Nikola Ginobili        12    4    3    1   0   2/2   100.0     0/0   0.0
Gary Simons            12    2    6    2   0   1/4    25.0     0/0   0.0
Malcolm Herro          12    2    0    0   0   1/2    50.0     0/0   0.0
Jaren Johnson          12    0    5    0   0   0/4     0.0     0/0   0.0

TEAM: FG: 8/18 (44.4%), 3PT: 1/3 (33.3%), REB: 14 (5 off, 9 def), AST: 3, TO: 5
TEAM FOULS: 5 [Team_063 in BONUS]


Team_063
--------------------------------------------------------------------------------
Player                MIN  PTS  REB  AST  TO      FG   FG%      3P   3P%
--------------------------------------------------------------------------------
Dirk Reaves            12    8    5    4   0   3/4    75.0     0/0   0.0
Terry Reaves           12    6    0    0   0   2/7    28.6     0/0   0.0
Malcolm Quickley       12    6    2    2   0   2/3    66.7     0/0   0.0
Tyler Harris           12    5    2    2   0   2/5    40.0     0/0   0.0
Bradley Davis          12    5    0    0   0   2/2   100.0     0/0   0.0

TEAM: FG: 11/21 (52.4%), 3PT: 5/10 (50.0%), REB: 9 (1 off, 8 def), AST: 8, TO: 1
TEAM FOULS: 6 [Team_068 in BONUS]

================================================================================

================================================================================
                       2ND QUARTER - Team_068 vs Team_063                       
================================================================================

[12:00] Team_068 possession (Score: 20-30)
Malcolm Herro attempts a 3Pt. Heavily contested by Malcolm Quickley (0.5 feet, MAN)! Malcolm Herro misses. Offensive rebound by Nikola Ginobili! Nikola Ginobili puts it back in!
Score: 22-30

[11:45] Team_063 possession (Score: 22-30)
Terry Reaves drives to the basket... Terry Reaves throws a bad pass! Stolen by Jaren Johnson! TURNOVER! (live ball)

[11:32] Team_068 possession (Score: 22-30)
Malcolm Herro drives and kicks out. Jaren Johnson attempts a 3Pt. Contested by Malcolm Quickley (4.5 feet, ZONE). Jaren Johnson misses. FOUL! Loose ball foul on Malcolm Quickley during the rebound battle. [Team fouls: 1] No free throws, side out. (Malcolm Quickley: 1 personal fouls)

[11:17] Team_068 possession (Score: 22-30)
Gary Simons attempts a Midrange. Contested by Terry Reaves (4.8 feet, ZONE). Gary Simons misses. Offensive rebound by Nikola Ginobili! Nikola Ginobili's putback is no good. Rebound secured by Dirk Reaves.

[11:03] Team_063 possession (Score: 22-30)
Bradley Davis attempts a 3Pt. Heavily contested by Zion Anunoby (1.3 feet, ZONE)! Bradley Davis misses. Rebound secured by Jaren Johnson.

[10:51] Team_068 possession (Score: 22-30)
FOUL! Shooting foul on Tyler Harris. Zion Anunoby to the line for 2 free throws. [Team fouls: 2] (Tyler Harris: 1 personal fouls)   FT 1/2: GOOD   FT 2/2: MISS Zion Anunoby makes 1/2 from the line. Rebound secured by Dirk Reaves.
Score: 23-30

[10:38] Team_063 possession (Score: 23-30)
Dirk Reaves attempts a Midrange. BLOCKED BY JAREN JOHNSON! Ball deflects out of bounds off Dirk Reaves.

[10:22] Team_068 possession (Score: 23-30)
FOUL! Offensive foul on Malcolm Herro! Malcolm Quickley drew the charge! [Team fouls: 1] (Malcolm Herro: 1 personal fouls) TURNOVER! (dead ball)

[10:04] Team_063 possession (Score: 23-30)
FOUL! Offensive foul on Dirk Reaves! Gary Simons drew the charge! [Team fouls: 3] (Dirk Reaves: 1 personal fouls) TURNOVER! (dead ball)

[09:48] Team_068 possession (Score: 23-30)
Gary Simons attempts a Layup. Wide open! Tyler Harris is 6.1 feet away. [ZONE] GARY SIMONS MAKES IT! Assist: Malcolm Herro
Score: 25-30

[09:30] Team_063 possession (Score: 25-30)
Tyler Harris drives, Gary Simons stays with him. Tyler Harris attempts a Dunk. Heavily contested by Gary Simons (1.6 feet, ZONE)! Tyler Harris misses. Rebound secured by Jaren Johnson.

[09:16] Team_068 possession (Score: 25-30)
Jaren Johnson attempts a Midrange. Contested by Tyler Harris (4.5 feet, ZONE). Jaren Johnson misses. Rebound secured by Malcolm Quickley.

[09:00] Team_063 possession (Score: 25-30)
Terry Reaves attempts a Midrange. Wide open! Malcolm Herro is 9.0 feet away. [ZONE] Terry Reaves misses. Rebound secured by Nikola Ginobili.

[08:46] Team_068 possession (Score: 25-30)
Malcolm Herro attempts a 3Pt. Contested by Malcolm Quickley (3.8 feet, ZONE). Malcolm Herro misses. Rebound secured by Malcolm Quickley.

[08:27] Team_063 possession (Score: 25-30)
Malcolm Quickley drives and kicks out. Dirk Reaves attempts a 3Pt. Contested by Gary Simons (4.9 feet, MAN). DIRK REAVES MAKES IT! Assist: Tyler Harris
Score: 25-33

[08:14] Team_068 possession (Score: 25-33)
FOUL! Reach-in foul on Malcolm Quickley during the drive. [Team fouls: 4] No free throws, side out. (Malcolm Quickley: 2 personal fouls)

[07:56] Team_068 possession (Score: 25-33)
Malcolm Herro attempts a 3Pt. Contested by Malcolm Quickley (4.3 feet, MAN). Malcolm Herro misses. Rebound secured by Tyler Harris.

[07:41] Team_063 possession (Score: 25-33)
Terry Reaves attempts a 3Pt. Wide open! Zion Anunoby is 8.6 feet away. [ZONE] Terry Reaves misses. Rebound secured by Jaren Johnson.

[07:26] Team_068 possession (Score: 25-33)
Zion Anunoby attempts a 3Pt. Wide open! Bradley Davis is 7.8 feet away. [MAN] Zion Anunoby misses. Rebound secured by Tyler Harris.

[07:12] Team_063 possession (Score: 25-33)
Dirk Reaves drives and kicks out. Terry Reaves attempts a Midrange. Wide open! Jaren Johnson is 6.5 feet away. [MAN] TERRY REAVES MAKES IT! Assist: Bradley Davis
Score: 25-35

[06:56] Team_068 possession (Score: 25-35)
Jaren Johnson attempts a 3Pt. Wide open! Terry Reaves is 8.7 feet away. [MAN] Jaren Johnson misses. Offensive rebound by Jaren Johnson! Jaren Johnson kicks it out.

[06:42] Team_068 possession (Score: 25-35)
Malcolm Herro attempts a Midrange. Heavily contested by Dirk Reaves (0.8 feet, ZONE)! Malcolm Herro misses. Rebound secured by Malcolm Quickley.

[06:31] Team_063 possession (Score: 25-35)
Dirk Reaves drives, Gary Simons stays with him. Dirk Reaves attempts a Layup. Wide open! Gary Simons is 7.0 feet away. [MAN] Dirk Reaves misses. Offensive rebound by Malcolm Quickley! Malcolm Quickley kicks it out.

[06:18] Team_063 possession (Score: 25-35)
Terry Reaves drives, picks up Jaren Johnson. Help arrives from Malcolm Herro! Terry Reaves attempts a Dunk. Contested by Malcolm Herro (5.7 feet, MAN). TERRY REAVES MAKES IT! Assist: Tyler Harris
Score: 25-37

[06:05] Team_068 possession (Score: 25-37)
Malcolm Herro attempts a 3Pt. Contested by Malcolm Quickley (3.3 feet, MAN). Malcolm Herro misses. Rebound secured by Malcolm Quickley.

[05:49] Team_063 possession (Score: 25-37)
Tyler Harris attempts a Midrange. Wide open! Nikola Ginobili is 6.5 feet away. [ZONE] TYLER HARRIS MAKES IT!
Score: 25-39

[05:34] Team_068 possession (Score: 25-39)
Gary Simons attempts a Midrange. Contested by Terry Reaves (5.0 feet, ZONE). Gary Simons misses. Rebound secured by Tyler Harris.

[05:18] Team_063 possession (Score: 25-39)
Dirk Reaves attempts a Layup. BLOCKED BY GARY SIMONS! Ball is loose! Rebound secured by Nikola Ginobili.

[05:06] Team_068 possession (Score: 25-39)
Gary Simons drives and kicks out. Nikola Ginobili attempts a 3Pt. Wide open! Tyler Harris is 10.0 feet away. [MAN] NIKOLA GINOBILI MAKES IT! Assist: Gary Simons
Score: 28-39

[04:54] Team_063 possession (Score: 28-39)
Terry Reaves attempts a 3Pt. Contested by Jaren Johnson (2.2 feet, MAN). Terry Reaves misses. Offensive rebound by Malcolm Quickley! Malcolm Quickley kicks it out.

[04:38] Team_063 possession (Score: 28-39)
FOUL! Reach-in foul on Gary Simons during the drive. [Team fouls: 2] No free throws, side out. (Gary Simons: 1 personal fouls)

[04:23] Team_063 possession (Score: 28-39)
Malcolm Quickley attempts a Layup. Wide open! Malcolm Herro is 7.4 feet away. [MAN] MALCOLM QUICKLEY MAKES IT!
Score: 28-41

[04:08] Team_068 possession (Score: 28-41)
Nikola Ginobili drives, picks up Tyler Harris. Help arrives from Malcolm Quickley! Nikola Ginobili attempts a Dunk. Wide open! Malcolm Quickley is 8.7 feet away. [ZONE] NIKOLA GINOBILI MAKES IT! Assist: Jaren Johnson
Score: 30-41

[03:52] Team_063 possession (Score: 30-41)
Terry Reaves attempts a 3Pt. Wide open! Jaren Johnson is 8.4 feet away. [MAN] Terry Reaves misses. Offensive rebound by Malcolm Quickley! Malcolm Quickley kicks it out.

[03:39] Team_063 possession (Score: 30-41)
Malcolm Quickley attempts a 3Pt. Contested by Zion Anunoby (5.5 feet, ZONE). Malcolm Quickley misses. Rebound secured by Nikola Ginobili.

[03:26] Team_068 possession (Score: 30-41)
Nikola Ginobili drives and kicks out. Zion Anunoby attempts a Midrange. Contested by Dirk Reaves (4.7 feet, ZONE). Zion Anunoby misses. Rebound secured by Dirk Reaves.

[03:11] Team_063 possession (Score: 30-41)
Tyler Harris attempts a 3Pt. Contested by Zion Anunoby (5.5 feet, ZONE). TYLER HARRIS MAKES IT!
Score: 30-44

[02:55] Team_068 possession (Score: 30-44)
Malcolm Herro attempts a Layup. Contested by Malcolm Quickley (4.1 feet, MAN). Malcolm Herro misses. Offensive rebound by Nikola Ginobili! Nikola Ginobili kicks it out.

[02:40] Team_068 possession (Score: 30-44)
FOUL! Reach-in foul on Tyler Harris during the drive. [IN THE BONUS! 5 team fouls] Gary Simons to the line for 2 free throws. (Tyler Harris: 2 personal fouls)   FT 1/2: GOOD   FT 2/2: GOOD Gary Simons makes 2/2 from the line.
Score: 32-44

[02:24] Team_063 possession (Score: 32-44)
Dirk Reaves attempts a Layup. BLOCKED BY MALCOLM HERRO! Ball is loose! Offensive rebound by Malcolm Quickley! Malcolm Quickley kicks it out.

[02:10] Team_063 possession (Score: 32-44)
Tyler Harris drives, Nikola Ginobili stays with him. Tyler Harris attempts a Layup. Wide open! Nikola Ginobili is 6.7 feet away. [MAN] TYLER HARRIS MAKES IT! Assist: Dirk Reaves
Score: 32-46

[01:54] Team_068 possession (Score: 32-46)
Nikola Ginobili attempts a Midrange. Wide open! Terry Reaves is 9.5 feet away. [ZONE] NIKOLA GINOBILI MAKES IT! Assist: Zion Anunoby
Score: 34-46

[01:40] Team_063 possession (Score: 34-46)
Bradley Davis attempts a 3Pt. Contested by Zion Anunoby (4.9 feet, MAN). Bradley Davis misses. Rebound secured by Nikola Ginobili.

[01:22] Team_068 possession (Score: 34-46)
Malcolm Herro attempts a Midrange. Contested by Terry Reaves (5.7 feet, ZONE). MALCOLM HERRO MAKES IT!
Score: 36-46

[01:09] Team_063 possession (Score: 36-46)
Tyler Harris drives to the basket... Tyler Harris throws a bad pass out of bounds! TURNOVER! (dead ball)

[01:09] Substitution (Team_068): Zion Anunoby OUT → Cole Anthony IN (stamina_rule2)

[01:09] Substitution (Team_068): Malcolm Herro OUT → Ja Banchero IN (stamina_rule2)

[01:09] Substitution (Team_068): Jaren Johnson OUT → Miles Murray IN (stamina_rule2)

[01:09] Substitution (Team_068): Gary Simons OUT → Jarrett Oladipo IN (stamina_rule2)

[01:09] Substitution (Team_068): Nikola Ginobili OUT → Franz Curry IN (stamina_rule2)

[01:09] Substitution (Team_063): Bradley Davis OUT → DeMar Banchero IN (stamina_rule2)

[01:09] Substitution (Team_063): Malcolm Quickley OUT → Cole Durant IN (stamina_rule2)

[01:09] Substitution (Team_063): Terry Reaves OUT → Jaren James IN (stamina_rule2)

[01:09] Substitution (Team_063): Dirk Reaves OUT → Lamelo Ball IN (stamina_rule2)

[01:09] Substitution (Team_063): Tyler Harris OUT → Kyle Green IN (stamina_rule2)

[00:54] Team_068 possession (Score: 36-46)
FOUL! Shooting foul on Jaren James. Miles Murray to the line for 2 free throws. [BONUS: 6 team fouls] (Jaren James: 1 personal fouls)   FT 1/2: GOOD   FT 2/2: MISS Miles Murray makes 1/2 from the line. Offensive rebound by Jarrett Oladipo! Jarrett Oladipo kicks it out.
Score: 37-46

[00:38] Team_068 possession (Score: 37-46)
Franz Curry attempts a Layup. Contested by Kyle Green (2.4 feet, ZONE). FRANZ CURRY MAKES IT! Assist: Cole Anthony
Score: 39-46

[00:25] Team_063 possession (Score: 39-46)
Lamelo Ball drives, Jarrett Oladipo stays with him. Lamelo Ball attempts a Dunk. Wide open! Jarrett Oladipo is 9.0 feet away. [MAN] LAMELO BALL MAKES IT! Assist: Kyle Green
Score: 39-48

[00:08] Team_068 possession (Score: 39-48)
Cole Anthony attempts a Midrange. Contested by Lamelo Ball (5.2 feet, ZONE). Cole Anthony misses. Rebound secured by Kyle Green.

================================================================================
                              2ND QUARTER COMPLETE                              
================================================================================

2ND QUARTER SCORE: Team_068 19, Team_063 18

BOX SCORE:
================================================================================

Team_068
--------------------------------------------------------------------------------
Player                MIN  PTS  REB  AST  TO      FG   FG%      3P   3P%
--------------------------------------------------------------------------------
Nikola Ginobili        23    9    7    0   0   4/5    80.0     0/0   0.0
Gary Simons            23    4    0    1   0   2/4    50.0     0/0   0.0
Malcolm Herro          23    2    0    1   0   1/5    20.0     0/0   0.0
Franz Curry             1    2    0    0   0   1/1   100.0     0/0   0.0
Jaren Johnson          23    0    4    1   0   0/1     0.0     0/0   0.0
Zion Anunoby           23    0    0    1   0   0/2     0.0     0/0   0.0
Jarrett Oladipo         1    0    1    0   0   0/0     0.0     0/0   0.0
Cole Anthony            1    0    0    1   0   0/1     0.0     0/0   0.0

TEAM: FG: 8/19 (42.1%), 3PT: 1/5 (20.0%), REB: 13 (6 off, 7 def), AST: 5, TO: 1
TEAM FOULS: 2


Team_063
--------------------------------------------------------------------------------
Player                MIN  PTS  REB  AST  TO      FG   FG%      3P   3P%
--------------------------------------------------------------------------------
Tyler Harris           23    7    3    2   0   3/4    75.0     0/0   0.0
Terry Reaves           23    4    0    0   0   2/4    50.0     0/0   0.0
Dirk Reaves            23    3    3    1   0   1/3    33.3     0/0   0.0
Malcolm Quickley       23    2    8    0   0   1/2    50.0     0/0   0.0
Lamelo Ball             1    2    0    0   0   1/1   100.0     0/0   0.0
Bradley Davis          23    0    0    1   0   0/2     0.0     0/0   0.0
Kyle Green              1    0    1    1   0   0/0     0.0     0/0   0.0

TEAM: FG: 8/16 (50.0%), 3PT: 1/5 (20.0%), REB: 14 (4 off, 10 def), AST: 5, TO: 3
TEAM FOULS: 6 [Team_068 in BONUS]

================================================================================

================================================================================
                       3RD QUARTER - Team_068 vs Team_063                       
================================================================================

[12:00] Team_068 possession (Score: 39-48)
Jaren Johnson drives and kicks out. Nikola Ginobili attempts a 3Pt. Contested by Dirk Reaves (3.1 feet, ZONE). Nikola Ginobili misses. Rebound secured by Dirk Reaves.

[11:46] Team_063 possession (Score: 39-48)
FOUL! Shooting foul on Gary Simons. Dirk Reaves to the line for 2 free throws. [Team fouls: 1] (Gary Simons: 1 personal fouls)   FT 1/2: GOOD   FT 2/2: MISS Dirk Reaves makes 1/2 from the line. Offensive rebound by Dirk Reaves! Dirk Reaves puts it back in!
Score: 39-51

[11:34] Team_068 possession (Score: 39-51)
Jaren Johnson drives to the basket... FOUL! Offensive foul on Jaren Johnson! Tyler Harris drew the charge! [Team fouls: 2] (Jaren Johnson: 1 personal fouls) TURNOVER! (dead ball)

[11:22] Team_063 possession (Score: 39-51)
Tyler Harris drives to the basket... Tyler Harris throws a bad pass! Stolen by Nikola Ginobili! TURNOVER! (live ball)

[11:10] Team_068 possession (Score: 39-51)
Zion Anunoby drives, picks up Bradley Davis. Help arrives from Malcolm Quickley! Zion Anunoby attempts a Dunk. Wide open! Malcolm Quickley is 6.2 feet away. [MAN] ZION ANUNOBY MAKES IT! Assist: Gary Simons
Score: 41-51

[10:54] Team_063 possession (Score: 41-51)
Tyler Harris drives and kicks out. Terry Reaves attempts a Midrange. BLOCKED BY JAREN JOHNSON! Ball is loose! Rebound secured by Jaren Johnson.

[10:42] Team_068 possession (Score: 41-51)
Jaren Johnson attempts a 3Pt. Contested by Malcolm Quickley (5.3 feet, ZONE). Jaren Johnson misses. Rebound secured by Malcolm Quickley.

[10:28] Team_063 possession (Score: 41-51)
Terry Reaves attempts a Layup. Heavily contested by Gary Simons (0.5 feet, ZONE)! Terry Reaves misses. Offensive rebound by Dirk Reaves! Dirk Reaves's putback is no good. Offensive rebound by Tyler Harris! Tyler Harris kicks it out.

[10:11] Team_063 possession (Score: 41-51)
Dirk Reaves attempts a 3Pt. Contested by Gary Simons (4.3 feet, ZONE). Dirk Reaves misses. Rebound secured by Nikola Ginobili.

[09:57] Team_068 possession (Score: 41-51)
Malcolm Herro attempts a Midrange. Contested by Malcolm Quickley (6.0 feet, MAN). Malcolm Herro misses. Rebound secured by Dirk Reaves.

[09:43] Team_063 possession (Score: 41-51)
Dirk Reaves drives, picks up Gary Simons. Help arrives from Malcolm Herro! Dirk Reaves attempts a Dunk. Contested by Malcolm Herro (4.3 feet, ZONE). DIRK REAVES MAKES IT! Assist: Bradley Davis
Score: 41-53

[09:28] Team_068 possession (Score: 41-53)
Zion Anunoby attempts a Midrange. Contested by Malcolm Quickley (4.0 feet, ZONE). Zion Anunoby misses. Rebound secured by Tyler Harris.

[09:16] Team_063 possession (Score: 41-53)
Dirk Reaves attempts a Layup. Wide open! Gary Simons is 6.7 feet away. [ZONE] Dirk Reaves misses. Offensive rebound by Tyler Harris! Tyler Harris puts it back in!
Score: 41-55

[09:06] Team_068 possession (Score: 41-55)
FOUL! Offensive foul on Zion Anunoby! Bradley Davis drew the charge! [Team fouls: 4] (Zion Anunoby: 1 personal fouls) TURNOVER! (dead ball)

[08:54] Team_063 possession (Score: 41-55)
Tyler Harris attempts a 3Pt. Contested by Nikola Ginobili (5.5 feet, MAN). Tyler Harris misses. Rebound secured by Gary Simons.

[08:42] Team_068 possession (Score: 41-55)
FOUL! Shooting foul on Terry Reaves. Jaren Johnson to the line for 2 free throws. [Team fouls: 1] (Terry Reaves: 1 personal fouls)   FT 1/2: GOOD   FT 2/2: GOOD Jaren Johnson makes 2/2 from the line.
Score: 43-55

[08:23] Team_063 possession (Score: 43-55)
Terry Reaves drives and kicks out. Terry Reaves attempts a Midrange. Contested by Jaren Johnson (2.9 feet, MAN). Terry Reaves misses. Rebound secured by Gary Simons.

[08:08] Team_068 possession (Score: 43-55)
Zion Anunoby attempts a Layup. Wide open! Bradley Davis is 8.3 feet away. [MAN] ZION ANUNOBY MAKES IT! Assist: Gary Simons
Score: 45-55

[07:55] Team_063 possession (Score: 45-55)
Dirk Reaves drives, picks up Gary Simons. Help arrives from Malcolm Herro! Dirk Reaves attempts a Dunk. Contested by Malcolm Herro (3.6 feet, ZONE). DIRK REAVES MAKES IT!
Score: 45-57

[07:44] Team_068 possession (Score: 45-57)
Zion Anunoby attempts a Midrange. Contested by Dirk Reaves (4.6 feet, ZONE). ZION ANUNOBY MAKES IT!
Score: 47-57

[07:34] Team_063 possession (Score: 47-57)
Tyler Harris makes the Layup and draws the foul on Gary Simons! And-1! Tyler Harris to the line for 1. [BONUS: 5 team fouls] (Gary Simons: 3 personal fouls)   FT 1/1: GOOD Tyler Harris makes 1/1 from the line.
Score: 47-60

[07:16] Team_068 possession (Score: 47-60)
Jaren Johnson attempts a Midrange. Contested by Malcolm Quickley (5.6 feet, ZONE). JAREN JOHNSON MAKES IT! Assist: Malcolm Herro
Score: 49-60

[07:05] Team_063 possession (Score: 49-60)
Tyler Harris attempts a Midrange. Contested by Nikola Ginobili (4.7 feet, MAN). Tyler Harris misses. Rebound secured by Jaren Johnson.

[06:53] Team_068 possession (Score: 49-60)
Jaren Johnson attempts a 3Pt. Heavily contested by Malcolm Quickley (0.5 feet, ZONE)! Jaren Johnson misses. Rebound secured by Tyler Harris.

[06:38] Team_063 possession (Score: 49-60)
Bradley Davis attempts a Midrange. Contested by Zion Anunoby (5.3 feet, MAN). Bradley Davis misses. Rebound secured by Jaren Johnson.

[06:24] Team_068 possession (Score: 49-60)
Malcolm Herro attempts a Layup. BLOCKED BY MALCOLM QUICKLEY! Ball is loose! Rebound secured by Tyler Harris.

[06:06] Team_063 possession (Score: 49-60)
Tyler Harris drives to the basket... Tyler Harris throws a bad pass! Stolen by Nikola Ginobili! TURNOVER! (live ball)

[05:51] Team_068 possession (Score: 49-60)
Nikola Ginobili attempts a Midrange. Heavily contested by Tyler Harris (1.1 feet, MAN)! Nikola Ginobili misses. Rebound secured by Dirk Reaves.

[05:32] Team_063 possession (Score: 49-60)
Tyler Harris makes the Dunk and draws the foul on Gary Simons! And-1! Tyler Harris to the line for 1. [BONUS: 6 team fouls] (Gary Simons: 4 personal fouls)   FT 1/1: GOOD Tyler Harris makes 1/1 from the line.
Score: 49-63

[05:21] Team_068 possession (Score: 49-63)
Nikola Ginobili makes the Layup and draws the foul on Tyler Harris! And-1! Nikola Ginobili to the line for 1. [Team fouls: 2] (Tyler Harris: 1 personal fouls)   FT 1/1: GOOD Nikola Ginobili makes 1/1 from the line.
Score: 52-63

[05:02] Team_063 possession (Score: 52-63)
Tyler Harris attempts a Midrange. Contested by Nikola Ginobili (3.3 feet, MAN). TYLER HARRIS MAKES IT! Assist: Bradley Davis
Score: 52-65

[04:50] Team_068 possession (Score: 52-65)
Jaren Johnson attempts a 3Pt. Wide open! Terry Reaves is 6.1 feet away. [MAN] JAREN JOHNSON MAKES IT!
Score: 55-65

[04:34] Team_063 possession (Score: 55-65)
Bradley Davis attempts a 3Pt. Contested by Zion Anunoby (3.9 feet, ZONE). BRADLEY DAVIS MAKES IT!
Score: 55-68

[04:24] Team_068 possession (Score: 55-68)
Gary Simons drives, picks up Dirk Reaves. Help arrives from Malcolm Quickley! Gary Simons attempts a Layup. Contested by Malcolm Quickley (5.3 feet, MAN). GARY SIMONS MAKES IT! Assist: Nikola Ginobili
Score: 57-68

[04:12] Team_063 possession (Score: 57-68)
Tyler Harris attempts a Midrange. Contested by Nikola Ginobili (3.0 feet, MAN). TYLER HARRIS MAKES IT!
Score: 57-70

[03:55] Team_068 possession (Score: 57-70)
Gary Simons drives, Tyler Harris stays with him. Gary Simons attempts a Dunk. Contested by Tyler Harris (3.4 feet, ZONE). GARY SIMONS MAKES IT! Assist: Malcolm Herro
Score: 59-70

[03:37] Team_063 possession (Score: 59-70)
Tyler Harris attempts a Layup. Contested by Gary Simons (4.6 feet, ZONE). TYLER HARRIS MAKES IT! Assist: Malcolm Quickley
Score: 59-72

[03:18] Team_068 possession (Score: 59-72)
Jaren Johnson attempts a Midrange. Wide open! Terry Reaves is 8.6 feet away. [MAN] Jaren Johnson misses. Rebound secured by Dirk Reaves.

[03:03] Team_063 possession (Score: 59-72)
Terry Reaves attempts a 3Pt. Contested by Zion Anunoby (2.1 feet, ZONE). Terry Reaves misses. Rebound secured by Jaren Johnson.

[02:47] Team_068 possession (Score: 59-72)
Zion Anunoby attempts a Layup. Wide open! Bradley Davis is 8.6 feet away. [MAN] ZION ANUNOBY MAKES IT! Assist: Nikola Ginobili
Score: 61-72

[02:31] Team_063 possession (Score: 61-72)
Terry Reaves attempts a Midrange. Wide open! Jaren Johnson is 7.6 feet away. [ZONE] Terry Reaves misses. Offensive rebound by Tyler Harris! Tyler Harris's putback is no good. Rebound secured by Jaren Johnson.

[02:14] Team_068 possession (Score: 61-72)
FOUL! Shooting foul on Tyler Harris. Nikola Ginobili to the line for 2 free throws. [Team fouls: 3] (Tyler Harris: 2 personal fouls)   FT 1/2: GOOD   FT 2/2: GOOD Nikola Ginobili makes 2/2 from the line.
Score: 63-72

[01:59] Team_063 possession (Score: 63-72)
Malcolm Quickley attempts a 3Pt. Contested by Zion Anunoby (5.3 feet, ZONE). MALCOLM QUICKLEY MAKES IT!
Score: 63-75

[01:45] Team_068 possession (Score: 63-75)
Nikola Ginobili drives, Tyler Harris stays with him. Nikola Ginobili attempts a Dunk. Contested by Tyler Harris (2.7 feet, ZONE). NIKOLA GINOBILI MAKES IT! Assist: Jaren Johnson
Score: 65-75

[01:31] Team_063 possession (Score: 65-75)
Bradley Davis attempts a Midrange. Contested by Jaren Johnson (3.7 feet, ZONE). Bradley Davis misses. Rebound secured by Nikola Ginobili.

[01:18] Team_068 possession (Score: 65-75)
Nikola Ginobili drives, Tyler Harris stays with him. Nikola Ginobili attempts a Layup. Contested by Tyler Harris (5.4 feet, MAN). NIKOLA GINOBILI MAKES IT!
Score: 67-75

[01:07] Team_063 possession (Score: 67-75)
Malcolm Quickley attempts a 3Pt. Contested by Zion Anunoby (5.3 feet, ZONE). MALCOLM QUICKLEY MAKES IT! Assist: Bradley Davis
Score: 67-78

[00:51] Team_068 possession (Score: 67-78)
Malcolm Herro attempts a 3Pt. Contested by Malcolm Quickley (3.6 feet, ZONE). Malcolm Herro misses. Offensive rebound by Nikola Ginobili! Nikola Ginobili puts it back in!
Score: 69-78

[00:36] Team_063 possession (Score: 69-78)
FOUL! Offensive foul on Dirk Reaves! Gary Simons drew the charge! [Team fouls: 4] (Dirk Reaves: 1 personal fouls) TURNOVER! (dead ball)

[00:21] Team_068 possession (Score: 69-78)
Jaren Johnson attempts a Layup. BLOCKED BY TERRY REAVES! Ball is loose! Offensive rebound by Nikola Ginobili! Nikola Ginobili kicks it out.

[00:05] Team_068 possession (Score: 69-78)
Zion Anunoby attempts a 3Pt. Contested by Malcolm Quickley (5.7 feet, ZONE). Zion Anunoby misses. Rebound secured by Tyler Harris.

================================================================================
                              3RD QUARTER COMPLETE                              
================================================================================

3RD QUARTER SCORE: Team_068 30, Team_063 30

BOX SCORE:
================================================================================

Team_068
--------------------------------------------------------------------------------
Player                MIN  PTS  REB  AST  TO      FG   FG%      3P   3P%
--------------------------------------------------------------------------------
Nikola Ginobili        35   11    4    2   0   5/6    83.3     0/0   0.0
Zion Anunoby           35    8    0    0   0   4/6    66.7     0/0   0.0
Jaren Johnson          35    7    5    1   0   3/7    42.9     0/0   0.0
Gary Simons            35    4    2    2   0   2/2   100.0     0/0   0.0
Malcolm Herro          35    0    0    2   0   0/2     0.0     0/0   0.0

TEAM: FG: 14/23 (60.9%), 3PT: 2/5 (40.0%), REB: 10 (2 off, 8 def), AST: 7, TO: 2
TEAM FOULS: 6 [Team_063 in BONUS]


Team_063
--------------------------------------------------------------------------------
Player                MIN  PTS  REB  AST  TO      FG   FG%      3P   3P%
--------------------------------------------------------------------------------
Tyler Harris           35   14    6    0   0   6/9    66.7     0/0   0.0
Dirk Reaves            35    7    4    0   0   3/4    75.0     0/0   0.0
Malcolm Quickley       35    6    1    1   0   2/2   100.0     0/0   0.0
Bradley Davis          35    3    0    3   0   1/3    33.3     0/0   0.0
Terry Reaves           35    0    0    0   0   0/3     0.0     0/0   0.0

TEAM: FG: 12/21 (57.1%), 3PT: 3/6 (50.0%), REB: 12 (3 off, 9 def), AST: 4, TO: 3
TEAM FOULS: 4

================================================================================

================================================================================
                       4TH QUARTER - Team_068 vs Team_063                       
================================================================================

[12:00] Team_068 possession (Score: 69-78)
FOUL! Holding foul on Terry Reaves. [Team fouls: 1] No free throws, side out. (Terry Reaves: 1 personal fouls)

[11:45] Team_068 possession (Score: 69-78)
Zion Anunoby attempts a 3Pt. Contested by Malcolm Quickley (5.4 feet, ZONE). Zion Anunoby misses. Rebound secured by Malcolm Quickley.

[11:34] Team_063 possession (Score: 69-78)
Bradley Davis drives, Gary Simons stays with him. Bradley Davis attempts a Dunk. Contested by Gary Simons (3.3 feet, ZONE). Bradley Davis misses. Rebound secured by Nikola Ginobili.

[11:19] Team_068 possession (Score: 69-78)
Nikola Ginobili drives, Tyler Harris stays with him. Nikola Ginobili attempts a Dunk. Contested by Tyler Harris (4.6 feet, ZONE). Nikola Ginobili misses. Rebound secured by Dirk Reaves.

[11:04] Team_063 possession (Score: 69-78)
Tyler Harris attempts a Layup. Contested by Nikola Ginobili (5.1 feet, ZONE). TYLER HARRIS MAKES IT! Assist: Bradley Davis
Score: 69-80

[10:50] Team_068 possession (Score: 69-80)
Gary Simons attempts a 3Pt. Contested by Dirk Reaves (2.9 feet, MAN). Gary Simons misses. Rebound secured by Malcolm Quickley.

[10:38] Team_063 possession (Score: 69-80)
Tyler Harris drives to the basket... FOUL! Offensive foul on Tyler Harris! Nikola Ginobili drew the charge! [Team fouls: 2] (Tyler Harris: 1 personal fouls) TURNOVER! (dead ball)

[10:23] Team_068 possession (Score: 69-80)
FOUL! Shooting foul on Terry Reaves. Gary Simons to the line for 2 free throws. [Team fouls: 3] (Terry Reaves: 2 personal fouls)   FT 1/2: GOOD   FT 2/2: GOOD Gary Simons makes 2/2 from the line.
Score: 71-80

[10:08] Team_063 possession (Score: 71-80)
Malcolm Quickley loses control! Ball rolls out of bounds! TURNOVER! (dead ball)

[10:08] Substitution (Team_068): Zion Anunoby OUT → Cole Anthony IN (stamina_rule2)

[10:08] Substitution (Team_068): Malcolm Herro OUT → Ja Banchero IN (stamina_rule2)

[10:08] Substitution (Team_068): Jaren Johnson OUT → Miles Murray IN (stamina_rule2)

[10:08] Substitution (Team_068): Gary Simons OUT → Jarrett Oladipo IN (stamina_rule2)

[10:08] Substitution (Team_068): Nikola Ginobili OUT → Franz Curry IN (stamina_rule2)

[10:08] Substitution (Team_063): Bradley Davis OUT → DeMar Banchero IN (stamina_rule2)

[10:08] Substitution (Team_063): Malcolm Quickley OUT → Cole Durant IN (stamina_rule2)

[10:08] Substitution (Team_063): Terry Reaves OUT → Jaren James IN (stamina_rule2)

[10:08] Substitution (Team_063): Dirk Reaves OUT → Lamelo Ball IN (stamina_rule2)

[10:08] Substitution (Team_063): Tyler Harris OUT → Kyle Green IN (stamina_rule2)

[09:57] Team_068 possession (Score: 71-80)
Miles Murray drives and kicks out. Miles Murray attempts a 3Pt. Wide open! DeMar Banchero is 6.1 feet away. [ZONE] Miles Murray misses. FOUL! Loose ball foul on Kyle Green during the rebound battle. [Team fouls: 4] No free throws, side out. (Kyle Green: 1 personal fouls)

[09:45] Team_068 possession (Score: 71-80)
Franz Curry loses the ball! Stripped by Kyle Green! TURNOVER! (live ball)

[09:32] Team_063 possession (Score: 71-80)
FOUL! Reach-in foul on Franz Curry during the drive. [Team fouls: 1] No free throws, side out. (Franz Curry: 1 personal fouls)

[09:17] Team_063 possession (Score: 71-80)
DeMar Banchero attempts a Midrange. Contested by Jarrett Oladipo (3.1 feet, ZONE). DEMAR BANCHERO MAKES IT!
Score: 71-82

[09:00] Team_068 possession (Score: 71-82)
FOUL! Reach-in foul on Kyle Green during the drive. [IN THE BONUS! 5 team fouls] Franz Curry to the line for 2 free throws. (Kyle Green: 2 personal fouls)   FT 1/2: MISS   FT 2/2: MISS Franz Curry makes 0/2 from the line. Rebound secured by Lamelo Ball.

[08:44] Team_063 possession (Score: 71-82)
FOUL! Offensive foul on Kyle Green! Franz Curry drew the charge! [Team fouls: 6] (Kyle Green: 3 personal fouls) TURNOVER! (dead ball)

[08:32] Team_068 possession (Score: 71-82)
Franz Curry drives, picks up Kyle Green. Help arrives from Cole Durant! Franz Curry attempts a Layup. Contested by Cole Durant (2.9 feet, MAN). Franz Curry misses. Offensive rebound by Franz Curry! Franz Curry puts it back in!
Score: 73-82

[08:19] Team_063 possession (Score: 73-82)
DeMar Banchero attempts a Layup. Contested by Franz Curry (2.6 feet, ZONE). DEMAR BANCHERO MAKES IT! Assist: Cole Durant
Score: 73-84

[08:05] Team_068 possession (Score: 73-84)
Franz Curry attempts a 3Pt. Contested by DeMar Banchero (4.2 feet, ZONE). Franz Curry misses. Rebound secured by Kyle Green.

[07:52] Team_063 possession (Score: 73-84)
DeMar Banchero commits a violation (traveling/carry)! TURNOVER! (dead ball)

[07:37] Team_068 possession (Score: 73-84)
Ja Banchero attempts a 3Pt. Contested by Cole Durant (4.9 feet, MAN). JA BANCHERO MAKES IT! Assist: Cole Anthony
Score: 76-84

[07:22] Team_063 possession (Score: 76-84)
FOUL! Holding foul on Miles Murray. [Team fouls: 2] No free throws, side out. (Miles Murray: 1 personal fouls)

[07:06] Team_063 possession (Score: 76-84)
Kyle Green throws a bad pass! Stolen by Franz Curry! TURNOVER! (live ball)

[06:47] Team_068 possession (Score: 76-84)
Miles Murray attempts a 3Pt. Contested by Lamelo Ball (4.5 feet, ZONE). MILES MURRAY MAKES IT! Assist: Jarrett Oladipo
Score: 79-84

[06:32] Team_063 possession (Score: 79-84)
Kyle Green attempts a Midrange. Contested by Franz Curry (5.4 feet, MAN). Kyle Green misses. Rebound secured by Ja Banchero.

[06:20] Team_068 possession (Score: 79-84)
FOUL! Reach-in foul on Kyle Green during the drive. [IN THE BONUS! 7 team fouls] Franz Curry to the line for 2 free throws. (Kyle Green: 4 personal fouls)   FT 1/2: GOOD   FT 2/2: GOOD Franz Curry makes 2/2 from the line.
Score: 81-84

[06:08] Team_063 possession (Score: 81-84)
Jaren James attempts a 3Pt. Wide open! Ja Banchero is 6.8 feet away. [ZONE] Jaren James misses. Rebound secured by Jarrett Oladipo.

[05:53] Team_068 possession (Score: 81-84)
Ja Banchero attempts a 3Pt. Contested by Cole Durant (3.8 feet, ZONE). Ja Banchero misses. Rebound secured by Lamelo Ball.

[05:39] Team_063 possession (Score: 81-84)
FOUL! Reach-in foul on Franz Curry during the drive. [Team fouls: 3] No free throws, side out. (Franz Curry: 2 personal fouls)

[05:21] Team_063 possession (Score: 81-84)
DeMar Banchero drives, picks up Cole Anthony. Help arrives from Miles Murray! DeMar Banchero attempts a Layup. Contested by Miles Murray (5.1 feet, MAN). DEMAR BANCHERO MAKES IT! Assist: Cole Durant
Score: 81-86

[05:03] Team_068 possession (Score: 81-86)
Miles Murray attempts a 3Pt. Contested by Jaren James (3.5 feet, MAN). Miles Murray misses. Rebound secured by Kyle Green.

[04:48] Team_063 possession (Score: 81-86)
FOUL! Holding foul on Franz Curry. [Team fouls: 4] No free throws, side out. (Franz Curry: 3 personal fouls)

[04:30] Team_063 possession (Score: 81-86)
Lamelo Ball attempts a 3Pt. Heavily contested by Ja Banchero (0.7 feet, ZONE)! Lamelo Ball misses. Rebound secured by Franz Curry.

[04:19] Team_068 possession (Score: 81-86)
Ja Banchero attempts a 3Pt. Contested by DeMar Banchero (3.1 feet, ZONE). Ja Banchero misses. Rebound secured by Lamelo Ball.

[04:07] Team_063 possession (Score: 81-86)
FOUL! Shooting foul on Ja Banchero. Lamelo Ball to the line for 2 free throws. [BONUS: 5 team fouls] (Ja Banchero: 1 personal fouls)   FT 1/2: GOOD   FT 2/2: MISS Lamelo Ball makes 1/2 from the line. Offensive rebound by Lamelo Ball! Lamelo Ball kicks it out.
Score: 81-87

[03:50] Team_063 possession (Score: 81-87)
Kyle Green attempts a 3Pt. Contested by Ja Banchero (5.5 feet, ZONE). Kyle Green misses. Rebound secured by Franz Curry.

[03:35] Team_068 possession (Score: 81-87)
Ja Banchero attempts a 3Pt. Heavily contested by Cole Durant (1.0 feet, MAN)! Ja Banchero misses. Rebound secured by Kyle Green.

[03:21] Team_063 possession (Score: 81-87)
Cole Durant drives to the basket... FOUL! Offensive foul on Cole Durant! Ja Banchero drew the charge! [Team fouls: 8] (Cole Durant: 1 personal fouls) TURNOVER! (dead ball)

[03:09] Team_068 possession (Score: 81-87)
Jarrett Oladipo drives, Lamelo Ball stays with him. Jarrett Oladipo attempts a Dunk. Contested by Lamelo Ball (2.9 feet, MAN). Jarrett Oladipo misses. Rebound secured by Cole Durant.

[02:57] Team_063 possession (Score: 81-87)
Lamelo Ball makes the Dunk and draws the foul on Jarrett Oladipo! And-1! Lamelo Ball to the line for 1. [BONUS: 6 team fouls] (Jarrett Oladipo: 1 personal fouls)   FT 1/1: GOOD Lamelo Ball makes 1/1 from the line.
Score: 81-90

[02:48] Team_068 possession (Score: 81-90)
Cole Anthony attempts a Layup. BLOCKED BY DEMAR BANCHERO! Ball is loose! Rebound secured by Cole Durant.

[02:32] Team_063 possession (Score: 81-90)
DeMar Banchero attempts a Midrange. Wide open! Cole Anthony is 6.9 feet away. [MAN] DeMar Banchero misses. Rebound secured by Jarrett Oladipo.

[02:17] Team_068 possession (Score: 81-90)
Franz Curry drives, Kyle Green stays with him. Franz Curry attempts a Dunk. Contested by Kyle Green (4.8 feet, MAN). FRANZ CURRY MAKES IT!
Score: 83-90

[02:03] Team_063 possession (Score: 83-90)
FOUL! Shooting foul on Franz Curry. Kyle Green to the line for 2 free throws. [BONUS: 7 team fouls] (Franz Curry: 4 personal fouls)   FT 1/2: GOOD   FT 2/2: GOOD Kyle Green makes 2/2 from the line.
Score: 83-92

[01:50] Team_068 possession (Score: 83-92)
Ja Banchero attempts a Layup. Contested by Cole Durant (4.4 feet, MAN). JA BANCHERO MAKES IT! Assist: Cole Anthony
Score: 85-92

[01:36] Team_063 possession (Score: 85-92)
Kyle Green attempts a Midrange. Contested by Franz Curry (3.2 feet, MAN). Kyle Green misses. Rebound secured by Franz Curry.

[01:20] Team_068 possession (Score: 85-92)
FOUL! Shooting foul on DeMar Banchero. Ja Banchero to the line for 3 free throws. [BONUS: 9 team fouls] (DeMar Banchero: 1 personal fouls)   FT 1/3: GOOD   FT 2/3: GOOD   FT 3/3: GOOD Ja Banchero makes 3/3 from the line.
Score: 88-92

[01:04] Team_063 possession (Score: 88-92)
DeMar Banchero attempts a 3Pt. Contested by Cole Anthony (4.0 feet, MAN). DeMar Banchero misses. Rebound secured by Jarrett Oladipo.

[00:51] Team_068 possession (Score: 88-92)
Jarrett Oladipo drives, picks up Kyle Green. Help arrives from Cole Durant! Jarrett Oladipo attempts a Dunk. Contested by Cole Durant (5.3 feet, ZONE). JARRETT OLADIPO MAKES IT!
Score: 90-92

[00:36] Team_063 possession (Score: 90-92)
Kyle Green throws a bad pass out of bounds! TURNOVER! (dead ball)

[00:22] Team_068 possession (Score: 90-92)
FOUL! Shooting foul on DeMar Banchero. Ja Banchero to the line for 3 free throws. [BONUS: 10 team fouls] (DeMar Banchero: 2 personal fouls)   FT 1/3: GOOD   FT 2/3: GOOD   FT 3/3: MISS Ja Banchero makes 2/3 from the line. Offensive rebound by Franz Curry! Franz Curry puts it back in!
Score: 94-92

[00:07] Team_063 possession (Score: 94-92)
Cole Durant attempts a 3Pt. Wide open! Miles Murray is 7.2 feet away. [ZONE] Cole Durant misses. Rebound secured by Franz Curry.

================================================================================
                              4TH QUARTER COMPLETE                              
================================================================================

4TH QUARTER SCORE: Team_068 25, Team_063 14

BOX SCORE:
================================================================================

Team_068
--------------------------------------------------------------------------------
Player                MIN  PTS  REB  AST  TO      FG   FG%      3P   3P%
--------------------------------------------------------------------------------
Franz Curry            11   10    6    0   0   4/6    66.7     0/0   0.0
Ja Banchero            11    8    1    0   0   3/6    50.0     0/0   0.0
Miles Murray           11    3    0    0   0   1/2    50.0     0/0   0.0
Gary Simons            37    2    0    0   0   1/2    50.0     0/0   0.0
Jarrett Oladipo        11    2    3    1   0   1/2    50.0     0/0   0.0
Zion Anunoby           37    0    0    0   0   0/1     0.0     0/0   0.0
Nikola Ginobili        37    0    1    0   0   0/1     0.0     0/0   0.0
Cole Anthony           11    0    0    2   0   0/1     0.0     0/0   0.0

TEAM: FG: 10/21 (47.6%), 3PT: 4/11 (36.4%), REB: 11 (2 off, 9 def), AST: 3, TO: 1
TEAM FOULS: 7 [Team_063 in BONUS]


Team_063
--------------------------------------------------------------------------------
Player                MIN  PTS  REB  AST  TO      FG   FG%      3P   3P%
--------------------------------------------------------------------------------
DeMar Banchero         11    6    0    0   0   3/5    60.0     0/0   0.0
Lamelo Ball            11    3    4    0   0   1/2    50.0     0/0   0.0
Tyler Harris           37    2    0    0   0   1/1   100.0     0/0   0.0
Kyle Green             11    2    3    0   0   1/4    25.0     0/0   0.0
Malcolm Quickley       37    0    2    0   0   0/0     0.0     0/0   0.0
Bradley Davis          37    0    0    1   0   0/1     0.0     0/0   0.0
Dirk Reaves            37    0    1    0   0   0/0     0.0     0/0   0.0
Cole Durant            11    0    2    2   0   0/1     0.0     0/0   0.0
Jaren James            11    0    0    0   0   0/1     0.0     0/0   0.0

TEAM: FG: 6/15 (40.0%), 3PT: 0/5 (0.0%), REB: 12 (1 off, 11 def), AST: 3, TO: 7
TEAM FOULS: 10 [Team_068 in BONUS]

================================================================================

================================================================================
                               FULL GAME COMPLETE                               
================================================================================

FINAL SCORE: Team_068 94, Team_063 92

SCORING BY QUARTER:
--------------------------------------------------------------------------------
Team                     Q1     Q2     Q3     Q4    FINAL
--------------------------------------------------------------------------------
Team_068                 20     19     30     25       94
Team_063                 30     18     30     14       92
--------------------------------------------------------------------------------

FULL GAME BOX SCORE:
================================================================================

Team_068
--------------------------------------------------------------------------------
Player                MIN  PTS  REB  AST  TO      FG   FG%      3P   3P%      FT STL BLK
--------------------------------------------------------------------------------
Zion Anunoby           37   17    0    1   1   8/15   53.3   1/4    25.0   1/2     0   1
Malcolm Herro          37    4    0    3   2   5/12   41.7   2/6    33.3   0/0     0   1
Jaren Johnson          37    7   14    2   3   3/12   25.0   1/4    25.0   2/2     1   2
Gary Simons            37   12    8    5   2   7/13   53.8   0/1     0.0   6/6     1   2
Nikola Ginobili        37   24   15    3   0   7/10   70.0   0/0     0.0   4/6     2   0
Cole Anthony           11    0    0    3   0   0/2     0.0   0/0     0.0   0/0     0   0
Ja Banchero            11    8    1    0   0   4/7    57.1   3/6    50.0   5/6     0   0
Miles Murray           11    3    0    0   0   1/2    50.0   1/2    50.0   1/2     0   0
Jarrett Oladipo        11    2    4    1   0   1/2    50.0   0/0     0.0   0/0     0   0
Franz Curry            11   12    7    0   1   4/6    66.7   0/1     0.0   2/4     1   0

TEAM: FG: 40/81 (49.4%), 3PT: 8/24 (33.3%), REB: 48 (15 off, 33 def), AST: 18, TO: 9


Team_063
--------------------------------------------------------------------------------
Player                MIN  PTS  REB  AST  TO      FG   FG%      3P   3P%      FT STL BLK
--------------------------------------------------------------------------------
Bradley Davis          37    8    0    5   1   2/7    28.6   1/3    33.3   0/0     0   0
Malcolm Quickley       37   14   13    3   2   6/8    75.0   4/6    66.7   0/0     1   1
Terry Reaves           37   10    0    0   1   3/13   23.1   1/7    14.3   1/1     0   1
Dirk Reaves            37   18   14    5   4   8/12   66.7   1/2    50.0   2/3     0   0
Tyler Harris           37   28   11    4   1  12/19   63.2   2/3    66.7   2/2     0   1
DeMar Banchero         11    6    0    0   1   3/5    60.0   0/1     0.0   0/0     0   1
Cole Durant            11    0    2    2   1   0/1     0.0   0/1     0.0   0/0     0   0
Jaren James            11    0    0    0   0   0/1     0.0   0/1     0.0   0/0     0   0
Lamelo Ball            11    5    4    0   0   2/3    66.7   0/1     0.0   2/3     0   0
Kyle Green             11    2    4    1   3   1/4    25.0   0/1     0.0   2/2     1   0

TEAM: FG: 37/73 (50.7%), 3PT: 9/26 (34.6%), REB: 47 (9 off, 38 def), AST: 20, TO: 14

================================================================================
