================================================================================
                        FULL GAME - Team_081 vs Team_020                        
================================================================================

================================================================================
                       1ST QUARTER - Team_081 vs Team_020                       
================================================================================

[12:00] Team_081 possession (Score: 0-0)
Bradley Leonard drives to the basket... Bradley Leonard loses control! Ball rolls out of bounds! TURNOVER! (dead ball)

[11:43] Team_020 possession (Score: 0-0)
Bam Leonard attempts a 3Pt. Contested by Bradley Sabonis (5.6 feet, MAN). BAM LEONARD MAKES IT! Assist: Jarrett McCollum
Score: 0-3

[11:31] Team_081 possession (Score: 0-3)
Julius Durant attempts a 3Pt. Contested by Bam Leonard (5.6 feet, ZONE). Julius Durant misses. Rebound secured by Trae Curry.

[11:15] Team_020 possession (Score: 0-3)
Bam Leonard attempts a Layup. Wide open! Franz Antetokounmpo is 6.3 feet away. [ZONE] Bam Leonard misses. Offensive rebound by Trae Curry! Trae Curry's putback is no good. Offensive rebound by Trae Curry! Trae Curry kicks it out.

[10:59] Team_020 possession (Score: 0-3)
Jarrett McCollum attempts a 3Pt. Contested by Julius Durant (5.5 feet, MAN). Jarrett McCollum misses. Rebound secured by Vince Adebayo.

[10:47] Team_081 possession (Score: 0-3)
Bradley Sabonis attempts a Midrange. Contested by Terry Simons (4.3 feet, ZONE). BRADLEY SABONIS MAKES IT! Assist: Franz Antetokounmpo
Score: 2-3

[10:33] Team_020 possession (Score: 2-3)
Jarrett McCollum drives to the basket... Jarrett McCollum throws a bad pass! Stolen by Franz Antetokounmpo! TURNOVER! (live ball)

[10:20] Team_081 possession (Score: 2-3)
Julius Durant attempts a 3Pt. Contested by Jarrett McCollum (3.4 feet, MAN). Julius Durant misses. Rebound secured by Trae Curry.

[10:03] Team_020 possession (Score: 2-3)
Bam Leonard drives, Bradley Sabonis stays with him. Bam Leonard attempts a Dunk. Contested by Bradley Sabonis (3.1 feet, MAN). Bam Leonard misses. Rebound secured by Franz Antetokounmpo.

[09:49] Team_081 possession (Score: 2-3)
Julius Durant drives and kicks out. Julius Durant attempts a 3Pt. Heavily contested by Bam Leonard (0.5 feet, ZONE)! Julius Durant misses. Rebound secured by Trae Curry.

[09:38] Team_020 possession (Score: 2-3)
Terry Simons drives, Vince Adebayo stays with him. Terry Simons attempts a Dunk. Contested by Vince Adebayo (3.1 feet, MAN). TERRY SIMONS MAKES IT! Assist: Trae Curry
Score: 2-5

[09:28] Team_081 possession (Score: 2-5)
Vince Adebayo attempts a Layup. BLOCKED BY TRAE CURRY! Ball is loose! Rebound secured by Bam Leonard.

[09:17] Team_020 possession (Score: 2-5)
Terry Simons attempts a 3Pt. Contested by Vince Adebayo (4.6 feet, ZONE). Terry Simons misses. Rebound secured by Vince Adebayo.

[09:03] Team_081 possession (Score: 2-5)
Vince Adebayo drives to the basket... Vince Adebayo loses control! Ball rolls out of bounds! TURNOVER! (dead ball)

[08:48] Team_020 possession (Score: 2-5)
FOUL! Shooting foul on Franz Antetokounmpo. Bam Leonard to the line for 2 free throws. [Team fouls: 2] (Franz Antetokounmpo: 1 personal fouls)   FT 1/2: GOOD   FT 2/2: MISS Bam Leonard makes 1/2 from the line. Rebound secured by Franz Antetokounmpo.
Score: 2-6

[08:31] Team_081 possession (Score: 2-6)
Franz Antetokounmpo drives to the basket... Franz Antetokounmpo throws a bad pass! Stolen by Trae Curry! TURNOVER! (live ball)

[08:18] Team_020 possession (Score: 2-6)
James Cunningham attempts a 3Pt. Contested by Bradley Leonard (3.0 feet, MAN). James Cunningham misses. Rebound secured by Franz Antetokounmpo.

[07:59] Team_081 possession (Score: 2-6)
Bradley Leonard drives to the basket... Bradley Leonard throws a bad pass! Stolen by Trae Curry! TURNOVER! (live ball)

[07:45] Team_020 possession (Score: 2-6)
Trae Curry drives and kicks out. Jarrett McCollum attempts a Midrange. Contested by Julius Durant (2.9 feet, MAN). JARRETT MCCOLLUM MAKES IT!
Score: 2-8

[07:30] Team_081 possession (Score: 2-8)
Franz Antetokounmpo drives to the basket... Franz Antetokounmpo throws a bad pass! Stolen by Bam Leonard! TURNOVER! (live ball)

[07:18] Team_020 possession (Score: 2-8)
Terry Simons attempts a Layup. Contested by Franz Antetokounmpo (5.0 feet, ZONE). TERRY SIMONS MAKES IT! Assist: James Cunningham
Score: 2-10

[07:02] Team_081 possession (Score: 2-10)
Franz Antetokounmpo drives, Bam Leonard stays with him. Franz Antetokounmpo attempts a Dunk. Heavily contested by Bam Leonard (1.2 feet, MAN)! FRANZ ANTETOKOUNMPO MAKES IT!
Score: 4-10

[06:48] Team_020 possession (Score: 4-10)
Bam Leonard attempts a Layup. Wide open! Bradley Sabonis is 7.9 feet away. [MAN] Bam Leonard misses. Rebound secured by Vince Adebayo.

[06:34] Team_081 possession (Score: 4-10)
Bradley Leonard attempts a 3Pt. Contested by Bam Leonard (2.0 feet, ZONE). Bradley Leonard misses. Rebound secured by Bam Leonard.

[06:23] Team_020 possession (Score: 4-10)
James Cunningham loses control! Ball rolls out of bounds! TURNOVER! (dead ball)

[06:13] Team_081 possession (Score: 4-10)
Vince Adebayo attempts a 3Pt. Contested by Terry Simons (4.3 feet, MAN). VINCE ADEBAYO MAKES IT! Assist: Bradley Sabonis
Score: 7-10

[05:59] Team_020 possession (Score: 7-10)
FOUL! Reach-in foul on Vince Adebayo during the drive. [Team fouls: 3] No free throws, side out. (Vince Adebayo: 1 personal fouls)

[05:40] Team_020 possession (Score: 7-10)
Bam Leonard drives, picks up Franz Antetokounmpo. Help arrives from Bradley Leonard! Bam Leonard attempts a Layup. Heavily contested by Bradley Leonard (1.5 feet, ZONE)! Bam Leonard misses. Rebound secured by Bradley Sabonis.

[05:27] Team_081 possession (Score: 7-10)
Bradley Leonard attempts a 3Pt. Heavily contested by James Cunningham (1.0 feet, MAN)! BRADLEY LEONARD MAKES IT! Assist: Bradley Sabonis
Score: 10-10

[05:11] Team_020 possession (Score: 10-10)
Jarrett McCollum attempts a Layup. Contested by Julius Durant (5.5 feet, MAN). JARRETT MCCOLLUM MAKES IT! Assist: Bam Leonard
Score: 10-12

[04:56] Team_081 possession (Score: 10-12)
Vince Adebayo attempts a 3Pt. Contested by Bam Leonard (2.3 feet, ZONE). Vince Adebayo misses. Offensive rebound by Franz Antetokounmpo! Franz Antetokounmpo puts it back in!
Score: 12-12

[04:42] Team_020 possession (Score: 12-12)
Trae Curry attempts a Midrange. Contested by Franz Antetokounmpo (5.1 feet, ZONE). TRAE CURRY MAKES IT! Assist: Terry Simons
Score: 12-14

[04:29] Team_081 possession (Score: 12-14)
Bradley Sabonis drives and kicks out. Bradley Sabonis attempts a 3Pt. Contested by Bam Leonard (4.2 feet, MAN). Bradley Sabonis misses. Rebound secured by Trae Curry.

[04:20] Team_020 possession (Score: 12-14)
James Cunningham attempts a Layup. Wide open! Franz Antetokounmpo is 8.9 feet away. [ZONE] JAMES CUNNINGHAM MAKES IT! Assist: Terry Simons
Score: 12-16

[04:03] Team_081 possession (Score: 12-16)
Bradley Sabonis attempts a 3Pt. Heavily contested by Bam Leonard (1.0 feet, ZONE)! Bradley Sabonis misses. Rebound secured by Terry Simons.

[03:51] Team_020 possession (Score: 12-16)
Trae Curry attempts a Midrange. Wide open! Franz Antetokounmpo is 7.3 feet away. [MAN] Trae Curry misses. Rebound secured by Vince Adebayo.

[03:32] Team_081 possession (Score: 12-16)
FOUL! Shooting foul on Terry Simons. Vince Adebayo to the line for 2 free throws. [Team fouls: 1] (Terry Simons: 1 personal fouls)   FT 1/2: GOOD   FT 2/2: GOOD Vince Adebayo makes 2/2 from the line.
Score: 14-16

[03:21] Team_020 possession (Score: 14-16)
Bam Leonard attempts a Midrange. Wide open! Bradley Sabonis is 7.2 feet away. [MAN] BAM LEONARD MAKES IT! Assist: James Cunningham
Score: 14-18

[03:10] Team_081 possession (Score: 14-18)
Bradley Sabonis attempts a Midrange. Heavily contested by Bam Leonard (0.5 feet, MAN)! Bradley Sabonis misses. Rebound secured by Bam Leonard.

[02:54] Team_020 possession (Score: 14-18)
Trae Curry drives and kicks out. Jarrett McCollum attempts a 3Pt. Contested by Bradley Leonard (4.5 feet, ZONE). Jarrett McCollum misses. Offensive rebound by Trae Curry! Trae Curry puts it back in!
Score: 14-20

[02:37] Team_081 possession (Score: 14-20)
Bradley Sabonis makes the Layup and draws the foul on Bam Leonard! And-1! Bradley Sabonis to the line for 1. [Team fouls: 2] (Bam Leonard: 1 personal fouls)   FT 1/1: GOOD Bradley Sabonis makes 1/1 from the line.
Score: 17-20

[02:19] Team_020 possession (Score: 17-20)
Bam Leonard drives and kicks out. Terry Simons attempts a Midrange. Wide open! Bradley Leonard is 6.6 feet away. [ZONE] Terry Simons misses. Rebound secured by Vince Adebayo.

[02:07] Team_081 possession (Score: 17-20)
Bradley Leonard loses control! Ball rolls out of bounds! TURNOVER! (dead ball)

[02:07] Substitution (Team_081): Julius Durant OUT → Dejounte Bane IN (stamina_rule2)

[02:07] Substitution (Team_081): Bradley Leonard OUT → Lamelo Wade IN (stamina_rule2)

[02:07] Substitution (Team_081): Vince Adebayo OUT → Larry Adebayo IN (stamina_rule2)

[02:07] Substitution (Team_081): Bradley Sabonis OUT → Chris Holiday IN (stamina_rule2)

[02:07] Substitution (Team_081): Franz Antetokounmpo OUT → D'Angelo Markkanen IN (stamina_rule2)

[02:07] Substitution (Team_020): Jarrett McCollum OUT → Franz Doncic IN (stamina_rule2)

[02:07] Substitution (Team_020): James Cunningham OUT → Stephen Parker IN (stamina_rule2)

[02:07] Substitution (Team_020): Terry Simons OUT → Victor Holiday IN (stamina_rule2)

[02:07] Substitution (Team_020): Bam Leonard OUT → Cole Barnes IN (stamina_rule2)

[02:07] Substitution (Team_020): Trae Curry OUT → Miles Siakam IN (stamina_rule2)

[01:52] Team_020 possession (Score: 17-20)
Cole Barnes throws a bad pass! Stolen by Chris Holiday! TURNOVER! (live ball)

[01:36] Team_081 possession (Score: 17-20)
Larry Adebayo makes the Midrange and draws the foul on Miles Siakam! And-1! Larry Adebayo to the line for 1. [Team fouls: 3] (Miles Siakam: 1 personal fouls)   FT 1/1: GOOD Larry Adebayo makes 1/1 from the line.
Score: 20-20

[01:22] Team_020 possession (Score: 20-20)
Stephen Parker drives, Lamelo Wade stays with him. Stephen Parker attempts a Layup. Contested by Lamelo Wade (3.9 feet, MAN). STEPHEN PARKER MAKES IT!
Score: 20-22

[01:07] Team_081 possession (Score: 20-22)
FOUL! Shooting foul on Stephen Parker. D'Angelo Markkanen to the line for 2 free throws. [Team fouls: 4] (Stephen Parker: 1 personal fouls)   FT 1/2: MISS   FT 2/2: GOOD D'Angelo Markkanen makes 1/2 from the line.
Score: 21-22

[00:49] Team_020 possession (Score: 21-22)
FOUL! Holding foul on Dejounte Bane. [Team fouls: 4] No free throws, side out. (Dejounte Bane: 1 personal fouls)

[00:35] Team_020 possession (Score: 21-22)
Victor Holiday makes the Dunk and draws the foul on Chris Holiday! And-1! Victor Holiday to the line for 1. [BONUS: 5 team fouls] (Chris Holiday: 1 personal fouls)   FT 1/1: GOOD Victor Holiday makes 1/1 from the line.
Score: 21-25

[00:23] Team_081 possession (Score: 21-25)
Chris Holiday drives, picks up Miles Siakam. Help arrives from Franz Doncic! Chris Holiday attempts a Layup. Contested by Franz Doncic (5.2 feet, ZONE). Chris Holiday misses. Rebound secured by Cole Barnes.

[00:08] Team_020 possession (Score: 21-25)
Miles Siakam drives, picks up Chris Holiday. Help arrives from Lamelo Wade! Miles Siakam attempts a Layup. Contested by Lamelo Wade (5.7 feet, MAN). Miles Siakam misses. Rebound secured by Lamelo Wade.

================================================================================
                              1ST QUARTER COMPLETE                              
================================================================================

1ST QUARTER SCORE: Team_081 21, Team_020 25

BOX SCORE:
================================================================================

Team_081
--------------------------------------------------------------------------------
Player                MIN  PTS  REB  AST  TO      FG   FG%      3P   3P%
--------------------------------------------------------------------------------
Vince Adebayo          10    5    5    0   0   2/3    66.7     0/0   0.0
Bradley Sabonis        10    5    1    2   0   2/5    40.0     0/0   0.0
Franz Antetokounmpo    10    4    4    1   0   2/2   100.0     0/0   0.0
Bradley Leonard        10    3    0    0   0   1/2    50.0     0/0   0.0
Larry Adebayo           2    3    0    0   0   1/1   100.0     0/0   0.0
D'Angelo Markkanen      2    1    0    0   0   1/1   100.0     0/0   0.0
Julius Durant          10    0    0    0   0   0/3     0.0     0/0   0.0
Chris Holiday           2    0    0    0   0   0/1     0.0     0/0   0.0
Lamelo Wade             2    0    1    0   0   0/0     0.0     0/0   0.0

TEAM: FG: 9/18 (50.0%), 3PT: 3/7 (42.9%), REB: 11 (1 off, 10 def), AST: 3, TO: 6
TEAM FOULS: 5 [Team_020 in BONUS]


Team_020
--------------------------------------------------------------------------------
Player                MIN  PTS  REB  AST  TO      FG   FG%      3P   3P%
--------------------------------------------------------------------------------
Bam Leonard            10    5    3    1   0   2/7    28.6     0/0   0.0
Jarrett McCollum       10    4    0    1   0   2/3    66.7     0/0   0.0
Trae Curry             10    4    6    1   0   2/3    66.7     0/0   0.0
Terry Simons           10    4    1    2   0   2/3    66.7     0/0   0.0
Victor Holiday          2    3    0    0   0   1/1   100.0     0/0   0.0
James Cunningham       10    2    0    2   0   1/2    50.0     0/0   0.0
Stephen Parker          2    2    0    0   0   1/1   100.0     0/0   0.0
Cole Barnes             2    0    1    0   0   0/0     0.0     0/0   0.0
Miles Siakam            2    0    0    0   0   0/1     0.0     0/0   0.0

TEAM: FG: 11/21 (52.4%), 3PT: 1/4 (25.0%), REB: 11 (2 off, 9 def), AST: 7, TO: 3
TEAM FOULS: 4

================================================================================

================================================================================
                       2ND QUARTER - Team_081 vs Team_020                       
================================================================================

[12:00] Team_081 possession (Score: 21-25)
Vince Adebayo attempts a Midrange. Wide open! Terry Simons is 6.3 feet away. [MAN] VINCE ADEBAYO MAKES IT! Assist: Julius Durant
Score: 23-25

[11:46] Team_020 possession (Score: 23-25)
James Cunningham drives, picks up Bradley Leonard. Help arrives from Vince Adebayo! James Cunningham attempts a Layup. Wide open! Vince Adebayo is 6.7 feet away. [MAN] JAMES CUNNINGHAM MAKES IT!
Score: 23-27

[11:32] Team_081 possession (Score: 23-27)
Bradley Sabonis attempts a 3Pt. Heavily contested by Bam Leonard (1.0 feet, MAN)! Bradley Sabonis misses. Rebound secured by Trae Curry.

[11:17] Team_020 possession (Score: 23-27)
Trae Curry attempts a 3Pt. Contested by Bradley Leonard (2.8 feet, ZONE). Trae Curry misses. Offensive rebound by Trae Curry! Trae Curry puts it back in!
Score: 23-29

[11:05] Team_081 possession (Score: 23-29)
Julius Durant attempts a 3Pt. Wide open! Jarrett McCollum is 6.4 feet away. [MAN] Julius Durant misses. Rebound secured by Terry Simons.

[10:46] Team_020 possession (Score: 23-29)
FOUL! Offensive foul on James Cunningham! Bradley Leonard drew the charge! [Team fouls: 1] (James Cunningham: 1 personal fouls) TURNOVER! (dead ball)

[10:33] Team_081 possession (Score: 23-29)
Franz Antetokounmpo drives, Bam Leonard stays with him. Franz Antetokounmpo attempts a Layup. Contested by Bam Leonard (4.2 feet, MAN). Franz Antetokounmpo misses. Rebound secured by Trae Curry.

[10:23] Team_020 possession (Score: 23-29)
Terry Simons attempts a 3Pt. Contested by Bradley Leonard (3.7 feet, ZONE). Terry Simons misses. Rebound secured by Franz Antetokounmpo.

[10:04] Team_081 possession (Score: 23-29)
Bradley Sabonis drives to the basket... Bradley Sabonis loses the ball! Stripped by Bam Leonard! TURNOVER! (live ball)

[09:52] Team_020 possession (Score: 23-29)
James Cunningham attempts a Midrange. Contested by Bradley Leonard (2.9 feet, MAN). James Cunningham misses. Offensive rebound by Bam Leonard! Bam Leonard puts it back in!
Score: 23-31

[09:37] Team_081 possession (Score: 23-31)
Bradley Leonard attempts a 3Pt. Contested by James Cunningham (2.5 feet, ZONE). BRADLEY LEONARD MAKES IT! Assist: Vince Adebayo
Score: 26-31

[09:24] Team_020 possession (Score: 26-31)
Bam Leonard attempts a Midrange. Contested by Bradley Sabonis (4.2 feet, MAN). BAM LEONARD MAKES IT!
Score: 26-33

[09:09] Team_081 possession (Score: 26-33)
Julius Durant attempts a Midrange. Contested by Jarrett McCollum (5.2 feet, MAN). JULIUS DURANT MAKES IT! Assist: Vince Adebayo
Score: 28-33

[08:55] Team_020 possession (Score: 28-33)
James Cunningham attempts a Midrange. Heavily contested by Vince Adebayo (0.5 feet, ZONE)! James Cunningham misses. Rebound secured by Vince Adebayo.

[08:41] Team_081 possession (Score: 28-33)
Bradley Sabonis drives and kicks out. Julius Durant attempts a Midrange. Contested by Terry Simons (3.8 feet, ZONE). Julius Durant misses. Rebound secured by Terry Simons.

[08:27] Team_020 possession (Score: 28-33)
Terry Simons drives, Vince Adebayo stays with him. Terry Simons attempts a Dunk. Contested by Vince Adebayo (3.9 feet, MAN). TERRY SIMONS MAKES IT! Assist: Jarrett McCollum
Score: 28-35

[08:10] Team_081 possession (Score: 28-35)
Bradley Sabonis attempts a Layup. Contested by Trae Curry (4.3 feet, ZONE). BRADLEY SABONIS MAKES IT! Assist: Franz Antetokounmpo
Score: 30-35

[07:55] Team_020 possession (Score: 30-35)
James Cunningham loses control! Ball rolls out of bounds! TURNOVER! (dead ball)

[07:55] Substitution (Team_081): Julius Durant OUT → Dejounte Bane IN (stamina_rule2)

[07:55] Substitution (Team_081): Bradley Leonard OUT → Lamelo Wade IN (stamina_rule2)

[07:55] Substitution (Team_081): Vince Adebayo OUT → Larry Adebayo IN (stamina_rule2)

[07:55] Substitution (Team_081): Bradley Sabonis OUT → Chris Holiday IN (stamina_rule2)

[07:55] Substitution (Team_081): Franz Antetokounmpo OUT → D'Angelo Markkanen IN (stamina_rule2)

[07:55] Substitution (Team_020): Jarrett McCollum OUT → Franz Doncic IN (stamina_rule2)

[07:55] Substitution (Team_020): James Cunningham OUT → Stephen Parker IN (stamina_rule2)

[07:55] Substitution (Team_020): Terry Simons OUT → Victor Holiday IN (stamina_rule2)

[07:55] Substitution (Team_020): Bam Leonard OUT → Cole Barnes IN (stamina_rule2)

[07:55] Substitution (Team_020): Trae Curry OUT → Miles Siakam IN (stamina_rule2)

[07:44] Team_081 possession (Score: 30-35)
Dejounte Bane throws a bad pass out of bounds! TURNOVER! (dead ball)

[07:30] Team_020 possession (Score: 30-35)
Franz Doncic attempts a Midrange. Heavily contested by Lamelo Wade (1.9 feet, ZONE)! Franz Doncic misses. Rebound secured by Chris Holiday.

[07:10] Team_081 possession (Score: 30-35)
Chris Holiday drives, picks up Miles Siakam. Help arrives from Franz Doncic! Chris Holiday attempts a Layup. Contested by Franz Doncic (5.8 feet, ZONE). CHRIS HOLIDAY MAKES IT! Assist: Dejounte Bane
Score: 32-35

[07:01] Team_020 possession (Score: 32-35)
Cole Barnes drives and kicks out. Victor Holiday attempts a 3Pt. Wide open! Dejounte Bane is 7.1 feet away. [ZONE] VICTOR HOLIDAY MAKES IT! Assist: Miles Siakam
Score: 32-38

[06:42] Team_081 possession (Score: 32-38)
Lamelo Wade drives, Stephen Parker stays with him. Lamelo Wade attempts a Layup. Wide open! Stephen Parker is 6.7 feet away. [MAN] Lamelo Wade misses. Rebound secured by Victor Holiday.

[06:25] Team_020 possession (Score: 32-38)
Franz Doncic drives and kicks out. Franz Doncic attempts a 3Pt. Contested by Dejounte Bane (4.5 feet, MAN). Franz Doncic misses. Rebound secured by Larry Adebayo.

[06:11] Team_081 possession (Score: 32-38)
D'Angelo Markkanen drives, picks up Miles Siakam. Help arrives from Franz Doncic! D'Angelo Markkanen attempts a Layup. Contested by Franz Doncic (2.7 feet, ZONE). D'Angelo Markkanen misses. Rebound secured by Victor Holiday.

[05:59] Team_020 possession (Score: 32-38)
Cole Barnes attempts a 3Pt. Contested by Chris Holiday (2.6 feet, MAN). Cole Barnes misses. Rebound secured by Chris Holiday.

[05:44] Team_081 possession (Score: 32-38)
Lamelo Wade attempts a Layup. Contested by Stephen Parker (4.2 feet, MAN). LAMELO WADE MAKES IT! Assist: Dejounte Bane
Score: 34-38

[05:30] Team_020 possession (Score: 34-38)
Franz Doncic attempts a Midrange. Contested by Dejounte Bane (4.0 feet, MAN). FRANZ DONCIC MAKES IT! Assist: Victor Holiday
Score: 34-40

[05:16] Team_081 possession (Score: 34-40)
Lamelo Wade attempts a Midrange. Contested by Stephen Parker (3.6 feet, MAN). LAMELO WADE MAKES IT!
Score: 36-40

[05:06] Team_020 possession (Score: 36-40)
Victor Holiday drives, Larry Adebayo stays with him. Victor Holiday attempts a Layup. Contested by Larry Adebayo (4.8 feet, MAN). VICTOR HOLIDAY MAKES IT! Assist: Miles Siakam
Score: 36-42

[04:56] Team_081 possession (Score: 36-42)
Lamelo Wade drives, picks up Stephen Parker. Help arrives from Victor Holiday! Lamelo Wade attempts a Layup. Contested by Victor Holiday (5.5 feet, MAN). LAMELO WADE MAKES IT! Assist: D'Angelo Markkanen
Score: 38-42

[04:44] Team_020 possession (Score: 38-42)
Miles Siakam attempts a 3Pt. Contested by Chris Holiday (4.5 feet, MAN). Miles Siakam misses. Rebound secured by Lamelo Wade.

[04:26] Team_081 possession (Score: 38-42)
Dejounte Bane drives to the basket... Dejounte Bane loses control! Ball rolls out of bounds! TURNOVER! (dead ball)

[04:14] Team_020 possession (Score: 38-42)
FOUL! Holding foul on Chris Holiday. [Team fouls: 1] No free throws, side out. (Chris Holiday: 1 personal fouls)

[04:00] Team_020 possession (Score: 38-42)
Stephen Parker attempts a Midrange. Contested by Lamelo Wade (5.3 feet, MAN). STEPHEN PARKER MAKES IT!
Score: 38-44

[03:48] Team_081 possession (Score: 38-44)
Larry Adebayo attempts a Midrange. Contested by Stephen Parker (2.4 feet, ZONE). LARRY ADEBAYO MAKES IT! Assist: Lamelo Wade
Score: 40-44

[03:38] Team_020 possession (Score: 40-44)
Franz Doncic attempts a 3Pt. Contested by Chris Holiday (4.7 feet, ZONE). FRANZ DONCIC MAKES IT! Assist: Victor Holiday
Score: 40-47

[03:25] Team_081 possession (Score: 40-47)
Larry Adebayo drives, picks up Miles Siakam. Help arrives from Franz Doncic! Larry Adebayo attempts a Dunk. Contested by Franz Doncic (4.0 feet, ZONE). Larry Adebayo misses. Rebound secured by Cole Barnes.

[03:12] Team_020 possession (Score: 40-47)
Cole Barnes attempts a Midrange. Contested by Chris Holiday (5.5 feet, ZONE). Cole Barnes misses. Rebound secured by Lamelo Wade.

[02:55] Team_081 possession (Score: 40-47)
D'Angelo Markkanen attempts a Midrange. Contested by Miles Siakam (3.2 feet, MAN). D'Angelo Markkanen misses. Rebound secured by Miles Siakam.

[02:44] Team_020 possession (Score: 40-47)
Stephen Parker drives, Lamelo Wade stays with him. Stephen Parker attempts a Dunk. Contested by Lamelo Wade (3.0 feet, MAN). STEPHEN PARKER MAKES IT!
Score: 40-49

[02:28] Team_081 possession (Score: 40-49)
Lamelo Wade attempts a Midrange. Wide open! Stephen Parker is 6.4 feet away. [MAN] Lamelo Wade misses. Rebound secured by Miles Siakam.

[02:14] Team_020 possession (Score: 40-49)
Victor Holiday drives, picks up Chris Holiday. Help arrives from Lamelo Wade! Victor Holiday attempts a Dunk. Contested by Lamelo Wade (4.8 feet, ZONE). Victor Holiday misses. Rebound secured by Larry Adebayo.

[01:55] Team_081 possession (Score: 40-49)
Larry Adebayo makes the Dunk and draws the foul on Franz Doncic! And-1! Larry Adebayo to the line for 1. [Team fouls: 2] (Franz Doncic: 1 personal fouls)   FT 1/1: MISS Larry Adebayo makes 0/1 from the line. Rebound secured by Victor Holiday.
Score: 42-49

[01:38] Team_020 possession (Score: 42-49)
Stephen Parker drives and kicks out. Stephen Parker attempts a Midrange. Contested by Lamelo Wade (5.8 feet, MAN). STEPHEN PARKER MAKES IT! Assist: Miles Siakam
Score: 42-51

[01:21] Team_081 possession (Score: 42-51)
FOUL! Shooting foul on Cole Barnes. Chris Holiday to the line for 2 free throws. [Team fouls: 3] (Cole Barnes: 1 personal fouls)   FT 1/2: GOOD   FT 2/2: GOOD Chris Holiday makes 2/2 from the line.
Score: 44-51

[01:04] Team_020 possession (Score: 44-51)
Stephen Parker drives to the basket... Stephen Parker loses the ball! Stripped by Lamelo Wade! TURNOVER! (live ball)

[00:50] Team_081 possession (Score: 44-51)
Lamelo Wade attempts a 3Pt. Wide open! Stephen Parker is 6.1 feet away. [ZONE] Lamelo Wade misses. Rebound secured by Cole Barnes.

[00:35] Team_020 possession (Score: 44-51)
Stephen Parker drives to the basket... Stephen Parker loses the ball! Stripped by Lamelo Wade! TURNOVER! (live ball)

[00:18] Team_081 possession (Score: 44-51)
FOUL! Reach-in foul on Stephen Parker during the drive. [Team fouls: 4] No free throws, side out. (Stephen Parker: 1 personal fouls)

[00:07] Team_081 possession (Score: 44-51)
Dejounte Bane attempts a Layup. Contested by Franz Doncic (3.7 feet, MAN). Dejounte Bane misses. Rebound secured by Cole Barnes.

================================================================================
                              2ND QUARTER COMPLETE                              
================================================================================

2ND QUARTER SCORE: Team_081 23, Team_020 26

BOX SCORE:
================================================================================

Team_081
--------------------------------------------------------------------------------
Player                MIN  PTS  REB  AST  TO      FG   FG%      3P   3P%
--------------------------------------------------------------------------------
Lamelo Wade            10    6    2    1   0   3/6    50.0     0/0   0.0
Chris Holiday          10    4    2    0   0   2/2   100.0     0/0   0.0
Bradley Leonard        14    3    0    0   0   1/1   100.0     0/0   0.0
Vince Adebayo          14    2    1    2   0   1/1   100.0     0/0   0.0
Julius Durant          14    2    0    1   0   1/2    50.0     0/0   0.0
Bradley Sabonis        14    2    0    0   0   1/3    33.3     0/0   0.0
Larry Adebayo          10    2    2    0   0   1/3    33.3     0/0   0.0
Franz Antetokounmpo    14    0    1    1   0   0/1     0.0     0/0   0.0
Dejounte Bane          10    0    0    2   0   0/1     0.0     0/0   0.0
D'Angelo Markkanen     10    0    0    1   0   0/2     0.0     0/0   0.0

TEAM: FG: 10/22 (45.5%), 3PT: 1/4 (25.0%), REB: 8 (0 off, 8 def), AST: 8, TO: 3
TEAM FOULS: 1


Team_020
--------------------------------------------------------------------------------
Player                MIN  PTS  REB  AST  TO      FG   FG%      3P   3P%
--------------------------------------------------------------------------------
Stephen Parker         10    6    0    0   0   3/3   100.0     0/0   0.0
Franz Doncic           10    5    0    0   0   2/4    50.0     0/0   0.0
Victor Holiday         10    5    3    2   0   2/3    66.7     0/0   0.0
Bam Leonard            14    4    1    0   0   2/2   100.0     0/0   0.0
James Cunningham       14    2    0    0   0   1/2    50.0     0/0   0.0
Trae Curry             14    2    3    0   0   1/1   100.0     0/0   0.0
Terry Simons           14    2    2    0   0   1/2    50.0     0/0   0.0
Jarrett McCollum       14    0    0    1   0   0/0     0.0     0/0   0.0
Miles Siakam           10    0    2    3   0   0/1     0.0     0/0   0.0
Cole Barnes            10    0    3    0   0   0/2     0.0     0/0   0.0

TEAM: FG: 12/20 (60.0%), 3PT: 2/5 (40.0%), REB: 14 (2 off, 12 def), AST: 6, TO: 4
TEAM FOULS: 4

================================================================================

================================================================================
                       3RD QUARTER - Team_081 vs Team_020                       
================================================================================

[12:00] Team_081 possession (Score: 44-51)
Julius Durant attempts a Midrange. Contested by Jarrett McCollum (4.2 feet, MAN). Julius Durant misses. Offensive rebound by Franz Antetokounmpo! Franz Antetokounmpo's putback is no good. Offensive rebound by Franz Antetokounmpo! Franz Antetokounmpo kicks it out.

[11:41] Team_081 possession (Score: 44-51)
FOUL! Shooting foul on Trae Curry. Vince Adebayo to the line for 2 free throws. [Team fouls: 2] (Trae Curry: 1 personal fouls)   FT 1/2: GOOD   FT 2/2: GOOD Vince Adebayo makes 2/2 from the line.
Score: 46-51

[11:28] Team_020 possession (Score: 46-51)
Bam Leonard throws a bad pass out of bounds! TURNOVER! (dead ball)

[11:11] Team_081 possession (Score: 46-51)
Julius Durant drives to the basket... Julius Durant loses the ball! Stripped by Trae Curry! TURNOVER! (live ball)

[10:56] Team_020 possession (Score: 46-51)
James Cunningham makes the Dunk and draws the foul on Franz Antetokounmpo! And-1! James Cunningham to the line for 1. [Team fouls: 1] (Franz Antetokounmpo: 1 personal fouls)   FT 1/1: GOOD James Cunningham makes 1/1 from the line.
Score: 46-54

[10:40] Team_081 possession (Score: 46-54)
Franz Antetokounmpo attempts a Layup. Heavily contested by Bam Leonard (1.3 feet, MAN)! FRANZ ANTETOKOUNMPO MAKES IT! Assist: Vince Adebayo
Score: 48-54

[10:24] Team_020 possession (Score: 48-54)
Bam Leonard attempts a 3Pt. Wide open! Bradley Sabonis is 7.6 feet away. [MAN] Bam Leonard misses. Rebound secured by Franz Antetokounmpo.

[10:09] Team_081 possession (Score: 48-54)
Franz Antetokounmpo drives to the basket... FOUL! Offensive foul on Franz Antetokounmpo! Trae Curry drew the charge! [Team fouls: 2] (Franz Antetokounmpo: 2 personal fouls) TURNOVER! (dead ball)

[09:54] Team_020 possession (Score: 48-54)
Trae Curry drives, Franz Antetokounmpo stays with him. Trae Curry attempts a Layup. Wide open! Franz Antetokounmpo is 6.3 feet away. [MAN] TRAE CURRY MAKES IT! Assist: Jarrett McCollum
Score: 48-56

[09:43] Team_081 possession (Score: 48-56)
FOUL! Reach-in foul on Bam Leonard during the drive. [Team fouls: 3] No free throws, side out. (Bam Leonard: 2 personal fouls)

[09:29] Team_081 possession (Score: 48-56)
Franz Antetokounmpo drives to the basket... Franz Antetokounmpo throws a bad pass out of bounds! TURNOVER! (dead ball)

[09:15] Team_020 possession (Score: 48-56)
Bam Leonard drives to the basket... Bam Leonard loses the ball! Stripped by Franz Antetokounmpo! TURNOVER! (live ball)

[08:58] Team_081 possession (Score: 48-56)
Bradley Sabonis attempts a Midrange. Contested by Bam Leonard (2.0 feet, MAN). Bradley Sabonis misses. Offensive rebound by Franz Antetokounmpo! Franz Antetokounmpo puts it back in!
Score: 50-56

[08:40] Team_020 possession (Score: 50-56)
FOUL! Offensive foul on Bam Leonard! Bradley Sabonis drew the charge! [Team fouls: 4] (Bam Leonard: 3 personal fouls) TURNOVER! (dead ball)

[08:28] Team_081 possession (Score: 50-56)
Franz Antetokounmpo makes the Layup and draws the foul on Bam Leonard! And-1! Franz Antetokounmpo to the line for 1. [BONUS: 5 team fouls] (Bam Leonard: 4 personal fouls)   FT 1/1: GOOD Franz Antetokounmpo makes 1/1 from the line.
Score: 53-56

[08:15] Team_020 possession (Score: 53-56)
Terry Simons loses control! Ball rolls out of bounds! TURNOVER! (dead ball)

[08:02] Team_081 possession (Score: 53-56)
Vince Adebayo attempts a 3Pt. Contested by Terry Simons (2.2 feet, MAN). Vince Adebayo misses. Rebound secured by Trae Curry.

[07:50] Team_020 possession (Score: 53-56)
James Cunningham attempts a Layup. Contested by Franz Antetokounmpo (3.1 feet, ZONE). JAMES CUNNINGHAM MAKES IT!
Score: 53-58

[07:38] Team_081 possession (Score: 53-58)
FOUL! Holding foul on Bam Leonard. [IN THE BONUS! 6 team fouls] Bradley Sabonis to the line for 2 free throws. (Bam Leonard: 5 personal fouls)   FT 1/2: GOOD   FT 2/2: GOOD Bradley Sabonis makes 2/2 from the line.
Score: 55-58

[07:27] Team_020 possession (Score: 55-58)
Trae Curry attempts a Midrange. Wide open! Bradley Sabonis is 6.7 feet away. [ZONE] TRAE CURRY MAKES IT! Assist: Bam Leonard
Score: 55-60

[07:09] Team_081 possession (Score: 55-60)
Franz Antetokounmpo drives, Bam Leonard stays with him. Franz Antetokounmpo attempts a Dunk. Contested by Bam Leonard (4.2 feet, MAN). FRANZ ANTETOKOUNMPO MAKES IT! Assist: Vince Adebayo
Score: 57-60

[06:55] Team_020 possession (Score: 57-60)
Trae Curry attempts a Layup. Contested by Franz Antetokounmpo (4.0 feet, MAN). Trae Curry misses. Rebound secured by Bradley Sabonis.

[06:39] Team_081 possession (Score: 57-60)
Julius Durant attempts a Midrange. Heavily contested by Jarrett McCollum (1.3 feet, MAN)! JULIUS DURANT MAKES IT!
Score: 59-60

[06:28] Team_020 possession (Score: 59-60)
James Cunningham attempts a 3Pt. Heavily contested by Bradley Leonard (0.5 feet, MAN)! James Cunningham misses. Rebound secured by Bradley Sabonis.

[06:14] Team_081 possession (Score: 59-60)
FOUL! Shooting foul on Jarrett McCollum. Julius Durant to the line for 3 free throws. [BONUS: 7 team fouls] (Jarrett McCollum: 1 personal fouls)   FT 1/3: MISS   FT 2/3: GOOD   FT 3/3: GOOD Julius Durant makes 2/3 from the line.
Score: 61-60

[06:02] Team_020 possession (Score: 61-60)
James Cunningham attempts a 3Pt. Contested by Bradley Leonard (3.9 feet, MAN). JAMES CUNNINGHAM MAKES IT! Assist: Jarrett McCollum
Score: 61-63

[05:43] Team_081 possession (Score: 61-63)
Franz Antetokounmpo makes the Layup and draws the foul on Bam Leonard! And-1! Franz Antetokounmpo to the line for 1. [BONUS: 8 team fouls] (Bam Leonard: 6 personal fouls) Bam Leonard FOULS OUT!   FT 1/1: GOOD Franz Antetokounmpo makes 1/1 from the line.
Score: 64-63

[05:43] Substitution (Team_020): Bam Leonard OUT (stamina: 80) → Franz Doncic IN (foul_out)

[05:31] Team_020 possession (Score: 64-63)
Franz Doncic drives, Julius Durant stays with him. Franz Doncic attempts a Layup. Contested by Julius Durant (4.1 feet, MAN). FRANZ DONCIC MAKES IT!
Score: 64-65

[05:12] Team_081 possession (Score: 64-65)
Vince Adebayo drives and kicks out. Bradley Leonard makes the 3Pt and draws the foul on James Cunningham! And-1! Bradley Leonard to the line for 1. [BONUS: 9 team fouls] (James Cunningham: 1 personal fouls)   FT 1/1: GOOD Bradley Leonard makes 1/1 from the line.
Score: 68-65

[04:56] Team_020 possession (Score: 68-65)
Jarrett McCollum attempts a 3Pt. Contested by Bradley Leonard (2.3 feet, ZONE). Jarrett McCollum misses. Rebound secured by Franz Antetokounmpo.

[04:38] Team_081 possession (Score: 68-65)
Bradley Leonard drives to the basket... Bradley Leonard throws a bad pass! Stolen by Trae Curry! TURNOVER! (live ball)

[04:22] Team_020 possession (Score: 68-65)
FOUL! Reach-in foul on Vince Adebayo during the drive. [Team fouls: 3] No free throws, side out. (Vince Adebayo: 1 personal fouls)

[04:04] Team_020 possession (Score: 68-65)
James Cunningham attempts a Layup. BLOCKED BY FRANZ ANTETOKOUNMPO! Ball is loose! Rebound secured by Bradley Sabonis.

[03:50] Team_081 possession (Score: 68-65)
FOUL! Reach-in foul on Trae Curry during the drive. [IN THE BONUS! 10 team fouls] Bradley Leonard to the line for 2 free throws. (Trae Curry: 2 personal fouls)   FT 1/2: GOOD   FT 2/2: GOOD Bradley Leonard makes 2/2 from the line.
Score: 70-65

[03:32] Team_020 possession (Score: 70-65)
Terry Simons attempts a Layup. Contested by Franz Antetokounmpo (4.5 feet, ZONE). TERRY SIMONS MAKES IT! Assist: Jarrett McCollum
Score: 70-67

[03:17] Team_081 possession (Score: 70-67)
Julius Durant attempts a 3Pt. Wide open! Franz Doncic is 6.8 feet away. [ZONE] Julius Durant misses. Rebound secured by Terry Simons.

[03:02] Team_020 possession (Score: 70-67)
Franz Doncic attempts a Midrange. Wide open! Julius Durant is 6.7 feet away. [MAN] FRANZ DONCIC MAKES IT!
Score: 70-69

[02:45] Team_081 possession (Score: 70-69)
Bradley Leonard attempts a Midrange. Contested by Terry Simons (5.2 feet, ZONE). Bradley Leonard misses. Rebound secured by Trae Curry.

[02:33] Team_020 possession (Score: 70-69)
Jarrett McCollum attempts a 3Pt. Contested by Julius Durant (2.5 feet, MAN). JARRETT MCCOLLUM MAKES IT! Assist: James Cunningham
Score: 70-72

[02:16] Team_081 possession (Score: 70-72)
Vince Adebayo attempts a 3Pt. Contested by Terry Simons (4.4 feet, MAN). Vince Adebayo misses. Offensive rebound by Bradley Sabonis! Bradley Sabonis kicks it out.

[02:00] Team_081 possession (Score: 70-72)
Franz Antetokounmpo drives to the basket... FOUL! Offensive foul on Franz Antetokounmpo! Trae Curry drew the charge! [Team fouls: 4] (Franz Antetokounmpo: 3 personal fouls) TURNOVER! (dead ball)

[01:46] Team_020 possession (Score: 70-72)
Jarrett McCollum attempts a 3Pt. Contested by Julius Durant (4.5 feet, MAN). Jarrett McCollum misses. Rebound secured by Franz Antetokounmpo.

[01:33] Team_081 possession (Score: 70-72)
Vince Adebayo attempts a Midrange. Contested by Terry Simons (2.3 feet, MAN). Vince Adebayo misses. Offensive rebound by Franz Antetokounmpo! Franz Antetokounmpo's putback is no good. Rebound secured by Trae Curry.

[01:17] Team_020 possession (Score: 70-72)
FOUL! Offensive foul on Terry Simons! Vince Adebayo drew the charge! [Team fouls: 11] (Terry Simons: 1 personal fouls) TURNOVER! (dead ball)

[01:07] Team_081 possession (Score: 70-72)
Bradley Sabonis drives and kicks out. Bradley Leonard attempts a Midrange. Wide open! James Cunningham is 6.1 feet away. [MAN] Bradley Leonard misses. FOUL! Loose ball foul on Terry Simons during the rebound battle. [IN THE BONUS! 12 team fouls] Franz Antetokounmpo to the line for 2 free throws. (Terry Simons: 2 personal fouls)   FT 1/2: GOOD   FT 2/2: GOOD Franz Antetokounmpo makes 2/2 from the line.
Score: 72-72

[00:56] Team_020 possession (Score: 72-72)
Franz Doncic attempts a 3Pt. Heavily contested by Bradley Leonard (1.8 feet, ZONE)! FRANZ DONCIC MAKES IT! Assist: James Cunningham
Score: 72-75

[00:43] Team_081 possession (Score: 72-75)
Franz Antetokounmpo drives, picks up Trae Curry. Help arrives from Jarrett McCollum! Franz Antetokounmpo attempts a Dunk. Contested by Jarrett McCollum (4.8 feet, ZONE). FRANZ ANTETOKOUNMPO MAKES IT! Assist: Bradley Sabonis
Score: 74-75

[00:25] Team_020 possession (Score: 74-75)
FOUL! Shooting foul on Bradley Leonard. Franz Doncic to the line for 3 free throws. [BONUS: 5 team fouls] (Bradley Leonard: 1 personal fouls)   FT 1/3: GOOD   FT 2/3: GOOD   FT 3/3: GOOD Franz Doncic makes 3/3 from the line.
Score: 74-78

[00:08] Team_081 possession (Score: 74-78)
FOUL! Holding foul on Trae Curry. [IN THE BONUS! 13 team fouls] Franz Antetokounmpo to the line for 2 free throws. (Trae Curry: 3 personal fouls)   FT 1/2: GOOD   FT 2/2: MISS Franz Antetokounmpo makes 1/2 from the line. Rebound secured by Trae Curry.
Score: 75-78

================================================================================
                              3RD QUARTER COMPLETE                              
================================================================================

3RD QUARTER SCORE: Team_081 31, Team_020 27

BOX SCORE:
================================================================================

Team_081
--------------------------------------------------------------------------------
Player                MIN  PTS  REB  AST  TO      FG   FG%      3P   3P%
--------------------------------------------------------------------------------
Franz Antetokounmpo    26   16    5    0   0   7/7   100.0     0/0   0.0
Bradley Leonard        26    6    0    0   0   2/3    66.7     0/0   0.0
Julius Durant          26    4    0    0   0   2/3    66.7     0/0   0.0
Vince Adebayo          26    2    0    2   0   1/3    33.3     0/0   0.0
Bradley Sabonis        26    2    4    1   0   1/1   100.0     0/0   0.0

TEAM: FG: 13/18 (72.2%), 3PT: 1/3 (33.3%), REB: 10 (4 off, 6 def), AST: 3, TO: 5
TEAM FOULS: 5 [Team_020 in BONUS]


Team_020
--------------------------------------------------------------------------------
Player                MIN  PTS  REB  AST  TO      FG   FG%      3P   3P%
--------------------------------------------------------------------------------
Franz Doncic           16   10    0    0   0   4/4   100.0     0/0   0.0
James Cunningham       26    8    0    2   0   3/5    60.0     0/0   0.0
Trae Curry             26    4    4    0   0   2/3    66.7     0/0   0.0
Jarrett McCollum       26    3    0    3   0   1/3    33.3     0/0   0.0
Terry Simons           26    2    1    0   0   1/1   100.0     0/0   0.0
Bam Leonard            21    0    0    1   0   0/1     0.0     0/0   0.0

TEAM: FG: 11/17 (64.7%), 3PT: 4/8 (50.0%), REB: 4 (0 off, 4 def), AST: 6, TO: 5
TEAM FOULS: 13 [Team_081 in BONUS]

================================================================================

================================================================================
                       4TH QUARTER - Team_081 vs Team_020                       
================================================================================

[12:00] Team_081 possession (Score: 75-78)
Franz Antetokounmpo attempts a Dunk. BLOCKED BY BAM LEONARD! Ball is loose! Offensive rebound by Bradley Sabonis! Bradley Sabonis kicks it out.

[11:47] Team_081 possession (Score: 75-78)
Bradley Leonard attempts a 3Pt. Wide open! James Cunningham is 7.7 feet away. [MAN] Bradley Leonard misses. Rebound secured by Terry Simons.

[11:31] Team_020 possession (Score: 75-78)
Bam Leonard attempts a Layup. Wide open! Bradley Sabonis is 6.7 feet away. [MAN] BAM LEONARD MAKES IT!
Score: 75-80

[11:14] Team_081 possession (Score: 75-80)
Bradley Leonard attempts a 3Pt. Contested by James Cunningham (5.2 feet, ZONE). Bradley Leonard misses. Rebound secured by Trae Curry.

[11:03] Team_020 possession (Score: 75-80)
Jarrett McCollum attempts a 3Pt. Contested by Julius Durant (5.7 feet, MAN). Jarrett McCollum misses. Rebound secured by Bradley Sabonis.

[10:46] Team_081 possession (Score: 75-80)
FOUL! Holding foul on Terry Simons. [Team fouls: 1] No free throws, side out. (Terry Simons: 1 personal fouls)

[10:28] Team_081 possession (Score: 75-80)
Bradley Leonard drives and kicks out. Franz Antetokounmpo attempts a 3Pt. Contested by Bam Leonard (3.3 feet, MAN). Franz Antetokounmpo misses. FOUL! Loose ball foul on Trae Curry during the rebound battle. [Team fouls: 2] No free throws, side out. (Trae Curry: 1 personal fouls)

[10:10] Team_081 possession (Score: 75-80)
FOUL! Reach-in foul on Bam Leonard during the drive. [Team fouls: 3] No free throws, side out. (Bam Leonard: 1 personal fouls)

[09:55] Team_081 possession (Score: 75-80)
Vince Adebayo attempts a 3Pt. Contested by Bam Leonard (3.0 feet, ZONE). Vince Adebayo misses. Rebound secured by Trae Curry.

[09:41] Team_020 possession (Score: 75-80)
Trae Curry drives, picks up Franz Antetokounmpo. Help arrives from Bradley Leonard! Trae Curry attempts a Dunk. Wide open! Bradley Leonard is 6.6 feet away. [ZONE] Trae Curry misses. Rebound secured by Vince Adebayo.

[09:30] Team_081 possession (Score: 75-80)
Julius Durant attempts a Midrange. Wide open! Jarrett McCollum is 9.2 feet away. [MAN] Julius Durant misses. Offensive rebound by Bradley Sabonis! Bradley Sabonis kicks it out.

[09:14] Team_081 possession (Score: 75-80)
Vince Adebayo attempts a 3Pt. Heavily contested by Bam Leonard (1.1 feet, ZONE)! Vince Adebayo misses. Rebound secured by Trae Curry.

[08:58] Team_020 possession (Score: 75-80)
Jarrett McCollum attempts a Layup. Wide open! Julius Durant is 7.1 feet away. [MAN] Jarrett McCollum misses. Rebound secured by Bradley Sabonis.

[08:43] Team_081 possession (Score: 75-80)
Vince Adebayo attempts a 3Pt. Contested by Terry Simons (4.2 feet, MAN). Vince Adebayo misses. Rebound secured by Terry Simons.

[08:32] Team_020 possession (Score: 75-80)
FOUL! Offensive foul on James Cunningham! Bradley Leonard drew the charge! [Team fouls: 4] (James Cunningham: 1 personal fouls) TURNOVER! (dead ball)

[08:22] Team_081 possession (Score: 75-80)
Bradley Sabonis drives to the basket... FOUL! Offensive foul on Bradley Sabonis! Bam Leonard drew the charge! [Team fouls: 1] (Bradley Sabonis: 1 personal fouls) TURNOVER! (dead ball)

[08:07] Team_020 possession (Score: 75-80)
Jarrett McCollum makes the Layup and draws the foul on Bradley Sabonis! And-1! Jarrett McCollum to the line for 1. [Team fouls: 2] (Bradley Sabonis: 2 personal fouls)   FT 1/1: GOOD Jarrett McCollum makes 1/1 from the line.
Score: 75-83

[07:54] Team_081 possession (Score: 75-83)
Vince Adebayo drives, Terry Simons stays with him. Vince Adebayo attempts a Layup. Contested by Terry Simons (5.2 feet, MAN). VINCE ADEBAYO MAKES IT!
Score: 77-83

[07:41] Team_020 possession (Score: 77-83)
James Cunningham drives, Bradley Leonard stays with him. James Cunningham attempts a Layup. Wide open! Bradley Leonard is 7.7 feet away. [MAN] JAMES CUNNINGHAM MAKES IT!
Score: 77-85

[07:28] Team_081 possession (Score: 77-85)
Franz Antetokounmpo throws a bad pass out of bounds! TURNOVER! (dead ball)

[07:28] Substitution (Team_081): Julius Durant OUT → Dejounte Bane IN (stamina_rule2)

[07:28] Substitution (Team_081): Bradley Leonard OUT → Lamelo Wade IN (stamina_rule2)

[07:28] Substitution (Team_081): Vince Adebayo OUT → Larry Adebayo IN (stamina_rule2)

[07:28] Substitution (Team_081): Bradley Sabonis OUT → Chris Holiday IN (stamina_rule2)

[07:28] Substitution (Team_081): Franz Antetokounmpo OUT → D'Angelo Markkanen IN (stamina_rule2)

[07:28] Substitution (Team_020): Jarrett McCollum OUT → Franz Doncic IN (stamina_rule2)

[07:28] Substitution (Team_020): James Cunningham OUT → Stephen Parker IN (stamina_rule2)

[07:28] Substitution (Team_020): Terry Simons OUT → Victor Holiday IN (stamina_rule2)

[07:28] Substitution (Team_020): Trae Curry OUT → Miles Siakam IN (stamina_rule2)

[07:14] Team_020 possession (Score: 77-85)
FOUL! Shooting foul on Larry Adebayo. Victor Holiday to the line for 3 free throws. [Team fouls: 3] (Larry Adebayo: 1 personal fouls)   FT 1/3: GOOD   FT 2/3: GOOD   FT 3/3: GOOD Victor Holiday makes 3/3 from the line.
Score: 77-88

[07:00] Team_081 possession (Score: 77-88)
Lamelo Wade throws a bad pass! Stolen by Stephen Parker! TURNOVER! (live ball)

[06:50] Team_020 possession (Score: 77-88)
Bam Leonard attempts a Midrange. Contested by Chris Holiday (3.5 feet, MAN). Bam Leonard misses. Rebound secured by Chris Holiday.

[06:36] Team_081 possession (Score: 77-88)
Chris Holiday attempts a 3Pt. Heavily contested by Bam Leonard (0.5 feet, MAN)! CHRIS HOLIDAY MAKES IT! Assist: Lamelo Wade
Score: 80-88

[06:24] Team_020 possession (Score: 80-88)
Franz Doncic attempts a 3Pt. Contested by Chris Holiday (4.5 feet, ZONE). FRANZ DONCIC MAKES IT! Assist: Bam Leonard
Score: 80-91

[06:07] Team_081 possession (Score: 80-91)
Dejounte Bane attempts a Layup. Contested by Franz Doncic (2.8 feet, MAN). DEJOUNTE BANE MAKES IT! Assist: Lamelo Wade
Score: 82-91

[05:58] Team_020 possession (Score: 82-91)
Stephen Parker attempts a Midrange. Wide open! Lamelo Wade is 7.8 feet away. [MAN] STEPHEN PARKER MAKES IT! Assist: Bam Leonard
Score: 82-93

[05:44] Team_081 possession (Score: 82-93)
Larry Adebayo attempts a 3Pt. Contested by Victor Holiday (4.3 feet, MAN). Larry Adebayo misses. Rebound secured by Bam Leonard.

[05:33] Team_020 possession (Score: 82-93)
Franz Doncic attempts a 3Pt. Heavily contested by Chris Holiday (1.0 feet, ZONE)! Franz Doncic misses. Rebound secured by Chris Holiday.

[05:20] Team_081 possession (Score: 82-93)
D'Angelo Markkanen attempts a Layup. BLOCKED BY FRANZ DONCIC! Ball is loose! Offensive rebound by Chris Holiday! Chris Holiday kicks it out.

[05:08] Team_081 possession (Score: 82-93)
D'Angelo Markkanen attempts a Midrange. BLOCKED BY MILES SIAKAM! Ball goes out off Miles Siakam. D'Angelo Markkanen's ball!

[04:54] Team_081 possession (Score: 82-93)
FOUL! Shooting foul on Franz Doncic. Dejounte Bane to the line for 2 free throws. [BONUS: 5 team fouls] (Franz Doncic: 1 personal fouls)   FT 1/2: MISS   FT 2/2: GOOD Dejounte Bane makes 1/2 from the line.
Score: 83-93

[04:35] Team_020 possession (Score: 83-93)
FOUL! Offensive foul on Bam Leonard! Chris Holiday drew the charge! [Team fouls: 6] (Bam Leonard: 2 personal fouls) TURNOVER! (dead ball)

[04:22] Team_081 possession (Score: 83-93)
Dejounte Bane attempts a 3Pt. Contested by Stephen Parker (3.6 feet, ZONE). DEJOUNTE BANE MAKES IT! Assist: D'Angelo Markkanen
Score: 86-93

[04:09] Team_020 possession (Score: 86-93)
Miles Siakam attempts a Midrange. Contested by Larry Adebayo (4.2 feet, ZONE). Miles Siakam misses. Rebound secured by Chris Holiday.

[03:53] Team_081 possession (Score: 86-93)
FOUL! Holding foul on Victor Holiday. [IN THE BONUS! 7 team fouls] Larry Adebayo to the line for 2 free throws. (Victor Holiday: 1 personal fouls)   FT 1/2: GOOD   FT 2/2: GOOD Larry Adebayo makes 2/2 from the line.
Score: 88-93

[03:41] Team_020 possession (Score: 88-93)
Bam Leonard attempts a Layup. Contested by Chris Holiday (3.7 feet, MAN). Bam Leonard misses. Rebound secured by Larry Adebayo.

[03:28] Team_081 possession (Score: 88-93)
Chris Holiday attempts a Layup. Wide open! Miles Siakam is 8.0 feet away. [ZONE] CHRIS HOLIDAY MAKES IT!
Score: 90-93

[03:11] Team_020 possession (Score: 90-93)
Stephen Parker attempts a Midrange. Contested by Lamelo Wade (3.7 feet, MAN). STEPHEN PARKER MAKES IT!
Score: 90-95

[02:56] Team_081 possession (Score: 90-95)
Lamelo Wade attempts a Midrange. Wide open! Stephen Parker is 6.2 feet away. [MAN] Lamelo Wade misses. Offensive rebound by Lamelo Wade! Lamelo Wade kicks it out.

[02:44] Team_081 possession (Score: 90-95)
Lamelo Wade attempts a Midrange. Contested by Bam Leonard (4.7 feet, ZONE). Lamelo Wade misses. Rebound secured by Victor Holiday.

[02:28] Team_020 possession (Score: 90-95)
Miles Siakam attempts a Layup. Contested by Chris Holiday (5.7 feet, MAN). MILES SIAKAM MAKES IT! Assist: Stephen Parker
Score: 90-97

[02:13] Team_081 possession (Score: 90-97)
Chris Holiday attempts a 3Pt. Contested by Stephen Parker (3.8 feet, ZONE). Chris Holiday misses. Rebound secured by Bam Leonard.

[02:04] Team_020 possession (Score: 90-97)
Bam Leonard attempts a Midrange. Heavily contested by Lamelo Wade (1.8 feet, ZONE)! Bam Leonard misses. Rebound secured by Larry Adebayo.

[01:52] Team_081 possession (Score: 90-97)
Chris Holiday drives and kicks out. Dejounte Bane attempts a Midrange. Contested by Franz Doncic (2.6 feet, MAN). Dejounte Bane misses. Rebound secured by Bam Leonard.

[01:36] Team_020 possession (Score: 90-97)
Victor Holiday attempts a 3Pt. Contested by Chris Holiday (3.1 feet, ZONE). Victor Holiday misses. Offensive rebound by Miles Siakam! Miles Siakam kicks it out.

[01:21] Team_020 possession (Score: 90-97)
Miles Siakam attempts a Midrange. Wide open! Chris Holiday is 8.6 feet away. [MAN] Miles Siakam misses. Offensive rebound by Miles Siakam! Miles Siakam kicks it out.

[01:07] Team_020 possession (Score: 90-97)
Stephen Parker attempts a 3Pt. Wide open! Lamelo Wade is 7.2 feet away. [MAN] Stephen Parker misses. Rebound secured by Larry Adebayo.

[00:52] Team_081 possession (Score: 90-97)
FOUL! Shooting foul on Miles Siakam. D'Angelo Markkanen to the line for 2 free throws. [BONUS: 8 team fouls] (Miles Siakam: 1 personal fouls)   FT 1/2: MISS   FT 2/2: GOOD D'Angelo Markkanen makes 1/2 from the line.
Score: 91-97

[00:36] Team_020 possession (Score: 91-97)
Franz Doncic drives and kicks out. Victor Holiday attempts a 3Pt. Contested by Larry Adebayo (5.9 feet, MAN). Victor Holiday misses. Rebound secured by Chris Holiday.

[00:25] Team_081 possession (Score: 91-97)
Larry Adebayo attempts a 3Pt. Contested by Stephen Parker (5.7 feet, ZONE). Larry Adebayo misses. Rebound secured by Bam Leonard.

[00:11] Team_020 possession (Score: 91-97)
FOUL! Holding foul on Chris Holiday. [Team fouls: 4] No free throws, side out. (Chris Holiday: 1 personal fouls)

================================================================================
                              4TH QUARTER COMPLETE                              
================================================================================

4TH QUARTER SCORE: Team_081 16, Team_020 19

BOX SCORE:
================================================================================

Team_081
--------------------------------------------------------------------------------
Player                MIN  PTS  REB  AST  TO      FG   FG%      3P   3P%
--------------------------------------------------------------------------------
Dejounte Bane          17    6    0    0   0   3/3   100.0     0/0   0.0
Chris Holiday          17    5    5    0   0   2/4    50.0     0/0   0.0
Vince Adebayo          31    2    1    0   0   1/4    25.0     0/0   0.0
Larry Adebayo          17    2    3    0   0   1/3    33.3     0/0   0.0
D'Angelo Markkanen     17    1    0    1   0   1/1   100.0     0/0   0.0
Bradley Sabonis        31    0    4    0   0   0/0     0.0     0/0   0.0
Bradley Leonard        31    0    0    0   0   0/2     0.0     0/0   0.0
Franz Antetokounmpo    31    0    1    0   0   0/0     0.0     0/0   0.0
Lamelo Wade            17    0    1    2   0   0/1     0.0     0/0   0.0

TEAM: FG: 8/18 (44.4%), 3PT: 2/10 (20.0%), REB: 15 (5 off, 10 def), AST: 3, TO: 3
TEAM FOULS: 4


Team_020
--------------------------------------------------------------------------------
Player                MIN  PTS  REB  AST  TO      FG   FG%      3P   3P%
--------------------------------------------------------------------------------
Stephen Parker         17    4    0    1   0   2/3    66.7     0/0   0.0
Jarrett McCollum       31    3    0    0   0   1/3    33.3     0/0   0.0
Victor Holiday         17    3    1    0   0   1/1   100.0     0/0   0.0
Franz Doncic           23    3    0    0   0   1/3    33.3     0/0   0.0
Bam Leonard            33    2    4    2   0   1/4    25.0     0/0   0.0
James Cunningham       31    2    0    0   0   1/1   100.0     0/0   0.0
Miles Siakam           17    2    2    0   0   1/2    50.0     0/0   0.0
Terry Simons           31    0    2    0   0   0/0     0.0     0/0   0.0
Trae Curry             31    0    3    0   0   0/1     0.0     0/0   0.0

TEAM: FG: 8/18 (44.4%), 3PT: 2/5 (40.0%), REB: 12 (2 off, 10 def), AST: 3, TO: 2
TEAM FOULS: 8 [Team_081 in BONUS]

================================================================================

================================================================================
                               FULL GAME COMPLETE                               
================================================================================

FINAL SCORE: Team_081 91, Team_020 97

SCORING BY QUARTER:
--------------------------------------------------------------------------------
Team                     Q1     Q2     Q3     Q4    FINAL
--------------------------------------------------------------------------------
Team_081                 21     23     31     16       91
Team_020                 25     26     27     19       97
--------------------------------------------------------------------------------

FULL GAME BOX SCORE:
================================================================================

Team_081
--------------------------------------------------------------------------------
Player                MIN  PTS  REB  AST  TO      FG   FG%      3P   3P%      FT STL BLK
--------------------------------------------------------------------------------
Julius Durant          31    6    0    1   2   3/8    37.5   1/5    20.0   2/3     0   0
Bradley Leonard        31   12    0    0   3   3/7    42.9   2/5    40.0   3/3     0   0
Vince Adebayo          31   11    7    4   4   7/13   53.8   2/6    33.3   4/4     0   0
Bradley Sabonis        31    9    9    3   1   5/10   50.0   0/2     0.0   3/3     0   0
Franz Antetokounmpo    31   20   11    2   4   6/7    85.7   0/0     0.0   5/6     2   1
Dejounte Bane          17    6    0    2   2   3/4    75.0   1/1   100.0   1/2     0   0
Lamelo Wade            17    6    4    3   1   3/7    42.9   0/1     0.0   0/0     2   0
Larry Adebayo          17    7    5    0   0   2/6    33.3   0/2     0.0   3/4     0   0
Chris Holiday          17    9    7    0   0   4/7    57.1   1/2    50.0   2/2     1   0
D'Angelo Markkanen     17    2    0    2   0   2/4    50.0   0/0     0.0   2/4     0   0

TEAM: FG: 40/76 (52.6%), 3PT: 7/24 (29.2%), REB: 44 (10 off, 34 def), AST: 17, TO: 17


Team_020
--------------------------------------------------------------------------------
Player                MIN  PTS  REB  AST  TO      FG   FG%      3P   3P%      FT STL BLK
--------------------------------------------------------------------------------
Bam Leonard            33   11    8    4   4   4/13   30.8   1/2    50.0   1/2     2   1
Jarrett McCollum       31   10    0    5   0   3/8    37.5   1/5    20.0   1/1     0   0
James Cunningham       31   14    0    4   4   7/11   63.6   1/3    33.3   1/1     0   0
Terry Simons           31    8    6    2   2   4/6    66.7   0/2     0.0   0/0     0   0
Trae Curry             31   10   16    1   1   6/9    66.7   1/1   100.0   0/0     4   1
Franz Doncic           23   18    0    0   0   7/11   63.6   4/5    80.0   3/3     0   1
Stephen Parker         17   12    0    1   1   6/7    85.7   0/1     0.0   0/0     1   0
Victor Holiday         17   11    4    2   1   3/4    75.0   1/1   100.0   4/4     0   0
Miles Siakam           17    2    4    3   0   1/4    25.0   0/1     0.0   0/0     0   1
Cole Barnes            10    0    4    0   1   1/3    33.3   0/1     0.0   0/0     0   0

TEAM: FG: 42/76 (55.3%), 3PT: 9/22 (40.9%), REB: 41 (6 off, 35 def), AST: 22, TO: 14

================================================================================
