================================================================================
                        FULL GAME - Team_075 vs Team_005                        
================================================================================

================================================================================
                       1ST QUARTER - Team_075 vs Team_005                       
================================================================================

[12:00] Team_075 possession (Score: 0-0)
Larry McCollum attempts a Layup. BLOCKED BY BRANDON GEORGE! Ball is loose! Offensive rebound by Derrick Stewart! Derrick Stewart kicks it out.

[11:43] Team_075 possession (Score: 0-0)
Kawhi Ingram attempts a 3Pt. Contested by Derrick Allen (4.3 feet, ZONE). KAWHI INGRAM MAKES IT! Assist: Klay Jokic
Score: 3-0

[11:33] Team_005 possession (Score: 3-0)
Derrick Allen makes the Layup and draws the foul on Derrick Stewart! And-1! Derrick Allen to the line for 1. [Team fouls: 1] (Derrick Stewart: 1 personal fouls)   FT 1/1: MISS Derrick Allen makes 0/1 from the line. FOUL! Loose ball foul on Derrick Stewart during the free throw rebound! [Team fouls: 2] No free throws, side out. (Derrick Stewart: 2 personal fouls)
Score: 3-2

[11:21] Team_005 possession (Score: 3-2)
Jalen Rozier drives, Derrick Stewart stays with him. Jalen Rozier attempts a Layup. Wide open! Derrick Stewart is 6.9 feet away. [ZONE] Jalen Rozier misses. Offensive rebound by Cade Markkanen! Cade Markkanen's putback is no good. Offensive rebound by Cade Markkanen! Cade Markkanen kicks it out.

[11:04] Team_005 possession (Score: 3-2)
Brandon George attempts a 3Pt. Wide open! Kawhi Ingram is 6.5 feet away. [ZONE] Brandon George misses. FOUL! Loose ball foul on Klay Jokic during the rebound battle. [Team fouls: 3] No free throws, side out. (Klay Jokic: 1 personal fouls)

[10:46] Team_005 possession (Score: 3-2)
Jalen Rozier attempts a Midrange. Contested by Derrick Stewart (6.0 feet, MAN). JALEN ROZIER MAKES IT!
Score: 3-4

[10:27] Team_075 possession (Score: 3-4)
Larry McCollum makes the Midrange and draws the foul on Jalen Rozier! And-1! Larry McCollum to the line for 1. [Team fouls: 1] (Jalen Rozier: 1 personal fouls)   FT 1/1: GOOD Larry McCollum makes 1/1 from the line.
Score: 6-4

[10:12] Team_005 possession (Score: 6-4)
Jalen Rozier attempts a Midrange. Wide open! Derrick Stewart is 6.0 feet away. [MAN] Jalen Rozier misses. Rebound secured by Derrick Stewart.

[10:01] Team_075 possession (Score: 6-4)
Derrick Stewart drives and kicks out. Myles Barrett attempts a 3Pt. Contested by Derrick Allen (5.7 feet, MAN). Myles Barrett misses. Rebound secured by Cade Markkanen.

[09:44] Team_005 possession (Score: 6-4)
Cade Markkanen makes the Layup and draws the foul on Klay Jokic! And-1! Cade Markkanen to the line for 1. [Team fouls: 4] (Klay Jokic: 2 personal fouls)   FT 1/1: MISS Cade Markkanen makes 0/1 from the line. Offensive rebound by Jalen Rozier! Jalen Rozier kicks it out.
Score: 6-6

[09:30] Team_005 possession (Score: 6-6)
Cade Markkanen drives and kicks out. Brandon George attempts a Midrange. Heavily contested by Larry McCollum (2.0 feet, MAN)! Brandon George misses. Rebound secured by Klay Jokic.

[09:15] Team_075 possession (Score: 6-6)
FOUL! Shooting foul on Derrick Allen. Myles Barrett to the line for 3 free throws. [Team fouls: 2] (Derrick Allen: 1 personal fouls)   FT 1/3: MISS   FT 2/3: MISS   FT 3/3: GOOD Myles Barrett makes 1/3 from the line.
Score: 7-6

[09:02] Team_005 possession (Score: 7-6)
Brandon George makes the Layup and draws the foul on Derrick Stewart! And-1! Brandon George to the line for 1. [BONUS: 5 team fouls] (Derrick Stewart: 3 personal fouls)   FT 1/1: MISS Brandon George makes 0/1 from the line. Rebound secured by Klay Jokic.
Score: 7-8

[08:48] Team_075 possession (Score: 7-8)
Myles Barrett loses the ball! Stripped by Derrick Allen! TURNOVER! (live ball)

[08:34] Team_005 possession (Score: 7-8)
Cade Markkanen drives, picks up Klay Jokic. Help arrives from Larry McCollum! Cade Markkanen attempts a Dunk. Wide open! Larry McCollum is 7.5 feet away. [MAN] CADE MARKKANEN MAKES IT! Assist: Anthony Rozier
Score: 7-10

[08:18] Team_075 possession (Score: 7-10)
Kawhi Ingram drives, Anthony Rozier stays with him. Kawhi Ingram attempts a Layup. Contested by Anthony Rozier (5.5 feet, MAN). KAWHI INGRAM MAKES IT!
Score: 9-10

[08:03] Team_005 possession (Score: 9-10)
Cade Markkanen attempts a 3Pt. Contested by Larry McCollum (3.4 feet, ZONE). CADE MARKKANEN MAKES IT!
Score: 9-13

[07:52] Team_075 possession (Score: 9-13)
Klay Jokic attempts a Midrange. Wide open! Derrick Allen is 8.1 feet away. [ZONE] Klay Jokic misses. Rebound secured by Cade Markkanen.

[07:36] Team_005 possession (Score: 9-13)
Brandon George drives, Derrick Stewart stays with him. Brandon George attempts a Dunk. Contested by Derrick Stewart (4.2 feet, ZONE). Brandon George misses. Rebound secured by Kawhi Ingram.

[07:18] Team_075 possession (Score: 9-13)
Derrick Stewart drives to the basket... FOUL! Offensive foul on Derrick Stewart! Jalen Rozier drew the charge! [Team fouls: 6] (Derrick Stewart: 4 personal fouls) TURNOVER! (dead ball)

[07:04] Team_005 possession (Score: 9-13)
FOUL! Reach-in foul on Derrick Stewart during the drive. [IN THE BONUS! 7 team fouls] Cade Markkanen to the line for 2 free throws. (Derrick Stewart: 5 personal fouls)   FT 1/2: MISS   FT 2/2: GOOD Cade Markkanen makes 1/2 from the line.
Score: 9-14

[06:47] Team_075 possession (Score: 9-14)
Larry McCollum attempts a Layup. BLOCKED BY BRANDON GEORGE! Ball is loose! Rebound secured by Cade Markkanen.

[06:33] Team_005 possession (Score: 9-14)
Derrick Allen attempts a 3Pt. Contested by Kawhi Ingram (3.3 feet, ZONE). Derrick Allen misses. Rebound secured by Derrick Stewart.

[06:15] Team_075 possession (Score: 9-14)
Kawhi Ingram attempts a Midrange. Contested by Jalen Rozier (6.0 feet, ZONE). Kawhi Ingram misses. Rebound secured by Derrick Allen.

[05:58] Team_005 possession (Score: 9-14)
Brandon George drives and kicks out. Brandon George attempts a 3Pt. Contested by Larry McCollum (4.3 feet, ZONE). Brandon George misses. Rebound secured by Derrick Stewart.

[05:44] Team_075 possession (Score: 9-14)
Kawhi Ingram drives and kicks out. Derrick Stewart attempts a Midrange. Contested by Cade Markkanen (4.3 feet, ZONE). Derrick Stewart misses. Rebound secured by Cade Markkanen.

[05:33] Team_005 possession (Score: 9-14)
Anthony Rozier attempts a 3Pt. Contested by Larry McCollum (3.6 feet, ZONE). Anthony Rozier misses. Rebound secured by Derrick Stewart.

[05:19] Team_075 possession (Score: 9-14)
Larry McCollum attempts a 3Pt. Contested by Derrick Allen (5.9 feet, ZONE). LARRY MCCOLLUM MAKES IT! Assist: Derrick Stewart
Score: 12-14

[05:03] Team_005 possession (Score: 12-14)
Jalen Rozier drives, Klay Jokic stays with him. Jalen Rozier attempts a Dunk. Contested by Klay Jokic (5.9 feet, ZONE). Jalen Rozier misses. Rebound secured by Derrick Stewart.

[04:45] Team_075 possession (Score: 12-14)
Derrick Stewart drives and kicks out. Klay Jokic attempts a 3Pt. Heavily contested by Cade Markkanen (0.5 feet, MAN)! Klay Jokic misses. Rebound secured by Derrick Allen.

[04:31] Team_005 possession (Score: 12-14)
FOUL! Reach-in foul on Derrick Stewart during the drive. [IN THE BONUS! 8 team fouls] Brandon George to the line for 2 free throws. (Derrick Stewart: 6 personal fouls) Derrick Stewart FOULS OUT!   FT 1/2: GOOD   FT 2/2: GOOD Brandon George makes 2/2 from the line.
Score: 12-16

[04:31] Substitution (Team_075): Derrick Stewart OUT (stamina: 77) → D'Angelo Anunoby IN (foul_out)

[04:20] Team_075 possession (Score: 12-16)
Myles Barrett drives, Derrick Allen stays with him. Myles Barrett attempts a Dunk. Contested by Derrick Allen (4.7 feet, MAN). MYLES BARRETT MAKES IT! Assist: D'Angelo Anunoby
Score: 14-16

[04:01] Team_005 possession (Score: 14-16)
Cade Markkanen drives, picks up Klay Jokic. Help arrives from Larry McCollum! Cade Markkanen attempts a Dunk. Wide open! Larry McCollum is 6.2 feet away. [ZONE] CADE MARKKANEN MAKES IT! Assist: Anthony Rozier
Score: 14-18

[03:50] Team_075 possession (Score: 14-18)
D'Angelo Anunoby throws a bad pass out of bounds! TURNOVER! (dead ball)

[03:35] Team_005 possession (Score: 14-18)
Brandon George attempts a 3Pt. Contested by Larry McCollum (5.0 feet, MAN). Brandon George misses. Rebound secured by Larry McCollum.

[03:24] Team_075 possession (Score: 14-18)
Kawhi Ingram drives, Anthony Rozier stays with him. Kawhi Ingram attempts a Dunk. Heavily contested by Anthony Rozier (1.6 feet, MAN)! KAWHI INGRAM MAKES IT!
Score: 16-18

[03:09] Team_005 possession (Score: 16-18)
Brandon George attempts a 3Pt. Contested by Larry McCollum (2.2 feet, ZONE). BRANDON GEORGE MAKES IT! Assist: Derrick Allen
Score: 16-21

[02:55] Team_075 possession (Score: 16-21)
Larry McCollum attempts a Midrange. Contested by Brandon George (4.7 feet, MAN). LARRY MCCOLLUM MAKES IT! Assist: Myles Barrett
Score: 18-21

[02:42] Team_005 possession (Score: 18-21)
Jalen Rozier attempts a Layup. Wide open! Klay Jokic is 7.5 feet away. [ZONE] JALEN ROZIER MAKES IT! Assist: Cade Markkanen
Score: 18-23

[02:31] Team_075 possession (Score: 18-23)
D'Angelo Anunoby makes the Layup and draws the foul on Jalen Rozier! And-1! D'Angelo Anunoby to the line for 1. [Team fouls: 3] (Jalen Rozier: 2 personal fouls)   FT 1/1: GOOD D'Angelo Anunoby makes 1/1 from the line.
Score: 21-23

[02:22] Team_005 possession (Score: 21-23)
Cade Markkanen attempts a Midrange. Contested by Klay Jokic (4.8 feet, MAN). CADE MARKKANEN MAKES IT! Assist: Brandon George
Score: 21-25

[02:08] Team_075 possession (Score: 21-25)
Myles Barrett attempts a 3Pt. Wide open! Derrick Allen is 8.0 feet away. [ZONE] MYLES BARRETT MAKES IT! Assist: Larry McCollum
Score: 24-25

[01:58] Team_005 possession (Score: 24-25)
Derrick Allen attempts a 3Pt. Contested by D'Angelo Anunoby (5.2 feet, ZONE). DERRICK ALLEN MAKES IT! Assist: Cade Markkanen
Score: 24-28

[01:44] Team_075 possession (Score: 24-28)
Klay Jokic attempts a 3Pt. Contested by Cade Markkanen (4.2 feet, MAN). KLAY JOKIC MAKES IT! Assist: Kawhi Ingram
Score: 27-28

[01:31] Team_005 possession (Score: 27-28)
Derrick Allen attempts a Midrange. Wide open! Myles Barrett is 6.4 feet away. [MAN] DERRICK ALLEN MAKES IT!
Score: 27-30

[01:20] Team_075 possession (Score: 27-30)
Myles Barrett throws a bad pass! Stolen by Derrick Allen! TURNOVER! (live ball)

[01:04] Team_005 possession (Score: 27-30)
Jalen Rozier attempts a 3Pt. Contested by D'Angelo Anunoby (5.8 feet, ZONE). Jalen Rozier misses. Offensive rebound by Cade Markkanen! Cade Markkanen kicks it out.

[00:50] Team_005 possession (Score: 27-30)
Anthony Rozier loses control! Ball rolls out of bounds! TURNOVER! (dead ball)

[00:50] Substitution (Team_075): Larry McCollum OUT → LeBron Ginobili IN (stamina_rule2)

[00:50] Substitution (Team_075): Kawhi Ingram OUT → Larry McCollum IN (stamina_rule2)

[00:50] Substitution (Team_075): Myles Barrett OUT → Donovan Paul IN (stamina_rule2)

[00:50] Substitution (Team_075): Klay Jokic OUT → Kevin Towns IN (stamina_rule2)

[00:50] Substitution (Team_005): Brandon George OUT → Blake O'Neal IN (stamina_rule2)

[00:50] Substitution (Team_005): Anthony Rozier OUT → Draymond Smith IN (stamina_rule2)

[00:50] Substitution (Team_005): Derrick Allen OUT → Lauri Wade IN (stamina_rule2)

[00:50] Substitution (Team_005): Jalen Rozier OUT → Isaiah Durant IN (stamina_rule2)

[00:50] Substitution (Team_005): Cade Markkanen OUT → Zion Parker IN (stamina_rule2)

[00:33] Team_075 possession (Score: 27-30)
Kevin Towns drives and kicks out. Larry McCollum attempts a 3Pt. Heavily contested by Blake O'Neal (2.0 feet, ZONE)! Larry McCollum misses. Rebound secured by Zion Parker.

[00:23] Team_005 possession (Score: 27-30)
Zion Parker attempts a 3Pt. Wide open! D'Angelo Anunoby is 8.5 feet away. [ZONE] ZION PARKER MAKES IT! Assist: Lauri Wade
Score: 27-33

[00:07] Team_075 possession (Score: 27-33)
Larry McCollum attempts a 3Pt. Heavily contested by Blake O'Neal (0.6 feet, ZONE)! Larry McCollum misses. Rebound secured by Zion Parker.

================================================================================
                              1ST QUARTER COMPLETE                              
================================================================================

1ST QUARTER SCORE: Team_075 27, Team_005 33

BOX SCORE:
================================================================================

Team_075
--------------------------------------------------------------------------------
Player                MIN  PTS  REB  AST  TO      FG   FG%      3P   3P%
--------------------------------------------------------------------------------
Larry McCollum         12    8    1    1   0   3/5    60.0     0/0   0.0
Kawhi Ingram           11    7    1    1   0   3/5    60.0     0/0   0.0
Myles Barrett          11    6    0    1   0   3/3   100.0     0/0   0.0
Klay Jokic             11    3    2    1   0   1/2    50.0     0/0   0.0
D'Angelo Anunoby        4    3    0    1   0   1/1   100.0     0/0   0.0
Derrick Stewart         8    0    6    1   0   0/2     0.0     0/0   0.0
Kevin Towns             1    0    0    0   0   0/1     0.0     0/0   0.0

TEAM: FG: 11/19 (57.9%), 3PT: 5/6 (83.3%), REB: 10 (1 off, 9 def), AST: 6, TO: 4
TEAM FOULS: 8 [Team_005 in BONUS]


Team_005
--------------------------------------------------------------------------------
Player                MIN  PTS  REB  AST  TO      FG   FG%      3P   3P%
--------------------------------------------------------------------------------
Cade Markkanen         11   10    6    2   0   5/6    83.3     0/0   0.0
Brandon George         11    5    0    1   0   2/6    33.3     0/0   0.0
Derrick Allen          11    5    2    1   0   2/3    66.7     0/0   0.0
Jalen Rozier           11    4    3    0   0   2/4    50.0     0/0   0.0
Zion Parker             1    3    2    0   0   1/1   100.0     0/0   0.0
Anthony Rozier         11    0    0    2   0   0/1     0.0     0/0   0.0
Lauri Wade              1    0    0    1   0   0/0     0.0     0/0   0.0

TEAM: FG: 12/21 (57.1%), 3PT: 4/7 (57.1%), REB: 13 (5 off, 8 def), AST: 7, TO: 1
TEAM FOULS: 3

================================================================================

================================================================================
                       2ND QUARTER - Team_075 vs Team_005                       
================================================================================

[12:00] Team_075 possession (Score: 27-33)
Klay Jokic attempts a Layup. BLOCKED BY CADE MARKKANEN! Ball deflects out of bounds off Klay Jokic.

[11:43] Team_005 possession (Score: 27-33)
Cade Markkanen makes the Layup and draws the foul on Derrick Stewart! And-1! Cade Markkanen to the line for 1. [Team fouls: 1] (Derrick Stewart: 1 personal fouls)   FT 1/1: GOOD Cade Markkanen makes 1/1 from the line.
Score: 27-36

[11:30] Team_075 possession (Score: 27-36)
FOUL! Reach-in foul on Cade Markkanen during the drive. [Team fouls: 1] No free throws, side out. (Cade Markkanen: 1 personal fouls)

[11:15] Team_075 possession (Score: 27-36)
Myles Barrett attempts a 3Pt. Contested by Derrick Allen (5.1 feet, ZONE). Myles Barrett misses. Offensive rebound by Kawhi Ingram! Kawhi Ingram kicks it out.

[10:59] Team_075 possession (Score: 27-36)
Kawhi Ingram drives and kicks out. Myles Barrett makes the 3Pt and draws the foul on Brandon George! And-1! Myles Barrett to the line for 1. [Team fouls: 2] (Brandon George: 1 personal fouls)   FT 1/1: GOOD Myles Barrett makes 1/1 from the line.
Score: 31-36

[10:44] Team_005 possession (Score: 31-36)
Brandon George makes the Midrange and draws the foul on Larry McCollum! And-1! Brandon George to the line for 1. [Team fouls: 2] (Larry McCollum: 1 personal fouls)   FT 1/1: GOOD Brandon George makes 1/1 from the line.
Score: 31-39

[10:34] Team_075 possession (Score: 31-39)
Myles Barrett attempts a Midrange. Contested by Jalen Rozier (4.6 feet, ZONE). Myles Barrett misses. Rebound secured by Derrick Allen.

[10:23] Team_005 possession (Score: 31-39)
Brandon George attempts a Layup. Contested by Larry McCollum (3.4 feet, MAN). Brandon George misses. Offensive rebound by Cade Markkanen! Cade Markkanen kicks it out.

[10:05] Team_005 possession (Score: 31-39)
Cade Markkanen attempts a Midrange. Contested by Klay Jokic (4.8 feet, MAN). Cade Markkanen misses. Offensive rebound by Derrick Allen! Derrick Allen kicks it out.

[09:50] Team_005 possession (Score: 31-39)
Anthony Rozier attempts a 3Pt. Heavily contested by Kawhi Ingram (1.8 feet, MAN)! Anthony Rozier misses. Rebound secured by Derrick Stewart.

[09:41] Team_075 possession (Score: 31-39)
Larry McCollum attempts a 3Pt. Wide open! Derrick Allen is 6.1 feet away. [ZONE] LARRY MCCOLLUM MAKES IT! Assist: Kawhi Ingram
Score: 34-39

[09:30] Team_005 possession (Score: 34-39)
Brandon George drives, Larry McCollum stays with him. Brandon George attempts a Dunk. Contested by Larry McCollum (4.5 feet, MAN). BRANDON GEORGE MAKES IT! Assist: Anthony Rozier
Score: 34-41

[09:19] Team_075 possession (Score: 34-41)
Klay Jokic attempts a Midrange. Contested by Derrick Allen (3.9 feet, ZONE). Klay Jokic misses. Rebound secured by Jalen Rozier.

[09:05] Team_005 possession (Score: 34-41)
Jalen Rozier attempts a Midrange. Wide open! Kawhi Ingram is 6.6 feet away. [ZONE] Jalen Rozier misses. Offensive rebound by Cade Markkanen! Cade Markkanen kicks it out.

[08:52] Team_005 possession (Score: 34-41)
Jalen Rozier attempts a Layup. Contested by Derrick Stewart (3.3 feet, ZONE). JALEN ROZIER MAKES IT! Assist: Derrick Allen
Score: 34-43

[08:40] Team_075 possession (Score: 34-43)
Myles Barrett drives to the basket... Myles Barrett commits a violation (traveling/carry)! TURNOVER! (dead ball)

[08:40] Substitution (Team_075): Larry McCollum OUT → LeBron Ginobili IN (stamina_rule2)

[08:40] Substitution (Team_075): Kawhi Ingram OUT → D'Angelo Anunoby IN (stamina_rule2)

[08:40] Substitution (Team_075): Myles Barrett OUT → Donovan Paul IN (stamina_rule2)

[08:40] Substitution (Team_075): Klay Jokic OUT → Kevin Towns IN (stamina_rule2)

[08:40] Substitution (Team_005): Brandon George OUT → Blake O'Neal IN (stamina_rule2)

[08:40] Substitution (Team_005): Anthony Rozier OUT → Draymond Smith IN (stamina_rule2)

[08:40] Substitution (Team_005): Derrick Allen OUT → Lauri Wade IN (stamina_rule2)

[08:40] Substitution (Team_005): Jalen Rozier OUT → Isaiah Durant IN (stamina_rule2)

[08:40] Substitution (Team_005): Cade Markkanen OUT → Zion Parker IN (stamina_rule2)

[08:27] Team_005 possession (Score: 34-43)
Lauri Wade attempts a Midrange. Wide open! Donovan Paul is 6.0 feet away. [MAN] LAURI WADE MAKES IT!
Score: 34-45

[08:18] Team_075 possession (Score: 34-45)
Donovan Paul attempts a 3Pt. Wide open! Lauri Wade is 7.7 feet away. [ZONE] DONOVAN PAUL MAKES IT! Assist: LeBron Ginobili
Score: 37-45

[08:04] Team_005 possession (Score: 37-45)
Lauri Wade attempts a 3Pt. Wide open! Donovan Paul is 6.3 feet away. [MAN] LAURI WADE MAKES IT! Assist: Isaiah Durant
Score: 37-48

[07:54] Team_075 possession (Score: 37-48)
FOUL! Shooting foul on Isaiah Durant. Derrick Stewart to the line for 2 free throws. [Team fouls: 3] (Isaiah Durant: 1 personal fouls)   FT 1/2: GOOD   FT 2/2: GOOD Derrick Stewart makes 2/2 from the line.
Score: 39-48

[07:39] Team_005 possession (Score: 39-48)
Blake O'Neal attempts a 3Pt. Wide open! D'Angelo Anunoby is 7.5 feet away. [MAN] BLAKE O'NEAL MAKES IT! Assist: Lauri Wade
Score: 39-51

[07:22] Team_075 possession (Score: 39-51)
LeBron Ginobili attempts a Midrange. Contested by Draymond Smith (2.6 feet, MAN). LeBron Ginobili misses. Rebound secured by Lauri Wade.

[07:07] Team_005 possession (Score: 39-51)
FOUL! Reach-in foul on Derrick Stewart during the drive. [Team fouls: 3] No free throws, side out. (Derrick Stewart: 2 personal fouls)

[06:51] Team_005 possession (Score: 39-51)
Lauri Wade throws a bad pass out of bounds! TURNOVER! (dead ball)

[06:51] Substitution (Team_075): Derrick Stewart OUT → Collin Duncan IN (stamina_rule2)

[06:35] Team_075 possession (Score: 39-51)
Collin Duncan attempts a Layup. BLOCKED BY ZION PARKER! Ball is loose! Rebound secured by Zion Parker.

[06:19] Team_005 possession (Score: 39-51)
Isaiah Durant drives, Collin Duncan stays with him. Isaiah Durant attempts a Dunk. Wide open! Collin Duncan is 6.8 feet away. [MAN] ISAIAH DURANT MAKES IT!
Score: 39-53

[06:02] Team_075 possession (Score: 39-53)
Kevin Towns drives and kicks out. D'Angelo Anunoby attempts a 3Pt. Contested by Blake O'Neal (4.7 feet, ZONE). D'ANGELO ANUNOBY MAKES IT! Assist: Collin Duncan
Score: 42-53

[05:46] Team_005 possession (Score: 42-53)
Lauri Wade drives and kicks out. Zion Parker attempts a Midrange. Wide open! Kevin Towns is 7.5 feet away. [MAN] Zion Parker misses. Rebound secured by Collin Duncan.

[05:32] Team_075 possession (Score: 42-53)
Collin Duncan drives and kicks out. LeBron Ginobili attempts a 3Pt. Contested by Draymond Smith (4.0 feet, MAN). LEBRON GINOBILI MAKES IT!
Score: 45-53

[05:18] Team_005 possession (Score: 45-53)
Draymond Smith drives, Kevin Towns stays with him. Draymond Smith attempts a Layup. Contested by Kevin Towns (4.4 feet, ZONE). Draymond Smith misses. Rebound secured by Kevin Towns.

[05:05] Team_075 possession (Score: 45-53)
Donovan Paul attempts a 3Pt. Contested by Blake O'Neal (5.0 feet, ZONE). DONOVAN PAUL MAKES IT! Assist: D'Angelo Anunoby
Score: 48-53

[04:50] Team_005 possession (Score: 48-53)
Lauri Wade drives, Donovan Paul stays with him. Lauri Wade attempts a Dunk. Wide open! Donovan Paul is 6.2 feet away. [MAN] LAURI WADE MAKES IT! Assist: Blake O'Neal
Score: 48-55

[04:33] Team_075 possession (Score: 48-55)
FOUL! Shooting foul on Blake O'Neal. D'Angelo Anunoby to the line for 2 free throws. [Team fouls: 4] (Blake O'Neal: 1 personal fouls)   FT 1/2: GOOD   FT 2/2: MISS D'Angelo Anunoby makes 1/2 from the line. Rebound secured by Draymond Smith.
Score: 49-55

[04:24] Team_005 possession (Score: 49-55)
Isaiah Durant attempts a Midrange. Contested by Collin Duncan (4.3 feet, MAN). ISAIAH DURANT MAKES IT! Assist: Draymond Smith
Score: 49-57

[04:05] Team_075 possession (Score: 49-57)
D'Angelo Anunoby attempts a 3Pt. Wide open! Blake O'Neal is 7.2 feet away. [MAN] D'ANGELO ANUNOBY MAKES IT! Assist: LeBron Ginobili
Score: 52-57

[03:55] Team_005 possession (Score: 52-57)
Isaiah Durant attempts a 3Pt. Wide open! Collin Duncan is 7.1 feet away. [MAN] Isaiah Durant misses. Rebound secured by Kevin Towns.

[03:40] Team_075 possession (Score: 52-57)
LeBron Ginobili attempts a Midrange. Contested by Isaiah Durant (4.0 feet, ZONE). LEBRON GINOBILI MAKES IT! Assist: Collin Duncan
Score: 54-57

[03:28] Team_005 possession (Score: 54-57)
Draymond Smith attempts a 3Pt. Contested by D'Angelo Anunoby (3.8 feet, ZONE). DRAYMOND SMITH MAKES IT! Assist: Isaiah Durant
Score: 54-60

[03:17] Team_075 possession (Score: 54-60)
D'Angelo Anunoby attempts a Midrange. Contested by Blake O'Neal (3.7 feet, MAN). D'ANGELO ANUNOBY MAKES IT! Assist: Kevin Towns
Score: 56-60

[03:01] Team_005 possession (Score: 56-60)
Zion Parker drives, Kevin Towns stays with him. Zion Parker attempts a Dunk. Wide open! Kevin Towns is 6.4 feet away. [ZONE] Zion Parker misses. Offensive rebound by Zion Parker! Zion Parker puts it back in!
Score: 56-62

[02:48] Team_075 possession (Score: 56-62)
LeBron Ginobili attempts a 3Pt. Contested by Draymond Smith (5.3 feet, MAN). LeBron Ginobili misses. FOUL! Loose ball foul on Lauri Wade during the rebound battle. [IN THE BONUS! 5 team fouls] Collin Duncan to the line for 2 free throws. (Lauri Wade: 1 personal fouls)   FT 1/2: MISS   FT 2/2: GOOD Collin Duncan makes 1/2 from the line.
Score: 57-62

[02:32] Team_005 possession (Score: 57-62)
Zion Parker attempts a Layup. Wide open! Kevin Towns is 8.6 feet away. [MAN] ZION PARKER MAKES IT!
Score: 57-64

[02:23] Team_075 possession (Score: 57-64)
Collin Duncan attempts a Layup. Contested by Isaiah Durant (2.7 feet, MAN). Collin Duncan misses. Rebound secured by Lauri Wade.

[02:12] Team_005 possession (Score: 57-64)
FOUL! Shooting foul on Kevin Towns. Zion Parker to the line for 2 free throws. [Team fouls: 4] (Kevin Towns: 1 personal fouls)   FT 1/2: GOOD   FT 2/2: MISS Zion Parker makes 1/2 from the line. Rebound secured by Kevin Towns.
Score: 57-65

[01:58] Team_075 possession (Score: 57-65)
LeBron Ginobili drives and kicks out. LeBron Ginobili attempts a 3Pt. Contested by Draymond Smith (2.3 feet, MAN). LeBron Ginobili misses. Offensive rebound by Collin Duncan! Collin Duncan kicks it out.

[01:44] Team_075 possession (Score: 57-65)
Donovan Paul attempts a 3Pt. Wide open! Blake O'Neal is 6.3 feet away. [ZONE] DONOVAN PAUL MAKES IT!
Score: 60-65

[01:32] Team_005 possession (Score: 60-65)
Isaiah Durant makes the Dunk and draws the foul on D'Angelo Anunoby! And-1! Isaiah Durant to the line for 1. [BONUS: 5 team fouls] (D'Angelo Anunoby: 1 personal fouls)   FT 1/1: GOOD Isaiah Durant makes 1/1 from the line.
Score: 60-68

[01:17] Team_075 possession (Score: 60-68)
Kevin Towns attempts a 3Pt. Contested by Zion Parker (3.7 feet, MAN). KEVIN TOWNS MAKES IT! Assist: Donovan Paul
Score: 63-68

[01:01] Team_005 possession (Score: 63-68)
Lauri Wade attempts a 3Pt. Heavily contested by LeBron Ginobili (0.9 feet, ZONE)! Lauri Wade misses. Offensive rebound by Draymond Smith! Draymond Smith kicks it out.

[00:50] Team_005 possession (Score: 63-68)
Isaiah Durant attempts a 3Pt. Contested by D'Angelo Anunoby (3.4 feet, ZONE). Isaiah Durant misses. Rebound secured by Kevin Towns.

[00:41] Team_075 possession (Score: 63-68)
Collin Duncan attempts a 3Pt. Contested by Isaiah Durant (5.2 feet, MAN). Collin Duncan misses. Rebound secured by Zion Parker.

[00:29] Team_005 possession (Score: 63-68)
Zion Parker attempts a 3Pt. Contested by D'Angelo Anunoby (3.6 feet, ZONE). Zion Parker misses. Rebound secured by Collin Duncan.

[00:12] Team_075 possession (Score: 63-68)
Collin Duncan makes the Layup and draws the foul on Zion Parker! And-1! Collin Duncan to the line for 1. [BONUS: 6 team fouls] (Zion Parker: 1 personal fouls)   FT 1/1: MISS Collin Duncan makes 0/1 from the line. Offensive rebound by Kevin Towns! Kevin Towns kicks it out.
Score: 65-68

================================================================================
                              2ND QUARTER COMPLETE                              
================================================================================

2ND QUARTER SCORE: Team_075 38, Team_005 35

BOX SCORE:
================================================================================

Team_075
--------------------------------------------------------------------------------
Player                MIN  PTS  REB  AST  TO      FG   FG%      3P   3P%
--------------------------------------------------------------------------------
Donovan Paul            9    9    0    1   0   3/3   100.0     0/0   0.0
D'Angelo Anunoby       13    8    0    1   0   3/4    75.0     0/0   0.0
LeBron Ginobili         9    5    0    2   0   2/3    66.7     0/0   0.0
Myles Barrett          15    4    0    0   0   1/2    50.0     0/0   0.0
Larry McCollum         16    3    0    0   0   1/1   100.0     0/0   0.0
Kevin Towns             9    3    5    1   0   1/1   100.0     0/0   0.0
Derrick Stewart        13    2    1    0   0   1/1   100.0     0/0   0.0
Collin Duncan           7    1    3    2   0   1/4    25.0     0/0   0.0
Klay Jokic             15    0    0    0   0   0/2     0.0     0/0   0.0
Kawhi Ingram           15    0    1    1   0   0/0     0.0     0/0   0.0

TEAM: FG: 13/21 (61.9%), 3PT: 7/8 (87.5%), REB: 10 (3 off, 7 def), AST: 8, TO: 1
TEAM FOULS: 5 [Team_005 in BONUS]


Team_005
--------------------------------------------------------------------------------
Player                MIN  PTS  REB  AST  TO      FG   FG%      3P   3P%
--------------------------------------------------------------------------------
Lauri Wade              9    7    2    1   0   3/4    75.0     0/0   0.0
Isaiah Durant           9    7    0    2   0   3/5    60.0     0/0   0.0
Brandon George         15    5    0    0   0   2/2   100.0     0/0   0.0
Zion Parker             9    4    3    0   0   2/4    50.0     0/0   0.0
Cade Markkanen         15    3    2    0   0   1/1   100.0     0/0   0.0
Blake O'Neal            9    3    0    1   0   1/1   100.0     0/0   0.0
Draymond Smith          9    3    2    1   0   1/2    50.0     0/0   0.0
Jalen Rozier           15    2    1    0   0   1/1   100.0     0/0   0.0
Derrick Allen          15    0    2    1   0   0/0     0.0     0/0   0.0
Anthony Rozier         15    0    0    1   0   0/1     0.0     0/0   0.0

TEAM: FG: 14/21 (66.7%), 3PT: 3/7 (42.9%), REB: 12 (5 off, 7 def), AST: 7, TO: 1
TEAM FOULS: 6 [Team_075 in BONUS]

================================================================================

================================================================================
                       3RD QUARTER - Team_075 vs Team_005                       
================================================================================

[12:00] Team_075 possession (Score: 65-68)
Derrick Stewart drives to the basket... Derrick Stewart throws a bad pass! Stolen by Cade Markkanen! TURNOVER! (live ball)

[11:47] Team_005 possession (Score: 65-68)
Anthony Rozier attempts a 3Pt. Heavily contested by Kawhi Ingram (0.5 feet, MAN)! Anthony Rozier misses. Rebound secured by Klay Jokic.

[11:33] Team_075 possession (Score: 65-68)
Klay Jokic attempts a 3Pt. Contested by Jalen Rozier (5.5 feet, ZONE). Klay Jokic misses. FOUL! Loose ball foul on Jalen Rozier during the rebound battle. [Team fouls: 1] No free throws, side out. (Jalen Rozier: 1 personal fouls)

[11:17] Team_075 possession (Score: 65-68)
Myles Barrett drives, Cade Markkanen stays with him. Myles Barrett attempts a Dunk. Wide open! Cade Markkanen is 6.5 feet away. [ZONE] Myles Barrett misses. Rebound secured by Derrick Allen.

[11:02] Team_005 possession (Score: 65-68)
Anthony Rozier attempts a Layup. Heavily contested by Kawhi Ingram (0.5 feet, MAN)! Anthony Rozier misses. Offensive rebound by Jalen Rozier! Jalen Rozier kicks it out.

[10:48] Team_005 possession (Score: 65-68)
Cade Markkanen drives and kicks out. Cade Markkanen attempts a 3Pt. Contested by Larry McCollum (2.2 feet, ZONE). CADE MARKKANEN MAKES IT! Assist: Derrick Allen
Score: 65-71

[10:34] Team_075 possession (Score: 65-71)
Myles Barrett drives, picks up Cade Markkanen. Help arrives from Anthony Rozier! Myles Barrett attempts a Dunk. Contested by Anthony Rozier (3.6 feet, ZONE). MYLES BARRETT MAKES IT! Assist: Kawhi Ingram
Score: 67-71

[10:20] Team_005 possession (Score: 67-71)
Jalen Rozier attempts a 3Pt. Wide open! Larry McCollum is 6.4 feet away. [ZONE] Jalen Rozier misses. Rebound secured by Kawhi Ingram.

[10:06] Team_075 possession (Score: 67-71)
Derrick Stewart attempts a Layup. Heavily contested by Cade Markkanen (0.5 feet, MAN)! DERRICK STEWART MAKES IT! Assist: Myles Barrett
Score: 69-71

[09:53] Team_005 possession (Score: 69-71)
Brandon George makes the Midrange and draws the foul on Larry McCollum! And-1! Brandon George to the line for 1. [Team fouls: 1] (Larry McCollum: 1 personal fouls)   FT 1/1: GOOD Brandon George makes 1/1 from the line.
Score: 69-74

[09:38] Team_075 possession (Score: 69-74)
Myles Barrett attempts a Layup. Contested by Cade Markkanen (5.2 feet, ZONE). MYLES BARRETT MAKES IT!
Score: 71-74

[09:28] Team_005 possession (Score: 71-74)
Brandon George attempts a 3Pt. Wide open! Larry McCollum is 9.8 feet away. [ZONE] Brandon George misses. Offensive rebound by Jalen Rozier! Jalen Rozier kicks it out.

[09:08] Team_005 possession (Score: 71-74)
Anthony Rozier attempts a 3Pt. Contested by Kawhi Ingram (2.7 feet, MAN). Anthony Rozier misses. Rebound secured by Derrick Stewart.

[08:50] Team_075 possession (Score: 71-74)
Larry McCollum drives and kicks out. Derrick Stewart attempts a 3Pt. Contested by Cade Markkanen (2.3 feet, MAN). Derrick Stewart misses. Offensive rebound by Derrick Stewart! Derrick Stewart kicks it out.

[08:41] Team_075 possession (Score: 71-74)
Kawhi Ingram attempts a 3Pt. Contested by Derrick Allen (5.1 feet, ZONE). Kawhi Ingram misses. Rebound secured by Cade Markkanen.

[08:28] Team_005 possession (Score: 71-74)
Brandon George attempts a Midrange. Contested by Larry McCollum (3.8 feet, MAN). BRANDON GEORGE MAKES IT! Assist: Derrick Allen
Score: 71-76

[08:15] Team_075 possession (Score: 71-76)
Klay Jokic drives to the basket... Klay Jokic throws a bad pass! Stolen by Cade Markkanen! TURNOVER! (live ball)

[07:56] Team_005 possession (Score: 71-76)
Brandon George attempts a 3Pt. Contested by Larry McCollum (5.2 feet, MAN). Brandon George misses. Rebound secured by Klay Jokic.

[07:45] Team_075 possession (Score: 71-76)
FOUL! Shooting foul on Derrick Allen. Myles Barrett to the line for 2 free throws. [Team fouls: 2] (Derrick Allen: 1 personal fouls)   FT 1/2: GOOD   FT 2/2: GOOD Myles Barrett makes 2/2 from the line.
Score: 73-76

[07:31] Team_005 possession (Score: 73-76)
FOUL! Holding foul on Larry McCollum. [Team fouls: 2] No free throws, side out. (Larry McCollum: 2 personal fouls)

[07:14] Team_005 possession (Score: 73-76)
Jalen Rozier attempts a 3Pt. Contested by Kawhi Ingram (5.4 feet, ZONE). JALEN ROZIER MAKES IT! Assist: Brandon George
Score: 73-79

[07:03] Team_075 possession (Score: 73-79)
Klay Jokic drives, Cade Markkanen stays with him. Klay Jokic attempts a Layup. Contested by Cade Markkanen (2.4 feet, ZONE). KLAY JOKIC MAKES IT! Assist: Larry McCollum
Score: 75-79

[06:48] Team_005 possession (Score: 75-79)
Jalen Rozier attempts a 3Pt. Wide open! Derrick Stewart is 8.1 feet away. [MAN] JALEN ROZIER MAKES IT! Assist: Cade Markkanen
Score: 75-82

[06:33] Team_075 possession (Score: 75-82)
Derrick Stewart attempts a Layup. Contested by Cade Markkanen (4.0 feet, ZONE). Derrick Stewart misses. Rebound secured by Cade Markkanen.

[06:18] Team_005 possession (Score: 75-82)
Derrick Allen attempts a 3Pt. Contested by Myles Barrett (5.0 feet, MAN). DERRICK ALLEN MAKES IT! Assist: Cade Markkanen
Score: 75-85

[06:02] Team_075 possession (Score: 75-85)
Larry McCollum attempts a Layup. Contested by Brandon George (4.6 feet, MAN). LARRY MCCOLLUM MAKES IT! Assist: Kawhi Ingram
Score: 77-85

[05:51] Team_005 possession (Score: 77-85)
Derrick Allen drives and kicks out. Brandon George attempts a Midrange. Contested by Larry McCollum (4.0 feet, MAN). Brandon George misses. FOUL! Loose ball foul on Derrick Stewart during the rebound battle. [Team fouls: 3] No free throws, side out. (Derrick Stewart: 1 personal fouls)

[05:39] Team_005 possession (Score: 77-85)
Anthony Rozier attempts a 3Pt. Contested by Kawhi Ingram (3.4 feet, MAN). Anthony Rozier misses. Rebound secured by Kawhi Ingram.

[05:27] Team_075 possession (Score: 77-85)
Larry McCollum attempts a 3Pt. Contested by Anthony Rozier (5.5 feet, ZONE). Larry McCollum misses. Rebound secured by Jalen Rozier.

[05:10] Team_005 possession (Score: 77-85)
FOUL! Holding foul on Myles Barrett. [Team fouls: 4] No free throws, side out. (Myles Barrett: 1 personal fouls)

[04:53] Team_005 possession (Score: 77-85)
Brandon George attempts a 3Pt. Contested by Larry McCollum (4.7 feet, MAN). Brandon George misses. Rebound secured by Klay Jokic.

[04:38] Team_075 possession (Score: 77-85)
Larry McCollum drives, picks up Brandon George. Help arrives from Anthony Rozier! Larry McCollum attempts a Dunk. Wide open! Anthony Rozier is 10.0 feet away. [MAN] LARRY MCCOLLUM MAKES IT! Assist: Derrick Stewart
Score: 79-85

[04:19] Team_005 possession (Score: 79-85)
Anthony Rozier attempts a 3Pt. Contested by Larry McCollum (4.6 feet, ZONE). ANTHONY ROZIER MAKES IT! Assist: Derrick Allen
Score: 79-88

[04:04] Team_075 possession (Score: 79-88)
Klay Jokic drives and kicks out. Myles Barrett attempts a Midrange. Contested by Derrick Allen (3.6 feet, ZONE). MYLES BARRETT MAKES IT!
Score: 81-88

[03:48] Team_005 possession (Score: 81-88)
Anthony Rozier attempts a 3Pt. Heavily contested by Larry McCollum (1.5 feet, ZONE)! ANTHONY ROZIER MAKES IT! Assist: Brandon George
Score: 81-91

[03:31] Team_075 possession (Score: 81-91)
Klay Jokic drives, picks up Cade Markkanen. Help arrives from Anthony Rozier! Klay Jokic attempts a Layup. Contested by Anthony Rozier (4.1 feet, ZONE). Klay Jokic misses. Offensive rebound by Kawhi Ingram! Kawhi Ingram kicks it out.

[03:15] Team_075 possession (Score: 81-91)
Derrick Stewart attempts a Layup. Wide open! Jalen Rozier is 6.5 feet away. [MAN] Derrick Stewart misses. FOUL! Loose ball foul on Derrick Allen during the rebound battle. [Team fouls: 3] No free throws, side out. (Derrick Allen: 2 personal fouls)

[03:00] Team_075 possession (Score: 81-91)
Derrick Stewart drives and kicks out. Myles Barrett attempts a 3Pt. Wide open! Brandon George is 8.0 feet away. [ZONE] MYLES BARRETT MAKES IT! Assist: Klay Jokic
Score: 84-91

[02:46] Team_005 possession (Score: 84-91)
Brandon George attempts a Layup. BLOCKED BY LARRY MCCOLLUM! Ball is loose! Offensive rebound by Jalen Rozier! Jalen Rozier kicks it out.

[02:37] Team_005 possession (Score: 84-91)
Cade Markkanen drives and kicks out. Anthony Rozier attempts a Midrange. Wide open! Kawhi Ingram is 7.9 feet away. [MAN] Anthony Rozier misses. FOUL! Loose ball foul on Klay Jokic during the rebound battle. [IN THE BONUS! 5 team fouls] Cade Markkanen to the line for 2 free throws. (Klay Jokic: 1 personal fouls)   FT 1/2: GOOD   FT 2/2: GOOD Cade Markkanen makes 2/2 from the line.
Score: 84-93

[02:22] Team_075 possession (Score: 84-93)
Myles Barrett attempts a 3Pt. Contested by Derrick Allen (2.4 feet, ZONE). Myles Barrett misses. Rebound secured by Jalen Rozier.

[02:09] Team_005 possession (Score: 84-93)
Jalen Rozier attempts a 3Pt. Contested by Larry McCollum (3.4 feet, ZONE). JALEN ROZIER MAKES IT! Assist: Anthony Rozier
Score: 84-96

[01:52] Team_075 possession (Score: 84-96)
Klay Jokic makes the Layup and draws the foul on Cade Markkanen! And-1! Klay Jokic to the line for 1. [Team fouls: 4] (Cade Markkanen: 1 personal fouls)   FT 1/1: GOOD Klay Jokic makes 1/1 from the line.
Score: 87-96

[01:38] Team_005 possession (Score: 87-96)
Anthony Rozier attempts a 3Pt. Contested by Kawhi Ingram (5.8 feet, MAN). Anthony Rozier misses. Offensive rebound by Cade Markkanen! Cade Markkanen kicks it out.

[01:22] Team_005 possession (Score: 87-96)
Brandon George attempts a 3Pt. Wide open! Larry McCollum is 7.2 feet away. [MAN] Brandon George misses. Offensive rebound by Jalen Rozier! Jalen Rozier kicks it out.

[01:08] Team_005 possession (Score: 87-96)
Anthony Rozier drives to the basket... Anthony Rozier throws a bad pass! Stolen by Kawhi Ingram! TURNOVER! (live ball)

[00:55] Team_075 possession (Score: 87-96)
FOUL! Holding foul on Anthony Rozier. [IN THE BONUS! 5 team fouls] Kawhi Ingram to the line for 2 free throws. (Anthony Rozier: 1 personal fouls)   FT 1/2: GOOD   FT 2/2: GOOD Kawhi Ingram makes 2/2 from the line.
Score: 89-96

[00:42] Team_005 possession (Score: 89-96)
FOUL! Reach-in foul on Derrick Stewart during the drive. [IN THE BONUS! 6 team fouls] Cade Markkanen to the line for 2 free throws. (Derrick Stewart: 2 personal fouls)   FT 1/2: GOOD   FT 2/2: GOOD Cade Markkanen makes 2/2 from the line.
Score: 89-98

[00:27] Team_075 possession (Score: 89-98)
Larry McCollum attempts a 3Pt. Wide open! Brandon George is 6.7 feet away. [MAN] Larry McCollum misses. Rebound secured by Derrick Allen.

[00:18] Team_005 possession (Score: 89-98)
Cade Markkanen drives to the basket... Cade Markkanen throws a bad pass! Stolen by Klay Jokic! TURNOVER! (live ball)

[00:06] Team_075 possession (Score: 89-98)
FOUL! Offensive foul on Kawhi Ingram! Anthony Rozier drew the charge! [Team fouls: 7] (Kawhi Ingram: 1 personal fouls) TURNOVER! (dead ball)

================================================================================
                              3RD QUARTER COMPLETE                              
================================================================================

3RD QUARTER SCORE: Team_075 24, Team_005 30

BOX SCORE:
================================================================================

Team_075
--------------------------------------------------------------------------------
Player                MIN  PTS  REB  AST  TO      FG   FG%      3P   3P%
--------------------------------------------------------------------------------
Myles Barrett          27   11    0    1   0   5/7    71.4     0/0   0.0
Klay Jokic             27    5    3    1   0   2/2   100.0     0/0   0.0
Larry McCollum         28    4    0    1   0   2/4    50.0     0/0   0.0
Kawhi Ingram           27    2    5    2   0   1/2    50.0     0/0   0.0
Derrick Stewart        25    2    2    1   0   1/2    50.0     0/0   0.0

TEAM: FG: 11/17 (64.7%), 3PT: 0/4 (0.0%), REB: 10 (4 off, 6 def), AST: 6, TO: 3
TEAM FOULS: 7 [Team_005 in BONUS]


Team_005
--------------------------------------------------------------------------------
Player                MIN  PTS  REB  AST  TO      FG   FG%      3P   3P%
--------------------------------------------------------------------------------
Jalen Rozier           27    9    6    0   0   3/4    75.0     0/0   0.0
Cade Markkanen         27    7    4    2   0   3/3   100.0     0/0   0.0
Anthony Rozier         27    6    0    1   0   2/5    40.0     0/0   0.0
Brandon George         27    5    0    2   0   2/4    50.0     0/0   0.0
Derrick Allen          27    3    2    3   0   1/1   100.0     0/0   0.0

TEAM: FG: 11/17 (64.7%), 3PT: 6/12 (50.0%), REB: 12 (6 off, 6 def), AST: 8, TO: 2
TEAM FOULS: 5 [Team_075 in BONUS]

================================================================================

================================================================================
                       4TH QUARTER - Team_075 vs Team_005                       
================================================================================

[12:00] Team_075 possession (Score: 89-98)
Kawhi Ingram attempts a 3Pt. Wide open! Anthony Rozier is 8.3 feet away. [MAN] Kawhi Ingram misses. Rebound secured by Derrick Allen.

[11:48] Team_005 possession (Score: 89-98)
Jalen Rozier attempts a 3Pt. Wide open! Larry McCollum is 6.8 feet away. [ZONE] Jalen Rozier misses. Offensive rebound by Cade Markkanen! Cade Markkanen kicks it out.

[11:33] Team_005 possession (Score: 89-98)
Cade Markkanen drives, Klay Jokic stays with him. Cade Markkanen attempts a Layup. Wide open! Klay Jokic is 7.9 feet away. [MAN] CADE MARKKANEN MAKES IT! Assist: Anthony Rozier
Score: 89-100

[11:16] Team_075 possession (Score: 89-100)
Myles Barrett attempts a 3Pt. BLOCKED BY DERRICK ALLEN! Ball deflects out of bounds off Myles Barrett.

[11:06] Team_005 possession (Score: 89-100)
Brandon George drives, Derrick Stewart stays with him. Brandon George attempts a Dunk. Contested by Derrick Stewart (4.7 feet, ZONE). BRANDON GEORGE MAKES IT! Assist: Cade Markkanen
Score: 89-102

[10:55] Team_075 possession (Score: 89-102)
Larry McCollum attempts a 3Pt. Contested by Derrick Allen (4.3 feet, ZONE). Larry McCollum misses. FOUL! Loose ball foul on Jalen Rozier during the rebound battle. [Team fouls: 1] No free throws, side out. (Jalen Rozier: 1 personal fouls)

[10:38] Team_075 possession (Score: 89-102)
Kawhi Ingram drives and kicks out. Klay Jokic attempts a Midrange. Contested by Derrick Allen (5.2 feet, ZONE). Klay Jokic misses. FOUL! Loose ball foul on Jalen Rozier during the rebound battle. [Team fouls: 2] No free throws, side out. (Jalen Rozier: 2 personal fouls)

[10:25] Team_075 possession (Score: 89-102)
Larry McCollum attempts a Midrange. Contested by Brandon George (5.4 feet, MAN). Larry McCollum misses. Offensive rebound by Kawhi Ingram! Kawhi Ingram kicks it out.

[10:12] Team_075 possession (Score: 89-102)
Myles Barrett attempts a 3Pt. Wide open! Derrick Allen is 6.3 feet away. [ZONE] MYLES BARRETT MAKES IT! Assist: Klay Jokic
Score: 92-102

[09:57] Team_005 possession (Score: 92-102)
Cade Markkanen makes the Midrange and draws the foul on Derrick Stewart! And-1! Cade Markkanen to the line for 1. [Team fouls: 1] (Derrick Stewart: 1 personal fouls)   FT 1/1: GOOD Cade Markkanen makes 1/1 from the line.
Score: 92-105

[09:39] Team_075 possession (Score: 92-105)
Kawhi Ingram attempts a 3Pt. Contested by Anthony Rozier (5.0 feet, MAN). KAWHI INGRAM MAKES IT! Assist: Larry McCollum
Score: 95-105

[09:29] Team_005 possession (Score: 95-105)
Derrick Allen attempts a Layup. Wide open! Myles Barrett is 7.2 feet away. [MAN] DERRICK ALLEN MAKES IT! Assist: Jalen Rozier
Score: 95-107

[09:12] Team_075 possession (Score: 95-107)
Derrick Stewart attempts a 3Pt. Contested by Derrick Allen (4.4 feet, ZONE). Derrick Stewart misses. Rebound secured by Jalen Rozier.

[08:57] Team_005 possession (Score: 95-107)
Anthony Rozier attempts a Midrange. Contested by Derrick Stewart (2.3 feet, ZONE). Anthony Rozier misses. Rebound secured by Kawhi Ingram.

[08:39] Team_075 possession (Score: 95-107)
Larry McCollum drives, Brandon George stays with him. Larry McCollum attempts a Dunk. Wide open! Brandon George is 10.0 feet away. [MAN] Larry McCollum misses. Rebound secured by Cade Markkanen.

[08:24] Team_005 possession (Score: 95-107)
Derrick Allen attempts a Midrange. Wide open! Klay Jokic is 6.4 feet away. [ZONE] Derrick Allen misses. Rebound secured by Derrick Stewart.

[08:13] Team_075 possession (Score: 95-107)
Larry McCollum attempts a 3Pt. Wide open! Brandon George is 6.7 feet away. [MAN] LARRY MCCOLLUM MAKES IT!
Score: 98-107

[07:59] Team_005 possession (Score: 98-107)
Jalen Rozier drives, Derrick Stewart stays with him. Jalen Rozier attempts a Dunk. Wide open! Derrick Stewart is 7.3 feet away. [MAN] Jalen Rozier misses. Rebound secured by Kawhi Ingram.

[07:40] Team_075 possession (Score: 98-107)
FOUL! Reach-in foul on Cade Markkanen during the drive. [Team fouls: 3] No free throws, side out. (Cade Markkanen: 1 personal fouls)

[07:26] Team_075 possession (Score: 98-107)
Larry McCollum attempts a 3Pt. Contested by Derrick Allen (3.7 feet, ZONE). LARRY MCCOLLUM MAKES IT! Assist: Klay Jokic
Score: 101-107

[07:11] Team_005 possession (Score: 101-107)
Cade Markkanen attempts a 3Pt. Contested by Klay Jokic (4.3 feet, MAN). Cade Markkanen misses. Offensive rebound by Cade Markkanen! Cade Markkanen kicks it out.

[06:54] Team_005 possession (Score: 101-107)
Jalen Rozier attempts a 3Pt. Contested by Derrick Stewart (5.9 feet, MAN). Jalen Rozier misses. Rebound secured by Derrick Stewart.

[06:39] Team_075 possession (Score: 101-107)
Klay Jokic drives, Cade Markkanen stays with him. Klay Jokic attempts a Dunk. Contested by Cade Markkanen (3.2 feet, MAN). KLAY JOKIC MAKES IT! Assist: Kawhi Ingram
Score: 103-107

[06:21] Team_005 possession (Score: 103-107)
Jalen Rozier drives, Derrick Stewart stays with him. Jalen Rozier attempts a Dunk. Contested by Derrick Stewart (3.4 feet, ZONE). JALEN ROZIER MAKES IT!
Score: 103-109

[06:07] Team_075 possession (Score: 103-109)
Myles Barrett commits a violation (traveling/carry)! TURNOVER! (dead ball)

[06:07] Substitution (Team_075): Larry McCollum OUT → D'Angelo Anunoby IN (stamina_rule2)

[06:07] Substitution (Team_075): Kawhi Ingram OUT → LeBron Ginobili IN (stamina_rule2)

[06:07] Substitution (Team_075): Myles Barrett OUT → Donovan Paul IN (stamina_rule2)

[06:07] Substitution (Team_075): Derrick Stewart OUT → Collin Duncan IN (stamina_rule2)

[06:07] Substitution (Team_075): Klay Jokic OUT → Kevin Towns IN (stamina_rule2)

[06:07] Substitution (Team_005): Brandon George OUT → Blake O'Neal IN (stamina_rule2)

[06:07] Substitution (Team_005): Anthony Rozier OUT → Draymond Smith IN (stamina_rule2)

[06:07] Substitution (Team_005): Derrick Allen OUT → Lauri Wade IN (stamina_rule2)

[06:07] Substitution (Team_005): Jalen Rozier OUT → Isaiah Durant IN (stamina_rule2)

[06:07] Substitution (Team_005): Cade Markkanen OUT → Zion Parker IN (stamina_rule2)

[05:52] Team_005 possession (Score: 103-109)
Zion Parker attempts a Midrange. Wide open! Kevin Towns is 8.3 feet away. [MAN] Zion Parker misses. Rebound secured by D'Angelo Anunoby.

[05:42] Team_075 possession (Score: 103-109)
Collin Duncan attempts a Layup. Contested by Isaiah Durant (5.1 feet, MAN). COLLIN DUNCAN MAKES IT! Assist: LeBron Ginobili
Score: 105-109

[05:23] Team_005 possession (Score: 105-109)
Draymond Smith attempts a 3Pt. Contested by LeBron Ginobili (5.0 feet, MAN). Draymond Smith misses. Rebound secured by Collin Duncan.

[05:09] Team_075 possession (Score: 105-109)
Collin Duncan drives and kicks out. LeBron Ginobili attempts a 3Pt. Contested by Draymond Smith (4.3 feet, MAN). LEBRON GINOBILI MAKES IT! Assist: Kevin Towns
Score: 108-109

[04:52] Team_005 possession (Score: 108-109)
Isaiah Durant attempts a Layup. BLOCKED BY COLLIN DUNCAN! Ball is loose! Rebound secured by Kevin Towns.

[04:37] Team_075 possession (Score: 108-109)
FOUL! Offensive foul on D'Angelo Anunoby! Blake O'Neal drew the charge! [Team fouls: 2] (D'Angelo Anunoby: 1 personal fouls) TURNOVER! (dead ball)

[04:22] Team_005 possession (Score: 108-109)
Isaiah Durant attempts a Midrange. Wide open! Collin Duncan is 6.8 feet away. [MAN] Isaiah Durant misses. Rebound secured by Collin Duncan.

[04:09] Team_075 possession (Score: 108-109)
Donovan Paul attempts a 3Pt. Contested by Blake O'Neal (4.8 feet, ZONE). Donovan Paul misses. Rebound secured by Draymond Smith.

[03:55] Team_005 possession (Score: 108-109)
Zion Parker attempts a 3Pt. Contested by D'Angelo Anunoby (4.4 feet, ZONE). Zion Parker misses. Rebound secured by D'Angelo Anunoby.

[03:40] Team_075 possession (Score: 108-109)
LeBron Ginobili attempts a 3Pt. Contested by Draymond Smith (2.5 feet, MAN). LeBron Ginobili misses. Rebound secured by Draymond Smith.

[03:27] Team_005 possession (Score: 108-109)
Lauri Wade drives and kicks out. Zion Parker attempts a 3Pt. Contested by Kevin Towns (3.6 feet, MAN). Zion Parker misses. Rebound secured by Collin Duncan.

[03:13] Team_075 possession (Score: 108-109)
LeBron Ginobili attempts a 3Pt. Contested by Blake O'Neal (2.2 feet, ZONE). LeBron Ginobili misses. Offensive rebound by Kevin Towns! Kevin Towns kicks it out.

[02:57] Team_075 possession (Score: 108-109)
Kevin Towns attempts a Layup. Contested by Zion Parker (4.0 feet, ZONE). KEVIN TOWNS MAKES IT!
Score: 110-109

[02:41] Team_005 possession (Score: 110-109)
Draymond Smith attempts a 3Pt. Contested by LeBron Ginobili (5.2 feet, MAN). DRAYMOND SMITH MAKES IT! Assist: Lauri Wade
Score: 110-112

[02:25] Team_075 possession (Score: 110-112)
Collin Duncan loses control! Ball rolls out of bounds! TURNOVER! (dead ball)

[02:11] Team_005 possession (Score: 110-112)
Draymond Smith throws a bad pass! Stolen by LeBron Ginobili! TURNOVER! (live ball)

[01:53] Team_075 possession (Score: 110-112)
D'Angelo Anunoby attempts a 3Pt. Contested by Blake O'Neal (6.0 feet, ZONE). D'Angelo Anunoby misses. Rebound secured by Lauri Wade.

[01:44] Team_005 possession (Score: 110-112)
Lauri Wade drives to the basket... FOUL! Offensive foul on Lauri Wade! Donovan Paul drew the charge! [Team fouls: 4] (Lauri Wade: 1 personal fouls) TURNOVER! (dead ball)

[01:33] Team_075 possession (Score: 110-112)
Donovan Paul attempts a Midrange. Wide open! Lauri Wade is 6.2 feet away. [MAN] DONOVAN PAUL MAKES IT!
Score: 112-112

[01:16] Team_005 possession (Score: 112-112)
Lauri Wade throws a bad pass out of bounds! TURNOVER! (dead ball)

[01:04] Team_075 possession (Score: 112-112)
D'Angelo Anunoby drives and kicks out. Collin Duncan attempts a 3Pt. Contested by Isaiah Durant (3.3 feet, MAN). Collin Duncan misses. Rebound secured by Zion Parker.

[00:52] Team_005 possession (Score: 112-112)
Blake O'Neal attempts a 3Pt. Contested by D'Angelo Anunoby (3.1 feet, MAN). Blake O'Neal misses. Rebound secured by Kevin Towns.

[00:41] Team_075 possession (Score: 112-112)
LeBron Ginobili attempts a 3Pt. Contested by Draymond Smith (2.5 feet, MAN). LeBron Ginobili misses. Rebound secured by Zion Parker.

[00:29] Team_005 possession (Score: 112-112)
Zion Parker drives, Kevin Towns stays with him. Zion Parker attempts a Dunk. Contested by Kevin Towns (4.0 feet, ZONE). ZION PARKER MAKES IT! Assist: Lauri Wade
Score: 112-114

[00:19] Team_075 possession (Score: 112-114)
FOUL! Offensive foul on Donovan Paul! Lauri Wade drew the charge! [Team fouls: 3] (Donovan Paul: 1 personal fouls) TURNOVER! (dead ball)

[00:03] Team_005 possession (Score: 112-114)
FOUL! Holding foul on Donovan Paul. [Team fouls: 4] No free throws, side out. (Donovan Paul: 2 personal fouls)

================================================================================
                              4TH QUARTER COMPLETE                              
================================================================================

4TH QUARTER SCORE: Team_075 23, Team_005 16

BOX SCORE:
================================================================================

Team_075
--------------------------------------------------------------------------------
Player                MIN  PTS  REB  AST  TO      FG   FG%      3P   3P%
--------------------------------------------------------------------------------
Larry McCollum         34    6    0    1   0   2/3    66.7     0/0   0.0
Kawhi Ingram           33    3    5    1   0   1/2    50.0     0/0   0.0
Myles Barrett          33    3    0    0   0   1/2    50.0     0/0   0.0
LeBron Ginobili        15    3    0    1   0   1/3    33.3     0/0   0.0
Klay Jokic             33    2    0    2   0   1/1   100.0     0/0   0.0
Collin Duncan          13    2    3    0   0   1/1   100.0     0/0   0.0
Kevin Towns            15    2    3    1   0   1/1   100.0     0/0   0.0
Donovan Paul           15    2    0    0   0   1/2    50.0     0/0   0.0
Derrick Stewart        31    0    2    0   0   0/1     0.0     0/0   0.0
D'Angelo Anunoby       19    0    2    0   0   0/2     0.0     0/0   0.0

TEAM: FG: 9/18 (50.0%), 3PT: 4/11 (36.4%), REB: 15 (4 off, 11 def), AST: 6, TO: 4
TEAM FOULS: 4


Team_005
--------------------------------------------------------------------------------
Player                MIN  PTS  REB  AST  TO      FG   FG%      3P   3P%
--------------------------------------------------------------------------------
Cade Markkanen         33    5    3    1   0   2/2   100.0     0/0   0.0
Draymond Smith         15    3    2    0   0   1/2    50.0     0/0   0.0
Derrick Allen          33    2    1    0   0   1/2    50.0     0/0   0.0
Brandon George         33    2    0    0   0   1/1   100.0     0/0   0.0
Jalen Rozier           33    2    1    1   0   1/3    33.3     0/0   0.0
Zion Parker            15    2    2    0   0   1/3    33.3     0/0   0.0
Anthony Rozier         33    0    0    1   0   0/1     0.0     0/0   0.0
Isaiah Durant          15    0    0    0   0   0/2     0.0     0/0   0.0
Lauri Wade             15    0    1    2   0   0/1     0.0     0/0   0.0
Blake O'Neal           15    0    0    0   0   0/1     0.0     0/0   0.0

TEAM: FG: 7/18 (38.9%), 3PT: 1/5 (20.0%), REB: 10 (2 off, 8 def), AST: 5, TO: 3
TEAM FOULS: 4

================================================================================

================================================================================
                               FULL GAME COMPLETE                               
================================================================================

FINAL SCORE: Team_075 112, Team_005 114

SCORING BY QUARTER:
--------------------------------------------------------------------------------
Team                     Q1     Q2     Q3     Q4    FINAL
--------------------------------------------------------------------------------
Team_075                 27     38     24     23      112
Team_005                 33     35     30     16      114
--------------------------------------------------------------------------------

FULL GAME BOX SCORE:
================================================================================

Team_075
--------------------------------------------------------------------------------
Player                MIN  PTS  REB  AST  TO      FG   FG%      3P   3P%      FT STL BLK
--------------------------------------------------------------------------------
Larry McCollum         34   21    1    3   2   8/13   61.5   4/7    57.1   1/1     0   1
Kawhi Ingram           33   12   12    5   1   5/9    55.6   2/4    50.0   2/2     1   0
Myles Barrett          33   24    0    2   3   7/11   63.6   3/5    60.0   4/6     0   0
Klay Jokic             33   10    5    4   1   5/8    62.5   1/1   100.0   1/1     1   0
Derrick Stewart        31    4   11    2   1   3/7    42.9   0/1     0.0   2/2     0   0
D'Angelo Anunoby       19   11    2    2   2   3/6    50.0   1/2    50.0   2/3     0   0
LeBron Ginobili        15    8    0    3   0   2/5    40.0   1/3    33.3   0/0     1   0
Donovan Paul           15   11    0    1   1   4/5    80.0   3/4    75.0   0/0     0   0
Kevin Towns            15    5    8    2   0   3/4    75.0   1/1   100.0   0/0     0   0
Collin Duncan          13    3    6    2   1   3/6    50.0   0/1     0.0   1/3     0   1

TEAM: FG: 44/75 (58.7%), 3PT: 16/29 (55.2%), REB: 45 (12 off, 33 def), AST: 26, TO: 12


Team_005
--------------------------------------------------------------------------------
Player                MIN  PTS  REB  AST  TO      FG   FG%      3P   3P%      FT STL BLK
--------------------------------------------------------------------------------
Brandon George         33   17    0    3   1   7/13   53.8   1/4    25.0   4/5     0   2
Anthony Rozier         33    6    0    5   1   2/8    25.0   2/7    28.6   0/0     0   0
Derrick Allen          33   10    7    5   1   4/6    66.7   2/3    66.7   0/1     2   1
Jalen Rozier           33   17   11    1   0   7/12   58.3   3/5    60.0   0/0     0   0
Cade Markkanen         33   25   15    5   0  11/12   91.7   1/1   100.0   7/9     2   1
Blake O'Neal           15    3    0    1   0   1/2    50.0   1/2    50.0   0/0     0   0
Draymond Smith         15    6    4    1   2   2/4    50.0   2/3    66.7   0/0     0   0
Lauri Wade             15    7    3    4   2   3/5    60.0   1/1   100.0   0/0     0   0
Isaiah Durant          15    7    0    2   0   3/7    42.9   0/2     0.0   1/1     0   0
Zion Parker            15    9    7    0   0   4/8    50.0   1/3    33.3   1/2     0   1

TEAM: FG: 44/77 (57.1%), 3PT: 14/31 (45.2%), REB: 47 (18 off, 29 def), AST: 27, TO: 7

================================================================================
