================================================================================
                        FULL GAME - Team_028 vs Team_060                        
================================================================================

================================================================================
                       1ST QUARTER - Team_028 vs Team_060                       
================================================================================

[12:00] Team_028 possession (Score: 0-0)
Myles Haliburton drives, Immanuel Ming stays with him. Myles Haliburton attempts a Dunk. Contested by Immanuel Ming (4.3 feet, MAN). MYLES HALIBURTON MAKES IT!
Score: 2-0

[11:41] Team_060 possession (Score: 2-0)
Julius Green makes the Layup and draws the foul on Carmelo Carter! And-1! Julius Green to the line for 1. [Team fouls: 1] (Carmelo Carter: 1 personal fouls)   FT 1/1: GOOD Julius Green makes 1/1 from the line.
Score: 2-3

[11:25] Team_028 possession (Score: 2-3)
Carmelo Carter attempts a Midrange. Heavily contested by Julius Green (2.0 feet, MAN)! CARMELO CARTER MAKES IT!
Score: 4-3

[11:11] Team_060 possession (Score: 4-3)
Larry Westbrook attempts a Layup. BLOCKED BY KAWHI BALL! Ball is loose! Rebound secured by Jimmy Brogdon.

[10:53] Team_028 possession (Score: 4-3)
Kawhi Ball attempts a 3Pt. Contested by Immanuel Ming (4.8 feet, ZONE). Kawhi Ball misses. Rebound secured by Larry Westbrook.

[10:42] Team_060 possession (Score: 4-3)
Joel Morant attempts a Layup. Contested by Austin Russell (4.1 feet, MAN). Joel Morant misses. Rebound secured by Carmelo Carter.

[10:28] Team_028 possession (Score: 4-3)
Austin Russell attempts a 3Pt. Contested by Joel Morant (5.7 feet, MAN). AUSTIN RUSSELL MAKES IT! Assist: Myles Haliburton
Score: 7-3

[10:12] Team_060 possession (Score: 7-3)
Joel Morant drives to the basket... FOUL! Offensive foul on Joel Morant! Kawhi Ball drew the charge! [Team fouls: 1] (Joel Morant: 1 personal fouls) TURNOVER! (dead ball)

[10:02] Team_028 possession (Score: 7-3)
Myles Haliburton attempts a Layup. Contested by Immanuel Ming (2.7 feet, MAN). MYLES HALIBURTON MAKES IT! Assist: Kawhi Ball
Score: 9-3

[09:46] Team_060 possession (Score: 9-3)
Jaren George attempts a Midrange. Contested by Jimmy Brogdon (5.5 feet, MAN). Jaren George misses. Rebound secured by Jimmy Brogdon.

[09:35] Team_028 possession (Score: 9-3)
Carmelo Carter attempts a 3Pt. Wide open! Julius Green is 6.8 feet away. [ZONE] Carmelo Carter misses. Rebound secured by Immanuel Ming.

[09:21] Team_060 possession (Score: 9-3)
Jaren George attempts a Layup. Contested by Jimmy Brogdon (2.2 feet, MAN). Jaren George misses. Offensive rebound by Immanuel Ming! Immanuel Ming kicks it out.

[09:01] Team_060 possession (Score: 9-3)
Jaren George drives, picks up Jimmy Brogdon. Help arrives from Carmelo Carter! Jaren George attempts a Dunk. Wide open! Carmelo Carter is 7.8 feet away. [MAN] Jaren George misses. Rebound secured by Jimmy Brogdon.

[08:45] Team_028 possession (Score: 9-3)
Kawhi Ball throws a bad pass! Stolen by Larry Westbrook! TURNOVER! (live ball)

[08:30] Team_060 possession (Score: 9-3)
Immanuel Ming attempts a Midrange. Contested by Kawhi Ball (5.2 feet, ZONE). IMMANUEL MING MAKES IT! Assist: Julius Green
Score: 9-5

[08:12] Team_028 possession (Score: 9-5)
Myles Haliburton loses control! Ball rolls out of bounds! TURNOVER! (dead ball)

[07:55] Team_060 possession (Score: 9-5)
Larry Westbrook attempts a Midrange. Heavily contested by Austin Russell (1.2 feet, ZONE)! LARRY WESTBROOK MAKES IT!
Score: 9-7

[07:41] Team_028 possession (Score: 9-7)
Myles Haliburton attempts a 3Pt. Heavily contested by Julius Green (1.0 feet, ZONE)! MYLES HALIBURTON MAKES IT! Assist: Austin Russell
Score: 12-7

[07:28] Team_060 possession (Score: 12-7)
Jaren George attempts a 3Pt. Wide open! Jimmy Brogdon is 8.4 feet away. [MAN] Jaren George misses. Rebound secured by Jimmy Brogdon.

[07:14] Team_028 possession (Score: 12-7)
Jimmy Brogdon drives, picks up Jaren George. Help arrives from Julius Green! Jimmy Brogdon attempts a Layup. Contested by Julius Green (3.1 feet, MAN). Jimmy Brogdon misses. Offensive rebound by Jimmy Brogdon! Jimmy Brogdon kicks it out.

[06:59] Team_028 possession (Score: 12-7)
Myles Haliburton attempts a 3Pt. Contested by Julius Green (5.8 feet, ZONE). Myles Haliburton misses. Rebound secured by Larry Westbrook.

[06:42] Team_060 possession (Score: 12-7)
Julius Green attempts a 3Pt. Wide open! Austin Russell is 6.2 feet away. [ZONE] JULIUS GREEN MAKES IT! Assist: Larry Westbrook
Score: 12-10

[06:24] Team_028 possession (Score: 12-10)
Austin Russell attempts a Midrange. Contested by Joel Morant (3.1 feet, MAN). AUSTIN RUSSELL MAKES IT! Assist: Carmelo Carter
Score: 14-10

[06:09] Team_060 possession (Score: 14-10)
FOUL! Shooting foul on Austin Russell. Immanuel Ming to the line for 3 free throws. [Team fouls: 2] (Austin Russell: 1 personal fouls)   FT 1/3: GOOD   FT 2/3: GOOD   FT 3/3: GOOD Immanuel Ming makes 3/3 from the line.
Score: 14-13

[05:53] Team_028 possession (Score: 14-13)
Carmelo Carter attempts a 3Pt. Contested by Julius Green (4.7 feet, MAN). Carmelo Carter misses. Rebound secured by Immanuel Ming.

[05:36] Team_060 possession (Score: 14-13)
Larry Westbrook attempts a Layup. Wide open! Kawhi Ball is 6.3 feet away. [MAN] Larry Westbrook misses. Rebound secured by Jimmy Brogdon.

[05:22] Team_028 possession (Score: 14-13)
Myles Haliburton drives, picks up Jaren George. Help arrives from Julius Green! Myles Haliburton attempts a Dunk. Contested by Julius Green (4.1 feet, ZONE). Myles Haliburton misses. Rebound secured by Larry Westbrook.

[05:10] Team_060 possession (Score: 14-13)
Immanuel Ming attempts a 3Pt. Contested by Myles Haliburton (5.0 feet, MAN). Immanuel Ming misses. Rebound secured by Jimmy Brogdon.

[04:56] Team_028 possession (Score: 14-13)
FOUL! Shooting foul on Larry Westbrook. Kawhi Ball to the line for 2 free throws. [Team fouls: 2] (Larry Westbrook: 1 personal fouls)   FT 1/2: GOOD   FT 2/2: MISS Kawhi Ball makes 1/2 from the line. Offensive rebound by Jimmy Brogdon! Jimmy Brogdon kicks it out.
Score: 15-13

[04:42] Team_028 possession (Score: 15-13)
Carmelo Carter attempts a 3Pt. Contested by Julius Green (5.2 feet, MAN). Carmelo Carter misses. Rebound secured by Jaren George.

[04:25] Team_060 possession (Score: 15-13)
Immanuel Ming drives, Myles Haliburton stays with him. Immanuel Ming attempts a Layup. Contested by Myles Haliburton (3.8 feet, MAN). IMMANUEL MING MAKES IT!
Score: 15-15

[04:12] Team_028 possession (Score: 15-15)
FOUL! Shooting foul on Julius Green. Myles Haliburton to the line for 3 free throws. [Team fouls: 3] (Julius Green: 1 personal fouls)   FT 1/3: GOOD   FT 2/3: GOOD   FT 3/3: GOOD Myles Haliburton makes 3/3 from the line.
Score: 18-15

[03:57] Team_060 possession (Score: 18-15)
FOUL! Offensive foul on Jaren George! Jimmy Brogdon drew the charge! [Team fouls: 4] (Jaren George: 1 personal fouls) TURNOVER! (dead ball)

[03:41] Team_028 possession (Score: 18-15)
Austin Russell attempts a Layup. BLOCKED BY IMMANUEL MING! Ball goes out off Immanuel Ming. Austin Russell's ball!

[03:29] Team_028 possession (Score: 18-15)
Kawhi Ball attempts a 3Pt. Contested by Larry Westbrook (3.8 feet, MAN). KAWHI BALL MAKES IT! Assist: Myles Haliburton
Score: 21-15

[03:17] Team_060 possession (Score: 21-15)
Larry Westbrook attempts a Midrange. Wide open! Kawhi Ball is 7.2 feet away. [MAN] LARRY WESTBROOK MAKES IT! Assist: Julius Green
Score: 21-17

[03:04] Team_028 possession (Score: 21-17)
Carmelo Carter drives and kicks out. Jimmy Brogdon attempts a 3Pt. Wide open! Jaren George is 6.2 feet away. [MAN] JIMMY BROGDON MAKES IT! Assist: Myles Haliburton
Score: 24-17

[02:50] Team_060 possession (Score: 24-17)
Larry Westbrook attempts a 3Pt. Wide open! Austin Russell is 6.3 feet away. [ZONE] LARRY WESTBROOK MAKES IT! Assist: Jaren George
Score: 24-20

[02:36] Team_028 possession (Score: 24-20)
Myles Haliburton attempts a 3Pt. Wide open! Julius Green is 6.3 feet away. [ZONE] Myles Haliburton misses. Rebound secured by Immanuel Ming.

[02:26] Team_060 possession (Score: 24-20)
Jaren George commits a violation (traveling/carry)! TURNOVER! (dead ball)

[02:26] Substitution (Team_028): Carmelo Carter OUT → Tyrese Quickley IN (stamina_rule2)

[02:26] Substitution (Team_028): Kawhi Ball OUT → Bam Towns IN (stamina_rule2)

[02:26] Substitution (Team_028): Jimmy Brogdon OUT → Collin Bridges IN (stamina_rule2)

[02:26] Substitution (Team_060): Joel Morant OUT → Domantas Barnes IN (stamina_rule2)

[02:26] Substitution (Team_060): Larry Westbrook OUT → Yao Tatum IN (stamina_rule2)

[02:26] Substitution (Team_060): Jaren George OUT → Klay Haliburton IN (stamina_rule2)

[02:10] Team_028 possession (Score: 24-20)
Tyrese Quickley attempts a 3Pt. Contested by Julius Green (3.9 feet, MAN). Tyrese Quickley misses. Rebound secured by Domantas Barnes.

[01:53] Team_060 possession (Score: 24-20)
Immanuel Ming attempts a Layup. Contested by Myles Haliburton (4.9 feet, MAN). IMMANUEL MING MAKES IT!
Score: 24-22

[01:38] Team_028 possession (Score: 24-22)
Collin Bridges attempts a Layup. Contested by Klay Haliburton (5.8 feet, MAN). COLLIN BRIDGES MAKES IT! Assist: Bam Towns
Score: 26-22

[01:23] Team_060 possession (Score: 26-22)
Yao Tatum drives to the basket... Yao Tatum throws a bad pass out of bounds! TURNOVER! (dead ball)

[01:23] Substitution (Team_028): Austin Russell OUT → Scottie Ingram IN (stamina_rule2)

[01:23] Substitution (Team_028): Myles Haliburton OUT → Miles Booker IN (stamina_rule2)

[01:23] Substitution (Team_060): Julius Green OUT → Rudy Ginobili IN (stamina_rule2)

[01:23] Substitution (Team_060): Immanuel Ming OUT → Jarrett Wagner IN (stamina_rule2)

[01:08] Team_028 possession (Score: 26-22)
FOUL! Shooting foul on Domantas Barnes. Scottie Ingram to the line for 2 free throws. [BONUS: 5 team fouls] (Domantas Barnes: 1 personal fouls)   FT 1/2: GOOD   FT 2/2: GOOD Scottie Ingram makes 2/2 from the line.
Score: 28-22

[00:53] Team_060 possession (Score: 28-22)
Klay Haliburton attempts a Layup. Contested by Collin Bridges (5.5 feet, ZONE). Klay Haliburton misses. Rebound secured by Bam Towns.

[00:41] Team_028 possession (Score: 28-22)
Bam Towns drives, Yao Tatum stays with him. Bam Towns attempts a Dunk. Contested by Yao Tatum (4.9 feet, MAN). BAM TOWNS MAKES IT! Assist: Collin Bridges
Score: 30-22

[00:24] Team_060 possession (Score: 30-22)
Yao Tatum attempts a 3Pt. Wide open! Scottie Ingram is 6.4 feet away. [ZONE] Yao Tatum misses. Rebound secured by Bam Towns.

[00:07] Team_028 possession (Score: 30-22)
Bam Towns attempts a 3Pt. Wide open! Domantas Barnes is 8.0 feet away. [ZONE] Bam Towns misses. Rebound secured by Klay Haliburton.

================================================================================
                              1ST QUARTER COMPLETE                              
================================================================================

1ST QUARTER SCORE: Team_028 30, Team_060 22

BOX SCORE:
================================================================================

Team_028
--------------------------------------------------------------------------------
Player                MIN  PTS  REB  AST  TO      FG   FG%      3P   3P%
--------------------------------------------------------------------------------
Myles Haliburton       11   10    0    3   0   4/7    57.1     0/0   0.0
Austin Russell         11    5    0    1   0   2/2   100.0     0/0   0.0
Jimmy Brogdon          10    3    8    0   0   1/1   100.0     0/0   0.0
Kawhi Ball             10    3    0    1   0   1/2    50.0     0/0   0.0
Carmelo Carter         10    2    1    1   0   1/4    25.0     0/0   0.0
Collin Bridges          2    2    0    1   0   1/1   100.0     0/0   0.0
Bam Towns               2    2    2    1   0   1/2    50.0     0/0   0.0
Scottie Ingram          1    2    0    0   0   1/1   100.0     0/0   0.0
Tyrese Quickley         2    0    0    0   0   0/1     0.0     0/0   0.0

TEAM: FG: 12/21 (57.1%), 3PT: 4/12 (33.3%), REB: 11 (2 off, 9 def), AST: 8, TO: 2
TEAM FOULS: 2


Team_060
--------------------------------------------------------------------------------
Player                MIN  PTS  REB  AST  TO      FG   FG%      3P   3P%
--------------------------------------------------------------------------------
Immanuel Ming          11    9    4    0   0   4/5    80.0     0/0   0.0
Larry Westbrook        10    7    3    1   0   3/5    60.0     0/0   0.0
Julius Green           11    6    0    2   0   2/2   100.0     0/0   0.0
Joel Morant            10    0    0    0   0   0/1     0.0     0/0   0.0
Jaren George           10    0    1    1   0   0/3     0.0     0/0   0.0
Domantas Barnes         2    0    1    0   0   0/0     0.0     0/0   0.0
Klay Haliburton         2    0    1    0   0   0/1     0.0     0/0   0.0
Yao Tatum               2    0    0    0   0   0/1     0.0     0/0   0.0

TEAM: FG: 9/18 (50.0%), 3PT: 3/6 (50.0%), REB: 10 (1 off, 9 def), AST: 4, TO: 4
TEAM FOULS: 5 [Team_028 in BONUS]

================================================================================

================================================================================
                       2ND QUARTER - Team_028 vs Team_060                       
================================================================================

[12:00] Team_028 possession (Score: 30-22)
Jimmy Brogdon drives, Jaren George stays with him. Jimmy Brogdon attempts a Dunk. Contested by Jaren George (3.4 feet, MAN). JIMMY BROGDON MAKES IT!
Score: 32-22

[11:44] Team_060 possession (Score: 32-22)
Larry Westbrook attempts a Midrange. Contested by Carmelo Carter (4.3 feet, ZONE). LARRY WESTBROOK MAKES IT!
Score: 32-24

[11:31] Team_028 possession (Score: 32-24)
Austin Russell attempts a Midrange. Wide open! Joel Morant is 6.6 feet away. [MAN] Austin Russell misses. Rebound secured by Jaren George.

[11:12] Team_060 possession (Score: 32-24)
Joel Morant drives, Kawhi Ball stays with him. Joel Morant attempts a Dunk. Contested by Kawhi Ball (6.0 feet, ZONE). JOEL MORANT MAKES IT! Assist: Julius Green
Score: 32-26

[11:00] Team_028 possession (Score: 32-26)
Myles Haliburton drives to the basket... FOUL! Offensive foul on Myles Haliburton! Jaren George drew the charge! [Team fouls: 1] (Myles Haliburton: 1 personal fouls) TURNOVER! (dead ball)

[10:44] Team_060 possession (Score: 32-26)
Joel Morant attempts a Midrange. Contested by Austin Russell (5.4 feet, MAN). JOEL MORANT MAKES IT! Assist: Julius Green
Score: 32-28

[10:28] Team_028 possession (Score: 32-28)
Carmelo Carter attempts a Layup. Wide open! Jaren George is 6.0 feet away. [ZONE] CARMELO CARTER MAKES IT!
Score: 34-28

[10:14] Team_060 possession (Score: 34-28)
Julius Green attempts a 3Pt. Heavily contested by Austin Russell (1.5 feet, ZONE)! Julius Green misses. Offensive rebound by Jaren George! Jaren George puts it back in!
Score: 34-30

[09:58] Team_028 possession (Score: 34-30)
Austin Russell drives to the basket... Austin Russell loses control! Ball rolls out of bounds! TURNOVER! (dead ball)

[09:58] Substitution (Team_028): Austin Russell OUT → Scottie Ingram IN (stamina_rule2)

[09:58] Substitution (Team_060): Joel Morant OUT → Domantas Barnes IN (stamina_rule2)

[09:58] Substitution (Team_060): Julius Green OUT → Rudy Ginobili IN (stamina_rule2)

[09:58] Substitution (Team_060): Larry Westbrook OUT → Yao Tatum IN (stamina_rule2)

[09:58] Substitution (Team_060): Jaren George OUT → Klay Haliburton IN (stamina_rule2)

[09:43] Team_060 possession (Score: 34-30)
Klay Haliburton drives and kicks out. Yao Tatum attempts a 3Pt. Contested by Kawhi Ball (3.7 feet, ZONE). Yao Tatum misses. Rebound secured by Kawhi Ball.

[09:25] Team_028 possession (Score: 34-30)
Jimmy Brogdon drives, picks up Klay Haliburton. Help arrives from Domantas Barnes! Jimmy Brogdon attempts a Dunk. Contested by Domantas Barnes (3.8 feet, MAN). JIMMY BROGDON MAKES IT! Assist: Myles Haliburton
Score: 36-30

[09:12] Team_060 possession (Score: 36-30)
Immanuel Ming attempts a 3Pt. Wide open! Carmelo Carter is 7.9 feet away. [ZONE] IMMANUEL MING MAKES IT! Assist: Domantas Barnes
Score: 36-33

[08:58] Team_028 possession (Score: 36-33)
Kawhi Ball attempts a 3Pt. Contested by Domantas Barnes (2.3 feet, ZONE). Kawhi Ball misses. FOUL! Loose ball foul on Immanuel Ming during the rebound battle. [Team fouls: 1] No free throws, side out. (Immanuel Ming: 1 personal fouls)

[08:40] Team_028 possession (Score: 36-33)
Carmelo Carter attempts a 3Pt. Contested by Domantas Barnes (4.9 feet, ZONE). Carmelo Carter misses. Rebound secured by Klay Haliburton.

[08:28] Team_060 possession (Score: 36-33)
FOUL! Reach-in foul on Kawhi Ball during the drive. [Team fouls: 2] No free throws, side out. (Kawhi Ball: 1 personal fouls)

[08:13] Team_060 possession (Score: 36-33)
Klay Haliburton drives and kicks out. Domantas Barnes attempts a 3Pt. Contested by Scottie Ingram (5.1 feet, MAN). Domantas Barnes misses. Rebound secured by Carmelo Carter.

[07:57] Team_028 possession (Score: 36-33)
Jimmy Brogdon drives to the basket... FOUL! Offensive foul on Jimmy Brogdon! Klay Haliburton drew the charge! [Team fouls: 3] (Jimmy Brogdon: 1 personal fouls) TURNOVER! (dead ball)

[07:40] Team_060 possession (Score: 36-33)
Klay Haliburton attempts a Layup. BLOCKED BY CARMELO CARTER! Ball is loose! Rebound secured by Carmelo Carter.

[07:27] Team_028 possession (Score: 36-33)
Kawhi Ball attempts a 3Pt. Contested by Yao Tatum (4.9 feet, MAN). Kawhi Ball misses. FOUL! Loose ball foul on Immanuel Ming during the rebound battle. [Team fouls: 2] No free throws, side out. (Immanuel Ming: 2 personal fouls)

[07:15] Team_028 possession (Score: 36-33)
Carmelo Carter attempts a 3Pt. Contested by Rudy Ginobili (4.8 feet, MAN). Carmelo Carter misses. Rebound secured by Domantas Barnes.

[07:00] Team_060 possession (Score: 36-33)
Rudy Ginobili attempts a Midrange. Contested by Carmelo Carter (4.9 feet, MAN). RUDY GINOBILI MAKES IT!
Score: 36-35

[06:47] Team_028 possession (Score: 36-35)
Scottie Ingram makes the Midrange and draws the foul on Yao Tatum! And-1! Scottie Ingram to the line for 1. [Team fouls: 3] (Yao Tatum: 1 personal fouls)   FT 1/1: MISS Scottie Ingram makes 0/1 from the line. Rebound secured by Klay Haliburton.
Score: 38-35

[06:37] Team_060 possession (Score: 38-35)
Yao Tatum drives to the basket... Yao Tatum loses control! Ball rolls out of bounds! TURNOVER! (dead ball)

[06:37] Substitution (Team_028): Carmelo Carter OUT → Tyrese Quickley IN (stamina_rule2)

[06:37] Substitution (Team_028): Myles Haliburton OUT → Miles Booker IN (stamina_rule2)

[06:37] Substitution (Team_028): Kawhi Ball OUT → Bam Towns IN (stamina_rule2)

[06:37] Substitution (Team_028): Jimmy Brogdon OUT → Collin Bridges IN (stamina_rule2)

[06:37] Substitution (Team_060): Immanuel Ming OUT → Jarrett Wagner IN (stamina_rule2)

[06:23] Team_028 possession (Score: 38-35)
Collin Bridges commits a violation (traveling/carry)! TURNOVER! (dead ball)

[06:06] Team_060 possession (Score: 38-35)
Domantas Barnes attempts a 3Pt. Contested by Scottie Ingram (4.9 feet, ZONE). DOMANTAS BARNES MAKES IT! Assist: Klay Haliburton
Score: 38-38

[05:54] Team_028 possession (Score: 38-38)
Collin Bridges drives and kicks out. Bam Towns attempts a Midrange. Wide open! Yao Tatum is 8.3 feet away. [MAN] Bam Towns misses. Rebound secured by Klay Haliburton.

[05:43] Team_060 possession (Score: 38-38)
Domantas Barnes attempts a Midrange. Wide open! Bam Towns is 6.6 feet away. [ZONE] Domantas Barnes misses. Rebound secured by Tyrese Quickley.

[05:27] Team_028 possession (Score: 38-38)
Collin Bridges drives to the basket... Collin Bridges commits a violation (traveling/carry)! TURNOVER! (dead ball)

[05:10] Team_060 possession (Score: 38-38)
Yao Tatum drives, Collin Bridges stays with him. Yao Tatum attempts a Dunk. Heavily contested by Collin Bridges (1.0 feet, MAN)! Yao Tatum misses. Rebound secured by Bam Towns.

[04:56] Team_028 possession (Score: 38-38)
Collin Bridges drives, Klay Haliburton stays with him. Collin Bridges attempts a Layup. Contested by Klay Haliburton (4.8 feet, MAN). COLLIN BRIDGES MAKES IT! Assist: Scottie Ingram
Score: 40-38

[04:42] Team_060 possession (Score: 40-38)
Rudy Ginobili attempts a Midrange. Wide open! Tyrese Quickley is 6.9 feet away. [MAN] Rudy Ginobili misses. Offensive rebound by Domantas Barnes! Domantas Barnes kicks it out.

[04:25] Team_060 possession (Score: 40-38)
Klay Haliburton attempts a Layup. Contested by Collin Bridges (3.2 feet, MAN). KLAY HALIBURTON MAKES IT! Assist: Yao Tatum
Score: 40-40

[04:08] Team_028 possession (Score: 40-40)
Tyrese Quickley drives to the basket... Tyrese Quickley throws a bad pass! Stolen by Klay Haliburton! TURNOVER! (live ball)

[03:53] Team_060 possession (Score: 40-40)
Domantas Barnes drives and kicks out. Jarrett Wagner attempts a 3Pt. Contested by Scottie Ingram (5.9 feet, ZONE). JARRETT WAGNER MAKES IT! Assist: Yao Tatum
Score: 40-43

[03:35] Team_028 possession (Score: 40-43)
Scottie Ingram drives, picks up Klay Haliburton. Help arrives from Domantas Barnes! Scottie Ingram attempts a Dunk. Heavily contested by Domantas Barnes (0.8 feet, ZONE)! Scottie Ingram misses. Rebound secured by Klay Haliburton.

[03:20] Team_060 possession (Score: 40-43)
Jarrett Wagner attempts a 3Pt. Contested by Scottie Ingram (3.1 feet, ZONE). Jarrett Wagner misses. Rebound secured by Tyrese Quickley.

[03:05] Team_028 possession (Score: 40-43)
Bam Towns attempts a 3Pt. Contested by Yao Tatum (5.9 feet, MAN). Bam Towns misses. Rebound secured by Domantas Barnes.

[02:49] Team_060 possession (Score: 40-43)
Jarrett Wagner attempts a Midrange. Contested by Miles Booker (3.3 feet, MAN). JARRETT WAGNER MAKES IT!
Score: 40-45

[02:33] Team_028 possession (Score: 40-45)
FOUL! Shooting foul on Jarrett Wagner. Collin Bridges to the line for 2 free throws. [Team fouls: 4] (Jarrett Wagner: 1 personal fouls)   FT 1/2: GOOD   FT 2/2: MISS Collin Bridges makes 1/2 from the line. Offensive rebound by Collin Bridges! Collin Bridges kicks it out.
Score: 41-45

[02:19] Team_028 possession (Score: 41-45)
Bam Towns attempts a Midrange. Contested by Rudy Ginobili (3.7 feet, ZONE). Bam Towns misses. Rebound secured by Klay Haliburton.

[02:02] Team_060 possession (Score: 41-45)
Domantas Barnes drives and kicks out. Klay Haliburton attempts a 3Pt. Contested by Collin Bridges (2.7 feet, MAN). Klay Haliburton misses. Rebound secured by Collin Bridges.

[01:52] Team_028 possession (Score: 41-45)
Bam Towns attempts a Layup. Contested by Yao Tatum (5.3 feet, MAN). Bam Towns misses. Rebound secured by Domantas Barnes.

[01:36] Team_060 possession (Score: 41-45)
Klay Haliburton attempts a Midrange. Contested by Collin Bridges (3.1 feet, MAN). KLAY HALIBURTON MAKES IT! Assist: Rudy Ginobili
Score: 41-47

[01:26] Team_028 possession (Score: 41-47)
Tyrese Quickley attempts a Layup. BLOCKED BY RUDY GINOBILI! Ball is loose! Rebound secured by Domantas Barnes.

[01:12] Team_060 possession (Score: 41-47)
Rudy Ginobili attempts a Midrange. Wide open! Tyrese Quickley is 7.2 feet away. [MAN] RUDY GINOBILI MAKES IT! Assist: Klay Haliburton
Score: 41-49

[00:53] Team_028 possession (Score: 41-49)
FOUL! Reach-in foul on Domantas Barnes during the drive. [IN THE BONUS! 5 team fouls] Scottie Ingram to the line for 2 free throws. (Domantas Barnes: 1 personal fouls)   FT 1/2: GOOD   FT 2/2: GOOD Scottie Ingram makes 2/2 from the line.
Score: 43-49

[00:38] Team_060 possession (Score: 43-49)
FOUL! Offensive foul on Domantas Barnes! Scottie Ingram drew the charge! [Team fouls: 6] (Domantas Barnes: 2 personal fouls) TURNOVER! (dead ball)

[00:26] Team_028 possession (Score: 43-49)
Tyrese Quickley attempts a 3Pt. Contested by Domantas Barnes (2.9 feet, ZONE). Tyrese Quickley misses. Rebound secured by Klay Haliburton.

[00:09] Team_060 possession (Score: 43-49)
Domantas Barnes makes the 3Pt and draws the foul on Scottie Ingram! And-1! Domantas Barnes to the line for 1. [Team fouls: 4] (Scottie Ingram: 1 personal fouls)   FT 1/1: GOOD Domantas Barnes makes 1/1 from the line.
Score: 43-53

================================================================================
                              2ND QUARTER COMPLETE                              
================================================================================

2ND QUARTER SCORE: Team_028 13, Team_060 31

BOX SCORE:
================================================================================

Team_028
--------------------------------------------------------------------------------
Player                MIN  PTS  REB  AST  TO      FG   FG%      3P   3P%
--------------------------------------------------------------------------------
Jimmy Brogdon          15    4    1    0   0   2/2   100.0     0/0   0.0
Carmelo Carter         15    2    2    0   0   1/3    33.3     0/0   0.0
Scottie Ingram         11    2    0    1   0   1/3    33.3     0/0   0.0
Collin Bridges          9    2    2    0   0   1/2    50.0     0/0   0.0
Austin Russell         13    0    0    0   0   0/1     0.0     0/0   0.0
Kawhi Ball             15    0    2    0   0   0/0     0.0     0/0   0.0
Myles Haliburton       16    0    0    1   0   0/0     0.0     0/0   0.0
Tyrese Quickley         9    0    2    0   0   0/2     0.0     0/0   0.0
Bam Towns               9    0    1    0   0   0/3     0.0     0/0   0.0

TEAM: FG: 5/16 (31.2%), 3PT: 0/4 (0.0%), REB: 10 (3 off, 7 def), AST: 2, TO: 6
TEAM FOULS: 4


Team_060
--------------------------------------------------------------------------------
Player                MIN  PTS  REB  AST  TO      FG   FG%      3P   3P%
--------------------------------------------------------------------------------
Domantas Barnes        12    7    5    1   0   2/4    50.0     0/0   0.0
Jarrett Wagner          8    5    0    0   0   2/3    66.7     0/0   0.0
Joel Morant            12    4    0    0   0   2/2   100.0     0/0   0.0
Klay Haliburton        12    4    6    2   0   2/5    40.0     0/0   0.0
Rudy Ginobili          11    4    0    1   0   2/2   100.0     0/0   0.0
Immanuel Ming          16    3    0    0   0   1/1   100.0     0/0   0.0
Larry Westbrook        12    2    0    0   0   1/1   100.0     0/0   0.0
Jaren George           12    2    2    0   0   1/1   100.0     0/0   0.0
Julius Green           13    0    0    2   0   0/0     0.0     0/0   0.0
Yao Tatum              12    0    0    2   0   0/1     0.0     0/0   0.0

TEAM: FG: 13/20 (65.0%), 3PT: 4/5 (80.0%), REB: 13 (2 off, 11 def), AST: 8, TO: 2
TEAM FOULS: 6 [Team_028 in BONUS]

================================================================================

================================================================================
                       3RD QUARTER - Team_028 vs Team_060                       
================================================================================

[12:00] Team_028 possession (Score: 43-53)
Carmelo Carter attempts a 3Pt. Contested by Julius Green (3.2 feet, MAN). Carmelo Carter misses. Rebound secured by Jaren George.

[11:49] Team_060 possession (Score: 43-53)
Joel Morant attempts a 3Pt. Heavily contested by Carmelo Carter (1.0 feet, ZONE)! JOEL MORANT MAKES IT! Assist: Julius Green
Score: 43-56

[11:35] Team_028 possession (Score: 43-56)
Kawhi Ball attempts a Layup. Contested by Jaren George (3.8 feet, ZONE). KAWHI BALL MAKES IT! Assist: Austin Russell
Score: 45-56

[11:18] Team_060 possession (Score: 45-56)
FOUL! Shooting foul on Jimmy Brogdon. Jaren George to the line for 2 free throws. [Team fouls: 1] (Jimmy Brogdon: 1 personal fouls)   FT 1/2: GOOD   FT 2/2: GOOD Jaren George makes 2/2 from the line.
Score: 45-58

[11:06] Team_028 possession (Score: 45-58)
Jimmy Brogdon drives, picks up Jaren George. Help arrives from Julius Green! Jimmy Brogdon attempts a Layup. Wide open! Julius Green is 6.1 feet away. [MAN] JIMMY BROGDON MAKES IT!
Score: 47-58

[10:55] Team_060 possession (Score: 47-58)
Julius Green drives to the basket... Julius Green throws a bad pass! Stolen by Kawhi Ball! TURNOVER! (live ball)

[10:42] Team_028 possession (Score: 47-58)
Myles Haliburton attempts a 3Pt. Contested by Immanuel Ming (2.8 feet, ZONE). MYLES HALIBURTON MAKES IT! Assist: Austin Russell
Score: 50-58

[10:31] Team_060 possession (Score: 50-58)
FOUL! Shooting foul on Myles Haliburton. Immanuel Ming to the line for 2 free throws. [Team fouls: 2] (Myles Haliburton: 1 personal fouls)   FT 1/2: GOOD   FT 2/2: GOOD Immanuel Ming makes 2/2 from the line.
Score: 50-60

[10:16] Team_028 possession (Score: 50-60)
Austin Russell attempts a 3Pt. Contested by Julius Green (2.5 feet, ZONE). AUSTIN RUSSELL MAKES IT! Assist: Myles Haliburton
Score: 53-60

[10:04] Team_060 possession (Score: 53-60)
Immanuel Ming attempts a Midrange. Contested by Carmelo Carter (3.1 feet, ZONE). IMMANUEL MING MAKES IT! Assist: Joel Morant
Score: 53-62

[09:51] Team_028 possession (Score: 53-62)
Jimmy Brogdon attempts a Midrange. Wide open! Jaren George is 8.8 feet away. [MAN] Jimmy Brogdon misses. FOUL! Loose ball foul on Immanuel Ming during the rebound battle. [Team fouls: 1] No free throws, side out. (Immanuel Ming: 1 personal fouls)

[09:37] Team_028 possession (Score: 53-62)
Carmelo Carter attempts a 3Pt. Contested by Julius Green (5.2 feet, MAN). Carmelo Carter misses. Rebound secured by Jaren George.

[09:21] Team_060 possession (Score: 53-62)
Joel Morant attempts a Midrange. Heavily contested by Myles Haliburton (1.9 feet, ZONE)! Joel Morant misses. Rebound secured by Kawhi Ball.

[09:09] Team_028 possession (Score: 53-62)
FOUL! Holding foul on Immanuel Ming. [Team fouls: 2] No free throws, side out. (Immanuel Ming: 2 personal fouls)

[08:55] Team_028 possession (Score: 53-62)
Jimmy Brogdon attempts a Layup. Contested by Jaren George (5.8 feet, ZONE). Jimmy Brogdon misses. Rebound secured by Jaren George.

[08:36] Team_060 possession (Score: 53-62)
Jaren George drives, picks up Jimmy Brogdon. Help arrives from Carmelo Carter! Jaren George attempts a Layup. Wide open! Carmelo Carter is 6.2 feet away. [MAN] JAREN GEORGE MAKES IT!
Score: 53-64

[08:22] Team_028 possession (Score: 53-64)
Austin Russell attempts a Layup. BLOCKED BY JAREN GEORGE! Ball deflects out of bounds off Austin Russell.

[08:04] Team_060 possession (Score: 53-64)
Julius Green attempts a 3Pt. Contested by Carmelo Carter (3.2 feet, MAN). Julius Green misses. FOUL! Loose ball foul on Carmelo Carter during the rebound battle. [Team fouls: 3] No free throws, side out. (Carmelo Carter: 1 personal fouls)

[07:50] Team_060 possession (Score: 53-64)
Julius Green attempts a Layup. Contested by Kawhi Ball (4.0 feet, ZONE). JULIUS GREEN MAKES IT!
Score: 53-66

[07:35] Team_028 possession (Score: 53-66)
Myles Haliburton attempts a Midrange. Contested by Immanuel Ming (3.3 feet, MAN). MYLES HALIBURTON MAKES IT! Assist: Austin Russell
Score: 55-66

[07:21] Team_060 possession (Score: 55-66)
Julius Green attempts a 3Pt. Contested by Austin Russell (5.9 feet, ZONE). Julius Green misses. Rebound secured by Carmelo Carter.

[07:04] Team_028 possession (Score: 55-66)
Kawhi Ball drives, picks up Larry Westbrook. Help arrives from Julius Green! Kawhi Ball attempts a Dunk. Wide open! Julius Green is 6.1 feet away. [MAN] KAWHI BALL MAKES IT!
Score: 57-66

[06:51] Team_060 possession (Score: 57-66)
FOUL! Shooting foul on Carmelo Carter. Julius Green to the line for 2 free throws. [Team fouls: 4] (Carmelo Carter: 2 personal fouls)   FT 1/2: GOOD   FT 2/2: MISS Julius Green makes 1/2 from the line. Rebound secured by Jimmy Brogdon.
Score: 57-67

[06:40] Team_028 possession (Score: 57-67)
Myles Haliburton drives, picks up Jaren George. Help arrives from Julius Green! Myles Haliburton attempts a Layup. Wide open! Julius Green is 7.3 feet away. [ZONE] Myles Haliburton misses. Offensive rebound by Kawhi Ball! Kawhi Ball kicks it out.

[06:26] Team_028 possession (Score: 57-67)
Carmelo Carter attempts a Layup. Contested by Jaren George (5.1 feet, ZONE). CARMELO CARTER MAKES IT! Assist: Austin Russell
Score: 59-67

[06:12] Team_060 possession (Score: 59-67)
Immanuel Ming attempts a 3Pt. Contested by Austin Russell (3.0 feet, ZONE). Immanuel Ming misses. Rebound secured by Kawhi Ball.

[05:56] Team_028 possession (Score: 59-67)
Carmelo Carter attempts a Midrange. Contested by Julius Green (3.0 feet, ZONE). CARMELO CARTER MAKES IT!
Score: 61-67

[05:42] Team_060 possession (Score: 61-67)
Jaren George attempts a 3Pt. Wide open! Jimmy Brogdon is 6.0 feet away. [MAN] Jaren George misses. Offensive rebound by Immanuel Ming! Immanuel Ming kicks it out.

[05:29] Team_060 possession (Score: 61-67)
Julius Green attempts a Midrange. Contested by Carmelo Carter (2.7 feet, MAN). JULIUS GREEN MAKES IT!
Score: 61-69

[05:15] Team_028 possession (Score: 61-69)
Austin Russell attempts a 3Pt. Contested by Joel Morant (4.7 feet, MAN). Austin Russell misses. Rebound secured by Immanuel Ming.

[05:03] Team_060 possession (Score: 61-69)
Joel Morant drives and kicks out. Jaren George attempts a 3Pt. Contested by Jimmy Brogdon (5.5 feet, MAN). JAREN GEORGE MAKES IT! Assist: Immanuel Ming
Score: 61-72

[04:51] Team_028 possession (Score: 61-72)
Kawhi Ball attempts a 3Pt. Contested by Larry Westbrook (3.0 feet, MAN). Kawhi Ball misses. Offensive rebound by Kawhi Ball! Kawhi Ball kicks it out.

[04:35] Team_028 possession (Score: 61-72)
Jimmy Brogdon drives, Larry Westbrook stays with him. Jimmy Brogdon attempts a Layup. Contested by Larry Westbrook (4.7 feet, ZONE). JIMMY BROGDON MAKES IT! Assist: Myles Haliburton
Score: 63-72

[04:23] Team_060 possession (Score: 63-72)
Julius Green attempts a Layup. BLOCKED BY CARMELO CARTER! Ball is loose! Offensive rebound by Immanuel Ming! Immanuel Ming kicks it out.

[04:09] Team_060 possession (Score: 63-72)
Jaren George loses control! Ball rolls out of bounds! TURNOVER! (dead ball)

[03:58] Team_028 possession (Score: 63-72)
Myles Haliburton attempts a 3Pt. Contested by Immanuel Ming (4.5 feet, MAN). Myles Haliburton misses. Rebound secured by Immanuel Ming.

[03:40] Team_060 possession (Score: 63-72)
Julius Green attempts a 3Pt. Contested by Myles Haliburton (2.6 feet, ZONE). Julius Green misses. Rebound secured by Carmelo Carter.

[03:26] Team_028 possession (Score: 63-72)
Kawhi Ball drives, Larry Westbrook stays with him. Kawhi Ball attempts a Layup. Wide open! Larry Westbrook is 6.6 feet away. [MAN] KAWHI BALL MAKES IT! Assist: Carmelo Carter
Score: 65-72

[03:15] Team_060 possession (Score: 65-72)
Larry Westbrook attempts a 3Pt. Contested by Myles Haliburton (5.1 feet, ZONE). LARRY WESTBROOK MAKES IT! Assist: Jaren George
Score: 65-75

[03:02] Team_028 possession (Score: 65-75)
Jimmy Brogdon drives, Jaren George stays with him. Jimmy Brogdon attempts a Dunk. Contested by Jaren George (5.6 feet, ZONE). JIMMY BROGDON MAKES IT!
Score: 67-75

[02:47] Team_060 possession (Score: 67-75)
Jaren George attempts a Midrange. Contested by Carmelo Carter (5.5 feet, ZONE). Jaren George misses. Offensive rebound by Jaren George! Jaren George puts it back in!
Score: 67-77

[02:35] Team_028 possession (Score: 67-77)
Jimmy Brogdon attempts a Midrange. Heavily contested by Julius Green (1.9 feet, ZONE)! Jimmy Brogdon misses. Rebound secured by Larry Westbrook.

[02:23] Team_060 possession (Score: 67-77)
Julius Green attempts a Layup. Heavily contested by Kawhi Ball (1.8 feet, ZONE)! Julius Green misses. Rebound secured by Kawhi Ball.

[02:08] Team_028 possession (Score: 67-77)
Myles Haliburton attempts a Midrange. Wide open! Immanuel Ming is 6.1 feet away. [ZONE] Myles Haliburton misses. Rebound secured by Immanuel Ming.

[01:57] Team_060 possession (Score: 67-77)
Jaren George makes the Dunk and draws the foul on Kawhi Ball! And-1! Jaren George to the line for 1. [BONUS: 5 team fouls] (Kawhi Ball: 1 personal fouls)   FT 1/1: GOOD Jaren George makes 1/1 from the line.
Score: 67-80

[01:43] Team_028 possession (Score: 67-80)
Myles Haliburton attempts a 3Pt. Wide open! Immanuel Ming is 7.1 feet away. [MAN] Myles Haliburton misses. Rebound secured by Immanuel Ming.

[01:29] Team_060 possession (Score: 67-80)
Julius Green attempts a 3Pt. Contested by Austin Russell (4.4 feet, ZONE). Julius Green misses. Offensive rebound by Immanuel Ming! Immanuel Ming kicks it out.

[01:13] Team_060 possession (Score: 67-80)
Joel Morant attempts a 3Pt. Heavily contested by Austin Russell (0.5 feet, MAN)! JOEL MORANT MAKES IT! Assist: Larry Westbrook
Score: 67-83

[00:58] Team_028 possession (Score: 67-83)
Kawhi Ball attempts a 3Pt. Contested by Larry Westbrook (3.6 feet, MAN). Kawhi Ball misses. Rebound secured by Jaren George.

[00:41] Team_060 possession (Score: 67-83)
Immanuel Ming makes the Midrange and draws the foul on Myles Haliburton! And-1! Immanuel Ming to the line for 1. [BONUS: 6 team fouls] (Myles Haliburton: 2 personal fouls)   FT 1/1: GOOD Immanuel Ming makes 1/1 from the line.
Score: 67-86

[00:24] Team_028 possession (Score: 67-86)
Carmelo Carter drives and kicks out. Kawhi Ball attempts a 3Pt. Contested by Julius Green (4.5 feet, ZONE). Kawhi Ball misses. FOUL! Loose ball foul on Jaren George during the rebound battle. [Team fouls: 3] No free throws, side out. (Jaren George: 1 personal fouls)

[00:12] Team_028 possession (Score: 67-86)
Austin Russell attempts a Layup. Contested by Joel Morant (4.7 feet, MAN). AUSTIN RUSSELL MAKES IT! Assist: Kawhi Ball
Score: 69-86

================================================================================
                              3RD QUARTER COMPLETE                              
================================================================================

3RD QUARTER SCORE: Team_028 26, Team_060 33

BOX SCORE:
================================================================================

Team_028
--------------------------------------------------------------------------------
Player                MIN  PTS  REB  AST  TO      FG   FG%      3P   3P%
--------------------------------------------------------------------------------
Kawhi Ball             28    6    6    1   0   3/4    75.0     0/0   0.0
Jimmy Brogdon          28    6    2    0   0   3/5    60.0     0/0   0.0
Austin Russell         25    5    0    4   0   2/4    50.0     0/0   0.0
Myles Haliburton       29    5    0    2   0   2/5    40.0     0/0   0.0
Carmelo Carter         28    4    2    1   0   2/4    50.0     0/0   0.0

TEAM: FG: 12/22 (54.5%), 3PT: 2/8 (25.0%), REB: 10 (4 off, 6 def), AST: 8, TO: 0
TEAM FOULS: 6 [Team_060 in BONUS]


Team_060
--------------------------------------------------------------------------------
Player                MIN  PTS  REB  AST  TO      FG   FG%      3P   3P%
--------------------------------------------------------------------------------
Jaren George           24   12    5    1   0   5/5   100.0     0/0   0.0
Immanuel Ming          29    7    8    1   0   3/4    75.0     0/0   0.0
Joel Morant            24    6    0    1   0   2/3    66.7     0/0   0.0
Julius Green           25    4    0    1   0   2/6    33.3     0/0   0.0
Larry Westbrook        24    3    1    1   0   1/1   100.0     0/0   0.0

TEAM: FG: 13/19 (68.4%), 3PT: 3/6 (50.0%), REB: 14 (5 off, 9 def), AST: 5, TO: 2
TEAM FOULS: 3

================================================================================

================================================================================
                       4TH QUARTER - Team_028 vs Team_060                       
================================================================================

[12:00] Substitution (Team_028): Austin Russell OUT (stamina: 69) → Scottie Ingram IN (comeback_detected)

[12:00] Substitution (Team_060): Joel Morant OUT (stamina: 65) → Domantas Barnes IN (comeback_detected)

[12:00] Team_028 possession (Score: 69-86)
Carmelo Carter attempts a 3Pt. Contested by Domantas Barnes (5.9 feet, ZONE). CARMELO CARTER MAKES IT! Assist: Kawhi Ball
Score: 72-86

[11:43] Team_060 possession (Score: 72-86)
Julius Green makes the Midrange and draws the foul on Myles Haliburton! And-1! Julius Green to the line for 1. [Team fouls: 1] (Myles Haliburton: 1 personal fouls)   FT 1/1: GOOD Julius Green makes 1/1 from the line.
Score: 72-89

[11:29] Team_028 possession (Score: 72-89)
Scottie Ingram attempts a Midrange. Contested by Immanuel Ming (4.4 feet, ZONE). Scottie Ingram misses. Rebound secured by Immanuel Ming.

[11:14] Team_060 possession (Score: 72-89)
Immanuel Ming makes the Layup and draws the foul on Kawhi Ball! And-1! Immanuel Ming to the line for 1. [Team fouls: 2] (Kawhi Ball: 1 personal fouls)   FT 1/1: GOOD Immanuel Ming makes 1/1 from the line.
Score: 72-92

[10:59] Team_028 possession (Score: 72-92)
Carmelo Carter attempts a 3Pt. Contested by Domantas Barnes (3.0 feet, ZONE). Carmelo Carter misses. Rebound secured by Immanuel Ming.

[10:48] Team_060 possession (Score: 72-92)
Larry Westbrook drives, Kawhi Ball stays with him. Larry Westbrook attempts a Dunk. Wide open! Kawhi Ball is 10.0 feet away. [MAN] LARRY WESTBROOK MAKES IT! Assist: Julius Green
Score: 72-94

[10:33] Team_028 possession (Score: 72-94)
Scottie Ingram drives and kicks out. Kawhi Ball attempts a 3Pt. Wide open! Larry Westbrook is 6.3 feet away. [MAN] Kawhi Ball misses. Rebound secured by Jaren George.

[10:19] Team_060 possession (Score: 72-94)
Larry Westbrook drives, Kawhi Ball stays with him. Larry Westbrook attempts a Dunk. Wide open! Kawhi Ball is 6.8 feet away. [MAN] Larry Westbrook misses. Rebound secured by Jimmy Brogdon.

[10:00] Team_028 possession (Score: 72-94)
Jimmy Brogdon attempts a Layup. BLOCKED BY JAREN GEORGE! Ball is loose! Rebound secured by Domantas Barnes.

[09:45] Team_060 possession (Score: 72-94)
Domantas Barnes attempts a Layup. Contested by Scottie Ingram (5.1 feet, MAN). Domantas Barnes misses. Rebound secured by Jimmy Brogdon.

[09:34] Team_028 possession (Score: 72-94)
Scottie Ingram attempts a 3Pt. Contested by Larry Westbrook (5.3 feet, ZONE). Scottie Ingram misses. Rebound secured by Immanuel Ming.

[09:14] Team_060 possession (Score: 72-94)
Larry Westbrook attempts a 3Pt. Contested by Scottie Ingram (5.3 feet, ZONE). Larry Westbrook misses. Rebound secured by Jimmy Brogdon.

[08:58] Team_028 possession (Score: 72-94)
Jimmy Brogdon attempts a Layup. Contested by Jaren George (3.5 feet, MAN). JIMMY BROGDON MAKES IT!
Score: 74-94

[08:41] Team_060 possession (Score: 74-94)
Immanuel Ming attempts a Layup. Wide open! Kawhi Ball is 8.3 feet away. [ZONE] IMMANUEL MING MAKES IT! Assist: Domantas Barnes
Score: 74-96

[08:26] Team_028 possession (Score: 74-96)
Jimmy Brogdon drives, Jaren George stays with him. Jimmy Brogdon attempts a Layup. Contested by Jaren George (4.4 feet, MAN). JIMMY BROGDON MAKES IT! Assist: Kawhi Ball
Score: 76-96

[08:15] Team_060 possession (Score: 76-96)
Domantas Barnes drives and kicks out. Julius Green attempts a 3Pt. Contested by Carmelo Carter (5.6 feet, MAN). Julius Green misses. Rebound secured by Jimmy Brogdon.

[08:05] Team_028 possession (Score: 76-96)
Scottie Ingram attempts a 3Pt. Contested by Domantas Barnes (3.4 feet, ZONE). SCOTTIE INGRAM MAKES IT! Assist: Carmelo Carter
Score: 79-96

[07:48] Team_060 possession (Score: 79-96)
Jaren George attempts a Layup. BLOCKED BY KAWHI BALL! Ball is loose! Offensive rebound by Domantas Barnes! Domantas Barnes kicks it out.

[07:35] Team_060 possession (Score: 79-96)
Jaren George drives and kicks out. Jaren George attempts a 3Pt. Wide open! Jimmy Brogdon is 7.0 feet away. [MAN] JAREN GEORGE MAKES IT!
Score: 79-99

[07:25] Team_028 possession (Score: 79-99)
FOUL! Shooting foul on Domantas Barnes. Carmelo Carter to the line for 2 free throws. [Team fouls: 1] (Domantas Barnes: 1 personal fouls)   FT 1/2: GOOD   FT 2/2: MISS Carmelo Carter makes 1/2 from the line. Offensive rebound by Jimmy Brogdon! Jimmy Brogdon kicks it out.
Score: 80-99

[07:08] Team_028 possession (Score: 80-99)
Scottie Ingram drives, Domantas Barnes stays with him. Scottie Ingram attempts a Layup. Contested by Domantas Barnes (4.0 feet, MAN). SCOTTIE INGRAM MAKES IT!
Score: 82-99

[06:54] Team_060 possession (Score: 82-99)
Jaren George drives, Jimmy Brogdon stays with him. Jaren George attempts a Dunk. Wide open! Jimmy Brogdon is 8.1 feet away. [MAN] JAREN GEORGE MAKES IT! Assist: Domantas Barnes
Score: 82-101

[06:39] Team_028 possession (Score: 82-101)
Kawhi Ball makes the Dunk and draws the foul on Larry Westbrook! And-1! Kawhi Ball to the line for 1. [Team fouls: 2] (Larry Westbrook: 1 personal fouls)   FT 1/1: GOOD Kawhi Ball makes 1/1 from the line.
Score: 85-101

[06:30] Team_060 possession (Score: 85-101)
Immanuel Ming attempts a 3Pt. Contested by Scottie Ingram (5.5 feet, ZONE). Immanuel Ming misses. Rebound secured by Carmelo Carter.

[06:15] Team_028 possession (Score: 85-101)
Carmelo Carter attempts a Layup. Contested by Julius Green (4.2 feet, MAN). CARMELO CARTER MAKES IT!
Score: 87-101

[06:00] Team_060 possession (Score: 87-101)
Larry Westbrook attempts a 3Pt. Wide open! Scottie Ingram is 6.9 feet away. [ZONE] Larry Westbrook misses. Rebound secured by Carmelo Carter.

[05:48] Team_028 possession (Score: 87-101)
Myles Haliburton attempts a Midrange. Contested by Domantas Barnes (3.5 feet, ZONE). Myles Haliburton misses. Rebound secured by Jaren George.

[05:39] Team_060 possession (Score: 87-101)
Jaren George drives and kicks out. Immanuel Ming attempts a Midrange. Contested by Carmelo Carter (5.9 feet, ZONE). IMMANUEL MING MAKES IT! Assist: Domantas Barnes
Score: 87-103

[05:27] Team_028 possession (Score: 87-103)
Scottie Ingram drives and kicks out. Carmelo Carter attempts a 3Pt. Contested by Domantas Barnes (3.8 feet, ZONE). Carmelo Carter misses. Offensive rebound by Jimmy Brogdon! Jimmy Brogdon kicks it out.

[05:15] Team_028 possession (Score: 87-103)
Kawhi Ball attempts a Midrange. Wide open! Larry Westbrook is 9.3 feet away. [MAN] Kawhi Ball misses. Rebound secured by Immanuel Ming.

[04:59] Team_060 possession (Score: 87-103)
Jaren George commits a violation (traveling/carry)! TURNOVER! (dead ball)

[04:59] Substitution (Team_028): Carmelo Carter OUT → Tyrese Quickley IN (stamina_rule2)

[04:59] Substitution (Team_028): Myles Haliburton OUT → Miles Booker IN (stamina_rule2)

[04:59] Substitution (Team_028): Kawhi Ball OUT → Bam Towns IN (stamina_rule2)

[04:59] Substitution (Team_028): Jimmy Brogdon OUT → Collin Bridges IN (stamina_rule2)

[04:59] Substitution (Team_060): Julius Green OUT → Rudy Ginobili IN (stamina_rule2)

[04:59] Substitution (Team_060): Immanuel Ming OUT → Jarrett Wagner IN (stamina_rule2)

[04:59] Substitution (Team_060): Larry Westbrook OUT → Yao Tatum IN (stamina_rule2)

[04:59] Substitution (Team_060): Jaren George OUT → Klay Haliburton IN (stamina_rule2)

[04:44] Team_028 possession (Score: 87-103)
FOUL! Shooting foul on Rudy Ginobili. Tyrese Quickley to the line for 3 free throws. [Team fouls: 3] (Rudy Ginobili: 1 personal fouls)   FT 1/3: GOOD   FT 2/3: MISS   FT 3/3: GOOD Tyrese Quickley makes 2/3 from the line.
Score: 89-103

[04:30] Team_060 possession (Score: 89-103)
Rudy Ginobili drives, Tyrese Quickley stays with him. Rudy Ginobili attempts a Dunk. Contested by Tyrese Quickley (3.8 feet, MAN). RUDY GINOBILI MAKES IT! Assist: Jarrett Wagner
Score: 89-105

[04:16] Team_028 possession (Score: 89-105)
Collin Bridges attempts a Midrange. Contested by Yao Tatum (5.6 feet, ZONE). Collin Bridges misses. Rebound secured by Rudy Ginobili.

[04:01] Team_060 possession (Score: 89-105)
Jarrett Wagner attempts a Midrange. Contested by Bam Towns (2.8 feet, ZONE). Jarrett Wagner misses. Rebound secured by Collin Bridges.

[03:46] Team_028 possession (Score: 89-105)
Scottie Ingram attempts a Midrange. Contested by Yao Tatum (5.7 feet, ZONE). SCOTTIE INGRAM MAKES IT!
Score: 91-105

[03:33] Team_060 possession (Score: 91-105)
Klay Haliburton throws a bad pass! Stolen by Collin Bridges! TURNOVER! (live ball)

[03:18] Team_028 possession (Score: 91-105)
Scottie Ingram attempts a 3Pt. Contested by Domantas Barnes (4.2 feet, MAN). SCOTTIE INGRAM MAKES IT! Assist: Tyrese Quickley
Score: 94-105

[03:05] Team_060 possession (Score: 94-105)
Klay Haliburton drives, picks up Collin Bridges. Help arrives from Tyrese Quickley! Klay Haliburton attempts a Dunk. Contested by Tyrese Quickley (5.6 feet, ZONE). Klay Haliburton misses. Rebound secured by Bam Towns.

[02:50] Team_028 possession (Score: 94-105)
Bam Towns drives, picks up Klay Haliburton. Help arrives from Domantas Barnes! Bam Towns attempts a Layup. Contested by Domantas Barnes (4.8 feet, ZONE). BAM TOWNS MAKES IT! Assist: Miles Booker
Score: 96-105

[02:39] Team_060 possession (Score: 96-105)
Jarrett Wagner drives, picks up Miles Booker. Help arrives from Tyrese Quickley! Jarrett Wagner attempts a Layup. Wide open! Tyrese Quickley is 7.0 feet away. [MAN] JARRETT WAGNER MAKES IT!
Score: 96-107

[02:26] Team_028 possession (Score: 96-107)
Miles Booker attempts a Layup. Contested by Klay Haliburton (3.7 feet, ZONE). Miles Booker misses. Offensive rebound by Collin Bridges! Collin Bridges kicks it out.

[02:13] Team_028 possession (Score: 96-107)
Collin Bridges attempts a Layup. Contested by Klay Haliburton (4.2 feet, ZONE). COLLIN BRIDGES MAKES IT! Assist: Bam Towns
Score: 98-107

[01:55] Team_060 possession (Score: 98-107)
Jarrett Wagner attempts a Midrange. Contested by Miles Booker (4.1 feet, ZONE). JARRETT WAGNER MAKES IT! Assist: Rudy Ginobili
Score: 98-109

[01:44] Team_028 possession (Score: 98-109)
Miles Booker attempts a 3Pt. Contested by Domantas Barnes (4.3 feet, ZONE). Miles Booker misses. Rebound secured by Klay Haliburton.

[01:29] Team_060 possession (Score: 98-109)
Rudy Ginobili attempts a Midrange. Wide open! Tyrese Quickley is 6.3 feet away. [ZONE] Rudy Ginobili misses. Rebound secured by Bam Towns.

[01:15] Team_028 possession (Score: 98-109)
Miles Booker makes the Layup and draws the foul on Jarrett Wagner! And-1! Miles Booker to the line for 1. [Team fouls: 4] (Jarrett Wagner: 1 personal fouls)   FT 1/1: GOOD Miles Booker makes 1/1 from the line.
Score: 101-109

[01:00] Team_060 possession (Score: 101-109)
Rudy Ginobili attempts a 3Pt. Wide open! Tyrese Quickley is 6.1 feet away. [MAN] RUDY GINOBILI MAKES IT! Assist: Yao Tatum
Score: 101-112

[00:43] Team_028 possession (Score: 101-112)
Scottie Ingram attempts a Midrange. Contested by Domantas Barnes (3.4 feet, MAN). Scottie Ingram misses. Rebound secured by Klay Haliburton.

[00:32] Team_060 possession (Score: 101-112)
Domantas Barnes drives and kicks out. Rudy Ginobili attempts a Midrange. Contested by Tyrese Quickley (5.1 feet, MAN). Rudy Ginobili misses. Rebound secured by Collin Bridges.

[00:18] Team_028 possession (Score: 101-112)
Tyrese Quickley attempts a Layup. BLOCKED BY KLAY HALIBURTON! Ball deflects out of bounds off Tyrese Quickley.

[00:01] Team_060 possession (Score: 101-112)
Jarrett Wagner drives, picks up Collin Bridges. Help arrives from Tyrese Quickley! Jarrett Wagner attempts a Layup. Contested by Tyrese Quickley (3.9 feet, ZONE). JARRETT WAGNER MAKES IT! Assist: Domantas Barnes
Score: 101-114

================================================================================
                              4TH QUARTER COMPLETE                              
================================================================================

4TH QUARTER SCORE: Team_028 32, Team_060 28

BOX SCORE:
================================================================================

Team_028
--------------------------------------------------------------------------------
Player                MIN  PTS  REB  AST  TO      FG   FG%      3P   3P%
--------------------------------------------------------------------------------
Scottie Ingram         23   10    0    0   0   4/8    50.0     0/0   0.0
Carmelo Carter         35    5    2    1   0   2/3    66.7     0/0   0.0
Jimmy Brogdon          35    4    6    0   0   2/3    66.7     0/0   0.0
Kawhi Ball             35    3    0    2   0   1/2    50.0     0/0   0.0
Miles Booker           13    3    0    1   0   1/2    50.0     0/0   0.0
Tyrese Quickley        14    2    0    1   0   1/2    50.0     0/0   0.0
Collin Bridges         14    2    3    0   0   1/2    50.0     0/0   0.0
Bam Towns              14    2    2    1   0   1/1   100.0     0/0   0.0
Myles Haliburton       36    0    0    0   0   0/1     0.0     0/0   0.0

TEAM: FG: 13/24 (54.2%), 3PT: 4/7 (57.1%), REB: 13 (3 off, 10 def), AST: 6, TO: 0
TEAM FOULS: 2


Team_060
--------------------------------------------------------------------------------
Player                MIN  PTS  REB  AST  TO      FG   FG%      3P   3P%
--------------------------------------------------------------------------------
Immanuel Ming          36    7    4    0   0   3/4    75.0     0/0   0.0
Jarrett Wagner         13    6    0    1   0   3/4    75.0     0/0   0.0
Jaren George           31    5    2    0   0   2/2   100.0     0/0   0.0
Rudy Ginobili          16    5    1    1   0   2/3    66.7     0/0   0.0
Julius Green           32    3    0    1   0   1/1   100.0     0/0   0.0
Larry Westbrook        31    2    0    0   0   1/4    25.0     0/0   0.0
Domantas Barnes        24    0    2    4   0   0/3     0.0     0/0   0.0
Klay Haliburton        17    0    2    0   0   0/1     0.0     0/0   0.0
Yao Tatum              17    0    0    1   0   0/0     0.0     0/0   0.0

TEAM: FG: 12/22 (54.5%), 3PT: 1/4 (25.0%), REB: 11 (1 off, 10 def), AST: 8, TO: 2
TEAM FOULS: 4

================================================================================

================================================================================
                               FULL GAME COMPLETE                               
================================================================================

FINAL SCORE: Team_028 101, Team_060 114

SCORING BY QUARTER:
--------------------------------------------------------------------------------
Team                     Q1     Q2     Q3     Q4    FINAL
--------------------------------------------------------------------------------
Team_028                 30     13     26     32      101
Team_060                 22     31     33     28      114
--------------------------------------------------------------------------------

FULL GAME BOX SCORE:
================================================================================

Team_028
--------------------------------------------------------------------------------
Player                MIN  PTS  REB  AST  TO      FG   FG%      3P   3P%      FT STL BLK
--------------------------------------------------------------------------------
Myles Haliburton       36   15    0    6   2   6/13   46.2   3/7    42.9   3/3     0   0
Carmelo Carter         35   13    7    3   0   7/15   46.7   1/9    11.1   1/2     0   2
Kawhi Ball             35   12    8    4   1   5/8    62.5   1/3    33.3   2/3     1   2
Jimmy Brogdon          35   17   17    0   2   7/10   70.0   0/0     0.0   0/0     0   0
Austin Russell         25   10    0    5   0   4/7    57.1   2/3    66.7   0/0     0   0
Scottie Ingram         23   14    0    1   0   6/12   50.0   2/3    66.7   4/5     0   0
Tyrese Quickley        14    2    2    1   1   1/5    20.0   1/3    33.3   2/3     0   0
Bam Towns              14    4    5    2   1   2/6    33.3   0/2     0.0   0/0     0   0
Collin Bridges         14    6    5    1   1   3/5    60.0   0/0     0.0   1/2     1   0
Miles Booker           13    3    0    1   0   1/2    50.0   0/1     0.0   1/1     0   0

TEAM: FG: 42/83 (50.6%), 3PT: 10/31 (32.3%), REB: 44 (12 off, 32 def), AST: 24, TO: 8


Team_060
--------------------------------------------------------------------------------
Player                MIN  PTS  REB  AST  TO      FG   FG%      3P   3P%      FT STL BLK
--------------------------------------------------------------------------------
Immanuel Ming          36   26   16    1   3  10/13   76.9   2/5    40.0   7/7     0   1
Julius Green           32   13    0    6   0   6/10   60.0   2/4    50.0   3/4     0   0
Larry Westbrook        31   14    4    2   0   6/11   54.5   2/4    50.0   0/0     1   0
Jaren George           31   19   10    2   4   7/10   70.0   0/1     0.0   3/3     0   2
Domantas Barnes        24    7    8    5   1   3/8    37.5   2/2   100.0   1/1     0   0
Joel Morant            24   10    0    1   1   5/7    71.4   2/2   100.0   0/0     0   0
Yao Tatum              17    0    0    3   0   0/2     0.0   0/1     0.0   0/0     0   0
Klay Haliburton        17    4    9    2   1   2/7    28.6   0/0     0.0   0/0     1   1
Rudy Ginobili          16    9    1    2   0   4/5    80.0   1/1   100.0   0/0     0   1
Jarrett Wagner         13   11    0    1   0   4/6    66.7   0/1     0.0   0/0     0   0

TEAM: FG: 47/79 (59.5%), 3PT: 11/21 (52.4%), REB: 48 (9 off, 39 def), AST: 25, TO: 10

================================================================================
