================================================================================
                        FULL GAME - Team_065 vs Team_004                        
================================================================================

================================================================================
                       1ST QUARTER - Team_065 vs Team_004                       
================================================================================

[12:00] Team_065 possession (Score: 0-0)
Manu McGrady attempts a Layup. Wide open! Dwyane Irving is 6.4 feet away. [MAN] MANU MCGRADY MAKES IT!
Score: 2-0

[11:44] Team_004 possession (Score: 2-0)
Anthony Lillard drives, Russell Wade stays with him. Anthony Lillard attempts a Layup. Heavily contested by Russell Wade (1.5 feet, MAN)! Anthony Lillard misses. Rebound secured by Russell Wade.

[11:25] Team_065 possession (Score: 2-0)
Paul Williamson attempts a Layup. Contested by Anthony Lillard (5.9 feet, ZONE). PAUL WILLIAMSON MAKES IT!
Score: 4-0

[11:13] Team_004 possession (Score: 4-0)
Michael Curry attempts a 3Pt. Wide open! RJ Harden is 7.5 feet away. [ZONE] Michael Curry misses. Rebound secured by Manu McGrady.

[11:01] Team_065 possession (Score: 4-0)
Karl Booker attempts a 3Pt. Contested by Michael Curry (5.6 feet, ZONE). KARL BOOKER MAKES IT! Assist: RJ Harden
Score: 7-0

[10:45] Team_004 possession (Score: 7-0)
Michael Curry attempts a 3Pt. Contested by RJ Harden (4.6 feet, ZONE). Michael Curry misses. Rebound secured by RJ Harden.

[10:35] Team_065 possession (Score: 7-0)
Russell Wade attempts a Layup. Heavily contested by Draymond Fox (1.6 feet, MAN)! Russell Wade misses. Rebound secured by Draymond Fox.

[10:18] Team_004 possession (Score: 7-0)
Dwyane Irving attempts a 3Pt. Wide open! RJ Harden is 6.6 feet away. [ZONE] DWYANE IRVING MAKES IT!
Score: 7-3

[10:01] Team_065 possession (Score: 7-3)
Karl Booker drives, Anthony Lillard stays with him. Karl Booker attempts a Layup. Wide open! Anthony Lillard is 7.1 feet away. [MAN] KARL BOOKER MAKES IT! Assist: Manu McGrady
Score: 9-3

[09:47] Team_004 possession (Score: 9-3)
Jabari Wade attempts a 3Pt. Contested by RJ Harden (5.5 feet, ZONE). Jabari Wade misses. Offensive rebound by Draymond Fox! Draymond Fox kicks it out.

[09:32] Team_004 possession (Score: 9-3)
Jabari Wade drives and kicks out. Dwyane Irving attempts a Midrange. Contested by Paul Williamson (2.3 feet, ZONE). Dwyane Irving misses. Rebound secured by Russell Wade.

[09:17] Team_065 possession (Score: 9-3)
Manu McGrady attempts a 3Pt. Contested by Dwyane Irving (5.9 feet, MAN). Manu McGrady misses. Offensive rebound by Russell Wade! Russell Wade puts it back in!
Score: 11-3

[09:06] Team_004 possession (Score: 11-3)
Draymond Fox drives to the basket... Draymond Fox loses control! Ball rolls out of bounds! TURNOVER! (dead ball)

[08:52] Team_065 possession (Score: 11-3)
Russell Wade attempts a 3Pt. Contested by Michael Curry (5.6 feet, ZONE). Russell Wade misses. Offensive rebound by Manu McGrady! Manu McGrady kicks it out.

[08:40] Team_065 possession (Score: 11-3)
Russell Wade attempts a 3Pt. Contested by Michael Curry (5.5 feet, ZONE). Russell Wade misses. Rebound secured by Draymond Fox.

[08:28] Team_004 possession (Score: 11-3)
Jabari Wade attempts a 3Pt. Wide open! Paul Williamson is 7.2 feet away. [MAN] Jabari Wade misses. Rebound secured by Russell Wade.

[08:12] Team_065 possession (Score: 11-3)
Paul Williamson drives to the basket... Paul Williamson loses the ball! Stripped by Jabari Wade! TURNOVER! (live ball)

[07:56] Team_004 possession (Score: 11-3)
Jabari Wade throws a bad pass! Stolen by Paul Williamson! TURNOVER! (live ball)

[07:45] Team_065 possession (Score: 11-3)
Russell Wade attempts a Midrange. Contested by Dwyane Irving (2.3 feet, ZONE). RUSSELL WADE MAKES IT! Assist: Manu McGrady
Score: 13-3

[07:34] Team_004 possession (Score: 13-3)
Dwyane Irving attempts a 3Pt. Contested by Manu McGrady (5.5 feet, MAN). Dwyane Irving misses. Rebound secured by Manu McGrady.

[07:23] Team_065 possession (Score: 13-3)
Paul Williamson throws a bad pass! Stolen by Jabari Wade! TURNOVER! (live ball)

[07:13] Team_004 possession (Score: 13-3)
Jabari Wade attempts a 3Pt. Contested by Paul Williamson (2.1 feet, MAN). Jabari Wade misses. Offensive rebound by Anthony Lillard! Anthony Lillard kicks it out.

[07:01] Team_004 possession (Score: 13-3)
Anthony Lillard throws a bad pass! Stolen by Russell Wade! TURNOVER! (live ball)

[06:50] Team_065 possession (Score: 13-3)
Manu McGrady attempts a 3Pt. Contested by Michael Curry (5.2 feet, ZONE). MANU MCGRADY MAKES IT! Assist: RJ Harden
Score: 16-3

[06:37] Team_004 possession (Score: 16-3)
Dwyane Irving attempts a Midrange. Contested by Manu McGrady (5.3 feet, MAN). DWYANE IRVING MAKES IT! Assist: Draymond Fox
Score: 16-5

[06:25] Team_065 possession (Score: 16-5)
Russell Wade drives, Anthony Lillard stays with him. Russell Wade attempts a Dunk. Heavily contested by Anthony Lillard (0.5 feet, ZONE)! RUSSELL WADE MAKES IT!
Score: 18-5

[06:09] Team_004 possession (Score: 18-5)
Dwyane Irving attempts a 3Pt. Contested by RJ Harden (3.8 feet, ZONE). Dwyane Irving misses. Offensive rebound by Draymond Fox! Draymond Fox kicks it out.

[05:54] Team_004 possession (Score: 18-5)
Michael Curry attempts a 3Pt. Heavily contested by RJ Harden (1.4 feet, MAN)! Michael Curry misses. Rebound secured by Manu McGrady.

[05:43] Team_065 possession (Score: 18-5)
Russell Wade attempts a Midrange. Wide open! Draymond Fox is 6.7 feet away. [MAN] Russell Wade misses. Rebound secured by Dwyane Irving.

[05:24] Team_004 possession (Score: 18-5)
Dwyane Irving drives, Manu McGrady stays with him. Dwyane Irving attempts a Layup. Wide open! Manu McGrady is 6.4 feet away. [MAN] DWYANE IRVING MAKES IT!
Score: 18-7

[05:11] Team_065 possession (Score: 18-7)
FOUL! Reach-in foul on Anthony Lillard during the drive. [Team fouls: 1] No free throws, side out. (Anthony Lillard: 1 personal fouls)

[04:56] Team_065 possession (Score: 18-7)
Paul Williamson attempts a 3Pt. Contested by Jabari Wade (5.0 feet, MAN). PAUL WILLIAMSON MAKES IT! Assist: RJ Harden
Score: 21-7

[04:42] Team_004 possession (Score: 21-7)
Draymond Fox attempts a 3Pt. Wide open! Russell Wade is 7.6 feet away. [MAN] DRAYMOND FOX MAKES IT!
Score: 21-10

[04:28] Team_065 possession (Score: 21-10)
Karl Booker attempts a Midrange. Heavily contested by Anthony Lillard (1.8 feet, MAN)! Karl Booker misses. Rebound secured by Dwyane Irving.

[04:17] Team_004 possession (Score: 21-10)
Dwyane Irving attempts a 3Pt. Wide open! RJ Harden is 7.6 feet away. [ZONE] DWYANE IRVING MAKES IT! Assist: Draymond Fox
Score: 21-13

[04:01] Team_065 possession (Score: 21-13)
Russell Wade attempts a 3Pt. Heavily contested by Draymond Fox (1.0 feet, MAN)! Russell Wade misses. Rebound secured by Dwyane Irving.

[03:47] Team_004 possession (Score: 21-13)
Jabari Wade attempts a 3Pt. Contested by Paul Williamson (3.3 feet, MAN). Jabari Wade misses. Offensive rebound by Dwyane Irving! Dwyane Irving kicks it out.

[03:32] Team_004 possession (Score: 21-13)
FOUL! Reach-in foul on Russell Wade during the drive. [Team fouls: 1] No free throws, side out. (Russell Wade: 1 personal fouls)

[03:23] Team_004 possession (Score: 21-13)
Draymond Fox attempts a 3Pt. Wide open! RJ Harden is 6.7 feet away. [ZONE] Draymond Fox misses. Rebound secured by Russell Wade.

[03:09] Team_065 possession (Score: 21-13)
Karl Booker drives to the basket... Karl Booker throws a bad pass! Stolen by Anthony Lillard! TURNOVER! (live ball)

[02:56] Team_004 possession (Score: 21-13)
Anthony Lillard drives, Russell Wade stays with him. Anthony Lillard attempts a Layup. Contested by Russell Wade (3.3 feet, ZONE). Anthony Lillard misses. Rebound secured by RJ Harden.

[02:44] Team_065 possession (Score: 21-13)
Karl Booker attempts a Midrange. Contested by Anthony Lillard (3.4 feet, MAN). KARL BOOKER MAKES IT! Assist: Russell Wade
Score: 23-13

[02:32] Team_004 possession (Score: 23-13)
Draymond Fox drives, picks up Russell Wade. Help arrives from Paul Williamson! Draymond Fox attempts a Dunk. Heavily contested by Paul Williamson (1.9 feet, MAN)! Draymond Fox misses. Rebound secured by RJ Harden.

[02:20] Team_065 possession (Score: 23-13)
Karl Booker makes the Dunk and draws the foul on Anthony Lillard! And-1! Karl Booker to the line for 1. [Team fouls: 2] (Anthony Lillard: 2 personal fouls)   FT 1/1: GOOD Karl Booker makes 1/1 from the line.
Score: 26-13

[02:05] Team_004 possession (Score: 26-13)
Jabari Wade attempts a 3Pt. Contested by Paul Williamson (2.4 feet, MAN). JABARI WADE MAKES IT! Assist: Anthony Lillard
Score: 26-16

[01:50] Team_065 possession (Score: 26-16)
Paul Williamson attempts a 3Pt. Wide open! Michael Curry is 7.0 feet away. [ZONE] Paul Williamson misses. Rebound secured by Dwyane Irving.

[01:37] Team_004 possession (Score: 26-16)
Jabari Wade attempts a 3Pt. Contested by RJ Harden (2.7 feet, ZONE). Jabari Wade misses. Rebound secured by RJ Harden.

[01:25] Team_065 possession (Score: 26-16)
FOUL! Offensive foul on Paul Williamson! Jabari Wade drew the charge! [Team fouls: 2] (Paul Williamson: 1 personal fouls) TURNOVER! (dead ball)

[01:15] Team_004 possession (Score: 26-16)
Dwyane Irving attempts a 3Pt. Wide open! Manu McGrady is 6.3 feet away. [MAN] Dwyane Irving misses. Offensive rebound by Anthony Lillard! Anthony Lillard kicks it out.

[01:03] Team_004 possession (Score: 26-16)
FOUL! Shooting foul on Russell Wade. Michael Curry to the line for 2 free throws. [Team fouls: 3] (Russell Wade: 2 personal fouls)   FT 1/2: GOOD   FT 2/2: GOOD Michael Curry makes 2/2 from the line.
Score: 26-18

[00:49] Team_065 possession (Score: 26-18)
Russell Wade attempts a 3Pt. Wide open! Draymond Fox is 6.8 feet away. [MAN] RUSSELL WADE MAKES IT! Assist: Karl Booker
Score: 29-18

[00:37] Team_004 possession (Score: 29-18)
Dwyane Irving throws a bad pass out of bounds! TURNOVER! (dead ball)

[00:37] Substitution (Team_065): RJ Harden OUT → Paul Curry IN (stamina_rule2)

[00:37] Substitution (Team_065): Paul Williamson OUT → Derrick Poole IN (stamina_rule2)

[00:37] Substitution (Team_065): Manu McGrady OUT → D'Angelo Porzingis IN (stamina_rule2)

[00:37] Substitution (Team_065): Russell Wade OUT → Karl Leonard IN (stamina_rule2)

[00:37] Substitution (Team_065): Karl Booker OUT → Vince Mobley IN (stamina_rule2)

[00:37] Substitution (Team_004): Michael Curry OUT → Karl Reaves IN (stamina_rule2)

[00:37] Substitution (Team_004): Jabari Wade OUT → Russell Barnes IN (stamina_rule2)

[00:37] Substitution (Team_004): Dwyane Irving OUT → Kristaps Green IN (stamina_rule2)

[00:37] Substitution (Team_004): Draymond Fox OUT → Michael Sabonis IN (stamina_rule2)

[00:37] Substitution (Team_004): Anthony Lillard OUT → Shai Beal IN (stamina_rule2)

[00:22] Team_065 possession (Score: 29-18)
Paul Curry attempts a 3Pt. Contested by Karl Reaves (4.9 feet, MAN). PAUL CURRY MAKES IT! Assist: Karl Leonard
Score: 32-18

[00:08] Team_004 possession (Score: 32-18)
Karl Reaves attempts a 3Pt. Wide open! Paul Curry is 7.4 feet away. [ZONE] Karl Reaves misses. Rebound secured by Karl Leonard.

================================================================================
                              1ST QUARTER COMPLETE                              
================================================================================

1ST QUARTER SCORE: Team_065 32, Team_004 18

BOX SCORE:
================================================================================

Team_065
--------------------------------------------------------------------------------
Player                MIN  PTS  REB  AST  TO      FG   FG%      3P   3P%
--------------------------------------------------------------------------------
Karl Booker            12   10    0    1   0   4/5    80.0     0/0   0.0
Russell Wade           12    9    5    1   0   4/8    50.0     0/0   0.0
Manu McGrady           12    5    4    2   0   2/2   100.0     0/0   0.0
Paul Williamson        12    5    0    0   0   2/3    66.7     0/0   0.0
Paul Curry              0    3    0    0   0   1/1   100.0     0/0   0.0
RJ Harden              12    0    4    3   0   0/0     0.0     0/0   0.0
Karl Leonard            0    0    1    1   0   0/0     0.0     0/0   0.0

TEAM: FG: 13/19 (68.4%), 3PT: 6/9 (66.7%), REB: 14 (2 off, 12 def), AST: 8, TO: 4
TEAM FOULS: 3


Team_004
--------------------------------------------------------------------------------
Player                MIN  PTS  REB  AST  TO      FG   FG%      3P   3P%
--------------------------------------------------------------------------------
Dwyane Irving          12   10    5    0   0   4/5    80.0     0/0   0.0
Draymond Fox           12    3    4    2   0   1/3    33.3     0/0   0.0
Jabari Wade            12    3    0    0   0   1/4    25.0     0/0   0.0
Michael Curry          12    2    0    0   0   1/4    25.0     0/0   0.0
Anthony Lillard        12    0    2    1   0   0/2     0.0     0/0   0.0
Karl Reaves             0    0    0    0   0   0/1     0.0     0/0   0.0

TEAM: FG: 7/19 (36.8%), 3PT: 4/12 (33.3%), REB: 11 (5 off, 6 def), AST: 3, TO: 4
TEAM FOULS: 2

================================================================================

================================================================================
                       2ND QUARTER - Team_065 vs Team_004                       
================================================================================

[12:00] Team_065 possession (Score: 32-18)
Karl Booker drives and kicks out. Karl Booker attempts a 3Pt. Contested by Anthony Lillard (5.7 feet, MAN). KARL BOOKER MAKES IT! Assist: Russell Wade
Score: 35-18

[11:48] Team_004 possession (Score: 35-18)
Jabari Wade attempts a 3Pt. Wide open! RJ Harden is 7.7 feet away. [ZONE] JABARI WADE MAKES IT! Assist: Dwyane Irving
Score: 35-21

[11:32] Team_065 possession (Score: 35-21)
Paul Williamson attempts a Layup. Contested by Anthony Lillard (4.1 feet, ZONE). PAUL WILLIAMSON MAKES IT!
Score: 37-21

[11:18] Team_004 possession (Score: 37-21)
Michael Curry drives and kicks out. Michael Curry attempts a 3Pt. Contested by RJ Harden (4.7 feet, MAN). Michael Curry misses. Rebound secured by RJ Harden.

[11:03] Team_065 possession (Score: 37-21)
Manu McGrady drives to the basket... FOUL! Offensive foul on Manu McGrady! Anthony Lillard drew the charge! [Team fouls: 1] (Manu McGrady: 1 personal fouls) TURNOVER! (dead ball)

[10:49] Team_004 possession (Score: 37-21)
FOUL! Reach-in foul on Russell Wade during the drive. [Team fouls: 2] No free throws, side out. (Russell Wade: 1 personal fouls)

[10:38] Team_004 possession (Score: 37-21)
Dwyane Irving attempts a 3Pt. Heavily contested by RJ Harden (1.5 feet, ZONE)! Dwyane Irving misses. Rebound secured by Russell Wade.

[10:29] Team_065 possession (Score: 37-21)
Russell Wade attempts a 3Pt. Contested by Jabari Wade (5.2 feet, ZONE). RUSSELL WADE MAKES IT!
Score: 40-21

[10:15] Team_004 possession (Score: 40-21)
Draymond Fox attempts a Layup. BLOCKED BY PAUL WILLIAMSON! Ball is loose! Rebound secured by RJ Harden.

[09:56] Team_065 possession (Score: 40-21)
Manu McGrady attempts a Midrange. Contested by Dwyane Irving (4.9 feet, MAN). Manu McGrady misses. Rebound secured by Anthony Lillard.

[09:37] Team_004 possession (Score: 40-21)
Draymond Fox attempts a Midrange. Contested by Russell Wade (2.9 feet, MAN). Draymond Fox misses. Rebound secured by RJ Harden.

[09:21] Team_065 possession (Score: 40-21)
FOUL! Reach-in foul on Draymond Fox during the drive. [Team fouls: 1] No free throws, side out. (Draymond Fox: 1 personal fouls)

[09:06] Team_065 possession (Score: 40-21)
Paul Williamson attempts a 3Pt. Contested by Jabari Wade (5.3 feet, MAN). Paul Williamson misses. Offensive rebound by Russell Wade! Russell Wade's putback is no good. Offensive rebound by Russell Wade! Russell Wade kicks it out.

[08:51] Team_065 possession (Score: 40-21)
Russell Wade drives, Draymond Fox stays with him. Russell Wade attempts a Layup. Wide open! Draymond Fox is 6.2 feet away. [MAN] Russell Wade misses. Rebound secured by Draymond Fox.

[08:37] Team_004 possession (Score: 40-21)
Draymond Fox attempts a 3Pt. Contested by RJ Harden (5.6 feet, ZONE). DRAYMOND FOX MAKES IT! Assist: Jabari Wade
Score: 40-24

[08:27] Team_065 possession (Score: 40-24)
RJ Harden attempts a 3Pt. Wide open! Michael Curry is 6.5 feet away. [ZONE] RJ Harden misses. Rebound secured by Anthony Lillard.

[08:09] Team_004 possession (Score: 40-24)
Jabari Wade attempts a 3Pt. Contested by Paul Williamson (2.7 feet, MAN). Jabari Wade misses. Rebound secured by Manu McGrady.

[07:52] Team_065 possession (Score: 40-24)
Russell Wade drives and kicks out. Russell Wade attempts a Midrange. Contested by Draymond Fox (4.3 feet, MAN). Russell Wade misses. Rebound secured by Dwyane Irving.

[07:33] Team_004 possession (Score: 40-24)
Dwyane Irving attempts a 3Pt. Contested by Manu McGrady (3.0 feet, MAN). Dwyane Irving misses. Rebound secured by Manu McGrady.

[07:18] Team_065 possession (Score: 40-24)
Manu McGrady drives, Dwyane Irving stays with him. Manu McGrady attempts a Layup. Heavily contested by Dwyane Irving (1.6 feet, MAN)! MANU MCGRADY MAKES IT!
Score: 42-24

[07:05] Team_004 possession (Score: 42-24)
Anthony Lillard attempts a Midrange. Contested by Russell Wade (3.2 feet, MAN). Anthony Lillard misses. Rebound secured by Manu McGrady.

[06:49] Team_065 possession (Score: 42-24)
Russell Wade attempts a Midrange. Contested by Draymond Fox (2.6 feet, MAN). RUSSELL WADE MAKES IT!
Score: 44-24

[06:34] Team_004 possession (Score: 44-24)
FOUL! Offensive foul on Michael Curry! RJ Harden drew the charge! [Team fouls: 2] (Michael Curry: 1 personal fouls) TURNOVER! (dead ball)

[06:22] Team_065 possession (Score: 44-24)
Russell Wade attempts a Midrange. Contested by Jabari Wade (2.3 feet, ZONE). Russell Wade misses. Rebound secured by Anthony Lillard.

[06:07] Team_004 possession (Score: 44-24)
Dwyane Irving attempts a Midrange. Wide open! Manu McGrady is 6.5 feet away. [ZONE] DWYANE IRVING MAKES IT! Assist: Draymond Fox
Score: 44-26

[05:56] Team_065 possession (Score: 44-26)
RJ Harden attempts a 3Pt. Contested by Michael Curry (5.4 feet, MAN). RJ Harden misses. Rebound secured by Draymond Fox.

[05:41] Team_004 possession (Score: 44-26)
Jabari Wade drives, Paul Williamson stays with him. Jabari Wade attempts a Dunk. Contested by Paul Williamson (4.6 feet, MAN). JABARI WADE MAKES IT!
Score: 44-28

[05:24] Team_065 possession (Score: 44-28)
RJ Harden attempts a 3Pt. Wide open! Michael Curry is 7.2 feet away. [MAN] RJ Harden misses. Offensive rebound by Manu McGrady! Manu McGrady kicks it out.

[05:08] Team_065 possession (Score: 44-28)
FOUL! Reach-in foul on Anthony Lillard during the drive. [Team fouls: 3] No free throws, side out. (Anthony Lillard: 1 personal fouls)

[04:54] Team_065 possession (Score: 44-28)
Manu McGrady attempts a 3Pt. Wide open! Michael Curry is 7.1 feet away. [ZONE] Manu McGrady misses. Rebound secured by Dwyane Irving.

[04:41] Team_004 possession (Score: 44-28)
Dwyane Irving attempts a 3Pt. Wide open! RJ Harden is 8.8 feet away. [ZONE] Dwyane Irving misses. Rebound secured by Manu McGrady.

[04:22] Team_065 possession (Score: 44-28)
Paul Williamson attempts a Midrange. Wide open! Jabari Wade is 8.4 feet away. [MAN] Paul Williamson misses. Offensive rebound by Russell Wade! Russell Wade kicks it out.

[04:05] Team_065 possession (Score: 44-28)
Russell Wade drives and kicks out. Karl Booker attempts a 3Pt. Contested by Michael Curry (4.0 feet, ZONE). KARL BOOKER MAKES IT! Assist: Manu McGrady
Score: 47-28

[03:51] Team_004 possession (Score: 47-28)
Draymond Fox makes the Layup and draws the foul on Russell Wade! And-1! Draymond Fox to the line for 1. [Team fouls: 3] (Russell Wade: 2 personal fouls)   FT 1/1: GOOD Draymond Fox makes 1/1 from the line.
Score: 47-31

[03:42] Team_065 possession (Score: 47-31)
Russell Wade attempts a Layup. Wide open! Anthony Lillard is 7.8 feet away. [ZONE] RUSSELL WADE MAKES IT!
Score: 49-31

[03:26] Team_004 possession (Score: 49-31)
Jabari Wade attempts a 3Pt. Contested by Paul Williamson (3.3 feet, MAN). JABARI WADE MAKES IT! Assist: Dwyane Irving
Score: 49-34

[03:12] Team_065 possession (Score: 49-34)
RJ Harden drives, picks up Michael Curry. Help arrives from Dwyane Irving! RJ Harden attempts a Layup. Contested by Dwyane Irving (3.1 feet, MAN). RJ HARDEN MAKES IT! Assist: Karl Booker
Score: 51-34

[02:53] Team_004 possession (Score: 51-34)
Michael Curry attempts a 3Pt. Contested by RJ Harden (3.1 feet, ZONE). Michael Curry misses. Rebound secured by Manu McGrady.

[02:38] Team_065 possession (Score: 51-34)
Russell Wade attempts a 3Pt. Wide open! Michael Curry is 8.3 feet away. [ZONE] Russell Wade misses. Rebound secured by Draymond Fox.

[02:27] Team_004 possession (Score: 51-34)
Jabari Wade attempts a 3Pt. Wide open! Paul Williamson is 7.8 feet away. [MAN] JABARI WADE MAKES IT! Assist: Draymond Fox
Score: 51-37

[02:09] Team_065 possession (Score: 51-37)
FOUL! Offensive foul on RJ Harden! Michael Curry drew the charge! [Team fouls: 4] (RJ Harden: 1 personal fouls) TURNOVER! (dead ball)

[01:58] Team_004 possession (Score: 51-37)
Michael Curry attempts a 3Pt. Contested by Russell Wade (3.7 feet, ZONE). MICHAEL CURRY MAKES IT! Assist: Anthony Lillard
Score: 51-40

[01:43] Team_065 possession (Score: 51-40)
RJ Harden attempts a Midrange. Contested by Michael Curry (4.7 feet, MAN). RJ HARDEN MAKES IT! Assist: Karl Booker
Score: 53-40

[01:28] Team_004 possession (Score: 53-40)
Dwyane Irving makes the Layup and draws the foul on Manu McGrady! And-1! Dwyane Irving to the line for 1. [BONUS: 5 team fouls] (Manu McGrady: 2 personal fouls)   FT 1/1: GOOD Dwyane Irving makes 1/1 from the line.
Score: 53-43

[01:10] Team_065 possession (Score: 53-43)
Russell Wade attempts a Layup. Wide open! Anthony Lillard is 9.3 feet away. [ZONE] Russell Wade misses. Offensive rebound by Russell Wade! Russell Wade kicks it out.

[00:54] Team_065 possession (Score: 53-43)
Russell Wade attempts a 3Pt. Contested by Draymond Fox (4.6 feet, MAN). Russell Wade misses. Offensive rebound by Russell Wade! Russell Wade kicks it out.

[00:36] Team_065 possession (Score: 53-43)
RJ Harden attempts a 3Pt. Wide open! Michael Curry is 6.8 feet away. [ZONE] RJ Harden misses. Offensive rebound by Manu McGrady! Manu McGrady kicks it out.

[00:24] Team_065 possession (Score: 53-43)
Russell Wade drives to the basket... FOUL! Offensive foul on Russell Wade! Anthony Lillard drew the charge! [Team fouls: 6] (Russell Wade: 3 personal fouls) TURNOVER! (dead ball)

[00:12] Team_004 possession (Score: 53-43)
FOUL! Reach-in foul on Paul Williamson during the drive. [IN THE BONUS! 7 team fouls] Jabari Wade to the line for 2 free throws. (Paul Williamson: 1 personal fouls)   FT 1/2: MISS   FT 2/2: GOOD Jabari Wade makes 1/2 from the line.
Score: 53-44

================================================================================
                              2ND QUARTER COMPLETE                              
================================================================================

2ND QUARTER SCORE: Team_065 21, Team_004 26

BOX SCORE:
================================================================================

Team_065
--------------------------------------------------------------------------------
Player                MIN  PTS  REB  AST  TO      FG   FG%      3P   3P%
--------------------------------------------------------------------------------
Russell Wade           24    7    5    1   0   3/7    42.9     0/0   0.0
Karl Booker            24    6    0    2   0   2/2   100.0     0/0   0.0
RJ Harden              24    4    3    0   0   2/4    50.0     0/0   0.0
Paul Williamson        24    2    0    0   0   1/1   100.0     0/0   0.0
Manu McGrady           24    2    7    1   0   1/3    33.3     0/0   0.0

TEAM: FG: 9/17 (52.9%), 3PT: 1/5 (20.0%), REB: 15 (6 off, 9 def), AST: 4, TO: 3
TEAM FOULS: 7 [Team_004 in BONUS]


Team_004
--------------------------------------------------------------------------------
Player                MIN  PTS  REB  AST  TO      FG   FG%      3P   3P%
--------------------------------------------------------------------------------
Jabari Wade            24   12    0    1   0   5/6    83.3     0/0   0.0
Draymond Fox           24    6    3    2   0   2/4    50.0     0/0   0.0
Dwyane Irving          24    5    2    2   0   2/5    40.0     0/0   0.0
Michael Curry          24    3    0    0   0   1/3    33.3     0/0   0.0
Anthony Lillard        24    0    3    1   0   0/1     0.0     0/0   0.0

TEAM: FG: 10/19 (52.6%), 3PT: 5/10 (50.0%), REB: 8 (0 off, 8 def), AST: 6, TO: 1
TEAM FOULS: 3

================================================================================

================================================================================
                       3RD QUARTER - Team_065 vs Team_004                       
================================================================================

[12:00] Team_065 possession (Score: 53-44)
Manu McGrady drives and kicks out. RJ Harden attempts a 3Pt. Contested by Michael Curry (5.2 feet, ZONE). RJ HARDEN MAKES IT! Assist: Paul Williamson
Score: 56-44

[11:45] Team_004 possession (Score: 56-44)
FOUL! Shooting foul on Manu McGrady. Dwyane Irving to the line for 2 free throws. [Team fouls: 1] (Manu McGrady: 1 personal fouls)   FT 1/2: GOOD   FT 2/2: GOOD Dwyane Irving makes 2/2 from the line.
Score: 56-46

[11:33] Team_065 possession (Score: 56-46)
Paul Williamson attempts a 3Pt. Contested by Jabari Wade (3.2 feet, MAN). Paul Williamson misses. Rebound secured by Draymond Fox.

[11:22] Team_004 possession (Score: 56-46)
Anthony Lillard attempts a Midrange. Heavily contested by Russell Wade (0.5 feet, MAN)! Anthony Lillard misses. Rebound secured by RJ Harden.

[11:03] Team_065 possession (Score: 56-46)
Karl Booker drives and kicks out. Paul Williamson attempts a 3Pt. Contested by Michael Curry (5.7 feet, ZONE). Paul Williamson misses. Rebound secured by Anthony Lillard.

[10:49] Team_004 possession (Score: 56-46)
Jabari Wade attempts a 3Pt. Contested by Paul Williamson (4.3 feet, MAN). Jabari Wade misses. Rebound secured by RJ Harden.

[10:39] Team_065 possession (Score: 56-46)
RJ Harden attempts a 3Pt. Wide open! Michael Curry is 6.3 feet away. [ZONE] RJ HARDEN MAKES IT! Assist: Manu McGrady
Score: 59-46

[10:24] Team_004 possession (Score: 59-46)
Michael Curry attempts a Midrange. Contested by Karl Booker (3.5 feet, ZONE). MICHAEL CURRY MAKES IT!
Score: 59-48

[10:11] Team_065 possession (Score: 59-48)
RJ Harden attempts a Midrange. Contested by Michael Curry (5.3 feet, MAN). RJ HARDEN MAKES IT!
Score: 61-48

[10:00] Team_004 possession (Score: 61-48)
Anthony Lillard attempts a Midrange. Contested by Russell Wade (3.3 feet, MAN). ANTHONY LILLARD MAKES IT! Assist: Jabari Wade
Score: 61-50

[09:44] Team_065 possession (Score: 61-50)
Paul Williamson attempts a 3Pt. Wide open! Jabari Wade is 7.2 feet away. [MAN] Paul Williamson misses. Offensive rebound by Russell Wade! Russell Wade's putback is no good. Rebound secured by Dwyane Irving.

[09:30] Team_004 possession (Score: 61-50)
Michael Curry attempts a 3Pt. Contested by RJ Harden (3.2 feet, ZONE). MICHAEL CURRY MAKES IT! Assist: Draymond Fox
Score: 61-53

[09:18] Team_065 possession (Score: 61-53)
Manu McGrady attempts a 3Pt. Wide open! Dwyane Irving is 6.4 feet away. [MAN] Manu McGrady misses. Rebound secured by Anthony Lillard.

[09:04] Team_004 possession (Score: 61-53)
Anthony Lillard drives and kicks out. Draymond Fox attempts a Midrange. Contested by Russell Wade (5.0 feet, MAN). Draymond Fox misses. Offensive rebound by Draymond Fox! Draymond Fox kicks it out.

[08:50] Team_004 possession (Score: 61-53)
Draymond Fox attempts a Midrange. BLOCKED BY RUSSELL WADE! Ball is loose! Rebound secured by Manu McGrady.

[08:37] Team_065 possession (Score: 61-53)
Manu McGrady attempts a Layup. BLOCKED BY DWYANE IRVING! Ball is loose! Rebound secured by Anthony Lillard.

[08:23] Team_004 possession (Score: 61-53)
Anthony Lillard attempts a Midrange. Contested by Russell Wade (5.1 feet, MAN). Anthony Lillard misses. Rebound secured by Russell Wade.

[08:10] Team_065 possession (Score: 61-53)
RJ Harden attempts a 3Pt. Contested by Michael Curry (3.7 feet, MAN). RJ Harden misses. Offensive rebound by Russell Wade! Russell Wade puts it back in!
Score: 63-53

[07:53] Team_004 possession (Score: 63-53)
Draymond Fox drives and kicks out. Draymond Fox attempts a Midrange. Contested by Paul Williamson (5.8 feet, ZONE). DRAYMOND FOX MAKES IT!
Score: 63-55

[07:43] Team_065 possession (Score: 63-55)
FOUL! Offensive foul on Manu McGrady! Dwyane Irving drew the charge! [Team fouls: 2] (Manu McGrady: 2 personal fouls) TURNOVER! (dead ball)

[07:25] Team_004 possession (Score: 63-55)
Dwyane Irving attempts a 3Pt. Heavily contested by RJ Harden (0.9 feet, ZONE)! Dwyane Irving misses. FOUL! Loose ball foul on RJ Harden during the rebound battle. [Team fouls: 3] No free throws, side out. (RJ Harden: 1 personal fouls)

[07:06] Team_004 possession (Score: 63-55)
Dwyane Irving drives and kicks out. Anthony Lillard attempts a 3Pt. Contested by Russell Wade (3.2 feet, MAN). Anthony Lillard misses. Rebound secured by Russell Wade.

[06:53] Team_065 possession (Score: 63-55)
Manu McGrady attempts a 3Pt. Contested by Draymond Fox (5.9 feet, ZONE). Manu McGrady misses. Rebound secured by Anthony Lillard.

[06:44] Team_004 possession (Score: 63-55)
Draymond Fox attempts a Midrange. Contested by Russell Wade (2.3 feet, ZONE). DRAYMOND FOX MAKES IT!
Score: 63-57

[06:29] Team_065 possession (Score: 63-57)
RJ Harden drives, Anthony Lillard stays with him. RJ Harden attempts a Layup. Heavily contested by Anthony Lillard (1.0 feet, ZONE)! RJ Harden misses. Rebound secured by Draymond Fox.

[06:15] Team_004 possession (Score: 63-57)
Jabari Wade attempts a 3Pt. Contested by RJ Harden (5.4 feet, ZONE). Jabari Wade misses. Rebound secured by Manu McGrady.

[06:04] Team_065 possession (Score: 63-57)
RJ Harden drives and kicks out. Manu McGrady attempts a 3Pt. Contested by Michael Curry (5.1 feet, ZONE). MANU MCGRADY MAKES IT! Assist: Karl Booker
Score: 66-57

[05:47] Team_004 possession (Score: 66-57)
Draymond Fox loses the ball! Stripped by Russell Wade! TURNOVER! (live ball)

[05:33] Team_065 possession (Score: 66-57)
FOUL! Shooting foul on Jabari Wade. Karl Booker to the line for 2 free throws. [Team fouls: 1] (Jabari Wade: 1 personal fouls)   FT 1/2: MISS   FT 2/2: GOOD Karl Booker makes 1/2 from the line.
Score: 67-57

[05:22] Team_004 possession (Score: 67-57)
FOUL! Reach-in foul on Karl Booker during the drive. [Team fouls: 4] No free throws, side out. (Karl Booker: 1 personal fouls)

[05:05] Team_004 possession (Score: 67-57)
FOUL! Reach-in foul on Russell Wade during the drive. [IN THE BONUS! 5 team fouls] Jabari Wade to the line for 2 free throws. (Russell Wade: 1 personal fouls)   FT 1/2: GOOD   FT 2/2: GOOD Jabari Wade makes 2/2 from the line.
Score: 67-59

[04:50] Team_065 possession (Score: 67-59)
Karl Booker drives to the basket... Karl Booker loses control! Ball rolls out of bounds! TURNOVER! (dead ball)

[04:34] Team_004 possession (Score: 67-59)
Jabari Wade attempts a 3Pt. Wide open! RJ Harden is 7.2 feet away. [ZONE] Jabari Wade misses. FOUL! Loose ball foul on Manu McGrady during the rebound battle. [IN THE BONUS! 6 team fouls] Dwyane Irving to the line for 2 free throws. (Manu McGrady: 3 personal fouls)   FT 1/2: MISS   FT 2/2: GOOD Dwyane Irving makes 1/2 from the line.
Score: 67-60

[04:19] Team_065 possession (Score: 67-60)
RJ Harden attempts a Midrange. Contested by Michael Curry (5.2 feet, MAN). RJ HARDEN MAKES IT! Assist: Russell Wade
Score: 69-60

[04:06] Team_004 possession (Score: 69-60)
FOUL! Shooting foul on Paul Williamson. Michael Curry to the line for 2 free throws. [BONUS: 7 team fouls] (Paul Williamson: 1 personal fouls)   FT 1/2: GOOD   FT 2/2: GOOD Michael Curry makes 2/2 from the line.
Score: 69-62

[03:56] Team_065 possession (Score: 69-62)
Russell Wade attempts a 3Pt. Contested by Draymond Fox (4.8 feet, MAN). RUSSELL WADE MAKES IT! Assist: Karl Booker
Score: 72-62

[03:46] Team_004 possession (Score: 72-62)
Jabari Wade drives, Paul Williamson stays with him. Jabari Wade attempts a Layup. Wide open! Paul Williamson is 6.0 feet away. [MAN] JABARI WADE MAKES IT! Assist: Dwyane Irving
Score: 72-64

[03:29] Team_065 possession (Score: 72-64)
Karl Booker loses control! Ball rolls out of bounds! TURNOVER! (dead ball)

[03:29] Substitution (Team_004): Jabari Wade OUT → Russell Barnes IN (stamina_rule2)

[03:29] Substitution (Team_004): Anthony Lillard OUT → Shai Beal IN (stamina_rule2)

[03:14] Team_004 possession (Score: 72-64)
Draymond Fox attempts a Layup. Wide open! Russell Wade is 7.2 feet away. [ZONE] Draymond Fox misses. Rebound secured by Russell Wade.

[02:59] Team_065 possession (Score: 72-64)
Russell Wade drives and kicks out. RJ Harden attempts a 3Pt. Heavily contested by Russell Barnes (0.7 feet, ZONE)! RJ Harden misses. Rebound secured by Russell Barnes.

[02:45] Team_004 possession (Score: 72-64)
Shai Beal drives and kicks out. Michael Curry attempts a 3Pt. Contested by RJ Harden (4.6 feet, ZONE). MICHAEL CURRY MAKES IT! Assist: Dwyane Irving
Score: 72-67

[02:30] Team_065 possession (Score: 72-67)
Karl Booker attempts a Layup. Contested by Shai Beal (5.4 feet, ZONE). Karl Booker misses. Offensive rebound by Russell Wade! Russell Wade puts it back in!
Score: 74-67

[02:16] Team_004 possession (Score: 74-67)
Russell Barnes attempts a Layup. Wide open! Paul Williamson is 8.3 feet away. [MAN] Russell Barnes misses. Rebound secured by Russell Wade.

[02:02] Team_065 possession (Score: 74-67)
Karl Booker makes the Midrange and draws the foul on Shai Beal! And-1! Karl Booker to the line for 1. [Team fouls: 2] (Shai Beal: 1 personal fouls)   FT 1/1: GOOD Karl Booker makes 1/1 from the line.
Score: 77-67

[01:49] Team_004 possession (Score: 77-67)
Draymond Fox attempts a Midrange. Contested by Russell Wade (3.6 feet, MAN). Draymond Fox misses. FOUL! Loose ball foul on Manu McGrady during the rebound battle. [IN THE BONUS! 8 team fouls] Shai Beal to the line for 2 free throws. (Manu McGrady: 4 personal fouls)   FT 1/2: GOOD   FT 2/2: MISS Shai Beal makes 1/2 from the line. Rebound secured by Manu McGrady.
Score: 77-68

[01:39] Team_065 possession (Score: 77-68)
Russell Wade throws a bad pass! Stolen by Draymond Fox! TURNOVER! (live ball)

[01:27] Team_004 possession (Score: 77-68)
FOUL! Shooting foul on Paul Williamson. Russell Barnes to the line for 2 free throws. [BONUS: 9 team fouls] (Paul Williamson: 2 personal fouls)   FT 1/2: MISS   FT 2/2: GOOD Russell Barnes makes 1/2 from the line.
Score: 77-69

[01:12] Team_065 possession (Score: 77-69)
Paul Williamson makes the Midrange and draws the foul on Russell Barnes! And-1! Paul Williamson to the line for 1. [Team fouls: 3] (Russell Barnes: 1 personal fouls)   FT 1/1: GOOD Paul Williamson makes 1/1 from the line.
Score: 80-69

[01:00] Team_004 possession (Score: 80-69)
Shai Beal drives to the basket... FOUL! Offensive foul on Shai Beal! Russell Wade drew the charge! [Team fouls: 4] (Shai Beal: 2 personal fouls) TURNOVER! (dead ball)

[00:42] Team_065 possession (Score: 80-69)
Manu McGrady attempts a 3Pt. Contested by Michael Curry (3.3 feet, ZONE). MANU MCGRADY MAKES IT! Assist: Karl Booker
Score: 83-69

[00:27] Team_004 possession (Score: 83-69)
FOUL! Holding foul on Paul Williamson. [IN THE BONUS! 10 team fouls] Russell Barnes to the line for 2 free throws. (Paul Williamson: 3 personal fouls)   FT 1/2: GOOD   FT 2/2: GOOD Russell Barnes makes 2/2 from the line.
Score: 83-71

[00:10] Team_065 possession (Score: 83-71)
Manu McGrady drives and kicks out. Karl Booker attempts a Midrange. Contested by Shai Beal (4.2 feet, MAN). Karl Booker misses. Rebound secured by Russell Barnes.

================================================================================
                              3RD QUARTER COMPLETE                              
================================================================================

3RD QUARTER SCORE: Team_065 30, Team_004 27

BOX SCORE:
================================================================================

Team_065
--------------------------------------------------------------------------------
Player                MIN  PTS  REB  AST  TO      FG   FG%      3P   3P%
--------------------------------------------------------------------------------
RJ Harden              36   10    2    0   0   4/5    80.0     0/0   0.0
Russell Wade           36    7    6    1   0   3/4    75.0     0/0   0.0
Manu McGrady           36    6    3    1   0   2/6    33.3     0/0   0.0
Karl Booker            36    4    0    3   0   2/3    66.7     0/0   0.0
Paul Williamson        36    3    0    1   0   1/3    33.3     0/0   0.0

TEAM: FG: 12/21 (57.1%), 3PT: 4/8 (50.0%), REB: 11 (3 off, 8 def), AST: 6, TO: 4
TEAM FOULS: 10 [Team_004 in BONUS]


Team_004
--------------------------------------------------------------------------------
Player                MIN  PTS  REB  AST  TO      FG   FG%      3P   3P%
--------------------------------------------------------------------------------
Michael Curry          36   10    0    0   0   4/4   100.0     0/0   0.0
Draymond Fox           36    4    4    1   0   2/5    40.0     0/0   0.0
Jabari Wade            32    4    0    1   0   2/4    50.0     0/0   0.0
Dwyane Irving          36    3    1    2   0   2/3    66.7     0/0   0.0
Russell Barnes          4    3    2    0   0   2/3    66.7     0/0   0.0
Anthony Lillard        32    2    4    0   0   1/3    33.3     0/0   0.0

TEAM: FG: 13/22 (59.1%), 3PT: 2/4 (50.0%), REB: 11 (3 off, 8 def), AST: 4, TO: 2
TEAM FOULS: 4

================================================================================

================================================================================
                       4TH QUARTER - Team_065 vs Team_004                       
================================================================================

[12:00] Team_065 possession (Score: 83-71)
RJ Harden attempts a 3Pt. Wide open! Michael Curry is 8.0 feet away. [ZONE] RJ Harden misses. Rebound secured by Dwyane Irving.

[11:44] Team_004 possession (Score: 83-71)
Draymond Fox drives, Russell Wade stays with him. Draymond Fox attempts a Layup. Wide open! Russell Wade is 6.9 feet away. [MAN] DRAYMOND FOX MAKES IT! Assist: Anthony Lillard
Score: 83-73

[11:28] Team_065 possession (Score: 83-73)
Manu McGrady attempts a 3Pt. Contested by Dwyane Irving (5.6 feet, MAN). Manu McGrady misses. FOUL! Loose ball foul on Anthony Lillard during the rebound battle. [Team fouls: 1] No free throws, side out. (Anthony Lillard: 1 personal fouls)

[11:17] Team_065 possession (Score: 83-73)
Paul Williamson attempts a 3Pt. Contested by Jabari Wade (5.7 feet, MAN). Paul Williamson misses. Rebound secured by Draymond Fox.

[11:01] Team_004 possession (Score: 83-73)
FOUL! Shooting foul on Russell Wade. Anthony Lillard to the line for 2 free throws. [Team fouls: 1] (Russell Wade: 1 personal fouls)   FT 1/2: GOOD   FT 2/2: GOOD Anthony Lillard makes 2/2 from the line.
Score: 83-75

[10:51] Team_065 possession (Score: 83-75)
Paul Williamson attempts a Layup. BLOCKED BY ANTHONY LILLARD! Ball is loose! Rebound secured by Anthony Lillard.

[10:37] Team_004 possession (Score: 83-75)
FOUL! Shooting foul on Russell Wade. Anthony Lillard to the line for 2 free throws. [Team fouls: 2] (Russell Wade: 2 personal fouls)   FT 1/2: GOOD   FT 2/2: GOOD Anthony Lillard makes 2/2 from the line.
Score: 83-77

[10:23] Team_065 possession (Score: 83-77)
Paul Williamson drives and kicks out. Karl Booker attempts a Midrange. Heavily contested by Dwyane Irving (1.0 feet, ZONE)! KARL BOOKER MAKES IT! Assist: Paul Williamson
Score: 85-77

[10:12] Team_004 possession (Score: 85-77)
FOUL! Offensive foul on Draymond Fox! Russell Wade drew the charge! [Team fouls: 2] (Draymond Fox: 1 personal fouls) TURNOVER! (dead ball)

[09:52] Team_065 possession (Score: 85-77)
Karl Booker attempts a 3Pt. Wide open! Anthony Lillard is 6.1 feet away. [MAN] KARL BOOKER MAKES IT! Assist: Manu McGrady
Score: 88-77

[09:35] Team_004 possession (Score: 88-77)
Michael Curry attempts a 3Pt. Wide open! RJ Harden is 7.0 feet away. [ZONE] Michael Curry misses. Offensive rebound by Dwyane Irving! Dwyane Irving kicks it out.

[09:21] Team_004 possession (Score: 88-77)
Michael Curry attempts a 3Pt. Contested by RJ Harden (4.1 feet, MAN). Michael Curry misses. Rebound secured by RJ Harden.

[09:04] Team_065 possession (Score: 88-77)
Manu McGrady attempts a 3Pt. Contested by Michael Curry (2.7 feet, ZONE). Manu McGrady misses. Offensive rebound by Manu McGrady! Manu McGrady kicks it out.

[08:46] Team_065 possession (Score: 88-77)
Russell Wade attempts a 3Pt. Wide open! Michael Curry is 8.0 feet away. [ZONE] Russell Wade misses. Rebound secured by Draymond Fox.

[08:34] Team_004 possession (Score: 88-77)
Anthony Lillard attempts a Midrange. Wide open! Russell Wade is 7.4 feet away. [ZONE] Anthony Lillard misses. Rebound secured by Russell Wade.

[08:20] Team_065 possession (Score: 88-77)
Paul Williamson attempts a Layup. Contested by Anthony Lillard (5.4 feet, ZONE). PAUL WILLIAMSON MAKES IT! Assist: Karl Booker
Score: 90-77

[08:00] Team_004 possession (Score: 90-77)
Jabari Wade attempts a 3Pt. Heavily contested by Paul Williamson (1.3 feet, MAN)! JABARI WADE MAKES IT! Assist: Dwyane Irving
Score: 90-80

[07:45] Team_065 possession (Score: 90-80)
Paul Williamson attempts a 3Pt. Contested by Michael Curry (5.1 feet, ZONE). Paul Williamson misses. Rebound secured by Dwyane Irving.

[07:31] Team_004 possession (Score: 90-80)
Michael Curry attempts a Layup. BLOCKED BY RUSSELL WADE! Ball is loose! Rebound secured by Russell Wade.

[07:20] Team_065 possession (Score: 90-80)
Manu McGrady throws a bad pass! Stolen by Dwyane Irving! TURNOVER! (live ball)

[07:02] Team_004 possession (Score: 90-80)
Draymond Fox drives and kicks out. Jabari Wade attempts a 3Pt. Wide open! RJ Harden is 7.1 feet away. [ZONE] Jabari Wade misses. Rebound secured by Russell Wade.

[06:46] Team_065 possession (Score: 90-80)
Karl Booker drives, Anthony Lillard stays with him. Karl Booker attempts a Layup. Contested by Anthony Lillard (2.4 feet, MAN). Karl Booker misses. Offensive rebound by Manu McGrady! Manu McGrady kicks it out.

[06:32] Team_065 possession (Score: 90-80)
FOUL! Reach-in foul on Anthony Lillard during the drive. [Team fouls: 3] No free throws, side out. (Anthony Lillard: 2 personal fouls)

[06:14] Team_065 possession (Score: 90-80)
Paul Williamson drives and kicks out. Manu McGrady attempts a Midrange. Wide open! Jabari Wade is 7.7 feet away. [ZONE] MANU MCGRADY MAKES IT! Assist: Paul Williamson
Score: 92-80

[05:58] Team_004 possession (Score: 92-80)
Dwyane Irving attempts a Midrange. Heavily contested by Manu McGrady (1.5 feet, MAN)! Dwyane Irving misses. Rebound secured by Manu McGrady.

[05:41] Team_065 possession (Score: 92-80)
Manu McGrady attempts a Layup. BLOCKED BY JABARI WADE! Ball is loose! Offensive rebound by Russell Wade! Russell Wade kicks it out.

[05:27] Team_065 possession (Score: 92-80)
FOUL! Offensive foul on Paul Williamson! Jabari Wade drew the charge! [Team fouls: 3] (Paul Williamson: 1 personal fouls) TURNOVER! (dead ball)

[05:14] Team_004 possession (Score: 92-80)
Jabari Wade attempts a 3Pt. Contested by Paul Williamson (3.7 feet, MAN). Jabari Wade misses. Rebound secured by Manu McGrady.

[04:59] Team_065 possession (Score: 92-80)
RJ Harden attempts a Midrange. Wide open! Michael Curry is 7.1 feet away. [MAN] RJ HARDEN MAKES IT!
Score: 94-80

[04:43] Team_004 possession (Score: 94-80)
Michael Curry attempts a Midrange. Wide open! Paul Williamson is 7.1 feet away. [ZONE] MICHAEL CURRY MAKES IT!
Score: 94-82

[04:26] Team_065 possession (Score: 94-82)
Karl Booker attempts a 3Pt. Wide open! Michael Curry is 6.3 feet away. [ZONE] Karl Booker misses. Rebound secured by Dwyane Irving.

[04:10] Team_004 possession (Score: 94-82)
Anthony Lillard attempts a 3Pt. Contested by RJ Harden (4.8 feet, ZONE). Anthony Lillard misses. Offensive rebound by Dwyane Irving! Dwyane Irving kicks it out.

[03:59] Team_004 possession (Score: 94-82)
Draymond Fox attempts a 3Pt. Contested by RJ Harden (4.9 feet, ZONE). DRAYMOND FOX MAKES IT! Assist: Jabari Wade
Score: 94-85

[03:47] Team_065 possession (Score: 94-85)
Paul Williamson attempts a 3Pt. Wide open! Michael Curry is 6.9 feet away. [ZONE] Paul Williamson misses. Offensive rebound by Russell Wade! Russell Wade kicks it out.

[03:33] Team_065 possession (Score: 94-85)
Russell Wade drives, Anthony Lillard stays with him. Russell Wade attempts a Dunk. Contested by Anthony Lillard (3.7 feet, ZONE). Russell Wade misses. Offensive rebound by Russell Wade! Russell Wade kicks it out.

[03:20] Team_065 possession (Score: 94-85)
RJ Harden attempts a Midrange. Contested by Draymond Fox (5.8 feet, ZONE). RJ HARDEN MAKES IT!
Score: 96-85

[03:09] Team_004 possession (Score: 96-85)
Draymond Fox attempts a 3Pt. Contested by RJ Harden (3.1 feet, ZONE). Draymond Fox misses. Rebound secured by RJ Harden.

[02:54] Team_065 possession (Score: 96-85)
Manu McGrady attempts a 3Pt. Wide open! Dwyane Irving is 6.9 feet away. [MAN] MANU MCGRADY MAKES IT!
Score: 99-85

[02:44] Team_004 possession (Score: 99-85)
Jabari Wade attempts a 3Pt. Contested by Paul Williamson (5.0 feet, MAN). Jabari Wade misses. Offensive rebound by Anthony Lillard! Anthony Lillard kicks it out.

[02:29] Team_004 possession (Score: 99-85)
Michael Curry attempts a 3Pt. Contested by RJ Harden (5.1 feet, MAN). Michael Curry misses. Rebound secured by Manu McGrady.

[02:15] Team_065 possession (Score: 99-85)
Russell Wade makes the Dunk and draws the foul on Anthony Lillard! And-1! Russell Wade to the line for 1. [Team fouls: 4] (Anthony Lillard: 3 personal fouls)   FT 1/1: GOOD Russell Wade makes 1/1 from the line.
Score: 102-85

[02:02] Team_004 possession (Score: 102-85)
Draymond Fox attempts a 3Pt. Contested by RJ Harden (5.9 feet, ZONE). Draymond Fox misses. Rebound secured by Russell Wade.

[01:53] Team_065 possession (Score: 102-85)
Russell Wade attempts a 3Pt. Wide open! Draymond Fox is 9.0 feet away. [MAN] Russell Wade misses. Rebound secured by Dwyane Irving.

[01:34] Team_004 possession (Score: 102-85)
Jabari Wade attempts a 3Pt. Contested by Paul Williamson (5.1 feet, MAN). JABARI WADE MAKES IT! Assist: Anthony Lillard
Score: 102-88

[01:18] Team_065 possession (Score: 102-88)
Karl Booker attempts a Midrange. Contested by Anthony Lillard (3.2 feet, MAN). KARL BOOKER MAKES IT! Assist: Russell Wade
Score: 104-88

[01:02] Team_004 possession (Score: 104-88)
FOUL! Holding foul on Russell Wade. [Team fouls: 4] No free throws, side out. (Russell Wade: 3 personal fouls)

[00:43] Team_004 possession (Score: 104-88)
Anthony Lillard drives to the basket... Anthony Lillard throws a bad pass out of bounds! TURNOVER! (dead ball)

[00:43] Substitution (Team_065): RJ Harden OUT → Paul Curry IN (stamina_rule2)

[00:43] Substitution (Team_065): Paul Williamson OUT → Derrick Poole IN (stamina_rule2)

[00:43] Substitution (Team_065): Manu McGrady OUT → D'Angelo Porzingis IN (stamina_rule2)

[00:43] Substitution (Team_065): Russell Wade OUT → Karl Leonard IN (stamina_rule2)

[00:43] Substitution (Team_065): Karl Booker OUT → Vince Mobley IN (stamina_rule2)

[00:43] Substitution (Team_004): Michael Curry OUT → Karl Reaves IN (stamina_rule2)

[00:43] Substitution (Team_004): Jabari Wade OUT → Russell Barnes IN (stamina_rule2)

[00:43] Substitution (Team_004): Dwyane Irving OUT → Kristaps Green IN (stamina_rule2)

[00:43] Substitution (Team_004): Draymond Fox OUT → Michael Sabonis IN (stamina_rule2)

[00:43] Substitution (Team_004): Anthony Lillard OUT → Shai Beal IN (stamina_rule2)

[00:32] Team_065 possession (Score: 104-88)
Karl Leonard attempts a 3Pt. Contested by Michael Sabonis (5.4 feet, MAN). Karl Leonard misses. Rebound secured by Russell Barnes.

[00:17] Team_004 possession (Score: 104-88)
Russell Barnes attempts a 3Pt. Contested by Derrick Poole (4.9 feet, MAN). Russell Barnes misses. Rebound secured by D'Angelo Porzingis.

[00:01] Team_065 possession (Score: 104-88)
D'Angelo Porzingis throws a bad pass! Stolen by Kristaps Green! TURNOVER! (live ball)

================================================================================
                              4TH QUARTER COMPLETE                              
================================================================================

4TH QUARTER SCORE: Team_065 21, Team_004 17

BOX SCORE:
================================================================================

Team_065
--------------------------------------------------------------------------------
Player                MIN  PTS  REB  AST  TO      FG   FG%      3P   3P%
--------------------------------------------------------------------------------
Karl Booker            47    7    0    1   0   3/4    75.0     0/0   0.0
Manu McGrady           47    5    6    1   0   2/2   100.0     0/0   0.0
RJ Harden              47    4    2    0   0   2/3    66.7     0/0   0.0
Russell Wade           47    3    7    1   0   1/3    33.3     0/0   0.0
Paul Williamson        47    2    0    2   0   1/4    25.0     0/0   0.0
Karl Leonard            1    0    0    0   0   0/1     0.0     0/0   0.0
D'Angelo Porzingis      1    0    1    0   0   0/0     0.0     0/0   0.0

TEAM: FG: 9/17 (52.9%), 3PT: 2/9 (22.2%), REB: 16 (6 off, 10 def), AST: 5, TO: 3
TEAM FOULS: 4


Team_004
--------------------------------------------------------------------------------
Player                MIN  PTS  REB  AST  TO      FG   FG%      3P   3P%
--------------------------------------------------------------------------------
Jabari Wade            44    6    0    1   0   2/3    66.7     0/0   0.0
Draymond Fox           47    5    2    0   0   2/5    40.0     0/0   0.0
Anthony Lillard        44    4    2    2   0   2/3    66.7     0/0   0.0
Michael Curry          47    2    0    0   0   1/4    25.0     0/0   0.0
Dwyane Irving          47    0    6    1   0   0/1     0.0     0/0   0.0
Russell Barnes          4    0    1    0   0   0/1     0.0     0/0   0.0

TEAM: FG: 7/17 (41.2%), 3PT: 3/9 (33.3%), REB: 11 (3 off, 8 def), AST: 4, TO: 2
TEAM FOULS: 4

================================================================================

================================================================================
                               FULL GAME COMPLETE                               
================================================================================

FINAL SCORE: Team_065 104, Team_004 88

SCORING BY QUARTER:
--------------------------------------------------------------------------------
Team                     Q1     Q2     Q3     Q4    FINAL
--------------------------------------------------------------------------------
Team_065                 32     21     30     21      104
Team_004                 18     26     27     17       88
--------------------------------------------------------------------------------

FULL GAME BOX SCORE:
================================================================================

Team_065
--------------------------------------------------------------------------------
Player                MIN  PTS  REB  AST  TO      FG   FG%      3P   3P%      FT STL BLK
--------------------------------------------------------------------------------
RJ Harden              47   18   11    3   3   9/13   69.2   2/5    40.0   0/0     0   0
Paul Williamson        47   12    0    3   4   7/13   53.8   1/6    16.7   1/1     1   1
Manu McGrady           47   18   20    5   2   7/13   53.8   4/7    57.1   0/0     0   0
Russell Wade           47   26   23    4   2   9/20   45.0   3/8    37.5   1/1     2   2
Karl Booker            47   27    0    7   2  10/13   76.9   2/3    66.7   3/4     0   0
Paul Curry              1    3    0    0   0   1/1   100.0   1/1   100.0   0/0     0   0
Derrick Poole           1    0    0    0   0   0/0     0.0   0/0     0.0   0/0     0   0
D'Angelo Porzingis      1    0    1    0   1   0/0     0.0   0/0     0.0   0/0     0   0
Karl Leonard            1    0    1    1   0   0/1     0.0   0/1     0.0   0/0     0   0
Vince Mobley            1    0    0    0   0   0/0     0.0   0/0     0.0   0/0     0   0

TEAM: FG: 43/74 (58.1%), 3PT: 13/31 (41.9%), REB: 56 (17 off, 39 def), AST: 23, TO: 14


Team_004
--------------------------------------------------------------------------------
Player                MIN  PTS  REB  AST  TO      FG   FG%      3P   3P%      FT STL BLK
--------------------------------------------------------------------------------
Michael Curry          47   17    0    0   1   6/14   42.9   2/8    25.0   4/4     0   0
Dwyane Irving          47   18   14    5   2   7/13   53.8   2/6    33.3   4/5     1   1
Draymond Fox           47   18   13    5   3   7/17   41.2   3/6    50.0   1/1     1   0
Jabari Wade            44   25    0    3   2  11/18   61.1   7/13   53.8   3/4     2   1
Anthony Lillard        44    6   11    4   1   3/9    33.3   0/0     0.0   4/4     1   1
Russell Barnes          4    3    3    0   0   1/3    33.3   0/1     0.0   3/4     0   0
Shai Beal               4    0    0    0   0   1/1   100.0   0/0     0.0   1/2     0   0
Karl Reaves             1    0    0    0   0   0/1     0.0   0/1     0.0   0/0     0   0
Kristaps Green          1    0    0    0   0   0/0     0.0   0/0     0.0   0/0     1   0
Michael Sabonis         1    0    0    0   0   0/0     0.0   0/0     0.0   0/0     0   0

TEAM: FG: 37/77 (48.1%), 3PT: 14/35 (40.0%), REB: 41 (11 off, 30 def), AST: 17, TO: 9

================================================================================
