================================================================================
                        FULL GAME - Team_060 vs Team_091                        
================================================================================

================================================================================
                       1ST QUARTER - Team_060 vs Team_091                       
================================================================================

[12:00] Team_060 possession (Score: 0-0)
Immanuel Ming attempts a 3Pt. Contested by Rudy Bridges (4.5 feet, MAN). IMMANUEL MING MAKES IT! Assist: Jaren George
Score: 3-0

[11:46] Team_091 possession (Score: 3-0)
Kyrie Rozier attempts a 3Pt. Contested by Joel Morant (5.6 feet, MAN). Kyrie Rozier misses. Rebound secured by Jaren George.

[11:31] Team_060 possession (Score: 3-0)
Immanuel Ming attempts a Layup. Wide open! Rudy Bridges is 7.0 feet away. [MAN] IMMANUEL MING MAKES IT! Assist: Julius Green
Score: 5-0

[11:19] Team_091 possession (Score: 5-0)
Rudy Bridges attempts a 3Pt. Contested by Immanuel Ming (2.4 feet, MAN). RUDY BRIDGES MAKES IT! Assist: Kyrie Rozier
Score: 5-3

[11:04] Team_060 possession (Score: 5-3)
FOUL! Reach-in foul on Kevin Simons during the drive. [Team fouls: 1] No free throws, side out. (Kevin Simons: 1 personal fouls)

[10:52] Team_060 possession (Score: 5-3)
Immanuel Ming attempts a Layup. Contested by Kevin Simons (5.9 feet, ZONE). Immanuel Ming misses. Rebound secured by Kyrie Rozier.

[10:33] Team_091 possession (Score: 5-3)
Isaiah Siakam drives, Julius Green stays with him. Isaiah Siakam attempts a Layup. Wide open! Julius Green is 6.2 feet away. [MAN] ISAIAH SIAKAM MAKES IT! Assist: Rudy Bridges
Score: 5-5

[10:20] Team_060 possession (Score: 5-5)
Jaren George attempts a Layup. Contested by Kevin Simons (4.4 feet, MAN). Jaren George misses. Rebound secured by Kevin Simons.

[10:06] Team_091 possession (Score: 5-5)
Kevin Simons attempts a Dunk. BLOCKED BY JAREN GEORGE! Ball is loose! Rebound secured by Jaren George.

[09:52] Team_060 possession (Score: 5-5)
Immanuel Ming attempts a 3Pt. Contested by Rudy Bridges (5.1 feet, MAN). Immanuel Ming misses. Rebound secured by Rudy Bridges.

[09:38] Team_091 possession (Score: 5-5)
FOUL! Offensive foul on Kevin Simons! Jaren George drew the charge! [Team fouls: 2] (Kevin Simons: 2 personal fouls) TURNOVER! (dead ball)

[09:26] Team_060 possession (Score: 5-5)
Joel Morant attempts a Layup. BLOCKED BY KYRIE ROZIER! Ball deflects out of bounds off Joel Morant.

[09:09] Team_091 possession (Score: 5-5)
Rudy Bridges drives and kicks out. Kyrie Rozier attempts a Midrange. Contested by Joel Morant (2.2 feet, MAN). KYRIE ROZIER MAKES IT! Assist: D'Angelo Ingram
Score: 5-7

[08:52] Team_060 possession (Score: 5-7)
FOUL! Reach-in foul on Kevin Simons during the drive. [Team fouls: 3] No free throws, side out. (Kevin Simons: 3 personal fouls)

[08:36] Team_060 possession (Score: 5-7)
Julius Green attempts a 3Pt. Wide open! Isaiah Siakam is 8.1 feet away. [MAN] Julius Green misses. Rebound secured by Kevin Simons.

[08:26] Team_091 possession (Score: 5-7)
Kyrie Rozier drives, Jaren George stays with him. Kyrie Rozier attempts a Layup. Wide open! Jaren George is 6.8 feet away. [ZONE] KYRIE ROZIER MAKES IT! Assist: D'Angelo Ingram
Score: 5-9

[08:09] Team_060 possession (Score: 5-9)
Larry Westbrook attempts a Midrange. Wide open! D'Angelo Ingram is 6.4 feet away. [MAN] LARRY WESTBROOK MAKES IT!
Score: 7-9

[07:58] Team_091 possession (Score: 7-9)
D'Angelo Ingram attempts a 3Pt. Heavily contested by Julius Green (1.6 feet, ZONE)! D'Angelo Ingram misses. Offensive rebound by Rudy Bridges! Rudy Bridges kicks it out.

[07:46] Team_091 possession (Score: 7-9)
Kyrie Rozier attempts a Midrange. Contested by Larry Westbrook (5.5 feet, ZONE). Kyrie Rozier misses. Rebound secured by Jaren George.

[07:27] Team_060 possession (Score: 7-9)
FOUL! Reach-in foul on D'Angelo Ingram during the drive. [Team fouls: 4] No free throws, side out. (D'Angelo Ingram: 1 personal fouls)

[07:13] Team_060 possession (Score: 7-9)
Jaren George attempts a Layup. Contested by Kevin Simons (4.9 feet, MAN). Jaren George misses. FOUL! Loose ball foul on Rudy Bridges during the rebound battle. [IN THE BONUS! 5 team fouls] Jaren George to the line for 2 free throws. (Rudy Bridges: 1 personal fouls)   FT 1/2: MISS   FT 2/2: GOOD Jaren George makes 1/2 from the line.
Score: 8-9

[07:00] Team_091 possession (Score: 8-9)
Isaiah Siakam attempts a Midrange. Contested by Immanuel Ming (5.2 feet, ZONE). Isaiah Siakam misses. Rebound secured by Jaren George.

[06:42] Team_060 possession (Score: 8-9)
Immanuel Ming attempts a Midrange. Contested by D'Angelo Ingram (4.5 feet, ZONE). IMMANUEL MING MAKES IT!
Score: 10-9

[06:27] Team_091 possession (Score: 10-9)
Isaiah Siakam attempts a Midrange. Heavily contested by Julius Green (1.6 feet, MAN)! Isaiah Siakam misses. Rebound secured by Immanuel Ming.

[06:15] Team_060 possession (Score: 10-9)
Joel Morant drives, Kyrie Rozier stays with him. Joel Morant attempts a Layup. Contested by Kyrie Rozier (3.8 feet, MAN). JOEL MORANT MAKES IT! Assist: Immanuel Ming
Score: 12-9

[06:00] Team_091 possession (Score: 12-9)
Isaiah Siakam attempts a Midrange. Contested by Julius Green (3.8 feet, MAN). Isaiah Siakam misses. Rebound secured by Larry Westbrook.

[05:45] Team_060 possession (Score: 12-9)
Joel Morant throws a bad pass! Stolen by Kyrie Rozier! TURNOVER! (live ball)

[05:31] Team_091 possession (Score: 12-9)
Kevin Simons drives and kicks out. Rudy Bridges attempts a 3Pt. Contested by Immanuel Ming (5.3 feet, MAN). RUDY BRIDGES MAKES IT! Assist: D'Angelo Ingram
Score: 12-12

[05:16] Team_060 possession (Score: 12-12)
Jaren George drives, Kevin Simons stays with him. Jaren George attempts a Dunk. Heavily contested by Kevin Simons (1.6 feet, ZONE)! JAREN GEORGE MAKES IT! Assist: Larry Westbrook
Score: 14-12

[05:00] Team_091 possession (Score: 14-12)
Kevin Simons drives, picks up Jaren George. Help arrives from Julius Green! Kevin Simons attempts a Dunk. Contested by Julius Green (5.4 feet, ZONE). KEVIN SIMONS MAKES IT! Assist: Isaiah Siakam
Score: 14-14

[04:44] Team_060 possession (Score: 14-14)
FOUL! Reach-in foul on D'Angelo Ingram during the drive. [IN THE BONUS! 6 team fouls] Larry Westbrook to the line for 2 free throws. (D'Angelo Ingram: 2 personal fouls)   FT 1/2: GOOD   FT 2/2: GOOD Larry Westbrook makes 2/2 from the line.
Score: 16-14

[04:25] Team_091 possession (Score: 16-14)
FOUL! Holding foul on Julius Green. [Team fouls: 1] No free throws, side out. (Julius Green: 1 personal fouls)

[04:12] Team_091 possession (Score: 16-14)
D'Angelo Ingram attempts a Midrange. BLOCKED BY LARRY WESTBROOK! Ball is loose! Rebound secured by Larry Westbrook.

[04:00] Team_060 possession (Score: 16-14)
Jaren George drives, picks up Kevin Simons. Help arrives from Kyrie Rozier! Jaren George attempts a Layup. Contested by Kyrie Rozier (2.2 feet, MAN). JAREN GEORGE MAKES IT! Assist: Julius Green
Score: 18-14

[03:46] Team_091 possession (Score: 18-14)
Isaiah Siakam makes the Dunk and draws the foul on Julius Green! And-1! Isaiah Siakam to the line for 1. [Team fouls: 2] (Julius Green: 2 personal fouls)   FT 1/1: GOOD Isaiah Siakam makes 1/1 from the line.
Score: 18-17

[03:32] Team_060 possession (Score: 18-17)
Julius Green attempts a 3Pt. Wide open! Isaiah Siakam is 9.2 feet away. [MAN] JULIUS GREEN MAKES IT! Assist: Jaren George
Score: 21-17

[03:18] Team_091 possession (Score: 21-17)
Isaiah Siakam attempts a Midrange. Heavily contested by Julius Green (1.0 feet, MAN)! Isaiah Siakam misses. Rebound secured by Jaren George.

[03:06] Team_060 possession (Score: 21-17)
Joel Morant attempts a Midrange. Contested by Kyrie Rozier (5.2 feet, MAN). Joel Morant misses. Rebound secured by Kyrie Rozier.

[02:53] Team_091 possession (Score: 21-17)
Kyrie Rozier attempts a Midrange. Wide open! Joel Morant is 7.9 feet away. [MAN] KYRIE ROZIER MAKES IT! Assist: Rudy Bridges
Score: 21-19

[02:38] Team_060 possession (Score: 21-19)
Larry Westbrook attempts a 3Pt. Contested by D'Angelo Ingram (5.3 feet, MAN). Larry Westbrook misses. Rebound secured by Kyrie Rozier.

[02:23] Team_091 possession (Score: 21-19)
FOUL! Offensive foul on Kevin Simons! Jaren George drew the charge! [Team fouls: 7] (Kevin Simons: 4 personal fouls) TURNOVER! (dead ball)

[02:06] Team_060 possession (Score: 21-19)
Immanuel Ming attempts a Layup. Heavily contested by Kevin Simons (1.0 feet, ZONE)! Immanuel Ming misses. Rebound secured by Kyrie Rozier.

[01:54] Team_091 possession (Score: 21-19)
Isaiah Siakam attempts a 3Pt. Contested by Julius Green (3.8 feet, MAN). Isaiah Siakam misses. Rebound secured by Jaren George.

[01:40] Team_060 possession (Score: 21-19)
Immanuel Ming attempts a Midrange. Wide open! D'Angelo Ingram is 6.9 feet away. [ZONE] Immanuel Ming misses. Rebound secured by Rudy Bridges.

[01:28] Team_091 possession (Score: 21-19)
Rudy Bridges drives to the basket... Rudy Bridges loses the ball! Stripped by Larry Westbrook! TURNOVER! (live ball)

[01:14] Team_060 possession (Score: 21-19)
Joel Morant attempts a Midrange. Contested by Kyrie Rozier (2.9 feet, MAN). Joel Morant misses. Rebound secured by Kyrie Rozier.

[00:59] Team_091 possession (Score: 21-19)
Isaiah Siakam attempts a 3Pt. Heavily contested by Julius Green (1.4 feet, ZONE)! ISAIAH SIAKAM MAKES IT! Assist: Kyrie Rozier
Score: 21-22

[00:43] Team_060 possession (Score: 21-22)
FOUL! Shooting foul on Kyrie Rozier. Joel Morant to the line for 2 free throws. [BONUS: 8 team fouls] (Kyrie Rozier: 1 personal fouls)   FT 1/2: GOOD   FT 2/2: GOOD Joel Morant makes 2/2 from the line.
Score: 23-22

[00:28] Team_091 possession (Score: 23-22)
D'Angelo Ingram attempts a 3Pt. Wide open! Julius Green is 6.2 feet away. [ZONE] D'ANGELO INGRAM MAKES IT! Assist: Rudy Bridges
Score: 23-25

[00:11] Team_060 possession (Score: 23-25)
Larry Westbrook attempts a Midrange. Wide open! D'Angelo Ingram is 6.2 feet away. [MAN] Larry Westbrook misses. Offensive rebound by Immanuel Ming! Immanuel Ming kicks it out.

================================================================================
                              1ST QUARTER COMPLETE                              
================================================================================

1ST QUARTER SCORE: Team_060 23, Team_091 25

BOX SCORE:
================================================================================

Team_060
--------------------------------------------------------------------------------
Player                MIN  PTS  REB  AST  TO      FG   FG%      3P   3P%
--------------------------------------------------------------------------------
Immanuel Ming          12    7    2    1   0   3/7    42.9     0/0   0.0
Jaren George           12    5    6    2   0   3/4    75.0     0/0   0.0
Joel Morant            12    4    0    0   0   2/5    40.0     0/0   0.0
Larry Westbrook        12    4    2    1   0   2/3    66.7     0/0   0.0
Julius Green           12    3    0    2   0   1/2    50.0     0/0   0.0

TEAM: FG: 11/21 (52.4%), 3PT: 2/5 (40.0%), REB: 10 (1 off, 9 def), AST: 6, TO: 1
TEAM FOULS: 2


Team_091
--------------------------------------------------------------------------------
Player                MIN  PTS  REB  AST  TO      FG   FG%      3P   3P%
--------------------------------------------------------------------------------
Isaiah Siakam          12    8    0    1   0   3/8    37.5     0/0   0.0
Kyrie Rozier           12    6    5    2   0   3/5    60.0     0/0   0.0
Rudy Bridges           12    6    3    3   0   2/2   100.0     0/0   0.0
D'Angelo Ingram        12    3    0    3   0   1/2    50.0     0/0   0.0
Kevin Simons           12    2    2    0   0   1/2    50.0     0/0   0.0

TEAM: FG: 10/19 (52.6%), 3PT: 3/5 (60.0%), REB: 10 (1 off, 9 def), AST: 9, TO: 3
TEAM FOULS: 8 [Team_060 in BONUS]

================================================================================

================================================================================
                       2ND QUARTER - Team_060 vs Team_091                       
================================================================================

[12:00] Team_060 possession (Score: 23-25)
Joel Morant drives, Kevin Simons stays with him. Joel Morant attempts a Dunk. Wide open! Kevin Simons is 7.6 feet away. [ZONE] JOEL MORANT MAKES IT! Assist: Larry Westbrook
Score: 25-25

[11:43] Team_091 possession (Score: 25-25)
D'Angelo Ingram attempts a Layup. Wide open! Jaren George is 6.6 feet away. [ZONE] D'ANGELO INGRAM MAKES IT! Assist: Isaiah Siakam
Score: 25-27

[11:31] Team_060 possession (Score: 25-27)
Immanuel Ming attempts a Midrange. Contested by Rudy Bridges (4.4 feet, MAN). Immanuel Ming misses. Rebound secured by Rudy Bridges.

[11:15] Team_091 possession (Score: 25-27)
Kyrie Rozier attempts a Midrange. Contested by Joel Morant (4.4 feet, MAN). Kyrie Rozier misses. Rebound secured by Immanuel Ming.

[11:00] Team_060 possession (Score: 25-27)
Joel Morant attempts a 3Pt. Contested by Kyrie Rozier (3.3 feet, MAN). Joel Morant misses. Rebound secured by Rudy Bridges.

[10:46] Team_091 possession (Score: 25-27)
Kyrie Rozier attempts a 3Pt. Heavily contested by Joel Morant (1.4 feet, MAN)! Kyrie Rozier misses. Offensive rebound by Kevin Simons! Kevin Simons puts it back in!
Score: 25-29

[10:31] Team_060 possession (Score: 25-29)
FOUL! Offensive foul on Larry Westbrook! D'Angelo Ingram drew the charge! [Team fouls: 1] (Larry Westbrook: 1 personal fouls) TURNOVER! (dead ball)

[10:20] Team_091 possession (Score: 25-29)
Rudy Bridges drives and kicks out. D'Angelo Ingram attempts a 3Pt. Wide open! Larry Westbrook is 7.2 feet away. [MAN] D'ANGELO INGRAM MAKES IT! Assist: Isaiah Siakam
Score: 25-32

[10:06] Team_060 possession (Score: 25-32)
Joel Morant loses the ball! Stripped by Kyrie Rozier! TURNOVER! (live ball)

[09:49] Team_091 possession (Score: 25-32)
Rudy Bridges attempts a Layup. BLOCKED BY JAREN GEORGE! Ball goes out off Jaren George. Rudy Bridges's ball!

[09:34] Team_091 possession (Score: 25-32)
Rudy Bridges attempts a Layup. Contested by Immanuel Ming (3.5 feet, MAN). Rudy Bridges misses. Rebound secured by Jaren George.

[09:19] Team_060 possession (Score: 25-32)
Immanuel Ming attempts a Layup. Contested by Kevin Simons (3.5 feet, ZONE). Immanuel Ming misses. Offensive rebound by Jaren George! Jaren George kicks it out.

[09:04] Team_060 possession (Score: 25-32)
Jaren George drives to the basket... Jaren George throws a bad pass out of bounds! TURNOVER! (dead ball)

[09:04] Substitution (Team_060): Joel Morant OUT → Domantas Barnes IN (stamina_rule2)

[09:04] Substitution (Team_060): Julius Green OUT → Rudy Ginobili IN (stamina_rule2)

[09:04] Substitution (Team_060): Immanuel Ming OUT → Jarrett Wagner IN (stamina_rule2)

[09:04] Substitution (Team_060): Larry Westbrook OUT → Yao Tatum IN (stamina_rule2)

[09:04] Substitution (Team_060): Jaren George OUT → Klay Haliburton IN (stamina_rule2)

[09:04] Substitution (Team_091): Kyrie Rozier OUT → Karl Morant IN (stamina_rule2)

[09:04] Substitution (Team_091): Isaiah Siakam OUT → Julius Barnes IN (stamina_rule2)

[09:04] Substitution (Team_091): Rudy Bridges OUT → Tim Antetokounmpo IN (stamina_rule2)

[09:04] Substitution (Team_091): D'Angelo Ingram OUT → Zion Mitchell IN (stamina_rule2)

[09:04] Substitution (Team_091): Kevin Simons OUT → Ja George IN (stamina_rule2)

[08:54] Team_091 possession (Score: 25-32)
FOUL! Offensive foul on Ja George! Klay Haliburton drew the charge! [Team fouls: 1] (Ja George: 1 personal fouls) TURNOVER! (dead ball)

[08:37] Team_060 possession (Score: 25-32)
Jarrett Wagner attempts a 3Pt. Contested by Karl Morant (5.7 feet, ZONE). Jarrett Wagner misses. Rebound secured by Ja George.

[08:24] Team_091 possession (Score: 25-32)
FOUL! Holding foul on Domantas Barnes. [Team fouls: 2] No free throws, side out. (Domantas Barnes: 1 personal fouls)

[08:07] Team_091 possession (Score: 25-32)
Tim Antetokounmpo drives, Jarrett Wagner stays with him. Tim Antetokounmpo attempts a Dunk. Wide open! Jarrett Wagner is 6.1 feet away. [MAN] TIM ANTETOKOUNMPO MAKES IT! Assist: Zion Mitchell
Score: 25-34

[07:54] Team_060 possession (Score: 25-34)
Yao Tatum drives, picks up Zion Mitchell. Help arrives from Karl Morant! Yao Tatum attempts a Layup. Wide open! Karl Morant is 6.1 feet away. [ZONE] Yao Tatum misses. Rebound secured by Zion Mitchell.

[07:42] Team_091 possession (Score: 25-34)
Julius Barnes attempts a Layup. BLOCKED BY KLAY HALIBURTON! Ball goes out off Klay Haliburton. Julius Barnes's ball!

[07:24] Team_091 possession (Score: 25-34)
Karl Morant drives to the basket... Karl Morant loses control! Ball rolls out of bounds! TURNOVER! (dead ball)

[07:09] Team_060 possession (Score: 25-34)
Rudy Ginobili attempts a Midrange. Contested by Zion Mitchell (5.1 feet, ZONE). RUDY GINOBILI MAKES IT!
Score: 27-34

[06:57] Team_091 possession (Score: 27-34)
Julius Barnes attempts a 3Pt. Contested by Rudy Ginobili (4.2 feet, MAN). Julius Barnes misses. Rebound secured by Domantas Barnes.

[06:45] Team_060 possession (Score: 27-34)
Yao Tatum drives to the basket... Yao Tatum throws a bad pass! Stolen by Zion Mitchell! TURNOVER! (live ball)

[06:31] Team_091 possession (Score: 27-34)
Ja George drives, Klay Haliburton stays with him. Ja George attempts a Layup. Heavily contested by Klay Haliburton (1.4 feet, ZONE)! Ja George misses. Rebound secured by Rudy Ginobili.

[06:18] Team_060 possession (Score: 27-34)
FOUL! Holding foul on Zion Mitchell. [Team fouls: 2] No free throws, side out. (Zion Mitchell: 1 personal fouls)

[06:03] Team_060 possession (Score: 27-34)
Domantas Barnes attempts a 3Pt. Contested by Karl Morant (6.0 feet, MAN). Domantas Barnes misses. Rebound secured by Tim Antetokounmpo.

[05:49] Team_091 possession (Score: 27-34)
Tim Antetokounmpo drives, Jarrett Wagner stays with him. Tim Antetokounmpo attempts a Layup. Contested by Jarrett Wagner (2.8 feet, MAN). TIM ANTETOKOUNMPO MAKES IT! Assist: Zion Mitchell
Score: 27-36

[05:36] Team_060 possession (Score: 27-36)
Rudy Ginobili attempts a 3Pt. Contested by Julius Barnes (4.3 feet, MAN). Rudy Ginobili misses. Rebound secured by Tim Antetokounmpo.

[05:23] Team_091 possession (Score: 27-36)
Tim Antetokounmpo attempts a 3Pt. Contested by Jarrett Wagner (5.0 feet, MAN). Tim Antetokounmpo misses. Rebound secured by Domantas Barnes.

[05:11] Team_060 possession (Score: 27-36)
Domantas Barnes drives, picks up Zion Mitchell. Help arrives from Karl Morant! Domantas Barnes attempts a Layup. Contested by Karl Morant (3.8 feet, ZONE). DOMANTAS BARNES MAKES IT! Assist: Rudy Ginobili
Score: 29-36

[04:57] Team_091 possession (Score: 29-36)
Zion Mitchell drives, Yao Tatum stays with him. Zion Mitchell attempts a Dunk. Wide open! Yao Tatum is 8.7 feet away. [MAN] ZION MITCHELL MAKES IT!
Score: 29-38

[04:43] Team_060 possession (Score: 29-38)
FOUL! Shooting foul on Ja George. Klay Haliburton to the line for 2 free throws. [Team fouls: 3] (Ja George: 2 personal fouls)   FT 1/2: GOOD   FT 2/2: GOOD Klay Haliburton makes 2/2 from the line.
Score: 31-38

[04:25] Team_091 possession (Score: 31-38)
Karl Morant drives to the basket... FOUL! Offensive foul on Karl Morant! Klay Haliburton drew the charge! [Team fouls: 4] (Karl Morant: 1 personal fouls) TURNOVER! (dead ball)

[04:11] Team_060 possession (Score: 31-38)
Domantas Barnes attempts a 3Pt. Contested by Karl Morant (4.1 feet, MAN). DOMANTAS BARNES MAKES IT!
Score: 34-38

[03:58] Team_091 possession (Score: 34-38)
Karl Morant attempts a Layup. BLOCKED BY DOMANTAS BARNES! Ball is loose! Rebound secured by Klay Haliburton.

[03:46] Team_060 possession (Score: 34-38)
Yao Tatum loses the ball! Stripped by Zion Mitchell! TURNOVER! (live ball)

[03:30] Team_091 possession (Score: 34-38)
Zion Mitchell attempts a Layup. Wide open! Yao Tatum is 6.2 feet away. [MAN] ZION MITCHELL MAKES IT! Assist: Tim Antetokounmpo
Score: 34-40

[03:14] Team_060 possession (Score: 34-40)
Jarrett Wagner makes the Layup and draws the foul on Ja George! And-1! Jarrett Wagner to the line for 1. [BONUS: 5 team fouls] (Ja George: 3 personal fouls)   FT 1/1: GOOD Jarrett Wagner makes 1/1 from the line.
Score: 37-40

[02:58] Team_091 possession (Score: 37-40)
Julius Barnes attempts a 3Pt. Contested by Rudy Ginobili (3.6 feet, MAN). Julius Barnes misses. Rebound secured by Klay Haliburton.

[02:47] Team_060 possession (Score: 37-40)
Rudy Ginobili attempts a 3Pt. Wide open! Julius Barnes is 6.5 feet away. [MAN] Rudy Ginobili misses. Rebound secured by Ja George.

[02:37] Team_091 possession (Score: 37-40)
Ja George attempts a Midrange. Contested by Klay Haliburton (5.7 feet, MAN). JA GEORGE MAKES IT! Assist: Tim Antetokounmpo
Score: 37-42

[02:20] Team_060 possession (Score: 37-42)
Jarrett Wagner attempts a Layup. Wide open! Tim Antetokounmpo is 9.7 feet away. [MAN] Jarrett Wagner misses. Rebound secured by Tim Antetokounmpo.

[02:07] Team_091 possession (Score: 37-42)
Julius Barnes attempts a Midrange. Heavily contested by Rudy Ginobili (1.0 feet, MAN)! Julius Barnes misses. Rebound secured by Rudy Ginobili.

[01:48] Team_060 possession (Score: 37-42)
Jarrett Wagner attempts a Midrange. Wide open! Julius Barnes is 7.2 feet away. [ZONE] Jarrett Wagner misses. Offensive rebound by Klay Haliburton! Klay Haliburton's putback is no good. Offensive rebound by Domantas Barnes! Domantas Barnes kicks it out.

[01:29] Team_060 possession (Score: 37-42)
Jarrett Wagner attempts a Layup. Contested by Zion Mitchell (5.4 feet, ZONE). Jarrett Wagner misses. Offensive rebound by Domantas Barnes! Domantas Barnes kicks it out.

[01:14] Team_060 possession (Score: 37-42)
Yao Tatum attempts a 3Pt. Wide open! Zion Mitchell is 6.1 feet away. [MAN] YAO TATUM MAKES IT!
Score: 40-42

[00:59] Team_091 possession (Score: 40-42)
Julius Barnes attempts a 3Pt. Wide open! Domantas Barnes is 7.1 feet away. [ZONE] Julius Barnes misses. Offensive rebound by Ja George! Ja George kicks it out.

[00:44] Team_091 possession (Score: 40-42)
Ja George attempts a 3Pt. Contested by Klay Haliburton (3.6 feet, MAN). JA GEORGE MAKES IT! Assist: Zion Mitchell
Score: 40-45

[00:29] Team_060 possession (Score: 40-45)
Rudy Ginobili attempts a 3Pt. Wide open! Julius Barnes is 6.2 feet away. [MAN] Rudy Ginobili misses. Rebound secured by Tim Antetokounmpo.

[00:15] Team_091 possession (Score: 40-45)
Zion Mitchell attempts a 3Pt. Wide open! Jarrett Wagner is 7.4 feet away. [ZONE] ZION MITCHELL MAKES IT! Assist: Karl Morant
Score: 40-48

================================================================================
                              2ND QUARTER COMPLETE                              
================================================================================

2ND QUARTER SCORE: Team_060 17, Team_091 23

BOX SCORE:
================================================================================

Team_060
--------------------------------------------------------------------------------
Player                MIN  PTS  REB  AST  TO      FG   FG%      3P   3P%
--------------------------------------------------------------------------------
Domantas Barnes         9    5    4    0   0   2/3    66.7     0/0   0.0
Jarrett Wagner          9    3    0    0   0   1/3    33.3     0/0   0.0
Yao Tatum               9    3    0    0   0   1/2    50.0     0/0   0.0
Joel Morant            15    2    0    0   0   1/2    50.0     0/0   0.0
Rudy Ginobili           9    2    2    1   0   1/4    25.0     0/0   0.0
Klay Haliburton         9    2    2    0   0   1/1   100.0     0/0   0.0
Larry Westbrook        15    0    0    1   0   0/0     0.0     0/0   0.0
Immanuel Ming          15    0    1    0   0   0/1     0.0     0/0   0.0
Jaren George           15    0    2    0   0   0/0     0.0     0/0   0.0

TEAM: FG: 7/16 (43.8%), 3PT: 2/8 (25.0%), REB: 11 (3 off, 8 def), AST: 2, TO: 5
TEAM FOULS: 2


Team_091
--------------------------------------------------------------------------------
Player                MIN  PTS  REB  AST  TO      FG   FG%      3P   3P%
--------------------------------------------------------------------------------
Zion Mitchell           9    7    1    3   0   3/3   100.0     0/0   0.0
D'Angelo Ingram        15    5    0    0   0   2/2   100.0     0/0   0.0
Ja George               9    5    3    0   0   2/3    66.7     0/0   0.0
Tim Antetokounmpo       9    4    4    2   0   2/3    66.7     0/0   0.0
Kevin Simons           15    2    1    0   0   1/1   100.0     0/0   0.0
Isaiah Siakam          15    0    0    2   0   0/0     0.0     0/0   0.0
Rudy Bridges           15    0    2    0   0   0/1     0.0     0/0   0.0
Kyrie Rozier           15    0    0    0   0   0/1     0.0     0/0   0.0
Julius Barnes           9    0    0    0   0   0/3     0.0     0/0   0.0
Karl Morant             9    0    0    1   0   0/1     0.0     0/0   0.0

TEAM: FG: 10/18 (55.6%), 3PT: 3/6 (50.0%), REB: 11 (2 off, 9 def), AST: 8, TO: 3
TEAM FOULS: 5 [Team_060 in BONUS]

================================================================================

================================================================================
                       3RD QUARTER - Team_060 vs Team_091                       
================================================================================

[12:00] Team_060 possession (Score: 40-48)
Jaren George drives to the basket... Jaren George loses the ball! Stripped by Kevin Simons! TURNOVER! (live ball)

[11:49] Team_091 possession (Score: 40-48)
Rudy Bridges drives, Jaren George stays with him. Rudy Bridges attempts a Layup. Contested by Jaren George (2.9 feet, ZONE). RUDY BRIDGES MAKES IT! Assist: D'Angelo Ingram
Score: 40-50

[11:35] Team_060 possession (Score: 40-50)
Julius Green attempts a Midrange. Heavily contested by Rudy Bridges (0.7 feet, ZONE)! JULIUS GREEN MAKES IT! Assist: Larry Westbrook
Score: 42-50

[11:17] Team_091 possession (Score: 42-50)
Rudy Bridges throws a bad pass out of bounds! TURNOVER! (dead ball)

[11:07] Team_060 possession (Score: 42-50)
Julius Green attempts a Layup. Wide open! Isaiah Siakam is 6.2 feet away. [MAN] JULIUS GREEN MAKES IT! Assist: Joel Morant
Score: 44-50

[10:52] Team_091 possession (Score: 44-50)
Kyrie Rozier attempts a 3Pt. Contested by Joel Morant (4.9 feet, MAN). Kyrie Rozier misses. FOUL! Loose ball foul on Immanuel Ming during the rebound battle. [Team fouls: 1] No free throws, side out. (Immanuel Ming: 1 personal fouls)

[10:40] Team_091 possession (Score: 44-50)
Kevin Simons attempts a Layup. Wide open! Jaren George is 6.7 feet away. [MAN] KEVIN SIMONS MAKES IT! Assist: Kyrie Rozier
Score: 44-52

[10:22] Team_060 possession (Score: 44-52)
Larry Westbrook attempts a Midrange. Wide open! Isaiah Siakam is 9.9 feet away. [ZONE] LARRY WESTBROOK MAKES IT! Assist: Immanuel Ming
Score: 46-52

[10:10] Team_091 possession (Score: 46-52)
Isaiah Siakam makes the Dunk and draws the foul on Immanuel Ming! And-1! Isaiah Siakam to the line for 1. [Team fouls: 2] (Immanuel Ming: 2 personal fouls)   FT 1/1: GOOD Isaiah Siakam makes 1/1 from the line.
Score: 46-55

[10:00] Team_060 possession (Score: 46-55)
Julius Green attempts a Layup. Wide open! Kevin Simons is 6.6 feet away. [ZONE] JULIUS GREEN MAKES IT!
Score: 48-55

[09:44] Team_091 possession (Score: 48-55)
Kyrie Rozier attempts a Midrange. Contested by Joel Morant (4.5 feet, ZONE). KYRIE ROZIER MAKES IT! Assist: Kevin Simons
Score: 48-57

[09:33] Team_060 possession (Score: 48-57)
Joel Morant drives and kicks out. Joel Morant attempts a Midrange. Contested by Kyrie Rozier (3.3 feet, MAN). Joel Morant misses. Rebound secured by Kevin Simons.

[09:18] Team_091 possession (Score: 48-57)
D'Angelo Ingram attempts a Midrange. Wide open! Larry Westbrook is 6.3 feet away. [MAN] D'Angelo Ingram misses. Rebound secured by Jaren George.

[09:03] Team_060 possession (Score: 48-57)
Jaren George drives and kicks out. Immanuel Ming attempts a 3Pt. Contested by Kyrie Rozier (4.5 feet, ZONE). Immanuel Ming misses. Rebound secured by Rudy Bridges.

[08:50] Team_091 possession (Score: 48-57)
Rudy Bridges drives and kicks out. Isaiah Siakam attempts a 3Pt. Heavily contested by Julius Green (2.0 feet, ZONE)! Isaiah Siakam misses. Rebound secured by Jaren George.

[08:33] Team_060 possession (Score: 48-57)
Larry Westbrook throws a bad pass! Stolen by D'Angelo Ingram! TURNOVER! (live ball)

[08:14] Team_091 possession (Score: 48-57)
Kyrie Rozier attempts a 3Pt. Contested by Joel Morant (5.5 feet, MAN). Kyrie Rozier misses. Rebound secured by Jaren George.

[08:04] Team_060 possession (Score: 48-57)
Julius Green attempts a Layup. Wide open! Isaiah Siakam is 8.6 feet away. [MAN] JULIUS GREEN MAKES IT! Assist: Jaren George
Score: 50-57

[07:50] Team_091 possession (Score: 50-57)
Kevin Simons attempts a Midrange. Contested by Larry Westbrook (3.0 feet, ZONE). Kevin Simons misses. Offensive rebound by Kevin Simons! Kevin Simons puts it back in!
Score: 50-59

[07:36] Team_060 possession (Score: 50-59)
Immanuel Ming attempts a Midrange. Contested by Rudy Bridges (5.6 feet, MAN). IMMANUEL MING MAKES IT! Assist: Julius Green
Score: 52-59

[07:24] Team_091 possession (Score: 52-59)
Kevin Simons attempts a Midrange. Contested by Jaren George (4.5 feet, MAN). Kevin Simons misses. Rebound secured by Jaren George.

[07:10] Team_060 possession (Score: 52-59)
FOUL! Holding foul on Kevin Simons. [Team fouls: 1] No free throws, side out. (Kevin Simons: 1 personal fouls)

[06:57] Team_060 possession (Score: 52-59)
Julius Green attempts a 3Pt. Contested by Isaiah Siakam (4.3 feet, MAN). Julius Green misses. Offensive rebound by Jaren George! Jaren George puts it back in!
Score: 54-59

[06:43] Team_091 possession (Score: 54-59)
Kevin Simons drives, picks up Jaren George. Help arrives from Julius Green! Kevin Simons attempts a Dunk. Wide open! Julius Green is 6.8 feet away. [ZONE] KEVIN SIMONS MAKES IT!
Score: 54-61

[06:26] Team_060 possession (Score: 54-61)
Joel Morant attempts a 3Pt. Contested by Kyrie Rozier (5.0 feet, ZONE). JOEL MORANT MAKES IT! Assist: Immanuel Ming
Score: 57-61

[06:08] Team_091 possession (Score: 57-61)
Isaiah Siakam drives to the basket... Isaiah Siakam throws a bad pass! Stolen by Julius Green! TURNOVER! (live ball)

[05:54] Team_060 possession (Score: 57-61)
Joel Morant drives, Kevin Simons stays with him. Joel Morant attempts a Layup. Contested by Kevin Simons (2.8 feet, ZONE). JOEL MORANT MAKES IT! Assist: Jaren George
Score: 59-61

[05:41] Team_091 possession (Score: 59-61)
Kyrie Rozier drives, picks up Joel Morant. Help arrives from Immanuel Ming! Kyrie Rozier attempts a Layup. Contested by Immanuel Ming (5.5 feet, MAN). KYRIE ROZIER MAKES IT! Assist: Isaiah Siakam
Score: 59-63

[05:24] Team_060 possession (Score: 59-63)
Jaren George attempts a 3Pt. Contested by Kyrie Rozier (2.8 feet, ZONE). Jaren George misses. Rebound secured by Kyrie Rozier.

[05:10] Team_091 possession (Score: 59-63)
Rudy Bridges attempts a Layup. Heavily contested by Immanuel Ming (1.5 feet, MAN)! RUDY BRIDGES MAKES IT! Assist: Isaiah Siakam
Score: 59-65

[04:56] Team_060 possession (Score: 59-65)
Jaren George drives, picks up Kevin Simons. Help arrives from Kyrie Rozier! Jaren George attempts a Layup. Contested by Kyrie Rozier (4.0 feet, MAN). Jaren George misses. Rebound secured by Rudy Bridges.

[04:44] Team_091 possession (Score: 59-65)
Isaiah Siakam attempts a 3Pt. Contested by Julius Green (2.6 feet, ZONE). Isaiah Siakam misses. Rebound secured by Jaren George.

[04:25] Team_060 possession (Score: 59-65)
Jaren George drives, Kevin Simons stays with him. Jaren George attempts a Dunk. Wide open! Kevin Simons is 8.3 feet away. [ZONE] JAREN GEORGE MAKES IT! Assist: Julius Green
Score: 61-65

[04:09] Team_091 possession (Score: 61-65)
Kevin Simons loses the ball! Stripped by Jaren George! TURNOVER! (live ball)

[03:56] Team_060 possession (Score: 61-65)
Larry Westbrook makes the Layup and draws the foul on D'Angelo Ingram! And-1! Larry Westbrook to the line for 1. [Team fouls: 2] (D'Angelo Ingram: 1 personal fouls)   FT 1/1: GOOD Larry Westbrook makes 1/1 from the line.
Score: 64-65

[03:42] Team_091 possession (Score: 64-65)
Kyrie Rozier attempts a Midrange. Contested by Joel Morant (4.8 feet, MAN). KYRIE ROZIER MAKES IT!
Score: 64-67

[03:26] Team_060 possession (Score: 64-67)
Larry Westbrook attempts a Midrange. Contested by D'Angelo Ingram (2.2 feet, ZONE). Larry Westbrook misses. Rebound secured by Kevin Simons.

[03:15] Team_091 possession (Score: 64-67)
D'Angelo Ingram drives, picks up Larry Westbrook. Help arrives from Julius Green! D'Angelo Ingram attempts a Layup. Contested by Julius Green (4.5 feet, MAN). D'ANGELO INGRAM MAKES IT!
Score: 64-69

[03:01] Team_060 possession (Score: 64-69)
Immanuel Ming attempts a 3Pt. Contested by Kyrie Rozier (3.6 feet, ZONE). IMMANUEL MING MAKES IT! Assist: Joel Morant
Score: 67-69

[02:44] Team_091 possession (Score: 67-69)
D'Angelo Ingram drives, Jaren George stays with him. D'Angelo Ingram attempts a Dunk. Wide open! Jaren George is 8.9 feet away. [ZONE] D'ANGELO INGRAM MAKES IT!
Score: 67-71

[02:32] Team_060 possession (Score: 67-71)
Julius Green attempts a 3Pt. Contested by Kyrie Rozier (5.8 feet, ZONE). Julius Green misses. Rebound secured by Kevin Simons.

[02:14] Team_091 possession (Score: 67-71)
FOUL! Offensive foul on Isaiah Siakam! Julius Green drew the charge! [Team fouls: 3] (Isaiah Siakam: 1 personal fouls) TURNOVER! (dead ball)

[02:02] Team_060 possession (Score: 67-71)
Immanuel Ming attempts a 3Pt. Contested by Kyrie Rozier (5.1 feet, ZONE). Immanuel Ming misses. Rebound secured by Kevin Simons.

[01:52] Team_091 possession (Score: 67-71)
FOUL! Shooting foul on Jaren George. Rudy Bridges to the line for 2 free throws. [Team fouls: 3] (Jaren George: 1 personal fouls)   FT 1/2: MISS   FT 2/2: GOOD Rudy Bridges makes 1/2 from the line.
Score: 67-72

[01:38] Team_060 possession (Score: 67-72)
Joel Morant attempts a 3Pt. Contested by Kyrie Rozier (4.2 feet, MAN). JOEL MORANT MAKES IT! Assist: Immanuel Ming
Score: 70-72

[01:22] Team_091 possession (Score: 70-72)
FOUL! Reach-in foul on Julius Green during the drive. [Team fouls: 4] No free throws, side out. (Julius Green: 1 personal fouls)

[01:05] Team_091 possession (Score: 70-72)
Kevin Simons drives, Jaren George stays with him. Kevin Simons attempts a Dunk. Contested by Jaren George (4.9 feet, ZONE). KEVIN SIMONS MAKES IT!
Score: 70-74

[00:50] Team_060 possession (Score: 70-74)
Immanuel Ming attempts a 3Pt. Contested by Rudy Bridges (5.9 feet, MAN). Immanuel Ming misses. Rebound secured by Kyrie Rozier.

[00:37] Team_091 possession (Score: 70-74)
FOUL! Reach-in foul on Jaren George during the drive. [IN THE BONUS! 5 team fouls] Kevin Simons to the line for 2 free throws. (Jaren George: 2 personal fouls)   FT 1/2: GOOD   FT 2/2: GOOD Kevin Simons makes 2/2 from the line.
Score: 70-76

[00:24] Team_060 possession (Score: 70-76)
FOUL! Reach-in foul on Rudy Bridges during the drive. [Team fouls: 4] No free throws, side out. (Rudy Bridges: 1 personal fouls)

[00:10] Team_060 possession (Score: 70-76)
Jaren George throws a bad pass! Stolen by Kevin Simons! TURNOVER! (live ball)

================================================================================
                              3RD QUARTER COMPLETE                              
================================================================================

3RD QUARTER SCORE: Team_060 30, Team_091 28

BOX SCORE:
================================================================================

Team_060
--------------------------------------------------------------------------------
Player                MIN  PTS  REB  AST  TO      FG   FG%      3P   3P%
--------------------------------------------------------------------------------
Julius Green           27    8    0    2   0   4/5    80.0     0/0   0.0
Joel Morant            27    8    0    2   0   3/4    75.0     0/0   0.0
Larry Westbrook        27    5    0    1   0   2/3    66.7     0/0   0.0
Immanuel Ming          27    5    0    3   0   2/4    50.0     0/0   0.0
Jaren George           27    4    6    2   0   2/5    40.0     0/0   0.0

TEAM: FG: 13/21 (61.9%), 3PT: 4/8 (50.0%), REB: 6 (1 off, 5 def), AST: 10, TO: 3
TEAM FOULS: 5 [Team_091 in BONUS]


Team_091
--------------------------------------------------------------------------------
Player                MIN  PTS  REB  AST  TO      FG   FG%      3P   3P%
--------------------------------------------------------------------------------
Kevin Simons           27   10    5    1   0   5/6    83.3     0/0   0.0
Kyrie Rozier           27    6    2    1   0   3/4    75.0     0/0   0.0
Rudy Bridges           27    5    3    0   0   3/4    75.0     0/0   0.0
D'Angelo Ingram        27    4    0    1   0   2/3    66.7     0/0   0.0
Isaiah Siakam          27    3    0    2   0   1/2    50.0     0/0   0.0

TEAM: FG: 14/19 (73.7%), 3PT: 0/2 (0.0%), REB: 10 (2 off, 8 def), AST: 5, TO: 4
TEAM FOULS: 4

================================================================================

================================================================================
                       4TH QUARTER - Team_060 vs Team_091                       
================================================================================

[12:00] Team_060 possession (Score: 70-76)
FOUL! Holding foul on Rudy Bridges. [Team fouls: 1] No free throws, side out. (Rudy Bridges: 1 personal fouls)

[11:47] Team_060 possession (Score: 70-76)
FOUL! Shooting foul on Kevin Simons. Jaren George to the line for 2 free throws. [Team fouls: 2] (Kevin Simons: 1 personal fouls)   FT 1/2: GOOD   FT 2/2: GOOD Jaren George makes 2/2 from the line.
Score: 72-76

[11:35] Team_091 possession (Score: 72-76)
Isaiah Siakam attempts a 3Pt. Contested by Julius Green (2.7 feet, ZONE). Isaiah Siakam misses. Rebound secured by Jaren George.

[11:23] Team_060 possession (Score: 72-76)
Jaren George attempts a Midrange. Contested by Kevin Simons (4.5 feet, MAN). Jaren George misses. Rebound secured by Rudy Bridges.

[11:06] Team_091 possession (Score: 72-76)
Isaiah Siakam attempts a Midrange. Wide open! Julius Green is 7.4 feet away. [MAN] Isaiah Siakam misses. Rebound secured by Immanuel Ming.

[10:49] Team_060 possession (Score: 72-76)
Larry Westbrook attempts a Midrange. Contested by Isaiah Siakam (5.4 feet, ZONE). Larry Westbrook misses. Rebound secured by Kevin Simons.

[10:37] Team_091 possession (Score: 72-76)
Isaiah Siakam drives to the basket... Isaiah Siakam loses control! Ball rolls out of bounds! TURNOVER! (dead ball)

[10:37] Substitution (Team_060): Joel Morant OUT → Domantas Barnes IN (stamina_rule2)

[10:37] Substitution (Team_060): Julius Green OUT → Rudy Ginobili IN (stamina_rule2)

[10:37] Substitution (Team_060): Immanuel Ming OUT → Jarrett Wagner IN (stamina_rule2)

[10:37] Substitution (Team_060): Larry Westbrook OUT → Yao Tatum IN (stamina_rule2)

[10:37] Substitution (Team_060): Jaren George OUT → Klay Haliburton IN (stamina_rule2)

[10:37] Substitution (Team_091): Kyrie Rozier OUT → Karl Morant IN (stamina_rule2)

[10:37] Substitution (Team_091): Isaiah Siakam OUT → Julius Barnes IN (stamina_rule2)

[10:37] Substitution (Team_091): Rudy Bridges OUT → Tim Antetokounmpo IN (stamina_rule2)

[10:37] Substitution (Team_091): D'Angelo Ingram OUT → Zion Mitchell IN (stamina_rule2)

[10:37] Substitution (Team_091): Kevin Simons OUT → Ja George IN (stamina_rule2)

[10:24] Team_060 possession (Score: 72-76)
FOUL! Reach-in foul on Ja George during the drive. [Team fouls: 3] No free throws, side out. (Ja George: 1 personal fouls)

[10:08] Team_060 possession (Score: 72-76)
Yao Tatum attempts a Midrange. Wide open! Zion Mitchell is 6.8 feet away. [ZONE] YAO TATUM MAKES IT! Assist: Domantas Barnes
Score: 74-76

[09:51] Team_091 possession (Score: 74-76)
Tim Antetokounmpo attempts a 3Pt. Contested by Domantas Barnes (4.7 feet, ZONE). Tim Antetokounmpo misses. Rebound secured by Domantas Barnes.

[09:37] Team_060 possession (Score: 74-76)
Yao Tatum loses the ball! Stripped by Zion Mitchell! TURNOVER! (live ball)

[09:19] Team_091 possession (Score: 74-76)
FOUL! Shooting foul on Klay Haliburton. Karl Morant to the line for 2 free throws. [Team fouls: 1] (Klay Haliburton: 1 personal fouls)   FT 1/2: GOOD   FT 2/2: MISS Karl Morant makes 1/2 from the line. Offensive rebound by Zion Mitchell! Zion Mitchell kicks it out.
Score: 74-77

[09:07] Team_091 possession (Score: 74-77)
Zion Mitchell attempts a Midrange. Contested by Yao Tatum (5.4 feet, MAN). Zion Mitchell misses. Offensive rebound by Zion Mitchell! Zion Mitchell kicks it out.

[08:56] Team_091 possession (Score: 74-77)
Ja George attempts a Midrange. Contested by Klay Haliburton (5.1 feet, MAN). Ja George misses. Rebound secured by Domantas Barnes.

[08:43] Team_060 possession (Score: 74-77)
Yao Tatum attempts a 3Pt. Contested by Karl Morant (5.0 feet, ZONE). Yao Tatum misses. Rebound secured by Ja George.

[08:29] Team_091 possession (Score: 74-77)
Karl Morant attempts a 3Pt. Contested by Domantas Barnes (5.3 feet, ZONE). Karl Morant misses. Rebound secured by Domantas Barnes.

[08:13] Team_060 possession (Score: 74-77)
Rudy Ginobili attempts a Midrange. Contested by Julius Barnes (4.7 feet, ZONE). Rudy Ginobili misses. Rebound secured by Zion Mitchell.

[07:57] Team_091 possession (Score: 74-77)
Karl Morant attempts a Layup. Contested by Klay Haliburton (2.9 feet, ZONE). KARL MORANT MAKES IT! Assist: Ja George
Score: 74-79

[07:43] Team_060 possession (Score: 74-79)
Yao Tatum drives, Zion Mitchell stays with him. Yao Tatum attempts a Dunk. Wide open! Zion Mitchell is 6.2 feet away. [MAN] YAO TATUM MAKES IT! Assist: Domantas Barnes
Score: 76-79

[07:30] Team_091 possession (Score: 76-79)
Tim Antetokounmpo attempts a 3Pt. Contested by Jarrett Wagner (3.7 feet, MAN). TIM ANTETOKOUNMPO MAKES IT! Assist: Zion Mitchell
Score: 76-82

[07:13] Team_060 possession (Score: 76-82)
Jarrett Wagner attempts a 3Pt. Wide open! Tim Antetokounmpo is 8.9 feet away. [MAN] Jarrett Wagner misses. Rebound secured by Ja George.

[06:58] Team_091 possession (Score: 76-82)
FOUL! Reach-in foul on Yao Tatum during the drive. [Team fouls: 2] No free throws, side out. (Yao Tatum: 1 personal fouls)

[06:47] Team_091 possession (Score: 76-82)
Julius Barnes attempts a Midrange. Contested by Rudy Ginobili (4.8 feet, MAN). Julius Barnes misses. Rebound secured by Domantas Barnes.

[06:33] Team_060 possession (Score: 76-82)
Domantas Barnes attempts a Layup. Contested by Zion Mitchell (3.4 feet, ZONE). DOMANTAS BARNES MAKES IT! Assist: Rudy Ginobili
Score: 78-82

[06:20] Team_091 possession (Score: 78-82)
Tim Antetokounmpo attempts a 3Pt. Contested by Domantas Barnes (4.3 feet, ZONE). Tim Antetokounmpo misses. Rebound secured by Klay Haliburton.

[06:08] Team_060 possession (Score: 78-82)
Rudy Ginobili attempts a Midrange. Contested by Julius Barnes (5.4 feet, MAN). RUDY GINOBILI MAKES IT! Assist: Klay Haliburton
Score: 80-82

[05:51] Team_091 possession (Score: 80-82)
Karl Morant drives, Klay Haliburton stays with him. Karl Morant attempts a Dunk. Wide open! Klay Haliburton is 7.2 feet away. [ZONE] Karl Morant misses. Offensive rebound by Zion Mitchell! Zion Mitchell kicks it out.

[05:35] Team_091 possession (Score: 80-82)
FOUL! Shooting foul on Rudy Ginobili. Julius Barnes to the line for 3 free throws. [Team fouls: 3] (Rudy Ginobili: 1 personal fouls)   FT 1/3: GOOD   FT 2/3: GOOD   FT 3/3: GOOD Julius Barnes makes 3/3 from the line.
Score: 80-85

[05:22] Team_060 possession (Score: 80-85)
Rudy Ginobili attempts a 3Pt. Wide open! Karl Morant is 6.7 feet away. [ZONE] Rudy Ginobili misses. Rebound secured by Ja George.

[05:06] Team_091 possession (Score: 80-85)
Karl Morant throws a bad pass! Stolen by Domantas Barnes! TURNOVER! (live ball)

[04:53] Team_060 possession (Score: 80-85)
Jarrett Wagner attempts a 3Pt. Wide open! Karl Morant is 7.6 feet away. [ZONE] Jarrett Wagner misses. Offensive rebound by Klay Haliburton! Klay Haliburton puts it back in!
Score: 82-85

[04:37] Team_091 possession (Score: 82-85)
Tim Antetokounmpo makes the Dunk and draws the foul on Domantas Barnes! And-1! Tim Antetokounmpo to the line for 1. [Team fouls: 4] (Domantas Barnes: 1 personal fouls)   FT 1/1: GOOD Tim Antetokounmpo makes 1/1 from the line.
Score: 82-88

[04:25] Team_060 possession (Score: 82-88)
Jarrett Wagner attempts a 3Pt. Contested by Karl Morant (5.4 feet, ZONE). Jarrett Wagner misses. Rebound secured by Tim Antetokounmpo.

[04:09] Team_091 possession (Score: 82-88)
Ja George drives and kicks out. Zion Mitchell attempts a 3Pt. Contested by Yao Tatum (3.3 feet, MAN). ZION MITCHELL MAKES IT! Assist: Karl Morant
Score: 82-91

[03:54] Team_060 possession (Score: 82-91)
Domantas Barnes attempts a 3Pt. Wide open! Karl Morant is 6.1 feet away. [ZONE] Domantas Barnes misses. Rebound secured by Zion Mitchell.

[03:41] Team_091 possession (Score: 82-91)
Tim Antetokounmpo attempts a 3Pt. Wide open! Domantas Barnes is 8.5 feet away. [ZONE] TIM ANTETOKOUNMPO MAKES IT! Assist: Julius Barnes
Score: 82-94

[03:26] Team_060 possession (Score: 82-94)
Klay Haliburton drives, Ja George stays with him. Klay Haliburton attempts a Dunk. Contested by Ja George (3.7 feet, MAN). KLAY HALIBURTON MAKES IT! Assist: Domantas Barnes
Score: 84-94

[03:14] Team_091 possession (Score: 84-94)
Zion Mitchell attempts a Midrange. Contested by Yao Tatum (2.1 feet, ZONE). Zion Mitchell misses. Rebound secured by Domantas Barnes.

[02:59] Team_060 possession (Score: 84-94)
Domantas Barnes attempts a 3Pt. Contested by Karl Morant (2.9 feet, MAN). DOMANTAS BARNES MAKES IT! Assist: Yao Tatum
Score: 87-94

[02:45] Team_091 possession (Score: 87-94)
Karl Morant attempts a 3Pt. Contested by Jarrett Wagner (4.7 feet, ZONE). KARL MORANT MAKES IT! Assist: Zion Mitchell
Score: 87-97

[02:28] Team_060 possession (Score: 87-97)
Jarrett Wagner attempts a Midrange. Contested by Tim Antetokounmpo (2.4 feet, MAN). JARRETT WAGNER MAKES IT!
Score: 89-97

[02:12] Team_091 possession (Score: 89-97)
Karl Morant attempts a Midrange. Contested by Yao Tatum (4.0 feet, ZONE). Karl Morant misses. Rebound secured by Klay Haliburton.

[01:54] Team_060 possession (Score: 89-97)
Jarrett Wagner attempts a 3Pt. Wide open! Tim Antetokounmpo is 10.0 feet away. [MAN] Jarrett Wagner misses. Rebound secured by Tim Antetokounmpo.

[01:42] Team_091 possession (Score: 89-97)
Ja George makes the Dunk and draws the foul on Domantas Barnes! And-1! Ja George to the line for 1. [BONUS: 5 team fouls] (Domantas Barnes: 2 personal fouls)   FT 1/1: GOOD Ja George makes 1/1 from the line.
Score: 89-100

[01:27] Team_060 possession (Score: 89-100)
Klay Haliburton attempts a 3Pt. Wide open! Karl Morant is 7.4 feet away. [ZONE] Klay Haliburton misses. Rebound secured by Zion Mitchell.

[01:09] Team_091 possession (Score: 89-100)
Ja George attempts a Midrange. Wide open! Jarrett Wagner is 6.1 feet away. [ZONE] Ja George misses. Rebound secured by Rudy Ginobili.

[00:57] Team_060 possession (Score: 89-100)
Rudy Ginobili attempts a 3Pt. Contested by Julius Barnes (3.5 feet, MAN). Rudy Ginobili misses. Rebound secured by Zion Mitchell.

[00:38] Team_091 possession (Score: 89-100)
Karl Morant attempts a Midrange. Contested by Rudy Ginobili (5.9 feet, ZONE). KARL MORANT MAKES IT! Assist: Tim Antetokounmpo
Score: 89-102

[00:20] Team_060 possession (Score: 89-102)
Klay Haliburton drives, picks up Ja George. Help arrives from Karl Morant! Klay Haliburton attempts a Layup. Contested by Karl Morant (5.2 feet, MAN). KLAY HALIBURTON MAKES IT! Assist: Yao Tatum
Score: 91-102

[00:04] Team_091 possession (Score: 91-102)
Zion Mitchell attempts a Layup. Contested by Klay Haliburton (5.6 feet, ZONE). ZION MITCHELL MAKES IT! Assist: Karl Morant
Score: 91-104

================================================================================
                              4TH QUARTER COMPLETE                              
================================================================================

4TH QUARTER SCORE: Team_060 21, Team_091 28

BOX SCORE:
================================================================================

Team_060
--------------------------------------------------------------------------------
Player                MIN  PTS  REB  AST  TO      FG   FG%      3P   3P%
--------------------------------------------------------------------------------
Klay Haliburton        19    6    3    1   0   3/4    75.0     0/0   0.0
Domantas Barnes        19    5    5    3   0   2/3    66.7     0/0   0.0
Yao Tatum              19    4    0    2   0   2/3    66.7     0/0   0.0
Jaren George           29    2    1    0   0   1/2    50.0     0/0   0.0
Rudy Ginobili          19    2    1    1   0   1/4    25.0     0/0   0.0
Jarrett Wagner         19    2    0    0   0   1/4    25.0     0/0   0.0
Immanuel Ming          29    0    1    0   0   0/0     0.0     0/0   0.0
Larry Westbrook        29    0    0    0   0   0/1     0.0     0/0   0.0

TEAM: FG: 10/21 (47.6%), 3PT: 2/10 (20.0%), REB: 11 (1 off, 10 def), AST: 7, TO: 1
TEAM FOULS: 5 [Team_091 in BONUS]


Team_091
--------------------------------------------------------------------------------
Player                MIN  PTS  REB  AST  TO      FG   FG%      3P   3P%
--------------------------------------------------------------------------------
Tim Antetokounmpo      19    9    2    1   0   3/5    60.0     0/0   0.0
Karl Morant            19    7    0    2   0   3/5    60.0     0/0   0.0
Zion Mitchell          19    5    7    2   0   2/3    66.7     0/0   0.0
Ja George              19    3    3    1   0   1/3    33.3     0/0   0.0
Julius Barnes          19    3    0    1   0   1/2    50.0     0/0   0.0
Isaiah Siakam          29    0    0    0   0   0/2     0.0     0/0   0.0
Rudy Bridges           29    0    1    0   0   0/0     0.0     0/0   0.0
Kevin Simons           29    0    1    0   0   0/0     0.0     0/0   0.0

TEAM: FG: 10/20 (50.0%), 3PT: 4/8 (50.0%), REB: 14 (3 off, 11 def), AST: 7, TO: 2
TEAM FOULS: 3

================================================================================

================================================================================
                               FULL GAME COMPLETE                               
================================================================================

FINAL SCORE: Team_060 91, Team_091 104

SCORING BY QUARTER:
--------------------------------------------------------------------------------
Team                     Q1     Q2     Q3     Q4    FINAL
--------------------------------------------------------------------------------
Team_060                 23     17     30     21       91
Team_091                 25     23     28     28      104
--------------------------------------------------------------------------------

FULL GAME BOX SCORE:
================================================================================

Team_060
--------------------------------------------------------------------------------
Player                MIN  PTS  REB  AST  TO      FG   FG%      3P   3P%      FT STL BLK
--------------------------------------------------------------------------------
Joel Morant            29   14    0    2   2   6/11   54.5   2/3    66.7   2/2     0   0
Julius Green           29   11    0    4   1   6/8    75.0   2/4    50.0   0/0     1   0
Immanuel Ming          29   12    4    4   0   5/12   41.7   2/5    40.0   0/0     0   0
Larry Westbrook        29    9    2    3   2   4/7    57.1   0/1     0.0   3/3     1   1
Jaren George           29   11   15    4   2   5/10   50.0   0/1     0.0   3/4     1   2
Domantas Barnes        19   10    9    3   0   4/6    66.7   2/4    50.0   0/0     1   1
Rudy Ginobili          19    4    3    2   0   2/8    25.0   0/5     0.0   0/0     0   0
Jarrett Wagner         19    5    0    0   0   3/8    37.5   1/5    20.0   1/1     0   0
Yao Tatum              19    7    0    2   3   3/5    60.0   1/2    50.0   0/0     0   0
Klay Haliburton        19    8    5    1   0   3/4    75.0   0/1     0.0   2/2     0   1

TEAM: FG: 41/79 (51.9%), 3PT: 10/31 (32.3%), REB: 38 (6 off, 32 def), AST: 25, TO: 10


Team_091
--------------------------------------------------------------------------------
Player                MIN  PTS  REB  AST  TO      FG   FG%      3P   3P%      FT STL BLK
--------------------------------------------------------------------------------
Kyrie Rozier           29   12    7    3   2   6/10   60.0   1/3    33.3   0/0     2   1
Isaiah Siakam          29   11    0    5   1   4/12   33.3   1/4    25.0   2/2     0   0
Rudy Bridges           29   11    9    3   1   6/8    75.0   1/1   100.0   1/2     0   0
D'Angelo Ingram        29   12    0    4   1   4/6    66.7   1/1   100.0   0/0     1   0
Kevin Simons           29   14    9    1   3   7/9    77.8   0/0     0.0   2/2     2   0
Karl Morant            19    7    0    3   2   3/6    50.0   1/2    50.0   1/2     0   0
Julius Barnes          19    3    0    1   0   1/5    20.0   1/3    33.3   3/3     0   0
Tim Antetokounmpo      19   13    6    3   0   5/8    62.5   2/5    40.0   1/1     0   0
Zion Mitchell          19   12    8    5   1   4/5    80.0   1/1   100.0   0/0     3   0
Ja George              19    8    6    1   1   4/7    57.1   1/1   100.0   1/1     0   0

TEAM: FG: 44/76 (57.9%), 3PT: 10/21 (47.6%), REB: 45 (8 off, 37 def), AST: 29, TO: 12

================================================================================
