================================================================================
                        FULL GAME - Team_014 vs Team_079                        
================================================================================

================================================================================
                       1ST QUARTER - Team_014 vs Team_079                       
================================================================================

[12:00] Team_014 possession (Score: 0-0)
Ayo Murray makes the Layup and draws the foul on Trae Durant! And-1! Ayo Murray to the line for 1. [Team fouls: 1] (Trae Durant: 1 personal fouls)   FT 1/1: GOOD Ayo Murray makes 1/1 from the line.
Score: 3-0

[11:47] Team_079 possession (Score: 3-0)
Trae Durant attempts a Layup. Contested by DeMar Adebayo (2.1 feet, ZONE). TRAE DURANT MAKES IT! Assist: Bam Randle
Score: 3-2

[11:35] Team_014 possession (Score: 3-2)
Jordan Anunoby attempts a Midrange. Wide open! Miles Ming is 6.4 feet away. [MAN] Jordan Anunoby misses. Rebound secured by Trae Durant.

[11:19] Team_079 possession (Score: 3-2)
Miles Ming attempts a Midrange. Heavily contested by Jordan Anunoby (0.5 feet, MAN)! MILES MING MAKES IT! Assist: Donovan Randle
Score: 3-4

[11:04] Team_014 possession (Score: 3-4)
FOUL! Shooting foul on Trae Durant. Lamelo Simmons to the line for 2 free throws. [Team fouls: 2] (Trae Durant: 2 personal fouls)   FT 1/2: GOOD   FT 2/2: GOOD Lamelo Simmons makes 2/2 from the line.
Score: 5-4

[10:49] Team_079 possession (Score: 5-4)
Miles Ming attempts a 3Pt. Contested by Jordan Anunoby (4.6 feet, MAN). Miles Ming misses. Offensive rebound by Trae Durant! Trae Durant puts it back in!
Score: 5-6

[10:36] Team_014 possession (Score: 5-6)
Jordan Anunoby drives to the basket... Jordan Anunoby throws a bad pass! Stolen by Miles Ming! TURNOVER! (live ball)

[10:23] Team_079 possession (Score: 5-6)
Trae Durant drives and kicks out. Miles Ming attempts a Midrange. Contested by Jordan Anunoby (5.0 feet, MAN). Miles Ming misses. FOUL! Loose ball foul on DeMar Adebayo during the rebound battle. [Team fouls: 1] No free throws, side out. (DeMar Adebayo: 1 personal fouls)

[10:08] Team_079 possession (Score: 5-6)
FOUL! Shooting foul on Lamelo Simmons. Bam Randle to the line for 2 free throws. [Team fouls: 2] (Lamelo Simmons: 1 personal fouls)   FT 1/2: GOOD   FT 2/2: GOOD Bam Randle makes 2/2 from the line.
Score: 5-8

[09:59] Team_014 possession (Score: 5-8)
Lamelo Simmons attempts a Midrange. Contested by Bam Randle (5.6 feet, ZONE). LAMELO SIMMONS MAKES IT!
Score: 7-8

[09:47] Team_079 possession (Score: 7-8)
Trae Durant attempts a 3Pt. Heavily contested by DeMar Adebayo (1.2 feet, MAN)! Trae Durant misses. Offensive rebound by Trae Durant! Trae Durant's putback is no good. Rebound secured by Michael Cunningham.

[09:35] Team_014 possession (Score: 7-8)
Jordan Anunoby attempts a 3Pt. Wide open! Miles Ming is 8.3 feet away. [MAN] Jordan Anunoby misses. Rebound secured by Bam Randle.

[09:24] Team_079 possession (Score: 7-8)
Trae Durant attempts a Midrange. Contested by DeMar Adebayo (3.3 feet, MAN). TRAE DURANT MAKES IT!
Score: 7-10

[09:11] Team_014 possession (Score: 7-10)
Ayo Murray drives to the basket... Ayo Murray throws a bad pass! Stolen by Donovan Randle! TURNOVER! (live ball)

[08:54] Team_079 possession (Score: 7-10)
FOUL! Shooting foul on DeMar Adebayo. Bam Randle to the line for 2 free throws. [Team fouls: 3] (DeMar Adebayo: 2 personal fouls)   FT 1/2: GOOD   FT 2/2: GOOD Bam Randle makes 2/2 from the line.
Score: 7-12

[08:42] Team_014 possession (Score: 7-12)
DeMar Adebayo attempts a Layup. Contested by Trae Durant (2.4 feet, ZONE). DeMar Adebayo misses. FOUL! Loose ball foul on Trae Durant during the rebound battle. [Team fouls: 3] No free throws, side out. (Trae Durant: 3 personal fouls)

[08:27] Team_014 possession (Score: 7-12)
Ayo Murray drives and kicks out. DeMar Adebayo attempts a Midrange. Contested by Trae Durant (4.0 feet, MAN). DEMAR ADEBAYO MAKES IT! Assist: Ayo Murray
Score: 9-12

[08:13] Team_079 possession (Score: 9-12)
Bam Randle attempts a Layup. Heavily contested by DeMar Adebayo (0.5 feet, ZONE)! BAM RANDLE MAKES IT! Assist: Khris Embiid
Score: 9-14

[08:00] Team_014 possession (Score: 9-14)
Lamelo Simmons attempts a 3Pt. Wide open! Bam Randle is 8.2 feet away. [MAN] Lamelo Simmons misses. Rebound secured by Donovan Randle.

[07:45] Team_079 possession (Score: 9-14)
Donovan Randle attempts a Midrange. Heavily contested by Ayo Murray (2.0 feet, MAN)! Donovan Randle misses. Offensive rebound by Donovan Randle! Donovan Randle kicks it out.

[07:36] Team_079 possession (Score: 9-14)
FOUL! Reach-in foul on DeMar Adebayo during the drive. [Team fouls: 4] No free throws, side out. (DeMar Adebayo: 3 personal fouls)

[07:18] Team_079 possession (Score: 9-14)
Trae Durant attempts a 3Pt. Contested by Jordan Anunoby (4.8 feet, ZONE). TRAE DURANT MAKES IT! Assist: Khris Embiid
Score: 9-17

[07:03] Team_014 possession (Score: 9-17)
Jordan Anunoby attempts a 3Pt. Contested by Trae Durant (2.9 feet, ZONE). Jordan Anunoby misses. Rebound secured by Donovan Randle.

[06:48] Team_079 possession (Score: 9-17)
FOUL! Holding foul on Ayo Murray. [IN THE BONUS! 5 team fouls] Donovan Randle to the line for 2 free throws. (Ayo Murray: 1 personal fouls)   FT 1/2: GOOD   FT 2/2: MISS Donovan Randle makes 1/2 from the line. Rebound secured by Ayo Murray.
Score: 9-18

[06:33] Team_014 possession (Score: 9-18)
Jordan Anunoby attempts a 3Pt. Contested by Miles Ming (4.7 feet, MAN). Jordan Anunoby misses. Rebound secured by Donovan Randle.

[06:20] Team_079 possession (Score: 9-18)
FOUL! Reach-in foul on DeMar Adebayo during the drive. [IN THE BONUS! 6 team fouls] Trae Durant to the line for 2 free throws. (DeMar Adebayo: 4 personal fouls)   FT 1/2: GOOD   FT 2/2: GOOD Trae Durant makes 2/2 from the line.
Score: 9-20

[06:04] Team_014 possession (Score: 9-20)
Ayo Murray drives, Donovan Randle stays with him. Ayo Murray attempts a Dunk. Contested by Donovan Randle (3.2 feet, MAN). Ayo Murray misses. Rebound secured by Trae Durant.

[05:48] Team_079 possession (Score: 9-20)
FOUL! Shooting foul on Lamelo Simmons. Bam Randle to the line for 2 free throws. [BONUS: 7 team fouls] (Lamelo Simmons: 2 personal fouls)   FT 1/2: GOOD   FT 2/2: GOOD Bam Randle makes 2/2 from the line.
Score: 9-22

[05:37] Team_014 possession (Score: 9-22)
Lamelo Simmons attempts a 3Pt. Contested by Trae Durant (2.0 feet, ZONE). Lamelo Simmons misses. Offensive rebound by Ayo Murray! Ayo Murray kicks it out.

[05:22] Team_014 possession (Score: 9-22)
DeMar Adebayo attempts a Layup. Heavily contested by Trae Durant (1.4 feet, ZONE)! DEMAR ADEBAYO MAKES IT!
Score: 11-22

[05:08] Team_079 possession (Score: 11-22)
Khris Embiid attempts a 3Pt. Contested by Jordan Anunoby (3.3 feet, ZONE). Khris Embiid misses. Rebound secured by Michael Cunningham.

[04:53] Team_014 possession (Score: 11-22)
Michael Cunningham attempts a Midrange. Wide open! Khris Embiid is 8.2 feet away. [MAN] MICHAEL CUNNINGHAM MAKES IT! Assist: DeMar Adebayo
Score: 13-22

[04:42] Team_079 possession (Score: 13-22)
Trae Durant drives and kicks out. Khris Embiid attempts a Midrange. Wide open! Michael Cunningham is 8.4 feet away. [MAN] KHRIS EMBIID MAKES IT! Assist: Miles Ming
Score: 13-24

[04:31] Team_014 possession (Score: 13-24)
Michael Cunningham makes the Layup and draws the foul on Khris Embiid! And-1! Michael Cunningham to the line for 1. [Team fouls: 4] (Khris Embiid: 1 personal fouls)   FT 1/1: GOOD Michael Cunningham makes 1/1 from the line.
Score: 16-24

[04:21] Team_079 possession (Score: 16-24)
Trae Durant attempts a Dunk. BLOCKED BY DEMAR ADEBAYO! Ball deflects out of bounds off Trae Durant.

[04:08] Team_014 possession (Score: 16-24)
FOUL! Reach-in foul on Bam Randle during the drive. [IN THE BONUS! 5 team fouls] Lamelo Simmons to the line for 2 free throws. (Bam Randle: 1 personal fouls)   FT 1/2: GOOD   FT 2/2: MISS Lamelo Simmons makes 1/2 from the line. Rebound secured by Bam Randle.
Score: 17-24

[03:55] Team_079 possession (Score: 17-24)
FOUL! Shooting foul on Jordan Anunoby. Bam Randle to the line for 2 free throws. [BONUS: 8 team fouls] (Jordan Anunoby: 1 personal fouls)   FT 1/2: GOOD   FT 2/2: GOOD Bam Randle makes 2/2 from the line.
Score: 17-26

[03:39] Team_014 possession (Score: 17-26)
DeMar Adebayo throws a bad pass! Stolen by Trae Durant! TURNOVER! (live ball)

[03:23] Team_079 possession (Score: 17-26)
Trae Durant commits a violation (traveling/carry)! TURNOVER! (dead ball)

[03:23] Substitution (Team_014): Lamelo Simmons OUT → Tracy Westbrook IN (stamina_rule2)

[03:23] Substitution (Team_079): Donovan Randle OUT → James LaVine IN (stamina_rule2)

[03:13] Team_014 possession (Score: 17-26)
Ayo Murray attempts a Layup. BLOCKED BY TRAE DURANT! Ball is loose! Rebound secured by Bam Randle.

[03:00] Team_079 possession (Score: 17-26)
Bam Randle drives and kicks out. James LaVine attempts a Midrange. Contested by Ayo Murray (5.5 feet, MAN). James LaVine misses. Offensive rebound by James LaVine! James LaVine's putback is no good. Rebound secured by Michael Cunningham.

[02:44] Team_014 possession (Score: 17-26)
Jordan Anunoby drives to the basket... Jordan Anunoby throws a bad pass! Stolen by Miles Ming! TURNOVER! (live ball)

[02:28] Team_079 possession (Score: 17-26)
Miles Ming attempts a 3Pt. Contested by Jordan Anunoby (2.3 feet, MAN). MILES MING MAKES IT! Assist: Khris Embiid
Score: 17-29

[02:18] Team_014 possession (Score: 17-29)
DeMar Adebayo drives, Trae Durant stays with him. DeMar Adebayo attempts a Dunk. Contested by Trae Durant (4.2 feet, MAN). DEMAR ADEBAYO MAKES IT!
Score: 19-29

[02:01] Team_079 possession (Score: 19-29)
James LaVine attempts a Layup. Contested by Ayo Murray (3.0 feet, MAN). James LaVine misses. Rebound secured by Michael Cunningham.

[01:48] Team_014 possession (Score: 19-29)
Ayo Murray drives to the basket... Ayo Murray throws a bad pass out of bounds! TURNOVER! (dead ball)

[01:48] Substitution (Team_014): Michael Cunningham OUT → Jalen Booker IN (stamina_rule2)

[01:48] Substitution (Team_014): Jordan Anunoby OUT → Bones Quickley IN (stamina_rule2)

[01:48] Substitution (Team_014): DeMar Adebayo OUT → Nikola James IN (stamina_rule2)

[01:48] Substitution (Team_014): Ayo Murray OUT → Collin Gasol IN (stamina_rule2)

[01:48] Substitution (Team_079): Khris Embiid OUT → Evan Mobley IN (stamina_rule2)

[01:48] Substitution (Team_079): Miles Ming OUT → Karl Ingram IN (stamina_rule2)

[01:48] Substitution (Team_079): Bam Randle OUT → Anthony Wade IN (stamina_rule2)

[01:48] Substitution (Team_079): Trae Durant OUT → Kobe Curry IN (stamina_rule2)

[01:35] Team_079 possession (Score: 19-29)
FOUL! Reach-in foul on Nikola James during the drive. [IN THE BONUS! 9 team fouls] Kobe Curry to the line for 2 free throws. (Nikola James: 1 personal fouls)   FT 1/2: GOOD   FT 2/2: GOOD Kobe Curry makes 2/2 from the line.
Score: 19-31

[01:21] Team_014 possession (Score: 19-31)
Bones Quickley drives and kicks out. Collin Gasol attempts a 3Pt. Wide open! James LaVine is 9.4 feet away. [MAN] Collin Gasol misses. Rebound secured by James LaVine.

[01:05] Team_079 possession (Score: 19-31)
James LaVine makes the Layup and draws the foul on Collin Gasol! And-1! James LaVine to the line for 1. [BONUS: 10 team fouls] (Collin Gasol: 1 personal fouls)   FT 1/1: GOOD James LaVine makes 1/1 from the line.
Score: 19-34

[00:48] Team_014 possession (Score: 19-34)
Tracy Westbrook attempts a Layup. Contested by James LaVine (5.9 feet, ZONE). Tracy Westbrook misses. Rebound secured by James LaVine.

[00:29] Team_079 possession (Score: 19-34)
Evan Mobley drives and kicks out. Karl Ingram attempts a Midrange. Wide open! Bones Quickley is 6.2 feet away. [MAN] KARL INGRAM MAKES IT! Assist: Anthony Wade
Score: 19-36

[00:15] Team_014 possession (Score: 19-36)
FOUL! Shooting foul on Kobe Curry. Nikola James to the line for 2 free throws. [BONUS: 6 team fouls] (Kobe Curry: 1 personal fouls)   FT 1/2: GOOD   FT 2/2: MISS Nikola James makes 1/2 from the line. Rebound secured by Kobe Curry.
Score: 20-36

[00:01] Team_079 possession (Score: 20-36)
Evan Mobley makes the Layup and draws the foul on Collin Gasol! And-1! Evan Mobley to the line for 1. [BONUS: 11 team fouls] (Collin Gasol: 2 personal fouls)   FT 1/1: GOOD Evan Mobley makes 1/1 from the line.
Score: 20-39

================================================================================
                              1ST QUARTER COMPLETE                              
================================================================================

1ST QUARTER SCORE: Team_014 20, Team_079 39

BOX SCORE:
================================================================================

Team_014
--------------------------------------------------------------------------------
Player                MIN  PTS  REB  AST  TO      FG   FG%      3P   3P%
--------------------------------------------------------------------------------
DeMar Adebayo          10    6    0    1   0   3/3   100.0     0/0   0.0
Michael Cunningham     10    5    4    0   0   2/2   100.0     0/0   0.0
Lamelo Simmons          9    4    0    0   0   2/4    50.0     0/0   0.0
Ayo Murray             10    3    3    1   0   1/3    33.3     0/0   0.0
Jordan Anunoby         10    0    0    0   0   0/4     0.0     0/0   0.0
Bones Quickley          2    0    0    0   0   0/1     0.0     0/0   0.0
Tracy Westbrook         3    0    0    0   0   0/1     0.0     0/0   0.0
Nikola James            2    0    0    0   0   0/1     0.0     0/0   0.0

TEAM: FG: 8/19 (42.1%), 3PT: 0/4 (0.0%), REB: 5 (2 off, 3 def), AST: 2, TO: 5
TEAM FOULS: 11 [Team_079 in BONUS]


Team_079
--------------------------------------------------------------------------------
Player                MIN  PTS  REB  AST  TO      FG   FG%      3P   3P%
--------------------------------------------------------------------------------
Trae Durant            10   11    4    0   0   5/7    71.4     0/0   0.0
Bam Randle             10   10    3    1   0   5/6    83.3     0/0   0.0
Miles Ming             10    5    0    1   0   2/2   100.0     0/0   0.0
James LaVine            3    3    2    0   0   1/2    50.0     0/0   0.0
Evan Mobley             2    3    0    0   0   1/1   100.0     0/0   0.0
Khris Embiid           10    2    0    3   0   1/2    50.0     0/0   0.0
Kobe Curry              2    2    1    0   0   1/1   100.0     0/0   0.0
Karl Ingram             2    2    0    0   0   1/1   100.0     0/0   0.0
Donovan Randle          9    0    4    1   0   0/0     0.0     0/0   0.0
Anthony Wade            2    0    0    1   0   0/0     0.0     0/0   0.0

TEAM: FG: 17/23 (73.9%), 3PT: 3/5 (60.0%), REB: 16 (5 off, 11 def), AST: 7, TO: 1
TEAM FOULS: 6 [Team_014 in BONUS]

================================================================================

================================================================================
                       2ND QUARTER - Team_014 vs Team_079                       
================================================================================

[12:00] Team_014 possession (Score: 20-39)
Lamelo Simmons attempts a 3Pt. Contested by Bam Randle (3.4 feet, MAN). LAMELO SIMMONS MAKES IT! Assist: Jordan Anunoby
Score: 23-39

[11:45] Team_079 possession (Score: 23-39)
Bam Randle drives, DeMar Adebayo stays with him. Bam Randle attempts a Dunk. Contested by DeMar Adebayo (2.9 feet, ZONE). BAM RANDLE MAKES IT!
Score: 23-41

[11:27] Team_014 possession (Score: 23-41)
FOUL! Shooting foul on Trae Durant. DeMar Adebayo to the line for 3 free throws. [Team fouls: 1] (Trae Durant: 1 personal fouls)   FT 1/3: GOOD   FT 2/3: GOOD   FT 3/3: GOOD DeMar Adebayo makes 3/3 from the line.
Score: 26-41

[11:12] Team_079 possession (Score: 26-41)
Trae Durant attempts a 3Pt. Contested by DeMar Adebayo (3.3 feet, MAN). Trae Durant misses. Rebound secured by Ayo Murray.

[10:59] Team_014 possession (Score: 26-41)
Michael Cunningham drives, Trae Durant stays with him. Michael Cunningham attempts a Dunk. Contested by Trae Durant (2.5 feet, ZONE). MICHAEL CUNNINGHAM MAKES IT! Assist: Ayo Murray
Score: 28-41

[10:47] Team_079 possession (Score: 28-41)
Khris Embiid attempts a 3Pt. Contested by Jordan Anunoby (2.4 feet, ZONE). Khris Embiid misses. Rebound secured by Michael Cunningham.

[10:34] Team_014 possession (Score: 28-41)
Jordan Anunoby attempts a Midrange. Contested by Miles Ming (3.9 feet, ZONE). JORDAN ANUNOBY MAKES IT! Assist: Michael Cunningham
Score: 30-41

[10:21] Team_079 possession (Score: 30-41)
Khris Embiid attempts a 3Pt. Contested by Lamelo Simmons (3.3 feet, ZONE). Khris Embiid misses. Rebound secured by Michael Cunningham.

[10:06] Team_014 possession (Score: 30-41)
Ayo Murray attempts a Midrange. Contested by Donovan Randle (2.1 feet, MAN). Ayo Murray misses. Rebound secured by Donovan Randle.

[09:53] Team_079 possession (Score: 30-41)
Donovan Randle attempts a Layup. Contested by Ayo Murray (4.4 feet, MAN). Donovan Randle misses. Rebound secured by Ayo Murray.

[09:34] Team_014 possession (Score: 30-41)
DeMar Adebayo attempts a 3Pt. Heavily contested by Trae Durant (0.5 feet, MAN)! DeMar Adebayo misses. Offensive rebound by Ayo Murray! Ayo Murray kicks it out.

[09:19] Team_014 possession (Score: 30-41)
Jordan Anunoby drives and kicks out. DeMar Adebayo attempts a 3Pt. Heavily contested by Trae Durant (1.3 feet, MAN)! DeMar Adebayo misses. Rebound secured by Trae Durant.

[09:10] Team_079 possession (Score: 30-41)
Trae Durant attempts a Dunk. BLOCKED BY MICHAEL CUNNINGHAM! Ball is loose! Rebound secured by Michael Cunningham.

[08:54] Team_014 possession (Score: 30-41)
Ayo Murray drives, Trae Durant stays with him. Ayo Murray attempts a Dunk. Contested by Trae Durant (3.4 feet, ZONE). AYO MURRAY MAKES IT!
Score: 32-41

[08:42] Team_079 possession (Score: 32-41)
Donovan Randle drives to the basket... Donovan Randle loses the ball! Stripped by Ayo Murray! TURNOVER! (live ball)

[08:30] Team_014 possession (Score: 32-41)
Lamelo Simmons attempts a 3Pt. Contested by Bam Randle (4.9 feet, MAN). Lamelo Simmons misses. Rebound secured by Donovan Randle.

[08:15] Team_079 possession (Score: 32-41)
FOUL! Reach-in foul on DeMar Adebayo during the drive. [Team fouls: 1] No free throws, side out. (DeMar Adebayo: 1 personal fouls)

[08:03] Team_079 possession (Score: 32-41)
Donovan Randle makes the Layup and draws the foul on Ayo Murray! And-1! Donovan Randle to the line for 1. [Team fouls: 2] (Ayo Murray: 1 personal fouls)   FT 1/1: GOOD Donovan Randle makes 1/1 from the line.
Score: 32-44

[07:52] Team_014 possession (Score: 32-44)
FOUL! Shooting foul on Trae Durant. Jordan Anunoby to the line for 3 free throws. [Team fouls: 2] (Trae Durant: 2 personal fouls)   FT 1/3: GOOD   FT 2/3: GOOD   FT 3/3: GOOD Jordan Anunoby makes 3/3 from the line.
Score: 35-44

[07:37] Team_079 possession (Score: 35-44)
Khris Embiid attempts a 3Pt. Wide open! Jordan Anunoby is 6.1 feet away. [ZONE] KHRIS EMBIID MAKES IT! Assist: Miles Ming
Score: 35-47

[07:24] Team_014 possession (Score: 35-47)
Michael Cunningham attempts a Midrange. Wide open! Khris Embiid is 6.9 feet away. [MAN] MICHAEL CUNNINGHAM MAKES IT! Assist: DeMar Adebayo
Score: 37-47

[07:11] Team_079 possession (Score: 37-47)
Khris Embiid drives, Michael Cunningham stays with him. Khris Embiid attempts a Layup. Contested by Michael Cunningham (5.8 feet, MAN). Khris Embiid misses. Rebound secured by Ayo Murray.

[06:57] Team_014 possession (Score: 37-47)
DeMar Adebayo attempts a Midrange. Heavily contested by Trae Durant (1.4 feet, MAN)! DeMar Adebayo misses. Rebound secured by Donovan Randle.

[06:46] Team_079 possession (Score: 37-47)
Miles Ming attempts a 3Pt. Wide open! Jordan Anunoby is 9.5 feet away. [ZONE] MILES MING MAKES IT! Assist: Bam Randle
Score: 37-50

[06:34] Team_014 possession (Score: 37-50)
Jordan Anunoby attempts a Midrange. Wide open! Miles Ming is 7.2 feet away. [MAN] Jordan Anunoby misses. Rebound secured by Bam Randle.

[06:19] Team_079 possession (Score: 37-50)
Trae Durant drives and kicks out. Donovan Randle attempts a 3Pt. Wide open! DeMar Adebayo is 7.2 feet away. [ZONE] Donovan Randle misses. Offensive rebound by Donovan Randle! Donovan Randle kicks it out.

[06:04] Team_079 possession (Score: 37-50)
Bam Randle attempts a 3Pt. Contested by Lamelo Simmons (4.4 feet, MAN). BAM RANDLE MAKES IT! Assist: Khris Embiid
Score: 37-53

[05:46] Team_014 possession (Score: 37-53)
Jordan Anunoby attempts a Midrange. Contested by Miles Ming (3.7 feet, MAN). Jordan Anunoby misses. Rebound secured by Donovan Randle.

[05:31] Team_079 possession (Score: 37-53)
Khris Embiid throws a bad pass out of bounds! TURNOVER! (dead ball)

[05:31] Substitution (Team_014): Michael Cunningham OUT → Jalen Booker IN (stamina_rule2)

[05:31] Substitution (Team_014): Jordan Anunoby OUT → Bones Quickley IN (stamina_rule2)

[05:31] Substitution (Team_014): Lamelo Simmons OUT → Tracy Westbrook IN (stamina_rule2)

[05:31] Substitution (Team_014): DeMar Adebayo OUT → Nikola James IN (stamina_rule2)

[05:31] Substitution (Team_014): Ayo Murray OUT → Collin Gasol IN (stamina_rule2)

[05:31] Substitution (Team_079): Khris Embiid OUT → Evan Mobley IN (stamina_rule2)

[05:31] Substitution (Team_079): Miles Ming OUT → Karl Ingram IN (stamina_rule2)

[05:31] Substitution (Team_079): Bam Randle OUT → Anthony Wade IN (stamina_rule2)

[05:31] Substitution (Team_079): Trae Durant OUT → Kobe Curry IN (stamina_rule2)

[05:31] Substitution (Team_079): Donovan Randle OUT → James LaVine IN (stamina_rule2)

[05:21] Team_014 possession (Score: 37-53)
Nikola James makes the Layup and draws the foul on James LaVine! And-1! Nikola James to the line for 1. [Team fouls: 3] (James LaVine: 1 personal fouls)   FT 1/1: GOOD Nikola James makes 1/1 from the line.
Score: 40-53

[05:07] Team_079 possession (Score: 40-53)
Evan Mobley attempts a Layup. Contested by Jalen Booker (5.2 feet, MAN). EVAN MOBLEY MAKES IT! Assist: Anthony Wade
Score: 40-55

[04:50] Team_014 possession (Score: 40-55)
Tracy Westbrook attempts a 3Pt. Contested by Evan Mobley (2.8 feet, ZONE). Tracy Westbrook misses. Rebound secured by Anthony Wade.

[04:30] Team_079 possession (Score: 40-55)
Evan Mobley attempts a 3Pt. Contested by Jalen Booker (3.8 feet, MAN). Evan Mobley misses. Rebound secured by Nikola James.

[04:17] Team_014 possession (Score: 40-55)
Tracy Westbrook drives, picks up Anthony Wade. Help arrives from Karl Ingram! Tracy Westbrook attempts a Layup. Wide open! Karl Ingram is 6.7 feet away. [MAN] TRACY WESTBROOK MAKES IT! Assist: Bones Quickley
Score: 42-55

[03:57] Team_079 possession (Score: 42-55)
Karl Ingram makes the Midrange and draws the foul on Bones Quickley! And-1! Karl Ingram to the line for 1. [Team fouls: 3] (Bones Quickley: 1 personal fouls)   FT 1/1: MISS Karl Ingram makes 0/1 from the line. Rebound secured by Collin Gasol.
Score: 42-57

[03:42] Team_014 possession (Score: 42-57)
Collin Gasol makes the Layup and draws the foul on James LaVine! And-1! Collin Gasol to the line for 1. [Team fouls: 4] (James LaVine: 2 personal fouls)   FT 1/1: GOOD Collin Gasol makes 1/1 from the line.
Score: 45-57

[03:29] Team_079 possession (Score: 45-57)
Evan Mobley attempts a Midrange. Contested by Nikola James (3.8 feet, ZONE). Evan Mobley misses. FOUL! Loose ball foul on Collin Gasol during the rebound battle. [Team fouls: 4] No free throws, side out. (Collin Gasol: 1 personal fouls)

[03:16] Team_079 possession (Score: 45-57)
Kobe Curry attempts a 3Pt. Contested by Jalen Booker (3.6 feet, ZONE). Kobe Curry misses. Offensive rebound by James LaVine! James LaVine's putback is no good. Rebound secured by Collin Gasol.

[03:01] Team_014 possession (Score: 45-57)
Tracy Westbrook attempts a 3Pt. Contested by Evan Mobley (4.9 feet, ZONE). TRACY WESTBROOK MAKES IT! Assist: Collin Gasol
Score: 48-57

[02:43] Team_079 possession (Score: 48-57)
Karl Ingram attempts a Midrange. Contested by Bones Quickley (5.4 feet, MAN). Karl Ingram misses. Offensive rebound by Kobe Curry! Kobe Curry kicks it out.

[02:28] Team_079 possession (Score: 48-57)
Evan Mobley attempts a Midrange. Wide open! Nikola James is 6.2 feet away. [ZONE] EVAN MOBLEY MAKES IT! Assist: Karl Ingram
Score: 48-59

[02:11] Team_014 possession (Score: 48-59)
Jalen Booker attempts a Midrange. Contested by Karl Ingram (5.3 feet, ZONE). JALEN BOOKER MAKES IT! Assist: Nikola James
Score: 50-59

[01:56] Team_079 possession (Score: 50-59)
Karl Ingram attempts a Midrange. Contested by Bones Quickley (5.5 feet, MAN). KARL INGRAM MAKES IT! Assist: Kobe Curry
Score: 50-61

[01:43] Team_014 possession (Score: 50-61)
Nikola James attempts a 3Pt. Contested by Kobe Curry (3.4 feet, MAN). Nikola James misses. Offensive rebound by Nikola James! Nikola James kicks it out.

[01:25] Team_014 possession (Score: 50-61)
Nikola James attempts a Midrange. Contested by Kobe Curry (3.7 feet, ZONE). Nikola James misses. Offensive rebound by Nikola James! Nikola James kicks it out.

[01:10] Team_014 possession (Score: 50-61)
Jalen Booker drives and kicks out. Bones Quickley attempts a 3Pt. Wide open! Evan Mobley is 6.4 feet away. [ZONE] Bones Quickley misses. Rebound secured by Kobe Curry.

[00:53] Team_079 possession (Score: 50-61)
Evan Mobley attempts a 3Pt. Contested by Jalen Booker (4.7 feet, ZONE). Evan Mobley misses. Rebound secured by Collin Gasol.

[00:36] Team_014 possession (Score: 50-61)
Collin Gasol attempts a Midrange. Wide open! Anthony Wade is 6.2 feet away. [ZONE] COLLIN GASOL MAKES IT! Assist: Nikola James
Score: 52-61

[00:20] Team_079 possession (Score: 52-61)
FOUL! Reach-in foul on Collin Gasol during the drive. [IN THE BONUS! 5 team fouls] Evan Mobley to the line for 2 free throws. (Collin Gasol: 2 personal fouls)   FT 1/2: GOOD   FT 2/2: GOOD Evan Mobley makes 2/2 from the line.
Score: 52-63

[00:04] Team_014 possession (Score: 52-63)
Bones Quickley makes the 3Pt and draws the foul on Evan Mobley! And-1! Bones Quickley to the line for 1. [BONUS: 5 team fouls] (Evan Mobley: 1 personal fouls)   FT 1/1: GOOD Bones Quickley makes 1/1 from the line.
Score: 56-63

================================================================================
                              2ND QUARTER COMPLETE                              
================================================================================

2ND QUARTER SCORE: Team_014 36, Team_079 24

BOX SCORE:
================================================================================

Team_014
--------------------------------------------------------------------------------
Player                MIN  PTS  REB  AST  TO      FG   FG%      3P   3P%
--------------------------------------------------------------------------------
Jordan Anunoby         17    5    0    1   0   2/5    40.0     0/0   0.0
Tracy Westbrook         9    5    0    0   0   2/3    66.7     0/0   0.0
Collin Gasol            7    5    3    1   0   2/2   100.0     0/0   0.0
Michael Cunningham     17    4    3    1   0   2/2   100.0     0/0   0.0
Bones Quickley          7    4    0    1   0   1/1   100.0     0/0   0.0
Lamelo Simmons         15    3    0    0   0   1/2    50.0     0/0   0.0
DeMar Adebayo          17    3    0    1   0   1/2    50.0     0/0   0.0
Nikola James            7    3    3    2   0   1/1   100.0     0/0   0.0
Ayo Murray             17    2    4    1   0   1/2    50.0     0/0   0.0
Jalen Booker            7    2    0    0   0   1/2    50.0     0/0   0.0

TEAM: FG: 14/22 (63.6%), 3PT: 5/7 (71.4%), REB: 12 (3 off, 9 def), AST: 8, TO: 0
TEAM FOULS: 5 [Team_079 in BONUS]


Team_079
--------------------------------------------------------------------------------
Player                MIN  PTS  REB  AST  TO      FG   FG%      3P   3P%
--------------------------------------------------------------------------------
Evan Mobley             7    6    0    0   0   3/5    60.0     0/0   0.0
Bam Randle             17    5    1    1   0   2/2   100.0     0/0   0.0
Khris Embiid           17    3    0    1   0   1/4    25.0     0/0   0.0
Donovan Randle         15    3    5    0   0   1/2    50.0     0/0   0.0
Miles Ming             17    3    0    1   0   1/1   100.0     0/0   0.0
Karl Ingram             7    2    0    1   0   1/2    50.0     0/0   0.0
Trae Durant            17    0    1    0   0   0/2     0.0     0/0   0.0
Anthony Wade            7    0    1    1   0   0/0     0.0     0/0   0.0
James LaVine            9    0    1    0   0   0/0     0.0     0/0   0.0
Kobe Curry              7    0    2    1   0   0/1     0.0     0/0   0.0

TEAM: FG: 9/19 (47.4%), 3PT: 3/9 (33.3%), REB: 12 (4 off, 8 def), AST: 6, TO: 2
TEAM FOULS: 5 [Team_014 in BONUS]

================================================================================

================================================================================
                       3RD QUARTER - Team_014 vs Team_079                       
================================================================================

[12:00] Team_014 possession (Score: 56-63)
Lamelo Simmons attempts a 3Pt. Contested by Bam Randle (4.6 feet, MAN). Lamelo Simmons misses. Rebound secured by Donovan Randle.

[11:48] Team_079 possession (Score: 56-63)
Khris Embiid attempts a Layup. BLOCKED BY DEMAR ADEBAYO! Ball goes out off DeMar Adebayo. Khris Embiid's ball!

[11:33] Team_079 possession (Score: 56-63)
FOUL! Holding foul on Michael Cunningham. [Team fouls: 1] No free throws, side out. (Michael Cunningham: 1 personal fouls)

[11:17] Team_079 possession (Score: 56-63)
Khris Embiid attempts a Layup. Wide open! Michael Cunningham is 6.0 feet away. [MAN] KHRIS EMBIID MAKES IT! Assist: Miles Ming
Score: 56-65

[10:59] Team_014 possession (Score: 56-65)
Jordan Anunoby attempts a 3Pt. Wide open! Bam Randle is 7.0 feet away. [ZONE] JORDAN ANUNOBY MAKES IT! Assist: Ayo Murray
Score: 59-65

[10:47] Team_079 possession (Score: 59-65)
Khris Embiid attempts a 3Pt. Contested by Jordan Anunoby (2.8 feet, ZONE). Khris Embiid misses. Rebound secured by Michael Cunningham.

[10:33] Team_014 possession (Score: 59-65)
Michael Cunningham attempts a 3Pt. Contested by Khris Embiid (5.4 feet, MAN). Michael Cunningham misses. Rebound secured by Trae Durant.

[10:15] Team_079 possession (Score: 59-65)
Donovan Randle attempts a Layup. Contested by Ayo Murray (4.2 feet, MAN). Donovan Randle misses. Rebound secured by Michael Cunningham.

[10:01] Team_014 possession (Score: 59-65)
Lamelo Simmons attempts a 3Pt. Contested by Bam Randle (3.7 feet, MAN). Lamelo Simmons misses. Offensive rebound by DeMar Adebayo! DeMar Adebayo kicks it out.

[09:44] Team_014 possession (Score: 59-65)
FOUL! Holding foul on Bam Randle. [Team fouls: 1] No free throws, side out. (Bam Randle: 1 personal fouls)

[09:29] Team_014 possession (Score: 59-65)
FOUL! Holding foul on Donovan Randle. [Team fouls: 2] No free throws, side out. (Donovan Randle: 1 personal fouls)

[09:17] Team_014 possession (Score: 59-65)
Lamelo Simmons attempts a Midrange. Contested by Trae Durant (2.4 feet, ZONE). LAMELO SIMMONS MAKES IT! Assist: Ayo Murray
Score: 61-65

[09:01] Team_079 possession (Score: 61-65)
FOUL! Offensive foul on Khris Embiid! Michael Cunningham drew the charge! [Team fouls: 3] (Khris Embiid: 1 personal fouls) TURNOVER! (dead ball)

[08:47] Team_014 possession (Score: 61-65)
FOUL! Shooting foul on Miles Ming. Ayo Murray to the line for 2 free throws. [Team fouls: 4] (Miles Ming: 1 personal fouls)   FT 1/2: GOOD   FT 2/2: GOOD Ayo Murray makes 2/2 from the line.
Score: 63-65

[08:30] Team_079 possession (Score: 63-65)
Trae Durant attempts a Dunk. BLOCKED BY MICHAEL CUNNINGHAM! Ball goes out off Michael Cunningham. Trae Durant's ball!

[08:18] Team_079 possession (Score: 63-65)
FOUL! Reach-in foul on DeMar Adebayo during the drive. [Team fouls: 2] No free throws, side out. (DeMar Adebayo: 1 personal fouls)

[08:02] Team_079 possession (Score: 63-65)
Miles Ming attempts a 3Pt. Contested by Jordan Anunoby (5.1 feet, MAN). Miles Ming misses. FOUL! Loose ball foul on DeMar Adebayo during the rebound battle. [Team fouls: 3] No free throws, side out. (DeMar Adebayo: 2 personal fouls)

[07:43] Team_079 possession (Score: 63-65)
Miles Ming attempts a Midrange. Contested by Jordan Anunoby (3.1 feet, MAN). MILES MING MAKES IT! Assist: Khris Embiid
Score: 63-67

[07:26] Team_014 possession (Score: 63-67)
Jordan Anunoby attempts a 3Pt. Contested by Trae Durant (4.5 feet, ZONE). Jordan Anunoby misses. Rebound secured by Trae Durant.

[07:07] Team_079 possession (Score: 63-67)
Trae Durant attempts a Dunk. BLOCKED BY DEMAR ADEBAYO! Ball deflects out of bounds off Trae Durant.

[06:48] Team_014 possession (Score: 63-67)
Ayo Murray makes the Dunk and draws the foul on Miles Ming! And-1! Ayo Murray to the line for 1. [BONUS: 5 team fouls] (Miles Ming: 2 personal fouls)   FT 1/1: GOOD Ayo Murray makes 1/1 from the line.
Score: 66-67

[06:34] Team_079 possession (Score: 66-67)
FOUL! Reach-in foul on Lamelo Simmons during the drive. [Team fouls: 4] No free throws, side out. (Lamelo Simmons: 1 personal fouls)

[06:17] Team_079 possession (Score: 66-67)
Bam Randle drives and kicks out. Miles Ming attempts a 3Pt. Wide open! Jordan Anunoby is 7.7 feet away. [MAN] Miles Ming misses. Rebound secured by Michael Cunningham.

[05:59] Team_014 possession (Score: 66-67)
Ayo Murray drives, picks up Donovan Randle. Help arrives from Miles Ming! Ayo Murray attempts a Dunk. Contested by Miles Ming (3.7 feet, MAN). Ayo Murray misses. Rebound secured by Trae Durant.

[05:45] Team_079 possession (Score: 66-67)
Khris Embiid attempts a 3Pt. Wide open! Jordan Anunoby is 7.3 feet away. [ZONE] KHRIS EMBIID MAKES IT! Assist: Bam Randle
Score: 66-70

[05:27] Team_014 possession (Score: 66-70)
Lamelo Simmons drives and kicks out. Lamelo Simmons attempts a Midrange. Contested by Miles Ming (3.3 feet, ZONE). LAMELO SIMMONS MAKES IT!
Score: 68-70

[05:15] Team_079 possession (Score: 68-70)
Miles Ming attempts a 3Pt. Contested by Jordan Anunoby (5.8 feet, MAN). Miles Ming misses. Rebound secured by Ayo Murray.

[05:01] Team_014 possession (Score: 68-70)
DeMar Adebayo attempts a 3Pt. Contested by Trae Durant (4.4 feet, MAN). DeMar Adebayo misses. FOUL! Loose ball foul on Donovan Randle during the rebound battle. [IN THE BONUS! 6 team fouls] DeMar Adebayo to the line for 2 free throws. (Donovan Randle: 2 personal fouls)   FT 1/2: MISS   FT 2/2: GOOD DeMar Adebayo makes 1/2 from the line.
Score: 69-70

[04:46] Team_079 possession (Score: 69-70)
Bam Randle loses the ball! Stripped by Lamelo Simmons! TURNOVER! (live ball)

[04:35] Team_014 possession (Score: 69-70)
FOUL! Offensive foul on Jordan Anunoby! Miles Ming drew the charge! [Team fouls: 5] (Jordan Anunoby: 1 personal fouls) TURNOVER! (dead ball)

[04:23] Team_079 possession (Score: 69-70)
Khris Embiid attempts a 3Pt. Contested by Michael Cunningham (3.9 feet, ZONE). Khris Embiid misses. Rebound secured by Ayo Murray.

[04:10] Team_014 possession (Score: 69-70)
Ayo Murray drives, Donovan Randle stays with him. Ayo Murray attempts a Layup. Contested by Donovan Randle (5.2 feet, MAN). AYO MURRAY MAKES IT! Assist: Michael Cunningham
Score: 71-70

[03:53] Team_079 possession (Score: 71-70)
Miles Ming drives, picks up Jordan Anunoby. Help arrives from Michael Cunningham! Miles Ming attempts a Dunk. Contested by Michael Cunningham (4.1 feet, MAN). MILES MING MAKES IT! Assist: Bam Randle
Score: 71-72

[03:41] Team_014 possession (Score: 71-72)
DeMar Adebayo attempts a Layup. Contested by Trae Durant (3.7 feet, MAN). DeMar Adebayo misses. Rebound secured by Trae Durant.

[03:29] Team_079 possession (Score: 71-72)
Trae Durant drives and kicks out. Donovan Randle attempts a 3Pt. Heavily contested by Jordan Anunoby (2.0 feet, ZONE)! Donovan Randle misses. Rebound secured by Michael Cunningham.

[03:19] Team_014 possession (Score: 71-72)
Jordan Anunoby attempts a 3Pt. Contested by Miles Ming (5.1 feet, MAN). Jordan Anunoby misses. Rebound secured by Donovan Randle.

[03:04] Team_079 possession (Score: 71-72)
Trae Durant makes the Layup and draws the foul on DeMar Adebayo! And-1! Trae Durant to the line for 1. [BONUS: 6 team fouls] (DeMar Adebayo: 3 personal fouls)   FT 1/1: GOOD Trae Durant makes 1/1 from the line.
Score: 71-75

[02:49] Team_014 possession (Score: 71-75)
FOUL! Reach-in foul on Miles Ming during the drive. [IN THE BONUS! 7 team fouls] Jordan Anunoby to the line for 2 free throws. (Miles Ming: 3 personal fouls)   FT 1/2: GOOD   FT 2/2: MISS Jordan Anunoby makes 1/2 from the line. Rebound secured by Trae Durant.
Score: 72-75

[02:37] Team_079 possession (Score: 72-75)
FOUL! Shooting foul on DeMar Adebayo. Donovan Randle to the line for 2 free throws. [BONUS: 7 team fouls] (DeMar Adebayo: 4 personal fouls)   FT 1/2: GOOD   FT 2/2: GOOD Donovan Randle makes 2/2 from the line.
Score: 72-77

[02:27] Team_014 possession (Score: 72-77)
Jordan Anunoby attempts a 3Pt. Contested by Trae Durant (2.6 feet, ZONE). JORDAN ANUNOBY MAKES IT! Assist: Michael Cunningham
Score: 75-77

[02:16] Team_079 possession (Score: 75-77)
Donovan Randle attempts a 3Pt. Contested by Jordan Anunoby (2.3 feet, ZONE). Donovan Randle misses. Rebound secured by DeMar Adebayo.

[02:00] Team_014 possession (Score: 75-77)
Michael Cunningham loses control! Ball rolls out of bounds! TURNOVER! (dead ball)

[02:00] Substitution (Team_014): Michael Cunningham OUT → Jalen Booker IN (stamina_rule2)

[02:00] Substitution (Team_014): Jordan Anunoby OUT → Bones Quickley IN (stamina_rule2)

[02:00] Substitution (Team_014): Lamelo Simmons OUT → Tracy Westbrook IN (stamina_rule2)

[02:00] Substitution (Team_014): DeMar Adebayo OUT → Nikola James IN (stamina_rule2)

[02:00] Substitution (Team_014): Ayo Murray OUT → Collin Gasol IN (stamina_rule2)

[02:00] Substitution (Team_079): Khris Embiid OUT → Evan Mobley IN (stamina_rule2)

[02:00] Substitution (Team_079): Miles Ming OUT → Karl Ingram IN (stamina_rule2)

[02:00] Substitution (Team_079): Bam Randle OUT → Anthony Wade IN (stamina_rule2)

[02:00] Substitution (Team_079): Donovan Randle OUT → James LaVine IN (stamina_rule2)

[01:48] Team_079 possession (Score: 75-77)
Trae Durant attempts a Layup. Contested by Nikola James (3.8 feet, MAN). TRAE DURANT MAKES IT! Assist: Anthony Wade
Score: 75-79

[01:33] Team_014 possession (Score: 75-79)
Tracy Westbrook attempts a Midrange. Contested by Evan Mobley (4.3 feet, ZONE). Tracy Westbrook misses. Rebound secured by James LaVine.

[01:18] Team_079 possession (Score: 75-79)
Evan Mobley makes the Layup and draws the foul on Tracy Westbrook! And-1! Evan Mobley to the line for 1. [BONUS: 8 team fouls] (Tracy Westbrook: 1 personal fouls)   FT 1/1: GOOD Evan Mobley makes 1/1 from the line.
Score: 75-82

[00:59] Team_014 possession (Score: 75-82)
Nikola James attempts a 3Pt. Contested by Trae Durant (2.8 feet, ZONE). Nikola James misses. Rebound secured by Trae Durant.

[00:40] Team_079 possession (Score: 75-82)
Anthony Wade drives, picks up Collin Gasol. Help arrives from Jalen Booker! Anthony Wade attempts a Layup. Contested by Jalen Booker (5.2 feet, ZONE). ANTHONY WADE MAKES IT! Assist: Karl Ingram
Score: 75-84

[00:26] Team_014 possession (Score: 75-84)
Collin Gasol attempts a Layup. Wide open! James LaVine is 6.6 feet away. [MAN] Collin Gasol misses. Rebound secured by Trae Durant.

[00:07] Team_079 possession (Score: 75-84)
James LaVine attempts a Midrange. Contested by Bones Quickley (2.9 feet, ZONE). James LaVine misses. Offensive rebound by James LaVine! James LaVine puts it back in!
Score: 75-86

================================================================================
                              3RD QUARTER COMPLETE                              
================================================================================

3RD QUARTER SCORE: Team_014 19, Team_079 23

BOX SCORE:
================================================================================

Team_014
--------------------------------------------------------------------------------
Player                MIN  PTS  REB  AST  TO      FG   FG%      3P   3P%
--------------------------------------------------------------------------------
Ayo Murray             27    7    2    2   0   3/4    75.0     0/0   0.0
Jordan Anunoby         27    6    0    0   0   2/5    40.0     0/0   0.0
Lamelo Simmons         26    4    0    0   0   2/3    66.7     0/0   0.0
DeMar Adebayo          27    1    2    0   0   1/2    50.0     0/0   0.0
Michael Cunningham     27    0    4    2   0   0/1     0.0     0/0   0.0
Tracy Westbrook        11    0    0    0   0   0/1     0.0     0/0   0.0
Nikola James            9    0    0    0   0   0/1     0.0     0/0   0.0
Collin Gasol            9    0    0    0   0   0/1     0.0     0/0   0.0

TEAM: FG: 8/18 (44.4%), 3PT: 3/8 (37.5%), REB: 8 (1 off, 7 def), AST: 4, TO: 2
TEAM FOULS: 8 [Team_079 in BONUS]


Team_079
--------------------------------------------------------------------------------
Player                MIN  PTS  REB  AST  TO      FG   FG%      3P   3P%
--------------------------------------------------------------------------------
Khris Embiid           27    5    0    1   0   2/4    50.0     0/0   0.0
Trae Durant            29    5    7    0   0   2/4    50.0     0/0   0.0
Miles Ming             27    4    0    1   0   2/3    66.7     0/0   0.0
Evan Mobley             9    3    0    0   0   1/1   100.0     0/0   0.0
Donovan Randle         26    2    3    0   0   1/3    33.3     0/0   0.0
Anthony Wade            9    2    0    1   0   1/1   100.0     0/0   0.0
James LaVine           11    2    2    0   0   1/1   100.0     0/0   0.0
Bam Randle             27    0    0    2   0   0/1     0.0     0/0   0.0
Karl Ingram             9    0    0    1   0   0/0     0.0     0/0   0.0

TEAM: FG: 10/18 (55.6%), 3PT: 1/5 (20.0%), REB: 12 (2 off, 10 def), AST: 6, TO: 2
TEAM FOULS: 7 [Team_014 in BONUS]

================================================================================

================================================================================
                       4TH QUARTER - Team_014 vs Team_079                       
================================================================================

[12:00] Substitution (Team_014): Michael Cunningham OUT (stamina: 78) → Jalen Booker IN (comeback_detected)

[12:00] Substitution (Team_079): Khris Embiid OUT (stamina: 79) → Evan Mobley IN (comeback_detected)

[12:00] Team_014 possession (Score: 75-86)
Jalen Booker drives to the basket... Jalen Booker loses control! Ball rolls out of bounds! TURNOVER! (dead ball)

[11:49] Team_079 possession (Score: 75-86)
Miles Ming attempts a Layup. BLOCKED BY DEMAR ADEBAYO! Ball is loose! Rebound secured by Ayo Murray.

[11:29] Team_014 possession (Score: 75-86)
Jalen Booker attempts a 3Pt. Heavily contested by Trae Durant (0.9 feet, ZONE)! Jalen Booker misses. Rebound secured by Donovan Randle.

[11:11] Team_079 possession (Score: 75-86)
Evan Mobley attempts a Midrange. Contested by Jalen Booker (3.0 feet, ZONE). EVAN MOBLEY MAKES IT!
Score: 75-88

[10:59] Team_014 possession (Score: 75-88)
Ayo Murray attempts a Midrange. Heavily contested by Trae Durant (1.6 feet, ZONE)! Ayo Murray misses. Rebound secured by Trae Durant.

[10:44] Team_079 possession (Score: 75-88)
Bam Randle attempts a 3Pt. Contested by Jordan Anunoby (5.6 feet, ZONE). BAM RANDLE MAKES IT! Assist: Trae Durant
Score: 75-91

[10:25] Team_014 possession (Score: 75-91)
Jalen Booker attempts a 3Pt. Contested by Evan Mobley (4.4 feet, MAN). Jalen Booker misses. Rebound secured by Bam Randle.

[10:14] Team_079 possession (Score: 75-91)
Trae Durant attempts a 3Pt. Contested by Jordan Anunoby (3.1 feet, ZONE). Trae Durant misses. Rebound secured by Ayo Murray.

[10:00] Team_014 possession (Score: 75-91)
DeMar Adebayo attempts a Layup. BLOCKED BY TRAE DURANT! Ball is loose! Rebound secured by Trae Durant.

[09:46] Team_079 possession (Score: 75-91)
Bam Randle attempts a Midrange. Contested by DeMar Adebayo (5.6 feet, ZONE). Bam Randle misses. Rebound secured by DeMar Adebayo.

[09:33] Team_014 possession (Score: 75-91)
FOUL! Reach-in foul on Evan Mobley during the drive. [Team fouls: 1] No free throws, side out. (Evan Mobley: 1 personal fouls)

[09:24] Team_014 possession (Score: 75-91)
Ayo Murray attempts a Midrange. Contested by Miles Ming (2.8 feet, ZONE). Ayo Murray misses. Rebound secured by Trae Durant.

[09:12] Team_079 possession (Score: 75-91)
Bam Randle attempts a Midrange. Contested by Lamelo Simmons (3.2 feet, MAN). BAM RANDLE MAKES IT!
Score: 75-93

[09:00] Team_014 possession (Score: 75-93)
Jalen Booker drives to the basket... FOUL! Offensive foul on Jalen Booker! Trae Durant drew the charge! [Team fouls: 1] (Jalen Booker: 1 personal fouls) TURNOVER! (dead ball)

[08:50] Team_079 possession (Score: 75-93)
Trae Durant drives to the basket... Trae Durant throws a bad pass out of bounds! TURNOVER! (dead ball)

[08:50] Substitution (Team_014): Jordan Anunoby OUT → Bones Quickley IN (stamina_rule2)

[08:50] Substitution (Team_014): Lamelo Simmons OUT → Tracy Westbrook IN (stamina_rule2)

[08:50] Substitution (Team_014): DeMar Adebayo OUT → Nikola James IN (stamina_rule2)

[08:50] Substitution (Team_014): Ayo Murray OUT → Collin Gasol IN (stamina_rule2)

[08:50] Substitution (Team_079): Miles Ming OUT → Karl Ingram IN (stamina_rule2)

[08:50] Substitution (Team_079): Bam Randle OUT → Anthony Wade IN (stamina_rule2)

[08:50] Substitution (Team_079): Trae Durant OUT → Kobe Curry IN (stamina_rule2)

[08:50] Substitution (Team_079): Donovan Randle OUT → James LaVine IN (stamina_rule2)

[08:38] Team_014 possession (Score: 75-93)
Tracy Westbrook attempts a 3Pt. Wide open! Evan Mobley is 6.8 feet away. [ZONE] Tracy Westbrook misses. Rebound secured by Kobe Curry.

[08:21] Team_079 possession (Score: 75-93)
Anthony Wade drives and kicks out. FOUL! Shooting foul on Nikola James. Kobe Curry to the line for 3 free throws. [Team fouls: 2] (Nikola James: 1 personal fouls)   FT 1/3: GOOD   FT 2/3: MISS   FT 3/3: MISS Kobe Curry makes 1/3 from the line. Rebound secured by Nikola James.
Score: 75-94

[08:03] Team_014 possession (Score: 75-94)
Nikola James drives, James LaVine stays with him. Nikola James attempts a Layup. Contested by James LaVine (5.7 feet, ZONE). Nikola James misses. FOUL! Loose ball foul on James LaVine during the rebound battle. [Team fouls: 2] No free throws, side out. (James LaVine: 1 personal fouls)

[07:46] Team_014 possession (Score: 75-94)
FOUL! Holding foul on Anthony Wade. [Team fouls: 3] No free throws, side out. (Anthony Wade: 1 personal fouls)

[07:33] Team_014 possession (Score: 75-94)
Nikola James attempts a 3Pt. Heavily contested by Kobe Curry (1.3 feet, MAN)! NIKOLA JAMES MAKES IT! Assist: Bones Quickley
Score: 78-94

[07:16] Team_079 possession (Score: 78-94)
James LaVine attempts a 3Pt. Wide open! Collin Gasol is 8.4 feet away. [MAN] JAMES LAVINE MAKES IT!
Score: 78-97

[07:00] Team_014 possession (Score: 78-97)
Tracy Westbrook drives and kicks out. Bones Quickley attempts a 3Pt. Wide open! Karl Ingram is 8.7 feet away. [MAN] Bones Quickley misses. Rebound secured by James LaVine.

[06:43] Team_079 possession (Score: 78-97)
Karl Ingram attempts a 3Pt. Contested by Bones Quickley (3.7 feet, MAN). Karl Ingram misses. Offensive rebound by James LaVine! James LaVine's putback is no good. Offensive rebound by Kobe Curry! Kobe Curry kicks it out.

[06:28] Team_079 possession (Score: 78-97)
Kobe Curry drives, Nikola James stays with him. Kobe Curry attempts a Dunk. Wide open! Nikola James is 7.9 feet away. [MAN] Kobe Curry misses. Rebound secured by Collin Gasol.

[06:18] Team_014 possession (Score: 78-97)
FOUL! Shooting foul on Karl Ingram. Bones Quickley to the line for 3 free throws. [Team fouls: 4] (Karl Ingram: 1 personal fouls)   FT 1/3: MISS   FT 2/3: MISS   FT 3/3: GOOD Bones Quickley makes 1/3 from the line.
Score: 79-97

[06:03] Team_079 possession (Score: 79-97)
Anthony Wade drives, picks up Nikola James. Help arrives from Jalen Booker! Anthony Wade attempts a Dunk. Contested by Jalen Booker (2.5 feet, ZONE). ANTHONY WADE MAKES IT!
Score: 79-99

[05:47] Team_014 possession (Score: 79-99)
Tracy Westbrook attempts a 3Pt. Contested by Anthony Wade (2.3 feet, MAN). Tracy Westbrook misses. Rebound secured by Anthony Wade.

[05:34] Team_079 possession (Score: 79-99)
Evan Mobley drives and kicks out. Evan Mobley attempts a Midrange. Wide open! Jalen Booker is 7.2 feet away. [MAN] EVAN MOBLEY MAKES IT!
Score: 79-101

[05:15] Team_014 possession (Score: 79-101)
FOUL! Reach-in foul on James LaVine during the drive. [IN THE BONUS! 5 team fouls] Tracy Westbrook to the line for 2 free throws. (James LaVine: 2 personal fouls)   FT 1/2: GOOD   FT 2/2: GOOD Tracy Westbrook makes 2/2 from the line.
Score: 81-101

[05:00] Team_079 possession (Score: 81-101)
Kobe Curry attempts a 3Pt. Contested by Jalen Booker (4.4 feet, ZONE). KOBE CURRY MAKES IT! Assist: Karl Ingram
Score: 81-104

[04:46] Team_014 possession (Score: 81-104)
Collin Gasol drives and kicks out. Collin Gasol attempts a 3Pt. Contested by James LaVine (5.6 feet, MAN). Collin Gasol misses. Rebound secured by James LaVine.

[04:34] Team_079 possession (Score: 81-104)
Karl Ingram attempts a Midrange. Wide open! Tracy Westbrook is 6.2 feet away. [ZONE] Karl Ingram misses. Rebound secured by Collin Gasol.

[04:21] Team_014 possession (Score: 81-104)
Jalen Booker attempts a 3Pt. Contested by Karl Ingram (5.0 feet, ZONE). JALEN BOOKER MAKES IT! Assist: Bones Quickley
Score: 84-104

[04:09] Team_079 possession (Score: 84-104)
Kobe Curry attempts a Midrange. Contested by Nikola James (4.6 feet, MAN). Kobe Curry misses. FOUL! Loose ball foul on Collin Gasol during the rebound battle. [Team fouls: 3] No free throws, side out. (Collin Gasol: 1 personal fouls)

[03:58] Team_079 possession (Score: 84-104)
Kobe Curry attempts a 3Pt. Contested by Nikola James (4.8 feet, MAN). Kobe Curry misses. Rebound secured by Nikola James.

[03:41] Team_014 possession (Score: 84-104)
Tracy Westbrook drives and kicks out. Nikola James attempts a Midrange. Wide open! Anthony Wade is 7.8 feet away. [ZONE] Nikola James misses. Offensive rebound by Nikola James! Nikola James kicks it out.

[03:24] Team_014 possession (Score: 84-104)
Nikola James attempts a 3Pt. Contested by Kobe Curry (5.8 feet, MAN). NIKOLA JAMES MAKES IT! Assist: Bones Quickley
Score: 87-104

[03:10] Team_079 possession (Score: 87-104)
Evan Mobley commits a violation (traveling/carry)! TURNOVER! (dead ball)

[03:10] Substitution (Team_079): Evan Mobley OUT → Khris Embiid IN (starter_return_rule1)

[02:55] Team_014 possession (Score: 87-104)
Jalen Booker drives, picks up James LaVine. Help arrives from Khris Embiid! Jalen Booker attempts a Dunk. Wide open! Khris Embiid is 6.6 feet away. [ZONE] Jalen Booker misses. Rebound secured by Anthony Wade.

[02:39] Team_079 possession (Score: 87-104)
Karl Ingram makes the Layup and draws the foul on Collin Gasol! And-1! Karl Ingram to the line for 1. [Team fouls: 4] (Collin Gasol: 2 personal fouls)   FT 1/1: GOOD Karl Ingram makes 1/1 from the line.
Score: 87-107

[02:26] Team_014 possession (Score: 87-107)
Collin Gasol drives and kicks out. Tracy Westbrook attempts a Midrange. Contested by James LaVine (3.6 feet, ZONE). Tracy Westbrook misses. Offensive rebound by Collin Gasol! Collin Gasol's putback is no good. Rebound secured by Anthony Wade.

[02:15] Team_079 possession (Score: 87-107)
Khris Embiid attempts a 3Pt. Contested by Bones Quickley (2.1 feet, ZONE). KHRIS EMBIID MAKES IT! Assist: Anthony Wade
Score: 87-110

[01:57] Team_014 possession (Score: 87-110)
Jalen Booker attempts a Layup. Contested by Khris Embiid (4.0 feet, MAN). JALEN BOOKER MAKES IT! Assist: Collin Gasol
Score: 89-110

[01:42] Team_079 possession (Score: 89-110)
Kobe Curry attempts a 3Pt. Contested by Nikola James (4.7 feet, MAN). Kobe Curry misses. FOUL! Loose ball foul on Tracy Westbrook during the rebound battle. [IN THE BONUS! 5 team fouls] James LaVine to the line for 2 free throws. (Tracy Westbrook: 1 personal fouls)   FT 1/2: GOOD   FT 2/2: GOOD James LaVine makes 2/2 from the line.
Score: 89-112

[01:30] Team_014 possession (Score: 89-112)
Bones Quickley makes the Dunk and draws the foul on Khris Embiid! And-1! Bones Quickley to the line for 1. [BONUS: 6 team fouls] (Khris Embiid: 1 personal fouls)   FT 1/1: GOOD Bones Quickley makes 1/1 from the line.
Score: 92-112

[01:15] Team_079 possession (Score: 92-112)
Karl Ingram throws a bad pass! Stolen by Bones Quickley! TURNOVER! (live ball)

[00:57] Team_014 possession (Score: 92-112)
Nikola James drives, picks up Kobe Curry. Help arrives from Khris Embiid! Nikola James attempts a Layup. Contested by Khris Embiid (2.9 feet, MAN). NIKOLA JAMES MAKES IT!
Score: 94-112

[00:46] Team_079 possession (Score: 94-112)
James LaVine loses control! Ball rolls out of bounds! TURNOVER! (dead ball)

[00:46] Substitution (Team_014): Jalen Booker OUT → Michael Cunningham IN (starter_return_rule1)

[00:35] Team_014 possession (Score: 94-112)
Nikola James attempts a 3Pt. Wide open! Kobe Curry is 7.1 feet away. [MAN] Nikola James misses. Rebound secured by Kobe Curry.

[00:21] Team_079 possession (Score: 94-112)
Karl Ingram loses control! Ball rolls out of bounds! TURNOVER! (dead ball)

[00:02] Team_014 possession (Score: 94-112)
Tracy Westbrook attempts a Midrange. Contested by Anthony Wade (5.4 feet, MAN). TRACY WESTBROOK MAKES IT! Assist: Nikola James
Score: 96-112

================================================================================
                              4TH QUARTER COMPLETE                              
================================================================================

4TH QUARTER SCORE: Team_014 21, Team_079 26

BOX SCORE:
================================================================================

Team_014
--------------------------------------------------------------------------------
Player                MIN  PTS  REB  AST  TO      FG   FG%      3P   3P%
--------------------------------------------------------------------------------
Nikola James           18    8    3    1   0   3/4    75.0     0/0   0.0
Jalen Booker           21    5    0    0   0   2/5    40.0     0/0   0.0
Tracy Westbrook        20    4    0    0   0   2/5    40.0     0/0   0.0
Bones Quickley         18    4    0    3   0   2/2   100.0     0/0   0.0
Ayo Murray             31    0    2    0   0   0/2     0.0     0/0   0.0
DeMar Adebayo          31    0    1    0   0   0/1     0.0     0/0   0.0
Collin Gasol           18    0    3    1   0   0/2     0.0     0/0   0.0

TEAM: FG: 9/21 (42.9%), 3PT: 4/9 (44.4%), REB: 10 (3 off, 7 def), AST: 5, TO: 2
TEAM FOULS: 5 [Team_079 in BONUS]


Team_079
--------------------------------------------------------------------------------
Player                MIN  PTS  REB  AST  TO      FG   FG%      3P   3P%
--------------------------------------------------------------------------------
Bam Randle             31    5    1    0   0   2/3    66.7     0/0   0.0
James LaVine           20    5    2    0   0   2/2   100.0     0/0   0.0
Evan Mobley            18    4    0    0   0   2/2   100.0     0/0   0.0
Kobe Curry             16    3    4    0   0   1/3    33.3     0/0   0.0
Karl Ingram            18    3    0    1   0   1/2    50.0     0/0   0.0
Khris Embiid           30    3    0    0   0   1/1   100.0     0/0   0.0
Anthony Wade           18    2    3    1   0   1/2    50.0     0/0   0.0
Miles Ming             31    0    0    0   0   0/1     0.0     0/0   0.0
Donovan Randle         29    0    1    0   0   0/0     0.0     0/0   0.0
Trae Durant            33    0    3    1   0   0/1     0.0     0/0   0.0

TEAM: FG: 10/17 (58.8%), 3PT: 5/7 (71.4%), REB: 13 (2 off, 11 def), AST: 3, TO: 5
TEAM FOULS: 6 [Team_014 in BONUS]

================================================================================

================================================================================
                               FULL GAME COMPLETE                               
================================================================================

FINAL SCORE: Team_014 96, Team_079 112

SCORING BY QUARTER:
--------------------------------------------------------------------------------
Team                     Q1     Q2     Q3     Q4    FINAL
--------------------------------------------------------------------------------
Team_014                 20     36     19     21       96
Team_079                 39     24     23     26      112
--------------------------------------------------------------------------------

FULL GAME BOX SCORE:
================================================================================

Team_014
--------------------------------------------------------------------------------
Player                MIN  PTS  REB  AST  TO      FG   FG%      3P   3P%      FT STL BLK
--------------------------------------------------------------------------------
Jordan Anunoby         31   11    0    1   2   4/14   28.6   3/8    37.5   4/5     0   0
DeMar Adebayo          31   10    3    2   2   4/7    57.1   2/2   100.0   4/5     0   4
Ayo Murray             31   12   11    4   1   6/12   50.0   0/0     0.0   4/4     1   0
Lamelo Simmons         29   11    0    0   1   5/9    55.6   1/4    25.0   3/4     1   0
Michael Cunningham     28    9   11    3   2   4/5    80.0   0/1     0.0   1/1     0   2
Jalen Booker           21    7    0    0   1   3/7    42.9   1/3    33.3   0/0     0   0
Tracy Westbrook        20    9    0    0   0   4/10   40.0   1/4    25.0   2/2     0   0
Bones Quickley         18    8    0    4   0   3/4    75.0   2/2   100.0   3/5     1   0
Nikola James           18   11    6    3   0   4/7    57.1   2/4    50.0   2/3     0   0
Collin Gasol           18    5    6    2   0   2/5    40.0   0/0     0.0   1/1     0   0

TEAM: FG: 39/80 (48.8%), 3PT: 12/28 (42.9%), REB: 35 (9 off, 26 def), AST: 19, TO: 9


Team_079
--------------------------------------------------------------------------------
Player                MIN  PTS  REB  AST  TO      FG   FG%      3P   3P%      FT STL BLK
--------------------------------------------------------------------------------
Trae Durant            33   16   15    1   1   7/14   50.0   1/4    25.0   3/3     1   2
Miles Ming             31   12    0    3   0   6/8    75.0   3/4    75.0   0/0     2   0
Bam Randle             31   20    5    4   3   9/12   75.0   2/2   100.0   8/8     0   0
Khris Embiid           30   13    0    5   2   4/10   40.0   3/8    37.5   0/0     0   0
Donovan Randle         29    5   13    1   0   2/5    40.0   0/1     0.0   4/5     1   0
James LaVine           20   10    7    0   1   3/4    75.0   1/1   100.0   3/3     0   0
Evan Mobley            18   16    0    0   1   8/10   80.0   0/2     0.0   4/4     0   0
Karl Ingram            18    7    0    3   2   2/4    50.0   0/0     0.0   1/2     0   0
Anthony Wade           18    4    4    4   0   2/3    66.7   0/0     0.0   0/0     0   0
Kobe Curry             16    5    7    1   0   3/6    50.0   2/4    50.0   3/5     0   0

TEAM: FG: 46/77 (59.7%), 3PT: 12/26 (46.2%), REB: 53 (13 off, 40 def), AST: 22, TO: 10

================================================================================
