================================================================================
                        FULL GAME - Team_063 vs Team_011                        
================================================================================

================================================================================
                       1ST QUARTER - Team_063 vs Team_011                       
================================================================================

[12:00] Team_063 possession (Score: 0-0)
Tyler Harris attempts a Midrange. BLOCKED BY PAU BARNES! Ball goes out off Pau Barnes. Tyler Harris's ball!

[11:41] Team_063 possession (Score: 0-0)
Bradley Davis drives to the basket... FOUL! Offensive foul on Bradley Davis! Pau Barnes drew the charge! [Team fouls: 1] (Bradley Davis: 1 personal fouls) TURNOVER! (dead ball)

[11:24] Team_011 possession (Score: 0-0)
Magic Tatum attempts a Layup. Contested by Tyler Harris (4.3 feet, ZONE). MAGIC TATUM MAKES IT!
Score: 0-2

[11:12] Team_063 possession (Score: 0-2)
Bradley Davis attempts a 3Pt. Contested by Trae Tatum (2.8 feet, ZONE). Bradley Davis misses. Offensive rebound by Dirk Reaves! Dirk Reaves's putback is no good. Rebound secured by Michael Carter.

[10:55] Team_011 possession (Score: 0-2)
Trae Tatum attempts a Layup. BLOCKED BY TYLER HARRIS! Ball is loose! Offensive rebound by Pau Barnes! Pau Barnes kicks it out.

[10:44] Team_011 possession (Score: 0-2)
Magic Tatum throws a bad pass out of bounds! TURNOVER! (dead ball)

[10:29] Team_063 possession (Score: 0-2)
Bradley Davis attempts a 3Pt. Contested by Magic Tatum (5.4 feet, MAN). Bradley Davis misses. Offensive rebound by Tyler Harris! Tyler Harris puts it back in!
Score: 2-2

[10:13] Team_011 possession (Score: 2-2)
Magic Tatum attempts a 3Pt. Contested by Malcolm Quickley (2.3 feet, ZONE). MAGIC TATUM MAKES IT! Assist: Pau Barnes
Score: 2-5

[09:57] Team_063 possession (Score: 2-5)
Dirk Reaves attempts a Midrange. Contested by Pau Barnes (4.7 feet, MAN). DIRK REAVES MAKES IT!
Score: 4-5

[09:42] Team_011 possession (Score: 4-5)
Trae Tatum attempts a Layup. Contested by Tyler Harris (4.0 feet, ZONE). Trae Tatum misses. Rebound secured by Tyler Harris.

[09:30] Team_063 possession (Score: 4-5)
Tyler Harris drives and kicks out. Dirk Reaves attempts a Midrange. Contested by Pau Barnes (2.9 feet, ZONE). DIRK REAVES MAKES IT!
Score: 6-5

[09:19] Team_011 possession (Score: 6-5)
Magic Tatum drives, picks up Dirk Reaves. Help arrives from Malcolm Quickley! Magic Tatum attempts a Layup. Contested by Malcolm Quickley (4.4 feet, ZONE). MAGIC TATUM MAKES IT! Assist: Michael Carter
Score: 6-7

[09:02] Team_063 possession (Score: 6-7)
Bradley Davis makes the Midrange and draws the foul on Pau Barnes! And-1! Bradley Davis to the line for 1. [Team fouls: 1] (Pau Barnes: 1 personal fouls)   FT 1/1: GOOD Bradley Davis makes 1/1 from the line.
Score: 9-7

[08:49] Team_011 possession (Score: 9-7)
Michael Carter attempts a 3Pt. Heavily contested by Malcolm Quickley (0.5 feet, ZONE)! MICHAEL CARTER MAKES IT! Assist: Magic Tatum
Score: 9-10

[08:34] Team_063 possession (Score: 9-10)
Malcolm Quickley attempts a 3Pt. Contested by Magic Tatum (5.7 feet, ZONE). Malcolm Quickley misses. Offensive rebound by Dirk Reaves! Dirk Reaves's putback is no good. Rebound secured by Pau Barnes.

[08:19] Team_011 possession (Score: 9-10)
Michael Carter makes the Midrange and draws the foul on Terry Reaves! And-1! Michael Carter to the line for 1. [Team fouls: 2] (Terry Reaves: 1 personal fouls)   FT 1/1: GOOD Michael Carter makes 1/1 from the line.
Score: 9-13

[08:05] Team_063 possession (Score: 9-13)
Bradley Davis attempts a 3Pt. Contested by Magic Tatum (4.7 feet, MAN). Bradley Davis misses. Rebound secured by Evan George.

[07:47] Team_011 possession (Score: 9-13)
Michael Carter drives and kicks out. Magic Tatum attempts a Midrange. Heavily contested by Dirk Reaves (1.8 feet, ZONE)! Magic Tatum misses. Offensive rebound by Evan George! Evan George puts it back in!
Score: 9-15

[07:34] Team_063 possession (Score: 9-15)
Malcolm Quickley attempts a 3Pt. Wide open! Michael Carter is 6.9 feet away. [ZONE] Malcolm Quickley misses. Rebound secured by Michael Carter.

[07:21] Team_011 possession (Score: 9-15)
Trae Tatum drives to the basket... FOUL! Offensive foul on Trae Tatum! Tyler Harris drew the charge! [Team fouls: 2] (Trae Tatum: 1 personal fouls) TURNOVER! (dead ball)

[07:03] Team_063 possession (Score: 9-15)
Terry Reaves throws a bad pass! Stolen by Michael Carter! TURNOVER! (live ball)

[06:50] Team_011 possession (Score: 9-15)
Evan George attempts a Layup. BLOCKED BY TYLER HARRIS! Ball is loose! Rebound secured by Malcolm Quickley.

[06:33] Team_063 possession (Score: 9-15)
Dirk Reaves drives to the basket... Dirk Reaves throws a bad pass! Stolen by Pau Barnes! TURNOVER! (live ball)

[06:19] Team_011 possession (Score: 9-15)
Magic Tatum attempts a Layup. Contested by Bradley Davis (4.2 feet, MAN). MAGIC TATUM MAKES IT! Assist: Michael Carter
Score: 9-17

[06:03] Team_063 possession (Score: 9-17)
Malcolm Quickley makes the Layup and draws the foul on Magic Tatum! And-1! Malcolm Quickley to the line for 1. [Team fouls: 3] (Magic Tatum: 1 personal fouls)   FT 1/1: GOOD Malcolm Quickley makes 1/1 from the line.
Score: 12-17

[05:49] Team_011 possession (Score: 12-17)
Trae Tatum drives and kicks out. Pau Barnes attempts a 3Pt. Contested by Dirk Reaves (3.4 feet, MAN). PAU BARNES MAKES IT! Assist: Michael Carter
Score: 12-20

[05:36] Team_063 possession (Score: 12-20)
FOUL! Shooting foul on Pau Barnes. Terry Reaves to the line for 2 free throws. [Team fouls: 4] (Pau Barnes: 2 personal fouls)   FT 1/2: GOOD   FT 2/2: GOOD Terry Reaves makes 2/2 from the line.
Score: 14-20

[05:24] Team_011 possession (Score: 14-20)
Evan George attempts a 3Pt. Wide open! Malcolm Quickley is 6.4 feet away. [ZONE] EVAN GEORGE MAKES IT!
Score: 14-23

[05:12] Team_063 possession (Score: 14-23)
Tyler Harris attempts a Layup. Heavily contested by Pau Barnes (0.9 feet, MAN)! TYLER HARRIS MAKES IT! Assist: Dirk Reaves
Score: 16-23

[04:58] Team_011 possession (Score: 16-23)
Evan George attempts a 3Pt. Contested by Tyler Harris (4.3 feet, MAN). Evan George misses. Offensive rebound by Pau Barnes! Pau Barnes puts it back in!
Score: 16-25

[04:43] Team_063 possession (Score: 16-25)
Terry Reaves drives and kicks out. Malcolm Quickley attempts a 3Pt. Contested by Trae Tatum (2.2 feet, MAN). Malcolm Quickley misses. Offensive rebound by Tyler Harris! Tyler Harris's putback is no good. Rebound secured by Evan George.

[04:28] Team_011 possession (Score: 16-25)
Pau Barnes makes the Layup and draws the foul on Dirk Reaves! And-1! Pau Barnes to the line for 1. [Team fouls: 3] (Dirk Reaves: 1 personal fouls)   FT 1/1: MISS Pau Barnes makes 0/1 from the line. Rebound secured by Tyler Harris.
Score: 16-27

[04:14] Team_063 possession (Score: 16-27)
FOUL! Holding foul on Pau Barnes. [IN THE BONUS! 5 team fouls] Tyler Harris to the line for 2 free throws. (Pau Barnes: 3 personal fouls)   FT 1/2: MISS   FT 2/2: GOOD Tyler Harris makes 1/2 from the line.
Score: 17-27

[04:00] Team_011 possession (Score: 17-27)
Michael Carter attempts a 3Pt. Wide open! Terry Reaves is 7.1 feet away. [MAN] Michael Carter misses. Offensive rebound by Evan George! Evan George puts it back in!
Score: 17-29

[03:48] Team_063 possession (Score: 17-29)
Dirk Reaves attempts a 3Pt. Contested by Pau Barnes (5.0 feet, MAN). Dirk Reaves misses. Rebound secured by Michael Carter.

[03:28] Team_011 possession (Score: 17-29)
Michael Carter drives to the basket... FOUL! Offensive foul on Michael Carter! Tyler Harris drew the charge! [Team fouls: 6] (Michael Carter: 1 personal fouls) TURNOVER! (dead ball)

[03:13] Team_063 possession (Score: 17-29)
Tyler Harris drives and kicks out. Tyler Harris attempts a Midrange. Wide open! Pau Barnes is 6.7 feet away. [ZONE] TYLER HARRIS MAKES IT! Assist: Dirk Reaves
Score: 19-29

[02:53] Team_011 possession (Score: 19-29)
Michael Carter makes the Dunk and draws the foul on Tyler Harris! And-1! Michael Carter to the line for 1. [Team fouls: 4] (Tyler Harris: 1 personal fouls)   FT 1/1: GOOD Michael Carter makes 1/1 from the line.
Score: 19-32

[02:38] Team_063 possession (Score: 19-32)
Malcolm Quickley attempts a 3Pt. Contested by Michael Carter (5.1 feet, ZONE). Malcolm Quickley misses. Offensive rebound by Tyler Harris! Tyler Harris puts it back in!
Score: 21-32

[02:21] Team_011 possession (Score: 21-32)
Pau Barnes drives, picks up Tyler Harris. Help arrives from Malcolm Quickley! Pau Barnes attempts a Dunk. Wide open! Malcolm Quickley is 8.2 feet away. [ZONE] PAU BARNES MAKES IT! Assist: Michael Carter
Score: 21-34

[02:06] Team_063 possession (Score: 21-34)
Bradley Davis attempts a 3Pt. Contested by Magic Tatum (2.7 feet, ZONE). Bradley Davis misses. Rebound secured by Michael Carter.

[01:54] Team_011 possession (Score: 21-34)
Trae Tatum attempts a Layup. BLOCKED BY MALCOLM QUICKLEY! Ball is loose! Rebound secured by Tyler Harris.

[01:39] Team_063 possession (Score: 21-34)
FOUL! Holding foul on Magic Tatum. [IN THE BONUS! 7 team fouls] Bradley Davis to the line for 2 free throws. (Magic Tatum: 2 personal fouls)   FT 1/2: GOOD   FT 2/2: MISS Bradley Davis makes 1/2 from the line. Offensive rebound by Dirk Reaves! Dirk Reaves kicks it out.
Score: 22-34

[01:26] Team_063 possession (Score: 22-34)
Terry Reaves attempts a Layup. Contested by Michael Carter (4.1 feet, MAN). Terry Reaves misses. Rebound secured by Evan George.

[01:13] Team_011 possession (Score: 22-34)
FOUL! Shooting foul on Malcolm Quickley. Trae Tatum to the line for 3 free throws. [BONUS: 5 team fouls] (Malcolm Quickley: 1 personal fouls)   FT 1/3: MISS   FT 2/3: GOOD   FT 3/3: GOOD Trae Tatum makes 2/3 from the line.
Score: 22-36

[01:01] Team_063 possession (Score: 22-36)
Dirk Reaves attempts a Midrange. Contested by Pau Barnes (4.5 feet, MAN). Dirk Reaves misses. Offensive rebound by Tyler Harris! Tyler Harris puts it back in!
Score: 24-36

[00:48] Team_011 possession (Score: 24-36)
Trae Tatum attempts a Midrange. Heavily contested by Malcolm Quickley (0.5 feet, MAN)! Trae Tatum misses. Rebound secured by Malcolm Quickley.

[00:37] Team_063 possession (Score: 24-36)
Terry Reaves attempts a Layup. Contested by Michael Carter (5.7 feet, MAN). Terry Reaves misses. Offensive rebound by Dirk Reaves! Dirk Reaves kicks it out.

[00:27] Team_063 possession (Score: 24-36)
Dirk Reaves makes the Layup and draws the foul on Pau Barnes! And-1! Dirk Reaves to the line for 1. [BONUS: 8 team fouls] (Pau Barnes: 4 personal fouls)   FT 1/1: GOOD Dirk Reaves makes 1/1 from the line.
Score: 27-36

[00:16] Team_011 possession (Score: 27-36)
Magic Tatum attempts a Midrange. Contested by Malcolm Quickley (4.5 feet, ZONE). Magic Tatum misses. Rebound secured by Dirk Reaves.

[00:03] Team_063 possession (Score: 27-36)
Malcolm Quickley attempts a Midrange. Contested by Pau Barnes (5.4 feet, ZONE). Malcolm Quickley misses. Rebound secured by Michael Carter.

================================================================================
                              1ST QUARTER COMPLETE                              
================================================================================

1ST QUARTER SCORE: Team_063 27, Team_011 36

BOX SCORE:
================================================================================

Team_063
--------------------------------------------------------------------------------
Player                MIN  PTS  REB  AST  TO      FG   FG%      3P   3P%
--------------------------------------------------------------------------------
Tyler Harris           12   11    6    0   0   6/6   100.0     0/0   0.0
Dirk Reaves            12    7    3    2   0   3/4    75.0     0/0   0.0
Bradley Davis          12    3    0    0   0   1/4    25.0     0/0   0.0
Malcolm Quickley       12    3    2    0   0   1/4    25.0     0/0   0.0
Terry Reaves           12    2    0    0   0   1/3    33.3     0/0   0.0

TEAM: FG: 12/21 (57.1%), 3PT: 2/8 (25.0%), REB: 14 (8 off, 6 def), AST: 2, TO: 3
TEAM FOULS: 5 [Team_011 in BONUS]


Team_011
--------------------------------------------------------------------------------
Player                MIN  PTS  REB  AST  TO      FG   FG%      3P   3P%
--------------------------------------------------------------------------------
Magic Tatum            12    9    0    1   0   4/5    80.0     0/0   0.0
Michael Carter         12    9    5    4   0   3/3   100.0     0/0   0.0
Pau Barnes             12    7    3    1   0   3/4    75.0     0/0   0.0
Evan George            12    7    5    0   0   3/4    75.0     0/0   0.0
Trae Tatum             12    2    0    0   0   1/4    25.0     0/0   0.0

TEAM: FG: 14/20 (70.0%), 3PT: 6/6 (100.0%), REB: 10 (4 off, 6 def), AST: 6, TO: 3
TEAM FOULS: 8 [Team_063 in BONUS]

================================================================================

================================================================================
                       2ND QUARTER - Team_063 vs Team_011                       
================================================================================

[12:00] Team_063 possession (Score: 27-36)
Dirk Reaves attempts a Midrange. Contested by Pau Barnes (4.1 feet, MAN). Dirk Reaves misses. Rebound secured by Pau Barnes.

[11:46] Team_011 possession (Score: 27-36)
Michael Carter attempts a Layup. Wide open! Tyler Harris is 6.6 feet away. [ZONE] Michael Carter misses. Rebound secured by Tyler Harris.

[11:35] Team_063 possession (Score: 27-36)
FOUL! Offensive foul on Malcolm Quickley! Trae Tatum drew the charge! [Team fouls: 1] (Malcolm Quickley: 1 personal fouls) TURNOVER! (dead ball)

[11:19] Team_011 possession (Score: 27-36)
Magic Tatum makes the 3Pt and draws the foul on Malcolm Quickley! And-1! Magic Tatum to the line for 1. [Team fouls: 2] (Malcolm Quickley: 2 personal fouls)   FT 1/1: MISS Magic Tatum makes 0/1 from the line. Rebound secured by Tyler Harris.
Score: 27-39

[11:00] Team_063 possession (Score: 27-39)
Bradley Davis attempts a 3Pt. Contested by Magic Tatum (4.2 feet, ZONE). Bradley Davis misses. Rebound secured by Evan George.

[10:45] Team_011 possession (Score: 27-39)
FOUL! Reach-in foul on Tyler Harris during the drive. [Team fouls: 3] No free throws, side out. (Tyler Harris: 1 personal fouls)

[10:35] Team_011 possession (Score: 27-39)
Michael Carter drives and kicks out. Pau Barnes attempts a 3Pt. Contested by Bradley Davis (5.5 feet, ZONE). Pau Barnes misses. Rebound secured by Dirk Reaves.

[10:17] Team_063 possession (Score: 27-39)
Malcolm Quickley attempts a 3Pt. Wide open! Magic Tatum is 6.6 feet away. [ZONE] Malcolm Quickley misses. Rebound secured by Michael Carter.

[10:02] Team_011 possession (Score: 27-39)
Pau Barnes attempts a Midrange. Contested by Dirk Reaves (4.7 feet, MAN). PAU BARNES MAKES IT!
Score: 27-41

[09:52] Team_063 possession (Score: 27-41)
Malcolm Quickley drives to the basket... Malcolm Quickley loses the ball! Stripped by Pau Barnes! TURNOVER! (live ball)

[09:32] Team_011 possession (Score: 27-41)
Trae Tatum drives and kicks out. Trae Tatum attempts a 3Pt. Contested by Malcolm Quickley (3.6 feet, ZONE). Trae Tatum misses. FOUL! Loose ball foul on Dirk Reaves during the rebound battle. [Team fouls: 4] No free throws, side out. (Dirk Reaves: 1 personal fouls)

[09:17] Team_011 possession (Score: 27-41)
FOUL! Holding foul on Terry Reaves. [IN THE BONUS! 5 team fouls] Michael Carter to the line for 2 free throws. (Terry Reaves: 1 personal fouls)   FT 1/2: MISS   FT 2/2: GOOD Michael Carter makes 1/2 from the line.
Score: 27-42

[09:04] Team_063 possession (Score: 27-42)
Terry Reaves loses control! Ball rolls out of bounds! TURNOVER! (dead ball)

[09:04] Substitution (Team_063): Bradley Davis OUT → DeMar Banchero IN (stamina_rule2)

[09:04] Substitution (Team_063): Malcolm Quickley OUT → Cole Durant IN (stamina_rule2)

[09:04] Substitution (Team_063): Terry Reaves OUT → Jaren James IN (stamina_rule2)

[09:04] Substitution (Team_063): Dirk Reaves OUT → Lamelo Ball IN (stamina_rule2)

[09:04] Substitution (Team_063): Tyler Harris OUT → Kyle Green IN (stamina_rule2)

[09:04] Substitution (Team_011): Magic Tatum OUT → Shai Leonard IN (stamina_rule2)

[09:04] Substitution (Team_011): Trae Tatum OUT → De'Aaron George IN (stamina_rule2)

[09:04] Substitution (Team_011): Michael Carter OUT → Tyrese Nowitzki IN (stamina_rule2)

[09:04] Substitution (Team_011): Pau Barnes OUT → Russell Davis IN (stamina_rule2)

[09:04] Substitution (Team_011): Evan George OUT → Pau Towns IN (stamina_rule2)

[08:51] Team_011 possession (Score: 27-42)
De'Aaron George attempts a 3Pt. Contested by Lamelo Ball (4.2 feet, ZONE). De'Aaron George misses. Rebound secured by Kyle Green.

[08:38] Team_063 possession (Score: 27-42)
DeMar Banchero attempts a Midrange. Contested by De'Aaron George (4.8 feet, ZONE). DeMar Banchero misses. Rebound secured by Pau Towns.

[08:27] Team_011 possession (Score: 27-42)
De'Aaron George makes the Layup and draws the foul on Cole Durant! And-1! De'Aaron George to the line for 1. [BONUS: 6 team fouls] (Cole Durant: 1 personal fouls)   FT 1/1: GOOD De'Aaron George makes 1/1 from the line.
Score: 27-45

[08:16] Team_063 possession (Score: 27-45)
Jaren James makes the 3Pt and draws the foul on Tyrese Nowitzki! And-1! Jaren James to the line for 1. [Team fouls: 1] (Tyrese Nowitzki: 1 personal fouls)   FT 1/1: MISS Jaren James makes 0/1 from the line. Rebound secured by Pau Towns.
Score: 30-45

[08:02] Team_011 possession (Score: 30-45)
Tyrese Nowitzki attempts a 3Pt. Contested by Jaren James (4.5 feet, MAN). Tyrese Nowitzki misses. Rebound secured by Cole Durant.

[07:48] Team_063 possession (Score: 30-45)
DeMar Banchero loses control! Ball rolls out of bounds! TURNOVER! (dead ball)

[07:36] Team_011 possession (Score: 30-45)
Russell Davis attempts a Midrange. Contested by Lamelo Ball (3.8 feet, MAN). Russell Davis misses. FOUL! Loose ball foul on Lamelo Ball during the rebound battle. [IN THE BONUS! 7 team fouls] Pau Towns to the line for 2 free throws. (Lamelo Ball: 1 personal fouls)   FT 1/2: MISS   FT 2/2: GOOD Pau Towns makes 1/2 from the line.
Score: 30-46

[07:20] Team_063 possession (Score: 30-46)
Jaren James loses the ball! Stripped by Tyrese Nowitzki! TURNOVER! (live ball)

[07:04] Team_011 possession (Score: 30-46)
Shai Leonard drives, Kyle Green stays with him. Shai Leonard attempts a Layup. Wide open! Kyle Green is 7.1 feet away. [ZONE] Shai Leonard misses. Rebound secured by Kyle Green.

[06:52] Team_063 possession (Score: 30-46)
Lamelo Ball attempts a Layup. Wide open! Russell Davis is 8.0 feet away. [MAN] LAMELO BALL MAKES IT! Assist: DeMar Banchero
Score: 32-46

[06:37] Team_011 possession (Score: 32-46)
Shai Leonard throws a bad pass! Stolen by DeMar Banchero! TURNOVER! (live ball)

[06:27] Team_063 possession (Score: 32-46)
Lamelo Ball drives to the basket... Lamelo Ball throws a bad pass out of bounds! TURNOVER! (dead ball)

[06:17] Team_011 possession (Score: 32-46)
Pau Towns drives, Kyle Green stays with him. Pau Towns attempts a Dunk. Heavily contested by Kyle Green (1.2 feet, ZONE)! PAU TOWNS MAKES IT!
Score: 32-48

[05:59] Team_063 possession (Score: 32-48)
Kyle Green loses control! Ball rolls out of bounds! TURNOVER! (dead ball)

[05:49] Team_011 possession (Score: 32-48)
De'Aaron George attempts a 3Pt. Contested by Cole Durant (4.2 feet, MAN). De'Aaron George misses. Rebound secured by Lamelo Ball.

[05:37] Team_063 possession (Score: 32-48)
Lamelo Ball attempts a 3Pt. Wide open! Shai Leonard is 7.5 feet away. [ZONE] Lamelo Ball misses. Rebound secured by Pau Towns.

[05:21] Team_011 possession (Score: 32-48)
Pau Towns makes the Layup and draws the foul on Kyle Green! And-1! Pau Towns to the line for 1. [BONUS: 8 team fouls] (Kyle Green: 1 personal fouls)   FT 1/1: GOOD Pau Towns makes 1/1 from the line.
Score: 32-51

[05:04] Team_063 possession (Score: 32-51)
Cole Durant attempts a 3Pt. Contested by De'Aaron George (3.9 feet, MAN). Cole Durant misses. Rebound secured by Pau Towns.

[04:51] Team_011 possession (Score: 32-51)
FOUL! Shooting foul on DeMar Banchero. Tyrese Nowitzki to the line for 3 free throws. [BONUS: 9 team fouls] (DeMar Banchero: 1 personal fouls)   FT 1/3: GOOD   FT 2/3: MISS   FT 3/3: GOOD Tyrese Nowitzki makes 2/3 from the line.
Score: 32-53

[04:35] Team_063 possession (Score: 32-53)
Lamelo Ball attempts a Layup. Contested by Russell Davis (3.6 feet, MAN). LAMELO BALL MAKES IT! Assist: Kyle Green
Score: 34-53

[04:17] Team_011 possession (Score: 34-53)
De'Aaron George drives to the basket... FOUL! Offensive foul on De'Aaron George! Kyle Green drew the charge! [Team fouls: 2] (De'Aaron George: 1 personal fouls) TURNOVER! (dead ball)

[04:03] Team_063 possession (Score: 34-53)
DeMar Banchero attempts a Midrange. Contested by De'Aaron George (4.4 feet, ZONE). DeMar Banchero misses. Rebound secured by Tyrese Nowitzki.

[03:49] Team_011 possession (Score: 34-53)
De'Aaron George attempts a 3Pt. Contested by DeMar Banchero (4.0 feet, ZONE). De'Aaron George misses. Offensive rebound by Pau Towns! Pau Towns kicks it out.

[03:39] Team_011 possession (Score: 34-53)
De'Aaron George attempts a Midrange. Heavily contested by Jaren James (0.5 feet, ZONE)! De'Aaron George misses. Rebound secured by Lamelo Ball.

[03:25] Team_063 possession (Score: 34-53)
Cole Durant attempts a Midrange. Contested by De'Aaron George (5.4 feet, MAN). Cole Durant misses. FOUL! Loose ball foul on Russell Davis during the rebound battle. [Team fouls: 3] No free throws, side out. (Russell Davis: 1 personal fouls)

[03:12] Team_063 possession (Score: 34-53)
Cole Durant throws a bad pass out of bounds! TURNOVER! (dead ball)

[02:57] Team_011 possession (Score: 34-53)
Shai Leonard drives and kicks out. Tyrese Nowitzki attempts a 3Pt. Contested by Lamelo Ball (3.9 feet, ZONE). Tyrese Nowitzki misses. Rebound secured by Lamelo Ball.

[02:42] Team_063 possession (Score: 34-53)
Lamelo Ball drives to the basket... Lamelo Ball throws a bad pass! Stolen by Russell Davis! TURNOVER! (live ball)

[02:27] Team_011 possession (Score: 34-53)
De'Aaron George attempts a 3Pt. Wide open! Cole Durant is 7.7 feet away. [MAN] De'Aaron George misses. Rebound secured by Cole Durant.

[02:10] Team_063 possession (Score: 34-53)
Cole Durant attempts a Layup. Wide open! De'Aaron George is 6.5 feet away. [MAN] COLE DURANT MAKES IT!
Score: 36-53

[01:54] Team_011 possession (Score: 36-53)
Shai Leonard drives, Kyle Green stays with him. Shai Leonard attempts a Layup. Contested by Kyle Green (4.0 feet, ZONE). Shai Leonard misses. Rebound secured by Kyle Green.

[01:40] Team_063 possession (Score: 36-53)
Kyle Green attempts a Layup. BLOCKED BY RUSSELL DAVIS! Ball deflects out of bounds off Kyle Green.

[01:28] Team_011 possession (Score: 36-53)
De'Aaron George drives and kicks out. Shai Leonard attempts a 3Pt. Contested by DeMar Banchero (2.1 feet, MAN). SHAI LEONARD MAKES IT! Assist: Tyrese Nowitzki
Score: 36-56

[01:18] Team_063 possession (Score: 36-56)
Lamelo Ball drives and kicks out. Lamelo Ball attempts a 3Pt. Contested by Russell Davis (3.5 feet, MAN). Lamelo Ball misses. Rebound secured by Tyrese Nowitzki.

[01:05] Team_011 possession (Score: 36-56)
Pau Towns drives, picks up Kyle Green. Help arrives from Cole Durant! Pau Towns attempts a Dunk. Wide open! Cole Durant is 6.3 feet away. [ZONE] PAU TOWNS MAKES IT! Assist: Russell Davis
Score: 36-58

[00:47] Team_063 possession (Score: 36-58)
DeMar Banchero attempts a 3Pt. Wide open! Shai Leonard is 6.7 feet away. [ZONE] DeMar Banchero misses. Rebound secured by Russell Davis.

[00:32] Team_011 possession (Score: 36-58)
De'Aaron George drives and kicks out. Tyrese Nowitzki attempts a 3Pt. Contested by Jaren James (3.4 feet, MAN). Tyrese Nowitzki misses. Offensive rebound by Russell Davis! Russell Davis kicks it out.

[00:17] Team_011 possession (Score: 36-58)
De'Aaron George attempts a 3Pt. Wide open! Cole Durant is 6.6 feet away. [ZONE] DE'AARON GEORGE MAKES IT! Assist: Russell Davis
Score: 36-61

[00:02] Team_063 possession (Score: 36-61)
Jaren James attempts a 3Pt. Heavily contested by Tyrese Nowitzki (1.7 feet, MAN)! Jaren James misses. Rebound secured by Russell Davis.

================================================================================
                              2ND QUARTER COMPLETE                              
================================================================================

2ND QUARTER SCORE: Team_063 9, Team_011 25

BOX SCORE:
================================================================================

Team_063
--------------------------------------------------------------------------------
Player                MIN  PTS  REB  AST  TO      FG   FG%      3P   3P%
--------------------------------------------------------------------------------
Lamelo Ball             9    4    4    0   0   2/4    50.0     0/0   0.0
Cole Durant             9    2    2    0   0   1/2    50.0     0/0   0.0
Dirk Reaves            15    0    1    0   0   0/1     0.0     0/0   0.0
Tyler Harris           15    0    2    0   0   0/0     0.0     0/0   0.0
Bradley Davis          15    0    0    0   0   0/1     0.0     0/0   0.0
Malcolm Quickley       15    0    0    0   0   0/1     0.0     0/0   0.0
Kyle Green              9    0    3    1   0   0/1     0.0     0/0   0.0
DeMar Banchero          9    0    0    1   0   0/3     0.0     0/0   0.0
Jaren James             9    0    0    0   0   0/2     0.0     0/0   0.0

TEAM: FG: 3/15 (20.0%), 3PT: 0/7 (0.0%), REB: 12 (1 off, 11 def), AST: 2, TO: 9
TEAM FOULS: 9 [Team_011 in BONUS]


Team_011
--------------------------------------------------------------------------------
Player                MIN  PTS  REB  AST  TO      FG   FG%      3P   3P%
--------------------------------------------------------------------------------
Pau Towns               9    8    5    0   0   4/4   100.0     0/0   0.0
De'Aaron George         9    6    0    0   0   2/6    33.3     0/0   0.0
Shai Leonard            9    3    0    0   0   1/4    25.0     0/0   0.0
Pau Barnes             15    2    2    0   0   1/1   100.0     0/0   0.0
Tyrese Nowitzki         9    2    2    1   0   1/2    50.0     0/0   0.0
Michael Carter         15    1    1    0   0   1/3    33.3     0/0   0.0
Magic Tatum            15    0    0    0   0   0/1     0.0     0/0   0.0
Evan George            15    0    1    0   0   0/0     0.0     0/0   0.0
Russell Davis           9    0    3    2   0   0/0     0.0     0/0   0.0

TEAM: FG: 10/21 (47.6%), 3PT: 2/7 (28.6%), REB: 14 (3 off, 11 def), AST: 3, TO: 2
TEAM FOULS: 3

================================================================================

================================================================================
                       3RD QUARTER - Team_063 vs Team_011                       
================================================================================

[12:00] Team_063 possession (Score: 36-61)
Terry Reaves attempts a Midrange. Contested by Michael Carter (2.9 feet, MAN). Terry Reaves misses. Offensive rebound by Tyler Harris! Tyler Harris puts it back in!
Score: 38-61

[11:42] Team_011 possession (Score: 38-61)
Michael Carter attempts a Midrange. Contested by Dirk Reaves (3.4 feet, ZONE). MICHAEL CARTER MAKES IT! Assist: Magic Tatum
Score: 38-63

[11:29] Team_063 possession (Score: 38-63)
Malcolm Quickley attempts a 3Pt. Heavily contested by Trae Tatum (1.3 feet, MAN)! Malcolm Quickley misses. Rebound secured by Evan George.

[11:18] Team_011 possession (Score: 38-63)
FOUL! Offensive foul on Trae Tatum! Malcolm Quickley drew the charge! [Team fouls: 1] (Trae Tatum: 1 personal fouls) TURNOVER! (dead ball)

[11:02] Team_063 possession (Score: 38-63)
Dirk Reaves attempts a Midrange. Contested by Michael Carter (4.8 feet, ZONE). DIRK REAVES MAKES IT! Assist: Tyler Harris
Score: 40-63

[10:50] Team_011 possession (Score: 40-63)
FOUL! Offensive foul on Magic Tatum! Bradley Davis drew the charge! [Team fouls: 2] (Magic Tatum: 1 personal fouls) TURNOVER! (dead ball)

[10:33] Team_063 possession (Score: 40-63)
Dirk Reaves makes the Dunk and draws the foul on Magic Tatum! And-1! Dirk Reaves to the line for 1. [Team fouls: 3] (Magic Tatum: 2 personal fouls)   FT 1/1: MISS Dirk Reaves makes 0/1 from the line. Rebound secured by Evan George.
Score: 42-63

[10:20] Team_011 possession (Score: 42-63)
Trae Tatum attempts a 3Pt. Heavily contested by Malcolm Quickley (0.5 feet, MAN)! Trae Tatum misses. Rebound secured by Malcolm Quickley.

[10:07] Team_063 possession (Score: 42-63)
Bradley Davis loses the ball! Stripped by Magic Tatum! TURNOVER! (live ball)

[09:47] Team_011 possession (Score: 42-63)
Pau Barnes attempts a 3Pt. Heavily contested by Malcolm Quickley (1.8 feet, ZONE)! Pau Barnes misses. Rebound secured by Dirk Reaves.

[09:34] Team_063 possession (Score: 42-63)
Tyler Harris attempts a Midrange. Contested by Pau Barnes (4.4 feet, MAN). Tyler Harris misses. Rebound secured by Evan George.

[09:21] Team_011 possession (Score: 42-63)
Evan George attempts a 3Pt. Wide open! Malcolm Quickley is 8.5 feet away. [ZONE] EVAN GEORGE MAKES IT! Assist: Magic Tatum
Score: 42-66

[09:02] Team_063 possession (Score: 42-66)
Malcolm Quickley attempts a 3Pt. Contested by Trae Tatum (4.8 feet, MAN). MALCOLM QUICKLEY MAKES IT!
Score: 45-66

[08:45] Team_011 possession (Score: 45-66)
Magic Tatum attempts a Layup. Contested by Tyler Harris (3.1 feet, ZONE). MAGIC TATUM MAKES IT!
Score: 45-68

[08:27] Team_063 possession (Score: 45-68)
FOUL! Shooting foul on Michael Carter. Terry Reaves to the line for 2 free throws. [Team fouls: 4] (Michael Carter: 1 personal fouls)   FT 1/2: MISS   FT 2/2: GOOD Terry Reaves makes 1/2 from the line.
Score: 46-68

[08:12] Team_011 possession (Score: 46-68)
Michael Carter attempts a Midrange. Wide open! Malcolm Quickley is 7.1 feet away. [ZONE] Michael Carter misses. Offensive rebound by Evan George! Evan George puts it back in!
Score: 46-70

[07:57] Team_063 possession (Score: 46-70)
Terry Reaves attempts a Midrange. Contested by Michael Carter (4.5 feet, MAN). TERRY REAVES MAKES IT!
Score: 48-70

[07:46] Team_011 possession (Score: 48-70)
Trae Tatum drives to the basket... Trae Tatum loses the ball! Stripped by Tyler Harris! TURNOVER! (live ball)

[07:36] Team_063 possession (Score: 48-70)
Tyler Harris drives and kicks out. Dirk Reaves attempts a 3Pt. Heavily contested by Pau Barnes (0.5 feet, MAN)! Dirk Reaves misses. Rebound secured by Michael Carter.

[07:25] Team_011 possession (Score: 48-70)
Trae Tatum drives to the basket... FOUL! Offensive foul on Trae Tatum! Tyler Harris drew the charge! [Team fouls: 5] (Trae Tatum: 2 personal fouls) TURNOVER! (dead ball)

[07:16] Team_063 possession (Score: 48-70)
Bradley Davis attempts a Midrange. Contested by Trae Tatum (4.9 feet, ZONE). BRADLEY DAVIS MAKES IT!
Score: 50-70

[07:02] Team_011 possession (Score: 50-70)
Evan George drives to the basket... Evan George loses control! Ball rolls out of bounds! TURNOVER! (dead ball)

[06:50] Team_063 possession (Score: 50-70)
Bradley Davis drives, picks up Magic Tatum. Help arrives from Michael Carter! Bradley Davis attempts a Layup. Contested by Michael Carter (4.6 feet, MAN). BRADLEY DAVIS MAKES IT! Assist: Dirk Reaves
Score: 52-70

[06:36] Team_011 possession (Score: 52-70)
Magic Tatum makes the Layup and draws the foul on Tyler Harris! And-1! Magic Tatum to the line for 1. [Team fouls: 1] (Tyler Harris: 1 personal fouls)   FT 1/1: GOOD Magic Tatum makes 1/1 from the line.
Score: 52-73

[06:22] Team_063 possession (Score: 52-73)
Dirk Reaves drives and kicks out. Bradley Davis attempts a Midrange. Contested by Magic Tatum (4.0 feet, MAN). Bradley Davis misses. Offensive rebound by Dirk Reaves! Dirk Reaves's putback is no good. Offensive rebound by Dirk Reaves! Dirk Reaves kicks it out.

[06:09] Team_063 possession (Score: 52-73)
Bradley Davis attempts a 3Pt. Heavily contested by Magic Tatum (1.1 feet, ZONE)! BRADLEY DAVIS MAKES IT! Assist: Dirk Reaves
Score: 55-73

[05:55] Team_011 possession (Score: 55-73)
Michael Carter attempts a Layup. Contested by Terry Reaves (5.5 feet, MAN). MICHAEL CARTER MAKES IT! Assist: Evan George
Score: 55-75

[05:43] Team_063 possession (Score: 55-75)
Terry Reaves attempts a Midrange. Contested by Trae Tatum (5.2 feet, ZONE). TERRY REAVES MAKES IT!
Score: 57-75

[05:28] Team_011 possession (Score: 57-75)
Trae Tatum drives to the basket... FOUL! Offensive foul on Trae Tatum! Malcolm Quickley drew the charge! [Team fouls: 7] (Trae Tatum: 3 personal fouls) TURNOVER! (dead ball)

[05:11] Team_063 possession (Score: 57-75)
Malcolm Quickley attempts a 3Pt. Contested by Trae Tatum (3.7 feet, MAN). MALCOLM QUICKLEY MAKES IT! Assist: Terry Reaves
Score: 60-75

[04:55] Team_011 possession (Score: 60-75)
Evan George drives and kicks out. Magic Tatum attempts a 3Pt. Contested by Bradley Davis (5.8 feet, MAN). MAGIC TATUM MAKES IT! Assist: Pau Barnes
Score: 60-78

[04:40] Team_063 possession (Score: 60-78)
Bradley Davis makes the Layup and draws the foul on Magic Tatum! And-1! Bradley Davis to the line for 1. [BONUS: 8 team fouls] (Magic Tatum: 3 personal fouls)   FT 1/1: GOOD Bradley Davis makes 1/1 from the line.
Score: 63-78

[04:27] Team_011 possession (Score: 63-78)
Evan George drives, Tyler Harris stays with him. Evan George attempts a Dunk. Contested by Tyler Harris (5.0 feet, ZONE). EVAN GEORGE MAKES IT! Assist: Michael Carter
Score: 63-80

[04:11] Team_063 possession (Score: 63-80)
Dirk Reaves drives, picks up Pau Barnes. Help arrives from Magic Tatum! Dirk Reaves attempts a Layup. Heavily contested by Magic Tatum (1.7 feet, ZONE)! DIRK REAVES MAKES IT! Assist: Tyler Harris
Score: 65-80

[03:56] Team_011 possession (Score: 65-80)
Trae Tatum throws a bad pass! Stolen by Malcolm Quickley! TURNOVER! (live ball)

[03:40] Team_063 possession (Score: 65-80)
Dirk Reaves attempts a 3Pt. Heavily contested by Pau Barnes (0.5 feet, ZONE)! Dirk Reaves misses. Offensive rebound by Tyler Harris! Tyler Harris's putback is no good. Offensive rebound by Tyler Harris! Tyler Harris kicks it out.

[03:24] Team_063 possession (Score: 65-80)
Bradley Davis attempts a Midrange. Heavily contested by Pau Barnes (0.5 feet, ZONE)! Bradley Davis misses. Rebound secured by Pau Barnes.

[03:13] Team_011 possession (Score: 65-80)
Pau Barnes throws a bad pass! Stolen by Dirk Reaves! TURNOVER! (live ball)

[03:02] Team_063 possession (Score: 65-80)
FOUL! Offensive foul on Terry Reaves! Michael Carter drew the charge! [Team fouls: 2] (Terry Reaves: 1 personal fouls) TURNOVER! (dead ball)

[02:45] Team_011 possession (Score: 65-80)
Evan George attempts a Midrange. Contested by Tyler Harris (4.4 feet, MAN). Evan George misses. Offensive rebound by Evan George! Evan George puts it back in!
Score: 65-82

[02:32] Team_063 possession (Score: 65-82)
Terry Reaves drives to the basket... FOUL! Offensive foul on Terry Reaves! Pau Barnes drew the charge! [Team fouls: 3] (Terry Reaves: 2 personal fouls) TURNOVER! (dead ball)

[02:17] Team_011 possession (Score: 65-82)
Trae Tatum attempts a 3Pt. Contested by Malcolm Quickley (5.8 feet, MAN). Trae Tatum misses. Rebound secured by Tyler Harris.

[02:06] Team_063 possession (Score: 65-82)
Terry Reaves drives to the basket... Terry Reaves loses control! Ball rolls out of bounds! TURNOVER! (dead ball)

[02:06] Substitution (Team_063): Bradley Davis OUT → DeMar Banchero IN (stamina_rule2)

[02:06] Substitution (Team_063): Malcolm Quickley OUT → Cole Durant IN (stamina_rule2)

[02:06] Substitution (Team_063): Terry Reaves OUT → Jaren James IN (stamina_rule2)

[02:06] Substitution (Team_063): Dirk Reaves OUT → Lamelo Ball IN (stamina_rule2)

[02:06] Substitution (Team_063): Tyler Harris OUT → Kyle Green IN (stamina_rule2)

[02:06] Substitution (Team_011): Magic Tatum OUT → Shai Leonard IN (stamina_rule2)

[02:06] Substitution (Team_011): Trae Tatum OUT → De'Aaron George IN (stamina_rule2)

[02:06] Substitution (Team_011): Michael Carter OUT → Tyrese Nowitzki IN (stamina_rule2)

[02:06] Substitution (Team_011): Pau Barnes OUT → Russell Davis IN (stamina_rule2)

[02:06] Substitution (Team_011): Evan George OUT → Pau Towns IN (stamina_rule2)

[01:53] Team_011 possession (Score: 65-82)
Pau Towns attempts a Layup. Contested by Kyle Green (3.1 feet, MAN). Pau Towns misses. Rebound secured by Kyle Green.

[01:40] Team_063 possession (Score: 65-82)
Kyle Green drives, Russell Davis stays with him. Kyle Green attempts a Dunk. Contested by Russell Davis (3.4 feet, ZONE). KYLE GREEN MAKES IT! Assist: Lamelo Ball
Score: 67-82

[01:24] Team_011 possession (Score: 67-82)
Tyrese Nowitzki attempts a 3Pt. Contested by Jaren James (3.3 feet, MAN). Tyrese Nowitzki misses. Rebound secured by Kyle Green.

[01:05] Team_063 possession (Score: 67-82)
DeMar Banchero drives to the basket... DeMar Banchero throws a bad pass out of bounds! TURNOVER! (dead ball)

[00:52] Team_011 possession (Score: 67-82)
Shai Leonard attempts a 3Pt. Contested by Lamelo Ball (5.4 feet, ZONE). SHAI LEONARD MAKES IT! Assist: Pau Towns
Score: 67-85

[00:37] Team_063 possession (Score: 67-85)
FOUL! Shooting foul on Shai Leonard. Lamelo Ball to the line for 2 free throws. [BONUS: 10 team fouls] (Shai Leonard: 1 personal fouls)   FT 1/2: GOOD   FT 2/2: GOOD Lamelo Ball makes 2/2 from the line.
Score: 69-85

[00:21] Team_011 possession (Score: 69-85)
FOUL! Holding foul on Kyle Green. [Team fouls: 4] No free throws, side out. (Kyle Green: 1 personal fouls)

[00:05] Team_011 possession (Score: 69-85)
Russell Davis attempts a Midrange. Heavily contested by Lamelo Ball (1.4 feet, MAN)! Russell Davis misses. Rebound secured by Lamelo Ball.

================================================================================
                              3RD QUARTER COMPLETE                              
================================================================================

3RD QUARTER SCORE: Team_063 33, Team_011 24

BOX SCORE:
================================================================================

Team_063
--------------------------------------------------------------------------------
Player                MIN  PTS  REB  AST  TO      FG   FG%      3P   3P%
--------------------------------------------------------------------------------
Bradley Davis          25   10    0    0   0   4/5    80.0     0/0   0.0
Malcolm Quickley       25    6    1    0   0   2/3    66.7     0/0   0.0
Terry Reaves           25    5    0    1   0   3/3   100.0     0/0   0.0
Dirk Reaves            25    4    2    2   0   2/3    66.7     0/0   0.0
Tyler Harris           25    2    3    2   0   1/3    33.3     0/0   0.0
Kyle Green             11    2    2    0   0   1/1   100.0     0/0   0.0
Lamelo Ball            11    2    1    1   0   1/1   100.0     0/0   0.0

TEAM: FG: 14/19 (73.7%), 3PT: 3/4 (75.0%), REB: 9 (3 off, 6 def), AST: 6, TO: 5
TEAM FOULS: 4


Team_011
--------------------------------------------------------------------------------
Player                MIN  PTS  REB  AST  TO      FG   FG%      3P   3P%
--------------------------------------------------------------------------------
Evan George            25    9    5    1   0   4/4   100.0     0/0   0.0
Magic Tatum            25    8    0    2   0   3/3   100.0     0/0   0.0
Michael Carter         25    4    1    1   0   2/2   100.0     0/0   0.0
Shai Leonard           11    3    0    0   0   1/1   100.0     0/0   0.0
Trae Tatum             25    0    0    0   0   0/2     0.0     0/0   0.0
Pau Barnes             25    0    1    1   0   0/1     0.0     0/0   0.0
Pau Towns              11    0    0    1   0   0/1     0.0     0/0   0.0
Tyrese Nowitzki        11    0    0    0   0   0/1     0.0     0/0   0.0
Russell Davis          11    0    0    0   0   0/1     0.0     0/0   0.0

TEAM: FG: 10/16 (62.5%), 3PT: 2/6 (33.3%), REB: 7 (2 off, 5 def), AST: 6, TO: 8
TEAM FOULS: 10 [Team_063 in BONUS]

================================================================================

================================================================================
                       4TH QUARTER - Team_063 vs Team_011                       
================================================================================

[12:00] Substitution (Team_063): Bradley Davis OUT (stamina: 78) → DeMar Banchero IN (comeback_detected)

[12:00] Substitution (Team_011): Magic Tatum OUT (stamina: 79) → Shai Leonard IN (comeback_detected)

[12:00] Team_063 possession (Score: 69-85)
Malcolm Quickley attempts a Layup. Contested by Trae Tatum (5.6 feet, MAN). MALCOLM QUICKLEY MAKES IT! Assist: Terry Reaves
Score: 71-85

[11:42] Team_011 possession (Score: 71-85)
FOUL! Shooting foul on Dirk Reaves. Pau Barnes to the line for 2 free throws. [Team fouls: 1] (Dirk Reaves: 1 personal fouls)   FT 1/2: GOOD   FT 2/2: GOOD Pau Barnes makes 2/2 from the line.
Score: 71-87

[11:27] Team_063 possession (Score: 71-87)
Malcolm Quickley attempts a Midrange. Contested by Pau Barnes (4.2 feet, ZONE). Malcolm Quickley misses. Offensive rebound by Tyler Harris! Tyler Harris puts it back in!
Score: 73-87

[11:15] Team_011 possession (Score: 73-87)
Trae Tatum drives, picks up Malcolm Quickley. Help arrives from DeMar Banchero! Trae Tatum attempts a Dunk. Contested by DeMar Banchero (3.2 feet, MAN). TRAE TATUM MAKES IT! Assist: Evan George
Score: 73-89

[11:05] Team_063 possession (Score: 73-89)
Tyler Harris attempts a Midrange. Heavily contested by Pau Barnes (1.3 feet, MAN)! Tyler Harris misses. Rebound secured by Michael Carter.

[10:53] Team_011 possession (Score: 73-89)
Michael Carter attempts a 3Pt. Contested by Terry Reaves (5.6 feet, MAN). Michael Carter misses. Offensive rebound by Pau Barnes! Pau Barnes's putback is no good. Rebound secured by Dirk Reaves.

[10:37] Team_063 possession (Score: 73-89)
Malcolm Quickley attempts a 3Pt. Wide open! Trae Tatum is 6.6 feet away. [MAN] Malcolm Quickley misses. Rebound secured by Michael Carter.

[10:22] Team_011 possession (Score: 73-89)
Pau Barnes drives to the basket... FOUL! Offensive foul on Pau Barnes! Dirk Reaves drew the charge! [Team fouls: 1] (Pau Barnes: 1 personal fouls) TURNOVER! (dead ball)

[10:08] Team_063 possession (Score: 73-89)
Malcolm Quickley attempts a 3Pt. Contested by Trae Tatum (5.6 feet, MAN). Malcolm Quickley misses. Rebound secured by Pau Barnes.

[09:52] Team_011 possession (Score: 73-89)
Pau Barnes attempts a Layup. Contested by Tyler Harris (4.1 feet, ZONE). PAU BARNES MAKES IT! Assist: Trae Tatum
Score: 73-91

[09:38] Team_063 possession (Score: 73-91)
Malcolm Quickley attempts a 3Pt. Contested by Trae Tatum (2.8 feet, MAN). MALCOLM QUICKLEY MAKES IT! Assist: Dirk Reaves
Score: 76-91

[09:24] Team_011 possession (Score: 76-91)
Trae Tatum throws a bad pass out of bounds! TURNOVER! (dead ball)

[09:24] Substitution (Team_063): Malcolm Quickley OUT → Cole Durant IN (stamina_rule2)

[09:24] Substitution (Team_063): Terry Reaves OUT → Jaren James IN (stamina_rule2)

[09:24] Substitution (Team_063): Dirk Reaves OUT → Lamelo Ball IN (stamina_rule2)

[09:24] Substitution (Team_063): Tyler Harris OUT → Kyle Green IN (stamina_rule2)

[09:24] Substitution (Team_011): Trae Tatum OUT → De'Aaron George IN (stamina_rule2)

[09:24] Substitution (Team_011): Michael Carter OUT → Tyrese Nowitzki IN (stamina_rule2)

[09:24] Substitution (Team_011): Pau Barnes OUT → Russell Davis IN (stamina_rule2)

[09:24] Substitution (Team_011): Evan George OUT → Pau Towns IN (stamina_rule2)

[09:10] Team_063 possession (Score: 76-91)
FOUL! Holding foul on De'Aaron George. [Team fouls: 2] No free throws, side out. (De'Aaron George: 1 personal fouls)

[08:55] Team_063 possession (Score: 76-91)
Kyle Green drives and kicks out. Jaren James attempts a Midrange. Contested by Shai Leonard (4.8 feet, ZONE). JAREN JAMES MAKES IT!
Score: 78-91

[08:43] Team_011 possession (Score: 78-91)
Shai Leonard makes the Layup and draws the foul on Jaren James! And-1! Shai Leonard to the line for 1. [Team fouls: 2] (Jaren James: 1 personal fouls)   FT 1/1: MISS Shai Leonard makes 0/1 from the line. Rebound secured by Lamelo Ball.
Score: 78-93

[08:26] Team_063 possession (Score: 78-93)
Lamelo Ball attempts a Midrange. Contested by Russell Davis (3.4 feet, MAN). LAMELO BALL MAKES IT!
Score: 80-93

[08:14] Team_011 possession (Score: 80-93)
Russell Davis attempts a 3Pt. Contested by Lamelo Ball (4.3 feet, MAN). Russell Davis misses. Rebound secured by Cole Durant.

[07:59] Team_063 possession (Score: 80-93)
Jaren James drives, Tyrese Nowitzki stays with him. Jaren James attempts a Dunk. Contested by Tyrese Nowitzki (4.0 feet, MAN). Jaren James misses. FOUL! Loose ball foul on Russell Davis during the rebound battle. [Team fouls: 3] No free throws, side out. (Russell Davis: 1 personal fouls)

[07:43] Team_063 possession (Score: 80-93)
FOUL! Holding foul on De'Aaron George. [Team fouls: 4] No free throws, side out. (De'Aaron George: 2 personal fouls)

[07:33] Team_063 possession (Score: 80-93)
DeMar Banchero makes the Layup and draws the foul on Shai Leonard! And-1! DeMar Banchero to the line for 1. [BONUS: 5 team fouls] (Shai Leonard: 1 personal fouls)   FT 1/1: GOOD DeMar Banchero makes 1/1 from the line.
Score: 83-93

[07:16] Team_011 possession (Score: 83-93)
Shai Leonard attempts a Midrange. Contested by Jaren James (2.8 feet, ZONE). Shai Leonard misses. Rebound secured by Lamelo Ball.

[07:00] Team_063 possession (Score: 83-93)
Jaren James attempts a Midrange. Wide open! De'Aaron George is 8.0 feet away. [ZONE] JAREN JAMES MAKES IT!
Score: 85-93

[06:47] Team_011 possession (Score: 85-93)
FOUL! Reach-in foul on Jaren James during the drive. [Team fouls: 3] No free throws, side out. (Jaren James: 2 personal fouls)

[06:36] Team_011 possession (Score: 85-93)
Tyrese Nowitzki attempts a Midrange. Contested by Jaren James (4.0 feet, MAN). Tyrese Nowitzki misses. Rebound secured by Lamelo Ball.

[06:19] Team_063 possession (Score: 85-93)
Jaren James attempts a 3Pt. Wide open! Shai Leonard is 6.3 feet away. [ZONE] Jaren James misses. Rebound secured by Tyrese Nowitzki.

[06:06] Team_011 possession (Score: 85-93)
Pau Towns attempts a 3Pt. Contested by DeMar Banchero (4.2 feet, ZONE). Pau Towns misses. Rebound secured by Kyle Green.

[05:49] Team_063 possession (Score: 85-93)
Cole Durant attempts a 3Pt. Contested by De'Aaron George (2.5 feet, MAN). Cole Durant misses. Rebound secured by Tyrese Nowitzki.

[05:35] Team_011 possession (Score: 85-93)
Shai Leonard attempts a 3Pt. Contested by DeMar Banchero (3.0 feet, MAN). SHAI LEONARD MAKES IT! Assist: Tyrese Nowitzki
Score: 85-96

[05:22] Team_063 possession (Score: 85-96)
Lamelo Ball attempts a Midrange. Contested by De'Aaron George (3.7 feet, ZONE). Lamelo Ball misses. FOUL! Loose ball foul on Pau Towns during the rebound battle. [IN THE BONUS! 6 team fouls] Kyle Green to the line for 2 free throws. (Pau Towns: 1 personal fouls)   FT 1/2: MISS   FT 2/2: GOOD Kyle Green makes 1/2 from the line.
Score: 86-96

[05:10] Team_011 possession (Score: 86-96)
Russell Davis drives to the basket... Russell Davis commits a violation (traveling/carry)! TURNOVER! (dead ball)

[04:54] Team_063 possession (Score: 86-96)
Cole Durant attempts a Midrange. Wide open! De'Aaron George is 6.1 feet away. [MAN] Cole Durant misses. Rebound secured by Russell Davis.

[04:39] Team_011 possession (Score: 86-96)
Russell Davis drives to the basket... Russell Davis throws a bad pass! Stolen by Kyle Green! TURNOVER! (live ball)

[04:23] Team_063 possession (Score: 86-96)
Kyle Green attempts a Layup. Contested by Russell Davis (6.0 feet, ZONE). KYLE GREEN MAKES IT! Assist: Lamelo Ball
Score: 88-96

[04:06] Team_011 possession (Score: 88-96)
Pau Towns attempts a Midrange. Wide open! Lamelo Ball is 8.2 feet away. [ZONE] Pau Towns misses. Rebound secured by Lamelo Ball.

[03:52] Team_063 possession (Score: 88-96)
Jaren James drives to the basket... Jaren James commits a violation (traveling/carry)! TURNOVER! (dead ball)

[03:37] Team_011 possession (Score: 88-96)
Tyrese Nowitzki drives and kicks out. Tyrese Nowitzki attempts a 3Pt. Contested by Jaren James (2.3 feet, MAN). Tyrese Nowitzki misses. Rebound secured by Lamelo Ball.

[03:21] Team_063 possession (Score: 88-96)
Jaren James attempts a 3Pt. Wide open! Shai Leonard is 6.7 feet away. [ZONE] JAREN JAMES MAKES IT! Assist: Lamelo Ball
Score: 91-96

[03:08] Team_011 possession (Score: 91-96)
De'Aaron George drives, Kyle Green stays with him. De'Aaron George attempts a Dunk. Contested by Kyle Green (3.5 feet, ZONE). DE'AARON GEORGE MAKES IT!
Score: 91-98

[02:53] Team_063 possession (Score: 91-98)
DeMar Banchero attempts a 3Pt. Wide open! Shai Leonard is 7.1 feet away. [ZONE] DeMar Banchero misses. Offensive rebound by Kyle Green! Kyle Green puts it back in!
Score: 93-98

[02:43] Team_011 possession (Score: 93-98)
FOUL! Reach-in foul on Lamelo Ball during the drive. [Team fouls: 4] No free throws, side out. (Lamelo Ball: 1 personal fouls)

[02:33] Team_011 possession (Score: 93-98)
De'Aaron George drives, Cole Durant stays with him. De'Aaron George attempts a Layup. Contested by Cole Durant (5.6 feet, MAN). DE'AARON GEORGE MAKES IT! Assist: Tyrese Nowitzki
Score: 93-100

[02:18] Team_063 possession (Score: 93-100)
Lamelo Ball drives, picks up Russell Davis. Help arrives from De'Aaron George! Lamelo Ball attempts a Dunk. Wide open! De'Aaron George is 6.2 feet away. [MAN] LAMELO BALL MAKES IT! Assist: Jaren James
Score: 95-100

[02:07] Team_011 possession (Score: 95-100)
Russell Davis attempts a 3Pt. Contested by Jaren James (3.7 feet, ZONE). Russell Davis misses. Rebound secured by Kyle Green.

[01:52] Team_063 possession (Score: 95-100)
Cole Durant drives and kicks out. Kyle Green attempts a Midrange. Contested by Tyrese Nowitzki (3.2 feet, ZONE). Kyle Green misses. Offensive rebound by Kyle Green! Kyle Green puts it back in!
Score: 97-100

[01:41] Team_011 possession (Score: 97-100)
Shai Leonard attempts a 3Pt. Contested by DeMar Banchero (4.9 feet, ZONE). Shai Leonard misses. Rebound secured by Kyle Green.

[01:26] Team_063 possession (Score: 97-100)
Kyle Green throws a bad pass out of bounds! TURNOVER! (dead ball)

[01:26] Substitution (Team_063): DeMar Banchero OUT → Bradley Davis IN (starter_return_rule1)

[01:26] Substitution (Team_011): Shai Leonard OUT → Magic Tatum IN (starter_return_rule1)

[01:16] Team_011 possession (Score: 97-100)
Russell Davis drives, Kyle Green stays with him. Russell Davis attempts a Layup. Contested by Kyle Green (4.1 feet, ZONE). RUSSELL DAVIS MAKES IT!
Score: 97-102

[01:01] Team_063 possession (Score: 97-102)
Bradley Davis attempts a 3Pt. Heavily contested by Magic Tatum (1.2 feet, MAN)! BRADLEY DAVIS MAKES IT! Assist: Cole Durant
Score: 100-102

[00:44] Team_011 possession (Score: 100-102)
Magic Tatum attempts a 3Pt. Contested by Bradley Davis (4.2 feet, MAN). MAGIC TATUM MAKES IT! Assist: Tyrese Nowitzki
Score: 100-105

[00:30] Team_063 possession (Score: 100-105)
FOUL! Shooting foul on Magic Tatum. Bradley Davis to the line for 2 free throws. [BONUS: 7 team fouls] (Magic Tatum: 1 personal fouls)   FT 1/2: MISS   FT 2/2: GOOD Bradley Davis makes 1/2 from the line.
Score: 101-105

[00:16] Team_011 possession (Score: 101-105)
De'Aaron George attempts a Midrange. Wide open! Cole Durant is 7.5 feet away. [MAN] DE'AARON GEORGE MAKES IT! Assist: Magic Tatum
Score: 101-107

[00:01] Team_063 possession (Score: 101-107)
Jaren James attempts a 3Pt. Heavily contested by Magic Tatum (0.8 feet, ZONE)! Jaren James misses. Rebound secured by Pau Towns.

================================================================================
                              4TH QUARTER COMPLETE                              
================================================================================

4TH QUARTER SCORE: Team_063 32, Team_011 22

BOX SCORE:
================================================================================

Team_063
--------------------------------------------------------------------------------
Player                MIN  PTS  REB  AST  TO      FG   FG%      3P   3P%
--------------------------------------------------------------------------------
Jaren James            20    7    0    1   0   3/5    60.0     0/0   0.0
Kyle Green             20    7    6    0   0   4/4   100.0     0/0   0.0
Malcolm Quickley       28    5    0    0   0   2/4    50.0     0/0   0.0
Lamelo Ball            20    4    5    2   0   2/2   100.0     0/0   0.0
Bradley Davis          27    4    0    0   0   2/2   100.0     0/0   0.0
DeMar Banchero         22    3    0    0   0   1/1   100.0     0/0   0.0
Tyler Harris           28    2    1    0   0   1/2    50.0     0/0   0.0
Terry Reaves           28    0    0    1   0   0/0     0.0     0/0   0.0
Dirk Reaves            28    0    1    1   0   0/0     0.0     0/0   0.0
Cole Durant            20    0    1    1   0   0/2     0.0     0/0   0.0

TEAM: FG: 15/22 (68.2%), 3PT: 4/9 (44.4%), REB: 13 (4 off, 9 def), AST: 6, TO: 2
TEAM FOULS: 4


Team_011
--------------------------------------------------------------------------------
Player                MIN  PTS  REB  AST  TO      FG   FG%      3P   3P%
--------------------------------------------------------------------------------
De'Aaron George        20    6    0    0   0   3/3   100.0     0/0   0.0
Pau Barnes             28    4    1    0   0   2/2   100.0     0/0   0.0
Shai Leonard           22    3    0    0   0   1/4    25.0     0/0   0.0
Magic Tatum            27    3    0    1   0   1/1   100.0     0/0   0.0
Trae Tatum             28    2    0    1   0   1/1   100.0     0/0   0.0
Russell Davis          20    2    1    0   0   1/3    33.3     0/0   0.0
Evan George            28    0    0    1   0   0/0     0.0     0/0   0.0
Michael Carter         28    0    2    0   0   0/1     0.0     0/0   0.0
Tyrese Nowitzki        20    0    2    3   0   0/2     0.0     0/0   0.0
Pau Towns              20    0    1    0   0   0/2     0.0     0/0   0.0

TEAM: FG: 9/19 (47.4%), 3PT: 2/7 (28.6%), REB: 8 (1 off, 7 def), AST: 6, TO: 4
TEAM FOULS: 7 [Team_063 in BONUS]

================================================================================

================================================================================
                               FULL GAME COMPLETE                               
================================================================================

FINAL SCORE: Team_063 101, Team_011 107

SCORING BY QUARTER:
--------------------------------------------------------------------------------
Team                     Q1     Q2     Q3     Q4    FINAL
--------------------------------------------------------------------------------
Team_063                 27      9     33     32      101
Team_011                 36     25     24     22      107
--------------------------------------------------------------------------------

FULL GAME BOX SCORE:
================================================================================

Team_063
--------------------------------------------------------------------------------
Player                MIN  PTS  REB  AST  TO      FG   FG%      3P   3P%      FT STL BLK
--------------------------------------------------------------------------------
Malcolm Quickley       28   14    3    0   3   7/14   50.0   4/10   40.0   1/1     1   1
Terry Reaves           28    7    0    2   5   5/7    71.4   0/0     0.0   3/4     0   0
Dirk Reaves            28   11    7    5   1   5/8    62.5   0/1     0.0   1/2     1   0
Tyler Harris           28   15   12    2   0   3/6    50.0   0/0     0.0   1/2     1   2
Bradley Davis          27   17    0    0   1   8/13   61.5   3/7    42.9   4/6     0   0
DeMar Banchero         22    3    0    1   1   2/5    40.0   1/2    50.0   1/1     1   0
Cole Durant            20    2    3    1   1   2/5    40.0   0/2     0.0   0/0     0   0
Jaren James            20    7    0    1   2   2/6    33.3   1/5    20.0   0/1     0   0
Lamelo Ball            20   10   10    3   2   6/8    75.0   0/1     0.0   2/2     0   0
Kyle Green             20    9   11    1   3   3/4    75.0   0/0     0.0   1/2     1   0

TEAM: FG: 44/77 (57.1%), 3PT: 9/28 (32.1%), REB: 48 (16 off, 32 def), AST: 16, TO: 19


Team_011
--------------------------------------------------------------------------------
Player                MIN  PTS  REB  AST  TO      FG   FG%      3P   3P%      FT STL BLK
--------------------------------------------------------------------------------
Trae Tatum             28    4    0    1   3   3/8    37.5   1/3    33.3   2/3     0   0
Michael Carter         28   14    9    5   0   8/11   72.7   2/3    66.7   3/4     1   0
Pau Barnes             28   13    7    2   3   4/6    66.7   0/1     0.0   2/3     2   1
Evan George            28   16   11    2   3   6/7    85.7   3/3   100.0   0/0     0   0
Magic Tatum            27   20    0    4   4   7/9    77.8   2/3    66.7   1/2     1   0
Shai Leonard           22    9    0    0   2   2/8    25.0   2/3    66.7   0/1     0   0
De'Aaron George        20   12    0    0   1   6/10   60.0   1/4    25.0   1/1     0   0
Tyrese Nowitzki        20    2    4    4   0   1/5    20.0   1/3    33.3   2/3     1   0
Russell Davis          20    2    4    2   1   2/5    40.0   0/2     0.0   0/0     1   1
Pau Towns              20    8    6    1   0   3/6    50.0   0/1     0.0   2/3     0   0

TEAM: FG: 43/76 (56.6%), 3PT: 12/26 (46.2%), REB: 39 (10 off, 29 def), AST: 21, TO: 17

================================================================================
