================================================================================
                        FULL GAME - Team_068 vs Team_071                        
================================================================================

================================================================================
                       1ST QUARTER - Team_068 vs Team_071                       
================================================================================

[12:00] Team_068 possession (Score: 0-0)
FOUL! Reach-in foul on Dejounte Paul during the drive. [Team fouls: 1] No free throws, side out. (Dejounte Paul: 1 personal fouls)

[11:49] Team_068 possession (Score: 0-0)
Zion Anunoby attempts a Midrange. Contested by Allen Williamson (4.2 feet, MAN). Zion Anunoby misses. Offensive rebound by Jaren Johnson! Jaren Johnson kicks it out.

[11:37] Team_068 possession (Score: 0-0)
Nikola Ginobili drives and kicks out. Malcolm Herro attempts a 3Pt. Wide open! Victor Anunoby is 6.5 feet away. [ZONE] Malcolm Herro misses. Rebound secured by Bam Iverson.

[11:21] Team_071 possession (Score: 0-0)
Bam Iverson drives and kicks out. Allen Williamson attempts a Midrange. Contested by Gary Simons (5.8 feet, ZONE). Allen Williamson misses. Rebound secured by Jaren Johnson.

[11:04] Team_068 possession (Score: 0-0)
Zion Anunoby attempts a Midrange. Contested by Allen Williamson (3.6 feet, MAN). ZION ANUNOBY MAKES IT!
Score: 2-0

[10:46] Team_071 possession (Score: 2-0)
Jimmy Simons drives and kicks out. Victor Anunoby attempts a 3Pt. Contested by Zion Anunoby (3.6 feet, ZONE). Victor Anunoby misses. Rebound secured by Nikola Ginobili.

[10:33] Team_068 possession (Score: 2-0)
Jaren Johnson attempts a 3Pt. Wide open! Bam Iverson is 7.4 feet away. [MAN] JAREN JOHNSON MAKES IT! Assist: Nikola Ginobili
Score: 5-0

[10:21] Team_071 possession (Score: 5-0)
Dejounte Paul drives to the basket... Dejounte Paul loses control! Ball rolls out of bounds! TURNOVER! (dead ball)

[10:08] Team_068 possession (Score: 5-0)
Gary Simons attempts a Midrange. Contested by Jimmy Simons (4.4 feet, MAN). GARY SIMONS MAKES IT!
Score: 7-0

[09:50] Team_071 possession (Score: 7-0)
Dejounte Paul makes the Layup and draws the foul on Gary Simons! And-1! Dejounte Paul to the line for 1. [Team fouls: 1] (Gary Simons: 1 personal fouls)   FT 1/1: GOOD Dejounte Paul makes 1/1 from the line.
Score: 7-3

[09:37] Team_068 possession (Score: 7-3)
Malcolm Herro makes the Layup and draws the foul on Dejounte Paul! And-1! Malcolm Herro to the line for 1. [Team fouls: 2] (Dejounte Paul: 2 personal fouls)   FT 1/1: GOOD Malcolm Herro makes 1/1 from the line.
Score: 10-3

[09:20] Team_071 possession (Score: 10-3)
Dejounte Paul attempts a 3Pt. Contested by Nikola Ginobili (4.5 feet, MAN). Dejounte Paul misses. Rebound secured by Jaren Johnson.

[09:09] Team_068 possession (Score: 10-3)
FOUL! Holding foul on Victor Anunoby. [Team fouls: 3] No free throws, side out. (Victor Anunoby: 1 personal fouls)

[08:53] Team_068 possession (Score: 10-3)
FOUL! Shooting foul on Allen Williamson. Zion Anunoby to the line for 2 free throws. [Team fouls: 4] (Allen Williamson: 1 personal fouls)   FT 1/2: GOOD   FT 2/2: GOOD Zion Anunoby makes 2/2 from the line.
Score: 12-3

[08:39] Team_071 possession (Score: 12-3)
Bam Iverson attempts a Midrange. Contested by Gary Simons (2.2 feet, ZONE). Bam Iverson misses. Rebound secured by Jaren Johnson.

[08:22] Team_068 possession (Score: 12-3)
Malcolm Herro attempts a 3Pt. Wide open! Victor Anunoby is 6.3 feet away. [MAN] MALCOLM HERRO MAKES IT! Assist: Nikola Ginobili
Score: 15-3

[08:08] Team_071 possession (Score: 15-3)
Jimmy Simons attempts a Layup. Contested by Nikola Ginobili (2.8 feet, ZONE). Jimmy Simons misses. Rebound secured by Gary Simons.

[07:53] Team_068 possession (Score: 15-3)
Jaren Johnson makes the Layup and draws the foul on Bam Iverson! And-1! Jaren Johnson to the line for 1. [BONUS: 5 team fouls] (Bam Iverson: 1 personal fouls)   FT 1/1: GOOD Jaren Johnson makes 1/1 from the line.
Score: 18-3

[07:37] Team_071 possession (Score: 18-3)
Allen Williamson attempts a 3Pt. Wide open! Zion Anunoby is 7.3 feet away. [ZONE] Allen Williamson misses. Rebound secured by Jaren Johnson.

[07:26] Team_068 possession (Score: 18-3)
Nikola Ginobili drives to the basket... Nikola Ginobili throws a bad pass! Stolen by Dejounte Paul! TURNOVER! (live ball)

[07:14] Team_071 possession (Score: 18-3)
Allen Williamson attempts a 3Pt. Contested by Zion Anunoby (4.0 feet, ZONE). ALLEN WILLIAMSON MAKES IT! Assist: Dejounte Paul
Score: 18-6

[07:00] Team_068 possession (Score: 18-6)
Malcolm Herro makes the Layup and draws the foul on Victor Anunoby! And-1! Malcolm Herro to the line for 1. [BONUS: 6 team fouls] (Victor Anunoby: 2 personal fouls)   FT 1/1: MISS Malcolm Herro makes 0/1 from the line. Offensive rebound by Jaren Johnson! Jaren Johnson kicks it out.
Score: 20-6

[06:46] Team_068 possession (Score: 20-6)
Gary Simons drives and kicks out. Nikola Ginobili attempts a Midrange. Contested by Jimmy Simons (2.0 feet, ZONE). Nikola Ginobili misses. Rebound secured by Bam Iverson.

[06:33] Team_071 possession (Score: 20-6)
Dejounte Paul drives and kicks out. Victor Anunoby attempts a 3Pt. Contested by Malcolm Herro (3.7 feet, MAN). Victor Anunoby misses. Rebound secured by Jaren Johnson.

[06:19] Team_068 possession (Score: 20-6)
Malcolm Herro drives to the basket... Malcolm Herro throws a bad pass! Stolen by Victor Anunoby! TURNOVER! (live ball)

[06:05] Team_071 possession (Score: 20-6)
Bam Iverson attempts a 3Pt. Heavily contested by Zion Anunoby (1.6 feet, ZONE)! BAM IVERSON MAKES IT! Assist: Jimmy Simons
Score: 20-9

[05:47] Team_068 possession (Score: 20-9)
FOUL! Shooting foul on Dejounte Paul. Jaren Johnson to the line for 2 free throws. [BONUS: 7 team fouls] (Dejounte Paul: 3 personal fouls)   FT 1/2: MISS   FT 2/2: GOOD Jaren Johnson makes 1/2 from the line.
Score: 21-9

[05:34] Team_071 possession (Score: 21-9)
Dejounte Paul attempts a Layup. Wide open! Gary Simons is 7.3 feet away. [ZONE] DEJOUNTE PAUL MAKES IT!
Score: 21-11

[05:22] Team_068 possession (Score: 21-11)
Nikola Ginobili drives, Dejounte Paul stays with him. Nikola Ginobili attempts a Dunk. Contested by Dejounte Paul (3.8 feet, MAN). NIKOLA GINOBILI MAKES IT! Assist: Jaren Johnson
Score: 23-11

[05:11] Team_071 possession (Score: 23-11)
Allen Williamson attempts a Midrange. Contested by Gary Simons (3.0 feet, ZONE). Allen Williamson misses. Rebound secured by Jaren Johnson.

[04:58] Team_068 possession (Score: 23-11)
Jaren Johnson drives and kicks out. Zion Anunoby attempts a Midrange. Wide open! Allen Williamson is 6.6 feet away. [MAN] Zion Anunoby misses. Rebound secured by Jimmy Simons.

[04:45] Team_071 possession (Score: 23-11)
Victor Anunoby attempts a Midrange. Wide open! Malcolm Herro is 6.3 feet away. [ZONE] Victor Anunoby misses. FOUL! Loose ball foul on Gary Simons during the rebound battle. [Team fouls: 2] No free throws, side out. (Gary Simons: 2 personal fouls)

[04:27] Team_071 possession (Score: 23-11)
Dejounte Paul attempts a 3Pt. Contested by Zion Anunoby (2.7 feet, ZONE). DEJOUNTE PAUL MAKES IT! Assist: Jimmy Simons
Score: 23-14

[04:11] Team_068 possession (Score: 23-14)
FOUL! Reach-in foul on Bam Iverson during the drive. [IN THE BONUS! 8 team fouls] Jaren Johnson to the line for 2 free throws. (Bam Iverson: 2 personal fouls)   FT 1/2: MISS   FT 2/2: GOOD Jaren Johnson makes 1/2 from the line.
Score: 24-14

[03:57] Team_071 possession (Score: 24-14)
Bam Iverson attempts a Layup. BLOCKED BY MALCOLM HERRO! Ball is loose! Rebound secured by Nikola Ginobili.

[03:45] Team_068 possession (Score: 24-14)
Nikola Ginobili attempts a Layup. Contested by Dejounte Paul (3.3 feet, MAN). NIKOLA GINOBILI MAKES IT! Assist: Zion Anunoby
Score: 26-14

[03:31] Team_071 possession (Score: 26-14)
Dejounte Paul drives, Nikola Ginobili stays with him. Dejounte Paul attempts a Layup. Contested by Nikola Ginobili (2.5 feet, MAN). DEJOUNTE PAUL MAKES IT!
Score: 26-16

[03:16] Team_068 possession (Score: 26-16)
Jaren Johnson attempts a Layup. Contested by Dejounte Paul (3.3 feet, ZONE). JAREN JOHNSON MAKES IT!
Score: 28-16

[03:05] Team_071 possession (Score: 28-16)
Bam Iverson drives, Jaren Johnson stays with him. Bam Iverson attempts a Layup. Contested by Jaren Johnson (5.7 feet, MAN). BAM IVERSON MAKES IT! Assist: Allen Williamson
Score: 28-18

[02:49] Team_068 possession (Score: 28-18)
Zion Anunoby attempts a Midrange. Contested by Allen Williamson (5.4 feet, MAN). Zion Anunoby misses. Rebound secured by Bam Iverson.

[02:34] Team_071 possession (Score: 28-18)
Dejounte Paul attempts a Midrange. Contested by Malcolm Herro (3.6 feet, ZONE). DEJOUNTE PAUL MAKES IT!
Score: 28-20

[02:17] Team_068 possession (Score: 28-20)
Gary Simons attempts a Layup. Contested by Jimmy Simons (3.5 feet, MAN). GARY SIMONS MAKES IT!
Score: 30-20

[02:03] Team_071 possession (Score: 30-20)
Allen Williamson attempts a 3Pt. Contested by Zion Anunoby (4.8 feet, MAN). Allen Williamson misses. Offensive rebound by Dejounte Paul! Dejounte Paul kicks it out.

[01:47] Team_071 possession (Score: 30-20)
Jimmy Simons attempts a Layup. Contested by Gary Simons (4.9 feet, MAN). Jimmy Simons misses. Rebound secured by Jaren Johnson.

[01:29] Team_068 possession (Score: 30-20)
FOUL! Reach-in foul on Dejounte Paul during the drive. [IN THE BONUS! 9 team fouls] Zion Anunoby to the line for 2 free throws. (Dejounte Paul: 4 personal fouls)   FT 1/2: MISS   FT 2/2: GOOD Zion Anunoby makes 1/2 from the line.
Score: 31-20

[01:12] Team_071 possession (Score: 31-20)
Bam Iverson attempts a Midrange. Heavily contested by Jaren Johnson (0.5 feet, MAN)! BAM IVERSON MAKES IT!
Score: 31-22

[00:55] Team_068 possession (Score: 31-22)
Gary Simons drives and kicks out. Zion Anunoby attempts a Midrange. Contested by Allen Williamson (3.9 feet, MAN). ZION ANUNOBY MAKES IT! Assist: Gary Simons
Score: 33-22

[00:43] Team_071 possession (Score: 33-22)
Victor Anunoby attempts a 3Pt. Wide open! Malcolm Herro is 8.2 feet away. [MAN] VICTOR ANUNOBY MAKES IT! Assist: Allen Williamson
Score: 33-25

[00:28] Team_068 possession (Score: 33-25)
Malcolm Herro attempts a Layup. Wide open! Victor Anunoby is 8.6 feet away. [MAN] MALCOLM HERRO MAKES IT! Assist: Jaren Johnson
Score: 35-25

[00:15] Team_071 possession (Score: 35-25)
Allen Williamson drives, Gary Simons stays with him. Allen Williamson attempts a Dunk. Heavily contested by Gary Simons (1.7 feet, ZONE)! Allen Williamson misses. Rebound secured by Gary Simons.

[00:03] Team_068 possession (Score: 35-25)
Gary Simons drives and kicks out. Gary Simons attempts a 3Pt. Contested by Victor Anunoby (5.0 feet, ZONE). Gary Simons misses. Rebound secured by Jimmy Simons.

================================================================================
                              1ST QUARTER COMPLETE                              
================================================================================

1ST QUARTER SCORE: Team_068 35, Team_071 25

BOX SCORE:
================================================================================

Team_068
--------------------------------------------------------------------------------
Player                MIN  PTS  REB  AST  TO      FG   FG%      3P   3P%
--------------------------------------------------------------------------------
Jaren Johnson          12   10    9    2   0   5/6    83.3     0/0   0.0
Malcolm Herro          12    8    0    0   0   3/3   100.0     0/0   0.0
Zion Anunoby           12    7    0    1   0   4/5    80.0     0/0   0.0
Nikola Ginobili        12    4    2    2   0   2/3    66.7     0/0   0.0
Gary Simons            12    4    2    1   0   2/4    50.0     0/0   0.0

TEAM: FG: 16/21 (76.2%), 3PT: 2/2 (100.0%), REB: 13 (2 off, 11 def), AST: 6, TO: 2
TEAM FOULS: 2


Team_071
--------------------------------------------------------------------------------
Player                MIN  PTS  REB  AST  TO      FG   FG%      3P   3P%
--------------------------------------------------------------------------------
Dejounte Paul          12   12    2    1   0   5/7    71.4     0/0   0.0
Bam Iverson            12    7    3    0   0   3/6    50.0     0/0   0.0
Allen Williamson       12    3    0    2   0   1/4    25.0     0/0   0.0
Victor Anunoby         12    3    0    0   0   1/1   100.0     0/0   0.0
Jimmy Simons           12    0    2    2   0   0/3     0.0     0/0   0.0

TEAM: FG: 10/21 (47.6%), 3PT: 4/6 (66.7%), REB: 7 (2 off, 5 def), AST: 5, TO: 1
TEAM FOULS: 9 [Team_068 in BONUS]

================================================================================

================================================================================
                       2ND QUARTER - Team_068 vs Team_071                       
================================================================================

[12:00] Team_068 possession (Score: 35-25)
Zion Anunoby attempts a 3Pt. Contested by Victor Anunoby (3.6 feet, ZONE). Zion Anunoby misses. Rebound secured by Jimmy Simons.

[11:42] Team_071 possession (Score: 35-25)
FOUL! Shooting foul on Nikola Ginobili. Dejounte Paul to the line for 2 free throws. [Team fouls: 1] (Nikola Ginobili: 1 personal fouls)   FT 1/2: GOOD   FT 2/2: GOOD Dejounte Paul makes 2/2 from the line.
Score: 35-27

[11:28] Team_068 possession (Score: 35-27)
Gary Simons attempts a Midrange. Contested by Allen Williamson (2.0 feet, ZONE). GARY SIMONS MAKES IT!
Score: 37-27

[11:18] Team_071 possession (Score: 37-27)
Bam Iverson attempts a Midrange. Contested by Jaren Johnson (3.5 feet, MAN). BAM IVERSON MAKES IT!
Score: 37-29

[11:01] Team_068 possession (Score: 37-29)
Zion Anunoby attempts a Layup. Wide open! Allen Williamson is 6.7 feet away. [MAN] ZION ANUNOBY MAKES IT!
Score: 39-29

[10:43] Team_071 possession (Score: 39-29)
FOUL! Shooting foul on Gary Simons. Jimmy Simons to the line for 2 free throws. [Team fouls: 2] (Gary Simons: 1 personal fouls)   FT 1/2: GOOD   FT 2/2: GOOD Jimmy Simons makes 2/2 from the line.
Score: 39-31

[10:26] Team_068 possession (Score: 39-31)
Nikola Ginobili attempts a 3Pt. Wide open! Dejounte Paul is 6.7 feet away. [MAN] Nikola Ginobili misses. Rebound secured by Jimmy Simons.

[10:10] Team_071 possession (Score: 39-31)
Dejounte Paul attempts a Midrange. Contested by Gary Simons (4.4 feet, ZONE). Dejounte Paul misses. Rebound secured by Nikola Ginobili.

[09:54] Team_068 possession (Score: 39-31)
Malcolm Herro attempts a 3Pt. Contested by Victor Anunoby (4.1 feet, MAN). Malcolm Herro misses. Rebound secured by Jimmy Simons.

[09:42] Team_071 possession (Score: 39-31)
Jimmy Simons attempts a Midrange. Contested by Gary Simons (5.5 feet, ZONE). JIMMY SIMONS MAKES IT!
Score: 39-33

[09:27] Team_068 possession (Score: 39-33)
Jaren Johnson attempts a 3Pt. Contested by Bam Iverson (5.1 feet, MAN). JAREN JOHNSON MAKES IT! Assist: Gary Simons
Score: 42-33

[09:12] Team_071 possession (Score: 42-33)
Allen Williamson attempts a 3Pt. Contested by Zion Anunoby (5.5 feet, MAN). Allen Williamson misses. Rebound secured by Gary Simons.

[08:54] Team_068 possession (Score: 42-33)
Jaren Johnson drives and kicks out. Gary Simons makes the Midrange and draws the foul on Jimmy Simons! And-1! Gary Simons to the line for 1. [Team fouls: 1] (Jimmy Simons: 1 personal fouls)   FT 1/1: GOOD Gary Simons makes 1/1 from the line.
Score: 45-33

[08:38] Team_071 possession (Score: 45-33)
Bam Iverson attempts a Midrange. Contested by Jaren Johnson (5.2 feet, ZONE). BAM IVERSON MAKES IT! Assist: Victor Anunoby
Score: 45-35

[08:21] Team_068 possession (Score: 45-35)
Gary Simons attempts a Midrange. Contested by Allen Williamson (4.5 feet, ZONE). Gary Simons misses. Rebound secured by Bam Iverson.

[08:05] Team_071 possession (Score: 45-35)
Bam Iverson attempts a 3Pt. Contested by Jaren Johnson (5.7 feet, MAN). Bam Iverson misses. FOUL! Loose ball foul on Gary Simons during the rebound battle. [Team fouls: 3] No free throws, side out. (Gary Simons: 2 personal fouls)

[07:50] Team_071 possession (Score: 45-35)
Jimmy Simons attempts a Midrange. Wide open! Gary Simons is 7.4 feet away. [MAN] JIMMY SIMONS MAKES IT! Assist: Bam Iverson
Score: 45-37

[07:30] Team_068 possession (Score: 45-37)
Zion Anunoby attempts a Midrange. Wide open! Allen Williamson is 7.0 feet away. [MAN] ZION ANUNOBY MAKES IT!
Score: 47-37

[07:13] Team_071 possession (Score: 47-37)
Allen Williamson attempts a 3Pt. Wide open! Malcolm Herro is 6.1 feet away. [ZONE] Allen Williamson misses. Offensive rebound by Jimmy Simons! Jimmy Simons kicks it out.

[07:01] Team_071 possession (Score: 47-37)
Victor Anunoby drives to the basket... Victor Anunoby throws a bad pass! Stolen by Malcolm Herro! TURNOVER! (live ball)

[06:51] Team_068 possession (Score: 47-37)
Gary Simons drives to the basket... Gary Simons throws a bad pass out of bounds! TURNOVER! (dead ball)

[06:51] Substitution (Team_068): Zion Anunoby OUT → Cole Anthony IN (stamina_rule2)

[06:51] Substitution (Team_068): Malcolm Herro OUT → Ja Banchero IN (stamina_rule2)

[06:51] Substitution (Team_068): Jaren Johnson OUT → Miles Murray IN (stamina_rule2)

[06:51] Substitution (Team_068): Gary Simons OUT → Jarrett Oladipo IN (stamina_rule2)

[06:51] Substitution (Team_068): Nikola Ginobili OUT → Franz Curry IN (stamina_rule2)

[06:51] Substitution (Team_071): Allen Williamson OUT → Evan Sexton IN (stamina_rule2)

[06:51] Substitution (Team_071): Victor Anunoby OUT → Paul Ball IN (stamina_rule2)

[06:51] Substitution (Team_071): Bam Iverson OUT → Immanuel Ginobili IN (stamina_rule2)

[06:51] Substitution (Team_071): Jimmy Simons OUT → Jordan Durant IN (stamina_rule2)

[06:51] Substitution (Team_071): Dejounte Paul OUT → Tyrese Brogdon IN (stamina_rule2)

[06:39] Team_071 possession (Score: 47-37)
Tyrese Brogdon drives to the basket... Tyrese Brogdon commits a violation (traveling/carry)! TURNOVER! (dead ball)

[06:27] Team_068 possession (Score: 47-37)
Franz Curry drives, Tyrese Brogdon stays with him. Franz Curry attempts a Dunk. Contested by Tyrese Brogdon (5.6 feet, MAN). FRANZ CURRY MAKES IT! Assist: Jarrett Oladipo
Score: 49-37

[06:10] Team_071 possession (Score: 49-37)
Jordan Durant attempts a 3Pt. Wide open! Jarrett Oladipo is 7.3 feet away. [MAN] Jordan Durant misses. Rebound secured by Ja Banchero.

[05:59] Team_068 possession (Score: 49-37)
Franz Curry attempts a Layup. Wide open! Tyrese Brogdon is 6.5 feet away. [MAN] FRANZ CURRY MAKES IT! Assist: Jarrett Oladipo
Score: 51-37

[05:43] Team_071 possession (Score: 51-37)
Evan Sexton attempts a Layup. Contested by Franz Curry (3.8 feet, ZONE). EVAN SEXTON MAKES IT!
Score: 51-39

[05:29] Team_068 possession (Score: 51-39)
Franz Curry attempts a Layup. Wide open! Tyrese Brogdon is 9.5 feet away. [MAN] Franz Curry misses. Rebound secured by Jordan Durant.

[05:14] Team_071 possession (Score: 51-39)
Evan Sexton drives, picks up Franz Curry. Help arrives from Ja Banchero! Evan Sexton attempts a Layup. Contested by Ja Banchero (5.8 feet, ZONE). EVAN SEXTON MAKES IT! Assist: Immanuel Ginobili
Score: 51-41

[05:02] Team_068 possession (Score: 51-41)
Ja Banchero drives, picks up Jordan Durant. Help arrives from Evan Sexton! Ja Banchero attempts a Layup. Wide open! Evan Sexton is 8.5 feet away. [ZONE] Ja Banchero misses. Rebound secured by Jordan Durant.

[04:47] Team_071 possession (Score: 51-41)
Immanuel Ginobili attempts a 3Pt. Contested by Ja Banchero (5.5 feet, ZONE). IMMANUEL GINOBILI MAKES IT! Assist: Jordan Durant
Score: 51-44

[04:35] Team_068 possession (Score: 51-44)
Miles Murray attempts a 3Pt. Contested by Paul Ball (2.8 feet, ZONE). MILES MURRAY MAKES IT! Assist: Jarrett Oladipo
Score: 54-44

[04:26] Team_071 possession (Score: 54-44)
Paul Ball attempts a Midrange. Contested by Miles Murray (5.2 feet, ZONE). Paul Ball misses. Offensive rebound by Immanuel Ginobili! Immanuel Ginobili kicks it out.

[04:12] Team_071 possession (Score: 54-44)
Tyrese Brogdon attempts a Midrange. Contested by Franz Curry (5.7 feet, MAN). Tyrese Brogdon misses. Offensive rebound by Immanuel Ginobili! Immanuel Ginobili kicks it out.

[03:59] Team_071 possession (Score: 54-44)
Paul Ball attempts a Midrange. Contested by Ja Banchero (5.0 feet, MAN). Paul Ball misses. Rebound secured by Franz Curry.

[03:45] Team_068 possession (Score: 54-44)
Jarrett Oladipo drives, picks up Jordan Durant. Help arrives from Evan Sexton! Jarrett Oladipo attempts a Dunk. Wide open! Evan Sexton is 7.7 feet away. [MAN] JARRETT OLADIPO MAKES IT! Assist: Franz Curry
Score: 56-44

[03:32] Team_071 possession (Score: 56-44)
FOUL! Holding foul on Franz Curry. [Team fouls: 4] No free throws, side out. (Franz Curry: 1 personal fouls)

[03:18] Team_071 possession (Score: 56-44)
Jordan Durant drives to the basket... Jordan Durant throws a bad pass! Stolen by Jarrett Oladipo! TURNOVER! (live ball)

[03:02] Team_068 possession (Score: 56-44)
Jarrett Oladipo drives and kicks out. Franz Curry attempts a 3Pt. Contested by Tyrese Brogdon (3.6 feet, MAN). Franz Curry misses. FOUL! Loose ball foul on Evan Sexton during the rebound battle. [Team fouls: 2] No free throws, side out. (Evan Sexton: 1 personal fouls)

[02:47] Team_068 possession (Score: 56-44)
Cole Anthony attempts a 3Pt. Contested by Evan Sexton (5.4 feet, MAN). Cole Anthony misses. Rebound secured by Jordan Durant.

[02:30] Team_071 possession (Score: 56-44)
Jordan Durant attempts a Midrange. Contested by Miles Murray (2.1 feet, ZONE). Jordan Durant misses. Rebound secured by Jarrett Oladipo.

[02:14] Team_068 possession (Score: 56-44)
Miles Murray attempts a Midrange. Contested by Immanuel Ginobili (4.6 feet, MAN). MILES MURRAY MAKES IT!
Score: 58-44

[02:00] Team_071 possession (Score: 58-44)
Evan Sexton attempts a 3Pt. Contested by Miles Murray (2.7 feet, ZONE). Evan Sexton misses. Rebound secured by Franz Curry.

[01:43] Team_068 possession (Score: 58-44)
Ja Banchero makes the 3Pt and draws the foul on Paul Ball! And-1! Ja Banchero to the line for 1. [Team fouls: 3] (Paul Ball: 1 personal fouls)   FT 1/1: GOOD Ja Banchero makes 1/1 from the line.
Score: 62-44

[01:28] Team_071 possession (Score: 62-44)
Immanuel Ginobili makes the 3Pt and draws the foul on Miles Murray! And-1! Immanuel Ginobili to the line for 1. [BONUS: 5 team fouls] (Miles Murray: 1 personal fouls)   FT 1/1: GOOD Immanuel Ginobili makes 1/1 from the line.
Score: 62-48

[01:15] Team_068 possession (Score: 62-48)
Ja Banchero attempts a Midrange. Wide open! Jordan Durant is 7.1 feet away. [ZONE] JA BANCHERO MAKES IT! Assist: Jarrett Oladipo
Score: 64-48

[00:57] Team_071 possession (Score: 64-48)
Tyrese Brogdon drives, Franz Curry stays with him. Tyrese Brogdon attempts a Layup. Wide open! Franz Curry is 8.4 feet away. [MAN] Tyrese Brogdon misses. Rebound secured by Jarrett Oladipo.

[00:42] Team_068 possession (Score: 64-48)
Ja Banchero throws a bad pass! Stolen by Paul Ball! TURNOVER! (live ball)

[00:27] Team_071 possession (Score: 64-48)
FOUL! Holding foul on Jarrett Oladipo. [IN THE BONUS! 6 team fouls] Jordan Durant to the line for 2 free throws. (Jarrett Oladipo: 1 personal fouls)   FT 1/2: GOOD   FT 2/2: GOOD Jordan Durant makes 2/2 from the line.
Score: 64-50

[00:15] Team_068 possession (Score: 64-50)
Jarrett Oladipo drives to the basket... Jarrett Oladipo loses control! Ball rolls out of bounds! TURNOVER! (dead ball)

[00:05] Team_071 possession (Score: 64-50)
Paul Ball drives, Ja Banchero stays with him. Paul Ball attempts a Layup. Contested by Ja Banchero (3.3 feet, MAN). PAUL BALL MAKES IT! Assist: Tyrese Brogdon
Score: 64-52

================================================================================
                              2ND QUARTER COMPLETE                              
================================================================================

2ND QUARTER SCORE: Team_068 29, Team_071 27

BOX SCORE:
================================================================================

Team_068
--------------------------------------------------------------------------------
Player                MIN  PTS  REB  AST  TO      FG   FG%      3P   3P%
--------------------------------------------------------------------------------
Ja Banchero             7    6    1    0   0   2/3    66.7     0/0   0.0
Gary Simons            17    5    1    1   0   2/3    66.7     0/0   0.0
Miles Murray            7    5    0    0   0   2/2   100.0     0/0   0.0
Zion Anunoby           17    4    0    0   0   2/3    66.7     0/0   0.0
Franz Curry             7    4    3    1   0   2/3    66.7     0/0   0.0
Jaren Johnson          17    3    0    0   0   1/1   100.0     0/0   0.0
Jarrett Oladipo         7    2    2    4   0   1/1   100.0     0/0   0.0
Nikola Ginobili        17    0    1    0   0   0/1     0.0     0/0   0.0
Malcolm Herro          17    0    0    0   0   0/1     0.0     0/0   0.0
Cole Anthony            7    0    0    0   0   0/1     0.0     0/0   0.0

TEAM: FG: 12/19 (63.2%), 3PT: 3/7 (42.9%), REB: 8 (1 off, 7 def), AST: 6, TO: 3
TEAM FOULS: 6 [Team_071 in BONUS]


Team_071
--------------------------------------------------------------------------------
Player                MIN  PTS  REB  AST  TO      FG   FG%      3P   3P%
--------------------------------------------------------------------------------
Immanuel Ginobili       7    7    2    1   0   2/2   100.0     0/0   0.0
Jimmy Simons           17    6    5    0   0   3/3   100.0     0/0   0.0
Bam Iverson            17    4    1    1   0   2/2   100.0     0/0   0.0
Evan Sexton             7    4    0    0   0   2/3    66.7     0/0   0.0
Dejounte Paul          17    2    0    0   0   1/2    50.0     0/0   0.0
Jordan Durant           7    2    3    1   0   1/3    33.3     0/0   0.0
Paul Ball               7    2    0    0   0   1/2    50.0     0/0   0.0
Allen Williamson       17    0    0    0   0   0/1     0.0     0/0   0.0
Victor Anunoby         17    0    0    1   0   0/0     0.0     0/0   0.0
Tyrese Brogdon          7    0    0    1   0   0/1     0.0     0/0   0.0

TEAM: FG: 12/19 (63.2%), 3PT: 2/5 (40.0%), REB: 11 (4 off, 7 def), AST: 5, TO: 3
TEAM FOULS: 3

================================================================================

================================================================================
                       3RD QUARTER - Team_068 vs Team_071                       
================================================================================

[12:00] Team_068 possession (Score: 64-52)
Zion Anunoby attempts a 3Pt. Contested by Bam Iverson (4.3 feet, ZONE). ZION ANUNOBY MAKES IT! Assist: Jaren Johnson
Score: 67-52

[11:45] Team_071 possession (Score: 67-52)
Victor Anunoby attempts a Layup. BLOCKED BY JAREN JOHNSON! Ball is loose! Rebound secured by Jaren Johnson.

[11:30] Team_068 possession (Score: 67-52)
Jaren Johnson attempts a 3Pt. BLOCKED BY BAM IVERSON! Ball is loose! Rebound secured by Jimmy Simons.

[11:14] Team_071 possession (Score: 67-52)
Jimmy Simons drives, Gary Simons stays with him. Jimmy Simons attempts a Layup. Heavily contested by Gary Simons (0.5 feet, ZONE)! Jimmy Simons misses. Rebound secured by Gary Simons.

[10:59] Team_068 possession (Score: 67-52)
Nikola Ginobili drives to the basket... Nikola Ginobili loses control! Ball rolls out of bounds! TURNOVER! (dead ball)

[10:49] Team_071 possession (Score: 67-52)
Victor Anunoby attempts a 3Pt. Contested by Malcolm Herro (5.2 feet, MAN). VICTOR ANUNOBY MAKES IT! Assist: Bam Iverson
Score: 67-55

[10:35] Team_068 possession (Score: 67-55)
Gary Simons attempts a 3Pt. Wide open! Allen Williamson is 6.9 feet away. [ZONE] Gary Simons misses. Rebound secured by Dejounte Paul.

[10:20] Team_071 possession (Score: 67-55)
Victor Anunoby drives, Gary Simons stays with him. Victor Anunoby attempts a Dunk. Wide open! Gary Simons is 6.0 feet away. [ZONE] VICTOR ANUNOBY MAKES IT! Assist: Dejounte Paul
Score: 67-57

[10:05] Team_068 possession (Score: 67-57)
Jaren Johnson attempts a 3Pt. Contested by Victor Anunoby (4.2 feet, ZONE). JAREN JOHNSON MAKES IT! Assist: Malcolm Herro
Score: 70-57

[09:55] Team_071 possession (Score: 70-57)
Bam Iverson attempts a 3Pt. Wide open! Gary Simons is 7.1 feet away. [ZONE] Bam Iverson misses. Offensive rebound by Jimmy Simons! Jimmy Simons kicks it out.

[09:40] Team_071 possession (Score: 70-57)
Bam Iverson attempts a Midrange. Contested by Jaren Johnson (4.0 feet, MAN). Bam Iverson misses. Rebound secured by Gary Simons.

[09:23] Team_068 possession (Score: 70-57)
Nikola Ginobili attempts a Midrange. Wide open! Victor Anunoby is 6.3 feet away. [ZONE] NIKOLA GINOBILI MAKES IT! Assist: Jaren Johnson
Score: 72-57

[09:08] Team_071 possession (Score: 72-57)
FOUL! Holding foul on Zion Anunoby. [Team fouls: 1] No free throws, side out. (Zion Anunoby: 1 personal fouls)

[08:52] Team_071 possession (Score: 72-57)
Jimmy Simons attempts a Layup. Contested by Gary Simons (3.1 feet, ZONE). Jimmy Simons misses. Offensive rebound by Dejounte Paul! Dejounte Paul kicks it out.

[08:42] Team_071 possession (Score: 72-57)
Dejounte Paul drives to the basket... Dejounte Paul throws a bad pass! Stolen by Gary Simons! TURNOVER! (live ball)

[08:27] Team_068 possession (Score: 72-57)
Nikola Ginobili drives, picks up Dejounte Paul. Help arrives from Allen Williamson! Nikola Ginobili attempts a Dunk. Contested by Allen Williamson (5.4 feet, MAN). NIKOLA GINOBILI MAKES IT! Assist: Malcolm Herro
Score: 74-57

[08:07] Team_071 possession (Score: 74-57)
Dejounte Paul attempts a 3Pt. Contested by Zion Anunoby (5.6 feet, ZONE). Dejounte Paul misses. Rebound secured by Jaren Johnson.

[07:52] Team_068 possession (Score: 74-57)
Malcolm Herro attempts a Midrange. BLOCKED BY VICTOR ANUNOBY! Ball is loose! Offensive rebound by Jaren Johnson! Jaren Johnson kicks it out.

[07:38] Team_068 possession (Score: 74-57)
Gary Simons attempts a 3Pt. Contested by Jimmy Simons (3.7 feet, MAN). Gary Simons misses. FOUL! Loose ball foul on Dejounte Paul during the rebound battle. [Team fouls: 1] No free throws, side out. (Dejounte Paul: 1 personal fouls)

[07:24] Team_068 possession (Score: 74-57)
Nikola Ginobili drives, picks up Dejounte Paul. Help arrives from Allen Williamson! Nikola Ginobili attempts a Layup. Contested by Allen Williamson (4.0 feet, ZONE). NIKOLA GINOBILI MAKES IT!
Score: 76-57

[07:10] Team_071 possession (Score: 76-57)
Jimmy Simons drives, picks up Gary Simons. Help arrives from Malcolm Herro! Jimmy Simons attempts a Dunk. Contested by Malcolm Herro (4.7 feet, MAN). JIMMY SIMONS MAKES IT!
Score: 76-59

[06:52] Team_068 possession (Score: 76-59)
Nikola Ginobili attempts a Midrange. Contested by Dejounte Paul (4.6 feet, MAN). Nikola Ginobili misses. FOUL! Loose ball foul on Dejounte Paul during the rebound battle. [Team fouls: 2] No free throws, side out. (Dejounte Paul: 2 personal fouls)

[06:38] Team_068 possession (Score: 76-59)
Nikola Ginobili drives, picks up Dejounte Paul. Help arrives from Allen Williamson! Nikola Ginobili attempts a Dunk. Contested by Allen Williamson (2.1 feet, ZONE). NIKOLA GINOBILI MAKES IT! Assist: Malcolm Herro
Score: 78-59

[06:25] Team_071 possession (Score: 78-59)
Allen Williamson attempts a 3Pt. Wide open! Zion Anunoby is 7.5 feet away. [ZONE] ALLEN WILLIAMSON MAKES IT! Assist: Jimmy Simons
Score: 78-62

[06:09] Team_068 possession (Score: 78-62)
Nikola Ginobili attempts a 3Pt. Contested by Dejounte Paul (5.0 feet, MAN). Nikola Ginobili misses. Rebound secured by Jimmy Simons.

[05:51] Team_071 possession (Score: 78-62)
Allen Williamson drives and kicks out. Jimmy Simons attempts a Midrange. Contested by Gary Simons (4.8 feet, MAN). Jimmy Simons misses. Rebound secured by Gary Simons.

[05:37] Team_068 possession (Score: 78-62)
Malcolm Herro attempts a 3Pt. Contested by Victor Anunoby (3.9 feet, MAN). MALCOLM HERRO MAKES IT! Assist: Zion Anunoby
Score: 81-62

[05:26] Team_071 possession (Score: 81-62)
FOUL! Shooting foul on Malcolm Herro. Bam Iverson to the line for 2 free throws. [Team fouls: 2] (Malcolm Herro: 1 personal fouls)   FT 1/2: GOOD   FT 2/2: GOOD Bam Iverson makes 2/2 from the line.
Score: 81-64

[05:09] Team_068 possession (Score: 81-64)
Nikola Ginobili throws a bad pass out of bounds! TURNOVER! (dead ball)

[04:56] Team_071 possession (Score: 81-64)
Dejounte Paul attempts a Layup. Contested by Nikola Ginobili (4.4 feet, MAN). DEJOUNTE PAUL MAKES IT!
Score: 81-66

[04:41] Team_068 possession (Score: 81-66)
Jaren Johnson attempts a Layup. Heavily contested by Bam Iverson (0.7 feet, MAN)! JAREN JOHNSON MAKES IT! Assist: Malcolm Herro
Score: 83-66

[04:25] Team_071 possession (Score: 83-66)
Dejounte Paul makes the Layup and draws the foul on Nikola Ginobili! And-1! Dejounte Paul to the line for 1. [Team fouls: 3] (Nikola Ginobili: 1 personal fouls)   FT 1/1: GOOD Dejounte Paul makes 1/1 from the line.
Score: 83-69

[04:14] Team_068 possession (Score: 83-69)
Gary Simons attempts a 3Pt. Contested by Jimmy Simons (3.8 feet, MAN). Gary Simons misses. Rebound secured by Jimmy Simons.

[04:05] Team_071 possession (Score: 83-69)
FOUL! Offensive foul on Bam Iverson! Jaren Johnson drew the charge! [Team fouls: 3] (Bam Iverson: 1 personal fouls) TURNOVER! (dead ball)

[03:48] Team_068 possession (Score: 83-69)
Malcolm Herro drives, picks up Dejounte Paul. Help arrives from Allen Williamson! Malcolm Herro attempts a Dunk. Contested by Allen Williamson (4.3 feet, ZONE). MALCOLM HERRO MAKES IT!
Score: 85-69

[03:32] Team_071 possession (Score: 85-69)
Jimmy Simons drives to the basket... FOUL! Offensive foul on Jimmy Simons! Gary Simons drew the charge! [Team fouls: 4] (Jimmy Simons: 1 personal fouls) TURNOVER! (dead ball)

[03:18] Team_068 possession (Score: 85-69)
Zion Anunoby attempts a 3Pt. Contested by Victor Anunoby (3.9 feet, ZONE). Zion Anunoby misses. Offensive rebound by Nikola Ginobili! Nikola Ginobili puts it back in!
Score: 87-69

[03:05] Team_071 possession (Score: 87-69)
Jimmy Simons drives, Gary Simons stays with him. Jimmy Simons attempts a Dunk. Contested by Gary Simons (3.2 feet, MAN). Jimmy Simons misses. FOUL! Loose ball foul on Jaren Johnson during the rebound battle. [Team fouls: 4] No free throws, side out. (Jaren Johnson: 1 personal fouls)

[02:49] Team_071 possession (Score: 87-69)
Dejounte Paul attempts a Layup. Contested by Nikola Ginobili (2.9 feet, MAN). DEJOUNTE PAUL MAKES IT!
Score: 87-71

[02:36] Team_068 possession (Score: 87-71)
Nikola Ginobili attempts a Midrange. Heavily contested by Bam Iverson (1.3 feet, ZONE)! Nikola Ginobili misses. Offensive rebound by Nikola Ginobili! Nikola Ginobili puts it back in!
Score: 89-71

[02:22] Team_071 possession (Score: 89-71)
Victor Anunoby drives to the basket... Victor Anunoby commits a violation (traveling/carry)! TURNOVER! (dead ball)

[02:22] Substitution (Team_068): Malcolm Herro OUT → Ja Banchero IN (stamina_rule2)

[02:22] Substitution (Team_068): Jaren Johnson OUT → Miles Murray IN (stamina_rule2)

[02:22] Substitution (Team_068): Gary Simons OUT → Jarrett Oladipo IN (stamina_rule2)

[02:22] Substitution (Team_068): Nikola Ginobili OUT → Franz Curry IN (stamina_rule2)

[02:22] Substitution (Team_071): Allen Williamson OUT → Evan Sexton IN (stamina_rule2)

[02:22] Substitution (Team_071): Victor Anunoby OUT → Paul Ball IN (stamina_rule2)

[02:22] Substitution (Team_071): Bam Iverson OUT → Immanuel Ginobili IN (stamina_rule2)

[02:22] Substitution (Team_071): Jimmy Simons OUT → Jordan Durant IN (stamina_rule2)

[02:22] Substitution (Team_071): Dejounte Paul OUT → Tyrese Brogdon IN (stamina_rule2)

[02:10] Team_068 possession (Score: 89-71)
Jarrett Oladipo attempts a Layup. Contested by Jordan Durant (3.9 feet, MAN). JARRETT OLADIPO MAKES IT! Assist: Zion Anunoby
Score: 91-71

[02:01] Team_071 possession (Score: 91-71)
Jordan Durant attempts a 3Pt. Contested by Zion Anunoby (5.1 feet, ZONE). Jordan Durant misses. Rebound secured by Ja Banchero.

[01:43] Team_068 possession (Score: 91-71)
Franz Curry drives, picks up Tyrese Brogdon. Help arrives from Evan Sexton! Franz Curry attempts a Dunk. Wide open! Evan Sexton is 7.6 feet away. [MAN] Franz Curry misses. Offensive rebound by Franz Curry! Franz Curry's putback is no good. Rebound secured by Immanuel Ginobili.

[01:27] Team_071 possession (Score: 91-71)
Evan Sexton drives, Franz Curry stays with him. Evan Sexton attempts a Layup. Wide open! Franz Curry is 6.7 feet away. [ZONE] Evan Sexton misses. Offensive rebound by Jordan Durant! Jordan Durant kicks it out.

[01:16] Team_071 possession (Score: 91-71)
Evan Sexton makes the 3Pt and draws the foul on Zion Anunoby! And-1! Evan Sexton to the line for 1. [BONUS: 5 team fouls] (Zion Anunoby: 2 personal fouls)   FT 1/1: GOOD Evan Sexton makes 1/1 from the line.
Score: 91-75

[00:59] Team_068 possession (Score: 91-75)
Miles Murray attempts a Midrange. Contested by Immanuel Ginobili (4.0 feet, MAN). Miles Murray misses. Rebound secured by Evan Sexton.

[00:44] Team_071 possession (Score: 91-75)
Tyrese Brogdon attempts a 3Pt. Contested by Zion Anunoby (2.5 feet, ZONE). Tyrese Brogdon misses. Rebound secured by Ja Banchero.

[00:26] Team_068 possession (Score: 91-75)
Franz Curry drives to the basket... Franz Curry throws a bad pass out of bounds! TURNOVER! (dead ball)

[00:26] Substitution (Team_068): Zion Anunoby OUT → Cole Anthony IN (stamina_rule2)

[00:14] Team_071 possession (Score: 91-75)
Tyrese Brogdon attempts a Midrange. Contested by Franz Curry (3.6 feet, MAN). TYRESE BROGDON MAKES IT! Assist: Jordan Durant
Score: 91-77

[00:04] Team_068 possession (Score: 91-77)
Cole Anthony attempts a Midrange. Wide open! Immanuel Ginobili is 7.4 feet away. [ZONE] COLE ANTHONY MAKES IT!
Score: 93-77

================================================================================
                              3RD QUARTER COMPLETE                              
================================================================================

3RD QUARTER SCORE: Team_068 29, Team_071 25

BOX SCORE:
================================================================================

Team_068
--------------------------------------------------------------------------------
Player                MIN  PTS  REB  AST  TO      FG   FG%      3P   3P%
--------------------------------------------------------------------------------
Nikola Ginobili        27   12    2    0   0   6/7    85.7     0/0   0.0
Jaren Johnson          27    5    5    2   0   2/3    66.7     0/0   0.0
Malcolm Herro          27    5    0    4   0   2/2   100.0     0/0   0.0
Zion Anunoby           29    3    0    2   0   1/1   100.0     0/0   0.0
Jarrett Oladipo         9    2    0    0   0   1/1   100.0     0/0   0.0
Cole Anthony            7    2    0    0   0   1/1   100.0     0/0   0.0
Gary Simons            27    0    3    0   0   0/2     0.0     0/0   0.0
Ja Banchero             9    0    2    0   0   0/0     0.0     0/0   0.0
Franz Curry             9    0    0    0   0   0/1     0.0     0/0   0.0
Immanuel Ginobili       9    0    1    0   0   0/0     0.0     0/0   0.0
Miles Murray            9    0    0    0   0   0/1     0.0     0/0   0.0

TEAM: FG: 13/19 (68.4%), 3PT: 4/8 (50.0%), REB: 13 (6 off, 7 def), AST: 8, TO: 3
TEAM FOULS: 5 [Team_071 in BONUS]


Team_071
--------------------------------------------------------------------------------
Player                MIN  PTS  REB  AST  TO      FG   FG%      3P   3P%
--------------------------------------------------------------------------------
Dejounte Paul          27    7    2    1   0   3/4    75.0     0/0   0.0
Victor Anunoby         27    5    0    0   0   2/3    66.7     0/0   0.0
Evan Sexton             9    4    1    0   0   1/1   100.0     0/0   0.0
Allen Williamson       27    3    0    0   0   1/2    50.0     0/0   0.0
Jimmy Simons           27    2    5    1   0   1/2    50.0     0/0   0.0
Bam Iverson            27    2    0    1   0   1/2    50.0     0/0   0.0
Tyrese Brogdon          9    2    0    0   0   1/2    50.0     0/0   0.0
Jordan Durant           9    0    1    1   0   0/1     0.0     0/0   0.0

TEAM: FG: 10/17 (58.8%), 3PT: 3/6 (50.0%), REB: 9 (4 off, 5 def), AST: 4, TO: 4
TEAM FOULS: 4

================================================================================

================================================================================
                       4TH QUARTER - Team_068 vs Team_071                       
================================================================================

[12:00] Team_068 possession (Score: 93-77)
Jaren Johnson attempts a 3Pt. Contested by Victor Anunoby (5.8 feet, ZONE). Jaren Johnson misses. FOUL! Loose ball foul on Bam Iverson during the rebound battle. [Team fouls: 1] No free throws, side out. (Bam Iverson: 1 personal fouls)

[11:50] Team_068 possession (Score: 93-77)
Zion Anunoby drives, Dejounte Paul stays with him. Zion Anunoby attempts a Dunk. Contested by Dejounte Paul (3.0 feet, ZONE). Zion Anunoby misses. Rebound secured by Jimmy Simons.

[11:35] Team_071 possession (Score: 93-77)
Dejounte Paul attempts a Dunk. BLOCKED BY MALCOLM HERRO! Ball is loose! Rebound secured by Nikola Ginobili.

[11:22] Team_068 possession (Score: 93-77)
Zion Anunoby drives to the basket... FOUL! Offensive foul on Zion Anunoby! Allen Williamson drew the charge! [Team fouls: 1] (Zion Anunoby: 1 personal fouls) TURNOVER! (dead ball)

[11:06] Team_071 possession (Score: 93-77)
Victor Anunoby drives, Gary Simons stays with him. Victor Anunoby attempts a Layup. Contested by Gary Simons (5.7 feet, ZONE). Victor Anunoby misses. Rebound secured by Gary Simons.

[10:52] Team_068 possession (Score: 93-77)
FOUL! Reach-in foul on Dejounte Paul during the drive. [Team fouls: 2] No free throws, side out. (Dejounte Paul: 1 personal fouls)

[10:37] Team_068 possession (Score: 93-77)
Nikola Ginobili attempts a Midrange. Contested by Dejounte Paul (4.1 feet, MAN). Nikola Ginobili misses. Offensive rebound by Nikola Ginobili! Nikola Ginobili's putback is no good. Rebound secured by Dejounte Paul.

[10:21] Team_071 possession (Score: 93-77)
Bam Iverson drives, Jaren Johnson stays with him. Bam Iverson attempts a Dunk. Contested by Jaren Johnson (3.7 feet, MAN). BAM IVERSON MAKES IT! Assist: Allen Williamson
Score: 93-79

[10:04] Team_068 possession (Score: 93-79)
Nikola Ginobili attempts a Midrange. Wide open! Dejounte Paul is 6.2 feet away. [MAN] Nikola Ginobili misses. Rebound secured by Jimmy Simons.

[09:50] Team_071 possession (Score: 93-79)
Bam Iverson attempts a 3Pt. Contested by Jaren Johnson (5.8 feet, MAN). Bam Iverson misses. Rebound secured by Jaren Johnson.

[09:40] Team_068 possession (Score: 93-79)
Malcolm Herro drives and kicks out. Jaren Johnson attempts a Midrange. Contested by Bam Iverson (2.5 feet, MAN). Jaren Johnson misses. Offensive rebound by Jaren Johnson! Jaren Johnson kicks it out.

[09:26] Team_068 possession (Score: 93-79)
Nikola Ginobili attempts a 3Pt. Wide open! Dejounte Paul is 8.1 feet away. [MAN] Nikola Ginobili misses. Offensive rebound by Jaren Johnson! Jaren Johnson kicks it out.

[09:14] Team_068 possession (Score: 93-79)
Nikola Ginobili drives to the basket... Nikola Ginobili throws a bad pass! Stolen by Dejounte Paul! TURNOVER! (live ball)

[08:58] Team_071 possession (Score: 93-79)
Victor Anunoby attempts a Midrange. Contested by Malcolm Herro (3.4 feet, ZONE). VICTOR ANUNOBY MAKES IT!
Score: 93-81

[08:43] Team_068 possession (Score: 93-81)
Malcolm Herro drives, Dejounte Paul stays with him. Malcolm Herro attempts a Layup. Contested by Dejounte Paul (5.5 feet, ZONE). MALCOLM HERRO MAKES IT!
Score: 95-81

[08:28] Team_071 possession (Score: 95-81)
Victor Anunoby attempts a 3Pt. Contested by Zion Anunoby (5.4 feet, ZONE). Victor Anunoby misses. Rebound secured by Gary Simons.

[08:14] Team_068 possession (Score: 95-81)
Gary Simons attempts a Midrange. Contested by Victor Anunoby (5.1 feet, ZONE). Gary Simons misses. Rebound secured by Dejounte Paul.

[08:04] Team_071 possession (Score: 95-81)
Victor Anunoby attempts a 3Pt. Contested by Malcolm Herro (5.9 feet, MAN). Victor Anunoby misses. Rebound secured by Jaren Johnson.

[07:52] Team_068 possession (Score: 95-81)
Jaren Johnson attempts a 3Pt. Contested by Victor Anunoby (3.6 feet, ZONE). Jaren Johnson misses. Rebound secured by Bam Iverson.

[07:36] Team_071 possession (Score: 95-81)
Bam Iverson attempts a 3Pt. Contested by Malcolm Herro (4.4 feet, ZONE). Bam Iverson misses. Rebound secured by Nikola Ginobili.

[07:23] Team_068 possession (Score: 95-81)
Jaren Johnson drives to the basket... Jaren Johnson throws a bad pass out of bounds! TURNOVER! (dead ball)

[07:23] Substitution (Team_068): Zion Anunoby OUT → Cole Anthony IN (stamina_rule2)

[07:23] Substitution (Team_068): Malcolm Herro OUT → Ja Banchero IN (stamina_rule2)

[07:23] Substitution (Team_068): Jaren Johnson OUT → Miles Murray IN (stamina_rule2)

[07:23] Substitution (Team_068): Gary Simons OUT → Jarrett Oladipo IN (stamina_rule2)

[07:23] Substitution (Team_068): Nikola Ginobili OUT → Franz Curry IN (stamina_rule2)

[07:23] Substitution (Team_071): Allen Williamson OUT → Evan Sexton IN (stamina_rule2)

[07:23] Substitution (Team_071): Victor Anunoby OUT → Paul Ball IN (stamina_rule2)

[07:23] Substitution (Team_071): Bam Iverson OUT → Immanuel Ginobili IN (stamina_rule2)

[07:23] Substitution (Team_071): Jimmy Simons OUT → Jordan Durant IN (stamina_rule2)

[07:23] Substitution (Team_071): Dejounte Paul OUT → Tyrese Brogdon IN (stamina_rule2)

[07:11] Team_071 possession (Score: 95-81)
Tyrese Brogdon makes the Layup and draws the foul on Franz Curry! And-1! Tyrese Brogdon to the line for 1. [Team fouls: 2] (Franz Curry: 1 personal fouls)   FT 1/1: GOOD Tyrese Brogdon makes 1/1 from the line.
Score: 95-84

[06:56] Team_068 possession (Score: 95-84)
Miles Murray attempts a 3Pt. Heavily contested by Paul Ball (0.5 feet, ZONE)! MILES MURRAY MAKES IT! Assist: Jarrett Oladipo
Score: 98-84

[06:41] Team_071 possession (Score: 98-84)
Paul Ball attempts a 3Pt. Contested by Ja Banchero (5.2 feet, ZONE). PAUL BALL MAKES IT! Assist: Tyrese Brogdon
Score: 98-87

[06:23] Team_068 possession (Score: 98-87)
Ja Banchero attempts a 3Pt. Contested by Paul Ball (2.2 feet, MAN). JA BANCHERO MAKES IT! Assist: Miles Murray
Score: 101-87

[06:12] Team_071 possession (Score: 101-87)
Paul Ball attempts a Midrange. Wide open! Ja Banchero is 8.9 feet away. [MAN] PAUL BALL MAKES IT! Assist: Tyrese Brogdon
Score: 101-89

[05:56] Team_068 possession (Score: 101-89)
Ja Banchero attempts a 3Pt. Contested by Paul Ball (5.6 feet, MAN). Ja Banchero misses. FOUL! Loose ball foul on Jordan Durant during the rebound battle. [Team fouls: 3] No free throws, side out. (Jordan Durant: 1 personal fouls)

[05:44] Team_068 possession (Score: 101-89)
Franz Curry attempts a Layup. Wide open! Tyrese Brogdon is 7.0 feet away. [MAN] FRANZ CURRY MAKES IT!
Score: 103-89

[05:32] Team_071 possession (Score: 103-89)
Evan Sexton makes the Layup and draws the foul on Franz Curry! And-1! Evan Sexton to the line for 1. [Team fouls: 3] (Franz Curry: 2 personal fouls)   FT 1/1: GOOD Evan Sexton makes 1/1 from the line.
Score: 103-92

[05:17] Team_068 possession (Score: 103-92)
Franz Curry attempts a Midrange. Contested by Jordan Durant (3.7 feet, ZONE). FRANZ CURRY MAKES IT!
Score: 105-92

[05:00] Team_071 possession (Score: 105-92)
Tyrese Brogdon attempts a Midrange. Contested by Franz Curry (2.9 feet, MAN). Tyrese Brogdon misses. Rebound secured by Franz Curry.

[04:44] Team_068 possession (Score: 105-92)
Miles Murray attempts a Midrange. Contested by Immanuel Ginobili (3.4 feet, MAN). MILES MURRAY MAKES IT! Assist: Franz Curry
Score: 107-92

[04:32] Team_071 possession (Score: 107-92)
Paul Ball attempts a 3Pt. Contested by Ja Banchero (5.5 feet, ZONE). Paul Ball misses. Rebound secured by Ja Banchero.

[04:18] Team_068 possession (Score: 107-92)
Miles Murray attempts a 3Pt. Contested by Jordan Durant (6.0 feet, ZONE). Miles Murray misses. Rebound secured by Jordan Durant.

[04:04] Team_071 possession (Score: 107-92)
Tyrese Brogdon attempts a 3Pt. Wide open! Ja Banchero is 6.2 feet away. [ZONE] Tyrese Brogdon misses. Rebound secured by Ja Banchero.

[03:47] Team_068 possession (Score: 107-92)
Miles Murray attempts a Midrange. Wide open! Paul Ball is 6.0 feet away. [ZONE] Miles Murray misses. FOUL! Loose ball foul on Jordan Durant during the rebound battle. [Team fouls: 4] No free throws, side out. (Jordan Durant: 2 personal fouls)

[03:34] Team_068 possession (Score: 107-92)
Franz Curry attempts a Midrange. Contested by Tyrese Brogdon (4.5 feet, MAN). Franz Curry misses. FOUL! Loose ball foul on Immanuel Ginobili during the rebound battle. [IN THE BONUS! 5 team fouls] Franz Curry to the line for 2 free throws. (Immanuel Ginobili: 1 personal fouls)   FT 1/2: MISS   FT 2/2: GOOD Franz Curry makes 1/2 from the line.
Score: 108-92

[03:16] Team_071 possession (Score: 108-92)
Jordan Durant makes the Layup and draws the foul on Jarrett Oladipo! And-1! Jordan Durant to the line for 1. [Team fouls: 4] (Jarrett Oladipo: 1 personal fouls)   FT 1/1: GOOD Jordan Durant makes 1/1 from the line.
Score: 108-95

[03:01] Team_068 possession (Score: 108-95)
Franz Curry attempts a Layup. Contested by Tyrese Brogdon (4.7 feet, ZONE). FRANZ CURRY MAKES IT!
Score: 110-95

[02:47] Team_071 possession (Score: 110-95)
Paul Ball loses control! Ball rolls out of bounds! TURNOVER! (dead ball)

[02:32] Team_068 possession (Score: 110-95)
Cole Anthony attempts a Midrange. Contested by Jordan Durant (2.9 feet, ZONE). COLE ANTHONY MAKES IT! Assist: Jarrett Oladipo
Score: 112-95

[02:16] Team_071 possession (Score: 112-95)
Paul Ball attempts a 3Pt. Contested by Jarrett Oladipo (2.6 feet, ZONE). Paul Ball misses. Offensive rebound by Immanuel Ginobili! Immanuel Ginobili kicks it out.

[02:00] Team_071 possession (Score: 112-95)
Evan Sexton attempts a 3Pt. Contested by Ja Banchero (5.1 feet, ZONE). Evan Sexton misses. Rebound secured by Jarrett Oladipo.

[01:46] Team_068 possession (Score: 112-95)
FOUL! Reach-in foul on Immanuel Ginobili during the drive. [IN THE BONUS! 6 team fouls] Miles Murray to the line for 2 free throws. (Immanuel Ginobili: 2 personal fouls)   FT 1/2: GOOD   FT 2/2: MISS Miles Murray makes 1/2 from the line. Offensive rebound by Jarrett Oladipo! Jarrett Oladipo kicks it out.
Score: 113-95

[01:29] Team_068 possession (Score: 113-95)
Cole Anthony drives, Tyrese Brogdon stays with him. Cole Anthony attempts a Dunk. Contested by Tyrese Brogdon (5.5 feet, ZONE). Cole Anthony misses. Offensive rebound by Franz Curry! Franz Curry puts it back in!
Score: 115-95

[01:19] Team_071 possession (Score: 115-95)
Tyrese Brogdon makes the Dunk and draws the foul on Franz Curry! And-1! Tyrese Brogdon to the line for 1. [BONUS: 5 team fouls] (Franz Curry: 3 personal fouls)   FT 1/1: MISS Tyrese Brogdon makes 0/1 from the line. Rebound secured by Franz Curry.
Score: 115-97

[01:04] Team_068 possession (Score: 115-97)
Miles Murray attempts a 3Pt. Contested by Paul Ball (4.0 feet, ZONE). MILES MURRAY MAKES IT! Assist: Ja Banchero
Score: 118-97

[00:49] Team_071 possession (Score: 118-97)
Immanuel Ginobili drives, picks up Miles Murray. Help arrives from Ja Banchero! Immanuel Ginobili attempts a Layup. Wide open! Ja Banchero is 7.1 feet away. [MAN] IMMANUEL GINOBILI MAKES IT!
Score: 118-99

[00:30] Team_068 possession (Score: 118-99)
Jarrett Oladipo attempts a 3Pt. Contested by Jordan Durant (2.8 feet, MAN). Jarrett Oladipo misses. FOUL! Loose ball foul on Evan Sexton during the rebound battle. [IN THE BONUS! 7 team fouls] Franz Curry to the line for 2 free throws. (Evan Sexton: 1 personal fouls)   FT 1/2: GOOD   FT 2/2: MISS Franz Curry makes 1/2 from the line. Rebound secured by Evan Sexton.
Score: 119-99

[00:15] Team_071 possession (Score: 119-99)
Paul Ball drives to the basket... Paul Ball throws a bad pass! Stolen by Ja Banchero! TURNOVER! (live ball)

================================================================================
                              4TH QUARTER COMPLETE                              
================================================================================

4TH QUARTER SCORE: Team_068 26, Team_071 22

BOX SCORE:
================================================================================

Team_068
--------------------------------------------------------------------------------
Player                MIN  PTS  REB  AST  TO      FG   FG%      3P   3P%
--------------------------------------------------------------------------------
Franz Curry            16    9    5    1   0   5/5   100.0     0/0   0.0
Miles Murray           16    8    0    1   0   3/4    75.0     0/0   0.0
Ja Banchero            16    3    2    1   0   1/1   100.0     0/0   0.0
Evan Sexton            16    3    1    0   0   1/2    50.0     0/0   0.0
Malcolm Herro          32    2    0    0   0   1/1   100.0     0/0   0.0
Cole Anthony           14    2    0    0   0   1/1   100.0     0/0   0.0
Nikola Ginobili        32    0    3    0   0   0/2     0.0     0/0   0.0
Zion Anunoby           34    0    0    0   0   0/1     0.0     0/0   0.0
Gary Simons            32    0    2    0   0   0/1     0.0     0/0   0.0
Jaren Johnson          32    0    4    0   0   0/1     0.0     0/0   0.0
Jarrett Oladipo        16    0    2    2   0   0/1     0.0     0/0   0.0

TEAM: FG: 11/18 (61.1%), 3PT: 3/6 (50.0%), REB: 20 (9 off, 11 def), AST: 5, TO: 3
TEAM FOULS: 5 [Team_071 in BONUS]


Team_071
--------------------------------------------------------------------------------
Player                MIN  PTS  REB  AST  TO      FG   FG%      3P   3P%
--------------------------------------------------------------------------------
Paul Ball              16    5    0    0   0   2/3    66.7     0/0   0.0
Tyrese Brogdon         16    3    0    2   0   1/4    25.0     0/0   0.0
Jordan Durant          16    3    1    0   0   1/1   100.0     0/0   0.0
Victor Anunoby         32    2    0    0   0   1/4    25.0     0/0   0.0
Bam Iverson            32    2    1    0   0   1/3    33.3     0/0   0.0
Immanuel Ginobili      16    2    1    0   0   1/1   100.0     0/0   0.0
Jimmy Simons           32    0    2    0   0   0/0     0.0     0/0   0.0
Dejounte Paul          32    0    2    0   0   0/1     0.0     0/0   0.0
Allen Williamson       32    0    0    1   0   0/0     0.0     0/0   0.0

TEAM: FG: 8/19 (42.1%), 3PT: 1/8 (12.5%), REB: 6 (1 off, 5 def), AST: 3, TO: 2
TEAM FOULS: 7 [Team_068 in BONUS]

================================================================================

================================================================================
                               FULL GAME COMPLETE                               
================================================================================

FINAL SCORE: Team_068 119, Team_071 99

SCORING BY QUARTER:
--------------------------------------------------------------------------------
Team                     Q1     Q2     Q3     Q4    FINAL
--------------------------------------------------------------------------------
Team_068                 35     29     29     26      119
Team_071                 25     27     25     22       99
--------------------------------------------------------------------------------

FULL GAME BOX SCORE:
================================================================================

Team_068
--------------------------------------------------------------------------------
Player                MIN  PTS  REB  AST  TO      FG   FG%      3P   3P%      FT STL BLK
--------------------------------------------------------------------------------
Zion Anunoby           34   14    0    3   0   7/10   70.0   2/3    66.7   3/4     0   0
Malcolm Herro          32   15    0    4   1   6/7    85.7   2/3    66.7   1/2     1   2
Jaren Johnson          32   18   18    4   2   9/12   75.0   3/5    60.0   3/5     0   1
Gary Simons            32    9    8    2   3   4/10   40.0   0/2     0.0   1/1     1   0
Nikola Ginobili        32   16    8    2   2   7/12   58.3   0/2     0.0   0/0     0   0
Ja Banchero            16    9    5    1   2   3/4    75.0   2/2   100.0   1/1     1   0
Miles Murray           16   13    0    1   1   5/7    71.4   3/4    75.0   1/2     0   0
Jarrett Oladipo        16    4    4    6   0   2/3    66.7   0/1     0.0   0/0     1   0
Franz Curry            16   13    8    2   0   6/8    75.0   0/0     0.0   2/4     0   0
Cole Anthony           14    4    0    0   0   3/4    75.0   0/1     0.0   0/0     0   0

TEAM: FG: 52/77 (67.5%), 3PT: 12/23 (52.2%), REB: 54 (18 off, 36 def), AST: 25, TO: 11


Team_071
--------------------------------------------------------------------------------
Player                MIN  PTS  REB  AST  TO      FG   FG%      3P   3P%      FT STL BLK
--------------------------------------------------------------------------------
Allen Williamson       32    6    0    3   0   2/7    28.6   2/4    50.0   0/0     0   0
Victor Anunoby         32   10    0    1   0   4/8    50.0   2/4    50.0   0/0     1   1
Bam Iverson            32   15    5    2   2   7/13   53.8   1/3    33.3   2/2     0   1
Jimmy Simons           32    8   14    3   3   4/8    50.0   0/0     0.0   2/2     0   0
Dejounte Paul          32   21    6    2   1   9/14   64.3   1/3    33.3   4/4     2   0
Evan Sexton            16   11    2    0   1   4/6    66.7   1/3    33.3   2/2     0   0
Paul Ball              16    7    0    0   1   3/5    60.0   1/2    50.0   0/0     1   0
Immanuel Ginobili      16    9    4    1   0   3/3   100.0   2/2   100.0   1/1     0   0
Jordan Durant          16    5    5    2   1   1/4    25.0   0/2     0.0   3/3     0   0
Tyrese Brogdon         16    5    0    3   1   2/7    28.6   0/2     0.0   1/2     0   0

TEAM: FG: 40/76 (52.6%), 3PT: 10/25 (40.0%), REB: 33 (11 off, 22 def), AST: 17, TO: 10

================================================================================
