================================================================================
                        FULL GAME - Team_028 vs Team_100                        
================================================================================

================================================================================
                       1ST QUARTER - Team_028 vs Team_100                       
================================================================================

[12:00] Team_028 possession (Score: 0-0)
Carmelo Carter attempts a 3Pt. Wide open! Luka Green is 6.1 feet away. [ZONE] Carmelo Carter misses. Offensive rebound by Kawhi Ball! Kawhi Ball kicks it out.

[11:48] Team_028 possession (Score: 0-0)
Austin Russell attempts a Midrange. Contested by Luka Green (3.4 feet, MAN). Austin Russell misses. Offensive rebound by Jimmy Brogdon! Jimmy Brogdon kicks it out.

[11:33] Team_028 possession (Score: 0-0)
Austin Russell attempts a 3Pt. Wide open! Luka Green is 7.8 feet away. [ZONE] Austin Russell misses. Offensive rebound by Kawhi Ball! Kawhi Ball kicks it out.

[11:22] Team_028 possession (Score: 0-0)
Myles Haliburton attempts a Midrange. Wide open! Tyler Griffin is 8.1 feet away. [ZONE] Myles Haliburton misses. Rebound secured by Pau LaVine.

[11:07] Team_100 possession (Score: 0-0)
Manu Ball drives, Kawhi Ball stays with him. Manu Ball attempts a Layup. Contested by Kawhi Ball (3.6 feet, ZONE). MANU BALL MAKES IT! Assist: Chris Mobley
Score: 0-2

[10:52] Team_028 possession (Score: 0-2)
Carmelo Carter drives to the basket... Carmelo Carter throws a bad pass out of bounds! TURNOVER! (dead ball)

[10:38] Team_100 possession (Score: 0-2)
Tyler Griffin attempts a Midrange. Wide open! Carmelo Carter is 8.0 feet away. [ZONE] Tyler Griffin misses. Rebound secured by Kawhi Ball.

[10:26] Team_028 possession (Score: 0-2)
Myles Haliburton drives and kicks out. Myles Haliburton attempts a 3Pt. Contested by Tyler Griffin (5.3 feet, MAN). MYLES HALIBURTON MAKES IT! Assist: Austin Russell
Score: 3-2

[10:08] Team_100 possession (Score: 3-2)
Pau LaVine drives, Kawhi Ball stays with him. Pau LaVine attempts a Dunk. Wide open! Kawhi Ball is 8.7 feet away. [ZONE] PAU LAVINE MAKES IT! Assist: Chris Mobley
Score: 3-4

[09:49] Team_028 possession (Score: 3-4)
Austin Russell drives to the basket... Austin Russell loses the ball! Stripped by Luka Green! TURNOVER! (live ball)

[09:35] Team_100 possession (Score: 3-4)
Pau LaVine attempts a 3Pt. Contested by Austin Russell (4.2 feet, ZONE). Pau LaVine misses. Rebound secured by Jimmy Brogdon.

[09:24] Team_028 possession (Score: 3-4)
Myles Haliburton attempts a Layup. Wide open! Tyler Griffin is 7.3 feet away. [MAN] Myles Haliburton misses. Offensive rebound by Kawhi Ball! Kawhi Ball kicks it out.

[09:14] Team_028 possession (Score: 3-4)
Kawhi Ball throws a bad pass out of bounds! TURNOVER! (dead ball)

[08:57] Team_100 possession (Score: 3-4)
Luka Green drives, picks up Austin Russell. Help arrives from Carmelo Carter! Luka Green attempts a Dunk. Contested by Carmelo Carter (4.8 feet, MAN). LUKA GREEN MAKES IT!
Score: 3-6

[08:42] Team_028 possession (Score: 3-6)
Carmelo Carter attempts a 3Pt. Contested by Manu Ball (5.3 feet, MAN). CARMELO CARTER MAKES IT!
Score: 6-6

[08:30] Team_100 possession (Score: 6-6)
Chris Mobley drives and kicks out. Manu Ball attempts a 3Pt. Contested by Carmelo Carter (2.1 feet, ZONE). MANU BALL MAKES IT! Assist: Luka Green
Score: 6-9

[08:18] Team_028 possession (Score: 6-9)
Kawhi Ball makes the Layup and draws the foul on Manu Ball! And-1! Kawhi Ball to the line for 1. [Team fouls: 1] (Manu Ball: 1 personal fouls)   FT 1/1: GOOD Kawhi Ball makes 1/1 from the line.
Score: 9-9

[08:00] Team_100 possession (Score: 9-9)
Tyler Griffin drives, Kawhi Ball stays with him. Tyler Griffin attempts a Layup. Contested by Kawhi Ball (5.6 feet, ZONE). TYLER GRIFFIN MAKES IT! Assist: Pau LaVine
Score: 9-11

[07:47] Team_028 possession (Score: 9-11)
Myles Haliburton loses control! Ball rolls out of bounds! TURNOVER! (dead ball)

[07:31] Team_100 possession (Score: 9-11)
Pau LaVine drives to the basket... Pau LaVine throws a bad pass! Stolen by Kawhi Ball! TURNOVER! (live ball)

[07:14] Team_028 possession (Score: 9-11)
FOUL! Reach-in foul on Manu Ball during the drive. [Team fouls: 2] No free throws, side out. (Manu Ball: 2 personal fouls)

[07:04] Team_028 possession (Score: 9-11)
Kawhi Ball drives, Pau LaVine stays with him. Kawhi Ball attempts a Layup. Contested by Pau LaVine (5.2 feet, MAN). KAWHI BALL MAKES IT! Assist: Austin Russell
Score: 11-11

[06:47] Team_100 possession (Score: 11-11)
Luka Green attempts a 3Pt. Contested by Austin Russell (5.0 feet, ZONE). Luka Green misses. Rebound secured by Carmelo Carter.

[06:28] Team_028 possession (Score: 11-11)
FOUL! Shooting foul on Luka Green. Austin Russell to the line for 2 free throws. [Team fouls: 3] (Luka Green: 1 personal fouls)   FT 1/2: MISS   FT 2/2: GOOD Austin Russell makes 1/2 from the line.
Score: 12-11

[06:14] Team_100 possession (Score: 12-11)
Tyler Griffin attempts a Midrange. Contested by Kawhi Ball (3.2 feet, ZONE). TYLER GRIFFIN MAKES IT!
Score: 12-13

[05:59] Team_028 possession (Score: 12-13)
Kawhi Ball attempts a 3Pt. Contested by Pau LaVine (3.2 feet, MAN). Kawhi Ball misses. Rebound secured by Pau LaVine.

[05:42] Team_100 possession (Score: 12-13)
Manu Ball attempts a 3Pt. Contested by Carmelo Carter (3.0 feet, MAN). Manu Ball misses. Rebound secured by Jimmy Brogdon.

[05:26] Team_028 possession (Score: 12-13)
Myles Haliburton loses the ball! Stripped by Tyler Griffin! TURNOVER! (live ball)

[05:09] Team_100 possession (Score: 12-13)
Tyler Griffin attempts a Layup. Contested by Kawhi Ball (4.2 feet, ZONE). Tyler Griffin misses. Rebound secured by Carmelo Carter.

[04:51] Team_028 possession (Score: 12-13)
Jimmy Brogdon drives, picks up Pau LaVine. Help arrives from Manu Ball! Jimmy Brogdon attempts a Dunk. Wide open! Manu Ball is 6.0 feet away. [ZONE] Jimmy Brogdon misses. Rebound secured by Pau LaVine.

[04:35] Team_100 possession (Score: 12-13)
Tyler Griffin attempts a 3Pt. Contested by Myles Haliburton (3.5 feet, MAN). Tyler Griffin misses. Rebound secured by Jimmy Brogdon.

[04:21] Team_028 possession (Score: 12-13)
FOUL! Offensive foul on Kawhi Ball! Pau LaVine drew the charge! [Team fouls: 1] (Kawhi Ball: 1 personal fouls) TURNOVER! (dead ball)

[04:07] Team_100 possession (Score: 12-13)
Manu Ball drives and kicks out. Luka Green attempts a 3Pt. Heavily contested by Austin Russell (1.4 feet, ZONE)! Luka Green misses. Offensive rebound by Pau LaVine! Pau LaVine kicks it out.

[03:54] Team_100 possession (Score: 12-13)
Tyler Griffin attempts a 3Pt. Contested by Myles Haliburton (5.9 feet, MAN). Tyler Griffin misses. Offensive rebound by Chris Mobley! Chris Mobley kicks it out.

[03:41] Team_100 possession (Score: 12-13)
Manu Ball attempts a 3Pt. Contested by Austin Russell (2.1 feet, ZONE). MANU BALL MAKES IT! Assist: Luka Green
Score: 12-16

[03:27] Team_028 possession (Score: 12-16)
Jimmy Brogdon drives and kicks out. Myles Haliburton attempts a Midrange. Wide open! Tyler Griffin is 6.2 feet away. [MAN] MYLES HALIBURTON MAKES IT! Assist: Kawhi Ball
Score: 14-16

[03:14] Team_100 possession (Score: 14-16)
Tyler Griffin drives to the basket... Tyler Griffin throws a bad pass! Stolen by Myles Haliburton! TURNOVER! (live ball)

[02:59] Team_028 possession (Score: 14-16)
Austin Russell attempts a 3Pt. Contested by Tyler Griffin (5.5 feet, ZONE). AUSTIN RUSSELL MAKES IT! Assist: Myles Haliburton
Score: 17-16

[02:43] Team_100 possession (Score: 17-16)
Manu Ball attempts a 3Pt. Wide open! Carmelo Carter is 6.1 feet away. [MAN] Manu Ball misses. Rebound secured by Kawhi Ball.

[02:28] Team_028 possession (Score: 17-16)
Carmelo Carter attempts a Midrange. Contested by Pau LaVine (3.5 feet, ZONE). Carmelo Carter misses. Offensive rebound by Kawhi Ball! Kawhi Ball kicks it out.

[02:14] Team_028 possession (Score: 17-16)
Myles Haliburton attempts a 3Pt. Wide open! Luka Green is 6.5 feet away. [ZONE] Myles Haliburton misses. Offensive rebound by Jimmy Brogdon! Jimmy Brogdon kicks it out.

[01:56] Team_028 possession (Score: 17-16)
Myles Haliburton makes the Layup and draws the foul on Tyler Griffin! And-1! Myles Haliburton to the line for 1. [Team fouls: 4] (Tyler Griffin: 1 personal fouls)   FT 1/1: GOOD Myles Haliburton makes 1/1 from the line.
Score: 20-16

[01:41] Team_100 possession (Score: 20-16)
Chris Mobley drives and kicks out. Chris Mobley attempts a 3Pt. Contested by Jimmy Brogdon (5.1 feet, MAN). CHRIS MOBLEY MAKES IT! Assist: Pau LaVine
Score: 20-19

[01:27] Team_028 possession (Score: 20-19)
Austin Russell attempts a 3Pt. Contested by Luka Green (5.2 feet, MAN). AUSTIN RUSSELL MAKES IT! Assist: Jimmy Brogdon
Score: 23-19

[01:13] Team_100 possession (Score: 23-19)
Tyler Griffin attempts a 3Pt. Contested by Austin Russell (3.0 feet, ZONE). TYLER GRIFFIN MAKES IT! Assist: Chris Mobley
Score: 23-22

[00:59] Team_028 possession (Score: 23-22)
Myles Haliburton attempts a 3Pt. Contested by Tyler Griffin (3.4 feet, MAN). Myles Haliburton misses. Offensive rebound by Kawhi Ball! Kawhi Ball kicks it out.

[00:44] Team_028 possession (Score: 23-22)
Jimmy Brogdon makes the Midrange and draws the foul on Pau LaVine! And-1! Jimmy Brogdon to the line for 1. [BONUS: 5 team fouls] (Pau LaVine: 1 personal fouls)   FT 1/1: MISS Jimmy Brogdon makes 0/1 from the line. Rebound secured by Pau LaVine.
Score: 25-22

[00:31] Team_100 possession (Score: 25-22)
Chris Mobley attempts a Midrange. Wide open! Jimmy Brogdon is 7.0 feet away. [MAN] Chris Mobley misses. Rebound secured by Carmelo Carter.

[00:14] Team_028 possession (Score: 25-22)
Jimmy Brogdon drives to the basket... Jimmy Brogdon throws a bad pass out of bounds! TURNOVER! (dead ball)

[00:14] Substitution (Team_028): Austin Russell OUT → Scottie Ingram IN (stamina_rule2)

[00:14] Substitution (Team_028): Carmelo Carter OUT → Tyrese Quickley IN (stamina_rule2)

[00:14] Substitution (Team_028): Myles Haliburton OUT → Miles Booker IN (stamina_rule2)

[00:14] Substitution (Team_028): Kawhi Ball OUT → Bam Towns IN (stamina_rule2)

[00:14] Substitution (Team_028): Jimmy Brogdon OUT → Collin Bridges IN (stamina_rule2)

[00:14] Substitution (Team_100): Luka Green OUT → Dirk Sabonis IN (stamina_rule2)

[00:14] Substitution (Team_100): Manu Ball OUT → Evan Butler IN (stamina_rule2)

[00:14] Substitution (Team_100): Tyler Griffin OUT → Tyrese Wade IN (stamina_rule2)

[00:14] Substitution (Team_100): Pau LaVine OUT → Carmelo Ginobili IN (stamina_rule2)

[00:14] Substitution (Team_100): Chris Mobley OUT → John Rozier IN (stamina_rule2)

================================================================================
                              1ST QUARTER COMPLETE                              
================================================================================

1ST QUARTER SCORE: Team_028 25, Team_100 22

BOX SCORE:
================================================================================

Team_028
--------------------------------------------------------------------------------
Player                MIN  PTS  REB  AST  TO      FG   FG%      3P   3P%
--------------------------------------------------------------------------------
Myles Haliburton       12    8    0    1   0   3/4    75.0     0/0   0.0
Austin Russell         12    7    0    2   0   3/3   100.0     0/0   0.0
Kawhi Ball             12    5    7    1   0   2/3    66.7     0/0   0.0
Carmelo Carter         12    3    3    0   0   1/1   100.0     0/0   0.0
Jimmy Brogdon          12    0    5    1   0   0/2     0.0     0/0   0.0

TEAM: FG: 9/13 (69.2%), 3PT: 3/4 (75.0%), REB: 15 (7 off, 8 def), AST: 5, TO: 7
TEAM FOULS: 1


Team_100
--------------------------------------------------------------------------------
Player                MIN  PTS  REB  AST  TO      FG   FG%      3P   3P%
--------------------------------------------------------------------------------
Manu Ball              12    8    0    0   0   3/5    60.0     0/0   0.0
Tyler Griffin          12    7    0    0   0   3/6    50.0     0/0   0.0
Chris Mobley           12    3    1    3   0   1/2    50.0     0/0   0.0
Pau LaVine             12    2    5    2   0   1/2    50.0     0/0   0.0
Luka Green             12    2    0    2   0   1/2    50.0     0/0   0.0

TEAM: FG: 9/17 (52.9%), 3PT: 2/7 (28.6%), REB: 6 (2 off, 4 def), AST: 7, TO: 2
TEAM FOULS: 5 [Team_028 in BONUS]

================================================================================

================================================================================
                       2ND QUARTER - Team_028 vs Team_100                       
================================================================================

[12:00] Team_028 possession (Score: 25-22)
Austin Russell attempts a Midrange. Wide open! Luka Green is 8.5 feet away. [MAN] AUSTIN RUSSELL MAKES IT! Assist: Carmelo Carter
Score: 27-22

[11:48] Team_100 possession (Score: 27-22)
Manu Ball attempts a 3Pt. Contested by Austin Russell (4.0 feet, ZONE). MANU BALL MAKES IT! Assist: Pau LaVine
Score: 27-25

[11:30] Team_028 possession (Score: 27-25)
Austin Russell attempts a 3Pt. Wide open! Luka Green is 6.5 feet away. [MAN] AUSTIN RUSSELL MAKES IT! Assist: Kawhi Ball
Score: 30-25

[11:12] Team_100 possession (Score: 30-25)
Chris Mobley attempts a Layup. Wide open! Kawhi Ball is 6.6 feet away. [ZONE] Chris Mobley misses. Offensive rebound by Pau LaVine! Pau LaVine kicks it out.

[10:57] Team_100 possession (Score: 30-25)
Chris Mobley attempts a 3Pt. Contested by Austin Russell (3.9 feet, ZONE). Chris Mobley misses. Rebound secured by Kawhi Ball.

[10:45] Team_028 possession (Score: 30-25)
Kawhi Ball attempts a 3Pt. Contested by Pau LaVine (3.2 feet, MAN). Kawhi Ball misses. Rebound secured by Tyler Griffin.

[10:27] Team_100 possession (Score: 30-25)
Manu Ball attempts a Midrange. Contested by Carmelo Carter (2.5 feet, MAN). Manu Ball misses. Rebound secured by Jimmy Brogdon.

[10:17] Team_028 possession (Score: 30-25)
Carmelo Carter drives to the basket... Carmelo Carter throws a bad pass! Stolen by Pau LaVine! TURNOVER! (live ball)

[10:02] Team_100 possession (Score: 30-25)
FOUL! Shooting foul on Kawhi Ball. Luka Green to the line for 2 free throws. [Team fouls: 1] (Kawhi Ball: 1 personal fouls)   FT 1/2: GOOD   FT 2/2: GOOD Luka Green makes 2/2 from the line.
Score: 30-27

[09:50] Team_028 possession (Score: 30-27)
Jimmy Brogdon attempts a Midrange. Contested by Chris Mobley (4.5 feet, MAN). JIMMY BROGDON MAKES IT! Assist: Austin Russell
Score: 32-27

[09:37] Team_100 possession (Score: 32-27)
Pau LaVine attempts a Midrange. Contested by Kawhi Ball (4.1 feet, MAN). PAU LAVINE MAKES IT! Assist: Luka Green
Score: 32-29

[09:18] Team_028 possession (Score: 32-29)
Kawhi Ball attempts a 3Pt. Wide open! Luka Green is 6.8 feet away. [ZONE] Kawhi Ball misses. Rebound secured by Chris Mobley.

[09:01] Team_100 possession (Score: 32-29)
FOUL! Reach-in foul on Jimmy Brogdon during the drive. [Team fouls: 2] No free throws, side out. (Jimmy Brogdon: 1 personal fouls)

[08:47] Team_100 possession (Score: 32-29)
Tyler Griffin attempts a Midrange. Contested by Myles Haliburton (4.3 feet, MAN). TYLER GRIFFIN MAKES IT! Assist: Chris Mobley
Score: 32-31

[08:37] Team_028 possession (Score: 32-31)
Myles Haliburton drives and kicks out. Carmelo Carter attempts a 3Pt. Wide open! Luka Green is 6.7 feet away. [ZONE] Carmelo Carter misses. Rebound secured by Pau LaVine.

[08:26] Team_100 possession (Score: 32-31)
Tyler Griffin attempts a Midrange. Contested by Myles Haliburton (4.2 feet, ZONE). Tyler Griffin misses. Rebound secured by Kawhi Ball.

[08:09] Team_028 possession (Score: 32-31)
Myles Haliburton attempts a 3Pt. Contested by Luka Green (3.2 feet, ZONE). Myles Haliburton misses. Offensive rebound by Kawhi Ball! Kawhi Ball kicks it out.

[07:49] Team_028 possession (Score: 32-31)
Myles Haliburton attempts a Layup. Contested by Tyler Griffin (5.9 feet, MAN). Myles Haliburton misses. FOUL! Loose ball foul on Chris Mobley during the rebound battle. [Team fouls: 1] No free throws, side out. (Chris Mobley: 1 personal fouls)

[07:36] Team_028 possession (Score: 32-31)
Kawhi Ball attempts a Layup. Wide open! Chris Mobley is 7.8 feet away. [ZONE] Kawhi Ball misses. Offensive rebound by Jimmy Brogdon! Jimmy Brogdon kicks it out.

[07:20] Team_028 possession (Score: 32-31)
Austin Russell attempts a Layup. Wide open! Pau LaVine is 6.5 feet away. [ZONE] Austin Russell misses. Offensive rebound by Jimmy Brogdon! Jimmy Brogdon kicks it out.

[07:07] Team_028 possession (Score: 32-31)
Carmelo Carter attempts a Layup. Wide open! Pau LaVine is 9.0 feet away. [ZONE] Carmelo Carter misses. Rebound secured by Chris Mobley.

[06:53] Team_100 possession (Score: 32-31)
Pau LaVine drives, Kawhi Ball stays with him. Pau LaVine attempts a Layup. Contested by Kawhi Ball (4.1 feet, MAN). PAU LAVINE MAKES IT! Assist: Tyler Griffin
Score: 32-33

[06:39] Team_028 possession (Score: 32-33)
Kawhi Ball makes the Dunk and draws the foul on Pau LaVine! And-1! Kawhi Ball to the line for 1. [Team fouls: 2] (Pau LaVine: 1 personal fouls)   FT 1/1: GOOD Kawhi Ball makes 1/1 from the line.
Score: 35-33

[06:27] Team_100 possession (Score: 35-33)
Manu Ball attempts a 3Pt. Wide open! Austin Russell is 7.0 feet away. [ZONE] MANU BALL MAKES IT!
Score: 35-36

[06:12] Team_028 possession (Score: 35-36)
Jimmy Brogdon attempts a Layup. Wide open! Chris Mobley is 7.4 feet away. [MAN] JIMMY BROGDON MAKES IT!
Score: 37-36

[05:56] Team_100 possession (Score: 37-36)
FOUL! Offensive foul on Tyler Griffin! Myles Haliburton drew the charge! [Team fouls: 3] (Tyler Griffin: 1 personal fouls) TURNOVER! (dead ball)

[05:43] Team_028 possession (Score: 37-36)
FOUL! Shooting foul on Tyler Griffin. Myles Haliburton to the line for 2 free throws. [Team fouls: 4] (Tyler Griffin: 2 personal fouls)   FT 1/2: GOOD   FT 2/2: MISS Myles Haliburton makes 1/2 from the line. Rebound secured by Chris Mobley.
Score: 38-36

[05:29] Team_100 possession (Score: 38-36)
Luka Green attempts a 3Pt. Contested by Kawhi Ball (4.5 feet, ZONE). Luka Green misses. Rebound secured by Jimmy Brogdon.

[05:18] Team_028 possession (Score: 38-36)
Austin Russell attempts a 3Pt. Contested by Luka Green (4.9 feet, MAN). Austin Russell misses. Rebound secured by Chris Mobley.

[05:00] Team_100 possession (Score: 38-36)
Manu Ball drives, Carmelo Carter stays with him. Manu Ball attempts a Dunk. Contested by Carmelo Carter (5.0 feet, MAN). MANU BALL MAKES IT!
Score: 38-38

[04:42] Team_028 possession (Score: 38-38)
Austin Russell attempts a Midrange. Contested by Luka Green (5.9 feet, MAN). Austin Russell misses. Rebound secured by Pau LaVine.

[04:31] Team_100 possession (Score: 38-38)
Chris Mobley attempts a 3Pt. Wide open! Jimmy Brogdon is 9.0 feet away. [MAN] CHRIS MOBLEY MAKES IT! Assist: Manu Ball
Score: 38-41

[04:16] Team_028 possession (Score: 38-41)
Austin Russell attempts a 3Pt. Contested by Luka Green (4.6 feet, ZONE). Austin Russell misses. Rebound secured by Pau LaVine.

[04:01] Team_100 possession (Score: 38-41)
Chris Mobley attempts a Layup. Wide open! Kawhi Ball is 9.6 feet away. [ZONE] CHRIS MOBLEY MAKES IT! Assist: Pau LaVine
Score: 38-43

[03:42] Team_028 possession (Score: 38-43)
Myles Haliburton makes the 3Pt and draws the foul on Tyler Griffin! And-1! Myles Haliburton to the line for 1. [BONUS: 5 team fouls] (Tyler Griffin: 3 personal fouls)   FT 1/1: GOOD Myles Haliburton makes 1/1 from the line.
Score: 42-43

[03:28] Team_100 possession (Score: 42-43)
Tyler Griffin drives and kicks out. Tyler Griffin attempts a Midrange. Wide open! Myles Haliburton is 7.5 feet away. [ZONE] TYLER GRIFFIN MAKES IT!
Score: 42-45

[03:14] Team_028 possession (Score: 42-45)
Austin Russell attempts a Midrange. Contested by Tyler Griffin (4.8 feet, ZONE). Austin Russell misses. Offensive rebound by Kawhi Ball! Kawhi Ball kicks it out.

[02:55] Team_028 possession (Score: 42-45)
Carmelo Carter attempts a Layup. Wide open! Pau LaVine is 8.5 feet away. [ZONE] CARMELO CARTER MAKES IT!
Score: 44-45

[02:43] Team_100 possession (Score: 44-45)
Chris Mobley attempts a 3Pt. Contested by Austin Russell (6.0 feet, ZONE). Chris Mobley misses. Rebound secured by Carmelo Carter.

[02:25] Team_028 possession (Score: 44-45)
Kawhi Ball attempts a Layup. Contested by Pau LaVine (3.0 feet, MAN). KAWHI BALL MAKES IT!
Score: 46-45

[02:06] Team_100 possession (Score: 46-45)
Chris Mobley drives to the basket... FOUL! Offensive foul on Chris Mobley! Jimmy Brogdon drew the charge! [Team fouls: 6] (Chris Mobley: 2 personal fouls) TURNOVER! (dead ball)

[01:53] Team_028 possession (Score: 46-45)
Kawhi Ball drives and kicks out. Austin Russell attempts a 3Pt. Wide open! Luka Green is 10.0 feet away. [MAN] Austin Russell misses. Rebound secured by Tyler Griffin.

[01:37] Team_100 possession (Score: 46-45)
Manu Ball attempts a 3Pt. Wide open! Carmelo Carter is 7.1 feet away. [MAN] Manu Ball misses. Offensive rebound by Chris Mobley! Chris Mobley kicks it out.

[01:22] Team_100 possession (Score: 46-45)
Luka Green attempts a 3Pt. Contested by Austin Russell (2.4 feet, ZONE). LUKA GREEN MAKES IT! Assist: Tyler Griffin
Score: 46-48

[01:06] Team_028 possession (Score: 46-48)
Austin Russell attempts a 3Pt. Wide open! Tyler Griffin is 8.0 feet away. [ZONE] AUSTIN RUSSELL MAKES IT! Assist: Myles Haliburton
Score: 49-48

[00:53] Team_100 possession (Score: 49-48)
Tyler Griffin attempts a 3Pt. Contested by Austin Russell (4.6 feet, ZONE). Tyler Griffin misses. Rebound secured by Jimmy Brogdon.

[00:38] Team_028 possession (Score: 49-48)
Austin Russell attempts a 3Pt. Wide open! Luka Green is 9.0 feet away. [ZONE] Austin Russell misses. Offensive rebound by Kawhi Ball! Kawhi Ball kicks it out.

[00:26] Team_028 possession (Score: 49-48)
Jimmy Brogdon attempts a Layup. BLOCKED BY PAU LAVINE! Ball is loose! Offensive rebound by Kawhi Ball! Kawhi Ball kicks it out.

[00:13] Team_028 possession (Score: 49-48)
Jimmy Brogdon drives, Chris Mobley stays with him. Jimmy Brogdon attempts a Dunk. Wide open! Chris Mobley is 8.5 feet away. [MAN] JIMMY BROGDON MAKES IT! Assist: Austin Russell
Score: 51-48

================================================================================
                              2ND QUARTER COMPLETE                              
================================================================================

2ND QUARTER SCORE: Team_028 26, Team_100 26

BOX SCORE:
================================================================================

Team_028
--------------------------------------------------------------------------------
Player                MIN  PTS  REB  AST  TO      FG   FG%      3P   3P%
--------------------------------------------------------------------------------
Austin Russell         24    8    0    2   0   3/6    50.0     0/0   0.0
Jimmy Brogdon          24    6    6    0   0   3/3   100.0     0/0   0.0
Kawhi Ball             24    5    6    1   0   2/5    40.0     0/0   0.0
Myles Haliburton       24    4    0    1   0   1/3    33.3     0/0   0.0
Carmelo Carter         24    2    1    1   0   1/2    50.0     0/0   0.0

TEAM: FG: 10/19 (52.6%), 3PT: 3/7 (42.9%), REB: 13 (7 off, 6 def), AST: 5, TO: 1
TEAM FOULS: 2


Team_100
--------------------------------------------------------------------------------
Player                MIN  PTS  REB  AST  TO      FG   FG%      3P   3P%
--------------------------------------------------------------------------------
Manu Ball              24    8    0    1   0   3/4    75.0     0/0   0.0
Chris Mobley           24    5    5    1   0   2/4    50.0     0/0   0.0
Luka Green             24    5    0    1   0   2/3    66.7     0/0   0.0
Pau LaVine             24    4    4    2   0   2/2   100.0     0/0   0.0
Tyler Griffin          24    4    2    2   0   2/4    50.0     0/0   0.0

TEAM: FG: 11/17 (64.7%), 3PT: 4/8 (50.0%), REB: 11 (2 off, 9 def), AST: 7, TO: 2
TEAM FOULS: 6 [Team_028 in BONUS]

================================================================================

================================================================================
                       3RD QUARTER - Team_028 vs Team_100                       
================================================================================

[12:00] Team_028 possession (Score: 51-48)
Kawhi Ball attempts a 3Pt. Contested by Luka Green (3.3 feet, ZONE). Kawhi Ball misses. Rebound secured by Tyler Griffin.

[11:49] Team_100 possession (Score: 51-48)
Manu Ball attempts a 3Pt. Heavily contested by Carmelo Carter (0.5 feet, MAN)! Manu Ball misses. Rebound secured by Carmelo Carter.

[11:33] Team_028 possession (Score: 51-48)
Austin Russell loses control! Ball rolls out of bounds! TURNOVER! (dead ball)

[11:22] Team_100 possession (Score: 51-48)
Tyler Griffin drives, Myles Haliburton stays with him. Tyler Griffin attempts a Layup. Contested by Myles Haliburton (2.2 feet, MAN). TYLER GRIFFIN MAKES IT! Assist: Luka Green
Score: 51-50

[11:05] Team_028 possession (Score: 51-50)
Kawhi Ball makes the Dunk and draws the foul on Pau LaVine! And-1! Kawhi Ball to the line for 1. [Team fouls: 1] (Pau LaVine: 1 personal fouls)   FT 1/1: GOOD Kawhi Ball makes 1/1 from the line.
Score: 54-50

[10:50] Team_100 possession (Score: 54-50)
Pau LaVine attempts a Layup. Heavily contested by Kawhi Ball (1.3 feet, ZONE)! Pau LaVine misses. Rebound secured by Kawhi Ball.

[10:35] Team_028 possession (Score: 54-50)
Myles Haliburton attempts a Layup. Contested by Pau LaVine (5.9 feet, ZONE). MYLES HALIBURTON MAKES IT!
Score: 56-50

[10:21] Team_100 possession (Score: 56-50)
Pau LaVine attempts a 3Pt. Contested by Austin Russell (3.6 feet, ZONE). PAU LAVINE MAKES IT! Assist: Tyler Griffin
Score: 56-53

[10:07] Team_028 possession (Score: 56-53)
FOUL! Offensive foul on Carmelo Carter! Manu Ball drew the charge! [Team fouls: 1] (Carmelo Carter: 1 personal fouls) TURNOVER! (dead ball)

[09:52] Team_100 possession (Score: 56-53)
FOUL! Offensive foul on Chris Mobley! Jimmy Brogdon drew the charge! [Team fouls: 2] (Chris Mobley: 1 personal fouls) TURNOVER! (dead ball)

[09:35] Team_028 possession (Score: 56-53)
Kawhi Ball attempts a 3Pt. Wide open! Pau LaVine is 6.6 feet away. [ZONE] KAWHI BALL MAKES IT! Assist: Austin Russell
Score: 59-53

[09:19] Team_100 possession (Score: 59-53)
Luka Green drives and kicks out. Chris Mobley attempts a 3Pt. Contested by Jimmy Brogdon (6.0 feet, MAN). Chris Mobley misses. Offensive rebound by Pau LaVine! Pau LaVine kicks it out.

[09:09] Team_100 possession (Score: 59-53)
Luka Green drives, picks up Austin Russell. Help arrives from Carmelo Carter! Luka Green attempts a Layup. Contested by Carmelo Carter (5.6 feet, MAN). LUKA GREEN MAKES IT! Assist: Tyler Griffin
Score: 59-55

[08:52] Team_028 possession (Score: 59-55)
Myles Haliburton throws a bad pass! Stolen by Tyler Griffin! TURNOVER! (live ball)

[08:41] Team_100 possession (Score: 59-55)
Pau LaVine attempts a Midrange. Heavily contested by Myles Haliburton (1.1 feet, ZONE)! PAU LAVINE MAKES IT! Assist: Tyler Griffin
Score: 59-57

[08:25] Team_028 possession (Score: 59-57)
Jimmy Brogdon drives and kicks out. Austin Russell attempts a Midrange. Wide open! Luka Green is 8.4 feet away. [MAN] Austin Russell misses. Rebound secured by Pau LaVine.

[08:09] Team_100 possession (Score: 59-57)
Tyler Griffin drives, picks up Jimmy Brogdon. Help arrives from Carmelo Carter! Tyler Griffin attempts a Dunk. Contested by Carmelo Carter (4.3 feet, ZONE). Tyler Griffin misses. Rebound secured by Carmelo Carter.

[07:56] Team_028 possession (Score: 59-57)
Jimmy Brogdon attempts a Midrange. Contested by Chris Mobley (4.8 feet, MAN). Jimmy Brogdon misses. Offensive rebound by Kawhi Ball! Kawhi Ball kicks it out.

[07:40] Team_028 possession (Score: 59-57)
Myles Haliburton attempts a 3Pt. Contested by Tyler Griffin (5.8 feet, MAN). MYLES HALIBURTON MAKES IT! Assist: Carmelo Carter
Score: 62-57

[07:29] Team_100 possession (Score: 62-57)
Luka Green attempts a 3Pt. Wide open! Austin Russell is 6.4 feet away. [ZONE] Luka Green misses. Rebound secured by Kawhi Ball.

[07:10] Team_028 possession (Score: 62-57)
Carmelo Carter attempts a Layup. Contested by Manu Ball (5.6 feet, MAN). Carmelo Carter misses. Rebound secured by Chris Mobley.

[06:56] Team_100 possession (Score: 62-57)
FOUL! Shooting foul on Carmelo Carter. Chris Mobley to the line for 2 free throws. [Team fouls: 2] (Carmelo Carter: 2 personal fouls)   FT 1/2: MISS   FT 2/2: MISS Chris Mobley makes 0/2 from the line. Rebound secured by Jimmy Brogdon.

[06:41] Team_028 possession (Score: 62-57)
Austin Russell drives, picks up Pau LaVine. Help arrives from Manu Ball! Austin Russell attempts a Dunk. Wide open! Manu Ball is 8.4 feet away. [ZONE] Austin Russell misses. Rebound secured by Pau LaVine.

[06:24] Team_100 possession (Score: 62-57)
FOUL! Reach-in foul on Kawhi Ball during the drive. [Team fouls: 3] No free throws, side out. (Kawhi Ball: 1 personal fouls)

[06:05] Team_100 possession (Score: 62-57)
FOUL! Shooting foul on Kawhi Ball. Manu Ball to the line for 2 free throws. [Team fouls: 4] (Kawhi Ball: 2 personal fouls)   FT 1/2: MISS   FT 2/2: GOOD Manu Ball makes 1/2 from the line.
Score: 62-58

[05:49] Team_028 possession (Score: 62-58)
FOUL! Reach-in foul on Chris Mobley during the drive. [Team fouls: 3] No free throws, side out. (Chris Mobley: 2 personal fouls)

[05:37] Team_028 possession (Score: 62-58)
Kawhi Ball attempts a Layup. Wide open! Pau LaVine is 8.9 feet away. [MAN] KAWHI BALL MAKES IT!
Score: 64-58

[05:24] Team_100 possession (Score: 64-58)
Tyler Griffin attempts a 3Pt. Contested by Austin Russell (4.7 feet, ZONE). Tyler Griffin misses. Rebound secured by Kawhi Ball.

[05:09] Team_028 possession (Score: 64-58)
Kawhi Ball attempts a 3Pt. Contested by Pau LaVine (2.7 feet, ZONE). Kawhi Ball misses. Rebound secured by Tyler Griffin.

[04:55] Team_100 possession (Score: 64-58)
FOUL! Reach-in foul on Kawhi Ball during the drive. [IN THE BONUS! 5 team fouls] Manu Ball to the line for 2 free throws. (Kawhi Ball: 3 personal fouls)   FT 1/2: MISS   FT 2/2: GOOD Manu Ball makes 1/2 from the line.
Score: 64-59

[04:41] Team_028 possession (Score: 64-59)
FOUL! Holding foul on Chris Mobley. [Team fouls: 4] No free throws, side out. (Chris Mobley: 3 personal fouls)

[04:25] Team_028 possession (Score: 64-59)
Myles Haliburton attempts a Midrange. Wide open! Tyler Griffin is 6.3 feet away. [MAN] Myles Haliburton misses. Rebound secured by Chris Mobley.

[04:15] Team_100 possession (Score: 64-59)
Luka Green attempts a Midrange. Heavily contested by Kawhi Ball (2.0 feet, ZONE)! Luka Green misses. Rebound secured by Jimmy Brogdon.

[03:58] Team_028 possession (Score: 64-59)
Carmelo Carter attempts a Midrange. Wide open! Manu Ball is 8.3 feet away. [MAN] CARMELO CARTER MAKES IT!
Score: 66-59

[03:42] Team_100 possession (Score: 66-59)
FOUL! Reach-in foul on Jimmy Brogdon during the drive. [IN THE BONUS! 6 team fouls] Chris Mobley to the line for 2 free throws. (Jimmy Brogdon: 1 personal fouls)   FT 1/2: MISS   FT 2/2: GOOD Chris Mobley makes 1/2 from the line.
Score: 66-60

[03:26] Team_028 possession (Score: 66-60)
Myles Haliburton drives to the basket... Myles Haliburton loses control! Ball rolls out of bounds! TURNOVER! (dead ball)

[03:26] Substitution (Team_100): Chris Mobley OUT → John Rozier IN (stamina_rule2)

[03:13] Team_100 possession (Score: 66-60)
Manu Ball drives to the basket... Manu Ball throws a bad pass! Stolen by Jimmy Brogdon! TURNOVER! (live ball)

[03:03] Team_028 possession (Score: 66-60)
Jimmy Brogdon attempts a 3Pt. Wide open! Luka Green is 8.5 feet away. [ZONE] JIMMY BROGDON MAKES IT! Assist: Kawhi Ball
Score: 69-60

[02:51] Team_100 possession (Score: 69-60)
Manu Ball attempts a 3Pt. Contested by Carmelo Carter (4.9 feet, MAN). Manu Ball misses. FOUL! Loose ball foul on Kawhi Ball during the rebound battle. [IN THE BONUS! 7 team fouls] John Rozier to the line for 2 free throws. (Kawhi Ball: 4 personal fouls)   FT 1/2: MISS   FT 2/2: MISS John Rozier makes 0/2 from the line. Rebound secured by Jimmy Brogdon.

[02:37] Team_028 possession (Score: 69-60)
Austin Russell drives, John Rozier stays with him. Austin Russell attempts a Layup. Contested by John Rozier (5.0 feet, ZONE). AUSTIN RUSSELL MAKES IT!
Score: 71-60

[02:20] Team_100 possession (Score: 71-60)
Manu Ball attempts a 3Pt. Contested by Austin Russell (5.2 feet, ZONE). MANU BALL MAKES IT! Assist: Pau LaVine
Score: 71-63

[02:07] Team_028 possession (Score: 71-63)
Jimmy Brogdon attempts a Midrange. Contested by John Rozier (5.2 feet, MAN). Jimmy Brogdon misses. Rebound secured by Pau LaVine.

[01:54] Team_100 possession (Score: 71-63)
John Rozier attempts a Midrange. Contested by Myles Haliburton (4.0 feet, ZONE). JOHN ROZIER MAKES IT! Assist: Pau LaVine
Score: 71-65

[01:38] Team_028 possession (Score: 71-65)
Austin Russell drives, Luka Green stays with him. Austin Russell attempts a Layup. Contested by Luka Green (5.2 feet, MAN). AUSTIN RUSSELL MAKES IT!
Score: 73-65

[01:24] Team_100 possession (Score: 73-65)
Tyler Griffin attempts a 3Pt. Contested by Austin Russell (3.7 feet, ZONE). Tyler Griffin misses. Rebound secured by Jimmy Brogdon.

[01:11] Team_028 possession (Score: 73-65)
Carmelo Carter attempts a Layup. Contested by John Rozier (2.4 feet, ZONE). Carmelo Carter misses. Rebound secured by Tyler Griffin.

[00:57] Team_100 possession (Score: 73-65)
Manu Ball drives, Kawhi Ball stays with him. Manu Ball attempts a Layup. Contested by Kawhi Ball (2.9 feet, ZONE). Manu Ball misses. Offensive rebound by Pau LaVine! Pau LaVine kicks it out.

[00:42] Team_100 possession (Score: 73-65)
John Rozier attempts a Layup. Contested by Kawhi Ball (4.4 feet, ZONE). JOHN ROZIER MAKES IT!
Score: 73-67

[00:27] Team_028 possession (Score: 73-67)
FOUL! Shooting foul on Luka Green. Myles Haliburton to the line for 3 free throws. [BONUS: 5 team fouls] (Luka Green: 1 personal fouls)   FT 1/3: MISS   FT 2/3: GOOD   FT 3/3: GOOD Myles Haliburton makes 2/3 from the line.
Score: 75-67

[00:10] Team_100 possession (Score: 75-67)
John Rozier attempts a Midrange. Wide open! Kawhi Ball is 7.3 feet away. [ZONE] JOHN ROZIER MAKES IT!
Score: 75-69

================================================================================
                              3RD QUARTER COMPLETE                              
================================================================================

3RD QUARTER SCORE: Team_028 24, Team_100 21

BOX SCORE:
================================================================================

Team_028
--------------------------------------------------------------------------------
Player                MIN  PTS  REB  AST  TO      FG   FG%      3P   3P%
--------------------------------------------------------------------------------
Kawhi Ball             36    8    4    1   0   3/5    60.0     0/0   0.0
Myles Haliburton       36    7    0    0   0   3/4    75.0     0/0   0.0
Austin Russell         36    4    0    1   0   2/3    66.7     0/0   0.0
Jimmy Brogdon          36    3    4    0   0   1/3    33.3     0/0   0.0
Carmelo Carter         36    2    2    1   0   1/3    33.3     0/0   0.0

TEAM: FG: 10/18 (55.6%), 3PT: 4/6 (66.7%), REB: 9 (1 off, 8 def), AST: 3, TO: 4
TEAM FOULS: 7 [Team_100 in BONUS]


Team_100
--------------------------------------------------------------------------------
Player                MIN  PTS  REB  AST  TO      FG   FG%      3P   3P%
--------------------------------------------------------------------------------
John Rozier             3    6    0    0   0   3/3   100.0     0/0   0.0
Manu Ball              36    5    0    0   0   3/5    60.0     0/0   0.0
Pau LaVine             36    5    5    2   0   2/3    66.7     0/0   0.0
Tyler Griffin          36    2    3    3   0   1/4    25.0     0/0   0.0
Luka Green             36    2    0    1   0   1/3    33.3     0/0   0.0
Chris Mobley           33    1    2    0   0   1/2    50.0     0/0   0.0

TEAM: FG: 11/20 (55.0%), 3PT: 2/7 (28.6%), REB: 11 (3 off, 8 def), AST: 6, TO: 2
TEAM FOULS: 5 [Team_028 in BONUS]

================================================================================

================================================================================
                       4TH QUARTER - Team_028 vs Team_100                       
================================================================================

[12:00] Substitution (Team_028): Austin Russell OUT → Scottie Ingram IN (stamina_rule2)

[12:00] Substitution (Team_028): Carmelo Carter OUT → Tyrese Quickley IN (stamina_rule2)

[12:00] Substitution (Team_028): Kawhi Ball OUT → Bam Towns IN (stamina_rule2)

[12:00] Substitution (Team_028): Jimmy Brogdon OUT → Collin Bridges IN (stamina_rule2)

[12:00] Substitution (Team_100): Manu Ball OUT → Evan Butler IN (stamina_rule2)

[12:00] Substitution (Team_100): Tyler Griffin OUT → Tyrese Wade IN (stamina_rule2)

[12:00] Substitution (Team_100): Pau LaVine OUT → Carmelo Ginobili IN (stamina_rule2)

[12:00] Team_028 possession (Score: 75-69)
Austin Russell drives to the basket... Austin Russell throws a bad pass out of bounds! TURNOVER! (dead ball)

[11:45] Team_100 possession (Score: 75-69)
Chris Mobley attempts a Layup. Wide open! Bam Towns is 7.1 feet away. [ZONE] Chris Mobley misses. FOUL! Loose ball foul on Bam Towns during the rebound battle. [Team fouls: 1] No free throws, side out. (Bam Towns: 1 personal fouls)

[11:34] Team_100 possession (Score: 75-69)
Luka Green attempts a 3Pt. Wide open! Scottie Ingram is 6.5 feet away. [MAN] Luka Green misses. Rebound secured by Bam Towns.

[11:21] Team_028 possession (Score: 75-69)
FOUL! Shooting foul on Carmelo Ginobili. Bam Towns to the line for 2 free throws. [Team fouls: 1] (Carmelo Ginobili: 1 personal fouls)   FT 1/2: GOOD   FT 2/2: GOOD Bam Towns makes 2/2 from the line.
Score: 77-69

[11:06] Team_100 possession (Score: 77-69)
Tyrese Wade attempts a 3Pt. Contested by Myles Haliburton (4.3 feet, MAN). TYRESE WADE MAKES IT! Assist: Carmelo Ginobili
Score: 77-72

[10:53] Team_028 possession (Score: 77-72)
Tyrese Quickley drives and kicks out. Myles Haliburton attempts a Midrange. Wide open! Luka Green is 9.7 feet away. [ZONE] MYLES HALIBURTON MAKES IT!
Score: 79-72

[10:36] Team_100 possession (Score: 79-72)
Chris Mobley makes the Layup and draws the foul on Collin Bridges! And-1! Chris Mobley to the line for 1. [Team fouls: 2] (Collin Bridges: 1 personal fouls)   FT 1/1: GOOD Chris Mobley makes 1/1 from the line.
Score: 79-75

[10:18] Team_028 possession (Score: 79-75)
Scottie Ingram attempts a Midrange. Contested by Evan Butler (2.4 feet, ZONE). SCOTTIE INGRAM MAKES IT! Assist: Bam Towns
Score: 81-75

[10:06] Team_100 possession (Score: 81-75)
Luka Green attempts a 3Pt. Contested by Bam Towns (2.4 feet, ZONE). LUKA GREEN MAKES IT! Assist: Carmelo Ginobili
Score: 81-78

[09:56] Team_028 possession (Score: 81-78)
Myles Haliburton attempts a Midrange. Wide open! Luka Green is 8.6 feet away. [ZONE] MYLES HALIBURTON MAKES IT!
Score: 83-78

[09:39] Team_100 possession (Score: 83-78)
Carmelo Ginobili attempts a 3Pt. Contested by Collin Bridges (3.1 feet, MAN). Carmelo Ginobili misses. Rebound secured by Bam Towns.

[09:23] Team_028 possession (Score: 83-78)
FOUL! Shooting foul on Tyrese Wade. Tyrese Quickley to the line for 3 free throws. [Team fouls: 2] (Tyrese Wade: 1 personal fouls)   FT 1/3: GOOD   FT 2/3: GOOD   FT 3/3: GOOD Tyrese Quickley makes 3/3 from the line.
Score: 86-78

[09:13] Team_100 possession (Score: 86-78)
Chris Mobley attempts a Midrange. Contested by Collin Bridges (5.0 feet, MAN). Chris Mobley misses. Rebound secured by Bam Towns.

[08:55] Team_028 possession (Score: 86-78)
Collin Bridges drives to the basket... Collin Bridges loses control! Ball rolls out of bounds! TURNOVER! (dead ball)

[08:55] Substitution (Team_028): Myles Haliburton OUT → Miles Booker IN (stamina_rule2)

[08:55] Substitution (Team_100): Luka Green OUT → Dirk Sabonis IN (stamina_rule2)

[08:55] Substitution (Team_100): Chris Mobley OUT → John Rozier IN (stamina_rule2)

[08:39] Team_100 possession (Score: 86-78)
John Rozier attempts a Midrange. Contested by Bam Towns (3.7 feet, ZONE). John Rozier misses. Rebound secured by Collin Bridges.

[08:25] Team_028 possession (Score: 86-78)
Tyrese Quickley attempts a 3Pt. Wide open! Evan Butler is 6.5 feet away. [MAN] TYRESE QUICKLEY MAKES IT! Assist: Scottie Ingram
Score: 89-78

[08:10] Team_100 possession (Score: 89-78)
Evan Butler attempts a 3Pt. Contested by Scottie Ingram (5.1 feet, ZONE). EVAN BUTLER MAKES IT! Assist: John Rozier
Score: 89-81

[07:57] Team_028 possession (Score: 89-81)
Bam Towns attempts a 3Pt. Wide open! Dirk Sabonis is 6.7 feet away. [ZONE] Bam Towns misses. Rebound secured by John Rozier.

[07:45] Team_100 possession (Score: 89-81)
Tyrese Wade drives to the basket... Tyrese Wade loses control! Ball rolls out of bounds! TURNOVER! (dead ball)

[07:30] Team_028 possession (Score: 89-81)
Miles Booker attempts a Midrange. Contested by Tyrese Wade (4.4 feet, MAN). Miles Booker misses. Rebound secured by Tyrese Wade.

[07:19] Team_100 possession (Score: 89-81)
Tyrese Wade drives and kicks out. Carmelo Ginobili attempts a Midrange. Wide open! Miles Booker is 8.5 feet away. [ZONE] CARMELO GINOBILI MAKES IT! Assist: John Rozier
Score: 89-83

[07:03] Team_028 possession (Score: 89-83)
Collin Bridges drives, picks up John Rozier. Help arrives from Evan Butler! Collin Bridges attempts a Layup. Contested by Evan Butler (4.3 feet, MAN). COLLIN BRIDGES MAKES IT! Assist: Scottie Ingram
Score: 91-83

[06:49] Team_100 possession (Score: 91-83)
Dirk Sabonis drives, picks up Scottie Ingram. Help arrives from Tyrese Quickley! Dirk Sabonis attempts a Layup. Contested by Tyrese Quickley (5.5 feet, MAN). DIRK SABONIS MAKES IT! Assist: Tyrese Wade
Score: 91-85

[06:34] Team_028 possession (Score: 91-85)
Miles Booker makes the Dunk and draws the foul on Evan Butler! And-1! Miles Booker to the line for 1. [Team fouls: 3] (Evan Butler: 1 personal fouls)   FT 1/1: MISS Miles Booker makes 0/1 from the line. Offensive rebound by Collin Bridges! Collin Bridges kicks it out.
Score: 93-85

[06:20] Team_028 possession (Score: 93-85)
Collin Bridges drives and kicks out. Bam Towns attempts a 3Pt. Heavily contested by Tyrese Wade (1.4 feet, ZONE)! Bam Towns misses. Offensive rebound by Collin Bridges! Collin Bridges kicks it out.

[06:09] Team_028 possession (Score: 93-85)
Miles Booker drives, Tyrese Wade stays with him. Miles Booker attempts a Dunk. Wide open! Tyrese Wade is 8.1 feet away. [MAN] Miles Booker misses. Offensive rebound by Collin Bridges! Collin Bridges kicks it out.

[05:51] Team_028 possession (Score: 93-85)
Miles Booker attempts a Layup. Contested by John Rozier (3.9 feet, ZONE). MILES BOOKER MAKES IT! Assist: Collin Bridges
Score: 95-85

[05:39] Team_100 possession (Score: 95-85)
Tyrese Wade drives to the basket... Tyrese Wade throws a bad pass! Stolen by Bam Towns! TURNOVER! (live ball)

[05:26] Team_028 possession (Score: 95-85)
Bam Towns attempts a Midrange. Contested by Evan Butler (5.2 feet, ZONE). Bam Towns misses. Rebound secured by Carmelo Ginobili.

[05:15] Team_100 possession (Score: 95-85)
Tyrese Wade attempts a 3Pt. Contested by Miles Booker (3.2 feet, MAN). TYRESE WADE MAKES IT!
Score: 95-88

[04:59] Team_028 possession (Score: 95-88)
Scottie Ingram attempts a 3Pt. Wide open! Dirk Sabonis is 6.6 feet away. [MAN] Scottie Ingram misses. Rebound secured by Carmelo Ginobili.

[04:42] Team_100 possession (Score: 95-88)
Dirk Sabonis drives, picks up Collin Bridges. Help arrives from Tyrese Quickley! Dirk Sabonis attempts a Dunk. Contested by Tyrese Quickley (4.0 feet, ZONE). Dirk Sabonis misses. Rebound secured by Collin Bridges.

[04:26] Team_028 possession (Score: 95-88)
FOUL! Shooting foul on Tyrese Wade. Miles Booker to the line for 3 free throws. [Team fouls: 4] (Tyrese Wade: 2 personal fouls)   FT 1/3: MISS   FT 2/3: GOOD   FT 3/3: MISS Miles Booker makes 1/3 from the line. Offensive rebound by Collin Bridges! Collin Bridges kicks it out.
Score: 96-88

[04:13] Team_028 possession (Score: 96-88)
Miles Booker attempts a Midrange. Wide open! Tyrese Wade is 6.3 feet away. [ZONE] Miles Booker misses. Rebound secured by Tyrese Wade.

[04:01] Team_100 possession (Score: 96-88)
John Rozier loses the ball! Stripped by Collin Bridges! TURNOVER! (live ball)

[03:48] Team_028 possession (Score: 96-88)
Tyrese Quickley drives, John Rozier stays with him. Tyrese Quickley attempts a Dunk. Contested by John Rozier (5.7 feet, ZONE). Tyrese Quickley misses. Rebound secured by Carmelo Ginobili.

[03:35] Team_100 possession (Score: 96-88)
Dirk Sabonis attempts a 3Pt. Contested by Scottie Ingram (4.0 feet, ZONE). Dirk Sabonis misses. Rebound secured by Tyrese Quickley.

[03:23] Team_028 possession (Score: 96-88)
Scottie Ingram attempts a 3Pt. Contested by Dirk Sabonis (5.1 feet, MAN). Scottie Ingram misses. Offensive rebound by Collin Bridges! Collin Bridges kicks it out.

[03:07] Team_028 possession (Score: 96-88)
Collin Bridges drives, picks up John Rozier. Help arrives from Evan Butler! Collin Bridges attempts a Layup. Heavily contested by Evan Butler (1.7 feet, MAN)! COLLIN BRIDGES MAKES IT! Assist: Bam Towns
Score: 98-88

[02:52] Team_100 possession (Score: 98-88)
John Rozier drives and kicks out. Dirk Sabonis attempts a 3Pt. Wide open! Miles Booker is 7.7 feet away. [ZONE] DIRK SABONIS MAKES IT! Assist: Evan Butler
Score: 98-91

[02:37] Team_028 possession (Score: 98-91)
Scottie Ingram throws a bad pass out of bounds! TURNOVER! (dead ball)

[02:22] Team_100 possession (Score: 98-91)
Carmelo Ginobili drives, Collin Bridges stays with him. Carmelo Ginobili attempts a Dunk. Wide open! Collin Bridges is 6.2 feet away. [ZONE] CARMELO GINOBILI MAKES IT! Assist: Evan Butler
Score: 98-93

[02:09] Team_028 possession (Score: 98-93)
Miles Booker attempts a 3Pt. Wide open! Tyrese Wade is 6.0 feet away. [MAN] MILES BOOKER MAKES IT! Assist: Scottie Ingram
Score: 101-93

[01:53] Team_100 possession (Score: 101-93)
Dirk Sabonis attempts a 3Pt. Contested by Scottie Ingram (2.3 feet, MAN). Dirk Sabonis misses. Rebound secured by Collin Bridges.

[01:41] Team_028 possession (Score: 101-93)
Tyrese Quickley attempts a 3Pt. Contested by Tyrese Wade (5.7 feet, ZONE). Tyrese Quickley misses. Offensive rebound by Bam Towns! Bam Towns kicks it out.

[01:26] Team_028 possession (Score: 101-93)
Collin Bridges drives and kicks out. Bam Towns attempts a 3Pt. Contested by Carmelo Ginobili (5.7 feet, MAN). BAM TOWNS MAKES IT! Assist: Miles Booker
Score: 104-93

[01:09] Team_100 possession (Score: 104-93)
Dirk Sabonis attempts a Layup. Wide open! Scottie Ingram is 7.2 feet away. [MAN] DIRK SABONIS MAKES IT! Assist: Evan Butler
Score: 104-95

[00:55] Team_028 possession (Score: 104-95)
Scottie Ingram attempts a Midrange. Contested by Evan Butler (3.4 feet, ZONE). SCOTTIE INGRAM MAKES IT! Assist: Miles Booker
Score: 106-95

[00:40] Team_100 possession (Score: 106-95)
Carmelo Ginobili drives and kicks out. Tyrese Wade attempts a 3Pt. Contested by Miles Booker (5.1 feet, MAN). TYRESE WADE MAKES IT! Assist: Evan Butler
Score: 106-98

[00:26] Team_028 possession (Score: 106-98)
Collin Bridges drives, picks up John Rozier. Help arrives from Evan Butler! Collin Bridges attempts a Dunk. Contested by Evan Butler (2.5 feet, ZONE). Collin Bridges misses. Offensive rebound by Bam Towns! Bam Towns kicks it out.

[00:08] Team_028 possession (Score: 106-98)
Tyrese Quickley attempts a Midrange. Wide open! Evan Butler is 6.7 feet away. [MAN] TYRESE QUICKLEY MAKES IT! Assist: Collin Bridges
Score: 108-98

================================================================================
                              4TH QUARTER COMPLETE                              
================================================================================

4TH QUARTER SCORE: Team_028 33, Team_100 29

BOX SCORE:
================================================================================

Team_028
--------------------------------------------------------------------------------
Player                MIN  PTS  REB  AST  TO      FG   FG%      3P   3P%
--------------------------------------------------------------------------------
Tyrese Quickley        12    8    1    0   0   3/4    75.0     0/0   0.0
Bam Towns              12    5    5    2   0   2/4    50.0     0/0   0.0
Miles Booker            9    5    0    2   0   2/4    50.0     0/0   0.0
Myles Haliburton       40    4    0    0   0   2/2   100.0     0/0   0.0
Scottie Ingram         12    4    0    3   0   2/3    66.7     0/0   0.0
Collin Bridges         12    4    8    2   0   2/2   100.0     0/0   0.0

TEAM: FG: 13/19 (68.4%), 3PT: 3/5 (60.0%), REB: 14 (7 off, 7 def), AST: 9, TO: 3
TEAM FOULS: 2


Team_100
--------------------------------------------------------------------------------
Player                MIN  PTS  REB  AST  TO      FG   FG%      3P   3P%
--------------------------------------------------------------------------------
Tyrese Wade            12    9    2    1   0   3/3   100.0     0/0   0.0
Dirk Sabonis            9    7    0    0   0   3/6    50.0     0/0   0.0
Carmelo Ginobili       12    4    3    2   0   2/3    66.7     0/0   0.0
Chris Mobley           36    3    1    0   0   1/2    50.0     0/0   0.0
Luka Green             40    3    0    0   0   1/2    50.0     0/0   0.0
Evan Butler            12    3    0    4   0   1/1   100.0     0/0   0.0
John Rozier            12    0    1    2   0   0/1     0.0     0/0   0.0

TEAM: FG: 11/18 (61.1%), 3PT: 4/8 (50.0%), REB: 7 (1 off, 6 def), AST: 9, TO: 3
TEAM FOULS: 4

================================================================================

================================================================================
                               FULL GAME COMPLETE                               
================================================================================

FINAL SCORE: Team_028 108, Team_100 98

SCORING BY QUARTER:
--------------------------------------------------------------------------------
Team                     Q1     Q2     Q3     Q4    FINAL
--------------------------------------------------------------------------------
Team_028                 25     26     24     33      108
Team_100                 22     26     21     29       98
--------------------------------------------------------------------------------

FULL GAME BOX SCORE:
================================================================================

Team_028
--------------------------------------------------------------------------------
Player                MIN  PTS  REB  AST  TO      FG   FG%      3P   3P%      FT STL BLK
--------------------------------------------------------------------------------
Myles Haliburton       40   23    0    2   7   7/11   63.6   3/3   100.0   5/7     1   0
Austin Russell         36   19    0    5   1   8/12   66.7   4/6    66.7   1/2     0   0
Carmelo Carter         36    7    6    2   4   3/6    50.0   1/1   100.0   0/0     0   0
Kawhi Ball             36   18   17    3   2   7/13   53.8   1/6    16.7   3/3     1   0
Jimmy Brogdon          36    9   15    1   0   5/9    55.6   1/1   100.0   0/1     1   0
Scottie Ingram         12    4    0    3   1   2/3    66.7   0/1     0.0   0/0     0   0
Tyrese Quickley        12    8    1    0   0   4/5    80.0   2/2   100.0   3/3     0   0
Bam Towns              12    5    5    2   0   1/3    33.3   0/1     0.0   2/2     1   0
Collin Bridges         12    4    8    2   0   3/3   100.0   0/0     0.0   0/0     1   0
Miles Booker            9    5    0    2   0   2/4    50.0   1/1   100.0   1/4     0   0

TEAM: FG: 42/69 (60.9%), 3PT: 13/22 (59.1%), REB: 51 (22 off, 29 def), AST: 22, TO: 15


Team_100
--------------------------------------------------------------------------------
Player                MIN  PTS  REB  AST  TO      FG   FG%      3P   3P%      FT STL BLK
--------------------------------------------------------------------------------
Luka Green             40   12    0    4   1   5/10   50.0   2/6    33.3   2/2     1   0
Manu Ball              36   21    0    1   0   8/13   61.5   4/8    50.0   2/4     0   0
Tyler Griffin          36   13    5    5   1   6/14   42.9   1/5    20.0   0/0     2   0
Pau LaVine             36   11   14    6   0   5/7    71.4   1/2    50.0   0/0     1   1
Chris Mobley           36   12    9    4   3   6/11   54.5   1/3    33.3   2/5     0   0
John Rozier            12    6    1    2   3   4/5    80.0   0/0     0.0   0/2     0   0
Evan Butler            12    3    0    4   0   1/1   100.0   1/1   100.0   0/0     0   0
Tyrese Wade            12    9    2    1   1   3/3   100.0   2/2   100.0   0/0     0   0
Carmelo Ginobili       12    4    3    2   0   2/3    66.7   0/1     0.0   0/0     0   0
Dirk Sabonis            9    7    0    0   0   2/5    40.0   0/2     0.0   0/0     0   0

TEAM: FG: 42/72 (58.3%), 3PT: 12/30 (40.0%), REB: 35 (8 off, 27 def), AST: 29, TO: 9

================================================================================
