================================================================================
                        FULL GAME - Team_043 vs Team_020                        
================================================================================

================================================================================
                       1ST QUARTER - Team_043 vs Team_020                       
================================================================================

[12:00] Team_043 possession (Score: 0-0)
Manu Carter attempts a 3Pt. Contested by Bam Leonard (4.5 feet, MAN). Manu Carter misses. Rebound secured by Bam Leonard.

[11:43] Team_020 possession (Score: 0-0)
Trae Curry drives and kicks out. Terry Simons attempts a 3Pt. Heavily contested by D'Angelo Iverson (1.4 feet, MAN)! Terry Simons misses. Offensive rebound by Trae Curry! Trae Curry puts it back in!
Score: 0-2

[11:32] Team_043 possession (Score: 0-2)
Manu Carter attempts a Layup. Contested by Trae Curry (3.6 feet, ZONE). MANU CARTER MAKES IT! Assist: D'Angelo Iverson
Score: 2-2

[11:20] Team_020 possession (Score: 2-2)
Terry Simons attempts a 3Pt. Contested by D'Angelo Iverson (2.3 feet, MAN). Terry Simons misses. Rebound secured by Dwyane Dosunmu.

[11:04] Team_043 possession (Score: 2-2)
Dwyane Dosunmu drives to the basket... Dwyane Dosunmu loses the ball! Stripped by Bam Leonard! TURNOVER! (live ball)

[10:51] Team_020 possession (Score: 2-2)
Trae Curry attempts a Midrange. Contested by Manu Carter (3.5 feet, MAN). TRAE CURRY MAKES IT! Assist: Jarrett McCollum
Score: 2-4

[10:39] Team_043 possession (Score: 2-4)
Malcolm Murray attempts a 3Pt. Contested by Bam Leonard (3.6 feet, ZONE). Malcolm Murray misses. Rebound secured by Terry Simons.

[10:28] Team_020 possession (Score: 2-4)
James Cunningham attempts a 3Pt. Contested by D'Angelo Iverson (3.4 feet, ZONE). JAMES CUNNINGHAM MAKES IT! Assist: Jarrett McCollum
Score: 2-7

[10:09] Team_043 possession (Score: 2-7)
D'Angelo Iverson attempts a 3Pt. Contested by Terry Simons (3.2 feet, MAN). D'Angelo Iverson misses. Offensive rebound by Manu Carter! Manu Carter kicks it out.

[09:54] Team_043 possession (Score: 2-7)
Magic Durant attempts a 3Pt. Contested by James Cunningham (2.8 feet, MAN). MAGIC DURANT MAKES IT!
Score: 5-7

[09:40] Team_020 possession (Score: 5-7)
James Cunningham attempts a 3Pt. Contested by Magic Durant (2.4 feet, MAN). JAMES CUNNINGHAM MAKES IT! Assist: Terry Simons
Score: 5-10

[09:27] Team_043 possession (Score: 5-10)
Manu Carter drives, picks up Trae Curry. Help arrives from Jarrett McCollum! Manu Carter attempts a Dunk. Contested by Jarrett McCollum (5.2 feet, ZONE). MANU CARTER MAKES IT! Assist: Magic Durant
Score: 7-10

[09:15] Team_020 possession (Score: 7-10)
Bam Leonard attempts a 3Pt. Contested by Manu Carter (2.7 feet, MAN). Bam Leonard misses. Rebound secured by D'Angelo Iverson.

[09:04] Team_043 possession (Score: 7-10)
FOUL! Shooting foul on Bam Leonard. D'Angelo Iverson to the line for 3 free throws. [Team fouls: 1] (Bam Leonard: 1 personal fouls)   FT 1/3: GOOD   FT 2/3: GOOD   FT 3/3: MISS D'Angelo Iverson makes 2/3 from the line. Rebound secured by Trae Curry.
Score: 9-10

[08:53] Team_020 possession (Score: 9-10)
Bam Leonard attempts a Layup. Contested by Manu Carter (6.0 feet, MAN). Bam Leonard misses. Rebound secured by Dwyane Dosunmu.

[08:42] Team_043 possession (Score: 9-10)
Malcolm Murray attempts a Midrange. Heavily contested by Bam Leonard (1.2 feet, ZONE)! MALCOLM MURRAY MAKES IT! Assist: D'Angelo Iverson
Score: 11-10

[08:27] Team_020 possession (Score: 11-10)
FOUL! Shooting foul on D'Angelo Iverson. Terry Simons to the line for 3 free throws. [Team fouls: 1] (D'Angelo Iverson: 1 personal fouls)   FT 1/3: GOOD   FT 2/3: GOOD   FT 3/3: GOOD Terry Simons makes 3/3 from the line.
Score: 11-13

[08:13] Team_043 possession (Score: 11-13)
Dwyane Dosunmu drives to the basket... FOUL! Offensive foul on Dwyane Dosunmu! Bam Leonard drew the charge! [Team fouls: 2] (Dwyane Dosunmu: 1 personal fouls) TURNOVER! (dead ball)

[08:01] Team_020 possession (Score: 11-13)
James Cunningham attempts a 3Pt. Contested by D'Angelo Iverson (2.1 feet, ZONE). James Cunningham misses. Offensive rebound by Trae Curry! Trae Curry's putback is no good. Rebound secured by Manu Carter.

[07:50] Team_043 possession (Score: 11-13)
FOUL! Shooting foul on Terry Simons. Magic Durant to the line for 2 free throws. [Team fouls: 2] (Terry Simons: 1 personal fouls)   FT 1/2: GOOD   FT 2/2: GOOD Magic Durant makes 2/2 from the line.
Score: 13-13

[07:40] Team_020 possession (Score: 13-13)
Bam Leonard attempts a 3Pt. Contested by Manu Carter (4.5 feet, MAN). Bam Leonard misses. Rebound secured by D'Angelo Iverson.

[07:22] Team_043 possession (Score: 13-13)
Malcolm Murray drives, Trae Curry stays with him. Malcolm Murray attempts a Dunk. Contested by Trae Curry (2.9 feet, ZONE). Malcolm Murray misses. Rebound secured by Terry Simons.

[07:08] Team_020 possession (Score: 13-13)
Terry Simons attempts a 3Pt. Contested by D'Angelo Iverson (3.9 feet, ZONE). Terry Simons misses. Rebound secured by Manu Carter.

[06:50] Team_043 possession (Score: 13-13)
Magic Durant makes the Dunk and draws the foul on James Cunningham! And-1! Magic Durant to the line for 1. [Team fouls: 3] (James Cunningham: 1 personal fouls)   FT 1/1: MISS Magic Durant makes 0/1 from the line. Rebound secured by Bam Leonard.
Score: 15-13

[06:35] Team_020 possession (Score: 15-13)
Bam Leonard attempts a 3Pt. Wide open! Manu Carter is 6.7 feet away. [MAN] Bam Leonard misses. FOUL! Loose ball foul on D'Angelo Iverson during the rebound battle. [Team fouls: 3] No free throws, side out. (D'Angelo Iverson: 2 personal fouls)

[06:17] Team_020 possession (Score: 15-13)
Jarrett McCollum attempts a Layup. Contested by Malcolm Murray (3.1 feet, MAN). JARRETT MCCOLLUM MAKES IT!
Score: 15-15

[06:03] Team_043 possession (Score: 15-15)
Manu Carter drives to the basket... Manu Carter throws a bad pass out of bounds! TURNOVER! (dead ball)

[05:47] Team_020 possession (Score: 15-15)
FOUL! Reach-in foul on D'Angelo Iverson during the drive. [Team fouls: 4] No free throws, side out. (D'Angelo Iverson: 3 personal fouls)

[05:35] Team_020 possession (Score: 15-15)
Jarrett McCollum throws a bad pass! Stolen by Malcolm Murray! TURNOVER! (live ball)

[05:25] Team_043 possession (Score: 15-15)
Manu Carter drives to the basket... FOUL! Offensive foul on Manu Carter! Bam Leonard drew the charge! [Team fouls: 5] (Manu Carter: 1 personal fouls) TURNOVER! (dead ball)

[05:13] Team_020 possession (Score: 15-15)
James Cunningham attempts a 3Pt. Heavily contested by D'Angelo Iverson (0.5 feet, ZONE)! James Cunningham misses. Rebound secured by D'Angelo Iverson.

[04:58] Team_043 possession (Score: 15-15)
Dwyane Dosunmu drives and kicks out. Manu Carter attempts a Midrange. Contested by James Cunningham (4.4 feet, ZONE). Manu Carter misses. Rebound secured by Trae Curry.

[04:43] Team_020 possession (Score: 15-15)
James Cunningham attempts a Midrange. Contested by D'Angelo Iverson (4.9 feet, ZONE). James Cunningham misses. Rebound secured by D'Angelo Iverson.

[04:28] Team_043 possession (Score: 15-15)
FOUL! Shooting foul on Terry Simons. D'Angelo Iverson to the line for 2 free throws. [Team fouls: 4] (Terry Simons: 2 personal fouls)   FT 1/2: GOOD   FT 2/2: GOOD D'Angelo Iverson makes 2/2 from the line.
Score: 17-15

[04:17] Team_020 possession (Score: 17-15)
Terry Simons attempts a 3Pt. Wide open! D'Angelo Iverson is 6.6 feet away. [MAN] Terry Simons misses. Offensive rebound by Bam Leonard! Bam Leonard puts it back in!
Score: 17-17

[04:02] Team_043 possession (Score: 17-17)
Magic Durant attempts a 3Pt. Wide open! James Cunningham is 6.0 feet away. [MAN] Magic Durant misses. Rebound secured by Trae Curry.

[03:52] Team_020 possession (Score: 17-17)
FOUL! Shooting foul on Malcolm Murray. Jarrett McCollum to the line for 2 free throws. [BONUS: 6 team fouls] (Malcolm Murray: 1 personal fouls)   FT 1/2: MISS   FT 2/2: GOOD Jarrett McCollum makes 1/2 from the line.
Score: 17-18

[03:33] Team_043 possession (Score: 17-18)
Dwyane Dosunmu attempts a Layup. Heavily contested by Bam Leonard (1.7 feet, MAN)! DWYANE DOSUNMU MAKES IT! Assist: Magic Durant
Score: 19-18

[03:18] Team_020 possession (Score: 19-18)
James Cunningham drives to the basket... FOUL! Offensive foul on James Cunningham! Manu Carter drew the charge! [Team fouls: 5] (James Cunningham: 2 personal fouls) TURNOVER! (dead ball)

[03:06] Team_043 possession (Score: 19-18)
Malcolm Murray attempts a Midrange. Contested by Jarrett McCollum (3.8 feet, MAN). Malcolm Murray misses. Offensive rebound by Manu Carter! Manu Carter kicks it out.

[02:55] Team_043 possession (Score: 19-18)
FOUL! Holding foul on Jarrett McCollum. [IN THE BONUS! 6 team fouls] Malcolm Murray to the line for 2 free throws. (Jarrett McCollum: 1 personal fouls)   FT 1/2: GOOD   FT 2/2: GOOD Malcolm Murray makes 2/2 from the line.
Score: 21-18

[02:41] Team_020 possession (Score: 21-18)
James Cunningham attempts a 3Pt. Heavily contested by Magic Durant (0.5 feet, MAN)! James Cunningham misses. Rebound secured by Manu Carter.

[02:32] Team_043 possession (Score: 21-18)
Manu Carter attempts a 3Pt. Contested by Bam Leonard (3.2 feet, MAN). Manu Carter misses. Rebound secured by Trae Curry.

[02:23] Team_020 possession (Score: 21-18)
Jarrett McCollum attempts a 3Pt. Contested by Malcolm Murray (3.2 feet, MAN). Jarrett McCollum misses. Rebound secured by Manu Carter.

[02:10] Team_043 possession (Score: 21-18)
FOUL! Reach-in foul on Jarrett McCollum during the drive. [IN THE BONUS! 7 team fouls] Malcolm Murray to the line for 2 free throws. (Jarrett McCollum: 2 personal fouls)   FT 1/2: GOOD   FT 2/2: GOOD Malcolm Murray makes 2/2 from the line.
Score: 23-18

[01:54] Team_020 possession (Score: 23-18)
James Cunningham attempts a 3Pt. Wide open! Magic Durant is 6.2 feet away. [MAN] JAMES CUNNINGHAM MAKES IT! Assist: Terry Simons
Score: 23-21

[01:41] Team_043 possession (Score: 23-21)
FOUL! Shooting foul on Bam Leonard. Dwyane Dosunmu to the line for 3 free throws. [BONUS: 8 team fouls] (Bam Leonard: 2 personal fouls)   FT 1/3: MISS   FT 2/3: GOOD   FT 3/3: GOOD Dwyane Dosunmu makes 2/3 from the line.
Score: 25-21

[01:22] Team_020 possession (Score: 25-21)
Bam Leonard attempts a Midrange. Contested by Manu Carter (3.7 feet, ZONE). BAM LEONARD MAKES IT!
Score: 25-23

[01:09] Team_043 possession (Score: 25-23)
Manu Carter attempts a Midrange. Wide open! James Cunningham is 7.2 feet away. [ZONE] Manu Carter misses. FOUL! Loose ball foul on Bam Leonard during the rebound battle. [IN THE BONUS! 9 team fouls] D'Angelo Iverson to the line for 2 free throws. (Bam Leonard: 3 personal fouls)   FT 1/2: GOOD   FT 2/2: GOOD D'Angelo Iverson makes 2/2 from the line.
Score: 27-23

[00:53] Team_020 possession (Score: 27-23)
Bam Leonard attempts a 3Pt. Contested by D'Angelo Iverson (5.6 feet, ZONE). Bam Leonard misses. Rebound secured by Dwyane Dosunmu.

[00:37] Team_043 possession (Score: 27-23)
FOUL! Shooting foul on Bam Leonard. Dwyane Dosunmu to the line for 3 free throws. [BONUS: 10 team fouls] (Bam Leonard: 4 personal fouls)   FT 1/3: MISS   FT 2/3: GOOD   FT 3/3: GOOD Dwyane Dosunmu makes 2/3 from the line.
Score: 29-23

[00:26] Team_020 possession (Score: 29-23)
Trae Curry drives, Manu Carter stays with him. Trae Curry attempts a Layup. Contested by Manu Carter (5.1 feet, ZONE). Trae Curry misses. Rebound secured by Dwyane Dosunmu.

[00:12] Team_043 possession (Score: 29-23)
Dwyane Dosunmu attempts a Layup. Contested by Bam Leonard (4.9 feet, MAN). Dwyane Dosunmu misses. Rebound secured by Terry Simons.

================================================================================
                              1ST QUARTER COMPLETE                              
================================================================================

1ST QUARTER SCORE: Team_043 29, Team_020 23

BOX SCORE:
================================================================================

Team_043
--------------------------------------------------------------------------------
Player                MIN  PTS  REB  AST  TO      FG   FG%      3P   3P%
--------------------------------------------------------------------------------
Dwyane Dosunmu         12    6    4    0   0   3/5    60.0     0/0   0.0
Malcolm Murray         12    6    0    0   0   3/5    60.0     0/0   0.0
Magic Durant           12    5    0    2   0   2/4    50.0     0/0   0.0
Manu Carter            12    4    6    0   0   2/4    50.0     0/0   0.0
D'Angelo Iverson       12    4    4    2   0   2/3    66.7     0/0   0.0

TEAM: FG: 12/21 (57.1%), 3PT: 3/8 (37.5%), REB: 13 (2 off, 11 def), AST: 4, TO: 4
TEAM FOULS: 6 [Team_020 in BONUS]


Team_020
--------------------------------------------------------------------------------
Player                MIN  PTS  REB  AST  TO      FG   FG%      3P   3P%
--------------------------------------------------------------------------------
James Cunningham       12    9    0    0   0   3/7    42.9     0/0   0.0
Bam Leonard            12    4    4    0   0   2/6    33.3     0/0   0.0
Trae Curry             12    4    5    0   0   2/3    66.7     0/0   0.0
Terry Simons           12    3    3    2   0   1/3    33.3     0/0   0.0
Jarrett McCollum       12    3    0    2   0   2/3    66.7     0/0   0.0

TEAM: FG: 10/22 (45.5%), 3PT: 5/14 (35.7%), REB: 13 (4 off, 9 def), AST: 4, TO: 2
TEAM FOULS: 10 [Team_043 in BONUS]

================================================================================

================================================================================
                       2ND QUARTER - Team_043 vs Team_020                       
================================================================================

[12:00] Team_043 possession (Score: 29-23)
D'Angelo Iverson attempts a Midrange. Contested by Terry Simons (5.3 feet, ZONE). D'Angelo Iverson misses. Rebound secured by Trae Curry.

[11:47] Team_020 possession (Score: 29-23)
Terry Simons attempts a 3Pt. Contested by D'Angelo Iverson (5.5 feet, MAN). Terry Simons misses. Rebound secured by D'Angelo Iverson.

[11:34] Team_043 possession (Score: 29-23)
Dwyane Dosunmu drives to the basket... Dwyane Dosunmu throws a bad pass! Stolen by Bam Leonard! TURNOVER! (live ball)

[11:16] Team_020 possession (Score: 29-23)
James Cunningham makes the Layup and draws the foul on Manu Carter! And-1! James Cunningham to the line for 1. [Team fouls: 1] (Manu Carter: 1 personal fouls)   FT 1/1: GOOD James Cunningham makes 1/1 from the line.
Score: 29-26

[11:00] Team_043 possession (Score: 29-26)
Manu Carter attempts a Midrange. Wide open! Bam Leonard is 6.0 feet away. [MAN] MANU CARTER MAKES IT! Assist: D'Angelo Iverson
Score: 31-26

[10:45] Team_020 possession (Score: 31-26)
FOUL! Offensive foul on Terry Simons! D'Angelo Iverson drew the charge! [Team fouls: 1] (Terry Simons: 1 personal fouls) TURNOVER! (dead ball)

[10:26] Team_043 possession (Score: 31-26)
Magic Durant drives, James Cunningham stays with him. Magic Durant attempts a Dunk. Wide open! James Cunningham is 6.7 feet away. [MAN] MAGIC DURANT MAKES IT! Assist: D'Angelo Iverson
Score: 33-26

[10:15] Team_020 possession (Score: 33-26)
Bam Leonard attempts a 3Pt. Contested by Manu Carter (4.9 feet, MAN). Bam Leonard misses. Rebound secured by Manu Carter.

[09:59] Team_043 possession (Score: 33-26)
FOUL! Offensive foul on Dwyane Dosunmu! Bam Leonard drew the charge! [Team fouls: 2] (Dwyane Dosunmu: 1 personal fouls) TURNOVER! (dead ball)

[09:44] Team_020 possession (Score: 33-26)
James Cunningham attempts a Midrange. Contested by Magic Durant (5.4 feet, MAN). James Cunningham misses. Rebound secured by Dwyane Dosunmu.

[09:33] Team_043 possession (Score: 33-26)
Dwyane Dosunmu drives and kicks out. Dwyane Dosunmu attempts a 3Pt. Contested by Bam Leonard (3.2 feet, ZONE). Dwyane Dosunmu misses. Rebound secured by Bam Leonard.

[09:22] Team_020 possession (Score: 33-26)
FOUL! Reach-in foul on Manu Carter during the drive. [Team fouls: 3] No free throws, side out. (Manu Carter: 2 personal fouls)

[09:07] Team_020 possession (Score: 33-26)
Bam Leonard attempts a Midrange. Contested by Manu Carter (3.1 feet, MAN). Bam Leonard misses. Rebound secured by D'Angelo Iverson.

[08:49] Team_043 possession (Score: 33-26)
Dwyane Dosunmu attempts a Midrange. Wide open! Bam Leonard is 6.6 feet away. [ZONE] Dwyane Dosunmu misses. Rebound secured by Bam Leonard.

[08:31] Team_020 possession (Score: 33-26)
Trae Curry drives to the basket... Trae Curry commits a violation (traveling/carry)! TURNOVER! (dead ball)

[08:31] Substitution (Team_043): Malcolm Murray OUT → Jabari Holiday IN (stamina_rule2)

[08:31] Substitution (Team_043): Magic Durant OUT → Ben LaVine IN (stamina_rule2)

[08:31] Substitution (Team_043): D'Angelo Iverson OUT → Dirk Herro IN (stamina_rule2)

[08:31] Substitution (Team_043): Manu Carter OUT → Joel Murray IN (stamina_rule2)

[08:31] Substitution (Team_043): Dwyane Dosunmu OUT → Terry Randle IN (stamina_rule2)

[08:31] Substitution (Team_020): Jarrett McCollum OUT → Franz Doncic IN (stamina_rule2)

[08:31] Substitution (Team_020): James Cunningham OUT → Stephen Parker IN (stamina_rule2)

[08:31] Substitution (Team_020): Terry Simons OUT → Victor Holiday IN (stamina_rule2)

[08:31] Substitution (Team_020): Bam Leonard OUT → Cole Barnes IN (stamina_rule2)

[08:31] Substitution (Team_020): Trae Curry OUT → Miles Siakam IN (stamina_rule2)

[08:18] Team_043 possession (Score: 33-26)
Ben LaVine drives, picks up Miles Siakam. Help arrives from Franz Doncic! Ben LaVine attempts a Dunk. Contested by Franz Doncic (2.4 feet, ZONE). Ben LaVine misses. Rebound secured by Victor Holiday.

[08:03] Team_020 possession (Score: 33-26)
Stephen Parker attempts a 3Pt. Wide open! Ben LaVine is 6.1 feet away. [MAN] Stephen Parker misses. Rebound secured by Ben LaVine.

[07:48] Team_043 possession (Score: 33-26)
Dirk Herro attempts a Midrange. Contested by Franz Doncic (4.1 feet, ZONE). Dirk Herro misses. Rebound secured by Miles Siakam.

[07:35] Team_020 possession (Score: 33-26)
Miles Siakam attempts a 3Pt. Contested by Terry Randle (4.6 feet, MAN). Miles Siakam misses. Offensive rebound by Cole Barnes! Cole Barnes kicks it out.

[07:19] Team_020 possession (Score: 33-26)
Cole Barnes attempts a Midrange. Contested by Joel Murray (2.9 feet, ZONE). COLE BARNES MAKES IT! Assist: Franz Doncic
Score: 33-28

[07:03] Team_043 possession (Score: 33-28)
Jabari Holiday attempts a Midrange. Contested by Franz Doncic (3.7 feet, MAN). JABARI HOLIDAY MAKES IT! Assist: Joel Murray
Score: 35-28

[06:51] Team_020 possession (Score: 35-28)
Stephen Parker attempts a Layup. BLOCKED BY TERRY RANDLE! Ball deflects out of bounds off Stephen Parker.

[06:37] Team_043 possession (Score: 35-28)
Terry Randle drives and kicks out. Joel Murray attempts a Midrange. Contested by Victor Holiday (4.0 feet, ZONE). JOEL MURRAY MAKES IT! Assist: Jabari Holiday
Score: 37-28

[06:26] Team_020 possession (Score: 37-28)
FOUL! Shooting foul on Jabari Holiday. Franz Doncic to the line for 2 free throws. [Team fouls: 4] (Jabari Holiday: 1 personal fouls)   FT 1/2: MISS   FT 2/2: GOOD Franz Doncic makes 1/2 from the line.
Score: 37-29

[06:12] Team_043 possession (Score: 37-29)
Dirk Herro drives, Miles Siakam stays with him. Dirk Herro attempts a Dunk. Wide open! Miles Siakam is 6.2 feet away. [ZONE] DIRK HERRO MAKES IT!
Score: 39-29

[06:01] Team_020 possession (Score: 39-29)
Franz Doncic makes the Layup and draws the foul on Jabari Holiday! And-1! Franz Doncic to the line for 1. [BONUS: 5 team fouls] (Jabari Holiday: 2 personal fouls)   FT 1/1: MISS Franz Doncic makes 0/1 from the line. Rebound secured by Ben LaVine.
Score: 39-31

[05:48] Team_043 possession (Score: 39-31)
Ben LaVine attempts a 3Pt. Contested by Stephen Parker (5.4 feet, ZONE). Ben LaVine misses. Rebound secured by Cole Barnes.

[05:32] Team_020 possession (Score: 39-31)
Victor Holiday drives and kicks out. FOUL! Shooting foul on Terry Randle. Miles Siakam to the line for 2 free throws. [BONUS: 6 team fouls] (Terry Randle: 1 personal fouls)   FT 1/2: GOOD   FT 2/2: GOOD Miles Siakam makes 2/2 from the line.
Score: 39-33

[05:17] Team_043 possession (Score: 39-33)
Joel Murray attempts a 3Pt. Contested by Cole Barnes (5.6 feet, MAN). JOEL MURRAY MAKES IT! Assist: Dirk Herro
Score: 42-33

[05:02] Team_020 possession (Score: 42-33)
Franz Doncic drives, Terry Randle stays with him. Franz Doncic attempts a Dunk. Contested by Terry Randle (3.2 feet, ZONE). FRANZ DONCIC MAKES IT! Assist: Miles Siakam
Score: 42-35

[04:47] Team_043 possession (Score: 42-35)
Ben LaVine drives, Stephen Parker stays with him. Ben LaVine attempts a Layup. Wide open! Stephen Parker is 8.6 feet away. [MAN] BEN LAVINE MAKES IT! Assist: Terry Randle
Score: 44-35

[04:38] Team_020 possession (Score: 44-35)
Victor Holiday drives, picks up Dirk Herro. Help arrives from Ben LaVine! Victor Holiday attempts a Dunk. Contested by Ben LaVine (4.6 feet, MAN). VICTOR HOLIDAY MAKES IT!
Score: 44-37

[04:25] Team_043 possession (Score: 44-37)
Terry Randle drives, Miles Siakam stays with him. Terry Randle attempts a Layup. Contested by Miles Siakam (5.7 feet, ZONE). Terry Randle misses. Offensive rebound by Terry Randle! Terry Randle kicks it out.

[04:15] Team_043 possession (Score: 44-37)
Joel Murray attempts a 3Pt. Contested by Stephen Parker (5.4 feet, ZONE). Joel Murray misses. Rebound secured by Cole Barnes.

[04:01] Team_020 possession (Score: 44-37)
Stephen Parker attempts a 3Pt. Wide open! Dirk Herro is 6.0 feet away. [ZONE] STEPHEN PARKER MAKES IT! Assist: Franz Doncic
Score: 44-40

[03:48] Team_043 possession (Score: 44-40)
Jabari Holiday attempts a 3Pt. Heavily contested by Franz Doncic (1.8 feet, MAN)! Jabari Holiday misses. Rebound secured by Victor Holiday.

[03:33] Team_020 possession (Score: 44-40)
Victor Holiday attempts a Layup. BLOCKED BY BEN LAVINE! Ball is loose! Rebound secured by Ben LaVine.

[03:17] Team_043 possession (Score: 44-40)
Joel Murray drives and kicks out. Dirk Herro attempts a Midrange. Wide open! Victor Holiday is 6.7 feet away. [ZONE] DIRK HERRO MAKES IT!
Score: 46-40

[03:01] Team_020 possession (Score: 46-40)
Cole Barnes makes the Layup and draws the foul on Terry Randle! And-1! Cole Barnes to the line for 1. [BONUS: 7 team fouls] (Terry Randle: 2 personal fouls)   FT 1/1: GOOD Cole Barnes makes 1/1 from the line.
Score: 46-43

[02:48] Team_043 possession (Score: 46-43)
Ben LaVine makes the Layup and draws the foul on Franz Doncic! And-1! Ben LaVine to the line for 1. [Team fouls: 2] (Franz Doncic: 1 personal fouls)   FT 1/1: GOOD Ben LaVine makes 1/1 from the line.
Score: 49-43

[02:37] Team_020 possession (Score: 49-43)
Stephen Parker drives to the basket... Stephen Parker commits a violation (traveling/carry)! TURNOVER! (dead ball)

[02:25] Team_043 possession (Score: 49-43)
Ben LaVine drives, Miles Siakam stays with him. Ben LaVine attempts a Layup. Contested by Miles Siakam (5.4 feet, ZONE). BEN LAVINE MAKES IT!
Score: 51-43

[02:12] Team_020 possession (Score: 51-43)
Stephen Parker attempts a 3Pt. BLOCKED BY DIRK HERRO! Ball is loose! Offensive rebound by Cole Barnes! Cole Barnes kicks it out.

[01:54] Team_020 possession (Score: 51-43)
Stephen Parker attempts a 3Pt. Wide open! Ben LaVine is 7.0 feet away. [MAN] Stephen Parker misses. Rebound secured by Ben LaVine.

[01:41] Team_043 possession (Score: 51-43)
Jabari Holiday attempts a 3Pt. Contested by Stephen Parker (4.3 feet, ZONE). Jabari Holiday misses. Offensive rebound by Dirk Herro! Dirk Herro puts it back in!
Score: 53-43

[01:24] Team_020 possession (Score: 53-43)
Cole Barnes attempts a Layup. Wide open! Terry Randle is 8.3 feet away. [ZONE] Cole Barnes misses. Rebound secured by Dirk Herro.

[01:13] Team_043 possession (Score: 53-43)
Terry Randle attempts a Midrange. Wide open! Miles Siakam is 6.6 feet away. [MAN] Terry Randle misses. Rebound secured by Miles Siakam.

[00:59] Team_020 possession (Score: 53-43)
Cole Barnes attempts a Midrange. Contested by Joel Murray (4.6 feet, MAN). COLE BARNES MAKES IT!
Score: 53-45

[00:46] Team_043 possession (Score: 53-45)
Ben LaVine attempts a 3Pt. Wide open! Stephen Parker is 6.2 feet away. [ZONE] BEN LAVINE MAKES IT! Assist: Joel Murray
Score: 56-45

[00:32] Team_020 possession (Score: 56-45)
Franz Doncic attempts a 3Pt. Contested by Jabari Holiday (3.7 feet, MAN). Franz Doncic misses. Rebound secured by Dirk Herro.

[00:23] Team_043 possession (Score: 56-45)
Ben LaVine makes the Midrange and draws the foul on Stephen Parker! And-1! Ben LaVine to the line for 1. [Team fouls: 3] (Stephen Parker: 1 personal fouls)   FT 1/1: GOOD Ben LaVine makes 1/1 from the line.
Score: 59-45

[00:09] Team_020 possession (Score: 59-45)
Miles Siakam attempts a Layup. Wide open! Terry Randle is 6.6 feet away. [MAN] MILES SIAKAM MAKES IT! Assist: Cole Barnes
Score: 59-47

================================================================================
                              2ND QUARTER COMPLETE                              
================================================================================

2ND QUARTER SCORE: Team_043 30, Team_020 24

BOX SCORE:
================================================================================

Team_043
--------------------------------------------------------------------------------
Player                MIN  PTS  REB  AST  TO      FG   FG%      3P   3P%
--------------------------------------------------------------------------------
Ben LaVine              8   13    4    0   0   5/7    71.4     0/0   0.0
Dirk Herro              8    6    3    1   0   3/4    75.0     0/0   0.0
Joel Murray             8    5    0    2   0   2/3    66.7     0/0   0.0
Manu Carter            16    2    1    0   0   1/1   100.0     0/0   0.0
Magic Durant           16    2    0    0   0   1/1   100.0     0/0   0.0
Jabari Holiday          8    2    0    1   0   1/2    50.0     0/0   0.0
D'Angelo Iverson       16    0    2    2   0   0/1     0.0     0/0   0.0
Dwyane Dosunmu         16    0    1    0   0   0/2     0.0     0/0   0.0
Terry Randle            8    0    1    1   0   0/1     0.0     0/0   0.0

TEAM: FG: 13/22 (59.1%), 3PT: 3/6 (50.0%), REB: 12 (2 off, 10 def), AST: 7, TO: 2
TEAM FOULS: 7 [Team_020 in BONUS]


Team_020
--------------------------------------------------------------------------------
Player                MIN  PTS  REB  AST  TO      FG   FG%      3P   3P%
--------------------------------------------------------------------------------
Cole Barnes             8    7    4    1   0   3/4    75.0     0/0   0.0
Miles Siakam            8    4    2    1   0   2/2   100.0     0/0   0.0
James Cunningham       16    3    0    0   0   1/2    50.0     0/0   0.0
Stephen Parker          8    3    0    0   0   1/4    25.0     0/0   0.0
Franz Doncic            8    3    0    2   0   2/4    50.0     0/0   0.0
Victor Holiday          8    2    2    0   0   1/2    50.0     0/0   0.0
Trae Curry             16    0    1    0   0   0/0     0.0     0/0   0.0
Terry Simons           16    0    0    0   0   0/1     0.0     0/0   0.0
Bam Leonard            16    0    2    0   0   0/2     0.0     0/0   0.0

TEAM: FG: 10/21 (47.6%), 3PT: 1/6 (16.7%), REB: 11 (2 off, 9 def), AST: 4, TO: 3
TEAM FOULS: 3

================================================================================

================================================================================
                       3RD QUARTER - Team_043 vs Team_020                       
================================================================================

[12:00] Team_043 possession (Score: 59-47)
Magic Durant attempts a 3Pt. Heavily contested by Bam Leonard (0.5 feet, ZONE)! Magic Durant misses. Rebound secured by Bam Leonard.

[11:45] Team_020 possession (Score: 59-47)
Terry Simons attempts a 3Pt. Contested by D'Angelo Iverson (4.7 feet, ZONE). Terry Simons misses. Rebound secured by D'Angelo Iverson.

[11:34] Team_043 possession (Score: 59-47)
Malcolm Murray drives to the basket... Malcolm Murray loses the ball! Stripped by Jarrett McCollum! TURNOVER! (live ball)

[11:16] Team_020 possession (Score: 59-47)
James Cunningham attempts a 3Pt. Wide open! Magic Durant is 6.7 feet away. [MAN] James Cunningham misses. Rebound secured by D'Angelo Iverson.

[11:00] Team_043 possession (Score: 59-47)
Dwyane Dosunmu attempts a Midrange. Contested by Bam Leonard (3.2 feet, MAN). Dwyane Dosunmu misses. Offensive rebound by D'Angelo Iverson! D'Angelo Iverson kicks it out.

[10:42] Team_043 possession (Score: 59-47)
Manu Carter makes the Dunk and draws the foul on Trae Curry! And-1! Manu Carter to the line for 1. [Team fouls: 1] (Trae Curry: 1 personal fouls)   FT 1/1: GOOD Manu Carter makes 1/1 from the line.
Score: 62-47

[10:28] Team_020 possession (Score: 62-47)
James Cunningham attempts a 3Pt. Contested by D'Angelo Iverson (4.8 feet, ZONE). James Cunningham misses. Rebound secured by Dwyane Dosunmu.

[10:11] Team_043 possession (Score: 62-47)
Malcolm Murray attempts a 3Pt. Contested by Jarrett McCollum (3.6 feet, MAN). Malcolm Murray misses. Offensive rebound by D'Angelo Iverson! D'Angelo Iverson kicks it out.

[09:57] Team_043 possession (Score: 62-47)
Malcolm Murray drives to the basket... Malcolm Murray throws a bad pass out of bounds! TURNOVER! (dead ball)

[09:40] Team_020 possession (Score: 62-47)
Trae Curry drives to the basket... Trae Curry throws a bad pass! Stolen by Manu Carter! TURNOVER! (live ball)

[09:28] Team_043 possession (Score: 62-47)
Magic Durant attempts a 3Pt. Heavily contested by Bam Leonard (0.5 feet, ZONE)! Magic Durant misses. Rebound secured by Bam Leonard.

[09:15] Team_020 possession (Score: 62-47)
James Cunningham attempts a Midrange. Contested by Manu Carter (4.6 feet, ZONE). JAMES CUNNINGHAM MAKES IT!
Score: 62-49

[08:59] Team_043 possession (Score: 62-49)
Magic Durant drives and kicks out. Dwyane Dosunmu attempts a Midrange. BLOCKED BY BAM LEONARD! Ball deflects out of bounds off Dwyane Dosunmu.

[08:47] Team_020 possession (Score: 62-49)
Jarrett McCollum attempts a 3Pt. Contested by Malcolm Murray (5.9 feet, MAN). Jarrett McCollum misses. Rebound secured by Manu Carter.

[08:30] Team_043 possession (Score: 62-49)
D'Angelo Iverson attempts a 3Pt. Heavily contested by Bam Leonard (1.2 feet, ZONE)! D'Angelo Iverson misses. Rebound secured by Trae Curry.

[08:13] Team_020 possession (Score: 62-49)
Trae Curry drives, picks up Manu Carter. Help arrives from Malcolm Murray! Trae Curry attempts a Layup. Wide open! Malcolm Murray is 7.2 feet away. [ZONE] TRAE CURRY MAKES IT! Assist: Bam Leonard
Score: 62-51

[07:56] Team_043 possession (Score: 62-51)
D'Angelo Iverson attempts a 3Pt. Contested by Bam Leonard (2.1 feet, ZONE). D'Angelo Iverson misses. Rebound secured by Bam Leonard.

[07:41] Team_020 possession (Score: 62-51)
Terry Simons attempts a 3Pt. Heavily contested by D'Angelo Iverson (1.1 feet, MAN)! Terry Simons misses. Rebound secured by D'Angelo Iverson.

[07:26] Team_043 possession (Score: 62-51)
Manu Carter drives, picks up Bam Leonard. Help arrives from Jarrett McCollum! Manu Carter attempts a Dunk. Contested by Jarrett McCollum (4.9 feet, MAN). MANU CARTER MAKES IT! Assist: D'Angelo Iverson
Score: 64-51

[07:09] Team_020 possession (Score: 64-51)
Jarrett McCollum drives to the basket... Jarrett McCollum loses control! Ball rolls out of bounds! TURNOVER! (dead ball)

[06:55] Team_043 possession (Score: 64-51)
D'Angelo Iverson drives, Trae Curry stays with him. D'Angelo Iverson attempts a Dunk. Heavily contested by Trae Curry (1.7 feet, ZONE)! D'ANGELO IVERSON MAKES IT!
Score: 66-51

[06:41] Team_020 possession (Score: 66-51)
Jarrett McCollum drives to the basket... Jarrett McCollum throws a bad pass out of bounds! TURNOVER! (dead ball)

[06:27] Team_043 possession (Score: 66-51)
Magic Durant drives and kicks out. Dwyane Dosunmu attempts a 3Pt. Heavily contested by Bam Leonard (1.6 feet, ZONE)! Dwyane Dosunmu misses. Rebound secured by Terry Simons.

[06:14] Team_020 possession (Score: 66-51)
Bam Leonard attempts a Midrange. Contested by Manu Carter (4.9 feet, ZONE). Bam Leonard misses. Rebound secured by Manu Carter.

[06:02] Team_043 possession (Score: 66-51)
Dwyane Dosunmu attempts a Midrange. Heavily contested by Bam Leonard (1.4 feet, MAN)! Dwyane Dosunmu misses. Offensive rebound by D'Angelo Iverson! D'Angelo Iverson kicks it out.

[05:47] Team_043 possession (Score: 66-51)
FOUL! Offensive foul on Magic Durant! James Cunningham drew the charge! [Team fouls: 1] (Magic Durant: 1 personal fouls) TURNOVER! (dead ball)

[05:34] Team_020 possession (Score: 66-51)
Bam Leonard makes the Layup and draws the foul on Manu Carter! And-1! Bam Leonard to the line for 1. [Team fouls: 2] (Manu Carter: 1 personal fouls)   FT 1/1: MISS Bam Leonard makes 0/1 from the line. Offensive rebound by Bam Leonard! Bam Leonard puts it back in!
Score: 66-55

[05:23] Team_043 possession (Score: 66-55)
Dwyane Dosunmu drives to the basket... Dwyane Dosunmu loses the ball! Stripped by Trae Curry! TURNOVER! (live ball)

[05:08] Team_020 possession (Score: 66-55)
FOUL! Holding foul on Magic Durant. [Team fouls: 3] No free throws, side out. (Magic Durant: 2 personal fouls)

[04:53] Team_020 possession (Score: 66-55)
James Cunningham attempts a 3Pt. Wide open! Magic Durant is 6.8 feet away. [MAN] James Cunningham misses. Rebound secured by Dwyane Dosunmu.

[04:40] Team_043 possession (Score: 66-55)
Manu Carter drives and kicks out. D'Angelo Iverson attempts a 3Pt. Contested by Terry Simons (4.5 feet, MAN). D'Angelo Iverson misses. Rebound secured by Terry Simons.

[04:29] Team_020 possession (Score: 66-55)
Jarrett McCollum attempts a Layup. Contested by Malcolm Murray (5.7 feet, MAN). JARRETT MCCOLLUM MAKES IT! Assist: Bam Leonard
Score: 66-57

[04:13] Team_043 possession (Score: 66-57)
Manu Carter attempts a 3Pt. Contested by Bam Leonard (3.1 feet, MAN). MANU CARTER MAKES IT! Assist: Malcolm Murray
Score: 69-57

[03:59] Team_020 possession (Score: 69-57)
Bam Leonard drives and kicks out. Bam Leonard attempts a 3Pt. Wide open! D'Angelo Iverson is 6.5 feet away. [ZONE] BAM LEONARD MAKES IT! Assist: James Cunningham
Score: 69-60

[03:45] Team_043 possession (Score: 69-60)
Magic Durant attempts a 3Pt. Heavily contested by Bam Leonard (1.7 feet, ZONE)! Magic Durant misses. Rebound secured by Trae Curry.

[03:33] Team_020 possession (Score: 69-60)
Bam Leonard throws a bad pass! Stolen by Manu Carter! TURNOVER! (live ball)

[03:19] Team_043 possession (Score: 69-60)
Magic Durant drives and kicks out. Manu Carter attempts a 3Pt. Contested by Bam Leonard (4.2 feet, MAN). Manu Carter misses. Rebound secured by Trae Curry.

[03:06] Team_020 possession (Score: 69-60)
Bam Leonard attempts a Midrange. Contested by Manu Carter (2.3 feet, ZONE). Bam Leonard misses. Offensive rebound by Bam Leonard! Bam Leonard puts it back in!
Score: 69-62

[02:49] Team_043 possession (Score: 69-62)
Magic Durant attempts a 3Pt. Wide open! James Cunningham is 6.4 feet away. [MAN] Magic Durant misses. Rebound secured by Trae Curry.

[02:36] Team_020 possession (Score: 69-62)
FOUL! Shooting foul on Malcolm Murray. James Cunningham to the line for 2 free throws. [Team fouls: 4] (Malcolm Murray: 1 personal fouls)   FT 1/2: GOOD   FT 2/2: MISS James Cunningham makes 1/2 from the line. Offensive rebound by Trae Curry! Trae Curry's putback is no good.
Score: 69-63

[02:21] Team_043 possession (Score: 69-63)
D'Angelo Iverson attempts a 3Pt. Heavily contested by Bam Leonard (1.0 feet, ZONE)! D'Angelo Iverson misses. FOUL! Loose ball foul on Terry Simons during the rebound battle. [Team fouls: 2] No free throws, side out. (Terry Simons: 1 personal fouls)

[02:03] Team_043 possession (Score: 69-63)
Malcolm Murray attempts a 3Pt. Contested by Bam Leonard (5.6 feet, ZONE). MALCOLM MURRAY MAKES IT! Assist: Magic Durant
Score: 72-63

[01:51] Team_020 possession (Score: 72-63)
Jarrett McCollum attempts a 3Pt. Contested by Malcolm Murray (5.1 feet, MAN). Jarrett McCollum misses. Rebound secured by Manu Carter.

[01:35] Team_043 possession (Score: 72-63)
Dwyane Dosunmu attempts a Midrange. Heavily contested by Bam Leonard (0.5 feet, MAN)! Dwyane Dosunmu misses. Offensive rebound by D'Angelo Iverson! D'Angelo Iverson kicks it out.

[01:18] Team_043 possession (Score: 72-63)
FOUL! Shooting foul on Bam Leonard. Dwyane Dosunmu to the line for 3 free throws. [Team fouls: 3] (Bam Leonard: 1 personal fouls)   FT 1/3: GOOD   FT 2/3: GOOD   FT 3/3: MISS Dwyane Dosunmu makes 2/3 from the line. Offensive rebound by Manu Carter! Manu Carter kicks it out.
Score: 74-63

[01:02] Team_043 possession (Score: 74-63)
D'Angelo Iverson attempts a 3Pt. Wide open! Terry Simons is 7.2 feet away. [MAN] D'Angelo Iverson misses. Rebound secured by Trae Curry.

[00:44] Team_020 possession (Score: 74-63)
James Cunningham drives, Manu Carter stays with him. James Cunningham attempts a Layup. Contested by Manu Carter (4.8 feet, ZONE). James Cunningham misses. Rebound secured by D'Angelo Iverson.

[00:30] Team_043 possession (Score: 74-63)
Manu Carter attempts a Layup. BLOCKED BY BAM LEONARD! Ball is loose! Rebound secured by Bam Leonard.

[00:15] Team_020 possession (Score: 74-63)
James Cunningham drives, picks up Magic Durant. Help arrives from D'Angelo Iverson! James Cunningham attempts a Dunk. Wide open! D'Angelo Iverson is 6.5 feet away. [MAN] James Cunningham misses. Rebound secured by Manu Carter.

================================================================================
                              3RD QUARTER COMPLETE                              
================================================================================

3RD QUARTER SCORE: Team_043 15, Team_020 16

BOX SCORE:
================================================================================

Team_043
--------------------------------------------------------------------------------
Player                MIN  PTS  REB  AST  TO      FG   FG%      3P   3P%
--------------------------------------------------------------------------------
Manu Carter            28    8    5    0   0   3/5    60.0     0/0   0.0
Malcolm Murray         28    3    0    1   0   1/1   100.0     0/0   0.0
D'Angelo Iverson       28    2    9    1   0   1/4    25.0     0/0   0.0
Magic Durant           28    0    0    1   0   0/7     0.0     0/0   0.0
Dwyane Dosunmu         28    0    2    0   0   0/0     0.0     0/0   0.0

TEAM: FG: 5/17 (29.4%), 3PT: 2/9 (22.2%), REB: 17 (6 off, 11 def), AST: 3, TO: 4
TEAM FOULS: 4


Team_020
--------------------------------------------------------------------------------
Player                MIN  PTS  REB  AST  TO      FG   FG%      3P   3P%
--------------------------------------------------------------------------------
Bam Leonard            28    9    5    2   0   3/4    75.0     0/0   0.0
James Cunningham       28    2    0    1   0   1/7    14.3     0/0   0.0
Jarrett McCollum       28    2    0    0   0   1/3    33.3     0/0   0.0
Trae Curry             28    2    6    0   0   1/1   100.0     0/0   0.0
Terry Simons           28    0    2    0   0   0/2     0.0     0/0   0.0

TEAM: FG: 6/17 (35.3%), 3PT: 0/7 (0.0%), REB: 12 (1 off, 11 def), AST: 3, TO: 4
TEAM FOULS: 3

================================================================================

================================================================================
                       4TH QUARTER - Team_043 vs Team_020                       
================================================================================

[12:00] Team_043 possession (Score: 74-63)
D'Angelo Iverson attempts a Midrange. Contested by Bam Leonard (3.8 feet, ZONE). D'Angelo Iverson misses. Rebound secured by Terry Simons.

[11:50] Team_020 possession (Score: 74-63)
Jarrett McCollum attempts a 3Pt. Wide open! Malcolm Murray is 6.1 feet away. [MAN] JARRETT MCCOLLUM MAKES IT! Assist: Trae Curry
Score: 74-66

[11:36] Team_043 possession (Score: 74-66)
Magic Durant attempts a 3Pt. Contested by James Cunningham (2.1 feet, MAN). MAGIC DURANT MAKES IT! Assist: Manu Carter
Score: 77-66

[11:17] Team_020 possession (Score: 77-66)
James Cunningham drives and kicks out. Jarrett McCollum attempts a 3Pt. Heavily contested by D'Angelo Iverson (1.9 feet, ZONE)! Jarrett McCollum misses. Rebound secured by D'Angelo Iverson.

[11:02] Team_043 possession (Score: 77-66)
D'Angelo Iverson drives and kicks out. Dwyane Dosunmu attempts a 3Pt. Contested by Bam Leonard (5.1 feet, MAN). Dwyane Dosunmu misses. Rebound secured by Trae Curry.

[10:46] Team_020 possession (Score: 77-66)
James Cunningham attempts a Layup. Wide open! Manu Carter is 7.0 feet away. [ZONE] JAMES CUNNINGHAM MAKES IT!
Score: 77-68

[10:33] Team_043 possession (Score: 77-68)
Dwyane Dosunmu attempts a Midrange. Contested by Bam Leonard (5.2 feet, MAN). Dwyane Dosunmu misses. Rebound secured by Bam Leonard.

[10:17] Team_020 possession (Score: 77-68)
James Cunningham attempts a Midrange. Wide open! Magic Durant is 7.1 feet away. [MAN] James Cunningham misses. Rebound secured by D'Angelo Iverson.

[10:02] Team_043 possession (Score: 77-68)
D'Angelo Iverson attempts a Midrange. Wide open! Terry Simons is 7.3 feet away. [MAN] D'ANGELO IVERSON MAKES IT! Assist: Manu Carter
Score: 79-68

[09:50] Team_020 possession (Score: 79-68)
FOUL! Shooting foul on Manu Carter. Trae Curry to the line for 2 free throws. [Team fouls: 1] (Manu Carter: 1 personal fouls)   FT 1/2: GOOD   FT 2/2: GOOD Trae Curry makes 2/2 from the line.
Score: 79-70

[09:36] Team_043 possession (Score: 79-70)
D'Angelo Iverson makes the 3Pt and draws the foul on Bam Leonard! And-1! D'Angelo Iverson to the line for 1. [Team fouls: 1] (Bam Leonard: 1 personal fouls)   FT 1/1: GOOD D'Angelo Iverson makes 1/1 from the line.
Score: 83-70

[09:21] Team_020 possession (Score: 83-70)
FOUL! Holding foul on D'Angelo Iverson. [Team fouls: 2] No free throws, side out. (D'Angelo Iverson: 1 personal fouls)

[09:07] Team_020 possession (Score: 83-70)
FOUL! Reach-in foul on Manu Carter during the drive. [Team fouls: 3] No free throws, side out. (Manu Carter: 2 personal fouls)

[08:53] Team_020 possession (Score: 83-70)
Bam Leonard attempts a Layup. Wide open! Manu Carter is 9.7 feet away. [MAN] Bam Leonard misses. Offensive rebound by Trae Curry! Trae Curry kicks it out.

[08:36] Team_020 possession (Score: 83-70)
Bam Leonard attempts a Midrange. Contested by D'Angelo Iverson (3.6 feet, ZONE). BAM LEONARD MAKES IT! Assist: Trae Curry
Score: 83-72

[08:19] Team_043 possession (Score: 83-72)
Magic Durant makes the Midrange and draws the foul on Bam Leonard! And-1! Magic Durant to the line for 1. [Team fouls: 2] (Bam Leonard: 2 personal fouls)   FT 1/1: GOOD Magic Durant makes 1/1 from the line.
Score: 86-72

[08:05] Team_020 possession (Score: 86-72)
Bam Leonard drives and kicks out. James Cunningham attempts a 3Pt. Contested by D'Angelo Iverson (2.8 feet, ZONE). James Cunningham misses. Rebound secured by Manu Carter.

[07:55] Team_043 possession (Score: 86-72)
FOUL! Reach-in foul on Trae Curry during the drive. [Team fouls: 3] No free throws, side out. (Trae Curry: 1 personal fouls)

[07:39] Team_043 possession (Score: 86-72)
Magic Durant attempts a Midrange. Contested by Bam Leonard (4.5 feet, ZONE). MAGIC DURANT MAKES IT! Assist: Dwyane Dosunmu
Score: 88-72

[07:25] Team_020 possession (Score: 88-72)
Terry Simons attempts a 3Pt. Contested by D'Angelo Iverson (4.2 feet, MAN). Terry Simons misses. Rebound secured by Manu Carter.

[07:10] Team_043 possession (Score: 88-72)
Manu Carter attempts a 3Pt. Contested by Bam Leonard (4.7 feet, MAN). Manu Carter misses. Rebound secured by Bam Leonard.

[06:54] Team_020 possession (Score: 88-72)
Terry Simons attempts a Midrange. Contested by D'Angelo Iverson (2.7 feet, ZONE). Terry Simons misses. Offensive rebound by Bam Leonard! Bam Leonard puts it back in!
Score: 88-74

[06:43] Team_043 possession (Score: 88-74)
FOUL! Shooting foul on Bam Leonard. Dwyane Dosunmu to the line for 2 free throws. [Team fouls: 4] (Bam Leonard: 3 personal fouls)   FT 1/2: GOOD   FT 2/2: GOOD Dwyane Dosunmu makes 2/2 from the line.
Score: 90-74

[06:28] Team_020 possession (Score: 90-74)
Jarrett McCollum attempts a 3Pt. Wide open! Malcolm Murray is 7.0 feet away. [MAN] Jarrett McCollum misses. Offensive rebound by Trae Curry! Trae Curry kicks it out.

[06:16] Team_020 possession (Score: 90-74)
James Cunningham drives and kicks out. Trae Curry attempts a 3Pt. Wide open! Dwyane Dosunmu is 6.7 feet away. [MAN] Trae Curry misses. Rebound secured by Dwyane Dosunmu.

[06:04] Team_043 possession (Score: 90-74)
Malcolm Murray drives, Trae Curry stays with him. Malcolm Murray attempts a Layup. Wide open! Trae Curry is 7.5 feet away. [ZONE] MALCOLM MURRAY MAKES IT! Assist: Dwyane Dosunmu
Score: 92-74

[05:53] Team_020 possession (Score: 92-74)
Terry Simons attempts a 3Pt. Contested by D'Angelo Iverson (3.6 feet, MAN). Terry Simons misses. Rebound secured by D'Angelo Iverson.

[05:40] Team_043 possession (Score: 92-74)
Dwyane Dosunmu attempts a Layup. Wide open! Trae Curry is 6.6 feet away. [ZONE] Dwyane Dosunmu misses. Rebound secured by Trae Curry.

[05:26] Team_020 possession (Score: 92-74)
Trae Curry drives, Dwyane Dosunmu stays with him. Trae Curry attempts a Layup. Wide open! Dwyane Dosunmu is 8.5 feet away. [MAN] Trae Curry misses. FOUL! Loose ball foul on D'Angelo Iverson during the rebound battle. [Team fouls: 4] No free throws, side out. (D'Angelo Iverson: 2 personal fouls)

[05:12] Team_020 possession (Score: 92-74)
Terry Simons attempts a Layup. Contested by D'Angelo Iverson (5.5 feet, MAN). Terry Simons misses. Offensive rebound by Bam Leonard! Bam Leonard kicks it out.

[04:56] Team_020 possession (Score: 92-74)
Bam Leonard drives, picks up Manu Carter. Help arrives from Malcolm Murray! Bam Leonard attempts a Dunk. Contested by Malcolm Murray (4.4 feet, MAN). Bam Leonard misses. Rebound secured by Dwyane Dosunmu.

[04:41] Team_043 possession (Score: 92-74)
FOUL! Reach-in foul on Jarrett McCollum during the drive. [IN THE BONUS! 5 team fouls] Malcolm Murray to the line for 2 free throws. (Jarrett McCollum: 1 personal fouls)   FT 1/2: MISS   FT 2/2: GOOD Malcolm Murray makes 1/2 from the line.
Score: 93-74

[04:24] Team_020 possession (Score: 93-74)
James Cunningham attempts a Midrange. Wide open! Magic Durant is 6.4 feet away. [MAN] JAMES CUNNINGHAM MAKES IT!
Score: 93-76

[04:11] Team_043 possession (Score: 93-76)
Dwyane Dosunmu attempts a Midrange. Wide open! Trae Curry is 6.7 feet away. [MAN] DWYANE DOSUNMU MAKES IT!
Score: 95-76

[03:55] Team_020 possession (Score: 95-76)
Jarrett McCollum attempts a 3Pt. Contested by Malcolm Murray (5.1 feet, MAN). Jarrett McCollum misses. Offensive rebound by Trae Curry! Trae Curry kicks it out.

[03:38] Team_020 possession (Score: 95-76)
James Cunningham attempts a 3Pt. Contested by D'Angelo Iverson (3.4 feet, ZONE). James Cunningham misses. Rebound secured by Dwyane Dosunmu.

[03:23] Team_043 possession (Score: 95-76)
Manu Carter drives and kicks out. Manu Carter attempts a Midrange. Wide open! Terry Simons is 9.3 feet away. [ZONE] MANU CARTER MAKES IT! Assist: Malcolm Murray
Score: 97-76

[03:07] Team_020 possession (Score: 97-76)
James Cunningham attempts a Layup. Contested by Dwyane Dosunmu (3.8 feet, ZONE). James Cunningham misses. Offensive rebound by Bam Leonard! Bam Leonard kicks it out.

[02:58] Team_020 possession (Score: 97-76)
Trae Curry drives to the basket... Trae Curry commits a violation (traveling/carry)! TURNOVER! (dead ball)

[02:58] Substitution (Team_043): Malcolm Murray OUT → Jabari Holiday IN (stamina_rule2)

[02:58] Substitution (Team_043): Magic Durant OUT → Ben LaVine IN (stamina_rule2)

[02:58] Substitution (Team_043): D'Angelo Iverson OUT → Dirk Herro IN (stamina_rule2)

[02:58] Substitution (Team_043): Manu Carter OUT → Joel Murray IN (stamina_rule2)

[02:58] Substitution (Team_043): Dwyane Dosunmu OUT → Terry Randle IN (stamina_rule2)

[02:58] Substitution (Team_020): Jarrett McCollum OUT → Franz Doncic IN (stamina_rule2)

[02:58] Substitution (Team_020): James Cunningham OUT → Stephen Parker IN (stamina_rule2)

[02:58] Substitution (Team_020): Terry Simons OUT → Victor Holiday IN (stamina_rule2)

[02:58] Substitution (Team_020): Bam Leonard OUT → Cole Barnes IN (stamina_rule2)

[02:58] Substitution (Team_020): Trae Curry OUT → Miles Siakam IN (stamina_rule2)

[02:42] Team_043 possession (Score: 97-76)
Terry Randle attempts a 3Pt. Contested by Stephen Parker (4.3 feet, ZONE). TERRY RANDLE MAKES IT! Assist: Dirk Herro
Score: 100-76

[02:33] Team_020 possession (Score: 100-76)
Miles Siakam makes the Dunk and draws the foul on Terry Randle! And-1! Miles Siakam to the line for 1. [BONUS: 5 team fouls] (Terry Randle: 1 personal fouls)   FT 1/1: MISS Miles Siakam makes 0/1 from the line. Offensive rebound by Miles Siakam! Miles Siakam kicks it out.
Score: 100-78

[02:20] Team_020 possession (Score: 100-78)
Miles Siakam attempts a Midrange. Contested by Ben LaVine (5.6 feet, ZONE). Miles Siakam misses. Rebound secured by Dirk Herro.

[02:03] Team_043 possession (Score: 100-78)
Terry Randle makes the Midrange and draws the foul on Miles Siakam! And-1! Terry Randle to the line for 1. [BONUS: 6 team fouls] (Miles Siakam: 1 personal fouls)   FT 1/1: GOOD Terry Randle makes 1/1 from the line.
Score: 103-78

[01:45] Team_020 possession (Score: 103-78)
FOUL! Reach-in foul on Ben LaVine during the drive. [IN THE BONUS! 6 team fouls] Stephen Parker to the line for 2 free throws. (Ben LaVine: 1 personal fouls)   FT 1/2: GOOD   FT 2/2: GOOD Stephen Parker makes 2/2 from the line.
Score: 103-80

[01:29] Team_043 possession (Score: 103-80)
FOUL! Shooting foul on Miles Siakam. Terry Randle to the line for 2 free throws. [BONUS: 7 team fouls] (Miles Siakam: 2 personal fouls)   FT 1/2: MISS   FT 2/2: GOOD Terry Randle makes 1/2 from the line.
Score: 104-80

[01:17] Team_020 possession (Score: 104-80)
Victor Holiday attempts a Layup. Wide open! Terry Randle is 6.2 feet away. [ZONE] VICTOR HOLIDAY MAKES IT!
Score: 104-82

[01:06] Team_043 possession (Score: 104-82)
Joel Murray loses control! Ball rolls out of bounds! TURNOVER! (dead ball)

[00:51] Team_020 possession (Score: 104-82)
Franz Doncic attempts a 3Pt. Contested by Dirk Herro (3.2 feet, ZONE). Franz Doncic misses. Offensive rebound by Miles Siakam! Miles Siakam kicks it out.

[00:36] Team_020 possession (Score: 104-82)
Cole Barnes drives and kicks out. Victor Holiday attempts a 3Pt. Contested by Dirk Herro (3.7 feet, MAN). VICTOR HOLIDAY MAKES IT! Assist: Cole Barnes
Score: 104-85

[00:24] Team_043 possession (Score: 104-85)
Dirk Herro attempts a 3Pt. Contested by Victor Holiday (5.1 feet, MAN). DIRK HERRO MAKES IT! Assist: Jabari Holiday
Score: 107-85

[00:12] Team_020 possession (Score: 107-85)
Franz Doncic attempts a Midrange. Contested by Ben LaVine (4.3 feet, ZONE). FRANZ DONCIC MAKES IT!
Score: 107-87

================================================================================
                              4TH QUARTER COMPLETE                              
================================================================================

4TH QUARTER SCORE: Team_043 33, Team_020 24

BOX SCORE:
================================================================================

Team_043
--------------------------------------------------------------------------------
Player                MIN  PTS  REB  AST  TO      FG   FG%      3P   3P%
--------------------------------------------------------------------------------
Magic Durant           37    8    0    0   0   3/3   100.0     0/0   0.0
Terry Randle           11    7    0    0   0   3/3   100.0     0/0   0.0
D'Angelo Iverson       37    6    3    0   0   2/4    50.0     0/0   0.0
Dwyane Dosunmu         37    4    3    2   0   2/4    50.0     0/0   0.0
Malcolm Murray         37    3    0    1   0   2/2   100.0     0/0   0.0
Dirk Herro             11    3    1    1   0   1/1   100.0     0/0   0.0
Manu Carter            37    2    2    2   0   1/2    50.0     0/0   0.0
Jabari Holiday         11    0    0    1   0   0/0     0.0     0/0   0.0

TEAM: FG: 14/19 (73.7%), 3PT: 4/5 (80.0%), REB: 9 (0 off, 9 def), AST: 7, TO: 1
TEAM FOULS: 6 [Team_020 in BONUS]


Team_020
--------------------------------------------------------------------------------
Player                MIN  PTS  REB  AST  TO      FG   FG%      3P   3P%
--------------------------------------------------------------------------------
Victor Holiday         11    5    0    0   0   2/2   100.0     0/0   0.0
James Cunningham       37    4    0    0   0   2/6    33.3     0/0   0.0
Bam Leonard            37    4    5    0   0   2/4    50.0     0/0   0.0
Jarrett McCollum       37    3    0    0   0   1/1   100.0     0/0   0.0
Trae Curry             37    2    6    2   0   1/1   100.0     0/0   0.0
Stephen Parker         11    2    0    0   0   1/1   100.0     0/0   0.0
Franz Doncic           11    2    0    0   0   1/1   100.0     0/0   0.0
Terry Simons           37    0    1    0   0   0/2     0.0     0/0   0.0
Miles Siakam           11    0    2    0   0   0/1     0.0     0/0   0.0
Cole Barnes            11    0    0    1   0   0/0     0.0     0/0   0.0

TEAM: FG: 10/19 (52.6%), 3PT: 1/4 (25.0%), REB: 14 (9 off, 5 def), AST: 3, TO: 1
TEAM FOULS: 7 [Team_043 in BONUS]

================================================================================

================================================================================
                               FULL GAME COMPLETE                               
================================================================================

FINAL SCORE: Team_043 107, Team_020 87

SCORING BY QUARTER:
--------------------------------------------------------------------------------
Team                     Q1     Q2     Q3     Q4    FINAL
--------------------------------------------------------------------------------
Team_043                 29     30     15     33      107
Team_020                 23     24     16     24       87
--------------------------------------------------------------------------------

FULL GAME BOX SCORE:
================================================================================

Team_043
--------------------------------------------------------------------------------
Player                MIN  PTS  REB  AST  TO      FG   FG%      3P   3P%      FT STL BLK
--------------------------------------------------------------------------------
Malcolm Murray         37   12    0    2   1   5/7    71.4   1/2    50.0   5/6     1   0
Magic Durant           37   15    0    3   2   6/15   40.0   2/7    28.6   3/4     0   0
D'Angelo Iverson       37   12   18    5   1   4/11   36.4   1/5    20.0   7/8     0   0
Manu Carter            37   16   14    2   4   8/13   61.5   1/4    25.0   1/1     2   0
Dwyane Dosunmu         37   10   10    2   2   5/11   45.5   2/2   100.0   8/11    0   0
Jabari Holiday         11    2    0    2   0   2/3    66.7   1/2    50.0   0/0     0   0
Ben LaVine             11   13    4    0   0   5/7    71.4   1/2    50.0   2/2     0   1
Dirk Herro             11    9    4    2   0   2/3    66.7   1/1   100.0   0/0     0   1
Joel Murray            11    5    0    2   1   2/3    66.7   1/2    50.0   0/0     0   0
Terry Randle           11    7    1    1   0   4/5    80.0   1/1   100.0   2/3     0   1

TEAM: FG: 44/79 (55.7%), 3PT: 12/28 (42.9%), REB: 51 (10 off, 41 def), AST: 21, TO: 11


Team_020
--------------------------------------------------------------------------------
Player                MIN  PTS  REB  AST  TO      FG   FG%      3P   3P%      FT STL BLK
--------------------------------------------------------------------------------
Jarrett McCollum       37    8    0    2   1   4/7    57.1   1/4    25.0   1/2     1   0
James Cunningham       37   18    0    1   1   7/22   31.8   3/10   30.0   2/3     0   0
Terry Simons           37    3    6    2   2   3/10   30.0   2/9    22.2   3/3     0   0
Bam Leonard            37   17   17    2   2   5/14   35.7   0/4     0.0   0/1     2   2
Trae Curry             37    8   18    2   3   4/5    80.0   0/0     0.0   2/2     1   0
Franz Doncic           11    5    0    2   0   3/5    60.0   0/1     0.0   1/3     0   0
Stephen Parker         11    5    0    0   0   2/5    40.0   1/3    33.3   2/2     0   0
Victor Holiday         11    7    2    0   0   3/4    75.0   0/0     0.0   0/0     0   0
Cole Barnes            11    7    4    2   0   4/5    80.0   0/0     0.0   1/1     0   0
Miles Siakam           11    4    4    1   1   1/2    50.0   0/0     0.0   2/3     0   0

TEAM: FG: 36/79 (45.6%), 3PT: 7/31 (22.6%), REB: 50 (16 off, 34 def), AST: 14, TO: 10

================================================================================
