================================================================================
                        FULL GAME - Team_015 vs Team_057                        
================================================================================

================================================================================
                       1ST QUARTER - Team_015 vs Team_057                       
================================================================================

[12:00] Team_015 possession (Score: 0-0)
CJ Banchero attempts a 3Pt. Heavily contested by Kobe Ming (0.6 feet, ZONE)! CJ Banchero misses. Rebound secured by Anfernee Adebayo.

[11:45] Team_057 possession (Score: 0-0)
FOUL! Shooting foul on Scottie Gasol. Kobe Ming to the line for 2 free throws. [Team fouls: 1] (Scottie Gasol: 1 personal fouls)   FT 1/2: GOOD   FT 2/2: MISS Kobe Ming makes 1/2 from the line. Offensive rebound by Miles Middleton! Miles Middleton kicks it out.
Score: 0-1

[11:27] Team_057 possession (Score: 0-1)
Klay Rozier makes the Midrange and draws the foul on Scottie Gasol! And-1! Klay Rozier to the line for 1. [Team fouls: 2] (Scottie Gasol: 2 personal fouls)   FT 1/1: MISS Klay Rozier makes 0/1 from the line. Offensive rebound by Ben Adebayo! Ben Adebayo kicks it out.
Score: 0-3

[11:14] Team_057 possession (Score: 0-3)
FOUL! Offensive foul on Kobe Ming! Manu Anthony drew the charge! [Team fouls: 1] (Kobe Ming: 1 personal fouls) TURNOVER! (dead ball)

[10:58] Team_015 possession (Score: 0-3)
Michael Simmons attempts a Layup. Wide open! Ben Adebayo is 6.2 feet away. [ZONE] MICHAEL SIMMONS MAKES IT!
Score: 2-3

[10:48] Team_057 possession (Score: 2-3)
Ben Adebayo drives and kicks out. FOUL! Shooting foul on Manu Anthony. Kobe Ming to the line for 3 free throws. [Team fouls: 3] (Manu Anthony: 1 personal fouls)   FT 1/3: GOOD   FT 2/3: GOOD   FT 3/3: GOOD Kobe Ming makes 3/3 from the line.
Score: 2-6

[10:31] Team_015 possession (Score: 2-6)
Scottie Gasol attempts a Dunk. BLOCKED BY MILES MIDDLETON! Ball is loose! Rebound secured by Miles Middleton.

[10:21] Team_057 possession (Score: 2-6)
Klay Rozier attempts a Midrange. Wide open! Michael Simmons is 6.1 feet away. [MAN] Klay Rozier misses. Rebound secured by CJ Banchero.

[10:08] Team_015 possession (Score: 2-6)
CJ Banchero drives, Anfernee Adebayo stays with him. CJ Banchero attempts a Dunk. Contested by Anfernee Adebayo (4.7 feet, MAN). CJ BANCHERO MAKES IT!
Score: 4-6

[09:56] Team_057 possession (Score: 4-6)
Kobe Ming attempts a Layup. Contested by Manu Anthony (3.9 feet, MAN). KOBE MING MAKES IT! Assist: Klay Rozier
Score: 4-8

[09:39] Team_015 possession (Score: 4-8)
Scottie Gasol makes the Midrange and draws the foul on Ben Adebayo! And-1! Scottie Gasol to the line for 1. [Team fouls: 2] (Ben Adebayo: 1 personal fouls)   FT 1/1: MISS Scottie Gasol makes 0/1 from the line. Offensive rebound by CJ Banchero! CJ Banchero puts it back in!
Score: 8-8

[09:23] Team_057 possession (Score: 8-8)
Kobe Ming attempts a Midrange. Contested by Michael Simmons (2.3 feet, ZONE). Kobe Ming misses. Rebound secured by Trae Turner.

[09:11] Team_015 possession (Score: 8-8)
Trae Turner drives and kicks out. Scottie Gasol attempts a 3Pt. Contested by Ben Adebayo (5.3 feet, MAN). SCOTTIE GASOL MAKES IT! Assist: CJ Banchero
Score: 11-8

[08:54] Team_057 possession (Score: 11-8)
Anfernee Adebayo attempts a 3Pt. Heavily contested by Manu Anthony (0.6 feet, ZONE)! Anfernee Adebayo misses. Rebound secured by Michael Simmons.

[08:39] Team_015 possession (Score: 11-8)
Trae Turner attempts a Midrange. Contested by Ben Adebayo (5.5 feet, ZONE). Trae Turner misses. FOUL! Loose ball foul on Miles Middleton during the rebound battle. [Team fouls: 3] No free throws, side out. (Miles Middleton: 1 personal fouls)

[08:23] Team_015 possession (Score: 11-8)
Trae Turner drives, picks up Miles Middleton. Help arrives from Klay Rozier! Trae Turner attempts a Layup. Contested by Klay Rozier (3.2 feet, MAN). Trae Turner misses. Rebound secured by Miles Middleton.

[08:06] Team_057 possession (Score: 11-8)
Kobe Ming makes the Layup and draws the foul on Scottie Gasol! And-1! Kobe Ming to the line for 1. [Team fouls: 4] (Scottie Gasol: 3 personal fouls)   FT 1/1: GOOD Kobe Ming makes 1/1 from the line.
Score: 11-11

[07:50] Team_015 possession (Score: 11-11)
Scottie Gasol attempts a Layup. Wide open! Ben Adebayo is 6.6 feet away. [MAN] SCOTTIE GASOL MAKES IT!
Score: 13-11

[07:36] Team_057 possession (Score: 13-11)
Kobe Ming throws a bad pass out of bounds! TURNOVER! (dead ball)

[07:18] Team_015 possession (Score: 13-11)
Scottie Gasol attempts a Midrange. Contested by Ben Adebayo (2.7 feet, MAN). Scottie Gasol misses. Rebound secured by Miles Middleton.

[07:07] Team_057 possession (Score: 13-11)
Klay Rozier attempts a 3Pt. Contested by Manu Anthony (3.8 feet, ZONE). KLAY ROZIER MAKES IT! Assist: Miles Middleton
Score: 13-14

[06:52] Team_015 possession (Score: 13-14)
Scottie Gasol loses control! Ball rolls out of bounds! TURNOVER! (dead ball)

[06:37] Team_057 possession (Score: 13-14)
Klay Rozier attempts a 3Pt. Contested by Manu Anthony (3.7 feet, ZONE). KLAY ROZIER MAKES IT! Assist: Kobe Ming
Score: 13-17

[06:25] Team_015 possession (Score: 13-17)
CJ Banchero drives and kicks out. Manu Anthony attempts a 3Pt. Contested by Kobe Ming (4.1 feet, MAN). Manu Anthony misses. Rebound secured by Ben Adebayo.

[06:11] Team_057 possession (Score: 13-17)
Klay Rozier attempts a 3Pt. Contested by Michael Simmons (4.6 feet, MAN). Klay Rozier misses. FOUL! Loose ball foul on Trae Turner during the rebound battle. [IN THE BONUS! 5 team fouls] Miles Middleton to the line for 2 free throws. (Trae Turner: 1 personal fouls)   FT 1/2: GOOD   FT 2/2: GOOD Miles Middleton makes 2/2 from the line.
Score: 13-19

[05:53] Team_015 possession (Score: 13-19)
Trae Turner attempts a Layup. BLOCKED BY MILES MIDDLETON! Ball is loose! Rebound secured by Anfernee Adebayo.

[05:41] Team_057 possession (Score: 13-19)
Ben Adebayo drives, picks up Scottie Gasol. Help arrives from Michael Simmons! Ben Adebayo attempts a Dunk. Contested by Michael Simmons (4.1 feet, ZONE). Ben Adebayo misses. Rebound secured by Trae Turner.

[05:24] Team_015 possession (Score: 13-19)
FOUL! Reach-in foul on Ben Adebayo during the drive. [Team fouls: 4] No free throws, side out. (Ben Adebayo: 2 personal fouls)

[05:08] Team_015 possession (Score: 13-19)
Michael Simmons drives to the basket... FOUL! Offensive foul on Michael Simmons! Miles Middleton drew the charge! [Team fouls: 6] (Michael Simmons: 1 personal fouls) TURNOVER! (dead ball)

[04:50] Team_057 possession (Score: 13-19)
FOUL! Holding foul on Manu Anthony. [IN THE BONUS! 7 team fouls] Kobe Ming to the line for 2 free throws. (Manu Anthony: 2 personal fouls)   FT 1/2: GOOD   FT 2/2: MISS Kobe Ming makes 1/2 from the line. Offensive rebound by Ben Adebayo! Ben Adebayo kicks it out.
Score: 13-20

[04:33] Team_057 possession (Score: 13-20)
Anfernee Adebayo loses the ball! Stripped by CJ Banchero! TURNOVER! (live ball)

[04:16] Team_015 possession (Score: 13-20)
CJ Banchero attempts a 3Pt. Contested by Kobe Ming (3.1 feet, ZONE). CJ Banchero misses. Rebound secured by Ben Adebayo.

[04:05] Team_057 possession (Score: 13-20)
Anfernee Adebayo attempts a 3Pt. Wide open! CJ Banchero is 6.9 feet away. [MAN] ANFERNEE ADEBAYO MAKES IT! Assist: Miles Middleton
Score: 13-23

[03:48] Team_015 possession (Score: 13-23)
Michael Simmons attempts a 3Pt. Heavily contested by Klay Rozier (0.5 feet, MAN)! MICHAEL SIMMONS MAKES IT! Assist: Trae Turner
Score: 16-23

[03:37] Team_057 possession (Score: 16-23)
Klay Rozier makes the Layup and draws the foul on Scottie Gasol! And-1! Klay Rozier to the line for 1. [BONUS: 8 team fouls] (Scottie Gasol: 4 personal fouls)   FT 1/1: GOOD Klay Rozier makes 1/1 from the line.
Score: 16-26

[03:19] Team_015 possession (Score: 16-26)
Scottie Gasol attempts a Midrange. Contested by Ben Adebayo (4.7 feet, MAN). Scottie Gasol misses. Rebound secured by Anfernee Adebayo.

[03:06] Team_057 possession (Score: 16-26)
Kobe Ming attempts a 3Pt. Contested by Manu Anthony (4.2 feet, MAN). Kobe Ming misses. Offensive rebound by Ben Adebayo! Ben Adebayo kicks it out.

[02:50] Team_057 possession (Score: 16-26)
FOUL! Shooting foul on Michael Simmons. Ben Adebayo to the line for 2 free throws. [BONUS: 9 team fouls] (Michael Simmons: 2 personal fouls)   FT 1/2: GOOD   FT 2/2: GOOD Ben Adebayo makes 2/2 from the line.
Score: 16-28

[02:33] Team_015 possession (Score: 16-28)
Michael Simmons attempts a Layup. Wide open! Ben Adebayo is 10.0 feet away. [ZONE] Michael Simmons misses. Rebound secured by Miles Middleton.

[02:16] Team_057 possession (Score: 16-28)
Miles Middleton attempts a 3Pt. Contested by Manu Anthony (5.0 feet, ZONE). Miles Middleton misses. Rebound secured by Trae Turner.

[02:04] Team_015 possession (Score: 16-28)
Manu Anthony attempts a 3Pt. Contested by Kobe Ming (4.4 feet, ZONE). MANU ANTHONY MAKES IT! Assist: Michael Simmons
Score: 19-28

[01:46] Team_057 possession (Score: 19-28)
Anfernee Adebayo attempts a 3Pt. Contested by Manu Anthony (2.6 feet, ZONE). ANFERNEE ADEBAYO MAKES IT! Assist: Kobe Ming
Score: 19-31

[01:31] Team_015 possession (Score: 19-31)
Scottie Gasol drives to the basket... Scottie Gasol commits a violation (traveling/carry)! TURNOVER! (dead ball)

[01:31] Substitution (Team_015): Manu Anthony OUT → Dwyane Sabonis IN (stamina_rule2)

[01:31] Substitution (Team_015): Michael Simmons OUT → Paolo Jokic IN (stamina_rule2)

[01:31] Substitution (Team_015): CJ Banchero OUT → Magic Wagner IN (stamina_rule2)

[01:31] Substitution (Team_015): Scottie Gasol OUT → Rudy Paul IN (stamina_rule2)

[01:31] Substitution (Team_015): Trae Turner OUT → Allen Curry IN (stamina_rule2)

[01:31] Substitution (Team_057): Kobe Ming OUT → Scottie Johnson IN (stamina_rule2)

[01:31] Substitution (Team_057): Klay Rozier OUT → Bradley Ginobili IN (stamina_rule2)

[01:31] Substitution (Team_057): Anfernee Adebayo OUT → Joel Wade IN (stamina_rule2)

[01:31] Substitution (Team_057): Ben Adebayo OUT → Lamelo Irving IN (stamina_rule2)

[01:31] Substitution (Team_057): Miles Middleton OUT → Zion Lillard IN (stamina_rule2)

[01:19] Team_057 possession (Score: 19-31)
Bradley Ginobili attempts a Layup. Wide open! Rudy Paul is 7.8 feet away. [ZONE] BRADLEY GINOBILI MAKES IT! Assist: Scottie Johnson
Score: 19-33

[01:04] Team_015 possession (Score: 19-33)
Dwyane Sabonis throws a bad pass out of bounds! TURNOVER! (dead ball)

[00:51] Team_057 possession (Score: 19-33)
Joel Wade drives, picks up Magic Wagner. Help arrives from Dwyane Sabonis! Joel Wade attempts a Dunk. Contested by Dwyane Sabonis (4.5 feet, MAN). JOEL WADE MAKES IT!
Score: 19-35

[00:37] Team_015 possession (Score: 19-35)
Rudy Paul attempts a 3Pt. Contested by Lamelo Irving (4.0 feet, MAN). RUDY PAUL MAKES IT!
Score: 22-35

[00:24] Team_057 possession (Score: 22-35)
Zion Lillard drives, Rudy Paul stays with him. Zion Lillard attempts a Layup. Contested by Rudy Paul (3.3 feet, MAN). Zion Lillard misses. Rebound secured by Allen Curry.

[00:13] Team_015 possession (Score: 22-35)
FOUL! Shooting foul on Bradley Ginobili. Paolo Jokic to the line for 3 free throws. [BONUS: 5 team fouls] (Bradley Ginobili: 1 personal fouls)   FT 1/3: GOOD   FT 2/3: GOOD   FT 3/3: GOOD Paolo Jokic makes 3/3 from the line.
Score: 25-35

================================================================================
                              1ST QUARTER COMPLETE                              
================================================================================

1ST QUARTER SCORE: Team_015 25, Team_057 35

BOX SCORE:
================================================================================

Team_015
--------------------------------------------------------------------------------
Player                MIN  PTS  REB  AST  TO      FG   FG%      3P   3P%
--------------------------------------------------------------------------------
CJ Banchero            11    6    1    1   0   2/5    40.0     0/0   0.0
Michael Simmons        11    5    1    1   0   2/3    66.7     0/0   0.0
Scottie Gasol          11    5    0    0   0   2/5    40.0     0/0   0.0
Manu Anthony           11    3    0    0   0   1/1   100.0     0/0   0.0
Rudy Paul               1    3    0    0   0   1/1   100.0     0/0   0.0
Paolo Jokic             1    3    0    0   0   1/1   100.0     0/0   0.0
Trae Turner            11    0    4    1   0   0/2     0.0     0/0   0.0
Allen Curry             1    0    1    0   0   0/0     0.0     0/0   0.0

TEAM: FG: 9/18 (50.0%), 3PT: 4/6 (66.7%), REB: 7 (1 off, 6 def), AST: 3, TO: 4
TEAM FOULS: 9 [Team_057 in BONUS]


Team_057
--------------------------------------------------------------------------------
Player                MIN  PTS  REB  AST  TO      FG   FG%      3P   3P%
--------------------------------------------------------------------------------
Klay Rozier            11    9    0    1   0   3/4    75.0     0/0   0.0
Kobe Ming              11    8    0    2   0   3/4    75.0     0/0   0.0
Anfernee Adebayo       11    6    3    0   0   2/3    66.7     0/0   0.0
Miles Middleton        11    2    5    2   0   1/2    50.0     0/0   0.0
Ben Adebayo            11    2    5    0   0   1/2    50.0     0/0   0.0
Bradley Ginobili        1    2    0    0   0   1/1   100.0     0/0   0.0
Joel Wade               1    2    0    0   0   1/1   100.0     0/0   0.0
Scottie Johnson         1    0    0    1   0   0/0     0.0     0/0   0.0
Zion Lillard            1    0    0    0   0   0/1     0.0     0/0   0.0

TEAM: FG: 12/18 (66.7%), 3PT: 5/7 (71.4%), REB: 13 (4 off, 9 def), AST: 6, TO: 3
TEAM FOULS: 5 [Team_015 in BONUS]

================================================================================

================================================================================
                       2ND QUARTER - Team_015 vs Team_057                       
================================================================================

[12:00] Team_015 possession (Score: 25-35)
Scottie Gasol attempts a 3Pt. Wide open! Ben Adebayo is 8.2 feet away. [MAN] SCOTTIE GASOL MAKES IT!
Score: 28-35

[11:42] Team_057 possession (Score: 28-35)
Kobe Ming drives to the basket... Kobe Ming commits a violation (traveling/carry)! TURNOVER! (dead ball)

[11:28] Team_015 possession (Score: 28-35)
FOUL! Reach-in foul on Ben Adebayo during the drive. [Team fouls: 1] No free throws, side out. (Ben Adebayo: 1 personal fouls)

[11:12] Team_015 possession (Score: 28-35)
Manu Anthony attempts a 3Pt. Wide open! Kobe Ming is 6.0 feet away. [MAN] Manu Anthony misses. Rebound secured by Miles Middleton.

[10:55] Team_057 possession (Score: 28-35)
Klay Rozier attempts a Midrange. Contested by Michael Simmons (4.8 feet, MAN). Klay Rozier misses. Rebound secured by CJ Banchero.

[10:39] Team_015 possession (Score: 28-35)
CJ Banchero attempts a Midrange. Heavily contested by Klay Rozier (1.7 feet, ZONE)! CJ BANCHERO MAKES IT!
Score: 30-35

[10:24] Team_057 possession (Score: 30-35)
Miles Middleton makes the Layup and draws the foul on Scottie Gasol! And-1! Miles Middleton to the line for 1. [Team fouls: 1] (Scottie Gasol: 1 personal fouls)   FT 1/1: GOOD Miles Middleton makes 1/1 from the line.
Score: 30-38

[10:10] Team_015 possession (Score: 30-38)
Manu Anthony attempts a Layup. Wide open! Kobe Ming is 6.3 feet away. [MAN] MANU ANTHONY MAKES IT! Assist: Trae Turner
Score: 32-38

[09:55] Team_057 possession (Score: 32-38)
Miles Middleton drives and kicks out. Miles Middleton attempts a Midrange. Heavily contested by Trae Turner (1.8 feet, MAN)! MILES MIDDLETON MAKES IT!
Score: 32-40

[09:40] Team_015 possession (Score: 32-40)
FOUL! Holding foul on Ben Adebayo. [Team fouls: 2] No free throws, side out. (Ben Adebayo: 2 personal fouls)

[09:30] Team_015 possession (Score: 32-40)
FOUL! Reach-in foul on Miles Middleton during the drive. [Team fouls: 3] No free throws, side out. (Miles Middleton: 1 personal fouls)

[09:16] Team_015 possession (Score: 32-40)
CJ Banchero attempts a 3Pt. Contested by Anfernee Adebayo (3.0 feet, MAN). CJ BANCHERO MAKES IT! Assist: Michael Simmons
Score: 35-40

[09:01] Team_057 possession (Score: 35-40)
Miles Middleton attempts a 3Pt. Contested by Trae Turner (5.5 feet, MAN). MILES MIDDLETON MAKES IT! Assist: Klay Rozier
Score: 35-43

[08:50] Team_015 possession (Score: 35-43)
FOUL! Offensive foul on Manu Anthony! Kobe Ming drew the charge! [Team fouls: 2] (Manu Anthony: 1 personal fouls) TURNOVER! (dead ball)

[08:32] Team_057 possession (Score: 35-43)
Miles Middleton drives and kicks out. Anfernee Adebayo attempts a Midrange. Contested by CJ Banchero (2.1 feet, MAN). Anfernee Adebayo misses. Rebound secured by Trae Turner.

[08:19] Team_015 possession (Score: 35-43)
Scottie Gasol drives to the basket... FOUL! Offensive foul on Scottie Gasol! Ben Adebayo drew the charge! [Team fouls: 3] (Scottie Gasol: 2 personal fouls) TURNOVER! (dead ball)

[08:06] Team_057 possession (Score: 35-43)
Miles Middleton attempts a Layup. Contested by Trae Turner (4.4 feet, MAN). MILES MIDDLETON MAKES IT!
Score: 35-45

[07:53] Team_015 possession (Score: 35-45)
Michael Simmons attempts a 3Pt. Contested by Klay Rozier (2.4 feet, MAN). Michael Simmons misses. Rebound secured by Ben Adebayo.

[07:41] Team_057 possession (Score: 35-45)
FOUL! Shooting foul on Trae Turner. Miles Middleton to the line for 2 free throws. [Team fouls: 4] (Trae Turner: 1 personal fouls)   FT 1/2: GOOD   FT 2/2: GOOD Miles Middleton makes 2/2 from the line.
Score: 35-47

[07:27] Team_015 possession (Score: 35-47)
Trae Turner makes the Layup and draws the foul on Ben Adebayo! And-1! Trae Turner to the line for 1. [Team fouls: 4] (Ben Adebayo: 3 personal fouls)   FT 1/1: GOOD Trae Turner makes 1/1 from the line.
Score: 38-47

[07:12] Team_057 possession (Score: 38-47)
Klay Rozier attempts a Midrange. Contested by Michael Simmons (5.5 feet, MAN). Klay Rozier misses. Rebound secured by CJ Banchero.

[06:56] Team_015 possession (Score: 38-47)
Trae Turner attempts a Midrange. Contested by Miles Middleton (5.4 feet, MAN). Trae Turner misses. Rebound secured by Anfernee Adebayo.

[06:42] Team_057 possession (Score: 38-47)
Anfernee Adebayo drives and kicks out. Miles Middleton attempts a 3Pt. Wide open! Trae Turner is 6.7 feet away. [MAN] Miles Middleton misses. Rebound secured by Trae Turner.

[06:25] Team_015 possession (Score: 38-47)
Michael Simmons attempts a 3Pt. Wide open! Kobe Ming is 7.1 feet away. [ZONE] Michael Simmons misses. Rebound secured by Miles Middleton.

[06:11] Team_057 possession (Score: 38-47)
Ben Adebayo drives to the basket... FOUL! Offensive foul on Ben Adebayo! Scottie Gasol drew the charge! [Team fouls: 5] (Ben Adebayo: 4 personal fouls) TURNOVER! (dead ball)

[05:57] Team_015 possession (Score: 38-47)
Michael Simmons attempts a Midrange. Contested by Ben Adebayo (2.1 feet, ZONE). Michael Simmons misses. Rebound secured by Miles Middleton.

[05:47] Team_057 possession (Score: 38-47)
Klay Rozier attempts a 3Pt. Contested by Michael Simmons (6.0 feet, MAN). Klay Rozier misses. Rebound secured by CJ Banchero.

[05:36] Team_015 possession (Score: 38-47)
CJ Banchero drives, Ben Adebayo stays with him. CJ Banchero attempts a Layup. Heavily contested by Ben Adebayo (0.5 feet, ZONE)! CJ BANCHERO MAKES IT! Assist: Trae Turner
Score: 40-47

[05:24] Team_057 possession (Score: 40-47)
Klay Rozier attempts a 3Pt. Contested by Michael Simmons (4.5 feet, MAN). KLAY ROZIER MAKES IT! Assist: Anfernee Adebayo
Score: 40-50

[05:07] Team_015 possession (Score: 40-50)
Scottie Gasol attempts a 3Pt. Wide open! Kobe Ming is 6.6 feet away. [ZONE] SCOTTIE GASOL MAKES IT! Assist: Manu Anthony
Score: 43-50

[04:53] Team_057 possession (Score: 43-50)
Kobe Ming drives and kicks out. Klay Rozier attempts a 3Pt. Contested by Manu Anthony (4.1 feet, ZONE). Klay Rozier misses. Offensive rebound by Ben Adebayo! Ben Adebayo kicks it out.

[04:44] Team_057 possession (Score: 43-50)
Klay Rozier attempts a Midrange. Wide open! Michael Simmons is 7.3 feet away. [MAN] Klay Rozier misses. Rebound secured by Michael Simmons.

[04:33] Team_015 possession (Score: 43-50)
Michael Simmons attempts a Midrange. Contested by Anfernee Adebayo (4.3 feet, ZONE). Michael Simmons misses. FOUL! Loose ball foul on Ben Adebayo during the rebound battle. [IN THE BONUS! 6 team fouls] Michael Simmons to the line for 2 free throws. (Ben Adebayo: 5 personal fouls)   FT 1/2: GOOD   FT 2/2: GOOD Michael Simmons makes 2/2 from the line.
Score: 45-50

[04:21] Team_057 possession (Score: 45-50)
FOUL! Reach-in foul on Scottie Gasol during the drive. [IN THE BONUS! 5 team fouls] Klay Rozier to the line for 2 free throws. (Scottie Gasol: 3 personal fouls)   FT 1/2: GOOD   FT 2/2: GOOD Klay Rozier makes 2/2 from the line.
Score: 45-52

[04:04] Team_015 possession (Score: 45-52)
Michael Simmons attempts a Layup. Contested by Klay Rozier (3.9 feet, MAN). Michael Simmons misses. Offensive rebound by CJ Banchero! CJ Banchero kicks it out.

[03:53] Team_015 possession (Score: 45-52)
Michael Simmons drives and kicks out. Trae Turner attempts a 3Pt. Contested by Miles Middleton (5.4 feet, MAN). Trae Turner misses. Rebound secured by Ben Adebayo.

[03:36] Team_057 possession (Score: 45-52)
Miles Middleton attempts a Midrange. Contested by CJ Banchero (4.2 feet, ZONE). Miles Middleton misses. Rebound secured by Michael Simmons.

[03:21] Team_015 possession (Score: 45-52)
Trae Turner attempts a Midrange. Wide open! Anfernee Adebayo is 7.8 feet away. [ZONE] TRAE TURNER MAKES IT! Assist: Scottie Gasol
Score: 47-52

[03:10] Team_057 possession (Score: 47-52)
Ben Adebayo attempts a Layup. Contested by Scottie Gasol (4.5 feet, ZONE). BEN ADEBAYO MAKES IT!
Score: 47-54

[02:54] Team_015 possession (Score: 47-54)
Manu Anthony attempts a 3Pt. Wide open! Kobe Ming is 8.0 feet away. [ZONE] MANU ANTHONY MAKES IT! Assist: Michael Simmons
Score: 50-54

[02:43] Team_057 possession (Score: 50-54)
Klay Rozier attempts a 3Pt. Wide open! Michael Simmons is 7.4 feet away. [MAN] Klay Rozier misses. Rebound secured by Scottie Gasol.

[02:30] Team_015 possession (Score: 50-54)
CJ Banchero attempts a Midrange. Heavily contested by Anfernee Adebayo (1.4 feet, MAN)! CJ BANCHERO MAKES IT! Assist: Manu Anthony
Score: 52-54

[02:14] Team_057 possession (Score: 52-54)
Kobe Ming attempts a 3Pt. Wide open! Manu Anthony is 8.1 feet away. [MAN] Kobe Ming misses. Rebound secured by CJ Banchero.

[02:01] Team_015 possession (Score: 52-54)
Trae Turner drives, picks up Miles Middleton. Help arrives from Klay Rozier! Trae Turner attempts a Layup. Contested by Klay Rozier (5.6 feet, MAN). TRAE TURNER MAKES IT! Assist: Michael Simmons
Score: 54-54

[01:47] Team_057 possession (Score: 54-54)
Ben Adebayo loses the ball! Stripped by Scottie Gasol! TURNOVER! (live ball)

[01:29] Team_015 possession (Score: 54-54)
Michael Simmons attempts a 3Pt. Wide open! Klay Rozier is 6.4 feet away. [MAN] Michael Simmons misses. Rebound secured by Anfernee Adebayo.

[01:14] Team_057 possession (Score: 54-54)
Kobe Ming attempts a 3Pt. Contested by Manu Anthony (2.9 feet, ZONE). Kobe Ming misses. Rebound secured by Scottie Gasol.

[01:00] Team_015 possession (Score: 54-54)
Scottie Gasol attempts a Midrange. Contested by Ben Adebayo (5.6 feet, MAN). SCOTTIE GASOL MAKES IT!
Score: 56-54

[00:43] Team_057 possession (Score: 56-54)
FOUL! Holding foul on Scottie Gasol. [IN THE BONUS! 6 team fouls] Ben Adebayo to the line for 2 free throws. (Scottie Gasol: 4 personal fouls)   FT 1/2: GOOD   FT 2/2: GOOD Ben Adebayo makes 2/2 from the line.
Score: 56-56

[00:32] Team_015 possession (Score: 56-56)
Michael Simmons attempts a Midrange. Wide open! Klay Rozier is 9.1 feet away. [MAN] Michael Simmons misses. Offensive rebound by Michael Simmons! Michael Simmons kicks it out.

[00:12] Team_015 possession (Score: 56-56)
Trae Turner attempts a Layup. BLOCKED BY KLAY ROZIER! Ball is loose! Rebound secured by Ben Adebayo.

================================================================================
                              2ND QUARTER COMPLETE                              
================================================================================

2ND QUARTER SCORE: Team_015 31, Team_057 21

BOX SCORE:
================================================================================

Team_015
--------------------------------------------------------------------------------
Player                MIN  PTS  REB  AST  TO      FG   FG%      3P   3P%
--------------------------------------------------------------------------------
CJ Banchero            23    9    5    0   0   4/4   100.0     0/0   0.0
Scottie Gasol          23    8    2    1   0   3/3   100.0     0/0   0.0
Trae Turner            23    7    2    2   0   3/5    60.0     0/0   0.0
Manu Anthony           23    5    0    2   0   2/3    66.7     0/0   0.0
Michael Simmons        23    2    3    3   0   1/6    16.7     0/0   0.0

TEAM: FG: 13/21 (61.9%), 3PT: 4/8 (50.0%), REB: 12 (2 off, 10 def), AST: 8, TO: 2
TEAM FOULS: 6 [Team_057 in BONUS]


Team_057
--------------------------------------------------------------------------------
Player                MIN  PTS  REB  AST  TO      FG   FG%      3P   3P%
--------------------------------------------------------------------------------
Miles Middleton        23   12    3    0   0   5/7    71.4     0/0   0.0
Klay Rozier            23    5    0    1   0   2/7    28.6     0/0   0.0
Ben Adebayo            23    4    4    0   0   2/2   100.0     0/0   0.0
Anfernee Adebayo       23    0    2    1   0   0/1     0.0     0/0   0.0
Kobe Ming              23    0    0    0   0   0/2     0.0     0/0   0.0

TEAM: FG: 9/19 (47.4%), 3PT: 2/6 (33.3%), REB: 9 (1 off, 8 def), AST: 2, TO: 3
TEAM FOULS: 6 [Team_015 in BONUS]

================================================================================

================================================================================
                       3RD QUARTER - Team_015 vs Team_057                       
================================================================================

[12:00] Team_015 possession (Score: 56-56)
Scottie Gasol attempts a 3Pt. Wide open! Kobe Ming is 7.2 feet away. [ZONE] SCOTTIE GASOL MAKES IT! Assist: Michael Simmons
Score: 59-56

[11:43] Team_057 possession (Score: 59-56)
Kobe Ming attempts a Midrange. Contested by CJ Banchero (3.4 feet, ZONE). KOBE MING MAKES IT!
Score: 59-58

[11:26] Team_015 possession (Score: 59-58)
Trae Turner drives to the basket... Trae Turner commits a violation (traveling/carry)! TURNOVER! (dead ball)

[11:10] Team_057 possession (Score: 59-58)
Klay Rozier attempts a 3Pt. Contested by Manu Anthony (4.9 feet, ZONE). Klay Rozier misses. Offensive rebound by Miles Middleton! Miles Middleton kicks it out.

[10:56] Team_057 possession (Score: 59-58)
Klay Rozier attempts a 3Pt. Contested by Michael Simmons (2.3 feet, MAN). Klay Rozier misses. FOUL! Loose ball foul on Michael Simmons during the rebound battle. [Team fouls: 1] No free throws, side out. (Michael Simmons: 1 personal fouls)

[10:38] Team_057 possession (Score: 59-58)
Kobe Ming drives and kicks out. Kobe Ming attempts a Midrange. Wide open! Manu Anthony is 7.4 feet away. [MAN] KOBE MING MAKES IT!
Score: 59-60

[10:23] Team_015 possession (Score: 59-60)
Michael Simmons drives to the basket... Michael Simmons commits a violation (traveling/carry)! TURNOVER! (dead ball)

[10:08] Team_057 possession (Score: 59-60)
Kobe Ming attempts a Midrange. Contested by Manu Anthony (2.8 feet, MAN). Kobe Ming misses. Offensive rebound by Miles Middleton! Miles Middleton kicks it out.

[09:51] Team_057 possession (Score: 59-60)
Miles Middleton attempts a Midrange. Contested by Trae Turner (4.7 feet, MAN). MILES MIDDLETON MAKES IT!
Score: 59-62

[09:35] Team_015 possession (Score: 59-62)
FOUL! Shooting foul on Ben Adebayo. Trae Turner to the line for 2 free throws. [Team fouls: 1] (Ben Adebayo: 1 personal fouls)   FT 1/2: GOOD   FT 2/2: GOOD Trae Turner makes 2/2 from the line.
Score: 61-62

[09:19] Team_057 possession (Score: 61-62)
Ben Adebayo attempts a 3Pt. Contested by Scottie Gasol (4.0 feet, MAN). BEN ADEBAYO MAKES IT!
Score: 61-65

[09:01] Team_015 possession (Score: 61-65)
Michael Simmons attempts a Layup. Contested by Klay Rozier (2.7 feet, MAN). MICHAEL SIMMONS MAKES IT! Assist: Scottie Gasol
Score: 63-65

[08:44] Team_057 possession (Score: 63-65)
Klay Rozier attempts a Layup. Heavily contested by Michael Simmons (1.0 feet, MAN)! KLAY ROZIER MAKES IT!
Score: 63-67

[08:30] Team_015 possession (Score: 63-67)
FOUL! Offensive foul on Michael Simmons! Klay Rozier drew the charge! [Team fouls: 2] (Michael Simmons: 2 personal fouls) TURNOVER! (dead ball)

[08:16] Team_057 possession (Score: 63-67)
Anfernee Adebayo attempts a Midrange. Wide open! CJ Banchero is 8.6 feet away. [MAN] Anfernee Adebayo misses. Rebound secured by CJ Banchero.

[08:00] Team_015 possession (Score: 63-67)
FOUL! Offensive foul on Trae Turner! Miles Middleton drew the charge! [Team fouls: 3] (Trae Turner: 1 personal fouls) TURNOVER! (dead ball)

[07:47] Team_057 possession (Score: 63-67)
Kobe Ming attempts a Midrange. Contested by Manu Anthony (3.8 feet, MAN). KOBE MING MAKES IT!
Score: 63-69

[07:37] Team_015 possession (Score: 63-69)
Trae Turner attempts a Midrange. Wide open! Anfernee Adebayo is 6.7 feet away. [ZONE] Trae Turner misses. Rebound secured by Anfernee Adebayo.

[07:25] Team_057 possession (Score: 63-69)
Anfernee Adebayo attempts a Midrange. Contested by CJ Banchero (3.9 feet, MAN). Anfernee Adebayo misses. Rebound secured by Michael Simmons.

[07:06] Team_015 possession (Score: 63-69)
Manu Anthony attempts a 3Pt. Contested by Kobe Ming (4.5 feet, MAN). MANU ANTHONY MAKES IT! Assist: Trae Turner
Score: 66-69

[06:49] Team_057 possession (Score: 66-69)
Ben Adebayo attempts a Midrange. Contested by Scottie Gasol (5.4 feet, MAN). Ben Adebayo misses. Rebound secured by Michael Simmons.

[06:32] Team_015 possession (Score: 66-69)
Manu Anthony drives and kicks out. Manu Anthony attempts a Midrange. Heavily contested by Miles Middleton (1.9 feet, ZONE)! MANU ANTHONY MAKES IT! Assist: Scottie Gasol
Score: 68-69

[06:18] Team_057 possession (Score: 68-69)
FOUL! Shooting foul on Scottie Gasol. Kobe Ming to the line for 2 free throws. [Team fouls: 4] (Scottie Gasol: 1 personal fouls)   FT 1/2: MISS   FT 2/2: MISS Kobe Ming makes 0/2 from the line. Offensive rebound by Ben Adebayo! Ben Adebayo kicks it out.

[06:04] Team_057 possession (Score: 68-69)
Kobe Ming drives and kicks out. Kobe Ming attempts a 3Pt. Contested by Manu Anthony (2.3 feet, MAN). Kobe Ming misses. Rebound secured by CJ Banchero.

[05:49] Team_015 possession (Score: 68-69)
Manu Anthony attempts a 3Pt. Contested by Kobe Ming (4.4 feet, MAN). MANU ANTHONY MAKES IT! Assist: Trae Turner
Score: 71-69

[05:36] Team_057 possession (Score: 71-69)
Ben Adebayo attempts a 3Pt. Wide open! Scottie Gasol is 9.1 feet away. [MAN] Ben Adebayo misses. Rebound secured by Trae Turner.

[05:20] Team_015 possession (Score: 71-69)
Manu Anthony attempts a 3Pt. Wide open! Kobe Ming is 6.9 feet away. [ZONE] Manu Anthony misses. Offensive rebound by Trae Turner! Trae Turner puts it back in!
Score: 73-69

[05:10] Team_057 possession (Score: 73-69)
Miles Middleton attempts a Midrange. Heavily contested by Scottie Gasol (0.5 feet, ZONE)! Miles Middleton misses. Rebound secured by Michael Simmons.

[04:53] Team_015 possession (Score: 73-69)
CJ Banchero drives and kicks out. Scottie Gasol attempts a 3Pt. Contested by Anfernee Adebayo (3.0 feet, ZONE). SCOTTIE GASOL MAKES IT!
Score: 76-69

[04:33] Team_057 possession (Score: 76-69)
Kobe Ming drives, picks up Manu Anthony. Help arrives from Michael Simmons! Kobe Ming attempts a Layup. Contested by Michael Simmons (3.9 feet, MAN). KOBE MING MAKES IT! Assist: Anfernee Adebayo
Score: 76-71

[04:15] Team_015 possession (Score: 76-71)
CJ Banchero drives and kicks out. Michael Simmons attempts a 3Pt. Contested by Klay Rozier (4.1 feet, MAN). MICHAEL SIMMONS MAKES IT! Assist: Trae Turner
Score: 79-71

[04:04] Team_057 possession (Score: 79-71)
FOUL! Shooting foul on CJ Banchero. Kobe Ming to the line for 2 free throws. [BONUS: 5 team fouls] (CJ Banchero: 1 personal fouls)   FT 1/2: GOOD   FT 2/2: MISS Kobe Ming makes 1/2 from the line. Rebound secured by CJ Banchero.
Score: 79-72

[03:47] Team_015 possession (Score: 79-72)
Michael Simmons attempts a 3Pt. Contested by Kobe Ming (4.1 feet, ZONE). Michael Simmons misses. Offensive rebound by CJ Banchero! CJ Banchero's putback is no good. Rebound secured by Ben Adebayo.

[03:30] Team_057 possession (Score: 79-72)
Kobe Ming attempts a 3Pt. Contested by Manu Anthony (2.9 feet, ZONE). Kobe Ming misses. Offensive rebound by Miles Middleton! Miles Middleton kicks it out.

[03:13] Team_057 possession (Score: 79-72)
Klay Rozier drives, Michael Simmons stays with him. Klay Rozier attempts a Dunk. Contested by Michael Simmons (2.2 feet, MAN). KLAY ROZIER MAKES IT! Assist: Kobe Ming
Score: 79-74

[02:58] Team_015 possession (Score: 79-74)
Trae Turner drives and kicks out. CJ Banchero attempts a Midrange. Contested by Anfernee Adebayo (5.2 feet, MAN). CJ BANCHERO MAKES IT!
Score: 81-74

[02:45] Team_057 possession (Score: 81-74)
Kobe Ming throws a bad pass! Stolen by Manu Anthony! TURNOVER! (live ball)

[02:32] Team_015 possession (Score: 81-74)
Trae Turner throws a bad pass out of bounds! TURNOVER! (dead ball)

[02:32] Substitution (Team_015): Trae Turner OUT → Allen Curry IN (stamina_rule2)

[02:21] Team_057 possession (Score: 81-74)
Ben Adebayo drives, Scottie Gasol stays with him. Ben Adebayo attempts a Dunk. Heavily contested by Scottie Gasol (1.8 feet, MAN)! BEN ADEBAYO MAKES IT! Assist: Anfernee Adebayo
Score: 81-76

[02:06] Team_015 possession (Score: 81-76)
CJ Banchero attempts a Layup. Contested by Anfernee Adebayo (4.8 feet, MAN). CJ BANCHERO MAKES IT! Assist: Allen Curry
Score: 83-76

[01:52] Team_057 possession (Score: 83-76)
Miles Middleton drives, Scottie Gasol stays with him. Miles Middleton attempts a Dunk. Wide open! Scottie Gasol is 6.3 feet away. [ZONE] Miles Middleton misses. Rebound secured by CJ Banchero.

[01:37] Team_015 possession (Score: 83-76)
Allen Curry drives and kicks out. Allen Curry attempts a 3Pt. Wide open! Kobe Ming is 6.3 feet away. [ZONE] Allen Curry misses. Rebound secured by Miles Middleton.

[01:23] Team_057 possession (Score: 83-76)
Miles Middleton drives to the basket... Miles Middleton loses control! Ball rolls out of bounds! TURNOVER! (dead ball)

[01:23] Substitution (Team_015): Manu Anthony OUT → Dwyane Sabonis IN (stamina_rule2)

[01:23] Substitution (Team_015): Michael Simmons OUT → Paolo Jokic IN (stamina_rule2)

[01:23] Substitution (Team_015): CJ Banchero OUT → Magic Wagner IN (stamina_rule2)

[01:23] Substitution (Team_015): Scottie Gasol OUT → Rudy Paul IN (stamina_rule2)

[01:23] Substitution (Team_057): Kobe Ming OUT → Scottie Johnson IN (stamina_rule2)

[01:23] Substitution (Team_057): Klay Rozier OUT → Bradley Ginobili IN (stamina_rule2)

[01:23] Substitution (Team_057): Anfernee Adebayo OUT → Joel Wade IN (stamina_rule2)

[01:23] Substitution (Team_057): Ben Adebayo OUT → Lamelo Irving IN (stamina_rule2)

[01:23] Substitution (Team_057): Miles Middleton OUT → Zion Lillard IN (stamina_rule2)

[01:12] Team_015 possession (Score: 83-76)
Paolo Jokic attempts a 3Pt. Contested by Bradley Ginobili (3.0 feet, MAN). Paolo Jokic misses. Rebound secured by Joel Wade.

[00:57] Team_057 possession (Score: 83-76)
Zion Lillard attempts a Midrange. Contested by Paolo Jokic (4.9 feet, ZONE). Zion Lillard misses. Rebound secured by Magic Wagner.

[00:48] Team_015 possession (Score: 83-76)
Paolo Jokic attempts a 3Pt. Wide open! Scottie Johnson is 6.6 feet away. [ZONE] PAOLO JOKIC MAKES IT! Assist: Allen Curry
Score: 86-76

[00:30] Team_057 possession (Score: 86-76)
Joel Wade attempts a 3Pt. Contested by Rudy Paul (2.7 feet, ZONE). Joel Wade misses. Rebound secured by Rudy Paul.

[00:18] Team_015 possession (Score: 86-76)
Allen Curry attempts a Layup. Contested by Lamelo Irving (4.5 feet, ZONE). Allen Curry misses. Rebound secured by Lamelo Irving.

[00:07] Team_057 possession (Score: 86-76)
Scottie Johnson attempts a 3Pt. Wide open! Dwyane Sabonis is 7.4 feet away. [MAN] Scottie Johnson misses. Rebound secured by Rudy Paul.

================================================================================
                              3RD QUARTER COMPLETE                              
================================================================================

3RD QUARTER SCORE: Team_015 30, Team_057 20

BOX SCORE:
================================================================================

Team_015
--------------------------------------------------------------------------------
Player                MIN  PTS  REB  AST  TO      FG   FG%      3P   3P%
--------------------------------------------------------------------------------
Manu Anthony           34    8    0    0   0   3/3   100.0     0/0   0.0
Scottie Gasol          34    6    0    2   0   2/2   100.0     0/0   0.0
Michael Simmons        34    5    3    1   0   2/3    66.7     0/0   0.0
Trae Turner            32    4    2    3   0   2/3    66.7     0/0   0.0
CJ Banchero            34    4    4    0   0   2/2   100.0     0/0   0.0
Paolo Jokic             3    3    0    0   0   1/2    50.0     0/0   0.0
Allen Curry             4    0    0    2   0   0/2     0.0     0/0   0.0
Magic Wagner            3    0    1    0   0   0/0     0.0     0/0   0.0
Rudy Paul               3    0    2    0   0   0/0     0.0     0/0   0.0

TEAM: FG: 12/17 (70.6%), 3PT: 5/7 (71.4%), REB: 13 (2 off, 11 def), AST: 8, TO: 5
TEAM FOULS: 5 [Team_057 in BONUS]


Team_057
--------------------------------------------------------------------------------
Player                MIN  PTS  REB  AST  TO      FG   FG%      3P   3P%
--------------------------------------------------------------------------------
Kobe Ming              34    8    0    1   0   4/6    66.7     0/0   0.0
Ben Adebayo            34    5    2    0   0   2/4    50.0     0/0   0.0
Klay Rozier            34    4    0    0   0   2/2   100.0     0/0   0.0
Miles Middleton        34    2    5    0   0   1/3    33.3     0/0   0.0
Anfernee Adebayo       34    0    1    2   0   0/2     0.0     0/0   0.0
Joel Wade               3    0    1    0   0   0/1     0.0     0/0   0.0
Zion Lillard            3    0    0    0   0   0/1     0.0     0/0   0.0
Lamelo Irving           3    0    1    0   0   0/0     0.0     0/0   0.0
Scottie Johnson         3    0    0    0   0   0/1     0.0     0/0   0.0

TEAM: FG: 9/20 (45.0%), 3PT: 1/4 (25.0%), REB: 9 (5 off, 4 def), AST: 3, TO: 2
TEAM FOULS: 1

================================================================================

================================================================================
                       4TH QUARTER - Team_015 vs Team_057                       
================================================================================

[12:00] Team_015 possession (Score: 86-76)
Scottie Gasol attempts a 3Pt. Wide open! Ben Adebayo is 8.7 feet away. [MAN] Scottie Gasol misses. Rebound secured by Anfernee Adebayo.

[11:47] Team_057 possession (Score: 86-76)
Anfernee Adebayo attempts a 3Pt. Contested by Manu Anthony (5.7 feet, ZONE). Anfernee Adebayo misses. Rebound secured by CJ Banchero.

[11:36] Team_015 possession (Score: 86-76)
CJ Banchero drives and kicks out. Manu Anthony attempts a 3Pt. Heavily contested by Kobe Ming (0.9 feet, ZONE)! Manu Anthony misses. Rebound secured by Anfernee Adebayo.

[11:23] Team_057 possession (Score: 86-76)
Klay Rozier drives, picks up Scottie Gasol. Help arrives from Michael Simmons! Klay Rozier attempts a Layup. Contested by Michael Simmons (3.3 feet, ZONE). Klay Rozier misses. Rebound secured by CJ Banchero.

[11:04] Team_015 possession (Score: 86-76)
CJ Banchero drives and kicks out. FOUL! Shooting foul on Ben Adebayo. Trae Turner to the line for 2 free throws. [Team fouls: 1] (Ben Adebayo: 1 personal fouls)   FT 1/2: MISS   FT 2/2: GOOD Trae Turner makes 1/2 from the line.
Score: 87-76

[10:48] Team_057 possession (Score: 87-76)
Ben Adebayo drives and kicks out. Anfernee Adebayo attempts a 3Pt. Contested by CJ Banchero (2.1 feet, MAN). Anfernee Adebayo misses. Rebound secured by CJ Banchero.

[10:29] Team_015 possession (Score: 87-76)
Trae Turner drives to the basket... Trae Turner throws a bad pass out of bounds! TURNOVER! (dead ball)

[10:29] Substitution (Team_057): Anfernee Adebayo OUT → Joel Wade IN (stamina_rule2)

[10:12] Team_057 possession (Score: 87-76)
Joel Wade attempts a 3Pt. Contested by Manu Anthony (2.3 feet, ZONE). Joel Wade misses. Rebound secured by CJ Banchero.

[09:54] Team_015 possession (Score: 87-76)
Scottie Gasol attempts a 3Pt. Contested by Kobe Ming (5.0 feet, ZONE). SCOTTIE GASOL MAKES IT! Assist: Trae Turner
Score: 90-76

[09:41] Team_057 possession (Score: 90-76)
Joel Wade attempts a 3Pt. Heavily contested by CJ Banchero (1.1 feet, MAN)! Joel Wade misses. Rebound secured by Michael Simmons.

[09:24] Team_015 possession (Score: 90-76)
CJ Banchero attempts a 3Pt. Wide open! Kobe Ming is 7.3 feet away. [ZONE] CJ BANCHERO MAKES IT! Assist: Manu Anthony
Score: 93-76

[09:10] Team_057 possession (Score: 93-76)
Klay Rozier attempts a 3Pt. Heavily contested by Michael Simmons (0.5 feet, MAN)! Klay Rozier misses. Rebound secured by Trae Turner.

[08:58] Team_015 possession (Score: 93-76)
Michael Simmons drives and kicks out. Trae Turner attempts a 3Pt. Heavily contested by Kobe Ming (1.5 feet, ZONE)! Trae Turner misses. Rebound secured by Ben Adebayo.

[08:41] Team_057 possession (Score: 93-76)
Ben Adebayo drives, Scottie Gasol stays with him. Ben Adebayo attempts a Layup. Wide open! Scottie Gasol is 7.2 feet away. [ZONE] BEN ADEBAYO MAKES IT!
Score: 93-78

[08:26] Team_015 possession (Score: 93-78)
Manu Anthony attempts a Layup. Contested by Kobe Ming (5.2 feet, MAN). Manu Anthony misses. Offensive rebound by CJ Banchero! CJ Banchero kicks it out.

[08:16] Team_015 possession (Score: 93-78)
CJ Banchero attempts a Layup. Contested by Joel Wade (3.6 feet, MAN). CJ Banchero misses. Rebound secured by Miles Middleton.

[08:01] Team_057 possession (Score: 93-78)
Ben Adebayo attempts a 3Pt. Wide open! Manu Anthony is 8.2 feet away. [ZONE] Ben Adebayo misses. Offensive rebound by Miles Middleton! Miles Middleton kicks it out.

[07:44] Team_057 possession (Score: 93-78)
Joel Wade attempts a 3Pt. Contested by Manu Anthony (2.3 feet, ZONE). Joel Wade misses. Rebound secured by Trae Turner.

[07:34] Team_015 possession (Score: 93-78)
CJ Banchero attempts a 3Pt. Contested by Kobe Ming (2.5 feet, ZONE). CJ BANCHERO MAKES IT! Assist: Manu Anthony
Score: 96-78

[07:16] Team_057 possession (Score: 96-78)
FOUL! Shooting foul on Trae Turner. Miles Middleton to the line for 2 free throws. [Team fouls: 1] (Trae Turner: 1 personal fouls)   FT 1/2: MISS   FT 2/2: MISS Miles Middleton makes 0/2 from the line. FOUL! Loose ball foul on Michael Simmons during the free throw rebound! [Team fouls: 2] No free throws, side out. (Michael Simmons: 1 personal fouls)

[07:01] Team_057 possession (Score: 96-78)
Miles Middleton throws a bad pass! Stolen by Trae Turner! TURNOVER! (live ball)

[06:49] Team_015 possession (Score: 96-78)
Michael Simmons attempts a Layup. Contested by Klay Rozier (4.1 feet, MAN). MICHAEL SIMMONS MAKES IT! Assist: Scottie Gasol
Score: 98-78

[06:34] Team_057 possession (Score: 98-78)
Kobe Ming attempts a 3Pt. Contested by Manu Anthony (3.6 feet, MAN). Kobe Ming misses. Offensive rebound by Miles Middleton! Miles Middleton kicks it out.

[06:20] Team_057 possession (Score: 98-78)
Kobe Ming attempts a Midrange. Heavily contested by Manu Anthony (1.8 feet, MAN)! KOBE MING MAKES IT! Assist: Joel Wade
Score: 98-80

[06:08] Team_015 possession (Score: 98-80)
Scottie Gasol drives, Ben Adebayo stays with him. Scottie Gasol attempts a Layup. Contested by Ben Adebayo (4.1 feet, ZONE). Scottie Gasol misses. Rebound secured by Joel Wade.

[05:55] Team_057 possession (Score: 98-80)
Ben Adebayo attempts a 3Pt. Contested by Manu Anthony (4.3 feet, ZONE). Ben Adebayo misses. Rebound secured by CJ Banchero.

[05:44] Team_015 possession (Score: 98-80)
Scottie Gasol attempts a Midrange. Wide open! Ben Adebayo is 6.3 feet away. [MAN] SCOTTIE GASOL MAKES IT!
Score: 100-80

[05:31] Team_057 possession (Score: 100-80)
Kobe Ming throws a bad pass out of bounds! TURNOVER! (dead ball)

[05:31] Substitution (Team_015): Manu Anthony OUT → Dwyane Sabonis IN (stamina_rule2)

[05:31] Substitution (Team_015): Michael Simmons OUT → Paolo Jokic IN (stamina_rule2)

[05:31] Substitution (Team_015): CJ Banchero OUT → Magic Wagner IN (stamina_rule2)

[05:31] Substitution (Team_015): Scottie Gasol OUT → Rudy Paul IN (stamina_rule2)

[05:31] Substitution (Team_015): Trae Turner OUT → Allen Curry IN (stamina_rule2)

[05:31] Substitution (Team_057): Kobe Ming OUT → Scottie Johnson IN (stamina_rule2)

[05:31] Substitution (Team_057): Klay Rozier OUT → Bradley Ginobili IN (stamina_rule2)

[05:31] Substitution (Team_057): Ben Adebayo OUT → Lamelo Irving IN (stamina_rule2)

[05:31] Substitution (Team_057): Miles Middleton OUT → Zion Lillard IN (stamina_rule2)

[05:16] Team_015 possession (Score: 100-80)
Magic Wagner attempts a Midrange. Contested by Joel Wade (3.3 feet, MAN). MAGIC WAGNER MAKES IT! Assist: Paolo Jokic
Score: 102-80

[05:03] Team_057 possession (Score: 102-80)
Zion Lillard attempts a Midrange. Contested by Rudy Paul (5.0 feet, MAN). Zion Lillard misses. FOUL! Loose ball foul on Rudy Paul during the rebound battle. [Team fouls: 3] No free throws, side out. (Rudy Paul: 1 personal fouls)

[04:51] Team_057 possession (Score: 102-80)
Joel Wade attempts a Layup. Contested by Magic Wagner (4.7 feet, MAN). JOEL WADE MAKES IT! Assist: Lamelo Irving
Score: 102-82

[04:36] Team_015 possession (Score: 102-82)
Rudy Paul attempts a Layup. Contested by Lamelo Irving (4.7 feet, MAN). RUDY PAUL MAKES IT!
Score: 104-82

[04:25] Team_057 possession (Score: 104-82)
Zion Lillard drives and kicks out. Lamelo Irving attempts a 3Pt. Wide open! Rudy Paul is 6.1 feet away. [ZONE] Lamelo Irving misses. Rebound secured by Magic Wagner.

[04:10] Team_015 possession (Score: 104-82)
Rudy Paul drives to the basket... Rudy Paul throws a bad pass out of bounds! TURNOVER! (dead ball)

[03:57] Team_057 possession (Score: 104-82)
Joel Wade attempts a Layup. Contested by Rudy Paul (2.3 feet, ZONE). Joel Wade misses. Rebound secured by Allen Curry.

[03:44] Team_015 possession (Score: 104-82)
Magic Wagner attempts a 3Pt. Wide open! Scottie Johnson is 6.6 feet away. [ZONE] Magic Wagner misses. FOUL! Loose ball foul on Zion Lillard during the rebound battle. [Team fouls: 2] No free throws, side out. (Zion Lillard: 1 personal fouls)

[03:30] Team_015 possession (Score: 104-82)
Paolo Jokic makes the Layup and draws the foul on Joel Wade! And-1! Paolo Jokic to the line for 1. [Team fouls: 3] (Joel Wade: 1 personal fouls)   FT 1/1: GOOD Paolo Jokic makes 1/1 from the line.
Score: 107-82

[03:13] Team_057 possession (Score: 107-82)
Bradley Ginobili attempts a 3Pt. Contested by Rudy Paul (3.8 feet, ZONE). Bradley Ginobili misses. Rebound secured by Rudy Paul.

[02:57] Team_015 possession (Score: 107-82)
FOUL! Holding foul on Bradley Ginobili. [Team fouls: 4] No free throws, side out. (Bradley Ginobili: 1 personal fouls)

[02:42] Team_015 possession (Score: 107-82)
Dwyane Sabonis attempts a Midrange. Wide open! Bradley Ginobili is 8.2 feet away. [ZONE] Dwyane Sabonis misses. Offensive rebound by Rudy Paul! Rudy Paul's putback is no good. Rebound secured by Lamelo Irving.

[02:24] Team_057 possession (Score: 107-82)
Lamelo Irving attempts a Layup. Contested by Rudy Paul (3.3 feet, MAN). LAMELO IRVING MAKES IT! Assist: Joel Wade
Score: 107-84

[02:07] Team_015 possession (Score: 107-84)
Allen Curry drives and kicks out. Paolo Jokic attempts a 3Pt. Contested by Bradley Ginobili (5.4 feet, MAN). Paolo Jokic misses. Rebound secured by Zion Lillard.

[01:55] Team_057 possession (Score: 107-84)
FOUL! Reach-in foul on Rudy Paul during the drive. [Team fouls: 4] No free throws, side out. (Rudy Paul: 2 personal fouls)

[01:40] Team_057 possession (Score: 107-84)
Zion Lillard drives to the basket... Zion Lillard throws a bad pass! Stolen by Rudy Paul! TURNOVER! (live ball)

[01:30] Team_015 possession (Score: 107-84)
Allen Curry drives and kicks out. Allen Curry attempts a 3Pt. Contested by Zion Lillard (5.0 feet, MAN). Allen Curry misses. Rebound secured by Joel Wade.

[01:15] Team_057 possession (Score: 107-84)
Bradley Ginobili attempts a 3Pt. Contested by Rudy Paul (4.2 feet, ZONE). Bradley Ginobili misses. Offensive rebound by Zion Lillard! Zion Lillard puts it back in!
Score: 107-86

[01:03] Team_015 possession (Score: 107-86)
Paolo Jokic attempts a 3Pt. Contested by Bradley Ginobili (4.4 feet, MAN). PAOLO JOKIC MAKES IT! Assist: Rudy Paul
Score: 110-86

[00:47] Team_057 possession (Score: 110-86)
FOUL! Reach-in foul on Magic Wagner during the drive. [IN THE BONUS! 5 team fouls] Joel Wade to the line for 2 free throws. (Magic Wagner: 1 personal fouls)   FT 1/2: GOOD   FT 2/2: GOOD Joel Wade makes 2/2 from the line.
Score: 110-88

[00:30] Team_015 possession (Score: 110-88)
Dwyane Sabonis drives, Scottie Johnson stays with him. Dwyane Sabonis attempts a Dunk. Contested by Scottie Johnson (3.9 feet, MAN). DWYANE SABONIS MAKES IT!
Score: 112-88

[00:11] Team_057 possession (Score: 112-88)
Joel Wade throws a bad pass! Stolen by Magic Wagner! TURNOVER! (live ball)

================================================================================
                              4TH QUARTER COMPLETE                              
================================================================================

4TH QUARTER SCORE: Team_015 26, Team_057 12

BOX SCORE:
================================================================================

Team_015
--------------------------------------------------------------------------------
Player                MIN  PTS  REB  AST  TO      FG   FG%      3P   3P%
--------------------------------------------------------------------------------
CJ Banchero            40    6    6    0   0   2/4    50.0     0/0   0.0
Paolo Jokic             8    6    0    1   0   2/2   100.0     0/0   0.0
Scottie Gasol          40    5    0    1   0   2/4    50.0     0/0   0.0
Michael Simmons        40    2    1    0   0   1/2    50.0     0/0   0.0
Magic Wagner            8    2    1    0   0   1/1   100.0     0/0   0.0
Rudy Paul               8    2    1    1   0   1/1   100.0     0/0   0.0
Dwyane Sabonis          8    2    0    0   0   1/2    50.0     0/0   0.0
Trae Turner            39    1    2    1   0   1/1   100.0     0/0   0.0
Manu Anthony           40    0    0    2   0   0/0     0.0     0/0   0.0
Allen Curry             9    0    2    0   0   0/2     0.0     0/0   0.0

TEAM: FG: 11/19 (57.9%), 3PT: 4/5 (80.0%), REB: 14 (3 off, 11 def), AST: 6, TO: 2
TEAM FOULS: 5 [Team_057 in BONUS]


Team_057
--------------------------------------------------------------------------------
Player                MIN  PTS  REB  AST  TO      FG   FG%      3P   3P%
--------------------------------------------------------------------------------
Joel Wade              13    4    2    2   0   2/6    33.3     0/0   0.0
Ben Adebayo            40    2    1    0   0   1/3    33.3     0/0   0.0
Kobe Ming              40    2    0    0   0   1/1   100.0     0/0   0.0
Lamelo Irving           8    2    2    1   0   1/1   100.0     0/0   0.0
Zion Lillard            8    2    2    0   0   1/2    50.0     0/0   0.0
Anfernee Adebayo       35    0    2    0   0   0/1     0.0     0/0   0.0
Klay Rozier            40    0    0    0   0   0/2     0.0     0/0   0.0
Miles Middleton        40    0    4    0   0   0/0     0.0     0/0   0.0
Bradley Ginobili        8    0    0    0   0   0/1     0.0     0/0   0.0

TEAM: FG: 6/17 (35.3%), 3PT: 1/8 (12.5%), REB: 12 (5 off, 7 def), AST: 3, TO: 4
TEAM FOULS: 4

================================================================================

================================================================================
                               FULL GAME COMPLETE                               
================================================================================

FINAL SCORE: Team_015 112, Team_057 88

SCORING BY QUARTER:
--------------------------------------------------------------------------------
Team                     Q1     Q2     Q3     Q4    FINAL
--------------------------------------------------------------------------------
Team_015                 25     31     30     26      112
Team_057                 35     21     20     12       88
--------------------------------------------------------------------------------

FULL GAME BOX SCORE:
================================================================================

Team_015
--------------------------------------------------------------------------------
Player                MIN  PTS  REB  AST  TO      FG   FG%      3P   3P%      FT STL BLK
--------------------------------------------------------------------------------
Manu Anthony           40   16    0    4   3   7/8    87.5   5/6    83.3   0/0     1   0
Michael Simmons        40   14    8    5   2   5/13   38.5   1/5    20.0   2/2     0   0
CJ Banchero            40   25   17    1   0  11/16   68.8   3/5    60.0   0/0     1   0
Scottie Gasol          40   24    2    4   2   8/13   61.5   4/5    80.0   0/1     1   0
Trae Turner            39   12   10    7   4   6/11   54.5   0/0     0.0   4/5     1   0
Allen Curry             9    0    3    2   0   0/4     0.0   0/0     0.0   0/0     0   0
Dwyane Sabonis          8    2    0    0   1   1/2    50.0   0/0     0.0   0/0     0   0
Paolo Jokic             8   12    0    1   1   4/5    80.0   3/4    75.0   4/4     0   0
Magic Wagner            8    2    2    0   0   1/1   100.0   0/0     0.0   0/0     1   0
Rudy Paul               8    5    3    1   0   2/2   100.0   1/1   100.0   0/0     1   0

TEAM: FG: 45/75 (60.0%), 3PT: 17/26 (65.4%), REB: 46 (8 off, 38 def), AST: 25, TO: 13


Team_057
--------------------------------------------------------------------------------
Player                MIN  PTS  REB  AST  TO      FG   FG%      3P   3P%      FT STL BLK
--------------------------------------------------------------------------------
Kobe Ming              40   18    0    3   5   7/12   58.3   0/2     0.0   7/12    0   0
Klay Rozier            40   18    0    2   0   8/16   50.0   4/7    57.1   3/4     0   1
Ben Adebayo            40   13   12    0   1   6/11   54.5   1/3    33.3   4/4     0   0
Miles Middleton        40   16   17    2   2   6/11   54.5   1/2    50.0   5/7     0   2
Anfernee Adebayo       35    6    8    3   2   2/7    28.6   2/4    50.0   0/0     0   0
Joel Wade              13    6    3    2   1   3/8    37.5   0/4     0.0   2/2     0   0
Scottie Johnson         8    0    0    1   0   0/1     0.0   0/1     0.0   0/0     0   0
Bradley Ginobili        8    2    0    0   0   2/3    66.7   1/2    50.0   0/0     0   0
Lamelo Irving           8    2    3    1   0   1/1   100.0   0/0     0.0   0/0     0   0
Zion Lillard            8    2    2    0   1   0/3     0.0   0/0     0.0   0/0     0   0

TEAM: FG: 36/74 (48.6%), 3PT: 9/25 (36.0%), REB: 43 (15 off, 28 def), AST: 14, TO: 12

================================================================================
