================================================================================
                        FULL GAME - Team_030 vs Team_061                        
================================================================================

================================================================================
                       1ST QUARTER - Team_030 vs Team_061                       
================================================================================

[12:00] Team_030 possession (Score: 0-0)
Jaren Green attempts a Midrange. Contested by Jayson Holiday (4.2 feet, ZONE). Jaren Green misses. Rebound secured by Bam Sexton.

[11:46] Team_061 possession (Score: 0-0)
Jayson Holiday attempts a 3Pt. Contested by Tim Barrett (4.8 feet, MAN). JAYSON HOLIDAY MAKES IT! Assist: Michael Russell
Score: 0-3

[11:30] Team_030 possession (Score: 0-3)
Jaren Green attempts a Midrange. Contested by Draymond Banchero (3.1 feet, MAN). Jaren Green misses. FOUL! Loose ball foul on Michael Russell during the rebound battle. [Team fouls: 1] No free throws, side out. (Michael Russell: 1 personal fouls)

[11:14] Team_030 possession (Score: 0-3)
Tim Barrett attempts a 3Pt. Heavily contested by Jayson Holiday (0.5 feet, MAN)! TIM BARRETT MAKES IT! Assist: Jaren Green
Score: 3-3

[11:04] Team_061 possession (Score: 3-3)
Draymond Banchero drives and kicks out. Jayson Holiday attempts a Midrange. Contested by Joel Anunoby (3.3 feet, ZONE). JAYSON HOLIDAY MAKES IT! Assist: Draymond Banchero
Score: 3-5

[10:51] Team_030 possession (Score: 3-5)
Tim Barrett attempts a 3Pt. Contested by Brandon Russell (4.1 feet, ZONE). TIM BARRETT MAKES IT! Assist: Joel Anunoby
Score: 6-5

[10:36] Team_061 possession (Score: 6-5)
Brandon Russell attempts a Midrange. Contested by Joel Anunoby (2.0 feet, ZONE). BRANDON RUSSELL MAKES IT!
Score: 6-7

[10:22] Team_030 possession (Score: 6-7)
Jordan Nowitzki drives, Draymond Banchero stays with him. Jordan Nowitzki attempts a Layup. Contested by Draymond Banchero (4.4 feet, ZONE). JORDAN NOWITZKI MAKES IT! Assist: Jaren Green
Score: 8-7

[10:06] Team_061 possession (Score: 8-7)
Bam Sexton attempts a 3Pt. Contested by Tim Barrett (3.8 feet, ZONE). Bam Sexton misses. Rebound secured by Jordan Nowitzki.

[09:47] Team_030 possession (Score: 8-7)
Jaren Green attempts a Layup. Contested by Draymond Banchero (5.6 feet, MAN). JAREN GREEN MAKES IT! Assist: Jordan Nowitzki
Score: 10-7

[09:31] Team_061 possession (Score: 10-7)
Brandon Russell drives to the basket... Brandon Russell throws a bad pass! Stolen by Jaren Green! TURNOVER! (live ball)

[09:14] Team_030 possession (Score: 10-7)
Joel Anunoby attempts a Layup. Contested by Michael Russell (3.8 feet, MAN). JOEL ANUNOBY MAKES IT!
Score: 12-7

[08:59] Team_061 possession (Score: 12-7)
Michael Russell attempts a 3Pt. Contested by Tyler Beal (2.5 feet, ZONE). MICHAEL RUSSELL MAKES IT!
Score: 12-10

[08:40] Team_030 possession (Score: 12-10)
Jaren Green attempts a 3Pt. Contested by Draymond Banchero (3.6 feet, MAN). Jaren Green misses. Rebound secured by Michael Russell.

[08:22] Team_061 possession (Score: 12-10)
Michael Russell attempts a 3Pt. Contested by Joel Anunoby (5.8 feet, MAN). Michael Russell misses. Rebound secured by Jaren Green.

[08:08] Team_030 possession (Score: 12-10)
Tyler Beal drives, picks up Brandon Russell. Help arrives from Michael Russell! Tyler Beal attempts a Dunk. Contested by Michael Russell (3.7 feet, MAN). TYLER BEAL MAKES IT! Assist: Jordan Nowitzki
Score: 14-10

[07:55] Team_061 possession (Score: 14-10)
Jayson Holiday drives, picks up Tim Barrett. Help arrives from Joel Anunoby! Jayson Holiday attempts a Layup. Wide open! Joel Anunoby is 7.7 feet away. [MAN] JAYSON HOLIDAY MAKES IT! Assist: Draymond Banchero
Score: 14-12

[07:42] Team_030 possession (Score: 14-12)
Joel Anunoby attempts a 3Pt. Contested by Michael Russell (6.0 feet, MAN). JOEL ANUNOBY MAKES IT!
Score: 17-12

[07:31] Team_061 possession (Score: 17-12)
Draymond Banchero makes the Layup and draws the foul on Tyler Beal! And-1! Draymond Banchero to the line for 1. [Team fouls: 1] (Tyler Beal: 1 personal fouls)   FT 1/1: GOOD Draymond Banchero makes 1/1 from the line.
Score: 17-15

[07:14] Team_030 possession (Score: 17-15)
Joel Anunoby drives, Michael Russell stays with him. Joel Anunoby attempts a Layup. Wide open! Michael Russell is 8.1 feet away. [MAN] JOEL ANUNOBY MAKES IT!
Score: 19-15

[07:03] Team_061 possession (Score: 19-15)
Jayson Holiday attempts a Layup. Contested by Jaren Green (5.6 feet, ZONE). Jayson Holiday misses. Rebound secured by Joel Anunoby.

[06:46] Team_030 possession (Score: 19-15)
Tim Barrett drives and kicks out. Tyler Beal attempts a Midrange. Heavily contested by Brandon Russell (0.7 feet, MAN)! TYLER BEAL MAKES IT!
Score: 21-15

[06:31] Team_061 possession (Score: 21-15)
Bam Sexton drives to the basket... Bam Sexton loses the ball! Stripped by Jaren Green! TURNOVER! (live ball)

[06:18] Team_030 possession (Score: 21-15)
Jordan Nowitzki attempts a 3Pt. Contested by Brandon Russell (2.9 feet, ZONE). Jordan Nowitzki misses. Offensive rebound by Jordan Nowitzki! Jordan Nowitzki puts it back in!
Score: 23-15

[06:03] Team_061 possession (Score: 23-15)
Bam Sexton attempts a 3Pt. Contested by Tyler Beal (4.1 feet, ZONE). Bam Sexton misses. Offensive rebound by Michael Russell! Michael Russell puts it back in!
Score: 23-17

[05:49] Team_030 possession (Score: 23-17)
Tyler Beal attempts a Midrange. Contested by Jayson Holiday (5.8 feet, ZONE). Tyler Beal misses. FOUL! Loose ball foul on Michael Russell during the rebound battle. [Team fouls: 2] No free throws, side out. (Michael Russell: 2 personal fouls)

[05:32] Team_030 possession (Score: 23-17)
Jaren Green drives to the basket... FOUL! Offensive foul on Jaren Green! Bam Sexton drew the charge! [Team fouls: 2] (Jaren Green: 1 personal fouls) TURNOVER! (dead ball)

[05:19] Team_061 possession (Score: 23-17)
Draymond Banchero attempts a 3Pt. Contested by Tyler Beal (3.6 feet, ZONE). DRAYMOND BANCHERO MAKES IT! Assist: Bam Sexton
Score: 23-20

[05:04] Team_030 possession (Score: 23-20)
Joel Anunoby attempts a Midrange. Contested by Michael Russell (5.6 feet, MAN). Joel Anunoby misses. Rebound secured by Draymond Banchero.

[04:48] Team_061 possession (Score: 23-20)
Brandon Russell drives, Jaren Green stays with him. Brandon Russell attempts a Layup. Contested by Jaren Green (2.8 feet, ZONE). Brandon Russell misses. Rebound secured by Jaren Green.

[04:36] Team_030 possession (Score: 23-20)
FOUL! Holding foul on Jayson Holiday. [Team fouls: 3] No free throws, side out. (Jayson Holiday: 1 personal fouls)

[04:23] Team_030 possession (Score: 23-20)
Jaren Green drives and kicks out. Jaren Green attempts a 3Pt. Wide open! Brandon Russell is 6.8 feet away. [ZONE] Jaren Green misses. Rebound secured by Draymond Banchero.

[04:09] Team_061 possession (Score: 23-20)
Brandon Russell attempts a 3Pt. Contested by Tyler Beal (4.9 feet, MAN). Brandon Russell misses. Rebound secured by Jordan Nowitzki.

[03:53] Team_030 possession (Score: 23-20)
Jaren Green drives to the basket... FOUL! Offensive foul on Jaren Green! Draymond Banchero drew the charge! [Team fouls: 3] (Jaren Green: 2 personal fouls) TURNOVER! (dead ball)

[03:40] Team_061 possession (Score: 23-20)
Draymond Banchero loses the ball! Stripped by Jaren Green! TURNOVER! (live ball)

[03:30] Team_030 possession (Score: 23-20)
Joel Anunoby attempts a 3Pt. Contested by Brandon Russell (5.0 feet, ZONE). Joel Anunoby misses. Rebound secured by Michael Russell.

[03:12] Team_061 possession (Score: 23-20)
Draymond Banchero attempts a 3Pt. Wide open! Jaren Green is 6.3 feet away. [MAN] DRAYMOND BANCHERO MAKES IT! Assist: Michael Russell
Score: 23-23

[02:56] Team_030 possession (Score: 23-23)
FOUL! Shooting foul on Brandon Russell. Joel Anunoby to the line for 3 free throws. [Team fouls: 4] (Brandon Russell: 1 personal fouls)   FT 1/3: GOOD   FT 2/3: GOOD   FT 3/3: GOOD Joel Anunoby makes 3/3 from the line.
Score: 26-23

[02:44] Team_061 possession (Score: 26-23)
Jayson Holiday attempts a 3Pt. Heavily contested by Tyler Beal (0.5 feet, ZONE)! Jayson Holiday misses. Rebound secured by Joel Anunoby.

[02:28] Team_030 possession (Score: 26-23)
Tyler Beal attempts a 3Pt. Contested by Brandon Russell (5.2 feet, ZONE). Tyler Beal misses. Rebound secured by Bam Sexton.

[02:14] Team_061 possession (Score: 26-23)
Jayson Holiday attempts a 3Pt. Contested by Tyler Beal (2.9 feet, ZONE). JAYSON HOLIDAY MAKES IT! Assist: Brandon Russell
Score: 26-26

[02:01] Team_030 possession (Score: 26-26)
Tim Barrett attempts a 3Pt. Contested by Jayson Holiday (5.8 feet, MAN). TIM BARRETT MAKES IT! Assist: Jordan Nowitzki
Score: 29-26

[01:51] Team_061 possession (Score: 29-26)
Draymond Banchero makes the Layup and draws the foul on Jaren Green! And-1! Draymond Banchero to the line for 1. [Team fouls: 4] (Jaren Green: 3 personal fouls)   FT 1/1: GOOD Draymond Banchero makes 1/1 from the line.
Score: 29-29

[01:36] Team_030 possession (Score: 29-29)
Jaren Green makes the Layup and draws the foul on Jayson Holiday! And-1! Jaren Green to the line for 1. [BONUS: 5 team fouls] (Jayson Holiday: 2 personal fouls)   FT 1/1: GOOD Jaren Green makes 1/1 from the line.
Score: 32-29

[01:24] Team_061 possession (Score: 32-29)
Brandon Russell attempts a Midrange. Wide open! Tyler Beal is 7.1 feet away. [MAN] BRANDON RUSSELL MAKES IT!
Score: 32-31

[01:09] Team_030 possession (Score: 32-31)
Tim Barrett attempts a 3Pt. Contested by Jayson Holiday (4.9 feet, MAN). Tim Barrett misses. Rebound secured by Michael Russell.

[00:55] Team_061 possession (Score: 32-31)
Draymond Banchero attempts a Midrange. Wide open! Joel Anunoby is 6.3 feet away. [ZONE] Draymond Banchero misses. Rebound secured by Joel Anunoby.

[00:37] Team_030 possession (Score: 32-31)
Joel Anunoby drives, Michael Russell stays with him. Joel Anunoby attempts a Layup. Contested by Michael Russell (3.5 feet, MAN). Joel Anunoby misses. FOUL! Loose ball foul on Draymond Banchero during the rebound battle. [IN THE BONUS! 6 team fouls] Joel Anunoby to the line for 2 free throws. (Draymond Banchero: 1 personal fouls)   FT 1/2: GOOD   FT 2/2: GOOD Joel Anunoby makes 2/2 from the line.
Score: 34-31

[00:26] Team_061 possession (Score: 34-31)
Michael Russell attempts a Midrange. Contested by Jordan Nowitzki (4.7 feet, ZONE). MICHAEL RUSSELL MAKES IT!
Score: 34-33

[00:13] Team_030 possession (Score: 34-33)
Joel Anunoby attempts a Midrange. Wide open! Michael Russell is 7.2 feet away. [MAN] Joel Anunoby misses. Rebound secured by Draymond Banchero.

================================================================================
                              1ST QUARTER COMPLETE                              
================================================================================

1ST QUARTER SCORE: Team_030 34, Team_061 33

BOX SCORE:
================================================================================

Team_030
--------------------------------------------------------------------------------
Player                MIN  PTS  REB  AST  TO      FG   FG%      3P   3P%
--------------------------------------------------------------------------------
Joel Anunoby           12   12    3    1   0   5/8    62.5     0/0   0.0
Tim Barrett            12    9    0    0   0   3/4    75.0     0/0   0.0
Jaren Green            12    5    2    2   0   2/5    40.0     0/0   0.0
Jordan Nowitzki        12    4    5    3   0   2/2   100.0     0/0   0.0
Tyler Beal             12    4    0    0   0   2/3    66.7     0/0   0.0

TEAM: FG: 14/22 (63.6%), 3PT: 6/10 (60.0%), REB: 10 (3 off, 7 def), AST: 6, TO: 2
TEAM FOULS: 4


Team_061
--------------------------------------------------------------------------------
Player                MIN  PTS  REB  AST  TO      FG   FG%      3P   3P%
--------------------------------------------------------------------------------
Draymond Banchero      12   12    3    2   0   4/5    80.0     0/0   0.0
Jayson Holiday         12   10    0    0   0   4/6    66.7     0/0   0.0
Michael Russell        12    7    4    2   0   3/4    75.0     0/0   0.0
Brandon Russell        12    4    0    1   0   2/4    50.0     0/0   0.0
Bam Sexton             12    0    2    1   0   0/1     0.0     0/0   0.0

TEAM: FG: 13/20 (65.0%), 3PT: 6/10 (60.0%), REB: 9 (1 off, 8 def), AST: 6, TO: 3
TEAM FOULS: 6 [Team_030 in BONUS]

================================================================================

================================================================================
                       2ND QUARTER - Team_030 vs Team_061                       
================================================================================

[12:00] Team_030 possession (Score: 34-33)
Tim Barrett attempts a 3Pt. Contested by Brandon Russell (5.6 feet, ZONE). Tim Barrett misses. Rebound secured by Michael Russell.

[11:51] Team_061 possession (Score: 34-33)
Michael Russell attempts a 3Pt. Heavily contested by Joel Anunoby (0.5 feet, MAN)! MICHAEL RUSSELL MAKES IT! Assist: Bam Sexton
Score: 34-36

[11:33] Team_030 possession (Score: 34-36)
Tyler Beal attempts a Layup. BLOCKED BY DRAYMOND BANCHERO! Ball is loose! Offensive rebound by Jordan Nowitzki! Jordan Nowitzki kicks it out.

[11:18] Team_030 possession (Score: 34-36)
Jordan Nowitzki makes the 3Pt and draws the foul on Bam Sexton! And-1! Jordan Nowitzki to the line for 1. [Team fouls: 1] (Bam Sexton: 1 personal fouls)   FT 1/1: GOOD Jordan Nowitzki makes 1/1 from the line.
Score: 38-36

[11:01] Team_061 possession (Score: 38-36)
Brandon Russell attempts a 3Pt. Contested by Tyler Beal (3.2 feet, ZONE). Brandon Russell misses. Rebound secured by Jaren Green.

[10:48] Team_030 possession (Score: 38-36)
Jaren Green attempts a Midrange. Wide open! Brandon Russell is 6.8 feet away. [ZONE] JAREN GREEN MAKES IT! Assist: Tyler Beal
Score: 40-36

[10:34] Team_061 possession (Score: 40-36)
Jayson Holiday drives and kicks out. Jayson Holiday attempts a Midrange. Contested by Joel Anunoby (5.6 feet, ZONE). Jayson Holiday misses. Rebound secured by Jaren Green.

[10:17] Team_030 possession (Score: 40-36)
Tim Barrett attempts a Midrange. Contested by Jayson Holiday (4.6 feet, MAN). Tim Barrett misses. Rebound secured by Bam Sexton.

[10:03] Team_061 possession (Score: 40-36)
Bam Sexton drives, Jordan Nowitzki stays with him. Bam Sexton attempts a Dunk. Contested by Jordan Nowitzki (5.0 feet, MAN). BAM SEXTON MAKES IT! Assist: Michael Russell
Score: 40-38

[09:48] Team_030 possession (Score: 40-38)
Tim Barrett attempts a Midrange. Contested by Jayson Holiday (5.1 feet, MAN). Tim Barrett misses. Rebound secured by Draymond Banchero.

[09:36] Team_061 possession (Score: 40-38)
Jayson Holiday attempts a 3Pt. Contested by Tim Barrett (4.0 feet, ZONE). JAYSON HOLIDAY MAKES IT! Assist: Brandon Russell
Score: 40-41

[09:21] Team_030 possession (Score: 40-41)
Joel Anunoby drives and kicks out. FOUL! Shooting foul on Brandon Russell. Jordan Nowitzki to the line for 3 free throws. [Team fouls: 2] (Brandon Russell: 1 personal fouls)   FT 1/3: GOOD   FT 2/3: GOOD   FT 3/3: MISS Jordan Nowitzki makes 2/3 from the line. Rebound secured by Bam Sexton.
Score: 42-41

[09:05] Team_061 possession (Score: 42-41)
Brandon Russell attempts a 3Pt. Contested by Tyler Beal (2.2 feet, MAN). Brandon Russell misses. Rebound secured by Joel Anunoby.

[08:54] Team_030 possession (Score: 42-41)
Jaren Green makes the Layup and draws the foul on Jayson Holiday! And-1! Jaren Green to the line for 1. [Team fouls: 3] (Jayson Holiday: 1 personal fouls)   FT 1/1: MISS Jaren Green makes 0/1 from the line. Rebound secured by Draymond Banchero.
Score: 44-41

[08:37] Team_061 possession (Score: 44-41)
Jayson Holiday attempts a 3Pt. Wide open! Tim Barrett is 6.8 feet away. [MAN] Jayson Holiday misses. Rebound secured by Jordan Nowitzki.

[08:22] Team_030 possession (Score: 44-41)
Jaren Green attempts a 3Pt. Contested by Draymond Banchero (5.2 feet, MAN). Jaren Green misses. Rebound secured by Bam Sexton.

[08:08] Team_061 possession (Score: 44-41)
Draymond Banchero makes the Dunk and draws the foul on Jaren Green! And-1! Draymond Banchero to the line for 1. [Team fouls: 1] (Jaren Green: 1 personal fouls)   FT 1/1: GOOD Draymond Banchero makes 1/1 from the line.
Score: 44-44

[07:51] Team_030 possession (Score: 44-44)
Jordan Nowitzki attempts a Midrange. Contested by Jayson Holiday (3.5 feet, ZONE). Jordan Nowitzki misses. Rebound secured by Draymond Banchero.

[07:36] Team_061 possession (Score: 44-44)
Jayson Holiday drives to the basket... FOUL! Offensive foul on Jayson Holiday! Jordan Nowitzki drew the charge! [Team fouls: 4] (Jayson Holiday: 2 personal fouls) TURNOVER! (dead ball)

[07:22] Team_030 possession (Score: 44-44)
Tim Barrett attempts a 3Pt. Contested by Brandon Russell (4.8 feet, ZONE). Tim Barrett misses. Rebound secured by Bam Sexton.

[07:07] Team_061 possession (Score: 44-44)
Bam Sexton drives, picks up Jordan Nowitzki. Help arrives from Tyler Beal! Bam Sexton attempts a Dunk. Contested by Tyler Beal (4.5 feet, MAN). Bam Sexton misses. Offensive rebound by Bam Sexton! Bam Sexton kicks it out.

[06:55] Team_061 possession (Score: 44-44)
Jayson Holiday drives to the basket... Jayson Holiday throws a bad pass out of bounds! TURNOVER! (dead ball)

[06:55] Substitution (Team_030): Tyler Beal OUT → RJ Carter IN (stamina_rule2)

[06:55] Substitution (Team_030): Tim Barrett OUT → Josh Smith IN (stamina_rule2)

[06:55] Substitution (Team_030): Joel Anunoby OUT → Pau James IN (stamina_rule2)

[06:55] Substitution (Team_030): Jordan Nowitzki OUT → Damian Green IN (stamina_rule2)

[06:55] Substitution (Team_030): Jaren Green OUT → Franz Anunoby IN (stamina_rule2)

[06:55] Substitution (Team_061): Brandon Russell OUT → Evan Rose IN (stamina_rule2)

[06:55] Substitution (Team_061): Jayson Holiday OUT → Gary Fox IN (stamina_rule2)

[06:55] Substitution (Team_061): Michael Russell OUT → Desmond Morant IN (stamina_rule2)

[06:55] Substitution (Team_061): Bam Sexton OUT → Stephen Towns IN (stamina_rule2)

[06:55] Substitution (Team_061): Draymond Banchero OUT → Tim Durant IN (stamina_rule2)

[06:38] Team_030 possession (Score: 44-44)
Franz Anunoby attempts a Layup. BLOCKED BY TIM DURANT! Ball is loose! Offensive rebound by Pau James! Pau James kicks it out.

[06:24] Team_030 possession (Score: 44-44)
RJ Carter drives and kicks out. RJ Carter attempts a Midrange. Wide open! Gary Fox is 8.9 feet away. [ZONE] RJ CARTER MAKES IT!
Score: 46-44

[06:13] Team_061 possession (Score: 46-44)
Gary Fox attempts a 3Pt. Contested by Josh Smith (2.2 feet, MAN). Gary Fox misses. Rebound secured by Franz Anunoby.

[05:54] Team_030 possession (Score: 46-44)
Damian Green drives and kicks out. Franz Anunoby attempts a Midrange. Wide open! Tim Durant is 7.5 feet away. [MAN] Franz Anunoby misses. Offensive rebound by Damian Green! Damian Green kicks it out.

[05:38] Team_030 possession (Score: 46-44)
FOUL! Holding foul on Desmond Morant. [IN THE BONUS! 5 team fouls] Pau James to the line for 2 free throws. (Desmond Morant: 1 personal fouls)   FT 1/2: GOOD   FT 2/2: GOOD Pau James makes 2/2 from the line.
Score: 48-44

[05:22] Team_061 possession (Score: 48-44)
Desmond Morant attempts a 3Pt. Contested by RJ Carter (4.8 feet, ZONE). Desmond Morant misses. Rebound secured by Pau James.

[05:06] Team_030 possession (Score: 48-44)
RJ Carter throws a bad pass out of bounds! TURNOVER! (dead ball)

[04:50] Team_061 possession (Score: 48-44)
Stephen Towns drives, picks up Damian Green. Help arrives from Josh Smith! Stephen Towns attempts a Layup. Wide open! Josh Smith is 6.6 feet away. [MAN] Stephen Towns misses. Rebound secured by Franz Anunoby.

[04:33] Team_030 possession (Score: 48-44)
FOUL! Shooting foul on Tim Durant. Pau James to the line for 2 free throws. [BONUS: 6 team fouls] (Tim Durant: 1 personal fouls)   FT 1/2: GOOD   FT 2/2: GOOD Pau James makes 2/2 from the line.
Score: 50-44

[04:17] Team_061 possession (Score: 50-44)
Evan Rose loses the ball! Stripped by RJ Carter! TURNOVER! (live ball)

[04:04] Team_030 possession (Score: 50-44)
Damian Green drives and kicks out. RJ Carter attempts a Midrange. Wide open! Evan Rose is 6.6 feet away. [MAN] RJ CARTER MAKES IT! Assist: Pau James
Score: 52-44

[03:48] Team_061 possession (Score: 52-44)
Desmond Morant drives and kicks out. Evan Rose attempts a 3Pt. Wide open! RJ Carter is 6.6 feet away. [ZONE] Evan Rose misses. Rebound secured by Damian Green.

[03:36] Team_030 possession (Score: 52-44)
RJ Carter attempts a 3Pt. Contested by Evan Rose (4.0 feet, MAN). RJ CARTER MAKES IT! Assist: Josh Smith
Score: 55-44

[03:24] Team_061 possession (Score: 55-44)
Desmond Morant attempts a 3Pt. Contested by RJ Carter (4.9 feet, ZONE). Desmond Morant misses. Rebound secured by Franz Anunoby.

[03:11] Team_030 possession (Score: 55-44)
Damian Green attempts a 3Pt. Wide open! Desmond Morant is 6.8 feet away. [ZONE] DAMIAN GREEN MAKES IT! Assist: Josh Smith
Score: 58-44

[02:56] Team_061 possession (Score: 58-44)
FOUL! Shooting foul on Josh Smith. Stephen Towns to the line for 2 free throws. [Team fouls: 2] (Josh Smith: 1 personal fouls)   FT 1/2: GOOD   FT 2/2: GOOD Stephen Towns makes 2/2 from the line.
Score: 58-46

[02:42] Team_030 possession (Score: 58-46)
Pau James drives to the basket... Pau James loses the ball! Stripped by Tim Durant! TURNOVER! (live ball)

[02:24] Team_061 possession (Score: 58-46)
Desmond Morant attempts a 3Pt. Contested by Pau James (5.7 feet, ZONE). Desmond Morant misses. Rebound secured by Pau James.

[02:11] Team_030 possession (Score: 58-46)
RJ Carter throws a bad pass! Stolen by Evan Rose! TURNOVER! (live ball)

[01:54] Team_061 possession (Score: 58-46)
FOUL! Shooting foul on Josh Smith. Desmond Morant to the line for 2 free throws. [Team fouls: 3] (Josh Smith: 2 personal fouls)   FT 1/2: GOOD   FT 2/2: GOOD Desmond Morant makes 2/2 from the line.
Score: 58-48

[01:39] Team_030 possession (Score: 58-48)
FOUL! Shooting foul on Desmond Morant. Pau James to the line for 3 free throws. [BONUS: 7 team fouls] (Desmond Morant: 2 personal fouls)   FT 1/3: GOOD   FT 2/3: MISS   FT 3/3: GOOD Pau James makes 2/3 from the line.
Score: 60-48

[01:23] Team_061 possession (Score: 60-48)
Desmond Morant attempts a 3Pt. Contested by Pau James (6.0 feet, MAN). DESMOND MORANT MAKES IT! Assist: Tim Durant
Score: 60-51

[01:13] Team_030 possession (Score: 60-51)
Pau James attempts a Midrange. Wide open! Desmond Morant is 6.1 feet away. [MAN] PAU JAMES MAKES IT! Assist: Franz Anunoby
Score: 62-51

[01:01] Team_061 possession (Score: 62-51)
Stephen Towns attempts a 3Pt. Wide open! Damian Green is 6.1 feet away. [MAN] STEPHEN TOWNS MAKES IT! Assist: Evan Rose
Score: 62-54

[00:48] Team_030 possession (Score: 62-54)
Josh Smith attempts a 3Pt. Contested by Gary Fox (3.4 feet, MAN). JOSH SMITH MAKES IT! Assist: Pau James
Score: 65-54

[00:31] Team_061 possession (Score: 65-54)
Gary Fox attempts a 3Pt. Contested by Josh Smith (5.3 feet, MAN). Gary Fox misses. Rebound secured by Pau James.

[00:13] Team_030 possession (Score: 65-54)
RJ Carter attempts a 3Pt. Contested by Evan Rose (6.0 feet, MAN). RJ Carter misses. Offensive rebound by Damian Green! Damian Green kicks it out.

================================================================================
                              2ND QUARTER COMPLETE                              
================================================================================

2ND QUARTER SCORE: Team_030 31, Team_061 21

BOX SCORE:
================================================================================

Team_030
--------------------------------------------------------------------------------
Player                MIN  PTS  REB  AST  TO      FG   FG%      3P   3P%
--------------------------------------------------------------------------------
Pau James               7    8    4    2   0   4/4   100.0     0/0   0.0
RJ Carter               7    7    0    0   0   3/3   100.0     0/0   0.0
Jordan Nowitzki        17    4    2    0   0   1/2    50.0     0/0   0.0
Damian Green            7    3    3    0   0   1/1   100.0     0/0   0.0
Josh Smith              7    3    0    2   0   1/1   100.0     0/0   0.0
Jaren Green            17    2    2    0   0   1/3    33.3     0/0   0.0
Tim Barrett            17    0    0    0   0   0/4     0.0     0/0   0.0
Tyler Beal             17    0    0    1   0   0/0     0.0     0/0   0.0
Joel Anunoby           17    0    1    0   0   0/1     0.0     0/0   0.0
Franz Anunoby           7    0    3    1   0   0/0     0.0     0/0   0.0

TEAM: FG: 11/19 (57.9%), 3PT: 5/8 (62.5%), REB: 15 (4 off, 11 def), AST: 6, TO: 3
TEAM FOULS: 3


Team_061
--------------------------------------------------------------------------------
Player                MIN  PTS  REB  AST  TO      FG   FG%      3P   3P%
--------------------------------------------------------------------------------
Desmond Morant          7    5    0    0   0   2/6    33.3     0/0   0.0
Stephen Towns           7    5    0    0   0   2/3    66.7     0/0   0.0
Michael Russell        17    3    1    1   0   1/1   100.0     0/0   0.0
Jayson Holiday         17    3    0    0   0   1/3    33.3     0/0   0.0
Draymond Banchero      17    3    3    0   0   1/1   100.0     0/0   0.0
Bam Sexton             17    2    5    1   0   1/1   100.0     0/0   0.0
Brandon Russell        17    0    0    1   0   0/2     0.0     0/0   0.0
Gary Fox                7    0    0    0   0   0/2     0.0     0/0   0.0
Tim Durant              7    0    0    1   0   0/0     0.0     0/0   0.0
Evan Rose               7    0    0    1   0   0/0     0.0     0/0   0.0

TEAM: FG: 8/19 (42.1%), 3PT: 4/12 (33.3%), REB: 9 (1 off, 8 def), AST: 5, TO: 3
TEAM FOULS: 7 [Team_030 in BONUS]

================================================================================

================================================================================
                       3RD QUARTER - Team_030 vs Team_061                       
================================================================================

[12:00] Team_030 possession (Score: 65-54)
Jordan Nowitzki throws a bad pass! Stolen by Bam Sexton! TURNOVER! (live ball)

[11:41] Team_061 possession (Score: 65-54)
Brandon Russell attempts a Midrange. Contested by Tim Barrett (5.2 feet, ZONE). Brandon Russell misses. Rebound secured by Jaren Green.

[11:27] Team_030 possession (Score: 65-54)
Jaren Green attempts a 3Pt. Wide open! Brandon Russell is 6.7 feet away. [ZONE] Jaren Green misses. Rebound secured by Draymond Banchero.

[11:12] Team_061 possession (Score: 65-54)
Michael Russell drives to the basket... Michael Russell loses the ball! Stripped by Joel Anunoby! TURNOVER! (live ball)

[10:58] Team_030 possession (Score: 65-54)
Jaren Green drives, picks up Draymond Banchero. Help arrives from Jayson Holiday! Jaren Green attempts a Layup. Heavily contested by Jayson Holiday (0.5 feet, MAN)! JAREN GREEN MAKES IT!
Score: 67-54

[10:42] Team_061 possession (Score: 67-54)
Jayson Holiday attempts a Layup. Contested by Tim Barrett (5.4 feet, MAN). JAYSON HOLIDAY MAKES IT!
Score: 67-56

[10:30] Team_030 possession (Score: 67-56)
Jaren Green drives, Draymond Banchero stays with him. Jaren Green attempts a Layup. Contested by Draymond Banchero (4.4 feet, ZONE). JAREN GREEN MAKES IT!
Score: 69-56

[10:12] Team_061 possession (Score: 69-56)
Bam Sexton attempts a Layup. BLOCKED BY JAREN GREEN! Ball deflects out of bounds off Bam Sexton.

[09:55] Team_030 possession (Score: 69-56)
Jaren Green drives to the basket... FOUL! Offensive foul on Jaren Green! Draymond Banchero drew the charge! [Team fouls: 1] (Jaren Green: 1 personal fouls) TURNOVER! (dead ball)

[09:40] Team_061 possession (Score: 69-56)
Bam Sexton attempts a 3Pt. Wide open! Tyler Beal is 6.7 feet away. [ZONE] BAM SEXTON MAKES IT! Assist: Draymond Banchero
Score: 69-59

[09:29] Team_030 possession (Score: 69-59)
Jaren Green loses control! Ball rolls out of bounds! TURNOVER! (dead ball)

[09:14] Team_061 possession (Score: 69-59)
Bam Sexton attempts a 3Pt. Wide open! Jordan Nowitzki is 6.4 feet away. [MAN] Bam Sexton misses. Offensive rebound by Draymond Banchero! Draymond Banchero puts it back in!
Score: 69-61

[08:59] Team_030 possession (Score: 69-61)
Jaren Green drives and kicks out. Jordan Nowitzki attempts a 3Pt. Contested by Brandon Russell (4.7 feet, ZONE). JORDAN NOWITZKI MAKES IT! Assist: Jaren Green
Score: 72-61

[08:43] Team_061 possession (Score: 72-61)
Jayson Holiday drives to the basket... Jayson Holiday throws a bad pass! Stolen by Jaren Green! TURNOVER! (live ball)

[08:30] Team_030 possession (Score: 72-61)
FOUL! Reach-in foul on Draymond Banchero during the drive. [Team fouls: 1] No free throws, side out. (Draymond Banchero: 1 personal fouls)

[08:12] Team_030 possession (Score: 72-61)
Joel Anunoby attempts a Midrange. Contested by Bam Sexton (5.6 feet, ZONE). JOEL ANUNOBY MAKES IT!
Score: 74-61

[07:57] Team_061 possession (Score: 74-61)
Draymond Banchero drives, Jaren Green stays with him. Draymond Banchero attempts a Dunk. Heavily contested by Jaren Green (1.7 feet, ZONE)! DRAYMOND BANCHERO MAKES IT!
Score: 74-63

[07:43] Team_030 possession (Score: 74-63)
Tyler Beal attempts a 3Pt. Contested by Brandon Russell (2.4 feet, MAN). Tyler Beal misses. Rebound secured by Michael Russell.

[07:29] Team_061 possession (Score: 74-63)
Draymond Banchero drives, Jaren Green stays with him. Draymond Banchero attempts a Dunk. Contested by Jaren Green (3.6 feet, MAN). DRAYMOND BANCHERO MAKES IT!
Score: 74-65

[07:16] Team_030 possession (Score: 74-65)
Jaren Green drives to the basket... Jaren Green throws a bad pass! Stolen by Draymond Banchero! TURNOVER! (live ball)

[07:03] Team_061 possession (Score: 74-65)
Michael Russell attempts a 3Pt. Heavily contested by Joel Anunoby (1.8 feet, MAN)! Michael Russell misses. Rebound secured by Joel Anunoby.

[06:49] Team_030 possession (Score: 74-65)
Tim Barrett attempts a Midrange. Contested by Bam Sexton (2.4 feet, ZONE). TIM BARRETT MAKES IT!
Score: 76-65

[06:31] Team_061 possession (Score: 76-65)
Michael Russell attempts a 3Pt. Contested by Tyler Beal (3.2 feet, ZONE). Michael Russell misses. Rebound secured by Joel Anunoby.

[06:18] Team_030 possession (Score: 76-65)
Joel Anunoby attempts a Midrange. Contested by Michael Russell (4.6 feet, MAN). Joel Anunoby misses. Rebound secured by Bam Sexton.

[06:04] Team_061 possession (Score: 76-65)
Bam Sexton drives and kicks out. Draymond Banchero attempts a Midrange. Contested by Jaren Green (2.2 feet, MAN). Draymond Banchero misses. Offensive rebound by Michael Russell! Michael Russell puts it back in!
Score: 76-67

[05:51] Team_030 possession (Score: 76-67)
Jaren Green drives to the basket... FOUL! Offensive foul on Jaren Green! Draymond Banchero drew the charge! [Team fouls: 2] (Jaren Green: 2 personal fouls) TURNOVER! (dead ball)

[05:38] Team_061 possession (Score: 76-67)
Bam Sexton attempts a 3Pt. Contested by Jordan Nowitzki (4.5 feet, MAN). Bam Sexton misses. Rebound secured by Jaren Green.

[05:22] Team_030 possession (Score: 76-67)
Tyler Beal drives, Draymond Banchero stays with him. Tyler Beal attempts a Layup. Heavily contested by Draymond Banchero (0.5 feet, ZONE)! TYLER BEAL MAKES IT! Assist: Jaren Green
Score: 78-67

[05:07] Team_061 possession (Score: 78-67)
Bam Sexton makes the Layup and draws the foul on Jordan Nowitzki! And-1! Bam Sexton to the line for 1. [Team fouls: 3] (Jordan Nowitzki: 1 personal fouls)   FT 1/1: GOOD Bam Sexton makes 1/1 from the line.
Score: 78-70

[04:55] Team_030 possession (Score: 78-70)
Joel Anunoby attempts a Midrange. Contested by Draymond Banchero (5.3 feet, ZONE). JOEL ANUNOBY MAKES IT! Assist: Tim Barrett
Score: 80-70

[04:42] Team_061 possession (Score: 80-70)
Brandon Russell drives and kicks out. Draymond Banchero attempts a Midrange. Contested by Jordan Nowitzki (2.5 feet, ZONE). DRAYMOND BANCHERO MAKES IT!
Score: 80-72

[04:29] Team_030 possession (Score: 80-72)
Tim Barrett drives, Jayson Holiday stays with him. Tim Barrett attempts a Layup. Contested by Jayson Holiday (4.3 feet, MAN). Tim Barrett misses. Offensive rebound by Joel Anunoby! Joel Anunoby kicks it out.

[04:16] Team_030 possession (Score: 80-72)
Tyler Beal attempts a 3Pt. Contested by Brandon Russell (3.3 feet, MAN). Tyler Beal misses. Rebound secured by Draymond Banchero.

[04:07] Team_061 possession (Score: 80-72)
Michael Russell drives, Jaren Green stays with him. Michael Russell attempts a Dunk. Wide open! Jaren Green is 6.2 feet away. [ZONE] Michael Russell misses. Rebound secured by Jordan Nowitzki.

[03:52] Team_030 possession (Score: 80-72)
Tyler Beal attempts a 3Pt. Contested by Brandon Russell (3.3 feet, ZONE). Tyler Beal misses. Rebound secured by Bam Sexton.

[03:35] Team_061 possession (Score: 80-72)
Jayson Holiday drives and kicks out. Michael Russell attempts a 3Pt. Contested by Joel Anunoby (2.4 feet, MAN). Michael Russell misses. Offensive rebound by Michael Russell! Michael Russell's putback is no good. Offensive rebound by Michael Russell! Michael Russell kicks it out.

[03:18] Team_061 possession (Score: 80-72)
FOUL! Reach-in foul on Jaren Green during the drive. [Team fouls: 4] No free throws, side out. (Jaren Green: 3 personal fouls)

[03:01] Team_061 possession (Score: 80-72)
Jayson Holiday drives to the basket... FOUL! Offensive foul on Jayson Holiday! Tim Barrett drew the charge! [Team fouls: 2] (Jayson Holiday: 1 personal fouls) TURNOVER! (dead ball)

[02:47] Team_030 possession (Score: 80-72)
FOUL! Offensive foul on Tim Barrett! Jayson Holiday drew the charge! [Team fouls: 5] (Tim Barrett: 1 personal fouls) TURNOVER! (dead ball)

[02:37] Team_061 possession (Score: 80-72)
Michael Russell attempts a Layup. BLOCKED BY JORDAN NOWITZKI! Ball deflects out of bounds off Michael Russell.

[02:25] Team_030 possession (Score: 80-72)
Jordan Nowitzki attempts a Layup. Heavily contested by Draymond Banchero (0.5 feet, ZONE)! Jordan Nowitzki misses. Rebound secured by Michael Russell.

[02:09] Team_061 possession (Score: 80-72)
Draymond Banchero attempts a Midrange. Contested by Jaren Green (6.0 feet, MAN). DRAYMOND BANCHERO MAKES IT!
Score: 80-74

[01:50] Team_030 possession (Score: 80-74)
FOUL! Holding foul on Draymond Banchero. [Team fouls: 3] No free throws, side out. (Draymond Banchero: 2 personal fouls)

[01:39] Team_030 possession (Score: 80-74)
Jordan Nowitzki drives, Bam Sexton stays with him. Jordan Nowitzki attempts a Layup. Contested by Bam Sexton (4.6 feet, MAN). JORDAN NOWITZKI MAKES IT!
Score: 82-74

[01:27] Team_061 possession (Score: 82-74)
Jayson Holiday attempts a Layup. Contested by Tim Barrett (5.4 feet, MAN). Jayson Holiday misses. Offensive rebound by Michael Russell! Michael Russell's putback is no good. Offensive rebound by Michael Russell! Michael Russell kicks it out.

[01:13] Team_061 possession (Score: 82-74)
Bam Sexton attempts a Layup. Contested by Jordan Nowitzki (3.7 feet, MAN). BAM SEXTON MAKES IT! Assist: Michael Russell
Score: 82-76

[00:59] Team_030 possession (Score: 82-76)
Tyler Beal drives to the basket... Tyler Beal throws a bad pass! Stolen by Brandon Russell! TURNOVER! (live ball)

[00:49] Team_061 possession (Score: 82-76)
Brandon Russell drives and kicks out. Bam Sexton attempts a Midrange. Wide open! Jaren Green is 7.4 feet away. [ZONE] BAM SEXTON MAKES IT!
Score: 82-78

[00:38] Team_030 possession (Score: 82-78)
Tim Barrett drives, Jayson Holiday stays with him. Tim Barrett attempts a Layup. Wide open! Jayson Holiday is 6.3 feet away. [MAN] TIM BARRETT MAKES IT! Assist: Jaren Green
Score: 84-78

[00:24] Team_061 possession (Score: 84-78)
Bam Sexton attempts a Layup. Contested by Jaren Green (4.3 feet, ZONE). BAM SEXTON MAKES IT! Assist: Jayson Holiday
Score: 84-80

[00:10] Team_030 possession (Score: 84-80)
Tim Barrett drives, picks up Jayson Holiday. Help arrives from Michael Russell! Tim Barrett attempts a Layup. Contested by Michael Russell (5.3 feet, MAN). Tim Barrett misses. Rebound secured by Michael Russell.

================================================================================
                              3RD QUARTER COMPLETE                              
================================================================================

3RD QUARTER SCORE: Team_030 19, Team_061 26

BOX SCORE:
================================================================================

Team_030
--------------------------------------------------------------------------------
Player                MIN  PTS  REB  AST  TO      FG   FG%      3P   3P%
--------------------------------------------------------------------------------
Jordan Nowitzki        29    5    1    0   0   2/3    66.7     0/0   0.0
Jaren Green            29    4    2    3   0   2/3    66.7     0/0   0.0
Joel Anunoby           29    4    3    0   0   2/3    66.7     0/0   0.0
Tim Barrett            29    4    0    1   0   2/3    66.7     0/0   0.0
Tyler Beal             29    2    0    0   0   1/4    25.0     0/0   0.0

TEAM: FG: 9/16 (56.2%), 3PT: 0/4 (0.0%), REB: 6 (1 off, 5 def), AST: 4, TO: 7
TEAM FOULS: 5 [Team_061 in BONUS]


Team_061
--------------------------------------------------------------------------------
Player                MIN  PTS  REB  AST  TO      FG   FG%      3P   3P%
--------------------------------------------------------------------------------
Bam Sexton             29   12    2    0   0   5/7    71.4     0/0   0.0
Draymond Banchero      29   10    3    1   0   5/5   100.0     0/0   0.0
Jayson Holiday         29    2    0    1   0   1/1   100.0     0/0   0.0
Michael Russell        29    2    6    1   0   1/5    20.0     0/0   0.0
Brandon Russell        29    0    0    0   0   0/1     0.0     0/0   0.0

TEAM: FG: 12/19 (63.2%), 3PT: 2/5 (40.0%), REB: 11 (4 off, 7 def), AST: 3, TO: 3
TEAM FOULS: 3

================================================================================

================================================================================
                       4TH QUARTER - Team_030 vs Team_061                       
================================================================================

[12:00] Team_030 possession (Score: 84-80)
Joel Anunoby drives and kicks out. Tim Barrett attempts a 3Pt. Contested by Brandon Russell (4.8 feet, ZONE). Tim Barrett misses. Rebound secured by Michael Russell.

[11:46] Team_061 possession (Score: 84-80)
Jayson Holiday drives to the basket... Jayson Holiday throws a bad pass! Stolen by Tim Barrett! TURNOVER! (live ball)

[11:33] Team_030 possession (Score: 84-80)
Tyler Beal attempts a 3Pt. Contested by Brandon Russell (2.7 feet, MAN). TYLER BEAL MAKES IT! Assist: Jordan Nowitzki
Score: 87-80

[11:21] Team_061 possession (Score: 87-80)
Brandon Russell attempts a Midrange. Wide open! Tyler Beal is 9.0 feet away. [MAN] Brandon Russell misses. Rebound secured by Jaren Green.

[11:05] Team_030 possession (Score: 87-80)
Jordan Nowitzki attempts a Midrange. Contested by Bam Sexton (2.3 feet, ZONE). Jordan Nowitzki misses. Rebound secured by Bam Sexton.

[10:49] Team_061 possession (Score: 87-80)
Michael Russell attempts a Layup. BLOCKED BY JOEL ANUNOBY! Ball is loose! Rebound secured by Joel Anunoby.

[10:35] Team_030 possession (Score: 87-80)
FOUL! Shooting foul on Brandon Russell. Joel Anunoby to the line for 3 free throws. [Team fouls: 1] (Brandon Russell: 1 personal fouls)   FT 1/3: GOOD   FT 2/3: MISS   FT 3/3: GOOD Joel Anunoby makes 2/3 from the line.
Score: 89-80

[10:18] Team_061 possession (Score: 89-80)
Jayson Holiday attempts a 3Pt. Contested by Tim Barrett (2.3 feet, MAN). Jayson Holiday misses. Rebound secured by Joel Anunoby.

[09:58] Team_030 possession (Score: 89-80)
Tyler Beal attempts a Layup. Wide open! Brandon Russell is 6.1 feet away. [MAN] TYLER BEAL MAKES IT! Assist: Jordan Nowitzki
Score: 91-80

[09:43] Team_061 possession (Score: 91-80)
FOUL! Reach-in foul on Jaren Green during the drive. [Team fouls: 1] No free throws, side out. (Jaren Green: 1 personal fouls)

[09:31] Team_061 possession (Score: 91-80)
Brandon Russell drives to the basket... Brandon Russell throws a bad pass! Stolen by Jaren Green! TURNOVER! (live ball)

[09:22] Team_030 possession (Score: 91-80)
Joel Anunoby attempts a Layup. Contested by Michael Russell (3.5 feet, MAN). Joel Anunoby misses. Rebound secured by Bam Sexton.

[09:03] Team_061 possession (Score: 91-80)
Jayson Holiday throws a bad pass out of bounds! TURNOVER! (dead ball)

[09:03] Substitution (Team_030): Tyler Beal OUT → RJ Carter IN (stamina_rule2)

[09:03] Substitution (Team_030): Tim Barrett OUT → Josh Smith IN (stamina_rule2)

[09:03] Substitution (Team_030): Joel Anunoby OUT → Pau James IN (stamina_rule2)

[09:03] Substitution (Team_030): Jordan Nowitzki OUT → Damian Green IN (stamina_rule2)

[09:03] Substitution (Team_030): Jaren Green OUT → Franz Anunoby IN (stamina_rule2)

[09:03] Substitution (Team_061): Brandon Russell OUT → Evan Rose IN (stamina_rule2)

[09:03] Substitution (Team_061): Jayson Holiday OUT → Gary Fox IN (stamina_rule2)

[09:03] Substitution (Team_061): Michael Russell OUT → Desmond Morant IN (stamina_rule2)

[09:03] Substitution (Team_061): Bam Sexton OUT → Stephen Towns IN (stamina_rule2)

[09:03] Substitution (Team_061): Draymond Banchero OUT → Tim Durant IN (stamina_rule2)

[08:49] Team_030 possession (Score: 91-80)
Franz Anunoby makes the Layup and draws the foul on Tim Durant! And-1! Franz Anunoby to the line for 1. [Team fouls: 2] (Tim Durant: 1 personal fouls)   FT 1/1: GOOD Franz Anunoby makes 1/1 from the line.
Score: 94-80

[08:33] Team_061 possession (Score: 94-80)
Stephen Towns attempts a 3Pt. Contested by Damian Green (4.7 feet, MAN). STEPHEN TOWNS MAKES IT! Assist: Tim Durant
Score: 94-83

[08:15] Team_030 possession (Score: 94-83)
Josh Smith attempts a 3Pt. Contested by Gary Fox (6.0 feet, MAN). JOSH SMITH MAKES IT! Assist: Franz Anunoby
Score: 97-83

[08:04] Team_061 possession (Score: 97-83)
Tim Durant attempts a Layup. Wide open! Damian Green is 6.9 feet away. [ZONE] Tim Durant misses. Rebound secured by Damian Green.

[07:47] Team_030 possession (Score: 97-83)
Pau James attempts a Midrange. Contested by Gary Fox (4.8 feet, ZONE). PAU JAMES MAKES IT!
Score: 99-83

[07:35] Team_061 possession (Score: 99-83)
Gary Fox attempts a Midrange. Contested by Damian Green (2.5 feet, ZONE). GARY FOX MAKES IT! Assist: Stephen Towns
Score: 99-85

[07:21] Team_030 possession (Score: 99-85)
Pau James attempts a Midrange. Wide open! Stephen Towns is 6.7 feet away. [ZONE] Pau James misses. Rebound secured by Stephen Towns.

[07:06] Team_061 possession (Score: 99-85)
Desmond Morant attempts a Midrange. Contested by Pau James (5.4 feet, MAN). DESMOND MORANT MAKES IT! Assist: Stephen Towns
Score: 99-87

[06:54] Team_030 possession (Score: 99-87)
RJ Carter drives, Evan Rose stays with him. RJ Carter attempts a Layup. Contested by Evan Rose (2.6 feet, MAN). RJ CARTER MAKES IT!
Score: 101-87

[06:40] Team_061 possession (Score: 101-87)
Gary Fox attempts a Midrange. Wide open! Josh Smith is 7.6 feet away. [MAN] Gary Fox misses. Rebound secured by Damian Green.

[06:27] Team_030 possession (Score: 101-87)
RJ Carter makes the Layup and draws the foul on Tim Durant! And-1! RJ Carter to the line for 1. [Team fouls: 3] (Tim Durant: 2 personal fouls)   FT 1/1: MISS RJ Carter makes 0/1 from the line. Offensive rebound by Damian Green! Damian Green kicks it out.
Score: 103-87

[06:14] Team_030 possession (Score: 103-87)
FOUL! Reach-in foul on Tim Durant during the drive. [Team fouls: 4] No free throws, side out. (Tim Durant: 3 personal fouls)

[06:00] Team_030 possession (Score: 103-87)
Pau James attempts a 3Pt. Contested by Desmond Morant (4.2 feet, MAN). PAU JAMES MAKES IT! Assist: Damian Green
Score: 106-87

[05:41] Team_061 possession (Score: 106-87)
Evan Rose drives and kicks out. FOUL! Shooting foul on RJ Carter. Stephen Towns to the line for 3 free throws. [Team fouls: 2] (RJ Carter: 1 personal fouls)   FT 1/3: GOOD   FT 2/3: GOOD   FT 3/3: GOOD Stephen Towns makes 3/3 from the line.
Score: 106-90

[05:29] Team_030 possession (Score: 106-90)
RJ Carter attempts a Midrange. Contested by Evan Rose (4.3 feet, ZONE). RJ Carter misses. Rebound secured by Desmond Morant.

[05:17] Team_061 possession (Score: 106-90)
Gary Fox drives, picks up Josh Smith. Help arrives from Pau James! Gary Fox attempts a Dunk. Contested by Pau James (5.5 feet, MAN). Gary Fox misses. Rebound secured by Pau James.

[05:02] Team_030 possession (Score: 106-90)
Damian Green attempts a Layup. Contested by Tim Durant (2.7 feet, ZONE). DAMIAN GREEN MAKES IT! Assist: RJ Carter
Score: 108-90

[04:48] Team_061 possession (Score: 108-90)
Evan Rose commits a violation (traveling/carry)! TURNOVER! (dead ball)

[04:33] Team_030 possession (Score: 108-90)
Damian Green attempts a 3Pt. Wide open! Stephen Towns is 8.7 feet away. [MAN] Damian Green misses. Rebound secured by Tim Durant.

[04:21] Team_061 possession (Score: 108-90)
Tim Durant drives to the basket... Tim Durant loses control! Ball rolls out of bounds! TURNOVER! (dead ball)

[04:10] Team_030 possession (Score: 108-90)
FOUL! Reach-in foul on Tim Durant during the drive. [IN THE BONUS! 5 team fouls] Damian Green to the line for 2 free throws. (Tim Durant: 4 personal fouls)   FT 1/2: MISS   FT 2/2: GOOD Damian Green makes 1/2 from the line.
Score: 109-90

[03:58] Team_061 possession (Score: 109-90)
Tim Durant drives, Franz Anunoby stays with him. Tim Durant attempts a Dunk. Wide open! Franz Anunoby is 6.6 feet away. [MAN] TIM DURANT MAKES IT! Assist: Gary Fox
Score: 109-92

[03:41] Team_030 possession (Score: 109-92)
RJ Carter attempts a 3Pt. Contested by Desmond Morant (4.3 feet, ZONE). RJ CARTER MAKES IT! Assist: Damian Green
Score: 112-92

[03:27] Team_061 possession (Score: 112-92)
Stephen Towns attempts a 3Pt. Contested by RJ Carter (4.6 feet, ZONE). Stephen Towns misses. Offensive rebound by Stephen Towns! Stephen Towns kicks it out.

[03:12] Team_061 possession (Score: 112-92)
Gary Fox makes the Dunk and draws the foul on Pau James! And-1! Gary Fox to the line for 1. [Team fouls: 3] (Pau James: 1 personal fouls)   FT 1/1: GOOD Gary Fox makes 1/1 from the line.
Score: 112-95

[02:57] Team_030 possession (Score: 112-95)
Damian Green throws a bad pass! Stolen by Stephen Towns! TURNOVER! (live ball)

[02:42] Team_061 possession (Score: 112-95)
Gary Fox attempts a 3Pt. Contested by RJ Carter (3.7 feet, ZONE). Gary Fox misses. Rebound secured by Franz Anunoby.

[02:24] Team_030 possession (Score: 112-95)
Franz Anunoby drives to the basket... Franz Anunoby throws a bad pass! Stolen by Tim Durant! TURNOVER! (live ball)

[02:11] Team_061 possession (Score: 112-95)
Gary Fox drives and kicks out. Tim Durant attempts a Midrange. Contested by Franz Anunoby (2.6 feet, MAN). Tim Durant misses. Rebound secured by Pau James.

[01:57] Team_030 possession (Score: 112-95)
Pau James drives and kicks out. Pau James attempts a 3Pt. Heavily contested by Desmond Morant (2.0 feet, ZONE)! Pau James misses. Rebound secured by Desmond Morant.

[01:41] Team_061 possession (Score: 112-95)
Gary Fox drives to the basket... Gary Fox loses control! Ball rolls out of bounds! TURNOVER! (dead ball)

[01:29] Team_030 possession (Score: 112-95)
Franz Anunoby attempts a 3Pt. Contested by Desmond Morant (2.7 feet, ZONE). Franz Anunoby misses. Rebound secured by Stephen Towns.

[01:17] Team_061 possession (Score: 112-95)
Desmond Morant attempts a 3Pt. Wide open! RJ Carter is 7.2 feet away. [ZONE] Desmond Morant misses. Offensive rebound by Stephen Towns! Stephen Towns kicks it out.

[01:03] Team_061 possession (Score: 112-95)
Evan Rose throws a bad pass! Stolen by RJ Carter! TURNOVER! (live ball)

[00:49] Team_030 possession (Score: 112-95)
RJ Carter drives and kicks out. Josh Smith attempts a 3Pt. Wide open! Stephen Towns is 10.0 feet away. [ZONE] JOSH SMITH MAKES IT! Assist: Pau James
Score: 115-95

[00:34] Team_061 possession (Score: 115-95)
Gary Fox attempts a Layup. Wide open! Josh Smith is 7.8 feet away. [MAN] GARY FOX MAKES IT! Assist: Desmond Morant
Score: 115-97

[00:22] Team_030 possession (Score: 115-97)
FOUL! Offensive foul on Franz Anunoby! Tim Durant drew the charge! [Team fouls: 4] (Franz Anunoby: 1 personal fouls) TURNOVER! (dead ball)

[00:09] Team_061 possession (Score: 115-97)
Stephen Towns drives, Damian Green stays with him. Stephen Towns attempts a Dunk. Wide open! Damian Green is 8.1 feet away. [MAN] STEPHEN TOWNS MAKES IT! Assist: Desmond Morant
Score: 115-99

================================================================================
                              4TH QUARTER COMPLETE                              
================================================================================

4TH QUARTER SCORE: Team_030 31, Team_061 19

BOX SCORE:
================================================================================

Team_030
--------------------------------------------------------------------------------
Player                MIN  PTS  REB  AST  TO      FG   FG%      3P   3P%
--------------------------------------------------------------------------------
Josh Smith             16    6    0    0   0   2/2   100.0     0/0   0.0
Tyler Beal             33    5    0    0   0   2/2   100.0     0/0   0.0
Pau James              16    5    2    1   0   2/4    50.0     0/0   0.0
RJ Carter              16    5    0    1   0   2/3    66.7     0/0   0.0
Franz Anunoby          16    3    1    1   0   1/2    50.0     0/0   0.0
Damian Green           16    3    3    2   0   2/3    66.7     0/0   0.0
Joel Anunoby           33    2    2    0   0   1/3    33.3     0/0   0.0
Jordan Nowitzki        33    0    0    2   0   0/1     0.0     0/0   0.0
Jaren Green            33    0    1    0   0   0/0     0.0     0/0   0.0

TEAM: FG: 12/20 (60.0%), 3PT: 5/7 (71.4%), REB: 9 (1 off, 8 def), AST: 7, TO: 3
TEAM FOULS: 4


Team_061
--------------------------------------------------------------------------------
Player                MIN  PTS  REB  AST  TO      FG   FG%      3P   3P%
--------------------------------------------------------------------------------
Stephen Towns          16    8    4    2   0   3/3   100.0     0/0   0.0
Gary Fox               16    7    0    1   0   3/7    42.9     0/0   0.0
Tim Durant             16    2    1    1   0   1/2    50.0     0/0   0.0
Desmond Morant         16    2    2    2   0   1/1   100.0     0/0   0.0
Michael Russell        33    0    1    0   0   0/1     0.0     0/0   0.0
Brandon Russell        33    0    0    0   0   0/1     0.0     0/0   0.0
Bam Sexton             33    0    2    0   0   0/0     0.0     0/0   0.0
Jayson Holiday         33    0    0    0   0   0/1     0.0     0/0   0.0

TEAM: FG: 8/16 (50.0%), 3PT: 1/3 (33.3%), REB: 10 (2 off, 8 def), AST: 6, TO: 7
TEAM FOULS: 5 [Team_030 in BONUS]

================================================================================

================================================================================
                               FULL GAME COMPLETE                               
================================================================================

FINAL SCORE: Team_030 115, Team_061 99

SCORING BY QUARTER:
--------------------------------------------------------------------------------
Team                     Q1     Q2     Q3     Q4    FINAL
--------------------------------------------------------------------------------
Team_030                 34     31     19     31      115
Team_061                 33     21     26     19       99
--------------------------------------------------------------------------------

FULL GAME BOX SCORE:
================================================================================

Team_030
--------------------------------------------------------------------------------
Player                MIN  PTS  REB  AST  TO      FG   FG%      3P   3P%      FT STL BLK
--------------------------------------------------------------------------------
Tyler Beal             33   11    0    1   3   4/8    50.0   1/5    20.0   0/0     0   0
Tim Barrett            33   13    0    1   2   6/12   50.0   3/6    50.0   0/0     1   0
Joel Anunoby           33   18    9    1   1   8/15   53.3   3/4    75.0   7/8     1   1
Jordan Nowitzki        33   13    8    5   2   4/7    57.1   2/2   100.0   3/4     0   1
Jaren Green            33   11    7    5   1   6/12   50.0   0/3     0.0   1/2     5   1
RJ Carter              16   12    0    1   2   5/6    83.3   2/2   100.0   0/1     2   0
Josh Smith             16    9    0    2   0   2/2   100.0   2/2   100.0   0/0     0   0
Pau James              16   13    6    3   2   5/7    71.4   2/2   100.0   6/7     0   0
Damian Green           16    6    6    2   1   4/5    80.0   1/2    50.0   1/2     0   0
Franz Anunoby          16    3    4    2   1   1/2    50.0   0/1     0.0   1/1     0   0

TEAM: FG: 46/77 (59.7%), 3PT: 16/29 (55.2%), REB: 40 (9 off, 31 def), AST: 23, TO: 15


Team_061
--------------------------------------------------------------------------------
Player                MIN  PTS  REB  AST  TO      FG   FG%      3P   3P%      FT STL BLK
--------------------------------------------------------------------------------
Brandon Russell        33    4    0    2   2   4/10   40.0   0/3     0.0   0/0     1   0
Jayson Holiday         33   15    0    1   2   5/10   50.0   3/6    50.0   0/0     0   0
Michael Russell        33   12   12    4   1   3/9    33.3   2/5    40.0   0/0     0   0
Bam Sexton             33   14   11    2   1   8/11   72.7   3/5    60.0   1/1     1   0
Draymond Banchero      33   25    9    3   5   9/10   90.0   2/2   100.0   3/3     1   1
Evan Rose              16    0    0    1   4   1/1   100.0   0/0     0.0   0/0     1   0
Gary Fox               16    7    0    1   0   3/9    33.3   0/3     0.0   1/1     0   0
Desmond Morant         16    7    2    2   0   3/7    42.9   1/4    25.0   2/2     0   0
Stephen Towns          16   13    4    2   1   4/5    80.0   2/2   100.0   5/5     1   0
Tim Durant             16    2    1    2   0   1/2    50.0   0/0     0.0   0/0     2   1

TEAM: FG: 41/74 (55.4%), 3PT: 13/30 (43.3%), REB: 39 (8 off, 31 def), AST: 20, TO: 16

================================================================================
