================================================================================
                        FULL GAME - Team_020 vs Team_008                        
================================================================================

================================================================================
                       1ST QUARTER - Team_020 vs Team_008                       
================================================================================

[12:00] Team_020 possession (Score: 0-0)
Terry Simons makes the Layup and draws the foul on Khris Hyland! And-1! Terry Simons to the line for 1. [Team fouls: 1] (Khris Hyland: 1 personal fouls)   FT 1/1: GOOD Terry Simons makes 1/1 from the line.
Score: 3-0

[11:42] Team_008 possession (Score: 3-0)
Victor Leonard attempts a Layup. Heavily contested by Jarrett McCollum (1.0 feet, MAN)! Victor Leonard misses. Rebound secured by Bam Leonard.

[11:30] Team_020 possession (Score: 3-0)
Bam Leonard attempts a Midrange. Contested by Victor Leonard (4.4 feet, ZONE). Bam Leonard misses. Rebound secured by Tyrese Thompson.

[11:15] Team_008 possession (Score: 3-0)
FOUL! Holding foul on Bam Leonard. [Team fouls: 1] No free throws, side out. (Bam Leonard: 1 personal fouls)

[11:05] Team_008 possession (Score: 3-0)
Khris Hyland makes the Layup and draws the foul on Terry Simons! And-1! Khris Hyland to the line for 1. [Team fouls: 2] (Terry Simons: 1 personal fouls)   FT 1/1: GOOD Khris Hyland makes 1/1 from the line.
Score: 3-3

[10:47] Team_020 possession (Score: 3-3)
Terry Simons attempts a 3Pt. Contested by Victor Leonard (5.4 feet, ZONE). Terry Simons misses. Rebound secured by Khris Hyland.

[10:32] Team_008 possession (Score: 3-3)
Khris Hyland makes the Dunk and draws the foul on Trae Curry! And-1! Khris Hyland to the line for 1. [Team fouls: 3] (Trae Curry: 1 personal fouls)   FT 1/1: GOOD Khris Hyland makes 1/1 from the line.
Score: 3-6

[10:20] Team_020 possession (Score: 3-6)
James Cunningham drives, Jrue Harris stays with him. James Cunningham attempts a Dunk. Wide open! Jrue Harris is 6.3 feet away. [MAN] JAMES CUNNINGHAM MAKES IT! Assist: Bam Leonard
Score: 5-6

[10:07] Team_008 possession (Score: 5-6)
Tyrese Thompson attempts a Midrange. Heavily contested by Bam Leonard (0.5 feet, MAN)! TYRESE THOMPSON MAKES IT!
Score: 5-8

[09:54] Team_020 possession (Score: 5-8)
Trae Curry drives and kicks out. Terry Simons attempts a Midrange. Wide open! Khris Hyland is 7.9 feet away. [MAN] TERRY SIMONS MAKES IT!
Score: 7-8

[09:39] Team_008 possession (Score: 7-8)
Victor Leonard drives to the basket... Victor Leonard commits a violation (traveling/carry)! TURNOVER! (dead ball)

[09:27] Team_020 possession (Score: 7-8)
Trae Curry attempts a Midrange. Heavily contested by Magic Young (2.0 feet, MAN)! Trae Curry misses. Rebound secured by Tyrese Thompson.

[09:10] Team_008 possession (Score: 7-8)
Khris Hyland attempts a 3Pt. Heavily contested by Bam Leonard (1.5 feet, ZONE)! Khris Hyland misses. Rebound secured by Terry Simons.

[08:57] Team_020 possession (Score: 7-8)
Bam Leonard drives, Tyrese Thompson stays with him. Bam Leonard attempts a Layup. Contested by Tyrese Thompson (5.3 feet, MAN). Bam Leonard misses. Rebound secured by Tyrese Thompson.

[08:43] Team_008 possession (Score: 7-8)
FOUL! Shooting foul on Bam Leonard. Magic Young to the line for 2 free throws. [Team fouls: 4] (Bam Leonard: 2 personal fouls)   FT 1/2: MISS   FT 2/2: MISS Magic Young makes 0/2 from the line. Rebound secured by Terry Simons.

[08:32] Team_020 possession (Score: 7-8)
Trae Curry drives and kicks out. Bam Leonard attempts a 3Pt. Contested by Tyrese Thompson (4.6 feet, ZONE). BAM LEONARD MAKES IT! Assist: James Cunningham
Score: 10-8

[08:15] Team_008 possession (Score: 10-8)
Victor Leonard drives to the basket... Victor Leonard loses the ball! Stripped by Trae Curry! TURNOVER! (live ball)

[08:00] Team_020 possession (Score: 10-8)
James Cunningham attempts a 3Pt. Contested by Jrue Harris (5.3 feet, MAN). JAMES CUNNINGHAM MAKES IT! Assist: Bam Leonard
Score: 13-8

[07:41] Team_008 possession (Score: 13-8)
Jrue Harris attempts a 3Pt. Contested by James Cunningham (5.7 feet, MAN). JRUE HARRIS MAKES IT! Assist: Victor Leonard
Score: 13-11

[07:27] Team_020 possession (Score: 13-11)
Trae Curry attempts a Layup. Contested by Tyrese Thompson (3.9 feet, ZONE). TRAE CURRY MAKES IT! Assist: Jarrett McCollum
Score: 15-11

[07:15] Team_008 possession (Score: 15-11)
Jrue Harris attempts a 3Pt. Contested by James Cunningham (2.4 feet, MAN). Jrue Harris misses. Offensive rebound by Tyrese Thompson! Tyrese Thompson kicks it out.

[07:04] Team_008 possession (Score: 15-11)
Jrue Harris drives and kicks out. Jrue Harris attempts a Midrange. Contested by Terry Simons (4.5 feet, ZONE). Jrue Harris misses. FOUL! Loose ball foul on Trae Curry during the rebound battle. [IN THE BONUS! 5 team fouls] Tyrese Thompson to the line for 2 free throws. (Trae Curry: 2 personal fouls)   FT 1/2: MISS   FT 2/2: MISS Tyrese Thompson makes 0/2 from the line. Offensive rebound by Tyrese Thompson! Tyrese Thompson kicks it out.

[06:48] Team_008 possession (Score: 15-11)
Magic Young attempts a 3Pt. Heavily contested by Bam Leonard (0.5 feet, MAN)! Magic Young misses. Rebound secured by Bam Leonard.

[06:32] Team_020 possession (Score: 15-11)
Terry Simons attempts a Midrange. Contested by Khris Hyland (5.1 feet, MAN). TERRY SIMONS MAKES IT! Assist: Jarrett McCollum
Score: 17-11

[06:16] Team_008 possession (Score: 17-11)
Khris Hyland drives to the basket... Khris Hyland loses the ball! Stripped by Terry Simons! TURNOVER! (live ball)

[06:04] Team_020 possession (Score: 17-11)
FOUL! Shooting foul on Tyrese Thompson. James Cunningham to the line for 2 free throws. [Team fouls: 2] (Tyrese Thompson: 1 personal fouls)   FT 1/2: GOOD   FT 2/2: MISS James Cunningham makes 1/2 from the line. Rebound secured by Tyrese Thompson.
Score: 18-11

[05:49] Team_008 possession (Score: 18-11)
Victor Leonard drives to the basket... Victor Leonard throws a bad pass out of bounds! TURNOVER! (dead ball)

[05:37] Team_020 possession (Score: 18-11)
Bam Leonard throws a bad pass! Stolen by Tyrese Thompson! TURNOVER! (live ball)

[05:18] Team_008 possession (Score: 18-11)
Victor Leonard attempts a Layup. BLOCKED BY JARRETT MCCOLLUM! Ball is loose! Offensive rebound by Magic Young! Magic Young kicks it out.

[05:04] Team_008 possession (Score: 18-11)
Victor Leonard attempts a Midrange. Heavily contested by Bam Leonard (1.5 feet, ZONE)! Victor Leonard misses. Rebound secured by Trae Curry.

[04:47] Team_020 possession (Score: 18-11)
Jarrett McCollum attempts a Layup. Wide open! Victor Leonard is 7.1 feet away. [MAN] JARRETT MCCOLLUM MAKES IT! Assist: Trae Curry
Score: 20-11

[04:31] Team_008 possession (Score: 20-11)
Tyrese Thompson attempts a 3Pt. Contested by Bam Leonard (2.6 feet, ZONE). Tyrese Thompson misses. Rebound secured by Terry Simons.

[04:17] Team_020 possession (Score: 20-11)
Terry Simons attempts a 3Pt. Contested by Victor Leonard (3.7 feet, ZONE). TERRY SIMONS MAKES IT!
Score: 23-11

[04:05] Team_008 possession (Score: 23-11)
Victor Leonard throws a bad pass out of bounds! TURNOVER! (dead ball)

[03:50] Team_020 possession (Score: 23-11)
Bam Leonard drives, Tyrese Thompson stays with him. Bam Leonard attempts a Layup. Heavily contested by Tyrese Thompson (1.8 feet, ZONE)! Bam Leonard misses. Rebound secured by Khris Hyland.

[03:37] Team_008 possession (Score: 23-11)
Tyrese Thompson drives to the basket... FOUL! Offensive foul on Tyrese Thompson! Bam Leonard drew the charge! [Team fouls: 3] (Tyrese Thompson: 2 personal fouls) TURNOVER! (dead ball)

[03:19] Team_020 possession (Score: 23-11)
Trae Curry drives, Tyrese Thompson stays with him. Trae Curry attempts a Layup. Contested by Tyrese Thompson (4.3 feet, ZONE). Trae Curry misses. Rebound secured by Magic Young.

[03:03] Team_008 possession (Score: 23-11)
Victor Leonard attempts a 3Pt. Contested by Bam Leonard (2.0 feet, ZONE). Victor Leonard misses. Rebound secured by Bam Leonard.

[02:48] Team_020 possession (Score: 23-11)
Trae Curry makes the Dunk and draws the foul on Tyrese Thompson! And-1! Trae Curry to the line for 1. [Team fouls: 4] (Tyrese Thompson: 3 personal fouls)   FT 1/1: GOOD Trae Curry makes 1/1 from the line.
Score: 26-11

[02:32] Team_008 possession (Score: 26-11)
Khris Hyland drives and kicks out. Victor Leonard attempts a 3Pt. Heavily contested by Bam Leonard (0.5 feet, ZONE)! Victor Leonard misses. Rebound secured by Bam Leonard.

[02:22] Team_020 possession (Score: 26-11)
FOUL! Shooting foul on Khris Hyland. Terry Simons to the line for 2 free throws. [BONUS: 5 team fouls] (Khris Hyland: 2 personal fouls)   FT 1/2: GOOD   FT 2/2: GOOD Terry Simons makes 2/2 from the line.
Score: 28-11

[02:11] Team_008 possession (Score: 28-11)
Tyrese Thompson attempts a Midrange. Wide open! Bam Leonard is 6.6 feet away. [MAN] TYRESE THOMPSON MAKES IT!
Score: 28-13

[01:55] Team_020 possession (Score: 28-13)
Bam Leonard drives, Tyrese Thompson stays with him. Bam Leonard attempts a Layup. Contested by Tyrese Thompson (3.4 feet, ZONE). BAM LEONARD MAKES IT!
Score: 30-13

[01:37] Team_008 possession (Score: 30-13)
Jrue Harris attempts a 3Pt. Contested by James Cunningham (3.2 feet, MAN). Jrue Harris misses. Rebound secured by Bam Leonard.

[01:22] Team_020 possession (Score: 30-13)
Bam Leonard drives and kicks out. Trae Curry attempts a Midrange. Contested by Khris Hyland (2.4 feet, ZONE). Trae Curry misses. Rebound secured by Khris Hyland.

[01:10] Team_008 possession (Score: 30-13)
FOUL! Offensive foul on Tyrese Thompson! Bam Leonard drew the charge! [Team fouls: 6] (Tyrese Thompson: 4 personal fouls) TURNOVER! (dead ball)

[00:57] Team_020 possession (Score: 30-13)
Terry Simons attempts a 3Pt. Wide open! Victor Leonard is 7.5 feet away. [ZONE] Terry Simons misses. Rebound secured by Tyrese Thompson.

[00:44] Team_008 possession (Score: 30-13)
Tyrese Thompson attempts a 3Pt. Wide open! Bam Leonard is 6.3 feet away. [MAN] Tyrese Thompson misses. Rebound secured by Bam Leonard.

[00:29] Team_020 possession (Score: 30-13)
Bam Leonard drives, Tyrese Thompson stays with him. Bam Leonard attempts a Dunk. Wide open! Tyrese Thompson is 8.1 feet away. [ZONE] Bam Leonard misses. Rebound secured by Tyrese Thompson.

[00:18] Team_008 possession (Score: 30-13)
Khris Hyland drives, Terry Simons stays with him. Khris Hyland attempts a Dunk. Wide open! Terry Simons is 6.3 feet away. [MAN] Khris Hyland misses. Offensive rebound by Magic Young! Magic Young kicks it out.

[00:04] Team_008 possession (Score: 30-13)
Tyrese Thompson attempts a Midrange. Heavily contested by Bam Leonard (1.7 feet, MAN)! TYRESE THOMPSON MAKES IT!
Score: 30-15

================================================================================
                              1ST QUARTER COMPLETE                              
================================================================================

1ST QUARTER SCORE: Team_020 30, Team_008 15

BOX SCORE:
================================================================================

Team_020
--------------------------------------------------------------------------------
Player                MIN  PTS  REB  AST  TO      FG   FG%      3P   3P%
--------------------------------------------------------------------------------
Terry Simons           12   12    3    0   0   5/7    71.4     0/0   0.0
Bam Leonard            12    5    6    2   0   2/7    28.6     0/0   0.0
James Cunningham       12    5    0    1   0   2/3    66.7     0/0   0.0
Trae Curry             12    5    1    1   0   2/4    50.0     0/0   0.0
Jarrett McCollum       12    2    0    2   0   1/1   100.0     0/0   0.0

TEAM: FG: 12/22 (54.5%), 3PT: 2/4 (50.0%), REB: 10 (0 off, 10 def), AST: 6, TO: 1
TEAM FOULS: 5 [Team_008 in BONUS]


Team_008
--------------------------------------------------------------------------------
Player                MIN  PTS  REB  AST  TO      FG   FG%      3P   3P%
--------------------------------------------------------------------------------
Tyrese Thompson        12    6    8    0   0   3/5    60.0     0/0   0.0
Khris Hyland           12    6    3    0   0   2/4    50.0     0/0   0.0
Jrue Harris            12    3    0    0   0   1/2    50.0     0/0   0.0
Victor Leonard         12    0    0    1   0   0/3     0.0     0/0   0.0
Magic Young            12    0    3    0   0   0/2     0.0     0/0   0.0

TEAM: FG: 6/16 (37.5%), 3PT: 1/7 (14.3%), REB: 14 (4 off, 10 def), AST: 1, TO: 7
TEAM FOULS: 6 [Team_020 in BONUS]

================================================================================

================================================================================
                       2ND QUARTER - Team_020 vs Team_008                       
================================================================================

[12:00] Team_020 possession (Score: 30-15)
James Cunningham attempts a Midrange. Contested by Jrue Harris (3.7 feet, MAN). James Cunningham misses. Rebound secured by Magic Young.

[11:47] Team_008 possession (Score: 30-15)
Khris Hyland attempts a Midrange. Contested by Terry Simons (4.0 feet, MAN). KHRIS HYLAND MAKES IT!
Score: 30-17

[11:35] Team_020 possession (Score: 30-17)
Terry Simons attempts a 3Pt. Contested by Victor Leonard (4.6 feet, ZONE). Terry Simons misses. Offensive rebound by Trae Curry! Trae Curry's putback is no good. Rebound secured by Magic Young.

[11:23] Team_008 possession (Score: 30-17)
Magic Young attempts a Midrange. Contested by Bam Leonard (2.9 feet, MAN). Magic Young misses. Rebound secured by Bam Leonard.

[11:07] Team_020 possession (Score: 30-17)
Terry Simons attempts a 3Pt. Wide open! Khris Hyland is 6.6 feet away. [MAN] TERRY SIMONS MAKES IT! Assist: Bam Leonard
Score: 33-17

[10:54] Team_008 possession (Score: 33-17)
Jrue Harris attempts a 3Pt. Contested by Bam Leonard (2.8 feet, ZONE). Jrue Harris misses. Offensive rebound by Tyrese Thompson! Tyrese Thompson kicks it out.

[10:39] Team_008 possession (Score: 33-17)
Khris Hyland attempts a 3Pt. Contested by Terry Simons (4.0 feet, ZONE). Khris Hyland misses. Rebound secured by Trae Curry.

[10:20] Team_020 possession (Score: 33-17)
Bam Leonard makes the Layup and draws the foul on Jrue Harris! And-1! Bam Leonard to the line for 1. [Team fouls: 1] (Jrue Harris: 1 personal fouls)   FT 1/1: GOOD Bam Leonard makes 1/1 from the line.
Score: 36-17

[10:03] Team_008 possession (Score: 36-17)
Jrue Harris drives to the basket... FOUL! Offensive foul on Jrue Harris! James Cunningham drew the charge! [Team fouls: 2] (Jrue Harris: 2 personal fouls) TURNOVER! (dead ball)

[09:51] Team_020 possession (Score: 36-17)
Bam Leonard attempts a Midrange. Wide open! Tyrese Thompson is 6.8 feet away. [MAN] Bam Leonard misses. Rebound secured by Khris Hyland.

[09:36] Team_008 possession (Score: 36-17)
Khris Hyland attempts a 3Pt. Contested by Terry Simons (2.3 feet, MAN). Khris Hyland misses. Rebound secured by Trae Curry.

[09:22] Team_020 possession (Score: 36-17)
James Cunningham attempts a Midrange. Contested by Khris Hyland (3.2 feet, ZONE). James Cunningham misses. Rebound secured by Khris Hyland.

[09:09] Team_008 possession (Score: 36-17)
Victor Leonard makes the Dunk and draws the foul on Trae Curry! And-1! Victor Leonard to the line for 1. [Team fouls: 1] (Trae Curry: 1 personal fouls)   FT 1/1: GOOD Victor Leonard makes 1/1 from the line.
Score: 36-20

[08:54] Team_020 possession (Score: 36-20)
Bam Leonard attempts a 3Pt. Heavily contested by Jrue Harris (1.7 feet, ZONE)! Bam Leonard misses. Offensive rebound by Bam Leonard! Bam Leonard's putback is no good. Offensive rebound by Bam Leonard! Bam Leonard kicks it out.

[08:36] Team_020 possession (Score: 36-20)
Jarrett McCollum attempts a 3Pt. Contested by Victor Leonard (4.3 feet, ZONE). Jarrett McCollum misses. Rebound secured by Tyrese Thompson.

[08:22] Team_008 possession (Score: 36-20)
Victor Leonard attempts a 3Pt. Contested by Jarrett McCollum (5.6 feet, MAN). Victor Leonard misses. Rebound secured by Trae Curry.

[08:10] Team_020 possession (Score: 36-20)
Bam Leonard throws a bad pass out of bounds! TURNOVER! (dead ball)

[08:10] Substitution (Team_020): Jarrett McCollum OUT → Franz Doncic IN (stamina_rule2)

[08:10] Substitution (Team_020): James Cunningham OUT → Stephen Parker IN (stamina_rule2)

[08:10] Substitution (Team_020): Terry Simons OUT → Victor Holiday IN (stamina_rule2)

[08:10] Substitution (Team_020): Bam Leonard OUT → Cole Barnes IN (stamina_rule2)

[08:10] Substitution (Team_020): Trae Curry OUT → Miles Siakam IN (stamina_rule2)

[08:10] Substitution (Team_008): Victor Leonard OUT → Blake Holiday IN (stamina_rule2)

[08:10] Substitution (Team_008): Jrue Harris OUT → Chris Griffin IN (stamina_rule2)

[08:10] Substitution (Team_008): Khris Hyland OUT → Immanuel Young IN (stamina_rule2)

[08:10] Substitution (Team_008): Tyrese Thompson OUT → Khris Giddey IN (stamina_rule2)

[08:10] Substitution (Team_008): Magic Young OUT → Lamelo Middleton IN (stamina_rule2)

[07:54] Team_008 possession (Score: 36-20)
Khris Giddey attempts a Midrange. Contested by Cole Barnes (4.3 feet, MAN). Khris Giddey misses. FOUL! Loose ball foul on Victor Holiday during the rebound battle. [Team fouls: 2] No free throws, side out. (Victor Holiday: 1 personal fouls)

[07:38] Team_008 possession (Score: 36-20)
Khris Giddey drives and kicks out. Lamelo Middleton attempts a 3Pt. Contested by Miles Siakam (4.3 feet, MAN). Lamelo Middleton misses. Offensive rebound by Khris Giddey! Khris Giddey kicks it out.

[07:22] Team_008 possession (Score: 36-20)
Immanuel Young attempts a 3Pt. Contested by Victor Holiday (3.1 feet, MAN). Immanuel Young misses. Rebound secured by Miles Siakam.

[07:04] Team_020 possession (Score: 36-20)
Miles Siakam drives and kicks out. Miles Siakam attempts a 3Pt. Contested by Khris Giddey (2.4 feet, ZONE). Miles Siakam misses. Rebound secured by Chris Griffin.

[06:49] Team_008 possession (Score: 36-20)
Chris Griffin attempts a 3Pt. Contested by Stephen Parker (4.1 feet, ZONE). Chris Griffin misses. Rebound secured by Victor Holiday.

[06:36] Team_020 possession (Score: 36-20)
Stephen Parker commits a violation (traveling/carry)! TURNOVER! (dead ball)

[06:21] Team_008 possession (Score: 36-20)
Lamelo Middleton drives and kicks out. Khris Giddey attempts a Midrange. Contested by Victor Holiday (3.3 feet, ZONE). Khris Giddey misses. Rebound secured by Victor Holiday.

[06:06] Team_020 possession (Score: 36-20)
Victor Holiday attempts a Midrange. Contested by Immanuel Young (4.4 feet, MAN). Victor Holiday misses. Rebound secured by Lamelo Middleton.

[05:51] Team_008 possession (Score: 36-20)
Chris Griffin throws a bad pass out of bounds! TURNOVER! (dead ball)

[05:40] Team_020 possession (Score: 36-20)
Stephen Parker drives, picks up Chris Griffin. Help arrives from Immanuel Young! Stephen Parker attempts a Dunk. Wide open! Immanuel Young is 6.2 feet away. [MAN] STEPHEN PARKER MAKES IT!
Score: 38-20

[05:26] Team_008 possession (Score: 38-20)
Khris Giddey drives, picks up Miles Siakam. Help arrives from Franz Doncic! Khris Giddey attempts a Dunk. Contested by Franz Doncic (4.5 feet, ZONE). Khris Giddey misses. Rebound secured by Victor Holiday.

[05:11] Team_020 possession (Score: 38-20)
Victor Holiday drives, Immanuel Young stays with him. Victor Holiday attempts a Dunk. Contested by Immanuel Young (3.4 feet, MAN). VICTOR HOLIDAY MAKES IT! Assist: Franz Doncic
Score: 40-20

[04:59] Team_008 possession (Score: 40-20)
FOUL! Shooting foul on Franz Doncic. Blake Holiday to the line for 3 free throws. [Team fouls: 3] (Franz Doncic: 1 personal fouls)   FT 1/3: GOOD   FT 2/3: MISS   FT 3/3: GOOD Blake Holiday makes 2/3 from the line.
Score: 40-22

[04:44] Team_020 possession (Score: 40-22)
FOUL! Holding foul on Khris Giddey. [Team fouls: 3] No free throws, side out. (Khris Giddey: 1 personal fouls)

[04:30] Team_020 possession (Score: 40-22)
FOUL! Holding foul on Khris Giddey. [Team fouls: 4] No free throws, side out. (Khris Giddey: 2 personal fouls)

[04:16] Team_020 possession (Score: 40-22)
Miles Siakam drives, Lamelo Middleton stays with him. Miles Siakam attempts a Layup. Contested by Lamelo Middleton (2.3 feet, MAN). Miles Siakam misses. Rebound secured by Chris Griffin.

[04:02] Team_008 possession (Score: 40-22)
Blake Holiday drives and kicks out. Chris Griffin attempts a Midrange. Wide open! Victor Holiday is 8.3 feet away. [ZONE] CHRIS GRIFFIN MAKES IT!
Score: 40-24

[03:46] Team_020 possession (Score: 40-24)
Miles Siakam attempts a Midrange. Contested by Lamelo Middleton (3.7 feet, MAN). MILES SIAKAM MAKES IT! Assist: Victor Holiday
Score: 42-24

[03:37] Team_008 possession (Score: 42-24)
Immanuel Young drives, Victor Holiday stays with him. Immanuel Young attempts a Layup. Contested by Victor Holiday (3.8 feet, MAN). Immanuel Young misses. Rebound secured by Miles Siakam.

[03:22] Team_020 possession (Score: 42-24)
Cole Barnes attempts a 3Pt. Heavily contested by Khris Giddey (0.5 feet, MAN)! Cole Barnes misses. FOUL! Loose ball foul on Chris Griffin during the rebound battle. [IN THE BONUS! 5 team fouls] Miles Siakam to the line for 2 free throws. (Chris Griffin: 1 personal fouls)   FT 1/2: GOOD   FT 2/2: GOOD Miles Siakam makes 2/2 from the line.
Score: 44-24

[03:08] Team_008 possession (Score: 44-24)
Lamelo Middleton attempts a 3Pt. Heavily contested by Stephen Parker (1.8 feet, ZONE)! Lamelo Middleton misses. Rebound secured by Miles Siakam.

[02:53] Team_020 possession (Score: 44-24)
Victor Holiday attempts a Midrange. Wide open! Immanuel Young is 6.8 feet away. [MAN] Victor Holiday misses. Offensive rebound by Miles Siakam! Miles Siakam kicks it out.

[02:35] Team_020 possession (Score: 44-24)
Miles Siakam makes the Layup and draws the foul on Lamelo Middleton! And-1! Miles Siakam to the line for 1. [BONUS: 6 team fouls] (Lamelo Middleton: 1 personal fouls)   FT 1/1: GOOD Miles Siakam makes 1/1 from the line.
Score: 47-24

[02:19] Team_008 possession (Score: 47-24)
Lamelo Middleton attempts a 3Pt. Wide open! Stephen Parker is 8.8 feet away. [ZONE] Lamelo Middleton misses. FOUL! Loose ball foul on Miles Siakam during the rebound battle. [Team fouls: 4] No free throws, side out. (Miles Siakam: 1 personal fouls)

[02:04] Team_008 possession (Score: 47-24)
Khris Giddey makes the Dunk and draws the foul on Franz Doncic! And-1! Khris Giddey to the line for 1. [BONUS: 5 team fouls] (Franz Doncic: 2 personal fouls)   FT 1/1: GOOD Khris Giddey makes 1/1 from the line.
Score: 47-27

[01:46] Team_020 possession (Score: 47-27)
Stephen Parker attempts a 3Pt. Contested by Chris Griffin (3.9 feet, MAN). Stephen Parker misses. Rebound secured by Lamelo Middleton.

[01:34] Team_008 possession (Score: 47-27)
Khris Giddey drives, Miles Siakam stays with him. Khris Giddey attempts a Layup. Contested by Miles Siakam (5.4 feet, ZONE). KHRIS GIDDEY MAKES IT!
Score: 47-29

[01:16] Team_020 possession (Score: 47-29)
Franz Doncic attempts a Midrange. Contested by Khris Giddey (4.7 feet, ZONE). Franz Doncic misses. Rebound secured by Khris Giddey.

[01:03] Team_008 possession (Score: 47-29)
Chris Griffin attempts a 3Pt. Contested by Stephen Parker (4.1 feet, MAN). CHRIS GRIFFIN MAKES IT! Assist: Lamelo Middleton
Score: 47-32

[00:49] Team_020 possession (Score: 47-32)
Franz Doncic drives, Lamelo Middleton stays with him. Franz Doncic attempts a Layup. Contested by Lamelo Middleton (2.7 feet, ZONE). FRANZ DONCIC MAKES IT! Assist: Victor Holiday
Score: 49-32

[00:38] Team_008 possession (Score: 49-32)
Chris Griffin attempts a 3Pt. Heavily contested by Victor Holiday (0.8 feet, ZONE)! Chris Griffin misses. Offensive rebound by Khris Giddey! Khris Giddey kicks it out.

[00:24] Team_008 possession (Score: 49-32)
Lamelo Middleton drives, Miles Siakam stays with him. Lamelo Middleton attempts a Dunk. Contested by Miles Siakam (4.0 feet, MAN). Lamelo Middleton misses. Rebound secured by Miles Siakam.

[00:09] Team_020 possession (Score: 49-32)
FOUL! Reach-in foul on Immanuel Young during the drive. [IN THE BONUS! 7 team fouls] Victor Holiday to the line for 2 free throws. (Immanuel Young: 1 personal fouls)   FT 1/2: GOOD   FT 2/2: GOOD Victor Holiday makes 2/2 from the line.
Score: 51-32

================================================================================
                              2ND QUARTER COMPLETE                              
================================================================================

2ND QUARTER SCORE: Team_020 21, Team_008 17

BOX SCORE:
================================================================================

Team_020
--------------------------------------------------------------------------------
Player                MIN  PTS  REB  AST  TO      FG   FG%      3P   3P%
--------------------------------------------------------------------------------
Miles Siakam            8    7    5    0   0   3/5    60.0     0/0   0.0
Victor Holiday          8    4    3    2   0   2/3    66.7     0/0   0.0
Terry Simons           16    3    0    0   0   1/2    50.0     0/0   0.0
Bam Leonard            16    3    2    1   0   1/2    50.0     0/0   0.0
Stephen Parker          8    2    0    0   0   1/2    50.0     0/0   0.0
Franz Doncic            8    2    0    1   0   1/2    50.0     0/0   0.0
James Cunningham       16    0    0    0   0   0/2     0.0     0/0   0.0
Trae Curry             16    0    3    0   0   0/0     0.0     0/0   0.0
Jarrett McCollum       16    0    0    0   0   0/1     0.0     0/0   0.0

TEAM: FG: 9/19 (47.4%), 3PT: 2/5 (40.0%), REB: 14 (3 off, 11 def), AST: 4, TO: 2
TEAM FOULS: 5 [Team_008 in BONUS]


Team_008
--------------------------------------------------------------------------------
Player                MIN  PTS  REB  AST  TO      FG   FG%      3P   3P%
--------------------------------------------------------------------------------
Khris Giddey            8    5    4    0   0   2/3    66.7     0/0   0.0
Chris Griffin           8    5    2    0   0   2/3    66.7     0/0   0.0
Victor Leonard         16    3    0    0   0   1/2    50.0     0/0   0.0
Khris Hyland           16    2    2    0   0   1/3    33.3     0/0   0.0
Blake Holiday           8    2    0    0   0   1/1   100.0     0/0   0.0
Magic Young            16    0    2    0   0   0/1     0.0     0/0   0.0
Tyrese Thompson        16    0    2    0   0   0/0     0.0     0/0   0.0
Immanuel Young          8    0    0    0   0   0/2     0.0     0/0   0.0
Lamelo Middleton        8    0    3    1   0   0/3     0.0     0/0   0.0

TEAM: FG: 7/18 (38.9%), 3PT: 2/8 (25.0%), REB: 14 (5 off, 9 def), AST: 1, TO: 2
TEAM FOULS: 7 [Team_020 in BONUS]

================================================================================

================================================================================
                       3RD QUARTER - Team_020 vs Team_008                       
================================================================================

[12:00] Team_020 possession (Score: 51-32)
Bam Leonard drives to the basket... Bam Leonard commits a violation (traveling/carry)! TURNOVER! (dead ball)

[11:43] Team_008 possession (Score: 51-32)
Magic Young attempts a Midrange. Wide open! James Cunningham is 6.3 feet away. [ZONE] MAGIC YOUNG MAKES IT! Assist: Khris Hyland
Score: 51-34

[11:30] Team_020 possession (Score: 51-34)
Bam Leonard throws a bad pass! Stolen by Tyrese Thompson! TURNOVER! (live ball)

[11:16] Team_008 possession (Score: 51-34)
FOUL! Reach-in foul on Trae Curry during the drive. [Team fouls: 1] No free throws, side out. (Trae Curry: 1 personal fouls)

[11:05] Team_008 possession (Score: 51-34)
Jrue Harris attempts a Midrange. Wide open! James Cunningham is 8.3 feet away. [ZONE] JRUE HARRIS MAKES IT!
Score: 51-36

[10:51] Team_020 possession (Score: 51-36)
Trae Curry attempts a Layup. Wide open! Tyrese Thompson is 7.2 feet away. [ZONE] TRAE CURRY MAKES IT!
Score: 53-36

[10:39] Team_008 possession (Score: 53-36)
Magic Young drives and kicks out. Jrue Harris attempts a Midrange. Heavily contested by Bam Leonard (0.5 feet, ZONE)! Jrue Harris misses. Offensive rebound by Magic Young! Magic Young's putback is no good. Rebound secured by Bam Leonard.

[10:20] Team_020 possession (Score: 53-36)
Jarrett McCollum attempts a 3Pt. Wide open! Victor Leonard is 6.8 feet away. [MAN] JARRETT MCCOLLUM MAKES IT! Assist: James Cunningham
Score: 56-36

[10:04] Team_008 possession (Score: 56-36)
Victor Leonard attempts a 3Pt. Contested by Bam Leonard (3.1 feet, ZONE). Victor Leonard misses. Rebound secured by Trae Curry.

[09:48] Team_020 possession (Score: 56-36)
Trae Curry attempts a Layup. Contested by Tyrese Thompson (6.0 feet, ZONE). TRAE CURRY MAKES IT!
Score: 58-36

[09:35] Team_008 possession (Score: 58-36)
Magic Young attempts a Layup. BLOCKED BY BAM LEONARD! Ball is loose! Rebound secured by Trae Curry.

[09:20] Team_020 possession (Score: 58-36)
Terry Simons makes the Dunk and draws the foul on Khris Hyland! And-1! Terry Simons to the line for 1. [Team fouls: 1] (Khris Hyland: 1 personal fouls)   FT 1/1: GOOD Terry Simons makes 1/1 from the line.
Score: 61-36

[09:05] Team_008 possession (Score: 61-36)
FOUL! Shooting foul on Bam Leonard. Magic Young to the line for 2 free throws. [Team fouls: 2] (Bam Leonard: 1 personal fouls)   FT 1/2: GOOD   FT 2/2: GOOD Magic Young makes 2/2 from the line.
Score: 61-38

[08:51] Team_020 possession (Score: 61-38)
James Cunningham drives and kicks out. James Cunningham attempts a Midrange. Contested by Jrue Harris (3.7 feet, MAN). JAMES CUNNINGHAM MAKES IT! Assist: Trae Curry
Score: 63-38

[08:38] Team_008 possession (Score: 63-38)
Magic Young attempts a Midrange. Contested by Bam Leonard (4.0 feet, MAN). Magic Young misses. Rebound secured by Bam Leonard.

[08:24] Team_020 possession (Score: 63-38)
FOUL! Shooting foul on Jrue Harris. James Cunningham to the line for 3 free throws. [Team fouls: 2] (Jrue Harris: 1 personal fouls)   FT 1/3: GOOD   FT 2/3: MISS   FT 3/3: GOOD James Cunningham makes 2/3 from the line.
Score: 65-38

[08:07] Team_008 possession (Score: 65-38)
Magic Young attempts a 3Pt. Heavily contested by Bam Leonard (1.7 feet, MAN)! Magic Young misses. Rebound secured by Trae Curry.

[07:53] Team_020 possession (Score: 65-38)
James Cunningham attempts a 3Pt. Wide open! Victor Leonard is 6.1 feet away. [ZONE] James Cunningham misses. Rebound secured by Magic Young.

[07:37] Team_008 possession (Score: 65-38)
Magic Young drives to the basket... Magic Young throws a bad pass! Stolen by Trae Curry! TURNOVER! (live ball)

[07:19] Team_020 possession (Score: 65-38)
Bam Leonard attempts a 3Pt. Contested by Tyrese Thompson (4.8 feet, MAN). BAM LEONARD MAKES IT! Assist: Terry Simons
Score: 68-38

[07:03] Team_008 possession (Score: 68-38)
Magic Young drives, picks up Bam Leonard. Help arrives from Jarrett McCollum! Magic Young attempts a Dunk. Contested by Jarrett McCollum (3.1 feet, MAN). Magic Young misses. Rebound secured by Terry Simons.

[06:48] Team_020 possession (Score: 68-38)
Bam Leonard drives, Magic Young stays with him. Bam Leonard attempts a Dunk. Wide open! Magic Young is 6.1 feet away. [ZONE] Bam Leonard misses. Rebound secured by Magic Young.

[06:31] Team_008 possession (Score: 68-38)
Jrue Harris attempts a 3Pt. Contested by Terry Simons (5.9 feet, ZONE). JRUE HARRIS MAKES IT! Assist: Khris Hyland
Score: 68-41

[06:15] Team_020 possession (Score: 68-41)
Jarrett McCollum attempts a Layup. BLOCKED BY JRUE HARRIS! Ball goes out off Jrue Harris. Jarrett McCollum's ball!

[06:04] Team_020 possession (Score: 68-41)
Jarrett McCollum attempts a 3Pt. Contested by Victor Leonard (4.2 feet, MAN). JARRETT MCCOLLUM MAKES IT! Assist: James Cunningham
Score: 71-41

[05:53] Team_008 possession (Score: 71-41)
Khris Hyland attempts a 3Pt. Heavily contested by Bam Leonard (0.5 feet, ZONE)! Khris Hyland misses. Rebound secured by Terry Simons.

[05:35] Team_020 possession (Score: 71-41)
Terry Simons makes the Dunk and draws the foul on Khris Hyland! And-1! Terry Simons to the line for 1. [Team fouls: 3] (Khris Hyland: 2 personal fouls)   FT 1/1: GOOD Terry Simons makes 1/1 from the line.
Score: 74-41

[05:17] Team_008 possession (Score: 74-41)
Jrue Harris makes the Dunk and draws the foul on Trae Curry! And-1! Jrue Harris to the line for 1. [Team fouls: 3] (Trae Curry: 2 personal fouls)   FT 1/1: GOOD Jrue Harris makes 1/1 from the line.
Score: 74-44

[05:02] Team_020 possession (Score: 74-44)
James Cunningham makes the Midrange and draws the foul on Jrue Harris! And-1! James Cunningham to the line for 1. [Team fouls: 4] (Jrue Harris: 2 personal fouls)   FT 1/1: GOOD James Cunningham makes 1/1 from the line.
Score: 77-44

[04:52] Team_008 possession (Score: 77-44)
Magic Young attempts a Layup. Contested by Bam Leonard (3.2 feet, MAN). Magic Young misses. Rebound secured by Terry Simons.

[04:37] Team_020 possession (Score: 77-44)
James Cunningham drives, Jrue Harris stays with him. James Cunningham attempts a Layup. Contested by Jrue Harris (2.2 feet, MAN). JAMES CUNNINGHAM MAKES IT!
Score: 79-44

[04:20] Team_008 possession (Score: 79-44)
Victor Leonard drives, picks up Bam Leonard. Help arrives from Jarrett McCollum! Victor Leonard attempts a Layup. Heavily contested by Jarrett McCollum (1.9 feet, ZONE)! VICTOR LEONARD MAKES IT! Assist: Tyrese Thompson
Score: 79-46

[04:07] Team_020 possession (Score: 79-46)
Jarrett McCollum attempts a Midrange. Heavily contested by Victor Leonard (1.7 feet, MAN)! Jarrett McCollum misses. Offensive rebound by Bam Leonard! Bam Leonard puts it back in!
Score: 81-46

[03:51] Team_008 possession (Score: 81-46)
Victor Leonard loses the ball! Stripped by Jarrett McCollum! TURNOVER! (live ball)

[03:37] Team_020 possession (Score: 81-46)
Trae Curry throws a bad pass out of bounds! TURNOVER! (dead ball)

[03:20] Team_008 possession (Score: 81-46)
FOUL! Shooting foul on Trae Curry. Magic Young to the line for 2 free throws. [Team fouls: 4] (Trae Curry: 3 personal fouls)   FT 1/2: GOOD   FT 2/2: GOOD Magic Young makes 2/2 from the line.
Score: 81-48

[03:05] Team_020 possession (Score: 81-48)
FOUL! Holding foul on Victor Leonard. [IN THE BONUS! 5 team fouls] Jarrett McCollum to the line for 2 free throws. (Victor Leonard: 1 personal fouls)   FT 1/2: GOOD   FT 2/2: GOOD Jarrett McCollum makes 2/2 from the line.
Score: 83-48

[02:54] Team_008 possession (Score: 83-48)
Victor Leonard attempts a Midrange. Contested by Terry Simons (4.9 feet, ZONE). Victor Leonard misses. Rebound secured by Terry Simons.

[02:39] Team_020 possession (Score: 83-48)
Terry Simons attempts a 3Pt. Wide open! Jrue Harris is 6.3 feet away. [ZONE] Terry Simons misses. FOUL! Loose ball foul on Khris Hyland during the rebound battle. [IN THE BONUS! 6 team fouls] Trae Curry to the line for 2 free throws. (Khris Hyland: 3 personal fouls)   FT 1/2: GOOD   FT 2/2: GOOD Trae Curry makes 2/2 from the line.
Score: 85-48

[02:25] Team_008 possession (Score: 85-48)
Magic Young drives and kicks out. FOUL! Shooting foul on Bam Leonard. Tyrese Thompson to the line for 2 free throws. [BONUS: 5 team fouls] (Bam Leonard: 2 personal fouls)   FT 1/2: MISS   FT 2/2: GOOD Tyrese Thompson makes 1/2 from the line.
Score: 85-49

[02:11] Team_020 possession (Score: 85-49)
James Cunningham attempts a 3Pt. Wide open! Victor Leonard is 6.9 feet away. [ZONE] JAMES CUNNINGHAM MAKES IT! Assist: Jarrett McCollum
Score: 88-49

[01:57] Team_008 possession (Score: 88-49)
Magic Young attempts a Midrange. Heavily contested by Bam Leonard (1.2 feet, MAN)! Magic Young misses. Rebound secured by Bam Leonard.

[01:38] Team_020 possession (Score: 88-49)
James Cunningham attempts a Layup. Wide open! Tyrese Thompson is 8.5 feet away. [ZONE] JAMES CUNNINGHAM MAKES IT! Assist: Terry Simons
Score: 90-49

[01:26] Team_008 possession (Score: 90-49)
Tyrese Thompson drives, Trae Curry stays with him. Tyrese Thompson attempts a Dunk. Contested by Trae Curry (4.0 feet, ZONE). Tyrese Thompson misses. Rebound secured by Trae Curry.

[01:15] Team_020 possession (Score: 90-49)
James Cunningham attempts a 3Pt. Contested by Victor Leonard (3.4 feet, ZONE). James Cunningham misses. Rebound secured by Tyrese Thompson.

[01:02] Team_008 possession (Score: 90-49)
Victor Leonard attempts a 3Pt. Contested by Jarrett McCollum (2.5 feet, MAN). Victor Leonard misses. Rebound secured by Bam Leonard.

[00:45] Team_020 possession (Score: 90-49)
Bam Leonard drives and kicks out. Bam Leonard makes the Midrange and draws the foul on Tyrese Thompson! And-1! Bam Leonard to the line for 1. [BONUS: 7 team fouls] (Tyrese Thompson: 1 personal fouls)   FT 1/1: GOOD Bam Leonard makes 1/1 from the line.
Score: 93-49

[00:27] Team_008 possession (Score: 93-49)
FOUL! Reach-in foul on Trae Curry during the drive. [IN THE BONUS! 6 team fouls] Magic Young to the line for 2 free throws. (Trae Curry: 4 personal fouls)   FT 1/2: GOOD   FT 2/2: GOOD Magic Young makes 2/2 from the line.
Score: 93-51

[00:11] Team_020 possession (Score: 93-51)
FOUL! Shooting foul on Jrue Harris. James Cunningham to the line for 3 free throws. [BONUS: 8 team fouls] (Jrue Harris: 3 personal fouls)   FT 1/3: GOOD   FT 2/3: GOOD   FT 3/3: GOOD James Cunningham makes 3/3 from the line.
Score: 96-51

================================================================================
                              3RD QUARTER COMPLETE                              
================================================================================

3RD QUARTER SCORE: Team_020 45, Team_008 19

BOX SCORE:
================================================================================

Team_020
--------------------------------------------------------------------------------
Player                MIN  PTS  REB  AST  TO      FG   FG%      3P   3P%
--------------------------------------------------------------------------------
James Cunningham       28   17    0    2   0   7/9    77.8     0/0   0.0
Bam Leonard            28    8    5    0   0   3/4    75.0     0/0   0.0
Jarrett McCollum       28    8    0    1   0   3/3   100.0     0/0   0.0
Trae Curry             28    6    4    1   0   3/3   100.0     0/0   0.0
Terry Simons           28    6    4    2   0   2/2   100.0     0/0   0.0

TEAM: FG: 18/21 (85.7%), 3PT: 7/9 (77.8%), REB: 12 (1 off, 11 def), AST: 6, TO: 3
TEAM FOULS: 6 [Team_008 in BONUS]


Team_008
--------------------------------------------------------------------------------
Player                MIN  PTS  REB  AST  TO      FG   FG%      3P   3P%
--------------------------------------------------------------------------------
Magic Young            28    8    2    0   0   4/11   36.4     0/0   0.0
Jrue Harris            28    8    0    0   0   3/3   100.0     0/0   0.0
Victor Leonard         28    2    0    0   0   1/4    25.0     0/0   0.0
Tyrese Thompson        28    1    1    1   0   1/2    50.0     0/0   0.0
Khris Hyland           28    0    0    2   0   0/1     0.0     0/0   0.0

TEAM: FG: 9/21 (42.9%), 3PT: 1/5 (20.0%), REB: 4 (1 off, 3 def), AST: 3, TO: 2
TEAM FOULS: 8 [Team_020 in BONUS]

================================================================================

================================================================================
                       4TH QUARTER - Team_020 vs Team_008                       
================================================================================

[12:00] Team_020 possession (Score: 96-51)
Bam Leonard attempts a Midrange. Contested by Jrue Harris (2.8 feet, ZONE). Bam Leonard misses. Rebound secured by Magic Young.

[11:49] Team_008 possession (Score: 96-51)
Magic Young attempts a Layup. Wide open! Bam Leonard is 6.0 feet away. [MAN] MAGIC YOUNG MAKES IT! Assist: Tyrese Thompson
Score: 96-53

[11:31] Team_020 possession (Score: 96-53)
Jarrett McCollum drives and kicks out. Jarrett McCollum attempts a 3Pt. Contested by Victor Leonard (5.3 feet, ZONE). Jarrett McCollum misses. Rebound secured by Tyrese Thompson.

[11:16] Team_008 possession (Score: 96-53)
FOUL! Shooting foul on Bam Leonard. Magic Young to the line for 2 free throws. [Team fouls: 1] (Bam Leonard: 1 personal fouls)   FT 1/2: MISS   FT 2/2: GOOD Magic Young makes 1/2 from the line.
Score: 96-54

[11:00] Team_020 possession (Score: 96-54)
FOUL! Holding foul on Jrue Harris. [Team fouls: 1] No free throws, side out. (Jrue Harris: 1 personal fouls)

[10:47] Team_020 possession (Score: 96-54)
James Cunningham attempts a 3Pt. Heavily contested by Victor Leonard (0.5 feet, ZONE)! JAMES CUNNINGHAM MAKES IT! Assist: Trae Curry
Score: 99-54

[10:38] Team_008 possession (Score: 99-54)
Jrue Harris attempts a 3Pt. Contested by Jarrett McCollum (2.2 feet, ZONE). JRUE HARRIS MAKES IT! Assist: Khris Hyland
Score: 99-57

[10:19] Team_020 possession (Score: 99-57)
James Cunningham makes the Dunk and draws the foul on Tyrese Thompson! And-1! James Cunningham to the line for 1. [Team fouls: 2] (Tyrese Thompson: 1 personal fouls)   FT 1/1: GOOD James Cunningham makes 1/1 from the line.
Score: 102-57

[10:04] Team_008 possession (Score: 102-57)
Tyrese Thompson drives and kicks out. Jrue Harris attempts a Midrange. Heavily contested by Bam Leonard (1.0 feet, ZONE)! Jrue Harris misses. Rebound secured by Trae Curry.

[09:53] Team_020 possession (Score: 102-57)
Jarrett McCollum attempts a 3Pt. BLOCKED BY VICTOR LEONARD! Ball is loose! Offensive rebound by Bam Leonard! Bam Leonard kicks it out.

[09:41] Team_020 possession (Score: 102-57)
Bam Leonard attempts a 3Pt. Contested by Tyrese Thompson (4.2 feet, MAN). Bam Leonard misses. Rebound secured by Tyrese Thompson.

[09:31] Team_008 possession (Score: 102-57)
Victor Leonard drives and kicks out. Victor Leonard attempts a Midrange. Contested by Terry Simons (4.9 feet, ZONE). Victor Leonard misses. Rebound secured by Bam Leonard.

[09:14] Team_020 possession (Score: 102-57)
Terry Simons drives to the basket... Terry Simons loses the ball! Stripped by Khris Hyland! TURNOVER! (live ball)

[09:04] Team_008 possession (Score: 102-57)
Jrue Harris drives, picks up James Cunningham. Help arrives from Terry Simons! Jrue Harris attempts a Dunk. Contested by Terry Simons (3.1 feet, MAN). JRUE HARRIS MAKES IT! Assist: Magic Young
Score: 102-59

[08:51] Team_020 possession (Score: 102-59)
Jarrett McCollum attempts a 3Pt. Contested by Victor Leonard (5.8 feet, MAN). Jarrett McCollum misses. Rebound secured by Khris Hyland.

[08:37] Team_008 possession (Score: 102-59)
Khris Hyland attempts a Midrange. Wide open! James Cunningham is 7.3 feet away. [ZONE] Khris Hyland misses. Rebound secured by Bam Leonard.

[08:20] Team_020 possession (Score: 102-59)
Bam Leonard drives, Tyrese Thompson stays with him. Bam Leonard attempts a Dunk. Contested by Tyrese Thompson (3.8 feet, MAN). Bam Leonard misses. Offensive rebound by Trae Curry! Trae Curry kicks it out.

[08:02] Team_020 possession (Score: 102-59)
Terry Simons attempts a 3Pt. Contested by Khris Hyland (4.2 feet, MAN). Terry Simons misses. Rebound secured by Tyrese Thompson.

[07:45] Team_008 possession (Score: 102-59)
Magic Young drives, Trae Curry stays with him. Magic Young attempts a Layup. Wide open! Trae Curry is 6.7 feet away. [ZONE] MAGIC YOUNG MAKES IT!
Score: 102-61

[07:34] Team_020 possession (Score: 102-61)
Terry Simons attempts a 3Pt. Wide open! Victor Leonard is 7.9 feet away. [ZONE] Terry Simons misses. Rebound secured by Tyrese Thompson.

[07:22] Team_008 possession (Score: 102-61)
Magic Young attempts a Layup. BLOCKED BY BAM LEONARD! Ball is loose! Offensive rebound by Magic Young! Magic Young kicks it out.

[07:10] Team_008 possession (Score: 102-61)
Khris Hyland attempts a 3Pt. Contested by Terry Simons (2.9 feet, MAN). Khris Hyland misses. Rebound secured by Bam Leonard.

[06:58] Team_020 possession (Score: 102-61)
Bam Leonard loses the ball! Stripped by Tyrese Thompson! TURNOVER! (live ball)

[06:44] Team_008 possession (Score: 102-61)
Khris Hyland attempts a 3Pt. Contested by Bam Leonard (3.7 feet, ZONE). Khris Hyland misses. Rebound secured by Terry Simons.

[06:28] Team_020 possession (Score: 102-61)
Terry Simons attempts a Midrange. Contested by Khris Hyland (3.2 feet, ZONE). TERRY SIMONS MAKES IT! Assist: Bam Leonard
Score: 104-61

[06:14] Team_008 possession (Score: 104-61)
Tyrese Thompson drives and kicks out. Tyrese Thompson attempts a 3Pt. Contested by Bam Leonard (4.4 feet, ZONE). Tyrese Thompson misses. Rebound secured by Bam Leonard.

[05:58] Team_020 possession (Score: 104-61)
Trae Curry drives and kicks out. Terry Simons attempts a 3Pt. Wide open! Khris Hyland is 6.2 feet away. [MAN] TERRY SIMONS MAKES IT!
Score: 107-61

[05:45] Team_008 possession (Score: 107-61)
Victor Leonard drives, Jarrett McCollum stays with him. Victor Leonard attempts a Dunk. Wide open! Jarrett McCollum is 7.4 feet away. [MAN] VICTOR LEONARD MAKES IT!
Score: 107-63

[05:33] Team_020 possession (Score: 107-63)
Bam Leonard attempts a Layup. BLOCKED BY JRUE HARRIS! Ball is loose! Rebound secured by Khris Hyland.

[05:15] Team_008 possession (Score: 107-63)
Magic Young drives, Bam Leonard stays with him. Magic Young attempts a Dunk. Heavily contested by Bam Leonard (0.5 feet, MAN)! Magic Young misses. Rebound secured by Bam Leonard.

[05:01] Team_020 possession (Score: 107-63)
James Cunningham attempts a Midrange. Wide open! Jrue Harris is 6.9 feet away. [MAN] James Cunningham misses. Offensive rebound by Trae Curry! Trae Curry kicks it out.

[04:45] Team_020 possession (Score: 107-63)
Jarrett McCollum drives, Victor Leonard stays with him. Jarrett McCollum attempts a Layup. Wide open! Victor Leonard is 9.5 feet away. [MAN] JARRETT MCCOLLUM MAKES IT! Assist: Bam Leonard
Score: 109-63

[04:33] Team_008 possession (Score: 109-63)
Magic Young attempts a 3Pt. Contested by Trae Curry (6.0 feet, MAN). Magic Young misses. Offensive rebound by Tyrese Thompson! Tyrese Thompson kicks it out.

[04:17] Team_008 possession (Score: 109-63)
FOUL! Shooting foul on Terry Simons. Khris Hyland to the line for 2 free throws. [Team fouls: 2] (Terry Simons: 1 personal fouls)   FT 1/2: GOOD   FT 2/2: MISS Khris Hyland makes 1/2 from the line. FOUL! Loose ball foul on Trae Curry during the free throw rebound! [Team fouls: 3] No free throws, side out. (Trae Curry: 1 personal fouls)
Score: 109-64

[04:01] Team_008 possession (Score: 109-64)
Victor Leonard throws a bad pass! Stolen by Jarrett McCollum! TURNOVER! (live ball)

[03:45] Team_020 possession (Score: 109-64)
James Cunningham drives to the basket... FOUL! Offensive foul on James Cunningham! Tyrese Thompson drew the charge! [Team fouls: 4] (James Cunningham: 1 personal fouls) TURNOVER! (dead ball)

[03:27] Team_008 possession (Score: 109-64)
Jrue Harris drives, James Cunningham stays with him. Jrue Harris attempts a Layup. Wide open! James Cunningham is 9.1 feet away. [MAN] Jrue Harris misses. Rebound secured by Trae Curry.

[03:14] Team_020 possession (Score: 109-64)
Trae Curry drives and kicks out. James Cunningham attempts a 3Pt. Contested by Victor Leonard (5.1 feet, ZONE). James Cunningham misses. Offensive rebound by Bam Leonard! Bam Leonard kicks it out.

[03:02] Team_020 possession (Score: 109-64)
James Cunningham attempts a 3Pt. Contested by Jrue Harris (3.5 feet, MAN). James Cunningham misses. Rebound secured by Tyrese Thompson.

[02:50] Team_008 possession (Score: 109-64)
Tyrese Thompson attempts a 3Pt. Heavily contested by Bam Leonard (1.6 feet, MAN)! Tyrese Thompson misses. Rebound secured by Trae Curry.

[02:34] Team_020 possession (Score: 109-64)
Terry Simons drives to the basket... Terry Simons commits a violation (traveling/carry)! TURNOVER! (dead ball)

[02:34] Substitution (Team_020): Jarrett McCollum OUT → Franz Doncic IN (stamina_rule2)

[02:34] Substitution (Team_020): James Cunningham OUT → Stephen Parker IN (stamina_rule2)

[02:34] Substitution (Team_020): Terry Simons OUT → Victor Holiday IN (stamina_rule2)

[02:34] Substitution (Team_020): Bam Leonard OUT → Cole Barnes IN (stamina_rule2)

[02:34] Substitution (Team_020): Trae Curry OUT → Miles Siakam IN (stamina_rule2)

[02:34] Substitution (Team_008): Victor Leonard OUT → Blake Holiday IN (stamina_rule2)

[02:34] Substitution (Team_008): Jrue Harris OUT → Chris Griffin IN (stamina_rule2)

[02:34] Substitution (Team_008): Khris Hyland OUT → Immanuel Young IN (stamina_rule2)

[02:34] Substitution (Team_008): Tyrese Thompson OUT → Khris Giddey IN (stamina_rule2)

[02:34] Substitution (Team_008): Magic Young OUT → Lamelo Middleton IN (stamina_rule2)

[02:22] Team_008 possession (Score: 109-64)
Chris Griffin attempts a 3Pt. Wide open! Stephen Parker is 8.2 feet away. [ZONE] CHRIS GRIFFIN MAKES IT! Assist: Blake Holiday
Score: 109-67

[02:03] Team_020 possession (Score: 109-67)
FOUL! Shooting foul on Lamelo Middleton. Stephen Parker to the line for 2 free throws. [Team fouls: 3] (Lamelo Middleton: 1 personal fouls)   FT 1/2: GOOD   FT 2/2: GOOD Stephen Parker makes 2/2 from the line.
Score: 111-67

[01:44] Team_008 possession (Score: 111-67)
Khris Giddey attempts a 3Pt. Contested by Cole Barnes (5.8 feet, MAN). Khris Giddey misses. Rebound secured by Victor Holiday.

[01:30] Team_020 possession (Score: 111-67)
Franz Doncic attempts a 3Pt. Contested by Khris Giddey (4.7 feet, ZONE). Franz Doncic misses. Rebound secured by Khris Giddey.

[01:14] Team_008 possession (Score: 111-67)
Blake Holiday loses control! Ball rolls out of bounds! TURNOVER! (dead ball)

[00:57] Team_020 possession (Score: 111-67)
Victor Holiday attempts a 3Pt. Contested by Khris Giddey (4.3 feet, ZONE). Victor Holiday misses. Rebound secured by Khris Giddey.

[00:43] Team_008 possession (Score: 111-67)
FOUL! Shooting foul on Miles Siakam. Chris Griffin to the line for 2 free throws. [BONUS: 5 team fouls] (Miles Siakam: 1 personal fouls)   FT 1/2: MISS   FT 2/2: MISS Chris Griffin makes 0/2 from the line. Rebound secured by Victor Holiday.

[00:29] Team_020 possession (Score: 111-67)
Franz Doncic attempts a Layup. BLOCKED BY LAMELO MIDDLETON! Ball is loose! Rebound secured by Khris Giddey.

[00:13] Team_008 possession (Score: 111-67)
Immanuel Young attempts a 3Pt. Contested by Victor Holiday (4.2 feet, ZONE). IMMANUEL YOUNG MAKES IT! Assist: Blake Holiday
Score: 111-70

================================================================================
                              4TH QUARTER COMPLETE                              
================================================================================

4TH QUARTER SCORE: Team_020 15, Team_008 19

BOX SCORE:
================================================================================

Team_020
--------------------------------------------------------------------------------
Player                MIN  PTS  REB  AST  TO      FG   FG%      3P   3P%
--------------------------------------------------------------------------------
James Cunningham       38    6    0    0   0   2/3    66.7     0/0   0.0
Terry Simons           38    5    1    0   0   2/4    50.0     0/0   0.0
Jarrett McCollum       38    2    0    0   0   1/3    33.3     0/0   0.0
Stephen Parker         10    2    0    0   0   1/1   100.0     0/0   0.0
Bam Leonard            38    0    7    2   0   0/3     0.0     0/0   0.0
Trae Curry             38    0    5    1   0   0/0     0.0     0/0   0.0
Victor Holiday         10    0    2    0   0   0/1     0.0     0/0   0.0
Franz Doncic           10    0    0    0   0   0/2     0.0     0/0   0.0

TEAM: FG: 6/17 (35.3%), 3PT: 1/8 (12.5%), REB: 15 (4 off, 11 def), AST: 3, TO: 4
TEAM FOULS: 5 [Team_008 in BONUS]


Team_008
--------------------------------------------------------------------------------
Player                MIN  PTS  REB  AST  TO      FG   FG%      3P   3P%
--------------------------------------------------------------------------------
Magic Young            38    5    2    1   0   3/4    75.0     0/0   0.0
Jrue Harris            38    5    0    0   0   2/3    66.7     0/0   0.0
Chris Griffin          10    3    0    0   0   1/2    50.0     0/0   0.0
Immanuel Young         10    3    0    0   0   1/1   100.0     0/0   0.0
Victor Leonard         38    2    0    0   0   1/2    50.0     0/0   0.0
Tyrese Thompson        38    0    7    1   0   0/3     0.0     0/0   0.0
Khris Hyland           38    0    2    1   0   0/3     0.0     0/0   0.0
Blake Holiday          10    0    0    2   0   0/0     0.0     0/0   0.0
Khris Giddey           10    0    3    0   0   0/1     0.0     0/0   0.0

TEAM: FG: 8/19 (42.1%), 3PT: 3/7 (42.9%), REB: 14 (3 off, 11 def), AST: 5, TO: 2
TEAM FOULS: 3

================================================================================

================================================================================
                               FULL GAME COMPLETE                               
================================================================================

FINAL SCORE: Team_020 111, Team_008 70

SCORING BY QUARTER:
--------------------------------------------------------------------------------
Team                     Q1     Q2     Q3     Q4    FINAL
--------------------------------------------------------------------------------
Team_020                 30     21     45     15      111
Team_008                 15     17     19     19       70
--------------------------------------------------------------------------------

FULL GAME BOX SCORE:
================================================================================

Team_020
--------------------------------------------------------------------------------
Player                MIN  PTS  REB  AST  TO      FG   FG%      3P   3P%      FT STL BLK
--------------------------------------------------------------------------------
Jarrett McCollum       38   12    0    3   1   5/8    62.5   2/4    50.0   2/2     2   1
James Cunningham       38   28    0    3   1  11/17   64.7   5/8    62.5   8/10    0   0
Terry Simons           38   26    8    2   1   9/14   64.3   3/8    37.5   5/5     1   0
Bam Leonard            38   16   20    5   5   4/14   28.6   1/2    50.0   2/2     0   2
Trae Curry             38   11   13    3   1   7/9    77.8   0/0     0.0   3/3     2   0
Franz Doncic           10    2    0    1   0   1/4    25.0   0/1     0.0   0/0     0   0
Stephen Parker         10    4    0    0   1   2/3    66.7   0/1     0.0   2/2     0   0
Victor Holiday         10    4    5    2   0   2/4    50.0   0/1     0.0   2/2     0   0
Cole Barnes            10    0    0    0   0   1/1   100.0   1/1   100.0   0/0     0   0
Miles Siakam           10    7    5    0   0   2/4    50.0   0/0     0.0   3/3     0   0

TEAM: FG: 45/79 (57.0%), 3PT: 12/26 (46.2%), REB: 51 (8 off, 43 def), AST: 19, TO: 10


Team_008
--------------------------------------------------------------------------------
Player                MIN  PTS  REB  AST  TO      FG   FG%      3P   3P%      FT STL BLK
--------------------------------------------------------------------------------
Victor Leonard         38    7    0    1   3   3/11   27.3   0/4     0.0   1/1     0   1
Jrue Harris            38   16    0    0   2   6/8    75.0   3/4    75.0   1/1     0   2
Khris Hyland           38    8    7    3   2   3/11   27.3   0/6     0.0   3/4     1   0
Tyrese Thompson        38    7   18    2   3   3/9    33.3   0/3     0.0   1/4     3   0
Magic Young            38   13    9    1   1   8/19   42.1   0/2     0.0   7/10    0   0
Blake Holiday          10    2    0    2   1   2/2   100.0   1/1   100.0   2/3     0   0
Chris Griffin          10    8    2    0   1   2/4    50.0   2/3    66.7   0/2     0   0
Immanuel Young         10    3    0    0   0   1/3    33.3   1/2    50.0   0/0     0   0
Khris Giddey           10    5    7    0   0   2/4    50.0   0/1     0.0   1/1     0   0
Lamelo Middleton       10    0    3    1   0   0/3     0.0   0/1     0.0   0/0     0   1

TEAM: FG: 30/74 (40.5%), 3PT: 7/27 (25.9%), REB: 46 (13 off, 33 def), AST: 10, TO: 13

================================================================================
