================================================================================
                        FULL GAME - Team_036 vs Team_046                        
================================================================================

================================================================================
                       1ST QUARTER - Team_036 vs Team_046                       
================================================================================

[12:00] Team_036 possession (Score: 0-0)
Anthony Poole drives, picks up Lauri Carter. Help arrives from D'Angelo O'Neal! Anthony Poole attempts a Layup. Heavily contested by D'Angelo O'Neal (1.2 feet, MAN)! ANTHONY POOLE MAKES IT! Assist: Michael Westbrook
Score: 2-0

[11:45] Team_046 possession (Score: 2-0)
Victor Nowitzki attempts a 3Pt. Contested by Michael Westbrook (2.4 feet, ZONE). Victor Nowitzki misses. Rebound secured by Kobe Simmons.

[11:30] Team_036 possession (Score: 2-0)
Terry Durant drives, picks up Kevin Allen. Help arrives from D'Angelo O'Neal! Terry Durant attempts a Dunk. Contested by D'Angelo O'Neal (2.8 feet, ZONE). TERRY DURANT MAKES IT!
Score: 4-0

[11:17] Team_046 possession (Score: 4-0)
D'Angelo O'Neal attempts a Midrange. Wide open! Anthony Poole is 10.0 feet away. [ZONE] D'ANGELO O'NEAL MAKES IT!
Score: 4-2

[11:01] Team_036 possession (Score: 4-2)
Kobe Simmons drives, picks up Kevin Allen. Help arrives from D'Angelo O'Neal! Kobe Simmons attempts a Dunk. Contested by D'Angelo O'Neal (3.6 feet, ZONE). KOBE SIMMONS MAKES IT!
Score: 6-2

[10:48] Team_046 possession (Score: 6-2)
Kevin Allen attempts a Midrange. Contested by Kobe Simmons (5.2 feet, MAN). KEVIN ALLEN MAKES IT!
Score: 6-4

[10:33] Team_036 possession (Score: 6-4)
Anthony Poole attempts a Midrange. Contested by Lauri Carter (3.2 feet, MAN). Anthony Poole misses. Rebound secured by Kevin Allen.

[10:15] Team_046 possession (Score: 6-4)
Kevin Allen attempts a Layup. BLOCKED BY GIANNIS BOOKER! Ball goes out off Giannis Booker. Kevin Allen's ball!

[10:01] Team_046 possession (Score: 6-4)
D'Angelo O'Neal attempts a 3Pt. Contested by Michael Westbrook (3.2 feet, MAN). D'Angelo O'Neal misses. Offensive rebound by Cade Wall! Cade Wall kicks it out.

[09:50] Team_046 possession (Score: 6-4)
Kevin Allen drives and kicks out. Cade Wall attempts a 3Pt. Heavily contested by Terry Durant (1.7 feet, MAN)! Cade Wall misses. Rebound secured by Giannis Booker.

[09:36] Team_036 possession (Score: 6-4)
Terry Durant attempts a Layup. Heavily contested by Cade Wall (0.5 feet, MAN)! TERRY DURANT MAKES IT! Assist: Anthony Poole
Score: 8-4

[09:21] Team_046 possession (Score: 8-4)
D'Angelo O'Neal attempts a 3Pt. Contested by Michael Westbrook (4.2 feet, MAN). D'Angelo O'Neal misses. Rebound secured by Terry Durant.

[09:09] Team_036 possession (Score: 8-4)
Kobe Simmons makes the Layup and draws the foul on Kevin Allen! And-1! Kobe Simmons to the line for 1. [Team fouls: 1] (Kevin Allen: 1 personal fouls)   FT 1/1: GOOD Kobe Simmons makes 1/1 from the line.
Score: 11-4

[08:53] Team_046 possession (Score: 11-4)
FOUL! Holding foul on Anthony Poole. [Team fouls: 1] No free throws, side out. (Anthony Poole: 1 personal fouls)

[08:41] Team_046 possession (Score: 11-4)
FOUL! Shooting foul on Michael Westbrook. D'Angelo O'Neal to the line for 2 free throws. [Team fouls: 2] (Michael Westbrook: 1 personal fouls)   FT 1/2: GOOD   FT 2/2: GOOD D'Angelo O'Neal makes 2/2 from the line.
Score: 11-6

[08:23] Team_036 possession (Score: 11-6)
Anthony Poole attempts a Midrange. Wide open! Cade Wall is 8.5 feet away. [ZONE] ANTHONY POOLE MAKES IT! Assist: Giannis Booker
Score: 13-6

[08:10] Team_046 possession (Score: 13-6)
Kevin Allen attempts a Layup. BLOCKED BY KOBE SIMMONS! Ball deflects out of bounds off Kevin Allen.

[07:53] Team_036 possession (Score: 13-6)
Anthony Poole attempts a Layup. Contested by Lauri Carter (4.1 feet, MAN). ANTHONY POOLE MAKES IT! Assist: Michael Westbrook
Score: 15-6

[07:34] Team_046 possession (Score: 15-6)
D'Angelo O'Neal makes the Midrange and draws the foul on Michael Westbrook! And-1! D'Angelo O'Neal to the line for 1. [Team fouls: 3] (Michael Westbrook: 2 personal fouls)   FT 1/1: GOOD D'Angelo O'Neal makes 1/1 from the line.
Score: 15-9

[07:19] Team_036 possession (Score: 15-9)
Terry Durant attempts a Midrange. Contested by Lauri Carter (4.5 feet, ZONE). TERRY DURANT MAKES IT!
Score: 17-9

[07:06] Team_046 possession (Score: 17-9)
FOUL! Holding foul on Terry Durant. [Team fouls: 4] No free throws, side out. (Terry Durant: 1 personal fouls)

[06:51] Team_046 possession (Score: 17-9)
D'Angelo O'Neal attempts a 3Pt. Wide open! Michael Westbrook is 8.8 feet away. [MAN] D'ANGELO O'NEAL MAKES IT! Assist: Cade Wall
Score: 17-12

[06:38] Team_036 possession (Score: 17-12)
Giannis Booker attempts a Midrange. Contested by Lauri Carter (2.1 feet, ZONE). Giannis Booker misses. Rebound secured by Cade Wall.

[06:24] Team_046 possession (Score: 17-12)
Cade Wall drives and kicks out. FOUL! Shooting foul on Terry Durant. Cade Wall to the line for 3 free throws. [BONUS: 5 team fouls] (Terry Durant: 2 personal fouls)   FT 1/3: GOOD   FT 2/3: GOOD   FT 3/3: GOOD Cade Wall makes 3/3 from the line.
Score: 17-15

[06:13] Team_036 possession (Score: 17-15)
Kobe Simmons throws a bad pass! Stolen by Kevin Allen! TURNOVER! (live ball)

[05:58] Team_046 possession (Score: 17-15)
Kevin Allen throws a bad pass! Stolen by Kobe Simmons! TURNOVER! (live ball)

[05:41] Team_036 possession (Score: 17-15)
Giannis Booker attempts a 3Pt. Contested by Lauri Carter (3.8 feet, ZONE). GIANNIS BOOKER MAKES IT!
Score: 20-15

[05:30] Team_046 possession (Score: 20-15)
Kevin Allen drives, Kobe Simmons stays with him. Kevin Allen attempts a Dunk. Wide open! Kobe Simmons is 7.9 feet away. [ZONE] KEVIN ALLEN MAKES IT! Assist: Victor Nowitzki
Score: 20-17

[05:16] Team_036 possession (Score: 20-17)
Kobe Simmons attempts a Midrange. Wide open! Kevin Allen is 7.2 feet away. [MAN] Kobe Simmons misses. Rebound secured by Lauri Carter.

[05:02] Team_046 possession (Score: 20-17)
Kevin Allen attempts a Layup. Contested by Kobe Simmons (3.3 feet, MAN). KEVIN ALLEN MAKES IT!
Score: 20-19

[04:48] Team_036 possession (Score: 20-19)
Kobe Simmons attempts a Layup. Contested by Kevin Allen (6.0 feet, MAN). KOBE SIMMONS MAKES IT! Assist: Anthony Poole
Score: 22-19

[04:33] Team_046 possession (Score: 22-19)
Victor Nowitzki drives and kicks out. Kevin Allen attempts a Midrange. Contested by Kobe Simmons (2.1 feet, MAN). Kevin Allen misses. Rebound secured by Giannis Booker.

[04:18] Team_036 possession (Score: 22-19)
Terry Durant attempts a 3Pt. Wide open! Cade Wall is 6.0 feet away. [MAN] TERRY DURANT MAKES IT! Assist: Michael Westbrook
Score: 25-19

[04:02] Team_046 possession (Score: 25-19)
FOUL! Shooting foul on Kobe Simmons. D'Angelo O'Neal to the line for 2 free throws. [BONUS: 6 team fouls] (Kobe Simmons: 1 personal fouls)   FT 1/2: GOOD   FT 2/2: MISS D'Angelo O'Neal makes 1/2 from the line. Rebound secured by Terry Durant.
Score: 25-20

[03:47] Team_036 possession (Score: 25-20)
Terry Durant drives, Cade Wall stays with him. Terry Durant attempts a Layup. Contested by Cade Wall (3.2 feet, MAN). TERRY DURANT MAKES IT! Assist: Michael Westbrook
Score: 27-20

[03:31] Team_046 possession (Score: 27-20)
Lauri Carter attempts a 3Pt. Contested by Anthony Poole (5.2 feet, MAN). Lauri Carter misses. FOUL! Loose ball foul on Kobe Simmons during the rebound battle. [IN THE BONUS! 7 team fouls] Kevin Allen to the line for 2 free throws. (Kobe Simmons: 2 personal fouls)   FT 1/2: MISS   FT 2/2: GOOD Kevin Allen makes 1/2 from the line.
Score: 27-21

[03:18] Team_036 possession (Score: 27-21)
Giannis Booker attempts a 3Pt. Contested by Victor Nowitzki (4.0 feet, MAN). Giannis Booker misses. Rebound secured by Lauri Carter.

[03:04] Team_046 possession (Score: 27-21)
Kevin Allen attempts a Layup. Contested by Kobe Simmons (3.6 feet, ZONE). Kevin Allen misses. Offensive rebound by Cade Wall! Cade Wall kicks it out.

[02:49] Team_046 possession (Score: 27-21)
Victor Nowitzki drives, Giannis Booker stays with him. Victor Nowitzki attempts a Dunk. Wide open! Giannis Booker is 6.6 feet away. [MAN] VICTOR NOWITZKI MAKES IT! Assist: Kevin Allen
Score: 27-23

[02:38] Team_036 possession (Score: 27-23)
Michael Westbrook makes the Layup and draws the foul on D'Angelo O'Neal! And-1! Michael Westbrook to the line for 1. [Team fouls: 2] (D'Angelo O'Neal: 1 personal fouls)   FT 1/1: GOOD Michael Westbrook makes 1/1 from the line.
Score: 30-23

[02:20] Team_046 possession (Score: 30-23)
Lauri Carter attempts a 3Pt. Contested by Anthony Poole (5.4 feet, MAN). Lauri Carter misses. Rebound secured by Kobe Simmons.

[02:02] Team_036 possession (Score: 30-23)
Giannis Booker drives and kicks out. Kobe Simmons attempts a 3Pt. Wide open! Kevin Allen is 7.9 feet away. [MAN] Kobe Simmons misses. Rebound secured by Lauri Carter.

[01:47] Team_046 possession (Score: 30-23)
D'Angelo O'Neal attempts a Midrange. Wide open! Michael Westbrook is 9.5 feet away. [MAN] D'Angelo O'Neal misses. Rebound secured by Kobe Simmons.

[01:32] Team_036 possession (Score: 30-23)
Kobe Simmons drives, picks up Kevin Allen. Help arrives from D'Angelo O'Neal! Kobe Simmons attempts a Dunk. Wide open! D'Angelo O'Neal is 6.8 feet away. [ZONE] KOBE SIMMONS MAKES IT!
Score: 32-23

[01:19] Team_046 possession (Score: 32-23)
Kevin Allen drives to the basket... Kevin Allen loses the ball! Stripped by Kobe Simmons! TURNOVER! (live ball)

[01:05] Team_036 possession (Score: 32-23)
Giannis Booker attempts a Midrange. Contested by Victor Nowitzki (4.9 feet, MAN). Giannis Booker misses. Rebound secured by Lauri Carter.

[00:52] Team_046 possession (Score: 32-23)
FOUL! Reach-in foul on Kobe Simmons during the drive. [IN THE BONUS! 8 team fouls] Kevin Allen to the line for 2 free throws. (Kobe Simmons: 3 personal fouls)   FT 1/2: MISS   FT 2/2: GOOD Kevin Allen makes 1/2 from the line.
Score: 32-24

[00:40] Team_036 possession (Score: 32-24)
Terry Durant attempts a Dunk. BLOCKED BY CADE WALL! Ball is loose! Offensive rebound by Kobe Simmons! Kobe Simmons kicks it out.

[00:24] Team_036 possession (Score: 32-24)
Michael Westbrook drives, Kevin Allen stays with him. Michael Westbrook attempts a Layup. Contested by Kevin Allen (2.7 feet, ZONE). Michael Westbrook misses. Rebound secured by Cade Wall.

[00:13] Team_046 possession (Score: 32-24)
Lauri Carter attempts a Layup. Wide open! Anthony Poole is 7.8 feet away. [MAN] Lauri Carter misses. Rebound secured by Terry Durant.

================================================================================
                              1ST QUARTER COMPLETE                              
================================================================================

1ST QUARTER SCORE: Team_036 32, Team_046 24

BOX SCORE:
================================================================================

Team_036
--------------------------------------------------------------------------------
Player                MIN  PTS  REB  AST  TO      FG   FG%      3P   3P%
--------------------------------------------------------------------------------
Terry Durant           12   11    3    0   0   5/5   100.0     0/0   0.0
Kobe Simmons           12    9    4    0   0   4/5    80.0     0/0   0.0
Anthony Poole          12    6    0    2   0   3/4    75.0     0/0   0.0
Michael Westbrook      12    3    0    4   0   1/2    50.0     0/0   0.0
Giannis Booker         12    3    2    1   0   1/5    20.0     0/0   0.0

TEAM: FG: 14/21 (66.7%), 3PT: 2/3 (66.7%), REB: 9 (1 off, 8 def), AST: 7, TO: 1
TEAM FOULS: 8 [Team_046 in BONUS]


Team_046
--------------------------------------------------------------------------------
Player                MIN  PTS  REB  AST  TO      FG   FG%      3P   3P%
--------------------------------------------------------------------------------
D'Angelo O'Neal        12   10    0    0   0   4/7    57.1     0/0   0.0
Kevin Allen            12    8    1    1   0   5/7    71.4     0/0   0.0
Cade Wall              12    3    4    1   0   1/1   100.0     0/0   0.0
Victor Nowitzki        12    2    0    1   0   1/3    33.3     0/0   0.0
Lauri Carter           12    0    4    0   0   0/2     0.0     0/0   0.0

TEAM: FG: 11/20 (55.0%), 3PT: 2/5 (40.0%), REB: 9 (2 off, 7 def), AST: 3, TO: 2
TEAM FOULS: 2

================================================================================

================================================================================
                       2ND QUARTER - Team_036 vs Team_046                       
================================================================================

[12:00] Team_036 possession (Score: 32-24)
Terry Durant drives, Kevin Allen stays with him. Terry Durant attempts a Layup. Contested by Kevin Allen (4.4 feet, ZONE). TERRY DURANT MAKES IT! Assist: Kobe Simmons
Score: 34-24

[11:44] Team_046 possession (Score: 34-24)
FOUL! Holding foul on Giannis Booker. [Team fouls: 1] No free throws, side out. (Giannis Booker: 1 personal fouls)

[11:30] Team_046 possession (Score: 34-24)
Kevin Allen drives, Kobe Simmons stays with him. Kevin Allen attempts a Dunk. Contested by Kobe Simmons (4.6 feet, ZONE). KEVIN ALLEN MAKES IT! Assist: Victor Nowitzki
Score: 34-26

[11:14] Team_036 possession (Score: 34-26)
Terry Durant attempts a 3Pt. Wide open! Lauri Carter is 6.7 feet away. [ZONE] TERRY DURANT MAKES IT! Assist: Giannis Booker
Score: 37-26

[10:59] Team_046 possession (Score: 37-26)
Victor Nowitzki attempts a 3Pt. Wide open! Michael Westbrook is 7.6 feet away. [ZONE] Victor Nowitzki misses. Rebound secured by Kobe Simmons.

[10:41] Team_036 possession (Score: 37-26)
Kobe Simmons attempts a Layup. Contested by Kevin Allen (4.5 feet, ZONE). KOBE SIMMONS MAKES IT! Assist: Anthony Poole
Score: 39-26

[10:32] Team_046 possession (Score: 39-26)
D'Angelo O'Neal attempts a 3Pt. Contested by Michael Westbrook (4.2 feet, MAN). D'Angelo O'Neal misses. Rebound secured by Giannis Booker.

[10:18] Team_036 possession (Score: 39-26)
Michael Westbrook attempts a 3Pt. Contested by D'Angelo O'Neal (4.4 feet, MAN). MICHAEL WESTBROOK MAKES IT! Assist: Kobe Simmons
Score: 42-26

[10:05] Team_046 possession (Score: 42-26)
Victor Nowitzki attempts a Layup. BLOCKED BY GIANNIS BOOKER! Ball is loose! Rebound secured by Terry Durant.

[09:52] Team_036 possession (Score: 42-26)
FOUL! Shooting foul on Kevin Allen. Kobe Simmons to the line for 2 free throws. [Team fouls: 1] (Kevin Allen: 1 personal fouls)   FT 1/2: GOOD   FT 2/2: GOOD Kobe Simmons makes 2/2 from the line.
Score: 44-26

[09:36] Team_046 possession (Score: 44-26)
Victor Nowitzki makes the Layup and draws the foul on Kobe Simmons! And-1! Victor Nowitzki to the line for 1. [Team fouls: 2] (Kobe Simmons: 1 personal fouls)   FT 1/1: GOOD Victor Nowitzki makes 1/1 from the line.
Score: 44-29

[09:22] Team_036 possession (Score: 44-29)
Michael Westbrook attempts a 3Pt. Wide open! D'Angelo O'Neal is 6.4 feet away. [MAN] Michael Westbrook misses. Offensive rebound by Kobe Simmons! Kobe Simmons puts it back in!
Score: 46-29

[09:06] Team_046 possession (Score: 46-29)
Kevin Allen throws a bad pass! Stolen by Kobe Simmons! TURNOVER! (live ball)

[08:51] Team_036 possession (Score: 46-29)
Anthony Poole makes the Layup and draws the foul on D'Angelo O'Neal! And-1! Anthony Poole to the line for 1. [Team fouls: 2] (D'Angelo O'Neal: 1 personal fouls)   FT 1/1: GOOD Anthony Poole makes 1/1 from the line.
Score: 49-29

[08:38] Team_046 possession (Score: 49-29)
FOUL! Shooting foul on Anthony Poole. Lauri Carter to the line for 2 free throws. [Team fouls: 3] (Anthony Poole: 1 personal fouls)   FT 1/2: MISS   FT 2/2: GOOD Lauri Carter makes 1/2 from the line.
Score: 49-30

[08:24] Team_036 possession (Score: 49-30)
Giannis Booker attempts a 3Pt. Contested by Victor Nowitzki (5.1 feet, MAN). Giannis Booker misses. Rebound secured by Cade Wall.

[08:10] Team_046 possession (Score: 49-30)
Kevin Allen attempts a Layup. BLOCKED BY KOBE SIMMONS! Ball is loose! Rebound secured by Giannis Booker.

[08:00] Team_036 possession (Score: 49-30)
Michael Westbrook attempts a Midrange. Wide open! D'Angelo O'Neal is 7.9 feet away. [MAN] Michael Westbrook misses. Rebound secured by Cade Wall.

[07:49] Team_046 possession (Score: 49-30)
Kevin Allen drives and kicks out. Victor Nowitzki attempts a 3Pt. Wide open! Giannis Booker is 6.2 feet away. [MAN] Victor Nowitzki misses. Rebound secured by Kobe Simmons.

[07:36] Team_036 possession (Score: 49-30)
Terry Durant commits a violation (traveling/carry)! TURNOVER! (dead ball)

[07:36] Substitution (Team_036): Michael Westbrook OUT → Dirk Anunoby IN (stamina_rule2)

[07:36] Substitution (Team_036): Giannis Booker OUT → Tobias Fox IN (stamina_rule2)

[07:36] Substitution (Team_036): Anthony Poole OUT → Pascal Antetokounmpo IN (stamina_rule2)

[07:36] Substitution (Team_036): Terry Durant OUT → Devin Simmons IN (stamina_rule2)

[07:36] Substitution (Team_036): Kobe Simmons OUT → Bradley Murray IN (stamina_rule2)

[07:36] Substitution (Team_046): D'Angelo O'Neal OUT → Collin Butler IN (stamina_rule2)

[07:36] Substitution (Team_046): Victor Nowitzki OUT → Manu Dosunmu IN (stamina_rule2)

[07:36] Substitution (Team_046): Lauri Carter OUT → Josh Barrett IN (stamina_rule2)

[07:36] Substitution (Team_046): Cade Wall OUT → Chris LaVine IN (stamina_rule2)

[07:36] Substitution (Team_046): Kevin Allen OUT → Paul DeRozan IN (stamina_rule2)

[07:23] Team_046 possession (Score: 49-30)
FOUL! Reach-in foul on Pascal Antetokounmpo during the drive. [Team fouls: 4] No free throws, side out. (Pascal Antetokounmpo: 1 personal fouls)

[07:10] Team_046 possession (Score: 49-30)
Collin Butler throws a bad pass out of bounds! TURNOVER! (dead ball)

[06:56] Team_036 possession (Score: 49-30)
Tobias Fox drives and kicks out. Devin Simmons attempts a Midrange. Contested by Chris LaVine (3.2 feet, ZONE). Devin Simmons misses. Rebound secured by Chris LaVine.

[06:46] Team_046 possession (Score: 49-30)
Josh Barrett attempts a Layup. Contested by Devin Simmons (5.8 feet, ZONE). JOSH BARRETT MAKES IT! Assist: Chris LaVine
Score: 49-32

[06:32] Team_036 possession (Score: 49-32)
Pascal Antetokounmpo attempts a 3Pt. Wide open! Manu Dosunmu is 7.7 feet away. [ZONE] PASCAL ANTETOKOUNMPO MAKES IT! Assist: Tobias Fox
Score: 52-32

[06:20] Team_046 possession (Score: 52-32)
FOUL! Shooting foul on Bradley Murray. Paul DeRozan to the line for 2 free throws. [BONUS: 5 team fouls] (Bradley Murray: 1 personal fouls)   FT 1/2: GOOD   FT 2/2: GOOD Paul DeRozan makes 2/2 from the line.
Score: 52-34

[06:05] Team_036 possession (Score: 52-34)
Dirk Anunoby attempts a 3Pt. Contested by Collin Butler (3.6 feet, MAN). Dirk Anunoby misses. FOUL! Loose ball foul on Chris LaVine during the rebound battle. [Team fouls: 3] No free throws, side out. (Chris LaVine: 1 personal fouls)

[05:55] Team_036 possession (Score: 52-34)
Devin Simmons attempts a Midrange. Contested by Chris LaVine (5.7 feet, MAN). Devin Simmons misses. Rebound secured by Paul DeRozan.

[05:41] Team_046 possession (Score: 52-34)
Paul DeRozan attempts a 3Pt. Contested by Tobias Fox (3.6 feet, ZONE). Paul DeRozan misses. Rebound secured by Devin Simmons.

[05:30] Team_036 possession (Score: 52-34)
Dirk Anunoby attempts a 3Pt. Heavily contested by Chris LaVine (0.9 feet, ZONE)! Dirk Anunoby misses. Rebound secured by Chris LaVine.

[05:11] Team_046 possession (Score: 52-34)
Chris LaVine attempts a 3Pt. Contested by Devin Simmons (5.4 feet, MAN). Chris LaVine misses. Offensive rebound by Chris LaVine! Chris LaVine kicks it out.

[04:58] Team_046 possession (Score: 52-34)
FOUL! Shooting foul on Tobias Fox. Manu Dosunmu to the line for 3 free throws. [BONUS: 6 team fouls] (Tobias Fox: 1 personal fouls)   FT 1/3: GOOD   FT 2/3: GOOD   FT 3/3: GOOD Manu Dosunmu makes 3/3 from the line.
Score: 52-37

[04:41] Team_036 possession (Score: 52-37)
Dirk Anunoby attempts a 3Pt. Contested by Collin Butler (3.5 feet, ZONE). Dirk Anunoby misses. Rebound secured by Chris LaVine.

[04:24] Team_046 possession (Score: 52-37)
Collin Butler attempts a Layup. Contested by Dirk Anunoby (3.3 feet, MAN). Collin Butler misses. Rebound secured by Bradley Murray.

[04:09] Team_036 possession (Score: 52-37)
Tobias Fox attempts a Midrange. Contested by Manu Dosunmu (2.5 feet, MAN). TOBIAS FOX MAKES IT!
Score: 54-37

[03:52] Team_046 possession (Score: 54-37)
Collin Butler attempts a 3Pt. Wide open! Dirk Anunoby is 6.4 feet away. [MAN] COLLIN BUTLER MAKES IT! Assist: Manu Dosunmu
Score: 54-40

[03:36] Team_036 possession (Score: 54-40)
Tobias Fox attempts a 3Pt. Wide open! Manu Dosunmu is 8.0 feet away. [MAN] TOBIAS FOX MAKES IT! Assist: Devin Simmons
Score: 57-40

[03:21] Team_046 possession (Score: 57-40)
Josh Barrett attempts a Midrange. Contested by Pascal Antetokounmpo (4.8 feet, MAN). Josh Barrett misses. Rebound secured by Devin Simmons.

[03:06] Team_036 possession (Score: 57-40)
Dirk Anunoby attempts a Layup. Contested by Chris LaVine (5.6 feet, ZONE). DIRK ANUNOBY MAKES IT!
Score: 59-40

[02:47] Team_046 possession (Score: 59-40)
Paul DeRozan attempts a Midrange. Wide open! Pascal Antetokounmpo is 8.6 feet away. [ZONE] Paul DeRozan misses. FOUL! Loose ball foul on Pascal Antetokounmpo during the rebound battle. [IN THE BONUS! 7 team fouls] Chris LaVine to the line for 2 free throws. (Pascal Antetokounmpo: 2 personal fouls)   FT 1/2: GOOD   FT 2/2: GOOD Chris LaVine makes 2/2 from the line.
Score: 59-42

[02:28] Team_036 possession (Score: 59-42)
Bradley Murray drives, picks up Chris LaVine. Help arrives from Manu Dosunmu! Bradley Murray attempts a Dunk. Contested by Manu Dosunmu (5.0 feet, MAN). BRADLEY MURRAY MAKES IT!
Score: 61-42

[02:14] Team_046 possession (Score: 61-42)
Paul DeRozan attempts a Layup. Contested by Devin Simmons (5.2 feet, ZONE). PAUL DEROZAN MAKES IT!
Score: 61-44

[02:02] Team_036 possession (Score: 61-44)
Tobias Fox drives and kicks out. Tobias Fox attempts a 3Pt. Heavily contested by Manu Dosunmu (1.1 feet, MAN)! TOBIAS FOX MAKES IT! Assist: Bradley Murray
Score: 64-44

[01:47] Team_046 possession (Score: 64-44)
Paul DeRozan attempts a 3Pt. Contested by Tobias Fox (4.7 feet, ZONE). Paul DeRozan misses. Rebound secured by Pascal Antetokounmpo.

[01:31] Team_036 possession (Score: 64-44)
Dirk Anunoby attempts a 3Pt. Contested by Collin Butler (4.1 feet, MAN). Dirk Anunoby misses. Rebound secured by Paul DeRozan.

[01:18] Team_046 possession (Score: 64-44)
Chris LaVine attempts a Layup. Contested by Devin Simmons (4.2 feet, ZONE). Chris LaVine misses. Rebound secured by Devin Simmons.

[01:03] Team_036 possession (Score: 64-44)
Devin Simmons attempts a 3Pt. Heavily contested by Collin Butler (1.8 feet, ZONE)! DEVIN SIMMONS MAKES IT! Assist: Bradley Murray
Score: 67-44

[00:51] Team_046 possession (Score: 67-44)
Chris LaVine drives and kicks out. Paul DeRozan attempts a 3Pt. Contested by Tobias Fox (5.0 feet, ZONE). Paul DeRozan misses. Rebound secured by Devin Simmons.

[00:35] Team_036 possession (Score: 67-44)
Bradley Murray attempts a Layup. Contested by Chris LaVine (5.2 feet, ZONE). Bradley Murray misses. Rebound secured by Manu Dosunmu.

[00:25] Team_046 possession (Score: 67-44)
Chris LaVine drives to the basket... Chris LaVine throws a bad pass! Stolen by Devin Simmons! TURNOVER! (live ball)

[00:10] Team_036 possession (Score: 67-44)
Tobias Fox attempts a 3Pt. Contested by Collin Butler (3.3 feet, ZONE). Tobias Fox misses. Offensive rebound by Devin Simmons! Devin Simmons kicks it out.

================================================================================
                              2ND QUARTER COMPLETE                              
================================================================================

2ND QUARTER SCORE: Team_036 35, Team_046 20

BOX SCORE:
================================================================================

Team_036
--------------------------------------------------------------------------------
Player                MIN  PTS  REB  AST  TO      FG   FG%      3P   3P%
--------------------------------------------------------------------------------
Tobias Fox              7    8    0    1   0   3/4    75.0     0/0   0.0
Kobe Simmons           17    6    3    2   0   3/3   100.0     0/0   0.0
Terry Durant           17    5    1    0   0   2/2   100.0     0/0   0.0
Anthony Poole          17    3    0    1   0   1/1   100.0     0/0   0.0
Michael Westbrook      17    3    0    0   0   1/2    50.0     0/0   0.0
Pascal Antetokounmpo    7    3    1    0   0   1/1   100.0     0/0   0.0
Devin Simmons           7    3    5    1   0   1/2    50.0     0/0   0.0
Bradley Murray          7    2    2    2   0   1/2    50.0     0/0   0.0
Dirk Anunoby            7    2    0    0   0   1/4    25.0     0/0   0.0
Giannis Booker         17    0    2    1   0   0/1     0.0     0/0   0.0

TEAM: FG: 14/22 (63.6%), 3PT: 6/10 (60.0%), REB: 14 (3 off, 11 def), AST: 8, TO: 1
TEAM FOULS: 7 [Team_046 in BONUS]


Team_046
--------------------------------------------------------------------------------
Player                MIN  PTS  REB  AST  TO      FG   FG%      3P   3P%
--------------------------------------------------------------------------------
Paul DeRozan            7    4    2    0   0   2/4    50.0     0/0   0.0
Victor Nowitzki        17    3    0    1   0   1/3    33.3     0/0   0.0
Manu Dosunmu            7    3    1    1   0   1/1   100.0     0/0   0.0
Collin Butler           7    3    0    0   0   1/2    50.0     0/0   0.0
Kevin Allen            17    2    0    0   0   1/3    33.3     0/0   0.0
Chris LaVine            7    2    4    1   0   1/3    33.3     0/0   0.0
Josh Barrett            7    2    0    0   0   1/2    50.0     0/0   0.0
Lauri Carter           17    1    0    0   0   1/1   100.0     0/0   0.0
D'Angelo O'Neal        17    0    0    0   0   0/1     0.0     0/0   0.0
Cade Wall              17    0    2    0   0   0/0     0.0     0/0   0.0

TEAM: FG: 9/20 (45.0%), 3PT: 2/6 (33.3%), REB: 9 (1 off, 8 def), AST: 3, TO: 3
TEAM FOULS: 3

================================================================================

================================================================================
                       3RD QUARTER - Team_036 vs Team_046                       
================================================================================

[12:00] Team_036 possession (Score: 67-44)
Kobe Simmons drives, picks up Kevin Allen. Help arrives from D'Angelo O'Neal! Kobe Simmons attempts a Layup. Wide open! D'Angelo O'Neal is 7.5 feet away. [MAN] KOBE SIMMONS MAKES IT!
Score: 69-44

[11:46] Team_046 possession (Score: 69-44)
Kevin Allen attempts a Midrange. Wide open! Terry Durant is 6.3 feet away. [ZONE] Kevin Allen misses. Offensive rebound by Kevin Allen! Kevin Allen kicks it out.

[11:35] Team_046 possession (Score: 69-44)
Kevin Allen attempts a Layup. Heavily contested by Kobe Simmons (2.0 feet, ZONE)! KEVIN ALLEN MAKES IT!
Score: 69-46

[11:19] Team_036 possession (Score: 69-46)
Kobe Simmons makes the Layup and draws the foul on Kevin Allen! And-1! Kobe Simmons to the line for 1. [Team fouls: 1] (Kevin Allen: 1 personal fouls)   FT 1/1: GOOD Kobe Simmons makes 1/1 from the line.
Score: 72-46

[11:06] Team_046 possession (Score: 72-46)
FOUL! Offensive foul on Kevin Allen! Kobe Simmons drew the charge! [Team fouls: 2] (Kevin Allen: 2 personal fouls) TURNOVER! (dead ball)

[10:48] Team_036 possession (Score: 72-46)
Michael Westbrook drives, D'Angelo O'Neal stays with him. Michael Westbrook attempts a Layup. Wide open! D'Angelo O'Neal is 7.1 feet away. [MAN] Michael Westbrook misses. Rebound secured by Cade Wall.

[10:33] Team_046 possession (Score: 72-46)
Kevin Allen drives to the basket... Kevin Allen commits a violation (traveling/carry)! TURNOVER! (dead ball)

[10:16] Team_036 possession (Score: 72-46)
Kobe Simmons attempts a Midrange. Wide open! Victor Nowitzki is 7.8 feet away. [ZONE] Kobe Simmons misses. Rebound secured by Lauri Carter.

[10:01] Team_046 possession (Score: 72-46)
Victor Nowitzki attempts a 3Pt. Wide open! Michael Westbrook is 10.0 feet away. [ZONE] VICTOR NOWITZKI MAKES IT! Assist: Cade Wall
Score: 72-49

[09:47] Team_036 possession (Score: 72-49)
Giannis Booker loses the ball! Stripped by Victor Nowitzki! TURNOVER! (live ball)

[09:32] Team_046 possession (Score: 72-49)
Cade Wall attempts a Layup. Contested by Terry Durant (5.9 feet, MAN). CADE WALL MAKES IT! Assist: Lauri Carter
Score: 72-51

[09:17] Team_036 possession (Score: 72-51)
Michael Westbrook attempts a 3Pt. Contested by D'Angelo O'Neal (2.1 feet, MAN). MICHAEL WESTBROOK MAKES IT! Assist: Kobe Simmons
Score: 75-51

[09:04] Team_046 possession (Score: 75-51)
Lauri Carter drives to the basket... Lauri Carter throws a bad pass! Stolen by Kobe Simmons! TURNOVER! (live ball)

[08:50] Team_036 possession (Score: 75-51)
Giannis Booker drives, picks up Victor Nowitzki. Help arrives from Lauri Carter! Giannis Booker attempts a Dunk. Wide open! Lauri Carter is 7.1 feet away. [MAN] Giannis Booker misses. Offensive rebound by Kobe Simmons! Kobe Simmons puts it back in!
Score: 77-51

[08:37] Team_046 possession (Score: 77-51)
Kevin Allen attempts a Midrange. Wide open! Kobe Simmons is 7.2 feet away. [MAN] KEVIN ALLEN MAKES IT! Assist: Lauri Carter
Score: 77-53

[08:23] Team_036 possession (Score: 77-53)
Anthony Poole attempts a 3Pt. Contested by Lauri Carter (4.7 feet, MAN). Anthony Poole misses. FOUL! Loose ball foul on Lauri Carter during the rebound battle. [Team fouls: 3] No free throws, side out. (Lauri Carter: 1 personal fouls)

[08:14] Team_036 possession (Score: 77-53)
Giannis Booker drives to the basket... Giannis Booker throws a bad pass out of bounds! TURNOVER! (dead ball)

[07:59] Team_046 possession (Score: 77-53)
Victor Nowitzki makes the Layup and draws the foul on Anthony Poole! And-1! Victor Nowitzki to the line for 1. [Team fouls: 1] (Anthony Poole: 1 personal fouls)   FT 1/1: GOOD Victor Nowitzki makes 1/1 from the line.
Score: 77-56

[07:42] Team_036 possession (Score: 77-56)
Anthony Poole attempts a Layup. BLOCKED BY LAURI CARTER! Ball is loose! Offensive rebound by Kobe Simmons! Kobe Simmons kicks it out.

[07:29] Team_036 possession (Score: 77-56)
Terry Durant attempts a 3Pt. Contested by Lauri Carter (5.7 feet, ZONE). Terry Durant misses. Rebound secured by Cade Wall.

[07:14] Team_046 possession (Score: 77-56)
Victor Nowitzki attempts a Midrange. Contested by Terry Durant (3.8 feet, ZONE). Victor Nowitzki misses. Rebound secured by Giannis Booker.

[07:00] Team_036 possession (Score: 77-56)
Anthony Poole attempts a 3Pt. Wide open! Lauri Carter is 6.1 feet away. [MAN] Anthony Poole misses. FOUL! Loose ball foul on Lauri Carter during the rebound battle. [Team fouls: 4] No free throws, side out. (Lauri Carter: 2 personal fouls)

[06:47] Team_036 possession (Score: 77-56)
Kobe Simmons attempts a Layup. Wide open! Kevin Allen is 7.0 feet away. [ZONE] KOBE SIMMONS MAKES IT!
Score: 79-56

[06:33] Team_046 possession (Score: 79-56)
FOUL! Reach-in foul on Kobe Simmons during the drive. [Team fouls: 2] No free throws, side out. (Kobe Simmons: 1 personal fouls)

[06:19] Team_046 possession (Score: 79-56)
Victor Nowitzki attempts a Layup. Wide open! Giannis Booker is 7.4 feet away. [MAN] Victor Nowitzki misses. Rebound secured by Kobe Simmons.

[06:06] Team_036 possession (Score: 79-56)
Kobe Simmons attempts a Midrange. Contested by Kevin Allen (4.3 feet, MAN). Kobe Simmons misses. Rebound secured by Cade Wall.

[05:49] Team_046 possession (Score: 79-56)
Kevin Allen drives, picks up Kobe Simmons. Help arrives from Giannis Booker! Kevin Allen attempts a Layup. Wide open! Giannis Booker is 6.4 feet away. [MAN] Kevin Allen misses. Rebound secured by Giannis Booker.

[05:36] Team_036 possession (Score: 79-56)
Terry Durant attempts a 3Pt. Contested by Lauri Carter (3.1 feet, ZONE). Terry Durant misses. Rebound secured by Lauri Carter.

[05:17] Team_046 possession (Score: 79-56)
Kevin Allen drives, Kobe Simmons stays with him. Kevin Allen attempts a Layup. Contested by Kobe Simmons (2.5 feet, ZONE). Kevin Allen misses. Rebound secured by Terry Durant.

[05:02] Team_036 possession (Score: 79-56)
Giannis Booker drives, picks up Kevin Allen. Help arrives from D'Angelo O'Neal! Giannis Booker attempts a Layup. Heavily contested by D'Angelo O'Neal (1.1 feet, ZONE)! GIANNIS BOOKER MAKES IT! Assist: Anthony Poole
Score: 81-56

[04:48] Team_046 possession (Score: 81-56)
Kevin Allen drives to the basket... Kevin Allen loses the ball! Stripped by Kobe Simmons! TURNOVER! (live ball)

[04:34] Team_036 possession (Score: 81-56)
Kobe Simmons drives to the basket... Kobe Simmons throws a bad pass! Stolen by Kevin Allen! TURNOVER! (live ball)

[04:19] Team_046 possession (Score: 81-56)
Cade Wall drives, Kobe Simmons stays with him. Cade Wall attempts a Layup. Contested by Kobe Simmons (3.5 feet, ZONE). CADE WALL MAKES IT! Assist: Victor Nowitzki
Score: 81-58

[04:01] Team_036 possession (Score: 81-58)
Kobe Simmons drives, Kevin Allen stays with him. Kobe Simmons attempts a Layup. Wide open! Kevin Allen is 7.7 feet away. [MAN] KOBE SIMMONS MAKES IT! Assist: Giannis Booker
Score: 83-58

[03:44] Team_046 possession (Score: 83-58)
Victor Nowitzki attempts a Layup. Contested by Giannis Booker (3.4 feet, MAN). VICTOR NOWITZKI MAKES IT! Assist: Cade Wall
Score: 83-60

[03:33] Team_036 possession (Score: 83-60)
Kobe Simmons drives, picks up Kevin Allen. Help arrives from D'Angelo O'Neal! Kobe Simmons attempts a Dunk. Contested by D'Angelo O'Neal (5.1 feet, ZONE). KOBE SIMMONS MAKES IT! Assist: Michael Westbrook
Score: 85-60

[03:15] Team_046 possession (Score: 85-60)
Lauri Carter loses the ball! Stripped by Anthony Poole! TURNOVER! (live ball)

[03:01] Team_036 possession (Score: 85-60)
Michael Westbrook attempts a 3Pt. Contested by D'Angelo O'Neal (3.0 feet, MAN). Michael Westbrook misses. Rebound secured by Lauri Carter.

[02:43] Team_046 possession (Score: 85-60)
Lauri Carter attempts a 3Pt. Contested by Anthony Poole (3.2 feet, MAN). LAURI CARTER MAKES IT! Assist: Kevin Allen
Score: 85-63

[02:27] Team_036 possession (Score: 85-63)
Kobe Simmons drives, picks up Kevin Allen. Help arrives from D'Angelo O'Neal! Kobe Simmons attempts a Layup. Contested by D'Angelo O'Neal (4.6 feet, MAN). KOBE SIMMONS MAKES IT! Assist: Terry Durant
Score: 87-63

[02:13] Team_046 possession (Score: 87-63)
Kevin Allen makes the Layup and draws the foul on Kobe Simmons! And-1! Kevin Allen to the line for 1. [Team fouls: 3] (Kobe Simmons: 2 personal fouls)   FT 1/1: GOOD Kevin Allen makes 1/1 from the line.
Score: 87-66

[01:57] Team_036 possession (Score: 87-66)
Anthony Poole drives, Kevin Allen stays with him. Anthony Poole attempts a Dunk. Wide open! Kevin Allen is 8.9 feet away. [ZONE] ANTHONY POOLE MAKES IT! Assist: Michael Westbrook
Score: 89-66

[01:41] Team_046 possession (Score: 89-66)
Lauri Carter drives, Anthony Poole stays with him. Lauri Carter attempts a Dunk. Wide open! Anthony Poole is 7.2 feet away. [MAN] LAURI CARTER MAKES IT! Assist: D'Angelo O'Neal
Score: 89-68

[01:25] Team_036 possession (Score: 89-68)
Kobe Simmons attempts a 3Pt. Contested by Lauri Carter (4.3 feet, ZONE). Kobe Simmons misses. Rebound secured by Cade Wall.

[01:10] Team_046 possession (Score: 89-68)
Victor Nowitzki attempts a 3Pt. Wide open! Anthony Poole is 6.3 feet away. [ZONE] Victor Nowitzki misses. Rebound secured by Kobe Simmons.

[00:55] Team_036 possession (Score: 89-68)
Michael Westbrook attempts a 3Pt. Heavily contested by Lauri Carter (0.5 feet, ZONE)! Michael Westbrook misses. Rebound secured by Cade Wall.

[00:39] Team_046 possession (Score: 89-68)
Kevin Allen attempts a Layup. Wide open! Kobe Simmons is 7.0 feet away. [MAN] Kevin Allen misses. Rebound secured by Kobe Simmons.

[00:25] Team_036 possession (Score: 89-68)
Anthony Poole attempts a Midrange. Contested by Lauri Carter (4.2 feet, MAN). Anthony Poole misses. Rebound secured by Cade Wall.

[00:14] Team_046 possession (Score: 89-68)
FOUL! Reach-in foul on Kobe Simmons during the drive. [Team fouls: 4] No free throws, side out. (Kobe Simmons: 3 personal fouls)

================================================================================
                              3RD QUARTER COMPLETE                              
================================================================================

3RD QUARTER SCORE: Team_036 22, Team_046 24

BOX SCORE:
================================================================================

Team_036
--------------------------------------------------------------------------------
Player                MIN  PTS  REB  AST  TO      FG   FG%      3P   3P%
--------------------------------------------------------------------------------
Kobe Simmons           29   15    6    1   0   7/10   70.0     0/0   0.0
Michael Westbrook      29    3    0    2   0   1/4    25.0     0/0   0.0
Giannis Booker         29    2    2    1   0   1/1   100.0     0/0   0.0
Anthony Poole          29    2    0    1   0   1/2    50.0     0/0   0.0
Terry Durant           29    0    2    1   0   0/2     0.0     0/0   0.0

TEAM: FG: 10/19 (52.6%), 3PT: 1/6 (16.7%), REB: 10 (4 off, 6 def), AST: 6, TO: 3
TEAM FOULS: 4


Team_046
--------------------------------------------------------------------------------
Player                MIN  PTS  REB  AST  TO      FG   FG%      3P   3P%
--------------------------------------------------------------------------------
Victor Nowitzki        29    8    0    1   0   3/6    50.0     0/0   0.0
Kevin Allen            29    7    1    1   0   3/6    50.0     0/0   0.0
Lauri Carter           29    5    3    2   0   2/2   100.0     0/0   0.0
Cade Wall              29    4    6    2   0   2/2   100.0     0/0   0.0
D'Angelo O'Neal        29    0    0    1   0   0/0     0.0     0/0   0.0

TEAM: FG: 10/16 (62.5%), 3PT: 2/3 (66.7%), REB: 10 (1 off, 9 def), AST: 7, TO: 5
TEAM FOULS: 4

================================================================================

================================================================================
                       4TH QUARTER - Team_036 vs Team_046                       
================================================================================

[12:00] Team_036 possession (Score: 89-68)
Anthony Poole attempts a 3Pt. Contested by Lauri Carter (5.8 feet, MAN). Anthony Poole misses. FOUL! Loose ball foul on Cade Wall during the rebound battle. [Team fouls: 1] No free throws, side out. (Cade Wall: 1 personal fouls)

[11:48] Team_036 possession (Score: 89-68)
Michael Westbrook attempts a 3Pt. Contested by Lauri Carter (4.0 feet, ZONE). Michael Westbrook misses. Rebound secured by Kevin Allen.

[11:31] Team_046 possession (Score: 89-68)
Cade Wall attempts a 3Pt. Contested by Terry Durant (5.1 feet, MAN). Cade Wall misses. Rebound secured by Kobe Simmons.

[11:18] Team_036 possession (Score: 89-68)
Terry Durant attempts a 3Pt. Contested by Lauri Carter (3.2 feet, ZONE). TERRY DURANT MAKES IT!
Score: 92-68

[11:05] Team_046 possession (Score: 92-68)
FOUL! Shooting foul on Michael Westbrook. Lauri Carter to the line for 3 free throws. [Team fouls: 1] (Michael Westbrook: 1 personal fouls)   FT 1/3: GOOD   FT 2/3: GOOD   FT 3/3: GOOD Lauri Carter makes 3/3 from the line.
Score: 92-71

[10:48] Team_036 possession (Score: 92-71)
Terry Durant makes the Layup and draws the foul on Cade Wall! And-1! Terry Durant to the line for 1. [Team fouls: 2] (Cade Wall: 2 personal fouls)   FT 1/1: MISS Terry Durant makes 0/1 from the line. Rebound secured by Lauri Carter.
Score: 94-71

[10:31] Team_046 possession (Score: 94-71)
Kevin Allen attempts a Midrange. Heavily contested by Kobe Simmons (1.4 feet, MAN)! Kevin Allen misses. Offensive rebound by Cade Wall! Cade Wall kicks it out.

[10:15] Team_046 possession (Score: 94-71)
D'Angelo O'Neal drives to the basket... D'Angelo O'Neal throws a bad pass! Stolen by Kobe Simmons! TURNOVER! (live ball)

[10:02] Team_036 possession (Score: 94-71)
FOUL! Shooting foul on Cade Wall. Terry Durant to the line for 2 free throws. [Team fouls: 3] (Cade Wall: 3 personal fouls)   FT 1/2: MISS   FT 2/2: GOOD Terry Durant makes 1/2 from the line.
Score: 95-71

[09:47] Team_046 possession (Score: 95-71)
Kevin Allen attempts a Midrange. Contested by Kobe Simmons (2.0 feet, MAN). Kevin Allen misses. Rebound secured by Terry Durant.

[09:32] Team_036 possession (Score: 95-71)
Michael Westbrook attempts a 3Pt. Contested by D'Angelo O'Neal (4.0 feet, MAN). MICHAEL WESTBROOK MAKES IT! Assist: Terry Durant
Score: 98-71

[09:16] Team_046 possession (Score: 98-71)
Cade Wall attempts a Layup. Wide open! Terry Durant is 8.1 feet away. [MAN] CADE WALL MAKES IT! Assist: D'Angelo O'Neal
Score: 98-73

[09:01] Team_036 possession (Score: 98-73)
Kobe Simmons attempts a 3Pt. Heavily contested by Lauri Carter (0.5 feet, ZONE)! Kobe Simmons misses. Rebound secured by Lauri Carter.

[08:49] Team_046 possession (Score: 98-73)
Lauri Carter drives and kicks out. Kevin Allen attempts a 3Pt. Contested by Michael Westbrook (3.7 feet, ZONE). Kevin Allen misses. Rebound secured by Kobe Simmons.

[08:37] Team_036 possession (Score: 98-73)
Terry Durant loses the ball! Stripped by Cade Wall! TURNOVER! (live ball)

[08:21] Team_046 possession (Score: 98-73)
D'Angelo O'Neal drives, Michael Westbrook stays with him. D'Angelo O'Neal attempts a Layup. Wide open! Michael Westbrook is 9.2 feet away. [MAN] D'Angelo O'Neal misses. Rebound secured by Terry Durant.

[08:06] Team_036 possession (Score: 98-73)
Michael Westbrook drives and kicks out. Michael Westbrook attempts a 3Pt. Contested by Cade Wall (2.9 feet, ZONE). Michael Westbrook misses. Offensive rebound by Kobe Simmons! Kobe Simmons puts it back in!
Score: 100-73

[07:51] Team_046 possession (Score: 100-73)
D'Angelo O'Neal drives and kicks out. Lauri Carter attempts a Midrange. Contested by Anthony Poole (5.8 feet, ZONE). LAURI CARTER MAKES IT! Assist: Kevin Allen
Score: 100-75

[07:34] Team_036 possession (Score: 100-75)
Giannis Booker attempts a Layup. Wide open! Victor Nowitzki is 7.9 feet away. [MAN] Giannis Booker misses. Rebound secured by Kevin Allen.

[07:16] Team_046 possession (Score: 100-75)
Cade Wall drives and kicks out. Lauri Carter attempts a 3Pt. Contested by Anthony Poole (3.6 feet, MAN). LAURI CARTER MAKES IT! Assist: Kevin Allen
Score: 100-78

[07:03] Team_036 possession (Score: 100-78)
Anthony Poole drives to the basket... Anthony Poole throws a bad pass! Stolen by Kevin Allen! TURNOVER! (live ball)

[06:47] Team_046 possession (Score: 100-78)
Kevin Allen attempts a 3Pt. Wide open! Michael Westbrook is 6.1 feet away. [ZONE] Kevin Allen misses. Rebound secured by Giannis Booker.

[06:34] Team_036 possession (Score: 100-78)
Michael Westbrook attempts a 3Pt. Wide open! D'Angelo O'Neal is 6.4 feet away. [ZONE] Michael Westbrook misses. Rebound secured by Kevin Allen.

[06:19] Team_046 possession (Score: 100-78)
Lauri Carter attempts a Midrange. Wide open! Anthony Poole is 6.4 feet away. [MAN] LAURI CARTER MAKES IT! Assist: Cade Wall
Score: 100-80

[06:06] Team_036 possession (Score: 100-80)
Anthony Poole attempts a 3Pt. Contested by Lauri Carter (5.2 feet, MAN). Anthony Poole misses. Offensive rebound by Kobe Simmons! Kobe Simmons puts it back in!
Score: 102-80

[05:50] Team_046 possession (Score: 102-80)
Victor Nowitzki attempts a 3Pt. Contested by Giannis Booker (5.8 feet, MAN). Victor Nowitzki misses. Rebound secured by Giannis Booker.

[05:36] Team_036 possession (Score: 102-80)
Terry Durant drives, Cade Wall stays with him. Terry Durant attempts a Dunk. Wide open! Cade Wall is 6.4 feet away. [MAN] Terry Durant misses. Offensive rebound by Terry Durant! Terry Durant kicks it out.

[05:24] Team_036 possession (Score: 102-80)
Terry Durant loses control! Ball rolls out of bounds! TURNOVER! (dead ball)

[05:24] Substitution (Team_036): Michael Westbrook OUT → Dirk Anunoby IN (stamina_rule2)

[05:24] Substitution (Team_036): Giannis Booker OUT → Tobias Fox IN (stamina_rule2)

[05:24] Substitution (Team_036): Anthony Poole OUT → Pascal Antetokounmpo IN (stamina_rule2)

[05:24] Substitution (Team_036): Terry Durant OUT → Devin Simmons IN (stamina_rule2)

[05:24] Substitution (Team_036): Kobe Simmons OUT → Bradley Murray IN (stamina_rule2)

[05:24] Substitution (Team_046): D'Angelo O'Neal OUT → Collin Butler IN (stamina_rule2)

[05:24] Substitution (Team_046): Victor Nowitzki OUT → Manu Dosunmu IN (stamina_rule2)

[05:24] Substitution (Team_046): Lauri Carter OUT → Josh Barrett IN (stamina_rule2)

[05:24] Substitution (Team_046): Cade Wall OUT → Chris LaVine IN (stamina_rule2)

[05:24] Substitution (Team_046): Kevin Allen OUT → Paul DeRozan IN (stamina_rule2)

[05:07] Team_046 possession (Score: 102-80)
Paul DeRozan attempts a Midrange. Contested by Pascal Antetokounmpo (5.7 feet, ZONE). Paul DeRozan misses. Rebound secured by Devin Simmons.

[04:57] Team_036 possession (Score: 102-80)
Dirk Anunoby attempts a Midrange. Contested by Collin Butler (3.7 feet, MAN). Dirk Anunoby misses. Offensive rebound by Bradley Murray! Bradley Murray kicks it out.

[04:43] Team_036 possession (Score: 102-80)
Bradley Murray makes the Layup and draws the foul on Chris LaVine! And-1! Bradley Murray to the line for 1. [Team fouls: 4] (Chris LaVine: 1 personal fouls)   FT 1/1: GOOD Bradley Murray makes 1/1 from the line.
Score: 105-80

[04:29] Team_046 possession (Score: 105-80)
Josh Barrett drives, picks up Pascal Antetokounmpo. Help arrives from Dirk Anunoby! Josh Barrett attempts a Dunk. Contested by Dirk Anunoby (3.5 feet, MAN). JOSH BARRETT MAKES IT! Assist: Chris LaVine
Score: 105-82

[04:18] Team_036 possession (Score: 105-82)
Devin Simmons drives and kicks out. Devin Simmons attempts a Midrange. Contested by Chris LaVine (3.5 feet, MAN). DEVIN SIMMONS MAKES IT! Assist: Tobias Fox
Score: 107-82

[04:06] Team_046 possession (Score: 107-82)
Paul DeRozan attempts a 3Pt. Contested by Pascal Antetokounmpo (5.7 feet, ZONE). Paul DeRozan misses. FOUL! Loose ball foul on Pascal Antetokounmpo during the rebound battle. [Team fouls: 2] No free throws, side out. (Pascal Antetokounmpo: 1 personal fouls)

[03:51] Team_046 possession (Score: 107-82)
Chris LaVine drives, picks up Devin Simmons. Help arrives from Dirk Anunoby! Chris LaVine attempts a Dunk. Contested by Dirk Anunoby (5.0 feet, MAN). CHRIS LAVINE MAKES IT! Assist: Josh Barrett
Score: 107-84

[03:39] Team_036 possession (Score: 107-84)
Devin Simmons drives, picks up Chris LaVine. Help arrives from Manu Dosunmu! Devin Simmons attempts a Dunk. Wide open! Manu Dosunmu is 6.1 feet away. [ZONE] Devin Simmons misses. FOUL! Loose ball foul on Manu Dosunmu during the rebound battle. [IN THE BONUS! 5 team fouls] Bradley Murray to the line for 2 free throws. (Manu Dosunmu: 1 personal fouls)   FT 1/2: GOOD   FT 2/2: MISS Bradley Murray makes 1/2 from the line. Rebound secured by Chris LaVine.
Score: 108-84

[03:29] Team_046 possession (Score: 108-84)
Collin Butler drives, Dirk Anunoby stays with him. Collin Butler attempts a Dunk. Contested by Dirk Anunoby (4.2 feet, MAN). Collin Butler misses. Rebound secured by Bradley Murray.

[03:11] Team_036 possession (Score: 108-84)
Devin Simmons attempts a Layup. Contested by Chris LaVine (4.9 feet, MAN). DEVIN SIMMONS MAKES IT! Assist: Pascal Antetokounmpo
Score: 110-84

[02:55] Team_046 possession (Score: 110-84)
FOUL! Shooting foul on Devin Simmons. Paul DeRozan to the line for 2 free throws. [Team fouls: 3] (Devin Simmons: 1 personal fouls)   FT 1/2: GOOD   FT 2/2: GOOD Paul DeRozan makes 2/2 from the line.
Score: 110-86

[02:44] Team_036 possession (Score: 110-86)
Devin Simmons attempts a 3Pt. Heavily contested by Chris LaVine (0.5 feet, MAN)! Devin Simmons misses. Rebound secured by Paul DeRozan.

[02:28] Team_046 possession (Score: 110-86)
Josh Barrett drives, Devin Simmons stays with him. Josh Barrett attempts a Layup. Contested by Devin Simmons (3.9 feet, ZONE). JOSH BARRETT MAKES IT! Assist: Chris LaVine
Score: 110-88

[02:15] Team_036 possession (Score: 110-88)
Tobias Fox drives and kicks out. Dirk Anunoby makes the Midrange and draws the foul on Collin Butler! And-1! Dirk Anunoby to the line for 1. [BONUS: 6 team fouls] (Collin Butler: 1 personal fouls)   FT 1/1: GOOD Dirk Anunoby makes 1/1 from the line.
Score: 113-88

[02:02] Team_046 possession (Score: 113-88)
Chris LaVine drives, picks up Devin Simmons. Help arrives from Dirk Anunoby! Chris LaVine attempts a Dunk. Wide open! Dirk Anunoby is 7.5 feet away. [ZONE] Chris LaVine misses. Rebound secured by Bradley Murray.

[01:45] Team_036 possession (Score: 113-88)
Bradley Murray throws a bad pass out of bounds! TURNOVER! (dead ball)

[01:31] Team_046 possession (Score: 113-88)
Chris LaVine makes the 3Pt and draws the foul on Tobias Fox! And-1! Chris LaVine to the line for 1. [Team fouls: 4] (Tobias Fox: 1 personal fouls)   FT 1/1: MISS Chris LaVine makes 0/1 from the line. Rebound secured by Devin Simmons.
Score: 113-91

[01:14] Team_036 possession (Score: 113-91)
Dirk Anunoby drives and kicks out. Devin Simmons attempts a 3Pt. Contested by Collin Butler (5.5 feet, ZONE). Devin Simmons misses. Offensive rebound by Bradley Murray! Bradley Murray kicks it out.

[00:59] Team_036 possession (Score: 113-91)
Bradley Murray attempts a 3Pt. Wide open! Chris LaVine is 6.7 feet away. [MAN] BRADLEY MURRAY MAKES IT! Assist: Tobias Fox
Score: 116-91

[00:45] Team_046 possession (Score: 116-91)
Chris LaVine attempts a Layup. Contested by Devin Simmons (2.8 feet, ZONE). CHRIS LAVINE MAKES IT! Assist: Paul DeRozan
Score: 116-93

[00:32] Team_036 possession (Score: 116-93)
Pascal Antetokounmpo attempts a 3Pt. Wide open! Collin Butler is 8.3 feet away. [ZONE] Pascal Antetokounmpo misses. Rebound secured by Manu Dosunmu.

[00:15] Team_046 possession (Score: 116-93)
Manu Dosunmu attempts a 3Pt. Wide open! Tobias Fox is 7.3 feet away. [ZONE] MANU DOSUNMU MAKES IT! Assist: Collin Butler
Score: 116-96

================================================================================
                              4TH QUARTER COMPLETE                              
================================================================================

4TH QUARTER SCORE: Team_036 27, Team_046 28

BOX SCORE:
================================================================================

Team_036
--------------------------------------------------------------------------------
Player                MIN  PTS  REB  AST  TO      FG   FG%      3P   3P%
--------------------------------------------------------------------------------
Bradley Murray         13    6    4    0   0   2/2   100.0     0/0   0.0
Kobe Simmons           36    4    5    0   0   2/3    66.7     0/0   0.0
Terry Durant           36    4    3    1   0   2/3    66.7     0/0   0.0
Devin Simmons          13    4    2    0   0   2/4    50.0     0/0   0.0
Michael Westbrook      36    3    0    0   0   1/3    33.3     0/0   0.0
Dirk Anunoby           13    3    0    0   0   1/1   100.0     0/0   0.0
Giannis Booker         36    0    2    0   0   0/1     0.0     0/0   0.0
Tobias Fox             13    0    0    2   0   0/0     0.0     0/0   0.0
Pascal Antetokounmpo   13    0    0    1   0   0/1     0.0     0/0   0.0

TEAM: FG: 10/18 (55.6%), 3PT: 4/9 (44.4%), REB: 17 (7 off, 10 def), AST: 4, TO: 4
TEAM FOULS: 4


Team_046
--------------------------------------------------------------------------------
Player                MIN  PTS  REB  AST  TO      FG   FG%      3P   3P%
--------------------------------------------------------------------------------
Lauri Carter           36   10    2    0   0   4/5    80.0     0/0   0.0
Josh Barrett           13    4    0    1   0   2/2   100.0     0/0   0.0
Chris LaVine           13    4    2    2   0   2/4    50.0     0/0   0.0
Manu Dosunmu           13    3    1    0   0   1/1   100.0     0/0   0.0
Cade Wall              36    2    1    1   0   1/2    50.0     0/0   0.0
Paul DeRozan           13    2    1    1   0   1/2    50.0     0/0   0.0
Kevin Allen            36    0    3    2   0   0/2     0.0     0/0   0.0
D'Angelo O'Neal        36    0    0    1   0   0/1     0.0     0/0   0.0
Victor Nowitzki        36    0    0    0   0   0/1     0.0     0/0   0.0
Collin Butler          13    0    0    1   0   0/1     0.0     0/0   0.0

TEAM: FG: 11/21 (52.4%), 3PT: 2/6 (33.3%), REB: 9 (2 off, 7 def), AST: 9, TO: 1
TEAM FOULS: 6 [Team_036 in BONUS]

================================================================================

================================================================================
                               FULL GAME COMPLETE                               
================================================================================

FINAL SCORE: Team_036 116, Team_046 96

SCORING BY QUARTER:
--------------------------------------------------------------------------------
Team                     Q1     Q2     Q3     Q4    FINAL
--------------------------------------------------------------------------------
Team_036                 32     35     22     27      116
Team_046                 24     20     24     28       96
--------------------------------------------------------------------------------

FULL GAME BOX SCORE:
================================================================================

Team_036
--------------------------------------------------------------------------------
Player                MIN  PTS  REB  AST  TO      FG   FG%      3P   3P%      FT STL BLK
--------------------------------------------------------------------------------
Michael Westbrook      36   12    0    6   1   6/13   46.2   4/8    50.0   1/1     0   0
Giannis Booker         36    5    8    3   2   3/9    33.3   1/3    33.3   0/0     0   2
Anthony Poole          36   11    0    4   0   6/8    75.0   1/1   100.0   1/1     1   0
Terry Durant           36   20    9    2   3   9/12   75.0   3/5    60.0   1/3     0   0
Kobe Simmons           36   34   18    3   2  12/17   70.6   0/2     0.0   4/4     6   2
Dirk Anunoby           13    5    0    0   0   1/4    25.0   0/3     0.0   1/1     0   0
Tobias Fox             13    8    0    3   0   4/5    80.0   1/1   100.0   0/0     0   0
Pascal Antetokounmpo   13    3    1    1   0   1/2    50.0   1/2    50.0   0/0     0   0
Devin Simmons          13    7    7    1   0   3/6    50.0   1/2    50.0   0/0     1   0
Bradley Murray         13    8    6    2   1   3/4    75.0   1/1   100.0   2/3     0   0

TEAM: FG: 48/80 (60.0%), 3PT: 13/28 (46.4%), REB: 50 (15 off, 35 def), AST: 25, TO: 9


Team_046
--------------------------------------------------------------------------------
Player                MIN  PTS  REB  AST  TO      FG   FG%      3P   3P%      FT STL BLK
--------------------------------------------------------------------------------
D'Angelo O'Neal        36   10    0    2   1   5/10   50.0   1/3    33.3   4/5     0   0
Victor Nowitzki        36   13    0    3   0   5/13   38.5   1/5    20.0   2/2     1   0
Lauri Carter           36   16    9    2   2   6/9    66.7   3/4    75.0   4/5     0   1
Cade Wall              36    9   13    4   1   5/6    83.3   0/1     0.0   3/3     1   1
Kevin Allen            36   17    5    4   5   8/17   47.1   0/1     0.0   3/5     3   0
Collin Butler          13    3    0    1   1   1/3    33.3   1/1   100.0   0/0     0   0
Manu Dosunmu           13    6    2    1   0   2/2   100.0   2/2   100.0   3/3     0   0
Josh Barrett           13    6    0    1   0   3/4    75.0   0/0     0.0   0/0     0   0
Chris LaVine           13    6    6    3   1   2/6    33.3   0/1     0.0   2/3     0   0
Paul DeRozan           13    6    3    1   0   4/7    57.1   0/2     0.0   4/4     0   0

TEAM: FG: 41/77 (53.2%), 3PT: 8/20 (40.0%), REB: 37 (6 off, 31 def), AST: 22, TO: 11

================================================================================
