================================================================================
                        FULL GAME - Team_039 vs Team_027                        
================================================================================

================================================================================
                       1ST QUARTER - Team_039 vs Team_027                       
================================================================================

[12:00] Team_039 possession (Score: 0-0)
Donovan Markkanen attempts a Midrange. Wide open! Tony Doncic is 6.3 feet away. [MAN] DONOVAN MARKKANEN MAKES IT!
Score: 2-0

[11:43] Team_027 possession (Score: 2-0)
Tim Johnson attempts a 3Pt. Contested by Jrue Bridges (4.5 feet, MAN). TIM JOHNSON MAKES IT! Assist: Scottie Harden
Score: 2-3

[11:28] Team_039 possession (Score: 2-3)
Donovan Markkanen attempts a Midrange. Contested by Tony Doncic (5.1 feet, MAN). Donovan Markkanen misses. Rebound secured by Bradley Dosunmu.

[11:14] Team_027 possession (Score: 2-3)
Tony Doncic attempts a 3Pt. Contested by Donovan Markkanen (5.6 feet, MAN). Tony Doncic misses. Rebound secured by Donovan Markkanen.

[11:00] Team_039 possession (Score: 2-3)
Austin O'Neal attempts a Layup. Heavily contested by John Russell (1.2 feet, ZONE)! Austin O'Neal misses. Rebound secured by John Russell.

[10:48] Team_027 possession (Score: 2-3)
Bradley Dosunmu drives, picks up Klay Wade. Help arrives from Donovan Markkanen! Bradley Dosunmu attempts a Dunk. Contested by Donovan Markkanen (5.1 feet, ZONE). BRADLEY DOSUNMU MAKES IT! Assist: Scottie Harden
Score: 2-5

[10:30] Team_039 possession (Score: 2-5)
Austin O'Neal drives, Scottie Harden stays with him. Austin O'Neal attempts a Layup. Contested by Scottie Harden (3.7 feet, MAN). AUSTIN O'NEAL MAKES IT! Assist: Klay Wade
Score: 4-5

[10:19] Team_027 possession (Score: 4-5)
Scottie Harden attempts a Midrange. Contested by Austin O'Neal (2.0 feet, MAN). Scottie Harden misses. Rebound secured by Klay Wade.

[10:05] Team_039 possession (Score: 4-5)
Klay Wade drives, John Russell stays with him. Klay Wade attempts a Layup. Contested by John Russell (5.6 feet, ZONE). KLAY WADE MAKES IT!
Score: 6-5

[09:52] Team_027 possession (Score: 6-5)
FOUL! Shooting foul on Austin O'Neal. Scottie Harden to the line for 2 free throws. [Team fouls: 1] (Austin O'Neal: 1 personal fouls)   FT 1/2: GOOD   FT 2/2: MISS Scottie Harden makes 1/2 from the line. Offensive rebound by Bradley Dosunmu! Bradley Dosunmu kicks it out.
Score: 6-6

[09:39] Team_027 possession (Score: 6-6)
Bradley Dosunmu drives to the basket... FOUL! Offensive foul on Bradley Dosunmu! Klay Wade drew the charge! [Team fouls: 1] (Bradley Dosunmu: 1 personal fouls) TURNOVER! (dead ball)

[09:27] Team_039 possession (Score: 6-6)
Donovan Markkanen attempts a Midrange. Contested by Bradley Dosunmu (3.9 feet, ZONE). Donovan Markkanen misses. Rebound secured by Tony Doncic.

[09:11] Team_027 possession (Score: 6-6)
Scottie Harden attempts a Layup. Contested by Austin O'Neal (4.0 feet, MAN). SCOTTIE HARDEN MAKES IT! Assist: Bradley Dosunmu
Score: 6-8

[09:00] Team_039 possession (Score: 6-8)
Austin O'Neal attempts a 3Pt. Heavily contested by Scottie Harden (1.0 feet, MAN)! AUSTIN O'NEAL MAKES IT! Assist: Klay Wade
Score: 9-8

[08:47] Team_027 possession (Score: 9-8)
Scottie Harden drives and kicks out. Tim Johnson attempts a 3Pt. Contested by Jrue Bridges (5.3 feet, MAN). Tim Johnson misses. Rebound secured by Klay Wade.

[08:35] Team_039 possession (Score: 9-8)
FOUL! Shooting foul on John Russell. Klay Wade to the line for 2 free throws. [Team fouls: 2] (John Russell: 1 personal fouls)   FT 1/2: GOOD   FT 2/2: GOOD Klay Wade makes 2/2 from the line.
Score: 11-8

[08:18] Team_027 possession (Score: 11-8)
Bradley Dosunmu attempts a Midrange. Wide open! Anfernee Carter is 7.8 feet away. [ZONE] BRADLEY DOSUNMU MAKES IT!
Score: 11-10

[08:00] Team_039 possession (Score: 11-10)
Jrue Bridges attempts a 3Pt. Wide open! Tim Johnson is 6.5 feet away. [MAN] Jrue Bridges misses. Rebound secured by Bradley Dosunmu.

[07:49] Team_027 possession (Score: 11-10)
Bradley Dosunmu attempts a Layup. BLOCKED BY KLAY WADE! Ball goes out off Klay Wade. Bradley Dosunmu's ball!

[07:38] Team_027 possession (Score: 11-10)
Tim Johnson attempts a 3Pt. Contested by Jrue Bridges (2.8 feet, ZONE). TIM JOHNSON MAKES IT! Assist: John Russell
Score: 11-13

[07:25] Team_039 possession (Score: 11-13)
Jrue Bridges attempts a 3Pt. Wide open! Tim Johnson is 7.3 feet away. [MAN] Jrue Bridges misses. Rebound secured by Tony Doncic.

[07:13] Team_027 possession (Score: 11-13)
John Russell drives and kicks out. FOUL! Shooting foul on Klay Wade. Bradley Dosunmu to the line for 2 free throws. [Team fouls: 2] (Klay Wade: 1 personal fouls)   FT 1/2: GOOD   FT 2/2: GOOD Bradley Dosunmu makes 2/2 from the line.
Score: 11-15

[06:57] Team_039 possession (Score: 11-15)
Austin O'Neal attempts a 3Pt. Contested by Tim Johnson (2.4 feet, ZONE). AUSTIN O'NEAL MAKES IT! Assist: Jrue Bridges
Score: 14-15

[06:43] Team_027 possession (Score: 14-15)
Scottie Harden attempts a 3Pt. Contested by Jrue Bridges (3.8 feet, ZONE). Scottie Harden misses. Rebound secured by Klay Wade.

[06:29] Team_039 possession (Score: 14-15)
Donovan Markkanen attempts a Layup. Wide open! Bradley Dosunmu is 6.5 feet away. [ZONE] DONOVAN MARKKANEN MAKES IT! Assist: Anfernee Carter
Score: 16-15

[06:11] Team_027 possession (Score: 16-15)
Bradley Dosunmu attempts a Midrange. Contested by Klay Wade (4.9 feet, MAN). BRADLEY DOSUNMU MAKES IT!
Score: 16-17

[05:54] Team_039 possession (Score: 16-17)
Klay Wade commits a violation (traveling/carry)! TURNOVER! (dead ball)

[05:41] Team_027 possession (Score: 16-17)
Tony Doncic attempts a Layup. BLOCKED BY KLAY WADE! Ball is loose! Rebound secured by Donovan Markkanen.

[05:30] Team_039 possession (Score: 16-17)
FOUL! Holding foul on Bradley Dosunmu. [Team fouls: 3] No free throws, side out. (Bradley Dosunmu: 2 personal fouls)

[05:16] Team_039 possession (Score: 16-17)
Donovan Markkanen attempts a Midrange. Contested by Tony Doncic (5.0 feet, MAN). DONOVAN MARKKANEN MAKES IT!
Score: 18-17

[05:01] Team_027 possession (Score: 18-17)
Bradley Dosunmu attempts a Midrange. Contested by Klay Wade (4.1 feet, MAN). BRADLEY DOSUNMU MAKES IT! Assist: Scottie Harden
Score: 18-19

[04:51] Team_039 possession (Score: 18-19)
Austin O'Neal attempts a Layup. Contested by Scottie Harden (3.6 feet, MAN). Austin O'Neal misses. Rebound secured by Tony Doncic.

[04:34] Team_027 possession (Score: 18-19)
Tim Johnson attempts a 3Pt. Contested by Jrue Bridges (2.2 feet, ZONE). Tim Johnson misses. Offensive rebound by Bradley Dosunmu! Bradley Dosunmu kicks it out.

[04:21] Team_027 possession (Score: 18-19)
Bradley Dosunmu attempts a Midrange. Wide open! Anfernee Carter is 6.0 feet away. [ZONE] BRADLEY DOSUNMU MAKES IT! Assist: Tony Doncic
Score: 18-21

[04:05] Team_039 possession (Score: 18-21)
Jrue Bridges makes the Dunk and draws the foul on Tony Doncic! And-1! Jrue Bridges to the line for 1. [Team fouls: 4] (Tony Doncic: 1 personal fouls)   FT 1/1: GOOD Jrue Bridges makes 1/1 from the line.
Score: 21-21

[03:53] Team_027 possession (Score: 21-21)
John Russell attempts a Midrange. Wide open! Anfernee Carter is 10.0 feet away. [ZONE] JOHN RUSSELL MAKES IT! Assist: Bradley Dosunmu
Score: 21-23

[03:39] Team_039 possession (Score: 21-23)
Anfernee Carter drives, Bradley Dosunmu stays with him. Anfernee Carter attempts a Layup. Wide open! Bradley Dosunmu is 6.4 feet away. [MAN] ANFERNEE CARTER MAKES IT! Assist: Klay Wade
Score: 23-23

[03:26] Team_027 possession (Score: 23-23)
Scottie Harden attempts a Midrange. Wide open! Austin O'Neal is 7.8 feet away. [MAN] Scottie Harden misses. Rebound secured by Klay Wade.

[03:09] Team_039 possession (Score: 23-23)
Donovan Markkanen drives, John Russell stays with him. Donovan Markkanen attempts a Dunk. Contested by John Russell (5.5 feet, ZONE). Donovan Markkanen misses. Rebound secured by Tony Doncic.

[02:54] Team_027 possession (Score: 23-23)
Bradley Dosunmu drives and kicks out. Scottie Harden attempts a Midrange. Wide open! Anfernee Carter is 6.7 feet away. [ZONE] SCOTTIE HARDEN MAKES IT!
Score: 23-25

[02:39] Team_039 possession (Score: 23-25)
Jrue Bridges drives to the basket... Jrue Bridges loses the ball! Stripped by John Russell! TURNOVER! (live ball)

[02:28] Team_027 possession (Score: 23-25)
Tony Doncic attempts a 3Pt. Wide open! Jrue Bridges is 6.0 feet away. [ZONE] Tony Doncic misses. Rebound secured by Donovan Markkanen.

[02:11] Team_039 possession (Score: 23-25)
Klay Wade attempts a Layup. Contested by John Russell (2.4 feet, MAN). KLAY WADE MAKES IT!
Score: 25-25

[01:56] Team_027 possession (Score: 25-25)
Tony Doncic drives and kicks out. Bradley Dosunmu attempts a Midrange. Contested by Austin O'Neal (5.1 feet, ZONE). BRADLEY DOSUNMU MAKES IT!
Score: 25-27

[01:44] Team_039 possession (Score: 25-27)
Austin O'Neal drives, John Russell stays with him. Austin O'Neal attempts a Layup. Contested by John Russell (2.2 feet, ZONE). Austin O'Neal misses. Offensive rebound by Austin O'Neal! Austin O'Neal kicks it out.

[01:29] Team_039 possession (Score: 25-27)
Klay Wade drives, John Russell stays with him. Klay Wade attempts a Dunk. Contested by John Russell (2.4 feet, MAN). KLAY WADE MAKES IT!
Score: 27-27

[01:16] Team_027 possession (Score: 27-27)
Scottie Harden attempts a Midrange. Wide open! Austin O'Neal is 6.2 feet away. [MAN] Scottie Harden misses. Rebound secured by Donovan Markkanen.

[01:04] Team_039 possession (Score: 27-27)
Austin O'Neal attempts a Layup. Contested by John Russell (3.5 feet, ZONE). Austin O'Neal misses. Rebound secured by Tony Doncic.

[00:50] Team_027 possession (Score: 27-27)
John Russell attempts a 3Pt. Contested by Austin O'Neal (5.4 feet, ZONE). JOHN RUSSELL MAKES IT! Assist: Scottie Harden
Score: 27-30

[00:34] Team_039 possession (Score: 27-30)
Austin O'Neal attempts a 3Pt. Contested by Scottie Harden (2.9 feet, MAN). Austin O'Neal misses. Offensive rebound by Klay Wade! Klay Wade kicks it out.

[00:21] Team_039 possession (Score: 27-30)
Jrue Bridges attempts a 3Pt. Wide open! Tim Johnson is 8.5 feet away. [ZONE] Jrue Bridges misses. Offensive rebound by Klay Wade! Klay Wade kicks it out.

[00:05] Team_039 possession (Score: 27-30)
Klay Wade attempts a Layup. BLOCKED BY JOHN RUSSELL! Ball is loose! Rebound secured by Tony Doncic.

================================================================================
                              1ST QUARTER COMPLETE                              
================================================================================

1ST QUARTER SCORE: Team_039 27, Team_027 30

BOX SCORE:
================================================================================

Team_039
--------------------------------------------------------------------------------
Player                MIN  PTS  REB  AST  TO      FG   FG%      3P   3P%
--------------------------------------------------------------------------------
Austin O'Neal          12    8    1    0   0   3/6    50.0     0/0   0.0
Klay Wade              12    8    6    3   0   4/5    80.0     0/0   0.0
Donovan Markkanen      12    6    4    0   0   3/6    50.0     0/0   0.0
Jrue Bridges           12    3    0    1   0   1/3    33.3     0/0   0.0
Anfernee Carter        12    2    0    1   0   1/1   100.0     0/0   0.0

TEAM: FG: 12/21 (57.1%), 3PT: 2/4 (50.0%), REB: 11 (3 off, 8 def), AST: 5, TO: 2
TEAM FOULS: 2


Team_027
--------------------------------------------------------------------------------
Player                MIN  PTS  REB  AST  TO      FG   FG%      3P   3P%
--------------------------------------------------------------------------------
Bradley Dosunmu        12   14    4    2   0   7/7   100.0     0/0   0.0
Tim Johnson            12    6    0    0   0   2/2   100.0     0/0   0.0
John Russell           12    5    1    1   0   2/2   100.0     0/0   0.0
Scottie Harden         12    4    0    4   0   2/7    28.6     0/0   0.0
Tony Doncic            12    0    6    1   0   0/3     0.0     0/0   0.0

TEAM: FG: 13/21 (61.9%), 3PT: 3/6 (50.0%), REB: 11 (2 off, 9 def), AST: 8, TO: 1
TEAM FOULS: 4

================================================================================

================================================================================
                       2ND QUARTER - Team_039 vs Team_027                       
================================================================================

[12:00] Team_039 possession (Score: 27-30)
Anfernee Carter attempts a Layup. Wide open! John Russell is 6.2 feet away. [ZONE] ANFERNEE CARTER MAKES IT!
Score: 29-30

[11:49] Team_027 possession (Score: 29-30)
Scottie Harden attempts a Layup. Contested by Austin O'Neal (4.7 feet, MAN). SCOTTIE HARDEN MAKES IT! Assist: Tim Johnson
Score: 29-32

[11:33] Team_039 possession (Score: 29-32)
Jrue Bridges drives, picks up Tim Johnson. Help arrives from Tony Doncic! Jrue Bridges attempts a Layup. Contested by Tony Doncic (4.8 feet, MAN). Jrue Bridges misses. Rebound secured by Tony Doncic.

[11:17] Team_027 possession (Score: 29-32)
Scottie Harden attempts a 3Pt. Contested by Jrue Bridges (3.9 feet, ZONE). SCOTTIE HARDEN MAKES IT! Assist: Tony Doncic
Score: 29-35

[11:02] Team_039 possession (Score: 29-35)
FOUL! Reach-in foul on John Russell during the drive. [Team fouls: 1] No free throws, side out. (John Russell: 1 personal fouls)

[10:49] Team_039 possession (Score: 29-35)
Austin O'Neal drives and kicks out. Jrue Bridges attempts a 3Pt. Wide open! Tim Johnson is 9.2 feet away. [MAN] Jrue Bridges misses. Offensive rebound by Austin O'Neal! Austin O'Neal kicks it out.

[10:33] Team_039 possession (Score: 29-35)
Klay Wade drives, John Russell stays with him. Klay Wade attempts a Layup. Wide open! John Russell is 6.1 feet away. [ZONE] KLAY WADE MAKES IT! Assist: Donovan Markkanen
Score: 31-35

[10:18] Team_027 possession (Score: 31-35)
John Russell makes the Layup and draws the foul on Klay Wade! And-1! John Russell to the line for 1. [Team fouls: 1] (Klay Wade: 1 personal fouls)   FT 1/1: MISS John Russell makes 0/1 from the line. Rebound secured by Klay Wade.
Score: 31-37

[10:03] Team_039 possession (Score: 31-37)
Klay Wade drives and kicks out. Austin O'Neal attempts a 3Pt. Contested by Scottie Harden (5.0 feet, MAN). AUSTIN O'NEAL MAKES IT! Assist: Anfernee Carter
Score: 34-37

[09:52] Team_027 possession (Score: 34-37)
FOUL! Reach-in foul on Klay Wade during the drive. [Team fouls: 2] No free throws, side out. (Klay Wade: 2 personal fouls)

[09:39] Team_027 possession (Score: 34-37)
John Russell attempts a Midrange. Contested by Donovan Markkanen (4.7 feet, ZONE). JOHN RUSSELL MAKES IT! Assist: Bradley Dosunmu
Score: 34-39

[09:24] Team_039 possession (Score: 34-39)
Anfernee Carter attempts a Midrange. Contested by Tony Doncic (3.6 feet, ZONE). ANFERNEE CARTER MAKES IT!
Score: 36-39

[09:10] Team_027 possession (Score: 36-39)
Scottie Harden attempts a Layup. Contested by Austin O'Neal (2.2 feet, MAN). SCOTTIE HARDEN MAKES IT!
Score: 36-41

[08:52] Team_039 possession (Score: 36-41)
Austin O'Neal attempts a Midrange. Contested by Bradley Dosunmu (4.9 feet, ZONE). Austin O'Neal misses. Offensive rebound by Klay Wade! Klay Wade kicks it out.

[08:42] Team_039 possession (Score: 36-41)
Austin O'Neal drives and kicks out. Jrue Bridges attempts a 3Pt. Contested by Tim Johnson (4.3 feet, MAN). Jrue Bridges misses. Rebound secured by John Russell.

[08:27] Team_027 possession (Score: 36-41)
Bradley Dosunmu attempts a 3Pt. Contested by Jrue Bridges (2.5 feet, ZONE). Bradley Dosunmu misses. Offensive rebound by Bradley Dosunmu! Bradley Dosunmu kicks it out.

[08:11] Team_027 possession (Score: 36-41)
Scottie Harden attempts a Midrange. Wide open! Austin O'Neal is 8.5 feet away. [MAN] Scottie Harden misses. FOUL! Loose ball foul on Klay Wade during the rebound battle. [Team fouls: 3] No free throws, side out. (Klay Wade: 3 personal fouls)

[08:01] Team_027 possession (Score: 36-41)
Bradley Dosunmu attempts a Midrange. Wide open! Anfernee Carter is 10.0 feet away. [ZONE] BRADLEY DOSUNMU MAKES IT! Assist: John Russell
Score: 36-43

[07:44] Team_039 possession (Score: 36-43)
Jrue Bridges attempts a 3Pt. Contested by Tim Johnson (4.0 feet, MAN). JRUE BRIDGES MAKES IT!
Score: 39-43

[07:33] Team_027 possession (Score: 39-43)
John Russell drives and kicks out. Tim Johnson attempts a 3Pt. Contested by Jrue Bridges (5.6 feet, ZONE). Tim Johnson misses. Rebound secured by Austin O'Neal.

[07:16] Team_039 possession (Score: 39-43)
Klay Wade attempts a 3Pt. Contested by Bradley Dosunmu (4.4 feet, ZONE). Klay Wade misses. Rebound secured by John Russell.

[07:05] Team_027 possession (Score: 39-43)
Bradley Dosunmu attempts a Layup. Contested by Klay Wade (4.7 feet, MAN). BRADLEY DOSUNMU MAKES IT!
Score: 39-45

[06:50] Team_039 possession (Score: 39-45)
Austin O'Neal makes the Layup and draws the foul on John Russell! And-1! Austin O'Neal to the line for 1. [Team fouls: 2] (John Russell: 2 personal fouls)   FT 1/1: GOOD Austin O'Neal makes 1/1 from the line.
Score: 42-45

[06:34] Team_027 possession (Score: 42-45)
Tim Johnson attempts a Layup. Wide open! Jrue Bridges is 6.8 feet away. [MAN] Tim Johnson misses. Rebound secured by Klay Wade.

[06:17] Team_039 possession (Score: 42-45)
FOUL! Holding foul on Tim Johnson. [Team fouls: 3] No free throws, side out. (Tim Johnson: 1 personal fouls)

[05:59] Team_039 possession (Score: 42-45)
Jrue Bridges makes the Layup and draws the foul on John Russell! And-1! Jrue Bridges to the line for 1. [Team fouls: 4] (John Russell: 3 personal fouls)   FT 1/1: GOOD Jrue Bridges makes 1/1 from the line.
Score: 45-45

[05:41] Team_027 possession (Score: 45-45)
FOUL! Holding foul on Austin O'Neal. [Team fouls: 4] No free throws, side out. (Austin O'Neal: 1 personal fouls)

[05:26] Team_027 possession (Score: 45-45)
Bradley Dosunmu attempts a Midrange. Contested by Donovan Markkanen (5.8 feet, ZONE). Bradley Dosunmu misses. Rebound secured by Klay Wade.

[05:16] Team_039 possession (Score: 45-45)
Klay Wade attempts a Layup. Wide open! John Russell is 7.8 feet away. [ZONE] Klay Wade misses. Rebound secured by Tony Doncic.

[05:01] Team_027 possession (Score: 45-45)
John Russell attempts a Layup. BLOCKED BY KLAY WADE! Ball is loose! Rebound secured by Austin O'Neal.

[04:46] Team_039 possession (Score: 45-45)
Klay Wade drives, John Russell stays with him. Klay Wade attempts a Layup. Contested by John Russell (5.7 feet, MAN). Klay Wade misses. Rebound secured by John Russell.

[04:32] Team_027 possession (Score: 45-45)
Tony Doncic drives and kicks out. Tim Johnson attempts a Midrange. Wide open! Donovan Markkanen is 8.6 feet away. [ZONE] Tim Johnson misses. Rebound secured by Austin O'Neal.

[04:18] Team_039 possession (Score: 45-45)
Klay Wade attempts a Midrange. Wide open! Tim Johnson is 10.0 feet away. [ZONE] KLAY WADE MAKES IT!
Score: 47-45

[04:05] Team_027 possession (Score: 47-45)
Tim Johnson attempts a Layup. Contested by Jrue Bridges (5.5 feet, MAN). Tim Johnson misses. Offensive rebound by John Russell! John Russell kicks it out.

[03:51] Team_027 possession (Score: 47-45)
John Russell attempts a Midrange. Wide open! Austin O'Neal is 6.6 feet away. [ZONE] JOHN RUSSELL MAKES IT!
Score: 47-47

[03:31] Team_039 possession (Score: 47-47)
Austin O'Neal attempts a 3Pt. Contested by Bradley Dosunmu (5.7 feet, ZONE). AUSTIN O'NEAL MAKES IT!
Score: 50-47

[03:17] Team_027 possession (Score: 50-47)
John Russell drives to the basket... John Russell loses control! Ball rolls out of bounds! TURNOVER! (dead ball)

[03:17] Substitution (Team_039): Jrue Bridges OUT → Tracy Mitchell IN (stamina_rule2)

[03:17] Substitution (Team_039): Donovan Markkanen OUT → Jayson Cunningham IN (stamina_rule2)

[03:17] Substitution (Team_039): Austin O'Neal OUT → Yao Carter IN (stamina_rule2)

[03:17] Substitution (Team_039): Anfernee Carter OUT → Victor Gasol IN (stamina_rule2)

[03:17] Substitution (Team_039): Klay Wade OUT → Bam Booker IN (stamina_rule2)

[03:17] Substitution (Team_027): Tim Johnson OUT → CJ Green IN (stamina_rule2)

[03:17] Substitution (Team_027): Tony Doncic OUT → Dirk Lillard IN (stamina_rule2)

[03:17] Substitution (Team_027): Scottie Harden OUT → Rudy Quickley IN (stamina_rule2)

[03:17] Substitution (Team_027): Bradley Dosunmu OUT → LeBron Russell IN (stamina_rule2)

[03:17] Substitution (Team_027): John Russell OUT → Ben Stewart IN (stamina_rule2)

[03:06] Team_039 possession (Score: 50-47)
Tracy Mitchell makes the Dunk and draws the foul on Dirk Lillard! And-1! Tracy Mitchell to the line for 1. [BONUS: 5 team fouls] (Dirk Lillard: 1 personal fouls)   FT 1/1: GOOD Tracy Mitchell makes 1/1 from the line.
Score: 53-47

[02:54] Team_027 possession (Score: 53-47)
LeBron Russell attempts a Layup. Contested by Victor Gasol (4.4 feet, MAN). LEBRON RUSSELL MAKES IT! Assist: Rudy Quickley
Score: 53-49

[02:35] Team_039 possession (Score: 53-49)
Victor Gasol drives, picks up Ben Stewart. Help arrives from Dirk Lillard! Victor Gasol attempts a Layup. Contested by Dirk Lillard (5.5 feet, ZONE). VICTOR GASOL MAKES IT! Assist: Tracy Mitchell
Score: 55-49

[02:24] Team_027 possession (Score: 55-49)
Dirk Lillard attempts a 3Pt. Contested by Victor Gasol (5.3 feet, ZONE). Dirk Lillard misses. Rebound secured by Victor Gasol.

[02:06] Team_039 possession (Score: 55-49)
Victor Gasol attempts a 3Pt. Contested by Rudy Quickley (2.8 feet, ZONE). VICTOR GASOL MAKES IT! Assist: Bam Booker
Score: 58-49

[01:51] Team_027 possession (Score: 58-49)
Ben Stewart attempts a Midrange. Contested by Bam Booker (4.2 feet, MAN). Ben Stewart misses. Offensive rebound by Ben Stewart! Ben Stewart's putback is no good. Rebound secured by Victor Gasol.

[01:39] Team_039 possession (Score: 58-49)
Victor Gasol drives, picks up LeBron Russell. Help arrives from Dirk Lillard! Victor Gasol attempts a Layup. Wide open! Dirk Lillard is 6.7 feet away. [MAN] VICTOR GASOL MAKES IT!
Score: 60-49

[01:26] Team_027 possession (Score: 60-49)
FOUL! Holding foul on Victor Gasol. [IN THE BONUS! 5 team fouls] LeBron Russell to the line for 2 free throws. (Victor Gasol: 1 personal fouls)   FT 1/2: MISS   FT 2/2: GOOD LeBron Russell makes 1/2 from the line.
Score: 60-50

[01:12] Team_039 possession (Score: 60-50)
Yao Carter attempts a Midrange. Contested by Dirk Lillard (3.0 feet, ZONE). Yao Carter misses. Rebound secured by Dirk Lillard.

[00:53] Team_027 possession (Score: 60-50)
Rudy Quickley drives and kicks out. Ben Stewart attempts a 3Pt. Contested by Bam Booker (3.8 feet, MAN). Ben Stewart misses. Rebound secured by Bam Booker.

[00:39] Team_039 possession (Score: 60-50)
Tracy Mitchell attempts a 3Pt. Contested by Rudy Quickley (2.2 feet, ZONE). TRACY MITCHELL MAKES IT! Assist: Bam Booker
Score: 63-50

[00:25] Team_027 possession (Score: 63-50)
Ben Stewart attempts a Layup. Contested by Bam Booker (4.8 feet, MAN). Ben Stewart misses. FOUL! Loose ball foul on Bam Booker during the rebound battle. [IN THE BONUS! 6 team fouls] Dirk Lillard to the line for 2 free throws. (Bam Booker: 1 personal fouls)   FT 1/2: GOOD   FT 2/2: MISS Dirk Lillard makes 1/2 from the line. Rebound secured by Bam Booker.
Score: 63-51

[00:14] Team_039 possession (Score: 63-51)
Tracy Mitchell attempts a 3Pt. Wide open! CJ Green is 6.3 feet away. [MAN] Tracy Mitchell misses. Rebound secured by LeBron Russell.

[00:01] Team_027 possession (Score: 63-51)
Ben Stewart attempts a 3Pt. Wide open! Bam Booker is 6.8 feet away. [MAN] Ben Stewart misses. Rebound secured by Bam Booker.

================================================================================
                              2ND QUARTER COMPLETE                              
================================================================================

2ND QUARTER SCORE: Team_039 36, Team_027 21

BOX SCORE:
================================================================================

Team_039
--------------------------------------------------------------------------------
Player                MIN  PTS  REB  AST  TO      FG   FG%      3P   3P%
--------------------------------------------------------------------------------
Austin O'Neal          21    9    4    0   0   3/4    75.0     0/0   0.0
Victor Gasol            3    7    2    0   0   3/3   100.0     0/0   0.0
Jrue Bridges           21    6    0    0   0   2/3    66.7     0/0   0.0
Tracy Mitchell          3    6    0    1   0   2/3    66.7     0/0   0.0
Anfernee Carter        21    4    0    1   0   2/2   100.0     0/0   0.0
Klay Wade              21    4    4    0   0   2/5    40.0     0/0   0.0
Donovan Markkanen      21    0    0    1   0   0/0     0.0     0/0   0.0
Bam Booker              3    0    3    2   0   0/0     0.0     0/0   0.0
Yao Carter              3    0    0    0   0   0/1     0.0     0/0   0.0

TEAM: FG: 14/21 (66.7%), 3PT: 4/6 (66.7%), REB: 11 (2 off, 9 def), AST: 5, TO: 0
TEAM FOULS: 6 [Team_027 in BONUS]


Team_027
--------------------------------------------------------------------------------
Player                MIN  PTS  REB  AST  TO      FG   FG%      3P   3P%
--------------------------------------------------------------------------------
Scottie Harden         21    7    0    0   0   3/3   100.0     0/0   0.0
John Russell           21    4    4    1   0   2/5    40.0     0/0   0.0
Bradley Dosunmu        21    4    2    1   0   2/3    66.7     0/0   0.0
LeBron Russell          3    3    1    0   0   2/2   100.0     0/0   0.0
Tim Johnson            21    0    0    1   0   0/1     0.0     0/0   0.0
Tony Doncic            21    0    2    1   0   0/1     0.0     0/0   0.0
Rudy Quickley           3    0    0    1   0   0/1     0.0     0/0   0.0
Dirk Lillard            3    0    1    0   0   0/1     0.0     0/0   0.0
Ben Stewart             3    0    0    0   0   0/3     0.0     0/0   0.0

TEAM: FG: 9/20 (45.0%), 3PT: 1/3 (33.3%), REB: 12 (5 off, 7 def), AST: 5, TO: 1
TEAM FOULS: 5 [Team_039 in BONUS]

================================================================================

================================================================================
                       3RD QUARTER - Team_039 vs Team_027                       
================================================================================

[12:00] Team_039 possession (Score: 63-51)
Klay Wade throws a bad pass! Stolen by John Russell! TURNOVER! (live ball)

[11:47] Team_027 possession (Score: 63-51)
John Russell attempts a Midrange. Heavily contested by Klay Wade (1.0 feet, MAN)! John Russell misses. Rebound secured by Austin O'Neal.

[11:32] Team_039 possession (Score: 63-51)
Donovan Markkanen makes the 3Pt and draws the foul on Scottie Harden! And-1! Donovan Markkanen to the line for 1. [Team fouls: 1] (Scottie Harden: 1 personal fouls)   FT 1/1: GOOD Donovan Markkanen makes 1/1 from the line.
Score: 67-51

[11:16] Team_027 possession (Score: 67-51)
Tony Doncic attempts a 3Pt. Contested by Donovan Markkanen (4.4 feet, MAN). Tony Doncic misses. Rebound secured by Austin O'Neal.

[11:00] Team_039 possession (Score: 67-51)
Austin O'Neal drives, picks up Scottie Harden. Help arrives from Tony Doncic! Austin O'Neal attempts a Dunk. Contested by Tony Doncic (5.3 feet, MAN). AUSTIN O'NEAL MAKES IT! Assist: Jrue Bridges
Score: 69-51

[10:43] Team_027 possession (Score: 69-51)
Tony Doncic attempts a 3Pt. Contested by Jrue Bridges (2.4 feet, ZONE). TONY DONCIC MAKES IT! Assist: Tim Johnson
Score: 69-54

[10:27] Team_039 possession (Score: 69-54)
Klay Wade attempts a 3Pt. Heavily contested by John Russell (1.1 feet, MAN)! Klay Wade misses. Rebound secured by Tony Doncic.

[10:13] Team_027 possession (Score: 69-54)
Scottie Harden attempts a 3Pt. Contested by Austin O'Neal (3.5 feet, MAN). Scottie Harden misses. Rebound secured by Klay Wade.

[09:55] Team_039 possession (Score: 69-54)
Austin O'Neal attempts a Layup. Contested by John Russell (2.8 feet, ZONE). AUSTIN O'NEAL MAKES IT! Assist: Jrue Bridges
Score: 71-54

[09:43] Team_027 possession (Score: 71-54)
Bradley Dosunmu attempts a Layup. BLOCKED BY KLAY WADE! Ball is loose! Offensive rebound by John Russell! John Russell kicks it out.

[09:32] Team_027 possession (Score: 71-54)
Bradley Dosunmu attempts a 3Pt. Contested by Jrue Bridges (2.9 feet, ZONE). BRADLEY DOSUNMU MAKES IT! Assist: John Russell
Score: 71-57

[09:19] Team_039 possession (Score: 71-57)
Donovan Markkanen attempts a Layup. Contested by Tony Doncic (3.1 feet, MAN). Donovan Markkanen misses. Rebound secured by John Russell.

[09:08] Team_027 possession (Score: 71-57)
Tim Johnson attempts a Midrange. Contested by Jrue Bridges (3.5 feet, MAN). TIM JOHNSON MAKES IT! Assist: Bradley Dosunmu
Score: 71-59

[08:53] Team_039 possession (Score: 71-59)
Anfernee Carter attempts a Midrange. Contested by Bradley Dosunmu (2.7 feet, ZONE). Anfernee Carter misses. Rebound secured by Tony Doncic.

[08:39] Team_027 possession (Score: 71-59)
John Russell attempts a Midrange. Wide open! Klay Wade is 6.4 feet away. [MAN] John Russell misses. Rebound secured by Donovan Markkanen.

[08:22] Team_039 possession (Score: 71-59)
Jrue Bridges attempts a Midrange. Contested by Tony Doncic (5.4 feet, ZONE). Jrue Bridges misses. Rebound secured by Bradley Dosunmu.

[08:04] Team_027 possession (Score: 71-59)
Bradley Dosunmu drives to the basket... Bradley Dosunmu loses the ball! Stripped by Klay Wade! TURNOVER! (live ball)

[07:47] Team_039 possession (Score: 71-59)
Austin O'Neal drives, picks up John Russell. Help arrives from Tony Doncic! Austin O'Neal attempts a Dunk. Wide open! Tony Doncic is 7.4 feet away. [ZONE] AUSTIN O'NEAL MAKES IT!
Score: 73-59

[07:33] Team_027 possession (Score: 73-59)
John Russell attempts a 3Pt. Wide open! Jrue Bridges is 6.8 feet away. [ZONE] JOHN RUSSELL MAKES IT! Assist: Scottie Harden
Score: 73-62

[07:17] Team_039 possession (Score: 73-62)
Austin O'Neal attempts a Midrange. Contested by Bradley Dosunmu (4.1 feet, ZONE). Austin O'Neal misses. Rebound secured by Tony Doncic.

[07:06] Team_027 possession (Score: 73-62)
John Russell attempts a Midrange. Contested by Klay Wade (3.0 feet, MAN). JOHN RUSSELL MAKES IT! Assist: Tim Johnson
Score: 73-64

[06:53] Team_039 possession (Score: 73-64)
Donovan Markkanen attempts a Midrange. Heavily contested by Tony Doncic (0.5 feet, MAN)! Donovan Markkanen misses. Rebound secured by Tony Doncic.

[06:39] Team_027 possession (Score: 73-64)
FOUL! Shooting foul on Klay Wade. Bradley Dosunmu to the line for 2 free throws. [Team fouls: 2] (Klay Wade: 1 personal fouls)   FT 1/2: GOOD   FT 2/2: MISS Bradley Dosunmu makes 1/2 from the line. Rebound secured by Austin O'Neal.
Score: 73-65

[06:27] Team_039 possession (Score: 73-65)
Klay Wade drives, John Russell stays with him. Klay Wade attempts a Dunk. Contested by John Russell (4.6 feet, ZONE). KLAY WADE MAKES IT! Assist: Austin O'Neal
Score: 75-65

[06:15] Team_027 possession (Score: 75-65)
Tony Doncic attempts a Midrange. Contested by Donovan Markkanen (3.3 feet, MAN). Tony Doncic misses. Rebound secured by Klay Wade.

[05:59] Team_039 possession (Score: 75-65)
Donovan Markkanen attempts a Midrange. Contested by Tony Doncic (3.1 feet, MAN). DONOVAN MARKKANEN MAKES IT!
Score: 77-65

[05:50] Team_027 possession (Score: 77-65)
Scottie Harden attempts a 3Pt. Contested by Austin O'Neal (5.1 feet, MAN). Scottie Harden misses. Rebound secured by Donovan Markkanen.

[05:36] Team_039 possession (Score: 77-65)
FOUL! Reach-in foul on Bradley Dosunmu during the drive. [Team fouls: 2] No free throws, side out. (Bradley Dosunmu: 1 personal fouls)

[05:21] Team_039 possession (Score: 77-65)
Jrue Bridges drives to the basket... Jrue Bridges loses the ball! Stripped by John Russell! TURNOVER! (live ball)

[05:10] Team_027 possession (Score: 77-65)
Tim Johnson loses the ball! Stripped by Jrue Bridges! TURNOVER! (live ball)

[04:57] Team_039 possession (Score: 77-65)
Austin O'Neal attempts a 3Pt. Wide open! Scottie Harden is 8.2 feet away. [MAN] AUSTIN O'NEAL MAKES IT! Assist: Jrue Bridges
Score: 80-65

[04:41] Team_027 possession (Score: 80-65)
FOUL! Offensive foul on Bradley Dosunmu! Klay Wade drew the charge! [Team fouls: 3] (Bradley Dosunmu: 2 personal fouls) TURNOVER! (dead ball)

[04:28] Team_039 possession (Score: 80-65)
Anfernee Carter drives and kicks out. Jrue Bridges attempts a Midrange. Contested by Scottie Harden (5.5 feet, ZONE). JRUE BRIDGES MAKES IT!
Score: 82-65

[04:14] Team_027 possession (Score: 82-65)
Scottie Harden attempts a Midrange. Heavily contested by Austin O'Neal (1.7 feet, MAN)! Scottie Harden misses. Offensive rebound by John Russell! John Russell puts it back in!
Score: 82-67

[04:02] Team_039 possession (Score: 82-67)
Donovan Markkanen attempts a Midrange. Contested by Tony Doncic (5.2 feet, ZONE). DONOVAN MARKKANEN MAKES IT!
Score: 84-67

[03:46] Team_027 possession (Score: 84-67)
John Russell attempts a 3Pt. Contested by Klay Wade (5.1 feet, MAN). John Russell misses. Offensive rebound by Bradley Dosunmu! Bradley Dosunmu kicks it out.

[03:33] Team_027 possession (Score: 84-67)
Tony Doncic drives, Donovan Markkanen stays with him. Tony Doncic attempts a Layup. Contested by Donovan Markkanen (3.0 feet, MAN). TONY DONCIC MAKES IT! Assist: Bradley Dosunmu
Score: 84-69

[03:19] Team_039 possession (Score: 84-69)
Austin O'Neal attempts a 3Pt. Contested by Tony Doncic (2.4 feet, ZONE). Austin O'Neal misses. Rebound secured by John Russell.

[03:05] Team_027 possession (Score: 84-69)
Scottie Harden attempts a Midrange. Wide open! Austin O'Neal is 6.2 feet away. [MAN] Scottie Harden misses. Rebound secured by Klay Wade.

[02:53] Team_039 possession (Score: 84-69)
FOUL! Reach-in foul on Bradley Dosunmu during the drive. [Team fouls: 4] No free throws, side out. (Bradley Dosunmu: 3 personal fouls)

[02:40] Team_039 possession (Score: 84-69)
Austin O'Neal drives, John Russell stays with him. Austin O'Neal attempts a Layup. Contested by John Russell (2.2 feet, ZONE). AUSTIN O'NEAL MAKES IT!
Score: 86-69

[02:27] Team_027 possession (Score: 86-69)
Tony Doncic drives, picks up Donovan Markkanen. Help arrives from Austin O'Neal! Tony Doncic attempts a Layup. Contested by Austin O'Neal (5.0 feet, MAN). TONY DONCIC MAKES IT! Assist: Scottie Harden
Score: 86-71

[02:12] Team_039 possession (Score: 86-71)
Austin O'Neal attempts a 3Pt. Wide open! Tim Johnson is 6.2 feet away. [ZONE] Austin O'Neal misses. Rebound secured by John Russell.

[01:56] Team_027 possession (Score: 86-71)
Bradley Dosunmu loses the ball! Stripped by Klay Wade! TURNOVER! (live ball)

[01:42] Team_039 possession (Score: 86-71)
Donovan Markkanen attempts a 3Pt. Contested by Tim Johnson (4.4 feet, ZONE). Donovan Markkanen misses. Rebound secured by Tony Doncic.

[01:29] Team_027 possession (Score: 86-71)
Tim Johnson makes the 3Pt and draws the foul on Jrue Bridges! And-1! Tim Johnson to the line for 1. [Team fouls: 3] (Jrue Bridges: 1 personal fouls)   FT 1/1: GOOD Tim Johnson makes 1/1 from the line.
Score: 86-75

[01:15] Team_039 possession (Score: 86-75)
Donovan Markkanen drives, picks up John Russell. Help arrives from Tony Doncic! Donovan Markkanen attempts a Dunk. Contested by Tony Doncic (5.7 feet, ZONE). Donovan Markkanen misses. Rebound secured by John Russell.

[01:02] Team_027 possession (Score: 86-75)
FOUL! Shooting foul on Donovan Markkanen. Tim Johnson to the line for 2 free throws. [Team fouls: 4] (Donovan Markkanen: 1 personal fouls)   FT 1/2: MISS   FT 2/2: GOOD Tim Johnson makes 1/2 from the line.
Score: 86-76

[00:48] Team_039 possession (Score: 86-76)
Klay Wade makes the Dunk and draws the foul on John Russell! And-1! Klay Wade to the line for 1. [BONUS: 5 team fouls] (John Russell: 1 personal fouls)   FT 1/1: GOOD Klay Wade makes 1/1 from the line.
Score: 89-76

[00:34] Team_027 possession (Score: 89-76)
Tim Johnson attempts a 3Pt. Wide open! Jrue Bridges is 7.1 feet away. [MAN] Tim Johnson misses. Rebound secured by Austin O'Neal.

[00:19] Team_039 possession (Score: 89-76)
Anfernee Carter attempts a 3Pt. Contested by Bradley Dosunmu (5.2 feet, MAN). ANFERNEE CARTER MAKES IT! Assist: Klay Wade
Score: 92-76

[00:05] Team_027 possession (Score: 92-76)
Scottie Harden attempts a 3Pt. Contested by Jrue Bridges (2.3 feet, ZONE). Scottie Harden misses. Offensive rebound by Bradley Dosunmu! Bradley Dosunmu kicks it out.

================================================================================
                              3RD QUARTER COMPLETE                              
================================================================================

3RD QUARTER SCORE: Team_039 29, Team_027 25

BOX SCORE:
================================================================================

Team_039
--------------------------------------------------------------------------------
Player                MIN  PTS  REB  AST  TO      FG   FG%      3P   3P%
--------------------------------------------------------------------------------
Austin O'Neal          33   11    4    1   0   5/8    62.5     0/0   0.0
Donovan Markkanen      33    8    2    0   0   3/7    42.9     0/0   0.0
Klay Wade              33    5    3    1   0   2/3    66.7     0/0   0.0
Anfernee Carter        33    3    0    0   0   1/2    50.0     0/0   0.0
Jrue Bridges           33    2    0    3   0   1/2    50.0     0/0   0.0

TEAM: FG: 12/22 (54.5%), 3PT: 3/7 (42.9%), REB: 9 (0 off, 9 def), AST: 5, TO: 2
TEAM FOULS: 4


Team_027
--------------------------------------------------------------------------------
Player                MIN  PTS  REB  AST  TO      FG   FG%      3P   3P%
--------------------------------------------------------------------------------
John Russell           33    7    6    1   0   3/5    60.0     0/0   0.0
Tony Doncic            33    7    5    0   0   3/5    60.0     0/0   0.0
Tim Johnson            33    7    0    2   0   3/4    75.0     0/0   0.0
Bradley Dosunmu        33    3    3    2   0   1/2    50.0     0/0   0.0
Scottie Harden         33    0    0    2   0   0/3     0.0     0/0   0.0

TEAM: FG: 10/19 (52.6%), 3PT: 4/8 (50.0%), REB: 14 (4 off, 10 def), AST: 7, TO: 4
TEAM FOULS: 5 [Team_039 in BONUS]

================================================================================

================================================================================
                       4TH QUARTER - Team_039 vs Team_027                       
================================================================================

[12:00] Team_039 possession (Score: 92-76)
Jrue Bridges attempts a Midrange. Wide open! Tim Johnson is 6.5 feet away. [MAN] JRUE BRIDGES MAKES IT!
Score: 94-76

[11:48] Team_027 possession (Score: 94-76)
Tim Johnson attempts a 3Pt. Heavily contested by Jrue Bridges (0.5 feet, MAN)! TIM JOHNSON MAKES IT! Assist: Scottie Harden
Score: 94-79

[11:34] Team_039 possession (Score: 94-79)
Austin O'Neal drives to the basket... Austin O'Neal loses control! Ball rolls out of bounds! TURNOVER! (dead ball)

[11:34] Substitution (Team_039): Jrue Bridges OUT → Tracy Mitchell IN (stamina_rule2)

[11:34] Substitution (Team_039): Donovan Markkanen OUT → Jayson Cunningham IN (stamina_rule2)

[11:34] Substitution (Team_039): Austin O'Neal OUT → Yao Carter IN (stamina_rule2)

[11:34] Substitution (Team_039): Anfernee Carter OUT → Victor Gasol IN (stamina_rule2)

[11:34] Substitution (Team_039): Klay Wade OUT → Bam Booker IN (stamina_rule2)

[11:34] Substitution (Team_027): Tim Johnson OUT → CJ Green IN (stamina_rule2)

[11:34] Substitution (Team_027): Tony Doncic OUT → Dirk Lillard IN (stamina_rule2)

[11:34] Substitution (Team_027): Scottie Harden OUT → Rudy Quickley IN (stamina_rule2)

[11:34] Substitution (Team_027): Bradley Dosunmu OUT → LeBron Russell IN (stamina_rule2)

[11:34] Substitution (Team_027): John Russell OUT → Ben Stewart IN (stamina_rule2)

[11:22] Team_027 possession (Score: 94-79)
Rudy Quickley attempts a Midrange. Contested by Yao Carter (5.4 feet, ZONE). Rudy Quickley misses. Offensive rebound by Ben Stewart! Ben Stewart puts it back in!
Score: 94-81

[11:05] Team_039 possession (Score: 94-81)
Victor Gasol attempts a Layup. Wide open! LeBron Russell is 7.4 feet away. [MAN] VICTOR GASOL MAKES IT!
Score: 96-81

[10:54] Team_027 possession (Score: 96-81)
FOUL! Offensive foul on Rudy Quickley! Yao Carter drew the charge! [Team fouls: 1] (Rudy Quickley: 1 personal fouls) TURNOVER! (dead ball)

[10:39] Team_039 possession (Score: 96-81)
Tracy Mitchell attempts a 3Pt. Contested by CJ Green (5.9 feet, MAN). TRACY MITCHELL MAKES IT! Assist: Yao Carter
Score: 99-81

[10:26] Team_027 possession (Score: 99-81)
FOUL! Reach-in foul on Victor Gasol during the drive. [Team fouls: 1] No free throws, side out. (Victor Gasol: 1 personal fouls)

[10:14] Team_027 possession (Score: 99-81)
FOUL! Reach-in foul on Victor Gasol during the drive. [Team fouls: 2] No free throws, side out. (Victor Gasol: 2 personal fouls)

[10:02] Team_027 possession (Score: 99-81)
Ben Stewart attempts a Layup. Contested by Victor Gasol (3.7 feet, ZONE). BEN STEWART MAKES IT! Assist: LeBron Russell
Score: 99-83

[09:46] Team_039 possession (Score: 99-83)
FOUL! Reach-in foul on Ben Stewart during the drive. [Team fouls: 2] No free throws, side out. (Ben Stewart: 1 personal fouls)

[09:31] Team_039 possession (Score: 99-83)
Victor Gasol drives, picks up LeBron Russell. Help arrives from Dirk Lillard! Victor Gasol attempts a Layup. Contested by Dirk Lillard (2.7 feet, MAN). VICTOR GASOL MAKES IT! Assist: Jayson Cunningham
Score: 101-83

[09:12] Team_027 possession (Score: 101-83)
LeBron Russell drives to the basket... LeBron Russell loses control! Ball rolls out of bounds! TURNOVER! (dead ball)

[08:58] Team_039 possession (Score: 101-83)
Jayson Cunningham drives to the basket... Jayson Cunningham loses the ball! Stripped by Dirk Lillard! TURNOVER! (live ball)

[08:39] Team_027 possession (Score: 101-83)
LeBron Russell drives and kicks out. LeBron Russell attempts a Midrange. Contested by Victor Gasol (2.8 feet, ZONE). LeBron Russell misses. Rebound secured by Victor Gasol.

[08:21] Team_039 possession (Score: 101-83)
Tracy Mitchell attempts a Midrange. Wide open! Ben Stewart is 7.2 feet away. [ZONE] Tracy Mitchell misses. Rebound secured by Ben Stewart.

[08:08] Team_027 possession (Score: 101-83)
CJ Green attempts a 3Pt. Wide open! Tracy Mitchell is 6.6 feet away. [ZONE] CJ GREEN MAKES IT! Assist: Dirk Lillard
Score: 101-86

[07:53] Team_039 possession (Score: 101-86)
Bam Booker attempts a Midrange. Heavily contested by Rudy Quickley (1.7 feet, ZONE)! Bam Booker misses. Offensive rebound by Yao Carter! Yao Carter kicks it out.

[07:35] Team_039 possession (Score: 101-86)
Bam Booker attempts a Midrange. Contested by Ben Stewart (5.7 feet, MAN). Bam Booker misses. Rebound secured by Ben Stewart.

[07:24] Team_027 possession (Score: 101-86)
LeBron Russell attempts a 3Pt. Contested by Victor Gasol (3.5 feet, MAN). LeBron Russell misses. Rebound secured by Victor Gasol.

[07:07] Team_039 possession (Score: 101-86)
Tracy Mitchell makes the Layup and draws the foul on CJ Green! And-1! Tracy Mitchell to the line for 1. [Team fouls: 3] (CJ Green: 1 personal fouls)   FT 1/1: GOOD Tracy Mitchell makes 1/1 from the line.
Score: 104-86

[06:54] Team_027 possession (Score: 104-86)
LeBron Russell drives and kicks out. Rudy Quickley attempts a Midrange. Contested by Victor Gasol (3.1 feet, ZONE). Rudy Quickley misses. Rebound secured by Victor Gasol.

[06:44] Team_039 possession (Score: 104-86)
Jayson Cunningham attempts a 3Pt. Contested by Dirk Lillard (4.0 feet, MAN). Jayson Cunningham misses. Rebound secured by Ben Stewart.

[06:28] Team_027 possession (Score: 104-86)
Dirk Lillard attempts a Layup. Wide open! Jayson Cunningham is 6.7 feet away. [MAN] DIRK LILLARD MAKES IT!
Score: 104-88

[06:15] Team_039 possession (Score: 104-88)
Tracy Mitchell attempts a Midrange. Contested by Rudy Quickley (2.1 feet, ZONE). Tracy Mitchell misses. Rebound secured by Ben Stewart.

[05:58] Team_027 possession (Score: 104-88)
LeBron Russell attempts a Layup. Contested by Victor Gasol (6.0 feet, MAN). LeBron Russell misses. Rebound secured by Yao Carter.

[05:46] Team_039 possession (Score: 104-88)
Yao Carter attempts a 3Pt. Contested by Rudy Quickley (5.8 feet, MAN). Yao Carter misses. Rebound secured by Dirk Lillard.

[05:29] Team_027 possession (Score: 104-88)
CJ Green attempts a Midrange. Contested by Tracy Mitchell (5.0 feet, MAN). CJ Green misses. Rebound secured by Victor Gasol.

[05:18] Team_039 possession (Score: 104-88)
Victor Gasol drives to the basket... Victor Gasol throws a bad pass out of bounds! TURNOVER! (dead ball)

[05:02] Team_027 possession (Score: 104-88)
Ben Stewart loses control! Ball rolls out of bounds! TURNOVER! (dead ball)

[04:51] Team_039 possession (Score: 104-88)
Victor Gasol attempts a 3Pt. Contested by LeBron Russell (5.5 feet, MAN). Victor Gasol misses. Rebound secured by LeBron Russell.

[04:36] Team_027 possession (Score: 104-88)
Ben Stewart attempts a Layup. Heavily contested by Bam Booker (1.1 feet, MAN)! BEN STEWART MAKES IT! Assist: Rudy Quickley
Score: 104-90

[04:19] Team_039 possession (Score: 104-90)
Jayson Cunningham attempts a 3Pt. Wide open! Dirk Lillard is 7.9 feet away. [ZONE] JAYSON CUNNINGHAM MAKES IT! Assist: Tracy Mitchell
Score: 107-90

[04:10] Team_027 possession (Score: 107-90)
Ben Stewart attempts a Dunk. BLOCKED BY VICTOR GASOL! Ball deflects out of bounds off Ben Stewart.

[03:55] Team_039 possession (Score: 107-90)
Jayson Cunningham attempts a Layup. Wide open! Ben Stewart is 6.1 feet away. [ZONE] Jayson Cunningham misses. Rebound secured by Dirk Lillard.

[03:38] Team_027 possession (Score: 107-90)
FOUL! Shooting foul on Bam Booker. Ben Stewart to the line for 2 free throws. [Team fouls: 3] (Bam Booker: 1 personal fouls)   FT 1/2: GOOD   FT 2/2: GOOD Ben Stewart makes 2/2 from the line.
Score: 107-92

[03:23] Team_039 possession (Score: 107-92)
FOUL! Shooting foul on LeBron Russell. Yao Carter to the line for 2 free throws. [Team fouls: 4] (LeBron Russell: 1 personal fouls)   FT 1/2: GOOD   FT 2/2: MISS Yao Carter makes 1/2 from the line. Rebound secured by LeBron Russell.
Score: 108-92

[03:08] Team_027 possession (Score: 108-92)
Ben Stewart attempts a Midrange. Contested by Bam Booker (5.1 feet, MAN). Ben Stewart misses. FOUL! Loose ball foul on Yao Carter during the rebound battle. [Team fouls: 4] No free throws, side out. (Yao Carter: 1 personal fouls)

[02:55] Team_027 possession (Score: 108-92)
Ben Stewart attempts a Midrange. Contested by Bam Booker (3.8 feet, MAN). BEN STEWART MAKES IT! Assist: Dirk Lillard
Score: 108-94

[02:44] Team_039 possession (Score: 108-94)
Victor Gasol attempts a Midrange. Contested by Rudy Quickley (5.4 feet, ZONE). VICTOR GASOL MAKES IT!
Score: 110-94

[02:27] Team_027 possession (Score: 110-94)
Ben Stewart drives to the basket... Ben Stewart throws a bad pass! Stolen by Victor Gasol! TURNOVER! (live ball)

[02:12] Team_039 possession (Score: 110-94)
Victor Gasol makes the Layup and draws the foul on LeBron Russell! And-1! Victor Gasol to the line for 1. [BONUS: 5 team fouls] (LeBron Russell: 2 personal fouls)   FT 1/1: GOOD Victor Gasol makes 1/1 from the line.
Score: 113-94

[01:57] Team_027 possession (Score: 113-94)
Rudy Quickley loses the ball! Stripped by Yao Carter! TURNOVER! (live ball)

[01:43] Team_039 possession (Score: 113-94)
Yao Carter attempts a Midrange. Wide open! Rudy Quickley is 7.6 feet away. [MAN] YAO CARTER MAKES IT!
Score: 115-94

[01:28] Team_027 possession (Score: 115-94)
CJ Green attempts a 3Pt. Wide open! Tracy Mitchell is 8.9 feet away. [ZONE] CJ Green misses. Offensive rebound by Dirk Lillard! Dirk Lillard kicks it out.

[01:16] Team_027 possession (Score: 115-94)
Ben Stewart attempts a Midrange. Wide open! Bam Booker is 6.8 feet away. [MAN] Ben Stewart misses. Rebound secured by Bam Booker.

[01:02] Team_039 possession (Score: 115-94)
Yao Carter drives and kicks out. Tracy Mitchell attempts a 3Pt. Contested by Rudy Quickley (2.5 feet, ZONE). Tracy Mitchell misses. Rebound secured by Ben Stewart.

[00:46] Team_027 possession (Score: 115-94)
LeBron Russell drives and kicks out. Ben Stewart attempts a 3Pt. Wide open! Tracy Mitchell is 6.9 feet away. [ZONE] Ben Stewart misses. Offensive rebound by Ben Stewart! Ben Stewart's putback is no good. Rebound secured by Yao Carter.

[00:34] Team_039 possession (Score: 115-94)
Yao Carter drives, picks up Ben Stewart. Help arrives from Dirk Lillard! Yao Carter attempts a Dunk. Wide open! Dirk Lillard is 6.1 feet away. [ZONE] YAO CARTER MAKES IT! Assist: Victor Gasol
Score: 117-94

[00:23] Team_027 possession (Score: 117-94)
FOUL! Holding foul on Victor Gasol. [IN THE BONUS! 5 team fouls] LeBron Russell to the line for 2 free throws. (Victor Gasol: 3 personal fouls)   FT 1/2: GOOD   FT 2/2: MISS LeBron Russell makes 1/2 from the line. Rebound secured by Yao Carter.
Score: 117-95

[00:12] Team_039 possession (Score: 117-95)
Victor Gasol drives and kicks out. Jayson Cunningham attempts a 3Pt. Contested by Rudy Quickley (3.2 feet, ZONE). Jayson Cunningham misses. Offensive rebound by Yao Carter! Yao Carter kicks it out.

================================================================================
                              4TH QUARTER COMPLETE                              
================================================================================

4TH QUARTER SCORE: Team_039 25, Team_027 19

BOX SCORE:
================================================================================

Team_039
--------------------------------------------------------------------------------
Player                MIN  PTS  REB  AST  TO      FG   FG%      3P   3P%
--------------------------------------------------------------------------------
Victor Gasol           15    9    4    1   0   4/5    80.0     0/0   0.0
Tracy Mitchell         15    6    0    1   0   2/4    50.0     0/0   0.0
Yao Carter             15    4    5    1   0   2/5    40.0     0/0   0.0
Jayson Cunningham      15    3    0    1   0   1/3    33.3     0/0   0.0
Jrue Bridges           34    2    0    0   0   1/1   100.0     0/0   0.0
Bam Booker             15    0    1    0   0   0/1     0.0     0/0   0.0

TEAM: FG: 10/19 (52.6%), 3PT: 2/5 (40.0%), REB: 9 (2 off, 7 def), AST: 4, TO: 3
TEAM FOULS: 5 [Team_027 in BONUS]


Team_027
--------------------------------------------------------------------------------
Player                MIN  PTS  REB  AST  TO      FG   FG%      3P   3P%
--------------------------------------------------------------------------------
Ben Stewart            15   10    6    0   0   5/7    71.4     0/0   0.0
Tim Johnson            34    3    0    0   0   1/1   100.0     0/0   0.0
CJ Green               15    3    0    0   0   1/2    50.0     0/0   0.0
Dirk Lillard           15    2    4    2   0   1/1   100.0     0/0   0.0
Scottie Harden         34    0    0    1   0   0/0     0.0     0/0   0.0
LeBron Russell         15    0    2    1   0   0/5     0.0     0/0   0.0
Rudy Quickley          15    0    0    1   0   0/0     0.0     0/0   0.0

TEAM: FG: 8/17 (47.1%), 3PT: 2/3 (66.7%), REB: 13 (4 off, 9 def), AST: 5, TO: 5
TEAM FOULS: 5 [Team_039 in BONUS]

================================================================================

================================================================================
                               FULL GAME COMPLETE                               
================================================================================

FINAL SCORE: Team_039 117, Team_027 95

SCORING BY QUARTER:
--------------------------------------------------------------------------------
Team                     Q1     Q2     Q3     Q4    FINAL
--------------------------------------------------------------------------------
Team_039                 27     36     29     25      117
Team_027                 30     21     25     19       95
--------------------------------------------------------------------------------

FULL GAME BOX SCORE:
================================================================================

Team_039
--------------------------------------------------------------------------------
Player                MIN  PTS  REB  AST  TO      FG   FG%      3P   3P%      FT STL BLK
--------------------------------------------------------------------------------
Jrue Bridges           34   13    0    4   2   4/8    50.0   1/3    33.3   2/2     1   0
Donovan Markkanen      34   14    6    1   0   6/13   46.2   1/2    50.0   1/1     0   0
Austin O'Neal          34   28    9    1   0  10/17   58.8   4/6    66.7   1/1     0   0
Anfernee Carter        34    9    0    2   0   5/6    83.3   1/1   100.0   0/0     0   0
Klay Wade              34   17   13    4   3   9/14   64.3   0/2     0.0   3/3     2   4
Tracy Mitchell         15   12    0    2   1   4/7    57.1   2/3    66.7   2/2     0   0
Jayson Cunningham      15    3    0    1   0   1/3    33.3   1/2    50.0   0/0     0   0
Yao Carter             15    4    5    1   1   2/6    33.3   0/1     0.0   1/2     1   0
Victor Gasol           15   16    6    1   0   7/8    87.5   1/2    50.0   1/1     1   1
Bam Booker             15    0    4    2   0   0/1     0.0   0/0     0.0   0/0     0   0

TEAM: FG: 48/83 (57.8%), 3PT: 11/22 (50.0%), REB: 40 (7 off, 33 def), AST: 19, TO: 7


Team_027
--------------------------------------------------------------------------------
Player                MIN  PTS  REB  AST  TO      FG   FG%      3P   3P%      FT STL BLK
--------------------------------------------------------------------------------
Tim Johnson            34   16    0    3   2   6/8    75.0   4/5    80.0   2/3     0   0
Tony Doncic            34    7   13    2   1   4/10   40.0   1/4    25.0   0/0     0   0
Scottie Harden         34   11    0    7   1   5/13   38.5   1/4    25.0   1/2     0   0
Bradley Dosunmu        34   21    9    5   2   9/11   81.8   1/1   100.0   3/4     0   0
John Russell           34   16   11    3   0   7/12   58.3   2/2   100.0   0/1     3   1
CJ Green               15    3    0    0   0   1/2    50.0   1/1   100.0   0/0     0   0
Dirk Lillard           15    2    5    2   0   1/2    50.0   0/1     0.0   1/2     1   0
Rudy Quickley          15    0    0    2   3   1/2    50.0   0/0     0.0   0/0     0   0
LeBron Russell         15    3    3    1   0   1/6    16.7   0/1     0.0   2/4     0   0
Ben Stewart            15   10    6    0   2   4/9    44.4   0/1     0.0   2/2     0   0

TEAM: FG: 40/77 (51.9%), 3PT: 10/20 (50.0%), REB: 50 (15 off, 35 def), AST: 25, TO: 11

================================================================================
