================================================================================
                        FULL GAME - Team_074 vs Team_058                        
================================================================================

================================================================================
                       1ST QUARTER - Team_074 vs Team_058                       
================================================================================

[12:00] Team_074 possession (Score: 0-0)
Dwyane Quickley attempts a 3Pt. Heavily contested by Bradley Sexton (0.5 feet, ZONE)! Dwyane Quickley misses. Rebound secured by Bradley Sexton.

[11:46] Team_058 possession (Score: 0-0)
Vince Hyland drives to the basket... Vince Hyland commits a violation (traveling/carry)! TURNOVER! (dead ball)

[11:33] Team_074 possession (Score: 0-0)
Donovan Doncic drives, Stephen Haliburton stays with him. Donovan Doncic attempts a Dunk. Contested by Stephen Haliburton (5.9 feet, MAN). Donovan Doncic misses. Offensive rebound by James Turner! James Turner's putback is no good. Offensive rebound by Donovan Doncic! Donovan Doncic kicks it out.

[11:17] Team_074 possession (Score: 0-0)
FOUL! Shooting foul on Stephen Haliburton. James Turner to the line for 2 free throws. [Team fouls: 2] (Stephen Haliburton: 2 personal fouls)   FT 1/2: GOOD   FT 2/2: MISS James Turner makes 1/2 from the line. Offensive rebound by Donovan Doncic! Donovan Doncic kicks it out.
Score: 1-0

[11:01] Team_074 possession (Score: 1-0)
James Turner attempts a Midrange. Contested by Kyle Westbrook (3.9 feet, ZONE). JAMES TURNER MAKES IT! Assist: Shai Green
Score: 3-0

[10:46] Team_058 possession (Score: 3-0)
Tyrese Doncic drives and kicks out. Bradley Sexton attempts a 3Pt. Contested by Dwyane Quickley (5.6 feet, MAN). Bradley Sexton misses. Rebound secured by Donovan Doncic.

[10:29] Team_074 possession (Score: 3-0)
Donovan Doncic attempts a Layup. Contested by Stephen Haliburton (3.1 feet, MAN). Donovan Doncic misses. Rebound secured by Stephen Haliburton.

[10:13] Team_058 possession (Score: 3-0)
Stephen Haliburton drives to the basket... Stephen Haliburton throws a bad pass out of bounds! TURNOVER! (dead ball)

[10:01] Team_074 possession (Score: 3-0)
Dwyane Quickley makes the Midrange and draws the foul on Bradley Sexton! And-1! Dwyane Quickley to the line for 1. [Team fouls: 3] (Bradley Sexton: 1 personal fouls)   FT 1/1: GOOD Dwyane Quickley makes 1/1 from the line.
Score: 6-0

[09:46] Team_058 possession (Score: 6-0)
Kyle Westbrook attempts a 3Pt. Wide open! Chris Carter is 6.1 feet away. [MAN] Kyle Westbrook misses. Rebound secured by Donovan Doncic.

[09:33] Team_074 possession (Score: 6-0)
James Turner attempts a Layup. Contested by Stephen Haliburton (3.1 feet, ZONE). James Turner misses. Rebound secured by Bradley Sexton.

[09:23] Team_058 possession (Score: 6-0)
FOUL! Reach-in foul on Chris Carter during the drive. [Team fouls: 1] No free throws, side out. (Chris Carter: 1 personal fouls)

[09:12] Team_058 possession (Score: 6-0)
Stephen Haliburton attempts a Midrange. Contested by Donovan Doncic (2.4 feet, MAN). Stephen Haliburton misses. Rebound secured by Donovan Doncic.

[08:56] Team_074 possession (Score: 6-0)
James Turner attempts a Layup. BLOCKED BY STEPHEN HALIBURTON! Ball is loose! Rebound secured by Stephen Haliburton.

[08:45] Team_058 possession (Score: 6-0)
Stephen Haliburton attempts a Midrange. Contested by Donovan Doncic (4.9 feet, ZONE). Stephen Haliburton misses. Rebound secured by Shai Green.

[08:28] Team_074 possession (Score: 6-0)
FOUL! Holding foul on Stephen Haliburton. [Team fouls: 4] No free throws, side out. (Stephen Haliburton: 3 personal fouls)

[08:11] Team_074 possession (Score: 6-0)
Dwyane Quickley attempts a 3Pt. Contested by Bradley Sexton (3.5 feet, ZONE). Dwyane Quickley misses. Offensive rebound by Donovan Doncic! Donovan Doncic kicks it out.

[08:00] Team_074 possession (Score: 6-0)
Shai Green drives and kicks out. James Turner attempts a 3Pt. Contested by Tyrese Doncic (5.7 feet, MAN). James Turner misses. Offensive rebound by James Turner! James Turner puts it back in!
Score: 8-0

[07:45] Team_058 possession (Score: 8-0)
Stephen Haliburton drives, Donovan Doncic stays with him. Stephen Haliburton attempts a Layup. Contested by Donovan Doncic (3.5 feet, MAN). STEPHEN HALIBURTON MAKES IT! Assist: Kyle Westbrook
Score: 8-2

[07:28] Team_074 possession (Score: 8-2)
James Turner makes the Layup and draws the foul on Stephen Haliburton! And-1! James Turner to the line for 1. [BONUS: 5 team fouls] (Stephen Haliburton: 4 personal fouls)   FT 1/1: MISS James Turner makes 0/1 from the line. Rebound secured by Bradley Sexton.
Score: 10-2

[07:13] Team_058 possession (Score: 10-2)
Bradley Sexton attempts a 3Pt. Contested by Chris Carter (4.6 feet, ZONE). Bradley Sexton misses. FOUL! Loose ball foul on James Turner during the rebound battle. [Team fouls: 2] No free throws, side out. (James Turner: 1 personal fouls)

[06:57] Team_058 possession (Score: 10-2)
Stephen Haliburton attempts a Midrange. Contested by Dwyane Quickley (4.5 feet, ZONE). Stephen Haliburton misses. Rebound secured by Donovan Doncic.

[06:42] Team_074 possession (Score: 10-2)
James Turner drives and kicks out. Shai Green attempts a 3Pt. Wide open! Vince Hyland is 7.5 feet away. [MAN] SHAI GREEN MAKES IT! Assist: Dwyane Quickley
Score: 13-2

[06:28] Team_058 possession (Score: 13-2)
Vince Hyland attempts a Midrange. Contested by Chris Carter (3.4 feet, ZONE). VINCE HYLAND MAKES IT!
Score: 13-4

[06:16] Team_074 possession (Score: 13-4)
Donovan Doncic drives to the basket... Donovan Doncic throws a bad pass! Stolen by Stephen Haliburton! TURNOVER! (live ball)

[06:02] Team_058 possession (Score: 13-4)
FOUL! Reach-in foul on Donovan Doncic during the drive. [Team fouls: 3] No free throws, side out. (Donovan Doncic: 1 personal fouls)

[05:48] Team_058 possession (Score: 13-4)
Tyrese Doncic attempts a Layup. Heavily contested by Donovan Doncic (0.5 feet, ZONE)! TYRESE DONCIC MAKES IT! Assist: Vince Hyland
Score: 13-6

[05:30] Team_074 possession (Score: 13-6)
Shai Green drives, Stephen Haliburton stays with him. Shai Green attempts a Layup. Heavily contested by Stephen Haliburton (0.5 feet, ZONE)! Shai Green misses. Rebound secured by Bradley Sexton.

[05:16] Team_058 possession (Score: 13-6)
Bradley Sexton drives, picks up Dwyane Quickley. Help arrives from Shai Green! Bradley Sexton attempts a Layup. Wide open! Shai Green is 7.7 feet away. [MAN] BRADLEY SEXTON MAKES IT! Assist: Vince Hyland
Score: 13-8

[05:03] Team_074 possession (Score: 13-8)
Chris Carter attempts a Midrange. Contested by Kyle Westbrook (4.7 feet, MAN). Chris Carter misses. Rebound secured by Tyrese Doncic.

[04:49] Team_058 possession (Score: 13-8)
Stephen Haliburton throws a bad pass out of bounds! TURNOVER! (dead ball)

[04:32] Team_074 possession (Score: 13-8)
Donovan Doncic attempts a Layup. Contested by Stephen Haliburton (5.5 feet, MAN). DONOVAN DONCIC MAKES IT! Assist: James Turner
Score: 15-8

[04:20] Team_058 possession (Score: 15-8)
Bradley Sexton drives and kicks out. Tyrese Doncic attempts a 3Pt. Contested by Dwyane Quickley (3.0 feet, ZONE). Tyrese Doncic misses. Offensive rebound by Stephen Haliburton! Stephen Haliburton's putback is no good. Rebound secured by Donovan Doncic.

[04:02] Team_074 possession (Score: 15-8)
Chris Carter attempts a Layup. Wide open! Stephen Haliburton is 7.9 feet away. [ZONE] Chris Carter misses. Rebound secured by Stephen Haliburton.

[03:48] Team_058 possession (Score: 15-8)
Tyrese Doncic drives, picks up Donovan Doncic. Help arrives from Chris Carter! Tyrese Doncic attempts a Layup. Contested by Chris Carter (2.7 feet, ZONE). TYRESE DONCIC MAKES IT!
Score: 15-10

[03:37] Team_074 possession (Score: 15-10)
FOUL! Shooting foul on Tyrese Doncic. James Turner to the line for 2 free throws. [BONUS: 6 team fouls] (Tyrese Doncic: 1 personal fouls)   FT 1/2: MISS   FT 2/2: GOOD James Turner makes 1/2 from the line.
Score: 16-10

[03:20] Team_058 possession (Score: 16-10)
Tyrese Doncic drives and kicks out. FOUL! Shooting foul on Shai Green. Vince Hyland to the line for 3 free throws. [Team fouls: 4] (Shai Green: 1 personal fouls)   FT 1/3: MISS   FT 2/3: GOOD   FT 3/3: GOOD Vince Hyland makes 2/3 from the line.
Score: 16-12

[03:07] Team_074 possession (Score: 16-12)
James Turner attempts a Midrange. Contested by Tyrese Doncic (4.2 feet, MAN). JAMES TURNER MAKES IT! Assist: Chris Carter
Score: 18-12

[02:51] Team_058 possession (Score: 18-12)
Stephen Haliburton attempts a Layup. Contested by Donovan Doncic (4.8 feet, ZONE). Stephen Haliburton misses. Offensive rebound by Stephen Haliburton! Stephen Haliburton's putback is no good. Rebound secured by Shai Green.

[02:41] Team_074 possession (Score: 18-12)
Dwyane Quickley drives and kicks out. Chris Carter attempts a 3Pt. Contested by Bradley Sexton (2.2 feet, ZONE). Chris Carter misses. Rebound secured by Bradley Sexton.

[02:27] Team_058 possession (Score: 18-12)
Stephen Haliburton attempts a Layup. BLOCKED BY DONOVAN DONCIC! Ball is loose! Rebound secured by James Turner.

[02:14] Team_074 possession (Score: 18-12)
Shai Green attempts a 3Pt. Wide open! Vince Hyland is 8.2 feet away. [MAN] Shai Green misses. Offensive rebound by Donovan Doncic! Donovan Doncic kicks it out.

[01:57] Team_074 possession (Score: 18-12)
Chris Carter attempts a 3Pt. Contested by Bradley Sexton (4.4 feet, ZONE). CHRIS CARTER MAKES IT! Assist: Dwyane Quickley
Score: 21-12

[01:40] Team_058 possession (Score: 21-12)
Tyrese Doncic attempts a Layup. Contested by James Turner (3.5 feet, MAN). Tyrese Doncic misses. Rebound secured by James Turner.

[01:22] Team_074 possession (Score: 21-12)
Dwyane Quickley attempts a 3Pt. Contested by Bradley Sexton (5.7 feet, ZONE). Dwyane Quickley misses. Rebound secured by Bradley Sexton.

[01:05] Team_058 possession (Score: 21-12)
Vince Hyland attempts a 3Pt. Contested by Shai Green (3.6 feet, MAN). VINCE HYLAND MAKES IT! Assist: Tyrese Doncic
Score: 21-15

[00:50] Team_074 possession (Score: 21-15)
Dwyane Quickley attempts a 3Pt. Heavily contested by Bradley Sexton (1.1 feet, ZONE)! Dwyane Quickley misses. Rebound secured by Bradley Sexton.

[00:40] Team_058 possession (Score: 21-15)
Tyrese Doncic throws a bad pass! Stolen by James Turner! TURNOVER! (live ball)

[00:26] Team_074 possession (Score: 21-15)
Donovan Doncic throws a bad pass! Stolen by Stephen Haliburton! TURNOVER! (live ball)

[00:13] Team_058 possession (Score: 21-15)
Kyle Westbrook attempts a 3Pt. Wide open! Chris Carter is 7.9 feet away. [MAN] Kyle Westbrook misses. Rebound secured by Donovan Doncic.

================================================================================
                              1ST QUARTER COMPLETE                              
================================================================================

1ST QUARTER SCORE: Team_074 21, Team_058 15

BOX SCORE:
================================================================================

Team_074
--------------------------------------------------------------------------------
Player                MIN  PTS  REB  AST  TO      FG   FG%      3P   3P%
--------------------------------------------------------------------------------
James Turner           12    7    3    1   0   4/7    57.1     0/0   0.0
Dwyane Quickley        12    3    0    2   0   1/5    20.0     0/0   0.0
Chris Carter           12    3    0    1   0   1/3    33.3     0/0   0.0
Donovan Doncic         12    2   10    0   0   1/2    50.0     0/0   0.0

TEAM: FG: 8/19 (42.1%), 3PT: 1/4 (25.0%), REB: 13 (5 off, 8 def), AST: 5, TO: 2
TEAM FOULS: 4


Team_058
--------------------------------------------------------------------------------
Player                MIN  PTS  REB  AST  TO      FG   FG%      3P   3P%
--------------------------------------------------------------------------------
Vince Hyland           12    7    0    2   0   3/3   100.0     0/0   0.0
Tyrese Doncic          12    4    1    1   0   2/4    50.0     0/0   0.0
Shai Green             12    3    2    1   0   1/2    50.0     0/0   0.0
Bradley Sexton         12    2    7    0   0   1/2    50.0     0/0   0.0
Stephen Haliburton     12    2    4    0   0   1/6    16.7     0/0   0.0
Kyle Westbrook         12    0    0    1   0   0/2     0.0     0/0   0.0

TEAM: FG: 7/17 (41.2%), 3PT: 1/3 (33.3%), REB: 14 (3 off, 11 def), AST: 4, TO: 4
TEAM FOULS: 6 [Team_074 in BONUS]

================================================================================

================================================================================
                       2ND QUARTER - Team_074 vs Team_058                       
================================================================================

[12:00] Team_074 possession (Score: 21-15)
Donovan Doncic attempts a Layup. BLOCKED BY STEPHEN HALIBURTON! Ball deflects out of bounds off Donovan Doncic.

[11:41] Team_058 possession (Score: 21-15)
FOUL! Holding foul on Chris Carter. [Team fouls: 1] No free throws, side out. (Chris Carter: 1 personal fouls)

[11:25] Team_058 possession (Score: 21-15)
Stephen Haliburton makes the Layup and draws the foul on Donovan Doncic! And-1! Stephen Haliburton to the line for 1. [Team fouls: 2] (Donovan Doncic: 1 personal fouls)   FT 1/1: GOOD Stephen Haliburton makes 1/1 from the line.
Score: 21-18

[11:11] Team_074 possession (Score: 21-18)
FOUL! Shooting foul on Stephen Haliburton. Donovan Doncic to the line for 3 free throws. [Team fouls: 1] (Stephen Haliburton: 1 personal fouls)   FT 1/3: GOOD   FT 2/3: GOOD   FT 3/3: GOOD Donovan Doncic makes 3/3 from the line.
Score: 24-18

[10:58] Team_058 possession (Score: 24-18)
Vince Hyland attempts a Midrange. Contested by Shai Green (5.2 feet, MAN). Vince Hyland misses. Rebound secured by Shai Green.

[10:43] Team_074 possession (Score: 24-18)
Donovan Doncic attempts a Midrange. Contested by Kyle Westbrook (2.7 feet, ZONE). Donovan Doncic misses. Offensive rebound by Donovan Doncic! Donovan Doncic kicks it out.

[10:28] Team_074 possession (Score: 24-18)
Chris Carter throws a bad pass! Stolen by Kyle Westbrook! TURNOVER! (live ball)

[10:10] Team_058 possession (Score: 24-18)
Kyle Westbrook attempts a Layup. Wide open! Chris Carter is 7.6 feet away. [MAN] KYLE WESTBROOK MAKES IT!
Score: 24-20

[09:53] Team_074 possession (Score: 24-20)
Chris Carter attempts a 3Pt. Heavily contested by Bradley Sexton (1.9 feet, ZONE)! Chris Carter misses. Rebound secured by Stephen Haliburton.

[09:36] Team_058 possession (Score: 24-20)
Tyrese Doncic drives and kicks out. Vince Hyland attempts a Midrange. Wide open! Donovan Doncic is 9.6 feet away. [ZONE] Vince Hyland misses. Rebound secured by Donovan Doncic.

[09:26] Team_074 possession (Score: 24-20)
Chris Carter commits a violation (traveling/carry)! TURNOVER! (dead ball)

[09:26] Substitution (Team_074): Dwyane Quickley OUT → James Barnes IN (stamina_rule2)

[09:26] Substitution (Team_074): Chris Carter OUT → Giannis Westbrook IN (stamina_rule2)

[09:26] Substitution (Team_074): Shai Green OUT → Ayo Smith IN (stamina_rule2)

[09:26] Substitution (Team_074): Donovan Doncic OUT → Yao Randle IN (stamina_rule2)

[09:26] Substitution (Team_074): James Turner OUT → Jaren Rozier IN (stamina_rule2)

[09:26] Substitution (Team_058): Bradley Sexton OUT → Draymond Williamson IN (stamina_rule2)

[09:26] Substitution (Team_058): Kyle Westbrook OUT → Jordan Ingram IN (stamina_rule2)

[09:26] Substitution (Team_058): Vince Hyland OUT → Pascal Holiday IN (stamina_rule2)

[09:26] Substitution (Team_058): Stephen Haliburton OUT → Shai Lowry IN (stamina_rule2)

[09:26] Substitution (Team_058): Tyrese Doncic OUT → Jarrett Gilgeous-Alexander IN (stamina_rule2)

[09:14] Team_058 possession (Score: 24-20)
Pascal Holiday attempts a Midrange. Contested by Ayo Smith (4.0 feet, MAN). Pascal Holiday misses. Rebound secured by Jaren Rozier.

[09:02] Team_074 possession (Score: 24-20)
FOUL! Reach-in foul on Shai Lowry during the drive. [Team fouls: 2] No free throws, side out. (Shai Lowry: 1 personal fouls)

[08:45] Team_074 possession (Score: 24-20)
Ayo Smith attempts a Layup. Wide open! Pascal Holiday is 7.1 feet away. [MAN] Ayo Smith misses. Rebound secured by Shai Lowry.

[08:30] Team_058 possession (Score: 24-20)
FOUL! Reach-in foul on Jaren Rozier during the drive. [Team fouls: 3] No free throws, side out. (Jaren Rozier: 1 personal fouls)

[08:16] Team_058 possession (Score: 24-20)
Pascal Holiday attempts a 3Pt. Heavily contested by James Barnes (1.6 feet, ZONE)! PASCAL HOLIDAY MAKES IT! Assist: Shai Lowry
Score: 24-23

[07:56] Team_074 possession (Score: 24-23)
Ayo Smith attempts a 3Pt. Wide open! Draymond Williamson is 6.6 feet away. [ZONE] AYO SMITH MAKES IT! Assist: Jaren Rozier
Score: 27-23

[07:44] Team_058 possession (Score: 27-23)
Jarrett Gilgeous-Alexander attempts a Midrange. Contested by Jaren Rozier (3.9 feet, MAN). JARRETT GILGEOUS-ALEXANDER MAKES IT! Assist: Shai Lowry
Score: 27-25

[07:31] Team_074 possession (Score: 27-25)
Yao Randle attempts a 3Pt. Contested by Shai Lowry (3.1 feet, MAN). Yao Randle misses. Rebound secured by Pascal Holiday.

[07:21] Team_058 possession (Score: 27-25)
Draymond Williamson loses the ball! Stripped by James Barnes! TURNOVER! (live ball)

[07:08] Team_074 possession (Score: 27-25)
FOUL! Shooting foul on Shai Lowry. Yao Randle to the line for 2 free throws. [Team fouls: 3] (Shai Lowry: 2 personal fouls)   FT 1/2: GOOD   FT 2/2: GOOD Yao Randle makes 2/2 from the line.
Score: 29-25

[06:55] Team_058 possession (Score: 29-25)
Jordan Ingram attempts a Midrange. Wide open! Yao Randle is 8.1 feet away. [ZONE] JORDAN INGRAM MAKES IT!
Score: 29-27

[06:36] Team_074 possession (Score: 29-27)
James Barnes attempts a Layup. Contested by Draymond Williamson (2.3 feet, MAN). JAMES BARNES MAKES IT! Assist: Yao Randle
Score: 31-27

[06:22] Team_058 possession (Score: 31-27)
Draymond Williamson attempts a Layup. Contested by James Barnes (4.3 feet, MAN). Draymond Williamson misses. Rebound secured by Jaren Rozier.

[06:06] Team_074 possession (Score: 31-27)
Jaren Rozier makes the Layup and draws the foul on Jarrett Gilgeous-Alexander! And-1! Jaren Rozier to the line for 1. [Team fouls: 4] (Jarrett Gilgeous-Alexander: 1 personal fouls)   FT 1/1: GOOD Jaren Rozier makes 1/1 from the line.
Score: 34-27

[05:47] Team_058 possession (Score: 34-27)
Draymond Williamson attempts a 3Pt. Wide open! James Barnes is 7.6 feet away. [MAN] DRAYMOND WILLIAMSON MAKES IT! Assist: Shai Lowry
Score: 34-30

[05:35] Team_074 possession (Score: 34-30)
Jaren Rozier attempts a Layup. BLOCKED BY SHAI LOWRY! Ball goes out off Shai Lowry. Jaren Rozier's ball!

[05:16] Team_074 possession (Score: 34-30)
Ayo Smith attempts a 3Pt. Heavily contested by Draymond Williamson (0.5 feet, ZONE)! Ayo Smith misses. Rebound secured by Pascal Holiday.

[04:59] Team_058 possession (Score: 34-30)
Jarrett Gilgeous-Alexander throws a bad pass out of bounds! TURNOVER! (dead ball)

[04:47] Team_074 possession (Score: 34-30)
Giannis Westbrook drives, picks up Jordan Ingram. Help arrives from Pascal Holiday! Giannis Westbrook attempts a Dunk. Contested by Pascal Holiday (4.5 feet, MAN). Giannis Westbrook misses. FOUL! Loose ball foul on Pascal Holiday during the rebound battle. [IN THE BONUS! 5 team fouls] Jaren Rozier to the line for 2 free throws. (Pascal Holiday: 1 personal fouls)   FT 1/2: MISS   FT 2/2: MISS Jaren Rozier makes 0/2 from the line. Offensive rebound by Jaren Rozier! Jaren Rozier kicks it out.

[04:35] Team_074 possession (Score: 34-30)
Yao Randle drives and kicks out. Jaren Rozier attempts a 3Pt. Wide open! Draymond Williamson is 7.5 feet away. [ZONE] Jaren Rozier misses. Rebound secured by Shai Lowry.

[04:23] Team_058 possession (Score: 34-30)
Pascal Holiday attempts a 3Pt. Wide open! Ayo Smith is 7.9 feet away. [MAN] PASCAL HOLIDAY MAKES IT! Assist: Jordan Ingram
Score: 34-33

[04:12] Team_074 possession (Score: 34-33)
Jaren Rozier attempts a 3Pt. Contested by Draymond Williamson (4.8 feet, ZONE). Jaren Rozier misses. Rebound secured by Shai Lowry.

[03:56] Team_058 possession (Score: 34-33)
Pascal Holiday attempts a Layup. Contested by Ayo Smith (4.4 feet, MAN). PASCAL HOLIDAY MAKES IT! Assist: Jordan Ingram
Score: 34-35

[03:41] Team_074 possession (Score: 34-35)
Ayo Smith drives, Shai Lowry stays with him. Ayo Smith attempts a Layup. Wide open! Shai Lowry is 6.6 feet away. [ZONE] Ayo Smith misses. Rebound secured by Jarrett Gilgeous-Alexander.

[03:28] Team_058 possession (Score: 34-35)
Draymond Williamson attempts a Midrange. Wide open! James Barnes is 6.6 feet away. [MAN] DRAYMOND WILLIAMSON MAKES IT!
Score: 34-37

[03:17] Team_074 possession (Score: 34-37)
Ayo Smith drives, Pascal Holiday stays with him. Ayo Smith attempts a Layup. Contested by Pascal Holiday (6.0 feet, MAN). Ayo Smith misses. Rebound secured by Jarrett Gilgeous-Alexander.

[02:59] Team_058 possession (Score: 34-37)
Pascal Holiday makes the Layup and draws the foul on Jaren Rozier! And-1! Pascal Holiday to the line for 1. [Team fouls: 4] (Jaren Rozier: 2 personal fouls)   FT 1/1: GOOD Pascal Holiday makes 1/1 from the line.
Score: 34-40

[02:44] Team_074 possession (Score: 34-40)
Jaren Rozier attempts a Midrange. Wide open! Jarrett Gilgeous-Alexander is 10.0 feet away. [MAN] Jaren Rozier misses. Rebound secured by Jarrett Gilgeous-Alexander.

[02:31] Team_058 possession (Score: 34-40)
Pascal Holiday attempts a 3Pt. Contested by Ayo Smith (5.9 feet, MAN). PASCAL HOLIDAY MAKES IT! Assist: Jarrett Gilgeous-Alexander
Score: 34-43

[02:13] Team_074 possession (Score: 34-43)
Giannis Westbrook attempts a Layup. Wide open! Shai Lowry is 6.5 feet away. [ZONE] GIANNIS WESTBROOK MAKES IT!
Score: 36-43

[02:02] Team_058 possession (Score: 36-43)
Jarrett Gilgeous-Alexander attempts a 3Pt. Contested by James Barnes (4.0 feet, ZONE). Jarrett Gilgeous-Alexander misses. Rebound secured by Jaren Rozier.

[01:46] Team_074 possession (Score: 36-43)
Ayo Smith attempts a 3Pt. Contested by Draymond Williamson (4.0 feet, ZONE). Ayo Smith misses. Rebound secured by Shai Lowry.

[01:32] Team_058 possession (Score: 36-43)
Pascal Holiday attempts a Midrange. Contested by Yao Randle (4.2 feet, ZONE). Pascal Holiday misses. Rebound secured by Ayo Smith.

[01:14] Team_074 possession (Score: 36-43)
Giannis Westbrook attempts a 3Pt. Wide open! Pascal Holiday is 6.4 feet away. [ZONE] Giannis Westbrook misses. FOUL! Loose ball foul on Pascal Holiday during the rebound battle. [IN THE BONUS! 6 team fouls] Jaren Rozier to the line for 2 free throws. (Pascal Holiday: 2 personal fouls)   FT 1/2: GOOD   FT 2/2: GOOD Jaren Rozier makes 2/2 from the line.
Score: 38-43

[00:58] Team_058 possession (Score: 38-43)
Jordan Ingram drives, Yao Randle stays with him. Jordan Ingram attempts a Layup. Contested by Yao Randle (3.7 feet, ZONE). JORDAN INGRAM MAKES IT!
Score: 38-45

[00:43] Team_074 possession (Score: 38-45)
Yao Randle attempts a 3Pt. Wide open! Shai Lowry is 6.3 feet away. [ZONE] YAO RANDLE MAKES IT! Assist: Giannis Westbrook
Score: 41-45

[00:28] Team_058 possession (Score: 41-45)
Draymond Williamson attempts a 3Pt. Wide open! James Barnes is 6.6 feet away. [MAN] Draymond Williamson misses. Rebound secured by Jaren Rozier.

[00:14] Team_074 possession (Score: 41-45)
Jaren Rozier attempts a Midrange. Contested by Shai Lowry (3.3 feet, ZONE). Jaren Rozier misses. Rebound secured by Jarrett Gilgeous-Alexander.

[00:05] Team_058 possession (Score: 41-45)
Pascal Holiday loses control! Ball rolls out of bounds! TURNOVER! (dead ball)

================================================================================
                              2ND QUARTER COMPLETE                              
================================================================================

2ND QUARTER SCORE: Team_074 20, Team_058 30

BOX SCORE:
================================================================================

Team_074
--------------------------------------------------------------------------------
Player                MIN  PTS  REB  AST  TO      FG   FG%      3P   3P%
--------------------------------------------------------------------------------
Jaren Rozier            9    5    5    1   0   2/5    40.0     0/0   0.0
Yao Randle              9    5    0    1   0   2/4    50.0     0/0   0.0
Donovan Doncic         15    3    2    0   0   1/2    50.0     0/0   0.0
Ayo Smith               9    3    1    0   0   1/6    16.7     0/0   0.0
James Barnes            9    2    0    0   0   1/1   100.0     0/0   0.0
Giannis Westbrook       9    2    0    1   0   1/1   100.0     0/0   0.0
Shai Green             15    0    1    0   0   0/0     0.0     0/0   0.0
Chris Carter           15    0    0    0   0   0/1     0.0     0/0   0.0

TEAM: FG: 8/20 (40.0%), 3PT: 4/9 (44.4%), REB: 9 (2 off, 7 def), AST: 3, TO: 2
TEAM FOULS: 4


Team_058
--------------------------------------------------------------------------------
Player                MIN  PTS  REB  AST  TO      FG   FG%      3P   3P%
--------------------------------------------------------------------------------
Pascal Holiday          9   14    2    0   0   5/7    71.4     0/0   0.0
Draymond Williamson     9    5    0    0   0   2/4    50.0     0/0   0.0
Jordan Ingram           9    4    0    2   0   2/2   100.0     0/0   0.0
Stephen Haliburton     15    3    1    0   0   1/1   100.0     0/0   0.0
Kyle Westbrook         15    2    0    0   0   1/1   100.0     0/0   0.0
Jarrett Gilgeous-Alexander    9    2    4    1   0   1/2    50.0     0/0   0.0
Vince Hyland           15    0    0    0   0   0/1     0.0     0/0   0.0
Tyrese Doncic          15    0    0    0   0   0/1     0.0     0/0   0.0
Shai Lowry              9    0    4    3   0   0/0     0.0     0/0   0.0

TEAM: FG: 12/19 (63.2%), 3PT: 4/6 (66.7%), REB: 11 (0 off, 11 def), AST: 6, TO: 3
TEAM FOULS: 6 [Team_074 in BONUS]

================================================================================

================================================================================
                       3RD QUARTER - Team_074 vs Team_058                       
================================================================================

[12:00] Team_074 possession (Score: 41-45)
Shai Green drives to the basket... Shai Green throws a bad pass out of bounds! TURNOVER! (dead ball)

[11:48] Team_058 possession (Score: 41-45)
Tyrese Doncic attempts a Layup. Contested by James Turner (5.7 feet, MAN). TYRESE DONCIC MAKES IT! Assist: Bradley Sexton
Score: 41-47

[11:34] Team_074 possession (Score: 41-47)
James Turner drives, Stephen Haliburton stays with him. James Turner attempts a Layup. Contested by Stephen Haliburton (2.3 feet, ZONE). James Turner misses. Rebound secured by Stephen Haliburton.

[11:19] Team_058 possession (Score: 41-47)
FOUL! Reach-in foul on Shai Green during the drive. [Team fouls: 1] No free throws, side out. (Shai Green: 1 personal fouls)

[11:05] Team_058 possession (Score: 41-47)
Kyle Westbrook attempts a 3Pt. Heavily contested by Chris Carter (1.7 feet, MAN)! Kyle Westbrook misses. Rebound secured by Donovan Doncic.

[10:46] Team_074 possession (Score: 41-47)
James Turner attempts a Midrange. Wide open! Tyrese Doncic is 6.1 feet away. [MAN] JAMES TURNER MAKES IT!
Score: 43-47

[10:34] Team_058 possession (Score: 43-47)
FOUL! Reach-in foul on Donovan Doncic during the drive. [Team fouls: 2] No free throws, side out. (Donovan Doncic: 1 personal fouls)

[10:22] Team_058 possession (Score: 43-47)
Kyle Westbrook attempts a Midrange. Heavily contested by Chris Carter (1.2 feet, ZONE)! KYLE WESTBROOK MAKES IT! Assist: Vince Hyland
Score: 43-49

[10:04] Team_074 possession (Score: 43-49)
Shai Green attempts a 3Pt. Heavily contested by Bradley Sexton (1.8 feet, ZONE)! Shai Green misses. Rebound secured by Bradley Sexton.

[09:50] Team_058 possession (Score: 43-49)
Stephen Haliburton attempts a Midrange. Contested by Donovan Doncic (4.3 feet, MAN). Stephen Haliburton misses. FOUL! Loose ball foul on Shai Green during the rebound battle. [Team fouls: 3] No free throws, side out. (Shai Green: 2 personal fouls)

[09:39] Team_058 possession (Score: 43-49)
Kyle Westbrook attempts a 3Pt. Heavily contested by Chris Carter (1.3 feet, MAN)! Kyle Westbrook misses. Rebound secured by Donovan Doncic.

[09:24] Team_074 possession (Score: 43-49)
Dwyane Quickley attempts a 3Pt. Contested by Bradley Sexton (2.5 feet, MAN). Dwyane Quickley misses. Rebound secured by Tyrese Doncic.

[09:08] Team_058 possession (Score: 43-49)
Vince Hyland attempts a Midrange. Wide open! James Turner is 6.4 feet away. [ZONE] VINCE HYLAND MAKES IT! Assist: Stephen Haliburton
Score: 43-51

[08:57] Team_074 possession (Score: 43-51)
Donovan Doncic attempts a 3Pt. Contested by Bradley Sexton (3.3 feet, ZONE). DONOVAN DONCIC MAKES IT! Assist: Dwyane Quickley
Score: 46-51

[08:41] Team_058 possession (Score: 46-51)
Bradley Sexton attempts a 3Pt. Contested by Dwyane Quickley (5.7 feet, ZONE). BRADLEY SEXTON MAKES IT!
Score: 46-54

[08:28] Team_074 possession (Score: 46-54)
James Turner drives to the basket... James Turner loses the ball! Stripped by Stephen Haliburton! TURNOVER! (live ball)

[08:17] Team_058 possession (Score: 46-54)
Bradley Sexton attempts a 3Pt. Contested by Chris Carter (3.0 feet, ZONE). Bradley Sexton misses. FOUL! Loose ball foul on Donovan Doncic during the rebound battle. [Team fouls: 4] No free throws, side out. (Donovan Doncic: 2 personal fouls)

[08:06] Team_058 possession (Score: 46-54)
Vince Hyland drives, picks up Donovan Doncic. Help arrives from Chris Carter! Vince Hyland attempts a Layup. Contested by Chris Carter (3.9 feet, ZONE). VINCE HYLAND MAKES IT! Assist: Stephen Haliburton
Score: 46-56

[07:48] Team_074 possession (Score: 46-56)
James Turner attempts a 3Pt. Contested by Bradley Sexton (2.3 feet, ZONE). JAMES TURNER MAKES IT! Assist: Shai Green
Score: 49-56

[07:34] Team_058 possession (Score: 49-56)
Kyle Westbrook attempts a 3Pt. Contested by Chris Carter (4.7 feet, MAN). KYLE WESTBROOK MAKES IT! Assist: Bradley Sexton
Score: 49-59

[07:19] Team_074 possession (Score: 49-59)
James Turner attempts a Midrange. BLOCKED BY TYRESE DONCIC! Ball goes out off Tyrese Doncic. James Turner's ball!

[07:03] Team_074 possession (Score: 49-59)
Dwyane Quickley attempts a 3Pt. Heavily contested by Bradley Sexton (1.9 feet, ZONE)! Dwyane Quickley misses. Rebound secured by Tyrese Doncic.

[06:49] Team_058 possession (Score: 49-59)
Tyrese Doncic drives, picks up Donovan Doncic. Help arrives from Chris Carter! Tyrese Doncic attempts a Dunk. Contested by Chris Carter (4.1 feet, ZONE). Tyrese Doncic misses. Rebound secured by Donovan Doncic.

[06:35] Team_074 possession (Score: 49-59)
Dwyane Quickley attempts a 3Pt. Contested by Bradley Sexton (3.5 feet, ZONE). Dwyane Quickley misses. Rebound secured by Bradley Sexton.

[06:22] Team_058 possession (Score: 49-59)
Tyrese Doncic attempts a 3Pt. Contested by Dwyane Quickley (5.8 feet, ZONE). TYRESE DONCIC MAKES IT! Assist: Kyle Westbrook
Score: 49-62

[06:08] Team_074 possession (Score: 49-62)
Dwyane Quickley loses the ball! Stripped by Bradley Sexton! TURNOVER! (live ball)

[05:54] Team_058 possession (Score: 49-62)
Stephen Haliburton drives, Donovan Doncic stays with him. Stephen Haliburton attempts a Layup. Contested by Donovan Doncic (5.9 feet, MAN). STEPHEN HALIBURTON MAKES IT! Assist: Kyle Westbrook
Score: 49-64

[05:37] Team_074 possession (Score: 49-64)
James Turner drives and kicks out. Shai Green attempts a 3Pt. Contested by Bradley Sexton (4.1 feet, ZONE). SHAI GREEN MAKES IT! Assist: Chris Carter
Score: 52-64

[05:25] Team_058 possession (Score: 52-64)
Bradley Sexton attempts a Midrange. BLOCKED BY DONOVAN DONCIC! Ball is loose! Rebound secured by James Turner.

[05:11] Team_074 possession (Score: 52-64)
Dwyane Quickley attempts a Midrange. Contested by Bradley Sexton (2.7 feet, MAN). DWYANE QUICKLEY MAKES IT!
Score: 54-64

[05:00] Team_058 possession (Score: 54-64)
Stephen Haliburton attempts a Midrange. Wide open! Donovan Doncic is 8.4 feet away. [MAN] STEPHEN HALIBURTON MAKES IT! Assist: Tyrese Doncic
Score: 54-66

[04:47] Team_074 possession (Score: 54-66)
Chris Carter drives, picks up Stephen Haliburton. Help arrives from Bradley Sexton! Chris Carter attempts a Dunk. Contested by Bradley Sexton (3.3 feet, ZONE). CHRIS CARTER MAKES IT!
Score: 56-66

[04:32] Team_058 possession (Score: 56-66)
Tyrese Doncic attempts a 3Pt. Contested by James Turner (4.7 feet, MAN). TYRESE DONCIC MAKES IT! Assist: Stephen Haliburton
Score: 56-69

[04:21] Team_074 possession (Score: 56-69)
Donovan Doncic attempts a Midrange. Wide open! Stephen Haliburton is 6.2 feet away. [MAN] Donovan Doncic misses. Rebound secured by Tyrese Doncic.

[04:03] Team_058 possession (Score: 56-69)
Vince Hyland drives, Donovan Doncic stays with him. Vince Hyland attempts a Dunk. Contested by Donovan Doncic (3.6 feet, ZONE). VINCE HYLAND MAKES IT!
Score: 56-71

[03:53] Team_074 possession (Score: 56-71)
Chris Carter drives, picks up Stephen Haliburton. Help arrives from Bradley Sexton! Chris Carter attempts a Dunk. Contested by Bradley Sexton (3.3 feet, ZONE). CHRIS CARTER MAKES IT! Assist: Shai Green
Score: 58-71

[03:40] Team_058 possession (Score: 58-71)
Vince Hyland attempts a Midrange. Heavily contested by Shai Green (1.3 feet, MAN)! VINCE HYLAND MAKES IT!
Score: 58-73

[03:27] Team_074 possession (Score: 58-73)
Shai Green attempts a 3Pt. Contested by Bradley Sexton (5.4 feet, ZONE). Shai Green misses. Rebound secured by Bradley Sexton.

[03:13] Team_058 possession (Score: 58-73)
Tyrese Doncic attempts a Midrange. Contested by Donovan Doncic (2.7 feet, ZONE). Tyrese Doncic misses. Rebound secured by Donovan Doncic.

[02:56] Team_074 possession (Score: 58-73)
James Turner attempts a 3Pt. Heavily contested by Bradley Sexton (0.5 feet, ZONE)! James Turner misses. Rebound secured by Stephen Haliburton.

[02:44] Team_058 possession (Score: 58-73)
Vince Hyland attempts a 3Pt. Wide open! Shai Green is 6.1 feet away. [MAN] Vince Hyland misses. Offensive rebound by Stephen Haliburton! Stephen Haliburton's putback is no good. Rebound secured by Donovan Doncic.

[02:29] Team_074 possession (Score: 58-73)
Chris Carter drives, Kyle Westbrook stays with him. Chris Carter attempts a Dunk. Contested by Kyle Westbrook (4.4 feet, MAN). Chris Carter misses. Rebound secured by Stephen Haliburton.

[02:16] Team_058 possession (Score: 58-73)
Bradley Sexton attempts a 3Pt. Contested by Dwyane Quickley (5.2 feet, MAN). Bradley Sexton misses. Rebound secured by James Turner.

[01:58] Team_074 possession (Score: 58-73)
Donovan Doncic drives and kicks out. Chris Carter attempts a Midrange. Contested by Stephen Haliburton (5.3 feet, ZONE). Chris Carter misses. Rebound secured by Tyrese Doncic.

[01:46] Team_058 possession (Score: 58-73)
Vince Hyland attempts a Midrange. Contested by Shai Green (4.2 feet, MAN). Vince Hyland misses. Rebound secured by Shai Green.

[01:31] Team_074 possession (Score: 58-73)
Chris Carter drives, picks up Stephen Haliburton. Help arrives from Bradley Sexton! Chris Carter attempts a Dunk. Contested by Bradley Sexton (3.6 feet, ZONE). CHRIS CARTER MAKES IT!
Score: 60-73

[01:21] Team_058 possession (Score: 60-73)
Kyle Westbrook attempts a 3Pt. Contested by Chris Carter (3.2 feet, MAN). KYLE WESTBROOK MAKES IT! Assist: Vince Hyland
Score: 60-76

[01:10] Team_074 possession (Score: 60-76)
Shai Green attempts a Layup. BLOCKED BY VINCE HYLAND! Ball is loose! Offensive rebound by James Turner! James Turner kicks it out.

[00:51] Team_074 possession (Score: 60-76)
Shai Green attempts a 3Pt. Wide open! Kyle Westbrook is 7.8 feet away. [ZONE] Shai Green misses. Rebound secured by Stephen Haliburton.

[00:37] Team_058 possession (Score: 60-76)
Kyle Westbrook attempts a Midrange. Heavily contested by Donovan Doncic (0.5 feet, ZONE)! Kyle Westbrook misses. Rebound secured by Donovan Doncic.

[00:21] Team_074 possession (Score: 60-76)
Chris Carter drives to the basket... Chris Carter throws a bad pass out of bounds! TURNOVER! (dead ball)

[00:21] Substitution (Team_074): Dwyane Quickley OUT → James Barnes IN (stamina_rule2)

[00:21] Substitution (Team_074): Chris Carter OUT → Giannis Westbrook IN (stamina_rule2)

[00:21] Substitution (Team_074): Shai Green OUT → Ayo Smith IN (stamina_rule2)

[00:21] Substitution (Team_074): Donovan Doncic OUT → Yao Randle IN (stamina_rule2)

[00:21] Substitution (Team_074): James Turner OUT → Jaren Rozier IN (stamina_rule2)

[00:21] Substitution (Team_058): Bradley Sexton OUT → Draymond Williamson IN (stamina_rule2)

[00:21] Substitution (Team_058): Kyle Westbrook OUT → Jordan Ingram IN (stamina_rule2)

[00:21] Substitution (Team_058): Vince Hyland OUT → Pascal Holiday IN (stamina_rule2)

[00:21] Substitution (Team_058): Stephen Haliburton OUT → Shai Lowry IN (stamina_rule2)

[00:21] Substitution (Team_058): Tyrese Doncic OUT → Jarrett Gilgeous-Alexander IN (stamina_rule2)

[00:08] Team_058 possession (Score: 60-76)
Pascal Holiday attempts a Midrange. Wide open! Ayo Smith is 6.9 feet away. [MAN] Pascal Holiday misses. Rebound secured by Jaren Rozier.

================================================================================
                              3RD QUARTER COMPLETE                              
================================================================================

3RD QUARTER SCORE: Team_074 19, Team_058 31

BOX SCORE:
================================================================================

Team_074
--------------------------------------------------------------------------------
Player                MIN  PTS  REB  AST  TO      FG   FG%      3P   3P%
--------------------------------------------------------------------------------
Chris Carter           27    6    0    1   0   3/4    75.0     0/0   0.0
James Turner           27    5    3    0   0   2/4    50.0     0/0   0.0
Donovan Doncic         27    3    6    0   0   1/3    33.3     0/0   0.0
Shai Green             27    3    1    2   0   1/4    25.0     0/0   0.0
Dwyane Quickley        27    2    0    1   0   1/4    25.0     0/0   0.0
Jaren Rozier           10    0    1    0   0   0/0     0.0     0/0   0.0

TEAM: FG: 8/19 (42.1%), 3PT: 2/9 (22.2%), REB: 10 (1 off, 9 def), AST: 4, TO: 4
TEAM FOULS: 4


Team_058
--------------------------------------------------------------------------------
Player                MIN  PTS  REB  AST  TO      FG   FG%      3P   3P%
--------------------------------------------------------------------------------
Tyrese Doncic          27    8    5    1   0   3/5    60.0     0/0   0.0
Kyle Westbrook         27    8    0    2   0   3/6    50.0     0/0   0.0
Vince Hyland           27    8    0    2   0   4/6    66.7     0/0   0.0
Stephen Haliburton     27    4    5    3   0   2/2   100.0     0/0   0.0
Bradley Sexton         27    3    3    2   0   1/3    33.3     0/0   0.0
Pascal Holiday         10    0    0    0   0   0/1     0.0     0/0   0.0

TEAM: FG: 13/23 (56.5%), 3PT: 5/9 (55.6%), REB: 14 (3 off, 11 def), AST: 10, TO: 0
TEAM FOULS: 0

================================================================================

================================================================================
                       4TH QUARTER - Team_074 vs Team_058                       
================================================================================

[12:00] Substitution (Team_074): Dwyane Quickley OUT (stamina: 69) → James Barnes IN (comeback_detected)

[12:00] Substitution (Team_058): Bradley Sexton OUT (stamina: 70) → Draymond Williamson IN (comeback_detected)

[12:00] Team_074 possession (Score: 60-76)
FOUL! Reach-in foul on Stephen Haliburton during the drive. [Team fouls: 1] No free throws, side out. (Stephen Haliburton: 1 personal fouls)

[11:44] Team_074 possession (Score: 60-76)
Chris Carter attempts a 3Pt. Wide open! Kyle Westbrook is 7.2 feet away. [MAN] Chris Carter misses. Offensive rebound by Donovan Doncic! Donovan Doncic kicks it out.

[11:30] Team_074 possession (Score: 60-76)
Donovan Doncic drives and kicks out. Donovan Doncic attempts a 3Pt. Contested by Kyle Westbrook (2.4 feet, ZONE). Donovan Doncic misses. Rebound secured by Tyrese Doncic.

[11:20] Team_058 possession (Score: 60-76)
Kyle Westbrook attempts a 3Pt. Contested by James Barnes (3.2 feet, ZONE). Kyle Westbrook misses. Rebound secured by Donovan Doncic.

[11:05] Team_074 possession (Score: 60-76)
James Barnes attempts a Midrange. Wide open! Draymond Williamson is 6.5 feet away. [MAN] James Barnes misses. Offensive rebound by Donovan Doncic! Donovan Doncic kicks it out.

[10:51] Team_074 possession (Score: 60-76)
Chris Carter attempts a Layup. Contested by Kyle Westbrook (5.9 feet, MAN). CHRIS CARTER MAKES IT!
Score: 62-76

[10:36] Team_058 possession (Score: 62-76)
Vince Hyland attempts a Midrange. Contested by Shai Green (4.2 feet, MAN). Vince Hyland misses. Rebound secured by Donovan Doncic.

[10:22] Team_074 possession (Score: 62-76)
James Barnes attempts a Midrange. Contested by Draymond Williamson (3.3 feet, MAN). James Barnes misses. Rebound secured by Stephen Haliburton.

[10:09] Team_058 possession (Score: 62-76)
Tyrese Doncic attempts a Layup. Heavily contested by James Turner (0.9 feet, MAN)! TYRESE DONCIC MAKES IT! Assist: Draymond Williamson
Score: 62-78

[09:57] Team_074 possession (Score: 62-78)
Shai Green drives, Vince Hyland stays with him. Shai Green attempts a Layup. Contested by Vince Hyland (5.9 feet, MAN). Shai Green misses. Offensive rebound by James Turner! James Turner kicks it out.

[09:39] Team_074 possession (Score: 62-78)
Donovan Doncic attempts a 3Pt. Wide open! Draymond Williamson is 6.9 feet away. [ZONE] Donovan Doncic misses. Rebound secured by Tyrese Doncic.

[09:28] Team_058 possession (Score: 62-78)
Kyle Westbrook attempts a 3Pt. Wide open! James Barnes is 6.6 feet away. [ZONE] KYLE WESTBROOK MAKES IT! Assist: Vince Hyland
Score: 62-81

[09:10] Team_074 possession (Score: 62-81)
James Turner attempts a Layup. Wide open! Stephen Haliburton is 9.3 feet away. [ZONE] James Turner misses. Rebound secured by Stephen Haliburton.

[08:57] Team_058 possession (Score: 62-81)
Vince Hyland attempts a 3Pt. Contested by Shai Green (4.3 feet, MAN). Vince Hyland misses. Rebound secured by Shai Green.

[08:39] Team_074 possession (Score: 62-81)
FOUL! Offensive foul on Donovan Doncic! Stephen Haliburton drew the charge! [Team fouls: 1] (Donovan Doncic: 1 personal fouls) TURNOVER! (dead ball)

[08:22] Team_058 possession (Score: 62-81)
Tyrese Doncic makes the Layup and draws the foul on Donovan Doncic! And-1! Tyrese Doncic to the line for 1. [Team fouls: 2] (Donovan Doncic: 2 personal fouls)   FT 1/1: GOOD Tyrese Doncic makes 1/1 from the line.
Score: 62-84

[08:07] Team_074 possession (Score: 62-84)
James Barnes attempts a 3Pt. Wide open! Draymond Williamson is 8.7 feet away. [ZONE] James Barnes misses. Rebound secured by Vince Hyland.

[07:54] Team_058 possession (Score: 62-84)
Draymond Williamson attempts a Layup. Contested by James Barnes (4.0 feet, MAN). Draymond Williamson misses. Rebound secured by Donovan Doncic.

[07:38] Team_074 possession (Score: 62-84)
Chris Carter attempts a Layup. Contested by Stephen Haliburton (4.6 feet, ZONE). CHRIS CARTER MAKES IT! Assist: James Turner
Score: 64-84

[07:22] Team_058 possession (Score: 64-84)
Tyrese Doncic attempts a Midrange. Contested by Shai Green (2.5 feet, ZONE). Tyrese Doncic misses. Rebound secured by James Turner.

[07:11] Team_074 possession (Score: 64-84)
Chris Carter attempts a Midrange. Contested by Kyle Westbrook (5.0 feet, MAN). CHRIS CARTER MAKES IT!
Score: 66-84

[06:56] Team_058 possession (Score: 66-84)
Kyle Westbrook drives to the basket... Kyle Westbrook throws a bad pass! Stolen by Chris Carter! TURNOVER! (live ball)

[06:42] Team_074 possession (Score: 66-84)
Chris Carter attempts a 3Pt. Wide open! Stephen Haliburton is 7.6 feet away. [ZONE] Chris Carter misses. Rebound secured by Vince Hyland.

[06:29] Team_058 possession (Score: 66-84)
Stephen Haliburton attempts a 3Pt. Contested by Donovan Doncic (2.0 feet, MAN). STEPHEN HALIBURTON MAKES IT! Assist: Kyle Westbrook
Score: 66-87

[06:09] Team_074 possession (Score: 66-87)
Shai Green drives and kicks out. FOUL! Shooting foul on Draymond Williamson. James Turner to the line for 3 free throws. [Team fouls: 2] (Draymond Williamson: 1 personal fouls)   FT 1/3: GOOD   FT 2/3: GOOD   FT 3/3: GOOD James Turner makes 3/3 from the line.
Score: 69-87

[05:56] Team_058 possession (Score: 69-87)
Draymond Williamson attempts a 3Pt. Wide open! James Barnes is 6.7 feet away. [MAN] Draymond Williamson misses. Rebound secured by James Turner.

[05:38] Team_074 possession (Score: 69-87)
Chris Carter attempts a 3Pt. Wide open! Kyle Westbrook is 6.2 feet away. [MAN] CHRIS CARTER MAKES IT! Assist: James Turner
Score: 72-87

[05:24] Team_058 possession (Score: 72-87)
Tyrese Doncic attempts a Midrange. Heavily contested by Shai Green (1.9 feet, ZONE)! Tyrese Doncic misses. Rebound secured by Shai Green.

[05:10] Team_074 possession (Score: 72-87)
Donovan Doncic drives, picks up Stephen Haliburton. Help arrives from Kyle Westbrook! Donovan Doncic attempts a Layup. Heavily contested by Kyle Westbrook (1.3 feet, MAN)! DONOVAN DONCIC MAKES IT! Assist: Shai Green
Score: 74-87

[04:55] Team_058 possession (Score: 74-87)
Draymond Williamson attempts a 3Pt. Contested by Chris Carter (4.5 feet, ZONE). DRAYMOND WILLIAMSON MAKES IT! Assist: Kyle Westbrook
Score: 74-90

[04:40] Team_074 possession (Score: 74-90)
James Barnes drives, Stephen Haliburton stays with him. James Barnes attempts a Dunk. Contested by Stephen Haliburton (4.7 feet, ZONE). JAMES BARNES MAKES IT! Assist: Shai Green
Score: 76-90

[04:21] Team_058 possession (Score: 76-90)
Tyrese Doncic attempts a 3Pt. Contested by James Barnes (5.2 feet, ZONE). Tyrese Doncic misses. Rebound secured by Shai Green.

[04:07] Team_074 possession (Score: 76-90)
James Barnes attempts a 3Pt. Contested by Draymond Williamson (5.3 feet, MAN). James Barnes misses. Rebound secured by Draymond Williamson.

[03:52] Team_058 possession (Score: 76-90)
Tyrese Doncic makes the Dunk and draws the foul on James Barnes! And-1! Tyrese Doncic to the line for 1. [Team fouls: 3] (James Barnes: 1 personal fouls)   FT 1/1: GOOD Tyrese Doncic makes 1/1 from the line.
Score: 76-93

[03:38] Team_074 possession (Score: 76-93)
Shai Green throws a bad pass out of bounds! TURNOVER! (dead ball)

[03:38] Substitution (Team_074): Chris Carter OUT → Giannis Westbrook IN (stamina_rule2)

[03:38] Substitution (Team_074): Shai Green OUT → Ayo Smith IN (stamina_rule2)

[03:38] Substitution (Team_074): Donovan Doncic OUT → Yao Randle IN (stamina_rule2)

[03:38] Substitution (Team_074): James Turner OUT → Jaren Rozier IN (stamina_rule2)

[03:38] Substitution (Team_058): Kyle Westbrook OUT → Jordan Ingram IN (stamina_rule2)

[03:38] Substitution (Team_058): Vince Hyland OUT → Pascal Holiday IN (stamina_rule2)

[03:38] Substitution (Team_058): Stephen Haliburton OUT → Shai Lowry IN (stamina_rule2)

[03:38] Substitution (Team_058): Tyrese Doncic OUT → Jarrett Gilgeous-Alexander IN (stamina_rule2)

[03:20] Team_058 possession (Score: 76-93)
Jarrett Gilgeous-Alexander loses the ball! Stripped by Jaren Rozier! TURNOVER! (live ball)

[03:05] Team_074 possession (Score: 76-93)
Ayo Smith attempts a 3Pt. Wide open! Draymond Williamson is 6.3 feet away. [ZONE] AYO SMITH MAKES IT! Assist: Yao Randle
Score: 79-93

[02:47] Team_058 possession (Score: 79-93)
Jordan Ingram attempts a Midrange. Wide open! Giannis Westbrook is 7.0 feet away. [MAN] Jordan Ingram misses. Offensive rebound by Shai Lowry! Shai Lowry kicks it out.

[02:35] Team_058 possession (Score: 79-93)
Pascal Holiday drives and kicks out. Draymond Williamson attempts a Midrange. Heavily contested by James Barnes (1.1 feet, MAN)! Draymond Williamson misses. Rebound secured by Jaren Rozier.

[02:17] Team_074 possession (Score: 79-93)
Jaren Rozier attempts a Layup. Contested by Jarrett Gilgeous-Alexander (5.0 feet, MAN). Jaren Rozier misses. FOUL! Loose ball foul on Jarrett Gilgeous-Alexander during the rebound battle. [Team fouls: 3] No free throws, side out. (Jarrett Gilgeous-Alexander: 1 personal fouls)

[02:06] Team_074 possession (Score: 79-93)
Ayo Smith attempts a Midrange. Contested by Pascal Holiday (4.6 feet, MAN). Ayo Smith misses. Rebound secured by Pascal Holiday.

[01:53] Team_058 possession (Score: 79-93)
Jordan Ingram attempts a Layup. Contested by Yao Randle (3.7 feet, ZONE). Jordan Ingram misses. Rebound secured by Ayo Smith.

[01:37] Team_074 possession (Score: 79-93)
Ayo Smith attempts a 3Pt. Wide open! Draymond Williamson is 6.7 feet away. [ZONE] Ayo Smith misses. Rebound secured by Jarrett Gilgeous-Alexander.

[01:22] Team_058 possession (Score: 79-93)
Pascal Holiday drives, Ayo Smith stays with him. Pascal Holiday attempts a Dunk. Contested by Ayo Smith (4.3 feet, MAN). PASCAL HOLIDAY MAKES IT!
Score: 79-95

[01:08] Team_074 possession (Score: 79-95)
FOUL! Shooting foul on Pascal Holiday. Yao Randle to the line for 3 free throws. [Team fouls: 4] (Pascal Holiday: 1 personal fouls)   FT 1/3: GOOD   FT 2/3: MISS   FT 3/3: GOOD Yao Randle makes 2/3 from the line.
Score: 81-95

[00:54] Team_058 possession (Score: 81-95)
Shai Lowry drives, picks up Yao Randle. Help arrives from Giannis Westbrook! Shai Lowry attempts a Dunk. Wide open! Giannis Westbrook is 6.6 feet away. [MAN] Shai Lowry misses. Rebound secured by Jaren Rozier.

[00:37] Team_074 possession (Score: 81-95)
Ayo Smith attempts a 3Pt. Contested by Draymond Williamson (4.8 feet, ZONE). AYO SMITH MAKES IT! Assist: James Barnes
Score: 84-95

[00:26] Team_058 possession (Score: 84-95)
Pascal Holiday attempts a Layup. Contested by Jaren Rozier (4.7 feet, ZONE). PASCAL HOLIDAY MAKES IT! Assist: Jarrett Gilgeous-Alexander
Score: 84-97

[00:12] Team_074 possession (Score: 84-97)
Ayo Smith drives, Pascal Holiday stays with him. Ayo Smith attempts a Layup. Wide open! Pascal Holiday is 7.4 feet away. [MAN] AYO SMITH MAKES IT! Assist: James Barnes
Score: 86-97

================================================================================
                              4TH QUARTER COMPLETE                              
================================================================================

4TH QUARTER SCORE: Team_074 26, Team_058 21

BOX SCORE:
================================================================================

Team_074
--------------------------------------------------------------------------------
Player                MIN  PTS  REB  AST  TO      FG   FG%      3P   3P%
--------------------------------------------------------------------------------
Chris Carter           35    9    0    0   0   4/5    80.0     0/0   0.0
Ayo Smith              13    8    1    0   0   3/5    60.0     0/0   0.0
James Turner           35    3    3    2   0   1/2    50.0     0/0   0.0
Donovan Doncic         35    2    5    0   0   1/3    33.3     0/0   0.0
James Barnes           22    2    0    2   0   1/4    25.0     0/0   0.0
Yao Randle             13    2    1    1   0   1/1   100.0     0/0   0.0
Shai Green             35    0    3    2   0   0/0     0.0     0/0   0.0
Jaren Rozier           13    0    2    0   0   0/0     0.0     0/0   0.0

TEAM: FG: 11/20 (55.0%), 3PT: 4/9 (44.4%), REB: 15 (4 off, 11 def), AST: 7, TO: 2
TEAM FOULS: 3


Team_058
--------------------------------------------------------------------------------
Player                MIN  PTS  REB  AST  TO      FG   FG%      3P   3P%
--------------------------------------------------------------------------------
Tyrese Doncic          35    8    2    0   0   3/6    50.0     0/0   0.0
Pascal Holiday         13    4    1    0   0   2/3    66.7     0/0   0.0
Kyle Westbrook         35    3    0    2   0   1/2    50.0     0/0   0.0
Stephen Haliburton     35    3    2    0   0   1/1   100.0     0/0   0.0
Draymond Williamson    22    3    1    1   0   1/3    33.3     0/0   0.0
Vince Hyland           35    0    2    1   0   0/2     0.0     0/0   0.0
Shai Lowry             13    0    1    0   0   0/1     0.0     0/0   0.0
Jordan Ingram          13    0    0    0   0   0/1     0.0     0/0   0.0
Jarrett Gilgeous-Alexander   13    0    1    1   0   0/0     0.0     0/0   0.0

TEAM: FG: 8/19 (42.1%), 3PT: 3/7 (42.9%), REB: 10 (1 off, 9 def), AST: 5, TO: 2
TEAM FOULS: 4

================================================================================

================================================================================
                               FULL GAME COMPLETE                               
================================================================================

FINAL SCORE: Team_074 86, Team_058 97

SCORING BY QUARTER:
--------------------------------------------------------------------------------
Team                     Q1     Q2     Q3     Q4    FINAL
--------------------------------------------------------------------------------
Team_074                 21     20     19     26       86
Team_058                 15     30     31     21       97
--------------------------------------------------------------------------------

FULL GAME BOX SCORE:
================================================================================

Team_074
--------------------------------------------------------------------------------
Player                MIN  PTS  REB  AST  TO      FG   FG%      3P   3P%      FT STL BLK
--------------------------------------------------------------------------------
Chris Carter           35   18    0    2   3   8/13   61.5   2/4    50.0   0/0     1   0
Shai Green             35    6    7    5   2   2/6    33.3   0/3     0.0   0/0     0   0
Donovan Doncic         35   10   23    0   3   4/10   40.0   2/3    66.7   3/3     0   2
James Turner           35   15    9    3   0   7/13   53.8   1/2    50.0   5/8     1   0
Dwyane Quickley        27    5    0    3   2   2/9    22.2   0/6     0.0   1/1     0   0
James Barnes           22    4    0    2   0   2/5    40.0   0/2     0.0   0/0     1   0
Giannis Westbrook      13    2    0    1   0   2/2   100.0   1/1   100.0   0/0     0   0
Ayo Smith              13   11    2    0   0   4/11   36.4   3/6    50.0   0/0     0   0
Yao Randle             13    7    1    2   0   3/5    60.0   2/3    66.7   4/5     0   0
Jaren Rozier           13    5    8    1   0   1/4    25.0   0/1     0.0   3/5     1   0

TEAM: FG: 35/78 (44.9%), 3PT: 11/31 (35.5%), REB: 47 (12 off, 35 def), AST: 19, TO: 10


Team_058
--------------------------------------------------------------------------------
Player                MIN  PTS  REB  AST  TO      FG   FG%      3P   3P%      FT STL BLK
--------------------------------------------------------------------------------
Kyle Westbrook         35   13    0    5   0   5/11   45.5   3/8    37.5   0/0     1   0
Vince Hyland           35   15    2    5   0   6/11   54.5   1/3    33.3   2/3     0   1
Stephen Haliburton     35   12   12    3   1   5/10   50.0   1/1   100.0   1/1     3   2
Tyrese Doncic          35   20    8    2   3   9/17   52.9   2/3    66.7   2/2     0   1
Bradley Sexton         27    5   10    2   1   2/5    40.0   1/2    50.0   0/0     1   0
Draymond Williamson    22    8    1    1   1   3/7    42.9   2/4    50.0   0/0     0   0
Jordan Ingram          13    4    0    2   0   2/3    66.7   0/0     0.0   0/0     0   0
Pascal Holiday         13   18    3    0   1   7/11   63.6   3/3   100.0   1/1     0   0
Shai Lowry             13    0    5    3   0   0/1     0.0   0/0     0.0   0/0     0   1
Jarrett Gilgeous-Alexander   13    2    5    2   2   1/2    50.0   0/1     0.0   0/0     0   0

TEAM: FG: 40/78 (51.3%), 3PT: 13/25 (52.0%), REB: 49 (7 off, 42 def), AST: 25, TO: 9

================================================================================
