================================================================================
                        FULL GAME - Team_086 vs Team_046                        
================================================================================

================================================================================
                       1ST QUARTER - Team_086 vs Team_046                       
================================================================================

[12:00] Team_086 possession (Score: 0-0)
Rudy Rose drives, Kevin Allen stays with him. Rudy Rose attempts a Layup. Wide open! Kevin Allen is 6.5 feet away. [MAN] RUDY ROSE MAKES IT! Assist: Lauri Johnson
Score: 2-0

[11:42] Team_046 possession (Score: 2-0)
Victor Nowitzki attempts a Midrange. Contested by Anfernee Harris (5.2 feet, MAN). VICTOR NOWITZKI MAKES IT!
Score: 2-2

[11:27] Team_086 possession (Score: 2-2)
FOUL! Offensive foul on Lauri Johnson! D'Angelo O'Neal drew the charge! [Team fouls: 1] (Lauri Johnson: 1 personal fouls) TURNOVER! (dead ball)

[11:12] Team_046 possession (Score: 2-2)
Lauri Carter drives, Bones Ginobili stays with him. Lauri Carter attempts a Dunk. Wide open! Bones Ginobili is 6.8 feet away. [ZONE] LAURI CARTER MAKES IT!
Score: 2-4

[10:58] Team_086 possession (Score: 2-4)
Lauri Johnson attempts a Midrange. Contested by Victor Nowitzki (4.0 feet, ZONE). LAURI JOHNSON MAKES IT!
Score: 4-4

[10:48] Team_046 possession (Score: 4-4)
Cade Wall drives, picks up Bones Ginobili. Help arrives from Anfernee Harris! Cade Wall attempts a Dunk. Wide open! Anfernee Harris is 6.2 feet away. [MAN] CADE WALL MAKES IT! Assist: Victor Nowitzki
Score: 4-6

[10:29] Team_086 possession (Score: 4-6)
Miles Gobert makes the Midrange and draws the foul on Lauri Carter! And-1! Miles Gobert to the line for 1. [Team fouls: 1] (Lauri Carter: 1 personal fouls)   FT 1/1: GOOD Miles Gobert makes 1/1 from the line.
Score: 7-6

[10:13] Team_046 possession (Score: 7-6)
Cade Wall attempts a Midrange. Contested by Bones Ginobili (5.7 feet, MAN). Cade Wall misses. Rebound secured by Rudy Rose.

[09:58] Team_086 possession (Score: 7-6)
Bones Ginobili attempts a Layup. Contested by Kevin Allen (5.6 feet, ZONE). Bones Ginobili misses. Rebound secured by Kevin Allen.

[09:47] Team_046 possession (Score: 7-6)
D'Angelo O'Neal drives, picks up Lauri Johnson. Help arrives from Miles Gobert! D'Angelo O'Neal attempts a Dunk. Contested by Miles Gobert (2.4 feet, MAN). D'Angelo O'Neal misses. Rebound secured by Rudy Rose.

[09:33] Team_086 possession (Score: 7-6)
Lauri Johnson attempts a Midrange. Contested by Kevin Allen (4.1 feet, ZONE). Lauri Johnson misses. Rebound secured by Kevin Allen.

[09:17] Team_046 possession (Score: 7-6)
Kevin Allen attempts a 3Pt. Wide open! Lauri Johnson is 7.4 feet away. [ZONE] KEVIN ALLEN MAKES IT! Assist: Lauri Carter
Score: 7-9

[09:01] Team_086 possession (Score: 7-9)
Anfernee Harris attempts a Layup. Wide open! Kevin Allen is 7.8 feet away. [ZONE] ANFERNEE HARRIS MAKES IT! Assist: Miles Gobert
Score: 9-9

[08:45] Team_046 possession (Score: 9-9)
FOUL! Shooting foul on Bones Ginobili. D'Angelo O'Neal to the line for 2 free throws. [Team fouls: 2] (Bones Ginobili: 1 personal fouls)   FT 1/2: GOOD   FT 2/2: MISS D'Angelo O'Neal makes 1/2 from the line. Rebound secured by Rudy Rose.
Score: 9-10

[08:28] Team_086 possession (Score: 9-10)
Lauri Johnson drives and kicks out. Rudy Rose attempts a 3Pt. Contested by Kevin Allen (4.3 feet, MAN). RUDY ROSE MAKES IT! Assist: Anfernee Harris
Score: 12-10

[08:18] Team_046 possession (Score: 12-10)
D'Angelo O'Neal attempts a 3Pt. Wide open! Lauri Johnson is 6.3 feet away. [MAN] D'ANGELO O'NEAL MAKES IT! Assist: Cade Wall
Score: 12-13

[08:07] Team_086 possession (Score: 12-13)
Lauri Johnson attempts a 3Pt. Contested by Lauri Carter (2.3 feet, ZONE). Lauri Johnson misses. Rebound secured by Lauri Carter.

[07:54] Team_046 possession (Score: 12-13)
Lauri Carter throws a bad pass out of bounds! TURNOVER! (dead ball)

[07:38] Team_086 possession (Score: 12-13)
Anfernee Harris attempts a Midrange. Contested by Lauri Carter (4.7 feet, ZONE). ANFERNEE HARRIS MAKES IT! Assist: Bones Ginobili
Score: 14-13

[07:24] Team_046 possession (Score: 14-13)
Lauri Carter attempts a Layup. Contested by Rudy Rose (5.9 feet, ZONE). Lauri Carter misses. Rebound secured by Rudy Rose.

[07:10] Team_086 possession (Score: 14-13)
Miles Gobert attempts a 3Pt. Contested by Lauri Carter (2.4 feet, ZONE). Miles Gobert misses. Rebound secured by Kevin Allen.

[06:55] Team_046 possession (Score: 14-13)
Kevin Allen drives and kicks out. Victor Nowitzki attempts a Midrange. Heavily contested by Miles Gobert (0.9 feet, ZONE)! VICTOR NOWITZKI MAKES IT! Assist: D'Angelo O'Neal
Score: 14-15

[06:42] Team_086 possession (Score: 14-15)
Bones Ginobili attempts a 3Pt. Contested by Lauri Carter (5.5 feet, ZONE). Bones Ginobili misses. Rebound secured by Lauri Carter.

[06:26] Team_046 possession (Score: 14-15)
Kevin Allen drives and kicks out. Kevin Allen attempts a Midrange. Heavily contested by Rudy Rose (1.7 feet, MAN)! Kevin Allen misses. Rebound secured by Miles Gobert.

[06:13] Team_086 possession (Score: 14-15)
FOUL! Shooting foul on D'Angelo O'Neal. Lauri Johnson to the line for 2 free throws. [Team fouls: 2] (D'Angelo O'Neal: 1 personal fouls)   FT 1/2: GOOD   FT 2/2: GOOD Lauri Johnson makes 2/2 from the line.
Score: 16-15

[06:01] Team_046 possession (Score: 16-15)
D'Angelo O'Neal attempts a Layup. Contested by Rudy Rose (2.8 feet, ZONE). D'Angelo O'Neal misses. Offensive rebound by Kevin Allen! Kevin Allen kicks it out.

[05:49] Team_046 possession (Score: 16-15)
Cade Wall attempts a Layup. Contested by Bones Ginobili (5.4 feet, MAN). CADE WALL MAKES IT! Assist: Victor Nowitzki
Score: 16-17

[05:33] Team_086 possession (Score: 16-17)
Anfernee Harris attempts a 3Pt. Contested by Lauri Carter (4.5 feet, ZONE). ANFERNEE HARRIS MAKES IT! Assist: Miles Gobert
Score: 19-17

[05:20] Team_046 possession (Score: 19-17)
Kevin Allen drives, picks up Rudy Rose. Help arrives from Anfernee Harris! Kevin Allen attempts a Dunk. Contested by Anfernee Harris (5.1 feet, ZONE). KEVIN ALLEN MAKES IT! Assist: Victor Nowitzki
Score: 19-19

[05:05] Team_086 possession (Score: 19-19)
Bones Ginobili drives to the basket... Bones Ginobili loses control! Ball rolls out of bounds! TURNOVER! (dead ball)

[04:51] Team_046 possession (Score: 19-19)
Cade Wall drives, Rudy Rose stays with him. Cade Wall attempts a Dunk. Heavily contested by Rudy Rose (0.5 feet, ZONE)! CADE WALL MAKES IT!
Score: 19-21

[04:36] Team_086 possession (Score: 19-21)
Rudy Rose attempts a Midrange. Heavily contested by Lauri Carter (0.5 feet, ZONE)! Rudy Rose misses. Rebound secured by Cade Wall.

[04:19] Team_046 possession (Score: 19-21)
Victor Nowitzki drives, Anfernee Harris stays with him. Victor Nowitzki attempts a Layup. Contested by Anfernee Harris (6.0 feet, MAN). Victor Nowitzki misses. Rebound secured by Bones Ginobili.

[04:07] Team_086 possession (Score: 19-21)
Lauri Johnson attempts a 3Pt. Contested by D'Angelo O'Neal (3.4 feet, MAN). Lauri Johnson misses. Offensive rebound by Rudy Rose! Rudy Rose puts it back in!
Score: 21-21

[03:50] Team_046 possession (Score: 21-21)
Lauri Carter drives, picks up Miles Gobert. Help arrives from Anfernee Harris! Lauri Carter attempts a Dunk. Wide open! Anfernee Harris is 7.2 feet away. [MAN] LAURI CARTER MAKES IT! Assist: Cade Wall
Score: 21-23

[03:32] Team_086 possession (Score: 21-23)
FOUL! Reach-in foul on Kevin Allen during the drive. [Team fouls: 3] No free throws, side out. (Kevin Allen: 1 personal fouls)

[03:18] Team_086 possession (Score: 21-23)
Rudy Rose drives and kicks out. Rudy Rose attempts a 3Pt. Contested by Kevin Allen (2.8 feet, MAN). Rudy Rose misses. Rebound secured by Kevin Allen.

[03:04] Team_046 possession (Score: 21-23)
Lauri Carter attempts a Midrange. Contested by Miles Gobert (5.3 feet, MAN). Lauri Carter misses. Rebound secured by Bones Ginobili.

[02:50] Team_086 possession (Score: 21-23)
Anfernee Harris attempts a Midrange. Contested by Cade Wall (2.3 feet, ZONE). Anfernee Harris misses. Rebound secured by Lauri Carter.

[02:37] Team_046 possession (Score: 21-23)
D'Angelo O'Neal attempts a Layup. BLOCKED BY MILES GOBERT! Ball deflects out of bounds off D'Angelo O'Neal.

[02:24] Team_086 possession (Score: 21-23)
Lauri Johnson attempts a Layup. BLOCKED BY KEVIN ALLEN! Ball is loose! Offensive rebound by Rudy Rose! Rudy Rose kicks it out.

[02:10] Team_086 possession (Score: 21-23)
Bones Ginobili drives, picks up Cade Wall. Help arrives from D'Angelo O'Neal! Bones Ginobili attempts a Dunk. Contested by D'Angelo O'Neal (4.1 feet, MAN). Bones Ginobili misses. Offensive rebound by Miles Gobert! Miles Gobert kicks it out.

[01:56] Team_086 possession (Score: 21-23)
Lauri Johnson attempts a 3Pt. Contested by Lauri Carter (5.2 feet, ZONE). Lauri Johnson misses. Rebound secured by Kevin Allen.

[01:40] Team_046 possession (Score: 21-23)
Lauri Carter attempts a Midrange. Contested by Miles Gobert (3.9 feet, MAN). LAURI CARTER MAKES IT!
Score: 21-25

[01:23] Team_086 possession (Score: 21-25)
Anfernee Harris attempts a 3Pt. Contested by Lauri Carter (3.2 feet, ZONE). Anfernee Harris misses. Rebound secured by Kevin Allen.

[01:12] Team_046 possession (Score: 21-25)
D'Angelo O'Neal attempts a 3Pt. Contested by Lauri Johnson (4.4 feet, MAN). D'Angelo O'Neal misses. Offensive rebound by Cade Wall! Cade Wall kicks it out.

[00:56] Team_046 possession (Score: 21-25)
Lauri Carter drives and kicks out. Cade Wall attempts a 3Pt. Contested by Lauri Johnson (5.3 feet, ZONE). CADE WALL MAKES IT! Assist: Lauri Carter
Score: 21-28

[00:43] Team_086 possession (Score: 21-28)
Bones Ginobili attempts a 3Pt. Contested by Cade Wall (5.8 feet, MAN). Bones Ginobili misses. Rebound secured by Cade Wall.

[00:27] Team_046 possession (Score: 21-28)
D'Angelo O'Neal attempts a 3Pt. Contested by Lauri Johnson (4.5 feet, ZONE). D'Angelo O'Neal misses. Rebound secured by Rudy Rose.

[00:10] Team_086 possession (Score: 21-28)
Bones Ginobili drives, Cade Wall stays with him. Bones Ginobili attempts a Dunk. Wide open! Cade Wall is 6.9 feet away. [MAN] Bones Ginobili misses. Rebound secured by Cade Wall.

================================================================================
                              1ST QUARTER COMPLETE                              
================================================================================

1ST QUARTER SCORE: Team_086 21, Team_046 28

BOX SCORE:
================================================================================

Team_086
--------------------------------------------------------------------------------
Player                MIN  PTS  REB  AST  TO      FG   FG%      3P   3P%
--------------------------------------------------------------------------------
Rudy Rose              12    7    7    0   0   3/5    60.0     0/0   0.0
Anfernee Harris        12    7    0    1   0   3/5    60.0     0/0   0.0
Lauri Johnson          12    4    0    1   0   2/5    40.0     0/0   0.0
Miles Gobert           12    3    2    2   0   1/2    50.0     0/0   0.0
Bones Ginobili         12    0    2    1   0   0/4     0.0     0/0   0.0

TEAM: FG: 9/21 (42.9%), 3PT: 2/8 (25.0%), REB: 11 (3 off, 8 def), AST: 5, TO: 2
TEAM FOULS: 2


Team_046
--------------------------------------------------------------------------------
Player                MIN  PTS  REB  AST  TO      FG   FG%      3P   3P%
--------------------------------------------------------------------------------
Cade Wall              12    9    4    2   0   4/5    80.0     0/0   0.0
Lauri Carter           12    6    3    2   0   3/5    60.0     0/0   0.0
Kevin Allen            12    5    7    0   0   2/3    66.7     0/0   0.0
Victor Nowitzki        12    4    0    3   0   2/3    66.7     0/0   0.0
D'Angelo O'Neal        12    3    0    1   0   1/5    20.0     0/0   0.0

TEAM: FG: 12/21 (57.1%), 3PT: 2/3 (66.7%), REB: 14 (2 off, 12 def), AST: 8, TO: 1
TEAM FOULS: 3

================================================================================

================================================================================
                       2ND QUARTER - Team_086 vs Team_046                       
================================================================================

[12:00] Team_086 possession (Score: 21-28)
Miles Gobert attempts a 3Pt. Contested by Lauri Carter (4.8 feet, MAN). Miles Gobert misses. Rebound secured by Kevin Allen.

[11:44] Team_046 possession (Score: 21-28)
Victor Nowitzki drives and kicks out. Kevin Allen attempts a 3Pt. Contested by Lauri Johnson (3.8 feet, ZONE). Kevin Allen misses. Rebound secured by Rudy Rose.

[11:33] Team_086 possession (Score: 21-28)
FOUL! Holding foul on Victor Nowitzki. [Team fouls: 1] No free throws, side out. (Victor Nowitzki: 1 personal fouls)

[11:19] Team_086 possession (Score: 21-28)
Rudy Rose drives, Kevin Allen stays with him. Rudy Rose attempts a Layup. Contested by Kevin Allen (4.2 feet, MAN). RUDY ROSE MAKES IT!
Score: 23-28

[11:02] Team_046 possession (Score: 23-28)
Kevin Allen attempts a Midrange. Contested by Rudy Rose (4.3 feet, MAN). Kevin Allen misses. Rebound secured by Bones Ginobili.

[10:47] Team_086 possession (Score: 23-28)
Rudy Rose drives and kicks out. Rudy Rose attempts a 3Pt. Wide open! Lauri Carter is 6.4 feet away. [ZONE] Rudy Rose misses. Rebound secured by Kevin Allen.

[10:33] Team_046 possession (Score: 23-28)
Lauri Carter drives and kicks out. FOUL! Shooting foul on Anfernee Harris. D'Angelo O'Neal to the line for 2 free throws. [Team fouls: 1] (Anfernee Harris: 1 personal fouls)   FT 1/2: MISS   FT 2/2: GOOD D'Angelo O'Neal makes 1/2 from the line.
Score: 23-29

[10:20] Team_086 possession (Score: 23-29)
Anfernee Harris drives, Kevin Allen stays with him. Anfernee Harris attempts a Dunk. Contested by Kevin Allen (4.8 feet, ZONE). ANFERNEE HARRIS MAKES IT! Assist: Rudy Rose
Score: 25-29

[10:08] Team_046 possession (Score: 25-29)
FOUL! Holding foul on Bones Ginobili. [Team fouls: 2] No free throws, side out. (Bones Ginobili: 1 personal fouls)

[09:52] Team_046 possession (Score: 25-29)
Cade Wall attempts a 3Pt. Wide open! Lauri Johnson is 8.5 feet away. [ZONE] CADE WALL MAKES IT! Assist: Kevin Allen
Score: 25-32

[09:37] Team_086 possession (Score: 25-32)
Anfernee Harris attempts a 3Pt. Wide open! Victor Nowitzki is 8.1 feet away. [MAN] Anfernee Harris misses. Rebound secured by Cade Wall.

[09:19] Team_046 possession (Score: 25-32)
D'Angelo O'Neal attempts a 3Pt. Wide open! Lauri Johnson is 7.0 feet away. [MAN] D'Angelo O'Neal misses. Rebound secured by Rudy Rose.

[09:02] Team_086 possession (Score: 25-32)
Rudy Rose drives and kicks out. Bones Ginobili attempts a 3Pt. Contested by Cade Wall (5.0 feet, ZONE). BONES GINOBILI MAKES IT! Assist: Anfernee Harris
Score: 28-32

[08:52] Team_046 possession (Score: 28-32)
FOUL! Offensive foul on Lauri Carter! Miles Gobert drew the charge! [Team fouls: 2] (Lauri Carter: 1 personal fouls) TURNOVER! (dead ball)

[08:37] Team_086 possession (Score: 28-32)
Bones Ginobili attempts a Midrange. Contested by Cade Wall (4.7 feet, MAN). Bones Ginobili misses. Rebound secured by Kevin Allen.

[08:19] Team_046 possession (Score: 28-32)
Kevin Allen drives, picks up Bones Ginobili. Help arrives from Anfernee Harris! Kevin Allen attempts a Layup. Wide open! Anfernee Harris is 6.9 feet away. [ZONE] KEVIN ALLEN MAKES IT! Assist: Lauri Carter
Score: 28-34

[08:09] Team_086 possession (Score: 28-34)
Lauri Johnson drives, Kevin Allen stays with him. Lauri Johnson attempts a Layup. Wide open! Kevin Allen is 7.0 feet away. [ZONE] LAURI JOHNSON MAKES IT! Assist: Bones Ginobili
Score: 30-34

[07:54] Team_046 possession (Score: 30-34)
FOUL! Shooting foul on Rudy Rose. Victor Nowitzki to the line for 2 free throws. [Team fouls: 3] (Rudy Rose: 1 personal fouls)   FT 1/2: GOOD   FT 2/2: GOOD Victor Nowitzki makes 2/2 from the line.
Score: 30-36

[07:36] Team_086 possession (Score: 30-36)
Lauri Johnson attempts a 3Pt. Contested by D'Angelo O'Neal (5.8 feet, MAN). LAURI JOHNSON MAKES IT! Assist: Anfernee Harris
Score: 33-36

[07:21] Team_046 possession (Score: 33-36)
Victor Nowitzki attempts a 3Pt. Contested by Lauri Johnson (5.8 feet, ZONE). VICTOR NOWITZKI MAKES IT! Assist: Lauri Carter
Score: 33-39

[07:07] Team_086 possession (Score: 33-39)
Miles Gobert drives, picks up Kevin Allen. Help arrives from D'Angelo O'Neal! Miles Gobert attempts a Layup. Contested by D'Angelo O'Neal (5.8 feet, ZONE). MILES GOBERT MAKES IT! Assist: Lauri Johnson
Score: 35-39

[06:56] Team_046 possession (Score: 35-39)
Lauri Carter attempts a 3Pt. Contested by Lauri Johnson (4.5 feet, ZONE). Lauri Carter misses. Rebound secured by Miles Gobert.

[06:39] Team_086 possession (Score: 35-39)
FOUL! Reach-in foul on Kevin Allen during the drive. [Team fouls: 3] No free throws, side out. (Kevin Allen: 1 personal fouls)

[06:22] Team_086 possession (Score: 35-39)
Lauri Johnson attempts a 3Pt. Contested by Lauri Carter (4.6 feet, ZONE). Lauri Johnson misses. Rebound secured by Cade Wall.

[06:08] Team_046 possession (Score: 35-39)
Lauri Carter attempts a 3Pt. Wide open! Miles Gobert is 7.0 feet away. [MAN] Lauri Carter misses. Rebound secured by Bones Ginobili.

[05:55] Team_086 possession (Score: 35-39)
Lauri Johnson attempts a 3Pt. Contested by Lauri Carter (4.6 feet, ZONE). Lauri Johnson misses. Rebound secured by Cade Wall.

[05:38] Team_046 possession (Score: 35-39)
Lauri Carter attempts a 3Pt. Contested by Miles Gobert (5.5 feet, MAN). Lauri Carter misses. Rebound secured by Miles Gobert.

[05:27] Team_086 possession (Score: 35-39)
Rudy Rose attempts a Layup. Wide open! Kevin Allen is 7.2 feet away. [ZONE] RUDY ROSE MAKES IT! Assist: Miles Gobert
Score: 37-39

[05:15] Team_046 possession (Score: 37-39)
Lauri Carter attempts a 3Pt. Contested by Lauri Johnson (5.4 feet, ZONE). Lauri Carter misses. Rebound secured by Miles Gobert.

[05:06] Team_086 possession (Score: 37-39)
Miles Gobert drives and kicks out. Miles Gobert attempts a 3Pt. Contested by Lauri Carter (5.1 feet, MAN). Miles Gobert misses. Rebound secured by Cade Wall.

[04:51] Team_046 possession (Score: 37-39)
Victor Nowitzki attempts a 3Pt. Contested by Anfernee Harris (5.4 feet, ZONE). Victor Nowitzki misses. Rebound secured by Rudy Rose.

[04:32] Team_086 possession (Score: 37-39)
Lauri Johnson attempts a 3Pt. Wide open! D'Angelo O'Neal is 8.6 feet away. [ZONE] Lauri Johnson misses. Rebound secured by Cade Wall.

[04:18] Team_046 possession (Score: 37-39)
Victor Nowitzki attempts a 3Pt. Wide open! Anfernee Harris is 6.7 feet away. [MAN] Victor Nowitzki misses. Rebound secured by Miles Gobert.

[04:03] Team_086 possession (Score: 37-39)
Lauri Johnson makes the 3Pt and draws the foul on D'Angelo O'Neal! And-1! Lauri Johnson to the line for 1. [Team fouls: 4] (D'Angelo O'Neal: 1 personal fouls)   FT 1/1: GOOD Lauri Johnson makes 1/1 from the line.
Score: 41-39

[03:46] Team_046 possession (Score: 41-39)
D'Angelo O'Neal drives, Rudy Rose stays with him. D'Angelo O'Neal attempts a Layup. Contested by Rudy Rose (5.8 feet, ZONE). D'ANGELO O'NEAL MAKES IT!
Score: 41-41

[03:30] Team_086 possession (Score: 41-41)
Lauri Johnson attempts a 3Pt. Wide open! D'Angelo O'Neal is 6.9 feet away. [MAN] LAURI JOHNSON MAKES IT! Assist: Miles Gobert
Score: 44-41

[03:15] Team_046 possession (Score: 44-41)
D'Angelo O'Neal attempts a 3Pt. Wide open! Lauri Johnson is 6.6 feet away. [MAN] D'ANGELO O'NEAL MAKES IT! Assist: Cade Wall
Score: 44-44

[02:59] Team_086 possession (Score: 44-44)
Rudy Rose attempts a Midrange. Contested by Kevin Allen (4.3 feet, ZONE). RUDY ROSE MAKES IT! Assist: Bones Ginobili
Score: 46-44

[02:46] Team_046 possession (Score: 46-44)
Kevin Allen attempts a Midrange. Contested by Rudy Rose (5.1 feet, MAN). Kevin Allen misses. Rebound secured by Miles Gobert.

[02:34] Team_086 possession (Score: 46-44)
Lauri Johnson loses control! Ball rolls out of bounds! TURNOVER! (dead ball)

[02:34] Substitution (Team_086): Lauri Johnson OUT → Anfernee Green IN (stamina_rule2)

[02:34] Substitution (Team_086): Anfernee Harris OUT → Anthony James IN (stamina_rule2)

[02:34] Substitution (Team_086): Miles Gobert OUT → Franz McGrady IN (stamina_rule2)

[02:34] Substitution (Team_086): Bones Ginobili OUT → Kyle McCollum IN (stamina_rule2)

[02:34] Substitution (Team_086): Rudy Rose OUT → Lamelo Towns IN (stamina_rule2)

[02:34] Substitution (Team_046): D'Angelo O'Neal OUT → Collin Butler IN (stamina_rule2)

[02:34] Substitution (Team_046): Victor Nowitzki OUT → Manu Dosunmu IN (stamina_rule2)

[02:34] Substitution (Team_046): Lauri Carter OUT → Josh Barrett IN (stamina_rule2)

[02:34] Substitution (Team_046): Cade Wall OUT → Chris LaVine IN (stamina_rule2)

[02:34] Substitution (Team_046): Kevin Allen OUT → Paul DeRozan IN (stamina_rule2)

[02:20] Team_046 possession (Score: 46-44)
FOUL! Shooting foul on Franz McGrady. Josh Barrett to the line for 2 free throws. [Team fouls: 4] (Franz McGrady: 1 personal fouls)   FT 1/2: MISS   FT 2/2: GOOD Josh Barrett makes 1/2 from the line.
Score: 46-45

[02:05] Team_086 possession (Score: 46-45)
Anfernee Green drives, picks up Paul DeRozan. Help arrives from Manu Dosunmu! Anfernee Green attempts a Dunk. Wide open! Manu Dosunmu is 6.8 feet away. [ZONE] Anfernee Green misses. Offensive rebound by Anfernee Green! Anfernee Green kicks it out.

[01:50] Team_086 possession (Score: 46-45)
Lamelo Towns attempts a Midrange. Contested by Josh Barrett (4.7 feet, ZONE). Lamelo Towns misses. Rebound secured by Manu Dosunmu.

[01:36] Team_046 possession (Score: 46-45)
Manu Dosunmu attempts a Layup. BLOCKED BY ANFERNEE GREEN! Ball is loose! Rebound secured by Lamelo Towns.

[01:19] Team_086 possession (Score: 46-45)
Kyle McCollum attempts a Midrange. Wide open! Chris LaVine is 6.2 feet away. [MAN] Kyle McCollum misses. Rebound secured by Chris LaVine.

[01:05] Team_046 possession (Score: 46-45)
Chris LaVine drives to the basket... Chris LaVine throws a bad pass! Stolen by Kyle McCollum! TURNOVER! (live ball)

[00:54] Team_086 possession (Score: 46-45)
Lamelo Towns attempts a Layup. Contested by Chris LaVine (2.1 feet, ZONE). LAMELO TOWNS MAKES IT! Assist: Anthony James
Score: 48-45

[00:41] Team_046 possession (Score: 48-45)
Collin Butler attempts a 3Pt. Contested by Franz McGrady (4.7 feet, ZONE). Collin Butler misses. FOUL! Loose ball foul on Anfernee Green during the rebound battle. [IN THE BONUS! 5 team fouls] Chris LaVine to the line for 2 free throws. (Anfernee Green: 1 personal fouls)   FT 1/2: MISS   FT 2/2: GOOD Chris LaVine makes 1/2 from the line.
Score: 48-46

[00:23] Team_086 possession (Score: 48-46)
Lamelo Towns attempts a Midrange. Wide open! Paul DeRozan is 6.1 feet away. [ZONE] LAMELO TOWNS MAKES IT!
Score: 50-46

[00:09] Team_046 possession (Score: 50-46)
Paul DeRozan drives, picks up Lamelo Towns. Help arrives from Anfernee Green! Paul DeRozan attempts a Dunk. Wide open! Anfernee Green is 7.8 feet away. [MAN] Paul DeRozan misses. Rebound secured by Lamelo Towns.

================================================================================
                              2ND QUARTER COMPLETE                              
================================================================================

2ND QUARTER SCORE: Team_086 29, Team_046 18

BOX SCORE:
================================================================================

Team_086
--------------------------------------------------------------------------------
Player                MIN  PTS  REB  AST  TO      FG   FG%      3P   3P%
--------------------------------------------------------------------------------
Lauri Johnson          22   12    0    1   0   4/7    57.1     0/0   0.0
Rudy Rose              22    6    3    1   0   3/4    75.0     0/0   0.0
Lamelo Towns            2    4    2    0   0   2/3    66.7     0/0   0.0
Bones Ginobili         22    3    2    2   0   1/2    50.0     0/0   0.0
Miles Gobert           22    2    5    2   0   1/3    33.3     0/0   0.0
Anfernee Harris        22    2    0    2   0   1/2    50.0     0/0   0.0
Anfernee Green          2    0    1    0   0   0/0     0.0     0/0   0.0
Kyle McCollum           2    0    0    0   0   0/1     0.0     0/0   0.0
Anthony James           2    0    0    1   0   0/0     0.0     0/0   0.0

TEAM: FG: 12/22 (54.5%), 3PT: 3/8 (37.5%), REB: 13 (1 off, 12 def), AST: 9, TO: 1
TEAM FOULS: 5 [Team_046 in BONUS]


Team_046
--------------------------------------------------------------------------------
Player                MIN  PTS  REB  AST  TO      FG   FG%      3P   3P%
--------------------------------------------------------------------------------
D'Angelo O'Neal        22    6    0    0   0   3/4    75.0     0/0   0.0
Victor Nowitzki        22    5    0    0   0   2/5    40.0     0/0   0.0
Cade Wall              22    3    5    1   0   1/1   100.0     0/0   0.0
Kevin Allen            22    2    3    1   0   1/3    33.3     0/0   0.0
Josh Barrett            2    1    0    0   0   1/1   100.0     0/0   0.0
Chris LaVine            2    1    1    0   0   1/1   100.0     0/0   0.0
Lauri Carter           22    0    0    2   0   0/4     0.0     0/0   0.0
Manu Dosunmu            2    0    1    0   0   0/1     0.0     0/0   0.0
Paul DeRozan            2    0    0    0   0   0/1     0.0     0/0   0.0

TEAM: FG: 9/21 (42.9%), 3PT: 4/11 (36.4%), REB: 10 (0 off, 10 def), AST: 4, TO: 2
TEAM FOULS: 4

================================================================================

================================================================================
                       3RD QUARTER - Team_086 vs Team_046                       
================================================================================

[12:00] Team_086 possession (Score: 50-46)
FOUL! Holding foul on Lauri Carter. [Team fouls: 1] No free throws, side out. (Lauri Carter: 1 personal fouls)

[11:43] Team_086 possession (Score: 50-46)
Rudy Rose makes the Layup and draws the foul on Kevin Allen! And-1! Rudy Rose to the line for 1. [Team fouls: 2] (Kevin Allen: 1 personal fouls)   FT 1/1: GOOD Rudy Rose makes 1/1 from the line.
Score: 53-46

[11:28] Team_046 possession (Score: 53-46)
Cade Wall attempts a Midrange. Contested by Bones Ginobili (4.7 feet, MAN). Cade Wall misses. Offensive rebound by Cade Wall! Cade Wall kicks it out.

[11:14] Team_046 possession (Score: 53-46)
Cade Wall attempts a Layup. Heavily contested by Rudy Rose (1.3 feet, ZONE)! CADE WALL MAKES IT! Assist: Kevin Allen
Score: 53-48

[10:56] Team_086 possession (Score: 53-48)
Anfernee Harris attempts a Midrange. Contested by Victor Nowitzki (5.3 feet, MAN). ANFERNEE HARRIS MAKES IT! Assist: Rudy Rose
Score: 55-48

[10:38] Team_046 possession (Score: 55-48)
FOUL! Shooting foul on Rudy Rose. Lauri Carter to the line for 2 free throws. [Team fouls: 1] (Rudy Rose: 1 personal fouls)   FT 1/2: MISS   FT 2/2: GOOD Lauri Carter makes 1/2 from the line.
Score: 55-49

[10:22] Team_086 possession (Score: 55-49)
Rudy Rose drives, picks up Kevin Allen. Help arrives from D'Angelo O'Neal! Rudy Rose attempts a Dunk. Contested by D'Angelo O'Neal (5.6 feet, ZONE). RUDY ROSE MAKES IT! Assist: Bones Ginobili
Score: 57-49

[10:09] Team_046 possession (Score: 57-49)
Victor Nowitzki attempts a Midrange. Contested by Anfernee Harris (4.4 feet, MAN). Victor Nowitzki misses. Offensive rebound by Cade Wall! Cade Wall kicks it out.

[09:54] Team_046 possession (Score: 57-49)
Lauri Carter attempts a 3Pt. Heavily contested by Miles Gobert (0.9 feet, MAN)! Lauri Carter misses. Rebound secured by Rudy Rose.

[09:40] Team_086 possession (Score: 57-49)
Rudy Rose attempts a Layup. Contested by Kevin Allen (4.2 feet, MAN). RUDY ROSE MAKES IT! Assist: Lauri Johnson
Score: 59-49

[09:22] Team_046 possession (Score: 59-49)
Kevin Allen drives and kicks out. Cade Wall attempts a 3Pt. Wide open! Bones Ginobili is 7.6 feet away. [MAN] CADE WALL MAKES IT!
Score: 59-52

[09:09] Team_086 possession (Score: 59-52)
Bones Ginobili attempts a Midrange. Contested by Cade Wall (3.8 feet, ZONE). BONES GINOBILI MAKES IT!
Score: 61-52

[08:56] Team_046 possession (Score: 61-52)
Cade Wall attempts a Layup. Heavily contested by Rudy Rose (1.4 feet, ZONE)! CADE WALL MAKES IT!
Score: 61-54

[08:41] Team_086 possession (Score: 61-54)
Rudy Rose attempts a Midrange. Wide open! Kevin Allen is 7.2 feet away. [MAN] RUDY ROSE MAKES IT! Assist: Bones Ginobili
Score: 63-54

[08:23] Team_046 possession (Score: 63-54)
FOUL! Reach-in foul on Rudy Rose during the drive. [Team fouls: 2] No free throws, side out. (Rudy Rose: 2 personal fouls)

[08:05] Team_046 possession (Score: 63-54)
Victor Nowitzki drives, Anfernee Harris stays with him. Victor Nowitzki attempts a Layup. Wide open! Anfernee Harris is 10.0 feet away. [MAN] Victor Nowitzki misses. Rebound secured by Bones Ginobili.

[07:51] Team_086 possession (Score: 63-54)
Anfernee Harris attempts a 3Pt. Wide open! Victor Nowitzki is 8.5 feet away. [MAN] Anfernee Harris misses. Offensive rebound by Rudy Rose! Rudy Rose puts it back in!
Score: 65-54

[07:38] Team_046 possession (Score: 65-54)
Victor Nowitzki attempts a 3Pt. Wide open! Anfernee Harris is 6.7 feet away. [MAN] Victor Nowitzki misses. Offensive rebound by Cade Wall! Cade Wall kicks it out.

[07:23] Team_046 possession (Score: 65-54)
D'Angelo O'Neal drives, picks up Lauri Johnson. Help arrives from Miles Gobert! D'Angelo O'Neal attempts a Layup. Contested by Miles Gobert (5.1 feet, MAN). D'ANGELO O'NEAL MAKES IT! Assist: Lauri Carter
Score: 65-56

[07:07] Team_086 possession (Score: 65-56)
Lauri Johnson drives, picks up D'Angelo O'Neal. Help arrives from Lauri Carter! Lauri Johnson attempts a Dunk. Contested by Lauri Carter (3.0 feet, MAN). Lauri Johnson misses. Offensive rebound by Miles Gobert! Miles Gobert kicks it out.

[06:52] Team_086 possession (Score: 65-56)
FOUL! Holding foul on Victor Nowitzki. [Team fouls: 3] No free throws, side out. (Victor Nowitzki: 1 personal fouls)

[06:37] Team_086 possession (Score: 65-56)
Anfernee Harris loses the ball! Stripped by Victor Nowitzki! TURNOVER! (live ball)

[06:23] Team_046 possession (Score: 65-56)
Cade Wall attempts a 3Pt. Contested by Bones Ginobili (5.1 feet, MAN). CADE WALL MAKES IT! Assist: Kevin Allen
Score: 65-59

[06:08] Team_086 possession (Score: 65-59)
Rudy Rose throws a bad pass! Stolen by Kevin Allen! TURNOVER! (live ball)

[05:53] Team_046 possession (Score: 65-59)
Kevin Allen attempts a Midrange. Heavily contested by Rudy Rose (0.5 feet, MAN)! Kevin Allen misses. Rebound secured by Rudy Rose.

[05:37] Team_086 possession (Score: 65-59)
Anfernee Harris attempts a Midrange. Wide open! Victor Nowitzki is 8.2 feet away. [MAN] Anfernee Harris misses. Rebound secured by Cade Wall.

[05:25] Team_046 possession (Score: 65-59)
D'Angelo O'Neal attempts a Midrange. Heavily contested by Miles Gobert (2.0 feet, ZONE)! D'ANGELO O'NEAL MAKES IT!
Score: 65-61

[05:11] Team_086 possession (Score: 65-61)
Lauri Johnson attempts a 3Pt. Contested by Lauri Carter (4.4 feet, ZONE). Lauri Johnson misses. Rebound secured by Cade Wall.

[05:00] Team_046 possession (Score: 65-61)
Victor Nowitzki drives and kicks out. FOUL! Shooting foul on Bones Ginobili. Victor Nowitzki to the line for 2 free throws. [Team fouls: 3] (Bones Ginobili: 1 personal fouls)   FT 1/2: GOOD   FT 2/2: MISS Victor Nowitzki makes 1/2 from the line. Rebound secured by Bones Ginobili.
Score: 65-62

[04:45] Team_086 possession (Score: 65-62)
Rudy Rose attempts a Midrange. Contested by Cade Wall (4.1 feet, ZONE). RUDY ROSE MAKES IT!
Score: 67-62

[04:34] Team_046 possession (Score: 67-62)
Lauri Carter attempts a 3Pt. Contested by Miles Gobert (4.0 feet, MAN). Lauri Carter misses. Offensive rebound by Kevin Allen! Kevin Allen kicks it out.

[04:19] Team_046 possession (Score: 67-62)
Lauri Carter attempts a 3Pt. Contested by Miles Gobert (2.5 feet, MAN). Lauri Carter misses. Rebound secured by Miles Gobert.

[04:06] Team_086 possession (Score: 67-62)
Rudy Rose attempts a Midrange. Heavily contested by Lauri Carter (1.2 feet, ZONE)! RUDY ROSE MAKES IT! Assist: Lauri Johnson
Score: 69-62

[03:50] Team_046 possession (Score: 69-62)
Victor Nowitzki attempts a Layup. Contested by Anfernee Harris (2.4 feet, MAN). VICTOR NOWITZKI MAKES IT! Assist: D'Angelo O'Neal
Score: 69-64

[03:31] Team_086 possession (Score: 69-64)
Miles Gobert attempts a 3Pt. Heavily contested by Lauri Carter (1.1 feet, MAN)! Miles Gobert misses. Rebound secured by Kevin Allen.

[03:17] Team_046 possession (Score: 69-64)
Lauri Carter attempts a Midrange. Heavily contested by Miles Gobert (1.6 feet, MAN)! Lauri Carter misses. Rebound secured by Bones Ginobili.

[03:06] Team_086 possession (Score: 69-64)
Anfernee Harris attempts a Layup. Contested by Victor Nowitzki (4.2 feet, MAN). ANFERNEE HARRIS MAKES IT! Assist: Miles Gobert
Score: 71-64

[02:49] Team_046 possession (Score: 71-64)
FOUL! Holding foul on Lauri Johnson. [Team fouls: 4] No free throws, side out. (Lauri Johnson: 1 personal fouls)

[02:36] Team_046 possession (Score: 71-64)
Kevin Allen drives, Rudy Rose stays with him. Kevin Allen attempts a Layup. Wide open! Rudy Rose is 8.6 feet away. [ZONE] KEVIN ALLEN MAKES IT!
Score: 71-66

[02:18] Team_086 possession (Score: 71-66)
Rudy Rose drives to the basket... FOUL! Offensive foul on Rudy Rose! Kevin Allen drew the charge! [Team fouls: 5] (Rudy Rose: 3 personal fouls) TURNOVER! (dead ball)

[02:05] Team_046 possession (Score: 71-66)
Victor Nowitzki attempts a Midrange. Wide open! Anfernee Harris is 6.4 feet away. [MAN] VICTOR NOWITZKI MAKES IT!
Score: 71-68

[01:50] Team_086 possession (Score: 71-68)
Rudy Rose attempts a 3Pt. Wide open! Kevin Allen is 8.1 feet away. [MAN] Rudy Rose misses. Rebound secured by Lauri Carter.

[01:39] Team_046 possession (Score: 71-68)
Cade Wall attempts a 3Pt. Contested by Bones Ginobili (3.8 feet, MAN). Cade Wall misses. Rebound secured by Bones Ginobili.

[01:25] Team_086 possession (Score: 71-68)
Bones Ginobili attempts a Midrange. Wide open! Lauri Carter is 6.1 feet away. [ZONE] BONES GINOBILI MAKES IT! Assist: Miles Gobert
Score: 73-68

[01:10] Team_046 possession (Score: 73-68)
Cade Wall loses control! Ball rolls out of bounds! TURNOVER! (dead ball)

[01:10] Substitution (Team_086): Lauri Johnson OUT → Anfernee Green IN (stamina_rule2)

[01:10] Substitution (Team_086): Anfernee Harris OUT → Anthony James IN (stamina_rule2)

[01:10] Substitution (Team_086): Miles Gobert OUT → Franz McGrady IN (stamina_rule2)

[01:10] Substitution (Team_086): Bones Ginobili OUT → Kyle McCollum IN (stamina_rule2)

[01:10] Substitution (Team_086): Rudy Rose OUT → Lamelo Towns IN (stamina_rule2)

[01:10] Substitution (Team_046): D'Angelo O'Neal OUT → Collin Butler IN (stamina_rule2)

[01:10] Substitution (Team_046): Victor Nowitzki OUT → Manu Dosunmu IN (stamina_rule2)

[01:10] Substitution (Team_046): Lauri Carter OUT → Josh Barrett IN (stamina_rule2)

[01:10] Substitution (Team_046): Cade Wall OUT → Chris LaVine IN (stamina_rule2)

[01:10] Substitution (Team_046): Kevin Allen OUT → Paul DeRozan IN (stamina_rule2)

[00:56] Team_086 possession (Score: 73-68)
Anthony James attempts a 3Pt. Contested by Manu Dosunmu (5.6 feet, MAN). Anthony James misses. FOUL! Loose ball foul on Manu Dosunmu during the rebound battle. [Team fouls: 4] No free throws, side out. (Manu Dosunmu: 1 personal fouls)

[00:38] Team_086 possession (Score: 73-68)
Franz McGrady attempts a 3Pt. Contested by Collin Butler (3.3 feet, ZONE). Franz McGrady misses. Rebound secured by Paul DeRozan.

[00:19] Team_046 possession (Score: 73-68)
Collin Butler attempts a Midrange. Contested by Anfernee Green (5.5 feet, MAN). COLLIN BUTLER MAKES IT! Assist: Paul DeRozan
Score: 73-70

[00:01] Team_086 possession (Score: 73-70)
FOUL! Holding foul on Manu Dosunmu. [IN THE BONUS! 5 team fouls] Anthony James to the line for 2 free throws. (Manu Dosunmu: 2 personal fouls)   FT 1/2: GOOD   FT 2/2: GOOD Anthony James makes 2/2 from the line.
Score: 75-70

================================================================================
                              3RD QUARTER COMPLETE                              
================================================================================

3RD QUARTER SCORE: Team_086 25, Team_046 24

BOX SCORE:
================================================================================

Team_086
--------------------------------------------------------------------------------
Player                MIN  PTS  REB  AST  TO      FG   FG%      3P   3P%
--------------------------------------------------------------------------------
Rudy Rose              33   15    3    1   0   7/8    87.5     0/0   0.0
Anfernee Harris        33    4    0    0   0   2/3    66.7     0/0   0.0
Bones Ginobili         33    4    4    2   0   2/2   100.0     0/0   0.0
Anthony James           4    2    0    0   0   1/1   100.0     0/0   0.0
Lauri Johnson          33    0    0    2   0   0/1     0.0     0/0   0.0
Miles Gobert           33    0    2    2   0   0/1     0.0     0/0   0.0
Lamelo Towns            4    0    1    0   0   0/0     0.0     0/0   0.0
Franz McGrady           4    0    0    0   0   0/1     0.0     0/0   0.0

TEAM: FG: 12/17 (70.6%), 3PT: 1/5 (20.0%), REB: 10 (3 off, 7 def), AST: 7, TO: 3
TEAM FOULS: 5 [Team_046 in BONUS]


Team_046
--------------------------------------------------------------------------------
Player                MIN  PTS  REB  AST  TO      FG   FG%      3P   3P%
--------------------------------------------------------------------------------
Cade Wall              33   10    5    0   0   4/5    80.0     0/0   0.0
Victor Nowitzki        33    4    0    0   0   2/4    50.0     0/0   0.0
D'Angelo O'Neal        33    4    0    1   0   2/2   100.0     0/0   0.0
Kevin Allen            33    2    2    2   0   1/2    50.0     0/0   0.0
Collin Butler           4    2    0    0   0   1/1   100.0     0/0   0.0
Lauri Carter           33    1    1    1   0   1/4    25.0     0/0   0.0
Paul DeRozan            4    0    1    1   0   0/0     0.0     0/0   0.0

TEAM: FG: 11/18 (61.1%), 3PT: 1/4 (25.0%), REB: 9 (4 off, 5 def), AST: 5, TO: 1
TEAM FOULS: 5 [Team_086 in BONUS]

================================================================================

================================================================================
                       4TH QUARTER - Team_086 vs Team_046                       
================================================================================

[12:00] Team_086 possession (Score: 75-70)
Rudy Rose attempts a Midrange. Contested by Victor Nowitzki (6.0 feet, ZONE). Rudy Rose misses. Offensive rebound by Miles Gobert! Miles Gobert kicks it out.

[11:43] Team_086 possession (Score: 75-70)
Anfernee Harris attempts a Layup. Wide open! Kevin Allen is 8.4 feet away. [ZONE] ANFERNEE HARRIS MAKES IT! Assist: Rudy Rose
Score: 77-70

[11:30] Team_046 possession (Score: 77-70)
D'Angelo O'Neal loses the ball! Stripped by Lauri Johnson! TURNOVER! (live ball)

[11:14] Team_086 possession (Score: 77-70)
Anfernee Harris attempts a 3Pt. Contested by Lauri Carter (5.4 feet, ZONE). Anfernee Harris misses. Offensive rebound by Miles Gobert! Miles Gobert kicks it out.

[10:57] Team_086 possession (Score: 77-70)
Bones Ginobili drives, Kevin Allen stays with him. Bones Ginobili attempts a Layup. Contested by Kevin Allen (5.2 feet, ZONE). BONES GINOBILI MAKES IT! Assist: Lauri Johnson
Score: 79-70

[10:42] Team_046 possession (Score: 79-70)
Cade Wall attempts a 3Pt. Contested by Lauri Johnson (3.7 feet, ZONE). Cade Wall misses. Rebound secured by Rudy Rose.

[10:28] Team_086 possession (Score: 79-70)
FOUL! Shooting foul on D'Angelo O'Neal. Lauri Johnson to the line for 2 free throws. [Team fouls: 1] (D'Angelo O'Neal: 1 personal fouls)   FT 1/2: GOOD   FT 2/2: GOOD Lauri Johnson makes 2/2 from the line.
Score: 81-70

[10:18] Team_046 possession (Score: 81-70)
D'Angelo O'Neal attempts a Midrange. Wide open! Lauri Johnson is 6.6 feet away. [MAN] D'Angelo O'Neal misses. Rebound secured by Miles Gobert.

[10:05] Team_086 possession (Score: 81-70)
Anfernee Harris commits a violation (traveling/carry)! TURNOVER! (dead ball)

[10:05] Substitution (Team_086): Lauri Johnson OUT → Anfernee Green IN (stamina_rule2)

[10:05] Substitution (Team_086): Anfernee Harris OUT → Anthony James IN (stamina_rule2)

[10:05] Substitution (Team_086): Bones Ginobili OUT → Kyle McCollum IN (stamina_rule2)

[10:05] Substitution (Team_086): Rudy Rose OUT → Lamelo Towns IN (stamina_rule2)

[10:05] Substitution (Team_046): D'Angelo O'Neal OUT → Collin Butler IN (stamina_rule2)

[10:05] Substitution (Team_046): Victor Nowitzki OUT → Manu Dosunmu IN (stamina_rule2)

[10:05] Substitution (Team_046): Lauri Carter OUT → Josh Barrett IN (stamina_rule2)

[10:05] Substitution (Team_046): Cade Wall OUT → Chris LaVine IN (stamina_rule2)

[10:05] Substitution (Team_046): Kevin Allen OUT → Paul DeRozan IN (stamina_rule2)

[09:50] Team_046 possession (Score: 81-70)
Manu Dosunmu attempts a Midrange. Contested by Anthony James (4.5 feet, MAN). MANU DOSUNMU MAKES IT!
Score: 81-72

[09:39] Team_086 possession (Score: 81-72)
Anfernee Green drives to the basket... FOUL! Offensive foul on Anfernee Green! Chris LaVine drew the charge! [Team fouls: 1] (Anfernee Green: 1 personal fouls) TURNOVER! (dead ball)

[09:26] Team_046 possession (Score: 81-72)
Chris LaVine makes the Midrange and draws the foul on Kyle McCollum! And-1! Chris LaVine to the line for 1. [Team fouls: 2] (Kyle McCollum: 1 personal fouls)   FT 1/1: GOOD Chris LaVine makes 1/1 from the line.
Score: 81-75

[09:12] Team_086 possession (Score: 81-75)
Kyle McCollum attempts a 3Pt. Contested by Chris LaVine (5.5 feet, MAN). Kyle McCollum misses. FOUL! Loose ball foul on Paul DeRozan during the rebound battle. [Team fouls: 2] No free throws, side out. (Paul DeRozan: 1 personal fouls)

[08:56] Team_086 possession (Score: 81-75)
Anfernee Green makes the 3Pt and draws the foul on Collin Butler! And-1! Anfernee Green to the line for 1. [Team fouls: 3] (Collin Butler: 1 personal fouls)   FT 1/1: GOOD Anfernee Green makes 1/1 from the line.
Score: 85-75

[08:40] Team_046 possession (Score: 85-75)
Collin Butler attempts a Midrange. BLOCKED BY ANFERNEE GREEN! Ball is loose! Offensive rebound by Chris LaVine! Chris LaVine kicks it out.

[08:24] Team_046 possession (Score: 85-75)
Manu Dosunmu attempts a 3Pt. Heavily contested by Anthony James (0.5 feet, MAN)! Manu Dosunmu misses. Offensive rebound by Paul DeRozan! Paul DeRozan's putback is no good. Rebound secured by Miles Gobert.

[08:12] Team_086 possession (Score: 85-75)
FOUL! Holding foul on Josh Barrett. [Team fouls: 4] No free throws, side out. (Josh Barrett: 1 personal fouls)

[08:01] Team_086 possession (Score: 85-75)
FOUL! Shooting foul on Chris LaVine. Lamelo Towns to the line for 2 free throws. [BONUS: 5 team fouls] (Chris LaVine: 1 personal fouls)   FT 1/2: GOOD   FT 2/2: GOOD Lamelo Towns makes 2/2 from the line.
Score: 87-75

[07:45] Team_046 possession (Score: 87-75)
Chris LaVine attempts a Midrange. Wide open! Kyle McCollum is 8.2 feet away. [ZONE] CHRIS LAVINE MAKES IT! Assist: Collin Butler
Score: 87-77

[07:30] Team_086 possession (Score: 87-77)
Anthony James attempts a Midrange. Contested by Manu Dosunmu (4.7 feet, MAN). Anthony James misses. Rebound secured by Paul DeRozan.

[07:16] Team_046 possession (Score: 87-77)
Chris LaVine attempts a 3Pt. Contested by Kyle McCollum (4.7 feet, ZONE). Chris LaVine misses. FOUL! Loose ball foul on Anfernee Green during the rebound battle. [Team fouls: 3] No free throws, side out. (Anfernee Green: 2 personal fouls)

[06:57] Team_046 possession (Score: 87-77)
Paul DeRozan attempts a Midrange. Contested by Miles Gobert (5.1 feet, ZONE). Paul DeRozan misses. Rebound secured by Miles Gobert.

[06:44] Team_086 possession (Score: 87-77)
Anthony James attempts a 3Pt. Wide open! Manu Dosunmu is 7.8 feet away. [MAN] Anthony James misses. Rebound secured by Chris LaVine.

[06:28] Team_046 possession (Score: 87-77)
FOUL! Reach-in foul on Lamelo Towns during the drive. [Team fouls: 4] No free throws, side out. (Lamelo Towns: 1 personal fouls)

[06:09] Team_046 possession (Score: 87-77)
Josh Barrett drives to the basket... Josh Barrett loses control! Ball rolls out of bounds! TURNOVER! (dead ball)

[06:09] Substitution (Team_086): Miles Gobert OUT → Franz McGrady IN (stamina_rule2)

[05:51] Team_086 possession (Score: 87-77)
FOUL! Holding foul on Chris LaVine. [IN THE BONUS! 6 team fouls] Kyle McCollum to the line for 2 free throws. (Chris LaVine: 2 personal fouls)   FT 1/2: GOOD   FT 2/2: GOOD Kyle McCollum makes 2/2 from the line.
Score: 89-77

[05:37] Team_046 possession (Score: 89-77)
Josh Barrett attempts a Midrange. Contested by Franz McGrady (2.4 feet, MAN). JOSH BARRETT MAKES IT!
Score: 89-79

[05:22] Team_086 possession (Score: 89-79)
Lamelo Towns attempts a Layup. Contested by Chris LaVine (2.7 feet, MAN). Lamelo Towns misses. Rebound secured by Chris LaVine.

[05:07] Team_046 possession (Score: 89-79)
Chris LaVine attempts a 3Pt. Contested by Anthony James (3.9 feet, ZONE). Chris LaVine misses. Rebound secured by Anfernee Green.

[04:53] Team_086 possession (Score: 89-79)
Lamelo Towns attempts a Layup. Wide open! Chris LaVine is 6.1 feet away. [MAN] Lamelo Towns misses. Rebound secured by Chris LaVine.

[04:39] Team_046 possession (Score: 89-79)
Collin Butler attempts a Layup. Wide open! Anfernee Green is 6.5 feet away. [MAN] COLLIN BUTLER MAKES IT!
Score: 89-81

[04:23] Team_086 possession (Score: 89-81)
Franz McGrady attempts a Layup. BLOCKED BY JOSH BARRETT! Ball goes out off Josh Barrett. Franz McGrady's ball!

[04:09] Team_086 possession (Score: 89-81)
Franz McGrady attempts a 3Pt. Wide open! Josh Barrett is 9.3 feet away. [MAN] Franz McGrady misses. Rebound secured by Chris LaVine.

[03:57] Team_046 possession (Score: 89-81)
Josh Barrett attempts a 3Pt. Heavily contested by Anfernee Green (0.5 feet, ZONE)! JOSH BARRETT MAKES IT! Assist: Collin Butler
Score: 89-84

[03:39] Team_086 possession (Score: 89-84)
Kyle McCollum attempts a 3Pt. Wide open! Chris LaVine is 8.1 feet away. [MAN] Kyle McCollum misses. Rebound secured by Chris LaVine.

[03:25] Team_046 possession (Score: 89-84)
FOUL! Shooting foul on Franz McGrady. Josh Barrett to the line for 2 free throws. [BONUS: 5 team fouls] (Franz McGrady: 1 personal fouls)   FT 1/2: MISS   FT 2/2: GOOD Josh Barrett makes 1/2 from the line.
Score: 89-85

[03:11] Team_086 possession (Score: 89-85)
Franz McGrady drives, Josh Barrett stays with him. Franz McGrady attempts a Layup. Contested by Josh Barrett (4.9 feet, MAN). Franz McGrady misses. Rebound secured by Manu Dosunmu.

[02:55] Team_046 possession (Score: 89-85)
Chris LaVine attempts a Midrange. Contested by Kyle McCollum (5.7 feet, MAN). Chris LaVine misses. Rebound secured by Kyle McCollum.

[02:43] Team_086 possession (Score: 89-85)
Lamelo Towns attempts a Midrange. Wide open! Chris LaVine is 6.0 feet away. [ZONE] LAMELO TOWNS MAKES IT!
Score: 91-85

[02:32] Team_046 possession (Score: 91-85)
Manu Dosunmu drives and kicks out. Collin Butler attempts a 3Pt. Contested by Anfernee Green (2.4 feet, MAN). Collin Butler misses. Rebound secured by Lamelo Towns.

[02:14] Team_086 possession (Score: 91-85)
Kyle McCollum makes the Layup and draws the foul on Manu Dosunmu! And-1! Kyle McCollum to the line for 1. [BONUS: 7 team fouls] (Manu Dosunmu: 1 personal fouls)   FT 1/1: MISS Kyle McCollum makes 0/1 from the line. Offensive rebound by Lamelo Towns! Lamelo Towns kicks it out.
Score: 93-85

[02:00] Team_086 possession (Score: 93-85)
Franz McGrady attempts a 3Pt. Heavily contested by Collin Butler (0.6 feet, ZONE)! Franz McGrady misses. Rebound secured by Paul DeRozan.

[01:47] Team_046 possession (Score: 93-85)
Chris LaVine makes the Layup and draws the foul on Kyle McCollum! And-1! Chris LaVine to the line for 1. [BONUS: 6 team fouls] (Kyle McCollum: 2 personal fouls)   FT 1/1: MISS Chris LaVine makes 0/1 from the line. Rebound secured by Lamelo Towns.
Score: 93-87

[01:36] Team_086 possession (Score: 93-87)
Anthony James attempts a Layup. BLOCKED BY COLLIN BUTLER! Ball is loose! Rebound secured by Manu Dosunmu.

[01:25] Team_046 possession (Score: 93-87)
FOUL! Holding foul on Franz McGrady. [IN THE BONUS! 7 team fouls] Josh Barrett to the line for 2 free throws. (Franz McGrady: 2 personal fouls)   FT 1/2: MISS   FT 2/2: MISS Josh Barrett makes 0/2 from the line. Rebound secured by Lamelo Towns.

[01:11] Team_086 possession (Score: 93-87)
Anthony James attempts a 3Pt. Contested by Collin Butler (5.1 feet, ZONE). Anthony James misses. Rebound secured by Chris LaVine.

[00:53] Team_046 possession (Score: 93-87)
Manu Dosunmu drives and kicks out. Chris LaVine attempts a Midrange. Wide open! Lamelo Towns is 7.5 feet away. [ZONE] CHRIS LAVINE MAKES IT!
Score: 93-89

[00:40] Team_086 possession (Score: 93-89)
Kyle McCollum attempts a Midrange. Wide open! Josh Barrett is 6.2 feet away. [ZONE] Kyle McCollum misses. Rebound secured by Manu Dosunmu.

[00:28] Team_046 possession (Score: 93-89)
Manu Dosunmu attempts a 3Pt. Wide open! Anfernee Green is 6.0 feet away. [ZONE] Manu Dosunmu misses. Rebound secured by Anfernee Green.

[00:12] Team_086 possession (Score: 93-89)
Anthony James commits a violation (traveling/carry)! TURNOVER! (dead ball)

================================================================================
                              4TH QUARTER COMPLETE                              
================================================================================

4TH QUARTER SCORE: Team_086 18, Team_046 19

BOX SCORE:
================================================================================

Team_086
--------------------------------------------------------------------------------
Player                MIN  PTS  REB  AST  TO      FG   FG%      3P   3P%
--------------------------------------------------------------------------------
Anfernee Green         13    4    2    0   0   1/1   100.0     0/0   0.0
Lamelo Towns           13    4    4    0   0   2/4    50.0     0/0   0.0
Anfernee Harris        35    2    0    0   0   1/1   100.0     0/0   0.0
Bones Ginobili         35    2    0    0   0   1/1   100.0     0/0   0.0
Lauri Johnson          35    2    0    1   0   1/1   100.0     0/0   0.0
Kyle McCollum          13    2    1    0   0   1/3    33.3     0/0   0.0
Miles Gobert           39    0    6    0   0   0/0     0.0     0/0   0.0
Rudy Rose              35    0    1    1   0   0/0     0.0     0/0   0.0
Anthony James          13    0    0    0   0   0/4     0.0     0/0   0.0
Franz McGrady          10    0    0    0   0   0/3     0.0     0/0   0.0

TEAM: FG: 7/18 (38.9%), 3PT: 1/6 (16.7%), REB: 13 (4 off, 9 def), AST: 2, TO: 3
TEAM FOULS: 7 [Team_046 in BONUS]


Team_046
--------------------------------------------------------------------------------
Player                MIN  PTS  REB  AST  TO      FG   FG%      3P   3P%
--------------------------------------------------------------------------------
Chris LaVine           13    7    7    0   0   3/6    50.0     0/0   0.0
Josh Barrett           13    6    0    0   0   3/3   100.0     0/0   0.0
Manu Dosunmu           13    2    3    0   0   1/4    25.0     0/0   0.0
Collin Butler          13    2    0    2   0   1/1   100.0     0/0   0.0
Cade Wall              35    0    0    0   0   0/1     0.0     0/0   0.0
D'Angelo O'Neal        35    0    0    0   0   0/1     0.0     0/0   0.0
Paul DeRozan           13    0    3    0   0   0/1     0.0     0/0   0.0

TEAM: FG: 8/18 (44.4%), 3PT: 1/5 (20.0%), REB: 14 (3 off, 11 def), AST: 2, TO: 2
TEAM FOULS: 7 [Team_086 in BONUS]

================================================================================

================================================================================
                               FULL GAME COMPLETE                               
================================================================================

FINAL SCORE: Team_086 93, Team_046 89

SCORING BY QUARTER:
--------------------------------------------------------------------------------
Team                     Q1     Q2     Q3     Q4    FINAL
--------------------------------------------------------------------------------
Team_086                 21     29     25     18       93
Team_046                 28     18     24     19       89
--------------------------------------------------------------------------------

FULL GAME BOX SCORE:
================================================================================

Team_086
--------------------------------------------------------------------------------
Player                MIN  PTS  REB  AST  TO      FG   FG%      3P   3P%      FT STL BLK
--------------------------------------------------------------------------------
Miles Gobert           39    5   15    6   1   2/6    33.3   0/3     0.0   1/1     0   1
Lauri Johnson          35   18    0    5   2   9/16   56.2   4/10   40.0   5/5     1   0
Anfernee Harris        35   15    0    3   3   8/12   66.7   2/4    50.0   0/0     0   0
Bones Ginobili         35    9    8    5   0   3/8    37.5   0/2     0.0   0/0     0   0
Rudy Rose              35   28   14    3   2  11/15   73.3   0/1     0.0   1/1     0   0
Anfernee Green         13    4    3    0   0   1/1   100.0   1/1   100.0   1/1     0   2
Anthony James          13    2    0    1   1   0/4     0.0   0/2     0.0   2/2     0   0
Kyle McCollum          13    2    1    0   0   0/3     0.0   0/1     0.0   2/3     1   0
Lamelo Towns           13    8    7    0   0   4/7    57.1   0/0     0.0   2/2     0   0
Franz McGrady          10    0    0    0   0   0/4     0.0   0/3     0.0   0/0     0   0

TEAM: FG: 40/78 (51.3%), 3PT: 7/27 (25.9%), REB: 47 (11 off, 36 def), AST: 23, TO: 9


Team_046
--------------------------------------------------------------------------------
Player                MIN  PTS  REB  AST  TO      FG   FG%      3P   3P%      FT STL BLK
--------------------------------------------------------------------------------
D'Angelo O'Neal        35   13    0    2   1   5/11   45.5   2/4    50.0   2/4     0   0
Victor Nowitzki        35   13    0    3   0   5/11   45.5   1/3    33.3   3/4     1   0
Lauri Carter           35    7    4    5   2   6/15   40.0   0/6     0.0   1/2     0   0
Cade Wall              35   22   14    3   1   7/10   70.0   2/4    50.0   0/0     0   0
Kevin Allen            35    9   12    3   0   6/10   60.0   1/1   100.0   0/0     1   1
Collin Butler          13    4    0    2   0   3/3   100.0   1/1   100.0   0/0     0   1
Manu Dosunmu           13    2    4    0   0   2/6    33.3   0/2     0.0   0/0     0   0
Josh Barrett           13    7    0    0   0   4/4   100.0   1/1   100.0   2/6     0   1
Chris LaVine           13    8    8    0   1   2/5    40.0   0/1     0.0   2/4     0   0
Paul DeRozan           13    0    4    1   1   0/2     0.0   0/0     0.0   0/0     0   0

TEAM: FG: 40/78 (51.3%), 3PT: 8/23 (34.8%), REB: 47 (9 off, 38 def), AST: 19, TO: 6

================================================================================
