================================================================================
                        FULL GAME - Team_002 vs Team_024                        
================================================================================

================================================================================
                       1ST QUARTER - Team_002 vs Team_024                       
================================================================================

[12:00] Team_002 possession (Score: 0-0)
Jordan Green drives to the basket... Jordan Green commits a violation (traveling/carry)! TURNOVER! (dead ball)

[11:46] Team_024 possession (Score: 0-0)
Ja Reaves loses the ball! Stripped by Miles Bane! TURNOVER! (live ball)

[11:32] Team_002 possession (Score: 0-0)
Carmelo Lowry attempts a Layup. Contested by Anfernee Williamson (4.0 feet, MAN). Carmelo Lowry misses. Offensive rebound by Tyler Porzingis! Tyler Porzingis puts it back in!
Score: 2-0

[11:14] Team_024 possession (Score: 2-0)
Ja Reaves attempts a 3Pt. Contested by Miles Bane (4.6 feet, MAN). Ja Reaves misses. Rebound secured by Miles Bane.

[11:01] Team_002 possession (Score: 2-0)
Tyler Porzingis attempts a Layup. Contested by Anfernee Williamson (3.6 feet, ZONE). TYLER PORZINGIS MAKES IT! Assist: Carmelo Lowry
Score: 4-0

[10:48] Team_024 possession (Score: 4-0)
Anfernee Williamson attempts a 3Pt. Contested by Carmelo Lowry (5.3 feet, MAN). ANFERNEE WILLIAMSON MAKES IT! Assist: Draymond Towns
Score: 4-3

[10:38] Team_002 possession (Score: 4-3)
Tyler Porzingis attempts a Layup. Contested by Anfernee Williamson (3.0 feet, MAN). TYLER PORZINGIS MAKES IT! Assist: Carmelo Lowry
Score: 6-3

[10:24] Team_024 possession (Score: 6-3)
FOUL! Shooting foul on CJ Barrett. Ja Reaves to the line for 2 free throws. [Team fouls: 1] (CJ Barrett: 1 personal fouls)   FT 1/2: GOOD   FT 2/2: MISS Ja Reaves makes 1/2 from the line. Rebound secured by Tyler Porzingis.
Score: 6-4

[10:11] Team_002 possession (Score: 6-4)
Tyler Porzingis attempts a Midrange. Heavily contested by Anfernee Williamson (1.0 feet, MAN)! Tyler Porzingis misses. Rebound secured by Anfernee Williamson.

[09:56] Team_024 possession (Score: 6-4)
Bradley Allen attempts a 3Pt. Contested by Jordan Green (5.5 feet, MAN). BRADLEY ALLEN MAKES IT!
Score: 6-7

[09:40] Team_002 possession (Score: 6-7)
Tyler Porzingis throws a bad pass out of bounds! TURNOVER! (dead ball)

[09:30] Team_024 possession (Score: 6-7)
Zach Fox makes the Dunk and draws the foul on CJ Barrett! And-1! Zach Fox to the line for 1. [Team fouls: 2] (CJ Barrett: 2 personal fouls)   FT 1/1: GOOD Zach Fox makes 1/1 from the line.
Score: 6-10

[09:14] Team_002 possession (Score: 6-10)
FOUL! Reach-in foul on Anfernee Williamson during the drive. [Team fouls: 1] No free throws, side out. (Anfernee Williamson: 1 personal fouls)

[09:03] Team_002 possession (Score: 6-10)
Miles Bane attempts a Midrange. Contested by Draymond Towns (2.7 feet, ZONE). MILES BANE MAKES IT! Assist: Tyler Porzingis
Score: 8-10

[08:51] Team_024 possession (Score: 8-10)
Draymond Towns drives and kicks out. Zach Fox attempts a 3Pt. Contested by CJ Barrett (3.9 feet, ZONE). Zach Fox misses. Rebound secured by Carmelo Lowry.

[08:37] Team_002 possession (Score: 8-10)
CJ Barrett attempts a Midrange. Wide open! Zach Fox is 8.1 feet away. [MAN] CJ Barrett misses. Rebound secured by Draymond Towns.

[08:19] Team_024 possession (Score: 8-10)
Bradley Allen attempts a 3Pt. Contested by CJ Barrett (4.1 feet, ZONE). Bradley Allen misses. Rebound secured by Miles Bane.

[08:05] Team_002 possession (Score: 8-10)
Miles Bane attempts a Midrange. Contested by Zach Fox (2.4 feet, ZONE). Miles Bane misses. Rebound secured by Draymond Towns.

[07:49] Team_024 possession (Score: 8-10)
Draymond Towns attempts a Midrange. Contested by Jordan Green (4.6 feet, ZONE). DRAYMOND TOWNS MAKES IT! Assist: Anfernee Williamson
Score: 8-12

[07:37] Team_002 possession (Score: 8-12)
Carmelo Lowry drives to the basket... Carmelo Lowry loses control! Ball rolls out of bounds! TURNOVER! (dead ball)

[07:21] Team_024 possession (Score: 8-12)
Bradley Allen attempts a 3Pt. Wide open! CJ Barrett is 6.5 feet away. [ZONE] Bradley Allen misses. Rebound secured by Carmelo Lowry.

[07:04] Team_002 possession (Score: 8-12)
Jordan Green attempts a 3Pt. Contested by Bradley Allen (4.9 feet, MAN). Jordan Green misses. Rebound secured by Zach Fox.

[06:48] Team_024 possession (Score: 8-12)
Draymond Towns attempts a Midrange. Wide open! CJ Barrett is 6.5 feet away. [ZONE] Draymond Towns misses. Rebound secured by Miles Bane.

[06:32] Team_002 possession (Score: 8-12)
Tyler Porzingis drives and kicks out. Tyler Porzingis attempts a 3Pt. Contested by Anfernee Williamson (4.4 feet, MAN). Tyler Porzingis misses. FOUL! Loose ball foul on Anfernee Williamson during the rebound battle. [Team fouls: 2] No free throws, side out. (Anfernee Williamson: 2 personal fouls)

[06:17] Team_002 possession (Score: 8-12)
Tyler Porzingis attempts a 3Pt. Heavily contested by Anfernee Williamson (1.9 feet, MAN)! Tyler Porzingis misses. Rebound secured by Zach Fox.

[06:01] Team_024 possession (Score: 8-12)
Anfernee Williamson drives, picks up Carmelo Lowry. Help arrives from CJ Barrett! Anfernee Williamson attempts a Layup. Heavily contested by CJ Barrett (0.8 feet, MAN)! ANFERNEE WILLIAMSON MAKES IT!
Score: 8-14

[05:44] Team_002 possession (Score: 8-14)
CJ Barrett attempts a Midrange. Heavily contested by Zach Fox (1.3 feet, MAN)! CJ Barrett misses. Rebound secured by Draymond Towns.

[05:28] Team_024 possession (Score: 8-14)
FOUL! Holding foul on CJ Barrett. [Team fouls: 3] No free throws, side out. (CJ Barrett: 3 personal fouls)

[05:14] Team_024 possession (Score: 8-14)
Zach Fox makes the Layup and draws the foul on Tyler Porzingis! And-1! Zach Fox to the line for 1. [Team fouls: 4] (Tyler Porzingis: 1 personal fouls)   FT 1/1: GOOD Zach Fox makes 1/1 from the line.
Score: 8-17

[04:58] Team_002 possession (Score: 8-17)
Tyler Porzingis attempts a Midrange. Contested by Zach Fox (2.2 feet, ZONE). Tyler Porzingis misses. Rebound secured by Zach Fox.

[04:48] Team_024 possession (Score: 8-17)
Anfernee Williamson attempts a 3Pt. Contested by CJ Barrett (2.5 feet, ZONE). ANFERNEE WILLIAMSON MAKES IT! Assist: Zach Fox
Score: 8-20

[04:31] Team_002 possession (Score: 8-20)
Miles Bane attempts a Layup. Contested by Ja Reaves (5.8 feet, MAN). Miles Bane misses. Rebound secured by Anfernee Williamson.

[04:15] Team_024 possession (Score: 8-20)
Bradley Allen drives, picks up Tyler Porzingis. Help arrives from CJ Barrett! Bradley Allen attempts a Dunk. Heavily contested by CJ Barrett (0.5 feet, ZONE)! BRADLEY ALLEN MAKES IT!
Score: 8-22

[03:59] Team_002 possession (Score: 8-22)
Jordan Green attempts a 3Pt. Wide open! Bradley Allen is 6.6 feet away. [MAN] Jordan Green misses. Rebound secured by Anfernee Williamson.

[03:42] Team_024 possession (Score: 8-22)
Draymond Towns attempts a Layup. Wide open! Tyler Porzingis is 6.1 feet away. [ZONE] DRAYMOND TOWNS MAKES IT! Assist: Ja Reaves
Score: 8-24

[03:25] Team_002 possession (Score: 8-24)
Jordan Green attempts a Midrange. Wide open! Bradley Allen is 7.6 feet away. [MAN] JORDAN GREEN MAKES IT!
Score: 10-24

[03:09] Team_024 possession (Score: 10-24)
Anfernee Williamson attempts a Midrange. Contested by Carmelo Lowry (5.3 feet, MAN). ANFERNEE WILLIAMSON MAKES IT! Assist: Zach Fox
Score: 10-26

[02:55] Team_002 possession (Score: 10-26)
Miles Bane attempts a 3Pt. Contested by Ja Reaves (4.9 feet, MAN). Miles Bane misses. Rebound secured by Zach Fox.

[02:39] Team_024 possession (Score: 10-26)
FOUL! Holding foul on Carmelo Lowry. [IN THE BONUS! 5 team fouls] Anfernee Williamson to the line for 2 free throws. (Carmelo Lowry: 1 personal fouls)   FT 1/2: GOOD   FT 2/2: GOOD Anfernee Williamson makes 2/2 from the line.
Score: 10-28

[02:22] Team_002 possession (Score: 10-28)
CJ Barrett loses the ball! Stripped by Zach Fox! TURNOVER! (live ball)

[02:05] Team_024 possession (Score: 10-28)
Bradley Allen attempts a 3Pt. Contested by Jordan Green (4.2 feet, MAN). BRADLEY ALLEN MAKES IT! Assist: Anfernee Williamson
Score: 10-31

[01:48] Team_002 possession (Score: 10-31)
Carmelo Lowry attempts a 3Pt. Contested by Zach Fox (3.5 feet, ZONE). Carmelo Lowry misses. Rebound secured by Anfernee Williamson.

[01:32] Team_024 possession (Score: 10-31)
Draymond Towns drives, Tyler Porzingis stays with him. Draymond Towns attempts a Layup. Contested by Tyler Porzingis (2.9 feet, MAN). DRAYMOND TOWNS MAKES IT! Assist: Anfernee Williamson
Score: 10-33

[01:17] Team_002 possession (Score: 10-33)
Jordan Green attempts a Midrange. Contested by Bradley Allen (5.8 feet, MAN). Jordan Green misses. Rebound secured by Anfernee Williamson.

[00:58] Team_024 possession (Score: 10-33)
Bradley Allen attempts a 3Pt. Wide open! CJ Barrett is 7.8 feet away. [ZONE] BRADLEY ALLEN MAKES IT! Assist: Anfernee Williamson
Score: 10-36

[00:44] Team_002 possession (Score: 10-36)
Tyler Porzingis drives, Draymond Towns stays with him. Tyler Porzingis attempts a Layup. Contested by Draymond Towns (4.2 feet, MAN). TYLER PORZINGIS MAKES IT! Assist: Jordan Green
Score: 12-36

[00:31] Team_024 possession (Score: 12-36)
Anfernee Williamson attempts a Midrange. Contested by Carmelo Lowry (3.4 feet, MAN). Anfernee Williamson misses. Rebound secured by Carmelo Lowry.

[00:22] Team_002 possession (Score: 12-36)
Tyler Porzingis attempts a Layup. Wide open! Draymond Towns is 6.2 feet away. [MAN] Tyler Porzingis misses. Rebound secured by Anfernee Williamson.

[00:07] Team_024 possession (Score: 12-36)
Draymond Towns loses the ball! Stripped by Tyler Porzingis! TURNOVER! (live ball)

================================================================================
                              1ST QUARTER COMPLETE                              
================================================================================

1ST QUARTER SCORE: Team_002 12, Team_024 36

BOX SCORE:
================================================================================

Team_002
--------------------------------------------------------------------------------
Player                MIN  PTS  REB  AST  TO      FG   FG%      3P   3P%
--------------------------------------------------------------------------------
Tyler Porzingis        12    8    3    1   0   4/8    50.0     0/0   0.0
Miles Bane             12    2    3    0   0   1/4    25.0     0/0   0.0
Jordan Green           12    2    0    1   0   1/4    25.0     0/0   0.0
Carmelo Lowry          12    0    3    2   0   0/1     0.0     0/0   0.0
CJ Barrett             12    0    0    0   0   0/2     0.0     0/0   0.0

TEAM: FG: 6/19 (31.6%), 3PT: 0/5 (0.0%), REB: 9 (2 off, 7 def), AST: 4, TO: 4
TEAM FOULS: 5 [Team_024 in BONUS]


Team_024
--------------------------------------------------------------------------------
Player                MIN  PTS  REB  AST  TO      FG   FG%      3P   3P%
--------------------------------------------------------------------------------
Anfernee Williamson    12   12    6    4   0   5/6    83.3     0/0   0.0
Bradley Allen          12   11    0    0   0   4/6    66.7     0/0   0.0
Draymond Towns         12    6    3    1   0   3/5    60.0     0/0   0.0
Zach Fox               12    6    4    2   0   2/2   100.0     0/0   0.0
Ja Reaves              12    0    0    1   0   0/2     0.0     0/0   0.0

TEAM: FG: 14/21 (66.7%), 3PT: 5/8 (62.5%), REB: 13 (0 off, 13 def), AST: 8, TO: 2
TEAM FOULS: 2

================================================================================

================================================================================
                       2ND QUARTER - Team_002 vs Team_024                       
================================================================================

[12:00] Team_002 possession (Score: 12-36)
CJ Barrett attempts a Layup. Contested by Anfernee Williamson (3.9 feet, ZONE). CJ Barrett misses. Offensive rebound by Carmelo Lowry! Carmelo Lowry kicks it out.

[11:46] Team_002 possession (Score: 12-36)
Jordan Green drives, picks up Bradley Allen. Help arrives from Zach Fox! Jordan Green attempts a Dunk. Wide open! Zach Fox is 7.5 feet away. [MAN] JORDAN GREEN MAKES IT! Assist: CJ Barrett
Score: 14-36

[11:36] Team_024 possession (Score: 14-36)
FOUL! Reach-in foul on Carmelo Lowry during the drive. [Team fouls: 1] No free throws, side out. (Carmelo Lowry: 1 personal fouls)

[11:18] Team_024 possession (Score: 14-36)
Ja Reaves drives and kicks out. Anfernee Williamson attempts a Midrange. Contested by Carmelo Lowry (4.0 feet, MAN). ANFERNEE WILLIAMSON MAKES IT!
Score: 14-38

[11:03] Team_002 possession (Score: 14-38)
CJ Barrett attempts a 3Pt. Contested by Zach Fox (3.4 feet, MAN). CJ Barrett misses. Rebound secured by Anfernee Williamson.

[10:44] Team_024 possession (Score: 14-38)
Zach Fox attempts a Layup. Contested by Tyler Porzingis (3.3 feet, ZONE). ZACH FOX MAKES IT! Assist: Bradley Allen
Score: 14-40

[10:33] Team_002 possession (Score: 14-40)
Miles Bane attempts a 3Pt. Contested by Ja Reaves (5.4 feet, MAN). Miles Bane misses. Rebound secured by Draymond Towns.

[10:22] Team_024 possession (Score: 14-40)
FOUL! Shooting foul on Carmelo Lowry. Anfernee Williamson to the line for 3 free throws. [Team fouls: 2] (Carmelo Lowry: 2 personal fouls)   FT 1/3: GOOD   FT 2/3: GOOD   FT 3/3: GOOD Anfernee Williamson makes 3/3 from the line.
Score: 14-43

[10:04] Team_002 possession (Score: 14-43)
Tyler Porzingis drives and kicks out. FOUL! Shooting foul on Draymond Towns. Tyler Porzingis to the line for 3 free throws. [Team fouls: 1] (Draymond Towns: 1 personal fouls)   FT 1/3: GOOD   FT 2/3: GOOD   FT 3/3: GOOD Tyler Porzingis makes 3/3 from the line.
Score: 17-43

[09:54] Team_024 possession (Score: 17-43)
Zach Fox attempts a Midrange. Contested by CJ Barrett (3.7 feet, MAN). Zach Fox misses. Offensive rebound by Zach Fox! Zach Fox kicks it out.

[09:38] Team_024 possession (Score: 17-43)
FOUL! Shooting foul on Miles Bane. Ja Reaves to the line for 2 free throws. [Team fouls: 3] (Miles Bane: 1 personal fouls)   FT 1/2: GOOD   FT 2/2: GOOD Ja Reaves makes 2/2 from the line.
Score: 17-45

[09:26] Team_002 possession (Score: 17-45)
Miles Bane attempts a 3Pt. Contested by Zach Fox (4.2 feet, ZONE). MILES BANE MAKES IT! Assist: Jordan Green
Score: 20-45

[09:11] Team_024 possession (Score: 20-45)
Bradley Allen attempts a Midrange. Contested by Jordan Green (3.7 feet, MAN). Bradley Allen misses. Rebound secured by Miles Bane.

[08:53] Team_002 possession (Score: 20-45)
Miles Bane attempts a Midrange. Wide open! Draymond Towns is 6.6 feet away. [ZONE] Miles Bane misses. Rebound secured by Anfernee Williamson.

[08:39] Team_024 possession (Score: 20-45)
Ja Reaves drives and kicks out. Draymond Towns attempts a 3Pt. Contested by Tyler Porzingis (3.2 feet, MAN). Draymond Towns misses. Rebound secured by Carmelo Lowry.

[08:24] Team_002 possession (Score: 20-45)
CJ Barrett attempts a Midrange. Contested by Zach Fox (5.2 feet, MAN). CJ BARRETT MAKES IT! Assist: Miles Bane
Score: 22-45

[08:05] Team_024 possession (Score: 22-45)
Ja Reaves attempts a Midrange. Wide open! Miles Bane is 7.8 feet away. [MAN] Ja Reaves misses. FOUL! Loose ball foul on Miles Bane during the rebound battle. [Team fouls: 4] No free throws, side out. (Miles Bane: 2 personal fouls)

[07:47] Team_024 possession (Score: 22-45)
Anfernee Williamson attempts a 3Pt. Contested by Carmelo Lowry (4.2 feet, MAN). Anfernee Williamson misses. Rebound secured by Miles Bane.

[07:32] Team_002 possession (Score: 22-45)
Tyler Porzingis makes the Layup and draws the foul on Anfernee Williamson! And-1! Tyler Porzingis to the line for 1. [Team fouls: 2] (Anfernee Williamson: 1 personal fouls)   FT 1/1: GOOD Tyler Porzingis makes 1/1 from the line.
Score: 25-45

[07:18] Team_024 possession (Score: 25-45)
Draymond Towns drives, Tyler Porzingis stays with him. Draymond Towns attempts a Layup. Wide open! Tyler Porzingis is 6.5 feet away. [ZONE] Draymond Towns misses. Offensive rebound by Zach Fox! Zach Fox kicks it out.

[07:03] Team_024 possession (Score: 25-45)
Ja Reaves attempts a Layup. Wide open! Tyler Porzingis is 9.0 feet away. [ZONE] Ja Reaves misses. Offensive rebound by Zach Fox! Zach Fox kicks it out.

[06:52] Team_024 possession (Score: 25-45)
FOUL! Shooting foul on CJ Barrett. Draymond Towns to the line for 2 free throws. [BONUS: 5 team fouls] (CJ Barrett: 1 personal fouls)   FT 1/2: GOOD   FT 2/2: GOOD Draymond Towns makes 2/2 from the line.
Score: 25-47

[06:34] Team_002 possession (Score: 25-47)
Jordan Green drives, Anfernee Williamson stays with him. Jordan Green attempts a Layup. Contested by Anfernee Williamson (3.8 feet, ZONE). JORDAN GREEN MAKES IT!
Score: 27-47

[06:22] Team_024 possession (Score: 27-47)
Zach Fox attempts a 3Pt. Contested by Miles Bane (4.9 feet, ZONE). Zach Fox misses. Rebound secured by Carmelo Lowry.

[06:11] Team_002 possession (Score: 27-47)
Jordan Green attempts a Midrange. Wide open! Bradley Allen is 6.1 feet away. [MAN] JORDAN GREEN MAKES IT!
Score: 29-47

[05:54] Team_024 possession (Score: 29-47)
Draymond Towns attempts a Layup. Wide open! Tyler Porzingis is 6.7 feet away. [ZONE] Draymond Towns misses. Rebound secured by Tyler Porzingis.

[05:40] Team_002 possession (Score: 29-47)
Miles Bane drives, picks up Anfernee Williamson. Help arrives from Zach Fox! Miles Bane attempts a Layup. Heavily contested by Zach Fox (1.1 feet, ZONE)! Miles Bane misses. Rebound secured by Anfernee Williamson.

[05:26] Team_024 possession (Score: 29-47)
FOUL! Shooting foul on Tyler Porzingis. Draymond Towns to the line for 2 free throws. [BONUS: 6 team fouls] (Tyler Porzingis: 1 personal fouls)   FT 1/2: GOOD   FT 2/2: GOOD Draymond Towns makes 2/2 from the line.
Score: 29-49

[05:10] Team_002 possession (Score: 29-49)
CJ Barrett attempts a Midrange. Wide open! Zach Fox is 6.8 feet away. [MAN] CJ Barrett misses. Rebound secured by Zach Fox.

[04:54] Team_024 possession (Score: 29-49)
Draymond Towns attempts a Layup. Contested by Tyler Porzingis (2.1 feet, MAN). Draymond Towns misses. FOUL! Loose ball foul on Miles Bane during the rebound battle. [IN THE BONUS! 7 team fouls] Zach Fox to the line for 2 free throws. (Miles Bane: 3 personal fouls)   FT 1/2: GOOD   FT 2/2: GOOD Zach Fox makes 2/2 from the line.
Score: 29-51

[04:44] Team_002 possession (Score: 29-51)
Carmelo Lowry attempts a Midrange. Wide open! Anfernee Williamson is 8.8 feet away. [MAN] Carmelo Lowry misses. Rebound secured by Zach Fox.

[04:28] Team_024 possession (Score: 29-51)
Zach Fox attempts a Midrange. Contested by CJ Barrett (3.5 feet, MAN). Zach Fox misses. Offensive rebound by Draymond Towns! Draymond Towns kicks it out.

[04:12] Team_024 possession (Score: 29-51)
Draymond Towns drives, Tyler Porzingis stays with him. Draymond Towns attempts a Dunk. Contested by Tyler Porzingis (2.9 feet, ZONE). DRAYMOND TOWNS MAKES IT!
Score: 29-53

[03:59] Team_002 possession (Score: 29-53)
Jordan Green attempts a 3Pt. Contested by Zach Fox (5.4 feet, ZONE). JORDAN GREEN MAKES IT! Assist: Tyler Porzingis
Score: 32-53

[03:45] Team_024 possession (Score: 32-53)
Ja Reaves attempts a 3Pt. Contested by Miles Bane (4.8 feet, MAN). JA REAVES MAKES IT! Assist: Draymond Towns
Score: 32-56

[03:29] Team_002 possession (Score: 32-56)
Jordan Green attempts a Layup. Contested by Bradley Allen (4.7 feet, MAN). JORDAN GREEN MAKES IT! Assist: CJ Barrett
Score: 34-56

[03:13] Team_024 possession (Score: 34-56)
Draymond Towns loses the ball! Stripped by Tyler Porzingis! TURNOVER! (live ball)

[03:00] Team_002 possession (Score: 34-56)
Carmelo Lowry drives to the basket... Carmelo Lowry commits a violation (traveling/carry)! TURNOVER! (dead ball)

[03:00] Substitution (Team_002): Miles Bane OUT → John Duncan IN (stamina_rule2)

[03:00] Substitution (Team_002): CJ Barrett OUT → Dirk Middleton IN (stamina_rule2)

[03:00] Substitution (Team_002): Jordan Green OUT → Anfernee Sexton IN (stamina_rule2)

[03:00] Substitution (Team_002): Carmelo Lowry OUT → Julius Curry IN (stamina_rule2)

[03:00] Substitution (Team_002): Tyler Porzingis OUT → Lamelo O'Neal IN (stamina_rule2)

[03:00] Substitution (Team_024): Ja Reaves OUT → Victor Simons IN (stamina_rule2)

[03:00] Substitution (Team_024): Zach Fox OUT → Vince Irving IN (stamina_rule2)

[03:00] Substitution (Team_024): Bradley Allen OUT → Zach Durant IN (stamina_rule2)

[03:00] Substitution (Team_024): Anfernee Williamson OUT → Julius Harris IN (stamina_rule2)

[03:00] Substitution (Team_024): Draymond Towns OUT → Terry Rozier IN (stamina_rule2)

[02:45] Team_024 possession (Score: 34-56)
Zach Durant attempts a 3Pt. Wide open! Anfernee Sexton is 6.7 feet away. [MAN] ZACH DURANT MAKES IT! Assist: Terry Rozier
Score: 34-59

[02:30] Team_002 possession (Score: 34-59)
Anfernee Sexton drives, Zach Durant stays with him. Anfernee Sexton attempts a Dunk. Contested by Zach Durant (5.7 feet, MAN). Anfernee Sexton misses. Offensive rebound by Lamelo O'Neal! Lamelo O'Neal's putback is no good. Rebound secured by Terry Rozier.

[02:19] Team_024 possession (Score: 34-59)
Terry Rozier drives and kicks out. Julius Harris attempts a 3Pt. Heavily contested by Lamelo O'Neal (1.2 feet, MAN)! Julius Harris misses. Rebound secured by Julius Curry.

[02:03] Team_002 possession (Score: 34-59)
Lamelo O'Neal drives to the basket... Lamelo O'Neal throws a bad pass out of bounds! TURNOVER! (dead ball)

[01:52] Team_024 possession (Score: 34-59)
Victor Simons drives, Lamelo O'Neal stays with him. Victor Simons attempts a Layup. Wide open! Lamelo O'Neal is 6.9 feet away. [ZONE] Victor Simons misses. FOUL! Loose ball foul on Anfernee Sexton during the rebound battle. [IN THE BONUS! 8 team fouls] Julius Harris to the line for 2 free throws. (Anfernee Sexton: 1 personal fouls)   FT 1/2: GOOD   FT 2/2: GOOD Julius Harris makes 2/2 from the line.
Score: 34-61

[01:36] Team_002 possession (Score: 34-61)
Anfernee Sexton attempts a 3Pt. Heavily contested by Zach Durant (2.0 feet, ZONE)! ANFERNEE SEXTON MAKES IT! Assist: John Duncan
Score: 37-61

[01:20] Team_024 possession (Score: 37-61)
FOUL! Holding foul on Dirk Middleton. [IN THE BONUS! 9 team fouls] Vince Irving to the line for 2 free throws. (Dirk Middleton: 1 personal fouls)   FT 1/2: GOOD   FT 2/2: GOOD Vince Irving makes 2/2 from the line.
Score: 37-63

[01:08] Team_002 possession (Score: 37-63)
Anfernee Sexton attempts a 3Pt. Heavily contested by Zach Durant (1.9 feet, MAN)! Anfernee Sexton misses. Rebound secured by Zach Durant.

[00:55] Team_024 possession (Score: 37-63)
Julius Harris loses the ball! Stripped by Lamelo O'Neal! TURNOVER! (live ball)

[00:39] Team_002 possession (Score: 37-63)
FOUL! Reach-in foul on Terry Rozier during the drive. [Team fouls: 3] No free throws, side out. (Terry Rozier: 1 personal fouls)

[00:23] Team_002 possession (Score: 37-63)
Julius Curry attempts a 3Pt. Contested by Victor Simons (2.9 feet, ZONE). JULIUS CURRY MAKES IT! Assist: Lamelo O'Neal
Score: 40-63

[00:08] Team_024 possession (Score: 40-63)
Victor Simons drives, Lamelo O'Neal stays with him. Victor Simons attempts a Layup. Contested by Lamelo O'Neal (5.1 feet, ZONE). Victor Simons misses. Rebound secured by Lamelo O'Neal.

================================================================================
                              2ND QUARTER COMPLETE                              
================================================================================

2ND QUARTER SCORE: Team_002 28, Team_024 27

BOX SCORE:
================================================================================

Team_002
--------------------------------------------------------------------------------
Player                MIN  PTS  REB  AST  TO      FG   FG%      3P   3P%
--------------------------------------------------------------------------------
Jordan Green           21   11    0    1   0   5/5   100.0     0/0   0.0
Tyler Porzingis        21    6    1    1   0   2/2   100.0     0/0   0.0
Miles Bane             21    3    2    1   0   1/4    25.0     0/0   0.0
Anfernee Sexton         3    3    0    0   0   1/3    33.3     0/0   0.0
Julius Curry            3    3    1    0   0   1/1   100.0     0/0   0.0
CJ Barrett             21    2    0    2   0   1/3    33.3     0/0   0.0
Carmelo Lowry          21    0    3    0   0   0/1     0.0     0/0   0.0
John Duncan             3    0    0    1   0   0/0     0.0     0/0   0.0
Lamelo O'Neal           3    0    1    1   0   0/0     0.0     0/0   0.0

TEAM: FG: 11/19 (57.9%), 3PT: 4/7 (57.1%), REB: 9 (2 off, 7 def), AST: 7, TO: 2
TEAM FOULS: 9 [Team_024 in BONUS]


Team_024
--------------------------------------------------------------------------------
Player                MIN  PTS  REB  AST  TO      FG   FG%      3P   3P%
--------------------------------------------------------------------------------
Draymond Towns         21    6    2    1   0   3/4    75.0     0/0   0.0
Anfernee Williamson    21    5    3    0   0   2/3    66.7     0/0   0.0
Ja Reaves              21    5    0    0   0   2/3    66.7     0/0   0.0
Zach Fox               21    4    6    0   0   2/3    66.7     0/0   0.0
Zach Durant             3    3    1    0   0   1/1   100.0     0/0   0.0
Julius Harris           3    2    0    0   0   1/1   100.0     0/0   0.0
Vince Irving            3    2    0    0   0   1/1   100.0     0/0   0.0
Bradley Allen          21    0    0    1   0   0/1     0.0     0/0   0.0
Terry Rozier            3    0    1    1   0   0/1     0.0     0/0   0.0
Victor Simons           3    0    0    0   0   0/1     0.0     0/0   0.0

TEAM: FG: 12/19 (63.2%), 3PT: 3/5 (60.0%), REB: 12 (5 off, 7 def), AST: 3, TO: 2
TEAM FOULS: 3

================================================================================

================================================================================
                       3RD QUARTER - Team_002 vs Team_024                       
================================================================================

[12:00] Team_002 possession (Score: 40-63)
CJ Barrett attempts a 3Pt. Heavily contested by Zach Fox (0.8 feet, MAN)! CJ Barrett misses. Rebound secured by Zach Fox.

[11:50] Team_024 possession (Score: 40-63)
Bradley Allen attempts a Midrange. Contested by Jordan Green (4.5 feet, ZONE). BRADLEY ALLEN MAKES IT!
Score: 40-65

[11:32] Team_002 possession (Score: 40-65)
Carmelo Lowry drives and kicks out. CJ Barrett attempts a 3Pt. Contested by Zach Fox (4.1 feet, ZONE). CJ Barrett misses. Rebound secured by Anfernee Williamson.

[11:14] Team_024 possession (Score: 40-65)
Draymond Towns attempts a 3Pt. Contested by CJ Barrett (4.1 feet, ZONE). Draymond Towns misses. Rebound secured by Carmelo Lowry.

[10:55] Team_002 possession (Score: 40-65)
Carmelo Lowry attempts a Midrange. Contested by Anfernee Williamson (5.3 feet, MAN). Carmelo Lowry misses. Rebound secured by Draymond Towns.

[10:43] Team_024 possession (Score: 40-65)
Zach Fox drives, CJ Barrett stays with him. Zach Fox attempts a Layup. Contested by CJ Barrett (4.7 feet, MAN). ZACH FOX MAKES IT! Assist: Ja Reaves
Score: 40-67

[10:29] Team_002 possession (Score: 40-67)
Tyler Porzingis makes the 3Pt and draws the foul on Anfernee Williamson! And-1! Tyler Porzingis to the line for 1. [Team fouls: 1] (Anfernee Williamson: 1 personal fouls)   FT 1/1: GOOD Tyler Porzingis makes 1/1 from the line.
Score: 44-67

[10:15] Team_024 possession (Score: 44-67)
Ja Reaves drives, Miles Bane stays with him. Ja Reaves attempts a Layup. Wide open! Miles Bane is 8.1 feet away. [MAN] Ja Reaves misses. Rebound secured by Tyler Porzingis.

[10:00] Team_002 possession (Score: 44-67)
CJ Barrett attempts a 3Pt. Wide open! Zach Fox is 6.7 feet away. [ZONE] CJ Barrett misses. Rebound secured by Draymond Towns.

[09:43] Team_024 possession (Score: 44-67)
FOUL! Reach-in foul on Carmelo Lowry during the drive. [Team fouls: 1] No free throws, side out. (Carmelo Lowry: 1 personal fouls)

[09:31] Team_024 possession (Score: 44-67)
Zach Fox attempts a 3Pt. Contested by CJ Barrett (4.1 feet, ZONE). Zach Fox misses. Offensive rebound by Draymond Towns! Draymond Towns's putback is no good. Rebound secured by Carmelo Lowry.

[09:15] Team_002 possession (Score: 44-67)
Carmelo Lowry attempts a 3Pt. Heavily contested by Zach Fox (0.5 feet, ZONE)! Carmelo Lowry misses. Rebound secured by Anfernee Williamson.

[09:00] Team_024 possession (Score: 44-67)
Bradley Allen attempts a Midrange. BLOCKED BY JORDAN GREEN! Ball is loose! Rebound secured by Miles Bane.

[08:46] Team_002 possession (Score: 44-67)
CJ Barrett drives, picks up Zach Fox. Help arrives from Bradley Allen! CJ Barrett attempts a Dunk. Contested by Bradley Allen (2.6 feet, MAN). CJ Barrett misses. Rebound secured by Anfernee Williamson.

[08:29] Team_024 possession (Score: 44-67)
Ja Reaves attempts a 3Pt. Wide open! Miles Bane is 7.5 feet away. [MAN] Ja Reaves misses. Rebound secured by Carmelo Lowry.

[08:13] Team_002 possession (Score: 44-67)
Carmelo Lowry drives to the basket... Carmelo Lowry commits a violation (traveling/carry)! TURNOVER! (dead ball)

[08:02] Team_024 possession (Score: 44-67)
Ja Reaves attempts a Midrange. Contested by Miles Bane (5.1 feet, MAN). Ja Reaves misses. Rebound secured by Miles Bane.

[07:51] Team_002 possession (Score: 44-67)
CJ Barrett attempts a Midrange. Wide open! Bradley Allen is 6.5 feet away. [ZONE] CJ Barrett misses. Rebound secured by Draymond Towns.

[07:38] Team_024 possession (Score: 44-67)
Zach Fox attempts a 3Pt. Contested by CJ Barrett (5.3 feet, ZONE). Zach Fox misses. Rebound secured by Miles Bane.

[07:25] Team_002 possession (Score: 44-67)
Carmelo Lowry drives, picks up Anfernee Williamson. Help arrives from Zach Fox! Carmelo Lowry attempts a Layup. Contested by Zach Fox (5.0 feet, MAN). CARMELO LOWRY MAKES IT! Assist: Jordan Green
Score: 46-67

[07:13] Team_024 possession (Score: 46-67)
Zach Fox attempts a 3Pt. Wide open! CJ Barrett is 6.7 feet away. [ZONE] Zach Fox misses. Rebound secured by Tyler Porzingis.

[07:01] Team_002 possession (Score: 46-67)
CJ Barrett drives to the basket... CJ Barrett commits a violation (traveling/carry)! TURNOVER! (dead ball)

[06:51] Team_024 possession (Score: 46-67)
Ja Reaves attempts a Layup. BLOCKED BY MILES BANE! Ball is loose! Rebound secured by Miles Bane.

[06:37] Team_002 possession (Score: 46-67)
Carmelo Lowry attempts a Layup. Wide open! Anfernee Williamson is 6.5 feet away. [MAN] CARMELO LOWRY MAKES IT! Assist: Tyler Porzingis
Score: 48-67

[06:26] Team_024 possession (Score: 48-67)
Bradley Allen attempts a Layup. Heavily contested by Tyler Porzingis (0.7 feet, ZONE)! Bradley Allen misses. Rebound secured by Tyler Porzingis.

[06:09] Team_002 possession (Score: 48-67)
Tyler Porzingis loses control! Ball rolls out of bounds! TURNOVER! (dead ball)

[05:51] Team_024 possession (Score: 48-67)
FOUL! Reach-in foul on Tyler Porzingis during the drive. [Team fouls: 2] No free throws, side out. (Tyler Porzingis: 1 personal fouls)

[05:37] Team_024 possession (Score: 48-67)
Ja Reaves attempts a Midrange. Contested by Miles Bane (4.9 feet, MAN). Ja Reaves misses. Offensive rebound by Zach Fox! Zach Fox kicks it out.

[05:19] Team_024 possession (Score: 48-67)
Draymond Towns drives and kicks out. Zach Fox attempts a Midrange. Contested by CJ Barrett (3.0 feet, MAN). Zach Fox misses. Offensive rebound by Zach Fox! Zach Fox kicks it out.

[05:02] Team_024 possession (Score: 48-67)
FOUL! Reach-in foul on Tyler Porzingis during the drive. [Team fouls: 3] No free throws, side out. (Tyler Porzingis: 2 personal fouls)

[04:48] Team_024 possession (Score: 48-67)
Anfernee Williamson drives and kicks out. Ja Reaves attempts a 3Pt. Contested by CJ Barrett (4.3 feet, ZONE). JA REAVES MAKES IT! Assist: Bradley Allen
Score: 48-70

[04:36] Team_002 possession (Score: 48-70)
Jordan Green attempts a 3Pt. Contested by Bradley Allen (3.6 feet, MAN). JORDAN GREEN MAKES IT! Assist: Miles Bane
Score: 51-70

[04:26] Team_024 possession (Score: 51-70)
Zach Fox drives and kicks out. Ja Reaves attempts a Midrange. Heavily contested by Carmelo Lowry (0.9 feet, ZONE)! Ja Reaves misses. Rebound secured by Tyler Porzingis.

[04:11] Team_002 possession (Score: 51-70)
Tyler Porzingis loses the ball! Stripped by Anfernee Williamson! TURNOVER! (live ball)

[03:55] Team_024 possession (Score: 51-70)
Zach Fox attempts a 3Pt. Wide open! CJ Barrett is 6.0 feet away. [MAN] ZACH FOX MAKES IT! Assist: Draymond Towns
Score: 51-73

[03:38] Team_002 possession (Score: 51-73)
FOUL! Holding foul on Bradley Allen. [Team fouls: 2] No free throws, side out. (Bradley Allen: 1 personal fouls)

[03:25] Team_002 possession (Score: 51-73)
FOUL! Shooting foul on Bradley Allen. Jordan Green to the line for 2 free throws. [Team fouls: 3] (Bradley Allen: 2 personal fouls)   FT 1/2: MISS   FT 2/2: GOOD Jordan Green makes 1/2 from the line.
Score: 52-73

[03:14] Team_024 possession (Score: 52-73)
Draymond Towns attempts a 3Pt. Heavily contested by CJ Barrett (1.8 feet, ZONE)! Draymond Towns misses. Rebound secured by Carmelo Lowry.

[02:58] Team_002 possession (Score: 52-73)
Tyler Porzingis drives to the basket... Tyler Porzingis throws a bad pass out of bounds! TURNOVER! (dead ball)

[02:58] Substitution (Team_002): Carmelo Lowry OUT → Julius Curry IN (stamina_rule2)

[02:58] Substitution (Team_002): Tyler Porzingis OUT → Lamelo O'Neal IN (stamina_rule2)

[02:44] Team_024 possession (Score: 52-73)
Anfernee Williamson attempts a Layup. Contested by Lamelo O'Neal (3.9 feet, ZONE). Anfernee Williamson misses. Rebound secured by Miles Bane.

[02:30] Team_002 possession (Score: 52-73)
FOUL! Reach-in foul on Anfernee Williamson during the drive. [Team fouls: 4] No free throws, side out. (Anfernee Williamson: 2 personal fouls)

[02:16] Team_002 possession (Score: 52-73)
Miles Bane attempts a 3Pt. Contested by Ja Reaves (4.5 feet, MAN). Miles Bane misses. Rebound secured by Zach Fox.

[02:05] Team_024 possession (Score: 52-73)
Zach Fox drives to the basket... Zach Fox throws a bad pass! Stolen by CJ Barrett! TURNOVER! (live ball)

[01:50] Team_002 possession (Score: 52-73)
Jordan Green attempts a 3Pt. Contested by Zach Fox (5.1 feet, ZONE). Jordan Green misses. Rebound secured by Anfernee Williamson.

[01:33] Team_024 possession (Score: 52-73)
Anfernee Williamson drives, Lamelo O'Neal stays with him. Anfernee Williamson attempts a Layup. Contested by Lamelo O'Neal (4.8 feet, ZONE). ANFERNEE WILLIAMSON MAKES IT!
Score: 52-75

[01:22] Team_002 possession (Score: 52-75)
Lamelo O'Neal drives to the basket... Lamelo O'Neal commits a violation (traveling/carry)! TURNOVER! (dead ball)

[01:22] Substitution (Team_002): Miles Bane OUT → John Duncan IN (stamina_rule2)

[01:22] Substitution (Team_002): CJ Barrett OUT → Dirk Middleton IN (stamina_rule2)

[01:22] Substitution (Team_002): Jordan Green OUT → Anfernee Sexton IN (stamina_rule2)

[01:22] Substitution (Team_024): Ja Reaves OUT → Victor Simons IN (stamina_rule2)

[01:22] Substitution (Team_024): Zach Fox OUT → Vince Irving IN (stamina_rule2)

[01:22] Substitution (Team_024): Bradley Allen OUT → Zach Durant IN (stamina_rule2)

[01:22] Substitution (Team_024): Anfernee Williamson OUT → Julius Harris IN (stamina_rule2)

[01:22] Substitution (Team_024): Draymond Towns OUT → Terry Rozier IN (stamina_rule2)

[01:13] Team_024 possession (Score: 52-75)
Vince Irving throws a bad pass! Stolen by Dirk Middleton! TURNOVER! (live ball)

[00:57] Team_002 possession (Score: 52-75)
Lamelo O'Neal attempts a Layup. Heavily contested by Terry Rozier (1.3 feet, MAN)! LAMELO O'NEAL MAKES IT! Assist: Dirk Middleton
Score: 54-75

[00:43] Team_024 possession (Score: 54-75)
FOUL! Shooting foul on Julius Curry. Zach Durant to the line for 3 free throws. [Team fouls: 4] (Julius Curry: 1 personal fouls)   FT 1/3: GOOD   FT 2/3: GOOD   FT 3/3: MISS Zach Durant makes 2/3 from the line. Rebound secured by Anfernee Sexton.
Score: 54-77

[00:23] Team_002 possession (Score: 54-77)
Julius Curry drives, Julius Harris stays with him. Julius Curry attempts a Layup. Wide open! Julius Harris is 6.8 feet away. [MAN] JULIUS CURRY MAKES IT! Assist: Anfernee Sexton
Score: 56-77

[00:12] Team_024 possession (Score: 56-77)
FOUL! Reach-in foul on Lamelo O'Neal during the drive. [IN THE BONUS! 5 team fouls] Vince Irving to the line for 2 free throws. (Lamelo O'Neal: 1 personal fouls)   FT 1/2: GOOD   FT 2/2: GOOD Vince Irving makes 2/2 from the line.
Score: 56-79

================================================================================
                              3RD QUARTER COMPLETE                              
================================================================================

3RD QUARTER SCORE: Team_002 16, Team_024 16

BOX SCORE:
================================================================================

Team_002
--------------------------------------------------------------------------------
Player                MIN  PTS  REB  AST  TO      FG   FG%      3P   3P%
--------------------------------------------------------------------------------
Carmelo Lowry          31    4    4    0   0   2/5    40.0     0/0   0.0
Tyler Porzingis        31    4    4    1   0   1/1   100.0     0/0   0.0
Jordan Green           32    4    0    1   0   2/3    66.7     0/0   0.0
Lamelo O'Neal           6    2    0    0   0   1/1   100.0     0/0   0.0
Julius Curry            6    2    0    0   0   1/1   100.0     0/0   0.0
CJ Barrett             32    0    0    0   0   0/4     0.0     0/0   0.0
Miles Bane             32    0    5    1   0   0/1     0.0     0/0   0.0
Dirk Middleton          4    0    0    1   0   0/0     0.0     0/0   0.0
Anfernee Sexton         4    0    1    1   0   0/0     0.0     0/0   0.0

TEAM: FG: 7/16 (43.8%), 3PT: 2/7 (28.6%), REB: 13 (0 off, 13 def), AST: 5, TO: 6
TEAM FOULS: 5 [Team_024 in BONUS]


Team_024
--------------------------------------------------------------------------------
Player                MIN  PTS  REB  AST  TO      FG   FG%      3P   3P%
--------------------------------------------------------------------------------
Zach Fox               32    5    4    0   0   2/6    33.3     0/0   0.0
Ja Reaves              32    3    0    1   0   1/5    20.0     0/0   0.0
Bradley Allen          32    2    0    1   0   1/3    33.3     0/0   0.0
Anfernee Williamson    32    2    4    0   0   1/2    50.0     0/0   0.0
Vince Irving            4    2    0    0   0   1/1   100.0     0/0   0.0
Draymond Towns         32    0    3    1   0   0/2     0.0     0/0   0.0
Zach Durant             4    0    0    0   0   0/1     0.0     0/0   0.0

TEAM: FG: 6/20 (30.0%), 3PT: 1/8 (12.5%), REB: 12 (3 off, 9 def), AST: 3, TO: 2
TEAM FOULS: 4

================================================================================

================================================================================
                       4TH QUARTER - Team_002 vs Team_024                       
================================================================================

[12:00] Substitution (Team_002): Miles Bane OUT (stamina: 76) → John Duncan IN (comeback_detected)

[12:00] Substitution (Team_024): Ja Reaves OUT (stamina: 75) → Victor Simons IN (comeback_detected)

[12:00] Team_002 possession (Score: 56-79)
Tyler Porzingis attempts a 3Pt. Heavily contested by Draymond Towns (0.5 feet, MAN)! Tyler Porzingis misses. Rebound secured by Zach Fox.

[11:46] Team_024 possession (Score: 56-79)
Zach Fox attempts a 3Pt. Contested by John Duncan (4.5 feet, ZONE). Zach Fox misses. Rebound secured by Tyler Porzingis.

[11:32] Team_002 possession (Score: 56-79)
Tyler Porzingis drives to the basket... Tyler Porzingis throws a bad pass out of bounds! TURNOVER! (dead ball)

[11:14] Team_024 possession (Score: 56-79)
Victor Simons attempts a 3Pt. Contested by CJ Barrett (3.3 feet, ZONE). Victor Simons misses. Rebound secured by CJ Barrett.

[11:00] Team_002 possession (Score: 56-79)
FOUL! Holding foul on Victor Simons. [Team fouls: 1] No free throws, side out. (Victor Simons: 1 personal fouls)

[10:44] Team_002 possession (Score: 56-79)
FOUL! Shooting foul on Bradley Allen. Jordan Green to the line for 2 free throws. [Team fouls: 2] (Bradley Allen: 1 personal fouls)   FT 1/2: GOOD   FT 2/2: GOOD Jordan Green makes 2/2 from the line.
Score: 58-79

[10:30] Team_024 possession (Score: 58-79)
Victor Simons makes the Layup and draws the foul on Tyler Porzingis! And-1! Victor Simons to the line for 1. [Team fouls: 1] (Tyler Porzingis: 1 personal fouls)   FT 1/1: GOOD Victor Simons makes 1/1 from the line.
Score: 58-82

[10:14] Team_002 possession (Score: 58-82)
CJ Barrett attempts a 3Pt. Contested by Victor Simons (4.9 feet, ZONE). CJ Barrett misses. Rebound secured by Zach Fox.

[10:01] Team_024 possession (Score: 58-82)
Draymond Towns drives, Tyler Porzingis stays with him. Draymond Towns attempts a Layup. Contested by Tyler Porzingis (4.0 feet, ZONE). DRAYMOND TOWNS MAKES IT! Assist: Victor Simons
Score: 58-84

[09:48] Team_002 possession (Score: 58-84)
FOUL! Reach-in foul on Anfernee Williamson during the drive. [Team fouls: 3] No free throws, side out. (Anfernee Williamson: 1 personal fouls)

[09:35] Team_002 possession (Score: 58-84)
Tyler Porzingis drives, picks up Anfernee Williamson. Help arrives from Zach Fox! Tyler Porzingis attempts a Layup. Contested by Zach Fox (2.3 feet, ZONE). TYLER PORZINGIS MAKES IT! Assist: Jordan Green
Score: 60-84

[09:22] Team_024 possession (Score: 60-84)
Bradley Allen attempts a Midrange. Wide open! Jordan Green is 9.5 feet away. [MAN] Bradley Allen misses. Rebound secured by Tyler Porzingis.

[09:08] Team_002 possession (Score: 60-84)
CJ Barrett drives and kicks out. John Duncan attempts a 3Pt. Contested by Victor Simons (5.3 feet, MAN). John Duncan misses. FOUL! Loose ball foul on Zach Fox during the rebound battle. [Team fouls: 4] No free throws, side out. (Zach Fox: 1 personal fouls)

[08:54] Team_002 possession (Score: 60-84)
John Duncan attempts a 3Pt. Contested by Victor Simons (4.5 feet, ZONE). JOHN DUNCAN MAKES IT! Assist: Carmelo Lowry
Score: 63-84

[08:37] Team_024 possession (Score: 63-84)
Zach Fox drives and kicks out. Bradley Allen attempts a Midrange. Wide open! Tyler Porzingis is 8.3 feet away. [ZONE] BRADLEY ALLEN MAKES IT!
Score: 63-86

[08:23] Team_002 possession (Score: 63-86)
Carmelo Lowry attempts a Midrange. Contested by Draymond Towns (3.5 feet, ZONE). Carmelo Lowry misses. Rebound secured by Anfernee Williamson.

[08:07] Team_024 possession (Score: 63-86)
Bradley Allen attempts a 3Pt. Contested by Jordan Green (4.3 feet, MAN). Bradley Allen misses. FOUL! Loose ball foul on Carmelo Lowry during the rebound battle. [Team fouls: 2] No free throws, side out. (Carmelo Lowry: 1 personal fouls)

[07:58] Team_024 possession (Score: 63-86)
Bradley Allen attempts a 3Pt. Contested by Jordan Green (4.5 feet, MAN). Bradley Allen misses. Rebound secured by Tyler Porzingis.

[07:39] Team_002 possession (Score: 63-86)
John Duncan attempts a Midrange. Contested by Victor Simons (2.7 feet, MAN). JOHN DUNCAN MAKES IT!
Score: 65-86

[07:26] Team_024 possession (Score: 65-86)
Zach Fox makes the Layup and draws the foul on Tyler Porzingis! And-1! Zach Fox to the line for 1. [Team fouls: 3] (Tyler Porzingis: 2 personal fouls)   FT 1/1: GOOD Zach Fox makes 1/1 from the line.
Score: 65-89

[07:08] Team_002 possession (Score: 65-89)
Jordan Green attempts a 3Pt. Contested by Bradley Allen (5.9 feet, MAN). Jordan Green misses. Offensive rebound by Carmelo Lowry! Carmelo Lowry kicks it out.

[06:57] Team_002 possession (Score: 65-89)
Jordan Green drives to the basket... FOUL! Offensive foul on Jordan Green! Anfernee Williamson drew the charge! [Team fouls: 4] (Jordan Green: 1 personal fouls) TURNOVER! (dead ball)

[06:44] Team_024 possession (Score: 65-89)
Bradley Allen attempts a Midrange. Contested by Tyler Porzingis (5.1 feet, ZONE). BRADLEY ALLEN MAKES IT!
Score: 65-91

[06:29] Team_002 possession (Score: 65-91)
Tyler Porzingis attempts a Layup. Contested by Draymond Towns (4.0 feet, ZONE). Tyler Porzingis misses. Rebound secured by Draymond Towns.

[06:15] Team_024 possession (Score: 65-91)
Bradley Allen attempts a Layup. BLOCKED BY TYLER PORZINGIS! Ball is loose! Rebound secured by Tyler Porzingis.

[06:01] Team_002 possession (Score: 65-91)
Jordan Green attempts a 3Pt. Contested by Victor Simons (4.6 feet, ZONE). Jordan Green misses. Rebound secured by Zach Fox.

[05:48] Team_024 possession (Score: 65-91)
Draymond Towns drives and kicks out. FOUL! Shooting foul on Jordan Green. Bradley Allen to the line for 3 free throws. [BONUS: 5 team fouls] (Jordan Green: 2 personal fouls)   FT 1/3: GOOD   FT 2/3: GOOD   FT 3/3: GOOD Bradley Allen makes 3/3 from the line.
Score: 65-94

[05:34] Team_002 possession (Score: 65-94)
CJ Barrett attempts a Layup. Wide open! Draymond Towns is 7.7 feet away. [ZONE] CJ Barrett misses. Rebound secured by Zach Fox.

[05:18] Team_024 possession (Score: 65-94)
Victor Simons attempts a Midrange. Wide open! John Duncan is 7.1 feet away. [MAN] Victor Simons misses. Rebound secured by Carmelo Lowry.

[05:00] Team_002 possession (Score: 65-94)
Carmelo Lowry attempts a Midrange. Wide open! Zach Fox is 6.7 feet away. [ZONE] Carmelo Lowry misses. Rebound secured by Zach Fox.

[04:44] Team_024 possession (Score: 65-94)
Zach Fox attempts a Midrange. Contested by CJ Barrett (4.8 feet, MAN). Zach Fox misses. Rebound secured by CJ Barrett.

[04:32] Team_002 possession (Score: 65-94)
Carmelo Lowry attempts a 3Pt. Contested by Anfernee Williamson (4.1 feet, MAN). Carmelo Lowry misses. Rebound secured by Draymond Towns.

[04:17] Team_024 possession (Score: 65-94)
Zach Fox attempts a 3Pt. Contested by CJ Barrett (2.1 feet, MAN). ZACH FOX MAKES IT!
Score: 65-97

[04:03] Team_002 possession (Score: 65-97)
John Duncan attempts a Midrange. Heavily contested by Victor Simons (1.8 feet, ZONE)! John Duncan misses. Offensive rebound by Tyler Porzingis! Tyler Porzingis puts it back in!
Score: 67-97

[03:49] Team_024 possession (Score: 67-97)
Bradley Allen drives, Tyler Porzingis stays with him. Bradley Allen attempts a Dunk. Contested by Tyler Porzingis (4.9 feet, ZONE). Bradley Allen misses. Rebound secured by Tyler Porzingis.

[03:30] Team_002 possession (Score: 67-97)
Jordan Green attempts a 3Pt. Wide open! Bradley Allen is 6.6 feet away. [MAN] Jordan Green misses. Rebound secured by Anfernee Williamson.

[03:19] Team_024 possession (Score: 67-97)
Zach Fox attempts a 3Pt. Wide open! CJ Barrett is 6.6 feet away. [MAN] ZACH FOX MAKES IT! Assist: Bradley Allen
Score: 67-100

[03:03] Team_002 possession (Score: 67-100)
Tyler Porzingis drives to the basket... FOUL! Offensive foul on Tyler Porzingis! Draymond Towns drew the charge! [Team fouls: 6] (Tyler Porzingis: 3 personal fouls) TURNOVER! (dead ball)

[02:48] Team_024 possession (Score: 67-100)
Anfernee Williamson attempts a 3Pt. Contested by CJ Barrett (4.8 feet, ZONE). ANFERNEE WILLIAMSON MAKES IT! Assist: Bradley Allen
Score: 67-103

[02:34] Team_002 possession (Score: 67-103)
Tyler Porzingis attempts a Midrange. Contested by Draymond Towns (5.0 feet, ZONE). TYLER PORZINGIS MAKES IT!
Score: 69-103

[02:19] Team_024 possession (Score: 69-103)
Bradley Allen attempts a Midrange. Wide open! Jordan Green is 7.6 feet away. [MAN] Bradley Allen misses. Rebound secured by CJ Barrett.

[02:06] Team_002 possession (Score: 69-103)
John Duncan attempts a 3Pt. Contested by Victor Simons (3.3 feet, ZONE). John Duncan misses. Rebound secured by Zach Fox.

[01:50] Team_024 possession (Score: 69-103)
Anfernee Williamson makes the Midrange and draws the foul on Carmelo Lowry! And-1! Anfernee Williamson to the line for 1. [BONUS: 7 team fouls] (Carmelo Lowry: 2 personal fouls)   FT 1/1: GOOD Anfernee Williamson makes 1/1 from the line.
Score: 69-106

[01:37] Team_002 possession (Score: 69-106)
FOUL! Reach-in foul on Zach Fox during the drive. [IN THE BONUS! 5 team fouls] CJ Barrett to the line for 2 free throws. (Zach Fox: 2 personal fouls)   FT 1/2: GOOD   FT 2/2: GOOD CJ Barrett makes 2/2 from the line.
Score: 71-106

[01:20] Team_024 possession (Score: 71-106)
Zach Fox attempts a 3Pt. Wide open! CJ Barrett is 7.1 feet away. [MAN] ZACH FOX MAKES IT! Assist: Bradley Allen
Score: 71-109

[01:03] Team_002 possession (Score: 71-109)
CJ Barrett throws a bad pass! Stolen by Zach Fox! TURNOVER! (live ball)

[00:47] Team_024 possession (Score: 71-109)
Bradley Allen attempts a 3Pt. Wide open! John Duncan is 7.6 feet away. [ZONE] Bradley Allen misses. Rebound secured by CJ Barrett.

[00:32] Team_002 possession (Score: 71-109)
Jordan Green attempts a Midrange. Wide open! Bradley Allen is 7.1 feet away. [ZONE] JORDAN GREEN MAKES IT!
Score: 73-109

[00:15] Team_024 possession (Score: 73-109)
FOUL! Shooting foul on John Duncan. Victor Simons to the line for 2 free throws. [BONUS: 8 team fouls] (John Duncan: 1 personal fouls)   FT 1/2: GOOD   FT 2/2: GOOD Victor Simons makes 2/2 from the line.
Score: 73-111

================================================================================
                              4TH QUARTER COMPLETE                              
================================================================================

4TH QUARTER SCORE: Team_002 17, Team_024 32

BOX SCORE:
================================================================================

Team_002
--------------------------------------------------------------------------------
Player                MIN  PTS  REB  AST  TO      FG   FG%      3P   3P%
--------------------------------------------------------------------------------
Tyler Porzingis        43    6    7    0   0   3/5    60.0     0/0   0.0
John Duncan            16    5    0    0   0   2/3    66.7     0/0   0.0
Jordan Green           44    4    0    1   0   2/4    50.0     0/0   0.0
CJ Barrett             44    2    4    0   0   1/3    33.3     0/0   0.0
Carmelo Lowry          43    0    2    1   0   0/3     0.0     0/0   0.0

TEAM: FG: 8/18 (44.4%), 3PT: 1/7 (14.3%), REB: 13 (3 off, 10 def), AST: 2, TO: 4
TEAM FOULS: 8 [Team_024 in BONUS]


Team_024
--------------------------------------------------------------------------------
Player                MIN  PTS  REB  AST  TO      FG   FG%      3P   3P%
--------------------------------------------------------------------------------
Zach Fox               44   12    7    0   0   4/6    66.7     0/0   0.0
Bradley Allen          44    7    0    3   0   3/9    33.3     0/0   0.0
Anfernee Williamson    44    6    2    0   0   2/2   100.0     0/0   0.0
Victor Simons          16    5    0    1   0   2/4    50.0     0/0   0.0
Draymond Towns         44    2    2    0   0   1/1   100.0     0/0   0.0

TEAM: FG: 12/22 (54.5%), 3PT: 4/8 (50.0%), REB: 11 (1 off, 10 def), AST: 4, TO: 0
TEAM FOULS: 5 [Team_002 in BONUS]

================================================================================

================================================================================
                               FULL GAME COMPLETE                               
================================================================================

FINAL SCORE: Team_002 73, Team_024 111

SCORING BY QUARTER:
--------------------------------------------------------------------------------
Team                     Q1     Q2     Q3     Q4    FINAL
--------------------------------------------------------------------------------
Team_002                 12     28     16     17       73
Team_024                 36     27     16     32      111
--------------------------------------------------------------------------------

FULL GAME BOX SCORE:
================================================================================

Team_002
--------------------------------------------------------------------------------
Player                MIN  PTS  REB  AST  TO      FG   FG%      3P   3P%      FT STL BLK
--------------------------------------------------------------------------------
CJ Barrett             44    4    4    2   4   2/12   16.7   0/4     0.0   2/2     1   0
Jordan Green           44   21    0    4   2  10/16   62.5   2/7    28.6   3/4     0   1
Carmelo Lowry          43    4   12    3   2   3/11   27.3   0/3     0.0   0/0     0   0
Tyler Porzingis        43   24   15    3   4   8/14   57.1   1/3    33.3   5/5     2   1
Miles Bane             32    5   10    2   2   2/9    22.2   1/4    25.0   0/0     1   1
John Duncan            16    5    0    1   2   3/4    75.0   1/2    50.0   0/0     0   0
Julius Curry            6    5    1    0   0   2/2   100.0   1/1   100.0   0/0     0   0
Lamelo O'Neal           6    2    1    1   0   1/1   100.0   0/0     0.0   0/0     1   0
Dirk Middleton          4    0    0    1   0   0/0     0.0   0/0     0.0   0/0     1   0
Anfernee Sexton         4    3    1    1   0   1/3    33.3   1/2    50.0   0/0     0   0

TEAM: FG: 32/72 (44.4%), 3PT: 7/26 (26.9%), REB: 44 (7 off, 37 def), AST: 18, TO: 16


Team_024
--------------------------------------------------------------------------------
Player                MIN  PTS  REB  AST  TO      FG   FG%      3P   3P%      FT STL BLK
--------------------------------------------------------------------------------
Zach Fox               44   27   21    2   0  10/17   58.8   4/9    44.4   5/5     2   0
Bradley Allen          44   20    0    5   0   6/17   35.3   3/7    42.9   3/3     0   0
Anfernee Williamson    44   25   15    4   1   9/12   75.0   4/5    80.0   6/6     1   0
Draymond Towns         44   14   10    3   2   9/14   64.3   0/2     0.0   4/4     0   0
Ja Reaves              32    8    0    2   1   3/10   30.0   1/3    33.3   3/4     0   0
Victor Simons          16    5    0    1   0   3/6    50.0   0/1     0.0   3/3     0   0
Vince Irving            4    4    0    0   1   1/1   100.0   0/0     0.0   4/4     0   0
Zach Durant             4    3    1    0   0   1/2    50.0   1/2    50.0   2/3     0   0
Julius Harris           4    2    0    0   1   0/0     0.0   0/0     0.0   2/2     0   0
Terry Rozier            4    0    1    1   0   0/1     0.0   0/0     0.0   0/0     0   0

TEAM: FG: 44/82 (53.7%), 3PT: 13/29 (44.8%), REB: 48 (9 off, 39 def), AST: 18, TO: 6

================================================================================
