================================================================================
                        FULL GAME - Team_061 vs Team_095                        
================================================================================

================================================================================
                       1ST QUARTER - Team_061 vs Team_095                       
================================================================================

[12:00] Team_061 possession (Score: 0-0)
Jayson Holiday attempts a 3Pt. Contested by Evan Carter (3.3 feet, ZONE). Jayson Holiday misses. Rebound secured by Evan Carter.

[11:44] Team_095 possession (Score: 0-0)
Immanuel Middleton throws a bad pass out of bounds! TURNOVER! (dead ball)

[11:30] Team_061 possession (Score: 0-0)
Draymond Banchero drives, picks up Immanuel Middleton. Help arrives from Dejounte Hyland! Draymond Banchero attempts a Layup. Contested by Dejounte Hyland (4.9 feet, ZONE). DRAYMOND BANCHERO MAKES IT!
Score: 2-0

[11:16] Team_095 possession (Score: 2-0)
Evan Carter makes the Layup and draws the foul on Jayson Holiday! And-1! Evan Carter to the line for 1. [Team fouls: 1] (Jayson Holiday: 1 personal fouls)   FT 1/1: MISS Evan Carter makes 0/1 from the line. Rebound secured by Bam Sexton.
Score: 2-2

[11:00] Team_061 possession (Score: 2-2)
Draymond Banchero attempts a Midrange. Wide open! Evan Carter is 6.1 feet away. [ZONE] DRAYMOND BANCHERO MAKES IT!
Score: 4-2

[10:43] Team_095 possession (Score: 4-2)
Shaquille Ball attempts a 3Pt. Contested by Jayson Holiday (3.0 feet, MAN). Shaquille Ball misses. Rebound secured by Bam Sexton.

[10:30] Team_061 possession (Score: 4-2)
Bam Sexton attempts a Layup. Wide open! Immanuel Middleton is 6.1 feet away. [ZONE] BAM SEXTON MAKES IT! Assist: Michael Russell
Score: 6-2

[10:16] Team_095 possession (Score: 6-2)
FOUL! Shooting foul on Draymond Banchero. Dejounte Hyland to the line for 2 free throws. [Team fouls: 2] (Draymond Banchero: 1 personal fouls)   FT 1/2: GOOD   FT 2/2: GOOD Dejounte Hyland makes 2/2 from the line.
Score: 6-4

[09:59] Team_061 possession (Score: 6-4)
Michael Russell attempts a 3Pt. Heavily contested by Evan Carter (1.4 feet, MAN)! Michael Russell misses. Offensive rebound by Draymond Banchero! Draymond Banchero puts it back in!
Score: 8-4

[09:41] Team_095 possession (Score: 8-4)
Kyrie Ming drives to the basket... Kyrie Ming throws a bad pass out of bounds! TURNOVER! (dead ball)

[09:24] Team_061 possession (Score: 8-4)
Jayson Holiday attempts a Midrange. Contested by Shaquille Ball (5.1 feet, MAN). Jayson Holiday misses. Rebound secured by Shaquille Ball.

[09:12] Team_095 possession (Score: 8-4)
Dejounte Hyland attempts a Midrange. Contested by Jayson Holiday (2.4 feet, ZONE). Dejounte Hyland misses. Rebound secured by Michael Russell.

[09:02] Team_061 possession (Score: 8-4)
FOUL! Shooting foul on Kyrie Ming. Draymond Banchero to the line for 2 free throws. [Team fouls: 1] (Kyrie Ming: 1 personal fouls)   FT 1/2: GOOD   FT 2/2: GOOD Draymond Banchero makes 2/2 from the line.
Score: 10-4

[08:52] Team_095 possession (Score: 10-4)
Dejounte Hyland attempts a 3Pt. Contested by Brandon Russell (3.2 feet, ZONE). DEJOUNTE HYLAND MAKES IT! Assist: Evan Carter
Score: 10-7

[08:37] Team_061 possession (Score: 10-7)
Jayson Holiday makes the Layup and draws the foul on Shaquille Ball! And-1! Jayson Holiday to the line for 1. [Team fouls: 2] (Shaquille Ball: 1 personal fouls)   FT 1/1: MISS Jayson Holiday makes 0/1 from the line. Rebound secured by Dejounte Hyland.
Score: 12-7

[08:23] Team_095 possession (Score: 12-7)
Shaquille Ball throws a bad pass out of bounds! TURNOVER! (dead ball)

[08:06] Team_061 possession (Score: 12-7)
Jayson Holiday makes the Dunk and draws the foul on Dejounte Hyland! And-1! Jayson Holiday to the line for 1. [Team fouls: 3] (Dejounte Hyland: 1 personal fouls)   FT 1/1: GOOD Jayson Holiday makes 1/1 from the line.
Score: 15-7

[07:51] Team_095 possession (Score: 15-7)
FOUL! Shooting foul on Michael Russell. Dejounte Hyland to the line for 2 free throws. [Team fouls: 3] (Michael Russell: 1 personal fouls)   FT 1/2: GOOD   FT 2/2: GOOD Dejounte Hyland makes 2/2 from the line.
Score: 15-9

[07:38] Team_061 possession (Score: 15-9)
Brandon Russell drives to the basket... Brandon Russell commits a violation (traveling/carry)! TURNOVER! (dead ball)

[07:25] Team_095 possession (Score: 15-9)
Dejounte Hyland attempts a 3Pt. Heavily contested by Brandon Russell (1.4 feet, MAN)! Dejounte Hyland misses. Rebound secured by Draymond Banchero.

[07:10] Team_061 possession (Score: 15-9)
Jayson Holiday attempts a 3Pt. Contested by Evan Carter (5.6 feet, ZONE). Jayson Holiday misses. Rebound secured by Dejounte Hyland.

[06:54] Team_095 possession (Score: 15-9)
Kyrie Ming drives to the basket... Kyrie Ming throws a bad pass out of bounds! TURNOVER! (dead ball)

[06:39] Team_061 possession (Score: 15-9)
Draymond Banchero attempts a Midrange. Wide open! Shaquille Ball is 6.8 feet away. [ZONE] DRAYMOND BANCHERO MAKES IT!
Score: 17-9

[06:24] Team_095 possession (Score: 17-9)
Immanuel Middleton attempts a Layup. Contested by Bam Sexton (4.9 feet, MAN). IMMANUEL MIDDLETON MAKES IT! Assist: Evan Carter
Score: 17-11

[06:12] Team_061 possession (Score: 17-11)
Michael Russell drives, Evan Carter stays with him. Michael Russell attempts a Dunk. Contested by Evan Carter (4.5 feet, MAN). MICHAEL RUSSELL MAKES IT! Assist: Bam Sexton
Score: 19-11

[06:00] Team_095 possession (Score: 19-11)
Evan Carter makes the Layup and draws the foul on Michael Russell! And-1! Evan Carter to the line for 1. [Team fouls: 4] (Michael Russell: 2 personal fouls)   FT 1/1: GOOD Evan Carter makes 1/1 from the line.
Score: 19-14

[05:47] Team_061 possession (Score: 19-14)
Brandon Russell attempts a 3Pt. Contested by Evan Carter (2.2 feet, ZONE). BRANDON RUSSELL MAKES IT! Assist: Draymond Banchero
Score: 22-14

[05:32] Team_095 possession (Score: 22-14)
Kyrie Ming drives and kicks out. Immanuel Middleton attempts a 3Pt. Contested by Bam Sexton (5.6 feet, MAN). Immanuel Middleton misses. Rebound secured by Michael Russell.

[05:23] Team_061 possession (Score: 22-14)
Bam Sexton attempts a 3Pt. Contested by Immanuel Middleton (2.5 feet, MAN). BAM SEXTON MAKES IT! Assist: Michael Russell
Score: 25-14

[05:05] Team_095 possession (Score: 25-14)
Shaquille Ball attempts a Midrange. Contested by Michael Russell (4.2 feet, ZONE). Shaquille Ball misses. Rebound secured by Michael Russell.

[04:49] Team_061 possession (Score: 25-14)
Michael Russell attempts a 3Pt. Contested by Evan Carter (4.5 feet, ZONE). MICHAEL RUSSELL MAKES IT!
Score: 28-14

[04:34] Team_095 possession (Score: 28-14)
Evan Carter drives, Michael Russell stays with him. Evan Carter attempts a Dunk. Wide open! Michael Russell is 9.7 feet away. [MAN] EVAN CARTER MAKES IT! Assist: Immanuel Middleton
Score: 28-16

[04:20] Team_061 possession (Score: 28-16)
Jayson Holiday attempts a Midrange. Contested by Shaquille Ball (4.7 feet, ZONE). JAYSON HOLIDAY MAKES IT! Assist: Michael Russell
Score: 30-16

[04:03] Team_095 possession (Score: 30-16)
Immanuel Middleton attempts a 3Pt. Contested by Brandon Russell (5.0 feet, ZONE). Immanuel Middleton misses. Rebound secured by Draymond Banchero.

[03:47] Team_061 possession (Score: 30-16)
FOUL! Holding foul on Shaquille Ball. [Team fouls: 4] No free throws, side out. (Shaquille Ball: 2 personal fouls)

[03:35] Team_061 possession (Score: 30-16)
Brandon Russell attempts a Layup. BLOCKED BY IMMANUEL MIDDLETON! Ball deflects out of bounds off Brandon Russell.

[03:19] Team_095 possession (Score: 30-16)
Immanuel Middleton attempts a Midrange. Wide open! Michael Russell is 6.8 feet away. [ZONE] Immanuel Middleton misses. Offensive rebound by Dejounte Hyland! Dejounte Hyland kicks it out.

[03:04] Team_095 possession (Score: 30-16)
Evan Carter attempts a 3Pt. Contested by Michael Russell (2.5 feet, MAN). Evan Carter misses. Offensive rebound by Evan Carter! Evan Carter puts it back in!
Score: 30-18

[02:50] Team_061 possession (Score: 30-18)
Brandon Russell drives, Dejounte Hyland stays with him. Brandon Russell attempts a Layup. Contested by Dejounte Hyland (3.8 feet, MAN). BRANDON RUSSELL MAKES IT! Assist: Bam Sexton
Score: 32-18

[02:38] Team_095 possession (Score: 32-18)
Evan Carter attempts a 3Pt. Contested by Michael Russell (4.8 feet, ZONE). Evan Carter misses. Rebound secured by Michael Russell.

[02:24] Team_061 possession (Score: 32-18)
Jayson Holiday attempts a Midrange. Contested by Evan Carter (4.4 feet, ZONE). JAYSON HOLIDAY MAKES IT!
Score: 34-18

[02:13] Team_095 possession (Score: 34-18)
Kyrie Ming attempts a Layup. BLOCKED BY DRAYMOND BANCHERO! Ball is loose! Rebound secured by Draymond Banchero.

[02:00] Team_061 possession (Score: 34-18)
Jayson Holiday attempts a Midrange. Wide open! Shaquille Ball is 8.3 feet away. [MAN] Jayson Holiday misses. Rebound secured by Evan Carter.

[01:43] Team_095 possession (Score: 34-18)
Kyrie Ming attempts a Midrange. Contested by Bam Sexton (3.5 feet, ZONE). KYRIE MING MAKES IT!
Score: 34-20

[01:27] Team_061 possession (Score: 34-20)
Michael Russell attempts a Layup. Contested by Evan Carter (4.5 feet, MAN). MICHAEL RUSSELL MAKES IT! Assist: Jayson Holiday
Score: 36-20

[01:11] Team_095 possession (Score: 36-20)
Shaquille Ball attempts a 3Pt. Heavily contested by Brandon Russell (1.6 feet, ZONE)! SHAQUILLE BALL MAKES IT! Assist: Dejounte Hyland
Score: 36-23

[00:54] Team_061 possession (Score: 36-23)
Michael Russell drives, Immanuel Middleton stays with him. Michael Russell attempts a Layup. Wide open! Immanuel Middleton is 6.3 feet away. [ZONE] MICHAEL RUSSELL MAKES IT! Assist: Draymond Banchero
Score: 38-23

[00:37] Team_095 possession (Score: 38-23)
Evan Carter attempts a 3Pt. Contested by Brandon Russell (5.3 feet, ZONE). EVAN CARTER MAKES IT! Assist: Dejounte Hyland
Score: 38-26

[00:25] Team_061 possession (Score: 38-26)
Jayson Holiday attempts a 3Pt. Wide open! Evan Carter is 6.9 feet away. [ZONE] Jayson Holiday misses. Rebound secured by Dejounte Hyland.

[00:12] Team_095 possession (Score: 38-26)
Shaquille Ball drives and kicks out. Dejounte Hyland attempts a Midrange. Contested by Bam Sexton (4.4 feet, ZONE). DEJOUNTE HYLAND MAKES IT! Assist: Shaquille Ball
Score: 38-28

================================================================================
                              1ST QUARTER COMPLETE                              
================================================================================

1ST QUARTER SCORE: Team_061 38, Team_095 28

BOX SCORE:
================================================================================

Team_061
--------------------------------------------------------------------------------
Player                MIN  PTS  REB  AST  TO      FG   FG%      3P   3P%
--------------------------------------------------------------------------------
Draymond Banchero      12   10    4    2   0   5/5   100.0     0/0   0.0
Michael Russell        12    9    4    3   0   4/4   100.0     0/0   0.0
Jayson Holiday         12    7    0    1   0   3/9    33.3     0/0   0.0
Bam Sexton             12    5    2    2   0   2/2   100.0     0/0   0.0
Brandon Russell        12    5    0    0   0   2/3    66.7     0/0   0.0

TEAM: FG: 16/23 (69.6%), 3PT: 4/7 (57.1%), REB: 10 (1 off, 9 def), AST: 8, TO: 1
TEAM FOULS: 4


Team_095
--------------------------------------------------------------------------------
Player                MIN  PTS  REB  AST  TO      FG   FG%      3P   3P%
--------------------------------------------------------------------------------
Evan Carter            12   10    3    2   0   4/6    66.7     0/0   0.0
Dejounte Hyland        12    9    4    2   0   4/6    66.7     0/0   0.0
Shaquille Ball         12    3    1    1   0   1/3    33.3     0/0   0.0
Immanuel Middleton     12    2    0    1   0   1/2    50.0     0/0   0.0
Kyrie Ming             12    2    0    0   0   1/3    33.3     0/0   0.0

TEAM: FG: 11/20 (55.0%), 3PT: 4/8 (50.0%), REB: 8 (2 off, 6 def), AST: 6, TO: 4
TEAM FOULS: 4

================================================================================

================================================================================
                       2ND QUARTER - Team_061 vs Team_095                       
================================================================================

[12:00] Team_061 possession (Score: 38-28)
Jayson Holiday attempts a 3Pt. Contested by Shaquille Ball (4.2 feet, MAN). Jayson Holiday misses. Rebound secured by Shaquille Ball.

[11:48] Team_095 possession (Score: 38-28)
Shaquille Ball attempts a Layup. Wide open! Draymond Banchero is 6.9 feet away. [ZONE] Shaquille Ball misses. Rebound secured by Bam Sexton.

[11:29] Team_061 possession (Score: 38-28)
Draymond Banchero attempts a Midrange. Wide open! Evan Carter is 6.7 feet away. [ZONE] DRAYMOND BANCHERO MAKES IT! Assist: Brandon Russell
Score: 40-28

[11:12] Team_095 possession (Score: 40-28)
Shaquille Ball attempts a 3Pt. Heavily contested by Jayson Holiday (0.5 feet, MAN)! Shaquille Ball misses. Offensive rebound by Evan Carter! Evan Carter puts it back in!
Score: 40-30

[10:56] Team_061 possession (Score: 40-30)
Jayson Holiday throws a bad pass! Stolen by Shaquille Ball! TURNOVER! (live ball)

[10:42] Team_095 possession (Score: 40-30)
Evan Carter attempts a 3Pt. Contested by Michael Russell (5.8 feet, MAN). Evan Carter misses. Rebound secured by Michael Russell.

[10:29] Team_061 possession (Score: 40-30)
Michael Russell attempts a 3Pt. Contested by Evan Carter (2.2 feet, MAN). Michael Russell misses. Rebound secured by Evan Carter.

[10:14] Team_095 possession (Score: 40-30)
Evan Carter attempts a Midrange. Wide open! Michael Russell is 6.3 feet away. [MAN] Evan Carter misses. Offensive rebound by Dejounte Hyland! Dejounte Hyland kicks it out.

[10:01] Team_095 possession (Score: 40-30)
Dejounte Hyland attempts a Layup. Contested by Brandon Russell (3.0 feet, MAN). DEJOUNTE HYLAND MAKES IT!
Score: 40-32

[09:49] Team_061 possession (Score: 40-32)
FOUL! Reach-in foul on Evan Carter during the drive. [Team fouls: 1] No free throws, side out. (Evan Carter: 1 personal fouls)

[09:35] Team_061 possession (Score: 40-32)
Jayson Holiday attempts a 3Pt. Wide open! Dejounte Hyland is 7.2 feet away. [ZONE] Jayson Holiday misses. Rebound secured by Evan Carter.

[09:16] Team_095 possession (Score: 40-32)
Evan Carter drives and kicks out. Kyrie Ming attempts a 3Pt. Contested by Draymond Banchero (3.1 feet, MAN). Kyrie Ming misses. FOUL! Loose ball foul on Bam Sexton during the rebound battle. [Team fouls: 1] No free throws, side out. (Bam Sexton: 1 personal fouls)

[09:02] Team_095 possession (Score: 40-32)
FOUL! Reach-in foul on Bam Sexton during the drive. [Team fouls: 2] No free throws, side out. (Bam Sexton: 2 personal fouls)

[08:46] Team_095 possession (Score: 40-32)
Immanuel Middleton attempts a 3Pt. Heavily contested by Brandon Russell (1.2 feet, ZONE)! IMMANUEL MIDDLETON MAKES IT! Assist: Kyrie Ming
Score: 40-35

[08:30] Team_061 possession (Score: 40-35)
Draymond Banchero attempts a Midrange. Contested by Immanuel Middleton (5.9 feet, ZONE). Draymond Banchero misses. Offensive rebound by Michael Russell! Michael Russell kicks it out.

[08:19] Team_061 possession (Score: 40-35)
Draymond Banchero attempts a Layup. Contested by Immanuel Middleton (5.4 feet, ZONE). Draymond Banchero misses. Rebound secured by Dejounte Hyland.

[08:01] Team_095 possession (Score: 40-35)
Evan Carter drives and kicks out. Shaquille Ball attempts a Midrange. Wide open! Draymond Banchero is 7.6 feet away. [ZONE] Shaquille Ball misses. Rebound secured by Bam Sexton.

[07:45] Team_061 possession (Score: 40-35)
Michael Russell attempts a 3Pt. Wide open! Evan Carter is 7.3 feet away. [MAN] MICHAEL RUSSELL MAKES IT! Assist: Jayson Holiday
Score: 43-35

[07:30] Team_095 possession (Score: 43-35)
Shaquille Ball attempts a 3Pt. Contested by Jayson Holiday (3.0 feet, MAN). Shaquille Ball misses. Rebound secured by Michael Russell.

[07:16] Team_061 possession (Score: 43-35)
FOUL! Holding foul on Immanuel Middleton. [Team fouls: 2] No free throws, side out. (Immanuel Middleton: 1 personal fouls)

[07:03] Team_061 possession (Score: 43-35)
Jayson Holiday makes the Dunk and draws the foul on Shaquille Ball! And-1! Jayson Holiday to the line for 1. [Team fouls: 3] (Shaquille Ball: 1 personal fouls)   FT 1/1: GOOD Jayson Holiday makes 1/1 from the line.
Score: 46-35

[06:45] Team_095 possession (Score: 46-35)
Dejounte Hyland attempts a Midrange. Contested by Brandon Russell (4.1 feet, MAN). Dejounte Hyland misses. Rebound secured by Bam Sexton.

[06:30] Team_061 possession (Score: 46-35)
Michael Russell attempts a 3Pt. Contested by Evan Carter (4.7 feet, ZONE). MICHAEL RUSSELL MAKES IT! Assist: Jayson Holiday
Score: 49-35

[06:17] Team_095 possession (Score: 49-35)
Evan Carter attempts a 3Pt. Contested by Michael Russell (4.1 feet, MAN). Evan Carter misses. Rebound secured by Bam Sexton.

[06:03] Team_061 possession (Score: 49-35)
Michael Russell drives, Evan Carter stays with him. Michael Russell attempts a Layup. Wide open! Evan Carter is 7.3 feet away. [MAN] Michael Russell misses. Rebound secured by Evan Carter.

[05:51] Team_095 possession (Score: 49-35)
Kyrie Ming makes the Dunk and draws the foul on Draymond Banchero! And-1! Kyrie Ming to the line for 1. [Team fouls: 3] (Draymond Banchero: 1 personal fouls)   FT 1/1: GOOD Kyrie Ming makes 1/1 from the line.
Score: 49-38

[05:39] Team_061 possession (Score: 49-38)
Draymond Banchero attempts a Layup. Wide open! Immanuel Middleton is 8.5 feet away. [ZONE] Draymond Banchero misses. Rebound secured by Evan Carter.

[05:27] Team_095 possession (Score: 49-38)
Dejounte Hyland attempts a 3Pt. Contested by Brandon Russell (3.8 feet, ZONE). DEJOUNTE HYLAND MAKES IT! Assist: Kyrie Ming
Score: 49-41

[05:10] Team_061 possession (Score: 49-41)
Bam Sexton drives, Immanuel Middleton stays with him. Bam Sexton attempts a Dunk. Contested by Immanuel Middleton (4.7 feet, ZONE). BAM SEXTON MAKES IT!
Score: 51-41

[04:51] Team_095 possession (Score: 51-41)
Dejounte Hyland attempts a 3Pt. Wide open! Brandon Russell is 6.0 feet away. [ZONE] Dejounte Hyland misses. Rebound secured by Draymond Banchero.

[04:38] Team_061 possession (Score: 51-41)
Jayson Holiday attempts a 3Pt. Contested by Shaquille Ball (2.5 feet, MAN). JAYSON HOLIDAY MAKES IT! Assist: Draymond Banchero
Score: 54-41

[04:26] Team_095 possession (Score: 54-41)
Dejounte Hyland attempts a 3Pt. Contested by Brandon Russell (3.9 feet, MAN). Dejounte Hyland misses. Offensive rebound by Shaquille Ball! Shaquille Ball kicks it out.

[04:13] Team_095 possession (Score: 54-41)
Kyrie Ming attempts a 3Pt. Contested by Draymond Banchero (2.1 feet, MAN). Kyrie Ming misses. Rebound secured by Michael Russell.

[03:58] Team_061 possession (Score: 54-41)
FOUL! Reach-in foul on Dejounte Hyland during the drive. [Team fouls: 4] No free throws, side out. (Dejounte Hyland: 1 personal fouls)

[03:44] Team_061 possession (Score: 54-41)
Draymond Banchero attempts a Midrange. Wide open! Evan Carter is 7.0 feet away. [ZONE] Draymond Banchero misses. Rebound secured by Shaquille Ball.

[03:32] Team_095 possession (Score: 54-41)
Immanuel Middleton drives to the basket... Immanuel Middleton loses control! Ball rolls out of bounds! TURNOVER! (dead ball)

[03:32] Substitution (Team_061): Brandon Russell OUT → Evan Rose IN (stamina_rule2)

[03:32] Substitution (Team_061): Jayson Holiday OUT → Gary Fox IN (stamina_rule2)

[03:32] Substitution (Team_061): Michael Russell OUT → Desmond Morant IN (stamina_rule2)

[03:32] Substitution (Team_061): Bam Sexton OUT → Stephen Towns IN (stamina_rule2)

[03:32] Substitution (Team_061): Draymond Banchero OUT → Tim Durant IN (stamina_rule2)

[03:32] Substitution (Team_095): Dejounte Hyland OUT → Kyle Poole IN (stamina_rule2)

[03:32] Substitution (Team_095): Shaquille Ball OUT → Cade Beal IN (stamina_rule2)

[03:32] Substitution (Team_095): Evan Carter OUT → Tobias Wagner IN (stamina_rule2)

[03:32] Substitution (Team_095): Immanuel Middleton OUT → Gary Davis IN (stamina_rule2)

[03:32] Substitution (Team_095): Kyrie Ming OUT → DeMar McCollum IN (stamina_rule2)

[03:16] Team_061 possession (Score: 54-41)
FOUL! Holding foul on Tobias Wagner. [IN THE BONUS! 5 team fouls] Desmond Morant to the line for 2 free throws. (Tobias Wagner: 1 personal fouls)   FT 1/2: GOOD   FT 2/2: GOOD Desmond Morant makes 2/2 from the line.
Score: 56-41

[02:57] Team_095 possession (Score: 56-41)
Kyle Poole attempts a 3Pt. Contested by Desmond Morant (2.6 feet, ZONE). KYLE POOLE MAKES IT! Assist: Tobias Wagner
Score: 56-44

[02:47] Team_061 possession (Score: 56-44)
Evan Rose attempts a 3Pt. Wide open! Kyle Poole is 6.1 feet away. [MAN] Evan Rose misses. Rebound secured by Gary Davis.

[02:38] Team_095 possession (Score: 56-44)
Cade Beal attempts a 3Pt. Wide open! Gary Fox is 6.1 feet away. [MAN] Cade Beal misses. Offensive rebound by DeMar McCollum! DeMar McCollum kicks it out.

[02:23] Team_095 possession (Score: 56-44)
Cade Beal attempts a 3Pt. Contested by Gary Fox (3.9 feet, MAN). CADE BEAL MAKES IT! Assist: Gary Davis
Score: 56-47

[02:07] Team_061 possession (Score: 56-47)
Desmond Morant throws a bad pass out of bounds! TURNOVER! (dead ball)

[01:52] Team_095 possession (Score: 56-47)
FOUL! Holding foul on Stephen Towns. [Team fouls: 4] No free throws, side out. (Stephen Towns: 1 personal fouls)

[01:38] Team_095 possession (Score: 56-47)
FOUL! Shooting foul on Tim Durant. DeMar McCollum to the line for 2 free throws. [BONUS: 5 team fouls] (Tim Durant: 1 personal fouls)   FT 1/2: MISS   FT 2/2: GOOD DeMar McCollum makes 1/2 from the line.
Score: 56-48

[01:22] Team_061 possession (Score: 56-48)
FOUL! Shooting foul on DeMar McCollum. Evan Rose to the line for 2 free throws. [BONUS: 6 team fouls] (DeMar McCollum: 1 personal fouls)   FT 1/2: GOOD   FT 2/2: GOOD Evan Rose makes 2/2 from the line.
Score: 58-48

[01:09] Team_095 possession (Score: 58-48)
Kyle Poole attempts a 3Pt. Contested by Desmond Morant (4.8 feet, ZONE). Kyle Poole misses. Rebound secured by Stephen Towns.

[00:59] Team_061 possession (Score: 58-48)
Gary Fox attempts a 3Pt. Contested by Cade Beal (3.3 feet, ZONE). GARY FOX MAKES IT! Assist: Tim Durant
Score: 61-48

[00:47] Team_095 possession (Score: 61-48)
Cade Beal attempts a 3Pt. Contested by Gary Fox (2.5 feet, MAN). CADE BEAL MAKES IT! Assist: DeMar McCollum
Score: 61-51

[00:32] Team_061 possession (Score: 61-51)
Tim Durant attempts a Layup. Heavily contested by DeMar McCollum (0.5 feet, ZONE)! Tim Durant misses. Rebound secured by Tobias Wagner.

[00:23] Team_095 possession (Score: 61-51)
FOUL! Shooting foul on Tim Durant. DeMar McCollum to the line for 2 free throws. [BONUS: 6 team fouls] (Tim Durant: 2 personal fouls)   FT 1/2: GOOD   FT 2/2: GOOD DeMar McCollum makes 2/2 from the line.
Score: 61-53

[00:06] Team_061 possession (Score: 61-53)
Desmond Morant makes the Layup and draws the foul on Kyle Poole! And-1! Desmond Morant to the line for 1. [BONUS: 7 team fouls] (Kyle Poole: 1 personal fouls)   FT 1/1: GOOD Desmond Morant makes 1/1 from the line.
Score: 64-53

================================================================================
                              2ND QUARTER COMPLETE                              
================================================================================

2ND QUARTER SCORE: Team_061 26, Team_095 25

BOX SCORE:
================================================================================

Team_061
--------------------------------------------------------------------------------
Player                MIN  PTS  REB  AST  TO      FG   FG%      3P   3P%
--------------------------------------------------------------------------------
Jayson Holiday         21    6    0    2   0   2/4    50.0     0/0   0.0
Michael Russell        21    6    4    0   0   2/4    50.0     0/0   0.0
Desmond Morant          3    5    0    0   0   2/2   100.0     0/0   0.0
Gary Fox                3    3    0    0   0   1/1   100.0     0/0   0.0
Bam Sexton             21    2    4    0   0   1/1   100.0     0/0   0.0
Draymond Banchero      21    2    1    1   0   1/4    25.0     0/0   0.0
Evan Rose               3    2    0    0   0   1/2    50.0     0/0   0.0
Brandon Russell        21    0    0    1   0   0/0     0.0     0/0   0.0
Stephen Towns           3    0    1    0   0   0/0     0.0     0/0   0.0
Tim Durant              3    0    0    1   0   0/1     0.0     0/0   0.0

TEAM: FG: 10/19 (52.6%), 3PT: 4/8 (50.0%), REB: 10 (1 off, 9 def), AST: 5, TO: 2
TEAM FOULS: 6 [Team_095 in BONUS]


Team_095
--------------------------------------------------------------------------------
Player                MIN  PTS  REB  AST  TO      FG   FG%      3P   3P%
--------------------------------------------------------------------------------
Cade Beal               3    6    0    0   0   2/2   100.0     0/0   0.0
Dejounte Hyland        21    5    2    0   0   2/4    50.0     0/0   0.0
Immanuel Middleton     21    3    0    0   0   1/1   100.0     0/0   0.0
Kyrie Ming             21    3    0    2   0   1/2    50.0     0/0   0.0
Kyle Poole              3    3    0    0   0   1/2    50.0     0/0   0.0
DeMar McCollum          3    3    1    1   0   2/2   100.0     0/0   0.0
Evan Carter            21    2    6    0   0   1/4    25.0     0/0   0.0
Shaquille Ball         21    0    3    0   0   0/2     0.0     0/0   0.0
Tobias Wagner           3    0    1    1   0   0/0     0.0     0/0   0.0
Gary Davis              3    0    1    1   0   0/0     0.0     0/0   0.0

TEAM: FG: 10/19 (52.6%), 3PT: 6/12 (50.0%), REB: 14 (5 off, 9 def), AST: 5, TO: 1
TEAM FOULS: 7 [Team_061 in BONUS]

================================================================================

================================================================================
                       3RD QUARTER - Team_061 vs Team_095                       
================================================================================

[12:00] Team_061 possession (Score: 64-53)
Jayson Holiday drives, Shaquille Ball stays with him. Jayson Holiday attempts a Dunk. Contested by Shaquille Ball (5.1 feet, MAN). Jayson Holiday misses. Rebound secured by Dejounte Hyland.

[11:44] Team_095 possession (Score: 64-53)
Immanuel Middleton attempts a Midrange. Contested by Bam Sexton (2.7 feet, ZONE). Immanuel Middleton misses. Rebound secured by Bam Sexton.

[11:32] Team_061 possession (Score: 64-53)
Bam Sexton attempts a Layup. Wide open! Immanuel Middleton is 8.2 feet away. [ZONE] Bam Sexton misses. Rebound secured by Dejounte Hyland.

[11:20] Team_095 possession (Score: 64-53)
Dejounte Hyland drives, picks up Brandon Russell. Help arrives from Michael Russell! Dejounte Hyland attempts a Layup. Contested by Michael Russell (3.8 feet, MAN). Dejounte Hyland misses. Offensive rebound by Evan Carter! Evan Carter puts it back in!
Score: 64-55

[11:08] Team_061 possession (Score: 64-55)
Jayson Holiday attempts a 3Pt. Contested by Shaquille Ball (4.7 feet, MAN). JAYSON HOLIDAY MAKES IT! Assist: Draymond Banchero
Score: 67-55

[10:55] Team_095 possession (Score: 67-55)
Evan Carter drives, Draymond Banchero stays with him. Evan Carter attempts a Layup. Contested by Draymond Banchero (2.3 feet, ZONE). Evan Carter misses. Rebound secured by Michael Russell.

[10:44] Team_061 possession (Score: 67-55)
Draymond Banchero attempts a Layup. Contested by Immanuel Middleton (3.0 feet, ZONE). DRAYMOND BANCHERO MAKES IT! Assist: Bam Sexton
Score: 69-55

[10:30] Team_095 possession (Score: 69-55)
Kyrie Ming loses the ball! Stripped by Draymond Banchero! TURNOVER! (live ball)

[10:18] Team_061 possession (Score: 69-55)
Jayson Holiday drives, Shaquille Ball stays with him. Jayson Holiday attempts a Layup. Wide open! Shaquille Ball is 8.9 feet away. [MAN] JAYSON HOLIDAY MAKES IT! Assist: Michael Russell
Score: 71-55

[09:59] Team_095 possession (Score: 71-55)
Evan Carter drives to the basket... Evan Carter commits a violation (traveling/carry)! TURNOVER! (dead ball)

[09:41] Team_061 possession (Score: 71-55)
Brandon Russell attempts a 3Pt. BLOCKED BY IMMANUEL MIDDLETON! Ball is loose! Rebound secured by Evan Carter.

[09:28] Team_095 possession (Score: 71-55)
Kyrie Ming attempts a Layup. Contested by Draymond Banchero (2.8 feet, MAN). KYRIE MING MAKES IT! Assist: Dejounte Hyland
Score: 71-57

[09:13] Team_061 possession (Score: 71-57)
Bam Sexton attempts a Midrange. Wide open! Immanuel Middleton is 6.2 feet away. [MAN] BAM SEXTON MAKES IT!
Score: 73-57

[08:54] Team_095 possession (Score: 73-57)
Dejounte Hyland attempts a Midrange. Contested by Bam Sexton (3.8 feet, ZONE). Dejounte Hyland misses. Rebound secured by Draymond Banchero.

[08:43] Team_061 possession (Score: 73-57)
Jayson Holiday attempts a 3Pt. Contested by Evan Carter (2.6 feet, ZONE). Jayson Holiday misses. Rebound secured by Dejounte Hyland.

[08:33] Team_095 possession (Score: 73-57)
Immanuel Middleton attempts a Layup. Contested by Bam Sexton (5.8 feet, MAN). IMMANUEL MIDDLETON MAKES IT! Assist: Evan Carter
Score: 73-59

[08:21] Team_061 possession (Score: 73-59)
Brandon Russell attempts a 3Pt. Wide open! Evan Carter is 6.5 feet away. [ZONE] Brandon Russell misses. Offensive rebound by Michael Russell! Michael Russell's putback is no good. Rebound secured by Shaquille Ball.

[08:06] Team_095 possession (Score: 73-59)
Immanuel Middleton attempts a 3Pt. Contested by Bam Sexton (5.9 feet, MAN). IMMANUEL MIDDLETON MAKES IT! Assist: Evan Carter
Score: 73-62

[07:50] Team_061 possession (Score: 73-62)
Draymond Banchero throws a bad pass out of bounds! TURNOVER! (dead ball)

[07:34] Team_095 possession (Score: 73-62)
Immanuel Middleton drives and kicks out. Shaquille Ball attempts a Midrange. BLOCKED BY JAYSON HOLIDAY! Ball is loose! Rebound secured by Draymond Banchero.

[07:18] Team_061 possession (Score: 73-62)
Bam Sexton attempts a Layup. Heavily contested by Immanuel Middleton (1.1 feet, ZONE)! BAM SEXTON MAKES IT! Assist: Michael Russell
Score: 75-62

[07:02] Team_095 possession (Score: 75-62)
FOUL! Offensive foul on Immanuel Middleton! Bam Sexton drew the charge! [Team fouls: 1] (Immanuel Middleton: 1 personal fouls) TURNOVER! (dead ball)

[06:45] Team_061 possession (Score: 75-62)
Michael Russell attempts a 3Pt. Contested by Evan Carter (4.2 feet, MAN). Michael Russell misses. Rebound secured by Evan Carter.

[06:27] Team_095 possession (Score: 75-62)
Shaquille Ball attempts a Layup. BLOCKED BY JAYSON HOLIDAY! Ball is loose! Rebound secured by Bam Sexton.

[06:15] Team_061 possession (Score: 75-62)
Draymond Banchero drives and kicks out. Draymond Banchero attempts a 3Pt. Heavily contested by Evan Carter (1.3 feet, ZONE)! Draymond Banchero misses. Rebound secured by Dejounte Hyland.

[06:00] Team_095 possession (Score: 75-62)
Dejounte Hyland attempts a 3Pt. Heavily contested by Brandon Russell (1.6 feet, ZONE)! Dejounte Hyland misses. Rebound secured by Michael Russell.

[05:45] Team_061 possession (Score: 75-62)
Draymond Banchero attempts a Midrange. Wide open! Kyrie Ming is 7.5 feet away. [MAN] Draymond Banchero misses. Offensive rebound by Michael Russell! Michael Russell's putback is no good. Offensive rebound by Draymond Banchero! Draymond Banchero kicks it out.

[05:29] Team_061 possession (Score: 75-62)
Michael Russell loses the ball! Stripped by Evan Carter! TURNOVER! (live ball)

[05:18] Team_095 possession (Score: 75-62)
Kyrie Ming drives to the basket... Kyrie Ming loses the ball! Stripped by Draymond Banchero! TURNOVER! (live ball)

[05:03] Team_061 possession (Score: 75-62)
Bam Sexton attempts a Midrange. Wide open! Shaquille Ball is 7.9 feet away. [ZONE] Bam Sexton misses. Rebound secured by Shaquille Ball.

[04:44] Team_095 possession (Score: 75-62)
FOUL! Shooting foul on Draymond Banchero. Kyrie Ming to the line for 2 free throws. [Team fouls: 1] (Draymond Banchero: 1 personal fouls)   FT 1/2: GOOD   FT 2/2: GOOD Kyrie Ming makes 2/2 from the line.
Score: 75-64

[04:31] Team_061 possession (Score: 75-64)
Michael Russell attempts a Midrange. Wide open! Evan Carter is 6.2 feet away. [MAN] Michael Russell misses. Rebound secured by Shaquille Ball.

[04:17] Team_095 possession (Score: 75-64)
Shaquille Ball makes the Layup and draws the foul on Draymond Banchero! And-1! Shaquille Ball to the line for 1. [Team fouls: 2] (Draymond Banchero: 2 personal fouls)   FT 1/1: GOOD Shaquille Ball makes 1/1 from the line.
Score: 75-67

[04:02] Team_061 possession (Score: 75-67)
Draymond Banchero attempts a Midrange. Wide open! Shaquille Ball is 6.4 feet away. [ZONE] DRAYMOND BANCHERO MAKES IT! Assist: Jayson Holiday
Score: 77-67

[03:47] Team_095 possession (Score: 77-67)
Kyrie Ming attempts a Midrange. Heavily contested by Draymond Banchero (0.5 feet, ZONE)! Kyrie Ming misses. Rebound secured by Draymond Banchero.

[03:33] Team_061 possession (Score: 77-67)
Jayson Holiday attempts a 3Pt. Contested by Shaquille Ball (3.5 feet, MAN). JAYSON HOLIDAY MAKES IT! Assist: Michael Russell
Score: 80-67

[03:19] Team_095 possession (Score: 80-67)
Shaquille Ball attempts a 3Pt. Contested by Brandon Russell (2.5 feet, ZONE). Shaquille Ball misses. Rebound secured by Draymond Banchero.

[03:06] Team_061 possession (Score: 80-67)
Bam Sexton attempts a Midrange. Contested by Immanuel Middleton (4.8 feet, ZONE). BAM SEXTON MAKES IT!
Score: 82-67

[02:50] Team_095 possession (Score: 82-67)
Dejounte Hyland attempts a 3Pt. Contested by Brandon Russell (3.4 feet, MAN). DEJOUNTE HYLAND MAKES IT! Assist: Kyrie Ming
Score: 82-70

[02:34] Team_061 possession (Score: 82-70)
Jayson Holiday makes the Layup and draws the foul on Dejounte Hyland! And-1! Jayson Holiday to the line for 1. [Team fouls: 2] (Dejounte Hyland: 1 personal fouls)   FT 1/1: GOOD Jayson Holiday makes 1/1 from the line.
Score: 85-70

[02:18] Team_095 possession (Score: 85-70)
Shaquille Ball attempts a 3Pt. Contested by Brandon Russell (5.8 feet, ZONE). Shaquille Ball misses. Rebound secured by Bam Sexton.

[02:00] Team_061 possession (Score: 85-70)
Michael Russell attempts a 3Pt. Contested by Evan Carter (2.3 feet, MAN). Michael Russell misses. Rebound secured by Shaquille Ball.

[01:44] Team_095 possession (Score: 85-70)
Kyrie Ming drives, Draymond Banchero stays with him. Kyrie Ming attempts a Dunk. Heavily contested by Draymond Banchero (0.5 feet, ZONE)! Kyrie Ming misses. Rebound secured by Draymond Banchero.

[01:29] Team_061 possession (Score: 85-70)
Jayson Holiday attempts a 3Pt. Contested by Shaquille Ball (5.3 feet, MAN). JAYSON HOLIDAY MAKES IT! Assist: Michael Russell
Score: 88-70

[01:18] Team_095 possession (Score: 88-70)
Evan Carter drives to the basket... Evan Carter throws a bad pass! Stolen by Michael Russell! TURNOVER! (live ball)

[01:00] Team_061 possession (Score: 88-70)
Brandon Russell attempts a Midrange. Contested by Evan Carter (5.9 feet, ZONE). Brandon Russell misses. Rebound secured by Dejounte Hyland.

[00:45] Team_095 possession (Score: 88-70)
Evan Carter attempts a 3Pt. Contested by Michael Russell (4.5 feet, MAN). Evan Carter misses. Rebound secured by Michael Russell.

[00:31] Team_061 possession (Score: 88-70)
Brandon Russell attempts a Midrange. Wide open! Immanuel Middleton is 6.9 feet away. [ZONE] Brandon Russell misses. Rebound secured by Evan Carter.

[00:16] Team_095 possession (Score: 88-70)
Shaquille Ball attempts a 3Pt. Contested by Brandon Russell (4.1 feet, ZONE). SHAQUILLE BALL MAKES IT! Assist: Evan Carter
Score: 88-73

[00:02] Team_061 possession (Score: 88-73)
Draymond Banchero drives and kicks out. Jayson Holiday makes the 3Pt and draws the foul on Shaquille Ball! And-1! Jayson Holiday to the line for 1. [Team fouls: 3] (Shaquille Ball: 1 personal fouls)   FT 1/1: MISS Jayson Holiday makes 0/1 from the line. Offensive rebound by Draymond Banchero! Draymond Banchero puts it back in!
Score: 93-73

================================================================================
                              3RD QUARTER COMPLETE                              
================================================================================

3RD QUARTER SCORE: Team_061 29, Team_095 20

BOX SCORE:
================================================================================

Team_061
--------------------------------------------------------------------------------
Player                MIN  PTS  REB  AST  TO      FG   FG%      3P   3P%
--------------------------------------------------------------------------------
Jayson Holiday         33   14    0    1   0   5/7    71.4     0/0   0.0
Draymond Banchero      33    9    6    1   0   3/4    75.0     0/0   0.0
Bam Sexton             33    6    3    1   0   3/5    60.0     0/0   0.0
Michael Russell        33    0    3    4   0   0/3     0.0     0/0   0.0
Brandon Russell        33    0    0    0   0   0/4     0.0     0/0   0.0

TEAM: FG: 11/23 (47.8%), 3PT: 3/8 (37.5%), REB: 13 (2 off, 11 def), AST: 7, TO: 2
TEAM FOULS: 2


Team_095
--------------------------------------------------------------------------------
Player                MIN  PTS  REB  AST  TO      FG   FG%      3P   3P%
--------------------------------------------------------------------------------
Shaquille Ball         33    6    4    0   0   2/5    40.0     0/0   0.0
Immanuel Middleton     33    5    0    0   0   2/4    50.0     0/0   0.0
Kyrie Ming             33    4    0    1   0   2/4    50.0     0/0   0.0
Dejounte Hyland        33    3    5    1   0   1/3    33.3     0/0   0.0
Evan Carter            33    2    4    3   0   1/3    33.3     0/0   0.0

TEAM: FG: 8/19 (42.1%), 3PT: 3/7 (42.9%), REB: 12 (1 off, 11 def), AST: 5, TO: 5
TEAM FOULS: 3

================================================================================

================================================================================
                       4TH QUARTER - Team_061 vs Team_095                       
================================================================================

[12:00] Team_061 possession (Score: 93-73)
Jayson Holiday drives, Immanuel Middleton stays with him. Jayson Holiday attempts a Layup. Wide open! Immanuel Middleton is 10.0 feet away. [ZONE] JAYSON HOLIDAY MAKES IT! Assist: Brandon Russell
Score: 95-73

[11:46] Team_095 possession (Score: 95-73)
Shaquille Ball drives to the basket... Shaquille Ball loses the ball! Stripped by Draymond Banchero! TURNOVER! (live ball)

[11:33] Team_061 possession (Score: 95-73)
Brandon Russell attempts a Midrange. Contested by Evan Carter (3.1 feet, ZONE). BRANDON RUSSELL MAKES IT! Assist: Jayson Holiday
Score: 97-73

[11:17] Team_095 possession (Score: 97-73)
Shaquille Ball attempts a 3Pt. Wide open! Brandon Russell is 7.1 feet away. [ZONE] SHAQUILLE BALL MAKES IT! Assist: Dejounte Hyland
Score: 97-76

[11:01] Team_061 possession (Score: 97-76)
Bam Sexton attempts a 3Pt. Contested by Immanuel Middleton (5.7 feet, MAN). Bam Sexton misses. Rebound secured by Evan Carter.

[10:48] Team_095 possession (Score: 97-76)
Dejounte Hyland attempts a Midrange. Contested by Bam Sexton (5.2 feet, ZONE). DEJOUNTE HYLAND MAKES IT!
Score: 97-78

[10:35] Team_061 possession (Score: 97-78)
Michael Russell attempts a Layup. Contested by Immanuel Middleton (3.0 feet, ZONE). MICHAEL RUSSELL MAKES IT!
Score: 99-78

[10:22] Team_095 possession (Score: 99-78)
Shaquille Ball drives and kicks out. Kyrie Ming attempts a 3Pt. Contested by Draymond Banchero (4.5 feet, MAN). Kyrie Ming misses. Rebound secured by Draymond Banchero.

[10:02] Team_061 possession (Score: 99-78)
Brandon Russell attempts a Midrange. Wide open! Dejounte Hyland is 7.1 feet away. [MAN] BRANDON RUSSELL MAKES IT!
Score: 101-78

[09:48] Team_095 possession (Score: 101-78)
Evan Carter attempts a 3Pt. Contested by Jayson Holiday (3.7 feet, ZONE). EVAN CARTER MAKES IT! Assist: Dejounte Hyland
Score: 101-81

[09:35] Team_061 possession (Score: 101-81)
Bam Sexton drives, Immanuel Middleton stays with him. Bam Sexton attempts a Dunk. Wide open! Immanuel Middleton is 9.2 feet away. [ZONE] BAM SEXTON MAKES IT!
Score: 103-81

[09:20] Team_095 possession (Score: 103-81)
Dejounte Hyland commits a violation (traveling/carry)! TURNOVER! (dead ball)

[09:20] Substitution (Team_061): Brandon Russell OUT → Evan Rose IN (stamina_rule2)

[09:20] Substitution (Team_061): Jayson Holiday OUT → Gary Fox IN (stamina_rule2)

[09:20] Substitution (Team_061): Michael Russell OUT → Desmond Morant IN (stamina_rule2)

[09:20] Substitution (Team_061): Bam Sexton OUT → Stephen Towns IN (stamina_rule2)

[09:20] Substitution (Team_061): Draymond Banchero OUT → Tim Durant IN (stamina_rule2)

[09:20] Substitution (Team_095): Dejounte Hyland OUT → Kyle Poole IN (stamina_rule2)

[09:20] Substitution (Team_095): Shaquille Ball OUT → Cade Beal IN (stamina_rule2)

[09:20] Substitution (Team_095): Evan Carter OUT → Tobias Wagner IN (stamina_rule2)

[09:20] Substitution (Team_095): Immanuel Middleton OUT → Gary Davis IN (stamina_rule2)

[09:20] Substitution (Team_095): Kyrie Ming OUT → DeMar McCollum IN (stamina_rule2)

[09:06] Team_061 possession (Score: 103-81)
Desmond Morant drives to the basket... Desmond Morant throws a bad pass! Stolen by Tobias Wagner! TURNOVER! (live ball)

[08:54] Team_095 possession (Score: 103-81)
Cade Beal attempts a 3Pt. Contested by Gary Fox (5.6 feet, MAN). CADE BEAL MAKES IT! Assist: Kyle Poole
Score: 103-84

[08:39] Team_061 possession (Score: 103-84)
Stephen Towns attempts a Midrange. Contested by Tobias Wagner (3.6 feet, ZONE). Stephen Towns misses. Rebound secured by Tobias Wagner.

[08:24] Team_095 possession (Score: 103-84)
Tobias Wagner attempts a 3Pt. Wide open! Desmond Morant is 6.1 feet away. [MAN] TOBIAS WAGNER MAKES IT! Assist: Kyle Poole
Score: 103-87

[08:09] Team_061 possession (Score: 103-87)
Evan Rose attempts a Midrange. Contested by Kyle Poole (3.0 feet, MAN). Evan Rose misses. Rebound secured by DeMar McCollum.

[07:52] Team_095 possession (Score: 103-87)
Gary Davis attempts a Midrange. Contested by Stephen Towns (4.8 feet, MAN). Gary Davis misses. Rebound secured by Stephen Towns.

[07:38] Team_061 possession (Score: 103-87)
Desmond Morant drives and kicks out. Stephen Towns attempts a 3Pt. Wide open! Gary Davis is 6.4 feet away. [MAN] STEPHEN TOWNS MAKES IT! Assist: Gary Fox
Score: 106-87

[07:21] Team_095 possession (Score: 106-87)
DeMar McCollum drives, picks up Tim Durant. Help arrives from Evan Rose! DeMar McCollum attempts a Dunk. Contested by Evan Rose (4.0 feet, ZONE). DeMar McCollum misses. Offensive rebound by Tobias Wagner! Tobias Wagner kicks it out.

[07:06] Team_095 possession (Score: 106-87)
DeMar McCollum attempts a 3Pt. Contested by Tim Durant (4.7 feet, MAN). DeMar McCollum misses. Rebound secured by Tim Durant.

[06:51] Team_061 possession (Score: 106-87)
Stephen Towns attempts a 3Pt. Contested by Gary Davis (5.1 feet, MAN). Stephen Towns misses. Offensive rebound by Stephen Towns! Stephen Towns kicks it out.

[06:40] Team_061 possession (Score: 106-87)
Stephen Towns drives and kicks out. Gary Fox attempts a 3Pt. Contested by Cade Beal (5.6 feet, MAN). Gary Fox misses. Rebound secured by Tobias Wagner.

[06:27] Team_095 possession (Score: 106-87)
Gary Davis attempts a Midrange. Heavily contested by Stephen Towns (0.7 feet, MAN)! GARY DAVIS MAKES IT!
Score: 106-89

[06:10] Team_061 possession (Score: 106-89)
Evan Rose attempts a 3Pt. Contested by Kyle Poole (5.9 feet, MAN). Evan Rose misses. Rebound secured by Gary Davis.

[05:59] Team_095 possession (Score: 106-89)
Cade Beal attempts a 3Pt. Wide open! Gary Fox is 10.0 feet away. [MAN] Cade Beal misses. Offensive rebound by Tobias Wagner! Tobias Wagner kicks it out.

[05:44] Team_095 possession (Score: 106-89)
Cade Beal attempts a 3Pt. Wide open! Gary Fox is 6.2 feet away. [MAN] CADE BEAL MAKES IT! Assist: DeMar McCollum
Score: 106-92

[05:29] Team_061 possession (Score: 106-92)
Desmond Morant attempts a 3Pt. Contested by Tobias Wagner (4.2 feet, ZONE). DESMOND MORANT MAKES IT! Assist: Gary Fox
Score: 109-92

[05:14] Team_095 possession (Score: 109-92)
Kyle Poole drives to the basket... FOUL! Offensive foul on Kyle Poole! Tim Durant drew the charge! [Team fouls: 1] (Kyle Poole: 1 personal fouls) TURNOVER! (dead ball)

[05:02] Team_061 possession (Score: 109-92)
Evan Rose attempts a 3Pt. Contested by Cade Beal (3.7 feet, ZONE). Evan Rose misses. Rebound secured by Gary Davis.

[04:45] Team_095 possession (Score: 109-92)
DeMar McCollum attempts a Midrange. Wide open! Tim Durant is 7.8 feet away. [MAN] DEMAR MCCOLLUM MAKES IT! Assist: Kyle Poole
Score: 109-94

[04:29] Team_061 possession (Score: 109-94)
Gary Fox attempts a 3Pt. Contested by Cade Beal (5.6 feet, MAN). Gary Fox misses. Rebound secured by Gary Davis.

[04:19] Team_095 possession (Score: 109-94)
Kyle Poole attempts a 3Pt. Contested by Evan Rose (5.1 feet, MAN). Kyle Poole misses. Offensive rebound by DeMar McCollum! DeMar McCollum kicks it out.

[04:08] Team_095 possession (Score: 109-94)
Gary Davis drives and kicks out. Kyle Poole attempts a 3Pt. Contested by Desmond Morant (3.0 feet, ZONE). Kyle Poole misses. Rebound secured by Tim Durant.

[03:58] Team_061 possession (Score: 109-94)
FOUL! Holding foul on Kyle Poole. [Team fouls: 2] No free throws, side out. (Kyle Poole: 2 personal fouls)

[03:44] Team_061 possession (Score: 109-94)
Evan Rose loses the ball! Stripped by Kyle Poole! TURNOVER! (live ball)

[03:28] Team_095 possession (Score: 109-94)
Kyle Poole attempts a 3Pt. Contested by Evan Rose (3.5 feet, ZONE). KYLE POOLE MAKES IT! Assist: Cade Beal
Score: 109-97

[03:16] Team_061 possession (Score: 109-97)
FOUL! Shooting foul on Cade Beal. Desmond Morant to the line for 3 free throws. [Team fouls: 3] (Cade Beal: 1 personal fouls)   FT 1/3: GOOD   FT 2/3: GOOD   FT 3/3: GOOD Desmond Morant makes 3/3 from the line.
Score: 112-97

[03:01] Team_095 possession (Score: 112-97)
FOUL! Offensive foul on Tobias Wagner! Desmond Morant drew the charge! [Team fouls: 4] (Tobias Wagner: 1 personal fouls) TURNOVER! (dead ball)

[02:43] Team_061 possession (Score: 112-97)
Stephen Towns attempts a Midrange. Contested by Tobias Wagner (4.7 feet, ZONE). Stephen Towns misses. Rebound secured by DeMar McCollum.

[02:25] Team_095 possession (Score: 112-97)
Gary Davis attempts a Midrange. Contested by Gary Fox (5.1 feet, ZONE). Gary Davis misses. Rebound secured by Tim Durant.

[02:09] Team_061 possession (Score: 112-97)
Evan Rose attempts a 3Pt. Contested by Kyle Poole (2.7 feet, MAN). Evan Rose misses. FOUL! Loose ball foul on DeMar McCollum during the rebound battle. [IN THE BONUS! 5 team fouls] Stephen Towns to the line for 2 free throws. (DeMar McCollum: 1 personal fouls)   FT 1/2: MISS   FT 2/2: GOOD Stephen Towns makes 1/2 from the line.
Score: 113-97

[01:55] Team_095 possession (Score: 113-97)
Kyle Poole attempts a Midrange. Contested by Gary Fox (2.4 feet, ZONE). Kyle Poole misses. Offensive rebound by Tobias Wagner! Tobias Wagner kicks it out.

[01:41] Team_095 possession (Score: 113-97)
DeMar McCollum makes the Layup and draws the foul on Tim Durant! And-1! DeMar McCollum to the line for 1. [Team fouls: 1] (Tim Durant: 1 personal fouls)   FT 1/1: MISS DeMar McCollum makes 0/1 from the line. Rebound secured by Desmond Morant.
Score: 113-99

[01:24] Team_061 possession (Score: 113-99)
Evan Rose attempts a 3Pt. Contested by Cade Beal (4.7 feet, ZONE). EVAN ROSE MAKES IT! Assist: Desmond Morant
Score: 116-99

[01:11] Team_095 possession (Score: 116-99)
Kyle Poole drives, picks up Tim Durant. Help arrives from Evan Rose! Kyle Poole attempts a Dunk. Contested by Evan Rose (4.0 feet, ZONE). Kyle Poole misses. Rebound secured by Tim Durant.

[00:54] Team_061 possession (Score: 116-99)
Tim Durant drives to the basket... FOUL! Offensive foul on Tim Durant! DeMar McCollum drew the charge! [Team fouls: 2] (Tim Durant: 2 personal fouls) TURNOVER! (dead ball)

[00:40] Team_095 possession (Score: 116-99)
Kyle Poole attempts a Layup. Contested by Evan Rose (4.9 feet, MAN). KYLE POOLE MAKES IT!
Score: 116-101

[00:26] Team_061 possession (Score: 116-101)
Stephen Towns drives, Gary Davis stays with him. Stephen Towns attempts a Layup. Wide open! Gary Davis is 7.9 feet away. [MAN] STEPHEN TOWNS MAKES IT! Assist: Evan Rose
Score: 118-101

[00:09] Team_095 possession (Score: 118-101)
Tobias Wagner attempts a Midrange. Contested by Gary Fox (5.7 feet, ZONE). Tobias Wagner misses. Rebound secured by Tim Durant.

================================================================================
                              4TH QUARTER COMPLETE                              
================================================================================

4TH QUARTER SCORE: Team_061 25, Team_095 28

BOX SCORE:
================================================================================

Team_061
--------------------------------------------------------------------------------
Player                MIN  PTS  REB  AST  TO      FG   FG%      3P   3P%
--------------------------------------------------------------------------------
Stephen Towns          13    6    2    0   0   3/6    50.0     0/0   0.0
Desmond Morant         13    6    1    1   0   2/2   100.0     0/0   0.0
Brandon Russell        36    4    0    1   0   2/2   100.0     0/0   0.0
Evan Rose              13    3    0    1   0   1/4    25.0     0/0   0.0
Jayson Holiday         36    2    0    1   0   1/1   100.0     0/0   0.0
Bam Sexton             36    2    0    0   0   1/2    50.0     0/0   0.0
Michael Russell        36    2    0    0   0   1/1   100.0     0/0   0.0
Draymond Banchero      36    0    1    0   0   0/0     0.0     0/0   0.0
Gary Fox               13    0    0    2   0   0/1     0.0     0/0   0.0
Tim Durant             13    0    5    0   0   0/0     0.0     0/0   0.0

TEAM: FG: 11/19 (57.9%), 3PT: 4/8 (50.0%), REB: 9 (1 off, 8 def), AST: 6, TO: 3
TEAM FOULS: 2


Team_095
--------------------------------------------------------------------------------
Player                MIN  PTS  REB  AST  TO      FG   FG%      3P   3P%
--------------------------------------------------------------------------------
Cade Beal              13    6    0    1   0   2/2   100.0     0/0   0.0
Kyle Poole             13    5    0    3   0   2/3    66.7     0/0   0.0
Shaquille Ball         36    3    0    0   0   1/2    50.0     0/0   0.0
Evan Carter            36    3    1    0   0   1/1   100.0     0/0   0.0
Tobias Wagner          13    3    5    0   0   1/2    50.0     0/0   0.0
Dejounte Hyland        36    2    0    2   0   1/1   100.0     0/0   0.0
DeMar McCollum         13    2    3    1   0   1/3    33.3     0/0   0.0
Gary Davis             13    2    3    0   0   1/4    25.0     0/0   0.0

TEAM: FG: 10/18 (55.6%), 3PT: 6/7 (85.7%), REB: 12 (4 off, 8 def), AST: 7, TO: 4
TEAM FOULS: 5 [Team_061 in BONUS]

================================================================================

================================================================================
                               FULL GAME COMPLETE                               
================================================================================

FINAL SCORE: Team_061 118, Team_095 101

SCORING BY QUARTER:
--------------------------------------------------------------------------------
Team                     Q1     Q2     Q3     Q4    FINAL
--------------------------------------------------------------------------------
Team_061                 38     26     29     25      118
Team_095                 28     25     20     28      101
--------------------------------------------------------------------------------

FULL GAME BOX SCORE:
================================================================================

Team_061
--------------------------------------------------------------------------------
Player                MIN  PTS  REB  AST  TO      FG   FG%      3P   3P%      FT STL BLK
--------------------------------------------------------------------------------
Brandon Russell        36    9    0    2   0   4/9    44.4   1/3    33.3   0/0     0   0
Jayson Holiday         36   29    0    5   2  11/21   52.4   4/10   40.0   3/5     0   2
Michael Russell        36   17   11    7   1   8/13   61.5   4/7    57.1   0/0     1   0
Bam Sexton             36   15    9    3   0   7/10   70.0   1/2    50.0   0/0     0   0
Draymond Banchero      36   21   13    4   1   8/12   66.7   0/0     0.0   2/2     3   1
Evan Rose              13    5    0    1   2   3/7    42.9   2/5    40.0   2/2     0   0
Gary Fox               13    3    0    2   0   1/2    50.0   1/2    50.0   0/0     0   0
Desmond Morant         13   11    1    1   2   4/4   100.0   2/2   100.0   6/6     0   0
Stephen Towns          13    6    3    0   0   1/4    25.0   0/0     0.0   1/2     0   0
Tim Durant             13    0    5    1   0   0/1     0.0   0/0     0.0   0/0     0   0

TEAM: FG: 48/84 (57.1%), 3PT: 15/31 (48.4%), REB: 42 (5 off, 37 def), AST: 26, TO: 8


Team_095
--------------------------------------------------------------------------------
Player                MIN  PTS  REB  AST  TO      FG   FG%      3P   3P%      FT STL BLK
--------------------------------------------------------------------------------
Dejounte Hyland        36   19   11    5   1   8/14   57.1   3/6    50.0   4/4     0   0
Shaquille Ball         36   12    8    1   3   6/14   42.9   4/8    50.0   1/1     1   0
Evan Carter            36   17   14    5   2   5/12   41.7   3/7    42.9   1/2     1   0
Immanuel Middleton     36   10    0    1   4   4/7    57.1   2/3    66.7   0/0     0   2
Kyrie Ming             36    9    0    3   2   4/9    44.4   0/1     0.0   3/3     0   0
Kyle Poole             13    8    0    3   1   3/5    60.0   2/3    66.7   0/0     1   0
Cade Beal              13   12    0    1   0   4/4   100.0   4/4   100.0   0/0     0   0
Tobias Wagner          13    3    6    1   1   1/2    50.0   1/1   100.0   0/0     1   0
Gary Davis             13    2    4    1   0   1/4    25.0   0/0     0.0   0/0     0   0
DeMar McCollum         13    5    4    2   0   3/5    60.0   0/1     0.0   3/5     0   0

TEAM: FG: 39/76 (51.3%), 3PT: 19/34 (55.9%), REB: 46 (12 off, 34 def), AST: 23, TO: 14

================================================================================
