================================================================================
                        FULL GAME - Team_002 vs Team_071                        
================================================================================

================================================================================
                       1ST QUARTER - Team_002 vs Team_071                       
================================================================================

[12:00] Team_002 possession (Score: 0-0)
CJ Barrett attempts a 3Pt. Contested by Victor Anunoby (4.6 feet, MAN). CJ Barrett misses. Rebound secured by Dejounte Paul.

[11:42] Team_071 possession (Score: 0-0)
Bam Iverson attempts a Layup. Wide open! Carmelo Lowry is 6.6 feet away. [ZONE] BAM IVERSON MAKES IT! Assist: Dejounte Paul
Score: 0-2

[11:27] Team_002 possession (Score: 0-2)
Carmelo Lowry throws a bad pass! Stolen by Jimmy Simons! TURNOVER! (live ball)

[11:12] Team_071 possession (Score: 0-2)
FOUL! Shooting foul on Carmelo Lowry. Jimmy Simons to the line for 2 free throws. [Team fouls: 1] (Carmelo Lowry: 1 personal fouls)   FT 1/2: GOOD   FT 2/2: GOOD Jimmy Simons makes 2/2 from the line.
Score: 0-4

[11:02] Team_002 possession (Score: 0-4)
Carmelo Lowry attempts a Midrange. Heavily contested by Jimmy Simons (0.5 feet, MAN)! Carmelo Lowry misses. Rebound secured by Bam Iverson.

[10:48] Team_071 possession (Score: 0-4)
Victor Anunoby attempts a 3Pt. Contested by CJ Barrett (5.8 feet, ZONE). Victor Anunoby misses. Rebound secured by Carmelo Lowry.

[10:30] Team_002 possession (Score: 0-4)
Carmelo Lowry attempts a 3Pt. Contested by Victor Anunoby (3.3 feet, ZONE). CARMELO LOWRY MAKES IT! Assist: Miles Bane
Score: 3-4

[10:15] Team_071 possession (Score: 3-4)
Jimmy Simons attempts a 3Pt. Contested by Carmelo Lowry (5.4 feet, MAN). Jimmy Simons misses. Rebound secured by Tyler Porzingis.

[09:57] Team_002 possession (Score: 3-4)
Tyler Porzingis drives and kicks out. Tyler Porzingis attempts a Midrange. Contested by Dejounte Paul (4.7 feet, MAN). Tyler Porzingis misses. Rebound secured by Dejounte Paul.

[09:41] Team_071 possession (Score: 3-4)
Bam Iverson drives, Tyler Porzingis stays with him. Bam Iverson attempts a Dunk. Contested by Tyler Porzingis (2.9 feet, ZONE). Bam Iverson misses. Offensive rebound by Dejounte Paul! Dejounte Paul kicks it out.

[09:27] Team_071 possession (Score: 3-4)
Allen Williamson attempts a 3Pt. Contested by Miles Bane (5.8 feet, MAN). ALLEN WILLIAMSON MAKES IT! Assist: Dejounte Paul
Score: 3-7

[09:13] Team_002 possession (Score: 3-7)
Tyler Porzingis drives and kicks out. Tyler Porzingis attempts a 3Pt. Heavily contested by Dejounte Paul (0.9 feet, MAN)! Tyler Porzingis misses. Offensive rebound by Carmelo Lowry! Carmelo Lowry kicks it out.

[08:57] Team_002 possession (Score: 3-7)
FOUL! Holding foul on Dejounte Paul. [Team fouls: 1] No free throws, side out. (Dejounte Paul: 1 personal fouls)

[08:42] Team_002 possession (Score: 3-7)
Miles Bane attempts a 3Pt. Heavily contested by Victor Anunoby (1.1 feet, ZONE)! Miles Bane misses. FOUL! Loose ball foul on Jimmy Simons during the rebound battle. [Team fouls: 2] No free throws, side out. (Jimmy Simons: 1 personal fouls)

[08:25] Team_002 possession (Score: 3-7)
Miles Bane attempts a Midrange. Wide open! Allen Williamson is 6.4 feet away. [MAN] MILES BANE MAKES IT!
Score: 5-7

[08:10] Team_071 possession (Score: 5-7)
Dejounte Paul loses control! Ball rolls out of bounds! TURNOVER! (dead ball)

[07:54] Team_002 possession (Score: 5-7)
Tyler Porzingis attempts a Midrange. Contested by Allen Williamson (3.3 feet, ZONE). Tyler Porzingis misses. Rebound secured by Dejounte Paul.

[07:36] Team_071 possession (Score: 5-7)
Victor Anunoby drives, CJ Barrett stays with him. Victor Anunoby attempts a Layup. Contested by CJ Barrett (3.1 feet, MAN). Victor Anunoby misses. Rebound secured by Carmelo Lowry.

[07:21] Team_002 possession (Score: 5-7)
CJ Barrett attempts a Layup. Wide open! Dejounte Paul is 6.3 feet away. [ZONE] CJ BARRETT MAKES IT! Assist: Jordan Green
Score: 7-7

[07:06] Team_071 possession (Score: 7-7)
Bam Iverson attempts a Midrange. Contested by Jordan Green (3.0 feet, MAN). BAM IVERSON MAKES IT!
Score: 7-9

[06:54] Team_002 possession (Score: 7-9)
Carmelo Lowry makes the Layup and draws the foul on Dejounte Paul! And-1! Carmelo Lowry to the line for 1. [Team fouls: 3] (Dejounte Paul: 2 personal fouls)   FT 1/1: GOOD Carmelo Lowry makes 1/1 from the line.
Score: 10-9

[06:36] Team_071 possession (Score: 10-9)
Dejounte Paul attempts a Layup. Contested by Carmelo Lowry (3.3 feet, ZONE). DEJOUNTE PAUL MAKES IT!
Score: 10-11

[06:18] Team_002 possession (Score: 10-11)
Jordan Green attempts a 3Pt. Contested by Bam Iverson (3.0 feet, MAN). Jordan Green misses. Offensive rebound by Tyler Porzingis! Tyler Porzingis's putback is no good. Rebound secured by Dejounte Paul.

[06:04] Team_071 possession (Score: 10-11)
Jimmy Simons attempts a Layup. BLOCKED BY CJ BARRETT! Ball is loose! Offensive rebound by Jimmy Simons! Jimmy Simons kicks it out.

[05:46] Team_071 possession (Score: 10-11)
Jimmy Simons drives, picks up Carmelo Lowry. Help arrives from CJ Barrett! Jimmy Simons attempts a Dunk. Wide open! CJ Barrett is 6.2 feet away. [MAN] Jimmy Simons misses. Rebound secured by Miles Bane.

[05:32] Team_002 possession (Score: 10-11)
Jordan Green attempts a Midrange. Heavily contested by Bam Iverson (0.5 feet, ZONE)! JORDAN GREEN MAKES IT!
Score: 12-11

[05:18] Team_071 possession (Score: 12-11)
Dejounte Paul attempts a Layup. Contested by Tyler Porzingis (2.6 feet, ZONE). Dejounte Paul misses. Rebound secured by Carmelo Lowry.

[05:05] Team_002 possession (Score: 12-11)
Tyler Porzingis drives, Dejounte Paul stays with him. Tyler Porzingis attempts a Dunk. Wide open! Dejounte Paul is 6.2 feet away. [MAN] TYLER PORZINGIS MAKES IT! Assist: Jordan Green
Score: 14-11

[04:52] Team_071 possession (Score: 14-11)
Bam Iverson attempts a 3Pt. Wide open! CJ Barrett is 6.1 feet away. [ZONE] Bam Iverson misses. Offensive rebound by Jimmy Simons! Jimmy Simons kicks it out.

[04:38] Team_071 possession (Score: 14-11)
Dejounte Paul drives, Tyler Porzingis stays with him. Dejounte Paul attempts a Dunk. Contested by Tyler Porzingis (5.4 feet, ZONE). DEJOUNTE PAUL MAKES IT! Assist: Allen Williamson
Score: 14-13

[04:24] Team_002 possession (Score: 14-13)
Carmelo Lowry throws a bad pass out of bounds! TURNOVER! (dead ball)

[04:08] Team_071 possession (Score: 14-13)
Jimmy Simons attempts a 3Pt. Heavily contested by CJ Barrett (0.8 feet, ZONE)! JIMMY SIMONS MAKES IT! Assist: Bam Iverson
Score: 14-16

[03:49] Team_002 possession (Score: 14-16)
Jordan Green drives and kicks out. Jordan Green attempts a Midrange. Heavily contested by Victor Anunoby (2.0 feet, ZONE)! Jordan Green misses. Rebound secured by Jimmy Simons.

[03:35] Team_071 possession (Score: 14-16)
Dejounte Paul makes the Midrange and draws the foul on Carmelo Lowry! And-1! Dejounte Paul to the line for 1. [Team fouls: 3] (Carmelo Lowry: 3 personal fouls)   FT 1/1: GOOD Dejounte Paul makes 1/1 from the line.
Score: 14-19

[03:18] Team_002 possession (Score: 14-19)
CJ Barrett attempts a 3Pt. Contested by Victor Anunoby (4.9 feet, ZONE). CJ BARRETT MAKES IT! Assist: Tyler Porzingis
Score: 17-19

[03:04] Team_071 possession (Score: 17-19)
Jimmy Simons attempts a Midrange. Contested by Carmelo Lowry (3.7 feet, MAN). Jimmy Simons misses. Rebound secured by Tyler Porzingis.

[02:46] Team_002 possession (Score: 17-19)
Carmelo Lowry attempts a 3Pt. Wide open! Victor Anunoby is 6.6 feet away. [ZONE] Carmelo Lowry misses. Offensive rebound by Carmelo Lowry! Carmelo Lowry kicks it out.

[02:32] Team_002 possession (Score: 17-19)
CJ Barrett attempts a 3Pt. Contested by Victor Anunoby (3.2 feet, ZONE). CJ Barrett misses. Rebound secured by Bam Iverson.

[02:18] Team_071 possession (Score: 17-19)
Bam Iverson attempts a 3Pt. Contested by Jordan Green (4.3 feet, MAN). Bam Iverson misses. Offensive rebound by Jimmy Simons! Jimmy Simons kicks it out.

[02:06] Team_071 possession (Score: 17-19)
Jimmy Simons attempts a Midrange. Contested by Carmelo Lowry (5.1 feet, MAN). Jimmy Simons misses. Rebound secured by Miles Bane.

[01:51] Team_002 possession (Score: 17-19)
Jordan Green attempts a 3Pt. Contested by Victor Anunoby (5.1 feet, ZONE). Jordan Green misses. Rebound secured by Bam Iverson.

[01:37] Team_071 possession (Score: 17-19)
Dejounte Paul attempts a 3Pt. Contested by CJ Barrett (3.3 feet, ZONE). Dejounte Paul misses. Rebound secured by Miles Bane.

[01:20] Team_002 possession (Score: 17-19)
Jordan Green attempts a 3Pt. Wide open! Victor Anunoby is 6.1 feet away. [ZONE] Jordan Green misses. Rebound secured by Bam Iverson.

[01:04] Team_071 possession (Score: 17-19)
Allen Williamson drives, Tyler Porzingis stays with him. Allen Williamson attempts a Dunk. Contested by Tyler Porzingis (4.7 feet, ZONE). ALLEN WILLIAMSON MAKES IT! Assist: Victor Anunoby
Score: 17-21

[00:50] Team_002 possession (Score: 17-21)
FOUL! Offensive foul on Miles Bane! Allen Williamson drew the charge! [Team fouls: 4] (Miles Bane: 1 personal fouls) TURNOVER! (dead ball)

[00:35] Team_071 possession (Score: 17-21)
Victor Anunoby drives, Carmelo Lowry stays with him. Victor Anunoby attempts a Dunk. Wide open! Carmelo Lowry is 8.7 feet away. [ZONE] VICTOR ANUNOBY MAKES IT! Assist: Jimmy Simons
Score: 17-23

[00:22] Team_002 possession (Score: 17-23)
Tyler Porzingis drives and kicks out. Miles Bane makes the 3Pt and draws the foul on Victor Anunoby! And-1! Miles Bane to the line for 1. [Team fouls: 4] (Victor Anunoby: 1 personal fouls)   FT 1/1: GOOD Miles Bane makes 1/1 from the line.
Score: 21-23

[00:08] Team_071 possession (Score: 21-23)
Dejounte Paul drives, Tyler Porzingis stays with him. Dejounte Paul attempts a Dunk. Heavily contested by Tyler Porzingis (1.9 feet, ZONE)! Dejounte Paul misses. Offensive rebound by Jimmy Simons! Jimmy Simons kicks it out.

================================================================================
                              1ST QUARTER COMPLETE                              
================================================================================

1ST QUARTER SCORE: Team_002 21, Team_071 23

BOX SCORE:
================================================================================

Team_002
--------------------------------------------------------------------------------
Player                MIN  PTS  REB  AST  TO      FG   FG%      3P   3P%
--------------------------------------------------------------------------------
Carmelo Lowry          12    6    5    0   0   2/3    66.7     0/0   0.0
Miles Bane             12    6    3    1   0   2/2   100.0     0/0   0.0
CJ Barrett             12    5    0    0   0   2/4    50.0     0/0   0.0
Tyler Porzingis        12    2    3    1   0   1/3    33.3     0/0   0.0
Jordan Green           12    2    0    2   0   1/5    20.0     0/0   0.0

TEAM: FG: 8/17 (47.1%), 3PT: 2/7 (28.6%), REB: 12 (4 off, 8 def), AST: 4, TO: 3
TEAM FOULS: 4


Team_071
--------------------------------------------------------------------------------
Player                MIN  PTS  REB  AST  TO      FG   FG%      3P   3P%
--------------------------------------------------------------------------------
Dejounte Paul          12    7    5    2   0   3/5    60.0     0/0   0.0
Jimmy Simons           12    5    5    1   0   2/6    33.3     0/0   0.0
Allen Williamson       12    5    0    1   0   2/2   100.0     0/0   0.0
Bam Iverson            12    4    4    1   0   2/2   100.0     0/0   0.0
Victor Anunoby         12    2    0    1   0   1/3    33.3     0/0   0.0

TEAM: FG: 10/18 (55.6%), 3PT: 2/5 (40.0%), REB: 13 (5 off, 8 def), AST: 6, TO: 1
TEAM FOULS: 4

================================================================================

================================================================================
                       2ND QUARTER - Team_002 vs Team_071                       
================================================================================

[12:00] Team_002 possession (Score: 21-23)
Jordan Green drives and kicks out. FOUL! Shooting foul on Victor Anunoby. Carmelo Lowry to the line for 3 free throws. [Team fouls: 1] (Victor Anunoby: 1 personal fouls)   FT 1/3: GOOD   FT 2/3: GOOD   FT 3/3: GOOD Carmelo Lowry makes 3/3 from the line.
Score: 24-23

[11:42] Team_071 possession (Score: 24-23)
Dejounte Paul drives and kicks out. Dejounte Paul attempts a Midrange. Contested by Tyler Porzingis (4.7 feet, MAN). Dejounte Paul misses. Offensive rebound by Dejounte Paul! Dejounte Paul kicks it out.

[11:29] Team_071 possession (Score: 24-23)
Dejounte Paul commits a violation (traveling/carry)! TURNOVER! (dead ball)

[11:29] Substitution (Team_002): Miles Bane OUT → John Duncan IN (stamina_rule2)

[11:29] Substitution (Team_002): CJ Barrett OUT → Dirk Middleton IN (stamina_rule2)

[11:29] Substitution (Team_002): Jordan Green OUT → Anfernee Sexton IN (stamina_rule2)

[11:29] Substitution (Team_002): Carmelo Lowry OUT → Julius Curry IN (stamina_rule2)

[11:29] Substitution (Team_002): Tyler Porzingis OUT → Lamelo O'Neal IN (stamina_rule2)

[11:29] Substitution (Team_071): Allen Williamson OUT → Evan Sexton IN (stamina_rule2)

[11:29] Substitution (Team_071): Victor Anunoby OUT → Paul Ball IN (stamina_rule2)

[11:29] Substitution (Team_071): Bam Iverson OUT → Immanuel Ginobili IN (stamina_rule2)

[11:29] Substitution (Team_071): Jimmy Simons OUT → Jordan Durant IN (stamina_rule2)

[11:29] Substitution (Team_071): Dejounte Paul OUT → Tyrese Brogdon IN (stamina_rule2)

[11:13] Team_002 possession (Score: 24-23)
Anfernee Sexton drives, Tyrese Brogdon stays with him. Anfernee Sexton attempts a Layup. Wide open! Tyrese Brogdon is 7.6 feet away. [ZONE] ANFERNEE SEXTON MAKES IT! Assist: Julius Curry
Score: 26-23

[11:02] Team_071 possession (Score: 26-23)
Paul Ball attempts a 3Pt. Contested by Julius Curry (5.2 feet, ZONE). Paul Ball misses. Rebound secured by Julius Curry.

[10:48] Team_002 possession (Score: 26-23)
Dirk Middleton loses the ball! Stripped by Paul Ball! TURNOVER! (live ball)

[10:38] Team_071 possession (Score: 26-23)
Immanuel Ginobili attempts a 3Pt. Contested by Julius Curry (3.6 feet, ZONE). IMMANUEL GINOBILI MAKES IT! Assist: Evan Sexton
Score: 26-26

[10:26] Team_002 possession (Score: 26-26)
John Duncan attempts a Midrange. Contested by Evan Sexton (3.2 feet, MAN). JOHN DUNCAN MAKES IT! Assist: Anfernee Sexton
Score: 28-26

[10:09] Team_071 possession (Score: 28-26)
FOUL! Shooting foul on Lamelo O'Neal. Evan Sexton to the line for 2 free throws. [Team fouls: 1] (Lamelo O'Neal: 1 personal fouls)   FT 1/2: GOOD   FT 2/2: GOOD Evan Sexton makes 2/2 from the line.
Score: 28-28

[09:55] Team_002 possession (Score: 28-28)
Dirk Middleton makes the Layup and draws the foul on Paul Ball! And-1! Dirk Middleton to the line for 1. [Team fouls: 2] (Paul Ball: 1 personal fouls)   FT 1/1: GOOD Dirk Middleton makes 1/1 from the line.
Score: 31-28

[09:41] Team_071 possession (Score: 31-28)
Jordan Durant attempts a Midrange. Contested by Anfernee Sexton (3.5 feet, ZONE). JORDAN DURANT MAKES IT! Assist: Tyrese Brogdon
Score: 31-30

[09:28] Team_002 possession (Score: 31-30)
Lamelo O'Neal throws a bad pass out of bounds! TURNOVER! (dead ball)

[09:15] Team_071 possession (Score: 31-30)
Immanuel Ginobili attempts a 3Pt. Contested by Julius Curry (2.2 feet, ZONE). IMMANUEL GINOBILI MAKES IT! Assist: Tyrese Brogdon
Score: 31-33

[09:01] Team_002 possession (Score: 31-33)
Dirk Middleton drives, Paul Ball stays with him. Dirk Middleton attempts a Dunk. Contested by Paul Ball (2.6 feet, MAN). DIRK MIDDLETON MAKES IT!
Score: 33-33

[08:47] Team_071 possession (Score: 33-33)
Paul Ball attempts a 3Pt. Wide open! Julius Curry is 7.4 feet away. [ZONE] Paul Ball misses. Rebound secured by Lamelo O'Neal.

[08:32] Team_002 possession (Score: 33-33)
Julius Curry attempts a Midrange. Contested by Jordan Durant (4.6 feet, MAN). JULIUS CURRY MAKES IT! Assist: Lamelo O'Neal
Score: 35-33

[08:18] Team_071 possession (Score: 35-33)
Evan Sexton attempts a Midrange. Wide open! Julius Curry is 9.1 feet away. [ZONE] EVAN SEXTON MAKES IT!
Score: 35-35

[08:02] Team_002 possession (Score: 35-35)
John Duncan drives and kicks out. Dirk Middleton attempts a 3Pt. Contested by Paul Ball (3.9 feet, MAN). DIRK MIDDLETON MAKES IT! Assist: Anfernee Sexton
Score: 38-35

[07:47] Team_071 possession (Score: 38-35)
Jordan Durant drives and kicks out. Evan Sexton attempts a 3Pt. Wide open! John Duncan is 7.4 feet away. [MAN] EVAN SEXTON MAKES IT! Assist: Tyrese Brogdon
Score: 38-38

[07:36] Team_002 possession (Score: 38-38)
Julius Curry drives and kicks out. John Duncan attempts a 3Pt. Contested by Paul Ball (4.3 feet, ZONE). JOHN DUNCAN MAKES IT!
Score: 41-38

[07:22] Team_071 possession (Score: 41-38)
Immanuel Ginobili attempts a Layup. BLOCKED BY ANFERNEE SEXTON! Ball deflects out of bounds off Immanuel Ginobili.

[07:09] Team_002 possession (Score: 41-38)
Julius Curry attempts a 3Pt. Heavily contested by Jordan Durant (1.7 feet, MAN)! JULIUS CURRY MAKES IT! Assist: Anfernee Sexton
Score: 44-38

[06:51] Team_071 possession (Score: 44-38)
FOUL! Holding foul on Lamelo O'Neal. [Team fouls: 2] No free throws, side out. (Lamelo O'Neal: 2 personal fouls)

[06:40] Team_071 possession (Score: 44-38)
Paul Ball drives to the basket... FOUL! Offensive foul on Paul Ball! Lamelo O'Neal drew the charge! [Team fouls: 3] (Paul Ball: 2 personal fouls) TURNOVER! (dead ball)

[06:23] Team_002 possession (Score: 44-38)
Julius Curry attempts a Layup. Wide open! Tyrese Brogdon is 6.3 feet away. [ZONE] JULIUS CURRY MAKES IT! Assist: John Duncan
Score: 46-38

[06:11] Team_071 possession (Score: 46-38)
Immanuel Ginobili drives and kicks out. Immanuel Ginobili attempts a 3Pt. Contested by Anfernee Sexton (4.8 feet, MAN). IMMANUEL GINOBILI MAKES IT! Assist: Tyrese Brogdon
Score: 46-41

[05:58] Team_002 possession (Score: 46-41)
Anfernee Sexton attempts a 3Pt. Wide open! Paul Ball is 7.6 feet away. [ZONE] Anfernee Sexton misses. Rebound secured by Immanuel Ginobili.

[05:42] Team_071 possession (Score: 46-41)
Immanuel Ginobili drives to the basket... Immanuel Ginobili commits a violation (traveling/carry)! TURNOVER! (dead ball)

[05:32] Team_002 possession (Score: 46-41)
Dirk Middleton attempts a Layup. BLOCKED BY EVAN SEXTON! Ball is loose! Rebound secured by Jordan Durant.

[05:18] Team_071 possession (Score: 46-41)
Evan Sexton attempts a Midrange. Contested by John Duncan (4.5 feet, MAN). EVAN SEXTON MAKES IT! Assist: Paul Ball
Score: 46-43

[05:04] Team_002 possession (Score: 46-43)
John Duncan attempts a 3Pt. Contested by Evan Sexton (3.3 feet, MAN). JOHN DUNCAN MAKES IT! Assist: Lamelo O'Neal
Score: 49-43

[04:49] Team_071 possession (Score: 49-43)
Paul Ball makes the Layup and draws the foul on Lamelo O'Neal! And-1! Paul Ball to the line for 1. [Team fouls: 3] (Lamelo O'Neal: 3 personal fouls)   FT 1/1: GOOD Paul Ball makes 1/1 from the line.
Score: 49-46

[04:40] Team_002 possession (Score: 49-46)
Julius Curry attempts a Layup. Wide open! Tyrese Brogdon is 6.1 feet away. [ZONE] JULIUS CURRY MAKES IT!
Score: 51-46

[04:29] Team_071 possession (Score: 51-46)
Paul Ball drives and kicks out. Paul Ball attempts a Midrange. Wide open! Dirk Middleton is 9.1 feet away. [ZONE] Paul Ball misses. Rebound secured by Julius Curry.

[04:15] Team_002 possession (Score: 51-46)
Anfernee Sexton attempts a 3Pt. Contested by Immanuel Ginobili (5.2 feet, MAN). Anfernee Sexton misses. Rebound secured by Jordan Durant.

[04:03] Team_071 possession (Score: 51-46)
Immanuel Ginobili attempts a 3Pt. Wide open! Julius Curry is 6.7 feet away. [ZONE] IMMANUEL GINOBILI MAKES IT!
Score: 51-49

[03:48] Team_002 possession (Score: 51-49)
Dirk Middleton attempts a 3Pt. Contested by Paul Ball (3.8 feet, ZONE). Dirk Middleton misses. FOUL! Loose ball foul on Immanuel Ginobili during the rebound battle. [Team fouls: 4] No free throws, side out. (Immanuel Ginobili: 1 personal fouls)

[03:36] Team_002 possession (Score: 51-49)
Dirk Middleton throws a bad pass! Stolen by Paul Ball! TURNOVER! (live ball)

[03:18] Team_071 possession (Score: 51-49)
FOUL! Shooting foul on Julius Curry. Evan Sexton to the line for 3 free throws. [Team fouls: 4] (Julius Curry: 1 personal fouls)   FT 1/3: GOOD   FT 2/3: GOOD   FT 3/3: GOOD Evan Sexton makes 3/3 from the line.
Score: 51-52

[03:00] Team_002 possession (Score: 51-52)
John Duncan drives, Tyrese Brogdon stays with him. John Duncan attempts a Dunk. Contested by Tyrese Brogdon (3.1 feet, ZONE). JOHN DUNCAN MAKES IT! Assist: Dirk Middleton
Score: 53-52

[02:43] Team_071 possession (Score: 53-52)
Jordan Durant attempts a 3Pt. Contested by Julius Curry (3.4 feet, ZONE). Jordan Durant misses. Offensive rebound by Immanuel Ginobili! Immanuel Ginobili kicks it out.

[02:31] Team_071 possession (Score: 53-52)
Tyrese Brogdon drives, Lamelo O'Neal stays with him. Tyrese Brogdon attempts a Dunk. Contested by Lamelo O'Neal (3.6 feet, MAN). Tyrese Brogdon misses. Rebound secured by Lamelo O'Neal.

[02:14] Team_002 possession (Score: 53-52)
Lamelo O'Neal drives, Jordan Durant stays with him. Lamelo O'Neal attempts a Dunk. Contested by Jordan Durant (5.6 feet, ZONE). Lamelo O'Neal misses. Rebound secured by Evan Sexton.

[02:01] Team_071 possession (Score: 53-52)
Jordan Durant drives, Lamelo O'Neal stays with him. Jordan Durant attempts a Layup. Wide open! Lamelo O'Neal is 7.6 feet away. [ZONE] JORDAN DURANT MAKES IT! Assist: Evan Sexton
Score: 53-54

[01:42] Team_002 possession (Score: 53-54)
Anfernee Sexton drives, picks up Tyrese Brogdon. Help arrives from Evan Sexton! Anfernee Sexton attempts a Dunk. Wide open! Evan Sexton is 7.4 feet away. [ZONE] ANFERNEE SEXTON MAKES IT! Assist: John Duncan
Score: 55-54

[01:32] Team_071 possession (Score: 55-54)
Tyrese Brogdon attempts a Midrange. Wide open! Dirk Middleton is 6.3 feet away. [ZONE] TYRESE BROGDON MAKES IT!
Score: 55-56

[01:18] Team_002 possession (Score: 55-56)
Julius Curry makes the Layup and draws the foul on Jordan Durant! And-1! Julius Curry to the line for 1. [BONUS: 5 team fouls] (Jordan Durant: 1 personal fouls)   FT 1/1: GOOD Julius Curry makes 1/1 from the line.
Score: 58-56

[01:03] Team_071 possession (Score: 58-56)
Tyrese Brogdon attempts a Midrange. Wide open! Anfernee Sexton is 6.9 feet away. [ZONE] Tyrese Brogdon misses. Rebound secured by Julius Curry.

[00:50] Team_002 possession (Score: 58-56)
FOUL! Holding foul on Jordan Durant. [IN THE BONUS! 6 team fouls] Julius Curry to the line for 2 free throws. (Jordan Durant: 2 personal fouls)   FT 1/2: GOOD   FT 2/2: GOOD Julius Curry makes 2/2 from the line.
Score: 60-56

[00:31] Team_071 possession (Score: 60-56)
Jordan Durant drives to the basket... Jordan Durant commits a violation (traveling/carry)! TURNOVER! (dead ball)

[00:17] Team_002 possession (Score: 60-56)
John Duncan drives to the basket... John Duncan loses control! Ball rolls out of bounds! TURNOVER! (dead ball)

[00:04] Team_071 possession (Score: 60-56)
FOUL! Shooting foul on Lamelo O'Neal. Tyrese Brogdon to the line for 2 free throws. [BONUS: 5 team fouls] (Lamelo O'Neal: 4 personal fouls)   FT 1/2: GOOD   FT 2/2: MISS Tyrese Brogdon makes 1/2 from the line. Rebound secured by Lamelo O'Neal.
Score: 60-57

================================================================================
                              2ND QUARTER COMPLETE                              
================================================================================

2ND QUARTER SCORE: Team_002 39, Team_071 34

BOX SCORE:
================================================================================

Team_002
--------------------------------------------------------------------------------
Player                MIN  PTS  REB  AST  TO      FG   FG%      3P   3P%
--------------------------------------------------------------------------------
Julius Curry           11   14    3    1   0   6/6   100.0     0/0   0.0
John Duncan            11   10    0    2   0   4/4   100.0     0/0   0.0
Dirk Middleton         11    8    0    1   0   3/4    75.0     0/0   0.0
Anfernee Sexton        11    4    1    3   0   2/4    50.0     0/0   0.0
Carmelo Lowry          13    3    0    0   0   1/1   100.0     0/0   0.0
Lamelo O'Neal          11    0    3    2   0   0/1     0.0     0/0   0.0

TEAM: FG: 16/20 (80.0%), 3PT: 2/4 (50.0%), REB: 7 (1 off, 6 def), AST: 9, TO: 4
TEAM FOULS: 5 [Team_071 in BONUS]


Team_071
--------------------------------------------------------------------------------
Player                MIN  PTS  REB  AST  TO      FG   FG%      3P   3P%
--------------------------------------------------------------------------------
Immanuel Ginobili      11   12    2    0   0   4/5    80.0     0/0   0.0
Evan Sexton            11   12    1    2   0   5/5   100.0     0/0   0.0
Jordan Durant          11    4    2    0   0   2/2   100.0     0/0   0.0
Paul Ball              11    3    0    1   0   1/4    25.0     0/0   0.0
Tyrese Brogdon         11    2    0    4   0   1/4    25.0     0/0   0.0
Dejounte Paul          13    0    1    0   0   0/0     0.0     0/0   0.0

TEAM: FG: 13/20 (65.0%), 3PT: 4/6 (66.7%), REB: 6 (2 off, 4 def), AST: 7, TO: 4
TEAM FOULS: 6 [Team_002 in BONUS]

================================================================================

================================================================================
                       3RD QUARTER - Team_002 vs Team_071                       
================================================================================

[12:00] Team_002 possession (Score: 60-57)
Miles Bane attempts a Midrange. Contested by Allen Williamson (4.8 feet, MAN). MILES BANE MAKES IT! Assist: Tyler Porzingis
Score: 62-57

[11:43] Team_071 possession (Score: 62-57)
FOUL! Reach-in foul on Tyler Porzingis during the drive. [Team fouls: 1] No free throws, side out. (Tyler Porzingis: 1 personal fouls)

[11:25] Team_071 possession (Score: 62-57)
Allen Williamson attempts a 3Pt. Contested by Miles Bane (3.4 feet, MAN). ALLEN WILLIAMSON MAKES IT! Assist: Dejounte Paul
Score: 62-60

[11:11] Team_002 possession (Score: 62-60)
Jordan Green attempts a 3Pt. Contested by Victor Anunoby (4.0 feet, ZONE). JORDAN GREEN MAKES IT! Assist: Miles Bane
Score: 65-60

[10:54] Team_071 possession (Score: 65-60)
FOUL! Holding foul on Carmelo Lowry. [Team fouls: 2] No free throws, side out. (Carmelo Lowry: 1 personal fouls)

[10:41] Team_071 possession (Score: 65-60)
Victor Anunoby attempts a Layup. Contested by Tyler Porzingis (3.2 feet, ZONE). Victor Anunoby misses. Offensive rebound by Dejounte Paul! Dejounte Paul kicks it out.

[10:32] Team_071 possession (Score: 65-60)
Jimmy Simons attempts a 3Pt. Contested by Carmelo Lowry (5.7 feet, MAN). JIMMY SIMONS MAKES IT! Assist: Allen Williamson
Score: 65-63

[10:17] Team_002 possession (Score: 65-63)
Jordan Green drives, picks up Bam Iverson. Help arrives from Allen Williamson! Jordan Green attempts a Layup. Contested by Allen Williamson (3.4 feet, MAN). JORDAN GREEN MAKES IT! Assist: CJ Barrett
Score: 67-63

[10:05] Team_071 possession (Score: 67-63)
FOUL! Holding foul on Carmelo Lowry. [Team fouls: 3] No free throws, side out. (Carmelo Lowry: 2 personal fouls)

[09:50] Team_071 possession (Score: 67-63)
Jimmy Simons attempts a Layup. BLOCKED BY TYLER PORZINGIS! Ball is loose! Rebound secured by Tyler Porzingis.

[09:34] Team_002 possession (Score: 67-63)
CJ Barrett attempts a 3Pt. Contested by Victor Anunoby (4.7 feet, ZONE). CJ Barrett misses. Rebound secured by Bam Iverson.

[09:17] Team_071 possession (Score: 67-63)
Victor Anunoby drives, picks up Tyler Porzingis. Help arrives from CJ Barrett! Victor Anunoby attempts a Layup. Contested by CJ Barrett (4.1 feet, ZONE). Victor Anunoby misses. Rebound secured by Tyler Porzingis.

[09:03] Team_002 possession (Score: 67-63)
CJ Barrett loses control! Ball rolls out of bounds! TURNOVER! (dead ball)

[08:49] Team_071 possession (Score: 67-63)
FOUL! Holding foul on Carmelo Lowry. [Team fouls: 4] No free throws, side out. (Carmelo Lowry: 3 personal fouls)

[08:37] Team_071 possession (Score: 67-63)
Bam Iverson drives and kicks out. Dejounte Paul attempts a 3Pt. Contested by CJ Barrett (2.5 feet, ZONE). Dejounte Paul misses. Rebound secured by Tyler Porzingis.

[08:20] Team_002 possession (Score: 67-63)
Miles Bane attempts a Layup. Heavily contested by Dejounte Paul (0.5 feet, ZONE)! MILES BANE MAKES IT! Assist: Tyler Porzingis
Score: 69-63

[08:07] Team_071 possession (Score: 69-63)
Dejounte Paul attempts a Midrange. Contested by Tyler Porzingis (3.0 feet, MAN). DEJOUNTE PAUL MAKES IT! Assist: Allen Williamson
Score: 69-65

[07:50] Team_002 possession (Score: 69-65)
Miles Bane throws a bad pass out of bounds! TURNOVER! (dead ball)

[07:38] Team_071 possession (Score: 69-65)
Jimmy Simons attempts a 3Pt. Contested by CJ Barrett (4.6 feet, ZONE). Jimmy Simons misses. Rebound secured by Carmelo Lowry.

[07:24] Team_002 possession (Score: 69-65)
Tyler Porzingis attempts a Layup. Contested by Dejounte Paul (5.1 feet, MAN). TYLER PORZINGIS MAKES IT!
Score: 71-65

[07:10] Team_071 possession (Score: 71-65)
Dejounte Paul attempts a Midrange. Contested by Miles Bane (3.8 feet, ZONE). Dejounte Paul misses. Offensive rebound by Dejounte Paul! Dejounte Paul kicks it out.

[06:52] Team_071 possession (Score: 71-65)
Bam Iverson attempts a Midrange. Heavily contested by CJ Barrett (1.0 feet, ZONE)! BAM IVERSON MAKES IT!
Score: 71-67

[06:35] Team_002 possession (Score: 71-67)
Miles Bane attempts a 3Pt. Heavily contested by Allen Williamson (1.9 feet, MAN)! Miles Bane misses. Offensive rebound by Carmelo Lowry! Carmelo Lowry kicks it out.

[06:19] Team_002 possession (Score: 71-67)
CJ Barrett attempts a 3Pt. Contested by Victor Anunoby (5.6 feet, ZONE). CJ Barrett misses. Rebound secured by Jimmy Simons.

[06:01] Team_071 possession (Score: 71-67)
Bam Iverson drives, Tyler Porzingis stays with him. Bam Iverson attempts a Dunk. Contested by Tyler Porzingis (3.3 feet, ZONE). BAM IVERSON MAKES IT! Assist: Dejounte Paul
Score: 71-69

[05:44] Team_002 possession (Score: 71-69)
CJ Barrett attempts a 3Pt. Contested by Victor Anunoby (2.3 feet, ZONE). CJ Barrett misses. Rebound secured by Jimmy Simons.

[05:29] Team_071 possession (Score: 71-69)
Allen Williamson attempts a Midrange. Contested by Miles Bane (3.0 feet, MAN). ALLEN WILLIAMSON MAKES IT!
Score: 71-71

[05:16] Team_002 possession (Score: 71-71)
Miles Bane attempts a 3Pt. Contested by Allen Williamson (4.5 feet, MAN). Miles Bane misses. Rebound secured by Bam Iverson.

[05:05] Team_071 possession (Score: 71-71)
Allen Williamson attempts a 3Pt. Contested by Miles Bane (4.9 feet, MAN). ALLEN WILLIAMSON MAKES IT! Assist: Bam Iverson
Score: 71-74

[04:50] Team_002 possession (Score: 71-74)
Jordan Green drives, Bam Iverson stays with him. Jordan Green attempts a Layup. Contested by Bam Iverson (4.1 feet, MAN). JORDAN GREEN MAKES IT! Assist: Miles Bane
Score: 73-74

[04:35] Team_071 possession (Score: 73-74)
Victor Anunoby attempts a 3Pt. Contested by Carmelo Lowry (5.8 feet, ZONE). Victor Anunoby misses. Rebound secured by Miles Bane.

[04:18] Team_002 possession (Score: 73-74)
Carmelo Lowry makes the Layup and draws the foul on Jimmy Simons! And-1! Carmelo Lowry to the line for 1. [Team fouls: 1] (Jimmy Simons: 1 personal fouls)   FT 1/1: GOOD Carmelo Lowry makes 1/1 from the line.
Score: 76-74

[04:04] Team_071 possession (Score: 76-74)
Victor Anunoby attempts a 3Pt. Contested by CJ Barrett (4.3 feet, MAN). Victor Anunoby misses. Rebound secured by Carmelo Lowry.

[03:47] Team_002 possession (Score: 76-74)
Tyler Porzingis attempts a Layup. Contested by Dejounte Paul (2.7 feet, ZONE). TYLER PORZINGIS MAKES IT!
Score: 78-74

[03:32] Team_071 possession (Score: 78-74)
FOUL! Shooting foul on CJ Barrett. Victor Anunoby to the line for 2 free throws. [BONUS: 5 team fouls] (CJ Barrett: 1 personal fouls)   FT 1/2: MISS   FT 2/2: GOOD Victor Anunoby makes 1/2 from the line.
Score: 78-75

[03:17] Team_002 possession (Score: 78-75)
Miles Bane attempts a 3Pt. Contested by Jimmy Simons (3.9 feet, ZONE). Miles Bane misses. Offensive rebound by Carmelo Lowry! Carmelo Lowry kicks it out.

[03:03] Team_002 possession (Score: 78-75)
Jordan Green attempts a Midrange. Contested by Bam Iverson (4.1 feet, ZONE). Jordan Green misses. Rebound secured by Bam Iverson.

[02:50] Team_071 possession (Score: 78-75)
Jimmy Simons attempts a Midrange. Contested by Miles Bane (2.4 feet, ZONE). Jimmy Simons misses. Rebound secured by Tyler Porzingis.

[02:36] Team_002 possession (Score: 78-75)
FOUL! Shooting foul on Allen Williamson. Miles Bane to the line for 3 free throws. [Team fouls: 2] (Allen Williamson: 1 personal fouls)   FT 1/3: GOOD   FT 2/3: GOOD   FT 3/3: GOOD Miles Bane makes 3/3 from the line.
Score: 81-75

[02:22] Team_071 possession (Score: 81-75)
Allen Williamson attempts a 3Pt. Wide open! Miles Bane is 6.6 feet away. [MAN] ALLEN WILLIAMSON MAKES IT! Assist: Bam Iverson
Score: 81-78

[02:03] Team_002 possession (Score: 81-78)
Miles Bane attempts a Midrange. Contested by Allen Williamson (2.0 feet, MAN). MILES BANE MAKES IT!
Score: 83-78

[01:52] Team_071 possession (Score: 83-78)
Jimmy Simons attempts a Layup. Contested by Tyler Porzingis (2.5 feet, ZONE). JIMMY SIMONS MAKES IT! Assist: Bam Iverson
Score: 83-80

[01:34] Team_002 possession (Score: 83-80)
Miles Bane attempts a Midrange. Heavily contested by Allen Williamson (0.5 feet, MAN)! Miles Bane misses. Rebound secured by Bam Iverson.

[01:19] Team_071 possession (Score: 83-80)
Bam Iverson attempts a 3Pt. Contested by Jordan Green (6.0 feet, MAN). BAM IVERSON MAKES IT! Assist: Dejounte Paul
Score: 83-83

[01:02] Team_002 possession (Score: 83-83)
Tyler Porzingis attempts a Layup. Contested by Dejounte Paul (5.3 feet, MAN). Tyler Porzingis misses. Rebound secured by Bam Iverson.

[00:47] Team_071 possession (Score: 83-83)
Jimmy Simons drives to the basket... Jimmy Simons throws a bad pass! Stolen by Carmelo Lowry! TURNOVER! (live ball)

[00:30] Team_002 possession (Score: 83-83)
Miles Bane attempts a Midrange. BLOCKED BY ALLEN WILLIAMSON! Ball goes out off Allen Williamson. Miles Bane's ball!

[00:20] Team_002 possession (Score: 83-83)
Jordan Green attempts a Midrange. Wide open! Bam Iverson is 6.2 feet away. [MAN] JORDAN GREEN MAKES IT! Assist: Miles Bane
Score: 85-83

[00:04] Team_071 possession (Score: 85-83)
Bam Iverson drives, Jordan Green stays with him. Bam Iverson attempts a Layup. Contested by Jordan Green (4.7 feet, MAN). Bam Iverson misses. Rebound secured by Miles Bane.

================================================================================
                              3RD QUARTER COMPLETE                              
================================================================================

3RD QUARTER SCORE: Team_002 25, Team_071 26

BOX SCORE:
================================================================================

Team_002
--------------------------------------------------------------------------------
Player                MIN  PTS  REB  AST  TO      FG   FG%      3P   3P%
--------------------------------------------------------------------------------
Miles Bane             25    9    2    3   0   4/6    66.7     0/0   0.0
Jordan Green           25    9    0    0   0   4/5    80.0     0/0   0.0
Tyler Porzingis        25    4    4    2   0   2/3    66.7     0/0   0.0
Carmelo Lowry          25    3    4    0   0   1/1   100.0     0/0   0.0
CJ Barrett             25    0    0    1   0   0/3     0.0     0/0   0.0

TEAM: FG: 11/18 (61.1%), 3PT: 2/6 (33.3%), REB: 10 (2 off, 8 def), AST: 6, TO: 2
TEAM FOULS: 5 [Team_071 in BONUS]


Team_071
--------------------------------------------------------------------------------
Player                MIN  PTS  REB  AST  TO      FG   FG%      3P   3P%
--------------------------------------------------------------------------------
Allen Williamson       25   11    0    2   0   4/4   100.0     0/0   0.0
Bam Iverson            25    7    5    3   0   3/5    60.0     0/0   0.0
Jimmy Simons           25    5    2    0   0   2/5    40.0     0/0   0.0
Dejounte Paul          25    2    2    3   0   1/1   100.0     0/0   0.0
Victor Anunoby         25    1    0    0   0   1/4    25.0     0/0   0.0

TEAM: FG: 11/19 (57.9%), 3PT: 5/8 (62.5%), REB: 9 (2 off, 7 def), AST: 8, TO: 1
TEAM FOULS: 2

================================================================================

================================================================================
                       4TH QUARTER - Team_002 vs Team_071                       
================================================================================

[12:00] Team_002 possession (Score: 85-83)
FOUL! Reach-in foul on Dejounte Paul during the drive. [Team fouls: 1] No free throws, side out. (Dejounte Paul: 1 personal fouls)

[11:47] Team_002 possession (Score: 85-83)
Jordan Green makes the Midrange and draws the foul on Bam Iverson! And-1! Jordan Green to the line for 1. [Team fouls: 2] (Bam Iverson: 1 personal fouls)   FT 1/1: GOOD Jordan Green makes 1/1 from the line.
Score: 88-83

[11:37] Team_071 possession (Score: 88-83)
Victor Anunoby attempts a 3Pt. Contested by CJ Barrett (6.0 feet, MAN). VICTOR ANUNOBY MAKES IT! Assist: Allen Williamson
Score: 88-86

[11:20] Team_002 possession (Score: 88-86)
Carmelo Lowry attempts a Layup. Contested by Dejounte Paul (3.7 feet, ZONE). CARMELO LOWRY MAKES IT! Assist: CJ Barrett
Score: 90-86

[11:08] Team_071 possession (Score: 90-86)
FOUL! Reach-in foul on Tyler Porzingis during the drive. [Team fouls: 1] No free throws, side out. (Tyler Porzingis: 1 personal fouls)

[10:52] Team_071 possession (Score: 90-86)
Allen Williamson attempts a 3Pt. Contested by Miles Bane (3.3 feet, MAN). Allen Williamson misses. Rebound secured by Tyler Porzingis.

[10:38] Team_002 possession (Score: 90-86)
Miles Bane drives to the basket... Miles Bane throws a bad pass out of bounds! TURNOVER! (dead ball)

[10:38] Substitution (Team_002): Miles Bane OUT → John Duncan IN (stamina_rule2)

[10:38] Substitution (Team_002): CJ Barrett OUT → Dirk Middleton IN (stamina_rule2)

[10:38] Substitution (Team_002): Jordan Green OUT → Anfernee Sexton IN (stamina_rule2)

[10:38] Substitution (Team_002): Carmelo Lowry OUT → Julius Curry IN (stamina_rule2)

[10:38] Substitution (Team_002): Tyler Porzingis OUT → Lamelo O'Neal IN (stamina_rule2)

[10:38] Substitution (Team_071): Allen Williamson OUT → Evan Sexton IN (stamina_rule2)

[10:38] Substitution (Team_071): Victor Anunoby OUT → Paul Ball IN (stamina_rule2)

[10:38] Substitution (Team_071): Bam Iverson OUT → Immanuel Ginobili IN (stamina_rule2)

[10:38] Substitution (Team_071): Jimmy Simons OUT → Jordan Durant IN (stamina_rule2)

[10:38] Substitution (Team_071): Dejounte Paul OUT → Tyrese Brogdon IN (stamina_rule2)

[10:23] Team_071 possession (Score: 90-86)
Paul Ball attempts a Layup. Wide open! Dirk Middleton is 7.0 feet away. [MAN] PAUL BALL MAKES IT! Assist: Evan Sexton
Score: 90-88

[10:09] Team_002 possession (Score: 90-88)
Julius Curry drives, Tyrese Brogdon stays with him. Julius Curry attempts a Dunk. Contested by Tyrese Brogdon (2.4 feet, ZONE). JULIUS CURRY MAKES IT!
Score: 92-88

[09:56] Team_071 possession (Score: 92-88)
Immanuel Ginobili attempts a 3Pt. Contested by Julius Curry (5.1 feet, ZONE). Immanuel Ginobili misses. Rebound secured by Lamelo O'Neal.

[09:42] Team_002 possession (Score: 92-88)
John Duncan attempts a 3Pt. Contested by Paul Ball (2.3 feet, ZONE). John Duncan misses. Rebound secured by Immanuel Ginobili.

[09:28] Team_071 possession (Score: 92-88)
Tyrese Brogdon drives and kicks out. Evan Sexton attempts a 3Pt. Contested by Julius Curry (3.6 feet, ZONE). EVAN SEXTON MAKES IT! Assist: Tyrese Brogdon
Score: 92-91

[09:14] Team_002 possession (Score: 92-91)
John Duncan attempts a Midrange. Contested by Evan Sexton (2.4 feet, MAN). JOHN DUNCAN MAKES IT!
Score: 94-91

[09:00] Team_071 possession (Score: 94-91)
Jordan Durant attempts a Midrange. Contested by Dirk Middleton (3.2 feet, ZONE). Jordan Durant misses. Offensive rebound by Immanuel Ginobili! Immanuel Ginobili kicks it out.

[08:44] Team_071 possession (Score: 94-91)
Jordan Durant attempts a Midrange. Contested by Lamelo O'Neal (2.0 feet, MAN). Jordan Durant misses. FOUL! Loose ball foul on Anfernee Sexton during the rebound battle. [Team fouls: 2] No free throws, side out. (Anfernee Sexton: 1 personal fouls)

[08:31] Team_071 possession (Score: 94-91)
Immanuel Ginobili attempts a 3Pt. Contested by Julius Curry (3.1 feet, ZONE). IMMANUEL GINOBILI MAKES IT! Assist: Evan Sexton
Score: 94-94

[08:15] Team_002 possession (Score: 94-94)
FOUL! Shooting foul on Tyrese Brogdon. Lamelo O'Neal to the line for 2 free throws. [Team fouls: 3] (Tyrese Brogdon: 1 personal fouls)   FT 1/2: GOOD   FT 2/2: GOOD Lamelo O'Neal makes 2/2 from the line.
Score: 96-94

[08:00] Team_071 possession (Score: 96-94)
Paul Ball attempts a 3Pt. Contested by Julius Curry (5.9 feet, ZONE). Paul Ball misses. Rebound secured by Lamelo O'Neal.

[07:46] Team_002 possession (Score: 96-94)
Lamelo O'Neal drives, Tyrese Brogdon stays with him. Lamelo O'Neal attempts a Layup. Wide open! Tyrese Brogdon is 6.8 feet away. [MAN] LAMELO O'NEAL MAKES IT! Assist: Dirk Middleton
Score: 98-94

[07:31] Team_071 possession (Score: 98-94)
Tyrese Brogdon drives, picks up Lamelo O'Neal. Help arrives from John Duncan! Tyrese Brogdon attempts a Layup. Contested by John Duncan (2.1 feet, MAN). Tyrese Brogdon misses. Rebound secured by Anfernee Sexton.

[07:21] Team_002 possession (Score: 98-94)
Julius Curry makes the Layup and draws the foul on Tyrese Brogdon! And-1! Julius Curry to the line for 1. [Team fouls: 4] (Tyrese Brogdon: 2 personal fouls)   FT 1/1: GOOD Julius Curry makes 1/1 from the line.
Score: 101-94

[07:05] Team_071 possession (Score: 101-94)
Evan Sexton attempts a 3Pt. Wide open! John Duncan is 9.4 feet away. [MAN] EVAN SEXTON MAKES IT! Assist: Paul Ball
Score: 101-97

[06:52] Team_002 possession (Score: 101-97)
Anfernee Sexton attempts a 3Pt. Contested by Paul Ball (4.7 feet, ZONE). Anfernee Sexton misses. Rebound secured by Evan Sexton.

[06:33] Team_071 possession (Score: 101-97)
Paul Ball attempts a Midrange. Wide open! Julius Curry is 6.1 feet away. [ZONE] Paul Ball misses. Offensive rebound by Jordan Durant! Jordan Durant kicks it out.

[06:19] Team_071 possession (Score: 101-97)
Paul Ball attempts a 3Pt. Contested by Julius Curry (5.4 feet, ZONE). Paul Ball misses. Rebound secured by Lamelo O'Neal.

[06:05] Team_002 possession (Score: 101-97)
Julius Curry attempts a 3Pt. Wide open! Paul Ball is 8.9 feet away. [ZONE] Julius Curry misses. Rebound secured by Jordan Durant.

[05:50] Team_071 possession (Score: 101-97)
FOUL! Shooting foul on Lamelo O'Neal. Tyrese Brogdon to the line for 2 free throws. [Team fouls: 3] (Lamelo O'Neal: 1 personal fouls)   FT 1/2: GOOD   FT 2/2: MISS Tyrese Brogdon makes 1/2 from the line. Rebound secured by Anfernee Sexton.
Score: 101-98

[05:35] Team_002 possession (Score: 101-98)
Dirk Middleton attempts a Midrange. Wide open! Paul Ball is 6.6 feet away. [ZONE] Dirk Middleton misses. Offensive rebound by Anfernee Sexton! Anfernee Sexton kicks it out.

[05:24] Team_002 possession (Score: 101-98)
Lamelo O'Neal attempts a Midrange. Contested by Tyrese Brogdon (5.3 feet, MAN). Lamelo O'Neal misses. Rebound secured by Evan Sexton.

[05:09] Team_071 possession (Score: 101-98)
Immanuel Ginobili drives to the basket... Immanuel Ginobili throws a bad pass out of bounds! TURNOVER! (dead ball)

[04:56] Team_002 possession (Score: 101-98)
Julius Curry attempts a Layup. Wide open! Jordan Durant is 9.2 feet away. [MAN] JULIUS CURRY MAKES IT!
Score: 103-98

[04:41] Team_071 possession (Score: 103-98)
Immanuel Ginobili makes the Dunk and draws the foul on Lamelo O'Neal! And-1! Immanuel Ginobili to the line for 1. [Team fouls: 4] (Lamelo O'Neal: 2 personal fouls)   FT 1/1: GOOD Immanuel Ginobili makes 1/1 from the line.
Score: 103-101

[04:25] Team_002 possession (Score: 103-101)
John Duncan drives, picks up Tyrese Brogdon. Help arrives from Evan Sexton! John Duncan attempts a Layup. Wide open! Evan Sexton is 6.4 feet away. [ZONE] JOHN DUNCAN MAKES IT! Assist: Lamelo O'Neal
Score: 105-101

[04:12] Team_071 possession (Score: 105-101)
Evan Sexton attempts a Layup. Contested by Lamelo O'Neal (3.1 feet, ZONE). Evan Sexton misses. Rebound secured by Julius Curry.

[03:56] Team_002 possession (Score: 105-101)
Lamelo O'Neal attempts a 3Pt. Contested by Jordan Durant (3.7 feet, ZONE). Lamelo O'Neal misses. Rebound secured by Jordan Durant.

[03:44] Team_071 possession (Score: 105-101)
Tyrese Brogdon attempts a Layup. Contested by Lamelo O'Neal (4.8 feet, MAN). Tyrese Brogdon misses. Rebound secured by Lamelo O'Neal.

[03:24] Team_002 possession (Score: 105-101)
Dirk Middleton makes the Midrange and draws the foul on Paul Ball! And-1! Dirk Middleton to the line for 1. [BONUS: 5 team fouls] (Paul Ball: 1 personal fouls)   FT 1/1: GOOD Dirk Middleton makes 1/1 from the line.
Score: 108-101

[03:09] Team_071 possession (Score: 108-101)
Tyrese Brogdon drives and kicks out. Immanuel Ginobili attempts a Midrange. Contested by Anfernee Sexton (4.4 feet, ZONE). IMMANUEL GINOBILI MAKES IT! Assist: Paul Ball
Score: 108-103

[02:57] Team_002 possession (Score: 108-103)
FOUL! Holding foul on Paul Ball. [IN THE BONUS! 6 team fouls] Dirk Middleton to the line for 2 free throws. (Paul Ball: 2 personal fouls)   FT 1/2: MISS   FT 2/2: GOOD Dirk Middleton makes 1/2 from the line.
Score: 109-103

[02:39] Team_071 possession (Score: 109-103)
Immanuel Ginobili attempts a 3Pt. Contested by Anfernee Sexton (4.3 feet, MAN). Immanuel Ginobili misses. Rebound secured by Lamelo O'Neal.

[02:26] Team_002 possession (Score: 109-103)
Dirk Middleton attempts a 3Pt. Contested by Paul Ball (3.9 feet, MAN). Dirk Middleton misses. Rebound secured by Immanuel Ginobili.

[02:09] Team_071 possession (Score: 109-103)
Tyrese Brogdon attempts a Midrange. Contested by Lamelo O'Neal (5.2 feet, MAN). Tyrese Brogdon misses. Rebound secured by Julius Curry.

[01:58] Team_002 possession (Score: 109-103)
Lamelo O'Neal attempts a Layup. Wide open! Tyrese Brogdon is 7.9 feet away. [ZONE] LAMELO O'NEAL MAKES IT!
Score: 111-103

[01:43] Team_071 possession (Score: 111-103)
Paul Ball drives to the basket... FOUL! Offensive foul on Paul Ball! Lamelo O'Neal drew the charge! [Team fouls: 7] (Paul Ball: 3 personal fouls) TURNOVER! (dead ball)

[01:28] Team_002 possession (Score: 111-103)
Lamelo O'Neal drives to the basket... Lamelo O'Neal commits a violation (traveling/carry)! TURNOVER! (dead ball)

[01:12] Team_071 possession (Score: 111-103)
Tyrese Brogdon attempts a Layup. Heavily contested by Lamelo O'Neal (0.5 feet, MAN)! Tyrese Brogdon misses. Rebound secured by Anfernee Sexton.

[00:58] Team_002 possession (Score: 111-103)
Julius Curry drives to the basket... FOUL! Offensive foul on Julius Curry! Jordan Durant drew the charge! [Team fouls: 5] (Julius Curry: 1 personal fouls) TURNOVER! (dead ball)

[00:47] Team_071 possession (Score: 111-103)
Jordan Durant attempts a Midrange. Contested by Anfernee Sexton (3.9 feet, ZONE). Jordan Durant misses. Rebound secured by Lamelo O'Neal.

[00:33] Team_002 possession (Score: 111-103)
Anfernee Sexton attempts a 3Pt. Wide open! Immanuel Ginobili is 6.5 feet away. [MAN] Anfernee Sexton misses. Rebound secured by Immanuel Ginobili.

[00:19] Team_071 possession (Score: 111-103)
FOUL! Offensive foul on Immanuel Ginobili! Anfernee Sexton drew the charge! [Team fouls: 8] (Immanuel Ginobili: 1 personal fouls) TURNOVER! (dead ball)

[00:05] Team_002 possession (Score: 111-103)
John Duncan attempts a 3Pt. Wide open! Paul Ball is 6.6 feet away. [ZONE] John Duncan misses. Rebound secured by Evan Sexton.

================================================================================
                              4TH QUARTER COMPLETE                              
================================================================================

4TH QUARTER SCORE: Team_002 26, Team_071 20

BOX SCORE:
================================================================================

Team_002
--------------------------------------------------------------------------------
Player                MIN  PTS  REB  AST  TO      FG   FG%      3P   3P%
--------------------------------------------------------------------------------
Julius Curry           22    7    2    0   0   3/4    75.0     0/0   0.0
Lamelo O'Neal          22    6    6    1   0   3/5    60.0     0/0   0.0
John Duncan            22    4    0    0   0   2/4    50.0     0/0   0.0
Dirk Middleton         22    4    0    1   0   2/3    66.7     0/0   0.0
Jordan Green           27    3    0    0   0   1/1   100.0     0/0   0.0
Carmelo Lowry          27    2    0    0   0   1/1   100.0     0/0   0.0
CJ Barrett             27    0    0    1   0   0/0     0.0     0/0   0.0
Tyler Porzingis        27    0    1    0   0   0/0     0.0     0/0   0.0
Anfernee Sexton        22    0    4    0   0   0/2     0.0     0/0   0.0

TEAM: FG: 12/20 (60.0%), 3PT: 0/7 (0.0%), REB: 13 (1 off, 12 def), AST: 3, TO: 3
TEAM FOULS: 5 [Team_071 in BONUS]


Team_071
--------------------------------------------------------------------------------
Player                MIN  PTS  REB  AST  TO      FG   FG%      3P   3P%
--------------------------------------------------------------------------------
Immanuel Ginobili      22    8    4    0   0   3/5    60.0     0/0   0.0
Evan Sexton            22    6    3    2   0   2/3    66.7     0/0   0.0
Victor Anunoby         27    3    0    0   0   1/1   100.0     0/0   0.0
Paul Ball              22    2    0    2   0   1/3    33.3     0/0   0.0
Allen Williamson       27    0    0    1   0   0/1     0.0     0/0   0.0
Tyrese Brogdon         22    0    0    1   0   0/5     0.0     0/0   0.0
Jordan Durant          22    0    4    0   0   0/1     0.0     0/0   0.0

TEAM: FG: 7/19 (36.8%), 3PT: 3/8 (37.5%), REB: 11 (3 off, 8 def), AST: 6, TO: 3
TEAM FOULS: 8 [Team_002 in BONUS]

================================================================================

================================================================================
                               FULL GAME COMPLETE                               
================================================================================

FINAL SCORE: Team_002 111, Team_071 103

SCORING BY QUARTER:
--------------------------------------------------------------------------------
Team                     Q1     Q2     Q3     Q4    FINAL
--------------------------------------------------------------------------------
Team_002                 21     39     25     26      111
Team_071                 23     34     26     20      103
--------------------------------------------------------------------------------

FULL GAME BOX SCORE:
================================================================================

Team_002
--------------------------------------------------------------------------------
Player                MIN  PTS  REB  AST  TO      FG   FG%      3P   3P%      FT STL BLK
--------------------------------------------------------------------------------
Miles Bane             27   15    5    4   2   5/7    71.4   1/2    50.0   4/4     0   0
CJ Barrett             27    5    0    2   1   2/7    28.6   1/6    16.7   0/0     0   1
Jordan Green           27   14    0    2   0   7/12   58.3   1/4    25.0   1/1     0   0
Carmelo Lowry          27   14    9    0   3   4/5    80.0   1/1   100.0   5/5     1   0
Tyler Porzingis        27    6    8    3   0   4/7    57.1   0/0     0.0   0/0     0   1
John Duncan            22   14    0    2   0   6/8    75.0   1/3    33.3   0/0     0   0
Dirk Middleton         22   12    0    2   3   3/5    60.0   0/1     0.0   3/4     0   0
Anfernee Sexton        22    4    5    3   1   2/6    33.3   0/4     0.0   0/0     0   1
Julius Curry           22   21    5    1   1   9/10   90.0   1/2    50.0   4/4     0   0
Lamelo O'Neal          22    6    9    3   1   3/6    50.0   0/1     0.0   2/2     0   0

TEAM: FG: 47/75 (62.7%), 3PT: 6/24 (25.0%), REB: 42 (8 off, 34 def), AST: 22, TO: 12


Team_071
--------------------------------------------------------------------------------
Player                MIN  PTS  REB  AST  TO      FG   FG%      3P   3P%      FT STL BLK
--------------------------------------------------------------------------------
Allen Williamson       27   16    0    4   0   6/7    85.7   4/5    80.0   0/0     0   1
Victor Anunoby         27    6    0    1   0   3/8    37.5   1/4    25.0   1/2     0   0
Bam Iverson            27   11    9    4   0   5/7    71.4   1/1   100.0   0/0     0   0
Jimmy Simons           27   10    7    1   0   4/11   36.4   2/4    50.0   2/2     1   0
Dejounte Paul          27    9    8    5   3   4/6    66.7   0/1     0.0   1/1     0   0
Evan Sexton            22   18    4    4   0   5/6    83.3   2/2   100.0   5/5     0   1
Paul Ball              22    5    0    3   2   2/7    28.6   0/4     0.0   1/1     2   0
Immanuel Ginobili      22   20    6    0   3   6/9    66.7   4/6    66.7   1/1     0   0
Jordan Durant          22    4    6    0   1   3/4    75.0   0/0     0.0   0/0     0   0
Tyrese Brogdon         22    2    0    5   0   3/11   27.3   0/0     0.0   2/4     0   0

TEAM: FG: 41/76 (53.9%), 3PT: 14/27 (51.9%), REB: 39 (12 off, 27 def), AST: 27, TO: 9

================================================================================
