================================================================================
                        FULL GAME - Team_004 vs Team_062                        
================================================================================

================================================================================
                       1ST QUARTER - Team_004 vs Team_062                       
================================================================================

[12:00] Team_004 possession (Score: 0-0)
Michael Curry attempts a 3Pt. Contested by RJ Williamson (5.2 feet, ZONE). MICHAEL CURRY MAKES IT! Assist: Draymond Fox
Score: 3-0

[11:47] Team_062 possession (Score: 3-0)
Chris Bird attempts a Midrange. Wide open! Michael Curry is 6.9 feet away. [MAN] Chris Bird misses. Rebound secured by Draymond Fox.

[11:29] Team_004 possession (Score: 3-0)
Anthony Lillard drives to the basket... FOUL! Offensive foul on Anthony Lillard! Jalen Reaves drew the charge! [Team fouls: 1] (Anthony Lillard: 1 personal fouls) TURNOVER! (dead ball)

[11:14] Team_062 possession (Score: 3-0)
Jalen Reaves attempts a Midrange. Contested by Anthony Lillard (3.5 feet, MAN). Jalen Reaves misses. Offensive rebound by Jalen Reaves! Jalen Reaves puts it back in!
Score: 3-2

[10:58] Team_004 possession (Score: 3-2)
Dwyane Irving drives and kicks out. Michael Curry attempts a Midrange. Contested by Michael Hyland (4.4 feet, ZONE). MICHAEL CURRY MAKES IT!
Score: 5-2

[10:47] Team_062 possession (Score: 5-2)
Michael Hyland attempts a Layup. Contested by Anthony Lillard (3.4 feet, ZONE). Michael Hyland misses. Rebound secured by Draymond Fox.

[10:32] Team_004 possession (Score: 5-2)
FOUL! Shooting foul on Kawhi Thompson. Draymond Fox to the line for 2 free throws. [Team fouls: 1] (Kawhi Thompson: 1 personal fouls)   FT 1/2: GOOD   FT 2/2: GOOD Draymond Fox makes 2/2 from the line.
Score: 7-2

[10:23] Team_062 possession (Score: 7-2)
Michael Hyland drives, Anthony Lillard stays with him. Michael Hyland attempts a Dunk. Wide open! Anthony Lillard is 6.1 feet away. [ZONE] MICHAEL HYLAND MAKES IT! Assist: Jalen Reaves
Score: 7-4

[10:08] Team_004 possession (Score: 7-4)
Dwyane Irving drives to the basket... Dwyane Irving throws a bad pass out of bounds! TURNOVER! (dead ball)

[09:54] Team_062 possession (Score: 7-4)
Kawhi Thompson makes the Layup and draws the foul on Anthony Lillard! And-1! Kawhi Thompson to the line for 1. [Team fouls: 2] (Anthony Lillard: 2 personal fouls)   FT 1/1: GOOD Kawhi Thompson makes 1/1 from the line.
Score: 7-7

[09:39] Team_004 possession (Score: 7-7)
Dwyane Irving attempts a Layup. Wide open! Jalen Reaves is 7.8 feet away. [ZONE] DWYANE IRVING MAKES IT! Assist: Jabari Wade
Score: 9-7

[09:22] Team_062 possession (Score: 9-7)
RJ Williamson drives, Anthony Lillard stays with him. RJ Williamson attempts a Layup. Contested by Anthony Lillard (2.8 feet, ZONE). RJ Williamson misses. Rebound secured by Dwyane Irving.

[09:07] Team_004 possession (Score: 9-7)
Draymond Fox attempts a Layup. Contested by Jalen Reaves (2.3 feet, ZONE). DRAYMOND FOX MAKES IT!
Score: 11-7

[08:50] Team_062 possession (Score: 11-7)
Kawhi Thompson drives and kicks out. Michael Hyland attempts a 3Pt. Contested by Dwyane Irving (4.3 feet, MAN). MICHAEL HYLAND MAKES IT! Assist: RJ Williamson
Score: 11-10

[08:35] Team_004 possession (Score: 11-10)
Michael Curry attempts a 3Pt. Contested by RJ Williamson (3.0 feet, ZONE). Michael Curry misses. Rebound secured by Michael Hyland.

[08:22] Team_062 possession (Score: 11-10)
Michael Hyland drives and kicks out. Chris Bird attempts a Midrange. Contested by Michael Curry (5.8 feet, MAN). Chris Bird misses. Rebound secured by Dwyane Irving.

[08:09] Team_004 possession (Score: 11-10)
FOUL! Offensive foul on Jabari Wade! RJ Williamson drew the charge! [Team fouls: 3] (Jabari Wade: 1 personal fouls) TURNOVER! (dead ball)

[07:56] Team_062 possession (Score: 11-10)
Kawhi Thompson drives, Draymond Fox stays with him. Kawhi Thompson attempts a Dunk. Contested by Draymond Fox (3.9 feet, MAN). KAWHI THOMPSON MAKES IT! Assist: Chris Bird
Score: 11-12

[07:43] Team_004 possession (Score: 11-12)
Anthony Lillard drives, Jalen Reaves stays with him. Anthony Lillard attempts a Layup. Contested by Jalen Reaves (4.3 feet, ZONE). ANTHONY LILLARD MAKES IT! Assist: Jabari Wade
Score: 13-12

[07:25] Team_062 possession (Score: 13-12)
Michael Hyland makes the Midrange and draws the foul on Dwyane Irving! And-1! Michael Hyland to the line for 1. [Team fouls: 4] (Dwyane Irving: 1 personal fouls)   FT 1/1: GOOD Michael Hyland makes 1/1 from the line.
Score: 13-15

[07:10] Team_004 possession (Score: 13-15)
Anthony Lillard attempts a Layup. Contested by Jalen Reaves (5.6 feet, MAN). Anthony Lillard misses. Rebound secured by Jalen Reaves.

[06:55] Team_062 possession (Score: 13-15)
Michael Hyland attempts a 3Pt. Contested by Dwyane Irving (2.9 feet, MAN). MICHAEL HYLAND MAKES IT! Assist: RJ Williamson
Score: 13-18

[06:39] Team_004 possession (Score: 13-18)
Michael Curry attempts a 3Pt. Heavily contested by RJ Williamson (1.7 feet, ZONE)! Michael Curry misses. Offensive rebound by Anthony Lillard! Anthony Lillard kicks it out.

[06:26] Team_004 possession (Score: 13-18)
Draymond Fox drives to the basket... Draymond Fox loses control! Ball rolls out of bounds! TURNOVER! (dead ball)

[06:15] Team_062 possession (Score: 13-18)
Michael Hyland attempts a Midrange. Wide open! Michael Curry is 6.4 feet away. [ZONE] MICHAEL HYLAND MAKES IT! Assist: Jalen Reaves
Score: 13-20

[06:02] Team_004 possession (Score: 13-20)
Dwyane Irving attempts a 3Pt. Contested by RJ Williamson (2.5 feet, ZONE). DWYANE IRVING MAKES IT! Assist: Jabari Wade
Score: 16-20

[05:47] Team_062 possession (Score: 16-20)
Kawhi Thompson drives to the basket... FOUL! Offensive foul on Kawhi Thompson! Anthony Lillard drew the charge! [Team fouls: 2] (Kawhi Thompson: 2 personal fouls) TURNOVER! (dead ball)

[05:28] Team_004 possession (Score: 16-20)
Anthony Lillard attempts a Midrange. Wide open! Kawhi Thompson is 6.7 feet away. [ZONE] ANTHONY LILLARD MAKES IT!
Score: 18-20

[05:16] Team_062 possession (Score: 18-20)
Jalen Reaves drives and kicks out. Kawhi Thompson attempts a 3Pt. Contested by Michael Curry (3.2 feet, ZONE). KAWHI THOMPSON MAKES IT! Assist: Michael Hyland
Score: 18-23

[04:59] Team_004 possession (Score: 18-23)
Jabari Wade attempts a 3Pt. Contested by RJ Williamson (5.5 feet, ZONE). Jabari Wade misses. Rebound secured by Kawhi Thompson.

[04:47] Team_062 possession (Score: 18-23)
Kawhi Thompson attempts a 3Pt. Contested by Draymond Fox (3.4 feet, MAN). KAWHI THOMPSON MAKES IT! Assist: RJ Williamson
Score: 18-26

[04:32] Team_004 possession (Score: 18-26)
Anthony Lillard attempts a Midrange. Wide open! Michael Hyland is 6.6 feet away. [ZONE] ANTHONY LILLARD MAKES IT! Assist: Jabari Wade
Score: 20-26

[04:17] Team_062 possession (Score: 20-26)
Jalen Reaves drives to the basket... Jalen Reaves throws a bad pass! Stolen by Anthony Lillard! TURNOVER! (live ball)

[04:01] Team_004 possession (Score: 20-26)
Anthony Lillard drives to the basket... Anthony Lillard loses the ball! Stripped by Jalen Reaves! TURNOVER! (live ball)

[03:46] Team_062 possession (Score: 20-26)
Jalen Reaves attempts a Midrange. Contested by Dwyane Irving (2.6 feet, ZONE). Jalen Reaves misses. Rebound secured by Dwyane Irving.

[03:29] Team_004 possession (Score: 20-26)
Dwyane Irving attempts a 3Pt. Wide open! RJ Williamson is 6.5 feet away. [ZONE] DWYANE IRVING MAKES IT! Assist: Jabari Wade
Score: 23-26

[03:13] Team_062 possession (Score: 23-26)
FOUL! Shooting foul on Dwyane Irving. Michael Hyland to the line for 3 free throws. [BONUS: 5 team fouls] (Dwyane Irving: 2 personal fouls)   FT 1/3: GOOD   FT 2/3: MISS   FT 3/3: GOOD Michael Hyland makes 2/3 from the line.
Score: 23-28

[02:56] Team_004 possession (Score: 23-28)
Dwyane Irving attempts a Midrange. Wide open! Kawhi Thompson is 6.6 feet away. [ZONE] Dwyane Irving misses. Rebound secured by Jalen Reaves.

[02:43] Team_062 possession (Score: 23-28)
FOUL! Holding foul on Dwyane Irving. [IN THE BONUS! 6 team fouls] Michael Hyland to the line for 2 free throws. (Dwyane Irving: 3 personal fouls)   FT 1/2: MISS   FT 2/2: GOOD Michael Hyland makes 1/2 from the line.
Score: 23-29

[02:31] Team_004 possession (Score: 23-29)
FOUL! Shooting foul on RJ Williamson. Anthony Lillard to the line for 2 free throws. [Team fouls: 3] (RJ Williamson: 1 personal fouls)   FT 1/2: MISS   FT 2/2: GOOD Anthony Lillard makes 1/2 from the line.
Score: 24-29

[02:16] Team_062 possession (Score: 24-29)
Chris Bird drives to the basket... Chris Bird loses the ball! Stripped by Michael Curry! TURNOVER! (live ball)

[02:05] Team_004 possession (Score: 24-29)
Draymond Fox attempts a Midrange. Wide open! Kawhi Thompson is 6.2 feet away. [MAN] Draymond Fox misses. Rebound secured by Jalen Reaves.

[01:53] Team_062 possession (Score: 24-29)
RJ Williamson drives to the basket... RJ Williamson throws a bad pass! Stolen by Jabari Wade! TURNOVER! (live ball)

[01:37] Team_004 possession (Score: 24-29)
Dwyane Irving attempts a 3Pt. Contested by Michael Hyland (2.6 feet, MAN). Dwyane Irving misses. Offensive rebound by Anthony Lillard! Anthony Lillard kicks it out.

[01:26] Team_004 possession (Score: 24-29)
Draymond Fox attempts a Layup. Contested by Jalen Reaves (4.4 feet, ZONE). DRAYMOND FOX MAKES IT!
Score: 26-29

[01:12] Team_062 possession (Score: 26-29)
RJ Williamson attempts a 3Pt. Wide open! Michael Curry is 7.0 feet away. [ZONE] RJ Williamson misses. Rebound secured by Dwyane Irving.

[00:59] Team_004 possession (Score: 26-29)
Dwyane Irving attempts a 3Pt. Wide open! Michael Hyland is 8.0 feet away. [MAN] Dwyane Irving misses. Offensive rebound by Dwyane Irving! Dwyane Irving kicks it out.

[00:44] Team_004 possession (Score: 26-29)
Draymond Fox drives, picks up Jalen Reaves. Help arrives from Chris Bird! Draymond Fox attempts a Layup. Wide open! Chris Bird is 7.1 feet away. [ZONE] Draymond Fox misses. FOUL! Loose ball foul on Jalen Reaves during the rebound battle. [Team fouls: 4] No free throws, side out. (Jalen Reaves: 1 personal fouls)

[00:29] Team_004 possession (Score: 26-29)
Draymond Fox attempts a Midrange. Contested by Kawhi Thompson (5.3 feet, MAN). Draymond Fox misses. Offensive rebound by Anthony Lillard! Anthony Lillard kicks it out.

[00:15] Team_004 possession (Score: 26-29)
Jabari Wade drives, picks up Jalen Reaves. Help arrives from Chris Bird! Jabari Wade attempts a Layup. Contested by Chris Bird (4.4 feet, ZONE). JABARI WADE MAKES IT!
Score: 28-29

================================================================================
                              1ST QUARTER COMPLETE                              
================================================================================

1ST QUARTER SCORE: Team_004 28, Team_062 29

BOX SCORE:
================================================================================

Team_004
--------------------------------------------------------------------------------
Player                MIN  PTS  REB  AST  TO      FG   FG%      3P   3P%
--------------------------------------------------------------------------------
Dwyane Irving          12    8    6    0   0   3/4    75.0     0/0   0.0
Anthony Lillard        12    7    3    0   0   4/5    80.0     0/0   0.0
Draymond Fox           12    6    2    1   0   3/4    75.0     0/0   0.0
Michael Curry          12    5    0    0   0   2/3    66.7     0/0   0.0
Jabari Wade            12    2    0    5   0   1/2    50.0     0/0   0.0

TEAM: FG: 13/18 (72.2%), 3PT: 3/5 (60.0%), REB: 11 (5 off, 6 def), AST: 6, TO: 5
TEAM FOULS: 6 [Team_062 in BONUS]


Team_062
--------------------------------------------------------------------------------
Player                MIN  PTS  REB  AST  TO      FG   FG%      3P   3P%
--------------------------------------------------------------------------------
Michael Hyland         12   16    1    1   0   7/9    77.8     0/0   0.0
Kawhi Thompson         12   11    1    0   0   4/4   100.0     0/0   0.0
Jalen Reaves           12    2    4    2   0   1/2    50.0     0/0   0.0
Chris Bird             12    0    0    1   0   0/1     0.0     0/0   0.0
RJ Williamson          12    0    0    3   0   0/2     0.0     0/0   0.0

TEAM: FG: 12/18 (66.7%), 3PT: 3/4 (75.0%), REB: 6 (1 off, 5 def), AST: 7, TO: 4
TEAM FOULS: 4

================================================================================

================================================================================
                       2ND QUARTER - Team_004 vs Team_062                       
================================================================================

[12:00] Team_004 possession (Score: 28-29)
Draymond Fox drives and kicks out. Anthony Lillard attempts a Midrange. Wide open! Jalen Reaves is 8.4 feet away. [MAN] Anthony Lillard misses. FOUL! Loose ball foul on Jalen Reaves during the rebound battle. [Team fouls: 1] No free throws, side out. (Jalen Reaves: 1 personal fouls)

[11:45] Team_004 possession (Score: 28-29)
Draymond Fox attempts a Layup. BLOCKED BY KAWHI THOMPSON! Ball is loose! Rebound secured by Michael Hyland.

[11:34] Team_062 possession (Score: 28-29)
Jalen Reaves attempts a Layup. Heavily contested by Anthony Lillard (1.4 feet, MAN)! Jalen Reaves misses. Offensive rebound by Kawhi Thompson! Kawhi Thompson kicks it out.

[11:25] Team_062 possession (Score: 28-29)
Jalen Reaves attempts a 3Pt. Wide open! Michael Curry is 7.7 feet away. [ZONE] Jalen Reaves misses. Rebound secured by Anthony Lillard.

[11:10] Team_004 possession (Score: 28-29)
Draymond Fox attempts a 3Pt. Contested by RJ Williamson (3.9 feet, ZONE). Draymond Fox misses. FOUL! Loose ball foul on Michael Hyland during the rebound battle. [Team fouls: 2] No free throws, side out. (Michael Hyland: 1 personal fouls)

[10:57] Team_004 possession (Score: 28-29)
Draymond Fox makes the Layup and draws the foul on Jalen Reaves! And-1! Draymond Fox to the line for 1. [Team fouls: 3] (Jalen Reaves: 2 personal fouls)   FT 1/1: GOOD Draymond Fox makes 1/1 from the line.
Score: 31-29

[10:43] Team_062 possession (Score: 31-29)
RJ Williamson attempts a 3Pt. Wide open! Michael Curry is 7.7 feet away. [ZONE] RJ WILLIAMSON MAKES IT! Assist: Kawhi Thompson
Score: 31-32

[10:27] Team_004 possession (Score: 31-32)
Jabari Wade attempts a Layup. Wide open! RJ Williamson is 7.6 feet away. [MAN] JABARI WADE MAKES IT! Assist: Draymond Fox
Score: 33-32

[10:17] Team_062 possession (Score: 33-32)
RJ Williamson drives and kicks out. Jalen Reaves attempts a 3Pt. Wide open! Michael Curry is 7.8 feet away. [ZONE] Jalen Reaves misses. Rebound secured by Anthony Lillard.

[10:04] Team_004 possession (Score: 33-32)
Michael Curry attempts a 3Pt. Contested by Chris Bird (3.3 feet, MAN). Michael Curry misses. Rebound secured by Kawhi Thompson.

[09:52] Team_062 possession (Score: 33-32)
RJ Williamson drives and kicks out. Chris Bird attempts a 3Pt. Wide open! Michael Curry is 7.0 feet away. [MAN] Chris Bird misses. Offensive rebound by Jalen Reaves! Jalen Reaves kicks it out.

[09:42] Team_062 possession (Score: 33-32)
Kawhi Thompson attempts a Layup. Contested by Anthony Lillard (2.6 feet, ZONE). KAWHI THOMPSON MAKES IT! Assist: RJ Williamson
Score: 33-34

[09:32] Team_004 possession (Score: 33-34)
Jabari Wade attempts a Layup. Contested by RJ Williamson (5.2 feet, MAN). JABARI WADE MAKES IT! Assist: Anthony Lillard
Score: 35-34

[09:13] Team_062 possession (Score: 35-34)
Chris Bird attempts a 3Pt. Wide open! Michael Curry is 6.9 feet away. [ZONE] CHRIS BIRD MAKES IT! Assist: Jalen Reaves
Score: 35-37

[08:55] Team_004 possession (Score: 35-37)
Draymond Fox attempts a Midrange. Contested by Kawhi Thompson (5.8 feet, MAN). Draymond Fox misses. Rebound secured by Jalen Reaves.

[08:41] Team_062 possession (Score: 35-37)
Michael Hyland drives and kicks out. Kawhi Thompson attempts a 3Pt. Contested by Draymond Fox (4.4 feet, MAN). Kawhi Thompson misses. Rebound secured by Draymond Fox.

[08:24] Team_004 possession (Score: 35-37)
Draymond Fox attempts a Layup. Wide open! Kawhi Thompson is 6.3 feet away. [MAN] Draymond Fox misses. Offensive rebound by Anthony Lillard! Anthony Lillard kicks it out.

[08:10] Team_004 possession (Score: 35-37)
Anthony Lillard makes the Layup and draws the foul on Jalen Reaves! And-1! Anthony Lillard to the line for 1. [Team fouls: 4] (Jalen Reaves: 3 personal fouls)   FT 1/1: MISS Anthony Lillard makes 0/1 from the line. Rebound secured by Jalen Reaves.
Score: 37-37

[07:55] Team_062 possession (Score: 37-37)
FOUL! Holding foul on Michael Curry. [Team fouls: 1] No free throws, side out. (Michael Curry: 1 personal fouls)

[07:39] Team_062 possession (Score: 37-37)
RJ Williamson drives and kicks out. Michael Hyland attempts a 3Pt. Contested by Dwyane Irving (2.8 feet, MAN). Michael Hyland misses. Rebound secured by Dwyane Irving.

[07:23] Team_004 possession (Score: 37-37)
Michael Curry attempts a Midrange. Contested by RJ Williamson (4.5 feet, ZONE). Michael Curry misses. Rebound secured by Michael Hyland.

[07:09] Team_062 possession (Score: 37-37)
Chris Bird attempts a Midrange. Contested by Michael Curry (4.0 feet, MAN). Chris Bird misses. Offensive rebound by Jalen Reaves! Jalen Reaves kicks it out.

[06:57] Team_062 possession (Score: 37-37)
Michael Hyland makes the Layup and draws the foul on Dwyane Irving! And-1! Michael Hyland to the line for 1. [Team fouls: 2] (Dwyane Irving: 1 personal fouls)   FT 1/1: GOOD Michael Hyland makes 1/1 from the line.
Score: 37-40

[06:46] Team_004 possession (Score: 37-40)
Draymond Fox attempts a Layup. Wide open! Kawhi Thompson is 6.1 feet away. [MAN] DRAYMOND FOX MAKES IT!
Score: 39-40

[06:32] Team_062 possession (Score: 39-40)
Kawhi Thompson drives to the basket... FOUL! Offensive foul on Kawhi Thompson! Draymond Fox drew the charge! [Team fouls: 5] (Kawhi Thompson: 1 personal fouls) TURNOVER! (dead ball)

[06:16] Team_004 possession (Score: 39-40)
Jabari Wade attempts a 3Pt. Contested by RJ Williamson (3.7 feet, ZONE). Jabari Wade misses. Offensive rebound by Dwyane Irving! Dwyane Irving kicks it out.

[06:00] Team_004 possession (Score: 39-40)
Michael Curry attempts a 3Pt. Contested by RJ Williamson (5.4 feet, ZONE). Michael Curry misses. Rebound secured by Jalen Reaves.

[05:44] Team_062 possession (Score: 39-40)
Chris Bird attempts a 3Pt. Contested by Michael Curry (5.1 feet, MAN). CHRIS BIRD MAKES IT! Assist: RJ Williamson
Score: 39-43

[05:31] Team_004 possession (Score: 39-43)
FOUL! Offensive foul on Dwyane Irving! Michael Hyland drew the charge! [Team fouls: 3] (Dwyane Irving: 2 personal fouls) TURNOVER! (dead ball)

[05:17] Team_062 possession (Score: 39-43)
RJ Williamson attempts a 3Pt. Wide open! Michael Curry is 7.5 feet away. [ZONE] RJ WILLIAMSON MAKES IT!
Score: 39-46

[05:01] Team_004 possession (Score: 39-46)
Anthony Lillard drives, picks up Jalen Reaves. Help arrives from Chris Bird! Anthony Lillard attempts a Dunk. Contested by Chris Bird (5.2 feet, MAN). Anthony Lillard misses. Rebound secured by Kawhi Thompson.

[04:46] Team_062 possession (Score: 39-46)
Chris Bird drives and kicks out. Jalen Reaves attempts a 3Pt. Contested by Anthony Lillard (4.0 feet, MAN). JALEN REAVES MAKES IT! Assist: Michael Hyland
Score: 39-49

[04:36] Team_004 possession (Score: 39-49)
Jabari Wade drives and kicks out. Dwyane Irving attempts a Midrange. Contested by Michael Hyland (5.0 feet, ZONE). DWYANE IRVING MAKES IT!
Score: 41-49

[04:21] Team_062 possession (Score: 41-49)
Kawhi Thompson drives to the basket... Kawhi Thompson loses the ball! Stripped by Draymond Fox! TURNOVER! (live ball)

[04:09] Team_004 possession (Score: 41-49)
Michael Curry attempts a Midrange. Contested by Kawhi Thompson (2.1 feet, ZONE). MICHAEL CURRY MAKES IT! Assist: Jabari Wade
Score: 43-49

[03:55] Team_062 possession (Score: 43-49)
Chris Bird drives, picks up Michael Curry. Help arrives from Dwyane Irving! Chris Bird attempts a Layup. Wide open! Dwyane Irving is 7.2 feet away. [MAN] Chris Bird misses. Rebound secured by Dwyane Irving.

[03:42] Team_004 possession (Score: 43-49)
Dwyane Irving attempts a 3Pt. Contested by RJ Williamson (5.9 feet, ZONE). DWYANE IRVING MAKES IT! Assist: Jabari Wade
Score: 46-49

[03:30] Team_062 possession (Score: 46-49)
RJ Williamson drives, picks up Jabari Wade. Help arrives from Dwyane Irving! RJ Williamson attempts a Layup. Contested by Dwyane Irving (5.2 feet, MAN). RJ Williamson misses. Rebound secured by Draymond Fox.

[03:15] Team_004 possession (Score: 46-49)
Draymond Fox attempts a 3Pt. Contested by RJ Williamson (5.8 feet, ZONE). Draymond Fox misses. Rebound secured by Michael Hyland.

[03:03] Team_062 possession (Score: 46-49)
FOUL! Shooting foul on Jabari Wade. Michael Hyland to the line for 2 free throws. [Team fouls: 4] (Jabari Wade: 1 personal fouls)   FT 1/2: GOOD   FT 2/2: GOOD Michael Hyland makes 2/2 from the line.
Score: 46-51

[02:47] Team_004 possession (Score: 46-51)
Anthony Lillard drives, Jalen Reaves stays with him. Anthony Lillard attempts a Layup. Wide open! Jalen Reaves is 8.8 feet away. [ZONE] ANTHONY LILLARD MAKES IT!
Score: 48-51

[02:31] Team_062 possession (Score: 48-51)
Jalen Reaves drives, picks up Anthony Lillard. Help arrives from Jabari Wade! Jalen Reaves attempts a Dunk. Contested by Jabari Wade (4.4 feet, ZONE). Jalen Reaves misses. Rebound secured by Draymond Fox.

[02:15] Team_004 possession (Score: 48-51)
Draymond Fox drives, picks up Kawhi Thompson. Help arrives from Chris Bird! Draymond Fox attempts a Layup. Contested by Chris Bird (5.6 feet, MAN). DRAYMOND FOX MAKES IT! Assist: Jabari Wade
Score: 50-51

[02:04] Team_062 possession (Score: 50-51)
Jalen Reaves attempts a Midrange. Wide open! Anthony Lillard is 8.2 feet away. [MAN] JALEN REAVES MAKES IT! Assist: Chris Bird
Score: 50-53

[01:51] Team_004 possession (Score: 50-53)
Jabari Wade attempts a 3Pt. Contested by RJ Williamson (5.6 feet, ZONE). JABARI WADE MAKES IT! Assist: Dwyane Irving
Score: 53-53

[01:31] Team_062 possession (Score: 53-53)
Michael Hyland attempts a 3Pt. Contested by Michael Curry (5.4 feet, ZONE). Michael Hyland misses. Rebound secured by Dwyane Irving.

[01:17] Team_004 possession (Score: 53-53)
Anthony Lillard attempts a Layup. Wide open! Jalen Reaves is 8.2 feet away. [ZONE] ANTHONY LILLARD MAKES IT!
Score: 55-53

[00:58] Team_062 possession (Score: 55-53)
Michael Hyland loses the ball! Stripped by Dwyane Irving! TURNOVER! (live ball)

[00:41] Team_004 possession (Score: 55-53)
FOUL! Reach-in foul on Michael Hyland during the drive. [IN THE BONUS! 6 team fouls] Dwyane Irving to the line for 2 free throws. (Michael Hyland: 2 personal fouls)   FT 1/2: GOOD   FT 2/2: GOOD Dwyane Irving makes 2/2 from the line.
Score: 57-53

[00:24] Team_062 possession (Score: 57-53)
Chris Bird drives to the basket... Chris Bird throws a bad pass! Stolen by Anthony Lillard! TURNOVER! (live ball)

[00:08] Team_004 possession (Score: 57-53)
Michael Curry attempts a 3Pt. Wide open! RJ Williamson is 7.9 feet away. [ZONE] Michael Curry misses. Rebound secured by Jalen Reaves.

================================================================================
                              2ND QUARTER COMPLETE                              
================================================================================

2ND QUARTER SCORE: Team_004 29, Team_062 24

BOX SCORE:
================================================================================

Team_004
--------------------------------------------------------------------------------
Player                MIN  PTS  REB  AST  TO      FG   FG%      3P   3P%
--------------------------------------------------------------------------------
Dwyane Irving          24    7    5    1   0   3/3   100.0     0/0   0.0
Draymond Fox           24    7    3    1   0   3/6    50.0     0/0   0.0
Jabari Wade            24    7    0    3   0   3/3   100.0     0/0   0.0
Anthony Lillard        24    4    4    1   0   2/4    50.0     0/0   0.0
Michael Curry          24    2    0    0   0   1/5    20.0     0/0   0.0

TEAM: FG: 12/21 (57.1%), 3PT: 2/6 (33.3%), REB: 12 (4 off, 8 def), AST: 6, TO: 1
TEAM FOULS: 4


Team_062
--------------------------------------------------------------------------------
Player                MIN  PTS  REB  AST  TO      FG   FG%      3P   3P%
--------------------------------------------------------------------------------
RJ Williamson          24    6    0    2   0   2/5    40.0     0/0   0.0
Chris Bird             24    6    0    1   0   2/3    66.7     0/0   0.0
Michael Hyland         24    5    3    1   0   2/4    50.0     0/0   0.0
Jalen Reaves           24    5    6    1   0   2/4    50.0     0/0   0.0
Kawhi Thompson         24    2    3    1   0   1/1   100.0     0/0   0.0

TEAM: FG: 9/17 (52.9%), 3PT: 4/6 (66.7%), REB: 12 (3 off, 9 def), AST: 6, TO: 4
TEAM FOULS: 6 [Team_004 in BONUS]

================================================================================

================================================================================
                       3RD QUARTER - Team_004 vs Team_062                       
================================================================================

[12:00] Team_004 possession (Score: 57-53)
Draymond Fox attempts a 3Pt. Contested by RJ Williamson (4.8 feet, ZONE). Draymond Fox misses. Rebound secured by Kawhi Thompson.

[11:45] Team_062 possession (Score: 57-53)
Chris Bird attempts a Midrange. Heavily contested by Michael Curry (0.6 feet, MAN)! Chris Bird misses. Rebound secured by Dwyane Irving.

[11:27] Team_004 possession (Score: 57-53)
Jabari Wade attempts a 3Pt. Wide open! RJ Williamson is 8.9 feet away. [ZONE] JABARI WADE MAKES IT!
Score: 60-53

[11:15] Team_062 possession (Score: 60-53)
RJ Williamson attempts a 3Pt. Wide open! Michael Curry is 6.5 feet away. [ZONE] RJ WILLIAMSON MAKES IT! Assist: Jalen Reaves
Score: 60-56

[11:04] Team_004 possession (Score: 60-56)
Draymond Fox drives and kicks out. Draymond Fox attempts a Midrange. Contested by RJ Williamson (3.5 feet, ZONE). Draymond Fox misses. Rebound secured by Kawhi Thompson.

[10:49] Team_062 possession (Score: 60-56)
FOUL! Holding foul on Anthony Lillard. [Team fouls: 1] No free throws, side out. (Anthony Lillard: 1 personal fouls)

[10:34] Team_062 possession (Score: 60-56)
RJ Williamson throws a bad pass! Stolen by Jabari Wade! TURNOVER! (live ball)

[10:23] Team_004 possession (Score: 60-56)
Draymond Fox attempts a Layup. Wide open! Kawhi Thompson is 9.0 feet away. [MAN] Draymond Fox misses. Rebound secured by Michael Hyland.

[10:10] Team_062 possession (Score: 60-56)
RJ Williamson drives and kicks out. Jalen Reaves attempts a Midrange. Wide open! Anthony Lillard is 6.1 feet away. [MAN] Jalen Reaves misses. Rebound secured by Dwyane Irving.

[09:55] Team_004 possession (Score: 60-56)
Anthony Lillard attempts a 3Pt. Heavily contested by RJ Williamson (1.1 feet, ZONE)! Anthony Lillard misses. Rebound secured by Michael Hyland.

[09:39] Team_062 possession (Score: 60-56)
Kawhi Thompson attempts a Midrange. Wide open! Dwyane Irving is 8.2 feet away. [ZONE] Kawhi Thompson misses. Rebound secured by Dwyane Irving.

[09:27] Team_004 possession (Score: 60-56)
Michael Curry drives and kicks out. Dwyane Irving attempts a Midrange. Contested by Michael Hyland (3.8 feet, MAN). Dwyane Irving misses. Rebound secured by Jalen Reaves.

[09:13] Team_062 possession (Score: 60-56)
Chris Bird throws a bad pass out of bounds! TURNOVER! (dead ball)

[08:55] Team_004 possession (Score: 60-56)
Jabari Wade attempts a 3Pt. Wide open! RJ Williamson is 7.2 feet away. [MAN] Jabari Wade misses. Rebound secured by Jalen Reaves.

[08:43] Team_062 possession (Score: 60-56)
Jalen Reaves attempts a Layup. BLOCKED BY ANTHONY LILLARD! Ball is loose! Rebound secured by Anthony Lillard.

[08:31] Team_004 possession (Score: 60-56)
Dwyane Irving makes the Layup and draws the foul on Kawhi Thompson! And-1! Dwyane Irving to the line for 1. [Team fouls: 1] (Kawhi Thompson: 1 personal fouls)   FT 1/1: MISS Dwyane Irving makes 0/1 from the line. Rebound secured by Michael Hyland.
Score: 62-56

[08:19] Team_062 possession (Score: 62-56)
Kawhi Thompson attempts a Midrange. Wide open! Michael Curry is 6.8 feet away. [ZONE] KAWHI THOMPSON MAKES IT!
Score: 62-58

[08:03] Team_004 possession (Score: 62-58)
Draymond Fox loses control! Ball rolls out of bounds! TURNOVER! (dead ball)

[07:51] Team_062 possession (Score: 62-58)
Jalen Reaves drives to the basket... FOUL! Offensive foul on Jalen Reaves! Anthony Lillard drew the charge! [Team fouls: 2] (Jalen Reaves: 1 personal fouls) TURNOVER! (dead ball)

[07:34] Team_004 possession (Score: 62-58)
Dwyane Irving attempts a 3Pt. Contested by RJ Williamson (2.0 feet, ZONE). DWYANE IRVING MAKES IT! Assist: Michael Curry
Score: 65-58

[07:16] Team_062 possession (Score: 65-58)
Jalen Reaves attempts a Midrange. Contested by Anthony Lillard (4.4 feet, MAN). Jalen Reaves misses. Offensive rebound by Jalen Reaves! Jalen Reaves's putback is no good. Rebound secured by Dwyane Irving.

[07:02] Team_004 possession (Score: 65-58)
Draymond Fox makes the Layup and draws the foul on Kawhi Thompson! And-1! Draymond Fox to the line for 1. [Team fouls: 3] (Kawhi Thompson: 2 personal fouls)   FT 1/1: GOOD Draymond Fox makes 1/1 from the line.
Score: 68-58

[06:44] Team_062 possession (Score: 68-58)
Jalen Reaves attempts a 3Pt. Contested by Anthony Lillard (2.5 feet, MAN). Jalen Reaves misses. Rebound secured by Anthony Lillard.

[06:26] Team_004 possession (Score: 68-58)
Draymond Fox attempts a Midrange. Contested by Kawhi Thompson (5.4 feet, MAN). Draymond Fox misses. Rebound secured by Michael Hyland.

[06:10] Team_062 possession (Score: 68-58)
Michael Hyland attempts a 3Pt. Wide open! Michael Curry is 6.4 feet away. [ZONE] MICHAEL HYLAND MAKES IT! Assist: Jalen Reaves
Score: 68-61

[05:56] Team_004 possession (Score: 68-61)
Jabari Wade attempts a Midrange. Contested by RJ Williamson (3.6 feet, MAN). JABARI WADE MAKES IT!
Score: 70-61

[05:46] Team_062 possession (Score: 70-61)
RJ Williamson attempts a Midrange. BLOCKED BY DRAYMOND FOX! Ball is loose! Rebound secured by Dwyane Irving.

[05:28] Team_004 possession (Score: 70-61)
FOUL! Shooting foul on RJ Williamson. Dwyane Irving to the line for 3 free throws. [Team fouls: 4] (RJ Williamson: 1 personal fouls)   FT 1/3: GOOD   FT 2/3: GOOD   FT 3/3: MISS Dwyane Irving makes 2/3 from the line. Offensive rebound by Anthony Lillard! Anthony Lillard kicks it out.
Score: 72-61

[05:13] Team_004 possession (Score: 72-61)
Dwyane Irving attempts a Layup. Wide open! Michael Hyland is 6.1 feet away. [MAN] DWYANE IRVING MAKES IT! Assist: Michael Curry
Score: 74-61

[05:04] Team_062 possession (Score: 74-61)
Chris Bird attempts a Layup. Wide open! Michael Curry is 6.8 feet away. [MAN] CHRIS BIRD MAKES IT! Assist: RJ Williamson
Score: 74-63

[04:51] Team_004 possession (Score: 74-63)
Anthony Lillard drives to the basket... Anthony Lillard loses control! Ball rolls out of bounds! TURNOVER! (dead ball)

[04:39] Team_062 possession (Score: 74-63)
Kawhi Thompson attempts a 3Pt. Contested by Michael Curry (4.9 feet, ZONE). Kawhi Thompson misses. Rebound secured by Draymond Fox.

[04:20] Team_004 possession (Score: 74-63)
FOUL! Shooting foul on Kawhi Thompson. Draymond Fox to the line for 2 free throws. [BONUS: 5 team fouls] (Kawhi Thompson: 3 personal fouls)   FT 1/2: GOOD   FT 2/2: GOOD Draymond Fox makes 2/2 from the line.
Score: 76-63

[04:06] Team_062 possession (Score: 76-63)
Michael Hyland attempts a 3Pt. Wide open! Michael Curry is 6.3 feet away. [ZONE] Michael Hyland misses. Rebound secured by Draymond Fox.

[03:54] Team_004 possession (Score: 76-63)
FOUL! Offensive foul on Draymond Fox! Kawhi Thompson drew the charge! [Team fouls: 2] (Draymond Fox: 1 personal fouls) TURNOVER! (dead ball)

[03:37] Team_062 possession (Score: 76-63)
Chris Bird attempts a 3Pt. Wide open! Michael Curry is 6.1 feet away. [MAN] CHRIS BIRD MAKES IT! Assist: Jalen Reaves
Score: 76-66

[03:23] Team_004 possession (Score: 76-66)
Anthony Lillard attempts a Layup. Wide open! Jalen Reaves is 6.1 feet away. [ZONE] Anthony Lillard misses. Offensive rebound by Anthony Lillard! Anthony Lillard kicks it out.

[03:08] Team_004 possession (Score: 76-66)
Jabari Wade attempts a Midrange. Contested by Jalen Reaves (4.0 feet, ZONE). Jabari Wade misses. Rebound secured by Kawhi Thompson.

[02:51] Team_062 possession (Score: 76-66)
Jalen Reaves attempts a 3Pt. Contested by Dwyane Irving (2.0 feet, ZONE). Jalen Reaves misses. Offensive rebound by Jalen Reaves! Jalen Reaves kicks it out.

[02:32] Team_062 possession (Score: 76-66)
Chris Bird drives and kicks out. Jalen Reaves attempts a Midrange. Wide open! Jabari Wade is 8.1 feet away. [ZONE] JALEN REAVES MAKES IT! Assist: Kawhi Thompson
Score: 76-68

[02:15] Team_004 possession (Score: 76-68)
Michael Curry drives, Chris Bird stays with him. Michael Curry attempts a Dunk. Contested by Chris Bird (5.3 feet, MAN). MICHAEL CURRY MAKES IT!
Score: 78-68

[01:58] Team_062 possession (Score: 78-68)
Kawhi Thompson attempts a Midrange. Heavily contested by Draymond Fox (1.9 feet, MAN)! Kawhi Thompson misses. Rebound secured by Draymond Fox.

[01:41] Team_004 possession (Score: 78-68)
Dwyane Irving attempts a 3Pt. Contested by Michael Hyland (2.9 feet, MAN). DWYANE IRVING MAKES IT! Assist: Jabari Wade
Score: 81-68

[01:24] Team_062 possession (Score: 81-68)
RJ Williamson attempts a Midrange. Contested by Draymond Fox (2.4 feet, ZONE). RJ Williamson misses. Offensive rebound by Jalen Reaves! Jalen Reaves kicks it out.

[01:05] Team_062 possession (Score: 81-68)
Michael Hyland attempts a 3Pt. Contested by Dwyane Irving (3.5 feet, MAN). Michael Hyland misses. Rebound secured by Anthony Lillard.

[00:54] Team_004 possession (Score: 81-68)
Dwyane Irving attempts a Layup. Wide open! Michael Hyland is 6.4 feet away. [MAN] DWYANE IRVING MAKES IT!
Score: 83-68

[00:38] Team_062 possession (Score: 83-68)
Jalen Reaves drives and kicks out. RJ Williamson attempts a 3Pt. Contested by Jabari Wade (5.6 feet, MAN). RJ Williamson misses. Rebound secured by Dwyane Irving.

[00:24] Team_004 possession (Score: 83-68)
Dwyane Irving makes the Layup and draws the foul on Michael Hyland! And-1! Dwyane Irving to the line for 1. [BONUS: 6 team fouls] (Michael Hyland: 1 personal fouls)   FT 1/1: MISS Dwyane Irving makes 0/1 from the line. Rebound secured by Kawhi Thompson.
Score: 85-68

[00:09] Team_062 possession (Score: 85-68)
Kawhi Thompson attempts a 3Pt. Contested by Michael Curry (5.5 feet, ZONE). Kawhi Thompson misses. Offensive rebound by Kawhi Thompson! Kawhi Thompson kicks it out.

================================================================================
                              3RD QUARTER COMPLETE                              
================================================================================

3RD QUARTER SCORE: Team_004 28, Team_062 15

BOX SCORE:
================================================================================

Team_004
--------------------------------------------------------------------------------
Player                MIN  PTS  REB  AST  TO      FG   FG%      3P   3P%
--------------------------------------------------------------------------------
Dwyane Irving          36   10    6    0   0   4/6    66.7     0/0   0.0
Draymond Fox           36    5    3    0   0   2/6    33.3     0/0   0.0
Jabari Wade            36    5    0    1   0   2/4    50.0     0/0   0.0
Michael Curry          36    2    0    2   0   1/2    50.0     0/0   0.0
Anthony Lillard        36    0    5    0   0   0/1     0.0     0/0   0.0

TEAM: FG: 9/19 (47.4%), 3PT: 3/6 (50.0%), REB: 13 (2 off, 11 def), AST: 3, TO: 3
TEAM FOULS: 2


Team_062
--------------------------------------------------------------------------------
Player                MIN  PTS  REB  AST  TO      FG   FG%      3P   3P%
--------------------------------------------------------------------------------
Chris Bird             36    5    0    0   0   2/3    66.7     0/0   0.0
RJ Williamson          36    3    0    1   0   1/3    33.3     0/0   0.0
Michael Hyland         36    3    4    0   0   1/3    33.3     0/0   0.0
Kawhi Thompson         36    2    5    1   0   1/4    25.0     0/0   0.0
Jalen Reaves           36    2    4    3   0   1/5    20.0     0/0   0.0

TEAM: FG: 6/18 (33.3%), 3PT: 3/7 (42.9%), REB: 14 (4 off, 10 def), AST: 5, TO: 3
TEAM FOULS: 6 [Team_004 in BONUS]

================================================================================

================================================================================
                       4TH QUARTER - Team_004 vs Team_062                       
================================================================================

[12:00] Team_004 possession (Score: 85-68)
Michael Curry attempts a 3Pt. Contested by RJ Williamson (4.3 feet, ZONE). Michael Curry misses. Rebound secured by Michael Hyland.

[11:48] Team_062 possession (Score: 85-68)
Kawhi Thompson drives to the basket... Kawhi Thompson throws a bad pass out of bounds! TURNOVER! (dead ball)

[11:48] Substitution (Team_004): Michael Curry OUT → Karl Reaves IN (stamina_rule2)

[11:48] Substitution (Team_004): Jabari Wade OUT → Russell Barnes IN (stamina_rule2)

[11:48] Substitution (Team_004): Draymond Fox OUT → Michael Sabonis IN (stamina_rule2)

[11:48] Substitution (Team_004): Anthony Lillard OUT → Shai Beal IN (stamina_rule2)

[11:48] Substitution (Team_062): Chris Bird OUT → Paolo McCollum IN (stamina_rule2)

[11:48] Substitution (Team_062): RJ Williamson OUT → Tony LaVine IN (stamina_rule2)

[11:48] Substitution (Team_062): Michael Hyland OUT → Paul Poole IN (stamina_rule2)

[11:48] Substitution (Team_062): Kawhi Thompson OUT → RJ Wall IN (stamina_rule2)

[11:48] Substitution (Team_062): Jalen Reaves OUT → Devin Young IN (stamina_rule2)

[11:35] Team_004 possession (Score: 85-68)
Russell Barnes attempts a Midrange. Contested by Tony LaVine (4.9 feet, MAN). RUSSELL BARNES MAKES IT!
Score: 87-68

[11:21] Team_062 possession (Score: 87-68)
Paul Poole throws a bad pass! Stolen by Dwyane Irving! TURNOVER! (live ball)

[11:09] Team_004 possession (Score: 87-68)
Dwyane Irving attempts a Layup. Contested by RJ Wall (5.9 feet, ZONE). DWYANE IRVING MAKES IT! Assist: Russell Barnes
Score: 89-68

[10:56] Team_062 possession (Score: 89-68)
RJ Wall attempts a 3Pt. Contested by Karl Reaves (3.6 feet, ZONE). RJ Wall misses. Rebound secured by Russell Barnes.

[10:45] Team_004 possession (Score: 89-68)
Michael Sabonis attempts a Layup. Contested by RJ Wall (4.2 feet, ZONE). MICHAEL SABONIS MAKES IT! Assist: Russell Barnes
Score: 91-68

[10:36] Team_062 possession (Score: 91-68)
Devin Young attempts a Layup. Wide open! Shai Beal is 6.4 feet away. [ZONE] DEVIN YOUNG MAKES IT!
Score: 91-70

[10:21] Team_004 possession (Score: 91-70)
Russell Barnes throws a bad pass out of bounds! TURNOVER! (dead ball)

[10:21] Substitution (Team_004): Dwyane Irving OUT → Kristaps Green IN (stamina_rule2)

[10:09] Team_062 possession (Score: 91-70)
Devin Young attempts a Midrange. Wide open! Shai Beal is 7.8 feet away. [MAN] Devin Young misses. Rebound secured by Michael Sabonis.

[09:55] Team_004 possession (Score: 91-70)
Shai Beal attempts a Midrange. Contested by Paul Poole (4.0 feet, ZONE). SHAI BEAL MAKES IT!
Score: 93-70

[09:41] Team_062 possession (Score: 93-70)
Devin Young drives and kicks out. RJ Wall attempts a Midrange. Contested by Russell Barnes (4.6 feet, ZONE). RJ WALL MAKES IT!
Score: 93-72

[09:25] Team_004 possession (Score: 93-72)
Russell Barnes attempts a Layup. Contested by Tony LaVine (4.6 feet, MAN). Russell Barnes misses. Rebound secured by Devin Young.

[09:12] Team_062 possession (Score: 93-72)
Paul Poole drives to the basket... Paul Poole throws a bad pass! Stolen by Shai Beal! TURNOVER! (live ball)

[09:01] Team_004 possession (Score: 93-72)
Russell Barnes attempts a Midrange. Wide open! Tony LaVine is 7.8 feet away. [MAN] Russell Barnes misses. Rebound secured by Devin Young.

[08:44] Team_062 possession (Score: 93-72)
Paolo McCollum attempts a 3Pt. Contested by Karl Reaves (3.0 feet, MAN). Paolo McCollum misses. Rebound secured by Russell Barnes.

[08:26] Team_004 possession (Score: 93-72)
Kristaps Green makes the Dunk and draws the foul on Paul Poole! And-1! Kristaps Green to the line for 1. [Team fouls: 1] (Paul Poole: 1 personal fouls)   FT 1/1: GOOD Kristaps Green makes 1/1 from the line.
Score: 96-72

[08:13] Team_062 possession (Score: 96-72)
Tony LaVine attempts a 3Pt. Contested by Russell Barnes (3.1 feet, MAN). Tony LaVine misses. Rebound secured by Michael Sabonis.

[07:56] Team_004 possession (Score: 96-72)
Russell Barnes attempts a Layup. Wide open! RJ Wall is 7.8 feet away. [ZONE] RUSSELL BARNES MAKES IT!
Score: 98-72

[07:44] Team_062 possession (Score: 98-72)
Paul Poole attempts a Midrange. Heavily contested by Kristaps Green (0.6 feet, MAN)! PAUL POOLE MAKES IT!
Score: 98-74

[07:33] Team_004 possession (Score: 98-74)
Russell Barnes attempts a 3Pt. Contested by Tony LaVine (4.8 feet, MAN). Russell Barnes misses. Rebound secured by Devin Young.

[07:14] Team_062 possession (Score: 98-74)
Devin Young drives, picks up Shai Beal. Help arrives from Russell Barnes! Devin Young attempts a Dunk. Contested by Russell Barnes (5.8 feet, MAN). DEVIN YOUNG MAKES IT! Assist: Tony LaVine
Score: 98-76

[07:02] Team_004 possession (Score: 98-76)
Michael Sabonis attempts a 3Pt. Contested by Paolo McCollum (4.3 feet, ZONE). MICHAEL SABONIS MAKES IT! Assist: Kristaps Green
Score: 101-76

[06:48] Team_062 possession (Score: 101-76)
Paul Poole attempts a 3Pt. Contested by Kristaps Green (3.8 feet, MAN). Paul Poole misses. Rebound secured by Shai Beal.

[06:31] Team_004 possession (Score: 101-76)
Russell Barnes attempts a Layup. Contested by RJ Wall (5.4 feet, ZONE). RUSSELL BARNES MAKES IT! Assist: Shai Beal
Score: 103-76

[06:15] Team_062 possession (Score: 103-76)
RJ Wall attempts a Midrange. Wide open! Michael Sabonis is 6.3 feet away. [MAN] RJ Wall misses. Rebound secured by Russell Barnes.

[06:04] Team_004 possession (Score: 103-76)
Michael Sabonis attempts a Midrange. Contested by Paul Poole (5.3 feet, ZONE). MICHAEL SABONIS MAKES IT! Assist: Shai Beal
Score: 105-76

[05:48] Team_062 possession (Score: 105-76)
Tony LaVine attempts a Midrange. Wide open! Russell Barnes is 6.7 feet away. [MAN] Tony LaVine misses. Rebound secured by Michael Sabonis.

[05:35] Team_004 possession (Score: 105-76)
Kristaps Green attempts a 3Pt. Wide open! Paul Poole is 8.3 feet away. [MAN] Kristaps Green misses. Offensive rebound by Shai Beal! Shai Beal kicks it out.

[05:21] Team_004 possession (Score: 105-76)
Russell Barnes attempts a Layup. Wide open! Tony LaVine is 7.2 feet away. [MAN] RUSSELL BARNES MAKES IT!
Score: 107-76

[05:05] Team_062 possession (Score: 107-76)
FOUL! Reach-in foul on Shai Beal during the drive. [Team fouls: 1] No free throws, side out. (Shai Beal: 1 personal fouls)

[04:49] Team_062 possession (Score: 107-76)
Devin Young attempts a Midrange. Contested by Shai Beal (4.9 feet, MAN). DEVIN YOUNG MAKES IT! Assist: Tony LaVine
Score: 107-78

[04:37] Team_004 possession (Score: 107-78)
Michael Sabonis attempts a Midrange. Wide open! RJ Wall is 6.7 feet away. [ZONE] Michael Sabonis misses. Rebound secured by RJ Wall.

[04:24] Team_062 possession (Score: 107-78)
Paolo McCollum attempts a 3Pt. Wide open! Karl Reaves is 6.4 feet away. [ZONE] PAOLO MCCOLLUM MAKES IT! Assist: Devin Young
Score: 107-81

[04:10] Team_004 possession (Score: 107-81)
Michael Sabonis attempts a 3Pt. Contested by RJ Wall (5.0 feet, MAN). MICHAEL SABONIS MAKES IT! Assist: Kristaps Green
Score: 110-81

[03:59] Team_062 possession (Score: 110-81)
Tony LaVine attempts a Midrange. Contested by Kristaps Green (5.9 feet, ZONE). Tony LaVine misses. Offensive rebound by Devin Young! Devin Young kicks it out.

[03:45] Team_062 possession (Score: 110-81)
Paolo McCollum attempts a 3Pt. Wide open! Karl Reaves is 7.2 feet away. [MAN] Paolo McCollum misses. Offensive rebound by Devin Young! Devin Young kicks it out.

[03:33] Team_062 possession (Score: 110-81)
Devin Young attempts a Midrange. Contested by Kristaps Green (2.8 feet, ZONE). DEVIN YOUNG MAKES IT!
Score: 110-83

[03:19] Team_004 possession (Score: 110-83)
Karl Reaves attempts a 3Pt. Wide open! Paolo McCollum is 9.4 feet away. [ZONE] KARL REAVES MAKES IT! Assist: Kristaps Green
Score: 113-83

[03:06] Team_062 possession (Score: 113-83)
Devin Young drives, picks up Shai Beal. Help arrives from Russell Barnes! Devin Young attempts a Dunk. Contested by Russell Barnes (2.8 feet, MAN). Devin Young misses. Rebound secured by Shai Beal.

[02:52] Team_004 possession (Score: 113-83)
Russell Barnes drives and kicks out. Russell Barnes attempts a Midrange. Heavily contested by RJ Wall (0.7 feet, ZONE)! Russell Barnes misses. Offensive rebound by Shai Beal! Shai Beal kicks it out.

[02:38] Team_004 possession (Score: 113-83)
Russell Barnes throws a bad pass! Stolen by Tony LaVine! TURNOVER! (live ball)

[02:22] Team_062 possession (Score: 113-83)
Paolo McCollum attempts a 3Pt. Wide open! Karl Reaves is 8.5 feet away. [MAN] PAOLO MCCOLLUM MAKES IT! Assist: RJ Wall
Score: 113-86

[02:11] Team_004 possession (Score: 113-86)
Shai Beal attempts a Midrange. Wide open! Paul Poole is 7.9 feet away. [ZONE] Shai Beal misses. Rebound secured by Devin Young.

[01:58] Team_062 possession (Score: 113-86)
Paul Poole loses the ball! Stripped by Kristaps Green! TURNOVER! (live ball)

[01:41] Team_004 possession (Score: 113-86)
Shai Beal attempts a Midrange. Wide open! Tony LaVine is 9.1 feet away. [ZONE] Shai Beal misses. Rebound secured by Devin Young.

[01:26] Team_062 possession (Score: 113-86)
RJ Wall attempts a Midrange. Heavily contested by Michael Sabonis (1.9 feet, ZONE)! RJ WALL MAKES IT! Assist: Tony LaVine
Score: 113-88

[01:10] Team_004 possession (Score: 113-88)
Russell Barnes attempts a Layup. Wide open! Tony LaVine is 9.3 feet away. [MAN] RUSSELL BARNES MAKES IT!
Score: 115-88

[00:55] Team_062 possession (Score: 115-88)
Tony LaVine drives to the basket... Tony LaVine commits a violation (traveling/carry)! TURNOVER! (dead ball)

[00:38] Team_004 possession (Score: 115-88)
Michael Sabonis attempts a Midrange. Contested by RJ Wall (6.0 feet, ZONE). MICHAEL SABONIS MAKES IT!
Score: 117-88

[00:24] Team_062 possession (Score: 117-88)
Paolo McCollum attempts a 3Pt. Wide open! Karl Reaves is 6.6 feet away. [MAN] Paolo McCollum misses. Rebound secured by Russell Barnes.

[00:07] Team_004 possession (Score: 117-88)
Shai Beal drives and kicks out. Michael Sabonis attempts a 3Pt. Wide open! RJ Wall is 6.3 feet away. [MAN] Michael Sabonis misses. Offensive rebound by Shai Beal! Shai Beal kicks it out.

================================================================================
                              4TH QUARTER COMPLETE                              
================================================================================

4TH QUARTER SCORE: Team_004 32, Team_062 20

BOX SCORE:
================================================================================

Team_004
--------------------------------------------------------------------------------
Player                MIN  PTS  REB  AST  TO      FG   FG%      3P   3P%
--------------------------------------------------------------------------------
Michael Sabonis        12   12    3    0   0   5/6    83.3     0/0   0.0
Russell Barnes         12   10    4    2   0   5/8    62.5     0/0   0.0
Kristaps Green         10    3    0    3   0   1/1   100.0     0/0   0.0
Karl Reaves            12    3    0    0   0   1/1   100.0     0/0   0.0
Dwyane Irving          38    2    0    0   0   1/1   100.0     0/0   0.0
Shai Beal              12    2    5    2   0   1/3    33.3     0/0   0.0
Michael Curry          37    0    0    0   0   0/1     0.0     0/0   0.0

TEAM: FG: 14/21 (66.7%), 3PT: 3/5 (60.0%), REB: 12 (3 off, 9 def), AST: 7, TO: 2
TEAM FOULS: 1


Team_062
--------------------------------------------------------------------------------
Player                MIN  PTS  REB  AST  TO      FG   FG%      3P   3P%
--------------------------------------------------------------------------------
Devin Young            12    8    7    1   0   4/6    66.7     0/0   0.0
Paolo McCollum         12    6    0    0   0   2/4    50.0     0/0   0.0
RJ Wall                12    4    1    1   0   2/4    50.0     0/0   0.0
Paul Poole             12    2    0    0   0   1/2    50.0     0/0   0.0
Michael Hyland         37    0    1    0   0   0/0     0.0     0/0   0.0
Tony LaVine            12    0    0    3   0   0/2     0.0     0/0   0.0

TEAM: FG: 9/18 (50.0%), 3PT: 2/7 (28.6%), REB: 9 (2 off, 7 def), AST: 5, TO: 5
TEAM FOULS: 1

================================================================================

================================================================================
                               FULL GAME COMPLETE                               
================================================================================

FINAL SCORE: Team_004 117, Team_062 88

SCORING BY QUARTER:
--------------------------------------------------------------------------------
Team                     Q1     Q2     Q3     Q4    FINAL
--------------------------------------------------------------------------------
Team_004                 28     29     28     32      117
Team_062                 29     24     15     20       88
--------------------------------------------------------------------------------

FULL GAME BOX SCORE:
================================================================================

Team_004
--------------------------------------------------------------------------------
Player                MIN  PTS  REB  AST  TO      FG   FG%      3P   3P%      FT STL BLK
--------------------------------------------------------------------------------
Dwyane Irving          38   27   17    1   1  11/14   78.6   5/5   100.0   4/7     2   0
Michael Curry          37    9    0    2   0   3/10   30.0   1/6    16.7   0/0     1   0
Jabari Wade            37   14    0    9   4   7/10   70.0   2/4    50.0   0/0     2   0
Draymond Fox           37   18    8    2   3   8/16   50.0   0/2     0.0   6/6     1   1
Anthony Lillard        37   11   12    1   1   6/10   60.0   0/1     0.0   1/3     2   1
Karl Reaves            12    3    0    0   0   1/1   100.0   1/1   100.0   0/0     0   0
Russell Barnes         12   10    4    2   2   5/8    62.5   0/1     0.0   0/0     0   0
Michael Sabonis        12   12    3    0   0   5/6    83.3   2/2   100.0   0/0     0   0
Shai Beal              12    2    5    2   0   1/3    33.3   0/0     0.0   0/0     1   0
Kristaps Green         10    3    0    3   0   1/1   100.0   0/0     0.0   1/1     1   0

TEAM: FG: 48/79 (60.8%), 3PT: 11/22 (50.0%), REB: 48 (14 off, 34 def), AST: 22, TO: 11


Team_062
--------------------------------------------------------------------------------
Player                MIN  PTS  REB  AST  TO      FG   FG%      3P   3P%      FT STL BLK
--------------------------------------------------------------------------------
Chris Bird             37   11    0    2   2   6/9    66.7   3/3   100.0   0/0     0   0
RJ Williamson          37    9    0    6   3   3/10   30.0   3/4    75.0   0/0     0   0
Michael Hyland         37   24    9    2   3   8/14   57.1   3/6    50.0   7/9     0   0
Kawhi Thompson         37   15    9    2   1   6/9    66.7   1/2    50.0   1/1     0   1
Jalen Reaves           37    9   14    6   3   3/10   30.0   0/2     0.0   0/0     1   0
Paolo McCollum         12    6    0    0   0   2/4    50.0   2/4    50.0   0/0     0   0
Tony LaVine            12    0    0    3   0   0/2     0.0   0/1     0.0   0/0     1   0
Paul Poole             12    2    0    0   2   1/2    50.0   0/1     0.0   0/0     0   0
RJ Wall                12    4    1    1   1   1/3    33.3   0/1     0.0   0/0     0   0
Devin Young            12    8    7    1   1   5/7    71.4   0/0     0.0   0/0     0   0

TEAM: FG: 36/71 (50.7%), 3PT: 12/24 (50.0%), REB: 41 (10 off, 31 def), AST: 23, TO: 16

================================================================================
