================================================================================
                        FULL GAME - Team_006 vs Team_017                        
================================================================================

================================================================================
                       1ST QUARTER - Team_006 vs Team_017                       
================================================================================

[12:00] Team_006 possession (Score: 0-0)
Ja Butler drives, Bam Williamson stays with him. Ja Butler attempts a Layup. Contested by Bam Williamson (3.3 feet, ZONE). JA BUTLER MAKES IT!
Score: 2-0

[11:49] Team_017 possession (Score: 2-0)
Bam Williamson attempts a Dunk. BLOCKED BY BRADLEY GOBERT! Ball goes out off Bradley Gobert. Bam Williamson's ball!

[11:33] Team_017 possession (Score: 2-0)
Desmond Reaves makes the Layup and draws the foul on Bradley Gobert! And-1! Desmond Reaves to the line for 1. [Team fouls: 1] (Bradley Gobert: 1 personal fouls)   FT 1/1: GOOD Desmond Reaves makes 1/1 from the line.
Score: 2-3

[11:19] Team_006 possession (Score: 2-3)
Bradley Gobert attempts a Dunk. BLOCKED BY BAM WILLIAMSON! Ball goes out off Bam Williamson. Bradley Gobert's ball!

[11:06] Team_006 possession (Score: 2-3)
Ja Butler drives, Bam Williamson stays with him. Ja Butler attempts a Dunk. Contested by Bam Williamson (2.2 feet, ZONE). JA BUTLER MAKES IT!
Score: 4-3

[10:48] Team_017 possession (Score: 4-3)
Vince Banchero attempts a 3Pt. Contested by Franz Wagner (5.4 feet, MAN). VINCE BANCHERO MAKES IT! Assist: Bam Williamson
Score: 4-6

[10:33] Team_006 possession (Score: 4-6)
Ja Butler attempts a Midrange. Heavily contested by Tony Smith (0.5 feet, ZONE)! Ja Butler misses. FOUL! Loose ball foul on Tony Smith during the rebound battle. [Team fouls: 1] No free throws, side out. (Tony Smith: 1 personal fouls)

[10:19] Team_006 possession (Score: 4-6)
Ja Butler drives to the basket... Ja Butler throws a bad pass! Stolen by Kyrie Middleton! TURNOVER! (live ball)

[10:01] Team_017 possession (Score: 4-6)
Tony Smith drives, Jayson Young stays with him. Tony Smith attempts a Layup. Wide open! Jayson Young is 6.7 feet away. [MAN] TONY SMITH MAKES IT!
Score: 4-8

[09:47] Team_006 possession (Score: 4-8)
Jayson Young attempts a Midrange. Heavily contested by Tony Smith (0.5 feet, MAN)! Jayson Young misses. Rebound secured by Kyrie Middleton.

[09:33] Team_017 possession (Score: 4-8)
Kyrie Middleton attempts a 3Pt. Contested by Ja Butler (2.8 feet, MAN). KYRIE MIDDLETON MAKES IT! Assist: Bam Williamson
Score: 4-11

[09:17] Team_006 possession (Score: 4-11)
Jayson Young attempts a Midrange. Wide open! Tony Smith is 6.8 feet away. [MAN] JAYSON YOUNG MAKES IT! Assist: Ja Butler
Score: 6-11

[09:04] Team_017 possession (Score: 6-11)
Tony Smith attempts a Layup. BLOCKED BY JAYSON YOUNG! Ball is loose! Offensive rebound by Kyrie Middleton! Kyrie Middleton kicks it out.

[08:52] Team_017 possession (Score: 6-11)
Bam Williamson attempts a Midrange. Contested by Ja Butler (5.6 feet, ZONE). Bam Williamson misses. Rebound secured by Ja Butler.

[08:36] Team_006 possession (Score: 6-11)
Ja Butler drives to the basket... Ja Butler loses control! Ball rolls out of bounds! TURNOVER! (dead ball)

[08:21] Team_017 possession (Score: 6-11)
Bam Williamson makes the Dunk and draws the foul on Shai Westbrook! And-1! Bam Williamson to the line for 1. [Team fouls: 2] (Shai Westbrook: 1 personal fouls)   FT 1/1: GOOD Bam Williamson makes 1/1 from the line.
Score: 6-14

[08:07] Team_006 possession (Score: 6-14)
Shai Westbrook throws a bad pass out of bounds! TURNOVER! (dead ball)

[07:55] Team_017 possession (Score: 6-14)
Desmond Reaves attempts a Layup. Contested by Shai Westbrook (5.0 feet, MAN). Desmond Reaves misses. Rebound secured by Ja Butler.

[07:39] Team_006 possession (Score: 6-14)
Bradley Gobert attempts a Layup. Contested by Bam Williamson (5.2 feet, MAN). BRADLEY GOBERT MAKES IT! Assist: Franz Wagner
Score: 8-14

[07:23] Team_017 possession (Score: 8-14)
Vince Banchero attempts a Layup. Wide open! Franz Wagner is 6.8 feet away. [MAN] VINCE BANCHERO MAKES IT! Assist: Bam Williamson
Score: 8-16

[07:11] Team_006 possession (Score: 8-16)
Jayson Young attempts a 3Pt. Wide open! Tony Smith is 6.3 feet away. [MAN] Jayson Young misses. Rebound secured by Tony Smith.

[06:57] Team_017 possession (Score: 8-16)
Tony Smith commits a violation (traveling/carry)! TURNOVER! (dead ball)

[06:41] Team_006 possession (Score: 8-16)
Bradley Gobert attempts a Midrange. Contested by Kyrie Middleton (3.5 feet, ZONE). Bradley Gobert misses. Offensive rebound by Ja Butler! Ja Butler puts it back in!
Score: 10-16

[06:28] Team_017 possession (Score: 10-16)
FOUL! Holding foul on Shai Westbrook. [Team fouls: 3] No free throws, side out. (Shai Westbrook: 2 personal fouls)

[06:14] Team_017 possession (Score: 10-16)
Vince Banchero attempts a Layup. BLOCKED BY BRADLEY GOBERT! Ball is loose! Rebound secured by Shai Westbrook.

[06:01] Team_006 possession (Score: 10-16)
Bradley Gobert attempts a Layup. Contested by Bam Williamson (3.2 feet, MAN). Bradley Gobert misses. Rebound secured by Kyrie Middleton.

[05:50] Team_017 possession (Score: 10-16)
Desmond Reaves attempts a 3Pt. Contested by Shai Westbrook (2.8 feet, ZONE). Desmond Reaves misses. Rebound secured by Shai Westbrook.

[05:36] Team_006 possession (Score: 10-16)
Jayson Young drives and kicks out. Bradley Gobert attempts a 3Pt. Contested by Bam Williamson (2.6 feet, MAN). Bradley Gobert misses. Rebound secured by Kyrie Middleton.

[05:20] Team_017 possession (Score: 10-16)
Vince Banchero drives to the basket... FOUL! Offensive foul on Vince Banchero! Franz Wagner drew the charge! [Team fouls: 2] (Vince Banchero: 1 personal fouls) TURNOVER! (dead ball)

[05:04] Team_006 possession (Score: 10-16)
Bradley Gobert drives to the basket... FOUL! Offensive foul on Bradley Gobert! Bam Williamson drew the charge! [Team fouls: 4] (Bradley Gobert: 2 personal fouls) TURNOVER! (dead ball)

[04:49] Team_017 possession (Score: 10-16)
Bam Williamson drives, Bradley Gobert stays with him. Bam Williamson attempts a Layup. Contested by Bradley Gobert (2.6 feet, ZONE). Bam Williamson misses. Rebound secured by Bradley Gobert.

[04:34] Team_006 possession (Score: 10-16)
Bradley Gobert drives and kicks out. Ja Butler attempts a Midrange. Contested by Kyrie Middleton (4.9 feet, MAN). JA BUTLER MAKES IT! Assist: Shai Westbrook
Score: 12-16

[04:22] Team_017 possession (Score: 12-16)
Desmond Reaves attempts a 3Pt. Contested by Shai Westbrook (5.8 feet, MAN). Desmond Reaves misses. Rebound secured by Bradley Gobert.

[04:10] Team_006 possession (Score: 12-16)
FOUL! Shooting foul on Vince Banchero. Ja Butler to the line for 2 free throws. [Team fouls: 3] (Vince Banchero: 2 personal fouls)   FT 1/2: MISS   FT 2/2: GOOD Ja Butler makes 1/2 from the line.
Score: 13-16

[03:54] Team_017 possession (Score: 13-16)
Kyrie Middleton drives, Bradley Gobert stays with him. Kyrie Middleton attempts a Dunk. Contested by Bradley Gobert (4.8 feet, ZONE). KYRIE MIDDLETON MAKES IT! Assist: Tony Smith
Score: 13-18

[03:38] Team_006 possession (Score: 13-18)
Ja Butler attempts a 3Pt. Wide open! Kyrie Middleton is 7.3 feet away. [MAN] Ja Butler misses. Rebound secured by Tony Smith.

[03:24] Team_017 possession (Score: 13-18)
FOUL! Shooting foul on Shai Westbrook. Kyrie Middleton to the line for 2 free throws. [BONUS: 5 team fouls] (Shai Westbrook: 3 personal fouls)   FT 1/2: GOOD   FT 2/2: GOOD Kyrie Middleton makes 2/2 from the line.
Score: 13-20

[03:14] Team_006 possession (Score: 13-20)
Shai Westbrook attempts a Midrange. Wide open! Desmond Reaves is 6.3 feet away. [MAN] Shai Westbrook misses. Rebound secured by Bam Williamson.

[03:00] Team_017 possession (Score: 13-20)
Desmond Reaves commits a violation (traveling/carry)! TURNOVER! (dead ball)

[03:00] Substitution (Team_006): Franz Wagner OUT → Lamelo Westbrook IN (stamina_rule2)

[03:00] Substitution (Team_006): Ja Butler OUT → Cade Ball IN (stamina_rule2)

[03:00] Substitution (Team_006): Bradley Gobert OUT → Shaquille Sexton IN (stamina_rule2)

[03:00] Substitution (Team_017): Bam Williamson OUT → Klay Holiday IN (stamina_rule2)

[02:46] Team_006 possession (Score: 13-20)
Cade Ball attempts a Midrange. Wide open! Klay Holiday is 7.0 feet away. [ZONE] Cade Ball misses. Rebound secured by Kyrie Middleton.

[02:37] Team_017 possession (Score: 13-20)
Vince Banchero attempts a 3Pt. Contested by Lamelo Westbrook (3.0 feet, MAN). Vince Banchero misses. Rebound secured by Shaquille Sexton.

[02:23] Team_006 possession (Score: 13-20)
Jayson Young attempts a 3Pt. Heavily contested by Tony Smith (1.3 feet, ZONE)! Jayson Young misses. Rebound secured by Klay Holiday.

[02:09] Team_017 possession (Score: 13-20)
Tony Smith attempts a 3Pt. Wide open! Jayson Young is 6.2 feet away. [MAN] Tony Smith misses. Rebound secured by Shaquille Sexton.

[01:56] Team_006 possession (Score: 13-20)
Cade Ball drives to the basket... Cade Ball loses the ball! Stripped by Kyrie Middleton! TURNOVER! (live ball)

[01:40] Team_017 possession (Score: 13-20)
Desmond Reaves attempts a 3Pt. Contested by Shai Westbrook (5.1 feet, MAN). Desmond Reaves misses. Rebound secured by Cade Ball.

[01:26] Team_006 possession (Score: 13-20)
Shaquille Sexton drives, Klay Holiday stays with him. Shaquille Sexton attempts a Dunk. Wide open! Klay Holiday is 6.1 feet away. [MAN] SHAQUILLE SEXTON MAKES IT! Assist: Shai Westbrook
Score: 15-20

[01:10] Team_017 possession (Score: 15-20)
Vince Banchero attempts a Layup. Contested by Lamelo Westbrook (2.3 feet, MAN). Vince Banchero misses. Rebound secured by Shai Westbrook.

[00:58] Team_006 possession (Score: 15-20)
FOUL! Reach-in foul on Tony Smith during the drive. [Team fouls: 4] No free throws, side out. (Tony Smith: 2 personal fouls)

[00:46] Team_006 possession (Score: 15-20)
Cade Ball attempts a Midrange. Contested by Kyrie Middleton (3.7 feet, MAN). Cade Ball misses. Offensive rebound by Cade Ball! Cade Ball kicks it out.

[00:27] Team_006 possession (Score: 15-20)
Shai Westbrook makes the Layup and draws the foul on Desmond Reaves! And-1! Shai Westbrook to the line for 1. [BONUS: 5 team fouls] (Desmond Reaves: 1 personal fouls)   FT 1/1: GOOD Shai Westbrook makes 1/1 from the line.
Score: 18-20

[00:14] Team_017 possession (Score: 18-20)
Desmond Reaves attempts a 3Pt. Contested by Shai Westbrook (4.9 feet, MAN). DESMOND REAVES MAKES IT! Assist: Klay Holiday
Score: 18-23

================================================================================
                              1ST QUARTER COMPLETE                              
================================================================================

1ST QUARTER SCORE: Team_006 18, Team_017 23

BOX SCORE:
================================================================================

Team_006
--------------------------------------------------------------------------------
Player                MIN  PTS  REB  AST  TO      FG   FG%      3P   3P%
--------------------------------------------------------------------------------
Ja Butler               9    9    3    1   0   5/6    83.3     0/0   0.0
Shai Westbrook         12    3    3    2   0   1/2    50.0     0/0   0.0
Bradley Gobert          9    2    3    0   0   1/2    50.0     0/0   0.0
Jayson Young           12    2    0    0   0   1/5    20.0     0/0   0.0
Shaquille Sexton        3    2    2    0   0   1/1   100.0     0/0   0.0
Franz Wagner            9    0    0    1   0   0/0     0.0     0/0   0.0
Cade Ball               3    0    2    0   0   0/1     0.0     0/0   0.0

TEAM: FG: 9/17 (52.9%), 3PT: 0/3 (0.0%), REB: 13 (3 off, 10 def), AST: 4, TO: 5
TEAM FOULS: 5 [Team_017 in BONUS]


Team_017
--------------------------------------------------------------------------------
Player                MIN  PTS  REB  AST  TO      FG   FG%      3P   3P%
--------------------------------------------------------------------------------
Kyrie Middleton        12    7    5    0   0   3/3   100.0     0/0   0.0
Desmond Reaves         12    6    0    0   0   2/6    33.3     0/0   0.0
Vince Banchero         12    5    0    0   0   2/5    40.0     0/0   0.0
Bam Williamson          9    3    1    3   0   1/3    33.3     0/0   0.0
Tony Smith             12    2    2    1   0   1/2    50.0     0/0   0.0
Klay Holiday            3    0    1    1   0   0/0     0.0     0/0   0.0

TEAM: FG: 9/19 (47.4%), 3PT: 3/8 (37.5%), REB: 9 (1 off, 8 def), AST: 5, TO: 3
TEAM FOULS: 5 [Team_006 in BONUS]

================================================================================

================================================================================
                       2ND QUARTER - Team_006 vs Team_017                       
================================================================================

[12:00] Team_006 possession (Score: 18-23)
Franz Wagner attempts a Layup. Contested by Bam Williamson (5.2 feet, ZONE). Franz Wagner misses. Offensive rebound by Ja Butler! Ja Butler puts it back in!
Score: 20-23

[11:48] Team_017 possession (Score: 20-23)
Vince Banchero attempts a 3Pt. Contested by Jayson Young (2.8 feet, ZONE). Vince Banchero misses. Rebound secured by Ja Butler.

[11:35] Team_006 possession (Score: 20-23)
Jayson Young attempts a 3Pt. Contested by Tony Smith (4.7 feet, ZONE). Jayson Young misses. Rebound secured by Kyrie Middleton.

[11:19] Team_017 possession (Score: 20-23)
Vince Banchero attempts a Layup. Contested by Bradley Gobert (3.9 feet, ZONE). Vince Banchero misses. Rebound secured by Bradley Gobert.

[11:03] Team_006 possession (Score: 20-23)
Ja Butler drives to the basket... Ja Butler loses the ball! Stripped by Kyrie Middleton! TURNOVER! (live ball)

[10:49] Team_017 possession (Score: 20-23)
Tony Smith drives, Jayson Young stays with him. Tony Smith attempts a Dunk. Contested by Jayson Young (4.2 feet, MAN). Tony Smith misses. Offensive rebound by Bam Williamson! Bam Williamson's putback is no good. Rebound secured by Ja Butler.

[10:34] Team_006 possession (Score: 20-23)
Shai Westbrook attempts a 3Pt. Contested by Desmond Reaves (5.2 feet, MAN). Shai Westbrook misses. Rebound secured by Bam Williamson.

[10:22] Team_017 possession (Score: 20-23)
Tony Smith drives, picks up Jayson Young. Help arrives from Franz Wagner! Tony Smith attempts a Layup. Contested by Franz Wagner (2.1 feet, MAN). TONY SMITH MAKES IT! Assist: Vince Banchero
Score: 20-25

[10:05] Team_006 possession (Score: 20-25)
Ja Butler drives, Bam Williamson stays with him. Ja Butler attempts a Layup. Contested by Bam Williamson (3.0 feet, ZONE). JA BUTLER MAKES IT! Assist: Shai Westbrook
Score: 22-25

[09:51] Team_017 possession (Score: 22-25)
Bam Williamson makes the Layup and draws the foul on Bradley Gobert! And-1! Bam Williamson to the line for 1. [Team fouls: 1] (Bradley Gobert: 1 personal fouls)   FT 1/1: MISS Bam Williamson makes 0/1 from the line. Rebound secured by Ja Butler.
Score: 22-27

[09:39] Team_006 possession (Score: 22-27)
Franz Wagner drives to the basket... Franz Wagner throws a bad pass out of bounds! TURNOVER! (dead ball)

[09:39] Substitution (Team_006): Shai Westbrook OUT → Miles Harris IN (stamina_rule2)

[09:39] Substitution (Team_006): Jayson Young OUT → Vince Sabonis IN (stamina_rule2)

[09:39] Substitution (Team_017): Desmond Reaves OUT → Blake Reaves IN (stamina_rule2)

[09:39] Substitution (Team_017): Vince Banchero OUT → Tobias Bridges IN (stamina_rule2)

[09:39] Substitution (Team_017): Tony Smith OUT → Shaquille Stewart IN (stamina_rule2)

[09:39] Substitution (Team_017): Kyrie Middleton OUT → Ja Stewart IN (stamina_rule2)

[09:26] Team_017 possession (Score: 22-27)
Shaquille Stewart drives and kicks out. Ja Stewart attempts a 3Pt. Heavily contested by Ja Butler (0.5 feet, MAN)! Ja Stewart misses. Rebound secured by Vince Sabonis.

[09:13] Team_006 possession (Score: 22-27)
Vince Sabonis attempts a Midrange. Contested by Shaquille Stewart (2.7 feet, MAN). Vince Sabonis misses. Offensive rebound by Bradley Gobert! Bradley Gobert kicks it out.

[09:00] Team_006 possession (Score: 22-27)
Franz Wagner attempts a Midrange. Contested by Tobias Bridges (4.5 feet, MAN). Franz Wagner misses. Rebound secured by Bam Williamson.

[08:48] Team_017 possession (Score: 22-27)
Blake Reaves attempts a 3Pt. Contested by Miles Harris (2.7 feet, MAN). BLAKE REAVES MAKES IT! Assist: Shaquille Stewart
Score: 22-30

[08:35] Team_006 possession (Score: 22-30)
Bradley Gobert drives, Bam Williamson stays with him. Bradley Gobert attempts a Dunk. Heavily contested by Bam Williamson (1.7 feet, MAN)! Bradley Gobert misses. Rebound secured by Shaquille Stewart.

[08:21] Team_017 possession (Score: 22-30)
FOUL! Holding foul on Bradley Gobert. [Team fouls: 2] No free throws, side out. (Bradley Gobert: 2 personal fouls)

[08:08] Team_017 possession (Score: 22-30)
Bam Williamson attempts a Layup. Contested by Bradley Gobert (4.2 feet, ZONE). BAM WILLIAMSON MAKES IT! Assist: Ja Stewart
Score: 22-32

[07:53] Team_006 possession (Score: 22-32)
Vince Sabonis attempts a Midrange. Wide open! Tobias Bridges is 6.2 feet away. [ZONE] Vince Sabonis misses. Offensive rebound by Ja Butler! Ja Butler's putback is no good. Rebound secured by Shaquille Stewart.

[07:38] Team_017 possession (Score: 22-32)
Ja Stewart attempts a Midrange. Contested by Franz Wagner (4.5 feet, ZONE). Ja Stewart misses. Offensive rebound by Shaquille Stewart! Shaquille Stewart kicks it out.

[07:23] Team_017 possession (Score: 22-32)
Shaquille Stewart makes the Layup and draws the foul on Franz Wagner! And-1! Shaquille Stewart to the line for 1. [Team fouls: 3] (Franz Wagner: 1 personal fouls)   FT 1/1: GOOD Shaquille Stewart makes 1/1 from the line.
Score: 22-35

[07:04] Team_006 possession (Score: 22-35)
Vince Sabonis attempts a 3Pt. Wide open! Shaquille Stewart is 6.7 feet away. [MAN] VINCE SABONIS MAKES IT! Assist: Bradley Gobert
Score: 25-35

[06:47] Team_017 possession (Score: 25-35)
Shaquille Stewart loses control! Ball rolls out of bounds! TURNOVER! (dead ball)

[06:47] Substitution (Team_006): Franz Wagner OUT → Lamelo Westbrook IN (stamina_rule2)

[06:47] Substitution (Team_006): Ja Butler OUT → Cade Ball IN (stamina_rule2)

[06:47] Substitution (Team_006): Bradley Gobert OUT → Shaquille Sexton IN (stamina_rule2)

[06:47] Substitution (Team_017): Bam Williamson OUT → Klay Holiday IN (stamina_rule2)

[06:34] Team_006 possession (Score: 25-35)
Vince Sabonis attempts a 3Pt. Contested by Tobias Bridges (3.8 feet, ZONE). Vince Sabonis misses. Rebound secured by Shaquille Stewart.

[06:20] Team_017 possession (Score: 25-35)
Ja Stewart attempts a Layup. Heavily contested by Cade Ball (1.7 feet, ZONE)! JA STEWART MAKES IT!
Score: 25-37

[06:09] Team_006 possession (Score: 25-37)
Vince Sabonis attempts a Midrange. Contested by Shaquille Stewart (4.7 feet, MAN). Vince Sabonis misses. Rebound secured by Shaquille Stewart.

[05:53] Team_017 possession (Score: 25-37)
Ja Stewart drives to the basket... Ja Stewart loses the ball! Stripped by Cade Ball! TURNOVER! (live ball)

[05:40] Team_006 possession (Score: 25-37)
Miles Harris attempts a 3Pt. Wide open! Blake Reaves is 8.5 feet away. [MAN] Miles Harris misses. Rebound secured by Shaquille Stewart.

[05:27] Team_017 possession (Score: 25-37)
Blake Reaves attempts a 3Pt. Contested by Miles Harris (4.9 feet, MAN). Blake Reaves misses. FOUL! Loose ball foul on Vince Sabonis during the rebound battle. [Team fouls: 4] No free throws, side out. (Vince Sabonis: 1 personal fouls)

[05:13] Team_017 possession (Score: 25-37)
Ja Stewart attempts a Midrange. Heavily contested by Cade Ball (1.8 feet, ZONE)! JA STEWART MAKES IT! Assist: Klay Holiday
Score: 25-39

[04:58] Team_006 possession (Score: 25-39)
FOUL! Reach-in foul on Tobias Bridges during the drive. [Team fouls: 1] No free throws, side out. (Tobias Bridges: 1 personal fouls)

[04:46] Team_006 possession (Score: 25-39)
FOUL! Shooting foul on Shaquille Stewart. Shaquille Sexton to the line for 2 free throws. [Team fouls: 2] (Shaquille Stewart: 1 personal fouls)   FT 1/2: GOOD   FT 2/2: GOOD Shaquille Sexton makes 2/2 from the line.
Score: 27-39

[04:35] Team_017 possession (Score: 27-39)
Shaquille Stewart throws a bad pass out of bounds! TURNOVER! (dead ball)

[04:21] Team_006 possession (Score: 27-39)
Miles Harris drives and kicks out. Cade Ball attempts a 3Pt. Contested by Tobias Bridges (4.9 feet, ZONE). Cade Ball misses. Offensive rebound by Shaquille Sexton! Shaquille Sexton kicks it out.

[04:05] Team_006 possession (Score: 27-39)
Lamelo Westbrook drives to the basket... FOUL! Offensive foul on Lamelo Westbrook! Ja Stewart drew the charge! [Team fouls: 5] (Lamelo Westbrook: 1 personal fouls) TURNOVER! (dead ball)

[03:47] Team_017 possession (Score: 27-39)
Ja Stewart attempts a 3Pt. Contested by Cade Ball (2.8 feet, MAN). JA STEWART MAKES IT! Assist: Shaquille Stewart
Score: 27-42

[03:35] Team_006 possession (Score: 27-42)
Lamelo Westbrook attempts a 3Pt. Contested by Blake Reaves (3.3 feet, ZONE). Lamelo Westbrook misses. Offensive rebound by Shaquille Sexton! Shaquille Sexton kicks it out.

[03:24] Team_006 possession (Score: 27-42)
Cade Ball attempts a 3Pt. Wide open! Ja Stewart is 7.4 feet away. [MAN] Cade Ball misses. Rebound secured by Shaquille Stewart.

[03:08] Team_017 possession (Score: 27-42)
Tobias Bridges drives and kicks out. Ja Stewart attempts a 3Pt. Contested by Lamelo Westbrook (4.4 feet, ZONE). Ja Stewart misses. Rebound secured by Shaquille Sexton.

[02:54] Team_006 possession (Score: 27-42)
Miles Harris attempts a 3Pt. Wide open! Blake Reaves is 6.7 feet away. [MAN] MILES HARRIS MAKES IT! Assist: Lamelo Westbrook
Score: 30-42

[02:40] Team_017 possession (Score: 30-42)
FOUL! Holding foul on Lamelo Westbrook. [IN THE BONUS! 6 team fouls] Tobias Bridges to the line for 2 free throws. (Lamelo Westbrook: 2 personal fouls)   FT 1/2: GOOD   FT 2/2: GOOD Tobias Bridges makes 2/2 from the line.
Score: 30-44

[02:26] Team_006 possession (Score: 30-44)
FOUL! Offensive foul on Miles Harris! Blake Reaves drew the charge! [Team fouls: 7] (Miles Harris: 1 personal fouls) TURNOVER! (dead ball)

[02:13] Team_017 possession (Score: 30-44)
FOUL! Holding foul on Cade Ball. [IN THE BONUS! 8 team fouls] Ja Stewart to the line for 2 free throws. (Cade Ball: 1 personal fouls)   FT 1/2: GOOD   FT 2/2: GOOD Ja Stewart makes 2/2 from the line.
Score: 30-46

[01:56] Team_006 possession (Score: 30-46)
Shaquille Sexton attempts a Midrange. Contested by Klay Holiday (3.5 feet, MAN). SHAQUILLE SEXTON MAKES IT!
Score: 32-46

[01:40] Team_017 possession (Score: 32-46)
Shaquille Stewart drives, picks up Vince Sabonis. Help arrives from Lamelo Westbrook! Shaquille Stewart attempts a Dunk. Contested by Lamelo Westbrook (4.4 feet, MAN). Shaquille Stewart misses. Rebound secured by Cade Ball.

[01:25] Team_006 possession (Score: 32-46)
Lamelo Westbrook attempts a 3Pt. Wide open! Tobias Bridges is 7.1 feet away. [MAN] LAMELO WESTBROOK MAKES IT! Assist: Shaquille Sexton
Score: 35-46

[01:15] Team_017 possession (Score: 35-46)
Ja Stewart attempts a 3Pt. Contested by Cade Ball (4.0 feet, MAN). JA STEWART MAKES IT! Assist: Tobias Bridges
Score: 35-49

[00:58] Team_006 possession (Score: 35-49)
Miles Harris makes the Layup and draws the foul on Tobias Bridges! And-1! Miles Harris to the line for 1. [Team fouls: 3] (Tobias Bridges: 2 personal fouls)   FT 1/1: GOOD Miles Harris makes 1/1 from the line.
Score: 38-49

[00:45] Team_017 possession (Score: 38-49)
Shaquille Stewart drives and kicks out. Ja Stewart attempts a 3Pt. Contested by Lamelo Westbrook (2.9 feet, ZONE). JA STEWART MAKES IT! Assist: Shaquille Stewart
Score: 38-52

[00:32] Team_006 possession (Score: 38-52)
Miles Harris loses control! Ball rolls out of bounds! TURNOVER! (dead ball)

[00:18] Team_017 possession (Score: 38-52)
Tobias Bridges attempts a 3Pt. Contested by Lamelo Westbrook (4.9 feet, ZONE). Tobias Bridges misses. Rebound secured by Cade Ball.

[00:04] Team_006 possession (Score: 38-52)
Lamelo Westbrook attempts a 3Pt. Contested by Tobias Bridges (5.0 feet, ZONE). Lamelo Westbrook misses. Rebound secured by Ja Stewart.

================================================================================
                              2ND QUARTER COMPLETE                              
================================================================================

2ND QUARTER SCORE: Team_006 20, Team_017 29

BOX SCORE:
================================================================================

Team_006
--------------------------------------------------------------------------------
Player                MIN  PTS  REB  AST  TO      FG   FG%      3P   3P%
--------------------------------------------------------------------------------
Miles Harris           10    6    0    0   0   2/3    66.7     0/0   0.0
Ja Butler              15    4    4    0   0   2/2   100.0     0/0   0.0
Shaquille Sexton       10    4    3    1   0   2/2   100.0     0/0   0.0
Vince Sabonis          10    3    1    0   0   1/4    25.0     0/0   0.0
Lamelo Westbrook       10    3    0    1   0   1/2    50.0     0/0   0.0
Jayson Young           15    0    0    0   0   0/1     0.0     0/0   0.0
Bradley Gobert         15    0    2    1   0   0/1     0.0     0/0   0.0
Shai Westbrook         15    0    0    1   0   0/1     0.0     0/0   0.0
Franz Wagner           15    0    0    0   0   0/1     0.0     0/0   0.0
Cade Ball              10    0    2    0   0   0/1     0.0     0/0   0.0

TEAM: FG: 8/18 (44.4%), 3PT: 3/9 (33.3%), REB: 12 (5 off, 7 def), AST: 4, TO: 5
TEAM FOULS: 8 [Team_017 in BONUS]


Team_017
--------------------------------------------------------------------------------
Player                MIN  PTS  REB  AST  TO      FG   FG%      3P   3P%
--------------------------------------------------------------------------------
Ja Stewart             10   15    2    1   0   6/6   100.0     0/0   0.0
Shaquille Stewart      10    3    7    3   0   1/3    33.3     0/0   0.0
Blake Reaves           10    3    0    0   0   1/1   100.0     0/0   0.0
Tony Smith             15    2    0    0   0   1/2    50.0     0/0   0.0
Bam Williamson         15    2    2    0   0   1/2    50.0     0/0   0.0
Tobias Bridges         10    2    0    1   0   1/3    33.3     0/0   0.0
Vince Banchero         15    0    0    1   0   0/2     0.0     0/0   0.0
Kyrie Middleton        15    0    1    0   0   0/0     0.0     0/0   0.0
Klay Holiday           10    0    0    1   0   0/0     0.0     0/0   0.0

TEAM: FG: 11/19 (57.9%), 3PT: 3/5 (60.0%), REB: 12 (3 off, 9 def), AST: 7, TO: 3
TEAM FOULS: 3

================================================================================

================================================================================
                       3RD QUARTER - Team_006 vs Team_017                       
================================================================================

[12:00] Team_006 possession (Score: 38-52)
Bradley Gobert attempts a Dunk. BLOCKED BY BAM WILLIAMSON! Ball is loose! Rebound secured by Bam Williamson.

[11:45] Team_017 possession (Score: 38-52)
FOUL! Shooting foul on Shai Westbrook. Vince Banchero to the line for 2 free throws. [Team fouls: 1] (Shai Westbrook: 1 personal fouls)   FT 1/2: GOOD   FT 2/2: GOOD Vince Banchero makes 2/2 from the line.
Score: 38-54

[11:29] Team_006 possession (Score: 38-54)
FOUL! Holding foul on Vince Banchero. [Team fouls: 1] No free throws, side out. (Vince Banchero: 1 personal fouls)

[11:14] Team_006 possession (Score: 38-54)
Ja Butler drives to the basket... Ja Butler throws a bad pass out of bounds! TURNOVER! (dead ball)

[11:00] Team_017 possession (Score: 38-54)
Bam Williamson drives, Bradley Gobert stays with him. Bam Williamson attempts a Layup. Contested by Bradley Gobert (3.6 feet, MAN). Bam Williamson misses. Rebound secured by Shai Westbrook.

[10:48] Team_006 possession (Score: 38-54)
Jayson Young drives to the basket... Jayson Young loses the ball! Stripped by Bam Williamson! TURNOVER! (live ball)

[10:36] Team_017 possession (Score: 38-54)
Bam Williamson drives and kicks out. Bam Williamson attempts a 3Pt. Contested by Bradley Gobert (2.6 feet, MAN). Bam Williamson misses. Offensive rebound by Bam Williamson! Bam Williamson's putback is no good. Rebound secured by Shai Westbrook.

[10:22] Team_006 possession (Score: 38-54)
Bradley Gobert drives, Bam Williamson stays with him. Bradley Gobert attempts a Dunk. Heavily contested by Bam Williamson (1.9 feet, ZONE)! BRADLEY GOBERT MAKES IT! Assist: Franz Wagner
Score: 40-54

[10:11] Team_017 possession (Score: 40-54)
Vince Banchero attempts a 3Pt. Contested by Franz Wagner (5.1 feet, MAN). VINCE BANCHERO MAKES IT! Assist: Desmond Reaves
Score: 40-57

[09:59] Team_006 possession (Score: 40-57)
Ja Butler makes the Dunk and draws the foul on Kyrie Middleton! And-1! Ja Butler to the line for 1. [Team fouls: 2] (Kyrie Middleton: 1 personal fouls)   FT 1/1: GOOD Ja Butler makes 1/1 from the line.
Score: 43-57

[09:45] Team_017 possession (Score: 43-57)
Kyrie Middleton attempts a Midrange. Contested by Ja Butler (2.8 feet, MAN). Kyrie Middleton misses. Rebound secured by Bradley Gobert.

[09:34] Team_006 possession (Score: 43-57)
Shai Westbrook attempts a Midrange. Contested by Desmond Reaves (4.9 feet, MAN). SHAI WESTBROOK MAKES IT! Assist: Franz Wagner
Score: 45-57

[09:21] Team_017 possession (Score: 45-57)
FOUL! Holding foul on Bradley Gobert. [Team fouls: 2] No free throws, side out. (Bradley Gobert: 1 personal fouls)

[09:07] Team_017 possession (Score: 45-57)
Tony Smith drives and kicks out. Bam Williamson attempts a 3Pt. Heavily contested by Shai Westbrook (1.4 feet, ZONE)! BAM WILLIAMSON MAKES IT! Assist: Vince Banchero
Score: 45-60

[08:52] Team_006 possession (Score: 45-60)
Franz Wagner attempts a 3Pt. Contested by Vince Banchero (2.9 feet, MAN). FRANZ WAGNER MAKES IT! Assist: Ja Butler
Score: 48-60

[08:37] Team_017 possession (Score: 48-60)
Vince Banchero attempts a Midrange. Contested by Franz Wagner (5.5 feet, MAN). VINCE BANCHERO MAKES IT!
Score: 48-62

[08:24] Team_006 possession (Score: 48-62)
Bradley Gobert drives to the basket... Bradley Gobert throws a bad pass! Stolen by Bam Williamson! TURNOVER! (live ball)

[08:10] Team_017 possession (Score: 48-62)
Vince Banchero drives, Franz Wagner stays with him. Vince Banchero attempts a Layup. Wide open! Franz Wagner is 6.9 feet away. [MAN] VINCE BANCHERO MAKES IT!
Score: 48-64

[07:54] Team_006 possession (Score: 48-64)
Franz Wagner drives to the basket... FOUL! Offensive foul on Franz Wagner! Bam Williamson drew the charge! [Team fouls: 3] (Franz Wagner: 1 personal fouls) TURNOVER! (dead ball)

[07:42] Team_017 possession (Score: 48-64)
Desmond Reaves attempts a Layup. Contested by Ja Butler (3.8 feet, ZONE). Desmond Reaves misses. Rebound secured by Shai Westbrook.

[07:26] Team_006 possession (Score: 48-64)
Franz Wagner attempts a 3Pt. Contested by Desmond Reaves (2.1 feet, ZONE). FRANZ WAGNER MAKES IT! Assist: Bradley Gobert
Score: 51-64

[07:08] Team_017 possession (Score: 51-64)
Desmond Reaves attempts a Midrange. Wide open! Jayson Young is 6.1 feet away. [ZONE] Desmond Reaves misses. Rebound secured by Bradley Gobert.

[06:53] Team_006 possession (Score: 51-64)
Bradley Gobert drives to the basket... Bradley Gobert loses the ball! Stripped by Bam Williamson! TURNOVER! (live ball)

[06:37] Team_017 possession (Score: 51-64)
Tony Smith attempts a 3Pt. Contested by Shai Westbrook (3.6 feet, ZONE). TONY SMITH MAKES IT! Assist: Bam Williamson
Score: 51-67

[06:23] Team_006 possession (Score: 51-67)
Franz Wagner attempts a Midrange. Contested by Kyrie Middleton (5.8 feet, ZONE). Franz Wagner misses. Rebound secured by Tony Smith.

[06:10] Team_017 possession (Score: 51-67)
Bam Williamson attempts a Midrange. Wide open! Bradley Gobert is 6.5 feet away. [MAN] BAM WILLIAMSON MAKES IT!
Score: 51-69

[05:56] Team_006 possession (Score: 51-69)
FOUL! Shooting foul on Desmond Reaves. Shai Westbrook to the line for 2 free throws. [Team fouls: 3] (Desmond Reaves: 1 personal fouls)   FT 1/2: MISS   FT 2/2: MISS Shai Westbrook makes 0/2 from the line. Rebound secured by Tony Smith.

[05:44] Team_017 possession (Score: 51-69)
Tony Smith drives, Jayson Young stays with him. Tony Smith attempts a Layup. Wide open! Jayson Young is 6.2 feet away. [MAN] Tony Smith misses. Rebound secured by Shai Westbrook.

[05:31] Team_006 possession (Score: 51-69)
Ja Butler attempts a Layup. Contested by Kyrie Middleton (5.8 feet, MAN). JA BUTLER MAKES IT! Assist: Franz Wagner
Score: 53-69

[05:13] Team_017 possession (Score: 53-69)
Kyrie Middleton drives to the basket... Kyrie Middleton throws a bad pass! Stolen by Bradley Gobert! TURNOVER! (live ball)

[04:57] Team_006 possession (Score: 53-69)
Jayson Young attempts a Layup. Heavily contested by Tony Smith (0.6 feet, MAN)! Jayson Young misses. Offensive rebound by Bradley Gobert! Bradley Gobert kicks it out.

[04:43] Team_006 possession (Score: 53-69)
Shai Westbrook attempts a 3Pt. Contested by Tony Smith (2.6 feet, ZONE). Shai Westbrook misses. Rebound secured by Tony Smith.

[04:27] Team_017 possession (Score: 53-69)
Bam Williamson attempts a Layup. Heavily contested by Bradley Gobert (1.7 feet, MAN)! Bam Williamson misses. Rebound secured by Ja Butler.

[04:12] Team_006 possession (Score: 53-69)
Shai Westbrook attempts a 3Pt. Heavily contested by Tony Smith (0.5 feet, ZONE)! SHAI WESTBROOK MAKES IT! Assist: Jayson Young
Score: 56-69

[04:01] Team_017 possession (Score: 56-69)
Kyrie Middleton attempts a Midrange. Contested by Ja Butler (3.7 feet, MAN). Kyrie Middleton misses. Rebound secured by Shai Westbrook.

[03:43] Team_006 possession (Score: 56-69)
Franz Wagner attempts a 3Pt. Contested by Vince Banchero (4.4 feet, MAN). Franz Wagner misses. Rebound secured by Bam Williamson.

[03:32] Team_017 possession (Score: 56-69)
Desmond Reaves attempts a 3Pt. Contested by Shai Westbrook (3.0 feet, ZONE). Desmond Reaves misses. Rebound secured by Shai Westbrook.

[03:18] Team_006 possession (Score: 56-69)
Bradley Gobert attempts a Midrange. Contested by Bam Williamson (3.9 feet, MAN). Bradley Gobert misses. Rebound secured by Kyrie Middleton.

[03:07] Team_017 possession (Score: 56-69)
FOUL! Reach-in foul on Bradley Gobert during the drive. [Team fouls: 4] No free throws, side out. (Bradley Gobert: 2 personal fouls)

[02:52] Team_017 possession (Score: 56-69)
Tony Smith attempts a Midrange. Wide open! Franz Wagner is 6.4 feet away. [ZONE] TONY SMITH MAKES IT!
Score: 56-71

[02:38] Team_006 possession (Score: 56-71)
Bradley Gobert attempts a Midrange. Contested by Kyrie Middleton (2.8 feet, ZONE). Bradley Gobert misses. Offensive rebound by Bradley Gobert! Bradley Gobert kicks it out.

[02:25] Team_006 possession (Score: 56-71)
Jayson Young makes the Layup and draws the foul on Bam Williamson! And-1! Jayson Young to the line for 1. [Team fouls: 4] (Bam Williamson: 1 personal fouls)   FT 1/1: GOOD Jayson Young makes 1/1 from the line.
Score: 59-71

[02:12] Team_017 possession (Score: 59-71)
Tony Smith attempts a Layup. BLOCKED BY BRADLEY GOBERT! Ball is loose! Rebound secured by Ja Butler.

[01:58] Team_006 possession (Score: 59-71)
Ja Butler attempts a Midrange. Wide open! Kyrie Middleton is 7.7 feet away. [MAN] JA BUTLER MAKES IT!
Score: 61-71

[01:42] Team_017 possession (Score: 61-71)
Tony Smith throws a bad pass! Stolen by Jayson Young! TURNOVER! (live ball)

[01:29] Team_006 possession (Score: 61-71)
Bradley Gobert attempts a Layup. BLOCKED BY BAM WILLIAMSON! Ball is loose! Rebound secured by Kyrie Middleton.

[01:14] Team_017 possession (Score: 61-71)
Vince Banchero attempts a 3Pt. Contested by Franz Wagner (4.3 feet, ZONE). VINCE BANCHERO MAKES IT! Assist: Bam Williamson
Score: 61-74

[01:03] Team_006 possession (Score: 61-74)
Shai Westbrook attempts a 3Pt. Contested by Tony Smith (4.1 feet, ZONE). Shai Westbrook misses. Rebound secured by Tony Smith.

[00:49] Team_017 possession (Score: 61-74)
Vince Banchero attempts a 3Pt. Contested by Jayson Young (3.4 feet, ZONE). VINCE BANCHERO MAKES IT! Assist: Bam Williamson
Score: 61-77

[00:29] Team_006 possession (Score: 61-77)
Shai Westbrook drives, Desmond Reaves stays with him. Shai Westbrook attempts a Layup. Wide open! Desmond Reaves is 8.8 feet away. [MAN] SHAI WESTBROOK MAKES IT! Assist: Jayson Young
Score: 63-77

[00:17] Team_017 possession (Score: 63-77)
Kyrie Middleton attempts a Layup. Contested by Bradley Gobert (4.2 feet, ZONE). KYRIE MIDDLETON MAKES IT! Assist: Tony Smith
Score: 63-79

[00:04] Team_006 possession (Score: 63-79)
Jayson Young drives and kicks out. Jayson Young attempts a 3Pt. Wide open! Tony Smith is 6.8 feet away. [ZONE] Jayson Young misses. Rebound secured by Kyrie Middleton.

================================================================================
                              3RD QUARTER COMPLETE                              
================================================================================

3RD QUARTER SCORE: Team_006 25, Team_017 27

BOX SCORE:
================================================================================

Team_006
--------------------------------------------------------------------------------
Player                MIN  PTS  REB  AST  TO      FG   FG%      3P   3P%
--------------------------------------------------------------------------------
Shai Westbrook         27    7    6    0   0   3/6    50.0     0/0   0.0
Ja Butler              27    7    2    1   0   3/3   100.0     0/0   0.0
Franz Wagner           27    6    0    3   0   2/4    50.0     0/0   0.0
Jayson Young           27    3    0    2   0   1/2    50.0     0/0   0.0
Bradley Gobert         27    2    4    1   0   1/4    25.0     0/0   0.0

TEAM: FG: 10/19 (52.6%), 3PT: 3/6 (50.0%), REB: 11 (2 off, 9 def), AST: 7, TO: 5
TEAM FOULS: 4


Team_017
--------------------------------------------------------------------------------
Player                MIN  PTS  REB  AST  TO      FG   FG%      3P   3P%
--------------------------------------------------------------------------------
Vince Banchero         27   15    0    1   0   6/6   100.0     0/0   0.0
Bam Williamson         27    5    2    3   0   2/5    40.0     0/0   0.0
Tony Smith             27    5    4    1   0   2/4    50.0     0/0   0.0
Kyrie Middleton        27    2    3    0   0   1/3    33.3     0/0   0.0
Desmond Reaves         27    0    0    1   0   0/3     0.0     0/0   0.0

TEAM: FG: 11/21 (52.4%), 3PT: 4/5 (80.0%), REB: 10 (1 off, 9 def), AST: 6, TO: 2
TEAM FOULS: 4

================================================================================

================================================================================
                       4TH QUARTER - Team_006 vs Team_017                       
================================================================================

[12:00] Substitution (Team_006): Shai Westbrook OUT (stamina: 69) → Miles Harris IN (comeback_detected)

[12:00] Substitution (Team_017): Desmond Reaves OUT (stamina: 67) → Blake Reaves IN (comeback_detected)

[12:00] Team_006 possession (Score: 63-79)
Bradley Gobert drives and kicks out. Bradley Gobert attempts a Midrange. Contested by Bam Williamson (4.1 feet, MAN). Bradley Gobert misses. Rebound secured by Bam Williamson.

[11:48] Team_017 possession (Score: 63-79)
FOUL! Reach-in foul on Bradley Gobert during the drive. [Team fouls: 1] No free throws, side out. (Bradley Gobert: 1 personal fouls)

[11:33] Team_017 possession (Score: 63-79)
FOUL! Reach-in foul on Bradley Gobert during the drive. [Team fouls: 2] No free throws, side out. (Bradley Gobert: 2 personal fouls)

[11:20] Team_017 possession (Score: 63-79)
Blake Reaves makes the Layup and draws the foul on Franz Wagner! And-1! Blake Reaves to the line for 1. [Team fouls: 3] (Franz Wagner: 1 personal fouls)   FT 1/1: GOOD Blake Reaves makes 1/1 from the line.
Score: 63-82

[11:08] Team_006 possession (Score: 63-82)
Franz Wagner drives, Vince Banchero stays with him. Franz Wagner attempts a Layup. Contested by Vince Banchero (4.8 feet, MAN). FRANZ WAGNER MAKES IT! Assist: Jayson Young
Score: 65-82

[10:53] Team_017 possession (Score: 65-82)
Tony Smith attempts a 3Pt. Wide open! Miles Harris is 6.1 feet away. [ZONE] Tony Smith misses. Rebound secured by Bradley Gobert.

[10:37] Team_006 possession (Score: 65-82)
Ja Butler attempts a 3Pt. Contested by Kyrie Middleton (4.2 feet, MAN). Ja Butler misses. Offensive rebound by Bradley Gobert! Bradley Gobert kicks it out.

[10:20] Team_006 possession (Score: 65-82)
Ja Butler attempts a Layup. Wide open! Kyrie Middleton is 6.7 feet away. [MAN] JA BUTLER MAKES IT! Assist: Jayson Young
Score: 67-82

[10:06] Team_017 possession (Score: 67-82)
Bam Williamson attempts a Midrange. Contested by Franz Wagner (5.0 feet, ZONE). Bam Williamson misses. Rebound secured by Bradley Gobert.

[09:51] Team_006 possession (Score: 67-82)
Jayson Young attempts a 3Pt. Wide open! Tony Smith is 8.1 feet away. [ZONE] JAYSON YOUNG MAKES IT! Assist: Ja Butler
Score: 70-82

[09:39] Team_017 possession (Score: 70-82)
FOUL! Shooting foul on Jayson Young. Tony Smith to the line for 2 free throws. [Team fouls: 4] (Jayson Young: 1 personal fouls)   FT 1/2: GOOD   FT 2/2: MISS Tony Smith makes 1/2 from the line. Rebound secured by Ja Butler.
Score: 70-83

[09:26] Team_006 possession (Score: 70-83)
Miles Harris attempts a Layup. Contested by Bam Williamson (3.0 feet, ZONE). Miles Harris misses. Rebound secured by Kyrie Middleton.

[09:10] Team_017 possession (Score: 70-83)
Kyrie Middleton attempts a Midrange. Contested by Ja Butler (2.8 feet, MAN). KYRIE MIDDLETON MAKES IT! Assist: Blake Reaves
Score: 70-85

[08:55] Team_006 possession (Score: 70-85)
Bradley Gobert makes the Layup and draws the foul on Bam Williamson! And-1! Bradley Gobert to the line for 1. [Team fouls: 1] (Bam Williamson: 1 personal fouls)   FT 1/1: GOOD Bradley Gobert makes 1/1 from the line.
Score: 73-85

[08:46] Team_017 possession (Score: 73-85)
Kyrie Middleton attempts a 3Pt. Contested by Ja Butler (2.0 feet, MAN). Kyrie Middleton misses. Rebound secured by Bradley Gobert.

[08:31] Team_006 possession (Score: 73-85)
Jayson Young attempts a 3Pt. Contested by Tony Smith (2.7 feet, ZONE). Jayson Young misses. Rebound secured by Tony Smith.

[08:14] Team_017 possession (Score: 73-85)
FOUL! Holding foul on Ja Butler. [IN THE BONUS! 5 team fouls] Kyrie Middleton to the line for 2 free throws. (Ja Butler: 1 personal fouls)   FT 1/2: MISS   FT 2/2: MISS Kyrie Middleton makes 0/2 from the line. Rebound secured by Ja Butler.

[07:59] Team_006 possession (Score: 73-85)
Bradley Gobert attempts a Midrange. Contested by Vince Banchero (3.8 feet, ZONE). Bradley Gobert misses. Rebound secured by Kyrie Middleton.

[07:49] Team_017 possession (Score: 73-85)
Blake Reaves drives, Miles Harris stays with him. Blake Reaves attempts a Layup. Contested by Miles Harris (5.2 feet, MAN). BLAKE REAVES MAKES IT! Assist: Bam Williamson
Score: 73-87

[07:39] Team_006 possession (Score: 73-87)
Jayson Young drives to the basket... Jayson Young loses control! Ball rolls out of bounds! TURNOVER! (dead ball)

[07:39] Substitution (Team_006): Franz Wagner OUT → Lamelo Westbrook IN (stamina_rule2)

[07:39] Substitution (Team_006): Jayson Young OUT → Vince Sabonis IN (stamina_rule2)

[07:39] Substitution (Team_006): Ja Butler OUT → Cade Ball IN (stamina_rule2)

[07:39] Substitution (Team_006): Bradley Gobert OUT → Shaquille Sexton IN (stamina_rule2)

[07:39] Substitution (Team_017): Vince Banchero OUT → Tobias Bridges IN (stamina_rule2)

[07:39] Substitution (Team_017): Tony Smith OUT → Shaquille Stewart IN (stamina_rule2)

[07:39] Substitution (Team_017): Kyrie Middleton OUT → Ja Stewart IN (stamina_rule2)

[07:39] Substitution (Team_017): Bam Williamson OUT → Klay Holiday IN (stamina_rule2)

[07:28] Team_017 possession (Score: 73-87)
Ja Stewart throws a bad pass out of bounds! TURNOVER! (dead ball)

[07:16] Team_006 possession (Score: 73-87)
Miles Harris drives to the basket... Miles Harris loses control! Ball rolls out of bounds! TURNOVER! (dead ball)

[06:58] Team_017 possession (Score: 73-87)
Blake Reaves makes the Dunk and draws the foul on Miles Harris! And-1! Blake Reaves to the line for 1. [BONUS: 6 team fouls] (Miles Harris: 1 personal fouls)   FT 1/1: GOOD Blake Reaves makes 1/1 from the line.
Score: 73-90

[06:45] Team_006 possession (Score: 73-90)
Vince Sabonis attempts a Midrange. Contested by Shaquille Stewart (2.3 feet, MAN). Vince Sabonis misses. Offensive rebound by Cade Ball! Cade Ball kicks it out.

[06:29] Team_006 possession (Score: 73-90)
Shaquille Sexton attempts a Midrange. Heavily contested by Klay Holiday (0.7 feet, MAN)! Shaquille Sexton misses. Rebound secured by Klay Holiday.

[06:15] Team_017 possession (Score: 73-90)
Ja Stewart drives, Cade Ball stays with him. Ja Stewart attempts a Layup. Contested by Cade Ball (4.9 feet, MAN). JA STEWART MAKES IT! Assist: Blake Reaves
Score: 73-92

[05:58] Team_006 possession (Score: 73-92)
Lamelo Westbrook attempts a Midrange. Heavily contested by Tobias Bridges (1.8 feet, ZONE)! Lamelo Westbrook misses. Offensive rebound by Cade Ball! Cade Ball kicks it out.

[05:43] Team_006 possession (Score: 73-92)
Lamelo Westbrook drives to the basket... Lamelo Westbrook throws a bad pass out of bounds! TURNOVER! (dead ball)

[05:27] Team_017 possession (Score: 73-92)
Ja Stewart attempts a 3Pt. Heavily contested by Lamelo Westbrook (0.8 feet, ZONE)! Ja Stewart misses. Rebound secured by Vince Sabonis.

[05:09] Team_006 possession (Score: 73-92)
Cade Ball drives and kicks out. FOUL! Shooting foul on Blake Reaves. Miles Harris to the line for 3 free throws. [Team fouls: 2] (Blake Reaves: 1 personal fouls)   FT 1/3: GOOD   FT 2/3: GOOD   FT 3/3: MISS Miles Harris makes 2/3 from the line. Rebound secured by Klay Holiday.
Score: 75-92

[04:53] Team_017 possession (Score: 75-92)
Tobias Bridges attempts a 3Pt. Contested by Lamelo Westbrook (4.8 feet, ZONE). Tobias Bridges misses. Rebound secured by Vince Sabonis.

[04:35] Team_006 possession (Score: 75-92)
Vince Sabonis attempts a 3Pt. Contested by Tobias Bridges (4.8 feet, ZONE). VINCE SABONIS MAKES IT!
Score: 78-92

[04:26] Team_017 possession (Score: 78-92)
Blake Reaves attempts a 3Pt. BLOCKED BY MILES HARRIS! Ball deflects out of bounds off Blake Reaves.

[04:09] Team_006 possession (Score: 78-92)
FOUL! Holding foul on Shaquille Stewart. [Team fouls: 3] No free throws, side out. (Shaquille Stewart: 1 personal fouls)

[03:57] Team_006 possession (Score: 78-92)
FOUL! Offensive foul on Shaquille Sexton! Klay Holiday drew the charge! [Team fouls: 7] (Shaquille Sexton: 1 personal fouls) TURNOVER! (dead ball)

[03:46] Team_017 possession (Score: 78-92)
FOUL! Holding foul on Lamelo Westbrook. [IN THE BONUS! 8 team fouls] Tobias Bridges to the line for 2 free throws. (Lamelo Westbrook: 1 personal fouls)   FT 1/2: GOOD   FT 2/2: GOOD Tobias Bridges makes 2/2 from the line.
Score: 78-94

[03:32] Team_006 possession (Score: 78-94)
Lamelo Westbrook attempts a 3Pt. Contested by Tobias Bridges (4.6 feet, MAN). Lamelo Westbrook misses. Rebound secured by Shaquille Stewart.

[03:18] Team_017 possession (Score: 78-94)
Tobias Bridges attempts a 3Pt. Contested by Lamelo Westbrook (4.6 feet, ZONE). Tobias Bridges misses. Rebound secured by Shaquille Sexton.

[03:05] Team_006 possession (Score: 78-94)
Vince Sabonis attempts a Layup. Contested by Ja Stewart (6.0 feet, ZONE). VINCE SABONIS MAKES IT! Assist: Cade Ball
Score: 80-94

[02:51] Team_017 possession (Score: 80-94)
Shaquille Stewart attempts a 3Pt. Contested by Lamelo Westbrook (4.7 feet, ZONE). Shaquille Stewart misses. Rebound secured by Cade Ball.

[02:35] Team_006 possession (Score: 80-94)
Miles Harris attempts a Layup. Contested by Blake Reaves (5.0 feet, MAN). MILES HARRIS MAKES IT!
Score: 82-94

[02:24] Team_017 possession (Score: 82-94)
Blake Reaves loses the ball! Stripped by Miles Harris! TURNOVER! (live ball)

[02:12] Team_006 possession (Score: 82-94)
Shaquille Sexton attempts a Midrange. Contested by Tobias Bridges (4.8 feet, ZONE). Shaquille Sexton misses. Rebound secured by Klay Holiday.

[01:54] Team_017 possession (Score: 82-94)
Ja Stewart drives, Cade Ball stays with him. Ja Stewart attempts a Layup. Contested by Cade Ball (2.8 feet, ZONE). Ja Stewart misses. Offensive rebound by Shaquille Stewart! Shaquille Stewart kicks it out.

[01:43] Team_017 possession (Score: 82-94)
FOUL! Holding foul on Vince Sabonis. [IN THE BONUS! 9 team fouls] Shaquille Stewart to the line for 2 free throws. (Vince Sabonis: 1 personal fouls)   FT 1/2: GOOD   FT 2/2: MISS Shaquille Stewart makes 1/2 from the line. Rebound secured by Cade Ball.
Score: 82-95

[01:28] Team_006 possession (Score: 82-95)
Lamelo Westbrook attempts a Midrange. Contested by Tobias Bridges (5.1 feet, MAN). Lamelo Westbrook misses. Rebound secured by Shaquille Stewart.

[01:16] Team_017 possession (Score: 82-95)
FOUL! Shooting foul on Lamelo Westbrook. Ja Stewart to the line for 2 free throws. [BONUS: 10 team fouls] (Lamelo Westbrook: 2 personal fouls)   FT 1/2: GOOD   FT 2/2: MISS Ja Stewart makes 1/2 from the line. Rebound secured by Cade Ball.
Score: 82-96

[01:00] Team_006 possession (Score: 82-96)
Miles Harris drives, picks up Blake Reaves. Help arrives from Tobias Bridges! Miles Harris attempts a Dunk. Wide open! Tobias Bridges is 9.1 feet away. [MAN] MILES HARRIS MAKES IT!
Score: 84-96

[00:46] Team_017 possession (Score: 84-96)
Ja Stewart attempts a 3Pt. Contested by Cade Ball (5.3 feet, MAN). Ja Stewart misses. Rebound secured by Cade Ball.

[00:32] Team_006 possession (Score: 84-96)
Lamelo Westbrook attempts a 3Pt. Contested by Tobias Bridges (5.0 feet, MAN). LAMELO WESTBROOK MAKES IT! Assist: Miles Harris
Score: 87-96

[00:19] Team_017 possession (Score: 87-96)
Blake Reaves attempts a 3Pt. Contested by Miles Harris (2.7 feet, MAN). Blake Reaves misses. Rebound secured by Shaquille Sexton.

[00:09] Team_006 possession (Score: 87-96)
Shaquille Sexton attempts a Layup. Wide open! Klay Holiday is 6.6 feet away. [MAN] Shaquille Sexton misses. Rebound secured by Klay Holiday.

================================================================================
                              4TH QUARTER COMPLETE                              
================================================================================

4TH QUARTER SCORE: Team_006 24, Team_017 17

BOX SCORE:
================================================================================

Team_006
--------------------------------------------------------------------------------
Player                MIN  PTS  REB  AST  TO      FG   FG%      3P   3P%
--------------------------------------------------------------------------------
Vince Sabonis          17    5    2    0   0   2/2   100.0     0/0   0.0
Miles Harris           22    4    0    1   0   2/3    66.7     0/0   0.0
Bradley Gobert         31    3    4    0   0   1/3    33.3     0/0   0.0
Jayson Young           31    3    0    2   0   1/2    50.0     0/0   0.0
Lamelo Westbrook       17    3    0    0   0   1/3    33.3     0/0   0.0
Franz Wagner           31    2    0    0   0   1/1   100.0     0/0   0.0
Ja Butler              31    2    2    1   0   1/1   100.0     0/0   0.0
Cade Ball              17    0    6    1   0   0/1     0.0     0/0   0.0
Shaquille Sexton       17    0    2    0   0   0/3     0.0     0/0   0.0

TEAM: FG: 9/19 (47.4%), 3PT: 3/5 (60.0%), REB: 16 (3 off, 13 def), AST: 5, TO: 4
TEAM FOULS: 10 [Team_017 in BONUS]


Team_017
--------------------------------------------------------------------------------
Player                MIN  PTS  REB  AST  TO      FG   FG%      3P   3P%
--------------------------------------------------------------------------------
Blake Reaves           22    8    0    2   0   3/5    60.0     0/0   0.0
Kyrie Middleton        31    2    2    0   0   1/2    50.0     0/0   0.0
Ja Stewart             17    2    0    0   0   1/4    25.0     0/0   0.0
Tobias Bridges         17    2    0    0   0   1/3    33.3     0/0   0.0
Bam Williamson         31    0    1    1   0   0/1     0.0     0/0   0.0
Tony Smith             31    0    1    0   0   0/2     0.0     0/0   0.0
Klay Holiday           17    0    4    0   0   0/0     0.0     0/0   0.0
Shaquille Stewart      17    0    3    0   0   0/1     0.0     0/0   0.0

TEAM: FG: 6/20 (30.0%), 3PT: 0/9 (0.0%), REB: 11 (1 off, 10 def), AST: 3, TO: 2
TEAM FOULS: 3

================================================================================

================================================================================
                               FULL GAME COMPLETE                               
================================================================================

FINAL SCORE: Team_006 87, Team_017 96

SCORING BY QUARTER:
--------------------------------------------------------------------------------
Team                     Q1     Q2     Q3     Q4    FINAL
--------------------------------------------------------------------------------
Team_006                 18     20     25     24       87
Team_017                 23     29     27     17       96
--------------------------------------------------------------------------------

FULL GAME BOX SCORE:
================================================================================

Team_006
--------------------------------------------------------------------------------
Player                MIN  PTS  REB  AST  TO      FG   FG%      3P   3P%      FT STL BLK
--------------------------------------------------------------------------------
Franz Wagner           31    8    0    4   2   4/7    57.1   2/3    66.7   0/0     0   0
Ja Butler              31   22   11    3   3   8/9    88.9   0/1     0.0   2/3     0   0
Bradley Gobert         31    7   13    2   3   5/12   41.7   0/0     0.0   1/1     1   3
Jayson Young           31    8    0    4   1   3/10   30.0   1/5    20.0   1/1     1   1
Shai Westbrook         27   10    9    3   4   4/9    44.4   1/4    25.0   1/3     0   0
Miles Harris           22   10    0    1   2   4/6    66.7   1/2    50.0   3/4     1   1
Vince Sabonis          17    8    3    0   1   3/6    50.0   2/3    66.7   0/0     0   0
Lamelo Westbrook       17    6    0    1   0   2/5    40.0   2/4    50.0   0/0     0   0
Cade Ball              17    0   10    1   1   0/3     0.0   0/1     0.0   0/0     1   0
Shaquille Sexton       17    6    7    1   2   3/6    50.0   0/0     0.0   2/2     0   0

TEAM: FG: 36/73 (49.3%), 3PT: 9/23 (39.1%), REB: 52 (13 off, 39 def), AST: 20, TO: 19


Team_017
--------------------------------------------------------------------------------
Player                MIN  PTS  REB  AST  TO      FG   FG%      3P   3P%      FT STL BLK
--------------------------------------------------------------------------------
Bam Williamson         31   10    6    7   1   3/10   30.0   0/0     0.0   1/2     3   3
Vince Banchero         31   20    0    2   0   8/13   61.5   4/6    66.7   2/2     0   0
Tony Smith             31    9    7    2   2   5/11   45.5   1/3    33.3   1/2     0   0
Kyrie Middleton        31   11   11    0   1   5/8    62.5   1/2    50.0   2/4     3   0
Desmond Reaves         27    6    0    1   1   2/9    22.2   1/5    20.0   1/1     0   0
Blake Reaves           22   11    0    2   2   4/6    66.7   1/3    33.3   2/2     0   0
Tobias Bridges         17    4    0    1   0   0/4     0.0   0/3     0.0   4/4     0   0
Shaquille Stewart      17    3   10    3   2   2/5    40.0   0/1     0.0   2/3     0   0
Ja Stewart             17   17    2    1   1   5/8    62.5   2/4    50.0   3/4     0   0
Klay Holiday           17    0    5    2   0   0/0     0.0   0/0     0.0   0/0     0   0

TEAM: FG: 37/79 (46.8%), 3PT: 10/27 (37.0%), REB: 42 (6 off, 36 def), AST: 21, TO: 10

================================================================================
