================================================================================
                        FULL GAME - Team_099 vs Team_095                        
================================================================================

================================================================================
                       1ST QUARTER - Team_099 vs Team_095                       
================================================================================

[12:00] Team_099 possession (Score: 0-0)
Damian Ginobili drives, Evan Carter stays with him. Damian Ginobili attempts a Dunk. Contested by Evan Carter (4.7 feet, MAN). Damian Ginobili misses. Offensive rebound by Larry Wade! Larry Wade puts it back in!
Score: 2-0

[11:44] Team_095 possession (Score: 2-0)
FOUL! Shooting foul on Ayo Barrett. Dejounte Hyland to the line for 2 free throws. [Team fouls: 1] (Ayo Barrett: 1 personal fouls)   FT 1/2: GOOD   FT 2/2: GOOD Dejounte Hyland makes 2/2 from the line.
Score: 2-2

[11:25] Team_099 possession (Score: 2-2)
Damian Ginobili attempts a 3Pt. Contested by Evan Carter (5.7 feet, ZONE). Damian Ginobili misses. Offensive rebound by Vince Lillard! Vince Lillard puts it back in!
Score: 4-2

[11:09] Team_095 possession (Score: 4-2)
Immanuel Middleton drives to the basket... Immanuel Middleton throws a bad pass! Stolen by Vince Lillard! TURNOVER! (live ball)

[10:51] Team_099 possession (Score: 4-2)
Vince Lillard drives to the basket... Vince Lillard commits a violation (traveling/carry)! TURNOVER! (dead ball)

[10:35] Team_095 possession (Score: 4-2)
Immanuel Middleton drives to the basket... FOUL! Offensive foul on Immanuel Middleton! Vince Lillard drew the charge! [Team fouls: 1] (Immanuel Middleton: 1 personal fouls) TURNOVER! (dead ball)

[10:23] Team_099 possession (Score: 4-2)
Damian Ginobili attempts a 3Pt. Contested by Evan Carter (4.5 feet, MAN). Damian Ginobili misses. Rebound secured by Evan Carter.

[10:08] Team_095 possession (Score: 4-2)
Shaquille Ball attempts a 3Pt. Heavily contested by Ayo Barrett (1.5 feet, ZONE)! Shaquille Ball misses. Rebound secured by Vince Lillard.

[09:57] Team_099 possession (Score: 4-2)
Ayo Barrett drives to the basket... Ayo Barrett loses the ball! Stripped by Dejounte Hyland! TURNOVER! (live ball)

[09:38] Team_095 possession (Score: 4-2)
Shaquille Ball attempts a 3Pt. Contested by Larry James (4.6 feet, MAN). SHAQUILLE BALL MAKES IT! Assist: Immanuel Middleton
Score: 4-5

[09:24] Team_099 possession (Score: 4-5)
Ayo Barrett attempts a 3Pt. Contested by Evan Carter (2.1 feet, ZONE). Ayo Barrett misses. Offensive rebound by Vince Lillard! Vince Lillard's putback is no good. Rebound secured by Dejounte Hyland.

[09:08] Team_095 possession (Score: 4-5)
Dejounte Hyland attempts a 3Pt. Contested by Ayo Barrett (2.1 feet, MAN). Dejounte Hyland misses. Rebound secured by Vince Lillard.

[08:55] Team_099 possession (Score: 4-5)
Larry James attempts a Midrange. Wide open! Shaquille Ball is 6.0 feet away. [MAN] Larry James misses. Offensive rebound by Vince Lillard! Vince Lillard puts it back in!
Score: 6-5

[08:45] Team_095 possession (Score: 6-5)
FOUL! Holding foul on Larry Wade. [Team fouls: 2] No free throws, side out. (Larry Wade: 1 personal fouls)

[08:30] Team_095 possession (Score: 6-5)
Evan Carter attempts a Midrange. Contested by Damian Ginobili (2.7 feet, MAN). EVAN CARTER MAKES IT! Assist: Kyrie Ming
Score: 6-7

[08:13] Team_099 possession (Score: 6-7)
Vince Lillard drives and kicks out. Larry Wade attempts a 3Pt. Heavily contested by Kyrie Ming (0.5 feet, MAN)! Larry Wade misses. Offensive rebound by Vince Lillard! Vince Lillard's putback is no good. Rebound secured by Dejounte Hyland.

[07:55] Team_095 possession (Score: 6-7)
Shaquille Ball drives to the basket... FOUL! Offensive foul on Shaquille Ball! Larry James drew the charge! [Team fouls: 2] (Shaquille Ball: 1 personal fouls) TURNOVER! (dead ball)

[07:41] Team_099 possession (Score: 6-7)
Damian Ginobili makes the Layup and draws the foul on Immanuel Middleton! And-1! Damian Ginobili to the line for 1. [Team fouls: 3] (Immanuel Middleton: 2 personal fouls)   FT 1/1: MISS Damian Ginobili makes 0/1 from the line. Rebound secured by Evan Carter.
Score: 8-7

[07:29] Team_095 possession (Score: 8-7)
Dejounte Hyland attempts a 3Pt. Contested by Ayo Barrett (2.5 feet, ZONE). Dejounte Hyland misses. Rebound secured by Larry Wade.

[07:16] Team_099 possession (Score: 8-7)
Larry James attempts a 3Pt. Wide open! Evan Carter is 6.8 feet away. [ZONE] Larry James misses. Rebound secured by Dejounte Hyland.

[07:02] Team_095 possession (Score: 8-7)
Immanuel Middleton attempts a Midrange. Wide open! Larry James is 6.2 feet away. [ZONE] Immanuel Middleton misses. Rebound secured by Vince Lillard.

[06:50] Team_099 possession (Score: 8-7)
Vince Lillard attempts a Layup. Contested by Immanuel Middleton (2.7 feet, ZONE). VINCE LILLARD MAKES IT!
Score: 10-7

[06:38] Team_095 possession (Score: 10-7)
FOUL! Shooting foul on Ayo Barrett. Evan Carter to the line for 3 free throws. [Team fouls: 3] (Ayo Barrett: 2 personal fouls)   FT 1/3: MISS   FT 2/3: GOOD   FT 3/3: GOOD Evan Carter makes 2/3 from the line.
Score: 10-9

[06:26] Team_099 possession (Score: 10-9)
Larry James attempts a Midrange. Wide open! Shaquille Ball is 6.1 feet away. [ZONE] Larry James misses. Rebound secured by Shaquille Ball.

[06:15] Team_095 possession (Score: 10-9)
Evan Carter attempts a Midrange. Contested by Ayo Barrett (2.5 feet, ZONE). EVAN CARTER MAKES IT!
Score: 10-11

[06:02] Team_099 possession (Score: 10-11)
Ayo Barrett attempts a 3Pt. Heavily contested by Evan Carter (1.6 feet, ZONE)! AYO BARRETT MAKES IT! Assist: Damian Ginobili
Score: 13-11

[05:50] Team_095 possession (Score: 13-11)
Evan Carter attempts a 3Pt. Contested by Damian Ginobili (3.9 feet, MAN). Evan Carter misses. FOUL! Loose ball foul on Damian Ginobili during the rebound battle. [Team fouls: 4] No free throws, side out. (Damian Ginobili: 1 personal fouls)

[05:34] Team_095 possession (Score: 13-11)
Dejounte Hyland attempts a Midrange. Contested by Ayo Barrett (3.7 feet, MAN). DEJOUNTE HYLAND MAKES IT!
Score: 13-13

[05:18] Team_099 possession (Score: 13-13)
Damian Ginobili drives, Immanuel Middleton stays with him. Damian Ginobili attempts a Layup. Heavily contested by Immanuel Middleton (1.8 feet, ZONE)! DAMIAN GINOBILI MAKES IT! Assist: Larry James
Score: 15-13

[05:01] Team_095 possession (Score: 15-13)
Evan Carter attempts a 3Pt. Contested by Ayo Barrett (3.7 feet, ZONE). Evan Carter misses. Rebound secured by Larry Wade.

[04:45] Team_099 possession (Score: 15-13)
Vince Lillard drives and kicks out. Ayo Barrett attempts a 3Pt. Wide open! Dejounte Hyland is 7.9 feet away. [MAN] AYO BARRETT MAKES IT! Assist: Larry Wade
Score: 18-13

[04:32] Team_095 possession (Score: 18-13)
Shaquille Ball attempts a 3Pt. Wide open! Larry James is 8.9 feet away. [MAN] Shaquille Ball misses. Rebound secured by Vince Lillard.

[04:15] Team_099 possession (Score: 18-13)
Damian Ginobili attempts a 3Pt. Contested by Evan Carter (4.4 feet, MAN). DAMIAN GINOBILI MAKES IT! Assist: Larry James
Score: 21-13

[03:59] Team_095 possession (Score: 21-13)
Immanuel Middleton attempts a 3Pt. Contested by Vince Lillard (3.1 feet, MAN). Immanuel Middleton misses. Offensive rebound by Evan Carter! Evan Carter's putback is no good. Rebound secured by Larry Wade.

[03:48] Team_099 possession (Score: 21-13)
Larry Wade attempts a 3Pt. Contested by Evan Carter (3.2 feet, ZONE). Larry Wade misses. Rebound secured by Shaquille Ball.

[03:33] Team_095 possession (Score: 21-13)
Dejounte Hyland attempts a Layup. Contested by Vince Lillard (3.0 feet, ZONE). DEJOUNTE HYLAND MAKES IT! Assist: Evan Carter
Score: 21-15

[03:19] Team_099 possession (Score: 21-15)
Larry Wade attempts a Midrange. Wide open! Kyrie Ming is 6.3 feet away. [MAN] Larry Wade misses. Offensive rebound by Vince Lillard! Vince Lillard's putback is no good. Rebound secured by Dejounte Hyland.

[03:04] Team_095 possession (Score: 21-15)
Immanuel Middleton attempts a 3Pt. Heavily contested by Vince Lillard (0.5 feet, MAN)! Immanuel Middleton misses. Offensive rebound by Dejounte Hyland! Dejounte Hyland kicks it out.

[02:48] Team_095 possession (Score: 21-15)
Kyrie Ming drives to the basket... Kyrie Ming throws a bad pass out of bounds! TURNOVER! (dead ball)

[02:48] Substitution (Team_099): Vince Lillard OUT → Donovan Green IN (stamina_rule2)

[02:48] Substitution (Team_095): Immanuel Middleton OUT → Gary Davis IN (stamina_rule2)

[02:48] Substitution (Team_095): Kyrie Ming OUT → DeMar McCollum IN (stamina_rule2)

[02:36] Team_099 possession (Score: 21-15)
Donovan Green attempts a Midrange. Wide open! Gary Davis is 8.5 feet away. [ZONE] Donovan Green misses. Offensive rebound by Larry Wade! Larry Wade kicks it out.

[02:25] Team_099 possession (Score: 21-15)
Donovan Green drives, picks up DeMar McCollum. Help arrives from Dejounte Hyland! Donovan Green attempts a Layup. Wide open! Dejounte Hyland is 6.9 feet away. [ZONE] Donovan Green misses. Rebound secured by DeMar McCollum.

[02:10] Team_095 possession (Score: 21-15)
Shaquille Ball attempts a 3Pt. Heavily contested by Ayo Barrett (1.2 feet, ZONE)! SHAQUILLE BALL MAKES IT! Assist: Gary Davis
Score: 21-18

[01:54] Team_099 possession (Score: 21-18)
Ayo Barrett attempts a 3Pt. Contested by Dejounte Hyland (5.7 feet, MAN). AYO BARRETT MAKES IT! Assist: Larry James
Score: 24-18

[01:42] Team_095 possession (Score: 24-18)
Shaquille Ball attempts a 3Pt. Contested by Larry James (4.6 feet, MAN). Shaquille Ball misses. Rebound secured by Donovan Green.

[01:26] Team_099 possession (Score: 24-18)
Larry Wade drives, DeMar McCollum stays with him. Larry Wade attempts a Layup. Wide open! DeMar McCollum is 6.3 feet away. [MAN] LARRY WADE MAKES IT!
Score: 26-18

[01:12] Team_095 possession (Score: 26-18)
Dejounte Hyland attempts a Midrange. Contested by Ayo Barrett (5.4 feet, MAN). Dejounte Hyland misses. Rebound secured by Damian Ginobili.

[00:59] Team_099 possession (Score: 26-18)
Larry James attempts a 3Pt. Contested by Shaquille Ball (3.1 feet, MAN). Larry James misses. Rebound secured by Evan Carter.

[00:44] Team_095 possession (Score: 26-18)
FOUL! Reach-in foul on Damian Ginobili during the drive. [IN THE BONUS! 5 team fouls] Evan Carter to the line for 2 free throws. (Damian Ginobili: 2 personal fouls)   FT 1/2: GOOD   FT 2/2: GOOD Evan Carter makes 2/2 from the line.
Score: 26-20

[00:32] Team_099 possession (Score: 26-20)
Damian Ginobili drives, DeMar McCollum stays with him. Damian Ginobili attempts a Dunk. Contested by DeMar McCollum (4.1 feet, ZONE). Damian Ginobili misses. Offensive rebound by Donovan Green! Donovan Green kicks it out.

[00:17] Team_099 possession (Score: 26-20)
Donovan Green loses control! Ball rolls out of bounds! TURNOVER! (dead ball)

[00:17] Substitution (Team_099): Ayo Barrett OUT → CJ Cunningham IN (stamina_rule2)

[00:17] Substitution (Team_099): Larry James OUT → Manu Johnson IN (stamina_rule2)

[00:17] Substitution (Team_099): Damian Ginobili OUT → Scottie Quickley IN (stamina_rule2)

[00:17] Substitution (Team_099): Larry Wade OUT → Jarrett Fox IN (stamina_rule2)

[00:17] Substitution (Team_095): Dejounte Hyland OUT → Kyle Poole IN (stamina_rule2)

[00:17] Substitution (Team_095): Shaquille Ball OUT → Cade Beal IN (stamina_rule2)

[00:17] Substitution (Team_095): Evan Carter OUT → Tobias Wagner IN (stamina_rule2)

[00:02] Team_095 possession (Score: 26-20)
FOUL! Holding foul on Scottie Quickley. [IN THE BONUS! 6 team fouls] Tobias Wagner to the line for 2 free throws. (Scottie Quickley: 1 personal fouls)   FT 1/2: GOOD   FT 2/2: GOOD Tobias Wagner makes 2/2 from the line.
Score: 26-22

================================================================================
                              1ST QUARTER COMPLETE                              
================================================================================

1ST QUARTER SCORE: Team_099 26, Team_095 22

BOX SCORE:
================================================================================

Team_099
--------------------------------------------------------------------------------
Player                MIN  PTS  REB  AST  TO      FG   FG%      3P   3P%
--------------------------------------------------------------------------------
Ayo Barrett            12    9    0    0   0   3/4    75.0     0/0   0.0
Vince Lillard           9    6    6    0   0   3/4    75.0     0/0   0.0
Damian Ginobili        12    5    1    1   0   2/4    50.0     0/0   0.0
Larry Wade             12    4    5    1   0   2/4    50.0     0/0   0.0
Larry James            12    0    0    3   0   0/3     0.0     0/0   0.0
Donovan Green           3    0    2    0   0   0/1     0.0     0/0   0.0

TEAM: FG: 10/20 (50.0%), 3PT: 4/9 (44.4%), REB: 16 (8 off, 8 def), AST: 5, TO: 3
TEAM FOULS: 6 [Team_095 in BONUS]


Team_095
--------------------------------------------------------------------------------
Player                MIN  PTS  REB  AST  TO      FG   FG%      3P   3P%
--------------------------------------------------------------------------------
Evan Carter            12    8    3    1   0   4/5    80.0     0/0   0.0
Dejounte Hyland        12    6    6    0   0   3/6    50.0     0/0   0.0
Shaquille Ball         12    6    2    0   0   2/5    40.0     0/0   0.0
Tobias Wagner           0    2    0    0   0   1/1   100.0     0/0   0.0
Immanuel Middleton      9    0    0    1   0   0/2     0.0     0/0   0.0
Kyrie Ming              9    0    0    1   0   0/0     0.0     0/0   0.0
DeMar McCollum          3    0    1    0   0   0/0     0.0     0/0   0.0
Gary Davis              3    0    0    1   0   0/0     0.0     0/0   0.0

TEAM: FG: 10/19 (52.6%), 3PT: 3/10 (30.0%), REB: 10 (3 off, 7 def), AST: 4, TO: 4
TEAM FOULS: 3

================================================================================

================================================================================
                       2ND QUARTER - Team_099 vs Team_095                       
================================================================================

[12:00] Team_099 possession (Score: 26-22)
FOUL! Reach-in foul on Immanuel Middleton during the drive. [Team fouls: 1] No free throws, side out. (Immanuel Middleton: 1 personal fouls)

[11:49] Team_099 possession (Score: 26-22)
Damian Ginobili attempts a 3Pt. Wide open! Evan Carter is 6.9 feet away. [MAN] DAMIAN GINOBILI MAKES IT!
Score: 29-22

[11:30] Team_095 possession (Score: 29-22)
Kyrie Ming drives, Larry Wade stays with him. Kyrie Ming attempts a Dunk. Contested by Larry Wade (5.7 feet, MAN). Kyrie Ming misses. Rebound secured by Damian Ginobili.

[11:13] Team_099 possession (Score: 29-22)
Larry James attempts a 3Pt. Contested by Evan Carter (3.7 feet, ZONE). Larry James misses. Rebound secured by Immanuel Middleton.

[10:59] Team_095 possession (Score: 29-22)
Kyrie Ming attempts a Layup. Contested by Vince Lillard (3.8 feet, ZONE). Kyrie Ming misses. Rebound secured by Vince Lillard.

[10:44] Team_099 possession (Score: 29-22)
Larry Wade commits a violation (traveling/carry)! TURNOVER! (dead ball)

[10:44] Substitution (Team_099): Ayo Barrett OUT → CJ Cunningham IN (stamina_rule2)

[10:44] Substitution (Team_099): Larry James OUT → Manu Johnson IN (stamina_rule2)

[10:44] Substitution (Team_099): Damian Ginobili OUT → Scottie Quickley IN (stamina_rule2)

[10:44] Substitution (Team_099): Larry Wade OUT → Jarrett Fox IN (stamina_rule2)

[10:44] Substitution (Team_095): Dejounte Hyland OUT → Kyle Poole IN (stamina_rule2)

[10:44] Substitution (Team_095): Shaquille Ball OUT → Cade Beal IN (stamina_rule2)

[10:44] Substitution (Team_095): Evan Carter OUT → Tobias Wagner IN (stamina_rule2)

[10:27] Team_095 possession (Score: 29-22)
Kyrie Ming attempts a Midrange. Contested by Vince Lillard (4.1 feet, ZONE). KYRIE MING MAKES IT! Assist: Kyle Poole
Score: 29-24

[10:11] Team_099 possession (Score: 29-24)
Jarrett Fox drives, Kyrie Ming stays with him. Jarrett Fox attempts a Layup. Contested by Kyrie Ming (5.4 feet, MAN). Jarrett Fox misses. Offensive rebound by Jarrett Fox! Jarrett Fox's putback is no good. Rebound secured by Cade Beal.

[09:59] Team_095 possession (Score: 29-24)
Kyrie Ming drives and kicks out. Immanuel Middleton attempts a 3Pt. Heavily contested by Vince Lillard (1.7 feet, MAN)! Immanuel Middleton misses. Rebound secured by Jarrett Fox.

[09:49] Team_099 possession (Score: 29-24)
Jarrett Fox attempts a Midrange. Contested by Immanuel Middleton (4.7 feet, ZONE). Jarrett Fox misses. Rebound secured by Kyrie Ming.

[09:34] Team_095 possession (Score: 29-24)
Immanuel Middleton attempts a Layup. Contested by Vince Lillard (3.5 feet, MAN). IMMANUEL MIDDLETON MAKES IT! Assist: Cade Beal
Score: 29-26

[09:19] Team_099 possession (Score: 29-26)
Jarrett Fox attempts a 3Pt. Contested by Cade Beal (4.0 feet, ZONE). Jarrett Fox misses. Rebound secured by Kyrie Ming.

[09:05] Team_095 possession (Score: 29-26)
Kyrie Ming drives, picks up Jarrett Fox. Help arrives from Manu Johnson! Kyrie Ming attempts a Layup. Contested by Manu Johnson (5.2 feet, MAN). KYRIE MING MAKES IT! Assist: Immanuel Middleton
Score: 29-28

[08:51] Team_099 possession (Score: 29-28)
Jarrett Fox drives and kicks out. Manu Johnson attempts a Midrange. Wide open! Immanuel Middleton is 6.3 feet away. [ZONE] Manu Johnson misses. Offensive rebound by Jarrett Fox! Jarrett Fox puts it back in!
Score: 31-28

[08:37] Team_095 possession (Score: 31-28)
FOUL! Shooting foul on Jarrett Fox. Kyrie Ming to the line for 2 free throws. [Team fouls: 1] (Jarrett Fox: 1 personal fouls)   FT 1/2: MISS   FT 2/2: GOOD Kyrie Ming makes 1/2 from the line.
Score: 31-29

[08:24] Team_099 possession (Score: 31-29)
Vince Lillard attempts a Dunk. BLOCKED BY IMMANUEL MIDDLETON! Ball deflects out of bounds off Vince Lillard.

[08:05] Team_095 possession (Score: 31-29)
Immanuel Middleton attempts a Midrange. Contested by Scottie Quickley (3.8 feet, ZONE). Immanuel Middleton misses. Rebound secured by Jarrett Fox.

[07:48] Team_099 possession (Score: 31-29)
Scottie Quickley attempts a 3Pt. Wide open! Tobias Wagner is 7.2 feet away. [MAN] Scottie Quickley misses. Rebound secured by Tobias Wagner.

[07:33] Team_095 possession (Score: 31-29)
Kyle Poole attempts a Layup. Contested by Vince Lillard (5.3 feet, ZONE). Kyle Poole misses. Rebound secured by Jarrett Fox.

[07:19] Team_099 possession (Score: 31-29)
CJ Cunningham attempts a 3Pt. Contested by Kyle Poole (5.4 feet, MAN). CJ CUNNINGHAM MAKES IT! Assist: Manu Johnson
Score: 34-29

[07:05] Team_095 possession (Score: 34-29)
Kyrie Ming attempts a 3Pt. Heavily contested by Jarrett Fox (1.6 feet, MAN)! Kyrie Ming misses. Rebound secured by Vince Lillard.

[06:51] Team_099 possession (Score: 34-29)
Vince Lillard drives and kicks out. Jarrett Fox attempts a 3Pt. Contested by Cade Beal (4.7 feet, ZONE). Jarrett Fox misses. Rebound secured by Tobias Wagner.

[06:41] Team_095 possession (Score: 34-29)
Kyle Poole attempts a 3Pt. Contested by Manu Johnson (3.1 feet, ZONE). Kyle Poole misses. Offensive rebound by Tobias Wagner! Tobias Wagner kicks it out.

[06:25] Team_095 possession (Score: 34-29)
Immanuel Middleton makes the Midrange and draws the foul on Vince Lillard! And-1! Immanuel Middleton to the line for 1. [Team fouls: 2] (Vince Lillard: 1 personal fouls)   FT 1/1: GOOD Immanuel Middleton makes 1/1 from the line.
Score: 34-32

[06:08] Team_099 possession (Score: 34-32)
Scottie Quickley attempts a Midrange. Contested by Tobias Wagner (4.0 feet, ZONE). Scottie Quickley misses. Rebound secured by Tobias Wagner.

[05:54] Team_095 possession (Score: 34-32)
Immanuel Middleton drives, Jarrett Fox stays with him. Immanuel Middleton attempts a Dunk. Contested by Jarrett Fox (2.6 feet, ZONE). IMMANUEL MIDDLETON MAKES IT! Assist: Tobias Wagner
Score: 34-34

[05:35] Team_099 possession (Score: 34-34)
Manu Johnson attempts a 3Pt. Contested by Cade Beal (3.7 feet, ZONE). MANU JOHNSON MAKES IT! Assist: CJ Cunningham
Score: 37-34

[05:21] Team_095 possession (Score: 37-34)
Kyle Poole drives, Jarrett Fox stays with him. Kyle Poole attempts a Layup. Wide open! Jarrett Fox is 7.2 feet away. [ZONE] Kyle Poole misses. Offensive rebound by Tobias Wagner! Tobias Wagner kicks it out.

[05:06] Team_095 possession (Score: 37-34)
Immanuel Middleton attempts a Midrange. Wide open! Vince Lillard is 6.0 feet away. [ZONE] IMMANUEL MIDDLETON MAKES IT! Assist: Kyrie Ming
Score: 37-36

[04:53] Team_099 possession (Score: 37-36)
Manu Johnson makes the 3Pt and draws the foul on Cade Beal! And-1! Manu Johnson to the line for 1. [Team fouls: 2] (Cade Beal: 1 personal fouls)   FT 1/1: GOOD Manu Johnson makes 1/1 from the line.
Score: 41-36

[04:40] Team_095 possession (Score: 41-36)
FOUL! Shooting foul on Scottie Quickley. Immanuel Middleton to the line for 2 free throws. [Team fouls: 3] (Scottie Quickley: 1 personal fouls)   FT 1/2: GOOD   FT 2/2: MISS Immanuel Middleton makes 1/2 from the line. Rebound secured by Vince Lillard.
Score: 41-37

[04:25] Team_099 possession (Score: 41-37)
Scottie Quickley attempts a Layup. Contested by Tobias Wagner (5.1 feet, MAN). SCOTTIE QUICKLEY MAKES IT! Assist: Vince Lillard
Score: 43-37

[04:08] Team_095 possession (Score: 43-37)
Immanuel Middleton attempts a Layup. Contested by Jarrett Fox (3.0 feet, ZONE). Immanuel Middleton misses. Rebound secured by Scottie Quickley.

[03:54] Team_099 possession (Score: 43-37)
Scottie Quickley attempts a 3Pt. Contested by Cade Beal (5.5 feet, ZONE). Scottie Quickley misses. Offensive rebound by Vince Lillard! Vince Lillard puts it back in!
Score: 45-37

[03:37] Team_095 possession (Score: 45-37)
Tobias Wagner attempts a Midrange. Contested by Scottie Quickley (3.8 feet, MAN). Tobias Wagner misses. Rebound secured by Scottie Quickley.

[03:23] Team_099 possession (Score: 45-37)
Vince Lillard drives, picks up Immanuel Middleton. Help arrives from Kyle Poole! Vince Lillard attempts a Dunk. Contested by Kyle Poole (3.7 feet, ZONE). VINCE LILLARD MAKES IT! Assist: CJ Cunningham
Score: 47-37

[03:05] Team_095 possession (Score: 47-37)
FOUL! Holding foul on Scottie Quickley. [Team fouls: 4] No free throws, side out. (Scottie Quickley: 2 personal fouls)

[02:50] Team_095 possession (Score: 47-37)
Tobias Wagner drives to the basket... FOUL! Offensive foul on Tobias Wagner! Scottie Quickley drew the charge! [Team fouls: 3] (Tobias Wagner: 1 personal fouls) TURNOVER! (dead ball)

[02:35] Team_099 possession (Score: 47-37)
Jarrett Fox attempts a Layup. Wide open! Immanuel Middleton is 6.5 feet away. [ZONE] JARRETT FOX MAKES IT! Assist: Scottie Quickley
Score: 49-37

[02:18] Team_095 possession (Score: 49-37)
Kyle Poole attempts a 3Pt. Contested by Manu Johnson (4.0 feet, ZONE). Kyle Poole misses. Rebound secured by Vince Lillard.

[02:02] Team_099 possession (Score: 49-37)
Scottie Quickley makes the Layup and draws the foul on Immanuel Middleton! And-1! Scottie Quickley to the line for 1. [Team fouls: 4] (Immanuel Middleton: 2 personal fouls)   FT 1/1: MISS Scottie Quickley makes 0/1 from the line. Rebound secured by Kyle Poole.
Score: 51-37

[01:49] Team_095 possession (Score: 51-37)
Tobias Wagner attempts a Midrange. Contested by Vince Lillard (2.2 feet, ZONE). Tobias Wagner misses. Rebound secured by Vince Lillard.

[01:38] Team_099 possession (Score: 51-37)
Scottie Quickley attempts a Midrange. Contested by Tobias Wagner (3.7 feet, MAN). SCOTTIE QUICKLEY MAKES IT! Assist: CJ Cunningham
Score: 53-37

[01:19] Team_095 possession (Score: 53-37)
Kyrie Ming attempts a Midrange. Wide open! Jarrett Fox is 8.1 feet away. [MAN] KYRIE MING MAKES IT!
Score: 53-39

[01:10] Team_099 possession (Score: 53-39)
Manu Johnson attempts a 3Pt. Contested by Cade Beal (5.7 feet, ZONE). MANU JOHNSON MAKES IT! Assist: Vince Lillard
Score: 56-39

[00:52] Team_095 possession (Score: 56-39)
Tobias Wagner attempts a 3Pt. Contested by Scottie Quickley (3.2 feet, MAN). Tobias Wagner misses. Offensive rebound by Tobias Wagner! Tobias Wagner kicks it out.

[00:42] Team_095 possession (Score: 56-39)
FOUL! Reach-in foul on Manu Johnson during the drive. [IN THE BONUS! 5 team fouls] Cade Beal to the line for 2 free throws. (Manu Johnson: 1 personal fouls)   FT 1/2: GOOD   FT 2/2: GOOD Cade Beal makes 2/2 from the line.
Score: 56-41

[00:30] Team_099 possession (Score: 56-41)
Scottie Quickley attempts a Midrange. Contested by Immanuel Middleton (6.0 feet, ZONE). SCOTTIE QUICKLEY MAKES IT! Assist: Manu Johnson
Score: 58-41

[00:17] Team_095 possession (Score: 58-41)
Kyrie Ming attempts a Midrange. Contested by Jarrett Fox (5.4 feet, ZONE). Kyrie Ming misses. Offensive rebound by Tobias Wagner! Tobias Wagner kicks it out.

[00:05] Team_095 possession (Score: 58-41)
Cade Beal attempts a Midrange. Wide open! Manu Johnson is 6.7 feet away. [MAN] Cade Beal misses. Offensive rebound by Tobias Wagner! Tobias Wagner kicks it out.

================================================================================
                              2ND QUARTER COMPLETE                              
================================================================================

2ND QUARTER SCORE: Team_099 32, Team_095 19

BOX SCORE:
================================================================================

Team_099
--------------------------------------------------------------------------------
Player                MIN  PTS  REB  AST  TO      FG   FG%      3P   3P%
--------------------------------------------------------------------------------
Manu Johnson           11   10    0    2   0   3/3   100.0     0/0   0.0
Scottie Quickley       11    6    2    1   0   3/6    50.0     0/0   0.0
Vince Lillard          22    4    6    2   0   2/4    50.0     0/0   0.0
Jarrett Fox            11    4    4    0   0   2/5    40.0     0/0   0.0
Damian Ginobili        14    3    1    0   0   1/1   100.0     0/0   0.0
CJ Cunningham          11    3    0    3   0   1/1   100.0     0/0   0.0
Larry James            14    0    0    0   0   0/1     0.0     0/0   0.0

TEAM: FG: 12/21 (57.1%), 3PT: 6/9 (66.7%), REB: 14 (3 off, 11 def), AST: 8, TO: 1
TEAM FOULS: 5 [Team_095 in BONUS]


Team_095
--------------------------------------------------------------------------------
Player                MIN  PTS  REB  AST  TO      FG   FG%      3P   3P%
--------------------------------------------------------------------------------
Immanuel Middleton     22    9    1    1   0   4/7    57.1     0/0   0.0
Kyrie Ming             22    7    2    1   0   4/8    50.0     0/0   0.0
Cade Beal              11    2    1    1   0   1/1   100.0     0/0   0.0
Kyle Poole             11    0    1    1   0   0/2     0.0     0/0   0.0
Tobias Wagner          11    0    8    1   0   0/2     0.0     0/0   0.0

TEAM: FG: 9/20 (45.0%), 3PT: 0/2 (0.0%), REB: 12 (5 off, 7 def), AST: 5, TO: 1
TEAM FOULS: 4

================================================================================

================================================================================
                       3RD QUARTER - Team_099 vs Team_095                       
================================================================================

[12:00] Team_099 possession (Score: 58-41)
Ayo Barrett drives to the basket... Ayo Barrett loses the ball! Stripped by Immanuel Middleton! TURNOVER! (live ball)

[11:50] Team_095 possession (Score: 58-41)
Dejounte Hyland drives, Ayo Barrett stays with him. Dejounte Hyland attempts a Layup. Wide open! Ayo Barrett is 6.3 feet away. [MAN] DEJOUNTE HYLAND MAKES IT! Assist: Shaquille Ball
Score: 58-43

[11:36] Team_099 possession (Score: 58-43)
Ayo Barrett drives, Dejounte Hyland stays with him. Ayo Barrett attempts a Dunk. Wide open! Dejounte Hyland is 6.1 feet away. [MAN] AYO BARRETT MAKES IT! Assist: Damian Ginobili
Score: 60-43

[11:21] Team_095 possession (Score: 60-43)
Shaquille Ball attempts a 3Pt. Heavily contested by Ayo Barrett (0.5 feet, ZONE)! Shaquille Ball misses. Rebound secured by Larry Wade.

[11:04] Team_099 possession (Score: 60-43)
Damian Ginobili attempts a 3Pt. Contested by Evan Carter (2.8 feet, MAN). Damian Ginobili misses. Rebound secured by Dejounte Hyland.

[10:53] Team_095 possession (Score: 60-43)
Shaquille Ball makes the Dunk and draws the foul on Damian Ginobili! And-1! Shaquille Ball to the line for 1. [Team fouls: 1] (Damian Ginobili: 1 personal fouls)   FT 1/1: GOOD Shaquille Ball makes 1/1 from the line.
Score: 60-46

[10:39] Team_099 possession (Score: 60-46)
Vince Lillard attempts a Midrange. Contested by Evan Carter (4.8 feet, ZONE). VINCE LILLARD MAKES IT! Assist: Ayo Barrett
Score: 62-46

[10:28] Team_095 possession (Score: 62-46)
Evan Carter drives, picks up Damian Ginobili. Help arrives from Ayo Barrett! Evan Carter attempts a Dunk. Contested by Ayo Barrett (2.6 feet, MAN). EVAN CARTER MAKES IT! Assist: Immanuel Middleton
Score: 62-48

[10:15] Team_099 possession (Score: 62-48)
FOUL! Holding foul on Evan Carter. [Team fouls: 1] No free throws, side out. (Evan Carter: 1 personal fouls)

[10:01] Team_099 possession (Score: 62-48)
Ayo Barrett drives to the basket... Ayo Barrett commits a violation (traveling/carry)! TURNOVER! (dead ball)

[09:44] Team_095 possession (Score: 62-48)
Dejounte Hyland attempts a 3Pt. BLOCKED BY AYO BARRETT! Ball is loose! Offensive rebound by Evan Carter! Evan Carter kicks it out.

[09:35] Team_095 possession (Score: 62-48)
Kyrie Ming attempts a Midrange. Contested by Larry Wade (4.5 feet, MAN). Kyrie Ming misses. Rebound secured by Vince Lillard.

[09:23] Team_099 possession (Score: 62-48)
Vince Lillard makes the Layup and draws the foul on Dejounte Hyland! And-1! Vince Lillard to the line for 1. [Team fouls: 2] (Dejounte Hyland: 1 personal fouls)   FT 1/1: GOOD Vince Lillard makes 1/1 from the line.
Score: 65-48

[09:11] Team_095 possession (Score: 65-48)
Evan Carter makes the Layup and draws the foul on Damian Ginobili! And-1! Evan Carter to the line for 1. [Team fouls: 2] (Damian Ginobili: 2 personal fouls)   FT 1/1: GOOD Evan Carter makes 1/1 from the line.
Score: 65-51

[08:56] Team_099 possession (Score: 65-51)
Ayo Barrett attempts a 3Pt. Contested by Evan Carter (3.1 feet, ZONE). Ayo Barrett misses. Offensive rebound by Larry Wade! Larry Wade puts it back in!
Score: 67-51

[08:37] Team_095 possession (Score: 67-51)
Immanuel Middleton drives, Vince Lillard stays with him. Immanuel Middleton attempts a Layup. Wide open! Vince Lillard is 6.4 feet away. [MAN] IMMANUEL MIDDLETON MAKES IT! Assist: Shaquille Ball
Score: 67-53

[08:23] Team_099 possession (Score: 67-53)
Ayo Barrett makes the Layup and draws the foul on Kyrie Ming! And-1! Ayo Barrett to the line for 1. [Team fouls: 3] (Kyrie Ming: 1 personal fouls)   FT 1/1: MISS Ayo Barrett makes 0/1 from the line. Rebound secured by Shaquille Ball.
Score: 69-53

[08:10] Team_095 possession (Score: 69-53)
Shaquille Ball drives and kicks out. Immanuel Middleton attempts a 3Pt. Contested by Vince Lillard (4.4 feet, MAN). Immanuel Middleton misses. Offensive rebound by Evan Carter! Evan Carter's putback is no good. Offensive rebound by Evan Carter! Evan Carter kicks it out.

[07:56] Team_095 possession (Score: 69-53)
Evan Carter attempts a 3Pt. Contested by Damian Ginobili (5.7 feet, MAN). Evan Carter misses. Rebound secured by Damian Ginobili.

[07:38] Team_099 possession (Score: 69-53)
Damian Ginobili attempts a Midrange. Wide open! Evan Carter is 6.7 feet away. [MAN] DAMIAN GINOBILI MAKES IT! Assist: Ayo Barrett
Score: 71-53

[07:26] Team_095 possession (Score: 71-53)
Shaquille Ball attempts a 3Pt. Contested by Larry James (4.5 feet, MAN). Shaquille Ball misses. FOUL! Loose ball foul on Damian Ginobili during the rebound battle. [Team fouls: 3] No free throws, side out. (Damian Ginobili: 3 personal fouls)

[07:12] Team_095 possession (Score: 71-53)
Shaquille Ball drives to the basket... Shaquille Ball loses the ball! Stripped by Larry James! TURNOVER! (live ball)

[06:56] Team_099 possession (Score: 71-53)
Ayo Barrett attempts a 3Pt. Contested by Dejounte Hyland (4.9 feet, MAN). Ayo Barrett misses. Rebound secured by Dejounte Hyland.

[06:45] Team_095 possession (Score: 71-53)
FOUL! Holding foul on Larry James. [Team fouls: 4] No free throws, side out. (Larry James: 1 personal fouls)

[06:29] Team_095 possession (Score: 71-53)
Evan Carter attempts a 3Pt. Contested by Ayo Barrett (5.3 feet, ZONE). EVAN CARTER MAKES IT! Assist: Shaquille Ball
Score: 71-56

[06:16] Team_099 possession (Score: 71-56)
Ayo Barrett attempts a 3Pt. Contested by Dejounte Hyland (4.5 feet, MAN). AYO BARRETT MAKES IT! Assist: Larry Wade
Score: 74-56

[05:59] Team_095 possession (Score: 74-56)
Dejounte Hyland attempts a 3Pt. Contested by Ayo Barrett (4.9 feet, MAN). Dejounte Hyland misses. Rebound secured by Vince Lillard.

[05:47] Team_099 possession (Score: 74-56)
Larry Wade drives, Immanuel Middleton stays with him. Larry Wade attempts a Dunk. Contested by Immanuel Middleton (4.4 feet, ZONE). LARRY WADE MAKES IT! Assist: Larry James
Score: 76-56

[05:27] Team_095 possession (Score: 76-56)
Kyrie Ming attempts a Layup. BLOCKED BY LARRY WADE! Ball is loose! Rebound secured by Vince Lillard.

[05:16] Team_099 possession (Score: 76-56)
Damian Ginobili attempts a 3Pt. Contested by Evan Carter (3.6 feet, MAN). DAMIAN GINOBILI MAKES IT!
Score: 79-56

[05:00] Team_095 possession (Score: 79-56)
Shaquille Ball attempts a 3Pt. Heavily contested by Ayo Barrett (1.3 feet, ZONE)! SHAQUILLE BALL MAKES IT! Assist: Evan Carter
Score: 79-59

[04:47] Team_099 possession (Score: 79-59)
Larry Wade drives, picks up Immanuel Middleton. Help arrives from Dejounte Hyland! Larry Wade attempts a Layup. Contested by Dejounte Hyland (4.3 feet, ZONE). LARRY WADE MAKES IT! Assist: Ayo Barrett
Score: 81-59

[04:37] Team_095 possession (Score: 81-59)
Dejounte Hyland attempts a Midrange. Contested by Ayo Barrett (3.4 feet, MAN). DEJOUNTE HYLAND MAKES IT!
Score: 81-61

[04:20] Team_099 possession (Score: 81-61)
Larry Wade attempts a 3Pt. Contested by Evan Carter (4.6 feet, ZONE). Larry Wade misses. Offensive rebound by Larry Wade! Larry Wade kicks it out.

[04:09] Team_099 possession (Score: 81-61)
Ayo Barrett attempts a 3Pt. Wide open! Dejounte Hyland is 6.1 feet away. [MAN] AYO BARRETT MAKES IT! Assist: Larry Wade
Score: 84-61

[03:54] Team_095 possession (Score: 84-61)
Immanuel Middleton attempts a 3Pt. Contested by Ayo Barrett (4.4 feet, ZONE). Immanuel Middleton misses. Rebound secured by Larry Wade.

[03:42] Team_099 possession (Score: 84-61)
Ayo Barrett attempts a 3Pt. Wide open! Dejounte Hyland is 6.2 feet away. [MAN] Ayo Barrett misses. Rebound secured by Evan Carter.

[03:27] Team_095 possession (Score: 84-61)
Kyrie Ming drives, Vince Lillard stays with him. Kyrie Ming attempts a Dunk. Contested by Vince Lillard (3.8 feet, ZONE). KYRIE MING MAKES IT!
Score: 84-63

[03:12] Team_099 possession (Score: 84-63)
FOUL! Offensive foul on Larry Wade! Kyrie Ming drew the charge! [Team fouls: 5] (Larry Wade: 1 personal fouls) TURNOVER! (dead ball)

[02:56] Team_095 possession (Score: 84-63)
Evan Carter attempts a Midrange. Contested by Damian Ginobili (3.6 feet, ZONE). Evan Carter misses. Rebound secured by Damian Ginobili.

[02:38] Team_099 possession (Score: 84-63)
FOUL! Reach-in foul on Immanuel Middleton during the drive. [Team fouls: 4] No free throws, side out. (Immanuel Middleton: 1 personal fouls)

[02:22] Team_099 possession (Score: 84-63)
Vince Lillard loses control! Ball rolls out of bounds! TURNOVER! (dead ball)

[02:22] Substitution (Team_099): Damian Ginobili OUT → Scottie Quickley IN (stamina_rule2)

[02:22] Substitution (Team_099): Vince Lillard OUT → Donovan Green IN (stamina_rule2)

[02:22] Substitution (Team_099): Larry Wade OUT → Jarrett Fox IN (stamina_rule2)

[02:22] Substitution (Team_095): Dejounte Hyland OUT → Kyle Poole IN (stamina_rule2)

[02:22] Substitution (Team_095): Shaquille Ball OUT → Cade Beal IN (stamina_rule2)

[02:22] Substitution (Team_095): Evan Carter OUT → Tobias Wagner IN (stamina_rule2)

[02:22] Substitution (Team_095): Immanuel Middleton OUT → Gary Davis IN (stamina_rule2)

[02:22] Substitution (Team_095): Kyrie Ming OUT → DeMar McCollum IN (stamina_rule2)

[02:04] Team_095 possession (Score: 84-63)
Cade Beal drives, picks up Jarrett Fox. Help arrives from Ayo Barrett! Cade Beal attempts a Dunk. Contested by Ayo Barrett (3.5 feet, ZONE). CADE BEAL MAKES IT! Assist: Gary Davis
Score: 84-65

[01:52] Team_099 possession (Score: 84-65)
Larry James attempts a Midrange. Contested by Cade Beal (3.6 feet, MAN). LARRY JAMES MAKES IT! Assist: Donovan Green
Score: 86-65

[01:35] Team_095 possession (Score: 86-65)
FOUL! Reach-in foul on Ayo Barrett during the drive. [IN THE BONUS! 6 team fouls] Kyle Poole to the line for 2 free throws. (Ayo Barrett: 1 personal fouls)   FT 1/2: GOOD   FT 2/2: GOOD Kyle Poole makes 2/2 from the line.
Score: 86-67

[01:25] Team_099 possession (Score: 86-67)
Larry James attempts a 3Pt. Contested by Cade Beal (3.6 feet, ZONE). Larry James misses. Rebound secured by DeMar McCollum.

[01:11] Team_095 possession (Score: 86-67)
Tobias Wagner attempts a 3Pt. Contested by Scottie Quickley (2.8 feet, ZONE). Tobias Wagner misses. Offensive rebound by DeMar McCollum! DeMar McCollum kicks it out.

[00:59] Team_095 possession (Score: 86-67)
Tobias Wagner drives, picks up Jarrett Fox. Help arrives from Ayo Barrett! Tobias Wagner attempts a Dunk. Contested by Ayo Barrett (5.1 feet, ZONE). TOBIAS WAGNER MAKES IT! Assist: Gary Davis
Score: 86-69

[00:43] Team_099 possession (Score: 86-69)
Larry James attempts a 3Pt. Heavily contested by Cade Beal (1.7 feet, ZONE)! Larry James misses. Offensive rebound by Donovan Green! Donovan Green kicks it out.

[00:25] Team_099 possession (Score: 86-69)
Larry James attempts a Layup. Contested by DeMar McCollum (3.3 feet, ZONE). LARRY JAMES MAKES IT! Assist: Jarrett Fox
Score: 88-69

[00:09] Team_095 possession (Score: 88-69)
Kyle Poole drives and kicks out. DeMar McCollum makes the 3Pt and draws the foul on Jarrett Fox! And-1! DeMar McCollum to the line for 1. [BONUS: 7 team fouls] (Jarrett Fox: 1 personal fouls)   FT 1/1: GOOD DeMar McCollum makes 1/1 from the line.
Score: 88-73

================================================================================
                              3RD QUARTER COMPLETE                              
================================================================================

3RD QUARTER SCORE: Team_099 30, Team_095 32

BOX SCORE:
================================================================================

Team_099
--------------------------------------------------------------------------------
Player                MIN  PTS  REB  AST  TO      FG   FG%      3P   3P%
--------------------------------------------------------------------------------
Ayo Barrett            26    8    0    3   0   3/6    50.0     0/0   0.0
Larry Wade             23    6    4    2   0   3/3   100.0     0/0   0.0
Damian Ginobili        23    5    2    1   0   2/3    66.7     0/0   0.0
Vince Lillard          31    5    3    0   0   2/2   100.0     0/0   0.0
Larry James            26    4    0    1   0   2/3    66.7     0/0   0.0
Donovan Green           5    0    1    1   0   0/0     0.0     0/0   0.0
Jarrett Fox            13    0    0    1   0   0/0     0.0     0/0   0.0

TEAM: FG: 12/17 (70.6%), 3PT: 4/8 (50.0%), REB: 10 (3 off, 7 def), AST: 9, TO: 4
TEAM FOULS: 7 [Team_095 in BONUS]


Team_095
--------------------------------------------------------------------------------
Player                MIN  PTS  REB  AST  TO      FG   FG%      3P   3P%
--------------------------------------------------------------------------------
Evan Carter            23    8    3    1   0   3/5    60.0     0/0   0.0
Shaquille Ball         23    6    1    3   0   2/3    66.7     0/0   0.0
Dejounte Hyland        23    4    3    0   0   2/3    66.7     0/0   0.0
DeMar McCollum          5    4    2    0   0   1/1   100.0     0/0   0.0
Immanuel Middleton     31    2    0    1   0   1/2    50.0     0/0   0.0
Kyrie Ming             31    2    0    0   0   1/3    33.3     0/0   0.0
Cade Beal              13    2    0    0   0   1/1   100.0     0/0   0.0
Kyle Poole             13    2    0    0   0   1/1   100.0     0/0   0.0
Tobias Wagner          13    2    0    0   0   1/1   100.0     0/0   0.0
Gary Davis              5    0    0    2   0   0/0     0.0     0/0   0.0

TEAM: FG: 13/20 (65.0%), 3PT: 2/6 (33.3%), REB: 9 (4 off, 5 def), AST: 7, TO: 1
TEAM FOULS: 4

================================================================================

================================================================================
                       4TH QUARTER - Team_099 vs Team_095                       
================================================================================

[12:00] Team_099 possession (Score: 88-73)
Damian Ginobili attempts a Midrange. Contested by Evan Carter (5.5 feet, MAN). Damian Ginobili misses. Offensive rebound by Larry Wade! Larry Wade puts it back in!
Score: 90-73

[11:48] Team_095 possession (Score: 90-73)
Dejounte Hyland attempts a 3Pt. Contested by Damian Ginobili (4.6 feet, ZONE). DEJOUNTE HYLAND MAKES IT!
Score: 90-76

[11:36] Team_099 possession (Score: 90-76)
Damian Ginobili drives, picks up Immanuel Middleton. Help arrives from Dejounte Hyland! Damian Ginobili attempts a Layup. Wide open! Dejounte Hyland is 7.0 feet away. [ZONE] Damian Ginobili misses. Rebound secured by Dejounte Hyland.

[11:17] Team_095 possession (Score: 90-76)
Immanuel Middleton makes the Layup and draws the foul on Vince Lillard! And-1! Immanuel Middleton to the line for 1. [Team fouls: 1] (Vince Lillard: 1 personal fouls)   FT 1/1: GOOD Immanuel Middleton makes 1/1 from the line.
Score: 90-79

[11:02] Team_099 possession (Score: 90-79)
Damian Ginobili drives and kicks out. Larry James attempts a 3Pt. Contested by Shaquille Ball (3.3 feet, MAN). LARRY JAMES MAKES IT! Assist: Larry Wade
Score: 93-79

[10:49] Team_095 possession (Score: 93-79)
Kyrie Ming attempts a Midrange. Wide open! Larry Wade is 7.2 feet away. [MAN] KYRIE MING MAKES IT!
Score: 93-81

[10:35] Team_099 possession (Score: 93-81)
Ayo Barrett attempts a Layup. BLOCKED BY EVAN CARTER! Ball goes out off Evan Carter. Ayo Barrett's ball!

[10:26] Team_099 possession (Score: 93-81)
FOUL! Holding foul on Immanuel Middleton. [Team fouls: 1] No free throws, side out. (Immanuel Middleton: 1 personal fouls)

[10:15] Team_099 possession (Score: 93-81)
Damian Ginobili attempts a 3Pt. Wide open! Evan Carter is 6.9 feet away. [MAN] DAMIAN GINOBILI MAKES IT! Assist: Larry Wade
Score: 96-81

[09:59] Team_095 possession (Score: 96-81)
Shaquille Ball attempts a 3Pt. Contested by Vince Lillard (2.1 feet, ZONE). Shaquille Ball misses. Rebound secured by Vince Lillard.

[09:47] Team_099 possession (Score: 96-81)
Ayo Barrett attempts a 3Pt. Contested by Evan Carter (3.9 feet, ZONE). Ayo Barrett misses. FOUL! Loose ball foul on Shaquille Ball during the rebound battle. [Team fouls: 2] No free throws, side out. (Shaquille Ball: 1 personal fouls)

[09:36] Team_099 possession (Score: 96-81)
Ayo Barrett attempts a 3Pt. Heavily contested by Evan Carter (0.8 feet, ZONE)! AYO BARRETT MAKES IT!
Score: 99-81

[09:21] Team_095 possession (Score: 99-81)
Shaquille Ball throws a bad pass! Stolen by Larry James! TURNOVER! (live ball)

[09:07] Team_099 possession (Score: 99-81)
Larry James attempts a 3Pt. Heavily contested by Evan Carter (1.1 feet, ZONE)! Larry James misses. Offensive rebound by Vince Lillard! Vince Lillard puts it back in!
Score: 101-81

[08:52] Team_095 possession (Score: 101-81)
Immanuel Middleton drives to the basket... Immanuel Middleton loses the ball! Stripped by Vince Lillard! TURNOVER! (live ball)

[08:41] Team_099 possession (Score: 101-81)
Ayo Barrett attempts a Midrange. Contested by Immanuel Middleton (5.7 feet, ZONE). AYO BARRETT MAKES IT!
Score: 103-81

[08:25] Team_095 possession (Score: 103-81)
FOUL! Shooting foul on Vince Lillard. Immanuel Middleton to the line for 2 free throws. [Team fouls: 2] (Vince Lillard: 2 personal fouls)   FT 1/2: GOOD   FT 2/2: GOOD Immanuel Middleton makes 2/2 from the line.
Score: 103-83

[08:13] Team_099 possession (Score: 103-83)
Ayo Barrett attempts a 3Pt. Contested by Dejounte Hyland (4.3 feet, MAN). Ayo Barrett misses. Rebound secured by Evan Carter.

[07:56] Team_095 possession (Score: 103-83)
Evan Carter attempts a 3Pt. Contested by Damian Ginobili (4.2 feet, MAN). EVAN CARTER MAKES IT! Assist: Immanuel Middleton
Score: 103-86

[07:42] Team_099 possession (Score: 103-86)
Vince Lillard makes the Midrange and draws the foul on Shaquille Ball! And-1! Vince Lillard to the line for 1. [Team fouls: 3] (Shaquille Ball: 2 personal fouls)   FT 1/1: MISS Vince Lillard makes 0/1 from the line. Rebound secured by Shaquille Ball.
Score: 105-86

[07:30] Team_095 possession (Score: 105-86)
Dejounte Hyland drives and kicks out. Immanuel Middleton attempts a 3Pt. Contested by Ayo Barrett (4.3 feet, ZONE). Immanuel Middleton misses. Offensive rebound by Evan Carter! Evan Carter's putback is no good. Offensive rebound by Evan Carter! Evan Carter kicks it out.

[07:16] Team_095 possession (Score: 105-86)
Evan Carter loses control! Ball rolls out of bounds! TURNOVER! (dead ball)

[07:16] Substitution (Team_099): Ayo Barrett OUT → CJ Cunningham IN (stamina_rule2)

[07:16] Substitution (Team_099): Larry James OUT → Manu Johnson IN (stamina_rule2)

[07:16] Substitution (Team_099): Damian Ginobili OUT → Scottie Quickley IN (stamina_rule2)

[07:16] Substitution (Team_099): Vince Lillard OUT → Donovan Green IN (stamina_rule2)

[07:16] Substitution (Team_099): Larry Wade OUT → Jarrett Fox IN (stamina_rule2)

[07:16] Substitution (Team_095): Dejounte Hyland OUT → Kyle Poole IN (stamina_rule2)

[07:16] Substitution (Team_095): Shaquille Ball OUT → Cade Beal IN (stamina_rule2)

[07:16] Substitution (Team_095): Evan Carter OUT → Tobias Wagner IN (stamina_rule2)

[07:16] Substitution (Team_095): Immanuel Middleton OUT → Gary Davis IN (stamina_rule2)

[07:16] Substitution (Team_095): Kyrie Ming OUT → DeMar McCollum IN (stamina_rule2)

[07:01] Team_099 possession (Score: 105-86)
FOUL! Reach-in foul on DeMar McCollum during the drive. [Team fouls: 4] No free throws, side out. (DeMar McCollum: 1 personal fouls)

[06:46] Team_099 possession (Score: 105-86)
Manu Johnson attempts a Midrange. Wide open! Cade Beal is 7.3 feet away. [MAN] Manu Johnson misses. Rebound secured by DeMar McCollum.

[06:29] Team_095 possession (Score: 105-86)
Tobias Wagner attempts a 3Pt. Contested by Scottie Quickley (2.2 feet, MAN). Tobias Wagner misses. Rebound secured by Jarrett Fox.

[06:14] Team_099 possession (Score: 105-86)
CJ Cunningham drives, DeMar McCollum stays with him. CJ Cunningham attempts a Layup. Contested by DeMar McCollum (4.3 feet, ZONE). CJ CUNNINGHAM MAKES IT!
Score: 107-86

[05:59] Team_095 possession (Score: 107-86)
Kyle Poole commits a violation (traveling/carry)! TURNOVER! (dead ball)

[05:46] Team_099 possession (Score: 107-86)
FOUL! Holding foul on Tobias Wagner. [IN THE BONUS! 5 team fouls] Scottie Quickley to the line for 2 free throws. (Tobias Wagner: 1 personal fouls)   FT 1/2: GOOD   FT 2/2: GOOD Scottie Quickley makes 2/2 from the line.
Score: 109-86

[05:33] Team_095 possession (Score: 109-86)
Gary Davis attempts a 3Pt. Contested by Donovan Green (5.2 feet, MAN). Gary Davis misses. Offensive rebound by DeMar McCollum! DeMar McCollum kicks it out.

[05:16] Team_095 possession (Score: 109-86)
Gary Davis attempts a Layup. Wide open! Donovan Green is 6.9 feet away. [MAN] GARY DAVIS MAKES IT! Assist: DeMar McCollum
Score: 109-88

[05:01] Team_099 possession (Score: 109-88)
Donovan Green attempts a 3Pt. Contested by Gary Davis (4.5 feet, MAN). Donovan Green misses. Rebound secured by DeMar McCollum.

[04:44] Team_095 possession (Score: 109-88)
DeMar McCollum attempts a Midrange. Contested by Manu Johnson (3.8 feet, ZONE). DEMAR MCCOLLUM MAKES IT!
Score: 109-90

[04:30] Team_099 possession (Score: 109-90)
FOUL! Reach-in foul on DeMar McCollum during the drive. [IN THE BONUS! 6 team fouls] Jarrett Fox to the line for 2 free throws. (DeMar McCollum: 2 personal fouls)   FT 1/2: GOOD   FT 2/2: MISS Jarrett Fox makes 1/2 from the line. Rebound secured by Tobias Wagner.
Score: 110-90

[04:18] Team_095 possession (Score: 110-90)
Tobias Wagner loses control! Ball rolls out of bounds! TURNOVER! (dead ball)

[04:06] Team_099 possession (Score: 110-90)
CJ Cunningham drives and kicks out. Manu Johnson attempts a Midrange. Contested by Cade Beal (5.7 feet, ZONE). MANU JOHNSON MAKES IT! Assist: Jarrett Fox
Score: 112-90

[03:55] Team_095 possession (Score: 112-90)
DeMar McCollum drives to the basket... DeMar McCollum throws a bad pass out of bounds! TURNOVER! (dead ball)

[03:42] Team_099 possession (Score: 112-90)
Scottie Quickley drives, DeMar McCollum stays with him. Scottie Quickley attempts a Dunk. Contested by DeMar McCollum (3.8 feet, ZONE). SCOTTIE QUICKLEY MAKES IT! Assist: Manu Johnson
Score: 114-90

[03:30] Team_095 possession (Score: 114-90)
Tobias Wagner attempts a Midrange. Contested by Scottie Quickley (3.6 feet, MAN). Tobias Wagner misses. Rebound secured by Scottie Quickley.

[03:12] Team_099 possession (Score: 114-90)
Jarrett Fox drives and kicks out. Donovan Green attempts a 3Pt. Contested by Cade Beal (2.9 feet, ZONE). Donovan Green misses. Rebound secured by Tobias Wagner.

[02:59] Team_095 possession (Score: 114-90)
Kyle Poole attempts a 3Pt. Wide open! CJ Cunningham is 7.9 feet away. [MAN] Kyle Poole misses. Rebound secured by Donovan Green.

[02:45] Team_099 possession (Score: 114-90)
Manu Johnson attempts a Layup. Contested by Cade Beal (3.3 feet, MAN). MANU JOHNSON MAKES IT! Assist: Scottie Quickley
Score: 116-90

[02:27] Team_095 possession (Score: 116-90)
Kyle Poole attempts a 3Pt. Contested by CJ Cunningham (3.2 feet, MAN). Kyle Poole misses. Rebound secured by Donovan Green.

[02:13] Team_099 possession (Score: 116-90)
CJ Cunningham attempts a Midrange. Wide open! Kyle Poole is 9.6 feet away. [MAN] CJ Cunningham misses. Rebound secured by Gary Davis.

[01:57] Team_095 possession (Score: 116-90)
Gary Davis attempts a Layup. BLOCKED BY JARRETT FOX! Ball is loose! Offensive rebound by DeMar McCollum! DeMar McCollum kicks it out.

[01:38] Team_095 possession (Score: 116-90)
FOUL! Holding foul on Manu Johnson. [Team fouls: 3] No free throws, side out. (Manu Johnson: 1 personal fouls)

[01:26] Team_095 possession (Score: 116-90)
FOUL! Shooting foul on CJ Cunningham. Kyle Poole to the line for 3 free throws. [Team fouls: 4] (CJ Cunningham: 1 personal fouls)   FT 1/3: GOOD   FT 2/3: GOOD   FT 3/3: MISS Kyle Poole makes 2/3 from the line. Rebound secured by Scottie Quickley.
Score: 116-92

[01:15] Team_099 possession (Score: 116-92)
Manu Johnson drives and kicks out. Donovan Green attempts a Midrange. Wide open! Gary Davis is 10.0 feet away. [ZONE] Donovan Green misses. Rebound secured by Gary Davis.

[00:57] Team_095 possession (Score: 116-92)
Kyle Poole drives, picks up CJ Cunningham. Help arrives from Scottie Quickley! Kyle Poole attempts a Layup. Wide open! Scottie Quickley is 6.2 feet away. [MAN] Kyle Poole misses. Offensive rebound by DeMar McCollum! DeMar McCollum kicks it out.

[00:44] Team_095 possession (Score: 116-92)
Cade Beal attempts a 3Pt. Contested by Manu Johnson (3.8 feet, ZONE). CADE BEAL MAKES IT! Assist: DeMar McCollum
Score: 116-95

[00:32] Team_099 possession (Score: 116-95)
Donovan Green makes the Layup and draws the foul on DeMar McCollum! And-1! Donovan Green to the line for 1. [BONUS: 7 team fouls] (DeMar McCollum: 3 personal fouls)   FT 1/1: GOOD Donovan Green makes 1/1 from the line.
Score: 119-95

[00:16] Team_095 possession (Score: 119-95)
Tobias Wagner attempts a 3Pt. Contested by Scottie Quickley (5.7 feet, MAN). Tobias Wagner misses. Rebound secured by Donovan Green.

================================================================================
                              4TH QUARTER COMPLETE                              
================================================================================

4TH QUARTER SCORE: Team_099 31, Team_095 22

BOX SCORE:
================================================================================

Team_099
--------------------------------------------------------------------------------
Player                MIN  PTS  REB  AST  TO      FG   FG%      3P   3P%
--------------------------------------------------------------------------------
Ayo Barrett            31    5    0    0   0   2/3    66.7     0/0   0.0
Manu Johnson           18    4    0    1   0   2/4    50.0     0/0   0.0
Scottie Quickley       20    4    2    1   0   2/2   100.0     0/0   0.0
Damian Ginobili        28    3    0    0   0   1/2    50.0     0/0   0.0
Larry James            31    3    0    0   0   1/1   100.0     0/0   0.0
Donovan Green          12    3    3    0   0   1/2    50.0     0/0   0.0
Larry Wade             28    2    1    2   0   1/1   100.0     0/0   0.0
Vince Lillard          36    2    3    0   0   1/2    50.0     0/0   0.0
CJ Cunningham          18    2    0    0   0   1/2    50.0     0/0   0.0
Jarrett Fox            20    0    1    1   0   0/2     0.0     0/0   0.0

TEAM: FG: 12/21 (57.1%), 3PT: 3/5 (60.0%), REB: 10 (3 off, 7 def), AST: 5, TO: 0
TEAM FOULS: 4


Team_095
--------------------------------------------------------------------------------
Player                MIN  PTS  REB  AST  TO      FG   FG%      3P   3P%
--------------------------------------------------------------------------------
Immanuel Middleton     36    5    0    1   0   2/2   100.0     0/0   0.0
Dejounte Hyland        28    3    1    0   0   1/1   100.0     0/0   0.0
Evan Carter            28    3    2    0   0   1/1   100.0     0/0   0.0
Cade Beal              20    3    0    0   0   1/1   100.0     0/0   0.0
Kyrie Ming             36    2    0    0   0   1/1   100.0     0/0   0.0
DeMar McCollum         12    2    5    2   0   1/1   100.0     0/0   0.0
Gary Davis             12    2    2    0   0   1/1   100.0     0/0   0.0
Shaquille Ball         28    0    1    0   0   0/1     0.0     0/0   0.0
Tobias Wagner          20    0    2    0   0   0/3     0.0     0/0   0.0
Kyle Poole             20    0    0    0   0   0/3     0.0     0/0   0.0

TEAM: FG: 8/15 (53.3%), 3PT: 3/9 (33.3%), REB: 13 (4 off, 9 def), AST: 3, TO: 6
TEAM FOULS: 7 [Team_099 in BONUS]

================================================================================

================================================================================
                               FULL GAME COMPLETE                               
================================================================================

FINAL SCORE: Team_099 119, Team_095 95

SCORING BY QUARTER:
--------------------------------------------------------------------------------
Team                     Q1     Q2     Q3     Q4    FINAL
--------------------------------------------------------------------------------
Team_099                 26     32     30     31      119
Team_095                 22     19     32     22       95
--------------------------------------------------------------------------------

FULL GAME BOX SCORE:
================================================================================

Team_099
--------------------------------------------------------------------------------
Player                MIN  PTS  REB  AST  TO      FG   FG%      3P   3P%      FT STL BLK
--------------------------------------------------------------------------------
Vince Lillard          36   17   18    2   2   5/9    55.6   0/0     0.0   1/2     2   0
Ayo Barrett            31   22    0    3   0   8/13   61.5   6/10   60.0   0/1     0   1
Larry James            31    7    0    4   2   4/9    44.4   1/5    20.0   0/0     2   0
Damian Ginobili        28   16    4    2   0  10/14   71.4   5/7    71.4   0/1     0   0
Larry Wade             28   12   10    5   3   3/5    60.0   0/1     0.0   0/0     0   1
Scottie Quickley       20   10    4    2   0   5/8    62.5   1/2    50.0   2/3     0   0
Jarrett Fox            20    4    5    2   0   2/7    28.6   0/1     0.0   1/2     0   1
CJ Cunningham          18    5    0    3   0   3/4    75.0   1/1   100.0   0/0     0   0
Manu Johnson           18   14    0    3   0   4/6    66.7   3/3   100.0   1/1     0   0
Donovan Green          12    3    6    1   1   1/3    33.3   0/1     0.0   1/1     0   0

TEAM: FG: 46/79 (58.2%), 3PT: 17/31 (54.8%), REB: 50 (17 off, 33 def), AST: 27, TO: 8


Team_095
--------------------------------------------------------------------------------
Player                MIN  PTS  REB  AST  TO      FG   FG%      3P   3P%      FT STL BLK
--------------------------------------------------------------------------------
Immanuel Middleton     36   16    1    4   1   7/13   53.8   0/2     0.0   5/6     1   1
Kyrie Ming             36   11    2    2   0   6/12   50.0   0/1     0.0   1/2     0   0
Dejounte Hyland        28   13   10    0   0   6/10   60.0   1/4    25.0   2/2     1   0
Shaquille Ball         28   12    4    3   3   4/9    44.4   3/8    37.5   1/1     0   0
Evan Carter            28   19    8    2   4   8/11   72.7   3/5    60.0   5/6     0   1
Kyle Poole             20    2    1    1   3   2/7    28.6   0/4     0.0   4/5     0   0
Cade Beal              20    7    1    1   0   3/3   100.0   1/1   100.0   2/2     0   0
Tobias Wagner          20    4   10    1   1   1/6    16.7   0/2     0.0   2/2     0   0
Gary Davis             12    2    2    3   0   1/1   100.0   0/0     0.0   0/0     0   0
DeMar McCollum         12    6    8    2   0   1/1   100.0   0/0     0.0   1/1     0   0

TEAM: FG: 40/74 (54.1%), 3PT: 8/27 (29.6%), REB: 44 (16 off, 28 def), AST: 19, TO: 12

================================================================================
