================================================================================
                        FULL GAME - Team_057 vs Team_041                        
================================================================================

================================================================================
                       1ST QUARTER - Team_057 vs Team_041                       
================================================================================

[12:00] Team_057 possession (Score: 0-0)
Klay Rozier drives to the basket... Klay Rozier throws a bad pass! Stolen by Terry Barrett! TURNOVER! (live ball)

[11:42] Team_041 possession (Score: 0-0)
Jarrett Anunoby drives and kicks out. Jarrett Anunoby attempts a 3Pt. Contested by Kobe Ming (5.3 feet, ZONE). Jarrett Anunoby misses. Rebound secured by Ben Adebayo.

[11:25] Team_057 possession (Score: 0-0)
Kobe Ming attempts a Layup. Wide open! Scottie Turner is 6.2 feet away. [MAN] KOBE MING MAKES IT!
Score: 2-0

[11:10] Team_041 possession (Score: 2-0)
Scottie Turner attempts a 3Pt. Contested by Kobe Ming (4.3 feet, ZONE). Scottie Turner misses. Rebound secured by Ben Adebayo.

[10:54] Team_057 possession (Score: 2-0)
Ben Adebayo attempts a Layup. BLOCKED BY TERRY BARRETT! Ball is loose! Rebound secured by Terry Barrett.

[10:44] Team_041 possession (Score: 2-0)
Terry Barrett drives to the basket... Terry Barrett commits a violation (traveling/carry)! TURNOVER! (dead ball)

[10:24] Team_057 possession (Score: 2-0)
Ben Adebayo attempts a Midrange. Wide open! Stephen Ingram is 6.1 feet away. [MAN] Ben Adebayo misses. Rebound secured by Stephen Ingram.

[10:07] Team_041 possession (Score: 2-0)
Jarrett Anunoby attempts a Layup. Heavily contested by Klay Rozier (1.0 feet, MAN)! JARRETT ANUNOBY MAKES IT! Assist: Scottie Turner
Score: 2-2

[09:52] Team_057 possession (Score: 2-2)
Kobe Ming drives and kicks out. Miles Middleton attempts a Midrange. Contested by Terry Barrett (4.0 feet, MAN). MILES MIDDLETON MAKES IT! Assist: Klay Rozier
Score: 4-2

[09:41] Team_041 possession (Score: 4-2)
Jarrett Anunoby attempts a 3Pt. Contested by Kobe Ming (4.0 feet, ZONE). JARRETT ANUNOBY MAKES IT!
Score: 4-5

[09:27] Team_057 possession (Score: 4-5)
Anfernee Adebayo commits a violation (traveling/carry)! TURNOVER! (dead ball)

[09:12] Team_041 possession (Score: 4-5)
Dejounte Griffin drives, Anfernee Adebayo stays with him. Dejounte Griffin attempts a Layup. Contested by Anfernee Adebayo (4.4 feet, MAN). Dejounte Griffin misses. Rebound secured by Miles Middleton.

[08:56] Team_057 possession (Score: 4-5)
Klay Rozier attempts a Midrange. Contested by Jarrett Anunoby (3.7 feet, MAN). KLAY ROZIER MAKES IT!
Score: 6-5

[08:42] Team_041 possession (Score: 6-5)
FOUL! Holding foul on Kobe Ming. [Team fouls: 1] No free throws, side out. (Kobe Ming: 1 personal fouls)

[08:27] Team_041 possession (Score: 6-5)
Dejounte Griffin attempts a 3Pt. Contested by Ben Adebayo (4.3 feet, ZONE). Dejounte Griffin misses. Rebound secured by Miles Middleton.

[08:10] Team_057 possession (Score: 6-5)
Ben Adebayo drives, picks up Stephen Ingram. Help arrives from Jarrett Anunoby! Ben Adebayo attempts a Layup. Contested by Jarrett Anunoby (5.3 feet, MAN). BEN ADEBAYO MAKES IT! Assist: Klay Rozier
Score: 8-5

[08:01] Team_041 possession (Score: 8-5)
Scottie Turner attempts a Midrange. Heavily contested by Klay Rozier (2.0 feet, ZONE)! Scottie Turner misses. Offensive rebound by Stephen Ingram! Stephen Ingram kicks it out.

[07:48] Team_041 possession (Score: 8-5)
Dejounte Griffin drives, Anfernee Adebayo stays with him. Dejounte Griffin attempts a Layup. Contested by Anfernee Adebayo (3.2 feet, MAN). Dejounte Griffin misses. Rebound secured by Anfernee Adebayo.

[07:36] Team_057 possession (Score: 8-5)
Ben Adebayo attempts a 3Pt. Contested by Stephen Ingram (5.3 feet, MAN). Ben Adebayo misses. Rebound secured by Dejounte Griffin.

[07:20] Team_041 possession (Score: 8-5)
Stephen Ingram throws a bad pass! Stolen by Ben Adebayo! TURNOVER! (live ball)

[07:06] Team_057 possession (Score: 8-5)
Ben Adebayo attempts a Midrange. Wide open! Dejounte Griffin is 6.7 feet away. [ZONE] BEN ADEBAYO MAKES IT! Assist: Miles Middleton
Score: 10-5

[06:49] Team_041 possession (Score: 10-5)
FOUL! Offensive foul on Stephen Ingram! Ben Adebayo drew the charge! [Team fouls: 1] (Stephen Ingram: 1 personal fouls) TURNOVER! (dead ball)

[06:35] Team_057 possession (Score: 10-5)
Ben Adebayo loses the ball! Stripped by Stephen Ingram! TURNOVER! (live ball)

[06:24] Team_041 possession (Score: 10-5)
FOUL! Holding foul on Anfernee Adebayo. [Team fouls: 2] No free throws, side out. (Anfernee Adebayo: 1 personal fouls)

[06:05] Team_041 possession (Score: 10-5)
Stephen Ingram drives, Ben Adebayo stays with him. Stephen Ingram attempts a Dunk. Contested by Ben Adebayo (5.0 feet, MAN). Stephen Ingram misses. Offensive rebound by Terry Barrett! Terry Barrett's putback is no good. Rebound secured by Anfernee Adebayo.

[05:52] Team_057 possession (Score: 10-5)
Ben Adebayo attempts a Midrange. Wide open! Stephen Ingram is 7.7 feet away. [MAN] BEN ADEBAYO MAKES IT!
Score: 12-5

[05:39] Team_041 possession (Score: 12-5)
Terry Barrett attempts a Midrange. Contested by Klay Rozier (5.0 feet, ZONE). Terry Barrett misses. Rebound secured by Ben Adebayo.

[05:22] Team_057 possession (Score: 12-5)
Ben Adebayo attempts a Midrange. Contested by Dejounte Griffin (2.2 feet, ZONE). BEN ADEBAYO MAKES IT!
Score: 14-5

[05:05] Team_041 possession (Score: 14-5)
Dejounte Griffin attempts a 3Pt. Contested by Ben Adebayo (2.4 feet, ZONE). Dejounte Griffin misses. Rebound secured by Ben Adebayo.

[04:49] Team_057 possession (Score: 14-5)
Anfernee Adebayo attempts a Midrange. Wide open! Dejounte Griffin is 8.3 feet away. [MAN] ANFERNEE ADEBAYO MAKES IT! Assist: Miles Middleton
Score: 16-5

[04:33] Team_041 possession (Score: 16-5)
Stephen Ingram attempts a 3Pt. Wide open! Ben Adebayo is 6.5 feet away. [MAN] STEPHEN INGRAM MAKES IT! Assist: Dejounte Griffin
Score: 16-8

[04:19] Team_057 possession (Score: 16-8)
Anfernee Adebayo attempts a Midrange. Contested by Dejounte Griffin (4.7 feet, MAN). Anfernee Adebayo misses. Rebound secured by Terry Barrett.

[04:04] Team_041 possession (Score: 16-8)
Stephen Ingram attempts a Layup. Contested by Ben Adebayo (4.8 feet, MAN). STEPHEN INGRAM MAKES IT! Assist: Scottie Turner
Score: 16-10

[03:47] Team_057 possession (Score: 16-10)
Klay Rozier drives, picks up Jarrett Anunoby. Help arrives from Dejounte Griffin! Klay Rozier attempts a Layup. Wide open! Dejounte Griffin is 6.3 feet away. [MAN] KLAY ROZIER MAKES IT! Assist: Anfernee Adebayo
Score: 18-10

[03:34] Team_041 possession (Score: 18-10)
Stephen Ingram attempts a Midrange. Wide open! Ben Adebayo is 6.0 feet away. [MAN] STEPHEN INGRAM MAKES IT! Assist: Terry Barrett
Score: 18-12

[03:19] Team_057 possession (Score: 18-12)
Anfernee Adebayo makes the Layup and draws the foul on Terry Barrett! And-1! Anfernee Adebayo to the line for 1. [Team fouls: 2] (Terry Barrett: 1 personal fouls)   FT 1/1: MISS Anfernee Adebayo makes 0/1 from the line. FOUL! Loose ball foul on Terry Barrett during the free throw rebound! [Team fouls: 3] No free throws, side out. (Terry Barrett: 2 personal fouls)
Score: 20-12

[03:02] Team_057 possession (Score: 20-12)
Anfernee Adebayo attempts a Midrange. Wide open! Dejounte Griffin is 7.3 feet away. [MAN] ANFERNEE ADEBAYO MAKES IT! Assist: Kobe Ming
Score: 22-12

[02:49] Team_041 possession (Score: 22-12)
Dejounte Griffin attempts a Layup. Contested by Ben Adebayo (5.9 feet, ZONE). Dejounte Griffin misses. Rebound secured by Anfernee Adebayo.

[02:34] Team_057 possession (Score: 22-12)
FOUL! Reach-in foul on Dejounte Griffin during the drive. [Team fouls: 4] No free throws, side out. (Dejounte Griffin: 1 personal fouls)

[02:17] Team_057 possession (Score: 22-12)
Anfernee Adebayo attempts a 3Pt. Wide open! Dejounte Griffin is 6.8 feet away. [MAN] Anfernee Adebayo misses. Rebound secured by Stephen Ingram.

[02:06] Team_041 possession (Score: 22-12)
Dejounte Griffin makes the Layup and draws the foul on Anfernee Adebayo! And-1! Dejounte Griffin to the line for 1. [Team fouls: 3] (Anfernee Adebayo: 2 personal fouls)   FT 1/1: GOOD Dejounte Griffin makes 1/1 from the line.
Score: 22-15

[01:52] Team_057 possession (Score: 22-15)
Anfernee Adebayo loses the ball! Stripped by Dejounte Griffin! TURNOVER! (live ball)

[01:36] Team_041 possession (Score: 22-15)
Dejounte Griffin attempts a Layup. Wide open! Ben Adebayo is 7.2 feet away. [ZONE] Dejounte Griffin misses. Rebound secured by Ben Adebayo.

[01:18] Team_057 possession (Score: 22-15)
Miles Middleton drives, Terry Barrett stays with him. Miles Middleton attempts a Layup. Contested by Terry Barrett (4.3 feet, MAN). Miles Middleton misses. Rebound secured by Dejounte Griffin.

[01:05] Team_041 possession (Score: 22-15)
Stephen Ingram attempts a Layup. BLOCKED BY BEN ADEBAYO! Ball is loose! Offensive rebound by Terry Barrett! Terry Barrett kicks it out.

[00:54] Team_041 possession (Score: 22-15)
FOUL! Shooting foul on Kobe Ming. Jarrett Anunoby to the line for 3 free throws. [BONUS: 5 team fouls] (Kobe Ming: 2 personal fouls)   FT 1/3: GOOD   FT 2/3: MISS   FT 3/3: GOOD Jarrett Anunoby makes 2/3 from the line.
Score: 22-17

[00:40] Team_057 possession (Score: 22-17)
FOUL! Holding foul on Jarrett Anunoby. [IN THE BONUS! 5 team fouls] Klay Rozier to the line for 2 free throws. (Jarrett Anunoby: 1 personal fouls)   FT 1/2: GOOD   FT 2/2: GOOD Klay Rozier makes 2/2 from the line.
Score: 24-17

[00:28] Team_041 possession (Score: 24-17)
Scottie Turner drives to the basket... Scottie Turner throws a bad pass! Stolen by Kobe Ming! TURNOVER! (live ball)

[00:12] Team_057 possession (Score: 24-17)
Kobe Ming attempts a Midrange. Wide open! Scottie Turner is 6.3 feet away. [MAN] KOBE MING MAKES IT!
Score: 26-17

================================================================================
                              1ST QUARTER COMPLETE                              
================================================================================

1ST QUARTER SCORE: Team_057 26, Team_041 17

BOX SCORE:
================================================================================

Team_057
--------------------------------------------------------------------------------
Player                MIN  PTS  REB  AST  TO      FG   FG%      3P   3P%
--------------------------------------------------------------------------------
Ben Adebayo            12    8    6    0   0   4/7    57.1     0/0   0.0
Klay Rozier            12    6    0    2   0   3/3   100.0     0/0   0.0
Kobe Ming              12    4    0    1   0   2/2   100.0     0/0   0.0
Anfernee Adebayo       12    4    3    1   0   2/4    50.0     0/0   0.0
Miles Middleton        12    2    2    2   0   1/2    50.0     0/0   0.0

TEAM: FG: 12/18 (66.7%), 3PT: 0/2 (0.0%), REB: 10 (1 off, 9 def), AST: 6, TO: 4
TEAM FOULS: 5 [Team_041 in BONUS]


Team_041
--------------------------------------------------------------------------------
Player                MIN  PTS  REB  AST  TO      FG   FG%      3P   3P%
--------------------------------------------------------------------------------
Jarrett Anunoby        12    7    0    0   0   3/4    75.0     0/0   0.0
Stephen Ingram         12    7    3    0   0   3/4    75.0     0/0   0.0
Dejounte Griffin       12    3    2    1   0   1/7    14.3     0/0   0.0
Scottie Turner         12    0    0    2   0   0/1     0.0     0/0   0.0
Terry Barrett          12    0    3    1   0   0/1     0.0     0/0   0.0

TEAM: FG: 7/17 (41.2%), 3PT: 3/6 (50.0%), REB: 9 (3 off, 6 def), AST: 4, TO: 4
TEAM FOULS: 5 [Team_057 in BONUS]

================================================================================

================================================================================
                       2ND QUARTER - Team_057 vs Team_041                       
================================================================================

[12:00] Team_057 possession (Score: 26-17)
Klay Rozier makes the Layup and draws the foul on Jarrett Anunoby! And-1! Klay Rozier to the line for 1. [Team fouls: 1] (Jarrett Anunoby: 1 personal fouls)   FT 1/1: MISS Klay Rozier makes 0/1 from the line. Rebound secured by Stephen Ingram.
Score: 28-17

[11:43] Team_041 possession (Score: 28-17)
Scottie Turner attempts a 3Pt. Contested by Kobe Ming (4.1 feet, ZONE). Scottie Turner misses. Rebound secured by Anfernee Adebayo.

[11:27] Team_057 possession (Score: 28-17)
Klay Rozier drives, Terry Barrett stays with him. Klay Rozier attempts a Dunk. Wide open! Terry Barrett is 6.4 feet away. [ZONE] Klay Rozier misses. Rebound secured by Dejounte Griffin.

[11:15] Team_041 possession (Score: 28-17)
Jarrett Anunoby makes the Midrange and draws the foul on Klay Rozier! And-1! Jarrett Anunoby to the line for 1. [Team fouls: 1] (Klay Rozier: 1 personal fouls)   FT 1/1: GOOD Jarrett Anunoby makes 1/1 from the line.
Score: 28-20

[10:59] Team_057 possession (Score: 28-20)
Miles Middleton makes the Midrange and draws the foul on Terry Barrett! And-1! Miles Middleton to the line for 1. [Team fouls: 2] (Terry Barrett: 1 personal fouls)   FT 1/1: GOOD Miles Middleton makes 1/1 from the line.
Score: 31-20

[10:44] Team_041 possession (Score: 31-20)
Dejounte Griffin drives, Ben Adebayo stays with him. Dejounte Griffin attempts a Dunk. Contested by Ben Adebayo (3.0 feet, ZONE). DEJOUNTE GRIFFIN MAKES IT!
Score: 31-22

[10:31] Team_057 possession (Score: 31-22)
FOUL! Reach-in foul on Scottie Turner during the drive. [Team fouls: 3] No free throws, side out. (Scottie Turner: 1 personal fouls)

[10:18] Team_057 possession (Score: 31-22)
Klay Rozier attempts a 3Pt. Wide open! Scottie Turner is 6.6 feet away. [ZONE] Klay Rozier misses. Rebound secured by Stephen Ingram.

[10:07] Team_041 possession (Score: 31-22)
FOUL! Offensive foul on Dejounte Griffin! Anfernee Adebayo drew the charge! [Team fouls: 4] (Dejounte Griffin: 1 personal fouls) TURNOVER! (dead ball)

[09:52] Team_057 possession (Score: 31-22)
Ben Adebayo attempts a Layup. Heavily contested by Terry Barrett (1.5 feet, ZONE)! Ben Adebayo misses. Rebound secured by Stephen Ingram.

[09:42] Team_041 possession (Score: 31-22)
Terry Barrett drives to the basket... Terry Barrett throws a bad pass out of bounds! TURNOVER! (dead ball)

[09:42] Substitution (Team_057): Kobe Ming OUT → Scottie Johnson IN (stamina_rule2)

[09:42] Substitution (Team_057): Klay Rozier OUT → Bradley Ginobili IN (stamina_rule2)

[09:42] Substitution (Team_057): Anfernee Adebayo OUT → Joel Wade IN (stamina_rule2)

[09:42] Substitution (Team_057): Ben Adebayo OUT → Lamelo Irving IN (stamina_rule2)

[09:42] Substitution (Team_057): Miles Middleton OUT → Zion Lillard IN (stamina_rule2)

[09:42] Substitution (Team_041): Scottie Turner OUT → Franz Rose IN (stamina_rule2)

[09:42] Substitution (Team_041): Jarrett Anunoby OUT → Kyrie Booker IN (stamina_rule2)

[09:42] Substitution (Team_041): Dejounte Griffin OUT → Bam McCollum IN (stamina_rule2)

[09:42] Substitution (Team_041): Stephen Ingram OUT → Tobias McCollum IN (stamina_rule2)

[09:42] Substitution (Team_041): Terry Barrett OUT → De'Aaron Poole IN (stamina_rule2)

[09:31] Team_057 possession (Score: 31-22)
Zion Lillard drives and kicks out. Lamelo Irving attempts a Midrange. Wide open! Franz Rose is 7.7 feet away. [ZONE] Lamelo Irving misses. Offensive rebound by Lamelo Irving! Lamelo Irving kicks it out.

[09:15] Team_057 possession (Score: 31-22)
Joel Wade attempts a 3Pt. Contested by Kyrie Booker (6.0 feet, ZONE). JOEL WADE MAKES IT! Assist: Zion Lillard
Score: 34-22

[09:00] Team_041 possession (Score: 34-22)
Tobias McCollum loses the ball! Stripped by Lamelo Irving! TURNOVER! (live ball)

[08:44] Team_057 possession (Score: 34-22)
Zion Lillard attempts a 3Pt. Contested by Kyrie Booker (2.4 feet, ZONE). ZION LILLARD MAKES IT! Assist: Bradley Ginobili
Score: 37-22

[08:33] Team_041 possession (Score: 37-22)
Kyrie Booker attempts a 3Pt. Wide open! Bradley Ginobili is 7.8 feet away. [MAN] KYRIE BOOKER MAKES IT!
Score: 37-25

[08:16] Team_057 possession (Score: 37-25)
Scottie Johnson commits a violation (traveling/carry)! TURNOVER! (dead ball)

[07:56] Team_041 possession (Score: 37-25)
De'Aaron Poole drives to the basket... De'Aaron Poole throws a bad pass! Stolen by Zion Lillard! TURNOVER! (live ball)

[07:45] Team_057 possession (Score: 37-25)
Zion Lillard attempts a 3Pt. Contested by De'Aaron Poole (3.5 feet, MAN). Zion Lillard misses. Offensive rebound by Lamelo Irving! Lamelo Irving kicks it out.

[07:27] Team_057 possession (Score: 37-25)
Scottie Johnson attempts a 3Pt. Wide open! Tobias McCollum is 7.1 feet away. [ZONE] SCOTTIE JOHNSON MAKES IT! Assist: Bradley Ginobili
Score: 40-25

[07:15] Team_041 possession (Score: 40-25)
Tobias McCollum attempts a Layup. Heavily contested by Lamelo Irving (0.7 feet, MAN)! Tobias McCollum misses. Rebound secured by Zion Lillard.

[06:58] Team_057 possession (Score: 40-25)
FOUL! Holding foul on Bam McCollum. [IN THE BONUS! 5 team fouls] Joel Wade to the line for 2 free throws. (Bam McCollum: 1 personal fouls)   FT 1/2: GOOD   FT 2/2: GOOD Joel Wade makes 2/2 from the line.
Score: 42-25

[06:42] Team_041 possession (Score: 42-25)
Kyrie Booker attempts a 3Pt. Wide open! Bradley Ginobili is 6.9 feet away. [MAN] Kyrie Booker misses. Rebound secured by Joel Wade.

[06:28] Team_057 possession (Score: 42-25)
Lamelo Irving loses control! Ball rolls out of bounds! TURNOVER! (dead ball)

[06:15] Team_041 possession (Score: 42-25)
Tobias McCollum attempts a 3Pt. BLOCKED BY LAMELO IRVING! Ball is loose! Rebound secured by Zion Lillard.

[06:04] Team_057 possession (Score: 42-25)
Bradley Ginobili drives and kicks out. Scottie Johnson attempts a 3Pt. Wide open! Tobias McCollum is 6.1 feet away. [ZONE] Scottie Johnson misses. Rebound secured by Tobias McCollum.

[05:53] Team_041 possession (Score: 42-25)
Kyrie Booker attempts a 3Pt. Wide open! Bradley Ginobili is 6.3 feet away. [MAN] Kyrie Booker misses. Rebound secured by Joel Wade.

[05:41] Team_057 possession (Score: 42-25)
Lamelo Irving drives, Tobias McCollum stays with him. Lamelo Irving attempts a Layup. Contested by Tobias McCollum (5.8 feet, MAN). LAMELO IRVING MAKES IT! Assist: Zion Lillard
Score: 44-25

[05:24] Team_041 possession (Score: 44-25)
Franz Rose drives, Lamelo Irving stays with him. Franz Rose attempts a Layup. Heavily contested by Lamelo Irving (1.7 feet, ZONE)! Franz Rose misses. Rebound secured by Joel Wade.

[05:13] Team_057 possession (Score: 44-25)
FOUL! Reach-in foul on De'Aaron Poole during the drive. [IN THE BONUS! 6 team fouls] Zion Lillard to the line for 2 free throws. (De'Aaron Poole: 1 personal fouls)   FT 1/2: GOOD   FT 2/2: GOOD Zion Lillard makes 2/2 from the line.
Score: 46-25

[04:58] Team_041 possession (Score: 46-25)
Bam McCollum attempts a 3Pt. Heavily contested by Scottie Johnson (1.2 feet, ZONE)! Bam McCollum misses. Rebound secured by Zion Lillard.

[04:44] Team_057 possession (Score: 46-25)
FOUL! Offensive foul on Lamelo Irving! Tobias McCollum drew the charge! [Team fouls: 2] (Lamelo Irving: 1 personal fouls) TURNOVER! (dead ball)

[04:33] Team_041 possession (Score: 46-25)
Bam McCollum attempts a 3Pt. Contested by Scottie Johnson (4.4 feet, ZONE). Bam McCollum misses. Rebound secured by Lamelo Irving.

[04:18] Team_057 possession (Score: 46-25)
FOUL! Holding foul on Tobias McCollum. [IN THE BONUS! 7 team fouls] Lamelo Irving to the line for 2 free throws. (Tobias McCollum: 1 personal fouls)   FT 1/2: GOOD   FT 2/2: MISS Lamelo Irving makes 1/2 from the line. Rebound secured by De'Aaron Poole.
Score: 47-25

[04:04] Team_041 possession (Score: 47-25)
Kyrie Booker attempts a 3Pt. Contested by Bradley Ginobili (3.5 feet, MAN). KYRIE BOOKER MAKES IT! Assist: Franz Rose
Score: 47-28

[03:50] Team_057 possession (Score: 47-28)
Lamelo Irving attempts a 3Pt. Contested by Kyrie Booker (2.9 feet, ZONE). Lamelo Irving misses. Rebound secured by Tobias McCollum.

[03:33] Team_041 possession (Score: 47-28)
Franz Rose drives, Scottie Johnson stays with him. Franz Rose attempts a Layup. Contested by Scottie Johnson (2.7 feet, MAN). FRANZ ROSE MAKES IT! Assist: De'Aaron Poole
Score: 47-30

[03:14] Team_057 possession (Score: 47-30)
Zion Lillard drives to the basket... FOUL! Offensive foul on Zion Lillard! Tobias McCollum drew the charge! [Team fouls: 3] (Zion Lillard: 1 personal fouls) TURNOVER! (dead ball)

[02:58] Team_041 possession (Score: 47-30)
Bam McCollum drives and kicks out. Kyrie Booker attempts a Midrange. Wide open! Bradley Ginobili is 10.0 feet away. [MAN] KYRIE BOOKER MAKES IT!
Score: 47-32

[02:42] Team_057 possession (Score: 47-32)
Lamelo Irving drives, Tobias McCollum stays with him. Lamelo Irving attempts a Layup. Wide open! Tobias McCollum is 7.2 feet away. [ZONE] LAMELO IRVING MAKES IT!
Score: 49-32

[02:30] Team_041 possession (Score: 49-32)
Bam McCollum drives to the basket... Bam McCollum loses the ball! Stripped by Lamelo Irving! TURNOVER! (live ball)

[02:18] Team_057 possession (Score: 49-32)
Bradley Ginobili drives to the basket... FOUL! Offensive foul on Bradley Ginobili! Tobias McCollum drew the charge! [Team fouls: 4] (Bradley Ginobili: 1 personal fouls) TURNOVER! (dead ball)

[02:07] Team_041 possession (Score: 49-32)
De'Aaron Poole drives to the basket... De'Aaron Poole throws a bad pass out of bounds! TURNOVER! (dead ball)

[01:51] Team_057 possession (Score: 49-32)
Zion Lillard attempts a Layup. Contested by Tobias McCollum (4.8 feet, ZONE). Zion Lillard misses. Rebound secured by Tobias McCollum.

[01:37] Team_041 possession (Score: 49-32)
Tobias McCollum drives to the basket... Tobias McCollum throws a bad pass! Stolen by Lamelo Irving! TURNOVER! (live ball)

[01:20] Team_057 possession (Score: 49-32)
Zion Lillard attempts a Midrange. Contested by Tobias McCollum (3.6 feet, ZONE). Zion Lillard misses. Rebound secured by Tobias McCollum.

[01:08] Team_041 possession (Score: 49-32)
Franz Rose attempts a Midrange. Contested by Scottie Johnson (4.1 feet, ZONE). FRANZ ROSE MAKES IT! Assist: Tobias McCollum
Score: 49-34

[00:54] Team_057 possession (Score: 49-34)
Zion Lillard attempts a Midrange. Contested by De'Aaron Poole (5.7 feet, MAN). Zion Lillard misses. Rebound secured by De'Aaron Poole.

[00:40] Team_041 possession (Score: 49-34)
Kyrie Booker drives to the basket... Kyrie Booker loses control! Ball rolls out of bounds! TURNOVER! (dead ball)

[00:27] Team_057 possession (Score: 49-34)
Joel Wade commits a violation (traveling/carry)! TURNOVER! (dead ball)

[00:07] Team_041 possession (Score: 49-34)
Bam McCollum attempts a Midrange. Contested by Joel Wade (3.6 feet, MAN). Bam McCollum misses. FOUL! Loose ball foul on Zion Lillard during the rebound battle. [IN THE BONUS! 5 team fouls] Tobias McCollum to the line for 2 free throws. (Zion Lillard: 2 personal fouls)   FT 1/2: GOOD   FT 2/2: GOOD Tobias McCollum makes 2/2 from the line.
Score: 49-36

================================================================================
                              2ND QUARTER COMPLETE                              
================================================================================

2ND QUARTER SCORE: Team_057 23, Team_041 19

BOX SCORE:
================================================================================

Team_057
--------------------------------------------------------------------------------
Player                MIN  PTS  REB  AST  TO      FG   FG%      3P   3P%
--------------------------------------------------------------------------------
Joel Wade              10    5    3    0   0   2/2   100.0     0/0   0.0
Zion Lillard           10    5    3    2   0   2/5    40.0     0/0   0.0
Lamelo Irving          10    4    3    0   0   2/3    66.7     0/0   0.0
Miles Middleton        15    3    0    0   0   1/1   100.0     0/0   0.0
Scottie Johnson        10    3    0    0   0   1/1   100.0     0/0   0.0
Klay Rozier            15    0    0    0   0   0/3     0.0     0/0   0.0
Anfernee Adebayo       15    0    1    0   0   0/0     0.0     0/0   0.0
Ben Adebayo            15    0    0    0   0   0/1     0.0     0/0   0.0
Bradley Ginobili       10    0    0    2   0   0/1     0.0     0/0   0.0

TEAM: FG: 8/18 (44.4%), 3PT: 3/5 (60.0%), REB: 10 (2 off, 8 def), AST: 4, TO: 6
TEAM FOULS: 5 [Team_041 in BONUS]


Team_041
--------------------------------------------------------------------------------
Player                MIN  PTS  REB  AST  TO      FG   FG%      3P   3P%
--------------------------------------------------------------------------------
Kyrie Booker           10    8    0    0   0   3/5    60.0     0/0   0.0
Franz Rose             10    4    0    1   0   2/3    66.7     0/0   0.0
Jarrett Anunoby        15    3    0    0   0   1/1   100.0     0/0   0.0
Dejounte Griffin       15    2    1    0   0   1/1   100.0     0/0   0.0
Tobias McCollum        10    2    4    1   0   1/3    33.3     0/0   0.0
Stephen Ingram         15    0    3    0   0   0/0     0.0     0/0   0.0
Scottie Turner         15    0    0    0   0   0/1     0.0     0/0   0.0
Bam McCollum           10    0    0    0   0   0/2     0.0     0/0   0.0
De'Aaron Poole         10    0    2    1   0   0/0     0.0     0/0   0.0

TEAM: FG: 8/16 (50.0%), 3PT: 2/8 (25.0%), REB: 10 (0 off, 10 def), AST: 3, TO: 8
TEAM FOULS: 7 [Team_057 in BONUS]

================================================================================

================================================================================
                       3RD QUARTER - Team_057 vs Team_041                       
================================================================================

[12:00] Team_057 possession (Score: 49-36)
Anfernee Adebayo drives, Terry Barrett stays with him. Anfernee Adebayo attempts a Layup. Wide open! Terry Barrett is 7.8 feet away. [ZONE] ANFERNEE ADEBAYO MAKES IT! Assist: Miles Middleton
Score: 51-36

[11:46] Team_041 possession (Score: 51-36)
Terry Barrett attempts a Midrange. Contested by Ben Adebayo (5.6 feet, ZONE). TERRY BARRETT MAKES IT! Assist: Stephen Ingram
Score: 51-38

[11:32] Team_057 possession (Score: 51-38)
Kobe Ming makes the Dunk and draws the foul on Terry Barrett! And-1! Kobe Ming to the line for 1. [Team fouls: 1] (Terry Barrett: 1 personal fouls)   FT 1/1: GOOD Kobe Ming makes 1/1 from the line.
Score: 54-38

[11:18] Team_041 possession (Score: 54-38)
FOUL! Holding foul on Miles Middleton. [Team fouls: 1] No free throws, side out. (Miles Middleton: 1 personal fouls)

[11:03] Team_041 possession (Score: 54-38)
Jarrett Anunoby drives, Ben Adebayo stays with him. Jarrett Anunoby attempts a Layup. Contested by Ben Adebayo (3.8 feet, ZONE). Jarrett Anunoby misses. Rebound secured by Miles Middleton.

[10:48] Team_057 possession (Score: 54-38)
Klay Rozier drives, Jarrett Anunoby stays with him. Klay Rozier attempts a Dunk. Contested by Jarrett Anunoby (4.9 feet, MAN). KLAY ROZIER MAKES IT! Assist: Kobe Ming
Score: 56-38

[10:35] Team_041 possession (Score: 56-38)
Stephen Ingram drives and kicks out. Terry Barrett attempts a 3Pt. Contested by Kobe Ming (2.6 feet, ZONE). Terry Barrett misses. Rebound secured by Anfernee Adebayo.

[10:21] Team_057 possession (Score: 56-38)
Anfernee Adebayo attempts a 3Pt. Contested by Dejounte Griffin (5.8 feet, MAN). Anfernee Adebayo misses. Offensive rebound by Ben Adebayo! Ben Adebayo kicks it out.

[10:05] Team_057 possession (Score: 56-38)
Ben Adebayo attempts a Layup. Contested by Terry Barrett (3.1 feet, ZONE). BEN ADEBAYO MAKES IT!
Score: 58-38

[09:51] Team_041 possession (Score: 58-38)
Dejounte Griffin drives, picks up Ben Adebayo. Help arrives from Klay Rozier! Dejounte Griffin attempts a Layup. Heavily contested by Klay Rozier (0.7 feet, ZONE)! DEJOUNTE GRIFFIN MAKES IT! Assist: Stephen Ingram
Score: 58-40

[09:34] Team_057 possession (Score: 58-40)
FOUL! Shooting foul on Jarrett Anunoby. Ben Adebayo to the line for 2 free throws. [Team fouls: 2] (Jarrett Anunoby: 1 personal fouls)   FT 1/2: GOOD   FT 2/2: GOOD Ben Adebayo makes 2/2 from the line.
Score: 60-40

[09:22] Team_041 possession (Score: 60-40)
Stephen Ingram throws a bad pass out of bounds! TURNOVER! (dead ball)

[09:06] Team_057 possession (Score: 60-40)
Klay Rozier attempts a 3Pt. Contested by Scottie Turner (4.0 feet, ZONE). KLAY ROZIER MAKES IT! Assist: Anfernee Adebayo
Score: 63-40

[08:50] Team_041 possession (Score: 63-40)
Scottie Turner attempts a Layup. Contested by Kobe Ming (5.0 feet, MAN). SCOTTIE TURNER MAKES IT! Assist: Jarrett Anunoby
Score: 63-42

[08:37] Team_057 possession (Score: 63-42)
Klay Rozier drives and kicks out. Ben Adebayo attempts a Midrange. Contested by Jarrett Anunoby (4.8 feet, ZONE). BEN ADEBAYO MAKES IT!
Score: 65-42

[08:24] Team_041 possession (Score: 65-42)
Terry Barrett attempts a Layup. Contested by Miles Middleton (3.5 feet, MAN). TERRY BARRETT MAKES IT! Assist: Scottie Turner
Score: 65-44

[08:12] Team_057 possession (Score: 65-44)
Kobe Ming drives, Terry Barrett stays with him. Kobe Ming attempts a Layup. Contested by Terry Barrett (5.3 feet, ZONE). Kobe Ming misses. Rebound secured by Stephen Ingram.

[07:58] Team_041 possession (Score: 65-44)
Jarrett Anunoby attempts a 3Pt. Contested by Kobe Ming (4.7 feet, ZONE). JARRETT ANUNOBY MAKES IT! Assist: Stephen Ingram
Score: 65-47

[07:44] Team_057 possession (Score: 65-47)
FOUL! Shooting foul on Terry Barrett. Ben Adebayo to the line for 2 free throws. [Team fouls: 3] (Terry Barrett: 2 personal fouls)   FT 1/2: GOOD   FT 2/2: GOOD Ben Adebayo makes 2/2 from the line.
Score: 67-47

[07:29] Team_041 possession (Score: 67-47)
Scottie Turner attempts a 3Pt. Wide open! Kobe Ming is 7.3 feet away. [ZONE] SCOTTIE TURNER MAKES IT! Assist: Jarrett Anunoby
Score: 67-50

[07:13] Team_057 possession (Score: 67-50)
Kobe Ming makes the Layup and draws the foul on Jarrett Anunoby! And-1! Kobe Ming to the line for 1. [Team fouls: 4] (Jarrett Anunoby: 2 personal fouls)   FT 1/1: GOOD Kobe Ming makes 1/1 from the line.
Score: 70-50

[07:01] Team_041 possession (Score: 70-50)
Dejounte Griffin loses control! Ball rolls out of bounds! TURNOVER! (dead ball)

[06:46] Team_057 possession (Score: 70-50)
Anfernee Adebayo attempts a 3Pt. Contested by Dejounte Griffin (2.9 feet, MAN). Anfernee Adebayo misses. Rebound secured by Stephen Ingram.

[06:30] Team_041 possession (Score: 70-50)
Stephen Ingram drives and kicks out. Terry Barrett makes the Midrange and draws the foul on Miles Middleton! And-1! Terry Barrett to the line for 1. [Team fouls: 2] (Miles Middleton: 2 personal fouls)   FT 1/1: GOOD Terry Barrett makes 1/1 from the line.
Score: 70-53

[06:12] Team_057 possession (Score: 70-53)
Ben Adebayo drives, picks up Terry Barrett. Help arrives from Jarrett Anunoby! Ben Adebayo attempts a Dunk. Contested by Jarrett Anunoby (2.1 feet, ZONE). BEN ADEBAYO MAKES IT! Assist: Klay Rozier
Score: 72-53

[06:01] Team_041 possession (Score: 72-53)
Dejounte Griffin makes the Layup and draws the foul on Anfernee Adebayo! And-1! Dejounte Griffin to the line for 1. [Team fouls: 3] (Anfernee Adebayo: 1 personal fouls)   FT 1/1: GOOD Dejounte Griffin makes 1/1 from the line.
Score: 72-56

[05:43] Team_057 possession (Score: 72-56)
Klay Rozier attempts a 3Pt. Contested by Scottie Turner (3.8 feet, ZONE). KLAY ROZIER MAKES IT! Assist: Miles Middleton
Score: 75-56

[05:28] Team_041 possession (Score: 75-56)
Jarrett Anunoby attempts a Midrange. Contested by Klay Rozier (2.3 feet, MAN). JARRETT ANUNOBY MAKES IT!
Score: 75-58

[05:12] Team_057 possession (Score: 75-58)
Miles Middleton attempts a Midrange. Heavily contested by Dejounte Griffin (1.8 feet, ZONE)! Miles Middleton misses. Offensive rebound by Ben Adebayo! Ben Adebayo kicks it out.

[04:56] Team_057 possession (Score: 75-58)
Klay Rozier attempts a Layup. Contested by Jarrett Anunoby (4.3 feet, MAN). KLAY ROZIER MAKES IT! Assist: Kobe Ming
Score: 77-58

[04:41] Team_041 possession (Score: 77-58)
FOUL! Holding foul on Anfernee Adebayo. [Team fouls: 4] No free throws, side out. (Anfernee Adebayo: 2 personal fouls)

[04:29] Team_041 possession (Score: 77-58)
FOUL! Reach-in foul on Ben Adebayo during the drive. [IN THE BONUS! 5 team fouls] Scottie Turner to the line for 2 free throws. (Ben Adebayo: 1 personal fouls)   FT 1/2: GOOD   FT 2/2: GOOD Scottie Turner makes 2/2 from the line.
Score: 77-60

[04:16] Team_057 possession (Score: 77-60)
Klay Rozier attempts a 3Pt. Contested by Scottie Turner (3.9 feet, ZONE). Klay Rozier misses. Offensive rebound by Miles Middleton! Miles Middleton kicks it out.

[04:05] Team_057 possession (Score: 77-60)
Klay Rozier attempts a 3Pt. Contested by Jarrett Anunoby (5.2 feet, MAN). Klay Rozier misses. Rebound secured by Dejounte Griffin.

[03:49] Team_041 possession (Score: 77-60)
Stephen Ingram attempts a 3Pt. Heavily contested by Kobe Ming (0.5 feet, ZONE)! Stephen Ingram misses. Rebound secured by Ben Adebayo.

[03:33] Team_057 possession (Score: 77-60)
Miles Middleton attempts a Layup. Contested by Terry Barrett (3.6 feet, ZONE). Miles Middleton misses. Rebound secured by Stephen Ingram.

[03:21] Team_041 possession (Score: 77-60)
Terry Barrett drives to the basket... Terry Barrett throws a bad pass! Stolen by Miles Middleton! TURNOVER! (live ball)

[03:07] Team_057 possession (Score: 77-60)
Ben Adebayo attempts a Layup. Contested by Stephen Ingram (4.8 feet, MAN). BEN ADEBAYO MAKES IT!
Score: 79-60

[02:52] Team_041 possession (Score: 79-60)
FOUL! Reach-in foul on Ben Adebayo during the drive. [IN THE BONUS! 6 team fouls] Terry Barrett to the line for 2 free throws. (Ben Adebayo: 2 personal fouls)   FT 1/2: GOOD   FT 2/2: GOOD Terry Barrett makes 2/2 from the line.
Score: 79-62

[02:37] Team_057 possession (Score: 79-62)
Miles Middleton attempts a 3Pt. Contested by Terry Barrett (4.6 feet, MAN). Miles Middleton misses. Rebound secured by Terry Barrett.

[02:26] Team_041 possession (Score: 79-62)
FOUL! Holding foul on Klay Rozier. [IN THE BONUS! 7 team fouls] Jarrett Anunoby to the line for 2 free throws. (Klay Rozier: 1 personal fouls)   FT 1/2: GOOD   FT 2/2: MISS Jarrett Anunoby makes 1/2 from the line. Rebound secured by Ben Adebayo.
Score: 79-63

[02:08] Team_057 possession (Score: 79-63)
Anfernee Adebayo attempts a Layup. Wide open! Dejounte Griffin is 7.7 feet away. [MAN] Anfernee Adebayo misses. Offensive rebound by Ben Adebayo! Ben Adebayo kicks it out.

[01:55] Team_057 possession (Score: 79-63)
Kobe Ming throws a bad pass out of bounds! TURNOVER! (dead ball)

[01:55] Substitution (Team_057): Kobe Ming OUT → Scottie Johnson IN (stamina_rule2)

[01:55] Substitution (Team_057): Klay Rozier OUT → Bradley Ginobili IN (stamina_rule2)

[01:55] Substitution (Team_057): Anfernee Adebayo OUT → Joel Wade IN (stamina_rule2)

[01:55] Substitution (Team_057): Ben Adebayo OUT → Lamelo Irving IN (stamina_rule2)

[01:55] Substitution (Team_057): Miles Middleton OUT → Zion Lillard IN (stamina_rule2)

[01:55] Substitution (Team_041): Scottie Turner OUT → Franz Rose IN (stamina_rule2)

[01:55] Substitution (Team_041): Jarrett Anunoby OUT → Kyrie Booker IN (stamina_rule2)

[01:55] Substitution (Team_041): Dejounte Griffin OUT → Bam McCollum IN (stamina_rule2)

[01:55] Substitution (Team_041): Terry Barrett OUT → De'Aaron Poole IN (stamina_rule2)

[01:40] Team_041 possession (Score: 79-63)
Franz Rose drives, Lamelo Irving stays with him. Franz Rose attempts a Layup. Wide open! Lamelo Irving is 8.1 feet away. [ZONE] FRANZ ROSE MAKES IT! Assist: Kyrie Booker
Score: 79-65

[01:26] Team_057 possession (Score: 79-65)
Bradley Ginobili drives and kicks out. Joel Wade attempts a 3Pt. Wide open! Bam McCollum is 6.8 feet away. [MAN] Joel Wade misses. Rebound secured by Stephen Ingram.

[01:10] Team_041 possession (Score: 79-65)
Bam McCollum attempts a 3Pt. Contested by Joel Wade (3.6 feet, MAN). Bam McCollum misses. Offensive rebound by Stephen Ingram! Stephen Ingram kicks it out.

[00:58] Team_041 possession (Score: 79-65)
Franz Rose drives and kicks out. De'Aaron Poole attempts a 3Pt. Contested by Zion Lillard (2.1 feet, MAN). De'Aaron Poole misses. Offensive rebound by Stephen Ingram! Stephen Ingram kicks it out.

[00:43] Team_041 possession (Score: 79-65)
Kyrie Booker attempts a Midrange. Heavily contested by Bradley Ginobili (1.5 feet, MAN)! KYRIE BOOKER MAKES IT! Assist: Stephen Ingram
Score: 79-67

[00:29] Team_057 possession (Score: 79-67)
Scottie Johnson drives and kicks out. Scottie Johnson attempts a Midrange. Contested by Franz Rose (5.3 feet, MAN). Scottie Johnson misses. Rebound secured by Stephen Ingram.

[00:12] Team_041 possession (Score: 79-67)
Kyrie Booker throws a bad pass out of bounds! TURNOVER! (dead ball)

[00:12] Substitution (Team_041): Stephen Ingram OUT → Tobias McCollum IN (stamina_rule2)

================================================================================
                              3RD QUARTER COMPLETE                              
================================================================================

3RD QUARTER SCORE: Team_057 30, Team_041 31

BOX SCORE:
================================================================================

Team_057
--------------------------------------------------------------------------------
Player                MIN  PTS  REB  AST  TO      FG   FG%      3P   3P%
--------------------------------------------------------------------------------
Ben Adebayo            25   12    5    0   0   6/6   100.0     0/0   0.0
Klay Rozier            25   10    0    1   0   4/5    80.0     0/0   0.0
Kobe Ming              25    6    0    2   0   2/3    66.7     0/0   0.0
Anfernee Adebayo       25    2    1    1   0   1/2    50.0     0/0   0.0
Miles Middleton        25    0    2    2   0   0/2     0.0     0/0   0.0
Bradley Ginobili       11    0    0    0   0   0/1     0.0     0/0   0.0
Scottie Johnson        11    0    0    0   0   0/1     0.0     0/0   0.0

TEAM: FG: 13/20 (65.0%), 3PT: 2/5 (40.0%), REB: 8 (4 off, 4 def), AST: 6, TO: 1
TEAM FOULS: 7 [Team_041 in BONUS]


Team_041
--------------------------------------------------------------------------------
Player                MIN  PTS  REB  AST  TO      FG   FG%      3P   3P%
--------------------------------------------------------------------------------
Terry Barrett          25    9    1    0   0   4/4   100.0     0/0   0.0
Scottie Turner         25    7    0    1   0   3/3   100.0     0/0   0.0
Jarrett Anunoby        25    5    0    2   0   2/3    66.7     0/0   0.0
Dejounte Griffin       25    5    1    0   0   2/2   100.0     0/0   0.0
Franz Rose             11    2    0    0   0   1/1   100.0     0/0   0.0
Kyrie Booker           11    2    0    1   0   1/1   100.0     0/0   0.0
Stephen Ingram         27    0    7    4   0   0/2     0.0     0/0   0.0

TEAM: FG: 13/17 (76.5%), 3PT: 2/3 (66.7%), REB: 9 (2 off, 7 def), AST: 8, TO: 4
TEAM FOULS: 4

================================================================================

================================================================================
                       4TH QUARTER - Team_057 vs Team_041                       
================================================================================

[12:00] Team_057 possession (Score: 79-67)
Kobe Ming attempts a 3Pt. Contested by Scottie Turner (5.0 feet, MAN). Kobe Ming misses. Rebound secured by Stephen Ingram.

[11:47] Team_041 possession (Score: 79-67)
Stephen Ingram attempts a 3Pt. Contested by Ben Adebayo (4.5 feet, MAN). Stephen Ingram misses. Offensive rebound by Stephen Ingram! Stephen Ingram kicks it out.

[11:37] Team_041 possession (Score: 79-67)
FOUL! Holding foul on Kobe Ming. [Team fouls: 1] No free throws, side out. (Kobe Ming: 1 personal fouls)

[11:20] Team_041 possession (Score: 79-67)
Jarrett Anunoby attempts a Layup. Contested by Miles Middleton (4.4 feet, ZONE). JARRETT ANUNOBY MAKES IT! Assist: Stephen Ingram
Score: 79-69

[11:03] Team_057 possession (Score: 79-69)
Miles Middleton loses the ball! Stripped by Terry Barrett! TURNOVER! (live ball)

[10:50] Team_041 possession (Score: 79-69)
Stephen Ingram drives, Ben Adebayo stays with him. Stephen Ingram attempts a Dunk. Contested by Ben Adebayo (4.2 feet, ZONE). STEPHEN INGRAM MAKES IT!
Score: 79-71

[10:34] Team_057 possession (Score: 79-71)
Anfernee Adebayo drives and kicks out. Klay Rozier attempts a 3Pt. Contested by Scottie Turner (3.7 feet, ZONE). KLAY ROZIER MAKES IT! Assist: Kobe Ming
Score: 82-71

[10:18] Team_041 possession (Score: 82-71)
Scottie Turner drives to the basket... Scottie Turner throws a bad pass out of bounds! TURNOVER! (dead ball)

[10:18] Substitution (Team_057): Anfernee Adebayo OUT → Joel Wade IN (stamina_rule2)

[10:18] Substitution (Team_041): Dejounte Griffin OUT → Bam McCollum IN (stamina_rule2)

[10:18] Substitution (Team_041): Stephen Ingram OUT → Tobias McCollum IN (stamina_rule2)

[10:02] Team_057 possession (Score: 82-71)
Joel Wade throws a bad pass! Stolen by Bam McCollum! TURNOVER! (live ball)

[09:49] Team_041 possession (Score: 82-71)
Terry Barrett drives to the basket... Terry Barrett throws a bad pass! Stolen by Miles Middleton! TURNOVER! (live ball)

[09:34] Team_057 possession (Score: 82-71)
Kobe Ming drives, picks up Scottie Turner. Help arrives from Jarrett Anunoby! Kobe Ming attempts a Layup. Wide open! Jarrett Anunoby is 6.7 feet away. [MAN] KOBE MING MAKES IT! Assist: Ben Adebayo
Score: 84-71

[09:21] Team_041 possession (Score: 84-71)
Bam McCollum attempts a Layup. BLOCKED BY JOEL WADE! Ball is loose! Rebound secured by Klay Rozier.

[09:05] Team_057 possession (Score: 84-71)
Klay Rozier attempts a Midrange. Contested by Jarrett Anunoby (3.3 feet, MAN). Klay Rozier misses. Rebound secured by Jarrett Anunoby.

[08:51] Team_041 possession (Score: 84-71)
Terry Barrett attempts a 3Pt. Contested by Kobe Ming (5.5 feet, ZONE). Terry Barrett misses. Rebound secured by Miles Middleton.

[08:39] Team_057 possession (Score: 84-71)
Klay Rozier attempts a Midrange. Wide open! Bam McCollum is 8.3 feet away. [ZONE] Klay Rozier misses. Rebound secured by Jarrett Anunoby.

[08:26] Team_041 possession (Score: 84-71)
Scottie Turner attempts a Midrange. Wide open! Kobe Ming is 6.4 feet away. [MAN] Scottie Turner misses. Rebound secured by Ben Adebayo.

[08:07] Team_057 possession (Score: 84-71)
Klay Rozier attempts a 3Pt. Contested by Jarrett Anunoby (3.4 feet, MAN). Klay Rozier misses. Rebound secured by Tobias McCollum.

[07:56] Team_041 possession (Score: 84-71)
Scottie Turner attempts a Layup. BLOCKED BY KLAY ROZIER! Ball is loose! Rebound secured by Miles Middleton.

[07:42] Team_057 possession (Score: 84-71)
Joel Wade attempts a 3Pt. Contested by Scottie Turner (4.9 feet, ZONE). JOEL WADE MAKES IT! Assist: Ben Adebayo
Score: 87-71

[07:28] Team_041 possession (Score: 87-71)
Terry Barrett attempts a Midrange. Contested by Ben Adebayo (4.9 feet, ZONE). TERRY BARRETT MAKES IT!
Score: 87-73

[07:10] Team_057 possession (Score: 87-73)
Miles Middleton attempts a 3Pt. Wide open! Terry Barrett is 10.0 feet away. [MAN] MILES MIDDLETON MAKES IT! Assist: Joel Wade
Score: 90-73

[06:58] Team_041 possession (Score: 90-73)
FOUL! Reach-in foul on Ben Adebayo during the drive. [Team fouls: 2] No free throws, side out. (Ben Adebayo: 1 personal fouls)

[06:45] Team_041 possession (Score: 90-73)
FOUL! Holding foul on Joel Wade. [Team fouls: 3] No free throws, side out. (Joel Wade: 1 personal fouls)

[06:29] Team_041 possession (Score: 90-73)
Bam McCollum drives and kicks out. Bam McCollum attempts a Midrange. Heavily contested by Joel Wade (0.8 feet, MAN)! BAM MCCOLLUM MAKES IT! Assist: Terry Barrett
Score: 90-75

[06:18] Team_057 possession (Score: 90-75)
FOUL! Holding foul on Terry Barrett. [Team fouls: 1] No free throws, side out. (Terry Barrett: 1 personal fouls)

[06:05] Team_057 possession (Score: 90-75)
Joel Wade attempts a 3Pt. Contested by Bam McCollum (5.3 feet, MAN). Joel Wade misses. Offensive rebound by Ben Adebayo! Ben Adebayo kicks it out.

[05:48] Team_057 possession (Score: 90-75)
Joel Wade attempts a Midrange. Contested by Bam McCollum (4.2 feet, MAN). JOEL WADE MAKES IT! Assist: Klay Rozier
Score: 92-75

[05:35] Team_041 possession (Score: 92-75)
Terry Barrett attempts a Midrange. Wide open! Miles Middleton is 6.2 feet away. [MAN] Terry Barrett misses. Offensive rebound by Tobias McCollum! Tobias McCollum kicks it out.

[05:17] Team_041 possession (Score: 92-75)
Bam McCollum attempts a Layup. Wide open! Ben Adebayo is 6.2 feet away. [ZONE] BAM MCCOLLUM MAKES IT! Assist: Scottie Turner
Score: 92-77

[05:05] Team_057 possession (Score: 92-77)
Miles Middleton drives to the basket... Miles Middleton commits a violation (traveling/carry)! TURNOVER! (dead ball)

[05:05] Substitution (Team_057): Kobe Ming OUT → Scottie Johnson IN (stamina_rule2)

[05:05] Substitution (Team_057): Klay Rozier OUT → Bradley Ginobili IN (stamina_rule2)

[05:05] Substitution (Team_057): Ben Adebayo OUT → Lamelo Irving IN (stamina_rule2)

[05:05] Substitution (Team_057): Miles Middleton OUT → Zion Lillard IN (stamina_rule2)

[05:05] Substitution (Team_041): Scottie Turner OUT → Franz Rose IN (stamina_rule2)

[05:05] Substitution (Team_041): Jarrett Anunoby OUT → Kyrie Booker IN (stamina_rule2)

[05:05] Substitution (Team_041): Terry Barrett OUT → De'Aaron Poole IN (stamina_rule2)

[04:50] Team_041 possession (Score: 92-77)
De'Aaron Poole attempts a Layup. Wide open! Zion Lillard is 7.0 feet away. [MAN] DE'AARON POOLE MAKES IT! Assist: Bam McCollum
Score: 92-79

[04:33] Team_057 possession (Score: 92-79)
Zion Lillard attempts a Midrange. Contested by De'Aaron Poole (2.2 feet, ZONE). ZION LILLARD MAKES IT!
Score: 94-79

[04:16] Team_041 possession (Score: 94-79)
Bam McCollum attempts a 3Pt. Contested by Scottie Johnson (3.3 feet, ZONE). Bam McCollum misses. Rebound secured by Joel Wade.

[04:03] Team_057 possession (Score: 94-79)
Scottie Johnson attempts a 3Pt. Contested by Franz Rose (2.7 feet, MAN). Scottie Johnson misses. Rebound secured by Tobias McCollum.

[03:49] Team_041 possession (Score: 94-79)
Kyrie Booker attempts a 3Pt. Contested by Bradley Ginobili (4.7 feet, MAN). KYRIE BOOKER MAKES IT! Assist: Franz Rose
Score: 94-82

[03:33] Team_057 possession (Score: 94-82)
Lamelo Irving drives, Tobias McCollum stays with him. Lamelo Irving attempts a Dunk. Wide open! Tobias McCollum is 6.0 feet away. [ZONE] LAMELO IRVING MAKES IT! Assist: Joel Wade
Score: 96-82

[03:23] Team_041 possession (Score: 96-82)
Kyrie Booker attempts a Midrange. BLOCKED BY JOEL WADE! Ball goes out off Joel Wade. Kyrie Booker's ball!

[03:09] Team_041 possession (Score: 96-82)
De'Aaron Poole drives, picks up Lamelo Irving. Help arrives from Bradley Ginobili! De'Aaron Poole attempts a Dunk. Wide open! Bradley Ginobili is 6.8 feet away. [ZONE] De'Aaron Poole misses. Rebound secured by Lamelo Irving.

[02:53] Team_057 possession (Score: 96-82)
Lamelo Irving attempts a Midrange. Contested by Tobias McCollum (4.8 feet, MAN). LAMELO IRVING MAKES IT! Assist: Zion Lillard
Score: 98-82

[02:34] Team_041 possession (Score: 98-82)
Tobias McCollum attempts a Layup. Contested by Lamelo Irving (5.9 feet, MAN). TOBIAS MCCOLLUM MAKES IT!
Score: 98-84

[02:18] Team_057 possession (Score: 98-84)
Bradley Ginobili attempts a 3Pt. Contested by Kyrie Booker (3.4 feet, MAN). Bradley Ginobili misses. Rebound secured by Tobias McCollum.

[01:59] Team_041 possession (Score: 98-84)
De'Aaron Poole makes the Layup and draws the foul on Zion Lillard! And-1! De'Aaron Poole to the line for 1. [Team fouls: 4] (Zion Lillard: 1 personal fouls)   FT 1/1: GOOD De'Aaron Poole makes 1/1 from the line.
Score: 98-87

[01:46] Team_057 possession (Score: 98-87)
Zion Lillard attempts a Layup. BLOCKED BY DE'AARON POOLE! Ball is loose! Offensive rebound by Zion Lillard! Zion Lillard kicks it out.

[01:33] Team_057 possession (Score: 98-87)
Joel Wade drives and kicks out. Joel Wade attempts a 3Pt. Contested by Kyrie Booker (4.9 feet, ZONE). Joel Wade misses. Rebound secured by Tobias McCollum.

[01:22] Team_041 possession (Score: 98-87)
De'Aaron Poole attempts a 3Pt. Wide open! Scottie Johnson is 7.5 feet away. [ZONE] De'Aaron Poole misses. Rebound secured by Lamelo Irving.

[01:09] Team_057 possession (Score: 98-87)
Lamelo Irving attempts a Midrange. Wide open! Tobias McCollum is 8.3 feet away. [MAN] Lamelo Irving misses. Rebound secured by Kyrie Booker.

[00:58] Team_041 possession (Score: 98-87)
Franz Rose attempts a Midrange. Contested by Scottie Johnson (3.7 feet, MAN). FRANZ ROSE MAKES IT! Assist: Bam McCollum
Score: 98-89

[00:44] Team_057 possession (Score: 98-89)
Scottie Johnson drives and kicks out. Zion Lillard attempts a Midrange. Wide open! De'Aaron Poole is 6.1 feet away. [MAN] Zion Lillard misses. Rebound secured by Kyrie Booker.

[00:25] Team_041 possession (Score: 98-89)
FOUL! Reach-in foul on Zion Lillard during the drive. [IN THE BONUS! 5 team fouls] De'Aaron Poole to the line for 2 free throws. (Zion Lillard: 2 personal fouls)   FT 1/2: GOOD   FT 2/2: MISS De'Aaron Poole makes 1/2 from the line. Rebound secured by Joel Wade.
Score: 98-90

[00:13] Team_057 possession (Score: 98-90)
Lamelo Irving drives, picks up Tobias McCollum. Help arrives from Kyrie Booker! Lamelo Irving attempts a Layup. Wide open! Kyrie Booker is 6.3 feet away. [MAN] Lamelo Irving misses. Offensive rebound by Zion Lillard! Zion Lillard's putback is no good. Rebound secured by Tobias McCollum.

================================================================================
                              4TH QUARTER COMPLETE                              
================================================================================

4TH QUARTER SCORE: Team_057 19, Team_041 23

BOX SCORE:
================================================================================

Team_057
--------------------------------------------------------------------------------
Player                MIN  PTS  REB  AST  TO      FG   FG%      3P   3P%
--------------------------------------------------------------------------------
Joel Wade              21    5    2    2   0   2/3    66.7     0/0   0.0
Lamelo Irving          16    4    2    0   0   2/4    50.0     0/0   0.0
Klay Rozier            32    3    1    1   0   1/4    25.0     0/0   0.0
Miles Middleton        32    3    2    0   0   1/1   100.0     0/0   0.0
Kobe Ming              32    2    0    1   0   1/2    50.0     0/0   0.0
Tobias McCollum        20    2    6    0   0   1/1   100.0     0/0   0.0
Zion Lillard           16    2    1    1   0   1/1   100.0     0/0   0.0
Ben Adebayo            32    0    2    2   0   0/0     0.0     0/0   0.0
Scottie Johnson        16    0    0    0   0   0/2     0.0     0/0   0.0
Bradley Ginobili       16    0    0    0   0   0/1     0.0     0/0   0.0

TEAM: FG: 8/18 (44.4%), 3PT: 2/6 (33.3%), REB: 11 (3 off, 8 def), AST: 7, TO: 3
TEAM FOULS: 5 [Team_041 in BONUS]


Team_041
--------------------------------------------------------------------------------
Player                MIN  PTS  REB  AST  TO      FG   FG%      3P   3P%
--------------------------------------------------------------------------------
De'Aaron Poole         16    5    0    0   0   2/5    40.0     0/0   0.0
Bam McCollum           21    4    0    2   0   2/4    50.0     0/0   0.0
Kyrie Booker           16    3    2    0   0   1/1   100.0     0/0   0.0
Stephen Ingram         29    2    2    1   0   1/1   100.0     0/0   0.0
Jarrett Anunoby        32    2    2    0   0   1/1   100.0     0/0   0.0
Terry Barrett          32    2    0    1   0   1/2    50.0     0/0   0.0
Franz Rose             16    2    0    1   0   1/1   100.0     0/0   0.0
Scottie Turner         32    0    0    1   0   0/2     0.0     0/0   0.0

TEAM: FG: 10/18 (55.6%), 3PT: 1/4 (25.0%), REB: 11 (2 off, 9 def), AST: 6, TO: 2
TEAM FOULS: 1

================================================================================

================================================================================
                               FULL GAME COMPLETE                               
================================================================================

FINAL SCORE: Team_057 98, Team_041 90

SCORING BY QUARTER:
--------------------------------------------------------------------------------
Team                     Q1     Q2     Q3     Q4    FINAL
--------------------------------------------------------------------------------
Team_057                 26     23     30     19       98
Team_041                 17     19     31     23       90
--------------------------------------------------------------------------------

FULL GAME BOX SCORE:
================================================================================

Team_057
--------------------------------------------------------------------------------
Player                MIN  PTS  REB  AST  TO      FG   FG%      3P   3P%      FT STL BLK
--------------------------------------------------------------------------------
Kobe Ming              32   12    0    4   2   6/8    75.0   0/1     0.0   2/2     1   0
Klay Rozier            32   19    1    4   0   7/14   50.0   2/5    40.0   2/3     0   1
Ben Adebayo            32   20   13    2   1   9/13   69.2   0/1     0.0   4/4     1   1
Miles Middleton        32    8    6    4   2   2/5    40.0   1/2    50.0   1/1     2   0
Anfernee Adebayo       27    6    5    2   2   4/7    57.1   0/2     0.0   0/1     0   0
Joel Wade              21   10    5    2   3   3/4    75.0   2/2   100.0   2/2     0   2
Scottie Johnson        16    3    0    0   1   1/4    25.0   1/2    50.0   0/0     0   0
Bradley Ginobili       16    0    0    2   0   0/3     0.0   0/1     0.0   0/0     0   0
Lamelo Irving          16    8    5    0   2   4/7    57.1   0/1     0.0   1/2     3   1
Zion Lillard           16    7    4    3   1   3/6    50.0   1/1   100.0   2/2     1   0

TEAM: FG: 41/74 (55.4%), 3PT: 7/18 (38.9%), REB: 39 (10 off, 29 def), AST: 23, TO: 14


Team_041
--------------------------------------------------------------------------------
Player                MIN  PTS  REB  AST  TO      FG   FG%      3P   3P%      FT STL BLK
--------------------------------------------------------------------------------
Scottie Turner         32    7    0    4   2   3/7    42.9   1/3    33.3   2/2     0   0
Jarrett Anunoby        32   17    2    2   0   7/9    77.8   3/3   100.0   4/6     0   0
Terry Barrett          32   11    4    2   1   4/6    66.7   0/1     0.0   3/3     2   1
Stephen Ingram         29    9   15    5   4   5/8    62.5   1/2    50.0   0/0     1   0
Dejounte Griffin       27   10    4    1   4   4/10   40.0   0/2     0.0   2/2     1   0
Bam McCollum           21    4    0    2   1   4/8    50.0   0/3     0.0   0/0     1   0
Tobias McCollum        20    4   10    1   2   1/3    33.3   0/1     0.0   2/2     0   0
Franz Rose             16    8    0    2   0   4/5    80.0   0/0     0.0   0/0     0   0
Kyrie Booker           16   13    2    1   3   4/6    66.7   3/5    60.0   0/0     0   0
De'Aaron Poole         16    5    2    1   1   2/5    40.0   0/1     0.0   2/3     0   1

TEAM: FG: 38/68 (55.9%), 3PT: 8/21 (38.1%), REB: 39 (7 off, 32 def), AST: 21, TO: 18

================================================================================
