================================================================================
                        FULL GAME - Team_097 vs Team_016                        
================================================================================

================================================================================
                       1ST QUARTER - Team_097 vs Team_016                       
================================================================================

[12:00] Team_097 possession (Score: 0-0)
Anthony Haliburton drives, picks up Ben Barrett. Help arrives from Collin Barnes! Anthony Haliburton attempts a Layup. Heavily contested by Collin Barnes (0.6 feet, MAN)! ANTHONY HALIBURTON MAKES IT!
Score: 2-0

[11:49] Team_016 possession (Score: 2-0)
Collin Barnes attempts a 3Pt. Wide open! Shai Poole is 8.0 feet away. [ZONE] Collin Barnes misses. Rebound secured by Shai Poole.

[11:35] Team_097 possession (Score: 2-0)
Evan Brogdon attempts a Midrange. Wide open! Vince Quickley is 6.8 feet away. [ZONE] Evan Brogdon misses. Rebound secured by Vince Quickley.

[11:22] Team_016 possession (Score: 2-0)
Ben Barrett throws a bad pass! Stolen by Anthony Haliburton! TURNOVER! (live ball)

[11:08] Team_097 possession (Score: 2-0)
Shai Poole attempts a 3Pt. Wide open! Ben Barrett is 6.1 feet away. [ZONE] SHAI POOLE MAKES IT!
Score: 5-0

[10:54] Team_016 possession (Score: 5-0)
Giannis Ginobili attempts a 3Pt. Wide open! Jrue Haliburton is 6.2 feet away. [MAN] Giannis Ginobili misses. Rebound secured by Anthony Haliburton.

[10:43] Team_097 possession (Score: 5-0)
Anthony Haliburton attempts a 3Pt. Wide open! Collin Barnes is 6.2 feet away. [ZONE] Anthony Haliburton misses. Rebound secured by Ben Barrett.

[10:29] Team_016 possession (Score: 5-0)
Collin Barnes makes the Dunk and draws the foul on Anthony Haliburton! And-1! Collin Barnes to the line for 1. [Team fouls: 1] (Anthony Haliburton: 1 personal fouls)   FT 1/1: GOOD Collin Barnes makes 1/1 from the line.
Score: 5-3

[10:15] Team_097 possession (Score: 5-3)
Evan Brogdon attempts a 3Pt. Contested by Collin Barnes (4.0 feet, MAN). EVAN BROGDON MAKES IT! Assist: Shai Poole
Score: 8-3

[09:58] Team_016 possession (Score: 8-3)
FOUL! Shooting foul on Shai Poole. Vince Quickley to the line for 3 free throws. [Team fouls: 2] (Shai Poole: 1 personal fouls)   FT 1/3: MISS   FT 2/3: GOOD   FT 3/3: MISS Vince Quickley makes 1/3 from the line. Rebound secured by Anthony Haliburton.
Score: 8-4

[09:44] Team_097 possession (Score: 8-4)
Jrue Haliburton attempts a 3Pt. Wide open! Giannis Ginobili is 6.0 feet away. [MAN] JRUE HALIBURTON MAKES IT! Assist: Tyrese Stewart
Score: 11-4

[09:33] Team_016 possession (Score: 11-4)
Vince Quickley attempts a 3Pt. Wide open! Shai Poole is 6.0 feet away. [ZONE] VINCE QUICKLEY MAKES IT! Assist: Vince Duncan
Score: 11-7

[09:18] Team_097 possession (Score: 11-7)
Jrue Haliburton throws a bad pass! Stolen by Giannis Ginobili! TURNOVER! (live ball)

[09:05] Team_016 possession (Score: 11-7)
Giannis Ginobili attempts a 3Pt. Contested by Shai Poole (3.5 feet, ZONE). Giannis Ginobili misses. Offensive rebound by Ben Barrett! Ben Barrett puts it back in!
Score: 11-9

[08:51] Team_097 possession (Score: 11-9)
Tyrese Stewart attempts a 3Pt. Contested by Vince Duncan (2.3 feet, MAN). Tyrese Stewart misses. Rebound secured by Vince Quickley.

[08:38] Team_016 possession (Score: 11-9)
Vince Duncan drives and kicks out. Vince Duncan attempts a Midrange. Contested by Tyrese Stewart (4.2 feet, ZONE). Vince Duncan misses. Rebound secured by Tyrese Stewart.

[08:28] Team_097 possession (Score: 11-9)
Shai Poole attempts a Layup. BLOCKED BY VINCE DUNCAN! Ball is loose! Rebound secured by Vince Duncan.

[08:18] Team_016 possession (Score: 11-9)
Giannis Ginobili attempts a 3Pt. Contested by Jrue Haliburton (4.8 feet, MAN). Giannis Ginobili misses. Rebound secured by Shai Poole.

[08:01] Team_097 possession (Score: 11-9)
Anthony Haliburton makes the Layup and draws the foul on Collin Barnes! And-1! Anthony Haliburton to the line for 1. [Team fouls: 1] (Collin Barnes: 1 personal fouls)   FT 1/1: MISS Anthony Haliburton makes 0/1 from the line. Offensive rebound by Tyrese Stewart! Tyrese Stewart kicks it out.
Score: 13-9

[07:48] Team_097 possession (Score: 13-9)
Evan Brogdon drives, picks up Vince Duncan. Help arrives from Collin Barnes! Evan Brogdon attempts a Layup. Contested by Collin Barnes (5.4 feet, ZONE). EVAN BROGDON MAKES IT!
Score: 15-9

[07:33] Team_016 possession (Score: 15-9)
Giannis Ginobili attempts a Layup. Contested by Anthony Haliburton (5.0 feet, ZONE). Giannis Ginobili misses. Rebound secured by Anthony Haliburton.

[07:16] Team_097 possession (Score: 15-9)
Tyrese Stewart makes the Layup and draws the foul on Collin Barnes! And-1! Tyrese Stewart to the line for 1. [Team fouls: 2] (Collin Barnes: 2 personal fouls)   FT 1/1: MISS Tyrese Stewart makes 0/1 from the line. Rebound secured by Ben Barrett.
Score: 17-9

[07:00] Team_016 possession (Score: 17-9)
Ben Barrett attempts a Midrange. Wide open! Jrue Haliburton is 7.0 feet away. [ZONE] Ben Barrett misses. Offensive rebound by Ben Barrett! Ben Barrett puts it back in!
Score: 17-11

[06:49] Team_097 possession (Score: 17-11)
Shai Poole drives and kicks out. Jrue Haliburton attempts a Midrange. BLOCKED BY BEN BARRETT! Ball goes out off Ben Barrett. Jrue Haliburton's ball!

[06:30] Team_097 possession (Score: 17-11)
Evan Brogdon attempts a 3Pt. Wide open! Collin Barnes is 6.3 feet away. [ZONE] Evan Brogdon misses. Rebound secured by Ben Barrett.

[06:12] Team_016 possession (Score: 17-11)
Vince Duncan drives and kicks out. Vince Duncan attempts a 3Pt. Contested by Shai Poole (2.4 feet, ZONE). Vince Duncan misses. Rebound secured by Tyrese Stewart.

[05:55] Team_097 possession (Score: 17-11)
Anthony Haliburton drives to the basket... FOUL! Offensive foul on Anthony Haliburton! Vince Duncan drew the charge! [Team fouls: 3] (Anthony Haliburton: 2 personal fouls) TURNOVER! (dead ball)

[05:43] Team_016 possession (Score: 17-11)
Giannis Ginobili attempts a 3Pt. BLOCKED BY SHAI POOLE! Ball is loose! Rebound secured by Anthony Haliburton.

[05:25] Team_097 possession (Score: 17-11)
Shai Poole attempts a 3Pt. Heavily contested by Collin Barnes (1.2 feet, ZONE)! Shai Poole misses. Rebound secured by Vince Quickley.

[05:09] Team_016 possession (Score: 17-11)
Collin Barnes attempts a 3Pt. Contested by Anthony Haliburton (3.5 feet, ZONE). Collin Barnes misses. Rebound secured by Tyrese Stewart.

[05:00] Team_097 possession (Score: 17-11)
Shai Poole drives, Vince Duncan stays with him. Shai Poole attempts a Layup. Contested by Vince Duncan (5.3 feet, ZONE). SHAI POOLE MAKES IT! Assist: Anthony Haliburton
Score: 19-11

[04:48] Team_016 possession (Score: 19-11)
Vince Duncan attempts a Midrange. Contested by Anthony Haliburton (4.4 feet, MAN). VINCE DUNCAN MAKES IT! Assist: Collin Barnes
Score: 19-13

[04:34] Team_097 possession (Score: 19-13)
Jrue Haliburton attempts a Layup. BLOCKED BY GIANNIS GINOBILI! Ball deflects out of bounds off Jrue Haliburton.

[04:19] Team_016 possession (Score: 19-13)
Vince Quickley attempts a Layup. Heavily contested by Anthony Haliburton (0.5 feet, ZONE)! Vince Quickley misses. Rebound secured by Anthony Haliburton.

[04:08] Team_097 possession (Score: 19-13)
Shai Poole drives, Vince Quickley stays with him. Shai Poole attempts a Dunk. Contested by Vince Quickley (2.3 feet, MAN). SHAI POOLE MAKES IT!
Score: 21-13

[03:54] Team_016 possession (Score: 21-13)
Ben Barrett attempts a 3Pt. Heavily contested by Shai Poole (0.5 feet, ZONE)! Ben Barrett misses. Rebound secured by Tyrese Stewart.

[03:36] Team_097 possession (Score: 21-13)
Tyrese Stewart loses the ball! Stripped by Vince Duncan! TURNOVER! (live ball)

[03:26] Team_016 possession (Score: 21-13)
Giannis Ginobili attempts a Midrange. Contested by Jrue Haliburton (5.9 feet, MAN). GIANNIS GINOBILI MAKES IT! Assist: Vince Duncan
Score: 21-15

[03:11] Team_097 possession (Score: 21-15)
Evan Brogdon attempts a Midrange. Contested by Collin Barnes (3.0 feet, ZONE). EVAN BROGDON MAKES IT! Assist: Anthony Haliburton
Score: 23-15

[02:55] Team_016 possession (Score: 23-15)
Vince Quickley attempts a Midrange. Contested by Shai Poole (2.3 feet, MAN). Vince Quickley misses. Offensive rebound by Vince Duncan! Vince Duncan kicks it out.

[02:41] Team_016 possession (Score: 23-15)
Ben Barrett attempts a 3Pt. Contested by Shai Poole (2.6 feet, ZONE). BEN BARRETT MAKES IT! Assist: Vince Quickley
Score: 23-18

[02:29] Team_097 possession (Score: 23-18)
Jrue Haliburton attempts a 3Pt. Wide open! Giannis Ginobili is 7.9 feet away. [MAN] Jrue Haliburton misses. Rebound secured by Vince Duncan.

[02:10] Team_016 possession (Score: 23-18)
FOUL! Shooting foul on Shai Poole. Vince Quickley to the line for 2 free throws. [Team fouls: 4] (Shai Poole: 2 personal fouls)   FT 1/2: GOOD   FT 2/2: GOOD Vince Quickley makes 2/2 from the line.
Score: 23-20

[01:58] Team_097 possession (Score: 23-20)
Jrue Haliburton attempts a Layup. Contested by Vince Duncan (2.7 feet, ZONE). JRUE HALIBURTON MAKES IT! Assist: Anthony Haliburton
Score: 25-20

[01:43] Team_016 possession (Score: 25-20)
Vince Quickley drives, Shai Poole stays with him. Vince Quickley attempts a Dunk. Heavily contested by Shai Poole (1.1 feet, MAN)! Vince Quickley misses. Rebound secured by Shai Poole.

[01:28] Team_097 possession (Score: 25-20)
Anthony Haliburton throws a bad pass! Stolen by Ben Barrett! TURNOVER! (live ball)

[01:12] Team_016 possession (Score: 25-20)
Collin Barnes attempts a Layup. Contested by Evan Brogdon (5.0 feet, MAN). COLLIN BARNES MAKES IT! Assist: Giannis Ginobili
Score: 25-22

[01:01] Team_097 possession (Score: 25-22)
Anthony Haliburton attempts a Midrange. Heavily contested by Ben Barrett (1.0 feet, MAN)! Anthony Haliburton misses. Rebound secured by Vince Quickley.

[00:47] Team_016 possession (Score: 25-22)
Collin Barnes attempts a Midrange. Contested by Evan Brogdon (4.7 feet, MAN). COLLIN BARNES MAKES IT! Assist: Vince Duncan
Score: 25-24

[00:34] Team_097 possession (Score: 25-24)
Evan Brogdon drives, Collin Barnes stays with him. Evan Brogdon attempts a Layup. Contested by Collin Barnes (2.9 feet, MAN). Evan Brogdon misses. Rebound secured by Vince Quickley.

[00:22] Team_016 possession (Score: 25-24)
Vince Quickley attempts a Midrange. Contested by Jrue Haliburton (3.7 feet, ZONE). Vince Quickley misses. Offensive rebound by Ben Barrett! Ben Barrett's putback is no good. Rebound secured by Tyrese Stewart.

[00:08] Team_097 possession (Score: 25-24)
Anthony Haliburton attempts a Layup. BLOCKED BY BEN BARRETT! Ball is loose! Rebound secured by Vince Duncan.

================================================================================
                              1ST QUARTER COMPLETE                              
================================================================================

1ST QUARTER SCORE: Team_097 25, Team_016 24

BOX SCORE:
================================================================================

Team_097
--------------------------------------------------------------------------------
Player                MIN  PTS  REB  AST  TO      FG   FG%      3P   3P%
--------------------------------------------------------------------------------
Shai Poole             12    7    3    1   0   3/5    60.0     0/0   0.0
Evan Brogdon           12    7    0    0   0   3/6    50.0     0/0   0.0
Jrue Haliburton        12    5    0    0   0   2/4    50.0     0/0   0.0
Anthony Haliburton     12    2    5    3   0   1/4    25.0     0/0   0.0

TEAM: FG: 9/21 (42.9%), 3PT: 3/8 (37.5%), REB: 13 (1 off, 12 def), AST: 5, TO: 4
TEAM FOULS: 4


Team_016
--------------------------------------------------------------------------------
Player                MIN  PTS  REB  AST  TO      FG   FG%      3P   3P%
--------------------------------------------------------------------------------
Collin Barnes          12    7    0    1   0   3/5    60.0     0/0   0.0
Ben Barrett            12    7    5    0   0   3/4    75.0     0/0   0.0
Vince Quickley         12    5    5    1   0   2/6    33.3     0/0   0.0
Giannis Ginobili       12    2    0    1   0   1/5    20.0     0/0   0.0
Vince Duncan           12    2    4    3   0   1/3    33.3     0/0   0.0
Tyrese Stewart         12    0    6    1   0   0/2     0.0     0/0   0.0

TEAM: FG: 10/23 (43.5%), 3PT: 3/10 (30.0%), REB: 15 (4 off, 11 def), AST: 6, TO: 1
TEAM FOULS: 2

================================================================================

================================================================================
                       2ND QUARTER - Team_097 vs Team_016                       
================================================================================

[12:00] Team_097 possession (Score: 25-24)
Jrue Haliburton attempts a 3Pt. Contested by Collin Barnes (3.8 feet, ZONE). Jrue Haliburton misses. FOUL! Loose ball foul on Vince Quickley during the rebound battle. [Team fouls: 1] No free throws, side out. (Vince Quickley: 1 personal fouls)

[11:50] Team_097 possession (Score: 25-24)
Evan Brogdon attempts a 3Pt. Heavily contested by Collin Barnes (1.8 feet, MAN)! Evan Brogdon misses. Rebound secured by Vince Duncan.

[11:38] Team_016 possession (Score: 25-24)
FOUL! Shooting foul on Evan Brogdon. Collin Barnes to the line for 2 free throws. [Team fouls: 1] (Evan Brogdon: 1 personal fouls)   FT 1/2: GOOD   FT 2/2: GOOD Collin Barnes makes 2/2 from the line.
Score: 25-26

[11:22] Team_097 possession (Score: 25-26)
Anthony Haliburton attempts a 3Pt. Contested by Ben Barrett (4.1 feet, MAN). Anthony Haliburton misses. Rebound secured by Vince Duncan.

[11:03] Team_016 possession (Score: 25-26)
Ben Barrett loses control! Ball rolls out of bounds! TURNOVER! (dead ball)

[11:03] Substitution (Team_097): Evan Brogdon OUT → Gary Carter IN (stamina_rule2)

[11:03] Substitution (Team_097): Jrue Haliburton OUT → Dwyane Ginobili IN (stamina_rule2)

[11:03] Substitution (Team_097): Shai Poole OUT → Miles Dosunmu IN (stamina_rule2)

[11:03] Substitution (Team_097): Anthony Haliburton OUT → Joel Simons IN (stamina_rule2)

[11:03] Substitution (Team_097): Tyrese Stewart OUT → Miles Banchero IN (stamina_rule2)

[11:03] Substitution (Team_016): Collin Barnes OUT → Lamelo Herro IN (stamina_rule2)

[11:03] Substitution (Team_016): Giannis Ginobili OUT → Immanuel Nowitzki IN (stamina_rule2)

[11:03] Substitution (Team_016): Vince Quickley OUT → Kevin Butler IN (stamina_rule2)

[11:03] Substitution (Team_016): Ben Barrett OUT → Giannis Doncic IN (stamina_rule2)

[11:03] Substitution (Team_016): Vince Duncan OUT → Trae Barnes IN (stamina_rule2)

[10:44] Team_097 possession (Score: 25-26)
Dwyane Ginobili drives, Immanuel Nowitzki stays with him. Dwyane Ginobili attempts a Layup. Contested by Immanuel Nowitzki (4.6 feet, MAN). DWYANE GINOBILI MAKES IT! Assist: Miles Banchero
Score: 27-26

[10:31] Team_016 possession (Score: 27-26)
Trae Barnes drives and kicks out. Immanuel Nowitzki attempts a 3Pt. Contested by Dwyane Ginobili (5.6 feet, MAN). IMMANUEL NOWITZKI MAKES IT! Assist: Kevin Butler
Score: 27-29

[10:17] Team_097 possession (Score: 27-29)
FOUL! Holding foul on Giannis Doncic. [Team fouls: 2] No free throws, side out. (Giannis Doncic: 1 personal fouls)

[09:58] Team_097 possession (Score: 27-29)
Dwyane Ginobili throws a bad pass! Stolen by Immanuel Nowitzki! TURNOVER! (live ball)

[09:44] Team_016 possession (Score: 27-29)
Trae Barnes drives, picks up Joel Simons. Help arrives from Dwyane Ginobili! Trae Barnes attempts a Dunk. Wide open! Dwyane Ginobili is 6.5 feet away. [ZONE] Trae Barnes misses. Rebound secured by Miles Banchero.

[09:29] Team_097 possession (Score: 27-29)
Miles Banchero drives, Trae Barnes stays with him. Miles Banchero attempts a Layup. Wide open! Trae Barnes is 6.1 feet away. [MAN] MILES BANCHERO MAKES IT! Assist: Miles Dosunmu
Score: 29-29

[09:12] Team_016 possession (Score: 29-29)
Kevin Butler attempts a 3Pt. Contested by Miles Dosunmu (4.3 feet, MAN). Kevin Butler misses. FOUL! Loose ball foul on Joel Simons during the rebound battle. [Team fouls: 2] No free throws, side out. (Joel Simons: 1 personal fouls)

[08:57] Team_016 possession (Score: 29-29)
Trae Barnes attempts a Midrange. Wide open! Dwyane Ginobili is 8.3 feet away. [ZONE] Trae Barnes misses. Rebound secured by Miles Dosunmu.

[08:46] Team_097 possession (Score: 29-29)
Joel Simons drives and kicks out. Gary Carter attempts a Midrange. Wide open! Immanuel Nowitzki is 6.4 feet away. [ZONE] Gary Carter misses. Rebound secured by Lamelo Herro.

[08:31] Team_016 possession (Score: 29-29)
Immanuel Nowitzki attempts a 3Pt. Contested by Joel Simons (5.3 feet, ZONE). Immanuel Nowitzki misses. Rebound secured by Miles Dosunmu.

[08:12] Team_097 possession (Score: 29-29)
Miles Dosunmu attempts a 3Pt. Contested by Kevin Butler (2.5 feet, MAN). MILES DOSUNMU MAKES IT! Assist: Gary Carter
Score: 32-29

[07:56] Team_016 possession (Score: 32-29)
Kevin Butler makes the Layup and draws the foul on Dwyane Ginobili! And-1! Kevin Butler to the line for 1. [Team fouls: 3] (Dwyane Ginobili: 1 personal fouls)   FT 1/1: MISS Kevin Butler makes 0/1 from the line. Rebound secured by Miles Dosunmu.
Score: 32-31

[07:44] Team_097 possession (Score: 32-31)
Dwyane Ginobili drives, Giannis Doncic stays with him. Dwyane Ginobili attempts a Dunk. Contested by Giannis Doncic (2.5 feet, ZONE). Dwyane Ginobili misses. Rebound secured by Trae Barnes.

[07:31] Team_016 possession (Score: 32-31)
Giannis Doncic drives, Joel Simons stays with him. Giannis Doncic attempts a Dunk. Contested by Joel Simons (3.2 feet, ZONE). Giannis Doncic misses. Rebound secured by Joel Simons.

[07:18] Team_097 possession (Score: 32-31)
Dwyane Ginobili attempts a 3Pt. Contested by Immanuel Nowitzki (5.0 feet, MAN). Dwyane Ginobili misses. Offensive rebound by Miles Dosunmu! Miles Dosunmu kicks it out.

[07:04] Team_097 possession (Score: 32-31)
Joel Simons attempts a Midrange. Contested by Kevin Butler (2.8 feet, ZONE). Joel Simons misses. Rebound secured by Trae Barnes.

[06:47] Team_016 possession (Score: 32-31)
Trae Barnes attempts a Layup. Contested by Joel Simons (5.4 feet, ZONE). TRAE BARNES MAKES IT! Assist: Kevin Butler
Score: 32-33

[06:32] Team_097 possession (Score: 32-33)
Gary Carter throws a bad pass! Stolen by Lamelo Herro! TURNOVER! (live ball)

[06:15] Team_016 possession (Score: 32-33)
Trae Barnes drives and kicks out. Trae Barnes attempts a 3Pt. Contested by Joel Simons (4.4 feet, MAN). Trae Barnes misses. Rebound secured by Miles Banchero.

[05:55] Team_097 possession (Score: 32-33)
Dwyane Ginobili attempts a Layup. Contested by Giannis Doncic (5.6 feet, ZONE). Dwyane Ginobili misses. Rebound secured by Trae Barnes.

[05:40] Team_016 possession (Score: 32-33)
Immanuel Nowitzki attempts a Midrange. Contested by Dwyane Ginobili (5.3 feet, MAN). Immanuel Nowitzki misses. Rebound secured by Miles Banchero.

[05:25] Team_097 possession (Score: 32-33)
Gary Carter attempts a 3Pt. Contested by Lamelo Herro (4.1 feet, ZONE). GARY CARTER MAKES IT! Assist: Miles Banchero
Score: 35-33

[05:06] Team_016 possession (Score: 35-33)
Kevin Butler attempts a Midrange. Contested by Miles Dosunmu (5.2 feet, MAN). Kevin Butler misses. Rebound secured by Miles Dosunmu.

[04:50] Team_097 possession (Score: 35-33)
Dwyane Ginobili drives, Giannis Doncic stays with him. Dwyane Ginobili attempts a Dunk. Heavily contested by Giannis Doncic (1.7 feet, ZONE)! DWYANE GINOBILI MAKES IT!
Score: 37-33

[04:34] Team_016 possession (Score: 37-33)
Trae Barnes attempts a Midrange. Contested by Joel Simons (2.2 feet, MAN). Trae Barnes misses. Rebound secured by Miles Dosunmu.

[04:19] Team_097 possession (Score: 37-33)
Miles Dosunmu loses control! Ball rolls out of bounds! TURNOVER! (dead ball)

[04:07] Team_016 possession (Score: 37-33)
Lamelo Herro attempts a Midrange. Contested by Gary Carter (2.8 feet, MAN). Lamelo Herro misses. Offensive rebound by Giannis Doncic! Giannis Doncic kicks it out.

[03:53] Team_016 possession (Score: 37-33)
Lamelo Herro attempts a 3Pt. Contested by Miles Dosunmu (2.7 feet, ZONE). LAMELO HERRO MAKES IT! Assist: Giannis Doncic
Score: 37-36

[03:41] Team_097 possession (Score: 37-36)
Miles Dosunmu attempts a 3Pt. Contested by Kevin Butler (5.0 feet, MAN). MILES DOSUNMU MAKES IT! Assist: Gary Carter
Score: 40-36

[03:27] Team_016 possession (Score: 40-36)
Trae Barnes attempts a Midrange. Heavily contested by Joel Simons (0.5 feet, MAN)! TRAE BARNES MAKES IT! Assist: Lamelo Herro
Score: 40-38

[03:10] Team_097 possession (Score: 40-38)
Dwyane Ginobili attempts a Layup. Contested by Giannis Doncic (4.7 feet, ZONE). DWYANE GINOBILI MAKES IT!
Score: 42-38

[02:56] Team_016 possession (Score: 42-38)
FOUL! Offensive foul on Immanuel Nowitzki! Dwyane Ginobili drew the charge! [Team fouls: 3] (Immanuel Nowitzki: 1 personal fouls) TURNOVER! (dead ball)

[02:40] Team_097 possession (Score: 42-38)
Joel Simons drives and kicks out. Miles Banchero attempts a Midrange. Contested by Trae Barnes (4.1 feet, MAN). Miles Banchero misses. Rebound secured by Lamelo Herro.

[02:24] Team_016 possession (Score: 42-38)
Lamelo Herro attempts a 3Pt. Contested by Gary Carter (5.5 feet, MAN). LAMELO HERRO MAKES IT! Assist: Kevin Butler
Score: 42-41

[02:09] Team_097 possession (Score: 42-41)
Gary Carter drives and kicks out. Joel Simons makes the Midrange and draws the foul on Giannis Doncic! And-1! Joel Simons to the line for 1. [Team fouls: 4] (Giannis Doncic: 2 personal fouls)   FT 1/1: GOOD Joel Simons makes 1/1 from the line.
Score: 45-41

[01:58] Team_016 possession (Score: 45-41)
Kevin Butler attempts a Midrange. Contested by Joel Simons (5.5 feet, ZONE). Kevin Butler misses. Rebound secured by Miles Dosunmu.

[01:44] Team_097 possession (Score: 45-41)
Joel Simons makes the Layup and draws the foul on Giannis Doncic! And-1! Joel Simons to the line for 1. [BONUS: 5 team fouls] (Giannis Doncic: 3 personal fouls)   FT 1/1: GOOD Joel Simons makes 1/1 from the line.
Score: 48-41

[01:29] Team_016 possession (Score: 48-41)
Immanuel Nowitzki drives, Joel Simons stays with him. Immanuel Nowitzki attempts a Dunk. Contested by Joel Simons (4.7 feet, ZONE). IMMANUEL NOWITZKI MAKES IT!
Score: 48-43

[01:13] Team_097 possession (Score: 48-43)
Gary Carter loses control! Ball rolls out of bounds! TURNOVER! (dead ball)

[00:57] Team_016 possession (Score: 48-43)
Kevin Butler attempts a 3Pt. Contested by Joel Simons (5.7 feet, ZONE). KEVIN BUTLER MAKES IT!
Score: 48-46

[00:40] Team_097 possession (Score: 48-46)
Miles Banchero attempts a 3Pt. Wide open! Trae Barnes is 6.7 feet away. [MAN] Miles Banchero misses. Rebound secured by Giannis Doncic.

[00:29] Team_016 possession (Score: 48-46)
Trae Barnes attempts a 3Pt. Wide open! Joel Simons is 7.3 feet away. [MAN] Trae Barnes misses. Rebound secured by Miles Dosunmu.

[00:12] Team_097 possession (Score: 48-46)
Miles Banchero attempts a Midrange. Contested by Trae Barnes (5.9 feet, MAN). Miles Banchero misses. Rebound secured by Trae Barnes.

================================================================================
                              2ND QUARTER COMPLETE                              
================================================================================

2ND QUARTER SCORE: Team_097 23, Team_016 22

BOX SCORE:
================================================================================

Team_097
--------------------------------------------------------------------------------
Player                MIN  PTS  REB  AST  TO      FG   FG%      3P   3P%
--------------------------------------------------------------------------------
Dwyane Ginobili        11    6    0    0   0   3/5    60.0     0/0   0.0
Miles Dosunmu          11    6    8    1   0   2/2   100.0     0/0   0.0
Joel Simons            11    6    1    0   0   2/5    40.0     0/0   0.0
Gary Carter            11    3    0    2   0   1/1   100.0     0/0   0.0
Miles Banchero         11    2    3    2   0   1/3    33.3     0/0   0.0
Anthony Haliburton     13    0    1    0   0   0/1     0.0     0/0   0.0
Evan Brogdon           13    0    0    0   0   0/1     0.0     0/0   0.0

TEAM: FG: 9/18 (50.0%), 3PT: 3/6 (50.0%), REB: 13 (2 off, 11 def), AST: 5, TO: 4
TEAM FOULS: 3


Team_016
--------------------------------------------------------------------------------
Player                MIN  PTS  REB  AST  TO      FG   FG%      3P   3P%
--------------------------------------------------------------------------------
Lamelo Herro           11    6    2    1   0   2/2   100.0     0/0   0.0
Immanuel Nowitzki      11    5    0    0   0   2/4    50.0     0/0   0.0
Trae Barnes            11    4    4    0   0   2/7    28.6     0/0   0.0
Kevin Butler           11    3    0    3   0   1/4    25.0     0/0   0.0
Collin Barnes          13    2    0    0   0   1/1   100.0     0/0   0.0
Vince Duncan           13    0    2    0   0   0/0     0.0     0/0   0.0
Giannis Doncic         11    0    3    1   0   0/1     0.0     0/0   0.0

TEAM: FG: 8/19 (42.1%), 3PT: 3/5 (60.0%), REB: 11 (2 off, 9 def), AST: 5, TO: 2
TEAM FOULS: 5 [Team_097 in BONUS]

================================================================================

================================================================================
                       3RD QUARTER - Team_097 vs Team_016                       
================================================================================

[12:00] Team_097 possession (Score: 48-46)
Anthony Haliburton attempts a Midrange. Contested by Vince Duncan (4.2 feet, ZONE). Anthony Haliburton misses. FOUL! Loose ball foul on Ben Barrett during the rebound battle. [Team fouls: 1] No free throws, side out. (Ben Barrett: 1 personal fouls)

[11:42] Team_097 possession (Score: 48-46)
Jrue Haliburton attempts a 3Pt. Contested by Giannis Ginobili (5.4 feet, MAN). Jrue Haliburton misses. Rebound secured by Vince Quickley.

[11:27] Team_016 possession (Score: 48-46)
Collin Barnes attempts a Midrange. Contested by Evan Brogdon (2.4 feet, MAN). Collin Barnes misses. Offensive rebound by Ben Barrett! Ben Barrett puts it back in!
Score: 48-48

[11:13] Team_097 possession (Score: 48-48)
Anthony Haliburton attempts a 3Pt. Heavily contested by Collin Barnes (1.5 feet, ZONE)! Anthony Haliburton misses. Rebound secured by Ben Barrett.

[10:59] Team_016 possession (Score: 48-48)
Vince Quickley attempts a 3Pt. Heavily contested by Shai Poole (1.5 feet, ZONE)! Vince Quickley misses. Rebound secured by Tyrese Stewart.

[10:42] Team_097 possession (Score: 48-48)
Shai Poole attempts a 3Pt. Wide open! Collin Barnes is 6.3 feet away. [ZONE] Shai Poole misses. Rebound secured by Vince Duncan.

[10:25] Team_016 possession (Score: 48-48)
Ben Barrett makes the Dunk and draws the foul on Jrue Haliburton! And-1! Ben Barrett to the line for 1. [Team fouls: 1] (Jrue Haliburton: 1 personal fouls)   FT 1/1: GOOD Ben Barrett makes 1/1 from the line.
Score: 48-51

[10:12] Team_097 possession (Score: 48-51)
Shai Poole attempts a 3Pt. Contested by Vince Quickley (2.9 feet, MAN). SHAI POOLE MAKES IT! Assist: Tyrese Stewart
Score: 51-51

[09:56] Team_016 possession (Score: 51-51)
Vince Duncan attempts a Midrange. Contested by Anthony Haliburton (5.9 feet, MAN). Vince Duncan misses. Offensive rebound by Ben Barrett! Ben Barrett's putback is no good. Offensive rebound by Ben Barrett! Ben Barrett kicks it out.

[09:43] Team_016 possession (Score: 51-51)
Vince Duncan attempts a Layup. Contested by Anthony Haliburton (2.9 feet, ZONE). VINCE DUNCAN MAKES IT! Assist: Giannis Ginobili
Score: 51-53

[09:30] Team_097 possession (Score: 51-53)
Jrue Haliburton attempts a Layup. Wide open! Giannis Ginobili is 7.1 feet away. [MAN] Jrue Haliburton misses. Rebound secured by Vince Quickley.

[09:14] Team_016 possession (Score: 51-53)
FOUL! Reach-in foul on Anthony Haliburton during the drive. [Team fouls: 2] No free throws, side out. (Anthony Haliburton: 1 personal fouls)

[09:04] Team_016 possession (Score: 51-53)
Ben Barrett attempts a Layup. Contested by Anthony Haliburton (5.0 feet, MAN). BEN BARRETT MAKES IT! Assist: Vince Quickley
Score: 51-55

[08:49] Team_097 possession (Score: 51-55)
Evan Brogdon attempts a 3Pt. Wide open! Vince Quickley is 6.0 feet away. [ZONE] Evan Brogdon misses. Rebound secured by Vince Quickley.

[08:33] Team_016 possession (Score: 51-55)
Collin Barnes attempts a Midrange. Contested by Shai Poole (4.4 feet, ZONE). Collin Barnes misses. Rebound secured by Tyrese Stewart.

[08:18] Team_097 possession (Score: 51-55)
Evan Brogdon drives, Vince Duncan stays with him. Evan Brogdon attempts a Layup. Wide open! Vince Duncan is 6.6 feet away. [ZONE] Evan Brogdon misses. Rebound secured by Vince Duncan.

[08:00] Team_016 possession (Score: 51-55)
Giannis Ginobili throws a bad pass out of bounds! TURNOVER! (dead ball)

[07:48] Team_097 possession (Score: 51-55)
Jrue Haliburton attempts a 3Pt. Wide open! Vince Quickley is 8.2 feet away. [ZONE] Jrue Haliburton misses. Rebound secured by Ben Barrett.

[07:31] Team_016 possession (Score: 51-55)
Ben Barrett attempts a Layup. Wide open! Tyrese Stewart is 7.3 feet away. [ZONE] BEN BARRETT MAKES IT! Assist: Vince Duncan
Score: 51-57

[07:22] Team_097 possession (Score: 51-57)
Shai Poole attempts a 3Pt. Wide open! Vince Quickley is 8.8 feet away. [MAN] Shai Poole misses. Rebound secured by Vince Duncan.

[07:12] Team_016 possession (Score: 51-57)
Vince Quickley loses control! Ball rolls out of bounds! TURNOVER! (dead ball)

[06:53] Team_097 possession (Score: 51-57)
Evan Brogdon attempts a 3Pt. Contested by Collin Barnes (5.0 feet, ZONE). EVAN BROGDON MAKES IT! Assist: Anthony Haliburton
Score: 54-57

[06:33] Team_016 possession (Score: 54-57)
Vince Duncan makes the Layup and draws the foul on Anthony Haliburton! And-1! Vince Duncan to the line for 1. [Team fouls: 3] (Anthony Haliburton: 2 personal fouls)   FT 1/1: GOOD Vince Duncan makes 1/1 from the line.
Score: 54-60

[06:18] Team_097 possession (Score: 54-60)
Evan Brogdon makes the Layup and draws the foul on Ben Barrett! And-1! Evan Brogdon to the line for 1. [Team fouls: 2] (Ben Barrett: 2 personal fouls)   FT 1/1: GOOD Evan Brogdon makes 1/1 from the line.
Score: 57-60

[06:03] Team_016 possession (Score: 57-60)
Vince Quickley attempts a Midrange. BLOCKED BY SHAI POOLE! Ball is loose! Rebound secured by Anthony Haliburton.

[05:49] Team_097 possession (Score: 57-60)
Evan Brogdon attempts a 3Pt. Wide open! Collin Barnes is 7.9 feet away. [MAN] Evan Brogdon misses. Offensive rebound by Tyrese Stewart! Tyrese Stewart kicks it out.

[05:35] Team_097 possession (Score: 57-60)
Jrue Haliburton makes the Layup and draws the foul on Vince Duncan! And-1! Jrue Haliburton to the line for 1. [Team fouls: 3] (Vince Duncan: 1 personal fouls)   FT 1/1: MISS Jrue Haliburton makes 0/1 from the line. Rebound secured by Ben Barrett.
Score: 59-60

[05:22] Team_016 possession (Score: 59-60)
Ben Barrett drives, Anthony Haliburton stays with him. Ben Barrett attempts a Layup. Heavily contested by Anthony Haliburton (1.4 feet, ZONE)! Ben Barrett misses. Offensive rebound by Ben Barrett! Ben Barrett puts it back in!
Score: 59-62

[05:07] Team_097 possession (Score: 59-62)
Tyrese Stewart attempts a Layup. Contested by Vince Duncan (3.5 feet, MAN). Tyrese Stewart misses. Offensive rebound by Anthony Haliburton! Anthony Haliburton's putback is no good. Rebound secured by Ben Barrett.

[04:51] Team_016 possession (Score: 59-62)
Giannis Ginobili drives and kicks out. Giannis Ginobili attempts a 3Pt. Contested by Jrue Haliburton (3.5 feet, MAN). Giannis Ginobili misses. Rebound secured by Shai Poole.

[04:33] Team_097 possession (Score: 59-62)
Evan Brogdon attempts a Midrange. Contested by Collin Barnes (5.1 feet, MAN). Evan Brogdon misses. Rebound secured by Ben Barrett.

[04:19] Team_016 possession (Score: 59-62)
Ben Barrett attempts a Layup. Contested by Anthony Haliburton (3.8 feet, ZONE). BEN BARRETT MAKES IT!
Score: 59-64

[04:08] Team_097 possession (Score: 59-64)
Tyrese Stewart attempts a Midrange. Contested by Collin Barnes (4.5 feet, ZONE). Tyrese Stewart misses. Offensive rebound by Tyrese Stewart! Tyrese Stewart kicks it out.

[03:53] Team_097 possession (Score: 59-64)
FOUL! Offensive foul on Shai Poole! Vince Quickley drew the charge! [Team fouls: 4] (Shai Poole: 1 personal fouls) TURNOVER! (dead ball)

[03:39] Team_016 possession (Score: 59-64)
Collin Barnes commits a violation (traveling/carry)! TURNOVER! (dead ball)

[03:28] Team_097 possession (Score: 59-64)
Shai Poole attempts a 3Pt. Heavily contested by Collin Barnes (0.6 feet, ZONE)! Shai Poole misses. Rebound secured by Vince Quickley.

[03:11] Team_016 possession (Score: 59-64)
Vince Duncan drives and kicks out. Giannis Ginobili attempts a Midrange. Contested by Tyrese Stewart (4.9 feet, ZONE). GIANNIS GINOBILI MAKES IT!
Score: 59-66

[03:00] Team_097 possession (Score: 59-66)
Evan Brogdon attempts a 3Pt. Contested by Collin Barnes (5.5 feet, ZONE). Evan Brogdon misses. Offensive rebound by Tyrese Stewart! Tyrese Stewart kicks it out.

[02:42] Team_097 possession (Score: 59-66)
Jrue Haliburton attempts a Layup. BLOCKED BY BEN BARRETT! Ball is loose! Rebound secured by Vince Quickley.

[02:27] Team_016 possession (Score: 59-66)
Giannis Ginobili attempts a Midrange. Wide open! Jrue Haliburton is 8.8 feet away. [ZONE] GIANNIS GINOBILI MAKES IT! Assist: Vince Duncan
Score: 59-68

[02:13] Team_097 possession (Score: 59-68)
Evan Brogdon drives, Collin Barnes stays with him. Evan Brogdon attempts a Layup. Contested by Collin Barnes (5.5 feet, MAN). EVAN BROGDON MAKES IT! Assist: Jrue Haliburton
Score: 61-68

[01:59] Team_016 possession (Score: 61-68)
Ben Barrett attempts a Midrange. Contested by Anthony Haliburton (3.2 feet, MAN). Ben Barrett misses. Rebound secured by Shai Poole.

[01:45] Team_097 possession (Score: 61-68)
Shai Poole attempts a Midrange. Contested by Vince Quickley (3.5 feet, MAN). Shai Poole misses. Rebound secured by Vince Duncan.

[01:29] Team_016 possession (Score: 61-68)
Collin Barnes drives and kicks out. Giannis Ginobili attempts a 3Pt. Wide open! Jrue Haliburton is 7.1 feet away. [MAN] Giannis Ginobili misses. Rebound secured by Anthony Haliburton.

[01:19] Team_097 possession (Score: 61-68)
Shai Poole attempts a 3Pt. Contested by Collin Barnes (5.3 feet, ZONE). SHAI POOLE MAKES IT!
Score: 64-68

[01:02] Team_016 possession (Score: 64-68)
Ben Barrett attempts a Midrange. Heavily contested by Anthony Haliburton (0.5 feet, MAN)! BEN BARRETT MAKES IT! Assist: Vince Quickley
Score: 64-70

[00:49] Team_097 possession (Score: 64-70)
Shai Poole attempts a Layup. BLOCKED BY VINCE QUICKLEY! Ball deflects out of bounds off Shai Poole.

[00:34] Team_016 possession (Score: 64-70)
Ben Barrett attempts a Midrange. Wide open! Jrue Haliburton is 8.9 feet away. [ZONE] BEN BARRETT MAKES IT!
Score: 64-72

[00:18] Team_097 possession (Score: 64-72)
Anthony Haliburton attempts a Midrange. Wide open! Ben Barrett is 7.1 feet away. [MAN] ANTHONY HALIBURTON MAKES IT! Assist: Shai Poole
Score: 66-72

[00:02] Team_016 possession (Score: 66-72)
Vince Duncan makes the Layup and draws the foul on Jrue Haliburton! And-1! Vince Duncan to the line for 1. [BONUS: 5 team fouls] (Jrue Haliburton: 2 personal fouls)   FT 1/1: GOOD Vince Duncan makes 1/1 from the line.
Score: 66-75

================================================================================
                              3RD QUARTER COMPLETE                              
================================================================================

3RD QUARTER SCORE: Team_097 18, Team_016 29

BOX SCORE:
================================================================================

Team_097
--------------------------------------------------------------------------------
Player                MIN  PTS  REB  AST  TO      FG   FG%      3P   3P%
--------------------------------------------------------------------------------
Evan Brogdon           26    8    0    0   0   3/6    50.0     0/0   0.0
Shai Poole             26    6    2    1   0   2/7    28.6     0/0   0.0
Anthony Haliburton     26    2    3    1   0   1/2    50.0     0/0   0.0
Jrue Haliburton        26    0    0    1   0   0/5     0.0     0/0   0.0
Tyrese Stewart         26    0    5    1   0   0/1     0.0     0/0   0.0

TEAM: FG: 6/21 (28.6%), 3PT: 3/10 (30.0%), REB: 11 (5 off, 6 def), AST: 4, TO: 1
TEAM FOULS: 5 [Team_016 in BONUS]


Team_016
--------------------------------------------------------------------------------
Player                MIN  PTS  REB  AST  TO      FG   FG%      3P   3P%
--------------------------------------------------------------------------------
Ben Barrett            26   17    8    0   0   8/9    88.9     0/0   0.0
Vince Duncan           26    8    4    2   0   3/3   100.0     0/0   0.0
Giannis Ginobili       26    4    0    1   0   2/3    66.7     0/0   0.0
Vince Quickley         26    0    5    2   0   0/2     0.0     0/0   0.0
Collin Barnes          26    0    0    0   0   0/2     0.0     0/0   0.0

TEAM: FG: 13/19 (68.4%), 3PT: 0/1 (0.0%), REB: 16 (3 off, 13 def), AST: 5, TO: 3
TEAM FOULS: 3

================================================================================

================================================================================
                       4TH QUARTER - Team_097 vs Team_016                       
================================================================================

[12:00] Team_097 possession (Score: 66-75)
Evan Brogdon attempts a 3Pt. Contested by Collin Barnes (3.5 feet, ZONE). Evan Brogdon misses. Offensive rebound by Tyrese Stewart! Tyrese Stewart kicks it out.

[11:44] Team_097 possession (Score: 66-75)
FOUL! Reach-in foul on Collin Barnes during the drive. [Team fouls: 1] No free throws, side out. (Collin Barnes: 1 personal fouls)

[11:30] Team_097 possession (Score: 66-75)
Jrue Haliburton attempts a 3Pt. Contested by Vince Quickley (4.2 feet, ZONE). Jrue Haliburton misses. Offensive rebound by Anthony Haliburton! Anthony Haliburton kicks it out.

[11:15] Team_097 possession (Score: 66-75)
Tyrese Stewart attempts a Midrange. Contested by Vince Duncan (5.1 feet, MAN). TYRESE STEWART MAKES IT! Assist: Evan Brogdon
Score: 68-75

[10:58] Team_016 possession (Score: 68-75)
Giannis Ginobili attempts a Midrange. Wide open! Jrue Haliburton is 6.7 feet away. [MAN] Giannis Ginobili misses. Rebound secured by Shai Poole.

[10:45] Team_097 possession (Score: 68-75)
Jrue Haliburton drives to the basket... Jrue Haliburton throws a bad pass! Stolen by Giannis Ginobili! TURNOVER! (live ball)

[10:28] Team_016 possession (Score: 68-75)
Vince Duncan throws a bad pass out of bounds! TURNOVER! (dead ball)

[10:28] Substitution (Team_097): Evan Brogdon OUT → Gary Carter IN (stamina_rule2)

[10:28] Substitution (Team_097): Jrue Haliburton OUT → Dwyane Ginobili IN (stamina_rule2)

[10:28] Substitution (Team_097): Shai Poole OUT → Miles Dosunmu IN (stamina_rule2)

[10:28] Substitution (Team_097): Anthony Haliburton OUT → Joel Simons IN (stamina_rule2)

[10:28] Substitution (Team_097): Tyrese Stewart OUT → Miles Banchero IN (stamina_rule2)

[10:28] Substitution (Team_016): Collin Barnes OUT → Lamelo Herro IN (stamina_rule2)

[10:28] Substitution (Team_016): Giannis Ginobili OUT → Immanuel Nowitzki IN (stamina_rule2)

[10:28] Substitution (Team_016): Vince Quickley OUT → Kevin Butler IN (stamina_rule2)

[10:28] Substitution (Team_016): Ben Barrett OUT → Giannis Doncic IN (stamina_rule2)

[10:28] Substitution (Team_016): Vince Duncan OUT → Trae Barnes IN (stamina_rule2)

[10:13] Team_097 possession (Score: 68-75)
Miles Dosunmu attempts a 3Pt. Heavily contested by Lamelo Herro (1.5 feet, ZONE)! Miles Dosunmu misses. Rebound secured by Lamelo Herro.

[09:56] Team_016 possession (Score: 68-75)
Immanuel Nowitzki attempts a 3Pt. Wide open! Joel Simons is 6.8 feet away. [ZONE] Immanuel Nowitzki misses. Rebound secured by Joel Simons.

[09:44] Team_097 possession (Score: 68-75)
Joel Simons makes the Layup and draws the foul on Giannis Doncic! And-1! Joel Simons to the line for 1. [Team fouls: 2] (Giannis Doncic: 1 personal fouls)   FT 1/1: GOOD Joel Simons makes 1/1 from the line.
Score: 71-75

[09:31] Team_016 possession (Score: 71-75)
Immanuel Nowitzki attempts a 3Pt. Contested by Joel Simons (6.0 feet, ZONE). IMMANUEL NOWITZKI MAKES IT! Assist: Giannis Doncic
Score: 71-78

[09:17] Team_097 possession (Score: 71-78)
Miles Dosunmu attempts a Layup. Heavily contested by Giannis Doncic (0.5 feet, ZONE)! Miles Dosunmu misses. Offensive rebound by Miles Dosunmu! Miles Dosunmu kicks it out.

[09:01] Team_097 possession (Score: 71-78)
Joel Simons attempts a 3Pt. Contested by Giannis Doncic (5.8 feet, MAN). Joel Simons misses. Rebound secured by Giannis Doncic.

[08:48] Team_016 possession (Score: 71-78)
Kevin Butler loses the ball! Stripped by Miles Dosunmu! TURNOVER! (live ball)

[08:34] Team_097 possession (Score: 71-78)
Joel Simons attempts a Layup. BLOCKED BY GIANNIS DONCIC! Ball is loose! Offensive rebound by Joel Simons! Joel Simons kicks it out.

[08:20] Team_097 possession (Score: 71-78)
Miles Banchero attempts a Midrange. Wide open! Trae Barnes is 8.4 feet away. [MAN] MILES BANCHERO MAKES IT!
Score: 73-78

[08:06] Team_016 possession (Score: 73-78)
Kevin Butler attempts a 3Pt. Heavily contested by Joel Simons (0.5 feet, ZONE)! Kevin Butler misses. Rebound secured by Miles Dosunmu.

[07:52] Team_097 possession (Score: 73-78)
Miles Dosunmu attempts a Layup. BLOCKED BY GIANNIS DONCIC! Ball is loose! Rebound secured by Trae Barnes.

[07:40] Team_016 possession (Score: 73-78)
Giannis Doncic attempts a 3Pt. Contested by Joel Simons (3.3 feet, MAN). Giannis Doncic misses. Rebound secured by Miles Dosunmu.

[07:25] Team_097 possession (Score: 73-78)
Dwyane Ginobili attempts a 3Pt. Heavily contested by Lamelo Herro (0.6 feet, ZONE)! Dwyane Ginobili misses. Rebound secured by Giannis Doncic.

[07:08] Team_016 possession (Score: 73-78)
Immanuel Nowitzki drives and kicks out. Immanuel Nowitzki attempts a 3Pt. Contested by Miles Dosunmu (4.9 feet, ZONE). Immanuel Nowitzki misses. Rebound secured by Miles Dosunmu.

[06:53] Team_097 possession (Score: 73-78)
Dwyane Ginobili attempts a Layup. BLOCKED BY IMMANUEL NOWITZKI! Ball is loose! Rebound secured by Giannis Doncic.

[06:37] Team_016 possession (Score: 73-78)
Lamelo Herro attempts a 3Pt. Contested by Joel Simons (4.5 feet, ZONE). Lamelo Herro misses. Rebound secured by Joel Simons.

[06:19] Team_097 possession (Score: 73-78)
Miles Dosunmu attempts a 3Pt. Heavily contested by Lamelo Herro (1.2 feet, ZONE)! Miles Dosunmu misses. Rebound secured by Giannis Doncic.

[06:02] Team_016 possession (Score: 73-78)
Lamelo Herro attempts a 3Pt. Contested by Joel Simons (2.7 feet, ZONE). Lamelo Herro misses. Rebound secured by Miles Dosunmu.

[05:48] Team_097 possession (Score: 73-78)
Dwyane Ginobili attempts a Midrange. Contested by Immanuel Nowitzki (3.9 feet, MAN). Dwyane Ginobili misses. Rebound secured by Lamelo Herro.

[05:36] Team_016 possession (Score: 73-78)
Trae Barnes attempts a Layup. Contested by Joel Simons (4.1 feet, ZONE). Trae Barnes misses. Rebound secured by Miles Banchero.

[05:20] Team_097 possession (Score: 73-78)
Miles Banchero attempts a 3Pt. Contested by Lamelo Herro (4.0 feet, ZONE). Miles Banchero misses. Rebound secured by Giannis Doncic.

[05:09] Team_016 possession (Score: 73-78)
Kevin Butler makes the Layup and draws the foul on Joel Simons! And-1! Kevin Butler to the line for 1. [Team fouls: 1] (Joel Simons: 1 personal fouls)   FT 1/1: GOOD Kevin Butler makes 1/1 from the line.
Score: 73-81

[04:56] Team_097 possession (Score: 73-81)
Miles Dosunmu attempts a 3Pt. Wide open! Lamelo Herro is 6.6 feet away. [ZONE] Miles Dosunmu misses. Offensive rebound by Joel Simons! Joel Simons kicks it out.

[04:43] Team_097 possession (Score: 73-81)
Miles Banchero makes the Dunk and draws the foul on Trae Barnes! And-1! Miles Banchero to the line for 1. [Team fouls: 3] (Trae Barnes: 1 personal fouls)   FT 1/1: MISS Miles Banchero makes 0/1 from the line. Rebound secured by Giannis Doncic.
Score: 75-81

[04:25] Team_016 possession (Score: 75-81)
Trae Barnes drives, picks up Joel Simons. Help arrives from Dwyane Ginobili! Trae Barnes attempts a Dunk. Wide open! Dwyane Ginobili is 6.0 feet away. [MAN] TRAE BARNES MAKES IT! Assist: Immanuel Nowitzki
Score: 75-83

[04:05] Team_097 possession (Score: 75-83)
Joel Simons drives, Giannis Doncic stays with him. Joel Simons attempts a Layup. Contested by Giannis Doncic (4.2 feet, MAN). JOEL SIMONS MAKES IT! Assist: Gary Carter
Score: 77-83

[03:48] Team_016 possession (Score: 77-83)
FOUL! Holding foul on Gary Carter. [Team fouls: 2] No free throws, side out. (Gary Carter: 1 personal fouls)

[03:33] Team_016 possession (Score: 77-83)
Immanuel Nowitzki attempts a 3Pt. Wide open! Dwyane Ginobili is 6.5 feet away. [MAN] IMMANUEL NOWITZKI MAKES IT! Assist: Giannis Doncic
Score: 77-86

[03:19] Team_097 possession (Score: 77-86)
Gary Carter drives and kicks out. Gary Carter attempts a 3Pt. Contested by Lamelo Herro (2.2 feet, ZONE). Gary Carter misses. Rebound secured by Giannis Doncic.

[03:06] Team_016 possession (Score: 77-86)
Giannis Doncic attempts a 3Pt. Heavily contested by Joel Simons (1.9 feet, ZONE)! GIANNIS DONCIC MAKES IT! Assist: Immanuel Nowitzki
Score: 77-89

[02:49] Team_097 possession (Score: 77-89)
Miles Banchero drives, Trae Barnes stays with him. Miles Banchero attempts a Layup. Wide open! Trae Barnes is 8.9 feet away. [MAN] MILES BANCHERO MAKES IT! Assist: Dwyane Ginobili
Score: 79-89

[02:34] Team_016 possession (Score: 79-89)
Kevin Butler makes the Layup and draws the foul on Miles Dosunmu! And-1! Kevin Butler to the line for 1. [Team fouls: 3] (Miles Dosunmu: 1 personal fouls)   FT 1/1: MISS Kevin Butler makes 0/1 from the line. Rebound secured by Joel Simons.
Score: 79-91

[02:20] Team_097 possession (Score: 79-91)
Gary Carter throws a bad pass! Stolen by Lamelo Herro! TURNOVER! (live ball)

[02:06] Team_016 possession (Score: 79-91)
Trae Barnes attempts a 3Pt. Contested by Joel Simons (3.3 feet, ZONE). Trae Barnes misses. FOUL! Loose ball foul on Miles Banchero during the rebound battle. [Team fouls: 4] No free throws, side out. (Miles Banchero: 1 personal fouls)

[01:52] Team_016 possession (Score: 79-91)
Trae Barnes makes the Midrange and draws the foul on Dwyane Ginobili! And-1! Trae Barnes to the line for 1. [BONUS: 5 team fouls] (Dwyane Ginobili: 1 personal fouls)   FT 1/1: GOOD Trae Barnes makes 1/1 from the line.
Score: 79-94

[01:32] Team_097 possession (Score: 79-94)
Miles Dosunmu attempts a Midrange. Contested by Kevin Butler (3.1 feet, ZONE). MILES DOSUNMU MAKES IT! Assist: Miles Banchero
Score: 81-94

[01:16] Team_016 possession (Score: 81-94)
Lamelo Herro attempts a 3Pt. Contested by Gary Carter (4.7 feet, MAN). Lamelo Herro misses. Rebound secured by Miles Banchero.

[01:00] Team_097 possession (Score: 81-94)
Miles Dosunmu drives to the basket... FOUL! Offensive foul on Miles Dosunmu! Giannis Doncic drew the charge! [Team fouls: 6] (Miles Dosunmu: 2 personal fouls) TURNOVER! (dead ball)

[00:46] Team_016 possession (Score: 81-94)
Lamelo Herro drives and kicks out. Kevin Butler attempts a 3Pt. Contested by Miles Dosunmu (4.4 feet, MAN). Kevin Butler misses. Rebound secured by Miles Dosunmu.

[00:35] Team_097 possession (Score: 81-94)
Miles Dosunmu attempts a Midrange. Contested by Kevin Butler (4.2 feet, ZONE). MILES DOSUNMU MAKES IT!
Score: 83-94

[00:23] Team_016 possession (Score: 83-94)
Kevin Butler attempts a Midrange. Contested by Joel Simons (3.3 feet, ZONE). Kevin Butler misses. Rebound secured by Miles Banchero.

[00:08] Team_097 possession (Score: 83-94)
Miles Banchero attempts a Midrange. Wide open! Trae Barnes is 7.0 feet away. [MAN] Miles Banchero misses. Rebound secured by Lamelo Herro.

================================================================================
                              4TH QUARTER COMPLETE                              
================================================================================

4TH QUARTER SCORE: Team_097 17, Team_016 19

BOX SCORE:
================================================================================

Team_097
--------------------------------------------------------------------------------
Player                MIN  PTS  REB  AST  TO      FG   FG%      3P   3P%
--------------------------------------------------------------------------------
Joel Simons            21    5    5    0   0   2/3    66.7     0/0   0.0
Miles Dosunmu          21    4    6    0   0   2/5    40.0     0/0   0.0
Miles Banchero         21    4    3    1   0   2/5    40.0     0/0   0.0
Tyrese Stewart         27    2    1    0   0   1/1   100.0     0/0   0.0
Anthony Haliburton     27    0    1    0   0   0/0     0.0     0/0   0.0
Evan Brogdon           27    0    0    1   0   0/0     0.0     0/0   0.0
Shai Poole             27    0    1    0   0   0/0     0.0     0/0   0.0
Dwyane Ginobili        21    0    0    1   0   0/3     0.0     0/0   0.0
Gary Carter            21    0    0    1   0   0/1     0.0     0/0   0.0

TEAM: FG: 7/18 (38.9%), 3PT: 0/5 (0.0%), REB: 17 (5 off, 12 def), AST: 4, TO: 3
TEAM FOULS: 6 [Team_016 in BONUS]


Team_016
--------------------------------------------------------------------------------
Player                MIN  PTS  REB  AST  TO      FG   FG%      3P   3P%
--------------------------------------------------------------------------------
Immanuel Nowitzki      21    6    0    2   0   2/4    50.0     0/0   0.0
Trae Barnes            21    5    1    0   0   2/3    66.7     0/0   0.0
Giannis Doncic         21    3    8    2   0   1/2    50.0     0/0   0.0
Kevin Butler           21    3    0    0   0   1/4    25.0     0/0   0.0
Giannis Ginobili       27    0    0    0   0   0/1     0.0     0/0   0.0
Lamelo Herro           21    0    3    0   0   0/4     0.0     0/0   0.0

TEAM: FG: 6/18 (33.3%), 3PT: 3/9 (33.3%), REB: 12 (1 off, 11 def), AST: 4, TO: 2
TEAM FOULS: 3

================================================================================

================================================================================
                               FULL GAME COMPLETE                               
================================================================================

FINAL SCORE: Team_097 83, Team_016 94

SCORING BY QUARTER:
--------------------------------------------------------------------------------
Team                     Q1     Q2     Q3     Q4    FINAL
--------------------------------------------------------------------------------
Team_097                 25     23     18     17       83
Team_016                 24     22     29     19       94
--------------------------------------------------------------------------------

FULL GAME BOX SCORE:
================================================================================

Team_097
--------------------------------------------------------------------------------
Player                MIN  PTS  REB  AST  TO      FG   FG%      3P   3P%      FT STL BLK
--------------------------------------------------------------------------------
Evan Brogdon           27   15    0    1   1   6/13   46.2   2/5    40.0   1/1     0   0
Jrue Haliburton        27    5    0    1   1   2/9    22.2   1/4    25.0   0/1     0   0
Shai Poole             27   13    6    2   1   5/12   41.7   3/7    42.9   0/0     0   2
Anthony Haliburton     27    4   10    4   1   2/7    28.6   0/3     0.0   0/1     1   0
Tyrese Stewart         27    2   12    2   2   1/4    25.0   0/1     0.0   0/1     0   0
Gary Carter            21    3    0    3   4   2/3    66.7   1/1   100.0   0/0     0   0
Dwyane Ginobili        21    6    0    1   1   3/8    37.5   0/1     0.0   0/0     0   0
Miles Dosunmu          21   10   14    1   1   4/7    57.1   2/4    50.0   0/0     1   0
Joel Simons            21   11    6    0   0   3/7    42.9   0/1     0.0   3/3     0   0
Miles Banchero         21    6    6    3   0   3/8    37.5   0/2     0.0   0/1     0   0

TEAM: FG: 31/78 (39.7%), 3PT: 9/29 (31.0%), REB: 54 (13 off, 41 def), AST: 18, TO: 12


Team_016
--------------------------------------------------------------------------------
Player                MIN  PTS  REB  AST  TO      FG   FG%      3P   3P%      FT STL BLK
--------------------------------------------------------------------------------
Collin Barnes          27    9    0    1   1   5/9    55.6   0/2     0.0   3/3     0   0
Giannis Ginobili       27    6    0    2   1   3/9    33.3   1/4    25.0   0/0     2   1
Vince Quickley         27    5   10    3   1   2/8    25.0   1/3    33.3   3/5     0   1
Ben Barrett            27   24   13    0   2   9/11   81.8   1/2    50.0   1/1     1   3
Vince Duncan           27   10   10    5   1   5/7    71.4   0/0     0.0   2/2     1   1
Lamelo Herro           21    6    5    1   0   2/6    33.3   2/5    40.0   0/0     2   0
Immanuel Nowitzki      21   11    0    2   1   3/7    42.9   2/4    50.0   0/0     1   1
Kevin Butler           21    6    0    3   1   2/8    25.0   1/2    50.0   1/3     0   0
Giannis Doncic         21    3   11    3   0   1/3    33.3   1/2    50.0   0/0     0   2
Trae Barnes            21    9    5    0   0   5/11   45.5   0/1     0.0   1/1     0   0

TEAM: FG: 37/79 (46.8%), 3PT: 9/25 (36.0%), REB: 54 (10 off, 44 def), AST: 20, TO: 8

================================================================================
