================================================================================
                        FULL GAME - Team_071 vs Team_090                        
================================================================================

================================================================================
                       1ST QUARTER - Team_071 vs Team_090                       
================================================================================

[12:00] Team_071 possession (Score: 0-0)
FOUL! Holding foul on Zach Wall. [Team fouls: 1] No free throws, side out. (Zach Wall: 1 personal fouls)

[11:46] Team_071 possession (Score: 0-0)
Bam Iverson drives, picks up Tracy Adebayo. Help arrives from Larry Bridges! Bam Iverson attempts a Dunk. Contested by Larry Bridges (5.0 feet, ZONE). Bam Iverson misses. Rebound secured by Zach Wall.

[11:35] Team_090 possession (Score: 0-0)
FOUL! Reach-in foul on Dejounte Paul during the drive. [Team fouls: 1] No free throws, side out. (Dejounte Paul: 1 personal fouls)

[11:25] Team_090 possession (Score: 0-0)
Zach Wall attempts a 3Pt. Contested by Bam Iverson (5.0 feet, MAN). Zach Wall misses. Rebound secured by Jimmy Simons.

[11:09] Team_071 possession (Score: 0-0)
Jimmy Simons attempts a Midrange. Contested by Zach Wall (4.5 feet, ZONE). JIMMY SIMONS MAKES IT!
Score: 2-0

[10:55] Team_090 possession (Score: 2-0)
Larry Bridges commits a violation (traveling/carry)! TURNOVER! (dead ball)

[10:42] Team_071 possession (Score: 2-0)
FOUL! Shooting foul on Larry Bridges. Victor Anunoby to the line for 2 free throws. [Team fouls: 2] (Larry Bridges: 1 personal fouls)   FT 1/2: MISS   FT 2/2: GOOD Victor Anunoby makes 1/2 from the line.
Score: 3-0

[10:25] Team_090 possession (Score: 3-0)
FOUL! Shooting foul on Dejounte Paul. Tracy Adebayo to the line for 2 free throws. [Team fouls: 2] (Dejounte Paul: 2 personal fouls)   FT 1/2: MISS   FT 2/2: GOOD Tracy Adebayo makes 1/2 from the line.
Score: 3-1

[10:14] Team_071 possession (Score: 3-1)
Bam Iverson drives, Zach Wall stays with him. Bam Iverson attempts a Layup. Contested by Zach Wall (5.3 feet, MAN). Bam Iverson misses. Rebound secured by Gary Brogdon.

[10:03] Team_090 possession (Score: 3-1)
Zach Wall attempts a 3Pt. Contested by Victor Anunoby (2.6 feet, ZONE). Zach Wall misses. Rebound secured by Jimmy Simons.

[09:52] Team_071 possession (Score: 3-1)
Dejounte Paul attempts a 3Pt. Contested by Tracy Adebayo (4.5 feet, MAN). Dejounte Paul misses. Rebound secured by Zach Wall.

[09:40] Team_090 possession (Score: 3-1)
Zach Wall attempts a 3Pt. Heavily contested by Victor Anunoby (1.8 feet, ZONE)! ZACH WALL MAKES IT!
Score: 3-4

[09:28] Team_071 possession (Score: 3-4)
Bam Iverson attempts a 3Pt. Contested by Zach Wall (5.9 feet, MAN). Bam Iverson misses. Rebound secured by Zach Wall.

[09:14] Team_090 possession (Score: 3-4)
Zach Wall attempts a 3Pt. Contested by Bam Iverson (3.5 feet, MAN). Zach Wall misses. Rebound secured by Dejounte Paul.

[08:56] Team_071 possession (Score: 3-4)
Jimmy Simons drives and kicks out. Jimmy Simons attempts a 3Pt. Contested by Gary Brogdon (5.6 feet, MAN). Jimmy Simons misses. Offensive rebound by Jimmy Simons! Jimmy Simons kicks it out.

[08:46] Team_071 possession (Score: 3-4)
FOUL! Reach-in foul on Tracy Adebayo during the drive. [Team fouls: 3] No free throws, side out. (Tracy Adebayo: 1 personal fouls)

[08:35] Team_071 possession (Score: 3-4)
Jimmy Simons attempts a 3Pt. Contested by Larry Bridges (2.1 feet, ZONE). JIMMY SIMONS MAKES IT! Assist: Allen Williamson
Score: 6-4

[08:20] Team_090 possession (Score: 6-4)
Gary Brogdon attempts a Layup. BLOCKED BY DEJOUNTE PAUL! Ball is loose! Offensive rebound by Tracy Adebayo! Tracy Adebayo kicks it out.

[08:08] Team_090 possession (Score: 6-4)
Tracy Adebayo attempts a Midrange. Contested by Jimmy Simons (4.5 feet, ZONE). TRACY ADEBAYO MAKES IT!
Score: 6-6

[07:48] Team_071 possession (Score: 6-6)
Jimmy Simons attempts a 3Pt. Contested by Derrick Mitchell (3.9 feet, ZONE). JIMMY SIMONS MAKES IT! Assist: Bam Iverson
Score: 9-6

[07:38] Team_090 possession (Score: 9-6)
FOUL! Reach-in foul on Dejounte Paul during the drive. [Team fouls: 3] No free throws, side out. (Dejounte Paul: 3 personal fouls)

[07:27] Team_090 possession (Score: 9-6)
Gary Brogdon makes the Layup and draws the foul on Dejounte Paul! And-1! Gary Brogdon to the line for 1. [Team fouls: 4] (Dejounte Paul: 4 personal fouls)   FT 1/1: GOOD Gary Brogdon makes 1/1 from the line.
Score: 9-9

[07:16] Team_071 possession (Score: 9-9)
Bam Iverson attempts a Midrange. Wide open! Gary Brogdon is 6.3 feet away. [ZONE] Bam Iverson misses. Offensive rebound by Jimmy Simons! Jimmy Simons kicks it out.

[07:05] Team_071 possession (Score: 9-9)
Bam Iverson attempts a 3Pt. Contested by Derrick Mitchell (5.9 feet, ZONE). Bam Iverson misses. Rebound secured by Tracy Adebayo.

[06:47] Team_090 possession (Score: 9-9)
Zach Wall attempts a Layup. BLOCKED BY BAM IVERSON! Ball goes out off Bam Iverson. Zach Wall's ball!

[06:33] Team_090 possession (Score: 9-9)
Tracy Adebayo drives and kicks out. Larry Bridges attempts a Midrange. Contested by Bam Iverson (3.1 feet, ZONE). Larry Bridges misses. Rebound secured by Bam Iverson.

[06:19] Team_071 possession (Score: 9-9)
Victor Anunoby makes the Dunk and draws the foul on Larry Bridges! And-1! Victor Anunoby to the line for 1. [Team fouls: 4] (Larry Bridges: 2 personal fouls)   FT 1/1: GOOD Victor Anunoby makes 1/1 from the line.
Score: 12-9

[06:01] Team_090 possession (Score: 12-9)
Larry Bridges attempts a 3Pt. Contested by Victor Anunoby (4.5 feet, ZONE). Larry Bridges misses. Rebound secured by Dejounte Paul.

[05:48] Team_071 possession (Score: 12-9)
Bam Iverson attempts a Midrange. Contested by Zach Wall (2.8 feet, MAN). BAM IVERSON MAKES IT! Assist: Allen Williamson
Score: 14-9

[05:31] Team_090 possession (Score: 14-9)
Larry Bridges attempts a 3Pt. Contested by Victor Anunoby (3.3 feet, ZONE). Larry Bridges misses. Rebound secured by Bam Iverson.

[05:12] Team_071 possession (Score: 14-9)
Jimmy Simons drives and kicks out. Allen Williamson attempts a 3Pt. Contested by Derrick Mitchell (2.8 feet, ZONE). ALLEN WILLIAMSON MAKES IT! Assist: Victor Anunoby
Score: 17-9

[04:58] Team_090 possession (Score: 17-9)
Gary Brogdon drives and kicks out. Gary Brogdon attempts a Midrange. Contested by Victor Anunoby (4.3 feet, ZONE). GARY BROGDON MAKES IT! Assist: Zach Wall
Score: 17-11

[04:42] Team_071 possession (Score: 17-11)
Bam Iverson attempts a 3Pt. Contested by Derrick Mitchell (3.8 feet, ZONE). BAM IVERSON MAKES IT!
Score: 20-11

[04:29] Team_090 possession (Score: 20-11)
Larry Bridges attempts a 3Pt. Contested by Victor Anunoby (5.5 feet, MAN). Larry Bridges misses. Offensive rebound by Zach Wall! Zach Wall kicks it out.

[04:14] Team_090 possession (Score: 20-11)
Derrick Mitchell attempts a Midrange. Contested by Jimmy Simons (2.6 feet, ZONE). DERRICK MITCHELL MAKES IT! Assist: Gary Brogdon
Score: 20-13

[04:00] Team_071 possession (Score: 20-13)
Bam Iverson attempts a Layup. BLOCKED BY GARY BROGDON! Ball goes out off Gary Brogdon. Bam Iverson's ball!

[03:44] Team_071 possession (Score: 20-13)
Bam Iverson drives, Gary Brogdon stays with him. Bam Iverson attempts a Dunk. Heavily contested by Gary Brogdon (2.0 feet, ZONE)! BAM IVERSON MAKES IT! Assist: Dejounte Paul
Score: 22-13

[03:30] Team_090 possession (Score: 22-13)
Zach Wall throws a bad pass! Stolen by Bam Iverson! TURNOVER! (live ball)

[03:15] Team_071 possession (Score: 22-13)
Dejounte Paul attempts a Layup. Wide open! Tracy Adebayo is 6.8 feet away. [MAN] Dejounte Paul misses. Rebound secured by Zach Wall.

[03:02] Team_090 possession (Score: 22-13)
Tracy Adebayo attempts a Midrange. Heavily contested by Jimmy Simons (1.9 feet, ZONE)! Tracy Adebayo misses. Rebound secured by Dejounte Paul.

[02:47] Team_071 possession (Score: 22-13)
Jimmy Simons drives, picks up Gary Brogdon. Help arrives from Larry Bridges! Jimmy Simons attempts a Layup. Contested by Larry Bridges (3.5 feet, ZONE). Jimmy Simons misses. Rebound secured by Zach Wall.

[02:35] Team_090 possession (Score: 22-13)
Larry Bridges attempts a 3Pt. Contested by Victor Anunoby (4.9 feet, ZONE). Larry Bridges misses. Rebound secured by Bam Iverson.

[02:21] Team_071 possession (Score: 22-13)
Bam Iverson attempts a 3Pt. Contested by Derrick Mitchell (2.9 feet, ZONE). BAM IVERSON MAKES IT!
Score: 25-13

[02:06] Team_090 possession (Score: 25-13)
FOUL! Shooting foul on Dejounte Paul. Tracy Adebayo to the line for 2 free throws. [BONUS: 5 team fouls] (Dejounte Paul: 5 personal fouls)   FT 1/2: MISS   FT 2/2: GOOD Tracy Adebayo makes 1/2 from the line.
Score: 25-14

[01:53] Team_071 possession (Score: 25-14)
Allen Williamson drives, Derrick Mitchell stays with him. Allen Williamson attempts a Layup. Wide open! Derrick Mitchell is 6.1 feet away. [MAN] Allen Williamson misses. Offensive rebound by Dejounte Paul! Dejounte Paul kicks it out.

[01:39] Team_071 possession (Score: 25-14)
Bam Iverson attempts a 3Pt. Contested by Zach Wall (4.4 feet, MAN). BAM IVERSON MAKES IT! Assist: Victor Anunoby
Score: 28-14

[01:29] Team_090 possession (Score: 28-14)
Larry Bridges throws a bad pass out of bounds! TURNOVER! (dead ball)

[01:29] Substitution (Team_071): Allen Williamson OUT → Evan Sexton IN (stamina_rule2)

[01:29] Substitution (Team_071): Victor Anunoby OUT → Paul Ball IN (stamina_rule2)

[01:29] Substitution (Team_071): Bam Iverson OUT → Immanuel Ginobili IN (stamina_rule2)

[01:29] Substitution (Team_071): Jimmy Simons OUT → Jordan Durant IN (stamina_rule2)

[01:29] Substitution (Team_071): Dejounte Paul OUT → Tyrese Brogdon IN (stamina_rule2)

[01:29] Substitution (Team_090): Derrick Mitchell OUT → OG Anunoby IN (stamina_rule2)

[01:29] Substitution (Team_090): Larry Bridges OUT → Josh Wall IN (stamina_rule2)

[01:29] Substitution (Team_090): Zach Wall OUT → Russell Smith IN (stamina_rule2)

[01:29] Substitution (Team_090): Gary Brogdon OUT → Derrick Nowitzki IN (stamina_rule2)

[01:29] Substitution (Team_090): Tracy Adebayo OUT → Tobias Tatum IN (stamina_rule2)

[01:12] Team_071 possession (Score: 28-14)
Immanuel Ginobili attempts a 3Pt. Contested by Russell Smith (3.9 feet, MAN). Immanuel Ginobili misses. Rebound secured by Russell Smith.

[00:53] Team_090 possession (Score: 28-14)
Josh Wall drives and kicks out. Derrick Nowitzki attempts a Midrange. Wide open! Jordan Durant is 6.1 feet away. [MAN] DERRICK NOWITZKI MAKES IT! Assist: Tobias Tatum
Score: 28-16

[00:38] Team_071 possession (Score: 28-16)
Jordan Durant makes the Dunk and draws the foul on Josh Wall! And-1! Jordan Durant to the line for 1. [BONUS: 5 team fouls] (Josh Wall: 1 personal fouls)   FT 1/1: GOOD Jordan Durant makes 1/1 from the line.
Score: 31-16

[00:22] Team_090 possession (Score: 31-16)
Josh Wall makes the Dunk and draws the foul on Tyrese Brogdon! And-1! Josh Wall to the line for 1. [BONUS: 6 team fouls] (Tyrese Brogdon: 1 personal fouls)   FT 1/1: GOOD Josh Wall makes 1/1 from the line.
Score: 31-19

[00:10] Team_071 possession (Score: 31-19)
Jordan Durant drives and kicks out. Tyrese Brogdon attempts a 3Pt. Contested by Russell Smith (4.9 feet, ZONE). TYRESE BROGDON MAKES IT! Assist: Immanuel Ginobili
Score: 34-19

================================================================================
                              1ST QUARTER COMPLETE                              
================================================================================

1ST QUARTER SCORE: Team_071 34, Team_090 19

BOX SCORE:
================================================================================

Team_071
--------------------------------------------------------------------------------
Player                MIN  PTS  REB  AST  TO      FG   FG%      3P   3P%
--------------------------------------------------------------------------------
Bam Iverson            11   13    3    1   0   5/9    55.6     0/0   0.0
Jimmy Simons           11    8    4    0   0   3/4    75.0     0/0   0.0
Victor Anunoby         11    4    0    2   0   2/2   100.0     0/0   0.0
Allen Williamson       11    3    0    2   0   1/1   100.0     0/0   0.0
Jordan Durant           1    3    0    0   0   1/1   100.0     0/0   0.0
Tyrese Brogdon          1    3    0    0   0   1/1   100.0     0/0   0.0
Dejounte Paul          11    0    4    1   0   0/2     0.0     0/0   0.0
Immanuel Ginobili       1    0    0    1   0   0/1     0.0     0/0   0.0

TEAM: FG: 13/21 (61.9%), 3PT: 5/9 (55.6%), REB: 11 (3 off, 8 def), AST: 7, TO: 0
TEAM FOULS: 6 [Team_090 in BONUS]


Team_090
--------------------------------------------------------------------------------
Player                MIN  PTS  REB  AST  TO      FG   FG%      3P   3P%
--------------------------------------------------------------------------------
Gary Brogdon           11    5    1    1   0   2/2   100.0     0/0   0.0
Tracy Adebayo          11    4    2    0   0   3/5    60.0     0/0   0.0
Zach Wall              11    3    6    1   0   1/4    25.0     0/0   0.0
Josh Wall               1    3    0    0   0   1/1   100.0     0/0   0.0
Derrick Mitchell       11    2    0    0   0   1/1   100.0     0/0   0.0
Derrick Nowitzki        1    2    0    0   0   1/1   100.0     0/0   0.0
Larry Bridges          11    0    0    0   0   0/3     0.0     0/0   0.0
Russell Smith           1    0    1    0   0   0/0     0.0     0/0   0.0
Tobias Tatum            1    0    0    1   0   0/0     0.0     0/0   0.0

TEAM: FG: 9/17 (52.9%), 3PT: 1/7 (14.3%), REB: 10 (2 off, 8 def), AST: 3, TO: 3
TEAM FOULS: 5 [Team_071 in BONUS]

================================================================================

================================================================================
                       2ND QUARTER - Team_071 vs Team_090                       
================================================================================

[12:00] Team_071 possession (Score: 34-19)
Victor Anunoby attempts a 3Pt. Wide open! Larry Bridges is 6.4 feet away. [MAN] VICTOR ANUNOBY MAKES IT! Assist: Jimmy Simons
Score: 37-19

[11:41] Team_090 possession (Score: 37-19)
FOUL! Reach-in foul on Bam Iverson during the drive. [Team fouls: 1] No free throws, side out. (Bam Iverson: 1 personal fouls)

[11:26] Team_090 possession (Score: 37-19)
Larry Bridges attempts a 3Pt. Contested by Victor Anunoby (5.5 feet, ZONE). Larry Bridges misses. Rebound secured by Jimmy Simons.

[11:09] Team_071 possession (Score: 37-19)
Victor Anunoby attempts a 3Pt. Contested by Larry Bridges (4.3 feet, MAN). Victor Anunoby misses. Rebound secured by Zach Wall.

[10:59] Team_090 possession (Score: 37-19)
Tracy Adebayo attempts a Layup. Wide open! Dejounte Paul is 6.7 feet away. [ZONE] Tracy Adebayo misses. Offensive rebound by Zach Wall! Zach Wall kicks it out.

[10:44] Team_090 possession (Score: 37-19)
FOUL! Shooting foul on Dejounte Paul. Larry Bridges to the line for 2 free throws. [Team fouls: 2] (Dejounte Paul: 1 personal fouls)   FT 1/2: GOOD   FT 2/2: GOOD Larry Bridges makes 2/2 from the line.
Score: 37-21

[10:31] Team_071 possession (Score: 37-21)
Jimmy Simons drives, Gary Brogdon stays with him. Jimmy Simons attempts a Layup. Contested by Gary Brogdon (5.2 feet, MAN). JIMMY SIMONS MAKES IT! Assist: Allen Williamson
Score: 39-21

[10:19] Team_090 possession (Score: 39-21)
Derrick Mitchell attempts a 3Pt. Heavily contested by Victor Anunoby (2.0 feet, ZONE)! DERRICK MITCHELL MAKES IT!
Score: 39-24

[10:07] Team_071 possession (Score: 39-24)
Dejounte Paul drives, Tracy Adebayo stays with him. Dejounte Paul attempts a Dunk. Contested by Tracy Adebayo (5.3 feet, MAN). Dejounte Paul misses. Rebound secured by Zach Wall.

[09:48] Team_090 possession (Score: 39-24)
Gary Brogdon drives, picks up Jimmy Simons. Help arrives from Allen Williamson! Gary Brogdon attempts a Dunk. Contested by Allen Williamson (4.2 feet, MAN). Gary Brogdon misses. Rebound secured by Dejounte Paul.

[09:29] Team_071 possession (Score: 39-24)
Victor Anunoby attempts a 3Pt. Contested by Larry Bridges (3.4 feet, MAN). Victor Anunoby misses. Rebound secured by Tracy Adebayo.

[09:12] Team_090 possession (Score: 39-24)
Derrick Mitchell drives and kicks out. Derrick Mitchell attempts a Midrange. Wide open! Allen Williamson is 6.4 feet away. [MAN] DERRICK MITCHELL MAKES IT! Assist: Tracy Adebayo
Score: 39-26

[08:58] Team_071 possession (Score: 39-26)
Dejounte Paul attempts a Layup. BLOCKED BY TRACY ADEBAYO! Ball goes out off Tracy Adebayo. Dejounte Paul's ball!

[08:45] Team_071 possession (Score: 39-26)
Bam Iverson drives and kicks out. Jimmy Simons attempts a 3Pt. Contested by Derrick Mitchell (4.3 feet, ZONE). Jimmy Simons misses. Rebound secured by Zach Wall.

[08:32] Team_090 possession (Score: 39-26)
FOUL! Shooting foul on Jimmy Simons. Tracy Adebayo to the line for 2 free throws. [Team fouls: 3] (Jimmy Simons: 1 personal fouls)   FT 1/2: GOOD   FT 2/2: GOOD Tracy Adebayo makes 2/2 from the line.
Score: 39-28

[08:15] Team_071 possession (Score: 39-28)
Dejounte Paul drives, Tracy Adebayo stays with him. Dejounte Paul attempts a Dunk. Wide open! Tracy Adebayo is 7.7 feet away. [MAN] Dejounte Paul misses. Rebound secured by Gary Brogdon.

[08:03] Team_090 possession (Score: 39-28)
Tracy Adebayo attempts a 3Pt. Wide open! Dejounte Paul is 7.0 feet away. [MAN] Tracy Adebayo misses. Rebound secured by Dejounte Paul.

[07:51] Team_071 possession (Score: 39-28)
Victor Anunoby attempts a 3Pt. Contested by Larry Bridges (5.8 feet, MAN). VICTOR ANUNOBY MAKES IT! Assist: Bam Iverson
Score: 42-28

[07:38] Team_090 possession (Score: 42-28)
Larry Bridges drives and kicks out. Zach Wall attempts a 3Pt. Wide open! Victor Anunoby is 6.6 feet away. [ZONE] ZACH WALL MAKES IT! Assist: Derrick Mitchell
Score: 42-31

[07:27] Team_071 possession (Score: 42-31)
Victor Anunoby attempts a 3Pt. Wide open! Derrick Mitchell is 7.0 feet away. [ZONE] Victor Anunoby misses. Rebound secured by Tracy Adebayo.

[07:11] Team_090 possession (Score: 42-31)
Larry Bridges attempts a 3Pt. Contested by Victor Anunoby (4.4 feet, MAN). Larry Bridges misses. Offensive rebound by Zach Wall! Zach Wall kicks it out.

[06:56] Team_090 possession (Score: 42-31)
Derrick Mitchell drives, Allen Williamson stays with him. Derrick Mitchell attempts a Layup. Contested by Allen Williamson (5.7 feet, MAN). Derrick Mitchell misses. Offensive rebound by Tracy Adebayo! Tracy Adebayo kicks it out.

[06:43] Team_090 possession (Score: 42-31)
Gary Brogdon attempts a Layup. Contested by Jimmy Simons (6.0 feet, MAN). GARY BROGDON MAKES IT!
Score: 42-33

[06:32] Team_071 possession (Score: 42-33)
Allen Williamson attempts a Midrange. Contested by Derrick Mitchell (5.9 feet, MAN). Allen Williamson misses. Rebound secured by Tracy Adebayo.

[06:20] Team_090 possession (Score: 42-33)
Derrick Mitchell attempts a Midrange. Wide open! Victor Anunoby is 6.8 feet away. [ZONE] Derrick Mitchell misses. Rebound secured by Bam Iverson.

[06:09] Team_071 possession (Score: 42-33)
Dejounte Paul drives and kicks out. Allen Williamson attempts a 3Pt. Contested by Derrick Mitchell (4.6 feet, MAN). ALLEN WILLIAMSON MAKES IT! Assist: Jimmy Simons
Score: 45-33

[05:52] Team_090 possession (Score: 45-33)
Larry Bridges makes the Layup and draws the foul on Victor Anunoby! And-1! Larry Bridges to the line for 1. [Team fouls: 4] (Victor Anunoby: 1 personal fouls)   FT 1/1: MISS Larry Bridges makes 0/1 from the line. Offensive rebound by Tracy Adebayo! Tracy Adebayo kicks it out.
Score: 45-35

[05:37] Team_090 possession (Score: 45-35)
Tracy Adebayo attempts a Midrange. Contested by Dejounte Paul (2.7 feet, MAN). Tracy Adebayo misses. Offensive rebound by Zach Wall! Zach Wall kicks it out.

[05:24] Team_090 possession (Score: 45-35)
Gary Brogdon attempts a 3Pt. Wide open! Bam Iverson is 7.4 feet away. [ZONE] Gary Brogdon misses. Rebound secured by Bam Iverson.

[05:07] Team_071 possession (Score: 45-35)
Bam Iverson attempts a 3Pt. Contested by Zach Wall (5.5 feet, MAN). Bam Iverson misses. Rebound secured by Zach Wall.

[04:52] Team_090 possession (Score: 45-35)
Zach Wall attempts a 3Pt. Contested by Bam Iverson (3.0 feet, MAN). ZACH WALL MAKES IT!
Score: 45-38

[04:40] Team_071 possession (Score: 45-38)
Allen Williamson attempts a 3Pt. Contested by Derrick Mitchell (2.8 feet, MAN). Allen Williamson misses. Rebound secured by Gary Brogdon.

[04:30] Team_090 possession (Score: 45-38)
Tracy Adebayo drives and kicks out. Zach Wall attempts a 3Pt. Contested by Bam Iverson (3.8 feet, MAN). Zach Wall misses. Rebound secured by Dejounte Paul.

[04:16] Team_071 possession (Score: 45-38)
Dejounte Paul attempts a Midrange. Contested by Tracy Adebayo (5.1 feet, MAN). Dejounte Paul misses. Rebound secured by Tracy Adebayo.

[04:01] Team_090 possession (Score: 45-38)
Tracy Adebayo attempts a Midrange. Contested by Dejounte Paul (4.0 feet, MAN). Tracy Adebayo misses. Rebound secured by Bam Iverson.

[03:50] Team_071 possession (Score: 45-38)
Victor Anunoby drives, Larry Bridges stays with him. Victor Anunoby attempts a Layup. Wide open! Larry Bridges is 7.3 feet away. [MAN] VICTOR ANUNOBY MAKES IT!
Score: 47-38

[03:34] Team_090 possession (Score: 47-38)
Larry Bridges drives and kicks out. Gary Brogdon attempts a 3Pt. Wide open! Victor Anunoby is 9.6 feet away. [ZONE] Gary Brogdon misses. Offensive rebound by Zach Wall! Zach Wall kicks it out.

[03:18] Team_090 possession (Score: 47-38)
Zach Wall attempts a 3Pt. Wide open! Victor Anunoby is 8.4 feet away. [ZONE] Zach Wall misses. Rebound secured by Dejounte Paul.

[03:05] Team_071 possession (Score: 47-38)
Dejounte Paul makes the Layup and draws the foul on Gary Brogdon! And-1! Dejounte Paul to the line for 1. [Team fouls: 1] (Gary Brogdon: 1 personal fouls)   FT 1/1: GOOD Dejounte Paul makes 1/1 from the line.
Score: 50-38

[02:49] Team_090 possession (Score: 50-38)
Larry Bridges attempts a Layup. Contested by Victor Anunoby (4.3 feet, MAN). LARRY BRIDGES MAKES IT! Assist: Zach Wall
Score: 50-40

[02:31] Team_071 possession (Score: 50-40)
Allen Williamson attempts a Midrange. Contested by Gary Brogdon (4.5 feet, ZONE). ALLEN WILLIAMSON MAKES IT! Assist: Bam Iverson
Score: 52-40

[02:21] Team_090 possession (Score: 52-40)
Gary Brogdon attempts a 3Pt. Wide open! Jimmy Simons is 6.6 feet away. [MAN] Gary Brogdon misses. Rebound secured by Jimmy Simons.

[02:09] Team_071 possession (Score: 52-40)
Bam Iverson attempts a 3Pt. Wide open! Zach Wall is 7.9 feet away. [MAN] Bam Iverson misses. Rebound secured by Zach Wall.

[01:53] Team_090 possession (Score: 52-40)
Derrick Mitchell throws a bad pass out of bounds! TURNOVER! (dead ball)

[01:53] Substitution (Team_071): Allen Williamson OUT → Evan Sexton IN (stamina_rule2)

[01:53] Substitution (Team_071): Victor Anunoby OUT → Paul Ball IN (stamina_rule2)

[01:53] Substitution (Team_071): Bam Iverson OUT → Immanuel Ginobili IN (stamina_rule2)

[01:53] Substitution (Team_071): Jimmy Simons OUT → Jordan Durant IN (stamina_rule2)

[01:53] Substitution (Team_071): Dejounte Paul OUT → Tyrese Brogdon IN (stamina_rule2)

[01:53] Substitution (Team_090): Derrick Mitchell OUT → OG Anunoby IN (stamina_rule2)

[01:53] Substitution (Team_090): Larry Bridges OUT → Josh Wall IN (stamina_rule2)

[01:53] Substitution (Team_090): Zach Wall OUT → Russell Smith IN (stamina_rule2)

[01:53] Substitution (Team_090): Gary Brogdon OUT → Derrick Nowitzki IN (stamina_rule2)

[01:53] Substitution (Team_090): Tracy Adebayo OUT → Tobias Tatum IN (stamina_rule2)

[01:39] Team_071 possession (Score: 52-40)
Tyrese Brogdon drives and kicks out. Tyrese Brogdon attempts a 3Pt. Contested by Tobias Tatum (4.3 feet, MAN). TYRESE BROGDON MAKES IT! Assist: Jordan Durant
Score: 55-40

[01:23] Team_090 possession (Score: 55-40)
OG Anunoby makes the Layup and draws the foul on Evan Sexton! And-1! OG Anunoby to the line for 1. [BONUS: 5 team fouls] (Evan Sexton: 1 personal fouls)   FT 1/1: GOOD OG Anunoby makes 1/1 from the line.
Score: 55-43

[01:06] Team_071 possession (Score: 55-43)
Tyrese Brogdon attempts a Layup. Contested by Derrick Nowitzki (3.1 feet, ZONE). TYRESE BROGDON MAKES IT! Assist: Jordan Durant
Score: 57-43

[00:56] Team_090 possession (Score: 57-43)
OG Anunoby drives, picks up Tyrese Brogdon. Help arrives from Evan Sexton! OG Anunoby attempts a Dunk. Wide open! Evan Sexton is 7.2 feet away. [ZONE] OG Anunoby misses. Rebound secured by Jordan Durant.

[00:45] Team_071 possession (Score: 57-43)
Jordan Durant loses control! Ball rolls out of bounds! TURNOVER! (dead ball)

[00:27] Team_090 possession (Score: 57-43)
OG Anunoby attempts a 3Pt. Wide open! Paul Ball is 8.3 feet away. [ZONE] OG ANUNOBY MAKES IT! Assist: Russell Smith
Score: 57-46

[00:11] Team_071 possession (Score: 57-46)
Jordan Durant attempts a 3Pt. Contested by Russell Smith (3.7 feet, ZONE). Jordan Durant misses. Rebound secured by Derrick Nowitzki.

================================================================================
                              2ND QUARTER COMPLETE                              
================================================================================

2ND QUARTER SCORE: Team_071 23, Team_090 27

BOX SCORE:
================================================================================

Team_071
--------------------------------------------------------------------------------
Player                MIN  PTS  REB  AST  TO      FG   FG%      3P   3P%
--------------------------------------------------------------------------------
Victor Anunoby         21    8    0    0   0   3/6    50.0     0/0   0.0
Allen Williamson       21    5    0    1   0   2/4    50.0     0/0   0.0
Tyrese Brogdon          3    5    0    0   0   2/2   100.0     0/0   0.0
Dejounte Paul          21    3    4    0   0   1/4    25.0     0/0   0.0
Jimmy Simons           21    2    2    2   0   1/1   100.0     0/0   0.0
Bam Iverson            21    0    3    2   0   0/3     0.0     0/0   0.0
Jordan Durant           3    0    1    2   0   0/1     0.0     0/0   0.0

TEAM: FG: 9/21 (42.9%), 3PT: 2/9 (22.2%), REB: 10 (0 off, 10 def), AST: 7, TO: 1
TEAM FOULS: 5 [Team_090 in BONUS]


Team_090
--------------------------------------------------------------------------------
Player                MIN  PTS  REB  AST  TO      FG   FG%      3P   3P%
--------------------------------------------------------------------------------
Zach Wall              21    6    9    1   0   2/3    66.7     0/0   0.0
OG Anunoby              3    6    0    0   0   2/3    66.7     0/0   0.0
Derrick Mitchell       21    5    0    1   0   2/3    66.7     0/0   0.0
Larry Bridges          21    4    0    0   0   2/3    66.7     0/0   0.0
Gary Brogdon           21    2    2    0   0   1/4    25.0     0/0   0.0
Tracy Adebayo          21    2    6    1   0   1/4    25.0     0/0   0.0
Russell Smith           3    0    0    1   0   0/0     0.0     0/0   0.0
Derrick Nowitzki        3    0    1    0   0   0/0     0.0     0/0   0.0

TEAM: FG: 10/20 (50.0%), 3PT: 3/8 (37.5%), REB: 18 (6 off, 12 def), AST: 4, TO: 1
TEAM FOULS: 1

================================================================================

================================================================================
                       3RD QUARTER - Team_071 vs Team_090                       
================================================================================

[12:00] Team_071 possession (Score: 57-46)
Dejounte Paul drives to the basket... Dejounte Paul loses the ball! Stripped by Tracy Adebayo! TURNOVER! (live ball)

[11:45] Team_090 possession (Score: 57-46)
Zach Wall attempts a 3Pt. Contested by Victor Anunoby (6.0 feet, ZONE). Zach Wall misses. Rebound secured by Jimmy Simons.

[11:33] Team_071 possession (Score: 57-46)
Dejounte Paul drives to the basket... Dejounte Paul loses control! Ball rolls out of bounds! TURNOVER! (dead ball)

[11:15] Team_090 possession (Score: 57-46)
Derrick Mitchell drives, Dejounte Paul stays with him. Derrick Mitchell attempts a Layup. Contested by Dejounte Paul (5.9 feet, ZONE). DERRICK MITCHELL MAKES IT! Assist: Zach Wall
Score: 57-48

[11:00] Team_071 possession (Score: 57-48)
Allen Williamson attempts a 3Pt. Contested by Larry Bridges (3.7 feet, ZONE). Allen Williamson misses. Offensive rebound by Jimmy Simons! Jimmy Simons kicks it out.

[10:46] Team_071 possession (Score: 57-48)
Dejounte Paul attempts a Midrange. Contested by Larry Bridges (4.9 feet, ZONE). Dejounte Paul misses. Rebound secured by Tracy Adebayo.

[10:34] Team_090 possession (Score: 57-48)
Derrick Mitchell makes the Layup and draws the foul on Dejounte Paul! And-1! Derrick Mitchell to the line for 1. [Team fouls: 1] (Dejounte Paul: 1 personal fouls)   FT 1/1: GOOD Derrick Mitchell makes 1/1 from the line.
Score: 57-51

[10:17] Team_071 possession (Score: 57-51)
Dejounte Paul attempts a 3Pt. Wide open! Tracy Adebayo is 6.4 feet away. [MAN] DEJOUNTE PAUL MAKES IT!
Score: 60-51

[10:06] Team_090 possession (Score: 60-51)
Larry Bridges attempts a 3Pt. Wide open! Victor Anunoby is 7.5 feet away. [ZONE] LARRY BRIDGES MAKES IT! Assist: Tracy Adebayo
Score: 60-54

[09:49] Team_071 possession (Score: 60-54)
Dejounte Paul attempts a Layup. Contested by Gary Brogdon (2.8 feet, ZONE). DEJOUNTE PAUL MAKES IT!
Score: 62-54

[09:31] Team_090 possession (Score: 62-54)
FOUL! Reach-in foul on Bam Iverson during the drive. [Team fouls: 2] No free throws, side out. (Bam Iverson: 1 personal fouls)

[09:13] Team_090 possession (Score: 62-54)
Larry Bridges attempts a 3Pt. Contested by Victor Anunoby (3.5 feet, MAN). Larry Bridges misses. Rebound secured by Jimmy Simons.

[09:01] Team_071 possession (Score: 62-54)
Victor Anunoby attempts a 3Pt. Heavily contested by Derrick Mitchell (0.8 feet, ZONE)! Victor Anunoby misses. Rebound secured by Tracy Adebayo.

[08:52] Team_090 possession (Score: 62-54)
FOUL! Shooting foul on Jimmy Simons. Gary Brogdon to the line for 2 free throws. [Team fouls: 3] (Jimmy Simons: 1 personal fouls)   FT 1/2: GOOD   FT 2/2: MISS Gary Brogdon makes 1/2 from the line. Rebound secured by Jimmy Simons.
Score: 62-55

[08:36] Team_071 possession (Score: 62-55)
Allen Williamson loses the ball! Stripped by Derrick Mitchell! TURNOVER! (live ball)

[08:20] Team_090 possession (Score: 62-55)
Derrick Mitchell attempts a Midrange. Heavily contested by Jimmy Simons (1.7 feet, ZONE)! Derrick Mitchell misses. Rebound secured by Jimmy Simons.

[08:05] Team_071 possession (Score: 62-55)
Victor Anunoby attempts a 3Pt. Heavily contested by Derrick Mitchell (0.5 feet, ZONE)! Victor Anunoby misses. Rebound secured by Zach Wall.

[07:48] Team_090 possession (Score: 62-55)
Larry Bridges attempts a Midrange. Wide open! Victor Anunoby is 6.1 feet away. [MAN] Larry Bridges misses. Rebound secured by Dejounte Paul.

[07:31] Team_071 possession (Score: 62-55)
Victor Anunoby attempts a Midrange. Wide open! Larry Bridges is 8.4 feet away. [MAN] VICTOR ANUNOBY MAKES IT!
Score: 64-55

[07:14] Team_090 possession (Score: 64-55)
Derrick Mitchell drives and kicks out. Larry Bridges attempts a Midrange. Contested by Victor Anunoby (3.9 feet, MAN). Larry Bridges misses. Rebound secured by Dejounte Paul.

[07:00] Team_071 possession (Score: 64-55)
Bam Iverson attempts a Midrange. BLOCKED BY ZACH WALL! Ball goes out off Zach Wall. Bam Iverson's ball!

[06:43] Team_071 possession (Score: 64-55)
Bam Iverson attempts a Midrange. Contested by Zach Wall (4.5 feet, ZONE). BAM IVERSON MAKES IT! Assist: Victor Anunoby
Score: 66-55

[06:31] Team_090 possession (Score: 66-55)
Tracy Adebayo drives, picks up Dejounte Paul. Help arrives from Allen Williamson! Tracy Adebayo attempts a Dunk. Heavily contested by Allen Williamson (1.0 feet, ZONE)! TRACY ADEBAYO MAKES IT!
Score: 66-57

[06:18] Team_071 possession (Score: 66-57)
FOUL! Reach-in foul on Tracy Adebayo during the drive. [Team fouls: 1] No free throws, side out. (Tracy Adebayo: 1 personal fouls)

[06:05] Team_071 possession (Score: 66-57)
Allen Williamson attempts a 3Pt. Heavily contested by Derrick Mitchell (1.4 feet, ZONE)! ALLEN WILLIAMSON MAKES IT! Assist: Jimmy Simons
Score: 69-57

[05:50] Team_090 possession (Score: 69-57)
Zach Wall attempts a 3Pt. Wide open! Bam Iverson is 6.5 feet away. [MAN] ZACH WALL MAKES IT! Assist: Derrick Mitchell
Score: 69-60

[05:36] Team_071 possession (Score: 69-60)
Dejounte Paul makes the Dunk and draws the foul on Tracy Adebayo! And-1! Dejounte Paul to the line for 1. [Team fouls: 2] (Tracy Adebayo: 2 personal fouls)   FT 1/1: GOOD Dejounte Paul makes 1/1 from the line.
Score: 72-60

[05:27] Team_090 possession (Score: 72-60)
Larry Bridges attempts a 3Pt. Contested by Jimmy Simons (5.4 feet, ZONE). Larry Bridges misses. Rebound secured by Jimmy Simons.

[05:10] Team_071 possession (Score: 72-60)
Bam Iverson attempts a Midrange. Contested by Zach Wall (2.3 feet, MAN). Bam Iverson misses. Offensive rebound by Dejounte Paul! Dejounte Paul kicks it out.

[04:56] Team_071 possession (Score: 72-60)
Bam Iverson makes the Dunk and draws the foul on Larry Bridges! And-1! Bam Iverson to the line for 1. [Team fouls: 3] (Larry Bridges: 1 personal fouls)   FT 1/1: GOOD Bam Iverson makes 1/1 from the line.
Score: 75-60

[04:37] Team_090 possession (Score: 75-60)
Larry Bridges attempts a Midrange. Contested by Victor Anunoby (5.8 feet, MAN). Larry Bridges misses. Rebound secured by Bam Iverson.

[04:22] Team_071 possession (Score: 75-60)
Bam Iverson attempts a Midrange. Contested by Zach Wall (5.0 feet, MAN). Bam Iverson misses. Rebound secured by Zach Wall.

[04:06] Team_090 possession (Score: 75-60)
Tracy Adebayo attempts a Midrange. Contested by Bam Iverson (5.5 feet, ZONE). TRACY ADEBAYO MAKES IT!
Score: 75-62

[03:52] Team_071 possession (Score: 75-62)
Bam Iverson throws a bad pass! Stolen by Zach Wall! TURNOVER! (live ball)

[03:41] Team_090 possession (Score: 75-62)
Larry Bridges drives and kicks out. Tracy Adebayo attempts a Midrange. Wide open! Dejounte Paul is 6.5 feet away. [MAN] TRACY ADEBAYO MAKES IT!
Score: 75-64

[03:28] Team_071 possession (Score: 75-64)
Allen Williamson attempts a 3Pt. Contested by Derrick Mitchell (3.5 feet, MAN). ALLEN WILLIAMSON MAKES IT! Assist: Victor Anunoby
Score: 78-64

[03:17] Team_090 possession (Score: 78-64)
Gary Brogdon drives to the basket... Gary Brogdon throws a bad pass out of bounds! TURNOVER! (dead ball)

[03:17] Substitution (Team_090): Gary Brogdon OUT → Derrick Nowitzki IN (stamina_rule2)

[03:08] Team_071 possession (Score: 78-64)
Dejounte Paul attempts a Layup. BLOCKED BY TRACY ADEBAYO! Ball is loose! Rebound secured by Larry Bridges.

[02:54] Team_090 possession (Score: 78-64)
Derrick Nowitzki attempts a Midrange. Contested by Jimmy Simons (5.6 feet, MAN). DERRICK NOWITZKI MAKES IT! Assist: Tracy Adebayo
Score: 78-66

[02:41] Team_071 possession (Score: 78-66)
Victor Anunoby attempts a Layup. Contested by Larry Bridges (5.5 feet, MAN). VICTOR ANUNOBY MAKES IT! Assist: Jimmy Simons
Score: 80-66

[02:28] Team_090 possession (Score: 80-66)
Derrick Nowitzki drives to the basket... Derrick Nowitzki loses control! Ball rolls out of bounds! TURNOVER! (dead ball)

[02:28] Substitution (Team_071): Allen Williamson OUT → Evan Sexton IN (stamina_rule2)

[02:28] Substitution (Team_071): Victor Anunoby OUT → Paul Ball IN (stamina_rule2)

[02:28] Substitution (Team_071): Bam Iverson OUT → Immanuel Ginobili IN (stamina_rule2)

[02:28] Substitution (Team_071): Jimmy Simons OUT → Jordan Durant IN (stamina_rule2)

[02:28] Substitution (Team_071): Dejounte Paul OUT → Tyrese Brogdon IN (stamina_rule2)

[02:28] Substitution (Team_090): Tracy Adebayo OUT → Tobias Tatum IN (stamina_rule2)

[02:13] Team_071 possession (Score: 80-66)
Jordan Durant attempts a Layup. Contested by Derrick Nowitzki (4.1 feet, MAN). JORDAN DURANT MAKES IT! Assist: Evan Sexton
Score: 82-66

[02:01] Team_090 possession (Score: 82-66)
Tobias Tatum attempts a Layup. Wide open! Tyrese Brogdon is 7.5 feet away. [MAN] TOBIAS TATUM MAKES IT! Assist: Larry Bridges
Score: 82-68

[01:44] Team_071 possession (Score: 82-68)
Paul Ball attempts a 3Pt. Contested by Derrick Mitchell (4.5 feet, ZONE). Paul Ball misses. Offensive rebound by Immanuel Ginobili! Immanuel Ginobili kicks it out.

[01:27] Team_071 possession (Score: 82-68)
Paul Ball drives, picks up Larry Bridges. Help arrives from Zach Wall! Paul Ball attempts a Layup. Contested by Zach Wall (4.4 feet, MAN). Paul Ball misses. Rebound secured by Tobias Tatum.

[01:09] Team_090 possession (Score: 82-68)
Tobias Tatum throws a bad pass out of bounds! TURNOVER! (dead ball)

[01:09] Substitution (Team_090): Derrick Mitchell OUT → OG Anunoby IN (stamina_rule2)

[01:09] Substitution (Team_090): Larry Bridges OUT → Josh Wall IN (stamina_rule2)

[01:09] Substitution (Team_090): Zach Wall OUT → Russell Smith IN (stamina_rule2)

[00:58] Team_071 possession (Score: 82-68)
Evan Sexton attempts a 3Pt. Contested by OG Anunoby (5.1 feet, MAN). Evan Sexton misses. Rebound secured by Derrick Nowitzki.

[00:43] Team_090 possession (Score: 82-68)
FOUL! Reach-in foul on Tyrese Brogdon during the drive. [Team fouls: 4] No free throws, side out. (Tyrese Brogdon: 1 personal fouls)

[00:34] Team_090 possession (Score: 82-68)
OG Anunoby drives and kicks out. Derrick Nowitzki attempts a 3Pt. Contested by Jordan Durant (3.1 feet, MAN). Derrick Nowitzki misses. Rebound secured by Jordan Durant.

[00:20] Team_071 possession (Score: 82-68)
Paul Ball attempts a Midrange. Contested by Josh Wall (3.8 feet, ZONE). Paul Ball misses. Rebound secured by Tobias Tatum.

[00:03] Team_090 possession (Score: 82-68)
Tobias Tatum drives to the basket... Tobias Tatum loses the ball! Stripped by Tyrese Brogdon! TURNOVER! (live ball)

================================================================================
                              3RD QUARTER COMPLETE                              
================================================================================

3RD QUARTER SCORE: Team_071 25, Team_090 22

BOX SCORE:
================================================================================

Team_071
--------------------------------------------------------------------------------
Player                MIN  PTS  REB  AST  TO      FG   FG%      3P   3P%
--------------------------------------------------------------------------------
Dejounte Paul          31    8    3    0   0   3/5    60.0     0/0   0.0
Allen Williamson       31    6    0    0   0   2/2   100.0     0/0   0.0
Bam Iverson            31    5    1    0   0   2/3    66.7     0/0   0.0
Victor Anunoby         31    4    0    2   0   2/4    50.0     0/0   0.0
Jordan Durant           5    2    1    0   0   1/1   100.0     0/0   0.0
Jimmy Simons           31    0    6    2   0   0/0     0.0     0/0   0.0
Evan Sexton             5    0    0    1   0   0/1     0.0     0/0   0.0
Immanuel Ginobili       5    0    1    0   0   0/0     0.0     0/0   0.0
Paul Ball               5    0    0    0   0   0/2     0.0     0/0   0.0

TEAM: FG: 10/18 (55.6%), 3PT: 3/6 (50.0%), REB: 12 (3 off, 9 def), AST: 5, TO: 4
TEAM FOULS: 4


Team_090
--------------------------------------------------------------------------------
Player                MIN  PTS  REB  AST  TO      FG   FG%      3P   3P%
--------------------------------------------------------------------------------
Tracy Adebayo          31    6    2    2   0   3/3   100.0     0/0   0.0
Derrick Mitchell       32    5    0    1   0   2/4    50.0     0/0   0.0
Zach Wall              32    3    2    1   0   1/2    50.0     0/0   0.0
Larry Bridges          32    3    1    1   0   1/5    20.0     0/0   0.0
Derrick Nowitzki        6    2    1    0   0   1/1   100.0     0/0   0.0
Tobias Tatum            5    2    2    0   0   1/1   100.0     0/0   0.0
Gary Brogdon           30    0    0    0   0   0/1     0.0     0/0   0.0
OG Anunoby              4    0    0    0   0   0/1     0.0     0/0   0.0

TEAM: FG: 9/18 (50.0%), 3PT: 2/5 (40.0%), REB: 8 (0 off, 8 def), AST: 5, TO: 4
TEAM FOULS: 3

================================================================================

================================================================================
                       4TH QUARTER - Team_071 vs Team_090                       
================================================================================

[12:00] Team_071 possession (Score: 82-68)
Victor Anunoby attempts a Midrange. Contested by Tracy Adebayo (3.5 feet, ZONE). VICTOR ANUNOBY MAKES IT! Assist: Bam Iverson
Score: 84-68

[11:46] Team_090 possession (Score: 84-68)
Gary Brogdon drives and kicks out. Gary Brogdon attempts a Midrange. Contested by Jimmy Simons (5.5 feet, MAN). Gary Brogdon misses. Rebound secured by Bam Iverson.

[11:30] Team_071 possession (Score: 84-68)
Dejounte Paul attempts a Midrange. Contested by Tracy Adebayo (4.5 feet, MAN). Dejounte Paul misses. Rebound secured by Gary Brogdon.

[11:12] Team_090 possession (Score: 84-68)
Gary Brogdon drives and kicks out. Larry Bridges attempts a Midrange. Contested by Victor Anunoby (4.3 feet, ZONE). LARRY BRIDGES MAKES IT!
Score: 84-70

[10:58] Team_071 possession (Score: 84-70)
Jimmy Simons attempts a Midrange. Heavily contested by Gary Brogdon (0.5 feet, MAN)! Jimmy Simons misses. Rebound secured by Gary Brogdon.

[10:46] Team_090 possession (Score: 84-70)
Tracy Adebayo attempts a Midrange. Wide open! Bam Iverson is 6.1 feet away. [ZONE] TRACY ADEBAYO MAKES IT! Assist: Larry Bridges
Score: 84-72

[10:35] Team_071 possession (Score: 84-72)
Bam Iverson attempts a 3Pt. Contested by Zach Wall (4.1 feet, MAN). Bam Iverson misses. FOUL! Loose ball foul on Gary Brogdon during the rebound battle. [Team fouls: 1] No free throws, side out. (Gary Brogdon: 1 personal fouls)

[10:22] Team_071 possession (Score: 84-72)
Allen Williamson attempts a Layup. Contested by Gary Brogdon (2.4 feet, ZONE). ALLEN WILLIAMSON MAKES IT!
Score: 86-72

[10:03] Team_090 possession (Score: 86-72)
Gary Brogdon attempts a Midrange. Contested by Bam Iverson (2.3 feet, ZONE). GARY BROGDON MAKES IT! Assist: Zach Wall
Score: 86-74

[09:46] Team_071 possession (Score: 86-74)
Jimmy Simons attempts a Layup. Wide open! Tracy Adebayo is 6.5 feet away. [ZONE] Jimmy Simons misses. Offensive rebound by Dejounte Paul! Dejounte Paul kicks it out.

[09:34] Team_071 possession (Score: 86-74)
Allen Williamson attempts a Layup. Heavily contested by Gary Brogdon (1.6 feet, ZONE)! Allen Williamson misses. Rebound secured by Gary Brogdon.

[09:22] Team_090 possession (Score: 86-74)
Larry Bridges attempts a 3Pt. Contested by Victor Anunoby (3.2 feet, ZONE). Larry Bridges misses. Offensive rebound by Tracy Adebayo! Tracy Adebayo kicks it out.

[09:09] Team_090 possession (Score: 86-74)
Zach Wall attempts a 3Pt. Contested by Jimmy Simons (3.9 feet, ZONE). ZACH WALL MAKES IT! Assist: Derrick Mitchell
Score: 86-77

[08:59] Team_071 possession (Score: 86-77)
Victor Anunoby attempts a 3Pt. Contested by Larry Bridges (5.3 feet, MAN). Victor Anunoby misses. Rebound secured by Zach Wall.

[08:47] Team_090 possession (Score: 86-77)
Zach Wall attempts a 3Pt. Heavily contested by Allen Williamson (1.5 feet, ZONE)! Zach Wall misses. Offensive rebound by Tracy Adebayo! Tracy Adebayo kicks it out.

[08:30] Team_090 possession (Score: 86-77)
Derrick Mitchell attempts a 3Pt. Contested by Allen Williamson (4.1 feet, MAN). Derrick Mitchell misses. Rebound secured by Jimmy Simons.

[08:17] Team_071 possession (Score: 86-77)
Allen Williamson drives, picks up Gary Brogdon. Help arrives from Larry Bridges! Allen Williamson attempts a Dunk. Wide open! Larry Bridges is 6.8 feet away. [ZONE] Allen Williamson misses. Rebound secured by Gary Brogdon.

[08:01] Team_090 possession (Score: 86-77)
Gary Brogdon attempts a Layup. Contested by Dejounte Paul (3.0 feet, ZONE). GARY BROGDON MAKES IT! Assist: Derrick Mitchell
Score: 86-79

[07:49] Team_071 possession (Score: 86-79)
Dejounte Paul attempts a 3Pt. Wide open! Tracy Adebayo is 6.6 feet away. [MAN] Dejounte Paul misses. Rebound secured by Tracy Adebayo.

[07:34] Team_090 possession (Score: 86-79)
Zach Wall attempts a 3Pt. Contested by Bam Iverson (2.1 feet, MAN). Zach Wall misses. Rebound secured by Jimmy Simons.

[07:21] Team_071 possession (Score: 86-79)
Victor Anunoby drives, picks up Larry Bridges. Help arrives from Zach Wall! Victor Anunoby attempts a Layup. Contested by Zach Wall (4.5 feet, MAN). Victor Anunoby misses. Rebound secured by Tracy Adebayo.

[07:08] Team_090 possession (Score: 86-79)
Larry Bridges attempts a Midrange. Wide open! Bam Iverson is 6.7 feet away. [ZONE] Larry Bridges misses. Rebound secured by Bam Iverson.

[06:52] Team_071 possession (Score: 86-79)
FOUL! Holding foul on Gary Brogdon. [Team fouls: 2] No free throws, side out. (Gary Brogdon: 2 personal fouls)

[06:36] Team_071 possession (Score: 86-79)
Victor Anunoby drives and kicks out. Allen Williamson attempts a 3Pt. Wide open! Derrick Mitchell is 7.1 feet away. [ZONE] ALLEN WILLIAMSON MAKES IT! Assist: Dejounte Paul
Score: 89-79

[06:23] Team_090 possession (Score: 89-79)
Larry Bridges attempts a 3Pt. Contested by Victor Anunoby (3.9 feet, ZONE). Larry Bridges misses. Rebound secured by Jimmy Simons.

[06:04] Team_071 possession (Score: 89-79)
Allen Williamson attempts a 3Pt. Heavily contested by Derrick Mitchell (0.6 feet, ZONE)! Allen Williamson misses. Offensive rebound by Jimmy Simons! Jimmy Simons kicks it out.

[05:49] Team_071 possession (Score: 89-79)
Dejounte Paul drives, picks up Tracy Adebayo. Help arrives from Larry Bridges! Dejounte Paul attempts a Dunk. Contested by Larry Bridges (3.9 feet, MAN). DEJOUNTE PAUL MAKES IT! Assist: Bam Iverson
Score: 91-79

[05:33] Team_090 possession (Score: 91-79)
Gary Brogdon attempts a 3Pt. Wide open! Bam Iverson is 7.4 feet away. [ZONE] Gary Brogdon misses. Offensive rebound by Gary Brogdon! Gary Brogdon kicks it out.

[05:21] Team_090 possession (Score: 91-79)
Tracy Adebayo attempts a Midrange. Contested by Bam Iverson (4.3 feet, ZONE). Tracy Adebayo misses. Offensive rebound by Tracy Adebayo! Tracy Adebayo kicks it out.

[05:08] Team_090 possession (Score: 91-79)
Derrick Mitchell makes the Midrange and draws the foul on Victor Anunoby! And-1! Derrick Mitchell to the line for 1. [Team fouls: 1] (Victor Anunoby: 1 personal fouls)   FT 1/1: GOOD Derrick Mitchell makes 1/1 from the line.
Score: 91-82

[04:54] Team_071 possession (Score: 91-82)
Victor Anunoby attempts a Layup. Wide open! Tracy Adebayo is 7.6 feet away. [ZONE] Victor Anunoby misses. Offensive rebound by Dejounte Paul! Dejounte Paul kicks it out.

[04:41] Team_071 possession (Score: 91-82)
Victor Anunoby attempts a 3Pt. Contested by Derrick Mitchell (4.2 feet, ZONE). Victor Anunoby misses. Rebound secured by Tracy Adebayo.

[04:28] Team_090 possession (Score: 91-82)
Zach Wall drives and kicks out. Larry Bridges attempts a 3Pt. Contested by Victor Anunoby (4.4 feet, MAN). LARRY BRIDGES MAKES IT! Assist: Gary Brogdon
Score: 91-85

[04:14] Team_071 possession (Score: 91-85)
Dejounte Paul attempts a Midrange. Wide open! Larry Bridges is 7.8 feet away. [ZONE] Dejounte Paul misses. Rebound secured by Zach Wall.

[04:04] Team_090 possession (Score: 91-85)
Derrick Mitchell attempts a 3Pt. Wide open! Allen Williamson is 6.4 feet away. [MAN] Derrick Mitchell misses. FOUL! Loose ball foul on Dejounte Paul during the rebound battle. [Team fouls: 2] No free throws, side out. (Dejounte Paul: 1 personal fouls)

[03:52] Team_090 possession (Score: 91-85)
Larry Bridges attempts a 3Pt. Wide open! Victor Anunoby is 6.9 feet away. [ZONE] Larry Bridges misses. Rebound secured by Jimmy Simons.

[03:36] Team_071 possession (Score: 91-85)
FOUL! Offensive foul on Dejounte Paul! Tracy Adebayo drew the charge! [Team fouls: 3] (Dejounte Paul: 2 personal fouls) TURNOVER! (dead ball)

[03:19] Team_090 possession (Score: 91-85)
Gary Brogdon throws a bad pass out of bounds! TURNOVER! (dead ball)

[03:19] Substitution (Team_071): Allen Williamson OUT → Evan Sexton IN (stamina_rule2)

[03:19] Substitution (Team_071): Victor Anunoby OUT → Paul Ball IN (stamina_rule2)

[03:19] Substitution (Team_071): Bam Iverson OUT → Immanuel Ginobili IN (stamina_rule2)

[03:19] Substitution (Team_071): Jimmy Simons OUT → Jordan Durant IN (stamina_rule2)

[03:19] Substitution (Team_071): Dejounte Paul OUT → Tyrese Brogdon IN (stamina_rule2)

[03:19] Substitution (Team_090): Derrick Mitchell OUT → OG Anunoby IN (stamina_rule2)

[03:19] Substitution (Team_090): Larry Bridges OUT → Josh Wall IN (stamina_rule2)

[03:19] Substitution (Team_090): Zach Wall OUT → Russell Smith IN (stamina_rule2)

[03:19] Substitution (Team_090): Gary Brogdon OUT → Derrick Nowitzki IN (stamina_rule2)

[03:19] Substitution (Team_090): Tracy Adebayo OUT → Tobias Tatum IN (stamina_rule2)

[03:00] Team_071 possession (Score: 91-85)
Jordan Durant attempts a Midrange. Contested by Derrick Nowitzki (3.3 feet, ZONE). Jordan Durant misses. Rebound secured by Tobias Tatum.

[02:46] Team_090 possession (Score: 91-85)
Derrick Nowitzki attempts a Midrange. Contested by Jordan Durant (2.3 feet, MAN). DERRICK NOWITZKI MAKES IT! Assist: Tobias Tatum
Score: 91-87

[02:28] Team_071 possession (Score: 91-87)
Jordan Durant attempts a 3Pt. Contested by Derrick Nowitzki (5.9 feet, MAN). Jordan Durant misses. Offensive rebound by Jordan Durant! Jordan Durant kicks it out.

[02:11] Team_071 possession (Score: 91-87)
Jordan Durant attempts a 3Pt. Wide open! Russell Smith is 7.0 feet away. [ZONE] JORDAN DURANT MAKES IT!
Score: 94-87

[01:57] Team_090 possession (Score: 94-87)
OG Anunoby attempts a 3Pt. Contested by Paul Ball (5.2 feet, ZONE). OG ANUNOBY MAKES IT! Assist: Josh Wall
Score: 94-90

[01:44] Team_071 possession (Score: 94-90)
Paul Ball attempts a Layup. BLOCKED BY JOSH WALL! Ball is loose! Rebound secured by Russell Smith.

[01:33] Team_090 possession (Score: 94-90)
Josh Wall attempts a 3Pt. Contested by Jordan Durant (5.2 feet, ZONE). JOSH WALL MAKES IT! Assist: OG Anunoby
Score: 94-93

[01:21] Team_071 possession (Score: 94-93)
Paul Ball drives to the basket... Paul Ball loses control! Ball rolls out of bounds! TURNOVER! (dead ball)

[01:08] Team_090 possession (Score: 94-93)
OG Anunoby attempts a 3Pt. Wide open! Evan Sexton is 6.6 feet away. [MAN] OG ANUNOBY MAKES IT! Assist: Josh Wall
Score: 94-96

[00:50] Team_071 possession (Score: 94-96)
FOUL! Holding foul on Derrick Nowitzki. [Team fouls: 3] No free throws, side out. (Derrick Nowitzki: 1 personal fouls)

[00:37] Team_071 possession (Score: 94-96)
Paul Ball attempts a Midrange. Wide open! Josh Wall is 7.0 feet away. [MAN] Paul Ball misses. Rebound secured by Russell Smith.

[00:25] Team_090 possession (Score: 94-96)
Josh Wall attempts a 3Pt. Wide open! Paul Ball is 8.6 feet away. [ZONE] Josh Wall misses. Rebound secured by Evan Sexton.

[00:11] Team_071 possession (Score: 94-96)
Immanuel Ginobili attempts a 3Pt. Wide open! Derrick Nowitzki is 6.2 feet away. [ZONE] IMMANUEL GINOBILI MAKES IT! Assist: Tyrese Brogdon
Score: 97-96

================================================================================
                              4TH QUARTER COMPLETE                              
================================================================================

4TH QUARTER SCORE: Team_071 15, Team_090 28

BOX SCORE:
================================================================================

Team_071
--------------------------------------------------------------------------------
Player                MIN  PTS  REB  AST  TO      FG   FG%      3P   3P%
--------------------------------------------------------------------------------
Allen Williamson       40    5    0    0   0   2/4    50.0     0/0   0.0
Jordan Durant           8    3    1    0   0   1/2    50.0     0/0   0.0
Immanuel Ginobili       8    3    0    0   0   1/1   100.0     0/0   0.0
Victor Anunoby         40    2    0    0   0   1/4    25.0     0/0   0.0
Dejounte Paul          40    2    2    1   0   1/4    25.0     0/0   0.0
Bam Iverson            40    0    2    2   0   0/0     0.0     0/0   0.0
Jimmy Simons           40    0    6    0   0   0/1     0.0     0/0   0.0
Paul Ball               8    0    0    0   0   0/2     0.0     0/0   0.0
Evan Sexton             8    0    1    0   0   0/0     0.0     0/0   0.0
Tyrese Brogdon          8    0    0    1   0   0/0     0.0     0/0   0.0

TEAM: FG: 6/18 (33.3%), 3PT: 2/5 (40.0%), REB: 12 (5 off, 7 def), AST: 4, TO: 2
TEAM FOULS: 3


Team_090
--------------------------------------------------------------------------------
Player                MIN  PTS  REB  AST  TO      FG   FG%      3P   3P%
--------------------------------------------------------------------------------
OG Anunoby              7    6    0    1   0   2/2   100.0     0/0   0.0
Larry Bridges          41    5    0    1   0   2/5    40.0     0/0   0.0
Gary Brogdon           39    4    5    1   0   2/3    66.7     0/0   0.0
Zach Wall              41    3    2    1   0   1/2    50.0     0/0   0.0
Derrick Mitchell       41    3    0    2   0   1/2    50.0     0/0   0.0
Josh Wall               7    3    0    2   0   1/2    50.0     0/0   0.0
Tracy Adebayo          40    2    7    0   0   1/1   100.0     0/0   0.0
Derrick Nowitzki        9    2    0    0   0   1/1   100.0     0/0   0.0
Tobias Tatum            8    0    1    1   0   0/0     0.0     0/0   0.0
Russell Smith           7    0    2    0   0   0/0     0.0     0/0   0.0

TEAM: FG: 11/18 (61.1%), 3PT: 4/9 (44.4%), REB: 17 (5 off, 12 def), AST: 9, TO: 1
TEAM FOULS: 3

================================================================================

================================================================================
                               FULL GAME COMPLETE                               
================================================================================

FINAL SCORE: Team_071 97, Team_090 96

SCORING BY QUARTER:
--------------------------------------------------------------------------------
Team                     Q1     Q2     Q3     Q4    FINAL
--------------------------------------------------------------------------------
Team_071                 34     23     25     15       97
Team_090                 19     27     22     28       96
--------------------------------------------------------------------------------

FULL GAME BOX SCORE:
================================================================================

Team_071
--------------------------------------------------------------------------------
Player                MIN  PTS  REB  AST  TO      FG   FG%      3P   3P%      FT STL BLK
--------------------------------------------------------------------------------
Allen Williamson       40   19    0    3   1   4/8    50.0   2/3    66.7   0/0     0   0
Victor Anunoby         40   18    0    4   0   9/17   52.9   2/9    22.2   2/3     0   0
Bam Iverson            40   18    9    5   1   7/15   46.7   3/7    42.9   1/1     1   1
Jimmy Simons           40   10   18    4   1   5/7    71.4   2/2   100.0   0/0     0   0
Dejounte Paul          40   13   13    2   2   6/16   37.5   1/3    33.3   2/2     0   1
Evan Sexton             8    0    1    1   0   0/1     0.0   0/1     0.0   0/0     0   0
Paul Ball               8    0    0    0   0   0/4     0.0   0/0     0.0   0/0     0   0
Immanuel Ginobili       8    3    1    1   1   1/2    50.0   1/2    50.0   0/0     0   0
Jordan Durant           8    8    3    2   1   4/6    66.7   1/2    50.0   1/1     0   0
Tyrese Brogdon          8    8    0    1   0   2/2   100.0   0/0     0.0   0/0     1   0

TEAM: FG: 38/78 (48.7%), 3PT: 12/29 (41.4%), REB: 45 (11 off, 34 def), AST: 23, TO: 7


Team_090
--------------------------------------------------------------------------------
Player                MIN  PTS  REB  AST  TO      FG   FG%      3P   3P%      FT STL BLK
--------------------------------------------------------------------------------
Derrick Mitchell       41   15    0    4   2   6/10   60.0   1/2    50.0   2/2     1   0
Larry Bridges          41   12    1    2   2   5/16   31.2   1/9    11.1   2/3     0   0
Zach Wall              41   15   19    4   2   5/11   45.5   4/10   40.0   0/0     1   1
Tracy Adebayo          40   14   17    3   0   7/12   58.3   0/1     0.0   4/6     1   2
Gary Brogdon           39   11    8    2   1   6/11   54.5   0/2     0.0   2/3     0   1
Derrick Nowitzki        9    6    2    0   0   2/2   100.0   0/0     0.0   0/0     0   0
Tobias Tatum            8    2    3    2   2   1/1   100.0   0/0     0.0   0/0     0   0
OG Anunoby              7   12    0    1   0   4/6    66.7   3/3   100.0   1/1     0   0
Josh Wall               7    6    0    2   0   3/4    75.0   1/2    50.0   1/1     0   1
Russell Smith           7    0    3    1   0   0/0     0.0   0/0     0.0   0/0     0   0

TEAM: FG: 39/73 (53.4%), 3PT: 10/29 (34.5%), REB: 53 (13 off, 40 def), AST: 21, TO: 9

================================================================================
