================================================================================
                        FULL GAME - Team_005 vs Team_029                        
================================================================================

================================================================================
                       1ST QUARTER - Team_005 vs Team_029                       
================================================================================

[12:00] Team_005 possession (Score: 0-0)
Cade Markkanen attempts a Layup. Heavily contested by Devin Butler (0.5 feet, ZONE)! CADE MARKKANEN MAKES IT! Assist: Derrick Allen
Score: 2-0

[11:47] Team_029 possession (Score: 2-0)
Giannis Banchero attempts a 3Pt. Contested by Derrick Allen (5.3 feet, MAN). Giannis Banchero misses. Rebound secured by Cade Markkanen.

[11:33] Team_005 possession (Score: 2-0)
Anthony Rozier attempts a 3Pt. Contested by Scottie Bird (2.7 feet, MAN). Anthony Rozier misses. Rebound secured by James Wall.

[11:18] Team_029 possession (Score: 2-0)
Scottie Bird attempts a Midrange. Wide open! Anthony Rozier is 6.2 feet away. [MAN] SCOTTIE BIRD MAKES IT!
Score: 2-2

[11:06] Team_005 possession (Score: 2-2)
Derrick Allen makes the Layup and draws the foul on Giannis Banchero! And-1! Derrick Allen to the line for 1. [Team fouls: 1] (Giannis Banchero: 1 personal fouls)   FT 1/1: GOOD Derrick Allen makes 1/1 from the line.
Score: 5-2

[10:50] Team_029 possession (Score: 5-2)
Giannis Banchero attempts a 3Pt. Contested by Derrick Allen (4.4 feet, ZONE). Giannis Banchero misses. Rebound secured by Jalen Rozier.

[10:35] Team_005 possession (Score: 5-2)
FOUL! Reach-in foul on James Wall during the drive. [Team fouls: 2] No free throws, side out. (James Wall: 1 personal fouls)

[10:20] Team_005 possession (Score: 5-2)
Cade Markkanen makes the Layup and draws the foul on Devin Butler! And-1! Cade Markkanen to the line for 1. [Team fouls: 3] (Devin Butler: 1 personal fouls)   FT 1/1: GOOD Cade Markkanen makes 1/1 from the line.
Score: 8-2

[10:04] Team_029 possession (Score: 8-2)
James Wall attempts a Midrange. Contested by Anthony Rozier (3.1 feet, ZONE). JAMES WALL MAKES IT!
Score: 8-4

[09:49] Team_005 possession (Score: 8-4)
Cade Markkanen attempts a Layup. Contested by Devin Butler (5.0 feet, MAN). Cade Markkanen misses. Rebound secured by Devin Butler.

[09:35] Team_029 possession (Score: 8-4)
James Wall drives, Cade Markkanen stays with him. James Wall attempts a Dunk. Contested by Cade Markkanen (2.5 feet, ZONE). JAMES WALL MAKES IT! Assist: Giannis Banchero
Score: 8-6

[09:20] Team_005 possession (Score: 8-6)
Derrick Allen drives, picks up Giannis Banchero. Help arrives from Scottie Bird! Derrick Allen attempts a Layup. Wide open! Scottie Bird is 7.6 feet away. [MAN] Derrick Allen misses. Rebound secured by Giannis Banchero.

[09:06] Team_029 possession (Score: 8-6)
James Wall attempts a Midrange. Contested by Cade Markkanen (5.5 feet, MAN). James Wall misses. Rebound secured by Derrick Allen.

[08:54] Team_005 possession (Score: 8-6)
Anthony Rozier attempts a Layup. Heavily contested by Scottie Bird (0.5 feet, MAN)! ANTHONY ROZIER MAKES IT!
Score: 10-6

[08:35] Team_029 possession (Score: 10-6)
Paul Iverson attempts a 3Pt. Contested by Derrick Allen (2.5 feet, ZONE). Paul Iverson misses. Offensive rebound by James Wall! James Wall's putback is no good. Rebound secured by Jalen Rozier.

[08:18] Team_005 possession (Score: 10-6)
Brandon George attempts a Midrange. Contested by Paul Iverson (5.0 feet, MAN). BRANDON GEORGE MAKES IT!
Score: 12-6

[08:03] Team_029 possession (Score: 12-6)
James Wall attempts a 3Pt. Contested by Derrick Allen (5.1 feet, ZONE). James Wall misses. Rebound secured by Jalen Rozier.

[07:48] Team_005 possession (Score: 12-6)
Brandon George attempts a 3Pt. Contested by Giannis Banchero (4.0 feet, ZONE). BRANDON GEORGE MAKES IT! Assist: Anthony Rozier
Score: 15-6

[07:33] Team_029 possession (Score: 15-6)
James Wall drives and kicks out. James Wall attempts a 3Pt. Contested by Derrick Allen (4.8 feet, ZONE). James Wall misses. Rebound secured by Jalen Rozier.

[07:21] Team_005 possession (Score: 15-6)
Cade Markkanen loses the ball! Stripped by Devin Butler! TURNOVER! (live ball)

[07:07] Team_029 possession (Score: 15-6)
James Wall drives to the basket... FOUL! Offensive foul on James Wall! Cade Markkanen drew the charge! [Team fouls: 4] (James Wall: 2 personal fouls) TURNOVER! (dead ball)

[06:50] Team_005 possession (Score: 15-6)
Cade Markkanen drives and kicks out. Cade Markkanen attempts a Midrange. Contested by Devin Butler (3.6 feet, MAN). Cade Markkanen misses. Rebound secured by Devin Butler.

[06:40] Team_029 possession (Score: 15-6)
FOUL! Shooting foul on Cade Markkanen. Giannis Banchero to the line for 2 free throws. [Team fouls: 1] (Cade Markkanen: 1 personal fouls)   FT 1/2: GOOD   FT 2/2: GOOD Giannis Banchero makes 2/2 from the line.
Score: 15-8

[06:29] Team_005 possession (Score: 15-8)
Cade Markkanen attempts a Layup. Wide open! James Wall is 7.2 feet away. [ZONE] CADE MARKKANEN MAKES IT! Assist: Anthony Rozier
Score: 17-8

[06:11] Team_029 possession (Score: 17-8)
Scottie Bird drives to the basket... Scottie Bird throws a bad pass out of bounds! TURNOVER! (dead ball)

[05:58] Team_005 possession (Score: 17-8)
Brandon George attempts a Midrange. Contested by James Wall (5.5 feet, ZONE). BRANDON GEORGE MAKES IT! Assist: Anthony Rozier
Score: 19-8

[05:42] Team_029 possession (Score: 19-8)
Devin Butler attempts a Midrange. Heavily contested by Anthony Rozier (1.4 feet, ZONE)! Devin Butler misses. Rebound secured by Jalen Rozier.

[05:25] Team_005 possession (Score: 19-8)
Anthony Rozier attempts a Midrange. Heavily contested by Scottie Bird (0.5 feet, ZONE)! Anthony Rozier misses. Rebound secured by Giannis Banchero.

[05:13] Team_029 possession (Score: 19-8)
Devin Butler drives to the basket... Devin Butler loses control! Ball rolls out of bounds! TURNOVER! (dead ball)

[04:54] Team_005 possession (Score: 19-8)
Anthony Rozier attempts a Midrange. Wide open! Scottie Bird is 7.1 feet away. [MAN] ANTHONY ROZIER MAKES IT! Assist: Brandon George
Score: 21-8

[04:38] Team_029 possession (Score: 21-8)
James Wall makes the Layup and draws the foul on Cade Markkanen! And-1! James Wall to the line for 1. [Team fouls: 2] (Cade Markkanen: 2 personal fouls)   FT 1/1: GOOD James Wall makes 1/1 from the line.
Score: 21-11

[04:20] Team_005 possession (Score: 21-11)
Anthony Rozier drives to the basket... Anthony Rozier loses the ball! Stripped by James Wall! TURNOVER! (live ball)

[04:07] Team_029 possession (Score: 21-11)
FOUL! Holding foul on Brandon George. [Team fouls: 3] No free throws, side out. (Brandon George: 1 personal fouls)

[03:51] Team_029 possession (Score: 21-11)
Paul Iverson attempts a 3Pt. Heavily contested by Brandon George (0.6 feet, MAN)! PAUL IVERSON MAKES IT! Assist: James Wall
Score: 21-14

[03:33] Team_005 possession (Score: 21-14)
Jalen Rozier attempts a Layup. BLOCKED BY SCOTTIE BIRD! Ball is loose! Rebound secured by James Wall.

[03:20] Team_029 possession (Score: 21-14)
Giannis Banchero attempts a Midrange. Wide open! Derrick Allen is 6.9 feet away. [MAN] Giannis Banchero misses. Rebound secured by Cade Markkanen.

[03:03] Team_005 possession (Score: 21-14)
Cade Markkanen drives, James Wall stays with him. Cade Markkanen attempts a Dunk. Contested by James Wall (2.6 feet, ZONE). CADE MARKKANEN MAKES IT!
Score: 23-14

[02:50] Team_029 possession (Score: 23-14)
Giannis Banchero attempts a 3Pt. Contested by Derrick Allen (5.9 feet, ZONE). GIANNIS BANCHERO MAKES IT! Assist: Paul Iverson
Score: 23-17

[02:36] Team_005 possession (Score: 23-17)
Derrick Allen drives, picks up Giannis Banchero. Help arrives from Scottie Bird! Derrick Allen attempts a Dunk. Contested by Scottie Bird (5.7 feet, MAN). DERRICK ALLEN MAKES IT!
Score: 25-17

[02:19] Team_029 possession (Score: 25-17)
Scottie Bird attempts a Layup. Contested by Cade Markkanen (5.3 feet, ZONE). SCOTTIE BIRD MAKES IT!
Score: 25-19

[02:08] Team_005 possession (Score: 25-19)
Anthony Rozier drives, Scottie Bird stays with him. Anthony Rozier attempts a Dunk. Contested by Scottie Bird (5.5 feet, MAN). Anthony Rozier misses. Rebound secured by Giannis Banchero.

[01:58] Team_029 possession (Score: 25-19)
Devin Butler attempts a 3Pt. Contested by Derrick Allen (4.8 feet, ZONE). DEVIN BUTLER MAKES IT! Assist: Paul Iverson
Score: 25-22

[01:42] Team_005 possession (Score: 25-22)
Jalen Rozier makes the Layup and draws the foul on James Wall! And-1! Jalen Rozier to the line for 1. [BONUS: 5 team fouls] (James Wall: 3 personal fouls)   FT 1/1: GOOD Jalen Rozier makes 1/1 from the line.
Score: 28-22

[01:28] Team_029 possession (Score: 28-22)
Scottie Bird drives and kicks out. Giannis Banchero attempts a 3Pt. Wide open! Derrick Allen is 9.0 feet away. [ZONE] Giannis Banchero misses. Rebound secured by Derrick Allen.

[01:12] Team_005 possession (Score: 28-22)
Cade Markkanen drives, picks up Devin Butler. Help arrives from Scottie Bird! Cade Markkanen attempts a Dunk. Wide open! Scottie Bird is 6.6 feet away. [MAN] CADE MARKKANEN MAKES IT! Assist: Jalen Rozier
Score: 30-22

[01:01] Team_029 possession (Score: 30-22)
James Wall attempts a Midrange. Wide open! Derrick Allen is 7.5 feet away. [ZONE] James Wall misses. Rebound secured by Cade Markkanen.

[00:44] Team_005 possession (Score: 30-22)
Jalen Rozier drives, picks up James Wall. Help arrives from Scottie Bird! Jalen Rozier attempts a Layup. Contested by Scottie Bird (2.6 feet, ZONE). Jalen Rozier misses. Rebound secured by James Wall.

[00:30] Team_029 possession (Score: 30-22)
Devin Butler attempts a Layup. Wide open! Cade Markkanen is 7.3 feet away. [ZONE] Devin Butler misses. Rebound secured by Jalen Rozier.

[00:18] Team_005 possession (Score: 30-22)
Anthony Rozier attempts a Midrange. Heavily contested by Scottie Bird (0.5 feet, MAN)! ANTHONY ROZIER MAKES IT! Assist: Cade Markkanen
Score: 32-22

[00:01] Team_029 possession (Score: 32-22)
Scottie Bird attempts a Layup. Wide open! Anthony Rozier is 6.5 feet away. [MAN] Scottie Bird misses. Rebound secured by Derrick Allen.

================================================================================
                              1ST QUARTER COMPLETE                              
================================================================================

1ST QUARTER SCORE: Team_005 32, Team_029 22

BOX SCORE:
================================================================================

Team_005
--------------------------------------------------------------------------------
Player                MIN  PTS  REB  AST  TO      FG   FG%      3P   3P%
--------------------------------------------------------------------------------
Cade Markkanen         12   11    3    1   0   5/7    71.4     0/0   0.0
Brandon George         12    7    0    1   0   3/3   100.0     0/0   0.0
Anthony Rozier         12    6    0    3   0   3/6    50.0     0/0   0.0
Derrick Allen          12    5    3    1   0   2/3    66.7     0/0   0.0
Jalen Rozier           12    3    6    1   0   1/3    33.3     0/0   0.0

TEAM: FG: 14/22 (63.6%), 3PT: 1/2 (50.0%), REB: 11 (0 off, 11 def), AST: 7, TO: 2
TEAM FOULS: 3


Team_029
--------------------------------------------------------------------------------
Player                MIN  PTS  REB  AST  TO      FG   FG%      3P   3P%
--------------------------------------------------------------------------------
James Wall             12    7    3    1   0   3/7    42.9     0/0   0.0
Giannis Banchero       12    5    3    1   0   2/5    40.0     0/0   0.0
Scottie Bird           12    4    0    0   0   2/4    50.0     0/0   0.0
Devin Butler           12    3    2    0   0   1/3    33.3     0/0   0.0
Paul Iverson           12    3    0    2   0   1/2    50.0     0/0   0.0

TEAM: FG: 9/21 (42.9%), 3PT: 3/7 (42.9%), REB: 9 (1 off, 8 def), AST: 4, TO: 3
TEAM FOULS: 5 [Team_005 in BONUS]

================================================================================

================================================================================
                       2ND QUARTER - Team_005 vs Team_029                       
================================================================================

[12:00] Team_005 possession (Score: 32-22)
Brandon George attempts a 3Pt. Wide open! Paul Iverson is 6.1 feet away. [MAN] Brandon George misses. Rebound secured by Giannis Banchero.

[11:43] Team_029 possession (Score: 32-22)
Devin Butler attempts a Layup. Contested by Cade Markkanen (5.1 feet, ZONE). DEVIN BUTLER MAKES IT! Assist: Paul Iverson
Score: 32-24

[11:26] Team_005 possession (Score: 32-24)
Anthony Rozier makes the Dunk and draws the foul on James Wall! And-1! Anthony Rozier to the line for 1. [Team fouls: 1] (James Wall: 1 personal fouls)   FT 1/1: GOOD Anthony Rozier makes 1/1 from the line.
Score: 35-24

[11:13] Team_029 possession (Score: 35-24)
FOUL! Reach-in foul on Derrick Allen during the drive. [Team fouls: 1] No free throws, side out. (Derrick Allen: 1 personal fouls)

[10:58] Team_029 possession (Score: 35-24)
Devin Butler drives, Cade Markkanen stays with him. Devin Butler attempts a Dunk. Contested by Cade Markkanen (3.8 feet, ZONE). Devin Butler misses. Rebound secured by Derrick Allen.

[10:43] Team_005 possession (Score: 35-24)
Anthony Rozier attempts a 3Pt. Wide open! Giannis Banchero is 6.4 feet away. [ZONE] Anthony Rozier misses. Rebound secured by Giannis Banchero.

[10:33] Team_029 possession (Score: 35-24)
Giannis Banchero makes the Layup and draws the foul on Cade Markkanen! And-1! Giannis Banchero to the line for 1. [Team fouls: 2] (Cade Markkanen: 1 personal fouls)   FT 1/1: MISS Giannis Banchero makes 0/1 from the line. Rebound secured by Jalen Rozier.
Score: 35-26

[10:20] Team_005 possession (Score: 35-26)
Brandon George attempts a 3Pt. Contested by Giannis Banchero (5.3 feet, ZONE). Brandon George misses. Rebound secured by Devin Butler.

[10:06] Team_029 possession (Score: 35-26)
Paul Iverson drives, picks up Brandon George. Help arrives from Anthony Rozier! Paul Iverson attempts a Layup. Contested by Anthony Rozier (4.2 feet, MAN). Paul Iverson misses. Offensive rebound by Devin Butler! Devin Butler kicks it out.

[09:52] Team_029 possession (Score: 35-26)
Giannis Banchero drives, Derrick Allen stays with him. Giannis Banchero attempts a Dunk. Contested by Derrick Allen (2.7 feet, MAN). GIANNIS BANCHERO MAKES IT! Assist: Scottie Bird
Score: 35-28

[09:39] Team_005 possession (Score: 35-28)
FOUL! Shooting foul on James Wall. Brandon George to the line for 2 free throws. [Team fouls: 2] (James Wall: 2 personal fouls)   FT 1/2: GOOD   FT 2/2: GOOD Brandon George makes 2/2 from the line.
Score: 37-28

[09:30] Team_029 possession (Score: 37-28)
Paul Iverson drives, Cade Markkanen stays with him. Paul Iverson attempts a Layup. Wide open! Cade Markkanen is 6.1 feet away. [ZONE] Paul Iverson misses. Rebound secured by Cade Markkanen.

[09:13] Team_005 possession (Score: 37-28)
Cade Markkanen attempts a Midrange. Contested by James Wall (2.8 feet, ZONE). Cade Markkanen misses. Rebound secured by Giannis Banchero.

[09:01] Team_029 possession (Score: 37-28)
FOUL! Reach-in foul on Cade Markkanen during the drive. [Team fouls: 3] No free throws, side out. (Cade Markkanen: 2 personal fouls)

[08:46] Team_029 possession (Score: 37-28)
Paul Iverson attempts a Midrange. Contested by Brandon George (3.9 feet, MAN). Paul Iverson misses. Rebound secured by Jalen Rozier.

[08:33] Team_005 possession (Score: 37-28)
Brandon George attempts a Midrange. Contested by Giannis Banchero (5.7 feet, ZONE). Brandon George misses. Offensive rebound by Cade Markkanen! Cade Markkanen kicks it out.

[08:23] Team_005 possession (Score: 37-28)
Anthony Rozier attempts a 3Pt. Wide open! Giannis Banchero is 7.3 feet away. [ZONE] Anthony Rozier misses. Rebound secured by Devin Butler.

[08:10] Team_029 possession (Score: 37-28)
Giannis Banchero attempts a 3Pt. Contested by Derrick Allen (3.4 feet, ZONE). Giannis Banchero misses. Rebound secured by Cade Markkanen.

[07:52] Team_005 possession (Score: 37-28)
Brandon George attempts a Midrange. Wide open! Paul Iverson is 7.0 feet away. [MAN] Brandon George misses. Rebound secured by Giannis Banchero.

[07:36] Team_029 possession (Score: 37-28)
James Wall makes the Layup and draws the foul on Jalen Rozier! And-1! James Wall to the line for 1. [Team fouls: 4] (Jalen Rozier: 1 personal fouls)   FT 1/1: GOOD James Wall makes 1/1 from the line.
Score: 37-31

[07:25] Team_005 possession (Score: 37-31)
Jalen Rozier attempts a Midrange. Contested by Giannis Banchero (5.3 feet, ZONE). JALEN ROZIER MAKES IT!
Score: 39-31

[07:14] Team_029 possession (Score: 39-31)
James Wall drives, Jalen Rozier stays with him. James Wall attempts a Dunk. Contested by Jalen Rozier (4.4 feet, MAN). James Wall misses. Offensive rebound by James Wall! James Wall puts it back in!
Score: 39-33

[07:03] Team_005 possession (Score: 39-33)
Anthony Rozier attempts a 3Pt. Contested by Scottie Bird (3.6 feet, MAN). Anthony Rozier misses. Rebound secured by Giannis Banchero.

[06:51] Team_029 possession (Score: 39-33)
Paul Iverson attempts a 3Pt. Wide open! Brandon George is 10.0 feet away. [MAN] PAUL IVERSON MAKES IT! Assist: James Wall
Score: 39-36

[06:33] Team_005 possession (Score: 39-36)
Brandon George attempts a Midrange. Contested by Paul Iverson (2.5 feet, MAN). Brandon George misses. Rebound secured by Devin Butler.

[06:19] Team_029 possession (Score: 39-36)
Scottie Bird makes the Midrange and draws the foul on Anthony Rozier! And-1! Scottie Bird to the line for 1. [BONUS: 5 team fouls] (Anthony Rozier: 1 personal fouls)   FT 1/1: GOOD Scottie Bird makes 1/1 from the line.
Score: 39-39

[06:08] Team_005 possession (Score: 39-39)
Cade Markkanen drives, picks up James Wall. Help arrives from Scottie Bird! Cade Markkanen attempts a Layup. Contested by Scottie Bird (2.8 feet, ZONE). Cade Markkanen misses. Rebound secured by James Wall.

[05:55] Team_029 possession (Score: 39-39)
FOUL! Shooting foul on Anthony Rozier. Devin Butler to the line for 2 free throws. [BONUS: 6 team fouls] (Anthony Rozier: 2 personal fouls)   FT 1/2: MISS   FT 2/2: GOOD Devin Butler makes 1/2 from the line.
Score: 39-40

[05:45] Team_005 possession (Score: 39-40)
Jalen Rozier attempts a Midrange. Contested by James Wall (5.5 feet, MAN). Jalen Rozier misses. Rebound secured by Giannis Banchero.

[05:26] Team_029 possession (Score: 39-40)
Paul Iverson attempts a 3Pt. Wide open! Brandon George is 8.1 feet away. [MAN] PAUL IVERSON MAKES IT! Assist: Scottie Bird
Score: 39-43

[05:08] Team_005 possession (Score: 39-43)
Jalen Rozier attempts a Layup. Contested by James Wall (4.1 feet, MAN). Jalen Rozier misses. Offensive rebound by Cade Markkanen! Cade Markkanen kicks it out.

[04:51] Team_005 possession (Score: 39-43)
Jalen Rozier drives and kicks out. Derrick Allen attempts a 3Pt. Contested by Giannis Banchero (5.9 feet, ZONE). Derrick Allen misses. Rebound secured by James Wall.

[04:35] Team_029 possession (Score: 39-43)
Devin Butler attempts a 3Pt. Wide open! Brandon George is 6.6 feet away. [ZONE] Devin Butler misses. Rebound secured by Cade Markkanen.

[04:17] Team_005 possession (Score: 39-43)
Anthony Rozier drives to the basket... Anthony Rozier throws a bad pass! Stolen by Scottie Bird! TURNOVER! (live ball)

[03:59] Team_029 possession (Score: 39-43)
Paul Iverson attempts a 3Pt. Contested by Brandon George (5.2 feet, MAN). Paul Iverson misses. Rebound secured by Cade Markkanen.

[03:45] Team_005 possession (Score: 39-43)
Brandon George throws a bad pass! Stolen by Paul Iverson! TURNOVER! (live ball)

[03:34] Team_029 possession (Score: 39-43)
James Wall attempts a Layup. Wide open! Jalen Rozier is 10.0 feet away. [MAN] JAMES WALL MAKES IT!
Score: 39-45

[03:15] Team_005 possession (Score: 39-45)
Cade Markkanen drives, picks up Devin Butler. Help arrives from Scottie Bird! Cade Markkanen attempts a Layup. Wide open! Scottie Bird is 6.5 feet away. [MAN] CADE MARKKANEN MAKES IT! Assist: Anthony Rozier
Score: 41-45

[03:01] Team_029 possession (Score: 41-45)
Devin Butler drives to the basket... Devin Butler loses the ball! Stripped by Cade Markkanen! TURNOVER! (live ball)

[02:44] Team_005 possession (Score: 41-45)
Jalen Rozier drives to the basket... Jalen Rozier commits a violation (traveling/carry)! TURNOVER! (dead ball)

[02:44] Substitution (Team_005): Brandon George OUT → Blake O'Neal IN (stamina_rule2)

[02:44] Substitution (Team_005): Anthony Rozier OUT → Draymond Smith IN (stamina_rule2)

[02:44] Substitution (Team_005): Derrick Allen OUT → Lauri Wade IN (stamina_rule2)

[02:44] Substitution (Team_005): Jalen Rozier OUT → Isaiah Durant IN (stamina_rule2)

[02:44] Substitution (Team_005): Cade Markkanen OUT → Zion Parker IN (stamina_rule2)

[02:44] Substitution (Team_029): Paul Iverson OUT → Immanuel Irving IN (stamina_rule2)

[02:44] Substitution (Team_029): Scottie Bird OUT → Bones Carter IN (stamina_rule2)

[02:44] Substitution (Team_029): Giannis Banchero OUT → Pau Anthony IN (stamina_rule2)

[02:44] Substitution (Team_029): James Wall OUT → Derrick Rozier IN (stamina_rule2)

[02:44] Substitution (Team_029): Devin Butler OUT → Shai Ball IN (stamina_rule2)

[02:29] Team_029 possession (Score: 41-45)
FOUL! Reach-in foul on Zion Parker during the drive. [IN THE BONUS! 7 team fouls] Pau Anthony to the line for 2 free throws. (Zion Parker: 1 personal fouls)   FT 1/2: GOOD   FT 2/2: MISS Pau Anthony makes 1/2 from the line. Rebound secured by Lauri Wade.
Score: 41-46

[02:13] Team_005 possession (Score: 41-46)
Blake O'Neal attempts a Midrange. Heavily contested by Immanuel Irving (1.1 feet, MAN)! BLAKE O'NEAL MAKES IT! Assist: Isaiah Durant
Score: 43-46

[02:01] Team_029 possession (Score: 43-46)
Shai Ball drives and kicks out. Derrick Rozier attempts a Midrange. Contested by Isaiah Durant (2.8 feet, MAN). Derrick Rozier misses. Offensive rebound by Pau Anthony! Pau Anthony kicks it out.

[01:44] Team_029 possession (Score: 43-46)
Derrick Rozier attempts a Layup. Contested by Zion Parker (3.3 feet, ZONE). DERRICK ROZIER MAKES IT! Assist: Immanuel Irving
Score: 43-48

[01:30] Team_005 possession (Score: 43-48)
Isaiah Durant attempts a 3Pt. Contested by Derrick Rozier (4.2 feet, MAN). Isaiah Durant misses. Rebound secured by Shai Ball.

[01:18] Team_029 possession (Score: 43-48)
Shai Ball attempts a 3Pt. Heavily contested by Blake O'Neal (1.6 feet, ZONE)! Shai Ball misses. Offensive rebound by Derrick Rozier! Derrick Rozier kicks it out.

[01:00] Team_029 possession (Score: 43-48)
Derrick Rozier drives and kicks out. Shai Ball attempts a Midrange. Contested by Lauri Wade (4.8 feet, ZONE). SHAI BALL MAKES IT! Assist: Immanuel Irving
Score: 43-50

[00:44] Team_005 possession (Score: 43-50)
Draymond Smith attempts a 3Pt. Contested by Pau Anthony (4.5 feet, ZONE). Draymond Smith misses. Rebound secured by Pau Anthony.

[00:29] Team_029 possession (Score: 43-50)
Immanuel Irving attempts a 3Pt. Contested by Blake O'Neal (5.6 feet, MAN). Immanuel Irving misses. Rebound secured by Zion Parker.

[00:14] Team_005 possession (Score: 43-50)
FOUL! Holding foul on Immanuel Irving. [Team fouls: 3] No free throws, side out. (Immanuel Irving: 1 personal fouls)

================================================================================
                              2ND QUARTER COMPLETE                              
================================================================================

2ND QUARTER SCORE: Team_005 11, Team_029 28

BOX SCORE:
================================================================================

Team_005
--------------------------------------------------------------------------------
Player                MIN  PTS  REB  AST  TO      FG   FG%      3P   3P%
--------------------------------------------------------------------------------
Anthony Rozier         22    3    0    1   0   1/4    25.0     0/0   0.0
Brandon George         22    2    0    0   0   1/5    20.0     0/0   0.0
Jalen Rozier           22    2    2    0   0   1/3    33.3     0/0   0.0
Cade Markkanen         22    2    6    0   0   1/3    33.3     0/0   0.0
Blake O'Neal            3    2    0    0   0   1/1   100.0     0/0   0.0
Derrick Allen          22    0    1    0   0   0/0     0.0     0/0   0.0
Lauri Wade              3    0    1    0   0   0/0     0.0     0/0   0.0
Isaiah Durant           3    0    0    1   0   0/1     0.0     0/0   0.0
Draymond Smith          3    0    0    0   0   0/1     0.0     0/0   0.0
Zion Parker             3    0    1    0   0   0/0     0.0     0/0   0.0

TEAM: FG: 5/18 (27.8%), 3PT: 0/7 (0.0%), REB: 11 (2 off, 9 def), AST: 2, TO: 3
TEAM FOULS: 7 [Team_029 in BONUS]


Team_029
--------------------------------------------------------------------------------
Player                MIN  PTS  REB  AST  TO      FG   FG%      3P   3P%
--------------------------------------------------------------------------------
James Wall             22    7    3    1   0   3/3   100.0     0/0   0.0
Paul Iverson           22    6    0    1   0   2/5    40.0     0/0   0.0
Devin Butler           22    3    4    0   0   2/4    50.0     0/0   0.0
Scottie Bird           22    3    0    2   0   1/1   100.0     0/0   0.0
Giannis Banchero       22    2    6    0   0   1/3    33.3     0/0   0.0
Derrick Rozier          3    2    1    0   0   1/1   100.0     0/0   0.0
Shai Ball               3    2    1    0   0   1/1   100.0     0/0   0.0
Pau Anthony             3    0    2    0   0   0/1     0.0     0/0   0.0
Immanuel Irving         3    0    0    2   0   0/1     0.0     0/0   0.0

TEAM: FG: 11/20 (55.0%), 3PT: 2/6 (33.3%), REB: 17 (4 off, 13 def), AST: 6, TO: 1
TEAM FOULS: 3

================================================================================

================================================================================
                       3RD QUARTER - Team_005 vs Team_029                       
================================================================================

[12:00] Team_005 possession (Score: 43-50)
Anthony Rozier attempts a Midrange. Contested by Scottie Bird (2.6 feet, MAN). Anthony Rozier misses. Rebound secured by James Wall.

[11:45] Team_029 possession (Score: 43-50)
Giannis Banchero attempts a 3Pt. Wide open! Derrick Allen is 8.2 feet away. [MAN] GIANNIS BANCHERO MAKES IT! Assist: Paul Iverson
Score: 43-53

[11:30] Team_005 possession (Score: 43-53)
Anthony Rozier attempts a Layup. Heavily contested by James Wall (0.5 feet, ZONE)! ANTHONY ROZIER MAKES IT! Assist: Cade Markkanen
Score: 45-53

[11:12] Team_029 possession (Score: 45-53)
FOUL! Reach-in foul on Cade Markkanen during the drive. [Team fouls: 1] No free throws, side out. (Cade Markkanen: 1 personal fouls)

[10:59] Team_029 possession (Score: 45-53)
Scottie Bird attempts a Midrange. Contested by Anthony Rozier (5.9 feet, MAN). Scottie Bird misses. Offensive rebound by James Wall! James Wall puts it back in!
Score: 45-55

[10:47] Team_005 possession (Score: 45-55)
Derrick Allen drives and kicks out. Cade Markkanen attempts a Midrange. BLOCKED BY SCOTTIE BIRD! Ball is loose! Offensive rebound by Cade Markkanen! Cade Markkanen kicks it out.

[10:35] Team_005 possession (Score: 45-55)
Anthony Rozier loses control! Ball rolls out of bounds! TURNOVER! (dead ball)

[10:24] Team_029 possession (Score: 45-55)
Scottie Bird attempts a 3Pt. Wide open! Anthony Rozier is 7.1 feet away. [MAN] SCOTTIE BIRD MAKES IT! Assist: James Wall
Score: 45-58

[10:10] Team_005 possession (Score: 45-58)
Derrick Allen attempts a 3Pt. Contested by Giannis Banchero (2.9 feet, ZONE). Derrick Allen misses. Offensive rebound by Jalen Rozier! Jalen Rozier kicks it out.

[09:50] Team_005 possession (Score: 45-58)
Brandon George drives, picks up Paul Iverson. Help arrives from Scottie Bird! Brandon George attempts a Layup. Contested by Scottie Bird (5.0 feet, MAN). BRANDON GEORGE MAKES IT! Assist: Derrick Allen
Score: 47-58

[09:39] Team_029 possession (Score: 47-58)
Devin Butler drives and kicks out. Giannis Banchero attempts a Midrange. Wide open! Cade Markkanen is 6.6 feet away. [ZONE] Giannis Banchero misses. Rebound secured by Cade Markkanen.

[09:27] Team_005 possession (Score: 47-58)
Cade Markkanen makes the Layup and draws the foul on Scottie Bird! And-1! Cade Markkanen to the line for 1. [Team fouls: 1] (Scottie Bird: 1 personal fouls)   FT 1/1: GOOD Cade Markkanen makes 1/1 from the line.
Score: 50-58

[09:16] Team_029 possession (Score: 50-58)
Paul Iverson attempts a 3Pt. Wide open! Jalen Rozier is 6.7 feet away. [ZONE] PAUL IVERSON MAKES IT! Assist: Scottie Bird
Score: 50-61

[08:58] Team_005 possession (Score: 50-61)
Jalen Rozier attempts a Midrange. Contested by James Wall (3.6 feet, MAN). Jalen Rozier misses. Rebound secured by Devin Butler.

[08:42] Team_029 possession (Score: 50-61)
Giannis Banchero attempts a Midrange. Contested by Derrick Allen (4.0 feet, MAN). Giannis Banchero misses. Rebound secured by Derrick Allen.

[08:27] Team_005 possession (Score: 50-61)
Cade Markkanen drives, James Wall stays with him. Cade Markkanen attempts a Dunk. Wide open! James Wall is 6.5 feet away. [ZONE] CADE MARKKANEN MAKES IT! Assist: Anthony Rozier
Score: 52-61

[08:12] Team_029 possession (Score: 52-61)
James Wall drives to the basket... FOUL! Offensive foul on James Wall! Cade Markkanen drew the charge! [Team fouls: 2] (James Wall: 1 personal fouls) TURNOVER! (dead ball)

[08:01] Team_005 possession (Score: 52-61)
Cade Markkanen attempts a Midrange. Contested by Scottie Bird (2.7 feet, ZONE). CADE MARKKANEN MAKES IT! Assist: Anthony Rozier
Score: 54-61

[07:43] Team_029 possession (Score: 54-61)
FOUL! Reach-in foul on Cade Markkanen during the drive. [Team fouls: 2] No free throws, side out. (Cade Markkanen: 2 personal fouls)

[07:28] Team_029 possession (Score: 54-61)
Devin Butler drives to the basket... FOUL! Offensive foul on Devin Butler! Cade Markkanen drew the charge! [Team fouls: 3] (Devin Butler: 1 personal fouls) TURNOVER! (dead ball)

[07:11] Team_005 possession (Score: 54-61)
Cade Markkanen attempts a Midrange. Heavily contested by Scottie Bird (0.5 feet, ZONE)! Cade Markkanen misses. FOUL! Loose ball foul on James Wall during the rebound battle. [Team fouls: 4] No free throws, side out. (James Wall: 2 personal fouls)

[06:56] Team_005 possession (Score: 54-61)
Jalen Rozier makes the Layup and draws the foul on Scottie Bird! And-1! Jalen Rozier to the line for 1. [BONUS: 5 team fouls] (Scottie Bird: 2 personal fouls)   FT 1/1: GOOD Jalen Rozier makes 1/1 from the line.
Score: 57-61

[06:42] Team_029 possession (Score: 57-61)
Giannis Banchero drives and kicks out. Giannis Banchero attempts a 3Pt. Heavily contested by Derrick Allen (2.0 feet, ZONE)! Giannis Banchero misses. Rebound secured by Derrick Allen.

[06:27] Team_005 possession (Score: 57-61)
Cade Markkanen drives and kicks out. Anthony Rozier attempts a 3Pt. Contested by Giannis Banchero (5.2 feet, ZONE). Anthony Rozier misses. Rebound secured by Devin Butler.

[06:11] Team_029 possession (Score: 57-61)
Scottie Bird drives, Anthony Rozier stays with him. Scottie Bird attempts a Dunk. Wide open! Anthony Rozier is 7.6 feet away. [MAN] SCOTTIE BIRD MAKES IT! Assist: Paul Iverson
Score: 57-63

[05:51] Team_005 possession (Score: 57-63)
Brandon George attempts a 3Pt. Wide open! Paul Iverson is 9.0 feet away. [MAN] Brandon George misses. Rebound secured by Giannis Banchero.

[05:33] Team_029 possession (Score: 57-63)
Paul Iverson makes the 3Pt and draws the foul on Brandon George! And-1! Paul Iverson to the line for 1. [Team fouls: 3] (Brandon George: 1 personal fouls)   FT 1/1: GOOD Paul Iverson makes 1/1 from the line.
Score: 57-67

[05:23] Team_005 possession (Score: 57-67)
FOUL! Reach-in foul on Giannis Banchero during the drive. [IN THE BONUS! 6 team fouls] Derrick Allen to the line for 2 free throws. (Giannis Banchero: 1 personal fouls)   FT 1/2: GOOD   FT 2/2: GOOD Derrick Allen makes 2/2 from the line.
Score: 59-67

[05:06] Team_029 possession (Score: 59-67)
FOUL! Offensive foul on James Wall! Cade Markkanen drew the charge! [Team fouls: 7] (James Wall: 3 personal fouls) TURNOVER! (dead ball)

[04:54] Team_005 possession (Score: 59-67)
Brandon George attempts a 3Pt. Contested by Giannis Banchero (3.9 feet, ZONE). BRANDON GEORGE MAKES IT!
Score: 62-67

[04:42] Team_029 possession (Score: 62-67)
Devin Butler throws a bad pass out of bounds! TURNOVER! (dead ball)

[04:23] Team_005 possession (Score: 62-67)
Derrick Allen attempts a Midrange. Contested by Giannis Banchero (4.6 feet, ZONE). Derrick Allen misses. Rebound secured by Giannis Banchero.

[04:11] Team_029 possession (Score: 62-67)
Paul Iverson attempts a Layup. BLOCKED BY CADE MARKKANEN! Ball is loose! Rebound secured by Jalen Rozier.

[03:56] Team_005 possession (Score: 62-67)
Brandon George attempts a 3Pt. Contested by Giannis Banchero (3.8 feet, ZONE). Brandon George misses. Rebound secured by James Wall.

[03:39] Team_029 possession (Score: 62-67)
James Wall attempts a 3Pt. Wide open! Jalen Rozier is 6.5 feet away. [MAN] James Wall misses. Rebound secured by Derrick Allen.

[03:26] Team_005 possession (Score: 62-67)
Cade Markkanen attempts a Layup. Wide open! James Wall is 6.1 feet away. [ZONE] Cade Markkanen misses. Rebound secured by Devin Butler.

[03:12] Team_029 possession (Score: 62-67)
Scottie Bird drives, Cade Markkanen stays with him. Scottie Bird attempts a Layup. Contested by Cade Markkanen (5.7 feet, ZONE). SCOTTIE BIRD MAKES IT! Assist: James Wall
Score: 62-69

[02:56] Team_005 possession (Score: 62-69)
Brandon George attempts a 3Pt. Wide open! Giannis Banchero is 6.2 feet away. [ZONE] Brandon George misses. Rebound secured by James Wall.

[02:40] Team_029 possession (Score: 62-69)
James Wall attempts a Layup. Contested by Jalen Rozier (5.2 feet, MAN). James Wall misses. Rebound secured by Derrick Allen.

[02:25] Team_005 possession (Score: 62-69)
Jalen Rozier attempts a Layup. BLOCKED BY JAMES WALL! Ball is loose! Rebound secured by James Wall.

[02:08] Team_029 possession (Score: 62-69)
Giannis Banchero attempts a 3Pt. Contested by Derrick Allen (3.3 feet, ZONE). Giannis Banchero misses. FOUL! Loose ball foul on Jalen Rozier during the rebound battle. [Team fouls: 4] No free throws, side out. (Jalen Rozier: 1 personal fouls)

[01:50] Team_029 possession (Score: 62-69)
FOUL! Reach-in foul on Anthony Rozier during the drive. [IN THE BONUS! 5 team fouls] Scottie Bird to the line for 2 free throws. (Anthony Rozier: 1 personal fouls)   FT 1/2: GOOD   FT 2/2: GOOD Scottie Bird makes 2/2 from the line.
Score: 62-71

[01:37] Team_005 possession (Score: 62-71)
Derrick Allen attempts a 3Pt. Contested by Giannis Banchero (4.3 feet, MAN). Derrick Allen misses. FOUL! Loose ball foul on James Wall during the rebound battle. [IN THE BONUS! 8 team fouls] Jalen Rozier to the line for 2 free throws. (James Wall: 4 personal fouls)   FT 1/2: GOOD   FT 2/2: GOOD Jalen Rozier makes 2/2 from the line.
Score: 64-71

[01:23] Team_029 possession (Score: 64-71)
Scottie Bird attempts a Layup. BLOCKED BY ANTHONY ROZIER! Ball deflects out of bounds off Scottie Bird.

[01:09] Team_005 possession (Score: 64-71)
Derrick Allen attempts a Layup. BLOCKED BY SCOTTIE BIRD! Ball is loose! Rebound secured by Devin Butler.

[00:55] Team_029 possession (Score: 64-71)
Giannis Banchero drives and kicks out. Giannis Banchero attempts a 3Pt. Contested by Derrick Allen (4.6 feet, MAN). Giannis Banchero misses. FOUL! Loose ball foul on Cade Markkanen during the rebound battle. [IN THE BONUS! 6 team fouls] Devin Butler to the line for 2 free throws. (Cade Markkanen: 3 personal fouls)   FT 1/2: GOOD   FT 2/2: GOOD Devin Butler makes 2/2 from the line.
Score: 64-73

[00:43] Team_005 possession (Score: 64-73)
Cade Markkanen attempts a Midrange. Contested by Devin Butler (4.8 feet, MAN). Cade Markkanen misses. Rebound secured by James Wall.

[00:27] Team_029 possession (Score: 64-73)
FOUL! Shooting foul on Cade Markkanen. James Wall to the line for 2 free throws. [BONUS: 7 team fouls] (Cade Markkanen: 4 personal fouls)   FT 1/2: GOOD   FT 2/2: GOOD James Wall makes 2/2 from the line.
Score: 64-75

[00:15] Team_005 possession (Score: 64-75)
Anthony Rozier attempts a Midrange. Contested by Scottie Bird (3.6 feet, MAN). Anthony Rozier misses. Rebound secured by Giannis Banchero.

================================================================================
                              3RD QUARTER COMPLETE                              
================================================================================

3RD QUARTER SCORE: Team_005 21, Team_029 25

BOX SCORE:
================================================================================

Team_005
--------------------------------------------------------------------------------
Player                MIN  PTS  REB  AST  TO      FG   FG%      3P   3P%
--------------------------------------------------------------------------------
Cade Markkanen         34    7    3    1   0   3/6    50.0     0/0   0.0
Jalen Rozier           34    5    2    0   0   2/4    50.0     0/0   0.0
Brandon George         34    5    0    0   0   2/5    40.0     0/0   0.0
Anthony Rozier         34    2    0    2   0   1/3    33.3     0/0   0.0
Derrick Allen          34    2    4    1   0   1/3    33.3     0/0   0.0

TEAM: FG: 9/21 (42.9%), 3PT: 2/5 (40.0%), REB: 9 (3 off, 6 def), AST: 4, TO: 1
TEAM FOULS: 7 [Team_029 in BONUS]


Team_029
--------------------------------------------------------------------------------
Player                MIN  PTS  REB  AST  TO      FG   FG%      3P   3P%
--------------------------------------------------------------------------------
Scottie Bird           34    9    0    1   0   4/5    80.0     0/0   0.0
Paul Iverson           34    7    0    2   0   2/3    66.7     0/0   0.0
James Wall             34    4    6    2   0   2/4    50.0     0/0   0.0
Giannis Banchero       34    3    3    0   0   1/3    33.3     0/0   0.0
Devin Butler           34    2    5    0   0   1/2    50.0     0/0   0.0

TEAM: FG: 10/17 (58.8%), 3PT: 4/5 (80.0%), REB: 14 (2 off, 12 def), AST: 5, TO: 4
TEAM FOULS: 8 [Team_005 in BONUS]

================================================================================

================================================================================
                       4TH QUARTER - Team_005 vs Team_029                       
================================================================================

[12:00] Substitution (Team_005): Brandon George OUT (stamina: 67) → Blake O'Neal IN (comeback_detected)

[12:00] Substitution (Team_029): Paul Iverson OUT (stamina: 71) → Immanuel Irving IN (comeback_detected)

[12:00] Team_005 possession (Score: 64-75)
Derrick Allen makes the Dunk and draws the foul on Scottie Bird! And-1! Derrick Allen to the line for 1. [Team fouls: 1] (Scottie Bird: 1 personal fouls)   FT 1/1: GOOD Derrick Allen makes 1/1 from the line.
Score: 67-75

[11:46] Team_029 possession (Score: 67-75)
James Wall makes the Layup and draws the foul on Jalen Rozier! And-1! James Wall to the line for 1. [Team fouls: 1] (Jalen Rozier: 1 personal fouls)   FT 1/1: GOOD James Wall makes 1/1 from the line.
Score: 67-78

[11:33] Team_005 possession (Score: 67-78)
Blake O'Neal attempts a 3Pt. Contested by Immanuel Irving (5.0 feet, ZONE). Blake O'Neal misses. Rebound secured by Giannis Banchero.

[11:14] Team_029 possession (Score: 67-78)
Immanuel Irving attempts a Layup. Contested by Blake O'Neal (5.4 feet, MAN). IMMANUEL IRVING MAKES IT! Assist: Giannis Banchero
Score: 67-80

[11:03] Team_005 possession (Score: 67-80)
Derrick Allen attempts a 3Pt. Contested by Giannis Banchero (2.2 feet, MAN). Derrick Allen misses. Rebound secured by Devin Butler.

[10:48] Team_029 possession (Score: 67-80)
James Wall drives to the basket... FOUL! Offensive foul on James Wall! Cade Markkanen drew the charge! [Team fouls: 2] (James Wall: 1 personal fouls) TURNOVER! (dead ball)

[10:32] Team_005 possession (Score: 67-80)
FOUL! Shooting foul on James Wall. Derrick Allen to the line for 2 free throws. [Team fouls: 3] (James Wall: 2 personal fouls)   FT 1/2: GOOD   FT 2/2: GOOD Derrick Allen makes 2/2 from the line.
Score: 69-80

[10:18] Team_029 possession (Score: 69-80)
Giannis Banchero attempts a 3Pt. Contested by Derrick Allen (2.9 feet, MAN). Giannis Banchero misses. Rebound secured by Jalen Rozier.

[10:07] Team_005 possession (Score: 69-80)
Derrick Allen attempts a 3Pt. Contested by Giannis Banchero (4.4 feet, MAN). Derrick Allen misses. Rebound secured by James Wall.

[09:56] Team_029 possession (Score: 69-80)
James Wall drives, Cade Markkanen stays with him. James Wall attempts a Layup. Contested by Cade Markkanen (5.7 feet, ZONE). JAMES WALL MAKES IT! Assist: Scottie Bird
Score: 69-82

[09:40] Team_005 possession (Score: 69-82)
Jalen Rozier attempts a 3Pt. Heavily contested by James Wall (0.5 feet, MAN)! Jalen Rozier misses. Offensive rebound by Cade Markkanen! Cade Markkanen kicks it out.

[09:29] Team_005 possession (Score: 69-82)
Jalen Rozier attempts a 3Pt. Contested by James Wall (3.3 feet, MAN). Jalen Rozier misses. Rebound secured by Giannis Banchero.

[09:16] Team_029 possession (Score: 69-82)
Giannis Banchero attempts a Layup. Contested by Derrick Allen (5.4 feet, MAN). Giannis Banchero misses. Rebound secured by Jalen Rozier.

[08:58] Team_005 possession (Score: 69-82)
Derrick Allen attempts a 3Pt. Contested by Giannis Banchero (2.5 feet, MAN). Derrick Allen misses. Rebound secured by Giannis Banchero.

[08:43] Team_029 possession (Score: 69-82)
Immanuel Irving attempts a 3Pt. Contested by Blake O'Neal (2.3 feet, MAN). Immanuel Irving misses. Rebound secured by Blake O'Neal.

[08:27] Team_005 possession (Score: 69-82)
Jalen Rozier attempts a Midrange. Contested by James Wall (3.5 feet, MAN). Jalen Rozier misses. Offensive rebound by Blake O'Neal! Blake O'Neal kicks it out.

[08:14] Team_005 possession (Score: 69-82)
Blake O'Neal attempts a Midrange. Wide open! Immanuel Irving is 9.4 feet away. [MAN] Blake O'Neal misses. Offensive rebound by Cade Markkanen! Cade Markkanen kicks it out.

[07:58] Team_005 possession (Score: 69-82)
Jalen Rozier loses control! Ball rolls out of bounds! TURNOVER! (dead ball)

[07:58] Substitution (Team_005): Anthony Rozier OUT → Draymond Smith IN (stamina_rule2)

[07:58] Substitution (Team_005): Derrick Allen OUT → Lauri Wade IN (stamina_rule2)

[07:58] Substitution (Team_005): Jalen Rozier OUT → Isaiah Durant IN (stamina_rule2)

[07:58] Substitution (Team_005): Cade Markkanen OUT → Zion Parker IN (stamina_rule2)

[07:58] Substitution (Team_029): Scottie Bird OUT → Bones Carter IN (stamina_rule2)

[07:58] Substitution (Team_029): Giannis Banchero OUT → Pau Anthony IN (stamina_rule2)

[07:58] Substitution (Team_029): James Wall OUT → Derrick Rozier IN (stamina_rule2)

[07:58] Substitution (Team_029): Devin Butler OUT → Shai Ball IN (stamina_rule2)

[07:42] Team_029 possession (Score: 69-82)
FOUL! Reach-in foul on Isaiah Durant during the drive. [Team fouls: 2] No free throws, side out. (Isaiah Durant: 1 personal fouls)

[07:27] Team_029 possession (Score: 69-82)
FOUL! Shooting foul on Zion Parker. Bones Carter to the line for 2 free throws. [Team fouls: 3] (Zion Parker: 1 personal fouls)   FT 1/2: GOOD   FT 2/2: GOOD Bones Carter makes 2/2 from the line.
Score: 69-84

[07:15] Team_005 possession (Score: 69-84)
Zion Parker drives, Derrick Rozier stays with him. Zion Parker attempts a Dunk. Contested by Derrick Rozier (4.4 feet, ZONE). ZION PARKER MAKES IT!
Score: 71-84

[07:01] Team_029 possession (Score: 71-84)
Shai Ball attempts a Midrange. Contested by Zion Parker (5.2 feet, MAN). Shai Ball misses. Rebound secured by Zion Parker.

[06:50] Team_005 possession (Score: 71-84)
FOUL! Holding foul on Immanuel Irving. [Team fouls: 4] No free throws, side out. (Immanuel Irving: 1 personal fouls)

[06:35] Team_005 possession (Score: 71-84)
Isaiah Durant attempts a 3Pt. Contested by Pau Anthony (2.9 feet, ZONE). ISAIAH DURANT MAKES IT! Assist: Zion Parker
Score: 74-84

[06:21] Team_029 possession (Score: 74-84)
Bones Carter drives, Zion Parker stays with him. Bones Carter attempts a Dunk. Contested by Zion Parker (2.6 feet, ZONE). BONES CARTER MAKES IT! Assist: Derrick Rozier
Score: 74-86

[06:07] Team_005 possession (Score: 74-86)
Blake O'Neal attempts a 3Pt. Contested by Immanuel Irving (3.2 feet, MAN). BLAKE O'NEAL MAKES IT! Assist: Isaiah Durant
Score: 77-86

[05:50] Team_029 possession (Score: 77-86)
FOUL! Reach-in foul on Lauri Wade during the drive. [Team fouls: 4] No free throws, side out. (Lauri Wade: 1 personal fouls)

[05:37] Team_029 possession (Score: 77-86)
Bones Carter attempts a 3Pt. Wide open! Draymond Smith is 7.3 feet away. [MAN] Bones Carter misses. Rebound secured by Draymond Smith.

[05:21] Team_005 possession (Score: 77-86)
Zion Parker throws a bad pass out of bounds! TURNOVER! (dead ball)

[05:07] Team_029 possession (Score: 77-86)
FOUL! Offensive foul on Bones Carter! Draymond Smith drew the charge! [Team fouls: 5] (Bones Carter: 1 personal fouls) TURNOVER! (dead ball)

[04:53] Team_005 possession (Score: 77-86)
Zion Parker attempts a Midrange. Contested by Shai Ball (2.7 feet, MAN). Zion Parker misses. Rebound secured by Pau Anthony.

[04:41] Team_029 possession (Score: 77-86)
Bones Carter drives and kicks out. Immanuel Irving attempts a Midrange. Contested by Blake O'Neal (2.6 feet, MAN). IMMANUEL IRVING MAKES IT!
Score: 77-88

[04:24] Team_005 possession (Score: 77-88)
FOUL! Reach-in foul on Immanuel Irving during the drive. [IN THE BONUS! 6 team fouls] Blake O'Neal to the line for 2 free throws. (Immanuel Irving: 2 personal fouls)   FT 1/2: MISS   FT 2/2: GOOD Blake O'Neal makes 1/2 from the line.
Score: 78-88

[04:07] Team_029 possession (Score: 78-88)
Pau Anthony attempts a Midrange. Wide open! Lauri Wade is 6.2 feet away. [ZONE] Pau Anthony misses. Rebound secured by Lauri Wade.

[03:50] Team_005 possession (Score: 78-88)
Blake O'Neal attempts a Layup. Wide open! Immanuel Irving is 6.6 feet away. [MAN] BLAKE O'NEAL MAKES IT!
Score: 80-88

[03:35] Team_029 possession (Score: 80-88)
Pau Anthony drives to the basket... Pau Anthony throws a bad pass out of bounds! TURNOVER! (dead ball)

[03:17] Team_005 possession (Score: 80-88)
Blake O'Neal attempts a Midrange. Wide open! Immanuel Irving is 6.9 feet away. [MAN] BLAKE O'NEAL MAKES IT!
Score: 82-88

[03:03] Team_029 possession (Score: 82-88)
Shai Ball attempts a Layup. Contested by Zion Parker (2.1 feet, MAN). SHAI BALL MAKES IT! Assist: Immanuel Irving
Score: 82-90

[02:52] Team_005 possession (Score: 82-90)
Draymond Smith drives, picks up Bones Carter. Help arrives from Pau Anthony! Draymond Smith attempts a Dunk. Contested by Pau Anthony (5.0 feet, MAN). DRAYMOND SMITH MAKES IT! Assist: Lauri Wade
Score: 84-90

[02:40] Team_029 possession (Score: 84-90)
Immanuel Irving attempts a Midrange. Contested by Zion Parker (3.0 feet, ZONE). Immanuel Irving misses. Offensive rebound by Pau Anthony! Pau Anthony kicks it out.

[02:24] Team_029 possession (Score: 84-90)
Shai Ball attempts a Midrange. Contested by Lauri Wade (5.9 feet, ZONE). Shai Ball misses. Rebound secured by Draymond Smith.

[02:05] Team_005 possession (Score: 84-90)
Isaiah Durant attempts a Midrange. Contested by Bones Carter (5.9 feet, ZONE). Isaiah Durant misses. Rebound secured by Derrick Rozier.

[01:49] Team_029 possession (Score: 84-90)
FOUL! Holding foul on Draymond Smith. [IN THE BONUS! 5 team fouls] Bones Carter to the line for 2 free throws. (Draymond Smith: 1 personal fouls)   FT 1/2: MISS   FT 2/2: GOOD Bones Carter makes 1/2 from the line.
Score: 84-91

[01:35] Team_005 possession (Score: 84-91)
FOUL! Offensive foul on Blake O'Neal! Immanuel Irving drew the charge! [Team fouls: 6] (Blake O'Neal: 1 personal fouls) TURNOVER! (dead ball)

[01:24] Team_029 possession (Score: 84-91)
Shai Ball drives, Zion Parker stays with him. Shai Ball attempts a Dunk. Wide open! Zion Parker is 6.0 feet away. [MAN] SHAI BALL MAKES IT!
Score: 84-93

[01:09] Team_005 possession (Score: 84-93)
Blake O'Neal attempts a Midrange. Wide open! Immanuel Irving is 6.7 feet away. [MAN] BLAKE O'NEAL MAKES IT!
Score: 86-93

[00:55] Team_029 possession (Score: 86-93)
Bones Carter attempts a Layup. Wide open! Draymond Smith is 6.2 feet away. [MAN] BONES CARTER MAKES IT! Assist: Immanuel Irving
Score: 86-95

[00:43] Team_005 possession (Score: 86-95)
Draymond Smith drives and kicks out. Isaiah Durant attempts a Midrange. Contested by Bones Carter (3.0 feet, ZONE). Isaiah Durant misses. Rebound secured by Derrick Rozier.

[00:27] Team_029 possession (Score: 86-95)
Immanuel Irving attempts a 3Pt. Contested by Blake O'Neal (2.4 feet, ZONE). IMMANUEL IRVING MAKES IT! Assist: Shai Ball
Score: 86-98

[00:10] Team_005 possession (Score: 86-98)
Lauri Wade attempts a 3Pt. Contested by Pau Anthony (3.2 feet, ZONE). LAURI WADE MAKES IT! Assist: Isaiah Durant
Score: 89-98

================================================================================
                              4TH QUARTER COMPLETE                              
================================================================================

4TH QUARTER SCORE: Team_005 25, Team_029 23

BOX SCORE:
================================================================================

Team_005
--------------------------------------------------------------------------------
Player                MIN  PTS  REB  AST  TO      FG   FG%      3P   3P%
--------------------------------------------------------------------------------
Blake O'Neal           15   10    2    0   0   5/6    83.3     0/0   0.0
Derrick Allen          38    5    0    0   0   2/5    40.0     0/0   0.0
Isaiah Durant          10    3    0    2   0   1/2    50.0     0/0   0.0
Lauri Wade             10    3    1    1   0   1/1   100.0     0/0   0.0
Zion Parker            10    2    1    1   0   1/2    50.0     0/0   0.0
Draymond Smith         10    2    2    0   0   1/2    50.0     0/0   0.0
Jalen Rozier           38    0    2    0   0   0/1     0.0     0/0   0.0
Cade Markkanen         38    0    2    0   0   0/0     0.0     0/0   0.0

TEAM: FG: 11/19 (57.9%), 3PT: 3/8 (37.5%), REB: 10 (3 off, 7 def), AST: 4, TO: 3
TEAM FOULS: 6 [Team_029 in BONUS]


Team_029
--------------------------------------------------------------------------------
Player                MIN  PTS  REB  AST  TO      FG   FG%      3P   3P%
--------------------------------------------------------------------------------
Immanuel Irving        15    7    0    2   0   3/4    75.0     0/0   0.0
Bones Carter           10    7    0    0   0   4/5    80.0     0/0   0.0
James Wall             38    5    1    0   0   2/2   100.0     0/0   0.0
Shai Ball              10    4    0    1   0   2/4    50.0     0/0   0.0
Giannis Banchero       38    0    3    1   0   0/2     0.0     0/0   0.0
Devin Butler           38    0    1    0   0   0/0     0.0     0/0   0.0
Scottie Bird           38    0    0    1   0   0/0     0.0     0/0   0.0
Derrick Rozier         10    0    2    1   0   0/0     0.0     0/0   0.0
Pau Anthony            10    0    2    0   0   0/1     0.0     0/0   0.0

TEAM: FG: 11/18 (61.1%), 3PT: 1/4 (25.0%), REB: 9 (1 off, 8 def), AST: 6, TO: 3
TEAM FOULS: 6 [Team_005 in BONUS]

================================================================================

================================================================================
                               FULL GAME COMPLETE                               
================================================================================

FINAL SCORE: Team_005 89, Team_029 98

SCORING BY QUARTER:
--------------------------------------------------------------------------------
Team                     Q1     Q2     Q3     Q4    FINAL
--------------------------------------------------------------------------------
Team_005                 32     11     21     25       89
Team_029                 22     28     25     23       98
--------------------------------------------------------------------------------

FULL GAME BOX SCORE:
================================================================================

Team_005
--------------------------------------------------------------------------------
Player                MIN  PTS  REB  AST  TO      FG   FG%      3P   3P%      FT STL BLK
--------------------------------------------------------------------------------
Anthony Rozier         38   11    0    6   2   5/13   38.5   0/4     0.0   1/1     0   1
Derrick Allen          38   12    8    2   1   6/12   50.0   1/4    25.0   6/6     0   0
Jalen Rozier           38   10   12    1   1   3/10   30.0   0/1     0.0   4/4     0   0
Cade Markkanen         38   20   14    2   2   9/16   56.2   0/0     0.0   2/2     1   1
Brandon George         34   14    0    1   1   6/13   46.2   2/7    28.6   2/2     0   0
Blake O'Neal           15   12    2    0   1   6/7    85.7   1/2    50.0   1/2     0   0
Draymond Smith         10    2    2    0   0   1/3    33.3   0/1     0.0   0/0     0   0
Lauri Wade             10    3    2    1   0   1/1   100.0   1/1   100.0   0/0     0   0
Isaiah Durant          10    3    0    3   0   1/3    33.3   1/2    50.0   0/0     0   0
Zion Parker            10    2    2    1   1   1/2    50.0   0/0     0.0   0/0     0   0

TEAM: FG: 39/80 (48.8%), 3PT: 6/22 (27.3%), REB: 41 (8 off, 33 def), AST: 17, TO: 9


Team_029
--------------------------------------------------------------------------------
Player                MIN  PTS  REB  AST  TO      FG   FG%      3P   3P%      FT STL BLK
--------------------------------------------------------------------------------
Scottie Bird           38   16    0    4   1   8/11   72.7   1/1   100.0   3/3     1   3
Giannis Banchero       38   10   15    2   0   5/14   35.7   2/6    33.3   2/3     0   0
James Wall             38   23   13    4   4   9/15   60.0   0/2     0.0   5/5     1   1
Devin Butler           38    8   12    0   2   3/8    37.5   1/2    50.0   3/4     1   0
Paul Iverson           34   16    0    5   2   5/10   50.0   5/7    71.4   1/1     1   0
Immanuel Irving        15    7    0    4   0   2/4    50.0   1/3    33.3   0/0     0   0
Bones Carter           10    7    0    0   1   4/5    80.0   0/1     0.0   3/4     0   0
Pau Anthony            10    0    4    0   0   0/2     0.0   0/0     0.0   1/2     0   0
Derrick Rozier         10    2    3    1   0   2/2   100.0   0/0     0.0   0/0     0   0
Shai Ball              10    6    1    1   1   2/4    50.0   0/0     0.0   0/0     0   0

TEAM: FG: 41/76 (53.9%), 3PT: 10/22 (45.5%), REB: 49 (8 off, 41 def), AST: 21, TO: 11

================================================================================
