================================================================================
                        FULL GAME - Team_037 vs Team_076                        
================================================================================

================================================================================
                       1ST QUARTER - Team_037 vs Team_076                       
================================================================================

[12:00] Team_037 possession (Score: 0-0)
FOUL! Reach-in foul on D'Angelo Tatum during the drive. [Team fouls: 1] No free throws, side out. (D'Angelo Tatum: 1 personal fouls)

[11:47] Team_037 possession (Score: 0-0)
RJ Mitchell attempts a 3Pt. Contested by Dejounte LaVine (5.2 feet, MAN). RJ Mitchell misses. Rebound secured by D'Angelo Tatum.

[11:35] Team_076 possession (Score: 0-0)
D'Angelo Tatum attempts a Midrange. Contested by Collin Young (5.0 feet, MAN). D'ANGELO TATUM MAKES IT!
Score: 0-2

[11:19] Team_037 possession (Score: 0-2)
Giannis Middleton attempts a 3Pt. Contested by Cade Barnes (3.0 feet, ZONE). Giannis Middleton misses. Rebound secured by Cade Barnes.

[11:04] Team_076 possession (Score: 0-2)
Cade Barnes drives, Scottie Jackson stays with him. Cade Barnes attempts a Layup. Contested by Scottie Jackson (5.0 feet, MAN). CADE BARNES MAKES IT!
Score: 0-4

[10:51] Team_037 possession (Score: 0-4)
Collin Young makes the Layup and draws the foul on Tobias Mitchell! And-1! Collin Young to the line for 1. [Team fouls: 2] (Tobias Mitchell: 1 personal fouls)   FT 1/1: GOOD Collin Young makes 1/1 from the line.
Score: 3-4

[10:37] Team_076 possession (Score: 3-4)
Dejounte LaVine attempts a Midrange. Contested by Jarrett Tatum (4.9 feet, ZONE). DEJOUNTE LAVINE MAKES IT! Assist: D'Angelo Tatum
Score: 3-6

[10:26] Team_037 possession (Score: 3-6)
Scottie Jackson attempts a Midrange. Contested by Cade Barnes (5.5 feet, MAN). SCOTTIE JACKSON MAKES IT! Assist: Jarrett Tatum
Score: 5-6

[10:11] Team_076 possession (Score: 5-6)
D'Angelo Tatum attempts a Layup. Contested by Scottie Jackson (5.9 feet, ZONE). D'Angelo Tatum misses. Rebound secured by Scottie Jackson.

[09:51] Team_037 possession (Score: 5-6)
Scottie Jackson throws a bad pass out of bounds! TURNOVER! (dead ball)

[09:36] Team_076 possession (Score: 5-6)
Paul Leonard attempts a 3Pt. Heavily contested by Scottie Jackson (1.4 feet, ZONE)! Paul Leonard misses. Rebound secured by Scottie Jackson.

[09:21] Team_037 possession (Score: 5-6)
Scottie Jackson drives and kicks out. Giannis Middleton attempts a 3Pt. Contested by Tobias Mitchell (5.3 feet, MAN). GIANNIS MIDDLETON MAKES IT! Assist: RJ Mitchell
Score: 8-6

[09:10] Team_076 possession (Score: 8-6)
Tobias Mitchell attempts a Midrange. Contested by Giannis Middleton (3.3 feet, MAN). Tobias Mitchell misses. Rebound secured by Scottie Jackson.

[08:56] Team_037 possession (Score: 8-6)
Scottie Jackson makes the Layup and draws the foul on Cade Barnes! And-1! Scottie Jackson to the line for 1. [Team fouls: 3] (Cade Barnes: 1 personal fouls)   FT 1/1: GOOD Scottie Jackson makes 1/1 from the line.
Score: 11-6

[08:41] Team_076 possession (Score: 11-6)
D'Angelo Tatum drives, picks up Collin Young. Help arrives from Giannis Middleton! D'Angelo Tatum attempts a Layup. Contested by Giannis Middleton (2.2 feet, MAN). D'ANGELO TATUM MAKES IT!
Score: 11-8

[08:26] Team_037 possession (Score: 11-8)
Collin Young attempts a Midrange. Contested by Tobias Mitchell (3.4 feet, ZONE). Collin Young misses. Rebound secured by Tobias Mitchell.

[08:07] Team_076 possession (Score: 11-8)
Dejounte LaVine attempts a 3Pt. Wide open! RJ Mitchell is 6.0 feet away. [MAN] Dejounte LaVine misses. Rebound secured by Collin Young.

[07:50] Team_037 possession (Score: 11-8)
Collin Young attempts a Layup. Contested by D'Angelo Tatum (3.8 feet, MAN). Collin Young misses. Rebound secured by Tobias Mitchell.

[07:34] Team_076 possession (Score: 11-8)
Paul Leonard attempts a 3Pt. Contested by Scottie Jackson (3.5 feet, ZONE). Paul Leonard misses. Rebound secured by Jarrett Tatum.

[07:20] Team_037 possession (Score: 11-8)
Giannis Middleton attempts a 3Pt. Contested by Tobias Mitchell (5.5 feet, MAN). Giannis Middleton misses. Rebound secured by Cade Barnes.

[07:04] Team_076 possession (Score: 11-8)
Tobias Mitchell makes the Dunk and draws the foul on Giannis Middleton! And-1! Tobias Mitchell to the line for 1. [Team fouls: 1] (Giannis Middleton: 1 personal fouls)   FT 1/1: GOOD Tobias Mitchell makes 1/1 from the line.
Score: 11-11

[06:50] Team_037 possession (Score: 11-11)
Giannis Middleton attempts a 3Pt. Wide open! Tobias Mitchell is 6.6 feet away. [MAN] Giannis Middleton misses. Offensive rebound by Scottie Jackson! Scottie Jackson's putback is no good. Rebound secured by D'Angelo Tatum.

[06:32] Team_076 possession (Score: 11-11)
Cade Barnes attempts a Layup. Heavily contested by Scottie Jackson (0.5 feet, MAN)! Cade Barnes misses. Rebound secured by Scottie Jackson.

[06:18] Team_037 possession (Score: 11-11)
Jarrett Tatum attempts a 3Pt. Heavily contested by Cade Barnes (0.6 feet, ZONE)! Jarrett Tatum misses. Offensive rebound by Scottie Jackson! Scottie Jackson puts it back in!
Score: 13-11

[06:04] Team_076 possession (Score: 13-11)
Cade Barnes attempts a Layup. Wide open! Scottie Jackson is 6.9 feet away. [ZONE] CADE BARNES MAKES IT! Assist: Paul Leonard
Score: 13-13

[05:47] Team_037 possession (Score: 13-13)
Scottie Jackson attempts a Midrange. Wide open! Tobias Mitchell is 7.2 feet away. [ZONE] SCOTTIE JACKSON MAKES IT! Assist: Collin Young
Score: 15-13

[05:31] Team_076 possession (Score: 15-13)
Dejounte LaVine attempts a 3Pt. Contested by Scottie Jackson (2.8 feet, ZONE). Dejounte LaVine misses. Rebound secured by Collin Young.

[05:16] Team_037 possession (Score: 15-13)
Collin Young drives and kicks out. RJ Mitchell attempts a Midrange. Contested by Paul Leonard (5.7 feet, ZONE). RJ MITCHELL MAKES IT! Assist: Scottie Jackson
Score: 17-13

[05:03] Team_076 possession (Score: 17-13)
Cade Barnes makes the Layup and draws the foul on Scottie Jackson! And-1! Cade Barnes to the line for 1. [Team fouls: 2] (Scottie Jackson: 1 personal fouls)   FT 1/1: GOOD Cade Barnes makes 1/1 from the line.
Score: 17-16

[04:52] Team_037 possession (Score: 17-16)
Collin Young drives, D'Angelo Tatum stays with him. Collin Young attempts a Dunk. Contested by D'Angelo Tatum (4.5 feet, MAN). Collin Young misses. Rebound secured by D'Angelo Tatum.

[04:36] Team_076 possession (Score: 17-16)
Dejounte LaVine attempts a 3Pt. Contested by Scottie Jackson (4.2 feet, ZONE). Dejounte LaVine misses. Rebound secured by Scottie Jackson.

[04:16] Team_037 possession (Score: 17-16)
Giannis Middleton drives, picks up Tobias Mitchell. Help arrives from Dejounte LaVine! Giannis Middleton attempts a Dunk. Contested by Dejounte LaVine (3.9 feet, MAN). GIANNIS MIDDLETON MAKES IT! Assist: Jarrett Tatum
Score: 19-16

[04:00] Team_076 possession (Score: 19-16)
Tobias Mitchell attempts a 3Pt. Wide open! Giannis Middleton is 6.1 feet away. [MAN] Tobias Mitchell misses. Rebound secured by Scottie Jackson.

[03:44] Team_037 possession (Score: 19-16)
Giannis Middleton drives, Tobias Mitchell stays with him. Giannis Middleton attempts a Dunk. Wide open! Tobias Mitchell is 6.0 feet away. [MAN] GIANNIS MIDDLETON MAKES IT!
Score: 21-16

[03:30] Team_076 possession (Score: 21-16)
Cade Barnes attempts a Midrange. Contested by Scottie Jackson (4.6 feet, MAN). Cade Barnes misses. Rebound secured by Collin Young.

[03:20] Team_037 possession (Score: 21-16)
Giannis Middleton attempts a 3Pt. Contested by Cade Barnes (4.5 feet, ZONE). Giannis Middleton misses. FOUL! Loose ball foul on Tobias Mitchell during the rebound battle. [Team fouls: 4] No free throws, side out. (Tobias Mitchell: 2 personal fouls)

[03:06] Team_037 possession (Score: 21-16)
Giannis Middleton attempts a Layup. Contested by Tobias Mitchell (4.8 feet, MAN). GIANNIS MIDDLETON MAKES IT! Assist: RJ Mitchell
Score: 23-16

[02:48] Team_076 possession (Score: 23-16)
D'Angelo Tatum attempts a Midrange. Contested by Collin Young (3.9 feet, MAN). D'Angelo Tatum misses. Rebound secured by Scottie Jackson.

[02:35] Team_037 possession (Score: 23-16)
FOUL! Offensive foul on Giannis Middleton! Tobias Mitchell drew the charge! [Team fouls: 3] (Giannis Middleton: 2 personal fouls) TURNOVER! (dead ball)

[02:16] Team_076 possession (Score: 23-16)
Paul Leonard attempts a 3Pt. Wide open! Jarrett Tatum is 7.1 feet away. [MAN] PAUL LEONARD MAKES IT!
Score: 23-19

[02:02] Team_037 possession (Score: 23-19)
Scottie Jackson attempts a 3Pt. Contested by Cade Barnes (6.0 feet, ZONE). Scottie Jackson misses. Rebound secured by Tobias Mitchell.

[01:52] Team_076 possession (Score: 23-19)
Paul Leonard attempts a 3Pt. Contested by Scottie Jackson (5.9 feet, ZONE). Paul Leonard misses. Rebound secured by Jarrett Tatum.

[01:39] Team_037 possession (Score: 23-19)
Scottie Jackson attempts a Midrange. Contested by Tobias Mitchell (5.2 feet, ZONE). SCOTTIE JACKSON MAKES IT! Assist: RJ Mitchell
Score: 25-19

[01:25] Team_076 possession (Score: 25-19)
FOUL! Reach-in foul on Scottie Jackson during the drive. [Team fouls: 4] No free throws, side out. (Scottie Jackson: 2 personal fouls)

[01:06] Team_076 possession (Score: 25-19)
Tobias Mitchell attempts a 3Pt. Heavily contested by Giannis Middleton (2.0 feet, MAN)! Tobias Mitchell misses. Rebound secured by Scottie Jackson.

[00:51] Team_037 possession (Score: 25-19)
RJ Mitchell attempts a 3Pt. Contested by Dejounte LaVine (5.7 feet, MAN). RJ MITCHELL MAKES IT! Assist: Scottie Jackson
Score: 28-19

[00:37] Team_076 possession (Score: 28-19)
FOUL! Holding foul on Collin Young. [IN THE BONUS! 5 team fouls] D'Angelo Tatum to the line for 2 free throws. (Collin Young: 1 personal fouls)   FT 1/2: GOOD   FT 2/2: GOOD D'Angelo Tatum makes 2/2 from the line.
Score: 28-21

[00:23] Team_037 possession (Score: 28-21)
Jarrett Tatum attempts a 3Pt. Heavily contested by Paul Leonard (1.4 feet, MAN)! Jarrett Tatum misses. Rebound secured by Cade Barnes.

[00:10] Team_076 possession (Score: 28-21)
Dejounte LaVine attempts a 3Pt. Heavily contested by Scottie Jackson (1.8 feet, ZONE)! Dejounte LaVine misses. Rebound secured by Collin Young.

================================================================================
                              1ST QUARTER COMPLETE                              
================================================================================

1ST QUARTER SCORE: Team_037 28, Team_076 21

BOX SCORE:
================================================================================

Team_037
--------------------------------------------------------------------------------
Player                MIN  PTS  REB  AST  TO      FG   FG%      3P   3P%
--------------------------------------------------------------------------------
Scottie Jackson        12   11    9    2   0   5/6    83.3     0/0   0.0
Giannis Middleton      12    9    0    0   0   4/7    57.1     0/0   0.0
RJ Mitchell            12    5    0    3   0   2/3    66.7     0/0   0.0
Collin Young           12    3    5    1   0   1/4    25.0     0/0   0.0
Jarrett Tatum          12    0    2    2   0   0/1     0.0     0/0   0.0

TEAM: FG: 12/21 (57.1%), 3PT: 2/8 (25.0%), REB: 17 (3 off, 14 def), AST: 8, TO: 2
TEAM FOULS: 5 [Team_076 in BONUS]


Team_076
--------------------------------------------------------------------------------
Player                MIN  PTS  REB  AST  TO      FG   FG%      3P   3P%
--------------------------------------------------------------------------------
Cade Barnes            12    7    3    0   0   3/5    60.0     0/0   0.0
D'Angelo Tatum         12    6    3    1   0   3/5    60.0     0/0   0.0
Paul Leonard           12    3    0    1   0   1/4    25.0     0/0   0.0
Tobias Mitchell        12    3    3    0   0   1/4    25.0     0/0   0.0
Dejounte LaVine        12    2    0    0   0   1/5    20.0     0/0   0.0

TEAM: FG: 9/23 (39.1%), 3PT: 1/10 (10.0%), REB: 8 (0 off, 8 def), AST: 2, TO: 0
TEAM FOULS: 4

================================================================================

================================================================================
                       2ND QUARTER - Team_037 vs Team_076                       
================================================================================

[12:00] Team_037 possession (Score: 28-21)
Scottie Jackson drives, Cade Barnes stays with him. Scottie Jackson attempts a Dunk. Heavily contested by Cade Barnes (0.7 feet, ZONE)! SCOTTIE JACKSON MAKES IT! Assist: Giannis Middleton
Score: 30-21

[11:44] Team_076 possession (Score: 30-21)
Paul Leonard attempts a Layup. Wide open! Jarrett Tatum is 8.2 feet away. [MAN] PAUL LEONARD MAKES IT! Assist: Cade Barnes
Score: 30-23

[11:29] Team_037 possession (Score: 30-23)
Collin Young attempts a Midrange. Contested by Tobias Mitchell (4.5 feet, ZONE). Collin Young misses. Offensive rebound by Collin Young! Collin Young puts it back in!
Score: 32-23

[11:16] Team_076 possession (Score: 32-23)
FOUL! Holding foul on Collin Young. [Team fouls: 1] No free throws, side out. (Collin Young: 1 personal fouls)

[11:02] Team_076 possession (Score: 32-23)
Dejounte LaVine drives to the basket... Dejounte LaVine throws a bad pass! Stolen by RJ Mitchell! TURNOVER! (live ball)

[10:51] Team_037 possession (Score: 32-23)
Collin Young drives and kicks out. RJ Mitchell attempts a 3Pt. Contested by Cade Barnes (4.7 feet, ZONE). RJ Mitchell misses. Rebound secured by D'Angelo Tatum.

[10:35] Team_076 possession (Score: 32-23)
D'Angelo Tatum attempts a Layup. Contested by Collin Young (2.7 feet, MAN). D'ANGELO TATUM MAKES IT! Assist: Paul Leonard
Score: 32-25

[10:24] Team_037 possession (Score: 32-25)
RJ Mitchell attempts a 3Pt. Contested by Cade Barnes (4.7 feet, ZONE). RJ Mitchell misses. Offensive rebound by Collin Young! Collin Young's putback is no good. Rebound secured by D'Angelo Tatum.

[10:09] Team_076 possession (Score: 32-25)
FOUL! Holding foul on Collin Young. [Team fouls: 2] No free throws, side out. (Collin Young: 2 personal fouls)

[09:56] Team_076 possession (Score: 32-25)
D'Angelo Tatum attempts a Layup. BLOCKED BY COLLIN YOUNG! Ball goes out off Collin Young. D'Angelo Tatum's ball!

[09:45] Team_076 possession (Score: 32-25)
Tobias Mitchell loses control! Ball rolls out of bounds! TURNOVER! (dead ball)

[09:45] Substitution (Team_037): RJ Mitchell OUT → Jarrett Randle IN (stamina_rule2)

[09:45] Substitution (Team_037): Giannis Middleton OUT → Collin Trent IN (stamina_rule2)

[09:45] Substitution (Team_037): Jarrett Tatum OUT → Julius Bird IN (stamina_rule2)

[09:45] Substitution (Team_037): Scottie Jackson OUT → Russell Anthony IN (stamina_rule2)

[09:45] Substitution (Team_037): Collin Young OUT → Wendell Herro IN (stamina_rule2)

[09:45] Substitution (Team_076): Dejounte LaVine OUT → Pascal Lowry IN (stamina_rule2)

[09:45] Substitution (Team_076): Tobias Mitchell OUT → Jalen Poole IN (stamina_rule2)

[09:45] Substitution (Team_076): Paul Leonard OUT → Vince Lowry IN (stamina_rule2)

[09:45] Substitution (Team_076): Cade Barnes OUT → Kevin Nowitzki IN (stamina_rule2)

[09:45] Substitution (Team_076): D'Angelo Tatum OUT → Jordan Doncic IN (stamina_rule2)

[09:30] Team_037 possession (Score: 32-25)
Jarrett Randle attempts a 3Pt. Contested by Vince Lowry (2.6 feet, ZONE). Jarrett Randle misses. Rebound secured by Jordan Doncic.

[09:13] Team_076 possession (Score: 32-25)
FOUL! Holding foul on Russell Anthony. [Team fouls: 3] No free throws, side out. (Russell Anthony: 1 personal fouls)

[08:57] Team_076 possession (Score: 32-25)
Kevin Nowitzki drives, picks up Russell Anthony. Help arrives from Collin Trent! Kevin Nowitzki attempts a Dunk. Contested by Collin Trent (5.2 feet, ZONE). KEVIN NOWITZKI MAKES IT! Assist: Jordan Doncic
Score: 32-27

[08:42] Team_037 possession (Score: 32-27)
Jarrett Randle attempts a Midrange. Contested by Pascal Lowry (4.8 feet, MAN). Jarrett Randle misses. Rebound secured by Kevin Nowitzki.

[08:26] Team_076 possession (Score: 32-27)
Pascal Lowry attempts a 3Pt. Contested by Jarrett Randle (4.7 feet, ZONE). Pascal Lowry misses. Offensive rebound by Kevin Nowitzki! Kevin Nowitzki kicks it out.

[08:12] Team_076 possession (Score: 32-27)
Jordan Doncic attempts a Layup. BLOCKED BY COLLIN TRENT! Ball goes out off Collin Trent. Jordan Doncic's ball!

[07:59] Team_076 possession (Score: 32-27)
Kevin Nowitzki loses the ball! Stripped by Russell Anthony! TURNOVER! (live ball)

[07:43] Team_037 possession (Score: 32-27)
Julius Bird attempts a Midrange. Wide open! Vince Lowry is 6.2 feet away. [ZONE] Julius Bird misses. Offensive rebound by Julius Bird! Julius Bird kicks it out.

[07:26] Team_037 possession (Score: 32-27)
Collin Trent attempts a 3Pt. Heavily contested by Vince Lowry (0.5 feet, ZONE)! Collin Trent misses. Rebound secured by Kevin Nowitzki.

[07:10] Team_076 possession (Score: 32-27)
Pascal Lowry attempts a 3Pt. Contested by Jarrett Randle (2.1 feet, ZONE). Pascal Lowry misses. Rebound secured by Wendell Herro.

[06:58] Team_037 possession (Score: 32-27)
Russell Anthony drives, picks up Kevin Nowitzki. Help arrives from Jalen Poole! Russell Anthony attempts a Layup. Wide open! Jalen Poole is 7.2 feet away. [MAN] Russell Anthony misses. Rebound secured by Jordan Doncic.

[06:42] Team_076 possession (Score: 32-27)
Pascal Lowry loses control! Ball rolls out of bounds! TURNOVER! (dead ball)

[06:29] Team_037 possession (Score: 32-27)
Julius Bird drives, Jordan Doncic stays with him. Julius Bird attempts a Layup. Contested by Jordan Doncic (3.4 feet, ZONE). Julius Bird misses. Rebound secured by Jordan Doncic.

[06:16] Team_076 possession (Score: 32-27)
Jordan Doncic drives and kicks out. Jalen Poole attempts a 3Pt. Contested by Jarrett Randle (3.4 feet, ZONE). JALEN POOLE MAKES IT!
Score: 32-30

[06:01] Team_037 possession (Score: 32-30)
Julius Bird attempts a Midrange. Contested by Vince Lowry (5.7 feet, MAN). Julius Bird misses. Rebound secured by Jordan Doncic.

[05:45] Team_076 possession (Score: 32-30)
Pascal Lowry loses control! Ball rolls out of bounds! TURNOVER! (dead ball)

[05:34] Team_037 possession (Score: 32-30)
Julius Bird attempts a Midrange. Contested by Vince Lowry (4.7 feet, MAN). JULIUS BIRD MAKES IT!
Score: 34-30

[05:17] Team_076 possession (Score: 34-30)
Pascal Lowry attempts a 3Pt. Contested by Jarrett Randle (4.3 feet, ZONE). Pascal Lowry misses. Rebound secured by Julius Bird.

[05:07] Team_037 possession (Score: 34-30)
Wendell Herro drives, Kevin Nowitzki stays with him. Wendell Herro attempts a Dunk. Wide open! Kevin Nowitzki is 6.1 feet away. [ZONE] WENDELL HERRO MAKES IT!
Score: 36-30

[04:55] Team_076 possession (Score: 36-30)
Jordan Doncic drives and kicks out. Pascal Lowry attempts a Midrange. Contested by Collin Trent (4.5 feet, ZONE). Pascal Lowry misses. Rebound secured by Wendell Herro.

[04:43] Team_037 possession (Score: 36-30)
Wendell Herro attempts a Layup. BLOCKED BY JORDAN DONCIC! Ball deflects out of bounds off Wendell Herro.

[04:26] Team_076 possession (Score: 36-30)
Jalen Poole attempts a 3Pt. Contested by Collin Trent (3.2 feet, MAN). Jalen Poole misses. Offensive rebound by Jordan Doncic! Jordan Doncic kicks it out.

[04:11] Team_076 possession (Score: 36-30)
Jordan Doncic attempts a Layup. Contested by Russell Anthony (3.5 feet, ZONE). JORDAN DONCIC MAKES IT! Assist: Kevin Nowitzki
Score: 36-32

[03:56] Team_037 possession (Score: 36-32)
Jarrett Randle attempts a 3Pt. Contested by Vince Lowry (4.7 feet, ZONE). JARRETT RANDLE MAKES IT! Assist: Collin Trent
Score: 39-32

[03:39] Team_076 possession (Score: 39-32)
FOUL! Shooting foul on Russell Anthony. Kevin Nowitzki to the line for 2 free throws. [Team fouls: 4] (Russell Anthony: 2 personal fouls)   FT 1/2: GOOD   FT 2/2: GOOD Kevin Nowitzki makes 2/2 from the line.
Score: 39-34

[03:22] Team_037 possession (Score: 39-34)
Collin Trent makes the Layup and draws the foul on Jalen Poole! And-1! Collin Trent to the line for 1. [Team fouls: 1] (Jalen Poole: 1 personal fouls)   FT 1/1: GOOD Collin Trent makes 1/1 from the line.
Score: 42-34

[03:08] Team_076 possession (Score: 42-34)
Jordan Doncic loses control! Ball rolls out of bounds! TURNOVER! (dead ball)

[02:53] Team_037 possession (Score: 42-34)
Jarrett Randle attempts a Layup. Contested by Jordan Doncic (4.8 feet, ZONE). JARRETT RANDLE MAKES IT!
Score: 44-34

[02:38] Team_076 possession (Score: 44-34)
Kevin Nowitzki drives, Russell Anthony stays with him. Kevin Nowitzki attempts a Layup. Heavily contested by Russell Anthony (0.5 feet, ZONE)! KEVIN NOWITZKI MAKES IT! Assist: Jordan Doncic
Score: 44-36

[02:20] Team_037 possession (Score: 44-36)
FOUL! Reach-in foul on Jordan Doncic during the drive. [Team fouls: 2] No free throws, side out. (Jordan Doncic: 1 personal fouls)

[02:05] Team_037 possession (Score: 44-36)
FOUL! Shooting foul on Vince Lowry. Julius Bird to the line for 2 free throws. [Team fouls: 3] (Vince Lowry: 1 personal fouls)   FT 1/2: GOOD   FT 2/2: MISS Julius Bird makes 1/2 from the line. Rebound secured by Kevin Nowitzki.
Score: 45-36

[01:56] Team_076 possession (Score: 45-36)
Jordan Doncic attempts a 3Pt. Heavily contested by Russell Anthony (0.5 feet, MAN)! JORDAN DONCIC MAKES IT! Assist: Pascal Lowry
Score: 45-39

[01:41] Team_037 possession (Score: 45-39)
FOUL! Reach-in foul on Jalen Poole during the drive. [Team fouls: 4] No free throws, side out. (Jalen Poole: 2 personal fouls)

[01:25] Team_037 possession (Score: 45-39)
Wendell Herro drives to the basket... Wendell Herro loses the ball! Stripped by Jordan Doncic! TURNOVER! (live ball)

[01:12] Team_076 possession (Score: 45-39)
Jordan Doncic attempts a Layup. Contested by Russell Anthony (5.9 feet, ZONE). Jordan Doncic misses. Rebound secured by Julius Bird.

[00:53] Team_037 possession (Score: 45-39)
Julius Bird drives and kicks out. Russell Anthony attempts a Midrange. Wide open! Kevin Nowitzki is 6.1 feet away. [MAN] Russell Anthony misses. Rebound secured by Kevin Nowitzki.

[00:38] Team_076 possession (Score: 45-39)
Kevin Nowitzki makes the Layup and draws the foul on Russell Anthony! And-1! Kevin Nowitzki to the line for 1. [BONUS: 5 team fouls] (Russell Anthony: 3 personal fouls)   FT 1/1: GOOD Kevin Nowitzki makes 1/1 from the line.
Score: 45-42

[00:21] Team_037 possession (Score: 45-42)
Russell Anthony attempts a Midrange. Contested by Kevin Nowitzki (6.0 feet, MAN). Russell Anthony misses. Rebound secured by Kevin Nowitzki.

[00:05] Team_076 possession (Score: 45-42)
Jordan Doncic attempts a Layup. Wide open! Russell Anthony is 6.5 feet away. [MAN] JORDAN DONCIC MAKES IT!
Score: 45-44

================================================================================
                              2ND QUARTER COMPLETE                              
================================================================================

2ND QUARTER SCORE: Team_037 17, Team_076 23

BOX SCORE:
================================================================================

Team_037
--------------------------------------------------------------------------------
Player                MIN  PTS  REB  AST  TO      FG   FG%      3P   3P%
--------------------------------------------------------------------------------
Jarrett Randle         10    5    0    0   0   2/4    50.0     0/0   0.0
Collin Trent           10    3    0    1   0   1/2    50.0     0/0   0.0
Scottie Jackson        15    2    0    0   0   1/1   100.0     0/0   0.0
Collin Young           15    2    1    0   0   1/2    50.0     0/0   0.0
D'Angelo Tatum         15    2    2    0   0   1/1   100.0     0/0   0.0
Julius Bird            10    2    3    0   0   1/5    20.0     0/0   0.0
Wendell Herro          10    2    2    0   0   1/2    50.0     0/0   0.0
Giannis Middleton      15    0    0    1   0   0/0     0.0     0/0   0.0
RJ Mitchell            15    0    0    0   0   0/1     0.0     0/0   0.0
Russell Anthony        10    0    0    0   0   0/2     0.0     0/0   0.0

TEAM: FG: 7/19 (36.8%), 3PT: 1/4 (25.0%), REB: 7 (3 off, 4 def), AST: 2, TO: 1
TEAM FOULS: 5 [Team_076 in BONUS]


Team_076
--------------------------------------------------------------------------------
Player                MIN  PTS  REB  AST  TO      FG   FG%      3P   3P%
--------------------------------------------------------------------------------
Kevin Nowitzki         10    9    6    1   0   4/4   100.0     0/0   0.0
Jordan Doncic          10    7    5    2   0   3/5    60.0     0/0   0.0
Jalen Poole            10    3    0    0   0   1/1   100.0     0/0   0.0
Paul Leonard           15    2    0    1   0   1/1   100.0     0/0   0.0
Cade Barnes            15    0    0    1   0   0/0     0.0     0/0   0.0
Pascal Lowry           10    0    0    1   0   0/2     0.0     0/0   0.0

TEAM: FG: 10/14 (71.4%), 3PT: 1/3 (33.3%), REB: 12 (2 off, 10 def), AST: 6, TO: 6
TEAM FOULS: 4

================================================================================

================================================================================
                       3RD QUARTER - Team_037 vs Team_076                       
================================================================================

[12:00] Team_037 possession (Score: 45-44)
Scottie Jackson makes the Dunk and draws the foul on Tobias Mitchell! And-1! Scottie Jackson to the line for 1. [Team fouls: 1] (Tobias Mitchell: 1 personal fouls)   FT 1/1: MISS Scottie Jackson makes 0/1 from the line. Rebound secured by D'Angelo Tatum.
Score: 47-44

[11:43] Team_076 possession (Score: 47-44)
Cade Barnes attempts a 3Pt. Wide open! Scottie Jackson is 6.0 feet away. [ZONE] Cade Barnes misses. Offensive rebound by Cade Barnes! Cade Barnes kicks it out.

[11:30] Team_076 possession (Score: 47-44)
Paul Leonard drives, picks up Scottie Jackson. Help arrives from Giannis Middleton! Paul Leonard attempts a Dunk. Contested by Giannis Middleton (4.9 feet, ZONE). PAUL LEONARD MAKES IT! Assist: Cade Barnes
Score: 47-46

[11:16] Team_037 possession (Score: 47-46)
Jarrett Tatum attempts a 3Pt. Wide open! Paul Leonard is 6.9 feet away. [MAN] Jarrett Tatum misses. Rebound secured by Cade Barnes.

[10:59] Team_076 possession (Score: 47-46)
Tobias Mitchell attempts a 3Pt. Wide open! Giannis Middleton is 7.0 feet away. [MAN] Tobias Mitchell misses. Rebound secured by Collin Young.

[10:46] Team_037 possession (Score: 47-46)
FOUL! Shooting foul on Cade Barnes. Collin Young to the line for 2 free throws. [Team fouls: 2] (Cade Barnes: 1 personal fouls)   FT 1/2: GOOD   FT 2/2: GOOD Collin Young makes 2/2 from the line.
Score: 49-46

[10:30] Team_076 possession (Score: 49-46)
Tobias Mitchell makes the Layup and draws the foul on Giannis Middleton! And-1! Tobias Mitchell to the line for 1. [Team fouls: 1] (Giannis Middleton: 1 personal fouls)   FT 1/1: GOOD Tobias Mitchell makes 1/1 from the line.
Score: 49-49

[10:14] Team_037 possession (Score: 49-49)
Scottie Jackson drives to the basket... FOUL! Offensive foul on Scottie Jackson! D'Angelo Tatum drew the charge! [Team fouls: 2] (Scottie Jackson: 1 personal fouls) TURNOVER! (dead ball)

[09:59] Team_076 possession (Score: 49-49)
Dejounte LaVine loses the ball! Stripped by RJ Mitchell! TURNOVER! (live ball)

[09:43] Team_037 possession (Score: 49-49)
Giannis Middleton attempts a Layup. BLOCKED BY CADE BARNES! Ball is loose! Rebound secured by D'Angelo Tatum.

[09:30] Team_076 possession (Score: 49-49)
Cade Barnes attempts a Midrange. Heavily contested by Scottie Jackson (1.2 feet, ZONE)! Cade Barnes misses. Rebound secured by Collin Young.

[09:16] Team_037 possession (Score: 49-49)
Jarrett Tatum drives, Paul Leonard stays with him. Jarrett Tatum attempts a Dunk. Contested by Paul Leonard (3.8 feet, MAN). JARRETT TATUM MAKES IT! Assist: Collin Young
Score: 51-49

[09:02] Team_076 possession (Score: 51-49)
Dejounte LaVine drives, RJ Mitchell stays with him. Dejounte LaVine attempts a Dunk. Contested by RJ Mitchell (4.5 feet, MAN). Dejounte LaVine misses. Offensive rebound by D'Angelo Tatum! D'Angelo Tatum kicks it out.

[08:47] Team_076 possession (Score: 51-49)
Paul Leonard attempts a 3Pt. Contested by Scottie Jackson (5.8 feet, ZONE). Paul Leonard misses. Rebound secured by Scottie Jackson.

[08:31] Team_037 possession (Score: 51-49)
RJ Mitchell attempts a 3Pt. Heavily contested by Dejounte LaVine (1.3 feet, MAN)! RJ Mitchell misses. Rebound secured by Tobias Mitchell.

[08:22] Team_076 possession (Score: 51-49)
Cade Barnes attempts a 3Pt. Contested by Scottie Jackson (4.3 feet, ZONE). Cade Barnes misses. Rebound secured by Scottie Jackson.

[08:07] Team_037 possession (Score: 51-49)
FOUL! Shooting foul on Paul Leonard. Jarrett Tatum to the line for 2 free throws. [Team fouls: 3] (Paul Leonard: 1 personal fouls)   FT 1/2: MISS   FT 2/2: GOOD Jarrett Tatum makes 1/2 from the line.
Score: 52-49

[07:52] Team_076 possession (Score: 52-49)
Tobias Mitchell attempts a 3Pt. Contested by Giannis Middleton (5.2 feet, MAN). Tobias Mitchell misses. Rebound secured by Jarrett Tatum.

[07:38] Team_037 possession (Score: 52-49)
Jarrett Tatum attempts a 3Pt. Contested by Paul Leonard (3.2 feet, MAN). JARRETT TATUM MAKES IT! Assist: Scottie Jackson
Score: 55-49

[07:28] Team_076 possession (Score: 55-49)
Cade Barnes attempts a 3Pt. Contested by Scottie Jackson (4.3 feet, ZONE). Cade Barnes misses. Rebound secured by Scottie Jackson.

[07:16] Team_037 possession (Score: 55-49)
RJ Mitchell attempts a 3Pt. Contested by Dejounte LaVine (4.6 feet, MAN). RJ Mitchell misses. Rebound secured by Cade Barnes.

[07:02] Team_076 possession (Score: 55-49)
Cade Barnes attempts a Layup. Wide open! Scottie Jackson is 6.4 feet away. [MAN] CADE BARNES MAKES IT!
Score: 55-51

[06:46] Team_037 possession (Score: 55-51)
Scottie Jackson attempts a Midrange. Contested by Cade Barnes (5.1 feet, MAN). Scottie Jackson misses. Rebound secured by Cade Barnes.

[06:32] Team_076 possession (Score: 55-51)
Tobias Mitchell attempts a Layup. Wide open! Giannis Middleton is 6.6 feet away. [MAN] TOBIAS MITCHELL MAKES IT!
Score: 55-53

[06:20] Team_037 possession (Score: 55-53)
FOUL! Reach-in foul on Paul Leonard during the drive. [Team fouls: 4] No free throws, side out. (Paul Leonard: 2 personal fouls)

[06:07] Team_037 possession (Score: 55-53)
RJ Mitchell attempts a 3Pt. Heavily contested by Cade Barnes (1.9 feet, ZONE)! RJ MITCHELL MAKES IT! Assist: Collin Young
Score: 58-53

[05:53] Team_076 possession (Score: 58-53)
Dejounte LaVine attempts a 3Pt. Heavily contested by RJ Mitchell (1.8 feet, MAN)! Dejounte LaVine misses. Rebound secured by Scottie Jackson.

[05:38] Team_037 possession (Score: 58-53)
RJ Mitchell attempts a 3Pt. Contested by Dejounte LaVine (5.5 feet, MAN). RJ Mitchell misses. Rebound secured by D'Angelo Tatum.

[05:23] Team_076 possession (Score: 58-53)
D'Angelo Tatum attempts a Midrange. Contested by Collin Young (3.7 feet, MAN). D'ANGELO TATUM MAKES IT!
Score: 58-55

[05:06] Team_037 possession (Score: 58-55)
Collin Young attempts a Midrange. Contested by D'Angelo Tatum (4.4 feet, MAN). COLLIN YOUNG MAKES IT! Assist: Scottie Jackson
Score: 60-55

[04:54] Team_076 possession (Score: 60-55)
Tobias Mitchell attempts a 3Pt. Wide open! Giannis Middleton is 7.1 feet away. [MAN] TOBIAS MITCHELL MAKES IT! Assist: Paul Leonard
Score: 60-58

[04:39] Team_037 possession (Score: 60-58)
FOUL! Shooting foul on Cade Barnes. Collin Young to the line for 2 free throws. [BONUS: 5 team fouls] (Cade Barnes: 2 personal fouls)   FT 1/2: GOOD   FT 2/2: MISS Collin Young makes 1/2 from the line. Offensive rebound by Collin Young! Collin Young's putback is no good.
Score: 61-58

[04:22] Team_076 possession (Score: 61-58)
Paul Leonard attempts a Midrange. Wide open! Jarrett Tatum is 6.4 feet away. [MAN] Paul Leonard misses. Rebound secured by Jarrett Tatum.

[04:11] Team_037 possession (Score: 61-58)
FOUL! Holding foul on D'Angelo Tatum. [IN THE BONUS! 6 team fouls] Collin Young to the line for 2 free throws. (D'Angelo Tatum: 1 personal fouls)   FT 1/2: GOOD   FT 2/2: GOOD Collin Young makes 2/2 from the line.
Score: 63-58

[03:54] Team_076 possession (Score: 63-58)
Paul Leonard attempts a Midrange. Contested by Jarrett Tatum (5.9 feet, MAN). Paul Leonard misses. Rebound secured by Jarrett Tatum.

[03:39] Team_037 possession (Score: 63-58)
Jarrett Tatum attempts a 3Pt. Contested by Paul Leonard (3.8 feet, MAN). Jarrett Tatum misses. Offensive rebound by Scottie Jackson! Scottie Jackson puts it back in!
Score: 65-58

[03:28] Team_076 possession (Score: 65-58)
Paul Leonard drives to the basket... Paul Leonard loses the ball! Stripped by Scottie Jackson! TURNOVER! (live ball)

[03:14] Team_037 possession (Score: 65-58)
Scottie Jackson attempts a Layup. BLOCKED BY CADE BARNES! Ball is loose! Rebound secured by Cade Barnes.

[03:02] Team_076 possession (Score: 65-58)
Tobias Mitchell drives, Scottie Jackson stays with him. Tobias Mitchell attempts a Layup. Wide open! Scottie Jackson is 6.2 feet away. [ZONE] Tobias Mitchell misses. Rebound secured by Collin Young.

[02:47] Team_037 possession (Score: 65-58)
Scottie Jackson attempts a 3Pt. Contested by Cade Barnes (4.3 feet, MAN). Scottie Jackson misses. Offensive rebound by Scottie Jackson! Scottie Jackson puts it back in!
Score: 67-58

[02:32] Team_076 possession (Score: 67-58)
Paul Leonard attempts a 3Pt. Contested by Jarrett Tatum (2.8 feet, MAN). Paul Leonard misses. Rebound secured by Collin Young.

[02:18] Team_037 possession (Score: 67-58)
Giannis Middleton makes the Midrange and draws the foul on Tobias Mitchell! And-1! Giannis Middleton to the line for 1. [BONUS: 7 team fouls] (Tobias Mitchell: 2 personal fouls)   FT 1/1: GOOD Giannis Middleton makes 1/1 from the line.
Score: 70-58

[02:01] Team_076 possession (Score: 70-58)
Tobias Mitchell attempts a 3Pt. Contested by Giannis Middleton (2.7 feet, MAN). Tobias Mitchell misses. Rebound secured by Collin Young.

[01:49] Team_037 possession (Score: 70-58)
Giannis Middleton throws a bad pass! Stolen by Tobias Mitchell! TURNOVER! (live ball)

[01:38] Team_076 possession (Score: 70-58)
Cade Barnes attempts a Midrange. Contested by Jarrett Tatum (4.5 feet, ZONE). Cade Barnes misses. FOUL! Loose ball foul on Collin Young during the rebound battle. [Team fouls: 3] No free throws, side out. (Collin Young: 1 personal fouls)

[01:19] Team_076 possession (Score: 70-58)
Paul Leonard attempts a 3Pt. Contested by Scottie Jackson (5.0 feet, ZONE). Paul Leonard misses. Rebound secured by Collin Young.

[01:03] Team_037 possession (Score: 70-58)
Collin Young makes the Layup and draws the foul on Tobias Mitchell! And-1! Collin Young to the line for 1. [BONUS: 8 team fouls] (Tobias Mitchell: 3 personal fouls)   FT 1/1: GOOD Collin Young makes 1/1 from the line.
Score: 73-58

[00:49] Team_076 possession (Score: 73-58)
Tobias Mitchell attempts a 3Pt. Contested by Giannis Middleton (5.0 feet, MAN). TOBIAS MITCHELL MAKES IT!
Score: 73-61

[00:36] Team_037 possession (Score: 73-61)
FOUL! Offensive foul on Giannis Middleton! Tobias Mitchell drew the charge! [Team fouls: 4] (Giannis Middleton: 2 personal fouls) TURNOVER! (dead ball)

[00:25] Team_076 possession (Score: 73-61)
Cade Barnes makes the Dunk and draws the foul on Giannis Middleton! And-1! Cade Barnes to the line for 1. [BONUS: 5 team fouls] (Giannis Middleton: 3 personal fouls)   FT 1/1: GOOD Cade Barnes makes 1/1 from the line.
Score: 73-64

[00:10] Team_037 possession (Score: 73-64)
Collin Young attempts a Midrange. Wide open! D'Angelo Tatum is 7.6 feet away. [MAN] Collin Young misses. Rebound secured by Cade Barnes.

================================================================================
                              3RD QUARTER COMPLETE                              
================================================================================

3RD QUARTER SCORE: Team_037 28, Team_076 20

BOX SCORE:
================================================================================

Team_037
--------------------------------------------------------------------------------
Player                MIN  PTS  REB  AST  TO      FG   FG%      3P   3P%
--------------------------------------------------------------------------------
Collin Young           27    9    7    2   0   4/6    66.7     0/0   0.0
Jarrett Tatum          27    6    3    0   0   3/4    75.0     0/0   0.0
Scottie Jackson        27    4    6    2   0   2/5    40.0     0/0   0.0
Giannis Middleton      27    3    0    0   0   1/2    50.0     0/0   0.0
RJ Mitchell            27    3    0    0   0   1/4    25.0     0/0   0.0

TEAM: FG: 11/21 (52.4%), 3PT: 4/8 (50.0%), REB: 15 (2 off, 13 def), AST: 4, TO: 3
TEAM FOULS: 5 [Team_076 in BONUS]


Team_076
--------------------------------------------------------------------------------
Player                MIN  PTS  REB  AST  TO      FG   FG%      3P   3P%
--------------------------------------------------------------------------------
Tobias Mitchell        27   11    1    0   0   4/8    50.0     0/0   0.0
Cade Barnes            27    5    6    1   0   2/5    40.0     0/0   0.0
D'Angelo Tatum         27    2    5    0   0   1/1   100.0     0/0   0.0
Paul Leonard           27    2    0    1   0   1/6    16.7     0/0   0.0
Dejounte LaVine        27    0    0    0   0   0/1     0.0     0/0   0.0

TEAM: FG: 8/21 (38.1%), 3PT: 2/11 (18.2%), REB: 13 (3 off, 10 def), AST: 2, TO: 2
TEAM FOULS: 8 [Team_037 in BONUS]

================================================================================

================================================================================
                       4TH QUARTER - Team_037 vs Team_076                       
================================================================================

[12:00] Team_037 possession (Score: 73-64)
Jarrett Tatum drives, Paul Leonard stays with him. Jarrett Tatum attempts a Dunk. Contested by Paul Leonard (4.8 feet, MAN). Jarrett Tatum misses. Rebound secured by Cade Barnes.

[11:50] Team_076 possession (Score: 73-64)
Tobias Mitchell attempts a Layup. Contested by Giannis Middleton (3.2 feet, MAN). TOBIAS MITCHELL MAKES IT! Assist: D'Angelo Tatum
Score: 73-66

[11:35] Team_037 possession (Score: 73-66)
FOUL! Shooting foul on Tobias Mitchell. Scottie Jackson to the line for 2 free throws. [Team fouls: 1] (Tobias Mitchell: 1 personal fouls)   FT 1/2: GOOD   FT 2/2: GOOD Scottie Jackson makes 2/2 from the line.
Score: 75-66

[11:21] Team_076 possession (Score: 75-66)
D'Angelo Tatum makes the Layup and draws the foul on Collin Young! And-1! D'Angelo Tatum to the line for 1. [Team fouls: 1] (Collin Young: 1 personal fouls)   FT 1/1: GOOD D'Angelo Tatum makes 1/1 from the line.
Score: 75-69

[11:04] Team_037 possession (Score: 75-69)
FOUL! Reach-in foul on Cade Barnes during the drive. [Team fouls: 2] No free throws, side out. (Cade Barnes: 1 personal fouls)

[10:53] Team_037 possession (Score: 75-69)
Collin Young drives, picks up Cade Barnes. Help arrives from Tobias Mitchell! Collin Young attempts a Layup. Contested by Tobias Mitchell (3.1 feet, ZONE). COLLIN YOUNG MAKES IT!
Score: 77-69

[10:36] Team_076 possession (Score: 77-69)
FOUL! Holding foul on RJ Mitchell. [Team fouls: 2] No free throws, side out. (RJ Mitchell: 1 personal fouls)

[10:18] Team_076 possession (Score: 77-69)
FOUL! Shooting foul on Scottie Jackson. Cade Barnes to the line for 2 free throws. [Team fouls: 3] (Scottie Jackson: 1 personal fouls)   FT 1/2: GOOD   FT 2/2: MISS Cade Barnes makes 1/2 from the line. Rebound secured by Jarrett Tatum.
Score: 77-70

[10:03] Team_037 possession (Score: 77-70)
Giannis Middleton attempts a 3Pt. Wide open! Cade Barnes is 6.6 feet away. [ZONE] Giannis Middleton misses. Rebound secured by D'Angelo Tatum.

[09:49] Team_076 possession (Score: 77-70)
FOUL! Offensive foul on Tobias Mitchell! Giannis Middleton drew the charge! [Team fouls: 3] (Tobias Mitchell: 2 personal fouls) TURNOVER! (dead ball)

[09:35] Team_037 possession (Score: 77-70)
RJ Mitchell attempts a 3Pt. Contested by Cade Barnes (5.2 feet, ZONE). RJ Mitchell misses. Rebound secured by Cade Barnes.

[09:22] Team_076 possession (Score: 77-70)
Cade Barnes drives, Scottie Jackson stays with him. Cade Barnes attempts a Dunk. Wide open! Scottie Jackson is 6.9 feet away. [ZONE] Cade Barnes misses. Rebound secured by Jarrett Tatum.

[09:10] Team_037 possession (Score: 77-70)
Scottie Jackson drives, Cade Barnes stays with him. Scottie Jackson attempts a Layup. Contested by Cade Barnes (4.9 feet, MAN). Scottie Jackson misses. Offensive rebound by Scottie Jackson! Scottie Jackson kicks it out.

[08:52] Team_037 possession (Score: 77-70)
Jarrett Tatum attempts a 3Pt. Contested by Paul Leonard (5.6 feet, MAN). JARRETT TATUM MAKES IT! Assist: RJ Mitchell
Score: 80-70

[08:36] Team_076 possession (Score: 80-70)
D'Angelo Tatum drives to the basket... D'Angelo Tatum throws a bad pass! Stolen by Scottie Jackson! TURNOVER! (live ball)

[08:22] Team_037 possession (Score: 80-70)
RJ Mitchell makes the Dunk and draws the foul on Cade Barnes! And-1! RJ Mitchell to the line for 1. [Team fouls: 4] (Cade Barnes: 2 personal fouls)   FT 1/1: GOOD RJ Mitchell makes 1/1 from the line.
Score: 83-70

[08:10] Team_076 possession (Score: 83-70)
D'Angelo Tatum drives and kicks out. Cade Barnes attempts a 3Pt. Heavily contested by Scottie Jackson (1.3 feet, MAN)! Cade Barnes misses. Rebound secured by Scottie Jackson.

[07:59] Team_037 possession (Score: 83-70)
Collin Young attempts a 3Pt. Contested by D'Angelo Tatum (4.4 feet, MAN). COLLIN YOUNG MAKES IT! Assist: Jarrett Tatum
Score: 86-70

[07:44] Team_076 possession (Score: 86-70)
Tobias Mitchell attempts a 3Pt. Contested by Scottie Jackson (4.8 feet, ZONE). Tobias Mitchell misses. Rebound secured by Scottie Jackson.

[07:27] Team_037 possession (Score: 86-70)
Scottie Jackson makes the Dunk and draws the foul on Cade Barnes! And-1! Scottie Jackson to the line for 1. [BONUS: 5 team fouls] (Cade Barnes: 3 personal fouls)   FT 1/1: MISS Scottie Jackson makes 0/1 from the line. Rebound secured by D'Angelo Tatum.
Score: 88-70

[07:14] Team_076 possession (Score: 88-70)
Cade Barnes attempts a Midrange. Wide open! RJ Mitchell is 6.1 feet away. [ZONE] CADE BARNES MAKES IT! Assist: Tobias Mitchell
Score: 88-72

[06:57] Team_037 possession (Score: 88-72)
Scottie Jackson drives, Cade Barnes stays with him. Scottie Jackson attempts a Layup. Wide open! Cade Barnes is 6.4 feet away. [MAN] SCOTTIE JACKSON MAKES IT! Assist: Collin Young
Score: 90-72

[06:40] Team_076 possession (Score: 90-72)
FOUL! Reach-in foul on Scottie Jackson during the drive. [Team fouls: 4] No free throws, side out. (Scottie Jackson: 2 personal fouls)

[06:22] Team_076 possession (Score: 90-72)
Cade Barnes drives and kicks out. Dejounte LaVine attempts a 3Pt. Contested by RJ Mitchell (4.1 feet, MAN). Dejounte LaVine misses. Rebound secured by Collin Young.

[06:11] Team_037 possession (Score: 90-72)
FOUL! Holding foul on Tobias Mitchell. [IN THE BONUS! 6 team fouls] Giannis Middleton to the line for 2 free throws. (Tobias Mitchell: 3 personal fouls)   FT 1/2: GOOD   FT 2/2: GOOD Giannis Middleton makes 2/2 from the line.
Score: 92-72

[05:54] Team_076 possession (Score: 92-72)
Cade Barnes attempts a Midrange. Contested by Scottie Jackson (2.2 feet, MAN). CADE BARNES MAKES IT! Assist: Paul Leonard
Score: 92-74

[05:40] Team_037 possession (Score: 92-74)
Giannis Middleton attempts a 3Pt. Contested by Cade Barnes (3.6 feet, ZONE). Giannis Middleton misses. Rebound secured by Tobias Mitchell.

[05:28] Team_076 possession (Score: 92-74)
D'Angelo Tatum attempts a Layup. Wide open! Collin Young is 7.2 feet away. [MAN] D'ANGELO TATUM MAKES IT! Assist: Dejounte LaVine
Score: 92-76

[05:12] Team_037 possession (Score: 92-76)
Scottie Jackson attempts a 3Pt. Contested by Cade Barnes (4.2 feet, MAN). Scottie Jackson misses. Rebound secured by D'Angelo Tatum.

[04:58] Team_076 possession (Score: 92-76)
Cade Barnes drives, Scottie Jackson stays with him. Cade Barnes attempts a Layup. Wide open! Scottie Jackson is 6.1 feet away. [MAN] CADE BARNES MAKES IT! Assist: Paul Leonard
Score: 92-78

[04:46] Team_037 possession (Score: 92-78)
Jarrett Tatum attempts a Midrange. Contested by Paul Leonard (5.6 feet, ZONE). Jarrett Tatum misses. Rebound secured by Cade Barnes.

[04:32] Team_076 possession (Score: 92-78)
FOUL! Holding foul on Scottie Jackson. [IN THE BONUS! 5 team fouls] Cade Barnes to the line for 2 free throws. (Scottie Jackson: 3 personal fouls)   FT 1/2: GOOD   FT 2/2: GOOD Cade Barnes makes 2/2 from the line.
Score: 92-80

[04:19] Team_037 possession (Score: 92-80)
Collin Young makes the Layup and draws the foul on D'Angelo Tatum! And-1! Collin Young to the line for 1. [BONUS: 7 team fouls] (D'Angelo Tatum: 1 personal fouls)   FT 1/1: GOOD Collin Young makes 1/1 from the line.
Score: 95-80

[03:59] Team_076 possession (Score: 95-80)
FOUL! Reach-in foul on Scottie Jackson during the drive. [IN THE BONUS! 6 team fouls] Cade Barnes to the line for 2 free throws. (Scottie Jackson: 4 personal fouls)   FT 1/2: GOOD   FT 2/2: GOOD Cade Barnes makes 2/2 from the line.
Score: 95-82

[03:44] Team_037 possession (Score: 95-82)
Giannis Middleton attempts a Midrange. Wide open! Tobias Mitchell is 9.7 feet away. [MAN] GIANNIS MIDDLETON MAKES IT!
Score: 97-82

[03:29] Team_076 possession (Score: 97-82)
Paul Leonard attempts a 3Pt. Contested by Scottie Jackson (4.7 feet, ZONE). Paul Leonard misses. Offensive rebound by D'Angelo Tatum! D'Angelo Tatum kicks it out.

[03:17] Team_076 possession (Score: 97-82)
Paul Leonard attempts a 3Pt. Contested by Scottie Jackson (4.4 feet, ZONE). PAUL LEONARD MAKES IT! Assist: D'Angelo Tatum
Score: 97-85

[03:03] Team_037 possession (Score: 97-85)
FOUL! Shooting foul on Cade Barnes. Scottie Jackson to the line for 2 free throws. [BONUS: 8 team fouls] (Cade Barnes: 4 personal fouls)   FT 1/2: GOOD   FT 2/2: GOOD Scottie Jackson makes 2/2 from the line.
Score: 99-85

[02:50] Team_076 possession (Score: 99-85)
D'Angelo Tatum loses control! Ball rolls out of bounds! TURNOVER! (dead ball)

[02:50] Substitution (Team_037): RJ Mitchell OUT → Jarrett Randle IN (stamina_rule2)

[02:50] Substitution (Team_037): Giannis Middleton OUT → Collin Trent IN (stamina_rule2)

[02:50] Substitution (Team_037): Jarrett Tatum OUT → Julius Bird IN (stamina_rule2)

[02:50] Substitution (Team_037): Scottie Jackson OUT → Russell Anthony IN (stamina_rule2)

[02:50] Substitution (Team_037): Collin Young OUT → Wendell Herro IN (stamina_rule2)

[02:50] Substitution (Team_076): Dejounte LaVine OUT → Pascal Lowry IN (stamina_rule2)

[02:50] Substitution (Team_076): Tobias Mitchell OUT → Jalen Poole IN (stamina_rule2)

[02:50] Substitution (Team_076): Paul Leonard OUT → Vince Lowry IN (stamina_rule2)

[02:50] Substitution (Team_076): Cade Barnes OUT → Kevin Nowitzki IN (stamina_rule2)

[02:50] Substitution (Team_076): D'Angelo Tatum OUT → Jordan Doncic IN (stamina_rule2)

[02:34] Team_037 possession (Score: 99-85)
Wendell Herro attempts a Midrange. Contested by Jordan Doncic (3.8 feet, MAN). WENDELL HERRO MAKES IT!
Score: 101-85

[02:21] Team_076 possession (Score: 101-85)
Pascal Lowry attempts a Midrange. Contested by Julius Bird (3.8 feet, ZONE). Pascal Lowry misses. Rebound secured by Russell Anthony.

[02:06] Team_037 possession (Score: 101-85)
Julius Bird attempts a 3Pt. Wide open! Vince Lowry is 6.2 feet away. [MAN] Julius Bird misses. Rebound secured by Jordan Doncic.

[01:52] Team_076 possession (Score: 101-85)
Kevin Nowitzki attempts a Midrange. Contested by Jarrett Randle (2.6 feet, ZONE). Kevin Nowitzki misses. Rebound secured by Wendell Herro.

[01:34] Team_037 possession (Score: 101-85)
Julius Bird attempts a Midrange. Heavily contested by Vince Lowry (0.5 feet, MAN)! JULIUS BIRD MAKES IT! Assist: Russell Anthony
Score: 103-85

[01:18] Team_076 possession (Score: 103-85)
Jordan Doncic attempts a 3Pt. Heavily contested by Jarrett Randle (1.8 feet, ZONE)! Jordan Doncic misses. Rebound secured by Julius Bird.

[01:04] Team_037 possession (Score: 103-85)
FOUL! Shooting foul on Kevin Nowitzki. Russell Anthony to the line for 2 free throws. [BONUS: 9 team fouls] (Kevin Nowitzki: 1 personal fouls)   FT 1/2: GOOD   FT 2/2: GOOD Russell Anthony makes 2/2 from the line.
Score: 105-85

[00:50] Team_076 possession (Score: 105-85)
FOUL! Reach-in foul on Wendell Herro during the drive. [IN THE BONUS! 7 team fouls] Jalen Poole to the line for 2 free throws. (Wendell Herro: 1 personal fouls)   FT 1/2: GOOD   FT 2/2: GOOD Jalen Poole makes 2/2 from the line.
Score: 105-87

[00:38] Team_037 possession (Score: 105-87)
Collin Trent attempts a Midrange. Contested by Kevin Nowitzki (3.4 feet, ZONE). COLLIN TRENT MAKES IT!
Score: 107-87

[00:21] Team_076 possession (Score: 107-87)
Kevin Nowitzki drives and kicks out. Kevin Nowitzki attempts a 3Pt. Heavily contested by Russell Anthony (0.5 feet, MAN)! Kevin Nowitzki misses. Offensive rebound by Kevin Nowitzki! Kevin Nowitzki kicks it out.

[00:06] Team_076 possession (Score: 107-87)
Jalen Poole attempts a 3Pt. Contested by Jarrett Randle (5.6 feet, ZONE). JALEN POOLE MAKES IT! Assist: Kevin Nowitzki
Score: 107-90

================================================================================
                              4TH QUARTER COMPLETE                              
================================================================================

4TH QUARTER SCORE: Team_037 34, Team_076 26

BOX SCORE:
================================================================================

Team_037
--------------------------------------------------------------------------------
Player                MIN  PTS  REB  AST  TO      FG   FG%      3P   3P%
--------------------------------------------------------------------------------
Collin Young           36    8    1    1   0   3/3   100.0     0/0   0.0
Scottie Jackson        36    6    3    0   0   3/5    60.0     0/0   0.0
Giannis Middleton      36    4    0    0   0   2/4    50.0     0/0   0.0
Jarrett Tatum          36    3    2    1   0   1/3    33.3     0/0   0.0
RJ Mitchell            36    3    0    1   0   1/2    50.0     0/0   0.0
Wendell Herro          12    2    1    0   0   1/1   100.0     0/0   0.0
Russell Anthony        12    2    1    1   0   1/1   100.0     0/0   0.0
Julius Bird            12    2    1    0   0   1/2    50.0     0/0   0.0
Collin Trent           12    2    0    0   0   1/1   100.0     0/0   0.0

TEAM: FG: 14/22 (63.6%), 3PT: 2/7 (28.6%), REB: 9 (1 off, 8 def), AST: 4, TO: 0
TEAM FOULS: 7 [Team_076 in BONUS]


Team_076
--------------------------------------------------------------------------------
Player                MIN  PTS  REB  AST  TO      FG   FG%      3P   3P%
--------------------------------------------------------------------------------
Cade Barnes            36   10    3    0   0   5/8    62.5     0/0   0.0
D'Angelo Tatum         36    5    4    2   0   2/3    66.7     0/0   0.0
Jalen Poole            12    5    0    0   0   2/2   100.0     0/0   0.0
Paul Leonard           36    3    0    2   0   1/1   100.0     0/0   0.0
Tobias Mitchell        36    2    1    1   0   1/2    50.0     0/0   0.0
Dejounte LaVine        36    0    0    1   0   0/0     0.0     0/0   0.0
Pascal Lowry           12    0    0    0   0   0/1     0.0     0/0   0.0
Jordan Doncic          12    0    1    0   0   0/1     0.0     0/0   0.0
Kevin Nowitzki         12    0    1    1   0   0/1     0.0     0/0   0.0

TEAM: FG: 11/19 (57.9%), 3PT: 2/4 (50.0%), REB: 10 (2 off, 8 def), AST: 7, TO: 3
TEAM FOULS: 9 [Team_037 in BONUS]

================================================================================

================================================================================
                               FULL GAME COMPLETE                               
================================================================================

FINAL SCORE: Team_037 107, Team_076 90

SCORING BY QUARTER:
--------------------------------------------------------------------------------
Team                     Q1     Q2     Q3     Q4    FINAL
--------------------------------------------------------------------------------
Team_037                 28     17     28     34      107
Team_076                 21     23     20     26       90
--------------------------------------------------------------------------------

FULL GAME BOX SCORE:
================================================================================

Team_037
--------------------------------------------------------------------------------
Player                MIN  PTS  REB  AST  TO      FG   FG%      3P   3P%      FT STL BLK
--------------------------------------------------------------------------------
RJ Mitchell            36   11    0    4   0   3/9    33.3   2/8    25.0   1/1     2   0
Giannis Middleton      36   16    0    1   3   5/11   45.5   0/5     0.0   3/3     0   0
Jarrett Tatum          36    9    7    3   0   6/10   60.0   4/6    66.7   1/2     0   0
Scottie Jackson        36   23   18    4   2  10/16   62.5   1/3    33.3   5/7     2   0
Collin Young           36   22   14    4   0   9/15   60.0   1/1   100.0   8/9     0   1
Jarrett Randle         12    5    0    0   0   2/4    50.0   1/2    50.0   0/0     0   0
Collin Trent           12    5    0    1   0   2/3    66.7   0/1     0.0   1/1     0   1
Julius Bird            12    4    4    0   0   2/7    28.6   0/1     0.0   1/2     0   0
Russell Anthony        12    2    1    1   0   1/3    33.3   0/0     0.0   2/2     1   0
Wendell Herro          12    4    3    0   1   2/3    66.7   0/0     0.0   0/0     0   0

TEAM: FG: 44/83 (53.0%), 3PT: 9/27 (33.3%), REB: 48 (9 off, 39 def), AST: 18, TO: 6


Team_076
--------------------------------------------------------------------------------
Player                MIN  PTS  REB  AST  TO      FG   FG%      3P   3P%      FT STL BLK
--------------------------------------------------------------------------------
Dejounte LaVine        36    2    0    1   1   1/6    16.7   0/5     0.0   0/0     0   0
Tobias Mitchell        36   16    5    1   3   6/14   42.9   2/8    25.0   2/2     1   0
Paul Leonard           36   10    0    5   1   4/12   33.3   2/8    25.0   0/0     0   0
Cade Barnes            36   22   12    2   1   9/17   52.9   0/2     0.0   7/8     0   2
D'Angelo Tatum         36   15   14    3   1   6/9    66.7   0/0     0.0   3/3     0   0
Pascal Lowry           12    0    0    1   2   0/3     0.0   0/2     0.0   0/0     0   0
Jalen Poole            12    8    0    0   0   2/2   100.0   1/1   100.0   2/2     0   0
Vince Lowry            12    0    0    0   0   0/0     0.0   0/0     0.0   0/0     0   0
Kevin Nowitzki         12    9    7    2   1   4/5    80.0   0/0     0.0   3/3     0   0
Jordan Doncic          12    7    6    2   1   4/7    57.1   1/2    50.0   0/0     1   1

TEAM: FG: 38/77 (49.4%), 3PT: 6/28 (21.4%), REB: 43 (7 off, 36 def), AST: 17, TO: 11

================================================================================
