================================================================================
                        FULL GAME - Team_056 vs Team_006                        
================================================================================

================================================================================
                       1ST QUARTER - Team_056 vs Team_006                       
================================================================================

[12:00] Team_056 possession (Score: 0-0)
Magic Russell attempts a 3Pt. Wide open! Shai Westbrook is 6.8 feet away. [ZONE] MAGIC RUSSELL MAKES IT! Assist: Yao Poole
Score: 3-0

[11:47] Team_006 possession (Score: 3-0)
Shai Westbrook attempts a Layup. Heavily contested by Jrue Lillard (1.7 feet, ZONE)! SHAI WESTBROOK MAKES IT!
Score: 3-2

[11:29] Team_056 possession (Score: 3-2)
FOUL! Offensive foul on Jrue Lillard! Ja Butler drew the charge! [Team fouls: 1] (Jrue Lillard: 1 personal fouls) TURNOVER! (dead ball)

[11:12] Team_006 possession (Score: 3-2)
Ja Butler attempts a Midrange. Contested by Jrue Lillard (4.9 feet, MAN). Ja Butler misses. Rebound secured by Yao Poole.

[10:54] Team_056 possession (Score: 3-2)
Giannis Jokic drives and kicks out. Giannis Jokic attempts a 3Pt. Contested by Shai Westbrook (3.1 feet, ZONE). GIANNIS JOKIC MAKES IT! Assist: Magic Russell
Score: 6-2

[10:37] Team_006 possession (Score: 6-2)
Shai Westbrook attempts a 3Pt. Contested by Giannis Jokic (4.6 feet, MAN). Shai Westbrook misses. Rebound secured by Jrue Lillard.

[10:23] Team_056 possession (Score: 6-2)
Magic Russell attempts a 3Pt. Contested by Franz Wagner (5.5 feet, MAN). MAGIC RUSSELL MAKES IT! Assist: Jrue Lillard
Score: 9-2

[10:11] Team_006 possession (Score: 9-2)
Jayson Young attempts a Midrange. Contested by Tony Carter (2.9 feet, ZONE). Jayson Young misses. Rebound secured by Yao Poole.

[09:54] Team_056 possession (Score: 9-2)
Tony Carter attempts a 3Pt. Contested by Shai Westbrook (5.6 feet, ZONE). TONY CARTER MAKES IT!
Score: 12-2

[09:41] Team_006 possession (Score: 12-2)
Ja Butler attempts a 3Pt. Contested by Giannis Jokic (4.5 feet, ZONE). Ja Butler misses. Rebound secured by Jrue Lillard.

[09:27] Team_056 possession (Score: 12-2)
Magic Russell attempts a Midrange. Contested by Ja Butler (3.0 feet, ZONE). Magic Russell misses. Rebound secured by Shai Westbrook.

[09:13] Team_006 possession (Score: 12-2)
Jayson Young attempts a 3Pt. Heavily contested by Giannis Jokic (1.7 feet, ZONE)! Jayson Young misses. Rebound secured by Yao Poole.

[09:01] Team_056 possession (Score: 12-2)
Yao Poole attempts a Midrange. Contested by Bradley Gobert (3.5 feet, MAN). Yao Poole misses. Offensive rebound by Jrue Lillard! Jrue Lillard's putback is no good. Rebound secured by Ja Butler.

[08:51] Team_006 possession (Score: 12-2)
Shai Westbrook drives, picks up Giannis Jokic. Help arrives from Tony Carter! Shai Westbrook attempts a Dunk. Heavily contested by Tony Carter (1.6 feet, MAN)! SHAI WESTBROOK MAKES IT! Assist: Bradley Gobert
Score: 12-4

[08:38] Team_056 possession (Score: 12-4)
Giannis Jokic drives, Bradley Gobert stays with him. Giannis Jokic attempts a Layup. Contested by Bradley Gobert (5.8 feet, ZONE). Giannis Jokic misses. Rebound secured by Ja Butler.

[08:23] Team_006 possession (Score: 12-4)
Shai Westbrook drives and kicks out. Jayson Young attempts a Midrange. Contested by Tony Carter (4.8 feet, MAN). JAYSON YOUNG MAKES IT! Assist: Franz Wagner
Score: 12-6

[08:07] Team_056 possession (Score: 12-6)
Giannis Jokic attempts a Midrange. Wide open! Jayson Young is 6.4 feet away. [ZONE] Giannis Jokic misses. Rebound secured by Bradley Gobert.

[07:53] Team_006 possession (Score: 12-6)
Ja Butler attempts a Midrange. Contested by Jrue Lillard (5.2 feet, MAN). Ja Butler misses. Rebound secured by Jrue Lillard.

[07:41] Team_056 possession (Score: 12-6)
Giannis Jokic attempts a 3Pt. Contested by Shai Westbrook (2.8 feet, MAN). Giannis Jokic misses. Offensive rebound by Yao Poole! Yao Poole kicks it out.

[07:27] Team_056 possession (Score: 12-6)
Magic Russell attempts a 3Pt. Contested by Franz Wagner (5.3 feet, MAN). MAGIC RUSSELL MAKES IT! Assist: Tony Carter
Score: 15-6

[07:11] Team_006 possession (Score: 15-6)
Bradley Gobert makes the Layup and draws the foul on Yao Poole! And-1! Bradley Gobert to the line for 1. [Team fouls: 2] (Yao Poole: 1 personal fouls)   FT 1/1: GOOD Bradley Gobert makes 1/1 from the line.
Score: 15-9

[06:53] Team_056 possession (Score: 15-9)
Giannis Jokic attempts a 3Pt. Contested by Shai Westbrook (4.5 feet, MAN). Giannis Jokic misses. Rebound secured by Bradley Gobert.

[06:43] Team_006 possession (Score: 15-9)
Shai Westbrook attempts a 3Pt. Contested by Giannis Jokic (5.9 feet, MAN). Shai Westbrook misses. FOUL! Loose ball foul on Yao Poole during the rebound battle. [Team fouls: 3] No free throws, side out. (Yao Poole: 2 personal fouls)

[06:29] Team_006 possession (Score: 15-9)
Bradley Gobert makes the Dunk and draws the foul on Jrue Lillard! And-1! Bradley Gobert to the line for 1. [Team fouls: 4] (Jrue Lillard: 2 personal fouls)   FT 1/1: MISS Bradley Gobert makes 0/1 from the line. Rebound secured by Yao Poole.
Score: 15-11

[06:17] Team_056 possession (Score: 15-11)
Yao Poole attempts a 3Pt. Heavily contested by Bradley Gobert (1.2 feet, MAN)! YAO POOLE MAKES IT! Assist: Jrue Lillard
Score: 18-11

[06:04] Team_006 possession (Score: 18-11)
Jayson Young drives, picks up Tony Carter. Help arrives from Giannis Jokic! Jayson Young attempts a Layup. Contested by Giannis Jokic (3.8 feet, MAN). JAYSON YOUNG MAKES IT! Assist: Bradley Gobert
Score: 18-13

[05:47] Team_056 possession (Score: 18-13)
Yao Poole drives to the basket... Yao Poole throws a bad pass out of bounds! TURNOVER! (dead ball)

[05:27] Team_006 possession (Score: 18-13)
Ja Butler attempts a Layup. Contested by Jrue Lillard (3.4 feet, MAN). Ja Butler misses. Rebound secured by Jrue Lillard.

[05:13] Team_056 possession (Score: 18-13)
Tony Carter drives, Bradley Gobert stays with him. Tony Carter attempts a Layup. Wide open! Bradley Gobert is 6.7 feet away. [ZONE] TONY CARTER MAKES IT!
Score: 20-13

[04:59] Team_006 possession (Score: 20-13)
Bradley Gobert makes the Midrange and draws the foul on Tony Carter! And-1! Bradley Gobert to the line for 1. [BONUS: 5 team fouls] (Tony Carter: 1 personal fouls)   FT 1/1: MISS Bradley Gobert makes 0/1 from the line. Rebound secured by Jrue Lillard.
Score: 20-15

[04:44] Team_056 possession (Score: 20-15)
Tony Carter attempts a Midrange. Contested by Ja Butler (5.0 feet, ZONE). TONY CARTER MAKES IT!
Score: 22-15

[04:28] Team_006 possession (Score: 22-15)
Franz Wagner drives, Magic Russell stays with him. Franz Wagner attempts a Dunk. Contested by Magic Russell (5.2 feet, MAN). FRANZ WAGNER MAKES IT!
Score: 22-17

[04:13] Team_056 possession (Score: 22-17)
Magic Russell drives, picks up Franz Wagner. Help arrives from Shai Westbrook! Magic Russell attempts a Dunk. Contested by Shai Westbrook (3.1 feet, MAN). MAGIC RUSSELL MAKES IT!
Score: 24-17

[03:59] Team_006 possession (Score: 24-17)
Ja Butler drives, Yao Poole stays with him. Ja Butler attempts a Dunk. Contested by Yao Poole (5.8 feet, ZONE). Ja Butler misses. Rebound secured by Jrue Lillard.

[03:46] Team_056 possession (Score: 24-17)
Tony Carter attempts a 3Pt. Contested by Jayson Young (5.0 feet, MAN). TONY CARTER MAKES IT! Assist: Jrue Lillard
Score: 27-17

[03:33] Team_006 possession (Score: 27-17)
Jayson Young attempts a Midrange. Contested by Tony Carter (4.1 feet, MAN). JAYSON YOUNG MAKES IT! Assist: Bradley Gobert
Score: 27-19

[03:16] Team_056 possession (Score: 27-19)
Yao Poole attempts a Layup. Contested by Bradley Gobert (3.2 feet, ZONE). YAO POOLE MAKES IT! Assist: Jrue Lillard
Score: 29-19

[02:59] Team_006 possession (Score: 29-19)
Shai Westbrook attempts a 3Pt. Contested by Giannis Jokic (3.8 feet, MAN). Shai Westbrook misses. Offensive rebound by Ja Butler! Ja Butler's putback is no good. Rebound secured by Yao Poole.

[02:45] Team_056 possession (Score: 29-19)
Giannis Jokic attempts a 3Pt. Contested by Shai Westbrook (4.4 feet, MAN). Giannis Jokic misses. Rebound secured by Shai Westbrook.

[02:28] Team_006 possession (Score: 29-19)
Jayson Young commits a violation (traveling/carry)! TURNOVER! (dead ball)

[02:28] Substitution (Team_056): Giannis Jokic OUT → De'Aaron Murray IN (stamina_rule2)

[02:28] Substitution (Team_056): Magic Russell OUT → Damian Barrett IN (stamina_rule2)

[02:28] Substitution (Team_056): Jrue Lillard OUT → RJ Johnson IN (stamina_rule2)

[02:28] Substitution (Team_056): Yao Poole OUT → Derrick Bane IN (stamina_rule2)

[02:28] Substitution (Team_006): Franz Wagner OUT → Lamelo Westbrook IN (stamina_rule2)

[02:28] Substitution (Team_006): Ja Butler OUT → Cade Ball IN (stamina_rule2)

[02:28] Substitution (Team_006): Bradley Gobert OUT → Shaquille Sexton IN (stamina_rule2)

[02:14] Team_056 possession (Score: 29-19)
De'Aaron Murray drives to the basket... De'Aaron Murray loses the ball! Stripped by Cade Ball! TURNOVER! (live ball)

[02:00] Team_006 possession (Score: 29-19)
Cade Ball drives and kicks out. FOUL! Shooting foul on RJ Johnson. Shai Westbrook to the line for 2 free throws. [BONUS: 6 team fouls] (RJ Johnson: 1 personal fouls)   FT 1/2: GOOD   FT 2/2: GOOD Shai Westbrook makes 2/2 from the line.
Score: 29-21

[01:47] Team_056 possession (Score: 29-21)
Derrick Bane attempts a Midrange. Wide open! Shaquille Sexton is 6.1 feet away. [MAN] DERRICK BANE MAKES IT! Assist: RJ Johnson
Score: 31-21

[01:31] Team_006 possession (Score: 31-21)
Jayson Young attempts a 3Pt. Wide open! De'Aaron Murray is 10.0 feet away. [ZONE] Jayson Young misses. Offensive rebound by Shaquille Sexton! Shaquille Sexton kicks it out.

[01:14] Team_006 possession (Score: 31-21)
Shai Westbrook drives and kicks out. Lamelo Westbrook attempts a 3Pt. Contested by Tony Carter (4.8 feet, ZONE). LAMELO WESTBROOK MAKES IT! Assist: Shaquille Sexton
Score: 31-24

[01:00] Team_056 possession (Score: 31-24)
RJ Johnson attempts a Layup. Contested by Cade Ball (4.8 feet, ZONE). RJ JOHNSON MAKES IT!
Score: 33-24

[00:48] Team_006 possession (Score: 33-24)
Cade Ball drives, RJ Johnson stays with him. Cade Ball attempts a Dunk. Wide open! RJ Johnson is 7.1 feet away. [ZONE] CADE BALL MAKES IT! Assist: Shai Westbrook
Score: 33-26

[00:36] Team_056 possession (Score: 33-26)
Derrick Bane attempts a Midrange. Wide open! Shaquille Sexton is 7.0 feet away. [MAN] Derrick Bane misses. Offensive rebound by Derrick Bane! Derrick Bane kicks it out.

[00:22] Team_056 possession (Score: 33-26)
Tony Carter attempts a Layup. Contested by Cade Ball (5.8 feet, ZONE). Tony Carter misses. Offensive rebound by RJ Johnson! RJ Johnson kicks it out.

[00:04] Team_056 possession (Score: 33-26)
Derrick Bane drives and kicks out. Damian Barrett attempts a Midrange. Heavily contested by Lamelo Westbrook (1.8 feet, MAN)! Damian Barrett misses. Offensive rebound by RJ Johnson! RJ Johnson kicks it out.

================================================================================
                              1ST QUARTER COMPLETE                              
================================================================================

1ST QUARTER SCORE: Team_056 33, Team_006 26

BOX SCORE:
================================================================================

Team_056
--------------------------------------------------------------------------------
Player                MIN  PTS  REB  AST  TO      FG   FG%      3P   3P%
--------------------------------------------------------------------------------
Magic Russell          10   11    0    1   0   4/5    80.0     0/0   0.0
Tony Carter            12   10    0    1   0   4/4   100.0     0/0   0.0
Giannis Jokic          10    3    0    0   0   1/5    20.0     0/0   0.0
Derrick Bane            2    2    1    0   0   1/1   100.0     0/0   0.0
RJ Johnson              2    2    2    1   0   1/1   100.0     0/0   0.0
Jrue Lillard           10    0    6    4   0   0/0     0.0     0/0   0.0

TEAM: FG: 13/19 (68.4%), 3PT: 6/8 (75.0%), REB: 15 (5 off, 10 def), AST: 8, TO: 3
TEAM FOULS: 6 [Team_006 in BONUS]


Team_006
--------------------------------------------------------------------------------
Player                MIN  PTS  REB  AST  TO      FG   FG%      3P   3P%
--------------------------------------------------------------------------------
Shai Westbrook         12    6    2    1   0   3/5    60.0     0/0   0.0
Jayson Young           12    6    0    0   0   3/5    60.0     0/0   0.0
Yao Poole              10    5    6    1   0   2/3    66.7     0/0   0.0
Bradley Gobert         10    3    3    3   0   1/3    33.3     0/0   0.0
Lamelo Westbrook        2    3    0    0   0   1/1   100.0     0/0   0.0
Franz Wagner           10    2    0    1   0   1/1   100.0     0/0   0.0
Cade Ball               2    2    0    0   0   1/1   100.0     0/0   0.0
Ja Butler              10    0    2    0   0   0/5     0.0     0/0   0.0
Shaquille Sexton        2    0    1    1   0   0/0     0.0     0/0   0.0

TEAM: FG: 10/21 (47.6%), 3PT: 0/4 (0.0%), REB: 8 (3 off, 5 def), AST: 6, TO: 1
TEAM FOULS: 0

================================================================================

================================================================================
                       2ND QUARTER - Team_056 vs Team_006                       
================================================================================

[12:00] Team_056 possession (Score: 33-26)
Yao Poole makes the Layup and draws the foul on Bradley Gobert! And-1! Yao Poole to the line for 1. [Team fouls: 1] (Bradley Gobert: 1 personal fouls)   FT 1/1: GOOD Yao Poole makes 1/1 from the line.
Score: 36-26

[11:43] Team_006 possession (Score: 36-26)
Jayson Young drives, picks up Tony Carter. Help arrives from Giannis Jokic! Jayson Young attempts a Dunk. Contested by Giannis Jokic (3.6 feet, MAN). JAYSON YOUNG MAKES IT! Assist: Bradley Gobert
Score: 36-28

[11:28] Team_056 possession (Score: 36-28)
Yao Poole attempts a Layup. Contested by Bradley Gobert (3.2 feet, MAN). YAO POOLE MAKES IT! Assist: Tony Carter
Score: 38-28

[11:16] Team_006 possession (Score: 38-28)
Shai Westbrook drives and kicks out. Shai Westbrook attempts a 3Pt. Contested by Giannis Jokic (3.6 feet, ZONE). SHAI WESTBROOK MAKES IT! Assist: Ja Butler
Score: 38-31

[11:05] Team_056 possession (Score: 38-31)
Yao Poole makes the Layup and draws the foul on Bradley Gobert! And-1! Yao Poole to the line for 1. [Team fouls: 2] (Bradley Gobert: 2 personal fouls)   FT 1/1: MISS Yao Poole makes 0/1 from the line. Rebound secured by Shai Westbrook.
Score: 40-31

[10:52] Team_006 possession (Score: 40-31)
Shai Westbrook attempts a Layup. BLOCKED BY GIANNIS JOKIC! Ball is loose! Rebound secured by Jrue Lillard.

[10:36] Team_056 possession (Score: 40-31)
Jrue Lillard makes the Layup and draws the foul on Bradley Gobert! And-1! Jrue Lillard to the line for 1. [Team fouls: 3] (Bradley Gobert: 3 personal fouls)   FT 1/1: MISS Jrue Lillard makes 0/1 from the line. Rebound secured by Ja Butler.
Score: 42-31

[10:24] Team_006 possession (Score: 42-31)
Jayson Young drives and kicks out. Ja Butler attempts a 3Pt. Contested by Giannis Jokic (4.6 feet, ZONE). Ja Butler misses. Offensive rebound by Bradley Gobert! Bradley Gobert kicks it out.

[10:07] Team_006 possession (Score: 42-31)
Franz Wagner attempts a Layup. Contested by Jrue Lillard (3.1 feet, ZONE). Franz Wagner misses. Rebound secured by Jrue Lillard.

[09:49] Team_056 possession (Score: 42-31)
FOUL! Holding foul on Shai Westbrook. [Team fouls: 4] No free throws, side out. (Shai Westbrook: 1 personal fouls)

[09:35] Team_056 possession (Score: 42-31)
Jrue Lillard attempts a 3Pt. Wide open! Shai Westbrook is 6.6 feet away. [ZONE] Jrue Lillard misses. Rebound secured by Bradley Gobert.

[09:18] Team_006 possession (Score: 42-31)
Shai Westbrook attempts a Midrange. Contested by Giannis Jokic (5.0 feet, MAN). Shai Westbrook misses. Rebound secured by Yao Poole.

[09:08] Team_056 possession (Score: 42-31)
Giannis Jokic drives to the basket... FOUL! Offensive foul on Giannis Jokic! Shai Westbrook drew the charge! [Team fouls: 1] (Giannis Jokic: 1 personal fouls) TURNOVER! (dead ball)

[08:57] Team_006 possession (Score: 42-31)
FOUL! Reach-in foul on Giannis Jokic during the drive. [Team fouls: 2] No free throws, side out. (Giannis Jokic: 2 personal fouls)

[08:41] Team_006 possession (Score: 42-31)
Jayson Young attempts a 3Pt. Contested by Giannis Jokic (4.7 feet, ZONE). JAYSON YOUNG MAKES IT!
Score: 42-34

[08:26] Team_056 possession (Score: 42-34)
Tony Carter drives to the basket... Tony Carter commits a violation (traveling/carry)! TURNOVER! (dead ball)

[08:26] Substitution (Team_056): Giannis Jokic OUT → De'Aaron Murray IN (stamina_rule2)

[08:26] Substitution (Team_056): Magic Russell OUT → Damian Barrett IN (stamina_rule2)

[08:26] Substitution (Team_056): Tony Carter OUT → CJ Anthony IN (stamina_rule2)

[08:26] Substitution (Team_056): Jrue Lillard OUT → RJ Johnson IN (stamina_rule2)

[08:26] Substitution (Team_056): Yao Poole OUT → Derrick Bane IN (stamina_rule2)

[08:26] Substitution (Team_006): Shai Westbrook OUT → Miles Harris IN (stamina_rule2)

[08:26] Substitution (Team_006): Franz Wagner OUT → Lamelo Westbrook IN (stamina_rule2)

[08:26] Substitution (Team_006): Jayson Young OUT → Vince Sabonis IN (stamina_rule2)

[08:26] Substitution (Team_006): Ja Butler OUT → Cade Ball IN (stamina_rule2)

[08:26] Substitution (Team_006): Bradley Gobert OUT → Shaquille Sexton IN (stamina_rule2)

[08:14] Team_006 possession (Score: 42-34)
Vince Sabonis attempts a Midrange. Contested by CJ Anthony (3.7 feet, ZONE). VINCE SABONIS MAKES IT!
Score: 42-36

[07:59] Team_056 possession (Score: 42-36)
CJ Anthony attempts a Midrange. Contested by Vince Sabonis (3.5 feet, ZONE). CJ ANTHONY MAKES IT!
Score: 44-36

[07:46] Team_006 possession (Score: 44-36)
Lamelo Westbrook attempts a 3Pt. Heavily contested by Damian Barrett (0.5 feet, MAN)! Lamelo Westbrook misses. Rebound secured by CJ Anthony.

[07:34] Team_056 possession (Score: 44-36)
FOUL! Reach-in foul on Cade Ball during the drive. [IN THE BONUS! 5 team fouls] Derrick Bane to the line for 2 free throws. (Cade Ball: 1 personal fouls)   FT 1/2: MISS   FT 2/2: GOOD Derrick Bane makes 1/2 from the line.
Score: 45-36

[07:20] Team_006 possession (Score: 45-36)
FOUL! Offensive foul on Cade Ball! RJ Johnson drew the charge! [Team fouls: 6] (Cade Ball: 2 personal fouls) TURNOVER! (dead ball)

[07:06] Team_056 possession (Score: 45-36)
Damian Barrett attempts a 3Pt. Heavily contested by Lamelo Westbrook (1.3 feet, MAN)! Damian Barrett misses. Rebound secured by Cade Ball.

[06:51] Team_006 possession (Score: 45-36)
Vince Sabonis attempts a 3Pt. Wide open! De'Aaron Murray is 8.2 feet away. [ZONE] VINCE SABONIS MAKES IT! Assist: Lamelo Westbrook
Score: 45-39

[06:34] Team_056 possession (Score: 45-39)
RJ Johnson attempts a Midrange. Wide open! Vince Sabonis is 6.8 feet away. [ZONE] RJ Johnson misses. Rebound secured by Cade Ball.

[06:19] Team_006 possession (Score: 45-39)
Cade Ball attempts a Layup. Contested by RJ Johnson (5.7 feet, ZONE). CADE BALL MAKES IT! Assist: Miles Harris
Score: 45-41

[06:09] Team_056 possession (Score: 45-41)
FOUL! Shooting foul on Lamelo Westbrook. De'Aaron Murray to the line for 2 free throws. [BONUS: 7 team fouls] (Lamelo Westbrook: 1 personal fouls)   FT 1/2: MISS   FT 2/2: GOOD De'Aaron Murray makes 1/2 from the line.
Score: 46-41

[05:52] Team_006 possession (Score: 46-41)
Cade Ball drives and kicks out. Vince Sabonis attempts a 3Pt. Contested by De'Aaron Murray (3.8 feet, ZONE). Vince Sabonis misses. Rebound secured by Derrick Bane.

[05:35] Team_056 possession (Score: 46-41)
CJ Anthony attempts a Layup. Contested by Vince Sabonis (5.7 feet, MAN). CJ ANTHONY MAKES IT! Assist: De'Aaron Murray
Score: 48-41

[05:19] Team_006 possession (Score: 48-41)
Cade Ball drives, RJ Johnson stays with him. Cade Ball attempts a Dunk. Contested by RJ Johnson (3.8 feet, MAN). CADE BALL MAKES IT!
Score: 48-43

[05:04] Team_056 possession (Score: 48-43)
Damian Barrett attempts a 3Pt. Contested by Lamelo Westbrook (3.8 feet, MAN). Damian Barrett misses. Rebound secured by Vince Sabonis.

[04:49] Team_006 possession (Score: 48-43)
Cade Ball drives to the basket... Cade Ball throws a bad pass out of bounds! TURNOVER! (dead ball)

[04:39] Team_056 possession (Score: 48-43)
RJ Johnson attempts a 3Pt. Contested by Cade Ball (3.7 feet, MAN). RJ Johnson misses. Rebound secured by Cade Ball.

[04:24] Team_006 possession (Score: 48-43)
Vince Sabonis attempts a Midrange. Heavily contested by CJ Anthony (1.0 feet, ZONE)! VINCE SABONIS MAKES IT!
Score: 48-45

[04:12] Team_056 possession (Score: 48-45)
FOUL! Holding foul on Shaquille Sexton. [IN THE BONUS! 8 team fouls] Derrick Bane to the line for 2 free throws. (Shaquille Sexton: 1 personal fouls)   FT 1/2: GOOD   FT 2/2: GOOD Derrick Bane makes 2/2 from the line.
Score: 50-45

[03:58] Team_006 possession (Score: 50-45)
Shaquille Sexton attempts a 3Pt. Wide open! Derrick Bane is 7.2 feet away. [MAN] SHAQUILLE SEXTON MAKES IT! Assist: Vince Sabonis
Score: 50-48

[03:49] Team_056 possession (Score: 50-48)
De'Aaron Murray attempts a Midrange. Wide open! Miles Harris is 6.5 feet away. [MAN] De'Aaron Murray misses. Offensive rebound by CJ Anthony! CJ Anthony kicks it out.

[03:37] Team_056 possession (Score: 50-48)
Derrick Bane attempts a Layup. Contested by Cade Ball (2.8 feet, ZONE). DERRICK BANE MAKES IT!
Score: 52-48

[03:26] Team_006 possession (Score: 52-48)
Vince Sabonis drives, CJ Anthony stays with him. Vince Sabonis attempts a Dunk. Contested by CJ Anthony (4.0 feet, MAN). Vince Sabonis misses. Rebound secured by Derrick Bane.

[03:12] Team_056 possession (Score: 52-48)
FOUL! Holding foul on Lamelo Westbrook. [IN THE BONUS! 9 team fouls] Damian Barrett to the line for 2 free throws. (Lamelo Westbrook: 2 personal fouls)   FT 1/2: GOOD   FT 2/2: GOOD Damian Barrett makes 2/2 from the line.
Score: 54-48

[02:57] Team_006 possession (Score: 54-48)
Lamelo Westbrook makes the Dunk and draws the foul on RJ Johnson! And-1! Lamelo Westbrook to the line for 1. [Team fouls: 3] (RJ Johnson: 1 personal fouls)   FT 1/1: GOOD Lamelo Westbrook makes 1/1 from the line.
Score: 54-51

[02:43] Team_056 possession (Score: 54-51)
CJ Anthony attempts a 3Pt. Heavily contested by Lamelo Westbrook (0.5 feet, ZONE)! CJ Anthony misses. Rebound secured by Vince Sabonis.

[02:32] Team_006 possession (Score: 54-51)
Miles Harris attempts a 3Pt. Contested by De'Aaron Murray (4.1 feet, ZONE). Miles Harris misses. Rebound secured by Derrick Bane.

[02:20] Team_056 possession (Score: 54-51)
De'Aaron Murray attempts a 3Pt. Contested by Lamelo Westbrook (5.6 feet, ZONE). De'Aaron Murray misses. Rebound secured by Shaquille Sexton.

[02:09] Team_006 possession (Score: 54-51)
Lamelo Westbrook attempts a Midrange. Wide open! Damian Barrett is 9.8 feet away. [ZONE] Lamelo Westbrook misses. Rebound secured by RJ Johnson.

[01:58] Team_056 possession (Score: 54-51)
Damian Barrett attempts a 3Pt. Heavily contested by Lamelo Westbrook (1.5 feet, ZONE)! Damian Barrett misses. Rebound secured by Vince Sabonis.

[01:45] Team_006 possession (Score: 54-51)
Cade Ball drives, picks up RJ Johnson. Help arrives from Damian Barrett! Cade Ball attempts a Layup. Wide open! Damian Barrett is 8.6 feet away. [ZONE] CADE BALL MAKES IT! Assist: Lamelo Westbrook
Score: 54-53

[01:30] Team_056 possession (Score: 54-53)
RJ Johnson loses control! Ball rolls out of bounds! TURNOVER! (dead ball)

[01:19] Team_006 possession (Score: 54-53)
Vince Sabonis drives to the basket... Vince Sabonis throws a bad pass! Stolen by CJ Anthony! TURNOVER! (live ball)

[01:02] Team_056 possession (Score: 54-53)
RJ Johnson attempts a Midrange. Contested by Vince Sabonis (5.5 feet, ZONE). RJ JOHNSON MAKES IT!
Score: 56-53

[00:48] Team_006 possession (Score: 56-53)
Vince Sabonis attempts a 3Pt. Contested by CJ Anthony (2.1 feet, ZONE). VINCE SABONIS MAKES IT! Assist: Miles Harris
Score: 56-56

[00:32] Team_056 possession (Score: 56-56)
FOUL! Offensive foul on Derrick Bane! Shaquille Sexton drew the charge! [Team fouls: 4] (Derrick Bane: 1 personal fouls) TURNOVER! (dead ball)

[00:19] Team_006 possession (Score: 56-56)
Lamelo Westbrook attempts a 3Pt. Contested by CJ Anthony (3.4 feet, ZONE). Lamelo Westbrook misses. Rebound secured by Derrick Bane.

[00:06] Team_056 possession (Score: 56-56)
FOUL! Shooting foul on Cade Ball. RJ Johnson to the line for 2 free throws. [BONUS: 10 team fouls] (Cade Ball: 3 personal fouls)   FT 1/2: GOOD   FT 2/2: GOOD RJ Johnson makes 2/2 from the line.
Score: 58-56

================================================================================
                              2ND QUARTER COMPLETE                              
================================================================================

2ND QUARTER SCORE: Team_056 25, Team_006 30

BOX SCORE:
================================================================================

Team_056
--------------------------------------------------------------------------------
Player                MIN  PTS  REB  AST  TO      FG   FG%      3P   3P%
--------------------------------------------------------------------------------
Yao Poole              14    5    1    0   0   2/3    66.7     0/0   0.0
Derrick Bane           11    5    4    0   0   3/3   100.0     0/0   0.0
CJ Anthony              8    4    2    0   0   2/3    66.7     0/0   0.0
RJ Johnson             11    4    1    0   0   2/4    50.0     0/0   0.0
Damian Barrett         11    2    0    0   0   1/4    25.0     0/0   0.0
De'Aaron Murray        11    1    0    1   0   1/2    50.0     0/0   0.0
Tony Carter            16    0    0    1   0   0/0     0.0     0/0   0.0
Jrue Lillard           14    0    2    0   0   0/2     0.0     0/0   0.0

TEAM: FG: 11/21 (52.4%), 3PT: 0/7 (0.0%), REB: 10 (1 off, 9 def), AST: 2, TO: 4
TEAM FOULS: 4


Team_006
--------------------------------------------------------------------------------
Player                MIN  PTS  REB  AST  TO      FG   FG%      3P   3P%
--------------------------------------------------------------------------------
Vince Sabonis           8   10    3    1   0   4/5    80.0     0/0   0.0
Cade Ball              11    6    3    0   0   3/4    75.0     0/0   0.0
Jayson Young           16    5    0    0   0   2/2   100.0     0/0   0.0
Shai Westbrook         16    3    1    0   0   1/3    33.3     0/0   0.0
Lamelo Westbrook       11    3    0    2   0   1/4    25.0     0/0   0.0
Shaquille Sexton       11    3    1    0   0   1/1   100.0     0/0   0.0
Bradley Gobert         14    0    2    1   0   0/0     0.0     0/0   0.0
Ja Butler              14    0    1    1   0   0/0     0.0     0/0   0.0
Franz Wagner           14    0    0    0   0   0/1     0.0     0/0   0.0
Miles Harris            8    0    0    2   0   0/1     0.0     0/0   0.0

TEAM: FG: 12/21 (57.1%), 3PT: 4/7 (57.1%), REB: 11 (1 off, 10 def), AST: 7, TO: 3
TEAM FOULS: 10 [Team_056 in BONUS]

================================================================================

================================================================================
                       3RD QUARTER - Team_056 vs Team_006                       
================================================================================

[12:00] Team_056 possession (Score: 58-56)
Yao Poole attempts a Midrange. Heavily contested by Bradley Gobert (1.6 feet, ZONE)! Yao Poole misses. Offensive rebound by Yao Poole! Yao Poole kicks it out.

[11:40] Team_056 possession (Score: 58-56)
Jrue Lillard drives, picks up Ja Butler. Help arrives from Shai Westbrook! Jrue Lillard attempts a Dunk. Contested by Shai Westbrook (6.0 feet, MAN). JRUE LILLARD MAKES IT!
Score: 60-56

[11:26] Team_006 possession (Score: 60-56)
Ja Butler attempts a Layup. Wide open! Jrue Lillard is 7.0 feet away. [MAN] JA BUTLER MAKES IT!
Score: 60-58

[11:13] Team_056 possession (Score: 60-58)
Yao Poole drives to the basket... FOUL! Offensive foul on Yao Poole! Bradley Gobert drew the charge! [Team fouls: 1] (Yao Poole: 1 personal fouls) TURNOVER! (dead ball)

[10:56] Team_006 possession (Score: 60-58)
Ja Butler drives and kicks out. Shai Westbrook attempts a 3Pt. Wide open! Giannis Jokic is 8.5 feet away. [MAN] Shai Westbrook misses. Rebound secured by Yao Poole.

[10:42] Team_056 possession (Score: 60-58)
Jrue Lillard attempts a Midrange. Contested by Ja Butler (4.9 feet, ZONE). JRUE LILLARD MAKES IT! Assist: Tony Carter
Score: 62-58

[10:27] Team_006 possession (Score: 62-58)
Jayson Young attempts a 3Pt. Contested by Tony Carter (5.0 feet, MAN). JAYSON YOUNG MAKES IT! Assist: Franz Wagner
Score: 62-61

[10:13] Team_056 possession (Score: 62-61)
Magic Russell drives and kicks out. Tony Carter attempts a 3Pt. Contested by Jayson Young (5.7 feet, MAN). Tony Carter misses. Rebound secured by Shai Westbrook.

[09:59] Team_006 possession (Score: 62-61)
Jayson Young attempts a 3Pt. Wide open! Tony Carter is 6.4 feet away. [MAN] JAYSON YOUNG MAKES IT! Assist: Shai Westbrook
Score: 62-64

[09:42] Team_056 possession (Score: 62-64)
Tony Carter drives, Bradley Gobert stays with him. Tony Carter attempts a Dunk. Heavily contested by Bradley Gobert (1.3 feet, ZONE)! TONY CARTER MAKES IT!
Score: 64-64

[09:25] Team_006 possession (Score: 64-64)
Shai Westbrook drives and kicks out. Bradley Gobert attempts a Midrange. Contested by Magic Russell (4.5 feet, ZONE). BRADLEY GOBERT MAKES IT!
Score: 64-66

[09:08] Team_056 possession (Score: 64-66)
Tony Carter attempts a Layup. Contested by Bradley Gobert (4.9 feet, ZONE). TONY CARTER MAKES IT!
Score: 66-66

[08:52] Team_006 possession (Score: 66-66)
Franz Wagner makes the 3Pt and draws the foul on Magic Russell! And-1! Franz Wagner to the line for 1. [Team fouls: 2] (Magic Russell: 1 personal fouls)   FT 1/1: GOOD Franz Wagner makes 1/1 from the line.
Score: 66-70

[08:43] Team_056 possession (Score: 66-70)
Yao Poole drives and kicks out. Yao Poole attempts a 3Pt. Contested by Shai Westbrook (2.8 feet, ZONE). Yao Poole misses. Rebound secured by Bradley Gobert.

[08:27] Team_006 possession (Score: 66-70)
Ja Butler attempts a Midrange. Wide open! Magic Russell is 6.2 feet away. [ZONE] Ja Butler misses. Offensive rebound by Bradley Gobert! Bradley Gobert kicks it out.

[08:15] Team_006 possession (Score: 66-70)
Franz Wagner attempts a 3Pt. Wide open! Giannis Jokic is 6.4 feet away. [ZONE] Franz Wagner misses. Rebound secured by Jrue Lillard.

[08:04] Team_056 possession (Score: 66-70)
Yao Poole attempts a 3Pt. Contested by Bradley Gobert (6.0 feet, MAN). Yao Poole misses. Rebound secured by Ja Butler.

[07:46] Team_006 possession (Score: 66-70)
Bradley Gobert throws a bad pass out of bounds! TURNOVER! (dead ball)

[07:29] Team_056 possession (Score: 66-70)
Giannis Jokic attempts a 3Pt. Contested by Shai Westbrook (4.1 feet, MAN). Giannis Jokic misses. Rebound secured by Bradley Gobert.

[07:17] Team_006 possession (Score: 66-70)
Shai Westbrook attempts a Midrange. Wide open! Giannis Jokic is 6.3 feet away. [MAN] SHAI WESTBROOK MAKES IT! Assist: Ja Butler
Score: 66-72

[07:00] Team_056 possession (Score: 66-72)
FOUL! Shooting foul on Bradley Gobert. Yao Poole to the line for 2 free throws. [Team fouls: 1] (Bradley Gobert: 1 personal fouls)   FT 1/2: MISS   FT 2/2: GOOD Yao Poole makes 1/2 from the line.
Score: 67-72

[06:49] Team_006 possession (Score: 67-72)
Shai Westbrook drives and kicks out. Franz Wagner attempts a Midrange. Contested by Magic Russell (3.7 feet, MAN). Franz Wagner misses. Rebound secured by Jrue Lillard.

[06:36] Team_056 possession (Score: 67-72)
Yao Poole drives to the basket... Yao Poole throws a bad pass! Stolen by Bradley Gobert! TURNOVER! (live ball)

[06:25] Team_006 possession (Score: 67-72)
Bradley Gobert makes the Layup and draws the foul on Jrue Lillard! And-1! Bradley Gobert to the line for 1. [Team fouls: 3] (Jrue Lillard: 1 personal fouls)   FT 1/1: GOOD Bradley Gobert makes 1/1 from the line.
Score: 67-75

[06:09] Team_056 possession (Score: 67-75)
Yao Poole throws a bad pass out of bounds! TURNOVER! (dead ball)

[05:52] Team_006 possession (Score: 67-75)
Shai Westbrook attempts a Layup. Wide open! Giannis Jokic is 6.8 feet away. [MAN] SHAI WESTBROOK MAKES IT! Assist: Franz Wagner
Score: 67-77

[05:36] Team_056 possession (Score: 67-77)
Yao Poole makes the Midrange and draws the foul on Bradley Gobert! And-1! Yao Poole to the line for 1. [Team fouls: 2] (Bradley Gobert: 2 personal fouls)   FT 1/1: GOOD Yao Poole makes 1/1 from the line.
Score: 70-77

[05:18] Team_006 possession (Score: 70-77)
Franz Wagner attempts a 3Pt. Contested by Giannis Jokic (2.7 feet, ZONE). Franz Wagner misses. Rebound secured by Tony Carter.

[05:05] Team_056 possession (Score: 70-77)
Giannis Jokic attempts a Layup. Heavily contested by Bradley Gobert (1.4 feet, ZONE)! GIANNIS JOKIC MAKES IT! Assist: Yao Poole
Score: 72-77

[04:47] Team_006 possession (Score: 72-77)
FOUL! Reach-in foul on Yao Poole during the drive. [Team fouls: 4] No free throws, side out. (Yao Poole: 2 personal fouls)

[04:36] Team_006 possession (Score: 72-77)
Jayson Young attempts a Layup. Contested by Jrue Lillard (5.6 feet, ZONE). JAYSON YOUNG MAKES IT! Assist: Ja Butler
Score: 72-79

[04:19] Team_056 possession (Score: 72-79)
Magic Russell attempts a Layup. BLOCKED BY BRADLEY GOBERT! Ball is loose! Rebound secured by Shai Westbrook.

[04:02] Team_006 possession (Score: 72-79)
Ja Butler attempts a 3Pt. Contested by Tony Carter (5.9 feet, ZONE). Ja Butler misses. Rebound secured by Tony Carter.

[03:49] Team_056 possession (Score: 72-79)
Tony Carter attempts a Layup. Contested by Bradley Gobert (2.5 feet, ZONE). Tony Carter misses. Rebound secured by Bradley Gobert.

[03:32] Team_006 possession (Score: 72-79)
Franz Wagner attempts a 3Pt. Wide open! Giannis Jokic is 8.8 feet away. [ZONE] FRANZ WAGNER MAKES IT!
Score: 72-82

[03:12] Team_056 possession (Score: 72-82)
Magic Russell attempts a 3Pt. Contested by Shai Westbrook (5.2 feet, ZONE). Magic Russell misses. Rebound secured by Ja Butler.

[03:01] Team_006 possession (Score: 72-82)
Franz Wagner attempts a 3Pt. Contested by Giannis Jokic (5.2 feet, ZONE). Franz Wagner misses. Rebound secured by Jrue Lillard.

[02:42] Team_056 possession (Score: 72-82)
Giannis Jokic attempts a 3Pt. Contested by Jayson Young (5.4 feet, ZONE). GIANNIS JOKIC MAKES IT! Assist: Yao Poole
Score: 75-82

[02:29] Team_006 possession (Score: 75-82)
Shai Westbrook makes the Layup and draws the foul on Giannis Jokic! And-1! Shai Westbrook to the line for 1. [BONUS: 5 team fouls] (Giannis Jokic: 1 personal fouls)   FT 1/1: MISS Shai Westbrook makes 0/1 from the line. Rebound secured by Tony Carter.
Score: 75-84

[02:17] Team_056 possession (Score: 75-84)
Magic Russell attempts a Midrange. Wide open! Franz Wagner is 7.6 feet away. [ZONE] Magic Russell misses. Rebound secured by Ja Butler.

[02:06] Team_006 possession (Score: 75-84)
Bradley Gobert attempts a 3Pt. Contested by Yao Poole (5.7 feet, MAN). Bradley Gobert misses. Rebound secured by Yao Poole.

[01:52] Team_056 possession (Score: 75-84)
FOUL! Offensive foul on Tony Carter! Jayson Young drew the charge! [Team fouls: 6] (Tony Carter: 1 personal fouls) TURNOVER! (dead ball)

[01:35] Team_006 possession (Score: 75-84)
FOUL! Shooting foul on Giannis Jokic. Bradley Gobert to the line for 2 free throws. [BONUS: 7 team fouls] (Giannis Jokic: 2 personal fouls)   FT 1/2: GOOD   FT 2/2: GOOD Bradley Gobert makes 2/2 from the line.
Score: 75-86

[01:21] Team_056 possession (Score: 75-86)
Tony Carter attempts a Midrange. Contested by Jayson Young (3.1 feet, MAN). Tony Carter misses. FOUL! Loose ball foul on Ja Butler during the rebound battle. [Team fouls: 3] No free throws, side out. (Ja Butler: 1 personal fouls)

[01:03] Team_056 possession (Score: 75-86)
FOUL! Reach-in foul on Bradley Gobert during the drive. [Team fouls: 4] No free throws, side out. (Bradley Gobert: 3 personal fouls)

[00:53] Team_056 possession (Score: 75-86)
FOUL! Reach-in foul on Bradley Gobert during the drive. [IN THE BONUS! 5 team fouls] Jrue Lillard to the line for 2 free throws. (Bradley Gobert: 4 personal fouls)   FT 1/2: GOOD   FT 2/2: GOOD Jrue Lillard makes 2/2 from the line.
Score: 77-86

[00:39] Team_006 possession (Score: 77-86)
Jayson Young attempts a 3Pt. Heavily contested by Giannis Jokic (1.7 feet, ZONE)! Jayson Young misses. Rebound secured by Yao Poole.

[00:26] Team_056 possession (Score: 77-86)
Magic Russell drives, Bradley Gobert stays with him. Magic Russell attempts a Dunk. Contested by Bradley Gobert (5.3 feet, ZONE). MAGIC RUSSELL MAKES IT!
Score: 79-86

[00:13] Team_006 possession (Score: 79-86)
Jayson Young attempts a 3Pt. Wide open! Tony Carter is 7.1 feet away. [MAN] JAYSON YOUNG MAKES IT! Assist: Shai Westbrook
Score: 79-89

================================================================================
                              3RD QUARTER COMPLETE                              
================================================================================

3RD QUARTER SCORE: Team_056 21, Team_006 33

BOX SCORE:
================================================================================

Team_056
--------------------------------------------------------------------------------
Player                MIN  PTS  REB  AST  TO      FG   FG%      3P   3P%
--------------------------------------------------------------------------------
Jrue Lillard           26    6    4    0   0   3/3   100.0     0/0   0.0
Giannis Jokic          26    5    0    0   0   2/3    66.7     0/0   0.0
Yao Poole              26    4    4    2   0   2/4    50.0     0/0   0.0
Tony Carter            28    4    3    1   0   2/3    66.7     0/0   0.0
Magic Russell          26    2    0    0   0   1/5    20.0     0/0   0.0

TEAM: FG: 10/18 (55.6%), 3PT: 1/4 (25.0%), REB: 11 (2 off, 9 def), AST: 3, TO: 4
TEAM FOULS: 7 [Team_006 in BONUS]


Team_006
--------------------------------------------------------------------------------
Player                MIN  PTS  REB  AST  TO      FG   FG%      3P   3P%
--------------------------------------------------------------------------------
Jayson Young           28   11    0    0   0   4/5    80.0     0/0   0.0
Franz Wagner           26    7    0    2   0   2/5    40.0     0/0   0.0
Bradley Gobert         26    7    4    0   0   3/4    75.0     0/0   0.0
Shai Westbrook         28    4    2    2   0   2/4    50.0     0/0   0.0
Ja Butler              26    2    3    2   0   1/3    33.3     0/0   0.0

TEAM: FG: 12/21 (57.1%), 3PT: 5/11 (45.5%), REB: 9 (1 off, 8 def), AST: 6, TO: 1
TEAM FOULS: 5 [Team_056 in BONUS]

================================================================================

================================================================================
                       4TH QUARTER - Team_056 vs Team_006                       
================================================================================

[12:00] Substitution (Team_056): Giannis Jokic OUT (stamina: 69) → De'Aaron Murray IN (comeback_detected)

[12:00] Substitution (Team_006): Shai Westbrook OUT (stamina: 71) → Miles Harris IN (comeback_detected)

[12:00] Team_056 possession (Score: 79-89)
Magic Russell attempts a Midrange. Contested by Jayson Young (2.6 feet, ZONE). Magic Russell misses. Offensive rebound by Jrue Lillard! Jrue Lillard puts it back in!
Score: 81-89

[11:44] Team_006 possession (Score: 81-89)
Jayson Young attempts a Midrange. Contested by Tony Carter (2.2 feet, MAN). Jayson Young misses. Rebound secured by Jrue Lillard.

[11:30] Team_056 possession (Score: 81-89)
De'Aaron Murray drives and kicks out. Tony Carter attempts a Midrange. Contested by Jayson Young (3.3 feet, MAN). Tony Carter misses. Rebound secured by Ja Butler.

[11:14] Team_006 possession (Score: 81-89)
Franz Wagner attempts a 3Pt. Contested by Magic Russell (5.6 feet, MAN). Franz Wagner misses. Rebound secured by Jrue Lillard.

[11:00] Team_056 possession (Score: 81-89)
FOUL! Offensive foul on Jrue Lillard! Ja Butler drew the charge! [Team fouls: 1] (Jrue Lillard: 1 personal fouls) TURNOVER! (dead ball)

[10:47] Team_006 possession (Score: 81-89)
Miles Harris attempts a Midrange. Contested by Tony Carter (5.6 feet, ZONE). Miles Harris misses. Rebound secured by Yao Poole.

[10:33] Team_056 possession (Score: 81-89)
Tony Carter attempts a Layup. BLOCKED BY JAYSON YOUNG! Ball is loose! Rebound secured by Bradley Gobert.

[10:15] Team_006 possession (Score: 81-89)
Jayson Young attempts a Midrange. Contested by Tony Carter (5.6 feet, MAN). JAYSON YOUNG MAKES IT! Assist: Bradley Gobert
Score: 81-91

[10:02] Team_056 possession (Score: 81-91)
Magic Russell attempts a Midrange. Wide open! Bradley Gobert is 6.7 feet away. [ZONE] MAGIC RUSSELL MAKES IT!
Score: 83-91

[09:47] Team_006 possession (Score: 83-91)
Franz Wagner attempts a 3Pt. Contested by Tony Carter (3.6 feet, ZONE). Franz Wagner misses. Rebound secured by Tony Carter.

[09:34] Team_056 possession (Score: 83-91)
Tony Carter attempts a 3Pt. Contested by Jayson Young (6.0 feet, MAN). TONY CARTER MAKES IT! Assist: De'Aaron Murray
Score: 86-91

[09:20] Team_006 possession (Score: 86-91)
Franz Wagner attempts a Midrange. Contested by Tony Carter (4.6 feet, ZONE). Franz Wagner misses. Rebound secured by Yao Poole.

[09:05] Team_056 possession (Score: 86-91)
Tony Carter attempts a 3Pt. Wide open! Miles Harris is 6.3 feet away. [ZONE] Tony Carter misses. Rebound secured by Ja Butler.

[08:50] Team_006 possession (Score: 86-91)
Miles Harris attempts a Midrange. Wide open! Magic Russell is 8.6 feet away. [ZONE] Miles Harris misses. Rebound secured by Tony Carter.

[08:35] Team_056 possession (Score: 86-91)
De'Aaron Murray loses control! Ball rolls out of bounds! TURNOVER! (dead ball)

[08:35] Substitution (Team_056): Magic Russell OUT → Damian Barrett IN (stamina_rule2)

[08:35] Substitution (Team_056): Tony Carter OUT → CJ Anthony IN (stamina_rule2)

[08:35] Substitution (Team_056): Jrue Lillard OUT → RJ Johnson IN (stamina_rule2)

[08:35] Substitution (Team_056): Yao Poole OUT → Derrick Bane IN (stamina_rule2)

[08:35] Substitution (Team_006): Franz Wagner OUT → Lamelo Westbrook IN (stamina_rule2)

[08:35] Substitution (Team_006): Jayson Young OUT → Vince Sabonis IN (stamina_rule2)

[08:35] Substitution (Team_006): Ja Butler OUT → Cade Ball IN (stamina_rule2)

[08:35] Substitution (Team_006): Bradley Gobert OUT → Shaquille Sexton IN (stamina_rule2)

[08:19] Team_006 possession (Score: 86-91)
Shaquille Sexton drives, picks up RJ Johnson. Help arrives from Damian Barrett! Shaquille Sexton attempts a Dunk. Contested by Damian Barrett (4.3 feet, ZONE). Shaquille Sexton misses. Rebound secured by RJ Johnson.

[08:05] Team_056 possession (Score: 86-91)
Derrick Bane attempts a Midrange. Wide open! Shaquille Sexton is 6.7 feet away. [MAN] DERRICK BANE MAKES IT! Assist: CJ Anthony
Score: 88-91

[07:50] Team_006 possession (Score: 88-91)
Miles Harris attempts a 3Pt. Wide open! De'Aaron Murray is 7.2 feet away. [ZONE] MILES HARRIS MAKES IT! Assist: Cade Ball
Score: 88-94

[07:33] Team_056 possession (Score: 88-94)
FOUL! Holding foul on Cade Ball. [Team fouls: 1] No free throws, side out. (Cade Ball: 1 personal fouls)

[07:19] Team_056 possession (Score: 88-94)
Derrick Bane attempts a 3Pt. Wide open! Shaquille Sexton is 7.0 feet away. [MAN] Derrick Bane misses. Rebound secured by Cade Ball.

[07:09] Team_006 possession (Score: 88-94)
Shaquille Sexton attempts a 3Pt. Contested by CJ Anthony (4.6 feet, ZONE). Shaquille Sexton misses. Rebound secured by RJ Johnson.

[06:56] Team_056 possession (Score: 88-94)
RJ Johnson drives, Cade Ball stays with him. RJ Johnson attempts a Layup. Contested by Cade Ball (5.0 feet, ZONE). RJ JOHNSON MAKES IT! Assist: Derrick Bane
Score: 90-94

[06:40] Team_006 possession (Score: 90-94)
Vince Sabonis makes the 3Pt and draws the foul on CJ Anthony! And-1! Vince Sabonis to the line for 1. [Team fouls: 2] (CJ Anthony: 1 personal fouls)   FT 1/1: GOOD Vince Sabonis makes 1/1 from the line.
Score: 90-98

[06:24] Team_056 possession (Score: 90-98)
De'Aaron Murray attempts a Midrange. Contested by Miles Harris (4.3 feet, MAN). De'Aaron Murray misses. Rebound secured by Cade Ball.

[06:12] Team_006 possession (Score: 90-98)
Miles Harris attempts a Midrange. Wide open! De'Aaron Murray is 6.3 feet away. [MAN] MILES HARRIS MAKES IT! Assist: Lamelo Westbrook
Score: 90-100

[05:58] Team_056 possession (Score: 90-100)
RJ Johnson drives to the basket... FOUL! Offensive foul on RJ Johnson! Cade Ball drew the charge! [Team fouls: 3] (RJ Johnson: 1 personal fouls) TURNOVER! (dead ball)

[05:43] Team_006 possession (Score: 90-100)
Shaquille Sexton loses the ball! Stripped by Derrick Bane! TURNOVER! (live ball)

[05:32] Team_056 possession (Score: 90-100)
RJ Johnson attempts a 3Pt. Heavily contested by Lamelo Westbrook (1.5 feet, ZONE)! RJ Johnson misses. Offensive rebound by CJ Anthony! CJ Anthony kicks it out.

[05:17] Team_056 possession (Score: 90-100)
CJ Anthony drives, Cade Ball stays with him. CJ Anthony attempts a Layup. Heavily contested by Cade Ball (0.8 feet, ZONE)! CJ Anthony misses. Rebound secured by Vince Sabonis.

[05:03] Team_006 possession (Score: 90-100)
Lamelo Westbrook drives, RJ Johnson stays with him. Lamelo Westbrook attempts a Layup. Contested by RJ Johnson (4.0 feet, ZONE). Lamelo Westbrook misses. Rebound secured by RJ Johnson.

[04:44] Team_056 possession (Score: 90-100)
CJ Anthony attempts a 3Pt. Contested by Vince Sabonis (4.5 feet, MAN). CJ Anthony misses. Rebound secured by Cade Ball.

[04:31] Team_006 possession (Score: 90-100)
Shaquille Sexton drives, picks up RJ Johnson. Help arrives from Damian Barrett! Shaquille Sexton attempts a Dunk. Contested by Damian Barrett (4.7 feet, ZONE). Shaquille Sexton misses. Rebound secured by RJ Johnson.

[04:18] Team_056 possession (Score: 90-100)
RJ Johnson attempts a Midrange. Contested by Lamelo Westbrook (3.3 feet, ZONE). RJ JOHNSON MAKES IT!
Score: 92-100

[03:59] Team_006 possession (Score: 92-100)
Vince Sabonis attempts a Midrange. Wide open! RJ Johnson is 6.2 feet away. [ZONE] VINCE SABONIS MAKES IT!
Score: 92-102

[03:48] Team_056 possession (Score: 92-102)
Derrick Bane drives, Cade Ball stays with him. Derrick Bane attempts a Layup. Wide open! Cade Ball is 7.3 feet away. [ZONE] Derrick Bane misses. Rebound secured by Shaquille Sexton.

[03:31] Team_006 possession (Score: 92-102)
Miles Harris attempts a 3Pt. Wide open! De'Aaron Murray is 6.3 feet away. [MAN] MILES HARRIS MAKES IT! Assist: Lamelo Westbrook
Score: 92-105

[03:15] Team_056 possession (Score: 92-105)
De'Aaron Murray drives, picks up Miles Harris. Help arrives from Lamelo Westbrook! De'Aaron Murray attempts a Layup. Wide open! Lamelo Westbrook is 7.7 feet away. [MAN] DE'AARON MURRAY MAKES IT! Assist: Derrick Bane
Score: 94-105

[02:57] Team_006 possession (Score: 94-105)
Miles Harris attempts a Midrange. Wide open! De'Aaron Murray is 10.0 feet away. [MAN] MILES HARRIS MAKES IT!
Score: 94-107

[02:42] Team_056 possession (Score: 94-107)
De'Aaron Murray attempts a 3Pt. Wide open! Miles Harris is 6.7 feet away. [MAN] DE'AARON MURRAY MAKES IT! Assist: Derrick Bane
Score: 97-107

[02:32] Team_006 possession (Score: 97-107)
Miles Harris attempts a 3Pt. Contested by CJ Anthony (5.3 feet, ZONE). Miles Harris misses. Offensive rebound by Cade Ball! Cade Ball kicks it out.

[02:21] Team_006 possession (Score: 97-107)
Cade Ball attempts a 3Pt. Heavily contested by CJ Anthony (0.5 feet, ZONE)! Cade Ball misses. Rebound secured by RJ Johnson.

[02:06] Team_056 possession (Score: 97-107)
Derrick Bane drives and kicks out. Derrick Bane attempts a 3Pt. Contested by Lamelo Westbrook (4.0 feet, ZONE). Derrick Bane misses. Offensive rebound by RJ Johnson! RJ Johnson kicks it out.

[01:48] Team_056 possession (Score: 97-107)
CJ Anthony drives and kicks out. RJ Johnson attempts a 3Pt. Heavily contested by Lamelo Westbrook (1.4 feet, ZONE)! RJ Johnson misses. Rebound secured by Shaquille Sexton.

[01:34] Team_006 possession (Score: 97-107)
Lamelo Westbrook makes the Midrange and draws the foul on CJ Anthony! And-1! Lamelo Westbrook to the line for 1. [Team fouls: 4] (CJ Anthony: 2 personal fouls)   FT 1/1: GOOD Lamelo Westbrook makes 1/1 from the line.
Score: 97-110

[01:23] Team_056 possession (Score: 97-110)
Damian Barrett attempts a 3Pt. Contested by Cade Ball (4.7 feet, ZONE). Damian Barrett misses. Rebound secured by Cade Ball.

[01:05] Team_006 possession (Score: 97-110)
Cade Ball drives to the basket... Cade Ball throws a bad pass out of bounds! TURNOVER! (dead ball)

[00:52] Team_056 possession (Score: 97-110)
De'Aaron Murray makes the Layup and draws the foul on Miles Harris! And-1! De'Aaron Murray to the line for 1. [Team fouls: 2] (Miles Harris: 1 personal fouls)   FT 1/1: GOOD De'Aaron Murray makes 1/1 from the line.
Score: 100-110

[00:37] Team_006 possession (Score: 100-110)
Vince Sabonis drives, CJ Anthony stays with him. Vince Sabonis attempts a Layup. Contested by CJ Anthony (3.0 feet, MAN). VINCE SABONIS MAKES IT! Assist: Lamelo Westbrook
Score: 100-112

[00:21] Team_056 possession (Score: 100-112)
RJ Johnson drives and kicks out. Derrick Bane attempts a 3Pt. Contested by Lamelo Westbrook (3.5 feet, ZONE). Derrick Bane misses. Offensive rebound by CJ Anthony! CJ Anthony kicks it out.

[00:06] Team_056 possession (Score: 100-112)
Derrick Bane attempts a Midrange. Contested by Shaquille Sexton (4.3 feet, MAN). Derrick Bane misses. Rebound secured by Cade Ball.

================================================================================
                              4TH QUARTER COMPLETE                              
================================================================================

4TH QUARTER SCORE: Team_056 21, Team_006 23

BOX SCORE:
================================================================================

Team_056
--------------------------------------------------------------------------------
Player                MIN  PTS  REB  AST  TO      FG   FG%      3P   3P%
--------------------------------------------------------------------------------
De'Aaron Murray        23    8    0    1   0   3/5    60.0     0/0   0.0
RJ Johnson             19    4    6    0   0   2/2   100.0     0/0   0.0
Tony Carter            32    3    2    0   0   1/3    33.3     0/0   0.0
Jrue Lillard           29    2    3    0   0   1/1   100.0     0/0   0.0
Magic Russell          29    2    0    0   0   1/1   100.0     0/0   0.0
Derrick Bane           19    2    0    3   0   1/4    25.0     0/0   0.0
Yao Poole              29    0    2    0   0   0/0     0.0     0/0   0.0
CJ Anthony             17    0    2    1   0   0/3     0.0     0/0   0.0
Damian Barrett         19    0    0    0   0   0/1     0.0     0/0   0.0

TEAM: FG: 9/20 (45.0%), 3PT: 2/6 (33.3%), REB: 15 (4 off, 11 def), AST: 5, TO: 3
TEAM FOULS: 4


Team_006
--------------------------------------------------------------------------------
Player                MIN  PTS  REB  AST  TO      FG   FG%      3P   3P%
--------------------------------------------------------------------------------
Miles Harris           20   10    0    0   0   4/6    66.7     0/0   0.0
Vince Sabonis          17    8    1    0   0   3/3   100.0     0/0   0.0
Lamelo Westbrook       19    3    0    3   0   1/2    50.0     0/0   0.0
Jayson Young           32    2    0    0   0   1/2    50.0     0/0   0.0
Ja Butler              29    0    2    0   0   0/0     0.0     0/0   0.0
Franz Wagner           29    0    0    0   0   0/3     0.0     0/0   0.0
Bradley Gobert         29    0    1    1   0   0/0     0.0     0/0   0.0
Shaquille Sexton       19    0    2    0   0   0/3     0.0     0/0   0.0
Cade Ball              19    0    6    1   0   0/1     0.0     0/0   0.0

TEAM: FG: 9/20 (45.0%), 3PT: 3/7 (42.9%), REB: 12 (1 off, 11 def), AST: 5, TO: 2
TEAM FOULS: 2

================================================================================

================================================================================
                               FULL GAME COMPLETE                               
================================================================================

FINAL SCORE: Team_056 100, Team_006 112

SCORING BY QUARTER:
--------------------------------------------------------------------------------
Team                     Q1     Q2     Q3     Q4    FINAL
--------------------------------------------------------------------------------
Team_056                 33     25     21     21      100
Team_006                 26     30     33     23      112
--------------------------------------------------------------------------------

FULL GAME BOX SCORE:
================================================================================

Team_056
--------------------------------------------------------------------------------
Player                MIN  PTS  REB  AST  TO      FG   FG%      3P   3P%      FT STL BLK
--------------------------------------------------------------------------------
Tony Carter            32   17    5    3   2   7/10   70.0   3/4    75.0   0/0     0   0
Magic Russell          29   15    0    1   3   7/12   58.3   3/4    75.0   0/0     0   0
Jrue Lillard           29    8   15    4   3   3/5    60.0   0/1     0.0   2/3     0   0
Yao Poole              29   14   13    3   1   6/10   60.0   1/2    50.0   3/5     0   0
Giannis Jokic          26    8    0    0   0   3/8    37.5   1/4    25.0   0/0     0   1
De'Aaron Murray        23    9    0    2   2   4/7    57.1   1/2    50.0   2/3     0   0
Damian Barrett         19    2    0    0   0   0/4     0.0   0/4     0.0   2/2     0   0
RJ Johnson             19   10    9    1   1   5/7    71.4   0/1     0.0   2/2     0   0
Derrick Bane           19    9    5    3   2   4/7    57.1   0/1     0.0   3/4     1   0
CJ Anthony             17    4    4    1   0   2/6    33.3   0/2     0.0   0/0     1   0

TEAM: FG: 43/78 (55.1%), 3PT: 9/25 (36.0%), REB: 51 (12 off, 39 def), AST: 18, TO: 14


Team_006
--------------------------------------------------------------------------------
Player                MIN  PTS  REB  AST  TO      FG   FG%      3P   3P%      FT STL BLK
--------------------------------------------------------------------------------
Jayson Young           32   24    0    0   1   9/13   69.2   4/6    66.7   0/0     0   1
Franz Wagner           29    9    0    3   0   3/10   30.0   2/7    28.6   1/1     0   0
Ja Butler              29    2    8    3   0   1/8    12.5   0/2     0.0   0/0     0   0
Bradley Gobert         29   10   10    5   1   3/6    50.0   0/1     0.0   4/6     1   1
Shai Westbrook         28   13    5    3   0   8/14   57.1   0/2     0.0   2/3     0   0
Miles Harris           20   10    0    2   0   4/7    57.1   2/3    66.7   0/0     0   0
Lamelo Westbrook       19    9    0    5   1   2/6    33.3   0/2     0.0   2/2     0   0
Cade Ball              19    8    9    1   3   5/7    71.4   0/1     0.0   0/0     1   0
Shaquille Sexton       19    3    4    1   1   1/4    25.0   1/2    50.0   0/0     0   0
Vince Sabonis          17   18    4    1   0   7/8    87.5   3/3   100.0   1/1     0   0

TEAM: FG: 43/83 (51.8%), 3PT: 12/29 (41.4%), REB: 40 (6 off, 34 def), AST: 24, TO: 7

================================================================================
