================================================================================
                        FULL GAME - Team_032 vs Team_072                        
================================================================================

================================================================================
                       1ST QUARTER - Team_032 vs Team_072                       
================================================================================

[12:00] Team_032 possession (Score: 0-0)
Tobias Bane attempts a 3Pt. Contested by Collin Griffin (5.9 feet, ZONE). Tobias Bane misses. Offensive rebound by Malcolm Lillard! Malcolm Lillard kicks it out.

[11:45] Team_032 possession (Score: 0-0)
Malcolm Lillard attempts a Midrange. Heavily contested by Tyrese Williamson (1.4 feet, MAN)! MALCOLM LILLARD MAKES IT! Assist: Tobias Bane
Score: 2-0

[11:30] Team_072 possession (Score: 2-0)
Wendell Anthony attempts a Layup. Contested by Malcolm Lillard (3.7 feet, ZONE). Wendell Anthony misses. Rebound secured by Anfernee Butler.

[11:11] Team_032 possession (Score: 2-0)
Anfernee Butler drives, picks up Tyrese Williamson. Help arrives from Collin Griffin! Anfernee Butler attempts a Layup. Heavily contested by Collin Griffin (1.3 feet, ZONE)! ANFERNEE BUTLER MAKES IT! Assist: DeMar Giddey
Score: 4-0

[10:53] Team_072 possession (Score: 4-0)
Cade Poole drives and kicks out. Wendell Anthony attempts a 3Pt. Wide open! Jalen Westbrook is 7.8 feet away. [MAN] WENDELL ANTHONY MAKES IT! Assist: Cade Poole
Score: 4-3

[10:38] Team_032 possession (Score: 4-3)
Jalen Westbrook makes the Layup and draws the foul on Wendell Anthony! And-1! Jalen Westbrook to the line for 1. [Team fouls: 1] (Wendell Anthony: 1 personal fouls)   FT 1/1: GOOD Jalen Westbrook makes 1/1 from the line.
Score: 7-3

[10:22] Team_072 possession (Score: 7-3)
Cade Poole drives and kicks out. Wendell Anthony attempts a Midrange. Wide open! Jalen Westbrook is 8.3 feet away. [MAN] WENDELL ANTHONY MAKES IT!
Score: 7-5

[10:09] Team_032 possession (Score: 7-5)
FOUL! Holding foul on Cade Poole. [Team fouls: 2] No free throws, side out. (Cade Poole: 1 personal fouls)

[09:56] Team_032 possession (Score: 7-5)
Malcolm Lillard attempts a 3Pt. Contested by Collin Griffin (3.9 feet, ZONE). MALCOLM LILLARD MAKES IT!
Score: 10-5

[09:43] Team_072 possession (Score: 10-5)
FOUL! Shooting foul on DeMar Giddey. Cade Poole to the line for 2 free throws. [Team fouls: 1] (DeMar Giddey: 1 personal fouls)   FT 1/2: GOOD   FT 2/2: MISS Cade Poole makes 1/2 from the line. Offensive rebound by Tyrese Williamson! Tyrese Williamson kicks it out.
Score: 10-6

[09:32] Team_072 possession (Score: 10-6)
Cade Poole attempts a 3Pt. Wide open! DeMar Giddey is 7.0 feet away. [MAN] Cade Poole misses. Rebound secured by Tobias Bane.

[09:19] Team_032 possession (Score: 10-6)
FOUL! Reach-in foul on Tyrese Williamson during the drive. [Team fouls: 3] No free throws, side out. (Tyrese Williamson: 1 personal fouls)

[09:03] Team_032 possession (Score: 10-6)
DeMar Giddey drives and kicks out. Jalen Westbrook attempts a Midrange. Wide open! Wendell Anthony is 7.6 feet away. [ZONE] JALEN WESTBROOK MAKES IT!
Score: 12-6

[08:46] Team_072 possession (Score: 12-6)
FOUL! Shooting foul on Tobias Bane. Collin Griffin to the line for 2 free throws. [Team fouls: 2] (Tobias Bane: 1 personal fouls)   FT 1/2: GOOD   FT 2/2: GOOD Collin Griffin makes 2/2 from the line.
Score: 12-8

[08:33] Team_032 possession (Score: 12-8)
Jalen Westbrook drives to the basket... Jalen Westbrook loses control! Ball rolls out of bounds! TURNOVER! (dead ball)

[08:14] Team_072 possession (Score: 12-8)
Cade Poole attempts a 3Pt. Contested by DeMar Giddey (5.0 feet, MAN). Cade Poole misses. Rebound secured by Tobias Bane.

[07:58] Team_032 possession (Score: 12-8)
FOUL! Shooting foul on Tyrese Williamson. Anfernee Butler to the line for 2 free throws. [Team fouls: 4] (Tyrese Williamson: 2 personal fouls)   FT 1/2: GOOD   FT 2/2: GOOD Anfernee Butler makes 2/2 from the line.
Score: 14-8

[07:45] Team_072 possession (Score: 14-8)
Tyrese Williamson drives and kicks out. Tracy Giddey attempts a Midrange. Contested by Jalen Westbrook (4.0 feet, ZONE). Tracy Giddey misses. Offensive rebound by Tracy Giddey! Tracy Giddey kicks it out.

[07:33] Team_072 possession (Score: 14-8)
Cade Poole attempts a Midrange. Contested by Jalen Westbrook (4.5 feet, ZONE). Cade Poole misses. Offensive rebound by Tracy Giddey! Tracy Giddey kicks it out.

[07:22] Team_072 possession (Score: 14-8)
Collin Griffin attempts a Midrange. Contested by Tobias Bane (2.9 feet, MAN). COLLIN GRIFFIN MAKES IT!
Score: 14-10

[07:12] Team_032 possession (Score: 14-10)
DeMar Giddey attempts a 3Pt. Contested by Cade Poole (3.8 feet, MAN). DEMAR GIDDEY MAKES IT! Assist: Jalen Westbrook
Score: 17-10

[07:01] Team_072 possession (Score: 17-10)
Wendell Anthony attempts a Midrange. Contested by Jalen Westbrook (5.7 feet, MAN). WENDELL ANTHONY MAKES IT!
Score: 17-12

[06:47] Team_032 possession (Score: 17-12)
Anfernee Butler attempts a Layup. Contested by Tracy Giddey (2.5 feet, MAN). ANFERNEE BUTLER MAKES IT!
Score: 19-12

[06:34] Team_072 possession (Score: 19-12)
Tracy Giddey drives to the basket... Tracy Giddey commits a violation (traveling/carry)! TURNOVER! (dead ball)

[06:21] Team_032 possession (Score: 19-12)
DeMar Giddey drives to the basket... DeMar Giddey loses the ball! Stripped by Tyrese Williamson! TURNOVER! (live ball)

[06:04] Team_072 possession (Score: 19-12)
Tyrese Williamson attempts a Midrange. Wide open! Malcolm Lillard is 6.7 feet away. [MAN] TYRESE WILLIAMSON MAKES IT!
Score: 19-14

[05:52] Team_032 possession (Score: 19-14)
Malcolm Lillard attempts a 3Pt. Contested by Cade Poole (5.1 feet, ZONE). MALCOLM LILLARD MAKES IT! Assist: DeMar Giddey
Score: 22-14

[05:34] Team_072 possession (Score: 22-14)
Wendell Anthony attempts a 3Pt. Contested by Tobias Bane (3.4 feet, ZONE). Wendell Anthony misses. Rebound secured by Anfernee Butler.

[05:18] Team_032 possession (Score: 22-14)
DeMar Giddey drives, picks up Cade Poole. Help arrives from Wendell Anthony! DeMar Giddey attempts a Dunk. Contested by Wendell Anthony (3.1 feet, MAN). DeMar Giddey misses. Offensive rebound by Malcolm Lillard! Malcolm Lillard kicks it out.

[05:02] Team_032 possession (Score: 22-14)
DeMar Giddey drives to the basket... DeMar Giddey throws a bad pass! Stolen by Tyrese Williamson! TURNOVER! (live ball)

[04:46] Team_072 possession (Score: 22-14)
Wendell Anthony attempts a 3Pt. Wide open! Jalen Westbrook is 6.8 feet away. [MAN] WENDELL ANTHONY MAKES IT! Assist: Cade Poole
Score: 22-17

[04:34] Team_032 possession (Score: 22-17)
Malcolm Lillard attempts a Layup. Contested by Tyrese Williamson (5.0 feet, ZONE). MALCOLM LILLARD MAKES IT! Assist: Anfernee Butler
Score: 24-17

[04:23] Team_072 possession (Score: 24-17)
FOUL! Holding foul on DeMar Giddey. [Team fouls: 3] No free throws, side out. (DeMar Giddey: 2 personal fouls)

[04:09] Team_072 possession (Score: 24-17)
FOUL! Holding foul on DeMar Giddey. [Team fouls: 4] No free throws, side out. (DeMar Giddey: 3 personal fouls)

[03:58] Team_072 possession (Score: 24-17)
Tyrese Williamson attempts a Layup. BLOCKED BY MALCOLM LILLARD! Ball is loose! Offensive rebound by Tracy Giddey! Tracy Giddey kicks it out.

[03:47] Team_072 possession (Score: 24-17)
FOUL! Reach-in foul on Tobias Bane during the drive. [IN THE BONUS! 5 team fouls] Collin Griffin to the line for 2 free throws. (Tobias Bane: 2 personal fouls)   FT 1/2: GOOD   FT 2/2: MISS Collin Griffin makes 1/2 from the line. Rebound secured by Tobias Bane.
Score: 24-18

[03:32] Team_032 possession (Score: 24-18)
Jalen Westbrook attempts a 3Pt. Contested by Wendell Anthony (4.1 feet, MAN). Jalen Westbrook misses. Rebound secured by Wendell Anthony.

[03:16] Team_072 possession (Score: 24-18)
Wendell Anthony drives to the basket... FOUL! Offensive foul on Wendell Anthony! Jalen Westbrook drew the charge! [Team fouls: 5] (Wendell Anthony: 2 personal fouls) TURNOVER! (dead ball)

[03:02] Team_032 possession (Score: 24-18)
Anfernee Butler attempts a Midrange. Heavily contested by Tracy Giddey (1.0 feet, MAN)! Anfernee Butler misses. Rebound secured by Tracy Giddey.

[02:52] Team_072 possession (Score: 24-18)
Wendell Anthony attempts a 3Pt. Contested by Tobias Bane (5.8 feet, ZONE). Wendell Anthony misses. Rebound secured by Tobias Bane.

[02:42] Team_032 possession (Score: 24-18)
Anfernee Butler makes the Layup and draws the foul on Tracy Giddey! And-1! Anfernee Butler to the line for 1. [BONUS: 6 team fouls] (Tracy Giddey: 1 personal fouls)   FT 1/1: GOOD Anfernee Butler makes 1/1 from the line.
Score: 27-18

[02:27] Team_072 possession (Score: 27-18)
Tracy Giddey attempts a Layup. Wide open! Anfernee Butler is 8.6 feet away. [MAN] TRACY GIDDEY MAKES IT! Assist: Tyrese Williamson
Score: 27-20

[02:16] Team_032 possession (Score: 27-20)
Malcolm Lillard makes the Layup and draws the foul on Tyrese Williamson! And-1! Malcolm Lillard to the line for 1. [BONUS: 7 team fouls] (Tyrese Williamson: 3 personal fouls)   FT 1/1: GOOD Malcolm Lillard makes 1/1 from the line.
Score: 30-20

[02:06] Team_072 possession (Score: 30-20)
Cade Poole throws a bad pass! Stolen by DeMar Giddey! TURNOVER! (live ball)

[01:56] Team_032 possession (Score: 30-20)
Jalen Westbrook attempts a Midrange. Contested by Wendell Anthony (3.6 feet, MAN). Jalen Westbrook misses. Rebound secured by Wendell Anthony.

[01:39] Team_072 possession (Score: 30-20)
Collin Griffin attempts a Layup. Wide open! Tobias Bane is 8.3 feet away. [MAN] COLLIN GRIFFIN MAKES IT!
Score: 30-22

[01:24] Team_032 possession (Score: 30-22)
DeMar Giddey attempts a 3Pt. Wide open! Cade Poole is 6.0 feet away. [MAN] DEMAR GIDDEY MAKES IT! Assist: Anfernee Butler
Score: 33-22

[01:09] Team_072 possession (Score: 33-22)
FOUL! Reach-in foul on Malcolm Lillard during the drive. [IN THE BONUS! 6 team fouls] Tracy Giddey to the line for 2 free throws. (Malcolm Lillard: 1 personal fouls)   FT 1/2: GOOD   FT 2/2: GOOD Tracy Giddey makes 2/2 from the line.
Score: 33-24

[00:55] Team_032 possession (Score: 33-24)
DeMar Giddey attempts a 3Pt. Contested by Tracy Giddey (4.3 feet, ZONE). DeMar Giddey misses. Rebound secured by Wendell Anthony.

[00:40] Team_072 possession (Score: 33-24)
Tracy Giddey drives, picks up Malcolm Lillard. Help arrives from DeMar Giddey! Tracy Giddey attempts a Dunk. Wide open! DeMar Giddey is 7.0 feet away. [ZONE] TRACY GIDDEY MAKES IT! Assist: Cade Poole
Score: 33-26

[00:28] Team_032 possession (Score: 33-26)
Tobias Bane attempts a Layup. Wide open! Collin Griffin is 8.1 feet away. [MAN] Tobias Bane misses. Rebound secured by Tracy Giddey.

[00:12] Team_072 possession (Score: 33-26)
Collin Griffin attempts a 3Pt. Contested by Tobias Bane (2.3 feet, MAN). Collin Griffin misses. Rebound secured by Malcolm Lillard.

================================================================================
                              1ST QUARTER COMPLETE                              
================================================================================

1ST QUARTER SCORE: Team_032 33, Team_072 26

BOX SCORE:
================================================================================

Team_032
--------------------------------------------------------------------------------
Player                MIN  PTS  REB  AST  TO      FG   FG%      3P   3P%
--------------------------------------------------------------------------------
Malcolm Lillard        12   13    3    0   0   5/5   100.0     0/0   0.0
Anfernee Butler        12    9    2    2   0   4/5    80.0     0/0   0.0
DeMar Giddey           12    6    0    2   0   2/3    66.7     0/0   0.0
Jalen Westbrook        12    5    0    1   0   2/4    50.0     0/0   0.0
Tobias Bane            12    0    4    1   0   0/1     0.0     0/0   0.0

TEAM: FG: 13/18 (72.2%), 3PT: 4/6 (66.7%), REB: 9 (2 off, 7 def), AST: 6, TO: 3
TEAM FOULS: 6 [Team_072 in BONUS]


Team_072
--------------------------------------------------------------------------------
Player                MIN  PTS  REB  AST  TO      FG   FG%      3P   3P%
--------------------------------------------------------------------------------
Wendell Anthony        12   10    3    0   0   4/7    57.1     0/0   0.0
Collin Griffin         12    6    0    0   0   3/5    60.0     0/0   0.0
Tracy Giddey           12    6    5    0   0   3/3   100.0     0/0   0.0
Tyrese Williamson      12    2    1    1   0   1/1   100.0     0/0   0.0
Cade Poole             12    0    0    3   0   0/2     0.0     0/0   0.0

TEAM: FG: 11/18 (61.1%), 3PT: 1/6 (16.7%), REB: 9 (4 off, 5 def), AST: 4, TO: 3
TEAM FOULS: 7 [Team_032 in BONUS]

================================================================================

================================================================================
                       2ND QUARTER - Team_032 vs Team_072                       
================================================================================

[12:00] Team_032 possession (Score: 33-26)
DeMar Giddey drives, Tyrese Williamson stays with him. DeMar Giddey attempts a Dunk. Wide open! Tyrese Williamson is 6.7 feet away. [ZONE] DeMar Giddey misses. Rebound secured by Tyrese Williamson.

[11:47] Team_072 possession (Score: 33-26)
Wendell Anthony drives to the basket... Wendell Anthony throws a bad pass out of bounds! TURNOVER! (dead ball)

[11:47] Substitution (Team_032): Tobias Bane OUT → Anfernee Griffin IN (stamina_rule2)

[11:47] Substitution (Team_032): DeMar Giddey OUT → Myles Herro IN (stamina_rule2)

[11:47] Substitution (Team_032): Jalen Westbrook OUT → Jrue Simmons IN (stamina_rule2)

[11:47] Substitution (Team_032): Anfernee Butler OUT → Jayson O'Neal IN (stamina_rule2)

[11:47] Substitution (Team_032): Malcolm Lillard OUT → Lauri Towns IN (stamina_rule2)

[11:47] Substitution (Team_072): Collin Griffin OUT → Giannis Gobert IN (stamina_rule2)

[11:47] Substitution (Team_072): Cade Poole OUT → CJ Jokic IN (stamina_rule2)

[11:47] Substitution (Team_072): Wendell Anthony OUT → CJ Bane IN (stamina_rule2)

[11:47] Substitution (Team_072): Tracy Giddey OUT → Brandon Durant IN (stamina_rule2)

[11:47] Substitution (Team_072): Tyrese Williamson OUT → Stephen Holiday IN (stamina_rule2)

[11:29] Team_032 possession (Score: 33-26)
Anfernee Griffin attempts a 3Pt. Contested by Giannis Gobert (4.1 feet, MAN). Anfernee Griffin misses. Rebound secured by CJ Jokic.

[11:16] Team_072 possession (Score: 33-26)
Stephen Holiday attempts a Layup. Contested by Lauri Towns (5.7 feet, MAN). STEPHEN HOLIDAY MAKES IT! Assist: Brandon Durant
Score: 33-28

[11:00] Team_032 possession (Score: 33-28)
Anfernee Griffin attempts a Midrange. Contested by CJ Bane (4.6 feet, ZONE). ANFERNEE GRIFFIN MAKES IT! Assist: Myles Herro
Score: 35-28

[10:47] Team_072 possession (Score: 35-28)
CJ Jokic drives and kicks out. Stephen Holiday attempts a 3Pt. Contested by Anfernee Griffin (2.9 feet, ZONE). Stephen Holiday misses. Rebound secured by Myles Herro.

[10:30] Team_032 possession (Score: 35-28)
Jrue Simmons attempts a 3Pt. Contested by CJ Bane (2.2 feet, MAN). Jrue Simmons misses. Rebound secured by Brandon Durant.

[10:15] Team_072 possession (Score: 35-28)
CJ Bane attempts a 3Pt. Contested by Jrue Simmons (3.0 feet, MAN). CJ BANE MAKES IT! Assist: Brandon Durant
Score: 35-31

[10:01] Team_032 possession (Score: 35-31)
Jrue Simmons attempts a Layup. Wide open! CJ Bane is 6.3 feet away. [MAN] JRUE SIMMONS MAKES IT!
Score: 37-31

[09:46] Team_072 possession (Score: 37-31)
Giannis Gobert drives, Lauri Towns stays with him. Giannis Gobert attempts a Layup. Contested by Lauri Towns (5.7 feet, ZONE). GIANNIS GOBERT MAKES IT! Assist: CJ Bane
Score: 37-33

[09:32] Team_032 possession (Score: 37-33)
FOUL! Reach-in foul on Stephen Holiday during the drive. [Team fouls: 1] No free throws, side out. (Stephen Holiday: 1 personal fouls)

[09:13] Team_032 possession (Score: 37-33)
Anfernee Griffin drives, Stephen Holiday stays with him. Anfernee Griffin attempts a Dunk. Contested by Stephen Holiday (5.1 feet, ZONE). ANFERNEE GRIFFIN MAKES IT!
Score: 39-33

[08:54] Team_072 possession (Score: 39-33)
Stephen Holiday drives and kicks out. Stephen Holiday attempts a 3Pt. Wide open! Lauri Towns is 6.7 feet away. [MAN] STEPHEN HOLIDAY MAKES IT! Assist: CJ Bane
Score: 39-36

[08:39] Team_032 possession (Score: 39-36)
Myles Herro attempts a 3Pt. Contested by Giannis Gobert (2.5 feet, ZONE). Myles Herro misses. Rebound secured by Stephen Holiday.

[08:26] Team_072 possession (Score: 39-36)
CJ Bane attempts a 3Pt. Wide open! Anfernee Griffin is 7.1 feet away. [ZONE] CJ Bane misses. Rebound secured by Lauri Towns.

[08:09] Team_032 possession (Score: 39-36)
Myles Herro makes the Dunk and draws the foul on CJ Bane! And-1! Myles Herro to the line for 1. [Team fouls: 2] (CJ Bane: 1 personal fouls)   FT 1/1: GOOD Myles Herro makes 1/1 from the line.
Score: 42-36

[07:54] Team_072 possession (Score: 42-36)
Stephen Holiday attempts a 3Pt. Contested by Anfernee Griffin (4.7 feet, ZONE). Stephen Holiday misses. Rebound secured by Myles Herro.

[07:42] Team_032 possession (Score: 42-36)
FOUL! Shooting foul on Stephen Holiday. Lauri Towns to the line for 3 free throws. [Team fouls: 3] (Stephen Holiday: 2 personal fouls)   FT 1/3: GOOD   FT 2/3: GOOD   FT 3/3: GOOD Lauri Towns makes 3/3 from the line.
Score: 45-36

[07:25] Team_072 possession (Score: 45-36)
Giannis Gobert drives, picks up Anfernee Griffin. Help arrives from Myles Herro! Giannis Gobert attempts a Layup. Wide open! Myles Herro is 8.0 feet away. [MAN] GIANNIS GOBERT MAKES IT! Assist: CJ Bane
Score: 45-38

[07:13] Team_032 possession (Score: 45-38)
Lauri Towns attempts a Layup. Heavily contested by Stephen Holiday (2.0 feet, ZONE)! LAURI TOWNS MAKES IT! Assist: Jayson O'Neal
Score: 47-38

[06:58] Team_072 possession (Score: 47-38)
Giannis Gobert attempts a 3Pt. Contested by Anfernee Griffin (6.0 feet, MAN). Giannis Gobert misses. Rebound secured by Jayson O'Neal.

[06:42] Team_032 possession (Score: 47-38)
Lauri Towns makes the Layup and draws the foul on Stephen Holiday! And-1! Lauri Towns to the line for 1. [Team fouls: 4] (Stephen Holiday: 3 personal fouls)   FT 1/1: MISS Lauri Towns makes 0/1 from the line. Offensive rebound by Lauri Towns! Lauri Towns kicks it out.
Score: 49-38

[06:24] Team_032 possession (Score: 49-38)
Lauri Towns attempts a Layup. BLOCKED BY BRANDON DURANT! Ball deflects out of bounds off Lauri Towns.

[06:09] Team_072 possession (Score: 49-38)
FOUL! Shooting foul on Myles Herro. CJ Jokic to the line for 2 free throws. [Team fouls: 1] (Myles Herro: 1 personal fouls)   FT 1/2: MISS   FT 2/2: GOOD CJ Jokic makes 1/2 from the line.
Score: 49-39

[05:54] Team_032 possession (Score: 49-39)
Jayson O'Neal attempts a 3Pt. Heavily contested by CJ Bane (1.6 feet, ZONE)! Jayson O'Neal misses. Rebound secured by Brandon Durant.

[05:35] Team_072 possession (Score: 49-39)
Stephen Holiday drives and kicks out. CJ Jokic attempts a 3Pt. Contested by Anfernee Griffin (4.3 feet, ZONE). CJ Jokic misses. Offensive rebound by Brandon Durant! Brandon Durant kicks it out.

[05:18] Team_072 possession (Score: 49-39)
FOUL! Reach-in foul on Jrue Simmons during the drive. [Team fouls: 2] No free throws, side out. (Jrue Simmons: 1 personal fouls)

[05:06] Team_072 possession (Score: 49-39)
Brandon Durant attempts a 3Pt. Contested by Jayson O'Neal (4.0 feet, MAN). Brandon Durant misses. Offensive rebound by Brandon Durant! Brandon Durant kicks it out.

[04:54] Team_072 possession (Score: 49-39)
CJ Jokic attempts a Midrange. Heavily contested by Myles Herro (2.0 feet, MAN)! CJ JOKIC MAKES IT! Assist: Brandon Durant
Score: 49-41

[04:40] Team_032 possession (Score: 49-41)
Lauri Towns attempts a Layup. Wide open! Stephen Holiday is 6.3 feet away. [MAN] Lauri Towns misses. Rebound secured by Brandon Durant.

[04:28] Team_072 possession (Score: 49-41)
FOUL! Reach-in foul on Lauri Towns during the drive. [Team fouls: 3] No free throws, side out. (Lauri Towns: 1 personal fouls)

[04:14] Team_072 possession (Score: 49-41)
Giannis Gobert drives, Anfernee Griffin stays with him. Giannis Gobert attempts a Layup. Wide open! Anfernee Griffin is 7.0 feet away. [MAN] GIANNIS GOBERT MAKES IT! Assist: CJ Bane
Score: 49-43

[04:03] Team_032 possession (Score: 49-43)
Lauri Towns drives, Stephen Holiday stays with him. Lauri Towns attempts a Dunk. Contested by Stephen Holiday (4.7 feet, ZONE). LAURI TOWNS MAKES IT!
Score: 51-43

[03:48] Team_072 possession (Score: 51-43)
CJ Bane attempts a 3Pt. Contested by Anfernee Griffin (5.1 feet, ZONE). CJ Bane misses. Rebound secured by Myles Herro.

[03:33] Team_032 possession (Score: 51-43)
Lauri Towns drives and kicks out. Jrue Simmons attempts a 3Pt. Heavily contested by CJ Bane (1.2 feet, MAN)! Jrue Simmons misses. Rebound secured by Stephen Holiday.

[03:15] Team_072 possession (Score: 51-43)
Brandon Durant attempts a Midrange. Contested by Jayson O'Neal (5.3 feet, MAN). BRANDON DURANT MAKES IT! Assist: CJ Bane
Score: 51-45

[03:01] Team_032 possession (Score: 51-45)
Jrue Simmons attempts a 3Pt. Wide open! CJ Bane is 7.1 feet away. [MAN] JRUE SIMMONS MAKES IT! Assist: Anfernee Griffin
Score: 54-45

[02:49] Team_072 possession (Score: 54-45)
CJ Jokic attempts a 3Pt. Wide open! Myles Herro is 6.7 feet away. [MAN] CJ Jokic misses. Offensive rebound by Stephen Holiday! Stephen Holiday kicks it out.

[02:40] Team_072 possession (Score: 54-45)
FOUL! Offensive foul on CJ Jokic! Myles Herro drew the charge! [Team fouls: 5] (CJ Jokic: 1 personal fouls) TURNOVER! (dead ball)

[02:29] Team_032 possession (Score: 54-45)
Anfernee Griffin attempts a Midrange. Contested by CJ Bane (5.2 feet, ZONE). ANFERNEE GRIFFIN MAKES IT!
Score: 56-45

[02:17] Team_072 possession (Score: 56-45)
Stephen Holiday makes the Layup and draws the foul on Lauri Towns! And-1! Stephen Holiday to the line for 1. [Team fouls: 4] (Lauri Towns: 2 personal fouls)   FT 1/1: GOOD Stephen Holiday makes 1/1 from the line.
Score: 56-48

[02:01] Team_032 possession (Score: 56-48)
Anfernee Griffin attempts a 3Pt. Wide open! Giannis Gobert is 8.8 feet away. [MAN] Anfernee Griffin misses. Offensive rebound by Lauri Towns! Lauri Towns kicks it out.

[01:46] Team_032 possession (Score: 56-48)
Anfernee Griffin attempts a Midrange. Contested by Giannis Gobert (3.5 feet, MAN). Anfernee Griffin misses. Rebound secured by Stephen Holiday.

[01:31] Team_072 possession (Score: 56-48)
CJ Jokic attempts a 3Pt. Wide open! Myles Herro is 9.6 feet away. [MAN] CJ Jokic misses. Rebound secured by Lauri Towns.

[01:19] Team_032 possession (Score: 56-48)
Jayson O'Neal attempts a 3Pt. Contested by Brandon Durant (4.4 feet, MAN). Jayson O'Neal misses. Rebound secured by CJ Jokic.

[01:10] Team_072 possession (Score: 56-48)
FOUL! Offensive foul on CJ Jokic! Myles Herro drew the charge! [Team fouls: 6] (CJ Jokic: 2 personal fouls) TURNOVER! (dead ball)

[00:55] Team_032 possession (Score: 56-48)
Myles Herro attempts a 3Pt. Contested by Brandon Durant (3.7 feet, ZONE). Myles Herro misses. Rebound secured by Stephen Holiday.

[00:43] Team_072 possession (Score: 56-48)
Stephen Holiday throws a bad pass! Stolen by Lauri Towns! TURNOVER! (live ball)

[00:27] Team_032 possession (Score: 56-48)
Jayson O'Neal attempts a Midrange. Contested by CJ Jokic (4.1 feet, ZONE). Jayson O'Neal misses. Rebound secured by Stephen Holiday.

[00:14] Team_072 possession (Score: 56-48)
Giannis Gobert attempts a Midrange. Wide open! Jayson O'Neal is 6.4 feet away. [ZONE] Giannis Gobert misses. Rebound secured by Myles Herro.

[00:02] Team_032 possession (Score: 56-48)
FOUL! Holding foul on Stephen Holiday. [IN THE BONUS! 7 team fouls] Lauri Towns to the line for 2 free throws. (Stephen Holiday: 4 personal fouls)   FT 1/2: MISS   FT 2/2: GOOD Lauri Towns makes 1/2 from the line.
Score: 57-48

================================================================================
                              2ND QUARTER COMPLETE                              
================================================================================

2ND QUARTER SCORE: Team_032 24, Team_072 22

BOX SCORE:
================================================================================

Team_032
--------------------------------------------------------------------------------
Player                MIN  PTS  REB  AST  TO      FG   FG%      3P   3P%
--------------------------------------------------------------------------------
Lauri Towns            12    8    4    0   0   4/7    57.1     0/0   0.0
Anfernee Griffin       12    6    0    1   0   3/5    60.0     0/0   0.0
Jrue Simmons           12    5    0    0   0   2/3    66.7     0/0   0.0
Myles Herro            12    3    4    1   0   1/3    33.3     0/0   0.0
DeMar Giddey           13    0    0    0   0   0/1     0.0     0/0   0.0
Jayson O'Neal          12    0    1    1   0   0/3     0.0     0/0   0.0

TEAM: FG: 10/22 (45.5%), 3PT: 2/8 (25.0%), REB: 9 (2 off, 7 def), AST: 3, TO: 0
TEAM FOULS: 4


Team_072
--------------------------------------------------------------------------------
Player                MIN  PTS  REB  AST  TO      FG   FG%      3P   3P%
--------------------------------------------------------------------------------
Stephen Holiday        12    8    6    0   0   3/4    75.0     0/0   0.0
Giannis Gobert         12    6    0    0   0   3/5    60.0     0/0   0.0
CJ Jokic               12    3    2    0   0   2/4    50.0     0/0   0.0
CJ Bane                12    3    0    5   0   1/3    33.3     0/0   0.0
Brandon Durant         12    2    5    3   0   1/1   100.0     0/0   0.0
Tyrese Williamson      13    0    1    0   0   0/0     0.0     0/0   0.0

TEAM: FG: 10/17 (58.8%), 3PT: 1/6 (16.7%), REB: 14 (3 off, 11 def), AST: 8, TO: 4
TEAM FOULS: 7 [Team_032 in BONUS]

================================================================================

================================================================================
                       3RD QUARTER - Team_032 vs Team_072                       
================================================================================

[12:00] Team_032 possession (Score: 57-48)
Malcolm Lillard attempts a Midrange. Contested by Tyrese Williamson (5.9 feet, MAN). Malcolm Lillard misses. Rebound secured by Wendell Anthony.

[11:44] Team_072 possession (Score: 57-48)
Cade Poole attempts a 3Pt. Contested by DeMar Giddey (5.0 feet, MAN). Cade Poole misses. Rebound secured by Malcolm Lillard.

[11:31] Team_032 possession (Score: 57-48)
Anfernee Butler attempts a Layup. Contested by Tracy Giddey (4.8 feet, MAN). Anfernee Butler misses. Rebound secured by Tracy Giddey.

[11:16] Team_072 possession (Score: 57-48)
Cade Poole attempts a Layup. Contested by DeMar Giddey (4.2 feet, MAN). CADE POOLE MAKES IT! Assist: Wendell Anthony
Score: 57-50

[11:01] Team_032 possession (Score: 57-50)
Anfernee Butler drives, Tracy Giddey stays with him. Anfernee Butler attempts a Layup. Heavily contested by Tracy Giddey (0.5 feet, MAN)! ANFERNEE BUTLER MAKES IT! Assist: Malcolm Lillard
Score: 59-50

[10:45] Team_072 possession (Score: 59-50)
Tracy Giddey drives, picks up Anfernee Butler. Help arrives from DeMar Giddey! Tracy Giddey attempts a Layup. Contested by DeMar Giddey (4.2 feet, MAN). TRACY GIDDEY MAKES IT! Assist: Cade Poole
Score: 59-52

[10:36] Team_032 possession (Score: 59-52)
Tobias Bane throws a bad pass out of bounds! TURNOVER! (dead ball)

[10:22] Team_072 possession (Score: 59-52)
Cade Poole attempts a 3Pt. Wide open! Tobias Bane is 6.4 feet away. [ZONE] CADE POOLE MAKES IT! Assist: Tyrese Williamson
Score: 59-55

[10:09] Team_032 possession (Score: 59-55)
FOUL! Reach-in foul on Collin Griffin during the drive. [Team fouls: 1] No free throws, side out. (Collin Griffin: 1 personal fouls)

[09:56] Team_032 possession (Score: 59-55)
Malcolm Lillard makes the Dunk and draws the foul on Collin Griffin! And-1! Malcolm Lillard to the line for 1. [Team fouls: 2] (Collin Griffin: 2 personal fouls)   FT 1/1: GOOD Malcolm Lillard makes 1/1 from the line.
Score: 62-55

[09:44] Team_072 possession (Score: 62-55)
Cade Poole attempts a Midrange. Wide open! DeMar Giddey is 8.1 feet away. [MAN] CADE POOLE MAKES IT!
Score: 62-57

[09:35] Team_032 possession (Score: 62-57)
DeMar Giddey attempts a Midrange. Contested by Tracy Giddey (3.8 feet, ZONE). DEMAR GIDDEY MAKES IT! Assist: Jalen Westbrook
Score: 64-57

[09:20] Team_072 possession (Score: 64-57)
Collin Griffin attempts a Layup. Wide open! Malcolm Lillard is 8.9 feet away. [ZONE] COLLIN GRIFFIN MAKES IT!
Score: 64-59

[09:02] Team_032 possession (Score: 64-59)
DeMar Giddey attempts a 3Pt. Contested by Cade Poole (2.2 feet, MAN). DeMar Giddey misses. Rebound secured by Tyrese Williamson.

[08:49] Team_072 possession (Score: 64-59)
Tyrese Williamson attempts a Layup. Contested by Malcolm Lillard (2.7 feet, MAN). TYRESE WILLIAMSON MAKES IT! Assist: Cade Poole
Score: 64-61

[08:32] Team_032 possession (Score: 64-61)
DeMar Giddey attempts a 3Pt. BLOCKED BY WENDELL ANTHONY! Ball is loose! Rebound secured by Wendell Anthony.

[08:16] Team_072 possession (Score: 64-61)
Tyrese Williamson drives and kicks out. Tyrese Williamson attempts a Midrange. Contested by Malcolm Lillard (2.6 feet, MAN). TYRESE WILLIAMSON MAKES IT!
Score: 64-63

[08:03] Team_032 possession (Score: 64-63)
FOUL! Offensive foul on Anfernee Butler! Tracy Giddey drew the charge! [Team fouls: 1] (Anfernee Butler: 1 personal fouls) TURNOVER! (dead ball)

[07:48] Team_072 possession (Score: 64-63)
Collin Griffin drives and kicks out. Collin Griffin attempts a 3Pt. Wide open! Tobias Bane is 7.8 feet away. [ZONE] COLLIN GRIFFIN MAKES IT! Assist: Wendell Anthony
Score: 64-66

[07:34] Team_032 possession (Score: 64-66)
Tobias Bane attempts a 3Pt. Wide open! Cade Poole is 8.1 feet away. [ZONE] Tobias Bane misses. Rebound secured by Tracy Giddey.

[07:17] Team_072 possession (Score: 64-66)
Collin Griffin drives and kicks out. Tracy Giddey attempts a 3Pt. BLOCKED BY TOBIAS BANE! Ball is loose! Rebound secured by Malcolm Lillard.

[07:00] Team_032 possession (Score: 64-66)
DeMar Giddey attempts a 3Pt. Contested by Cade Poole (5.9 feet, MAN). DeMar Giddey misses. Rebound secured by Tracy Giddey.

[06:47] Team_072 possession (Score: 64-66)
Cade Poole attempts a 3Pt. Contested by Tobias Bane (4.7 feet, ZONE). CADE POOLE MAKES IT! Assist: Collin Griffin
Score: 64-69

[06:34] Team_032 possession (Score: 64-69)
Tobias Bane loses the ball! Stripped by Collin Griffin! TURNOVER! (live ball)

[06:17] Team_072 possession (Score: 64-69)
Cade Poole attempts a Midrange. Wide open! Jalen Westbrook is 6.5 feet away. [ZONE] CADE POOLE MAKES IT! Assist: Tyrese Williamson
Score: 64-71

[06:02] Team_032 possession (Score: 64-71)
Jalen Westbrook drives, Wendell Anthony stays with him. Jalen Westbrook attempts a Layup. Wide open! Wendell Anthony is 7.5 feet away. [MAN] JALEN WESTBROOK MAKES IT!
Score: 66-71

[05:49] Team_072 possession (Score: 66-71)
Tyrese Williamson drives and kicks out. Tyrese Williamson attempts a 3Pt. Contested by Tobias Bane (4.9 feet, ZONE). Tyrese Williamson misses. Offensive rebound by Tyrese Williamson! Tyrese Williamson kicks it out.

[05:34] Team_072 possession (Score: 66-71)
Tracy Giddey attempts a Midrange. Contested by Anfernee Butler (4.7 feet, MAN). Tracy Giddey misses. Rebound secured by Tobias Bane.

[05:23] Team_032 possession (Score: 66-71)
Malcolm Lillard makes the Layup and draws the foul on Tyrese Williamson! And-1! Malcolm Lillard to the line for 1. [Team fouls: 3] (Tyrese Williamson: 1 personal fouls)   FT 1/1: GOOD Malcolm Lillard makes 1/1 from the line.
Score: 69-71

[05:07] Team_072 possession (Score: 69-71)
Tyrese Williamson drives, picks up Malcolm Lillard. Help arrives from DeMar Giddey! Tyrese Williamson attempts a Dunk. Wide open! DeMar Giddey is 7.5 feet away. [ZONE] Tyrese Williamson misses. Offensive rebound by Tyrese Williamson! Tyrese Williamson kicks it out.

[04:54] Team_072 possession (Score: 69-71)
Wendell Anthony drives, picks up Jalen Westbrook. Help arrives from DeMar Giddey! Wendell Anthony attempts a Layup. Wide open! DeMar Giddey is 7.5 feet away. [MAN] Wendell Anthony misses. Rebound secured by Anfernee Butler.

[04:39] Team_032 possession (Score: 69-71)
Jalen Westbrook attempts a Midrange. Contested by Wendell Anthony (4.7 feet, ZONE). Jalen Westbrook misses. Rebound secured by Wendell Anthony.

[04:26] Team_072 possession (Score: 69-71)
FOUL! Holding foul on Anfernee Butler. [Team fouls: 2] No free throws, side out. (Anfernee Butler: 2 personal fouls)

[04:11] Team_072 possession (Score: 69-71)
Tyrese Williamson makes the Layup and draws the foul on Malcolm Lillard! And-1! Tyrese Williamson to the line for 1. [Team fouls: 3] (Malcolm Lillard: 1 personal fouls)   FT 1/1: GOOD Tyrese Williamson makes 1/1 from the line.
Score: 69-74

[03:59] Team_032 possession (Score: 69-74)
Anfernee Butler drives to the basket... Anfernee Butler commits a violation (traveling/carry)! TURNOVER! (dead ball)

[03:42] Team_072 possession (Score: 69-74)
Collin Griffin makes the Layup and draws the foul on Tobias Bane! And-1! Collin Griffin to the line for 1. [Team fouls: 4] (Tobias Bane: 1 personal fouls)   FT 1/1: GOOD Collin Griffin makes 1/1 from the line.
Score: 69-77

[03:29] Team_032 possession (Score: 69-77)
Jalen Westbrook attempts a 3Pt. Contested by Cade Poole (4.4 feet, ZONE). Jalen Westbrook misses. Rebound secured by Wendell Anthony.

[03:13] Team_072 possession (Score: 69-77)
FOUL! Holding foul on Tobias Bane. [IN THE BONUS! 5 team fouls] Collin Griffin to the line for 2 free throws. (Tobias Bane: 2 personal fouls)   FT 1/2: GOOD   FT 2/2: GOOD Collin Griffin makes 2/2 from the line.
Score: 69-79

[02:58] Team_032 possession (Score: 69-79)
DeMar Giddey throws a bad pass out of bounds! TURNOVER! (dead ball)

[02:58] Substitution (Team_032): DeMar Giddey OUT → Myles Herro IN (stamina_rule2)

[02:58] Substitution (Team_032): Jalen Westbrook OUT → Jrue Simmons IN (stamina_rule2)

[02:58] Substitution (Team_032): Anfernee Butler OUT → Jayson O'Neal IN (stamina_rule2)

[02:58] Substitution (Team_072): Wendell Anthony OUT → CJ Bane IN (stamina_rule2)

[02:39] Team_072 possession (Score: 69-79)
Tyrese Williamson drives, picks up Malcolm Lillard. Help arrives from Myles Herro! Tyrese Williamson attempts a Layup. Contested by Myles Herro (4.8 feet, MAN). TYRESE WILLIAMSON MAKES IT! Assist: CJ Bane
Score: 69-81

[02:25] Team_032 possession (Score: 69-81)
Malcolm Lillard attempts a Midrange. Contested by Tyrese Williamson (3.6 feet, MAN). Malcolm Lillard misses. Rebound secured by Tyrese Williamson.

[02:14] Team_072 possession (Score: 69-81)
CJ Bane attempts a Midrange. Wide open! Myles Herro is 9.3 feet away. [ZONE] CJ BANE MAKES IT! Assist: Cade Poole
Score: 69-83

[02:00] Team_032 possession (Score: 69-83)
Myles Herro attempts a Midrange. Wide open! Cade Poole is 6.2 feet away. [ZONE] Myles Herro misses. Rebound secured by Tracy Giddey.

[01:48] Team_072 possession (Score: 69-83)
Cade Poole attempts a 3Pt. Wide open! Tobias Bane is 6.1 feet away. [ZONE] CADE POOLE MAKES IT! Assist: Tyrese Williamson
Score: 69-86

[01:38] Team_032 possession (Score: 69-86)
Myles Herro throws a bad pass out of bounds! TURNOVER! (dead ball)

[01:38] Substitution (Team_032): Tobias Bane OUT → Anfernee Griffin IN (stamina_rule2)

[01:38] Substitution (Team_032): Malcolm Lillard OUT → Lauri Towns IN (stamina_rule2)

[01:38] Substitution (Team_072): Collin Griffin OUT → Giannis Gobert IN (stamina_rule2)

[01:38] Substitution (Team_072): Cade Poole OUT → CJ Jokic IN (stamina_rule2)

[01:38] Substitution (Team_072): Tracy Giddey OUT → Brandon Durant IN (stamina_rule2)

[01:38] Substitution (Team_072): Tyrese Williamson OUT → Stephen Holiday IN (stamina_rule2)

[01:24] Team_072 possession (Score: 69-86)
Giannis Gobert attempts a Midrange. Contested by Jrue Simmons (4.0 feet, ZONE). GIANNIS GOBERT MAKES IT!
Score: 69-88

[01:07] Team_032 possession (Score: 69-88)
Jayson O'Neal drives, Stephen Holiday stays with him. Jayson O'Neal attempts a Dunk. Contested by Stephen Holiday (3.0 feet, ZONE). Jayson O'Neal misses. Rebound secured by Brandon Durant.

[00:53] Team_072 possession (Score: 69-88)
CJ Jokic drives, Myles Herro stays with him. CJ Jokic attempts a Layup. Wide open! Myles Herro is 8.0 feet away. [MAN] CJ JOKIC MAKES IT! Assist: Brandon Durant
Score: 69-90

[00:37] Team_032 possession (Score: 69-90)
Jrue Simmons drives and kicks out. Lauri Towns attempts a 3Pt. Heavily contested by Brandon Durant (0.5 feet, ZONE)! Lauri Towns misses. Rebound secured by Brandon Durant.

[00:18] Team_072 possession (Score: 69-90)
CJ Bane attempts a 3Pt. Heavily contested by Anfernee Griffin (1.8 feet, ZONE)! CJ Bane misses. Rebound secured by Myles Herro.

================================================================================
                              3RD QUARTER COMPLETE                              
================================================================================

3RD QUARTER SCORE: Team_032 12, Team_072 42

BOX SCORE:
================================================================================

Team_032
--------------------------------------------------------------------------------
Player                MIN  PTS  REB  AST  TO      FG   FG%      3P   3P%
--------------------------------------------------------------------------------
Malcolm Lillard        23    6    2    1   0   2/4    50.0     0/0   0.0
Anfernee Butler        22    2    1    0   0   1/2    50.0     0/0   0.0
DeMar Giddey           22    2    0    0   0   1/4    25.0     0/0   0.0
Jalen Westbrook        22    2    0    1   0   1/3    33.3     0/0   0.0
Tobias Bane            23    0    1    0   0   0/1     0.0     0/0   0.0
Myles Herro            14    0    1    0   0   0/1     0.0     0/0   0.0
Jayson O'Neal          14    0    0    0   0   0/1     0.0     0/0   0.0
Jrue Simmons           14    0    0    0   0   0/1     0.0     0/0   0.0

TEAM: FG: 5/17 (29.4%), 3PT: 0/5 (0.0%), REB: 5 (0 off, 5 def), AST: 2, TO: 6
TEAM FOULS: 5 [Team_072 in BONUS]


Team_072
--------------------------------------------------------------------------------
Player                MIN  PTS  REB  AST  TO      FG   FG%      3P   3P%
--------------------------------------------------------------------------------
Cade Poole             23   15    0    3   0   6/7    85.7     0/0   0.0
Collin Griffin         23   10    0    1   0   4/5    80.0     0/0   0.0
Tyrese Williamson      23    9    4    3   0   4/4   100.0     0/0   0.0
Tracy Giddey           23    2    4    0   0   1/2    50.0     0/0   0.0
CJ Bane                14    2    0    1   0   1/2    50.0     0/0   0.0
Giannis Gobert         13    2    0    0   0   1/1   100.0     0/0   0.0
CJ Jokic               13    2    0    0   0   1/1   100.0     0/0   0.0
Wendell Anthony        22    0    4    2   0   0/1     0.0     0/0   0.0
Brandon Durant         13    0    2    1   0   0/0     0.0     0/0   0.0

TEAM: FG: 18/23 (78.3%), 3PT: 3/5 (60.0%), REB: 14 (2 off, 12 def), AST: 11, TO: 0
TEAM FOULS: 3

================================================================================

================================================================================
                       4TH QUARTER - Team_032 vs Team_072                       
================================================================================

[12:00] Substitution (Team_032): Tobias Bane OUT (stamina: 76) → Anfernee Griffin IN (comeback_detected)

[12:00] Substitution (Team_072): Collin Griffin OUT (stamina: 76) → Giannis Gobert IN (comeback_detected)

[12:00] Team_032 possession (Score: 69-90)
Anfernee Butler attempts a 3Pt. Wide open! Cade Poole is 6.8 feet away. [ZONE] ANFERNEE BUTLER MAKES IT! Assist: DeMar Giddey
Score: 72-90

[11:45] Team_072 possession (Score: 72-90)
FOUL! Reach-in foul on Malcolm Lillard during the drive. [Team fouls: 1] No free throws, side out. (Malcolm Lillard: 1 personal fouls)

[11:25] Team_072 possession (Score: 72-90)
Cade Poole attempts a Layup. Contested by Malcolm Lillard (2.7 feet, ZONE). CADE POOLE MAKES IT!
Score: 72-92

[11:12] Team_032 possession (Score: 72-92)
Malcolm Lillard attempts a Layup. Contested by Tyrese Williamson (5.0 feet, MAN). MALCOLM LILLARD MAKES IT! Assist: Jalen Westbrook
Score: 74-92

[10:58] Team_072 possession (Score: 74-92)
Cade Poole drives and kicks out. Wendell Anthony attempts a 3Pt. Contested by DeMar Giddey (4.7 feet, ZONE). Wendell Anthony misses. Rebound secured by DeMar Giddey.

[10:44] Team_032 possession (Score: 74-92)
Jalen Westbrook attempts a 3Pt. Contested by Wendell Anthony (4.1 feet, MAN). Jalen Westbrook misses. Rebound secured by Wendell Anthony.

[10:29] Team_072 possession (Score: 74-92)
Wendell Anthony attempts a 3Pt. Contested by DeMar Giddey (5.6 feet, ZONE). Wendell Anthony misses. Rebound secured by DeMar Giddey.

[10:17] Team_032 possession (Score: 74-92)
Anfernee Griffin attempts a Midrange. Heavily contested by Cade Poole (1.7 feet, ZONE)! ANFERNEE GRIFFIN MAKES IT!
Score: 76-92

[10:02] Team_072 possession (Score: 76-92)
Tracy Giddey throws a bad pass out of bounds! TURNOVER! (dead ball)

[10:02] Substitution (Team_072): Cade Poole OUT → CJ Jokic IN (stamina_rule2)

[10:02] Substitution (Team_072): Tyrese Williamson OUT → Stephen Holiday IN (stamina_rule2)

[09:48] Team_032 possession (Score: 76-92)
Jalen Westbrook drives, picks up Wendell Anthony. Help arrives from Giannis Gobert! Jalen Westbrook attempts a Dunk. Contested by Giannis Gobert (4.6 feet, MAN). Jalen Westbrook misses. Offensive rebound by Anfernee Butler! Anfernee Butler kicks it out.

[09:31] Team_032 possession (Score: 76-92)
Anfernee Griffin drives to the basket... Anfernee Griffin loses the ball! Stripped by Giannis Gobert! TURNOVER! (live ball)

[09:14] Team_072 possession (Score: 76-92)
Stephen Holiday drives to the basket... FOUL! Offensive foul on Stephen Holiday! Malcolm Lillard drew the charge! [Team fouls: 1] (Stephen Holiday: 1 personal fouls) TURNOVER! (dead ball)

[09:02] Team_032 possession (Score: 76-92)
Anfernee Butler drives, picks up Stephen Holiday. Help arrives from Giannis Gobert! Anfernee Butler attempts a Layup. Heavily contested by Giannis Gobert (1.3 feet, ZONE)! ANFERNEE BUTLER MAKES IT! Assist: Malcolm Lillard
Score: 78-92

[08:48] Team_072 possession (Score: 78-92)
CJ Jokic attempts a Midrange. Wide open! DeMar Giddey is 6.5 feet away. [MAN] CJ Jokic misses. Rebound secured by Malcolm Lillard.

[08:36] Team_032 possession (Score: 78-92)
Malcolm Lillard attempts a Midrange. Wide open! Stephen Holiday is 6.4 feet away. [MAN] MALCOLM LILLARD MAKES IT!
Score: 80-92

[08:25] Team_072 possession (Score: 80-92)
Wendell Anthony drives and kicks out. CJ Jokic attempts a 3Pt. Wide open! Anfernee Griffin is 6.4 feet away. [ZONE] CJ Jokic misses. Offensive rebound by Tracy Giddey! Tracy Giddey kicks it out.

[08:14] Team_072 possession (Score: 80-92)
Giannis Gobert attempts a 3Pt. Contested by DeMar Giddey (3.6 feet, ZONE). Giannis Gobert misses. Rebound secured by Malcolm Lillard.

[07:59] Team_032 possession (Score: 80-92)
Malcolm Lillard loses the ball! Stripped by Stephen Holiday! TURNOVER! (live ball)

[07:44] Team_072 possession (Score: 80-92)
Wendell Anthony attempts a 3Pt. Contested by Jalen Westbrook (3.4 feet, MAN). WENDELL ANTHONY MAKES IT! Assist: Tracy Giddey
Score: 80-95

[07:27] Team_032 possession (Score: 80-95)
Anfernee Butler attempts a Layup. Wide open! Stephen Holiday is 7.0 feet away. [ZONE] ANFERNEE BUTLER MAKES IT! Assist: Anfernee Griffin
Score: 82-95

[07:11] Team_072 possession (Score: 82-95)
CJ Jokic drives and kicks out. Tracy Giddey attempts a Midrange. Heavily contested by Anfernee Butler (1.7 feet, MAN)! TRACY GIDDEY MAKES IT!
Score: 82-97

[06:54] Team_032 possession (Score: 82-97)
DeMar Giddey attempts a 3Pt. Wide open! Giannis Gobert is 7.8 feet away. [ZONE] DEMAR GIDDEY MAKES IT! Assist: Anfernee Griffin
Score: 85-97

[06:40] Team_072 possession (Score: 85-97)
Stephen Holiday attempts a 3Pt. Wide open! Malcolm Lillard is 6.1 feet away. [MAN] Stephen Holiday misses. Offensive rebound by Stephen Holiday! Stephen Holiday kicks it out.

[06:25] Team_072 possession (Score: 85-97)
Wendell Anthony drives and kicks out. Wendell Anthony attempts a Midrange. Wide open! Jalen Westbrook is 6.0 feet away. [MAN] Wendell Anthony misses. Rebound secured by Malcolm Lillard.

[06:13] Team_032 possession (Score: 85-97)
Anfernee Butler attempts a 3Pt. Contested by Tracy Giddey (4.7 feet, MAN). ANFERNEE BUTLER MAKES IT!
Score: 88-97

[06:01] Team_072 possession (Score: 88-97)
Giannis Gobert attempts a Layup. Wide open! Malcolm Lillard is 6.7 feet away. [ZONE] Giannis Gobert misses. Rebound secured by Anfernee Butler.

[05:44] Team_032 possession (Score: 88-97)
Anfernee Griffin throws a bad pass out of bounds! TURNOVER! (dead ball)

[05:44] Substitution (Team_032): DeMar Giddey OUT → Myles Herro IN (stamina_rule2)

[05:44] Substitution (Team_032): Jalen Westbrook OUT → Jrue Simmons IN (stamina_rule2)

[05:44] Substitution (Team_032): Anfernee Butler OUT → Jayson O'Neal IN (stamina_rule2)

[05:44] Substitution (Team_032): Malcolm Lillard OUT → Lauri Towns IN (stamina_rule2)

[05:44] Substitution (Team_072): Wendell Anthony OUT → CJ Bane IN (stamina_rule2)

[05:44] Substitution (Team_072): Tracy Giddey OUT → Brandon Durant IN (stamina_rule2)

[05:32] Team_072 possession (Score: 88-97)
Stephen Holiday drives, Lauri Towns stays with him. Stephen Holiday attempts a Layup. Wide open! Lauri Towns is 7.2 feet away. [MAN] STEPHEN HOLIDAY MAKES IT! Assist: CJ Jokic
Score: 88-99

[05:14] Team_032 possession (Score: 88-99)
Jrue Simmons drives and kicks out. Jayson O'Neal attempts a Midrange. Contested by Brandon Durant (4.6 feet, MAN). Jayson O'Neal misses. FOUL! Loose ball foul on CJ Jokic during the rebound battle. [Team fouls: 2] No free throws, side out. (CJ Jokic: 1 personal fouls)

[05:00] Team_032 possession (Score: 88-99)
Anfernee Griffin attempts a 3Pt. Heavily contested by Giannis Gobert (1.9 feet, MAN)! Anfernee Griffin misses. Rebound secured by Brandon Durant.

[04:45] Team_072 possession (Score: 88-99)
CJ Jokic attempts a 3Pt. Wide open! Anfernee Griffin is 6.4 feet away. [ZONE] CJ JOKIC MAKES IT! Assist: CJ Bane
Score: 88-102

[04:30] Team_032 possession (Score: 88-102)
Anfernee Griffin drives, Stephen Holiday stays with him. Anfernee Griffin attempts a Layup. Contested by Stephen Holiday (3.6 feet, ZONE). ANFERNEE GRIFFIN MAKES IT! Assist: Jayson O'Neal
Score: 90-102

[04:21] Team_072 possession (Score: 90-102)
Giannis Gobert drives and kicks out. CJ Bane attempts a 3Pt. Wide open! Jrue Simmons is 7.0 feet away. [MAN] CJ BANE MAKES IT!
Score: 90-105

[04:05] Team_032 possession (Score: 90-105)
Anfernee Griffin attempts a Midrange. Heavily contested by Giannis Gobert (2.0 feet, MAN)! ANFERNEE GRIFFIN MAKES IT! Assist: Jayson O'Neal
Score: 92-105

[03:50] Team_072 possession (Score: 92-105)
CJ Jokic attempts a Midrange. Contested by Myles Herro (5.0 feet, MAN). CJ JOKIC MAKES IT! Assist: Giannis Gobert
Score: 92-107

[03:34] Team_032 possession (Score: 92-107)
Myles Herro drives to the basket... Myles Herro loses control! Ball rolls out of bounds! TURNOVER! (dead ball)

[03:16] Team_072 possession (Score: 92-107)
Stephen Holiday attempts a 3Pt. Wide open! Anfernee Griffin is 8.2 feet away. [ZONE] STEPHEN HOLIDAY MAKES IT! Assist: CJ Jokic
Score: 92-110

[03:00] Team_032 possession (Score: 92-110)
Lauri Towns attempts a 3Pt. Wide open! Giannis Gobert is 6.3 feet away. [ZONE] Lauri Towns misses. Rebound secured by Stephen Holiday.

[02:46] Team_072 possession (Score: 92-110)
Giannis Gobert attempts a Layup. BLOCKED BY MYLES HERRO! Ball is loose! Rebound secured by Lauri Towns.

[02:29] Team_032 possession (Score: 92-110)
Jayson O'Neal attempts a Midrange. Wide open! CJ Bane is 6.4 feet away. [ZONE] JAYSON O'NEAL MAKES IT! Assist: Myles Herro
Score: 94-110

[02:12] Team_072 possession (Score: 94-110)
CJ Jokic drives, Myles Herro stays with him. CJ Jokic attempts a Layup. Wide open! Myles Herro is 6.6 feet away. [MAN] CJ JOKIC MAKES IT! Assist: Giannis Gobert
Score: 94-112

[01:58] Team_032 possession (Score: 94-112)
FOUL! Shooting foul on Giannis Gobert. Jayson O'Neal to the line for 3 free throws. [Team fouls: 3] (Giannis Gobert: 1 personal fouls)   FT 1/3: MISS   FT 2/3: GOOD   FT 3/3: GOOD Jayson O'Neal makes 2/3 from the line.
Score: 96-112

[01:39] Team_072 possession (Score: 96-112)
CJ Jokic commits a violation (traveling/carry)! TURNOVER! (dead ball)

[01:39] Substitution (Team_032): Anfernee Griffin OUT → Tobias Bane IN (starter_return_rule1)

[01:39] Substitution (Team_072): Giannis Gobert OUT → Collin Griffin IN (starter_return_rule1)

[01:24] Team_032 possession (Score: 96-112)
Jayson O'Neal drives to the basket... Jayson O'Neal throws a bad pass! Stolen by Brandon Durant! TURNOVER! (live ball)

[01:09] Team_072 possession (Score: 96-112)
CJ Jokic attempts a 3Pt. Wide open! Tobias Bane is 7.5 feet away. [ZONE] CJ Jokic misses. Rebound secured by Lauri Towns.

[00:57] Team_032 possession (Score: 96-112)
Jayson O'Neal attempts a Layup. Contested by Brandon Durant (2.2 feet, MAN). Jayson O'Neal misses. Rebound secured by Stephen Holiday.

[00:43] Team_072 possession (Score: 96-112)
FOUL! Shooting foul on Tobias Bane. CJ Bane to the line for 3 free throws. [Team fouls: 2] (Tobias Bane: 1 personal fouls)   FT 1/3: MISS   FT 2/3: MISS   FT 3/3: GOOD CJ Bane makes 1/3 from the line.
Score: 96-113

[00:29] Team_032 possession (Score: 96-113)
Tobias Bane attempts a 3Pt. Contested by CJ Bane (3.9 feet, ZONE). Tobias Bane misses. Offensive rebound by Tobias Bane! Tobias Bane kicks it out.

[00:15] Team_032 possession (Score: 96-113)
Myles Herro attempts a 3Pt. Contested by CJ Jokic (3.8 feet, MAN). Myles Herro misses. Rebound secured by Collin Griffin.

[00:02] Team_072 possession (Score: 96-113)
CJ Jokic throws a bad pass! Stolen by Myles Herro! TURNOVER! (live ball)

================================================================================
                              4TH QUARTER COMPLETE                              
================================================================================

4TH QUARTER SCORE: Team_032 27, Team_072 23

BOX SCORE:
================================================================================

Team_032
--------------------------------------------------------------------------------
Player                MIN  PTS  REB  AST  TO      FG   FG%      3P   3P%
--------------------------------------------------------------------------------
Anfernee Butler        28   10    2    0   0   4/4   100.0     0/0   0.0
Anfernee Griffin       24    6    0    2   0   3/4    75.0     0/0   0.0
Malcolm Lillard        30    4    3    1   0   2/2   100.0     0/0   0.0
Jayson O'Neal          20    4    0    2   0   2/3    66.7     0/0   0.0
DeMar Giddey           28    3    2    1   0   1/1   100.0     0/0   0.0
Jalen Westbrook        28    0    0    1   0   0/1     0.0     0/0   0.0
Lauri Towns            19    0    3    0   0   0/1     0.0     0/0   0.0
Myles Herro            20    0    0    1   0   0/1     0.0     0/0   0.0
Tobias Bane            25    0    1    0   0   0/0     0.0     0/0   0.0

TEAM: FG: 12/17 (70.6%), 3PT: 4/8 (50.0%), REB: 11 (3 off, 8 def), AST: 8, TO: 5
TEAM FOULS: 2


Team_072
--------------------------------------------------------------------------------
Player                MIN  PTS  REB  AST  TO      FG   FG%      3P   3P%
--------------------------------------------------------------------------------
CJ Jokic               23    7    0    2   0   3/5    60.0     0/0   0.0
Stephen Holiday        23    5    3    0   0   2/2   100.0     0/0   0.0
CJ Bane                20    4    0    1   0   2/2   100.0     0/0   0.0
Wendell Anthony        28    3    1    0   0   1/3    33.3     0/0   0.0
Cade Poole             25    2    0    0   0   1/2    50.0     0/0   0.0
Tracy Giddey           30    2    1    1   0   1/1   100.0     0/0   0.0
Giannis Gobert         24    0    0    2   0   0/3     0.0     0/0   0.0
Brandon Durant         19    0    1    0   0   0/0     0.0     0/0   0.0
Collin Griffin         25    0    1    0   0   0/0     0.0     0/0   0.0

TEAM: FG: 10/18 (55.6%), 3PT: 4/7 (57.1%), REB: 7 (2 off, 5 def), AST: 6, TO: 4
TEAM FOULS: 3

================================================================================

================================================================================
                               FULL GAME COMPLETE                               
================================================================================

FINAL SCORE: Team_032 96, Team_072 113

SCORING BY QUARTER:
--------------------------------------------------------------------------------
Team                     Q1     Q2     Q3     Q4    FINAL
--------------------------------------------------------------------------------
Team_032                 33     24     12     27       96
Team_072                 26     22     42     23      113
--------------------------------------------------------------------------------

FULL GAME BOX SCORE:
================================================================================

Team_032
--------------------------------------------------------------------------------
Player                MIN  PTS  REB  AST  TO      FG   FG%      3P   3P%      FT STL BLK
--------------------------------------------------------------------------------
Malcolm Lillard        30   23    8    2   2   9/11   81.8   2/2   100.0   3/3     0   1
DeMar Giddey           28   11    2    3   1   5/10   50.0   3/7    42.9   0/0     1   0
Jalen Westbrook        28    7    0    3   2   2/7    28.6   0/3     0.0   1/1     0   0
Anfernee Butler        28   21    5    2   2   9/11   81.8   2/2   100.0   3/3     0   0
Tobias Bane            25    0    6    1   2   0/2     0.0   0/1     0.0   0/0     0   1
Anfernee Griffin       24   12    0    3   2   6/9    66.7   0/2     0.0   0/0     0   0
Myles Herro            20    3    5    2   1   1/5    20.0   0/3     0.0   1/1     1   1
Jrue Simmons           20    5    0    0   0   2/4    50.0   1/2    50.0   0/0     0   0
Jayson O'Neal          20    4    1    3   0   2/7    28.6   1/3    33.3   2/3     0   0
Lauri Towns            19    8    7    0   2   3/7    42.9   1/2    50.0   4/6     1   0

TEAM: FG: 40/74 (54.1%), 3PT: 10/27 (37.0%), REB: 34 (7 off, 27 def), AST: 19, TO: 14


Team_072
--------------------------------------------------------------------------------
Player                MIN  PTS  REB  AST  TO      FG   FG%      3P   3P%      FT STL BLK
--------------------------------------------------------------------------------
Tracy Giddey           30   10   10    1   2   4/5    80.0   0/0     0.0   2/2     0   0
Wendell Anthony        28   13    8    2   0   3/9    33.3   2/5    40.0   0/0     0   1
Cade Poole             25   17    0    6   2   9/13   69.2   3/6    50.0   1/2     0   0
Tyrese Williamson      25   11    6    4   1   5/5   100.0   0/0     0.0   1/1     2   0
Collin Griffin         25   16    1    1   0   6/9    66.7   0/1     0.0   6/7     1   0
Giannis Gobert         24    8    0    2   0   5/10   50.0   0/2     0.0   0/0     1   0
CJ Jokic               23   12    2    2   5   7/11   63.6   1/3    33.3   1/2     0   0
Stephen Holiday        23   13    9    0   1   5/6    83.3   1/2    50.0   1/1     1   0
CJ Bane                20    9    0    7   0   3/6    50.0   2/5    40.0   1/3     0   0
Brandon Durant         19    2    8    4   0   1/1   100.0   0/0     0.0   0/0     1   1

TEAM: FG: 49/76 (64.5%), 3PT: 9/24 (37.5%), REB: 44 (11 off, 33 def), AST: 29, TO: 11

================================================================================
