================================================================================
                        FULL GAME - Team_059 vs Team_037                        
================================================================================

================================================================================
                       1ST QUARTER - Team_059 vs Team_037                       
================================================================================

[12:00] Team_059 possession (Score: 0-0)
Bam Wade attempts a 3Pt. Contested by Scottie Jackson (4.0 feet, ZONE). Bam Wade misses. Rebound secured by Scottie Jackson.

[11:42] Team_037 possession (Score: 0-0)
Jarrett Tatum drives, John Iverson stays with him. Jarrett Tatum attempts a Dunk. Contested by John Iverson (5.7 feet, MAN). JARRETT TATUM MAKES IT!
Score: 0-2

[11:28] Team_059 possession (Score: 0-2)
Nikola Jokic drives, Scottie Jackson stays with him. Nikola Jokic attempts a Layup. Contested by Scottie Jackson (3.5 feet, MAN). NIKOLA JOKIC MAKES IT! Assist: Blake Tatum
Score: 2-2

[11:15] Team_037 possession (Score: 2-2)
FOUL! Reach-in foul on Bam Wade during the drive. [Team fouls: 1] No free throws, side out. (Bam Wade: 1 personal fouls)

[10:59] Team_037 possession (Score: 2-2)
Collin Young attempts a Layup. Heavily contested by Jarrett Smith (1.9 feet, ZONE)! COLLIN YOUNG MAKES IT! Assist: Jarrett Tatum
Score: 2-4

[10:46] Team_059 possession (Score: 2-4)
Jarrett Smith drives, picks up Collin Young. Help arrives from Giannis Middleton! Jarrett Smith attempts a Dunk. Contested by Giannis Middleton (3.5 feet, MAN). JARRETT SMITH MAKES IT!
Score: 4-4

[10:30] Team_037 possession (Score: 4-4)
Scottie Jackson drives and kicks out. Jarrett Tatum attempts a Midrange. Contested by Nikola Jokic (5.9 feet, ZONE). JARRETT TATUM MAKES IT!
Score: 4-6

[10:15] Team_059 possession (Score: 4-6)
Jarrett Smith drives, picks up Collin Young. Help arrives from Giannis Middleton! Jarrett Smith attempts a Dunk. Contested by Giannis Middleton (5.6 feet, MAN). JARRETT SMITH MAKES IT!
Score: 6-6

[10:00] Team_037 possession (Score: 6-6)
Scottie Jackson attempts a Layup. Contested by Nikola Jokic (5.3 feet, MAN). Scottie Jackson misses. Rebound secured by Bam Wade.

[09:44] Team_059 possession (Score: 6-6)
John Iverson attempts a 3Pt. Contested by Jarrett Tatum (4.3 feet, MAN). JOHN IVERSON MAKES IT! Assist: Jarrett Smith
Score: 9-6

[09:28] Team_037 possession (Score: 9-6)
FOUL! Holding foul on John Iverson. [Team fouls: 2] No free throws, side out. (John Iverson: 1 personal fouls)

[09:10] Team_037 possession (Score: 9-6)
Giannis Middleton attempts a 3Pt. Contested by Blake Tatum (5.0 feet, MAN). Giannis Middleton misses. Rebound secured by John Iverson.

[08:53] Team_059 possession (Score: 9-6)
Nikola Jokic attempts a Midrange. Wide open! Scottie Jackson is 6.7 feet away. [MAN] Nikola Jokic misses. Rebound secured by Scottie Jackson.

[08:41] Team_037 possession (Score: 9-6)
FOUL! Reach-in foul on Jarrett Smith during the drive. [Team fouls: 3] No free throws, side out. (Jarrett Smith: 1 personal fouls)

[08:25] Team_037 possession (Score: 9-6)
Collin Young commits a violation (traveling/carry)! TURNOVER! (dead ball)

[08:13] Team_059 possession (Score: 9-6)
Bam Wade attempts a 3Pt. Contested by Scottie Jackson (2.6 feet, ZONE). Bam Wade misses. Offensive rebound by John Iverson! John Iverson kicks it out.

[07:59] Team_059 possession (Score: 9-6)
Bam Wade loses the ball! Stripped by RJ Mitchell! TURNOVER! (live ball)

[07:44] Team_037 possession (Score: 9-6)
Scottie Jackson drives, Jarrett Smith stays with him. Scottie Jackson attempts a Dunk. Wide open! Jarrett Smith is 6.8 feet away. [ZONE] Scottie Jackson misses. Rebound secured by John Iverson.

[07:30] Team_059 possession (Score: 9-6)
Blake Tatum attempts a 3Pt. Contested by Giannis Middleton (3.6 feet, MAN). BLAKE TATUM MAKES IT! Assist: John Iverson
Score: 12-6

[07:18] Team_037 possession (Score: 12-6)
Scottie Jackson makes the Layup and draws the foul on Jarrett Smith! And-1! Scottie Jackson to the line for 1. [Team fouls: 4] (Jarrett Smith: 2 personal fouls)   FT 1/1: GOOD Scottie Jackson makes 1/1 from the line.
Score: 12-9

[07:03] Team_059 possession (Score: 12-9)
Bam Wade drives, Collin Young stays with him. Bam Wade attempts a Dunk. Contested by Collin Young (3.7 feet, ZONE). Bam Wade misses. Rebound secured by Jarrett Tatum.

[06:47] Team_037 possession (Score: 12-9)
RJ Mitchell attempts a 3Pt. Contested by Bam Wade (2.8 feet, MAN). RJ Mitchell misses. Offensive rebound by Collin Young! Collin Young puts it back in!
Score: 12-11

[06:30] Team_059 possession (Score: 12-11)
Bam Wade attempts a 3Pt. Heavily contested by Scottie Jackson (1.3 feet, ZONE)! BAM WADE MAKES IT! Assist: Nikola Jokic
Score: 15-11

[06:14] Team_037 possession (Score: 15-11)
FOUL! Shooting foul on Jarrett Smith. RJ Mitchell to the line for 2 free throws. [BONUS: 5 team fouls] (Jarrett Smith: 3 personal fouls)   FT 1/2: MISS   FT 2/2: GOOD RJ Mitchell makes 1/2 from the line.
Score: 15-12

[06:03] Team_059 possession (Score: 15-12)
Jarrett Smith drives to the basket... Jarrett Smith loses control! Ball rolls out of bounds! TURNOVER! (dead ball)

[05:50] Team_037 possession (Score: 15-12)
Collin Young attempts a 3Pt. Contested by Bam Wade (5.4 feet, ZONE). Collin Young misses. Offensive rebound by Scottie Jackson! Scottie Jackson puts it back in!
Score: 15-14

[05:31] Team_059 possession (Score: 15-14)
Bam Wade makes the 3Pt and draws the foul on Scottie Jackson! And-1! Bam Wade to the line for 1. [Team fouls: 1] (Scottie Jackson: 1 personal fouls)   FT 1/1: GOOD Bam Wade makes 1/1 from the line.
Score: 19-14

[05:15] Team_037 possession (Score: 19-14)
RJ Mitchell attempts a 3Pt. Contested by Bam Wade (5.0 feet, MAN). RJ MITCHELL MAKES IT! Assist: Scottie Jackson
Score: 19-17

[05:00] Team_059 possession (Score: 19-17)
Blake Tatum attempts a Midrange. Wide open! Giannis Middleton is 7.5 feet away. [MAN] Blake Tatum misses. Rebound secured by Scottie Jackson.

[04:41] Team_037 possession (Score: 19-17)
Collin Young drives, Nikola Jokic stays with him. Collin Young attempts a Layup. Contested by Nikola Jokic (5.1 feet, ZONE). COLLIN YOUNG MAKES IT!
Score: 19-19

[04:27] Team_059 possession (Score: 19-19)
Jarrett Smith drives, Scottie Jackson stays with him. Jarrett Smith attempts a Dunk. Contested by Scottie Jackson (4.4 feet, ZONE). JARRETT SMITH MAKES IT! Assist: Bam Wade
Score: 21-19

[04:10] Team_037 possession (Score: 21-19)
Giannis Middleton attempts a 3Pt. Contested by Blake Tatum (4.2 feet, MAN). Giannis Middleton misses. Rebound secured by Jarrett Smith.

[03:56] Team_059 possession (Score: 21-19)
Jarrett Smith makes the Layup and draws the foul on Collin Young! And-1! Jarrett Smith to the line for 1. [Team fouls: 2] (Collin Young: 1 personal fouls)   FT 1/1: GOOD Jarrett Smith makes 1/1 from the line.
Score: 24-19

[03:42] Team_037 possession (Score: 24-19)
RJ Mitchell attempts a 3Pt. Heavily contested by Bam Wade (1.3 feet, ZONE)! RJ Mitchell misses. Rebound secured by Bam Wade.

[03:32] Team_059 possession (Score: 24-19)
Bam Wade drives and kicks out. Bam Wade attempts a Midrange. Contested by RJ Mitchell (3.2 feet, MAN). BAM WADE MAKES IT! Assist: Jarrett Smith
Score: 26-19

[03:19] Team_037 possession (Score: 26-19)
Scottie Jackson drives, Nikola Jokic stays with him. Scottie Jackson attempts a Layup. Contested by Nikola Jokic (4.7 feet, MAN). Scottie Jackson misses. Rebound secured by John Iverson.

[03:08] Team_059 possession (Score: 26-19)
FOUL! Shooting foul on Giannis Middleton. Bam Wade to the line for 2 free throws. [Team fouls: 3] (Giannis Middleton: 1 personal fouls)   FT 1/2: MISS   FT 2/2: GOOD Bam Wade makes 1/2 from the line.
Score: 27-19

[02:51] Team_037 possession (Score: 27-19)
RJ Mitchell drives and kicks out. Giannis Middleton attempts a 3Pt. Heavily contested by Blake Tatum (1.4 feet, MAN)! Giannis Middleton misses. Rebound secured by John Iverson.

[02:37] Team_059 possession (Score: 27-19)
Jarrett Smith attempts a Midrange. Contested by Jarrett Tatum (4.6 feet, ZONE). JARRETT SMITH MAKES IT! Assist: Blake Tatum
Score: 29-19

[02:23] Team_037 possession (Score: 29-19)
RJ Mitchell makes the 3Pt and draws the foul on Bam Wade! And-1! RJ Mitchell to the line for 1. [BONUS: 6 team fouls] (Bam Wade: 2 personal fouls)   FT 1/1: GOOD RJ Mitchell makes 1/1 from the line.
Score: 29-23

[02:08] Team_059 possession (Score: 29-23)
Bam Wade attempts a Midrange. Contested by RJ Mitchell (5.7 feet, MAN). Bam Wade misses. FOUL! Loose ball foul on Scottie Jackson during the rebound battle. [Team fouls: 4] No free throws, side out. (Scottie Jackson: 2 personal fouls)

[01:51] Team_059 possession (Score: 29-23)
FOUL! Shooting foul on RJ Mitchell. Bam Wade to the line for 3 free throws. [BONUS: 5 team fouls] (RJ Mitchell: 1 personal fouls)   FT 1/3: GOOD   FT 2/3: MISS   FT 3/3: MISS Bam Wade makes 1/3 from the line. Rebound secured by Collin Young.
Score: 30-23

[01:34] Team_037 possession (Score: 30-23)
RJ Mitchell attempts a 3Pt. Contested by Bam Wade (4.7 feet, ZONE). RJ MITCHELL MAKES IT! Assist: Giannis Middleton
Score: 30-26

[01:18] Team_059 possession (Score: 30-26)
FOUL! Shooting foul on Giannis Middleton. John Iverson to the line for 2 free throws. [BONUS: 6 team fouls] (Giannis Middleton: 2 personal fouls)   FT 1/2: GOOD   FT 2/2: GOOD John Iverson makes 2/2 from the line.
Score: 32-26

[01:03] Team_037 possession (Score: 32-26)
FOUL! Reach-in foul on Bam Wade during the drive. [IN THE BONUS! 7 team fouls] RJ Mitchell to the line for 2 free throws. (Bam Wade: 3 personal fouls)   FT 1/2: GOOD   FT 2/2: GOOD RJ Mitchell makes 2/2 from the line.
Score: 32-28

[00:48] Team_059 possession (Score: 32-28)
Jarrett Smith attempts a Midrange. Contested by Collin Young (2.3 feet, MAN). Jarrett Smith misses. Rebound secured by Jarrett Tatum.

[00:34] Team_037 possession (Score: 32-28)
Scottie Jackson attempts a Midrange. Wide open! Blake Tatum is 6.4 feet away. [ZONE] Scottie Jackson misses. Rebound secured by Bam Wade.

[00:20] Team_059 possession (Score: 32-28)
Jarrett Smith drives to the basket... Jarrett Smith loses the ball! Stripped by Collin Young! TURNOVER! (live ball)

[00:10] Team_037 possession (Score: 32-28)
Scottie Jackson drives, Nikola Jokic stays with him. Scottie Jackson attempts a Dunk. Contested by Nikola Jokic (4.1 feet, MAN). Scottie Jackson misses. Rebound secured by Bam Wade.

================================================================================
                              1ST QUARTER COMPLETE                              
================================================================================

1ST QUARTER SCORE: Team_059 32, Team_037 28

BOX SCORE:
================================================================================

Team_059
--------------------------------------------------------------------------------
Player                MIN  PTS  REB  AST  TO      FG   FG%      3P   3P%
--------------------------------------------------------------------------------
Jarrett Smith          12   11    2    2   0   5/6    83.3     0/0   0.0
Bam Wade               12   10    4    1   0   4/7    57.1     0/0   0.0
John Iverson           12    5    5    1   0   2/2   100.0     0/0   0.0
Blake Tatum            12    3    0    2   0   1/2    50.0     0/0   0.0
Nikola Jokic           12    2    0    1   0   1/2    50.0     0/0   0.0

TEAM: FG: 13/19 (68.4%), 3PT: 4/6 (66.7%), REB: 11 (2 off, 9 def), AST: 7, TO: 3
TEAM FOULS: 7 [Team_037 in BONUS]


Team_037
--------------------------------------------------------------------------------
Player                MIN  PTS  REB  AST  TO      FG   FG%      3P   3P%
--------------------------------------------------------------------------------
RJ Mitchell            12   13    0    0   0   5/7    71.4     0/0   0.0
Collin Young           12    6    2    0   0   3/3   100.0     0/0   0.0
Scottie Jackson        12    5    4    1   0   2/7    28.6     0/0   0.0
Jarrett Tatum          12    4    2    1   0   2/2   100.0     0/0   0.0
Giannis Middleton      12    0    0    1   0   0/2     0.0     0/0   0.0

TEAM: FG: 12/21 (57.1%), 3PT: 5/8 (62.5%), REB: 8 (2 off, 6 def), AST: 3, TO: 1
TEAM FOULS: 6 [Team_059 in BONUS]

================================================================================

================================================================================
                       2ND QUARTER - Team_059 vs Team_037                       
================================================================================

[12:00] Team_059 possession (Score: 32-28)
Blake Tatum makes the Midrange and draws the foul on Giannis Middleton! And-1! Blake Tatum to the line for 1. [Team fouls: 1] (Giannis Middleton: 1 personal fouls)   FT 1/1: GOOD Blake Tatum makes 1/1 from the line.
Score: 35-28

[11:46] Team_037 possession (Score: 35-28)
FOUL! Reach-in foul on Jarrett Smith during the drive. [Team fouls: 1] No free throws, side out. (Jarrett Smith: 1 personal fouls)

[11:31] Team_037 possession (Score: 35-28)
Giannis Middleton attempts a 3Pt. Wide open! Bam Wade is 8.1 feet away. [ZONE] Giannis Middleton misses. Rebound secured by Jarrett Smith.

[11:19] Team_059 possession (Score: 35-28)
Jarrett Smith drives, Scottie Jackson stays with him. Jarrett Smith attempts a Dunk. Contested by Scottie Jackson (3.9 feet, ZONE). Jarrett Smith misses. Offensive rebound by Jarrett Smith! Jarrett Smith kicks it out.

[11:03] Team_059 possession (Score: 35-28)
Nikola Jokic attempts a Midrange. Heavily contested by Scottie Jackson (0.5 feet, ZONE)! NIKOLA JOKIC MAKES IT! Assist: Bam Wade
Score: 37-28

[10:47] Team_037 possession (Score: 37-28)
Scottie Jackson attempts a Layup. Wide open! Nikola Jokic is 7.3 feet away. [MAN] Scottie Jackson misses. Rebound secured by Nikola Jokic.

[10:33] Team_059 possession (Score: 37-28)
John Iverson attempts a 3Pt. Heavily contested by Jarrett Tatum (0.5 feet, MAN)! John Iverson misses. Rebound secured by Scottie Jackson.

[10:19] Team_037 possession (Score: 37-28)
RJ Mitchell attempts a 3Pt. Contested by Bam Wade (4.1 feet, ZONE). RJ Mitchell misses. Rebound secured by Nikola Jokic.

[10:01] Team_059 possession (Score: 37-28)
John Iverson drives, Jarrett Tatum stays with him. John Iverson attempts a Dunk. Wide open! Jarrett Tatum is 8.2 feet away. [MAN] JOHN IVERSON MAKES IT!
Score: 39-28

[09:50] Team_037 possession (Score: 39-28)
Scottie Jackson attempts a Midrange. Wide open! Nikola Jokic is 9.1 feet away. [MAN] Scottie Jackson misses. Rebound secured by John Iverson.

[09:34] Team_059 possession (Score: 39-28)
Jarrett Smith attempts a Layup. Wide open! Collin Young is 6.3 feet away. [MAN] JARRETT SMITH MAKES IT! Assist: John Iverson
Score: 41-28

[09:18] Team_037 possession (Score: 41-28)
RJ Mitchell drives, picks up Bam Wade. Help arrives from Blake Tatum! RJ Mitchell attempts a Layup. Contested by Blake Tatum (5.4 feet, MAN). RJ MITCHELL MAKES IT!
Score: 41-30

[09:03] Team_059 possession (Score: 41-30)
Bam Wade drives and kicks out. Nikola Jokic attempts a Midrange. Contested by Scottie Jackson (3.8 feet, MAN). NIKOLA JOKIC MAKES IT! Assist: Bam Wade
Score: 43-30

[08:45] Team_037 possession (Score: 43-30)
Collin Young drives, Jarrett Smith stays with him. Collin Young attempts a Dunk. Contested by Jarrett Smith (5.4 feet, MAN). COLLIN YOUNG MAKES IT! Assist: RJ Mitchell
Score: 43-32

[08:30] Team_059 possession (Score: 43-32)
John Iverson attempts a Midrange. Wide open! Jarrett Tatum is 7.0 feet away. [MAN] John Iverson misses. Rebound secured by Scottie Jackson.

[08:17] Team_037 possession (Score: 43-32)
Scottie Jackson attempts a 3Pt. Wide open! Nikola Jokic is 7.3 feet away. [MAN] Scottie Jackson misses. Rebound secured by Nikola Jokic.

[08:02] Team_059 possession (Score: 43-32)
Nikola Jokic attempts a Layup. Wide open! Scottie Jackson is 6.7 feet away. [ZONE] NIKOLA JOKIC MAKES IT!
Score: 45-32

[07:46] Team_037 possession (Score: 45-32)
Scottie Jackson attempts a Midrange. Contested by Nikola Jokic (3.8 feet, MAN). SCOTTIE JACKSON MAKES IT! Assist: RJ Mitchell
Score: 45-34

[07:34] Team_059 possession (Score: 45-34)
Jarrett Smith drives and kicks out. Blake Tatum attempts a 3Pt. Wide open! Giannis Middleton is 6.3 feet away. [MAN] Blake Tatum misses. Rebound secured by Jarrett Tatum.

[07:18] Team_037 possession (Score: 45-34)
Giannis Middleton attempts a Midrange. Heavily contested by Blake Tatum (1.5 feet, ZONE)! GIANNIS MIDDLETON MAKES IT!
Score: 45-36

[07:05] Team_059 possession (Score: 45-36)
Nikola Jokic attempts a Layup. Contested by Scottie Jackson (3.1 feet, MAN). NIKOLA JOKIC MAKES IT!
Score: 47-36

[06:49] Team_037 possession (Score: 47-36)
RJ Mitchell attempts a 3Pt. Wide open! Bam Wade is 7.2 feet away. [MAN] RJ Mitchell misses. Offensive rebound by Scottie Jackson! Scottie Jackson kicks it out.

[06:34] Team_037 possession (Score: 47-36)
Jarrett Tatum drives to the basket... Jarrett Tatum throws a bad pass out of bounds! TURNOVER! (dead ball)

[06:34] Substitution (Team_059): Bam Wade OUT → Russell Quickley IN (stamina_rule2)

[06:34] Substitution (Team_059): Blake Tatum OUT → Scottie Ginobili IN (stamina_rule2)

[06:34] Substitution (Team_059): John Iverson OUT → Allen Giddey IN (stamina_rule2)

[06:34] Substitution (Team_059): Nikola Jokic OUT → Bones Middleton IN (stamina_rule2)

[06:34] Substitution (Team_059): Jarrett Smith OUT → LeBron Lowry IN (stamina_rule2)

[06:34] Substitution (Team_037): RJ Mitchell OUT → Jarrett Randle IN (stamina_rule2)

[06:34] Substitution (Team_037): Giannis Middleton OUT → Collin Trent IN (stamina_rule2)

[06:34] Substitution (Team_037): Jarrett Tatum OUT → Julius Bird IN (stamina_rule2)

[06:34] Substitution (Team_037): Scottie Jackson OUT → Russell Anthony IN (stamina_rule2)

[06:34] Substitution (Team_037): Collin Young OUT → Wendell Herro IN (stamina_rule2)

[06:19] Team_059 possession (Score: 47-36)
FOUL! Offensive foul on LeBron Lowry! Russell Anthony drew the charge! [Team fouls: 2] (LeBron Lowry: 1 personal fouls) TURNOVER! (dead ball)

[06:06] Team_037 possession (Score: 47-36)
FOUL! Offensive foul on Collin Trent! Scottie Ginobili drew the charge! [Team fouls: 2] (Collin Trent: 1 personal fouls) TURNOVER! (dead ball)

[05:51] Team_059 possession (Score: 47-36)
Allen Giddey drives and kicks out. Scottie Ginobili attempts a Midrange. Contested by Collin Trent (5.9 feet, MAN). Scottie Ginobili misses. FOUL! Loose ball foul on Julius Bird during the rebound battle. [Team fouls: 3] No free throws, side out. (Julius Bird: 1 personal fouls)

[05:39] Team_059 possession (Score: 47-36)
Scottie Ginobili attempts a 3Pt. Wide open! Collin Trent is 6.7 feet away. [MAN] SCOTTIE GINOBILI MAKES IT! Assist: Russell Quickley
Score: 50-36

[05:26] Team_037 possession (Score: 50-36)
Russell Anthony drives and kicks out. Julius Bird attempts a 3Pt. Contested by Russell Quickley (5.0 feet, ZONE). Julius Bird misses. Rebound secured by Bones Middleton.

[05:16] Team_059 possession (Score: 50-36)
Bones Middleton attempts a 3Pt. Contested by Russell Anthony (3.8 feet, MAN). BONES MIDDLETON MAKES IT! Assist: Allen Giddey
Score: 53-36

[05:04] Team_037 possession (Score: 53-36)
Russell Anthony drives and kicks out. Julius Bird attempts a 3Pt. Wide open! Allen Giddey is 8.8 feet away. [MAN] Julius Bird misses. Rebound secured by Bones Middleton.

[04:47] Team_059 possession (Score: 53-36)
Allen Giddey attempts a Layup. Contested by Russell Anthony (6.0 feet, ZONE). Allen Giddey misses. Rebound secured by Wendell Herro.

[04:37] Team_037 possession (Score: 53-36)
Russell Anthony attempts a Layup. Contested by Bones Middleton (4.7 feet, ZONE). RUSSELL ANTHONY MAKES IT! Assist: Wendell Herro
Score: 53-38

[04:22] Team_059 possession (Score: 53-38)
Bones Middleton attempts a Midrange. Contested by Russell Anthony (3.0 feet, MAN). Bones Middleton misses. Rebound secured by Russell Anthony.

[04:09] Team_037 possession (Score: 53-38)
Wendell Herro drives to the basket... FOUL! Offensive foul on Wendell Herro! LeBron Lowry drew the charge! [Team fouls: 4] (Wendell Herro: 1 personal fouls) TURNOVER! (dead ball)

[03:55] Team_059 possession (Score: 53-38)
Russell Quickley attempts a 3Pt. Contested by Jarrett Randle (2.2 feet, ZONE). RUSSELL QUICKLEY MAKES IT! Assist: Bones Middleton
Score: 56-38

[03:39] Team_037 possession (Score: 56-38)
Wendell Herro drives, LeBron Lowry stays with him. Wendell Herro attempts a Dunk. Wide open! LeBron Lowry is 6.7 feet away. [MAN] WENDELL HERRO MAKES IT! Assist: Collin Trent
Score: 56-40

[03:22] Team_059 possession (Score: 56-40)
Russell Quickley attempts a Midrange. Contested by Jarrett Randle (5.8 feet, MAN). Russell Quickley misses. Rebound secured by Wendell Herro.

[03:12] Team_037 possession (Score: 56-40)
Julius Bird attempts a 3Pt. Contested by Russell Quickley (5.1 feet, ZONE). JULIUS BIRD MAKES IT!
Score: 56-43

[02:55] Team_059 possession (Score: 56-43)
Scottie Ginobili drives, Russell Anthony stays with him. Scottie Ginobili attempts a Layup. Wide open! Russell Anthony is 7.7 feet away. [ZONE] SCOTTIE GINOBILI MAKES IT!
Score: 58-43

[02:46] Team_037 possession (Score: 58-43)
Wendell Herro attempts a Layup. Wide open! LeBron Lowry is 9.7 feet away. [MAN] WENDELL HERRO MAKES IT! Assist: Russell Anthony
Score: 58-45

[02:32] Team_059 possession (Score: 58-45)
LeBron Lowry drives to the basket... LeBron Lowry throws a bad pass! Stolen by Russell Anthony! TURNOVER! (live ball)

[02:16] Team_037 possession (Score: 58-45)
Russell Anthony drives and kicks out. Collin Trent attempts a 3Pt. Wide open! Russell Quickley is 9.2 feet away. [ZONE] COLLIN TRENT MAKES IT! Assist: Julius Bird
Score: 58-48

[02:05] Team_059 possession (Score: 58-48)
FOUL! Holding foul on Russell Anthony. [IN THE BONUS! 5 team fouls] LeBron Lowry to the line for 2 free throws. (Russell Anthony: 1 personal fouls)   FT 1/2: GOOD   FT 2/2: MISS LeBron Lowry makes 1/2 from the line. Rebound secured by Wendell Herro.
Score: 59-48

[01:52] Team_037 possession (Score: 59-48)
FOUL! Shooting foul on Scottie Ginobili. Russell Anthony to the line for 2 free throws. [Team fouls: 3] (Scottie Ginobili: 1 personal fouls)   FT 1/2: GOOD   FT 2/2: GOOD Russell Anthony makes 2/2 from the line.
Score: 59-50

[01:38] Team_059 possession (Score: 59-50)
Allen Giddey drives and kicks out. Russell Quickley attempts a Midrange. Wide open! Russell Anthony is 6.2 feet away. [ZONE] Russell Quickley misses. Offensive rebound by Scottie Ginobili! Scottie Ginobili kicks it out.

[01:23] Team_059 possession (Score: 59-50)
Scottie Ginobili attempts a 3Pt. Contested by Jarrett Randle (3.8 feet, ZONE). SCOTTIE GINOBILI MAKES IT! Assist: Russell Quickley
Score: 62-50

[01:10] Team_037 possession (Score: 62-50)
Collin Trent attempts a 3Pt. Wide open! Russell Quickley is 6.2 feet away. [ZONE] COLLIN TRENT MAKES IT! Assist: Jarrett Randle
Score: 62-53

[00:53] Team_059 possession (Score: 62-53)
Scottie Ginobili attempts a 3Pt. Contested by Collin Trent (3.5 feet, MAN). Scottie Ginobili misses. Rebound secured by Julius Bird.

[00:42] Team_037 possession (Score: 62-53)
FOUL! Holding foul on Russell Quickley. [Team fouls: 4] No free throws, side out. (Russell Quickley: 1 personal fouls)

[00:25] Team_037 possession (Score: 62-53)
Collin Trent drives, picks up Scottie Ginobili. Help arrives from Allen Giddey! Collin Trent attempts a Dunk. Wide open! Allen Giddey is 6.8 feet away. [MAN] COLLIN TRENT MAKES IT! Assist: Julius Bird
Score: 62-55

[00:10] Team_059 possession (Score: 62-55)
Russell Quickley attempts a Midrange. Contested by Jarrett Randle (5.2 feet, MAN). RUSSELL QUICKLEY MAKES IT!
Score: 64-55

================================================================================
                              2ND QUARTER COMPLETE                              
================================================================================

2ND QUARTER SCORE: Team_059 32, Team_037 27

BOX SCORE:
================================================================================

Team_059
--------------------------------------------------------------------------------
Player                MIN  PTS  REB  AST  TO      FG   FG%      3P   3P%
--------------------------------------------------------------------------------
Nikola Jokic           18    8    3    0   0   4/4   100.0     0/0   0.0
Scottie Ginobili        6    8    1    0   0   3/4    75.0     0/0   0.0
Russell Quickley        6    5    0    2   0   2/3    66.7     0/0   0.0
Blake Tatum            18    3    0    0   0   1/1   100.0     0/0   0.0
Bones Middleton         6    3    3    1   0   1/2    50.0     0/0   0.0
Jarrett Smith          18    2    2    0   0   1/2    50.0     0/0   0.0
John Iverson           18    2    1    1   0   1/3    33.3     0/0   0.0
Bam Wade               18    0    0    2   0   0/0     0.0     0/0   0.0
Allen Giddey            6    0    0    1   0   0/1     0.0     0/0   0.0

TEAM: FG: 13/21 (61.9%), 3PT: 4/6 (66.7%), REB: 10 (3 off, 7 def), AST: 7, TO: 2
TEAM FOULS: 4


Team_037
--------------------------------------------------------------------------------
Player                MIN  PTS  REB  AST  TO      FG   FG%      3P   3P%
--------------------------------------------------------------------------------
Collin Trent            6    8    0    1   0   3/3   100.0     0/0   0.0
Russell Anthony         6    4    1    1   0   2/4    50.0     0/0   0.0
Wendell Herro           6    4    3    1   0   2/2   100.0     0/0   0.0
Julius Bird             6    3    1    2   0   1/1   100.0     0/0   0.0
Giannis Middleton      18    2    0    0   0   1/2    50.0     0/0   0.0
Scottie Jackson        18    2    3    0   0   1/4    25.0     0/0   0.0
RJ Mitchell            18    2    0    2   0   1/2    50.0     0/0   0.0
Collin Young           18    2    0    0   0   1/1   100.0     0/0   0.0
Jarrett Tatum          18    0    1    0   0   0/0     0.0     0/0   0.0
Jarrett Randle          6    0    0    1   0   0/0     0.0     0/0   0.0

TEAM: FG: 12/19 (63.2%), 3PT: 2/5 (40.0%), REB: 9 (1 off, 8 def), AST: 8, TO: 3
TEAM FOULS: 5 [Team_059 in BONUS]

================================================================================

================================================================================
                       3RD QUARTER - Team_059 vs Team_037                       
================================================================================

[12:00] Team_059 possession (Score: 64-55)
Jarrett Smith drives, picks up Scottie Jackson. Help arrives from Giannis Middleton! Jarrett Smith attempts a Layup. Contested by Giannis Middleton (4.3 feet, ZONE). JARRETT SMITH MAKES IT!
Score: 66-55

[11:44] Team_037 possession (Score: 66-55)
RJ Mitchell drives, Jarrett Smith stays with him. RJ Mitchell attempts a Dunk. Contested by Jarrett Smith (5.9 feet, ZONE). RJ Mitchell misses. Rebound secured by Bam Wade.

[11:33] Team_059 possession (Score: 66-55)
Bam Wade attempts a Midrange. Heavily contested by Scottie Jackson (1.8 feet, ZONE)! BAM WADE MAKES IT! Assist: John Iverson
Score: 68-55

[11:18] Team_037 possession (Score: 68-55)
Giannis Middleton drives, Blake Tatum stays with him. Giannis Middleton attempts a Layup. Contested by Blake Tatum (4.3 feet, MAN). GIANNIS MIDDLETON MAKES IT! Assist: RJ Mitchell
Score: 68-57

[11:02] Team_059 possession (Score: 68-57)
FOUL! Reach-in foul on RJ Mitchell during the drive. [Team fouls: 1] No free throws, side out. (RJ Mitchell: 1 personal fouls)

[10:53] Team_059 possession (Score: 68-57)
Jarrett Smith drives, picks up Collin Young. Help arrives from Giannis Middleton! Jarrett Smith attempts a Dunk. Contested by Giannis Middleton (3.7 feet, MAN). JARRETT SMITH MAKES IT! Assist: Bam Wade
Score: 70-57

[10:35] Team_037 possession (Score: 70-57)
Giannis Middleton attempts a Midrange. Wide open! Nikola Jokic is 6.3 feet away. [ZONE] GIANNIS MIDDLETON MAKES IT! Assist: Jarrett Tatum
Score: 70-59

[10:17] Team_059 possession (Score: 70-59)
Jarrett Smith attempts a 3Pt. Wide open! Giannis Middleton is 6.3 feet away. [ZONE] Jarrett Smith misses. Rebound secured by Scottie Jackson.

[10:00] Team_037 possession (Score: 70-59)
RJ Mitchell attempts a 3Pt. Wide open! Bam Wade is 6.2 feet away. [ZONE] RJ MITCHELL MAKES IT! Assist: Collin Young
Score: 70-62

[09:48] Team_059 possession (Score: 70-62)
John Iverson drives and kicks out. FOUL! Shooting foul on Scottie Jackson. Nikola Jokic to the line for 3 free throws. [Team fouls: 2] (Scottie Jackson: 1 personal fouls)   FT 1/3: GOOD   FT 2/3: GOOD   FT 3/3: GOOD Nikola Jokic makes 3/3 from the line.
Score: 73-62

[09:31] Team_037 possession (Score: 73-62)
Scottie Jackson throws a bad pass out of bounds! TURNOVER! (dead ball)

[09:20] Team_059 possession (Score: 73-62)
Nikola Jokic attempts a 3Pt. Contested by Scottie Jackson (3.9 feet, MAN). Nikola Jokic misses. Rebound secured by Jarrett Tatum.

[09:06] Team_037 possession (Score: 73-62)
Giannis Middleton drives and kicks out. Scottie Jackson attempts a 3Pt. Wide open! John Iverson is 7.1 feet away. [ZONE] Scottie Jackson misses. Offensive rebound by Collin Young! Collin Young puts it back in!
Score: 73-64

[08:50] Team_059 possession (Score: 73-64)
Nikola Jokic attempts a 3Pt. Contested by Scottie Jackson (3.3 feet, ZONE). NIKOLA JOKIC MAKES IT! Assist: Blake Tatum
Score: 76-64

[08:32] Team_037 possession (Score: 76-64)
Jarrett Tatum attempts a Midrange. Contested by John Iverson (4.8 feet, MAN). Jarrett Tatum misses. Rebound secured by Bam Wade.

[08:17] Team_059 possession (Score: 76-64)
Nikola Jokic drives, Scottie Jackson stays with him. Nikola Jokic attempts a Layup. Heavily contested by Scottie Jackson (1.2 feet, MAN)! Nikola Jokic misses. FOUL! Loose ball foul on Collin Young during the rebound battle. [Team fouls: 3] No free throws, side out. (Collin Young: 1 personal fouls)

[08:04] Team_059 possession (Score: 76-64)
Blake Tatum throws a bad pass out of bounds! TURNOVER! (dead ball)

[07:49] Team_037 possession (Score: 76-64)
Scottie Jackson drives, picks up Jarrett Smith. Help arrives from Bam Wade! Scottie Jackson attempts a Layup. Heavily contested by Bam Wade (0.8 feet, ZONE)! SCOTTIE JACKSON MAKES IT! Assist: RJ Mitchell
Score: 76-66

[07:32] Team_059 possession (Score: 76-66)
Bam Wade attempts a Midrange. Contested by RJ Mitchell (2.2 feet, MAN). Bam Wade misses. Rebound secured by Jarrett Tatum.

[07:19] Team_037 possession (Score: 76-66)
Jarrett Tatum drives to the basket... Jarrett Tatum throws a bad pass out of bounds! TURNOVER! (dead ball)

[07:04] Team_059 possession (Score: 76-66)
Jarrett Smith drives to the basket... Jarrett Smith loses control! Ball rolls out of bounds! TURNOVER! (dead ball)

[06:49] Team_037 possession (Score: 76-66)
RJ Mitchell attempts a 3Pt. Contested by John Iverson (4.9 feet, ZONE). RJ Mitchell misses. Rebound secured by Jarrett Smith.

[06:35] Team_059 possession (Score: 76-66)
John Iverson attempts a Layup. Wide open! Jarrett Tatum is 8.1 feet away. [MAN] JOHN IVERSON MAKES IT!
Score: 78-66

[06:26] Team_037 possession (Score: 78-66)
Collin Young attempts a 3Pt. Contested by Bam Wade (5.2 feet, ZONE). Collin Young misses. Rebound secured by Bam Wade.

[06:10] Team_059 possession (Score: 78-66)
FOUL! Holding foul on Giannis Middleton. [Team fouls: 4] No free throws, side out. (Giannis Middleton: 1 personal fouls)

[05:57] Team_059 possession (Score: 78-66)
Bam Wade drives to the basket... Bam Wade commits a violation (traveling/carry)! TURNOVER! (dead ball)

[05:46] Team_037 possession (Score: 78-66)
Giannis Middleton attempts a 3Pt. Wide open! Blake Tatum is 8.0 feet away. [MAN] Giannis Middleton misses. Rebound secured by John Iverson.

[05:32] Team_059 possession (Score: 78-66)
Nikola Jokic attempts a 3Pt. Contested by Scottie Jackson (4.6 feet, MAN). Nikola Jokic misses. Rebound secured by Scottie Jackson.

[05:18] Team_037 possession (Score: 78-66)
Scottie Jackson attempts a Layup. Wide open! Jarrett Smith is 9.3 feet away. [ZONE] SCOTTIE JACKSON MAKES IT!
Score: 78-68

[05:00] Team_059 possession (Score: 78-68)
John Iverson attempts a Layup. Contested by Jarrett Tatum (4.0 feet, MAN). JOHN IVERSON MAKES IT! Assist: Nikola Jokic
Score: 80-68

[04:44] Team_037 possession (Score: 80-68)
FOUL! Reach-in foul on Jarrett Smith during the drive. [Team fouls: 1] No free throws, side out. (Jarrett Smith: 1 personal fouls)

[04:33] Team_037 possession (Score: 80-68)
FOUL! Holding foul on Jarrett Smith. [Team fouls: 2] No free throws, side out. (Jarrett Smith: 2 personal fouls)

[04:15] Team_037 possession (Score: 80-68)
RJ Mitchell drives, picks up Bam Wade. Help arrives from Blake Tatum! RJ Mitchell attempts a Layup. Contested by Blake Tatum (2.4 feet, MAN). RJ MITCHELL MAKES IT! Assist: Jarrett Tatum
Score: 80-70

[03:58] Team_059 possession (Score: 80-70)
Blake Tatum attempts a 3Pt. Contested by Giannis Middleton (4.9 feet, MAN). BLAKE TATUM MAKES IT! Assist: Nikola Jokic
Score: 83-70

[03:43] Team_037 possession (Score: 83-70)
RJ Mitchell attempts a Layup. Contested by Bam Wade (4.3 feet, MAN). RJ MITCHELL MAKES IT! Assist: Scottie Jackson
Score: 83-72

[03:27] Team_059 possession (Score: 83-72)
Blake Tatum throws a bad pass! Stolen by Giannis Middleton! TURNOVER! (live ball)

[03:17] Team_037 possession (Score: 83-72)
RJ Mitchell attempts a Midrange. Wide open! John Iverson is 7.6 feet away. [ZONE] RJ MITCHELL MAKES IT!
Score: 83-74

[03:04] Team_059 possession (Score: 83-74)
FOUL! Shooting foul on Giannis Middleton. John Iverson to the line for 2 free throws. [BONUS: 5 team fouls] (Giannis Middleton: 2 personal fouls)   FT 1/2: GOOD   FT 2/2: GOOD John Iverson makes 2/2 from the line.
Score: 85-74

[02:53] Team_037 possession (Score: 85-74)
RJ Mitchell drives, picks up Bam Wade. Help arrives from Blake Tatum! RJ Mitchell attempts a Layup. Contested by Blake Tatum (2.9 feet, MAN). RJ MITCHELL MAKES IT! Assist: Jarrett Tatum
Score: 85-76

[02:41] Team_059 possession (Score: 85-76)
FOUL! Shooting foul on Collin Young. Jarrett Smith to the line for 2 free throws. [BONUS: 6 team fouls] (Collin Young: 2 personal fouls)   FT 1/2: MISS   FT 2/2: GOOD Jarrett Smith makes 1/2 from the line.
Score: 86-76

[02:23] Team_037 possession (Score: 86-76)
FOUL! Shooting foul on Nikola Jokic. RJ Mitchell to the line for 2 free throws. [Team fouls: 3] (Nikola Jokic: 1 personal fouls)   FT 1/2: MISS   FT 2/2: MISS RJ Mitchell makes 0/2 from the line. Rebound secured by Bam Wade.

[02:04] Team_059 possession (Score: 86-76)
Blake Tatum attempts a Layup. Contested by Scottie Jackson (5.2 feet, ZONE). Blake Tatum misses. Rebound secured by Collin Young.

[01:49] Team_037 possession (Score: 86-76)
Giannis Middleton attempts a Midrange. Wide open! Blake Tatum is 6.4 feet away. [MAN] Giannis Middleton misses. Rebound secured by John Iverson.

[01:29] Team_059 possession (Score: 86-76)
Nikola Jokic makes the Layup and draws the foul on Giannis Middleton! And-1! Nikola Jokic to the line for 1. [BONUS: 7 team fouls] (Giannis Middleton: 3 personal fouls)   FT 1/1: MISS Nikola Jokic makes 0/1 from the line. Rebound secured by Jarrett Tatum.
Score: 88-76

[01:12] Team_037 possession (Score: 88-76)
FOUL! Reach-in foul on Blake Tatum during the drive. [Team fouls: 4] No free throws, side out. (Blake Tatum: 1 personal fouls)

[00:56] Team_037 possession (Score: 88-76)
Jarrett Tatum attempts a Midrange. Wide open! John Iverson is 7.3 feet away. [MAN] JARRETT TATUM MAKES IT!
Score: 88-78

[00:39] Team_059 possession (Score: 88-78)
FOUL! Shooting foul on Scottie Jackson. Blake Tatum to the line for 2 free throws. [BONUS: 8 team fouls] (Scottie Jackson: 2 personal fouls)   FT 1/2: MISS   FT 2/2: GOOD Blake Tatum makes 1/2 from the line.
Score: 89-78

[00:25] Team_037 possession (Score: 89-78)
Scottie Jackson attempts a 3Pt. Contested by Bam Wade (3.3 feet, ZONE). Scottie Jackson misses. Offensive rebound by Scottie Jackson! Scottie Jackson kicks it out.

[00:12] Team_037 possession (Score: 89-78)
Giannis Middleton attempts a 3Pt. Contested by Bam Wade (4.7 feet, ZONE). Giannis Middleton misses. Rebound secured by John Iverson.

================================================================================
                              3RD QUARTER COMPLETE                              
================================================================================

3RD QUARTER SCORE: Team_059 25, Team_037 23

BOX SCORE:
================================================================================

Team_059
--------------------------------------------------------------------------------
Player                MIN  PTS  REB  AST  TO      FG   FG%      3P   3P%
--------------------------------------------------------------------------------
John Iverson           30    6    3    1   0   3/3   100.0     0/0   0.0
Nikola Jokic           30    6    0    2   0   2/5    40.0     0/0   0.0
Jarrett Smith          30    5    2    0   0   3/4    75.0     0/0   0.0
Blake Tatum            30    4    0    1   0   2/3    66.7     0/0   0.0
Bam Wade               30    2    4    1   0   1/2    50.0     0/0   0.0

TEAM: FG: 11/17 (64.7%), 3PT: 2/5 (40.0%), REB: 9 (1 off, 8 def), AST: 5, TO: 4
TEAM FOULS: 4


Team_037
--------------------------------------------------------------------------------
Player                MIN  PTS  REB  AST  TO      FG   FG%      3P   3P%
--------------------------------------------------------------------------------
RJ Mitchell            30   11    0    2   0   5/8    62.5     0/0   0.0
Giannis Middleton      30    4    0    0   0   2/5    40.0     0/0   0.0
Scottie Jackson        30    4    3    1   0   2/2   100.0     0/0   0.0
Jarrett Tatum          30    2    3    3   0   1/2    50.0     0/0   0.0
Collin Young           30    2    2    1   0   1/2    50.0     0/0   0.0

TEAM: FG: 11/19 (57.9%), 3PT: 1/5 (20.0%), REB: 8 (2 off, 6 def), AST: 7, TO: 2
TEAM FOULS: 8 [Team_059 in BONUS]

================================================================================

================================================================================
                       4TH QUARTER - Team_059 vs Team_037                       
================================================================================

[12:00] Team_059 possession (Score: 89-78)
Nikola Jokic attempts a Midrange. Heavily contested by Giannis Middleton (1.0 feet, ZONE)! Nikola Jokic misses. Rebound secured by Collin Young.

[11:48] Team_037 possession (Score: 89-78)
Collin Young drives, Jarrett Smith stays with him. Collin Young attempts a Layup. Heavily contested by Jarrett Smith (2.0 feet, ZONE)! COLLIN YOUNG MAKES IT! Assist: Scottie Jackson
Score: 89-80

[11:34] Team_059 possession (Score: 89-80)
Bam Wade attempts a 3Pt. Contested by RJ Mitchell (2.2 feet, MAN). Bam Wade misses. Rebound secured by Scottie Jackson.

[11:21] Team_037 possession (Score: 89-80)
FOUL! Shooting foul on Bam Wade. RJ Mitchell to the line for 2 free throws. [Team fouls: 1] (Bam Wade: 1 personal fouls)   FT 1/2: GOOD   FT 2/2: GOOD RJ Mitchell makes 2/2 from the line.
Score: 89-82

[11:03] Team_059 possession (Score: 89-82)
Nikola Jokic makes the Midrange and draws the foul on Scottie Jackson! And-1! Nikola Jokic to the line for 1. [Team fouls: 1] (Scottie Jackson: 1 personal fouls)   FT 1/1: GOOD Nikola Jokic makes 1/1 from the line.
Score: 92-82

[10:52] Team_037 possession (Score: 92-82)
RJ Mitchell attempts a Midrange. Contested by Bam Wade (3.9 feet, MAN). RJ MITCHELL MAKES IT! Assist: Collin Young
Score: 92-84

[10:38] Team_059 possession (Score: 92-84)
FOUL! Reach-in foul on Scottie Jackson during the drive. [Team fouls: 2] No free throws, side out. (Scottie Jackson: 2 personal fouls)

[10:24] Team_059 possession (Score: 92-84)
Nikola Jokic drives to the basket... Nikola Jokic loses control! Ball rolls out of bounds! TURNOVER! (dead ball)

[10:24] Substitution (Team_059): Bam Wade OUT → Russell Quickley IN (stamina_rule2)

[10:24] Substitution (Team_059): Blake Tatum OUT → Scottie Ginobili IN (stamina_rule2)

[10:24] Substitution (Team_059): John Iverson OUT → Allen Giddey IN (stamina_rule2)

[10:24] Substitution (Team_059): Nikola Jokic OUT → Bones Middleton IN (stamina_rule2)

[10:24] Substitution (Team_059): Jarrett Smith OUT → LeBron Lowry IN (stamina_rule2)

[10:24] Substitution (Team_037): RJ Mitchell OUT → Jarrett Randle IN (stamina_rule2)

[10:24] Substitution (Team_037): Giannis Middleton OUT → Collin Trent IN (stamina_rule2)

[10:24] Substitution (Team_037): Jarrett Tatum OUT → Julius Bird IN (stamina_rule2)

[10:24] Substitution (Team_037): Scottie Jackson OUT → Russell Anthony IN (stamina_rule2)

[10:24] Substitution (Team_037): Collin Young OUT → Wendell Herro IN (stamina_rule2)

[10:12] Team_037 possession (Score: 92-84)
Wendell Herro makes the Midrange and draws the foul on LeBron Lowry! And-1! Wendell Herro to the line for 1. [Team fouls: 2] (LeBron Lowry: 1 personal fouls)   FT 1/1: GOOD Wendell Herro makes 1/1 from the line.
Score: 92-87

[09:57] Team_059 possession (Score: 92-87)
Allen Giddey attempts a 3Pt. BLOCKED BY JARRETT RANDLE! Ball is loose! Rebound secured by Julius Bird.

[09:42] Team_037 possession (Score: 92-87)
Julius Bird attempts a 3Pt. Contested by Russell Quickley (2.5 feet, ZONE). Julius Bird misses. Offensive rebound by Russell Anthony! Russell Anthony puts it back in!
Score: 92-89

[09:27] Team_059 possession (Score: 92-89)
Bones Middleton makes the Layup and draws the foul on Russell Anthony! And-1! Bones Middleton to the line for 1. [Team fouls: 3] (Russell Anthony: 1 personal fouls)   FT 1/1: GOOD Bones Middleton makes 1/1 from the line.
Score: 95-89

[09:10] Team_037 possession (Score: 95-89)
Julius Bird attempts a Layup. BLOCKED BY SCOTTIE GINOBILI! Ball deflects out of bounds off Julius Bird.

[08:54] Team_059 possession (Score: 95-89)
FOUL! Shooting foul on Julius Bird. Allen Giddey to the line for 2 free throws. [Team fouls: 4] (Julius Bird: 1 personal fouls)   FT 1/2: GOOD   FT 2/2: GOOD Allen Giddey makes 2/2 from the line.
Score: 97-89

[08:35] Team_037 possession (Score: 97-89)
Julius Bird attempts a 3Pt. Contested by Russell Quickley (4.4 feet, ZONE). JULIUS BIRD MAKES IT! Assist: Wendell Herro
Score: 97-92

[08:22] Team_059 possession (Score: 97-92)
LeBron Lowry drives to the basket... LeBron Lowry commits a violation (traveling/carry)! TURNOVER! (dead ball)

[08:10] Team_037 possession (Score: 97-92)
Jarrett Randle attempts a 3Pt. Contested by Russell Quickley (3.2 feet, ZONE). Jarrett Randle misses. Rebound secured by Bones Middleton.

[07:57] Team_059 possession (Score: 97-92)
LeBron Lowry drives to the basket... LeBron Lowry loses the ball! Stripped by Russell Anthony! TURNOVER! (live ball)

[07:43] Team_037 possession (Score: 97-92)
Russell Anthony drives, Bones Middleton stays with him. Russell Anthony attempts a Layup. Contested by Bones Middleton (4.7 feet, MAN). RUSSELL ANTHONY MAKES IT! Assist: Julius Bird
Score: 97-94

[07:28] Team_059 possession (Score: 97-94)
LeBron Lowry drives to the basket... LeBron Lowry loses control! Ball rolls out of bounds! TURNOVER! (dead ball)

[07:15] Team_037 possession (Score: 97-94)
Julius Bird attempts a 3Pt. Wide open! Allen Giddey is 6.7 feet away. [MAN] JULIUS BIRD MAKES IT! Assist: Jarrett Randle
Score: 97-97

[06:58] Team_059 possession (Score: 97-97)
FOUL! Shooting foul on Russell Anthony. LeBron Lowry to the line for 2 free throws. [BONUS: 5 team fouls] (Russell Anthony: 2 personal fouls)   FT 1/2: GOOD   FT 2/2: GOOD LeBron Lowry makes 2/2 from the line.
Score: 99-97

[06:41] Team_037 possession (Score: 99-97)
Collin Trent drives and kicks out. Russell Anthony attempts a 3Pt. Contested by Russell Quickley (5.2 feet, ZONE). Russell Anthony misses. Rebound secured by Bones Middleton.

[06:28] Team_059 possession (Score: 99-97)
Scottie Ginobili drives, picks up Russell Anthony. Help arrives from Collin Trent! Scottie Ginobili attempts a Layup. Contested by Collin Trent (2.5 feet, ZONE). SCOTTIE GINOBILI MAKES IT! Assist: Allen Giddey
Score: 101-97

[06:10] Team_037 possession (Score: 101-97)
Collin Trent attempts a Midrange. Contested by Scottie Ginobili (3.1 feet, MAN). Collin Trent misses. Offensive rebound by Russell Anthony! Russell Anthony puts it back in!
Score: 101-99

[05:53] Team_059 possession (Score: 101-99)
Allen Giddey drives and kicks out. Russell Quickley attempts a Midrange. Wide open! Jarrett Randle is 6.9 feet away. [MAN] Russell Quickley misses. Rebound secured by Wendell Herro.

[05:34] Team_037 possession (Score: 101-99)
Jarrett Randle attempts a 3Pt. Contested by Russell Quickley (2.3 feet, MAN). JARRETT RANDLE MAKES IT! Assist: Julius Bird
Score: 101-102

[05:20] Team_059 possession (Score: 101-102)
LeBron Lowry attempts a Layup. BLOCKED BY RUSSELL ANTHONY! Ball is loose! Rebound secured by Julius Bird.

[05:07] Team_037 possession (Score: 101-102)
Jarrett Randle attempts a 3Pt. Wide open! Russell Quickley is 6.6 feet away. [ZONE] Jarrett Randle misses. Offensive rebound by Julius Bird! Julius Bird kicks it out.

[04:50] Team_037 possession (Score: 101-102)
Collin Trent drives to the basket... FOUL! Offensive foul on Collin Trent! Scottie Ginobili drew the charge! [Team fouls: 6] (Collin Trent: 1 personal fouls) TURNOVER! (dead ball)

[04:35] Team_059 possession (Score: 101-102)
Allen Giddey attempts a 3Pt. Wide open! Julius Bird is 6.9 feet away. [MAN] Allen Giddey misses. Rebound secured by Wendell Herro.

[04:23] Team_037 possession (Score: 101-102)
Jarrett Randle drives to the basket... Jarrett Randle loses the ball! Stripped by Russell Quickley! TURNOVER! (live ball)

[04:08] Team_059 possession (Score: 101-102)
Scottie Ginobili drives and kicks out. Russell Quickley attempts a Midrange. Contested by Jarrett Randle (3.7 feet, MAN). Russell Quickley misses. Offensive rebound by Scottie Ginobili! Scottie Ginobili kicks it out.

[03:54] Team_059 possession (Score: 101-102)
Russell Quickley attempts a 3Pt. Contested by Jarrett Randle (2.4 feet, ZONE). Russell Quickley misses. Rebound secured by Russell Anthony.

[03:38] Team_037 possession (Score: 101-102)
Wendell Herro drives, Bones Middleton stays with him. Wendell Herro attempts a Layup. Wide open! Bones Middleton is 6.2 feet away. [ZONE] WENDELL HERRO MAKES IT! Assist: Julius Bird
Score: 101-104

[03:23] Team_059 possession (Score: 101-104)
Bones Middleton drives, Russell Anthony stays with him. Bones Middleton attempts a Dunk. Contested by Russell Anthony (3.7 feet, ZONE). BONES MIDDLETON MAKES IT!
Score: 103-104

[03:08] Team_037 possession (Score: 103-104)
Julius Bird attempts a 3Pt. Wide open! Allen Giddey is 9.7 feet away. [MAN] JULIUS BIRD MAKES IT! Assist: Collin Trent
Score: 103-107

[02:56] Team_059 possession (Score: 103-107)
Scottie Ginobili attempts a 3Pt. Contested by Jarrett Randle (4.5 feet, ZONE). SCOTTIE GINOBILI MAKES IT! Assist: Allen Giddey
Score: 106-107

[02:43] Team_037 possession (Score: 106-107)
Wendell Herro drives and kicks out. Russell Anthony attempts a 3Pt. Contested by Bones Middleton (4.6 feet, MAN). Russell Anthony misses. Rebound secured by LeBron Lowry.

[02:30] Team_059 possession (Score: 106-107)
Bones Middleton attempts a 3Pt. Contested by Russell Anthony (4.5 feet, ZONE). Bones Middleton misses. Rebound secured by Russell Anthony.

[02:12] Team_037 possession (Score: 106-107)
Russell Anthony attempts a Midrange. Contested by Bones Middleton (4.0 feet, MAN). RUSSELL ANTHONY MAKES IT!
Score: 106-109

[01:59] Team_059 possession (Score: 106-109)
Bones Middleton attempts a 3Pt. Contested by Russell Anthony (2.3 feet, MAN). Bones Middleton misses. Rebound secured by Russell Anthony.

[01:46] Team_037 possession (Score: 106-109)
Jarrett Randle attempts a 3Pt. Heavily contested by Russell Quickley (1.8 feet, MAN)! Jarrett Randle misses. Rebound secured by LeBron Lowry.

[01:31] Team_059 possession (Score: 106-109)
Bones Middleton attempts a Midrange. Contested by Russell Anthony (4.7 feet, MAN). BONES MIDDLETON MAKES IT! Assist: Allen Giddey
Score: 108-109

[01:15] Team_037 possession (Score: 108-109)
Wendell Herro commits a violation (traveling/carry)! TURNOVER! (dead ball)

[01:00] Team_059 possession (Score: 108-109)
LeBron Lowry drives and kicks out. Allen Giddey attempts a 3Pt. Contested by Jarrett Randle (3.2 feet, ZONE). Allen Giddey misses. Offensive rebound by Scottie Ginobili! Scottie Ginobili kicks it out.

[00:46] Team_059 possession (Score: 108-109)
Allen Giddey attempts a Layup. Contested by Russell Anthony (4.5 feet, ZONE). ALLEN GIDDEY MAKES IT! Assist: Scottie Ginobili
Score: 110-109

[00:32] Team_037 possession (Score: 110-109)
Collin Trent attempts a Midrange. Contested by Bones Middleton (4.8 feet, ZONE). Collin Trent misses. Rebound secured by Bones Middleton.

[00:18] Team_059 possession (Score: 110-109)
FOUL! Holding foul on Russell Anthony. [IN THE BONUS! 7 team fouls] Bones Middleton to the line for 2 free throws. (Russell Anthony: 3 personal fouls)   FT 1/2: GOOD   FT 2/2: GOOD Bones Middleton makes 2/2 from the line.
Score: 112-109

[00:04] Team_037 possession (Score: 112-109)
Collin Trent attempts a 3Pt. Contested by Russell Quickley (2.7 feet, ZONE). COLLIN TRENT MAKES IT!
Score: 112-112

================================================================================
                              4TH QUARTER COMPLETE                              
================================================================================

4TH QUARTER SCORE: Team_059 23, Team_037 34

BOX SCORE:
================================================================================

Team_059
--------------------------------------------------------------------------------
Player                MIN  PTS  REB  AST  TO      FG   FG%      3P   3P%
--------------------------------------------------------------------------------
Bones Middleton        17    9    3    0   0   4/6    66.7     0/0   0.0
Scottie Ginobili       17    5    2    1   0   2/2   100.0     0/0   0.0
Allen Giddey           17    4    0    3   0   2/5    40.0     0/0   0.0
Nikola Jokic           32    3    0    0   0   1/2    50.0     0/0   0.0
LeBron Lowry           17    2    2    0   0   1/2    50.0     0/0   0.0
Bam Wade               32    0    0    0   0   0/1     0.0     0/0   0.0
Russell Quickley       17    0    0    0   0   0/1     0.0     0/0   0.0

TEAM: FG: 10/19 (52.6%), 3PT: 1/7 (14.3%), REB: 7 (2 off, 5 def), AST: 4, TO: 4
TEAM FOULS: 2


Team_037
--------------------------------------------------------------------------------
Player                MIN  PTS  REB  AST  TO      FG   FG%      3P   3P%
--------------------------------------------------------------------------------
Julius Bird            17    9    3    3   0   3/4    75.0     0/0   0.0
Russell Anthony        17    8    5    0   0   4/4   100.0     0/0   0.0
Wendell Herro          17    5    2    1   0   2/3    66.7     0/0   0.0
RJ Mitchell            32    4    0    0   0   2/2   100.0     0/0   0.0
Jarrett Randle         17    3    0    1   0   1/3    33.3     0/0   0.0
Collin Trent           17    3    0    1   0   1/3    33.3     0/0   0.0
Collin Young           32    2    1    1   0   1/1   100.0     0/0   0.0
Scottie Jackson        32    0    1    1   0   0/0     0.0     0/0   0.0

TEAM: FG: 14/20 (70.0%), 3PT: 6/8 (75.0%), REB: 12 (3 off, 9 def), AST: 8, TO: 3
TEAM FOULS: 7 [Team_059 in BONUS]

================================================================================

================================================================================
                               FULL GAME COMPLETE                               
================================================================================

FINAL SCORE: Team_059 112, Team_037 112

SCORING BY QUARTER:
--------------------------------------------------------------------------------
Team                     Q1     Q2     Q3     Q4    FINAL
--------------------------------------------------------------------------------
Team_059                 32     32     25     23      112
Team_037                 28     27     23     34      112
--------------------------------------------------------------------------------

FULL GAME BOX SCORE:
================================================================================

Team_059
--------------------------------------------------------------------------------
Player                MIN  PTS  REB  AST  TO      FG   FG%      3P   3P%      FT STL BLK
--------------------------------------------------------------------------------
Bam Wade               32   12    8    4   4   6/11   54.5   2/5    40.0   3/6     0   0
Blake Tatum            32   10    0    3   2   4/6    66.7   2/2   100.0   2/3     0   0
John Iverson           32   13    9    3   0   7/9    77.8   1/2    50.0   4/4     0   0
Nikola Jokic           32   19    3    3   1   6/11   54.5   1/3    33.3   4/5     0   0
Jarrett Smith          32   18    6    2   1   9/12   75.0   0/1     0.0   2/3     0   0
Russell Quickley       17    5    0    2   1   2/4    50.0   1/2    50.0   0/0     1   0
Scottie Ginobili       17   13    3    1   1   5/6    83.3   3/4    75.0   0/0     0   1
Allen Giddey           17    4    0    4   0   2/6    33.3   0/2     0.0   2/2     0   0
Bones Middleton        17   12    6    1   0   4/7    57.1   1/3    33.3   3/3     0   0
LeBron Lowry           17    2    2    0   3   1/2    50.0   0/0     0.0   3/4     0   0

TEAM: FG: 47/76 (61.8%), 3PT: 11/24 (45.8%), REB: 37 (8 off, 29 def), AST: 23, TO: 13


Team_037
--------------------------------------------------------------------------------
Player                MIN  PTS  REB  AST  TO      FG   FG%      3P   3P%      FT STL BLK
--------------------------------------------------------------------------------
RJ Mitchell            32   30    0    4   0  14/20   70.0   5/8    62.5   6/9     1   0
Giannis Middleton      32    6    0    1   2   4/10   40.0   0/5     0.0   0/0     1   0
Jarrett Tatum          32    6    6    4   0   2/3    66.7   0/0     0.0   0/0     0   0
Scottie Jackson        32   11   11    3   1   5/13   38.5   0/1     0.0   1/1     0   0
Collin Young           32   12    5    2   1   5/6    83.3   1/2    50.0   0/0     1   0
Jarrett Randle         17    3    0    2   1   1/3    33.3   1/3    33.3   0/0     0   1
Collin Trent           17   11    0    2   1   4/6    66.7   2/2   100.0   0/0     0   0
Julius Bird            17   12    4    5   0   5/6    83.3   5/5   100.0   0/0     0   0
Russell Anthony        17   12    6    1   0   5/7    71.4   0/0     0.0   2/2     2   1
Wendell Herro          17    9    5    2   3   4/5    80.0   0/0     0.0   1/1     0   0

TEAM: FG: 49/79 (62.0%), 3PT: 14/26 (53.8%), REB: 37 (8 off, 29 def), AST: 26, TO: 9

================================================================================
