================================================================================
                        FULL GAME - Team_018 vs Team_099                        
================================================================================

================================================================================
                       1ST QUARTER - Team_018 vs Team_099                       
================================================================================

[12:00] Team_018 possession (Score: 0-0)
Bones Anunoby attempts a Midrange. Contested by Vince Lillard (6.0 feet, ZONE). Bones Anunoby misses. Rebound secured by Larry Wade.

[11:46] Team_099 possession (Score: 0-0)
Damian Ginobili attempts a Dunk. BLOCKED BY KLAY STEWART! Ball deflects out of bounds off Damian Ginobili.

[11:30] Team_018 possession (Score: 0-0)
FOUL! Holding foul on Larry Wade. [Team fouls: 1] No free throws, side out. (Larry Wade: 1 personal fouls)

[11:17] Team_018 possession (Score: 0-0)
Tracy Bryant drives to the basket... Tracy Bryant commits a violation (traveling/carry)! TURNOVER! (dead ball)

[11:00] Team_099 possession (Score: 0-0)
Larry Wade attempts a Layup. Contested by Domantas Wall (5.3 feet, MAN). LARRY WADE MAKES IT! Assist: Vince Lillard
Score: 0-2

[10:44] Team_018 possession (Score: 0-2)
Domantas Wall attempts a Midrange. Wide open! Larry Wade is 6.4 feet away. [MAN] Domantas Wall misses. Rebound secured by Vince Lillard.

[10:28] Team_099 possession (Score: 0-2)
Vince Lillard attempts a 3Pt. Contested by Klay Stewart (5.0 feet, ZONE). Vince Lillard misses. Rebound secured by Domantas Wall.

[10:11] Team_018 possession (Score: 0-2)
Allen Markkanen attempts a Midrange. Contested by Damian Ginobili (4.5 feet, MAN). Allen Markkanen misses. Rebound secured by Damian Ginobili.

[09:59] Team_099 possession (Score: 0-2)
Vince Lillard attempts a 3Pt. Contested by Klay Stewart (4.8 feet, ZONE). VINCE LILLARD MAKES IT! Assist: Ayo Barrett
Score: 0-5

[09:48] Team_018 possession (Score: 0-5)
Allen Markkanen drives and kicks out. Klay Stewart attempts a 3Pt. Contested by Ayo Barrett (4.1 feet, ZONE). KLAY STEWART MAKES IT! Assist: Domantas Wall
Score: 3-5

[09:33] Team_099 possession (Score: 3-5)
Larry James drives, Domantas Wall stays with him. Larry James attempts a Layup. Wide open! Domantas Wall is 6.8 feet away. [ZONE] LARRY JAMES MAKES IT! Assist: Damian Ginobili
Score: 3-7

[09:16] Team_018 possession (Score: 3-7)
Domantas Wall drives, picks up Vince Lillard. Help arrives from Ayo Barrett! Domantas Wall attempts a Layup. Heavily contested by Ayo Barrett (0.7 feet, ZONE)! DOMANTAS WALL MAKES IT! Assist: Klay Stewart
Score: 5-7

[09:01] Team_099 possession (Score: 5-7)
Vince Lillard attempts a 3Pt. Contested by Bones Anunoby (4.9 feet, MAN). VINCE LILLARD MAKES IT! Assist: Larry Wade
Score: 5-10

[08:44] Team_018 possession (Score: 5-10)
Bones Anunoby attempts a 3Pt. Wide open! Ayo Barrett is 6.6 feet away. [ZONE] BONES ANUNOBY MAKES IT! Assist: Klay Stewart
Score: 8-10

[08:31] Team_099 possession (Score: 8-10)
Larry Wade throws a bad pass! Stolen by Domantas Wall! TURNOVER! (live ball)

[08:13] Team_018 possession (Score: 8-10)
Allen Markkanen attempts a Midrange. Contested by Damian Ginobili (4.8 feet, MAN). ALLEN MARKKANEN MAKES IT! Assist: Bones Anunoby
Score: 10-10

[07:56] Team_099 possession (Score: 10-10)
Vince Lillard drives, Bones Anunoby stays with him. Vince Lillard attempts a Layup. Contested by Bones Anunoby (5.1 feet, ZONE). VINCE LILLARD MAKES IT!
Score: 10-12

[07:42] Team_018 possession (Score: 10-12)
Bones Anunoby loses control! Ball rolls out of bounds! TURNOVER! (dead ball)

[07:24] Team_099 possession (Score: 10-12)
Vince Lillard attempts a Dunk. BLOCKED BY KLAY STEWART! Ball deflects out of bounds off Vince Lillard.

[07:11] Team_018 possession (Score: 10-12)
Allen Markkanen attempts a Layup. Contested by Damian Ginobili (4.9 feet, MAN). ALLEN MARKKANEN MAKES IT!
Score: 12-12

[06:56] Team_099 possession (Score: 12-12)
Larry James attempts a 3Pt. Contested by Tracy Bryant (4.8 feet, MAN). LARRY JAMES MAKES IT! Assist: Larry Wade
Score: 12-15

[06:38] Team_018 possession (Score: 12-15)
Domantas Wall drives to the basket... Domantas Wall commits a violation (traveling/carry)! TURNOVER! (dead ball)

[06:22] Team_099 possession (Score: 12-15)
Larry Wade attempts a Layup. Contested by Domantas Wall (6.0 feet, ZONE). LARRY WADE MAKES IT! Assist: Damian Ginobili
Score: 12-17

[06:04] Team_018 possession (Score: 12-17)
Domantas Wall drives, picks up Larry Wade. Help arrives from Ayo Barrett! Domantas Wall attempts a Dunk. Contested by Ayo Barrett (5.0 feet, MAN). DOMANTAS WALL MAKES IT! Assist: Klay Stewart
Score: 14-17

[05:51] Team_099 possession (Score: 14-17)
Ayo Barrett makes the Layup and draws the foul on Klay Stewart! And-1! Ayo Barrett to the line for 1. [Team fouls: 1] (Klay Stewart: 1 personal fouls)   FT 1/1: GOOD Ayo Barrett makes 1/1 from the line.
Score: 14-20

[05:32] Team_018 possession (Score: 14-20)
Bones Anunoby attempts a Layup. Contested by Vince Lillard (4.5 feet, ZONE). BONES ANUNOBY MAKES IT! Assist: Allen Markkanen
Score: 16-20

[05:15] Team_099 possession (Score: 16-20)
FOUL! Offensive foul on Ayo Barrett! Klay Stewart drew the charge! [Team fouls: 2] (Ayo Barrett: 1 personal fouls) TURNOVER! (dead ball)

[04:59] Team_018 possession (Score: 16-20)
Tracy Bryant drives, Larry James stays with him. Tracy Bryant attempts a Layup. Wide open! Larry James is 6.8 feet away. [MAN] TRACY BRYANT MAKES IT! Assist: Domantas Wall
Score: 18-20

[04:41] Team_099 possession (Score: 18-20)
Larry James attempts a 3Pt. Wide open! Tracy Bryant is 8.7 feet away. [MAN] Larry James misses. Rebound secured by Allen Markkanen.

[04:26] Team_018 possession (Score: 18-20)
Klay Stewart attempts a Midrange. Contested by Larry James (4.1 feet, ZONE). Klay Stewart misses. Rebound secured by Vince Lillard.

[04:11] Team_099 possession (Score: 18-20)
Larry James attempts a Layup. BLOCKED BY DOMANTAS WALL! Ball is loose! Offensive rebound by Larry Wade! Larry Wade kicks it out.

[03:52] Team_099 possession (Score: 18-20)
Ayo Barrett attempts a 3Pt. Wide open! Klay Stewart is 6.8 feet away. [MAN] AYO BARRETT MAKES IT! Assist: Larry James
Score: 18-23

[03:37] Team_018 possession (Score: 18-23)
FOUL! Shooting foul on Larry James. Tracy Bryant to the line for 3 free throws. [Team fouls: 3] (Larry James: 1 personal fouls)   FT 1/3: GOOD   FT 2/3: GOOD   FT 3/3: GOOD Tracy Bryant makes 3/3 from the line.
Score: 21-23

[03:21] Team_099 possession (Score: 21-23)
Larry Wade makes the Layup and draws the foul on Domantas Wall! And-1! Larry Wade to the line for 1. [Team fouls: 2] (Domantas Wall: 1 personal fouls)   FT 1/1: GOOD Larry Wade makes 1/1 from the line.
Score: 21-26

[03:04] Team_018 possession (Score: 21-26)
Bones Anunoby attempts a Layup. Contested by Vince Lillard (3.2 feet, ZONE). BONES ANUNOBY MAKES IT! Assist: Tracy Bryant
Score: 23-26

[02:46] Team_099 possession (Score: 23-26)
FOUL! Reach-in foul on Bones Anunoby during the drive. [Team fouls: 3] No free throws, side out. (Bones Anunoby: 1 personal fouls)

[02:33] Team_099 possession (Score: 23-26)
Ayo Barrett attempts a 3Pt. Contested by Klay Stewart (4.1 feet, MAN). AYO BARRETT MAKES IT! Assist: Larry James
Score: 23-29

[02:22] Team_018 possession (Score: 23-29)
Domantas Wall attempts a Midrange. Heavily contested by Vince Lillard (1.2 feet, ZONE)! Domantas Wall misses. Rebound secured by Damian Ginobili.

[02:06] Team_099 possession (Score: 23-29)
FOUL! Reach-in foul on Allen Markkanen during the drive. [Team fouls: 4] No free throws, side out. (Allen Markkanen: 1 personal fouls)

[01:52] Team_099 possession (Score: 23-29)
Damian Ginobili attempts a 3Pt. Heavily contested by Allen Markkanen (0.8 feet, MAN)! Damian Ginobili misses. Rebound secured by Allen Markkanen.

[01:39] Team_018 possession (Score: 23-29)
Domantas Wall makes the Dunk and draws the foul on Ayo Barrett! And-1! Domantas Wall to the line for 1. [Team fouls: 4] (Ayo Barrett: 2 personal fouls)   FT 1/1: GOOD Domantas Wall makes 1/1 from the line.
Score: 26-29

[01:27] Team_099 possession (Score: 26-29)
Ayo Barrett attempts a 3Pt. Contested by Klay Stewart (4.6 feet, ZONE). Ayo Barrett misses. Rebound secured by Domantas Wall.

[01:12] Team_018 possession (Score: 26-29)
FOUL! Reach-in foul on Vince Lillard during the drive. [IN THE BONUS! 5 team fouls] Tracy Bryant to the line for 2 free throws. (Vince Lillard: 1 personal fouls)   FT 1/2: GOOD   FT 2/2: GOOD Tracy Bryant makes 2/2 from the line.
Score: 28-29

[00:59] Team_099 possession (Score: 28-29)
Larry James drives, Tracy Bryant stays with him. Larry James attempts a Layup. Contested by Tracy Bryant (3.0 feet, MAN). LARRY JAMES MAKES IT! Assist: Damian Ginobili
Score: 28-31

[00:44] Team_018 possession (Score: 28-31)
Klay Stewart drives, Vince Lillard stays with him. Klay Stewart attempts a Layup. Contested by Vince Lillard (4.0 feet, ZONE). KLAY STEWART MAKES IT!
Score: 30-31

[00:29] Team_099 possession (Score: 30-31)
Vince Lillard attempts a 3Pt. Contested by Tracy Bryant (5.2 feet, ZONE). Vince Lillard misses. Rebound secured by Domantas Wall.

[00:19] Team_018 possession (Score: 30-31)
Bones Anunoby attempts a Midrange. Heavily contested by Vince Lillard (0.9 feet, MAN)! Bones Anunoby misses. FOUL! Loose ball foul on Larry Wade during the rebound battle. [IN THE BONUS! 6 team fouls] Bones Anunoby to the line for 2 free throws. (Larry Wade: 2 personal fouls)   FT 1/2: GOOD   FT 2/2: GOOD Bones Anunoby makes 2/2 from the line.
Score: 32-31

[00:03] Team_099 possession (Score: 32-31)
Larry Wade attempts a 3Pt. Contested by Domantas Wall (3.6 feet, MAN). Larry Wade misses. Offensive rebound by Larry Wade! Larry Wade kicks it out.

================================================================================
                              1ST QUARTER COMPLETE                              
================================================================================

1ST QUARTER SCORE: Team_018 32, Team_099 31

BOX SCORE:
================================================================================

Team_018
--------------------------------------------------------------------------------
Player                MIN  PTS  REB  AST  TO      FG   FG%      3P   3P%
--------------------------------------------------------------------------------
Bones Anunoby          12    9    0    1   0   4/5    80.0     0/0   0.0
Domantas Wall          12    7    3    2   0   3/5    60.0     0/0   0.0
Tracy Bryant           12    7    0    1   0   3/3   100.0     0/0   0.0
Klay Stewart           12    5    0    3   0   2/3    66.7     0/0   0.0
Allen Markkanen        12    4    2    1   0   2/3    66.7     0/0   0.0

TEAM: FG: 14/19 (73.7%), 3PT: 2/2 (100.0%), REB: 5 (0 off, 5 def), AST: 8, TO: 3
TEAM FOULS: 4


Team_099
--------------------------------------------------------------------------------
Player                MIN  PTS  REB  AST  TO      FG   FG%      3P   3P%
--------------------------------------------------------------------------------
Ayo Barrett            12    9    0    1   0   3/4    75.0     0/0   0.0
Vince Lillard          12    8    2    1   0   3/6    50.0     0/0   0.0
Larry Wade             12    7    3    2   0   3/3   100.0     0/0   0.0
Larry James            12    7    0    2   0   3/4    75.0     0/0   0.0
Damian Ginobili        12    0    2    3   0   0/2     0.0     0/0   0.0

TEAM: FG: 12/19 (63.2%), 3PT: 5/10 (50.0%), REB: 7 (2 off, 5 def), AST: 9, TO: 2
TEAM FOULS: 6 [Team_018 in BONUS]

================================================================================

================================================================================
                       2ND QUARTER - Team_018 vs Team_099                       
================================================================================

[12:00] Team_018 possession (Score: 32-31)
Allen Markkanen attempts a 3Pt. Contested by Damian Ginobili (4.3 feet, MAN). Allen Markkanen misses. Offensive rebound by Bones Anunoby! Bones Anunoby kicks it out.

[11:48] Team_018 possession (Score: 32-31)
Bones Anunoby attempts a 3Pt. Contested by Ayo Barrett (2.6 feet, ZONE). Bones Anunoby misses. Rebound secured by Damian Ginobili.

[11:31] Team_099 possession (Score: 32-31)
Vince Lillard attempts a 3Pt. Wide open! Bones Anunoby is 7.1 feet away. [MAN] Vince Lillard misses. FOUL! Loose ball foul on Allen Markkanen during the rebound battle. [Team fouls: 1] No free throws, side out. (Allen Markkanen: 1 personal fouls)

[11:18] Team_099 possession (Score: 32-31)
Ayo Barrett drives to the basket... Ayo Barrett throws a bad pass out of bounds! TURNOVER! (dead ball)

[11:18] Substitution (Team_018): Klay Stewart OUT → Michael Simons IN (stamina_rule2)

[11:18] Substitution (Team_018): Tracy Bryant OUT → Miles Herro IN (stamina_rule2)

[11:18] Substitution (Team_018): Bones Anunoby OUT → Shai Wade IN (stamina_rule2)

[11:18] Substitution (Team_018): Domantas Wall OUT → Julius Jackson IN (stamina_rule2)

[11:18] Substitution (Team_099): Ayo Barrett OUT → CJ Cunningham IN (stamina_rule2)

[11:18] Substitution (Team_099): Larry James OUT → Manu Johnson IN (stamina_rule2)

[11:18] Substitution (Team_099): Damian Ginobili OUT → Scottie Quickley IN (stamina_rule2)

[11:18] Substitution (Team_099): Vince Lillard OUT → Donovan Green IN (stamina_rule2)

[11:18] Substitution (Team_099): Larry Wade OUT → Jarrett Fox IN (stamina_rule2)

[10:59] Team_018 possession (Score: 32-31)
Shai Wade attempts a Midrange. Contested by Donovan Green (3.1 feet, ZONE). SHAI WADE MAKES IT! Assist: Allen Markkanen
Score: 34-31

[10:43] Team_099 possession (Score: 34-31)
CJ Cunningham attempts a 3Pt. Heavily contested by Allen Markkanen (1.7 feet, ZONE)! CJ Cunningham misses. Rebound secured by Julius Jackson.

[10:33] Team_018 possession (Score: 34-31)
Julius Jackson drives and kicks out. Julius Jackson attempts a 3Pt. Contested by Jarrett Fox (2.2 feet, MAN). JULIUS JACKSON MAKES IT! Assist: Michael Simons
Score: 37-31

[10:16] Team_099 possession (Score: 37-31)
FOUL! Holding foul on Julius Jackson. [Team fouls: 2] No free throws, side out. (Julius Jackson: 1 personal fouls)

[10:00] Team_099 possession (Score: 37-31)
Donovan Green attempts a 3Pt. Contested by Allen Markkanen (3.8 feet, ZONE). DONOVAN GREEN MAKES IT!
Score: 37-34

[09:45] Team_018 possession (Score: 37-34)
Michael Simons attempts a Midrange. Wide open! Manu Johnson is 6.6 feet away. [ZONE] Michael Simons misses. Rebound secured by Jarrett Fox.

[09:30] Team_099 possession (Score: 37-34)
Scottie Quickley drives and kicks out. Scottie Quickley attempts a Midrange. Contested by Allen Markkanen (3.8 feet, MAN). Scottie Quickley misses. Rebound secured by Shai Wade.

[09:14] Team_018 possession (Score: 37-34)
Michael Simons attempts a Midrange. Contested by Jarrett Fox (5.8 feet, ZONE). Michael Simons misses. Rebound secured by Donovan Green.

[08:59] Team_099 possession (Score: 37-34)
FOUL! Holding foul on Miles Herro. [Team fouls: 3] No free throws, side out. (Miles Herro: 1 personal fouls)

[08:44] Team_099 possession (Score: 37-34)
Jarrett Fox drives and kicks out. Scottie Quickley attempts a 3Pt. Contested by Allen Markkanen (3.4 feet, MAN). Scottie Quickley misses. Rebound secured by Allen Markkanen.

[08:30] Team_018 possession (Score: 37-34)
Shai Wade loses the ball! Stripped by Donovan Green! TURNOVER! (live ball)

[08:17] Team_099 possession (Score: 37-34)
CJ Cunningham attempts a 3Pt. Heavily contested by Allen Markkanen (1.1 feet, ZONE)! CJ Cunningham misses. Rebound secured by Julius Jackson.

[08:04] Team_018 possession (Score: 37-34)
Julius Jackson drives and kicks out. Michael Simons attempts a 3Pt. Contested by CJ Cunningham (5.2 feet, MAN). Michael Simons misses. Offensive rebound by Julius Jackson! Julius Jackson kicks it out.

[07:48] Team_018 possession (Score: 37-34)
FOUL! Holding foul on CJ Cunningham. [Team fouls: 1] No free throws, side out. (CJ Cunningham: 1 personal fouls)

[07:32] Team_018 possession (Score: 37-34)
Shai Wade attempts a Layup. Contested by Jarrett Fox (3.0 feet, ZONE). SHAI WADE MAKES IT! Assist: Allen Markkanen
Score: 39-34

[07:16] Team_099 possession (Score: 39-34)
Jarrett Fox drives, picks up Julius Jackson. Help arrives from Miles Herro! Jarrett Fox attempts a Dunk. Wide open! Miles Herro is 6.3 feet away. [MAN] JARRETT FOX MAKES IT!
Score: 39-36

[07:02] Team_018 possession (Score: 39-36)
Julius Jackson attempts a Midrange. Heavily contested by Jarrett Fox (1.6 feet, MAN)! Julius Jackson misses. Rebound secured by Scottie Quickley.

[06:47] Team_099 possession (Score: 39-36)
Jarrett Fox makes the Layup and draws the foul on Julius Jackson! And-1! Jarrett Fox to the line for 1. [Team fouls: 4] (Julius Jackson: 2 personal fouls)   FT 1/1: GOOD Jarrett Fox makes 1/1 from the line.
Score: 39-39

[06:31] Team_018 possession (Score: 39-39)
FOUL! Shooting foul on CJ Cunningham. Michael Simons to the line for 2 free throws. [Team fouls: 2] (CJ Cunningham: 2 personal fouls)   FT 1/2: MISS   FT 2/2: GOOD Michael Simons makes 1/2 from the line.
Score: 40-39

[06:18] Team_099 possession (Score: 40-39)
Manu Johnson attempts a 3Pt. Wide open! Michael Simons is 8.5 feet away. [ZONE] Manu Johnson misses. Rebound secured by Julius Jackson.

[06:07] Team_018 possession (Score: 40-39)
Shai Wade attempts a Midrange. Contested by CJ Cunningham (3.2 feet, ZONE). Shai Wade misses. FOUL! Loose ball foul on Jarrett Fox during the rebound battle. [Team fouls: 3] No free throws, side out. (Jarrett Fox: 1 personal fouls)

[05:52] Team_018 possession (Score: 40-39)
Allen Markkanen attempts a 3Pt. Wide open! Manu Johnson is 7.3 feet away. [ZONE] Allen Markkanen misses. Offensive rebound by Julius Jackson! Julius Jackson kicks it out.

[05:41] Team_018 possession (Score: 40-39)
Allen Markkanen makes the Layup and draws the foul on Manu Johnson! And-1! Allen Markkanen to the line for 1. [Team fouls: 4] (Manu Johnson: 1 personal fouls)   FT 1/1: GOOD Allen Markkanen makes 1/1 from the line.
Score: 43-39

[05:26] Team_099 possession (Score: 43-39)
FOUL! Holding foul on Shai Wade. [IN THE BONUS! 5 team fouls] Donovan Green to the line for 2 free throws. (Shai Wade: 1 personal fouls)   FT 1/2: GOOD   FT 2/2: GOOD Donovan Green makes 2/2 from the line.
Score: 43-41

[05:11] Team_018 possession (Score: 43-41)
Miles Herro attempts a Layup. Contested by Donovan Green (4.2 feet, ZONE). Miles Herro misses. Rebound secured by Scottie Quickley.

[04:56] Team_099 possession (Score: 43-41)
FOUL! Shooting foul on Shai Wade. Donovan Green to the line for 2 free throws. [BONUS: 6 team fouls] (Shai Wade: 2 personal fouls)   FT 1/2: GOOD   FT 2/2: GOOD Donovan Green makes 2/2 from the line.
Score: 43-43

[04:41] Team_018 possession (Score: 43-43)
Allen Markkanen drives to the basket... Allen Markkanen throws a bad pass! Stolen by Jarrett Fox! TURNOVER! (live ball)

[04:21] Team_099 possession (Score: 43-43)
Manu Johnson attempts a 3Pt. Contested by Allen Markkanen (5.5 feet, ZONE). MANU JOHNSON MAKES IT! Assist: Donovan Green
Score: 43-46

[04:08] Team_018 possession (Score: 43-46)
Michael Simons attempts a 3Pt. Contested by Manu Johnson (3.3 feet, ZONE). Michael Simons misses. Rebound secured by Scottie Quickley.

[03:49] Team_099 possession (Score: 43-46)
Donovan Green attempts a 3Pt. Contested by Shai Wade (5.0 feet, MAN). Donovan Green misses. Rebound secured by Julius Jackson.

[03:31] Team_018 possession (Score: 43-46)
Miles Herro attempts a Midrange. Wide open! Manu Johnson is 6.3 feet away. [MAN] Miles Herro misses. Rebound secured by Donovan Green.

[03:17] Team_099 possession (Score: 43-46)
CJ Cunningham drives, picks up Michael Simons. Help arrives from Allen Markkanen! CJ Cunningham attempts a Dunk. Wide open! Allen Markkanen is 7.3 feet away. [MAN] CJ Cunningham misses. Offensive rebound by Donovan Green! Donovan Green kicks it out.

[03:06] Team_099 possession (Score: 43-46)
Jarrett Fox attempts a Layup. BLOCKED BY MILES HERRO! Ball is loose! Rebound secured by Julius Jackson.

[02:49] Team_018 possession (Score: 43-46)
Michael Simons attempts a Midrange. Wide open! CJ Cunningham is 7.1 feet away. [MAN] MICHAEL SIMONS MAKES IT!
Score: 45-46

[02:32] Team_099 possession (Score: 45-46)
Donovan Green attempts a 3Pt. Wide open! Michael Simons is 8.2 feet away. [ZONE] Donovan Green misses. Offensive rebound by Jarrett Fox! Jarrett Fox's putback is no good. Offensive rebound by Jarrett Fox! Jarrett Fox kicks it out.

[02:17] Team_099 possession (Score: 45-46)
Jarrett Fox drives, Julius Jackson stays with him. Jarrett Fox attempts a Dunk. Contested by Julius Jackson (5.5 feet, MAN). Jarrett Fox misses. Rebound secured by Allen Markkanen.

[02:01] Team_018 possession (Score: 45-46)
Allen Markkanen drives and kicks out. Julius Jackson attempts a 3Pt. Contested by Manu Johnson (5.2 feet, ZONE). Julius Jackson misses. Rebound secured by Scottie Quickley.

[01:47] Team_099 possession (Score: 45-46)
Scottie Quickley attempts a Layup. Wide open! Allen Markkanen is 6.3 feet away. [MAN] SCOTTIE QUICKLEY MAKES IT! Assist: CJ Cunningham
Score: 45-48

[01:35] Team_018 possession (Score: 45-48)
Miles Herro makes the Midrange and draws the foul on Manu Johnson! And-1! Miles Herro to the line for 1. [BONUS: 5 team fouls] (Manu Johnson: 2 personal fouls)   FT 1/1: GOOD Miles Herro makes 1/1 from the line.
Score: 48-48

[01:22] Team_099 possession (Score: 48-48)
Jarrett Fox attempts a Layup. Contested by Julius Jackson (5.7 feet, MAN). JARRETT FOX MAKES IT! Assist: Donovan Green
Score: 48-50

[01:12] Team_018 possession (Score: 48-50)
FOUL! Reach-in foul on CJ Cunningham during the drive. [IN THE BONUS! 6 team fouls] Michael Simons to the line for 2 free throws. (CJ Cunningham: 3 personal fouls)   FT 1/2: GOOD   FT 2/2: MISS Michael Simons makes 1/2 from the line. Rebound secured by Jarrett Fox.
Score: 49-50

[00:54] Team_099 possession (Score: 49-50)
Scottie Quickley attempts a 3Pt. Contested by Michael Simons (4.7 feet, ZONE). SCOTTIE QUICKLEY MAKES IT! Assist: CJ Cunningham
Score: 49-53

[00:40] Team_018 possession (Score: 49-53)
Shai Wade attempts a Layup. Contested by Jarrett Fox (4.4 feet, ZONE). Shai Wade misses. Rebound secured by Donovan Green.

[00:31] Team_099 possession (Score: 49-53)
Manu Johnson attempts a Layup. Wide open! Miles Herro is 6.4 feet away. [MAN] MANU JOHNSON MAKES IT!
Score: 49-55

[00:15] Team_018 possession (Score: 49-55)
Julius Jackson attempts a Midrange. Contested by CJ Cunningham (5.4 feet, ZONE). Julius Jackson misses. Offensive rebound by Julius Jackson! Julius Jackson kicks it out.

[00:01] Team_018 possession (Score: 49-55)
Julius Jackson drives, Jarrett Fox stays with him. Julius Jackson attempts a Layup. Wide open! Jarrett Fox is 8.9 feet away. [ZONE] JULIUS JACKSON MAKES IT! Assist: Shai Wade
Score: 51-55

================================================================================
                              2ND QUARTER COMPLETE                              
================================================================================

2ND QUARTER SCORE: Team_018 19, Team_099 24

BOX SCORE:
================================================================================

Team_018
--------------------------------------------------------------------------------
Player                MIN  PTS  REB  AST  TO      FG   FG%      3P   3P%
--------------------------------------------------------------------------------
Julius Jackson         11    5    8    0   0   2/3    66.7     0/0   0.0
Shai Wade              11    4    1    1   0   2/3    66.7     0/0   0.0
Allen Markkanen        24    3    3    2   0   1/2    50.0     0/0   0.0
Michael Simons         11    3    0    1   0   2/6    33.3     0/0   0.0
Miles Herro            11    3    0    0   0   1/3    33.3     0/0   0.0
Bones Anunoby          13    0    1    0   0   0/1     0.0     0/0   0.0

TEAM: FG: 8/18 (44.4%), 3PT: 0/2 (0.0%), REB: 13 (5 off, 8 def), AST: 4, TO: 2
TEAM FOULS: 6 [Team_099 in BONUS]


Team_099
--------------------------------------------------------------------------------
Player                MIN  PTS  REB  AST  TO      FG   FG%      3P   3P%
--------------------------------------------------------------------------------
Donovan Green          11    7    4    2   0   3/4    75.0     0/0   0.0
Jarrett Fox            11    7    3    0   0   3/6    50.0     0/0   0.0
Scottie Quickley       11    5    4    0   0   2/3    66.7     0/0   0.0
Manu Johnson           11    5    0    0   0   2/3    66.7     0/0   0.0
Damian Ginobili        13    0    1    0   0   0/0     0.0     0/0   0.0
Vince Lillard          13    0    1    0   0   0/0     0.0     0/0   0.0
CJ Cunningham          11    0    0    2   0   0/2     0.0     0/0   0.0

TEAM: FG: 10/18 (55.6%), 3PT: 3/7 (42.9%), REB: 13 (3 off, 10 def), AST: 4, TO: 1
TEAM FOULS: 6 [Team_018 in BONUS]

================================================================================

================================================================================
                       3RD QUARTER - Team_018 vs Team_099                       
================================================================================

[12:00] Team_018 possession (Score: 51-55)
Klay Stewart drives to the basket... FOUL! Offensive foul on Klay Stewart! Vince Lillard drew the charge! [Team fouls: 1] (Klay Stewart: 1 personal fouls) TURNOVER! (dead ball)

[11:41] Team_099 possession (Score: 51-55)
FOUL! Holding foul on Domantas Wall. [Team fouls: 2] No free throws, side out. (Domantas Wall: 1 personal fouls)

[11:22] Team_099 possession (Score: 51-55)
Larry James attempts a Layup. Wide open! Bones Anunoby is 6.4 feet away. [ZONE] LARRY JAMES MAKES IT! Assist: Larry Wade
Score: 51-57

[11:03] Team_018 possession (Score: 51-57)
Domantas Wall attempts a Layup. Contested by Larry Wade (4.6 feet, MAN). DOMANTAS WALL MAKES IT!
Score: 53-57

[10:50] Team_099 possession (Score: 53-57)
Damian Ginobili attempts a Layup. Contested by Allen Markkanen (4.5 feet, MAN). DAMIAN GINOBILI MAKES IT! Assist: Larry Wade
Score: 53-59

[10:38] Team_018 possession (Score: 53-59)
Tracy Bryant attempts a 3Pt. Contested by Ayo Barrett (4.9 feet, ZONE). Tracy Bryant misses. Rebound secured by Damian Ginobili.

[10:19] Team_099 possession (Score: 53-59)
Damian Ginobili attempts a 3Pt. Contested by Allen Markkanen (3.5 feet, ZONE). DAMIAN GINOBILI MAKES IT! Assist: Larry Wade
Score: 53-62

[10:05] Team_018 possession (Score: 53-62)
Bones Anunoby drives, Larry Wade stays with him. Bones Anunoby attempts a Dunk. Contested by Larry Wade (2.8 feet, ZONE). BONES ANUNOBY MAKES IT! Assist: Tracy Bryant
Score: 55-62

[09:49] Team_099 possession (Score: 55-62)
Vince Lillard attempts a Midrange. Contested by Tracy Bryant (2.6 feet, ZONE). VINCE LILLARD MAKES IT!
Score: 55-64

[09:37] Team_018 possession (Score: 55-64)
Klay Stewart drives, Ayo Barrett stays with him. Klay Stewart attempts a Dunk. Contested by Ayo Barrett (2.7 feet, MAN). KLAY STEWART MAKES IT! Assist: Allen Markkanen
Score: 57-64

[09:23] Team_099 possession (Score: 57-64)
Larry Wade drives, Domantas Wall stays with him. Larry Wade attempts a Layup. Contested by Domantas Wall (4.5 feet, MAN). Larry Wade misses. Rebound secured by Bones Anunoby.

[09:08] Team_018 possession (Score: 57-64)
Klay Stewart attempts a Midrange. Heavily contested by Damian Ginobili (1.8 feet, ZONE)! Klay Stewart misses. Rebound secured by Larry Wade.

[08:52] Team_099 possession (Score: 57-64)
Ayo Barrett attempts a Midrange. Contested by Klay Stewart (3.9 feet, MAN). Ayo Barrett misses. Rebound secured by Bones Anunoby.

[08:38] Team_018 possession (Score: 57-64)
FOUL! Offensive foul on Bones Anunoby! Vince Lillard drew the charge! [Team fouls: 3] (Bones Anunoby: 1 personal fouls) TURNOVER! (dead ball)

[08:27] Team_099 possession (Score: 57-64)
Ayo Barrett attempts a 3Pt. Contested by Klay Stewart (4.5 feet, ZONE). Ayo Barrett misses. Rebound secured by Bones Anunoby.

[08:17] Team_018 possession (Score: 57-64)
Bones Anunoby attempts a Midrange. Heavily contested by Vince Lillard (0.5 feet, MAN)! Bones Anunoby misses. Offensive rebound by Bones Anunoby! Bones Anunoby kicks it out.

[08:04] Team_018 possession (Score: 57-64)
Tracy Bryant drives to the basket... Tracy Bryant throws a bad pass! Stolen by Larry Wade! TURNOVER! (live ball)

[07:47] Team_099 possession (Score: 57-64)
Damian Ginobili attempts a 3Pt. Contested by Allen Markkanen (2.8 feet, MAN). Damian Ginobili misses. Rebound secured by Bones Anunoby.

[07:31] Team_018 possession (Score: 57-64)
FOUL! Shooting foul on Vince Lillard. Bones Anunoby to the line for 2 free throws. [Team fouls: 1] (Vince Lillard: 1 personal fouls)   FT 1/2: MISS   FT 2/2: GOOD Bones Anunoby makes 1/2 from the line.
Score: 58-64

[07:20] Team_099 possession (Score: 58-64)
Damian Ginobili drives and kicks out. Larry Wade attempts a 3Pt. Wide open! Domantas Wall is 6.0 feet away. [MAN] Larry Wade misses. FOUL! Loose ball foul on Bones Anunoby during the rebound battle. [Team fouls: 4] No free throws, side out. (Bones Anunoby: 2 personal fouls)

[07:06] Team_099 possession (Score: 58-64)
Vince Lillard attempts a Midrange. Contested by Bones Anunoby (3.1 feet, MAN). Vince Lillard misses. Rebound secured by Bones Anunoby.

[06:51] Team_018 possession (Score: 58-64)
Tracy Bryant attempts a 3Pt. Wide open! Larry James is 6.2 feet away. [MAN] Tracy Bryant misses. Rebound secured by Damian Ginobili.

[06:36] Team_099 possession (Score: 58-64)
Vince Lillard attempts a Midrange. Contested by Bones Anunoby (3.1 feet, MAN). VINCE LILLARD MAKES IT!
Score: 58-66

[06:22] Team_018 possession (Score: 58-66)
Tracy Bryant drives, picks up Larry James. Help arrives from Damian Ginobili! Tracy Bryant attempts a Dunk. Contested by Damian Ginobili (4.5 feet, MAN). TRACY BRYANT MAKES IT! Assist: Bones Anunoby
Score: 60-66

[06:09] Team_099 possession (Score: 60-66)
Larry Wade attempts a Layup. Heavily contested by Domantas Wall (0.6 feet, ZONE)! Larry Wade misses. Offensive rebound by Vince Lillard! Vince Lillard's putback is no good. Rebound secured by Domantas Wall.

[05:50] Team_018 possession (Score: 60-66)
Allen Markkanen attempts a 3Pt. Heavily contested by Vince Lillard (0.5 feet, ZONE)! Allen Markkanen misses. Rebound secured by Damian Ginobili.

[05:36] Team_099 possession (Score: 60-66)
Larry Wade drives, Domantas Wall stays with him. Larry Wade attempts a Dunk. Contested by Domantas Wall (4.0 feet, MAN). LARRY WADE MAKES IT! Assist: Damian Ginobili
Score: 60-68

[05:19] Team_018 possession (Score: 60-68)
Klay Stewart drives, picks up Vince Lillard. Help arrives from Ayo Barrett! Klay Stewart attempts a Dunk. Heavily contested by Ayo Barrett (1.0 feet, ZONE)! KLAY STEWART MAKES IT!
Score: 62-68

[05:02] Team_099 possession (Score: 62-68)
Damian Ginobili drives and kicks out. Larry Wade attempts a 3Pt. Contested by Klay Stewart (4.8 feet, ZONE). LARRY WADE MAKES IT! Assist: Vince Lillard
Score: 62-71

[04:46] Team_018 possession (Score: 62-71)
Bones Anunoby attempts a 3Pt. Heavily contested by Vince Lillard (1.3 feet, MAN)! BONES ANUNOBY MAKES IT! Assist: Domantas Wall
Score: 65-71

[04:35] Team_099 possession (Score: 65-71)
Damian Ginobili drives and kicks out. Larry Wade attempts a Midrange. Contested by Domantas Wall (3.1 feet, MAN). Larry Wade misses. FOUL! Loose ball foul on Domantas Wall during the rebound battle. [IN THE BONUS! 5 team fouls] Vince Lillard to the line for 2 free throws. (Domantas Wall: 2 personal fouls)   FT 1/2: GOOD   FT 2/2: GOOD Vince Lillard makes 2/2 from the line.
Score: 65-73

[04:26] Team_018 possession (Score: 65-73)
Tracy Bryant drives, picks up Larry James. Help arrives from Damian Ginobili! Tracy Bryant attempts a Dunk. Wide open! Damian Ginobili is 6.7 feet away. [MAN] Tracy Bryant misses. Rebound secured by Larry Wade.

[04:09] Team_099 possession (Score: 65-73)
Vince Lillard attempts a 3Pt. Contested by Klay Stewart (2.7 feet, ZONE). Vince Lillard misses. Offensive rebound by Larry Wade! Larry Wade kicks it out.

[03:54] Team_099 possession (Score: 65-73)
Larry Wade makes the Layup and draws the foul on Domantas Wall! And-1! Larry Wade to the line for 1. [BONUS: 6 team fouls] (Domantas Wall: 3 personal fouls)   FT 1/1: GOOD Larry Wade makes 1/1 from the line.
Score: 65-76

[03:38] Team_018 possession (Score: 65-76)
Domantas Wall attempts a Midrange. Contested by Vince Lillard (3.6 feet, ZONE). DOMANTAS WALL MAKES IT! Assist: Klay Stewart
Score: 67-76

[03:24] Team_099 possession (Score: 67-76)
Damian Ginobili throws a bad pass! Stolen by Allen Markkanen! TURNOVER! (live ball)

[03:07] Team_018 possession (Score: 67-76)
Bones Anunoby attempts a 3Pt. Wide open! Ayo Barrett is 6.4 feet away. [ZONE] BONES ANUNOBY MAKES IT! Assist: Klay Stewart
Score: 70-76

[02:53] Team_099 possession (Score: 70-76)
Damian Ginobili drives to the basket... Damian Ginobili loses control! Ball rolls out of bounds! TURNOVER! (dead ball)

[02:53] Substitution (Team_018): Domantas Wall OUT → Julius Jackson IN (stamina_rule2)

[02:37] Team_018 possession (Score: 70-76)
Allen Markkanen attempts a 3Pt. Contested by Damian Ginobili (4.0 feet, MAN). Allen Markkanen misses. Rebound secured by Damian Ginobili.

[02:24] Team_099 possession (Score: 70-76)
Larry Wade attempts a Layup. Contested by Bones Anunoby (4.6 feet, ZONE). LARRY WADE MAKES IT!
Score: 70-78

[02:11] Team_018 possession (Score: 70-78)
Allen Markkanen attempts a 3Pt. Contested by Ayo Barrett (4.6 feet, ZONE). ALLEN MARKKANEN MAKES IT! Assist: Bones Anunoby
Score: 73-78

[01:53] Team_099 possession (Score: 73-78)
Damian Ginobili drives, picks up Bones Anunoby. Help arrives from Klay Stewart! Damian Ginobili attempts a Dunk. Heavily contested by Klay Stewart (1.6 feet, ZONE)! DAMIAN GINOBILI MAKES IT!
Score: 73-80

[01:41] Team_018 possession (Score: 73-80)
Tracy Bryant attempts a 3Pt. Wide open! Ayo Barrett is 6.7 feet away. [ZONE] Tracy Bryant misses. Rebound secured by Larry Wade.

[01:31] Team_099 possession (Score: 73-80)
Larry James attempts a 3Pt. Contested by Tracy Bryant (3.4 feet, MAN). Larry James misses. Rebound secured by Allen Markkanen.

[01:14] Team_018 possession (Score: 73-80)
Julius Jackson drives and kicks out. Bones Anunoby attempts a Midrange. Contested by Larry Wade (3.9 feet, ZONE). BONES ANUNOBY MAKES IT! Assist: Allen Markkanen
Score: 75-80

[01:04] Team_099 possession (Score: 75-80)
Larry James attempts a 3Pt. Contested by Klay Stewart (2.3 feet, ZONE). LARRY JAMES MAKES IT! Assist: Larry Wade
Score: 75-83

[00:49] Team_018 possession (Score: 75-83)
Klay Stewart attempts a 3Pt. Wide open! Ayo Barrett is 6.3 feet away. [ZONE] KLAY STEWART MAKES IT! Assist: Tracy Bryant
Score: 78-83

[00:35] Team_099 possession (Score: 78-83)
Larry James attempts a 3Pt. Wide open! Klay Stewart is 6.2 feet away. [ZONE] Larry James misses. Rebound secured by Julius Jackson.

[00:26] Team_018 possession (Score: 78-83)
Klay Stewart attempts a 3Pt. Contested by Ayo Barrett (3.9 feet, MAN). Klay Stewart misses. Rebound secured by Vince Lillard.

[00:13] Team_099 possession (Score: 78-83)
Ayo Barrett drives, Klay Stewart stays with him. Ayo Barrett attempts a Dunk. Wide open! Klay Stewart is 6.2 feet away. [MAN] AYO BARRETT MAKES IT! Assist: Vince Lillard
Score: 78-85

================================================================================
                              3RD QUARTER COMPLETE                              
================================================================================

3RD QUARTER SCORE: Team_018 27, Team_099 30

BOX SCORE:
================================================================================

Team_018
--------------------------------------------------------------------------------
Player                MIN  PTS  REB  AST  TO      FG   FG%      3P   3P%
--------------------------------------------------------------------------------
Bones Anunoby          25   11    6    2   0   5/5   100.0     0/0   0.0
Klay Stewart           25    7    0    2   0   3/5    60.0     0/0   0.0
Domantas Wall          23    4    1    1   0   2/2   100.0     0/0   0.0
Allen Markkanen        36    3    1    2   0   1/3    33.3     0/0   0.0
Tracy Bryant           25    2    0    2   0   1/5    20.0     0/0   0.0
Julius Jackson         14    0    1    0   0   0/0     0.0     0/0   0.0

TEAM: FG: 12/20 (60.0%), 3PT: 4/10 (40.0%), REB: 8 (1 off, 7 def), AST: 9, TO: 3
TEAM FOULS: 6 [Team_099 in BONUS]


Team_099
--------------------------------------------------------------------------------
Player                MIN  PTS  REB  AST  TO      FG   FG%      3P   3P%
--------------------------------------------------------------------------------
Larry Wade             25   10    5    4   0   4/6    66.7     0/0   0.0
Damian Ginobili        25    7    4    1   0   3/4    75.0     0/0   0.0
Vince Lillard          25    6    1    2   0   3/4    75.0     0/0   0.0
Larry James            25    5    0    0   0   2/4    50.0     0/0   0.0
Ayo Barrett            25    2    0    0   0   1/3    33.3     0/0   0.0

TEAM: FG: 13/21 (61.9%), 3PT: 2/6 (33.3%), REB: 11 (3 off, 8 def), AST: 7, TO: 2
TEAM FOULS: 1

================================================================================

================================================================================
                       4TH QUARTER - Team_018 vs Team_099                       
================================================================================

[12:00] Team_018 possession (Score: 78-85)
Tracy Bryant attempts a Midrange. Contested by Vince Lillard (2.2 feet, ZONE). Tracy Bryant misses. Rebound secured by Vince Lillard.

[11:48] Team_099 possession (Score: 78-85)
Larry James drives and kicks out. Vince Lillard attempts a Midrange. Contested by Tracy Bryant (3.0 feet, ZONE). VINCE LILLARD MAKES IT! Assist: Damian Ginobili
Score: 78-87

[11:36] Team_018 possession (Score: 78-87)
Tracy Bryant attempts a 3Pt. Contested by Larry James (5.1 feet, MAN). TRACY BRYANT MAKES IT! Assist: Klay Stewart
Score: 81-87

[11:20] Team_099 possession (Score: 81-87)
Vince Lillard drives, Bones Anunoby stays with him. Vince Lillard attempts a Layup. Wide open! Bones Anunoby is 6.7 feet away. [MAN] VINCE LILLARD MAKES IT! Assist: Ayo Barrett
Score: 81-89

[11:03] Team_018 possession (Score: 81-89)
Allen Markkanen attempts a Midrange. Wide open! Larry James is 6.8 feet away. [ZONE] Allen Markkanen misses. Rebound secured by Vince Lillard.

[10:48] Team_099 possession (Score: 81-89)
FOUL! Holding foul on Klay Stewart. [Team fouls: 1] No free throws, side out. (Klay Stewart: 1 personal fouls)

[10:30] Team_099 possession (Score: 81-89)
Larry Wade attempts a Midrange. Contested by Domantas Wall (3.7 feet, MAN). Larry Wade misses. Rebound secured by Bones Anunoby.

[10:17] Team_018 possession (Score: 81-89)
Domantas Wall drives to the basket... Domantas Wall loses control! Ball rolls out of bounds! TURNOVER! (dead ball)

[10:17] Substitution (Team_018): Klay Stewart OUT → Michael Simons IN (stamina_rule2)

[10:17] Substitution (Team_018): Tracy Bryant OUT → Miles Herro IN (stamina_rule2)

[10:17] Substitution (Team_018): Allen Markkanen OUT → Austin Antetokounmpo IN (stamina_rule2)

[10:17] Substitution (Team_018): Bones Anunoby OUT → Shai Wade IN (stamina_rule2)

[10:17] Substitution (Team_099): Ayo Barrett OUT → CJ Cunningham IN (stamina_rule2)

[10:17] Substitution (Team_099): Larry James OUT → Manu Johnson IN (stamina_rule2)

[10:17] Substitution (Team_099): Damian Ginobili OUT → Scottie Quickley IN (stamina_rule2)

[10:17] Substitution (Team_099): Vince Lillard OUT → Donovan Green IN (stamina_rule2)

[10:17] Substitution (Team_099): Larry Wade OUT → Jarrett Fox IN (stamina_rule2)

[10:02] Team_099 possession (Score: 81-89)
FOUL! Shooting foul on Miles Herro. Donovan Green to the line for 2 free throws. [Team fouls: 2] (Miles Herro: 1 personal fouls)   FT 1/2: GOOD   FT 2/2: GOOD Donovan Green makes 2/2 from the line.
Score: 81-91

[09:46] Team_018 possession (Score: 81-91)
Miles Herro attempts a 3Pt. Contested by Manu Johnson (3.7 feet, ZONE). Miles Herro misses. Rebound secured by Donovan Green.

[09:33] Team_099 possession (Score: 81-91)
Donovan Green attempts a Midrange. BLOCKED BY SHAI WADE! Ball is loose! Rebound secured by Austin Antetokounmpo.

[09:17] Team_018 possession (Score: 81-91)
Shai Wade attempts a Layup. Contested by Jarrett Fox (4.9 feet, ZONE). Shai Wade misses. Rebound secured by Donovan Green.

[09:03] Team_099 possession (Score: 81-91)
Manu Johnson drives, Domantas Wall stays with him. Manu Johnson attempts a Dunk. Contested by Domantas Wall (3.7 feet, ZONE). MANU JOHNSON MAKES IT! Assist: CJ Cunningham
Score: 81-93

[08:51] Team_018 possession (Score: 81-93)
Domantas Wall attempts a Midrange. Heavily contested by Scottie Quickley (1.8 feet, ZONE)! Domantas Wall misses. Rebound secured by Donovan Green.

[08:32] Team_099 possession (Score: 81-93)
Scottie Quickley attempts a Midrange. Contested by Austin Antetokounmpo (3.8 feet, MAN). SCOTTIE QUICKLEY MAKES IT!
Score: 81-95

[08:17] Team_018 possession (Score: 81-95)
Miles Herro attempts a Midrange. Heavily contested by Scottie Quickley (1.7 feet, ZONE)! Miles Herro misses. Rebound secured by Donovan Green.

[08:03] Team_099 possession (Score: 81-95)
Jarrett Fox attempts a Layup. BLOCKED BY DOMANTAS WALL! Ball is loose! Rebound secured by Shai Wade.

[07:49] Team_018 possession (Score: 81-95)
Shai Wade drives and kicks out. Michael Simons attempts a 3Pt. Wide open! Scottie Quickley is 6.6 feet away. [ZONE] MICHAEL SIMONS MAKES IT! Assist: Domantas Wall
Score: 84-95

[07:39] Team_099 possession (Score: 84-95)
CJ Cunningham attempts a Layup. Wide open! Michael Simons is 6.4 feet away. [MAN] CJ CUNNINGHAM MAKES IT!
Score: 84-97

[07:28] Team_018 possession (Score: 84-97)
Miles Herro attempts a 3Pt. Contested by Donovan Green (3.4 feet, ZONE). MILES HERRO MAKES IT! Assist: Austin Antetokounmpo
Score: 87-97

[07:17] Team_099 possession (Score: 87-97)
CJ Cunningham attempts a 3Pt. Wide open! Michael Simons is 7.2 feet away. [MAN] CJ Cunningham misses. Offensive rebound by Jarrett Fox! Jarrett Fox's putback is no good. Offensive rebound by Donovan Green! Donovan Green kicks it out.

[07:06] Team_099 possession (Score: 87-97)
Scottie Quickley drives and kicks out. CJ Cunningham attempts a Midrange. Contested by Michael Simons (2.1 feet, MAN). CJ Cunningham misses. Rebound secured by Domantas Wall.

[06:49] Team_018 possession (Score: 87-97)
Michael Simons attempts a Midrange. Contested by CJ Cunningham (4.7 feet, MAN). MICHAEL SIMONS MAKES IT! Assist: Shai Wade
Score: 89-97

[06:33] Team_099 possession (Score: 89-97)
FOUL! Shooting foul on Austin Antetokounmpo. Scottie Quickley to the line for 2 free throws. [Team fouls: 3] (Austin Antetokounmpo: 1 personal fouls)   FT 1/2: GOOD   FT 2/2: GOOD Scottie Quickley makes 2/2 from the line.
Score: 89-99

[06:21] Team_018 possession (Score: 89-99)
Miles Herro drives and kicks out. Shai Wade attempts a 3Pt. Contested by Manu Johnson (3.3 feet, ZONE). SHAI WADE MAKES IT! Assist: Michael Simons
Score: 92-99

[06:06] Team_099 possession (Score: 92-99)
CJ Cunningham attempts a 3Pt. Heavily contested by Michael Simons (1.5 feet, MAN)! CJ CUNNINGHAM MAKES IT! Assist: Manu Johnson
Score: 92-102

[05:52] Team_018 possession (Score: 92-102)
Miles Herro attempts a 3Pt. Wide open! Manu Johnson is 10.0 feet away. [ZONE] MILES HERRO MAKES IT! Assist: Austin Antetokounmpo
Score: 95-102

[05:35] Team_099 possession (Score: 95-102)
FOUL! Shooting foul on Miles Herro. Manu Johnson to the line for 2 free throws. [Team fouls: 4] (Miles Herro: 2 personal fouls)   FT 1/2: GOOD   FT 2/2: GOOD Manu Johnson makes 2/2 from the line.
Score: 95-104

[05:18] Team_018 possession (Score: 95-104)
FOUL! Shooting foul on Jarrett Fox. Austin Antetokounmpo to the line for 2 free throws. [Team fouls: 1] (Jarrett Fox: 1 personal fouls)   FT 1/2: GOOD   FT 2/2: GOOD Austin Antetokounmpo makes 2/2 from the line.
Score: 97-104

[05:02] Team_099 possession (Score: 97-104)
CJ Cunningham drives, Domantas Wall stays with him. CJ Cunningham attempts a Dunk. Wide open! Domantas Wall is 9.5 feet away. [ZONE] CJ CUNNINGHAM MAKES IT!
Score: 97-106

[04:46] Team_018 possession (Score: 97-106)
Shai Wade drives, Donovan Green stays with him. Shai Wade attempts a Dunk. Wide open! Donovan Green is 7.1 feet away. [ZONE] Shai Wade misses. Rebound secured by Donovan Green.

[04:35] Team_099 possession (Score: 97-106)
CJ Cunningham attempts a 3Pt. Contested by Michael Simons (5.8 feet, MAN). CJ Cunningham misses. Rebound secured by Shai Wade.

[04:19] Team_018 possession (Score: 97-106)
Austin Antetokounmpo throws a bad pass! Stolen by Scottie Quickley! TURNOVER! (live ball)

[04:07] Team_099 possession (Score: 97-106)
Manu Johnson attempts a 3Pt. Wide open! Shai Wade is 9.7 feet away. [ZONE] Manu Johnson misses. Rebound secured by Shai Wade.

[03:53] Team_018 possession (Score: 97-106)
Michael Simons attempts a Midrange. Contested by Donovan Green (4.0 feet, ZONE). Michael Simons misses. Rebound secured by Jarrett Fox.

[03:38] Team_099 possession (Score: 97-106)
Scottie Quickley attempts a Midrange. Wide open! Austin Antetokounmpo is 6.1 feet away. [MAN] Scottie Quickley misses. Rebound secured by Shai Wade.

[03:24] Team_018 possession (Score: 97-106)
Domantas Wall attempts a Midrange. Contested by Jarrett Fox (4.3 feet, MAN). Domantas Wall misses. Rebound secured by Jarrett Fox.

[03:15] Team_099 possession (Score: 97-106)
Donovan Green attempts a 3Pt. Contested by Michael Simons (5.9 feet, ZONE). Donovan Green misses. Rebound secured by Austin Antetokounmpo.

[02:58] Team_018 possession (Score: 97-106)
Austin Antetokounmpo attempts a 3Pt. Wide open! Manu Johnson is 6.4 feet away. [ZONE] AUSTIN ANTETOKOUNMPO MAKES IT! Assist: Michael Simons
Score: 100-106

[02:41] Team_099 possession (Score: 100-106)
Manu Johnson attempts a Layup. Wide open! Shai Wade is 7.7 feet away. [ZONE] Manu Johnson misses. Rebound secured by Domantas Wall.

[02:27] Team_018 possession (Score: 100-106)
Shai Wade drives, Donovan Green stays with him. Shai Wade attempts a Dunk. Contested by Donovan Green (4.9 feet, MAN). Shai Wade misses. Rebound secured by Scottie Quickley.

[02:09] Team_099 possession (Score: 100-106)
FOUL! Holding foul on Miles Herro. [IN THE BONUS! 5 team fouls] Manu Johnson to the line for 2 free throws. (Miles Herro: 3 personal fouls)   FT 1/2: MISS   FT 2/2: MISS Manu Johnson makes 0/2 from the line. Rebound secured by Domantas Wall.

[01:57] Team_018 possession (Score: 100-106)
Shai Wade drives, picks up Donovan Green. Help arrives from Manu Johnson! Shai Wade attempts a Dunk. Contested by Manu Johnson (3.5 feet, MAN). SHAI WADE MAKES IT!
Score: 102-106

[01:47] Team_099 possession (Score: 102-106)
Donovan Green attempts a 3Pt. Contested by Shai Wade (4.6 feet, MAN). Donovan Green misses. Rebound secured by Austin Antetokounmpo.

[01:35] Team_018 possession (Score: 102-106)
Miles Herro drives, Manu Johnson stays with him. Miles Herro attempts a Dunk. Wide open! Manu Johnson is 6.7 feet away. [MAN] MILES HERRO MAKES IT!
Score: 104-106

[01:16] Team_099 possession (Score: 104-106)
Donovan Green attempts a Layup. Wide open! Shai Wade is 7.2 feet away. [MAN] DONOVAN GREEN MAKES IT!
Score: 104-108

[01:04] Team_018 possession (Score: 104-108)
Austin Antetokounmpo attempts a 3Pt. Heavily contested by Scottie Quickley (1.6 feet, MAN)! AUSTIN ANTETOKOUNMPO MAKES IT! Assist: Shai Wade
Score: 107-108

[00:49] Team_099 possession (Score: 107-108)
Donovan Green attempts a 3Pt. Contested by Shai Wade (5.7 feet, ZONE). DONOVAN GREEN MAKES IT! Assist: CJ Cunningham
Score: 107-111

[00:31] Team_018 possession (Score: 107-111)
Shai Wade attempts a Midrange. Contested by Donovan Green (4.7 feet, ZONE). Shai Wade misses. Offensive rebound by Austin Antetokounmpo! Austin Antetokounmpo kicks it out.

[00:15] Team_018 possession (Score: 107-111)
Austin Antetokounmpo drives to the basket... Austin Antetokounmpo throws a bad pass out of bounds! TURNOVER! (dead ball)

[00:15] Substitution (Team_018): Domantas Wall OUT → Julius Jackson IN (stamina_rule2)

[00:04] Team_099 possession (Score: 107-111)
Manu Johnson attempts a Layup. Contested by Miles Herro (3.0 feet, MAN). Manu Johnson misses. Rebound secured by Austin Antetokounmpo.

================================================================================
                              4TH QUARTER COMPLETE                              
================================================================================

4TH QUARTER SCORE: Team_018 29, Team_099 26

BOX SCORE:
================================================================================

Team_018
--------------------------------------------------------------------------------
Player                MIN  PTS  REB  AST  TO      FG   FG%      3P   3P%
--------------------------------------------------------------------------------
Miles Herro            21    8    0    0   0   3/5    60.0     0/0   0.0
Austin Antetokounmpo   10    8    5    2   0   3/3   100.0     0/0   0.0
Shai Wade              21    5    4    2   0   2/5    40.0     0/0   0.0
Michael Simons         21    5    0    2   0   2/3    66.7     0/0   0.0
Tracy Bryant           27    3    0    0   0   1/2    50.0     0/0   0.0
Klay Stewart           27    0    0    1   0   0/0     0.0     0/0   0.0
Allen Markkanen        38    0    0    0   0   0/1     0.0     0/0   0.0
Bones Anunoby          27    0    1    0   0   0/0     0.0     0/0   0.0
Domantas Wall          34    0    3    1   0   0/2     0.0     0/0   0.0

TEAM: FG: 11/21 (52.4%), 3PT: 5/6 (83.3%), REB: 13 (1 off, 12 def), AST: 8, TO: 3
TEAM FOULS: 5 [Team_099 in BONUS]


Team_099
--------------------------------------------------------------------------------
Player                MIN  PTS  REB  AST  TO      FG   FG%      3P   3P%
--------------------------------------------------------------------------------
Donovan Green          21    7    6    0   0   3/6    50.0     0/0   0.0
CJ Cunningham          21    7    0    2   0   3/4    75.0     0/0   0.0
Vince Lillard          27    4    2    0   0   2/2   100.0     0/0   0.0
Manu Johnson           21    4    0    1   0   2/5    40.0     0/0   0.0
Scottie Quickley       21    4    1    0   0   2/4    50.0     0/0   0.0
Damian Ginobili        27    0    0    1   0   0/0     0.0     0/0   0.0
Ayo Barrett            27    0    0    1   0   0/0     0.0     0/0   0.0
Larry Wade             27    0    0    0   0   0/1     0.0     0/0   0.0
Jarrett Fox            21    0    2    0   0   0/1     0.0     0/0   0.0

TEAM: FG: 12/24 (50.0%), 3PT: 2/6 (33.3%), REB: 11 (1 off, 10 def), AST: 5, TO: 0
TEAM FOULS: 1

================================================================================

================================================================================
                               FULL GAME COMPLETE                               
================================================================================

FINAL SCORE: Team_018 107, Team_099 111

SCORING BY QUARTER:
--------------------------------------------------------------------------------
Team                     Q1     Q2     Q3     Q4    FINAL
--------------------------------------------------------------------------------
Team_018                 32     19     27     29      107
Team_099                 31     24     30     26      111
--------------------------------------------------------------------------------

FULL GAME BOX SCORE:
================================================================================

Team_018
--------------------------------------------------------------------------------
Player                MIN  PTS  REB  AST  TO      FG   FG%      3P   3P%      FT STL BLK
--------------------------------------------------------------------------------
Allen Markkanen        38   10    6    5   2   5/10   50.0   1/3    33.3   1/1     1   0
Domantas Wall          34   11    7    4   1   5/9    55.6   0/0     0.0   1/1     1   2
Klay Stewart           27   12    0    6   1   4/7    57.1   1/2    50.0   0/0     0   2
Tracy Bryant           27   12    0    3   1   5/10   50.0   2/5    40.0   5/5     0   0
Bones Anunoby          27   20    8    3   3   8/10   80.0   3/4    75.0   3/4     0   0
Michael Simons         21    8    0    3   0   3/8    37.5   0/1     0.0   2/4     0   0
Miles Herro            21   11    0    0   0   5/9    55.6   2/3    66.7   1/1     0   1
Shai Wade              21    9    5    3   1   4/8    50.0   0/0     0.0   0/0     0   1
Julius Jackson         14    5    9    0   0   3/4    75.0   0/0     0.0   0/0     0   0
Austin Antetokounmpo   10    8    5    2   2   3/3   100.0   2/2   100.0   2/2     0   0

TEAM: FG: 45/78 (57.7%), 3PT: 11/20 (55.0%), REB: 39 (7 off, 32 def), AST: 29, TO: 11


Team_099
--------------------------------------------------------------------------------
Player                MIN  PTS  REB  AST  TO      FG   FG%      3P   3P%      FT STL BLK
--------------------------------------------------------------------------------
Ayo Barrett            27   11    0    2   2   4/7    57.1   2/4    50.0   1/1     0   0
Larry James            27   12    0    2   0   6/9    66.7   2/5    40.0   0/0     0   0
Damian Ginobili        27    7    7    5   2   5/8    62.5   1/3    33.3   0/0     0   0
Vince Lillard          27   18    6    3   0   6/10   60.0   2/4    50.0   2/2     0   0
Larry Wade             27   17    8    6   1   6/9    66.7   0/0     0.0   2/2     1   0
CJ Cunningham          21    7    0    4   0   3/6    50.0   1/4    25.0   0/0     0   0
Manu Johnson           21    9    0    1   0   4/8    50.0   1/3    33.3   2/4     0   0
Scottie Quickley       21    9    5    0   0   4/7    57.1   1/1   100.0   2/2     1   0
Donovan Green          21   14   10    2   0   5/9    55.6   2/5    40.0   6/6     1   0
Jarrett Fox            21    7    5    0   0   3/7    42.9   0/0     0.0   1/1     1   0

TEAM: FG: 47/82 (57.3%), 3PT: 12/29 (41.4%), REB: 42 (9 off, 33 def), AST: 25, TO: 5

================================================================================
