================================================================================
                        FULL GAME - Team_086 vs Team_089                        
================================================================================

================================================================================
                       1ST QUARTER - Team_086 vs Team_089                       
================================================================================

[12:00] Team_086 possession (Score: 0-0)
Rudy Rose attempts a Midrange. Contested by Terry Simmons (5.4 feet, MAN). RUDY ROSE MAKES IT!
Score: 2-0

[11:48] Team_089 possession (Score: 2-0)
Terry Simmons attempts a Layup. Wide open! Bones Ginobili is 9.2 feet away. [ZONE] TERRY SIMMONS MAKES IT!
Score: 2-2

[11:29] Team_086 possession (Score: 2-2)
Anfernee Harris drives and kicks out. Bones Ginobili attempts a Midrange. Wide open! Rudy Smith is 7.0 feet away. [MAN] Bones Ginobili misses. Rebound secured by Jalen Jackson.

[11:14] Team_089 possession (Score: 2-2)
Jordan Brogdon attempts a 3Pt. Contested by Lauri Johnson (4.2 feet, ZONE). Jordan Brogdon misses. Rebound secured by Bones Ginobili.

[11:00] Team_086 possession (Score: 2-2)
Bones Ginobili drives to the basket... Bones Ginobili commits a violation (traveling/carry)! TURNOVER! (dead ball)

[10:50] Team_089 possession (Score: 2-2)
Jalen Jackson drives and kicks out. Terry Simmons attempts a Midrange. Contested by Rudy Rose (2.9 feet, MAN). Terry Simmons misses. Rebound secured by Bones Ginobili.

[10:35] Team_086 possession (Score: 2-2)
FOUL! Shooting foul on Rudy Smith. Bones Ginobili to the line for 2 free throws. [Team fouls: 1] (Rudy Smith: 1 personal fouls)   FT 1/2: GOOD   FT 2/2: GOOD Bones Ginobili makes 2/2 from the line.
Score: 4-2

[10:22] Team_089 possession (Score: 4-2)
Rudy Smith attempts a 3Pt. Wide open! Bones Ginobili is 6.3 feet away. [MAN] RUDY SMITH MAKES IT! Assist: Allen Mobley
Score: 4-5

[10:07] Team_086 possession (Score: 4-5)
Miles Gobert attempts a 3Pt. Contested by Jordan Brogdon (3.7 feet, ZONE). Miles Gobert misses. Rebound secured by Rudy Smith.

[09:47] Team_089 possession (Score: 4-5)
Rudy Smith attempts a Layup. Contested by Bones Ginobili (4.3 feet, MAN). Rudy Smith misses. Rebound secured by Bones Ginobili.

[09:35] Team_086 possession (Score: 4-5)
Rudy Rose attempts a Midrange. Contested by Terry Simmons (4.4 feet, MAN). Rudy Rose misses. Rebound secured by Terry Simmons.

[09:17] Team_089 possession (Score: 4-5)
Jalen Jackson attempts a 3Pt. Wide open! Lauri Johnson is 8.1 feet away. [ZONE] Jalen Jackson misses. Offensive rebound by Terry Simmons! Terry Simmons's putback is no good. Rebound secured by Miles Gobert.

[09:06] Team_086 possession (Score: 4-5)
Bones Ginobili attempts a Midrange. Wide open! Rudy Smith is 9.6 feet away. [MAN] Bones Ginobili misses. Rebound secured by Jalen Jackson.

[08:48] Team_089 possession (Score: 4-5)
Allen Mobley drives and kicks out. Allen Mobley attempts a Midrange. Wide open! Miles Gobert is 7.3 feet away. [MAN] Allen Mobley misses. Rebound secured by Rudy Rose.

[08:38] Team_086 possession (Score: 4-5)
FOUL! Shooting foul on Allen Mobley. Lauri Johnson to the line for 2 free throws. [Team fouls: 2] (Allen Mobley: 1 personal fouls)   FT 1/2: GOOD   FT 2/2: GOOD Lauri Johnson makes 2/2 from the line.
Score: 6-5

[08:23] Team_089 possession (Score: 6-5)
Terry Simmons attempts a 3Pt. Contested by Lauri Johnson (4.0 feet, ZONE). Terry Simmons misses. Rebound secured by Miles Gobert.

[08:05] Team_086 possession (Score: 6-5)
Bones Ginobili drives to the basket... FOUL! Offensive foul on Bones Ginobili! Terry Simmons drew the charge! [Team fouls: 1] (Bones Ginobili: 1 personal fouls) TURNOVER! (dead ball)

[07:51] Team_089 possession (Score: 6-5)
Rudy Smith commits a violation (traveling/carry)! TURNOVER! (dead ball)

[07:34] Team_086 possession (Score: 6-5)
Anfernee Harris commits a violation (traveling/carry)! TURNOVER! (dead ball)

[07:19] Team_089 possession (Score: 6-5)
Jalen Jackson drives, Rudy Rose stays with him. Jalen Jackson attempts a Dunk. Wide open! Rudy Rose is 8.4 feet away. [ZONE] JALEN JACKSON MAKES IT!
Score: 6-7

[07:07] Team_086 possession (Score: 6-7)
Anfernee Harris drives and kicks out. Miles Gobert attempts a 3Pt. Contested by Rudy Smith (4.9 feet, ZONE). Miles Gobert misses. FOUL! Loose ball foul on Jalen Jackson during the rebound battle. [Team fouls: 3] No free throws, side out. (Jalen Jackson: 1 personal fouls)

[06:52] Team_086 possession (Score: 6-7)
Anfernee Harris attempts a 3Pt. Wide open! Jalen Jackson is 7.5 feet away. [ZONE] Anfernee Harris misses. Rebound secured by Rudy Smith.

[06:38] Team_089 possession (Score: 6-7)
Jalen Jackson makes the Layup and draws the foul on Anfernee Harris! And-1! Jalen Jackson to the line for 1. [Team fouls: 2] (Anfernee Harris: 1 personal fouls)   FT 1/1: GOOD Jalen Jackson makes 1/1 from the line.
Score: 6-10

[06:23] Team_086 possession (Score: 6-10)
Lauri Johnson drives, picks up Jordan Brogdon. Help arrives from Allen Mobley! Lauri Johnson attempts a Layup. Contested by Allen Mobley (3.4 feet, MAN). LAURI JOHNSON MAKES IT!
Score: 8-10

[06:07] Team_089 possession (Score: 8-10)
Jalen Jackson attempts a 3Pt. Contested by Anfernee Harris (2.1 feet, MAN). Jalen Jackson misses. Offensive rebound by Jalen Jackson! Jalen Jackson kicks it out.

[05:53] Team_089 possession (Score: 8-10)
Allen Mobley drives, picks up Bones Ginobili. Help arrives from Anfernee Harris! Allen Mobley attempts a Layup. Contested by Anfernee Harris (5.9 feet, ZONE). ALLEN MOBLEY MAKES IT! Assist: Terry Simmons
Score: 8-12

[05:37] Team_086 possession (Score: 8-12)
Anfernee Harris loses the ball! Stripped by Jalen Jackson! TURNOVER! (live ball)

[05:25] Team_089 possession (Score: 8-12)
Allen Mobley attempts a Layup. Contested by Miles Gobert (4.3 feet, MAN). ALLEN MOBLEY MAKES IT!
Score: 8-14

[05:10] Team_086 possession (Score: 8-14)
Miles Gobert attempts a 3Pt. Contested by Allen Mobley (4.8 feet, MAN). MILES GOBERT MAKES IT! Assist: Lauri Johnson
Score: 11-14

[04:53] Team_089 possession (Score: 11-14)
Allen Mobley attempts a 3Pt. Heavily contested by Miles Gobert (1.7 feet, MAN)! Allen Mobley misses. Offensive rebound by Terry Simmons! Terry Simmons's putback is no good. Offensive rebound by Terry Simmons! Terry Simmons kicks it out.

[04:40] Team_089 possession (Score: 11-14)
Allen Mobley makes the Layup and draws the foul on Rudy Rose! And-1! Allen Mobley to the line for 1. [Team fouls: 3] (Rudy Rose: 1 personal fouls)   FT 1/1: GOOD Allen Mobley makes 1/1 from the line.
Score: 11-17

[04:24] Team_086 possession (Score: 11-17)
Rudy Rose attempts a Midrange. Contested by Jalen Jackson (2.9 feet, ZONE). RUDY ROSE MAKES IT! Assist: Lauri Johnson
Score: 13-17

[04:11] Team_089 possession (Score: 13-17)
FOUL! Shooting foul on Bones Ginobili. Jordan Brogdon to the line for 2 free throws. [Team fouls: 4] (Bones Ginobili: 2 personal fouls)   FT 1/2: MISS   FT 2/2: GOOD Jordan Brogdon makes 1/2 from the line.
Score: 13-18

[03:57] Team_086 possession (Score: 13-18)
Miles Gobert attempts a Midrange. Contested by Allen Mobley (3.6 feet, MAN). MILES GOBERT MAKES IT! Assist: Bones Ginobili
Score: 15-18

[03:47] Team_089 possession (Score: 15-18)
Jordan Brogdon loses control! Ball rolls out of bounds! TURNOVER! (dead ball)

[03:35] Team_086 possession (Score: 15-18)
Rudy Rose attempts a 3Pt. Wide open! Terry Simmons is 6.7 feet away. [MAN] Rudy Rose misses. Rebound secured by Terry Simmons.

[03:20] Team_089 possession (Score: 15-18)
Jordan Brogdon attempts a Layup. Contested by Rudy Rose (4.6 feet, ZONE). JORDAN BROGDON MAKES IT! Assist: Rudy Smith
Score: 15-20

[03:04] Team_086 possession (Score: 15-20)
Bones Ginobili attempts a 3Pt. Contested by Jordan Brogdon (4.1 feet, ZONE). Bones Ginobili misses. Rebound secured by Rudy Smith.

[02:49] Team_089 possession (Score: 15-20)
FOUL! Reach-in foul on Miles Gobert during the drive. [IN THE BONUS! 5 team fouls] Allen Mobley to the line for 2 free throws. (Miles Gobert: 1 personal fouls)   FT 1/2: GOOD   FT 2/2: GOOD Allen Mobley makes 2/2 from the line.
Score: 15-22

[02:31] Team_086 possession (Score: 15-22)
FOUL! Shooting foul on Jalen Jackson. Miles Gobert to the line for 2 free throws. [Team fouls: 4] (Jalen Jackson: 2 personal fouls)   FT 1/2: GOOD   FT 2/2: GOOD Miles Gobert makes 2/2 from the line.
Score: 17-22

[02:12] Team_089 possession (Score: 17-22)
Allen Mobley attempts a 3Pt. Wide open! Lauri Johnson is 6.3 feet away. [ZONE] ALLEN MOBLEY MAKES IT! Assist: Terry Simmons
Score: 17-25

[01:56] Team_086 possession (Score: 17-25)
FOUL! Reach-in foul on Jordan Brogdon during the drive. [IN THE BONUS! 5 team fouls] Lauri Johnson to the line for 2 free throws. (Jordan Brogdon: 1 personal fouls)   FT 1/2: GOOD   FT 2/2: MISS Lauri Johnson makes 1/2 from the line. Offensive rebound by Miles Gobert! Miles Gobert kicks it out.
Score: 18-25

[01:44] Team_086 possession (Score: 18-25)
FOUL! Offensive foul on Miles Gobert! Allen Mobley drew the charge! [Team fouls: 6] (Miles Gobert: 2 personal fouls) TURNOVER! (dead ball)

[01:30] Team_089 possession (Score: 18-25)
FOUL! Reach-in foul on Miles Gobert during the drive. [IN THE BONUS! 7 team fouls] Allen Mobley to the line for 2 free throws. (Miles Gobert: 3 personal fouls)   FT 1/2: GOOD   FT 2/2: GOOD Allen Mobley makes 2/2 from the line.
Score: 18-27

[01:14] Team_086 possession (Score: 18-27)
Anfernee Harris attempts a 3Pt. Contested by Jalen Jackson (5.5 feet, ZONE). Anfernee Harris misses. Rebound secured by Terry Simmons.

[00:58] Team_089 possession (Score: 18-27)
Jordan Brogdon attempts a Midrange. Contested by Lauri Johnson (5.1 feet, MAN). JORDAN BROGDON MAKES IT!
Score: 18-29

[00:43] Team_086 possession (Score: 18-29)
Rudy Rose attempts a Midrange. Heavily contested by Allen Mobley (1.2 feet, ZONE)! Rudy Rose misses. Rebound secured by Rudy Smith.

[00:26] Team_089 possession (Score: 18-29)
Rudy Smith makes the Layup and draws the foul on Anfernee Harris! And-1! Rudy Smith to the line for 1. [BONUS: 8 team fouls] (Anfernee Harris: 2 personal fouls)   FT 1/1: GOOD Rudy Smith makes 1/1 from the line.
Score: 18-32

[00:15] Team_086 possession (Score: 18-32)
Anfernee Harris attempts a Layup. Wide open! Jalen Jackson is 7.6 feet away. [MAN] ANFERNEE HARRIS MAKES IT!
Score: 20-32

[00:04] Team_089 possession (Score: 20-32)
FOUL! Shooting foul on Lauri Johnson. Jordan Brogdon to the line for 3 free throws. [BONUS: 9 team fouls] (Lauri Johnson: 1 personal fouls)   FT 1/3: GOOD   FT 2/3: GOOD   FT 3/3: GOOD Jordan Brogdon makes 3/3 from the line.
Score: 20-35

================================================================================
                              1ST QUARTER COMPLETE                              
================================================================================

1ST QUARTER SCORE: Team_086 20, Team_089 35

BOX SCORE:
================================================================================

Team_086
--------------------------------------------------------------------------------
Player                MIN  PTS  REB  AST  TO      FG   FG%      3P   3P%
--------------------------------------------------------------------------------
Miles Gobert           12    7    3    0   0   3/4    75.0     0/0   0.0
Rudy Rose              12    4    2    0   0   2/5    40.0     0/0   0.0
Lauri Johnson          12    4    0    2   0   2/2   100.0     0/0   0.0
Anfernee Harris        12    2    0    0   0   1/4    25.0     0/0   0.0
Bones Ginobili         12    2    3    1   0   1/3    33.3     0/0   0.0

TEAM: FG: 9/18 (50.0%), 3PT: 1/6 (16.7%), REB: 7 (2 off, 5 def), AST: 3, TO: 5
TEAM FOULS: 9 [Team_089 in BONUS]


Team_089
--------------------------------------------------------------------------------
Player                MIN  PTS  REB  AST  TO      FG   FG%      3P   3P%
--------------------------------------------------------------------------------
Allen Mobley           12   14    0    1   0   6/7    85.7     0/0   0.0
Jordan Brogdon         12    8    0    0   0   4/5    80.0     0/0   0.0
Rudy Smith             12    6    4    1   0   2/3    66.7     0/0   0.0
Jalen Jackson          12    5    3    0   0   2/4    50.0     0/0   0.0
Terry Simmons          12    2    4    2   0   1/2    50.0     0/0   0.0

TEAM: FG: 15/21 (71.4%), 3PT: 3/6 (50.0%), REB: 12 (3 off, 9 def), AST: 4, TO: 2
TEAM FOULS: 5 [Team_086 in BONUS]

================================================================================

================================================================================
                       2ND QUARTER - Team_086 vs Team_089                       
================================================================================

[12:00] Team_086 possession (Score: 20-35)
FOUL! Shooting foul on Terry Simmons. Bones Ginobili to the line for 2 free throws. [Team fouls: 1] (Terry Simmons: 1 personal fouls)   FT 1/2: GOOD   FT 2/2: GOOD Bones Ginobili makes 2/2 from the line.
Score: 22-35

[11:46] Team_089 possession (Score: 22-35)
Jalen Jackson makes the Dunk and draws the foul on Rudy Rose! And-1! Jalen Jackson to the line for 1. [Team fouls: 1] (Rudy Rose: 1 personal fouls)   FT 1/1: GOOD Jalen Jackson makes 1/1 from the line.
Score: 22-38

[11:32] Team_086 possession (Score: 22-38)
Miles Gobert attempts a 3Pt. Contested by Allen Mobley (3.0 feet, MAN). MILES GOBERT MAKES IT! Assist: Lauri Johnson
Score: 25-38

[11:19] Team_089 possession (Score: 25-38)
Jalen Jackson drives, Anfernee Harris stays with him. Jalen Jackson attempts a Dunk. Contested by Anfernee Harris (5.5 feet, MAN). JALEN JACKSON MAKES IT!
Score: 25-40

[11:06] Team_086 possession (Score: 25-40)
Miles Gobert attempts a Midrange. Contested by Jalen Jackson (3.3 feet, ZONE). MILES GOBERT MAKES IT!
Score: 27-40

[10:48] Team_089 possession (Score: 27-40)
FOUL! Holding foul on Bones Ginobili. [Team fouls: 2] No free throws, side out. (Bones Ginobili: 1 personal fouls)

[10:30] Team_089 possession (Score: 27-40)
Terry Simmons drives and kicks out. Jalen Jackson attempts a 3Pt. Contested by Anfernee Harris (5.2 feet, MAN). JALEN JACKSON MAKES IT! Assist: Allen Mobley
Score: 27-43

[10:14] Team_086 possession (Score: 27-43)
FOUL! Shooting foul on Jordan Brogdon. Lauri Johnson to the line for 2 free throws. [Team fouls: 2] (Jordan Brogdon: 1 personal fouls)   FT 1/2: MISS   FT 2/2: MISS Lauri Johnson makes 0/2 from the line. Rebound secured by Terry Simmons.

[09:58] Team_089 possession (Score: 27-43)
Terry Simmons attempts a 3Pt. Wide open! Rudy Rose is 7.0 feet away. [MAN] Terry Simmons misses. Rebound secured by Bones Ginobili.

[09:43] Team_086 possession (Score: 27-43)
FOUL! Reach-in foul on Terry Simmons during the drive. [Team fouls: 3] No free throws, side out. (Terry Simmons: 2 personal fouls)

[09:32] Team_086 possession (Score: 27-43)
Miles Gobert attempts a Layup. BLOCKED BY TERRY SIMMONS! Ball is loose! Rebound secured by Rudy Smith.

[09:18] Team_089 possession (Score: 27-43)
Jordan Brogdon attempts a Midrange. Contested by Lauri Johnson (4.8 feet, MAN). Jordan Brogdon misses. Offensive rebound by Terry Simmons! Terry Simmons kicks it out.

[09:03] Team_089 possession (Score: 27-43)
Jalen Jackson drives and kicks out. Jordan Brogdon attempts a Midrange. Wide open! Lauri Johnson is 6.4 feet away. [ZONE] Jordan Brogdon misses. Rebound secured by Miles Gobert.

[08:46] Team_086 possession (Score: 27-43)
Rudy Rose loses control! Ball rolls out of bounds! TURNOVER! (dead ball)

[08:46] Substitution (Team_086): Lauri Johnson OUT → Anfernee Green IN (stamina_rule2)

[08:46] Substitution (Team_086): Anfernee Harris OUT → Anthony James IN (stamina_rule2)

[08:46] Substitution (Team_086): Miles Gobert OUT → Franz McGrady IN (stamina_rule2)

[08:46] Substitution (Team_086): Bones Ginobili OUT → Kyle McCollum IN (stamina_rule2)

[08:46] Substitution (Team_086): Rudy Rose OUT → Lamelo Towns IN (stamina_rule2)

[08:46] Substitution (Team_089): Jordan Brogdon OUT → Tony Parker IN (stamina_rule2)

[08:46] Substitution (Team_089): Jalen Jackson OUT → Joel Barnes IN (stamina_rule2)

[08:46] Substitution (Team_089): Allen Mobley OUT → Pascal Durant IN (stamina_rule2)

[08:46] Substitution (Team_089): Rudy Smith OUT → Devin Haliburton IN (stamina_rule2)

[08:46] Substitution (Team_089): Terry Simmons OUT → Evan Gasol IN (stamina_rule2)

[08:32] Team_089 possession (Score: 27-43)
Joel Barnes attempts a 3Pt. Contested by Anfernee Green (4.0 feet, ZONE). Joel Barnes misses. Rebound secured by Lamelo Towns.

[08:16] Team_086 possession (Score: 27-43)
Anfernee Green attempts a 3Pt. Wide open! Pascal Durant is 6.0 feet away. [ZONE] Anfernee Green misses. Rebound secured by Evan Gasol.

[08:00] Team_089 possession (Score: 27-43)
Evan Gasol drives, picks up Lamelo Towns. Help arrives from Anfernee Green! Evan Gasol attempts a Layup. Contested by Anfernee Green (5.5 feet, MAN). EVAN GASOL MAKES IT!
Score: 27-45

[07:43] Team_086 possession (Score: 27-45)
FOUL! Reach-in foul on Devin Haliburton during the drive. [Team fouls: 4] No free throws, side out. (Devin Haliburton: 1 personal fouls)

[07:30] Team_086 possession (Score: 27-45)
Kyle McCollum drives and kicks out. Anthony James attempts a 3Pt. Contested by Joel Barnes (5.8 feet, ZONE). Anthony James misses. Offensive rebound by Lamelo Towns! Lamelo Towns kicks it out.

[07:15] Team_086 possession (Score: 27-45)
Kyle McCollum attempts a Midrange. Contested by Devin Haliburton (6.0 feet, MAN). KYLE MCCOLLUM MAKES IT!
Score: 29-45

[07:00] Team_089 possession (Score: 29-45)
FOUL! Shooting foul on Kyle McCollum. Devin Haliburton to the line for 2 free throws. [Team fouls: 3] (Kyle McCollum: 1 personal fouls)   FT 1/2: GOOD   FT 2/2: MISS Devin Haliburton makes 1/2 from the line. Offensive rebound by Devin Haliburton! Devin Haliburton kicks it out.
Score: 29-46

[06:45] Team_089 possession (Score: 29-46)
Pascal Durant attempts a 3Pt. Contested by Anfernee Green (3.9 feet, ZONE). PASCAL DURANT MAKES IT! Assist: Joel Barnes
Score: 29-49

[06:30] Team_086 possession (Score: 29-49)
FOUL! Reach-in foul on Devin Haliburton during the drive. [IN THE BONUS! 5 team fouls] Anfernee Green to the line for 2 free throws. (Devin Haliburton: 2 personal fouls)   FT 1/2: GOOD   FT 2/2: GOOD Anfernee Green makes 2/2 from the line.
Score: 31-49

[06:15] Team_089 possession (Score: 31-49)
Devin Haliburton attempts a Midrange. Contested by Kyle McCollum (4.5 feet, MAN). DEVIN HALIBURTON MAKES IT! Assist: Tony Parker
Score: 31-51

[05:59] Team_086 possession (Score: 31-51)
FOUL! Shooting foul on Evan Gasol. Lamelo Towns to the line for 2 free throws. [BONUS: 6 team fouls] (Evan Gasol: 1 personal fouls)   FT 1/2: GOOD   FT 2/2: MISS Lamelo Towns makes 1/2 from the line. Rebound secured by Evan Gasol.
Score: 32-51

[05:42] Team_089 possession (Score: 32-51)
Joel Barnes throws a bad pass! Stolen by Anthony James! TURNOVER! (live ball)

[05:29] Team_086 possession (Score: 32-51)
Anthony James makes the Layup and draws the foul on Tony Parker! And-1! Anthony James to the line for 1. [BONUS: 7 team fouls] (Tony Parker: 1 personal fouls)   FT 1/1: GOOD Anthony James makes 1/1 from the line.
Score: 35-51

[05:17] Team_089 possession (Score: 35-51)
Pascal Durant attempts a 3Pt. Contested by Franz McGrady (3.1 feet, MAN). Pascal Durant misses. Rebound secured by Anfernee Green.

[05:03] Team_086 possession (Score: 35-51)
FOUL! Shooting foul on Tony Parker. Anfernee Green to the line for 3 free throws. [BONUS: 8 team fouls] (Tony Parker: 2 personal fouls)   FT 1/3: MISS   FT 2/3: GOOD   FT 3/3: MISS Anfernee Green makes 1/3 from the line. Rebound secured by Devin Haliburton.
Score: 36-51

[04:44] Team_089 possession (Score: 36-51)
Evan Gasol attempts a Midrange. Contested by Franz McGrady (3.7 feet, ZONE). EVAN GASOL MAKES IT! Assist: Pascal Durant
Score: 36-53

[04:29] Team_086 possession (Score: 36-53)
Anfernee Green attempts a 3Pt. Contested by Pascal Durant (2.1 feet, ZONE). Anfernee Green misses. Rebound secured by Evan Gasol.

[04:16] Team_089 possession (Score: 36-53)
Pascal Durant makes the Layup and draws the foul on Franz McGrady! And-1! Pascal Durant to the line for 1. [Team fouls: 4] (Franz McGrady: 1 personal fouls)   FT 1/1: MISS Pascal Durant makes 0/1 from the line. Rebound secured by Lamelo Towns.
Score: 36-55

[04:01] Team_086 possession (Score: 36-55)
Lamelo Towns drives, Evan Gasol stays with him. Lamelo Towns attempts a Dunk. Contested by Evan Gasol (5.6 feet, MAN). LAMELO TOWNS MAKES IT! Assist: Franz McGrady
Score: 38-55

[03:46] Team_089 possession (Score: 38-55)
Evan Gasol attempts a Layup. Wide open! Lamelo Towns is 7.1 feet away. [ZONE] Evan Gasol misses. Rebound secured by Kyle McCollum.

[03:31] Team_086 possession (Score: 38-55)
Kyle McCollum attempts a Midrange. Contested by Devin Haliburton (4.3 feet, MAN). Kyle McCollum misses. Offensive rebound by Anfernee Green! Anfernee Green kicks it out.

[03:16] Team_086 possession (Score: 38-55)
Anthony James throws a bad pass out of bounds! TURNOVER! (dead ball)

[03:05] Team_089 possession (Score: 38-55)
Pascal Durant attempts a Midrange. Contested by Franz McGrady (4.1 feet, MAN). Pascal Durant misses. FOUL! Loose ball foul on Lamelo Towns during the rebound battle. [IN THE BONUS! 5 team fouls] Evan Gasol to the line for 2 free throws. (Lamelo Towns: 1 personal fouls)   FT 1/2: GOOD   FT 2/2: GOOD Evan Gasol makes 2/2 from the line.
Score: 38-57

[02:51] Team_086 possession (Score: 38-57)
Lamelo Towns drives, picks up Evan Gasol. Help arrives from Tony Parker! Lamelo Towns attempts a Dunk. Contested by Tony Parker (5.4 feet, MAN). LAMELO TOWNS MAKES IT! Assist: Anfernee Green
Score: 40-57

[02:38] Team_089 possession (Score: 40-57)
Evan Gasol attempts a 3Pt. Heavily contested by Anthony James (0.5 feet, ZONE)! Evan Gasol misses. Rebound secured by Anfernee Green.

[02:24] Team_086 possession (Score: 40-57)
Franz McGrady attempts a 3Pt. Contested by Pascal Durant (4.3 feet, ZONE). Franz McGrady misses. Rebound secured by Devin Haliburton.

[02:13] Team_089 possession (Score: 40-57)
Devin Haliburton drives, Kyle McCollum stays with him. Devin Haliburton attempts a Dunk. Wide open! Kyle McCollum is 7.8 feet away. [MAN] Devin Haliburton misses. Rebound secured by Kyle McCollum.

[02:00] Team_086 possession (Score: 40-57)
Lamelo Towns drives and kicks out. Franz McGrady attempts a 3Pt. Contested by Pascal Durant (2.2 feet, ZONE). Franz McGrady misses. Offensive rebound by Lamelo Towns! Lamelo Towns kicks it out.

[01:43] Team_086 possession (Score: 40-57)
Franz McGrady attempts a Layup. Wide open! Pascal Durant is 6.5 feet away. [MAN] FRANZ MCGRADY MAKES IT! Assist: Anfernee Green
Score: 42-57

[01:25] Team_089 possession (Score: 42-57)
Pascal Durant attempts a 3Pt. Contested by Franz McGrady (3.8 feet, MAN). Pascal Durant misses. FOUL! Loose ball foul on Anfernee Green during the rebound battle. [IN THE BONUS! 6 team fouls] Devin Haliburton to the line for 2 free throws. (Anfernee Green: 1 personal fouls)   FT 1/2: MISS   FT 2/2: GOOD Devin Haliburton makes 1/2 from the line.
Score: 42-58

[01:08] Team_086 possession (Score: 42-58)
Franz McGrady attempts a Layup. BLOCKED BY PASCAL DURANT! Ball deflects out of bounds off Franz McGrady.

[00:51] Team_089 possession (Score: 42-58)
Evan Gasol drives and kicks out. Tony Parker attempts a 3Pt. Contested by Anthony James (5.5 feet, ZONE). TONY PARKER MAKES IT! Assist: Pascal Durant
Score: 42-61

[00:33] Team_086 possession (Score: 42-61)
Anfernee Green makes the Midrange and draws the foul on Joel Barnes! And-1! Anfernee Green to the line for 1. [BONUS: 9 team fouls] (Joel Barnes: 1 personal fouls)   FT 1/1: MISS Anfernee Green makes 0/1 from the line. Rebound secured by Evan Gasol.
Score: 44-61

[00:21] Team_089 possession (Score: 44-61)
FOUL! Reach-in foul on Anthony James during the drive. [IN THE BONUS! 7 team fouls] Joel Barnes to the line for 2 free throws. (Anthony James: 1 personal fouls)   FT 1/2: MISS   FT 2/2: GOOD Joel Barnes makes 1/2 from the line.
Score: 44-62

[00:09] Team_086 possession (Score: 44-62)
Lamelo Towns attempts a Midrange. Contested by Evan Gasol (3.3 feet, MAN). Lamelo Towns misses. Rebound secured by Evan Gasol.

================================================================================
                              2ND QUARTER COMPLETE                              
================================================================================

2ND QUARTER SCORE: Team_086 24, Team_089 27

BOX SCORE:
================================================================================

Team_086
--------------------------------------------------------------------------------
Player                MIN  PTS  REB  AST  TO      FG   FG%      3P   3P%
--------------------------------------------------------------------------------
Miles Gobert           16    5    1    0   0   2/3    66.7     0/0   0.0
Lamelo Towns            9    4    4    0   0   2/4    50.0     0/0   0.0
Anthony James           9    3    0    0   0   1/1   100.0     0/0   0.0
Bones Ginobili         16    2    1    0   0   1/1   100.0     0/0   0.0
Anfernee Green          9    2    3    2   0   1/5    20.0     0/0   0.0
Kyle McCollum           9    2    2    0   0   1/1   100.0     0/0   0.0
Franz McGrady           9    2    0    1   0   1/3    33.3     0/0   0.0
Lauri Johnson          16    0    0    1   0   0/1     0.0     0/0   0.0

TEAM: FG: 9/19 (47.4%), 3PT: 1/5 (20.0%), REB: 11 (3 off, 8 def), AST: 4, TO: 2
TEAM FOULS: 7 [Team_089 in BONUS]


Team_089
--------------------------------------------------------------------------------
Player                MIN  PTS  REB  AST  TO      FG   FG%      3P   3P%
--------------------------------------------------------------------------------
Jalen Jackson          16    8    0    0   0   3/4    75.0     0/0   0.0
Evan Gasol              9    6    5    0   0   3/5    60.0     0/0   0.0
Devin Haliburton        9    3    3    0   0   2/3    66.7     0/0   0.0
Pascal Durant           9    3    0    2   0   1/3    33.3     0/0   0.0
Tony Parker             9    3    0    1   0   1/1   100.0     0/0   0.0
Joel Barnes             9    1    0    1   0   1/2    50.0     0/0   0.0
Allen Mobley           16    0    0    1   0   0/0     0.0     0/0   0.0
Terry Simmons          16    0    2    0   0   0/1     0.0     0/0   0.0
Rudy Smith             16    0    1    0   0   0/0     0.0     0/0   0.0

TEAM: FG: 11/19 (57.9%), 3PT: 2/6 (33.3%), REB: 11 (2 off, 9 def), AST: 5, TO: 1
TEAM FOULS: 9 [Team_086 in BONUS]

================================================================================

================================================================================
                       3RD QUARTER - Team_086 vs Team_089                       
================================================================================

[12:00] Team_086 possession (Score: 44-62)
Anfernee Harris loses control! Ball rolls out of bounds! TURNOVER! (dead ball)

[11:44] Team_089 possession (Score: 44-62)
FOUL! Reach-in foul on Anfernee Harris during the drive. [Team fouls: 1] No free throws, side out. (Anfernee Harris: 1 personal fouls)

[11:33] Team_089 possession (Score: 44-62)
FOUL! Reach-in foul on Anfernee Harris during the drive. [Team fouls: 2] No free throws, side out. (Anfernee Harris: 2 personal fouls)

[11:19] Team_089 possession (Score: 44-62)
Terry Simmons drives to the basket... Terry Simmons commits a violation (traveling/carry)! TURNOVER! (dead ball)

[11:07] Team_086 possession (Score: 44-62)
FOUL! Reach-in foul on Terry Simmons during the drive. [Team fouls: 1] No free throws, side out. (Terry Simmons: 1 personal fouls)

[10:52] Team_086 possession (Score: 44-62)
Anfernee Harris attempts a 3Pt. Contested by Jordan Brogdon (4.9 feet, ZONE). ANFERNEE HARRIS MAKES IT! Assist: Lauri Johnson
Score: 47-62

[10:37] Team_089 possession (Score: 47-62)
FOUL! Shooting foul on Anfernee Harris. Terry Simmons to the line for 2 free throws. [Team fouls: 3] (Anfernee Harris: 3 personal fouls)   FT 1/2: GOOD   FT 2/2: GOOD Terry Simmons makes 2/2 from the line.
Score: 47-64

[10:20] Team_086 possession (Score: 47-64)
Lauri Johnson drives and kicks out. Anfernee Harris attempts a 3Pt. Contested by Jalen Jackson (2.6 feet, MAN). Anfernee Harris misses. Rebound secured by Rudy Smith.

[10:02] Team_089 possession (Score: 47-64)
FOUL! Reach-in foul on Miles Gobert during the drive. [Team fouls: 4] No free throws, side out. (Miles Gobert: 1 personal fouls)

[09:52] Team_089 possession (Score: 47-64)
Terry Simmons attempts a 3Pt. Contested by Lauri Johnson (4.0 feet, ZONE). Terry Simmons misses. Rebound secured by Rudy Rose.

[09:34] Team_086 possession (Score: 47-64)
Rudy Rose drives, picks up Terry Simmons. Help arrives from Jalen Jackson! Rudy Rose attempts a Layup. Contested by Jalen Jackson (4.0 feet, MAN). RUDY ROSE MAKES IT! Assist: Bones Ginobili
Score: 49-64

[09:22] Team_089 possession (Score: 49-64)
Jalen Jackson attempts a 3Pt. Contested by Lauri Johnson (3.4 feet, ZONE). JALEN JACKSON MAKES IT! Assist: Terry Simmons
Score: 49-67

[09:13] Team_086 possession (Score: 49-67)
Lauri Johnson attempts a Midrange. Contested by Allen Mobley (4.8 feet, ZONE). Lauri Johnson misses. Rebound secured by Rudy Smith.

[09:03] Team_089 possession (Score: 49-67)
Jordan Brogdon drives, picks up Rudy Rose. Help arrives from Anfernee Harris! Jordan Brogdon attempts a Layup. Contested by Anfernee Harris (3.9 feet, ZONE). Jordan Brogdon misses. Rebound secured by Bones Ginobili.

[08:50] Team_086 possession (Score: 49-67)
Lauri Johnson attempts a 3Pt. Contested by Jordan Brogdon (3.5 feet, ZONE). Lauri Johnson misses. Offensive rebound by Rudy Rose! Rudy Rose's putback is no good. Rebound secured by Jalen Jackson.

[08:39] Team_089 possession (Score: 49-67)
Rudy Smith attempts a 3Pt. Wide open! Bones Ginobili is 6.2 feet away. [MAN] RUDY SMITH MAKES IT!
Score: 49-70

[08:28] Team_086 possession (Score: 49-70)
Lauri Johnson attempts a 3Pt. Contested by Jordan Brogdon (3.8 feet, MAN). Lauri Johnson misses. Offensive rebound by Miles Gobert! Miles Gobert kicks it out.

[08:15] Team_086 possession (Score: 49-70)
Miles Gobert loses control! Ball rolls out of bounds! TURNOVER! (dead ball)

[08:03] Team_089 possession (Score: 49-70)
Terry Simmons attempts a Midrange. Contested by Miles Gobert (3.7 feet, ZONE). TERRY SIMMONS MAKES IT!
Score: 49-72

[07:50] Team_086 possession (Score: 49-72)
Lauri Johnson attempts a 3Pt. Contested by Jordan Brogdon (2.5 feet, ZONE). Lauri Johnson misses. Rebound secured by Terry Simmons.

[07:35] Team_089 possession (Score: 49-72)
Rudy Smith drives and kicks out. Jalen Jackson attempts a Midrange. Contested by Anfernee Harris (5.3 feet, ZONE). Jalen Jackson misses. Rebound secured by Bones Ginobili.

[07:18] Team_086 possession (Score: 49-72)
Rudy Rose makes the Midrange and draws the foul on Terry Simmons! And-1! Rudy Rose to the line for 1. [Team fouls: 2] (Terry Simmons: 2 personal fouls)   FT 1/1: GOOD Rudy Rose makes 1/1 from the line.
Score: 52-72

[07:00] Team_089 possession (Score: 52-72)
Jordan Brogdon attempts a 3Pt. Contested by Lauri Johnson (3.1 feet, MAN). Jordan Brogdon misses. Offensive rebound by Terry Simmons! Terry Simmons's putback is no good. Rebound secured by Miles Gobert.

[06:47] Team_086 possession (Score: 52-72)
Lauri Johnson attempts a 3Pt. Wide open! Jordan Brogdon is 7.2 feet away. [ZONE] Lauri Johnson misses. Rebound secured by Terry Simmons.

[06:31] Team_089 possession (Score: 52-72)
Jalen Jackson attempts a 3Pt. Wide open! Lauri Johnson is 7.4 feet away. [ZONE] Jalen Jackson misses. Rebound secured by Rudy Rose.

[06:20] Team_086 possession (Score: 52-72)
Anfernee Harris throws a bad pass out of bounds! TURNOVER! (dead ball)

[06:03] Team_089 possession (Score: 52-72)
Jalen Jackson attempts a 3Pt. Contested by Anfernee Harris (3.0 feet, MAN). JALEN JACKSON MAKES IT!
Score: 52-75

[05:49] Team_086 possession (Score: 52-75)
Miles Gobert attempts a Midrange. Heavily contested by Jalen Jackson (1.2 feet, ZONE)! Miles Gobert misses. FOUL! Loose ball foul on Jalen Jackson during the rebound battle. [Team fouls: 3] No free throws, side out. (Jalen Jackson: 1 personal fouls)

[05:31] Team_086 possession (Score: 52-75)
Lauri Johnson drives and kicks out. Rudy Rose attempts a Midrange. Contested by Terry Simmons (5.5 feet, MAN). Rudy Rose misses. Rebound secured by Rudy Smith.

[05:17] Team_089 possession (Score: 52-75)
Terry Simmons drives to the basket... FOUL! Offensive foul on Terry Simmons! Rudy Rose drew the charge! [Team fouls: 4] (Terry Simmons: 3 personal fouls) TURNOVER! (dead ball)

[05:03] Team_086 possession (Score: 52-75)
Lauri Johnson attempts a 3Pt. Contested by Jordan Brogdon (4.2 feet, ZONE). Lauri Johnson misses. Offensive rebound by Miles Gobert! Miles Gobert kicks it out.

[04:51] Team_086 possession (Score: 52-75)
Rudy Rose makes the Dunk and draws the foul on Jalen Jackson! And-1! Rudy Rose to the line for 1. [BONUS: 5 team fouls] (Jalen Jackson: 2 personal fouls)   FT 1/1: GOOD Rudy Rose makes 1/1 from the line.
Score: 55-75

[04:39] Team_089 possession (Score: 55-75)
Allen Mobley attempts a Layup. Contested by Rudy Rose (3.6 feet, ZONE). Allen Mobley misses. Rebound secured by Bones Ginobili.

[04:27] Team_086 possession (Score: 55-75)
Lauri Johnson attempts a Midrange. Contested by Jordan Brogdon (4.5 feet, MAN). LAURI JOHNSON MAKES IT! Assist: Anfernee Harris
Score: 57-75

[04:08] Team_089 possession (Score: 57-75)
Jalen Jackson attempts a Midrange. Wide open! Anfernee Harris is 7.2 feet away. [MAN] Jalen Jackson misses. Rebound secured by Miles Gobert.

[03:55] Team_086 possession (Score: 57-75)
Miles Gobert attempts a Dunk. BLOCKED BY TERRY SIMMONS! Ball goes out off Terry Simmons. Miles Gobert's ball!

[03:38] Team_086 possession (Score: 57-75)
Lauri Johnson attempts a Layup. BLOCKED BY ALLEN MOBLEY! Ball deflects out of bounds off Lauri Johnson.

[03:23] Team_089 possession (Score: 57-75)
Allen Mobley attempts a 3Pt. Contested by Bones Ginobili (3.1 feet, ZONE). ALLEN MOBLEY MAKES IT! Assist: Terry Simmons
Score: 57-78

[03:05] Team_086 possession (Score: 57-78)
Miles Gobert attempts a 3Pt. Contested by Jordan Brogdon (4.9 feet, ZONE). MILES GOBERT MAKES IT! Assist: Lauri Johnson
Score: 60-78

[02:51] Team_089 possession (Score: 60-78)
Terry Simmons attempts a Midrange. Wide open! Bones Ginobili is 7.6 feet away. [ZONE] TERRY SIMMONS MAKES IT!
Score: 60-80

[02:34] Team_086 possession (Score: 60-80)
Anfernee Harris attempts a 3Pt. Contested by Jordan Brogdon (3.8 feet, ZONE). Anfernee Harris misses. Rebound secured by Terry Simmons.

[02:17] Team_089 possession (Score: 60-80)
Allen Mobley attempts a Layup. Contested by Rudy Rose (5.5 feet, ZONE). ALLEN MOBLEY MAKES IT! Assist: Jalen Jackson
Score: 60-82

[02:03] Team_086 possession (Score: 60-82)
Lauri Johnson attempts a 3Pt. Wide open! Jordan Brogdon is 7.4 feet away. [ZONE] LAURI JOHNSON MAKES IT! Assist: Miles Gobert
Score: 63-82

[01:53] Team_089 possession (Score: 63-82)
Rudy Smith attempts a 3Pt. Wide open! Bones Ginobili is 7.8 feet away. [MAN] Rudy Smith misses. Rebound secured by Miles Gobert.

[01:42] Team_086 possession (Score: 63-82)
Miles Gobert attempts a Midrange. Contested by Allen Mobley (4.0 feet, MAN). Miles Gobert misses. Offensive rebound by Miles Gobert! Miles Gobert kicks it out.

[01:28] Team_086 possession (Score: 63-82)
Lauri Johnson drives and kicks out. Rudy Rose attempts a Midrange. Contested by Terry Simmons (3.8 feet, MAN). RUDY ROSE MAKES IT!
Score: 65-82

[01:15] Team_089 possession (Score: 65-82)
Rudy Smith makes the Dunk and draws the foul on Rudy Rose! And-1! Rudy Smith to the line for 1. [BONUS: 5 team fouls] (Rudy Rose: 1 personal fouls)   FT 1/1: GOOD Rudy Smith makes 1/1 from the line.
Score: 65-85

[01:02] Team_086 possession (Score: 65-85)
Rudy Rose attempts a 3Pt. Contested by Terry Simmons (5.2 feet, MAN). Rudy Rose misses. Rebound secured by Terry Simmons.

[00:50] Team_089 possession (Score: 65-85)
Allen Mobley attempts a Midrange. Contested by Miles Gobert (3.0 feet, ZONE). Allen Mobley misses. Rebound secured by Bones Ginobili.

[00:33] Team_086 possession (Score: 65-85)
Bones Ginobili attempts a Layup. Wide open! Rudy Smith is 7.4 feet away. [MAN] BONES GINOBILI MAKES IT!
Score: 67-85

[00:17] Team_089 possession (Score: 67-85)
FOUL! Reach-in foul on Lauri Johnson during the drive. [IN THE BONUS! 6 team fouls] Jordan Brogdon to the line for 2 free throws. (Lauri Johnson: 1 personal fouls)   FT 1/2: GOOD   FT 2/2: GOOD Jordan Brogdon makes 2/2 from the line.
Score: 67-87

[00:04] Team_086 possession (Score: 67-87)
Miles Gobert drives to the basket... Miles Gobert throws a bad pass! Stolen by Allen Mobley! TURNOVER! (live ball)

================================================================================
                              3RD QUARTER COMPLETE                              
================================================================================

3RD QUARTER SCORE: Team_086 23, Team_089 25

BOX SCORE:
================================================================================

Team_086
--------------------------------------------------------------------------------
Player                MIN  PTS  REB  AST  TO      FG   FG%      3P   3P%
--------------------------------------------------------------------------------
Rudy Rose              28   10    2    0   0   4/5    80.0     0/0   0.0
Lauri Johnson          28    5    0    2   0   2/9    22.2     0/0   0.0
Anfernee Harris        28    3    0    1   0   1/2    50.0     0/0   0.0
Miles Gobert           28    3    7    1   0   1/1   100.0     0/0   0.0
Bones Ginobili         28    2    4    1   0   1/1   100.0     0/0   0.0

TEAM: FG: 9/18 (50.0%), 3PT: 3/8 (37.5%), REB: 13 (5 off, 8 def), AST: 5, TO: 4
TEAM FOULS: 6 [Team_089 in BONUS]


Team_089
--------------------------------------------------------------------------------
Player                MIN  PTS  REB  AST  TO      FG   FG%      3P   3P%
--------------------------------------------------------------------------------
Terry Simmons          28    6    4    2   0   3/4    75.0     0/0   0.0
Rudy Smith             28    6    3    0   0   2/4    50.0     0/0   0.0
Jalen Jackson          28    6    1    1   0   2/4    50.0     0/0   0.0
Allen Mobley           28    5    0    0   0   2/4    50.0     0/0   0.0
Jordan Brogdon         28    2    0    0   0   1/3    33.3     0/0   0.0

TEAM: FG: 10/19 (52.6%), 3PT: 4/8 (50.0%), REB: 8 (1 off, 7 def), AST: 3, TO: 2
TEAM FOULS: 5 [Team_086 in BONUS]

================================================================================

================================================================================
                       4TH QUARTER - Team_086 vs Team_089                       
================================================================================

[12:00] Substitution (Team_086): Lauri Johnson OUT (stamina: 69) → Anfernee Green IN (comeback_detected)

[12:00] Substitution (Team_089): Jordan Brogdon OUT (stamina: 67) → Tony Parker IN (comeback_detected)

[12:00] Team_086 possession (Score: 67-87)
FOUL! Reach-in foul on Terry Simmons during the drive. [Team fouls: 1] No free throws, side out. (Terry Simmons: 1 personal fouls)

[11:46] Team_086 possession (Score: 67-87)
FOUL! Holding foul on Terry Simmons. [Team fouls: 2] No free throws, side out. (Terry Simmons: 2 personal fouls)

[11:27] Team_086 possession (Score: 67-87)
Bones Ginobili drives and kicks out. Anfernee Green attempts a Midrange. Contested by Jalen Jackson (5.3 feet, ZONE). ANFERNEE GREEN MAKES IT!
Score: 69-87

[11:13] Team_089 possession (Score: 69-87)
Allen Mobley drives to the basket... Allen Mobley throws a bad pass out of bounds! TURNOVER! (dead ball)

[11:13] Substitution (Team_086): Anfernee Harris OUT → Anthony James IN (stamina_rule2)

[11:13] Substitution (Team_086): Miles Gobert OUT → Franz McGrady IN (stamina_rule2)

[11:13] Substitution (Team_086): Bones Ginobili OUT → Kyle McCollum IN (stamina_rule2)

[11:13] Substitution (Team_086): Rudy Rose OUT → Lamelo Towns IN (stamina_rule2)

[11:13] Substitution (Team_089): Jalen Jackson OUT → Joel Barnes IN (stamina_rule2)

[11:13] Substitution (Team_089): Allen Mobley OUT → Pascal Durant IN (stamina_rule2)

[11:13] Substitution (Team_089): Rudy Smith OUT → Devin Haliburton IN (stamina_rule2)

[11:13] Substitution (Team_089): Terry Simmons OUT → Evan Gasol IN (stamina_rule2)

[10:56] Team_086 possession (Score: 69-87)
FOUL! Reach-in foul on Pascal Durant during the drive. [Team fouls: 3] No free throws, side out. (Pascal Durant: 1 personal fouls)

[10:42] Team_086 possession (Score: 69-87)
Anthony James drives, Joel Barnes stays with him. Anthony James attempts a Layup. Contested by Joel Barnes (5.8 feet, MAN). ANTHONY JAMES MAKES IT! Assist: Kyle McCollum
Score: 71-87

[10:26] Team_089 possession (Score: 71-87)
Tony Parker drives, Anfernee Green stays with him. Tony Parker attempts a Layup. Contested by Anfernee Green (5.8 feet, MAN). Tony Parker misses. Rebound secured by Anfernee Green.

[10:10] Team_086 possession (Score: 71-87)
Anthony James attempts a Midrange. Contested by Joel Barnes (4.6 feet, MAN). Anthony James misses. Rebound secured by Evan Gasol.

[09:58] Team_089 possession (Score: 71-87)
Tony Parker attempts a 3Pt. Contested by Anfernee Green (5.2 feet, ZONE). Tony Parker misses. Rebound secured by Kyle McCollum.

[09:43] Team_086 possession (Score: 71-87)
Franz McGrady makes the Midrange and draws the foul on Pascal Durant! And-1! Franz McGrady to the line for 1. [Team fouls: 4] (Pascal Durant: 2 personal fouls)   FT 1/1: GOOD Franz McGrady makes 1/1 from the line.
Score: 74-87

[09:25] Team_089 possession (Score: 74-87)
Joel Barnes loses the ball! Stripped by Anthony James! TURNOVER! (live ball)

[09:14] Team_086 possession (Score: 74-87)
Anfernee Green attempts a 3Pt. Contested by Tony Parker (5.0 feet, MAN). Anfernee Green misses. Offensive rebound by Anfernee Green! Anfernee Green kicks it out.

[08:59] Team_086 possession (Score: 74-87)
Anfernee Green attempts a 3Pt. Heavily contested by Pascal Durant (0.7 feet, ZONE)! Anfernee Green misses. Rebound secured by Pascal Durant.

[08:47] Team_089 possession (Score: 74-87)
Tony Parker attempts a Midrange. Wide open! Kyle McCollum is 6.9 feet away. [ZONE] TONY PARKER MAKES IT! Assist: Pascal Durant
Score: 74-89

[08:32] Team_086 possession (Score: 74-89)
Lamelo Towns attempts a Midrange. Contested by Tony Parker (3.0 feet, ZONE). LAMELO TOWNS MAKES IT! Assist: Anfernee Green
Score: 76-89

[08:13] Team_089 possession (Score: 76-89)
Pascal Durant attempts a 3Pt. Contested by Franz McGrady (3.6 feet, MAN). PASCAL DURANT MAKES IT! Assist: Joel Barnes
Score: 76-92

[07:58] Team_086 possession (Score: 76-92)
Anthony James attempts a 3Pt. Wide open! Tony Parker is 6.5 feet away. [ZONE] Anthony James misses. Rebound secured by Evan Gasol.

[07:48] Team_089 possession (Score: 76-92)
Tony Parker drives and kicks out. Pascal Durant attempts a Midrange. Wide open! Franz McGrady is 7.1 feet away. [MAN] PASCAL DURANT MAKES IT! Assist: Tony Parker
Score: 76-94

[07:33] Team_086 possession (Score: 76-94)
FOUL! Shooting foul on Pascal Durant. Franz McGrady to the line for 2 free throws. [BONUS: 5 team fouls] (Pascal Durant: 3 personal fouls)   FT 1/2: GOOD   FT 2/2: MISS Franz McGrady makes 1/2 from the line. Rebound secured by Evan Gasol.
Score: 77-94

[07:21] Team_089 possession (Score: 77-94)
Tony Parker attempts a 3Pt. Contested by Anfernee Green (2.9 feet, MAN). TONY PARKER MAKES IT!
Score: 77-97

[07:09] Team_086 possession (Score: 77-97)
Anthony James attempts a Midrange. Wide open! Joel Barnes is 6.2 feet away. [MAN] ANTHONY JAMES MAKES IT!
Score: 79-97

[06:53] Team_089 possession (Score: 79-97)
Joel Barnes attempts a Layup. Wide open! Lamelo Towns is 8.0 feet away. [ZONE] JOEL BARNES MAKES IT! Assist: Devin Haliburton
Score: 79-99

[06:34] Team_086 possession (Score: 79-99)
Anthony James drives, picks up Joel Barnes. Help arrives from Pascal Durant! Anthony James attempts a Dunk. Wide open! Pascal Durant is 8.5 feet away. [MAN] Anthony James misses. Rebound secured by Evan Gasol.

[06:20] Team_089 possession (Score: 79-99)
Tony Parker attempts a Layup. Wide open! Lamelo Towns is 6.5 feet away. [ZONE] Tony Parker misses. Rebound secured by Kyle McCollum.

[06:02] Team_086 possession (Score: 79-99)
Anthony James attempts a 3Pt. Contested by Pascal Durant (4.2 feet, ZONE). Anthony James misses. Rebound secured by Pascal Durant.

[05:48] Team_089 possession (Score: 79-99)
Evan Gasol attempts a Layup. Wide open! Lamelo Towns is 7.8 feet away. [ZONE] EVAN GASOL MAKES IT! Assist: Pascal Durant
Score: 79-101

[05:38] Team_086 possession (Score: 79-101)
Lamelo Towns drives and kicks out. Franz McGrady attempts a Midrange. Contested by Pascal Durant (4.6 feet, MAN). Franz McGrady misses. FOUL! Loose ball foul on Evan Gasol during the rebound battle. [IN THE BONUS! 6 team fouls] Anfernee Green to the line for 2 free throws. (Evan Gasol: 1 personal fouls)   FT 1/2: MISS   FT 2/2: GOOD Anfernee Green makes 1/2 from the line.
Score: 80-101

[05:22] Team_089 possession (Score: 80-101)
Evan Gasol attempts a 3Pt. Contested by Lamelo Towns (2.6 feet, MAN). EVAN GASOL MAKES IT! Assist: Devin Haliburton
Score: 80-104

[05:09] Team_086 possession (Score: 80-104)
Kyle McCollum attempts a Midrange. Wide open! Devin Haliburton is 7.0 feet away. [ZONE] Kyle McCollum misses. Rebound secured by Pascal Durant.

[04:57] Team_089 possession (Score: 80-104)
FOUL! Shooting foul on Lamelo Towns. Devin Haliburton to the line for 2 free throws. [Team fouls: 1] (Lamelo Towns: 1 personal fouls)   FT 1/2: GOOD   FT 2/2: GOOD Devin Haliburton makes 2/2 from the line.
Score: 80-106

[04:46] Team_086 possession (Score: 80-106)
Franz McGrady attempts a 3Pt. Contested by Pascal Durant (3.7 feet, ZONE). FRANZ MCGRADY MAKES IT! Assist: Anfernee Green
Score: 83-106

[04:32] Team_089 possession (Score: 83-106)
Devin Haliburton attempts a 3Pt. Contested by Franz McGrady (3.7 feet, ZONE). Devin Haliburton misses. Rebound secured by Lamelo Towns.

[04:17] Team_086 possession (Score: 83-106)
Lamelo Towns attempts a Midrange. Wide open! Tony Parker is 7.0 feet away. [ZONE] Lamelo Towns misses. Offensive rebound by Anfernee Green! Anfernee Green kicks it out.

[03:58] Team_086 possession (Score: 83-106)
FOUL! Reach-in foul on Evan Gasol during the drive. [IN THE BONUS! 7 team fouls] Kyle McCollum to the line for 2 free throws. (Evan Gasol: 2 personal fouls)   FT 1/2: GOOD   FT 2/2: MISS Kyle McCollum makes 1/2 from the line. Rebound secured by Devin Haliburton.
Score: 84-106

[03:45] Team_089 possession (Score: 84-106)
Tony Parker attempts a Midrange. Wide open! Franz McGrady is 6.5 feet away. [ZONE] TONY PARKER MAKES IT!
Score: 84-108

[03:28] Team_086 possession (Score: 84-108)
Anthony James attempts a 3Pt. Contested by Pascal Durant (2.2 feet, ZONE). Anthony James misses. Rebound secured by Pascal Durant.

[03:13] Team_089 possession (Score: 84-108)
Tony Parker attempts a 3Pt. Contested by Anfernee Green (4.5 feet, ZONE). Tony Parker misses. Rebound secured by Anfernee Green.

[02:59] Team_086 possession (Score: 84-108)
FOUL! Holding foul on Pascal Durant. [IN THE BONUS! 8 team fouls] Franz McGrady to the line for 2 free throws. (Pascal Durant: 4 personal fouls)   FT 1/2: GOOD   FT 2/2: GOOD Franz McGrady makes 2/2 from the line.
Score: 86-108

[02:46] Team_089 possession (Score: 86-108)
Joel Barnes attempts a Midrange. Wide open! Anfernee Green is 6.7 feet away. [ZONE] Joel Barnes misses. Rebound secured by Kyle McCollum.

[02:29] Team_086 possession (Score: 86-108)
Franz McGrady attempts a 3Pt. Heavily contested by Pascal Durant (0.5 feet, ZONE)! Franz McGrady misses. FOUL! Loose ball foul on Pascal Durant during the rebound battle. [IN THE BONUS! 9 team fouls] Anfernee Green to the line for 2 free throws. (Pascal Durant: 5 personal fouls)   FT 1/2: GOOD   FT 2/2: GOOD Anfernee Green makes 2/2 from the line.
Score: 88-108

[02:13] Team_089 possession (Score: 88-108)
Evan Gasol drives, Lamelo Towns stays with him. Evan Gasol attempts a Dunk. Wide open! Lamelo Towns is 7.2 feet away. [ZONE] EVAN GASOL MAKES IT!
Score: 88-110

[01:57] Team_086 possession (Score: 88-110)
Kyle McCollum attempts a Layup. Wide open! Devin Haliburton is 6.8 feet away. [ZONE] KYLE MCCOLLUM MAKES IT! Assist: Franz McGrady
Score: 90-110

[01:44] Team_089 possession (Score: 90-110)
FOUL! Reach-in foul on Anfernee Green during the drive. [Team fouls: 2] No free throws, side out. (Anfernee Green: 1 personal fouls)

[01:30] Team_089 possession (Score: 90-110)
FOUL! Shooting foul on Lamelo Towns. Evan Gasol to the line for 2 free throws. [Team fouls: 3] (Lamelo Towns: 2 personal fouls)   FT 1/2: GOOD   FT 2/2: GOOD Evan Gasol makes 2/2 from the line.
Score: 90-112

[01:15] Team_086 possession (Score: 90-112)
Anfernee Green attempts a 3Pt. Wide open! Tony Parker is 9.1 feet away. [MAN] Anfernee Green misses. Rebound secured by Evan Gasol.

[01:06] Team_089 possession (Score: 90-112)
Evan Gasol drives to the basket... Evan Gasol loses the ball! Stripped by Lamelo Towns! TURNOVER! (live ball)

[00:54] Team_086 possession (Score: 90-112)
Anthony James makes the 3Pt and draws the foul on Joel Barnes! And-1! Anthony James to the line for 1. [BONUS: 10 team fouls] (Joel Barnes: 1 personal fouls)   FT 1/1: GOOD Anthony James makes 1/1 from the line.
Score: 94-112

[00:38] Team_089 possession (Score: 94-112)
Pascal Durant attempts a Midrange. Wide open! Kyle McCollum is 6.6 feet away. [ZONE] PASCAL DURANT MAKES IT!
Score: 94-114

[00:24] Team_086 possession (Score: 94-114)
Lamelo Towns drives to the basket... FOUL! Offensive foul on Lamelo Towns! Devin Haliburton drew the charge! [Team fouls: 4] (Lamelo Towns: 3 personal fouls) TURNOVER! (dead ball)

[00:10] Team_089 possession (Score: 94-114)
Evan Gasol makes the Midrange and draws the foul on Lamelo Towns! And-1! Evan Gasol to the line for 1. [BONUS: 5 team fouls] (Lamelo Towns: 4 personal fouls)   FT 1/1: GOOD Evan Gasol makes 1/1 from the line.
Score: 94-117

================================================================================
                              4TH QUARTER COMPLETE                              
================================================================================

4TH QUARTER SCORE: Team_086 27, Team_089 30

BOX SCORE:
================================================================================

Team_086
--------------------------------------------------------------------------------
Player                MIN  PTS  REB  AST  TO      FG   FG%      3P   3P%
--------------------------------------------------------------------------------
Anthony James          20    8    0    0   0   3/8    37.5     0/0   0.0
Franz McGrady          20    8    0    1   0   3/4    75.0     0/0   0.0
Anfernee Green         21    5    4    2   0   3/5    60.0     0/0   0.0
Kyle McCollum          20    2    3    1   0   1/3    33.3     0/0   0.0
Lamelo Towns           20    2    1    0   0   1/1   100.0     0/0   0.0

TEAM: FG: 11/21 (52.4%), 3PT: 3/8 (37.5%), REB: 8 (2 off, 6 def), AST: 4, TO: 1
TEAM FOULS: 5 [Team_089 in BONUS]


Team_089
--------------------------------------------------------------------------------
Player                MIN  PTS  REB  AST  TO      FG   FG%      3P   3P%
--------------------------------------------------------------------------------
Evan Gasol             20   12    5    0   0   5/5   100.0     0/0   0.0
Tony Parker            21    7    0    1   0   3/7    42.9     0/0   0.0
Pascal Durant          20    7    4    2   0   3/3   100.0     0/0   0.0
Joel Barnes            20    2    0    1   0   1/2    50.0     0/0   0.0
Devin Haliburton       20    2    1    2   0   1/2    50.0     0/0   0.0

TEAM: FG: 13/19 (68.4%), 3PT: 3/6 (50.0%), REB: 10 (0 off, 10 def), AST: 6, TO: 3
TEAM FOULS: 10 [Team_086 in BONUS]

================================================================================

================================================================================
                               FULL GAME COMPLETE                               
================================================================================

FINAL SCORE: Team_086 94, Team_089 117

SCORING BY QUARTER:
--------------------------------------------------------------------------------
Team                     Q1     Q2     Q3     Q4    FINAL
--------------------------------------------------------------------------------
Team_086                 20     24     23     27       94
Team_089                 35     27     25     30      117
--------------------------------------------------------------------------------

FULL GAME BOX SCORE:
================================================================================

Team_086
--------------------------------------------------------------------------------
Player                MIN  PTS  REB  AST  TO      FG   FG%      3P   3P%      FT STL BLK
--------------------------------------------------------------------------------
Anfernee Harris        29    5    0    1   6   2/6    33.3   1/4    25.0   0/0     0   0
Miles Gobert           29   15   11    1   2   6/8    75.0   3/4    75.0   2/2     0   0
Bones Ginobili         29    6    8    2   0   4/6    66.7   0/1     0.0   4/4     0   0
Rudy Rose              29   14    4    0   2   5/9    55.6   0/2     0.0   2/2     0   0
Lauri Johnson          28    9    0    5   0   5/13   38.5   1/4    25.0   3/6     0   0
Anfernee Green         21    7    7    4   0   1/7    14.3   0/5     0.0   6/10    0   0
Anthony James          20   11    0    0   1   4/9    44.4   1/4    25.0   2/2     2   0
Franz McGrady          20   10    0    2   0   4/7    57.1   2/3    66.7   4/5     0   0
Kyle McCollum          20    4    5    1   1   2/4    50.0   0/0     0.0   1/2     0   0
Lamelo Towns           20    6    5    0   0   4/6    66.7   0/0     0.0   1/2     1   0

TEAM: FG: 38/76 (50.0%), 3PT: 8/27 (29.6%), REB: 39 (12 off, 27 def), AST: 16, TO: 12


Team_089
--------------------------------------------------------------------------------
Player                MIN  PTS  REB  AST  TO      FG   FG%      3P   3P%      FT STL BLK
--------------------------------------------------------------------------------
Jalen Jackson          29   19    4    1   1   6/11   54.5   2/4    50.0   2/2     1   0
Allen Mobley           29   19    0    2   1   8/11   72.7   2/2   100.0   5/5     1   1
Rudy Smith             29   12    8    1   1   4/7    57.1   2/3    66.7   2/2     0   0
Terry Simmons          29    8   10    4   1   5/8    62.5   0/3     0.0   2/2     0   2
Jordan Brogdon         28   10    0    0   1   5/8    62.5   1/3    33.3   6/7     0   0
Tony Parker            21   10    0    2   0   4/8    50.0   1/3    33.3   0/0     0   0
Joel Barnes            20    3    0    2   3   2/4    50.0   0/1     0.0   1/2     0   0
Pascal Durant          20   10    4    4   0   5/7    71.4   3/4    75.0   0/1     0   1
Devin Haliburton       20    5    4    2   0   2/4    50.0   0/1     0.0   4/6     0   0
Evan Gasol             20   18   10    0   0   8/10   80.0   1/2    50.0   5/5     0   0

TEAM: FG: 49/78 (62.8%), 3PT: 12/26 (46.2%), REB: 41 (6 off, 35 def), AST: 18, TO: 8

================================================================================
