================================================================================
                        FULL GAME - Team_060 vs Team_019                        
================================================================================

================================================================================
                       1ST QUARTER - Team_060 vs Team_019                       
================================================================================

[12:00] Team_060 possession (Score: 0-0)
Immanuel Ming attempts a 3Pt. Contested by D'Angelo Randle (3.2 feet, MAN). Immanuel Ming misses. Offensive rebound by Immanuel Ming! Immanuel Ming kicks it out.

[11:44] Team_060 possession (Score: 0-0)
FOUL! Shooting foul on DeMar James. Immanuel Ming to the line for 2 free throws. [Team fouls: 1] (DeMar James: 1 personal fouls)   FT 1/2: GOOD   FT 2/2: GOOD Immanuel Ming makes 2/2 from the line.
Score: 2-0

[11:34] Team_019 possession (Score: 2-0)
Brandon James attempts a 3Pt. Contested by Julius Green (5.1 feet, MAN). Brandon James misses. Rebound secured by Larry Westbrook.

[11:22] Team_060 possession (Score: 2-0)
Immanuel Ming drives and kicks out. Larry Westbrook attempts a 3Pt. Contested by Tobias Hyland (4.8 feet, MAN). Larry Westbrook misses. Rebound secured by DeMar James.

[11:08] Team_019 possession (Score: 2-0)
Rudy Giddey attempts a Midrange. Contested by Joel Morant (3.9 feet, MAN). RUDY GIDDEY MAKES IT! Assist: Brandon James
Score: 2-2

[10:51] Team_060 possession (Score: 2-2)
Immanuel Ming drives, picks up D'Angelo Randle. Help arrives from Brandon James! Immanuel Ming attempts a Layup. Contested by Brandon James (3.5 feet, MAN). IMMANUEL MING MAKES IT! Assist: Jaren George
Score: 4-2

[10:33] Team_019 possession (Score: 4-2)
Rudy Giddey attempts a 3Pt. Contested by Joel Morant (4.0 feet, MAN). RUDY GIDDEY MAKES IT! Assist: D'Angelo Randle
Score: 4-5

[10:21] Team_060 possession (Score: 4-5)
Julius Green attempts a Midrange. Contested by Brandon James (4.7 feet, MAN). Julius Green misses. Rebound secured by DeMar James.

[10:08] Team_019 possession (Score: 4-5)
Rudy Giddey drives, Joel Morant stays with him. Rudy Giddey attempts a Dunk. Heavily contested by Joel Morant (0.5 feet, MAN)! RUDY GIDDEY MAKES IT!
Score: 4-7

[09:56] Team_060 possession (Score: 4-7)
Joel Morant attempts a 3Pt. Contested by D'Angelo Randle (3.3 feet, ZONE). Joel Morant misses. Rebound secured by DeMar James.

[09:43] Team_019 possession (Score: 4-7)
D'Angelo Randle attempts a Midrange. Contested by Jaren George (5.1 feet, ZONE). D'ANGELO RANDLE MAKES IT! Assist: Brandon James
Score: 4-9

[09:29] Team_060 possession (Score: 4-9)
Jaren George attempts a Layup. Contested by DeMar James (4.6 feet, ZONE). Jaren George misses. Rebound secured by D'Angelo Randle.

[09:18] Team_019 possession (Score: 4-9)
Rudy Giddey attempts a Midrange. Wide open! Joel Morant is 6.2 feet away. [MAN] Rudy Giddey misses. Rebound secured by Jaren George.

[09:06] Team_060 possession (Score: 4-9)
Larry Westbrook drives, DeMar James stays with him. Larry Westbrook attempts a Dunk. Contested by DeMar James (3.5 feet, ZONE). Larry Westbrook misses. Rebound secured by DeMar James.

[08:57] Team_019 possession (Score: 4-9)
D'Angelo Randle attempts a 3Pt. Contested by Immanuel Ming (4.1 feet, MAN). D'ANGELO RANDLE MAKES IT! Assist: Tobias Hyland
Score: 4-12

[08:44] Team_060 possession (Score: 4-12)
Joel Morant drives, picks up Rudy Giddey. Help arrives from D'Angelo Randle! Joel Morant attempts a Layup. Contested by D'Angelo Randle (4.4 feet, MAN). JOEL MORANT MAKES IT!
Score: 6-12

[08:26] Team_019 possession (Score: 6-12)
Rudy Giddey attempts a 3Pt. Wide open! Julius Green is 6.1 feet away. [ZONE] Rudy Giddey misses. Rebound secured by Jaren George.

[08:11] Team_060 possession (Score: 6-12)
Joel Morant drives to the basket... Joel Morant throws a bad pass! Stolen by DeMar James! TURNOVER! (live ball)

[07:59] Team_019 possession (Score: 6-12)
Rudy Giddey attempts a Layup. Contested by Larry Westbrook (6.0 feet, ZONE). RUDY GIDDEY MAKES IT! Assist: D'Angelo Randle
Score: 6-14

[07:46] Team_060 possession (Score: 6-14)
Larry Westbrook attempts a Layup. Contested by DeMar James (3.9 feet, ZONE). Larry Westbrook misses. Rebound secured by DeMar James.

[07:33] Team_019 possession (Score: 6-14)
D'Angelo Randle attempts a 3Pt. Heavily contested by Julius Green (0.5 feet, ZONE)! D'Angelo Randle misses. Rebound secured by Jaren George.

[07:22] Team_060 possession (Score: 6-14)
Jaren George attempts a Layup. Wide open! DeMar James is 8.3 feet away. [MAN] Jaren George misses. Rebound secured by DeMar James.

[07:12] Team_019 possession (Score: 6-14)
Tobias Hyland attempts a Midrange. Wide open! Immanuel Ming is 8.0 feet away. [ZONE] Tobias Hyland misses. Offensive rebound by D'Angelo Randle! D'Angelo Randle's putback is no good. Rebound secured by Jaren George.

[06:54] Team_060 possession (Score: 6-14)
Jaren George drives, picks up DeMar James. Help arrives from Brandon James! Jaren George attempts a Dunk. Contested by Brandon James (5.0 feet, MAN). JAREN GEORGE MAKES IT! Assist: Immanuel Ming
Score: 8-14

[06:36] Team_019 possession (Score: 8-14)
Tobias Hyland attempts a 3Pt. Contested by Julius Green (3.3 feet, ZONE). Tobias Hyland misses. Rebound secured by Immanuel Ming.

[06:23] Team_060 possession (Score: 8-14)
Jaren George drives to the basket... Jaren George throws a bad pass out of bounds! TURNOVER! (dead ball)

[06:12] Team_019 possession (Score: 8-14)
Tobias Hyland drives, Larry Westbrook stays with him. Tobias Hyland attempts a Dunk. Wide open! Larry Westbrook is 7.6 feet away. [MAN] TOBIAS HYLAND MAKES IT! Assist: DeMar James
Score: 8-16

[05:53] Team_060 possession (Score: 8-16)
Joel Morant attempts a 3Pt. Contested by D'Angelo Randle (2.7 feet, ZONE). JOEL MORANT MAKES IT! Assist: Immanuel Ming
Score: 11-16

[05:39] Team_019 possession (Score: 11-16)
Rudy Giddey attempts a Midrange. Contested by Joel Morant (4.5 feet, MAN). RUDY GIDDEY MAKES IT!
Score: 11-18

[05:24] Team_060 possession (Score: 11-18)
Jaren George attempts a Layup. Heavily contested by DeMar James (1.3 feet, MAN)! JAREN GEORGE MAKES IT!
Score: 13-18

[05:06] Team_019 possession (Score: 13-18)
Rudy Giddey attempts a 3Pt. Heavily contested by Julius Green (1.7 feet, ZONE)! RUDY GIDDEY MAKES IT!
Score: 13-21

[04:47] Team_060 possession (Score: 13-21)
Larry Westbrook attempts a 3Pt. Wide open! D'Angelo Randle is 6.1 feet away. [ZONE] Larry Westbrook misses. Rebound secured by DeMar James.

[04:33] Team_019 possession (Score: 13-21)
Brandon James attempts a Layup. BLOCKED BY LARRY WESTBROOK! Ball is loose! Rebound secured by Jaren George.

[04:16] Team_060 possession (Score: 13-21)
Larry Westbrook attempts a Midrange. Contested by Tobias Hyland (2.1 feet, MAN). Larry Westbrook misses. Offensive rebound by Immanuel Ming! Immanuel Ming kicks it out.

[04:04] Team_060 possession (Score: 13-21)
Joel Morant attempts a 3Pt. Contested by D'Angelo Randle (2.5 feet, ZONE). JOEL MORANT MAKES IT! Assist: Julius Green
Score: 16-21

[03:50] Team_019 possession (Score: 16-21)
D'Angelo Randle attempts a 3Pt. Heavily contested by Julius Green (0.5 feet, ZONE)! D'Angelo Randle misses. Offensive rebound by DeMar James! DeMar James's putback is no good. Rebound secured by Larry Westbrook.

[03:38] Team_060 possession (Score: 16-21)
FOUL! Shooting foul on Brandon James. Julius Green to the line for 3 free throws. [Team fouls: 2] (Brandon James: 1 personal fouls)   FT 1/3: GOOD   FT 2/3: GOOD   FT 3/3: GOOD Julius Green makes 3/3 from the line.
Score: 19-21

[03:24] Team_019 possession (Score: 19-21)
Brandon James attempts a 3Pt. Contested by Julius Green (4.6 feet, ZONE). Brandon James misses. Offensive rebound by D'Angelo Randle! D'Angelo Randle kicks it out.

[03:08] Team_019 possession (Score: 19-21)
DeMar James drives and kicks out. DeMar James attempts a 3Pt. Contested by Jaren George (4.0 feet, MAN). DEMAR JAMES MAKES IT! Assist: Rudy Giddey
Score: 19-24

[02:55] Team_060 possession (Score: 19-24)
Joel Morant attempts a 3Pt. Heavily contested by D'Angelo Randle (2.0 feet, ZONE)! JOEL MORANT MAKES IT! Assist: Jaren George
Score: 22-24

[02:36] Team_019 possession (Score: 22-24)
Tobias Hyland attempts a Layup. Contested by Larry Westbrook (5.5 feet, MAN). TOBIAS HYLAND MAKES IT!
Score: 22-26

[02:25] Team_060 possession (Score: 22-26)
Larry Westbrook drives, Tobias Hyland stays with him. Larry Westbrook attempts a Dunk. Contested by Tobias Hyland (5.1 feet, MAN). LARRY WESTBROOK MAKES IT! Assist: Joel Morant
Score: 24-26

[02:06] Team_019 possession (Score: 24-26)
Tobias Hyland attempts a 3Pt. Contested by Larry Westbrook (5.3 feet, MAN). Tobias Hyland misses. Rebound secured by Larry Westbrook.

[01:53] Team_060 possession (Score: 24-26)
Larry Westbrook makes the Midrange and draws the foul on Tobias Hyland! And-1! Larry Westbrook to the line for 1. [Team fouls: 3] (Tobias Hyland: 1 personal fouls)   FT 1/1: GOOD Larry Westbrook makes 1/1 from the line.
Score: 27-26

[01:37] Team_019 possession (Score: 27-26)
Tobias Hyland attempts a Midrange. Wide open! Larry Westbrook is 6.9 feet away. [MAN] Tobias Hyland misses. Rebound secured by Larry Westbrook.

[01:24] Team_060 possession (Score: 27-26)
FOUL! Reach-in foul on DeMar James during the drive. [Team fouls: 4] No free throws, side out. (DeMar James: 2 personal fouls)

[01:07] Team_060 possession (Score: 27-26)
Immanuel Ming throws a bad pass! Stolen by D'Angelo Randle! TURNOVER! (live ball)

[00:51] Team_019 possession (Score: 27-26)
Brandon James attempts a 3Pt. Contested by Julius Green (3.0 feet, MAN). Brandon James misses. Offensive rebound by DeMar James! DeMar James kicks it out.

[00:39] Team_019 possession (Score: 27-26)
FOUL! Holding foul on Joel Morant. [Team fouls: 1] No free throws, side out. (Joel Morant: 1 personal fouls)

[00:23] Team_019 possession (Score: 27-26)
Tobias Hyland attempts a Midrange. Wide open! Larry Westbrook is 6.0 feet away. [MAN] Tobias Hyland misses. Offensive rebound by D'Angelo Randle! D'Angelo Randle kicks it out.

[00:08] Team_019 possession (Score: 27-26)
Brandon James drives and kicks out. Brandon James attempts a 3Pt. Wide open! Joel Morant is 10.0 feet away. [ZONE] Brandon James misses. Rebound secured by Larry Westbrook.

================================================================================
                              1ST QUARTER COMPLETE                              
================================================================================

1ST QUARTER SCORE: Team_060 27, Team_019 26

BOX SCORE:
================================================================================

Team_060
--------------------------------------------------------------------------------
Player                MIN  PTS  REB  AST  TO      FG   FG%      3P   3P%
--------------------------------------------------------------------------------
Joel Morant            12   11    0    1   0   4/5    80.0     0/0   0.0
Larry Westbrook        12    5    5    0   0   2/5    40.0     0/0   0.0
Immanuel Ming          12    4    3    2   0   2/3    66.7     0/0   0.0
Jaren George           12    4    5    2   0   2/4    50.0     0/0   0.0
Julius Green           12    3    0    1   0   1/2    50.0     0/0   0.0

TEAM: FG: 11/19 (57.9%), 3PT: 4/6 (66.7%), REB: 11 (2 off, 9 def), AST: 6, TO: 3
TEAM FOULS: 1


Team_019
--------------------------------------------------------------------------------
Player                MIN  PTS  REB  AST  TO      FG   FG%      3P   3P%
--------------------------------------------------------------------------------
Rudy Giddey            12   14    0    1   0   6/8    75.0     0/0   0.0
D'Angelo Randle        12    5    3    2   0   2/4    50.0     0/0   0.0
Tobias Hyland          12    4    0    1   0   2/6    33.3     0/0   0.0
DeMar James            12    3    8    1   0   1/1   100.0     0/0   0.0
Brandon James          12    0    0    2   0   0/3     0.0     0/0   0.0

TEAM: FG: 11/22 (50.0%), 3PT: 3/9 (33.3%), REB: 13 (5 off, 8 def), AST: 7, TO: 0
TEAM FOULS: 4

================================================================================

================================================================================
                       2ND QUARTER - Team_060 vs Team_019                       
================================================================================

[12:00] Team_060 possession (Score: 27-26)
Immanuel Ming attempts a 3Pt. Contested by D'Angelo Randle (5.6 feet, ZONE). Immanuel Ming misses. FOUL! Loose ball foul on D'Angelo Randle during the rebound battle. [Team fouls: 1] No free throws, side out. (D'Angelo Randle: 1 personal fouls)

[11:47] Team_060 possession (Score: 27-26)
Julius Green drives, DeMar James stays with him. Julius Green attempts a Dunk. Contested by DeMar James (3.8 feet, ZONE). Julius Green misses. Rebound secured by DeMar James.

[11:30] Team_019 possession (Score: 27-26)
D'Angelo Randle attempts a 3Pt. Wide open! Immanuel Ming is 7.1 feet away. [MAN] D'Angelo Randle misses. Rebound secured by Jaren George.

[11:14] Team_060 possession (Score: 27-26)
FOUL! Shooting foul on D'Angelo Randle. Julius Green to the line for 3 free throws. [Team fouls: 2] (D'Angelo Randle: 2 personal fouls)   FT 1/3: GOOD   FT 2/3: MISS   FT 3/3: GOOD Julius Green makes 2/3 from the line.
Score: 29-26

[11:02] Team_019 possession (Score: 29-26)
D'Angelo Randle attempts a Midrange. Wide open! Joel Morant is 6.9 feet away. [ZONE] D'Angelo Randle misses. Rebound secured by Immanuel Ming.

[10:50] Team_060 possession (Score: 29-26)
Larry Westbrook attempts a Midrange. Wide open! Tobias Hyland is 8.2 feet away. [MAN] LARRY WESTBROOK MAKES IT!
Score: 31-26

[10:35] Team_019 possession (Score: 31-26)
FOUL! Holding foul on Immanuel Ming. [Team fouls: 1] No free throws, side out. (Immanuel Ming: 1 personal fouls)

[10:21] Team_019 possession (Score: 31-26)
Tobias Hyland attempts a Midrange. Wide open! Larry Westbrook is 7.3 feet away. [MAN] Tobias Hyland misses. Rebound secured by Jaren George.

[10:10] Team_060 possession (Score: 31-26)
Immanuel Ming attempts a Layup. Contested by D'Angelo Randle (2.5 feet, MAN). IMMANUEL MING MAKES IT! Assist: Joel Morant
Score: 33-26

[09:56] Team_019 possession (Score: 33-26)
Tobias Hyland drives, picks up Larry Westbrook. Help arrives from Julius Green! Tobias Hyland attempts a Dunk. Wide open! Julius Green is 10.0 feet away. [MAN] TOBIAS HYLAND MAKES IT! Assist: Rudy Giddey
Score: 33-28

[09:41] Team_060 possession (Score: 33-28)
FOUL! Holding foul on Brandon James. [Team fouls: 3] No free throws, side out. (Brandon James: 1 personal fouls)

[09:24] Team_060 possession (Score: 33-28)
Jaren George throws a bad pass! Stolen by DeMar James! TURNOVER! (live ball)

[09:08] Team_019 possession (Score: 33-28)
Brandon James attempts a 3Pt. Contested by Julius Green (4.9 feet, MAN). Brandon James misses. Offensive rebound by DeMar James! DeMar James kicks it out.

[08:54] Team_019 possession (Score: 33-28)
Rudy Giddey drives, Jaren George stays with him. Rudy Giddey attempts a Layup. Wide open! Jaren George is 6.7 feet away. [ZONE] RUDY GIDDEY MAKES IT! Assist: Tobias Hyland
Score: 33-30

[08:42] Team_060 possession (Score: 33-30)
Julius Green attempts a Midrange. Heavily contested by Brandon James (1.6 feet, MAN)! Julius Green misses. Rebound secured by DeMar James.

[08:31] Team_019 possession (Score: 33-30)
D'Angelo Randle attempts a 3Pt. Wide open! Julius Green is 10.0 feet away. [ZONE] D'ANGELO RANDLE MAKES IT! Assist: DeMar James
Score: 33-33

[08:17] Team_060 possession (Score: 33-33)
Joel Morant attempts a 3Pt. Contested by D'Angelo Randle (5.5 feet, ZONE). Joel Morant misses. Offensive rebound by Jaren George! Jaren George kicks it out.

[08:07] Team_060 possession (Score: 33-33)
Joel Morant drives and kicks out. Jaren George attempts a 3Pt. Contested by DeMar James (4.2 feet, MAN). Jaren George misses. Rebound secured by DeMar James.

[07:51] Team_019 possession (Score: 33-33)
DeMar James drives and kicks out. D'Angelo Randle attempts a Midrange. Contested by Immanuel Ming (2.7 feet, MAN). D'ANGELO RANDLE MAKES IT! Assist: Rudy Giddey
Score: 33-35

[07:39] Team_060 possession (Score: 33-35)
Immanuel Ming attempts a 3Pt. Contested by D'Angelo Randle (2.6 feet, MAN). Immanuel Ming misses. Rebound secured by DeMar James.

[07:23] Team_019 possession (Score: 33-35)
D'Angelo Randle attempts a 3Pt. Heavily contested by Julius Green (1.6 feet, ZONE)! D'Angelo Randle misses. Rebound secured by Jaren George.

[07:06] Team_060 possession (Score: 33-35)
Jaren George drives to the basket... Jaren George commits a violation (traveling/carry)! TURNOVER! (dead ball)

[07:06] Substitution (Team_060): Joel Morant OUT → Domantas Barnes IN (stamina_rule2)

[07:06] Substitution (Team_060): Julius Green OUT → Rudy Ginobili IN (stamina_rule2)

[07:06] Substitution (Team_060): Immanuel Ming OUT → Jarrett Wagner IN (stamina_rule2)

[07:06] Substitution (Team_060): Larry Westbrook OUT → Yao Tatum IN (stamina_rule2)

[07:06] Substitution (Team_060): Jaren George OUT → Klay Haliburton IN (stamina_rule2)

[07:06] Substitution (Team_019): Rudy Giddey OUT → Gary Ginobili IN (stamina_rule2)

[07:06] Substitution (Team_019): Brandon James OUT → Jalen Turner IN (stamina_rule2)

[07:06] Substitution (Team_019): D'Angelo Randle OUT → Blake LaVine IN (stamina_rule2)

[07:06] Substitution (Team_019): Tobias Hyland OUT → Shai Ingram IN (stamina_rule2)

[07:06] Substitution (Team_019): DeMar James OUT → Tim Jordan IN (stamina_rule2)

[06:51] Team_019 possession (Score: 33-35)
Tim Jordan attempts a Midrange. Contested by Klay Haliburton (5.7 feet, MAN). Tim Jordan misses. Rebound secured by Rudy Ginobili.

[06:39] Team_060 possession (Score: 33-35)
Jarrett Wagner attempts a Layup. Contested by Blake LaVine (4.1 feet, MAN). JARRETT WAGNER MAKES IT!
Score: 35-35

[06:24] Team_019 possession (Score: 35-35)
Jalen Turner attempts a 3Pt. Wide open! Domantas Barnes is 7.2 feet away. [ZONE] Jalen Turner misses. Rebound secured by Domantas Barnes.

[06:13] Team_060 possession (Score: 35-35)
Klay Haliburton makes the Midrange and draws the foul on Shai Ingram! And-1! Klay Haliburton to the line for 1. [Team fouls: 4] (Shai Ingram: 1 personal fouls)   FT 1/1: GOOD Klay Haliburton makes 1/1 from the line.
Score: 38-35

[05:57] Team_019 possession (Score: 38-35)
FOUL! Offensive foul on Shai Ingram! Yao Tatum drew the charge! [Team fouls: 5] (Shai Ingram: 2 personal fouls) TURNOVER! (dead ball)

[05:41] Team_060 possession (Score: 38-35)
Jarrett Wagner attempts a 3Pt. Contested by Blake LaVine (4.9 feet, ZONE). JARRETT WAGNER MAKES IT! Assist: Klay Haliburton
Score: 41-35

[05:26] Team_019 possession (Score: 41-35)
Blake LaVine attempts a 3Pt. Contested by Jarrett Wagner (4.8 feet, MAN). Blake LaVine misses. Rebound secured by Domantas Barnes.

[05:12] Team_060 possession (Score: 41-35)
Klay Haliburton commits a violation (traveling/carry)! TURNOVER! (dead ball)

[05:00] Team_019 possession (Score: 41-35)
Jalen Turner attempts a 3Pt. Contested by Domantas Barnes (4.4 feet, ZONE). Jalen Turner misses. Rebound secured by Klay Haliburton.

[04:44] Team_060 possession (Score: 41-35)
Rudy Ginobili drives, picks up Jalen Turner. Help arrives from Blake LaVine! Rudy Ginobili attempts a Layup. Contested by Blake LaVine (4.5 feet, MAN). RUDY GINOBILI MAKES IT! Assist: Yao Tatum
Score: 43-35

[04:26] Team_019 possession (Score: 43-35)
Gary Ginobili throws a bad pass! Stolen by Domantas Barnes! TURNOVER! (live ball)

[04:14] Team_060 possession (Score: 43-35)
Yao Tatum attempts a Midrange. Contested by Shai Ingram (3.8 feet, MAN). YAO TATUM MAKES IT!
Score: 45-35

[03:59] Team_019 possession (Score: 45-35)
Tim Jordan attempts a Midrange. Contested by Rudy Ginobili (5.9 feet, ZONE). Tim Jordan misses. FOUL! Loose ball foul on Rudy Ginobili during the rebound battle. [Team fouls: 2] No free throws, side out. (Rudy Ginobili: 1 personal fouls)

[03:44] Team_019 possession (Score: 45-35)
FOUL! Reach-in foul on Klay Haliburton during the drive. [Team fouls: 3] No free throws, side out. (Klay Haliburton: 1 personal fouls)

[03:31] Team_019 possession (Score: 45-35)
Jalen Turner attempts a 3Pt. Wide open! Domantas Barnes is 7.7 feet away. [ZONE] JALEN TURNER MAKES IT! Assist: Tim Jordan
Score: 45-38

[03:15] Team_060 possession (Score: 45-38)
Jarrett Wagner attempts a 3Pt. Contested by Blake LaVine (4.4 feet, ZONE). Jarrett Wagner misses. Rebound secured by Tim Jordan.

[02:56] Team_019 possession (Score: 45-38)
Shai Ingram drives, picks up Yao Tatum. Help arrives from Domantas Barnes! Shai Ingram attempts a Dunk. Contested by Domantas Barnes (4.9 feet, MAN). SHAI INGRAM MAKES IT! Assist: Tim Jordan
Score: 45-40

[02:39] Team_060 possession (Score: 45-40)
Klay Haliburton drives, Shai Ingram stays with him. Klay Haliburton attempts a Layup. Contested by Shai Ingram (2.3 feet, MAN). Klay Haliburton misses. Offensive rebound by Klay Haliburton! Klay Haliburton puts it back in!
Score: 47-40

[02:21] Team_019 possession (Score: 47-40)
Shai Ingram attempts a 3Pt. Contested by Yao Tatum (5.1 feet, MAN). Shai Ingram misses. Rebound secured by Klay Haliburton.

[02:05] Team_060 possession (Score: 47-40)
Domantas Barnes attempts a 3Pt. Wide open! Gary Ginobili is 7.1 feet away. [MAN] Domantas Barnes misses. Offensive rebound by Klay Haliburton! Klay Haliburton's putback is no good. Rebound secured by Tim Jordan.

[01:54] Team_019 possession (Score: 47-40)
Blake LaVine attempts a Midrange. Wide open! Jarrett Wagner is 9.4 feet away. [MAN] BLAKE LAVINE MAKES IT!
Score: 47-42

[01:42] Team_060 possession (Score: 47-42)
Klay Haliburton drives and kicks out. Yao Tatum attempts a Midrange. Contested by Jalen Turner (4.6 feet, ZONE). Yao Tatum misses. Rebound secured by Blake LaVine.

[01:28] Team_019 possession (Score: 47-42)
Blake LaVine drives, Jarrett Wagner stays with him. Blake LaVine attempts a Layup. Contested by Jarrett Wagner (5.0 feet, MAN). Blake LaVine misses. Rebound secured by Rudy Ginobili.

[01:15] Team_060 possession (Score: 47-42)
Klay Haliburton loses control! Ball rolls out of bounds! TURNOVER! (dead ball)

[01:01] Team_019 possession (Score: 47-42)
Jalen Turner attempts a 3Pt. Contested by Domantas Barnes (5.0 feet, ZONE). Jalen Turner misses. Offensive rebound by Tim Jordan! Tim Jordan kicks it out.

[00:45] Team_019 possession (Score: 47-42)
Shai Ingram attempts a Midrange. Contested by Jarrett Wagner (4.9 feet, ZONE). SHAI INGRAM MAKES IT! Assist: Gary Ginobili
Score: 47-44

[00:31] Team_060 possession (Score: 47-44)
Klay Haliburton attempts a Midrange. Contested by Shai Ingram (3.8 feet, MAN). KLAY HALIBURTON MAKES IT!
Score: 49-44

[00:15] Team_019 possession (Score: 49-44)
Gary Ginobili attempts a 3Pt. Contested by Domantas Barnes (3.5 feet, MAN). Gary Ginobili misses. Rebound secured by Klay Haliburton.

================================================================================
                              2ND QUARTER COMPLETE                              
================================================================================

2ND QUARTER SCORE: Team_060 22, Team_019 18

BOX SCORE:
================================================================================

Team_060
--------------------------------------------------------------------------------
Player                MIN  PTS  REB  AST  TO      FG   FG%      3P   3P%
--------------------------------------------------------------------------------
Klay Haliburton         7    7    4    1   0   3/4    75.0     0/0   0.0
Jarrett Wagner          7    5    0    0   0   2/3    66.7     0/0   0.0
Julius Green           17    2    0    0   0   1/3    33.3     0/0   0.0
Immanuel Ming          17    2    1    0   0   1/2    50.0     0/0   0.0
Larry Westbrook        17    2    0    0   0   1/1   100.0     0/0   0.0
Rudy Ginobili           7    2    2    0   0   1/1   100.0     0/0   0.0
Yao Tatum               7    2    0    1   0   1/1   100.0     0/0   0.0
Jaren George           17    0    5    0   0   0/0     0.0     0/0   0.0
Joel Morant            17    0    0    1   0   0/1     0.0     0/0   0.0
Domantas Barnes         7    0    2    0   0   0/1     0.0     0/0   0.0

TEAM: FG: 10/17 (58.8%), 3PT: 2/5 (40.0%), REB: 15 (4 off, 11 def), AST: 3, TO: 4
TEAM FOULS: 3


Team_019
--------------------------------------------------------------------------------
Player                MIN  PTS  REB  AST  TO      FG   FG%      3P   3P%
--------------------------------------------------------------------------------
D'Angelo Randle        17    5    0    0   0   2/5    40.0     0/0   0.0
Shai Ingram             7    4    0    0   0   2/3    66.7     0/0   0.0
Jalen Turner            7    3    0    0   0   1/3    33.3     0/0   0.0
Tobias Hyland          17    2    0    1   0   1/2    50.0     0/0   0.0
Rudy Giddey            17    2    0    2   0   1/1   100.0     0/0   0.0
Blake LaVine            7    2    1    0   0   1/3    33.3     0/0   0.0
DeMar James            17    0    5    1   0   0/0     0.0     0/0   0.0
Tim Jordan              7    0    4    2   0   0/1     0.0     0/0   0.0
Gary Ginobili           7    0    0    1   0   0/1     0.0     0/0   0.0

TEAM: FG: 8/19 (42.1%), 3PT: 2/9 (22.2%), REB: 9 (3 off, 6 def), AST: 7, TO: 2
TEAM FOULS: 5 [Team_060 in BONUS]

================================================================================

================================================================================
                       3RD QUARTER - Team_060 vs Team_019                       
================================================================================

[12:00] Team_060 possession (Score: 49-44)
Immanuel Ming attempts a 3Pt. Contested by D'Angelo Randle (5.1 feet, ZONE). Immanuel Ming misses. Offensive rebound by Immanuel Ming! Immanuel Ming kicks it out.

[11:42] Team_060 possession (Score: 49-44)
FOUL! Offensive foul on Immanuel Ming! D'Angelo Randle drew the charge! [Team fouls: 1] (Immanuel Ming: 1 personal fouls) TURNOVER! (dead ball)

[11:26] Team_019 possession (Score: 49-44)
Brandon James attempts a Layup. Wide open! Jaren George is 6.4 feet away. [ZONE] Brandon James misses. Rebound secured by Larry Westbrook.

[11:12] Team_060 possession (Score: 49-44)
Jaren George makes the Layup and draws the foul on DeMar James! And-1! Jaren George to the line for 1. [Team fouls: 1] (DeMar James: 1 personal fouls)   FT 1/1: GOOD Jaren George makes 1/1 from the line.
Score: 52-44

[11:01] Team_019 possession (Score: 52-44)
Brandon James drives to the basket... Brandon James loses control! Ball rolls out of bounds! TURNOVER! (dead ball)

[10:47] Team_060 possession (Score: 52-44)
Joel Morant attempts a Midrange. Contested by Rudy Giddey (3.7 feet, MAN). JOEL MORANT MAKES IT!
Score: 54-44

[10:30] Team_019 possession (Score: 54-44)
Rudy Giddey drives, Jaren George stays with him. Rudy Giddey attempts a Layup. Wide open! Jaren George is 6.2 feet away. [ZONE] RUDY GIDDEY MAKES IT! Assist: Tobias Hyland
Score: 54-46

[10:14] Team_060 possession (Score: 54-46)
Joel Morant attempts a Layup. Wide open! Rudy Giddey is 10.0 feet away. [MAN] JOEL MORANT MAKES IT! Assist: Jaren George
Score: 56-46

[10:00] Team_019 possession (Score: 56-46)
Brandon James drives, Jaren George stays with him. Brandon James attempts a Layup. Wide open! Jaren George is 6.1 feet away. [ZONE] BRANDON JAMES MAKES IT!
Score: 56-48

[09:48] Team_060 possession (Score: 56-48)
Julius Green attempts a 3Pt. Contested by D'Angelo Randle (4.8 feet, ZONE). Julius Green misses. Rebound secured by Tobias Hyland.

[09:31] Team_019 possession (Score: 56-48)
Tobias Hyland attempts a Midrange. Contested by Larry Westbrook (5.9 feet, MAN). Tobias Hyland misses. Rebound secured by Immanuel Ming.

[09:19] Team_060 possession (Score: 56-48)
FOUL! Offensive foul on Immanuel Ming! D'Angelo Randle drew the charge! [Team fouls: 2] (Immanuel Ming: 2 personal fouls) TURNOVER! (dead ball)

[09:02] Team_019 possession (Score: 56-48)
D'Angelo Randle drives and kicks out. Brandon James attempts a 3Pt. Contested by Julius Green (4.8 feet, MAN). Brandon James misses. Rebound secured by Immanuel Ming.

[08:53] Team_060 possession (Score: 56-48)
Immanuel Ming attempts a Midrange. Contested by Tobias Hyland (5.8 feet, ZONE). Immanuel Ming misses. Rebound secured by DeMar James.

[08:39] Team_019 possession (Score: 56-48)
Brandon James attempts a Midrange. Contested by Julius Green (2.0 feet, MAN). Brandon James misses. Rebound secured by Jaren George.

[08:27] Team_060 possession (Score: 56-48)
Joel Morant attempts a 3Pt. Contested by Tobias Hyland (2.9 feet, ZONE). Joel Morant misses. Rebound secured by Tobias Hyland.

[08:17] Team_019 possession (Score: 56-48)
Tobias Hyland attempts a Midrange. BLOCKED BY LARRY WESTBROOK! Ball is loose! Offensive rebound by DeMar James! DeMar James kicks it out.

[08:01] Team_019 possession (Score: 56-48)
Rudy Giddey drives, picks up Joel Morant. Help arrives from Immanuel Ming! Rudy Giddey attempts a Dunk. Wide open! Immanuel Ming is 9.0 feet away. [MAN] RUDY GIDDEY MAKES IT! Assist: Brandon James
Score: 56-50

[07:47] Team_060 possession (Score: 56-50)
Joel Morant makes the Layup and draws the foul on DeMar James! And-1! Joel Morant to the line for 1. [Team fouls: 2] (DeMar James: 2 personal fouls)   FT 1/1: GOOD Joel Morant makes 1/1 from the line.
Score: 59-50

[07:30] Team_019 possession (Score: 59-50)
Brandon James attempts a Layup. Contested by Julius Green (5.7 feet, MAN). BRANDON JAMES MAKES IT! Assist: D'Angelo Randle
Score: 59-52

[07:15] Team_060 possession (Score: 59-52)
Larry Westbrook attempts a 3Pt. Wide open! Tobias Hyland is 9.6 feet away. [MAN] Larry Westbrook misses. Rebound secured by D'Angelo Randle.

[06:56] Team_019 possession (Score: 59-52)
FOUL! Shooting foul on Julius Green. DeMar James to the line for 2 free throws. [Team fouls: 3] (Julius Green: 1 personal fouls)   FT 1/2: GOOD   FT 2/2: GOOD DeMar James makes 2/2 from the line.
Score: 59-54

[06:42] Team_060 possession (Score: 59-54)
FOUL! Holding foul on Rudy Giddey. [Team fouls: 3] No free throws, side out. (Rudy Giddey: 1 personal fouls)

[06:26] Team_060 possession (Score: 59-54)
Julius Green attempts a Midrange. Contested by Brandon James (6.0 feet, MAN). JULIUS GREEN MAKES IT! Assist: Jaren George
Score: 61-54

[06:12] Team_019 possession (Score: 61-54)
D'Angelo Randle attempts a Layup. Wide open! Jaren George is 9.5 feet away. [ZONE] D'Angelo Randle misses. Rebound secured by Jaren George.

[05:57] Team_060 possession (Score: 61-54)
Immanuel Ming drives to the basket... Immanuel Ming loses control! Ball rolls out of bounds! TURNOVER! (dead ball)

[05:39] Team_019 possession (Score: 61-54)
D'Angelo Randle attempts a 3Pt. Contested by Immanuel Ming (4.0 feet, MAN). D'ANGELO RANDLE MAKES IT! Assist: Tobias Hyland
Score: 61-57

[05:25] Team_060 possession (Score: 61-57)
Julius Green drives to the basket... Julius Green loses the ball! Stripped by Brandon James! TURNOVER! (live ball)

[05:08] Team_019 possession (Score: 61-57)
Brandon James attempts a 3Pt. Contested by Julius Green (3.8 feet, ZONE). BRANDON JAMES MAKES IT!
Score: 61-60

[04:52] Team_060 possession (Score: 61-60)
Immanuel Ming throws a bad pass! Stolen by D'Angelo Randle! TURNOVER! (live ball)

[04:39] Team_019 possession (Score: 61-60)
Tobias Hyland attempts a 3Pt. Contested by Larry Westbrook (5.7 feet, MAN). Tobias Hyland misses. Rebound secured by Jaren George.

[04:21] Team_060 possession (Score: 61-60)
Joel Morant attempts a Layup. BLOCKED BY BRANDON JAMES! Ball is loose! Offensive rebound by Immanuel Ming! Immanuel Ming kicks it out.

[04:04] Team_060 possession (Score: 61-60)
Jaren George attempts a Layup. Wide open! DeMar James is 8.6 feet away. [ZONE] JAREN GEORGE MAKES IT!
Score: 63-60

[03:52] Team_019 possession (Score: 63-60)
D'Angelo Randle attempts a 3Pt. Contested by Immanuel Ming (5.5 feet, MAN). D'ANGELO RANDLE MAKES IT! Assist: Brandon James
Score: 63-63

[03:37] Team_060 possession (Score: 63-63)
Immanuel Ming attempts a 3Pt. Contested by D'Angelo Randle (3.5 feet, MAN). Immanuel Ming misses. Rebound secured by DeMar James.

[03:18] Team_019 possession (Score: 63-63)
DeMar James drives and kicks out. D'Angelo Randle makes the Midrange and draws the foul on Julius Green! And-1! D'Angelo Randle to the line for 1. [Team fouls: 4] (Julius Green: 2 personal fouls)   FT 1/1: GOOD D'Angelo Randle makes 1/1 from the line.
Score: 63-66

[03:02] Team_060 possession (Score: 63-66)
Jaren George attempts a Layup. Contested by DeMar James (5.8 feet, ZONE). Jaren George misses. Offensive rebound by Jaren George! Jaren George's putback is no good. Offensive rebound by Immanuel Ming! Immanuel Ming kicks it out.

[02:48] Team_060 possession (Score: 63-66)
Larry Westbrook attempts a Midrange. Contested by Tobias Hyland (2.9 feet, MAN). Larry Westbrook misses. Rebound secured by DeMar James.

[02:33] Team_019 possession (Score: 63-66)
DeMar James attempts a Midrange. Wide open! Jaren George is 6.1 feet away. [MAN] DEMAR JAMES MAKES IT! Assist: Brandon James
Score: 63-68

[02:24] Team_060 possession (Score: 63-68)
Larry Westbrook attempts a 3Pt. Wide open! Tobias Hyland is 9.7 feet away. [MAN] Larry Westbrook misses. Offensive rebound by Jaren George! Jaren George puts it back in!
Score: 65-68

[02:13] Team_019 possession (Score: 65-68)
Rudy Giddey attempts a Midrange. Wide open! Joel Morant is 9.0 feet away. [MAN] RUDY GIDDEY MAKES IT!
Score: 65-70

[01:57] Team_060 possession (Score: 65-70)
Joel Morant drives, picks up Rudy Giddey. Help arrives from D'Angelo Randle! Joel Morant attempts a Dunk. Contested by D'Angelo Randle (2.4 feet, MAN). Joel Morant misses. Rebound secured by DeMar James.

[01:41] Team_019 possession (Score: 65-70)
FOUL! Holding foul on Jaren George. [IN THE BONUS! 5 team fouls] DeMar James to the line for 2 free throws. (Jaren George: 1 personal fouls)   FT 1/2: GOOD   FT 2/2: GOOD DeMar James makes 2/2 from the line.
Score: 65-72

[01:24] Team_060 possession (Score: 65-72)
Joel Morant attempts a 3Pt. Contested by Rudy Giddey (2.9 feet, MAN). JOEL MORANT MAKES IT! Assist: Julius Green
Score: 68-72

[01:10] Team_019 possession (Score: 68-72)
Brandon James drives, picks up Jaren George. Help arrives from Julius Green! Brandon James attempts a Layup. Contested by Julius Green (4.6 feet, ZONE). Brandon James misses. Rebound secured by Larry Westbrook.

[00:53] Team_060 possession (Score: 68-72)
Joel Morant makes the 3Pt and draws the foul on Rudy Giddey! And-1! Joel Morant to the line for 1. [BONUS: 5 team fouls] (Rudy Giddey: 2 personal fouls)   FT 1/1: MISS Joel Morant makes 0/1 from the line. Rebound secured by Tobias Hyland.
Score: 71-72

[00:40] Team_019 possession (Score: 71-72)
Tobias Hyland attempts a Layup. BLOCKED BY LARRY WESTBROOK! Ball is loose! Offensive rebound by D'Angelo Randle! D'Angelo Randle kicks it out.

[00:25] Team_019 possession (Score: 71-72)
Rudy Giddey drives, Joel Morant stays with him. Rudy Giddey attempts a Layup. Contested by Joel Morant (3.8 feet, MAN). Rudy Giddey misses. Rebound secured by Jaren George.

[00:14] Team_060 possession (Score: 71-72)
Larry Westbrook attempts a Layup. Contested by Tobias Hyland (5.8 feet, MAN). LARRY WESTBROOK MAKES IT! Assist: Immanuel Ming
Score: 73-72

[00:03] Team_019 possession (Score: 73-72)
Rudy Giddey attempts a 3Pt. Contested by Julius Green (2.9 feet, ZONE). Rudy Giddey misses. Offensive rebound by DeMar James! DeMar James kicks it out.

================================================================================
                              3RD QUARTER COMPLETE                              
================================================================================

3RD QUARTER SCORE: Team_060 24, Team_019 28

BOX SCORE:
================================================================================

Team_060
--------------------------------------------------------------------------------
Player                MIN  PTS  REB  AST  TO      FG   FG%      3P   3P%
--------------------------------------------------------------------------------
Joel Morant            29   10    0    0   0   4/7    57.1     0/0   0.0
Jaren George           29    7    5    2   0   3/3   100.0     0/0   0.0
Larry Westbrook        29    2    2    0   0   1/3    33.3     0/0   0.0
Julius Green           29    2    0    1   0   1/2    50.0     0/0   0.0
Immanuel Ming          29    0    5    1   0   0/2     0.0     0/0   0.0

TEAM: FG: 9/17 (52.9%), 3PT: 2/7 (28.6%), REB: 12 (4 off, 8 def), AST: 4, TO: 5
TEAM FOULS: 5 [Team_019 in BONUS]


Team_019
--------------------------------------------------------------------------------
Player                MIN  PTS  REB  AST  TO      FG   FG%      3P   3P%
--------------------------------------------------------------------------------
D'Angelo Randle        29    9    2    1   0   3/5    60.0     0/0   0.0
Brandon James          29    7    0    3   0   3/6    50.0     0/0   0.0
Rudy Giddey            29    6    0    0   0   3/4    75.0     0/0   0.0
DeMar James            29    6    6    0   0   3/3   100.0     0/0   0.0
Tobias Hyland          29    0    3    2   0   0/2     0.0     0/0   0.0

TEAM: FG: 12/20 (60.0%), 3PT: 3/4 (75.0%), REB: 11 (3 off, 8 def), AST: 6, TO: 1
TEAM FOULS: 5 [Team_060 in BONUS]

================================================================================

================================================================================
                       4TH QUARTER - Team_060 vs Team_019                       
================================================================================

[12:00] Team_060 possession (Score: 73-72)
Larry Westbrook attempts a 3Pt. Wide open! Tobias Hyland is 6.8 feet away. [MAN] Larry Westbrook misses. Rebound secured by D'Angelo Randle.

[11:45] Team_019 possession (Score: 73-72)
Tobias Hyland attempts a 3Pt. Heavily contested by Julius Green (1.2 feet, ZONE)! Tobias Hyland misses. Rebound secured by Larry Westbrook.

[11:26] Team_060 possession (Score: 73-72)
Immanuel Ming makes the Layup and draws the foul on Brandon James! And-1! Immanuel Ming to the line for 1. [Team fouls: 1] (Brandon James: 1 personal fouls)   FT 1/1: MISS Immanuel Ming makes 0/1 from the line. Rebound secured by DeMar James.
Score: 75-72

[11:13] Team_019 possession (Score: 75-72)
Tobias Hyland attempts a 3Pt. Wide open! Julius Green is 6.8 feet away. [ZONE] Tobias Hyland misses. Rebound secured by Larry Westbrook.

[11:01] Team_060 possession (Score: 75-72)
Jaren George attempts a Midrange. Wide open! DeMar James is 6.4 feet away. [MAN] JAREN GEORGE MAKES IT! Assist: Joel Morant
Score: 77-72

[10:47] Team_019 possession (Score: 77-72)
Tobias Hyland attempts a Layup. Contested by Larry Westbrook (4.9 feet, MAN). TOBIAS HYLAND MAKES IT! Assist: Rudy Giddey
Score: 77-74

[10:29] Team_060 possession (Score: 77-74)
Jaren George drives, DeMar James stays with him. Jaren George attempts a Layup. Contested by DeMar James (3.1 feet, ZONE). Jaren George misses. Rebound secured by D'Angelo Randle.

[10:13] Team_019 possession (Score: 77-74)
D'Angelo Randle attempts a Layup. Heavily contested by Immanuel Ming (1.8 feet, MAN)! D'ANGELO RANDLE MAKES IT!
Score: 77-76

[10:03] Team_060 possession (Score: 77-76)
Immanuel Ming drives and kicks out. Joel Morant attempts a 3Pt. Wide open! Rudy Giddey is 8.9 feet away. [MAN] Joel Morant misses. Rebound secured by D'Angelo Randle.

[09:48] Team_019 possession (Score: 77-76)
FOUL! Offensive foul on D'Angelo Randle! Immanuel Ming drew the charge! [Team fouls: 2] (D'Angelo Randle: 1 personal fouls) TURNOVER! (dead ball)

[09:36] Team_060 possession (Score: 77-76)
Joel Morant attempts a 3Pt. Wide open! Rudy Giddey is 8.2 feet away. [MAN] JOEL MORANT MAKES IT! Assist: Immanuel Ming
Score: 80-76

[09:19] Team_019 possession (Score: 80-76)
D'Angelo Randle attempts a Midrange. Wide open! Immanuel Ming is 6.0 feet away. [ZONE] D'ANGELO RANDLE MAKES IT!
Score: 80-78

[09:05] Team_060 possession (Score: 80-78)
Larry Westbrook attempts a 3Pt. Wide open! D'Angelo Randle is 7.4 feet away. [ZONE] Larry Westbrook misses. Rebound secured by DeMar James.

[08:49] Team_019 possession (Score: 80-78)
D'Angelo Randle attempts a 3Pt. Contested by Immanuel Ming (4.9 feet, MAN). D'Angelo Randle misses. Rebound secured by Immanuel Ming.

[08:34] Team_060 possession (Score: 80-78)
Julius Green attempts a 3Pt. Contested by Brandon James (4.8 feet, MAN). JULIUS GREEN MAKES IT! Assist: Larry Westbrook
Score: 83-78

[08:20] Team_019 possession (Score: 83-78)
DeMar James drives, Jaren George stays with him. DeMar James attempts a Layup. Wide open! Jaren George is 6.7 feet away. [MAN] DeMar James misses. Rebound secured by Immanuel Ming.

[08:04] Team_060 possession (Score: 83-78)
Immanuel Ming drives to the basket... Immanuel Ming loses the ball! Stripped by D'Angelo Randle! TURNOVER! (live ball)

[07:51] Team_019 possession (Score: 83-78)
DeMar James attempts a Midrange. Contested by Julius Green (3.7 feet, ZONE). DEMAR JAMES MAKES IT!
Score: 83-80

[07:40] Team_060 possession (Score: 83-80)
Larry Westbrook attempts a 3Pt. Contested by D'Angelo Randle (4.5 feet, ZONE). Larry Westbrook misses. Rebound secured by Tobias Hyland.

[07:28] Team_019 possession (Score: 83-80)
Rudy Giddey attempts a Midrange. Wide open! Joel Morant is 8.6 feet away. [MAN] Rudy Giddey misses. Rebound secured by Larry Westbrook.

[07:17] Team_060 possession (Score: 83-80)
Larry Westbrook drives to the basket... Larry Westbrook throws a bad pass out of bounds! TURNOVER! (dead ball)

[07:17] Substitution (Team_060): Joel Morant OUT → Domantas Barnes IN (stamina_rule2)

[07:17] Substitution (Team_060): Julius Green OUT → Rudy Ginobili IN (stamina_rule2)

[07:17] Substitution (Team_060): Immanuel Ming OUT → Jarrett Wagner IN (stamina_rule2)

[07:17] Substitution (Team_060): Larry Westbrook OUT → Yao Tatum IN (stamina_rule2)

[07:17] Substitution (Team_060): Jaren George OUT → Klay Haliburton IN (stamina_rule2)

[07:17] Substitution (Team_019): Rudy Giddey OUT → Gary Ginobili IN (stamina_rule2)

[07:17] Substitution (Team_019): Brandon James OUT → Jalen Turner IN (stamina_rule2)

[07:17] Substitution (Team_019): D'Angelo Randle OUT → Blake LaVine IN (stamina_rule2)

[07:17] Substitution (Team_019): Tobias Hyland OUT → Shai Ingram IN (stamina_rule2)

[07:17] Substitution (Team_019): DeMar James OUT → Tim Jordan IN (stamina_rule2)

[07:00] Team_019 possession (Score: 83-80)
Tim Jordan drives to the basket... FOUL! Offensive foul on Tim Jordan! Klay Haliburton drew the charge! [Team fouls: 3] (Tim Jordan: 1 personal fouls) TURNOVER! (dead ball)

[06:43] Team_060 possession (Score: 83-80)
Klay Haliburton makes the Layup and draws the foul on Shai Ingram! And-1! Klay Haliburton to the line for 1. [Team fouls: 4] (Shai Ingram: 1 personal fouls)   FT 1/1: GOOD Klay Haliburton makes 1/1 from the line.
Score: 86-80

[06:29] Team_019 possession (Score: 86-80)
Gary Ginobili drives and kicks out. Shai Ingram attempts a 3Pt. Contested by Jarrett Wagner (3.8 feet, ZONE). SHAI INGRAM MAKES IT! Assist: Jalen Turner
Score: 86-83

[06:14] Team_060 possession (Score: 86-83)
Yao Tatum drives, picks up Shai Ingram. Help arrives from Jalen Turner! Yao Tatum attempts a Layup. Contested by Jalen Turner (3.3 feet, MAN). YAO TATUM MAKES IT! Assist: Domantas Barnes
Score: 88-83

[05:58] Team_019 possession (Score: 88-83)
Tim Jordan attempts a Layup. Contested by Klay Haliburton (2.3 feet, MAN). Tim Jordan misses. Rebound secured by Rudy Ginobili.

[05:47] Team_060 possession (Score: 88-83)
Jarrett Wagner attempts a Layup. Contested by Shai Ingram (6.0 feet, ZONE). JARRETT WAGNER MAKES IT! Assist: Rudy Ginobili
Score: 90-83

[05:33] Team_019 possession (Score: 90-83)
Gary Ginobili attempts a 3Pt. Contested by Domantas Barnes (2.1 feet, ZONE). Gary Ginobili misses. Rebound secured by Rudy Ginobili.

[05:20] Team_060 possession (Score: 90-83)
FOUL! Holding foul on Jalen Turner. [IN THE BONUS! 5 team fouls] Rudy Ginobili to the line for 2 free throws. (Jalen Turner: 1 personal fouls)   FT 1/2: MISS   FT 2/2: GOOD Rudy Ginobili makes 1/2 from the line.
Score: 91-83

[05:05] Team_019 possession (Score: 91-83)
Jalen Turner attempts a 3Pt. Contested by Domantas Barnes (5.9 feet, ZONE). Jalen Turner misses. Rebound secured by Rudy Ginobili.

[04:51] Team_060 possession (Score: 91-83)
FOUL! Shooting foul on Blake LaVine. Jarrett Wagner to the line for 3 free throws. [BONUS: 6 team fouls] (Blake LaVine: 1 personal fouls)   FT 1/3: GOOD   FT 2/3: GOOD   FT 3/3: GOOD Jarrett Wagner makes 3/3 from the line.
Score: 94-83

[04:32] Team_019 possession (Score: 94-83)
Tim Jordan attempts a Layup. BLOCKED BY KLAY HALIBURTON! Ball deflects out of bounds off Tim Jordan.

[04:17] Team_060 possession (Score: 94-83)
FOUL! Holding foul on Blake LaVine. [IN THE BONUS! 7 team fouls] Jarrett Wagner to the line for 2 free throws. (Blake LaVine: 2 personal fouls)   FT 1/2: GOOD   FT 2/2: GOOD Jarrett Wagner makes 2/2 from the line.
Score: 96-83

[04:02] Team_019 possession (Score: 96-83)
Gary Ginobili attempts a 3Pt. Wide open! Domantas Barnes is 6.9 feet away. [ZONE] Gary Ginobili misses. Rebound secured by Klay Haliburton.

[03:47] Team_060 possession (Score: 96-83)
Jarrett Wagner drives to the basket... Jarrett Wagner throws a bad pass! Stolen by Shai Ingram! TURNOVER! (live ball)

[03:32] Team_019 possession (Score: 96-83)
FOUL! Shooting foul on Domantas Barnes. Gary Ginobili to the line for 3 free throws. [Team fouls: 1] (Domantas Barnes: 1 personal fouls)   FT 1/3: GOOD   FT 2/3: GOOD   FT 3/3: GOOD Gary Ginobili makes 3/3 from the line.
Score: 96-86

[03:19] Team_060 possession (Score: 96-86)
Klay Haliburton attempts a Layup. Wide open! Shai Ingram is 6.7 feet away. [MAN] KLAY HALIBURTON MAKES IT!
Score: 98-86

[03:07] Team_019 possession (Score: 98-86)
FOUL! Shooting foul on Klay Haliburton. Tim Jordan to the line for 2 free throws. [Team fouls: 2] (Klay Haliburton: 1 personal fouls)   FT 1/2: GOOD   FT 2/2: MISS Tim Jordan makes 1/2 from the line. Rebound secured by Domantas Barnes.
Score: 98-87

[02:49] Team_060 possession (Score: 98-87)
Jarrett Wagner attempts a Layup. Contested by Blake LaVine (4.7 feet, MAN). JARRETT WAGNER MAKES IT!
Score: 100-87

[02:38] Team_019 possession (Score: 100-87)
FOUL! Holding foul on Domantas Barnes. [Team fouls: 3] No free throws, side out. (Domantas Barnes: 2 personal fouls)

[02:25] Team_019 possession (Score: 100-87)
FOUL! Holding foul on Klay Haliburton. [Team fouls: 4] No free throws, side out. (Klay Haliburton: 2 personal fouls)

[02:11] Team_019 possession (Score: 100-87)
Gary Ginobili attempts a 3Pt. Contested by Domantas Barnes (2.8 feet, MAN). GARY GINOBILI MAKES IT! Assist: Jalen Turner
Score: 100-90

[01:55] Team_060 possession (Score: 100-90)
Rudy Ginobili attempts a 3Pt. Wide open! Shai Ingram is 7.4 feet away. [ZONE] Rudy Ginobili misses. Rebound secured by Shai Ingram.

[01:44] Team_019 possession (Score: 100-90)
Shai Ingram drives to the basket... Shai Ingram throws a bad pass! Stolen by Yao Tatum! TURNOVER! (live ball)

[01:28] Team_060 possession (Score: 100-90)
Domantas Barnes attempts a Midrange. Contested by Gary Ginobili (4.5 feet, MAN). Domantas Barnes misses. Rebound secured by Shai Ingram.

[01:13] Team_019 possession (Score: 100-90)
Jalen Turner attempts a 3Pt. Contested by Rudy Ginobili (2.2 feet, MAN). Jalen Turner misses. Rebound secured by Domantas Barnes.

[01:00] Team_060 possession (Score: 100-90)
Domantas Barnes attempts a Midrange. Wide open! Gary Ginobili is 7.1 feet away. [ZONE] Domantas Barnes misses. Offensive rebound by Klay Haliburton! Klay Haliburton's putback is no good. Rebound secured by Shai Ingram.

[00:47] Team_019 possession (Score: 100-90)
Blake LaVine makes the Layup and draws the foul on Jarrett Wagner! And-1! Blake LaVine to the line for 1. [BONUS: 5 team fouls] (Jarrett Wagner: 1 personal fouls)   FT 1/1: GOOD Blake LaVine makes 1/1 from the line.
Score: 100-93

[00:32] Team_060 possession (Score: 100-93)
Jarrett Wagner drives and kicks out. Jarrett Wagner attempts a 3Pt. Contested by Blake LaVine (3.2 feet, ZONE). Jarrett Wagner misses. FOUL! Loose ball foul on Tim Jordan during the rebound battle. [IN THE BONUS! 8 team fouls] Domantas Barnes to the line for 2 free throws. (Tim Jordan: 2 personal fouls)   FT 1/2: GOOD   FT 2/2: MISS Domantas Barnes makes 1/2 from the line. Offensive rebound by Domantas Barnes! Domantas Barnes kicks it out.
Score: 101-93

[00:18] Team_060 possession (Score: 101-93)
Jarrett Wagner drives to the basket... Jarrett Wagner commits a violation (traveling/carry)! TURNOVER! (dead ball)

[00:01] Team_019 possession (Score: 101-93)
FOUL! Holding foul on Jarrett Wagner. [IN THE BONUS! 6 team fouls] Blake LaVine to the line for 2 free throws. (Jarrett Wagner: 2 personal fouls)   FT 1/2: GOOD   FT 2/2: MISS Blake LaVine makes 1/2 from the line. Rebound secured by Rudy Ginobili.
Score: 101-94

================================================================================
                              4TH QUARTER COMPLETE                              
================================================================================

4TH QUARTER SCORE: Team_060 28, Team_019 22

BOX SCORE:
================================================================================

Team_060
--------------------------------------------------------------------------------
Player                MIN  PTS  REB  AST  TO      FG   FG%      3P   3P%
--------------------------------------------------------------------------------
Jarrett Wagner         14    9    0    0   0   4/4   100.0     0/0   0.0
Klay Haliburton        14    5    1    0   0   2/2   100.0     0/0   0.0
Joel Morant            34    3    0    1   0   1/1   100.0     0/0   0.0
Julius Green           34    3    0    0   0   1/1   100.0     0/0   0.0
Shai Ingram            14    3    3    0   0   1/1   100.0     0/0   0.0
Jaren George           34    2    0    0   0   1/2    50.0     0/0   0.0
Yao Tatum              14    2    0    0   0   1/1   100.0     0/0   0.0
Rudy Ginobili          14    1    4    1   0   1/2    50.0     0/0   0.0
Larry Westbrook        34    0    3    1   0   0/3     0.0     0/0   0.0
Immanuel Ming          34    0    2    1   0   0/2     0.0     0/0   0.0
Domantas Barnes        14    0    3    1   0   0/2     0.0     0/0   0.0

TEAM: FG: 11/20 (55.0%), 3PT: 3/7 (42.9%), REB: 14 (2 off, 12 def), AST: 5, TO: 4
TEAM FOULS: 6 [Team_019 in BONUS]


Team_019
--------------------------------------------------------------------------------
Player                MIN  PTS  REB  AST  TO      FG   FG%      3P   3P%
--------------------------------------------------------------------------------
Gary Ginobili          14    6    0    0   0   2/4    50.0     0/0   0.0
D'Angelo Randle        34    4    3    0   0   2/3    66.7     0/0   0.0
Blake LaVine           14    3    0    0   0   1/1   100.0     0/0   0.0
Tobias Hyland          34    2    1    0   0   1/3    33.3     0/0   0.0
DeMar James            34    2    2    0   0   1/2    50.0     0/0   0.0
Rudy Giddey            34    0    0    1   0   0/1     0.0     0/0   0.0
Jalen Turner           14    0    0    2   0   0/2     0.0     0/0   0.0
Tim Jordan             14    0    0    0   0   0/3     0.0     0/0   0.0

TEAM: FG: 8/21 (38.1%), 3PT: 2/9 (22.2%), REB: 8 (0 off, 8 def), AST: 3, TO: 3
TEAM FOULS: 8 [Team_060 in BONUS]

================================================================================

================================================================================
                               FULL GAME COMPLETE                               
================================================================================

FINAL SCORE: Team_060 101, Team_019 94

SCORING BY QUARTER:
--------------------------------------------------------------------------------
Team                     Q1     Q2     Q3     Q4    FINAL
--------------------------------------------------------------------------------
Team_060                 27     22     24     28      101
Team_019                 26     18     28     22       94
--------------------------------------------------------------------------------

FULL GAME BOX SCORE:
================================================================================

Team_060
--------------------------------------------------------------------------------
Player                MIN  PTS  REB  AST  TO      FG   FG%      3P   3P%      FT STL BLK
--------------------------------------------------------------------------------
Joel Morant            34   24    0    3   0   9/14   64.3   5/8    62.5   1/2     0   0
Julius Green           34   10    0    2   2   4/8    50.0   3/4    75.0   5/6     0   0
Immanuel Ming          34    6   11    4   6   3/9    33.3   0/2     0.0   2/3     0   0
Larry Westbrook        34    9   10    1   1   5/13   38.5   1/6    16.7   1/1     0   3
Jaren George           34   13   15    4   3   5/8    62.5   0/0     0.0   1/1     0   0
Domantas Barnes        14    0    5    1   0   0/3     0.0   0/1     0.0   1/2     1   0
Rudy Ginobili          14    3    6    1   1   1/2    50.0   0/1     0.0   1/2     0   0
Jarrett Wagner         14   14    0    0   1   5/6    83.3   2/3    66.7   5/5     0   0
Yao Tatum              14    4    0    1   0   2/2   100.0   0/0     0.0   0/0     1   0
Klay Haliburton        14   12    5    1   2   5/6    83.3   0/0     0.0   2/2     0   1

TEAM: FG: 41/73 (56.2%), 3PT: 11/25 (44.0%), REB: 52 (12 off, 40 def), AST: 18, TO: 16


Team_019
--------------------------------------------------------------------------------
Player                MIN  PTS  REB  AST  TO      FG   FG%      3P   3P%      FT STL BLK
--------------------------------------------------------------------------------
Rudy Giddey            34   22    0    4   0  10/14   71.4   2/3    66.7   0/0     0   0
Brandon James          34    7    0    5   0   3/9    33.3   1/2    50.0   0/0     1   1
D'Angelo Randle        34   23    8    3   1   7/15   46.7   4/9    44.4   1/1     3   0
Tobias Hyland          34    8    4    4   0   4/13   30.8   0/5     0.0   0/0     0   0
DeMar James            34   11   21    2   1   6/7    85.7   0/0     0.0   4/4     2   0
Gary Ginobili          14    6    0    1   1   3/6    50.0   2/5    40.0   3/3     0   0
Jalen Turner           14    3    0    2   2   1/5    20.0   1/5    20.0   0/0     0   0
Blake LaVine           14    5    1    0   0   2/4    50.0   0/1     0.0   2/3     0   0
Shai Ingram            14    7    3    0   1   2/3    66.7   0/1     0.0   0/0     1   0
Tim Jordan             14    0    4    2   0   0/4     0.0   0/0     0.0   1/2     0   0

TEAM: FG: 39/82 (47.6%), 3PT: 10/31 (32.3%), REB: 41 (11 off, 30 def), AST: 23, TO: 6

================================================================================
