================================================================================
                        FULL GAME - Team_016 vs Team_058                        
================================================================================

================================================================================
                       1ST QUARTER - Team_016 vs Team_058                       
================================================================================

[12:00] Team_016 possession (Score: 0-0)
FOUL! Holding foul on Tyrese Doncic. [Team fouls: 1] No free throws, side out. (Tyrese Doncic: 1 personal fouls)

[11:46] Team_016 possession (Score: 0-0)
Vince Duncan attempts a 3Pt. Contested by Bradley Sexton (4.3 feet, ZONE). Vince Duncan misses. Rebound secured by Tyrese Doncic.

[11:33] Team_058 possession (Score: 0-0)
Bradley Sexton attempts a Midrange. Contested by Giannis Ginobili (3.6 feet, ZONE). Bradley Sexton misses. Rebound secured by Ben Barrett.

[11:17] Team_016 possession (Score: 0-0)
Vince Quickley attempts a Midrange. Contested by Vince Hyland (3.9 feet, MAN). Vince Quickley misses. Rebound secured by Stephen Haliburton.

[11:03] Team_058 possession (Score: 0-0)
Vince Hyland attempts a Layup. Contested by Vince Duncan (2.1 feet, ZONE). Vince Hyland misses. Rebound secured by Vince Duncan.

[10:50] Team_016 possession (Score: 0-0)
Collin Barnes attempts a 3Pt. Contested by Bradley Sexton (2.0 feet, MAN). Collin Barnes misses. Rebound secured by Bradley Sexton.

[10:34] Team_058 possession (Score: 0-0)
Tyrese Doncic drives to the basket... Tyrese Doncic throws a bad pass! Stolen by Vince Duncan! TURNOVER! (live ball)

[10:16] Team_016 possession (Score: 0-0)
Vince Duncan attempts a 3Pt. Contested by Tyrese Doncic (5.2 feet, MAN). Vince Duncan misses. Rebound secured by Bradley Sexton.

[10:01] Team_058 possession (Score: 0-0)
Vince Hyland attempts a Midrange. Contested by Vince Quickley (2.7 feet, MAN). VINCE HYLAND MAKES IT!
Score: 0-2

[09:48] Team_016 possession (Score: 0-2)
Ben Barrett drives and kicks out. Vince Duncan attempts a 3Pt. Contested by Bradley Sexton (2.9 feet, ZONE). VINCE DUNCAN MAKES IT! Assist: Giannis Ginobili
Score: 3-2

[09:32] Team_058 possession (Score: 3-2)
Kyle Westbrook attempts a 3Pt. Contested by Collin Barnes (4.1 feet, ZONE). Kyle Westbrook misses. Rebound secured by Ben Barrett.

[09:19] Team_016 possession (Score: 3-2)
Vince Duncan drives and kicks out. Ben Barrett attempts a 3Pt. Contested by Bradley Sexton (5.0 feet, ZONE). Ben Barrett misses. Rebound secured by Tyrese Doncic.

[09:04] Team_058 possession (Score: 3-2)
Tyrese Doncic drives, Vince Duncan stays with him. Tyrese Doncic attempts a Layup. Heavily contested by Vince Duncan (1.9 feet, MAN)! Tyrese Doncic misses. Rebound secured by Vince Quickley.

[08:47] Team_016 possession (Score: 3-2)
Vince Duncan drives, Tyrese Doncic stays with him. Vince Duncan attempts a Dunk. Heavily contested by Tyrese Doncic (1.9 feet, MAN)! VINCE DUNCAN MAKES IT!
Score: 5-2

[08:30] Team_058 possession (Score: 5-2)
Vince Hyland attempts a 3Pt. Contested by Vince Quickley (2.5 feet, MAN). Vince Hyland misses. Rebound secured by Vince Duncan.

[08:14] Team_016 possession (Score: 5-2)
Collin Barnes attempts a 3Pt. Contested by Bradley Sexton (4.5 feet, ZONE). Collin Barnes misses. Rebound secured by Stephen Haliburton.

[08:01] Team_058 possession (Score: 5-2)
Kyle Westbrook attempts a 3Pt. Contested by Giannis Ginobili (4.7 feet, MAN). KYLE WESTBROOK MAKES IT! Assist: Bradley Sexton
Score: 5-5

[07:43] Team_016 possession (Score: 5-5)
Vince Duncan attempts a Midrange. Wide open! Tyrese Doncic is 7.1 feet away. [MAN] VINCE DUNCAN MAKES IT!
Score: 7-5

[07:29] Team_058 possession (Score: 7-5)
Bradley Sexton attempts a 3Pt. Contested by Collin Barnes (2.6 feet, ZONE). Bradley Sexton misses. Rebound secured by Vince Duncan.

[07:13] Team_016 possession (Score: 7-5)
Giannis Ginobili attempts a 3Pt. Contested by Kyle Westbrook (5.6 feet, MAN). GIANNIS GINOBILI MAKES IT! Assist: Vince Quickley
Score: 10-5

[06:59] Team_058 possession (Score: 10-5)
Stephen Haliburton throws a bad pass! Stolen by Ben Barrett! TURNOVER! (live ball)

[06:44] Team_016 possession (Score: 10-5)
Vince Duncan drives, picks up Tyrese Doncic. Help arrives from Bradley Sexton! Vince Duncan attempts a Dunk. Wide open! Bradley Sexton is 6.2 feet away. [MAN] VINCE DUNCAN MAKES IT! Assist: Vince Quickley
Score: 12-5

[06:33] Team_058 possession (Score: 12-5)
Tyrese Doncic attempts a Layup. Contested by Vince Duncan (3.2 feet, MAN). TYRESE DONCIC MAKES IT! Assist: Kyle Westbrook
Score: 12-7

[06:18] Team_016 possession (Score: 12-7)
Ben Barrett throws a bad pass! Stolen by Stephen Haliburton! TURNOVER! (live ball)

[06:04] Team_058 possession (Score: 12-7)
Vince Hyland attempts a 3Pt. Contested by Vince Quickley (5.0 feet, MAN). Vince Hyland misses. Rebound secured by Vince Duncan.

[05:46] Team_016 possession (Score: 12-7)
Vince Quickley drives, picks up Vince Hyland. Help arrives from Bradley Sexton! Vince Quickley attempts a Layup. Contested by Bradley Sexton (5.6 feet, MAN). Vince Quickley misses. Rebound secured by Bradley Sexton.

[05:30] Team_058 possession (Score: 12-7)
Kyle Westbrook drives, Vince Duncan stays with him. Kyle Westbrook attempts a Layup. Contested by Vince Duncan (3.2 feet, ZONE). Kyle Westbrook misses. Rebound secured by Ben Barrett.

[05:21] Team_016 possession (Score: 12-7)
Giannis Ginobili attempts a 3Pt. Contested by Kyle Westbrook (4.1 feet, MAN). Giannis Ginobili misses. Rebound secured by Stephen Haliburton.

[05:12] Team_058 possession (Score: 12-7)
Vince Hyland attempts a 3Pt. Heavily contested by Collin Barnes (1.6 feet, ZONE)! Vince Hyland misses. Rebound secured by Vince Duncan.

[04:56] Team_016 possession (Score: 12-7)
Giannis Ginobili makes the Layup and draws the foul on Kyle Westbrook! And-1! Giannis Ginobili to the line for 1. [Team fouls: 2] (Kyle Westbrook: 1 personal fouls)   FT 1/1: GOOD Giannis Ginobili makes 1/1 from the line.
Score: 15-7

[04:39] Team_058 possession (Score: 15-7)
Bradley Sexton drives and kicks out. Kyle Westbrook attempts a Midrange. Wide open! Vince Quickley is 6.8 feet away. [ZONE] Kyle Westbrook misses. Rebound secured by Vince Duncan.

[04:26] Team_016 possession (Score: 15-7)
FOUL! Reach-in foul on Vince Hyland during the drive. [Team fouls: 3] No free throws, side out. (Vince Hyland: 1 personal fouls)

[04:11] Team_016 possession (Score: 15-7)
Collin Barnes drives and kicks out. Ben Barrett attempts a 3Pt. Contested by Vince Hyland (3.8 feet, ZONE). Ben Barrett misses. Offensive rebound by Vince Duncan! Vince Duncan puts it back in!
Score: 17-7

[03:57] Team_058 possession (Score: 17-7)
Stephen Haliburton attempts a 3Pt. Contested by Collin Barnes (2.9 feet, ZONE). Stephen Haliburton misses. Offensive rebound by Stephen Haliburton! Stephen Haliburton's putback is no good. Rebound secured by Vince Duncan.

[03:43] Team_016 possession (Score: 17-7)
Giannis Ginobili attempts a Midrange. Contested by Kyle Westbrook (4.2 feet, MAN). Giannis Ginobili misses. Offensive rebound by Vince Duncan! Vince Duncan puts it back in!
Score: 19-7

[03:29] Team_058 possession (Score: 19-7)
Tyrese Doncic attempts a Midrange. Contested by Vince Duncan (3.4 feet, MAN). Tyrese Doncic misses. Rebound secured by Ben Barrett.

[03:17] Team_016 possession (Score: 19-7)
Ben Barrett attempts a Dunk. BLOCKED BY STEPHEN HALIBURTON! Ball is loose! Offensive rebound by Ben Barrett! Ben Barrett kicks it out.

[02:58] Team_016 possession (Score: 19-7)
Ben Barrett attempts a Layup. Contested by Tyrese Doncic (3.9 feet, ZONE). BEN BARRETT MAKES IT! Assist: Vince Quickley
Score: 21-7

[02:43] Team_058 possession (Score: 21-7)
Tyrese Doncic attempts a Midrange. Heavily contested by Vince Duncan (0.8 feet, MAN)! TYRESE DONCIC MAKES IT!
Score: 21-9

[02:28] Team_016 possession (Score: 21-9)
Giannis Ginobili drives to the basket... FOUL! Offensive foul on Giannis Ginobili! Kyle Westbrook drew the charge! [Team fouls: 1] (Giannis Ginobili: 1 personal fouls) TURNOVER! (dead ball)

[02:16] Team_058 possession (Score: 21-9)
Stephen Haliburton drives, Ben Barrett stays with him. Stephen Haliburton attempts a Dunk. Wide open! Ben Barrett is 6.2 feet away. [MAN] Stephen Haliburton misses. Offensive rebound by Stephen Haliburton! Stephen Haliburton puts it back in!
Score: 21-11

[02:01] Team_016 possession (Score: 21-11)
Giannis Ginobili attempts a 3Pt. Contested by Kyle Westbrook (5.1 feet, MAN). Giannis Ginobili misses. Rebound secured by Bradley Sexton.

[01:49] Team_058 possession (Score: 21-11)
Vince Hyland attempts a Layup. Wide open! Vince Duncan is 7.5 feet away. [ZONE] VINCE HYLAND MAKES IT! Assist: Bradley Sexton
Score: 21-13

[01:32] Team_016 possession (Score: 21-13)
Vince Duncan attempts a 3Pt. Contested by Bradley Sexton (3.4 feet, ZONE). VINCE DUNCAN MAKES IT! Assist: Collin Barnes
Score: 24-13

[01:21] Team_058 possession (Score: 24-13)
Vince Hyland attempts a 3Pt. Contested by Vince Quickley (4.5 feet, MAN). VINCE HYLAND MAKES IT! Assist: Kyle Westbrook
Score: 24-16

[01:03] Team_016 possession (Score: 24-16)
Giannis Ginobili attempts a Layup. Contested by Stephen Haliburton (5.2 feet, ZONE). GIANNIS GINOBILI MAKES IT! Assist: Ben Barrett
Score: 26-16

[00:53] Team_058 possession (Score: 26-16)
Tyrese Doncic drives and kicks out. Vince Hyland attempts a 3Pt. Contested by Collin Barnes (4.7 feet, ZONE). Vince Hyland misses. Rebound secured by Vince Quickley.

[00:38] Team_016 possession (Score: 26-16)
Ben Barrett attempts a Midrange. Contested by Kyle Westbrook (2.8 feet, ZONE). Ben Barrett misses. Rebound secured by Tyrese Doncic.

[00:25] Team_058 possession (Score: 26-16)
Stephen Haliburton attempts a Midrange. Contested by Giannis Ginobili (5.0 feet, ZONE). STEPHEN HALIBURTON MAKES IT! Assist: Vince Hyland
Score: 26-18

[00:13] Team_016 possession (Score: 26-18)
Vince Duncan drives to the basket... FOUL! Offensive foul on Vince Duncan! Tyrese Doncic drew the charge! [Team fouls: 2] (Vince Duncan: 1 personal fouls) TURNOVER! (dead ball)

================================================================================
                              1ST QUARTER COMPLETE                              
================================================================================

1ST QUARTER SCORE: Team_016 26, Team_058 18

BOX SCORE:
================================================================================

Team_016
--------------------------------------------------------------------------------
Player                MIN  PTS  REB  AST  TO      FG   FG%      3P   3P%
--------------------------------------------------------------------------------
Vince Duncan           12   16    9    0   0   7/10   70.0     0/0   0.0
Giannis Ginobili       12    8    0    1   0   3/5    60.0     0/0   0.0
Ben Barrett            12    2    5    1   0   1/2    50.0     0/0   0.0
Vince Quickley         12    0    2    3   0   0/2     0.0     0/0   0.0
Collin Barnes          12    0    0    1   0   0/2     0.0     0/0   0.0

TEAM: FG: 11/21 (52.4%), 3PT: 2/8 (25.0%), REB: 15 (3 off, 12 def), AST: 6, TO: 3
TEAM FOULS: 2


Team_058
--------------------------------------------------------------------------------
Player                MIN  PTS  REB  AST  TO      FG   FG%      3P   3P%
--------------------------------------------------------------------------------
Vince Hyland           12    7    0    1   0   3/7    42.9     0/0   0.0
Tyrese Doncic          12    4    3    0   0   2/5    40.0     0/0   0.0
Stephen Haliburton     12    4    4    0   0   2/3    66.7     0/0   0.0
Kyle Westbrook         12    3    0    2   0   1/3    33.3     0/0   0.0
Bradley Sexton         12    0    4    2   0   0/3     0.0     0/0   0.0

TEAM: FG: 8/21 (38.1%), 3PT: 2/8 (25.0%), REB: 12 (2 off, 10 def), AST: 5, TO: 2
TEAM FOULS: 3

================================================================================

================================================================================
                       2ND QUARTER - Team_016 vs Team_058                       
================================================================================

[12:00] Team_016 possession (Score: 26-18)
Collin Barnes attempts a 3Pt. Contested by Bradley Sexton (2.9 feet, MAN). Collin Barnes misses. Rebound secured by Stephen Haliburton.

[11:48] Team_058 possession (Score: 26-18)
Bradley Sexton attempts a Midrange. Contested by Collin Barnes (5.1 feet, MAN). BRADLEY SEXTON MAKES IT!
Score: 26-20

[11:33] Team_016 possession (Score: 26-20)
Collin Barnes drives, Bradley Sexton stays with him. Collin Barnes attempts a Dunk. Contested by Bradley Sexton (5.5 feet, MAN). COLLIN BARNES MAKES IT! Assist: Vince Quickley
Score: 28-20

[11:20] Team_058 possession (Score: 28-20)
Tyrese Doncic drives and kicks out. Tyrese Doncic attempts a Midrange. Contested by Vince Duncan (3.0 feet, MAN). Tyrese Doncic misses. Rebound secured by Vince Duncan.

[11:04] Team_016 possession (Score: 28-20)
Vince Duncan drives, Stephen Haliburton stays with him. Vince Duncan attempts a Dunk. Contested by Stephen Haliburton (3.8 feet, ZONE). VINCE DUNCAN MAKES IT! Assist: Ben Barrett
Score: 30-20

[10:52] Team_058 possession (Score: 30-20)
Bradley Sexton attempts a 3Pt. Contested by Collin Barnes (6.0 feet, MAN). Bradley Sexton misses. Offensive rebound by Stephen Haliburton! Stephen Haliburton puts it back in!
Score: 30-22

[10:36] Team_016 possession (Score: 30-22)
Vince Quickley attempts a 3Pt. Heavily contested by Vince Hyland (0.5 feet, MAN)! Vince Quickley misses. Rebound secured by Tyrese Doncic.

[10:23] Team_058 possession (Score: 30-22)
Bradley Sexton attempts a 3Pt. Contested by Collin Barnes (5.2 feet, MAN). Bradley Sexton misses. Rebound secured by Vince Quickley.

[10:11] Team_016 possession (Score: 30-22)
Vince Quickley attempts a 3Pt. Wide open! Vince Hyland is 8.3 feet away. [MAN] VINCE QUICKLEY MAKES IT! Assist: Collin Barnes
Score: 33-22

[09:59] Team_058 possession (Score: 33-22)
FOUL! Reach-in foul on Vince Duncan during the drive. [Team fouls: 1] No free throws, side out. (Vince Duncan: 1 personal fouls)

[09:47] Team_058 possession (Score: 33-22)
Stephen Haliburton drives to the basket... FOUL! Offensive foul on Stephen Haliburton! Ben Barrett drew the charge! [Team fouls: 1] (Stephen Haliburton: 1 personal fouls) TURNOVER! (dead ball)

[09:36] Team_016 possession (Score: 33-22)
Giannis Ginobili attempts a 3Pt. Contested by Bradley Sexton (3.7 feet, ZONE). Giannis Ginobili misses. Offensive rebound by Vince Duncan! Vince Duncan kicks it out.

[09:24] Team_016 possession (Score: 33-22)
Collin Barnes attempts a 3Pt. Contested by Bradley Sexton (4.9 feet, MAN). Collin Barnes misses. Rebound secured by Vince Hyland.

[09:12] Team_058 possession (Score: 33-22)
FOUL! Reach-in foul on Vince Duncan during the drive. [Team fouls: 2] No free throws, side out. (Vince Duncan: 2 personal fouls)

[08:57] Team_058 possession (Score: 33-22)
Kyle Westbrook attempts a 3Pt. Contested by Collin Barnes (5.9 feet, ZONE). KYLE WESTBROOK MAKES IT! Assist: Vince Hyland
Score: 33-25

[08:43] Team_016 possession (Score: 33-25)
Giannis Ginobili attempts a Midrange. Contested by Vince Hyland (3.9 feet, ZONE). GIANNIS GINOBILI MAKES IT! Assist: Collin Barnes
Score: 35-25

[08:28] Team_058 possession (Score: 35-25)
Bradley Sexton attempts a 3Pt. Contested by Collin Barnes (2.5 feet, MAN). Bradley Sexton misses. Offensive rebound by Tyrese Doncic! Tyrese Doncic kicks it out.

[08:17] Team_058 possession (Score: 35-25)
Tyrese Doncic attempts a 3Pt. Contested by Collin Barnes (5.2 feet, ZONE). Tyrese Doncic misses. Offensive rebound by Tyrese Doncic! Tyrese Doncic kicks it out.

[08:00] Team_058 possession (Score: 35-25)
Bradley Sexton attempts a Layup. Contested by Collin Barnes (5.4 feet, MAN). BRADLEY SEXTON MAKES IT! Assist: Vince Hyland
Score: 35-27

[07:45] Team_016 possession (Score: 35-27)
Vince Quickley attempts a 3Pt. Wide open! Vince Hyland is 7.1 feet away. [MAN] Vince Quickley misses. Rebound secured by Tyrese Doncic.

[07:31] Team_058 possession (Score: 35-27)
Tyrese Doncic drives, Vince Duncan stays with him. Tyrese Doncic attempts a Layup. Contested by Vince Duncan (2.7 feet, ZONE). TYRESE DONCIC MAKES IT! Assist: Kyle Westbrook
Score: 35-29

[07:16] Team_016 possession (Score: 35-29)
Giannis Ginobili attempts a 3Pt. Heavily contested by Kyle Westbrook (1.2 feet, ZONE)! Giannis Ginobili misses. Offensive rebound by Vince Duncan! Vince Duncan kicks it out.

[06:58] Team_016 possession (Score: 35-29)
Giannis Ginobili drives, Stephen Haliburton stays with him. Giannis Ginobili attempts a Layup. Contested by Stephen Haliburton (3.3 feet, ZONE). Giannis Ginobili misses. Offensive rebound by Ben Barrett! Ben Barrett's putback is no good. Rebound secured by Vince Hyland.

[06:43] Team_058 possession (Score: 35-29)
Kyle Westbrook attempts a Layup. Wide open! Vince Duncan is 7.6 feet away. [ZONE] Kyle Westbrook misses. Rebound secured by Vince Quickley.

[06:26] Team_016 possession (Score: 35-29)
Giannis Ginobili makes the Layup and draws the foul on Kyle Westbrook! And-1! Giannis Ginobili to the line for 1. [Team fouls: 2] (Kyle Westbrook: 1 personal fouls)   FT 1/1: GOOD Giannis Ginobili makes 1/1 from the line.
Score: 38-29

[06:13] Team_058 possession (Score: 38-29)
FOUL! Holding foul on Vince Duncan. [Team fouls: 3] No free throws, side out. (Vince Duncan: 3 personal fouls)

[05:59] Team_058 possession (Score: 38-29)
Stephen Haliburton loses the ball! Stripped by Ben Barrett! TURNOVER! (live ball)

[05:47] Team_016 possession (Score: 38-29)
Collin Barnes attempts a 3Pt. Contested by Bradley Sexton (3.0 feet, MAN). Collin Barnes misses. Offensive rebound by Ben Barrett! Ben Barrett puts it back in!
Score: 40-29

[05:36] Team_058 possession (Score: 40-29)
Kyle Westbrook attempts a Layup. Wide open! Giannis Ginobili is 10.0 feet away. [MAN] Kyle Westbrook misses. Rebound secured by Vince Duncan.

[05:20] Team_016 possession (Score: 40-29)
Vince Duncan attempts a 3Pt. Contested by Bradley Sexton (5.6 feet, ZONE). Vince Duncan misses. Rebound secured by Tyrese Doncic.

[05:09] Team_058 possession (Score: 40-29)
Vince Hyland attempts a 3Pt. Contested by Vince Quickley (4.5 feet, MAN). VINCE HYLAND MAKES IT! Assist: Bradley Sexton
Score: 40-32

[04:56] Team_016 possession (Score: 40-32)
Vince Duncan attempts a Midrange. Wide open! Tyrese Doncic is 6.3 feet away. [ZONE] Vince Duncan misses. Rebound secured by Vince Hyland.

[04:41] Team_058 possession (Score: 40-32)
Stephen Haliburton attempts a 3Pt. Wide open! Collin Barnes is 6.7 feet away. [ZONE] Stephen Haliburton misses. Rebound secured by Vince Quickley.

[04:29] Team_016 possession (Score: 40-32)
Collin Barnes attempts a 3Pt. Contested by Bradley Sexton (4.2 feet, ZONE). Collin Barnes misses. Rebound secured by Stephen Haliburton.

[04:20] Team_058 possession (Score: 40-32)
Vince Hyland attempts a 3Pt. Contested by Vince Quickley (3.9 feet, MAN). Vince Hyland misses. Rebound secured by Ben Barrett.

[04:05] Team_016 possession (Score: 40-32)
Ben Barrett attempts a 3Pt. Contested by Stephen Haliburton (4.6 feet, MAN). Ben Barrett misses. Rebound secured by Tyrese Doncic.

[03:52] Team_058 possession (Score: 40-32)
Tyrese Doncic attempts a Layup. Contested by Vince Duncan (4.8 feet, ZONE). TYRESE DONCIC MAKES IT!
Score: 40-34

[03:40] Team_016 possession (Score: 40-34)
Giannis Ginobili drives and kicks out. Ben Barrett attempts a 3Pt. Contested by Bradley Sexton (4.0 feet, ZONE). Ben Barrett misses. Offensive rebound by Vince Duncan! Vince Duncan kicks it out.

[03:24] Team_016 possession (Score: 40-34)
Vince Quickley drives, Vince Hyland stays with him. Vince Quickley attempts a Layup. Wide open! Vince Hyland is 8.0 feet away. [MAN] VINCE QUICKLEY MAKES IT! Assist: Collin Barnes
Score: 42-34

[03:12] Team_058 possession (Score: 42-34)
Vince Hyland attempts a 3Pt. Contested by Vince Quickley (3.6 feet, MAN). Vince Hyland misses. Rebound secured by Vince Quickley.

[02:58] Team_016 possession (Score: 42-34)
Vince Duncan attempts a Midrange. Contested by Tyrese Doncic (4.5 feet, MAN). VINCE DUNCAN MAKES IT! Assist: Giannis Ginobili
Score: 44-34

[02:46] Team_058 possession (Score: 44-34)
Vince Hyland drives, Vince Duncan stays with him. Vince Hyland attempts a Layup. Wide open! Vince Duncan is 8.5 feet away. [ZONE] Vince Hyland misses. Rebound secured by Ben Barrett.

[02:36] Team_016 possession (Score: 44-34)
Giannis Ginobili attempts a 3Pt. Wide open! Kyle Westbrook is 6.9 feet away. [MAN] Giannis Ginobili misses. Rebound secured by Tyrese Doncic.

[02:22] Team_058 possession (Score: 44-34)
FOUL! Holding foul on Vince Quickley. [Team fouls: 4] No free throws, side out. (Vince Quickley: 1 personal fouls)

[02:07] Team_058 possession (Score: 44-34)
Vince Hyland attempts a 3Pt. Contested by Vince Quickley (5.4 feet, MAN). Vince Hyland misses. Rebound secured by Vince Duncan.

[01:48] Team_016 possession (Score: 44-34)
Collin Barnes throws a bad pass! Stolen by Bradley Sexton! TURNOVER! (live ball)

[01:34] Team_058 possession (Score: 44-34)
Vince Hyland drives and kicks out. Stephen Haliburton attempts a Midrange. Wide open! Ben Barrett is 7.9 feet away. [MAN] STEPHEN HALIBURTON MAKES IT! Assist: Tyrese Doncic
Score: 44-36

[01:21] Team_016 possession (Score: 44-36)
Collin Barnes attempts a 3Pt. Contested by Stephen Haliburton (2.0 feet, ZONE). Collin Barnes misses. Rebound secured by Tyrese Doncic.

[01:05] Team_058 possession (Score: 44-36)
FOUL! Holding foul on Vince Duncan. [IN THE BONUS! 5 team fouls] Tyrese Doncic to the line for 2 free throws. (Vince Duncan: 4 personal fouls)   FT 1/2: GOOD   FT 2/2: GOOD Tyrese Doncic makes 2/2 from the line.
Score: 44-38

[00:49] Team_016 possession (Score: 44-38)
Ben Barrett drives to the basket... Ben Barrett loses control! Ball rolls out of bounds! TURNOVER! (dead ball)

[00:49] Substitution (Team_016): Collin Barnes OUT → Lamelo Herro IN (stamina_rule2)

[00:49] Substitution (Team_016): Giannis Ginobili OUT → Immanuel Nowitzki IN (stamina_rule2)

[00:49] Substitution (Team_016): Vince Quickley OUT → Kevin Butler IN (stamina_rule2)

[00:49] Substitution (Team_016): Ben Barrett OUT → Giannis Doncic IN (stamina_rule2)

[00:49] Substitution (Team_016): Vince Duncan OUT → Trae Barnes IN (stamina_rule2)

[00:49] Substitution (Team_058): Bradley Sexton OUT → Draymond Williamson IN (stamina_rule2)

[00:49] Substitution (Team_058): Kyle Westbrook OUT → Jordan Ingram IN (stamina_rule2)

[00:49] Substitution (Team_058): Vince Hyland OUT → Pascal Holiday IN (stamina_rule2)

[00:49] Substitution (Team_058): Stephen Haliburton OUT → Shai Lowry IN (stamina_rule2)

[00:49] Substitution (Team_058): Tyrese Doncic OUT → Jarrett Gilgeous-Alexander IN (stamina_rule2)

[00:36] Team_058 possession (Score: 44-38)
Jordan Ingram loses control! Ball rolls out of bounds! TURNOVER! (dead ball)

[00:20] Team_016 possession (Score: 44-38)
Kevin Butler attempts a 3Pt. Contested by Pascal Holiday (5.3 feet, MAN). Kevin Butler misses. Rebound secured by Jarrett Gilgeous-Alexander.

[00:06] Team_058 possession (Score: 44-38)
Jordan Ingram makes the Midrange and draws the foul on Kevin Butler! And-1! Jordan Ingram to the line for 1. [BONUS: 6 team fouls] (Kevin Butler: 1 personal fouls)   FT 1/1: GOOD Jordan Ingram makes 1/1 from the line.
Score: 44-41

================================================================================
                              2ND QUARTER COMPLETE                              
================================================================================

2ND QUARTER SCORE: Team_016 18, Team_058 23

BOX SCORE:
================================================================================

Team_016
--------------------------------------------------------------------------------
Player                MIN  PTS  REB  AST  TO      FG   FG%      3P   3P%
--------------------------------------------------------------------------------
Vince Quickley         24    5    4    1   0   2/4    50.0     0/0   0.0
Giannis Ginobili       24    5    0    1   0   2/4    50.0     0/0   0.0
Vince Duncan           24    4    6    0   0   2/4    50.0     0/0   0.0
Collin Barnes          24    2    0    3   0   1/5    20.0     0/0   0.0
Ben Barrett            24    2    3    1   0   1/2    50.0     0/0   0.0
Kevin Butler            1    0    0    0   0   0/1     0.0     0/0   0.0

TEAM: FG: 8/20 (40.0%), 3PT: 2/12 (16.7%), REB: 14 (5 off, 9 def), AST: 6, TO: 2
TEAM FOULS: 6 [Team_058 in BONUS]


Team_058
--------------------------------------------------------------------------------
Player                MIN  PTS  REB  AST  TO      FG   FG%      3P   3P%
--------------------------------------------------------------------------------
Tyrese Doncic          24    6    8    1   0   3/4    75.0     0/0   0.0
Stephen Haliburton     24    4    3    0   0   2/3    66.7     0/0   0.0
Bradley Sexton         24    4    0    1   0   2/3    66.7     0/0   0.0
Vince Hyland           24    3    3    2   0   1/5    20.0     0/0   0.0
Kyle Westbrook         24    3    0    1   0   1/3    33.3     0/0   0.0
Jordan Ingram           1    3    0    0   0   1/1   100.0     0/0   0.0
Jarrett Gilgeous-Alexander    1    0    1    0   0   0/0     0.0     0/0   0.0

TEAM: FG: 10/19 (52.6%), 3PT: 3/8 (37.5%), REB: 14 (3 off, 11 def), AST: 5, TO: 3
TEAM FOULS: 2

================================================================================

================================================================================
                       3RD QUARTER - Team_016 vs Team_058                       
================================================================================

[12:00] Team_016 possession (Score: 44-41)
Vince Duncan drives and kicks out. Ben Barrett attempts a 3Pt. Contested by Stephen Haliburton (5.1 feet, MAN). Ben Barrett misses. Rebound secured by Tyrese Doncic.

[11:46] Team_058 possession (Score: 44-41)
Bradley Sexton drives, Collin Barnes stays with him. Bradley Sexton attempts a Layup. Contested by Collin Barnes (4.9 feet, MAN). BRADLEY SEXTON MAKES IT! Assist: Vince Hyland
Score: 44-43

[11:33] Team_016 possession (Score: 44-43)
Vince Duncan drives, Stephen Haliburton stays with him. Vince Duncan attempts a Dunk. Heavily contested by Stephen Haliburton (1.8 feet, ZONE)! VINCE DUNCAN MAKES IT!
Score: 46-43

[11:20] Team_058 possession (Score: 46-43)
Bradley Sexton attempts a Midrange. Wide open! Collin Barnes is 6.1 feet away. [MAN] BRADLEY SEXTON MAKES IT! Assist: Tyrese Doncic
Score: 46-45

[11:09] Team_016 possession (Score: 46-45)
FOUL! Shooting foul on Tyrese Doncic. Vince Duncan to the line for 2 free throws. [Team fouls: 1] (Tyrese Doncic: 1 personal fouls)   FT 1/2: GOOD   FT 2/2: MISS Vince Duncan makes 1/2 from the line. Rebound secured by Stephen Haliburton.
Score: 47-45

[10:54] Team_058 possession (Score: 47-45)
Bradley Sexton attempts a 3Pt. Wide open! Collin Barnes is 6.1 feet away. [ZONE] Bradley Sexton misses. Rebound secured by Vince Duncan.

[10:37] Team_016 possession (Score: 47-45)
Vince Quickley attempts a 3Pt. Contested by Vince Hyland (4.2 feet, MAN). Vince Quickley misses. Rebound secured by Bradley Sexton.

[10:23] Team_058 possession (Score: 47-45)
FOUL! Shooting foul on Vince Duncan. Tyrese Doncic to the line for 2 free throws. [Team fouls: 1] (Vince Duncan: 1 personal fouls)   FT 1/2: GOOD   FT 2/2: MISS Tyrese Doncic makes 1/2 from the line. Rebound secured by Vince Quickley.
Score: 47-46

[10:11] Team_016 possession (Score: 47-46)
Giannis Ginobili attempts a 3Pt. Contested by Kyle Westbrook (3.7 feet, MAN). Giannis Ginobili misses. Rebound secured by Stephen Haliburton.

[10:02] Team_058 possession (Score: 47-46)
Bradley Sexton drives and kicks out. Stephen Haliburton attempts a 3Pt. Contested by Ben Barrett (2.3 feet, MAN). Stephen Haliburton misses. Rebound secured by Vince Quickley.

[09:50] Team_016 possession (Score: 47-46)
Giannis Ginobili attempts a 3Pt. Heavily contested by Bradley Sexton (1.4 feet, ZONE)! Giannis Ginobili misses. Rebound secured by Tyrese Doncic.

[09:34] Team_058 possession (Score: 47-46)
Stephen Haliburton makes the Layup and draws the foul on Ben Barrett! And-1! Stephen Haliburton to the line for 1. [Team fouls: 2] (Ben Barrett: 1 personal fouls)   FT 1/1: GOOD Stephen Haliburton makes 1/1 from the line.
Score: 47-49

[09:16] Team_016 possession (Score: 47-49)
Vince Quickley attempts a Layup. Heavily contested by Stephen Haliburton (1.7 feet, ZONE)! Vince Quickley misses. Rebound secured by Tyrese Doncic.

[09:00] Team_058 possession (Score: 47-49)
Bradley Sexton attempts a 3Pt. Contested by Collin Barnes (3.2 feet, MAN). BRADLEY SEXTON MAKES IT!
Score: 47-52

[08:47] Team_016 possession (Score: 47-52)
Giannis Ginobili loses the ball! Stripped by Kyle Westbrook! TURNOVER! (live ball)

[08:32] Team_058 possession (Score: 47-52)
Kyle Westbrook drives to the basket... Kyle Westbrook loses the ball! Stripped by Vince Duncan! TURNOVER! (live ball)

[08:20] Team_016 possession (Score: 47-52)
Vince Duncan drives, picks up Tyrese Doncic. Help arrives from Bradley Sexton! Vince Duncan attempts a Layup. Wide open! Bradley Sexton is 8.0 feet away. [MAN] VINCE DUNCAN MAKES IT!
Score: 49-52

[08:06] Team_058 possession (Score: 49-52)
Vince Hyland attempts a 3Pt. Contested by Vince Quickley (5.4 feet, MAN). VINCE HYLAND MAKES IT! Assist: Bradley Sexton
Score: 49-55

[07:49] Team_016 possession (Score: 49-55)
Collin Barnes attempts a Midrange. Contested by Bradley Sexton (3.6 feet, MAN). Collin Barnes misses. Rebound secured by Bradley Sexton.

[07:33] Team_058 possession (Score: 49-55)
Kyle Westbrook attempts a Layup. BLOCKED BY VINCE QUICKLEY! Ball deflects out of bounds off Kyle Westbrook.

[07:15] Team_016 possession (Score: 49-55)
Ben Barrett attempts a Layup. Contested by Stephen Haliburton (5.1 feet, ZONE). BEN BARRETT MAKES IT! Assist: Vince Quickley
Score: 51-55

[06:59] Team_058 possession (Score: 51-55)
Tyrese Doncic attempts a Midrange. Contested by Vince Quickley (3.5 feet, ZONE). TYRESE DONCIC MAKES IT!
Score: 51-57

[06:46] Team_016 possession (Score: 51-57)
Vince Quickley drives and kicks out. Giannis Ginobili attempts a Midrange. Contested by Kyle Westbrook (5.8 feet, MAN). GIANNIS GINOBILI MAKES IT!
Score: 53-57

[06:33] Team_058 possession (Score: 53-57)
FOUL! Reach-in foul on Vince Duncan during the drive. [Team fouls: 3] No free throws, side out. (Vince Duncan: 2 personal fouls)

[06:16] Team_058 possession (Score: 53-57)
Vince Hyland attempts a Midrange. Contested by Vince Quickley (2.7 feet, MAN). Vince Hyland misses. FOUL! Loose ball foul on Vince Duncan during the rebound battle. [Team fouls: 4] No free throws, side out. (Vince Duncan: 3 personal fouls)

[06:03] Team_058 possession (Score: 53-57)
Tyrese Doncic attempts a Layup. BLOCKED BY VINCE DUNCAN! Ball is loose! Rebound secured by Vince Duncan.

[05:48] Team_016 possession (Score: 53-57)
Vince Quickley drives to the basket... Vince Quickley loses control! Ball rolls out of bounds! TURNOVER! (dead ball)

[05:33] Team_058 possession (Score: 53-57)
Kyle Westbrook attempts a 3Pt. Contested by Giannis Ginobili (5.8 feet, MAN). Kyle Westbrook misses. Offensive rebound by Stephen Haliburton! Stephen Haliburton's putback is no good. Rebound secured by Vince Quickley.

[05:15] Team_016 possession (Score: 53-57)
Vince Duncan drives, Tyrese Doncic stays with him. Vince Duncan attempts a Dunk. Contested by Tyrese Doncic (2.7 feet, MAN). VINCE DUNCAN MAKES IT! Assist: Collin Barnes
Score: 55-57

[04:59] Team_058 possession (Score: 55-57)
Stephen Haliburton attempts a 3Pt. Contested by Collin Barnes (2.8 feet, ZONE). Stephen Haliburton misses. Rebound secured by Ben Barrett.

[04:45] Team_016 possession (Score: 55-57)
Ben Barrett attempts a Layup. Contested by Stephen Haliburton (4.1 feet, ZONE). Ben Barrett misses. Offensive rebound by Ben Barrett! Ben Barrett puts it back in!
Score: 57-57

[04:29] Team_058 possession (Score: 57-57)
Vince Hyland attempts a Midrange. Contested by Vince Quickley (4.7 feet, MAN). Vince Hyland misses. Rebound secured by Ben Barrett.

[04:18] Team_016 possession (Score: 57-57)
Giannis Ginobili loses the ball! Stripped by Kyle Westbrook! TURNOVER! (live ball)

[04:02] Team_058 possession (Score: 57-57)
Vince Hyland drives, picks up Vince Duncan. Help arrives from Collin Barnes! Vince Hyland attempts a Layup. Contested by Collin Barnes (5.0 feet, ZONE). VINCE HYLAND MAKES IT!
Score: 57-59

[03:46] Team_016 possession (Score: 57-59)
Vince Quickley attempts a 3Pt. Wide open! Vince Hyland is 6.1 feet away. [MAN] Vince Quickley misses. Rebound secured by Bradley Sexton.

[03:33] Team_058 possession (Score: 57-59)
FOUL! Holding foul on Collin Barnes. [IN THE BONUS! 5 team fouls] Bradley Sexton to the line for 2 free throws. (Collin Barnes: 1 personal fouls)   FT 1/2: GOOD   FT 2/2: GOOD Bradley Sexton makes 2/2 from the line.
Score: 57-61

[03:14] Team_016 possession (Score: 57-61)
Vince Quickley drives to the basket... Vince Quickley loses control! Ball rolls out of bounds! TURNOVER! (dead ball)

[02:59] Team_058 possession (Score: 57-61)
Vince Hyland drives to the basket... FOUL! Offensive foul on Vince Hyland! Vince Duncan drew the charge! [Team fouls: 2] (Vince Hyland: 1 personal fouls) TURNOVER! (dead ball)

[02:44] Team_016 possession (Score: 57-61)
Giannis Ginobili attempts a 3Pt. Contested by Bradley Sexton (3.8 feet, ZONE). GIANNIS GINOBILI MAKES IT! Assist: Collin Barnes
Score: 60-61

[02:32] Team_058 possession (Score: 60-61)
Kyle Westbrook attempts a 3Pt. Contested by Collin Barnes (4.4 feet, ZONE). Kyle Westbrook misses. Rebound secured by Ben Barrett.

[02:17] Team_016 possession (Score: 60-61)
Collin Barnes attempts a Layup. BLOCKED BY BRADLEY SEXTON! Ball is loose! Rebound secured by Stephen Haliburton.

[02:02] Team_058 possession (Score: 60-61)
Stephen Haliburton attempts a Layup. Contested by Ben Barrett (4.6 feet, MAN). STEPHEN HALIBURTON MAKES IT! Assist: Vince Hyland
Score: 60-63

[01:47] Team_016 possession (Score: 60-63)
Vince Duncan attempts a Midrange. Wide open! Tyrese Doncic is 8.4 feet away. [MAN] Vince Duncan misses. Rebound secured by Tyrese Doncic.

[01:33] Team_058 possession (Score: 60-63)
Tyrese Doncic attempts a Midrange. Contested by Vince Duncan (2.9 feet, MAN). Tyrese Doncic misses. Rebound secured by Vince Duncan.

[01:20] Team_016 possession (Score: 60-63)
Vince Quickley drives, Vince Hyland stays with him. Vince Quickley attempts a Layup. Contested by Vince Hyland (3.6 feet, MAN). VINCE QUICKLEY MAKES IT! Assist: Vince Duncan
Score: 62-63

[01:03] Team_058 possession (Score: 62-63)
Tyrese Doncic makes the Layup and draws the foul on Vince Duncan! And-1! Tyrese Doncic to the line for 1. [BONUS: 6 team fouls] (Vince Duncan: 4 personal fouls)   FT 1/1: GOOD Tyrese Doncic makes 1/1 from the line.
Score: 62-66

[00:53] Team_016 possession (Score: 62-66)
Giannis Ginobili attempts a 3Pt. Contested by Kyle Westbrook (5.4 feet, MAN). GIANNIS GINOBILI MAKES IT! Assist: Vince Quickley
Score: 65-66

[00:38] Team_058 possession (Score: 65-66)
Kyle Westbrook attempts a Midrange. Wide open! Giannis Ginobili is 10.0 feet away. [MAN] Kyle Westbrook misses. Rebound secured by Ben Barrett.

[00:28] Team_016 possession (Score: 65-66)
Ben Barrett drives, Stephen Haliburton stays with him. Ben Barrett attempts a Dunk. Contested by Stephen Haliburton (2.8 feet, MAN). BEN BARRETT MAKES IT!
Score: 67-66

[00:13] Team_058 possession (Score: 67-66)
Bradley Sexton attempts a 3Pt. Wide open! Collin Barnes is 6.7 feet away. [MAN] Bradley Sexton misses. Rebound secured by Vince Quickley.

================================================================================
                              3RD QUARTER COMPLETE                              
================================================================================

3RD QUARTER SCORE: Team_016 23, Team_058 25

BOX SCORE:
================================================================================

Team_016
--------------------------------------------------------------------------------
Player                MIN  PTS  REB  AST  TO      FG   FG%      3P   3P%
--------------------------------------------------------------------------------
Giannis Ginobili       36    8    0    0   0   3/5    60.0     0/0   0.0
Vince Duncan           36    6    3    1   0   3/6    50.0     0/0   0.0
Ben Barrett            36    6    5    0   0   3/3   100.0     0/0   0.0
Vince Quickley         36    2    4    2   0   1/4    25.0     0/0   0.0
Collin Barnes          36    0    0    2   0   0/2     0.0     0/0   0.0

TEAM: FG: 10/20 (50.0%), 3PT: 2/6 (33.3%), REB: 11 (1 off, 10 def), AST: 5, TO: 4
TEAM FOULS: 6 [Team_058 in BONUS]


Team_058
--------------------------------------------------------------------------------
Player                MIN  PTS  REB  AST  TO      FG   FG%      3P   3P%
--------------------------------------------------------------------------------
Bradley Sexton         36    9    3    1   0   4/7    57.1     0/0   0.0
Tyrese Doncic          36    5    4    1   0   2/5    40.0     0/0   0.0
Vince Hyland           36    5    0    2   0   2/3    66.7     0/0   0.0
Stephen Haliburton     36    5    4    0   0   2/3    66.7     0/0   0.0
Kyle Westbrook         36    0    0    0   0   0/4     0.0     0/0   0.0

TEAM: FG: 10/22 (45.5%), 3PT: 2/7 (28.6%), REB: 12 (2 off, 10 def), AST: 4, TO: 2
TEAM FOULS: 2

================================================================================

================================================================================
                       4TH QUARTER - Team_016 vs Team_058                       
================================================================================

[12:00] Team_016 possession (Score: 67-66)
Ben Barrett makes the Layup and draws the foul on Stephen Haliburton! And-1! Ben Barrett to the line for 1. [Team fouls: 1] (Stephen Haliburton: 1 personal fouls)   FT 1/1: GOOD Ben Barrett makes 1/1 from the line.
Score: 70-66

[11:43] Team_058 possession (Score: 70-66)
Tyrese Doncic attempts a 3Pt. Contested by Vince Duncan (2.5 feet, MAN). Tyrese Doncic misses. Rebound secured by Ben Barrett.

[11:26] Team_016 possession (Score: 70-66)
Giannis Ginobili drives, Kyle Westbrook stays with him. Giannis Ginobili attempts a Layup. Contested by Kyle Westbrook (4.6 feet, MAN). GIANNIS GINOBILI MAKES IT! Assist: Collin Barnes
Score: 72-66

[11:11] Team_058 possession (Score: 72-66)
Tyrese Doncic drives to the basket... Tyrese Doncic throws a bad pass! Stolen by Vince Duncan! TURNOVER! (live ball)

[10:59] Team_016 possession (Score: 72-66)
Giannis Ginobili attempts a 3Pt. Wide open! Bradley Sexton is 6.0 feet away. [ZONE] Giannis Ginobili misses. Rebound secured by Tyrese Doncic.

[10:49] Team_058 possession (Score: 72-66)
Vince Hyland throws a bad pass out of bounds! TURNOVER! (dead ball)

[10:49] Substitution (Team_016): Collin Barnes OUT → Lamelo Herro IN (stamina_rule2)

[10:49] Substitution (Team_016): Giannis Ginobili OUT → Immanuel Nowitzki IN (stamina_rule2)

[10:49] Substitution (Team_016): Vince Quickley OUT → Kevin Butler IN (stamina_rule2)

[10:49] Substitution (Team_016): Ben Barrett OUT → Giannis Doncic IN (stamina_rule2)

[10:49] Substitution (Team_016): Vince Duncan OUT → Trae Barnes IN (stamina_rule2)

[10:49] Substitution (Team_058): Bradley Sexton OUT → Draymond Williamson IN (stamina_rule2)

[10:49] Substitution (Team_058): Kyle Westbrook OUT → Jordan Ingram IN (stamina_rule2)

[10:49] Substitution (Team_058): Vince Hyland OUT → Pascal Holiday IN (stamina_rule2)

[10:49] Substitution (Team_058): Stephen Haliburton OUT → Shai Lowry IN (stamina_rule2)

[10:49] Substitution (Team_058): Tyrese Doncic OUT → Jarrett Gilgeous-Alexander IN (stamina_rule2)

[10:35] Team_016 possession (Score: 72-66)
Trae Barnes makes the Layup and draws the foul on Jordan Ingram! And-1! Trae Barnes to the line for 1. [Team fouls: 2] (Jordan Ingram: 1 personal fouls)   FT 1/1: GOOD Trae Barnes makes 1/1 from the line.
Score: 75-66

[10:22] Team_058 possession (Score: 75-66)
Jarrett Gilgeous-Alexander attempts a Layup. Wide open! Giannis Doncic is 6.6 feet away. [ZONE] JARRETT GILGEOUS-ALEXANDER MAKES IT! Assist: Pascal Holiday
Score: 75-68

[10:10] Team_016 possession (Score: 75-68)
FOUL! Reach-in foul on Shai Lowry during the drive. [Team fouls: 3] No free throws, side out. (Shai Lowry: 1 personal fouls)

[09:54] Team_016 possession (Score: 75-68)
Trae Barnes attempts a 3Pt. Contested by Jarrett Gilgeous-Alexander (5.6 feet, MAN). TRAE BARNES MAKES IT! Assist: Giannis Doncic
Score: 78-68

[09:40] Team_058 possession (Score: 78-68)
Jarrett Gilgeous-Alexander attempts a 3Pt. Contested by Kevin Butler (2.8 feet, ZONE). Jarrett Gilgeous-Alexander misses. Rebound secured by Trae Barnes.

[09:25] Team_016 possession (Score: 78-68)
Lamelo Herro attempts a Layup. Contested by Draymond Williamson (5.1 feet, MAN). LAMELO HERRO MAKES IT! Assist: Trae Barnes
Score: 80-68

[09:11] Team_058 possession (Score: 80-68)
Jarrett Gilgeous-Alexander drives to the basket... Jarrett Gilgeous-Alexander throws a bad pass out of bounds! TURNOVER! (dead ball)

[08:52] Team_016 possession (Score: 80-68)
Trae Barnes drives to the basket... Trae Barnes throws a bad pass out of bounds! TURNOVER! (dead ball)

[08:36] Team_058 possession (Score: 80-68)
FOUL! Holding foul on Trae Barnes. [Team fouls: 1] No free throws, side out. (Trae Barnes: 1 personal fouls)

[08:25] Team_058 possession (Score: 80-68)
Shai Lowry attempts a Midrange. Contested by Giannis Doncic (3.8 feet, ZONE). Shai Lowry misses. Rebound secured by Lamelo Herro.

[08:07] Team_016 possession (Score: 80-68)
FOUL! Shooting foul on Pascal Holiday. Trae Barnes to the line for 2 free throws. [Team fouls: 4] (Pascal Holiday: 1 personal fouls)   FT 1/2: GOOD   FT 2/2: MISS Trae Barnes makes 1/2 from the line. Rebound secured by Pascal Holiday.
Score: 81-68

[07:54] Team_058 possession (Score: 81-68)
Jarrett Gilgeous-Alexander loses control! Ball rolls out of bounds! TURNOVER! (dead ball)

[07:44] Team_016 possession (Score: 81-68)
Giannis Doncic attempts a Layup. BLOCKED BY SHAI LOWRY! Ball is loose! Rebound secured by Jarrett Gilgeous-Alexander.

[07:27] Team_058 possession (Score: 81-68)
Shai Lowry attempts a Layup. Wide open! Giannis Doncic is 6.8 feet away. [MAN] Shai Lowry misses. Rebound secured by Lamelo Herro.

[07:08] Team_016 possession (Score: 81-68)
Giannis Doncic attempts a Midrange. BLOCKED BY SHAI LOWRY! Ball deflects out of bounds off Giannis Doncic.

[06:50] Team_058 possession (Score: 81-68)
Jordan Ingram drives and kicks out. Jordan Ingram attempts a Midrange. Contested by Kevin Butler (2.7 feet, ZONE). JORDAN INGRAM MAKES IT!
Score: 81-70

[06:38] Team_016 possession (Score: 81-70)
Trae Barnes drives, Jarrett Gilgeous-Alexander stays with him. Trae Barnes attempts a Layup. Wide open! Jarrett Gilgeous-Alexander is 7.1 feet away. [MAN] Trae Barnes misses. Rebound secured by Jarrett Gilgeous-Alexander.

[06:23] Team_058 possession (Score: 81-70)
Shai Lowry attempts a 3Pt. Contested by Lamelo Herro (5.6 feet, ZONE). Shai Lowry misses. Rebound secured by Giannis Doncic.

[06:07] Team_016 possession (Score: 81-70)
Lamelo Herro attempts a Layup. Heavily contested by Draymond Williamson (1.0 feet, MAN)! LAMELO HERRO MAKES IT!
Score: 83-70

[05:52] Team_058 possession (Score: 83-70)
Shai Lowry drives, Giannis Doncic stays with him. Shai Lowry attempts a Dunk. Contested by Giannis Doncic (3.0 feet, MAN). Shai Lowry misses. Rebound secured by Giannis Doncic.

[05:37] Team_016 possession (Score: 83-70)
Lamelo Herro attempts a 3Pt. Contested by Draymond Williamson (3.7 feet, ZONE). LAMELO HERRO MAKES IT!
Score: 86-70

[05:25] Team_058 possession (Score: 86-70)
Jordan Ingram attempts a 3Pt. Heavily contested by Immanuel Nowitzki (1.7 feet, MAN)! Jordan Ingram misses. Rebound secured by Trae Barnes.

[05:12] Team_016 possession (Score: 86-70)
Giannis Doncic attempts a 3Pt. Wide open! Draymond Williamson is 6.7 feet away. [ZONE] Giannis Doncic misses. Rebound secured by Pascal Holiday.

[04:53] Team_058 possession (Score: 86-70)
Pascal Holiday attempts a 3Pt. Contested by Kevin Butler (5.4 feet, MAN). Pascal Holiday misses. Rebound secured by Trae Barnes.

[04:36] Team_016 possession (Score: 86-70)
Immanuel Nowitzki attempts a 3Pt. Wide open! Jordan Ingram is 6.1 feet away. [ZONE] IMMANUEL NOWITZKI MAKES IT! Assist: Lamelo Herro
Score: 89-70

[04:23] Team_058 possession (Score: 89-70)
FOUL! Shooting foul on Lamelo Herro. Draymond Williamson to the line for 2 free throws. [Team fouls: 2] (Lamelo Herro: 1 personal fouls)   FT 1/2: MISS   FT 2/2: GOOD Draymond Williamson makes 1/2 from the line.
Score: 89-71

[04:10] Team_016 possession (Score: 89-71)
FOUL! Holding foul on Shai Lowry. [IN THE BONUS! 5 team fouls] Giannis Doncic to the line for 2 free throws. (Shai Lowry: 2 personal fouls)   FT 1/2: GOOD   FT 2/2: GOOD Giannis Doncic makes 2/2 from the line.
Score: 91-71

[03:56] Team_058 possession (Score: 91-71)
Jarrett Gilgeous-Alexander attempts a Midrange. Contested by Giannis Doncic (4.8 feet, ZONE). Jarrett Gilgeous-Alexander misses. Rebound secured by Giannis Doncic.

[03:39] Team_016 possession (Score: 91-71)
Lamelo Herro attempts a 3Pt. Contested by Pascal Holiday (4.5 feet, ZONE). Lamelo Herro misses. Rebound secured by Jarrett Gilgeous-Alexander.

[03:28] Team_058 possession (Score: 91-71)
Draymond Williamson attempts a 3Pt. Contested by Lamelo Herro (5.5 feet, ZONE). Draymond Williamson misses. Rebound secured by Trae Barnes.

[03:12] Team_016 possession (Score: 91-71)
Trae Barnes attempts a Layup. Contested by Jarrett Gilgeous-Alexander (3.3 feet, MAN). TRAE BARNES MAKES IT! Assist: Giannis Doncic
Score: 93-71

[02:58] Team_058 possession (Score: 93-71)
Draymond Williamson attempts a 3Pt. Contested by Lamelo Herro (5.1 feet, ZONE). DRAYMOND WILLIAMSON MAKES IT! Assist: Pascal Holiday
Score: 93-74

[02:44] Team_016 possession (Score: 93-74)
Trae Barnes attempts a Midrange. Contested by Jarrett Gilgeous-Alexander (3.0 feet, MAN). TRAE BARNES MAKES IT!
Score: 95-74

[02:28] Team_058 possession (Score: 95-74)
Pascal Holiday attempts a 3Pt. Contested by Lamelo Herro (2.4 feet, ZONE). PASCAL HOLIDAY MAKES IT! Assist: Draymond Williamson
Score: 95-77

[02:12] Team_016 possession (Score: 95-77)
Giannis Doncic attempts a 3Pt. Contested by Shai Lowry (3.2 feet, MAN). Giannis Doncic misses. Rebound secured by Pascal Holiday.

[01:57] Team_058 possession (Score: 95-77)
Draymond Williamson drives, picks up Lamelo Herro. Help arrives from Kevin Butler! Draymond Williamson attempts a Dunk. Wide open! Kevin Butler is 7.3 feet away. [MAN] Draymond Williamson misses. Offensive rebound by Pascal Holiday! Pascal Holiday puts it back in!
Score: 95-79

[01:40] Team_016 possession (Score: 95-79)
Giannis Doncic drives to the basket... Giannis Doncic throws a bad pass out of bounds! TURNOVER! (dead ball)

[01:30] Team_058 possession (Score: 95-79)
Pascal Holiday drives and kicks out. Jordan Ingram attempts a 3Pt. Contested by Lamelo Herro (4.7 feet, ZONE). Jordan Ingram misses. Offensive rebound by Shai Lowry! Shai Lowry kicks it out.

[01:12] Team_058 possession (Score: 95-79)
Pascal Holiday drives, Kevin Butler stays with him. Pascal Holiday attempts a Dunk. Contested by Kevin Butler (4.2 feet, MAN). PASCAL HOLIDAY MAKES IT! Assist: Jordan Ingram
Score: 95-81

[00:59] Team_016 possession (Score: 95-81)
Immanuel Nowitzki makes the Dunk and draws the foul on Shai Lowry! And-1! Immanuel Nowitzki to the line for 1. [BONUS: 6 team fouls] (Shai Lowry: 3 personal fouls)   FT 1/1: GOOD Immanuel Nowitzki makes 1/1 from the line.
Score: 98-81

[00:46] Team_058 possession (Score: 98-81)
Pascal Holiday attempts a Layup. BLOCKED BY GIANNIS DONCIC! Ball deflects out of bounds off Pascal Holiday.

[00:33] Team_016 possession (Score: 98-81)
Kevin Butler attempts a 3Pt. Contested by Pascal Holiday (2.2 feet, MAN). Kevin Butler misses. Rebound secured by Pascal Holiday.

[00:15] Team_058 possession (Score: 98-81)
FOUL! Shooting foul on Lamelo Herro. Draymond Williamson to the line for 3 free throws. [Team fouls: 3] (Lamelo Herro: 2 personal fouls)   FT 1/3: GOOD   FT 2/3: MISS   FT 3/3: GOOD Draymond Williamson makes 2/3 from the line.
Score: 98-83

================================================================================
                              4TH QUARTER COMPLETE                              
================================================================================

4TH QUARTER SCORE: Team_016 31, Team_058 17

BOX SCORE:
================================================================================

Team_016
--------------------------------------------------------------------------------
Player                MIN  PTS  REB  AST  TO      FG   FG%      3P   3P%
--------------------------------------------------------------------------------
Trae Barnes            11   10    4    1   0   4/6    66.7     0/0   0.0
Lamelo Herro           11    7    2    1   0   3/4    75.0     0/0   0.0
Immanuel Nowitzki      11    6    0    0   0   2/2   100.0     0/0   0.0
Ben Barrett            37    3    1    0   0   1/1   100.0     0/0   0.0
Giannis Ginobili       37    2    0    0   0   1/2    50.0     0/0   0.0
Giannis Doncic         11    2    3    2   0   1/5    20.0     0/0   0.0
Collin Barnes          37    0    0    1   0   0/0     0.0     0/0   0.0
Kevin Butler           11    0    0    0   0   0/1     0.0     0/0   0.0

TEAM: FG: 12/21 (57.1%), 3PT: 3/8 (37.5%), REB: 10 (0 off, 10 def), AST: 5, TO: 2
TEAM FOULS: 3


Team_058
--------------------------------------------------------------------------------
Player                MIN  PTS  REB  AST  TO      FG   FG%      3P   3P%
--------------------------------------------------------------------------------
Pascal Holiday         11    7    5    2   0   3/5    60.0     0/0   0.0
Draymond Williamson    11    6    0    1   0   3/4    75.0     0/0   0.0
Jarrett Gilgeous-Alexander   11    2    3    0   0   1/3    33.3     0/0   0.0
Jordan Ingram          11    2    0    1   0   1/2    50.0     0/0   0.0
Tyrese Doncic          37    0    1    0   0   0/1     0.0     0/0   0.0
Shai Lowry             11    0    1    0   0   0/4     0.0     0/0   0.0

TEAM: FG: 8/19 (42.1%), 3PT: 3/9 (33.3%), REB: 10 (2 off, 8 def), AST: 4, TO: 4
TEAM FOULS: 6 [Team_016 in BONUS]

================================================================================

================================================================================
                               FULL GAME COMPLETE                               
================================================================================

FINAL SCORE: Team_016 98, Team_058 83

SCORING BY QUARTER:
--------------------------------------------------------------------------------
Team                     Q1     Q2     Q3     Q4    FINAL
--------------------------------------------------------------------------------
Team_016                 26     18     23     31       98
Team_058                 18     23     25     17       83
--------------------------------------------------------------------------------

FULL GAME BOX SCORE:
================================================================================

Team_016
--------------------------------------------------------------------------------
Player                MIN  PTS  REB  AST  TO      FG   FG%      3P   3P%      FT STL BLK
--------------------------------------------------------------------------------
Collin Barnes          37    2    0    7   1   3/11   27.3   1/7    14.3   0/0     0   0
Giannis Ginobili       37   23    0    2   3   9/16   56.2   3/9    33.3   2/2     0   0
Vince Quickley         37    7   10    6   0   4/11   36.4   1/5    20.0   0/0     0   1
Ben Barrett            37   13   14    2   2   6/8    75.0   0/1     0.0   1/1     2   0
Vince Duncan           37   26   18    1   3   9/17   52.9   1/4    25.0   1/2     3   1
Lamelo Herro           11    7    2    1   0   3/4    75.0   1/2    50.0   0/0     0   0
Immanuel Nowitzki      11    6    0    0   0   2/2   100.0   1/1   100.0   1/1     0   0
Kevin Butler           11    0    0    0   1   0/2     0.0   0/2     0.0   0/0     0   0
Giannis Doncic         11    2    3    2   0   0/4     0.0   0/2     0.0   2/2     0   1
Trae Barnes            11   10    4    1   1   4/6    66.7   1/1   100.0   2/3     0   0

TEAM: FG: 41/82 (50.0%), 3PT: 9/34 (26.5%), REB: 50 (9 off, 41 def), AST: 22, TO: 11


Team_058
--------------------------------------------------------------------------------
Player                MIN  PTS  REB  AST  TO      FG   FG%      3P   3P%      FT STL BLK
--------------------------------------------------------------------------------
Bradley Sexton         37   13    7    4   1   6/13   46.2   2/6    33.3   2/2     1   1
Kyle Westbrook         37    6    0    3   1   2/10   20.0   2/5    40.0   0/0     2   0
Vince Hyland           37   15    3    5   2   7/16   43.8   3/9    33.3   0/0     0   0
Stephen Haliburton     37   13   11    0   3   4/7    57.1   0/3     0.0   1/1     1   1
Tyrese Doncic          37   15   16    2   1   6/14   42.9   0/1     0.0   4/5     0   0
Draymond Williamson    11    6    0    1   1   4/5    80.0   2/3    66.7   3/5     0   0
Jordan Ingram          11    5    0    1   1   2/3    66.7   0/1     0.0   1/1     0   0
Pascal Holiday         11    7    5    2   0   2/4    50.0   1/2    50.0   0/0     0   0
Shai Lowry             11    0    1    0   0   0/4     0.0   0/1     0.0   0/0     0   2
Jarrett Gilgeous-Alexander   11    2    4    0   1   1/3    33.3   0/1     0.0   0/0     0   0

TEAM: FG: 36/81 (44.4%), 3PT: 10/32 (31.2%), REB: 48 (9 off, 39 def), AST: 18, TO: 11

================================================================================
