================================================================================
                        FULL GAME - Team_044 vs Team_078                        
================================================================================

================================================================================
                       1ST QUARTER - Team_044 vs Team_078                       
================================================================================

[12:00] Team_044 possession (Score: 0-0)
FOUL! Shooting foul on Isaiah Simmons. Victor Westbrook to the line for 2 free throws. [Team fouls: 1] (Isaiah Simmons: 1 personal fouls)   FT 1/2: MISS   FT 2/2: GOOD Victor Westbrook makes 1/2 from the line.
Score: 1-0

[11:45] Team_078 possession (Score: 1-0)
Kyrie Carter drives, picks up Isaiah Murray. Help arrives from Victor Westbrook! Kyrie Carter attempts a Dunk. Contested by Victor Westbrook (3.3 feet, MAN). KYRIE CARTER MAKES IT! Assist: Jabari Barrett
Score: 1-2

[11:32] Team_044 possession (Score: 1-2)
Zach McGrady drives, Jabari Barnes stays with him. Zach McGrady attempts a Dunk. Contested by Jabari Barnes (3.7 feet, MAN). Zach McGrady misses. Offensive rebound by Victor Westbrook! Victor Westbrook kicks it out.

[11:19] Team_044 possession (Score: 1-2)
Ayo McCollum drives and kicks out. Karl Fox attempts a Midrange. Wide open! Ben Ginobili is 6.2 feet away. [ZONE] KARL FOX MAKES IT! Assist: Isaiah Murray
Score: 3-2

[11:02] Team_078 possession (Score: 3-2)
Jabari Barrett attempts a Midrange. Contested by Victor Westbrook (5.9 feet, ZONE). Jabari Barrett misses. Rebound secured by Victor Westbrook.

[10:47] Team_044 possession (Score: 3-2)
Zach McGrady attempts a 3Pt. Contested by Isaiah Simmons (4.0 feet, ZONE). ZACH MCGRADY MAKES IT! Assist: Isaiah Murray
Score: 6-2

[10:32] Team_078 possession (Score: 6-2)
Isaiah Simmons attempts a 3Pt. Contested by Isaiah Murray (5.3 feet, ZONE). Isaiah Simmons misses. Rebound secured by Ayo McCollum.

[10:16] Team_044 possession (Score: 6-2)
Isaiah Murray attempts a Midrange. Contested by Kyrie Carter (4.9 feet, MAN). Isaiah Murray misses. Rebound secured by Jabari Barrett.

[10:05] Team_078 possession (Score: 6-2)
Jabari Barrett drives to the basket... Jabari Barrett commits a violation (traveling/carry)! TURNOVER! (dead ball)

[09:50] Team_044 possession (Score: 6-2)
Victor Westbrook attempts a 3Pt. Heavily contested by Isaiah Simmons (1.7 feet, MAN)! Victor Westbrook misses. Rebound secured by Jabari Barrett.

[09:34] Team_078 possession (Score: 6-2)
Kyrie Carter attempts a 3Pt. Contested by Isaiah Murray (5.2 feet, ZONE). KYRIE CARTER MAKES IT! Assist: Isaiah Simmons
Score: 6-5

[09:24] Team_044 possession (Score: 6-5)
Victor Westbrook makes the Midrange and draws the foul on Isaiah Simmons! And-1! Victor Westbrook to the line for 1. [Team fouls: 2] (Isaiah Simmons: 2 personal fouls)   FT 1/1: GOOD Victor Westbrook makes 1/1 from the line.
Score: 9-5

[09:12] Team_078 possession (Score: 9-5)
Jabari Barnes attempts a Midrange. Heavily contested by Zach McGrady (1.6 feet, MAN)! Jabari Barnes misses. Rebound secured by Karl Fox.

[08:56] Team_044 possession (Score: 9-5)
Zach McGrady attempts a Midrange. Contested by Jabari Barnes (2.0 feet, MAN). ZACH MCGRADY MAKES IT! Assist: Isaiah Murray
Score: 11-5

[08:41] Team_078 possession (Score: 11-5)
Jabari Barrett attempts a Midrange. Contested by Karl Fox (3.7 feet, ZONE). Jabari Barrett misses. Rebound secured by Karl Fox.

[08:29] Team_044 possession (Score: 11-5)
Victor Westbrook attempts a 3Pt. Contested by Isaiah Simmons (5.4 feet, ZONE). Victor Westbrook misses. Rebound secured by Jabari Barrett.

[08:15] Team_078 possession (Score: 11-5)
Ben Ginobili attempts a 3Pt. Contested by Isaiah Murray (5.2 feet, ZONE). Ben Ginobili misses. Rebound secured by Karl Fox.

[08:00] Team_044 possession (Score: 11-5)
Karl Fox attempts a 3Pt. Wide open! Ben Ginobili is 9.4 feet away. [MAN] KARL FOX MAKES IT!
Score: 14-5

[07:46] Team_078 possession (Score: 14-5)
Isaiah Simmons commits a violation (traveling/carry)! TURNOVER! (dead ball)

[07:37] Team_044 possession (Score: 14-5)
Zach McGrady attempts a Midrange. Contested by Jabari Barrett (3.0 feet, ZONE). ZACH MCGRADY MAKES IT!
Score: 16-5

[07:24] Team_078 possession (Score: 16-5)
Jabari Barrett drives and kicks out. Isaiah Simmons attempts a 3Pt. Contested by Victor Westbrook (3.2 feet, MAN). ISAIAH SIMMONS MAKES IT! Assist: Ben Ginobili
Score: 16-8

[07:12] Team_044 possession (Score: 16-8)
Isaiah Murray attempts a 3Pt. Wide open! Kyrie Carter is 6.0 feet away. [MAN] ISAIAH MURRAY MAKES IT! Assist: Karl Fox
Score: 19-8

[07:00] Team_078 possession (Score: 19-8)
Isaiah Simmons attempts a Midrange. Wide open! Victor Westbrook is 6.1 feet away. [MAN] ISAIAH SIMMONS MAKES IT!
Score: 19-10

[06:44] Team_044 possession (Score: 19-10)
Karl Fox attempts a Layup. Contested by Jabari Barrett (5.5 feet, ZONE). KARL FOX MAKES IT! Assist: Ayo McCollum
Score: 21-10

[06:28] Team_078 possession (Score: 21-10)
Kyrie Carter attempts a 3Pt. Contested by Isaiah Murray (2.9 feet, ZONE). KYRIE CARTER MAKES IT! Assist: Jabari Barrett
Score: 21-13

[06:11] Team_044 possession (Score: 21-13)
FOUL! Shooting foul on Isaiah Simmons. Zach McGrady to the line for 3 free throws. [Team fouls: 3] (Isaiah Simmons: 3 personal fouls)   FT 1/3: GOOD   FT 2/3: GOOD   FT 3/3: GOOD Zach McGrady makes 3/3 from the line.
Score: 24-13

[05:53] Team_078 possession (Score: 24-13)
Ben Ginobili attempts a Midrange. Contested by Isaiah Murray (5.1 feet, ZONE). Ben Ginobili misses. Offensive rebound by Isaiah Simmons! Isaiah Simmons's putback is no good. Rebound secured by Ayo McCollum.

[05:38] Team_044 possession (Score: 24-13)
Karl Fox attempts a Midrange. Wide open! Isaiah Simmons is 6.3 feet away. [ZONE] KARL FOX MAKES IT! Assist: Ayo McCollum
Score: 26-13

[05:24] Team_078 possession (Score: 26-13)
Kyrie Carter drives to the basket... Kyrie Carter throws a bad pass! Stolen by Karl Fox! TURNOVER! (live ball)

[05:09] Team_044 possession (Score: 26-13)
Victor Westbrook attempts a Layup. Contested by Isaiah Simmons (2.9 feet, MAN). VICTOR WESTBROOK MAKES IT! Assist: Isaiah Murray
Score: 28-13

[04:57] Team_078 possession (Score: 28-13)
Jabari Barrett attempts a Midrange. Contested by Zach McGrady (5.2 feet, ZONE). Jabari Barrett misses. Rebound secured by Ayo McCollum.

[04:45] Team_044 possession (Score: 28-13)
Karl Fox attempts a 3Pt. Contested by Isaiah Simmons (4.1 feet, ZONE). Karl Fox misses. Rebound secured by Ben Ginobili.

[04:25] Team_078 possession (Score: 28-13)
Kyrie Carter attempts a 3Pt. Contested by Isaiah Murray (5.3 feet, ZONE). Kyrie Carter misses. Rebound secured by Karl Fox.

[04:11] Team_044 possession (Score: 28-13)
Karl Fox attempts a Midrange. Contested by Ben Ginobili (5.5 feet, MAN). KARL FOX MAKES IT!
Score: 30-13

[03:58] Team_078 possession (Score: 30-13)
Isaiah Simmons attempts a 3Pt. Contested by Victor Westbrook (5.9 feet, MAN). ISAIAH SIMMONS MAKES IT! Assist: Jabari Barrett
Score: 30-16

[03:44] Team_044 possession (Score: 30-16)
Isaiah Murray throws a bad pass out of bounds! TURNOVER! (dead ball)

[03:44] Substitution (Team_044): Ayo McCollum OUT → Victor Anthony IN (stamina_rule2)

[03:29] Team_078 possession (Score: 30-16)
Kyrie Carter attempts a 3Pt. Contested by Isaiah Murray (4.7 feet, MAN). Kyrie Carter misses. Rebound secured by Karl Fox.

[03:16] Team_044 possession (Score: 30-16)
Victor Westbrook attempts a Midrange. Contested by Ben Ginobili (4.9 feet, ZONE). VICTOR WESTBROOK MAKES IT!
Score: 32-16

[03:04] Team_078 possession (Score: 32-16)
Jabari Barnes attempts a 3Pt. Heavily contested by Zach McGrady (0.6 feet, MAN)! Jabari Barnes misses. Rebound secured by Victor Westbrook.

[02:46] Team_044 possession (Score: 32-16)
Zach McGrady drives, Jabari Barnes stays with him. Zach McGrady attempts a Layup. Contested by Jabari Barnes (2.5 feet, MAN). ZACH MCGRADY MAKES IT!
Score: 34-16

[02:33] Team_078 possession (Score: 34-16)
Jabari Barnes attempts a 3Pt. Contested by Zach McGrady (4.9 feet, MAN). JABARI BARNES MAKES IT! Assist: Kyrie Carter
Score: 34-19

[02:19] Team_044 possession (Score: 34-19)
Zach McGrady attempts a Midrange. Contested by Isaiah Simmons (6.0 feet, ZONE). ZACH MCGRADY MAKES IT!
Score: 36-19

[02:07] Team_078 possession (Score: 36-19)
Isaiah Simmons attempts a Midrange. Wide open! Victor Westbrook is 7.5 feet away. [MAN] Isaiah Simmons misses. Rebound secured by Victor Anthony.

[01:52] Team_044 possession (Score: 36-19)
Isaiah Murray attempts a Midrange. Contested by Kyrie Carter (3.3 feet, MAN). Isaiah Murray misses. Rebound secured by Isaiah Simmons.

[01:36] Team_078 possession (Score: 36-19)
Jabari Barrett attempts a Midrange. Contested by Victor Anthony (4.4 feet, MAN). Jabari Barrett misses. Rebound secured by Karl Fox.

[01:25] Team_044 possession (Score: 36-19)
Zach McGrady attempts a 3Pt. Wide open! Jabari Barnes is 6.3 feet away. [MAN] Zach McGrady misses. Rebound secured by Ben Ginobili.

[01:14] Team_078 possession (Score: 36-19)
Kyrie Carter throws a bad pass! Stolen by Isaiah Murray! TURNOVER! (live ball)

[01:03] Team_044 possession (Score: 36-19)
Isaiah Murray drives, picks up Kyrie Carter. Help arrives from Isaiah Simmons! Isaiah Murray attempts a Dunk. Contested by Isaiah Simmons (2.8 feet, MAN). Isaiah Murray misses. Rebound secured by Isaiah Simmons.

[00:47] Team_078 possession (Score: 36-19)
Jabari Barrett attempts a Layup. BLOCKED BY VICTOR ANTHONY! Ball is loose! Offensive rebound by Isaiah Simmons! Isaiah Simmons kicks it out.

[00:35] Team_078 possession (Score: 36-19)
Jabari Barrett drives, picks up Victor Anthony. Help arrives from Zach McGrady! Jabari Barrett attempts a Layup. Contested by Zach McGrady (5.1 feet, MAN). Jabari Barrett misses. Rebound secured by Victor Anthony.

[00:15] Team_044 possession (Score: 36-19)
Zach McGrady drives, Jabari Barrett stays with him. Zach McGrady attempts a Dunk. Wide open! Jabari Barrett is 6.8 feet away. [ZONE] Zach McGrady misses. Rebound secured by Jabari Barrett.

[00:01] Team_078 possession (Score: 36-19)
Jabari Barnes attempts a 3Pt. Wide open! Zach McGrady is 6.7 feet away. [MAN] JABARI BARNES MAKES IT! Assist: Kyrie Carter
Score: 36-22

================================================================================
                              1ST QUARTER COMPLETE                              
================================================================================

1ST QUARTER SCORE: Team_044 36, Team_078 22

BOX SCORE:
================================================================================

Team_044
--------------------------------------------------------------------------------
Player                MIN  PTS  REB  AST  TO      FG   FG%      3P   3P%
--------------------------------------------------------------------------------
Zach McGrady           12   14    0    0   0   6/8    75.0     0/0   0.0
Karl Fox               12   11    6    1   0   5/6    83.3     0/0   0.0
Victor Westbrook       12    8    3    0   0   4/6    66.7     0/0   0.0
Isaiah Murray          12    3    0    4   0   1/4    25.0     0/0   0.0
Ayo McCollum            9    0    3    2   0   0/0     0.0     0/0   0.0
Victor Anthony          4    0    2    0   0   0/0     0.0     0/0   0.0

TEAM: FG: 16/24 (66.7%), 3PT: 4/8 (50.0%), REB: 13 (1 off, 12 def), AST: 7, TO: 1
TEAM FOULS: 1


Team_078
--------------------------------------------------------------------------------
Player                MIN  PTS  REB  AST  TO      FG   FG%      3P   3P%
--------------------------------------------------------------------------------
Kyrie Carter           12    8    0    2   0   3/5    60.0     0/0   0.0
Isaiah Simmons         12    8    3    1   0   3/5    60.0     0/0   0.0
Jabari Barnes          12    6    0    0   0   2/4    50.0     0/0   0.0
Jabari Barrett         12    0    4    3   0   0/5     0.0     0/0   0.0
Ben Ginobili           12    0    2    1   0   0/2     0.0     0/0   0.0

TEAM: FG: 8/21 (38.1%), 3PT: 5/10 (50.0%), REB: 10 (2 off, 8 def), AST: 7, TO: 4
TEAM FOULS: 3

================================================================================

================================================================================
                       2ND QUARTER - Team_044 vs Team_078                       
================================================================================

[12:00] Team_044 possession (Score: 36-22)
Victor Westbrook attempts a 3Pt. Contested by Isaiah Simmons (2.2 feet, MAN). Victor Westbrook misses. Rebound secured by Jabari Barrett.

[11:43] Team_078 possession (Score: 36-22)
Ben Ginobili drives to the basket... Ben Ginobili commits a violation (traveling/carry)! TURNOVER! (dead ball)

[11:43] Substitution (Team_044): Zach McGrady OUT → Kyrie Poole IN (stamina_rule2)

[11:43] Substitution (Team_044): Isaiah Murray OUT → Tim Towns IN (stamina_rule2)

[11:43] Substitution (Team_044): Victor Westbrook OUT → Tim Siakam IN (stamina_rule2)

[11:43] Substitution (Team_044): Karl Fox OUT → Pau Quickley IN (stamina_rule2)

[11:43] Substitution (Team_078): Jabari Barnes OUT → Magic Barrett IN (stamina_rule2)

[11:43] Substitution (Team_078): Kyrie Carter OUT → Damian Allen IN (stamina_rule2)

[11:43] Substitution (Team_078): Isaiah Simmons OUT → Malcolm Randle IN (stamina_rule2)

[11:43] Substitution (Team_078): Ben Ginobili OUT → Paul Ming IN (stamina_rule2)

[11:43] Substitution (Team_078): Jabari Barrett OUT → Draymond Irving IN (stamina_rule2)

[11:30] Team_044 possession (Score: 36-22)
Tim Siakam attempts a Midrange. Wide open! Damian Allen is 8.4 feet away. [ZONE] Tim Siakam misses. Rebound secured by Malcolm Randle.

[11:15] Team_078 possession (Score: 36-22)
Malcolm Randle attempts a 3Pt. Contested by Tim Siakam (5.4 feet, ZONE). MALCOLM RANDLE MAKES IT! Assist: Draymond Irving
Score: 36-25

[11:01] Team_044 possession (Score: 36-25)
Pau Quickley drives to the basket... Pau Quickley loses the ball! Stripped by Paul Ming! TURNOVER! (live ball)

[10:46] Team_078 possession (Score: 36-25)
Malcolm Randle makes the Layup and draws the foul on Tim Siakam! And-1! Malcolm Randle to the line for 1. [Team fouls: 1] (Tim Siakam: 1 personal fouls)   FT 1/1: GOOD Malcolm Randle makes 1/1 from the line.
Score: 36-28

[10:35] Team_044 possession (Score: 36-28)
Kyrie Poole drives, picks up Paul Ming. Help arrives from Damian Allen! Kyrie Poole attempts a Layup. Heavily contested by Damian Allen (1.6 feet, ZONE)! KYRIE POOLE MAKES IT! Assist: Ayo McCollum
Score: 38-28

[10:19] Team_078 possession (Score: 38-28)
Draymond Irving drives and kicks out. FOUL! Shooting foul on Pau Quickley. Magic Barrett to the line for 2 free throws. [Team fouls: 2] (Pau Quickley: 1 personal fouls)   FT 1/2: GOOD   FT 2/2: GOOD Magic Barrett makes 2/2 from the line.
Score: 38-30

[10:00] Team_044 possession (Score: 38-30)
Ayo McCollum makes the Layup and draws the foul on Paul Ming! And-1! Ayo McCollum to the line for 1. [Team fouls: 1] (Paul Ming: 1 personal fouls)   FT 1/1: GOOD Ayo McCollum makes 1/1 from the line.
Score: 41-30

[09:46] Team_078 possession (Score: 41-30)
Malcolm Randle attempts a 3Pt. Heavily contested by Tim Siakam (1.9 feet, MAN)! Malcolm Randle misses. Rebound secured by Pau Quickley.

[09:32] Team_044 possession (Score: 41-30)
Tim Towns attempts a 3Pt. Contested by Damian Allen (4.2 feet, MAN). Tim Towns misses. Rebound secured by Malcolm Randle.

[09:18] Team_078 possession (Score: 41-30)
Malcolm Randle drives, Tim Siakam stays with him. Malcolm Randle attempts a Dunk. Contested by Tim Siakam (5.7 feet, MAN). MALCOLM RANDLE MAKES IT!
Score: 41-32

[09:03] Team_044 possession (Score: 41-32)
Kyrie Poole attempts a 3Pt. Contested by Magic Barrett (2.2 feet, MAN). Kyrie Poole misses. FOUL! Loose ball foul on Malcolm Randle during the rebound battle. [Team fouls: 2] No free throws, side out. (Malcolm Randle: 1 personal fouls)

[08:53] Team_044 possession (Score: 41-32)
Tim Siakam attempts a Layup. Contested by Malcolm Randle (5.4 feet, MAN). TIM SIAKAM MAKES IT!
Score: 43-32

[08:40] Team_078 possession (Score: 43-32)
Magic Barrett attempts a Midrange. Contested by Pau Quickley (2.6 feet, ZONE). MAGIC BARRETT MAKES IT!
Score: 43-34

[08:25] Team_044 possession (Score: 43-34)
Pau Quickley drives, Paul Ming stays with him. Pau Quickley attempts a Dunk. Wide open! Paul Ming is 6.0 feet away. [MAN] Pau Quickley misses. Rebound secured by Paul Ming.

[08:13] Team_078 possession (Score: 43-34)
Draymond Irving attempts a Midrange. Wide open! Pau Quickley is 7.1 feet away. [ZONE] Draymond Irving misses. Rebound secured by Tim Siakam.

[07:56] Team_044 possession (Score: 43-34)
Tim Siakam drives to the basket... Tim Siakam throws a bad pass out of bounds! TURNOVER! (dead ball)

[07:56] Substitution (Team_044): Ayo McCollum OUT → Victor Anthony IN (stamina_rule2)

[07:43] Team_078 possession (Score: 43-34)
Damian Allen attempts a 3Pt. Contested by Pau Quickley (2.7 feet, ZONE). DAMIAN ALLEN MAKES IT! Assist: Paul Ming
Score: 43-37

[07:30] Team_044 possession (Score: 43-37)
Pau Quickley makes the Layup and draws the foul on Paul Ming! And-1! Pau Quickley to the line for 1. [Team fouls: 3] (Paul Ming: 2 personal fouls)   FT 1/1: GOOD Pau Quickley makes 1/1 from the line.
Score: 46-37

[07:14] Team_078 possession (Score: 46-37)
Draymond Irving drives to the basket... Draymond Irving loses the ball! Stripped by Pau Quickley! TURNOVER! (live ball)

[07:03] Team_044 possession (Score: 46-37)
Victor Anthony attempts a Midrange. Wide open! Draymond Irving is 7.7 feet away. [MAN] Victor Anthony misses. Rebound secured by Malcolm Randle.

[06:45] Team_078 possession (Score: 46-37)
Magic Barrett attempts a 3Pt. Wide open! Tim Siakam is 8.1 feet away. [ZONE] Magic Barrett misses. Rebound secured by Victor Anthony.

[06:28] Team_044 possession (Score: 46-37)
Tim Towns attempts a 3Pt. Wide open! Damian Allen is 7.5 feet away. [ZONE] Tim Towns misses. Offensive rebound by Victor Anthony! Victor Anthony kicks it out.

[06:13] Team_044 possession (Score: 46-37)
Victor Anthony attempts a Midrange. Contested by Damian Allen (3.3 feet, ZONE). Victor Anthony misses. Offensive rebound by Victor Anthony! Victor Anthony kicks it out.

[05:57] Team_044 possession (Score: 46-37)
Victor Anthony drives to the basket... Victor Anthony throws a bad pass! Stolen by Draymond Irving! TURNOVER! (live ball)

[05:45] Team_078 possession (Score: 46-37)
Draymond Irving attempts a 3Pt. Contested by Victor Anthony (4.5 feet, MAN). Draymond Irving misses. Offensive rebound by Draymond Irving! Draymond Irving kicks it out.

[05:28] Team_078 possession (Score: 46-37)
Magic Barrett attempts a Layup. Heavily contested by Pau Quickley (0.7 feet, ZONE)! Magic Barrett misses. Rebound secured by Tim Siakam.

[05:13] Team_044 possession (Score: 46-37)
FOUL! Shooting foul on Damian Allen. Kyrie Poole to the line for 2 free throws. [Team fouls: 4] (Damian Allen: 1 personal fouls)   FT 1/2: GOOD   FT 2/2: GOOD Kyrie Poole makes 2/2 from the line.
Score: 48-37

[04:55] Team_078 possession (Score: 48-37)
Damian Allen attempts a 3Pt. Contested by Tim Towns (5.3 feet, MAN). DAMIAN ALLEN MAKES IT! Assist: Magic Barrett
Score: 48-40

[04:38] Team_044 possession (Score: 48-40)
Victor Anthony attempts a Layup. Contested by Draymond Irving (3.6 feet, MAN). VICTOR ANTHONY MAKES IT! Assist: Pau Quickley
Score: 50-40

[04:19] Team_078 possession (Score: 50-40)
FOUL! Shooting foul on Tim Siakam. Malcolm Randle to the line for 2 free throws. [Team fouls: 3] (Tim Siakam: 2 personal fouls)   FT 1/2: GOOD   FT 2/2: GOOD Malcolm Randle makes 2/2 from the line.
Score: 50-42

[04:06] Team_044 possession (Score: 50-42)
Kyrie Poole attempts a Midrange. Wide open! Magic Barrett is 7.9 feet away. [ZONE] KYRIE POOLE MAKES IT!
Score: 52-42

[03:53] Team_078 possession (Score: 52-42)
Malcolm Randle attempts a Midrange. Contested by Tim Siakam (2.6 feet, MAN). Malcolm Randle misses. Rebound secured by Pau Quickley.

[03:38] Team_044 possession (Score: 52-42)
Victor Anthony drives to the basket... Victor Anthony loses control! Ball rolls out of bounds! TURNOVER! (dead ball)

[03:19] Team_078 possession (Score: 52-42)
Malcolm Randle drives and kicks out. FOUL! Shooting foul on Tim Towns. Damian Allen to the line for 2 free throws. [Team fouls: 4] (Tim Towns: 1 personal fouls)   FT 1/2: MISS   FT 2/2: GOOD Damian Allen makes 1/2 from the line.
Score: 52-43

[03:07] Team_044 possession (Score: 52-43)
Victor Anthony drives, Paul Ming stays with him. Victor Anthony attempts a Layup. Wide open! Paul Ming is 7.5 feet away. [ZONE] VICTOR ANTHONY MAKES IT! Assist: Tim Siakam
Score: 54-43

[02:53] Team_078 possession (Score: 54-43)
Damian Allen attempts a 3Pt. Contested by Kyrie Poole (5.5 feet, ZONE). Damian Allen misses. Rebound secured by Tim Siakam.

[02:41] Team_044 possession (Score: 54-43)
FOUL! Shooting foul on Paul Ming. Kyrie Poole to the line for 2 free throws. [BONUS: 5 team fouls] (Paul Ming: 3 personal fouls)   FT 1/2: MISS   FT 2/2: GOOD Kyrie Poole makes 1/2 from the line.
Score: 55-43

[02:30] Team_078 possession (Score: 55-43)
Damian Allen attempts a Layup. Contested by Pau Quickley (2.9 feet, ZONE). Damian Allen misses. Rebound secured by Pau Quickley.

[02:16] Team_044 possession (Score: 55-43)
Tim Siakam attempts a 3Pt. Contested by Damian Allen (5.4 feet, ZONE). Tim Siakam misses. Rebound secured by Draymond Irving.

[01:59] Team_078 possession (Score: 55-43)
Magic Barrett attempts a 3Pt. Contested by Kyrie Poole (4.7 feet, MAN). Magic Barrett misses. Rebound secured by Victor Anthony.

[01:45] Team_044 possession (Score: 55-43)
Tim Towns attempts a 3Pt. Contested by Damian Allen (4.9 feet, ZONE). Tim Towns misses. Rebound secured by Malcolm Randle.

[01:31] Team_078 possession (Score: 55-43)
Malcolm Randle attempts a 3Pt. Contested by Tim Siakam (2.7 feet, MAN). Malcolm Randle misses. Rebound secured by Tim Siakam.

[01:16] Team_044 possession (Score: 55-43)
Victor Anthony drives to the basket... Victor Anthony loses the ball! Stripped by Draymond Irving! TURNOVER! (live ball)

[01:00] Team_078 possession (Score: 55-43)
Magic Barrett attempts a Midrange. Contested by Pau Quickley (2.9 feet, ZONE). Magic Barrett misses. Offensive rebound by Draymond Irving! Draymond Irving kicks it out.

[00:46] Team_078 possession (Score: 55-43)
Draymond Irving drives to the basket... Draymond Irving throws a bad pass! Stolen by Victor Anthony! TURNOVER! (live ball)

[00:30] Team_044 possession (Score: 55-43)
Victor Anthony drives, Paul Ming stays with him. Victor Anthony attempts a Layup. Contested by Paul Ming (2.6 feet, ZONE). Victor Anthony misses. Rebound secured by Draymond Irving.

[00:14] Team_078 possession (Score: 55-43)
Draymond Irving drives to the basket... Draymond Irving throws a bad pass! Stolen by Victor Anthony! TURNOVER! (live ball)

================================================================================
                              2ND QUARTER COMPLETE                              
================================================================================

2ND QUARTER SCORE: Team_044 19, Team_078 21

BOX SCORE:
================================================================================

Team_044
--------------------------------------------------------------------------------
Player                MIN  PTS  REB  AST  TO      FG   FG%      3P   3P%
--------------------------------------------------------------------------------
Kyrie Poole            12    7    0    0   0   4/4   100.0     0/0   0.0
Victor Anthony         12    4    4    0   0   2/4    50.0     0/0   0.0
Ayo McCollum           13    3    1    1   0   1/1   100.0     0/0   0.0
Pau Quickley           12    3    3    1   0   1/2    50.0     0/0   0.0
Tim Siakam             12    2    4    1   0   1/3    33.3     0/0   0.0
Victor Westbrook       13    0    0    0   0   0/1     0.0     0/0   0.0
Tim Towns              12    0    0    0   0   0/2     0.0     0/0   0.0

TEAM: FG: 9/17 (52.9%), 3PT: 0/4 (0.0%), REB: 12 (3 off, 9 def), AST: 3, TO: 5
TEAM FOULS: 4


Team_078
--------------------------------------------------------------------------------
Player                MIN  PTS  REB  AST  TO      FG   FG%      3P   3P%
--------------------------------------------------------------------------------
Malcolm Randle         12   10    4    0   0   4/7    57.1     0/0   0.0
Damian Allen           12    7    0    0   0   3/5    60.0     0/0   0.0
Magic Barrett          12    4    0    1   0   2/5    40.0     0/0   0.0
Jabari Barrett         13    0    1    0   0   0/0     0.0     0/0   0.0
Draymond Irving        12    0    4    1   0   0/1     0.0     0/0   0.0
Paul Ming              12    0    1    1   0   0/0     0.0     0/0   0.0

TEAM: FG: 9/18 (50.0%), 3PT: 3/8 (37.5%), REB: 10 (2 off, 8 def), AST: 3, TO: 4
TEAM FOULS: 5 [Team_044 in BONUS]

================================================================================

================================================================================
                       3RD QUARTER - Team_044 vs Team_078                       
================================================================================

[12:00] Team_044 possession (Score: 55-43)
Isaiah Murray attempts a Layup. Wide open! Jabari Barrett is 7.0 feet away. [ZONE] ISAIAH MURRAY MAKES IT! Assist: Karl Fox
Score: 57-43

[11:44] Team_078 possession (Score: 57-43)
Jabari Barrett drives and kicks out. Ben Ginobili attempts a 3Pt. Contested by Karl Fox (5.7 feet, MAN). Ben Ginobili misses. Offensive rebound by Isaiah Simmons! Isaiah Simmons puts it back in!
Score: 57-45

[11:25] Team_044 possession (Score: 57-45)
Karl Fox drives, picks up Ben Ginobili. Help arrives from Kyrie Carter! Karl Fox attempts a Layup. Contested by Kyrie Carter (3.0 feet, MAN). KARL FOX MAKES IT! Assist: Victor Westbrook
Score: 59-45

[11:12] Team_078 possession (Score: 59-45)
Kyrie Carter loses control! Ball rolls out of bounds! TURNOVER! (dead ball)

[10:56] Team_044 possession (Score: 59-45)
Ayo McCollum drives, Jabari Barrett stays with him. Ayo McCollum attempts a Dunk. Contested by Jabari Barrett (3.8 feet, ZONE). Ayo McCollum misses. Rebound secured by Isaiah Simmons.

[10:44] Team_078 possession (Score: 59-45)
Kyrie Carter attempts a 3Pt. Contested by Isaiah Murray (4.7 feet, ZONE). Kyrie Carter misses. Rebound secured by Karl Fox.

[10:26] Team_044 possession (Score: 59-45)
Ayo McCollum attempts a Layup. Contested by Jabari Barrett (3.8 feet, ZONE). AYO MCCOLLUM MAKES IT! Assist: Karl Fox
Score: 61-45

[10:15] Team_078 possession (Score: 61-45)
Ben Ginobili attempts a 3Pt. Contested by Karl Fox (5.9 feet, MAN). Ben Ginobili misses. Rebound secured by Victor Westbrook.

[10:01] Team_044 possession (Score: 61-45)
Karl Fox drives to the basket... Karl Fox loses the ball! Stripped by Ben Ginobili! TURNOVER! (live ball)

[09:47] Team_078 possession (Score: 61-45)
Ben Ginobili attempts a Layup. Wide open! Karl Fox is 7.9 feet away. [MAN] BEN GINOBILI MAKES IT! Assist: Kyrie Carter
Score: 61-47

[09:29] Team_044 possession (Score: 61-47)
Victor Westbrook attempts a Midrange. Contested by Isaiah Simmons (3.8 feet, MAN). VICTOR WESTBROOK MAKES IT! Assist: Karl Fox
Score: 63-47

[09:14] Team_078 possession (Score: 63-47)
Jabari Barnes throws a bad pass out of bounds! TURNOVER! (dead ball)

[09:01] Team_044 possession (Score: 63-47)
Victor Westbrook attempts a Midrange. Contested by Ben Ginobili (3.8 feet, ZONE). Victor Westbrook misses. Rebound secured by Jabari Barrett.

[08:45] Team_078 possession (Score: 63-47)
Ben Ginobili attempts a Layup. Contested by Ayo McCollum (5.6 feet, ZONE). BEN GINOBILI MAKES IT!
Score: 63-49

[08:35] Team_044 possession (Score: 63-49)
Ayo McCollum drives to the basket... Ayo McCollum throws a bad pass out of bounds! TURNOVER! (dead ball)

[08:16] Team_078 possession (Score: 63-49)
Ben Ginobili drives and kicks out. Isaiah Simmons attempts a Midrange. Wide open! Victor Westbrook is 6.1 feet away. [ZONE] ISAIAH SIMMONS MAKES IT! Assist: Jabari Barrett
Score: 63-51

[08:05] Team_044 possession (Score: 63-51)
Karl Fox attempts a Midrange. Wide open! Jabari Barnes is 7.1 feet away. [ZONE] Karl Fox misses. Rebound secured by Isaiah Simmons.

[07:51] Team_078 possession (Score: 63-51)
Isaiah Simmons attempts a 3Pt. Contested by Victor Westbrook (4.6 feet, MAN). Isaiah Simmons misses. Offensive rebound by Jabari Barrett! Jabari Barrett kicks it out.

[07:39] Team_078 possession (Score: 63-51)
Kyrie Carter attempts a 3Pt. Contested by Isaiah Murray (2.6 feet, ZONE). KYRIE CARTER MAKES IT!
Score: 63-54

[07:25] Team_044 possession (Score: 63-54)
Zach McGrady drives to the basket... Zach McGrady loses the ball! Stripped by Jabari Barnes! TURNOVER! (live ball)

[07:12] Team_078 possession (Score: 63-54)
FOUL! Offensive foul on Isaiah Simmons! Victor Westbrook drew the charge! [Team fouls: 1] (Isaiah Simmons: 1 personal fouls) TURNOVER! (dead ball)

[06:57] Team_044 possession (Score: 63-54)
Isaiah Murray drives to the basket... Isaiah Murray throws a bad pass! Stolen by Jabari Barrett! TURNOVER! (live ball)

[06:40] Team_078 possession (Score: 63-54)
Isaiah Simmons attempts a Layup. Wide open! Victor Westbrook is 7.0 feet away. [MAN] ISAIAH SIMMONS MAKES IT! Assist: Jabari Barnes
Score: 63-56

[06:26] Team_044 possession (Score: 63-56)
FOUL! Shooting foul on Jabari Barrett. Karl Fox to the line for 2 free throws. [Team fouls: 2] (Jabari Barrett: 1 personal fouls)   FT 1/2: GOOD   FT 2/2: MISS Karl Fox makes 1/2 from the line. Rebound secured by Ben Ginobili.
Score: 64-56

[06:13] Team_078 possession (Score: 64-56)
Isaiah Simmons attempts a Midrange. Wide open! Victor Westbrook is 7.3 feet away. [MAN] ISAIAH SIMMONS MAKES IT! Assist: Jabari Barnes
Score: 64-58

[05:58] Team_044 possession (Score: 64-58)
Ayo McCollum drives to the basket... FOUL! Offensive foul on Ayo McCollum! Jabari Barrett drew the charge! [Team fouls: 1] (Ayo McCollum: 1 personal fouls) TURNOVER! (dead ball)

[05:44] Team_078 possession (Score: 64-58)
Jabari Barrett attempts a Layup. Wide open! Ayo McCollum is 6.8 feet away. [ZONE] Jabari Barrett misses. Rebound secured by Victor Westbrook.

[05:28] Team_044 possession (Score: 64-58)
Isaiah Murray attempts a Midrange. Heavily contested by Kyrie Carter (1.4 feet, MAN)! ISAIAH MURRAY MAKES IT! Assist: Victor Westbrook
Score: 66-58

[05:16] Team_078 possession (Score: 66-58)
Jabari Barnes attempts a 3Pt. Contested by Isaiah Murray (4.3 feet, ZONE). Jabari Barnes misses. Rebound secured by Ayo McCollum.

[05:03] Team_044 possession (Score: 66-58)
Karl Fox attempts a 3Pt. Heavily contested by Isaiah Simmons (1.9 feet, ZONE)! Karl Fox misses. Rebound secured by Jabari Barrett.

[04:51] Team_078 possession (Score: 66-58)
Jabari Barrett attempts a Midrange. Contested by Ayo McCollum (3.2 feet, MAN). Jabari Barrett misses. Rebound secured by Karl Fox.

[04:36] Team_044 possession (Score: 66-58)
Ayo McCollum attempts a Midrange. Contested by Jabari Barrett (5.0 feet, MAN). Ayo McCollum misses. Offensive rebound by Ayo McCollum! Ayo McCollum kicks it out.

[04:22] Team_044 possession (Score: 66-58)
Victor Westbrook attempts a 3Pt. Contested by Isaiah Simmons (2.7 feet, ZONE). Victor Westbrook misses. Offensive rebound by Victor Westbrook! Victor Westbrook kicks it out.

[04:10] Team_044 possession (Score: 66-58)
Karl Fox attempts a Midrange. Wide open! Jabari Barrett is 6.8 feet away. [ZONE] KARL FOX MAKES IT! Assist: Victor Westbrook
Score: 68-58

[03:58] Team_078 possession (Score: 68-58)
FOUL! Shooting foul on Ayo McCollum. Ben Ginobili to the line for 2 free throws. [Team fouls: 2] (Ayo McCollum: 2 personal fouls)   FT 1/2: MISS   FT 2/2: GOOD Ben Ginobili makes 1/2 from the line.
Score: 68-59

[03:44] Team_044 possession (Score: 68-59)
Zach McGrady attempts a Midrange. Contested by Jabari Barnes (2.5 feet, MAN). ZACH MCGRADY MAKES IT! Assist: Victor Westbrook
Score: 70-59

[03:30] Team_078 possession (Score: 70-59)
Kyrie Carter attempts a Midrange. Contested by Zach McGrady (5.3 feet, ZONE). Kyrie Carter misses. Offensive rebound by Jabari Barrett! Jabari Barrett kicks it out.

[03:12] Team_078 possession (Score: 70-59)
FOUL! Shooting foul on Ayo McCollum. Jabari Barrett to the line for 2 free throws. [Team fouls: 3] (Ayo McCollum: 3 personal fouls)   FT 1/2: GOOD   FT 2/2: MISS Jabari Barrett makes 1/2 from the line. Rebound secured by Victor Westbrook.
Score: 70-60

[02:55] Team_044 possession (Score: 70-60)
FOUL! Holding foul on Isaiah Simmons. [Team fouls: 3] No free throws, side out. (Isaiah Simmons: 2 personal fouls)

[02:36] Team_044 possession (Score: 70-60)
FOUL! Holding foul on Isaiah Simmons. [Team fouls: 4] No free throws, side out. (Isaiah Simmons: 3 personal fouls)

[02:21] Team_044 possession (Score: 70-60)
Ayo McCollum drives, picks up Jabari Barrett. Help arrives from Kyrie Carter! Ayo McCollum attempts a Dunk. Wide open! Kyrie Carter is 6.8 feet away. [MAN] AYO MCCOLLUM MAKES IT! Assist: Zach McGrady
Score: 72-60

[02:08] Team_078 possession (Score: 72-60)
Ben Ginobili drives and kicks out. Jabari Barnes attempts a Midrange. Heavily contested by Zach McGrady (1.6 feet, MAN)! Jabari Barnes misses. Rebound secured by Karl Fox.

[01:54] Team_044 possession (Score: 72-60)
Victor Westbrook attempts a 3Pt. Wide open! Isaiah Simmons is 6.0 feet away. [MAN] Victor Westbrook misses. Offensive rebound by Victor Westbrook! Victor Westbrook kicks it out.

[01:43] Team_044 possession (Score: 72-60)
Isaiah Murray attempts a 3Pt. Contested by Isaiah Simmons (5.8 feet, ZONE). ISAIAH MURRAY MAKES IT! Assist: Victor Westbrook
Score: 75-60

[01:31] Team_078 possession (Score: 75-60)
Jabari Barrett attempts a 3Pt. Contested by Isaiah Murray (5.0 feet, ZONE). JABARI BARRETT MAKES IT! Assist: Isaiah Simmons
Score: 75-63

[01:13] Team_044 possession (Score: 75-63)
Victor Westbrook throws a bad pass! Stolen by Isaiah Simmons! TURNOVER! (live ball)

[00:56] Team_078 possession (Score: 75-63)
Kyrie Carter attempts a 3Pt. Contested by Isaiah Murray (2.2 feet, ZONE). KYRIE CARTER MAKES IT! Assist: Isaiah Simmons
Score: 75-66

[00:47] Team_044 possession (Score: 75-66)
Karl Fox drives, Jabari Barrett stays with him. Karl Fox attempts a Dunk. Wide open! Jabari Barrett is 6.2 feet away. [ZONE] KARL FOX MAKES IT!
Score: 77-66

[00:34] Team_078 possession (Score: 77-66)
Isaiah Simmons attempts a 3Pt. Wide open! Isaiah Murray is 7.0 feet away. [ZONE] ISAIAH SIMMONS MAKES IT! Assist: Kyrie Carter
Score: 77-69

[00:17] Team_044 possession (Score: 77-69)
Isaiah Murray attempts a 3Pt. Wide open! Kyrie Carter is 7.2 feet away. [MAN] ISAIAH MURRAY MAKES IT! Assist: Zach McGrady
Score: 80-69

[00:02] Team_078 possession (Score: 80-69)
Jabari Barrett attempts a Midrange. Contested by Ayo McCollum (4.1 feet, MAN). Jabari Barrett misses. Rebound secured by Karl Fox.

================================================================================
                              3RD QUARTER COMPLETE                              
================================================================================

3RD QUARTER SCORE: Team_044 25, Team_078 26

BOX SCORE:
================================================================================

Team_044
--------------------------------------------------------------------------------
Player                MIN  PTS  REB  AST  TO      FG   FG%      3P   3P%
--------------------------------------------------------------------------------
Isaiah Murray          25   10    0    0   0   4/4   100.0     0/0   0.0
Karl Fox               25    6    4    3   0   3/6    50.0     0/0   0.0
Ayo McCollum           25    4    2    0   0   2/3    66.7     0/0   0.0
Victor Westbrook       25    2    5    5   0   1/2    50.0     0/0   0.0
Zach McGrady           25    2    0    2   0   1/1   100.0     0/0   0.0

TEAM: FG: 11/16 (68.8%), 3PT: 2/3 (66.7%), REB: 11 (3 off, 8 def), AST: 10, TO: 6
TEAM FOULS: 3


Team_078
--------------------------------------------------------------------------------
Player                MIN  PTS  REB  AST  TO      FG   FG%      3P   3P%
--------------------------------------------------------------------------------
Isaiah Simmons         25   11    3    2   0   5/5   100.0     0/0   0.0
Kyrie Carter           25    6    0    2   0   2/3    66.7     0/0   0.0
Ben Ginobili           25    5    1    0   0   3/5    60.0     0/0   0.0
Jabari Barrett         25    3    4    1   0   1/5    20.0     0/0   0.0
Jabari Barnes          25    0    0    2   0   0/1     0.0     0/0   0.0

TEAM: FG: 11/19 (57.9%), 3PT: 4/7 (57.1%), REB: 8 (3 off, 5 def), AST: 7, TO: 3
TEAM FOULS: 4

================================================================================

================================================================================
                       4TH QUARTER - Team_044 vs Team_078                       
================================================================================

[12:00] Team_044 possession (Score: 80-69)
Ayo McCollum drives and kicks out. Karl Fox attempts a 3Pt. Heavily contested by Isaiah Simmons (1.0 feet, ZONE)! KARL FOX MAKES IT! Assist: Isaiah Murray
Score: 83-69

[11:51] Team_078 possession (Score: 83-69)
Ben Ginobili attempts a Midrange. Contested by Karl Fox (5.6 feet, MAN). BEN GINOBILI MAKES IT!
Score: 83-71

[11:34] Team_044 possession (Score: 83-71)
Karl Fox drives and kicks out. Victor Westbrook attempts a 3Pt. Contested by Isaiah Simmons (2.6 feet, MAN). VICTOR WESTBROOK MAKES IT! Assist: Zach McGrady
Score: 86-71

[11:18] Team_078 possession (Score: 86-71)
Jabari Barnes attempts a Layup. Wide open! Zach McGrady is 6.7 feet away. [MAN] JABARI BARNES MAKES IT!
Score: 86-73

[11:06] Team_044 possession (Score: 86-73)
Isaiah Murray attempts a Midrange. Contested by Kyrie Carter (5.4 feet, ZONE). ISAIAH MURRAY MAKES IT!
Score: 88-73

[10:48] Team_078 possession (Score: 88-73)
Ben Ginobili attempts a 3Pt. Contested by Isaiah Murray (4.6 feet, ZONE). Ben Ginobili misses. Rebound secured by Victor Westbrook.

[10:33] Team_044 possession (Score: 88-73)
FOUL! Offensive foul on Karl Fox! Ben Ginobili drew the charge! [Team fouls: 1] (Karl Fox: 1 personal fouls) TURNOVER! (dead ball)

[10:15] Team_078 possession (Score: 88-73)
Ben Ginobili attempts a 3Pt. Contested by Karl Fox (5.6 feet, MAN). Ben Ginobili misses. Rebound secured by Karl Fox.

[10:02] Team_044 possession (Score: 88-73)
FOUL! Reach-in foul on Jabari Barrett during the drive. [Team fouls: 1] No free throws, side out. (Jabari Barrett: 1 personal fouls)

[09:47] Team_044 possession (Score: 88-73)
Ayo McCollum drives, Jabari Barrett stays with him. Ayo McCollum attempts a Layup. Wide open! Jabari Barrett is 7.0 feet away. [MAN] AYO MCCOLLUM MAKES IT! Assist: Karl Fox
Score: 90-73

[09:28] Team_078 possession (Score: 90-73)
Jabari Barnes throws a bad pass! Stolen by Zach McGrady! TURNOVER! (live ball)

[09:16] Team_044 possession (Score: 90-73)
Karl Fox drives, Jabari Barrett stays with him. Karl Fox attempts a Layup. Wide open! Jabari Barrett is 6.6 feet away. [ZONE] Karl Fox misses. Rebound secured by Ben Ginobili.

[09:03] Team_078 possession (Score: 90-73)
Ben Ginobili drives, picks up Karl Fox. Help arrives from Zach McGrady! Ben Ginobili attempts a Layup. Contested by Zach McGrady (3.5 feet, ZONE). BEN GINOBILI MAKES IT! Assist: Isaiah Simmons
Score: 90-75

[08:45] Team_044 possession (Score: 90-75)
Karl Fox makes the Dunk and draws the foul on Ben Ginobili! And-1! Karl Fox to the line for 1. [Team fouls: 2] (Ben Ginobili: 1 personal fouls)   FT 1/1: MISS Karl Fox makes 0/1 from the line. Rebound secured by Jabari Barrett.
Score: 92-75

[08:29] Team_078 possession (Score: 92-75)
FOUL! Holding foul on Isaiah Murray. [Team fouls: 2] No free throws, side out. (Isaiah Murray: 1 personal fouls)

[08:18] Team_078 possession (Score: 92-75)
Isaiah Simmons attempts a 3Pt. Contested by Isaiah Murray (3.5 feet, ZONE). Isaiah Simmons misses. Rebound secured by Victor Westbrook.

[08:02] Team_044 possession (Score: 92-75)
Isaiah Murray attempts a Midrange. Wide open! Jabari Barrett is 7.3 feet away. [ZONE] Isaiah Murray misses. Offensive rebound by Ayo McCollum! Ayo McCollum kicks it out.

[07:46] Team_044 possession (Score: 92-75)
Zach McGrady attempts a Midrange. Wide open! Jabari Barnes is 8.2 feet away. [MAN] Zach McGrady misses. Rebound secured by Isaiah Simmons.

[07:30] Team_078 possession (Score: 92-75)
FOUL! Reach-in foul on Karl Fox during the drive. [Team fouls: 3] No free throws, side out. (Karl Fox: 2 personal fouls)

[07:15] Team_078 possession (Score: 92-75)
Jabari Barrett drives and kicks out. Ben Ginobili attempts a Midrange. Contested by Karl Fox (3.8 feet, MAN). BEN GINOBILI MAKES IT!
Score: 92-77

[07:02] Team_044 possession (Score: 92-77)
Karl Fox attempts a 3Pt. Contested by Isaiah Simmons (5.1 feet, ZONE). KARL FOX MAKES IT! Assist: Zach McGrady
Score: 95-77

[06:46] Team_078 possession (Score: 95-77)
Kyrie Carter attempts a 3Pt. Contested by Isaiah Murray (5.6 feet, MAN). KYRIE CARTER MAKES IT! Assist: Isaiah Simmons
Score: 95-80

[06:31] Team_044 possession (Score: 95-80)
Isaiah Murray attempts a 3Pt. Contested by Kyrie Carter (5.2 feet, MAN). ISAIAH MURRAY MAKES IT! Assist: Zach McGrady
Score: 98-80

[06:14] Team_078 possession (Score: 98-80)
Isaiah Simmons attempts a 3Pt. Wide open! Karl Fox is 6.2 feet away. [ZONE] Isaiah Simmons misses. Rebound secured by Victor Westbrook.

[06:04] Team_044 possession (Score: 98-80)
Isaiah Murray attempts a Midrange. Contested by Isaiah Simmons (5.6 feet, ZONE). Isaiah Murray misses. Offensive rebound by Victor Westbrook! Victor Westbrook kicks it out.

[05:50] Team_044 possession (Score: 98-80)
Victor Westbrook attempts a 3Pt. Contested by Isaiah Simmons (4.0 feet, MAN). VICTOR WESTBROOK MAKES IT! Assist: Isaiah Murray
Score: 101-80

[05:37] Team_078 possession (Score: 101-80)
FOUL! Reach-in foul on Karl Fox during the drive. [Team fouls: 4] No free throws, side out. (Karl Fox: 3 personal fouls)

[05:24] Team_078 possession (Score: 101-80)
Jabari Barnes drives and kicks out. Ben Ginobili attempts a 3Pt. Contested by Karl Fox (5.6 feet, MAN). BEN GINOBILI MAKES IT! Assist: Jabari Barnes
Score: 101-83

[05:11] Team_044 possession (Score: 101-83)
Zach McGrady attempts a Layup. Wide open! Jabari Barnes is 8.2 feet away. [MAN] ZACH MCGRADY MAKES IT!
Score: 103-83

[04:55] Team_078 possession (Score: 103-83)
Ben Ginobili attempts a Layup. Wide open! Karl Fox is 7.2 feet away. [MAN] Ben Ginobili misses. Offensive rebound by Jabari Barrett! Jabari Barrett kicks it out.

[04:41] Team_078 possession (Score: 103-83)
Jabari Barrett drives, Ayo McCollum stays with him. Jabari Barrett attempts a Dunk. Contested by Ayo McCollum (3.0 feet, MAN). JABARI BARRETT MAKES IT! Assist: Isaiah Simmons
Score: 103-85

[04:26] Team_044 possession (Score: 103-85)
FOUL! Shooting foul on Isaiah Simmons. Zach McGrady to the line for 3 free throws. [Team fouls: 3] (Isaiah Simmons: 1 personal fouls)   FT 1/3: GOOD   FT 2/3: MISS   FT 3/3: GOOD Zach McGrady makes 2/3 from the line.
Score: 105-85

[04:10] Team_078 possession (Score: 105-85)
Jabari Barrett attempts a Midrange. Contested by Ayo McCollum (4.5 feet, MAN). Jabari Barrett misses. Rebound secured by Karl Fox.

[03:56] Team_044 possession (Score: 105-85)
Karl Fox drives, Jabari Barrett stays with him. Karl Fox attempts a Dunk. Wide open! Jabari Barrett is 7.8 feet away. [ZONE] KARL FOX MAKES IT!
Score: 107-85

[03:42] Team_078 possession (Score: 107-85)
Kyrie Carter attempts a Midrange. Wide open! Karl Fox is 7.4 feet away. [ZONE] Kyrie Carter misses. Rebound secured by Victor Westbrook.

[03:28] Team_044 possession (Score: 107-85)
Ayo McCollum commits a violation (traveling/carry)! TURNOVER! (dead ball)

[03:28] Substitution (Team_044): Zach McGrady OUT → Kyrie Poole IN (stamina_rule2)

[03:28] Substitution (Team_044): Isaiah Murray OUT → Tim Towns IN (stamina_rule2)

[03:28] Substitution (Team_044): Victor Westbrook OUT → Tim Siakam IN (stamina_rule2)

[03:28] Substitution (Team_044): Karl Fox OUT → Pau Quickley IN (stamina_rule2)

[03:28] Substitution (Team_044): Ayo McCollum OUT → Victor Anthony IN (stamina_rule2)

[03:28] Substitution (Team_078): Jabari Barnes OUT → Magic Barrett IN (stamina_rule2)

[03:28] Substitution (Team_078): Kyrie Carter OUT → Damian Allen IN (stamina_rule2)

[03:28] Substitution (Team_078): Isaiah Simmons OUT → Malcolm Randle IN (stamina_rule2)

[03:28] Substitution (Team_078): Ben Ginobili OUT → Paul Ming IN (stamina_rule2)

[03:28] Substitution (Team_078): Jabari Barrett OUT → Draymond Irving IN (stamina_rule2)

[03:13] Team_078 possession (Score: 107-85)
Paul Ming attempts a Midrange. Heavily contested by Pau Quickley (0.5 feet, ZONE)! Paul Ming misses. Rebound secured by Tim Siakam.

[03:01] Team_044 possession (Score: 107-85)
Kyrie Poole attempts a 3Pt. Contested by Magic Barrett (3.7 feet, MAN). Kyrie Poole misses. FOUL! Loose ball foul on Malcolm Randle during the rebound battle. [Team fouls: 4] No free throws, side out. (Malcolm Randle: 1 personal fouls)

[02:47] Team_044 possession (Score: 107-85)
Pau Quickley attempts a Midrange. Contested by Paul Ming (5.8 feet, MAN). Pau Quickley misses. Rebound secured by Draymond Irving.

[02:32] Team_078 possession (Score: 107-85)
Malcolm Randle throws a bad pass! Stolen by Tim Siakam! TURNOVER! (live ball)

[02:15] Team_044 possession (Score: 107-85)
Kyrie Poole drives, Paul Ming stays with him. Kyrie Poole attempts a Dunk. Contested by Paul Ming (5.9 feet, ZONE). Kyrie Poole misses. Offensive rebound by Victor Anthony! Victor Anthony kicks it out.

[02:02] Team_044 possession (Score: 107-85)
Victor Anthony attempts a Layup. Wide open! Draymond Irving is 7.3 feet away. [MAN] Victor Anthony misses. Offensive rebound by Victor Anthony! Victor Anthony kicks it out.

[01:46] Team_044 possession (Score: 107-85)
Victor Anthony attempts a Midrange. Contested by Malcolm Randle (4.4 feet, ZONE). VICTOR ANTHONY MAKES IT! Assist: Kyrie Poole
Score: 109-85

[01:33] Team_078 possession (Score: 109-85)
Damian Allen attempts a 3Pt. Contested by Tim Towns (5.3 feet, MAN). Damian Allen misses. Rebound secured by Pau Quickley.

[01:16] Team_044 possession (Score: 109-85)
Victor Anthony drives, Draymond Irving stays with him. Victor Anthony attempts a Dunk. Wide open! Draymond Irving is 7.7 feet away. [MAN] VICTOR ANTHONY MAKES IT! Assist: Tim Towns
Score: 111-85

[01:02] Team_078 possession (Score: 111-85)
Magic Barrett attempts a 3Pt. Wide open! Kyrie Poole is 7.3 feet away. [MAN] Magic Barrett misses. Rebound secured by Victor Anthony.

[00:45] Team_044 possession (Score: 111-85)
Pau Quickley attempts a 3Pt. Contested by Damian Allen (4.0 feet, ZONE). PAU QUICKLEY MAKES IT! Assist: Kyrie Poole
Score: 114-85

[00:28] Team_078 possession (Score: 114-85)
FOUL! Offensive foul on Magic Barrett! Kyrie Poole drew the charge! [Team fouls: 5] (Magic Barrett: 1 personal fouls) TURNOVER! (dead ball)

[00:10] Team_044 possession (Score: 114-85)
Pau Quickley drives, Paul Ming stays with him. Pau Quickley attempts a Dunk. Wide open! Paul Ming is 6.6 feet away. [ZONE] PAU QUICKLEY MAKES IT! Assist: Tim Siakam
Score: 116-85

================================================================================
                              4TH QUARTER COMPLETE                              
================================================================================

4TH QUARTER SCORE: Team_044 36, Team_078 16

BOX SCORE:
================================================================================

Team_044
--------------------------------------------------------------------------------
Player                MIN  PTS  REB  AST  TO      FG   FG%      3P   3P%
--------------------------------------------------------------------------------
Karl Fox               34    8    2    1   0   3/5    60.0     0/0   0.0
Victor Westbrook       34    6    5    0   0   2/2   100.0     0/0   0.0
Isaiah Murray          34    5    0    2   0   2/2   100.0     0/0   0.0
Pau Quickley           15    5    1    0   0   2/3    66.7     0/0   0.0
Zach McGrady           34    4    0    3   0   2/3    66.7     0/0   0.0
Victor Anthony         15    4    4    0   0   2/2   100.0     0/0   0.0
Ayo McCollum           34    2    1    0   0   1/1   100.0     0/0   0.0
Tim Siakam             15    0    1    1   0   0/0     0.0     0/0   0.0
Kyrie Poole            15    0    0    2   0   0/0     0.0     0/0   0.0
Tim Towns              15    0    0    1   0   0/0     0.0     0/0   0.0

TEAM: FG: 14/18 (77.8%), 3PT: 5/5 (100.0%), REB: 14 (5 off, 9 def), AST: 10, TO: 2
TEAM FOULS: 4


Team_078
--------------------------------------------------------------------------------
Player                MIN  PTS  REB  AST  TO      FG   FG%      3P   3P%
--------------------------------------------------------------------------------
Ben Ginobili           34    9    1    0   0   4/6    66.7     0/0   0.0
Kyrie Carter           34    3    0    0   0   1/2    50.0     0/0   0.0
Jabari Barnes          34    2    0    1   0   1/1   100.0     0/0   0.0
Jabari Barrett         34    2    2    0   0   1/2    50.0     0/0   0.0
Isaiah Simmons         34    0    1    3   0   0/2     0.0     0/0   0.0
Paul Ming              15    0    0    0   0   0/1     0.0     0/0   0.0
Draymond Irving        15    0    1    0   0   0/0     0.0     0/0   0.0
Damian Allen           15    0    0    0   0   0/1     0.0     0/0   0.0
Magic Barrett          15    0    0    0   0   0/1     0.0     0/0   0.0

TEAM: FG: 7/16 (43.8%), 3PT: 1/7 (14.3%), REB: 5 (1 off, 4 def), AST: 4, TO: 3
TEAM FOULS: 5 [Team_044 in BONUS]

================================================================================

================================================================================
                               FULL GAME COMPLETE                               
================================================================================

FINAL SCORE: Team_044 116, Team_078 85

SCORING BY QUARTER:
--------------------------------------------------------------------------------
Team                     Q1     Q2     Q3     Q4    FINAL
--------------------------------------------------------------------------------
Team_044                 36     19     25     36      116
Team_078                 22     21     26     16       85
--------------------------------------------------------------------------------

FULL GAME BOX SCORE:
================================================================================

Team_044
--------------------------------------------------------------------------------
Player                MIN  PTS  REB  AST  TO      FG   FG%      3P   3P%      FT STL BLK
--------------------------------------------------------------------------------
Ayo McCollum           34    9    7    3   2   6/7    85.7   0/0     0.0   1/1     0   0
Zach McGrady           34   20    0    5   0   9/12   75.0   3/4    75.0   5/6     1   0
Isaiah Murray          34   18    0    6   4   7/10   70.0   4/4   100.0   0/0     1   0
Victor Westbrook       34   16   13    5   1   6/10   60.0   1/4    25.0   2/3     0   0
Karl Fox               34   25   12    5   2  10/16   62.5   2/4    50.0   1/3     1   0
Kyrie Poole            15    7    0    2   2   4/4   100.0   0/0     0.0   3/4     0   0
Tim Towns              15    0    0    1   0   0/2     0.0   0/2     0.0   0/0     0   0
Tim Siakam             15    2    5    2   3   1/3    33.3   0/1     0.0   0/0     1   0
Pau Quickley           15    8    4    1   0   3/5    60.0   1/1   100.0   1/1     1   0
Victor Anthony         15    8   10    0   0   4/6    66.7   0/0     0.0   0/0     2   1

TEAM: FG: 50/75 (66.7%), 3PT: 11/20 (55.0%), REB: 50 (12 off, 38 def), AST: 30, TO: 14


Team_078
--------------------------------------------------------------------------------
Player                MIN  PTS  REB  AST  TO      FG   FG%      3P   3P%      FT STL BLK
--------------------------------------------------------------------------------
Jabari Barnes          34    8    0    3   3   4/7    57.1   2/4    50.0   0/0     1   0
Kyrie Carter           34   17    0    4   2   6/10   60.0   5/8    62.5   0/0     0   0
Isaiah Simmons         34   19    7    6   2   5/9    55.6   2/5    40.0   0/0     1   0
Ben Ginobili           34   14    4    1   1   6/12   50.0   0/4     0.0   1/2     1   0
Jabari Barrett         34    5   11    4   1   5/15   33.3   1/1   100.0   1/2     1   0
Magic Barrett          15    4    0    1   2   1/5    20.0   0/3     0.0   2/2     0   0
Damian Allen           15    7    0    0   1   2/5    40.0   2/4    50.0   1/2     0   0
Malcolm Randle         15   10    4    0   1   5/8    62.5   1/3    33.3   3/3     0   0
Paul Ming              15    0    1    1   0   0/1     0.0   0/0     0.0   0/0     1   0
Draymond Irving        15    0    5    1   1   1/2    50.0   0/0     0.0   0/0     2   0

TEAM: FG: 35/74 (47.3%), 3PT: 13/32 (40.6%), REB: 33 (8 off, 25 def), AST: 21, TO: 14

================================================================================
