================================================================================
                        FULL GAME - Team_026 vs Team_096                        
================================================================================

================================================================================
                       1ST QUARTER - Team_026 vs Team_096                       
================================================================================

[12:00] Team_026 possession (Score: 0-0)
Klay Giddey attempts a 3Pt. Contested by Cole Griffin (2.8 feet, MAN). KLAY GIDDEY MAKES IT! Assist: Kobe Booker
Score: 3-0

[11:48] Team_096 possession (Score: 3-0)
Terry Mobley loses control! Ball rolls out of bounds! TURNOVER! (dead ball)

[11:35] Team_026 possession (Score: 3-0)
Kobe Booker attempts a Midrange. Contested by Kyrie Adebayo (5.9 feet, MAN). Kobe Booker misses. Rebound secured by Scottie Herro.

[11:23] Team_096 possession (Score: 3-0)
FOUL! Shooting foul on Wendell Gasol. Terry Mobley to the line for 2 free throws. [Team fouls: 1] (Wendell Gasol: 1 personal fouls)   FT 1/2: MISS   FT 2/2: GOOD Terry Mobley makes 1/2 from the line.
Score: 3-1

[11:08] Team_026 possession (Score: 3-1)
Kobe Booker attempts a 3Pt. Contested by Cole Griffin (2.6 feet, ZONE). Kobe Booker misses. Rebound secured by Scottie Herro.

[10:50] Team_096 possession (Score: 3-1)
Kyrie Adebayo drives and kicks out. Lamelo Quickley attempts a Midrange. Wide open! Klay Giddey is 7.2 feet away. [ZONE] LAMELO QUICKLEY MAKES IT!
Score: 3-3

[10:37] Team_026 possession (Score: 3-3)
Immanuel Hyland attempts a Layup. Wide open! Lamelo Quickley is 6.4 feet away. [MAN] Immanuel Hyland misses. Rebound secured by Kyrie Adebayo.

[10:21] Team_096 possession (Score: 3-3)
Scottie Herro drives, Shaquille Trent stays with him. Scottie Herro attempts a Layup. Wide open! Shaquille Trent is 8.6 feet away. [MAN] SCOTTIE HERRO MAKES IT!
Score: 3-5

[10:05] Team_026 possession (Score: 3-5)
Wendell Gasol makes the Layup and draws the foul on Terry Mobley! And-1! Wendell Gasol to the line for 1. [Team fouls: 1] (Terry Mobley: 1 personal fouls)   FT 1/1: GOOD Wendell Gasol makes 1/1 from the line.
Score: 6-5

[09:53] Team_096 possession (Score: 6-5)
Lamelo Quickley attempts a 3Pt. Contested by Immanuel Hyland (5.1 feet, MAN). LAMELO QUICKLEY MAKES IT! Assist: Scottie Herro
Score: 6-8

[09:37] Team_026 possession (Score: 6-8)
Shaquille Trent attempts a Midrange. Heavily contested by Lamelo Quickley (0.5 feet, ZONE)! Shaquille Trent misses. Rebound secured by Kyrie Adebayo.

[09:24] Team_096 possession (Score: 6-8)
Scottie Herro attempts a Midrange. Wide open! Immanuel Hyland is 6.8 feet away. [ZONE] Scottie Herro misses. Rebound secured by Shaquille Trent.

[09:06] Team_026 possession (Score: 6-8)
Immanuel Hyland attempts a 3Pt. Contested by Lamelo Quickley (5.8 feet, MAN). Immanuel Hyland misses. Rebound secured by Scottie Herro.

[08:49] Team_096 possession (Score: 6-8)
Cole Griffin attempts a Layup. BLOCKED BY KOBE BOOKER! Ball is loose! Offensive rebound by Scottie Herro! Scottie Herro kicks it out.

[08:37] Team_096 possession (Score: 6-8)
Lamelo Quickley drives to the basket... Lamelo Quickley throws a bad pass! Stolen by Immanuel Hyland! TURNOVER! (live ball)

[08:25] Team_026 possession (Score: 6-8)
Kobe Booker attempts a 3Pt. Contested by Scottie Herro (3.5 feet, ZONE). Kobe Booker misses. Rebound secured by Kyrie Adebayo.

[08:14] Team_096 possession (Score: 6-8)
Terry Mobley attempts a 3Pt. Wide open! Wendell Gasol is 6.3 feet away. [MAN] Terry Mobley misses. Rebound secured by Kobe Booker.

[07:58] Team_026 possession (Score: 6-8)
Klay Giddey drives, Cole Griffin stays with him. Klay Giddey attempts a Dunk. Heavily contested by Cole Griffin (1.4 feet, MAN)! KLAY GIDDEY MAKES IT! Assist: Kobe Booker
Score: 8-8

[07:43] Team_096 possession (Score: 8-8)
Cole Griffin makes the 3Pt and draws the foul on Immanuel Hyland! And-1! Cole Griffin to the line for 1. [Team fouls: 2] (Immanuel Hyland: 1 personal fouls)   FT 1/1: GOOD Cole Griffin makes 1/1 from the line.
Score: 8-12

[07:27] Team_026 possession (Score: 8-12)
Kobe Booker attempts a 3Pt. Contested by Kyrie Adebayo (5.0 feet, MAN). Kobe Booker misses. Rebound secured by Scottie Herro.

[07:12] Team_096 possession (Score: 8-12)
Kyrie Adebayo attempts a Midrange. Wide open! Klay Giddey is 9.1 feet away. [ZONE] Kyrie Adebayo misses. Rebound secured by Immanuel Hyland.

[06:58] Team_026 possession (Score: 8-12)
Klay Giddey drives, Cole Griffin stays with him. Klay Giddey attempts a Dunk. Contested by Cole Griffin (3.2 feet, MAN). Klay Giddey misses. Rebound secured by Kyrie Adebayo.

[06:39] Team_096 possession (Score: 8-12)
FOUL! Offensive foul on Scottie Herro! Shaquille Trent drew the charge! [Team fouls: 2] (Scottie Herro: 1 personal fouls) TURNOVER! (dead ball)

[06:22] Team_026 possession (Score: 8-12)
Wendell Gasol attempts a Midrange. Contested by Kyrie Adebayo (3.7 feet, ZONE). Wendell Gasol misses. Rebound secured by Cole Griffin.

[06:09] Team_096 possession (Score: 8-12)
Kyrie Adebayo attempts a Layup. Wide open! Kobe Booker is 6.9 feet away. [MAN] KYRIE ADEBAYO MAKES IT!
Score: 8-14

[05:55] Team_026 possession (Score: 8-14)
FOUL! Shooting foul on Cole Griffin. Klay Giddey to the line for 3 free throws. [Team fouls: 3] (Cole Griffin: 1 personal fouls)   FT 1/3: GOOD   FT 2/3: GOOD   FT 3/3: GOOD Klay Giddey makes 3/3 from the line.
Score: 11-14

[05:38] Team_096 possession (Score: 11-14)
Kyrie Adebayo attempts a Layup. Contested by Kobe Booker (4.8 feet, MAN). KYRIE ADEBAYO MAKES IT! Assist: Terry Mobley
Score: 11-16

[05:24] Team_026 possession (Score: 11-16)
Klay Giddey attempts a Layup. Wide open! Cole Griffin is 7.5 feet away. [MAN] KLAY GIDDEY MAKES IT!
Score: 13-16

[05:11] Team_096 possession (Score: 13-16)
Kyrie Adebayo attempts a 3Pt. Heavily contested by Kobe Booker (0.8 feet, MAN)! Kyrie Adebayo misses. Rebound secured by Immanuel Hyland.

[04:58] Team_026 possession (Score: 13-16)
FOUL! Offensive foul on Kobe Booker! Kyrie Adebayo drew the charge! [Team fouls: 3] (Kobe Booker: 1 personal fouls) TURNOVER! (dead ball)

[04:43] Team_096 possession (Score: 13-16)
Kyrie Adebayo attempts a Layup. Contested by Kobe Booker (3.7 feet, MAN). KYRIE ADEBAYO MAKES IT! Assist: Scottie Herro
Score: 13-18

[04:30] Team_026 possession (Score: 13-18)
Klay Giddey drives and kicks out. Immanuel Hyland attempts a 3Pt. Contested by Cole Griffin (4.2 feet, ZONE). IMMANUEL HYLAND MAKES IT! Assist: Klay Giddey
Score: 16-18

[04:18] Team_096 possession (Score: 16-18)
Scottie Herro attempts a 3Pt. Wide open! Immanuel Hyland is 6.4 feet away. [ZONE] Scottie Herro misses. Rebound secured by Shaquille Trent.

[04:08] Team_026 possession (Score: 16-18)
Wendell Gasol attempts a 3Pt. Contested by Terry Mobley (3.0 feet, MAN). Wendell Gasol misses. Offensive rebound by Shaquille Trent! Shaquille Trent kicks it out.

[03:55] Team_026 possession (Score: 16-18)
Wendell Gasol attempts a Midrange. BLOCKED BY KYRIE ADEBAYO! Ball deflects out of bounds off Wendell Gasol.

[03:43] Team_096 possession (Score: 16-18)
Lamelo Quickley attempts a 3Pt. Contested by Immanuel Hyland (4.2 feet, MAN). Lamelo Quickley misses. Rebound secured by Kobe Booker.

[03:27] Team_026 possession (Score: 16-18)
Wendell Gasol attempts a Layup. Contested by Terry Mobley (3.1 feet, MAN). WENDELL GASOL MAKES IT! Assist: Kobe Booker
Score: 18-18

[03:16] Team_096 possession (Score: 18-18)
Terry Mobley attempts a Layup. Contested by Wendell Gasol (2.2 feet, MAN). TERRY MOBLEY MAKES IT!
Score: 18-20

[03:02] Team_026 possession (Score: 18-20)
Klay Giddey attempts a Midrange. Contested by Cole Griffin (3.6 feet, MAN). Klay Giddey misses. Rebound secured by Kyrie Adebayo.

[02:50] Team_096 possession (Score: 18-20)
Kyrie Adebayo attempts a 3Pt. Contested by Shaquille Trent (3.5 feet, ZONE). KYRIE ADEBAYO MAKES IT! Assist: Scottie Herro
Score: 18-23

[02:34] Team_026 possession (Score: 18-23)
Kobe Booker attempts a Midrange. Contested by Kyrie Adebayo (5.4 feet, MAN). KOBE BOOKER MAKES IT! Assist: Klay Giddey
Score: 20-23

[02:19] Team_096 possession (Score: 20-23)
Lamelo Quickley drives to the basket... FOUL! Offensive foul on Lamelo Quickley! Kobe Booker drew the charge! [Team fouls: 4] (Lamelo Quickley: 1 personal fouls) TURNOVER! (dead ball)

[02:08] Team_026 possession (Score: 20-23)
Immanuel Hyland attempts a 3Pt. Heavily contested by Cole Griffin (0.5 feet, ZONE)! Immanuel Hyland misses. FOUL! Loose ball foul on Cole Griffin during the rebound battle. [IN THE BONUS! 5 team fouls] Kobe Booker to the line for 2 free throws. (Cole Griffin: 2 personal fouls)   FT 1/2: GOOD   FT 2/2: MISS Kobe Booker makes 1/2 from the line. Rebound secured by Kyrie Adebayo.
Score: 21-23

[01:55] Team_096 possession (Score: 21-23)
FOUL! Holding foul on Kobe Booker. [Team fouls: 4] No free throws, side out. (Kobe Booker: 2 personal fouls)

[01:37] Team_096 possession (Score: 21-23)
Kyrie Adebayo drives to the basket... Kyrie Adebayo throws a bad pass! Stolen by Kobe Booker! TURNOVER! (live ball)

[01:26] Team_026 possession (Score: 21-23)
Klay Giddey attempts a 3Pt. Contested by Cole Griffin (3.7 feet, ZONE). Klay Giddey misses. Rebound secured by Scottie Herro.

[01:10] Team_096 possession (Score: 21-23)
Cole Griffin attempts a 3Pt. Contested by Klay Giddey (5.3 feet, MAN). Cole Griffin misses. Rebound secured by Kobe Booker.

[00:56] Team_026 possession (Score: 21-23)
Wendell Gasol drives and kicks out. Klay Giddey attempts a 3Pt. Contested by Cole Griffin (5.4 feet, ZONE). Klay Giddey misses. Rebound secured by Kyrie Adebayo.

[00:40] Team_096 possession (Score: 21-23)
Scottie Herro makes the Layup and draws the foul on Shaquille Trent! And-1! Scottie Herro to the line for 1. [BONUS: 5 team fouls] (Shaquille Trent: 1 personal fouls)   FT 1/1: GOOD Scottie Herro makes 1/1 from the line.
Score: 21-26

[00:25] Team_026 possession (Score: 21-26)
Immanuel Hyland drives, Kyrie Adebayo stays with him. Immanuel Hyland attempts a Layup. Contested by Kyrie Adebayo (4.4 feet, ZONE). Immanuel Hyland misses. Rebound secured by Kyrie Adebayo.

[00:10] Team_096 possession (Score: 21-26)
FOUL! Shooting foul on Shaquille Trent. Scottie Herro to the line for 2 free throws. [BONUS: 6 team fouls] (Shaquille Trent: 2 personal fouls)   FT 1/2: GOOD   FT 2/2: GOOD Scottie Herro makes 2/2 from the line.
Score: 21-28

================================================================================
                              1ST QUARTER COMPLETE                              
================================================================================

1ST QUARTER SCORE: Team_026 21, Team_096 28

BOX SCORE:
================================================================================

Team_026
--------------------------------------------------------------------------------
Player                MIN  PTS  REB  AST  TO      FG   FG%      3P   3P%
--------------------------------------------------------------------------------
Klay Giddey            12   10    0    2   0   4/7    57.1     0/0   0.0
Wendell Gasol          12    5    0    0   0   2/5    40.0     0/0   0.0
Immanuel Hyland        12    3    2    0   0   1/5    20.0     0/0   0.0
Kobe Booker            12    2    3    3   0   1/5    20.0     0/0   0.0
Shaquille Trent        12    0    3    0   0   0/1     0.0     0/0   0.0

TEAM: FG: 8/23 (34.8%), 3PT: 2/8 (25.0%), REB: 9 (2 off, 7 def), AST: 5, TO: 1
TEAM FOULS: 6 [Team_096 in BONUS]


Team_096
--------------------------------------------------------------------------------
Player                MIN  PTS  REB  AST  TO      FG   FG%      3P   3P%
--------------------------------------------------------------------------------
Kyrie Adebayo          12    9    8    0   0   4/6    66.7     0/0   0.0
Scottie Herro          12    7    6    3   0   3/5    60.0     0/0   0.0
Lamelo Quickley        12    5    0    0   0   2/3    66.7     0/0   0.0
Cole Griffin           12    4    1    0   0   1/2    50.0     0/0   0.0
Terry Mobley           12    3    0    1   0   2/3    66.7     0/0   0.0

TEAM: FG: 12/19 (63.2%), 3PT: 3/8 (37.5%), REB: 14 (1 off, 13 def), AST: 4, TO: 5
TEAM FOULS: 5 [Team_026 in BONUS]

================================================================================

================================================================================
                       2ND QUARTER - Team_026 vs Team_096                       
================================================================================

[12:00] Team_026 possession (Score: 21-28)
FOUL! Shooting foul on Lamelo Quickley. Immanuel Hyland to the line for 2 free throws. [Team fouls: 1] (Lamelo Quickley: 1 personal fouls)   FT 1/2: GOOD   FT 2/2: GOOD Immanuel Hyland makes 2/2 from the line.
Score: 23-28

[11:42] Team_096 possession (Score: 23-28)
Kyrie Adebayo drives, picks up Kobe Booker. Help arrives from Immanuel Hyland! Kyrie Adebayo attempts a Dunk. Contested by Immanuel Hyland (3.1 feet, MAN). KYRIE ADEBAYO MAKES IT! Assist: Terry Mobley
Score: 23-30

[11:28] Team_026 possession (Score: 23-30)
Shaquille Trent attempts a Midrange. Contested by Cole Griffin (5.2 feet, ZONE). Shaquille Trent misses. Rebound secured by Scottie Herro.

[11:12] Team_096 possession (Score: 23-30)
FOUL! Offensive foul on Scottie Herro! Shaquille Trent drew the charge! [Team fouls: 2] (Scottie Herro: 1 personal fouls) TURNOVER! (dead ball)

[10:59] Team_026 possession (Score: 23-30)
FOUL! Shooting foul on Lamelo Quickley. Immanuel Hyland to the line for 2 free throws. [Team fouls: 3] (Lamelo Quickley: 2 personal fouls)   FT 1/2: GOOD   FT 2/2: MISS Immanuel Hyland makes 1/2 from the line. Rebound secured by Cole Griffin.
Score: 24-30

[10:41] Team_096 possession (Score: 24-30)
Lamelo Quickley attempts a 3Pt. Contested by Immanuel Hyland (4.4 feet, ZONE). Lamelo Quickley misses. Rebound secured by Immanuel Hyland.

[10:22] Team_026 possession (Score: 24-30)
Shaquille Trent attempts a Layup. Wide open! Scottie Herro is 6.3 feet away. [MAN] SHAQUILLE TRENT MAKES IT! Assist: Klay Giddey
Score: 26-30

[10:11] Team_096 possession (Score: 26-30)
Lamelo Quickley attempts a Layup. Contested by Immanuel Hyland (4.8 feet, MAN). LAMELO QUICKLEY MAKES IT!
Score: 26-32

[09:54] Team_026 possession (Score: 26-32)
Immanuel Hyland loses control! Ball rolls out of bounds! TURNOVER! (dead ball)

[09:54] Substitution (Team_026): Wendell Gasol OUT → Myles Tatum IN (stamina_rule2)

[09:54] Substitution (Team_026): Immanuel Hyland OUT → Karl Barrett IN (stamina_rule2)

[09:54] Substitution (Team_026): Klay Giddey OUT → Josh Simons IN (stamina_rule2)

[09:54] Substitution (Team_026): Shaquille Trent OUT → Damian Doncic IN (stamina_rule2)

[09:54] Substitution (Team_026): Kobe Booker OUT → Dirk Randle IN (stamina_rule2)

[09:54] Substitution (Team_096): Terry Mobley OUT → Cade Jokic IN (stamina_rule2)

[09:54] Substitution (Team_096): Lamelo Quickley OUT → Jarrett Markkanen IN (stamina_rule2)

[09:54] Substitution (Team_096): Cole Griffin OUT → Cole Holiday IN (stamina_rule2)

[09:54] Substitution (Team_096): Scottie Herro OUT → Tyler Haliburton IN (stamina_rule2)

[09:54] Substitution (Team_096): Kyrie Adebayo OUT → Devin Griffin IN (stamina_rule2)

[09:40] Team_096 possession (Score: 26-32)
Tyler Haliburton attempts a 3Pt. Contested by Karl Barrett (2.2 feet, ZONE). Tyler Haliburton misses. Rebound secured by Josh Simons.

[09:28] Team_026 possession (Score: 26-32)
Josh Simons drives, picks up Cole Holiday. Help arrives from Jarrett Markkanen! Josh Simons attempts a Layup. Wide open! Jarrett Markkanen is 6.4 feet away. [MAN] Josh Simons misses. Rebound secured by Tyler Haliburton.

[09:13] Team_096 possession (Score: 26-32)
Tyler Haliburton attempts a Layup. Contested by Damian Doncic (3.2 feet, MAN). Tyler Haliburton misses. Rebound secured by Damian Doncic.

[09:00] Team_026 possession (Score: 26-32)
Karl Barrett attempts a Layup. Contested by Jarrett Markkanen (3.0 feet, MAN). Karl Barrett misses. Rebound secured by Jarrett Markkanen.

[08:45] Team_096 possession (Score: 26-32)
Cole Holiday drives and kicks out. Cade Jokic attempts a 3Pt. Wide open! Myles Tatum is 6.4 feet away. [MAN] Cade Jokic misses. Rebound secured by Damian Doncic.

[08:36] Team_026 possession (Score: 26-32)
Josh Simons drives and kicks out. Karl Barrett attempts a Midrange. Contested by Jarrett Markkanen (3.8 feet, MAN). KARL BARRETT MAKES IT!
Score: 28-32

[08:17] Team_096 possession (Score: 28-32)
Tyler Haliburton drives, Damian Doncic stays with him. Tyler Haliburton attempts a Layup. Wide open! Damian Doncic is 6.3 feet away. [ZONE] Tyler Haliburton misses. FOUL! Loose ball foul on Damian Doncic during the rebound battle. [Team fouls: 1] No free throws, side out. (Damian Doncic: 1 personal fouls)

[08:03] Team_096 possession (Score: 28-32)
Tyler Haliburton attempts a Midrange. Contested by Josh Simons (4.7 feet, ZONE). TYLER HALIBURTON MAKES IT! Assist: Devin Griffin
Score: 28-34

[07:46] Team_026 possession (Score: 28-34)
Josh Simons drives and kicks out. Dirk Randle attempts a 3Pt. Contested by Cole Holiday (4.6 feet, ZONE). Dirk Randle misses. Rebound secured by Jarrett Markkanen.

[07:29] Team_096 possession (Score: 28-34)
Cade Jokic drives, Myles Tatum stays with him. Cade Jokic attempts a Layup. Wide open! Myles Tatum is 9.3 feet away. [MAN] Cade Jokic misses. Rebound secured by Josh Simons.

[07:10] Team_026 possession (Score: 28-34)
Josh Simons attempts a 3Pt. Wide open! Cole Holiday is 7.1 feet away. [MAN] Josh Simons misses. Rebound secured by Devin Griffin.

[06:57] Team_096 possession (Score: 28-34)
Cole Holiday drives, picks up Josh Simons. Help arrives from Karl Barrett! Cole Holiday attempts a Dunk. Contested by Karl Barrett (4.9 feet, MAN). COLE HOLIDAY MAKES IT! Assist: Tyler Haliburton
Score: 28-36

[06:45] Team_026 possession (Score: 28-36)
Damian Doncic attempts a Layup. Contested by Tyler Haliburton (4.6 feet, MAN). Damian Doncic misses. Rebound secured by Jarrett Markkanen.

[06:35] Team_096 possession (Score: 28-36)
Devin Griffin drives to the basket... Devin Griffin loses the ball! Stripped by Dirk Randle! TURNOVER! (live ball)

[06:19] Team_026 possession (Score: 28-36)
Karl Barrett attempts a Midrange. Contested by Tyler Haliburton (5.0 feet, ZONE). Karl Barrett misses. Rebound secured by Tyler Haliburton.

[06:09] Team_096 possession (Score: 28-36)
Cole Holiday drives, picks up Josh Simons. Help arrives from Karl Barrett! Cole Holiday attempts a Layup. Contested by Karl Barrett (2.5 feet, MAN). Cole Holiday misses. Offensive rebound by Devin Griffin! Devin Griffin kicks it out.

[05:52] Team_096 possession (Score: 28-36)
FOUL! Holding foul on Josh Simons. [Team fouls: 2] No free throws, side out. (Josh Simons: 1 personal fouls)

[05:38] Team_096 possession (Score: 28-36)
Cade Jokic attempts a 3Pt. Contested by Karl Barrett (3.5 feet, ZONE). Cade Jokic misses. Rebound secured by Josh Simons.

[05:21] Team_026 possession (Score: 28-36)
Myles Tatum attempts a 3Pt. Contested by Cole Holiday (3.6 feet, ZONE). MYLES TATUM MAKES IT! Assist: Dirk Randle
Score: 31-36

[05:05] Team_096 possession (Score: 31-36)
Cade Jokic attempts a Layup. Wide open! Myles Tatum is 6.7 feet away. [MAN] CADE JOKIC MAKES IT! Assist: Cole Holiday
Score: 31-38

[04:53] Team_026 possession (Score: 31-38)
Josh Simons attempts a Layup. BLOCKED BY DEVIN GRIFFIN! Ball is loose! Offensive rebound by Damian Doncic! Damian Doncic kicks it out.

[04:39] Team_026 possession (Score: 31-38)
FOUL! Shooting foul on Cade Jokic. Karl Barrett to the line for 3 free throws. [Team fouls: 4] (Cade Jokic: 1 personal fouls)   FT 1/3: GOOD   FT 2/3: GOOD   FT 3/3: GOOD Karl Barrett makes 3/3 from the line.
Score: 34-38

[04:25] Team_096 possession (Score: 34-38)
Cade Jokic attempts a Midrange. Contested by Myles Tatum (5.6 feet, MAN). CADE JOKIC MAKES IT!
Score: 34-40

[04:11] Team_026 possession (Score: 34-40)
Myles Tatum throws a bad pass! Stolen by Cade Jokic! TURNOVER! (live ball)

[03:53] Team_096 possession (Score: 34-40)
Tyler Haliburton makes the Layup and draws the foul on Damian Doncic! And-1! Tyler Haliburton to the line for 1. [Team fouls: 3] (Damian Doncic: 2 personal fouls)   FT 1/1: GOOD Tyler Haliburton makes 1/1 from the line.
Score: 34-43

[03:39] Team_026 possession (Score: 34-43)
FOUL! Reach-in foul on Devin Griffin during the drive. [IN THE BONUS! 5 team fouls] Karl Barrett to the line for 2 free throws. (Devin Griffin: 1 personal fouls)   FT 1/2: GOOD   FT 2/2: GOOD Karl Barrett makes 2/2 from the line.
Score: 36-43

[03:23] Team_096 possession (Score: 36-43)
Jarrett Markkanen drives, Dirk Randle stays with him. Jarrett Markkanen attempts a Dunk. Contested by Dirk Randle (5.3 feet, ZONE). Jarrett Markkanen misses. Rebound secured by Karl Barrett.

[03:08] Team_026 possession (Score: 36-43)
Damian Doncic attempts a Midrange. Wide open! Tyler Haliburton is 6.6 feet away. [ZONE] DAMIAN DONCIC MAKES IT! Assist: Dirk Randle
Score: 38-43

[02:55] Team_096 possession (Score: 38-43)
Jarrett Markkanen attempts a 3Pt. Contested by Karl Barrett (3.9 feet, MAN). Jarrett Markkanen misses. Rebound secured by Karl Barrett.

[02:38] Team_026 possession (Score: 38-43)
Myles Tatum drives to the basket... Myles Tatum loses control! Ball rolls out of bounds! TURNOVER! (dead ball)

[02:20] Team_096 possession (Score: 38-43)
Cade Jokic throws a bad pass out of bounds! TURNOVER! (dead ball)

[02:06] Team_026 possession (Score: 38-43)
Myles Tatum attempts a 3Pt. Contested by Cade Jokic (4.5 feet, MAN). Myles Tatum misses. Rebound secured by Devin Griffin.

[01:54] Team_096 possession (Score: 38-43)
Tyler Haliburton drives, picks up Damian Doncic. Help arrives from Karl Barrett! Tyler Haliburton attempts a Dunk. Contested by Karl Barrett (4.7 feet, MAN). TYLER HALIBURTON MAKES IT!
Score: 38-45

[01:40] Team_026 possession (Score: 38-45)
Dirk Randle attempts a 3Pt. Contested by Cade Jokic (2.3 feet, ZONE). Dirk Randle misses. Rebound secured by Jarrett Markkanen.

[01:26] Team_096 possession (Score: 38-45)
FOUL! Reach-in foul on Damian Doncic during the drive. [Team fouls: 4] No free throws, side out. (Damian Doncic: 3 personal fouls)

[01:08] Team_096 possession (Score: 38-45)
Tyler Haliburton attempts a 3Pt. Contested by Karl Barrett (2.5 feet, ZONE). Tyler Haliburton misses. Rebound secured by Damian Doncic.

[00:57] Team_026 possession (Score: 38-45)
Damian Doncic attempts a Midrange. BLOCKED BY TYLER HALIBURTON! Ball goes out off Tyler Haliburton. Damian Doncic's ball!

[00:44] Team_026 possession (Score: 38-45)
Myles Tatum attempts a 3Pt. Contested by Cade Jokic (3.2 feet, ZONE). Myles Tatum misses. Rebound secured by Tyler Haliburton.

[00:25] Team_096 possession (Score: 38-45)
Jarrett Markkanen attempts a 3Pt. Heavily contested by Damian Doncic (1.4 feet, ZONE)! Jarrett Markkanen misses. Rebound secured by Karl Barrett.

[00:11] Team_026 possession (Score: 38-45)
Damian Doncic attempts a Midrange. Wide open! Jarrett Markkanen is 6.4 feet away. [ZONE] DAMIAN DONCIC MAKES IT! Assist: Dirk Randle
Score: 40-45

================================================================================
                              2ND QUARTER COMPLETE                              
================================================================================

2ND QUARTER SCORE: Team_026 19, Team_096 17

BOX SCORE:
================================================================================

Team_026
--------------------------------------------------------------------------------
Player                MIN  PTS  REB  AST  TO      FG   FG%      3P   3P%
--------------------------------------------------------------------------------
Karl Barrett           10    7    3    0   0   3/5    60.0     0/0   0.0
Damian Doncic          10    4    4    0   0   2/3    66.7     0/0   0.0
Myles Tatum            10    3    0    0   0   1/3    33.3     0/0   0.0
Immanuel Hyland        14    2    1    0   0   1/2    50.0     0/0   0.0
Shaquille Trent        14    2    0    0   0   1/2    50.0     0/0   0.0
Klay Giddey            14    0    0    1   0   0/0     0.0     0/0   0.0
Josh Simons            10    0    3    0   0   0/3     0.0     0/0   0.0
Dirk Randle            10    0    0    3   0   0/1     0.0     0/0   0.0

TEAM: FG: 8/19 (42.1%), 3PT: 2/6 (33.3%), REB: 11 (1 off, 10 def), AST: 4, TO: 3
TEAM FOULS: 4


Team_096
--------------------------------------------------------------------------------
Player                MIN  PTS  REB  AST  TO      FG   FG%      3P   3P%
--------------------------------------------------------------------------------
Tyler Haliburton       10    7    4    1   0   3/6    50.0     0/0   0.0
Cade Jokic             10    4    0    0   0   2/4    50.0     0/0   0.0
Kyrie Adebayo          14    2    0    0   0   1/1   100.0     0/0   0.0
Lamelo Quickley        14    2    0    0   0   1/2    50.0     0/0   0.0
Cole Holiday           10    2    0    1   0   1/2    50.0     0/0   0.0
Terry Mobley           14    0    0    1   0   0/0     0.0     0/0   0.0
Scottie Herro          14    0    1    0   0   0/0     0.0     0/0   0.0
Cole Griffin           14    0    1    0   0   0/0     0.0     0/0   0.0
Jarrett Markkanen      10    0    4    0   0   0/3     0.0     0/0   0.0
Devin Griffin          10    0    3    1   0   0/0     0.0     0/0   0.0

TEAM: FG: 8/18 (44.4%), 3PT: 0/6 (0.0%), REB: 13 (2 off, 11 def), AST: 4, TO: 3
TEAM FOULS: 5 [Team_026 in BONUS]

================================================================================

================================================================================
                       3RD QUARTER - Team_026 vs Team_096                       
================================================================================

[12:00] Team_026 possession (Score: 40-45)
Kobe Booker drives, Kyrie Adebayo stays with him. Kobe Booker attempts a Layup. Contested by Kyrie Adebayo (4.4 feet, MAN). Kobe Booker misses. Rebound secured by Cole Griffin.

[11:49] Team_096 possession (Score: 40-45)
Lamelo Quickley attempts a Layup. Heavily contested by Kobe Booker (2.0 feet, ZONE)! Lamelo Quickley misses. Rebound secured by Kobe Booker.

[11:35] Team_026 possession (Score: 40-45)
Shaquille Trent makes the Dunk and draws the foul on Scottie Herro! And-1! Shaquille Trent to the line for 1. [Team fouls: 1] (Scottie Herro: 1 personal fouls)   FT 1/1: GOOD Shaquille Trent makes 1/1 from the line.
Score: 43-45

[11:22] Team_096 possession (Score: 43-45)
Cole Griffin attempts a 3Pt. Wide open! Wendell Gasol is 6.5 feet away. [ZONE] COLE GRIFFIN MAKES IT! Assist: Scottie Herro
Score: 43-48

[11:04] Team_026 possession (Score: 43-48)
FOUL! Shooting foul on Cole Griffin. Klay Giddey to the line for 2 free throws. [Team fouls: 2] (Cole Griffin: 1 personal fouls)   FT 1/2: GOOD   FT 2/2: MISS Klay Giddey makes 1/2 from the line. Offensive rebound by Kobe Booker! Kobe Booker kicks it out.
Score: 44-48

[10:51] Team_026 possession (Score: 44-48)
FOUL! Reach-in foul on Terry Mobley during the drive. [Team fouls: 3] No free throws, side out. (Terry Mobley: 1 personal fouls)

[10:33] Team_026 possession (Score: 44-48)
Immanuel Hyland attempts a 3Pt. Wide open! Lamelo Quickley is 7.4 feet away. [MAN] Immanuel Hyland misses. Offensive rebound by Kobe Booker! Kobe Booker kicks it out.

[10:21] Team_026 possession (Score: 44-48)
Wendell Gasol attempts a 3Pt. Contested by Terry Mobley (6.0 feet, MAN). Wendell Gasol misses. Rebound secured by Kyrie Adebayo.

[10:05] Team_096 possession (Score: 44-48)
Kyrie Adebayo drives to the basket... Kyrie Adebayo loses the ball! Stripped by Kobe Booker! TURNOVER! (live ball)

[09:49] Team_026 possession (Score: 44-48)
Shaquille Trent attempts a Midrange. Contested by Scottie Herro (5.6 feet, ZONE). Shaquille Trent misses. Rebound secured by Kyrie Adebayo.

[09:37] Team_096 possession (Score: 44-48)
Kyrie Adebayo drives and kicks out. Kyrie Adebayo attempts a 3Pt. Contested by Immanuel Hyland (4.2 feet, ZONE). KYRIE ADEBAYO MAKES IT! Assist: Cole Griffin
Score: 44-51

[09:23] Team_026 possession (Score: 44-51)
Shaquille Trent attempts a Midrange. Wide open! Cole Griffin is 7.1 feet away. [ZONE] SHAQUILLE TRENT MAKES IT! Assist: Klay Giddey
Score: 46-51

[09:10] Team_096 possession (Score: 46-51)
FOUL! Reach-in foul on Kobe Booker during the drive. [Team fouls: 1] No free throws, side out. (Kobe Booker: 1 personal fouls)

[08:52] Team_096 possession (Score: 46-51)
Lamelo Quickley attempts a 3Pt. Heavily contested by Immanuel Hyland (1.7 feet, MAN)! Lamelo Quickley misses. Rebound secured by Shaquille Trent.

[08:34] Team_026 possession (Score: 46-51)
Shaquille Trent drives and kicks out. Klay Giddey attempts a 3Pt. Contested by Cole Griffin (2.8 feet, ZONE). Klay Giddey misses. Offensive rebound by Shaquille Trent! Shaquille Trent kicks it out.

[08:20] Team_026 possession (Score: 46-51)
Klay Giddey makes the Layup and draws the foul on Lamelo Quickley! And-1! Klay Giddey to the line for 1. [Team fouls: 4] (Lamelo Quickley: 1 personal fouls)   FT 1/1: GOOD Klay Giddey makes 1/1 from the line.
Score: 49-51

[08:09] Team_096 possession (Score: 49-51)
Terry Mobley drives and kicks out. Scottie Herro attempts a 3Pt. Contested by Shaquille Trent (5.6 feet, MAN). SCOTTIE HERRO MAKES IT!
Score: 49-54

[07:57] Team_026 possession (Score: 49-54)
Wendell Gasol attempts a 3Pt. Contested by Terry Mobley (4.1 feet, ZONE). WENDELL GASOL MAKES IT! Assist: Klay Giddey
Score: 52-54

[07:44] Team_096 possession (Score: 52-54)
Terry Mobley attempts a Layup. Wide open! Shaquille Trent is 7.3 feet away. [ZONE] TERRY MOBLEY MAKES IT!
Score: 52-56

[07:32] Team_026 possession (Score: 52-56)
Immanuel Hyland attempts a 3Pt. Wide open! Terry Mobley is 7.4 feet away. [ZONE] Immanuel Hyland misses. FOUL! Loose ball foul on Scottie Herro during the rebound battle. [IN THE BONUS! 5 team fouls] Kobe Booker to the line for 2 free throws. (Scottie Herro: 2 personal fouls)   FT 1/2: GOOD   FT 2/2: MISS Kobe Booker makes 1/2 from the line. Offensive rebound by Shaquille Trent! Shaquille Trent kicks it out.
Score: 53-56

[07:21] Team_026 possession (Score: 53-56)
Immanuel Hyland attempts a Midrange. Wide open! Scottie Herro is 6.8 feet away. [ZONE] Immanuel Hyland misses. FOUL! Loose ball foul on Kyrie Adebayo during the rebound battle. [IN THE BONUS! 6 team fouls] Kobe Booker to the line for 2 free throws. (Kyrie Adebayo: 1 personal fouls)   FT 1/2: MISS   FT 2/2: GOOD Kobe Booker makes 1/2 from the line.
Score: 54-56

[07:02] Team_096 possession (Score: 54-56)
Kyrie Adebayo attempts a Midrange. Wide open! Klay Giddey is 7.8 feet away. [ZONE] Kyrie Adebayo misses. Rebound secured by Immanuel Hyland.

[06:47] Team_026 possession (Score: 54-56)
FOUL! Shooting foul on Kyrie Adebayo. Kobe Booker to the line for 2 free throws. [BONUS: 7 team fouls] (Kyrie Adebayo: 2 personal fouls)   FT 1/2: GOOD   FT 2/2: GOOD Kobe Booker makes 2/2 from the line.
Score: 56-56

[06:33] Team_096 possession (Score: 56-56)
Kyrie Adebayo attempts a Midrange. Wide open! Shaquille Trent is 7.3 feet away. [ZONE] KYRIE ADEBAYO MAKES IT!
Score: 56-58

[06:18] Team_026 possession (Score: 56-58)
Wendell Gasol makes the Dunk and draws the foul on Cole Griffin! And-1! Wendell Gasol to the line for 1. [BONUS: 8 team fouls] (Cole Griffin: 2 personal fouls)   FT 1/1: GOOD Wendell Gasol makes 1/1 from the line.
Score: 59-58

[06:06] Team_096 possession (Score: 59-58)
Terry Mobley loses control! Ball rolls out of bounds! TURNOVER! (dead ball)

[05:50] Team_026 possession (Score: 59-58)
Immanuel Hyland attempts a Layup. Contested by Kyrie Adebayo (5.6 feet, ZONE). IMMANUEL HYLAND MAKES IT! Assist: Kobe Booker
Score: 61-58

[05:34] Team_096 possession (Score: 61-58)
Scottie Herro throws a bad pass! Stolen by Shaquille Trent! TURNOVER! (live ball)

[05:16] Team_026 possession (Score: 61-58)
Klay Giddey attempts a Midrange. Contested by Lamelo Quickley (4.6 feet, ZONE). Klay Giddey misses. Rebound secured by Kyrie Adebayo.

[05:06] Team_096 possession (Score: 61-58)
Cole Griffin attempts a 3Pt. Wide open! Klay Giddey is 6.3 feet away. [MAN] Cole Griffin misses. Rebound secured by Kobe Booker.

[04:50] Team_026 possession (Score: 61-58)
Immanuel Hyland attempts a 3Pt. Wide open! Terry Mobley is 6.2 feet away. [ZONE] Immanuel Hyland misses. Rebound secured by Scottie Herro.

[04:37] Team_096 possession (Score: 61-58)
FOUL! Holding foul on Klay Giddey. [Team fouls: 2] No free throws, side out. (Klay Giddey: 1 personal fouls)

[04:24] Team_096 possession (Score: 61-58)
Kyrie Adebayo attempts a Midrange. Contested by Kobe Booker (5.9 feet, MAN). KYRIE ADEBAYO MAKES IT! Assist: Scottie Herro
Score: 61-60

[04:10] Team_026 possession (Score: 61-60)
Wendell Gasol drives and kicks out. Klay Giddey attempts a Midrange. Contested by Cole Griffin (3.0 feet, MAN). Klay Giddey misses. Rebound secured by Cole Griffin.

[03:53] Team_096 possession (Score: 61-60)
Scottie Herro attempts a 3Pt. Contested by Shaquille Trent (3.9 feet, MAN). Scottie Herro misses. Rebound secured by Shaquille Trent.

[03:38] Team_026 possession (Score: 61-60)
Wendell Gasol attempts a 3Pt. Contested by Cole Griffin (4.7 feet, ZONE). WENDELL GASOL MAKES IT! Assist: Immanuel Hyland
Score: 64-60

[03:25] Team_096 possession (Score: 64-60)
Terry Mobley attempts a 3Pt. Contested by Immanuel Hyland (4.5 feet, ZONE). Terry Mobley misses. Rebound secured by Shaquille Trent.

[03:12] Team_026 possession (Score: 64-60)
Klay Giddey drives and kicks out. Shaquille Trent attempts a Midrange. Wide open! Scottie Herro is 7.1 feet away. [MAN] Shaquille Trent misses. Rebound secured by Kyrie Adebayo.

[03:02] Team_096 possession (Score: 64-60)
Cole Griffin attempts a 3Pt. Contested by Immanuel Hyland (4.7 feet, ZONE). Cole Griffin misses. Rebound secured by Immanuel Hyland.

[02:46] Team_026 possession (Score: 64-60)
FOUL! Shooting foul on Lamelo Quickley. Immanuel Hyland to the line for 3 free throws. [BONUS: 9 team fouls] (Lamelo Quickley: 2 personal fouls)   FT 1/3: GOOD   FT 2/3: GOOD   FT 3/3: GOOD Immanuel Hyland makes 3/3 from the line.
Score: 67-60

[02:33] Team_096 possession (Score: 67-60)
Cole Griffin drives, picks up Kobe Booker. Help arrives from Immanuel Hyland! Cole Griffin attempts a Dunk. Wide open! Immanuel Hyland is 7.0 feet away. [ZONE] Cole Griffin misses. Rebound secured by Kobe Booker.

[02:17] Team_026 possession (Score: 67-60)
Immanuel Hyland makes the Midrange and draws the foul on Lamelo Quickley! And-1! Immanuel Hyland to the line for 1. [BONUS: 10 team fouls] (Lamelo Quickley: 3 personal fouls)   FT 1/1: GOOD Immanuel Hyland makes 1/1 from the line.
Score: 70-60

[02:02] Team_096 possession (Score: 70-60)
Cole Griffin attempts a 3Pt. Contested by Klay Giddey (5.5 feet, MAN). COLE GRIFFIN MAKES IT! Assist: Kyrie Adebayo
Score: 70-63

[01:51] Team_026 possession (Score: 70-63)
FOUL! Shooting foul on Cole Griffin. Kobe Booker to the line for 2 free throws. [BONUS: 11 team fouls] (Cole Griffin: 3 personal fouls)   FT 1/2: GOOD   FT 2/2: MISS Kobe Booker makes 1/2 from the line. Rebound secured by Kyrie Adebayo.
Score: 71-63

[01:40] Team_096 possession (Score: 71-63)
FOUL! Reach-in foul on Immanuel Hyland during the drive. [Team fouls: 3] No free throws, side out. (Immanuel Hyland: 1 personal fouls)

[01:27] Team_096 possession (Score: 71-63)
Lamelo Quickley drives to the basket... FOUL! Offensive foul on Lamelo Quickley! Immanuel Hyland drew the charge! [Team fouls: 12] (Lamelo Quickley: 4 personal fouls) TURNOVER! (dead ball)

[01:15] Team_026 possession (Score: 71-63)
Shaquille Trent drives to the basket... Shaquille Trent throws a bad pass out of bounds! TURNOVER! (dead ball)

[01:15] Substitution (Team_026): Wendell Gasol OUT → Myles Tatum IN (stamina_rule2)

[01:15] Substitution (Team_026): Immanuel Hyland OUT → Karl Barrett IN (stamina_rule2)

[01:15] Substitution (Team_026): Klay Giddey OUT → Josh Simons IN (stamina_rule2)

[01:15] Substitution (Team_026): Shaquille Trent OUT → Damian Doncic IN (stamina_rule2)

[01:15] Substitution (Team_026): Kobe Booker OUT → Dirk Randle IN (stamina_rule2)

[01:15] Substitution (Team_096): Terry Mobley OUT → Cade Jokic IN (stamina_rule2)

[01:15] Substitution (Team_096): Lamelo Quickley OUT → Jarrett Markkanen IN (stamina_rule2)

[01:15] Substitution (Team_096): Cole Griffin OUT → Cole Holiday IN (stamina_rule2)

[01:15] Substitution (Team_096): Scottie Herro OUT → Tyler Haliburton IN (stamina_rule2)

[01:15] Substitution (Team_096): Kyrie Adebayo OUT → Devin Griffin IN (stamina_rule2)

[01:00] Team_096 possession (Score: 71-63)
Devin Griffin attempts a Layup. Wide open! Damian Doncic is 7.1 feet away. [ZONE] DEVIN GRIFFIN MAKES IT! Assist: Tyler Haliburton
Score: 71-65

[00:42] Team_026 possession (Score: 71-65)
Myles Tatum drives and kicks out. Myles Tatum attempts a 3Pt. Contested by Cade Jokic (5.8 feet, MAN). MYLES TATUM MAKES IT! Assist: Damian Doncic
Score: 74-65

[00:30] Team_096 possession (Score: 74-65)
Tyler Haliburton makes the Layup and draws the foul on Damian Doncic! And-1! Tyler Haliburton to the line for 1. [Team fouls: 4] (Damian Doncic: 1 personal fouls)   FT 1/1: MISS Tyler Haliburton makes 0/1 from the line. Rebound secured by Josh Simons.
Score: 74-67

[00:18] Team_026 possession (Score: 74-67)
Josh Simons attempts a 3Pt. Contested by Cole Holiday (3.6 feet, MAN). Josh Simons misses. Rebound secured by Devin Griffin.

[00:06] Team_096 possession (Score: 74-67)
Devin Griffin attempts a 3Pt. Contested by Karl Barrett (3.2 feet, ZONE). Devin Griffin misses. Rebound secured by Karl Barrett.

================================================================================
                              3RD QUARTER COMPLETE                              
================================================================================

3RD QUARTER SCORE: Team_026 34, Team_096 22

BOX SCORE:
================================================================================

Team_026
--------------------------------------------------------------------------------
Player                MIN  PTS  REB  AST  TO      FG   FG%      3P   3P%
--------------------------------------------------------------------------------
Wendell Gasol          25    9    0    0   0   3/5    60.0     0/0   0.0
Immanuel Hyland        25    8    2    1   0   3/4    75.0     0/0   0.0
Shaquille Trent        25    5    5    0   0   2/3    66.7     0/0   0.0
Kobe Booker            25    3    5    1   0   2/4    50.0     0/0   0.0
Klay Giddey            25    3    0    2   0   1/3    33.3     0/0   0.0
Myles Tatum            11    3    0    0   0   1/1   100.0     0/0   0.0
Damian Doncic          11    0    0    1   0   0/0     0.0     0/0   0.0
Josh Simons            11    0    1    0   0   0/1     0.0     0/0   0.0
Karl Barrett           11    0    1    0   0   0/0     0.0     0/0   0.0

TEAM: FG: 12/21 (57.1%), 3PT: 3/6 (50.0%), REB: 14 (4 off, 10 def), AST: 5, TO: 1
TEAM FOULS: 4


Team_096
--------------------------------------------------------------------------------
Player                MIN  PTS  REB  AST  TO      FG   FG%      3P   3P%
--------------------------------------------------------------------------------
Kyrie Adebayo          25    7    5    1   0   3/4    75.0     0/0   0.0
Cole Griffin           25    6    2    1   0   2/5    40.0     0/0   0.0
Scottie Herro          25    3    1    2   0   1/2    50.0     0/0   0.0
Terry Mobley           25    2    0    0   0   1/2    50.0     0/0   0.0
Devin Griffin          11    2    1    0   0   1/2    50.0     0/0   0.0
Lamelo Quickley        25    0    0    0   0   0/2     0.0     0/0   0.0
Tyler Haliburton       11    0    0    1   0   0/1     0.0     0/0   0.0

TEAM: FG: 8/18 (44.4%), 3PT: 2/8 (25.0%), REB: 9 (0 off, 9 def), AST: 5, TO: 4
TEAM FOULS: 12 [Team_026 in BONUS]

================================================================================

================================================================================
                       4TH QUARTER - Team_026 vs Team_096                       
================================================================================

[12:00] Team_026 possession (Score: 74-67)
Kobe Booker makes the Dunk and draws the foul on Lamelo Quickley! And-1! Kobe Booker to the line for 1. [Team fouls: 1] (Lamelo Quickley: 1 personal fouls)   FT 1/1: GOOD Kobe Booker makes 1/1 from the line.
Score: 77-67

[11:47] Team_096 possession (Score: 77-67)
Kyrie Adebayo attempts a Layup. Contested by Kobe Booker (3.6 feet, ZONE). KYRIE ADEBAYO MAKES IT!
Score: 77-69

[11:30] Team_026 possession (Score: 77-69)
Klay Giddey attempts a 3Pt. BLOCKED BY COLE GRIFFIN! Ball is loose! Offensive rebound by Shaquille Trent! Shaquille Trent kicks it out.

[11:16] Team_026 possession (Score: 77-69)
Shaquille Trent drives to the basket... FOUL! Offensive foul on Shaquille Trent! Scottie Herro drew the charge! [Team fouls: 1] (Shaquille Trent: 1 personal fouls) TURNOVER! (dead ball)

[11:03] Team_096 possession (Score: 77-69)
Terry Mobley attempts a Midrange. Wide open! Immanuel Hyland is 6.6 feet away. [ZONE] TERRY MOBLEY MAKES IT! Assist: Cole Griffin
Score: 77-71

[10:52] Team_026 possession (Score: 77-71)
Shaquille Trent attempts a 3Pt. Contested by Scottie Herro (3.5 feet, MAN). Shaquille Trent misses. Rebound secured by Kyrie Adebayo.

[10:35] Team_096 possession (Score: 77-71)
Lamelo Quickley drives and kicks out. Kyrie Adebayo attempts a Midrange. Wide open! Shaquille Trent is 7.6 feet away. [ZONE] Kyrie Adebayo misses. Offensive rebound by Kyrie Adebayo! Kyrie Adebayo puts it back in!
Score: 77-73

[10:18] Team_026 possession (Score: 77-73)
Wendell Gasol drives, picks up Kyrie Adebayo. Help arrives from Lamelo Quickley! Wendell Gasol attempts a Layup. Contested by Lamelo Quickley (3.1 feet, ZONE). Wendell Gasol misses. Rebound secured by Kyrie Adebayo.

[10:00] Team_096 possession (Score: 77-73)
Terry Mobley attempts a 3Pt. Wide open! Immanuel Hyland is 6.5 feet away. [ZONE] Terry Mobley misses. Offensive rebound by Scottie Herro! Scottie Herro kicks it out.

[09:46] Team_096 possession (Score: 77-73)
Terry Mobley drives, Kobe Booker stays with him. Terry Mobley attempts a Dunk. Contested by Kobe Booker (2.9 feet, ZONE). Terry Mobley misses. Offensive rebound by Kyrie Adebayo! Kyrie Adebayo's putback is no good. Rebound secured by Kobe Booker.

[09:33] Team_026 possession (Score: 77-73)
Wendell Gasol attempts a 3Pt. Contested by Cole Griffin (2.1 feet, ZONE). Wendell Gasol misses. Rebound secured by Scottie Herro.

[09:15] Team_096 possession (Score: 77-73)
Scottie Herro drives, Shaquille Trent stays with him. Scottie Herro attempts a Layup. Wide open! Shaquille Trent is 8.1 feet away. [MAN] Scottie Herro misses. FOUL! Loose ball foul on Kobe Booker during the rebound battle. [Team fouls: 2] No free throws, side out. (Kobe Booker: 1 personal fouls)

[09:03] Team_096 possession (Score: 77-73)
Kyrie Adebayo attempts a Midrange. Contested by Immanuel Hyland (4.3 feet, ZONE). Kyrie Adebayo misses. Rebound secured by Kobe Booker.

[08:50] Team_026 possession (Score: 77-73)
Kobe Booker drives, picks up Kyrie Adebayo. Help arrives from Lamelo Quickley! Kobe Booker attempts a Layup. Wide open! Lamelo Quickley is 6.2 feet away. [ZONE] KOBE BOOKER MAKES IT! Assist: Immanuel Hyland
Score: 79-73

[08:37] Team_096 possession (Score: 79-73)
Kyrie Adebayo drives and kicks out. Scottie Herro attempts a Midrange. Contested by Shaquille Trent (4.2 feet, MAN). Scottie Herro misses. Rebound secured by Shaquille Trent.

[08:24] Team_026 possession (Score: 79-73)
Shaquille Trent attempts a 3Pt. Contested by Cole Griffin (5.2 feet, ZONE). Shaquille Trent misses. Rebound secured by Kyrie Adebayo.

[08:11] Team_096 possession (Score: 79-73)
Cole Griffin attempts a 3Pt. Contested by Klay Giddey (4.9 feet, MAN). Cole Griffin misses. Rebound secured by Shaquille Trent.

[07:55] Team_026 possession (Score: 79-73)
Klay Giddey attempts a 3Pt. Contested by Terry Mobley (2.1 feet, ZONE). Klay Giddey misses. Rebound secured by Scottie Herro.

[07:46] Team_096 possession (Score: 79-73)
Kyrie Adebayo attempts a Midrange. Wide open! Kobe Booker is 6.2 feet away. [MAN] KYRIE ADEBAYO MAKES IT! Assist: Terry Mobley
Score: 79-75

[07:33] Team_026 possession (Score: 79-75)
Klay Giddey attempts a 3Pt. Contested by Cole Griffin (3.1 feet, MAN). Klay Giddey misses. Rebound secured by Kyrie Adebayo.

[07:17] Team_096 possession (Score: 79-75)
FOUL! Offensive foul on Terry Mobley! Wendell Gasol drew the charge! [Team fouls: 3] (Terry Mobley: 1 personal fouls) TURNOVER! (dead ball)

[07:05] Team_026 possession (Score: 79-75)
Shaquille Trent attempts a Layup. Wide open! Kyrie Adebayo is 10.0 feet away. [ZONE] Shaquille Trent misses. Rebound secured by Scottie Herro.

[06:52] Team_096 possession (Score: 79-75)
Lamelo Quickley drives, Immanuel Hyland stays with him. Lamelo Quickley attempts a Dunk. Contested by Immanuel Hyland (4.0 feet, MAN). Lamelo Quickley misses. Rebound secured by Kobe Booker.

[06:39] Team_026 possession (Score: 79-75)
Shaquille Trent attempts a 3Pt. Contested by Cole Griffin (4.4 feet, ZONE). Shaquille Trent misses. Offensive rebound by Kobe Booker! Kobe Booker kicks it out.

[06:29] Team_026 possession (Score: 79-75)
FOUL! Shooting foul on Terry Mobley. Wendell Gasol to the line for 3 free throws. [Team fouls: 4] (Terry Mobley: 2 personal fouls)   FT 1/3: MISS   FT 2/3: GOOD   FT 3/3: GOOD Wendell Gasol makes 2/3 from the line.
Score: 81-75

[06:14] Team_096 possession (Score: 81-75)
Kyrie Adebayo attempts a Midrange. Contested by Shaquille Trent (5.4 feet, ZONE). Kyrie Adebayo misses. Rebound secured by Immanuel Hyland.

[06:00] Team_026 possession (Score: 81-75)
Kobe Booker attempts a Midrange. Wide open! Kyrie Adebayo is 7.7 feet away. [MAN] Kobe Booker misses. Rebound secured by Scottie Herro.

[05:46] Team_096 possession (Score: 81-75)
Lamelo Quickley throws a bad pass out of bounds! TURNOVER! (dead ball)

[05:46] Substitution (Team_026): Wendell Gasol OUT → Myles Tatum IN (stamina_rule2)

[05:46] Substitution (Team_026): Immanuel Hyland OUT → Karl Barrett IN (stamina_rule2)

[05:46] Substitution (Team_026): Klay Giddey OUT → Josh Simons IN (stamina_rule2)

[05:46] Substitution (Team_026): Shaquille Trent OUT → Damian Doncic IN (stamina_rule2)

[05:46] Substitution (Team_026): Kobe Booker OUT → Dirk Randle IN (stamina_rule2)

[05:46] Substitution (Team_096): Terry Mobley OUT → Cade Jokic IN (stamina_rule2)

[05:46] Substitution (Team_096): Lamelo Quickley OUT → Jarrett Markkanen IN (stamina_rule2)

[05:46] Substitution (Team_096): Cole Griffin OUT → Cole Holiday IN (stamina_rule2)

[05:46] Substitution (Team_096): Scottie Herro OUT → Tyler Haliburton IN (stamina_rule2)

[05:46] Substitution (Team_096): Kyrie Adebayo OUT → Devin Griffin IN (stamina_rule2)

[05:32] Team_026 possession (Score: 81-75)
Karl Barrett commits a violation (traveling/carry)! TURNOVER! (dead ball)

[05:13] Team_096 possession (Score: 81-75)
Jarrett Markkanen drives, Karl Barrett stays with him. Jarrett Markkanen attempts a Dunk. Wide open! Karl Barrett is 7.8 feet away. [MAN] Jarrett Markkanen misses. Offensive rebound by Devin Griffin! Devin Griffin kicks it out.

[04:59] Team_096 possession (Score: 81-75)
Cade Jokic drives, Damian Doncic stays with him. Cade Jokic attempts a Layup. Wide open! Damian Doncic is 6.2 feet away. [ZONE] CADE JOKIC MAKES IT! Assist: Cole Holiday
Score: 81-77

[04:42] Team_026 possession (Score: 81-77)
Damian Doncic drives and kicks out. Karl Barrett attempts a 3Pt. Contested by Jarrett Markkanen (4.3 feet, MAN). Karl Barrett misses. Rebound secured by Devin Griffin.

[04:30] Team_096 possession (Score: 81-77)
Jarrett Markkanen attempts a 3Pt. Wide open! Karl Barrett is 8.3 feet away. [MAN] Jarrett Markkanen misses. Rebound secured by Damian Doncic.

[04:19] Team_026 possession (Score: 81-77)
Karl Barrett attempts a Midrange. Contested by Tyler Haliburton (5.8 feet, ZONE). KARL BARRETT MAKES IT!
Score: 83-77

[04:07] Team_096 possession (Score: 83-77)
Devin Griffin attempts a Midrange. Wide open! Dirk Randle is 7.7 feet away. [MAN] Devin Griffin misses. Rebound secured by Damian Doncic.

[03:53] Team_026 possession (Score: 83-77)
Damian Doncic drives and kicks out. Karl Barrett attempts a Midrange. Wide open! Jarrett Markkanen is 7.5 feet away. [ZONE] Karl Barrett misses. Rebound secured by Tyler Haliburton.

[03:37] Team_096 possession (Score: 83-77)
FOUL! Reach-in foul on Damian Doncic during the drive. [Team fouls: 3] No free throws, side out. (Damian Doncic: 1 personal fouls)

[03:24] Team_096 possession (Score: 83-77)
Cole Holiday loses the ball! Stripped by Josh Simons! TURNOVER! (live ball)

[03:09] Team_026 possession (Score: 83-77)
Karl Barrett attempts a Layup. Contested by Devin Griffin (4.8 feet, ZONE). Karl Barrett misses. Rebound secured by Jarrett Markkanen.

[02:58] Team_096 possession (Score: 83-77)
Cole Holiday attempts a Layup. Contested by Josh Simons (3.6 feet, MAN). Cole Holiday misses. Rebound secured by Damian Doncic.

[02:41] Team_026 possession (Score: 83-77)
Dirk Randle attempts a Midrange. Heavily contested by Jarrett Markkanen (1.2 feet, ZONE)! Dirk Randle misses. Rebound secured by Tyler Haliburton.

[02:24] Team_096 possession (Score: 83-77)
Devin Griffin attempts a Layup. Wide open! Damian Doncic is 7.8 feet away. [ZONE] Devin Griffin misses. Rebound secured by Karl Barrett.

[02:08] Team_026 possession (Score: 83-77)
Dirk Randle attempts a 3Pt. Contested by Devin Griffin (5.1 feet, MAN). Dirk Randle misses. Rebound secured by Tyler Haliburton.

[01:53] Team_096 possession (Score: 83-77)
Jarrett Markkanen attempts a 3Pt. Contested by Karl Barrett (5.4 feet, MAN). Jarrett Markkanen misses. Rebound secured by Karl Barrett.

[01:42] Team_026 possession (Score: 83-77)
Damian Doncic attempts a Midrange. Wide open! Cole Holiday is 6.0 feet away. [ZONE] Damian Doncic misses. Offensive rebound by Josh Simons! Josh Simons kicks it out.

[01:27] Team_026 possession (Score: 83-77)
Damian Doncic attempts a Midrange. Contested by Tyler Haliburton (4.5 feet, MAN). Damian Doncic misses. Rebound secured by Devin Griffin.

[01:13] Team_096 possession (Score: 83-77)
Devin Griffin throws a bad pass out of bounds! TURNOVER! (dead ball)

[00:56] Team_026 possession (Score: 83-77)
Damian Doncic drives and kicks out. Myles Tatum attempts a 3Pt. Wide open! Cade Jokic is 7.8 feet away. [ZONE] MYLES TATUM MAKES IT! Assist: Damian Doncic
Score: 86-77

[00:42] Team_096 possession (Score: 86-77)
Devin Griffin drives and kicks out. Tyler Haliburton attempts a 3Pt. Wide open! Damian Doncic is 7.7 feet away. [MAN] TYLER HALIBURTON MAKES IT! Assist: Devin Griffin
Score: 86-80

[00:28] Team_026 possession (Score: 86-80)
Josh Simons attempts a Midrange. Heavily contested by Cole Holiday (1.5 feet, ZONE)! Josh Simons misses. Rebound secured by Tyler Haliburton.

[00:17] Team_096 possession (Score: 86-80)
Cade Jokic attempts a Layup. Wide open! Damian Doncic is 6.9 feet away. [ZONE] CADE JOKIC MAKES IT!
Score: 86-82

[00:05] Team_026 possession (Score: 86-82)
Karl Barrett attempts a Midrange. BLOCKED BY JARRETT MARKKANEN! Ball goes out off Jarrett Markkanen. Karl Barrett's ball!

================================================================================
                              4TH QUARTER COMPLETE                              
================================================================================

4TH QUARTER SCORE: Team_026 12, Team_096 15

BOX SCORE:
================================================================================

Team_026
--------------------------------------------------------------------------------
Player                MIN  PTS  REB  AST  TO      FG   FG%      3P   3P%
--------------------------------------------------------------------------------
Kobe Booker            32    5    4    0   0   2/3    66.7     0/0   0.0
Myles Tatum            16    3    0    0   0   1/1   100.0     0/0   0.0
Wendell Gasol          32    2    0    0   0   1/3    33.3     0/0   0.0
Karl Barrett           16    2    2    0   0   1/2    50.0     0/0   0.0
Shaquille Trent        32    0    3    0   0   0/3     0.0     0/0   0.0
Immanuel Hyland        32    0    1    1   0   0/0     0.0     0/0   0.0
Klay Giddey            32    0    0    0   0   0/2     0.0     0/0   0.0
Damian Doncic          16    0    3    1   0   0/3     0.0     0/0   0.0
Dirk Randle            16    0    0    0   0   0/2     0.0     0/0   0.0
Josh Simons            16    0    1    0   0   0/1     0.0     0/0   0.0

TEAM: FG: 5/20 (25.0%), 3PT: 1/7 (14.3%), REB: 13 (3 off, 10 def), AST: 2, TO: 2
TEAM FOULS: 3


Team_096
--------------------------------------------------------------------------------
Player                MIN  PTS  REB  AST  TO      FG   FG%      3P   3P%
--------------------------------------------------------------------------------
Kyrie Adebayo          32    6    6    0   0   3/6    50.0     0/0   0.0
Cade Jokic             16    4    0    0   0   2/2   100.0     0/0   0.0
Tyler Haliburton       16    3    4    0   0   1/1   100.0     0/0   0.0
Terry Mobley           32    2    0    1   0   1/2    50.0     0/0   0.0
Cole Griffin           32    0    0    1   0   0/1     0.0     0/0   0.0
Scottie Herro          32    0    5    0   0   0/0     0.0     0/0   0.0
Lamelo Quickley        32    0    0    0   0   0/1     0.0     0/0   0.0
Devin Griffin          16    0    3    1   0   0/2     0.0     0/0   0.0
Cole Holiday           16    0    0    1   0   0/1     0.0     0/0   0.0
Jarrett Markkanen      16    0    1    0   0   0/2     0.0     0/0   0.0

TEAM: FG: 7/18 (38.9%), 3PT: 0/3 (0.0%), REB: 20 (5 off, 15 def), AST: 4, TO: 4
TEAM FOULS: 4

================================================================================

================================================================================
                               FULL GAME COMPLETE                               
================================================================================

FINAL SCORE: Team_026 86, Team_096 82

SCORING BY QUARTER:
--------------------------------------------------------------------------------
Team                     Q1     Q2     Q3     Q4    FINAL
--------------------------------------------------------------------------------
Team_026                 21     19     34     12       86
Team_096                 28     17     22     15       82
--------------------------------------------------------------------------------

FULL GAME BOX SCORE:
================================================================================

Team_026
--------------------------------------------------------------------------------
Player                MIN  PTS  REB  AST  TO      FG   FG%      3P   3P%      FT STL BLK
--------------------------------------------------------------------------------
Wendell Gasol          32   16    0    0   0   6/13   46.2   3/5    60.0   4/5     0   0
Immanuel Hyland        32   13    6    2   1   5/11   45.5   1/4    25.0   7/8     1   0
Klay Giddey            32   13    0    5   0   6/13   46.2   2/5    40.0   5/6     0   0
Shaquille Trent        32    7   11    0   0   3/9    33.3   0/2     0.0   1/1     1   0
Kobe Booker            32   10   12    4   3   4/11   36.4   0/3     0.0   7/11    2   1
Myles Tatum            16    9    0    0   1   2/4    50.0   1/3    33.3   0/0     0   0
Karl Barrett           16    9    6    0   1   3/6    50.0   1/1   100.0   5/5     0   0
Josh Simons            16    0    5    0   0   1/6    16.7   0/2     0.0   0/0     1   0
Damian Doncic          16    4    7    2   1   3/7    42.9   0/0     0.0   0/0     0   0
Dirk Randle            16    0    0    3   0   0/3     0.0   0/2     0.0   0/0     1   0

TEAM: FG: 33/83 (39.8%), 3PT: 8/27 (29.6%), REB: 47 (10 off, 37 def), AST: 16, TO: 7


Team_096
--------------------------------------------------------------------------------
Player                MIN  PTS  REB  AST  TO      FG   FG%      3P   3P%      FT STL BLK
--------------------------------------------------------------------------------
Terry Mobley           32    7    0    3   6   5/8    62.5   0/2     0.0   1/2     0   0
Lamelo Quickley        32    7    0    0   2   3/8    37.5   1/4    25.0   0/0     0   0
Cole Griffin           32   10    4    2   1   3/8    37.5   3/7    42.9   1/1     0   1
Scottie Herro          32   10   13    5   3   3/6    50.0   0/2     0.0   3/3     0   0
Kyrie Adebayo          32   24   19    1   0  11/17   64.7   1/2    50.0   0/0     0   1
Cade Jokic             16    8    0    0   1   4/6    66.7   0/1     0.0   0/0     1   0
Jarrett Markkanen      16    0    5    0   0   0/5     0.0   0/4     0.0   0/0     0   1
Cole Holiday           16    2    0    2   1   1/3    33.3   0/0     0.0   0/0     0   0
Tyler Haliburton       16   10    8    2   0   3/7    42.9   0/2     0.0   1/2     0   1
Devin Griffin          16    2    7    2   2   2/5    40.0   0/1     0.0   0/0     0   1

TEAM: FG: 35/73 (47.9%), 3PT: 5/25 (20.0%), REB: 56 (8 off, 48 def), AST: 17, TO: 16

================================================================================
