================================================================================
                        FULL GAME - Team_034 vs Team_090                        
================================================================================

================================================================================
                       1ST QUARTER - Team_034 vs Team_090                       
================================================================================

[12:00] Team_034 possession (Score: 0-0)
Ben Hyland drives, Gary Brogdon stays with him. Ben Hyland attempts a Dunk. Contested by Gary Brogdon (2.8 feet, ZONE). Ben Hyland misses. Rebound secured by Tracy Adebayo.

[11:44] Team_090 possession (Score: 0-0)
Zach Wall attempts a Midrange. Contested by Cole Antetokounmpo (4.4 feet, MAN). Zach Wall misses. Offensive rebound by Tracy Adebayo! Tracy Adebayo kicks it out.

[11:32] Team_090 possession (Score: 0-0)
Larry Bridges drives, picks up Terry Doncic. Help arrives from Ben Hyland! Larry Bridges attempts a Dunk. Contested by Ben Hyland (3.8 feet, ZONE). Larry Bridges misses. Rebound secured by Terry Doncic.

[11:18] Team_034 possession (Score: 0-0)
Devin Poole loses control! Ball rolls out of bounds! TURNOVER! (dead ball)

[11:03] Team_090 possession (Score: 0-0)
Gary Brogdon attempts a Layup. Heavily contested by Terry Doncic (1.1 feet, ZONE)! GARY BROGDON MAKES IT! Assist: Zach Wall
Score: 0-2

[10:47] Team_034 possession (Score: 0-2)
Cole Antetokounmpo commits a violation (traveling/carry)! TURNOVER! (dead ball)

[10:33] Team_090 possession (Score: 0-2)
Gary Brogdon attempts a 3Pt. Contested by Terry Doncic (3.8 feet, MAN). Gary Brogdon misses. Rebound secured by Terry Doncic.

[10:19] Team_034 possession (Score: 0-2)
Anthony Bane drives, picks up Gary Brogdon. Help arrives from Larry Bridges! Anthony Bane attempts a Dunk. Contested by Larry Bridges (5.0 feet, ZONE). Anthony Bane misses. FOUL! Loose ball foul on Tracy Adebayo during the rebound battle. [Team fouls: 1] No free throws, side out. (Tracy Adebayo: 1 personal fouls)

[10:05] Team_034 possession (Score: 0-2)
Cole Antetokounmpo attempts a 3Pt. Contested by Zach Wall (5.2 feet, MAN). COLE ANTETOKOUNMPO MAKES IT! Assist: Ben Hyland
Score: 3-2

[09:51] Team_090 possession (Score: 3-2)
Gary Brogdon attempts a 3Pt. Contested by Terry Doncic (3.8 feet, MAN). Gary Brogdon misses. Rebound secured by Terry Doncic.

[09:41] Team_034 possession (Score: 3-2)
Ben Hyland attempts a 3Pt. Contested by Larry Bridges (4.6 feet, MAN). BEN HYLAND MAKES IT!
Score: 6-2

[09:23] Team_090 possession (Score: 6-2)
Larry Bridges commits a violation (traveling/carry)! TURNOVER! (dead ball)

[09:13] Team_034 possession (Score: 6-2)
Cole Antetokounmpo attempts a Layup. Contested by Zach Wall (3.6 feet, MAN). Cole Antetokounmpo misses. Rebound secured by Zach Wall.

[08:56] Team_090 possession (Score: 6-2)
Gary Brogdon attempts a Layup. BLOCKED BY TERRY DONCIC! Ball is loose! Offensive rebound by Tracy Adebayo! Tracy Adebayo kicks it out.

[08:43] Team_090 possession (Score: 6-2)
Larry Bridges attempts a 3Pt. Contested by Devin Poole (4.2 feet, ZONE). Larry Bridges misses. Offensive rebound by Tracy Adebayo! Tracy Adebayo kicks it out.

[08:27] Team_090 possession (Score: 6-2)
Derrick Mitchell drives and kicks out. Derrick Mitchell attempts a 3Pt. Contested by Devin Poole (5.2 feet, MAN). Derrick Mitchell misses. Offensive rebound by Tracy Adebayo! Tracy Adebayo kicks it out.

[08:14] Team_090 possession (Score: 6-2)
Gary Brogdon attempts a Layup. BLOCKED BY TERRY DONCIC! Ball is loose! Rebound secured by Cole Antetokounmpo.

[08:03] Team_034 possession (Score: 6-2)
Terry Doncic drives and kicks out. Ben Hyland attempts a 3Pt. Contested by Larry Bridges (4.7 feet, MAN). Ben Hyland misses. Rebound secured by Zach Wall.

[07:45] Team_090 possession (Score: 6-2)
FOUL! Reach-in foul on Terry Doncic during the drive. [Team fouls: 2] No free throws, side out. (Terry Doncic: 2 personal fouls)

[07:34] Team_090 possession (Score: 6-2)
Zach Wall attempts a 3Pt. Contested by Devin Poole (4.8 feet, ZONE). Zach Wall misses. Rebound secured by Cole Antetokounmpo.

[07:23] Team_034 possession (Score: 6-2)
Ben Hyland attempts a Midrange. Wide open! Larry Bridges is 6.2 feet away. [MAN] BEN HYLAND MAKES IT!
Score: 8-2

[07:09] Team_090 possession (Score: 8-2)
Tracy Adebayo drives, Terry Doncic stays with him. Tracy Adebayo attempts a Dunk. Wide open! Terry Doncic is 8.1 feet away. [ZONE] Tracy Adebayo misses. Offensive rebound by Tracy Adebayo! Tracy Adebayo kicks it out.

[06:57] Team_090 possession (Score: 8-2)
Gary Brogdon makes the Layup and draws the foul on Terry Doncic! And-1! Gary Brogdon to the line for 1. [Team fouls: 3] (Terry Doncic: 3 personal fouls)   FT 1/1: GOOD Gary Brogdon makes 1/1 from the line.
Score: 8-5

[06:46] Team_034 possession (Score: 8-5)
Devin Poole attempts a Midrange. Heavily contested by Derrick Mitchell (1.8 feet, MAN)! Devin Poole misses. Offensive rebound by Terry Doncic! Terry Doncic puts it back in!
Score: 10-5

[06:31] Team_090 possession (Score: 10-5)
Larry Bridges attempts a 3Pt. Heavily contested by Ben Hyland (1.7 feet, MAN)! LARRY BRIDGES MAKES IT! Assist: Zach Wall
Score: 10-8

[06:18] Team_034 possession (Score: 10-8)
Anthony Bane attempts a Layup. Contested by Tracy Adebayo (3.4 feet, MAN). ANTHONY BANE MAKES IT!
Score: 12-8

[06:02] Team_090 possession (Score: 12-8)
Zach Wall attempts a 3Pt. Wide open! Devin Poole is 7.3 feet away. [ZONE] Zach Wall misses. Rebound secured by Cole Antetokounmpo.

[05:44] Team_034 possession (Score: 12-8)
Ben Hyland attempts a Midrange. Contested by Gary Brogdon (4.4 feet, ZONE). Ben Hyland misses. FOUL! Loose ball foul on Tracy Adebayo during the rebound battle. [Team fouls: 2] No free throws, side out. (Tracy Adebayo: 2 personal fouls)

[05:33] Team_034 possession (Score: 12-8)
Anthony Bane drives, Gary Brogdon stays with him. Anthony Bane attempts a Dunk. Contested by Gary Brogdon (2.6 feet, ZONE). Anthony Bane misses. Rebound secured by Gary Brogdon.

[05:23] Team_090 possession (Score: 12-8)
FOUL! Holding foul on Anthony Bane. [Team fouls: 4] No free throws, side out. (Anthony Bane: 1 personal fouls)

[05:12] Team_090 possession (Score: 12-8)
Gary Brogdon attempts a Midrange. Contested by Terry Doncic (3.7 feet, MAN). Gary Brogdon misses. Rebound secured by Terry Doncic.

[05:00] Team_034 possession (Score: 12-8)
Terry Doncic attempts a Layup. Contested by Gary Brogdon (5.6 feet, MAN). TERRY DONCIC MAKES IT! Assist: Cole Antetokounmpo
Score: 14-8

[04:40] Team_090 possession (Score: 14-8)
Gary Brogdon attempts a 3Pt. Heavily contested by Terry Doncic (1.4 feet, MAN)! GARY BROGDON MAKES IT! Assist: Larry Bridges
Score: 14-11

[04:30] Team_034 possession (Score: 14-11)
Devin Poole attempts a Midrange. Contested by Zach Wall (3.8 feet, ZONE). Devin Poole misses. Rebound secured by Gary Brogdon.

[04:18] Team_090 possession (Score: 14-11)
Derrick Mitchell attempts a 3Pt. Contested by Devin Poole (2.1 feet, ZONE). Derrick Mitchell misses. Offensive rebound by Zach Wall! Zach Wall kicks it out.

[04:01] Team_090 possession (Score: 14-11)
FOUL! Offensive foul on Gary Brogdon! Terry Doncic drew the charge! [Team fouls: 3] (Gary Brogdon: 1 personal fouls) TURNOVER! (dead ball)

[03:49] Team_034 possession (Score: 14-11)
Terry Doncic attempts a 3Pt. Contested by Gary Brogdon (2.9 feet, MAN). Terry Doncic misses. Offensive rebound by Terry Doncic! Terry Doncic puts it back in!
Score: 16-11

[03:37] Team_090 possession (Score: 16-11)
Derrick Mitchell loses the ball! Stripped by Devin Poole! TURNOVER! (live ball)

[03:21] Team_034 possession (Score: 16-11)
Cole Antetokounmpo attempts a 3Pt. Wide open! Derrick Mitchell is 6.4 feet away. [ZONE] Cole Antetokounmpo misses. Rebound secured by Gary Brogdon.

[03:07] Team_090 possession (Score: 16-11)
Derrick Mitchell attempts a Layup. Contested by Devin Poole (5.8 feet, MAN). Derrick Mitchell misses. Rebound secured by Terry Doncic.

[02:53] Team_034 possession (Score: 16-11)
Terry Doncic drives, Gary Brogdon stays with him. Terry Doncic attempts a Dunk. Wide open! Gary Brogdon is 8.7 feet away. [ZONE] TERRY DONCIC MAKES IT! Assist: Devin Poole
Score: 18-11

[02:35] Team_090 possession (Score: 18-11)
Larry Bridges drives and kicks out. Tracy Adebayo attempts a Midrange. Wide open! Cole Antetokounmpo is 7.5 feet away. [ZONE] TRACY ADEBAYO MAKES IT! Assist: Larry Bridges
Score: 18-13

[02:20] Team_034 possession (Score: 18-13)
Terry Doncic attempts a Midrange. Contested by Gary Brogdon (5.5 feet, MAN). TERRY DONCIC MAKES IT! Assist: Devin Poole
Score: 20-13

[02:02] Team_090 possession (Score: 20-13)
Zach Wall attempts a Midrange. Contested by Terry Doncic (5.8 feet, ZONE). ZACH WALL MAKES IT! Assist: Derrick Mitchell
Score: 20-15

[01:48] Team_034 possession (Score: 20-15)
FOUL! Holding foul on Gary Brogdon. [Team fouls: 4] No free throws, side out. (Gary Brogdon: 2 personal fouls)

[01:35] Team_034 possession (Score: 20-15)
FOUL! Shooting foul on Gary Brogdon. Terry Doncic to the line for 2 free throws. [BONUS: 5 team fouls] (Gary Brogdon: 3 personal fouls)   FT 1/2: GOOD   FT 2/2: GOOD Terry Doncic makes 2/2 from the line.
Score: 22-15

[01:20] Team_090 possession (Score: 22-15)
Tracy Adebayo drives, Anthony Bane stays with him. Tracy Adebayo attempts a Layup. Wide open! Anthony Bane is 7.5 feet away. [ZONE] Tracy Adebayo misses. Rebound secured by Terry Doncic.

[01:07] Team_034 possession (Score: 22-15)
Anthony Bane attempts a Midrange. Wide open! Tracy Adebayo is 7.9 feet away. [MAN] Anthony Bane misses. Rebound secured by Zach Wall.

[00:53] Team_090 possession (Score: 22-15)
Larry Bridges attempts a 3Pt. Contested by Ben Hyland (2.4 feet, MAN). LARRY BRIDGES MAKES IT! Assist: Derrick Mitchell
Score: 22-18

[00:40] Team_034 possession (Score: 22-18)
Cole Antetokounmpo attempts a 3Pt. Wide open! Zach Wall is 10.0 feet away. [MAN] COLE ANTETOKOUNMPO MAKES IT! Assist: Terry Doncic
Score: 25-18

[00:26] Team_090 possession (Score: 25-18)
FOUL! Shooting foul on Terry Doncic. Gary Brogdon to the line for 2 free throws. [BONUS: 5 team fouls] (Terry Doncic: 4 personal fouls)   FT 1/2: GOOD   FT 2/2: GOOD Gary Brogdon makes 2/2 from the line.
Score: 25-20

[00:11] Team_034 possession (Score: 25-20)
FOUL! Shooting foul on Derrick Mitchell. Ben Hyland to the line for 3 free throws. [BONUS: 6 team fouls] (Derrick Mitchell: 1 personal fouls)   FT 1/3: GOOD   FT 2/3: GOOD   FT 3/3: GOOD Ben Hyland makes 3/3 from the line.
Score: 28-20

================================================================================
                              1ST QUARTER COMPLETE                              
================================================================================

1ST QUARTER SCORE: Team_034 28, Team_090 20

BOX SCORE:
================================================================================

Team_034
--------------------------------------------------------------------------------
Player                MIN  PTS  REB  AST  TO      FG   FG%      3P   3P%
--------------------------------------------------------------------------------
Terry Doncic           12   12   10    1   0   6/7    85.7     0/0   0.0
Ben Hyland             12    8    0    1   0   3/4    75.0     0/0   0.0
Cole Antetokounmpo     12    6    3    1   0   2/4    50.0     0/0   0.0
Anthony Bane           12    2    0    0   0   1/3    33.3     0/0   0.0
Devin Poole            12    0    0    2   0   0/1     0.0     0/0   0.0

TEAM: FG: 12/19 (63.2%), 3PT: 5/6 (83.3%), REB: 13 (4 off, 9 def), AST: 5, TO: 2
TEAM FOULS: 5 [Team_090 in BONUS]


Team_090
--------------------------------------------------------------------------------
Player                MIN  PTS  REB  AST  TO      FG   FG%      3P   3P%
--------------------------------------------------------------------------------
Gary Brogdon           12   10    3    0   0   4/8    50.0     0/0   0.0
Larry Bridges          12    6    0    2   0   2/3    66.7     0/0   0.0
Tracy Adebayo          12    2    6    0   0   1/2    50.0     0/0   0.0
Zach Wall              12    2    4    2   0   1/3    33.3     0/0   0.0
Derrick Mitchell       12    0    0    2   0   0/1     0.0     0/0   0.0

TEAM: FG: 8/17 (47.1%), 3PT: 3/7 (42.9%), REB: 13 (6 off, 7 def), AST: 6, TO: 3
TEAM FOULS: 6 [Team_034 in BONUS]

================================================================================

================================================================================
                       2ND QUARTER - Team_034 vs Team_090                       
================================================================================

[12:00] Team_034 possession (Score: 28-20)
Anthony Bane makes the Midrange and draws the foul on Larry Bridges! And-1! Anthony Bane to the line for 1. [Team fouls: 1] (Larry Bridges: 1 personal fouls)   FT 1/1: GOOD Anthony Bane makes 1/1 from the line.
Score: 31-20

[11:49] Team_090 possession (Score: 31-20)
Larry Bridges attempts a 3Pt. Contested by Ben Hyland (4.9 feet, MAN). LARRY BRIDGES MAKES IT! Assist: Tracy Adebayo
Score: 31-23

[11:34] Team_034 possession (Score: 31-23)
Cole Antetokounmpo attempts a 3Pt. Contested by Derrick Mitchell (5.8 feet, ZONE). Cole Antetokounmpo misses. Rebound secured by Gary Brogdon.

[11:22] Team_090 possession (Score: 31-23)
Derrick Mitchell attempts a 3Pt. Heavily contested by Ben Hyland (0.9 feet, ZONE)! Derrick Mitchell misses. Rebound secured by Anthony Bane.

[11:10] Team_034 possession (Score: 31-23)
FOUL! Holding foul on Tracy Adebayo. [Team fouls: 2] No free throws, side out. (Tracy Adebayo: 1 personal fouls)

[10:56] Team_034 possession (Score: 31-23)
Cole Antetokounmpo drives to the basket... FOUL! Offensive foul on Cole Antetokounmpo! Gary Brogdon drew the charge! [Team fouls: 1] (Cole Antetokounmpo: 1 personal fouls) TURNOVER! (dead ball)

[10:38] Team_090 possession (Score: 31-23)
Larry Bridges drives and kicks out. Larry Bridges attempts a Midrange. Wide open! Anthony Bane is 6.2 feet away. [ZONE] Larry Bridges misses. Rebound secured by Anthony Bane.

[10:26] Team_034 possession (Score: 31-23)
Terry Doncic attempts a Midrange. Contested by Gary Brogdon (2.2 feet, MAN). Terry Doncic misses. Rebound secured by Zach Wall.

[10:08] Team_090 possession (Score: 31-23)
Derrick Mitchell drives, picks up Devin Poole. Help arrives from Ben Hyland! Derrick Mitchell attempts a Dunk. Contested by Ben Hyland (3.1 feet, MAN). Derrick Mitchell misses. Rebound secured by Terry Doncic.

[09:56] Team_034 possession (Score: 31-23)
Terry Doncic attempts a Midrange. Contested by Derrick Mitchell (2.8 feet, ZONE). Terry Doncic misses. Offensive rebound by Terry Doncic! Terry Doncic kicks it out.

[09:41] Team_034 possession (Score: 31-23)
Anthony Bane drives, Tracy Adebayo stays with him. Anthony Bane attempts a Dunk. Contested by Tracy Adebayo (5.3 feet, MAN). ANTHONY BANE MAKES IT! Assist: Terry Doncic
Score: 33-23

[09:26] Team_090 possession (Score: 33-23)
FOUL! Offensive foul on Gary Brogdon! Terry Doncic drew the charge! [Team fouls: 3] (Gary Brogdon: 1 personal fouls) TURNOVER! (dead ball)

[09:12] Team_034 possession (Score: 33-23)
Terry Doncic drives and kicks out. Anthony Bane attempts a Midrange. Wide open! Tracy Adebayo is 8.0 feet away. [MAN] Anthony Bane misses. Rebound secured by Gary Brogdon.

[08:55] Team_090 possession (Score: 33-23)
Tracy Adebayo drives, Anthony Bane stays with him. Tracy Adebayo attempts a Dunk. Wide open! Anthony Bane is 7.3 feet away. [MAN] Tracy Adebayo misses. Rebound secured by Terry Doncic.

[08:42] Team_034 possession (Score: 33-23)
Devin Poole attempts a 3Pt. Contested by Derrick Mitchell (4.7 feet, MAN). Devin Poole misses. Rebound secured by Gary Brogdon.

[08:27] Team_090 possession (Score: 33-23)
Derrick Mitchell attempts a Midrange. Contested by Devin Poole (2.4 feet, MAN). Derrick Mitchell misses. Offensive rebound by Tracy Adebayo! Tracy Adebayo kicks it out.

[08:12] Team_090 possession (Score: 33-23)
Derrick Mitchell attempts a Layup. BLOCKED BY TERRY DONCIC! Ball is loose! Rebound secured by Cole Antetokounmpo.

[07:55] Team_034 possession (Score: 33-23)
Ben Hyland attempts a Midrange. Wide open! Larry Bridges is 6.7 feet away. [ZONE] BEN HYLAND MAKES IT! Assist: Terry Doncic
Score: 35-23

[07:38] Team_090 possession (Score: 35-23)
Zach Wall attempts a 3Pt. Wide open! Devin Poole is 8.1 feet away. [ZONE] Zach Wall misses. Rebound secured by Terry Doncic.

[07:25] Team_034 possession (Score: 35-23)
FOUL! Reach-in foul on Gary Brogdon during the drive. [Team fouls: 4] No free throws, side out. (Gary Brogdon: 2 personal fouls)

[07:07] Team_034 possession (Score: 35-23)
Terry Doncic makes the Layup and draws the foul on Gary Brogdon! And-1! Terry Doncic to the line for 1. [BONUS: 5 team fouls] (Gary Brogdon: 3 personal fouls)   FT 1/1: MISS Terry Doncic makes 0/1 from the line. Rebound secured by Zach Wall.
Score: 37-23

[06:53] Team_090 possession (Score: 37-23)
Larry Bridges attempts a Layup. Wide open! Terry Doncic is 8.4 feet away. [ZONE] LARRY BRIDGES MAKES IT! Assist: Zach Wall
Score: 37-25

[06:36] Team_034 possession (Score: 37-25)
Devin Poole attempts a Midrange. Contested by Zach Wall (6.0 feet, ZONE). DEVIN POOLE MAKES IT!
Score: 39-25

[06:23] Team_090 possession (Score: 39-25)
Zach Wall makes the Dunk and draws the foul on Cole Antetokounmpo! And-1! Zach Wall to the line for 1. [Team fouls: 2] (Cole Antetokounmpo: 2 personal fouls)   FT 1/1: GOOD Zach Wall makes 1/1 from the line.
Score: 39-28

[06:07] Team_034 possession (Score: 39-28)
Ben Hyland attempts a 3Pt. Contested by Larry Bridges (4.5 feet, MAN). Ben Hyland misses. Offensive rebound by Terry Doncic! Terry Doncic kicks it out.

[05:58] Team_034 possession (Score: 39-28)
Cole Antetokounmpo attempts a Midrange. Wide open! Zach Wall is 6.6 feet away. [MAN] COLE ANTETOKOUNMPO MAKES IT! Assist: Terry Doncic
Score: 41-28

[05:42] Team_090 possession (Score: 41-28)
Gary Brogdon drives, picks up Terry Doncic. Help arrives from Ben Hyland! Gary Brogdon attempts a Dunk. Wide open! Ben Hyland is 6.8 feet away. [MAN] Gary Brogdon misses. Rebound secured by Terry Doncic.

[05:29] Team_034 possession (Score: 41-28)
Devin Poole attempts a 3Pt. Wide open! Derrick Mitchell is 7.6 feet away. [MAN] DEVIN POOLE MAKES IT! Assist: Terry Doncic
Score: 44-28

[05:18] Team_090 possession (Score: 44-28)
Tracy Adebayo attempts a Layup. Wide open! Anthony Bane is 6.3 feet away. [MAN] TRACY ADEBAYO MAKES IT! Assist: Gary Brogdon
Score: 44-30

[05:02] Team_034 possession (Score: 44-30)
Devin Poole attempts a 3Pt. Contested by Derrick Mitchell (2.5 feet, MAN). Devin Poole misses. Rebound secured by Tracy Adebayo.

[04:53] Team_090 possession (Score: 44-30)
Zach Wall attempts a 3Pt. Wide open! Devin Poole is 6.1 feet away. [ZONE] Zach Wall misses. Rebound secured by Anthony Bane.

[04:39] Team_034 possession (Score: 44-30)
Anthony Bane drives, Tracy Adebayo stays with him. Anthony Bane attempts a Layup. Wide open! Tracy Adebayo is 9.1 feet away. [MAN] ANTHONY BANE MAKES IT!
Score: 46-30

[04:28] Team_090 possession (Score: 46-30)
Tracy Adebayo drives and kicks out. Larry Bridges attempts a Midrange. Wide open! Ben Hyland is 7.6 feet away. [MAN] Larry Bridges misses. Rebound secured by Anthony Bane.

[04:15] Team_034 possession (Score: 46-30)
Ben Hyland attempts a Layup. Contested by Gary Brogdon (5.8 feet, ZONE). Ben Hyland misses. Rebound secured by Tracy Adebayo.

[04:00] Team_090 possession (Score: 46-30)
Tracy Adebayo drives, picks up Terry Doncic. Help arrives from Ben Hyland! Tracy Adebayo attempts a Dunk. Wide open! Ben Hyland is 6.9 feet away. [ZONE] TRACY ADEBAYO MAKES IT! Assist: Larry Bridges
Score: 46-32

[03:46] Team_034 possession (Score: 46-32)
Cole Antetokounmpo attempts a Layup. Wide open! Tracy Adebayo is 9.6 feet away. [ZONE] Cole Antetokounmpo misses. Offensive rebound by Anthony Bane! Anthony Bane kicks it out.

[03:32] Team_034 possession (Score: 46-32)
Anthony Bane drives to the basket... Anthony Bane throws a bad pass! Stolen by Gary Brogdon! TURNOVER! (live ball)

[03:17] Team_090 possession (Score: 46-32)
Larry Bridges drives, Ben Hyland stays with him. Larry Bridges attempts a Dunk. Contested by Ben Hyland (4.5 feet, MAN). LARRY BRIDGES MAKES IT! Assist: Tracy Adebayo
Score: 46-34

[03:03] Team_034 possession (Score: 46-34)
Terry Doncic attempts a Layup. Wide open! Gary Brogdon is 7.4 feet away. [ZONE] Terry Doncic misses. Offensive rebound by Terry Doncic! Terry Doncic kicks it out.

[02:53] Team_034 possession (Score: 46-34)
Ben Hyland attempts a Layup. Contested by Gary Brogdon (4.5 feet, ZONE). Ben Hyland misses. Rebound secured by Zach Wall.

[02:42] Team_090 possession (Score: 46-34)
Tracy Adebayo drives, Anthony Bane stays with him. Tracy Adebayo attempts a Dunk. Wide open! Anthony Bane is 6.0 feet away. [ZONE] Tracy Adebayo misses. Rebound secured by Terry Doncic.

[02:27] Team_034 possession (Score: 46-34)
Ben Hyland attempts a 3Pt. Wide open! Larry Bridges is 6.8 feet away. [MAN] BEN HYLAND MAKES IT! Assist: Cole Antetokounmpo
Score: 49-34

[02:10] Team_090 possession (Score: 49-34)
Tracy Adebayo attempts a Midrange. Contested by Cole Antetokounmpo (3.0 feet, ZONE). TRACY ADEBAYO MAKES IT! Assist: Zach Wall
Score: 49-36

[01:51] Team_034 possession (Score: 49-36)
Devin Poole attempts a Midrange. Contested by Derrick Mitchell (5.6 feet, MAN). DEVIN POOLE MAKES IT! Assist: Ben Hyland
Score: 51-36

[01:35] Team_090 possession (Score: 51-36)
Zach Wall attempts a Layup. Contested by Terry Doncic (5.0 feet, ZONE). ZACH WALL MAKES IT! Assist: Gary Brogdon
Score: 51-38

[01:22] Team_034 possession (Score: 51-38)
FOUL! Reach-in foul on Gary Brogdon during the drive. [IN THE BONUS! 6 team fouls] Cole Antetokounmpo to the line for 2 free throws. (Gary Brogdon: 4 personal fouls)   FT 1/2: GOOD   FT 2/2: GOOD Cole Antetokounmpo makes 2/2 from the line.
Score: 53-38

[01:12] Team_090 possession (Score: 53-38)
Zach Wall attempts a Layup. BLOCKED BY BEN HYLAND! Ball is loose! Rebound secured by Terry Doncic.

[00:55] Team_034 possession (Score: 53-38)
Anthony Bane attempts a 3Pt. Wide open! Tracy Adebayo is 10.0 feet away. [MAN] ANTHONY BANE MAKES IT! Assist: Devin Poole
Score: 56-38

[00:43] Team_090 possession (Score: 56-38)
Derrick Mitchell attempts a 3Pt. Contested by Devin Poole (2.8 feet, MAN). DERRICK MITCHELL MAKES IT! Assist: Zach Wall
Score: 56-41

[00:32] Team_034 possession (Score: 56-41)
Devin Poole attempts a 3Pt. Wide open! Zach Wall is 7.0 feet away. [ZONE] Devin Poole misses. Rebound secured by Zach Wall.

[00:19] Team_090 possession (Score: 56-41)
Gary Brogdon drives, Terry Doncic stays with him. Gary Brogdon attempts a Layup. Wide open! Terry Doncic is 7.6 feet away. [MAN] GARY BROGDON MAKES IT! Assist: Zach Wall
Score: 56-43

[00:09] Team_034 possession (Score: 56-43)
Terry Doncic attempts a Midrange. Wide open! Gary Brogdon is 7.6 feet away. [MAN] Terry Doncic misses. Rebound secured by Zach Wall.

================================================================================
                              2ND QUARTER COMPLETE                              
================================================================================

2ND QUARTER SCORE: Team_034 28, Team_090 23

BOX SCORE:
================================================================================

Team_034
--------------------------------------------------------------------------------
Player                MIN  PTS  REB  AST  TO      FG   FG%      3P   3P%
--------------------------------------------------------------------------------
Anthony Bane           24   10    5    0   0   4/4   100.0     0/0   0.0
Devin Poole            24    7    0    1   0   3/6    50.0     0/0   0.0
Ben Hyland             24    5    0    1   0   2/4    50.0     0/0   0.0
Cole Antetokounmpo     24    4    1    1   0   2/3    66.7     0/0   0.0
Terry Doncic           24    0    9    4   0   0/4     0.0     0/0   0.0

TEAM: FG: 11/21 (52.4%), 3PT: 3/7 (42.9%), REB: 15 (4 off, 11 def), AST: 7, TO: 2
TEAM FOULS: 2


Team_090
--------------------------------------------------------------------------------
Player                MIN  PTS  REB  AST  TO      FG   FG%      3P   3P%
--------------------------------------------------------------------------------
Larry Bridges          24    7    0    1   0   3/4    75.0     0/0   0.0
Tracy Adebayo          24    6    3    2   0   3/6    50.0     0/0   0.0
Zach Wall              24    5    5    4   0   2/5    40.0     0/0   0.0
Derrick Mitchell       24    3    0    0   0   1/4    25.0     0/0   0.0
Gary Brogdon           24    2    3    2   0   1/2    50.0     0/0   0.0

TEAM: FG: 10/21 (47.6%), 3PT: 2/5 (40.0%), REB: 11 (1 off, 10 def), AST: 9, TO: 1
TEAM FOULS: 6 [Team_034 in BONUS]

================================================================================

================================================================================
                       3RD QUARTER - Team_034 vs Team_090                       
================================================================================

[12:00] Team_034 possession (Score: 56-43)
Terry Doncic attempts a 3Pt. Contested by Gary Brogdon (3.5 feet, MAN). Terry Doncic misses. Rebound secured by Tracy Adebayo.

[11:46] Team_090 possession (Score: 56-43)
Gary Brogdon attempts a Layup. BLOCKED BY TERRY DONCIC! Ball is loose! Rebound secured by Anthony Bane.

[11:29] Team_034 possession (Score: 56-43)
Anthony Bane drives to the basket... Anthony Bane loses the ball! Stripped by Tracy Adebayo! TURNOVER! (live ball)

[11:17] Team_090 possession (Score: 56-43)
Larry Bridges drives, Ben Hyland stays with him. Larry Bridges attempts a Layup. Contested by Ben Hyland (2.5 feet, MAN). LARRY BRIDGES MAKES IT! Assist: Zach Wall
Score: 56-45

[11:00] Team_034 possession (Score: 56-45)
Ben Hyland makes the Layup and draws the foul on Larry Bridges! And-1! Ben Hyland to the line for 1. [Team fouls: 1] (Larry Bridges: 1 personal fouls)   FT 1/1: GOOD Ben Hyland makes 1/1 from the line.
Score: 59-45

[10:47] Team_090 possession (Score: 59-45)
Zach Wall drives and kicks out. Derrick Mitchell attempts a Midrange. Contested by Devin Poole (5.4 feet, MAN). Derrick Mitchell misses. Rebound secured by Terry Doncic.

[10:33] Team_034 possession (Score: 59-45)
Cole Antetokounmpo attempts a 3Pt. Contested by Derrick Mitchell (3.9 feet, ZONE). COLE ANTETOKOUNMPO MAKES IT! Assist: Devin Poole
Score: 62-45

[10:20] Team_090 possession (Score: 62-45)
FOUL! Shooting foul on Terry Doncic. Gary Brogdon to the line for 2 free throws. [Team fouls: 1] (Terry Doncic: 1 personal fouls)   FT 1/2: GOOD   FT 2/2: GOOD Gary Brogdon makes 2/2 from the line.
Score: 62-47

[10:07] Team_034 possession (Score: 62-47)
Ben Hyland attempts a 3Pt. Wide open! Larry Bridges is 6.0 feet away. [MAN] Ben Hyland misses. Rebound secured by Zach Wall.

[09:51] Team_090 possession (Score: 62-47)
Derrick Mitchell attempts a Midrange. Wide open! Devin Poole is 6.1 feet away. [MAN] Derrick Mitchell misses. Rebound secured by Terry Doncic.

[09:36] Team_034 possession (Score: 62-47)
Ben Hyland attempts a Layup. Contested by Larry Bridges (3.6 feet, MAN). BEN HYLAND MAKES IT! Assist: Anthony Bane
Score: 64-47

[09:23] Team_090 possession (Score: 64-47)
Tracy Adebayo attempts a Midrange. Contested by Anthony Bane (4.6 feet, MAN). Tracy Adebayo misses. Rebound secured by Anthony Bane.

[09:11] Team_034 possession (Score: 64-47)
Cole Antetokounmpo drives to the basket... Cole Antetokounmpo throws a bad pass! Stolen by Zach Wall! TURNOVER! (live ball)

[08:54] Team_090 possession (Score: 64-47)
Gary Brogdon drives to the basket... Gary Brogdon throws a bad pass! Stolen by Terry Doncic! TURNOVER! (live ball)

[08:41] Team_034 possession (Score: 64-47)
Anthony Bane attempts a Layup. Contested by Gary Brogdon (5.6 feet, ZONE). ANTHONY BANE MAKES IT! Assist: Cole Antetokounmpo
Score: 66-47

[08:25] Team_090 possession (Score: 66-47)
Larry Bridges makes the Layup and draws the foul on Cole Antetokounmpo! And-1! Larry Bridges to the line for 1. [Team fouls: 2] (Cole Antetokounmpo: 1 personal fouls)   FT 1/1: GOOD Larry Bridges makes 1/1 from the line.
Score: 66-50

[08:14] Team_034 possession (Score: 66-50)
Ben Hyland makes the Dunk and draws the foul on Zach Wall! And-1! Ben Hyland to the line for 1. [Team fouls: 2] (Zach Wall: 1 personal fouls)   FT 1/1: MISS Ben Hyland makes 0/1 from the line. Rebound secured by Zach Wall.
Score: 68-50

[08:03] Team_090 possession (Score: 68-50)
Larry Bridges attempts a 3Pt. Heavily contested by Ben Hyland (1.6 feet, MAN)! Larry Bridges misses. Offensive rebound by Tracy Adebayo! Tracy Adebayo kicks it out.

[07:46] Team_090 possession (Score: 68-50)
Gary Brogdon attempts a Midrange. Contested by Terry Doncic (2.4 feet, ZONE). Gary Brogdon misses. Offensive rebound by Tracy Adebayo! Tracy Adebayo kicks it out.

[07:30] Team_090 possession (Score: 68-50)
Derrick Mitchell attempts a 3Pt. Contested by Devin Poole (3.9 feet, MAN). Derrick Mitchell misses. Rebound secured by Cole Antetokounmpo.

[07:16] Team_034 possession (Score: 68-50)
Anthony Bane attempts a Midrange. Wide open! Tracy Adebayo is 6.4 feet away. [MAN] Anthony Bane misses. Offensive rebound by Terry Doncic! Terry Doncic's putback is no good. Rebound secured by Zach Wall.

[07:02] Team_090 possession (Score: 68-50)
Tracy Adebayo attempts a Layup. Wide open! Terry Doncic is 6.8 feet away. [ZONE] Tracy Adebayo misses. Rebound secured by Terry Doncic.

[06:50] Team_034 possession (Score: 68-50)
Anthony Bane attempts a Midrange. Wide open! Tracy Adebayo is 9.8 feet away. [MAN] ANTHONY BANE MAKES IT! Assist: Cole Antetokounmpo
Score: 70-50

[06:33] Team_090 possession (Score: 70-50)
FOUL! Offensive foul on Gary Brogdon! Terry Doncic drew the charge! [Team fouls: 3] (Gary Brogdon: 1 personal fouls) TURNOVER! (dead ball)

[06:20] Team_034 possession (Score: 70-50)
Terry Doncic loses control! Ball rolls out of bounds! TURNOVER! (dead ball)

[06:06] Team_090 possession (Score: 70-50)
Larry Bridges attempts a 3Pt. Contested by Terry Doncic (5.0 feet, ZONE). Larry Bridges misses. Rebound secured by Anthony Bane.

[05:55] Team_034 possession (Score: 70-50)
Anthony Bane attempts a Layup. Contested by Tracy Adebayo (3.4 feet, MAN). ANTHONY BANE MAKES IT!
Score: 72-50

[05:43] Team_090 possession (Score: 72-50)
Derrick Mitchell makes the Layup and draws the foul on Devin Poole! And-1! Derrick Mitchell to the line for 1. [Team fouls: 3] (Devin Poole: 1 personal fouls)   FT 1/1: MISS Derrick Mitchell makes 0/1 from the line. Offensive rebound by Gary Brogdon! Gary Brogdon kicks it out.
Score: 72-52

[05:25] Team_090 possession (Score: 72-52)
FOUL! Shooting foul on Devin Poole. Zach Wall to the line for 3 free throws. [Team fouls: 4] (Devin Poole: 2 personal fouls)   FT 1/3: GOOD   FT 2/3: GOOD   FT 3/3: MISS Zach Wall makes 2/3 from the line. Rebound secured by Terry Doncic.
Score: 72-54

[05:11] Team_034 possession (Score: 72-54)
Ben Hyland attempts a 3Pt. Contested by Zach Wall (4.7 feet, ZONE). Ben Hyland misses. Rebound secured by Zach Wall.

[04:59] Team_090 possession (Score: 72-54)
Tracy Adebayo drives to the basket... Tracy Adebayo commits a violation (traveling/carry)! TURNOVER! (dead ball)

[04:44] Team_034 possession (Score: 72-54)
FOUL! Shooting foul on Derrick Mitchell. Devin Poole to the line for 3 free throws. [Team fouls: 4] (Derrick Mitchell: 1 personal fouls)   FT 1/3: MISS   FT 2/3: GOOD   FT 3/3: GOOD Devin Poole makes 2/3 from the line.
Score: 74-54

[04:28] Team_090 possession (Score: 74-54)
Zach Wall makes the Dunk and draws the foul on Cole Antetokounmpo! And-1! Zach Wall to the line for 1. [BONUS: 5 team fouls] (Cole Antetokounmpo: 2 personal fouls)   FT 1/1: MISS Zach Wall makes 0/1 from the line. Offensive rebound by Zach Wall! Zach Wall kicks it out.
Score: 74-56

[04:15] Team_090 possession (Score: 74-56)
Tracy Adebayo attempts a 3Pt. Contested by Terry Doncic (2.1 feet, ZONE). Tracy Adebayo misses. Rebound secured by Terry Doncic.

[03:58] Team_034 possession (Score: 74-56)
Anthony Bane drives to the basket... Anthony Bane loses the ball! Stripped by Gary Brogdon! TURNOVER! (live ball)

[03:39] Team_090 possession (Score: 74-56)
Derrick Mitchell attempts a Midrange. Contested by Devin Poole (5.7 feet, MAN). Derrick Mitchell misses. Rebound secured by Cole Antetokounmpo.

[03:28] Team_034 possession (Score: 74-56)
Cole Antetokounmpo attempts a 3Pt. Wide open! Zach Wall is 8.2 feet away. [MAN] COLE ANTETOKOUNMPO MAKES IT! Assist: Anthony Bane
Score: 77-56

[03:15] Team_090 possession (Score: 77-56)
Tracy Adebayo attempts a Layup. Contested by Anthony Bane (5.8 feet, MAN). Tracy Adebayo misses. FOUL! Loose ball foul on Terry Doncic during the rebound battle. [IN THE BONUS! 6 team fouls] Tracy Adebayo to the line for 2 free throws. (Terry Doncic: 2 personal fouls)   FT 1/2: GOOD   FT 2/2: GOOD Tracy Adebayo makes 2/2 from the line.
Score: 77-58

[02:58] Team_034 possession (Score: 77-58)
Ben Hyland attempts a 3Pt. Contested by Larry Bridges (5.7 feet, MAN). Ben Hyland misses. Rebound secured by Tracy Adebayo.

[02:41] Team_090 possession (Score: 77-58)
Derrick Mitchell attempts a 3Pt. Wide open! Devin Poole is 7.3 feet away. [MAN] Derrick Mitchell misses. Rebound secured by Cole Antetokounmpo.

[02:28] Team_034 possession (Score: 77-58)
Devin Poole throws a bad pass! Stolen by Derrick Mitchell! TURNOVER! (live ball)

[02:09] Team_090 possession (Score: 77-58)
Tracy Adebayo drives, Terry Doncic stays with him. Tracy Adebayo attempts a Layup. Wide open! Terry Doncic is 6.9 feet away. [ZONE] Tracy Adebayo misses. Rebound secured by Terry Doncic.

[01:54] Team_034 possession (Score: 77-58)
Cole Antetokounmpo drives to the basket... FOUL! Offensive foul on Cole Antetokounmpo! Zach Wall drew the charge! [Team fouls: 7] (Cole Antetokounmpo: 3 personal fouls) TURNOVER! (dead ball)

[01:42] Team_090 possession (Score: 77-58)
Zach Wall attempts a 3Pt. Contested by Cole Antetokounmpo (2.2 feet, MAN). Zach Wall misses. Offensive rebound by Zach Wall! Zach Wall kicks it out.

[01:29] Team_090 possession (Score: 77-58)
FOUL! Shooting foul on Terry Doncic. Larry Bridges to the line for 2 free throws. [BONUS: 8 team fouls] (Terry Doncic: 3 personal fouls)   FT 1/2: GOOD   FT 2/2: MISS Larry Bridges makes 1/2 from the line. Rebound secured by Cole Antetokounmpo.
Score: 77-59

[01:17] Team_034 possession (Score: 77-59)
Ben Hyland attempts a 3Pt. Wide open! Larry Bridges is 6.4 feet away. [ZONE] Ben Hyland misses. Rebound secured by Gary Brogdon.

[01:04] Team_090 possession (Score: 77-59)
Derrick Mitchell attempts a Midrange. Contested by Devin Poole (6.0 feet, MAN). DERRICK MITCHELL MAKES IT! Assist: Gary Brogdon
Score: 77-61

[00:52] Team_034 possession (Score: 77-61)
Anthony Bane drives, picks up Tracy Adebayo. Help arrives from Larry Bridges! Anthony Bane attempts a Dunk. Contested by Larry Bridges (5.6 feet, MAN). Anthony Bane misses. Rebound secured by Zach Wall.

[00:37] Team_090 possession (Score: 77-61)
Tracy Adebayo commits a violation (traveling/carry)! TURNOVER! (dead ball)

[00:37] Substitution (Team_034): Devin Poole OUT → Manu Jokic IN (stamina_rule2)

[00:37] Substitution (Team_034): Ben Hyland OUT → Damian Turner IN (stamina_rule2)

[00:37] Substitution (Team_034): Cole Antetokounmpo OUT → Vince Paul IN (stamina_rule2)

[00:37] Substitution (Team_034): Terry Doncic OUT → Nikola Wagner IN (stamina_rule2)

[00:37] Substitution (Team_034): Anthony Bane OUT → Carmelo Anunoby IN (stamina_rule2)

[00:37] Substitution (Team_090): Derrick Mitchell OUT → OG Anunoby IN (stamina_rule2)

[00:37] Substitution (Team_090): Larry Bridges OUT → Josh Wall IN (stamina_rule2)

[00:37] Substitution (Team_090): Zach Wall OUT → Russell Smith IN (stamina_rule2)

[00:37] Substitution (Team_090): Gary Brogdon OUT → Derrick Nowitzki IN (stamina_rule2)

[00:37] Substitution (Team_090): Tracy Adebayo OUT → Tobias Tatum IN (stamina_rule2)

[00:25] Team_034 possession (Score: 77-61)
FOUL! Holding foul on Derrick Nowitzki. [IN THE BONUS! 5 team fouls] Nikola Wagner to the line for 2 free throws. (Derrick Nowitzki: 1 personal fouls)   FT 1/2: GOOD   FT 2/2: GOOD Nikola Wagner makes 2/2 from the line.
Score: 79-61

[00:12] Team_090 possession (Score: 79-61)
OG Anunoby attempts a Midrange. Contested by Vince Paul (3.3 feet, ZONE). OG ANUNOBY MAKES IT!
Score: 79-63

================================================================================
                              3RD QUARTER COMPLETE                              
================================================================================

3RD QUARTER SCORE: Team_034 23, Team_090 20

BOX SCORE:
================================================================================

Team_034
--------------------------------------------------------------------------------
Player                MIN  PTS  REB  AST  TO      FG   FG%      3P   3P%
--------------------------------------------------------------------------------
Anthony Bane           36    6    3    2   0   3/5    60.0     0/0   0.0
Cole Antetokounmpo     36    6    4    2   0   2/2   100.0     0/0   0.0
Ben Hyland             36    5    0    0   0   2/7    28.6     0/0   0.0
Devin Poole            36    2    0    1   0   1/1   100.0     0/0   0.0
Nikola Wagner           0    2    0    0   0   1/1   100.0     0/0   0.0
Terry Doncic           36    0    6    0   0   0/1     0.0     0/0   0.0

TEAM: FG: 9/17 (52.9%), 3PT: 3/8 (37.5%), REB: 14 (1 off, 13 def), AST: 5, TO: 6
TEAM FOULS: 8 [Team_090 in BONUS]


Team_090
--------------------------------------------------------------------------------
Player                MIN  PTS  REB  AST  TO      FG   FG%      3P   3P%
--------------------------------------------------------------------------------
Larry Bridges          36    5    0    0   0   2/4    50.0     0/0   0.0
Tracy Adebayo          36    2    4    0   0   1/5    20.0     0/0   0.0
Gary Brogdon           36    2    2    1   0   1/2    50.0     0/0   0.0
Derrick Mitchell       36    2    0    0   0   1/5    20.0     0/0   0.0
OG Anunoby              0    2    0    0   0   1/1   100.0     0/0   0.0
Zach Wall              36    0    7    1   0   0/2     0.0     0/0   0.0

TEAM: FG: 6/19 (31.6%), 3PT: 0/5 (0.0%), REB: 12 (5 off, 7 def), AST: 2, TO: 4
TEAM FOULS: 5 [Team_034 in BONUS]

================================================================================

================================================================================
                       4TH QUARTER - Team_034 vs Team_090                       
================================================================================

[12:00] Team_034 possession (Score: 79-63)
Terry Doncic attempts a 3Pt. Heavily contested by Derrick Mitchell (1.7 feet, ZONE)! Terry Doncic misses. Rebound secured by Tracy Adebayo.

[11:46] Team_090 possession (Score: 79-63)
Gary Brogdon drives to the basket... Gary Brogdon loses control! Ball rolls out of bounds! TURNOVER! (dead ball)

[11:46] Substitution (Team_034): Devin Poole OUT → Manu Jokic IN (stamina_rule2)

[11:46] Substitution (Team_034): Cole Antetokounmpo OUT → Vince Paul IN (stamina_rule2)

[11:46] Substitution (Team_034): Terry Doncic OUT → Nikola Wagner IN (stamina_rule2)

[11:46] Substitution (Team_034): Anthony Bane OUT → Carmelo Anunoby IN (stamina_rule2)

[11:46] Substitution (Team_090): Gary Brogdon OUT → Derrick Nowitzki IN (stamina_rule2)

[11:46] Substitution (Team_090): Tracy Adebayo OUT → Tobias Tatum IN (stamina_rule2)

[11:31] Team_034 possession (Score: 79-63)
Carmelo Anunoby attempts a Layup. BLOCKED BY DERRICK NOWITZKI! Ball is loose! Rebound secured by Tobias Tatum.

[11:21] Team_090 possession (Score: 79-63)
FOUL! Shooting foul on Ben Hyland. Derrick Nowitzki to the line for 2 free throws. [Team fouls: 1] (Ben Hyland: 1 personal fouls)   FT 1/2: GOOD   FT 2/2: GOOD Derrick Nowitzki makes 2/2 from the line.
Score: 79-65

[11:10] Team_034 possession (Score: 79-65)
FOUL! Shooting foul on Zach Wall. Vince Paul to the line for 2 free throws. [Team fouls: 1] (Zach Wall: 1 personal fouls)   FT 1/2: GOOD   FT 2/2: GOOD Vince Paul makes 2/2 from the line.
Score: 81-65

[10:52] Team_090 possession (Score: 81-65)
Tobias Tatum drives, picks up Carmelo Anunoby. Help arrives from Ben Hyland! Tobias Tatum attempts a Dunk. Wide open! Ben Hyland is 6.2 feet away. [MAN] TOBIAS TATUM MAKES IT! Assist: Zach Wall
Score: 81-67

[10:40] Team_034 possession (Score: 81-67)
Manu Jokic attempts a 3Pt. Heavily contested by Derrick Mitchell (0.8 feet, MAN)! Manu Jokic misses. Rebound secured by Derrick Nowitzki.

[10:22] Team_090 possession (Score: 81-67)
Tobias Tatum throws a bad pass out of bounds! TURNOVER! (dead ball)

[10:22] Substitution (Team_034): Ben Hyland OUT → Damian Turner IN (stamina_rule2)

[10:22] Substitution (Team_090): Derrick Mitchell OUT → OG Anunoby IN (stamina_rule2)

[10:22] Substitution (Team_090): Larry Bridges OUT → Josh Wall IN (stamina_rule2)

[10:22] Substitution (Team_090): Zach Wall OUT → Russell Smith IN (stamina_rule2)

[10:06] Team_034 possession (Score: 81-67)
Manu Jokic attempts a 3Pt. Contested by OG Anunoby (5.8 feet, MAN). Manu Jokic misses. Rebound secured by Russell Smith.

[09:50] Team_090 possession (Score: 81-67)
Tobias Tatum attempts a Layup. Wide open! Carmelo Anunoby is 6.4 feet away. [ZONE] TOBIAS TATUM MAKES IT!
Score: 81-69

[09:31] Team_034 possession (Score: 81-69)
Damian Turner attempts a 3Pt. Contested by Russell Smith (5.1 feet, ZONE). Damian Turner misses. Rebound secured by Tobias Tatum.

[09:12] Team_090 possession (Score: 81-69)
Derrick Nowitzki drives, picks up Nikola Wagner. Help arrives from Damian Turner! Derrick Nowitzki attempts a Layup. Contested by Damian Turner (5.4 feet, MAN). Derrick Nowitzki misses. Rebound secured by Carmelo Anunoby.

[08:58] Team_034 possession (Score: 81-69)
Vince Paul attempts a Midrange. Wide open! Russell Smith is 6.6 feet away. [MAN] VINCE PAUL MAKES IT!
Score: 83-69

[08:42] Team_090 possession (Score: 83-69)
Russell Smith attempts a Layup. Contested by Carmelo Anunoby (4.2 feet, ZONE). RUSSELL SMITH MAKES IT! Assist: OG Anunoby
Score: 83-71

[08:27] Team_034 possession (Score: 83-71)
Carmelo Anunoby drives and kicks out. Carmelo Anunoby attempts a Midrange. Contested by Tobias Tatum (4.7 feet, MAN). CARMELO ANUNOBY MAKES IT! Assist: Nikola Wagner
Score: 85-71

[08:12] Team_090 possession (Score: 85-71)
FOUL! Shooting foul on Manu Jokic. OG Anunoby to the line for 3 free throws. [Team fouls: 2] (Manu Jokic: 1 personal fouls)   FT 1/3: GOOD   FT 2/3: GOOD   FT 3/3: GOOD OG Anunoby makes 3/3 from the line.
Score: 85-74

[07:57] Team_034 possession (Score: 85-74)
Nikola Wagner attempts a Layup. Contested by Derrick Nowitzki (4.6 feet, ZONE). Nikola Wagner misses. Offensive rebound by Vince Paul! Vince Paul's putback is no good. Offensive rebound by Vince Paul! Vince Paul kicks it out.

[07:42] Team_034 possession (Score: 85-74)
Vince Paul attempts a 3Pt. Wide open! Russell Smith is 6.1 feet away. [MAN] Vince Paul misses. Rebound secured by Derrick Nowitzki.

[07:25] Team_090 possession (Score: 85-74)
FOUL! Reach-in foul on Carmelo Anunoby during the drive. [Team fouls: 3] No free throws, side out. (Carmelo Anunoby: 1 personal fouls)

[07:10] Team_090 possession (Score: 85-74)
Josh Wall drives, picks up Damian Turner. Help arrives from Vince Paul! Josh Wall attempts a Layup. Wide open! Vince Paul is 9.1 feet away. [MAN] Josh Wall misses. Rebound secured by Vince Paul.

[06:53] Team_034 possession (Score: 85-74)
Manu Jokic drives, Derrick Nowitzki stays with him. Manu Jokic attempts a Dunk. Wide open! Derrick Nowitzki is 6.2 feet away. [ZONE] MANU JOKIC MAKES IT! Assist: Damian Turner
Score: 87-74

[06:39] Team_090 possession (Score: 87-74)
OG Anunoby drives to the basket... FOUL! Offensive foul on OG Anunoby! Carmelo Anunoby drew the charge! [Team fouls: 2] (OG Anunoby: 1 personal fouls) TURNOVER! (dead ball)

[06:27] Team_034 possession (Score: 87-74)
FOUL! Shooting foul on OG Anunoby. Manu Jokic to the line for 3 free throws. [Team fouls: 3] (OG Anunoby: 2 personal fouls)   FT 1/3: MISS   FT 2/3: GOOD   FT 3/3: GOOD Manu Jokic makes 2/3 from the line.
Score: 89-74

[06:14] Team_090 possession (Score: 89-74)
FOUL! Shooting foul on Damian Turner. Tobias Tatum to the line for 2 free throws. [Team fouls: 4] (Damian Turner: 1 personal fouls)   FT 1/2: GOOD   FT 2/2: GOOD Tobias Tatum makes 2/2 from the line.
Score: 89-76

[06:02] Team_034 possession (Score: 89-76)
Vince Paul attempts a 3Pt. Contested by Russell Smith (2.3 feet, ZONE). VINCE PAUL MAKES IT! Assist: Damian Turner
Score: 92-76

[05:47] Team_090 possession (Score: 92-76)
Russell Smith drives to the basket... Russell Smith loses control! Ball rolls out of bounds! TURNOVER! (dead ball)

[05:34] Team_034 possession (Score: 92-76)
Manu Jokic attempts a 3Pt. Contested by OG Anunoby (4.4 feet, MAN). MANU JOKIC MAKES IT! Assist: Vince Paul
Score: 95-76

[05:18] Team_090 possession (Score: 95-76)
Russell Smith drives to the basket... Russell Smith throws a bad pass out of bounds! TURNOVER! (dead ball)

[05:02] Team_034 possession (Score: 95-76)
Damian Turner attempts a 3Pt. Contested by Russell Smith (4.1 feet, ZONE). Damian Turner misses. Rebound secured by Derrick Nowitzki.

[04:49] Team_090 possession (Score: 95-76)
Derrick Nowitzki makes the Layup and draws the foul on Nikola Wagner! And-1! Derrick Nowitzki to the line for 1. [BONUS: 5 team fouls] (Nikola Wagner: 1 personal fouls)   FT 1/1: GOOD Derrick Nowitzki makes 1/1 from the line.
Score: 95-79

[04:36] Team_034 possession (Score: 95-79)
Nikola Wagner makes the Layup and draws the foul on Derrick Nowitzki! And-1! Nikola Wagner to the line for 1. [Team fouls: 4] (Derrick Nowitzki: 1 personal fouls)   FT 1/1: GOOD Nikola Wagner makes 1/1 from the line.
Score: 98-79

[04:20] Team_090 possession (Score: 98-79)
Derrick Nowitzki attempts a 3Pt. Contested by Nikola Wagner (5.9 feet, MAN). Derrick Nowitzki misses. Rebound secured by Nikola Wagner.

[04:08] Team_034 possession (Score: 98-79)
Damian Turner drives, Derrick Nowitzki stays with him. Damian Turner attempts a Layup. Contested by Derrick Nowitzki (5.5 feet, ZONE). DAMIAN TURNER MAKES IT! Assist: Vince Paul
Score: 100-79

[03:54] Team_090 possession (Score: 100-79)
OG Anunoby attempts a Midrange. Contested by Manu Jokic (4.1 feet, MAN). OG ANUNOBY MAKES IT! Assist: Russell Smith
Score: 100-81

[03:41] Team_034 possession (Score: 100-81)
Vince Paul attempts a Midrange. Wide open! Russell Smith is 8.0 feet away. [MAN] VINCE PAUL MAKES IT! Assist: Manu Jokic
Score: 102-81

[03:25] Team_090 possession (Score: 102-81)
OG Anunoby makes the 3Pt and draws the foul on Manu Jokic! And-1! OG Anunoby to the line for 1. [BONUS: 6 team fouls] (Manu Jokic: 2 personal fouls)   FT 1/1: GOOD OG Anunoby makes 1/1 from the line.
Score: 102-85

[03:09] Team_034 possession (Score: 102-85)
Nikola Wagner makes the Midrange and draws the foul on Josh Wall! And-1! Nikola Wagner to the line for 1. [BONUS: 5 team fouls] (Josh Wall: 1 personal fouls)   FT 1/1: GOOD Nikola Wagner makes 1/1 from the line.
Score: 105-85

[02:58] Team_090 possession (Score: 105-85)
FOUL! Reach-in foul on Carmelo Anunoby during the drive. [IN THE BONUS! 7 team fouls] Tobias Tatum to the line for 2 free throws. (Carmelo Anunoby: 2 personal fouls)   FT 1/2: MISS   FT 2/2: MISS Tobias Tatum makes 0/2 from the line. Offensive rebound by Tobias Tatum! Tobias Tatum kicks it out.

[02:43] Team_090 possession (Score: 105-85)
Tobias Tatum drives, Carmelo Anunoby stays with him. Tobias Tatum attempts a Layup. Wide open! Carmelo Anunoby is 6.9 feet away. [MAN] TOBIAS TATUM MAKES IT! Assist: Derrick Nowitzki
Score: 105-87

[02:30] Team_034 possession (Score: 105-87)
Vince Paul attempts a Layup. Contested by Derrick Nowitzki (3.5 feet, ZONE). VINCE PAUL MAKES IT! Assist: Nikola Wagner
Score: 107-87

[02:15] Team_090 possession (Score: 107-87)
Russell Smith attempts a 3Pt. Contested by Vince Paul (5.3 feet, ZONE). Russell Smith misses. Rebound secured by Carmelo Anunoby.

[02:02] Team_034 possession (Score: 107-87)
Carmelo Anunoby drives and kicks out. Carmelo Anunoby attempts a Midrange. Contested by Russell Smith (4.1 feet, ZONE). CARMELO ANUNOBY MAKES IT!
Score: 109-87

[01:47] Team_090 possession (Score: 109-87)
Derrick Nowitzki drives and kicks out. Derrick Nowitzki attempts a Midrange. Contested by Nikola Wagner (3.4 feet, MAN). DERRICK NOWITZKI MAKES IT!
Score: 109-89

[01:34] Team_034 possession (Score: 109-89)
Damian Turner attempts a Midrange. Contested by Josh Wall (5.5 feet, ZONE). DAMIAN TURNER MAKES IT! Assist: Carmelo Anunoby
Score: 111-89

[01:16] Team_090 possession (Score: 111-89)
FOUL! Shooting foul on Vince Paul. Russell Smith to the line for 3 free throws. [BONUS: 8 team fouls] (Vince Paul: 1 personal fouls)   FT 1/3: GOOD   FT 2/3: GOOD   FT 3/3: GOOD Russell Smith makes 3/3 from the line.
Score: 111-92

[01:01] Team_034 possession (Score: 111-92)
Manu Jokic drives to the basket... Manu Jokic loses the ball! Stripped by Derrick Nowitzki! TURNOVER! (live ball)

[00:42] Team_090 possession (Score: 111-92)
OG Anunoby attempts a Midrange. Contested by Manu Jokic (4.5 feet, MAN). OG ANUNOBY MAKES IT! Assist: Josh Wall
Score: 111-94

[00:29] Team_034 possession (Score: 111-94)
Vince Paul attempts a 3Pt. Contested by Russell Smith (4.4 feet, ZONE). Vince Paul misses. Offensive rebound by Carmelo Anunoby! Carmelo Anunoby kicks it out.

[00:19] Team_034 possession (Score: 111-94)
Vince Paul makes the Layup and draws the foul on Derrick Nowitzki! And-1! Vince Paul to the line for 1. [BONUS: 6 team fouls] (Derrick Nowitzki: 2 personal fouls)   FT 1/1: MISS Vince Paul makes 0/1 from the line. Rebound secured by Tobias Tatum.
Score: 113-94

[00:01] Team_090 possession (Score: 113-94)
Russell Smith attempts a 3Pt. Contested by Vince Paul (6.0 feet, MAN). Russell Smith misses. Rebound secured by Vince Paul.

================================================================================
                              4TH QUARTER COMPLETE                              
================================================================================

4TH QUARTER SCORE: Team_034 34, Team_090 31

BOX SCORE:
================================================================================

Team_034
--------------------------------------------------------------------------------
Player                MIN  PTS  REB  AST  TO      FG   FG%      3P   3P%
--------------------------------------------------------------------------------
Vince Paul             12   11    3    2   0   5/7    71.4     0/0   0.0
Manu Jokic             12    7    0    1   0   3/5    60.0     0/0   0.0
Nikola Wagner          12    6    1    2   0   2/2   100.0     0/0   0.0
Carmelo Anunoby        12    4    3    1   0   2/3    66.7     0/0   0.0
Damian Turner          11    4    0    2   0   2/4    50.0     0/0   0.0
Terry Doncic           36    0    0    0   0   0/1     0.0     0/0   0.0

TEAM: FG: 14/22 (63.6%), 3PT: 3/9 (33.3%), REB: 7 (2 off, 5 def), AST: 8, TO: 1
TEAM FOULS: 8 [Team_090 in BONUS]


Team_090
--------------------------------------------------------------------------------
Player                MIN  PTS  REB  AST  TO      FG   FG%      3P   3P%
--------------------------------------------------------------------------------
OG Anunoby             11   11    0    1   0   4/4   100.0     0/0   0.0
Tobias Tatum           12    8    4    0   0   4/4   100.0     0/0   0.0
Derrick Nowitzki       12    7    3    1   0   3/5    60.0     0/0   0.0
Russell Smith          11    5    1    1   0   2/4    50.0     0/0   0.0
Tracy Adebayo          36    0    1    0   0   0/0     0.0     0/0   0.0
Zach Wall              38    0    0    1   0   0/0     0.0     0/0   0.0
Josh Wall              11    0    0    1   0   0/1     0.0     0/0   0.0

TEAM: FG: 13/18 (72.2%), 3PT: 3/6 (50.0%), REB: 9 (1 off, 8 def), AST: 5, TO: 5
TEAM FOULS: 6 [Team_034 in BONUS]

================================================================================

================================================================================
                               FULL GAME COMPLETE                               
================================================================================

FINAL SCORE: Team_034 113, Team_090 94

SCORING BY QUARTER:
--------------------------------------------------------------------------------
Team                     Q1     Q2     Q3     Q4    FINAL
--------------------------------------------------------------------------------
Team_034                 28     28     23     34      113
Team_090                 20     23     20     31       94
--------------------------------------------------------------------------------

FULL GAME BOX SCORE:
================================================================================

Team_034
--------------------------------------------------------------------------------
Player                MIN  PTS  REB  AST  TO      FG   FG%      3P   3P%      FT STL BLK
--------------------------------------------------------------------------------
Ben Hyland             38   18    0    2   0   7/15   46.7   3/7    42.9   4/5     0   1
Devin Poole            36    9    0    4   4   5/9    55.6   2/5    40.0   2/3     1   0
Cole Antetokounmpo     36   16    8    4   3   6/9    66.7   4/6    66.7   2/2     0   0
Terry Doncic           36   12   25    5   2   5/12   41.7   1/3    33.3   2/3     1   4
Anthony Bane           36   18    8    2   1   8/12   66.7   1/1   100.0   1/1     0   0
Manu Jokic             12    7    0    1   0   3/5    60.0   2/4    50.0   2/3     0   0
Vince Paul             12   11    3    2   0   5/7    71.4   1/2    50.0   2/3     0   0
Nikola Wagner          12    8    1    2   0   2/2   100.0   0/0     0.0   4/4     0   0
Carmelo Anunoby        12    4    3    1   0   2/3    66.7   0/0     0.0   0/0     0   0
Damian Turner          11    4    0    2   1   2/4    50.0   0/2     0.0   0/0     0   0

TEAM: FG: 46/79 (58.2%), 3PT: 14/30 (46.7%), REB: 49 (11 off, 38 def), AST: 25, TO: 11


Team_090
--------------------------------------------------------------------------------
Player                MIN  PTS  REB  AST  TO      FG   FG%      3P   3P%      FT STL BLK
--------------------------------------------------------------------------------
Derrick Mitchell       38    5    0    2   1   2/10   20.0   1/4    25.0   0/1     1   0
Larry Bridges          38   18    0    3   3   8/12   66.7   3/4    75.0   2/3     0   0
Zach Wall              38    7   16    8   0   3/10   30.0   0/5     0.0   3/5     1   0
Gary Brogdon           36   14    8    3   3   6/12   50.0   1/3    33.3   5/5     2   0
Tracy Adebayo          36   10   14    2   2   4/12   33.3   0/1     0.0   2/2     1   0
Derrick Nowitzki       12    7    3    1   1   3/5    60.0   0/1     0.0   3/3     1   1
Tobias Tatum           12    8    4    0   1   4/4   100.0   0/0     0.0   2/4     0   0
OG Anunoby             11   13    0    1   0   5/5   100.0   2/2   100.0   4/4     0   0
Josh Wall              11    0    0    1   1   0/1     0.0   0/0     0.0   0/0     0   0
Russell Smith          11    5    1    1   1   2/4    50.0   1/3    33.3   3/3     0   0

TEAM: FG: 37/75 (49.3%), 3PT: 8/23 (34.8%), REB: 45 (13 off, 32 def), AST: 22, TO: 13

================================================================================
