================================================================================
                        FULL GAME - Team_056 vs Team_009                        
================================================================================

================================================================================
                       1ST QUARTER - Team_056 vs Team_009                       
================================================================================

[12:00] Team_056 possession (Score: 0-0)
Yao Poole makes the Layup and draws the foul on Kyle Brogdon! And-1! Yao Poole to the line for 1. [Team fouls: 1] (Kyle Brogdon: 1 personal fouls)   FT 1/1: MISS Yao Poole makes 0/1 from the line. Rebound secured by Cole Mitchell.
Score: 2-0

[11:41] Team_009 possession (Score: 2-0)
Desmond Harden attempts a 3Pt. Contested by Giannis Jokic (5.6 feet, ZONE). Desmond Harden misses. Rebound secured by Jrue Lillard.

[11:21] Team_056 possession (Score: 2-0)
Giannis Jokic throws a bad pass! Stolen by Miles Sabonis! TURNOVER! (live ball)

[11:05] Team_009 possession (Score: 2-0)
Kyle Brogdon drives, picks up Yao Poole. Help arrives from Giannis Jokic! Kyle Brogdon attempts a Dunk. Contested by Giannis Jokic (2.8 feet, MAN). Kyle Brogdon misses. Rebound secured by Tony Carter.

[10:56] Team_056 possession (Score: 2-0)
Giannis Jokic attempts a 3Pt. Wide open! Miles Sabonis is 6.0 feet away. [MAN] GIANNIS JOKIC MAKES IT! Assist: Tony Carter
Score: 5-0

[10:39] Team_009 possession (Score: 5-0)
Cole Mitchell attempts a Layup. BLOCKED BY JRUE LILLARD! Ball deflects out of bounds off Cole Mitchell.

[10:27] Team_056 possession (Score: 5-0)
Yao Poole attempts a Midrange. Contested by Kyle Brogdon (3.4 feet, MAN). Yao Poole misses. FOUL! Loose ball foul on Kyle Brogdon during the rebound battle. [Team fouls: 2] No free throws, side out. (Kyle Brogdon: 2 personal fouls)

[10:14] Team_056 possession (Score: 5-0)
Magic Russell attempts a 3Pt. Contested by Miles Sabonis (4.9 feet, ZONE). Magic Russell misses. Rebound secured by Cole Mitchell.

[10:01] Team_009 possession (Score: 5-0)
Cole Mitchell attempts a Layup. Heavily contested by Jrue Lillard (0.5 feet, MAN)! Cole Mitchell misses. FOUL! Loose ball foul on Tony Carter during the rebound battle. [Team fouls: 1] No free throws, side out. (Tony Carter: 1 personal fouls)

[09:45] Team_009 possession (Score: 5-0)
Miles Sabonis attempts a 3Pt. Contested by Giannis Jokic (5.1 feet, MAN). Miles Sabonis misses. Rebound secured by Jrue Lillard.

[09:32] Team_056 possession (Score: 5-0)
Jrue Lillard attempts a 3Pt. Wide open! Cole Mitchell is 6.8 feet away. [MAN] Jrue Lillard misses. Rebound secured by Anfernee Anunoby.

[09:17] Team_009 possession (Score: 5-0)
Anfernee Anunoby attempts a Midrange. Contested by Magic Russell (4.4 feet, ZONE). Anfernee Anunoby misses. Rebound secured by Yao Poole.

[09:02] Team_056 possession (Score: 5-0)
Tony Carter makes the Dunk and draws the foul on Kyle Brogdon! And-1! Tony Carter to the line for 1. [Team fouls: 3] (Kyle Brogdon: 3 personal fouls)   FT 1/1: GOOD Tony Carter makes 1/1 from the line.
Score: 8-0

[08:48] Team_009 possession (Score: 8-0)
Desmond Harden attempts a Layup. Wide open! Magic Russell is 6.3 feet away. [MAN] DESMOND HARDEN MAKES IT! Assist: Kyle Brogdon
Score: 8-2

[08:35] Team_056 possession (Score: 8-2)
Tony Carter attempts a Midrange. Contested by Anfernee Anunoby (5.3 feet, MAN). Tony Carter misses. FOUL! Loose ball foul on Cole Mitchell during the rebound battle. [Team fouls: 4] No free throws, side out. (Cole Mitchell: 1 personal fouls)

[08:24] Team_056 possession (Score: 8-2)
Tony Carter attempts a Layup. Wide open! Kyle Brogdon is 6.9 feet away. [ZONE] TONY CARTER MAKES IT! Assist: Yao Poole
Score: 10-2

[08:05] Team_009 possession (Score: 10-2)
Cole Mitchell makes the Midrange and draws the foul on Jrue Lillard! And-1! Cole Mitchell to the line for 1. [Team fouls: 2] (Jrue Lillard: 1 personal fouls)   FT 1/1: GOOD Cole Mitchell makes 1/1 from the line.
Score: 10-5

[07:50] Team_056 possession (Score: 10-5)
Jrue Lillard drives, picks up Cole Mitchell. Help arrives from Miles Sabonis! Jrue Lillard attempts a Layup. Contested by Miles Sabonis (6.0 feet, MAN). JRUE LILLARD MAKES IT! Assist: Yao Poole
Score: 12-5

[07:32] Team_009 possession (Score: 12-5)
Kyle Brogdon attempts a Midrange. Wide open! Magic Russell is 6.6 feet away. [ZONE] Kyle Brogdon misses. Offensive rebound by Kyle Brogdon! Kyle Brogdon's putback is no good. Rebound secured by Jrue Lillard.

[07:19] Team_056 possession (Score: 12-5)
Tony Carter drives and kicks out. Tony Carter attempts a 3Pt. Wide open! Anfernee Anunoby is 8.7 feet away. [MAN] Tony Carter misses. Rebound secured by Kyle Brogdon.

[06:59] Team_009 possession (Score: 12-5)
FOUL! Shooting foul on Tony Carter. Cole Mitchell to the line for 2 free throws. [Team fouls: 3] (Tony Carter: 2 personal fouls)   FT 1/2: GOOD   FT 2/2: GOOD Cole Mitchell makes 2/2 from the line.
Score: 12-7

[06:42] Team_056 possession (Score: 12-7)
Yao Poole throws a bad pass out of bounds! TURNOVER! (dead ball)

[06:28] Team_009 possession (Score: 12-7)
Anfernee Anunoby drives to the basket... FOUL! Offensive foul on Anfernee Anunoby! Tony Carter drew the charge! [Team fouls: 5] (Anfernee Anunoby: 1 personal fouls) TURNOVER! (dead ball)

[06:12] Team_056 possession (Score: 12-7)
FOUL! Shooting foul on Anfernee Anunoby. Tony Carter to the line for 2 free throws. [BONUS: 6 team fouls] (Anfernee Anunoby: 2 personal fouls)   FT 1/2: GOOD   FT 2/2: GOOD Tony Carter makes 2/2 from the line.
Score: 14-7

[05:57] Team_009 possession (Score: 14-7)
Desmond Harden drives to the basket... Desmond Harden throws a bad pass out of bounds! TURNOVER! (dead ball)

[05:39] Team_056 possession (Score: 14-7)
Giannis Jokic attempts a 3Pt. Contested by Miles Sabonis (5.6 feet, MAN). Giannis Jokic misses. Rebound secured by Anfernee Anunoby.

[05:20] Team_009 possession (Score: 14-7)
FOUL! Shooting foul on Jrue Lillard. Anfernee Anunoby to the line for 2 free throws. [Team fouls: 4] (Jrue Lillard: 2 personal fouls)   FT 1/2: GOOD   FT 2/2: GOOD Anfernee Anunoby makes 2/2 from the line.
Score: 14-9

[05:09] Team_056 possession (Score: 14-9)
Tony Carter attempts a Midrange. Wide open! Anfernee Anunoby is 7.6 feet away. [MAN] TONY CARTER MAKES IT!
Score: 16-9

[04:55] Team_009 possession (Score: 16-9)
Desmond Harden attempts a Midrange. Contested by Jrue Lillard (2.0 feet, ZONE). Desmond Harden misses. Offensive rebound by Kyle Brogdon! Kyle Brogdon puts it back in!
Score: 16-11

[04:40] Team_056 possession (Score: 16-11)
Yao Poole loses the ball! Stripped by Kyle Brogdon! TURNOVER! (live ball)

[04:25] Team_009 possession (Score: 16-11)
Kyle Brogdon attempts a Midrange. Contested by Magic Russell (5.3 feet, ZONE). KYLE BROGDON MAKES IT! Assist: Cole Mitchell
Score: 16-13

[04:08] Team_056 possession (Score: 16-13)
Giannis Jokic drives and kicks out. Jrue Lillard attempts a Midrange. Contested by Desmond Harden (3.9 feet, ZONE). Jrue Lillard misses. Rebound secured by Kyle Brogdon.

[03:52] Team_009 possession (Score: 16-13)
Miles Sabonis attempts a 3Pt. Contested by Giannis Jokic (5.3 feet, ZONE). MILES SABONIS MAKES IT! Assist: Kyle Brogdon
Score: 16-16

[03:36] Team_056 possession (Score: 16-16)
Tony Carter attempts a 3Pt. Contested by Anfernee Anunoby (4.8 feet, MAN). Tony Carter misses. Rebound secured by Anfernee Anunoby.

[03:21] Team_009 possession (Score: 16-16)
Kyle Brogdon drives to the basket... Kyle Brogdon loses the ball! Stripped by Yao Poole! TURNOVER! (live ball)

[03:05] Team_056 possession (Score: 16-16)
Tony Carter attempts a Midrange. Contested by Anfernee Anunoby (5.9 feet, MAN). TONY CARTER MAKES IT!
Score: 18-16

[02:54] Team_009 possession (Score: 18-16)
Desmond Harden attempts a 3Pt. Contested by Magic Russell (5.0 feet, MAN). Desmond Harden misses. Rebound secured by Yao Poole.

[02:39] Team_056 possession (Score: 18-16)
Tony Carter drives to the basket... FOUL! Offensive foul on Tony Carter! Kyle Brogdon drew the charge! [Team fouls: 5] (Tony Carter: 3 personal fouls) TURNOVER! (dead ball)

[02:26] Team_009 possession (Score: 18-16)
Kyle Brogdon attempts a Midrange. Heavily contested by Yao Poole (1.5 feet, MAN)! Kyle Brogdon misses. Rebound secured by Yao Poole.

[02:09] Team_056 possession (Score: 18-16)
Giannis Jokic attempts a 3Pt. Contested by Miles Sabonis (5.8 feet, ZONE). Giannis Jokic misses. Rebound secured by Cole Mitchell.

[01:56] Team_009 possession (Score: 18-16)
Anfernee Anunoby attempts a Midrange. Contested by Jrue Lillard (3.0 feet, ZONE). ANFERNEE ANUNOBY MAKES IT! Assist: Cole Mitchell
Score: 18-18

[01:46] Team_056 possession (Score: 18-18)
FOUL! Holding foul on Anfernee Anunoby. [IN THE BONUS! 7 team fouls] Tony Carter to the line for 2 free throws. (Anfernee Anunoby: 3 personal fouls)   FT 1/2: MISS   FT 2/2: GOOD Tony Carter makes 1/2 from the line.
Score: 19-18

[01:35] Team_009 possession (Score: 19-18)
Cole Mitchell drives and kicks out. Miles Sabonis attempts a 3Pt. Contested by Giannis Jokic (5.4 feet, MAN). Miles Sabonis misses. Rebound secured by Yao Poole.

[01:18] Team_056 possession (Score: 19-18)
Giannis Jokic attempts a 3Pt. Wide open! Desmond Harden is 7.3 feet away. [ZONE] Giannis Jokic misses. Rebound secured by Kyle Brogdon.

[01:01] Team_009 possession (Score: 19-18)
Cole Mitchell attempts a Midrange. Contested by Jrue Lillard (2.8 feet, MAN). Cole Mitchell misses. FOUL! Loose ball foul on Yao Poole during the rebound battle. [IN THE BONUS! 6 team fouls] Kyle Brogdon to the line for 2 free throws. (Yao Poole: 1 personal fouls)   FT 1/2: GOOD   FT 2/2: GOOD Kyle Brogdon makes 2/2 from the line.
Score: 19-20

[00:49] Team_056 possession (Score: 19-20)
Tony Carter attempts a Midrange. Wide open! Anfernee Anunoby is 6.2 feet away. [MAN] Tony Carter misses. Rebound secured by Anfernee Anunoby.

[00:34] Team_009 possession (Score: 19-20)
FOUL! Shooting foul on Giannis Jokic. Miles Sabonis to the line for 2 free throws. [BONUS: 7 team fouls] (Giannis Jokic: 1 personal fouls)   FT 1/2: GOOD   FT 2/2: GOOD Miles Sabonis makes 2/2 from the line.
Score: 19-22

[00:20] Team_056 possession (Score: 19-22)
Giannis Jokic attempts a 3Pt. Contested by Miles Sabonis (5.2 feet, MAN). GIANNIS JOKIC MAKES IT! Assist: Tony Carter
Score: 22-22

[00:06] Team_009 possession (Score: 22-22)
Desmond Harden drives and kicks out. Anfernee Anunoby attempts a 3Pt. Wide open! Tony Carter is 6.4 feet away. [MAN] Anfernee Anunoby misses. Rebound secured by Jrue Lillard.

================================================================================
                              1ST QUARTER COMPLETE                              
================================================================================

1ST QUARTER SCORE: Team_056 22, Team_009 22

BOX SCORE:
================================================================================

Team_056
--------------------------------------------------------------------------------
Player                MIN  PTS  REB  AST  TO      FG   FG%      3P   3P%
--------------------------------------------------------------------------------
Tony Carter            12   12    1    2   0   6/9    66.7     0/0   0.0
Giannis Jokic          12    6    0    0   0   2/6    33.3     0/0   0.0
Jrue Lillard           12    2    5    0   0   1/2    50.0     0/0   0.0
Yao Poole              12    0    5    2   0   0/1     0.0     0/0   0.0
Magic Russell          12    0    0    0   0   0/1     0.0     0/0   0.0

TEAM: FG: 9/19 (47.4%), 3PT: 2/8 (25.0%), REB: 10 (2 off, 8 def), AST: 4, TO: 4
TEAM FOULS: 7 [Team_009 in BONUS]


Team_009
--------------------------------------------------------------------------------
Player                MIN  PTS  REB  AST  TO      FG   FG%      3P   3P%
--------------------------------------------------------------------------------
Kyle Brogdon           12    6    5    2   0   3/6    50.0     0/0   0.0
Cole Mitchell          12    5    3    2   0   2/4    50.0     0/0   0.0
Miles Sabonis          12    5    0    0   0   2/3    66.7     0/0   0.0
Anfernee Anunoby       12    4    4    0   0   2/3    66.7     0/0   0.0
Desmond Harden         12    2    0    0   0   1/4    25.0     0/0   0.0

TEAM: FG: 10/20 (50.0%), 3PT: 1/4 (25.0%), REB: 13 (3 off, 10 def), AST: 4, TO: 3
TEAM FOULS: 7 [Team_056 in BONUS]

================================================================================

================================================================================
                       2ND QUARTER - Team_056 vs Team_009                       
================================================================================

[12:00] Team_056 possession (Score: 22-22)
Tony Carter attempts a 3Pt. Contested by Anfernee Anunoby (3.5 feet, ZONE). Tony Carter misses. Rebound secured by Kyle Brogdon.

[11:47] Team_009 possession (Score: 22-22)
Anfernee Anunoby makes the Dunk and draws the foul on Giannis Jokic! And-1! Anfernee Anunoby to the line for 1. [Team fouls: 1] (Giannis Jokic: 1 personal fouls)   FT 1/1: GOOD Anfernee Anunoby makes 1/1 from the line.
Score: 22-25

[11:37] Team_056 possession (Score: 22-25)
FOUL! Reach-in foul on Desmond Harden during the drive. [Team fouls: 1] No free throws, side out. (Desmond Harden: 1 personal fouls)

[11:23] Team_056 possession (Score: 22-25)
Magic Russell attempts a Midrange. Contested by Kyle Brogdon (5.6 feet, ZONE). MAGIC RUSSELL MAKES IT!
Score: 24-25

[11:11] Team_009 possession (Score: 24-25)
Miles Sabonis attempts a 3Pt. Contested by Giannis Jokic (4.6 feet, ZONE). Miles Sabonis misses. Rebound secured by Tony Carter.

[10:57] Team_056 possession (Score: 24-25)
Giannis Jokic drives, Miles Sabonis stays with him. Giannis Jokic attempts a Layup. Contested by Miles Sabonis (3.7 feet, MAN). GIANNIS JOKIC MAKES IT!
Score: 26-25

[10:42] Team_009 possession (Score: 26-25)
FOUL! Reach-in foul on Tony Carter during the drive. [Team fouls: 2] No free throws, side out. (Tony Carter: 1 personal fouls)

[10:27] Team_009 possession (Score: 26-25)
Desmond Harden attempts a 3Pt. Contested by Giannis Jokic (2.2 feet, ZONE). DESMOND HARDEN MAKES IT! Assist: Anfernee Anunoby
Score: 26-28

[10:12] Team_056 possession (Score: 26-28)
Giannis Jokic attempts a 3Pt. Contested by Miles Sabonis (4.7 feet, ZONE). Giannis Jokic misses. Rebound secured by Cole Mitchell.

[09:58] Team_009 possession (Score: 26-28)
Desmond Harden drives to the basket... Desmond Harden throws a bad pass! Stolen by Magic Russell! TURNOVER! (live ball)

[09:41] Team_056 possession (Score: 26-28)
Magic Russell drives, Kyle Brogdon stays with him. Magic Russell attempts a Layup. Wide open! Kyle Brogdon is 6.5 feet away. [ZONE] Magic Russell misses. Offensive rebound by Jrue Lillard! Jrue Lillard puts it back in!
Score: 28-28

[09:25] Team_009 possession (Score: 28-28)
Kyle Brogdon attempts a Layup. BLOCKED BY GIANNIS JOKIC! Ball deflects out of bounds off Kyle Brogdon.

[09:08] Team_056 possession (Score: 28-28)
Tony Carter attempts a 3Pt. Wide open! Miles Sabonis is 6.7 feet away. [ZONE] TONY CARTER MAKES IT! Assist: Jrue Lillard
Score: 31-28

[08:55] Team_009 possession (Score: 31-28)
Cole Mitchell drives to the basket... Cole Mitchell throws a bad pass out of bounds! TURNOVER! (dead ball)

[08:55] Substitution (Team_056): Giannis Jokic OUT → De'Aaron Murray IN (stamina_rule2)

[08:55] Substitution (Team_056): Magic Russell OUT → Damian Barrett IN (stamina_rule2)

[08:55] Substitution (Team_056): Tony Carter OUT → CJ Anthony IN (stamina_rule2)

[08:55] Substitution (Team_056): Jrue Lillard OUT → RJ Johnson IN (stamina_rule2)

[08:55] Substitution (Team_056): Yao Poole OUT → Derrick Bane IN (stamina_rule2)

[08:55] Substitution (Team_009): Miles Sabonis OUT → Paul Trent IN (stamina_rule2)

[08:55] Substitution (Team_009): Desmond Harden OUT → Evan Curry IN (stamina_rule2)

[08:55] Substitution (Team_009): Anfernee Anunoby OUT → RJ Jokic IN (stamina_rule2)

[08:55] Substitution (Team_009): Cole Mitchell OUT → Kawhi Herro IN (stamina_rule2)

[08:55] Substitution (Team_009): Kyle Brogdon OUT → Shaquille Green IN (stamina_rule2)

[08:45] Team_056 possession (Score: 31-28)
Derrick Bane attempts a 3Pt. Contested by Shaquille Green (5.5 feet, MAN). Derrick Bane misses. Rebound secured by Kawhi Herro.

[08:30] Team_009 possession (Score: 31-28)
Evan Curry attempts a 3Pt. Wide open! De'Aaron Murray is 10.0 feet away. [ZONE] Evan Curry misses. Rebound secured by Derrick Bane.

[08:17] Team_056 possession (Score: 31-28)
RJ Johnson attempts a Midrange. Contested by RJ Jokic (5.6 feet, ZONE). RJ JOHNSON MAKES IT! Assist: De'Aaron Murray
Score: 33-28

[08:00] Team_009 possession (Score: 33-28)
Evan Curry attempts a 3Pt. Wide open! De'Aaron Murray is 7.8 feet away. [ZONE] Evan Curry misses. Rebound secured by Derrick Bane.

[07:48] Team_056 possession (Score: 33-28)
CJ Anthony attempts a 3Pt. Wide open! Paul Trent is 9.9 feet away. [ZONE] CJ ANTHONY MAKES IT! Assist: Damian Barrett
Score: 36-28

[07:35] Team_009 possession (Score: 36-28)
FOUL! Shooting foul on RJ Johnson. Paul Trent to the line for 2 free throws. [Team fouls: 3] (RJ Johnson: 1 personal fouls)   FT 1/2: MISS   FT 2/2: GOOD Paul Trent makes 1/2 from the line.
Score: 36-29

[07:20] Team_056 possession (Score: 36-29)
Derrick Bane drives, Kawhi Herro stays with him. Derrick Bane attempts a Dunk. Wide open! Kawhi Herro is 7.8 feet away. [ZONE] DERRICK BANE MAKES IT! Assist: RJ Johnson
Score: 38-29

[07:09] Team_009 possession (Score: 38-29)
Paul Trent commits a violation (traveling/carry)! TURNOVER! (dead ball)

[07:00] Team_056 possession (Score: 38-29)
RJ Johnson drives and kicks out. CJ Anthony attempts a 3Pt. Contested by RJ Jokic (4.4 feet, MAN). CJ Anthony misses. Offensive rebound by CJ Anthony! CJ Anthony kicks it out.

[06:46] Team_056 possession (Score: 38-29)
Derrick Bane attempts a Layup. Heavily contested by Kawhi Herro (1.7 feet, ZONE)! Derrick Bane misses. Offensive rebound by CJ Anthony! CJ Anthony kicks it out.

[06:30] Team_056 possession (Score: 38-29)
Damian Barrett attempts a 3Pt. Wide open! Paul Trent is 7.3 feet away. [ZONE] DAMIAN BARRETT MAKES IT! Assist: De'Aaron Murray
Score: 41-29

[06:17] Team_009 possession (Score: 41-29)
Evan Curry attempts a Midrange. Wide open! Damian Barrett is 8.2 feet away. [MAN] Evan Curry misses. Rebound secured by Derrick Bane.

[06:03] Team_056 possession (Score: 41-29)
CJ Anthony drives, picks up RJ Jokic. Help arrives from Paul Trent! CJ Anthony attempts a Layup. Contested by Paul Trent (4.7 feet, MAN). CJ ANTHONY MAKES IT!
Score: 43-29

[05:46] Team_009 possession (Score: 43-29)
FOUL! Holding foul on Damian Barrett. [Team fouls: 4] No free throws, side out. (Damian Barrett: 1 personal fouls)

[05:30] Team_009 possession (Score: 43-29)
Shaquille Green throws a bad pass out of bounds! TURNOVER! (dead ball)

[05:19] Team_056 possession (Score: 43-29)
CJ Anthony attempts a 3Pt. Heavily contested by RJ Jokic (1.9 feet, MAN)! CJ ANTHONY MAKES IT! Assist: Damian Barrett
Score: 46-29

[05:04] Team_009 possession (Score: 46-29)
Shaquille Green makes the 3Pt and draws the foul on De'Aaron Murray! And-1! Shaquille Green to the line for 1. [BONUS: 5 team fouls] (De'Aaron Murray: 1 personal fouls)   FT 1/1: GOOD Shaquille Green makes 1/1 from the line.
Score: 46-33

[04:50] Team_056 possession (Score: 46-33)
Damian Barrett drives to the basket... FOUL! Offensive foul on Damian Barrett! Evan Curry drew the charge! [Team fouls: 6] (Damian Barrett: 2 personal fouls) TURNOVER! (dead ball)

[04:36] Team_009 possession (Score: 46-33)
Paul Trent attempts a 3Pt. Contested by De'Aaron Murray (3.5 feet, ZONE). Paul Trent misses. Rebound secured by CJ Anthony.

[04:25] Team_056 possession (Score: 46-33)
CJ Anthony drives and kicks out. Damian Barrett attempts a 3Pt. Heavily contested by Evan Curry (1.9 feet, MAN)! DAMIAN BARRETT MAKES IT! Assist: RJ Johnson
Score: 49-33

[04:12] Team_009 possession (Score: 49-33)
Evan Curry attempts a 3Pt. Contested by De'Aaron Murray (5.3 feet, ZONE). Evan Curry misses. Rebound secured by Derrick Bane.

[03:59] Team_056 possession (Score: 49-33)
FOUL! Offensive foul on Damian Barrett! Evan Curry drew the charge! [Team fouls: 7] (Damian Barrett: 3 personal fouls) TURNOVER! (dead ball)

[03:42] Team_009 possession (Score: 49-33)
RJ Jokic attempts a 3Pt. Contested by CJ Anthony (5.1 feet, MAN). RJ Jokic misses. Rebound secured by CJ Anthony.

[03:26] Team_056 possession (Score: 49-33)
FOUL! Holding foul on Paul Trent. [Team fouls: 2] No free throws, side out. (Paul Trent: 1 personal fouls)

[03:12] Team_056 possession (Score: 49-33)
RJ Johnson drives and kicks out. RJ Johnson attempts a 3Pt. Contested by Kawhi Herro (5.0 feet, MAN). RJ Johnson misses. Offensive rebound by RJ Johnson! RJ Johnson kicks it out.

[03:02] Team_056 possession (Score: 49-33)
De'Aaron Murray attempts a 3Pt. Contested by Paul Trent (4.8 feet, ZONE). DE'AARON MURRAY MAKES IT! Assist: Derrick Bane
Score: 52-33

[02:46] Team_009 possession (Score: 52-33)
Kawhi Herro drives, picks up RJ Johnson. Help arrives from Damian Barrett! Kawhi Herro attempts a Layup. Contested by Damian Barrett (3.8 feet, MAN). KAWHI HERRO MAKES IT!
Score: 52-35

[02:27] Team_056 possession (Score: 52-35)
Derrick Bane throws a bad pass out of bounds! TURNOVER! (dead ball)

[02:16] Team_009 possession (Score: 52-35)
FOUL! Shooting foul on De'Aaron Murray. Evan Curry to the line for 3 free throws. [BONUS: 8 team fouls] (De'Aaron Murray: 2 personal fouls)   FT 1/3: GOOD   FT 2/3: GOOD   FT 3/3: GOOD Evan Curry makes 3/3 from the line.
Score: 52-38

[01:59] Team_056 possession (Score: 52-38)
Damian Barrett throws a bad pass! Stolen by Evan Curry! TURNOVER! (live ball)

[01:49] Team_009 possession (Score: 52-38)
Shaquille Green attempts a Midrange. Wide open! Damian Barrett is 8.4 feet away. [ZONE] Shaquille Green misses. Rebound secured by RJ Johnson.

[01:34] Team_056 possession (Score: 52-38)
CJ Anthony drives, Kawhi Herro stays with him. CJ Anthony attempts a Layup. Contested by Kawhi Herro (4.9 feet, ZONE). CJ ANTHONY MAKES IT!
Score: 54-38

[01:20] Team_009 possession (Score: 54-38)
RJ Jokic attempts a 3Pt. Heavily contested by CJ Anthony (0.5 feet, MAN)! RJ Jokic misses. Rebound secured by RJ Johnson.

[01:04] Team_056 possession (Score: 54-38)
CJ Anthony attempts a Midrange. Contested by RJ Jokic (5.4 feet, MAN). CJ ANTHONY MAKES IT! Assist: De'Aaron Murray
Score: 56-38

[00:52] Team_009 possession (Score: 56-38)
RJ Jokic attempts a 3Pt. Contested by CJ Anthony (4.2 feet, MAN). RJ Jokic misses. Offensive rebound by Shaquille Green! Shaquille Green kicks it out.

[00:37] Team_009 possession (Score: 56-38)
Kawhi Herro makes the Dunk and draws the foul on RJ Johnson! And-1! Kawhi Herro to the line for 1. [BONUS: 9 team fouls] (RJ Johnson: 2 personal fouls)   FT 1/1: GOOD Kawhi Herro makes 1/1 from the line.
Score: 56-41

[00:23] Team_056 possession (Score: 56-41)
RJ Johnson drives and kicks out. Damian Barrett attempts a 3Pt. Contested by Paul Trent (2.6 feet, ZONE). DAMIAN BARRETT MAKES IT!
Score: 59-41

[00:09] Team_009 possession (Score: 59-41)
Evan Curry attempts a 3Pt. Contested by De'Aaron Murray (4.8 feet, ZONE). EVAN CURRY MAKES IT! Assist: Paul Trent
Score: 59-44

================================================================================
                              2ND QUARTER COMPLETE                              
================================================================================

2ND QUARTER SCORE: Team_056 37, Team_009 22

BOX SCORE:
================================================================================

Team_056
--------------------------------------------------------------------------------
Player                MIN  PTS  REB  AST  TO      FG   FG%      3P   3P%
--------------------------------------------------------------------------------
CJ Anthony              9   12    4    0   0   5/5   100.0     0/0   0.0
Damian Barrett          9    9    0    2   0   3/3   100.0     0/0   0.0
Tony Carter            15    3    1    0   0   1/2    50.0     0/0   0.0
De'Aaron Murray         9    3    0    3   0   1/1   100.0     0/0   0.0
Magic Russell          15    2    0    0   0   1/1   100.0     0/0   0.0
Giannis Jokic          15    2    0    0   0   1/2    50.0     0/0   0.0
Jrue Lillard           15    2    1    1   0   1/1   100.0     0/0   0.0
Derrick Bane            9    2    4    1   0   1/2    50.0     0/0   0.0
RJ Johnson              9    2    3    2   0   1/1   100.0     0/0   0.0

TEAM: FG: 15/18 (83.3%), 3PT: 5/8 (62.5%), REB: 13 (4 off, 9 def), AST: 9, TO: 4
TEAM FOULS: 9 [Team_009 in BONUS]


Team_009
--------------------------------------------------------------------------------
Player                MIN  PTS  REB  AST  TO      FG   FG%      3P   3P%
--------------------------------------------------------------------------------
Evan Curry              9    6    0    0   0   2/6    33.3     0/0   0.0
Kawhi Herro             9    5    1    0   0   2/2   100.0     0/0   0.0
Shaquille Green         9    4    1    0   0   1/2    50.0     0/0   0.0
Anfernee Anunoby       15    3    0    1   0   1/1   100.0     0/0   0.0
Desmond Harden         15    3    0    0   0   1/1   100.0     0/0   0.0
Paul Trent              9    1    0    1   0   1/2    50.0     0/0   0.0
Kyle Brogdon           15    0    1    0   0   0/1     0.0     0/0   0.0
Miles Sabonis          15    0    0    0   0   0/1     0.0     0/0   0.0
Cole Mitchell          15    0    1    0   0   0/0     0.0     0/0   0.0
RJ Jokic                9    0    0    0   0   0/2     0.0     0/0   0.0

TEAM: FG: 8/18 (44.4%), 3PT: 4/11 (36.4%), REB: 4 (1 off, 3 def), AST: 2, TO: 4
TEAM FOULS: 2

================================================================================

================================================================================
                       3RD QUARTER - Team_056 vs Team_009                       
================================================================================

[12:00] Team_056 possession (Score: 59-44)
Yao Poole attempts a 3Pt. Wide open! Miles Sabonis is 8.7 feet away. [ZONE] YAO POOLE MAKES IT!
Score: 62-44

[11:50] Team_009 possession (Score: 62-44)
Miles Sabonis attempts a 3Pt. Contested by Giannis Jokic (2.8 feet, ZONE). Miles Sabonis misses. Offensive rebound by Kyle Brogdon! Kyle Brogdon's putback is no good. Rebound secured by Tony Carter.

[11:35] Team_056 possession (Score: 62-44)
FOUL! Shooting foul on Cole Mitchell. Magic Russell to the line for 2 free throws. [Team fouls: 1] (Cole Mitchell: 1 personal fouls)   FT 1/2: GOOD   FT 2/2: GOOD Magic Russell makes 2/2 from the line.
Score: 64-44

[11:19] Team_009 possession (Score: 64-44)
Kyle Brogdon attempts a Layup. Contested by Yao Poole (3.9 feet, MAN). Kyle Brogdon misses. Rebound secured by Jrue Lillard.

[11:07] Team_056 possession (Score: 64-44)
Magic Russell attempts a 3Pt. Contested by Desmond Harden (5.5 feet, MAN). Magic Russell misses. Rebound secured by Cole Mitchell.

[10:55] Team_009 possession (Score: 64-44)
FOUL! Reach-in foul on Tony Carter during the drive. [Team fouls: 1] No free throws, side out. (Tony Carter: 1 personal fouls)

[10:38] Team_009 possession (Score: 64-44)
Miles Sabonis drives to the basket... Miles Sabonis throws a bad pass! Stolen by Jrue Lillard! TURNOVER! (live ball)

[10:21] Team_056 possession (Score: 64-44)
Magic Russell throws a bad pass out of bounds! TURNOVER! (dead ball)

[10:08] Team_009 possession (Score: 64-44)
Desmond Harden attempts a 3Pt. Contested by Giannis Jokic (5.9 feet, ZONE). Desmond Harden misses. Rebound secured by Yao Poole.

[09:52] Team_056 possession (Score: 64-44)
Tony Carter attempts a Layup. Contested by Kyle Brogdon (3.0 feet, ZONE). Tony Carter misses. Offensive rebound by Jrue Lillard! Jrue Lillard puts it back in!
Score: 66-44

[09:37] Team_009 possession (Score: 66-44)
Cole Mitchell drives, picks up Jrue Lillard. Help arrives from Giannis Jokic! Cole Mitchell attempts a Dunk. Contested by Giannis Jokic (4.9 feet, MAN). COLE MITCHELL MAKES IT!
Score: 66-46

[09:19] Team_056 possession (Score: 66-46)
Magic Russell attempts a 3Pt. Wide open! Desmond Harden is 7.8 feet away. [MAN] Magic Russell misses. Rebound secured by Kyle Brogdon.

[09:05] Team_009 possession (Score: 66-46)
Miles Sabonis attempts a 3Pt. Contested by Giannis Jokic (5.4 feet, ZONE). Miles Sabonis misses. Rebound secured by Jrue Lillard.

[08:51] Team_056 possession (Score: 66-46)
Giannis Jokic attempts a 3Pt. Wide open! Miles Sabonis is 6.9 feet away. [ZONE] Giannis Jokic misses. Rebound secured by Anfernee Anunoby.

[08:40] Team_009 possession (Score: 66-46)
Anfernee Anunoby attempts a Midrange. Contested by Magic Russell (5.3 feet, ZONE). ANFERNEE ANUNOBY MAKES IT!
Score: 66-48

[08:25] Team_056 possession (Score: 66-48)
Tony Carter attempts a 3Pt. Contested by Miles Sabonis (5.1 feet, ZONE). TONY CARTER MAKES IT! Assist: Magic Russell
Score: 69-48

[08:15] Team_009 possession (Score: 69-48)
Cole Mitchell attempts a Midrange. Contested by Tony Carter (2.3 feet, ZONE). Cole Mitchell misses. Rebound secured by Jrue Lillard.

[08:02] Team_056 possession (Score: 69-48)
Giannis Jokic drives to the basket... Giannis Jokic loses the ball! Stripped by Miles Sabonis! TURNOVER! (live ball)

[07:49] Team_009 possession (Score: 69-48)
Desmond Harden attempts a Midrange. Wide open! Magic Russell is 8.5 feet away. [MAN] DESMOND HARDEN MAKES IT!
Score: 69-50

[07:40] Team_056 possession (Score: 69-50)
Magic Russell attempts a 3Pt. Wide open! Desmond Harden is 8.4 feet away. [MAN] Magic Russell misses. Rebound secured by Anfernee Anunoby.

[07:23] Team_009 possession (Score: 69-50)
FOUL! Offensive foul on Desmond Harden! Magic Russell drew the charge! [Team fouls: 2] (Desmond Harden: 1 personal fouls) TURNOVER! (dead ball)

[07:13] Team_056 possession (Score: 69-50)
Magic Russell drives, picks up Kyle Brogdon. Help arrives from Miles Sabonis! Magic Russell attempts a Layup. Wide open! Miles Sabonis is 6.9 feet away. [ZONE] MAGIC RUSSELL MAKES IT!
Score: 71-50

[07:01] Team_009 possession (Score: 71-50)
Kyle Brogdon drives, Jrue Lillard stays with him. Kyle Brogdon attempts a Dunk. Contested by Jrue Lillard (3.4 feet, ZONE). Kyle Brogdon misses. Rebound secured by Yao Poole.

[06:49] Team_056 possession (Score: 71-50)
Giannis Jokic attempts a Midrange. Contested by Miles Sabonis (5.1 feet, MAN). Giannis Jokic misses. Rebound secured by Anfernee Anunoby.

[06:34] Team_009 possession (Score: 71-50)
Miles Sabonis commits a violation (traveling/carry)! TURNOVER! (dead ball)

[06:21] Team_056 possession (Score: 71-50)
Giannis Jokic makes the Layup and draws the foul on Miles Sabonis! And-1! Giannis Jokic to the line for 1. [Team fouls: 3] (Miles Sabonis: 1 personal fouls)   FT 1/1: GOOD Giannis Jokic makes 1/1 from the line.
Score: 74-50

[06:07] Team_009 possession (Score: 74-50)
Cole Mitchell attempts a Layup. BLOCKED BY JRUE LILLARD! Ball deflects out of bounds off Cole Mitchell.

[05:50] Team_056 possession (Score: 74-50)
Giannis Jokic drives, Miles Sabonis stays with him. Giannis Jokic attempts a Layup. Wide open! Miles Sabonis is 7.8 feet away. [MAN] GIANNIS JOKIC MAKES IT!
Score: 76-50

[05:35] Team_009 possession (Score: 76-50)
Miles Sabonis makes the Midrange and draws the foul on Tony Carter! And-1! Miles Sabonis to the line for 1. [Team fouls: 2] (Tony Carter: 2 personal fouls)   FT 1/1: GOOD Miles Sabonis makes 1/1 from the line.
Score: 76-53

[05:19] Team_056 possession (Score: 76-53)
Magic Russell drives, picks up Kyle Brogdon. Help arrives from Miles Sabonis! Magic Russell attempts a Dunk. Wide open! Miles Sabonis is 7.8 feet away. [ZONE] MAGIC RUSSELL MAKES IT! Assist: Jrue Lillard
Score: 78-53

[05:04] Team_009 possession (Score: 78-53)
FOUL! Offensive foul on Kyle Brogdon! Yao Poole drew the charge! [Team fouls: 4] (Kyle Brogdon: 1 personal fouls) TURNOVER! (dead ball)

[04:50] Team_056 possession (Score: 78-53)
FOUL! Holding foul on Anfernee Anunoby. [IN THE BONUS! 5 team fouls] Tony Carter to the line for 2 free throws. (Anfernee Anunoby: 1 personal fouls)   FT 1/2: GOOD   FT 2/2: GOOD Tony Carter makes 2/2 from the line.
Score: 80-53

[04:38] Team_009 possession (Score: 80-53)
Anfernee Anunoby makes the Layup and draws the foul on Tony Carter! And-1! Anfernee Anunoby to the line for 1. [Team fouls: 3] (Tony Carter: 3 personal fouls)   FT 1/1: GOOD Anfernee Anunoby makes 1/1 from the line.
Score: 80-56

[04:21] Team_056 possession (Score: 80-56)
Giannis Jokic attempts a 3Pt. Wide open! Desmond Harden is 6.7 feet away. [ZONE] GIANNIS JOKIC MAKES IT! Assist: Magic Russell
Score: 83-56

[04:04] Team_009 possession (Score: 83-56)
Kyle Brogdon attempts a Layup. BLOCKED BY JRUE LILLARD! Ball is loose! Rebound secured by Yao Poole.

[03:49] Team_056 possession (Score: 83-56)
Magic Russell drives to the basket... Magic Russell throws a bad pass out of bounds! TURNOVER! (dead ball)

[03:31] Team_009 possession (Score: 83-56)
Cole Mitchell attempts a 3Pt. Contested by Jrue Lillard (4.3 feet, MAN). COLE MITCHELL MAKES IT! Assist: Kyle Brogdon
Score: 83-59

[03:15] Team_056 possession (Score: 83-59)
Tony Carter attempts a 3Pt. Wide open! Anfernee Anunoby is 8.2 feet away. [MAN] Tony Carter misses. FOUL! Loose ball foul on Kyle Brogdon during the rebound battle. [IN THE BONUS! 6 team fouls] Jrue Lillard to the line for 2 free throws. (Kyle Brogdon: 2 personal fouls)   FT 1/2: MISS   FT 2/2: GOOD Jrue Lillard makes 1/2 from the line.
Score: 84-59

[03:01] Team_009 possession (Score: 84-59)
FOUL! Shooting foul on Yao Poole. Kyle Brogdon to the line for 2 free throws. [Team fouls: 4] (Yao Poole: 1 personal fouls)   FT 1/2: GOOD   FT 2/2: GOOD Kyle Brogdon makes 2/2 from the line.
Score: 84-61

[02:49] Team_056 possession (Score: 84-61)
FOUL! Reach-in foul on Kyle Brogdon during the drive. [IN THE BONUS! 7 team fouls] Yao Poole to the line for 2 free throws. (Kyle Brogdon: 3 personal fouls)   FT 1/2: GOOD   FT 2/2: GOOD Yao Poole makes 2/2 from the line.
Score: 86-61

[02:32] Team_009 possession (Score: 86-61)
FOUL! Reach-in foul on Yao Poole during the drive. [IN THE BONUS! 5 team fouls] Miles Sabonis to the line for 2 free throws. (Yao Poole: 2 personal fouls)   FT 1/2: MISS   FT 2/2: GOOD Miles Sabonis makes 1/2 from the line.
Score: 86-62

[02:13] Team_056 possession (Score: 86-62)
Yao Poole attempts a Midrange. Contested by Kyle Brogdon (3.4 feet, MAN). YAO POOLE MAKES IT! Assist: Tony Carter
Score: 88-62

[01:59] Team_009 possession (Score: 88-62)
Cole Mitchell attempts a Midrange. Contested by Jrue Lillard (5.5 feet, MAN). COLE MITCHELL MAKES IT! Assist: Miles Sabonis
Score: 88-64

[01:47] Team_056 possession (Score: 88-64)
Yao Poole attempts a 3Pt. Heavily contested by Miles Sabonis (1.8 feet, ZONE)! Yao Poole misses. Offensive rebound by Yao Poole! Yao Poole kicks it out.

[01:28] Team_056 possession (Score: 88-64)
Yao Poole attempts a Midrange. Contested by Kyle Brogdon (5.7 feet, MAN). Yao Poole misses. Rebound secured by Cole Mitchell.

[01:15] Team_009 possession (Score: 88-64)
Kyle Brogdon attempts a Layup. BLOCKED BY YAO POOLE! Ball goes out off Yao Poole. Kyle Brogdon's ball!

[01:01] Team_009 possession (Score: 88-64)
Desmond Harden loses the ball! Stripped by Magic Russell! TURNOVER! (live ball)

[00:47] Team_056 possession (Score: 88-64)
Yao Poole attempts a Midrange. Contested by Kyle Brogdon (4.7 feet, MAN). Yao Poole misses. Offensive rebound by Jrue Lillard! Jrue Lillard's putback is no good. Rebound secured by Cole Mitchell.

[00:34] Team_009 possession (Score: 88-64)
Cole Mitchell attempts a Midrange. Contested by Jrue Lillard (4.9 feet, ZONE). COLE MITCHELL MAKES IT! Assist: Anfernee Anunoby
Score: 88-66

[00:17] Team_056 possession (Score: 88-66)
Jrue Lillard attempts a 3Pt. Contested by Cole Mitchell (5.7 feet, MAN). Jrue Lillard misses. Rebound secured by Anfernee Anunoby.

[00:03] Team_009 possession (Score: 88-66)
Miles Sabonis attempts a Layup. Contested by Jrue Lillard (2.1 feet, ZONE). Miles Sabonis misses. Rebound secured by Tony Carter.

================================================================================
                              3RD QUARTER COMPLETE                              
================================================================================

3RD QUARTER SCORE: Team_056 29, Team_009 22

BOX SCORE:
================================================================================

Team_056
--------------------------------------------------------------------------------
Player                MIN  PTS  REB  AST  TO      FG   FG%      3P   3P%
--------------------------------------------------------------------------------
Giannis Jokic          28    8    0    0   0   3/5    60.0     0/0   0.0
Yao Poole              28    7    4    0   0   3/5    60.0     0/0   0.0
Magic Russell          28    6    0    2   0   3/6    50.0     0/0   0.0
Tony Carter            28    5    2    1   0   2/2   100.0     0/0   0.0
Jrue Lillard           28    3    4    1   0   2/3    66.7     0/0   0.0

TEAM: FG: 13/21 (61.9%), 3PT: 4/9 (44.4%), REB: 10 (3 off, 7 def), AST: 4, TO: 3
TEAM FOULS: 5 [Team_009 in BONUS]


Team_009
--------------------------------------------------------------------------------
Player                MIN  PTS  REB  AST  TO      FG   FG%      3P   3P%
--------------------------------------------------------------------------------
Cole Mitchell          28    9    3    0   0   4/6    66.7     0/0   0.0
Anfernee Anunoby       28    5    4    1   0   2/2   100.0     0/0   0.0
Miles Sabonis          28    4    0    1   0   2/5    40.0     0/0   0.0
Kyle Brogdon           28    2    1    1   0   1/4    25.0     0/0   0.0
Desmond Harden         28    2    0    0   0   1/2    50.0     0/0   0.0

TEAM: FG: 10/19 (52.6%), 3PT: 1/4 (25.0%), REB: 8 (1 off, 7 def), AST: 3, TO: 5
TEAM FOULS: 7 [Team_056 in BONUS]

================================================================================

================================================================================
                       4TH QUARTER - Team_056 vs Team_009                       
================================================================================

[12:00] Team_056 possession (Score: 88-66)
Magic Russell attempts a 3Pt. Contested by Miles Sabonis (4.6 feet, ZONE). Magic Russell misses. Rebound secured by Kyle Brogdon.

[11:46] Team_009 possession (Score: 88-66)
Kyle Brogdon attempts a Layup. BLOCKED BY YAO POOLE! Ball is loose! Rebound secured by Tony Carter.

[11:36] Team_056 possession (Score: 88-66)
Giannis Jokic attempts a Layup. BLOCKED BY KYLE BROGDON! Ball is loose! Rebound secured by Kyle Brogdon.

[11:23] Team_009 possession (Score: 88-66)
Desmond Harden drives, Magic Russell stays with him. Desmond Harden attempts a Layup. Wide open! Magic Russell is 6.8 feet away. [MAN] DESMOND HARDEN MAKES IT!
Score: 88-68

[11:12] Team_056 possession (Score: 88-68)
Giannis Jokic attempts a 3Pt. Wide open! Miles Sabonis is 7.4 feet away. [MAN] GIANNIS JOKIC MAKES IT!
Score: 91-68

[10:58] Team_009 possession (Score: 91-68)
Miles Sabonis makes the 3Pt and draws the foul on Giannis Jokic! And-1! Miles Sabonis to the line for 1. [Team fouls: 1] (Giannis Jokic: 1 personal fouls)   FT 1/1: GOOD Miles Sabonis makes 1/1 from the line.
Score: 91-72

[10:45] Team_056 possession (Score: 91-72)
Tony Carter attempts a Midrange. Wide open! Desmond Harden is 6.3 feet away. [ZONE] Tony Carter misses. Offensive rebound by Yao Poole! Yao Poole kicks it out.

[10:34] Team_056 possession (Score: 91-72)
Yao Poole attempts a 3Pt. Contested by Miles Sabonis (4.6 feet, ZONE). Yao Poole misses. Offensive rebound by Jrue Lillard! Jrue Lillard puts it back in!
Score: 93-72

[10:17] Team_009 possession (Score: 93-72)
Miles Sabonis drives and kicks out. Cole Mitchell attempts a 3Pt. Contested by Tony Carter (5.5 feet, ZONE). Cole Mitchell misses. Rebound secured by Jrue Lillard.

[10:01] Team_056 possession (Score: 93-72)
Jrue Lillard attempts a Layup. Wide open! Cole Mitchell is 6.3 feet away. [MAN] Jrue Lillard misses. Rebound secured by Anfernee Anunoby.

[09:47] Team_009 possession (Score: 93-72)
Anfernee Anunoby makes the Layup and draws the foul on Tony Carter! And-1! Anfernee Anunoby to the line for 1. [Team fouls: 2] (Tony Carter: 1 personal fouls)   FT 1/1: GOOD Anfernee Anunoby makes 1/1 from the line.
Score: 93-75

[09:33] Team_056 possession (Score: 93-75)
FOUL! Holding foul on Miles Sabonis. [Team fouls: 1] No free throws, side out. (Miles Sabonis: 1 personal fouls)

[09:14] Team_056 possession (Score: 93-75)
Tony Carter drives to the basket... Tony Carter throws a bad pass out of bounds! TURNOVER! (dead ball)

[09:14] Substitution (Team_056): Giannis Jokic OUT → De'Aaron Murray IN (stamina_rule2)

[09:14] Substitution (Team_056): Magic Russell OUT → Damian Barrett IN (stamina_rule2)

[09:14] Substitution (Team_056): Tony Carter OUT → CJ Anthony IN (stamina_rule2)

[09:14] Substitution (Team_056): Jrue Lillard OUT → RJ Johnson IN (stamina_rule2)

[09:14] Substitution (Team_056): Yao Poole OUT → Derrick Bane IN (stamina_rule2)

[09:14] Substitution (Team_009): Miles Sabonis OUT → Paul Trent IN (stamina_rule2)

[09:14] Substitution (Team_009): Desmond Harden OUT → Evan Curry IN (stamina_rule2)

[09:14] Substitution (Team_009): Anfernee Anunoby OUT → RJ Jokic IN (stamina_rule2)

[09:14] Substitution (Team_009): Cole Mitchell OUT → Kawhi Herro IN (stamina_rule2)

[09:14] Substitution (Team_009): Kyle Brogdon OUT → Shaquille Green IN (stamina_rule2)

[08:57] Team_009 possession (Score: 93-75)
Evan Curry attempts a Midrange. Wide open! Damian Barrett is 6.8 feet away. [MAN] Evan Curry misses. Rebound secured by CJ Anthony.

[08:38] Team_056 possession (Score: 93-75)
RJ Johnson drives, Kawhi Herro stays with him. RJ Johnson attempts a Dunk. Contested by Kawhi Herro (3.1 feet, MAN). RJ JOHNSON MAKES IT!
Score: 95-75

[08:24] Team_009 possession (Score: 95-75)
Shaquille Green makes the Layup and draws the foul on Derrick Bane! And-1! Shaquille Green to the line for 1. [Team fouls: 3] (Derrick Bane: 1 personal fouls)   FT 1/1: GOOD Shaquille Green makes 1/1 from the line.
Score: 95-78

[08:08] Team_056 possession (Score: 95-78)
De'Aaron Murray commits a violation (traveling/carry)! TURNOVER! (dead ball)

[07:55] Team_009 possession (Score: 95-78)
Evan Curry attempts a Midrange. Contested by CJ Anthony (3.4 feet, ZONE). Evan Curry misses. Offensive rebound by Kawhi Herro! Kawhi Herro puts it back in!
Score: 95-80

[07:42] Team_056 possession (Score: 95-80)
RJ Johnson attempts a 3Pt. Contested by Paul Trent (3.7 feet, ZONE). RJ Johnson misses. Rebound secured by RJ Jokic.

[07:24] Team_009 possession (Score: 95-80)
Evan Curry attempts a 3Pt. Contested by Damian Barrett (3.7 feet, MAN). Evan Curry misses. Rebound secured by CJ Anthony.

[07:08] Team_056 possession (Score: 95-80)
FOUL! Holding foul on RJ Jokic. [Team fouls: 2] No free throws, side out. (RJ Jokic: 1 personal fouls)

[06:49] Team_056 possession (Score: 95-80)
Derrick Bane attempts a Midrange. Contested by Evan Curry (5.8 feet, ZONE). Derrick Bane misses. Offensive rebound by CJ Anthony! CJ Anthony kicks it out.

[06:32] Team_056 possession (Score: 95-80)
RJ Johnson attempts a 3Pt. Wide open! Paul Trent is 6.4 feet away. [ZONE] RJ Johnson misses. Offensive rebound by RJ Johnson! RJ Johnson kicks it out.

[06:17] Team_056 possession (Score: 95-80)
Damian Barrett attempts a 3Pt. Wide open! Evan Curry is 8.3 feet away. [MAN] Damian Barrett misses. Rebound secured by Kawhi Herro.

[06:02] Team_009 possession (Score: 95-80)
RJ Jokic attempts a Midrange. Contested by CJ Anthony (4.6 feet, MAN). RJ Jokic misses. Rebound secured by CJ Anthony.

[05:47] Team_056 possession (Score: 95-80)
Damian Barrett attempts a Midrange. Contested by Evan Curry (4.7 feet, MAN). DAMIAN BARRETT MAKES IT!
Score: 97-80

[05:37] Team_009 possession (Score: 97-80)
FOUL! Reach-in foul on RJ Johnson during the drive. [Team fouls: 4] No free throws, side out. (RJ Johnson: 1 personal fouls)

[05:21] Team_009 possession (Score: 97-80)
FOUL! Reach-in foul on CJ Anthony during the drive. [IN THE BONUS! 5 team fouls] RJ Jokic to the line for 2 free throws. (CJ Anthony: 1 personal fouls)   FT 1/2: MISS   FT 2/2: GOOD RJ Jokic makes 1/2 from the line.
Score: 97-81

[05:06] Team_056 possession (Score: 97-81)
De'Aaron Murray attempts a 3Pt. Wide open! Paul Trent is 9.3 feet away. [MAN] DE'AARON MURRAY MAKES IT!
Score: 100-81

[04:48] Team_009 possession (Score: 100-81)
FOUL! Reach-in foul on RJ Johnson during the drive. [IN THE BONUS! 6 team fouls] Kawhi Herro to the line for 2 free throws. (RJ Johnson: 2 personal fouls)   FT 1/2: GOOD   FT 2/2: GOOD Kawhi Herro makes 2/2 from the line.
Score: 100-83

[04:34] Team_056 possession (Score: 100-83)
Damian Barrett attempts a 3Pt. Heavily contested by Evan Curry (0.5 feet, ZONE)! Damian Barrett misses. Rebound secured by Kawhi Herro.

[04:19] Team_009 possession (Score: 100-83)
Kawhi Herro loses control! Ball rolls out of bounds! TURNOVER! (dead ball)

[04:04] Team_056 possession (Score: 100-83)
CJ Anthony drives to the basket... FOUL! Offensive foul on CJ Anthony! Kawhi Herro drew the charge! [Team fouls: 7] (CJ Anthony: 2 personal fouls) TURNOVER! (dead ball)

[03:48] Team_009 possession (Score: 100-83)
Shaquille Green attempts a Layup. Contested by Derrick Bane (5.4 feet, MAN). Shaquille Green misses. Rebound secured by RJ Johnson.

[03:29] Team_056 possession (Score: 100-83)
Derrick Bane attempts a 3Pt. Contested by Paul Trent (2.1 feet, ZONE). Derrick Bane misses. Rebound secured by RJ Jokic.

[03:20] Team_009 possession (Score: 100-83)
Kawhi Herro attempts a Midrange. Contested by RJ Johnson (5.5 feet, MAN). KAWHI HERRO MAKES IT! Assist: Shaquille Green
Score: 100-85

[03:10] Team_056 possession (Score: 100-85)
Derrick Bane attempts a Midrange. Wide open! Shaquille Green is 7.3 feet away. [ZONE] DERRICK BANE MAKES IT!
Score: 102-85

[02:59] Team_009 possession (Score: 102-85)
Paul Trent attempts a 3Pt. Contested by De'Aaron Murray (4.5 feet, ZONE). PAUL TRENT MAKES IT! Assist: Kawhi Herro
Score: 102-88

[02:45] Team_056 possession (Score: 102-88)
Damian Barrett attempts a Midrange. Contested by Kawhi Herro (4.4 feet, ZONE). Damian Barrett misses. Rebound secured by RJ Jokic.

[02:32] Team_009 possession (Score: 102-88)
RJ Jokic drives, RJ Johnson stays with him. RJ Jokic attempts a Layup. Wide open! RJ Johnson is 6.2 feet away. [ZONE] RJ JOKIC MAKES IT! Assist: Paul Trent
Score: 102-90

[02:19] Team_056 possession (Score: 102-90)
De'Aaron Murray attempts a Layup. Contested by Kawhi Herro (2.5 feet, ZONE). DE'AARON MURRAY MAKES IT! Assist: RJ Johnson
Score: 104-90

[02:04] Team_009 possession (Score: 104-90)
Shaquille Green attempts a 3Pt. Contested by Derrick Bane (5.2 feet, MAN). Shaquille Green misses. Rebound secured by CJ Anthony.

[01:54] Team_056 possession (Score: 104-90)
RJ Johnson drives to the basket... RJ Johnson loses the ball! Stripped by Kawhi Herro! TURNOVER! (live ball)

[01:41] Team_009 possession (Score: 104-90)
Kawhi Herro attempts a 3Pt. Contested by De'Aaron Murray (5.1 feet, ZONE). Kawhi Herro misses. Rebound secured by RJ Johnson.

[01:25] Team_056 possession (Score: 104-90)
Damian Barrett attempts a Layup. BLOCKED BY SHAQUILLE GREEN! Ball deflects out of bounds off Damian Barrett.

[01:13] Team_009 possession (Score: 104-90)
FOUL! Holding foul on Damian Barrett. [IN THE BONUS! 8 team fouls] Evan Curry to the line for 2 free throws. (Damian Barrett: 1 personal fouls)   FT 1/2: GOOD   FT 2/2: GOOD Evan Curry makes 2/2 from the line.
Score: 104-92

[01:00] Team_056 possession (Score: 104-92)
De'Aaron Murray attempts a 3Pt. Wide open! Paul Trent is 7.2 feet away. [ZONE] De'Aaron Murray misses. Offensive rebound by RJ Johnson! RJ Johnson kicks it out.

[00:45] Team_056 possession (Score: 104-92)
RJ Johnson attempts a Midrange. Contested by Kawhi Herro (2.9 feet, MAN). RJ Johnson misses. Rebound secured by Shaquille Green.

[00:27] Team_009 possession (Score: 104-92)
Kawhi Herro attempts a 3Pt. Wide open! RJ Johnson is 6.9 feet away. [MAN] Kawhi Herro misses. Rebound secured by CJ Anthony.

[00:09] Team_056 possession (Score: 104-92)
Damian Barrett attempts a 3Pt. Contested by Evan Curry (3.7 feet, MAN). Damian Barrett misses. Rebound secured by Kawhi Herro.

================================================================================
                              4TH QUARTER COMPLETE                              
================================================================================

4TH QUARTER SCORE: Team_056 16, Team_009 26

BOX SCORE:
================================================================================

Team_056
--------------------------------------------------------------------------------
Player                MIN  PTS  REB  AST  TO      FG   FG%      3P   3P%
--------------------------------------------------------------------------------
De'Aaron Murray        18    5    0    0   0   2/2   100.0     0/0   0.0
Giannis Jokic          31    3    0    0   0   1/2    50.0     0/0   0.0
Jrue Lillard           31    2    2    0   0   1/2    50.0     0/0   0.0
RJ Johnson             18    2    4    1   0   1/3    33.3     0/0   0.0
Damian Barrett         18    2    0    0   0   1/6    16.7     0/0   0.0
Derrick Bane           18    2    0    0   0   1/2    50.0     0/0   0.0
Magic Russell          31    0    0    0   0   0/1     0.0     0/0   0.0
Tony Carter            31    0    1    0   0   0/0     0.0     0/0   0.0
Yao Poole              31    0    1    0   0   0/0     0.0     0/0   0.0
CJ Anthony             18    0    6    0   0   0/0     0.0     0/0   0.0

TEAM: FG: 7/18 (38.9%), 3PT: 3/9 (33.3%), REB: 14 (5 off, 9 def), AST: 1, TO: 4
TEAM FOULS: 8 [Team_009 in BONUS]


Team_009
--------------------------------------------------------------------------------
Player                MIN  PTS  REB  AST  TO      FG   FG%      3P   3P%
--------------------------------------------------------------------------------
Kawhi Herro            18    6    4    1   0   3/5    60.0     0/0   0.0
Miles Sabonis          31    4    0    0   0   1/2    50.0     0/0   0.0
Anfernee Anunoby       31    3    1    0   0   1/1   100.0     0/0   0.0
Shaquille Green        18    3    1    1   0   1/3    33.3     0/0   0.0
RJ Jokic               18    3    3    0   0   2/3    66.7     0/0   0.0
Paul Trent             18    3    0    1   0   1/1   100.0     0/0   0.0
Desmond Harden         31    2    0    0   0   1/1   100.0     0/0   0.0
Evan Curry             18    2    0    0   0   1/3    33.3     0/0   0.0
Kyle Brogdon           31    0    2    0   0   0/1     0.0     0/0   0.0

TEAM: FG: 11/20 (55.0%), 3PT: 2/6 (33.3%), REB: 11 (1 off, 10 def), AST: 3, TO: 1
TEAM FOULS: 2

================================================================================

================================================================================
                               FULL GAME COMPLETE                               
================================================================================

FINAL SCORE: Team_056 104, Team_009 92

SCORING BY QUARTER:
--------------------------------------------------------------------------------
Team                     Q1     Q2     Q3     Q4    FINAL
--------------------------------------------------------------------------------
Team_056                 22     37     29     16      104
Team_009                 22     22     22     26       92
--------------------------------------------------------------------------------

FULL GAME BOX SCORE:
================================================================================

Team_056
--------------------------------------------------------------------------------
Player                MIN  PTS  REB  AST  TO      FG   FG%      3P   3P%      FT STL BLK
--------------------------------------------------------------------------------
Giannis Jokic          31   19    0    0   1   7/15   46.7   4/9    44.4   1/1     0   1
Magic Russell          31    8    0    2   3   5/10   50.0   0/5     0.0   2/2     2   0
Tony Carter            31   20    5    3   0   9/13   69.2   3/5    60.0   6/7     0   0
Jrue Lillard           31    9   12    2   0   1/4    25.0   0/2     0.0   1/2     1   3
Yao Poole              31    7   10    2   4   4/7    57.1   2/2   100.0   2/3     1   2
De'Aaron Murray        18    8    0    3   1   3/3   100.0   2/2   100.0   0/0     0   0
Damian Barrett         18   11    0    2   3   2/7    28.6   1/4    25.0   0/0     0   0
CJ Anthony             18   12   10    0   1   6/6   100.0   2/2   100.0   0/0     0   0
RJ Johnson             18    4    7    3   1   3/5    60.0   0/1     0.0   0/0     0   0
Derrick Bane           18    4    4    1   1   2/4    50.0   0/2     0.0   0/0     0   0

TEAM: FG: 44/76 (57.9%), 3PT: 14/34 (41.2%), REB: 47 (14 off, 33 def), AST: 18, TO: 15


Team_009
--------------------------------------------------------------------------------
Player                MIN  PTS  REB  AST  TO      FG   FG%      3P   3P%      FT STL BLK
--------------------------------------------------------------------------------
Miles Sabonis          31   13    0    1   1   5/11   45.5   2/6    33.3   5/6     2   0
Desmond Harden         31    9    0    0   3   5/9    55.6   1/4    25.0   0/0     0   0
Anfernee Anunoby       31   15    9    2   1   6/7    85.7   0/0     0.0   5/5     0   0
Cole Mitchell          31   14    7    2   1   7/11   63.6   1/1   100.0   3/3     0   0
Kyle Brogdon           31    8    9    3   4   2/10   20.0   0/0     0.0   4/4     1   1
Paul Trent             18    4    0    2   1   2/3    66.7   1/2    50.0   1/2     0   0
Evan Curry             18    8    0    0   0   3/9    33.3   2/6    33.3   5/5     1   0
RJ Jokic               18    3    3    0   0   2/5    40.0   0/2     0.0   1/2     0   0
Kawhi Herro            18   11    5    1   1   4/6    66.7   0/2     0.0   3/3     1   0
Shaquille Green        18    7    2    1   1   2/5    40.0   1/2    50.0   2/2     0   1

TEAM: FG: 39/77 (50.6%), 3PT: 8/25 (32.0%), REB: 36 (6 off, 30 def), AST: 12, TO: 13

================================================================================
