================================================================================
                        FULL GAME - Team_023 vs Team_044                        
================================================================================

================================================================================
                       1ST QUARTER - Team_023 vs Team_044                       
================================================================================

[12:00] Team_023 possession (Score: 0-0)
Tim Bane drives and kicks out. FOUL! Shooting foul on Isaiah Murray. Collin Ginobili to the line for 3 free throws. [Team fouls: 1] (Isaiah Murray: 1 personal fouls)   FT 1/3: GOOD   FT 2/3: GOOD   FT 3/3: GOOD Collin Ginobili makes 3/3 from the line.
Score: 3-0

[11:48] Team_044 possession (Score: 3-0)
Victor Westbrook attempts a 3Pt. Contested by Kyle Paul (3.2 feet, MAN). Victor Westbrook misses. Rebound secured by Tim Bane.

[11:32] Team_023 possession (Score: 3-0)
Josh Morant attempts a 3Pt. Contested by Karl Fox (3.0 feet, MAN). Josh Morant misses. Offensive rebound by Tim Bane! Tim Bane puts it back in!
Score: 5-0

[11:20] Team_044 possession (Score: 5-0)
Ayo McCollum drives, Tim Bane stays with him. Ayo McCollum attempts a Dunk. Contested by Tim Bane (3.6 feet, MAN). AYO MCCOLLUM MAKES IT! Assist: Victor Westbrook
Score: 5-2

[11:03] Team_023 possession (Score: 5-2)
Kyle Paul attempts a Midrange. Wide open! Victor Westbrook is 9.2 feet away. [MAN] KYLE PAUL MAKES IT!
Score: 7-2

[10:48] Team_044 possession (Score: 7-2)
Ayo McCollum makes the 3Pt and draws the foul on Tim Bane! And-1! Ayo McCollum to the line for 1. [Team fouls: 1] (Tim Bane: 1 personal fouls)   FT 1/1: MISS Ayo McCollum makes 0/1 from the line. Offensive rebound by Ayo McCollum! Ayo McCollum's putback is no good.
Score: 7-5

[10:37] Team_023 possession (Score: 7-5)
FOUL! Reach-in foul on Ayo McCollum during the drive. [Team fouls: 2] No free throws, side out. (Ayo McCollum: 1 personal fouls)

[10:17] Team_023 possession (Score: 7-5)
Trae Ingram drives to the basket... FOUL! Offensive foul on Trae Ingram! Ayo McCollum drew the charge! [Team fouls: 2] (Trae Ingram: 1 personal fouls) TURNOVER! (dead ball)

[10:04] Team_044 possession (Score: 7-5)
Isaiah Murray attempts a 3Pt. Contested by Collin Ginobili (2.7 feet, MAN). Isaiah Murray misses. Rebound secured by Tim Bane.

[09:51] Team_023 possession (Score: 7-5)
Collin Ginobili attempts a 3Pt. Contested by Isaiah Murray (4.5 feet, MAN). Collin Ginobili misses. Rebound secured by Victor Westbrook.

[09:37] Team_044 possession (Score: 7-5)
Zach McGrady attempts a 3Pt. Contested by Trae Ingram (4.0 feet, MAN). Zach McGrady misses. Rebound secured by Josh Morant.

[09:25] Team_023 possession (Score: 7-5)
Josh Morant attempts a Midrange. Wide open! Karl Fox is 6.2 feet away. [MAN] Josh Morant misses. Offensive rebound by Tim Bane! Tim Bane's putback is no good. Offensive rebound by Josh Morant! Josh Morant kicks it out.

[09:12] Team_023 possession (Score: 7-5)
FOUL! Shooting foul on Karl Fox. Josh Morant to the line for 2 free throws. [Team fouls: 3] (Karl Fox: 1 personal fouls)   FT 1/2: MISS   FT 2/2: MISS Josh Morant makes 0/2 from the line. Rebound secured by Victor Westbrook.

[08:57] Team_044 possession (Score: 7-5)
FOUL! Shooting foul on Kyle Paul. Victor Westbrook to the line for 3 free throws. [Team fouls: 3] (Kyle Paul: 1 personal fouls)   FT 1/3: GOOD   FT 2/3: GOOD   FT 3/3: GOOD Victor Westbrook makes 3/3 from the line.
Score: 7-8

[08:42] Team_023 possession (Score: 7-8)
Josh Morant drives and kicks out. Josh Morant attempts a Midrange. Contested by Karl Fox (2.9 feet, MAN). Josh Morant misses. FOUL! Loose ball foul on Victor Westbrook during the rebound battle. [Team fouls: 4] No free throws, side out. (Victor Westbrook: 1 personal fouls)

[08:24] Team_023 possession (Score: 7-8)
Kyle Paul attempts a 3Pt. Contested by Victor Westbrook (4.0 feet, MAN). KYLE PAUL MAKES IT! Assist: Collin Ginobili
Score: 10-8

[08:12] Team_044 possession (Score: 10-8)
Zach McGrady attempts a 3Pt. Contested by Trae Ingram (5.9 feet, MAN). Zach McGrady misses. FOUL! Loose ball foul on Josh Morant during the rebound battle. [Team fouls: 4] No free throws, side out. (Josh Morant: 1 personal fouls)

[07:54] Team_044 possession (Score: 10-8)
Karl Fox drives and kicks out. Victor Westbrook attempts a 3Pt. Heavily contested by Kyle Paul (0.5 feet, ZONE)! Victor Westbrook misses. Rebound secured by Tim Bane.

[07:38] Team_023 possession (Score: 10-8)
Josh Morant attempts a 3Pt. Contested by Isaiah Murray (4.3 feet, ZONE). JOSH MORANT MAKES IT! Assist: Collin Ginobili
Score: 13-8

[07:24] Team_044 possession (Score: 13-8)
Karl Fox attempts a 3Pt. Contested by Josh Morant (2.0 feet, MAN). Karl Fox misses. Rebound secured by Tim Bane.

[07:06] Team_023 possession (Score: 13-8)
Collin Ginobili attempts a 3Pt. Wide open! Isaiah Murray is 6.3 feet away. [ZONE] COLLIN GINOBILI MAKES IT! Assist: Josh Morant
Score: 16-8

[06:52] Team_044 possession (Score: 16-8)
FOUL! Reach-in foul on Tim Bane during the drive. [IN THE BONUS! 5 team fouls] Ayo McCollum to the line for 2 free throws. (Tim Bane: 2 personal fouls)   FT 1/2: GOOD   FT 2/2: GOOD Ayo McCollum makes 2/2 from the line.
Score: 16-10

[06:41] Team_023 possession (Score: 16-10)
Trae Ingram attempts a 3Pt. Contested by Isaiah Murray (3.8 feet, ZONE). Trae Ingram misses. Rebound secured by Victor Westbrook.

[06:28] Team_044 possession (Score: 16-10)
Isaiah Murray attempts a 3Pt. Contested by Kyle Paul (5.3 feet, ZONE). Isaiah Murray misses. Rebound secured by Tim Bane.

[06:13] Team_023 possession (Score: 16-10)
FOUL! Holding foul on Isaiah Murray. [IN THE BONUS! 5 team fouls] Collin Ginobili to the line for 2 free throws. (Isaiah Murray: 2 personal fouls)   FT 1/2: MISS   FT 2/2: GOOD Collin Ginobili makes 1/2 from the line.
Score: 17-10

[06:01] Team_044 possession (Score: 17-10)
Isaiah Murray attempts a Midrange. Contested by Collin Ginobili (3.7 feet, MAN). Isaiah Murray misses. Offensive rebound by Victor Westbrook! Victor Westbrook kicks it out.

[05:45] Team_044 possession (Score: 17-10)
Victor Westbrook attempts a 3Pt. Contested by Kyle Paul (3.8 feet, ZONE). Victor Westbrook misses. Rebound secured by Tim Bane.

[05:32] Team_023 possession (Score: 17-10)
Kyle Paul drives, picks up Ayo McCollum. Help arrives from Zach McGrady! Kyle Paul attempts a Dunk. Wide open! Zach McGrady is 7.5 feet away. [ZONE] KYLE PAUL MAKES IT!
Score: 19-10

[05:17] Team_044 possession (Score: 19-10)
Ayo McCollum drives, Tim Bane stays with him. Ayo McCollum attempts a Dunk. Contested by Tim Bane (5.3 feet, ZONE). AYO MCCOLLUM MAKES IT! Assist: Isaiah Murray
Score: 19-12

[05:02] Team_023 possession (Score: 19-12)
FOUL! Shooting foul on Zach McGrady. Trae Ingram to the line for 2 free throws. [BONUS: 6 team fouls] (Zach McGrady: 1 personal fouls)   FT 1/2: GOOD   FT 2/2: GOOD Trae Ingram makes 2/2 from the line.
Score: 21-12

[04:46] Team_044 possession (Score: 21-12)
FOUL! Offensive foul on Ayo McCollum! Tim Bane drew the charge! [Team fouls: 7] (Ayo McCollum: 2 personal fouls) TURNOVER! (dead ball)

[04:27] Team_023 possession (Score: 21-12)
Josh Morant drives, Karl Fox stays with him. Josh Morant attempts a Layup. Wide open! Karl Fox is 6.1 feet away. [MAN] JOSH MORANT MAKES IT! Assist: Tim Bane
Score: 23-12

[04:16] Team_044 possession (Score: 23-12)
Ayo McCollum drives, Tim Bane stays with him. Ayo McCollum attempts a Dunk. Wide open! Tim Bane is 6.7 feet away. [MAN] Ayo McCollum misses. Offensive rebound by Victor Westbrook! Victor Westbrook kicks it out.

[04:03] Team_044 possession (Score: 23-12)
Ayo McCollum attempts a Midrange. Heavily contested by Kyle Paul (1.2 feet, ZONE)! Ayo McCollum misses. Rebound secured by Josh Morant.

[03:48] Team_023 possession (Score: 23-12)
Collin Ginobili attempts a 3Pt. Wide open! Isaiah Murray is 6.4 feet away. [ZONE] Collin Ginobili misses. Rebound secured by Ayo McCollum.

[03:32] Team_044 possession (Score: 23-12)
Ayo McCollum drives to the basket... Ayo McCollum loses the ball! Stripped by Tim Bane! TURNOVER! (live ball)

[03:18] Team_023 possession (Score: 23-12)
Kyle Paul attempts a Layup. Contested by Victor Westbrook (5.7 feet, MAN). KYLE PAUL MAKES IT!
Score: 25-12

[03:04] Team_044 possession (Score: 25-12)
Isaiah Murray drives, picks up Collin Ginobili. Help arrives from Kyle Paul! Isaiah Murray attempts a Layup. Contested by Kyle Paul (5.9 feet, MAN). ISAIAH MURRAY MAKES IT! Assist: Ayo McCollum
Score: 25-14

[02:48] Team_023 possession (Score: 25-14)
Josh Morant attempts a 3Pt. Wide open! Isaiah Murray is 8.8 feet away. [ZONE] JOSH MORANT MAKES IT!
Score: 28-14

[02:32] Team_044 possession (Score: 28-14)
Victor Westbrook attempts a 3Pt. Contested by Kyle Paul (2.4 feet, ZONE). Victor Westbrook misses. Rebound secured by Josh Morant.

[02:16] Team_023 possession (Score: 28-14)
FOUL! Shooting foul on Karl Fox. Josh Morant to the line for 2 free throws. [BONUS: 8 team fouls] (Karl Fox: 2 personal fouls)   FT 1/2: GOOD   FT 2/2: MISS Josh Morant makes 1/2 from the line. Rebound secured by Ayo McCollum.
Score: 29-14

[02:06] Team_044 possession (Score: 29-14)
Karl Fox attempts a 3Pt. Contested by Josh Morant (5.2 feet, ZONE). Karl Fox misses. Rebound secured by Kyle Paul.

[01:49] Team_023 possession (Score: 29-14)
Trae Ingram attempts a Midrange. Contested by Zach McGrady (3.3 feet, MAN). Trae Ingram misses. Rebound secured by Ayo McCollum.

[01:33] Team_044 possession (Score: 29-14)
Karl Fox attempts a 3Pt. Contested by Kyle Paul (2.1 feet, ZONE). Karl Fox misses. Rebound secured by Kyle Paul.

[01:20] Team_023 possession (Score: 29-14)
Tim Bane attempts a Midrange. Wide open! Ayo McCollum is 6.2 feet away. [MAN] Tim Bane misses. Rebound secured by Ayo McCollum.

[01:04] Team_044 possession (Score: 29-14)
Zach McGrady attempts a 3Pt. Heavily contested by Kyle Paul (1.1 feet, ZONE)! Zach McGrady misses. Rebound secured by Kyle Paul.

[00:52] Team_023 possession (Score: 29-14)
Collin Ginobili drives, picks up Isaiah Murray. Help arrives from Victor Westbrook! Collin Ginobili attempts a Dunk. Heavily contested by Victor Westbrook (1.5 feet, MAN)! COLLIN GINOBILI MAKES IT! Assist: Tim Bane
Score: 31-14

[00:41] Team_044 possession (Score: 31-14)
FOUL! Shooting foul on Tim Bane. Victor Westbrook to the line for 2 free throws. [BONUS: 6 team fouls] (Tim Bane: 3 personal fouls)   FT 1/2: GOOD   FT 2/2: MISS Victor Westbrook makes 1/2 from the line. Rebound secured by Josh Morant.
Score: 31-15

[00:25] Team_023 possession (Score: 31-15)
Josh Morant attempts a 3Pt. Contested by Karl Fox (3.4 feet, MAN). Josh Morant misses. Rebound secured by Ayo McCollum.

[00:15] Team_044 possession (Score: 31-15)
Ayo McCollum attempts a Midrange. Wide open! Josh Morant is 6.6 feet away. [ZONE] AYO MCCOLLUM MAKES IT! Assist: Karl Fox
Score: 31-17

[00:01] Team_023 possession (Score: 31-17)
FOUL! Shooting foul on Zach McGrady. Trae Ingram to the line for 2 free throws. [BONUS: 9 team fouls] (Zach McGrady: 2 personal fouls)   FT 1/2: GOOD   FT 2/2: GOOD Trae Ingram makes 2/2 from the line.
Score: 33-17

================================================================================
                              1ST QUARTER COMPLETE                              
================================================================================

1ST QUARTER SCORE: Team_023 33, Team_044 17

BOX SCORE:
================================================================================

Team_023
--------------------------------------------------------------------------------
Player                MIN  PTS  REB  AST  TO      FG   FG%      3P   3P%
--------------------------------------------------------------------------------
Collin Ginobili        12    9    0    2   0   4/6    66.7     0/0   0.0
Kyle Paul              12    9    3    0   0   4/4   100.0     0/0   0.0
Josh Morant            12    8    6    1   0   3/6    50.0     0/0   0.0
Trae Ingram            12    4    0    0   0   2/4    50.0     0/0   0.0
Tim Bane               12    2    7    2   0   1/2    50.0     0/0   0.0

TEAM: FG: 14/22 (63.6%), 3PT: 5/9 (55.6%), REB: 17 (3 off, 14 def), AST: 5, TO: 1
TEAM FOULS: 6 [Team_044 in BONUS]


Team_044
--------------------------------------------------------------------------------
Player                MIN  PTS  REB  AST  TO      FG   FG%      3P   3P%
--------------------------------------------------------------------------------
Ayo McCollum           12    8    6    1   0   4/6    66.7     0/0   0.0
Victor Westbrook       12    3    6    1   0   1/5    20.0     0/0   0.0
Isaiah Murray          12    2    0    1   0   1/3    33.3     0/0   0.0
Zach McGrady           12    0    0    0   0   0/2     0.0     0/0   0.0
Karl Fox               12    0    0    1   0   0/4     0.0     0/0   0.0

TEAM: FG: 6/20 (30.0%), 3PT: 1/12 (8.3%), REB: 11 (3 off, 8 def), AST: 4, TO: 2
TEAM FOULS: 9 [Team_023 in BONUS]

================================================================================

================================================================================
                       2ND QUARTER - Team_023 vs Team_044                       
================================================================================

[12:00] Team_023 possession (Score: 33-17)
Collin Ginobili attempts a 3Pt. Contested by Isaiah Murray (4.0 feet, ZONE). Collin Ginobili misses. Rebound secured by Karl Fox.

[11:49] Team_044 possession (Score: 33-17)
Ayo McCollum drives to the basket... FOUL! Offensive foul on Ayo McCollum! Tim Bane drew the charge! [Team fouls: 1] (Ayo McCollum: 1 personal fouls) TURNOVER! (dead ball)

[11:35] Team_023 possession (Score: 33-17)
Kyle Paul attempts a Layup. Contested by Victor Westbrook (3.2 feet, MAN). Kyle Paul misses. Offensive rebound by Josh Morant! Josh Morant kicks it out.

[11:16] Team_023 possession (Score: 33-17)
Collin Ginobili attempts a 3Pt. Contested by Isaiah Murray (5.4 feet, MAN). Collin Ginobili misses. Rebound secured by Victor Westbrook.

[10:59] Team_044 possession (Score: 33-17)
Victor Westbrook attempts a Layup. Contested by Tim Bane (4.9 feet, ZONE). VICTOR WESTBROOK MAKES IT!
Score: 33-19

[10:44] Team_023 possession (Score: 33-19)
Josh Morant drives and kicks out. Collin Ginobili attempts a 3Pt. Contested by Isaiah Murray (3.0 feet, MAN). Collin Ginobili misses. Rebound secured by Ayo McCollum.

[10:30] Team_044 possession (Score: 33-19)
Ayo McCollum drives, Tim Bane stays with him. Ayo McCollum attempts a Dunk. Contested by Tim Bane (3.2 feet, MAN). AYO MCCOLLUM MAKES IT! Assist: Victor Westbrook
Score: 33-21

[10:15] Team_023 possession (Score: 33-21)
Trae Ingram attempts a 3Pt. Contested by Isaiah Murray (5.2 feet, ZONE). TRAE INGRAM MAKES IT! Assist: Kyle Paul
Score: 36-21

[10:00] Team_044 possession (Score: 36-21)
FOUL! Shooting foul on Collin Ginobili. Isaiah Murray to the line for 2 free throws. [Team fouls: 1] (Collin Ginobili: 1 personal fouls)   FT 1/2: GOOD   FT 2/2: MISS Isaiah Murray makes 1/2 from the line. Rebound secured by Kyle Paul.
Score: 36-22

[09:49] Team_023 possession (Score: 36-22)
Josh Morant attempts a 3Pt. Contested by Karl Fox (2.4 feet, MAN). JOSH MORANT MAKES IT!
Score: 39-22

[09:37] Team_044 possession (Score: 39-22)
Zach McGrady attempts a Layup. BLOCKED BY TIM BANE! Ball deflects out of bounds off Zach McGrady.

[09:22] Team_023 possession (Score: 39-22)
Kyle Paul attempts a 3Pt. Contested by Victor Westbrook (4.4 feet, MAN). KYLE PAUL MAKES IT!
Score: 42-22

[09:09] Team_044 possession (Score: 42-22)
Zach McGrady throws a bad pass out of bounds! TURNOVER! (dead ball)

[09:09] Substitution (Team_023): Trae Ingram OUT → Tracy Anthony IN (stamina_rule2)

[09:09] Substitution (Team_023): Collin Ginobili OUT → Magic Booker IN (stamina_rule2)

[09:09] Substitution (Team_023): Kyle Paul OUT → Gary Westbrook IN (stamina_rule2)

[09:09] Substitution (Team_023): Josh Morant OUT → Evan Parker IN (stamina_rule2)

[09:09] Substitution (Team_023): Tim Bane OUT → Vince Gasol IN (stamina_rule2)

[09:09] Substitution (Team_044): Zach McGrady OUT → Kyrie Poole IN (stamina_rule2)

[09:09] Substitution (Team_044): Isaiah Murray OUT → Tim Towns IN (stamina_rule2)

[09:09] Substitution (Team_044): Victor Westbrook OUT → Tim Siakam IN (stamina_rule2)

[09:09] Substitution (Team_044): Karl Fox OUT → Pau Quickley IN (stamina_rule2)

[09:09] Substitution (Team_044): Ayo McCollum OUT → Victor Anthony IN (stamina_rule2)

[08:53] Team_023 possession (Score: 42-22)
Tracy Anthony drives and kicks out. Evan Parker attempts a 3Pt. Heavily contested by Pau Quickley (1.2 feet, MAN)! Evan Parker misses. Rebound secured by Victor Anthony.

[08:38] Team_044 possession (Score: 42-22)
Tim Towns attempts a 3Pt. Contested by Magic Booker (5.4 feet, MAN). Tim Towns misses. Rebound secured by Gary Westbrook.

[08:24] Team_023 possession (Score: 42-22)
Vince Gasol attempts a Midrange. Contested by Pau Quickley (5.5 feet, ZONE). Vince Gasol misses. Rebound secured by Pau Quickley.

[08:13] Team_044 possession (Score: 42-22)
Pau Quickley attempts a Midrange. Wide open! Gary Westbrook is 6.7 feet away. [ZONE] Pau Quickley misses. Rebound secured by Gary Westbrook.

[07:56] Team_023 possession (Score: 42-22)
Magic Booker attempts a 3Pt. Contested by Tim Siakam (2.3 feet, ZONE). Magic Booker misses. Offensive rebound by Vince Gasol! Vince Gasol's putback is no good. Offensive rebound by Vince Gasol! Vince Gasol kicks it out.

[07:43] Team_023 possession (Score: 42-22)
Gary Westbrook attempts a 3Pt. Heavily contested by Tim Siakam (0.5 feet, ZONE)! Gary Westbrook misses. Rebound secured by Tim Siakam.

[07:32] Team_044 possession (Score: 42-22)
Kyrie Poole attempts a 3Pt. Heavily contested by Tracy Anthony (0.5 feet, ZONE)! KYRIE POOLE MAKES IT! Assist: Pau Quickley
Score: 42-25

[07:16] Team_023 possession (Score: 42-25)
Vince Gasol drives to the basket... Vince Gasol throws a bad pass! Stolen by Victor Anthony! TURNOVER! (live ball)

[07:01] Team_044 possession (Score: 42-25)
Pau Quickley attempts a 3Pt. Wide open! Tracy Anthony is 8.5 feet away. [ZONE] PAU QUICKLEY MAKES IT! Assist: Kyrie Poole
Score: 42-28

[06:43] Team_023 possession (Score: 42-28)
FOUL! Offensive foul on Tracy Anthony! Kyrie Poole drew the charge! [Team fouls: 2] (Tracy Anthony: 1 personal fouls) TURNOVER! (dead ball)

[06:29] Team_044 possession (Score: 42-28)
Tim Towns drives, picks up Evan Parker. Help arrives from Magic Booker! Tim Towns attempts a Layup. Heavily contested by Magic Booker (0.6 feet, ZONE)! TIM TOWNS MAKES IT! Assist: Victor Anthony
Score: 42-30

[06:15] Team_023 possession (Score: 42-30)
Gary Westbrook attempts a 3Pt. Contested by Tim Siakam (4.5 feet, ZONE). Gary Westbrook misses. Rebound secured by Victor Anthony.

[05:59] Team_044 possession (Score: 42-30)
Tim Siakam attempts a Midrange. Contested by Evan Parker (5.0 feet, ZONE). Tim Siakam misses. Rebound secured by Vince Gasol.

[05:43] Team_023 possession (Score: 42-30)
Evan Parker attempts a Midrange. Contested by Pau Quickley (2.7 feet, MAN). Evan Parker misses. Rebound secured by Pau Quickley.

[05:33] Team_044 possession (Score: 42-30)
Victor Anthony attempts a Layup. Contested by Vince Gasol (5.1 feet, ZONE). Victor Anthony misses. FOUL! Loose ball foul on Vince Gasol during the rebound battle. [Team fouls: 3] No free throws, side out. (Vince Gasol: 1 personal fouls)

[05:20] Team_044 possession (Score: 42-30)
Pau Quickley drives, picks up Vince Gasol. Help arrives from Magic Booker! Pau Quickley attempts a Layup. Heavily contested by Magic Booker (0.5 feet, ZONE)! PAU QUICKLEY MAKES IT!
Score: 42-32

[05:03] Team_023 possession (Score: 42-32)
Gary Westbrook attempts a 3Pt. Contested by Kyrie Poole (5.0 feet, ZONE). Gary Westbrook misses. Rebound secured by Victor Anthony.

[04:49] Team_044 possession (Score: 42-32)
Pau Quickley attempts a 3Pt. Contested by Evan Parker (4.1 feet, MAN). Pau Quickley misses. Rebound secured by Vince Gasol.

[04:33] Team_023 possession (Score: 42-32)
Vince Gasol attempts a Midrange. Contested by Victor Anthony (3.0 feet, MAN). Vince Gasol misses. Rebound secured by Pau Quickley.

[04:20] Team_044 possession (Score: 42-32)
Kyrie Poole attempts a 3Pt. Heavily contested by Tracy Anthony (1.7 feet, ZONE)! Kyrie Poole misses. Rebound secured by Evan Parker.

[04:04] Team_023 possession (Score: 42-32)
Evan Parker drives to the basket... Evan Parker commits a violation (traveling/carry)! TURNOVER! (dead ball)

[03:47] Team_044 possession (Score: 42-32)
Pau Quickley drives to the basket... Pau Quickley throws a bad pass! Stolen by Vince Gasol! TURNOVER! (live ball)

[03:31] Team_023 possession (Score: 42-32)
Gary Westbrook drives, picks up Pau Quickley. Help arrives from Tim Towns! Gary Westbrook attempts a Layup. Contested by Tim Towns (5.9 feet, ZONE). GARY WESTBROOK MAKES IT! Assist: Tracy Anthony
Score: 44-32

[03:15] Team_044 possession (Score: 44-32)
Victor Anthony attempts a Layup. Heavily contested by Vince Gasol (0.8 feet, ZONE)! Victor Anthony misses. Offensive rebound by Tim Siakam! Tim Siakam kicks it out.

[03:02] Team_044 possession (Score: 44-32)
Tim Towns attempts a 3Pt. Contested by Tracy Anthony (3.0 feet, ZONE). TIM TOWNS MAKES IT! Assist: Kyrie Poole
Score: 44-35

[02:48] Team_023 possession (Score: 44-35)
Evan Parker drives to the basket... Evan Parker loses control! Ball rolls out of bounds! TURNOVER! (dead ball)

[02:32] Team_044 possession (Score: 44-35)
Pau Quickley attempts a Layup. BLOCKED BY EVAN PARKER! Ball is loose! Offensive rebound by Victor Anthony! Victor Anthony kicks it out.

[02:16] Team_044 possession (Score: 44-35)
Kyrie Poole attempts a 3Pt. Contested by Tracy Anthony (4.1 feet, MAN). Kyrie Poole misses. Rebound secured by Evan Parker.

[02:02] Team_023 possession (Score: 44-35)
Evan Parker attempts a Layup. Contested by Pau Quickley (5.6 feet, ZONE). Evan Parker misses. Offensive rebound by Evan Parker! Evan Parker puts it back in!
Score: 46-35

[01:49] Team_044 possession (Score: 46-35)
Pau Quickley attempts a Midrange. Contested by Magic Booker (4.4 feet, ZONE). Pau Quickley misses. Offensive rebound by Victor Anthony! Victor Anthony kicks it out.

[01:36] Team_044 possession (Score: 46-35)
Victor Anthony makes the Dunk and draws the foul on Vince Gasol! And-1! Victor Anthony to the line for 1. [Team fouls: 4] (Vince Gasol: 2 personal fouls)   FT 1/1: GOOD Victor Anthony makes 1/1 from the line.
Score: 46-38

[01:24] Team_023 possession (Score: 46-38)
Tracy Anthony drives and kicks out. Evan Parker attempts a 3Pt. Heavily contested by Pau Quickley (0.8 feet, MAN)! EVAN PARKER MAKES IT! Assist: Tracy Anthony
Score: 49-38

[01:09] Team_044 possession (Score: 49-38)
Kyrie Poole attempts a 3Pt. Contested by Tracy Anthony (4.2 feet, MAN). KYRIE POOLE MAKES IT! Assist: Tim Siakam
Score: 49-41

[00:59] Team_023 possession (Score: 49-41)
FOUL! Shooting foul on Pau Quickley. Tracy Anthony to the line for 2 free throws. [Team fouls: 2] (Pau Quickley: 1 personal fouls)   FT 1/2: GOOD   FT 2/2: GOOD Tracy Anthony makes 2/2 from the line.
Score: 51-41

[00:43] Team_044 possession (Score: 51-41)
Victor Anthony attempts a Midrange. Contested by Gary Westbrook (4.6 feet, ZONE). Victor Anthony misses. Rebound secured by Evan Parker.

[00:32] Team_023 possession (Score: 51-41)
Vince Gasol attempts a Midrange. Heavily contested by Victor Anthony (1.2 feet, MAN)! Vince Gasol misses. Rebound secured by Pau Quickley.

[00:17] Team_044 possession (Score: 51-41)
Victor Anthony drives, picks up Vince Gasol. Help arrives from Magic Booker! Victor Anthony attempts a Dunk. Contested by Magic Booker (3.5 feet, ZONE). Victor Anthony misses. Rebound secured by Gary Westbrook.

[00:03] Team_023 possession (Score: 51-41)
Tracy Anthony attempts a Layup. BLOCKED BY PAU QUICKLEY! Ball deflects out of bounds off Tracy Anthony.

================================================================================
                              2ND QUARTER COMPLETE                              
================================================================================

2ND QUARTER SCORE: Team_023 18, Team_044 24

BOX SCORE:
================================================================================

Team_023
--------------------------------------------------------------------------------
Player                MIN  PTS  REB  AST  TO      FG   FG%      3P   3P%
--------------------------------------------------------------------------------
Evan Parker             9    5    4    0   0   2/3    66.7     0/0   0.0
Josh Morant            15    3    1    0   0   1/2    50.0     0/0   0.0
Trae Ingram            15    3    0    0   0   1/1   100.0     0/0   0.0
Kyle Paul              15    3    1    1   0   1/1   100.0     0/0   0.0
Tracy Anthony           9    2    0    2   0   1/3    33.3     0/0   0.0
Gary Westbrook          9    2    3    0   0   1/4    25.0     0/0   0.0
Collin Ginobili        15    0    0    0   0   0/2     0.0     0/0   0.0
Vince Gasol             9    0    3    0   0   0/3     0.0     0/0   0.0

TEAM: FG: 7/19 (36.8%), 3PT: 3/8 (37.5%), REB: 12 (3 off, 9 def), AST: 3, TO: 4
TEAM FOULS: 4


Team_044
--------------------------------------------------------------------------------
Player                MIN  PTS  REB  AST  TO      FG   FG%      3P   3P%
--------------------------------------------------------------------------------
Kyrie Poole             9    6    0    2   0   2/4    50.0     0/0   0.0
Tim Towns               9    5    0    0   0   2/3    66.7     0/0   0.0
Pau Quickley            9    5    4    1   0   2/4    50.0     0/0   0.0
Victor Anthony          9    3    5    1   0   1/3    33.3     0/0   0.0
Victor Westbrook       15    2    1    1   0   1/1   100.0     0/0   0.0
Ayo McCollum           15    2    1    0   0   1/1   100.0     0/0   0.0
Karl Fox               15    0    1    0   0   0/0     0.0     0/0   0.0
Isaiah Murray          15    0    0    0   0   0/1     0.0     0/0   0.0
Zach McGrady           15    0    0    0   0   0/1     0.0     0/0   0.0
Tim Siakam              9    0    3    1   0   0/1     0.0     0/0   0.0

TEAM: FG: 9/19 (47.4%), 3PT: 4/8 (50.0%), REB: 15 (4 off, 11 def), AST: 6, TO: 3
TEAM FOULS: 2

================================================================================

================================================================================
                       3RD QUARTER - Team_023 vs Team_044                       
================================================================================

[12:00] Team_023 possession (Score: 51-41)
Kyle Paul attempts a Midrange. Heavily contested by Victor Westbrook (2.0 feet, MAN)! Kyle Paul misses. Rebound secured by Ayo McCollum.

[11:44] Team_044 possession (Score: 51-41)
FOUL! Shooting foul on Trae Ingram. Zach McGrady to the line for 3 free throws. [Team fouls: 1] (Trae Ingram: 1 personal fouls)   FT 1/3: GOOD   FT 2/3: MISS   FT 3/3: MISS Zach McGrady makes 1/3 from the line. Offensive rebound by Victor Westbrook! Victor Westbrook kicks it out.
Score: 51-42

[11:31] Team_044 possession (Score: 51-42)
Zach McGrady attempts a Midrange. Contested by Kyle Paul (2.9 feet, ZONE). ZACH MCGRADY MAKES IT! Assist: Ayo McCollum
Score: 51-44

[11:19] Team_023 possession (Score: 51-44)
FOUL! Holding foul on Zach McGrady. [Team fouls: 1] No free throws, side out. (Zach McGrady: 1 personal fouls)

[11:07] Team_023 possession (Score: 51-44)
FOUL! Holding foul on Isaiah Murray. [Team fouls: 2] No free throws, side out. (Isaiah Murray: 1 personal fouls)

[10:52] Team_023 possession (Score: 51-44)
Trae Ingram attempts a 3Pt. Contested by Isaiah Murray (5.8 feet, ZONE). Trae Ingram misses. Offensive rebound by Josh Morant! Josh Morant kicks it out.

[10:41] Team_023 possession (Score: 51-44)
Collin Ginobili attempts a Midrange. Wide open! Isaiah Murray is 6.6 feet away. [MAN] Collin Ginobili misses. Offensive rebound by Tim Bane! Tim Bane's putback is no good. Offensive rebound by Tim Bane! Tim Bane kicks it out.

[10:26] Team_023 possession (Score: 51-44)
Tim Bane drives to the basket... Tim Bane loses the ball! Stripped by Ayo McCollum! TURNOVER! (live ball)

[10:11] Team_044 possession (Score: 51-44)
Ayo McCollum attempts a Midrange. Wide open! Tim Bane is 6.5 feet away. [MAN] AYO MCCOLLUM MAKES IT!
Score: 51-46

[09:58] Team_023 possession (Score: 51-46)
Collin Ginobili drives and kicks out. Trae Ingram attempts a 3Pt. Contested by Isaiah Murray (4.4 feet, ZONE). Trae Ingram misses. Offensive rebound by Tim Bane! Tim Bane puts it back in!
Score: 53-46

[09:49] Team_044 possession (Score: 53-46)
Victor Westbrook drives and kicks out. Zach McGrady attempts a 3Pt. Contested by Collin Ginobili (3.7 feet, ZONE). Zach McGrady misses. Rebound secured by Tim Bane.

[09:38] Team_023 possession (Score: 53-46)
Kyle Paul attempts a 3Pt. Wide open! Karl Fox is 6.0 feet away. [ZONE] KYLE PAUL MAKES IT! Assist: Trae Ingram
Score: 56-46

[09:24] Team_044 possession (Score: 56-46)
Zach McGrady drives to the basket... Zach McGrady loses the ball! Stripped by Tim Bane! TURNOVER! (live ball)

[09:09] Team_023 possession (Score: 56-46)
Josh Morant attempts a Midrange. Wide open! Karl Fox is 9.0 feet away. [MAN] Josh Morant misses. Rebound secured by Karl Fox.

[08:50] Team_044 possession (Score: 56-46)
Zach McGrady attempts a 3Pt. Heavily contested by Kyle Paul (1.0 feet, ZONE)! Zach McGrady misses. Rebound secured by Kyle Paul.

[08:39] Team_023 possession (Score: 56-46)
Josh Morant drives, picks up Karl Fox. Help arrives from Zach McGrady! Josh Morant attempts a Layup. Wide open! Zach McGrady is 6.3 feet away. [MAN] JOSH MORANT MAKES IT!
Score: 58-46

[08:21] Team_044 possession (Score: 58-46)
Ayo McCollum drives to the basket... FOUL! Offensive foul on Ayo McCollum! Tim Bane drew the charge! [Team fouls: 3] (Ayo McCollum: 1 personal fouls) TURNOVER! (dead ball)

[08:08] Team_023 possession (Score: 58-46)
Trae Ingram attempts a 3Pt. Contested by Victor Westbrook (3.8 feet, ZONE). TRAE INGRAM MAKES IT! Assist: Tim Bane
Score: 61-46

[07:51] Team_044 possession (Score: 61-46)
Zach McGrady attempts a 3Pt. Contested by Kyle Paul (3.6 feet, ZONE). Zach McGrady misses. Rebound secured by Josh Morant.

[07:38] Team_023 possession (Score: 61-46)
FOUL! Shooting foul on Victor Westbrook. Kyle Paul to the line for 3 free throws. [Team fouls: 4] (Victor Westbrook: 1 personal fouls)   FT 1/3: GOOD   FT 2/3: GOOD   FT 3/3: GOOD Kyle Paul makes 3/3 from the line.
Score: 64-46

[07:21] Team_044 possession (Score: 64-46)
Victor Westbrook drives and kicks out. Ayo McCollum attempts a 3Pt. Contested by Tim Bane (6.0 feet, MAN). Ayo McCollum misses. Rebound secured by Tim Bane.

[07:07] Team_023 possession (Score: 64-46)
Kyle Paul attempts a 3Pt. Contested by Victor Westbrook (5.0 feet, MAN). KYLE PAUL MAKES IT! Assist: Trae Ingram
Score: 67-46

[06:53] Team_044 possession (Score: 67-46)
Isaiah Murray attempts a Layup. BLOCKED BY KYLE PAUL! Ball is loose! Rebound secured by Tim Bane.

[06:37] Team_023 possession (Score: 67-46)
Collin Ginobili drives and kicks out. Collin Ginobili attempts a Midrange. Contested by Isaiah Murray (3.9 feet, MAN). Collin Ginobili misses. Offensive rebound by Tim Bane! Tim Bane puts it back in!
Score: 69-46

[06:19] Team_044 possession (Score: 69-46)
Victor Westbrook throws a bad pass out of bounds! TURNOVER! (dead ball)

[06:03] Team_023 possession (Score: 69-46)
Trae Ingram attempts a Layup. Contested by Zach McGrady (5.2 feet, MAN). TRAE INGRAM MAKES IT! Assist: Kyle Paul
Score: 71-46

[05:52] Team_044 possession (Score: 71-46)
Ayo McCollum attempts a Layup. Contested by Tim Bane (3.6 feet, ZONE). AYO MCCOLLUM MAKES IT! Assist: Karl Fox
Score: 71-48

[05:38] Team_023 possession (Score: 71-48)
Trae Ingram attempts a Layup. Contested by Zach McGrady (5.2 feet, MAN). Trae Ingram misses. Rebound secured by Victor Westbrook.

[05:28] Team_044 possession (Score: 71-48)
FOUL! Shooting foul on Collin Ginobili. Isaiah Murray to the line for 2 free throws. [Team fouls: 2] (Collin Ginobili: 1 personal fouls)   FT 1/2: GOOD   FT 2/2: MISS Isaiah Murray makes 1/2 from the line. FOUL! Loose ball foul on Tim Bane during the free throw rebound! [Team fouls: 3] No free throws, side out. (Tim Bane: 1 personal fouls)
Score: 71-49

[05:10] Team_044 possession (Score: 71-49)
Karl Fox drives to the basket... Karl Fox loses control! Ball rolls out of bounds! TURNOVER! (dead ball)

[04:56] Team_023 possession (Score: 71-49)
Tim Bane drives, picks up Ayo McCollum. Help arrives from Zach McGrady! Tim Bane attempts a Layup. Contested by Zach McGrady (2.7 feet, ZONE). TIM BANE MAKES IT! Assist: Collin Ginobili
Score: 73-49

[04:40] Team_044 possession (Score: 73-49)
Victor Westbrook attempts a 3Pt. Heavily contested by Kyle Paul (1.3 feet, MAN)! Victor Westbrook misses. Rebound secured by Josh Morant.

[04:26] Team_023 possession (Score: 73-49)
Tim Bane attempts a 3Pt. Wide open! Isaiah Murray is 8.3 feet away. [ZONE] Tim Bane misses. Rebound secured by Karl Fox.

[04:12] Team_044 possession (Score: 73-49)
Karl Fox drives, Tim Bane stays with him. Karl Fox attempts a Layup. Contested by Tim Bane (4.4 feet, ZONE). KARL FOX MAKES IT! Assist: Isaiah Murray
Score: 73-51

[03:58] Team_023 possession (Score: 73-51)
Tim Bane attempts a Layup. Wide open! Ayo McCollum is 7.1 feet away. [ZONE] TIM BANE MAKES IT! Assist: Kyle Paul
Score: 75-51

[03:45] Team_044 possession (Score: 75-51)
Ayo McCollum drives, Tim Bane stays with him. Ayo McCollum attempts a Layup. Contested by Tim Bane (2.8 feet, ZONE). Ayo McCollum misses. Offensive rebound by Ayo McCollum! Ayo McCollum kicks it out.

[03:33] Team_044 possession (Score: 75-51)
Ayo McCollum attempts a Layup. Contested by Tim Bane (4.3 feet, MAN). Ayo McCollum misses. Rebound secured by Kyle Paul.

[03:19] Team_023 possession (Score: 75-51)
Josh Morant attempts a Layup. BLOCKED BY ZACH MCGRADY! Ball deflects out of bounds off Josh Morant.

[03:03] Team_044 possession (Score: 75-51)
Zach McGrady drives to the basket... FOUL! Offensive foul on Zach McGrady! Trae Ingram drew the charge! [Team fouls: 5] (Zach McGrady: 2 personal fouls) TURNOVER! (dead ball)

[02:50] Team_023 possession (Score: 75-51)
Kyle Paul attempts a Midrange. Contested by Victor Westbrook (5.4 feet, MAN). Kyle Paul misses. Rebound secured by Victor Westbrook.

[02:33] Team_044 possession (Score: 75-51)
FOUL! Reach-in foul on Tim Bane during the drive. [Team fouls: 4] No free throws, side out. (Tim Bane: 2 personal fouls)

[02:19] Team_044 possession (Score: 75-51)
Victor Westbrook attempts a 3Pt. Contested by Kyle Paul (2.5 feet, MAN). Victor Westbrook misses. Rebound secured by Kyle Paul.

[02:02] Team_023 possession (Score: 75-51)
Tim Bane drives, Karl Fox stays with him. Tim Bane attempts a Dunk. Wide open! Karl Fox is 7.1 feet away. [ZONE] TIM BANE MAKES IT! Assist: Josh Morant
Score: 77-51

[01:48] Team_044 possession (Score: 77-51)
Ayo McCollum drives, picks up Tim Bane. Help arrives from Trae Ingram! Ayo McCollum attempts a Layup. Contested by Trae Ingram (4.9 feet, MAN). AYO MCCOLLUM MAKES IT! Assist: Isaiah Murray
Score: 77-53

[01:37] Team_023 possession (Score: 77-53)
Tim Bane attempts a 3Pt. Heavily contested by Isaiah Murray (1.4 feet, ZONE)! Tim Bane misses. Offensive rebound by Josh Morant! Josh Morant kicks it out.

[01:22] Team_023 possession (Score: 77-53)
Trae Ingram drives and kicks out. Collin Ginobili attempts a Midrange. Wide open! Isaiah Murray is 8.5 feet away. [MAN] Collin Ginobili misses. Rebound secured by Ayo McCollum.

[01:10] Team_044 possession (Score: 77-53)
Isaiah Murray drives and kicks out. Isaiah Murray attempts a 3Pt. Contested by Collin Ginobili (5.1 feet, MAN). Isaiah Murray misses. FOUL! Loose ball foul on Kyle Paul during the rebound battle. [IN THE BONUS! 5 team fouls] Ayo McCollum to the line for 2 free throws. (Kyle Paul: 1 personal fouls)   FT 1/2: GOOD   FT 2/2: MISS Ayo McCollum makes 1/2 from the line. Rebound secured by Kyle Paul.
Score: 77-54

[00:54] Team_023 possession (Score: 77-54)
Kyle Paul attempts a 3Pt. Wide open! Victor Westbrook is 6.6 feet away. [MAN] KYLE PAUL MAKES IT! Assist: Trae Ingram
Score: 80-54

[00:40] Team_044 possession (Score: 80-54)
Ayo McCollum attempts a Midrange. Wide open! Tim Bane is 8.4 feet away. [MAN] Ayo McCollum misses. Rebound secured by Josh Morant.

[00:23] Team_023 possession (Score: 80-54)
Collin Ginobili drives to the basket... Collin Ginobili throws a bad pass out of bounds! TURNOVER! (dead ball)

[00:23] Substitution (Team_023): Trae Ingram OUT → Tracy Anthony IN (stamina_rule2)

[00:23] Substitution (Team_023): Collin Ginobili OUT → Magic Booker IN (stamina_rule2)

[00:23] Substitution (Team_023): Kyle Paul OUT → Gary Westbrook IN (stamina_rule2)

[00:23] Substitution (Team_023): Josh Morant OUT → Evan Parker IN (stamina_rule2)

[00:23] Substitution (Team_023): Tim Bane OUT → Vince Gasol IN (stamina_rule2)

[00:23] Substitution (Team_044): Zach McGrady OUT → Kyrie Poole IN (stamina_rule2)

[00:23] Substitution (Team_044): Isaiah Murray OUT → Tim Towns IN (stamina_rule2)

[00:23] Substitution (Team_044): Victor Westbrook OUT → Tim Siakam IN (stamina_rule2)

[00:23] Substitution (Team_044): Karl Fox OUT → Pau Quickley IN (stamina_rule2)

[00:23] Substitution (Team_044): Ayo McCollum OUT → Victor Anthony IN (stamina_rule2)

[00:03] Team_044 possession (Score: 80-54)
Kyrie Poole attempts a Midrange. Wide open! Gary Westbrook is 8.1 feet away. [ZONE] Kyrie Poole misses. Rebound secured by Gary Westbrook.

================================================================================
                              3RD QUARTER COMPLETE                              
================================================================================

3RD QUARTER SCORE: Team_023 29, Team_044 13

BOX SCORE:
================================================================================

Team_023
--------------------------------------------------------------------------------
Player                MIN  PTS  REB  AST  TO      FG   FG%      3P   3P%
--------------------------------------------------------------------------------
Kyle Paul              27   12    4    2   0   4/6    66.7     0/0   0.0
Tim Bane               27   10    6    1   0   5/6    83.3     0/0   0.0
Trae Ingram            27    5    0    3   0   2/4    50.0     0/0   0.0
Josh Morant            27    2    5    1   0   1/3    33.3     0/0   0.0
Collin Ginobili        27    0    0    1   0   0/0     0.0     0/0   0.0
Gary Westbrook          9    0    1    0   0   0/0     0.0     0/0   0.0

TEAM: FG: 12/19 (63.2%), 3PT: 5/6 (83.3%), REB: 15 (5 off, 10 def), AST: 8, TO: 2
TEAM FOULS: 5 [Team_044 in BONUS]


Team_044
--------------------------------------------------------------------------------
Player                MIN  PTS  REB  AST  TO      FG   FG%      3P   3P%
--------------------------------------------------------------------------------
Ayo McCollum           27    6    3    1   0   3/5    60.0     0/0   0.0
Zach McGrady           27    2    0    0   0   1/3    33.3     0/0   0.0
Karl Fox               27    2    2    1   0   1/1   100.0     0/0   0.0
Victor Westbrook       27    0    4    0   0   0/4     0.0     0/0   0.0
Isaiah Murray          27    0    0    2   0   0/2     0.0     0/0   0.0
Kyrie Poole             9    0    0    0   0   0/1     0.0     0/0   0.0

TEAM: FG: 5/16 (31.2%), 3PT: 0/4 (0.0%), REB: 10 (4 off, 6 def), AST: 4, TO: 5
TEAM FOULS: 5 [Team_023 in BONUS]

================================================================================

================================================================================
                       4TH QUARTER - Team_023 vs Team_044                       
================================================================================

[12:00] Team_023 possession (Score: 80-54)
Trae Ingram attempts a 3Pt. Contested by Isaiah Murray (4.7 feet, ZONE). Trae Ingram misses. Rebound secured by Karl Fox.

[11:49] Team_044 possession (Score: 80-54)
Victor Westbrook attempts a 3Pt. Contested by Kyle Paul (4.1 feet, MAN). Victor Westbrook misses. FOUL! Loose ball foul on Kyle Paul during the rebound battle. [Team fouls: 1] No free throws, side out. (Kyle Paul: 1 personal fouls)

[11:34] Team_044 possession (Score: 80-54)
FOUL! Reach-in foul on Josh Morant during the drive. [Team fouls: 2] No free throws, side out. (Josh Morant: 1 personal fouls)

[11:22] Team_044 possession (Score: 80-54)
Zach McGrady throws a bad pass out of bounds! TURNOVER! (dead ball)

[11:22] Substitution (Team_023): Trae Ingram OUT → Tracy Anthony IN (stamina_rule2)

[11:22] Substitution (Team_023): Collin Ginobili OUT → Magic Booker IN (stamina_rule2)

[11:22] Substitution (Team_023): Kyle Paul OUT → Gary Westbrook IN (stamina_rule2)

[11:22] Substitution (Team_023): Josh Morant OUT → Evan Parker IN (stamina_rule2)

[11:22] Substitution (Team_023): Tim Bane OUT → Vince Gasol IN (stamina_rule2)

[11:22] Substitution (Team_044): Zach McGrady OUT → Kyrie Poole IN (stamina_rule2)

[11:22] Substitution (Team_044): Isaiah Murray OUT → Tim Towns IN (stamina_rule2)

[11:22] Substitution (Team_044): Victor Westbrook OUT → Tim Siakam IN (stamina_rule2)

[11:22] Substitution (Team_044): Karl Fox OUT → Pau Quickley IN (stamina_rule2)

[11:22] Substitution (Team_044): Ayo McCollum OUT → Victor Anthony IN (stamina_rule2)

[11:11] Team_023 possession (Score: 80-54)
Gary Westbrook attempts a Midrange. Contested by Tim Siakam (3.0 feet, ZONE). Gary Westbrook misses. Offensive rebound by Vince Gasol! Vince Gasol's putback is no good. Rebound secured by Pau Quickley.

[11:02] Team_044 possession (Score: 80-54)
FOUL! Reach-in foul on Evan Parker during the drive. [Team fouls: 3] No free throws, side out. (Evan Parker: 1 personal fouls)

[10:45] Team_044 possession (Score: 80-54)
Tim Siakam attempts a 3Pt. Heavily contested by Tracy Anthony (0.8 feet, ZONE)! Tim Siakam misses. Rebound secured by Gary Westbrook.

[10:31] Team_023 possession (Score: 80-54)
Evan Parker drives, Pau Quickley stays with him. Evan Parker attempts a Layup. Wide open! Pau Quickley is 6.8 feet away. [ZONE] EVAN PARKER MAKES IT!
Score: 82-54

[10:22] Team_044 possession (Score: 82-54)
Kyrie Poole drives and kicks out. Tim Towns attempts a 3Pt. Contested by Tracy Anthony (4.3 feet, ZONE). TIM TOWNS MAKES IT! Assist: Kyrie Poole
Score: 82-57

[10:12] Team_023 possession (Score: 82-57)
Evan Parker loses control! Ball rolls out of bounds! TURNOVER! (dead ball)

[09:54] Team_044 possession (Score: 82-57)
Tim Siakam attempts a 3Pt. Contested by Tracy Anthony (2.8 feet, ZONE). TIM SIAKAM MAKES IT! Assist: Kyrie Poole
Score: 82-60

[09:38] Team_023 possession (Score: 82-60)
Vince Gasol attempts a Midrange. Contested by Kyrie Poole (4.3 feet, ZONE). VINCE GASOL MAKES IT! Assist: Gary Westbrook
Score: 84-60

[09:24] Team_044 possession (Score: 84-60)
Pau Quickley makes the Layup and draws the foul on Magic Booker! And-1! Pau Quickley to the line for 1. [Team fouls: 4] (Magic Booker: 1 personal fouls)   FT 1/1: GOOD Pau Quickley makes 1/1 from the line.
Score: 84-63

[09:05] Team_023 possession (Score: 84-63)
Magic Booker attempts a Layup. Wide open! Tim Towns is 6.6 feet away. [MAN] MAGIC BOOKER MAKES IT!
Score: 86-63

[08:54] Team_044 possession (Score: 86-63)
Tim Towns drives to the basket... Tim Towns loses control! Ball rolls out of bounds! TURNOVER! (dead ball)

[08:37] Team_023 possession (Score: 86-63)
Gary Westbrook attempts a 3Pt. Wide open! Tim Siakam is 7.1 feet away. [MAN] Gary Westbrook misses. Rebound secured by Tim Siakam.

[08:24] Team_044 possession (Score: 86-63)
Pau Quickley drives and kicks out. Victor Anthony attempts a 3Pt. Contested by Gary Westbrook (3.8 feet, ZONE). Victor Anthony misses. Rebound secured by Gary Westbrook.

[08:13] Team_023 possession (Score: 86-63)
Evan Parker attempts a Midrange. Heavily contested by Pau Quickley (1.6 feet, MAN)! Evan Parker misses. Rebound secured by Tim Siakam.

[07:58] Team_044 possession (Score: 86-63)
Pau Quickley attempts a Midrange. Contested by Evan Parker (3.2 feet, ZONE). Pau Quickley misses. Rebound secured by Vince Gasol.

[07:44] Team_023 possession (Score: 86-63)
Vince Gasol attempts a 3Pt. Contested by Tim Siakam (5.1 feet, ZONE). Vince Gasol misses. Rebound secured by Victor Anthony.

[07:28] Team_044 possession (Score: 86-63)
Tim Siakam loses the ball! Stripped by Gary Westbrook! TURNOVER! (live ball)

[07:18] Team_023 possession (Score: 86-63)
FOUL! Reach-in foul on Pau Quickley during the drive. [Team fouls: 1] No free throws, side out. (Pau Quickley: 1 personal fouls)

[07:04] Team_023 possession (Score: 86-63)
Vince Gasol attempts a Layup. Contested by Pau Quickley (2.2 feet, ZONE). VINCE GASOL MAKES IT! Assist: Tracy Anthony
Score: 88-63

[06:54] Team_044 possession (Score: 88-63)
FOUL! Shooting foul on Magic Booker. Tim Towns to the line for 2 free throws. [BONUS: 5 team fouls] (Magic Booker: 2 personal fouls)   FT 1/2: GOOD   FT 2/2: GOOD Tim Towns makes 2/2 from the line.
Score: 88-65

[06:35] Team_023 possession (Score: 88-65)
Vince Gasol drives, Victor Anthony stays with him. Vince Gasol attempts a Dunk. Contested by Victor Anthony (2.8 feet, MAN). VINCE GASOL MAKES IT! Assist: Evan Parker
Score: 90-65

[06:19] Team_044 possession (Score: 90-65)
Tim Siakam attempts a 3Pt. Heavily contested by Tracy Anthony (0.5 feet, ZONE)! Tim Siakam misses. Offensive rebound by Tim Siakam! Tim Siakam kicks it out.

[06:03] Team_044 possession (Score: 90-65)
Pau Quickley drives, picks up Evan Parker. Help arrives from Magic Booker! Pau Quickley attempts a Layup. Contested by Magic Booker (4.1 feet, MAN). PAU QUICKLEY MAKES IT! Assist: Tim Siakam
Score: 90-67

[05:48] Team_023 possession (Score: 90-67)
Vince Gasol drives, Pau Quickley stays with him. Vince Gasol attempts a Dunk. Contested by Pau Quickley (2.8 feet, ZONE). Vince Gasol misses. Offensive rebound by Vince Gasol! Vince Gasol's putback is no good. Rebound secured by Pau Quickley.

[05:32] Team_044 possession (Score: 90-67)
Kyrie Poole attempts a Midrange. Wide open! Tracy Anthony is 6.7 feet away. [MAN] Kyrie Poole misses. Rebound secured by Gary Westbrook.

[05:17] Team_023 possession (Score: 90-67)
Magic Booker makes the Layup and draws the foul on Tim Towns! And-1! Magic Booker to the line for 1. [Team fouls: 2] (Tim Towns: 1 personal fouls)   FT 1/1: GOOD Magic Booker makes 1/1 from the line.
Score: 93-67

[05:06] Team_044 possession (Score: 93-67)
FOUL! Offensive foul on Kyrie Poole! Tracy Anthony drew the charge! [Team fouls: 3] (Kyrie Poole: 1 personal fouls) TURNOVER! (dead ball)

[04:54] Team_023 possession (Score: 93-67)
Tracy Anthony attempts a 3Pt. Contested by Kyrie Poole (3.3 feet, MAN). Tracy Anthony misses. Rebound secured by Tim Siakam.

[04:36] Team_044 possession (Score: 93-67)
Tim Towns attempts a Midrange. Contested by Gary Westbrook (3.6 feet, ZONE). Tim Towns misses. Rebound secured by Vince Gasol.

[04:22] Team_023 possession (Score: 93-67)
FOUL! Shooting foul on Pau Quickley. Gary Westbrook to the line for 2 free throws. [Team fouls: 4] (Pau Quickley: 2 personal fouls)   FT 1/2: MISS   FT 2/2: GOOD Gary Westbrook makes 1/2 from the line.
Score: 94-67

[04:07] Team_044 possession (Score: 94-67)
Tim Towns throws a bad pass! Stolen by Magic Booker! TURNOVER! (live ball)

[03:52] Team_023 possession (Score: 94-67)
Tracy Anthony attempts a 3Pt. Contested by Tim Towns (4.1 feet, ZONE). Tracy Anthony misses. Rebound secured by Victor Anthony.

[03:38] Team_044 possession (Score: 94-67)
Victor Anthony attempts a Midrange. Contested by Vince Gasol (4.7 feet, MAN). VICTOR ANTHONY MAKES IT!
Score: 94-69

[03:21] Team_023 possession (Score: 94-69)
Gary Westbrook drives to the basket... Gary Westbrook loses the ball! Stripped by Tim Siakam! TURNOVER! (live ball)

[03:07] Team_044 possession (Score: 94-69)
Tim Siakam attempts a 3Pt. Heavily contested by Evan Parker (0.5 feet, ZONE)! Tim Siakam misses. Rebound secured by Gary Westbrook.

[02:55] Team_023 possession (Score: 94-69)
Magic Booker attempts a 3Pt. Contested by Pau Quickley (5.0 feet, ZONE). Magic Booker misses. Rebound secured by Victor Anthony.

[02:37] Team_044 possession (Score: 94-69)
FOUL! Shooting foul on Evan Parker. Tim Towns to the line for 2 free throws. [BONUS: 6 team fouls] (Evan Parker: 2 personal fouls)   FT 1/2: GOOD   FT 2/2: GOOD Tim Towns makes 2/2 from the line.
Score: 94-71

[02:20] Team_023 possession (Score: 94-71)
FOUL! Reach-in foul on Pau Quickley during the drive. [IN THE BONUS! 5 team fouls] Evan Parker to the line for 2 free throws. (Pau Quickley: 3 personal fouls)   FT 1/2: GOOD   FT 2/2: GOOD Evan Parker makes 2/2 from the line.
Score: 96-71

[02:05] Team_044 possession (Score: 96-71)
Victor Anthony attempts a Midrange. Contested by Magic Booker (4.5 feet, ZONE). Victor Anthony misses. Offensive rebound by Tim Siakam! Tim Siakam kicks it out.

[01:53] Team_044 possession (Score: 96-71)
Pau Quickley attempts a Layup. Contested by Evan Parker (2.8 feet, MAN). Pau Quickley misses. Rebound secured by Evan Parker.

[01:36] Team_023 possession (Score: 96-71)
Tracy Anthony drives, Kyrie Poole stays with him. Tracy Anthony attempts a Dunk. Contested by Kyrie Poole (5.6 feet, MAN). TRACY ANTHONY MAKES IT!
Score: 98-71

[01:21] Team_044 possession (Score: 98-71)
Tim Towns attempts a Layup. Contested by Vince Gasol (2.7 feet, ZONE). TIM TOWNS MAKES IT!
Score: 98-73

[01:05] Team_023 possession (Score: 98-73)
Magic Booker attempts a 3Pt. Contested by Tim Siakam (2.4 feet, ZONE). Magic Booker misses. FOUL! Loose ball foul on Tim Siakam during the rebound battle. [IN THE BONUS! 6 team fouls] Vince Gasol to the line for 2 free throws. (Tim Siakam: 1 personal fouls)   FT 1/2: GOOD   FT 2/2: GOOD Vince Gasol makes 2/2 from the line.
Score: 100-73

[00:46] Team_044 possession (Score: 100-73)
Victor Anthony attempts a Midrange. Contested by Evan Parker (4.0 feet, ZONE). VICTOR ANTHONY MAKES IT! Assist: Tim Siakam
Score: 100-75

[00:29] Team_023 possession (Score: 100-75)
Evan Parker attempts a Midrange. Heavily contested by Pau Quickley (1.3 feet, ZONE)! EVAN PARKER MAKES IT!
Score: 102-75

[00:12] Team_044 possession (Score: 102-75)
Pau Quickley attempts a Layup. Wide open! Vince Gasol is 6.8 feet away. [ZONE] Pau Quickley misses. Rebound secured by Evan Parker.

================================================================================
                              4TH QUARTER COMPLETE                              
================================================================================

4TH QUARTER SCORE: Team_023 22, Team_044 21

BOX SCORE:
================================================================================

Team_023
--------------------------------------------------------------------------------
Player                MIN  PTS  REB  AST  TO      FG   FG%      3P   3P%
--------------------------------------------------------------------------------
Vince Gasol            21    8    2    0   0   4/6    66.7     0/0   0.0
Evan Parker            21    6    2    1   0   3/4    75.0     0/0   0.0
Magic Booker           21    5    0    0   0   2/3    66.7     0/0   0.0
Tracy Anthony          21    2    0    1   0   1/3    33.3     0/0   0.0
Gary Westbrook         21    1    4    1   0   1/3    33.3     0/0   0.0
Trae Ingram            28    0    0    0   0   0/1     0.0     0/0   0.0

TEAM: FG: 11/20 (55.0%), 3PT: 1/7 (14.3%), REB: 10 (2 off, 8 def), AST: 3, TO: 2
TEAM FOULS: 6 [Team_044 in BONUS]


Team_044
--------------------------------------------------------------------------------
Player                MIN  PTS  REB  AST  TO      FG   FG%      3P   3P%
--------------------------------------------------------------------------------
Tim Towns              21    9    0    0   0   4/5    80.0     0/0   0.0
Pau Quickley           21    5    2    0   0   2/6    33.3     0/0   0.0
Victor Anthony         21    4    3    0   0   2/2   100.0     0/0   0.0
Tim Siakam             21    3    5    2   0   1/3    33.3     0/0   0.0
Karl Fox               28    0    1    0   0   0/0     0.0     0/0   0.0
Ayo McCollum           28    0    1    0   0   0/0     0.0     0/0   0.0
Kyrie Poole            21    0    0    2   0   0/1     0.0     0/0   0.0

TEAM: FG: 9/17 (52.9%), 3PT: 1/3 (33.3%), REB: 10 (3 off, 7 def), AST: 4, TO: 5
TEAM FOULS: 6 [Team_023 in BONUS]

================================================================================

================================================================================
                               FULL GAME COMPLETE                               
================================================================================

FINAL SCORE: Team_023 102, Team_044 75

SCORING BY QUARTER:
--------------------------------------------------------------------------------
Team                     Q1     Q2     Q3     Q4    FINAL
--------------------------------------------------------------------------------
Team_023                 33     18     29     22      102
Team_044                 17     24     13     21       75
--------------------------------------------------------------------------------

FULL GAME BOX SCORE:
================================================================================

Team_023
--------------------------------------------------------------------------------
Player                MIN  PTS  REB  AST  TO      FG   FG%      3P   3P%      FT STL BLK
--------------------------------------------------------------------------------
Trae Ingram            28   12    0    3   0   5/10   50.0   2/4    50.0   4/4     0   0
Collin Ginobili        28    9    0    3   0   4/8    50.0   1/5    20.0   4/5     0   0
Kyle Paul              28   24    8    3   0   9/11   81.8   6/6   100.0   3/3     0   1
Josh Morant            28   13   12    2   0   6/12   50.0   4/5    80.0   1/4     0   0
Tim Bane               28   12   13    3   3   4/6    66.7   0/1     0.0   0/0     2   1
Tracy Anthony          21    4    0    3   2   3/7    42.9   0/2     0.0   2/2     0   0
Magic Booker           21    5    0    0   0   3/4    75.0   1/2    50.0   1/1     1   0
Gary Westbrook         21    3    8    1   1   2/7    28.6   0/4     0.0   1/2     1   0
Evan Parker            21   11    6    1   3   4/6    66.7   0/0     0.0   2/2     0   1
Vince Gasol            21    8    5    0   0   3/8    37.5   0/1     0.0   2/2     1   0

TEAM: FG: 44/80 (55.0%), 3PT: 14/30 (46.7%), REB: 54 (13 off, 41 def), AST: 19, TO: 9


Team_044
--------------------------------------------------------------------------------
Player                MIN  PTS  REB  AST  TO      FG   FG%      3P   3P%      FT STL BLK
--------------------------------------------------------------------------------
Zach McGrady           28    2    0    0   3   1/6    16.7   0/4     0.0   1/3     0   1
Isaiah Murray          28    2    0    3   1   1/6    16.7   0/2     0.0   2/4     0   0
Victor Westbrook       28    5   11    2   2   2/10   20.0   1/6    16.7   4/5     0   0
Karl Fox               28    2    4    2   1   1/5    20.0   0/3     0.0   0/0     0   0
Ayo McCollum           28   16   11    2   3   8/12   66.7   0/1     0.0   3/5     1   0
Kyrie Poole            21    6    0    4   1   3/7    42.9   2/4    50.0   0/0     0   0
Tim Towns              21   14    0    0   1   5/7    71.4   1/2    50.0   4/4     0   0
Tim Siakam             21    3    8    3   2   1/4    25.0   1/3    33.3   0/0     1   0
Pau Quickley           21   10    6    1   1   4/10   40.0   1/2    50.0   1/1     0   1
Victor Anthony         21    7    8    1   0   3/5    60.0   0/0     0.0   1/1     1   0

TEAM: FG: 29/72 (40.3%), 3PT: 6/27 (22.2%), REB: 46 (14 off, 32 def), AST: 18, TO: 15

================================================================================
