================================================================================
                        FULL GAME - Team_080 vs Team_054                        
================================================================================

================================================================================
                       1ST QUARTER - Team_080 vs Team_054                       
================================================================================

[12:00] Team_080 possession (Score: 0-0)
Khris Turner throws a bad pass! Stolen by Lauri Irving! TURNOVER! (live ball)

[11:46] Team_054 possession (Score: 0-0)
Vince Ball attempts a 3Pt. Contested by Larry Paul (2.0 feet, MAN). Vince Ball misses. Rebound secured by Larry Paul.

[11:31] Team_080 possession (Score: 0-0)
Jaren Morant attempts a Midrange. Contested by Vince Ball (5.1 feet, ZONE). Jaren Morant misses. Rebound secured by Blake Russell.

[11:18] Team_054 possession (Score: 0-0)
Lauri Irving drives and kicks out. Vince Ball attempts a 3Pt. Wide open! Lauri Dosunmu is 7.9 feet away. [ZONE] Vince Ball misses. Rebound secured by Jaren Morant.

[11:06] Team_080 possession (Score: 0-0)
Jaren Morant drives, picks up Luka Brogdon. Help arrives from Lauri Irving! Jaren Morant attempts a Dunk. Wide open! Lauri Irving is 6.1 feet away. [MAN] JAREN MORANT MAKES IT! Assist: Lauri Dosunmu
Score: 2-0

[10:47] Team_054 possession (Score: 2-0)
Blake Russell attempts a 3Pt. Contested by Lauri Dosunmu (5.6 feet, ZONE). BLAKE RUSSELL MAKES IT! Assist: Luka Brogdon
Score: 2-3

[10:34] Team_080 possession (Score: 2-3)
Lauri Dosunmu attempts a 3Pt. Contested by Malcolm Harden (4.1 feet, MAN). Lauri Dosunmu misses. Offensive rebound by Draymond Simons! Draymond Simons puts it back in!
Score: 4-3

[10:21] Team_054 possession (Score: 4-3)
Luka Brogdon drives, Jaren Morant stays with him. Luka Brogdon attempts a Dunk. Contested by Jaren Morant (4.3 feet, MAN). LUKA BROGDON MAKES IT! Assist: Blake Russell
Score: 4-5

[10:05] Team_080 possession (Score: 4-5)
Lauri Dosunmu drives, picks up Malcolm Harden. Help arrives from Lauri Irving! Lauri Dosunmu attempts a Layup. Contested by Lauri Irving (2.9 feet, MAN). LAURI DOSUNMU MAKES IT!
Score: 6-5

[09:52] Team_054 possession (Score: 6-5)
Luka Brogdon attempts a 3Pt. Wide open! Jaren Morant is 7.3 feet away. [MAN] Luka Brogdon misses. Rebound secured by Larry Paul.

[09:34] Team_080 possession (Score: 6-5)
Jaren Morant drives to the basket... Jaren Morant commits a violation (traveling/carry)! TURNOVER! (dead ball)

[09:18] Team_054 possession (Score: 6-5)
Blake Russell attempts a Dunk. BLOCKED BY DRAYMOND SIMONS! Ball deflects out of bounds off Blake Russell.

[09:04] Team_080 possession (Score: 6-5)
FOUL! Reach-in foul on Blake Russell during the drive. [Team fouls: 1] No free throws, side out. (Blake Russell: 1 personal fouls)

[08:46] Team_080 possession (Score: 6-5)
Lauri Dosunmu attempts a 3Pt. Heavily contested by Lauri Irving (1.1 feet, ZONE)! Lauri Dosunmu misses. Offensive rebound by Jaren Morant! Jaren Morant kicks it out.

[08:29] Team_080 possession (Score: 6-5)
Lauri Dosunmu drives and kicks out. Larry Paul makes the Midrange and draws the foul on Vince Ball! And-1! Larry Paul to the line for 1. [Team fouls: 2] (Vince Ball: 1 personal fouls)   FT 1/1: GOOD Larry Paul makes 1/1 from the line.
Score: 9-5

[08:15] Team_054 possession (Score: 9-5)
FOUL! Shooting foul on Larry Paul. Vince Ball to the line for 2 free throws. [Team fouls: 1] (Larry Paul: 1 personal fouls)   FT 1/2: GOOD   FT 2/2: GOOD Vince Ball makes 2/2 from the line.
Score: 9-7

[08:01] Team_080 possession (Score: 9-7)
Draymond Simons drives to the basket... FOUL! Offensive foul on Draymond Simons! Blake Russell drew the charge! [Team fouls: 2] (Draymond Simons: 1 personal fouls) TURNOVER! (dead ball)

[07:42] Team_054 possession (Score: 9-7)
Vince Ball makes the Layup and draws the foul on Jaren Morant! And-1! Vince Ball to the line for 1. [Team fouls: 3] (Jaren Morant: 1 personal fouls)   FT 1/1: GOOD Vince Ball makes 1/1 from the line.
Score: 9-10

[07:24] Team_080 possession (Score: 9-10)
Draymond Simons drives, Blake Russell stays with him. Draymond Simons attempts a Layup. Contested by Blake Russell (4.4 feet, ZONE). DRAYMOND SIMONS MAKES IT! Assist: Jaren Morant
Score: 11-10

[07:08] Team_054 possession (Score: 11-10)
FOUL! Shooting foul on Jaren Morant. Luka Brogdon to the line for 2 free throws. [Team fouls: 4] (Jaren Morant: 2 personal fouls)   FT 1/2: MISS   FT 2/2: GOOD Luka Brogdon makes 1/2 from the line.
Score: 11-11

[06:57] Team_080 possession (Score: 11-11)
FOUL! Offensive foul on Draymond Simons! Blake Russell drew the charge! [Team fouls: 5] (Draymond Simons: 2 personal fouls) TURNOVER! (dead ball)

[06:41] Team_054 possession (Score: 11-11)
Malcolm Harden attempts a Midrange. Wide open! Khris Turner is 6.9 feet away. [ZONE] Malcolm Harden misses. Rebound secured by Jaren Morant.

[06:27] Team_080 possession (Score: 11-11)
FOUL! Reach-in foul on Blake Russell during the drive. [Team fouls: 3] No free throws, side out. (Blake Russell: 2 personal fouls)

[06:09] Team_080 possession (Score: 11-11)
Larry Paul attempts a 3Pt. Heavily contested by Vince Ball (0.7 feet, MAN)! Larry Paul misses. Rebound secured by Blake Russell.

[05:55] Team_054 possession (Score: 11-11)
Luka Brogdon attempts a Midrange. Contested by Jaren Morant (3.4 feet, ZONE). LUKA BROGDON MAKES IT!
Score: 11-13

[05:45] Team_080 possession (Score: 11-13)
FOUL! Shooting foul on Lauri Irving. Jaren Morant to the line for 2 free throws. [Team fouls: 4] (Lauri Irving: 1 personal fouls)   FT 1/2: GOOD   FT 2/2: GOOD Jaren Morant makes 2/2 from the line.
Score: 13-13

[05:30] Team_054 possession (Score: 13-13)
Blake Russell commits a violation (traveling/carry)! TURNOVER! (dead ball)

[05:16] Team_080 possession (Score: 13-13)
Larry Paul drives and kicks out. FOUL! Shooting foul on Vince Ball. Larry Paul to the line for 2 free throws. [BONUS: 5 team fouls] (Vince Ball: 2 personal fouls)   FT 1/2: GOOD   FT 2/2: GOOD Larry Paul makes 2/2 from the line.
Score: 15-13

[05:00] Team_054 possession (Score: 15-13)
Luka Brogdon attempts a Layup. Contested by Draymond Simons (4.7 feet, ZONE). LUKA BROGDON MAKES IT! Assist: Malcolm Harden
Score: 15-15

[04:44] Team_080 possession (Score: 15-15)
Draymond Simons drives, Blake Russell stays with him. Draymond Simons attempts a Dunk. Contested by Blake Russell (3.0 feet, ZONE). DRAYMOND SIMONS MAKES IT!
Score: 17-15

[04:32] Team_054 possession (Score: 17-15)
Luka Brogdon attempts a Midrange. Contested by Jaren Morant (5.4 feet, MAN). Luka Brogdon misses. Rebound secured by Larry Paul.

[04:17] Team_080 possession (Score: 17-15)
Lauri Dosunmu attempts a 3Pt. Wide open! Lauri Irving is 7.7 feet away. [ZONE] LAURI DOSUNMU MAKES IT! Assist: Larry Paul
Score: 20-15

[04:03] Team_054 possession (Score: 20-15)
Vince Ball attempts a Midrange. Contested by Larry Paul (2.8 feet, ZONE). VINCE BALL MAKES IT! Assist: Blake Russell
Score: 20-17

[03:53] Team_080 possession (Score: 20-17)
Jaren Morant attempts a Layup. BLOCKED BY LAURI IRVING! Ball is loose! Offensive rebound by Jaren Morant! Jaren Morant kicks it out.

[03:36] Team_080 possession (Score: 20-17)
Lauri Dosunmu attempts a 3Pt. Heavily contested by Lauri Irving (1.8 feet, ZONE)! Lauri Dosunmu misses. FOUL! Loose ball foul on Vince Ball during the rebound battle. [IN THE BONUS! 6 team fouls] Draymond Simons to the line for 2 free throws. (Vince Ball: 3 personal fouls)   FT 1/2: GOOD   FT 2/2: GOOD Draymond Simons makes 2/2 from the line.
Score: 22-17

[03:19] Team_054 possession (Score: 22-17)
Lauri Irving attempts a 3Pt. Wide open! Khris Turner is 6.3 feet away. [MAN] Lauri Irving misses. Rebound secured by Jaren Morant.

[03:08] Team_080 possession (Score: 22-17)
Khris Turner attempts a Midrange. Contested by Lauri Irving (2.3 feet, MAN). Khris Turner misses. Rebound secured by Blake Russell.

[02:51] Team_054 possession (Score: 22-17)
Lauri Irving attempts a Layup. Wide open! Khris Turner is 6.7 feet away. [MAN] LAURI IRVING MAKES IT! Assist: Malcolm Harden
Score: 22-19

[02:36] Team_080 possession (Score: 22-19)
Khris Turner attempts a Midrange. Heavily contested by Blake Russell (1.9 feet, ZONE)! Khris Turner misses. Rebound secured by Vince Ball.

[02:22] Team_054 possession (Score: 22-19)
Blake Russell attempts a Layup. Contested by Draymond Simons (4.3 feet, ZONE). BLAKE RUSSELL MAKES IT! Assist: Lauri Irving
Score: 22-21

[02:07] Team_080 possession (Score: 22-21)
FOUL! Shooting foul on Malcolm Harden. Lauri Dosunmu to the line for 3 free throws. [BONUS: 7 team fouls] (Malcolm Harden: 1 personal fouls)   FT 1/3: GOOD   FT 2/3: GOOD   FT 3/3: GOOD Lauri Dosunmu makes 3/3 from the line.
Score: 25-21

[01:58] Team_054 possession (Score: 25-21)
FOUL! Offensive foul on Vince Ball! Larry Paul drew the charge! [Team fouls: 8] (Vince Ball: 4 personal fouls) TURNOVER! (dead ball)

[01:44] Team_080 possession (Score: 25-21)
Khris Turner drives to the basket... Khris Turner loses control! Ball rolls out of bounds! TURNOVER! (dead ball)

[01:44] Substitution (Team_080): Lauri Dosunmu OUT → Tony James IN (stamina_rule2)

[01:44] Substitution (Team_080): Khris Turner OUT → Larry Reaves IN (stamina_rule2)

[01:44] Substitution (Team_080): Jaren Morant OUT → Ja Cunningham IN (stamina_rule2)

[01:44] Substitution (Team_080): Draymond Simons OUT → Trae Brogdon IN (stamina_rule2)

[01:44] Substitution (Team_054): Malcolm Harden OUT → Shaquille Irving IN (stamina_rule2)

[01:44] Substitution (Team_054): Lauri Irving OUT → Bradley Quickley IN (stamina_rule2)

[01:44] Substitution (Team_054): Blake Russell OUT → Devin Jackson IN (stamina_rule2)

[01:30] Team_054 possession (Score: 25-21)
Vince Ball attempts a 3Pt. Heavily contested by Larry Paul (1.9 feet, MAN)! VINCE BALL MAKES IT! Assist: Devin Jackson
Score: 25-24

[01:16] Team_080 possession (Score: 25-24)
Ja Cunningham attempts a 3Pt. Contested by Shaquille Irving (4.6 feet, ZONE). JA CUNNINGHAM MAKES IT! Assist: Tony James
Score: 28-24

[00:59] Team_054 possession (Score: 28-24)
Vince Ball attempts a Layup. BLOCKED BY LARRY REAVES! Ball goes out off Larry Reaves. Vince Ball's ball!

[00:44] Team_054 possession (Score: 28-24)
Vince Ball attempts a 3Pt. Contested by Tony James (2.5 feet, ZONE). VINCE BALL MAKES IT! Assist: Shaquille Irving
Score: 28-27

[00:29] Team_080 possession (Score: 28-27)
Trae Brogdon attempts a Layup. BLOCKED BY DEVIN JACKSON! Ball deflects out of bounds off Trae Brogdon.

[00:16] Team_054 possession (Score: 28-27)
Bradley Quickley attempts a Midrange. Contested by Larry Reaves (3.5 feet, MAN). BRADLEY QUICKLEY MAKES IT!
Score: 28-29

================================================================================
                              1ST QUARTER COMPLETE                              
================================================================================

1ST QUARTER SCORE: Team_080 28, Team_054 29

BOX SCORE:
================================================================================

Team_080
--------------------------------------------------------------------------------
Player                MIN  PTS  REB  AST  TO      FG   FG%      3P   3P%
--------------------------------------------------------------------------------
Lauri Dosunmu          10    8    0    1   0   3/3   100.0     0/0   0.0
Draymond Simons        10    8    1    0   0   4/4   100.0     0/0   0.0
Larry Paul             12    5    3    1   0   2/3    66.7     0/0   0.0
Jaren Morant           10    4    5    1   0   2/3    66.7     0/0   0.0
Ja Cunningham           2    3    0    0   0   1/1   100.0     0/0   0.0
Khris Turner           10    0    0    0   0   0/2     0.0     0/0   0.0
Tony James              2    0    0    1   0   0/0     0.0     0/0   0.0
Trae Brogdon            2    0    0    0   0   0/1     0.0     0/0   0.0

TEAM: FG: 12/17 (70.6%), 3PT: 5/6 (83.3%), REB: 9 (3 off, 6 def), AST: 4, TO: 5
TEAM FOULS: 5 [Team_054 in BONUS]


Team_054
--------------------------------------------------------------------------------
Player                MIN  PTS  REB  AST  TO      FG   FG%      3P   3P%
--------------------------------------------------------------------------------
Vince Ball             12   13    1    0   0   5/6    83.3     0/0   0.0
Luka Brogdon           12    7    0    1   0   4/6    66.7     0/0   0.0
Blake Russell          10    5    3    2   0   2/3    66.7     0/0   0.0
Lauri Irving           10    2    0    1   0   1/3    33.3     0/0   0.0
Bradley Quickley        2    2    0    0   0   1/1   100.0     0/0   0.0
Malcolm Harden         10    0    0    2   0   0/1     0.0     0/0   0.0
Devin Jackson           2    0    0    1   0   0/0     0.0     0/0   0.0
Shaquille Irving        2    0    0    1   0   0/0     0.0     0/0   0.0

TEAM: FG: 13/20 (65.0%), 3PT: 3/6 (50.0%), REB: 4 (0 off, 4 def), AST: 8, TO: 2
TEAM FOULS: 8 [Team_080 in BONUS]

================================================================================

================================================================================
                       2ND QUARTER - Team_080 vs Team_054                       
================================================================================

[12:00] Team_080 possession (Score: 28-29)
Draymond Simons attempts a Midrange. Contested by Blake Russell (3.4 feet, MAN). DRAYMOND SIMONS MAKES IT!
Score: 30-29

[11:45] Team_054 possession (Score: 30-29)
Blake Russell attempts a 3Pt. Contested by Lauri Dosunmu (4.6 feet, ZONE). Blake Russell misses. Rebound secured by Jaren Morant.

[11:26] Team_080 possession (Score: 30-29)
Lauri Dosunmu drives, picks up Malcolm Harden. Help arrives from Lauri Irving! Lauri Dosunmu attempts a Dunk. Contested by Lauri Irving (3.1 feet, MAN). LAURI DOSUNMU MAKES IT! Assist: Jaren Morant
Score: 32-29

[11:13] Team_054 possession (Score: 32-29)
FOUL! Reach-in foul on Draymond Simons during the drive. [Team fouls: 1] No free throws, side out. (Draymond Simons: 1 personal fouls)

[10:58] Team_054 possession (Score: 32-29)
Malcolm Harden drives and kicks out. Blake Russell attempts a 3Pt. Contested by Lauri Dosunmu (3.9 feet, ZONE). Blake Russell misses. Rebound secured by Larry Paul.

[10:48] Team_080 possession (Score: 32-29)
FOUL! Shooting foul on Lauri Irving. Khris Turner to the line for 2 free throws. [Team fouls: 1] (Lauri Irving: 1 personal fouls)   FT 1/2: GOOD   FT 2/2: GOOD Khris Turner makes 2/2 from the line.
Score: 34-29

[10:35] Team_054 possession (Score: 34-29)
Vince Ball attempts a 3Pt. Heavily contested by Lauri Dosunmu (0.9 feet, ZONE)! VINCE BALL MAKES IT! Assist: Lauri Irving
Score: 34-32

[10:20] Team_080 possession (Score: 34-32)
Larry Paul attempts a 3Pt. Contested by Vince Ball (3.1 feet, MAN). LARRY PAUL MAKES IT! Assist: Lauri Dosunmu
Score: 37-32

[10:05] Team_054 possession (Score: 37-32)
Malcolm Harden drives to the basket... FOUL! Offensive foul on Malcolm Harden! Lauri Dosunmu drew the charge! [Team fouls: 2] (Malcolm Harden: 1 personal fouls) TURNOVER! (dead ball)

[09:50] Team_080 possession (Score: 37-32)
Larry Paul attempts a 3Pt. Heavily contested by Lauri Irving (0.8 feet, ZONE)! Larry Paul misses. Offensive rebound by Jaren Morant! Jaren Morant kicks it out.

[09:35] Team_080 possession (Score: 37-32)
Larry Paul attempts a 3Pt. Contested by Vince Ball (5.4 feet, MAN). Larry Paul misses. Offensive rebound by Draymond Simons! Draymond Simons's putback is no good. Rebound secured by Blake Russell.

[09:18] Team_054 possession (Score: 37-32)
Vince Ball attempts a Midrange. Contested by Jaren Morant (5.2 feet, ZONE). VINCE BALL MAKES IT!
Score: 37-34

[09:06] Team_080 possession (Score: 37-34)
Larry Paul attempts a 3Pt. Wide open! Lauri Irving is 7.4 feet away. [ZONE] Larry Paul misses. Rebound secured by Lauri Irving.

[08:53] Team_054 possession (Score: 37-34)
Luka Brogdon attempts a Layup. Wide open! Draymond Simons is 7.0 feet away. [ZONE] LUKA BROGDON MAKES IT!
Score: 37-36

[08:36] Team_080 possession (Score: 37-36)
Jaren Morant attempts a 3Pt. Wide open! Luka Brogdon is 7.7 feet away. [MAN] Jaren Morant misses. Rebound secured by Lauri Irving.

[08:25] Team_054 possession (Score: 37-36)
Lauri Irving attempts a 3Pt. Contested by Khris Turner (3.9 feet, MAN). LAURI IRVING MAKES IT! Assist: Malcolm Harden
Score: 37-39

[08:11] Team_080 possession (Score: 37-39)
Larry Paul drives to the basket... FOUL! Offensive foul on Larry Paul! Vince Ball drew the charge! [Team fouls: 2] (Larry Paul: 1 personal fouls) TURNOVER! (dead ball)

[07:54] Team_054 possession (Score: 37-39)
Malcolm Harden drives, picks up Lauri Dosunmu. Help arrives from Larry Paul! Malcolm Harden attempts a Layup. Wide open! Larry Paul is 6.7 feet away. [MAN] Malcolm Harden misses. Rebound secured by Jaren Morant.

[07:41] Team_080 possession (Score: 37-39)
Draymond Simons attempts a 3Pt. Contested by Lauri Irving (2.4 feet, ZONE). Draymond Simons misses. Rebound secured by Blake Russell.

[07:26] Team_054 possession (Score: 37-39)
Vince Ball makes the Midrange and draws the foul on Khris Turner! And-1! Vince Ball to the line for 1. [Team fouls: 3] (Khris Turner: 1 personal fouls)   FT 1/1: GOOD Vince Ball makes 1/1 from the line.
Score: 37-42

[07:12] Team_080 possession (Score: 37-42)
Khris Turner attempts a 3Pt. Heavily contested by Lauri Irving (1.3 feet, MAN)! Khris Turner misses. Rebound secured by Lauri Irving.

[06:59] Team_054 possession (Score: 37-42)
Luka Brogdon drives to the basket... FOUL! Offensive foul on Luka Brogdon! Jaren Morant drew the charge! [Team fouls: 3] (Luka Brogdon: 1 personal fouls) TURNOVER! (dead ball)

[06:44] Team_080 possession (Score: 37-42)
Larry Paul attempts a 3Pt. Contested by Lauri Irving (4.0 feet, ZONE). Larry Paul misses. Offensive rebound by Jaren Morant! Jaren Morant kicks it out.

[06:26] Team_080 possession (Score: 37-42)
Khris Turner attempts a 3Pt. Contested by Lauri Irving (4.7 feet, ZONE). Khris Turner misses. Rebound secured by Blake Russell.

[06:12] Team_054 possession (Score: 37-42)
Luka Brogdon attempts a 3Pt. Contested by Jaren Morant (4.9 feet, MAN). Luka Brogdon misses. Rebound secured by Draymond Simons.

[06:00] Team_080 possession (Score: 37-42)
Draymond Simons drives to the basket... FOUL! Offensive foul on Draymond Simons! Blake Russell drew the charge! [Team fouls: 4] (Draymond Simons: 2 personal fouls) TURNOVER! (dead ball)

[05:48] Team_054 possession (Score: 37-42)
Blake Russell attempts a 3Pt. Wide open! Draymond Simons is 7.4 feet away. [MAN] Blake Russell misses. Rebound secured by Larry Paul.

[05:32] Team_080 possession (Score: 37-42)
Draymond Simons makes the Layup and draws the foul on Blake Russell! And-1! Draymond Simons to the line for 1. [Team fouls: 4] (Blake Russell: 1 personal fouls)   FT 1/1: GOOD Draymond Simons makes 1/1 from the line.
Score: 40-42

[05:17] Team_054 possession (Score: 40-42)
Vince Ball drives, Draymond Simons stays with him. Vince Ball attempts a Layup. Contested by Draymond Simons (5.5 feet, ZONE). VINCE BALL MAKES IT!
Score: 40-44

[05:02] Team_080 possession (Score: 40-44)
Khris Turner attempts a Midrange. Contested by Lauri Irving (4.3 feet, MAN). KHRIS TURNER MAKES IT!
Score: 42-44

[04:48] Team_054 possession (Score: 42-44)
Blake Russell drives, picks up Draymond Simons. Help arrives from Khris Turner! Blake Russell attempts a Dunk. Contested by Khris Turner (5.0 feet, MAN). BLAKE RUSSELL MAKES IT! Assist: Lauri Irving
Score: 42-46

[04:36] Team_080 possession (Score: 42-46)
Khris Turner attempts a Layup. Contested by Blake Russell (3.6 feet, ZONE). KHRIS TURNER MAKES IT! Assist: Draymond Simons
Score: 44-46

[04:23] Team_054 possession (Score: 44-46)
Blake Russell attempts a Midrange. Contested by Khris Turner (5.6 feet, ZONE). Blake Russell misses. Rebound secured by Jaren Morant.

[04:08] Team_080 possession (Score: 44-46)
Larry Paul drives and kicks out. Lauri Dosunmu attempts a Midrange. BLOCKED BY MALCOLM HARDEN! Ball goes out off Malcolm Harden. Lauri Dosunmu's ball!

[03:57] Team_080 possession (Score: 44-46)
Jaren Morant attempts a 3Pt. Wide open! Luka Brogdon is 7.2 feet away. [MAN] Jaren Morant misses. Offensive rebound by Jaren Morant! Jaren Morant kicks it out.

[03:42] Team_080 possession (Score: 44-46)
Jaren Morant attempts a Layup. Contested by Luka Brogdon (5.8 feet, MAN). Jaren Morant misses. Rebound secured by Blake Russell.

[03:30] Team_054 possession (Score: 44-46)
Malcolm Harden throws a bad pass out of bounds! TURNOVER! (dead ball)

[03:30] Substitution (Team_080): Lauri Dosunmu OUT → Tony James IN (stamina_rule2)

[03:30] Substitution (Team_080): Khris Turner OUT → Larry Reaves IN (stamina_rule2)

[03:30] Substitution (Team_080): Larry Paul OUT → Joel Bryant IN (stamina_rule2)

[03:30] Substitution (Team_080): Jaren Morant OUT → Ja Cunningham IN (stamina_rule2)

[03:30] Substitution (Team_080): Draymond Simons OUT → Trae Brogdon IN (stamina_rule2)

[03:30] Substitution (Team_054): Malcolm Harden OUT → Shaquille Irving IN (stamina_rule2)

[03:30] Substitution (Team_054): Lauri Irving OUT → Bradley Quickley IN (stamina_rule2)

[03:30] Substitution (Team_054): Vince Ball OUT → Vince James IN (stamina_rule2)

[03:30] Substitution (Team_054): Luka Brogdon OUT → Tobias Nowitzki IN (stamina_rule2)

[03:30] Substitution (Team_054): Blake Russell OUT → Devin Jackson IN (stamina_rule2)

[03:19] Team_080 possession (Score: 44-46)
Joel Bryant attempts a 3Pt. Contested by Vince James (4.6 feet, MAN). JOEL BRYANT MAKES IT! Assist: Tony James
Score: 47-46

[03:04] Team_054 possession (Score: 47-46)
Shaquille Irving attempts a 3Pt. Contested by Tony James (5.7 feet, MAN). Shaquille Irving misses. Offensive rebound by Vince James! Vince James kicks it out.

[02:53] Team_054 possession (Score: 47-46)
Shaquille Irving attempts a 3Pt. Wide open! Joel Bryant is 6.6 feet away. [ZONE] Shaquille Irving misses. FOUL! Loose ball foul on Ja Cunningham during the rebound battle. [IN THE BONUS! 5 team fouls] Tobias Nowitzki to the line for 2 free throws. (Ja Cunningham: 1 personal fouls)   FT 1/2: GOOD   FT 2/2: GOOD Tobias Nowitzki makes 2/2 from the line.
Score: 47-48

[02:40] Team_080 possession (Score: 47-48)
Ja Cunningham attempts a 3Pt. Contested by Shaquille Irving (4.6 feet, ZONE). JA CUNNINGHAM MAKES IT! Assist: Tony James
Score: 50-48

[02:24] Team_054 possession (Score: 50-48)
Vince James attempts a 3Pt. Contested by Larry Reaves (2.5 feet, ZONE). Vince James misses. Rebound secured by Ja Cunningham.

[02:12] Team_080 possession (Score: 50-48)
Joel Bryant attempts a 3Pt. Wide open! Vince James is 8.3 feet away. [MAN] JOEL BRYANT MAKES IT! Assist: Trae Brogdon
Score: 53-48

[01:57] Team_054 possession (Score: 53-48)
Shaquille Irving drives, Tony James stays with him. Shaquille Irving attempts a Dunk. Contested by Tony James (4.7 feet, MAN). SHAQUILLE IRVING MAKES IT! Assist: Tobias Nowitzki
Score: 53-50

[01:39] Team_080 possession (Score: 53-50)
Tony James attempts a 3Pt. Contested by Shaquille Irving (5.0 feet, MAN). Tony James misses. Rebound secured by Tobias Nowitzki.

[01:29] Team_054 possession (Score: 53-50)
Bradley Quickley attempts a 3Pt. Contested by Joel Bryant (3.2 feet, ZONE). BRADLEY QUICKLEY MAKES IT! Assist: Tobias Nowitzki
Score: 53-53

[01:16] Team_080 possession (Score: 53-53)
Joel Bryant drives, picks up Vince James. Help arrives from Bradley Quickley! Joel Bryant attempts a Dunk. Wide open! Bradley Quickley is 6.8 feet away. [MAN] JOEL BRYANT MAKES IT! Assist: Tony James
Score: 55-53

[01:05] Team_054 possession (Score: 55-53)
Shaquille Irving attempts a Midrange. Wide open! Joel Bryant is 9.7 feet away. [ZONE] Shaquille Irving misses. Rebound secured by Larry Reaves.

[00:47] Team_080 possession (Score: 55-53)
FOUL! Shooting foul on Vince James. Joel Bryant to the line for 2 free throws. [BONUS: 5 team fouls] (Vince James: 1 personal fouls)   FT 1/2: GOOD   FT 2/2: MISS Joel Bryant makes 1/2 from the line. Rebound secured by Tobias Nowitzki.
Score: 56-53

[00:36] Team_054 possession (Score: 56-53)
Bradley Quickley attempts a Midrange. Contested by Larry Reaves (3.4 feet, MAN). Bradley Quickley misses. Rebound secured by Ja Cunningham.

[00:20] Team_080 possession (Score: 56-53)
Tony James attempts a Layup. Contested by Devin Jackson (4.0 feet, ZONE). Tony James misses. Rebound secured by Devin Jackson.

[00:04] Team_054 possession (Score: 56-53)
Tobias Nowitzki attempts a 3Pt. Wide open! Ja Cunningham is 6.4 feet away. [MAN] TOBIAS NOWITZKI MAKES IT! Assist: Bradley Quickley
Score: 56-56

================================================================================
                              2ND QUARTER COMPLETE                              
================================================================================

2ND QUARTER SCORE: Team_080 28, Team_054 27

BOX SCORE:
================================================================================

Team_080
--------------------------------------------------------------------------------
Player                MIN  PTS  REB  AST  TO      FG   FG%      3P   3P%
--------------------------------------------------------------------------------
Joel Bryant             3    8    0    0   0   3/4    75.0     0/0   0.0
Khris Turner           19    6    0    0   0   3/5    60.0     0/0   0.0
Draymond Simons        19    5    1    1   0   2/3    66.7     0/0   0.0
Larry Paul             21    3    2    0   0   1/3    33.3     0/0   0.0
Ja Cunningham           5    3    2    0   0   1/1   100.0     0/0   0.0
Lauri Dosunmu          19    2    0    1   0   1/1   100.0     0/0   0.0
Jaren Morant           19    0    6    1   0   0/2     0.0     0/0   0.0
Tony James              5    0    0    3   0   0/2     0.0     0/0   0.0
Trae Brogdon            5    0    0    1   0   0/0     0.0     0/0   0.0
Larry Reaves            5    0    1    0   0   0/0     0.0     0/0   0.0

TEAM: FG: 11/21 (52.4%), 3PT: 4/11 (36.4%), REB: 13 (4 off, 9 def), AST: 7, TO: 2
TEAM FOULS: 5 [Team_054 in BONUS]


Team_054
--------------------------------------------------------------------------------
Player                MIN  PTS  REB  AST  TO      FG   FG%      3P   3P%
--------------------------------------------------------------------------------
Vince Ball             21   10    0    0   0   4/4   100.0     0/0   0.0
Tobias Nowitzki         3    5    2    2   0   2/2   100.0     0/0   0.0
Lauri Irving           19    3    3    2   0   1/1   100.0     0/0   0.0
Bradley Quickley        5    3    0    1   0   1/2    50.0     0/0   0.0
Blake Russell          19    2    4    0   0   1/4    25.0     0/0   0.0
Luka Brogdon           21    2    0    0   0   1/2    50.0     0/0   0.0
Shaquille Irving        5    2    0    0   0   1/2    50.0     0/0   0.0
Malcolm Harden         19    0    0    1   0   0/2     0.0     0/0   0.0
Vince James             3    0    1    0   0   0/1     0.0     0/0   0.0
Devin Jackson           5    0    1    0   0   0/0     0.0     0/0   0.0

TEAM: FG: 11/20 (55.0%), 3PT: 5/9 (55.6%), REB: 10 (1 off, 9 def), AST: 6, TO: 3
TEAM FOULS: 5 [Team_080 in BONUS]

================================================================================

================================================================================
                       3RD QUARTER - Team_080 vs Team_054                       
================================================================================

[12:00] Team_080 possession (Score: 56-56)
Draymond Simons drives and kicks out. Draymond Simons attempts a 3Pt. Heavily contested by Blake Russell (0.5 feet, MAN)! Draymond Simons misses. Rebound secured by Lauri Irving.

[11:47] Team_054 possession (Score: 56-56)
Lauri Irving attempts a 3Pt. Wide open! Khris Turner is 6.1 feet away. [MAN] Lauri Irving misses. Rebound secured by Draymond Simons.

[11:32] Team_080 possession (Score: 56-56)
Lauri Dosunmu drives, picks up Malcolm Harden. Help arrives from Lauri Irving! Lauri Dosunmu attempts a Layup. Contested by Lauri Irving (5.4 feet, MAN). LAURI DOSUNMU MAKES IT! Assist: Draymond Simons
Score: 58-56

[11:19] Team_054 possession (Score: 58-56)
Blake Russell drives and kicks out. Malcolm Harden attempts a 3Pt. Contested by Lauri Dosunmu (2.6 feet, MAN). Malcolm Harden misses. Rebound secured by Draymond Simons.

[11:05] Team_080 possession (Score: 58-56)
Larry Paul attempts a Midrange. Contested by Vince Ball (4.5 feet, MAN). Larry Paul misses. Rebound secured by Blake Russell.

[10:50] Team_054 possession (Score: 58-56)
Vince Ball attempts a Midrange. Contested by Larry Paul (5.0 feet, ZONE). Vince Ball misses. Rebound secured by Larry Paul.

[10:37] Team_080 possession (Score: 58-56)
Khris Turner attempts a 3Pt. Wide open! Lauri Irving is 6.7 feet away. [ZONE] Khris Turner misses. Rebound secured by Blake Russell.

[10:21] Team_054 possession (Score: 58-56)
FOUL! Offensive foul on Vince Ball! Larry Paul drew the charge! [Team fouls: 1] (Vince Ball: 1 personal fouls) TURNOVER! (dead ball)

[10:06] Team_080 possession (Score: 58-56)
Larry Paul attempts a Midrange. Contested by Vince Ball (3.8 feet, MAN). Larry Paul misses. Rebound secured by Blake Russell.

[09:49] Team_054 possession (Score: 58-56)
Vince Ball attempts a 3Pt. Wide open! Lauri Dosunmu is 7.5 feet away. [ZONE] Vince Ball misses. Rebound secured by Draymond Simons.

[09:34] Team_080 possession (Score: 58-56)
Larry Paul attempts a 3Pt. Contested by Lauri Irving (5.1 feet, ZONE). LARRY PAUL MAKES IT! Assist: Draymond Simons
Score: 61-56

[09:20] Team_054 possession (Score: 61-56)
Vince Ball attempts a Midrange. Heavily contested by Jaren Morant (0.6 feet, ZONE)! Vince Ball misses. Offensive rebound by Luka Brogdon! Luka Brogdon kicks it out.

[09:02] Team_054 possession (Score: 61-56)
Malcolm Harden attempts a 3Pt. Contested by Lauri Dosunmu (2.6 feet, MAN). Malcolm Harden misses. Rebound secured by Larry Paul.

[08:45] Team_080 possession (Score: 61-56)
Draymond Simons attempts a Midrange. Contested by Blake Russell (3.2 feet, MAN). Draymond Simons misses. Rebound secured by Lauri Irving.

[08:34] Team_054 possession (Score: 61-56)
Malcolm Harden throws a bad pass! Stolen by Lauri Dosunmu! TURNOVER! (live ball)

[08:22] Team_080 possession (Score: 61-56)
Jaren Morant drives to the basket... Jaren Morant throws a bad pass! Stolen by Luka Brogdon! TURNOVER! (live ball)

[08:10] Team_054 possession (Score: 61-56)
Lauri Irving makes the Layup and draws the foul on Khris Turner! And-1! Lauri Irving to the line for 1. [Team fouls: 1] (Khris Turner: 1 personal fouls)   FT 1/1: GOOD Lauri Irving makes 1/1 from the line.
Score: 61-59

[07:59] Team_080 possession (Score: 61-59)
Jaren Morant attempts a Layup. Contested by Blake Russell (4.7 feet, ZONE). Jaren Morant misses. Rebound secured by Luka Brogdon.

[07:47] Team_054 possession (Score: 61-59)
Lauri Irving attempts a Layup. Wide open! Khris Turner is 6.8 feet away. [MAN] LAURI IRVING MAKES IT!
Score: 61-61

[07:29] Team_080 possession (Score: 61-61)
Jaren Morant attempts a 3Pt. Contested by Luka Brogdon (4.5 feet, MAN). JAREN MORANT MAKES IT! Assist: Larry Paul
Score: 64-61

[07:16] Team_054 possession (Score: 64-61)
Malcolm Harden drives, picks up Draymond Simons. Help arrives from Khris Turner! Malcolm Harden attempts a Dunk. Heavily contested by Khris Turner (1.5 feet, ZONE)! MALCOLM HARDEN MAKES IT!
Score: 64-63

[07:01] Team_080 possession (Score: 64-63)
Lauri Dosunmu attempts a 3Pt. Wide open! Malcolm Harden is 8.6 feet away. [ZONE] Lauri Dosunmu misses. Rebound secured by Blake Russell.

[06:47] Team_054 possession (Score: 64-63)
Lauri Irving throws a bad pass out of bounds! TURNOVER! (dead ball)

[06:32] Team_080 possession (Score: 64-63)
Khris Turner attempts a 3Pt. Contested by Lauri Irving (3.3 feet, ZONE). Khris Turner misses. Rebound secured by Luka Brogdon.

[06:17] Team_054 possession (Score: 64-63)
Luka Brogdon attempts a 3Pt. Contested by Jaren Morant (4.9 feet, MAN). Luka Brogdon misses. Rebound secured by Jaren Morant.

[06:02] Team_080 possession (Score: 64-63)
Lauri Dosunmu attempts a Midrange. Contested by Vince Ball (5.2 feet, ZONE). Lauri Dosunmu misses. Rebound secured by Luka Brogdon.

[05:46] Team_054 possession (Score: 64-63)
Malcolm Harden attempts a Midrange. Contested by Lauri Dosunmu (3.9 feet, MAN). Malcolm Harden misses. Offensive rebound by Luka Brogdon! Luka Brogdon kicks it out.

[05:33] Team_054 possession (Score: 64-63)
FOUL! Shooting foul on Khris Turner. Blake Russell to the line for 2 free throws. [Team fouls: 2] (Khris Turner: 2 personal fouls)   FT 1/2: GOOD   FT 2/2: GOOD Blake Russell makes 2/2 from the line.
Score: 64-65

[05:17] Team_080 possession (Score: 64-65)
Larry Paul attempts a 3Pt. Contested by Lauri Irving (2.5 feet, ZONE). Larry Paul misses. Rebound secured by Blake Russell.

[05:04] Team_054 possession (Score: 64-65)
Lauri Irving attempts a 3Pt. Contested by Khris Turner (3.6 feet, MAN). LAURI IRVING MAKES IT! Assist: Malcolm Harden
Score: 64-68

[04:54] Team_080 possession (Score: 64-68)
FOUL! Shooting foul on Lauri Irving. Lauri Dosunmu to the line for 2 free throws. [Team fouls: 2] (Lauri Irving: 1 personal fouls)   FT 1/2: GOOD   FT 2/2: GOOD Lauri Dosunmu makes 2/2 from the line.
Score: 66-68

[04:41] Team_054 possession (Score: 66-68)
FOUL! Holding foul on Jaren Morant. [Team fouls: 3] No free throws, side out. (Jaren Morant: 1 personal fouls)

[04:28] Team_054 possession (Score: 66-68)
Luka Brogdon attempts a Layup. BLOCKED BY JAREN MORANT! Ball is loose! Offensive rebound by Luka Brogdon! Luka Brogdon kicks it out.

[04:11] Team_054 possession (Score: 66-68)
Luka Brogdon drives, picks up Jaren Morant. Help arrives from Khris Turner! Luka Brogdon attempts a Dunk. Heavily contested by Khris Turner (0.5 feet, MAN)! Luka Brogdon misses. Rebound secured by Jaren Morant.

[03:55] Team_080 possession (Score: 66-68)
FOUL! Reach-in foul on Blake Russell during the drive. [Team fouls: 3] No free throws, side out. (Blake Russell: 1 personal fouls)

[03:36] Team_080 possession (Score: 66-68)
Khris Turner commits a violation (traveling/carry)! TURNOVER! (dead ball)

[03:21] Team_054 possession (Score: 66-68)
Vince Ball drives, picks up Draymond Simons. Help arrives from Khris Turner! Vince Ball attempts a Layup. Wide open! Khris Turner is 7.2 feet away. [ZONE] Vince Ball misses. Rebound secured by Draymond Simons.

[03:04] Team_080 possession (Score: 66-68)
Jaren Morant drives and kicks out. Jaren Morant attempts a Midrange. Contested by Luka Brogdon (3.0 feet, MAN). Jaren Morant misses. Rebound secured by Luka Brogdon.

[02:49] Team_054 possession (Score: 66-68)
Malcolm Harden throws a bad pass! Stolen by Lauri Dosunmu! TURNOVER! (live ball)

[02:40] Team_080 possession (Score: 66-68)
Jaren Morant throws a bad pass out of bounds! TURNOVER! (dead ball)

[02:40] Substitution (Team_080): Lauri Dosunmu OUT → Tony James IN (stamina_rule2)

[02:40] Substitution (Team_080): Jaren Morant OUT → Ja Cunningham IN (stamina_rule2)

[02:40] Substitution (Team_080): Draymond Simons OUT → Trae Brogdon IN (stamina_rule2)

[02:40] Substitution (Team_054): Blake Russell OUT → Devin Jackson IN (stamina_rule2)

[02:26] Team_054 possession (Score: 66-68)
FOUL! Offensive foul on Vince Ball! Larry Paul drew the charge! [Team fouls: 4] (Vince Ball: 2 personal fouls) TURNOVER! (dead ball)

[02:12] Team_080 possession (Score: 66-68)
Khris Turner attempts a 3Pt. Contested by Lauri Irving (4.0 feet, ZONE). KHRIS TURNER MAKES IT! Assist: Trae Brogdon
Score: 69-68

[01:55] Team_054 possession (Score: 69-68)
Lauri Irving attempts a Layup. Contested by Ja Cunningham (3.3 feet, ZONE). LAURI IRVING MAKES IT! Assist: Malcolm Harden
Score: 69-70

[01:39] Team_080 possession (Score: 69-70)
Larry Paul makes the Layup and draws the foul on Luka Brogdon! And-1! Larry Paul to the line for 1. [BONUS: 5 team fouls] (Luka Brogdon: 1 personal fouls)   FT 1/1: GOOD Larry Paul makes 1/1 from the line.
Score: 72-70

[01:19] Team_054 possession (Score: 72-70)
Lauri Irving loses the ball! Stripped by Khris Turner! TURNOVER! (live ball)

[01:02] Team_080 possession (Score: 72-70)
Larry Paul attempts a 3Pt. Wide open! Vince Ball is 6.6 feet away. [MAN] LARRY PAUL MAKES IT! Assist: Khris Turner
Score: 75-70

[00:51] Team_054 possession (Score: 75-70)
FOUL! Holding foul on Larry Paul. [IN THE BONUS! 5 team fouls] Vince Ball to the line for 2 free throws. (Larry Paul: 1 personal fouls)   FT 1/2: GOOD   FT 2/2: GOOD Vince Ball makes 2/2 from the line.
Score: 75-72

[00:37] Team_080 possession (Score: 75-72)
Tony James attempts a 3Pt. Contested by Lauri Irving (2.8 feet, ZONE). Tony James misses. Rebound secured by Lauri Irving.

[00:23] Team_054 possession (Score: 75-72)
Luka Brogdon attempts a Midrange. Wide open! Ja Cunningham is 6.8 feet away. [MAN] Luka Brogdon misses. Offensive rebound by Vince Ball! Vince Ball kicks it out.

[00:09] Team_054 possession (Score: 75-72)
Lauri Irving attempts a 3Pt. Wide open! Ja Cunningham is 6.3 feet away. [ZONE] LAURI IRVING MAKES IT!
Score: 75-75

================================================================================
                              3RD QUARTER COMPLETE                              
================================================================================

3RD QUARTER SCORE: Team_080 19, Team_054 19

BOX SCORE:
================================================================================

Team_080
--------------------------------------------------------------------------------
Player                MIN  PTS  REB  AST  TO      FG   FG%      3P   3P%
--------------------------------------------------------------------------------
Larry Paul             33    9    2    1   0   3/6    50.0     0/0   0.0
Lauri Dosunmu          29    4    0    0   0   2/4    50.0     0/0   0.0
Khris Turner           31    3    0    1   0   1/3    33.3     0/0   0.0
Jaren Morant           29    3    2    0   0   1/3    33.3     0/0   0.0
Draymond Simons        29    0    4    2   0   0/2     0.0     0/0   0.0
Trae Brogdon            8    0    0    1   0   0/0     0.0     0/0   0.0
Tony James              8    0    0    0   0   0/1     0.0     0/0   0.0

TEAM: FG: 7/19 (36.8%), 3PT: 4/9 (44.4%), REB: 8 (0 off, 8 def), AST: 5, TO: 3
TEAM FOULS: 5 [Team_054 in BONUS]


Team_054
--------------------------------------------------------------------------------
Player                MIN  PTS  REB  AST  TO      FG   FG%      3P   3P%
--------------------------------------------------------------------------------
Lauri Irving           31   13    3    0   0   5/6    83.3     0/0   0.0
Blake Russell          29    2    5    0   0   1/2    50.0     0/0   0.0
Vince Ball             33    2    1    0   0   1/4    25.0     0/0   0.0
Malcolm Harden         31    2    0    2   0   1/2    50.0     0/0   0.0
Luka Brogdon           33    0    7    0   0   0/2     0.0     0/0   0.0

TEAM: FG: 8/16 (50.0%), 3PT: 2/6 (33.3%), REB: 16 (4 off, 12 def), AST: 2, TO: 6
TEAM FOULS: 5 [Team_080 in BONUS]

================================================================================

================================================================================
                       4TH QUARTER - Team_080 vs Team_054                       
================================================================================

[12:00] Team_080 possession (Score: 75-75)
Draymond Simons attempts a Midrange. Heavily contested by Luka Brogdon (0.5 feet, ZONE)! DRAYMOND SIMONS MAKES IT! Assist: Jaren Morant
Score: 77-75

[11:46] Team_054 possession (Score: 77-75)
Luka Brogdon attempts a 3Pt. Contested by Jaren Morant (2.5 feet, MAN). LUKA BROGDON MAKES IT! Assist: Vince Ball
Score: 77-78

[11:35] Team_080 possession (Score: 77-78)
Jaren Morant attempts a Layup. BLOCKED BY BLAKE RUSSELL! Ball deflects out of bounds off Jaren Morant.

[11:25] Team_054 possession (Score: 77-78)
Lauri Irving makes the Layup and draws the foul on Draymond Simons! And-1! Lauri Irving to the line for 1. [Team fouls: 1] (Draymond Simons: 1 personal fouls)   FT 1/1: GOOD Lauri Irving makes 1/1 from the line.
Score: 77-81

[11:10] Team_080 possession (Score: 77-81)
Jaren Morant drives and kicks out. Jaren Morant attempts a 3Pt. Contested by Vince Ball (3.5 feet, ZONE). JAREN MORANT MAKES IT! Assist: Draymond Simons
Score: 80-81

[10:56] Team_054 possession (Score: 80-81)
Lauri Irving attempts a 3Pt. Contested by Lauri Dosunmu (5.7 feet, ZONE). LAURI IRVING MAKES IT! Assist: Vince Ball
Score: 80-84

[10:39] Team_080 possession (Score: 80-84)
Draymond Simons attempts a Midrange. Contested by Vince Ball (4.7 feet, ZONE). DRAYMOND SIMONS MAKES IT! Assist: Jaren Morant
Score: 82-84

[10:28] Team_054 possession (Score: 82-84)
Blake Russell attempts a Layup. Contested by Draymond Simons (4.5 feet, ZONE). BLAKE RUSSELL MAKES IT! Assist: Malcolm Harden
Score: 82-86

[10:14] Team_080 possession (Score: 82-86)
Jaren Morant drives, Blake Russell stays with him. Jaren Morant attempts a Layup. Contested by Blake Russell (4.8 feet, ZONE). Jaren Morant misses. Rebound secured by Blake Russell.

[09:59] Team_054 possession (Score: 82-86)
FOUL! Shooting foul on Lauri Dosunmu. Malcolm Harden to the line for 3 free throws. [Team fouls: 2] (Lauri Dosunmu: 1 personal fouls)   FT 1/3: GOOD   FT 2/3: GOOD   FT 3/3: GOOD Malcolm Harden makes 3/3 from the line.
Score: 82-89

[09:44] Team_080 possession (Score: 82-89)
Lauri Dosunmu drives and kicks out. Jaren Morant attempts a 3Pt. Wide open! Lauri Irving is 6.4 feet away. [ZONE] Jaren Morant misses. Rebound secured by Luka Brogdon.

[09:28] Team_054 possession (Score: 82-89)
Lauri Irving drives to the basket... Lauri Irving commits a violation (traveling/carry)! TURNOVER! (dead ball)

[09:28] Substitution (Team_080): Khris Turner OUT → Larry Reaves IN (stamina_rule2)

[09:28] Substitution (Team_080): Larry Paul OUT → Joel Bryant IN (stamina_rule2)

[09:28] Substitution (Team_080): Jaren Morant OUT → Ja Cunningham IN (stamina_rule2)

[09:28] Substitution (Team_080): Draymond Simons OUT → Trae Brogdon IN (stamina_rule2)

[09:28] Substitution (Team_054): Malcolm Harden OUT → Shaquille Irving IN (stamina_rule2)

[09:28] Substitution (Team_054): Lauri Irving OUT → Bradley Quickley IN (stamina_rule2)

[09:28] Substitution (Team_054): Vince Ball OUT → Vince James IN (stamina_rule2)

[09:28] Substitution (Team_054): Luka Brogdon OUT → Tobias Nowitzki IN (stamina_rule2)

[09:28] Substitution (Team_054): Blake Russell OUT → Devin Jackson IN (stamina_rule2)

[09:13] Team_080 possession (Score: 82-89)
Trae Brogdon drives and kicks out. Joel Bryant attempts a Midrange. Wide open! Tobias Nowitzki is 7.1 feet away. [ZONE] JOEL BRYANT MAKES IT! Assist: Lauri Dosunmu
Score: 84-89

[08:58] Team_054 possession (Score: 84-89)
Bradley Quickley attempts a 3Pt. Heavily contested by Larry Reaves (0.5 feet, MAN)! Bradley Quickley misses. Rebound secured by Trae Brogdon.

[08:44] Team_080 possession (Score: 84-89)
Lauri Dosunmu attempts a Layup. Contested by Devin Jackson (3.2 feet, ZONE). LAURI DOSUNMU MAKES IT! Assist: Joel Bryant
Score: 86-89

[08:30] Team_054 possession (Score: 86-89)
Shaquille Irving attempts a 3Pt. Contested by Lauri Dosunmu (2.3 feet, ZONE). Shaquille Irving misses. Rebound secured by Trae Brogdon.

[08:16] Team_080 possession (Score: 86-89)
Joel Bryant attempts a 3Pt. Wide open! Shaquille Irving is 7.0 feet away. [ZONE] Joel Bryant misses. Rebound secured by Tobias Nowitzki.

[08:03] Team_054 possession (Score: 86-89)
Vince James attempts a 3Pt. Contested by Joel Bryant (4.6 feet, MAN). Vince James misses. Rebound secured by Larry Reaves.

[07:46] Team_080 possession (Score: 86-89)
Ja Cunningham attempts a 3Pt. Contested by Shaquille Irving (5.0 feet, ZONE). Ja Cunningham misses. Rebound secured by Devin Jackson.

[07:29] Team_054 possession (Score: 86-89)
Bradley Quickley attempts a 3Pt. Contested by Lauri Dosunmu (3.9 feet, ZONE). Bradley Quickley misses. Rebound secured by Larry Reaves.

[07:15] Team_080 possession (Score: 86-89)
Joel Bryant attempts a 3Pt. Contested by Vince James (4.2 feet, MAN). Joel Bryant misses. Offensive rebound by Larry Reaves! Larry Reaves kicks it out.

[07:01] Team_080 possession (Score: 86-89)
FOUL! Holding foul on Devin Jackson. [Team fouls: 1] No free throws, side out. (Devin Jackson: 1 personal fouls)

[06:51] Team_080 possession (Score: 86-89)
Ja Cunningham attempts a Layup. Contested by Devin Jackson (4.9 feet, ZONE). JA CUNNINGHAM MAKES IT!
Score: 88-89

[06:35] Team_054 possession (Score: 88-89)
Devin Jackson attempts a 3Pt. Contested by Lauri Dosunmu (5.4 feet, ZONE). Devin Jackson misses. Rebound secured by Trae Brogdon.

[06:17] Team_080 possession (Score: 88-89)
Ja Cunningham attempts a Midrange. Contested by Tobias Nowitzki (3.2 feet, ZONE). Ja Cunningham misses. Rebound secured by Tobias Nowitzki.

[06:07] Team_054 possession (Score: 88-89)
Devin Jackson drives, picks up Trae Brogdon. Help arrives from Larry Reaves! Devin Jackson attempts a Layup. Contested by Larry Reaves (4.1 feet, MAN). DEVIN JACKSON MAKES IT! Assist: Tobias Nowitzki
Score: 88-91

[05:57] Team_080 possession (Score: 88-91)
Ja Cunningham attempts a 3Pt. Contested by Tobias Nowitzki (3.9 feet, MAN). Ja Cunningham misses. Rebound secured by Tobias Nowitzki.

[05:41] Team_054 possession (Score: 88-91)
Devin Jackson drives to the basket... FOUL! Offensive foul on Devin Jackson! Ja Cunningham drew the charge! [Team fouls: 2] (Devin Jackson: 2 personal fouls) TURNOVER! (dead ball)

[05:25] Team_080 possession (Score: 88-91)
Joel Bryant throws a bad pass out of bounds! TURNOVER! (dead ball)

[05:25] Substitution (Team_080): Lauri Dosunmu OUT → Tony James IN (stamina_rule2)

[05:07] Team_054 possession (Score: 88-91)
Shaquille Irving attempts a 3Pt. Wide open! Tony James is 6.1 feet away. [MAN] Shaquille Irving misses. Offensive rebound by Vince James! Vince James kicks it out.

[04:55] Team_054 possession (Score: 88-91)
Shaquille Irving loses control! Ball rolls out of bounds! TURNOVER! (dead ball)

[04:38] Team_080 possession (Score: 88-91)
Joel Bryant attempts a 3Pt. Contested by Shaquille Irving (3.4 feet, ZONE). JOEL BRYANT MAKES IT! Assist: Ja Cunningham
Score: 91-91

[04:21] Team_054 possession (Score: 91-91)
Tobias Nowitzki attempts a Midrange. Contested by Ja Cunningham (5.1 feet, ZONE). TOBIAS NOWITZKI MAKES IT!
Score: 91-93

[04:06] Team_080 possession (Score: 91-93)
Larry Reaves makes the Layup and draws the foul on Bradley Quickley! And-1! Larry Reaves to the line for 1. [Team fouls: 3] (Bradley Quickley: 1 personal fouls)   FT 1/1: GOOD Larry Reaves makes 1/1 from the line.
Score: 94-93

[03:50] Team_054 possession (Score: 94-93)
Shaquille Irving drives and kicks out. Vince James attempts a Midrange. Contested by Larry Reaves (3.8 feet, ZONE). Vince James misses. Rebound secured by Larry Reaves.

[03:32] Team_080 possession (Score: 94-93)
Larry Reaves attempts a 3Pt. Wide open! Bradley Quickley is 7.1 feet away. [MAN] Larry Reaves misses. Rebound secured by Vince James.

[03:14] Team_054 possession (Score: 94-93)
Devin Jackson drives and kicks out. Devin Jackson attempts a 3Pt. Contested by Joel Bryant (6.0 feet, ZONE). DEVIN JACKSON MAKES IT! Assist: Tobias Nowitzki
Score: 94-96

[03:01] Team_080 possession (Score: 94-96)
Tony James drives to the basket... Tony James loses the ball! Stripped by Shaquille Irving! TURNOVER! (live ball)

[02:44] Team_054 possession (Score: 94-96)
Devin Jackson attempts a Midrange. Wide open! Trae Brogdon is 9.5 feet away. [MAN] DEVIN JACKSON MAKES IT!
Score: 94-98

[02:26] Team_080 possession (Score: 94-98)
Tony James drives, Tobias Nowitzki stays with him. Tony James attempts a Dunk. Contested by Tobias Nowitzki (5.8 feet, ZONE). Tony James misses. Rebound secured by Tobias Nowitzki.

[02:09] Team_054 possession (Score: 94-98)
Vince James attempts a Midrange. Heavily contested by Joel Bryant (0.9 feet, MAN)! Vince James misses. Rebound secured by Larry Reaves.

[01:56] Team_080 possession (Score: 94-98)
Ja Cunningham drives and kicks out. Larry Reaves attempts a 3Pt. Contested by Bradley Quickley (4.0 feet, MAN). LARRY REAVES MAKES IT! Assist: Tony James
Score: 97-98

[01:41] Team_054 possession (Score: 97-98)
Tobias Nowitzki attempts a 3Pt. Contested by Joel Bryant (5.1 feet, ZONE). TOBIAS NOWITZKI MAKES IT! Assist: Vince James
Score: 97-101

[01:28] Team_080 possession (Score: 97-101)
Joel Bryant attempts a 3Pt. Contested by Shaquille Irving (3.4 feet, ZONE). JOEL BRYANT MAKES IT! Assist: Ja Cunningham
Score: 100-101

[01:15] Team_054 possession (Score: 100-101)
Bradley Quickley attempts a Midrange. Contested by Larry Reaves (2.3 feet, MAN). Bradley Quickley misses. Rebound secured by Joel Bryant.

[00:58] Team_080 possession (Score: 100-101)
Trae Brogdon drives and kicks out. Ja Cunningham attempts a 3Pt. Wide open! Tobias Nowitzki is 7.0 feet away. [MAN] JA CUNNINGHAM MAKES IT!
Score: 103-101

[00:43] Team_054 possession (Score: 103-101)
Bradley Quickley attempts a Layup. BLOCKED BY JA CUNNINGHAM! Ball is loose! Rebound secured by Ja Cunningham.

[00:28] Team_080 possession (Score: 103-101)
Ja Cunningham attempts a 3Pt. Contested by Shaquille Irving (5.7 feet, ZONE). Ja Cunningham misses. Rebound secured by Vince James.

[00:11] Team_054 possession (Score: 103-101)
Shaquille Irving drives, Ja Cunningham stays with him. Shaquille Irving attempts a Layup. Wide open! Ja Cunningham is 7.6 feet away. [ZONE] SHAQUILLE IRVING MAKES IT! Assist: Devin Jackson
Score: 103-103

================================================================================
                              4TH QUARTER COMPLETE                              
================================================================================

4TH QUARTER SCORE: Team_080 28, Team_054 28

BOX SCORE:
================================================================================

Team_080
--------------------------------------------------------------------------------
Player                MIN  PTS  REB  AST  TO      FG   FG%      3P   3P%
--------------------------------------------------------------------------------
Joel Bryant            13    8    1    1   0   3/4    75.0     0/0   0.0
Larry Reaves           14    6    5    0   0   2/3    66.7     0/0   0.0
Ja Cunningham          17    5    1    2   0   2/6    33.3     0/0   0.0
Draymond Simons        32    4    0    1   0   2/2   100.0     0/0   0.0
Jaren Morant           32    3    0    2   0   1/3    33.3     0/0   0.0
Lauri Dosunmu          36    2    0    1   0   1/2    50.0     0/0   0.0
Trae Brogdon           17    0    3    0   0   0/0     0.0     0/0   0.0
Tony James             13    0    0    1   0   0/1     0.0     0/0   0.0

TEAM: FG: 11/21 (52.4%), 3PT: 2/7 (28.6%), REB: 10 (1 off, 9 def), AST: 8, TO: 2
TEAM FOULS: 2


Team_054
--------------------------------------------------------------------------------
Player                MIN  PTS  REB  AST  TO      FG   FG%      3P   3P%
--------------------------------------------------------------------------------
Devin Jackson          17    7    1    1   0   3/4    75.0     0/0   0.0
Lauri Irving           34    6    0    0   0   2/2   100.0     0/0   0.0
Tobias Nowitzki        13    5    4    2   0   2/2   100.0     0/0   0.0
Luka Brogdon           36    3    1    0   0   1/1   100.0     0/0   0.0
Malcolm Harden         34    3    0    1   0   1/1   100.0     0/0   0.0
Blake Russell          32    2    1    0   0   1/1   100.0     0/0   0.0
Shaquille Irving       14    2    0    0   0   1/3    33.3     0/0   0.0
Vince Ball             36    0    0    2   0   0/0     0.0     0/0   0.0
Bradley Quickley       14    0    0    0   0   0/4     0.0     0/0   0.0
Vince James            13    0    3    1   0   0/2     0.0     0/0   0.0

TEAM: FG: 11/20 (55.0%), 3PT: 4/9 (44.4%), REB: 10 (1 off, 9 def), AST: 7, TO: 3
TEAM FOULS: 3

================================================================================

================================================================================
                               FULL GAME COMPLETE                               
================================================================================

FINAL SCORE: Team_080 103, Team_054 103

SCORING BY QUARTER:
--------------------------------------------------------------------------------
Team                     Q1     Q2     Q3     Q4    FINAL
--------------------------------------------------------------------------------
Team_080                 28     28     19     28      103
Team_054                 29     27     19     28      103
--------------------------------------------------------------------------------

FULL GAME BOX SCORE:
================================================================================

Team_080
--------------------------------------------------------------------------------
Player                MIN  PTS  REB  AST  TO      FG   FG%      3P   3P%      FT STL BLK
--------------------------------------------------------------------------------
Larry Paul             36   17    7    2   0   5/11   45.5   3/7    42.9   4/4     0   0
Lauri Dosunmu          36   16    0    3   1  10/13   76.9   4/5    80.0   5/5     2   0
Khris Turner           34    9    0    1   4   4/10   40.0   1/5    20.0   2/2     1   0
Jaren Morant           32   10   13    4   2   4/11   36.4   1/2    50.0   2/2     0   1
Draymond Simons        32   17    6    4   3   6/9    66.7   0/1     0.0   3/3     0   1
Ja Cunningham          17   11    3    2   0   4/8    50.0   2/5    40.0   0/0     0   1
Trae Brogdon           17    0    3    2   1   2/3    66.7   0/0     0.0   0/0     0   0
Larry Reaves           14    6    6    0   0   1/2    50.0   0/1     0.0   1/1     0   1
Tony James             13    0    0    5   0   0/4     0.0   0/2     0.0   0/0     0   0
Joel Bryant            13   16    1    1   1   5/7    71.4   4/5    80.0   1/2     0   0

TEAM: FG: 41/78 (52.6%), 3PT: 15/33 (45.5%), REB: 40 (8 off, 32 def), AST: 24, TO: 12


Team_054
--------------------------------------------------------------------------------
Player                MIN  PTS  REB  AST  TO      FG   FG%      3P   3P%      FT STL BLK
--------------------------------------------------------------------------------
Vince Ball             36   25    2    2   3   9/13   69.2   3/5    60.0   6/6     0   0
Luka Brogdon           36   12    8    1   1   6/11   54.5   1/4    25.0   1/2     1   0
Malcolm Harden         34    5    0    6   4   2/6    33.3   1/2    50.0   3/3     0   1
Lauri Irving           34   24    6    3   3   9/12   75.0   4/6    66.7   2/2     1   1
Blake Russell          32   11   13    2   1   5/10   50.0   1/3    33.3   2/2     0   1
Devin Jackson          17    7    2    2   1   3/4    75.0   0/1     0.0   0/0     0   1
Shaquille Irving       14    4    0    1   1   3/6    50.0   1/2    50.0   0/0     1   0
Bradley Quickley       14    5    0    1   0   2/7    28.6   1/3    33.3   0/0     0   0
Vince James            13    0    4    1   0   0/3     0.0   0/2     0.0   0/0     0   0
Tobias Nowitzki        13   10    6    4   0   3/3   100.0   2/2   100.0   2/2     0   0

TEAM: FG: 43/76 (56.6%), 3PT: 14/30 (46.7%), REB: 40 (6 off, 34 def), AST: 23, TO: 14

================================================================================
