================================================================================
                        FULL GAME - Team_042 vs Team_067                        
================================================================================

================================================================================
                       1ST QUARTER - Team_042 vs Team_067                       
================================================================================

[12:00] Team_042 possession (Score: 0-0)
Cade Dosunmu throws a bad pass out of bounds! TURNOVER! (dead ball)

[11:48] Team_067 possession (Score: 0-0)
Manu Reaves attempts a Midrange. Contested by Tyler Barrett (4.7 feet, MAN). MANU REAVES MAKES IT! Assist: Wendell Antetokounmpo
Score: 0-2

[11:36] Team_042 possession (Score: 0-2)
FOUL! Shooting foul on Desmond Simmons. Jarrett Sabonis to the line for 3 free throws. [Team fouls: 1] (Desmond Simmons: 1 personal fouls)   FT 1/3: GOOD   FT 2/3: GOOD   FT 3/3: MISS Jarrett Sabonis makes 2/3 from the line. Rebound secured by Wendell Antetokounmpo.
Score: 2-2

[11:20] Team_067 possession (Score: 2-2)
Malcolm Westbrook drives to the basket... Malcolm Westbrook throws a bad pass! Stolen by Cade Dosunmu! TURNOVER! (live ball)

[11:08] Team_042 possession (Score: 2-2)
Jarrett Sabonis makes the Dunk and draws the foul on Desmond Simmons! And-1! Jarrett Sabonis to the line for 1. [Team fouls: 2] (Desmond Simmons: 2 personal fouls)   FT 1/1: GOOD Jarrett Sabonis makes 1/1 from the line.
Score: 5-2

[10:55] Team_067 possession (Score: 5-2)
Malcolm Westbrook attempts a 3Pt. Contested by Cade Dosunmu (4.4 feet, MAN). Malcolm Westbrook misses. Rebound secured by Tyler Barrett.

[10:43] Team_042 possession (Score: 5-2)
Jarrett Sabonis drives, Malcolm Westbrook stays with him. Jarrett Sabonis attempts a Layup. Contested by Malcolm Westbrook (5.6 feet, ZONE). Jarrett Sabonis misses. Offensive rebound by Dejounte Butler! Dejounte Butler puts it back in!
Score: 7-2

[10:34] Team_067 possession (Score: 7-2)
Manu Reaves drives and kicks out. Desmond Simmons attempts a 3Pt. Contested by Jarrett Sabonis (5.7 feet, MAN). Desmond Simmons misses. Rebound secured by Dejounte Butler.

[10:18] Team_042 possession (Score: 7-2)
FOUL! Shooting foul on Wendell Antetokounmpo. Jarrett Sabonis to the line for 2 free throws. [Team fouls: 3] (Wendell Antetokounmpo: 1 personal fouls)   FT 1/2: MISS   FT 2/2: MISS Jarrett Sabonis makes 0/2 from the line. Rebound secured by Malcolm Westbrook.

[10:01] Team_067 possession (Score: 7-2)
Manu Reaves attempts a 3Pt. Contested by Jarrett Sabonis (5.8 feet, ZONE). MANU REAVES MAKES IT! Assist: Malcolm Westbrook
Score: 7-5

[09:48] Team_042 possession (Score: 7-5)
Kristaps Parker drives, picks up Malcolm Westbrook. Help arrives from Wendell Antetokounmpo! Kristaps Parker attempts a Layup. Contested by Wendell Antetokounmpo (3.8 feet, ZONE). KRISTAPS PARKER MAKES IT! Assist: Dejounte Butler
Score: 9-5

[09:36] Team_067 possession (Score: 9-5)
Ben Ball attempts a Midrange. Wide open! Dejounte Butler is 7.7 feet away. [MAN] BEN BALL MAKES IT! Assist: Desmond Simmons
Score: 9-7

[09:24] Team_042 possession (Score: 9-7)
Tyler Barrett drives to the basket... FOUL! Offensive foul on Tyler Barrett! Manu Reaves drew the charge! [Team fouls: 1] (Tyler Barrett: 1 personal fouls) TURNOVER! (dead ball)

[09:07] Team_067 possession (Score: 9-7)
Ben Ball drives, picks up Dejounte Butler. Help arrives from Tyler Barrett! Ben Ball attempts a Dunk. Wide open! Tyler Barrett is 7.0 feet away. [ZONE] Ben Ball misses. Rebound secured by Tyler Barrett.

[08:53] Team_042 possession (Score: 9-7)
Cade Dosunmu attempts a Midrange. Contested by Malcolm Westbrook (5.7 feet, MAN). Cade Dosunmu misses. Offensive rebound by Dejounte Butler! Dejounte Butler puts it back in!
Score: 11-7

[08:37] Team_067 possession (Score: 11-7)
Ben Ball drives, picks up Dejounte Butler. Help arrives from Tyler Barrett! Ben Ball attempts a Layup. Contested by Tyler Barrett (2.3 feet, MAN). Ben Ball misses. FOUL! Loose ball foul on Cade Dosunmu during the rebound battle. [Team fouls: 2] No free throws, side out. (Cade Dosunmu: 1 personal fouls)

[08:25] Team_067 possession (Score: 11-7)
Ben Ball attempts a Layup. Contested by Cade Dosunmu (2.4 feet, ZONE). Ben Ball misses. Rebound secured by Cade Dosunmu.

[08:14] Team_042 possession (Score: 11-7)
Cade Dosunmu attempts a Layup. Contested by Malcolm Westbrook (3.8 feet, ZONE). CADE DOSUNMU MAKES IT! Assist: Jarrett Sabonis
Score: 13-7

[08:02] Team_067 possession (Score: 13-7)
Desmond Simmons drives and kicks out. Manu Reaves attempts a 3Pt. Wide open! Tyler Barrett is 8.0 feet away. [MAN] MANU REAVES MAKES IT! Assist: Wendell Antetokounmpo
Score: 13-10

[07:48] Team_042 possession (Score: 13-10)
Jarrett Sabonis drives and kicks out. Jarrett Sabonis makes the Midrange and draws the foul on Desmond Simmons! And-1! Jarrett Sabonis to the line for 1. [Team fouls: 4] (Desmond Simmons: 3 personal fouls)   FT 1/1: GOOD Jarrett Sabonis makes 1/1 from the line.
Score: 16-10

[07:32] Team_067 possession (Score: 16-10)
Manu Reaves drives, Tyler Barrett stays with him. Manu Reaves attempts a Dunk. Contested by Tyler Barrett (4.7 feet, MAN). Manu Reaves misses. Rebound secured by Cade Dosunmu.

[07:15] Team_042 possession (Score: 16-10)
Tyler Barrett attempts a Layup. Contested by Malcolm Westbrook (3.6 feet, ZONE). TYLER BARRETT MAKES IT! Assist: Kristaps Parker
Score: 18-10

[07:00] Team_067 possession (Score: 18-10)
Wendell Antetokounmpo attempts a Midrange. Contested by Kristaps Parker (3.3 feet, MAN). WENDELL ANTETOKOUNMPO MAKES IT!
Score: 18-12

[06:44] Team_042 possession (Score: 18-12)
Jarrett Sabonis attempts a Midrange. Wide open! Ben Ball is 6.9 feet away. [ZONE] JARRETT SABONIS MAKES IT! Assist: Cade Dosunmu
Score: 20-12

[06:30] Team_067 possession (Score: 20-12)
Manu Reaves attempts a 3Pt. Contested by Tyler Barrett (3.1 feet, ZONE). Manu Reaves misses. Rebound secured by Cade Dosunmu.

[06:16] Team_042 possession (Score: 20-12)
FOUL! Reach-in foul on Malcolm Westbrook during the drive. [IN THE BONUS! 5 team fouls] Jarrett Sabonis to the line for 2 free throws. (Malcolm Westbrook: 1 personal fouls)   FT 1/2: GOOD   FT 2/2: GOOD Jarrett Sabonis makes 2/2 from the line.
Score: 22-12

[06:00] Team_067 possession (Score: 22-12)
Ben Ball attempts a Midrange. Wide open! Dejounte Butler is 6.7 feet away. [ZONE] BEN BALL MAKES IT! Assist: Manu Reaves
Score: 22-14

[05:44] Team_042 possession (Score: 22-14)
FOUL! Reach-in foul on Malcolm Westbrook during the drive. [IN THE BONUS! 6 team fouls] Cade Dosunmu to the line for 2 free throws. (Malcolm Westbrook: 2 personal fouls)   FT 1/2: GOOD   FT 2/2: MISS Cade Dosunmu makes 1/2 from the line. Rebound secured by Malcolm Westbrook.
Score: 23-14

[05:28] Team_067 possession (Score: 23-14)
Manu Reaves attempts a 3Pt. Contested by Tyler Barrett (3.0 feet, ZONE). Manu Reaves misses. Offensive rebound by Desmond Simmons! Desmond Simmons kicks it out.

[05:13] Team_067 possession (Score: 23-14)
Desmond Simmons attempts a 3Pt. Contested by Jarrett Sabonis (4.2 feet, MAN). Desmond Simmons misses. Rebound secured by Cade Dosunmu.

[05:02] Team_042 possession (Score: 23-14)
Dejounte Butler throws a bad pass out of bounds! TURNOVER! (dead ball)

[04:49] Team_067 possession (Score: 23-14)
Wendell Antetokounmpo attempts a 3Pt. Contested by Kristaps Parker (4.7 feet, MAN). Wendell Antetokounmpo misses. Rebound secured by Cade Dosunmu.

[04:30] Team_042 possession (Score: 23-14)
Jarrett Sabonis attempts a 3Pt. Wide open! Desmond Simmons is 8.0 feet away. [ZONE] Jarrett Sabonis misses. Rebound secured by Wendell Antetokounmpo.

[04:16] Team_067 possession (Score: 23-14)
Malcolm Westbrook attempts a Midrange. Wide open! Cade Dosunmu is 6.7 feet away. [MAN] Malcolm Westbrook misses. Rebound secured by Cade Dosunmu.

[04:04] Team_042 possession (Score: 23-14)
FOUL! Shooting foul on Malcolm Westbrook. Jarrett Sabonis to the line for 2 free throws. [BONUS: 7 team fouls] (Malcolm Westbrook: 3 personal fouls)   FT 1/2: GOOD   FT 2/2: GOOD Jarrett Sabonis makes 2/2 from the line.
Score: 25-14

[03:53] Team_067 possession (Score: 25-14)
Ben Ball attempts a Midrange. Contested by Jarrett Sabonis (4.1 feet, ZONE). BEN BALL MAKES IT! Assist: Malcolm Westbrook
Score: 25-16

[03:43] Team_042 possession (Score: 25-16)
Cade Dosunmu drives, Malcolm Westbrook stays with him. Cade Dosunmu attempts a Layup. Contested by Malcolm Westbrook (2.7 feet, MAN). CADE DOSUNMU MAKES IT! Assist: Dejounte Butler
Score: 27-16

[03:27] Team_067 possession (Score: 27-16)
Ben Ball attempts a 3Pt. Contested by Tyler Barrett (4.7 feet, ZONE). Ben Ball misses. Rebound secured by Tyler Barrett.

[03:11] Team_042 possession (Score: 27-16)
Tyler Barrett attempts a 3Pt. Wide open! Ben Ball is 6.8 feet away. [ZONE] Tyler Barrett misses. Rebound secured by Desmond Simmons.

[02:54] Team_067 possession (Score: 27-16)
Wendell Antetokounmpo attempts a Midrange. Contested by Kristaps Parker (3.3 feet, MAN). Wendell Antetokounmpo misses. Offensive rebound by Malcolm Westbrook! Malcolm Westbrook's putback is no good. Offensive rebound by Desmond Simmons! Desmond Simmons kicks it out.

[02:36] Team_067 possession (Score: 27-16)
Manu Reaves drives, picks up Dejounte Butler. Help arrives from Tyler Barrett! Manu Reaves attempts a Layup. Contested by Tyler Barrett (3.3 feet, ZONE). Manu Reaves misses. Rebound secured by Dejounte Butler.

[02:18] Team_042 possession (Score: 27-16)
Kristaps Parker drives, picks up Wendell Antetokounmpo. Help arrives from Desmond Simmons! Kristaps Parker attempts a Dunk. Wide open! Desmond Simmons is 6.6 feet away. [MAN] Kristaps Parker misses. Offensive rebound by Dejounte Butler! Dejounte Butler puts it back in!
Score: 29-16

[02:02] Team_067 possession (Score: 29-16)
Manu Reaves attempts a 3Pt. Contested by Tyler Barrett (2.3 feet, MAN). Manu Reaves misses. Offensive rebound by Desmond Simmons! Desmond Simmons kicks it out.

[01:47] Team_067 possession (Score: 29-16)
Wendell Antetokounmpo attempts a 3Pt. Contested by Kristaps Parker (2.7 feet, MAN). WENDELL ANTETOKOUNMPO MAKES IT! Assist: Manu Reaves
Score: 29-19

[01:30] Team_042 possession (Score: 29-19)
Dejounte Butler drives to the basket... Dejounte Butler throws a bad pass out of bounds! TURNOVER! (dead ball)

[01:30] Substitution (Team_042): Tyler Barrett OUT → Khris George IN (stamina_rule2)

[01:30] Substitution (Team_042): Kristaps Parker OUT → Isaiah Randle IN (stamina_rule2)

[01:30] Substitution (Team_042): Jarrett Sabonis OUT → Gary Jackson IN (stamina_rule2)

[01:30] Substitution (Team_042): Dejounte Butler OUT → Allen Towns IN (stamina_rule2)

[01:30] Substitution (Team_042): Cade Dosunmu OUT → Lamelo Stewart IN (stamina_rule2)

[01:30] Substitution (Team_067): Manu Reaves OUT → James Rozier IN (stamina_rule2)

[01:30] Substitution (Team_067): Wendell Antetokounmpo OUT → Anfernee Wagner IN (stamina_rule2)

[01:30] Substitution (Team_067): Desmond Simmons OUT → Kyle Leonard IN (stamina_rule2)

[01:30] Substitution (Team_067): Ben Ball OUT → Kristaps Davis IN (stamina_rule2)

[01:30] Substitution (Team_067): Malcolm Westbrook OUT → Zach DeRozan IN (stamina_rule2)

[01:21] Team_067 possession (Score: 29-19)
Anfernee Wagner attempts a 3Pt. Heavily contested by Khris George (0.5 feet, ZONE)! ANFERNEE WAGNER MAKES IT! Assist: Kristaps Davis
Score: 29-22

[01:10] Team_042 possession (Score: 29-22)
Isaiah Randle attempts a 3Pt. Contested by Anfernee Wagner (3.7 feet, ZONE). Isaiah Randle misses. Rebound secured by Anfernee Wagner.

[00:51] Team_067 possession (Score: 29-22)
James Rozier attempts a 3Pt. Heavily contested by Khris George (1.0 feet, MAN)! James Rozier misses. Rebound secured by Lamelo Stewart.

[00:34] Team_042 possession (Score: 29-22)
Lamelo Stewart attempts a Midrange. Contested by Zach DeRozan (4.2 feet, MAN). Lamelo Stewart misses. Rebound secured by Zach DeRozan.

[00:18] Team_067 possession (Score: 29-22)
Kristaps Davis attempts a 3Pt. Contested by Khris George (4.0 feet, ZONE). Kristaps Davis misses. Rebound secured by Lamelo Stewart.

[00:03] Team_042 possession (Score: 29-22)
Allen Towns drives and kicks out. Lamelo Stewart attempts a Midrange. Contested by Kristaps Davis (3.7 feet, ZONE). LAMELO STEWART MAKES IT!
Score: 31-22

================================================================================
                              1ST QUARTER COMPLETE                              
================================================================================

1ST QUARTER SCORE: Team_042 31, Team_067 22

BOX SCORE:
================================================================================

Team_042
--------------------------------------------------------------------------------
Player                MIN  PTS  REB  AST  TO      FG   FG%      3P   3P%
--------------------------------------------------------------------------------
Jarrett Sabonis        11   12    0    1   0   5/8    62.5     0/0   0.0
Dejounte Butler        11    6    5    2   0   3/3   100.0     0/0   0.0
Cade Dosunmu           11    4    6    1   0   2/3    66.7     0/0   0.0
Tyler Barrett          11    2    3    0   0   1/2    50.0     0/0   0.0
Kristaps Parker        11    2    0    1   0   1/1   100.0     0/0   0.0
Lamelo Stewart          2    2    2    0   0   1/2    50.0     0/0   0.0
Isaiah Randle           2    0    0    0   0   0/1     0.0     0/0   0.0

TEAM: FG: 13/20 (65.0%), 3PT: 0/4 (0.0%), REB: 16 (3 off, 13 def), AST: 5, TO: 4
TEAM FOULS: 2


Team_067
--------------------------------------------------------------------------------
Player                MIN  PTS  REB  AST  TO      FG   FG%      3P   3P%
--------------------------------------------------------------------------------
Manu Reaves            11    8    0    2   0   3/7    42.9     0/0   0.0
Ben Ball               11    6    0    0   0   3/6    50.0     0/0   0.0
Wendell Antetokounmpo   11    5    2    2   0   2/3    66.7     0/0   0.0
Anfernee Wagner         2    3    1    0   0   1/1   100.0     0/0   0.0
Malcolm Westbrook      11    0    2    2   0   0/2     0.0     0/0   0.0
Desmond Simmons        11    0    5    1   0   0/1     0.0     0/0   0.0
Kristaps Davis          2    0    0    1   0   0/1     0.0     0/0   0.0
James Rozier            2    0    0    0   0   0/1     0.0     0/0   0.0
Zach DeRozan            2    0    1    0   0   0/0     0.0     0/0   0.0

TEAM: FG: 9/22 (40.9%), 3PT: 3/10 (30.0%), REB: 11 (4 off, 7 def), AST: 8, TO: 1
TEAM FOULS: 7 [Team_042 in BONUS]

================================================================================

================================================================================
                       2ND QUARTER - Team_042 vs Team_067                       
================================================================================

[12:00] Team_042 possession (Score: 31-22)
Kristaps Parker attempts a 3Pt. Heavily contested by Wendell Antetokounmpo (2.0 feet, ZONE)! Kristaps Parker misses. Rebound secured by Desmond Simmons.

[11:44] Team_067 possession (Score: 31-22)
Wendell Antetokounmpo attempts a 3Pt. Contested by Tyler Barrett (5.2 feet, ZONE). Wendell Antetokounmpo misses. Rebound secured by Dejounte Butler.

[11:30] Team_042 possession (Score: 31-22)
Cade Dosunmu loses control! Ball rolls out of bounds! TURNOVER! (dead ball)

[11:30] Substitution (Team_067): Wendell Antetokounmpo OUT → Anfernee Wagner IN (stamina_rule2)

[11:20] Team_067 possession (Score: 31-22)
Malcolm Westbrook attempts a 3Pt. Wide open! Cade Dosunmu is 6.5 feet away. [MAN] MALCOLM WESTBROOK MAKES IT! Assist: Ben Ball
Score: 31-25

[11:06] Team_042 possession (Score: 31-25)
Dejounte Butler attempts a 3Pt. Contested by Anfernee Wagner (2.0 feet, ZONE). Dejounte Butler misses. Rebound secured by Desmond Simmons.

[10:53] Team_067 possession (Score: 31-25)
Ben Ball attempts a 3Pt. Wide open! Dejounte Butler is 9.3 feet away. [MAN] BEN BALL MAKES IT! Assist: Anfernee Wagner
Score: 31-28

[10:44] Team_042 possession (Score: 31-28)
FOUL! Holding foul on Manu Reaves. [Team fouls: 1] No free throws, side out. (Manu Reaves: 1 personal fouls)

[10:31] Team_042 possession (Score: 31-28)
Kristaps Parker drives to the basket... Kristaps Parker commits a violation (traveling/carry)! TURNOVER! (dead ball)

[10:31] Substitution (Team_042): Tyler Barrett OUT → Khris George IN (stamina_rule2)

[10:31] Substitution (Team_042): Kristaps Parker OUT → Isaiah Randle IN (stamina_rule2)

[10:31] Substitution (Team_042): Jarrett Sabonis OUT → Gary Jackson IN (stamina_rule2)

[10:31] Substitution (Team_042): Dejounte Butler OUT → Allen Towns IN (stamina_rule2)

[10:31] Substitution (Team_042): Cade Dosunmu OUT → Lamelo Stewart IN (stamina_rule2)

[10:31] Substitution (Team_067): Manu Reaves OUT → James Rozier IN (stamina_rule2)

[10:31] Substitution (Team_067): Ben Ball OUT → Kristaps Davis IN (stamina_rule2)

[10:31] Substitution (Team_067): Malcolm Westbrook OUT → Zach DeRozan IN (stamina_rule2)

[10:18] Team_067 possession (Score: 31-28)
FOUL! Reach-in foul on Isaiah Randle during the drive. [Team fouls: 1] No free throws, side out. (Isaiah Randle: 1 personal fouls)

[10:03] Team_067 possession (Score: 31-28)
Zach DeRozan drives and kicks out. James Rozier attempts a 3Pt. Heavily contested by Khris George (1.8 feet, MAN)! James Rozier misses. FOUL! Loose ball foul on Lamelo Stewart during the rebound battle. [Team fouls: 2] No free throws, side out. (Lamelo Stewart: 1 personal fouls)

[09:49] Team_067 possession (Score: 31-28)
Anfernee Wagner drives and kicks out. Anfernee Wagner attempts a Midrange. Contested by Gary Jackson (2.0 feet, ZONE). ANFERNEE WAGNER MAKES IT! Assist: Zach DeRozan
Score: 31-30

[09:33] Team_042 possession (Score: 31-30)
Isaiah Randle attempts a 3Pt. Contested by Anfernee Wagner (3.9 feet, ZONE). Isaiah Randle misses. Rebound secured by Anfernee Wagner.

[09:19] Team_067 possession (Score: 31-30)
Desmond Simmons attempts a 3Pt. Contested by Khris George (4.9 feet, ZONE). Desmond Simmons misses. Rebound secured by Gary Jackson.

[09:06] Team_042 possession (Score: 31-30)
Allen Towns attempts a 3Pt. Contested by James Rozier (2.4 feet, ZONE). ALLEN TOWNS MAKES IT! Assist: Lamelo Stewart
Score: 34-30

[08:50] Team_067 possession (Score: 34-30)
Kristaps Davis attempts a 3Pt. Wide open! Allen Towns is 6.9 feet away. [MAN] KRISTAPS DAVIS MAKES IT! Assist: Desmond Simmons
Score: 34-33

[08:38] Team_042 possession (Score: 34-33)
Allen Towns attempts a 3Pt. Contested by Anfernee Wagner (3.9 feet, ZONE). ALLEN TOWNS MAKES IT! Assist: Khris George
Score: 37-33

[08:23] Team_067 possession (Score: 37-33)
Desmond Simmons throws a bad pass out of bounds! TURNOVER! (dead ball)

[08:23] Substitution (Team_067): Desmond Simmons OUT → Kyle Leonard IN (stamina_rule2)

[08:10] Team_042 possession (Score: 37-33)
Lamelo Stewart attempts a Layup. Contested by Kristaps Davis (3.9 feet, ZONE). Lamelo Stewart misses. Offensive rebound by Lamelo Stewart! Lamelo Stewart kicks it out.

[07:52] Team_042 possession (Score: 37-33)
Allen Towns makes the Layup and draws the foul on James Rozier! And-1! Allen Towns to the line for 1. [Team fouls: 2] (James Rozier: 1 personal fouls)   FT 1/1: GOOD Allen Towns makes 1/1 from the line.
Score: 40-33

[07:41] Team_067 possession (Score: 40-33)
Kristaps Davis attempts a Layup. Heavily contested by Allen Towns (0.5 feet, ZONE)! KRISTAPS DAVIS MAKES IT! Assist: Anfernee Wagner
Score: 40-35

[07:24] Team_042 possession (Score: 40-35)
FOUL! Reach-in foul on Kristaps Davis during the drive. [Team fouls: 3] No free throws, side out. (Kristaps Davis: 1 personal fouls)

[07:06] Team_042 possession (Score: 40-35)
Lamelo Stewart drives to the basket... Lamelo Stewart loses control! Ball rolls out of bounds! TURNOVER! (dead ball)

[06:56] Team_067 possession (Score: 40-35)
Anfernee Wagner attempts a Layup. BLOCKED BY ISAIAH RANDLE! Ball deflects out of bounds off Anfernee Wagner.

[06:41] Team_042 possession (Score: 40-35)
Gary Jackson attempts a Midrange. Contested by Anfernee Wagner (5.7 feet, ZONE). GARY JACKSON MAKES IT!
Score: 42-35

[06:23] Team_067 possession (Score: 42-35)
Anfernee Wagner attempts a 3Pt. Heavily contested by Khris George (1.5 feet, ZONE)! ANFERNEE WAGNER MAKES IT! Assist: Zach DeRozan
Score: 42-38

[06:11] Team_042 possession (Score: 42-38)
Isaiah Randle attempts a Midrange. Contested by Kristaps Davis (5.9 feet, ZONE). Isaiah Randle misses. Offensive rebound by Lamelo Stewart! Lamelo Stewart kicks it out.

[06:01] Team_042 possession (Score: 42-38)
Gary Jackson drives and kicks out. Khris George attempts a Midrange. Contested by James Rozier (2.6 feet, MAN). Khris George misses. Offensive rebound by Allen Towns! Allen Towns kicks it out.

[05:48] Team_042 possession (Score: 42-38)
Allen Towns attempts a 3Pt. Contested by Anfernee Wagner (4.9 feet, ZONE). Allen Towns misses. Rebound secured by Zach DeRozan.

[05:33] Team_067 possession (Score: 42-38)
Kristaps Davis attempts a 3Pt. Contested by Allen Towns (3.9 feet, MAN). Kristaps Davis misses. Rebound secured by Lamelo Stewart.

[05:20] Team_042 possession (Score: 42-38)
Allen Towns drives and kicks out. Lamelo Stewart attempts a 3Pt. Contested by Anfernee Wagner (3.5 feet, ZONE). Lamelo Stewart misses. Rebound secured by Kristaps Davis.

[05:07] Team_067 possession (Score: 42-38)
Zach DeRozan drives and kicks out. Kristaps Davis attempts a 3Pt. Contested by Allen Towns (3.8 feet, MAN). KRISTAPS DAVIS MAKES IT! Assist: Zach DeRozan
Score: 42-41

[04:53] Team_042 possession (Score: 42-41)
Lamelo Stewart attempts a Layup. BLOCKED BY KRISTAPS DAVIS! Ball deflects out of bounds off Lamelo Stewart.

[04:37] Team_067 possession (Score: 42-41)
Anfernee Wagner attempts a 3Pt. Heavily contested by Isaiah Randle (0.8 feet, MAN)! Anfernee Wagner misses. Rebound secured by Allen Towns.

[04:20] Team_042 possession (Score: 42-41)
Gary Jackson drives, Kristaps Davis stays with him. Gary Jackson attempts a Layup. Contested by Kristaps Davis (3.5 feet, ZONE). Gary Jackson misses. Rebound secured by Zach DeRozan.

[04:08] Team_067 possession (Score: 42-41)
FOUL! Reach-in foul on Allen Towns during the drive. [Team fouls: 3] No free throws, side out. (Allen Towns: 1 personal fouls)

[03:48] Team_067 possession (Score: 42-41)
Kyle Leonard attempts a 3Pt. Contested by Gary Jackson (3.8 feet, MAN). Kyle Leonard misses. Rebound secured by Allen Towns.

[03:37] Team_042 possession (Score: 42-41)
Lamelo Stewart attempts a Layup. Wide open! Kristaps Davis is 6.6 feet away. [ZONE] LAMELO STEWART MAKES IT! Assist: Khris George
Score: 44-41

[03:22] Team_067 possession (Score: 44-41)
Anfernee Wagner attempts a 3Pt. BLOCKED BY KHRIS GEORGE! Ball is loose! Rebound secured by Gary Jackson.

[03:11] Team_042 possession (Score: 44-41)
Lamelo Stewart attempts a Layup. Wide open! Zach DeRozan is 6.8 feet away. [MAN] LAMELO STEWART MAKES IT! Assist: Khris George
Score: 46-41

[02:56] Team_067 possession (Score: 46-41)
Kyle Leonard loses the ball! Stripped by Gary Jackson! TURNOVER! (live ball)

[02:41] Team_042 possession (Score: 46-41)
Khris George drives to the basket... FOUL! Offensive foul on Khris George! James Rozier drew the charge! [Team fouls: 4] (Khris George: 1 personal fouls) TURNOVER! (dead ball)

[02:26] Team_067 possession (Score: 46-41)
Kyle Leonard attempts a 3Pt. Contested by Khris George (2.8 feet, ZONE). Kyle Leonard misses. Rebound secured by Gary Jackson.

[02:12] Team_042 possession (Score: 46-41)
Lamelo Stewart drives, picks up Zach DeRozan. Help arrives from James Rozier! Lamelo Stewart attempts a Dunk. Wide open! James Rozier is 6.7 feet away. [MAN] LAMELO STEWART MAKES IT! Assist: Isaiah Randle
Score: 48-41

[01:57] Team_067 possession (Score: 48-41)
Kristaps Davis attempts a 3Pt. Contested by Khris George (4.3 feet, ZONE). KRISTAPS DAVIS MAKES IT! Assist: Zach DeRozan
Score: 48-44

[01:40] Team_042 possession (Score: 48-44)
Lamelo Stewart attempts a 3Pt. Contested by Kyle Leonard (4.0 feet, ZONE). Lamelo Stewart misses. Rebound secured by Kyle Leonard.

[01:25] Team_067 possession (Score: 48-44)
Anfernee Wagner attempts a 3Pt. Contested by Khris George (4.0 feet, ZONE). Anfernee Wagner misses. Rebound secured by Lamelo Stewart.

[01:11] Team_042 possession (Score: 48-44)
FOUL! Reach-in foul on Kristaps Davis during the drive. [Team fouls: 4] No free throws, side out. (Kristaps Davis: 2 personal fouls)

[01:00] Team_042 possession (Score: 48-44)
Isaiah Randle attempts a 3Pt. Contested by Kyle Leonard (5.4 feet, ZONE). Isaiah Randle misses. FOUL! Loose ball foul on Zach DeRozan during the rebound battle. [IN THE BONUS! 5 team fouls] Lamelo Stewart to the line for 2 free throws. (Zach DeRozan: 1 personal fouls)   FT 1/2: GOOD   FT 2/2: GOOD Lamelo Stewart makes 2/2 from the line.
Score: 50-44

[00:44] Team_067 possession (Score: 50-44)
Zach DeRozan drives, picks up Allen Towns. Help arrives from Khris George! Zach DeRozan attempts a Layup. Heavily contested by Khris George (1.2 feet, ZONE)! ZACH DEROZAN MAKES IT! Assist: Anfernee Wagner
Score: 50-46

[00:35] Team_042 possession (Score: 50-46)
Khris George drives to the basket... FOUL! Offensive foul on Khris George! Kristaps Davis drew the charge! [Team fouls: 5] (Khris George: 2 personal fouls) TURNOVER! (dead ball)

[00:24] Team_067 possession (Score: 50-46)
Zach DeRozan drives to the basket... Zach DeRozan throws a bad pass! Stolen by Lamelo Stewart! TURNOVER! (live ball)

[00:09] Team_042 possession (Score: 50-46)
Isaiah Randle attempts a Midrange. Wide open! Anfernee Wagner is 7.9 feet away. [ZONE] ISAIAH RANDLE MAKES IT!
Score: 52-46

================================================================================
                              2ND QUARTER COMPLETE                              
================================================================================

2ND QUARTER SCORE: Team_042 21, Team_067 24

BOX SCORE:
================================================================================

Team_042
--------------------------------------------------------------------------------
Player                MIN  PTS  REB  AST  TO      FG   FG%      3P   3P%
--------------------------------------------------------------------------------
Allen Towns            12    9    3    0   0   3/5    60.0     0/0   0.0
Lamelo Stewart         12    8    4    1   0   4/6    66.7     0/0   0.0
Isaiah Randle          12    2    0    1   0   1/2    50.0     0/0   0.0
Gary Jackson           12    2    3    0   0   1/2    50.0     0/0   0.0
Kristaps Parker        12    0    0    0   0   0/1     0.0     0/0   0.0
Dejounte Butler        12    0    1    0   0   0/1     0.0     0/0   0.0
Khris George           12    0    0    3   0   0/0     0.0     0/0   0.0

TEAM: FG: 9/17 (52.9%), 3PT: 3/8 (37.5%), REB: 11 (3 off, 8 def), AST: 5, TO: 5
TEAM FOULS: 5 [Team_067 in BONUS]


Team_067
--------------------------------------------------------------------------------
Player                MIN  PTS  REB  AST  TO      FG   FG%      3P   3P%
--------------------------------------------------------------------------------
Kristaps Davis         12   11    1    0   0   4/5    80.0     0/0   0.0
Anfernee Wagner        13    5    1    3   0   2/6    33.3     0/0   0.0
Malcolm Westbrook      12    3    0    0   0   1/1   100.0     0/0   0.0
Ben Ball               12    3    0    1   0   1/1   100.0     0/0   0.0
Zach DeRozan           12    2    3    4   0   1/1   100.0     0/0   0.0
Desmond Simmons        14    0    2    1   0   0/1     0.0     0/0   0.0
Wendell Antetokounmpo   11    0    0    0   0   0/1     0.0     0/0   0.0
Kyle Leonard           10    0    1    0   0   0/2     0.0     0/0   0.0

TEAM: FG: 9/18 (50.0%), 3PT: 5/13 (38.5%), REB: 8 (1 off, 7 def), AST: 9, TO: 3
TEAM FOULS: 5 [Team_042 in BONUS]

================================================================================

================================================================================
                       3RD QUARTER - Team_042 vs Team_067                       
================================================================================

[12:00] Team_042 possession (Score: 52-46)
Cade Dosunmu makes the Layup and draws the foul on Malcolm Westbrook! And-1! Cade Dosunmu to the line for 1. [Team fouls: 1] (Malcolm Westbrook: 1 personal fouls)   FT 1/1: GOOD Cade Dosunmu makes 1/1 from the line.
Score: 55-46

[11:49] Team_067 possession (Score: 55-46)
Wendell Antetokounmpo attempts a 3Pt. Contested by Tyler Barrett (4.0 feet, ZONE). Wendell Antetokounmpo misses. Rebound secured by Dejounte Butler.

[11:36] Team_042 possession (Score: 55-46)
Cade Dosunmu drives to the basket... Cade Dosunmu commits a violation (traveling/carry)! TURNOVER! (dead ball)

[11:23] Team_067 possession (Score: 55-46)
FOUL! Reach-in foul on Cade Dosunmu during the drive. [Team fouls: 1] No free throws, side out. (Cade Dosunmu: 1 personal fouls)

[11:08] Team_067 possession (Score: 55-46)
Wendell Antetokounmpo makes the 3Pt and draws the foul on Kristaps Parker! And-1! Wendell Antetokounmpo to the line for 1. [Team fouls: 2] (Kristaps Parker: 1 personal fouls)   FT 1/1: GOOD Wendell Antetokounmpo makes 1/1 from the line.
Score: 55-50

[10:54] Team_042 possession (Score: 55-50)
Kristaps Parker drives to the basket... Kristaps Parker throws a bad pass! Stolen by Wendell Antetokounmpo! TURNOVER! (live ball)

[10:39] Team_067 possession (Score: 55-50)
Wendell Antetokounmpo attempts a 3Pt. Contested by Tyler Barrett (3.8 feet, ZONE). Wendell Antetokounmpo misses. Rebound secured by Dejounte Butler.

[10:27] Team_042 possession (Score: 55-50)
Kristaps Parker attempts a 3Pt. Contested by Desmond Simmons (4.2 feet, ZONE). KRISTAPS PARKER MAKES IT! Assist: Jarrett Sabonis
Score: 58-50

[10:13] Team_067 possession (Score: 58-50)
Ben Ball attempts a 3Pt. Contested by Tyler Barrett (5.8 feet, ZONE). Ben Ball misses. Rebound secured by Dejounte Butler.

[09:58] Team_042 possession (Score: 58-50)
FOUL! Holding foul on Wendell Antetokounmpo. [Team fouls: 2] No free throws, side out. (Wendell Antetokounmpo: 1 personal fouls)

[09:39] Team_042 possession (Score: 58-50)
FOUL! Reach-in foul on Malcolm Westbrook during the drive. [Team fouls: 3] No free throws, side out. (Malcolm Westbrook: 2 personal fouls)

[09:23] Team_042 possession (Score: 58-50)
Tyler Barrett loses the ball! Stripped by Manu Reaves! TURNOVER! (live ball)

[09:11] Team_067 possession (Score: 58-50)
Manu Reaves attempts a 3Pt. Contested by Tyler Barrett (3.9 feet, ZONE). MANU REAVES MAKES IT! Assist: Wendell Antetokounmpo
Score: 58-53

[08:59] Team_042 possession (Score: 58-53)
Cade Dosunmu makes the Layup and draws the foul on Malcolm Westbrook! And-1! Cade Dosunmu to the line for 1. [Team fouls: 4] (Malcolm Westbrook: 3 personal fouls)   FT 1/1: GOOD Cade Dosunmu makes 1/1 from the line.
Score: 61-53

[08:45] Team_067 possession (Score: 61-53)
Ben Ball attempts a Layup. BLOCKED BY DEJOUNTE BUTLER! Ball deflects out of bounds off Ben Ball.

[08:32] Team_042 possession (Score: 61-53)
Cade Dosunmu drives and kicks out. Tyler Barrett attempts a 3Pt. Contested by Desmond Simmons (2.5 feet, ZONE). Tyler Barrett misses. Rebound secured by Malcolm Westbrook.

[08:14] Team_067 possession (Score: 61-53)
Manu Reaves drives and kicks out. Manu Reaves attempts a 3Pt. Contested by Tyler Barrett (6.0 feet, MAN). MANU REAVES MAKES IT! Assist: Wendell Antetokounmpo
Score: 61-56

[08:00] Team_042 possession (Score: 61-56)
Jarrett Sabonis drives and kicks out. Kristaps Parker attempts a Midrange. Contested by Manu Reaves (3.0 feet, ZONE). KRISTAPS PARKER MAKES IT!
Score: 63-56

[07:49] Team_067 possession (Score: 63-56)
Ben Ball drives to the basket... Ben Ball throws a bad pass! Stolen by Dejounte Butler! TURNOVER! (live ball)

[07:32] Team_042 possession (Score: 63-56)
Cade Dosunmu makes the 3Pt and draws the foul on Malcolm Westbrook! And-1! Cade Dosunmu to the line for 1. [BONUS: 5 team fouls] (Malcolm Westbrook: 4 personal fouls)   FT 1/1: GOOD Cade Dosunmu makes 1/1 from the line.
Score: 67-56

[07:17] Team_067 possession (Score: 67-56)
Desmond Simmons attempts a 3Pt. Wide open! Tyler Barrett is 8.0 feet away. [ZONE] Desmond Simmons misses. Rebound secured by Dejounte Butler.

[07:01] Team_042 possession (Score: 67-56)
FOUL! Holding foul on Manu Reaves. [IN THE BONUS! 6 team fouls] Tyler Barrett to the line for 2 free throws. (Manu Reaves: 1 personal fouls)   FT 1/2: MISS   FT 2/2: GOOD Tyler Barrett makes 1/2 from the line.
Score: 68-56

[06:45] Team_067 possession (Score: 68-56)
Ben Ball attempts a Layup. Contested by Dejounte Butler (3.3 feet, MAN). BEN BALL MAKES IT! Assist: Desmond Simmons
Score: 68-58

[06:31] Team_042 possession (Score: 68-58)
Cade Dosunmu attempts a Layup. Contested by Malcolm Westbrook (4.8 feet, ZONE). Cade Dosunmu misses. Rebound secured by Wendell Antetokounmpo.

[06:13] Team_067 possession (Score: 68-58)
Malcolm Westbrook attempts a Layup. Heavily contested by Cade Dosunmu (0.9 feet, MAN)! Malcolm Westbrook misses. Rebound secured by Dejounte Butler.

[05:57] Team_042 possession (Score: 68-58)
Tyler Barrett drives to the basket... Tyler Barrett throws a bad pass! Stolen by Manu Reaves! TURNOVER! (live ball)

[05:42] Team_067 possession (Score: 68-58)
Manu Reaves drives to the basket... Manu Reaves throws a bad pass out of bounds! TURNOVER! (dead ball)

[05:28] Team_042 possession (Score: 68-58)
Dejounte Butler attempts a Midrange. Wide open! Ben Ball is 6.1 feet away. [MAN] Dejounte Butler misses. Rebound secured by Malcolm Westbrook.

[05:12] Team_067 possession (Score: 68-58)
Ben Ball attempts a 3Pt. Contested by Dejounte Butler (4.4 feet, MAN). Ben Ball misses. Rebound secured by Cade Dosunmu.

[04:57] Team_042 possession (Score: 68-58)
Jarrett Sabonis attempts a Midrange. Contested by Ben Ball (2.6 feet, ZONE). JARRETT SABONIS MAKES IT!
Score: 70-58

[04:39] Team_067 possession (Score: 70-58)
Wendell Antetokounmpo attempts a 3Pt. Contested by Kristaps Parker (4.4 feet, MAN). WENDELL ANTETOKOUNMPO MAKES IT!
Score: 70-61

[04:24] Team_042 possession (Score: 70-61)
Cade Dosunmu attempts a Layup. Contested by Malcolm Westbrook (5.2 feet, ZONE). CADE DOSUNMU MAKES IT! Assist: Jarrett Sabonis
Score: 72-61

[04:08] Team_067 possession (Score: 72-61)
FOUL! Shooting foul on Jarrett Sabonis. Desmond Simmons to the line for 2 free throws. [Team fouls: 3] (Jarrett Sabonis: 1 personal fouls)   FT 1/2: GOOD   FT 2/2: MISS Desmond Simmons makes 1/2 from the line. Offensive rebound by Desmond Simmons! Desmond Simmons kicks it out.
Score: 72-62

[03:53] Team_067 possession (Score: 72-62)
Wendell Antetokounmpo attempts a Midrange. Contested by Dejounte Butler (4.0 feet, ZONE). WENDELL ANTETOKOUNMPO MAKES IT!
Score: 72-64

[03:37] Team_042 possession (Score: 72-64)
Dejounte Butler drives and kicks out. Kristaps Parker attempts a Midrange. Contested by Wendell Antetokounmpo (4.6 feet, MAN). Kristaps Parker misses. Rebound secured by Desmond Simmons.

[03:23] Team_067 possession (Score: 72-64)
Malcolm Westbrook makes the Dunk and draws the foul on Tyler Barrett! And-1! Malcolm Westbrook to the line for 1. [Team fouls: 4] (Tyler Barrett: 1 personal fouls)   FT 1/1: GOOD Malcolm Westbrook makes 1/1 from the line.
Score: 72-67

[03:09] Team_042 possession (Score: 72-67)
Jarrett Sabonis attempts a 3Pt. Contested by Desmond Simmons (2.5 feet, ZONE). Jarrett Sabonis misses. Rebound secured by Malcolm Westbrook.

[02:56] Team_067 possession (Score: 72-67)
Desmond Simmons attempts a Layup. BLOCKED BY JARRETT SABONIS! Ball is loose! Rebound secured by Tyler Barrett.

[02:40] Team_042 possession (Score: 72-67)
Kristaps Parker attempts a 3Pt. Contested by Desmond Simmons (3.7 feet, ZONE). Kristaps Parker misses. Rebound secured by Desmond Simmons.

[02:27] Team_067 possession (Score: 72-67)
Malcolm Westbrook makes the Layup and draws the foul on Cade Dosunmu! And-1! Malcolm Westbrook to the line for 1. [BONUS: 5 team fouls] (Cade Dosunmu: 2 personal fouls)   FT 1/1: GOOD Malcolm Westbrook makes 1/1 from the line.
Score: 72-70

[02:15] Team_042 possession (Score: 72-70)
Cade Dosunmu drives, Malcolm Westbrook stays with him. Cade Dosunmu attempts a Dunk. Wide open! Malcolm Westbrook is 6.5 feet away. [ZONE] CADE DOSUNMU MAKES IT!
Score: 74-70

[01:59] Team_067 possession (Score: 74-70)
Manu Reaves attempts a Layup. Contested by Tyler Barrett (4.0 feet, MAN). Manu Reaves misses. Rebound secured by Cade Dosunmu.

[01:48] Team_042 possession (Score: 74-70)
FOUL! Holding foul on Desmond Simmons. [IN THE BONUS! 7 team fouls] Jarrett Sabonis to the line for 2 free throws. (Desmond Simmons: 1 personal fouls)   FT 1/2: GOOD   FT 2/2: GOOD Jarrett Sabonis makes 2/2 from the line.
Score: 76-70

[01:33] Team_067 possession (Score: 76-70)
Wendell Antetokounmpo attempts a Midrange. Contested by Kristaps Parker (4.2 feet, MAN). Wendell Antetokounmpo misses. Rebound secured by Dejounte Butler.

[01:18] Team_042 possession (Score: 76-70)
Tyler Barrett attempts a Midrange. Contested by Manu Reaves (4.1 feet, MAN). TYLER BARRETT MAKES IT!
Score: 78-70

[01:03] Team_067 possession (Score: 78-70)
Malcolm Westbrook throws a bad pass! Stolen by Cade Dosunmu! TURNOVER! (live ball)

[00:48] Team_042 possession (Score: 78-70)
Tyler Barrett throws a bad pass out of bounds! TURNOVER! (dead ball)

[00:48] Substitution (Team_042): Tyler Barrett OUT → Khris George IN (stamina_rule2)

[00:48] Substitution (Team_042): Kristaps Parker OUT → Isaiah Randle IN (stamina_rule2)

[00:48] Substitution (Team_042): Jarrett Sabonis OUT → Gary Jackson IN (stamina_rule2)

[00:48] Substitution (Team_042): Dejounte Butler OUT → Allen Towns IN (stamina_rule2)

[00:48] Substitution (Team_042): Cade Dosunmu OUT → Lamelo Stewart IN (stamina_rule2)

[00:48] Substitution (Team_067): Manu Reaves OUT → James Rozier IN (stamina_rule2)

[00:48] Substitution (Team_067): Wendell Antetokounmpo OUT → Anfernee Wagner IN (stamina_rule2)

[00:48] Substitution (Team_067): Desmond Simmons OUT → Kyle Leonard IN (stamina_rule2)

[00:48] Substitution (Team_067): Ben Ball OUT → Kristaps Davis IN (stamina_rule2)

[00:48] Substitution (Team_067): Malcolm Westbrook OUT → Zach DeRozan IN (stamina_rule2)

[00:37] Team_067 possession (Score: 78-70)
Anfernee Wagner makes the Layup and draws the foul on Isaiah Randle! And-1! Anfernee Wagner to the line for 1. [BONUS: 6 team fouls] (Isaiah Randle: 1 personal fouls)   FT 1/1: GOOD Anfernee Wagner makes 1/1 from the line.
Score: 78-73

[00:20] Team_042 possession (Score: 78-73)
Gary Jackson drives and kicks out. Khris George attempts a 3Pt. Wide open! James Rozier is 6.2 feet away. [MAN] Khris George misses. Offensive rebound by Lamelo Stewart! Lamelo Stewart kicks it out.

[00:06] Team_042 possession (Score: 78-73)
Gary Jackson drives and kicks out. FOUL! Shooting foul on Kristaps Davis. Allen Towns to the line for 2 free throws. [BONUS: 8 team fouls] (Kristaps Davis: 1 personal fouls)   FT 1/2: GOOD   FT 2/2: GOOD Allen Towns makes 2/2 from the line.
Score: 80-73

================================================================================
                              3RD QUARTER COMPLETE                              
================================================================================

3RD QUARTER SCORE: Team_042 28, Team_067 27

BOX SCORE:
================================================================================

Team_042
--------------------------------------------------------------------------------
Player                MIN  PTS  REB  AST  TO      FG   FG%      3P   3P%
--------------------------------------------------------------------------------
Cade Dosunmu           24   14    2    0   0   5/7    71.4     0/0   0.0
Kristaps Parker        24    5    0    0   0   2/3    66.7     0/0   0.0
Jarrett Sabonis        24    4    0    2   0   2/3    66.7     0/0   0.0
Tyler Barrett          24    3    1    0   0   2/2   100.0     0/0   0.0
Allen Towns            13    2    0    0   0   1/1   100.0     0/0   0.0
Dejounte Butler        24    0    6    0   0   0/2     0.0     0/0   0.0
Lamelo Stewart         13    0    1    0   0   0/0     0.0     0/0   0.0

TEAM: FG: 12/18 (66.7%), 3PT: 2/4 (50.0%), REB: 10 (1 off, 9 def), AST: 2, TO: 5
TEAM FOULS: 6 [Team_067 in BONUS]


Team_067
--------------------------------------------------------------------------------
Player                MIN  PTS  REB  AST  TO      FG   FG%      3P   3P%
--------------------------------------------------------------------------------
Wendell Antetokounmpo   23    9    1    2   0   3/6    50.0     0/0   0.0
Manu Reaves            24    6    0    0   0   2/3    66.7     0/0   0.0
Malcolm Westbrook      24    6    3    0   0   2/3    66.7     0/0   0.0
Anfernee Wagner        14    3    0    0   0   1/1   100.0     0/0   0.0
Ben Ball               24    2    0    0   0   1/4    25.0     0/0   0.0
Desmond Simmons        26    0    3    1   0   0/2     0.0     0/0   0.0

TEAM: FG: 9/19 (47.4%), 3PT: 3/8 (37.5%), REB: 7 (1 off, 6 def), AST: 3, TO: 3
TEAM FOULS: 8 [Team_042 in BONUS]

================================================================================

================================================================================
                       4TH QUARTER - Team_042 vs Team_067                       
================================================================================

[12:00] Substitution (Team_067): Wendell Antetokounmpo OUT → Anfernee Wagner IN (stamina_rule2)

[12:00] Team_042 possession (Score: 80-73)
Jarrett Sabonis throws a bad pass out of bounds! TURNOVER! (dead ball)

[11:48] Team_067 possession (Score: 80-73)
Ben Ball drives, Cade Dosunmu stays with him. Ben Ball attempts a Layup. Contested by Cade Dosunmu (3.4 feet, ZONE). Ben Ball misses. Rebound secured by Cade Dosunmu.

[11:32] Team_042 possession (Score: 80-73)
Jarrett Sabonis attempts a 3Pt. Wide open! Desmond Simmons is 6.8 feet away. [MAN] JARRETT SABONIS MAKES IT!
Score: 83-73

[11:17] Team_067 possession (Score: 83-73)
Anfernee Wagner attempts a Midrange. Contested by Kristaps Parker (4.1 feet, MAN). Anfernee Wagner misses. Offensive rebound by Malcolm Westbrook! Malcolm Westbrook puts it back in!
Score: 83-75

[11:02] Team_042 possession (Score: 83-75)
FOUL! Shooting foul on Anfernee Wagner. Dejounte Butler to the line for 2 free throws. [Team fouls: 1] (Anfernee Wagner: 1 personal fouls)   FT 1/2: GOOD   FT 2/2: GOOD Dejounte Butler makes 2/2 from the line.
Score: 85-75

[10:50] Team_067 possession (Score: 85-75)
Desmond Simmons attempts a 3Pt. Contested by Jarrett Sabonis (2.4 feet, MAN). Desmond Simmons misses. Rebound secured by Cade Dosunmu.

[10:39] Team_042 possession (Score: 85-75)
Cade Dosunmu makes the Midrange and draws the foul on Anfernee Wagner! And-1! Cade Dosunmu to the line for 1. [Team fouls: 2] (Anfernee Wagner: 2 personal fouls)   FT 1/1: GOOD Cade Dosunmu makes 1/1 from the line.
Score: 88-75

[10:25] Team_067 possession (Score: 88-75)
Manu Reaves attempts a Midrange. Contested by Tyler Barrett (5.5 feet, MAN). MANU REAVES MAKES IT! Assist: Desmond Simmons
Score: 88-77

[10:08] Team_042 possession (Score: 88-77)
Tyler Barrett drives, Malcolm Westbrook stays with him. Tyler Barrett attempts a Dunk. Contested by Malcolm Westbrook (3.4 feet, ZONE). Tyler Barrett misses. Rebound secured by Malcolm Westbrook.

[09:56] Team_067 possession (Score: 88-77)
Malcolm Westbrook attempts a Midrange. Contested by Cade Dosunmu (5.7 feet, MAN). Malcolm Westbrook misses. Rebound secured by Tyler Barrett.

[09:40] Team_042 possession (Score: 88-77)
FOUL! Reach-in foul on Desmond Simmons during the drive. [Team fouls: 3] No free throws, side out. (Desmond Simmons: 1 personal fouls)

[09:28] Team_042 possession (Score: 88-77)
Tyler Barrett attempts a 3Pt. Wide open! Ben Ball is 8.0 feet away. [ZONE] TYLER BARRETT MAKES IT! Assist: Dejounte Butler
Score: 91-77

[09:11] Team_067 possession (Score: 91-77)
FOUL! Shooting foul on Tyler Barrett. Manu Reaves to the line for 3 free throws. [Team fouls: 1] (Tyler Barrett: 1 personal fouls)   FT 1/3: GOOD   FT 2/3: GOOD   FT 3/3: GOOD Manu Reaves makes 3/3 from the line.
Score: 91-80

[08:57] Team_042 possession (Score: 91-80)
FOUL! Holding foul on Malcolm Westbrook. [Team fouls: 4] No free throws, side out. (Malcolm Westbrook: 1 personal fouls)

[08:47] Team_042 possession (Score: 91-80)
Dejounte Butler attempts a 3Pt. Heavily contested by Ben Ball (1.4 feet, MAN)! Dejounte Butler misses. Rebound secured by Desmond Simmons.

[08:32] Team_067 possession (Score: 91-80)
Manu Reaves attempts a 3Pt. Contested by Tyler Barrett (4.3 feet, ZONE). MANU REAVES MAKES IT! Assist: Ben Ball
Score: 91-83

[08:21] Team_042 possession (Score: 91-83)
Dejounte Butler attempts a 3Pt. Wide open! Manu Reaves is 7.9 feet away. [ZONE] Dejounte Butler misses. Rebound secured by Anfernee Wagner.

[08:06] Team_067 possession (Score: 91-83)
Manu Reaves attempts a Midrange. Contested by Tyler Barrett (4.3 feet, MAN). Manu Reaves misses. Rebound secured by Cade Dosunmu.

[07:53] Team_042 possession (Score: 91-83)
Cade Dosunmu attempts a Midrange. Contested by Malcolm Westbrook (3.1 feet, MAN). CADE DOSUNMU MAKES IT! Assist: Tyler Barrett
Score: 93-83

[07:37] Team_067 possession (Score: 93-83)
Malcolm Westbrook drives to the basket... Malcolm Westbrook loses control! Ball rolls out of bounds! TURNOVER! (dead ball)

[07:37] Substitution (Team_042): Tyler Barrett OUT → Khris George IN (stamina_rule2)

[07:37] Substitution (Team_042): Kristaps Parker OUT → Isaiah Randle IN (stamina_rule2)

[07:37] Substitution (Team_042): Jarrett Sabonis OUT → Gary Jackson IN (stamina_rule2)

[07:37] Substitution (Team_042): Dejounte Butler OUT → Allen Towns IN (stamina_rule2)

[07:37] Substitution (Team_042): Cade Dosunmu OUT → Lamelo Stewart IN (stamina_rule2)

[07:37] Substitution (Team_067): Manu Reaves OUT → James Rozier IN (stamina_rule2)

[07:37] Substitution (Team_067): Desmond Simmons OUT → Kyle Leonard IN (stamina_rule2)

[07:37] Substitution (Team_067): Ben Ball OUT → Kristaps Davis IN (stamina_rule2)

[07:37] Substitution (Team_067): Malcolm Westbrook OUT → Zach DeRozan IN (stamina_rule2)

[07:21] Team_042 possession (Score: 93-83)
Isaiah Randle attempts a Midrange. Heavily contested by Kyle Leonard (0.5 feet, ZONE)! Isaiah Randle misses. Rebound secured by Zach DeRozan.

[07:07] Team_067 possession (Score: 93-83)
Anfernee Wagner drives, Isaiah Randle stays with him. Anfernee Wagner attempts a Dunk. Contested by Isaiah Randle (4.3 feet, MAN). ANFERNEE WAGNER MAKES IT! Assist: James Rozier
Score: 93-85

[06:49] Team_042 possession (Score: 93-85)
Isaiah Randle attempts a Midrange. Contested by Anfernee Wagner (3.9 feet, MAN). Isaiah Randle misses. Rebound secured by Kristaps Davis.

[06:37] Team_067 possession (Score: 93-85)
Anfernee Wagner drives, picks up Isaiah Randle. Help arrives from Khris George! Anfernee Wagner attempts a Dunk. Contested by Khris George (3.0 feet, MAN). Anfernee Wagner misses. Rebound secured by Allen Towns.

[06:24] Team_042 possession (Score: 93-85)
FOUL! Shooting foul on Kristaps Davis. Lamelo Stewart to the line for 2 free throws. [BONUS: 5 team fouls] (Kristaps Davis: 1 personal fouls)   FT 1/2: GOOD   FT 2/2: MISS Lamelo Stewart makes 1/2 from the line. Rebound secured by Kristaps Davis.
Score: 94-85

[06:06] Team_067 possession (Score: 94-85)
FOUL! Reach-in foul on Allen Towns during the drive. [Team fouls: 2] No free throws, side out. (Allen Towns: 1 personal fouls)

[05:52] Team_067 possession (Score: 94-85)
Zach DeRozan drives, Allen Towns stays with him. Zach DeRozan attempts a Layup. Contested by Allen Towns (5.7 feet, ZONE). Zach DeRozan misses. Rebound secured by Allen Towns.

[05:38] Team_042 possession (Score: 94-85)
Lamelo Stewart attempts a Midrange. Contested by Zach DeRozan (3.3 feet, MAN). Lamelo Stewart misses. Offensive rebound by Allen Towns! Allen Towns kicks it out.

[05:24] Team_042 possession (Score: 94-85)
Isaiah Randle attempts a 3Pt. Contested by Anfernee Wagner (3.6 feet, MAN). Isaiah Randle misses. Rebound secured by Kristaps Davis.

[05:11] Team_067 possession (Score: 94-85)
FOUL! Holding foul on Khris George. [Team fouls: 3] No free throws, side out. (Khris George: 1 personal fouls)

[04:56] Team_067 possession (Score: 94-85)
James Rozier attempts a 3Pt. Contested by Khris George (4.8 feet, MAN). James Rozier misses. Rebound secured by Lamelo Stewart.

[04:39] Team_042 possession (Score: 94-85)
Isaiah Randle attempts a Midrange. Wide open! Anfernee Wagner is 6.2 feet away. [MAN] Isaiah Randle misses. Rebound secured by Zach DeRozan.

[04:21] Team_067 possession (Score: 94-85)
Anfernee Wagner attempts a 3Pt. Contested by Isaiah Randle (4.4 feet, MAN). Anfernee Wagner misses. Rebound secured by Allen Towns.

[04:03] Team_042 possession (Score: 94-85)
Lamelo Stewart attempts a Midrange. Heavily contested by Zach DeRozan (0.9 feet, MAN)! Lamelo Stewart misses. Rebound secured by Kristaps Davis.

[03:50] Team_067 possession (Score: 94-85)
Anfernee Wagner commits a violation (traveling/carry)! TURNOVER! (dead ball)

[03:38] Team_042 possession (Score: 94-85)
Khris George attempts a 3Pt. Contested by Kyle Leonard (3.5 feet, ZONE). Khris George misses. Rebound secured by Kristaps Davis.

[03:23] Team_067 possession (Score: 94-85)
FOUL! Holding foul on Khris George. [Team fouls: 4] No free throws, side out. (Khris George: 2 personal fouls)

[03:07] Team_067 possession (Score: 94-85)
FOUL! Offensive foul on James Rozier! Khris George drew the charge! [Team fouls: 6] (James Rozier: 1 personal fouls) TURNOVER! (dead ball)

[02:51] Team_042 possession (Score: 94-85)
Lamelo Stewart makes the Dunk and draws the foul on Kristaps Davis! And-1! Lamelo Stewart to the line for 1. [BONUS: 7 team fouls] (Kristaps Davis: 2 personal fouls)   FT 1/1: MISS Lamelo Stewart makes 0/1 from the line. Rebound secured by Zach DeRozan.
Score: 96-85

[02:37] Team_067 possession (Score: 96-85)
Kyle Leonard attempts a Midrange. Contested by Isaiah Randle (3.7 feet, ZONE). KYLE LEONARD MAKES IT! Assist: James Rozier
Score: 96-87

[02:23] Team_042 possession (Score: 96-87)
FOUL! Reach-in foul on Kristaps Davis during the drive. [IN THE BONUS! 8 team fouls] Khris George to the line for 2 free throws. (Kristaps Davis: 3 personal fouls)   FT 1/2: GOOD   FT 2/2: GOOD Khris George makes 2/2 from the line.
Score: 98-87

[02:09] Team_067 possession (Score: 98-87)
Zach DeRozan drives and kicks out. Kyle Leonard attempts a Midrange. Contested by Gary Jackson (2.5 feet, MAN). KYLE LEONARD MAKES IT!
Score: 98-89

[01:55] Team_042 possession (Score: 98-89)
Khris George attempts a 3Pt. Contested by Kristaps Davis (3.3 feet, ZONE). KHRIS GEORGE MAKES IT! Assist: Gary Jackson
Score: 101-89

[01:40] Team_067 possession (Score: 101-89)
James Rozier attempts a Layup. BLOCKED BY KHRIS GEORGE! Ball is loose! Offensive rebound by Kristaps Davis! Kristaps Davis kicks it out.

[01:29] Team_067 possession (Score: 101-89)
Kyle Leonard attempts a 3Pt. Contested by Gary Jackson (5.0 feet, MAN). Kyle Leonard misses. Rebound secured by Lamelo Stewart.

[01:18] Team_042 possession (Score: 101-89)
Isaiah Randle drives and kicks out. Gary Jackson attempts a 3Pt. Wide open! Kyle Leonard is 9.1 feet away. [MAN] Gary Jackson misses. Rebound secured by Zach DeRozan.

[01:04] Team_067 possession (Score: 101-89)
Kyle Leonard drives and kicks out. Kristaps Davis attempts a Midrange. Wide open! Gary Jackson is 7.5 feet away. [ZONE] Kristaps Davis misses. Rebound secured by Gary Jackson.

[00:48] Team_042 possession (Score: 101-89)
Allen Towns attempts a 3Pt. Wide open! Kristaps Davis is 6.7 feet away. [MAN] Allen Towns misses. Rebound secured by Kristaps Davis.

[00:34] Team_067 possession (Score: 101-89)
James Rozier drives, Allen Towns stays with him. James Rozier attempts a Dunk. Contested by Allen Towns (2.2 feet, ZONE). James Rozier misses. Rebound secured by Lamelo Stewart.

[00:22] Team_042 possession (Score: 101-89)
Lamelo Stewart attempts a Layup. Contested by Zach DeRozan (4.9 feet, MAN). LAMELO STEWART MAKES IT! Assist: Allen Towns
Score: 103-89

[00:12] Team_067 possession (Score: 103-89)
Kristaps Davis makes the Dunk and draws the foul on Allen Towns! And-1! Kristaps Davis to the line for 1. [BONUS: 5 team fouls] (Allen Towns: 2 personal fouls)   FT 1/1: GOOD Kristaps Davis makes 1/1 from the line.
Score: 103-92

================================================================================
                              4TH QUARTER COMPLETE                              
================================================================================

4TH QUARTER SCORE: Team_042 23, Team_067 19

BOX SCORE:
================================================================================

Team_042
--------------------------------------------------------------------------------
Player                MIN  PTS  REB  AST  TO      FG   FG%      3P   3P%
--------------------------------------------------------------------------------
Cade Dosunmu           28    5    3    0   0   2/2   100.0     0/0   0.0
Khris George           20    5    0    0   0   2/3    66.7     0/0   0.0
Jarrett Sabonis        28    3    0    0   0   1/1   100.0     0/0   0.0
Tyler Barrett          28    3    1    1   0   1/2    50.0     0/0   0.0
Dejounte Butler        28    2    0    1   0   1/3    33.3     0/0   0.0
Lamelo Stewart         20    2    3    0   0   1/4    25.0     0/0   0.0
Isaiah Randle          20    0    0    0   0   0/5     0.0     0/0   0.0
Allen Towns            20    0    4    1   0   0/1     0.0     0/0   0.0
Gary Jackson           20    0    1    1   0   0/0     0.0     0/0   0.0

TEAM: FG: 8/21 (38.1%), 3PT: 3/8 (37.5%), REB: 12 (1 off, 11 def), AST: 4, TO: 1
TEAM FOULS: 5 [Team_067 in BONUS]


Team_067
--------------------------------------------------------------------------------
Player                MIN  PTS  REB  AST  TO      FG   FG%      3P   3P%
--------------------------------------------------------------------------------
Manu Reaves            28    8    0    0   0   3/4    75.0     0/0   0.0
Kyle Leonard           18    4    0    0   0   2/4    50.0     0/0   0.0
Kristaps Davis         20    3    7    0   0   1/1   100.0     0/0   0.0
Malcolm Westbrook      28    2    2    0   0   1/2    50.0     0/0   0.0
Anfernee Wagner        25    2    1    0   0   1/3    33.3     0/0   0.0
Ben Ball               28    0    0    1   0   0/1     0.0     0/0   0.0
Desmond Simmons        31    0    1    1   0   0/1     0.0     0/0   0.0
Zach DeRozan           20    0    4    0   0   0/1     0.0     0/0   0.0
James Rozier           20    0    0    2   0   0/2     0.0     0/0   0.0

TEAM: FG: 8/19 (42.1%), 3PT: 2/6 (33.3%), REB: 15 (2 off, 13 def), AST: 4, TO: 3
TEAM FOULS: 8 [Team_042 in BONUS]

================================================================================

================================================================================
                               FULL GAME COMPLETE                               
================================================================================

FINAL SCORE: Team_042 103, Team_067 92

SCORING BY QUARTER:
--------------------------------------------------------------------------------
Team                     Q1     Q2     Q3     Q4    FINAL
--------------------------------------------------------------------------------
Team_042                 31     21     28     23      103
Team_067                 22     24     27     19       92
--------------------------------------------------------------------------------

FULL GAME BOX SCORE:
================================================================================

Team_042
--------------------------------------------------------------------------------
Player                MIN  PTS  REB  AST  TO      FG   FG%      3P   3P%      FT STL BLK
--------------------------------------------------------------------------------
Tyler Barrett          28    8    5    1   2   3/5    60.0   1/2    50.0   1/2     0   0
Kristaps Parker        28    7    0    1   2   3/5    60.0   1/3    33.3   0/0     0   0
Jarrett Sabonis        28   19    0    3   2   9/13   69.2   1/4    25.0  10/13    0   1
Dejounte Butler        28    8   12    3   2   1/6    16.7   0/3     0.0   2/2     1   1
Cade Dosunmu           28   23   11    1   4  10/13   76.9   1/1   100.0   5/6     2   0
Khris George           20    5    0    3   0   2/3    66.7   1/2    50.0   2/2     0   2
Isaiah Randle          20    2    0    1   1   2/9    22.2   1/4    25.0   0/0     0   1
Gary Jackson           20    2    4    1   1   2/3    66.7   0/0     0.0   0/0     1   0
Allen Towns            20   11    7    1   0   4/7    57.1   2/4    50.0   3/3     0   0
Lamelo Stewart         20   12   10    1   1   4/10   40.0   0/1     0.0   3/5     1   0

TEAM: FG: 42/76 (55.3%), 3PT: 8/24 (33.3%), REB: 49 (8 off, 41 def), AST: 16, TO: 15


Team_067
--------------------------------------------------------------------------------
Player                MIN  PTS  REB  AST  TO      FG   FG%      3P   3P%      FT STL BLK
--------------------------------------------------------------------------------
Desmond Simmons        31    0   11    4   1   1/6    16.7   0/4     0.0   1/2     0   0
Manu Reaves            28   22    0    2   2   7/13   53.8   4/5    80.0   3/3     2   0
Ben Ball               28   11    0    2   1   5/12   41.7   1/4    25.0   0/0     0   0
Malcolm Westbrook      28   11    7    2   2   3/7    42.9   1/2    50.0   2/2     0   0
Anfernee Wagner        25   13    3    3   1   6/12   50.0   2/6    33.3   1/1     0   0
Wendell Antetokounmpo   23   14    3    4   0   5/10   50.0   3/7    42.9   1/1     1   0
James Rozier           20    0    0    2   2   0/3     0.0   0/2     0.0   0/0     0   0
Kristaps Davis         20   14    8    1   0   4/6    66.7   2/4    50.0   1/1     0   1
Zach DeRozan           20    2    8    4   0   3/4    75.0   0/0     0.0   0/0     0   0
Kyle Leonard           18    4    1    0   1   1/5    20.0   0/3     0.0   0/0     0   0

TEAM: FG: 35/78 (44.9%), 3PT: 13/37 (35.1%), REB: 41 (8 off, 33 def), AST: 24, TO: 10

================================================================================
