================================================================================
                        FULL GAME - Team_007 vs Team_043                        
================================================================================

================================================================================
                       1ST QUARTER - Team_007 vs Team_043                       
================================================================================

[12:00] Team_007 possession (Score: 0-0)
John Quickley attempts a Midrange. Contested by D'Angelo Iverson (2.8 feet, ZONE). John Quickley misses. Offensive rebound by Carmelo Siakam! Carmelo Siakam's putback is no good. Rebound secured by D'Angelo Iverson.

[11:51] Team_043 possession (Score: 0-0)
D'Angelo Iverson attempts a 3Pt. Contested by Bones Siakam (4.8 feet, MAN). D'Angelo Iverson misses. Rebound secured by Bones Siakam.

[11:37] Team_007 possession (Score: 0-0)
Jaren Dosunmu attempts a Layup. Wide open! Manu Carter is 8.5 feet away. [ZONE] JAREN DOSUNMU MAKES IT! Assist: Bones Siakam
Score: 2-0

[11:26] Team_043 possession (Score: 2-0)
FOUL! Reach-in foul on John Quickley during the drive. [Team fouls: 1] No free throws, side out. (John Quickley: 1 personal fouls)

[11:15] Team_043 possession (Score: 2-0)
FOUL! Holding foul on John Quickley. [Team fouls: 2] No free throws, side out. (John Quickley: 2 personal fouls)

[10:59] Team_043 possession (Score: 2-0)
Dwyane Dosunmu attempts a Midrange. Contested by John Quickley (4.1 feet, MAN). Dwyane Dosunmu misses. Rebound secured by John Quickley.

[10:44] Team_007 possession (Score: 2-0)
Tobias Johnson drives and kicks out. Carmelo Siakam attempts a 3Pt. Contested by D'Angelo Iverson (2.7 feet, ZONE). Carmelo Siakam misses. Rebound secured by Dwyane Dosunmu.

[10:25] Team_043 possession (Score: 2-0)
Dwyane Dosunmu drives, picks up John Quickley. Help arrives from Jaren Dosunmu! Dwyane Dosunmu attempts a Layup. Contested by Jaren Dosunmu (3.0 feet, ZONE). DWYANE DOSUNMU MAKES IT!
Score: 2-2

[10:10] Team_007 possession (Score: 2-2)
Carmelo Siakam makes the Layup and draws the foul on Malcolm Murray! And-1! Carmelo Siakam to the line for 1. [Team fouls: 1] (Malcolm Murray: 1 personal fouls)   FT 1/1: GOOD Carmelo Siakam makes 1/1 from the line.
Score: 5-2

[10:00] Team_043 possession (Score: 5-2)
Malcolm Murray attempts a 3Pt. Contested by John Quickley (2.4 feet, ZONE). MALCOLM MURRAY MAKES IT! Assist: D'Angelo Iverson
Score: 5-5

[09:49] Team_007 possession (Score: 5-5)
Jaren Dosunmu attempts a 3Pt. Contested by Magic Durant (5.9 feet, MAN). Jaren Dosunmu misses. Rebound secured by D'Angelo Iverson.

[09:33] Team_043 possession (Score: 5-5)
D'Angelo Iverson attempts a Midrange. Wide open! John Quickley is 6.0 feet away. [ZONE] D'ANGELO IVERSON MAKES IT!
Score: 5-7

[09:16] Team_007 possession (Score: 5-7)
Bones Siakam attempts a 3Pt. Contested by D'Angelo Iverson (3.7 feet, MAN). Bones Siakam misses. Rebound secured by Manu Carter.

[09:02] Team_043 possession (Score: 5-7)
Manu Carter commits a violation (traveling/carry)! TURNOVER! (dead ball)

[08:49] Team_007 possession (Score: 5-7)
Jaren Dosunmu attempts a Midrange. Contested by Magic Durant (4.0 feet, MAN). Jaren Dosunmu misses. Rebound secured by Dwyane Dosunmu.

[08:30] Team_043 possession (Score: 5-7)
Malcolm Murray loses control! Ball rolls out of bounds! TURNOVER! (dead ball)

[08:16] Team_007 possession (Score: 5-7)
Carmelo Siakam drives, Manu Carter stays with him. Carmelo Siakam attempts a Layup. Wide open! Manu Carter is 6.9 feet away. [ZONE] CARMELO SIAKAM MAKES IT!
Score: 7-7

[08:03] Team_043 possession (Score: 7-7)
FOUL! Shooting foul on John Quickley. Manu Carter to the line for 2 free throws. [Team fouls: 3] (John Quickley: 3 personal fouls)   FT 1/2: GOOD   FT 2/2: GOOD Manu Carter makes 2/2 from the line.
Score: 7-9

[07:48] Team_007 possession (Score: 7-9)
Bones Siakam attempts a Midrange. Contested by D'Angelo Iverson (5.9 feet, MAN). Bones Siakam misses. Rebound secured by Dwyane Dosunmu.

[07:34] Team_043 possession (Score: 7-9)
Dwyane Dosunmu attempts a Midrange. Contested by Bones Siakam (2.5 feet, ZONE). Dwyane Dosunmu misses. Rebound secured by John Quickley.

[07:17] Team_007 possession (Score: 7-9)
John Quickley attempts a Midrange. Wide open! Magic Durant is 7.1 feet away. [ZONE] John Quickley misses. Rebound secured by Manu Carter.

[07:01] Team_043 possession (Score: 7-9)
D'Angelo Iverson attempts a Midrange. Contested by Bones Siakam (4.9 feet, MAN). D'Angelo Iverson misses. Offensive rebound by Manu Carter! Manu Carter kicks it out.

[06:46] Team_043 possession (Score: 7-9)
FOUL! Reach-in foul on John Quickley during the drive. [Team fouls: 4] No free throws, side out. (John Quickley: 4 personal fouls)

[06:34] Team_043 possession (Score: 7-9)
Malcolm Murray attempts a 3Pt. Contested by Tobias Johnson (3.4 feet, MAN). Malcolm Murray misses. Rebound secured by Bones Siakam.

[06:19] Team_007 possession (Score: 7-9)
Bones Siakam attempts a 3Pt. Contested by D'Angelo Iverson (2.5 feet, ZONE). Bones Siakam misses. Rebound secured by Dwyane Dosunmu.

[06:03] Team_043 possession (Score: 7-9)
FOUL! Shooting foul on John Quickley. Dwyane Dosunmu to the line for 2 free throws. [BONUS: 5 team fouls] (John Quickley: 5 personal fouls)   FT 1/2: MISS   FT 2/2: GOOD Dwyane Dosunmu makes 1/2 from the line.
Score: 7-10

[05:49] Team_007 possession (Score: 7-10)
John Quickley throws a bad pass! Stolen by Manu Carter! TURNOVER! (live ball)

[05:34] Team_043 possession (Score: 7-10)
Manu Carter drives and kicks out. D'Angelo Iverson attempts a 3Pt. Contested by Jaren Dosunmu (3.2 feet, ZONE). D'Angelo Iverson misses. Rebound secured by Carmelo Siakam.

[05:20] Team_007 possession (Score: 7-10)
Carmelo Siakam attempts a Midrange. Contested by Manu Carter (5.2 feet, MAN). Carmelo Siakam misses. Rebound secured by D'Angelo Iverson.

[05:06] Team_043 possession (Score: 7-10)
D'Angelo Iverson attempts a Layup. Contested by Bones Siakam (5.7 feet, MAN). D'Angelo Iverson misses. Rebound secured by John Quickley.

[04:54] Team_007 possession (Score: 7-10)
Bones Siakam attempts a Midrange. Heavily contested by D'Angelo Iverson (0.5 feet, MAN)! Bones Siakam misses. Rebound secured by Dwyane Dosunmu.

[04:38] Team_043 possession (Score: 7-10)
Magic Durant attempts a 3Pt. BLOCKED BY JOHN QUICKLEY! Ball is loose! Offensive rebound by Manu Carter! Manu Carter kicks it out.

[04:27] Team_043 possession (Score: 7-10)
D'Angelo Iverson attempts a 3Pt. Contested by Jaren Dosunmu (2.5 feet, ZONE). D'Angelo Iverson misses. Rebound secured by Carmelo Siakam.

[04:14] Team_007 possession (Score: 7-10)
Bones Siakam attempts a 3Pt. Contested by D'Angelo Iverson (4.7 feet, ZONE). Bones Siakam misses. Rebound secured by Dwyane Dosunmu.

[04:01] Team_043 possession (Score: 7-10)
Manu Carter attempts a Midrange. Contested by Carmelo Siakam (4.9 feet, ZONE). MANU CARTER MAKES IT!
Score: 7-12

[03:47] Team_007 possession (Score: 7-12)
FOUL! Shooting foul on Manu Carter. Tobias Johnson to the line for 2 free throws. [Team fouls: 2] (Manu Carter: 1 personal fouls)   FT 1/2: GOOD   FT 2/2: GOOD Tobias Johnson makes 2/2 from the line.
Score: 9-12

[03:31] Team_043 possession (Score: 9-12)
Magic Durant attempts a 3Pt. Contested by Jaren Dosunmu (5.7 feet, MAN). Magic Durant misses. Rebound secured by Carmelo Siakam.

[03:20] Team_007 possession (Score: 9-12)
Jaren Dosunmu loses the ball! Stripped by Magic Durant! TURNOVER! (live ball)

[03:07] Team_043 possession (Score: 9-12)
Magic Durant drives, Jaren Dosunmu stays with him. Magic Durant attempts a Layup. Contested by Jaren Dosunmu (5.4 feet, MAN). Magic Durant misses. Rebound secured by Carmelo Siakam.

[02:57] Team_007 possession (Score: 9-12)
Tobias Johnson throws a bad pass! Stolen by Malcolm Murray! TURNOVER! (live ball)

[02:46] Team_043 possession (Score: 9-12)
Malcolm Murray attempts a 3Pt. Heavily contested by John Quickley (1.7 feet, ZONE)! Malcolm Murray misses. Rebound secured by John Quickley.

[02:34] Team_007 possession (Score: 9-12)
Carmelo Siakam attempts a Midrange. Contested by D'Angelo Iverson (5.7 feet, ZONE). Carmelo Siakam misses. Rebound secured by Manu Carter.

[02:23] Team_043 possession (Score: 9-12)
Manu Carter attempts a Layup. BLOCKED BY JOHN QUICKLEY! Ball is loose! Rebound secured by Carmelo Siakam.

[02:09] Team_007 possession (Score: 9-12)
Jaren Dosunmu attempts a Midrange. Contested by Malcolm Murray (5.0 feet, ZONE). Jaren Dosunmu misses. Offensive rebound by Carmelo Siakam! Carmelo Siakam puts it back in!
Score: 11-12

[01:53] Team_043 possession (Score: 11-12)
Malcolm Murray drives and kicks out. Dwyane Dosunmu attempts a Midrange. Contested by John Quickley (3.4 feet, MAN). Dwyane Dosunmu misses. Rebound secured by John Quickley.

[01:43] Team_007 possession (Score: 11-12)
Tobias Johnson drives, Manu Carter stays with him. Tobias Johnson attempts a Dunk. Wide open! Manu Carter is 10.0 feet away. [ZONE] Tobias Johnson misses. Rebound secured by Dwyane Dosunmu.

[01:30] Team_043 possession (Score: 11-12)
Magic Durant attempts a 3Pt. Contested by John Quickley (4.4 feet, ZONE). Magic Durant misses. Rebound secured by Bones Siakam.

[01:14] Team_007 possession (Score: 11-12)
Carmelo Siakam attempts a Layup. Contested by Manu Carter (3.8 feet, MAN). CARMELO SIAKAM MAKES IT! Assist: John Quickley
Score: 13-12

[01:03] Team_043 possession (Score: 13-12)
Manu Carter attempts a 3Pt. Contested by John Quickley (3.0 feet, MAN). MANU CARTER MAKES IT! Assist: Magic Durant
Score: 13-15

[00:52] Team_007 possession (Score: 13-15)
FOUL! Holding foul on Magic Durant. [Team fouls: 3] No free throws, side out. (Magic Durant: 1 personal fouls)

[00:37] Team_007 possession (Score: 13-15)
Jaren Dosunmu attempts a Midrange. Contested by Magic Durant (5.4 feet, MAN). Jaren Dosunmu misses. Offensive rebound by Carmelo Siakam! Carmelo Siakam puts it back in!
Score: 15-15

[00:20] Team_043 possession (Score: 15-15)
Malcolm Murray attempts a 3Pt. Contested by John Quickley (3.5 feet, ZONE). Malcolm Murray misses. Rebound secured by John Quickley.

[00:02] Team_007 possession (Score: 15-15)
Tobias Johnson attempts a Midrange. Contested by Malcolm Murray (4.4 feet, MAN). Tobias Johnson misses. Rebound secured by Manu Carter.

================================================================================
                              1ST QUARTER COMPLETE                              
================================================================================

1ST QUARTER SCORE: Team_007 15, Team_043 15

BOX SCORE:
================================================================================

Team_007
--------------------------------------------------------------------------------
Player                MIN  PTS  REB  AST  TO      FG   FG%      3P   3P%
--------------------------------------------------------------------------------
Carmelo Siakam         12   11    7    0   0   5/7    71.4     0/0   0.0
Jaren Dosunmu          12    2    0    0   0   1/3    33.3     0/0   0.0
Tobias Johnson         12    2    0    0   0   1/4    25.0     0/0   0.0
John Quickley          12    0    6    1   0   0/2     0.0     0/0   0.0
Bones Siakam           12    0    3    1   0   0/5     0.0     0/0   0.0

TEAM: FG: 7/21 (33.3%), 3PT: 0/4 (0.0%), REB: 17 (3 off, 14 def), AST: 2, TO: 3
TEAM FOULS: 5 [Team_043 in BONUS]


Team_043
--------------------------------------------------------------------------------
Player                MIN  PTS  REB  AST  TO      FG   FG%      3P   3P%
--------------------------------------------------------------------------------
Manu Carter            12    7    6    0   0   3/5    60.0     0/0   0.0
Dwyane Dosunmu         12    3    7    0   0   2/4    50.0     0/0   0.0
Malcolm Murray         12    3    0    0   0   1/5    20.0     0/0   0.0
D'Angelo Iverson       12    2    3    1   0   1/4    25.0     0/0   0.0
Magic Durant           12    0    0    1   0   0/3     0.0     0/0   0.0

TEAM: FG: 7/21 (33.3%), 3PT: 2/9 (22.2%), REB: 15 (2 off, 13 def), AST: 2, TO: 2
TEAM FOULS: 3

================================================================================

================================================================================
                       2ND QUARTER - Team_007 vs Team_043                       
================================================================================

[12:00] Team_007 possession (Score: 15-15)
FOUL! Reach-in foul on Manu Carter during the drive. [Team fouls: 1] No free throws, side out. (Manu Carter: 1 personal fouls)

[11:45] Team_007 possession (Score: 15-15)
FOUL! Shooting foul on D'Angelo Iverson. Bones Siakam to the line for 3 free throws. [Team fouls: 2] (D'Angelo Iverson: 1 personal fouls)   FT 1/3: GOOD   FT 2/3: GOOD   FT 3/3: GOOD Bones Siakam makes 3/3 from the line.
Score: 18-15

[11:30] Team_043 possession (Score: 18-15)
FOUL! Shooting foul on Bones Siakam. D'Angelo Iverson to the line for 2 free throws. [Team fouls: 1] (Bones Siakam: 1 personal fouls)   FT 1/2: GOOD   FT 2/2: GOOD D'Angelo Iverson makes 2/2 from the line.
Score: 18-17

[11:19] Team_007 possession (Score: 18-17)
John Quickley attempts a Layup. BLOCKED BY MANU CARTER! Ball is loose! Offensive rebound by Carmelo Siakam! Carmelo Siakam kicks it out.

[11:00] Team_007 possession (Score: 18-17)
Jaren Dosunmu drives and kicks out. Bones Siakam attempts a Midrange. Contested by Manu Carter (3.8 feet, ZONE). BONES SIAKAM MAKES IT! Assist: Jaren Dosunmu
Score: 20-17

[10:46] Team_043 possession (Score: 20-17)
FOUL! Reach-in foul on John Quickley during the drive. [Team fouls: 2] No free throws, side out. (John Quickley: 1 personal fouls)

[10:32] Team_043 possession (Score: 20-17)
Magic Durant attempts a 3Pt. Wide open! Jaren Dosunmu is 6.5 feet away. [MAN] Magic Durant misses. Rebound secured by John Quickley.

[10:17] Team_007 possession (Score: 20-17)
Bones Siakam attempts a 3Pt. Contested by D'Angelo Iverson (3.2 feet, MAN). Bones Siakam misses. Rebound secured by D'Angelo Iverson.

[10:03] Team_043 possession (Score: 20-17)
FOUL! Shooting foul on John Quickley. Dwyane Dosunmu to the line for 2 free throws. [Team fouls: 3] (John Quickley: 2 personal fouls)   FT 1/2: GOOD   FT 2/2: GOOD Dwyane Dosunmu makes 2/2 from the line.
Score: 20-19

[09:50] Team_007 possession (Score: 20-19)
Jaren Dosunmu attempts a 3Pt. Contested by Magic Durant (4.3 feet, MAN). Jaren Dosunmu misses. Rebound secured by Manu Carter.

[09:37] Team_043 possession (Score: 20-19)
Dwyane Dosunmu drives, John Quickley stays with him. Dwyane Dosunmu attempts a Dunk. Contested by John Quickley (2.6 feet, MAN). DWYANE DOSUNMU MAKES IT!
Score: 20-21

[09:18] Team_007 possession (Score: 20-21)
Jaren Dosunmu drives and kicks out. Carmelo Siakam attempts a 3Pt. Contested by D'Angelo Iverson (4.7 feet, ZONE). Carmelo Siakam misses. Offensive rebound by Carmelo Siakam! Carmelo Siakam puts it back in!
Score: 22-21

[09:01] Team_043 possession (Score: 22-21)
Magic Durant attempts a 3Pt. Contested by John Quickley (4.6 feet, ZONE). Magic Durant misses. Offensive rebound by Manu Carter! Manu Carter kicks it out.

[08:43] Team_043 possession (Score: 22-21)
Manu Carter drives and kicks out. Dwyane Dosunmu attempts a 3Pt. Heavily contested by John Quickley (0.5 feet, ZONE)! Dwyane Dosunmu misses. Rebound secured by Bones Siakam.

[08:24] Team_007 possession (Score: 22-21)
Carmelo Siakam attempts a Midrange. Contested by Manu Carter (3.4 feet, MAN). Carmelo Siakam misses. Rebound secured by Dwyane Dosunmu.

[08:09] Team_043 possession (Score: 22-21)
Malcolm Murray attempts a Layup. Contested by Tobias Johnson (3.3 feet, MAN). MALCOLM MURRAY MAKES IT! Assist: Manu Carter
Score: 22-23

[07:53] Team_007 possession (Score: 22-23)
FOUL! Offensive foul on Bones Siakam! D'Angelo Iverson drew the charge! [Team fouls: 4] (Bones Siakam: 2 personal fouls) TURNOVER! (dead ball)

[07:34] Team_043 possession (Score: 22-23)
D'Angelo Iverson attempts a 3Pt. Contested by John Quickley (3.0 feet, ZONE). D'Angelo Iverson misses. Rebound secured by Bones Siakam.

[07:20] Team_007 possession (Score: 22-23)
Bones Siakam attempts a Midrange. Heavily contested by D'Angelo Iverson (1.3 feet, MAN)! Bones Siakam misses. Rebound secured by D'Angelo Iverson.

[07:08] Team_043 possession (Score: 22-23)
Dwyane Dosunmu drives to the basket... Dwyane Dosunmu commits a violation (traveling/carry)! TURNOVER! (dead ball)

[07:08] Substitution (Team_007): Tobias Johnson OUT → Wendell Poole IN (stamina_rule2)

[07:08] Substitution (Team_007): Jaren Dosunmu OUT → OG Porzingis IN (stamina_rule2)

[07:08] Substitution (Team_007): Bones Siakam OUT → Gary LaVine IN (stamina_rule2)

[07:08] Substitution (Team_007): John Quickley OUT → Austin Simons IN (stamina_rule2)

[07:08] Substitution (Team_007): Carmelo Siakam OUT → Draymond Harris IN (stamina_rule2)

[07:08] Substitution (Team_043): Malcolm Murray OUT → Jabari Holiday IN (stamina_rule2)

[07:08] Substitution (Team_043): Magic Durant OUT → Ben LaVine IN (stamina_rule2)

[07:08] Substitution (Team_043): D'Angelo Iverson OUT → Dirk Herro IN (stamina_rule2)

[07:08] Substitution (Team_043): Manu Carter OUT → Joel Murray IN (stamina_rule2)

[07:08] Substitution (Team_043): Dwyane Dosunmu OUT → Terry Randle IN (stamina_rule2)

[06:53] Team_007 possession (Score: 22-23)
Austin Simons attempts a Layup. Heavily contested by Terry Randle (1.5 feet, ZONE)! AUSTIN SIMONS MAKES IT! Assist: OG Porzingis
Score: 24-23

[06:38] Team_043 possession (Score: 24-23)
Dirk Herro attempts a Layup. Heavily contested by Gary LaVine (1.5 feet, MAN)! DIRK HERRO MAKES IT! Assist: Jabari Holiday
Score: 24-25

[06:24] Team_007 possession (Score: 24-25)
OG Porzingis makes the Layup and draws the foul on Ben LaVine! And-1! OG Porzingis to the line for 1. [Team fouls: 3] (Ben LaVine: 1 personal fouls)   FT 1/1: GOOD OG Porzingis makes 1/1 from the line.
Score: 27-25

[06:09] Team_043 possession (Score: 27-25)
Jabari Holiday drives, Wendell Poole stays with him. Jabari Holiday attempts a Dunk. Wide open! Wendell Poole is 8.1 feet away. [MAN] JABARI HOLIDAY MAKES IT! Assist: Terry Randle
Score: 27-27

[05:55] Team_007 possession (Score: 27-27)
FOUL! Reach-in foul on Terry Randle during the drive. [Team fouls: 4] No free throws, side out. (Terry Randle: 1 personal fouls)

[05:38] Team_007 possession (Score: 27-27)
Wendell Poole drives, Terry Randle stays with him. Wendell Poole attempts a Layup. Heavily contested by Terry Randle (0.5 feet, ZONE)! WENDELL POOLE MAKES IT!
Score: 29-27

[05:22] Team_043 possession (Score: 29-27)
Jabari Holiday attempts a Layup. Wide open! Austin Simons is 7.1 feet away. [ZONE] JABARI HOLIDAY MAKES IT!
Score: 29-29

[05:06] Team_007 possession (Score: 29-29)
FOUL! Reach-in foul on Ben LaVine during the drive. [IN THE BONUS! 5 team fouls] OG Porzingis to the line for 2 free throws. (Ben LaVine: 2 personal fouls)   FT 1/2: MISS   FT 2/2: MISS OG Porzingis makes 0/2 from the line. Rebound secured by Ben LaVine.

[04:52] Team_043 possession (Score: 29-29)
Terry Randle attempts a Layup. Contested by Draymond Harris (4.2 feet, MAN). TERRY RANDLE MAKES IT! Assist: Dirk Herro
Score: 29-31

[04:39] Team_007 possession (Score: 29-31)
Wendell Poole attempts a 3Pt. Contested by Jabari Holiday (4.9 feet, MAN). Wendell Poole misses. Offensive rebound by Draymond Harris! Draymond Harris kicks it out.

[04:24] Team_007 possession (Score: 29-31)
Wendell Poole drives and kicks out. Wendell Poole attempts a 3Pt. Contested by Jabari Holiday (4.3 feet, MAN). Wendell Poole misses. Offensive rebound by Draymond Harris! Draymond Harris kicks it out.

[04:04] Team_007 possession (Score: 29-31)
FOUL! Shooting foul on Terry Randle. Draymond Harris to the line for 2 free throws. [BONUS: 6 team fouls] (Terry Randle: 2 personal fouls)   FT 1/2: GOOD   FT 2/2: GOOD Draymond Harris makes 2/2 from the line.
Score: 31-31

[03:49] Team_043 possession (Score: 31-31)
FOUL! Shooting foul on Austin Simons. Jabari Holiday to the line for 2 free throws. [BONUS: 5 team fouls] (Austin Simons: 1 personal fouls)   FT 1/2: MISS   FT 2/2: MISS Jabari Holiday makes 0/2 from the line. Rebound secured by Draymond Harris.

[03:33] Team_007 possession (Score: 31-31)
Gary LaVine attempts a Midrange. Wide open! Dirk Herro is 7.3 feet away. [ZONE] GARY LAVINE MAKES IT! Assist: Draymond Harris
Score: 33-31

[03:17] Team_043 possession (Score: 33-31)
Ben LaVine attempts a 3Pt. Contested by OG Porzingis (4.3 feet, ZONE). Ben LaVine misses. Offensive rebound by Dirk Herro! Dirk Herro puts it back in!
Score: 33-33

[03:06] Team_007 possession (Score: 33-33)
FOUL! Shooting foul on Dirk Herro. Gary LaVine to the line for 2 free throws. [BONUS: 7 team fouls] (Dirk Herro: 1 personal fouls)   FT 1/2: GOOD   FT 2/2: GOOD Gary LaVine makes 2/2 from the line.
Score: 35-33

[02:47] Team_043 possession (Score: 35-33)
Jabari Holiday makes the Layup and draws the foul on OG Porzingis! And-1! Jabari Holiday to the line for 1. [BONUS: 6 team fouls] (OG Porzingis: 1 personal fouls)   FT 1/1: GOOD Jabari Holiday makes 1/1 from the line.
Score: 35-36

[02:33] Team_007 possession (Score: 35-36)
Draymond Harris drives, Terry Randle stays with him. Draymond Harris attempts a Layup. Wide open! Terry Randle is 6.4 feet away. [ZONE] DRAYMOND HARRIS MAKES IT! Assist: Gary LaVine
Score: 37-36

[02:20] Team_043 possession (Score: 37-36)
Dirk Herro drives to the basket... Dirk Herro commits a violation (traveling/carry)! TURNOVER! (dead ball)

[02:06] Team_007 possession (Score: 37-36)
Gary LaVine attempts a 3Pt. Heavily contested by Dirk Herro (1.3 feet, MAN)! Gary LaVine misses. Offensive rebound by Draymond Harris! Draymond Harris kicks it out.

[01:55] Team_007 possession (Score: 37-36)
OG Porzingis attempts a Midrange. Heavily contested by Ben LaVine (1.8 feet, MAN)! OG Porzingis misses. Rebound secured by Ben LaVine.

[01:38] Team_043 possession (Score: 37-36)
Jabari Holiday drives and kicks out. Ben LaVine attempts a Midrange. Contested by Austin Simons (3.7 feet, ZONE). Ben LaVine misses. Rebound secured by Gary LaVine.

[01:21] Team_007 possession (Score: 37-36)
OG Porzingis drives to the basket... OG Porzingis throws a bad pass! Stolen by Ben LaVine! TURNOVER! (live ball)

[01:04] Team_043 possession (Score: 37-36)
FOUL! Reach-in foul on Austin Simons during the drive. [IN THE BONUS! 7 team fouls] Jabari Holiday to the line for 2 free throws. (Austin Simons: 2 personal fouls)   FT 1/2: GOOD   FT 2/2: MISS Jabari Holiday makes 1/2 from the line. Rebound secured by Gary LaVine.
Score: 37-37

[00:53] Team_007 possession (Score: 37-37)
Draymond Harris attempts a 3Pt. Contested by Dirk Herro (2.2 feet, ZONE). Draymond Harris misses. Rebound secured by Terry Randle.

[00:38] Team_043 possession (Score: 37-37)
Joel Murray attempts a 3Pt. Contested by OG Porzingis (3.7 feet, ZONE). Joel Murray misses. Rebound secured by Gary LaVine.

[00:19] Team_007 possession (Score: 37-37)
Draymond Harris drives to the basket... Draymond Harris throws a bad pass out of bounds! TURNOVER! (dead ball)

[00:08] Team_043 possession (Score: 37-37)
Terry Randle drives and kicks out. Terry Randle attempts a 3Pt. Wide open! Draymond Harris is 6.4 feet away. [MAN] Terry Randle misses. Offensive rebound by Dirk Herro! Dirk Herro's putback is no good. Offensive rebound by Terry Randle! Terry Randle kicks it out.

================================================================================
                              2ND QUARTER COMPLETE                              
================================================================================

2ND QUARTER SCORE: Team_007 22, Team_043 22

BOX SCORE:
================================================================================

Team_007
--------------------------------------------------------------------------------
Player                MIN  PTS  REB  AST  TO      FG   FG%      3P   3P%
--------------------------------------------------------------------------------
Bones Siakam           17    5    2    0   0   2/4    50.0     0/0   0.0
Draymond Harris         7    4    4    1   0   2/3    66.7     0/0   0.0
Gary LaVine             7    4    3    1   0   2/2   100.0     0/0   0.0
OG Porzingis            7    3    0    1   0   1/3    33.3     0/0   0.0
Carmelo Siakam         17    2    2    0   0   1/2    50.0     0/0   0.0
Austin Simons           7    2    0    0   0   1/1   100.0     0/0   0.0
Wendell Poole           7    2    0    0   0   1/1   100.0     0/0   0.0
Jaren Dosunmu          17    0    0    1   0   0/1     0.0     0/0   0.0
John Quickley          17    0    1    0   0   0/0     0.0     0/0   0.0

TEAM: FG: 10/17 (58.8%), 3PT: 1/4 (25.0%), REB: 12 (5 off, 7 def), AST: 4, TO: 3
TEAM FOULS: 8 [Team_043 in BONUS]


Team_043
--------------------------------------------------------------------------------
Player                MIN  PTS  REB  AST  TO      FG   FG%      3P   3P%
--------------------------------------------------------------------------------
Jabari Holiday          7    7    0    1   0   3/6    50.0     0/0   0.0
Dwyane Dosunmu         17    4    1    0   0   2/2   100.0     0/0   0.0
Dirk Herro              7    4    1    1   0   2/2   100.0     0/0   0.0
D'Angelo Iverson       17    2    2    0   0   1/2    50.0     0/0   0.0
Malcolm Murray         17    2    0    0   0   1/1   100.0     0/0   0.0
Terry Randle            7    2    2    1   0   1/1   100.0     0/0   0.0
Magic Durant           17    0    0    0   0   0/1     0.0     0/0   0.0
Manu Carter            17    0    2    1   0   0/1     0.0     0/0   0.0
Ben LaVine              7    0    2    0   0   0/0     0.0     0/0   0.0
Joel Murray             7    0    0    0   0   0/1     0.0     0/0   0.0

TEAM: FG: 10/17 (58.8%), 3PT: 1/4 (25.0%), REB: 10 (3 off, 7 def), AST: 4, TO: 2
TEAM FOULS: 7 [Team_007 in BONUS]

================================================================================

================================================================================
                       3RD QUARTER - Team_007 vs Team_043                       
================================================================================

[12:00] Team_007 possession (Score: 37-37)
Bones Siakam makes the Dunk and draws the foul on D'Angelo Iverson! And-1! Bones Siakam to the line for 1. [Team fouls: 1] (D'Angelo Iverson: 1 personal fouls)   FT 1/1: GOOD Bones Siakam makes 1/1 from the line.
Score: 40-37

[11:48] Team_043 possession (Score: 40-37)
Dwyane Dosunmu attempts a Midrange. Heavily contested by John Quickley (1.8 feet, MAN)! Dwyane Dosunmu misses. Rebound secured by Carmelo Siakam.

[11:34] Team_007 possession (Score: 40-37)
Carmelo Siakam attempts a 3Pt. Contested by D'Angelo Iverson (3.3 feet, ZONE). Carmelo Siakam misses. Rebound secured by D'Angelo Iverson.

[11:20] Team_043 possession (Score: 40-37)
D'Angelo Iverson attempts a 3Pt. Contested by John Quickley (3.0 feet, ZONE). D'Angelo Iverson misses. Rebound secured by John Quickley.

[11:05] Team_007 possession (Score: 40-37)
Jaren Dosunmu attempts a Midrange. Wide open! Magic Durant is 6.1 feet away. [MAN] Jaren Dosunmu misses. Rebound secured by D'Angelo Iverson.

[10:49] Team_043 possession (Score: 40-37)
FOUL! Reach-in foul on John Quickley during the drive. [Team fouls: 1] No free throws, side out. (John Quickley: 1 personal fouls)

[10:34] Team_043 possession (Score: 40-37)
D'Angelo Iverson drives and kicks out. Dwyane Dosunmu attempts a Midrange. Wide open! John Quickley is 7.0 feet away. [MAN] Dwyane Dosunmu misses. Rebound secured by Bones Siakam.

[10:20] Team_007 possession (Score: 40-37)
Bones Siakam attempts a 3Pt. Contested by D'Angelo Iverson (2.9 feet, ZONE). Bones Siakam misses. Rebound secured by Manu Carter.

[10:09] Team_043 possession (Score: 40-37)
Manu Carter drives, John Quickley stays with him. Manu Carter attempts a Layup. Wide open! John Quickley is 7.7 feet away. [MAN] MANU CARTER MAKES IT! Assist: Dwyane Dosunmu
Score: 40-39

[09:58] Team_007 possession (Score: 40-39)
Bones Siakam makes the Layup and draws the foul on Manu Carter! And-1! Bones Siakam to the line for 1. [Team fouls: 2] (Manu Carter: 1 personal fouls)   FT 1/1: GOOD Bones Siakam makes 1/1 from the line.
Score: 43-39

[09:46] Team_043 possession (Score: 43-39)
D'Angelo Iverson drives and kicks out. D'Angelo Iverson attempts a 3Pt. Contested by John Quickley (5.5 feet, ZONE). D'Angelo Iverson misses. Rebound secured by Carmelo Siakam.

[09:34] Team_007 possession (Score: 43-39)
John Quickley attempts a Midrange. Contested by D'Angelo Iverson (4.2 feet, ZONE). JOHN QUICKLEY MAKES IT!
Score: 45-39

[09:21] Team_043 possession (Score: 45-39)
D'Angelo Iverson attempts a Midrange. Heavily contested by Bones Siakam (0.5 feet, MAN)! D'Angelo Iverson misses. Offensive rebound by D'Angelo Iverson! D'Angelo Iverson kicks it out.

[09:12] Team_043 possession (Score: 45-39)
Manu Carter drives and kicks out. Manu Carter attempts a 3Pt. Contested by John Quickley (2.5 feet, MAN). Manu Carter misses. Rebound secured by John Quickley.

[08:52] Team_007 possession (Score: 45-39)
Carmelo Siakam drives and kicks out. Tobias Johnson attempts a Midrange. Heavily contested by Manu Carter (0.8 feet, ZONE)! Tobias Johnson misses. Rebound secured by Manu Carter.

[08:38] Team_043 possession (Score: 45-39)
D'Angelo Iverson attempts a Midrange. Contested by John Quickley (3.4 feet, ZONE). D'ANGELO IVERSON MAKES IT!
Score: 45-41

[08:22] Team_007 possession (Score: 45-41)
Tobias Johnson attempts a Layup. Contested by Malcolm Murray (4.5 feet, MAN). TOBIAS JOHNSON MAKES IT!
Score: 47-41

[08:08] Team_043 possession (Score: 47-41)
D'Angelo Iverson attempts a Layup. Contested by Bones Siakam (2.1 feet, MAN). D'Angelo Iverson misses. Rebound secured by John Quickley.

[07:54] Team_007 possession (Score: 47-41)
Tobias Johnson attempts a 3Pt. Contested by Manu Carter (5.3 feet, ZONE). Tobias Johnson misses. Offensive rebound by Bones Siakam! Bones Siakam's putback is no good. Rebound secured by Manu Carter.

[07:37] Team_043 possession (Score: 47-41)
Manu Carter makes the Layup and draws the foul on John Quickley! And-1! Manu Carter to the line for 1. [Team fouls: 2] (John Quickley: 2 personal fouls)   FT 1/1: GOOD Manu Carter makes 1/1 from the line.
Score: 47-44

[07:20] Team_007 possession (Score: 47-44)
Tobias Johnson attempts a Layup. Contested by Manu Carter (2.4 feet, ZONE). Tobias Johnson misses. Rebound secured by D'Angelo Iverson.

[07:03] Team_043 possession (Score: 47-44)
D'Angelo Iverson attempts a 3Pt. Wide open! Bones Siakam is 6.8 feet away. [MAN] D'ANGELO IVERSON MAKES IT! Assist: Dwyane Dosunmu
Score: 47-47

[06:45] Team_007 possession (Score: 47-47)
Bones Siakam throws a bad pass out of bounds! TURNOVER! (dead ball)

[06:30] Team_043 possession (Score: 47-47)
Manu Carter drives to the basket... FOUL! Offensive foul on Manu Carter! John Quickley drew the charge! [Team fouls: 3] (Manu Carter: 2 personal fouls) TURNOVER! (dead ball)

[06:15] Team_007 possession (Score: 47-47)
FOUL! Shooting foul on Manu Carter. Tobias Johnson to the line for 2 free throws. [Team fouls: 4] (Manu Carter: 3 personal fouls)   FT 1/2: GOOD   FT 2/2: MISS Tobias Johnson makes 1/2 from the line. Rebound secured by D'Angelo Iverson.
Score: 48-47

[06:00] Team_043 possession (Score: 48-47)
Magic Durant attempts a 3Pt. Contested by Jaren Dosunmu (4.6 feet, MAN). MAGIC DURANT MAKES IT! Assist: Dwyane Dosunmu
Score: 48-50

[05:46] Team_007 possession (Score: 48-50)
Jaren Dosunmu drives, picks up Magic Durant. Help arrives from D'Angelo Iverson! Jaren Dosunmu attempts a Dunk. Wide open! D'Angelo Iverson is 7.7 feet away. [MAN] JAREN DOSUNMU MAKES IT!
Score: 50-50

[05:31] Team_043 possession (Score: 50-50)
D'Angelo Iverson attempts a 3Pt. Contested by Bones Siakam (5.4 feet, MAN). D'Angelo Iverson misses. Offensive rebound by D'Angelo Iverson! D'Angelo Iverson kicks it out.

[05:16] Team_043 possession (Score: 50-50)
D'Angelo Iverson attempts a 3Pt. Contested by John Quickley (3.5 feet, ZONE). D'ANGELO IVERSON MAKES IT! Assist: Manu Carter
Score: 50-53

[05:06] Team_007 possession (Score: 50-53)
Carmelo Siakam drives to the basket... Carmelo Siakam throws a bad pass! Stolen by Manu Carter! TURNOVER! (live ball)

[04:51] Team_043 possession (Score: 50-53)
FOUL! Shooting foul on Bones Siakam. D'Angelo Iverson to the line for 2 free throws. [Team fouls: 3] (Bones Siakam: 1 personal fouls)   FT 1/2: GOOD   FT 2/2: GOOD D'Angelo Iverson makes 2/2 from the line.
Score: 50-55

[04:36] Team_007 possession (Score: 50-55)
Tobias Johnson loses the ball! Stripped by Malcolm Murray! TURNOVER! (live ball)

[04:23] Team_043 possession (Score: 50-55)
Dwyane Dosunmu attempts a Midrange. Contested by John Quickley (2.7 feet, ZONE). Dwyane Dosunmu misses. Rebound secured by Bones Siakam.

[04:13] Team_007 possession (Score: 50-55)
Carmelo Siakam drives to the basket... Carmelo Siakam commits a violation (traveling/carry)! TURNOVER! (dead ball)

[04:03] Team_043 possession (Score: 50-55)
Dwyane Dosunmu attempts a Midrange. Contested by John Quickley (5.2 feet, MAN). DWYANE DOSUNMU MAKES IT! Assist: Manu Carter
Score: 50-57

[03:45] Team_007 possession (Score: 50-57)
Jaren Dosunmu attempts a Midrange. Wide open! Magic Durant is 7.1 feet away. [MAN] Jaren Dosunmu misses. Offensive rebound by Bones Siakam! Bones Siakam kicks it out.

[03:31] Team_007 possession (Score: 50-57)
Tobias Johnson attempts a Midrange. Contested by Magic Durant (3.9 feet, ZONE). TOBIAS JOHNSON MAKES IT! Assist: Carmelo Siakam
Score: 52-57

[03:18] Team_043 possession (Score: 52-57)
D'Angelo Iverson attempts a 3Pt. Heavily contested by John Quickley (0.9 feet, ZONE)! D'Angelo Iverson misses. Rebound secured by Carmelo Siakam.

[03:08] Team_007 possession (Score: 52-57)
Carmelo Siakam attempts a Midrange. Contested by Manu Carter (4.2 feet, ZONE). Carmelo Siakam misses. Rebound secured by D'Angelo Iverson.

[02:56] Team_043 possession (Score: 52-57)
FOUL! Reach-in foul on John Quickley during the drive. [Team fouls: 4] No free throws, side out. (John Quickley: 3 personal fouls)

[02:39] Team_043 possession (Score: 52-57)
Magic Durant drives and kicks out. Magic Durant attempts a 3Pt. Contested by John Quickley (4.0 feet, ZONE). Magic Durant misses. Rebound secured by Bones Siakam.

[02:23] Team_007 possession (Score: 52-57)
Carmelo Siakam drives to the basket... Carmelo Siakam loses the ball! Stripped by Manu Carter! TURNOVER! (live ball)

[02:11] Team_043 possession (Score: 52-57)
Malcolm Murray attempts a 3Pt. Contested by John Quickley (4.7 feet, ZONE). Malcolm Murray misses. Offensive rebound by D'Angelo Iverson! D'Angelo Iverson kicks it out.

[01:59] Team_043 possession (Score: 52-57)
Dwyane Dosunmu drives and kicks out. Manu Carter attempts a 3Pt. Contested by John Quickley (4.2 feet, ZONE). Manu Carter misses. Rebound secured by Bones Siakam.

[01:47] Team_007 possession (Score: 52-57)
Bones Siakam attempts a 3Pt. Wide open! Manu Carter is 6.0 feet away. [ZONE] BONES SIAKAM MAKES IT! Assist: Tobias Johnson
Score: 55-57

[01:32] Team_043 possession (Score: 55-57)
D'Angelo Iverson attempts a Midrange. Wide open! Bones Siakam is 6.1 feet away. [MAN] D'ANGELO IVERSON MAKES IT! Assist: Malcolm Murray
Score: 55-59

[01:19] Team_007 possession (Score: 55-59)
Bones Siakam attempts a 3Pt. Contested by D'Angelo Iverson (4.4 feet, MAN). BONES SIAKAM MAKES IT! Assist: Carmelo Siakam
Score: 58-59

[01:05] Team_043 possession (Score: 58-59)
Manu Carter attempts a 3Pt. Contested by John Quickley (4.2 feet, ZONE). Manu Carter misses. Offensive rebound by Manu Carter! Manu Carter kicks it out.

[00:47] Team_043 possession (Score: 58-59)
Manu Carter drives, picks up John Quickley. Help arrives from Jaren Dosunmu! Manu Carter attempts a Layup. Contested by Jaren Dosunmu (5.6 feet, MAN). MANU CARTER MAKES IT! Assist: D'Angelo Iverson
Score: 58-61

[00:33] Team_007 possession (Score: 58-61)
Jaren Dosunmu attempts a 3Pt. Contested by Magic Durant (5.1 feet, MAN). Jaren Dosunmu misses. Rebound secured by Dwyane Dosunmu.

[00:21] Team_043 possession (Score: 58-61)
Dwyane Dosunmu drives and kicks out. Manu Carter attempts a Midrange. Contested by Jaren Dosunmu (2.9 feet, ZONE). Manu Carter misses. Rebound secured by John Quickley.

[00:10] Team_007 possession (Score: 58-61)
Carmelo Siakam attempts a Midrange. Contested by Dwyane Dosunmu (2.4 feet, ZONE). CARMELO SIAKAM MAKES IT! Assist: Tobias Johnson
Score: 60-61

================================================================================
                              3RD QUARTER COMPLETE                              
================================================================================

3RD QUARTER SCORE: Team_007 23, Team_043 24

BOX SCORE:
================================================================================

Team_007
--------------------------------------------------------------------------------
Player                MIN  PTS  REB  AST  TO      FG   FG%      3P   3P%
--------------------------------------------------------------------------------
Bones Siakam           29   12    5    0   0   4/5    80.0     0/0   0.0
Tobias Johnson         29    4    0    2   0   2/5    40.0     0/0   0.0
Carmelo Siakam         29    2    3    2   0   1/4    25.0     0/0   0.0
John Quickley          29    2    4    0   0   1/1   100.0     0/0   0.0
Jaren Dosunmu          29    2    0    0   0   1/3    33.3     0/0   0.0

TEAM: FG: 9/18 (50.0%), 3PT: 2/6 (33.3%), REB: 13 (2 off, 11 def), AST: 4, TO: 5
TEAM FOULS: 4


Team_043
--------------------------------------------------------------------------------
Player                MIN  PTS  REB  AST  TO      FG   FG%      3P   3P%
--------------------------------------------------------------------------------
D'Angelo Iverson       29   12    8    1   0   5/10   50.0     0/0   0.0
Manu Carter            29    7    4    2   0   3/4    75.0     0/0   0.0
Magic Durant           29    3    0    0   0   1/2    50.0     0/0   0.0
Dwyane Dosunmu         29    2    1    3   0   1/5    20.0     0/0   0.0
Malcolm Murray         29    0    0    1   0   0/0     0.0     0/0   0.0

TEAM: FG: 10/21 (47.6%), 3PT: 3/5 (60.0%), REB: 12 (4 off, 8 def), AST: 7, TO: 1
TEAM FOULS: 4

================================================================================

================================================================================
                       4TH QUARTER - Team_007 vs Team_043                       
================================================================================

[12:00] Team_007 possession (Score: 60-61)
Jaren Dosunmu attempts a 3Pt. Heavily contested by D'Angelo Iverson (0.5 feet, ZONE)! Jaren Dosunmu misses. Offensive rebound by Carmelo Siakam! Carmelo Siakam's putback is no good. Rebound secured by Dwyane Dosunmu.

[11:48] Team_043 possession (Score: 60-61)
Dwyane Dosunmu drives and kicks out. Malcolm Murray attempts a 3Pt. Wide open! Tobias Johnson is 6.3 feet away. [MAN] Malcolm Murray misses. Rebound secured by John Quickley.

[11:34] Team_007 possession (Score: 60-61)
Bones Siakam attempts a 3Pt. Contested by D'Angelo Iverson (5.5 feet, MAN). Bones Siakam misses. Offensive rebound by Carmelo Siakam! Carmelo Siakam puts it back in!
Score: 62-61

[11:16] Team_043 possession (Score: 62-61)
Magic Durant drives, John Quickley stays with him. Magic Durant attempts a Layup. Contested by John Quickley (2.6 feet, ZONE). Magic Durant misses. Rebound secured by Bones Siakam.

[11:01] Team_007 possession (Score: 62-61)
FOUL! Shooting foul on D'Angelo Iverson. Tobias Johnson to the line for 3 free throws. [Team fouls: 1] (D'Angelo Iverson: 1 personal fouls)   FT 1/3: GOOD   FT 2/3: GOOD   FT 3/3: GOOD Tobias Johnson makes 3/3 from the line.
Score: 65-61

[10:46] Team_043 possession (Score: 65-61)
Malcolm Murray attempts a 3Pt. Heavily contested by John Quickley (0.7 feet, ZONE)! Malcolm Murray misses. Rebound secured by John Quickley.

[10:29] Team_007 possession (Score: 65-61)
Carmelo Siakam commits a violation (traveling/carry)! TURNOVER! (dead ball)

[10:29] Substitution (Team_007): Tobias Johnson OUT → Wendell Poole IN (stamina_rule2)

[10:29] Substitution (Team_007): Jaren Dosunmu OUT → OG Porzingis IN (stamina_rule2)

[10:29] Substitution (Team_007): Bones Siakam OUT → Gary LaVine IN (stamina_rule2)

[10:29] Substitution (Team_007): John Quickley OUT → Austin Simons IN (stamina_rule2)

[10:29] Substitution (Team_007): Carmelo Siakam OUT → Draymond Harris IN (stamina_rule2)

[10:29] Substitution (Team_043): Malcolm Murray OUT → Jabari Holiday IN (stamina_rule2)

[10:29] Substitution (Team_043): Magic Durant OUT → Ben LaVine IN (stamina_rule2)

[10:29] Substitution (Team_043): D'Angelo Iverson OUT → Dirk Herro IN (stamina_rule2)

[10:29] Substitution (Team_043): Manu Carter OUT → Joel Murray IN (stamina_rule2)

[10:29] Substitution (Team_043): Dwyane Dosunmu OUT → Terry Randle IN (stamina_rule2)

[10:17] Team_043 possession (Score: 65-61)
Terry Randle attempts a Midrange. Contested by Draymond Harris (5.9 feet, MAN). Terry Randle misses. Rebound secured by Draymond Harris.

[10:03] Team_007 possession (Score: 65-61)
Austin Simons attempts a Midrange. Wide open! Joel Murray is 9.5 feet away. [MAN] Austin Simons misses. Rebound secured by Ben LaVine.

[09:49] Team_043 possession (Score: 65-61)
Dirk Herro attempts a Layup. Wide open! Austin Simons is 6.1 feet away. [ZONE] DIRK HERRO MAKES IT! Assist: Terry Randle
Score: 65-63

[09:33] Team_007 possession (Score: 65-63)
OG Porzingis drives, Ben LaVine stays with him. OG Porzingis attempts a Dunk. Wide open! Ben LaVine is 6.7 feet away. [MAN] OG PORZINGIS MAKES IT!
Score: 67-63

[09:20] Team_043 possession (Score: 67-63)
FOUL! Reach-in foul on Austin Simons during the drive. [Team fouls: 1] No free throws, side out. (Austin Simons: 1 personal fouls)

[09:09] Team_043 possession (Score: 67-63)
Ben LaVine drives and kicks out. Ben LaVine attempts a Midrange. Contested by Austin Simons (3.0 feet, ZONE). BEN LAVINE MAKES IT! Assist: Jabari Holiday
Score: 67-65

[08:58] Team_007 possession (Score: 67-65)
Austin Simons attempts a 3Pt. Contested by Dirk Herro (5.3 feet, ZONE). AUSTIN SIMONS MAKES IT! Assist: Wendell Poole
Score: 70-65

[08:45] Team_043 possession (Score: 70-65)
Ben LaVine attempts a 3Pt. Contested by OG Porzingis (6.0 feet, ZONE). Ben LaVine misses. Rebound secured by Austin Simons.

[08:26] Team_007 possession (Score: 70-65)
OG Porzingis drives, picks up Ben LaVine. Help arrives from Dirk Herro! OG Porzingis attempts a Layup. Contested by Dirk Herro (2.6 feet, MAN). OG PORZINGIS MAKES IT! Assist: Gary LaVine
Score: 72-65

[08:13] Team_043 possession (Score: 72-65)
Dirk Herro attempts a 3Pt. Contested by Gary LaVine (4.8 feet, MAN). Dirk Herro misses. Rebound secured by Draymond Harris.

[08:03] Team_007 possession (Score: 72-65)
OG Porzingis makes the Dunk and draws the foul on Ben LaVine! And-1! OG Porzingis to the line for 1. [Team fouls: 2] (Ben LaVine: 1 personal fouls)   FT 1/1: GOOD OG Porzingis makes 1/1 from the line.
Score: 75-65

[07:50] Team_043 possession (Score: 75-65)
Jabari Holiday attempts a Midrange. Contested by Wendell Poole (5.2 feet, MAN). Jabari Holiday misses. Rebound secured by Draymond Harris.

[07:35] Team_007 possession (Score: 75-65)
FOUL! Shooting foul on Terry Randle. OG Porzingis to the line for 2 free throws. [Team fouls: 3] (Terry Randle: 1 personal fouls)   FT 1/2: MISS   FT 2/2: GOOD OG Porzingis makes 1/2 from the line.
Score: 76-65

[07:19] Team_043 possession (Score: 76-65)
Terry Randle attempts a Layup. BLOCKED BY AUSTIN SIMONS! Ball is loose! Rebound secured by Austin Simons.

[07:08] Team_007 possession (Score: 76-65)
Draymond Harris throws a bad pass! Stolen by Terry Randle! TURNOVER! (live ball)

[06:52] Team_043 possession (Score: 76-65)
Dirk Herro attempts a Midrange. Wide open! Draymond Harris is 9.1 feet away. [ZONE] DIRK HERRO MAKES IT! Assist: Ben LaVine
Score: 76-67

[06:34] Team_007 possession (Score: 76-67)
Wendell Poole drives and kicks out. Austin Simons attempts a 3Pt. Contested by Dirk Herro (4.3 feet, ZONE). Austin Simons misses. Offensive rebound by Austin Simons! Austin Simons's putback is no good. Offensive rebound by Austin Simons! Austin Simons kicks it out.

[06:23] Team_007 possession (Score: 76-67)
FOUL! Reach-in foul on Terry Randle during the drive. [Team fouls: 4] No free throws, side out. (Terry Randle: 2 personal fouls)

[06:08] Team_007 possession (Score: 76-67)
FOUL! Shooting foul on Ben LaVine. Draymond Harris to the line for 2 free throws. [BONUS: 5 team fouls] (Ben LaVine: 2 personal fouls)   FT 1/2: GOOD   FT 2/2: MISS Draymond Harris makes 1/2 from the line. FOUL! Loose ball foul on Dirk Herro during the free throw rebound! [IN THE BONUS! 6 team fouls] Austin Simons to the line for 2 free throws. (Dirk Herro: 1 personal fouls)   FT 1/2: GOOD   FT 2/2: GOOD Austin Simons makes 2/2 from the line.
Score: 79-67

[05:52] Team_043 possession (Score: 79-67)
Ben LaVine drives, Austin Simons stays with him. Ben LaVine attempts a Dunk. Wide open! Austin Simons is 7.3 feet away. [ZONE] BEN LAVINE MAKES IT!
Score: 79-69

[05:40] Team_007 possession (Score: 79-69)
Austin Simons drives, Joel Murray stays with him. Austin Simons attempts a Dunk. Wide open! Joel Murray is 6.2 feet away. [MAN] AUSTIN SIMONS MAKES IT! Assist: Draymond Harris
Score: 81-69

[05:24] Team_043 possession (Score: 81-69)
FOUL! Shooting foul on Wendell Poole. Jabari Holiday to the line for 3 free throws. [Team fouls: 2] (Wendell Poole: 1 personal fouls)   FT 1/3: GOOD   FT 2/3: GOOD   FT 3/3: GOOD Jabari Holiday makes 3/3 from the line.
Score: 81-72

[05:09] Team_007 possession (Score: 81-72)
OG Porzingis attempts a 3Pt. Heavily contested by Dirk Herro (1.8 feet, ZONE)! OG Porzingis misses. Offensive rebound by Austin Simons! Austin Simons's putback is no good. Rebound secured by Terry Randle.

[04:54] Team_043 possession (Score: 81-72)
Dirk Herro attempts a 3Pt. Contested by OG Porzingis (3.4 feet, ZONE). Dirk Herro misses. Rebound secured by Gary LaVine.

[04:39] Team_007 possession (Score: 81-72)
Wendell Poole drives and kicks out. Gary LaVine attempts a 3Pt. Heavily contested by Dirk Herro (1.8 feet, ZONE)! Gary LaVine misses. Offensive rebound by Austin Simons! Austin Simons puts it back in!
Score: 83-72

[04:28] Team_043 possession (Score: 83-72)
Jabari Holiday attempts a 3Pt. Heavily contested by OG Porzingis (1.9 feet, ZONE)! Jabari Holiday misses. Rebound secured by Draymond Harris.

[04:13] Team_007 possession (Score: 83-72)
Austin Simons attempts a Midrange. Wide open! Joel Murray is 8.0 feet away. [ZONE] Austin Simons misses. FOUL! Loose ball foul on Terry Randle during the rebound battle. [IN THE BONUS! 7 team fouls] Austin Simons to the line for 2 free throws. (Terry Randle: 3 personal fouls)   FT 1/2: GOOD   FT 2/2: MISS Austin Simons makes 1/2 from the line. Rebound secured by Dirk Herro.
Score: 84-72

[03:59] Team_043 possession (Score: 84-72)
FOUL! Holding foul on Draymond Harris. [Team fouls: 3] No free throws, side out. (Draymond Harris: 1 personal fouls)

[03:48] Team_043 possession (Score: 84-72)
FOUL! Holding foul on OG Porzingis. [Team fouls: 4] No free throws, side out. (OG Porzingis: 1 personal fouls)

[03:30] Team_043 possession (Score: 84-72)
Ben LaVine attempts a 3Pt. Contested by OG Porzingis (5.9 feet, MAN). Ben LaVine misses. Rebound secured by Gary LaVine.

[03:15] Team_007 possession (Score: 84-72)
Draymond Harris attempts a Layup. Contested by Terry Randle (3.8 feet, MAN). Draymond Harris misses. Rebound secured by Ben LaVine.

[02:56] Team_043 possession (Score: 84-72)
Jabari Holiday attempts a 3Pt. Wide open! Wendell Poole is 6.4 feet away. [MAN] Jabari Holiday misses. Rebound secured by Gary LaVine.

[02:40] Team_007 possession (Score: 84-72)
FOUL! Shooting foul on Terry Randle. Draymond Harris to the line for 3 free throws. [BONUS: 8 team fouls] (Terry Randle: 4 personal fouls)   FT 1/3: GOOD   FT 2/3: GOOD   FT 3/3: MISS Draymond Harris makes 2/3 from the line. Rebound secured by Dirk Herro.
Score: 86-72

[02:28] Team_043 possession (Score: 86-72)
FOUL! Shooting foul on Austin Simons. Terry Randle to the line for 2 free throws. [BONUS: 5 team fouls] (Austin Simons: 2 personal fouls)   FT 1/2: MISS   FT 2/2: GOOD Terry Randle makes 1/2 from the line.
Score: 86-73

[02:12] Team_007 possession (Score: 86-73)
FOUL! Holding foul on Jabari Holiday. [IN THE BONUS! 9 team fouls] Wendell Poole to the line for 2 free throws. (Jabari Holiday: 1 personal fouls)   FT 1/2: GOOD   FT 2/2: GOOD Wendell Poole makes 2/2 from the line.
Score: 88-73

[01:54] Team_043 possession (Score: 88-73)
Dirk Herro drives and kicks out. Jabari Holiday attempts a 3Pt. Wide open! Wendell Poole is 6.0 feet away. [MAN] Jabari Holiday misses. Offensive rebound by Dirk Herro! Dirk Herro puts it back in!
Score: 88-75

[01:40] Team_007 possession (Score: 88-75)
Wendell Poole attempts a 3Pt. Contested by Jabari Holiday (3.2 feet, MAN). Wendell Poole misses. Rebound secured by Ben LaVine.

[01:21] Team_043 possession (Score: 88-75)
Jabari Holiday attempts a 3Pt. Contested by OG Porzingis (5.7 feet, ZONE). Jabari Holiday misses. Rebound secured by Austin Simons.

[01:08] Team_007 possession (Score: 88-75)
Gary LaVine drives, Terry Randle stays with him. Gary LaVine attempts a Dunk. Wide open! Terry Randle is 7.1 feet away. [ZONE] Gary LaVine misses. Rebound secured by Terry Randle.

[00:52] Team_043 possession (Score: 88-75)
Ben LaVine attempts a Midrange. Contested by OG Porzingis (2.1 feet, MAN). BEN LAVINE MAKES IT!
Score: 88-77

[00:33] Team_007 possession (Score: 88-77)
Austin Simons makes the Midrange and draws the foul on Terry Randle! And-1! Austin Simons to the line for 1. [BONUS: 10 team fouls] (Terry Randle: 5 personal fouls)   FT 1/1: MISS Austin Simons makes 0/1 from the line. Rebound secured by Dirk Herro.
Score: 90-77

[00:23] Team_043 possession (Score: 90-77)
Dirk Herro attempts a 3Pt. Wide open! OG Porzingis is 6.6 feet away. [ZONE] Dirk Herro misses. Rebound secured by Gary LaVine.

[00:12] Team_007 possession (Score: 90-77)
Gary LaVine attempts a 3Pt. Contested by Dirk Herro (5.9 feet, ZONE). Gary LaVine misses. Rebound secured by Ben LaVine.

================================================================================
                              4TH QUARTER COMPLETE                              
================================================================================

4TH QUARTER SCORE: Team_007 30, Team_043 16

BOX SCORE:
================================================================================

Team_007
--------------------------------------------------------------------------------
Player                MIN  PTS  REB  AST  TO      FG   FG%      3P   3P%
--------------------------------------------------------------------------------
Austin Simons          17   10    5    0   0   4/7    57.1     0/0   0.0
OG Porzingis           17    8    0    0   0   4/5    80.0     0/0   0.0
Tobias Johnson         31    3    0    0   0   1/1   100.0     0/0   0.0
Carmelo Siakam         31    2    1    0   0   1/1   100.0     0/0   0.0
Wendell Poole          17    2    0    1   0   1/2    50.0     0/0   0.0
Jaren Dosunmu          31    0    0    0   0   0/1     0.0     0/0   0.0
John Quickley          31    0    2    0   0   0/0     0.0     0/0   0.0
Bones Siakam           31    0    1    0   0   0/0     0.0     0/0   0.0
Draymond Harris        17    0    4    1   0   0/2     0.0     0/0   0.0
Gary LaVine            17    0    4    1   0   0/2     0.0     0/0   0.0

TEAM: FG: 11/21 (52.4%), 3PT: 3/8 (37.5%), REB: 20 (6 off, 14 def), AST: 3, TO: 2
TEAM FOULS: 5 [Team_043 in BONUS]


Team_043
--------------------------------------------------------------------------------
Player                MIN  PTS  REB  AST  TO      FG   FG%      3P   3P%
--------------------------------------------------------------------------------
Ben LaVine             17    6    4    1   0   3/5    60.0     0/0   0.0
Dirk Herro             17    6    4    0   0   3/6    50.0     0/0   0.0
Jabari Holiday         17    3    0    1   0   1/5    20.0     0/0   0.0
Terry Randle           17    1    2    1   0   1/3    33.3     0/0   0.0
Dwyane Dosunmu         31    0    1    0   0   0/1     0.0     0/0   0.0
Magic Durant           31    0    0    0   0   0/1     0.0     0/0   0.0
Malcolm Murray         31    0    0    0   0   0/1     0.0     0/0   0.0

TEAM: FG: 8/22 (36.4%), 3PT: 1/10 (10.0%), REB: 8 (1 off, 7 def), AST: 3, TO: 0
TEAM FOULS: 10 [Team_007 in BONUS]

================================================================================

================================================================================
                               FULL GAME COMPLETE                               
================================================================================

FINAL SCORE: Team_007 90, Team_043 77

SCORING BY QUARTER:
--------------------------------------------------------------------------------
Team                     Q1     Q2     Q3     Q4    FINAL
--------------------------------------------------------------------------------
Team_007                 15     22     23     30       90
Team_043                 15     22     24     16       77
--------------------------------------------------------------------------------

FULL GAME BOX SCORE:
================================================================================

Team_007
--------------------------------------------------------------------------------
Player                MIN  PTS  REB  AST  TO      FG   FG%      3P   3P%      FT STL BLK
--------------------------------------------------------------------------------
Tobias Johnson         31    9    0    2   2   4/10   40.0   1/2    50.0   6/7     0   0
Jaren Dosunmu          31    4    0    1   2   6/12   50.0   0/4     0.0   0/0     0   0
Bones Siakam           31   17   11    1   2   6/14   42.9   4/9    44.4   5/5     0   0
John Quickley          31    2   13    1   2   1/3    33.3   0/0     0.0   0/0     0   2
Carmelo Siakam         31   17   13    2   2   4/10   40.0   0/1     0.0   1/1     0   0
Wendell Poole          17    4    0    1   0   2/3    66.7   0/1     0.0   2/2     0   0
OG Porzingis           17   11    0    1   0   5/8    62.5   0/1     0.0   3/6     0   0
Gary LaVine            17    4    7    2   0   2/4    50.0   0/1     0.0   2/2     0   0
Austin Simons          17   12    5    0   1   3/6    50.0   1/1   100.0   1/3     0   1
Draymond Harris        17    4    8    2   2   3/6    50.0   0/2     0.0   5/7     0   0

TEAM: FG: 37/77 (48.1%), 3PT: 6/22 (27.3%), REB: 62 (16 off, 46 def), AST: 13, TO: 13


Team_043
--------------------------------------------------------------------------------
Player                MIN  PTS  REB  AST  TO      FG   FG%      3P   3P%      FT STL BLK
--------------------------------------------------------------------------------
Malcolm Murray         31    5    0    1   1   2/7    28.6   1/5    20.0   0/0     2   0
Magic Durant           31    3    0    1   0   1/7    14.3   1/4    25.0   0/0     1   0
D'Angelo Iverson       31   16   13    2   0   7/16   43.8   2/7    28.6   4/4     0   0
Manu Carter            31   14   12    3   3   6/10   60.0   1/1   100.0   3/3     3   1
Dwyane Dosunmu         31    9   10    3   0   5/12   41.7   0/0     0.0   3/4     0   0
Jabari Holiday         17   10    0    2   0   4/11   36.4   1/4    25.0   5/8     0   0
Ben LaVine             17    6    6    1   1   4/6    66.7   1/3    33.3   0/0     1   0
Dirk Herro             17   10    5    1   0   4/7    57.1   0/3     0.0   0/0     0   0
Joel Murray            17    0    0    0   0   0/1     0.0   0/1     0.0   0/0     0   0
Terry Randle           17    3    4    2   0   2/4    50.0   0/0     0.0   1/2     1   0

TEAM: FG: 35/81 (43.2%), 3PT: 7/28 (25.0%), REB: 45 (10 off, 35 def), AST: 16, TO: 5

================================================================================
