================================================================================
                        FULL GAME - Team_056 vs Team_030                        
================================================================================

================================================================================
                       1ST QUARTER - Team_056 vs Team_030                       
================================================================================

[12:00] Team_056 possession (Score: 0-0)
Jrue Lillard drives and kicks out. Yao Poole attempts a Midrange. Contested by Tim Barrett (2.6 feet, ZONE). YAO POOLE MAKES IT! Assist: Magic Russell
Score: 2-0

[11:47] Team_030 possession (Score: 2-0)
Joel Anunoby throws a bad pass! Stolen by Tony Carter! TURNOVER! (live ball)

[11:33] Team_056 possession (Score: 2-0)
Jrue Lillard attempts a Midrange. Wide open! Jordan Nowitzki is 6.1 feet away. [MAN] Jrue Lillard misses. Rebound secured by Joel Anunoby.

[11:21] Team_030 possession (Score: 2-0)
Tyler Beal makes the Layup and draws the foul on Jrue Lillard! And-1! Tyler Beal to the line for 1. [Team fouls: 1] (Jrue Lillard: 1 personal fouls)   FT 1/1: MISS Tyler Beal makes 0/1 from the line. Rebound secured by Yao Poole.
Score: 2-2

[11:04] Team_056 possession (Score: 2-2)
Giannis Jokic attempts a 3Pt. Contested by Tyler Beal (4.5 feet, MAN). GIANNIS JOKIC MAKES IT! Assist: Magic Russell
Score: 5-2

[10:52] Team_030 possession (Score: 5-2)
Jaren Green drives and kicks out. Jaren Green attempts a Midrange. Wide open! Yao Poole is 7.1 feet away. [MAN] JAREN GREEN MAKES IT!
Score: 5-4

[10:36] Team_056 possession (Score: 5-4)
Yao Poole attempts a 3Pt. Contested by Tyler Beal (4.9 feet, ZONE). Yao Poole misses. Offensive rebound by Yao Poole! Yao Poole kicks it out.

[10:24] Team_056 possession (Score: 5-4)
Yao Poole drives, Jaren Green stays with him. Yao Poole attempts a Dunk. Contested by Jaren Green (4.9 feet, ZONE). Yao Poole misses. Rebound secured by Jaren Green.

[10:09] Team_030 possession (Score: 5-4)
Tim Barrett attempts a 3Pt. Contested by Magic Russell (4.9 feet, ZONE). TIM BARRETT MAKES IT! Assist: Jaren Green
Score: 5-7

[09:54] Team_056 possession (Score: 5-7)
Magic Russell attempts a Midrange. Wide open! Tim Barrett is 7.3 feet away. [MAN] Magic Russell misses. Rebound secured by Jordan Nowitzki.

[09:42] Team_030 possession (Score: 5-7)
Tyler Beal attempts a Midrange. Contested by Giannis Jokic (4.9 feet, MAN). TYLER BEAL MAKES IT! Assist: Jordan Nowitzki
Score: 5-9

[09:28] Team_056 possession (Score: 5-9)
FOUL! Shooting foul on Jaren Green. Jrue Lillard to the line for 2 free throws. [Team fouls: 1] (Jaren Green: 1 personal fouls)   FT 1/2: MISS   FT 2/2: GOOD Jrue Lillard makes 1/2 from the line.
Score: 6-9

[09:15] Team_030 possession (Score: 6-9)
Jordan Nowitzki drives, picks up Jrue Lillard. Help arrives from Giannis Jokic! Jordan Nowitzki attempts a Layup. Contested by Giannis Jokic (5.5 feet, ZONE). JORDAN NOWITZKI MAKES IT!
Score: 6-11

[08:59] Team_056 possession (Score: 6-11)
Jrue Lillard attempts a 3Pt. Contested by Tyler Beal (3.1 feet, ZONE). Jrue Lillard misses. Rebound secured by Jordan Nowitzki.

[08:45] Team_030 possession (Score: 6-11)
Joel Anunoby attempts a 3Pt. Contested by Giannis Jokic (3.4 feet, ZONE). Joel Anunoby misses. Rebound secured by Yao Poole.

[08:30] Team_056 possession (Score: 6-11)
Magic Russell attempts a Midrange. Contested by Tim Barrett (5.8 feet, ZONE). Magic Russell misses. Rebound secured by Jaren Green.

[08:20] Team_030 possession (Score: 6-11)
Jaren Green drives, Yao Poole stays with him. Jaren Green attempts a Dunk. Wide open! Yao Poole is 7.8 feet away. [MAN] JAREN GREEN MAKES IT! Assist: Joel Anunoby
Score: 6-13

[08:10] Team_056 possession (Score: 6-13)
Tony Carter throws a bad pass out of bounds! TURNOVER! (dead ball)

[07:56] Team_030 possession (Score: 6-13)
Tyler Beal attempts a Midrange. Wide open! Jrue Lillard is 6.9 feet away. [ZONE] Tyler Beal misses. Rebound secured by Jrue Lillard.

[07:46] Team_056 possession (Score: 6-13)
Jrue Lillard drives, Jaren Green stays with him. Jrue Lillard attempts a Layup. Contested by Jaren Green (4.1 feet, ZONE). Jrue Lillard misses. Offensive rebound by Yao Poole! Yao Poole kicks it out.

[07:32] Team_056 possession (Score: 6-13)
Jrue Lillard attempts a 3Pt. Contested by Tyler Beal (5.2 feet, ZONE). Jrue Lillard misses. Rebound secured by Jordan Nowitzki.

[07:15] Team_030 possession (Score: 6-13)
Jaren Green drives and kicks out. Joel Anunoby attempts a 3Pt. Contested by Jrue Lillard (4.7 feet, ZONE). Joel Anunoby misses. FOUL! Loose ball foul on Jrue Lillard during the rebound battle. [Team fouls: 2] No free throws, side out. (Jrue Lillard: 2 personal fouls)

[07:01] Team_030 possession (Score: 6-13)
Jaren Green drives, picks up Yao Poole. Help arrives from Giannis Jokic! Jaren Green attempts a Dunk. Wide open! Giannis Jokic is 8.7 feet away. [MAN] JAREN GREEN MAKES IT! Assist: Jordan Nowitzki
Score: 6-15

[06:46] Team_056 possession (Score: 6-15)
Yao Poole attempts a 3Pt. Wide open! Jaren Green is 7.8 feet away. [MAN] Yao Poole misses. FOUL! Loose ball foul on Jordan Nowitzki during the rebound battle. [Team fouls: 2] No free throws, side out. (Jordan Nowitzki: 1 personal fouls)

[06:30] Team_056 possession (Score: 6-15)
Giannis Jokic attempts a 3Pt. Contested by Tyler Beal (3.5 feet, ZONE). GIANNIS JOKIC MAKES IT! Assist: Yao Poole
Score: 9-15

[06:17] Team_030 possession (Score: 9-15)
Tyler Beal attempts a Layup. Contested by Giannis Jokic (4.1 feet, MAN). TYLER BEAL MAKES IT! Assist: Jaren Green
Score: 9-17

[06:02] Team_056 possession (Score: 9-17)
Jrue Lillard throws a bad pass out of bounds! TURNOVER! (dead ball)

[05:48] Team_030 possession (Score: 9-17)
FOUL! Shooting foul on Jrue Lillard. Tim Barrett to the line for 3 free throws. [Team fouls: 3] (Jrue Lillard: 3 personal fouls)   FT 1/3: GOOD   FT 2/3: GOOD   FT 3/3: GOOD Tim Barrett makes 3/3 from the line.
Score: 9-20

[05:32] Team_056 possession (Score: 9-20)
FOUL! Reach-in foul on Joel Anunoby during the drive. [Team fouls: 3] No free throws, side out. (Joel Anunoby: 1 personal fouls)

[05:18] Team_056 possession (Score: 9-20)
Yao Poole drives to the basket... FOUL! Offensive foul on Yao Poole! Jaren Green drew the charge! [Team fouls: 4] (Yao Poole: 1 personal fouls) TURNOVER! (dead ball)

[05:02] Team_030 possession (Score: 9-20)
Jaren Green drives and kicks out. Tyler Beal attempts a 3Pt. Wide open! Giannis Jokic is 6.5 feet away. [ZONE] Tyler Beal misses. Rebound secured by Yao Poole.

[04:51] Team_056 possession (Score: 9-20)
Yao Poole attempts a Midrange. Contested by Jaren Green (5.0 feet, MAN). Yao Poole misses. Rebound secured by Jaren Green.

[04:39] Team_030 possession (Score: 9-20)
Jordan Nowitzki attempts a Midrange. Contested by Giannis Jokic (4.8 feet, ZONE). Jordan Nowitzki misses. Offensive rebound by Joel Anunoby! Joel Anunoby kicks it out.

[04:28] Team_030 possession (Score: 9-20)
FOUL! Shooting foul on Giannis Jokic. Tyler Beal to the line for 3 free throws. [BONUS: 5 team fouls] (Giannis Jokic: 1 personal fouls)   FT 1/3: GOOD   FT 2/3: GOOD   FT 3/3: GOOD Tyler Beal makes 3/3 from the line.
Score: 9-23

[04:11] Team_056 possession (Score: 9-23)
FOUL! Reach-in foul on Jaren Green during the drive. [Team fouls: 4] No free throws, side out. (Jaren Green: 2 personal fouls)

[03:58] Team_056 possession (Score: 9-23)
Tony Carter attempts a 3Pt. Contested by Tyler Beal (4.3 feet, ZONE). Tony Carter misses. Rebound secured by Joel Anunoby.

[03:45] Team_030 possession (Score: 9-23)
Tyler Beal attempts a 3Pt. Heavily contested by Giannis Jokic (0.5 feet, ZONE)! Tyler Beal misses. Rebound secured by Tony Carter.

[03:31] Team_056 possession (Score: 9-23)
Giannis Jokic attempts a 3Pt. Contested by Tyler Beal (4.3 feet, ZONE). Giannis Jokic misses. Rebound secured by Joel Anunoby.

[03:19] Team_030 possession (Score: 9-23)
Tim Barrett attempts a 3Pt. Contested by Giannis Jokic (3.2 feet, ZONE). TIM BARRETT MAKES IT! Assist: Jaren Green
Score: 9-26

[03:07] Team_056 possession (Score: 9-26)
Yao Poole drives and kicks out. Tony Carter attempts a 3Pt. Contested by Joel Anunoby (4.3 feet, MAN). Tony Carter misses. Rebound secured by Jaren Green.

[02:54] Team_030 possession (Score: 9-26)
Tyler Beal drives, Giannis Jokic stays with him. Tyler Beal attempts a Layup. Wide open! Giannis Jokic is 7.3 feet away. [MAN] Tyler Beal misses. Rebound secured by Tony Carter.

[02:37] Team_056 possession (Score: 9-26)
Tony Carter drives to the basket... Tony Carter throws a bad pass out of bounds! TURNOVER! (dead ball)

[02:37] Substitution (Team_056): Giannis Jokic OUT → De'Aaron Murray IN (stamina_rule2)

[02:37] Substitution (Team_056): Magic Russell OUT → Damian Barrett IN (stamina_rule2)

[02:37] Substitution (Team_056): Tony Carter OUT → CJ Anthony IN (stamina_rule2)

[02:37] Substitution (Team_056): Jrue Lillard OUT → RJ Johnson IN (stamina_rule2)

[02:37] Substitution (Team_056): Yao Poole OUT → Derrick Bane IN (stamina_rule2)

[02:37] Substitution (Team_030): Tyler Beal OUT → RJ Carter IN (stamina_rule2)

[02:37] Substitution (Team_030): Tim Barrett OUT → Josh Smith IN (stamina_rule2)

[02:37] Substitution (Team_030): Jordan Nowitzki OUT → Damian Green IN (stamina_rule2)

[02:37] Substitution (Team_030): Jaren Green OUT → Franz Anunoby IN (stamina_rule2)

[02:21] Team_030 possession (Score: 9-26)
Joel Anunoby attempts a Layup. Heavily contested by CJ Anthony (0.6 feet, MAN)! JOEL ANUNOBY MAKES IT!
Score: 9-28

[02:02] Team_056 possession (Score: 9-28)
CJ Anthony attempts a Layup. BLOCKED BY JOEL ANUNOBY! Ball deflects out of bounds off CJ Anthony.

[01:47] Team_030 possession (Score: 9-28)
RJ Carter drives, picks up De'Aaron Murray. Help arrives from CJ Anthony! RJ Carter attempts a Dunk. Wide open! CJ Anthony is 6.1 feet away. [MAN] RJ CARTER MAKES IT! Assist: Joel Anunoby
Score: 9-30

[01:30] Team_056 possession (Score: 9-30)
Damian Barrett attempts a 3Pt. Contested by Josh Smith (3.1 feet, MAN). Damian Barrett misses. Rebound secured by Joel Anunoby.

[01:11] Team_030 possession (Score: 9-30)
Damian Green attempts a Midrange. Wide open! De'Aaron Murray is 6.4 feet away. [ZONE] Damian Green misses. Rebound secured by RJ Johnson.

[00:56] Team_056 possession (Score: 9-30)
FOUL! Reach-in foul on Franz Anunoby during the drive. [IN THE BONUS! 5 team fouls] Damian Barrett to the line for 2 free throws. (Franz Anunoby: 1 personal fouls)   FT 1/2: MISS   FT 2/2: MISS Damian Barrett makes 0/2 from the line. Offensive rebound by RJ Johnson! RJ Johnson kicks it out.

[00:37] Team_056 possession (Score: 9-30)
Derrick Bane drives, picks up Franz Anunoby. Help arrives from Josh Smith! Derrick Bane attempts a Dunk. Contested by Josh Smith (4.9 feet, MAN). DERRICK BANE MAKES IT! Assist: RJ Johnson
Score: 11-30

[00:23] Team_030 possession (Score: 11-30)
Joel Anunoby attempts a 3Pt. Heavily contested by De'Aaron Murray (2.0 feet, ZONE)! Joel Anunoby misses. Rebound secured by RJ Johnson.

[00:07] Team_056 possession (Score: 11-30)
FOUL! Shooting foul on Joel Anunoby. De'Aaron Murray to the line for 2 free throws. [BONUS: 6 team fouls] (Joel Anunoby: 2 personal fouls)   FT 1/2: MISS   FT 2/2: GOOD De'Aaron Murray makes 1/2 from the line.
Score: 12-30

================================================================================
                              1ST QUARTER COMPLETE                              
================================================================================

1ST QUARTER SCORE: Team_056 12, Team_030 30

BOX SCORE:
================================================================================

Team_056
--------------------------------------------------------------------------------
Player                MIN  PTS  REB  AST  TO      FG   FG%      3P   3P%
--------------------------------------------------------------------------------
Giannis Jokic          10    6    0    0   0   2/3    66.7     0/0   0.0
Yao Poole              10    2    5    1   0   1/4    25.0     0/0   0.0
Derrick Bane            2    2    0    0   0   1/1   100.0     0/0   0.0
Jrue Lillard           10    1    2    0   0   1/4    25.0     0/0   0.0
De'Aaron Murray         2    1    0    0   0   1/1   100.0     0/0   0.0
Magic Russell          10    0    0    2   0   0/2     0.0     0/0   0.0
Tony Carter            10    0    2    0   0   0/1     0.0     0/0   0.0
CJ Anthony              2    0    0    0   0   0/1     0.0     0/0   0.0
Damian Barrett          2    0    0    0   0   0/1     0.0     0/0   0.0
RJ Johnson              2    0    3    1   0   0/0     0.0     0/0   0.0

TEAM: FG: 6/18 (33.3%), 3PT: 2/7 (28.6%), REB: 12 (4 off, 8 def), AST: 4, TO: 4
TEAM FOULS: 5 [Team_030 in BONUS]


Team_030
--------------------------------------------------------------------------------
Player                MIN  PTS  REB  AST  TO      FG   FG%      3P   3P%
--------------------------------------------------------------------------------
Tim Barrett            10    9    0    0   0   3/3   100.0     0/0   0.0
Tyler Beal             10    7    0    0   0   3/7    42.9     0/0   0.0
Jaren Green            10    6    4    3   0   3/4    75.0     0/0   0.0
Joel Anunoby           12    2    6    2   0   1/3    33.3     0/0   0.0
Jordan Nowitzki        10    2    3    2   0   1/1   100.0     0/0   0.0
RJ Carter               2    2    0    0   0   1/1   100.0     0/0   0.0
Damian Green            2    0    0    0   0   0/1     0.0     0/0   0.0

TEAM: FG: 12/20 (60.0%), 3PT: 4/7 (57.1%), REB: 13 (2 off, 11 def), AST: 7, TO: 1
TEAM FOULS: 6 [Team_056 in BONUS]

================================================================================

================================================================================
                       2ND QUARTER - Team_056 vs Team_030                       
================================================================================

[12:00] Team_056 possession (Score: 12-30)
Giannis Jokic attempts a 3Pt. Contested by Tyler Beal (5.7 feet, ZONE). Giannis Jokic misses. Offensive rebound by Yao Poole! Yao Poole kicks it out.

[11:48] Team_056 possession (Score: 12-30)
FOUL! Holding foul on Jaren Green. [Team fouls: 1] No free throws, side out. (Jaren Green: 1 personal fouls)

[11:35] Team_056 possession (Score: 12-30)
Jrue Lillard throws a bad pass! Stolen by Jordan Nowitzki! TURNOVER! (live ball)

[11:25] Team_030 possession (Score: 12-30)
Joel Anunoby attempts a Layup. Contested by Jrue Lillard (3.2 feet, ZONE). JOEL ANUNOBY MAKES IT! Assist: Tyler Beal
Score: 12-32

[11:11] Team_056 possession (Score: 12-32)
Jrue Lillard attempts a 3Pt. Contested by Tyler Beal (3.5 feet, ZONE). Jrue Lillard misses. Rebound secured by Joel Anunoby.

[10:55] Team_030 possession (Score: 12-32)
FOUL! Reach-in foul on Magic Russell during the drive. [Team fouls: 1] No free throws, side out. (Magic Russell: 1 personal fouls)

[10:42] Team_030 possession (Score: 12-32)
Jordan Nowitzki attempts a Layup. Heavily contested by Jrue Lillard (1.7 feet, MAN)! JORDAN NOWITZKI MAKES IT!
Score: 12-34

[10:23] Team_056 possession (Score: 12-34)
Giannis Jokic attempts a 3Pt. Contested by Tyler Beal (4.7 feet, ZONE). Giannis Jokic misses. Rebound secured by Jaren Green.

[10:04] Team_030 possession (Score: 12-34)
Joel Anunoby drives to the basket... Joel Anunoby loses the ball! Stripped by Jrue Lillard! TURNOVER! (live ball)

[09:48] Team_056 possession (Score: 12-34)
Magic Russell makes the Layup and draws the foul on Joel Anunoby! And-1! Magic Russell to the line for 1. [Team fouls: 2] (Joel Anunoby: 1 personal fouls)   FT 1/1: GOOD Magic Russell makes 1/1 from the line.
Score: 15-34

[09:34] Team_030 possession (Score: 15-34)
FOUL! Holding foul on Tony Carter. [Team fouls: 2] No free throws, side out. (Tony Carter: 1 personal fouls)

[09:22] Team_030 possession (Score: 15-34)
Jordan Nowitzki drives, Jrue Lillard stays with him. Jordan Nowitzki attempts a Dunk. Wide open! Jrue Lillard is 6.7 feet away. [MAN] Jordan Nowitzki misses. Rebound secured by Jrue Lillard.

[09:05] Team_056 possession (Score: 15-34)
Giannis Jokic drives and kicks out. Magic Russell attempts a 3Pt. Contested by Tim Barrett (5.2 feet, MAN). Magic Russell misses. Offensive rebound by Yao Poole! Yao Poole kicks it out.

[08:53] Team_056 possession (Score: 15-34)
Giannis Jokic attempts a 3Pt. Contested by Tyler Beal (3.2 feet, MAN). Giannis Jokic misses. Rebound secured by Jordan Nowitzki.

[08:38] Team_030 possession (Score: 15-34)
Tim Barrett attempts a 3Pt. Contested by Magic Russell (4.2 feet, MAN). Tim Barrett misses. Rebound secured by Tony Carter.

[08:24] Team_056 possession (Score: 15-34)
Giannis Jokic throws a bad pass out of bounds! TURNOVER! (dead ball)

[08:24] Substitution (Team_056): Giannis Jokic OUT → De'Aaron Murray IN (stamina_rule2)

[08:24] Substitution (Team_056): Magic Russell OUT → Damian Barrett IN (stamina_rule2)

[08:24] Substitution (Team_056): Tony Carter OUT → CJ Anthony IN (stamina_rule2)

[08:24] Substitution (Team_056): Jrue Lillard OUT → RJ Johnson IN (stamina_rule2)

[08:24] Substitution (Team_056): Yao Poole OUT → Derrick Bane IN (stamina_rule2)

[08:24] Substitution (Team_030): Tyler Beal OUT → RJ Carter IN (stamina_rule2)

[08:24] Substitution (Team_030): Tim Barrett OUT → Josh Smith IN (stamina_rule2)

[08:24] Substitution (Team_030): Joel Anunoby OUT → Pau James IN (stamina_rule2)

[08:24] Substitution (Team_030): Jordan Nowitzki OUT → Damian Green IN (stamina_rule2)

[08:24] Substitution (Team_030): Jaren Green OUT → Franz Anunoby IN (stamina_rule2)

[08:09] Team_030 possession (Score: 15-34)
FOUL! Shooting foul on CJ Anthony. Josh Smith to the line for 2 free throws. [Team fouls: 3] (CJ Anthony: 1 personal fouls)   FT 1/2: MISS   FT 2/2: MISS Josh Smith makes 0/2 from the line. Rebound secured by Derrick Bane.

[07:53] Team_056 possession (Score: 15-34)
Damian Barrett attempts a 3Pt. Contested by RJ Carter (5.9 feet, ZONE). DAMIAN BARRETT MAKES IT!
Score: 18-34

[07:38] Team_030 possession (Score: 18-34)
RJ Carter loses control! Ball rolls out of bounds! TURNOVER! (dead ball)

[07:22] Team_056 possession (Score: 18-34)
Damian Barrett attempts a 3Pt. Contested by Josh Smith (5.2 feet, MAN). Damian Barrett misses. Offensive rebound by RJ Johnson! RJ Johnson kicks it out.

[07:08] Team_056 possession (Score: 18-34)
Derrick Bane attempts a Layup. Wide open! Franz Anunoby is 10.0 feet away. [MAN] Derrick Bane misses. Rebound secured by Pau James.

[06:54] Team_030 possession (Score: 18-34)
RJ Carter attempts a Layup. Contested by RJ Johnson (4.9 feet, ZONE). RJ CARTER MAKES IT!
Score: 18-36

[06:38] Team_056 possession (Score: 18-36)
De'Aaron Murray attempts a 3Pt. Wide open! RJ Carter is 9.3 feet away. [ZONE] De'Aaron Murray misses. Rebound secured by Damian Green.

[06:21] Team_030 possession (Score: 18-36)
RJ Carter makes the Dunk and draws the foul on De'Aaron Murray! And-1! RJ Carter to the line for 1. [Team fouls: 4] (De'Aaron Murray: 1 personal fouls)   FT 1/1: GOOD RJ Carter makes 1/1 from the line.
Score: 18-39

[06:03] Team_056 possession (Score: 18-39)
Derrick Bane attempts a Layup. BLOCKED BY FRANZ ANUNOBY! Ball goes out off Franz Anunoby. Derrick Bane's ball!

[05:45] Team_056 possession (Score: 18-39)
Derrick Bane attempts a Midrange. BLOCKED BY FRANZ ANUNOBY! Ball is loose! Offensive rebound by RJ Johnson! RJ Johnson kicks it out.

[05:27] Team_056 possession (Score: 18-39)
CJ Anthony attempts a 3Pt. Contested by Josh Smith (3.0 feet, ZONE). CJ ANTHONY MAKES IT! Assist: Derrick Bane
Score: 21-39

[05:11] Team_030 possession (Score: 21-39)
RJ Carter drives, RJ Johnson stays with him. RJ Carter attempts a Layup. Wide open! RJ Johnson is 6.7 feet away. [ZONE] RJ CARTER MAKES IT! Assist: Franz Anunoby
Score: 21-41

[04:57] Team_056 possession (Score: 21-41)
CJ Anthony attempts a Midrange. Contested by Pau James (5.9 feet, MAN). CJ Anthony misses. Rebound secured by Franz Anunoby.

[04:43] Team_030 possession (Score: 21-41)
Franz Anunoby drives, Derrick Bane stays with him. Franz Anunoby attempts a Dunk. Wide open! Derrick Bane is 6.3 feet away. [MAN] FRANZ ANUNOBY MAKES IT!
Score: 21-43

[04:29] Team_056 possession (Score: 21-43)
Derrick Bane drives, picks up Damian Green. Help arrives from Josh Smith! Derrick Bane attempts a Dunk. Contested by Josh Smith (5.3 feet, ZONE). DERRICK BANE MAKES IT!
Score: 23-43

[04:18] Team_030 possession (Score: 23-43)
Franz Anunoby attempts a Layup. Contested by RJ Johnson (4.8 feet, ZONE). FRANZ ANUNOBY MAKES IT! Assist: RJ Carter
Score: 23-45

[04:03] Team_056 possession (Score: 23-45)
RJ Johnson attempts a Midrange. Wide open! Damian Green is 8.0 feet away. [MAN] RJ JOHNSON MAKES IT! Assist: De'Aaron Murray
Score: 25-45

[03:48] Team_030 possession (Score: 25-45)
Franz Anunoby drives and kicks out. Pau James attempts a 3Pt. Contested by De'Aaron Murray (2.7 feet, ZONE). Pau James misses. Rebound secured by Derrick Bane.

[03:33] Team_056 possession (Score: 25-45)
RJ Johnson makes the Layup and draws the foul on Damian Green! And-1! RJ Johnson to the line for 1. [Team fouls: 3] (Damian Green: 1 personal fouls)   FT 1/1: MISS RJ Johnson makes 0/1 from the line. FOUL! Loose ball foul on Pau James during the free throw rebound! [Team fouls: 4] No free throws, side out. (Pau James: 1 personal fouls)
Score: 27-45

[03:19] Team_056 possession (Score: 27-45)
Damian Barrett attempts a 3Pt. Contested by RJ Carter (4.5 feet, ZONE). Damian Barrett misses. Rebound secured by Franz Anunoby.

[03:02] Team_030 possession (Score: 27-45)
Pau James attempts a 3Pt. Contested by De'Aaron Murray (5.4 feet, ZONE). PAU JAMES MAKES IT! Assist: Damian Green
Score: 27-48

[02:45] Team_056 possession (Score: 27-48)
FOUL! Holding foul on Franz Anunoby. [IN THE BONUS! 5 team fouls] Derrick Bane to the line for 2 free throws. (Franz Anunoby: 1 personal fouls)   FT 1/2: MISS   FT 2/2: GOOD Derrick Bane makes 1/2 from the line.
Score: 28-48

[02:28] Team_030 possession (Score: 28-48)
Pau James attempts a 3Pt. Contested by CJ Anthony (5.9 feet, MAN). PAU JAMES MAKES IT! Assist: RJ Carter
Score: 28-51

[02:10] Team_056 possession (Score: 28-51)
RJ Johnson attempts a 3Pt. Wide open! RJ Carter is 6.3 feet away. [ZONE] RJ Johnson misses. Offensive rebound by CJ Anthony! CJ Anthony kicks it out.

[02:01] Team_056 possession (Score: 28-51)
De'Aaron Murray attempts a 3Pt. Contested by RJ Carter (5.6 feet, MAN). De'Aaron Murray misses. FOUL! Loose ball foul on Franz Anunoby during the rebound battle. [IN THE BONUS! 6 team fouls] RJ Johnson to the line for 2 free throws. (Franz Anunoby: 2 personal fouls)   FT 1/2: GOOD   FT 2/2: GOOD RJ Johnson makes 2/2 from the line.
Score: 30-51

[01:46] Team_030 possession (Score: 30-51)
Damian Green attempts a 3Pt. Contested by De'Aaron Murray (5.4 feet, ZONE). Damian Green misses. Rebound secured by CJ Anthony.

[01:31] Team_056 possession (Score: 30-51)
CJ Anthony attempts a 3Pt. Contested by Pau James (4.6 feet, MAN). CJ Anthony misses. Offensive rebound by RJ Johnson! RJ Johnson kicks it out.

[01:16] Team_056 possession (Score: 30-51)
Derrick Bane drives to the basket... Derrick Bane commits a violation (traveling/carry)! TURNOVER! (dead ball)

[01:03] Team_030 possession (Score: 30-51)
RJ Carter drives, De'Aaron Murray stays with him. RJ Carter attempts a Layup. Wide open! De'Aaron Murray is 6.4 feet away. [MAN] RJ CARTER MAKES IT!
Score: 30-53

[00:45] Team_056 possession (Score: 30-53)
CJ Anthony attempts a Layup. Contested by Damian Green (4.0 feet, ZONE). CJ ANTHONY MAKES IT! Assist: De'Aaron Murray
Score: 32-53

[00:29] Team_030 possession (Score: 32-53)
Franz Anunoby drives to the basket... Franz Anunoby throws a bad pass! Stolen by RJ Johnson! TURNOVER! (live ball)

[00:20] Team_056 possession (Score: 32-53)
CJ Anthony drives to the basket... CJ Anthony throws a bad pass! Stolen by Pau James! TURNOVER! (live ball)

[00:04] Team_030 possession (Score: 32-53)
Pau James attempts a Midrange. Wide open! CJ Anthony is 8.3 feet away. [ZONE] PAU JAMES MAKES IT!
Score: 32-55

================================================================================
                              2ND QUARTER COMPLETE                              
================================================================================

2ND QUARTER SCORE: Team_056 20, Team_030 25

BOX SCORE:
================================================================================

Team_056
--------------------------------------------------------------------------------
Player                MIN  PTS  REB  AST  TO      FG   FG%      3P   3P%
--------------------------------------------------------------------------------
CJ Anthony             11    5    3    0   0   2/3    66.7     0/0   0.0
RJ Johnson             11    4    3    0   0   2/2   100.0     0/0   0.0
Magic Russell          13    3    0    0   0   1/1   100.0     0/0   0.0
Derrick Bane           11    3    2    1   0   2/3    66.7     0/0   0.0
Damian Barrett         11    3    0    0   0   1/2    50.0     0/0   0.0
Yao Poole              13    0    2    0   0   0/0     0.0     0/0   0.0
Jrue Lillard           13    0    1    0   0   0/1     0.0     0/0   0.0
Giannis Jokic          13    0    0    0   0   0/2     0.0     0/0   0.0
Tony Carter            13    0    1    0   0   0/0     0.0     0/0   0.0
De'Aaron Murray        11    0    0    2   0   0/1     0.0     0/0   0.0

TEAM: FG: 8/15 (53.3%), 3PT: 3/8 (37.5%), REB: 12 (7 off, 5 def), AST: 3, TO: 4
TEAM FOULS: 4


Team_030
--------------------------------------------------------------------------------
Player                MIN  PTS  REB  AST  TO      FG   FG%      3P   3P%
--------------------------------------------------------------------------------
RJ Carter              11    9    0    2   0   4/4   100.0     0/0   0.0
Pau James               8    8    1    0   0   3/3   100.0     0/0   0.0
Franz Anunoby          11    4    2    1   0   2/3    66.7     0/0   0.0
Joel Anunoby           16    2    1    0   0   1/1   100.0     0/0   0.0
Jordan Nowitzki        13    2    1    0   0   1/2    50.0     0/0   0.0
Tyler Beal             13    0    0    1   0   0/0     0.0     0/0   0.0
Jaren Green            13    0    1    0   0   0/0     0.0     0/0   0.0
Tim Barrett            13    0    0    0   0   0/1     0.0     0/0   0.0
Josh Smith             11    0    0    0   0   0/1     0.0     0/0   0.0
Damian Green           11    0    1    1   0   0/1     0.0     0/0   0.0

TEAM: FG: 11/16 (68.8%), 3PT: 2/4 (50.0%), REB: 7 (0 off, 7 def), AST: 5, TO: 3
TEAM FOULS: 6 [Team_056 in BONUS]

================================================================================

================================================================================
                       3RD QUARTER - Team_056 vs Team_030                       
================================================================================

[12:00] Team_056 possession (Score: 32-55)
Magic Russell attempts a 3Pt. Wide open! Tim Barrett is 6.2 feet away. [MAN] MAGIC RUSSELL MAKES IT! Assist: Tony Carter
Score: 35-55

[11:43] Team_030 possession (Score: 35-55)
Joel Anunoby drives to the basket... Joel Anunoby throws a bad pass! Stolen by Jrue Lillard! TURNOVER! (live ball)

[11:28] Team_056 possession (Score: 35-55)
Jrue Lillard attempts a Layup. BLOCKED BY JAREN GREEN! Ball is loose! Rebound secured by Jaren Green.

[11:16] Team_030 possession (Score: 35-55)
Jaren Green attempts a 3Pt. Wide open! Giannis Jokic is 8.0 feet away. [ZONE] JAREN GREEN MAKES IT! Assist: Joel Anunoby
Score: 35-58

[11:03] Team_056 possession (Score: 35-58)
Tony Carter loses the ball! Stripped by Joel Anunoby! TURNOVER! (live ball)

[10:51] Team_030 possession (Score: 35-58)
Joel Anunoby attempts a 3Pt. Contested by Giannis Jokic (3.2 feet, ZONE). Joel Anunoby misses. Offensive rebound by Jordan Nowitzki! Jordan Nowitzki puts it back in!
Score: 35-60

[10:38] Team_056 possession (Score: 35-60)
Magic Russell attempts a Midrange. Heavily contested by Jordan Nowitzki (1.8 feet, ZONE)! Magic Russell misses. Offensive rebound by Yao Poole! Yao Poole kicks it out.

[10:26] Team_056 possession (Score: 35-60)
Tony Carter attempts a Midrange. Wide open! Joel Anunoby is 6.5 feet away. [MAN] Tony Carter misses. Rebound secured by Joel Anunoby.

[10:11] Team_030 possession (Score: 35-60)
Jaren Green attempts a 3Pt. Contested by Giannis Jokic (4.7 feet, ZONE). Jaren Green misses. Offensive rebound by Jordan Nowitzki! Jordan Nowitzki puts it back in!
Score: 35-62

[09:57] Team_056 possession (Score: 35-62)
Yao Poole attempts a 3Pt. Contested by Tyler Beal (4.5 feet, ZONE). Yao Poole misses. Offensive rebound by Jrue Lillard! Jrue Lillard puts it back in!
Score: 37-62

[09:42] Team_030 possession (Score: 37-62)
Jaren Green attempts a Layup. Wide open! Jrue Lillard is 7.4 feet away. [ZONE] JAREN GREEN MAKES IT! Assist: Tyler Beal
Score: 37-64

[09:29] Team_056 possession (Score: 37-64)
Tony Carter attempts a 3Pt. Heavily contested by Joel Anunoby (0.5 feet, MAN)! TONY CARTER MAKES IT! Assist: Yao Poole
Score: 40-64

[09:18] Team_030 possession (Score: 40-64)
Tim Barrett makes the Dunk and draws the foul on Jrue Lillard! And-1! Tim Barrett to the line for 1. [Team fouls: 1] (Jrue Lillard: 1 personal fouls)   FT 1/1: GOOD Tim Barrett makes 1/1 from the line.
Score: 40-67

[09:05] Team_056 possession (Score: 40-67)
FOUL! Holding foul on Jaren Green. [Team fouls: 1] No free throws, side out. (Jaren Green: 1 personal fouls)

[08:51] Team_056 possession (Score: 40-67)
FOUL! Holding foul on Jaren Green. [Team fouls: 2] No free throws, side out. (Jaren Green: 2 personal fouls)

[08:38] Team_056 possession (Score: 40-67)
Giannis Jokic attempts a 3Pt. Contested by Tyler Beal (4.8 feet, MAN). Giannis Jokic misses. Offensive rebound by Jrue Lillard! Jrue Lillard's putback is no good. Offensive rebound by Yao Poole! Yao Poole kicks it out.

[08:25] Team_056 possession (Score: 40-67)
Tony Carter attempts a Midrange. Contested by Joel Anunoby (3.3 feet, ZONE). Tony Carter misses. Rebound secured by Jaren Green.

[08:07] Team_030 possession (Score: 40-67)
Jordan Nowitzki loses control! Ball rolls out of bounds! TURNOVER! (dead ball)

[07:51] Team_056 possession (Score: 40-67)
Jrue Lillard attempts a Layup. Wide open! Jaren Green is 6.3 feet away. [ZONE] Jrue Lillard misses. Rebound secured by Jaren Green.

[07:35] Team_030 possession (Score: 40-67)
Jordan Nowitzki attempts a 3Pt. Wide open! Giannis Jokic is 7.8 feet away. [ZONE] Jordan Nowitzki misses. Rebound secured by Tony Carter.

[07:19] Team_056 possession (Score: 40-67)
Yao Poole makes the Midrange and draws the foul on Jaren Green! And-1! Yao Poole to the line for 1. [Team fouls: 3] (Jaren Green: 3 personal fouls)   FT 1/1: GOOD Yao Poole makes 1/1 from the line.
Score: 43-67

[07:00] Team_030 possession (Score: 43-67)
Jaren Green throws a bad pass! Stolen by Yao Poole! TURNOVER! (live ball)

[06:49] Team_056 possession (Score: 43-67)
Yao Poole drives and kicks out. Magic Russell attempts a Midrange. Wide open! Tim Barrett is 6.5 feet away. [MAN] MAGIC RUSSELL MAKES IT! Assist: Giannis Jokic
Score: 45-67

[06:37] Team_030 possession (Score: 45-67)
Tim Barrett attempts a 3Pt. Wide open! Giannis Jokic is 8.7 feet away. [ZONE] TIM BARRETT MAKES IT!
Score: 45-70

[06:20] Team_056 possession (Score: 45-70)
Tony Carter attempts a 3Pt. Contested by Joel Anunoby (4.7 feet, MAN). Tony Carter misses. Rebound secured by Joel Anunoby.

[06:02] Team_030 possession (Score: 45-70)
Jaren Green attempts a 3Pt. Contested by Giannis Jokic (4.5 feet, ZONE). JAREN GREEN MAKES IT! Assist: Tim Barrett
Score: 45-73

[05:48] Team_056 possession (Score: 45-73)
Yao Poole throws a bad pass! Stolen by Jaren Green! TURNOVER! (live ball)

[05:37] Team_030 possession (Score: 45-73)
Tyler Beal attempts a 3Pt. Contested by Giannis Jokic (5.7 feet, ZONE). Tyler Beal misses. Rebound secured by Jrue Lillard.

[05:20] Team_056 possession (Score: 45-73)
Magic Russell throws a bad pass out of bounds! TURNOVER! (dead ball)

[05:03] Team_030 possession (Score: 45-73)
Jordan Nowitzki drives, Jrue Lillard stays with him. Jordan Nowitzki attempts a Layup. Contested by Jrue Lillard (5.7 feet, MAN). JORDAN NOWITZKI MAKES IT! Assist: Jaren Green
Score: 45-75

[04:46] Team_056 possession (Score: 45-75)
FOUL! Shooting foul on Jordan Nowitzki. Jrue Lillard to the line for 2 free throws. [Team fouls: 4] (Jordan Nowitzki: 1 personal fouls)   FT 1/2: GOOD   FT 2/2: GOOD Jrue Lillard makes 2/2 from the line.
Score: 47-75

[04:30] Team_030 possession (Score: 47-75)
Jaren Green drives, Jrue Lillard stays with him. Jaren Green attempts a Layup. Contested by Jrue Lillard (2.4 feet, ZONE). JAREN GREEN MAKES IT! Assist: Tyler Beal
Score: 47-77

[04:19] Team_056 possession (Score: 47-77)
Jrue Lillard loses the ball! Stripped by Jordan Nowitzki! TURNOVER! (live ball)

[04:02] Team_030 possession (Score: 47-77)
Jordan Nowitzki makes the Dunk and draws the foul on Jrue Lillard! And-1! Jordan Nowitzki to the line for 1. [Team fouls: 2] (Jrue Lillard: 2 personal fouls)   FT 1/1: GOOD Jordan Nowitzki makes 1/1 from the line.
Score: 47-80

[03:47] Team_056 possession (Score: 47-80)
Giannis Jokic attempts a 3Pt. Contested by Tyler Beal (5.5 feet, ZONE). GIANNIS JOKIC MAKES IT! Assist: Yao Poole
Score: 50-80

[03:31] Team_030 possession (Score: 50-80)
Jaren Green attempts a Layup. Contested by Jrue Lillard (5.1 feet, ZONE). JAREN GREEN MAKES IT!
Score: 50-82

[03:16] Team_056 possession (Score: 50-82)
Yao Poole throws a bad pass out of bounds! TURNOVER! (dead ball)

[03:16] Substitution (Team_056): Yao Poole OUT → Derrick Bane IN (stamina_rule2)

[02:56] Team_030 possession (Score: 50-82)
Jaren Green drives, Jrue Lillard stays with him. Jaren Green attempts a Layup. Wide open! Jrue Lillard is 6.6 feet away. [ZONE] JAREN GREEN MAKES IT!
Score: 50-84

[02:46] Team_056 possession (Score: 50-84)
Giannis Jokic attempts a 3Pt. Contested by Tyler Beal (4.3 feet, MAN). Giannis Jokic misses. FOUL! Loose ball foul on Joel Anunoby during the rebound battle. [IN THE BONUS! 5 team fouls] Derrick Bane to the line for 2 free throws. (Joel Anunoby: 1 personal fouls)   FT 1/2: GOOD   FT 2/2: MISS Derrick Bane makes 1/2 from the line. Rebound secured by Jordan Nowitzki.
Score: 51-84

[02:33] Team_030 possession (Score: 51-84)
FOUL! Offensive foul on Jaren Green! Derrick Bane drew the charge! [Team fouls: 6] (Jaren Green: 4 personal fouls) TURNOVER! (dead ball)

[02:19] Team_056 possession (Score: 51-84)
Derrick Bane drives and kicks out. Giannis Jokic attempts a Midrange. Wide open! Joel Anunoby is 6.8 feet away. [ZONE] Giannis Jokic misses. Rebound secured by Joel Anunoby.

[02:05] Team_030 possession (Score: 51-84)
Jordan Nowitzki makes the Midrange and draws the foul on Jrue Lillard! And-1! Jordan Nowitzki to the line for 1. [Team fouls: 3] (Jrue Lillard: 3 personal fouls)   FT 1/1: GOOD Jordan Nowitzki makes 1/1 from the line.
Score: 51-87

[01:51] Team_056 possession (Score: 51-87)
Derrick Bane throws a bad pass out of bounds! TURNOVER! (dead ball)

[01:51] Substitution (Team_056): Giannis Jokic OUT → De'Aaron Murray IN (stamina_rule2)

[01:51] Substitution (Team_056): Magic Russell OUT → Damian Barrett IN (stamina_rule2)

[01:51] Substitution (Team_056): Tony Carter OUT → CJ Anthony IN (stamina_rule2)

[01:51] Substitution (Team_056): Jrue Lillard OUT → RJ Johnson IN (stamina_rule2)

[01:51] Substitution (Team_030): Tyler Beal OUT → RJ Carter IN (stamina_rule2)

[01:51] Substitution (Team_030): Tim Barrett OUT → Josh Smith IN (stamina_rule2)

[01:51] Substitution (Team_030): Joel Anunoby OUT → Pau James IN (stamina_rule2)

[01:51] Substitution (Team_030): Jordan Nowitzki OUT → Damian Green IN (stamina_rule2)

[01:51] Substitution (Team_030): Jaren Green OUT → Franz Anunoby IN (stamina_rule2)

[01:36] Team_030 possession (Score: 51-87)
FOUL! Shooting foul on RJ Johnson. Damian Green to the line for 3 free throws. [Team fouls: 4] (RJ Johnson: 1 personal fouls)   FT 1/3: GOOD   FT 2/3: GOOD   FT 3/3: GOOD Damian Green makes 3/3 from the line.
Score: 51-90

[01:21] Team_056 possession (Score: 51-90)
FOUL! Reach-in foul on RJ Carter during the drive. [IN THE BONUS! 7 team fouls] De'Aaron Murray to the line for 2 free throws. (RJ Carter: 1 personal fouls)   FT 1/2: GOOD   FT 2/2: GOOD De'Aaron Murray makes 2/2 from the line.
Score: 53-90

[01:07] Team_030 possession (Score: 53-90)
FOUL! Reach-in foul on RJ Johnson during the drive. [IN THE BONUS! 5 team fouls] Franz Anunoby to the line for 2 free throws. (RJ Johnson: 2 personal fouls)   FT 1/2: GOOD   FT 2/2: GOOD Franz Anunoby makes 2/2 from the line.
Score: 53-92

[00:55] Team_056 possession (Score: 53-92)
De'Aaron Murray drives to the basket... De'Aaron Murray commits a violation (traveling/carry)! TURNOVER! (dead ball)

[00:37] Team_030 possession (Score: 53-92)
Franz Anunoby drives, RJ Johnson stays with him. Franz Anunoby attempts a Dunk. Contested by RJ Johnson (3.1 feet, ZONE). FRANZ ANUNOBY MAKES IT! Assist: Josh Smith
Score: 53-94

[00:23] Team_056 possession (Score: 53-94)
CJ Anthony makes the Layup and draws the foul on Josh Smith! And-1! CJ Anthony to the line for 1. [BONUS: 8 team fouls] (Josh Smith: 1 personal fouls)   FT 1/1: GOOD CJ Anthony makes 1/1 from the line.
Score: 56-94

[00:09] Team_030 possession (Score: 56-94)
Franz Anunoby attempts a Layup. Contested by Derrick Bane (4.6 feet, MAN). Franz Anunoby misses. Rebound secured by Derrick Bane.

================================================================================
                              3RD QUARTER COMPLETE                              
================================================================================

3RD QUARTER SCORE: Team_056 24, Team_030 39

BOX SCORE:
================================================================================

Team_056
--------------------------------------------------------------------------------
Player                MIN  PTS  REB  AST  TO      FG   FG%      3P   3P%
--------------------------------------------------------------------------------
Magic Russell          24    5    0    0   0   2/2   100.0     0/0   0.0
Jrue Lillard           24    4    2    0   0   2/4    50.0     0/0   0.0
Tony Carter            24    3    1    1   0   1/4    25.0     0/0   0.0
Yao Poole              23    3    2    2   0   1/1   100.0     0/0   0.0
Giannis Jokic          24    3    0    1   0   1/2    50.0     0/0   0.0
CJ Anthony             12    3    0    0   0   1/1   100.0     0/0   0.0
De'Aaron Murray        12    2    0    0   0   1/1   100.0     0/0   0.0
Derrick Bane           14    0    1    0   0   0/1     0.0     0/0   0.0

TEAM: FG: 9/16 (56.2%), 3PT: 4/6 (66.7%), REB: 7 (4 off, 3 def), AST: 4, TO: 7
TEAM FOULS: 5 [Team_030 in BONUS]


Team_030
--------------------------------------------------------------------------------
Player                MIN  PTS  REB  AST  TO      FG   FG%      3P   3P%
--------------------------------------------------------------------------------
Jaren Green            24   14    3    1   0   6/6   100.0     0/0   0.0
Jordan Nowitzki        24   12    3    0   0   5/6    83.3     0/0   0.0
Tim Barrett            24    6    0    1   0   2/2   100.0     0/0   0.0
Franz Anunoby          12    4    0    0   0   2/3    66.7     0/0   0.0
Damian Green           12    3    0    0   0   1/1   100.0     0/0   0.0
Joel Anunoby           26    0    3    1   0   0/0     0.0     0/0   0.0
Tyler Beal             24    0    0    2   0   0/1     0.0     0/0   0.0
Josh Smith             12    0    0    1   0   0/0     0.0     0/0   0.0

TEAM: FG: 16/19 (84.2%), 3PT: 6/8 (75.0%), REB: 8 (2 off, 6 def), AST: 6, TO: 4
TEAM FOULS: 8 [Team_056 in BONUS]

================================================================================

================================================================================
                       4TH QUARTER - Team_056 vs Team_030                       
================================================================================

[12:00] Substitution (Team_056): Giannis Jokic OUT (stamina: 76) → De'Aaron Murray IN (comeback_detected)

[12:00] Substitution (Team_030): Tyler Beal OUT (stamina: 78) → RJ Carter IN (comeback_detected)

[12:00] Team_056 possession (Score: 56-94)
Magic Russell attempts a 3Pt. Contested by Tim Barrett (2.4 feet, MAN). Magic Russell misses. Rebound secured by Jaren Green.

[11:43] Team_030 possession (Score: 56-94)
Tim Barrett makes the Layup and draws the foul on Magic Russell! And-1! Tim Barrett to the line for 1. [Team fouls: 1] (Magic Russell: 1 personal fouls)   FT 1/1: GOOD Tim Barrett makes 1/1 from the line.
Score: 56-97

[11:31] Team_056 possession (Score: 56-97)
Tony Carter drives, Jaren Green stays with him. Tony Carter attempts a Layup. Contested by Jaren Green (2.6 feet, ZONE). TONY CARTER MAKES IT! Assist: Yao Poole
Score: 58-97

[11:16] Team_030 possession (Score: 58-97)
Joel Anunoby drives, Jrue Lillard stays with him. Joel Anunoby attempts a Layup. Wide open! Jrue Lillard is 7.0 feet away. [ZONE] JOEL ANUNOBY MAKES IT! Assist: Jordan Nowitzki
Score: 58-99

[11:04] Team_056 possession (Score: 58-99)
Jrue Lillard attempts a 3Pt. Contested by Jordan Nowitzki (4.7 feet, ZONE). JRUE LILLARD MAKES IT! Assist: Tony Carter
Score: 61-99

[10:49] Team_030 possession (Score: 61-99)
Joel Anunoby drives and kicks out. RJ Carter makes the Midrange and draws the foul on De'Aaron Murray! And-1! RJ Carter to the line for 1. [Team fouls: 2] (De'Aaron Murray: 1 personal fouls)   FT 1/1: GOOD RJ Carter makes 1/1 from the line.
Score: 61-102

[10:37] Team_056 possession (Score: 61-102)
Tony Carter attempts a Midrange. Contested by Tim Barrett (5.4 feet, ZONE). Tony Carter misses. Rebound secured by Jordan Nowitzki.

[10:20] Team_030 possession (Score: 61-102)
RJ Carter attempts a 3Pt. Wide open! De'Aaron Murray is 6.5 feet away. [MAN] RJ Carter misses. Rebound secured by Tony Carter.

[10:08] Team_056 possession (Score: 61-102)
De'Aaron Murray loses the ball! Stripped by RJ Carter! TURNOVER! (live ball)

[09:58] Team_030 possession (Score: 61-102)
Jaren Green attempts a Layup. Wide open! Jrue Lillard is 6.3 feet away. [ZONE] JAREN GREEN MAKES IT!
Score: 61-104

[09:45] Team_056 possession (Score: 61-104)
Jrue Lillard attempts a 3Pt. Wide open! Jordan Nowitzki is 6.4 feet away. [MAN] Jrue Lillard misses. Rebound secured by Joel Anunoby.

[09:31] Team_030 possession (Score: 61-104)
Jordan Nowitzki drives to the basket... Jordan Nowitzki throws a bad pass! Stolen by Jrue Lillard! TURNOVER! (live ball)

[09:20] Team_056 possession (Score: 61-104)
Magic Russell attempts a 3Pt. Wide open! Tim Barrett is 6.0 feet away. [MAN] Magic Russell misses. Rebound secured by Jordan Nowitzki.

[09:07] Team_030 possession (Score: 61-104)
Joel Anunoby drives, picks up Tony Carter. Help arrives from De'Aaron Murray! Joel Anunoby attempts a Dunk. Wide open! De'Aaron Murray is 7.7 feet away. [MAN] JOEL ANUNOBY MAKES IT! Assist: Tim Barrett
Score: 61-106

[08:53] Team_056 possession (Score: 61-106)
Jrue Lillard attempts a 3Pt. Wide open! Tim Barrett is 7.5 feet away. [ZONE] Jrue Lillard misses. Offensive rebound by Yao Poole! Yao Poole kicks it out.

[08:37] Team_056 possession (Score: 61-106)
FOUL! Reach-in foul on Jaren Green during the drive. [Team fouls: 1] No free throws, side out. (Jaren Green: 1 personal fouls)

[08:22] Team_056 possession (Score: 61-106)
De'Aaron Murray attempts a 3Pt. Wide open! RJ Carter is 6.4 feet away. [MAN] DE'AARON MURRAY MAKES IT! Assist: Tony Carter
Score: 64-106

[08:09] Team_030 possession (Score: 64-106)
RJ Carter loses the ball! Stripped by De'Aaron Murray! TURNOVER! (live ball)

[07:55] Team_056 possession (Score: 64-106)
Jrue Lillard attempts a Midrange. BLOCKED BY JORDAN NOWITZKI! Ball deflects out of bounds off Jrue Lillard.

[07:41] Team_030 possession (Score: 64-106)
Joel Anunoby drives to the basket... FOUL! Offensive foul on Joel Anunoby! Tony Carter drew the charge! [Team fouls: 2] (Joel Anunoby: 1 personal fouls) TURNOVER! (dead ball)

[07:23] Team_056 possession (Score: 64-106)
Yao Poole drives to the basket... Yao Poole commits a violation (traveling/carry)! TURNOVER! (dead ball)

[07:23] Substitution (Team_056): Magic Russell OUT → Damian Barrett IN (stamina_rule2)

[07:23] Substitution (Team_056): Tony Carter OUT → CJ Anthony IN (stamina_rule2)

[07:23] Substitution (Team_056): Jrue Lillard OUT → RJ Johnson IN (stamina_rule2)

[07:23] Substitution (Team_056): Yao Poole OUT → Derrick Bane IN (stamina_rule2)

[07:23] Substitution (Team_030): Tim Barrett OUT → Josh Smith IN (stamina_rule2)

[07:23] Substitution (Team_030): Joel Anunoby OUT → Pau James IN (stamina_rule2)

[07:23] Substitution (Team_030): Jordan Nowitzki OUT → Damian Green IN (stamina_rule2)

[07:23] Substitution (Team_030): Jaren Green OUT → Franz Anunoby IN (stamina_rule2)

[07:09] Team_030 possession (Score: 64-106)
Damian Green attempts a 3Pt. Contested by De'Aaron Murray (4.2 feet, ZONE). Damian Green misses. Rebound secured by CJ Anthony.

[07:00] Team_056 possession (Score: 64-106)
De'Aaron Murray attempts a 3Pt. Wide open! RJ Carter is 7.7 feet away. [MAN] DE'AARON MURRAY MAKES IT! Assist: RJ Johnson
Score: 67-106

[06:45] Team_030 possession (Score: 67-106)
RJ Carter attempts a Layup. Wide open! De'Aaron Murray is 7.7 feet away. [MAN] RJ CARTER MAKES IT! Assist: Franz Anunoby
Score: 67-108

[06:30] Team_056 possession (Score: 67-108)
FOUL! Reach-in foul on Damian Green during the drive. [Team fouls: 3] No free throws, side out. (Damian Green: 1 personal fouls)

[06:20] Team_056 possession (Score: 67-108)
Derrick Bane attempts a Layup. BLOCKED BY DAMIAN GREEN! Ball deflects out of bounds off Derrick Bane.

[06:04] Team_030 possession (Score: 67-108)
Pau James attempts a 3Pt. Contested by De'Aaron Murray (4.4 feet, ZONE). PAU JAMES MAKES IT! Assist: Franz Anunoby
Score: 67-111

[05:49] Team_056 possession (Score: 67-111)
Damian Barrett attempts a 3Pt. Wide open! RJ Carter is 6.8 feet away. [ZONE] DAMIAN BARRETT MAKES IT! Assist: CJ Anthony
Score: 70-111

[05:39] Team_030 possession (Score: 70-111)
Pau James attempts a Midrange. Contested by CJ Anthony (2.9 feet, MAN). Pau James misses. Rebound secured by CJ Anthony.

[05:23] Team_056 possession (Score: 70-111)
CJ Anthony attempts a 3Pt. Contested by RJ Carter (4.4 feet, ZONE). CJ Anthony misses. Offensive rebound by CJ Anthony! CJ Anthony kicks it out.

[05:09] Team_056 possession (Score: 70-111)
RJ Johnson drives, picks up Damian Green. Help arrives from Josh Smith! RJ Johnson attempts a Dunk. Wide open! Josh Smith is 8.2 feet away. [ZONE] RJ JOHNSON MAKES IT! Assist: Derrick Bane
Score: 72-111

[04:53] Team_030 possession (Score: 72-111)
Damian Green attempts a Layup. Contested by Derrick Bane (5.2 feet, ZONE). Damian Green misses. Rebound secured by Derrick Bane.

[04:40] Team_056 possession (Score: 72-111)
CJ Anthony attempts a Layup. Wide open! Pau James is 6.4 feet away. [MAN] CJ ANTHONY MAKES IT!
Score: 74-111

[04:21] Team_030 possession (Score: 74-111)
Pau James attempts a 3Pt. Wide open! CJ Anthony is 6.2 feet away. [ZONE] PAU JAMES MAKES IT! Assist: RJ Carter
Score: 74-114

[04:08] Team_056 possession (Score: 74-114)
RJ Johnson loses control! Ball rolls out of bounds! TURNOVER! (dead ball)

[03:54] Team_030 possession (Score: 74-114)
Damian Green attempts a 3Pt. Wide open! CJ Anthony is 6.6 feet away. [ZONE] Damian Green misses. Rebound secured by RJ Johnson.

[03:39] Team_056 possession (Score: 74-114)
De'Aaron Murray attempts a 3Pt. Contested by RJ Carter (4.7 feet, MAN). DE'AARON MURRAY MAKES IT! Assist: RJ Johnson
Score: 77-114

[03:25] Team_030 possession (Score: 77-114)
FOUL! Shooting foul on CJ Anthony. Pau James to the line for 3 free throws. [Team fouls: 3] (CJ Anthony: 1 personal fouls)   FT 1/3: MISS   FT 2/3: GOOD   FT 3/3: GOOD Pau James makes 2/3 from the line.
Score: 77-116

[03:09] Team_056 possession (Score: 77-116)
RJ Johnson attempts a Midrange. Contested by Damian Green (3.4 feet, ZONE). RJ Johnson misses. Rebound secured by Damian Green.

[02:52] Team_030 possession (Score: 77-116)
Pau James attempts a Midrange. Contested by CJ Anthony (2.9 feet, MAN). PAU JAMES MAKES IT!
Score: 77-118

[02:39] Team_056 possession (Score: 77-118)
FOUL! Holding foul on Josh Smith. [Team fouls: 4] No free throws, side out. (Josh Smith: 1 personal fouls)

[02:26] Team_056 possession (Score: 77-118)
Damian Barrett attempts a Layup. Heavily contested by Josh Smith (0.5 feet, MAN)! Damian Barrett misses. Offensive rebound by RJ Johnson! RJ Johnson kicks it out.

[02:10] Team_056 possession (Score: 77-118)
CJ Anthony attempts a 3Pt. Heavily contested by Pau James (1.4 feet, MAN)! CJ Anthony misses. Rebound secured by Damian Green.

[01:56] Team_030 possession (Score: 77-118)
Josh Smith attempts a 3Pt. Contested by CJ Anthony (5.8 feet, ZONE). Josh Smith misses. Offensive rebound by Damian Green! Damian Green kicks it out.

[01:40] Team_030 possession (Score: 77-118)
FOUL! Reach-in foul on RJ Johnson during the drive. [Team fouls: 4] No free throws, side out. (RJ Johnson: 1 personal fouls)

[01:22] Team_030 possession (Score: 77-118)
FOUL! Holding foul on RJ Johnson. [IN THE BONUS! 5 team fouls] Damian Green to the line for 2 free throws. (RJ Johnson: 2 personal fouls)   FT 1/2: GOOD   FT 2/2: GOOD Damian Green makes 2/2 from the line.
Score: 77-120

[01:08] Team_056 possession (Score: 77-120)
RJ Johnson makes the Layup and draws the foul on Damian Green! And-1! RJ Johnson to the line for 1. [BONUS: 5 team fouls] (Damian Green: 2 personal fouls)   FT 1/1: GOOD RJ Johnson makes 1/1 from the line.
Score: 80-120

[00:54] Team_030 possession (Score: 80-120)
Franz Anunoby drives, picks up Derrick Bane. Help arrives from Damian Barrett! Franz Anunoby attempts a Dunk. Contested by Damian Barrett (5.4 feet, MAN). Franz Anunoby misses. Rebound secured by RJ Johnson.

[00:41] Team_056 possession (Score: 80-120)
RJ Johnson attempts a Midrange. Contested by Damian Green (3.5 feet, MAN). RJ Johnson misses. Rebound secured by Damian Green.

[00:26] Team_030 possession (Score: 80-120)
Damian Green attempts a 3Pt. Heavily contested by CJ Anthony (1.5 feet, ZONE)! Damian Green misses. Rebound secured by RJ Johnson.

[00:13] Team_056 possession (Score: 80-120)
Derrick Bane attempts a Layup. Contested by Franz Anunoby (3.8 feet, MAN). DERRICK BANE MAKES IT! Assist: De'Aaron Murray
Score: 82-120

================================================================================
                              4TH QUARTER COMPLETE                              
================================================================================

4TH QUARTER SCORE: Team_056 26, Team_030 26

BOX SCORE:
================================================================================

Team_056
--------------------------------------------------------------------------------
Player                MIN  PTS  REB  AST  TO      FG   FG%      3P   3P%
--------------------------------------------------------------------------------
De'Aaron Murray        24    9    0    1   0   3/3   100.0     0/0   0.0
RJ Johnson             20    5    4    2   0   2/4    50.0     0/0   0.0
Jrue Lillard           29    3    0    0   0   1/3    33.3     0/0   0.0
Damian Barrett         20    3    0    0   0   1/1   100.0     0/0   0.0
Tony Carter            29    2    1    2   0   1/2    50.0     0/0   0.0
CJ Anthony             20    2    3    1   0   1/2    50.0     0/0   0.0
Derrick Bane           21    2    1    1   0   1/2    50.0     0/0   0.0
Magic Russell          29    0    0    0   0   0/2     0.0     0/0   0.0
Yao Poole              27    0    1    1   0   0/0     0.0     0/0   0.0

TEAM: FG: 10/19 (52.6%), 3PT: 5/9 (55.6%), REB: 10 (3 off, 7 def), AST: 8, TO: 3
TEAM FOULS: 5 [Team_030 in BONUS]


Team_030
--------------------------------------------------------------------------------
Player                MIN  PTS  REB  AST  TO      FG   FG%      3P   3P%
--------------------------------------------------------------------------------
Pau James              17   10    0    0   0   4/5    80.0     0/0   0.0
RJ Carter              24    5    0    1   0   2/3    66.7     0/0   0.0
Joel Anunoby           31    4    1    0   0   2/2   100.0     0/0   0.0
Tim Barrett            29    3    0    1   0   1/1   100.0     0/0   0.0
Jaren Green            29    2    1    0   0   1/1   100.0     0/0   0.0
Damian Green           20    2    4    0   0   1/5    20.0     0/0   0.0
Jordan Nowitzki        29    0    2    1   0   0/0     0.0     0/0   0.0
Franz Anunoby          20    0    0    2   0   0/1     0.0     0/0   0.0

TEAM: FG: 11/18 (61.1%), 3PT: 3/7 (42.9%), REB: 8 (1 off, 7 def), AST: 5, TO: 3
TEAM FOULS: 5 [Team_056 in BONUS]

================================================================================

================================================================================
                               FULL GAME COMPLETE                               
================================================================================

FINAL SCORE: Team_056 82, Team_030 120

SCORING BY QUARTER:
--------------------------------------------------------------------------------
Team                     Q1     Q2     Q3     Q4    FINAL
--------------------------------------------------------------------------------
Team_056                 12     20     24     26       82
Team_030                 30     25     39     26      120
--------------------------------------------------------------------------------

FULL GAME BOX SCORE:
================================================================================

Team_056
--------------------------------------------------------------------------------
Player                MIN  PTS  REB  AST  TO      FG   FG%      3P   3P%      FT STL BLK
--------------------------------------------------------------------------------
Magic Russell          29    8    0    2   2   2/6    33.3   1/3    33.3   1/1     0   0
Tony Carter            29    5    5    3   2   2/7    28.6   1/3    33.3   0/0     1   0
Jrue Lillard           29    8    5    0   3   4/12   33.3   1/5    20.0   3/4     3   0
Yao Poole              27    5   10    4   4   3/6    50.0   1/1   100.0   1/1     1   0
De'Aaron Murray        24   12    0    3   2   6/7    85.7   4/5    80.0   3/4     1   0
Giannis Jokic          24    9    0    1   1   3/7    42.9   3/7    42.9   0/0     0   0
Derrick Bane           21    7    4    2   1   3/6    50.0   0/0     0.0   2/4     0   0
Damian Barrett         20    6    0    0   0   2/4    50.0   2/4    50.0   0/2     0   0
CJ Anthony             20   10    6    1   1   4/7    57.1   1/2    50.0   1/1     0   0
RJ Johnson             20    9   10    3   2   3/5    60.0   0/0     0.0   3/4     1   0

TEAM: FG: 33/68 (48.5%), 3PT: 14/30 (46.7%), REB: 41 (18 off, 23 def), AST: 19, TO: 18


Team_030
--------------------------------------------------------------------------------
Player                MIN  PTS  REB  AST  TO      FG   FG%      3P   3P%      FT STL BLK
--------------------------------------------------------------------------------
Joel Anunoby           31    8   11    3   2   6/8    75.0   1/3    33.3   0/0     1   1
Tim Barrett            29   18    0    2   0   6/7    85.7   4/5    80.0   5/5     0   0
Jordan Nowitzki        29   16    9    3   3   5/7    71.4   0/1     0.0   2/2     2   1
Jaren Green            29   22    9    4   3  11/12   91.7   3/3   100.0   0/0     1   1
RJ Carter              24   16    0    3   2   6/7    85.7   0/1     0.0   2/2     1   0
Tyler Beal             24    7    0    3   0   3/8    37.5   1/3    33.3   3/4     0   0
Josh Smith             20    0    0    1   0   0/1     0.0   0/0     0.0   0/2     0   0
Damian Green           20    5    5    1   1   1/7    14.3   1/5    20.0   5/5     0   1
Franz Anunoby          20    8    2    3   0   4/7    57.1   0/0     0.0   2/2     0   2
Pau James              17   18    1    0   0   7/8    87.5   5/5   100.0   2/3     1   0

TEAM: FG: 50/73 (68.5%), 3PT: 15/26 (57.7%), REB: 36 (5 off, 31 def), AST: 23, TO: 11

================================================================================
