================================================================================
                        FULL GAME - Team_016 vs Team_028                        
================================================================================

================================================================================
                       1ST QUARTER - Team_016 vs Team_028                       
================================================================================

[12:00] Team_016 possession (Score: 0-0)
Giannis Ginobili drives, Kawhi Ball stays with him. Giannis Ginobili attempts a Layup. Wide open! Kawhi Ball is 6.9 feet away. [ZONE] GIANNIS GINOBILI MAKES IT! Assist: Ben Barrett
Score: 2-0

[11:42] Team_028 possession (Score: 2-0)
Carmelo Carter drives, picks up Vince Duncan. Help arrives from Collin Barnes! Carmelo Carter attempts a Dunk. Contested by Collin Barnes (2.2 feet, ZONE). CARMELO CARTER MAKES IT! Assist: Jimmy Brogdon
Score: 2-2

[11:32] Team_016 possession (Score: 2-2)
Collin Barnes makes the 3Pt and draws the foul on Austin Russell! And-1! Collin Barnes to the line for 1. [Team fouls: 1] (Austin Russell: 1 personal fouls)   FT 1/1: GOOD Collin Barnes makes 1/1 from the line.
Score: 6-2

[11:20] Team_028 possession (Score: 6-2)
FOUL! Holding foul on Collin Barnes. [Team fouls: 1] No free throws, side out. (Collin Barnes: 1 personal fouls)

[11:03] Team_028 possession (Score: 6-2)
Myles Haliburton attempts a 3Pt. Contested by Vince Quickley (2.4 feet, MAN). Myles Haliburton misses. Rebound secured by Vince Duncan.

[10:48] Team_016 possession (Score: 6-2)
Ben Barrett attempts a Midrange. Contested by Kawhi Ball (5.3 feet, ZONE). Ben Barrett misses. Offensive rebound by Vince Duncan! Vince Duncan puts it back in!
Score: 8-2

[10:29] Team_028 possession (Score: 8-2)
Carmelo Carter attempts a 3Pt. Wide open! Giannis Ginobili is 8.8 feet away. [MAN] Carmelo Carter misses. Rebound secured by Vince Quickley.

[10:15] Team_016 possession (Score: 8-2)
Collin Barnes drives and kicks out. Collin Barnes attempts a Midrange. Contested by Kawhi Ball (3.8 feet, ZONE). COLLIN BARNES MAKES IT!
Score: 10-2

[10:04] Team_028 possession (Score: 10-2)
FOUL! Offensive foul on Jimmy Brogdon! Vince Duncan drew the charge! [Team fouls: 2] (Jimmy Brogdon: 1 personal fouls) TURNOVER! (dead ball)

[09:49] Team_016 possession (Score: 10-2)
Ben Barrett attempts a 3Pt. Wide open! Kawhi Ball is 6.3 feet away. [MAN] Ben Barrett misses. Rebound secured by Jimmy Brogdon.

[09:32] Team_028 possession (Score: 10-2)
Carmelo Carter attempts a Midrange. Contested by Ben Barrett (3.1 feet, ZONE). Carmelo Carter misses. Rebound secured by Vince Quickley.

[09:19] Team_016 possession (Score: 10-2)
Vince Duncan attempts a Layup. Contested by Kawhi Ball (2.7 feet, ZONE). VINCE DUNCAN MAKES IT! Assist: Collin Barnes
Score: 12-2

[09:03] Team_028 possession (Score: 12-2)
Carmelo Carter attempts a 3Pt. Contested by Collin Barnes (3.8 feet, ZONE). Carmelo Carter misses. Rebound secured by Vince Quickley.

[08:47] Team_016 possession (Score: 12-2)
FOUL! Shooting foul on Myles Haliburton. Vince Quickley to the line for 2 free throws. [Team fouls: 3] (Myles Haliburton: 1 personal fouls)   FT 1/2: GOOD   FT 2/2: MISS Vince Quickley makes 1/2 from the line. Rebound secured by Kawhi Ball.
Score: 13-2

[08:30] Team_028 possession (Score: 13-2)
Myles Haliburton attempts a 3Pt. Contested by Collin Barnes (3.6 feet, ZONE). MYLES HALIBURTON MAKES IT! Assist: Kawhi Ball
Score: 13-5

[08:16] Team_016 possession (Score: 13-5)
Vince Quickley attempts a 3Pt. Contested by Carmelo Carter (4.6 feet, ZONE). Vince Quickley misses. Rebound secured by Carmelo Carter.

[08:01] Team_028 possession (Score: 13-5)
Carmelo Carter attempts a Layup. Wide open! Giannis Ginobili is 9.4 feet away. [MAN] CARMELO CARTER MAKES IT! Assist: Jimmy Brogdon
Score: 13-7

[07:47] Team_016 possession (Score: 13-7)
Collin Barnes attempts a 3Pt. Contested by Austin Russell (5.2 feet, MAN). COLLIN BARNES MAKES IT! Assist: Vince Quickley
Score: 16-7

[07:31] Team_028 possession (Score: 16-7)
Jimmy Brogdon makes the Layup and draws the foul on Collin Barnes! And-1! Jimmy Brogdon to the line for 1. [Team fouls: 2] (Collin Barnes: 2 personal fouls)   FT 1/1: GOOD Jimmy Brogdon makes 1/1 from the line.
Score: 16-10

[07:18] Team_016 possession (Score: 16-10)
Vince Duncan attempts a Layup. Contested by Kawhi Ball (5.7 feet, ZONE). Vince Duncan misses. Offensive rebound by Vince Duncan! Vince Duncan puts it back in!
Score: 18-10

[07:01] Team_028 possession (Score: 18-10)
FOUL! Shooting foul on Vince Quickley. Myles Haliburton to the line for 2 free throws. [Team fouls: 3] (Vince Quickley: 1 personal fouls)   FT 1/2: MISS   FT 2/2: GOOD Myles Haliburton makes 1/2 from the line.
Score: 18-11

[06:48] Team_016 possession (Score: 18-11)
FOUL! Holding foul on Myles Haliburton. [Team fouls: 4] No free throws, side out. (Myles Haliburton: 2 personal fouls)

[06:31] Team_016 possession (Score: 18-11)
Giannis Ginobili attempts a 3Pt. Wide open! Austin Russell is 6.1 feet away. [ZONE] GIANNIS GINOBILI MAKES IT! Assist: Ben Barrett
Score: 21-11

[06:13] Team_028 possession (Score: 21-11)
Jimmy Brogdon attempts a Layup. Contested by Vince Duncan (4.1 feet, ZONE). JIMMY BROGDON MAKES IT! Assist: Carmelo Carter
Score: 21-13

[05:58] Team_016 possession (Score: 21-13)
Giannis Ginobili attempts a Layup. Contested by Carmelo Carter (3.8 feet, MAN). GIANNIS GINOBILI MAKES IT! Assist: Vince Duncan
Score: 23-13

[05:45] Team_028 possession (Score: 23-13)
FOUL! Shooting foul on Ben Barrett. Kawhi Ball to the line for 3 free throws. [Team fouls: 4] (Ben Barrett: 1 personal fouls)   FT 1/3: GOOD   FT 2/3: GOOD   FT 3/3: GOOD Kawhi Ball makes 3/3 from the line.
Score: 23-16

[05:30] Team_016 possession (Score: 23-16)
Collin Barnes attempts a 3Pt. Contested by Austin Russell (3.3 feet, ZONE). COLLIN BARNES MAKES IT!
Score: 26-16

[05:19] Team_028 possession (Score: 26-16)
Myles Haliburton attempts a 3Pt. Contested by Collin Barnes (3.3 feet, ZONE). MYLES HALIBURTON MAKES IT! Assist: Kawhi Ball
Score: 26-19

[05:04] Team_016 possession (Score: 26-19)
Giannis Ginobili drives and kicks out. Vince Quickley attempts a 3Pt. Wide open! Austin Russell is 6.6 feet away. [ZONE] VINCE QUICKLEY MAKES IT! Assist: Collin Barnes
Score: 29-19

[04:52] Team_028 possession (Score: 29-19)
Myles Haliburton drives and kicks out. Kawhi Ball attempts a Midrange. Contested by Ben Barrett (2.2 feet, MAN). KAWHI BALL MAKES IT! Assist: Myles Haliburton
Score: 29-21

[04:43] Team_016 possession (Score: 29-21)
Collin Barnes attempts a 3Pt. Wide open! Austin Russell is 6.8 feet away. [ZONE] Collin Barnes misses. Rebound secured by Kawhi Ball.

[04:24] Team_028 possession (Score: 29-21)
Austin Russell attempts a 3Pt. Contested by Collin Barnes (3.2 feet, ZONE). Austin Russell misses. Offensive rebound by Kawhi Ball! Kawhi Ball kicks it out.

[04:09] Team_028 possession (Score: 29-21)
Jimmy Brogdon attempts a Midrange. Wide open! Collin Barnes is 6.8 feet away. [ZONE] Jimmy Brogdon misses. Rebound secured by Ben Barrett.

[03:53] Team_016 possession (Score: 29-21)
Vince Quickley attempts a Midrange. Contested by Myles Haliburton (2.7 feet, MAN). Vince Quickley misses. Rebound secured by Kawhi Ball.

[03:37] Team_028 possession (Score: 29-21)
Austin Russell attempts a Layup. Wide open! Collin Barnes is 6.4 feet away. [MAN] Austin Russell misses. Rebound secured by Ben Barrett.

[03:23] Team_016 possession (Score: 29-21)
Vince Quickley drives and kicks out. Vince Duncan attempts a Midrange. Contested by Jimmy Brogdon (2.0 feet, MAN). Vince Duncan misses. Rebound secured by Jimmy Brogdon.

[03:13] Team_028 possession (Score: 29-21)
FOUL! Holding foul on Collin Barnes. [IN THE BONUS! 5 team fouls] Austin Russell to the line for 2 free throws. (Collin Barnes: 3 personal fouls)   FT 1/2: GOOD   FT 2/2: GOOD Austin Russell makes 2/2 from the line.
Score: 29-23

[03:00] Team_016 possession (Score: 29-23)
Vince Duncan drives, Kawhi Ball stays with him. Vince Duncan attempts a Layup. Contested by Kawhi Ball (2.0 feet, ZONE). VINCE DUNCAN MAKES IT! Assist: Collin Barnes
Score: 31-23

[02:46] Team_028 possession (Score: 31-23)
Jimmy Brogdon attempts a 3Pt. Contested by Vince Duncan (3.6 feet, MAN). Jimmy Brogdon misses. Rebound secured by Ben Barrett.

[02:31] Team_016 possession (Score: 31-23)
FOUL! Holding foul on Carmelo Carter. [IN THE BONUS! 5 team fouls] Giannis Ginobili to the line for 2 free throws. (Carmelo Carter: 1 personal fouls)   FT 1/2: MISS   FT 2/2: GOOD Giannis Ginobili makes 1/2 from the line.
Score: 32-23

[02:22] Team_028 possession (Score: 32-23)
Carmelo Carter makes the Layup and draws the foul on Vince Quickley! And-1! Carmelo Carter to the line for 1. [BONUS: 6 team fouls] (Vince Quickley: 2 personal fouls)   FT 1/1: GOOD Carmelo Carter makes 1/1 from the line.
Score: 32-26

[02:06] Team_016 possession (Score: 32-26)
FOUL! Shooting foul on Carmelo Carter. Giannis Ginobili to the line for 2 free throws. [BONUS: 6 team fouls] (Carmelo Carter: 2 personal fouls)   FT 1/2: GOOD   FT 2/2: GOOD Giannis Ginobili makes 2/2 from the line.
Score: 34-26

[01:51] Team_028 possession (Score: 34-26)
Carmelo Carter attempts a 3Pt. Contested by Collin Barnes (3.8 feet, ZONE). Carmelo Carter misses. Rebound secured by Vince Duncan.

[01:38] Team_016 possession (Score: 34-26)
Vince Quickley attempts a 3Pt. Contested by Myles Haliburton (3.4 feet, MAN). Vince Quickley misses. Rebound secured by Jimmy Brogdon.

[01:22] Team_028 possession (Score: 34-26)
Carmelo Carter attempts a 3Pt. Wide open! Giannis Ginobili is 9.7 feet away. [MAN] Carmelo Carter misses. Rebound secured by Vince Quickley.

[01:05] Team_016 possession (Score: 34-26)
Vince Duncan attempts a Midrange. Contested by Myles Haliburton (4.4 feet, ZONE). Vince Duncan misses. Rebound secured by Jimmy Brogdon.

[00:48] Team_028 possession (Score: 34-26)
Myles Haliburton attempts a Layup. Contested by Ben Barrett (4.0 feet, ZONE). MYLES HALIBURTON MAKES IT!
Score: 34-28

[00:30] Team_016 possession (Score: 34-28)
Vince Duncan attempts a Layup. Wide open! Kawhi Ball is 7.9 feet away. [ZONE] VINCE DUNCAN MAKES IT! Assist: Vince Quickley
Score: 36-28

[00:16] Team_028 possession (Score: 36-28)
Carmelo Carter attempts a Midrange. Contested by Giannis Ginobili (5.3 feet, MAN). CARMELO CARTER MAKES IT!
Score: 36-30

[00:03] Team_016 possession (Score: 36-30)
Vince Duncan drives and kicks out. Vince Duncan attempts a 3Pt. Wide open! Jimmy Brogdon is 10.0 feet away. [MAN] Vince Duncan misses. Rebound secured by Jimmy Brogdon.

================================================================================
                              1ST QUARTER COMPLETE                              
================================================================================

1ST QUARTER SCORE: Team_016 36, Team_028 30

BOX SCORE:
================================================================================

Team_016
--------------------------------------------------------------------------------
Player                MIN  PTS  REB  AST  TO      FG   FG%      3P   3P%
--------------------------------------------------------------------------------
Collin Barnes          12   12    0    3   0   4/5    80.0     0/0   0.0
Giannis Ginobili       12   10    0    0   0   5/5   100.0     0/0   0.0
Vince Duncan           12   10    4    1   0   5/7    71.4     0/0   0.0
Vince Quickley         12    3    4    2   0   1/6    16.7     0/0   0.0
Ben Barrett            12    0    3    2   0   0/1     0.0     0/0   0.0

TEAM: FG: 15/24 (62.5%), 3PT: 4/8 (50.0%), REB: 11 (2 off, 9 def), AST: 8, TO: 0
TEAM FOULS: 6 [Team_028 in BONUS]


Team_028
--------------------------------------------------------------------------------
Player                MIN  PTS  REB  AST  TO      FG   FG%      3P   3P%
--------------------------------------------------------------------------------
Carmelo Carter         12    9    1    1   0   4/9    44.4     0/0   0.0
Myles Haliburton       12    9    0    1   0   4/5    80.0     0/0   0.0
Jimmy Brogdon          12    5    5    2   0   2/4    50.0     0/0   0.0
Kawhi Ball             12    5    4    2   0   2/2   100.0     0/0   0.0
Austin Russell         12    2    0    0   0   1/2    50.0     0/0   0.0

TEAM: FG: 13/22 (59.1%), 3PT: 3/9 (33.3%), REB: 10 (1 off, 9 def), AST: 6, TO: 1
TEAM FOULS: 6 [Team_016 in BONUS]

================================================================================

================================================================================
                       2ND QUARTER - Team_016 vs Team_028                       
================================================================================

[12:00] Team_016 possession (Score: 36-30)
Vince Quickley drives and kicks out. Vince Duncan attempts a 3Pt. Contested by Austin Russell (6.0 feet, ZONE). Vince Duncan misses. Rebound secured by Kawhi Ball.

[11:44] Team_028 possession (Score: 36-30)
Kawhi Ball attempts a Midrange. Heavily contested by Ben Barrett (1.6 feet, ZONE)! KAWHI BALL MAKES IT!
Score: 36-32

[11:34] Team_016 possession (Score: 36-32)
Vince Quickley loses control! Ball rolls out of bounds! TURNOVER! (dead ball)

[11:34] Substitution (Team_016): Collin Barnes OUT → Lamelo Herro IN (stamina_rule2)

[11:34] Substitution (Team_016): Giannis Ginobili OUT → Immanuel Nowitzki IN (stamina_rule2)

[11:34] Substitution (Team_016): Ben Barrett OUT → Giannis Doncic IN (stamina_rule2)

[11:34] Substitution (Team_016): Vince Duncan OUT → Trae Barnes IN (stamina_rule2)

[11:34] Substitution (Team_028): Austin Russell OUT → Scottie Ingram IN (stamina_rule2)

[11:34] Substitution (Team_028): Carmelo Carter OUT → Tyrese Quickley IN (stamina_rule2)

[11:34] Substitution (Team_028): Myles Haliburton OUT → Miles Booker IN (stamina_rule2)

[11:34] Substitution (Team_028): Kawhi Ball OUT → Bam Towns IN (stamina_rule2)

[11:34] Substitution (Team_028): Jimmy Brogdon OUT → Collin Bridges IN (stamina_rule2)

[11:17] Team_028 possession (Score: 36-32)
Miles Booker attempts a Midrange. Contested by Immanuel Nowitzki (2.1 feet, ZONE). MILES BOOKER MAKES IT! Assist: Collin Bridges
Score: 36-34

[11:01] Team_016 possession (Score: 36-34)
Lamelo Herro drives and kicks out. Giannis Doncic attempts a 3Pt. Contested by Collin Bridges (3.5 feet, MAN). Giannis Doncic misses. Rebound secured by Tyrese Quickley.

[10:51] Team_028 possession (Score: 36-34)
Bam Towns attempts a Midrange. Wide open! Immanuel Nowitzki is 8.0 feet away. [ZONE] Bam Towns misses. Rebound secured by Trae Barnes.

[10:35] Team_016 possession (Score: 36-34)
Trae Barnes drives, Collin Bridges stays with him. Trae Barnes attempts a Layup. Contested by Collin Bridges (4.5 feet, MAN). TRAE BARNES MAKES IT!
Score: 38-34

[10:19] Team_028 possession (Score: 38-34)
Collin Bridges drives, Trae Barnes stays with him. Collin Bridges attempts a Dunk. Wide open! Trae Barnes is 6.5 feet away. [MAN] COLLIN BRIDGES MAKES IT! Assist: Tyrese Quickley
Score: 38-36

[10:09] Team_016 possession (Score: 38-36)
Giannis Doncic drives, picks up Collin Bridges. Help arrives from Tyrese Quickley! Giannis Doncic attempts a Layup. Wide open! Tyrese Quickley is 6.8 feet away. [ZONE] GIANNIS DONCIC MAKES IT! Assist: Lamelo Herro
Score: 40-36

[09:55] Team_028 possession (Score: 40-36)
Collin Bridges drives, Trae Barnes stays with him. Collin Bridges attempts a Layup. Contested by Trae Barnes (4.9 feet, ZONE). COLLIN BRIDGES MAKES IT! Assist: Bam Towns
Score: 40-38

[09:42] Team_016 possession (Score: 40-38)
Immanuel Nowitzki attempts a Layup. BLOCKED BY COLLIN BRIDGES! Ball is loose! Rebound secured by Collin Bridges.

[09:24] Team_028 possession (Score: 40-38)
Bam Towns attempts a 3Pt. Contested by Lamelo Herro (4.0 feet, ZONE). Bam Towns misses. Rebound secured by Lamelo Herro.

[09:10] Team_016 possession (Score: 40-38)
Vince Quickley drives and kicks out. Giannis Doncic attempts a 3Pt. Contested by Collin Bridges (3.3 feet, MAN). GIANNIS DONCIC MAKES IT! Assist: Trae Barnes
Score: 43-38

[08:54] Team_028 possession (Score: 43-38)
Scottie Ingram attempts a 3Pt. Wide open! Vince Quickley is 7.9 feet away. [ZONE] SCOTTIE INGRAM MAKES IT! Assist: Collin Bridges
Score: 43-41

[08:38] Team_016 possession (Score: 43-41)
Giannis Doncic attempts a Layup. BLOCKED BY TYRESE QUICKLEY! Ball is loose! Rebound secured by Bam Towns.

[08:28] Team_028 possession (Score: 43-41)
Tyrese Quickley attempts a 3Pt. Contested by Immanuel Nowitzki (2.2 feet, MAN). TYRESE QUICKLEY MAKES IT!
Score: 43-44

[08:13] Team_016 possession (Score: 43-44)
Immanuel Nowitzki attempts a 3Pt. Wide open! Scottie Ingram is 8.3 feet away. [ZONE] IMMANUEL NOWITZKI MAKES IT! Assist: Giannis Doncic
Score: 46-44

[07:57] Team_028 possession (Score: 46-44)
Miles Booker drives, picks up Vince Quickley. Help arrives from Lamelo Herro! Miles Booker attempts a Layup. Contested by Lamelo Herro (4.2 feet, MAN). MILES BOOKER MAKES IT! Assist: Tyrese Quickley
Score: 46-46

[07:41] Team_016 possession (Score: 46-46)
Trae Barnes drives to the basket... FOUL! Offensive foul on Trae Barnes! Collin Bridges drew the charge! [Team fouls: 1] (Trae Barnes: 1 personal fouls) TURNOVER! (dead ball)

[07:31] Team_028 possession (Score: 46-46)
Collin Bridges commits a violation (traveling/carry)! TURNOVER! (dead ball)

[07:31] Substitution (Team_016): Vince Quickley OUT → Kevin Butler IN (stamina_rule2)

[07:17] Team_016 possession (Score: 46-46)
Immanuel Nowitzki attempts a Midrange. Contested by Bam Towns (5.9 feet, ZONE). Immanuel Nowitzki misses. Rebound secured by Tyrese Quickley.

[07:06] Team_028 possession (Score: 46-46)
FOUL! Reach-in foul on Lamelo Herro during the drive. [Team fouls: 2] No free throws, side out. (Lamelo Herro: 1 personal fouls)

[06:50] Team_028 possession (Score: 46-46)
Collin Bridges drives to the basket... Collin Bridges throws a bad pass! Stolen by Trae Barnes! TURNOVER! (live ball)

[06:37] Team_016 possession (Score: 46-46)
Immanuel Nowitzki attempts a Midrange. Wide open! Tyrese Quickley is 6.3 feet away. [MAN] Immanuel Nowitzki misses. Rebound secured by Bam Towns.

[06:22] Team_028 possession (Score: 46-46)
Collin Bridges drives, Giannis Doncic stays with him. Collin Bridges attempts a Layup. Contested by Giannis Doncic (3.7 feet, ZONE). COLLIN BRIDGES MAKES IT! Assist: Miles Booker
Score: 46-48

[06:06] Team_016 possession (Score: 46-48)
Trae Barnes attempts a 3Pt. Contested by Collin Bridges (4.9 feet, MAN). Trae Barnes misses. Offensive rebound by Giannis Doncic! Giannis Doncic kicks it out.

[05:49] Team_016 possession (Score: 46-48)
Immanuel Nowitzki drives to the basket... Immanuel Nowitzki loses the ball! Stripped by Tyrese Quickley! TURNOVER! (live ball)

[05:32] Team_028 possession (Score: 46-48)
Scottie Ingram attempts a Layup. Contested by Lamelo Herro (4.5 feet, MAN). Scottie Ingram misses. Rebound secured by Lamelo Herro.

[05:17] Team_016 possession (Score: 46-48)
FOUL! Holding foul on Collin Bridges. [Team fouls: 1] No free throws, side out. (Collin Bridges: 1 personal fouls)

[04:59] Team_016 possession (Score: 46-48)
Immanuel Nowitzki throws a bad pass! Stolen by Tyrese Quickley! TURNOVER! (live ball)

[04:42] Team_028 possession (Score: 46-48)
Scottie Ingram drives and kicks out. Collin Bridges attempts a 3Pt. Contested by Lamelo Herro (3.3 feet, ZONE). Collin Bridges misses. Offensive rebound by Bam Towns! Bam Towns kicks it out.

[04:31] Team_028 possession (Score: 46-48)
Miles Booker attempts a Midrange. Contested by Giannis Doncic (3.8 feet, ZONE). Miles Booker misses. Rebound secured by Trae Barnes.

[04:16] Team_016 possession (Score: 46-48)
Immanuel Nowitzki attempts a 3Pt. Contested by Tyrese Quickley (5.6 feet, MAN). Immanuel Nowitzki misses. FOUL! Loose ball foul on Bam Towns during the rebound battle. [Team fouls: 2] No free throws, side out. (Bam Towns: 1 personal fouls)

[04:01] Team_016 possession (Score: 46-48)
Kevin Butler attempts a Midrange. Heavily contested by Miles Booker (0.5 feet, MAN)! KEVIN BUTLER MAKES IT! Assist: Trae Barnes
Score: 48-48

[03:50] Team_028 possession (Score: 48-48)
Scottie Ingram attempts a 3Pt. Contested by Lamelo Herro (2.9 feet, MAN). SCOTTIE INGRAM MAKES IT! Assist: Miles Booker
Score: 48-51

[03:36] Team_016 possession (Score: 48-51)
Trae Barnes attempts a 3Pt. Wide open! Miles Booker is 7.0 feet away. [ZONE] TRAE BARNES MAKES IT!
Score: 51-51

[03:24] Team_028 possession (Score: 51-51)
FOUL! Shooting foul on Trae Barnes. Collin Bridges to the line for 2 free throws. [Team fouls: 3] (Trae Barnes: 2 personal fouls)   FT 1/2: MISS   FT 2/2: GOOD Collin Bridges makes 1/2 from the line.
Score: 51-52

[03:12] Team_016 possession (Score: 51-52)
Immanuel Nowitzki attempts a Layup. Contested by Tyrese Quickley (4.7 feet, MAN). Immanuel Nowitzki misses. Rebound secured by Collin Bridges.

[02:56] Team_028 possession (Score: 51-52)
Miles Booker commits a violation (traveling/carry)! TURNOVER! (dead ball)

[02:40] Team_016 possession (Score: 51-52)
Immanuel Nowitzki attempts a 3Pt. Heavily contested by Tyrese Quickley (0.5 feet, MAN)! Immanuel Nowitzki misses. Rebound secured by Tyrese Quickley.

[02:28] Team_028 possession (Score: 51-52)
Miles Booker drives to the basket... Miles Booker throws a bad pass out of bounds! TURNOVER! (dead ball)

[02:16] Team_016 possession (Score: 51-52)
Immanuel Nowitzki attempts a 3Pt. Wide open! Tyrese Quickley is 6.6 feet away. [MAN] IMMANUEL NOWITZKI MAKES IT! Assist: Lamelo Herro
Score: 54-52

[02:04] Team_028 possession (Score: 54-52)
Miles Booker attempts a 3Pt. Heavily contested by Kevin Butler (1.0 feet, MAN)! Miles Booker misses. Rebound secured by Giannis Doncic.

[01:46] Team_016 possession (Score: 54-52)
Kevin Butler drives, Bam Towns stays with him. Kevin Butler attempts a Layup. Contested by Bam Towns (3.8 feet, ZONE). KEVIN BUTLER MAKES IT!
Score: 56-52

[01:34] Team_028 possession (Score: 56-52)
Scottie Ingram attempts a 3Pt. Contested by Lamelo Herro (5.6 feet, MAN). Scottie Ingram misses. Rebound secured by Lamelo Herro.

[01:15] Team_016 possession (Score: 56-52)
Giannis Doncic attempts a Layup. Contested by Collin Bridges (3.2 feet, ZONE). Giannis Doncic misses. Rebound secured by Collin Bridges.

[01:05] Team_028 possession (Score: 56-52)
Scottie Ingram attempts a 3Pt. Contested by Kevin Butler (5.3 feet, ZONE). SCOTTIE INGRAM MAKES IT! Assist: Collin Bridges
Score: 56-55

[00:49] Team_016 possession (Score: 56-55)
Immanuel Nowitzki attempts a 3Pt. Wide open! Scottie Ingram is 6.5 feet away. [ZONE] Immanuel Nowitzki misses. Rebound secured by Collin Bridges.

[00:30] Team_028 possession (Score: 56-55)
Collin Bridges attempts a Layup. Contested by Giannis Doncic (5.8 feet, ZONE). Collin Bridges misses. Rebound secured by Kevin Butler.

[00:20] Team_016 possession (Score: 56-55)
Immanuel Nowitzki attempts a Midrange. Contested by Tyrese Quickley (3.4 feet, MAN). Immanuel Nowitzki misses. Rebound secured by Tyrese Quickley.

[00:04] Team_028 possession (Score: 56-55)
Bam Towns attempts a Midrange. BLOCKED BY GIANNIS DONCIC! Ball deflects out of bounds off Bam Towns.

================================================================================
                              2ND QUARTER COMPLETE                              
================================================================================

2ND QUARTER SCORE: Team_016 20, Team_028 25

BOX SCORE:
================================================================================

Team_016
--------------------------------------------------------------------------------
Player                MIN  PTS  REB  AST  TO      FG   FG%      3P   3P%
--------------------------------------------------------------------------------
Immanuel Nowitzki      11    6    0    0   0   2/9    22.2     0/0   0.0
Trae Barnes            11    5    2    2   0   2/2   100.0     0/0   0.0
Giannis Doncic         11    5    3    1   0   2/4    50.0     0/0   0.0
Kevin Butler            7    4    1    0   0   2/2   100.0     0/0   0.0
Vince Quickley         17    0    0    0   0   0/1     0.0     0/0   0.0
Lamelo Herro           11    0    3    2   0   0/1     0.0     0/0   0.0

TEAM: FG: 8/19 (42.1%), 3PT: 3/5 (60.0%), REB: 9 (2 off, 7 def), AST: 5, TO: 4
TEAM FOULS: 3


Team_028
--------------------------------------------------------------------------------
Player                MIN  PTS  REB  AST  TO      FG   FG%      3P   3P%
--------------------------------------------------------------------------------
Scottie Ingram         11    9    0    0   0   3/5    60.0     0/0   0.0
Collin Bridges         11    7    4    3   0   4/5    80.0     0/0   0.0
Miles Booker           11    4    0    2   0   2/4    50.0     0/0   0.0
Tyrese Quickley        11    3    4    2   0   1/1   100.0     0/0   0.0
Kawhi Ball             13    2    1    0   0   1/1   100.0     0/0   0.0
Bam Towns              11    0    3    1   0   0/3     0.0     0/0   0.0

TEAM: FG: 11/19 (57.9%), 3PT: 4/7 (57.1%), REB: 12 (1 off, 11 def), AST: 8, TO: 4
TEAM FOULS: 2

================================================================================

================================================================================
                       3RD QUARTER - Team_016 vs Team_028                       
================================================================================

[12:00] Team_016 possession (Score: 56-55)
FOUL! Reach-in foul on Kawhi Ball during the drive. [Team fouls: 1] No free throws, side out. (Kawhi Ball: 1 personal fouls)

[11:46] Team_016 possession (Score: 56-55)
Giannis Ginobili attempts a 3Pt. Contested by Carmelo Carter (4.3 feet, MAN). Giannis Ginobili misses. Rebound secured by Carmelo Carter.

[11:31] Team_028 possession (Score: 56-55)
Carmelo Carter drives, picks up Vince Duncan. Help arrives from Collin Barnes! Carmelo Carter attempts a Layup. Contested by Collin Barnes (3.9 feet, ZONE). CARMELO CARTER MAKES IT! Assist: Kawhi Ball
Score: 56-57

[11:14] Team_016 possession (Score: 56-57)
Ben Barrett attempts a Layup. Contested by Kawhi Ball (5.3 feet, MAN). BEN BARRETT MAKES IT! Assist: Collin Barnes
Score: 58-57

[11:00] Team_028 possession (Score: 58-57)
Austin Russell drives, picks up Collin Barnes. Help arrives from Vince Quickley! Austin Russell attempts a Layup. Contested by Vince Quickley (4.6 feet, MAN). Austin Russell misses. Rebound secured by Ben Barrett.

[10:44] Team_016 possession (Score: 58-57)
Collin Barnes attempts a 3Pt. Contested by Austin Russell (5.7 feet, ZONE). Collin Barnes misses. Rebound secured by Carmelo Carter.

[10:31] Team_028 possession (Score: 58-57)
Kawhi Ball attempts a Midrange. Wide open! Ben Barrett is 6.1 feet away. [MAN] KAWHI BALL MAKES IT! Assist: Myles Haliburton
Score: 58-59

[10:17] Team_016 possession (Score: 58-59)
Vince Duncan attempts a 3Pt. BLOCKED BY AUSTIN RUSSELL! Ball is loose! Rebound secured by Carmelo Carter.

[10:04] Team_028 possession (Score: 58-59)
Austin Russell attempts a 3Pt. Wide open! Collin Barnes is 7.4 feet away. [ZONE] Austin Russell misses. Rebound secured by Vince Duncan.

[09:51] Team_016 possession (Score: 58-59)
Collin Barnes attempts a 3Pt. Contested by Austin Russell (3.2 feet, ZONE). Collin Barnes misses. Rebound secured by Kawhi Ball.

[09:38] Team_028 possession (Score: 58-59)
Myles Haliburton drives and kicks out. Carmelo Carter attempts a 3Pt. Contested by Collin Barnes (3.5 feet, ZONE). CARMELO CARTER MAKES IT! Assist: Jimmy Brogdon
Score: 58-62

[09:26] Team_016 possession (Score: 58-62)
Collin Barnes attempts a 3Pt. Heavily contested by Austin Russell (1.3 feet, MAN)! COLLIN BARNES MAKES IT! Assist: Vince Quickley
Score: 61-62

[09:09] Team_028 possession (Score: 61-62)
Myles Haliburton drives and kicks out. Kawhi Ball attempts a Midrange. Contested by Ben Barrett (2.5 feet, MAN). Kawhi Ball misses. Offensive rebound by Jimmy Brogdon! Jimmy Brogdon kicks it out.

[08:59] Team_028 possession (Score: 61-62)
Jimmy Brogdon drives to the basket... Jimmy Brogdon commits a violation (traveling/carry)! TURNOVER! (dead ball)

[08:45] Team_016 possession (Score: 61-62)
Ben Barrett drives and kicks out. Giannis Ginobili attempts a 3Pt. Contested by Carmelo Carter (2.6 feet, MAN). Giannis Ginobili misses. Rebound secured by Jimmy Brogdon.

[08:31] Team_028 possession (Score: 61-62)
Jimmy Brogdon drives and kicks out. Austin Russell attempts a 3Pt. Contested by Collin Barnes (5.2 feet, MAN). Austin Russell misses. Offensive rebound by Jimmy Brogdon! Jimmy Brogdon kicks it out.

[08:20] Team_028 possession (Score: 61-62)
Myles Haliburton attempts a 3Pt. Contested by Collin Barnes (2.4 feet, ZONE). MYLES HALIBURTON MAKES IT! Assist: Austin Russell
Score: 61-65

[08:05] Team_016 possession (Score: 61-65)
Ben Barrett attempts a Layup. Contested by Kawhi Ball (5.9 feet, ZONE). BEN BARRETT MAKES IT! Assist: Vince Duncan
Score: 63-65

[07:46] Team_028 possession (Score: 63-65)
Carmelo Carter attempts a 3Pt. Contested by Collin Barnes (4.8 feet, ZONE). Carmelo Carter misses. Rebound secured by Ben Barrett.

[07:31] Team_016 possession (Score: 63-65)
Vince Duncan makes the Dunk and draws the foul on Jimmy Brogdon! And-1! Vince Duncan to the line for 1. [Team fouls: 2] (Jimmy Brogdon: 1 personal fouls)   FT 1/1: GOOD Vince Duncan makes 1/1 from the line.
Score: 66-65

[07:16] Team_028 possession (Score: 66-65)
Myles Haliburton attempts a 3Pt. Wide open! Collin Barnes is 6.9 feet away. [ZONE] MYLES HALIBURTON MAKES IT!
Score: 66-68

[06:58] Team_016 possession (Score: 66-68)
Collin Barnes loses the ball! Stripped by Austin Russell! TURNOVER! (live ball)

[06:43] Team_028 possession (Score: 66-68)
Austin Russell makes the Dunk and draws the foul on Collin Barnes! And-1! Austin Russell to the line for 1. [Team fouls: 1] (Collin Barnes: 1 personal fouls)   FT 1/1: GOOD Austin Russell makes 1/1 from the line.
Score: 66-71

[06:27] Team_016 possession (Score: 66-71)
Vince Duncan attempts a Layup. Contested by Kawhi Ball (2.1 feet, ZONE). VINCE DUNCAN MAKES IT! Assist: Vince Quickley
Score: 68-71

[06:13] Team_028 possession (Score: 68-71)
Myles Haliburton loses the ball! Stripped by Vince Quickley! TURNOVER! (live ball)

[05:59] Team_016 possession (Score: 68-71)
Vince Quickley makes the Layup and draws the foul on Kawhi Ball! And-1! Vince Quickley to the line for 1. [Team fouls: 3] (Kawhi Ball: 2 personal fouls)   FT 1/1: GOOD Vince Quickley makes 1/1 from the line.
Score: 71-71

[05:44] Team_028 possession (Score: 71-71)
Austin Russell attempts a 3Pt. Contested by Collin Barnes (3.1 feet, ZONE). Austin Russell misses. Rebound secured by Vince Duncan.

[05:33] Team_016 possession (Score: 71-71)
Vince Duncan drives to the basket... FOUL! Offensive foul on Vince Duncan! Jimmy Brogdon drew the charge! [Team fouls: 2] (Vince Duncan: 1 personal fouls) TURNOVER! (dead ball)

[05:16] Team_028 possession (Score: 71-71)
Jimmy Brogdon attempts a Midrange. Contested by Vince Duncan (2.6 feet, MAN). Jimmy Brogdon misses. Rebound secured by Vince Quickley.

[04:59] Team_016 possession (Score: 71-71)
Giannis Ginobili attempts a 3Pt. Contested by Austin Russell (5.4 feet, ZONE). Giannis Ginobili misses. Rebound secured by Carmelo Carter.

[04:44] Team_028 possession (Score: 71-71)
Myles Haliburton drives, picks up Vince Quickley. Help arrives from Collin Barnes! Myles Haliburton attempts a Dunk. Heavily contested by Collin Barnes (1.6 feet, MAN)! Myles Haliburton misses. Rebound secured by Ben Barrett.

[04:34] Team_016 possession (Score: 71-71)
Ben Barrett throws a bad pass! Stolen by Kawhi Ball! TURNOVER! (live ball)

[04:20] Team_028 possession (Score: 71-71)
Myles Haliburton attempts a 3Pt. Contested by Vince Quickley (4.3 feet, MAN). Myles Haliburton misses. Rebound secured by Ben Barrett.

[04:07] Team_016 possession (Score: 71-71)
Collin Barnes attempts a Midrange. Contested by Austin Russell (4.7 feet, MAN). Collin Barnes misses. FOUL! Loose ball foul on Carmelo Carter during the rebound battle. [Team fouls: 4] No free throws, side out. (Carmelo Carter: 1 personal fouls)

[03:52] Team_016 possession (Score: 71-71)
Ben Barrett attempts a Midrange. Heavily contested by Kawhi Ball (1.4 feet, MAN)! BEN BARRETT MAKES IT! Assist: Vince Quickley
Score: 73-71

[03:35] Team_028 possession (Score: 73-71)
Myles Haliburton attempts a 3Pt. Contested by Collin Barnes (5.5 feet, ZONE). MYLES HALIBURTON MAKES IT! Assist: Austin Russell
Score: 73-74

[03:22] Team_016 possession (Score: 73-74)
Giannis Ginobili attempts a 3Pt. Contested by Kawhi Ball (3.6 feet, ZONE). GIANNIS GINOBILI MAKES IT! Assist: Ben Barrett
Score: 76-74

[03:07] Team_028 possession (Score: 76-74)
Jimmy Brogdon drives and kicks out. FOUL! Shooting foul on Collin Barnes. Austin Russell to the line for 3 free throws. [Team fouls: 3] (Collin Barnes: 2 personal fouls)   FT 1/3: MISS   FT 2/3: GOOD   FT 3/3: GOOD Austin Russell makes 2/3 from the line.
Score: 76-76

[02:54] Team_016 possession (Score: 76-76)
Giannis Ginobili drives, picks up Carmelo Carter. Help arrives from Myles Haliburton! Giannis Ginobili attempts a Dunk. Wide open! Myles Haliburton is 8.2 feet away. [MAN] Giannis Ginobili misses. Rebound secured by Kawhi Ball.

[02:41] Team_028 possession (Score: 76-76)
Kawhi Ball attempts a 3Pt. Heavily contested by Ben Barrett (1.9 feet, MAN)! Kawhi Ball misses. Offensive rebound by Jimmy Brogdon! Jimmy Brogdon kicks it out.

[02:28] Team_028 possession (Score: 76-76)
Carmelo Carter throws a bad pass out of bounds! TURNOVER! (dead ball)

[02:28] Substitution (Team_016): Collin Barnes OUT → Lamelo Herro IN (stamina_rule2)

[02:28] Substitution (Team_016): Ben Barrett OUT → Giannis Doncic IN (stamina_rule2)

[02:28] Substitution (Team_016): Vince Duncan OUT → Trae Barnes IN (stamina_rule2)

[02:28] Substitution (Team_028): Carmelo Carter OUT → Tyrese Quickley IN (stamina_rule2)

[02:28] Substitution (Team_028): Kawhi Ball OUT → Bam Towns IN (stamina_rule2)

[02:28] Substitution (Team_028): Jimmy Brogdon OUT → Collin Bridges IN (stamina_rule2)

[02:16] Team_016 possession (Score: 76-76)
FOUL! Holding foul on Austin Russell. [IN THE BONUS! 5 team fouls] Lamelo Herro to the line for 2 free throws. (Austin Russell: 1 personal fouls)   FT 1/2: GOOD   FT 2/2: MISS Lamelo Herro makes 1/2 from the line. Rebound secured by Tyrese Quickley.
Score: 77-76

[02:06] Team_028 possession (Score: 77-76)
Tyrese Quickley attempts a 3Pt. Wide open! Giannis Ginobili is 6.4 feet away. [MAN] TYRESE QUICKLEY MAKES IT!
Score: 77-79

[01:52] Team_016 possession (Score: 77-79)
Trae Barnes attempts a Midrange. Heavily contested by Myles Haliburton (0.5 feet, ZONE)! Trae Barnes misses. Rebound secured by Bam Towns.

[01:35] Team_028 possession (Score: 77-79)
Myles Haliburton drives and kicks out. Bam Towns attempts a 3Pt. Contested by Giannis Doncic (5.9 feet, MAN). Bam Towns misses. Rebound secured by Giannis Doncic.

[01:22] Team_016 possession (Score: 77-79)
Vince Quickley attempts a Layup. Contested by Myles Haliburton (2.7 feet, MAN). Vince Quickley misses. Rebound secured by Collin Bridges.

[01:10] Team_028 possession (Score: 77-79)
Myles Haliburton attempts a Midrange. Contested by Vince Quickley (6.0 feet, MAN). MYLES HALIBURTON MAKES IT!
Score: 77-81

[00:53] Team_016 possession (Score: 77-81)
Lamelo Herro attempts a 3Pt. Wide open! Austin Russell is 6.4 feet away. [ZONE] LAMELO HERRO MAKES IT! Assist: Vince Quickley
Score: 80-81

[00:38] Team_028 possession (Score: 80-81)
Tyrese Quickley attempts a Midrange. Wide open! Giannis Ginobili is 8.1 feet away. [MAN] TYRESE QUICKLEY MAKES IT!
Score: 80-83

[00:21] Team_016 possession (Score: 80-83)
Lamelo Herro attempts a 3Pt. Contested by Austin Russell (4.1 feet, ZONE). LAMELO HERRO MAKES IT! Assist: Vince Quickley
Score: 83-83

[00:08] Team_028 possession (Score: 83-83)
Collin Bridges drives, picks up Giannis Doncic. Help arrives from Lamelo Herro! Collin Bridges attempts a Layup. Contested by Lamelo Herro (5.4 feet, ZONE). Collin Bridges misses. Rebound secured by Lamelo Herro.

================================================================================
                              3RD QUARTER COMPLETE                              
================================================================================

3RD QUARTER SCORE: Team_016 27, Team_028 28

BOX SCORE:
================================================================================

Team_016
--------------------------------------------------------------------------------
Player                MIN  PTS  REB  AST  TO      FG   FG%      3P   3P%
--------------------------------------------------------------------------------
Ben Barrett            23    6    4    1   0   3/4    75.0     0/0   0.0
Lamelo Herro           14    6    1    0   0   2/2   100.0     0/0   0.0
Vince Duncan           23    5    3    1   0   2/3    66.7     0/0   0.0
Giannis Ginobili       25    3    0    0   0   1/4    25.0     0/0   0.0
Collin Barnes          23    3    0    1   0   1/3    33.3     0/0   0.0
Vince Quickley         29    3    1    5   0   1/2    50.0     0/0   0.0
Trae Barnes            14    0    0    0   0   0/1     0.0     0/0   0.0
Giannis Doncic         14    0    1    0   0   0/0     0.0     0/0   0.0

TEAM: FG: 10/20 (50.0%), 3PT: 4/9 (44.4%), REB: 10 (1 off, 9 def), AST: 8, TO: 3
TEAM FOULS: 3


Team_028
--------------------------------------------------------------------------------
Player                MIN  PTS  REB  AST  TO      FG   FG%      3P   3P%
--------------------------------------------------------------------------------
Myles Haliburton       25   11    0    1   0   4/7    57.1     0/0   0.0
Carmelo Carter         23    5    4    0   0   2/3    66.7     0/0   0.0
Austin Russell         25    5    0    2   0   2/5    40.0     0/0   0.0
Tyrese Quickley        14    5    1    0   0   2/2   100.0     0/0   0.0
Kawhi Ball             23    2    2    1   0   1/1   100.0     0/0   0.0
Jimmy Brogdon          23    0    4    1   0   0/1     0.0     0/0   0.0
Bam Towns              14    0    1    0   0   0/0     0.0     0/0   0.0
Collin Bridges         14    0    1    0   0   0/1     0.0     0/0   0.0

TEAM: FG: 11/20 (55.0%), 3PT: 4/8 (50.0%), REB: 13 (3 off, 10 def), AST: 5, TO: 3
TEAM FOULS: 5 [Team_016 in BONUS]

================================================================================

================================================================================
                       4TH QUARTER - Team_016 vs Team_028                       
================================================================================

[12:00] Team_016 possession (Score: 83-83)
Collin Barnes attempts a Midrange. Wide open! Myles Haliburton is 6.4 feet away. [ZONE] Collin Barnes misses. Rebound secured by Kawhi Ball.

[11:47] Team_028 possession (Score: 83-83)
Austin Russell attempts a 3Pt. Heavily contested by Collin Barnes (1.2 feet, MAN)! Austin Russell misses. Rebound secured by Ben Barrett.

[11:30] Team_016 possession (Score: 83-83)
Collin Barnes drives to the basket... Collin Barnes loses control! Ball rolls out of bounds! TURNOVER! (dead ball)

[11:30] Substitution (Team_016): Giannis Ginobili OUT → Immanuel Nowitzki IN (stamina_rule2)

[11:30] Substitution (Team_016): Vince Quickley OUT → Kevin Butler IN (stamina_rule2)

[11:30] Substitution (Team_028): Austin Russell OUT → Scottie Ingram IN (stamina_rule2)

[11:30] Substitution (Team_028): Myles Haliburton OUT → Miles Booker IN (stamina_rule2)

[11:16] Team_028 possession (Score: 83-83)
Miles Booker drives to the basket... Miles Booker loses control! Ball rolls out of bounds! TURNOVER! (dead ball)

[11:01] Team_016 possession (Score: 83-83)
Ben Barrett makes the Dunk and draws the foul on Kawhi Ball! And-1! Ben Barrett to the line for 1. [Team fouls: 1] (Kawhi Ball: 1 personal fouls)   FT 1/1: GOOD Ben Barrett makes 1/1 from the line.
Score: 86-83

[10:45] Team_028 possession (Score: 86-83)
Kawhi Ball attempts a Layup. Contested by Ben Barrett (4.3 feet, MAN). KAWHI BALL MAKES IT! Assist: Jimmy Brogdon
Score: 86-85

[10:33] Team_016 possession (Score: 86-85)
Vince Duncan drives and kicks out. FOUL! Shooting foul on Jimmy Brogdon. Vince Duncan to the line for 3 free throws. [Team fouls: 2] (Jimmy Brogdon: 1 personal fouls)   FT 1/3: GOOD   FT 2/3: MISS   FT 3/3: MISS Vince Duncan makes 1/3 from the line. Rebound secured by Carmelo Carter.
Score: 87-85

[10:17] Team_028 possession (Score: 87-85)
Scottie Ingram drives, Vince Duncan stays with him. Scottie Ingram attempts a Layup. Contested by Vince Duncan (3.6 feet, ZONE). Scottie Ingram misses. Rebound secured by Ben Barrett.

[10:01] Team_016 possession (Score: 87-85)
Ben Barrett attempts a 3Pt. Contested by Kawhi Ball (3.1 feet, MAN). BEN BARRETT MAKES IT! Assist: Collin Barnes
Score: 90-85

[09:42] Team_028 possession (Score: 90-85)
FOUL! Offensive foul on Carmelo Carter! Immanuel Nowitzki drew the charge! [Team fouls: 3] (Carmelo Carter: 1 personal fouls) TURNOVER! (dead ball)

[09:26] Team_016 possession (Score: 90-85)
Kevin Butler drives, Miles Booker stays with him. Kevin Butler attempts a Layup. Wide open! Miles Booker is 6.0 feet away. [MAN] Kevin Butler misses. Offensive rebound by Ben Barrett! Ben Barrett's putback is no good. Rebound secured by Kawhi Ball.

[09:08] Team_028 possession (Score: 90-85)
Scottie Ingram attempts a 3Pt. Contested by Collin Barnes (5.7 feet, ZONE). SCOTTIE INGRAM MAKES IT! Assist: Carmelo Carter
Score: 90-88

[08:54] Team_016 possession (Score: 90-88)
Ben Barrett loses control! Ball rolls out of bounds! TURNOVER! (dead ball)

[08:54] Substitution (Team_016): Collin Barnes OUT → Lamelo Herro IN (stamina_rule2)

[08:54] Substitution (Team_016): Ben Barrett OUT → Giannis Doncic IN (stamina_rule2)

[08:54] Substitution (Team_016): Vince Duncan OUT → Trae Barnes IN (stamina_rule2)

[08:54] Substitution (Team_028): Carmelo Carter OUT → Tyrese Quickley IN (stamina_rule2)

[08:54] Substitution (Team_028): Kawhi Ball OUT → Bam Towns IN (stamina_rule2)

[08:54] Substitution (Team_028): Jimmy Brogdon OUT → Collin Bridges IN (stamina_rule2)

[08:39] Team_028 possession (Score: 90-88)
Collin Bridges loses the ball! Stripped by Trae Barnes! TURNOVER! (live ball)

[08:25] Team_016 possession (Score: 90-88)
FOUL! Reach-in foul on Collin Bridges during the drive. [Team fouls: 4] No free throws, side out. (Collin Bridges: 1 personal fouls)

[08:10] Team_016 possession (Score: 90-88)
Kevin Butler drives to the basket... Kevin Butler commits a violation (traveling/carry)! TURNOVER! (dead ball)

[07:57] Team_028 possession (Score: 90-88)
FOUL! Offensive foul on Tyrese Quickley! Immanuel Nowitzki drew the charge! [Team fouls: 5] (Tyrese Quickley: 1 personal fouls) TURNOVER! (dead ball)

[07:44] Team_016 possession (Score: 90-88)
Trae Barnes commits a violation (traveling/carry)! TURNOVER! (dead ball)

[07:30] Team_028 possession (Score: 90-88)
Collin Bridges attempts a Midrange. Contested by Immanuel Nowitzki (3.5 feet, ZONE). Collin Bridges misses. Rebound secured by Trae Barnes.

[07:19] Team_016 possession (Score: 90-88)
Kevin Butler attempts a Layup. Contested by Collin Bridges (6.0 feet, ZONE). KEVIN BUTLER MAKES IT!
Score: 92-88

[07:08] Team_028 possession (Score: 92-88)
FOUL! Shooting foul on Immanuel Nowitzki. Tyrese Quickley to the line for 2 free throws. [Team fouls: 1] (Immanuel Nowitzki: 1 personal fouls)   FT 1/2: GOOD   FT 2/2: GOOD Tyrese Quickley makes 2/2 from the line.
Score: 92-90

[06:51] Team_016 possession (Score: 92-90)
Immanuel Nowitzki attempts a 3Pt. Wide open! Scottie Ingram is 6.5 feet away. [ZONE] Immanuel Nowitzki misses. Rebound secured by Tyrese Quickley.

[06:33] Team_028 possession (Score: 92-90)
Scottie Ingram attempts a Midrange. Wide open! Lamelo Herro is 6.7 feet away. [MAN] Scottie Ingram misses. Rebound secured by Giannis Doncic.

[06:16] Team_016 possession (Score: 92-90)
Immanuel Nowitzki attempts a 3Pt. Wide open! Tyrese Quickley is 6.0 feet away. [MAN] Immanuel Nowitzki misses. Rebound secured by Bam Towns.

[06:01] Team_028 possession (Score: 92-90)
Tyrese Quickley attempts a 3Pt. Contested by Immanuel Nowitzki (5.6 feet, MAN). TYRESE QUICKLEY MAKES IT! Assist: Collin Bridges
Score: 92-93

[05:49] Team_016 possession (Score: 92-93)
Giannis Doncic attempts a 3Pt. Heavily contested by Collin Bridges (0.7 feet, MAN)! GIANNIS DONCIC MAKES IT! Assist: Kevin Butler
Score: 95-93

[05:33] Team_028 possession (Score: 95-93)
Scottie Ingram drives and kicks out. Miles Booker attempts a Midrange. Heavily contested by Kevin Butler (0.9 feet, MAN)! Miles Booker misses. Rebound secured by Giannis Doncic.

[05:18] Team_016 possession (Score: 95-93)
Immanuel Nowitzki drives to the basket... FOUL! Offensive foul on Immanuel Nowitzki! Tyrese Quickley drew the charge! [Team fouls: 2] (Immanuel Nowitzki: 2 personal fouls) TURNOVER! (dead ball)

[05:04] Team_028 possession (Score: 95-93)
Scottie Ingram makes the Layup and draws the foul on Lamelo Herro! And-1! Scottie Ingram to the line for 1. [Team fouls: 3] (Lamelo Herro: 1 personal fouls)   FT 1/1: GOOD Scottie Ingram makes 1/1 from the line.
Score: 95-96

[04:46] Team_016 possession (Score: 95-96)
Giannis Doncic attempts a Midrange. Heavily contested by Tyrese Quickley (1.4 feet, ZONE)! Giannis Doncic misses. FOUL! Loose ball foul on Bam Towns during the rebound battle. [IN THE BONUS! 6 team fouls] Giannis Doncic to the line for 2 free throws. (Bam Towns: 1 personal fouls)   FT 1/2: GOOD   FT 2/2: GOOD Giannis Doncic makes 2/2 from the line.
Score: 97-96

[04:32] Team_028 possession (Score: 97-96)
Tyrese Quickley attempts a Midrange. Wide open! Kevin Butler is 7.6 feet away. [ZONE] Tyrese Quickley misses. Rebound secured by Trae Barnes.

[04:18] Team_016 possession (Score: 97-96)
Giannis Doncic drives, picks up Collin Bridges. Help arrives from Tyrese Quickley! Giannis Doncic attempts a Layup. Contested by Tyrese Quickley (4.3 feet, ZONE). Giannis Doncic misses. Rebound secured by Tyrese Quickley.

[04:04] Team_028 possession (Score: 97-96)
Scottie Ingram attempts a 3Pt. Contested by Lamelo Herro (4.7 feet, ZONE). Scottie Ingram misses. Rebound secured by Trae Barnes.

[03:48] Team_016 possession (Score: 97-96)
Giannis Doncic drives, picks up Collin Bridges. Help arrives from Tyrese Quickley! Giannis Doncic attempts a Layup. Heavily contested by Tyrese Quickley (0.5 feet, MAN)! Giannis Doncic misses. Offensive rebound by Giannis Doncic! Giannis Doncic kicks it out.

[03:35] Team_016 possession (Score: 97-96)
Trae Barnes attempts a Midrange. Contested by Collin Bridges (2.8 feet, MAN). Trae Barnes misses. Offensive rebound by Giannis Doncic! Giannis Doncic kicks it out.

[03:24] Team_016 possession (Score: 97-96)
Lamelo Herro drives to the basket... Lamelo Herro loses control! Ball rolls out of bounds! TURNOVER! (dead ball)

[03:13] Team_028 possession (Score: 97-96)
FOUL! Holding foul on Kevin Butler. [Team fouls: 4] No free throws, side out. (Kevin Butler: 1 personal fouls)

[03:00] Team_028 possession (Score: 97-96)
Bam Towns drives to the basket... FOUL! Offensive foul on Bam Towns! Giannis Doncic drew the charge! [Team fouls: 7] (Bam Towns: 2 personal fouls) TURNOVER! (dead ball)

[02:44] Team_016 possession (Score: 97-96)
Kevin Butler attempts a Midrange. Wide open! Miles Booker is 7.9 feet away. [MAN] KEVIN BUTLER MAKES IT! Assist: Trae Barnes
Score: 99-96

[02:31] Team_028 possession (Score: 99-96)
Collin Bridges drives, picks up Trae Barnes. Help arrives from Lamelo Herro! Collin Bridges attempts a Dunk. Wide open! Lamelo Herro is 6.5 feet away. [MAN] COLLIN BRIDGES MAKES IT! Assist: Scottie Ingram
Score: 99-98

[02:14] Team_016 possession (Score: 99-98)
Trae Barnes attempts a Layup. Contested by Collin Bridges (4.0 feet, ZONE). Trae Barnes misses. Rebound secured by Collin Bridges.

[02:01] Team_028 possession (Score: 99-98)
Tyrese Quickley drives, Immanuel Nowitzki stays with him. Tyrese Quickley attempts a Dunk. Wide open! Immanuel Nowitzki is 7.6 feet away. [MAN] TYRESE QUICKLEY MAKES IT! Assist: Scottie Ingram
Score: 99-100

[01:46] Team_016 possession (Score: 99-100)
Immanuel Nowitzki drives and kicks out. Kevin Butler attempts a 3Pt. Contested by Miles Booker (3.8 feet, MAN). Kevin Butler misses. Offensive rebound by Giannis Doncic! Giannis Doncic kicks it out.

[01:33] Team_016 possession (Score: 99-100)
Kevin Butler attempts a 3Pt. Wide open! Miles Booker is 6.2 feet away. [MAN] Kevin Butler misses. Rebound secured by Collin Bridges.

[01:16] Team_028 possession (Score: 99-100)
Scottie Ingram attempts a 3Pt. Contested by Lamelo Herro (5.8 feet, MAN). Scottie Ingram misses. Rebound secured by Trae Barnes.

[01:05] Team_016 possession (Score: 99-100)
Trae Barnes drives and kicks out. Immanuel Nowitzki attempts a 3Pt. Contested by Scottie Ingram (4.1 feet, ZONE). IMMANUEL NOWITZKI MAKES IT! Assist: Lamelo Herro
Score: 102-100

[00:49] Team_028 possession (Score: 102-100)
Miles Booker drives to the basket... Miles Booker throws a bad pass! Stolen by Giannis Doncic! TURNOVER! (live ball)

[00:36] Team_016 possession (Score: 102-100)
FOUL! Shooting foul on Miles Booker. Giannis Doncic to the line for 2 free throws. [BONUS: 8 team fouls] (Miles Booker: 1 personal fouls)   FT 1/2: MISS   FT 2/2: GOOD Giannis Doncic makes 1/2 from the line.
Score: 103-100

[00:18] Team_028 possession (Score: 103-100)
Bam Towns attempts a 3Pt. Contested by Lamelo Herro (2.6 feet, ZONE). Bam Towns misses. Rebound secured by Lamelo Herro.

[00:04] Team_016 possession (Score: 103-100)
Giannis Doncic commits a violation (traveling/carry)! TURNOVER! (dead ball)

================================================================================
                              4TH QUARTER COMPLETE                              
================================================================================

4TH QUARTER SCORE: Team_016 20, Team_028 17

BOX SCORE:
================================================================================

Team_016
--------------------------------------------------------------------------------
Player                MIN  PTS  REB  AST  TO      FG   FG%      3P   3P%
--------------------------------------------------------------------------------
Ben Barrett            26    6    2    0   0   2/2   100.0     0/0   0.0
Giannis Doncic         23    6    5    0   0   3/4    75.0     0/0   0.0
Kevin Butler           19    4    0    1   0   2/4    50.0     0/0   0.0
Immanuel Nowitzki      23    3    0    0   0   1/3    33.3     0/0   0.0
Kawhi Ball             26    2    2    0   0   1/1   100.0     0/0   0.0
Collin Barnes          26    0    0    1   0   0/1     0.0     0/0   0.0
Vince Duncan           26    0    0    0   0   0/1     0.0     0/0   0.0
Trae Barnes            23    0    4    1   0   0/1     0.0     0/0   0.0
Lamelo Herro           23    0    1    1   0   0/0     0.0     0/0   0.0

TEAM: FG: 8/16 (50.0%), 3PT: 2/5 (40.0%), REB: 13 (4 off, 9 def), AST: 4, TO: 7
TEAM FOULS: 4


Team_028
--------------------------------------------------------------------------------
Player                MIN  PTS  REB  AST  TO      FG   FG%      3P   3P%
--------------------------------------------------------------------------------
Tyrese Quickley        23    7    2    0   0   3/4    75.0     0/0   0.0
Scottie Ingram         23    6    0    2   0   2/7    28.6     0/0   0.0
Collin Bridges         23    2    2    1   0   1/2    50.0     0/0   0.0
Austin Russell         26    0    0    0   0   0/1     0.0     0/0   0.0
Jimmy Brogdon          26    0    0    1   0   0/0     0.0     0/0   0.0
Carmelo Carter         26    0    1    1   0   0/0     0.0     0/0   0.0
Bam Towns              23    0    1    0   0   0/1     0.0     0/0   0.0

TEAM: FG: 7/16 (43.8%), 3PT: 2/6 (33.3%), REB: 7 (0 off, 7 def), AST: 5, TO: 6
TEAM FOULS: 8 [Team_016 in BONUS]

================================================================================

================================================================================
                               FULL GAME COMPLETE                               
================================================================================

FINAL SCORE: Team_016 103, Team_028 100

SCORING BY QUARTER:
--------------------------------------------------------------------------------
Team                     Q1     Q2     Q3     Q4    FINAL
--------------------------------------------------------------------------------
Team_016                 36     20     27     20      103
Team_028                 30     25     28     17      100
--------------------------------------------------------------------------------

FULL GAME BOX SCORE:
================================================================================

Team_016
--------------------------------------------------------------------------------
Player                MIN  PTS  REB  AST  TO      FG   FG%      3P   3P%      FT STL BLK
--------------------------------------------------------------------------------
Vince Quickley         30    6    5    7   1   2/9    22.2   0/2     0.0   2/3     1   0
Collin Barnes          26   15    0    5   1   5/9    55.6   4/7    57.1   1/1     0   0
Ben Barrett            26   12    9    3   2   6/8    75.0   1/2    50.0   1/1     0   0
Vince Duncan           26   15    7    2   0   6/10   60.0   0/1     0.0   2/4     0   0
Giannis Ginobili       26   13    0    0   2   6/9    66.7   2/4    50.0   3/4     0   0
Immanuel Nowitzki      23    9    0    0   2   2/11   18.2   2/6    33.3   0/0     0   0
Lamelo Herro           23    6    5    3   1   2/3    66.7   2/2   100.0   1/2     0   0
Giannis Doncic         23   11    9    1   2   4/7    57.1   1/1   100.0   3/4     1   1
Trae Barnes            23    5    6    3   3   3/5    60.0   1/1   100.0   0/0     2   0
Kevin Butler           19    8    1    1   0   4/6    66.7   0/1     0.0   0/0     0   0

TEAM: FG: 41/79 (51.9%), 3PT: 13/27 (48.1%), REB: 43 (9 off, 34 def), AST: 25, TO: 14


Team_028
--------------------------------------------------------------------------------
Player                MIN  PTS  REB  AST  TO      FG   FG%      3P   3P%      FT STL BLK
--------------------------------------------------------------------------------
Carmelo Carter         26   14    6    2   2   5/11   45.5   0/5     0.0   1/1     0   0
Kawhi Ball             26   11    9    3   0   4/4   100.0   1/1   100.0   3/3     1   0
Jimmy Brogdon          26    5    9    4   2   3/6    50.0   0/1     0.0   1/1     0   0
Austin Russell         26    7    0    2   1   1/6    16.7   0/3     0.0   5/6     1   1
Myles Haliburton       26   20    0    2   1  10/14   71.4   5/7    71.4   1/2     0   0
Scottie Ingram         23   15    0    2   0   5/12   41.7   4/7    57.1   1/1     0   0
Miles Booker           23    4    0    2   1   2/4    50.0   0/1     0.0   0/0     0   0
Tyrese Quickley        23   15    7    2   3   6/7    85.7   3/3   100.0   2/2     2   1
Bam Towns              23    0    5    1   1   0/4     0.0   0/2     0.0   0/0     0   0
Collin Bridges         23    9    7    4   3   5/8    62.5   0/0     0.0   1/2     0   1

TEAM: FG: 42/77 (54.5%), 3PT: 13/30 (43.3%), REB: 42 (5 off, 37 def), AST: 24, TO: 14

================================================================================
