================================================================================
                        FULL GAME - Team_053 vs Team_036                        
================================================================================

================================================================================
                       1ST QUARTER - Team_053 vs Team_036                       
================================================================================

[12:00] Team_053 possession (Score: 0-0)
Draymond LaVine attempts a Layup. Wide open! Kobe Simmons is 7.3 feet away. [MAN] DRAYMOND LAVINE MAKES IT!
Score: 2-0

[11:44] Team_036 possession (Score: 2-0)
Anthony Poole attempts a Midrange. Contested by James Murray (5.6 feet, ZONE). Anthony Poole misses. Offensive rebound by Terry Durant! Terry Durant's putback is no good. Rebound secured by James Murray.

[11:30] Team_053 possession (Score: 2-0)
Immanuel Curry attempts a 3Pt. Wide open! Anthony Poole is 6.1 feet away. [MAN] IMMANUEL CURRY MAKES IT! Assist: Michael Gasol
Score: 5-0

[11:17] Team_036 possession (Score: 5-0)
FOUL! Shooting foul on Michael Gasol. Terry Durant to the line for 2 free throws. [Team fouls: 1] (Michael Gasol: 1 personal fouls)   FT 1/2: MISS   FT 2/2: GOOD Terry Durant makes 1/2 from the line.
Score: 5-1

[11:02] Team_053 possession (Score: 5-1)
Michael Gasol loses control! Ball rolls out of bounds! TURNOVER! (dead ball)

[10:45] Team_036 possession (Score: 5-1)
Giannis Booker drives to the basket... Giannis Booker commits a violation (traveling/carry)! TURNOVER! (dead ball)

[10:29] Team_053 possession (Score: 5-1)
Draymond LaVine drives to the basket... Draymond LaVine commits a violation (traveling/carry)! TURNOVER! (dead ball)

[10:16] Team_036 possession (Score: 5-1)
Michael Westbrook drives, picks up Kobe Ginobili. Help arrives from James Murray! Michael Westbrook attempts a Dunk. Wide open! James Murray is 7.2 feet away. [MAN] MICHAEL WESTBROOK MAKES IT!
Score: 5-3

[09:59] Team_053 possession (Score: 5-3)
Immanuel Curry drives, Anthony Poole stays with him. Immanuel Curry attempts a Layup. Contested by Anthony Poole (4.4 feet, MAN). IMMANUEL CURRY MAKES IT! Assist: James Murray
Score: 7-3

[09:46] Team_036 possession (Score: 7-3)
FOUL! Holding foul on Draymond LaVine. [Team fouls: 2] No free throws, side out. (Draymond LaVine: 1 personal fouls)

[09:29] Team_036 possession (Score: 7-3)
Terry Durant attempts a Midrange. Contested by Michael Gasol (5.1 feet, MAN). Terry Durant misses. Offensive rebound by Kobe Simmons! Kobe Simmons puts it back in!
Score: 7-5

[09:13] Team_053 possession (Score: 7-5)
Draymond LaVine makes the Layup and draws the foul on Kobe Simmons! And-1! Draymond LaVine to the line for 1. [Team fouls: 1] (Kobe Simmons: 1 personal fouls)   FT 1/1: GOOD Draymond LaVine makes 1/1 from the line.
Score: 10-5

[08:59] Team_036 possession (Score: 10-5)
Anthony Poole attempts a Midrange. Heavily contested by James Murray (0.5 feet, ZONE)! Anthony Poole misses. Rebound secured by James Murray.

[08:47] Team_053 possession (Score: 10-5)
FOUL! Holding foul on Terry Durant. [Team fouls: 2] No free throws, side out. (Terry Durant: 1 personal fouls)

[08:33] Team_053 possession (Score: 10-5)
Michael Gasol attempts a 3Pt. Heavily contested by Michael Westbrook (1.9 feet, ZONE)! Michael Gasol misses. Rebound secured by Terry Durant.

[08:22] Team_036 possession (Score: 10-5)
Michael Westbrook attempts a 3Pt. Contested by Michael Gasol (4.0 feet, ZONE). Michael Westbrook misses. Rebound secured by James Murray.

[08:03] Team_053 possession (Score: 10-5)
Kobe Ginobili attempts a Layup. Heavily contested by Michael Westbrook (2.0 feet, MAN)! Kobe Ginobili misses. Rebound secured by Terry Durant.

[07:49] Team_036 possession (Score: 10-5)
FOUL! Reach-in foul on Immanuel Curry during the drive. [Team fouls: 3] No free throws, side out. (Immanuel Curry: 1 personal fouls)

[07:36] Team_036 possession (Score: 10-5)
Michael Westbrook attempts a Midrange. Contested by Kobe Ginobili (6.0 feet, MAN). MICHAEL WESTBROOK MAKES IT! Assist: Terry Durant
Score: 10-7

[07:21] Team_053 possession (Score: 10-7)
Immanuel Curry attempts a Midrange. Contested by Giannis Booker (4.6 feet, ZONE). IMMANUEL CURRY MAKES IT! Assist: Michael Gasol
Score: 12-7

[07:08] Team_036 possession (Score: 12-7)
Anthony Poole throws a bad pass out of bounds! TURNOVER! (dead ball)

[06:54] Team_053 possession (Score: 12-7)
FOUL! Shooting foul on Terry Durant. James Murray to the line for 2 free throws. [Team fouls: 3] (Terry Durant: 2 personal fouls)   FT 1/2: GOOD   FT 2/2: MISS James Murray makes 1/2 from the line. Rebound secured by Kobe Simmons.
Score: 13-7

[06:39] Team_036 possession (Score: 13-7)
Terry Durant drives and kicks out. Kobe Simmons attempts a Midrange. Contested by James Murray (4.9 feet, ZONE). KOBE SIMMONS MAKES IT! Assist: Terry Durant
Score: 13-9

[06:28] Team_053 possession (Score: 13-9)
FOUL! Reach-in foul on Kobe Simmons during the drive. [Team fouls: 4] No free throws, side out. (Kobe Simmons: 2 personal fouls)

[06:12] Team_053 possession (Score: 13-9)
Immanuel Curry loses the ball! Stripped by Anthony Poole! TURNOVER! (live ball)

[05:57] Team_036 possession (Score: 13-9)
Giannis Booker drives to the basket... Giannis Booker throws a bad pass! Stolen by Michael Gasol! TURNOVER! (live ball)

[05:40] Team_053 possession (Score: 13-9)
Kobe Ginobili attempts a 3Pt. Contested by Michael Westbrook (3.0 feet, ZONE). KOBE GINOBILI MAKES IT! Assist: Immanuel Curry
Score: 16-9

[05:27] Team_036 possession (Score: 16-9)
Anthony Poole drives and kicks out. Terry Durant makes the Midrange and draws the foul on Michael Gasol! And-1! Terry Durant to the line for 1. [Team fouls: 4] (Michael Gasol: 2 personal fouls)   FT 1/1: GOOD Terry Durant makes 1/1 from the line.
Score: 16-12

[05:13] Team_053 possession (Score: 16-12)
James Murray attempts a 3Pt. Contested by Michael Westbrook (4.8 feet, ZONE). JAMES MURRAY MAKES IT! Assist: Immanuel Curry
Score: 19-12

[04:58] Team_036 possession (Score: 19-12)
Giannis Booker attempts a Midrange. Contested by James Murray (4.1 feet, MAN). Giannis Booker misses. Rebound secured by James Murray.

[04:47] Team_053 possession (Score: 19-12)
James Murray attempts a Layup. Contested by Giannis Booker (5.1 feet, MAN). JAMES MURRAY MAKES IT! Assist: Draymond LaVine
Score: 21-12

[04:29] Team_036 possession (Score: 21-12)
Giannis Booker drives and kicks out. Giannis Booker attempts a Midrange. Heavily contested by James Murray (0.8 feet, MAN)! Giannis Booker misses. Rebound secured by James Murray.

[04:11] Team_053 possession (Score: 21-12)
Immanuel Curry attempts a 3Pt. Contested by Anthony Poole (5.0 feet, MAN). Immanuel Curry misses. Rebound secured by Terry Durant.

[03:59] Team_036 possession (Score: 21-12)
Michael Westbrook attempts a 3Pt. Wide open! Kobe Ginobili is 6.1 feet away. [ZONE] MICHAEL WESTBROOK MAKES IT!
Score: 21-15

[03:42] Team_053 possession (Score: 21-15)
Immanuel Curry makes the 3Pt and draws the foul on Michael Westbrook! And-1! Immanuel Curry to the line for 1. [BONUS: 5 team fouls] (Michael Westbrook: 1 personal fouls)   FT 1/1: MISS Immanuel Curry makes 0/1 from the line. Offensive rebound by Draymond LaVine! Draymond LaVine kicks it out.
Score: 24-15

[03:27] Team_053 possession (Score: 24-15)
James Murray throws a bad pass out of bounds! TURNOVER! (dead ball)

[03:14] Team_036 possession (Score: 24-15)
Giannis Booker drives, Michael Gasol stays with him. Giannis Booker attempts a Dunk. Wide open! Michael Gasol is 6.1 feet away. [ZONE] Giannis Booker misses. Rebound secured by Draymond LaVine.

[02:57] Team_053 possession (Score: 24-15)
Immanuel Curry attempts a Midrange. Wide open! Giannis Booker is 6.9 feet away. [ZONE] IMMANUEL CURRY MAKES IT!
Score: 26-15

[02:45] Team_036 possession (Score: 26-15)
Terry Durant attempts a Midrange. Wide open! Draymond LaVine is 6.9 feet away. [ZONE] TERRY DURANT MAKES IT!
Score: 26-17

[02:32] Team_053 possession (Score: 26-17)
Michael Gasol attempts a Layup. Contested by Kobe Simmons (3.4 feet, ZONE). Michael Gasol misses. Rebound secured by Kobe Simmons.

[02:18] Team_036 possession (Score: 26-17)
Michael Westbrook attempts a Layup. BLOCKED BY JAMES MURRAY! Ball deflects out of bounds off Michael Westbrook.

[02:05] Team_053 possession (Score: 26-17)
Michael Gasol attempts a Layup. BLOCKED BY KOBE SIMMONS! Ball is loose! Offensive rebound by Draymond LaVine! Draymond LaVine kicks it out.

[01:52] Team_053 possession (Score: 26-17)
James Murray attempts a 3Pt. Wide open! Giannis Booker is 7.6 feet away. [MAN] JAMES MURRAY MAKES IT! Assist: Immanuel Curry
Score: 29-17

[01:37] Team_036 possession (Score: 29-17)
FOUL! Offensive foul on Kobe Simmons! Draymond LaVine drew the charge! [Team fouls: 6] (Kobe Simmons: 3 personal fouls) TURNOVER! (dead ball)

[01:24] Team_053 possession (Score: 29-17)
Draymond LaVine attempts a Midrange. Wide open! Anthony Poole is 8.0 feet away. [ZONE] Draymond LaVine misses. Rebound secured by Kobe Simmons.

[01:11] Team_036 possession (Score: 29-17)
Michael Westbrook drives and kicks out. Terry Durant attempts a 3Pt. Contested by Kobe Ginobili (2.6 feet, ZONE). TERRY DURANT MAKES IT! Assist: Michael Westbrook
Score: 29-20

[00:58] Team_053 possession (Score: 29-20)
Kobe Ginobili drives and kicks out. James Murray attempts a 3Pt. Wide open! Michael Westbrook is 8.7 feet away. [ZONE] James Murray misses. Offensive rebound by Michael Gasol! Michael Gasol puts it back in!
Score: 31-20

[00:44] Team_036 possession (Score: 31-20)
Kobe Simmons attempts a Layup. Contested by Michael Gasol (4.4 feet, ZONE). KOBE SIMMONS MAKES IT! Assist: Anthony Poole
Score: 31-22

[00:31] Team_053 possession (Score: 31-22)
Immanuel Curry attempts a Midrange. Wide open! Terry Durant is 7.5 feet away. [ZONE] Immanuel Curry misses. Rebound secured by Giannis Booker.

[00:14] Team_036 possession (Score: 31-22)
Giannis Booker attempts a Midrange. Contested by James Murray (4.4 feet, ZONE). Giannis Booker misses. Rebound secured by Draymond LaVine.

[00:01] Team_053 possession (Score: 31-22)
James Murray throws a bad pass! Stolen by Giannis Booker! TURNOVER! (live ball)

================================================================================
                              1ST QUARTER COMPLETE                              
================================================================================

1ST QUARTER SCORE: Team_053 31, Team_036 22

BOX SCORE:
================================================================================

Team_053
--------------------------------------------------------------------------------
Player                MIN  PTS  REB  AST  TO      FG   FG%      3P   3P%
--------------------------------------------------------------------------------
Immanuel Curry         12    9    0    3   0   4/6    66.7     0/0   0.0
James Murray           12    8    5    1   0   3/4    75.0     0/0   0.0
Draymond LaVine        12    5    4    1   0   2/3    66.7     0/0   0.0
Kobe Ginobili          12    3    0    0   0   1/2    50.0     0/0   0.0
Michael Gasol          12    2    1    2   0   1/3    33.3     0/0   0.0

TEAM: FG: 11/18 (61.1%), 3PT: 4/6 (66.7%), REB: 9 (3 off, 6 def), AST: 7, TO: 5
TEAM FOULS: 4


Team_036
--------------------------------------------------------------------------------
Player                MIN  PTS  REB  AST  TO      FG   FG%      3P   3P%
--------------------------------------------------------------------------------
Terry Durant           12    9    3    2   0   4/4   100.0     0/0   0.0
Michael Westbrook      12    7    0    1   0   3/5    60.0     0/0   0.0
Kobe Simmons           12    6    4    0   0   3/3   100.0     0/0   0.0
Anthony Poole          12    0    0    1   0   0/2     0.0     0/0   0.0
Giannis Booker         12    0    1    0   0   0/4     0.0     0/0   0.0

TEAM: FG: 10/18 (55.6%), 3PT: 1/2 (50.0%), REB: 9 (2 off, 7 def), AST: 4, TO: 4
TEAM FOULS: 6 [Team_053 in BONUS]

================================================================================

================================================================================
                       2ND QUARTER - Team_053 vs Team_036                       
================================================================================

[12:00] Team_053 possession (Score: 31-22)
FOUL! Shooting foul on Kobe Simmons. Draymond LaVine to the line for 2 free throws. [Team fouls: 1] (Kobe Simmons: 1 personal fouls)   FT 1/2: GOOD   FT 2/2: GOOD Draymond LaVine makes 2/2 from the line.
Score: 33-22

[11:46] Team_036 possession (Score: 33-22)
Michael Westbrook drives, picks up Kobe Ginobili. Help arrives from James Murray! Michael Westbrook attempts a Layup. Wide open! James Murray is 6.6 feet away. [MAN] Michael Westbrook misses. Offensive rebound by Terry Durant! Terry Durant's putback is no good. Offensive rebound by Terry Durant! Terry Durant kicks it out.

[11:30] Team_036 possession (Score: 33-22)
FOUL! Holding foul on Michael Gasol. [Team fouls: 1] No free throws, side out. (Michael Gasol: 1 personal fouls)

[11:16] Team_036 possession (Score: 33-22)
Michael Westbrook attempts a 3Pt. Contested by Kobe Ginobili (5.7 feet, ZONE). Michael Westbrook misses. Rebound secured by James Murray.

[11:01] Team_053 possession (Score: 33-22)
James Murray attempts a Midrange. Contested by Giannis Booker (4.4 feet, MAN). James Murray misses. Offensive rebound by Michael Gasol! Michael Gasol's putback is no good. Offensive rebound by Draymond LaVine! Draymond LaVine kicks it out.

[10:44] Team_053 possession (Score: 33-22)
Kobe Ginobili drives, Michael Westbrook stays with him. Kobe Ginobili attempts a Dunk. Wide open! Michael Westbrook is 6.2 feet away. [MAN] KOBE GINOBILI MAKES IT! Assist: Draymond LaVine
Score: 35-22

[10:28] Team_036 possession (Score: 35-22)
Kobe Simmons drives and kicks out. Kobe Simmons attempts a Midrange. Contested by Draymond LaVine (2.4 feet, ZONE). KOBE SIMMONS MAKES IT! Assist: Michael Westbrook
Score: 35-24

[10:15] Team_053 possession (Score: 35-24)
Michael Gasol attempts a 3Pt. Wide open! Terry Durant is 6.7 feet away. [MAN] MICHAEL GASOL MAKES IT! Assist: Immanuel Curry
Score: 38-24

[10:00] Team_036 possession (Score: 38-24)
Anthony Poole attempts a 3Pt. Contested by Immanuel Curry (2.4 feet, MAN). Anthony Poole misses. Offensive rebound by Terry Durant! Terry Durant kicks it out.

[09:47] Team_036 possession (Score: 38-24)
Kobe Simmons attempts a Midrange. Contested by Draymond LaVine (4.5 feet, MAN). Kobe Simmons misses. Rebound secured by Draymond LaVine.

[09:33] Team_053 possession (Score: 38-24)
FOUL! Holding foul on Anthony Poole. [Team fouls: 2] No free throws, side out. (Anthony Poole: 1 personal fouls)

[09:21] Team_053 possession (Score: 38-24)
Kobe Ginobili attempts a 3Pt. Wide open! Michael Westbrook is 6.6 feet away. [ZONE] Kobe Ginobili misses. Rebound secured by Kobe Simmons.

[09:03] Team_036 possession (Score: 38-24)
Michael Westbrook attempts a Midrange. Contested by Michael Gasol (5.9 feet, ZONE). Michael Westbrook misses. Rebound secured by James Murray.

[08:51] Team_053 possession (Score: 38-24)
Michael Gasol attempts a Layup. Contested by Terry Durant (3.7 feet, MAN). MICHAEL GASOL MAKES IT!
Score: 40-24

[08:35] Team_036 possession (Score: 40-24)
Terry Durant attempts a 3Pt. Contested by Kobe Ginobili (5.2 feet, ZONE). Terry Durant misses. Rebound secured by James Murray.

[08:21] Team_053 possession (Score: 40-24)
Immanuel Curry attempts a 3Pt. Contested by Michael Westbrook (5.8 feet, ZONE). Immanuel Curry misses. Offensive rebound by Michael Gasol! Michael Gasol kicks it out.

[08:03] Team_053 possession (Score: 40-24)
Immanuel Curry attempts a Midrange. Wide open! Anthony Poole is 6.6 feet away. [MAN] IMMANUEL CURRY MAKES IT! Assist: Kobe Ginobili
Score: 42-24

[07:52] Team_036 possession (Score: 42-24)
Michael Westbrook drives, Draymond LaVine stays with him. Michael Westbrook attempts a Dunk. Wide open! Draymond LaVine is 9.0 feet away. [ZONE] MICHAEL WESTBROOK MAKES IT! Assist: Terry Durant
Score: 42-26

[07:39] Team_053 possession (Score: 42-26)
Michael Gasol attempts a 3Pt. Wide open! Terry Durant is 7.1 feet away. [MAN] Michael Gasol misses. Rebound secured by Terry Durant.

[07:21] Team_036 possession (Score: 42-26)
Anthony Poole attempts a 3Pt. Wide open! Immanuel Curry is 6.4 feet away. [MAN] ANTHONY POOLE MAKES IT! Assist: Michael Westbrook
Score: 42-29

[07:07] Team_053 possession (Score: 42-29)
Kobe Ginobili attempts a Midrange. Heavily contested by Michael Westbrook (0.5 feet, MAN)! KOBE GINOBILI MAKES IT!
Score: 44-29

[06:58] Team_036 possession (Score: 44-29)
Giannis Booker loses control! Ball rolls out of bounds! TURNOVER! (dead ball)

[06:58] Substitution (Team_053): Kobe Ginobili OUT → Michael DeRozan IN (stamina_rule2)

[06:58] Substitution (Team_053): James Murray OUT → Tyrese Mitchell IN (stamina_rule2)

[06:58] Substitution (Team_053): Immanuel Curry OUT → Brandon Bryant IN (stamina_rule2)

[06:58] Substitution (Team_053): Michael Gasol OUT → Klay Anunoby IN (stamina_rule2)

[06:58] Substitution (Team_053): Draymond LaVine OUT → Devin Green IN (stamina_rule2)

[06:58] Substitution (Team_036): Michael Westbrook OUT → Dirk Anunoby IN (stamina_rule2)

[06:58] Substitution (Team_036): Giannis Booker OUT → Tobias Fox IN (stamina_rule2)

[06:58] Substitution (Team_036): Anthony Poole OUT → Pascal Antetokounmpo IN (stamina_rule2)

[06:58] Substitution (Team_036): Terry Durant OUT → Devin Simmons IN (stamina_rule2)

[06:58] Substitution (Team_036): Kobe Simmons OUT → Bradley Murray IN (stamina_rule2)

[06:42] Team_053 possession (Score: 44-29)
Michael DeRozan attempts a 3Pt. Wide open! Tobias Fox is 7.3 feet away. [ZONE] Michael DeRozan misses. Offensive rebound by Klay Anunoby! Klay Anunoby kicks it out.

[06:27] Team_053 possession (Score: 44-29)
Devin Green drives and kicks out. Tyrese Mitchell attempts a Midrange. Contested by Tobias Fox (3.3 feet, ZONE). Tyrese Mitchell misses. Rebound secured by Devin Simmons.

[06:13] Team_036 possession (Score: 44-29)
Tobias Fox attempts a 3Pt. Contested by Brandon Bryant (4.6 feet, ZONE). Tobias Fox misses. FOUL! Loose ball foul on Devin Green during the rebound battle. [Team fouls: 2] No free throws, side out. (Devin Green: 1 personal fouls)

[05:58] Team_036 possession (Score: 44-29)
Tobias Fox commits a violation (traveling/carry)! TURNOVER! (dead ball)

[05:40] Team_053 possession (Score: 44-29)
Devin Green attempts a Midrange. Contested by Pascal Antetokounmpo (3.0 feet, ZONE). Devin Green misses. Rebound secured by Bradley Murray.

[05:25] Team_036 possession (Score: 44-29)
Bradley Murray attempts a Midrange. Contested by Klay Anunoby (2.2 feet, ZONE). BRADLEY MURRAY MAKES IT! Assist: Pascal Antetokounmpo
Score: 44-31

[05:07] Team_053 possession (Score: 44-31)
Devin Green attempts a Midrange. Contested by Devin Simmons (4.6 feet, ZONE). Devin Green misses. Rebound secured by Bradley Murray.

[04:50] Team_036 possession (Score: 44-31)
Tobias Fox drives to the basket... Tobias Fox throws a bad pass! Stolen by Tyrese Mitchell! TURNOVER! (live ball)

[04:33] Team_053 possession (Score: 44-31)
Brandon Bryant attempts a 3Pt. Contested by Pascal Antetokounmpo (5.3 feet, MAN). Brandon Bryant misses. Rebound secured by Bradley Murray.

[04:15] Team_036 possession (Score: 44-31)
Tobias Fox attempts a Midrange. Heavily contested by Klay Anunoby (0.5 feet, ZONE)! Tobias Fox misses. Rebound secured by Brandon Bryant.

[03:59] Team_053 possession (Score: 44-31)
Devin Green drives and kicks out. Brandon Bryant attempts a Midrange. Contested by Pascal Antetokounmpo (4.9 feet, MAN). BRANDON BRYANT MAKES IT!
Score: 46-31

[03:46] Team_036 possession (Score: 46-31)
Pascal Antetokounmpo drives, picks up Devin Green. Help arrives from Tyrese Mitchell! Pascal Antetokounmpo attempts a Layup. Wide open! Tyrese Mitchell is 7.8 feet away. [ZONE] PASCAL ANTETOKOUNMPO MAKES IT! Assist: Devin Simmons
Score: 46-33

[03:33] Team_053 possession (Score: 46-33)
Devin Green attempts a Midrange. Contested by Bradley Murray (4.9 feet, MAN). Devin Green misses. Offensive rebound by Klay Anunoby! Klay Anunoby kicks it out.

[03:16] Team_053 possession (Score: 46-33)
Klay Anunoby attempts a Layup. Wide open! Devin Simmons is 6.9 feet away. [ZONE] Klay Anunoby misses. Rebound secured by Bradley Murray.

[02:59] Team_036 possession (Score: 46-33)
Tobias Fox attempts a Layup. BLOCKED BY BRANDON BRYANT! Ball is loose! Rebound secured by Klay Anunoby.

[02:49] Team_053 possession (Score: 46-33)
Tyrese Mitchell attempts a Layup. Contested by Devin Simmons (4.1 feet, ZONE). Tyrese Mitchell misses. Rebound secured by Devin Simmons.

[02:33] Team_036 possession (Score: 46-33)
Bradley Murray drives and kicks out. Tobias Fox attempts a 3Pt. Heavily contested by Brandon Bryant (1.3 feet, ZONE)! Tobias Fox misses. Offensive rebound by Devin Simmons! Devin Simmons kicks it out.

[02:16] Team_036 possession (Score: 46-33)
Devin Simmons attempts a Midrange. Contested by Klay Anunoby (5.1 feet, MAN). Devin Simmons misses. Rebound secured by Klay Anunoby.

[02:01] Team_053 possession (Score: 46-33)
Tyrese Mitchell attempts a Layup. Wide open! Devin Simmons is 10.0 feet away. [ZONE] Tyrese Mitchell misses. Offensive rebound by Devin Green! Devin Green puts it back in!
Score: 48-33

[01:47] Team_036 possession (Score: 48-33)
Tobias Fox drives, Tyrese Mitchell stays with him. Tobias Fox attempts a Layup. Contested by Tyrese Mitchell (2.3 feet, MAN). TOBIAS FOX MAKES IT! Assist: Dirk Anunoby
Score: 48-35

[01:36] Team_053 possession (Score: 48-35)
Brandon Bryant attempts a 3Pt. Contested by Pascal Antetokounmpo (5.0 feet, MAN). Brandon Bryant misses. Rebound secured by Pascal Antetokounmpo.

[01:19] Team_036 possession (Score: 48-35)
Pascal Antetokounmpo attempts a Midrange. Wide open! Brandon Bryant is 7.0 feet away. [MAN] PASCAL ANTETOKOUNMPO MAKES IT!
Score: 48-37

[01:08] Team_053 possession (Score: 48-37)
Michael DeRozan attempts a 3Pt. Contested by Dirk Anunoby (5.4 feet, ZONE). MICHAEL DEROZAN MAKES IT! Assist: Tyrese Mitchell
Score: 51-37

[00:53] Team_036 possession (Score: 51-37)
Tobias Fox attempts a Midrange. Contested by Klay Anunoby (2.9 feet, ZONE). Tobias Fox misses. Offensive rebound by Devin Simmons! Devin Simmons kicks it out.

[00:38] Team_036 possession (Score: 51-37)
FOUL! Shooting foul on Klay Anunoby. Devin Simmons to the line for 2 free throws. [Team fouls: 3] (Klay Anunoby: 1 personal fouls)   FT 1/2: GOOD   FT 2/2: GOOD Devin Simmons makes 2/2 from the line.
Score: 51-39

[00:25] Team_053 possession (Score: 51-39)
Tyrese Mitchell attempts a 3Pt. Wide open! Tobias Fox is 7.1 feet away. [ZONE] Tyrese Mitchell misses. Rebound secured by Devin Simmons.

[00:15] Team_036 possession (Score: 51-39)
Dirk Anunoby attempts a Layup. Contested by Devin Green (4.4 feet, ZONE). DIRK ANUNOBY MAKES IT! Assist: Pascal Antetokounmpo
Score: 51-41

================================================================================
                              2ND QUARTER COMPLETE                              
================================================================================

2ND QUARTER SCORE: Team_053 20, Team_036 19

BOX SCORE:
================================================================================

Team_053
--------------------------------------------------------------------------------
Player                MIN  PTS  REB  AST  TO      FG   FG%      3P   3P%
--------------------------------------------------------------------------------
Michael Gasol          17    5    1    0   0   2/3    66.7     0/0   0.0
Kobe Ginobili          17    4    0    1   0   2/3    66.7     0/0   0.0
Michael DeRozan         7    3    0    0   0   1/1   100.0     0/0   0.0
Draymond LaVine        17    2    2    1   0   1/1   100.0     0/0   0.0
Immanuel Curry         17    2    0    1   0   1/1   100.0     0/0   0.0
Devin Green             7    2    1    0   0   1/4    25.0     0/0   0.0
Brandon Bryant          7    2    1    0   0   1/3    33.3     0/0   0.0
James Murray           17    0    3    0   0   0/0     0.0     0/0   0.0
Klay Anunoby            7    0    4    0   0   0/1     0.0     0/0   0.0
Tyrese Mitchell         7    0    0    1   0   0/2     0.0     0/0   0.0

TEAM: FG: 9/19 (47.4%), 3PT: 2/7 (28.6%), REB: 12 (5 off, 7 def), AST: 4, TO: 0
TEAM FOULS: 3


Team_036
--------------------------------------------------------------------------------
Player                MIN  PTS  REB  AST  TO      FG   FG%      3P   3P%
--------------------------------------------------------------------------------
Pascal Antetokounmpo    7    4    1    2   0   2/2   100.0     0/0   0.0
Anthony Poole          17    3    0    0   0   1/1   100.0     0/0   0.0
Michael Westbrook      17    2    0    2   0   1/3    33.3     0/0   0.0
Kobe Simmons           17    2    1    0   0   1/2    50.0     0/0   0.0
Devin Simmons           7    2    6    1   0   1/2    50.0     0/0   0.0
Bradley Murray          7    2    4    0   0   1/1   100.0     0/0   0.0
Tobias Fox              7    2    0    0   0   1/3    33.3     0/0   0.0
Dirk Anunoby            7    2    0    1   0   1/1   100.0     0/0   0.0
Terry Durant           17    0    3    1   0   0/1     0.0     0/0   0.0

TEAM: FG: 9/16 (56.2%), 3PT: 1/3 (33.3%), REB: 15 (5 off, 10 def), AST: 7, TO: 3
TEAM FOULS: 2

================================================================================

================================================================================
                       3RD QUARTER - Team_053 vs Team_036                       
================================================================================

[12:00] Team_053 possession (Score: 51-41)
Immanuel Curry drives to the basket... FOUL! Offensive foul on Immanuel Curry! Kobe Simmons drew the charge! [Team fouls: 1] (Immanuel Curry: 1 personal fouls) TURNOVER! (dead ball)

[11:48] Team_036 possession (Score: 51-41)
Terry Durant makes the 3Pt and draws the foul on Michael Gasol! And-1! Terry Durant to the line for 1. [Team fouls: 2] (Michael Gasol: 1 personal fouls)   FT 1/1: GOOD Terry Durant makes 1/1 from the line.
Score: 51-45

[11:34] Team_053 possession (Score: 51-45)
Kobe Ginobili throws a bad pass! Stolen by Michael Westbrook! TURNOVER! (live ball)

[11:24] Team_036 possession (Score: 51-45)
Kobe Simmons makes the Layup and draws the foul on Draymond LaVine! And-1! Kobe Simmons to the line for 1. [Team fouls: 3] (Draymond LaVine: 1 personal fouls)   FT 1/1: GOOD Kobe Simmons makes 1/1 from the line.
Score: 51-48

[11:09] Team_053 possession (Score: 51-48)
FOUL! Reach-in foul on Michael Westbrook during the drive. [Team fouls: 1] No free throws, side out. (Michael Westbrook: 1 personal fouls)

[10:56] Team_053 possession (Score: 51-48)
Immanuel Curry attempts a 3Pt. Wide open! Michael Westbrook is 6.9 feet away. [ZONE] Immanuel Curry misses. Offensive rebound by Michael Gasol! Michael Gasol puts it back in!
Score: 53-48

[10:43] Team_036 possession (Score: 53-48)
Kobe Simmons attempts a Midrange. Contested by Draymond LaVine (5.3 feet, MAN). Kobe Simmons misses. Rebound secured by Draymond LaVine.

[10:31] Team_053 possession (Score: 53-48)
James Murray attempts a 3Pt. Contested by Giannis Booker (2.8 feet, MAN). James Murray misses. Offensive rebound by Michael Gasol! Michael Gasol's putback is no good. Rebound secured by Terry Durant.

[10:14] Team_036 possession (Score: 53-48)
Terry Durant attempts a 3Pt. Wide open! Michael Gasol is 7.2 feet away. [MAN] Terry Durant misses. Rebound secured by James Murray.

[10:00] Team_053 possession (Score: 53-48)
FOUL! Reach-in foul on Giannis Booker during the drive. [Team fouls: 2] No free throws, side out. (Giannis Booker: 1 personal fouls)

[09:46] Team_053 possession (Score: 53-48)
FOUL! Holding foul on Giannis Booker. [Team fouls: 3] No free throws, side out. (Giannis Booker: 2 personal fouls)

[09:32] Team_053 possession (Score: 53-48)
Immanuel Curry attempts a 3Pt. Wide open! Michael Westbrook is 6.8 feet away. [ZONE] Immanuel Curry misses. Rebound secured by Kobe Simmons.

[09:13] Team_036 possession (Score: 53-48)
Anthony Poole attempts a Midrange. Contested by Immanuel Curry (4.7 feet, MAN). Anthony Poole misses. Rebound secured by James Murray.

[08:58] Team_053 possession (Score: 53-48)
James Murray drives, picks up Kobe Simmons. Help arrives from Giannis Booker! James Murray attempts a Dunk. Heavily contested by Giannis Booker (0.5 feet, ZONE)! James Murray misses. Rebound secured by Terry Durant.

[08:45] Team_036 possession (Score: 53-48)
Michael Westbrook attempts a 3Pt. Wide open! Kobe Ginobili is 8.2 feet away. [MAN] Michael Westbrook misses. Rebound secured by Draymond LaVine.

[08:34] Team_053 possession (Score: 53-48)
James Murray makes the Dunk and draws the foul on Kobe Simmons! And-1! James Murray to the line for 1. [Team fouls: 4] (Kobe Simmons: 1 personal fouls)   FT 1/1: GOOD James Murray makes 1/1 from the line.
Score: 56-48

[08:15] Team_036 possession (Score: 56-48)
Giannis Booker drives, Michael Gasol stays with him. Giannis Booker attempts a Dunk. Contested by Michael Gasol (5.1 feet, ZONE). GIANNIS BOOKER MAKES IT! Assist: Anthony Poole
Score: 56-50

[08:02] Team_053 possession (Score: 56-50)
Draymond LaVine drives, picks up Kobe Simmons. Help arrives from Giannis Booker! Draymond LaVine attempts a Layup. Contested by Giannis Booker (2.7 feet, MAN). DRAYMOND LAVINE MAKES IT!
Score: 58-50

[07:52] Team_036 possession (Score: 58-50)
Terry Durant drives to the basket... Terry Durant throws a bad pass! Stolen by Michael Gasol! TURNOVER! (live ball)

[07:37] Team_053 possession (Score: 58-50)
Kobe Ginobili attempts a 3Pt. Contested by Michael Westbrook (3.1 feet, MAN). Kobe Ginobili misses. Rebound secured by Terry Durant.

[07:22] Team_036 possession (Score: 58-50)
Anthony Poole attempts a 3Pt. Wide open! Immanuel Curry is 7.0 feet away. [MAN] Anthony Poole misses. Rebound secured by James Murray.

[07:03] Team_053 possession (Score: 58-50)
James Murray drives to the basket... FOUL! Offensive foul on James Murray! Giannis Booker drew the charge! [Team fouls: 4] (James Murray: 1 personal fouls) TURNOVER! (dead ball)

[06:54] Team_036 possession (Score: 58-50)
Terry Durant attempts a 3Pt. Wide open! Kobe Ginobili is 6.7 feet away. [ZONE] Terry Durant misses. Rebound secured by Michael Gasol.

[06:37] Team_053 possession (Score: 58-50)
Immanuel Curry attempts a 3Pt. Contested by Michael Westbrook (4.6 feet, ZONE). IMMANUEL CURRY MAKES IT! Assist: Michael Gasol
Score: 61-50

[06:19] Team_036 possession (Score: 61-50)
Anthony Poole attempts a Midrange. Contested by Immanuel Curry (4.3 feet, ZONE). Anthony Poole misses. Offensive rebound by Terry Durant! Terry Durant's putback is no good. Rebound secured by James Murray.

[06:06] Team_053 possession (Score: 61-50)
Michael Gasol attempts a Layup. Wide open! Terry Durant is 7.1 feet away. [MAN] Michael Gasol misses. Rebound secured by Terry Durant.

[05:50] Team_036 possession (Score: 61-50)
Terry Durant attempts a Midrange. Contested by Michael Gasol (4.9 feet, MAN). TERRY DURANT MAKES IT! Assist: Anthony Poole
Score: 61-52

[05:34] Team_053 possession (Score: 61-52)
Immanuel Curry attempts a 3Pt. Wide open! Anthony Poole is 8.3 feet away. [MAN] Immanuel Curry misses. Rebound secured by Giannis Booker.

[05:18] Team_036 possession (Score: 61-52)
Kobe Simmons attempts a Dunk. BLOCKED BY DRAYMOND LAVINE! Ball deflects out of bounds off Kobe Simmons.

[05:06] Team_053 possession (Score: 61-52)
Draymond LaVine attempts a Layup. BLOCKED BY KOBE SIMMONS! Ball is loose! Rebound secured by Giannis Booker.

[04:55] Team_036 possession (Score: 61-52)
Giannis Booker attempts a 3Pt. Contested by Kobe Ginobili (2.7 feet, ZONE). GIANNIS BOOKER MAKES IT! Assist: Michael Westbrook
Score: 61-55

[04:41] Team_053 possession (Score: 61-55)
Michael Gasol drives, picks up Terry Durant. Help arrives from Giannis Booker! Michael Gasol attempts a Dunk. Wide open! Giannis Booker is 6.5 feet away. [MAN] MICHAEL GASOL MAKES IT! Assist: Draymond LaVine
Score: 63-55

[04:29] Team_036 possession (Score: 63-55)
FOUL! Reach-in foul on Michael Gasol during the drive. [IN THE BONUS! 5 team fouls] Giannis Booker to the line for 2 free throws. (Michael Gasol: 2 personal fouls)   FT 1/2: GOOD   FT 2/2: GOOD Giannis Booker makes 2/2 from the line.
Score: 63-57

[04:16] Team_053 possession (Score: 63-57)
Michael Gasol attempts a Midrange. Contested by Terry Durant (2.0 feet, MAN). Michael Gasol misses. Rebound secured by Kobe Simmons.

[03:59] Team_036 possession (Score: 63-57)
Michael Westbrook attempts a 3Pt. Contested by Michael Gasol (5.7 feet, ZONE). MICHAEL WESTBROOK MAKES IT! Assist: Kobe Simmons
Score: 63-60

[03:48] Team_053 possession (Score: 63-60)
Michael Gasol drives and kicks out. Kobe Ginobili attempts a 3Pt. Contested by Michael Westbrook (3.2 feet, MAN). KOBE GINOBILI MAKES IT! Assist: Draymond LaVine
Score: 66-60

[03:35] Team_036 possession (Score: 66-60)
Michael Westbrook attempts a Midrange. Contested by Kobe Ginobili (5.9 feet, MAN). Michael Westbrook misses. Rebound secured by Draymond LaVine.

[03:22] Team_053 possession (Score: 66-60)
Draymond LaVine makes the Layup and draws the foul on Kobe Simmons! And-1! Draymond LaVine to the line for 1. [BONUS: 5 team fouls] (Kobe Simmons: 2 personal fouls)   FT 1/1: GOOD Draymond LaVine makes 1/1 from the line.
Score: 69-60

[03:06] Team_036 possession (Score: 69-60)
Terry Durant attempts a Midrange. Wide open! Immanuel Curry is 6.2 feet away. [ZONE] TERRY DURANT MAKES IT!
Score: 69-62

[02:55] Team_053 possession (Score: 69-62)
James Murray attempts a Midrange. Contested by Giannis Booker (5.3 feet, MAN). James Murray misses. Rebound secured by Kobe Simmons.

[02:43] Team_036 possession (Score: 69-62)
Kobe Simmons throws a bad pass out of bounds! TURNOVER! (dead ball)

[02:43] Substitution (Team_053): Kobe Ginobili OUT → Michael DeRozan IN (stamina_rule2)

[02:43] Substitution (Team_053): James Murray OUT → Tyrese Mitchell IN (stamina_rule2)

[02:43] Substitution (Team_053): Immanuel Curry OUT → Brandon Bryant IN (stamina_rule2)

[02:43] Substitution (Team_053): Michael Gasol OUT → Klay Anunoby IN (stamina_rule2)

[02:43] Substitution (Team_053): Draymond LaVine OUT → Devin Green IN (stamina_rule2)

[02:43] Substitution (Team_036): Michael Westbrook OUT → Dirk Anunoby IN (stamina_rule2)

[02:43] Substitution (Team_036): Terry Durant OUT → Devin Simmons IN (stamina_rule2)

[02:43] Substitution (Team_036): Kobe Simmons OUT → Bradley Murray IN (stamina_rule2)

[02:31] Team_053 possession (Score: 69-62)
FOUL! Reach-in foul on Anthony Poole during the drive. [IN THE BONUS! 6 team fouls] Brandon Bryant to the line for 2 free throws. (Anthony Poole: 1 personal fouls)   FT 1/2: GOOD   FT 2/2: MISS Brandon Bryant makes 1/2 from the line. Rebound secured by Bradley Murray.
Score: 70-62

[02:14] Team_036 possession (Score: 70-62)
Giannis Booker attempts a 3Pt. Contested by Michael DeRozan (5.1 feet, ZONE). GIANNIS BOOKER MAKES IT! Assist: Devin Simmons
Score: 70-65

[01:57] Team_053 possession (Score: 70-65)
Brandon Bryant attempts a 3Pt. Wide open! Giannis Booker is 6.9 feet away. [ZONE] BRANDON BRYANT MAKES IT! Assist: Klay Anunoby
Score: 73-65

[01:42] Team_036 possession (Score: 73-65)
Dirk Anunoby drives to the basket... FOUL! Offensive foul on Dirk Anunoby! Devin Green drew the charge! [Team fouls: 7] (Dirk Anunoby: 1 personal fouls) TURNOVER! (dead ball)

[01:26] Team_053 possession (Score: 73-65)
Devin Green drives, Bradley Murray stays with him. Devin Green attempts a Layup. Wide open! Bradley Murray is 7.5 feet away. [MAN] DEVIN GREEN MAKES IT! Assist: Michael DeRozan
Score: 75-65

[01:11] Team_036 possession (Score: 75-65)
Dirk Anunoby drives, Michael DeRozan stays with him. Dirk Anunoby attempts a Layup. Wide open! Michael DeRozan is 7.1 feet away. [MAN] DIRK ANUNOBY MAKES IT! Assist: Anthony Poole
Score: 75-67

[00:59] Team_053 possession (Score: 75-67)
Tyrese Mitchell throws a bad pass! Stolen by Giannis Booker! TURNOVER! (live ball)

[00:41] Team_036 possession (Score: 75-67)
FOUL! Holding foul on Brandon Bryant. [IN THE BONUS! 6 team fouls] Anthony Poole to the line for 2 free throws. (Brandon Bryant: 1 personal fouls)   FT 1/2: GOOD   FT 2/2: GOOD Anthony Poole makes 2/2 from the line.
Score: 75-69

[00:28] Team_053 possession (Score: 75-69)
Devin Green drives and kicks out. Tyrese Mitchell attempts a Midrange. Heavily contested by Devin Simmons (0.5 feet, ZONE)! Tyrese Mitchell misses. Rebound secured by Giannis Booker.

[00:16] Team_036 possession (Score: 75-69)
Giannis Booker attempts a 3Pt. Contested by Tyrese Mitchell (3.6 feet, MAN). GIANNIS BOOKER MAKES IT! Assist: Bradley Murray
Score: 75-72

================================================================================
                              3RD QUARTER COMPLETE                              
================================================================================

3RD QUARTER SCORE: Team_053 24, Team_036 31

BOX SCORE:
================================================================================

Team_053
--------------------------------------------------------------------------------
Player                MIN  PTS  REB  AST  TO      FG   FG%      3P   3P%
--------------------------------------------------------------------------------
Draymond LaVine        27    5    3    2   0   2/3    66.7     0/0   0.0
Michael Gasol          27    4    2    1   0   2/4    50.0     0/0   0.0
James Murray           27    3    4    0   0   1/4    25.0     0/0   0.0
Immanuel Curry         27    3    0    0   0   1/3    33.3     0/0   0.0
Kobe Ginobili          27    3    0    0   0   1/2    50.0     0/0   0.0
Brandon Bryant          9    3    0    0   0   1/2    50.0     0/0   0.0
Devin Green             9    2    0    0   0   1/2    50.0     0/0   0.0
Klay Anunoby            9    0    0    1   0   0/0     0.0     0/0   0.0
Michael DeRozan         9    0    0    1   0   0/0     0.0     0/0   0.0

TEAM: FG: 9/20 (45.0%), 3PT: 3/7 (42.9%), REB: 9 (2 off, 7 def), AST: 5, TO: 4
TEAM FOULS: 6 [Team_036 in BONUS]


Team_036
--------------------------------------------------------------------------------
Player                MIN  PTS  REB  AST  TO      FG   FG%      3P   3P%
--------------------------------------------------------------------------------
Giannis Booker         29   13    3    0   0   5/5   100.0     0/0   0.0
Terry Durant           27    8    4    0   0   3/5    60.0     0/0   0.0
Kobe Simmons           27    3    3    1   0   1/3    33.3     0/0   0.0
Michael Westbrook      27    3    0    1   0   1/3    33.3     0/0   0.0
Anthony Poole          29    2    0    3   0   1/4    25.0     0/0   0.0
Dirk Anunoby            9    2    0    0   0   1/1   100.0     0/0   0.0
Bradley Murray          9    0    1    1   0   0/0     0.0     0/0   0.0
Devin Simmons           9    0    0    1   0   0/0     0.0     0/0   0.0

TEAM: FG: 12/21 (57.1%), 3PT: 5/9 (55.6%), REB: 11 (1 off, 10 def), AST: 7, TO: 3
TEAM FOULS: 7 [Team_053 in BONUS]

================================================================================

================================================================================
                       4TH QUARTER - Team_053 vs Team_036                       
================================================================================

[12:00] Team_053 possession (Score: 75-72)
James Murray drives and kicks out. Immanuel Curry attempts a 3Pt. Wide open! Anthony Poole is 9.9 feet away. [MAN] Immanuel Curry misses. Rebound secured by Kobe Simmons.

[11:43] Team_036 possession (Score: 75-72)
Michael Westbrook drives and kicks out. Giannis Booker attempts a 3Pt. Wide open! Kobe Ginobili is 6.5 feet away. [ZONE] Giannis Booker misses. Rebound secured by Michael Gasol.

[11:30] Team_053 possession (Score: 75-72)
James Murray drives and kicks out. Kobe Ginobili attempts a 3Pt. Contested by Michael Westbrook (4.8 feet, MAN). KOBE GINOBILI MAKES IT! Assist: Draymond LaVine
Score: 78-72

[11:14] Team_036 possession (Score: 78-72)
Terry Durant attempts a Layup. Contested by Michael Gasol (4.4 feet, ZONE). Terry Durant misses. Rebound secured by Draymond LaVine.

[11:02] Team_053 possession (Score: 78-72)
Michael Gasol throws a bad pass! Stolen by Terry Durant! TURNOVER! (live ball)

[10:47] Team_036 possession (Score: 78-72)
Kobe Simmons makes the Layup and draws the foul on Draymond LaVine! And-1! Kobe Simmons to the line for 1. [Team fouls: 1] (Draymond LaVine: 1 personal fouls)   FT 1/1: GOOD Kobe Simmons makes 1/1 from the line.
Score: 78-75

[10:29] Team_053 possession (Score: 78-75)
Michael Gasol throws a bad pass! Stolen by Terry Durant! TURNOVER! (live ball)

[10:14] Team_036 possession (Score: 78-75)
FOUL! Shooting foul on James Murray. Terry Durant to the line for 2 free throws. [Team fouls: 2] (James Murray: 1 personal fouls)   FT 1/2: MISS   FT 2/2: GOOD Terry Durant makes 1/2 from the line.
Score: 78-76

[10:00] Team_053 possession (Score: 78-76)
Immanuel Curry loses the ball! Stripped by Anthony Poole! TURNOVER! (live ball)

[09:48] Team_036 possession (Score: 78-76)
Kobe Simmons attempts a Layup. Wide open! Draymond LaVine is 6.9 feet away. [MAN] KOBE SIMMONS MAKES IT! Assist: Michael Westbrook
Score: 78-78

[09:37] Team_053 possession (Score: 78-78)
Draymond LaVine attempts a Layup. Contested by Kobe Simmons (4.7 feet, MAN). Draymond LaVine misses. Rebound secured by Terry Durant.

[09:25] Team_036 possession (Score: 78-78)
Kobe Simmons attempts a Midrange. Contested by James Murray (2.1 feet, ZONE). KOBE SIMMONS MAKES IT!
Score: 78-80

[09:05] Team_053 possession (Score: 78-80)
Draymond LaVine attempts a Midrange. Contested by Kobe Simmons (5.6 feet, MAN). DRAYMOND LAVINE MAKES IT! Assist: Kobe Ginobili
Score: 80-80

[08:51] Team_036 possession (Score: 80-80)
Kobe Simmons attempts a Midrange. Contested by Draymond LaVine (4.9 feet, MAN). Kobe Simmons misses. Rebound secured by Draymond LaVine.

[08:38] Team_053 possession (Score: 80-80)
Kobe Ginobili attempts a 3Pt. Wide open! Michael Westbrook is 6.3 feet away. [ZONE] Kobe Ginobili misses. Offensive rebound by Draymond LaVine! Draymond LaVine kicks it out.

[08:24] Team_053 possession (Score: 80-80)
James Murray attempts a 3Pt. Wide open! Michael Westbrook is 6.9 feet away. [ZONE] James Murray misses. Rebound secured by Terry Durant.

[08:05] Team_036 possession (Score: 80-80)
Giannis Booker attempts a 3Pt. Contested by Kobe Ginobili (4.6 feet, ZONE). GIANNIS BOOKER MAKES IT! Assist: Kobe Simmons
Score: 80-83

[07:52] Team_053 possession (Score: 80-83)
Michael Gasol attempts a Layup. Contested by Terry Durant (5.8 feet, ZONE). Michael Gasol misses. Rebound secured by Giannis Booker.

[07:32] Team_036 possession (Score: 80-83)
Kobe Simmons makes the Layup and draws the foul on Draymond LaVine! And-1! Kobe Simmons to the line for 1. [Team fouls: 3] (Draymond LaVine: 2 personal fouls)   FT 1/1: GOOD Kobe Simmons makes 1/1 from the line.
Score: 80-86

[07:13] Team_053 possession (Score: 80-86)
Immanuel Curry attempts a 3Pt. Contested by Michael Westbrook (5.4 feet, ZONE). IMMANUEL CURRY MAKES IT! Assist: Draymond LaVine
Score: 83-86

[06:57] Team_036 possession (Score: 83-86)
Michael Westbrook drives to the basket... Michael Westbrook throws a bad pass! Stolen by Kobe Ginobili! TURNOVER! (live ball)

[06:42] Team_053 possession (Score: 83-86)
FOUL! Offensive foul on James Murray! Giannis Booker drew the charge! [Team fouls: 4] (James Murray: 2 personal fouls) TURNOVER! (dead ball)

[06:28] Team_036 possession (Score: 83-86)
Anthony Poole attempts a Midrange. Contested by Immanuel Curry (5.5 feet, MAN). Anthony Poole misses. Rebound secured by James Murray.

[06:11] Team_053 possession (Score: 83-86)
Immanuel Curry attempts a Layup. Contested by Kobe Simmons (3.2 feet, ZONE). Immanuel Curry misses. Offensive rebound by Michael Gasol! Michael Gasol puts it back in!
Score: 85-86

[05:55] Team_036 possession (Score: 85-86)
Terry Durant drives and kicks out. FOUL! Shooting foul on Kobe Ginobili. Terry Durant to the line for 3 free throws. [BONUS: 5 team fouls] (Kobe Ginobili: 1 personal fouls)   FT 1/3: GOOD   FT 2/3: GOOD   FT 3/3: GOOD Terry Durant makes 3/3 from the line.
Score: 85-89

[05:38] Team_053 possession (Score: 85-89)
Immanuel Curry attempts a Layup. Wide open! Anthony Poole is 6.9 feet away. [MAN] Immanuel Curry misses. Rebound secured by Giannis Booker.

[05:21] Team_036 possession (Score: 85-89)
Kobe Simmons makes the Layup and draws the foul on Draymond LaVine! And-1! Kobe Simmons to the line for 1. [BONUS: 6 team fouls] (Draymond LaVine: 3 personal fouls)   FT 1/1: MISS Kobe Simmons makes 0/1 from the line. Offensive rebound by Kobe Simmons! Kobe Simmons puts it back in!
Score: 85-93

[05:10] Team_053 possession (Score: 85-93)
Kobe Ginobili attempts a 3Pt. Wide open! Terry Durant is 6.3 feet away. [ZONE] KOBE GINOBILI MAKES IT!
Score: 88-93

[04:55] Team_036 possession (Score: 88-93)
FOUL! Shooting foul on James Murray. Michael Westbrook to the line for 2 free throws. [BONUS: 7 team fouls] (James Murray: 3 personal fouls)   FT 1/2: GOOD   FT 2/2: GOOD Michael Westbrook makes 2/2 from the line.
Score: 88-95

[04:43] Team_053 possession (Score: 88-95)
Immanuel Curry attempts a 3Pt. Contested by Anthony Poole (6.0 feet, MAN). IMMANUEL CURRY MAKES IT! Assist: Michael Gasol
Score: 91-95

[04:27] Team_036 possession (Score: 91-95)
Terry Durant drives, Michael Gasol stays with him. Terry Durant attempts a Layup. Contested by Michael Gasol (4.7 feet, MAN). TERRY DURANT MAKES IT! Assist: Kobe Simmons
Score: 91-97

[04:16] Team_053 possession (Score: 91-97)
James Murray attempts a Layup. Contested by Kobe Simmons (5.8 feet, ZONE). JAMES MURRAY MAKES IT! Assist: Immanuel Curry
Score: 93-97

[03:59] Team_036 possession (Score: 93-97)
FOUL! Shooting foul on Michael Gasol. Terry Durant to the line for 3 free throws. [BONUS: 8 team fouls] (Michael Gasol: 1 personal fouls)   FT 1/3: GOOD   FT 2/3: GOOD   FT 3/3: GOOD Terry Durant makes 3/3 from the line.
Score: 93-100

[03:44] Team_053 possession (Score: 93-100)
Kobe Ginobili attempts a Midrange. Wide open! Anthony Poole is 8.3 feet away. [ZONE] KOBE GINOBILI MAKES IT!
Score: 95-100

[03:31] Team_036 possession (Score: 95-100)
FOUL! Reach-in foul on Michael Gasol during the drive. [IN THE BONUS! 9 team fouls] Kobe Simmons to the line for 2 free throws. (Michael Gasol: 2 personal fouls)   FT 1/2: MISS   FT 2/2: MISS Kobe Simmons makes 0/2 from the line. Rebound secured by Draymond LaVine.

[03:12] Team_053 possession (Score: 95-100)
Immanuel Curry attempts a Layup. Wide open! Anthony Poole is 9.3 feet away. [MAN] IMMANUEL CURRY MAKES IT! Assist: Draymond LaVine
Score: 97-100

[02:55] Team_036 possession (Score: 97-100)
Anthony Poole attempts a 3Pt. Heavily contested by Immanuel Curry (1.3 feet, MAN)! Anthony Poole misses. Offensive rebound by Kobe Simmons! Kobe Simmons's putback is no good. Rebound secured by Draymond LaVine.

[02:43] Team_053 possession (Score: 97-100)
Draymond LaVine drives, Kobe Simmons stays with him. Draymond LaVine attempts a Layup. Wide open! Kobe Simmons is 8.5 feet away. [ZONE] DRAYMOND LAVINE MAKES IT!
Score: 99-100

[02:29] Team_036 possession (Score: 99-100)
Giannis Booker attempts a 3Pt. Contested by James Murray (4.9 feet, ZONE). Giannis Booker misses. Rebound secured by James Murray.

[02:13] Team_053 possession (Score: 99-100)
Michael Gasol makes the Layup and draws the foul on Kobe Simmons! And-1! Michael Gasol to the line for 1. [Team fouls: 1] (Kobe Simmons: 1 personal fouls)   FT 1/1: MISS Michael Gasol makes 0/1 from the line. Rebound secured by Giannis Booker.
Score: 101-100

[01:56] Team_036 possession (Score: 101-100)
FOUL! Shooting foul on Draymond LaVine. Kobe Simmons to the line for 2 free throws. [BONUS: 10 team fouls] (Draymond LaVine: 4 personal fouls)   FT 1/2: GOOD   FT 2/2: GOOD Kobe Simmons makes 2/2 from the line.
Score: 101-102

[01:44] Team_053 possession (Score: 101-102)
Michael Gasol throws a bad pass! Stolen by Terry Durant! TURNOVER! (live ball)

[01:25] Team_036 possession (Score: 101-102)
Michael Westbrook attempts a Layup. BLOCKED BY MICHAEL GASOL! Ball deflects out of bounds off Michael Westbrook.

[01:12] Team_053 possession (Score: 101-102)
Kobe Ginobili attempts a 3Pt. Contested by Michael Westbrook (4.6 feet, ZONE). Kobe Ginobili misses. Rebound secured by Terry Durant.

[00:59] Team_036 possession (Score: 101-102)
Kobe Simmons attempts a 3Pt. Wide open! Kobe Ginobili is 6.9 feet away. [ZONE] KOBE SIMMONS MAKES IT! Assist: Michael Westbrook
Score: 101-105

[00:43] Team_053 possession (Score: 101-105)
James Murray drives, Giannis Booker stays with him. James Murray attempts a Dunk. Wide open! Giannis Booker is 6.5 feet away. [MAN] JAMES MURRAY MAKES IT! Assist: Kobe Ginobili
Score: 103-105

[00:27] Team_036 possession (Score: 103-105)
Terry Durant attempts a Midrange. Contested by Immanuel Curry (3.8 feet, ZONE). TERRY DURANT MAKES IT!
Score: 103-107

[00:11] Team_053 possession (Score: 103-107)
Kobe Ginobili attempts a Midrange. Contested by Michael Westbrook (3.5 feet, MAN). Kobe Ginobili misses. Rebound secured by Giannis Booker.

[00:01] Team_036 possession (Score: 103-107)
Giannis Booker loses control! Ball rolls out of bounds! TURNOVER! (dead ball)

[00:01] Substitution (Team_053): Kobe Ginobili OUT → Michael DeRozan IN (stamina_rule2)

[00:01] Substitution (Team_053): James Murray OUT → Tyrese Mitchell IN (stamina_rule2)

[00:01] Substitution (Team_053): Immanuel Curry OUT → Brandon Bryant IN (stamina_rule2)

[00:01] Substitution (Team_053): Michael Gasol OUT → Klay Anunoby IN (stamina_rule2)

[00:01] Substitution (Team_053): Draymond LaVine OUT → Devin Green IN (stamina_rule2)

[00:01] Substitution (Team_036): Michael Westbrook OUT → Dirk Anunoby IN (stamina_rule2)

[00:01] Substitution (Team_036): Giannis Booker OUT → Tobias Fox IN (stamina_rule2)

[00:01] Substitution (Team_036): Anthony Poole OUT → Pascal Antetokounmpo IN (stamina_rule2)

[00:01] Substitution (Team_036): Terry Durant OUT → Devin Simmons IN (stamina_rule2)

[00:01] Substitution (Team_036): Kobe Simmons OUT → Bradley Murray IN (stamina_rule2)

================================================================================
                              4TH QUARTER COMPLETE                              
================================================================================

4TH QUARTER SCORE: Team_053 28, Team_036 35

BOX SCORE:
================================================================================

Team_053
--------------------------------------------------------------------------------
Player                MIN  PTS  REB  AST  TO      FG   FG%      3P   3P%
--------------------------------------------------------------------------------
Kobe Ginobili          39    8    0    2   0   3/5    60.0     0/0   0.0
Immanuel Curry         39    8    0    1   0   3/4    75.0     0/0   0.0
James Murray           39    4    2    0   0   2/4    50.0     0/0   0.0
Draymond LaVine        39    4    5    3   0   2/3    66.7     0/0   0.0
Michael Gasol          39    2    2    1   0   1/3    33.3     0/0   0.0

TEAM: FG: 11/19 (57.9%), 3PT: 3/5 (60.0%), REB: 8 (2 off, 6 def), AST: 7, TO: 5
TEAM FOULS: 10 [Team_036 in BONUS]


Team_036
--------------------------------------------------------------------------------
Player                MIN  PTS  REB  AST  TO      FG   FG%      3P   3P%
--------------------------------------------------------------------------------
Kobe Simmons           39   19    1    2   0   7/9    77.8     0/0   0.0
Terry Durant           39   11    3    0   0   5/6    83.3     0/0   0.0
Giannis Booker         42    3    4    0   0   1/2    50.0     0/0   0.0
Michael Westbrook      39    2    0    2   0   1/3    33.3     0/0   0.0
Anthony Poole          42    0    0    0   0   0/2     0.0     0/0   0.0

TEAM: FG: 14/22 (63.6%), 3PT: 3/5 (60.0%), REB: 9 (1 off, 8 def), AST: 4, TO: 2
TEAM FOULS: 1

================================================================================

================================================================================
                               FULL GAME COMPLETE                               
================================================================================

FINAL SCORE: Team_053 103, Team_036 107

SCORING BY QUARTER:
--------------------------------------------------------------------------------
Team                     Q1     Q2     Q3     Q4    FINAL
--------------------------------------------------------------------------------
Team_053                 31     20     24     28      103
Team_036                 22     19     31     35      107
--------------------------------------------------------------------------------

FULL GAME BOX SCORE:
================================================================================

Team_053
--------------------------------------------------------------------------------
Player                MIN  PTS  REB  AST  TO      FG   FG%      3P   3P%      FT STL BLK
--------------------------------------------------------------------------------
Kobe Ginobili          39   18    0    3   1   6/11   54.5   2/5    40.0   0/0     1   0
James Murray           39   15   14    1   4   7/13   53.8   2/4    50.0   2/3     0   1
Immanuel Curry         39   22    0    5   3  11/16   68.8   5/8    62.5   0/1     0   0
Michael Gasol          39   13    6    4   4   4/11   36.4   1/3    33.3   0/1     2   1
Draymond LaVine        39   16   14    7   1   7/10   70.0   0/0     0.0   4/4     0   1
Michael DeRozan         9    3    0    1   0   1/1   100.0   1/1   100.0   0/0     0   0
Tyrese Mitchell         9    0    0    1   1   1/3    33.3   0/1     0.0   0/0     1   0
Brandon Bryant          9    5    1    0   0   1/4    25.0   1/3    33.3   1/2     0   1
Klay Anunoby            9    0    4    1   0   0/1     0.0   0/0     0.0   0/0     0   0
Devin Green             9    4    1    0   0   2/6    33.3   0/0     0.0   0/0     0   0

TEAM: FG: 40/76 (52.6%), 3PT: 12/25 (48.0%), REB: 38 (12 off, 26 def), AST: 23, TO: 14


Team_036
--------------------------------------------------------------------------------
Player                MIN  PTS  REB  AST  TO      FG   FG%      3P   3P%      FT STL BLK
--------------------------------------------------------------------------------
Giannis Booker         42   16    8    0   2   6/11   54.5   4/5    80.0   2/2     2   0
Anthony Poole          42    5    0    4   1   2/9    22.2   1/3    33.3   2/2     2   0
Michael Westbrook      39   14    0    6   0   7/15   46.7   2/5    40.0   2/2     1   0
Terry Durant           39   28   13    3   2  12/16   75.0   2/5    40.0  10/12    3   0
Kobe Simmons           39   30   10    3   4  10/15   66.7   1/1   100.0   5/8     0   2
Dirk Anunoby            9    4    0    1   0   2/2   100.0   0/0     0.0   0/0     0   0
Devin Simmons           9    2    6    2   1   1/2    50.0   0/0     0.0   2/2     0   0
Bradley Murray          9    2    5    1   1   1/1   100.0   0/0     0.0   0/0     0   0
Tobias Fox              7    2    0    0   1   1/3    33.3   0/0     0.0   0/0     0   0
Pascal Antetokounmpo    7    4    1    2   0   2/2   100.0   0/0     0.0   0/0     0   0

TEAM: FG: 45/77 (58.4%), 3PT: 10/19 (52.6%), REB: 44 (9 off, 35 def), AST: 22, TO: 12

================================================================================
