================================================================================
                        FULL GAME - Team_050 vs Team_041                        
================================================================================

================================================================================
                       1ST QUARTER - Team_050 vs Team_041                       
================================================================================

[12:00] Team_050 possession (Score: 0-0)
Donovan Trent attempts a Layup. Heavily contested by Terry Barrett (0.5 feet, ZONE)! DONOVAN TRENT MAKES IT!
Score: 2-0

[11:45] Team_041 possession (Score: 2-0)
Jarrett Anunoby drives to the basket... Jarrett Anunoby loses control! Ball rolls out of bounds! TURNOVER! (dead ball)

[11:25] Team_050 possession (Score: 2-0)
Joel Banchero drives, Jarrett Anunoby stays with him. Joel Banchero attempts a Layup. Contested by Jarrett Anunoby (2.7 feet, MAN). Joel Banchero misses. Rebound secured by Terry Barrett.

[11:12] Team_041 possession (Score: 2-0)
Stephen Ingram attempts a Layup. BLOCKED BY DONOVAN TRENT! Ball is loose! Rebound secured by Joel Banchero.

[11:03] Team_050 possession (Score: 2-0)
Donovan Trent attempts a Midrange. Heavily contested by Terry Barrett (0.5 feet, MAN)! Donovan Trent misses. Rebound secured by Stephen Ingram.

[10:47] Team_041 possession (Score: 2-0)
FOUL! Holding foul on Giannis LaVine. [Team fouls: 1] No free throws, side out. (Giannis LaVine: 1 personal fouls)

[10:30] Team_041 possession (Score: 2-0)
Jarrett Anunoby attempts a 3Pt. Contested by LeBron Bridges (4.2 feet, ZONE). Jarrett Anunoby misses. Rebound secured by LeBron Bridges.

[10:12] Team_050 possession (Score: 2-0)
Collin Bane attempts a 3Pt. Heavily contested by Scottie Turner (2.0 feet, ZONE)! Collin Bane misses. FOUL! Loose ball foul on Dejounte Griffin during the rebound battle. [Team fouls: 1] No free throws, side out. (Dejounte Griffin: 1 personal fouls)

[09:56] Team_050 possession (Score: 2-0)
FOUL! Shooting foul on Terry Barrett. LeBron Bridges to the line for 2 free throws. [Team fouls: 2] (Terry Barrett: 1 personal fouls)   FT 1/2: GOOD   FT 2/2: GOOD LeBron Bridges makes 2/2 from the line.
Score: 4-0

[09:43] Team_041 possession (Score: 4-0)
Scottie Turner attempts a 3Pt. Contested by Giannis LaVine (3.8 feet, MAN). Scottie Turner misses. Offensive rebound by Terry Barrett! Terry Barrett puts it back in!
Score: 4-2

[09:30] Team_050 possession (Score: 4-2)
FOUL! Offensive foul on Donovan Trent! Terry Barrett drew the charge! [Team fouls: 2] (Donovan Trent: 1 personal fouls) TURNOVER! (dead ball)

[09:18] Team_041 possession (Score: 4-2)
Scottie Turner attempts a 3Pt. Contested by Giannis LaVine (2.7 feet, ZONE). SCOTTIE TURNER MAKES IT! Assist: Dejounte Griffin
Score: 4-5

[09:03] Team_050 possession (Score: 4-5)
Giannis LaVine attempts a 3Pt. Contested by Scottie Turner (4.2 feet, ZONE). Giannis LaVine misses. Rebound secured by Terry Barrett.

[08:51] Team_041 possession (Score: 4-5)
FOUL! Shooting foul on Collin Bane. Jarrett Anunoby to the line for 2 free throws. [Team fouls: 3] (Collin Bane: 1 personal fouls)   FT 1/2: GOOD   FT 2/2: GOOD Jarrett Anunoby makes 2/2 from the line.
Score: 4-7

[08:35] Team_050 possession (Score: 4-7)
Donovan Trent attempts a Midrange. BLOCKED BY TERRY BARRETT! Ball is loose! Offensive rebound by LeBron Bridges! LeBron Bridges kicks it out.

[08:21] Team_050 possession (Score: 4-7)
Donovan Trent drives and kicks out. Giannis LaVine attempts a 3Pt. Contested by Scottie Turner (2.8 feet, MAN). GIANNIS LAVINE MAKES IT! Assist: LeBron Bridges
Score: 7-7

[08:06] Team_041 possession (Score: 7-7)
Stephen Ingram attempts a Midrange. Contested by LeBron Bridges (4.0 feet, MAN). Stephen Ingram misses. FOUL! Loose ball foul on LeBron Bridges during the rebound battle. [Team fouls: 4] No free throws, side out. (LeBron Bridges: 1 personal fouls)

[07:53] Team_041 possession (Score: 7-7)
Jarrett Anunoby attempts a Midrange. Heavily contested by Collin Bane (1.4 feet, ZONE)! Jarrett Anunoby misses. Rebound secured by Collin Bane.

[07:40] Team_050 possession (Score: 7-7)
Giannis LaVine attempts a Midrange. Contested by Scottie Turner (4.6 feet, MAN). Giannis LaVine misses. Rebound secured by Terry Barrett.

[07:20] Team_041 possession (Score: 7-7)
Scottie Turner attempts a 3Pt. Contested by Giannis LaVine (3.7 feet, ZONE). Scottie Turner misses. Rebound secured by LeBron Bridges.

[07:06] Team_050 possession (Score: 7-7)
Giannis LaVine attempts a 3Pt. Contested by Scottie Turner (5.1 feet, MAN). Giannis LaVine misses. Rebound secured by Terry Barrett.

[06:48] Team_041 possession (Score: 7-7)
Jarrett Anunoby attempts a Layup. BLOCKED BY DONOVAN TRENT! Ball deflects out of bounds off Jarrett Anunoby.

[06:36] Team_050 possession (Score: 7-7)
Donovan Trent drives and kicks out. Joel Banchero attempts a Midrange. Contested by Jarrett Anunoby (3.0 feet, MAN). Joel Banchero misses. Offensive rebound by LeBron Bridges! LeBron Bridges kicks it out.

[06:21] Team_050 possession (Score: 7-7)
Giannis LaVine attempts a 3Pt. Wide open! Scottie Turner is 7.0 feet away. [MAN] Giannis LaVine misses. Rebound secured by Dejounte Griffin.

[06:08] Team_041 possession (Score: 7-7)
Jarrett Anunoby throws a bad pass out of bounds! TURNOVER! (dead ball)

[05:53] Team_050 possession (Score: 7-7)
Collin Bane attempts a Layup. Contested by Terry Barrett (3.5 feet, ZONE). Collin Bane misses. Rebound secured by Terry Barrett.

[05:39] Team_041 possession (Score: 7-7)
Jarrett Anunoby attempts a 3Pt. Wide open! Joel Banchero is 6.8 feet away. [MAN] JARRETT ANUNOBY MAKES IT! Assist: Dejounte Griffin
Score: 7-10

[05:24] Team_050 possession (Score: 7-10)
Donovan Trent attempts a 3Pt. Contested by Scottie Turner (5.1 feet, ZONE). DONOVAN TRENT MAKES IT! Assist: LeBron Bridges
Score: 10-10

[05:08] Team_041 possession (Score: 10-10)
Stephen Ingram attempts a 3Pt. Contested by Giannis LaVine (4.7 feet, ZONE). Stephen Ingram misses. Offensive rebound by Stephen Ingram! Stephen Ingram kicks it out.

[04:49] Team_041 possession (Score: 10-10)
Stephen Ingram attempts a 3Pt. Wide open! Giannis LaVine is 7.7 feet away. [ZONE] Stephen Ingram misses. Rebound secured by Joel Banchero.

[04:36] Team_050 possession (Score: 10-10)
Donovan Trent attempts a 3Pt. Contested by Scottie Turner (5.9 feet, ZONE). Donovan Trent misses. Rebound secured by Terry Barrett.

[04:25] Team_041 possession (Score: 10-10)
Stephen Ingram attempts a Midrange. Wide open! LeBron Bridges is 7.9 feet away. [MAN] Stephen Ingram misses. Rebound secured by Joel Banchero.

[04:10] Team_050 possession (Score: 10-10)
Giannis LaVine attempts a Midrange. Contested by Scottie Turner (3.8 feet, MAN). Giannis LaVine misses. Offensive rebound by Collin Bane! Collin Bane kicks it out.

[03:57] Team_050 possession (Score: 10-10)
Collin Bane attempts a 3Pt. Wide open! Dejounte Griffin is 6.1 feet away. [ZONE] COLLIN BANE MAKES IT! Assist: Giannis LaVine
Score: 13-10

[03:42] Team_041 possession (Score: 13-10)
Jarrett Anunoby attempts a Midrange. Contested by Joel Banchero (3.2 feet, MAN). JARRETT ANUNOBY MAKES IT! Assist: Scottie Turner
Score: 13-12

[03:29] Team_050 possession (Score: 13-12)
Collin Bane attempts a 3Pt. Wide open! Scottie Turner is 8.1 feet away. [ZONE] Collin Bane misses. Rebound secured by Stephen Ingram.

[03:17] Team_041 possession (Score: 13-12)
Dejounte Griffin attempts a 3Pt. Contested by Collin Bane (4.5 feet, MAN). DEJOUNTE GRIFFIN MAKES IT! Assist: Scottie Turner
Score: 13-15

[03:00] Team_050 possession (Score: 13-15)
Donovan Trent drives and kicks out. Joel Banchero attempts a 3Pt. Contested by Jarrett Anunoby (3.7 feet, MAN). JOEL BANCHERO MAKES IT! Assist: Donovan Trent
Score: 16-15

[02:46] Team_041 possession (Score: 16-15)
Scottie Turner attempts a Midrange. Heavily contested by Giannis LaVine (1.5 feet, MAN)! Scottie Turner misses. Rebound secured by Collin Bane.

[02:37] Team_050 possession (Score: 16-15)
Donovan Trent attempts a 3Pt. Contested by Scottie Turner (3.9 feet, ZONE). Donovan Trent misses. Offensive rebound by Collin Bane! Collin Bane kicks it out.

[02:18] Team_050 possession (Score: 16-15)
Giannis LaVine attempts a Midrange. Heavily contested by Dejounte Griffin (0.5 feet, ZONE)! GIANNIS LAVINE MAKES IT!
Score: 18-15

[02:08] Team_041 possession (Score: 18-15)
Jarrett Anunoby attempts a 3Pt. Wide open! Giannis LaVine is 7.6 feet away. [ZONE] Jarrett Anunoby misses. Rebound secured by Joel Banchero.

[01:52] Team_050 possession (Score: 18-15)
Joel Banchero drives, Terry Barrett stays with him. Joel Banchero attempts a Dunk. Contested by Terry Barrett (5.3 feet, ZONE). JOEL BANCHERO MAKES IT!
Score: 20-15

[01:38] Team_041 possession (Score: 20-15)
Dejounte Griffin makes the Midrange and draws the foul on Collin Bane! And-1! Dejounte Griffin to the line for 1. [BONUS: 5 team fouls] (Collin Bane: 2 personal fouls)   FT 1/1: GOOD Dejounte Griffin makes 1/1 from the line.
Score: 20-18

[01:25] Team_050 possession (Score: 20-18)
LeBron Bridges attempts a Layup. Wide open! Stephen Ingram is 6.8 feet away. [ZONE] LEBRON BRIDGES MAKES IT! Assist: Collin Bane
Score: 22-18

[01:10] Team_041 possession (Score: 22-18)
Scottie Turner attempts a Midrange. Wide open! Joel Banchero is 6.8 feet away. [ZONE] Scottie Turner misses. Rebound secured by Joel Banchero.

[00:55] Team_050 possession (Score: 22-18)
Joel Banchero attempts a 3Pt. Contested by Jarrett Anunoby (5.4 feet, MAN). JOEL BANCHERO MAKES IT! Assist: Donovan Trent
Score: 25-18

[00:38] Team_041 possession (Score: 25-18)
Scottie Turner attempts a 3Pt. Contested by Collin Bane (2.7 feet, ZONE). SCOTTIE TURNER MAKES IT! Assist: Jarrett Anunoby
Score: 25-21

[00:29] Team_050 possession (Score: 25-21)
Collin Bane throws a bad pass out of bounds! TURNOVER! (dead ball)

[00:29] Substitution (Team_050): Giannis LaVine OUT → Damian O'Neal IN (stamina_rule2)

[00:29] Substitution (Team_050): Joel Banchero OUT → Dwyane Towns IN (stamina_rule2)

[00:29] Substitution (Team_050): Collin Bane OUT → Larry Curry IN (stamina_rule2)

[00:29] Substitution (Team_050): LeBron Bridges OUT → Luka Gasol IN (stamina_rule2)

[00:29] Substitution (Team_050): Donovan Trent OUT → Tyler Smith IN (stamina_rule2)

[00:29] Substitution (Team_041): Scottie Turner OUT → Franz Rose IN (stamina_rule2)

[00:29] Substitution (Team_041): Jarrett Anunoby OUT → Kyrie Booker IN (stamina_rule2)

[00:29] Substitution (Team_041): Dejounte Griffin OUT → Bam McCollum IN (stamina_rule2)

[00:29] Substitution (Team_041): Stephen Ingram OUT → Tobias McCollum IN (stamina_rule2)

[00:29] Substitution (Team_041): Terry Barrett OUT → De'Aaron Poole IN (stamina_rule2)

[00:15] Team_041 possession (Score: 25-21)
Franz Rose throws a bad pass out of bounds! TURNOVER! (dead ball)

================================================================================
                              1ST QUARTER COMPLETE                              
================================================================================

1ST QUARTER SCORE: Team_050 25, Team_041 21

BOX SCORE:
================================================================================

Team_050
--------------------------------------------------------------------------------
Player                MIN  PTS  REB  AST  TO      FG   FG%      3P   3P%
--------------------------------------------------------------------------------
Joel Banchero          12    8    5    0   0   3/4    75.0     0/0   0.0
Donovan Trent          12    5    0    2   0   2/4    50.0     0/0   0.0
Giannis LaVine         12    5    0    1   0   2/6    33.3     0/0   0.0
LeBron Bridges         12    4    4    2   0   2/2   100.0     0/0   0.0
Collin Bane            12    3    5    1   0   1/3    33.3     0/0   0.0

TEAM: FG: 10/19 (52.6%), 3PT: 3/8 (37.5%), REB: 14 (5 off, 9 def), AST: 6, TO: 2
TEAM FOULS: 5 [Team_041 in BONUS]


Team_041
--------------------------------------------------------------------------------
Player                MIN  PTS  REB  AST  TO      FG   FG%      3P   3P%
--------------------------------------------------------------------------------
Jarrett Anunoby        12    7    0    1   0   3/7    42.9     0/0   0.0
Scottie Turner         12    6    0    2   0   2/5    40.0     0/0   0.0
Dejounte Griffin       12    6    1    2   0   2/2   100.0     0/0   0.0
Terry Barrett          12    2    7    0   0   1/1   100.0     0/0   0.0
Stephen Ingram         12    0    4    0   0   0/3     0.0     0/0   0.0

TEAM: FG: 8/18 (44.4%), 3PT: 5/9 (55.6%), REB: 12 (3 off, 9 def), AST: 5, TO: 3
TEAM FOULS: 2

================================================================================

================================================================================
                       2ND QUARTER - Team_050 vs Team_041                       
================================================================================

[12:00] Team_050 possession (Score: 25-21)
Giannis LaVine attempts a Midrange. Wide open! Dejounte Griffin is 7.9 feet away. [ZONE] Giannis LaVine misses. Rebound secured by Stephen Ingram.

[11:47] Team_041 possession (Score: 25-21)
FOUL! Reach-in foul on Donovan Trent during the drive. [Team fouls: 1] No free throws, side out. (Donovan Trent: 1 personal fouls)

[11:30] Team_041 possession (Score: 25-21)
Dejounte Griffin attempts a 3Pt. Wide open! Collin Bane is 7.3 feet away. [MAN] Dejounte Griffin misses. Rebound secured by LeBron Bridges.

[11:13] Team_050 possession (Score: 25-21)
Donovan Trent drives, Terry Barrett stays with him. Donovan Trent attempts a Dunk. Heavily contested by Terry Barrett (1.4 feet, ZONE)! Donovan Trent misses. Rebound secured by Dejounte Griffin.

[11:02] Team_041 possession (Score: 25-21)
Scottie Turner drives, Donovan Trent stays with him. Scottie Turner attempts a Layup. Wide open! Donovan Trent is 6.1 feet away. [ZONE] SCOTTIE TURNER MAKES IT! Assist: Jarrett Anunoby
Score: 25-23

[10:52] Team_050 possession (Score: 25-23)
LeBron Bridges attempts a Midrange. Contested by Jarrett Anunoby (2.1 feet, ZONE). LEBRON BRIDGES MAKES IT! Assist: Giannis LaVine
Score: 27-23

[10:38] Team_041 possession (Score: 27-23)
FOUL! Offensive foul on Scottie Turner! Giannis LaVine drew the charge! [Team fouls: 1] (Scottie Turner: 1 personal fouls) TURNOVER! (dead ball)

[10:25] Team_050 possession (Score: 27-23)
Donovan Trent makes the Dunk and draws the foul on Jarrett Anunoby! And-1! Donovan Trent to the line for 1. [Team fouls: 2] (Jarrett Anunoby: 1 personal fouls)   FT 1/1: MISS Donovan Trent makes 0/1 from the line. Rebound secured by Dejounte Griffin.
Score: 29-23

[10:10] Team_041 possession (Score: 29-23)
Dejounte Griffin drives and kicks out. Jarrett Anunoby attempts a 3Pt. Contested by Joel Banchero (5.4 feet, MAN). Jarrett Anunoby misses. FOUL! Loose ball foul on LeBron Bridges during the rebound battle. [Team fouls: 2] No free throws, side out. (LeBron Bridges: 1 personal fouls)

[09:57] Team_041 possession (Score: 29-23)
Jarrett Anunoby attempts a 3Pt. Contested by Giannis LaVine (4.4 feet, ZONE). Jarrett Anunoby misses. Rebound secured by Joel Banchero.

[09:43] Team_050 possession (Score: 29-23)
Joel Banchero attempts a Midrange. Heavily contested by Dejounte Griffin (1.5 feet, ZONE)! Joel Banchero misses. Rebound secured by Terry Barrett.

[09:27] Team_041 possession (Score: 29-23)
Jarrett Anunoby attempts a 3Pt. Contested by Joel Banchero (5.1 feet, MAN). JARRETT ANUNOBY MAKES IT! Assist: Stephen Ingram
Score: 29-26

[09:12] Team_050 possession (Score: 29-26)
FOUL! Offensive foul on LeBron Bridges! Stephen Ingram drew the charge! [Team fouls: 3] (LeBron Bridges: 2 personal fouls) TURNOVER! (dead ball)

[08:57] Team_041 possession (Score: 29-26)
Jarrett Anunoby attempts a Midrange. Wide open! Joel Banchero is 8.4 feet away. [MAN] JARRETT ANUNOBY MAKES IT! Assist: Stephen Ingram
Score: 29-28

[08:44] Team_050 possession (Score: 29-28)
Collin Bane attempts a 3Pt. Heavily contested by Scottie Turner (1.5 feet, ZONE)! COLLIN BANE MAKES IT! Assist: LeBron Bridges
Score: 32-28

[08:26] Team_041 possession (Score: 32-28)
Scottie Turner attempts a Midrange. Contested by Giannis LaVine (2.7 feet, MAN). SCOTTIE TURNER MAKES IT! Assist: Jarrett Anunoby
Score: 32-30

[08:10] Team_050 possession (Score: 32-30)
FOUL! Holding foul on Dejounte Griffin. [Team fouls: 3] No free throws, side out. (Dejounte Griffin: 1 personal fouls)

[07:57] Team_050 possession (Score: 32-30)
Joel Banchero drives, picks up Terry Barrett. Help arrives from Jarrett Anunoby! Joel Banchero attempts a Dunk. Heavily contested by Jarrett Anunoby (0.6 feet, ZONE)! JOEL BANCHERO MAKES IT!
Score: 34-30

[07:44] Team_041 possession (Score: 34-30)
Jarrett Anunoby drives and kicks out. Scottie Turner attempts a 3Pt. Wide open! Giannis LaVine is 6.8 feet away. [ZONE] Scottie Turner misses. Rebound secured by Joel Banchero.

[07:28] Team_050 possession (Score: 34-30)
Donovan Trent drives and kicks out. LeBron Bridges makes the Midrange and draws the foul on Stephen Ingram! And-1! LeBron Bridges to the line for 1. [Team fouls: 4] (Stephen Ingram: 1 personal fouls)   FT 1/1: GOOD LeBron Bridges makes 1/1 from the line.
Score: 37-30

[07:12] Team_041 possession (Score: 37-30)
Jarrett Anunoby attempts a Midrange. Wide open! Joel Banchero is 9.1 feet away. [MAN] Jarrett Anunoby misses. Rebound secured by LeBron Bridges.

[07:00] Team_050 possession (Score: 37-30)
LeBron Bridges attempts a 3Pt. Contested by Stephen Ingram (4.0 feet, MAN). LEBRON BRIDGES MAKES IT! Assist: Giannis LaVine
Score: 40-30

[06:43] Team_041 possession (Score: 40-30)
FOUL! Reach-in foul on Collin Bane during the drive. [Team fouls: 4] No free throws, side out. (Collin Bane: 1 personal fouls)

[06:31] Team_041 possession (Score: 40-30)
FOUL! Holding foul on Joel Banchero. [IN THE BONUS! 5 team fouls] Jarrett Anunoby to the line for 2 free throws. (Joel Banchero: 1 personal fouls)   FT 1/2: GOOD   FT 2/2: GOOD Jarrett Anunoby makes 2/2 from the line.
Score: 40-32

[06:17] Team_050 possession (Score: 40-32)
Giannis LaVine throws a bad pass! Stolen by Scottie Turner! TURNOVER! (live ball)

[06:05] Team_041 possession (Score: 40-32)
Jarrett Anunoby attempts a 3Pt. Wide open! Joel Banchero is 6.0 feet away. [MAN] Jarrett Anunoby misses. Rebound secured by LeBron Bridges.

[05:48] Team_050 possession (Score: 40-32)
FOUL! Shooting foul on Jarrett Anunoby. Giannis LaVine to the line for 2 free throws. [BONUS: 5 team fouls] (Jarrett Anunoby: 2 personal fouls)   FT 1/2: GOOD   FT 2/2: GOOD Giannis LaVine makes 2/2 from the line.
Score: 42-32

[05:34] Team_041 possession (Score: 42-32)
Jarrett Anunoby attempts a 3Pt. Contested by LeBron Bridges (4.2 feet, ZONE). Jarrett Anunoby misses. Rebound secured by Collin Bane.

[05:19] Team_050 possession (Score: 42-32)
FOUL! Holding foul on Stephen Ingram. [IN THE BONUS! 6 team fouls] LeBron Bridges to the line for 2 free throws. (Stephen Ingram: 2 personal fouls)   FT 1/2: GOOD   FT 2/2: GOOD LeBron Bridges makes 2/2 from the line.
Score: 44-32

[05:02] Team_041 possession (Score: 44-32)
Terry Barrett drives and kicks out. Stephen Ingram attempts a 3Pt. Contested by Giannis LaVine (4.8 feet, ZONE). STEPHEN INGRAM MAKES IT! Assist: Terry Barrett
Score: 44-35

[04:45] Team_050 possession (Score: 44-35)
Giannis LaVine drives to the basket... Giannis LaVine loses control! Ball rolls out of bounds! TURNOVER! (dead ball)

[04:45] Substitution (Team_050): Giannis LaVine OUT → Damian O'Neal IN (stamina_rule2)

[04:45] Substitution (Team_050): Joel Banchero OUT → Dwyane Towns IN (stamina_rule2)

[04:45] Substitution (Team_050): Collin Bane OUT → Larry Curry IN (stamina_rule2)

[04:45] Substitution (Team_050): LeBron Bridges OUT → Luka Gasol IN (stamina_rule2)

[04:45] Substitution (Team_050): Donovan Trent OUT → Tyler Smith IN (stamina_rule2)

[04:45] Substitution (Team_041): Scottie Turner OUT → Franz Rose IN (stamina_rule2)

[04:45] Substitution (Team_041): Jarrett Anunoby OUT → Kyrie Booker IN (stamina_rule2)

[04:45] Substitution (Team_041): Dejounte Griffin OUT → Bam McCollum IN (stamina_rule2)

[04:45] Substitution (Team_041): Stephen Ingram OUT → Tobias McCollum IN (stamina_rule2)

[04:45] Substitution (Team_041): Terry Barrett OUT → De'Aaron Poole IN (stamina_rule2)

[04:29] Team_041 possession (Score: 44-35)
De'Aaron Poole drives to the basket... De'Aaron Poole throws a bad pass out of bounds! TURNOVER! (dead ball)

[04:15] Team_050 possession (Score: 44-35)
Tyler Smith attempts a Layup. Contested by De'Aaron Poole (4.5 feet, MAN). Tyler Smith misses. Offensive rebound by Tyler Smith! Tyler Smith kicks it out.

[04:00] Team_050 possession (Score: 44-35)
Dwyane Towns drives to the basket... Dwyane Towns loses control! Ball rolls out of bounds! TURNOVER! (dead ball)

[03:42] Team_041 possession (Score: 44-35)
Bam McCollum attempts a Midrange. Contested by Larry Curry (4.9 feet, MAN). BAM MCCOLLUM MAKES IT!
Score: 44-37

[03:25] Team_050 possession (Score: 44-37)
Larry Curry drives, Bam McCollum stays with him. Larry Curry attempts a Dunk. Contested by Bam McCollum (2.5 feet, MAN). LARRY CURRY MAKES IT!
Score: 46-37

[03:10] Team_041 possession (Score: 46-37)
Bam McCollum attempts a Layup. BLOCKED BY DWYANE TOWNS! Ball is loose! Offensive rebound by De'Aaron Poole! De'Aaron Poole kicks it out.

[03:00] Team_041 possession (Score: 46-37)
Tobias McCollum makes the Midrange and draws the foul on Luka Gasol! And-1! Tobias McCollum to the line for 1. [BONUS: 6 team fouls] (Luka Gasol: 1 personal fouls)   FT 1/1: GOOD Tobias McCollum makes 1/1 from the line.
Score: 46-40

[02:45] Team_050 possession (Score: 46-40)
Luka Gasol attempts a 3Pt. Contested by Kyrie Booker (3.8 feet, ZONE). LUKA GASOL MAKES IT! Assist: Damian O'Neal
Score: 49-40

[02:29] Team_041 possession (Score: 49-40)
Tobias McCollum attempts a 3Pt. Contested by Luka Gasol (2.6 feet, MAN). TOBIAS MCCOLLUM MAKES IT! Assist: Franz Rose
Score: 49-43

[02:16] Team_050 possession (Score: 49-43)
Dwyane Towns attempts a 3Pt. Contested by Kyrie Booker (5.3 feet, ZONE). Dwyane Towns misses. Offensive rebound by Tyler Smith! Tyler Smith kicks it out.

[02:04] Team_050 possession (Score: 49-43)
Larry Curry attempts a Midrange. Wide open! Bam McCollum is 7.7 feet away. [MAN] LARRY CURRY MAKES IT! Assist: Damian O'Neal
Score: 51-43

[01:47] Team_041 possession (Score: 51-43)
FOUL! Offensive foul on De'Aaron Poole! Tyler Smith drew the charge! [Team fouls: 7] (De'Aaron Poole: 1 personal fouls) TURNOVER! (dead ball)

[01:30] Team_050 possession (Score: 51-43)
Tyler Smith drives to the basket... Tyler Smith commits a violation (traveling/carry)! TURNOVER! (dead ball)

[01:16] Team_041 possession (Score: 51-43)
Franz Rose attempts a 3Pt. Heavily contested by Damian O'Neal (1.5 feet, ZONE)! Franz Rose misses. Rebound secured by Dwyane Towns.

[01:02] Team_050 possession (Score: 51-43)
Tyler Smith drives and kicks out. Dwyane Towns attempts a Midrange. Wide open! Kyrie Booker is 6.7 feet away. [MAN] Dwyane Towns misses. Rebound secured by Tobias McCollum.

[00:49] Team_041 possession (Score: 51-43)
Kyrie Booker attempts a 3Pt. Contested by Dwyane Towns (3.7 feet, MAN). Kyrie Booker misses. Rebound secured by Tyler Smith.

[00:34] Team_050 possession (Score: 51-43)
Luka Gasol attempts a 3Pt. Contested by Franz Rose (2.2 feet, ZONE). Luka Gasol misses. Offensive rebound by Tyler Smith! Tyler Smith kicks it out.

[00:20] Team_050 possession (Score: 51-43)
Luka Gasol attempts a Midrange. Wide open! Tobias McCollum is 6.3 feet away. [MAN] Luka Gasol misses. Rebound secured by De'Aaron Poole.

[00:02] Team_041 possession (Score: 51-43)
FOUL! Reach-in foul on Dwyane Towns during the drive. [IN THE BONUS! 7 team fouls] Kyrie Booker to the line for 2 free throws. (Dwyane Towns: 1 personal fouls)   FT 1/2: GOOD   FT 2/2: MISS Kyrie Booker makes 1/2 from the line. Rebound secured by Dwyane Towns.
Score: 51-44

================================================================================
                              2ND QUARTER COMPLETE                              
================================================================================

2ND QUARTER SCORE: Team_050 26, Team_041 23

BOX SCORE:
================================================================================

Team_050
--------------------------------------------------------------------------------
Player                MIN  PTS  REB  AST  TO      FG   FG%      3P   3P%
--------------------------------------------------------------------------------
LeBron Bridges         19   10    3    1   0   4/4   100.0     0/0   0.0
Larry Curry             5    4    0    0   0   2/2   100.0     0/0   0.0
Collin Bane            19    3    1    0   0   1/1   100.0     0/0   0.0
Luka Gasol              5    3    0    0   0   1/2    50.0     0/0   0.0
Giannis LaVine         19    2    0    2   0   1/2    50.0     0/0   0.0
Joel Banchero          19    2    2    0   0   1/2    50.0     0/0   0.0
Donovan Trent          19    0    0    0   0   0/2     0.0     0/0   0.0
Tyler Smith             5    0    4    0   0   0/1     0.0     0/0   0.0
Damian O'Neal           5    0    0    2   0   0/0     0.0     0/0   0.0
Dwyane Towns            5    0    2    0   0   0/0     0.0     0/0   0.0

TEAM: FG: 10/16 (62.5%), 3PT: 3/3 (100.0%), REB: 12 (3 off, 9 def), AST: 5, TO: 5
TEAM FOULS: 7 [Team_041 in BONUS]


Team_041
--------------------------------------------------------------------------------
Player                MIN  PTS  REB  AST  TO      FG   FG%      3P   3P%
--------------------------------------------------------------------------------
Jarrett Anunoby        19    7    0    2   0   3/8    37.5     0/0   0.0
Tobias McCollum         5    6    1    0   0   2/2   100.0     0/0   0.0
Scottie Turner         19    4    0    0   0   2/2   100.0     0/0   0.0
Stephen Ingram         19    3    2    2   0   1/1   100.0     0/0   0.0
Bam McCollum            5    2    0    0   0   1/1   100.0     0/0   0.0
Dejounte Griffin       19    0    2    0   0   0/1     0.0     0/0   0.0
Terry Barrett          19    0    1    1   0   0/0     0.0     0/0   0.0
De'Aaron Poole          5    0    2    0   0   0/0     0.0     0/0   0.0
Franz Rose              5    0    0    1   0   0/1     0.0     0/0   0.0
Kyrie Booker            5    0    0    0   0   0/2     0.0     0/0   0.0

TEAM: FG: 9/18 (50.0%), 3PT: 2/8 (25.0%), REB: 8 (2 off, 6 def), AST: 6, TO: 3
TEAM FOULS: 7 [Team_050 in BONUS]

================================================================================

================================================================================
                       3RD QUARTER - Team_050 vs Team_041                       
================================================================================

[12:00] Team_050 possession (Score: 51-44)
Giannis LaVine attempts a Layup. BLOCKED BY SCOTTIE TURNER! Ball is loose! Rebound secured by Terry Barrett.

[11:47] Team_041 possession (Score: 51-44)
Jarrett Anunoby drives to the basket... Jarrett Anunoby loses the ball! Stripped by Joel Banchero! TURNOVER! (live ball)

[11:32] Team_050 possession (Score: 51-44)
FOUL! Reach-in foul on Scottie Turner during the drive. [Team fouls: 1] No free throws, side out. (Scottie Turner: 1 personal fouls)

[11:20] Team_050 possession (Score: 51-44)
Donovan Trent attempts a Layup. BLOCKED BY TERRY BARRETT! Ball is loose! Rebound secured by Dejounte Griffin.

[11:04] Team_041 possession (Score: 51-44)
Terry Barrett attempts a Midrange. Wide open! Collin Bane is 6.3 feet away. [ZONE] Terry Barrett misses. Rebound secured by LeBron Bridges.

[10:47] Team_050 possession (Score: 51-44)
Donovan Trent attempts a Midrange. Contested by Terry Barrett (2.1 feet, MAN). Donovan Trent misses. Offensive rebound by LeBron Bridges! LeBron Bridges kicks it out.

[10:33] Team_050 possession (Score: 51-44)
Donovan Trent attempts a Layup. BLOCKED BY TERRY BARRETT! Ball is loose! Offensive rebound by Collin Bane! Collin Bane kicks it out.

[10:24] Team_050 possession (Score: 51-44)
Donovan Trent attempts a 3Pt. Contested by Terry Barrett (3.1 feet, MAN). Donovan Trent misses. Rebound secured by Terry Barrett.

[10:07] Team_041 possession (Score: 51-44)
FOUL! Holding foul on Joel Banchero. [Team fouls: 1] No free throws, side out. (Joel Banchero: 1 personal fouls)

[09:49] Team_041 possession (Score: 51-44)
Jarrett Anunoby attempts a 3Pt. Contested by Collin Bane (2.3 feet, ZONE). Jarrett Anunoby misses. Rebound secured by Collin Bane.

[09:33] Team_050 possession (Score: 51-44)
FOUL! Reach-in foul on Scottie Turner during the drive. [Team fouls: 2] No free throws, side out. (Scottie Turner: 2 personal fouls)

[09:21] Team_050 possession (Score: 51-44)
Collin Bane attempts a Layup. Contested by Terry Barrett (4.2 feet, ZONE). Collin Bane misses. Rebound secured by Terry Barrett.

[09:07] Team_041 possession (Score: 51-44)
Terry Barrett attempts a Midrange. Wide open! Donovan Trent is 6.5 feet away. [MAN] Terry Barrett misses. Rebound secured by Collin Bane.

[08:56] Team_050 possession (Score: 51-44)
Collin Bane makes the Layup and draws the foul on Terry Barrett! And-1! Collin Bane to the line for 1. [Team fouls: 3] (Terry Barrett: 1 personal fouls)   FT 1/1: GOOD Collin Bane makes 1/1 from the line.
Score: 54-44

[08:38] Team_041 possession (Score: 54-44)
Jarrett Anunoby attempts a 3Pt. Contested by Joel Banchero (4.5 feet, MAN). Jarrett Anunoby misses. Rebound secured by Collin Bane.

[08:21] Team_050 possession (Score: 54-44)
Joel Banchero attempts a 3Pt. Contested by Jarrett Anunoby (2.5 feet, MAN). JOEL BANCHERO MAKES IT! Assist: Collin Bane
Score: 57-44

[08:08] Team_041 possession (Score: 57-44)
FOUL! Offensive foul on Terry Barrett! Donovan Trent drew the charge! [Team fouls: 4] (Terry Barrett: 2 personal fouls) TURNOVER! (dead ball)

[07:52] Team_050 possession (Score: 57-44)
Collin Bane drives to the basket... FOUL! Offensive foul on Collin Bane! Dejounte Griffin drew the charge! [Team fouls: 2] (Collin Bane: 1 personal fouls) TURNOVER! (dead ball)

[07:38] Team_041 possession (Score: 57-44)
FOUL! Shooting foul on Giannis LaVine. Stephen Ingram to the line for 3 free throws. [Team fouls: 3] (Giannis LaVine: 1 personal fouls)   FT 1/3: GOOD   FT 2/3: MISS   FT 3/3: GOOD Stephen Ingram makes 2/3 from the line.
Score: 57-46

[07:20] Team_050 possession (Score: 57-46)
Giannis LaVine attempts a 3Pt. BLOCKED BY SCOTTIE TURNER! Ball is loose! Rebound secured by Terry Barrett.

[07:05] Team_041 possession (Score: 57-46)
Jarrett Anunoby drives and kicks out. Jarrett Anunoby attempts a Midrange. Heavily contested by Giannis LaVine (1.8 feet, ZONE)! Jarrett Anunoby misses. FOUL! Loose ball foul on Collin Bane during the rebound battle. [Team fouls: 4] No free throws, side out. (Collin Bane: 2 personal fouls)

[06:52] Team_041 possession (Score: 57-46)
FOUL! Holding foul on Joel Banchero. [IN THE BONUS! 5 team fouls] Jarrett Anunoby to the line for 2 free throws. (Joel Banchero: 2 personal fouls)   FT 1/2: GOOD   FT 2/2: MISS Jarrett Anunoby makes 1/2 from the line. Rebound secured by Joel Banchero.
Score: 57-47

[06:33] Team_050 possession (Score: 57-47)
FOUL! Reach-in foul on Terry Barrett during the drive. [IN THE BONUS! 5 team fouls] Donovan Trent to the line for 2 free throws. (Terry Barrett: 3 personal fouls)   FT 1/2: GOOD   FT 2/2: GOOD Donovan Trent makes 2/2 from the line.
Score: 59-47

[06:19] Team_041 possession (Score: 59-47)
FOUL! Holding foul on Donovan Trent. [IN THE BONUS! 6 team fouls] Terry Barrett to the line for 2 free throws. (Donovan Trent: 1 personal fouls)   FT 1/2: GOOD   FT 2/2: GOOD Terry Barrett makes 2/2 from the line.
Score: 59-49

[06:04] Team_050 possession (Score: 59-49)
Collin Bane attempts a 3Pt. Contested by Dejounte Griffin (4.8 feet, MAN). Collin Bane misses. Offensive rebound by LeBron Bridges! LeBron Bridges kicks it out.

[05:51] Team_050 possession (Score: 59-49)
Giannis LaVine makes the Midrange and draws the foul on Scottie Turner! And-1! Giannis LaVine to the line for 1. [BONUS: 6 team fouls] (Scottie Turner: 3 personal fouls)   FT 1/1: GOOD Giannis LaVine makes 1/1 from the line.
Score: 62-49

[05:39] Team_041 possession (Score: 62-49)
FOUL! Reach-in foul on LeBron Bridges during the drive. [IN THE BONUS! 7 team fouls] Stephen Ingram to the line for 2 free throws. (LeBron Bridges: 1 personal fouls)   FT 1/2: MISS   FT 2/2: GOOD Stephen Ingram makes 1/2 from the line.
Score: 62-50

[05:29] Team_050 possession (Score: 62-50)
Joel Banchero drives and kicks out. Giannis LaVine attempts a 3Pt. Heavily contested by Scottie Turner (0.5 feet, ZONE)! Giannis LaVine misses. Rebound secured by Stephen Ingram.

[05:11] Team_041 possession (Score: 62-50)
Dejounte Griffin attempts a Midrange. Contested by Collin Bane (4.9 feet, MAN). DEJOUNTE GRIFFIN MAKES IT! Assist: Stephen Ingram
Score: 62-52

[05:00] Team_050 possession (Score: 62-52)
Donovan Trent attempts a Midrange. Contested by Terry Barrett (4.0 feet, MAN). Donovan Trent misses. Rebound secured by Terry Barrett.

[04:45] Team_041 possession (Score: 62-52)
Terry Barrett attempts a Layup. Wide open! Donovan Trent is 6.7 feet away. [MAN] TERRY BARRETT MAKES IT! Assist: Stephen Ingram
Score: 62-54

[04:32] Team_050 possession (Score: 62-54)
LeBron Bridges drives and kicks out. Collin Bane attempts a 3Pt. Wide open! Scottie Turner is 6.6 feet away. [ZONE] Collin Bane misses. FOUL! Loose ball foul on Dejounte Griffin during the rebound battle. [IN THE BONUS! 7 team fouls] LeBron Bridges to the line for 2 free throws. (Dejounte Griffin: 1 personal fouls)   FT 1/2: GOOD   FT 2/2: MISS LeBron Bridges makes 1/2 from the line. Offensive rebound by LeBron Bridges! LeBron Bridges kicks it out.
Score: 63-54

[04:19] Team_050 possession (Score: 63-54)
Collin Bane attempts a 3Pt. Wide open! Scottie Turner is 6.6 feet away. [ZONE] Collin Bane misses. Rebound secured by Terry Barrett.

[04:10] Team_041 possession (Score: 63-54)
FOUL! Reach-in foul on Collin Bane during the drive. [IN THE BONUS! 8 team fouls] Dejounte Griffin to the line for 2 free throws. (Collin Bane: 3 personal fouls)   FT 1/2: GOOD   FT 2/2: GOOD Dejounte Griffin makes 2/2 from the line.
Score: 63-56

[03:58] Team_050 possession (Score: 63-56)
Donovan Trent makes the Midrange and draws the foul on Terry Barrett! And-1! Donovan Trent to the line for 1. [BONUS: 8 team fouls] (Terry Barrett: 4 personal fouls)   FT 1/1: MISS Donovan Trent makes 0/1 from the line. Offensive rebound by Collin Bane! Collin Bane kicks it out.
Score: 65-56

[03:45] Team_050 possession (Score: 65-56)
Joel Banchero attempts a Midrange. Wide open! Stephen Ingram is 7.6 feet away. [ZONE] Joel Banchero misses. Rebound secured by Stephen Ingram.

[03:25] Team_041 possession (Score: 65-56)
Dejounte Griffin attempts a Layup. Contested by Donovan Trent (3.4 feet, ZONE). DEJOUNTE GRIFFIN MAKES IT!
Score: 65-58

[03:08] Team_050 possession (Score: 65-58)
LeBron Bridges attempts a 3Pt. Wide open! Stephen Ingram is 6.7 feet away. [MAN] LeBron Bridges misses. Rebound secured by Stephen Ingram.

[02:54] Team_041 possession (Score: 65-58)
Dejounte Griffin attempts a 3Pt. Heavily contested by Collin Bane (0.5 feet, MAN)! Dejounte Griffin misses. Rebound secured by Joel Banchero.

[02:37] Team_050 possession (Score: 65-58)
FOUL! Holding foul on Scottie Turner. [IN THE BONUS! 9 team fouls] Giannis LaVine to the line for 2 free throws. (Scottie Turner: 4 personal fouls)   FT 1/2: MISS   FT 2/2: GOOD Giannis LaVine makes 1/2 from the line.
Score: 66-58

[02:25] Team_041 possession (Score: 66-58)
Scottie Turner attempts a 3Pt. Contested by Giannis LaVine (5.3 feet, MAN). Scottie Turner misses. Offensive rebound by Stephen Ingram! Stephen Ingram kicks it out.

[02:10] Team_041 possession (Score: 66-58)
Scottie Turner makes the Layup and draws the foul on Giannis LaVine! And-1! Scottie Turner to the line for 1. [BONUS: 9 team fouls] (Giannis LaVine: 2 personal fouls)   FT 1/1: GOOD Scottie Turner makes 1/1 from the line.
Score: 66-61

[01:55] Team_050 possession (Score: 66-61)
Joel Banchero attempts a 3Pt. Contested by Scottie Turner (3.3 feet, ZONE). Joel Banchero misses. Rebound secured by Terry Barrett.

[01:37] Team_041 possession (Score: 66-61)
Terry Barrett attempts a Midrange. Contested by Collin Bane (3.9 feet, ZONE). Terry Barrett misses. Rebound secured by LeBron Bridges.

[01:21] Team_050 possession (Score: 66-61)
Joel Banchero makes the Layup and draws the foul on Terry Barrett! And-1! Joel Banchero to the line for 1. [BONUS: 10 team fouls] (Terry Barrett: 5 personal fouls)   FT 1/1: GOOD Joel Banchero makes 1/1 from the line.
Score: 69-61

[01:08] Team_041 possession (Score: 69-61)
Stephen Ingram drives, Donovan Trent stays with him. Stephen Ingram attempts a Layup. Wide open! Donovan Trent is 6.8 feet away. [ZONE] STEPHEN INGRAM MAKES IT!
Score: 69-63

[00:51] Team_050 possession (Score: 69-63)
Giannis LaVine attempts a 3Pt. Wide open! Scottie Turner is 7.7 feet away. [MAN] Giannis LaVine misses. Rebound secured by Stephen Ingram.

[00:34] Team_041 possession (Score: 69-63)
Stephen Ingram attempts a Midrange. Contested by LeBron Bridges (5.9 feet, ZONE). STEPHEN INGRAM MAKES IT! Assist: Scottie Turner
Score: 69-65

[00:22] Team_050 possession (Score: 69-65)
FOUL! Reach-in foul on Dejounte Griffin during the drive. [IN THE BONUS! 11 team fouls] Collin Bane to the line for 2 free throws. (Dejounte Griffin: 2 personal fouls)   FT 1/2: GOOD   FT 2/2: GOOD Collin Bane makes 2/2 from the line.
Score: 71-65

[00:08] Team_041 possession (Score: 71-65)
Scottie Turner makes the Layup and draws the foul on Donovan Trent! And-1! Scottie Turner to the line for 1. [BONUS: 10 team fouls] (Donovan Trent: 2 personal fouls)   FT 1/1: GOOD Scottie Turner makes 1/1 from the line.
Score: 71-68

================================================================================
                              3RD QUARTER COMPLETE                              
================================================================================

3RD QUARTER SCORE: Team_050 20, Team_041 24

BOX SCORE:
================================================================================

Team_050
--------------------------------------------------------------------------------
Player                MIN  PTS  REB  AST  TO      FG   FG%      3P   3P%
--------------------------------------------------------------------------------
Joel Banchero          31    6    2    0   0   2/5    40.0     0/0   0.0
Collin Bane            31    5    5    1   0   2/4    50.0     0/0   0.0
Giannis LaVine         31    4    0    0   0   2/5    40.0     0/0   0.0
Donovan Trent          31    2    0    0   0   1/4    25.0     0/0   0.0
LeBron Bridges         31    0    5    0   0   0/1     0.0     0/0   0.0

TEAM: FG: 7/19 (36.8%), 3PT: 1/7 (14.3%), REB: 12 (5 off, 7 def), AST: 1, TO: 1
TEAM FOULS: 10 [Team_041 in BONUS]


Team_041
--------------------------------------------------------------------------------
Player                MIN  PTS  REB  AST  TO      FG   FG%      3P   3P%
--------------------------------------------------------------------------------
Stephen Ingram         31    7    5    2   0   4/4   100.0     0/0   0.0
Dejounte Griffin       31    6    1    0   0   3/4    75.0     0/0   0.0
Scottie Turner         31    6    0    1   0   2/2   100.0     0/0   0.0
Terry Barrett          31    4    8    0   0   2/5    40.0     0/0   0.0
Jarrett Anunoby        31    0    0    0   0   0/2     0.0     0/0   0.0

TEAM: FG: 11/18 (61.1%), 3PT: 1/4 (25.0%), REB: 14 (2 off, 12 def), AST: 3, TO: 2
TEAM FOULS: 11 [Team_050 in BONUS]

================================================================================

================================================================================
                       4TH QUARTER - Team_050 vs Team_041                       
================================================================================

[12:00] Team_050 possession (Score: 71-68)
FOUL! Reach-in foul on Terry Barrett during the drive. [Team fouls: 1] No free throws, side out. (Terry Barrett: 1 personal fouls)

[11:47] Team_050 possession (Score: 71-68)
LeBron Bridges attempts a 3Pt. Wide open! Dejounte Griffin is 9.4 feet away. [ZONE] LeBron Bridges misses. Rebound secured by Dejounte Griffin.

[11:30] Team_041 possession (Score: 71-68)
Terry Barrett attempts a Layup. Contested by Donovan Trent (4.8 feet, MAN). TERRY BARRETT MAKES IT!
Score: 71-70

[11:17] Team_050 possession (Score: 71-70)
Donovan Trent attempts a Layup. Contested by Terry Barrett (3.5 feet, ZONE). Donovan Trent misses. Rebound secured by Terry Barrett.

[11:02] Team_041 possession (Score: 71-70)
Stephen Ingram attempts a Layup. Wide open! Donovan Trent is 7.7 feet away. [ZONE] STEPHEN INGRAM MAKES IT! Assist: Scottie Turner
Score: 71-72

[10:45] Team_050 possession (Score: 71-72)
Giannis LaVine attempts a 3Pt. Wide open! Dejounte Griffin is 6.3 feet away. [ZONE] Giannis LaVine misses. Rebound secured by Stephen Ingram.

[10:35] Team_041 possession (Score: 71-72)
Scottie Turner loses the ball! Stripped by Giannis LaVine! TURNOVER! (live ball)

[10:24] Team_050 possession (Score: 71-72)
Joel Banchero attempts a 3Pt. Contested by Jarrett Anunoby (4.6 feet, MAN). JOEL BANCHERO MAKES IT! Assist: Giannis LaVine
Score: 74-72

[10:10] Team_041 possession (Score: 74-72)
Terry Barrett drives to the basket... FOUL! Offensive foul on Terry Barrett! Donovan Trent drew the charge! [Team fouls: 2] (Terry Barrett: 2 personal fouls) TURNOVER! (dead ball)

[10:01] Team_050 possession (Score: 74-72)
Donovan Trent drives, Terry Barrett stays with him. Donovan Trent attempts a Dunk. Contested by Terry Barrett (4.1 feet, ZONE). Donovan Trent misses. Rebound secured by Dejounte Griffin.

[09:44] Team_041 possession (Score: 74-72)
Jarrett Anunoby makes the Layup and draws the foul on Donovan Trent! And-1! Jarrett Anunoby to the line for 1. [Team fouls: 1] (Donovan Trent: 1 personal fouls)   FT 1/1: GOOD Jarrett Anunoby makes 1/1 from the line.
Score: 74-75

[09:30] Team_050 possession (Score: 74-75)
Joel Banchero attempts a 3Pt. Wide open! Scottie Turner is 6.3 feet away. [ZONE] JOEL BANCHERO MAKES IT! Assist: LeBron Bridges
Score: 77-75

[09:18] Team_041 possession (Score: 77-75)
Stephen Ingram attempts a 3Pt. Contested by LeBron Bridges (5.1 feet, MAN). STEPHEN INGRAM MAKES IT! Assist: Terry Barrett
Score: 77-78

[09:02] Team_050 possession (Score: 77-78)
Joel Banchero attempts a 3Pt. Wide open! Jarrett Anunoby is 7.3 feet away. [MAN] Joel Banchero misses. Rebound secured by Stephen Ingram.

[08:43] Team_041 possession (Score: 77-78)
Terry Barrett drives, picks up Donovan Trent. Help arrives from Joel Banchero! Terry Barrett attempts a Dunk. Wide open! Joel Banchero is 9.9 feet away. [MAN] Terry Barrett misses. Rebound secured by Collin Bane.

[08:28] Team_050 possession (Score: 77-78)
LeBron Bridges attempts a Midrange. Contested by Stephen Ingram (3.0 feet, MAN). LeBron Bridges misses. Rebound secured by Dejounte Griffin.

[08:18] Team_041 possession (Score: 77-78)
Scottie Turner drives, picks up Giannis LaVine. Help arrives from Collin Bane! Scottie Turner attempts a Dunk. Contested by Collin Bane (5.0 feet, MAN). SCOTTIE TURNER MAKES IT! Assist: Dejounte Griffin
Score: 77-80

[08:05] Team_050 possession (Score: 77-80)
Joel Banchero attempts a Midrange. Contested by Terry Barrett (3.3 feet, ZONE). JOEL BANCHERO MAKES IT!
Score: 79-80

[07:53] Team_041 possession (Score: 79-80)
Stephen Ingram throws a bad pass! Stolen by LeBron Bridges! TURNOVER! (live ball)

[07:38] Team_050 possession (Score: 79-80)
LeBron Bridges attempts a Midrange. Wide open! Dejounte Griffin is 6.4 feet away. [ZONE] LeBron Bridges misses. Rebound secured by Dejounte Griffin.

[07:19] Team_041 possession (Score: 79-80)
Terry Barrett attempts a Layup. BLOCKED BY DONOVAN TRENT! Ball goes out off Donovan Trent. Terry Barrett's ball!

[07:05] Team_041 possession (Score: 79-80)
Stephen Ingram attempts a Midrange. Contested by Joel Banchero (4.1 feet, ZONE). Stephen Ingram misses. Rebound secured by Collin Bane.

[06:51] Team_050 possession (Score: 79-80)
LeBron Bridges attempts a Layup. Wide open! Terry Barrett is 6.2 feet away. [ZONE] LEBRON BRIDGES MAKES IT! Assist: Collin Bane
Score: 81-80

[06:37] Team_041 possession (Score: 81-80)
Dejounte Griffin drives to the basket... Dejounte Griffin commits a violation (traveling/carry)! TURNOVER! (dead ball)

[06:37] Substitution (Team_050): Giannis LaVine OUT → Damian O'Neal IN (stamina_rule2)

[06:37] Substitution (Team_050): Joel Banchero OUT → Dwyane Towns IN (stamina_rule2)

[06:37] Substitution (Team_050): Collin Bane OUT → Larry Curry IN (stamina_rule2)

[06:37] Substitution (Team_050): LeBron Bridges OUT → Luka Gasol IN (stamina_rule2)

[06:37] Substitution (Team_050): Donovan Trent OUT → Tyler Smith IN (stamina_rule2)

[06:37] Substitution (Team_041): Scottie Turner OUT → Franz Rose IN (stamina_rule2)

[06:37] Substitution (Team_041): Jarrett Anunoby OUT → Kyrie Booker IN (stamina_rule2)

[06:37] Substitution (Team_041): Dejounte Griffin OUT → Bam McCollum IN (stamina_rule2)

[06:37] Substitution (Team_041): Stephen Ingram OUT → Tobias McCollum IN (stamina_rule2)

[06:37] Substitution (Team_041): Terry Barrett OUT → De'Aaron Poole IN (stamina_rule2)

[06:22] Team_050 possession (Score: 81-80)
Damian O'Neal loses the ball! Stripped by Franz Rose! TURNOVER! (live ball)

[06:07] Team_041 possession (Score: 81-80)
Kyrie Booker attempts a 3Pt. Contested by Luka Gasol (5.0 feet, ZONE). KYRIE BOOKER MAKES IT!
Score: 81-83

[05:49] Team_050 possession (Score: 81-83)
Dwyane Towns attempts a 3Pt. Contested by Kyrie Booker (4.8 feet, ZONE). Dwyane Towns misses. Rebound secured by Tobias McCollum.

[05:33] Team_041 possession (Score: 81-83)
Tobias McCollum attempts a 3Pt. Contested by Luka Gasol (5.6 feet, ZONE). Tobias McCollum misses. Rebound secured by Tyler Smith.

[05:21] Team_050 possession (Score: 81-83)
FOUL! Reach-in foul on Tobias McCollum during the drive. [Team fouls: 3] No free throws, side out. (Tobias McCollum: 1 personal fouls)

[05:04] Team_050 possession (Score: 81-83)
Tyler Smith attempts a Midrange. Contested by De'Aaron Poole (4.5 feet, MAN). TYLER SMITH MAKES IT!
Score: 83-83

[04:50] Team_041 possession (Score: 83-83)
Franz Rose drives to the basket... Franz Rose loses control! Ball rolls out of bounds! TURNOVER! (dead ball)

[04:40] Team_050 possession (Score: 83-83)
Damian O'Neal attempts a 3Pt. Heavily contested by Kyrie Booker (1.2 feet, ZONE)! Damian O'Neal misses. Offensive rebound by Tyler Smith! Tyler Smith kicks it out.

[04:27] Team_050 possession (Score: 83-83)
FOUL! Shooting foul on De'Aaron Poole. Tyler Smith to the line for 2 free throws. [Team fouls: 4] (De'Aaron Poole: 1 personal fouls)   FT 1/2: GOOD   FT 2/2: GOOD Tyler Smith makes 2/2 from the line.
Score: 85-83

[04:11] Team_041 possession (Score: 85-83)
Bam McCollum attempts a 3Pt. Contested by Larry Curry (3.2 feet, ZONE). BAM MCCOLLUM MAKES IT! Assist: Kyrie Booker
Score: 85-86

[04:01] Team_050 possession (Score: 85-86)
Luka Gasol attempts a Midrange. Heavily contested by Tobias McCollum (1.8 feet, MAN)! Luka Gasol misses. Rebound secured by Kyrie Booker.

[03:42] Team_041 possession (Score: 85-86)
Franz Rose makes the Dunk and draws the foul on Tyler Smith! And-1! Franz Rose to the line for 1. [Team fouls: 2] (Tyler Smith: 1 personal fouls)   FT 1/1: GOOD Franz Rose makes 1/1 from the line.
Score: 85-89

[03:28] Team_050 possession (Score: 85-89)
Damian O'Neal attempts a 3Pt. Contested by Kyrie Booker (5.2 feet, ZONE). Damian O'Neal misses. Offensive rebound by Larry Curry! Larry Curry kicks it out.

[03:12] Team_050 possession (Score: 85-89)
Larry Curry drives and kicks out. Tyler Smith attempts a Midrange. Wide open! Bam McCollum is 9.1 feet away. [ZONE] Tyler Smith misses. Rebound secured by Tobias McCollum.

[03:00] Team_041 possession (Score: 85-89)
Franz Rose attempts a Midrange. Wide open! Damian O'Neal is 6.1 feet away. [MAN] FRANZ ROSE MAKES IT! Assist: Kyrie Booker
Score: 85-91

[02:45] Team_050 possession (Score: 85-91)
Luka Gasol attempts a Midrange. Contested by Bam McCollum (5.2 feet, ZONE). Luka Gasol misses. FOUL! Loose ball foul on De'Aaron Poole during the rebound battle. [IN THE BONUS! 5 team fouls] Tyler Smith to the line for 2 free throws. (De'Aaron Poole: 2 personal fouls)   FT 1/2: GOOD   FT 2/2: GOOD Tyler Smith makes 2/2 from the line.
Score: 87-91

[02:32] Team_041 possession (Score: 87-91)
De'Aaron Poole attempts a Midrange. Contested by Tyler Smith (3.6 feet, MAN). DE'AARON POOLE MAKES IT!
Score: 87-93

[02:20] Team_050 possession (Score: 87-93)
Luka Gasol drives to the basket... Luka Gasol throws a bad pass out of bounds! TURNOVER! (dead ball)

[02:03] Team_041 possession (Score: 87-93)
Kyrie Booker attempts a 3Pt. Contested by Luka Gasol (3.3 feet, ZONE). Kyrie Booker misses. Offensive rebound by De'Aaron Poole! De'Aaron Poole's putback is no good. Offensive rebound by De'Aaron Poole! De'Aaron Poole kicks it out.

[01:52] Team_041 possession (Score: 87-93)
Tobias McCollum attempts a 3Pt. Wide open! Luka Gasol is 6.9 feet away. [ZONE] Tobias McCollum misses. Rebound secured by Larry Curry.

[01:38] Team_050 possession (Score: 87-93)
FOUL! Offensive foul on Larry Curry! Bam McCollum drew the charge! [Team fouls: 3] (Larry Curry: 1 personal fouls) TURNOVER! (dead ball)

[01:23] Team_041 possession (Score: 87-93)
De'Aaron Poole attempts a Midrange. Contested by Tyler Smith (3.0 feet, MAN). DE'AARON POOLE MAKES IT!
Score: 87-95

[01:07] Team_050 possession (Score: 87-95)
Larry Curry loses control! Ball rolls out of bounds! TURNOVER! (dead ball)

[00:54] Team_041 possession (Score: 87-95)
Tobias McCollum attempts a Layup. BLOCKED BY TYLER SMITH! Ball deflects out of bounds off Tobias McCollum.

[00:42] Team_050 possession (Score: 87-95)
Tyler Smith drives to the basket... Tyler Smith loses control! Ball rolls out of bounds! TURNOVER! (dead ball)

[00:27] Team_041 possession (Score: 87-95)
Franz Rose attempts a 3Pt. Contested by Luka Gasol (5.7 feet, ZONE). FRANZ ROSE MAKES IT! Assist: Bam McCollum
Score: 87-98

[00:10] Team_050 possession (Score: 87-98)
Larry Curry attempts a 3Pt. Contested by Kyrie Booker (3.2 feet, ZONE). LARRY CURRY MAKES IT! Assist: Luka Gasol
Score: 90-98

================================================================================
                              4TH QUARTER COMPLETE                              
================================================================================

4TH QUARTER SCORE: Team_050 19, Team_041 30

BOX SCORE:
================================================================================

Team_050
--------------------------------------------------------------------------------
Player                MIN  PTS  REB  AST  TO      FG   FG%      3P   3P%
--------------------------------------------------------------------------------
Joel Banchero          37    8    0    0   0   3/4    75.0     0/0   0.0
Tyler Smith            11    6    2    0   0   3/3   100.0     0/0   0.0
Larry Curry            11    3    2    0   0   1/2    50.0     0/0   0.0
LeBron Bridges         37    2    0    1   0   1/4    25.0     0/0   0.0
Donovan Trent          37    0    0    0   0   0/2     0.0     0/0   0.0
Giannis LaVine         37    0    0    1   0   0/1     0.0     0/0   0.0
Collin Bane            37    0    2    1   0   0/0     0.0     0/0   0.0
Dwyane Towns           11    0    0    0   0   0/1     0.0     0/0   0.0
Luka Gasol             11    0    0    1   0   0/1     0.0     0/0   0.0

TEAM: FG: 8/18 (44.4%), 3PT: 3/7 (42.9%), REB: 6 (2 off, 4 def), AST: 4, TO: 5
TEAM FOULS: 3


Team_041
--------------------------------------------------------------------------------
Player                MIN  PTS  REB  AST  TO      FG   FG%      3P   3P%
--------------------------------------------------------------------------------
Franz Rose             11    8    0    0   0   3/3   100.0     0/0   0.0
Stephen Ingram         37    5    2    0   0   2/3    66.7     0/0   0.0
De'Aaron Poole         11    4    1    0   0   2/2   100.0     0/0   0.0
Jarrett Anunoby        37    3    0    0   0   1/1   100.0     0/0   0.0
Kyrie Booker           11    3    1    2   0   1/1   100.0     0/0   0.0
Bam McCollum           11    3    0    1   0   1/1   100.0     0/0   0.0
Terry Barrett          37    2    1    1   0   1/2    50.0     0/0   0.0
Scottie Turner         37    2    0    1   0   1/1   100.0     0/0   0.0
Dejounte Griffin       37    0    4    1   0   0/0     0.0     0/0   0.0
Tobias McCollum        11    0    2    0   0   0/3     0.0     0/0   0.0

TEAM: FG: 12/17 (70.6%), 3PT: 4/6 (66.7%), REB: 11 (1 off, 10 def), AST: 6, TO: 5
TEAM FOULS: 5 [Team_050 in BONUS]

================================================================================

================================================================================
                               FULL GAME COMPLETE                               
================================================================================

FINAL SCORE: Team_050 90, Team_041 98

SCORING BY QUARTER:
--------------------------------------------------------------------------------
Team                     Q1     Q2     Q3     Q4    FINAL
--------------------------------------------------------------------------------
Team_050                 25     26     20     19       90
Team_041                 21     23     24     30       98
--------------------------------------------------------------------------------

FULL GAME BOX SCORE:
================================================================================

Team_050
--------------------------------------------------------------------------------
Player                MIN  PTS  REB  AST  TO      FG   FG%      3P   3P%      FT STL BLK
--------------------------------------------------------------------------------
Giannis LaVine         37   11    0    4   1   3/12   25.0   0/6     0.0   4/5     1   0
Joel Banchero          37   24    9    0   0   8/14   57.1   4/6    66.7   1/1     1   0
Collin Bane            37   11   13    3   2   4/8    50.0   2/4    50.0   3/3     0   0
LeBron Bridges         37   16   12    4   2   5/9    55.6   1/3    33.3   6/7     1   0
Donovan Trent          37    7    0    2   1   6/15   40.0   1/3    33.3   2/4     0   3
Damian O'Neal          11    0    0    2   1   0/0     0.0   0/0     0.0   0/0     0   0
Dwyane Towns           11    0    2    0   2   0/1     0.0   0/1     0.0   0/0     0   1
Larry Curry            11    7    2    0   4   3/4    75.0   1/1   100.0   0/0     0   0
Luka Gasol             11    3    0    1   0   2/4    50.0   1/1   100.0   0/0     0   0
Tyler Smith            11    6    6    0   0   2/3    66.7   0/0     0.0   4/4     0   1

TEAM: FG: 35/72 (48.6%), 3PT: 10/25 (40.0%), REB: 44 (15 off, 29 def), AST: 16, TO: 13


Team_041
--------------------------------------------------------------------------------
Player                MIN  PTS  REB  AST  TO      FG   FG%      3P   3P%      FT STL BLK
--------------------------------------------------------------------------------
Scottie Turner         37   18    0    4   2   8/11   72.7   3/4    75.0   2/2     1   2
Jarrett Anunoby        37   17    0    3   2   6/17   35.3   2/9    22.2   6/7     0   0
Dejounte Griffin       37   12    8    3   2   5/7    71.4   1/3    33.3   3/3     0   0
Stephen Ingram         37   15   13    4   2   6/10   60.0   2/3    66.7   3/5     0   0
Terry Barrett          37    8   17    2   1   3/7    42.9   0/0     0.0   2/2     0   3
Franz Rose             11    8    0    1   2   3/4    75.0   1/2    50.0   1/1     1   0
Kyrie Booker           11    3    1    2   0   1/3    33.3   1/2    50.0   1/2     0   0
Bam McCollum           11    5    0    1   1   2/2   100.0   1/1   100.0   0/0     0   0
Tobias McCollum        11    6    3    0   0   2/5    40.0   1/3    33.3   1/1     0   0
De'Aaron Poole         11    4    3    0   1   2/2   100.0   0/0     0.0   0/0     0   0

TEAM: FG: 40/71 (56.3%), 3PT: 12/27 (44.4%), REB: 45 (8 off, 37 def), AST: 20, TO: 13

================================================================================
