================================================================================
                        FULL GAME - Team_012 vs Team_033                        
================================================================================

================================================================================
                       1ST QUARTER - Team_012 vs Team_033                       
================================================================================

[12:00] Team_012 possession (Score: 0-0)
Shaquille Booker attempts a Midrange. Contested by Cade Randle (2.7 feet, MAN). Shaquille Booker misses. Rebound secured by Desmond DeRozan.

[11:44] Team_033 possession (Score: 0-0)
Chris Anunoby attempts a 3Pt. Heavily contested by RJ Nowitzki (1.7 feet, ZONE)! Chris Anunoby misses. FOUL! Loose ball foul on Ayo McGrady during the rebound battle. [Team fouls: 1] No free throws, side out. (Ayo McGrady: 1 personal fouls)

[11:31] Team_033 possession (Score: 0-0)
Cade Randle attempts a Layup. Heavily contested by Shaquille Booker (0.5 feet, MAN)! Cade Randle misses. Rebound secured by Ayo McGrady.

[11:18] Team_012 possession (Score: 0-0)
RJ Nowitzki attempts a 3Pt. Contested by Joel Green (5.8 feet, ZONE). RJ NOWITZKI MAKES IT! Assist: Ayo McGrady
Score: 3-0

[11:03] Team_033 possession (Score: 3-0)
Joel Green drives, Paolo Durant stays with him. Joel Green attempts a Layup. Contested by Paolo Durant (3.1 feet, ZONE). Joel Green misses. Offensive rebound by Bradley Simmons! Bradley Simmons puts it back in!
Score: 3-2

[10:46] Team_012 possession (Score: 3-2)
FOUL! Shooting foul on Cade Randle. RJ Nowitzki to the line for 2 free throws. [Team fouls: 1] (Cade Randle: 1 personal fouls)   FT 1/2: MISS   FT 2/2: GOOD RJ Nowitzki makes 1/2 from the line.
Score: 4-2

[10:27] Team_033 possession (Score: 4-2)
Desmond DeRozan attempts a Layup. Contested by Paolo Durant (2.0 feet, ZONE). Desmond DeRozan misses. Rebound secured by Paolo Durant.

[10:12] Team_012 possession (Score: 4-2)
Pascal Herro attempts a 3Pt. Wide open! Joel Green is 7.5 feet away. [MAN] Pascal Herro misses. Rebound secured by Desmond DeRozan.

[09:57] Team_033 possession (Score: 4-2)
Chris Anunoby attempts a Midrange. Heavily contested by Shaquille Booker (0.5 feet, ZONE)! CHRIS ANUNOBY MAKES IT!
Score: 4-4

[09:41] Team_012 possession (Score: 4-4)
RJ Nowitzki drives to the basket... RJ Nowitzki throws a bad pass! Stolen by Bradley Simmons! TURNOVER! (live ball)

[09:29] Team_033 possession (Score: 4-4)
Cade Randle attempts a 3Pt. Contested by Pascal Herro (5.1 feet, ZONE). Cade Randle misses. Rebound secured by Ayo McGrady.

[09:18] Team_012 possession (Score: 4-4)
Pascal Herro attempts a 3Pt. Wide open! Desmond DeRozan is 7.3 feet away. [ZONE] Pascal Herro misses. Rebound secured by Bradley Simmons.

[09:07] Team_033 possession (Score: 4-4)
Chris Anunoby attempts a Layup. Contested by Paolo Durant (2.4 feet, ZONE). CHRIS ANUNOBY MAKES IT! Assist: Bradley Simmons
Score: 4-6

[08:53] Team_012 possession (Score: 4-6)
FOUL! Offensive foul on Ayo McGrady! Bradley Simmons drew the charge! [Team fouls: 2] (Ayo McGrady: 2 personal fouls) TURNOVER! (dead ball)

[08:36] Team_033 possession (Score: 4-6)
Joel Green attempts a 3Pt. Contested by Pascal Herro (3.7 feet, MAN). Joel Green misses. Rebound secured by RJ Nowitzki.

[08:26] Team_012 possession (Score: 4-6)
RJ Nowitzki makes the Layup and draws the foul on Bradley Simmons! And-1! RJ Nowitzki to the line for 1. [Team fouls: 2] (Bradley Simmons: 1 personal fouls)   FT 1/1: GOOD RJ Nowitzki makes 1/1 from the line.
Score: 7-6

[08:11] Team_033 possession (Score: 7-6)
Bradley Simmons attempts a Midrange. Contested by Paolo Durant (4.6 feet, ZONE). Bradley Simmons misses. Rebound secured by RJ Nowitzki.

[07:54] Team_012 possession (Score: 7-6)
Shaquille Booker drives and kicks out. Shaquille Booker attempts a 3Pt. Heavily contested by Joel Green (1.8 feet, ZONE)! SHAQUILLE BOOKER MAKES IT!
Score: 10-6

[07:39] Team_033 possession (Score: 10-6)
Bradley Simmons drives, Ayo McGrady stays with him. Bradley Simmons attempts a Layup. Heavily contested by Ayo McGrady (0.7 feet, MAN)! BRADLEY SIMMONS MAKES IT! Assist: Joel Green
Score: 10-8

[07:26] Team_012 possession (Score: 10-8)
RJ Nowitzki drives and kicks out. Ayo McGrady attempts a 3Pt. Heavily contested by Bradley Simmons (1.6 feet, MAN)! Ayo McGrady misses. Rebound secured by Cade Randle.

[07:11] Team_033 possession (Score: 10-8)
Joel Green attempts a 3Pt. Contested by RJ Nowitzki (4.3 feet, ZONE). Joel Green misses. Rebound secured by Paolo Durant.

[06:55] Team_012 possession (Score: 10-8)
Pascal Herro attempts a 3Pt. Contested by Joel Green (5.3 feet, MAN). PASCAL HERRO MAKES IT! Assist: Paolo Durant
Score: 13-8

[06:41] Team_033 possession (Score: 13-8)
Desmond DeRozan attempts a Layup. Contested by Paolo Durant (2.1 feet, MAN). DESMOND DEROZAN MAKES IT!
Score: 13-10

[06:27] Team_012 possession (Score: 13-10)
Paolo Durant attempts a Layup. Contested by Desmond DeRozan (3.7 feet, MAN). PAOLO DURANT MAKES IT! Assist: Pascal Herro
Score: 15-10

[06:13] Team_033 possession (Score: 15-10)
Bradley Simmons attempts a 3Pt. Contested by RJ Nowitzki (3.3 feet, ZONE). Bradley Simmons misses. Rebound secured by RJ Nowitzki.

[06:01] Team_012 possession (Score: 15-10)
Pascal Herro drives and kicks out. Ayo McGrady attempts a Midrange. Contested by Bradley Simmons (5.9 feet, MAN). Ayo McGrady misses. Rebound secured by Bradley Simmons.

[05:47] Team_033 possession (Score: 15-10)
Bradley Simmons drives, picks up Paolo Durant. Help arrives from RJ Nowitzki! Bradley Simmons attempts a Layup. Heavily contested by RJ Nowitzki (1.1 feet, ZONE)! BRADLEY SIMMONS MAKES IT! Assist: Chris Anunoby
Score: 15-12

[05:33] Team_012 possession (Score: 15-12)
RJ Nowitzki attempts a Layup. Wide open! Chris Anunoby is 6.6 feet away. [MAN] RJ Nowitzki misses. Rebound secured by Bradley Simmons.

[05:21] Team_033 possession (Score: 15-12)
Chris Anunoby drives, picks up RJ Nowitzki. Help arrives from Pascal Herro! Chris Anunoby attempts a Layup. Contested by Pascal Herro (3.5 feet, MAN). CHRIS ANUNOBY MAKES IT! Assist: Bradley Simmons
Score: 15-14

[05:09] Team_012 possession (Score: 15-14)
Pascal Herro attempts a 3Pt. Contested by Joel Green (2.1 feet, ZONE). Pascal Herro misses. Rebound secured by Desmond DeRozan.

[04:58] Team_033 possession (Score: 15-14)
Chris Anunoby attempts a 3Pt. Heavily contested by RJ Nowitzki (1.1 feet, ZONE)! CHRIS ANUNOBY MAKES IT! Assist: Bradley Simmons
Score: 15-17

[04:44] Team_012 possession (Score: 15-17)
Pascal Herro drives and kicks out. RJ Nowitzki attempts a 3Pt. Wide open! Desmond DeRozan is 9.0 feet away. [ZONE] RJ NOWITZKI MAKES IT! Assist: Shaquille Booker
Score: 18-17

[04:26] Team_033 possession (Score: 18-17)
Cade Randle attempts a 3Pt. Wide open! Shaquille Booker is 6.1 feet away. [MAN] CADE RANDLE MAKES IT! Assist: Chris Anunoby
Score: 18-20

[04:08] Team_012 possession (Score: 18-20)
Ayo McGrady attempts a Layup. Heavily contested by Bradley Simmons (1.7 feet, ZONE)! AYO MCGRADY MAKES IT!
Score: 20-20

[03:57] Team_033 possession (Score: 20-20)
Cade Randle drives, picks up Shaquille Booker. Help arrives from RJ Nowitzki! Cade Randle attempts a Dunk. Wide open! RJ Nowitzki is 7.0 feet away. [MAN] Cade Randle misses. Rebound secured by RJ Nowitzki.

[03:46] Team_012 possession (Score: 20-20)
Pascal Herro attempts a 3Pt. Contested by Joel Green (5.7 feet, MAN). Pascal Herro misses. Rebound secured by Bradley Simmons.

[03:30] Team_033 possession (Score: 20-20)
Cade Randle attempts a 3Pt. Contested by RJ Nowitzki (5.7 feet, ZONE). Cade Randle misses. Offensive rebound by Cade Randle! Cade Randle puts it back in!
Score: 20-22

[03:15] Team_012 possession (Score: 20-22)
Pascal Herro attempts a 3Pt. Contested by Chris Anunoby (3.2 feet, ZONE). Pascal Herro misses. Rebound secured by Bradley Simmons.

[03:03] Team_033 possession (Score: 20-22)
Chris Anunoby attempts a Layup. Heavily contested by Paolo Durant (0.5 feet, ZONE)! CHRIS ANUNOBY MAKES IT! Assist: Cade Randle
Score: 20-24

[02:47] Team_012 possession (Score: 20-24)
Shaquille Booker attempts a Midrange. Contested by Cade Randle (3.3 feet, MAN). Shaquille Booker misses. Offensive rebound by RJ Nowitzki! RJ Nowitzki kicks it out.

[02:35] Team_012 possession (Score: 20-24)
Paolo Durant commits a violation (traveling/carry)! TURNOVER! (dead ball)

[02:35] Substitution (Team_012): Pascal Herro OUT → Desmond Irving IN (stamina_rule2)

[02:35] Substitution (Team_012): RJ Nowitzki OUT → Jalen Barnes IN (stamina_rule2)

[02:35] Substitution (Team_012): Shaquille Booker OUT → Domantas Bird IN (stamina_rule2)

[02:35] Substitution (Team_012): Paolo Durant OUT → Jimmy Quickley IN (stamina_rule2)

[02:35] Substitution (Team_012): Ayo McGrady OUT → Karl Young IN (stamina_rule2)

[02:35] Substitution (Team_033): Joel Green OUT → Ben Anthony IN (stamina_rule2)

[02:35] Substitution (Team_033): Chris Anunoby OUT → Manu Irving IN (stamina_rule2)

[02:35] Substitution (Team_033): Desmond DeRozan OUT → Zion Adebayo IN (stamina_rule2)

[02:35] Substitution (Team_033): Bradley Simmons OUT → Tim Griffin IN (stamina_rule2)

[02:22] Team_033 possession (Score: 20-24)
Manu Irving attempts a 3Pt. Wide open! Jalen Barnes is 6.1 feet away. [MAN] Manu Irving misses. Offensive rebound by Cade Randle! Cade Randle puts it back in!
Score: 20-26

[02:06] Team_012 possession (Score: 20-26)
Domantas Bird attempts a 3Pt. Contested by Cade Randle (3.6 feet, MAN). Domantas Bird misses. Rebound secured by Tim Griffin.

[01:49] Team_033 possession (Score: 20-26)
Tim Griffin drives and kicks out. Tim Griffin attempts a 3Pt. Contested by Desmond Irving (3.7 feet, ZONE). Tim Griffin misses. Rebound secured by Karl Young.

[01:35] Team_012 possession (Score: 20-26)
Domantas Bird drives and kicks out. Jalen Barnes attempts a 3Pt. Contested by Manu Irving (3.7 feet, MAN). JALEN BARNES MAKES IT!
Score: 23-26

[01:19] Team_033 possession (Score: 23-26)
Ben Anthony attempts a Layup. Wide open! Jimmy Quickley is 9.7 feet away. [ZONE] BEN ANTHONY MAKES IT! Assist: Cade Randle
Score: 23-28

[01:05] Team_012 possession (Score: 23-28)
Karl Young attempts a Midrange. Heavily contested by Manu Irving (1.1 feet, ZONE)! Karl Young misses. Rebound secured by Zion Adebayo.

[00:54] Team_033 possession (Score: 23-28)
Ben Anthony attempts a 3Pt. Contested by Desmond Irving (4.6 feet, MAN). Ben Anthony misses. Rebound secured by Jalen Barnes.

[00:37] Team_012 possession (Score: 23-28)
Karl Young makes the Dunk and draws the foul on Manu Irving! And-1! Karl Young to the line for 1. [Team fouls: 3] (Manu Irving: 1 personal fouls)   FT 1/1: GOOD Karl Young makes 1/1 from the line.
Score: 26-28

[00:24] Team_033 possession (Score: 26-28)
Ben Anthony drives, Desmond Irving stays with him. Ben Anthony attempts a Layup. Contested by Desmond Irving (3.9 feet, MAN). BEN ANTHONY MAKES IT! Assist: Tim Griffin
Score: 26-30

[00:07] Team_012 possession (Score: 26-30)
Desmond Irving makes the Layup and draws the foul on Ben Anthony! And-1! Desmond Irving to the line for 1. [Team fouls: 4] (Ben Anthony: 1 personal fouls)   FT 1/1: GOOD Desmond Irving makes 1/1 from the line.
Score: 29-30

================================================================================
                              1ST QUARTER COMPLETE                              
================================================================================

1ST QUARTER SCORE: Team_012 29, Team_033 30

BOX SCORE:
================================================================================

Team_012
--------------------------------------------------------------------------------
Player                MIN  PTS  REB  AST  TO      FG   FG%      3P   3P%
--------------------------------------------------------------------------------
RJ Nowitzki            10   10    5    0   0   4/6    66.7     0/0   0.0
Shaquille Booker       10    3    0    1   0   1/2    50.0     0/0   0.0
Pascal Herro           10    3    0    1   0   1/7    14.3     0/0   0.0
Karl Young              2    3    1    0   0   1/2    50.0     0/0   0.0
Jalen Barnes            2    3    1    0   0   1/1   100.0     0/0   0.0
Desmond Irving          2    3    0    0   0   1/1   100.0     0/0   0.0
Ayo McGrady            10    2    2    1   0   1/1   100.0     0/0   0.0
Paolo Durant           10    2    2    1   0   1/1   100.0     0/0   0.0
Domantas Bird           2    0    0    0   0   0/1     0.0     0/0   0.0

TEAM: FG: 11/22 (50.0%), 3PT: 2/8 (25.0%), REB: 11 (1 off, 10 def), AST: 4, TO: 3
TEAM FOULS: 2


Team_033
--------------------------------------------------------------------------------
Player                MIN  PTS  REB  AST  TO      FG   FG%      3P   3P%
--------------------------------------------------------------------------------
Chris Anunoby          10   11    0    2   0   5/5   100.0     0/0   0.0
Cade Randle            12    7    3    2   0   3/6    50.0     0/0   0.0
Bradley Simmons        10    6    7    3   0   3/5    60.0     0/0   0.0
Ben Anthony             2    4    0    0   0   2/3    66.7     0/0   0.0
Desmond DeRozan        10    2    3    0   0   1/2    50.0     0/0   0.0
Joel Green             10    0    0    1   0   0/2     0.0     0/0   0.0
Tim Griffin             2    0    1    1   0   0/1     0.0     0/0   0.0
Zion Adebayo            2    0    1    0   0   0/0     0.0     0/0   0.0

TEAM: FG: 14/24 (58.3%), 3PT: 4/9 (44.4%), REB: 15 (4 off, 11 def), AST: 9, TO: 0
TEAM FOULS: 4

================================================================================

================================================================================
                       2ND QUARTER - Team_012 vs Team_033                       
================================================================================

[12:00] Team_012 possession (Score: 29-30)
Shaquille Booker drives, Bradley Simmons stays with him. Shaquille Booker attempts a Layup. Contested by Bradley Simmons (2.3 feet, ZONE). Shaquille Booker misses. Rebound secured by Desmond DeRozan.

[11:48] Team_033 possession (Score: 29-30)
Bradley Simmons drives, Paolo Durant stays with him. Bradley Simmons attempts a Dunk. Contested by Paolo Durant (3.4 feet, ZONE). Bradley Simmons misses. FOUL! Loose ball foul on Ayo McGrady during the rebound battle. [Team fouls: 1] No free throws, side out. (Ayo McGrady: 1 personal fouls)

[11:36] Team_033 possession (Score: 29-30)
Desmond DeRozan attempts a 3Pt. Heavily contested by RJ Nowitzki (1.7 feet, ZONE)! Desmond DeRozan misses. Rebound secured by RJ Nowitzki.

[11:17] Team_012 possession (Score: 29-30)
RJ Nowitzki attempts a 3Pt. Contested by Chris Anunoby (3.7 feet, MAN). RJ Nowitzki misses. Rebound secured by Bradley Simmons.

[11:06] Team_033 possession (Score: 29-30)
Chris Anunoby drives and kicks out. Bradley Simmons attempts a 3Pt. Wide open! Ayo McGrady is 6.6 feet away. [MAN] BRADLEY SIMMONS MAKES IT! Assist: Chris Anunoby
Score: 29-33

[10:56] Team_012 possession (Score: 29-33)
Ayo McGrady drives and kicks out. Ayo McGrady attempts a 3Pt. Contested by Bradley Simmons (4.8 feet, MAN). AYO MCGRADY MAKES IT! Assist: RJ Nowitzki
Score: 32-33

[10:44] Team_033 possession (Score: 32-33)
FOUL! Holding foul on Pascal Herro. [Team fouls: 2] No free throws, side out. (Pascal Herro: 1 personal fouls)

[10:30] Team_033 possession (Score: 32-33)
Chris Anunoby drives, picks up RJ Nowitzki. Help arrives from Pascal Herro! Chris Anunoby attempts a Dunk. Contested by Pascal Herro (4.2 feet, MAN). CHRIS ANUNOBY MAKES IT! Assist: Cade Randle
Score: 32-35

[10:15] Team_012 possession (Score: 32-35)
RJ Nowitzki attempts a Layup. Wide open! Bradley Simmons is 6.2 feet away. [ZONE] RJ Nowitzki misses. Rebound secured by Chris Anunoby.

[10:03] Team_033 possession (Score: 32-35)
Chris Anunoby makes the Layup and draws the foul on RJ Nowitzki! And-1! Chris Anunoby to the line for 1. [Team fouls: 3] (RJ Nowitzki: 1 personal fouls)   FT 1/1: GOOD Chris Anunoby makes 1/1 from the line.
Score: 32-38

[09:46] Team_012 possession (Score: 32-38)
FOUL! Reach-in foul on Bradley Simmons during the drive. [Team fouls: 1] No free throws, side out. (Bradley Simmons: 1 personal fouls)

[09:35] Team_012 possession (Score: 32-38)
RJ Nowitzki makes the Layup and draws the foul on Bradley Simmons! And-1! RJ Nowitzki to the line for 1. [Team fouls: 2] (Bradley Simmons: 2 personal fouls)   FT 1/1: MISS RJ Nowitzki makes 0/1 from the line. Rebound secured by Desmond DeRozan.
Score: 34-38

[09:25] Team_033 possession (Score: 34-38)
FOUL! Holding foul on Ayo McGrady. [Team fouls: 4] No free throws, side out. (Ayo McGrady: 2 personal fouls)

[09:11] Team_033 possession (Score: 34-38)
Desmond DeRozan attempts a Midrange. Contested by RJ Nowitzki (3.7 feet, ZONE). Desmond DeRozan misses. Rebound secured by RJ Nowitzki.

[08:54] Team_012 possession (Score: 34-38)
Ayo McGrady throws a bad pass! Stolen by Bradley Simmons! TURNOVER! (live ball)

[08:40] Team_033 possession (Score: 34-38)
Chris Anunoby attempts a 3Pt. Contested by RJ Nowitzki (2.6 feet, MAN). CHRIS ANUNOBY MAKES IT! Assist: Desmond DeRozan
Score: 34-41

[08:24] Team_012 possession (Score: 34-41)
Pascal Herro attempts a 3Pt. Contested by Joel Green (5.7 feet, MAN). Pascal Herro misses. Rebound secured by Bradley Simmons.

[08:12] Team_033 possession (Score: 34-41)
Desmond DeRozan attempts a Midrange. Contested by Paolo Durant (2.8 feet, MAN). DESMOND DEROZAN MAKES IT! Assist: Bradley Simmons
Score: 34-43

[08:03] Team_012 possession (Score: 34-43)
Ayo McGrady attempts a Layup. Contested by Bradley Simmons (4.2 feet, MAN). Ayo McGrady misses. Rebound secured by Bradley Simmons.

[07:44] Team_033 possession (Score: 34-43)
Bradley Simmons attempts a 3Pt. Contested by RJ Nowitzki (2.4 feet, ZONE). Bradley Simmons misses. Rebound secured by RJ Nowitzki.

[07:33] Team_012 possession (Score: 34-43)
Shaquille Booker attempts a Midrange. Contested by Cade Randle (2.6 feet, MAN). SHAQUILLE BOOKER MAKES IT! Assist: Pascal Herro
Score: 36-43

[07:23] Team_033 possession (Score: 36-43)
FOUL! Holding foul on Shaquille Booker. [IN THE BONUS! 5 team fouls] Cade Randle to the line for 2 free throws. (Shaquille Booker: 1 personal fouls)   FT 1/2: MISS   FT 2/2: MISS Cade Randle makes 0/2 from the line. Rebound secured by RJ Nowitzki.

[07:06] Team_012 possession (Score: 36-43)
RJ Nowitzki attempts a Layup. Wide open! Bradley Simmons is 6.6 feet away. [ZONE] RJ NOWITZKI MAKES IT! Assist: Shaquille Booker
Score: 38-43

[06:48] Team_033 possession (Score: 38-43)
Bradley Simmons attempts a Midrange. Contested by Ayo McGrady (5.0 feet, MAN). Bradley Simmons misses. Rebound secured by RJ Nowitzki.

[06:33] Team_012 possession (Score: 38-43)
Pascal Herro attempts a 3Pt. Contested by Joel Green (4.5 feet, ZONE). Pascal Herro misses. Offensive rebound by Paolo Durant! Paolo Durant puts it back in!
Score: 40-43

[06:20] Team_033 possession (Score: 40-43)
Bradley Simmons attempts a Layup. Contested by Ayo McGrady (3.7 feet, MAN). Bradley Simmons misses. Offensive rebound by Desmond DeRozan! Desmond DeRozan kicks it out.

[06:03] Team_033 possession (Score: 40-43)
Desmond DeRozan attempts a 3Pt. Contested by Shaquille Booker (4.7 feet, ZONE). Desmond DeRozan misses. Rebound secured by RJ Nowitzki.

[05:48] Team_012 possession (Score: 40-43)
Paolo Durant drives, Bradley Simmons stays with him. Paolo Durant attempts a Layup. Wide open! Bradley Simmons is 7.0 feet away. [ZONE] PAOLO DURANT MAKES IT!
Score: 42-43

[05:34] Team_033 possession (Score: 42-43)
Desmond DeRozan attempts a 3Pt. Contested by RJ Nowitzki (3.0 feet, ZONE). Desmond DeRozan misses. Rebound secured by Paolo Durant.

[05:20] Team_012 possession (Score: 42-43)
Paolo Durant attempts a 3Pt. Contested by Desmond DeRozan (3.9 feet, MAN). Paolo Durant misses. Rebound secured by Chris Anunoby.

[05:06] Team_033 possession (Score: 42-43)
Cade Randle attempts a 3Pt. Contested by Shaquille Booker (5.4 feet, MAN). Cade Randle misses. Rebound secured by Paolo Durant.

[04:51] Team_012 possession (Score: 42-43)
RJ Nowitzki makes the Layup and draws the foul on Chris Anunoby! And-1! RJ Nowitzki to the line for 1. [Team fouls: 3] (Chris Anunoby: 1 personal fouls)   FT 1/1: GOOD RJ Nowitzki makes 1/1 from the line.
Score: 45-43

[04:37] Team_033 possession (Score: 45-43)
Joel Green attempts a 3Pt. Wide open! Pascal Herro is 7.7 feet away. [MAN] Joel Green misses. Rebound secured by Paolo Durant.

[04:22] Team_012 possession (Score: 45-43)
Pascal Herro attempts a Layup. Wide open! Desmond DeRozan is 7.6 feet away. [ZONE] PASCAL HERRO MAKES IT! Assist: Paolo Durant
Score: 47-43

[04:05] Team_033 possession (Score: 47-43)
Cade Randle throws a bad pass out of bounds! TURNOVER! (dead ball)

[04:05] Substitution (Team_012): Pascal Herro OUT → Desmond Irving IN (stamina_rule2)

[04:05] Substitution (Team_012): RJ Nowitzki OUT → Jalen Barnes IN (stamina_rule2)

[04:05] Substitution (Team_012): Shaquille Booker OUT → Domantas Bird IN (stamina_rule2)

[04:05] Substitution (Team_012): Paolo Durant OUT → Jimmy Quickley IN (stamina_rule2)

[04:05] Substitution (Team_012): Ayo McGrady OUT → Karl Young IN (stamina_rule2)

[04:05] Substitution (Team_033): Joel Green OUT → Ben Anthony IN (stamina_rule2)

[04:05] Substitution (Team_033): Chris Anunoby OUT → Manu Irving IN (stamina_rule2)

[04:05] Substitution (Team_033): Cade Randle OUT → Terry Jokic IN (stamina_rule2)

[04:05] Substitution (Team_033): Desmond DeRozan OUT → Zion Adebayo IN (stamina_rule2)

[04:05] Substitution (Team_033): Bradley Simmons OUT → Tim Griffin IN (stamina_rule2)

[03:48] Team_012 possession (Score: 47-43)
FOUL! Reach-in foul on Tim Griffin during the drive. [Team fouls: 4] No free throws, side out. (Tim Griffin: 1 personal fouls)

[03:34] Team_012 possession (Score: 47-43)
FOUL! Shooting foul on Manu Irving. Jalen Barnes to the line for 2 free throws. [BONUS: 5 team fouls] (Manu Irving: 1 personal fouls)   FT 1/2: GOOD   FT 2/2: GOOD Jalen Barnes makes 2/2 from the line.
Score: 49-43

[03:24] Team_033 possession (Score: 49-43)
Zion Adebayo attempts a Midrange. Wide open! Jalen Barnes is 6.5 feet away. [ZONE] ZION ADEBAYO MAKES IT!
Score: 49-45

[03:09] Team_012 possession (Score: 49-45)
Karl Young drives, Tim Griffin stays with him. Karl Young attempts a Dunk. Wide open! Tim Griffin is 6.0 feet away. [ZONE] KARL YOUNG MAKES IT! Assist: Jalen Barnes
Score: 51-45

[02:56] Team_033 possession (Score: 51-45)
Ben Anthony attempts a Midrange. Wide open! Jalen Barnes is 8.0 feet away. [ZONE] BEN ANTHONY MAKES IT!
Score: 51-47

[02:43] Team_012 possession (Score: 51-47)
Domantas Bird attempts a 3Pt. Contested by Terry Jokic (5.4 feet, MAN). Domantas Bird misses. Rebound secured by Zion Adebayo.

[02:31] Team_033 possession (Score: 51-47)
Terry Jokic drives to the basket... FOUL! Offensive foul on Terry Jokic! Jimmy Quickley drew the charge! [Team fouls: 6] (Terry Jokic: 1 personal fouls) TURNOVER! (dead ball)

[02:15] Team_012 possession (Score: 51-47)
Jalen Barnes drives to the basket... Jalen Barnes loses control! Ball rolls out of bounds! TURNOVER! (dead ball)

[02:03] Team_033 possession (Score: 51-47)
Terry Jokic attempts a 3Pt. Wide open! Domantas Bird is 6.7 feet away. [MAN] TERRY JOKIC MAKES IT! Assist: Manu Irving
Score: 51-50

[01:49] Team_012 possession (Score: 51-50)
Jimmy Quickley attempts a Layup. Contested by Zion Adebayo (4.8 feet, MAN). Jimmy Quickley misses. Rebound secured by Terry Jokic.

[01:32] Team_033 possession (Score: 51-50)
Manu Irving makes the Layup and draws the foul on Jalen Barnes! And-1! Manu Irving to the line for 1. [BONUS: 6 team fouls] (Jalen Barnes: 1 personal fouls)   FT 1/1: GOOD Manu Irving makes 1/1 from the line.
Score: 51-53

[01:16] Team_012 possession (Score: 51-53)
Karl Young drives, Tim Griffin stays with him. Karl Young attempts a Dunk. Contested by Tim Griffin (2.1 feet, MAN). KARL YOUNG MAKES IT! Assist: Desmond Irving
Score: 53-53

[01:01] Team_033 possession (Score: 53-53)
Terry Jokic attempts a 3Pt. Wide open! Desmond Irving is 6.3 feet away. [ZONE] TERRY JOKIC MAKES IT! Assist: Tim Griffin
Score: 53-56

[00:48] Team_012 possession (Score: 53-56)
Jimmy Quickley attempts a 3Pt. Wide open! Ben Anthony is 7.3 feet away. [ZONE] Jimmy Quickley misses. Rebound secured by Zion Adebayo.

[00:34] Team_033 possession (Score: 53-56)
Tim Griffin commits a violation (traveling/carry)! TURNOVER! (dead ball)

[00:24] Team_012 possession (Score: 53-56)
Jalen Barnes attempts a Midrange. Contested by Tim Griffin (3.5 feet, ZONE). Jalen Barnes misses. Rebound secured by Terry Jokic.

[00:10] Team_033 possession (Score: 53-56)
Ben Anthony attempts a 3Pt. Contested by Jalen Barnes (4.9 feet, ZONE). BEN ANTHONY MAKES IT!
Score: 53-59

================================================================================
                              2ND QUARTER COMPLETE                              
================================================================================

2ND QUARTER SCORE: Team_012 24, Team_033 29

BOX SCORE:
================================================================================

Team_012
--------------------------------------------------------------------------------
Player                MIN  PTS  REB  AST  TO      FG   FG%      3P   3P%
--------------------------------------------------------------------------------
RJ Nowitzki            18    5    6    1   0   2/5    40.0     0/0   0.0
Paolo Durant           18    4    4    1   0   2/3    66.7     0/0   0.0
Karl Young              6    4    0    0   0   2/2   100.0     0/0   0.0
Ayo McGrady            18    3    0    0   0   1/2    50.0     0/0   0.0
Shaquille Booker       18    2    0    1   0   1/2    50.0     0/0   0.0
Pascal Herro           18    2    0    1   0   1/2    50.0     0/0   0.0
Jalen Barnes            6    2    0    1   0   1/2    50.0     0/0   0.0
Domantas Bird           6    0    0    0   0   0/1     0.0     0/0   0.0
Jimmy Quickley          6    0    0    0   0   0/2     0.0     0/0   0.0
Desmond Irving          6    0    0    1   0   0/0     0.0     0/0   0.0

TEAM: FG: 10/21 (47.6%), 3PT: 1/6 (16.7%), REB: 10 (1 off, 9 def), AST: 6, TO: 2
TEAM FOULS: 6 [Team_033 in BONUS]


Team_033
--------------------------------------------------------------------------------
Player                MIN  PTS  REB  AST  TO      FG   FG%      3P   3P%
--------------------------------------------------------------------------------
Chris Anunoby          18    8    2    1   0   3/3   100.0     0/0   0.0
Terry Jokic             4    6    2    0   0   2/2   100.0     0/0   0.0
Ben Anthony             6    5    0    0   0   2/2   100.0     0/0   0.0
Bradley Simmons        18    3    4    1   0   1/3    33.3     0/0   0.0
Manu Irving             6    3    0    1   0   1/1   100.0     0/0   0.0
Desmond DeRozan        18    2    3    1   0   1/5    20.0     0/0   0.0
Zion Adebayo            6    2    2    0   0   1/1   100.0     0/0   0.0
Cade Randle            20    0    0    1   0   0/1     0.0     0/0   0.0
Joel Green             18    0    0    0   0   0/1     0.0     0/0   0.0
Tim Griffin             6    0    0    1   0   0/0     0.0     0/0   0.0

TEAM: FG: 11/20 (55.0%), 3PT: 4/10 (40.0%), REB: 13 (2 off, 11 def), AST: 6, TO: 3
TEAM FOULS: 6 [Team_012 in BONUS]

================================================================================

================================================================================
                       3RD QUARTER - Team_012 vs Team_033                       
================================================================================

[12:00] Team_012 possession (Score: 53-59)
Paolo Durant attempts a Layup. Contested by Desmond DeRozan (5.3 feet, MAN). PAOLO DURANT MAKES IT!
Score: 55-59

[11:47] Team_033 possession (Score: 55-59)
Joel Green attempts a Midrange. Contested by Pascal Herro (5.7 feet, MAN). JOEL GREEN MAKES IT!
Score: 55-61

[11:30] Team_012 possession (Score: 55-61)
Shaquille Booker drives, picks up Bradley Simmons. Help arrives from Chris Anunoby! Shaquille Booker attempts a Dunk. Contested by Chris Anunoby (5.5 feet, ZONE). SHAQUILLE BOOKER MAKES IT! Assist: Paolo Durant
Score: 57-61

[11:19] Team_033 possession (Score: 57-61)
Joel Green attempts a Midrange. Heavily contested by Pascal Herro (1.1 feet, MAN)! JOEL GREEN MAKES IT! Assist: Bradley Simmons
Score: 57-63

[11:03] Team_012 possession (Score: 57-63)
RJ Nowitzki attempts a 3Pt. Wide open! Joel Green is 6.8 feet away. [ZONE] RJ Nowitzki misses. FOUL! Loose ball foul on Desmond DeRozan during the rebound battle. [Team fouls: 1] No free throws, side out. (Desmond DeRozan: 1 personal fouls)

[10:49] Team_012 possession (Score: 57-63)
Ayo McGrady attempts a Midrange. Contested by Bradley Simmons (2.8 feet, MAN). Ayo McGrady misses. Rebound secured by Bradley Simmons.

[10:37] Team_033 possession (Score: 57-63)
Cade Randle attempts a 3Pt. Contested by RJ Nowitzki (5.5 feet, ZONE). Cade Randle misses. Offensive rebound by Bradley Simmons! Bradley Simmons's putback is no good. Rebound secured by Ayo McGrady.

[10:20] Team_012 possession (Score: 57-63)
RJ Nowitzki attempts a 3Pt. Wide open! Joel Green is 7.5 feet away. [ZONE] RJ Nowitzki misses. Rebound secured by Bradley Simmons.

[10:04] Team_033 possession (Score: 57-63)
FOUL! Holding foul on Shaquille Booker. [Team fouls: 1] No free throws, side out. (Shaquille Booker: 1 personal fouls)

[09:45] Team_033 possession (Score: 57-63)
Desmond DeRozan throws a bad pass out of bounds! TURNOVER! (dead ball)

[09:32] Team_012 possession (Score: 57-63)
FOUL! Reach-in foul on Joel Green during the drive. [Team fouls: 2] No free throws, side out. (Joel Green: 1 personal fouls)

[09:15] Team_012 possession (Score: 57-63)
RJ Nowitzki attempts a 3Pt. Wide open! Chris Anunoby is 7.0 feet away. [MAN] RJ NOWITZKI MAKES IT!
Score: 60-63

[09:03] Team_033 possession (Score: 60-63)
Joel Green attempts a Midrange. Wide open! Pascal Herro is 7.9 feet away. [ZONE] Joel Green misses. Rebound secured by Ayo McGrady.

[08:48] Team_012 possession (Score: 60-63)
Shaquille Booker attempts a 3Pt. Contested by Desmond DeRozan (5.5 feet, ZONE). SHAQUILLE BOOKER MAKES IT! Assist: RJ Nowitzki
Score: 63-63

[08:36] Team_033 possession (Score: 63-63)
FOUL! Holding foul on Paolo Durant. [Team fouls: 2] No free throws, side out. (Paolo Durant: 1 personal fouls)

[08:25] Team_033 possession (Score: 63-63)
Cade Randle attempts a 3Pt. Contested by Shaquille Booker (2.4 feet, MAN). Cade Randle misses. Rebound secured by Paolo Durant.

[08:14] Team_012 possession (Score: 63-63)
Paolo Durant attempts a Layup. Contested by Desmond DeRozan (3.7 feet, MAN). PAOLO DURANT MAKES IT! Assist: Pascal Herro
Score: 65-63

[08:01] Team_033 possession (Score: 65-63)
Chris Anunoby attempts a 3Pt. Contested by RJ Nowitzki (5.5 feet, ZONE). Chris Anunoby misses. Rebound secured by Paolo Durant.

[07:48] Team_012 possession (Score: 65-63)
Shaquille Booker makes the Layup and draws the foul on Bradley Simmons! And-1! Shaquille Booker to the line for 1. [Team fouls: 3] (Bradley Simmons: 1 personal fouls)   FT 1/1: GOOD Shaquille Booker makes 1/1 from the line.
Score: 68-63

[07:38] Team_033 possession (Score: 68-63)
Desmond DeRozan drives to the basket... Desmond DeRozan loses the ball! Stripped by Paolo Durant! TURNOVER! (live ball)

[07:26] Team_012 possession (Score: 68-63)
RJ Nowitzki attempts a 3Pt. Contested by Joel Green (2.6 feet, ZONE). RJ Nowitzki misses. Rebound secured by Bradley Simmons.

[07:16] Team_033 possession (Score: 68-63)
Cade Randle attempts a 3Pt. Contested by RJ Nowitzki (2.7 feet, ZONE). CADE RANDLE MAKES IT! Assist: Chris Anunoby
Score: 68-66

[07:05] Team_012 possession (Score: 68-66)
Pascal Herro attempts a Midrange. Contested by Desmond DeRozan (2.8 feet, ZONE). PASCAL HERRO MAKES IT! Assist: Paolo Durant
Score: 70-66

[06:52] Team_033 possession (Score: 70-66)
Chris Anunoby drives, RJ Nowitzki stays with him. Chris Anunoby attempts a Dunk. Heavily contested by RJ Nowitzki (0.5 feet, MAN)! Chris Anunoby misses. Rebound secured by RJ Nowitzki.

[06:40] Team_012 possession (Score: 70-66)
RJ Nowitzki attempts a 3Pt. Contested by Joel Green (4.2 feet, ZONE). RJ Nowitzki misses. Rebound secured by Bradley Simmons.

[06:28] Team_033 possession (Score: 70-66)
Cade Randle makes the Layup and draws the foul on Shaquille Booker! And-1! Cade Randle to the line for 1. [Team fouls: 3] (Shaquille Booker: 2 personal fouls)   FT 1/1: GOOD Cade Randle makes 1/1 from the line.
Score: 70-69

[06:10] Team_012 possession (Score: 70-69)
Paolo Durant attempts a 3Pt. Contested by Joel Green (4.4 feet, ZONE). PAOLO DURANT MAKES IT! Assist: Shaquille Booker
Score: 73-69

[05:56] Team_033 possession (Score: 73-69)
Joel Green attempts a Midrange. Contested by Shaquille Booker (4.3 feet, ZONE). Joel Green misses. Rebound secured by Paolo Durant.

[05:38] Team_012 possession (Score: 73-69)
RJ Nowitzki attempts a 3Pt. Contested by Chris Anunoby (2.3 feet, MAN). RJ Nowitzki misses. Rebound secured by Bradley Simmons.

[05:25] Team_033 possession (Score: 73-69)
Chris Anunoby attempts a 3Pt. Wide open! RJ Nowitzki is 6.7 feet away. [ZONE] CHRIS ANUNOBY MAKES IT! Assist: Cade Randle
Score: 73-72

[05:10] Team_012 possession (Score: 73-72)
Paolo Durant attempts a Layup. Wide open! Desmond DeRozan is 6.5 feet away. [MAN] Paolo Durant misses. Rebound secured by Bradley Simmons.

[04:51] Team_033 possession (Score: 73-72)
FOUL! Holding foul on Shaquille Booker. [Team fouls: 4] No free throws, side out. (Shaquille Booker: 3 personal fouls)

[04:39] Team_033 possession (Score: 73-72)
Desmond DeRozan attempts a Midrange. Contested by Paolo Durant (5.3 feet, MAN). Desmond DeRozan misses. Rebound secured by Ayo McGrady.

[04:28] Team_012 possession (Score: 73-72)
RJ Nowitzki attempts a Midrange. Contested by Cade Randle (5.8 feet, ZONE). RJ NOWITZKI MAKES IT! Assist: Ayo McGrady
Score: 75-72

[04:17] Team_033 possession (Score: 75-72)
Bradley Simmons drives, Ayo McGrady stays with him. Bradley Simmons attempts a Dunk. Contested by Ayo McGrady (3.6 feet, MAN). Bradley Simmons misses. Rebound secured by RJ Nowitzki.

[03:59] Team_012 possession (Score: 75-72)
Ayo McGrady attempts a 3Pt. Contested by Joel Green (4.6 feet, ZONE). Ayo McGrady misses. FOUL! Loose ball foul on Bradley Simmons during the rebound battle. [Team fouls: 4] No free throws, side out. (Bradley Simmons: 2 personal fouls)

[03:41] Team_012 possession (Score: 75-72)
RJ Nowitzki loses control! Ball rolls out of bounds! TURNOVER! (dead ball)

[03:26] Team_033 possession (Score: 75-72)
FOUL! Holding foul on Ayo McGrady. [IN THE BONUS! 5 team fouls] Bradley Simmons to the line for 2 free throws. (Ayo McGrady: 1 personal fouls)   FT 1/2: GOOD   FT 2/2: MISS Bradley Simmons makes 1/2 from the line. FOUL! Loose ball foul on RJ Nowitzki during the free throw rebound! [IN THE BONUS! 6 team fouls] Bradley Simmons to the line for 2 free throws. (RJ Nowitzki: 1 personal fouls)   FT 1/2: GOOD   FT 2/2: GOOD Bradley Simmons makes 2/2 from the line.
Score: 75-75

[03:11] Team_012 possession (Score: 75-75)
Pascal Herro drives to the basket... Pascal Herro throws a bad pass out of bounds! TURNOVER! (dead ball)

[03:11] Substitution (Team_012): Pascal Herro OUT → Desmond Irving IN (stamina_rule2)

[03:11] Substitution (Team_033): Chris Anunoby OUT → Manu Irving IN (stamina_rule2)

[03:11] Substitution (Team_033): Desmond DeRozan OUT → Zion Adebayo IN (stamina_rule2)

[03:11] Substitution (Team_033): Bradley Simmons OUT → Tim Griffin IN (stamina_rule2)

[02:53] Team_033 possession (Score: 75-75)
Cade Randle makes the Dunk and draws the foul on Paolo Durant! And-1! Cade Randle to the line for 1. [BONUS: 7 team fouls] (Paolo Durant: 2 personal fouls)   FT 1/1: GOOD Cade Randle makes 1/1 from the line.
Score: 75-78

[02:41] Team_012 possession (Score: 75-78)
Ayo McGrady drives and kicks out. RJ Nowitzki attempts a 3Pt. Wide open! Joel Green is 6.3 feet away. [ZONE] RJ Nowitzki misses. Rebound secured by Cade Randle.

[02:25] Team_033 possession (Score: 75-78)
Manu Irving attempts a Midrange. Heavily contested by RJ Nowitzki (1.0 feet, MAN)! MANU IRVING MAKES IT!
Score: 75-80

[02:11] Team_012 possession (Score: 75-80)
Desmond Irving drives and kicks out. Desmond Irving attempts a Midrange. Contested by Zion Adebayo (3.9 feet, ZONE). DESMOND IRVING MAKES IT!
Score: 77-80

[01:56] Team_033 possession (Score: 77-80)
Zion Adebayo attempts a Layup. Contested by Paolo Durant (5.3 feet, MAN). ZION ADEBAYO MAKES IT! Assist: Joel Green
Score: 77-82

[01:40] Team_012 possession (Score: 77-82)
Ayo McGrady attempts a Midrange. Heavily contested by Zion Adebayo (0.5 feet, ZONE)! AYO MCGRADY MAKES IT! Assist: Desmond Irving
Score: 79-82

[01:30] Team_033 possession (Score: 79-82)
FOUL! Reach-in foul on Desmond Irving during the drive. [IN THE BONUS! 8 team fouls] Joel Green to the line for 2 free throws. (Desmond Irving: 1 personal fouls)   FT 1/2: MISS   FT 2/2: GOOD Joel Green makes 1/2 from the line.
Score: 79-83

[01:13] Team_012 possession (Score: 79-83)
Desmond Irving attempts a 3Pt. Contested by Joel Green (5.5 feet, MAN). DESMOND IRVING MAKES IT! Assist: Paolo Durant
Score: 82-83

[00:58] Team_033 possession (Score: 82-83)
Zion Adebayo attempts a Midrange. Contested by Paolo Durant (5.0 feet, MAN). Zion Adebayo misses. Rebound secured by Paolo Durant.

[00:43] Team_012 possession (Score: 82-83)
Shaquille Booker attempts a Layup. Wide open! Cade Randle is 6.3 feet away. [MAN] SHAQUILLE BOOKER MAKES IT! Assist: Ayo McGrady
Score: 84-83

[00:29] Team_033 possession (Score: 84-83)
Tim Griffin drives, picks up Ayo McGrady. Help arrives from RJ Nowitzki! Tim Griffin attempts a Dunk. Wide open! RJ Nowitzki is 7.7 feet away. [MAN] TIM GRIFFIN MAKES IT! Assist: Cade Randle
Score: 84-85

[00:13] Team_012 possession (Score: 84-85)
Shaquille Booker attempts a Midrange. Contested by Cade Randle (5.3 feet, MAN). Shaquille Booker misses. Rebound secured by Cade Randle.

================================================================================
                              3RD QUARTER COMPLETE                              
================================================================================

3RD QUARTER SCORE: Team_012 31, Team_033 26

BOX SCORE:
================================================================================

Team_012
--------------------------------------------------------------------------------
Player                MIN  PTS  REB  AST  TO      FG   FG%      3P   3P%
--------------------------------------------------------------------------------
Shaquille Booker       30   10    0    1   0   4/5    80.0     0/0   0.0
Paolo Durant           30    7    4    3   0   3/4    75.0     0/0   0.0
RJ Nowitzki            30    5    4    1   0   2/6    33.3     0/0   0.0
Desmond Irving          9    5    0    1   0   2/2   100.0     0/0   0.0
Ayo McGrady            30    2    3    2   0   1/3    33.3     0/0   0.0
Pascal Herro           27    2    0    1   0   1/1   100.0     0/0   0.0

TEAM: FG: 13/21 (61.9%), 3PT: 4/8 (50.0%), REB: 10 (2 off, 8 def), AST: 9, TO: 2
TEAM FOULS: 8 [Team_033 in BONUS]


Team_033
--------------------------------------------------------------------------------
Player                MIN  PTS  REB  AST  TO      FG   FG%      3P   3P%
--------------------------------------------------------------------------------
Cade Randle            32    9    2    2   0   3/5    60.0     0/0   0.0
Joel Green             30    5    0    1   0   3/5    60.0     0/0   0.0
Bradley Simmons        27    3    6    1   0   1/2    50.0     0/0   0.0
Chris Anunoby          27    3    0    1   0   1/3    33.3     0/0   0.0
Manu Irving             9    2    0    0   0   1/1   100.0     0/0   0.0
Zion Adebayo            9    2    0    0   0   1/2    50.0     0/0   0.0
Tim Griffin             9    2    0    0   0   1/1   100.0     0/0   0.0
Desmond DeRozan        27    0    0    0   0   0/1     0.0     0/0   0.0

TEAM: FG: 11/20 (55.0%), 3PT: 2/5 (40.0%), REB: 9 (1 off, 8 def), AST: 5, TO: 2
TEAM FOULS: 4

================================================================================

================================================================================
                       4TH QUARTER - Team_012 vs Team_033                       
================================================================================

[12:00] Team_012 possession (Score: 84-85)
FOUL! Reach-in foul on Bradley Simmons during the drive. [Team fouls: 1] No free throws, side out. (Bradley Simmons: 1 personal fouls)

[11:49] Team_012 possession (Score: 84-85)
Paolo Durant attempts a Midrange. Contested by Chris Anunoby (4.1 feet, ZONE). Paolo Durant misses. Rebound secured by Chris Anunoby.

[11:35] Team_033 possession (Score: 84-85)
Cade Randle attempts a 3Pt. Contested by RJ Nowitzki (3.2 feet, ZONE). Cade Randle misses. Rebound secured by Ayo McGrady.

[11:19] Team_012 possession (Score: 84-85)
FOUL! Shooting foul on Desmond DeRozan. Paolo Durant to the line for 2 free throws. [Team fouls: 2] (Desmond DeRozan: 1 personal fouls)   FT 1/2: MISS   FT 2/2: GOOD Paolo Durant makes 1/2 from the line.
Score: 85-85

[11:09] Team_033 possession (Score: 85-85)
FOUL! Offensive foul on Chris Anunoby! RJ Nowitzki drew the charge! [Team fouls: 3] (Chris Anunoby: 1 personal fouls) TURNOVER! (dead ball)

[10:56] Team_012 possession (Score: 85-85)
Shaquille Booker attempts a 3Pt. Contested by Cade Randle (2.9 feet, MAN). Shaquille Booker misses. Offensive rebound by Paolo Durant! Paolo Durant puts it back in!
Score: 87-85

[10:41] Team_033 possession (Score: 87-85)
Bradley Simmons makes the Layup and draws the foul on Paolo Durant! And-1! Bradley Simmons to the line for 1. [Team fouls: 1] (Paolo Durant: 1 personal fouls)   FT 1/1: GOOD Bradley Simmons makes 1/1 from the line.
Score: 87-88

[10:28] Team_012 possession (Score: 87-88)
Ayo McGrady makes the Dunk and draws the foul on Chris Anunoby! And-1! Ayo McGrady to the line for 1. [Team fouls: 4] (Chris Anunoby: 2 personal fouls)   FT 1/1: MISS Ayo McGrady makes 0/1 from the line. Offensive rebound by Paolo Durant! Paolo Durant puts it back in!
Score: 91-88

[10:13] Team_033 possession (Score: 91-88)
Chris Anunoby attempts a 3Pt. Contested by RJ Nowitzki (4.9 feet, MAN). Chris Anunoby misses. Rebound secured by RJ Nowitzki.

[09:59] Team_012 possession (Score: 91-88)
FOUL! Shooting foul on Chris Anunoby. RJ Nowitzki to the line for 2 free throws. [BONUS: 5 team fouls] (Chris Anunoby: 3 personal fouls)   FT 1/2: GOOD   FT 2/2: MISS RJ Nowitzki makes 1/2 from the line. Rebound secured by Chris Anunoby.
Score: 92-88

[09:47] Team_033 possession (Score: 92-88)
Joel Green attempts a Midrange. Contested by Pascal Herro (6.0 feet, MAN). Joel Green misses. Rebound secured by Paolo Durant.

[09:35] Team_012 possession (Score: 92-88)
RJ Nowitzki drives and kicks out. Pascal Herro attempts a 3Pt. Wide open! Joel Green is 7.3 feet away. [MAN] Pascal Herro misses. Rebound secured by Desmond DeRozan.

[09:21] Team_033 possession (Score: 92-88)
Desmond DeRozan drives and kicks out. Cade Randle attempts a Midrange. Contested by RJ Nowitzki (3.6 feet, ZONE). Cade Randle misses. Offensive rebound by Bradley Simmons! Bradley Simmons's putback is no good. Rebound secured by Paolo Durant.

[09:06] Team_012 possession (Score: 92-88)
Shaquille Booker makes the Midrange and draws the foul on Cade Randle! And-1! Shaquille Booker to the line for 1. [BONUS: 6 team fouls] (Cade Randle: 1 personal fouls)   FT 1/1: GOOD Shaquille Booker makes 1/1 from the line.
Score: 95-88

[08:54] Team_033 possession (Score: 95-88)
Chris Anunoby drives, picks up RJ Nowitzki. Help arrives from Pascal Herro! Chris Anunoby attempts a Layup. Contested by Pascal Herro (4.6 feet, MAN). CHRIS ANUNOBY MAKES IT! Assist: Joel Green
Score: 95-90

[08:40] Team_012 possession (Score: 95-90)
Shaquille Booker attempts a 3Pt. Contested by Chris Anunoby (4.6 feet, ZONE). SHAQUILLE BOOKER MAKES IT! Assist: RJ Nowitzki
Score: 98-90

[08:26] Team_033 possession (Score: 98-90)
Chris Anunoby drives to the basket... Chris Anunoby throws a bad pass out of bounds! TURNOVER! (dead ball)

[08:26] Substitution (Team_012): Pascal Herro OUT → Desmond Irving IN (stamina_rule2)

[08:26] Substitution (Team_012): RJ Nowitzki OUT → Jalen Barnes IN (stamina_rule2)

[08:26] Substitution (Team_012): Shaquille Booker OUT → Domantas Bird IN (stamina_rule2)

[08:26] Substitution (Team_012): Paolo Durant OUT → Jimmy Quickley IN (stamina_rule2)

[08:26] Substitution (Team_012): Ayo McGrady OUT → Karl Young IN (stamina_rule2)

[08:26] Substitution (Team_033): Joel Green OUT → Ben Anthony IN (stamina_rule2)

[08:26] Substitution (Team_033): Chris Anunoby OUT → Manu Irving IN (stamina_rule2)

[08:26] Substitution (Team_033): Cade Randle OUT → Terry Jokic IN (stamina_rule2)

[08:26] Substitution (Team_033): Desmond DeRozan OUT → Zion Adebayo IN (stamina_rule2)

[08:26] Substitution (Team_033): Bradley Simmons OUT → Tim Griffin IN (stamina_rule2)

[08:12] Team_012 possession (Score: 98-90)
Jimmy Quickley attempts a Layup. Contested by Zion Adebayo (2.2 feet, MAN). Jimmy Quickley misses. FOUL! Loose ball foul on Tim Griffin during the rebound battle. [IN THE BONUS! 7 team fouls] Karl Young to the line for 2 free throws. (Tim Griffin: 1 personal fouls)   FT 1/2: GOOD   FT 2/2: GOOD Karl Young makes 2/2 from the line.
Score: 100-90

[07:58] Team_033 possession (Score: 100-90)
Terry Jokic attempts a Midrange. Contested by Domantas Bird (5.1 feet, MAN). Terry Jokic misses. FOUL! Loose ball foul on Jalen Barnes during the rebound battle. [Team fouls: 2] No free throws, side out. (Jalen Barnes: 1 personal fouls)

[07:42] Team_033 possession (Score: 100-90)
Manu Irving attempts a 3Pt. Wide open! Jalen Barnes is 7.6 feet away. [MAN] Manu Irving misses. Rebound secured by Karl Young.

[07:28] Team_012 possession (Score: 100-90)
Desmond Irving attempts a 3Pt. Contested by Ben Anthony (5.5 feet, MAN). Desmond Irving misses. FOUL! Loose ball foul on Zion Adebayo during the rebound battle. [IN THE BONUS! 8 team fouls] Jimmy Quickley to the line for 2 free throws. (Zion Adebayo: 1 personal fouls)   FT 1/2: GOOD   FT 2/2: GOOD Jimmy Quickley makes 2/2 from the line.
Score: 102-90

[07:17] Team_033 possession (Score: 102-90)
Terry Jokic drives, Domantas Bird stays with him. Terry Jokic attempts a Layup. Wide open! Domantas Bird is 7.2 feet away. [MAN] Terry Jokic misses. Rebound secured by Jimmy Quickley.

[07:02] Team_012 possession (Score: 102-90)
Jimmy Quickley throws a bad pass! Stolen by Zion Adebayo! TURNOVER! (live ball)

[06:42] Team_033 possession (Score: 102-90)
Zion Adebayo attempts a Midrange. Wide open! Jimmy Quickley is 6.1 feet away. [ZONE] Zion Adebayo misses. Offensive rebound by Terry Jokic! Terry Jokic kicks it out.

[06:29] Team_033 possession (Score: 102-90)
Manu Irving attempts a 3Pt. Contested by Jalen Barnes (4.8 feet, MAN). MANU IRVING MAKES IT! Assist: Terry Jokic
Score: 102-93

[06:12] Team_012 possession (Score: 102-93)
Jalen Barnes attempts a 3Pt. Contested by Manu Irving (5.1 feet, MAN). Jalen Barnes misses. Offensive rebound by Jimmy Quickley! Jimmy Quickley kicks it out.

[06:00] Team_012 possession (Score: 102-93)
Desmond Irving attempts a 3Pt. Contested by Ben Anthony (5.6 feet, MAN). DESMOND IRVING MAKES IT! Assist: Karl Young
Score: 105-93

[05:44] Team_033 possession (Score: 105-93)
Zion Adebayo attempts a 3Pt. Contested by Jimmy Quickley (2.4 feet, MAN). ZION ADEBAYO MAKES IT! Assist: Ben Anthony
Score: 105-96

[05:31] Team_012 possession (Score: 105-96)
Jimmy Quickley makes the Midrange and draws the foul on Terry Jokic! And-1! Jimmy Quickley to the line for 1. [BONUS: 9 team fouls] (Terry Jokic: 1 personal fouls)   FT 1/1: GOOD Jimmy Quickley makes 1/1 from the line.
Score: 108-96

[05:18] Team_033 possession (Score: 108-96)
Zion Adebayo drives and kicks out. Tim Griffin attempts a 3Pt. Contested by Desmond Irving (4.4 feet, ZONE). Tim Griffin misses. Rebound secured by Jimmy Quickley.

[05:02] Team_012 possession (Score: 108-96)
Jimmy Quickley attempts a 3Pt. Wide open! Ben Anthony is 8.2 feet away. [ZONE] Jimmy Quickley misses. Rebound secured by Terry Jokic.

[04:53] Team_033 possession (Score: 108-96)
FOUL! Reach-in foul on Jimmy Quickley during the drive. [Team fouls: 3] No free throws, side out. (Jimmy Quickley: 1 personal fouls)

[04:37] Team_033 possession (Score: 108-96)
FOUL! Offensive foul on Terry Jokic! Domantas Bird drew the charge! [Team fouls: 10] (Terry Jokic: 2 personal fouls) TURNOVER! (dead ball)

[04:23] Team_012 possession (Score: 108-96)
Jimmy Quickley drives and kicks out. Jalen Barnes attempts a 3Pt. Wide open! Manu Irving is 6.0 feet away. [MAN] Jalen Barnes misses. Rebound secured by Terry Jokic.

[04:10] Team_033 possession (Score: 108-96)
Manu Irving attempts a 3Pt. Wide open! Jalen Barnes is 6.2 feet away. [MAN] Manu Irving misses. Rebound secured by Jimmy Quickley.

[03:54] Team_012 possession (Score: 108-96)
Domantas Bird attempts a 3Pt. Contested by Ben Anthony (3.1 feet, ZONE). Domantas Bird misses. Rebound secured by Tim Griffin.

[03:41] Team_033 possession (Score: 108-96)
Zion Adebayo makes the Midrange and draws the foul on Domantas Bird! And-1! Zion Adebayo to the line for 1. [Team fouls: 4] (Domantas Bird: 1 personal fouls)   FT 1/1: MISS Zion Adebayo makes 0/1 from the line. Offensive rebound by Tim Griffin! Tim Griffin puts it back in!
Score: 108-100

[03:27] Team_012 possession (Score: 108-100)
Jalen Barnes attempts a 3Pt. Contested by Manu Irving (2.6 feet, MAN). Jalen Barnes misses. Rebound secured by Tim Griffin.

[03:08] Team_033 possession (Score: 108-100)
Ben Anthony attempts a Layup. Wide open! Jimmy Quickley is 10.0 feet away. [ZONE] BEN ANTHONY MAKES IT!
Score: 108-102

[02:54] Team_012 possession (Score: 108-102)
Domantas Bird attempts a 3Pt. Wide open! Terry Jokic is 6.4 feet away. [MAN] Domantas Bird misses. Rebound secured by Zion Adebayo.

[02:39] Team_033 possession (Score: 108-102)
Ben Anthony attempts a 3Pt. Wide open! Desmond Irving is 7.3 feet away. [ZONE] Ben Anthony misses. Rebound secured by Karl Young.

[02:25] Team_012 possession (Score: 108-102)
Jalen Barnes attempts a 3Pt. Contested by Ben Anthony (4.8 feet, ZONE). JALEN BARNES MAKES IT! Assist: Karl Young
Score: 111-102

[02:10] Team_033 possession (Score: 111-102)
Ben Anthony attempts a 3Pt. Contested by Desmond Irving (5.7 feet, MAN). BEN ANTHONY MAKES IT! Assist: Manu Irving
Score: 111-105

[01:55] Team_012 possession (Score: 111-105)
Desmond Irving makes the Layup and draws the foul on Ben Anthony! And-1! Desmond Irving to the line for 1. [BONUS: 11 team fouls] (Ben Anthony: 1 personal fouls)   FT 1/1: MISS Desmond Irving makes 0/1 from the line. Rebound secured by Zion Adebayo.
Score: 113-105

[01:42] Team_033 possession (Score: 113-105)
FOUL! Shooting foul on Karl Young. Tim Griffin to the line for 2 free throws. [BONUS: 5 team fouls] (Karl Young: 1 personal fouls)   FT 1/2: GOOD   FT 2/2: GOOD Tim Griffin makes 2/2 from the line.
Score: 113-107

[01:30] Team_012 possession (Score: 113-107)
Karl Young attempts a Layup. Contested by Tim Griffin (5.6 feet, ZONE). Karl Young misses. Rebound secured by Terry Jokic.

[01:15] Team_033 possession (Score: 113-107)
Manu Irving drives, Jalen Barnes stays with him. Manu Irving attempts a Layup. Contested by Jalen Barnes (4.2 feet, MAN). MANU IRVING MAKES IT! Assist: Ben Anthony
Score: 113-109

[00:59] Team_012 possession (Score: 113-109)
Karl Young drives to the basket... Karl Young throws a bad pass! Stolen by Tim Griffin! TURNOVER! (live ball)

[00:47] Team_033 possession (Score: 113-109)
Terry Jokic drives, Domantas Bird stays with him. Terry Jokic attempts a Dunk. Contested by Domantas Bird (5.8 feet, MAN). Terry Jokic misses. Rebound secured by Jimmy Quickley.

[00:30] Team_012 possession (Score: 113-109)
FOUL! Reach-in foul on Tim Griffin during the drive. [IN THE BONUS! 12 team fouls] Jalen Barnes to the line for 2 free throws. (Tim Griffin: 2 personal fouls)   FT 1/2: GOOD   FT 2/2: GOOD Jalen Barnes makes 2/2 from the line.
Score: 115-109

[00:12] Team_033 possession (Score: 115-109)
Zion Adebayo attempts a 3Pt. Contested by Desmond Irving (2.3 feet, ZONE). ZION ADEBAYO MAKES IT! Assist: Terry Jokic
Score: 115-112

================================================================================
                              4TH QUARTER COMPLETE                              
================================================================================

4TH QUARTER SCORE: Team_012 31, Team_033 27

BOX SCORE:
================================================================================

Team_012
--------------------------------------------------------------------------------
Player                MIN  PTS  REB  AST  TO      FG   FG%      3P   3P%
--------------------------------------------------------------------------------
Shaquille Booker       34    6    0    0   0   2/2   100.0     0/0   0.0
Jimmy Quickley         15    5    5    0   0   2/4    50.0     0/0   0.0
Jalen Barnes           15    5    0    0   0   2/3    66.7     0/0   0.0
Desmond Irving         17    3    0    0   0   1/2    50.0     0/0   0.0
Karl Young             15    2    2    2   0   1/2    50.0     0/0   0.0
Ayo McGrady            34    0    1    0   0   0/0     0.0     0/0   0.0
RJ Nowitzki            34    0    1    1   0   0/2     0.0     0/0   0.0
Domantas Bird          15    0    0    0   0   0/2     0.0     0/0   0.0

TEAM: FG: 11/21 (52.4%), 3PT: 5/9 (55.6%), REB: 11 (2 off, 9 def), AST: 3, TO: 2
TEAM FOULS: 5 [Team_033 in BONUS]


Team_033
--------------------------------------------------------------------------------
Player                MIN  PTS  REB  AST  TO      FG   FG%      3P   3P%
--------------------------------------------------------------------------------
Paolo Durant           34    7    3    0   0   3/4    75.0     0/0   0.0
Zion Adebayo           17    6    2    0   0   2/3    66.7     0/0   0.0
Tim Griffin            17    6    2    0   0   2/2   100.0     0/0   0.0
Manu Irving            17    5    0    1   0   2/4    50.0     0/0   0.0
Ben Anthony            15    5    0    2   0   2/3    66.7     0/0   0.0
Bradley Simmons        31    3    0    0   0   1/1   100.0     0/0   0.0
Chris Anunoby          31    2    2    0   0   1/2    50.0     0/0   0.0
Cade Randle            36    0    0    0   0   0/1     0.0     0/0   0.0
Joel Green             34    0    0    1   0   0/1     0.0     0/0   0.0
Desmond DeRozan        31    0    1    0   0   0/1     0.0     0/0   0.0
Terry Jokic            12    0    5    2   0   0/2     0.0     0/0   0.0

TEAM: FG: 10/20 (50.0%), 3PT: 4/9 (44.4%), REB: 13 (3 off, 10 def), AST: 6, TO: 3
TEAM FOULS: 12 [Team_012 in BONUS]

================================================================================

================================================================================
                               FULL GAME COMPLETE                               
================================================================================

FINAL SCORE: Team_012 115, Team_033 112

SCORING BY QUARTER:
--------------------------------------------------------------------------------
Team                     Q1     Q2     Q3     Q4    FINAL
--------------------------------------------------------------------------------
Team_012                 29     24     31     31      115
Team_033                 30     29     26     27      112
--------------------------------------------------------------------------------

FULL GAME BOX SCORE:
================================================================================

Team_012
--------------------------------------------------------------------------------
Player                MIN  PTS  REB  AST  TO      FG   FG%      3P   3P%      FT STL BLK
--------------------------------------------------------------------------------
RJ Nowitzki            34   20   16    3   1   7/18   38.9   2/7    28.6   4/7     0   0
Shaquille Booker       34   21    0    3   0   9/12   75.0   3/3   100.0   2/2     0   0
Paolo Durant           34   20   14    5   2   6/9    66.7   1/2    50.0   1/2     1   0
Ayo McGrady            34    7    6    3   2   4/7    57.1   0/0     0.0   0/1     0   0
Pascal Herro           31    7    0    3   1   5/12   41.7   2/8    25.0   0/0     0   0
Desmond Irving         17   11    0    2   0   5/6    83.3   3/3   100.0   1/2     0   0
Jalen Barnes           15   10    1    1   0   3/5    60.0   1/2    50.0   4/4     0   0
Domantas Bird          15    0    0    0   0   1/5    20.0   0/4     0.0   0/0     0   0
Jimmy Quickley         15    5    5    0   3   2/6    33.3   0/2     0.0   3/3     0   0
Karl Young             15    9    3    2   0   3/5    60.0   0/0     0.0   3/3     0   0

TEAM: FG: 45/85 (52.9%), 3PT: 12/31 (38.7%), REB: 42 (6 off, 36 def), AST: 22, TO: 9


Team_033
--------------------------------------------------------------------------------
Player                MIN  PTS  REB  AST  TO      FG   FG%      3P   3P%      FT STL BLK
--------------------------------------------------------------------------------
Cade Randle            36   16    5    5   1   5/12   41.7   3/8    37.5   2/4     0   0
Joel Green             34    5    0    3   0   4/10   40.0   0/3     0.0   1/2     0   0
Chris Anunoby          31   24    4    4   1  11/14   78.6   3/5    60.0   1/1     0   0
Desmond DeRozan        31    4    7    1   1   2/9    22.2   0/3     0.0   0/0     0   0
Bradley Simmons        31   15   17    5   2   3/8    37.5   0/2     0.0   2/3     2   0
Manu Irving            17   10    0    2   0   5/7    71.4   2/4    50.0   1/1     0   0
Zion Adebayo           17   10    5    0   0   5/7    71.4   2/2   100.0   0/1     1   0
Tim Griffin            17    8    4    2   2   2/3    66.7   0/0     0.0   2/2     1   0
Ben Anthony            15   14    0    2   0   6/8    75.0   2/4    50.0   0/0     0   0
Terry Jokic            12    6    7    2   1   2/4    50.0   2/2   100.0   0/0     0   0

TEAM: FG: 46/84 (54.8%), 3PT: 14/33 (42.4%), REB: 50 (10 off, 40 def), AST: 26, TO: 8

================================================================================
