================================================================================
                        FULL GAME - Team_045 vs Team_076                        
================================================================================

================================================================================
                       1ST QUARTER - Team_045 vs Team_076                       
================================================================================

[12:00] Team_045 possession (Score: 0-0)
Cole Simons drives, picks up Cade Barnes. Help arrives from Tobias Mitchell! Cole Simons attempts a Layup. Contested by Tobias Mitchell (4.3 feet, ZONE). COLE SIMONS MAKES IT!
Score: 2-0

[11:46] Team_076 possession (Score: 2-0)
Tobias Mitchell drives and kicks out. Cade Barnes attempts a 3Pt. Contested by Cole Simons (3.5 feet, ZONE). Cade Barnes misses. Rebound secured by DeMar Turner.

[11:32] Team_045 possession (Score: 2-0)
DeMar Turner attempts a Layup. Heavily contested by Cade Barnes (1.5 feet, ZONE)! DEMAR TURNER MAKES IT! Assist: Trae Russell
Score: 4-0

[11:15] Team_076 possession (Score: 4-0)
Paul Leonard attempts a 3Pt. Wide open! Cole Simons is 7.1 feet away. [MAN] Paul Leonard misses. Rebound secured by Cole Simons.

[11:04] Team_045 possession (Score: 4-0)
Cole Simons attempts a Midrange. Contested by Paul Leonard (4.0 feet, MAN). COLE SIMONS MAKES IT! Assist: Zion Butler
Score: 6-0

[10:52] Team_076 possession (Score: 6-0)
Tobias Mitchell attempts a 3Pt. Wide open! DeMar Turner is 6.0 feet away. [ZONE] TOBIAS MITCHELL MAKES IT! Assist: Dejounte LaVine
Score: 6-3

[10:38] Team_045 possession (Score: 6-3)
Cole Simons attempts a Layup. Wide open! Paul Leonard is 7.9 feet away. [MAN] COLE SIMONS MAKES IT! Assist: Trae Russell
Score: 8-3

[10:22] Team_076 possession (Score: 8-3)
D'Angelo Tatum attempts a 3Pt. Heavily contested by Cole Simons (1.1 feet, ZONE)! D'Angelo Tatum misses. Rebound secured by Cole Simons.

[10:10] Team_045 possession (Score: 8-3)
Cole Simons attempts a Layup. Wide open! Paul Leonard is 7.4 feet away. [MAN] COLE SIMONS MAKES IT! Assist: Trae Russell
Score: 10-3

[10:00] Team_076 possession (Score: 10-3)
D'Angelo Tatum attempts a Layup. Heavily contested by Zion Butler (0.8 feet, ZONE)! D'Angelo Tatum misses. Offensive rebound by D'Angelo Tatum! D'Angelo Tatum kicks it out.

[09:44] Team_076 possession (Score: 10-3)
Dejounte LaVine attempts a 3Pt. Wide open! Rudy Antetokounmpo is 8.0 feet away. [MAN] Dejounte LaVine misses. Rebound secured by DeMar Turner.

[09:29] Team_045 possession (Score: 10-3)
Rudy Antetokounmpo drives and kicks out. DeMar Turner attempts a 3Pt. Contested by Cade Barnes (3.9 feet, ZONE). DeMar Turner misses. Rebound secured by Cade Barnes.

[09:20] Team_076 possession (Score: 10-3)
Dejounte LaVine attempts a Midrange. BLOCKED BY RUDY ANTETOKOUNMPO! Ball is loose! Offensive rebound by D'Angelo Tatum! D'Angelo Tatum kicks it out.

[09:05] Team_076 possession (Score: 10-3)
Tobias Mitchell attempts a 3Pt. Contested by Cole Simons (2.8 feet, ZONE). Tobias Mitchell misses. Rebound secured by Cole Simons.

[08:51] Team_045 possession (Score: 10-3)
Trae Russell attempts a 3Pt. Contested by Cade Barnes (5.9 feet, ZONE). TRAE RUSSELL MAKES IT! Assist: Rudy Antetokounmpo
Score: 13-3

[08:42] Team_076 possession (Score: 13-3)
Paul Leonard drives, picks up Zion Butler. Help arrives from Rudy Antetokounmpo! Paul Leonard attempts a Dunk. Contested by Rudy Antetokounmpo (5.1 feet, ZONE). PAUL LEONARD MAKES IT! Assist: Cade Barnes
Score: 13-5

[08:26] Team_045 possession (Score: 13-5)
Trae Russell drives to the basket... Trae Russell throws a bad pass! Stolen by Cade Barnes! TURNOVER! (live ball)

[08:13] Team_076 possession (Score: 13-5)
Cade Barnes attempts a Layup. Heavily contested by Zion Butler (0.7 feet, MAN)! CADE BARNES MAKES IT! Assist: Dejounte LaVine
Score: 13-7

[08:00] Team_045 possession (Score: 13-7)
Cole Simons attempts a Layup. BLOCKED BY PAUL LEONARD! Ball is loose! Offensive rebound by DeMar Turner! DeMar Turner kicks it out.

[07:49] Team_045 possession (Score: 13-7)
DeMar Turner attempts a Midrange. Contested by Paul Leonard (4.5 feet, ZONE). DeMar Turner misses. Rebound secured by Cade Barnes.

[07:32] Team_076 possession (Score: 13-7)
Tobias Mitchell loses the ball! Stripped by Cole Simons! TURNOVER! (live ball)

[07:18] Team_045 possession (Score: 13-7)
Cole Simons attempts a Midrange. Heavily contested by Paul Leonard (1.5 feet, MAN)! Cole Simons misses. Offensive rebound by Zion Butler! Zion Butler puts it back in!
Score: 15-7

[07:02] Team_076 possession (Score: 15-7)
Tobias Mitchell attempts a 3Pt. Wide open! Rudy Antetokounmpo is 7.2 feet away. [ZONE] Tobias Mitchell misses. Rebound secured by DeMar Turner.

[06:51] Team_045 possession (Score: 15-7)
Trae Russell drives, picks up Tobias Mitchell. Help arrives from Dejounte LaVine! Trae Russell attempts a Layup. Contested by Dejounte LaVine (4.9 feet, MAN). TRAE RUSSELL MAKES IT! Assist: Rudy Antetokounmpo
Score: 17-7

[06:35] Team_076 possession (Score: 17-7)
FOUL! Reach-in foul on Zion Butler during the drive. [Team fouls: 1] No free throws, side out. (Zion Butler: 1 personal fouls)

[06:19] Team_076 possession (Score: 17-7)
D'Angelo Tatum attempts a 3Pt. BLOCKED BY ZION BUTLER! Ball goes out off Zion Butler. D'Angelo Tatum's ball!

[06:05] Team_076 possession (Score: 17-7)
FOUL! Reach-in foul on Zion Butler during the drive. [Team fouls: 2] No free throws, side out. (Zion Butler: 2 personal fouls)

[05:50] Team_076 possession (Score: 17-7)
Paul Leonard attempts a 3Pt. Contested by Cole Simons (3.8 feet, MAN). PAUL LEONARD MAKES IT! Assist: Dejounte LaVine
Score: 17-10

[05:35] Team_045 possession (Score: 17-10)
Trae Russell attempts a Layup. Wide open! Tobias Mitchell is 8.1 feet away. [MAN] TRAE RUSSELL MAKES IT! Assist: DeMar Turner
Score: 19-10

[05:19] Team_076 possession (Score: 19-10)
FOUL! Holding foul on Cole Simons. [Team fouls: 3] No free throws, side out. (Cole Simons: 1 personal fouls)

[05:03] Team_076 possession (Score: 19-10)
Paul Leonard drives, Cole Simons stays with him. Paul Leonard attempts a Layup. Wide open! Cole Simons is 8.3 feet away. [MAN] PAUL LEONARD MAKES IT!
Score: 19-12

[04:48] Team_045 possession (Score: 19-12)
FOUL! Offensive foul on DeMar Turner! Cade Barnes drew the charge! [Team fouls: 4] (DeMar Turner: 1 personal fouls) TURNOVER! (dead ball)

[04:33] Team_076 possession (Score: 19-12)
Paul Leonard attempts a 3Pt. Heavily contested by Cole Simons (1.0 feet, MAN)! Paul Leonard misses. Rebound secured by Cole Simons.

[04:19] Team_045 possession (Score: 19-12)
DeMar Turner makes the Layup and draws the foul on Cade Barnes! And-1! DeMar Turner to the line for 1. [Team fouls: 1] (Cade Barnes: 1 personal fouls)   FT 1/1: GOOD DeMar Turner makes 1/1 from the line.
Score: 22-12

[04:00] Team_076 possession (Score: 22-12)
Cade Barnes makes the Dunk and draws the foul on Rudy Antetokounmpo! And-1! Cade Barnes to the line for 1. [BONUS: 5 team fouls] (Rudy Antetokounmpo: 1 personal fouls)   FT 1/1: GOOD Cade Barnes makes 1/1 from the line.
Score: 22-15

[03:46] Team_045 possession (Score: 22-15)
Zion Butler drives and kicks out. Rudy Antetokounmpo attempts a 3Pt. Wide open! Cade Barnes is 8.5 feet away. [ZONE] RUDY ANTETOKOUNMPO MAKES IT! Assist: Trae Russell
Score: 25-15

[03:35] Team_076 possession (Score: 25-15)
Tobias Mitchell attempts a 3Pt. Contested by Cole Simons (5.1 feet, MAN). Tobias Mitchell misses. Rebound secured by Cole Simons.

[03:20] Team_045 possession (Score: 25-15)
Trae Russell makes the Dunk and draws the foul on Cade Barnes! And-1! Trae Russell to the line for 1. [Team fouls: 2] (Cade Barnes: 2 personal fouls)   FT 1/1: GOOD Trae Russell makes 1/1 from the line.
Score: 28-15

[03:09] Team_076 possession (Score: 28-15)
Paul Leonard drives and kicks out. Paul Leonard attempts a 3Pt. Contested by Cole Simons (2.4 feet, ZONE). Paul Leonard misses. Offensive rebound by Cade Barnes! Cade Barnes kicks it out.

[02:51] Team_076 possession (Score: 28-15)
D'Angelo Tatum drives to the basket... D'Angelo Tatum throws a bad pass! Stolen by DeMar Turner! TURNOVER! (live ball)

[02:36] Team_045 possession (Score: 28-15)
FOUL! Offensive foul on Trae Russell! Tobias Mitchell drew the charge! [Team fouls: 6] (Trae Russell: 1 personal fouls) TURNOVER! (dead ball)

[02:21] Team_076 possession (Score: 28-15)
Tobias Mitchell attempts a Midrange. Contested by Cole Simons (4.1 feet, ZONE). Tobias Mitchell misses. Rebound secured by Cole Simons.

[02:05] Team_045 possession (Score: 28-15)
FOUL! Shooting foul on Cade Barnes. Rudy Antetokounmpo to the line for 2 free throws. [Team fouls: 3] (Cade Barnes: 3 personal fouls)   FT 1/2: MISS   FT 2/2: MISS Rudy Antetokounmpo makes 0/2 from the line. Rebound secured by Cade Barnes.

[01:49] Team_076 possession (Score: 28-15)
Cade Barnes drives and kicks out. Cade Barnes attempts a 3Pt. Contested by Cole Simons (3.6 feet, ZONE). Cade Barnes misses. Rebound secured by DeMar Turner.

[01:38] Team_045 possession (Score: 28-15)
Trae Russell drives, Tobias Mitchell stays with him. Trae Russell attempts a Layup. Wide open! Tobias Mitchell is 6.1 feet away. [MAN] Trae Russell misses. Offensive rebound by Zion Butler! Zion Butler puts it back in!
Score: 30-15

[01:23] Team_076 possession (Score: 30-15)
Cade Barnes attempts a 3Pt. Contested by Cole Simons (3.6 feet, ZONE). Cade Barnes misses. Rebound secured by Zion Butler.

[01:13] Team_045 possession (Score: 30-15)
Rudy Antetokounmpo attempts a 3Pt. Contested by Cade Barnes (5.2 feet, ZONE). Rudy Antetokounmpo misses. Rebound secured by Cade Barnes.

[00:59] Team_076 possession (Score: 30-15)
D'Angelo Tatum attempts a Midrange. Contested by Zion Butler (3.8 feet, MAN). D'Angelo Tatum misses. Rebound secured by Cole Simons.

[00:44] Team_045 possession (Score: 30-15)
Rudy Antetokounmpo attempts a 3Pt. Contested by Cade Barnes (5.3 feet, ZONE). Rudy Antetokounmpo misses. Rebound secured by Cade Barnes.

[00:30] Team_076 possession (Score: 30-15)
Paul Leonard attempts a Midrange. Contested by Cole Simons (4.3 feet, MAN). Paul Leonard misses. FOUL! Loose ball foul on Zion Butler during the rebound battle. [IN THE BONUS! 7 team fouls] D'Angelo Tatum to the line for 2 free throws. (Zion Butler: 3 personal fouls)   FT 1/2: GOOD   FT 2/2: GOOD D'Angelo Tatum makes 2/2 from the line.
Score: 30-17

[00:19] Team_045 possession (Score: 30-17)
Trae Russell drives to the basket... Trae Russell loses the ball! Stripped by D'Angelo Tatum! TURNOVER! (live ball)

[00:04] Team_076 possession (Score: 30-17)
D'Angelo Tatum attempts a Layup. Contested by Zion Butler (5.1 feet, ZONE). D'ANGELO TATUM MAKES IT! Assist: Paul Leonard
Score: 30-19

================================================================================
                              1ST QUARTER COMPLETE                              
================================================================================

1ST QUARTER SCORE: Team_045 30, Team_076 19

BOX SCORE:
================================================================================

Team_045
--------------------------------------------------------------------------------
Player                MIN  PTS  REB  AST  TO      FG   FG%      3P   3P%
--------------------------------------------------------------------------------
Trae Russell           12   10    0    4   0   4/4   100.0     0/0   0.0
Cole Simons            12    8    7    0   0   4/4   100.0     0/0   0.0
DeMar Turner           12    5    5    1   0   2/3    66.7     0/0   0.0
Zion Butler            12    4    3    1   0   2/2   100.0     0/0   0.0
Rudy Antetokounmpo     12    3    0    2   0   1/5    20.0     0/0   0.0

TEAM: FG: 13/18 (72.2%), 3PT: 1/3 (33.3%), REB: 15 (3 off, 12 def), AST: 8, TO: 4
TEAM FOULS: 7 [Team_076 in BONUS]


Team_076
--------------------------------------------------------------------------------
Player                MIN  PTS  REB  AST  TO      FG   FG%      3P   3P%
--------------------------------------------------------------------------------
Paul Leonard           12    7    0    1   0   3/5    60.0     0/0   0.0
Cade Barnes            12    5    6    1   0   2/4    50.0     0/0   0.0
D'Angelo Tatum         12    4    2    0   0   2/4    50.0     0/0   0.0
Tobias Mitchell        12    3    0    0   0   1/6    16.7     0/0   0.0
Dejounte LaVine        12    0    0    3   0   0/1     0.0     0/0   0.0

TEAM: FG: 8/20 (40.0%), 3PT: 2/10 (20.0%), REB: 8 (3 off, 5 def), AST: 5, TO: 2
TEAM FOULS: 3

================================================================================

================================================================================
                       2ND QUARTER - Team_045 vs Team_076                       
================================================================================

[12:00] Team_045 possession (Score: 30-19)
Trae Russell drives, picks up Cade Barnes. Help arrives from Tobias Mitchell! Trae Russell attempts a Layup. Contested by Tobias Mitchell (3.3 feet, ZONE). Trae Russell misses. Offensive rebound by Zion Butler! Zion Butler's putback is no good. Rebound secured by D'Angelo Tatum.

[11:47] Team_076 possession (Score: 30-19)
D'Angelo Tatum drives and kicks out. Cade Barnes attempts a Midrange. Contested by Trae Russell (4.1 feet, ZONE). Cade Barnes misses. Rebound secured by Zion Butler.

[11:30] Team_045 possession (Score: 30-19)
DeMar Turner attempts a 3Pt. Contested by Cade Barnes (2.7 feet, ZONE). DeMar Turner misses. Rebound secured by D'Angelo Tatum.

[11:12] Team_076 possession (Score: 30-19)
FOUL! Reach-in foul on Cole Simons during the drive. [Team fouls: 1] No free throws, side out. (Cole Simons: 1 personal fouls)

[10:58] Team_076 possession (Score: 30-19)
Cade Barnes makes the Layup and draws the foul on DeMar Turner! And-1! Cade Barnes to the line for 1. [Team fouls: 2] (DeMar Turner: 1 personal fouls)   FT 1/1: GOOD Cade Barnes makes 1/1 from the line.
Score: 30-22

[10:41] Team_045 possession (Score: 30-22)
Trae Russell attempts a Midrange. Contested by Tobias Mitchell (5.3 feet, MAN). TRAE RUSSELL MAKES IT! Assist: DeMar Turner
Score: 32-22

[10:22] Team_076 possession (Score: 32-22)
Dejounte LaVine attempts a 3Pt. Contested by Cole Simons (4.7 feet, ZONE). Dejounte LaVine misses. Rebound secured by DeMar Turner.

[10:10] Team_045 possession (Score: 32-22)
Trae Russell attempts a 3Pt. Wide open! Tobias Mitchell is 9.0 feet away. [MAN] Trae Russell misses. Rebound secured by D'Angelo Tatum.

[09:56] Team_076 possession (Score: 32-22)
FOUL! Holding foul on Rudy Antetokounmpo. [Team fouls: 3] No free throws, side out. (Rudy Antetokounmpo: 1 personal fouls)

[09:42] Team_076 possession (Score: 32-22)
D'Angelo Tatum attempts a Midrange. Heavily contested by Zion Butler (1.1 feet, MAN)! D'Angelo Tatum misses. Rebound secured by Cole Simons.

[09:26] Team_045 possession (Score: 32-22)
Cole Simons loses the ball! Stripped by Paul Leonard! TURNOVER! (live ball)

[09:11] Team_076 possession (Score: 32-22)
Dejounte LaVine attempts a 3Pt. Contested by Rudy Antetokounmpo (4.5 feet, MAN). Dejounte LaVine misses. Rebound secured by Cole Simons.

[08:56] Team_045 possession (Score: 32-22)
Trae Russell attempts a 3Pt. Contested by Tobias Mitchell (5.9 feet, MAN). Trae Russell misses. Rebound secured by D'Angelo Tatum.

[08:45] Team_076 possession (Score: 32-22)
D'Angelo Tatum makes the Midrange and draws the foul on DeMar Turner! And-1! D'Angelo Tatum to the line for 1. [Team fouls: 4] (DeMar Turner: 2 personal fouls)   FT 1/1: GOOD D'Angelo Tatum makes 1/1 from the line.
Score: 32-25

[08:30] Team_045 possession (Score: 32-25)
Trae Russell attempts a Midrange. Contested by Tobias Mitchell (3.7 feet, MAN). Trae Russell misses. Rebound secured by Tobias Mitchell.

[08:14] Team_076 possession (Score: 32-25)
D'Angelo Tatum drives and kicks out. Dejounte LaVine attempts a 3Pt. Heavily contested by Rudy Antetokounmpo (0.8 feet, MAN)! Dejounte LaVine misses. Rebound secured by DeMar Turner.

[08:00] Team_045 possession (Score: 32-25)
Cole Simons makes the Midrange and draws the foul on Paul Leonard! And-1! Cole Simons to the line for 1. [Team fouls: 1] (Paul Leonard: 1 personal fouls)   FT 1/1: GOOD Cole Simons makes 1/1 from the line.
Score: 35-25

[07:45] Team_076 possession (Score: 35-25)
Cade Barnes attempts a Layup. Contested by Zion Butler (5.3 feet, ZONE). Cade Barnes misses. FOUL! Loose ball foul on Zion Butler during the rebound battle. [IN THE BONUS! 5 team fouls] Cade Barnes to the line for 2 free throws. (Zion Butler: 1 personal fouls)   FT 1/2: GOOD   FT 2/2: GOOD Cade Barnes makes 2/2 from the line.
Score: 35-27

[07:34] Team_045 possession (Score: 35-27)
DeMar Turner attempts a Midrange. Contested by Cade Barnes (2.4 feet, MAN). DeMar Turner misses. Offensive rebound by Zion Butler! Zion Butler's putback is no good. Rebound secured by Cade Barnes.

[07:19] Team_076 possession (Score: 35-27)
Paul Leonard attempts a Layup. Heavily contested by Cole Simons (1.9 feet, MAN)! PAUL LEONARD MAKES IT! Assist: Dejounte LaVine
Score: 35-29

[07:06] Team_045 possession (Score: 35-29)
Trae Russell attempts a 3Pt. Wide open! Tobias Mitchell is 7.0 feet away. [MAN] Trae Russell misses. Rebound secured by Cade Barnes.

[06:56] Team_076 possession (Score: 35-29)
Tobias Mitchell attempts a 3Pt. Contested by Trae Russell (5.3 feet, MAN). TOBIAS MITCHELL MAKES IT! Assist: Cade Barnes
Score: 35-32

[06:43] Team_045 possession (Score: 35-32)
Cole Simons attempts a 3Pt. Contested by Cade Barnes (4.4 feet, ZONE). Cole Simons misses. Rebound secured by Tobias Mitchell.

[06:27] Team_076 possession (Score: 35-32)
Paul Leonard attempts a 3Pt. Contested by Rudy Antetokounmpo (4.6 feet, ZONE). PAUL LEONARD MAKES IT! Assist: D'Angelo Tatum
Score: 35-35

[06:10] Team_045 possession (Score: 35-35)
Trae Russell attempts a Midrange. Wide open! Dejounte LaVine is 8.0 feet away. [ZONE] TRAE RUSSELL MAKES IT! Assist: DeMar Turner
Score: 37-35

[05:55] Team_076 possession (Score: 37-35)
Cade Barnes attempts a 3Pt. Contested by Cole Simons (5.8 feet, ZONE). Cade Barnes misses. Rebound secured by DeMar Turner.

[05:40] Team_045 possession (Score: 37-35)
Rudy Antetokounmpo drives, Dejounte LaVine stays with him. Rudy Antetokounmpo attempts a Dunk. Wide open! Dejounte LaVine is 7.2 feet away. [MAN] Rudy Antetokounmpo misses. Rebound secured by Tobias Mitchell.

[05:25] Team_076 possession (Score: 37-35)
Paul Leonard drives, Zion Butler stays with him. Paul Leonard attempts a Layup. Wide open! Zion Butler is 7.0 feet away. [ZONE] PAUL LEONARD MAKES IT!
Score: 37-37

[05:16] Team_045 possession (Score: 37-37)
FOUL! Shooting foul on D'Angelo Tatum. Zion Butler to the line for 2 free throws. [Team fouls: 2] (D'Angelo Tatum: 1 personal fouls)   FT 1/2: GOOD   FT 2/2: GOOD Zion Butler makes 2/2 from the line.
Score: 39-37

[05:01] Team_076 possession (Score: 39-37)
FOUL! Shooting foul on Cole Simons. Dejounte LaVine to the line for 3 free throws. [BONUS: 6 team fouls] (Cole Simons: 2 personal fouls)   FT 1/3: MISS   FT 2/3: GOOD   FT 3/3: GOOD Dejounte LaVine makes 2/3 from the line.
Score: 39-39

[04:46] Team_045 possession (Score: 39-39)
Rudy Antetokounmpo drives to the basket... FOUL! Offensive foul on Rudy Antetokounmpo! Dejounte LaVine drew the charge! [Team fouls: 7] (Rudy Antetokounmpo: 2 personal fouls) TURNOVER! (dead ball)

[04:33] Team_076 possession (Score: 39-39)
FOUL! Reach-in foul on Zion Butler during the drive. [IN THE BONUS! 8 team fouls] D'Angelo Tatum to the line for 2 free throws. (Zion Butler: 2 personal fouls)   FT 1/2: MISS   FT 2/2: MISS D'Angelo Tatum makes 0/2 from the line. Offensive rebound by D'Angelo Tatum! D'Angelo Tatum kicks it out.

[04:19] Team_076 possession (Score: 39-39)
Dejounte LaVine drives and kicks out. D'Angelo Tatum attempts a Midrange. Contested by Cole Simons (5.4 feet, ZONE). D'ANGELO TATUM MAKES IT!
Score: 39-41

[04:03] Team_045 possession (Score: 39-41)
Cole Simons attempts a 3Pt. Wide open! Paul Leonard is 10.0 feet away. [MAN] Cole Simons misses. Offensive rebound by Zion Butler! Zion Butler kicks it out.

[03:52] Team_045 possession (Score: 39-41)
Trae Russell attempts a 3Pt. Wide open! Tobias Mitchell is 8.9 feet away. [MAN] Trae Russell misses. Rebound secured by Tobias Mitchell.

[03:38] Team_076 possession (Score: 39-41)
D'Angelo Tatum drives and kicks out. D'Angelo Tatum attempts a 3Pt. Contested by Cole Simons (3.7 feet, ZONE). D'ANGELO TATUM MAKES IT! Assist: Dejounte LaVine
Score: 39-44

[03:25] Team_045 possession (Score: 39-44)
Cole Simons drives, picks up Paul Leonard. Help arrives from Tobias Mitchell! Cole Simons attempts a Dunk. Wide open! Tobias Mitchell is 7.5 feet away. [MAN] COLE SIMONS MAKES IT!
Score: 41-44

[03:05] Team_076 possession (Score: 41-44)
FOUL! Shooting foul on Zion Butler. D'Angelo Tatum to the line for 2 free throws. [BONUS: 9 team fouls] (Zion Butler: 3 personal fouls)   FT 1/2: GOOD   FT 2/2: GOOD D'Angelo Tatum makes 2/2 from the line.
Score: 41-46

[02:47] Team_045 possession (Score: 41-46)
FOUL! Reach-in foul on Cade Barnes during the drive. [Team fouls: 3] No free throws, side out. (Cade Barnes: 1 personal fouls)

[02:32] Team_045 possession (Score: 41-46)
Cole Simons attempts a Midrange. Wide open! Paul Leonard is 7.4 feet away. [MAN] Cole Simons misses. Rebound secured by Tobias Mitchell.

[02:15] Team_076 possession (Score: 41-46)
Paul Leonard attempts a 3Pt. Wide open! Rudy Antetokounmpo is 8.8 feet away. [ZONE] Paul Leonard misses. Offensive rebound by D'Angelo Tatum! D'Angelo Tatum kicks it out.

[01:57] Team_076 possession (Score: 41-46)
D'Angelo Tatum drives, Zion Butler stays with him. D'Angelo Tatum attempts a Dunk. Wide open! Zion Butler is 8.2 feet away. [ZONE] D'ANGELO TATUM MAKES IT! Assist: Dejounte LaVine
Score: 41-48

[01:47] Team_045 possession (Score: 41-48)
Cole Simons attempts a 3Pt. Wide open! Paul Leonard is 7.6 feet away. [MAN] COLE SIMONS MAKES IT! Assist: Zion Butler
Score: 44-48

[01:32] Team_076 possession (Score: 44-48)
Paul Leonard throws a bad pass out of bounds! TURNOVER! (dead ball)

[01:32] Substitution (Team_045): Rudy Antetokounmpo OUT → John Wagner IN (stamina_rule2)

[01:32] Substitution (Team_045): Trae Russell OUT → Julius James IN (stamina_rule2)

[01:32] Substitution (Team_045): Cole Simons OUT → Gary Towns IN (stamina_rule2)

[01:32] Substitution (Team_045): DeMar Turner OUT → Tim Sexton IN (stamina_rule2)

[01:32] Substitution (Team_045): Zion Butler OUT → Stephen Paul IN (stamina_rule2)

[01:32] Substitution (Team_076): Dejounte LaVine OUT → Pascal Lowry IN (stamina_rule2)

[01:32] Substitution (Team_076): Tobias Mitchell OUT → Jalen Poole IN (stamina_rule2)

[01:32] Substitution (Team_076): Paul Leonard OUT → Vince Lowry IN (stamina_rule2)

[01:32] Substitution (Team_076): Cade Barnes OUT → Kevin Nowitzki IN (stamina_rule2)

[01:32] Substitution (Team_076): D'Angelo Tatum OUT → Jordan Doncic IN (stamina_rule2)

[01:15] Team_045 possession (Score: 44-48)
Julius James attempts a Layup. Contested by Jalen Poole (5.8 feet, MAN). Julius James misses. Offensive rebound by Tim Sexton! Tim Sexton kicks it out.

[00:56] Team_045 possession (Score: 44-48)
Stephen Paul attempts a Midrange. Contested by Kevin Nowitzki (4.6 feet, ZONE). Stephen Paul misses. Rebound secured by Vince Lowry.

[00:40] Team_076 possession (Score: 44-48)
Jalen Poole drives to the basket... Jalen Poole throws a bad pass out of bounds! TURNOVER! (dead ball)

[00:29] Team_045 possession (Score: 44-48)
Stephen Paul attempts a 3Pt. Contested by Vince Lowry (4.4 feet, ZONE). Stephen Paul misses. Rebound secured by Jordan Doncic.

[00:13] Team_076 possession (Score: 44-48)
Kevin Nowitzki drives, Tim Sexton stays with him. Kevin Nowitzki attempts a Dunk. Contested by Tim Sexton (3.1 feet, MAN). Kevin Nowitzki misses. Offensive rebound by Jordan Doncic! Jordan Doncic kicks it out.

================================================================================
                              2ND QUARTER COMPLETE                              
================================================================================

2ND QUARTER SCORE: Team_045 14, Team_076 29

BOX SCORE:
================================================================================

Team_045
--------------------------------------------------------------------------------
Player                MIN  PTS  REB  AST  TO      FG   FG%      3P   3P%
--------------------------------------------------------------------------------
Cole Simons            23    8    2    0   0   3/5    60.0     0/0   0.0
Trae Russell           23    4    0    0   0   2/8    25.0     0/0   0.0
Zion Butler            23    2    2    1   0   1/1   100.0     0/0   0.0
DeMar Turner           23    0    3    2   0   0/2     0.0     0/0   0.0
Rudy Antetokounmpo     23    0    0    0   0   0/1     0.0     0/0   0.0
Tim Sexton              1    0    1    0   0   0/0     0.0     0/0   0.0
Stephen Paul            1    0    0    0   0   0/2     0.0     0/0   0.0

TEAM: FG: 6/19 (31.6%), 3PT: 1/8 (12.5%), REB: 10 (4 off, 6 def), AST: 3, TO: 2
TEAM FOULS: 9 [Team_076 in BONUS]


Team_076
--------------------------------------------------------------------------------
Player                MIN  PTS  REB  AST  TO      FG   FG%      3P   3P%
--------------------------------------------------------------------------------
D'Angelo Tatum         23   12    6    1   0   5/8    62.5     0/0   0.0
Paul Leonard           23    7    0    0   0   3/3   100.0     0/0   0.0
Cade Barnes            23    5    2    1   0   2/3    66.7     0/0   0.0
Tobias Mitchell        23    3    5    0   0   1/1   100.0     0/0   0.0
Dejounte LaVine        23    2    0    3   0   1/3    33.3     0/0   0.0
Vince Lowry             1    0    1    0   0   0/0     0.0     0/0   0.0
Jordan Doncic           1    0    2    0   0   0/0     0.0     0/0   0.0

TEAM: FG: 12/18 (66.7%), 3PT: 3/6 (50.0%), REB: 14 (3 off, 11 def), AST: 5, TO: 2
TEAM FOULS: 3

================================================================================

================================================================================
                       3RD QUARTER - Team_045 vs Team_076                       
================================================================================

[12:00] Team_045 possession (Score: 44-48)
Trae Russell attempts a 3Pt. Wide open! Tobias Mitchell is 6.2 feet away. [MAN] Trae Russell misses. Offensive rebound by Zion Butler! Zion Butler puts it back in!
Score: 46-48

[11:43] Team_076 possession (Score: 46-48)
Dejounte LaVine drives to the basket... Dejounte LaVine loses the ball! Stripped by Rudy Antetokounmpo! TURNOVER! (live ball)

[11:28] Team_045 possession (Score: 46-48)
FOUL! Holding foul on Cade Barnes. [Team fouls: 1] No free throws, side out. (Cade Barnes: 1 personal fouls)

[11:15] Team_045 possession (Score: 46-48)
Zion Butler drives, Cade Barnes stays with him. Zion Butler attempts a Dunk. Contested by Cade Barnes (2.1 feet, ZONE). ZION BUTLER MAKES IT! Assist: Rudy Antetokounmpo
Score: 48-48

[10:58] Team_076 possession (Score: 48-48)
Paul Leonard drives, Cole Simons stays with him. Paul Leonard attempts a Dunk. Contested by Cole Simons (3.8 feet, MAN). Paul Leonard misses. Offensive rebound by Cade Barnes! Cade Barnes kicks it out.

[10:45] Team_076 possession (Score: 48-48)
Tobias Mitchell attempts a Midrange. Wide open! Cole Simons is 7.4 feet away. [MAN] TOBIAS MITCHELL MAKES IT! Assist: Paul Leonard
Score: 48-50

[10:31] Team_045 possession (Score: 48-50)
Cole Simons attempts a Layup. Contested by Paul Leonard (3.0 feet, MAN). COLE SIMONS MAKES IT! Assist: Trae Russell
Score: 50-50

[10:20] Team_076 possession (Score: 50-50)
FOUL! Reach-in foul on Zion Butler during the drive. [Team fouls: 1] No free throws, side out. (Zion Butler: 1 personal fouls)

[10:10] Team_076 possession (Score: 50-50)
Paul Leonard attempts a 3Pt. Heavily contested by Cole Simons (0.6 feet, ZONE)! Paul Leonard misses. Rebound secured by Zion Butler.

[09:52] Team_045 possession (Score: 50-50)
Rudy Antetokounmpo attempts a 3Pt. Contested by Cade Barnes (3.9 feet, ZONE). Rudy Antetokounmpo misses. Offensive rebound by Zion Butler! Zion Butler puts it back in!
Score: 52-50

[09:40] Team_076 possession (Score: 52-50)
D'Angelo Tatum drives and kicks out. Cade Barnes attempts a Midrange. Contested by Zion Butler (2.2 feet, MAN). CADE BARNES MAKES IT!
Score: 52-52

[09:30] Team_045 possession (Score: 52-52)
Trae Russell drives and kicks out. Cole Simons attempts a Midrange. Heavily contested by Paul Leonard (1.8 feet, MAN)! Cole Simons misses. Rebound secured by Cade Barnes.

[09:15] Team_076 possession (Score: 52-52)
FOUL! Shooting foul on Cole Simons. Paul Leonard to the line for 3 free throws. [Team fouls: 2] (Cole Simons: 1 personal fouls)   FT 1/3: MISS   FT 2/3: GOOD   FT 3/3: GOOD Paul Leonard makes 2/3 from the line.
Score: 52-54

[09:02] Team_045 possession (Score: 52-54)
Zion Butler drives to the basket... FOUL! Offensive foul on Zion Butler! D'Angelo Tatum drew the charge! [Team fouls: 3] (Zion Butler: 2 personal fouls) TURNOVER! (dead ball)

[08:47] Team_076 possession (Score: 52-54)
Dejounte LaVine attempts a 3Pt. Contested by Rudy Antetokounmpo (5.8 feet, MAN). Dejounte LaVine misses. Rebound secured by Zion Butler.

[08:33] Team_045 possession (Score: 52-54)
DeMar Turner attempts a Midrange. Contested by Cade Barnes (2.7 feet, ZONE). DeMar Turner misses. Rebound secured by Cade Barnes.

[08:20] Team_076 possession (Score: 52-54)
Dejounte LaVine drives to the basket... Dejounte LaVine loses control! Ball rolls out of bounds! TURNOVER! (dead ball)

[08:11] Team_045 possession (Score: 52-54)
DeMar Turner makes the Midrange and draws the foul on Cade Barnes! And-1! DeMar Turner to the line for 1. [Team fouls: 2] (Cade Barnes: 2 personal fouls)   FT 1/1: GOOD DeMar Turner makes 1/1 from the line.
Score: 55-54

[07:56] Team_076 possession (Score: 55-54)
Dejounte LaVine attempts a Midrange. Contested by Trae Russell (2.0 feet, ZONE). DEJOUNTE LAVINE MAKES IT! Assist: Paul Leonard
Score: 55-56

[07:39] Team_045 possession (Score: 55-56)
DeMar Turner attempts a Midrange. Contested by Cade Barnes (3.7 feet, MAN). DEMAR TURNER MAKES IT! Assist: Zion Butler
Score: 57-56

[07:29] Team_076 possession (Score: 57-56)
FOUL! Reach-in foul on Zion Butler during the drive. [Team fouls: 4] No free throws, side out. (Zion Butler: 3 personal fouls)

[07:15] Team_076 possession (Score: 57-56)
D'Angelo Tatum attempts a Layup. Wide open! Zion Butler is 6.5 feet away. [ZONE] D'Angelo Tatum misses. Rebound secured by Cole Simons.

[06:56] Team_045 possession (Score: 57-56)
Cole Simons attempts a 3Pt. Contested by Cade Barnes (3.8 feet, ZONE). COLE SIMONS MAKES IT! Assist: Rudy Antetokounmpo
Score: 60-56

[06:45] Team_076 possession (Score: 60-56)
FOUL! Holding foul on Cole Simons. [IN THE BONUS! 5 team fouls] Paul Leonard to the line for 2 free throws. (Cole Simons: 2 personal fouls)   FT 1/2: GOOD   FT 2/2: GOOD Paul Leonard makes 2/2 from the line.
Score: 60-58

[06:30] Team_045 possession (Score: 60-58)
Zion Butler loses control! Ball rolls out of bounds! TURNOVER! (dead ball)

[06:13] Team_076 possession (Score: 60-58)
D'Angelo Tatum drives and kicks out. Dejounte LaVine attempts a 3Pt. Contested by Rudy Antetokounmpo (4.0 feet, MAN). Dejounte LaVine misses. Rebound secured by DeMar Turner.

[05:58] Team_045 possession (Score: 60-58)
Trae Russell attempts a Midrange. Contested by Tobias Mitchell (5.2 feet, ZONE). TRAE RUSSELL MAKES IT! Assist: DeMar Turner
Score: 62-58

[05:40] Team_076 possession (Score: 62-58)
Cade Barnes makes the Layup and draws the foul on Zion Butler! And-1! Cade Barnes to the line for 1. [BONUS: 6 team fouls] (Zion Butler: 4 personal fouls)   FT 1/1: GOOD Cade Barnes makes 1/1 from the line.
Score: 62-61

[05:23] Team_045 possession (Score: 62-61)
Zion Butler makes the Dunk and draws the foul on Cade Barnes! And-1! Zion Butler to the line for 1. [Team fouls: 3] (Cade Barnes: 3 personal fouls)   FT 1/1: GOOD Zion Butler makes 1/1 from the line.
Score: 65-61

[05:12] Team_076 possession (Score: 65-61)
Tobias Mitchell attempts a Layup. Contested by Zion Butler (4.5 feet, ZONE). TOBIAS MITCHELL MAKES IT! Assist: Cade Barnes
Score: 65-63

[04:57] Team_045 possession (Score: 65-63)
DeMar Turner attempts a 3Pt. Heavily contested by Cade Barnes (0.6 feet, MAN)! DeMar Turner misses. Rebound secured by D'Angelo Tatum.

[04:47] Team_076 possession (Score: 65-63)
Cade Barnes attempts a 3Pt. Contested by Cole Simons (5.1 feet, ZONE). Cade Barnes misses. Rebound secured by DeMar Turner.

[04:32] Team_045 possession (Score: 65-63)
Rudy Antetokounmpo attempts a 3Pt. Heavily contested by Cade Barnes (1.7 feet, ZONE)! Rudy Antetokounmpo misses. Rebound secured by Tobias Mitchell.

[04:16] Team_076 possession (Score: 65-63)
Tobias Mitchell attempts a 3Pt. Wide open! Cole Simons is 6.2 feet away. [MAN] Tobias Mitchell misses. Offensive rebound by Cade Barnes! Cade Barnes kicks it out.

[04:05] Team_076 possession (Score: 65-63)
D'Angelo Tatum makes the Layup and draws the foul on Zion Butler! And-1! D'Angelo Tatum to the line for 1. [BONUS: 7 team fouls] (Zion Butler: 5 personal fouls)   FT 1/1: MISS D'Angelo Tatum makes 0/1 from the line. Rebound secured by DeMar Turner.
Score: 65-65

[03:48] Team_045 possession (Score: 65-65)
FOUL! Shooting foul on Cade Barnes. DeMar Turner to the line for 3 free throws. [Team fouls: 4] (Cade Barnes: 4 personal fouls)   FT 1/3: GOOD   FT 2/3: GOOD   FT 3/3: MISS DeMar Turner makes 2/3 from the line. Rebound secured by Tobias Mitchell.
Score: 67-65

[03:31] Team_076 possession (Score: 67-65)
Paul Leonard makes the Dunk and draws the foul on Zion Butler! And-1! Paul Leonard to the line for 1. [BONUS: 8 team fouls] (Zion Butler: 6 personal fouls) Zion Butler FOULS OUT!   FT 1/1: GOOD Paul Leonard makes 1/1 from the line.
Score: 67-68

[03:31] Substitution (Team_045): Zion Butler OUT (stamina: 70) → John Wagner IN (foul_out)

[03:17] Team_045 possession (Score: 67-68)
Rudy Antetokounmpo attempts a 3Pt. Contested by Dejounte LaVine (5.4 feet, MAN). Rudy Antetokounmpo misses. Rebound secured by Tobias Mitchell.

[02:59] Team_076 possession (Score: 67-68)
Tobias Mitchell drives to the basket... FOUL! Offensive foul on Tobias Mitchell! Cole Simons drew the charge! [Team fouls: 5] (Tobias Mitchell: 1 personal fouls) TURNOVER! (dead ball)

[02:46] Team_045 possession (Score: 67-68)
Rudy Antetokounmpo attempts a Midrange. Contested by Tobias Mitchell (4.9 feet, ZONE). Rudy Antetokounmpo misses. FOUL! Loose ball foul on D'Angelo Tatum during the rebound battle. [IN THE BONUS! 6 team fouls] DeMar Turner to the line for 2 free throws. (D'Angelo Tatum: 1 personal fouls)   FT 1/2: GOOD   FT 2/2: GOOD DeMar Turner makes 2/2 from the line.
Score: 69-68

[02:31] Team_076 possession (Score: 69-68)
Tobias Mitchell attempts a 3Pt. Wide open! Cole Simons is 6.2 feet away. [ZONE] Tobias Mitchell misses. Rebound secured by DeMar Turner.

[02:14] Team_045 possession (Score: 69-68)
Cole Simons commits a violation (traveling/carry)! TURNOVER! (dead ball)

[02:14] Substitution (Team_045): Rudy Antetokounmpo OUT → Julius James IN (stamina_rule2)

[02:14] Substitution (Team_045): Trae Russell OUT → Rudy Antetokounmpo IN (stamina_rule2)

[02:14] Substitution (Team_045): Cole Simons OUT → Gary Towns IN (stamina_rule2)

[02:14] Substitution (Team_045): DeMar Turner OUT → Tim Sexton IN (stamina_rule2)

[02:14] Substitution (Team_076): Dejounte LaVine OUT → Pascal Lowry IN (stamina_rule2)

[02:14] Substitution (Team_076): Tobias Mitchell OUT → Jalen Poole IN (stamina_rule2)

[02:14] Substitution (Team_076): Paul Leonard OUT → Vince Lowry IN (stamina_rule2)

[02:14] Substitution (Team_076): Cade Barnes OUT → Kevin Nowitzki IN (stamina_rule2)

[02:14] Substitution (Team_076): D'Angelo Tatum OUT → Jordan Doncic IN (stamina_rule2)

[02:01] Team_076 possession (Score: 69-68)
Jalen Poole attempts a 3Pt. Contested by Rudy Antetokounmpo (4.8 feet, ZONE). JALEN POOLE MAKES IT! Assist: Pascal Lowry
Score: 69-71

[01:47] Team_045 possession (Score: 69-71)
Gary Towns attempts a 3Pt. Heavily contested by Vince Lowry (1.7 feet, MAN)! GARY TOWNS MAKES IT! Assist: Tim Sexton
Score: 72-71

[01:29] Team_076 possession (Score: 72-71)
Vince Lowry attempts a Layup. Contested by Tim Sexton (5.6 feet, ZONE). VINCE LOWRY MAKES IT!
Score: 72-73

[01:15] Team_045 possession (Score: 72-73)
Rudy Antetokounmpo attempts a 3Pt. Contested by Vince Lowry (5.5 feet, ZONE). RUDY ANTETOKOUNMPO MAKES IT! Assist: Gary Towns
Score: 75-73

[00:59] Team_076 possession (Score: 75-73)
Jalen Poole loses the ball! Stripped by Julius James! TURNOVER! (live ball)

[00:40] Team_045 possession (Score: 75-73)
Gary Towns attempts a Layup. Contested by Jordan Doncic (6.0 feet, ZONE). GARY TOWNS MAKES IT! Assist: Rudy Antetokounmpo
Score: 77-73

[00:25] Team_076 possession (Score: 77-73)
Jordan Doncic drives, Tim Sexton stays with him. Jordan Doncic attempts a Layup. Wide open! Tim Sexton is 6.1 feet away. [MAN] Jordan Doncic misses. Rebound secured by Julius James.

[00:13] Team_045 possession (Score: 77-73)
Julius James attempts a Midrange. Contested by Jalen Poole (2.9 feet, ZONE). JULIUS JAMES MAKES IT! Assist: Rudy Antetokounmpo
Score: 79-73

================================================================================
                              3RD QUARTER COMPLETE                              
================================================================================

3RD QUARTER SCORE: Team_045 35, Team_076 25

BOX SCORE:
================================================================================

Team_045
--------------------------------------------------------------------------------
Player                MIN  PTS  REB  AST  TO      FG   FG%      3P   3P%
--------------------------------------------------------------------------------
Zion Butler            32    9    4    1   0   4/4   100.0     0/0   0.0
DeMar Turner           33    7    4    1   0   3/6    50.0     0/0   0.0
Cole Simons            33    5    1    0   0   2/2   100.0     0/0   0.0
Gary Towns              3    5    0    1   0   2/2   100.0     0/0   0.0
Rudy Antetokounmpo     35    3    0    4   0   1/3    33.3     0/0   0.0
Trae Russell           33    2    0    1   0   1/2    50.0     0/0   0.0
Julius James            3    2    1    0   0   1/1   100.0     0/0   0.0
Tim Sexton              3    0    0    1   0   0/0     0.0     0/0   0.0

TEAM: FG: 14/20 (70.0%), 3PT: 5/9 (55.6%), REB: 10 (2 off, 8 def), AST: 9, TO: 3
TEAM FOULS: 8 [Team_076 in BONUS]


Team_076
--------------------------------------------------------------------------------
Player                MIN  PTS  REB  AST  TO      FG   FG%      3P   3P%
--------------------------------------------------------------------------------
Paul Leonard           33    7    0    2   0   3/4    75.0     0/0   0.0
Cade Barnes            33    5    4    1   0   2/3    66.7     0/0   0.0
Tobias Mitchell        33    4    3    0   0   2/3    66.7     0/0   0.0
Jalen Poole             3    3    0    0   0   1/1   100.0     0/0   0.0
Dejounte LaVine        33    2    0    0   0   1/2    50.0     0/0   0.0
Vince Lowry             3    2    0    0   0   1/1   100.0     0/0   0.0
D'Angelo Tatum         33    0    1    0   0   0/3     0.0     0/0   0.0
Pascal Lowry            3    0    0    1   0   0/0     0.0     0/0   0.0
Jordan Doncic           3    0    0    0   0   0/1     0.0     0/0   0.0

TEAM: FG: 10/18 (55.6%), 3PT: 2/6 (33.3%), REB: 8 (2 off, 6 def), AST: 4, TO: 4
TEAM FOULS: 6 [Team_045 in BONUS]

================================================================================

================================================================================
                       4TH QUARTER - Team_045 vs Team_076                       
================================================================================

[12:00] Team_045 possession (Score: 79-73)
Rudy Antetokounmpo drives, Cade Barnes stays with him. Rudy Antetokounmpo attempts a Layup. Wide open! Cade Barnes is 6.6 feet away. [ZONE] RUDY ANTETOKOUNMPO MAKES IT! Assist: Zion Butler
Score: 81-73

[11:47] Team_076 possession (Score: 81-73)
D'Angelo Tatum attempts a Layup. BLOCKED BY ZION BUTLER! Ball is loose! Rebound secured by Cole Simons.

[11:31] Team_045 possession (Score: 81-73)
Trae Russell drives, Cade Barnes stays with him. Trae Russell attempts a Dunk. Contested by Cade Barnes (4.5 feet, ZONE). Trae Russell misses. Offensive rebound by Zion Butler! Zion Butler puts it back in!
Score: 83-73

[11:20] Team_076 possession (Score: 83-73)
Dejounte LaVine attempts a Midrange. Contested by Rudy Antetokounmpo (4.5 feet, MAN). Dejounte LaVine misses. Rebound secured by DeMar Turner.

[11:06] Team_045 possession (Score: 83-73)
Rudy Antetokounmpo attempts a 3Pt. Contested by Cade Barnes (3.3 feet, ZONE). Rudy Antetokounmpo misses. FOUL! Loose ball foul on Tobias Mitchell during the rebound battle. [Team fouls: 1] No free throws, side out. (Tobias Mitchell: 1 personal fouls)

[10:51] Team_045 possession (Score: 83-73)
Zion Butler drives and kicks out. Cole Simons attempts a Midrange. Contested by Paul Leonard (6.0 feet, ZONE). Cole Simons misses. Rebound secured by Tobias Mitchell.

[10:40] Team_076 possession (Score: 83-73)
Paul Leonard attempts a Midrange. Contested by Cole Simons (2.5 feet, MAN). Paul Leonard misses. Rebound secured by Zion Butler.

[10:23] Team_045 possession (Score: 83-73)
Zion Butler drives, picks up D'Angelo Tatum. Help arrives from Tobias Mitchell! Zion Butler attempts a Dunk. Heavily contested by Tobias Mitchell (0.7 feet, MAN)! Zion Butler misses. Rebound secured by Cade Barnes.

[10:13] Team_076 possession (Score: 83-73)
Paul Leonard attempts a Layup. Heavily contested by Zion Butler (1.6 feet, ZONE)! Paul Leonard misses. Rebound secured by DeMar Turner.

[09:58] Team_045 possession (Score: 83-73)
Trae Russell throws a bad pass! Stolen by Tobias Mitchell! TURNOVER! (live ball)

[09:45] Team_076 possession (Score: 83-73)
Paul Leonard attempts a 3Pt. Contested by Cole Simons (2.8 feet, MAN). Paul Leonard misses. Rebound secured by Cole Simons.

[09:33] Team_045 possession (Score: 83-73)
Trae Russell attempts a 3Pt. Contested by Cade Barnes (4.1 feet, ZONE). Trae Russell misses. Offensive rebound by DeMar Turner! DeMar Turner kicks it out.

[09:19] Team_045 possession (Score: 83-73)
FOUL! Shooting foul on D'Angelo Tatum. Zion Butler to the line for 2 free throws. [Team fouls: 2] (D'Angelo Tatum: 1 personal fouls)   FT 1/2: GOOD   FT 2/2: GOOD Zion Butler makes 2/2 from the line.
Score: 85-73

[09:03] Team_076 possession (Score: 85-73)
Cade Barnes attempts a Midrange. Contested by Zion Butler (5.0 feet, ZONE). Cade Barnes misses. Offensive rebound by Cade Barnes! Cade Barnes kicks it out.

[08:47] Team_076 possession (Score: 85-73)
Cade Barnes drives, DeMar Turner stays with him. Cade Barnes attempts a Dunk. Wide open! DeMar Turner is 6.2 feet away. [MAN] CADE BARNES MAKES IT!
Score: 85-75

[08:33] Team_045 possession (Score: 85-75)
DeMar Turner attempts a 3Pt. Wide open! Cade Barnes is 7.2 feet away. [ZONE] DeMar Turner misses. Rebound secured by Cade Barnes.

[08:20] Team_076 possession (Score: 85-75)
Dejounte LaVine attempts a 3Pt. Wide open! Rudy Antetokounmpo is 7.9 feet away. [MAN] DEJOUNTE LAVINE MAKES IT!
Score: 85-78

[08:08] Team_045 possession (Score: 85-78)
Zion Butler drives, D'Angelo Tatum stays with him. Zion Butler attempts a Dunk. Contested by D'Angelo Tatum (3.5 feet, MAN). ZION BUTLER MAKES IT! Assist: Rudy Antetokounmpo
Score: 87-78

[07:51] Team_076 possession (Score: 87-78)
D'Angelo Tatum throws a bad pass! Stolen by Zion Butler! TURNOVER! (live ball)

[07:34] Team_045 possession (Score: 87-78)
Cole Simons attempts a 3Pt. Contested by Cade Barnes (3.2 feet, ZONE). Cole Simons misses. Rebound secured by D'Angelo Tatum.

[07:17] Team_076 possession (Score: 87-78)
Cade Barnes attempts a Midrange. Contested by DeMar Turner (5.9 feet, MAN). Cade Barnes misses. Rebound secured by Cole Simons.

[07:02] Team_045 possession (Score: 87-78)
Cole Simons attempts a 3Pt. Contested by Paul Leonard (5.4 feet, ZONE). COLE SIMONS MAKES IT! Assist: Rudy Antetokounmpo
Score: 90-78

[06:45] Team_076 possession (Score: 90-78)
Cade Barnes attempts a Midrange. Contested by DeMar Turner (5.0 feet, ZONE). Cade Barnes misses. Offensive rebound by D'Angelo Tatum! D'Angelo Tatum kicks it out.

[06:34] Team_076 possession (Score: 90-78)
Tobias Mitchell attempts a Midrange. Contested by DeMar Turner (3.0 feet, ZONE). Tobias Mitchell misses. Offensive rebound by Cade Barnes! Cade Barnes kicks it out.

[06:20] Team_076 possession (Score: 90-78)
D'Angelo Tatum attempts a 3Pt. Contested by Trae Russell (4.3 feet, ZONE). D'Angelo Tatum misses. Rebound secured by DeMar Turner.

[06:06] Team_045 possession (Score: 90-78)
Zion Butler drives and kicks out. Cole Simons attempts a Midrange. Contested by Cade Barnes (4.4 feet, ZONE). Cole Simons misses. Rebound secured by Cade Barnes.

[05:51] Team_076 possession (Score: 90-78)
FOUL! Shooting foul on Zion Butler. Dejounte LaVine to the line for 2 free throws. [Team fouls: 1] (Zion Butler: 1 personal fouls)   FT 1/2: GOOD   FT 2/2: MISS Dejounte LaVine makes 1/2 from the line. Rebound secured by Zion Butler.
Score: 90-79

[05:37] Team_045 possession (Score: 90-79)
Cole Simons attempts a Midrange. Contested by Paul Leonard (5.9 feet, MAN). COLE SIMONS MAKES IT!
Score: 92-79

[05:23] Team_076 possession (Score: 92-79)
Paul Leonard attempts a 3Pt. Contested by Cole Simons (3.6 feet, MAN). Paul Leonard misses. Rebound secured by Cole Simons.

[05:04] Team_045 possession (Score: 92-79)
DeMar Turner attempts a Layup. Wide open! Cade Barnes is 8.1 feet away. [ZONE] DEMAR TURNER MAKES IT!
Score: 94-79

[04:52] Team_076 possession (Score: 94-79)
FOUL! Shooting foul on Rudy Antetokounmpo. Paul Leonard to the line for 2 free throws. [Team fouls: 2] (Rudy Antetokounmpo: 1 personal fouls)   FT 1/2: MISS   FT 2/2: GOOD Paul Leonard makes 1/2 from the line.
Score: 94-80

[04:37] Team_045 possession (Score: 94-80)
Rudy Antetokounmpo attempts a Midrange. Wide open! Paul Leonard is 9.6 feet away. [ZONE] Rudy Antetokounmpo misses. Offensive rebound by DeMar Turner! DeMar Turner kicks it out.

[04:25] Team_045 possession (Score: 94-80)
Zion Butler attempts a Layup. Contested by D'Angelo Tatum (4.0 feet, MAN). Zion Butler misses. Rebound secured by Tobias Mitchell.

[04:11] Team_076 possession (Score: 94-80)
Cade Barnes attempts a Midrange. Contested by DeMar Turner (4.6 feet, MAN). CADE BARNES MAKES IT!
Score: 94-82

[03:57] Team_045 possession (Score: 94-82)
Trae Russell attempts a Midrange. Contested by Tobias Mitchell (5.5 feet, MAN). Trae Russell misses. Rebound secured by D'Angelo Tatum.

[03:45] Team_076 possession (Score: 94-82)
Dejounte LaVine attempts a Midrange. Wide open! Rudy Antetokounmpo is 6.7 feet away. [MAN] Dejounte LaVine misses. Rebound secured by Cole Simons.

[03:33] Team_045 possession (Score: 94-82)
Rudy Antetokounmpo attempts a 3Pt. Contested by Dejounte LaVine (3.4 feet, MAN). RUDY ANTETOKOUNMPO MAKES IT! Assist: Zion Butler
Score: 97-82

[03:19] Team_076 possession (Score: 97-82)
Tobias Mitchell attempts a Layup. Contested by Trae Russell (2.0 feet, MAN). Tobias Mitchell misses. Rebound secured by DeMar Turner.

[03:00] Team_045 possession (Score: 97-82)
Zion Butler throws a bad pass out of bounds! TURNOVER! (dead ball)

[03:00] Substitution (Team_045): Rudy Antetokounmpo OUT → John Wagner IN (stamina_rule2)

[03:00] Substitution (Team_045): Trae Russell OUT → Julius James IN (stamina_rule2)

[03:00] Substitution (Team_045): Cole Simons OUT → Gary Towns IN (stamina_rule2)

[03:00] Substitution (Team_045): DeMar Turner OUT → Tim Sexton IN (stamina_rule2)

[03:00] Substitution (Team_045): Zion Butler OUT → Stephen Paul IN (stamina_rule2)

[03:00] Substitution (Team_076): Dejounte LaVine OUT → Pascal Lowry IN (stamina_rule2)

[03:00] Substitution (Team_076): Tobias Mitchell OUT → Jalen Poole IN (stamina_rule2)

[03:00] Substitution (Team_076): Paul Leonard OUT → Vince Lowry IN (stamina_rule2)

[03:00] Substitution (Team_076): Cade Barnes OUT → Kevin Nowitzki IN (stamina_rule2)

[03:00] Substitution (Team_076): D'Angelo Tatum OUT → Jordan Doncic IN (stamina_rule2)

[02:46] Team_076 possession (Score: 97-82)
Jordan Doncic attempts a Midrange. Heavily contested by Gary Towns (1.4 feet, ZONE)! JORDAN DONCIC MAKES IT! Assist: Jalen Poole
Score: 97-84

[02:28] Team_045 possession (Score: 97-84)
Julius James drives, Jordan Doncic stays with him. Julius James attempts a Layup. Contested by Jordan Doncic (3.8 feet, ZONE). Julius James misses. Offensive rebound by Julius James! Julius James kicks it out.

[02:12] Team_045 possession (Score: 97-84)
Gary Towns drives and kicks out. Stephen Paul attempts a 3Pt. Wide open! Vince Lowry is 7.2 feet away. [ZONE] Stephen Paul misses. Rebound secured by Jordan Doncic.

[01:55] Team_076 possession (Score: 97-84)
Kevin Nowitzki attempts a Midrange. Contested by Tim Sexton (2.8 feet, MAN). KEVIN NOWITZKI MAKES IT!
Score: 97-86

[01:42] Team_045 possession (Score: 97-86)
Tim Sexton makes the Layup and draws the foul on Jordan Doncic! And-1! Tim Sexton to the line for 1. [Team fouls: 3] (Jordan Doncic: 1 personal fouls)   FT 1/1: GOOD Tim Sexton makes 1/1 from the line.
Score: 100-86

[01:24] Team_076 possession (Score: 100-86)
Kevin Nowitzki attempts a Midrange. Contested by Tim Sexton (5.3 feet, MAN). KEVIN NOWITZKI MAKES IT! Assist: Jordan Doncic
Score: 100-88

[01:07] Team_045 possession (Score: 100-88)
Tim Sexton attempts a 3Pt. Contested by Vince Lowry (2.6 feet, ZONE). Tim Sexton misses. Offensive rebound by Tim Sexton! Tim Sexton kicks it out.

[00:54] Team_045 possession (Score: 100-88)
FOUL! Offensive foul on Tim Sexton! Kevin Nowitzki drew the charge! [Team fouls: 3] (Tim Sexton: 1 personal fouls) TURNOVER! (dead ball)

[00:40] Team_076 possession (Score: 100-88)
FOUL! Reach-in foul on Stephen Paul during the drive. [Team fouls: 4] No free throws, side out. (Stephen Paul: 1 personal fouls)

[00:26] Team_076 possession (Score: 100-88)
Jordan Doncic drives to the basket... Jordan Doncic loses the ball! Stripped by Stephen Paul! TURNOVER! (live ball)

[00:12] Team_045 possession (Score: 100-88)
Tim Sexton attempts a Midrange. Heavily contested by Kevin Nowitzki (0.5 feet, MAN)! Tim Sexton misses. Rebound secured by Kevin Nowitzki.

================================================================================
                              4TH QUARTER COMPLETE                              
================================================================================

4TH QUARTER SCORE: Team_045 21, Team_076 15

BOX SCORE:
================================================================================

Team_045
--------------------------------------------------------------------------------
Player                MIN  PTS  REB  AST  TO      FG   FG%      3P   3P%
--------------------------------------------------------------------------------
Zion Butler            41    6    4    2   0   3/7    42.9     0/0   0.0
Rudy Antetokounmpo     44    5    0    2   0   2/2   100.0     0/0   0.0
Cole Simons            42    5    5    0   0   2/3    66.7     0/0   0.0
Tim Sexton              6    3    1    0   0   1/2    50.0     0/0   0.0
DeMar Turner           42    2    6    0   0   1/2    50.0     0/0   0.0
Trae Russell           42    0    0    0   0   0/1     0.0     0/0   0.0
Julius James            6    0    1    0   0   0/0     0.0     0/0   0.0
Gary Towns              6    0    0    0   0   0/1     0.0     0/0   0.0

TEAM: FG: 9/18 (50.0%), 3PT: 2/4 (50.0%), REB: 17 (6 off, 11 def), AST: 4, TO: 3
TEAM FOULS: 4


Team_076
--------------------------------------------------------------------------------
Player                MIN  PTS  REB  AST  TO      FG   FG%      3P   3P%
--------------------------------------------------------------------------------
Cade Barnes            42    4    5    0   0   2/3    66.7     0/0   0.0
Kevin Nowitzki          6    4    1    0   0   2/2   100.0     0/0   0.0
Dejounte LaVine        42    3    0    0   0   1/4    25.0     0/0   0.0
Jordan Doncic           6    2    1    1   0   1/1   100.0     0/0   0.0
Paul Leonard           42    1    0    0   0   1/5    20.0     0/0   0.0
D'Angelo Tatum         42    0    3    0   0   0/2     0.0     0/0   0.0
Tobias Mitchell        42    0    2    0   0   0/1     0.0     0/0   0.0
Jalen Poole             6    0    0    1   0   0/0     0.0     0/0   0.0

TEAM: FG: 7/18 (38.9%), 3PT: 1/4 (25.0%), REB: 12 (3 off, 9 def), AST: 2, TO: 2
TEAM FOULS: 3

================================================================================

================================================================================
                               FULL GAME COMPLETE                               
================================================================================

FINAL SCORE: Team_045 100, Team_076 88

SCORING BY QUARTER:
--------------------------------------------------------------------------------
Team                     Q1     Q2     Q3     Q4    FINAL
--------------------------------------------------------------------------------
Team_045                 30     14     35     21      100
Team_076                 19     29     25     15       88
--------------------------------------------------------------------------------

FULL GAME BOX SCORE:
================================================================================

Team_045
--------------------------------------------------------------------------------
Player                MIN  PTS  REB  AST  TO      FG   FG%      3P   3P%      FT STL BLK
--------------------------------------------------------------------------------
Rudy Antetokounmpo     44   11    0    8   1   5/12   41.7   3/7    42.9   0/2     1   1
Trae Russell           42   16    0    5   2  10/18   55.6   2/6    33.3   1/1     0   0
Cole Simons            42   26   15    0   3  12/15   80.0   3/5    60.0   1/1     1   0
DeMar Turner           42   14   18    4   3   5/12   41.7   0/4     0.0   6/7     1   0
Zion Butler            41   21   13    5   2   6/10   60.0   0/0     0.0   5/5     1   2
John Wagner             7    0    0    0   0   0/0     0.0   0/0     0.0   0/0     0   0
Julius James            6    2    2    0   0   1/1   100.0   0/0     0.0   0/0     1   0
Gary Towns              6    5    0    1   0   2/3    66.7   1/1   100.0   0/0     0   0
Tim Sexton              6    3    2    1   1   1/2    50.0   0/0     0.0   1/1     0   0
Stephen Paul            4    0    0    0   0   0/2     0.0   0/1     0.0   0/0     1   0

TEAM: FG: 42/75 (56.0%), 3PT: 9/24 (37.5%), REB: 52 (15 off, 37 def), AST: 24, TO: 12


Team_076
--------------------------------------------------------------------------------
Player                MIN  PTS  REB  AST  TO      FG   FG%      3P   3P%      FT STL BLK
--------------------------------------------------------------------------------
Dejounte LaVine        42    7    0    6   1   4/11   36.4   2/6    33.3   3/5     0   0
Tobias Mitchell        42   10   10    0   2   4/11   36.4   2/6    33.3   0/0     1   0
Paul Leonard           42   22    0    3   3  10/17   58.8   3/8    37.5   6/8     1   1
Cade Barnes            42   19   17    3   0   7/12   58.3   0/3     0.0   5/5     1   0
D'Angelo Tatum         42   16   12    1   1   6/16   37.5   0/2     0.0   5/8     1   0
Pascal Lowry            6    0    0    1   0   0/0     0.0   0/0     0.0   0/0     0   0
Jalen Poole             6    3    0    1   1   1/1   100.0   1/1   100.0   0/0     0   0
Vince Lowry             6    2    1    0   1   1/1   100.0   0/0     0.0   0/0     0   0
Kevin Nowitzki          6    4    1    0   0   2/2   100.0   0/0     0.0   0/0     0   0
Jordan Doncic           6    2    3    1   1   1/2    50.0   0/0     0.0   0/0     0   0

TEAM: FG: 37/74 (50.0%), 3PT: 8/26 (30.8%), REB: 42 (11 off, 31 def), AST: 16, TO: 10

================================================================================
