================================================================================
                        FULL GAME - Team_022 vs Team_041                        
================================================================================

================================================================================
                       1ST QUARTER - Team_022 vs Team_041                       
================================================================================

[12:00] Team_022 possession (Score: 0-0)
Dirk Markkanen attempts a 3Pt. Contested by Stephen Ingram (4.1 feet, ZONE). Dirk Markkanen misses. Rebound secured by Dejounte Griffin.

[11:45] Team_041 possession (Score: 0-0)
FOUL! Reach-in foul on Myles Anthony during the drive. [Team fouls: 1] No free throws, side out. (Myles Anthony: 1 personal fouls)

[11:31] Team_041 possession (Score: 0-0)
Scottie Turner attempts a 3Pt. Contested by Malcolm Allen (2.1 feet, MAN). SCOTTIE TURNER MAKES IT! Assist: Dejounte Griffin
Score: 0-3

[11:18] Team_022 possession (Score: 0-3)
Malcolm Allen attempts a 3Pt. Contested by Scottie Turner (5.8 feet, ZONE). MALCOLM ALLEN MAKES IT! Assist: Myles Anthony
Score: 3-3

[11:06] Team_041 possession (Score: 3-3)
Terry Barrett attempts a Midrange. Contested by Dirk Markkanen (2.4 feet, MAN). TERRY BARRETT MAKES IT! Assist: Jarrett Anunoby
Score: 3-5

[10:54] Team_022 possession (Score: 3-5)
Michael Ginobili drives, Jarrett Anunoby stays with him. Michael Ginobili attempts a Layup. Contested by Jarrett Anunoby (2.2 feet, MAN). MICHAEL GINOBILI MAKES IT! Assist: Malcolm Allen
Score: 5-5

[10:40] Team_041 possession (Score: 5-5)
Stephen Ingram attempts a 3Pt. Wide open! Lamelo Dosunmu is 8.6 feet away. [MAN] STEPHEN INGRAM MAKES IT! Assist: Terry Barrett
Score: 5-8

[10:23] Team_022 possession (Score: 5-8)
Lamelo Dosunmu drives and kicks out. Dirk Markkanen attempts a 3Pt. Heavily contested by Terry Barrett (1.2 feet, MAN)! Dirk Markkanen misses. Rebound secured by Dejounte Griffin.

[10:06] Team_041 possession (Score: 5-8)
Jarrett Anunoby makes the Layup and draws the foul on Michael Ginobili! And-1! Jarrett Anunoby to the line for 1. [Team fouls: 2] (Michael Ginobili: 1 personal fouls)   FT 1/1: GOOD Jarrett Anunoby makes 1/1 from the line.
Score: 5-11

[09:51] Team_022 possession (Score: 5-11)
Dirk Markkanen drives, Terry Barrett stays with him. Dirk Markkanen attempts a Dunk. Wide open! Terry Barrett is 6.5 feet away. [MAN] DIRK MARKKANEN MAKES IT!
Score: 7-11

[09:37] Team_041 possession (Score: 7-11)
Jarrett Anunoby drives, picks up Dirk Markkanen. Help arrives from Michael Ginobili! Jarrett Anunoby attempts a Dunk. Wide open! Michael Ginobili is 6.6 feet away. [ZONE] Jarrett Anunoby misses. Rebound secured by Michael Ginobili.

[09:23] Team_022 possession (Score: 7-11)
Dirk Markkanen attempts a Dunk. BLOCKED BY TERRY BARRETT! Ball is loose! Rebound secured by Dejounte Griffin.

[09:14] Team_041 possession (Score: 7-11)
FOUL! Shooting foul on Dirk Markkanen. Terry Barrett to the line for 2 free throws. [Team fouls: 3] (Dirk Markkanen: 1 personal fouls)   FT 1/2: GOOD   FT 2/2: MISS Terry Barrett makes 1/2 from the line. Rebound secured by Myles Anthony.
Score: 7-12

[08:59] Team_022 possession (Score: 7-12)
Myles Anthony attempts a Layup. Contested by Dejounte Griffin (5.3 feet, MAN). Myles Anthony misses. Rebound secured by Stephen Ingram.

[08:43] Team_041 possession (Score: 7-12)
FOUL! Shooting foul on Malcolm Allen. Scottie Turner to the line for 2 free throws. [Team fouls: 4] (Malcolm Allen: 1 personal fouls)   FT 1/2: MISS   FT 2/2: GOOD Scottie Turner makes 1/2 from the line.
Score: 7-13

[08:26] Team_022 possession (Score: 7-13)
Myles Anthony attempts a 3Pt. Contested by Dejounte Griffin (3.4 feet, MAN). Myles Anthony misses. Rebound secured by Terry Barrett.

[08:16] Team_041 possession (Score: 7-13)
FOUL! Shooting foul on Michael Ginobili. Dejounte Griffin to the line for 2 free throws. [BONUS: 5 team fouls] (Michael Ginobili: 2 personal fouls)   FT 1/2: MISS   FT 2/2: MISS Dejounte Griffin makes 0/2 from the line. Rebound secured by Dirk Markkanen.

[08:02] Team_022 possession (Score: 7-13)
Michael Ginobili attempts a 3Pt. Contested by Jarrett Anunoby (5.2 feet, MAN). Michael Ginobili misses. Rebound secured by Dejounte Griffin.

[07:51] Team_041 possession (Score: 7-13)
Terry Barrett attempts a Midrange. Contested by Michael Ginobili (2.8 feet, ZONE). Terry Barrett misses. Rebound secured by Dirk Markkanen.

[07:34] Team_022 possession (Score: 7-13)
Dirk Markkanen drives and kicks out. Malcolm Allen attempts a 3Pt. Contested by Scottie Turner (5.8 feet, ZONE). Malcolm Allen misses. Offensive rebound by Dirk Markkanen! Dirk Markkanen puts it back in!
Score: 9-13

[07:17] Team_041 possession (Score: 9-13)
Terry Barrett drives to the basket... FOUL! Offensive foul on Terry Barrett! Dirk Markkanen drew the charge! [Team fouls: 1] (Terry Barrett: 1 personal fouls) TURNOVER! (dead ball)

[06:59] Team_022 possession (Score: 9-13)
Lamelo Dosunmu attempts a Midrange. Wide open! Stephen Ingram is 6.0 feet away. [MAN] Lamelo Dosunmu misses. FOUL! Loose ball foul on Dejounte Griffin during the rebound battle. [Team fouls: 2] No free throws, side out. (Dejounte Griffin: 1 personal fouls)

[06:44] Team_022 possession (Score: 9-13)
Lamelo Dosunmu attempts a 3Pt. Contested by Stephen Ingram (3.9 feet, MAN). Lamelo Dosunmu misses. Rebound secured by Dejounte Griffin.

[06:26] Team_041 possession (Score: 9-13)
Terry Barrett makes the Midrange and draws the foul on Michael Ginobili! And-1! Terry Barrett to the line for 1. [BONUS: 6 team fouls] (Michael Ginobili: 3 personal fouls)   FT 1/1: GOOD Terry Barrett makes 1/1 from the line.
Score: 9-16

[06:10] Team_022 possession (Score: 9-16)
Dirk Markkanen attempts a Midrange. Contested by Dejounte Griffin (3.2 feet, ZONE). DIRK MARKKANEN MAKES IT! Assist: Myles Anthony
Score: 11-16

[05:53] Team_041 possession (Score: 11-16)
Terry Barrett drives, Dirk Markkanen stays with him. Terry Barrett attempts a Layup. Wide open! Dirk Markkanen is 6.2 feet away. [MAN] TERRY BARRETT MAKES IT!
Score: 11-18

[05:38] Team_022 possession (Score: 11-18)
Lamelo Dosunmu drives, Stephen Ingram stays with him. Lamelo Dosunmu attempts a Dunk. Contested by Stephen Ingram (4.7 feet, MAN). LAMELO DOSUNMU MAKES IT! Assist: Myles Anthony
Score: 13-18

[05:24] Team_041 possession (Score: 13-18)
Terry Barrett attempts a 3Pt. Contested by Dirk Markkanen (5.5 feet, MAN). TERRY BARRETT MAKES IT! Assist: Scottie Turner
Score: 13-21

[05:08] Team_022 possession (Score: 13-21)
Michael Ginobili drives and kicks out. Lamelo Dosunmu attempts a 3Pt. Wide open! Stephen Ingram is 7.9 feet away. [MAN] Lamelo Dosunmu misses. Offensive rebound by Michael Ginobili! Michael Ginobili kicks it out.

[04:51] Team_022 possession (Score: 13-21)
Dirk Markkanen attempts a 3Pt. Contested by Terry Barrett (3.7 feet, MAN). Dirk Markkanen misses. Rebound secured by Stephen Ingram.

[04:38] Team_041 possession (Score: 13-21)
Stephen Ingram attempts a 3Pt. Contested by Lamelo Dosunmu (2.7 feet, MAN). STEPHEN INGRAM MAKES IT! Assist: Jarrett Anunoby
Score: 13-24

[04:21] Team_022 possession (Score: 13-24)
Dirk Markkanen loses the ball! Stripped by Terry Barrett! TURNOVER! (live ball)

[04:05] Team_041 possession (Score: 13-24)
Jarrett Anunoby attempts a 3Pt. Contested by Michael Ginobili (4.1 feet, ZONE). Jarrett Anunoby misses. Rebound secured by Dirk Markkanen.

[03:53] Team_022 possession (Score: 13-24)
Michael Ginobili attempts a 3Pt. Contested by Scottie Turner (3.2 feet, ZONE). Michael Ginobili misses. Offensive rebound by Dirk Markkanen! Dirk Markkanen's putback is no good. Offensive rebound by Dirk Markkanen! Dirk Markkanen kicks it out.

[03:38] Team_022 possession (Score: 13-24)
Dirk Markkanen drives, Terry Barrett stays with him. Dirk Markkanen attempts a Dunk. Contested by Terry Barrett (4.5 feet, MAN). Dirk Markkanen misses. Rebound secured by Terry Barrett.

[03:23] Team_041 possession (Score: 13-24)
Stephen Ingram attempts a Midrange. Heavily contested by Myles Anthony (1.7 feet, ZONE)! Stephen Ingram misses. Rebound secured by Myles Anthony.

[03:13] Team_022 possession (Score: 13-24)
Malcolm Allen attempts a 3Pt. Contested by Scottie Turner (4.6 feet, MAN). MALCOLM ALLEN MAKES IT! Assist: Lamelo Dosunmu
Score: 16-24

[02:59] Team_041 possession (Score: 16-24)
Dejounte Griffin attempts a Layup. Contested by Myles Anthony (3.2 feet, MAN). DEJOUNTE GRIFFIN MAKES IT!
Score: 16-26

[02:42] Team_022 possession (Score: 16-26)
Malcolm Allen drives and kicks out. Myles Anthony attempts a Midrange. Wide open! Stephen Ingram is 7.5 feet away. [ZONE] Myles Anthony misses. Rebound secured by Dejounte Griffin.

[02:31] Team_041 possession (Score: 16-26)
Terry Barrett attempts a Midrange. Contested by Lamelo Dosunmu (3.9 feet, ZONE). Terry Barrett misses. Rebound secured by Michael Ginobili.

[02:14] Team_022 possession (Score: 16-26)
Lamelo Dosunmu drives to the basket... Lamelo Dosunmu commits a violation (traveling/carry)! TURNOVER! (dead ball)

[02:14] Substitution (Team_022): Malcolm Allen OUT → DeMar Harden IN (stamina_rule2)

[02:14] Substitution (Team_022): Michael Ginobili OUT → Lauri Gobert IN (stamina_rule2)

[02:14] Substitution (Team_022): Myles Anthony OUT → Dejounte Towns IN (stamina_rule2)

[02:14] Substitution (Team_022): Lamelo Dosunmu OUT → Kawhi Russell IN (stamina_rule2)

[02:14] Substitution (Team_022): Dirk Markkanen OUT → Cole Iverson IN (stamina_rule2)

[02:14] Substitution (Team_041): Jarrett Anunoby OUT → Kyrie Booker IN (stamina_rule2)

[02:14] Substitution (Team_041): Dejounte Griffin OUT → Bam McCollum IN (stamina_rule2)

[02:14] Substitution (Team_041): Terry Barrett OUT → De'Aaron Poole IN (stamina_rule2)

[02:00] Team_041 possession (Score: 16-26)
Kyrie Booker attempts a Midrange. Contested by DeMar Harden (5.5 feet, ZONE). KYRIE BOOKER MAKES IT!
Score: 16-28

[01:49] Team_022 possession (Score: 16-28)
Dejounte Towns attempts a Layup. Contested by De'Aaron Poole (5.9 feet, ZONE). DEJOUNTE TOWNS MAKES IT! Assist: Kawhi Russell
Score: 18-28

[01:36] Team_041 possession (Score: 18-28)
Kyrie Booker drives, picks up Lauri Gobert. Help arrives from DeMar Harden! Kyrie Booker attempts a Dunk. Contested by DeMar Harden (3.9 feet, MAN). KYRIE BOOKER MAKES IT!
Score: 18-30

[01:17] Team_022 possession (Score: 18-30)
DeMar Harden commits a violation (traveling/carry)! TURNOVER! (dead ball)

[01:17] Substitution (Team_041): Scottie Turner OUT → Franz Rose IN (stamina_rule2)

[01:17] Substitution (Team_041): Stephen Ingram OUT → Tobias McCollum IN (stamina_rule2)

[00:59] Team_041 possession (Score: 18-30)
Kyrie Booker attempts a Layup. Contested by Lauri Gobert (3.5 feet, MAN). KYRIE BOOKER MAKES IT! Assist: Bam McCollum
Score: 18-32

[00:46] Team_022 possession (Score: 18-32)
Lauri Gobert drives, Tobias McCollum stays with him. Lauri Gobert attempts a Layup. Contested by Tobias McCollum (4.7 feet, ZONE). LAURI GOBERT MAKES IT!
Score: 20-32

[00:35] Team_041 possession (Score: 20-32)
De'Aaron Poole attempts a Midrange. Contested by Lauri Gobert (4.3 feet, ZONE). DE'AARON POOLE MAKES IT! Assist: Kyrie Booker
Score: 20-34

[00:25] Team_022 possession (Score: 20-34)
FOUL! Shooting foul on De'Aaron Poole. Cole Iverson to the line for 2 free throws. [Team fouls: 3] (De'Aaron Poole: 1 personal fouls)   FT 1/2: GOOD   FT 2/2: GOOD Cole Iverson makes 2/2 from the line.
Score: 22-34

[00:08] Team_041 possession (Score: 22-34)
Kyrie Booker loses control! Ball rolls out of bounds! TURNOVER! (dead ball)

================================================================================
                              1ST QUARTER COMPLETE                              
================================================================================

1ST QUARTER SCORE: Team_022 22, Team_041 34

BOX SCORE:
================================================================================

Team_022
--------------------------------------------------------------------------------
Player                MIN  PTS  REB  AST  TO      FG   FG%      3P   3P%
--------------------------------------------------------------------------------
Dirk Markkanen         10    6    6    0   0   3/7    42.9     0/0   0.0
Malcolm Allen          10    6    0    1   0   2/3    66.7     0/0   0.0
Michael Ginobili       10    2    3    0   0   1/2    50.0     0/0   0.0
Lamelo Dosunmu         10    2    0    1   0   1/3    33.3     0/0   0.0
Dejounte Towns          2    2    0    0   0   1/1   100.0     0/0   0.0
Lauri Gobert            2    2    0    0   0   1/1   100.0     0/0   0.0
Cole Iverson            2    2    0    0   0   1/1   100.0     0/0   0.0
Myles Anthony          10    0    2    3   0   0/2     0.0     0/0   0.0
Kawhi Russell           2    0    0    1   0   0/0     0.0     0/0   0.0

TEAM: FG: 10/20 (50.0%), 3PT: 2/7 (28.6%), REB: 11 (4 off, 7 def), AST: 6, TO: 3
TEAM FOULS: 6 [Team_041 in BONUS]


Team_041
--------------------------------------------------------------------------------
Player                MIN  PTS  REB  AST  TO      FG   FG%      3P   3P%
--------------------------------------------------------------------------------
Terry Barrett          10   10    2    1   0   4/7    57.1     0/0   0.0
Stephen Ingram         11    6    2    0   0   2/3    66.7     0/0   0.0
Kyrie Booker            2    6    0    1   0   3/3   100.0     0/0   0.0
Scottie Turner         11    4    0    1   0   2/2   100.0     0/0   0.0
Jarrett Anunoby        10    3    0    2   0   1/3    33.3     0/0   0.0
Dejounte Griffin       10    2    6    1   0   1/2    50.0     0/0   0.0
De'Aaron Poole          2    2    0    0   0   1/1   100.0     0/0   0.0
Bam McCollum            2    0    0    1   0   0/0     0.0     0/0   0.0

TEAM: FG: 14/21 (66.7%), 3PT: 4/5 (80.0%), REB: 10 (0 off, 10 def), AST: 7, TO: 2
TEAM FOULS: 3

================================================================================

================================================================================
                       2ND QUARTER - Team_022 vs Team_041                       
================================================================================

[12:00] Team_022 possession (Score: 22-34)
Lamelo Dosunmu attempts a Midrange. Contested by Terry Barrett (5.1 feet, ZONE). Lamelo Dosunmu misses. Rebound secured by Stephen Ingram.

[11:50] Team_041 possession (Score: 22-34)
Stephen Ingram attempts a 3Pt. Contested by Lamelo Dosunmu (3.8 feet, MAN). Stephen Ingram misses. Rebound secured by Michael Ginobili.

[11:34] Team_022 possession (Score: 22-34)
FOUL! Shooting foul on Terry Barrett. Lamelo Dosunmu to the line for 2 free throws. [Team fouls: 1] (Terry Barrett: 1 personal fouls)   FT 1/2: GOOD   FT 2/2: GOOD Lamelo Dosunmu makes 2/2 from the line.
Score: 24-34

[11:16] Team_041 possession (Score: 24-34)
Scottie Turner attempts a Layup. BLOCKED BY DIRK MARKKANEN! Ball is loose! Rebound secured by Dirk Markkanen.

[10:58] Team_022 possession (Score: 24-34)
FOUL! Shooting foul on Jarrett Anunoby. Michael Ginobili to the line for 2 free throws. [Team fouls: 2] (Jarrett Anunoby: 1 personal fouls)   FT 1/2: GOOD   FT 2/2: GOOD Michael Ginobili makes 2/2 from the line.
Score: 26-34

[10:39] Team_041 possession (Score: 26-34)
Jarrett Anunoby attempts a 3Pt. Contested by Michael Ginobili (2.8 feet, ZONE). Jarrett Anunoby misses. Rebound secured by Dirk Markkanen.

[10:23] Team_022 possession (Score: 26-34)
Myles Anthony attempts a Midrange. Contested by Dejounte Griffin (2.9 feet, MAN). Myles Anthony misses. Offensive rebound by Michael Ginobili! Michael Ginobili kicks it out.

[10:09] Team_022 possession (Score: 26-34)
Michael Ginobili attempts a Layup. Contested by Jarrett Anunoby (2.6 feet, MAN). Michael Ginobili misses. Rebound secured by Terry Barrett.

[09:57] Team_041 possession (Score: 26-34)
Jarrett Anunoby attempts a 3Pt. Contested by Michael Ginobili (4.5 feet, MAN). Jarrett Anunoby misses. Offensive rebound by Terry Barrett! Terry Barrett's putback is no good. Offensive rebound by Stephen Ingram! Stephen Ingram kicks it out.

[09:45] Team_041 possession (Score: 26-34)
Dejounte Griffin drives to the basket... Dejounte Griffin loses the ball! Stripped by Dirk Markkanen! TURNOVER! (live ball)

[09:29] Team_022 possession (Score: 26-34)
Lamelo Dosunmu attempts a 3Pt. Contested by Stephen Ingram (3.9 feet, MAN). Lamelo Dosunmu misses. Rebound secured by Dejounte Griffin.

[09:17] Team_041 possession (Score: 26-34)
Stephen Ingram drives and kicks out. Dejounte Griffin attempts a Midrange. Contested by Myles Anthony (4.5 feet, MAN). Dejounte Griffin misses. Rebound secured by Myles Anthony.

[09:04] Team_022 possession (Score: 26-34)
Malcolm Allen attempts a 3Pt. Contested by Scottie Turner (5.7 feet, MAN). MALCOLM ALLEN MAKES IT! Assist: Dirk Markkanen
Score: 29-34

[08:51] Team_041 possession (Score: 29-34)
Scottie Turner attempts a Layup. BLOCKED BY MICHAEL GINOBILI! Ball is loose! Rebound secured by Myles Anthony.

[08:37] Team_022 possession (Score: 29-34)
Malcolm Allen attempts a Midrange. Wide open! Jarrett Anunoby is 7.0 feet away. [ZONE] MALCOLM ALLEN MAKES IT!
Score: 31-34

[08:23] Team_041 possession (Score: 31-34)
Scottie Turner attempts a Midrange. Contested by Malcolm Allen (5.7 feet, MAN). SCOTTIE TURNER MAKES IT!
Score: 31-36

[08:05] Team_022 possession (Score: 31-36)
Malcolm Allen makes the 3Pt and draws the foul on Scottie Turner! And-1! Malcolm Allen to the line for 1. [Team fouls: 3] (Scottie Turner: 1 personal fouls)   FT 1/1: MISS Malcolm Allen makes 0/1 from the line. Rebound secured by Stephen Ingram.
Score: 34-36

[07:51] Team_041 possession (Score: 34-36)
Jarrett Anunoby attempts a 3Pt. Contested by Michael Ginobili (4.1 feet, MAN). Jarrett Anunoby misses. Rebound secured by Myles Anthony.

[07:40] Team_022 possession (Score: 34-36)
Myles Anthony attempts a Midrange. Wide open! Scottie Turner is 7.9 feet away. [ZONE] Myles Anthony misses. Rebound secured by Terry Barrett.

[07:30] Team_041 possession (Score: 34-36)
Terry Barrett attempts a 3Pt. Contested by Myles Anthony (4.8 feet, ZONE). Terry Barrett misses. Rebound secured by Michael Ginobili.

[07:11] Team_022 possession (Score: 34-36)
Myles Anthony attempts a 3Pt. Contested by Scottie Turner (4.6 feet, ZONE). MYLES ANTHONY MAKES IT! Assist: Malcolm Allen
Score: 37-36

[06:58] Team_041 possession (Score: 37-36)
Scottie Turner drives and kicks out. Scottie Turner attempts a 3Pt. Heavily contested by Malcolm Allen (1.5 feet, MAN)! SCOTTIE TURNER MAKES IT! Assist: Terry Barrett
Score: 37-39

[06:44] Team_022 possession (Score: 37-39)
Myles Anthony attempts a 3Pt. Contested by Dejounte Griffin (3.5 feet, MAN). Myles Anthony misses. Rebound secured by Terry Barrett.

[06:26] Team_041 possession (Score: 37-39)
Terry Barrett attempts a Midrange. Wide open! Dirk Markkanen is 6.1 feet away. [ZONE] Terry Barrett misses. Offensive rebound by Stephen Ingram! Stephen Ingram kicks it out.

[06:13] Team_041 possession (Score: 37-39)
Terry Barrett attempts a Midrange. Heavily contested by Michael Ginobili (1.3 feet, ZONE)! Terry Barrett misses. Rebound secured by Myles Anthony.

[05:56] Team_022 possession (Score: 37-39)
Lamelo Dosunmu drives and kicks out. Lamelo Dosunmu attempts a Midrange. Contested by Stephen Ingram (5.2 feet, MAN). Lamelo Dosunmu misses. Rebound secured by Dejounte Griffin.

[05:38] Team_041 possession (Score: 37-39)
Dejounte Griffin drives, Dirk Markkanen stays with him. Dejounte Griffin attempts a Layup. Contested by Dirk Markkanen (2.4 feet, ZONE). DEJOUNTE GRIFFIN MAKES IT!
Score: 37-41

[05:23] Team_022 possession (Score: 37-41)
Myles Anthony drives to the basket... Myles Anthony loses the ball! Stripped by Terry Barrett! TURNOVER! (live ball)

[05:13] Team_041 possession (Score: 37-41)
Stephen Ingram attempts a Midrange. Contested by Lamelo Dosunmu (5.1 feet, MAN). STEPHEN INGRAM MAKES IT! Assist: Jarrett Anunoby
Score: 37-43

[05:00] Team_022 possession (Score: 37-43)
Myles Anthony attempts a Midrange. Contested by Dejounte Griffin (5.1 feet, MAN). Myles Anthony misses. FOUL! Loose ball foul on Stephen Ingram during the rebound battle. [Team fouls: 4] No free throws, side out. (Stephen Ingram: 1 personal fouls)

[04:45] Team_022 possession (Score: 37-43)
Lamelo Dosunmu attempts a Midrange. Contested by Jarrett Anunoby (5.1 feet, ZONE). Lamelo Dosunmu misses. Offensive rebound by Michael Ginobili! Michael Ginobili kicks it out.

[04:31] Team_022 possession (Score: 37-43)
Malcolm Allen drives, picks up Scottie Turner. Help arrives from Jarrett Anunoby! Malcolm Allen attempts a Layup. Wide open! Jarrett Anunoby is 6.2 feet away. [MAN] MALCOLM ALLEN MAKES IT! Assist: Myles Anthony
Score: 39-43

[04:18] Team_041 possession (Score: 39-43)
Dejounte Griffin attempts a 3Pt. Wide open! Lamelo Dosunmu is 10.0 feet away. [ZONE] DEJOUNTE GRIFFIN MAKES IT! Assist: Jarrett Anunoby
Score: 39-46

[04:02] Team_022 possession (Score: 39-46)
FOUL! Shooting foul on Dejounte Griffin. Myles Anthony to the line for 2 free throws. [BONUS: 5 team fouls] (Dejounte Griffin: 1 personal fouls)   FT 1/2: MISS   FT 2/2: GOOD Myles Anthony makes 1/2 from the line.
Score: 40-46

[03:47] Team_041 possession (Score: 40-46)
Stephen Ingram attempts a Midrange. Contested by Michael Ginobili (3.0 feet, ZONE). Stephen Ingram misses. Rebound secured by Dirk Markkanen.

[03:30] Team_022 possession (Score: 40-46)
Malcolm Allen attempts a Layup. Wide open! Scottie Turner is 6.3 feet away. [MAN] MALCOLM ALLEN MAKES IT!
Score: 42-46

[03:14] Team_041 possession (Score: 42-46)
Terry Barrett attempts a Layup. Contested by Dirk Markkanen (5.1 feet, MAN). TERRY BARRETT MAKES IT! Assist: Stephen Ingram
Score: 42-48

[02:58] Team_022 possession (Score: 42-48)
Lamelo Dosunmu drives, Stephen Ingram stays with him. Lamelo Dosunmu attempts a Dunk. Wide open! Stephen Ingram is 7.1 feet away. [MAN] Lamelo Dosunmu misses. Rebound secured by Dejounte Griffin.

[02:44] Team_041 possession (Score: 42-48)
Dejounte Griffin attempts a 3Pt. BLOCKED BY MICHAEL GINOBILI! Ball deflects out of bounds off Dejounte Griffin.

[02:26] Team_022 possession (Score: 42-48)
Lamelo Dosunmu attempts a 3Pt. Wide open! Scottie Turner is 7.9 feet away. [ZONE] Lamelo Dosunmu misses. Rebound secured by Terry Barrett.

[02:10] Team_041 possession (Score: 42-48)
Terry Barrett drives to the basket... Terry Barrett loses control! Ball rolls out of bounds! TURNOVER! (dead ball)

[02:10] Substitution (Team_022): Malcolm Allen OUT → DeMar Harden IN (stamina_rule2)

[02:10] Substitution (Team_022): Michael Ginobili OUT → Lauri Gobert IN (stamina_rule2)

[02:10] Substitution (Team_022): Myles Anthony OUT → Dejounte Towns IN (stamina_rule2)

[02:10] Substitution (Team_022): Lamelo Dosunmu OUT → Kawhi Russell IN (stamina_rule2)

[02:10] Substitution (Team_022): Dirk Markkanen OUT → Cole Iverson IN (stamina_rule2)

[02:10] Substitution (Team_041): Scottie Turner OUT → Franz Rose IN (stamina_rule2)

[02:10] Substitution (Team_041): Jarrett Anunoby OUT → Kyrie Booker IN (stamina_rule2)

[02:10] Substitution (Team_041): Dejounte Griffin OUT → Bam McCollum IN (stamina_rule2)

[02:10] Substitution (Team_041): Stephen Ingram OUT → Tobias McCollum IN (stamina_rule2)

[02:10] Substitution (Team_041): Terry Barrett OUT → De'Aaron Poole IN (stamina_rule2)

[01:58] Team_022 possession (Score: 42-48)
FOUL! Reach-in foul on Tobias McCollum during the drive. [IN THE BONUS! 6 team fouls] Cole Iverson to the line for 2 free throws. (Tobias McCollum: 1 personal fouls)   FT 1/2: GOOD   FT 2/2: GOOD Cole Iverson makes 2/2 from the line.
Score: 44-48

[01:46] Team_041 possession (Score: 44-48)
Bam McCollum makes the Layup and draws the foul on Dejounte Towns! And-1! Bam McCollum to the line for 1. [Team fouls: 1] (Dejounte Towns: 1 personal fouls)   FT 1/1: GOOD Bam McCollum makes 1/1 from the line.
Score: 44-51

[01:29] Team_022 possession (Score: 44-51)
Lauri Gobert attempts a 3Pt. Wide open! Franz Rose is 7.9 feet away. [ZONE] Lauri Gobert misses. Rebound secured by De'Aaron Poole.

[01:13] Team_041 possession (Score: 44-51)
Kyrie Booker attempts a Layup. BLOCKED BY LAURI GOBERT! Ball is loose! Rebound secured by Kawhi Russell.

[01:01] Team_022 possession (Score: 44-51)
DeMar Harden drives and kicks out. Kawhi Russell attempts a 3Pt. Contested by Kyrie Booker (3.5 feet, ZONE). Kawhi Russell misses. Rebound secured by Tobias McCollum.

[00:44] Team_041 possession (Score: 44-51)
Franz Rose attempts a 3Pt. Wide open! Dejounte Towns is 6.7 feet away. [ZONE] FRANZ ROSE MAKES IT! Assist: De'Aaron Poole
Score: 44-54

[00:28] Team_022 possession (Score: 44-54)
Dejounte Towns drives to the basket... Dejounte Towns throws a bad pass! Stolen by Bam McCollum! TURNOVER! (live ball)

[00:13] Team_041 possession (Score: 44-54)
FOUL! Holding foul on Cole Iverson. [Team fouls: 2] No free throws, side out. (Cole Iverson: 1 personal fouls)

================================================================================
                              2ND QUARTER COMPLETE                              
================================================================================

2ND QUARTER SCORE: Team_022 22, Team_041 20

BOX SCORE:
================================================================================

Team_022
--------------------------------------------------------------------------------
Player                MIN  PTS  REB  AST  TO      FG   FG%      3P   3P%
--------------------------------------------------------------------------------
Malcolm Allen          20    9    0    1   0   4/5    80.0     0/0   0.0
Myles Anthony          20    4    4    1   0   2/4    50.0     0/0   0.0
Lamelo Dosunmu         20    2    0    0   0   1/6    16.7     0/0   0.0
Michael Ginobili       20    2    4    0   0   1/2    50.0     0/0   0.0
Cole Iverson            4    2    0    0   0   1/1   100.0     0/0   0.0
Dirk Markkanen         20    0    4    1   0   0/0     0.0     0/0   0.0
Lauri Gobert            4    0    0    0   0   0/1     0.0     0/0   0.0
Kawhi Russell           4    0    1    0   0   0/0     0.0     0/0   0.0
DeMar Harden            4    0    0    0   0   0/1     0.0     0/0   0.0

TEAM: FG: 9/20 (45.0%), 3PT: 2/7 (28.6%), REB: 13 (3 off, 10 def), AST: 3, TO: 2
TEAM FOULS: 2


Team_041
--------------------------------------------------------------------------------
Player                MIN  PTS  REB  AST  TO      FG   FG%      3P   3P%
--------------------------------------------------------------------------------
Scottie Turner         21    5    0    0   0   2/4    50.0     0/0   0.0
Dejounte Griffin       20    5    3    0   0   2/3    66.7     0/0   0.0
Bam McCollum            4    3    0    0   0   1/1   100.0     0/0   0.0
Franz Rose              3    3    0    0   0   1/1   100.0     0/0   0.0
Stephen Ingram         21    2    4    1   0   1/4    25.0     0/0   0.0
Terry Barrett          20    2    4    1   0   1/3    33.3     0/0   0.0
Jarrett Anunoby        20    0    0    2   0   0/2     0.0     0/0   0.0
De'Aaron Poole          4    0    1    1   0   0/0     0.0     0/0   0.0
Kyrie Booker            4    0    0    0   0   0/1     0.0     0/0   0.0
Tobias McCollum         3    0    1    0   0   0/0     0.0     0/0   0.0

TEAM: FG: 8/19 (42.1%), 3PT: 2/7 (28.6%), REB: 13 (2 off, 11 def), AST: 5, TO: 2
TEAM FOULS: 6 [Team_022 in BONUS]

================================================================================

================================================================================
                       3RD QUARTER - Team_022 vs Team_041                       
================================================================================

[12:00] Team_022 possession (Score: 44-54)
FOUL! Offensive foul on Myles Anthony! Dejounte Griffin drew the charge! [Team fouls: 1] (Myles Anthony: 1 personal fouls) TURNOVER! (dead ball)

[11:43] Team_041 possession (Score: 44-54)
Scottie Turner drives to the basket... Scottie Turner loses control! Ball rolls out of bounds! TURNOVER! (dead ball)

[11:28] Team_022 possession (Score: 44-54)
FOUL! Holding foul on Scottie Turner. [Team fouls: 1] No free throws, side out. (Scottie Turner: 1 personal fouls)

[11:15] Team_022 possession (Score: 44-54)
Lamelo Dosunmu attempts a Midrange. Wide open! Stephen Ingram is 6.9 feet away. [MAN] Lamelo Dosunmu misses. Rebound secured by Terry Barrett.

[11:00] Team_041 possession (Score: 44-54)
Scottie Turner attempts a 3Pt. Contested by Michael Ginobili (4.4 feet, ZONE). SCOTTIE TURNER MAKES IT! Assist: Dejounte Griffin
Score: 44-57

[10:43] Team_022 possession (Score: 44-57)
Dirk Markkanen drives, Stephen Ingram stays with him. Dirk Markkanen attempts a Dunk. Heavily contested by Stephen Ingram (1.5 feet, ZONE)! DIRK MARKKANEN MAKES IT! Assist: Malcolm Allen
Score: 46-57

[10:27] Team_041 possession (Score: 46-57)
Terry Barrett attempts a Midrange. Contested by Lamelo Dosunmu (6.0 feet, ZONE). TERRY BARRETT MAKES IT! Assist: Scottie Turner
Score: 46-59

[10:11] Team_022 possession (Score: 46-59)
Lamelo Dosunmu attempts a 3Pt. Contested by Scottie Turner (4.6 feet, ZONE). Lamelo Dosunmu misses. FOUL! Loose ball foul on Dejounte Griffin during the rebound battle. [Team fouls: 2] No free throws, side out. (Dejounte Griffin: 1 personal fouls)

[09:55] Team_022 possession (Score: 46-59)
Myles Anthony attempts a Midrange. Contested by Stephen Ingram (2.2 feet, ZONE). Myles Anthony misses. Offensive rebound by Michael Ginobili! Michael Ginobili kicks it out.

[09:43] Team_022 possession (Score: 46-59)
FOUL! Shooting foul on Terry Barrett. Michael Ginobili to the line for 2 free throws. [Team fouls: 3] (Terry Barrett: 1 personal fouls)   FT 1/2: GOOD   FT 2/2: GOOD Michael Ginobili makes 2/2 from the line.
Score: 48-59

[09:32] Team_041 possession (Score: 48-59)
Jarrett Anunoby attempts a Midrange. Wide open! Michael Ginobili is 6.2 feet away. [MAN] JARRETT ANUNOBY MAKES IT!
Score: 48-61

[09:17] Team_022 possession (Score: 48-61)
Michael Ginobili attempts a 3Pt. Contested by Jarrett Anunoby (4.2 feet, MAN). MICHAEL GINOBILI MAKES IT! Assist: Dirk Markkanen
Score: 51-61

[09:03] Team_041 possession (Score: 51-61)
Stephen Ingram attempts a Layup. Wide open! Lamelo Dosunmu is 7.4 feet away. [MAN] Stephen Ingram misses. Rebound secured by Michael Ginobili.

[08:51] Team_022 possession (Score: 51-61)
Lamelo Dosunmu attempts a Midrange. Contested by Stephen Ingram (2.9 feet, MAN). LAMELO DOSUNMU MAKES IT!
Score: 53-61

[08:39] Team_041 possession (Score: 53-61)
Stephen Ingram drives and kicks out. Stephen Ingram attempts a 3Pt. Contested by Michael Ginobili (4.1 feet, ZONE). Stephen Ingram misses. Rebound secured by Myles Anthony.

[08:23] Team_022 possession (Score: 53-61)
Malcolm Allen attempts a 3Pt. Wide open! Scottie Turner is 6.1 feet away. [MAN] MALCOLM ALLEN MAKES IT! Assist: Myles Anthony
Score: 56-61

[08:12] Team_041 possession (Score: 56-61)
Jarrett Anunoby attempts a Layup. Contested by Michael Ginobili (2.7 feet, MAN). JARRETT ANUNOBY MAKES IT!
Score: 56-63

[07:56] Team_022 possession (Score: 56-63)
Michael Ginobili drives and kicks out. Malcolm Allen attempts a 3Pt. Wide open! Scottie Turner is 6.7 feet away. [ZONE] MALCOLM ALLEN MAKES IT! Assist: Lamelo Dosunmu
Score: 59-63

[07:40] Team_041 possession (Score: 59-63)
Stephen Ingram attempts a Midrange. Wide open! Lamelo Dosunmu is 7.0 feet away. [MAN] STEPHEN INGRAM MAKES IT! Assist: Terry Barrett
Score: 59-65

[07:26] Team_022 possession (Score: 59-65)
Malcolm Allen drives, Scottie Turner stays with him. Malcolm Allen attempts a Layup. Contested by Scottie Turner (5.6 feet, MAN). MALCOLM ALLEN MAKES IT! Assist: Lamelo Dosunmu
Score: 61-65

[07:12] Team_041 possession (Score: 61-65)
Scottie Turner attempts a 3Pt. Heavily contested by Malcolm Allen (1.5 feet, MAN)! SCOTTIE TURNER MAKES IT! Assist: Terry Barrett
Score: 61-68

[06:58] Team_022 possession (Score: 61-68)
Lamelo Dosunmu drives to the basket... Lamelo Dosunmu throws a bad pass out of bounds! TURNOVER! (dead ball)

[06:40] Team_041 possession (Score: 61-68)
Terry Barrett drives, picks up Dirk Markkanen. Help arrives from Michael Ginobili! Terry Barrett attempts a Layup. Wide open! Michael Ginobili is 7.0 feet away. [MAN] TERRY BARRETT MAKES IT!
Score: 61-70

[06:28] Team_022 possession (Score: 61-70)
Myles Anthony attempts a Midrange. Contested by Stephen Ingram (3.6 feet, ZONE). Myles Anthony misses. Offensive rebound by Dirk Markkanen! Dirk Markkanen's putback is no good. Offensive rebound by Dirk Markkanen! Dirk Markkanen kicks it out.

[06:11] Team_022 possession (Score: 61-70)
Myles Anthony attempts a 3Pt. Contested by Scottie Turner (5.2 feet, ZONE). Myles Anthony misses. Rebound secured by Terry Barrett.

[05:57] Team_041 possession (Score: 61-70)
Scottie Turner attempts a 3Pt. Contested by Michael Ginobili (3.8 feet, ZONE). Scottie Turner misses. Offensive rebound by Terry Barrett! Terry Barrett puts it back in!
Score: 61-72

[05:40] Team_022 possession (Score: 61-72)
Dirk Markkanen drives, Terry Barrett stays with him. Dirk Markkanen attempts a Dunk. Contested by Terry Barrett (4.3 feet, ZONE). DIRK MARKKANEN MAKES IT!
Score: 63-72

[05:27] Team_041 possession (Score: 63-72)
Scottie Turner attempts a Layup. Contested by Malcolm Allen (2.4 feet, MAN). SCOTTIE TURNER MAKES IT! Assist: Dejounte Griffin
Score: 63-74

[05:10] Team_022 possession (Score: 63-74)
Michael Ginobili drives and kicks out. Dirk Markkanen attempts a 3Pt. Contested by Terry Barrett (5.1 feet, MAN). Dirk Markkanen misses. Rebound secured by Dejounte Griffin.

[04:58] Team_041 possession (Score: 63-74)
FOUL! Shooting foul on Michael Ginobili. Stephen Ingram to the line for 2 free throws. [Team fouls: 2] (Michael Ginobili: 1 personal fouls)   FT 1/2: GOOD   FT 2/2: GOOD Stephen Ingram makes 2/2 from the line.
Score: 63-76

[04:45] Team_022 possession (Score: 63-76)
Lamelo Dosunmu attempts a Layup. Contested by Stephen Ingram (2.7 feet, MAN). LAMELO DOSUNMU MAKES IT!
Score: 65-76

[04:29] Team_041 possession (Score: 65-76)
Dejounte Griffin attempts a 3Pt. Contested by Myles Anthony (3.3 feet, MAN). Dejounte Griffin misses. Rebound secured by Myles Anthony.

[04:17] Team_022 possession (Score: 65-76)
Michael Ginobili drives and kicks out. Michael Ginobili attempts a Midrange. Wide open! Jarrett Anunoby is 6.2 feet away. [MAN] Michael Ginobili misses. Rebound secured by Dejounte Griffin.

[04:05] Team_041 possession (Score: 65-76)
FOUL! Reach-in foul on Dirk Markkanen during the drive. [Team fouls: 3] No free throws, side out. (Dirk Markkanen: 1 personal fouls)

[03:48] Team_041 possession (Score: 65-76)
Jarrett Anunoby attempts a Midrange. Wide open! Lamelo Dosunmu is 8.6 feet away. [ZONE] Jarrett Anunoby misses. Rebound secured by Dirk Markkanen.

[03:34] Team_022 possession (Score: 65-76)
Malcolm Allen drives to the basket... Malcolm Allen throws a bad pass out of bounds! TURNOVER! (dead ball)

[03:19] Team_041 possession (Score: 65-76)
Scottie Turner throws a bad pass out of bounds! TURNOVER! (dead ball)

[03:19] Substitution (Team_022): Lamelo Dosunmu OUT → Kawhi Russell IN (stamina_rule2)

[03:01] Team_022 possession (Score: 65-76)
Myles Anthony attempts a 3Pt. Contested by Jarrett Anunoby (4.4 feet, ZONE). MYLES ANTHONY MAKES IT! Assist: Malcolm Allen
Score: 68-76

[02:49] Team_041 possession (Score: 68-76)
Terry Barrett attempts a Midrange. Contested by Michael Ginobili (2.5 feet, ZONE). TERRY BARRETT MAKES IT! Assist: Jarrett Anunoby
Score: 68-78

[02:36] Team_022 possession (Score: 68-78)
Dirk Markkanen attempts a Layup. Wide open! Terry Barrett is 6.3 feet away. [MAN] DIRK MARKKANEN MAKES IT! Assist: Myles Anthony
Score: 70-78

[02:21] Team_041 possession (Score: 70-78)
Dejounte Griffin attempts a 3Pt. Contested by Michael Ginobili (5.0 feet, ZONE). Dejounte Griffin misses. Offensive rebound by Stephen Ingram! Stephen Ingram kicks it out.

[02:08] Team_041 possession (Score: 70-78)
Terry Barrett drives, Dirk Markkanen stays with him. Terry Barrett attempts a Dunk. Contested by Dirk Markkanen (5.8 feet, ZONE). TERRY BARRETT MAKES IT! Assist: Jarrett Anunoby
Score: 70-80

[01:54] Team_022 possession (Score: 70-80)
FOUL! Shooting foul on Jarrett Anunoby. Michael Ginobili to the line for 2 free throws. [Team fouls: 4] (Jarrett Anunoby: 1 personal fouls)   FT 1/2: GOOD   FT 2/2: MISS Michael Ginobili makes 1/2 from the line. FOUL! Loose ball foul on Dejounte Griffin during the free throw rebound! [IN THE BONUS! 5 team fouls] Dirk Markkanen to the line for 2 free throws. (Dejounte Griffin: 2 personal fouls)   FT 1/2: MISS   FT 2/2: MISS Dirk Markkanen makes 0/2 from the line. Rebound secured by Stephen Ingram.
Score: 71-80

[01:40] Team_041 possession (Score: 71-80)
Scottie Turner attempts a 3Pt. Contested by Michael Ginobili (5.3 feet, ZONE). Scottie Turner misses. Rebound secured by Michael Ginobili.

[01:29] Team_022 possession (Score: 71-80)
Myles Anthony attempts a 3Pt. Wide open! Dejounte Griffin is 6.9 feet away. [MAN] MYLES ANTHONY MAKES IT!
Score: 74-80

[01:11] Team_041 possession (Score: 74-80)
Terry Barrett drives, Dirk Markkanen stays with him. Terry Barrett attempts a Dunk. Contested by Dirk Markkanen (4.8 feet, MAN). TERRY BARRETT MAKES IT!
Score: 74-82

[00:55] Team_022 possession (Score: 74-82)
FOUL! Shooting foul on Terry Barrett. Dirk Markkanen to the line for 2 free throws. [BONUS: 6 team fouls] (Terry Barrett: 2 personal fouls)   FT 1/2: MISS   FT 2/2: GOOD Dirk Markkanen makes 1/2 from the line.
Score: 75-82

[00:42] Team_041 possession (Score: 75-82)
Terry Barrett throws a bad pass! Stolen by Kawhi Russell! TURNOVER! (live ball)

[00:24] Team_022 possession (Score: 75-82)
Myles Anthony attempts a 3Pt. Contested by Scottie Turner (3.8 feet, ZONE). Myles Anthony misses. FOUL! Loose ball foul on Stephen Ingram during the rebound battle. [IN THE BONUS! 7 team fouls] Dirk Markkanen to the line for 2 free throws. (Stephen Ingram: 1 personal fouls)   FT 1/2: MISS   FT 2/2: MISS Dirk Markkanen makes 0/2 from the line. Rebound secured by Dejounte Griffin.

[00:12] Team_041 possession (Score: 75-82)
Stephen Ingram attempts a Layup. Contested by Kawhi Russell (4.7 feet, MAN). STEPHEN INGRAM MAKES IT! Assist: Scottie Turner
Score: 75-84

[00:01] Team_022 possession (Score: 75-84)
FOUL! Shooting foul on Scottie Turner. Malcolm Allen to the line for 3 free throws. [BONUS: 8 team fouls] (Scottie Turner: 2 personal fouls)   FT 1/3: GOOD   FT 2/3: GOOD   FT 3/3: GOOD Malcolm Allen makes 3/3 from the line.
Score: 78-84

================================================================================
                              3RD QUARTER COMPLETE                              
================================================================================

3RD QUARTER SCORE: Team_022 34, Team_041 30

BOX SCORE:
================================================================================

Team_022
--------------------------------------------------------------------------------
Player                MIN  PTS  REB  AST  TO      FG   FG%      3P   3P%
--------------------------------------------------------------------------------
Malcolm Allen          32   11    0    2   0   4/4   100.0     0/0   0.0
Dirk Markkanen         32    7    3    1   0   4/4   100.0     0/0   0.0
Myles Anthony          32    6    2    2   0   2/4    50.0     0/0   0.0
Michael Ginobili       32    5    3    0   0   2/5    40.0     0/0   0.0
Lamelo Dosunmu         29    4    0    2   0   2/3    66.7     0/0   0.0
Dejounte Griffin       32    0    3    2   0   0/1     0.0     0/0   0.0

TEAM: FG: 14/20 (70.0%), 3PT: 5/7 (71.4%), REB: 9 (4 off, 5 def), AST: 7, TO: 3
TEAM FOULS: 3


Team_041
--------------------------------------------------------------------------------
Player                MIN  PTS  REB  AST  TO      FG   FG%      3P   3P%
--------------------------------------------------------------------------------
Terry Barrett          32   12    3    2   0   6/6   100.0     0/0   0.0
Scottie Turner         33    8    0    2   0   3/4    75.0     0/0   0.0
Stephen Ingram         33    6    2    0   0   3/5    60.0     0/0   0.0
Jarrett Anunoby        32    4    0    2   0   2/3    66.7     0/0   0.0

TEAM: FG: 14/19 (73.7%), 3PT: 3/5 (60.0%), REB: 7 (2 off, 5 def), AST: 8, TO: 3
TEAM FOULS: 8 [Team_022 in BONUS]

================================================================================

================================================================================
                       4TH QUARTER - Team_022 vs Team_041                       
================================================================================

[12:00] Substitution (Team_022): Malcolm Allen OUT → DeMar Harden IN (stamina_rule2)

[12:00] Substitution (Team_022): Michael Ginobili OUT → Lauri Gobert IN (stamina_rule2)

[12:00] Substitution (Team_022): Myles Anthony OUT → Dejounte Towns IN (stamina_rule2)

[12:00] Substitution (Team_022): Dirk Markkanen OUT → Cole Iverson IN (stamina_rule2)

[12:00] Substitution (Team_041): Scottie Turner OUT → Franz Rose IN (stamina_rule2)

[12:00] Substitution (Team_041): Jarrett Anunoby OUT → Kyrie Booker IN (stamina_rule2)

[12:00] Substitution (Team_041): Dejounte Griffin OUT → Bam McCollum IN (stamina_rule2)

[12:00] Substitution (Team_041): Terry Barrett OUT → De'Aaron Poole IN (stamina_rule2)

[12:00] Team_022 possession (Score: 78-84)
Lamelo Dosunmu drives to the basket... Lamelo Dosunmu commits a violation (traveling/carry)! TURNOVER! (dead ball)

[11:48] Team_041 possession (Score: 78-84)
Franz Rose loses control! Ball rolls out of bounds! TURNOVER! (dead ball)

[11:48] Substitution (Team_041): Stephen Ingram OUT → Tobias McCollum IN (stamina_rule2)

[11:28] Team_022 possession (Score: 78-84)
Cole Iverson drives, De'Aaron Poole stays with him. Cole Iverson attempts a Layup. Contested by De'Aaron Poole (2.1 feet, MAN). Cole Iverson misses. Rebound secured by Kyrie Booker.

[11:16] Team_041 possession (Score: 78-84)
Kyrie Booker attempts a 3Pt. Heavily contested by DeMar Harden (1.4 feet, ZONE)! KYRIE BOOKER MAKES IT! Assist: Bam McCollum
Score: 78-87

[11:05] Team_022 possession (Score: 78-87)
Lamelo Dosunmu drives and kicks out. DeMar Harden attempts a Midrange. Contested by Franz Rose (4.5 feet, MAN). DeMar Harden misses. Rebound secured by Tobias McCollum.

[10:49] Team_041 possession (Score: 78-87)
De'Aaron Poole drives to the basket... De'Aaron Poole commits a violation (traveling/carry)! TURNOVER! (dead ball)

[10:36] Team_022 possession (Score: 78-87)
Lauri Gobert drives to the basket... Lauri Gobert throws a bad pass out of bounds! TURNOVER! (dead ball)

[10:21] Team_041 possession (Score: 78-87)
Kyrie Booker attempts a Layup. Contested by Lauri Gobert (5.4 feet, MAN). KYRIE BOOKER MAKES IT!
Score: 78-89

[10:10] Team_022 possession (Score: 78-89)
Cole Iverson attempts a Midrange. Contested by Tobias McCollum (2.3 feet, ZONE). Cole Iverson misses. Rebound secured by Tobias McCollum.

[10:01] Team_041 possession (Score: 78-89)
Kyrie Booker drives to the basket... Kyrie Booker commits a violation (traveling/carry)! TURNOVER! (dead ball)

[09:48] Team_022 possession (Score: 78-89)
Lauri Gobert drives to the basket... Lauri Gobert loses the ball! Stripped by Tobias McCollum! TURNOVER! (live ball)

[09:36] Team_041 possession (Score: 78-89)
Tobias McCollum attempts a 3Pt. Contested by DeMar Harden (4.5 feet, ZONE). Tobias McCollum misses. Rebound secured by Lauri Gobert.

[09:23] Team_022 possession (Score: 78-89)
Lauri Gobert attempts a Midrange. Contested by Kyrie Booker (5.0 feet, MAN). LAURI GOBERT MAKES IT!
Score: 80-89

[09:11] Team_041 possession (Score: 80-89)
De'Aaron Poole attempts a Layup. BLOCKED BY COLE IVERSON! Ball is loose! Rebound secured by Cole Iverson.

[08:57] Team_022 possession (Score: 80-89)
Dejounte Towns attempts a 3Pt. Contested by Kyrie Booker (4.6 feet, ZONE). Dejounte Towns misses. Offensive rebound by Dejounte Towns! Dejounte Towns kicks it out.

[08:45] Team_022 possession (Score: 80-89)
Lamelo Dosunmu attempts a Layup. Contested by Tobias McCollum (4.9 feet, ZONE). Lamelo Dosunmu misses. Rebound secured by Tobias McCollum.

[08:28] Team_041 possession (Score: 80-89)
Franz Rose attempts a 3Pt. Wide open! DeMar Harden is 8.4 feet away. [ZONE] FRANZ ROSE MAKES IT!
Score: 80-92

[08:15] Team_022 possession (Score: 80-92)
DeMar Harden attempts a Midrange. Contested by Franz Rose (4.7 feet, MAN). DEMAR HARDEN MAKES IT!
Score: 82-92

[07:57] Team_041 possession (Score: 82-92)
FOUL! Shooting foul on Lamelo Dosunmu. Tobias McCollum to the line for 3 free throws. [Team fouls: 1] (Lamelo Dosunmu: 1 personal fouls)   FT 1/3: GOOD   FT 2/3: MISS   FT 3/3: GOOD Tobias McCollum makes 2/3 from the line.
Score: 82-94

[07:42] Team_022 possession (Score: 82-94)
DeMar Harden drives, Franz Rose stays with him. DeMar Harden attempts a Layup. Heavily contested by Franz Rose (0.5 feet, MAN)! DeMar Harden misses. Offensive rebound by Dejounte Towns! Dejounte Towns kicks it out.

[07:28] Team_022 possession (Score: 82-94)
DeMar Harden drives and kicks out. Dejounte Towns attempts a Midrange. Wide open! Bam McCollum is 6.8 feet away. [MAN] Dejounte Towns misses. Rebound secured by Tobias McCollum.

[07:13] Team_041 possession (Score: 82-94)
Tobias McCollum attempts a 3Pt. Wide open! Lauri Gobert is 6.6 feet away. [ZONE] Tobias McCollum misses. Rebound secured by Lauri Gobert.

[06:57] Team_022 possession (Score: 82-94)
Dejounte Towns attempts a Layup. Contested by Bam McCollum (4.8 feet, MAN). Dejounte Towns misses. Rebound secured by Kyrie Booker.

[06:44] Team_041 possession (Score: 82-94)
Bam McCollum attempts a 3Pt. Contested by DeMar Harden (5.8 feet, ZONE). Bam McCollum misses. Rebound secured by Lauri Gobert.

[06:30] Team_022 possession (Score: 82-94)
Lauri Gobert attempts a 3Pt. Contested by Kyrie Booker (3.5 feet, MAN). Lauri Gobert misses. Rebound secured by Tobias McCollum.

[06:20] Team_041 possession (Score: 82-94)
De'Aaron Poole drives, Cole Iverson stays with him. De'Aaron Poole attempts a Layup. Contested by Cole Iverson (3.8 feet, MAN). DE'AARON POOLE MAKES IT! Assist: Kyrie Booker
Score: 82-96

[06:07] Team_022 possession (Score: 82-96)
Lamelo Dosunmu drives to the basket... Lamelo Dosunmu throws a bad pass out of bounds! TURNOVER! (dead ball)

[06:07] Substitution (Team_022): Lamelo Dosunmu OUT → Kawhi Russell IN (stamina_rule2)

[05:55] Team_041 possession (Score: 82-96)
De'Aaron Poole attempts a Midrange. Contested by Lauri Gobert (5.5 feet, ZONE). DE'AARON POOLE MAKES IT!
Score: 82-98

[05:45] Team_022 possession (Score: 82-98)
Lauri Gobert attempts a Layup. Contested by Kyrie Booker (4.2 feet, MAN). LAURI GOBERT MAKES IT! Assist: Kawhi Russell
Score: 84-98

[05:31] Team_041 possession (Score: 84-98)
Franz Rose attempts a Midrange. Contested by DeMar Harden (5.0 feet, MAN). Franz Rose misses. Rebound secured by Kawhi Russell.

[05:18] Team_022 possession (Score: 84-98)
Dejounte Towns attempts a 3Pt. Wide open! Bam McCollum is 8.7 feet away. [MAN] DEJOUNTE TOWNS MAKES IT! Assist: Lauri Gobert
Score: 87-98

[05:04] Team_041 possession (Score: 87-98)
De'Aaron Poole attempts a Layup. Contested by Kawhi Russell (5.2 feet, ZONE). DE'AARON POOLE MAKES IT! Assist: Franz Rose
Score: 87-100

[04:45] Team_022 possession (Score: 87-100)
Lauri Gobert attempts a 3Pt. Contested by Kyrie Booker (3.2 feet, ZONE). Lauri Gobert misses. Offensive rebound by Lauri Gobert! Lauri Gobert kicks it out.

[04:30] Team_022 possession (Score: 87-100)
Lauri Gobert drives, Tobias McCollum stays with him. Lauri Gobert attempts a Dunk. Contested by Tobias McCollum (3.8 feet, ZONE). LAURI GOBERT MAKES IT! Assist: Cole Iverson
Score: 89-100

[04:16] Team_041 possession (Score: 89-100)
Tobias McCollum drives, Kawhi Russell stays with him. Tobias McCollum attempts a Dunk. Contested by Kawhi Russell (5.8 feet, MAN). TOBIAS MCCOLLUM MAKES IT! Assist: Kyrie Booker
Score: 89-102

[04:00] Team_022 possession (Score: 89-102)
DeMar Harden throws a bad pass out of bounds! TURNOVER! (dead ball)

[03:47] Team_041 possession (Score: 89-102)
Bam McCollum attempts a 3Pt. Contested by Kawhi Russell (5.8 feet, ZONE). Bam McCollum misses. Rebound secured by Kawhi Russell.

[03:31] Team_022 possession (Score: 89-102)
Cole Iverson attempts a Midrange. Wide open! Bam McCollum is 6.2 feet away. [ZONE] COLE IVERSON MAKES IT! Assist: Dejounte Towns
Score: 91-102

[03:15] Team_041 possession (Score: 91-102)
Tobias McCollum attempts a Layup. Contested by Kawhi Russell (5.1 feet, MAN). Tobias McCollum misses. Rebound secured by Kawhi Russell.

[02:59] Team_022 possession (Score: 91-102)
Cole Iverson attempts a 3Pt. Contested by De'Aaron Poole (3.9 feet, MAN). Cole Iverson misses. FOUL! Loose ball foul on De'Aaron Poole during the rebound battle. [Team fouls: 1] No free throws, side out. (De'Aaron Poole: 1 personal fouls)

[02:47] Team_022 possession (Score: 91-102)
Cole Iverson attempts a Layup. BLOCKED BY DE'AARON POOLE! Ball is loose! Rebound secured by De'Aaron Poole.

[02:36] Team_041 possession (Score: 91-102)
Tobias McCollum drives and kicks out. Bam McCollum attempts a Midrange. Contested by Dejounte Towns (2.6 feet, ZONE). Bam McCollum misses. Rebound secured by Kawhi Russell.

[02:22] Team_022 possession (Score: 91-102)
Dejounte Towns attempts a 3Pt. Wide open! Tobias McCollum is 7.9 feet away. [ZONE] Dejounte Towns misses. Rebound secured by Tobias McCollum.

[02:10] Team_041 possession (Score: 91-102)
Kyrie Booker throws a bad pass! Stolen by Lauri Gobert! TURNOVER! (live ball)

[01:55] Team_022 possession (Score: 91-102)
FOUL! Reach-in foul on Tobias McCollum during the drive. [Team fouls: 2] No free throws, side out. (Tobias McCollum: 1 personal fouls)

[01:42] Team_022 possession (Score: 91-102)
Kawhi Russell attempts a Midrange. Contested by Tobias McCollum (4.2 feet, MAN). KAWHI RUSSELL MAKES IT! Assist: Lauri Gobert
Score: 93-102

[01:28] Team_041 possession (Score: 93-102)
Tobias McCollum attempts a Midrange. Wide open! Kawhi Russell is 7.9 feet away. [MAN] Tobias McCollum misses. Rebound secured by Lauri Gobert.

[01:09] Team_022 possession (Score: 93-102)
DeMar Harden attempts a 3Pt. Contested by Kyrie Booker (3.1 feet, ZONE). DeMar Harden misses. Offensive rebound by Lauri Gobert! Lauri Gobert kicks it out.

[00:57] Team_022 possession (Score: 93-102)
Kawhi Russell drives, picks up Tobias McCollum. Help arrives from Kyrie Booker! Kawhi Russell attempts a Dunk. Contested by Kyrie Booker (6.0 feet, ZONE). KAWHI RUSSELL MAKES IT! Assist: Cole Iverson
Score: 95-102

[00:39] Team_041 possession (Score: 95-102)
FOUL! Reach-in foul on Cole Iverson during the drive. [Team fouls: 2] No free throws, side out. (Cole Iverson: 1 personal fouls)

[00:20] Team_041 possession (Score: 95-102)
De'Aaron Poole attempts a 3Pt. Wide open! Cole Iverson is 7.4 feet away. [MAN] DE'AARON POOLE MAKES IT! Assist: Franz Rose
Score: 95-105

[00:02] Team_022 possession (Score: 95-105)
DeMar Harden attempts a Midrange. Contested by Kyrie Booker (5.5 feet, ZONE). DeMar Harden misses. Rebound secured by Kyrie Booker.

================================================================================
                              4TH QUARTER COMPLETE                              
================================================================================

4TH QUARTER SCORE: Team_022 17, Team_041 21

BOX SCORE:
================================================================================

Team_022
--------------------------------------------------------------------------------
Player                MIN  PTS  REB  AST  TO      FG   FG%      3P   3P%
--------------------------------------------------------------------------------
Lauri Gobert           16    6    7    2   0   3/4    75.0     0/0   0.0
Kawhi Russell          13    4    4    1   0   2/2   100.0     0/0   0.0
Dejounte Towns         16    3    2    1   0   1/3    33.3     0/0   0.0
Cole Iverson           16    2    1    2   0   1/4    25.0     0/0   0.0
DeMar Harden           16    2    0    0   0   1/3    33.3     0/0   0.0
Lamelo Dosunmu         35    0    0    0   0   0/2     0.0     0/0   0.0

TEAM: FG: 8/18 (44.4%), 3PT: 1/3 (33.3%), REB: 14 (5 off, 9 def), AST: 6, TO: 5
TEAM FOULS: 2


Team_041
--------------------------------------------------------------------------------
Player                MIN  PTS  REB  AST  TO      FG   FG%      3P   3P%
--------------------------------------------------------------------------------
De'Aaron Poole         16    9    1    0   0   4/5    80.0     0/0   0.0
Kyrie Booker           16    5    3    2   0   2/2   100.0     0/0   0.0
Tobias McCollum        15    4    6    0   0   2/7    28.6     0/0   0.0
Franz Rose             15    3    0    2   0   1/2    50.0     0/0   0.0
Bam McCollum           16    0    0    1   0   0/2     0.0     0/0   0.0

TEAM: FG: 9/18 (50.0%), 3PT: 4/8 (50.0%), REB: 10 (0 off, 10 def), AST: 5, TO: 4
TEAM FOULS: 2

================================================================================

================================================================================
                               FULL GAME COMPLETE                               
================================================================================

FINAL SCORE: Team_022 95, Team_041 105

SCORING BY QUARTER:
--------------------------------------------------------------------------------
Team                     Q1     Q2     Q3     Q4    FINAL
--------------------------------------------------------------------------------
Team_022                 22     22     34     17       95
Team_041                 34     20     30     21      105
--------------------------------------------------------------------------------

FULL GAME BOX SCORE:
================================================================================

Team_022
--------------------------------------------------------------------------------
Player                MIN  PTS  REB  AST  TO      FG   FG%      3P   3P%      FT STL BLK
--------------------------------------------------------------------------------
Lamelo Dosunmu         35    8    0    3   2   4/14   28.6   0/3     0.0   2/2     0   0
Malcolm Allen          32   26    0    4   1   9/11   81.8   5/6    83.3   3/4     0   0
Michael Ginobili       32    9   10    0   0   5/10   50.0   1/2    50.0   5/6     0   2
Myles Anthony          32   10    8    6   4   4/10   40.0   3/7    42.9   1/2     0   0
Dirk Markkanen         32   13   13    2   2   7/11   63.6   0/2     0.0   1/4     1   1
DeMar Harden           16    2    0    0   3   1/4    25.0   0/0     0.0   0/0     0   0
Lauri Gobert           16    8    7    2   0   4/6    66.7   0/2     0.0   0/0     1   1
Dejounte Towns         16    5    2    1   0   2/4    50.0   1/2    50.0   0/0     0   0
Cole Iverson           16    6    1    2   0   3/6    50.0   0/0     0.0   4/4     0   1
Kawhi Russell          13    4    5    2   1   2/2   100.0   0/0     0.0   0/0     1   0

TEAM: FG: 41/78 (52.6%), 3PT: 10/24 (41.7%), REB: 47 (16 off, 31 def), AST: 22, TO: 13


Team_041
--------------------------------------------------------------------------------
Player                MIN  PTS  REB  AST  TO      FG   FG%      3P   3P%      FT STL BLK
--------------------------------------------------------------------------------
Stephen Ingram         34   14    8    1   0   6/12   50.0   2/3    66.7   2/2     0   0
Scottie Turner         33   17    0    3   1   8/11   72.7   4/5    80.0   1/2     0   0
Jarrett Anunoby        32    7    0    6   1   3/8    37.5   0/3     0.0   1/1     0   0
Dejounte Griffin       32    7   12    3   2   3/6    50.0   1/3    33.3   0/2     0   0
Terry Barrett          32   24    9    4   2  10/15   66.7   1/2    50.0   2/3     2   1
Kyrie Booker           16   11    3    3   3   5/6    83.3   1/1   100.0   0/0     0   0
Bam McCollum           16    3    0    2   0   1/3    33.3   0/2     0.0   1/1     1   0
De'Aaron Poole         16   11    2    1   1   5/6    83.3   1/1   100.0   0/0     0   1
Franz Rose             15    6    0    2   1   2/3    66.7   2/2   100.0   0/0     0   0
Tobias McCollum        15    4    7    0   0   2/7    28.6   1/3    33.3   2/3     1   0

TEAM: FG: 45/77 (58.4%), 3PT: 13/25 (52.0%), REB: 40 (4 off, 36 def), AST: 25, TO: 11

================================================================================
