================================================================================
                        FULL GAME - Team_066 vs Team_078                        
================================================================================

================================================================================
                       1ST QUARTER - Team_066 vs Team_078                       
================================================================================

[12:00] Team_066 possession (Score: 0-0)
Brandon Reaves throws a bad pass! Stolen by Isaiah Simmons! TURNOVER! (live ball)

[11:45] Team_078 possession (Score: 0-0)
Jabari Barnes drives to the basket... Jabari Barnes loses the ball! Stripped by Kyle Wagner! TURNOVER! (live ball)

[11:27] Team_066 possession (Score: 0-0)
Yao Brogdon attempts a 3Pt. Heavily contested by Isaiah Simmons (1.3 feet, ZONE)! Yao Brogdon misses. Rebound secured by Jabari Barrett.

[11:14] Team_078 possession (Score: 0-0)
Kyrie Carter attempts a 3Pt. Wide open! Pau Curry is 6.8 feet away. [MAN] KYRIE CARTER MAKES IT! Assist: Jabari Barnes
Score: 0-3

[11:04] Team_066 possession (Score: 0-3)
Jimmy Davis attempts a Layup. Contested by Jabari Barnes (4.0 feet, MAN). JIMMY DAVIS MAKES IT! Assist: Yao Brogdon
Score: 2-3

[10:48] Team_078 possession (Score: 2-3)
Ben Ginobili attempts a 3Pt. Contested by Yao Brogdon (2.2 feet, MAN). BEN GINOBILI MAKES IT! Assist: Jabari Barrett
Score: 2-6

[10:32] Team_066 possession (Score: 2-6)
Yao Brogdon attempts a Midrange. Contested by Isaiah Simmons (2.6 feet, ZONE). Yao Brogdon misses. Offensive rebound by Yao Brogdon! Yao Brogdon kicks it out.

[10:14] Team_066 possession (Score: 2-6)
Yao Brogdon attempts a Midrange. Wide open! Ben Ginobili is 7.3 feet away. [ZONE] Yao Brogdon misses. Offensive rebound by Yao Brogdon! Yao Brogdon kicks it out.

[09:56] Team_066 possession (Score: 2-6)
Pau Curry attempts a Midrange. Contested by Kyrie Carter (3.6 feet, MAN). PAU CURRY MAKES IT!
Score: 4-6

[09:45] Team_078 possession (Score: 4-6)
Ben Ginobili drives, Yao Brogdon stays with him. Ben Ginobili attempts a Dunk. Contested by Yao Brogdon (4.3 feet, MAN). Ben Ginobili misses. FOUL! Loose ball foul on Kyle Wagner during the rebound battle. [Team fouls: 1] No free throws, side out. (Kyle Wagner: 1 personal fouls)

[09:33] Team_078 possession (Score: 4-6)
Ben Ginobili attempts a 3Pt. Contested by Pau Curry (4.8 feet, ZONE). Ben Ginobili misses. Rebound secured by Kyle Wagner.

[09:16] Team_066 possession (Score: 4-6)
Jimmy Davis attempts a 3Pt. Contested by Kyrie Carter (4.5 feet, ZONE). Jimmy Davis misses. Rebound secured by Isaiah Simmons.

[09:00] Team_078 possession (Score: 4-6)
Jabari Barnes attempts a Midrange. Contested by Pau Curry (5.3 feet, ZONE). JABARI BARNES MAKES IT!
Score: 4-8

[08:47] Team_066 possession (Score: 4-8)
FOUL! Shooting foul on Jabari Barrett. Kyle Wagner to the line for 2 free throws. [Team fouls: 1] (Jabari Barrett: 1 personal fouls)   FT 1/2: GOOD   FT 2/2: GOOD Kyle Wagner makes 2/2 from the line.
Score: 6-8

[08:37] Team_078 possession (Score: 6-8)
Isaiah Simmons attempts a 3Pt. Contested by Brandon Reaves (3.8 feet, MAN). Isaiah Simmons misses. Offensive rebound by Jabari Barrett! Jabari Barrett kicks it out.

[08:21] Team_078 possession (Score: 6-8)
Isaiah Simmons attempts a Layup. Contested by Brandon Reaves (4.9 feet, MAN). ISAIAH SIMMONS MAKES IT! Assist: Kyrie Carter
Score: 6-10

[08:06] Team_066 possession (Score: 6-10)
FOUL! Shooting foul on Isaiah Simmons. Brandon Reaves to the line for 2 free throws. [Team fouls: 2] (Isaiah Simmons: 1 personal fouls)   FT 1/2: GOOD   FT 2/2: GOOD Brandon Reaves makes 2/2 from the line.
Score: 8-10

[07:51] Team_078 possession (Score: 8-10)
Kyrie Carter attempts a 3Pt. Wide open! Pau Curry is 8.0 feet away. [MAN] KYRIE CARTER MAKES IT!
Score: 8-13

[07:38] Team_066 possession (Score: 8-13)
Brandon Reaves attempts a 3Pt. Contested by Isaiah Simmons (5.2 feet, ZONE). Brandon Reaves misses. Rebound secured by Ben Ginobili.

[07:26] Team_078 possession (Score: 8-13)
Isaiah Simmons attempts a 3Pt. Wide open! Pau Curry is 7.9 feet away. [ZONE] Isaiah Simmons misses. Rebound secured by Kyle Wagner.

[07:12] Team_066 possession (Score: 8-13)
FOUL! Offensive foul on Kyle Wagner! Jabari Barrett drew the charge! [Team fouls: 2] (Kyle Wagner: 2 personal fouls) TURNOVER! (dead ball)

[06:57] Team_078 possession (Score: 8-13)
Kyrie Carter attempts a Midrange. Contested by Pau Curry (3.4 feet, ZONE). KYRIE CARTER MAKES IT!
Score: 8-15

[06:42] Team_066 possession (Score: 8-15)
FOUL! Reach-in foul on Jabari Barrett during the drive. [Team fouls: 3] No free throws, side out. (Jabari Barrett: 2 personal fouls)

[06:23] Team_066 possession (Score: 8-15)
Kyle Wagner attempts a Layup. Heavily contested by Jabari Barrett (0.7 feet, MAN)! KYLE WAGNER MAKES IT! Assist: Brandon Reaves
Score: 10-15

[06:08] Team_078 possession (Score: 10-15)
Ben Ginobili attempts a 3Pt. Contested by Pau Curry (3.9 feet, ZONE). Ben Ginobili misses. Rebound secured by Brandon Reaves.

[05:55] Team_066 possession (Score: 10-15)
Brandon Reaves attempts a Midrange. Contested by Kyrie Carter (3.4 feet, ZONE). Brandon Reaves misses. Offensive rebound by Yao Brogdon! Yao Brogdon kicks it out.

[05:43] Team_066 possession (Score: 10-15)
Yao Brogdon drives, Ben Ginobili stays with him. Yao Brogdon attempts a Dunk. Contested by Ben Ginobili (4.7 feet, ZONE). Yao Brogdon misses. Offensive rebound by Yao Brogdon! Yao Brogdon kicks it out.

[05:27] Team_066 possession (Score: 10-15)
FOUL! Shooting foul on Ben Ginobili. Jimmy Davis to the line for 2 free throws. [Team fouls: 4] (Ben Ginobili: 1 personal fouls)   FT 1/2: GOOD   FT 2/2: GOOD Jimmy Davis makes 2/2 from the line.
Score: 12-15

[05:15] Team_078 possession (Score: 12-15)
Jabari Barnes attempts a Midrange. Wide open! Jimmy Davis is 6.3 feet away. [MAN] JABARI BARNES MAKES IT!
Score: 12-17

[05:03] Team_066 possession (Score: 12-17)
Jimmy Davis drives and kicks out. Kyle Wagner attempts a 3Pt. Contested by Jabari Barrett (4.7 feet, MAN). KYLE WAGNER MAKES IT! Assist: Yao Brogdon
Score: 15-17

[04:50] Team_078 possession (Score: 15-17)
Jabari Barrett drives, Kyle Wagner stays with him. Jabari Barrett attempts a Layup. Wide open! Kyle Wagner is 7.9 feet away. [MAN] JABARI BARRETT MAKES IT!
Score: 15-19

[04:37] Team_066 possession (Score: 15-19)
Pau Curry loses the ball! Stripped by Kyrie Carter! TURNOVER! (live ball)

[04:19] Team_078 possession (Score: 15-19)
Ben Ginobili drives and kicks out. Ben Ginobili attempts a 3Pt. Contested by Pau Curry (4.2 feet, ZONE). Ben Ginobili misses. Rebound secured by Kyle Wagner.

[04:04] Team_066 possession (Score: 15-19)
Kyle Wagner attempts a Midrange. Contested by Kyrie Carter (3.5 feet, ZONE). Kyle Wagner misses. Rebound secured by Isaiah Simmons.

[03:48] Team_078 possession (Score: 15-19)
Jabari Barrett loses control! Ball rolls out of bounds! TURNOVER! (dead ball)

[03:38] Team_066 possession (Score: 15-19)
Jimmy Davis drives to the basket... FOUL! Offensive foul on Jimmy Davis! Jabari Barnes drew the charge! [Team fouls: 3] (Jimmy Davis: 1 personal fouls) TURNOVER! (dead ball)

[03:23] Team_078 possession (Score: 15-19)
Isaiah Simmons attempts a 3Pt. Wide open! Brandon Reaves is 7.3 feet away. [MAN] ISAIAH SIMMONS MAKES IT! Assist: Ben Ginobili
Score: 15-22

[03:08] Team_066 possession (Score: 15-22)
Pau Curry drives, picks up Kyrie Carter. Help arrives from Isaiah Simmons! Pau Curry attempts a Dunk. Wide open! Isaiah Simmons is 6.0 feet away. [MAN] PAU CURRY MAKES IT! Assist: Brandon Reaves
Score: 17-22

[02:54] Team_078 possession (Score: 17-22)
Jabari Barnes attempts a 3Pt. Contested by Jimmy Davis (5.1 feet, MAN). Jabari Barnes misses. FOUL! Loose ball foul on Brandon Reaves during the rebound battle. [Team fouls: 4] No free throws, side out. (Brandon Reaves: 1 personal fouls)

[02:38] Team_078 possession (Score: 17-22)
Isaiah Simmons makes the Midrange and draws the foul on Jimmy Davis! And-1! Isaiah Simmons to the line for 1. [BONUS: 5 team fouls] (Jimmy Davis: 2 personal fouls)   FT 1/1: MISS Isaiah Simmons makes 0/1 from the line. Rebound secured by Yao Brogdon.
Score: 17-24

[02:23] Team_066 possession (Score: 17-24)
Kyle Wagner attempts a Layup. Heavily contested by Jabari Barrett (1.6 feet, MAN)! Kyle Wagner misses. Offensive rebound by Kyle Wagner! Kyle Wagner kicks it out.

[02:07] Team_066 possession (Score: 17-24)
Yao Brogdon attempts a Midrange. Wide open! Kyrie Carter is 6.8 feet away. [ZONE] Yao Brogdon misses. Offensive rebound by Kyle Wagner! Kyle Wagner kicks it out.

[01:53] Team_066 possession (Score: 17-24)
Pau Curry drives and kicks out. Pau Curry attempts a 3Pt. Contested by Kyrie Carter (4.6 feet, MAN). Pau Curry misses. Rebound secured by Ben Ginobili.

[01:38] Team_078 possession (Score: 17-24)
Ben Ginobili attempts a Midrange. Wide open! Brandon Reaves is 6.8 feet away. [ZONE] BEN GINOBILI MAKES IT! Assist: Isaiah Simmons
Score: 17-26

[01:28] Team_066 possession (Score: 17-26)
Pau Curry drives, picks up Jabari Barrett. Help arrives from Kyrie Carter! Pau Curry attempts a Layup. Contested by Kyrie Carter (6.0 feet, ZONE). PAU CURRY MAKES IT! Assist: Yao Brogdon
Score: 19-26

[01:12] Team_078 possession (Score: 19-26)
Jabari Barnes attempts a 3Pt. Contested by Jimmy Davis (3.5 feet, MAN). JABARI BARNES MAKES IT! Assist: Ben Ginobili
Score: 19-29

[00:54] Team_066 possession (Score: 19-29)
Pau Curry attempts a Midrange. Contested by Kyrie Carter (2.5 feet, MAN). PAU CURRY MAKES IT!
Score: 21-29

[00:34] Team_078 possession (Score: 21-29)
Isaiah Simmons drives and kicks out. Kyrie Carter attempts a 3Pt. Wide open! Jimmy Davis is 8.6 feet away. [ZONE] Kyrie Carter misses. Rebound secured by Kyle Wagner.

[00:19] Team_066 possession (Score: 21-29)
Pau Curry attempts a 3Pt. Contested by Kyrie Carter (3.5 feet, MAN). PAU CURRY MAKES IT!
Score: 24-29

[00:07] Team_078 possession (Score: 24-29)
Kyrie Carter attempts a 3Pt. Wide open! Pau Curry is 7.1 feet away. [ZONE] Kyrie Carter misses. FOUL! Loose ball foul on Brandon Reaves during the rebound battle. [IN THE BONUS! 6 team fouls] Isaiah Simmons to the line for 2 free throws. (Brandon Reaves: 2 personal fouls)   FT 1/2: GOOD   FT 2/2: GOOD Isaiah Simmons makes 2/2 from the line.
Score: 24-31

================================================================================
                              1ST QUARTER COMPLETE                              
================================================================================

1ST QUARTER SCORE: Team_066 24, Team_078 31

BOX SCORE:
================================================================================

Team_066
--------------------------------------------------------------------------------
Player                MIN  PTS  REB  AST  TO      FG   FG%      3P   3P%
--------------------------------------------------------------------------------
Pau Curry              12   11    0    0   0   5/6    83.3     0/0   0.0
Kyle Wagner            12    7    6    0   0   3/4    75.0     0/0   0.0
Jimmy Davis            12    4    0    0   0   2/3    66.7     0/0   0.0
Brandon Reaves         12    2    1    2   0   1/2    50.0     0/0   0.0
Yao Brogdon            12    0    5    3   0   0/1     0.0     0/0   0.0

TEAM: FG: 11/16 (68.8%), 3PT: 1/4 (25.0%), REB: 12 (6 off, 6 def), AST: 5, TO: 4
TEAM FOULS: 6 [Team_078 in BONUS]


Team_078
--------------------------------------------------------------------------------
Player                MIN  PTS  REB  AST  TO      FG   FG%      3P   3P%
--------------------------------------------------------------------------------
Kyrie Carter           12    8    0    1   0   3/3   100.0     0/0   0.0
Jabari Barnes          12    7    0    1   0   3/3   100.0     0/0   0.0
Isaiah Simmons         12    7    3    1   0   3/6    50.0     0/0   0.0
Ben Ginobili           12    5    2    2   0   2/5    40.0     0/0   0.0
Jabari Barrett         12    2    3    1   0   1/1   100.0     0/0   0.0

TEAM: FG: 12/18 (66.7%), 3PT: 6/9 (66.7%), REB: 8 (3 off, 5 def), AST: 6, TO: 2
TEAM FOULS: 4

================================================================================

================================================================================
                       2ND QUARTER - Team_066 vs Team_078                       
================================================================================

[12:00] Team_066 possession (Score: 24-31)
Yao Brogdon attempts a Midrange. Wide open! Ben Ginobili is 6.0 feet away. [MAN] Yao Brogdon misses. Offensive rebound by Yao Brogdon! Yao Brogdon kicks it out.

[11:49] Team_066 possession (Score: 24-31)
Yao Brogdon attempts a 3Pt. Contested by Isaiah Simmons (4.6 feet, ZONE). Yao Brogdon misses. Rebound secured by Isaiah Simmons.

[11:34] Team_078 possession (Score: 24-31)
Jabari Barrett attempts a Midrange. Wide open! Kyle Wagner is 8.2 feet away. [MAN] Jabari Barrett misses. Rebound secured by Brandon Reaves.

[11:16] Team_066 possession (Score: 24-31)
Yao Brogdon attempts a 3Pt. Wide open! Ben Ginobili is 6.9 feet away. [MAN] YAO BROGDON MAKES IT! Assist: Kyle Wagner
Score: 27-31

[11:01] Team_078 possession (Score: 27-31)
Isaiah Simmons attempts a 3Pt. Wide open! Yao Brogdon is 6.8 feet away. [ZONE] Isaiah Simmons misses. Rebound secured by Yao Brogdon.

[10:46] Team_066 possession (Score: 27-31)
Kyle Wagner makes the Midrange and draws the foul on Jabari Barrett! And-1! Kyle Wagner to the line for 1. [Team fouls: 1] (Jabari Barrett: 1 personal fouls)   FT 1/1: GOOD Kyle Wagner makes 1/1 from the line.
Score: 30-31

[10:33] Team_078 possession (Score: 30-31)
Jabari Barnes attempts a Layup. Contested by Jimmy Davis (4.5 feet, MAN). Jabari Barnes misses. Rebound secured by Kyle Wagner.

[10:18] Team_066 possession (Score: 30-31)
Yao Brogdon attempts a 3Pt. Wide open! Ben Ginobili is 6.1 feet away. [MAN] YAO BROGDON MAKES IT! Assist: Brandon Reaves
Score: 33-31

[10:00] Team_078 possession (Score: 33-31)
FOUL! Reach-in foul on Jimmy Davis during the drive. [Team fouls: 1] No free throws, side out. (Jimmy Davis: 1 personal fouls)

[09:47] Team_078 possession (Score: 33-31)
Isaiah Simmons attempts a 3Pt. Wide open! Brandon Reaves is 6.8 feet away. [MAN] Isaiah Simmons misses. Offensive rebound by Jabari Barrett! Jabari Barrett kicks it out.

[09:33] Team_078 possession (Score: 33-31)
Isaiah Simmons makes the Layup and draws the foul on Kyle Wagner! And-1! Isaiah Simmons to the line for 1. [Team fouls: 2] (Kyle Wagner: 1 personal fouls)   FT 1/1: GOOD Isaiah Simmons makes 1/1 from the line.
Score: 33-34

[09:20] Team_066 possession (Score: 33-34)
Yao Brogdon throws a bad pass! Stolen by Ben Ginobili! TURNOVER! (live ball)

[09:08] Team_078 possession (Score: 33-34)
Jabari Barnes attempts a 3Pt. Wide open! Jimmy Davis is 6.7 feet away. [MAN] JABARI BARNES MAKES IT! Assist: Isaiah Simmons
Score: 33-37

[08:49] Team_066 possession (Score: 33-37)
Pau Curry attempts a 3Pt. Heavily contested by Isaiah Simmons (1.2 feet, ZONE)! Pau Curry misses. Rebound secured by Isaiah Simmons.

[08:34] Team_078 possession (Score: 33-37)
Isaiah Simmons attempts a Midrange. Contested by Pau Curry (5.8 feet, ZONE). Isaiah Simmons misses. Rebound secured by Brandon Reaves.

[08:17] Team_066 possession (Score: 33-37)
Jimmy Davis drives and kicks out. Pau Curry attempts a Midrange. Contested by Kyrie Carter (5.3 feet, MAN). PAU CURRY MAKES IT! Assist: Kyle Wagner
Score: 35-37

[08:03] Team_078 possession (Score: 35-37)
Jabari Barrett drives, picks up Kyle Wagner. Help arrives from Jimmy Davis! Jabari Barrett attempts a Layup. Wide open! Jimmy Davis is 6.6 feet away. [MAN] Jabari Barrett misses. Rebound secured by Brandon Reaves.

[07:49] Team_066 possession (Score: 35-37)
Brandon Reaves attempts a Layup. Contested by Jabari Barrett (5.4 feet, ZONE). Brandon Reaves misses. Rebound secured by Isaiah Simmons.

[07:32] Team_078 possession (Score: 35-37)
Isaiah Simmons attempts a Midrange. Contested by Brandon Reaves (5.6 feet, MAN). Isaiah Simmons misses. Rebound secured by Kyle Wagner.

[07:14] Team_066 possession (Score: 35-37)
Yao Brogdon attempts a Midrange. Wide open! Ben Ginobili is 6.1 feet away. [MAN] YAO BROGDON MAKES IT!
Score: 37-37

[06:59] Team_078 possession (Score: 37-37)
Ben Ginobili attempts a Midrange. Heavily contested by Kyle Wagner (1.2 feet, ZONE)! Ben Ginobili misses. Rebound secured by Yao Brogdon.

[06:43] Team_066 possession (Score: 37-37)
Jimmy Davis drives to the basket... Jimmy Davis loses the ball! Stripped by Jabari Barnes! TURNOVER! (live ball)

[06:30] Team_078 possession (Score: 37-37)
Jabari Barnes attempts a Layup. Wide open! Jimmy Davis is 7.8 feet away. [MAN] JABARI BARNES MAKES IT! Assist: Isaiah Simmons
Score: 37-39

[06:15] Team_066 possession (Score: 37-39)
FOUL! Shooting foul on Ben Ginobili. Yao Brogdon to the line for 2 free throws. [Team fouls: 2] (Ben Ginobili: 1 personal fouls)   FT 1/2: GOOD   FT 2/2: GOOD Yao Brogdon makes 2/2 from the line.
Score: 39-39

[05:56] Team_078 possession (Score: 39-39)
Jabari Barrett attempts a Midrange. Contested by Kyle Wagner (4.7 feet, MAN). Jabari Barrett misses. Rebound secured by Yao Brogdon.

[05:42] Team_066 possession (Score: 39-39)
Yao Brogdon drives to the basket... Yao Brogdon throws a bad pass out of bounds! TURNOVER! (dead ball)

[05:42] Substitution (Team_066): Jimmy Davis OUT → Pascal Carter IN (stamina_rule2)

[05:42] Substitution (Team_066): Pau Curry OUT → Lauri LaVine IN (stamina_rule2)

[05:42] Substitution (Team_066): Brandon Reaves OUT → Brandon Middleton IN (stamina_rule2)

[05:42] Substitution (Team_066): Yao Brogdon OUT → Cole Morant IN (stamina_rule2)

[05:42] Substitution (Team_066): Kyle Wagner OUT → Donovan Simmons IN (stamina_rule2)

[05:42] Substitution (Team_078): Jabari Barnes OUT → Magic Barrett IN (stamina_rule2)

[05:42] Substitution (Team_078): Kyrie Carter OUT → Damian Allen IN (stamina_rule2)

[05:42] Substitution (Team_078): Isaiah Simmons OUT → Malcolm Randle IN (stamina_rule2)

[05:42] Substitution (Team_078): Ben Ginobili OUT → Paul Ming IN (stamina_rule2)

[05:42] Substitution (Team_078): Jabari Barrett OUT → Draymond Irving IN (stamina_rule2)

[05:28] Team_078 possession (Score: 39-39)
Malcolm Randle attempts a Layup. Contested by Donovan Simmons (5.5 feet, ZONE). MALCOLM RANDLE MAKES IT!
Score: 39-41

[05:13] Team_066 possession (Score: 39-41)
FOUL! Shooting foul on Damian Allen. Lauri LaVine to the line for 2 free throws. [Team fouls: 3] (Damian Allen: 1 personal fouls)   FT 1/2: MISS   FT 2/2: GOOD Lauri LaVine makes 1/2 from the line.
Score: 40-41

[04:58] Team_078 possession (Score: 40-41)
Magic Barrett attempts a 3Pt. Contested by Brandon Middleton (3.7 feet, ZONE). MAGIC BARRETT MAKES IT! Assist: Draymond Irving
Score: 40-44

[04:43] Team_066 possession (Score: 40-44)
Pascal Carter attempts a Layup. Contested by Paul Ming (5.5 feet, ZONE). PASCAL CARTER MAKES IT! Assist: Cole Morant
Score: 42-44

[04:30] Team_078 possession (Score: 42-44)
FOUL! Reach-in foul on Pascal Carter during the drive. [Team fouls: 3] No free throws, side out. (Pascal Carter: 1 personal fouls)

[04:15] Team_078 possession (Score: 42-44)
Malcolm Randle throws a bad pass out of bounds! TURNOVER! (dead ball)

[03:58] Team_066 possession (Score: 42-44)
Brandon Middleton attempts a Midrange. Wide open! Magic Barrett is 6.9 feet away. [ZONE] Brandon Middleton misses. Rebound secured by Paul Ming.

[03:45] Team_078 possession (Score: 42-44)
Paul Ming attempts a Midrange. Contested by Cole Morant (4.2 feet, ZONE). PAUL MING MAKES IT!
Score: 42-46

[03:35] Team_066 possession (Score: 42-46)
Pascal Carter drives to the basket... Pascal Carter throws a bad pass! Stolen by Paul Ming! TURNOVER! (live ball)

[03:24] Team_078 possession (Score: 42-46)
Draymond Irving drives to the basket... Draymond Irving loses control! Ball rolls out of bounds! TURNOVER! (dead ball)

[03:10] Team_066 possession (Score: 42-46)
Brandon Middleton attempts a 3Pt. Contested by Malcolm Randle (4.7 feet, MAN). Brandon Middleton misses. Rebound secured by Malcolm Randle.

[02:53] Team_078 possession (Score: 42-46)
Draymond Irving makes the Layup and draws the foul on Donovan Simmons! And-1! Draymond Irving to the line for 1. [Team fouls: 4] (Donovan Simmons: 1 personal fouls)   FT 1/1: MISS Draymond Irving makes 0/1 from the line. Offensive rebound by Draymond Irving! Draymond Irving kicks it out.
Score: 42-48

[02:36] Team_078 possession (Score: 42-48)
Magic Barrett attempts a 3Pt. Contested by Lauri LaVine (4.8 feet, ZONE). Magic Barrett misses. Rebound secured by Brandon Middleton.

[02:21] Team_066 possession (Score: 42-48)
Donovan Simmons drives and kicks out. Brandon Middleton attempts a Midrange. BLOCKED BY MALCOLM RANDLE! Ball is loose! Rebound secured by Malcolm Randle.

[02:10] Team_078 possession (Score: 42-48)
Magic Barrett drives to the basket... Magic Barrett loses control! Ball rolls out of bounds! TURNOVER! (dead ball)

[01:59] Team_066 possession (Score: 42-48)
Lauri LaVine attempts a Midrange. Contested by Damian Allen (3.7 feet, MAN). Lauri LaVine misses. Offensive rebound by Donovan Simmons! Donovan Simmons kicks it out.

[01:40] Team_066 possession (Score: 42-48)
Pascal Carter attempts a 3Pt. Wide open! Damian Allen is 7.0 feet away. [ZONE] Pascal Carter misses. Rebound secured by Paul Ming.

[01:23] Team_078 possession (Score: 42-48)
FOUL! Shooting foul on Lauri LaVine. Damian Allen to the line for 2 free throws. [BONUS: 5 team fouls] (Lauri LaVine: 1 personal fouls)   FT 1/2: GOOD   FT 2/2: MISS Damian Allen makes 1/2 from the line. Offensive rebound by Draymond Irving! Draymond Irving kicks it out.
Score: 42-49

[01:06] Team_078 possession (Score: 42-49)
Damian Allen attempts a 3Pt. Contested by Lauri LaVine (2.7 feet, MAN). DAMIAN ALLEN MAKES IT! Assist: Magic Barrett
Score: 42-52

[00:51] Team_066 possession (Score: 42-52)
Donovan Simmons attempts a Midrange. Contested by Malcolm Randle (4.3 feet, ZONE). Donovan Simmons misses. Rebound secured by Draymond Irving.

[00:34] Team_078 possession (Score: 42-52)
Damian Allen attempts a Layup. Contested by Donovan Simmons (5.4 feet, ZONE). DAMIAN ALLEN MAKES IT!
Score: 42-54

[00:22] Team_066 possession (Score: 42-54)
Donovan Simmons loses the ball! Stripped by Draymond Irving! TURNOVER! (live ball)

[00:08] Team_078 possession (Score: 42-54)
Paul Ming throws a bad pass! Stolen by Cole Morant! TURNOVER! (live ball)

================================================================================
                              2ND QUARTER COMPLETE                              
================================================================================

2ND QUARTER SCORE: Team_066 18, Team_078 23

BOX SCORE:
================================================================================

Team_066
--------------------------------------------------------------------------------
Player                MIN  PTS  REB  AST  TO      FG   FG%      3P   3P%
--------------------------------------------------------------------------------
Yao Brogdon            19   10    4    0   0   4/5    80.0     0/0   0.0
Kyle Wagner            19    3    2    2   0   1/1   100.0     0/0   0.0
Pau Curry              19    2    0    0   0   1/2    50.0     0/0   0.0
Pascal Carter           6    2    0    0   0   1/2    50.0     0/0   0.0
Lauri LaVine            6    1    0    0   0   1/1   100.0     0/0   0.0
Brandon Reaves         19    0    3    1   0   0/1     0.0     0/0   0.0
Cole Morant             6    0    0    1   0   0/0     0.0     0/0   0.0
Brandon Middleton       6    0    1    0   0   0/2     0.0     0/0   0.0
Donovan Simmons         6    0    1    0   0   0/2     0.0     0/0   0.0

TEAM: FG: 8/16 (50.0%), 3PT: 2/6 (33.3%), REB: 11 (2 off, 9 def), AST: 4, TO: 5
TEAM FOULS: 5 [Team_078 in BONUS]


Team_078
--------------------------------------------------------------------------------
Player                MIN  PTS  REB  AST  TO      FG   FG%      3P   3P%
--------------------------------------------------------------------------------
Jabari Barnes          19    5    0    0   0   2/3    66.7     0/0   0.0
Damian Allen            6    5    0    0   0   2/2   100.0     0/0   0.0
Isaiah Simmons         19    3    3    2   0   1/4    25.0     0/0   0.0
Magic Barrett           6    3    0    1   0   1/2    50.0     0/0   0.0
Malcolm Randle          6    2    2    0   0   1/1   100.0     0/0   0.0
Paul Ming               6    2    2    0   0   1/1   100.0     0/0   0.0
Jabari Barrett         19    0    1    0   0   0/3     0.0     0/0   0.0
Ben Ginobili           19    0    0    0   0   0/1     0.0     0/0   0.0
Draymond Irving         6    0    3    1   0   0/0     0.0     0/0   0.0

TEAM: FG: 8/17 (47.1%), 3PT: 3/5 (60.0%), REB: 11 (3 off, 8 def), AST: 4, TO: 4
TEAM FOULS: 3

================================================================================

================================================================================
                       3RD QUARTER - Team_066 vs Team_078                       
================================================================================

[12:00] Team_066 possession (Score: 42-54)
Yao Brogdon drives and kicks out. Kyle Wagner attempts a Midrange. Heavily contested by Jabari Barnes (1.9 feet, ZONE)! Kyle Wagner misses. Rebound secured by Jabari Barrett.

[11:43] Team_078 possession (Score: 42-54)
Ben Ginobili attempts a Layup. Wide open! Yao Brogdon is 7.6 feet away. [MAN] BEN GINOBILI MAKES IT! Assist: Kyrie Carter
Score: 42-56

[11:26] Team_066 possession (Score: 42-56)
Kyle Wagner attempts a 3Pt. Wide open! Isaiah Simmons is 6.7 feet away. [ZONE] Kyle Wagner misses. Rebound secured by Jabari Barrett.

[11:15] Team_078 possession (Score: 42-56)
Jabari Barnes makes the Midrange and draws the foul on Jimmy Davis! And-1! Jabari Barnes to the line for 1. [Team fouls: 1] (Jimmy Davis: 1 personal fouls)   FT 1/1: GOOD Jabari Barnes makes 1/1 from the line.
Score: 42-59

[10:59] Team_066 possession (Score: 42-59)
Yao Brogdon drives, picks up Ben Ginobili. Help arrives from Kyrie Carter! Yao Brogdon attempts a Layup. Contested by Kyrie Carter (4.3 feet, MAN). YAO BROGDON MAKES IT!
Score: 44-59

[10:43] Team_078 possession (Score: 44-59)
FOUL! Reach-in foul on Yao Brogdon during the drive. [Team fouls: 2] No free throws, side out. (Yao Brogdon: 1 personal fouls)

[10:28] Team_078 possession (Score: 44-59)
Isaiah Simmons attempts a Layup. Contested by Kyle Wagner (3.3 feet, ZONE). ISAIAH SIMMONS MAKES IT!
Score: 44-61

[10:11] Team_066 possession (Score: 44-61)
Brandon Reaves attempts a 3Pt. Wide open! Isaiah Simmons is 7.6 feet away. [MAN] Brandon Reaves misses. Rebound secured by Jabari Barrett.

[09:53] Team_078 possession (Score: 44-61)
Jabari Barnes drives, Kyle Wagner stays with him. Jabari Barnes attempts a Layup. Wide open! Kyle Wagner is 7.2 feet away. [ZONE] JABARI BARNES MAKES IT! Assist: Ben Ginobili
Score: 44-63

[09:42] Team_066 possession (Score: 44-63)
FOUL! Shooting foul on Isaiah Simmons. Brandon Reaves to the line for 2 free throws. [Team fouls: 1] (Isaiah Simmons: 1 personal fouls)   FT 1/2: MISS   FT 2/2: GOOD Brandon Reaves makes 1/2 from the line.
Score: 45-63

[09:32] Team_078 possession (Score: 45-63)
Isaiah Simmons attempts a Midrange. Wide open! Brandon Reaves is 6.3 feet away. [MAN] ISAIAH SIMMONS MAKES IT!
Score: 45-65

[09:19] Team_066 possession (Score: 45-65)
FOUL! Reach-in foul on Jabari Barnes during the drive. [Team fouls: 2] No free throws, side out. (Jabari Barnes: 1 personal fouls)

[09:08] Team_066 possession (Score: 45-65)
Brandon Reaves attempts a 3Pt. Contested by Isaiah Simmons (3.6 feet, ZONE). Brandon Reaves misses. Offensive rebound by Yao Brogdon! Yao Brogdon kicks it out.

[08:54] Team_066 possession (Score: 45-65)
Jimmy Davis attempts a 3Pt. Contested by Jabari Barnes (2.4 feet, MAN). Jimmy Davis misses. Rebound secured by Ben Ginobili.

[08:40] Team_078 possession (Score: 45-65)
Jabari Barnes loses control! Ball rolls out of bounds! TURNOVER! (dead ball)

[08:24] Team_066 possession (Score: 45-65)
Brandon Reaves attempts a 3Pt. Contested by Isaiah Simmons (3.4 feet, MAN). Brandon Reaves misses. Offensive rebound by Yao Brogdon! Yao Brogdon kicks it out.

[08:10] Team_066 possession (Score: 45-65)
FOUL! Shooting foul on Isaiah Simmons. Kyle Wagner to the line for 3 free throws. [Team fouls: 3] (Isaiah Simmons: 2 personal fouls)   FT 1/3: GOOD   FT 2/3: GOOD   FT 3/3: MISS Kyle Wagner makes 2/3 from the line. Offensive rebound by Yao Brogdon! Yao Brogdon kicks it out.
Score: 47-65

[07:55] Team_066 possession (Score: 47-65)
Brandon Reaves attempts a 3Pt. Contested by Isaiah Simmons (5.5 feet, MAN). Brandon Reaves misses. Rebound secured by Ben Ginobili.

[07:38] Team_078 possession (Score: 47-65)
Ben Ginobili attempts a 3Pt. Contested by Pau Curry (4.4 feet, ZONE). BEN GINOBILI MAKES IT! Assist: Jabari Barnes
Score: 47-68

[07:26] Team_066 possession (Score: 47-68)
Jimmy Davis attempts a 3Pt. Heavily contested by Isaiah Simmons (0.5 feet, ZONE)! Jimmy Davis misses. Rebound secured by Jabari Barrett.

[07:10] Team_078 possession (Score: 47-68)
Jabari Barnes attempts a Midrange. Wide open! Yao Brogdon is 6.0 feet away. [ZONE] Jabari Barnes misses. Rebound secured by Brandon Reaves.

[06:55] Team_066 possession (Score: 47-68)
Brandon Reaves attempts a Midrange. Contested by Jabari Barrett (4.4 feet, ZONE). Brandon Reaves misses. Rebound secured by Ben Ginobili.

[06:38] Team_078 possession (Score: 47-68)
Ben Ginobili attempts a Midrange. Wide open! Yao Brogdon is 6.7 feet away. [MAN] Ben Ginobili misses. Rebound secured by Kyle Wagner.

[06:28] Team_066 possession (Score: 47-68)
Jimmy Davis attempts a 3Pt. Contested by Isaiah Simmons (2.3 feet, ZONE). Jimmy Davis misses. Rebound secured by Jabari Barrett.

[06:16] Team_078 possession (Score: 47-68)
Isaiah Simmons drives and kicks out. Kyrie Carter attempts a 3Pt. Contested by Pau Curry (4.6 feet, MAN). Kyrie Carter misses. Rebound secured by Kyle Wagner.

[06:03] Team_066 possession (Score: 47-68)
FOUL! Shooting foul on Jabari Barnes. Jimmy Davis to the line for 2 free throws. [Team fouls: 4] (Jabari Barnes: 2 personal fouls)   FT 1/2: GOOD   FT 2/2: GOOD Jimmy Davis makes 2/2 from the line.
Score: 49-68

[05:48] Team_078 possession (Score: 49-68)
Jabari Barnes loses the ball! Stripped by Jimmy Davis! TURNOVER! (live ball)

[05:29] Team_066 possession (Score: 49-68)
Jimmy Davis attempts a Midrange. Contested by Jabari Barnes (2.5 feet, MAN). Jimmy Davis misses. Rebound secured by Jabari Barrett.

[05:15] Team_078 possession (Score: 49-68)
Ben Ginobili attempts a 3Pt. Contested by Yao Brogdon (5.0 feet, MAN). Ben Ginobili misses. Rebound secured by Kyle Wagner.

[05:03] Team_066 possession (Score: 49-68)
Yao Brogdon throws a bad pass! Stolen by Ben Ginobili! TURNOVER! (live ball)

[04:50] Team_078 possession (Score: 49-68)
Kyrie Carter attempts a 3Pt. Wide open! Pau Curry is 6.7 feet away. [ZONE] KYRIE CARTER MAKES IT! Assist: Isaiah Simmons
Score: 49-71

[04:40] Team_066 possession (Score: 49-71)
Kyle Wagner drives and kicks out. Brandon Reaves attempts a Midrange. Contested by Ben Ginobili (5.8 feet, ZONE). BRANDON REAVES MAKES IT!
Score: 51-71

[04:20] Team_078 possession (Score: 51-71)
Jabari Barrett attempts a Layup. Contested by Kyle Wagner (2.2 feet, MAN). JABARI BARRETT MAKES IT! Assist: Ben Ginobili
Score: 51-73

[04:06] Team_066 possession (Score: 51-73)
Pau Curry drives and kicks out. Yao Brogdon attempts a 3Pt. Contested by Ben Ginobili (3.9 feet, MAN). Yao Brogdon misses. Rebound secured by Isaiah Simmons.

[03:55] Team_078 possession (Score: 51-73)
Kyrie Carter attempts a Midrange. Contested by Pau Curry (3.5 feet, MAN). KYRIE CARTER MAKES IT! Assist: Isaiah Simmons
Score: 51-75

[03:45] Team_066 possession (Score: 51-75)
Brandon Reaves attempts a 3Pt. Contested by Isaiah Simmons (3.2 feet, MAN). Brandon Reaves misses. Rebound secured by Jabari Barrett.

[03:29] Team_078 possession (Score: 51-75)
Kyrie Carter attempts a Layup. Contested by Kyle Wagner (5.7 feet, ZONE). KYRIE CARTER MAKES IT! Assist: Jabari Barrett
Score: 51-77

[03:12] Team_066 possession (Score: 51-77)
Kyle Wagner drives and kicks out. Yao Brogdon attempts a 3Pt. Contested by Jabari Barnes (2.5 feet, ZONE). YAO BROGDON MAKES IT! Assist: Jimmy Davis
Score: 54-77

[02:53] Team_078 possession (Score: 54-77)
Isaiah Simmons drives, Kyle Wagner stays with him. Isaiah Simmons attempts a Dunk. Contested by Kyle Wagner (3.6 feet, ZONE). Isaiah Simmons misses. FOUL! Loose ball foul on Kyle Wagner during the rebound battle. [Team fouls: 3] No free throws, side out. (Kyle Wagner: 1 personal fouls)

[02:35] Team_078 possession (Score: 54-77)
Isaiah Simmons attempts a Midrange. Wide open! Pau Curry is 6.4 feet away. [ZONE] Isaiah Simmons misses. Rebound secured by Brandon Reaves.

[02:21] Team_066 possession (Score: 54-77)
Kyle Wagner attempts a 3Pt. Contested by Isaiah Simmons (3.6 feet, ZONE). Kyle Wagner misses. Rebound secured by Ben Ginobili.

[02:06] Team_078 possession (Score: 54-77)
Isaiah Simmons attempts a Layup. Wide open! Kyle Wagner is 7.5 feet away. [ZONE] ISAIAH SIMMONS MAKES IT! Assist: Ben Ginobili
Score: 54-79

[01:52] Team_066 possession (Score: 54-79)
Jimmy Davis attempts a Layup. Wide open! Jabari Barrett is 6.4 feet away. [ZONE] Jimmy Davis misses. Rebound secured by Ben Ginobili.

[01:33] Team_078 possession (Score: 54-79)
Ben Ginobili drives, Yao Brogdon stays with him. Ben Ginobili attempts a Dunk. Contested by Yao Brogdon (5.4 feet, MAN). Ben Ginobili misses. Rebound secured by Brandon Reaves.

[01:22] Team_066 possession (Score: 54-79)
Jimmy Davis attempts a Midrange. Wide open! Jabari Barnes is 10.0 feet away. [MAN] Jimmy Davis misses. Rebound secured by Jabari Barrett.

[01:05] Team_078 possession (Score: 54-79)
Kyrie Carter attempts a Midrange. Contested by Pau Curry (5.5 feet, MAN). KYRIE CARTER MAKES IT! Assist: Jabari Barrett
Score: 54-81

[00:47] Team_066 possession (Score: 54-81)
Pau Curry attempts a 3Pt. Contested by Isaiah Simmons (4.4 feet, ZONE). Pau Curry misses. Rebound secured by Jabari Barrett.

[00:32] Team_078 possession (Score: 54-81)
Ben Ginobili attempts a Layup. Wide open! Yao Brogdon is 8.7 feet away. [MAN] Ben Ginobili misses. Rebound secured by Kyle Wagner.

[00:17] Team_066 possession (Score: 54-81)
Pau Curry attempts a 3Pt. Contested by Isaiah Simmons (3.5 feet, ZONE). Pau Curry misses. Rebound secured by Isaiah Simmons.

[00:04] Team_078 possession (Score: 54-81)
Jabari Barnes attempts a Layup. Contested by Kyle Wagner (2.2 feet, ZONE). Jabari Barnes misses. Rebound secured by Kyle Wagner.

================================================================================
                              3RD QUARTER COMPLETE                              
================================================================================

3RD QUARTER SCORE: Team_066 12, Team_078 27

BOX SCORE:
================================================================================

Team_066
--------------------------------------------------------------------------------
Player                MIN  PTS  REB  AST  TO      FG   FG%      3P   3P%
--------------------------------------------------------------------------------
Yao Brogdon            31    5    3    0   0   2/3    66.7     0/0   0.0
Brandon Reaves         31    3    3    0   0   2/6    33.3     0/0   0.0
Jimmy Davis            31    2    0    1   0   1/7    14.3     0/0   0.0
Kyle Wagner            31    0    5    0   0   0/2     0.0     0/0   0.0
Pau Curry              31    0    0    0   0   0/3     0.0     0/0   0.0

TEAM: FG: 5/21 (23.8%), 3PT: 0/10 (0.0%), REB: 11 (3 off, 8 def), AST: 1, TO: 1
TEAM FOULS: 3


Team_078
--------------------------------------------------------------------------------
Player                MIN  PTS  REB  AST  TO      FG   FG%      3P   3P%
--------------------------------------------------------------------------------
Kyrie Carter           31    9    0    1   0   4/4   100.0     0/0   0.0
Isaiah Simmons         31    6    3    2   0   3/5    60.0     0/0   0.0
Ben Ginobili           31    5    5    3   0   2/6    33.3     0/0   0.0
Jabari Barnes          31    5    0    1   0   2/4    50.0     0/0   0.0
Jabari Barrett         31    2    9    2   0   1/1   100.0     0/0   0.0

TEAM: FG: 12/20 (60.0%), 3PT: 2/3 (66.7%), REB: 17 (1 off, 16 def), AST: 9, TO: 2
TEAM FOULS: 4

================================================================================

================================================================================
                       4TH QUARTER - Team_066 vs Team_078                       
================================================================================

[12:00] Substitution (Team_066): Jimmy Davis OUT (stamina: 67) → Pascal Carter IN (comeback_detected)

[12:00] Substitution (Team_078): Jabari Barnes OUT (stamina: 67) → Magic Barrett IN (comeback_detected)

[12:00] Team_066 possession (Score: 54-81)
FOUL! Holding foul on Magic Barrett. [Team fouls: 1] No free throws, side out. (Magic Barrett: 1 personal fouls)

[11:49] Team_066 possession (Score: 54-81)
FOUL! Offensive foul on Brandon Reaves! Isaiah Simmons drew the charge! [Team fouls: 1] (Brandon Reaves: 1 personal fouls) TURNOVER! (dead ball)

[11:34] Team_078 possession (Score: 54-81)
FOUL! Reach-in foul on Brandon Reaves during the drive. [Team fouls: 2] No free throws, side out. (Brandon Reaves: 2 personal fouls)

[11:18] Team_078 possession (Score: 54-81)
Isaiah Simmons drives and kicks out. Isaiah Simmons makes the 3Pt and draws the foul on Pau Curry! And-1! Isaiah Simmons to the line for 1. [Team fouls: 3] (Pau Curry: 1 personal fouls)   FT 1/1: MISS Isaiah Simmons makes 0/1 from the line. FOUL! Loose ball foul on Kyle Wagner during the free throw rebound! [Team fouls: 4] No free throws, side out. (Kyle Wagner: 1 personal fouls)
Score: 54-84

[11:01] Team_078 possession (Score: 54-84)
Kyrie Carter drives, picks up Kyle Wagner. Help arrives from Pascal Carter! Kyrie Carter attempts a Layup. Wide open! Pascal Carter is 7.1 feet away. [ZONE] Kyrie Carter misses. Rebound secured by Brandon Reaves.

[10:41] Team_066 possession (Score: 54-84)
FOUL! Reach-in foul on Jabari Barrett during the drive. [Team fouls: 2] No free throws, side out. (Jabari Barrett: 1 personal fouls)

[10:25] Team_066 possession (Score: 54-84)
Brandon Reaves attempts a Midrange. Contested by Kyrie Carter (2.6 feet, ZONE). BRANDON REAVES MAKES IT!
Score: 56-84

[10:07] Team_078 possession (Score: 56-84)
Ben Ginobili attempts a Midrange. Contested by Yao Brogdon (4.2 feet, ZONE). BEN GINOBILI MAKES IT! Assist: Jabari Barrett
Score: 56-86

[09:55] Team_066 possession (Score: 56-86)
FOUL! Reach-in foul on Isaiah Simmons during the drive. [Team fouls: 3] No free throws, side out. (Isaiah Simmons: 1 personal fouls)

[09:36] Team_066 possession (Score: 56-86)
Pascal Carter attempts a 3Pt. Contested by Isaiah Simmons (3.0 feet, ZONE). Pascal Carter misses. Rebound secured by Isaiah Simmons.

[09:20] Team_078 possession (Score: 56-86)
Ben Ginobili attempts a Layup. Wide open! Yao Brogdon is 7.3 feet away. [MAN] BEN GINOBILI MAKES IT!
Score: 56-88

[09:07] Team_066 possession (Score: 56-88)
Pau Curry drives and kicks out. Kyle Wagner attempts a 3Pt. Wide open! Isaiah Simmons is 6.4 feet away. [ZONE] Kyle Wagner misses. Rebound secured by Ben Ginobili.

[08:57] Team_078 possession (Score: 56-88)
Isaiah Simmons attempts a Layup. Contested by Kyle Wagner (4.9 feet, ZONE). ISAIAH SIMMONS MAKES IT! Assist: Ben Ginobili
Score: 56-90

[08:41] Team_066 possession (Score: 56-90)
Pascal Carter drives, Jabari Barrett stays with him. Pascal Carter attempts a Layup. Wide open! Jabari Barrett is 6.6 feet away. [ZONE] Pascal Carter misses. Rebound secured by Jabari Barrett.

[08:26] Team_078 possession (Score: 56-90)
Ben Ginobili attempts a Layup. Wide open! Yao Brogdon is 6.7 feet away. [MAN] BEN GINOBILI MAKES IT!
Score: 56-92

[08:10] Team_066 possession (Score: 56-92)
FOUL! Shooting foul on Magic Barrett. Pascal Carter to the line for 3 free throws. [Team fouls: 4] (Magic Barrett: 2 personal fouls)   FT 1/3: GOOD   FT 2/3: MISS   FT 3/3: GOOD Pascal Carter makes 2/3 from the line.
Score: 58-92

[07:54] Team_078 possession (Score: 58-92)
Isaiah Simmons attempts a Midrange. Wide open! Yao Brogdon is 6.8 feet away. [ZONE] ISAIAH SIMMONS MAKES IT! Assist: Jabari Barrett
Score: 58-94

[07:43] Team_066 possession (Score: 58-94)
Pau Curry attempts a Midrange. Wide open! Kyrie Carter is 8.5 feet away. [MAN] Pau Curry misses. Rebound secured by Isaiah Simmons.

[07:29] Team_078 possession (Score: 58-94)
Ben Ginobili attempts a Midrange. Contested by Pau Curry (4.2 feet, ZONE). Ben Ginobili misses. Rebound secured by Kyle Wagner.

[07:13] Team_066 possession (Score: 58-94)
Pascal Carter attempts a Layup. Wide open! Jabari Barrett is 9.4 feet away. [ZONE] Pascal Carter misses. Rebound secured by Isaiah Simmons.

[06:59] Team_078 possession (Score: 58-94)
Kyrie Carter attempts a 3Pt. Wide open! Pau Curry is 7.6 feet away. [ZONE] Kyrie Carter misses. Rebound secured by Brandon Reaves.

[06:43] Team_066 possession (Score: 58-94)
FOUL! Shooting foul on Magic Barrett. Pascal Carter to the line for 2 free throws. [BONUS: 5 team fouls] (Magic Barrett: 3 personal fouls)   FT 1/2: GOOD   FT 2/2: GOOD Pascal Carter makes 2/2 from the line.
Score: 60-94

[06:32] Team_078 possession (Score: 60-94)
FOUL! Holding foul on Yao Brogdon. [IN THE BONUS! 5 team fouls] Ben Ginobili to the line for 2 free throws. (Yao Brogdon: 1 personal fouls)   FT 1/2: GOOD   FT 2/2: MISS Ben Ginobili makes 1/2 from the line. Rebound secured by Kyle Wagner.
Score: 60-95

[06:21] Team_066 possession (Score: 60-95)
Kyle Wagner attempts a 3Pt. Heavily contested by Isaiah Simmons (1.0 feet, ZONE)! KYLE WAGNER MAKES IT! Assist: Pascal Carter
Score: 63-95

[06:04] Team_078 possession (Score: 63-95)
Ben Ginobili attempts a 3Pt. Wide open! Yao Brogdon is 8.0 feet away. [MAN] Ben Ginobili misses. Rebound secured by Yao Brogdon.

[05:46] Team_066 possession (Score: 63-95)
Yao Brogdon attempts a 3Pt. Wide open! Ben Ginobili is 7.9 feet away. [MAN] Yao Brogdon misses. Rebound secured by Isaiah Simmons.

[05:37] Team_078 possession (Score: 63-95)
Ben Ginobili drives and kicks out. Jabari Barrett attempts a Midrange. Wide open! Kyle Wagner is 6.8 feet away. [MAN] Jabari Barrett misses. Rebound secured by Kyle Wagner.

[05:27] Team_066 possession (Score: 63-95)
Pascal Carter attempts a 3Pt. Contested by Isaiah Simmons (4.5 feet, ZONE). Pascal Carter misses. Rebound secured by Ben Ginobili.

[05:09] Team_078 possession (Score: 63-95)
Kyrie Carter attempts a 3Pt. Wide open! Pau Curry is 7.3 feet away. [MAN] Kyrie Carter misses. Offensive rebound by Isaiah Simmons! Isaiah Simmons kicks it out.

[04:52] Team_078 possession (Score: 63-95)
Kyrie Carter loses the ball! Stripped by Pau Curry! TURNOVER! (live ball)

[04:40] Team_066 possession (Score: 63-95)
Yao Brogdon makes the Layup and draws the foul on Jabari Barrett! And-1! Yao Brogdon to the line for 1. [BONUS: 6 team fouls] (Jabari Barrett: 2 personal fouls)   FT 1/1: GOOD Yao Brogdon makes 1/1 from the line.
Score: 66-95

[04:25] Team_078 possession (Score: 66-95)
FOUL! Reach-in foul on Yao Brogdon during the drive. [IN THE BONUS! 6 team fouls] Ben Ginobili to the line for 2 free throws. (Yao Brogdon: 2 personal fouls)   FT 1/2: GOOD   FT 2/2: GOOD Ben Ginobili makes 2/2 from the line.
Score: 66-97

[04:09] Team_066 possession (Score: 66-97)
Kyle Wagner attempts a Midrange. Contested by Jabari Barrett (5.2 feet, ZONE). Kyle Wagner misses. Offensive rebound by Kyle Wagner! Kyle Wagner kicks it out.

[03:51] Team_066 possession (Score: 66-97)
Pascal Carter attempts a 3Pt. Contested by Magic Barrett (4.4 feet, MAN). PASCAL CARTER MAKES IT! Assist: Brandon Reaves
Score: 69-97

[03:40] Team_078 possession (Score: 69-97)
Isaiah Simmons attempts a Layup. Contested by Kyle Wagner (5.3 feet, ZONE). ISAIAH SIMMONS MAKES IT!
Score: 69-99

[03:25] Team_066 possession (Score: 69-99)
Yao Brogdon attempts a Midrange. Wide open! Ben Ginobili is 6.8 feet away. [MAN] Yao Brogdon misses. Rebound secured by Jabari Barrett.

[03:10] Team_078 possession (Score: 69-99)
Isaiah Simmons drives, Kyle Wagner stays with him. Isaiah Simmons attempts a Layup. Wide open! Kyle Wagner is 7.2 feet away. [ZONE] ISAIAH SIMMONS MAKES IT!
Score: 69-101

[02:57] Team_066 possession (Score: 69-101)
Pascal Carter drives and kicks out. Kyle Wagner attempts a 3Pt. Contested by Magic Barrett (5.9 feet, ZONE). Kyle Wagner misses. Rebound secured by Magic Barrett.

[02:42] Team_078 possession (Score: 69-101)
Magic Barrett attempts a 3Pt. Wide open! Pau Curry is 7.2 feet away. [ZONE] MAGIC BARRETT MAKES IT!
Score: 69-104

[02:26] Team_066 possession (Score: 69-104)
Pascal Carter attempts a Layup. Wide open! Jabari Barrett is 6.4 feet away. [ZONE] Pascal Carter misses. Offensive rebound by Kyle Wagner! Kyle Wagner kicks it out.

[02:17] Team_066 possession (Score: 69-104)
Brandon Reaves attempts a Midrange. Wide open! Ben Ginobili is 8.5 feet away. [ZONE] BRANDON REAVES MAKES IT!
Score: 71-104

[02:03] Team_078 possession (Score: 71-104)
Ben Ginobili drives, picks up Yao Brogdon. Help arrives from Pascal Carter! Ben Ginobili attempts a Layup. Wide open! Pascal Carter is 8.2 feet away. [MAN] BEN GINOBILI MAKES IT!
Score: 71-106

[01:46] Team_066 possession (Score: 71-106)
Pau Curry attempts a 3Pt. Contested by Magic Barrett (3.4 feet, ZONE). Pau Curry misses. Rebound secured by Magic Barrett.

[01:28] Team_078 possession (Score: 71-106)
Kyrie Carter drives, picks up Pau Curry. Help arrives from Pascal Carter! Kyrie Carter attempts a Layup. Wide open! Pascal Carter is 6.8 feet away. [MAN] KYRIE CARTER MAKES IT! Assist: Magic Barrett
Score: 71-108

[01:14] Team_066 possession (Score: 71-108)
Pascal Carter attempts a 3Pt. Wide open! Magic Barrett is 6.1 feet away. [MAN] PASCAL CARTER MAKES IT! Assist: Pau Curry
Score: 74-108

[00:57] Team_078 possession (Score: 74-108)
Ben Ginobili drives, Yao Brogdon stays with him. Ben Ginobili attempts a Layup. Wide open! Yao Brogdon is 6.3 feet away. [MAN] Ben Ginobili misses. Rebound secured by Yao Brogdon.

[00:39] Team_066 possession (Score: 74-108)
Brandon Reaves attempts a Layup. Wide open! Isaiah Simmons is 7.8 feet away. [MAN] BRANDON REAVES MAKES IT!
Score: 76-108

[00:24] Team_078 possession (Score: 76-108)
Magic Barrett drives and kicks out. Isaiah Simmons attempts a 3Pt. Contested by Brandon Reaves (5.4 feet, ZONE). Isaiah Simmons misses. Rebound secured by Yao Brogdon.

[00:07] Team_066 possession (Score: 76-108)
Pau Curry attempts a 3Pt. Wide open! Kyrie Carter is 7.5 feet away. [MAN] Pau Curry misses. Rebound secured by Magic Barrett.

================================================================================
                              4TH QUARTER COMPLETE                              
================================================================================

4TH QUARTER SCORE: Team_066 22, Team_078 27

BOX SCORE:
================================================================================

Team_066
--------------------------------------------------------------------------------
Player                MIN  PTS  REB  AST  TO      FG   FG%      3P   3P%
--------------------------------------------------------------------------------
Pascal Carter          18   10    0    1   0   4/9    44.4     0/0   0.0
Brandon Reaves         43    6    2    1   0   3/3   100.0     0/0   0.0
Kyle Wagner            43    3    5    0   0   1/1   100.0     0/0   0.0
Yao Brogdon            43    3    3    0   0   1/3    33.3     0/0   0.0
Pau Curry              43    0    0    1   0   0/4     0.0     0/0   0.0

TEAM: FG: 9/20 (45.0%), 3PT: 4/9 (44.4%), REB: 10 (2 off, 8 def), AST: 3, TO: 1
TEAM FOULS: 6 [Team_078 in BONUS]


Team_078
--------------------------------------------------------------------------------
Player                MIN  PTS  REB  AST  TO      FG   FG%      3P   3P%
--------------------------------------------------------------------------------
Ben Ginobili           43   10    2    1   0   5/9    55.6     0/0   0.0
Isaiah Simmons         43    8    6    0   0   4/4   100.0     0/0   0.0
Magic Barrett          18    3    3    1   0   1/2    50.0     0/0   0.0
Kyrie Carter           43    2    0    0   0   1/3    33.3     0/0   0.0
Jabari Barrett         43    0    2    2   0   0/0     0.0     0/0   0.0

TEAM: FG: 11/19 (57.9%), 3PT: 1/3 (33.3%), REB: 13 (2 off, 11 def), AST: 4, TO: 1
TEAM FOULS: 6 [Team_066 in BONUS]

================================================================================

================================================================================
                               FULL GAME COMPLETE                               
================================================================================

FINAL SCORE: Team_066 76, Team_078 108

SCORING BY QUARTER:
--------------------------------------------------------------------------------
Team                     Q1     Q2     Q3     Q4    FINAL
--------------------------------------------------------------------------------
Team_066                 24     18     12     22       76
Team_078                 31     23     27     27      108
--------------------------------------------------------------------------------

FULL GAME BOX SCORE:
================================================================================

Team_066
--------------------------------------------------------------------------------
Player                MIN  PTS  REB  AST  TO      FG   FG%      3P   3P%      FT STL BLK
--------------------------------------------------------------------------------
Pau Curry              43   13    0    1   2   5/14   35.7   1/6    16.7   0/0     1   0
Brandon Reaves         43   11    9    4   2   5/11   45.5   0/4     0.0   3/4     0   0
Yao Brogdon            43   18   15    3   2   6/11   54.5   2/5    40.0   3/3     0   0
Kyle Wagner            43   13   18    2   1   6/9    66.7   1/3    33.3   5/6     1   0
Jimmy Davis            31    6    0    1   2   5/12   41.7   0/4     0.0   4/4     1   0
Pascal Carter          18   12    0    1   0   5/11   45.5   3/6    50.0   4/5     0   0
Lauri LaVine            6    1    0    0   0   1/1   100.0   0/0     0.0   1/2     0   0
Brandon Middleton       6    0    1    0   0   0/2     0.0   0/1     0.0   0/0     0   0
Cole Morant             6    0    0    1   0   0/0     0.0   0/0     0.0   0/0     1   0
Donovan Simmons         6    0    1    0   2   0/2     0.0   0/0     0.0   0/0     0   0

TEAM: FG: 33/73 (45.2%), 3PT: 7/29 (24.1%), REB: 44 (13 off, 31 def), AST: 13, TO: 11


Team_078
--------------------------------------------------------------------------------
Player                MIN  PTS  REB  AST  TO      FG   FG%      3P   3P%      FT STL BLK
--------------------------------------------------------------------------------
Kyrie Carter           43   19    0    2   2   9/11   81.8   4/5    80.0   0/0     1   0
Isaiah Simmons         43   24   15    5   0  10/18   55.6   1/3    33.3   3/5     1   0
Ben Ginobili           43   20    9    6   0   9/21   42.9   2/6    33.3   3/4     2   0
Jabari Barrett         43    4   15    5   1   2/5    40.0   0/0     0.0   0/0     0   0
Jabari Barnes          31   17    0    2   2   7/10   70.0   2/2   100.0   1/1     1   0
Magic Barrett          18    6    3    2   0   2/4    50.0   2/3    66.7   0/0     0   0
Damian Allen            6    5    0    0   1   2/2   100.0   1/1   100.0   1/2     0   0
Malcolm Randle          6    2    2    0   1   1/1   100.0   0/0     0.0   0/0     0   1
Paul Ming               6    2    2    0   2   1/1   100.0   0/0     0.0   0/0     1   0
Draymond Irving         6    0    3    1   0   0/0     0.0   0/0     0.0   0/1     1   0

TEAM: FG: 43/74 (58.1%), 3PT: 12/20 (60.0%), REB: 49 (9 off, 40 def), AST: 23, TO: 9

================================================================================
