================================================================================
                        FULL GAME - Team_029 vs Team_002                        
================================================================================

================================================================================
                       1ST QUARTER - Team_029 vs Team_002                       
================================================================================

[12:00] Team_029 possession (Score: 0-0)
Paul Iverson attempts a Midrange. Heavily contested by Carmelo Lowry (0.8 feet, ZONE)! Paul Iverson misses. Rebound secured by Tyler Porzingis.

[11:45] Team_002 possession (Score: 0-0)
Carmelo Lowry attempts a Layup. BLOCKED BY SCOTTIE BIRD! Ball is loose! Rebound secured by Giannis Banchero.

[11:31] Team_029 possession (Score: 0-0)
Paul Iverson attempts a 3Pt. Contested by CJ Barrett (3.4 feet, ZONE). Paul Iverson misses. Offensive rebound by Devin Butler! Devin Butler kicks it out.

[11:13] Team_029 possession (Score: 0-0)
Scottie Bird attempts a Midrange. Contested by CJ Barrett (2.7 feet, MAN). SCOTTIE BIRD MAKES IT!
Score: 2-0

[11:00] Team_002 possession (Score: 2-0)
Carmelo Lowry attempts a 3Pt. Contested by Giannis Banchero (4.3 feet, ZONE). Carmelo Lowry misses. Rebound secured by James Wall.

[10:43] Team_029 possession (Score: 2-0)
Paul Iverson drives and kicks out. Devin Butler attempts a 3Pt. Contested by Tyler Porzingis (2.6 feet, MAN). Devin Butler misses. Rebound secured by Carmelo Lowry.

[10:27] Team_002 possession (Score: 2-0)
CJ Barrett attempts a 3Pt. Contested by Giannis Banchero (4.9 feet, ZONE). CJ Barrett misses. Rebound secured by Devin Butler.

[10:09] Team_029 possession (Score: 2-0)
Scottie Bird drives and kicks out. Scottie Bird attempts a 3Pt. Contested by CJ Barrett (2.2 feet, ZONE). SCOTTIE BIRD MAKES IT! Assist: James Wall
Score: 5-0

[09:55] Team_002 possession (Score: 5-0)
Jordan Green drives, James Wall stays with him. Jordan Green attempts a Layup. Contested by James Wall (5.8 feet, ZONE). Jordan Green misses. Rebound secured by Giannis Banchero.

[09:37] Team_029 possession (Score: 5-0)
Paul Iverson attempts a Midrange. Contested by Jordan Green (5.4 feet, ZONE). PAUL IVERSON MAKES IT!
Score: 7-0

[09:21] Team_002 possession (Score: 7-0)
FOUL! Offensive foul on Carmelo Lowry! James Wall drew the charge! [Team fouls: 1] (Carmelo Lowry: 1 personal fouls) TURNOVER! (dead ball)

[09:06] Team_029 possession (Score: 7-0)
Scottie Bird attempts a Midrange. Heavily contested by CJ Barrett (1.7 feet, MAN)! Scottie Bird misses. Rebound secured by Miles Bane.

[08:52] Team_002 possession (Score: 7-0)
Tyler Porzingis drives, picks up Devin Butler. Help arrives from Scottie Bird! Tyler Porzingis attempts a Layup. Contested by Scottie Bird (5.7 feet, ZONE). TYLER PORZINGIS MAKES IT! Assist: Miles Bane
Score: 7-2

[08:38] Team_029 possession (Score: 7-2)
Giannis Banchero attempts a Midrange. Wide open! Jordan Green is 6.2 feet away. [ZONE] GIANNIS BANCHERO MAKES IT!
Score: 9-2

[08:22] Team_002 possession (Score: 9-2)
Tyler Porzingis drives and kicks out. CJ Barrett attempts a Midrange. Heavily contested by Scottie Bird (1.2 feet, MAN)! CJ Barrett misses. Rebound secured by James Wall.

[08:10] Team_029 possession (Score: 9-2)
James Wall drives, picks up Tyler Porzingis. Help arrives from CJ Barrett! James Wall attempts a Dunk. Contested by CJ Barrett (4.7 feet, ZONE). JAMES WALL MAKES IT! Assist: Scottie Bird
Score: 11-2

[07:57] Team_002 possession (Score: 11-2)
Tyler Porzingis drives to the basket... Tyler Porzingis throws a bad pass! Stolen by Devin Butler! TURNOVER! (live ball)

[07:40] Team_029 possession (Score: 11-2)
Scottie Bird attempts a 3Pt. Contested by CJ Barrett (4.2 feet, ZONE). Scottie Bird misses. Rebound secured by Miles Bane.

[07:30] Team_002 possession (Score: 11-2)
Tyler Porzingis attempts a Layup. Wide open! Devin Butler is 7.6 feet away. [MAN] TYLER PORZINGIS MAKES IT! Assist: Miles Bane
Score: 11-4

[07:16] Team_029 possession (Score: 11-4)
Scottie Bird attempts a Layup. Contested by Tyler Porzingis (5.3 feet, ZONE). SCOTTIE BIRD MAKES IT!
Score: 13-4

[07:01] Team_002 possession (Score: 13-4)
Miles Bane attempts a Midrange. Wide open! Paul Iverson is 6.1 feet away. [MAN] Miles Bane misses. Rebound secured by James Wall.

[06:48] Team_029 possession (Score: 13-4)
Devin Butler attempts a 3Pt. Heavily contested by CJ Barrett (0.5 feet, ZONE)! DEVIN BUTLER MAKES IT! Assist: Paul Iverson
Score: 16-4

[06:34] Team_002 possession (Score: 16-4)
Jordan Green attempts a Layup. Contested by Giannis Banchero (4.2 feet, MAN). Jordan Green misses. Rebound secured by Devin Butler.

[06:20] Team_029 possession (Score: 16-4)
Paul Iverson attempts a 3Pt. Contested by Miles Bane (2.4 feet, MAN). PAUL IVERSON MAKES IT! Assist: James Wall
Score: 19-4

[06:05] Team_002 possession (Score: 19-4)
Tyler Porzingis attempts a Midrange. Contested by Giannis Banchero (4.5 feet, ZONE). TYLER PORZINGIS MAKES IT!
Score: 19-6

[05:51] Team_029 possession (Score: 19-6)
Paul Iverson attempts a Midrange. Contested by Jordan Green (4.6 feet, ZONE). Paul Iverson misses. Offensive rebound by Devin Butler! Devin Butler kicks it out.

[05:37] Team_029 possession (Score: 19-6)
Paul Iverson attempts a Midrange. Contested by Miles Bane (4.8 feet, MAN). Paul Iverson misses. Rebound secured by Tyler Porzingis.

[05:24] Team_002 possession (Score: 19-6)
CJ Barrett attempts a 3Pt. Contested by Giannis Banchero (4.3 feet, ZONE). CJ Barrett misses. FOUL! Loose ball foul on James Wall during the rebound battle. [Team fouls: 1] No free throws, side out. (James Wall: 1 personal fouls)

[05:10] Team_002 possession (Score: 19-6)
Tyler Porzingis attempts a Midrange. Contested by Devin Butler (4.3 feet, MAN). Tyler Porzingis misses. Offensive rebound by Tyler Porzingis! Tyler Porzingis's putback is no good. Rebound secured by James Wall.

[04:58] Team_029 possession (Score: 19-6)
Paul Iverson drives and kicks out. Giannis Banchero attempts a Midrange. Wide open! Jordan Green is 7.6 feet away. [ZONE] GIANNIS BANCHERO MAKES IT! Assist: Scottie Bird
Score: 21-6

[04:47] Team_002 possession (Score: 21-6)
CJ Barrett attempts a Layup. Heavily contested by James Wall (1.6 feet, ZONE)! CJ Barrett misses. Rebound secured by James Wall.

[04:30] Team_029 possession (Score: 21-6)
Giannis Banchero makes the Midrange and draws the foul on CJ Barrett! And-1! Giannis Banchero to the line for 1. [Team fouls: 2] (CJ Barrett: 1 personal fouls)   FT 1/1: MISS Giannis Banchero makes 0/1 from the line. Rebound secured by Tyler Porzingis.
Score: 23-6

[04:15] Team_002 possession (Score: 23-6)
CJ Barrett attempts a Midrange. Contested by Scottie Bird (3.3 feet, ZONE). CJ Barrett misses. Rebound secured by Devin Butler.

[03:58] Team_029 possession (Score: 23-6)
James Wall attempts a Layup. BLOCKED BY CJ BARRETT! Ball deflects out of bounds off James Wall.

[03:44] Team_002 possession (Score: 23-6)
Jordan Green drives, James Wall stays with him. Jordan Green attempts a Dunk. Contested by James Wall (4.9 feet, ZONE). JORDAN GREEN MAKES IT! Assist: Carmelo Lowry
Score: 23-8

[03:29] Team_029 possession (Score: 23-8)
Giannis Banchero attempts a 3Pt. Contested by Jordan Green (4.8 feet, MAN). Giannis Banchero misses. Rebound secured by Miles Bane.

[03:20] Team_002 possession (Score: 23-8)
Carmelo Lowry attempts a 3Pt. Wide open! Giannis Banchero is 6.5 feet away. [ZONE] CARMELO LOWRY MAKES IT! Assist: Tyler Porzingis
Score: 23-11

[03:05] Team_029 possession (Score: 23-11)
FOUL! Shooting foul on Tyler Porzingis. Devin Butler to the line for 2 free throws. [Team fouls: 3] (Tyler Porzingis: 1 personal fouls)   FT 1/2: GOOD   FT 2/2: GOOD Devin Butler makes 2/2 from the line.
Score: 25-11

[02:48] Team_002 possession (Score: 25-11)
Miles Bane attempts a 3Pt. Contested by Giannis Banchero (5.0 feet, ZONE). Miles Bane misses. Rebound secured by James Wall.

[02:33] Team_029 possession (Score: 25-11)
Scottie Bird drives and kicks out. James Wall attempts a Midrange. Contested by Jordan Green (4.3 feet, ZONE). James Wall misses. Rebound secured by Carmelo Lowry.

[02:21] Team_002 possession (Score: 25-11)
Carmelo Lowry loses the ball! Stripped by James Wall! TURNOVER! (live ball)

[02:09] Team_029 possession (Score: 25-11)
Devin Butler attempts a Layup. Heavily contested by Tyler Porzingis (2.0 feet, MAN)! DEVIN BUTLER MAKES IT! Assist: James Wall
Score: 27-11

[01:56] Team_002 possession (Score: 27-11)
Carmelo Lowry loses the ball! Stripped by James Wall! TURNOVER! (live ball)

[01:39] Team_029 possession (Score: 27-11)
Giannis Banchero attempts a Midrange. Contested by Jordan Green (3.4 feet, ZONE). GIANNIS BANCHERO MAKES IT! Assist: Devin Butler
Score: 29-11

[01:22] Team_002 possession (Score: 29-11)
FOUL! Holding foul on Scottie Bird. [Team fouls: 2] No free throws, side out. (Scottie Bird: 1 personal fouls)

[01:08] Team_002 possession (Score: 29-11)
Miles Bane attempts a 3Pt. Contested by Giannis Banchero (4.6 feet, ZONE). Miles Bane misses. Rebound secured by Devin Butler.

[00:55] Team_029 possession (Score: 29-11)
Paul Iverson attempts a Midrange. Contested by Miles Bane (3.1 feet, MAN). PAUL IVERSON MAKES IT! Assist: Devin Butler
Score: 31-11

[00:43] Team_002 possession (Score: 31-11)
CJ Barrett attempts a Layup. Contested by Scottie Bird (4.0 feet, MAN). CJ BARRETT MAKES IT! Assist: Jordan Green
Score: 31-13

[00:28] Team_029 possession (Score: 31-13)
Scottie Bird attempts a Midrange. Wide open! Jordan Green is 9.8 feet away. [ZONE] SCOTTIE BIRD MAKES IT!
Score: 33-13

[00:13] Team_002 possession (Score: 33-13)
Tyler Porzingis attempts a Layup. Heavily contested by James Wall (0.5 feet, ZONE)! Tyler Porzingis misses. Rebound secured by James Wall.

================================================================================
                              1ST QUARTER COMPLETE                              
================================================================================

1ST QUARTER SCORE: Team_029 33, Team_002 13

BOX SCORE:
================================================================================

Team_029
--------------------------------------------------------------------------------
Player                MIN  PTS  REB  AST  TO      FG   FG%      3P   3P%
--------------------------------------------------------------------------------
Scottie Bird           12    9    0    2   0   4/7    57.1     0/0   0.0
Paul Iverson           12    7    0    1   0   3/6    50.0     0/0   0.0
Devin Butler           12    7    6    2   0   3/3   100.0     0/0   0.0
Giannis Banchero       12    6    2    0   0   3/5    60.0     0/0   0.0
James Wall             12    2    7    3   0   1/2    50.0     0/0   0.0

TEAM: FG: 14/23 (60.9%), 3PT: 2/4 (50.0%), REB: 14 (2 off, 12 def), AST: 8, TO: 0
TEAM FOULS: 2


Team_002
--------------------------------------------------------------------------------
Player                MIN  PTS  REB  AST  TO      FG   FG%      3P   3P%
--------------------------------------------------------------------------------
Tyler Porzingis        12    6    4    1   0   3/6    50.0     0/0   0.0
Carmelo Lowry          12    3    2    1   0   1/3    33.3     0/0   0.0
CJ Barrett             12    2    0    0   0   1/4    25.0     0/0   0.0
Jordan Green           12    2    0    1   0   1/3    33.3     0/0   0.0
Miles Bane             12    0    3    2   0   0/3     0.0     0/0   0.0

TEAM: FG: 6/19 (31.6%), 3PT: 1/5 (20.0%), REB: 10 (2 off, 8 def), AST: 5, TO: 4
TEAM FOULS: 3

================================================================================

================================================================================
                       2ND QUARTER - Team_029 vs Team_002                       
================================================================================

[12:00] Team_029 possession (Score: 33-13)
Scottie Bird attempts a 3Pt. Contested by CJ Barrett (2.8 feet, MAN). Scottie Bird misses. Rebound secured by Miles Bane.

[11:42] Team_002 possession (Score: 33-13)
Tyler Porzingis attempts a Layup. Heavily contested by James Wall (1.7 feet, ZONE)! Tyler Porzingis misses. Rebound secured by Giannis Banchero.

[11:25] Team_029 possession (Score: 33-13)
Paul Iverson throws a bad pass out of bounds! TURNOVER! (dead ball)

[11:25] Substitution (Team_029): Paul Iverson OUT → Immanuel Irving IN (stamina_rule2)

[11:25] Substitution (Team_029): Scottie Bird OUT → Bones Carter IN (stamina_rule2)

[11:25] Substitution (Team_029): Giannis Banchero OUT → Pau Anthony IN (stamina_rule2)

[11:25] Substitution (Team_029): James Wall OUT → Derrick Rozier IN (stamina_rule2)

[11:25] Substitution (Team_029): Devin Butler OUT → Shai Ball IN (stamina_rule2)

[11:25] Substitution (Team_002): Miles Bane OUT → John Duncan IN (stamina_rule2)

[11:25] Substitution (Team_002): CJ Barrett OUT → Dirk Middleton IN (stamina_rule2)

[11:25] Substitution (Team_002): Jordan Green OUT → Anfernee Sexton IN (stamina_rule2)

[11:25] Substitution (Team_002): Carmelo Lowry OUT → Julius Curry IN (stamina_rule2)

[11:25] Substitution (Team_002): Tyler Porzingis OUT → Lamelo O'Neal IN (stamina_rule2)

[11:13] Team_002 possession (Score: 33-13)
John Duncan attempts a 3Pt. Contested by Pau Anthony (3.6 feet, ZONE). JOHN DUNCAN MAKES IT!
Score: 33-16

[11:02] Team_029 possession (Score: 33-16)
Immanuel Irving makes the Dunk and draws the foul on Lamelo O'Neal! And-1! Immanuel Irving to the line for 1. [Team fouls: 1] (Lamelo O'Neal: 1 personal fouls)   FT 1/1: GOOD Immanuel Irving makes 1/1 from the line.
Score: 36-16

[10:53] Team_002 possession (Score: 36-16)
John Duncan attempts a 3Pt. Heavily contested by Pau Anthony (1.1 feet, ZONE)! John Duncan misses. Rebound secured by Derrick Rozier.

[10:38] Team_029 possession (Score: 36-16)
Shai Ball drives to the basket... Shai Ball loses control! Ball rolls out of bounds! TURNOVER! (dead ball)

[10:19] Team_002 possession (Score: 36-16)
Anfernee Sexton commits a violation (traveling/carry)! TURNOVER! (dead ball)

[10:03] Team_029 possession (Score: 36-16)
Derrick Rozier attempts a 3Pt. Contested by Julius Curry (5.0 feet, ZONE). Derrick Rozier misses. Rebound secured by Anfernee Sexton.

[09:44] Team_002 possession (Score: 36-16)
John Duncan drives, Derrick Rozier stays with him. John Duncan attempts a Layup. Contested by Derrick Rozier (4.8 feet, ZONE). John Duncan misses. Rebound secured by Derrick Rozier.

[09:31] Team_029 possession (Score: 36-16)
Bones Carter attempts a 3Pt. Wide open! Julius Curry is 7.9 feet away. [ZONE] Bones Carter misses. Offensive rebound by Pau Anthony! Pau Anthony kicks it out.

[09:18] Team_029 possession (Score: 36-16)
Bones Carter attempts a Layup. Contested by Dirk Middleton (4.0 feet, MAN). BONES CARTER MAKES IT! Assist: Shai Ball
Score: 38-16

[09:02] Team_002 possession (Score: 38-16)
John Duncan drives, Immanuel Irving stays with him. John Duncan attempts a Dunk. Contested by Immanuel Irving (3.7 feet, MAN). JOHN DUNCAN MAKES IT!
Score: 38-18

[08:51] Team_029 possession (Score: 38-18)
Shai Ball attempts a Midrange. Contested by Julius Curry (4.5 feet, ZONE). Shai Ball misses. Rebound secured by Lamelo O'Neal.

[08:32] Team_002 possession (Score: 38-18)
Lamelo O'Neal drives to the basket... Lamelo O'Neal throws a bad pass! Stolen by Shai Ball! TURNOVER! (live ball)

[08:15] Team_029 possession (Score: 38-18)
Derrick Rozier drives to the basket... FOUL! Offensive foul on Derrick Rozier! Lamelo O'Neal drew the charge! [Team fouls: 1] (Derrick Rozier: 1 personal fouls) TURNOVER! (dead ball)

[07:57] Team_002 possession (Score: 38-18)
Lamelo O'Neal attempts a Layup. Contested by Derrick Rozier (3.0 feet, ZONE). LAMELO O'NEAL MAKES IT! Assist: Dirk Middleton
Score: 38-20

[07:40] Team_029 possession (Score: 38-20)
Shai Ball drives and kicks out. Pau Anthony attempts a 3Pt. Wide open! Anfernee Sexton is 7.4 feet away. [MAN] PAU ANTHONY MAKES IT! Assist: Immanuel Irving
Score: 41-20

[07:29] Team_002 possession (Score: 41-20)
Anfernee Sexton attempts a 3Pt. Contested by Pau Anthony (4.7 feet, ZONE). Anfernee Sexton misses. Offensive rebound by Lamelo O'Neal! Lamelo O'Neal puts it back in!
Score: 41-22

[07:16] Team_029 possession (Score: 41-22)
Shai Ball loses the ball! Stripped by Lamelo O'Neal! TURNOVER! (live ball)

[07:06] Team_002 possession (Score: 41-22)
Anfernee Sexton attempts a 3Pt. Wide open! Pau Anthony is 8.5 feet away. [MAN] Anfernee Sexton misses. Rebound secured by Pau Anthony.

[06:48] Team_029 possession (Score: 41-22)
FOUL! Shooting foul on John Duncan. Immanuel Irving to the line for 2 free throws. [Team fouls: 2] (John Duncan: 1 personal fouls)   FT 1/2: GOOD   FT 2/2: GOOD Immanuel Irving makes 2/2 from the line.
Score: 43-22

[06:36] Team_002 possession (Score: 43-22)
Anfernee Sexton attempts a 3Pt. Wide open! Pau Anthony is 6.2 feet away. [MAN] Anfernee Sexton misses. Rebound secured by Shai Ball.

[06:23] Team_029 possession (Score: 43-22)
Bones Carter drives and kicks out. Derrick Rozier attempts a 3Pt. Contested by Lamelo O'Neal (4.3 feet, MAN). Derrick Rozier misses. Rebound secured by Julius Curry.

[06:07] Team_002 possession (Score: 43-22)
Dirk Middleton attempts a 3Pt. Contested by Pau Anthony (5.5 feet, ZONE). Dirk Middleton misses. Rebound secured by Shai Ball.

[05:55] Team_029 possession (Score: 43-22)
FOUL! Shooting foul on John Duncan. Derrick Rozier to the line for 2 free throws. [Team fouls: 3] (John Duncan: 2 personal fouls)   FT 1/2: GOOD   FT 2/2: GOOD Derrick Rozier makes 2/2 from the line.
Score: 45-22

[05:41] Team_002 possession (Score: 45-22)
John Duncan attempts a Midrange. Wide open! Immanuel Irving is 7.6 feet away. [MAN] JOHN DUNCAN MAKES IT!
Score: 45-24

[05:24] Team_029 possession (Score: 45-24)
Immanuel Irving attempts a 3Pt. Wide open! Julius Curry is 8.0 feet away. [ZONE] IMMANUEL IRVING MAKES IT! Assist: Pau Anthony
Score: 48-24

[05:10] Team_002 possession (Score: 48-24)
Julius Curry attempts a Layup. Contested by Derrick Rozier (5.4 feet, MAN). Julius Curry misses. Rebound secured by Derrick Rozier.

[04:56] Team_029 possession (Score: 48-24)
FOUL! Offensive foul on Immanuel Irving! John Duncan drew the charge! [Team fouls: 2] (Immanuel Irving: 1 personal fouls) TURNOVER! (dead ball)

[04:43] Team_002 possession (Score: 48-24)
FOUL! Holding foul on Pau Anthony. [Team fouls: 3] No free throws, side out. (Pau Anthony: 1 personal fouls)

[04:30] Team_002 possession (Score: 48-24)
FOUL! Offensive foul on Anfernee Sexton! Pau Anthony drew the charge! [Team fouls: 4] (Anfernee Sexton: 1 personal fouls) TURNOVER! (dead ball)

[04:15] Team_029 possession (Score: 48-24)
Pau Anthony drives, picks up Anfernee Sexton. Help arrives from John Duncan! Pau Anthony attempts a Dunk. Contested by John Duncan (4.2 feet, MAN). PAU ANTHONY MAKES IT!
Score: 50-24

[04:02] Team_002 possession (Score: 50-24)
Anfernee Sexton drives and kicks out. John Duncan attempts a 3Pt. Contested by Immanuel Irving (4.3 feet, MAN). JOHN DUNCAN MAKES IT! Assist: Julius Curry
Score: 50-27

[03:49] Team_029 possession (Score: 50-27)
FOUL! Holding foul on Lamelo O'Neal. [IN THE BONUS! 5 team fouls] Shai Ball to the line for 2 free throws. (Lamelo O'Neal: 2 personal fouls)   FT 1/2: GOOD   FT 2/2: MISS Shai Ball makes 1/2 from the line. Offensive rebound by Derrick Rozier! Derrick Rozier kicks it out.
Score: 51-27

[03:38] Team_029 possession (Score: 51-27)
FOUL! Holding foul on Dirk Middleton. [IN THE BONUS! 6 team fouls] Bones Carter to the line for 2 free throws. (Dirk Middleton: 1 personal fouls)   FT 1/2: MISS   FT 2/2: GOOD Bones Carter makes 1/2 from the line.
Score: 52-27

[03:24] Team_002 possession (Score: 52-27)
John Duncan attempts a 3Pt. Contested by Pau Anthony (3.3 feet, ZONE). John Duncan misses. Offensive rebound by Anfernee Sexton! Anfernee Sexton kicks it out.

[03:05] Team_002 possession (Score: 52-27)
Dirk Middleton makes the Layup and draws the foul on Bones Carter! And-1! Dirk Middleton to the line for 1. [Team fouls: 4] (Bones Carter: 1 personal fouls)   FT 1/1: MISS Dirk Middleton makes 0/1 from the line. Rebound secured by Pau Anthony.
Score: 52-29

[02:49] Team_029 possession (Score: 52-29)
Shai Ball attempts a Layup. Wide open! Lamelo O'Neal is 6.2 feet away. [MAN] Shai Ball misses. Rebound secured by Julius Curry.

[02:36] Team_002 possession (Score: 52-29)
Dirk Middleton drives, picks up Derrick Rozier. Help arrives from Bones Carter! Dirk Middleton attempts a Layup. Heavily contested by Bones Carter (0.5 feet, ZONE)! Dirk Middleton misses. Offensive rebound by Anfernee Sexton! Anfernee Sexton kicks it out.

[02:22] Team_002 possession (Score: 52-29)
FOUL! Reach-in foul on Derrick Rozier during the drive. [IN THE BONUS! 5 team fouls] John Duncan to the line for 2 free throws. (Derrick Rozier: 2 personal fouls)   FT 1/2: MISS   FT 2/2: GOOD John Duncan makes 1/2 from the line.
Score: 52-30

[02:08] Team_029 possession (Score: 52-30)
Pau Anthony attempts a 3Pt. Contested by Julius Curry (5.8 feet, ZONE). Pau Anthony misses. Rebound secured by Anfernee Sexton.

[01:54] Team_002 possession (Score: 52-30)
FOUL! Shooting foul on Derrick Rozier. Lamelo O'Neal to the line for 2 free throws. [BONUS: 6 team fouls] (Derrick Rozier: 3 personal fouls)   FT 1/2: MISS   FT 2/2: GOOD Lamelo O'Neal makes 1/2 from the line.
Score: 52-31

[01:37] Team_029 possession (Score: 52-31)
Immanuel Irving makes the Layup and draws the foul on Lamelo O'Neal! And-1! Immanuel Irving to the line for 1. [BONUS: 7 team fouls] (Lamelo O'Neal: 3 personal fouls)   FT 1/1: GOOD Immanuel Irving makes 1/1 from the line.
Score: 55-31

[01:20] Team_002 possession (Score: 55-31)
Lamelo O'Neal loses the ball! Stripped by Shai Ball! TURNOVER! (live ball)

[01:09] Team_029 possession (Score: 55-31)
FOUL! Shooting foul on Lamelo O'Neal. Shai Ball to the line for 2 free throws. [BONUS: 8 team fouls] (Lamelo O'Neal: 4 personal fouls)   FT 1/2: MISS   FT 2/2: GOOD Shai Ball makes 1/2 from the line.
Score: 56-31

[00:57] Team_002 possession (Score: 56-31)
Lamelo O'Neal attempts a Midrange. Contested by Shai Ball (5.7 feet, MAN). Lamelo O'Neal misses. Rebound secured by Derrick Rozier.

[00:41] Team_029 possession (Score: 56-31)
Immanuel Irving attempts a 3Pt. Contested by John Duncan (5.3 feet, MAN). Immanuel Irving misses. Rebound secured by Anfernee Sexton.

[00:25] Team_002 possession (Score: 56-31)
Julius Curry drives, Derrick Rozier stays with him. Julius Curry attempts a Layup. Wide open! Derrick Rozier is 6.4 feet away. [ZONE] JULIUS CURRY MAKES IT! Assist: Lamelo O'Neal
Score: 56-33

[00:14] Team_029 possession (Score: 56-33)
Pau Anthony attempts a Midrange. Contested by Anfernee Sexton (4.8 feet, ZONE). Pau Anthony misses. Rebound secured by Julius Curry.

[00:04] Team_002 possession (Score: 56-33)
John Duncan attempts a Midrange. Contested by Pau Anthony (5.6 feet, ZONE). John Duncan misses. Rebound secured by Derrick Rozier.

================================================================================
                              2ND QUARTER COMPLETE                              
================================================================================

2ND QUARTER SCORE: Team_029 23, Team_002 20

BOX SCORE:
================================================================================

Team_029
--------------------------------------------------------------------------------
Player                MIN  PTS  REB  AST  TO      FG   FG%      3P   3P%
--------------------------------------------------------------------------------
Immanuel Irving        11   11    0    1   0   4/5    80.0     0/0   0.0
Pau Anthony            11    5    3    1   0   2/4    50.0     0/0   0.0
Bones Carter           11    3    0    0   0   2/3    66.7     0/0   0.0
Derrick Rozier         11    2    6    0   0   1/2    50.0     0/0   0.0
Shai Ball              11    1    2    1   0   1/3    33.3     0/0   0.0
Scottie Bird           13    0    0    0   0   0/1     0.0     0/0   0.0
Giannis Banchero       13    0    1    0   0   0/0     0.0     0/0   0.0

TEAM: FG: 10/18 (55.6%), 3PT: 1/5 (20.0%), REB: 12 (2 off, 10 def), AST: 3, TO: 5
TEAM FOULS: 6 [Team_002 in BONUS]


Team_002
--------------------------------------------------------------------------------
Player                MIN  PTS  REB  AST  TO      FG   FG%      3P   3P%
--------------------------------------------------------------------------------
John Duncan            11   11    0    0   0   5/8    62.5     0/0   0.0
Lamelo O'Neal          11    5    2    1   0   3/4    75.0     0/0   0.0
Julius Curry           11    2    3    1   0   1/2    50.0     0/0   0.0
Miles Bane             13    0    1    0   0   0/0     0.0     0/0   0.0
Tyler Porzingis        13    0    0    0   0   0/1     0.0     0/0   0.0
Anfernee Sexton        11    0    5    0   0   0/2     0.0     0/0   0.0
Dirk Middleton         11    0    0    1   0   0/2     0.0     0/0   0.0

TEAM: FG: 9/19 (47.4%), 3PT: 2/6 (33.3%), REB: 11 (3 off, 8 def), AST: 3, TO: 4
TEAM FOULS: 8 [Team_029 in BONUS]

================================================================================

================================================================================
                       3RD QUARTER - Team_029 vs Team_002                       
================================================================================

[12:00] Team_029 possession (Score: 56-33)
Giannis Banchero makes the Midrange and draws the foul on Jordan Green! And-1! Giannis Banchero to the line for 1. [Team fouls: 1] (Jordan Green: 1 personal fouls)   FT 1/1: GOOD Giannis Banchero makes 1/1 from the line.
Score: 59-33

[11:45] Team_002 possession (Score: 59-33)
Tyler Porzingis drives to the basket... Tyler Porzingis loses control! Ball rolls out of bounds! TURNOVER! (dead ball)

[11:32] Team_029 possession (Score: 59-33)
Giannis Banchero attempts a 3Pt. Contested by Jordan Green (2.3 feet, MAN). Giannis Banchero misses. Rebound secured by Carmelo Lowry.

[11:16] Team_002 possession (Score: 59-33)
Miles Bane attempts a 3Pt. Heavily contested by Giannis Banchero (1.5 feet, ZONE)! Miles Bane misses. Rebound secured by Devin Butler.

[10:59] Team_029 possession (Score: 59-33)
Paul Iverson attempts a Layup. BLOCKED BY MILES BANE! Ball goes out off Miles Bane. Paul Iverson's ball!

[10:44] Team_029 possession (Score: 59-33)
James Wall drives, picks up Carmelo Lowry. Help arrives from CJ Barrett! James Wall attempts a Layup. Contested by CJ Barrett (3.6 feet, MAN). James Wall misses. Rebound secured by Tyler Porzingis.

[10:29] Team_002 possession (Score: 59-33)
Carmelo Lowry drives to the basket... Carmelo Lowry throws a bad pass out of bounds! TURNOVER! (dead ball)

[10:13] Team_029 possession (Score: 59-33)
Paul Iverson attempts a Midrange. Heavily contested by Miles Bane (1.5 feet, MAN)! Paul Iverson misses. Rebound secured by Tyler Porzingis.

[09:56] Team_002 possession (Score: 59-33)
Carmelo Lowry attempts a 3Pt. Contested by James Wall (3.0 feet, MAN). Carmelo Lowry misses. Rebound secured by James Wall.

[09:40] Team_029 possession (Score: 59-33)
Devin Butler drives, Tyler Porzingis stays with him. Devin Butler attempts a Dunk. Wide open! Tyler Porzingis is 6.8 feet away. [ZONE] Devin Butler misses. Rebound secured by Tyler Porzingis.

[09:29] Team_002 possession (Score: 59-33)
Tyler Porzingis attempts a Layup. Contested by James Wall (2.3 feet, ZONE). TYLER PORZINGIS MAKES IT! Assist: Jordan Green
Score: 59-35

[09:18] Team_029 possession (Score: 59-35)
Giannis Banchero attempts a Midrange. Contested by Jordan Green (4.4 feet, MAN). GIANNIS BANCHERO MAKES IT! Assist: James Wall
Score: 61-35

[09:04] Team_002 possession (Score: 61-35)
Carmelo Lowry loses the ball! Stripped by James Wall! TURNOVER! (live ball)

[08:49] Team_029 possession (Score: 61-35)
Scottie Bird attempts a 3Pt. Contested by CJ Barrett (4.3 feet, ZONE). SCOTTIE BIRD MAKES IT! Assist: Devin Butler
Score: 64-35

[08:33] Team_002 possession (Score: 64-35)
Carmelo Lowry loses the ball! Stripped by James Wall! TURNOVER! (live ball)

[08:18] Team_029 possession (Score: 64-35)
Paul Iverson attempts a 3Pt. Wide open! CJ Barrett is 6.6 feet away. [ZONE] Paul Iverson misses. Rebound secured by Miles Bane.

[08:04] Team_002 possession (Score: 64-35)
CJ Barrett attempts a 3Pt. Wide open! Giannis Banchero is 8.6 feet away. [ZONE] CJ Barrett misses. Rebound secured by James Wall.

[07:52] Team_029 possession (Score: 64-35)
Giannis Banchero makes the Layup and draws the foul on Jordan Green! And-1! Giannis Banchero to the line for 1. [Team fouls: 2] (Jordan Green: 2 personal fouls)   FT 1/1: GOOD Giannis Banchero makes 1/1 from the line.
Score: 67-35

[07:37] Team_002 possession (Score: 67-35)
Tyler Porzingis drives and kicks out. Tyler Porzingis attempts a Midrange. Heavily contested by James Wall (1.4 feet, ZONE)! Tyler Porzingis misses. Rebound secured by Giannis Banchero.

[07:20] Team_029 possession (Score: 67-35)
Giannis Banchero attempts a Midrange. Contested by Jordan Green (5.0 feet, ZONE). Giannis Banchero misses. Offensive rebound by Devin Butler! Devin Butler kicks it out.

[07:07] Team_029 possession (Score: 67-35)
Scottie Bird attempts a Midrange. Contested by CJ Barrett (4.6 feet, MAN). Scottie Bird misses. Rebound secured by Tyler Porzingis.

[06:51] Team_002 possession (Score: 67-35)
Miles Bane attempts a 3Pt. Contested by Giannis Banchero (4.8 feet, ZONE). Miles Bane misses. Rebound secured by James Wall.

[06:40] Team_029 possession (Score: 67-35)
Giannis Banchero drives, Jordan Green stays with him. Giannis Banchero attempts a Layup. Contested by Jordan Green (4.8 feet, MAN). GIANNIS BANCHERO MAKES IT! Assist: Scottie Bird
Score: 69-35

[06:27] Team_002 possession (Score: 69-35)
Miles Bane attempts a 3Pt. Heavily contested by Giannis Banchero (1.4 feet, ZONE)! Miles Bane misses. Offensive rebound by Tyler Porzingis! Tyler Porzingis's putback is no good. Offensive rebound by Carmelo Lowry! Carmelo Lowry kicks it out.

[06:13] Team_002 possession (Score: 69-35)
Miles Bane attempts a Layup. BLOCKED BY SCOTTIE BIRD! Ball goes out off Scottie Bird. Miles Bane's ball!

[05:56] Team_002 possession (Score: 69-35)
CJ Barrett attempts a 3Pt. Contested by Giannis Banchero (2.1 feet, ZONE). CJ Barrett misses. Rebound secured by James Wall.

[05:41] Team_029 possession (Score: 69-35)
James Wall attempts a Midrange. Contested by Carmelo Lowry (3.3 feet, MAN). James Wall misses. Rebound secured by Miles Bane.

[05:24] Team_002 possession (Score: 69-35)
Tyler Porzingis attempts a 3Pt. Contested by Giannis Banchero (3.0 feet, ZONE). Tyler Porzingis misses. Offensive rebound by Tyler Porzingis! Tyler Porzingis puts it back in!
Score: 69-37

[05:09] Team_029 possession (Score: 69-37)
FOUL! Shooting foul on CJ Barrett. Paul Iverson to the line for 3 free throws. [Team fouls: 3] (CJ Barrett: 1 personal fouls)   FT 1/3: GOOD   FT 2/3: MISS   FT 3/3: GOOD Paul Iverson makes 2/3 from the line.
Score: 71-37

[04:56] Team_002 possession (Score: 71-37)
Jordan Green makes the Layup and draws the foul on James Wall! And-1! Jordan Green to the line for 1. [Team fouls: 1] (James Wall: 1 personal fouls)   FT 1/1: GOOD Jordan Green makes 1/1 from the line.
Score: 71-40

[04:44] Team_029 possession (Score: 71-40)
Devin Butler attempts a Midrange. Wide open! Jordan Green is 6.6 feet away. [ZONE] Devin Butler misses. Rebound secured by Tyler Porzingis.

[04:32] Team_002 possession (Score: 71-40)
FOUL! Offensive foul on CJ Barrett! Scottie Bird drew the charge! [Team fouls: 4] (CJ Barrett: 2 personal fouls) TURNOVER! (dead ball)

[04:20] Team_029 possession (Score: 71-40)
Scottie Bird attempts a 3Pt. Heavily contested by CJ Barrett (0.9 feet, ZONE)! Scottie Bird misses. Rebound secured by Miles Bane.

[04:04] Team_002 possession (Score: 71-40)
CJ Barrett drives, Scottie Bird stays with him. CJ Barrett attempts a Layup. Contested by Scottie Bird (5.4 feet, MAN). CJ BARRETT MAKES IT! Assist: Tyler Porzingis
Score: 71-42

[03:48] Team_029 possession (Score: 71-42)
James Wall attempts a 3Pt. Contested by CJ Barrett (3.3 feet, ZONE). James Wall misses. Rebound secured by Tyler Porzingis.

[03:31] Team_002 possession (Score: 71-42)
Tyler Porzingis attempts a Dunk. BLOCKED BY JAMES WALL! Ball is loose! Rebound secured by Devin Butler.

[03:20] Team_029 possession (Score: 71-42)
Devin Butler attempts a Midrange. Contested by Tyler Porzingis (4.2 feet, MAN). Devin Butler misses. Rebound secured by Carmelo Lowry.

[03:04] Team_002 possession (Score: 71-42)
CJ Barrett attempts a Layup. BLOCKED BY DEVIN BUTLER! Ball is loose! Rebound secured by Devin Butler.

[02:52] Team_029 possession (Score: 71-42)
James Wall drives, picks up Tyler Porzingis. Help arrives from CJ Barrett! James Wall attempts a Layup. Contested by CJ Barrett (5.9 feet, ZONE). James Wall misses. Rebound secured by Tyler Porzingis.

[02:36] Team_002 possession (Score: 71-42)
Jordan Green attempts a 3Pt. Wide open! Paul Iverson is 6.1 feet away. [ZONE] JORDAN GREEN MAKES IT! Assist: CJ Barrett
Score: 71-45

[02:21] Team_029 possession (Score: 71-45)
Giannis Banchero attempts a 3Pt. Contested by Jordan Green (4.9 feet, MAN). Giannis Banchero misses. Rebound secured by Miles Bane.

[02:05] Team_002 possession (Score: 71-45)
CJ Barrett drives to the basket... CJ Barrett loses control! Ball rolls out of bounds! TURNOVER! (dead ball)

[02:05] Substitution (Team_029): Paul Iverson OUT → Immanuel Irving IN (stamina_rule2)

[02:05] Substitution (Team_029): Scottie Bird OUT → Bones Carter IN (stamina_rule2)

[02:05] Substitution (Team_029): Giannis Banchero OUT → Pau Anthony IN (stamina_rule2)

[02:05] Substitution (Team_029): Devin Butler OUT → Shai Ball IN (stamina_rule2)

[02:05] Substitution (Team_002): Miles Bane OUT → John Duncan IN (stamina_rule2)

[02:05] Substitution (Team_002): CJ Barrett OUT → Dirk Middleton IN (stamina_rule2)

[02:05] Substitution (Team_002): Jordan Green OUT → Anfernee Sexton IN (stamina_rule2)

[02:05] Substitution (Team_002): Carmelo Lowry OUT → Julius Curry IN (stamina_rule2)

[02:05] Substitution (Team_002): Tyler Porzingis OUT → Lamelo O'Neal IN (stamina_rule2)

[01:53] Team_029 possession (Score: 71-45)
James Wall drives, picks up Lamelo O'Neal. Help arrives from John Duncan! James Wall attempts a Dunk. Heavily contested by John Duncan (1.7 feet, ZONE)! JAMES WALL MAKES IT! Assist: Shai Ball
Score: 73-45

[01:36] Team_002 possession (Score: 73-45)
Julius Curry drives, James Wall stays with him. Julius Curry attempts a Layup. Heavily contested by James Wall (2.0 feet, MAN)! Julius Curry misses. Rebound secured by Pau Anthony.

[01:21] Team_029 possession (Score: 73-45)
James Wall loses control! Ball rolls out of bounds! TURNOVER! (dead ball)

[01:21] Substitution (Team_029): James Wall OUT → Derrick Rozier IN (stamina_rule2)

[01:10] Team_002 possession (Score: 73-45)
Dirk Middleton attempts a 3Pt. Contested by Bones Carter (4.5 feet, MAN). Dirk Middleton misses. Rebound secured by Derrick Rozier.

[00:59] Team_029 possession (Score: 73-45)
Shai Ball attempts a Layup. Contested by Lamelo O'Neal (5.6 feet, ZONE). Shai Ball misses. Rebound secured by Julius Curry.

[00:44] Team_002 possession (Score: 73-45)
John Duncan drives, Immanuel Irving stays with him. John Duncan attempts a Dunk. Wide open! Immanuel Irving is 6.5 feet away. [MAN] JOHN DUNCAN MAKES IT! Assist: Julius Curry
Score: 73-47

[00:28] Team_029 possession (Score: 73-47)
Immanuel Irving drives, John Duncan stays with him. Immanuel Irving attempts a Dunk. Wide open! John Duncan is 9.2 feet away. [MAN] IMMANUEL IRVING MAKES IT! Assist: Bones Carter
Score: 75-47

[00:13] Team_002 possession (Score: 75-47)
Julius Curry attempts a Layup. Contested by Derrick Rozier (4.0 feet, MAN). JULIUS CURRY MAKES IT! Assist: Dirk Middleton
Score: 75-49

================================================================================
                              3RD QUARTER COMPLETE                              
================================================================================

3RD QUARTER SCORE: Team_029 19, Team_002 16

BOX SCORE:
================================================================================

Team_029
--------------------------------------------------------------------------------
Player                MIN  PTS  REB  AST  TO      FG   FG%      3P   3P%
--------------------------------------------------------------------------------
Giannis Banchero       23   10    1    0   0   4/6    66.7     0/0   0.0
Scottie Bird           23    3    0    1   0   1/3    33.3     0/0   0.0
James Wall             24    2    4    1   0   1/5    20.0     0/0   0.0
Paul Iverson           23    2    0    0   0   1/3    33.3     0/0   0.0
Immanuel Irving        13    2    0    0   0   1/1   100.0     0/0   0.0
Devin Butler           23    0    4    1   0   0/3     0.0     0/0   0.0
Shai Ball              13    0    0    1   0   0/1     0.0     0/0   0.0
Pau Anthony            13    0    1    0   0   0/0     0.0     0/0   0.0
Derrick Rozier         13    0    1    0   0   0/0     0.0     0/0   0.0
Bones Carter           13    0    0    1   0   0/0     0.0     0/0   0.0

TEAM: FG: 8/22 (36.4%), 3PT: 2/7 (28.6%), REB: 11 (1 off, 10 def), AST: 5, TO: 1
TEAM FOULS: 1


Team_002
--------------------------------------------------------------------------------
Player                MIN  PTS  REB  AST  TO      FG   FG%      3P   3P%
--------------------------------------------------------------------------------
Jordan Green           23    6    0    1   0   2/2   100.0     0/0   0.0
Tyler Porzingis        23    4    8    1   0   2/4    50.0     0/0   0.0
CJ Barrett             23    2    0    1   0   1/4    25.0     0/0   0.0
Julius Curry           13    2    1    1   0   1/2    50.0     0/0   0.0
John Duncan            13    2    0    0   0   1/1   100.0     0/0   0.0
Carmelo Lowry          23    0    3    0   0   0/1     0.0     0/0   0.0
Miles Bane             23    0    4    0   0   0/2     0.0     0/0   0.0
Dirk Middleton         13    0    0    1   0   0/1     0.0     0/0   0.0

TEAM: FG: 7/17 (41.2%), 3PT: 2/8 (25.0%), REB: 16 (2 off, 14 def), AST: 5, TO: 6
TEAM FOULS: 4

================================================================================

================================================================================
                       4TH QUARTER - Team_029 vs Team_002                       
================================================================================

[12:00] Team_029 possession (Score: 75-49)
Scottie Bird attempts a 3Pt. Contested by CJ Barrett (5.2 feet, MAN). Scottie Bird misses. Offensive rebound by Devin Butler! Devin Butler kicks it out.

[11:44] Team_029 possession (Score: 75-49)
Giannis Banchero attempts a Midrange. Contested by Carmelo Lowry (2.6 feet, ZONE). Giannis Banchero misses. Rebound secured by Miles Bane.

[11:30] Team_002 possession (Score: 75-49)
CJ Barrett attempts a 3Pt. Contested by Giannis Banchero (3.3 feet, ZONE). CJ Barrett misses. Rebound secured by Giannis Banchero.

[11:17] Team_029 possession (Score: 75-49)
Scottie Bird drives to the basket... Scottie Bird commits a violation (traveling/carry)! TURNOVER! (dead ball)

[11:03] Team_002 possession (Score: 75-49)
FOUL! Reach-in foul on James Wall during the drive. [Team fouls: 1] No free throws, side out. (James Wall: 1 personal fouls)

[10:46] Team_002 possession (Score: 75-49)
Carmelo Lowry attempts a 3Pt. Heavily contested by Giannis Banchero (1.1 feet, ZONE)! Carmelo Lowry misses. Rebound secured by James Wall.

[10:35] Team_029 possession (Score: 75-49)
Paul Iverson makes the Midrange and draws the foul on Miles Bane! And-1! Paul Iverson to the line for 1. [Team fouls: 1] (Miles Bane: 1 personal fouls)   FT 1/1: GOOD Paul Iverson makes 1/1 from the line.
Score: 78-49

[10:19] Team_002 possession (Score: 78-49)
Tyler Porzingis attempts a Layup. Contested by Devin Butler (2.6 feet, MAN). TYLER PORZINGIS MAKES IT! Assist: Miles Bane
Score: 78-51

[10:08] Team_029 possession (Score: 78-51)
Giannis Banchero attempts a Layup. Contested by Tyler Porzingis (2.8 feet, ZONE). Giannis Banchero misses. Rebound secured by Tyler Porzingis.

[09:54] Team_002 possession (Score: 78-51)
CJ Barrett drives, picks up James Wall. Help arrives from Scottie Bird! CJ Barrett attempts a Layup. Heavily contested by Scottie Bird (1.9 feet, ZONE)! CJ BARRETT MAKES IT!
Score: 78-53

[09:36] Team_029 possession (Score: 78-53)
Scottie Bird drives and kicks out. FOUL! Shooting foul on Carmelo Lowry. James Wall to the line for 2 free throws. [Team fouls: 2] (Carmelo Lowry: 1 personal fouls)   FT 1/2: GOOD   FT 2/2: GOOD James Wall makes 2/2 from the line.
Score: 80-53

[09:21] Team_002 possession (Score: 80-53)
Carmelo Lowry attempts a 3Pt. Contested by Giannis Banchero (2.6 feet, ZONE). Carmelo Lowry misses. Rebound secured by Giannis Banchero.

[09:09] Team_029 possession (Score: 80-53)
James Wall makes the Dunk and draws the foul on Carmelo Lowry! And-1! James Wall to the line for 1. [Team fouls: 3] (Carmelo Lowry: 2 personal fouls)   FT 1/1: GOOD James Wall makes 1/1 from the line.
Score: 83-53

[08:59] Team_002 possession (Score: 83-53)
Jordan Green drives and kicks out. Carmelo Lowry attempts a 3Pt. Contested by Giannis Banchero (4.9 feet, ZONE). Carmelo Lowry misses. Rebound secured by James Wall.

[08:41] Team_029 possession (Score: 83-53)
Devin Butler attempts a Layup. Wide open! Tyler Porzingis is 6.9 feet away. [MAN] Devin Butler misses. Rebound secured by Tyler Porzingis.

[08:27] Team_002 possession (Score: 83-53)
Jordan Green attempts a 3Pt. Contested by Giannis Banchero (4.5 feet, ZONE). Jordan Green misses. Rebound secured by Giannis Banchero.

[08:12] Team_029 possession (Score: 83-53)
FOUL! Shooting foul on Tyler Porzingis. Devin Butler to the line for 2 free throws. [Team fouls: 4] (Tyler Porzingis: 1 personal fouls)   FT 1/2: GOOD   FT 2/2: GOOD Devin Butler makes 2/2 from the line.
Score: 85-53

[07:55] Team_002 possession (Score: 85-53)
Tyler Porzingis drives and kicks out. Tyler Porzingis attempts a Midrange. Contested by Scottie Bird (2.5 feet, ZONE). Tyler Porzingis misses. Offensive rebound by Carmelo Lowry! Carmelo Lowry kicks it out.

[07:41] Team_002 possession (Score: 85-53)
Carmelo Lowry drives, James Wall stays with him. Carmelo Lowry attempts a Layup. Heavily contested by James Wall (1.9 feet, ZONE)! Carmelo Lowry misses. Rebound secured by Giannis Banchero.

[07:22] Team_029 possession (Score: 85-53)
James Wall drives, picks up Carmelo Lowry. Help arrives from CJ Barrett! James Wall attempts a Dunk. Wide open! CJ Barrett is 7.3 feet away. [MAN] James Wall misses. Offensive rebound by James Wall! James Wall's putback is no good. Rebound secured by Miles Bane.

[07:03] Team_002 possession (Score: 85-53)
Tyler Porzingis attempts a 3Pt. Contested by Devin Butler (3.5 feet, MAN). Tyler Porzingis misses. Rebound secured by Devin Butler.

[06:50] Team_029 possession (Score: 85-53)
Scottie Bird makes the Midrange and draws the foul on CJ Barrett! And-1! Scottie Bird to the line for 1. [BONUS: 5 team fouls] (CJ Barrett: 1 personal fouls)   FT 1/1: GOOD Scottie Bird makes 1/1 from the line.
Score: 88-53

[06:37] Team_002 possession (Score: 88-53)
Jordan Green attempts a 3Pt. Contested by Giannis Banchero (3.5 feet, MAN). Jordan Green misses. Offensive rebound by Carmelo Lowry! Carmelo Lowry kicks it out.

[06:18] Team_002 possession (Score: 88-53)
Jordan Green attempts a 3Pt. Wide open! Giannis Banchero is 6.4 feet away. [ZONE] JORDAN GREEN MAKES IT! Assist: Carmelo Lowry
Score: 88-56

[06:02] Team_029 possession (Score: 88-56)
Scottie Bird drives, picks up CJ Barrett. Help arrives from Miles Bane! Scottie Bird attempts a Dunk. Contested by Miles Bane (3.7 feet, MAN). Scottie Bird misses. Rebound secured by Miles Bane.

[05:46] Team_002 possession (Score: 88-56)
Carmelo Lowry drives to the basket... Carmelo Lowry loses the ball! Stripped by James Wall! TURNOVER! (live ball)

[05:31] Team_029 possession (Score: 88-56)
FOUL! Shooting foul on Tyler Porzingis. Devin Butler to the line for 2 free throws. [BONUS: 6 team fouls] (Tyler Porzingis: 2 personal fouls)   FT 1/2: GOOD   FT 2/2: GOOD Devin Butler makes 2/2 from the line.
Score: 90-56

[05:17] Team_002 possession (Score: 90-56)
Miles Bane attempts a 3Pt. Contested by Giannis Banchero (5.2 feet, ZONE). MILES BANE MAKES IT! Assist: Jordan Green
Score: 90-59

[04:58] Team_029 possession (Score: 90-59)
Paul Iverson attempts a Layup. Contested by Miles Bane (2.7 feet, MAN). Paul Iverson misses. Offensive rebound by James Wall! James Wall puts it back in!
Score: 92-59

[04:40] Team_002 possession (Score: 92-59)
Miles Bane loses the ball! Stripped by Paul Iverson! TURNOVER! (live ball)

[04:30] Team_029 possession (Score: 92-59)
Scottie Bird attempts a 3Pt. Wide open! CJ Barrett is 7.8 feet away. [MAN] Scottie Bird misses. Rebound secured by Carmelo Lowry.

[04:17] Team_002 possession (Score: 92-59)
Carmelo Lowry attempts a Midrange. Contested by James Wall (4.7 feet, MAN). Carmelo Lowry misses. Rebound secured by Devin Butler.

[04:06] Team_029 possession (Score: 92-59)
Scottie Bird drives and kicks out. Scottie Bird attempts a 3Pt. Contested by Miles Bane (5.4 feet, ZONE). SCOTTIE BIRD MAKES IT! Assist: James Wall
Score: 95-59

[03:55] Team_002 possession (Score: 95-59)
CJ Barrett attempts a Layup. Contested by James Wall (3.7 feet, ZONE). CJ BARRETT MAKES IT! Assist: Jordan Green
Score: 95-61

[03:41] Team_029 possession (Score: 95-61)
Devin Butler throws a bad pass out of bounds! TURNOVER! (dead ball)

[03:41] Substitution (Team_029): Paul Iverson OUT → Immanuel Irving IN (stamina_rule2)

[03:41] Substitution (Team_029): Scottie Bird OUT → Bones Carter IN (stamina_rule2)

[03:41] Substitution (Team_029): Giannis Banchero OUT → Pau Anthony IN (stamina_rule2)

[03:41] Substitution (Team_029): James Wall OUT → Derrick Rozier IN (stamina_rule2)

[03:41] Substitution (Team_029): Devin Butler OUT → Shai Ball IN (stamina_rule2)

[03:41] Substitution (Team_002): Miles Bane OUT → John Duncan IN (stamina_rule2)

[03:41] Substitution (Team_002): CJ Barrett OUT → Dirk Middleton IN (stamina_rule2)

[03:41] Substitution (Team_002): Jordan Green OUT → Anfernee Sexton IN (stamina_rule2)

[03:41] Substitution (Team_002): Carmelo Lowry OUT → Julius Curry IN (stamina_rule2)

[03:41] Substitution (Team_002): Tyler Porzingis OUT → Lamelo O'Neal IN (stamina_rule2)

[03:27] Team_002 possession (Score: 95-61)
John Duncan attempts a Layup. Contested by Derrick Rozier (2.1 feet, ZONE). John Duncan misses. Rebound secured by Shai Ball.

[03:13] Team_029 possession (Score: 95-61)
Bones Carter attempts a Layup. Heavily contested by Lamelo O'Neal (1.1 feet, ZONE)! Bones Carter misses. Rebound secured by Lamelo O'Neal.

[03:01] Team_002 possession (Score: 95-61)
Julius Curry drives and kicks out. Julius Curry attempts a 3Pt. Contested by Derrick Rozier (3.8 feet, MAN). JULIUS CURRY MAKES IT! Assist: Lamelo O'Neal
Score: 95-64

[02:46] Team_029 possession (Score: 95-64)
Derrick Rozier attempts a 3Pt. Wide open! Julius Curry is 8.6 feet away. [ZONE] DERRICK ROZIER MAKES IT! Assist: Pau Anthony
Score: 98-64

[02:29] Team_002 possession (Score: 98-64)
Lamelo O'Neal drives to the basket... Lamelo O'Neal commits a violation (traveling/carry)! TURNOVER! (dead ball)

[02:13] Team_029 possession (Score: 98-64)
Shai Ball drives, Lamelo O'Neal stays with him. Shai Ball attempts a Layup. Contested by Lamelo O'Neal (4.0 feet, MAN). SHAI BALL MAKES IT! Assist: Immanuel Irving
Score: 100-64

[01:59] Team_002 possession (Score: 100-64)
Lamelo O'Neal attempts a Layup. Contested by Derrick Rozier (5.6 feet, ZONE). LAMELO O'NEAL MAKES IT! Assist: Anfernee Sexton
Score: 100-66

[01:47] Team_029 possession (Score: 100-66)
Derrick Rozier attempts a Midrange. Contested by Anfernee Sexton (5.6 feet, ZONE). Derrick Rozier misses. Rebound secured by Anfernee Sexton.

[01:33] Team_002 possession (Score: 100-66)
Dirk Middleton attempts a Midrange. Heavily contested by Bones Carter (1.9 feet, MAN)! Dirk Middleton misses. Rebound secured by Shai Ball.

[01:17] Team_029 possession (Score: 100-66)
Bones Carter attempts a Midrange. Contested by Dirk Middleton (4.5 feet, MAN). BONES CARTER MAKES IT! Assist: Pau Anthony
Score: 102-66

[01:00] Team_002 possession (Score: 102-66)
Lamelo O'Neal attempts a Layup. BLOCKED BY DERRICK ROZIER! Ball is loose! Offensive rebound by Anfernee Sexton! Anfernee Sexton kicks it out.

[00:49] Team_002 possession (Score: 102-66)
John Duncan drives to the basket... John Duncan throws a bad pass! Stolen by Shai Ball! TURNOVER! (live ball)

[00:30] Team_029 possession (Score: 102-66)
Pau Anthony attempts a 3Pt. Contested by Dirk Middleton (5.9 feet, ZONE). PAU ANTHONY MAKES IT!
Score: 105-66

[00:11] Team_002 possession (Score: 105-66)
Lamelo O'Neal attempts a 3Pt. Contested by Pau Anthony (5.6 feet, ZONE). Lamelo O'Neal misses. Rebound secured by Shai Ball.

================================================================================
                              4TH QUARTER COMPLETE                              
================================================================================

4TH QUARTER SCORE: Team_029 30, Team_002 17

BOX SCORE:
================================================================================

Team_029
--------------------------------------------------------------------------------
Player                MIN  PTS  REB  AST  TO      FG   FG%      3P   3P%
--------------------------------------------------------------------------------
James Wall             32    7    3    1   0   3/4    75.0     0/0   0.0
Scottie Bird           32    6    0    0   0   2/4    50.0     0/0   0.0
Devin Butler           32    4    3    0   0   2/3    66.7     0/0   0.0
Paul Iverson           32    3    0    0   0   1/1   100.0     0/0   0.0
Derrick Rozier         16    3    0    0   0   1/2    50.0     0/0   0.0
Pau Anthony            17    3    0    2   0   1/1   100.0     0/0   0.0
Shai Ball              17    2    3    0   0   1/1   100.0     0/0   0.0
Bones Carter           17    2    0    0   0   1/2    50.0     0/0   0.0
Giannis Banchero       32    0    4    0   0   0/2     0.0     0/0   0.0
Immanuel Irving        17    0    0    1   0   0/0     0.0     0/0   0.0

TEAM: FG: 12/20 (60.0%), 3PT: 2/3 (66.7%), REB: 14 (3 off, 11 def), AST: 4, TO: 2
TEAM FOULS: 1


Team_002
--------------------------------------------------------------------------------
Player                MIN  PTS  REB  AST  TO      FG   FG%      3P   3P%
--------------------------------------------------------------------------------
CJ Barrett             32    4    0    0   0   2/3    66.7     0/0   0.0
Miles Bane             32    3    3    1   0   1/1   100.0     0/0   0.0
Jordan Green           32    3    0    2   0   1/3    33.3     0/0   0.0
Julius Curry           17    3    0    0   0   1/1   100.0     0/0   0.0
Tyler Porzingis        32    2    2    0   0   1/2    50.0     0/0   0.0
Lamelo O'Neal          17    2    1    1   0   1/2    50.0     0/0   0.0
Carmelo Lowry          32    0    3    1   0   0/4     0.0     0/0   0.0
John Duncan            17    0    0    0   0   0/1     0.0     0/0   0.0
Anfernee Sexton        17    0    2    1   0   0/0     0.0     0/0   0.0
Dirk Middleton         17    0    0    0   0   0/1     0.0     0/0   0.0

TEAM: FG: 7/18 (38.9%), 3PT: 2/8 (25.0%), REB: 10 (3 off, 7 def), AST: 6, TO: 4
TEAM FOULS: 6 [Team_029 in BONUS]

================================================================================

================================================================================
                               FULL GAME COMPLETE                               
================================================================================

FINAL SCORE: Team_029 105, Team_002 66

SCORING BY QUARTER:
--------------------------------------------------------------------------------
Team                     Q1     Q2     Q3     Q4    FINAL
--------------------------------------------------------------------------------
Team_029                 33     23     19     30      105
Team_002                 13     20     16     17       66
--------------------------------------------------------------------------------

FULL GAME BOX SCORE:
================================================================================

Team_029
--------------------------------------------------------------------------------
Player                MIN  PTS  REB  AST  TO      FG   FG%      3P   3P%      FT STL BLK
--------------------------------------------------------------------------------
James Wall             32   11   14    5   1   3/9    33.3   0/1     0.0   3/3     5   1
Paul Iverson           32   12    0    1   1   7/12   58.3   2/3    66.7   3/4     1   0
Scottie Bird           32   18    0    3   0   8/16   50.0   1/5    20.0   1/1     0   2
Giannis Banchero       32   16    8    0   1   6/12   50.0   0/3     0.0   2/3     0   0
Devin Butler           32   11   13    3   1   5/9    55.6   1/1   100.0   6/6     1   1
Immanuel Irving        17   13    0    2   1   5/6    83.3   1/2    50.0   4/4     0   0
Bones Carter           17    5    0    1   2   2/4    50.0   0/0     0.0   1/2     0   0
Pau Anthony            17    8    4    3   0   2/4    50.0   1/2    50.0   0/0     0   0
Shai Ball              17    3    5    2   1   3/6    50.0   0/0     0.0   2/4     3   0
Derrick Rozier         16    5    7    0   0   2/4    50.0   1/2    50.0   2/2     0   1

TEAM: FG: 44/83 (53.0%), 3PT: 7/19 (36.8%), REB: 51 (8 off, 43 def), AST: 20, TO: 8


Team_002
--------------------------------------------------------------------------------
Player                MIN  PTS  REB  AST  TO      FG   FG%      3P   3P%      FT STL BLK
--------------------------------------------------------------------------------
Miles Bane             32    3   11    3   2   1/6    16.7   1/5    20.0   0/0     0   1
CJ Barrett             32    8    0    1   3   4/11   36.4   0/4     0.0   0/0     0   1
Jordan Green           32   11    0    4   1   4/8    50.0   2/3    66.7   1/1     0   0
Carmelo Lowry          32    3    8    2   6   1/8    12.5   1/5    20.0   0/0     0   0
Tyler Porzingis        32   12   14    2   0   6/13   46.2   1/2    50.0   0/0     0   0
John Duncan            17   13    0    0   0   5/9    55.6   1/2    50.0   1/2     0   0
Dirk Middleton         17    0    0    2   2   0/4     0.0   0/2     0.0   0/1     0   0
Anfernee Sexton        17    0    7    1   2   2/4    50.0   1/3    33.3   0/0     0   0
Julius Curry           17    7    4    2   1   3/5    60.0   0/0     0.0   0/0     0   0
Lamelo O'Neal          17    7    3    2   1   3/5    60.0   0/1     0.0   1/2     1   0

TEAM: FG: 29/73 (39.7%), 3PT: 7/27 (25.9%), REB: 47 (10 off, 37 def), AST: 19, TO: 18

================================================================================
