================================================================================
                        FULL GAME - Team_072 vs Team_046                        
================================================================================

================================================================================
                       1ST QUARTER - Team_072 vs Team_046                       
================================================================================

[12:00] Team_072 possession (Score: 0-0)
Collin Griffin drives, Kevin Allen stays with him. Collin Griffin attempts a Layup. Wide open! Kevin Allen is 6.5 feet away. [ZONE] COLLIN GRIFFIN MAKES IT! Assist: Tyrese Williamson
Score: 2-0

[11:51] Team_046 possession (Score: 2-0)
Victor Nowitzki attempts a 3Pt. Heavily contested by Cade Poole (0.5 feet, MAN)! Victor Nowitzki misses. FOUL! Loose ball foul on Wendell Anthony during the rebound battle. [Team fouls: 1] No free throws, side out. (Wendell Anthony: 1 personal fouls)

[11:39] Team_046 possession (Score: 2-0)
Victor Nowitzki loses the ball! Stripped by Cade Poole! TURNOVER! (live ball)

[11:25] Team_072 possession (Score: 2-0)
Wendell Anthony attempts a 3Pt. Contested by Lauri Carter (2.1 feet, MAN). Wendell Anthony misses. Rebound secured by Lauri Carter.

[11:09] Team_046 possession (Score: 2-0)
Lauri Carter attempts a 3Pt. Wide open! Cade Poole is 7.8 feet away. [ZONE] Lauri Carter misses. Rebound secured by Tyrese Williamson.

[10:53] Team_072 possession (Score: 2-0)
Tracy Giddey attempts a Dunk. BLOCKED BY CADE WALL! Ball is loose! Rebound secured by Cade Wall.

[10:38] Team_046 possession (Score: 2-0)
Cade Wall attempts a 3Pt. Contested by Tracy Giddey (4.6 feet, MAN). Cade Wall misses. Offensive rebound by Kevin Allen! Kevin Allen kicks it out.

[10:24] Team_046 possession (Score: 2-0)
Cade Wall drives and kicks out. D'Angelo O'Neal attempts a 3Pt. Contested by Cade Poole (3.6 feet, ZONE). D'ANGELO O'NEAL MAKES IT! Assist: Lauri Carter
Score: 2-3

[10:10] Team_072 possession (Score: 2-3)
Cade Poole attempts a 3Pt. Wide open! Victor Nowitzki is 6.6 feet away. [MAN] CADE POOLE MAKES IT! Assist: Tracy Giddey
Score: 5-3

[10:00] Team_046 possession (Score: 5-3)
Lauri Carter attempts a 3Pt. Contested by Wendell Anthony (5.0 feet, MAN). LAURI CARTER MAKES IT! Assist: D'Angelo O'Neal
Score: 5-6

[09:45] Team_072 possession (Score: 5-6)
Wendell Anthony attempts a 3Pt. Contested by Lauri Carter (3.1 feet, MAN). WENDELL ANTHONY MAKES IT! Assist: Collin Griffin
Score: 8-6

[09:35] Team_046 possession (Score: 8-6)
FOUL! Shooting foul on Tyrese Williamson. Kevin Allen to the line for 2 free throws. [Team fouls: 2] (Tyrese Williamson: 1 personal fouls)   FT 1/2: GOOD   FT 2/2: MISS Kevin Allen makes 1/2 from the line. Rebound secured by Tyrese Williamson.
Score: 8-7

[09:22] Team_072 possession (Score: 8-7)
Tracy Giddey attempts a Layup. Contested by Cade Wall (2.6 feet, MAN). TRACY GIDDEY MAKES IT! Assist: Wendell Anthony
Score: 10-7

[09:08] Team_046 possession (Score: 10-7)
Victor Nowitzki makes the Layup and draws the foul on Cade Poole! And-1! Victor Nowitzki to the line for 1. [Team fouls: 3] (Cade Poole: 1 personal fouls)   FT 1/1: GOOD Victor Nowitzki makes 1/1 from the line.
Score: 10-10

[08:55] Team_072 possession (Score: 10-10)
Collin Griffin attempts a 3Pt. Contested by Lauri Carter (4.5 feet, ZONE). Collin Griffin misses. Offensive rebound by Tyrese Williamson! Tyrese Williamson kicks it out.

[08:44] Team_072 possession (Score: 10-10)
Tyrese Williamson drives, Kevin Allen stays with him. Tyrese Williamson attempts a Layup. Contested by Kevin Allen (5.5 feet, MAN). TYRESE WILLIAMSON MAKES IT! Assist: Wendell Anthony
Score: 12-10

[08:33] Team_046 possession (Score: 12-10)
Victor Nowitzki drives and kicks out. Cade Wall attempts a Midrange. Contested by Tyrese Williamson (2.3 feet, ZONE). Cade Wall misses. Rebound secured by Wendell Anthony.

[08:17] Team_072 possession (Score: 12-10)
Cade Poole attempts a Midrange. Contested by Victor Nowitzki (5.8 feet, MAN). Cade Poole misses. Rebound secured by Lauri Carter.

[08:00] Team_046 possession (Score: 12-10)
FOUL! Holding foul on Collin Griffin. [Team fouls: 4] No free throws, side out. (Collin Griffin: 1 personal fouls)

[07:46] Team_046 possession (Score: 12-10)
Cade Wall attempts a 3Pt. Wide open! Cade Poole is 6.5 feet away. [ZONE] CADE WALL MAKES IT! Assist: D'Angelo O'Neal
Score: 12-13

[07:33] Team_072 possession (Score: 12-13)
Tyrese Williamson drives and kicks out. Tracy Giddey attempts a 3Pt. Contested by Lauri Carter (2.7 feet, ZONE). TRACY GIDDEY MAKES IT! Assist: Collin Griffin
Score: 15-13

[07:19] Team_046 possession (Score: 15-13)
Kevin Allen drives, Tyrese Williamson stays with him. Kevin Allen attempts a Dunk. Contested by Tyrese Williamson (5.5 feet, MAN). Kevin Allen misses. Rebound secured by Wendell Anthony.

[07:08] Team_072 possession (Score: 15-13)
Wendell Anthony attempts a 3Pt. Contested by Lauri Carter (3.0 feet, ZONE). Wendell Anthony misses. Rebound secured by Kevin Allen.

[06:56] Team_046 possession (Score: 15-13)
Kevin Allen throws a bad pass out of bounds! TURNOVER! (dead ball)

[06:46] Team_072 possession (Score: 15-13)
FOUL! Shooting foul on Cade Wall. Collin Griffin to the line for 2 free throws. [Team fouls: 1] (Cade Wall: 1 personal fouls)   FT 1/2: GOOD   FT 2/2: GOOD Collin Griffin makes 2/2 from the line.
Score: 17-13

[06:32] Team_046 possession (Score: 17-13)
FOUL! Shooting foul on Collin Griffin. D'Angelo O'Neal to the line for 2 free throws. [BONUS: 5 team fouls] (Collin Griffin: 2 personal fouls)   FT 1/2: GOOD   FT 2/2: GOOD D'Angelo O'Neal makes 2/2 from the line.
Score: 17-15

[06:13] Team_072 possession (Score: 17-15)
Tyrese Williamson drives, Kevin Allen stays with him. Tyrese Williamson attempts a Layup. Wide open! Kevin Allen is 6.8 feet away. [MAN] TYRESE WILLIAMSON MAKES IT!
Score: 19-15

[05:57] Team_046 possession (Score: 19-15)
Kevin Allen drives to the basket... FOUL! Offensive foul on Kevin Allen! Tyrese Williamson drew the charge! [Team fouls: 2] (Kevin Allen: 1 personal fouls) TURNOVER! (dead ball)

[05:47] Team_072 possession (Score: 19-15)
Tyrese Williamson drives to the basket... Tyrese Williamson throws a bad pass! Stolen by Kevin Allen! TURNOVER! (live ball)

[05:35] Team_046 possession (Score: 19-15)
Kevin Allen attempts a Midrange. Contested by Tyrese Williamson (2.8 feet, MAN). KEVIN ALLEN MAKES IT! Assist: Lauri Carter
Score: 19-17

[05:17] Team_072 possession (Score: 19-17)
Cade Poole attempts a Midrange. Contested by Victor Nowitzki (4.6 feet, MAN). CADE POOLE MAKES IT!
Score: 21-17

[05:01] Team_046 possession (Score: 21-17)
Victor Nowitzki attempts a Midrange. Contested by Cade Poole (2.3 feet, MAN). VICTOR NOWITZKI MAKES IT! Assist: D'Angelo O'Neal
Score: 21-19

[04:45] Team_072 possession (Score: 21-19)
Tyrese Williamson drives, Kevin Allen stays with him. Tyrese Williamson attempts a Layup. Contested by Kevin Allen (4.4 feet, ZONE). Tyrese Williamson misses. Rebound secured by Lauri Carter.

[04:31] Team_046 possession (Score: 21-19)
D'Angelo O'Neal attempts a 3Pt. Contested by Collin Griffin (4.5 feet, MAN). D'ANGELO O'NEAL MAKES IT! Assist: Kevin Allen
Score: 21-22

[04:18] Team_072 possession (Score: 21-22)
Tyrese Williamson makes the Layup and draws the foul on Kevin Allen! And-1! Tyrese Williamson to the line for 1. [Team fouls: 3] (Kevin Allen: 2 personal fouls)   FT 1/1: GOOD Tyrese Williamson makes 1/1 from the line.
Score: 24-22

[04:03] Team_046 possession (Score: 24-22)
D'Angelo O'Neal attempts a Midrange. Contested by Collin Griffin (4.7 feet, MAN). D'ANGELO O'NEAL MAKES IT!
Score: 24-24

[03:45] Team_072 possession (Score: 24-24)
FOUL! Shooting foul on Lauri Carter. Wendell Anthony to the line for 2 free throws. [Team fouls: 4] (Lauri Carter: 1 personal fouls)   FT 1/2: GOOD   FT 2/2: GOOD Wendell Anthony makes 2/2 from the line.
Score: 26-24

[03:28] Team_046 possession (Score: 26-24)
D'Angelo O'Neal attempts a 3Pt. Contested by Collin Griffin (3.7 feet, MAN). D'ANGELO O'NEAL MAKES IT! Assist: Lauri Carter
Score: 26-27

[03:17] Team_072 possession (Score: 26-27)
FOUL! Shooting foul on Cade Wall. Tracy Giddey to the line for 2 free throws. [BONUS: 5 team fouls] (Cade Wall: 2 personal fouls)   FT 1/2: MISS   FT 2/2: GOOD Tracy Giddey makes 1/2 from the line.
Score: 27-27

[03:03] Team_046 possession (Score: 27-27)
Victor Nowitzki attempts a Layup. Contested by Cade Poole (4.6 feet, MAN). VICTOR NOWITZKI MAKES IT!
Score: 27-29

[02:48] Team_072 possession (Score: 27-29)
Collin Griffin drives, picks up D'Angelo O'Neal. Help arrives from Lauri Carter! Collin Griffin attempts a Dunk. Contested by Lauri Carter (2.5 feet, MAN). Collin Griffin misses. Rebound secured by Lauri Carter.

[02:31] Team_046 possession (Score: 27-29)
FOUL! Shooting foul on Wendell Anthony. Lauri Carter to the line for 2 free throws. [BONUS: 6 team fouls] (Wendell Anthony: 2 personal fouls)   FT 1/2: GOOD   FT 2/2: GOOD Lauri Carter makes 2/2 from the line.
Score: 27-31

[02:15] Team_072 possession (Score: 27-31)
Tracy Giddey drives to the basket... Tracy Giddey throws a bad pass! Stolen by Cade Wall! TURNOVER! (live ball)

[01:59] Team_046 possession (Score: 27-31)
Victor Nowitzki attempts a Layup. Contested by Cade Poole (4.3 feet, MAN). VICTOR NOWITZKI MAKES IT! Assist: D'Angelo O'Neal
Score: 27-33

[01:45] Team_072 possession (Score: 27-33)
Collin Griffin drives, picks up Cade Wall. Help arrives from D'Angelo O'Neal! Collin Griffin attempts a Layup. Wide open! D'Angelo O'Neal is 6.6 feet away. [ZONE] COLLIN GRIFFIN MAKES IT! Assist: Tracy Giddey
Score: 29-33

[01:30] Team_046 possession (Score: 29-33)
FOUL! Shooting foul on Tracy Giddey. Victor Nowitzki to the line for 2 free throws. [BONUS: 7 team fouls] (Tracy Giddey: 1 personal fouls)   FT 1/2: GOOD   FT 2/2: GOOD Victor Nowitzki makes 2/2 from the line.
Score: 29-35

[01:17] Team_072 possession (Score: 29-35)
Cade Poole attempts a Midrange. Wide open! Victor Nowitzki is 6.3 feet away. [MAN] CADE POOLE MAKES IT! Assist: Wendell Anthony
Score: 31-35

[01:04] Team_046 possession (Score: 31-35)
Cade Wall drives and kicks out. Lauri Carter attempts a 3Pt. Contested by Cade Poole (4.9 feet, ZONE). Lauri Carter misses. Rebound secured by Tyrese Williamson.

[00:49] Team_072 possession (Score: 31-35)
Wendell Anthony makes the Layup and draws the foul on Lauri Carter! And-1! Wendell Anthony to the line for 1. [BONUS: 6 team fouls] (Lauri Carter: 2 personal fouls)   FT 1/1: GOOD Wendell Anthony makes 1/1 from the line.
Score: 34-35

[00:37] Team_046 possession (Score: 34-35)
Cade Wall drives and kicks out. Lauri Carter attempts a Midrange. Contested by Wendell Anthony (2.4 feet, MAN). LAURI CARTER MAKES IT! Assist: D'Angelo O'Neal
Score: 34-37

[00:22] Team_072 possession (Score: 34-37)
Tracy Giddey drives, picks up Cade Wall. Help arrives from D'Angelo O'Neal! Tracy Giddey attempts a Layup. Wide open! D'Angelo O'Neal is 7.0 feet away. [MAN] TRACY GIDDEY MAKES IT! Assist: Wendell Anthony
Score: 36-37

[00:05] Team_046 possession (Score: 36-37)
FOUL! Shooting foul on Wendell Anthony. Lauri Carter to the line for 2 free throws. [BONUS: 8 team fouls] (Wendell Anthony: 3 personal fouls)   FT 1/2: GOOD   FT 2/2: GOOD Lauri Carter makes 2/2 from the line.
Score: 36-39

================================================================================
                              1ST QUARTER COMPLETE                              
================================================================================

1ST QUARTER SCORE: Team_072 36, Team_046 39

BOX SCORE:
================================================================================

Team_072
--------------------------------------------------------------------------------
Player                MIN  PTS  REB  AST  TO      FG   FG%      3P   3P%
--------------------------------------------------------------------------------
Wendell Anthony        12    8    2    4   0   3/5    60.0     0/0   0.0
Tracy Giddey           12    8    0    2   0   4/5    80.0     0/0   0.0
Tyrese Williamson      12    7    4    1   0   3/4    75.0     0/0   0.0
Cade Poole             12    7    0    0   0   3/4    75.0     0/0   0.0
Collin Griffin         12    6    0    2   0   3/4    75.0     0/0   0.0

TEAM: FG: 16/22 (72.7%), 3PT: 2/4 (50.0%), REB: 6 (1 off, 5 def), AST: 9, TO: 2
TEAM FOULS: 8 [Team_046 in BONUS]


Team_046
--------------------------------------------------------------------------------
Player                MIN  PTS  REB  AST  TO      FG   FG%      3P   3P%
--------------------------------------------------------------------------------
D'Angelo O'Neal        12   13    0    5   0   5/5   100.0     0/0   0.0
Victor Nowitzki        12   11    0    0   0   5/6    83.3     0/0   0.0
Lauri Carter           12    9    4    3   0   4/5    80.0     0/0   0.0
Cade Wall              12    3    2    0   0   1/2    50.0     0/0   0.0
Kevin Allen            12    2    2    1   0   1/3    33.3     0/0   0.0

TEAM: FG: 16/21 (76.2%), 3PT: 4/5 (80.0%), REB: 8 (2 off, 6 def), AST: 9, TO: 3
TEAM FOULS: 6 [Team_072 in BONUS]

================================================================================

================================================================================
                       2ND QUARTER - Team_072 vs Team_046                       
================================================================================

[12:00] Team_072 possession (Score: 36-39)
Tracy Giddey drives, Kevin Allen stays with him. Tracy Giddey attempts a Dunk. Wide open! Kevin Allen is 6.7 feet away. [ZONE] TRACY GIDDEY MAKES IT! Assist: Cade Poole
Score: 38-39

[11:46] Team_046 possession (Score: 38-39)
Cade Wall attempts a Midrange. Wide open! Tracy Giddey is 7.0 feet away. [MAN] Cade Wall misses. FOUL! Loose ball foul on Wendell Anthony during the rebound battle. [Team fouls: 1] No free throws, side out. (Wendell Anthony: 1 personal fouls)

[11:31] Team_046 possession (Score: 38-39)
Victor Nowitzki drives, picks up Tyrese Williamson. Help arrives from Collin Griffin! Victor Nowitzki attempts a Layup. Contested by Collin Griffin (5.4 feet, ZONE). VICTOR NOWITZKI MAKES IT!
Score: 38-41

[11:14] Team_072 possession (Score: 38-41)
Cade Poole attempts a 3Pt. Contested by Victor Nowitzki (5.9 feet, MAN). Cade Poole misses. Rebound secured by Cade Wall.

[10:56] Team_046 possession (Score: 38-41)
Cade Wall attempts a 3Pt. Wide open! Tracy Giddey is 6.4 feet away. [MAN] Cade Wall misses. Rebound secured by Wendell Anthony.

[10:43] Team_072 possession (Score: 38-41)
Tracy Giddey attempts a 3Pt. Contested by Lauri Carter (2.6 feet, ZONE). Tracy Giddey misses. Rebound secured by Cade Wall.

[10:27] Team_046 possession (Score: 38-41)
Cade Wall drives, picks up Tracy Giddey. Help arrives from Collin Griffin! Cade Wall attempts a Layup. Wide open! Collin Griffin is 6.0 feet away. [MAN] Cade Wall misses. Rebound secured by Tyrese Williamson.

[10:09] Team_072 possession (Score: 38-41)
FOUL! Shooting foul on D'Angelo O'Neal. Wendell Anthony to the line for 2 free throws. [Team fouls: 1] (D'Angelo O'Neal: 1 personal fouls)   FT 1/2: GOOD   FT 2/2: MISS Wendell Anthony makes 1/2 from the line. Rebound secured by Kevin Allen.
Score: 39-41

[09:56] Team_046 possession (Score: 39-41)
D'Angelo O'Neal attempts a Midrange. Contested by Wendell Anthony (3.1 feet, ZONE). D'Angelo O'Neal misses. Rebound secured by Wendell Anthony.

[09:38] Team_072 possession (Score: 39-41)
FOUL! Reach-in foul on D'Angelo O'Neal during the drive. [Team fouls: 2] No free throws, side out. (D'Angelo O'Neal: 2 personal fouls)

[09:20] Team_072 possession (Score: 39-41)
Cade Poole makes the Layup and draws the foul on Kevin Allen! And-1! Cade Poole to the line for 1. [Team fouls: 3] (Kevin Allen: 1 personal fouls)   FT 1/1: GOOD Cade Poole makes 1/1 from the line.
Score: 42-41

[09:10] Team_046 possession (Score: 42-41)
Victor Nowitzki attempts a 3Pt. Wide open! Cade Poole is 6.2 feet away. [ZONE] Victor Nowitzki misses. Rebound secured by Tyrese Williamson.

[08:54] Team_072 possession (Score: 42-41)
Tracy Giddey drives to the basket... Tracy Giddey throws a bad pass out of bounds! TURNOVER! (dead ball)

[08:54] Substitution (Team_072): Collin Griffin OUT → Giannis Gobert IN (stamina_rule2)

[08:54] Substitution (Team_072): Cade Poole OUT → CJ Jokic IN (stamina_rule2)

[08:54] Substitution (Team_072): Wendell Anthony OUT → CJ Bane IN (stamina_rule2)

[08:54] Substitution (Team_072): Tracy Giddey OUT → Brandon Durant IN (stamina_rule2)

[08:54] Substitution (Team_072): Tyrese Williamson OUT → Stephen Holiday IN (stamina_rule2)

[08:54] Substitution (Team_046): D'Angelo O'Neal OUT → Collin Butler IN (stamina_rule2)

[08:54] Substitution (Team_046): Victor Nowitzki OUT → Manu Dosunmu IN (stamina_rule2)

[08:54] Substitution (Team_046): Lauri Carter OUT → Josh Barrett IN (stamina_rule2)

[08:54] Substitution (Team_046): Cade Wall OUT → Chris LaVine IN (stamina_rule2)

[08:54] Substitution (Team_046): Kevin Allen OUT → Paul DeRozan IN (stamina_rule2)

[08:44] Team_046 possession (Score: 42-41)
Paul DeRozan throws a bad pass! Stolen by Stephen Holiday! TURNOVER! (live ball)

[08:28] Team_072 possession (Score: 42-41)
Brandon Durant drives and kicks out. CJ Jokic attempts a Midrange. Contested by Manu Dosunmu (5.4 feet, MAN). CJ JOKIC MAKES IT!
Score: 44-41

[08:14] Team_046 possession (Score: 44-41)
FOUL! Shooting foul on Brandon Durant. Chris LaVine to the line for 2 free throws. [Team fouls: 2] (Brandon Durant: 1 personal fouls)   FT 1/2: GOOD   FT 2/2: GOOD Chris LaVine makes 2/2 from the line.
Score: 44-43

[08:00] Team_072 possession (Score: 44-43)
CJ Bane throws a bad pass! Stolen by Josh Barrett! TURNOVER! (live ball)

[07:47] Team_046 possession (Score: 44-43)
Josh Barrett attempts a Midrange. Contested by CJ Bane (4.2 feet, MAN). Josh Barrett misses. Rebound secured by Brandon Durant.

[07:32] Team_072 possession (Score: 44-43)
CJ Bane drives and kicks out. CJ Jokic attempts a 3Pt. Contested by Collin Butler (5.0 feet, ZONE). CJ JOKIC MAKES IT! Assist: CJ Bane
Score: 47-43

[07:15] Team_046 possession (Score: 47-43)
FOUL! Shooting foul on Stephen Holiday. Paul DeRozan to the line for 2 free throws. [Team fouls: 3] (Stephen Holiday: 1 personal fouls)   FT 1/2: GOOD   FT 2/2: GOOD Paul DeRozan makes 2/2 from the line.
Score: 47-45

[07:04] Team_072 possession (Score: 47-45)
Giannis Gobert drives to the basket... Giannis Gobert loses the ball! Stripped by Chris LaVine! TURNOVER! (live ball)

[06:50] Team_046 possession (Score: 47-45)
Paul DeRozan attempts a 3Pt. Contested by Giannis Gobert (3.7 feet, ZONE). Paul DeRozan misses. Rebound secured by CJ Jokic.

[06:37] Team_072 possession (Score: 47-45)
CJ Bane attempts a 3Pt. Contested by Chris LaVine (3.3 feet, ZONE). CJ Bane misses. Rebound secured by Manu Dosunmu.

[06:22] Team_046 possession (Score: 47-45)
FOUL! Shooting foul on Brandon Durant. Paul DeRozan to the line for 2 free throws. [Team fouls: 4] (Brandon Durant: 2 personal fouls)   FT 1/2: MISS   FT 2/2: GOOD Paul DeRozan makes 1/2 from the line.
Score: 47-46

[06:05] Team_072 possession (Score: 47-46)
CJ Jokic attempts a 3Pt. Contested by Collin Butler (2.4 feet, ZONE). CJ Jokic misses. Rebound secured by Manu Dosunmu.

[05:49] Team_046 possession (Score: 47-46)
Manu Dosunmu drives and kicks out. Josh Barrett attempts a Midrange. Contested by CJ Bane (3.0 feet, MAN). Josh Barrett misses. Offensive rebound by Chris LaVine! Chris LaVine kicks it out.

[05:38] Team_046 possession (Score: 47-46)
Paul DeRozan attempts a Layup. Contested by Stephen Holiday (5.3 feet, ZONE). PAUL DEROZAN MAKES IT!
Score: 47-48

[05:28] Team_072 possession (Score: 47-48)
Brandon Durant attempts a Layup. Contested by Chris LaVine (5.2 feet, ZONE). BRANDON DURANT MAKES IT!
Score: 49-48

[05:14] Team_046 possession (Score: 49-48)
Collin Butler attempts a 3Pt. Contested by Giannis Gobert (6.0 feet, MAN). COLLIN BUTLER MAKES IT! Assist: Manu Dosunmu
Score: 49-51

[04:59] Team_072 possession (Score: 49-51)
Giannis Gobert drives to the basket... Giannis Gobert throws a bad pass out of bounds! TURNOVER! (dead ball)

[04:43] Team_046 possession (Score: 49-51)
Paul DeRozan drives, picks up Stephen Holiday. Help arrives from Giannis Gobert! Paul DeRozan attempts a Dunk. Contested by Giannis Gobert (4.5 feet, ZONE). Paul DeRozan misses. Rebound secured by Brandon Durant.

[04:29] Team_072 possession (Score: 49-51)
CJ Jokic attempts a 3Pt. Contested by Manu Dosunmu (3.0 feet, MAN). CJ Jokic misses. Rebound secured by Paul DeRozan.

[04:19] Team_046 possession (Score: 49-51)
Paul DeRozan loses control! Ball rolls out of bounds! TURNOVER! (dead ball)

[04:06] Team_072 possession (Score: 49-51)
FOUL! Shooting foul on Manu Dosunmu. CJ Jokic to the line for 2 free throws. [Team fouls: 4] (Manu Dosunmu: 1 personal fouls)   FT 1/2: GOOD   FT 2/2: GOOD CJ Jokic makes 2/2 from the line.
Score: 51-51

[03:50] Team_046 possession (Score: 51-51)
Manu Dosunmu attempts a Midrange. Contested by CJ Jokic (2.7 feet, MAN). Manu Dosunmu misses. Rebound secured by Brandon Durant.

[03:32] Team_072 possession (Score: 51-51)
CJ Bane attempts a 3Pt. Contested by Collin Butler (3.6 feet, ZONE). CJ Bane misses. Rebound secured by Manu Dosunmu.

[03:19] Team_046 possession (Score: 51-51)
Josh Barrett makes the Layup and draws the foul on CJ Bane! And-1! Josh Barrett to the line for 1. [BONUS: 5 team fouls] (CJ Bane: 1 personal fouls)   FT 1/1: GOOD Josh Barrett makes 1/1 from the line.
Score: 51-54

[03:02] Team_072 possession (Score: 51-54)
Giannis Gobert attempts a Layup. Wide open! Collin Butler is 7.3 feet away. [MAN] GIANNIS GOBERT MAKES IT! Assist: Stephen Holiday
Score: 53-54

[02:47] Team_046 possession (Score: 53-54)
Chris LaVine attempts a Midrange. Contested by Giannis Gobert (3.8 feet, ZONE). Chris LaVine misses. Rebound secured by Stephen Holiday.

[02:32] Team_072 possession (Score: 53-54)
Brandon Durant attempts a Midrange. Wide open! Josh Barrett is 6.0 feet away. [ZONE] BRANDON DURANT MAKES IT! Assist: CJ Jokic
Score: 55-54

[02:19] Team_046 possession (Score: 55-54)
FOUL! Shooting foul on CJ Bane. Josh Barrett to the line for 2 free throws. [BONUS: 6 team fouls] (CJ Bane: 2 personal fouls)   FT 1/2: GOOD   FT 2/2: GOOD Josh Barrett makes 2/2 from the line.
Score: 55-56

[02:03] Team_072 possession (Score: 55-56)
CJ Jokic attempts a 3Pt. Contested by Manu Dosunmu (4.2 feet, MAN). CJ JOKIC MAKES IT! Assist: Brandon Durant
Score: 58-56

[01:47] Team_046 possession (Score: 58-56)
Chris LaVine attempts a Midrange. Wide open! CJ Jokic is 8.1 feet away. [ZONE] CHRIS LAVINE MAKES IT! Assist: Josh Barrett
Score: 58-58

[01:33] Team_072 possession (Score: 58-58)
FOUL! Holding foul on Collin Butler. [IN THE BONUS! 5 team fouls] Giannis Gobert to the line for 2 free throws. (Collin Butler: 1 personal fouls)   FT 1/2: GOOD   FT 2/2: MISS Giannis Gobert makes 1/2 from the line. FOUL! Loose ball foul on Chris LaVine during the free throw rebound! [IN THE BONUS! 6 team fouls] Stephen Holiday to the line for 2 free throws. (Chris LaVine: 1 personal fouls)   FT 1/2: GOOD   FT 2/2: GOOD Stephen Holiday makes 2/2 from the line.
Score: 61-58

[01:21] Team_046 possession (Score: 61-58)
Collin Butler drives to the basket... FOUL! Offensive foul on Collin Butler! Giannis Gobert drew the charge! [Team fouls: 7] (Collin Butler: 2 personal fouls) TURNOVER! (dead ball)

[01:10] Team_072 possession (Score: 61-58)
Giannis Gobert attempts a 3Pt. Contested by Collin Butler (2.5 feet, ZONE). Giannis Gobert misses. Rebound secured by Paul DeRozan.

[00:53] Team_046 possession (Score: 61-58)
Josh Barrett throws a bad pass out of bounds! TURNOVER! (dead ball)

[00:40] Team_072 possession (Score: 61-58)
Stephen Holiday drives to the basket... Stephen Holiday commits a violation (traveling/carry)! TURNOVER! (dead ball)

[00:28] Team_046 possession (Score: 61-58)
Manu Dosunmu attempts a Layup. Contested by CJ Jokic (3.3 feet, MAN). Manu Dosunmu misses. Rebound secured by Brandon Durant.

[00:11] Team_072 possession (Score: 61-58)
CJ Jokic attempts a 3Pt. Contested by Collin Butler (4.6 feet, ZONE). CJ JOKIC MAKES IT! Assist: Brandon Durant
Score: 64-58

================================================================================
                              2ND QUARTER COMPLETE                              
================================================================================

2ND QUARTER SCORE: Team_072 28, Team_046 19

BOX SCORE:
================================================================================

Team_072
--------------------------------------------------------------------------------
Player                MIN  PTS  REB  AST  TO      FG   FG%      3P   3P%
--------------------------------------------------------------------------------
CJ Jokic                9   13    1    1   0   5/7    71.4     0/0   0.0
Brandon Durant          9    4    4    2   0   2/2   100.0     0/0   0.0
Cade Poole             15    3    0    1   0   1/2    50.0     0/0   0.0
Stephen Holiday         9    3    1    1   0   1/1   100.0     0/0   0.0
Tracy Giddey           15    2    0    0   0   1/2    50.0     0/0   0.0
Giannis Gobert          9    2    0    0   0   1/2    50.0     0/0   0.0
Wendell Anthony        15    0    2    0   0   0/1     0.0     0/0   0.0
Tyrese Williamson      15    0    2    0   0   0/0     0.0     0/0   0.0
CJ Bane                 9    0    0    1   0   0/2     0.0     0/0   0.0

TEAM: FG: 11/19 (57.9%), 3PT: 2/9 (22.2%), REB: 10 (0 off, 10 def), AST: 6, TO: 5
TEAM FOULS: 6 [Team_046 in BONUS]


Team_046
--------------------------------------------------------------------------------
Player                MIN  PTS  REB  AST  TO      FG   FG%      3P   3P%
--------------------------------------------------------------------------------
Josh Barrett            9    5    0    1   0   2/3    66.7     0/0   0.0
Paul DeRozan            9    5    2    0   0   3/5    60.0     0/0   0.0
Chris LaVine            9    4    1    0   0   2/3    66.7     0/0   0.0
Collin Butler           9    3    0    0   0   1/1   100.0     0/0   0.0
Victor Nowitzki        15    2    0    0   0   1/2    50.0     0/0   0.0
Cade Wall              15    0    3    0   0   0/2     0.0     0/0   0.0
Kevin Allen            15    0    1    0   0   0/0     0.0     0/0   0.0
D'Angelo O'Neal        15    0    0    0   0   0/1     0.0     0/0   0.0
Manu Dosunmu            9    0    3    1   0   0/2     0.0     0/0   0.0

TEAM: FG: 9/19 (47.4%), 3PT: 1/4 (25.0%), REB: 10 (2 off, 8 def), AST: 2, TO: 4
TEAM FOULS: 7 [Team_072 in BONUS]

================================================================================

================================================================================
                       3RD QUARTER - Team_072 vs Team_046                       
================================================================================

[12:00] Team_072 possession (Score: 64-58)
Wendell Anthony attempts a Midrange. Contested by Lauri Carter (2.7 feet, MAN). WENDELL ANTHONY MAKES IT!
Score: 66-58

[11:44] Team_046 possession (Score: 66-58)
D'Angelo O'Neal attempts a 3Pt. Contested by Collin Griffin (3.0 feet, MAN). D'Angelo O'Neal misses. Rebound secured by Tracy Giddey.

[11:25] Team_072 possession (Score: 66-58)
Wendell Anthony attempts a 3Pt. Heavily contested by Lauri Carter (0.8 feet, MAN)! Wendell Anthony misses. Rebound secured by Lauri Carter.

[11:10] Team_046 possession (Score: 66-58)
Lauri Carter attempts a 3Pt. Contested by Cade Poole (4.1 feet, ZONE). LAURI CARTER MAKES IT!
Score: 66-61

[10:56] Team_072 possession (Score: 66-61)
Tracy Giddey drives, Kevin Allen stays with him. Tracy Giddey attempts a Dunk. Wide open! Kevin Allen is 7.3 feet away. [ZONE] TRACY GIDDEY MAKES IT!
Score: 68-61

[10:39] Team_046 possession (Score: 68-61)
Victor Nowitzki attempts a 3Pt. Contested by Cade Poole (4.3 feet, MAN). VICTOR NOWITZKI MAKES IT! Assist: D'Angelo O'Neal
Score: 68-64

[10:26] Team_072 possession (Score: 68-64)
FOUL! Reach-in foul on Lauri Carter during the drive. [Team fouls: 1] No free throws, side out. (Lauri Carter: 1 personal fouls)

[10:14] Team_072 possession (Score: 68-64)
FOUL! Holding foul on Lauri Carter. [Team fouls: 2] No free throws, side out. (Lauri Carter: 2 personal fouls)

[10:01] Team_072 possession (Score: 68-64)
Tracy Giddey attempts a Midrange. Contested by Lauri Carter (4.4 feet, ZONE). TRACY GIDDEY MAKES IT! Assist: Collin Griffin
Score: 70-64

[09:44] Team_046 possession (Score: 70-64)
Lauri Carter attempts a 3Pt. Contested by Cade Poole (5.6 feet, ZONE). LAURI CARTER MAKES IT! Assist: Cade Wall
Score: 70-67

[09:28] Team_072 possession (Score: 70-67)
Tracy Giddey attempts a Midrange. Heavily contested by D'Angelo O'Neal (0.5 feet, ZONE)! TRACY GIDDEY MAKES IT! Assist: Collin Griffin
Score: 72-67

[09:13] Team_046 possession (Score: 72-67)
Lauri Carter attempts a 3Pt. Wide open! Cade Poole is 7.7 feet away. [ZONE] LAURI CARTER MAKES IT! Assist: D'Angelo O'Neal
Score: 72-70

[09:02] Team_072 possession (Score: 72-70)
Cade Poole attempts a 3Pt. Contested by Lauri Carter (3.3 feet, ZONE). Cade Poole misses. Rebound secured by Lauri Carter.

[08:45] Team_046 possession (Score: 72-70)
Victor Nowitzki drives, Tyrese Williamson stays with him. Victor Nowitzki attempts a Layup. Heavily contested by Tyrese Williamson (1.7 feet, ZONE)! VICTOR NOWITZKI MAKES IT! Assist: Lauri Carter
Score: 72-72

[08:35] Team_072 possession (Score: 72-72)
Tracy Giddey attempts a 3Pt. Wide open! Cade Wall is 6.2 feet away. [MAN] Tracy Giddey misses. Rebound secured by Kevin Allen.

[08:19] Team_046 possession (Score: 72-72)
Cade Wall makes the Midrange and draws the foul on Tracy Giddey! And-1! Cade Wall to the line for 1. [Team fouls: 1] (Tracy Giddey: 1 personal fouls)   FT 1/1: GOOD Cade Wall makes 1/1 from the line.
Score: 72-75

[08:04] Team_072 possession (Score: 72-75)
Cade Poole attempts a 3Pt. Heavily contested by Lauri Carter (1.6 feet, ZONE)! CADE POOLE MAKES IT! Assist: Wendell Anthony
Score: 75-75

[07:50] Team_046 possession (Score: 75-75)
Victor Nowitzki attempts a 3Pt. Contested by Cade Poole (4.5 feet, MAN). Victor Nowitzki misses. Rebound secured by Tyrese Williamson.

[07:38] Team_072 possession (Score: 75-75)
Cade Poole drives and kicks out. Tyrese Williamson attempts a 3Pt. Contested by Kevin Allen (2.3 feet, MAN). Tyrese Williamson misses. Rebound secured by Lauri Carter.

[07:23] Team_046 possession (Score: 75-75)
D'Angelo O'Neal attempts a Midrange. Contested by Cade Poole (5.7 feet, ZONE). D'ANGELO O'NEAL MAKES IT!
Score: 75-77

[07:05] Team_072 possession (Score: 75-77)
Tracy Giddey drives, Cade Wall stays with him. Tracy Giddey attempts a Layup. Contested by Cade Wall (3.0 feet, MAN). TRACY GIDDEY MAKES IT!
Score: 77-77

[06:55] Team_046 possession (Score: 77-77)
FOUL! Holding foul on Wendell Anthony. [Team fouls: 2] No free throws, side out. (Wendell Anthony: 1 personal fouls)

[06:41] Team_046 possession (Score: 77-77)
D'Angelo O'Neal drives, Collin Griffin stays with him. D'Angelo O'Neal attempts a Layup. Wide open! Collin Griffin is 6.5 feet away. [MAN] D'ANGELO O'NEAL MAKES IT! Assist: Lauri Carter
Score: 77-79

[06:25] Team_072 possession (Score: 77-79)
Cade Poole drives, Victor Nowitzki stays with him. Cade Poole attempts a Dunk. Wide open! Victor Nowitzki is 6.8 feet away. [MAN] CADE POOLE MAKES IT!
Score: 79-79

[06:07] Team_046 possession (Score: 79-79)
FOUL! Holding foul on Tracy Giddey. [Team fouls: 3] No free throws, side out. (Tracy Giddey: 2 personal fouls)

[05:49] Team_046 possession (Score: 79-79)
Kevin Allen attempts a Midrange. Contested by Tyrese Williamson (3.5 feet, MAN). KEVIN ALLEN MAKES IT!
Score: 79-81

[05:31] Team_072 possession (Score: 79-81)
Collin Griffin attempts a 3Pt. Heavily contested by Lauri Carter (1.8 feet, ZONE)! Collin Griffin misses. Rebound secured by Kevin Allen.

[05:19] Team_046 possession (Score: 79-81)
D'Angelo O'Neal drives, Collin Griffin stays with him. D'Angelo O'Neal attempts a Dunk. Wide open! Collin Griffin is 7.2 feet away. [MAN] D'ANGELO O'NEAL MAKES IT! Assist: Kevin Allen
Score: 79-83

[05:03] Team_072 possession (Score: 79-83)
Tracy Giddey attempts a Midrange. Contested by Kevin Allen (2.9 feet, ZONE). Tracy Giddey misses. FOUL! Loose ball foul on Kevin Allen during the rebound battle. [Team fouls: 3] No free throws, side out. (Kevin Allen: 1 personal fouls)

[04:50] Team_072 possession (Score: 79-83)
Collin Griffin attempts a Midrange. Contested by D'Angelo O'Neal (3.1 feet, MAN). COLLIN GRIFFIN MAKES IT! Assist: Tyrese Williamson
Score: 81-83

[04:32] Team_046 possession (Score: 81-83)
D'Angelo O'Neal drives to the basket... FOUL! Offensive foul on D'Angelo O'Neal! Tyrese Williamson drew the charge! [Team fouls: 4] (D'Angelo O'Neal: 1 personal fouls) TURNOVER! (dead ball)

[04:14] Team_072 possession (Score: 81-83)
FOUL! Reach-in foul on Lauri Carter during the drive. [IN THE BONUS! 5 team fouls] Wendell Anthony to the line for 2 free throws. (Lauri Carter: 3 personal fouls)   FT 1/2: GOOD   FT 2/2: GOOD Wendell Anthony makes 2/2 from the line.
Score: 83-83

[04:00] Team_046 possession (Score: 83-83)
Victor Nowitzki drives, picks up Tyrese Williamson. Help arrives from Collin Griffin! Victor Nowitzki attempts a Dunk. Contested by Collin Griffin (3.0 feet, ZONE). VICTOR NOWITZKI MAKES IT! Assist: Lauri Carter
Score: 83-85

[03:46] Team_072 possession (Score: 83-85)
Collin Griffin attempts a Midrange. Contested by D'Angelo O'Neal (5.3 feet, MAN). Collin Griffin misses. Offensive rebound by Tyrese Williamson! Tyrese Williamson kicks it out.

[03:32] Team_072 possession (Score: 83-85)
Tyrese Williamson drives, picks up Kevin Allen. Help arrives from D'Angelo O'Neal! Tyrese Williamson attempts a Dunk. Contested by D'Angelo O'Neal (4.6 feet, MAN). TYRESE WILLIAMSON MAKES IT! Assist: Tracy Giddey
Score: 85-85

[03:17] Team_046 possession (Score: 85-85)
FOUL! Shooting foul on Tyrese Williamson. Victor Nowitzki to the line for 2 free throws. [Team fouls: 4] (Tyrese Williamson: 1 personal fouls)   FT 1/2: GOOD   FT 2/2: GOOD Victor Nowitzki makes 2/2 from the line.
Score: 85-87

[03:01] Team_072 possession (Score: 85-87)
Tyrese Williamson drives, Kevin Allen stays with him. Tyrese Williamson attempts a Dunk. Wide open! Kevin Allen is 9.8 feet away. [MAN] TYRESE WILLIAMSON MAKES IT! Assist: Tracy Giddey
Score: 87-87

[02:47] Team_046 possession (Score: 87-87)
Victor Nowitzki drives to the basket... Victor Nowitzki loses the ball! Stripped by Tyrese Williamson! TURNOVER! (live ball)

[02:32] Team_072 possession (Score: 87-87)
FOUL! Holding foul on Kevin Allen. [IN THE BONUS! 6 team fouls] Tyrese Williamson to the line for 2 free throws. (Kevin Allen: 2 personal fouls)   FT 1/2: MISS   FT 2/2: GOOD Tyrese Williamson makes 1/2 from the line.
Score: 88-87

[02:23] Team_046 possession (Score: 88-87)
Lauri Carter attempts a Midrange. Contested by Wendell Anthony (3.6 feet, MAN). LAURI CARTER MAKES IT! Assist: Victor Nowitzki
Score: 88-89

[02:07] Team_072 possession (Score: 88-89)
FOUL! Shooting foul on Lauri Carter. Collin Griffin to the line for 2 free throws. [BONUS: 7 team fouls] (Lauri Carter: 4 personal fouls)   FT 1/2: GOOD   FT 2/2: GOOD Collin Griffin makes 2/2 from the line.
Score: 90-89

[01:48] Team_046 possession (Score: 90-89)
D'Angelo O'Neal drives, Collin Griffin stays with him. D'Angelo O'Neal attempts a Layup. Contested by Collin Griffin (5.3 feet, MAN). D'Angelo O'Neal misses. Offensive rebound by Cade Wall! Cade Wall kicks it out.

[01:32] Team_046 possession (Score: 90-89)
Victor Nowitzki attempts a 3Pt. Contested by Cade Poole (3.3 feet, MAN). Victor Nowitzki misses. Offensive rebound by Cade Wall! Cade Wall kicks it out.

[01:13] Team_046 possession (Score: 90-89)
FOUL! Shooting foul on Tyrese Williamson. Lauri Carter to the line for 2 free throws. [BONUS: 5 team fouls] (Tyrese Williamson: 2 personal fouls)   FT 1/2: GOOD   FT 2/2: MISS Lauri Carter makes 1/2 from the line. Offensive rebound by Cade Wall! Cade Wall kicks it out.
Score: 90-90

[01:00] Team_046 possession (Score: 90-90)
FOUL! Shooting foul on Cade Poole. Lauri Carter to the line for 2 free throws. [BONUS: 6 team fouls] (Cade Poole: 1 personal fouls)   FT 1/2: GOOD   FT 2/2: GOOD Lauri Carter makes 2/2 from the line.
Score: 90-92

[00:47] Team_072 possession (Score: 90-92)
Tracy Giddey attempts a 3Pt. Wide open! Cade Wall is 6.9 feet away. [MAN] Tracy Giddey misses. Rebound secured by Lauri Carter.

[00:33] Team_046 possession (Score: 90-92)
FOUL! Reach-in foul on Tyrese Williamson during the drive. [IN THE BONUS! 7 team fouls] Kevin Allen to the line for 2 free throws. (Tyrese Williamson: 3 personal fouls)   FT 1/2: GOOD   FT 2/2: GOOD Kevin Allen makes 2/2 from the line.
Score: 90-94

[00:23] Team_072 possession (Score: 90-94)
Cade Poole attempts a Midrange. Contested by Lauri Carter (4.2 feet, ZONE). CADE POOLE MAKES IT! Assist: Collin Griffin
Score: 92-94

[00:08] Team_046 possession (Score: 92-94)
Victor Nowitzki attempts a Layup. Contested by Cade Poole (5.1 feet, MAN). Victor Nowitzki misses. Rebound secured by Tyrese Williamson.

================================================================================
                              3RD QUARTER COMPLETE                              
================================================================================

3RD QUARTER SCORE: Team_072 28, Team_046 36

BOX SCORE:
================================================================================

Team_072
--------------------------------------------------------------------------------
Player                MIN  PTS  REB  AST  TO      FG   FG%      3P   3P%
--------------------------------------------------------------------------------
Tracy Giddey           28    8    2    2   0   4/6    66.7     0/0   0.0
Cade Poole             28    7    0    0   0   3/5    60.0     0/0   0.0
Tyrese Williamson      28    5    3    1   0   3/3   100.0     0/0   0.0
Wendell Anthony        28    4    0    1   0   2/3    66.7     0/0   0.0
Collin Griffin         28    4    0    3   0   2/3    66.7     0/0   0.0

TEAM: FG: 14/20 (70.0%), 3PT: 1/6 (16.7%), REB: 5 (2 off, 3 def), AST: 7, TO: 0
TEAM FOULS: 7 [Team_046 in BONUS]


Team_046
--------------------------------------------------------------------------------
Player                MIN  PTS  REB  AST  TO      FG   FG%      3P   3P%
--------------------------------------------------------------------------------
Lauri Carter           28   13    4    3   0   5/5   100.0     0/0   0.0
Victor Nowitzki        28    9    0    1   0   4/6    66.7     0/0   0.0
D'Angelo O'Neal        28    6    0    2   0   3/4    75.0     0/0   0.0
Kevin Allen            28    4    2    1   0   2/2   100.0     0/0   0.0
Cade Wall              28    3    3    1   0   1/1   100.0     0/0   0.0

TEAM: FG: 15/18 (83.3%), 3PT: 4/6 (66.7%), REB: 9 (3 off, 6 def), AST: 8, TO: 2
TEAM FOULS: 7 [Team_072 in BONUS]

================================================================================

================================================================================
                       4TH QUARTER - Team_072 vs Team_046                       
================================================================================

[12:00] Team_072 possession (Score: 92-94)
Tracy Giddey attempts a Layup. BLOCKED BY KEVIN ALLEN! Ball is loose! Rebound secured by Lauri Carter.

[11:47] Team_046 possession (Score: 92-94)
Cade Wall attempts a Midrange. Contested by Tracy Giddey (2.4 feet, MAN). CADE WALL MAKES IT!
Score: 92-96

[11:34] Team_072 possession (Score: 92-96)
Cade Poole attempts a Midrange. BLOCKED BY VICTOR NOWITZKI! Ball is loose! Offensive rebound by Tracy Giddey! Tracy Giddey kicks it out.

[11:21] Team_072 possession (Score: 92-96)
Wendell Anthony drives to the basket... FOUL! Offensive foul on Wendell Anthony! Kevin Allen drew the charge! [Team fouls: 1] (Wendell Anthony: 1 personal fouls) TURNOVER! (dead ball)

[11:09] Team_046 possession (Score: 92-96)
D'Angelo O'Neal drives to the basket... D'Angelo O'Neal loses control! Ball rolls out of bounds! TURNOVER! (dead ball)

[11:09] Substitution (Team_072): Collin Griffin OUT → Giannis Gobert IN (stamina_rule2)

[11:09] Substitution (Team_072): Cade Poole OUT → CJ Jokic IN (stamina_rule2)

[11:09] Substitution (Team_072): Wendell Anthony OUT → CJ Bane IN (stamina_rule2)

[11:09] Substitution (Team_072): Tracy Giddey OUT → Brandon Durant IN (stamina_rule2)

[11:09] Substitution (Team_072): Tyrese Williamson OUT → Stephen Holiday IN (stamina_rule2)

[11:09] Substitution (Team_046): D'Angelo O'Neal OUT → Collin Butler IN (stamina_rule2)

[11:09] Substitution (Team_046): Victor Nowitzki OUT → Manu Dosunmu IN (stamina_rule2)

[11:09] Substitution (Team_046): Lauri Carter OUT → Josh Barrett IN (stamina_rule2)

[11:09] Substitution (Team_046): Cade Wall OUT → Chris LaVine IN (stamina_rule2)

[11:09] Substitution (Team_046): Kevin Allen OUT → Paul DeRozan IN (stamina_rule2)

[10:57] Team_072 possession (Score: 92-96)
CJ Bane drives to the basket... CJ Bane throws a bad pass! Stolen by Josh Barrett! TURNOVER! (live ball)

[10:45] Team_046 possession (Score: 92-96)
Josh Barrett loses control! Ball rolls out of bounds! TURNOVER! (dead ball)

[10:34] Team_072 possession (Score: 92-96)
Brandon Durant attempts a Layup. BLOCKED BY CHRIS LAVINE! Ball is loose! Rebound secured by Chris LaVine.

[10:21] Team_046 possession (Score: 92-96)
Manu Dosunmu attempts a 3Pt. Wide open! CJ Bane is 7.3 feet away. [ZONE] Manu Dosunmu misses. Rebound secured by Stephen Holiday.

[10:03] Team_072 possession (Score: 92-96)
FOUL! Reach-in foul on Paul DeRozan during the drive. [Team fouls: 2] No free throws, side out. (Paul DeRozan: 1 personal fouls)

[09:48] Team_072 possession (Score: 92-96)
FOUL! Offensive foul on Giannis Gobert! Collin Butler drew the charge! [Team fouls: 2] (Giannis Gobert: 1 personal fouls) TURNOVER! (dead ball)

[09:34] Team_046 possession (Score: 92-96)
Collin Butler attempts a Layup. BLOCKED BY CJ BANE! Ball is loose! Offensive rebound by Chris LaVine! Chris LaVine kicks it out.

[09:19] Team_046 possession (Score: 92-96)
Josh Barrett makes the Layup and draws the foul on CJ Bane! And-1! Josh Barrett to the line for 1. [Team fouls: 3] (CJ Bane: 1 personal fouls)   FT 1/1: GOOD Josh Barrett makes 1/1 from the line.
Score: 92-99

[09:05] Team_072 possession (Score: 92-99)
Stephen Holiday throws a bad pass! Stolen by Chris LaVine! TURNOVER! (live ball)

[08:51] Team_046 possession (Score: 92-99)
Josh Barrett drives and kicks out. Paul DeRozan attempts a Midrange. Contested by Brandon Durant (3.7 feet, ZONE). Paul DeRozan misses. Offensive rebound by Paul DeRozan! Paul DeRozan puts it back in!
Score: 92-101

[08:33] Team_072 possession (Score: 92-101)
CJ Bane attempts a Midrange. Wide open! Josh Barrett is 6.6 feet away. [ZONE] CJ Bane misses. Rebound secured by Chris LaVine.

[08:18] Team_046 possession (Score: 92-101)
Manu Dosunmu attempts a 3Pt. Contested by Giannis Gobert (4.5 feet, ZONE). Manu Dosunmu misses. Rebound secured by Stephen Holiday.

[08:06] Team_072 possession (Score: 92-101)
Brandon Durant attempts a 3Pt. Wide open! Chris LaVine is 6.6 feet away. [ZONE] BRANDON DURANT MAKES IT! Assist: CJ Jokic
Score: 95-101

[07:49] Team_046 possession (Score: 95-101)
Collin Butler drives, Giannis Gobert stays with him. Collin Butler attempts a Dunk. Contested by Giannis Gobert (5.2 feet, MAN). COLLIN BUTLER MAKES IT! Assist: Paul DeRozan
Score: 95-103

[07:31] Team_072 possession (Score: 95-103)
Brandon Durant drives and kicks out. CJ Jokic attempts a 3Pt. Wide open! Manu Dosunmu is 9.1 feet away. [MAN] CJ Jokic misses. Rebound secured by Manu Dosunmu.

[07:20] Team_046 possession (Score: 95-103)
Chris LaVine drives, picks up Stephen Holiday. Help arrives from Giannis Gobert! Chris LaVine attempts a Layup. Wide open! Giannis Gobert is 7.0 feet away. [ZONE] Chris LaVine misses. FOUL! Loose ball foul on CJ Jokic during the rebound battle. [Team fouls: 4] No free throws, side out. (CJ Jokic: 1 personal fouls)

[07:00] Team_046 possession (Score: 95-103)
FOUL! Reach-in foul on Stephen Holiday during the drive. [IN THE BONUS! 5 team fouls] Josh Barrett to the line for 2 free throws. (Stephen Holiday: 1 personal fouls)   FT 1/2: GOOD   FT 2/2: GOOD Josh Barrett makes 2/2 from the line.
Score: 95-105

[06:47] Team_072 possession (Score: 95-105)
FOUL! Reach-in foul on Chris LaVine during the drive. [Team fouls: 3] No free throws, side out. (Chris LaVine: 1 personal fouls)

[06:32] Team_072 possession (Score: 95-105)
CJ Bane attempts a 3Pt. Heavily contested by Collin Butler (1.8 feet, ZONE)! CJ Bane misses. Rebound secured by Manu Dosunmu.

[06:20] Team_046 possession (Score: 95-105)
Chris LaVine attempts a Layup. BLOCKED BY STEPHEN HOLIDAY! Ball is loose! Offensive rebound by Paul DeRozan! Paul DeRozan kicks it out.

[06:07] Team_046 possession (Score: 95-105)
FOUL! Holding foul on Brandon Durant. [IN THE BONUS! 6 team fouls] Chris LaVine to the line for 2 free throws. (Brandon Durant: 1 personal fouls)   FT 1/2: MISS   FT 2/2: MISS Chris LaVine makes 0/2 from the line. Rebound secured by Stephen Holiday.

[05:54] Team_072 possession (Score: 95-105)
Brandon Durant attempts a Midrange. Contested by Chris LaVine (4.6 feet, MAN). Brandon Durant misses. Rebound secured by Manu Dosunmu.

[05:43] Team_046 possession (Score: 95-105)
Manu Dosunmu attempts a 3Pt. Contested by Giannis Gobert (2.4 feet, ZONE). MANU DOSUNMU MAKES IT! Assist: Josh Barrett
Score: 95-108

[05:31] Team_072 possession (Score: 95-108)
Brandon Durant attempts a 3Pt. Contested by Collin Butler (2.6 feet, ZONE). Brandon Durant misses. Rebound secured by Manu Dosunmu.

[05:14] Team_046 possession (Score: 95-108)
Collin Butler attempts a 3Pt. Heavily contested by Giannis Gobert (1.3 feet, MAN)! Collin Butler misses. Rebound secured by Stephen Holiday.

[05:03] Team_072 possession (Score: 95-108)
CJ Jokic attempts a Layup. BLOCKED BY MANU DOSUNMU! Ball is loose! Offensive rebound by Stephen Holiday! Stephen Holiday kicks it out.

[04:53] Team_072 possession (Score: 95-108)
CJ Jokic makes the Midrange and draws the foul on Manu Dosunmu! And-1! CJ Jokic to the line for 1. [Team fouls: 4] (Manu Dosunmu: 1 personal fouls)   FT 1/1: GOOD CJ Jokic makes 1/1 from the line.
Score: 98-108

[04:37] Team_046 possession (Score: 98-108)
Paul DeRozan makes the Dunk and draws the foul on Stephen Holiday! And-1! Paul DeRozan to the line for 1. [BONUS: 7 team fouls] (Stephen Holiday: 2 personal fouls)   FT 1/1: GOOD Paul DeRozan makes 1/1 from the line.
Score: 98-111

[04:22] Team_072 possession (Score: 98-111)
CJ Jokic attempts a 3Pt. Contested by Collin Butler (5.8 feet, ZONE). CJ JOKIC MAKES IT! Assist: Giannis Gobert
Score: 101-111

[04:10] Team_046 possession (Score: 101-111)
Collin Butler attempts a 3Pt. Wide open! Giannis Gobert is 7.9 feet away. [MAN] COLLIN BUTLER MAKES IT! Assist: Josh Barrett
Score: 101-114

[03:57] Team_072 possession (Score: 101-114)
Brandon Durant attempts a Midrange. Contested by Chris LaVine (3.3 feet, MAN). Brandon Durant misses. Offensive rebound by Brandon Durant! Brandon Durant kicks it out.

[03:43] Team_072 possession (Score: 101-114)
Giannis Gobert attempts a Midrange. Heavily contested by Collin Butler (1.6 feet, MAN)! GIANNIS GOBERT MAKES IT! Assist: CJ Jokic
Score: 103-114

[03:30] Team_046 possession (Score: 103-114)
FOUL! Holding foul on CJ Bane. [IN THE BONUS! 8 team fouls] Josh Barrett to the line for 2 free throws. (CJ Bane: 2 personal fouls)   FT 1/2: GOOD   FT 2/2: GOOD Josh Barrett makes 2/2 from the line.
Score: 103-116

[03:18] Team_072 possession (Score: 103-116)
Giannis Gobert attempts a 3Pt. Heavily contested by Collin Butler (1.4 feet, ZONE)! Giannis Gobert misses. Rebound secured by Paul DeRozan.

[03:07] Team_046 possession (Score: 103-116)
Josh Barrett attempts a Layup. Wide open! CJ Bane is 8.0 feet away. [MAN] JOSH BARRETT MAKES IT!
Score: 103-118

[02:51] Team_072 possession (Score: 103-118)
CJ Bane attempts a Midrange. Contested by Josh Barrett (6.0 feet, MAN). CJ BANE MAKES IT! Assist: Brandon Durant
Score: 105-118

[02:35] Team_046 possession (Score: 105-118)
Paul DeRozan attempts a Midrange. Wide open! Stephen Holiday is 8.6 feet away. [MAN] PAUL DEROZAN MAKES IT! Assist: Josh Barrett
Score: 105-120

[02:21] Team_072 possession (Score: 105-120)
CJ Bane attempts a 3Pt. Heavily contested by Collin Butler (1.9 feet, ZONE)! CJ Bane misses. Rebound secured by Paul DeRozan.

[02:07] Team_046 possession (Score: 105-120)
Collin Butler attempts a 3Pt. Contested by Giannis Gobert (5.0 feet, ZONE). COLLIN BUTLER MAKES IT! Assist: Manu Dosunmu
Score: 105-123

[01:54] Team_072 possession (Score: 105-123)
CJ Bane drives, picks up Josh Barrett. Help arrives from Manu Dosunmu! CJ Bane attempts a Layup. Wide open! Manu Dosunmu is 7.1 feet away. [MAN] CJ BANE MAKES IT! Assist: Giannis Gobert
Score: 107-123

[01:39] Team_046 possession (Score: 107-123)
Collin Butler attempts a 3Pt. Wide open! Giannis Gobert is 9.3 feet away. [MAN] Collin Butler misses. Rebound secured by Brandon Durant.

[01:23] Team_072 possession (Score: 107-123)
CJ Bane attempts a Midrange. Contested by Josh Barrett (3.6 feet, MAN). CJ BANE MAKES IT! Assist: CJ Jokic
Score: 109-123

[01:09] Team_046 possession (Score: 109-123)
Paul DeRozan attempts a 3Pt. Contested by Giannis Gobert (4.2 feet, ZONE). Paul DeRozan misses. Rebound secured by Stephen Holiday.

[00:58] Team_072 possession (Score: 109-123)
Brandon Durant drives to the basket... Brandon Durant loses control! Ball rolls out of bounds! TURNOVER! (dead ball)

[00:46] Team_046 possession (Score: 109-123)
Paul DeRozan loses control! Ball rolls out of bounds! TURNOVER! (dead ball)

[00:35] Team_072 possession (Score: 109-123)
Giannis Gobert drives to the basket... Giannis Gobert loses the ball! Stripped by Collin Butler! TURNOVER! (live ball)

[00:18] Team_046 possession (Score: 109-123)
FOUL! Offensive foul on Collin Butler! Giannis Gobert drew the charge! [Team fouls: 5] (Collin Butler: 1 personal fouls) TURNOVER! (dead ball)

[00:05] Team_072 possession (Score: 109-123)
CJ Jokic attempts a Midrange. Contested by Manu Dosunmu (4.1 feet, ZONE). CJ Jokic misses. Rebound secured by Manu Dosunmu.

================================================================================
                              4TH QUARTER COMPLETE                              
================================================================================

4TH QUARTER SCORE: Team_072 17, Team_046 29

BOX SCORE:
================================================================================

Team_072
--------------------------------------------------------------------------------
Player                MIN  PTS  REB  AST  TO      FG   FG%      3P   3P%
--------------------------------------------------------------------------------
CJ Bane                20    6    0    0   0   3/6    50.0     0/0   0.0
CJ Jokic               20    6    0    3   0   2/3    66.7     0/0   0.0
Brandon Durant         20    3    2    1   0   1/5    20.0     0/0   0.0
Giannis Gobert         20    2    0    2   0   1/2    50.0     0/0   0.0
Tracy Giddey           29    0    1    0   0   0/1     0.0     0/0   0.0
Stephen Holiday        20    0    6    0   0   0/0     0.0     0/0   0.0

TEAM: FG: 7/17 (41.2%), 3PT: 2/6 (33.3%), REB: 9 (3 off, 6 def), AST: 6, TO: 6
TEAM FOULS: 8 [Team_046 in BONUS]


Team_046
--------------------------------------------------------------------------------
Player                MIN  PTS  REB  AST  TO      FG   FG%      3P   3P%
--------------------------------------------------------------------------------
Josh Barrett           20    9    0    3   0   4/4   100.0     0/0   0.0
Collin Butler          20    8    0    0   0   3/5    60.0     0/0   0.0
Paul DeRozan           20    7    5    1   0   3/4    75.0     0/0   0.0
Manu Dosunmu           20    3    5    1   0   1/3    33.3     0/0   0.0
Cade Wall              29    2    0    0   0   1/1   100.0     0/0   0.0
Lauri Carter           29    0    1    0   0   0/0     0.0     0/0   0.0
Chris LaVine           20    0    3    0   0   0/0     0.0     0/0   0.0

TEAM: FG: 12/18 (66.7%), 3PT: 3/8 (37.5%), REB: 14 (4 off, 10 def), AST: 5, TO: 4
TEAM FOULS: 5 [Team_072 in BONUS]

================================================================================

================================================================================
                               FULL GAME COMPLETE                               
================================================================================

FINAL SCORE: Team_072 109, Team_046 123

SCORING BY QUARTER:
--------------------------------------------------------------------------------
Team                     Q1     Q2     Q3     Q4    FINAL
--------------------------------------------------------------------------------
Team_072                 36     28     28     17      109
Team_046                 39     19     36     29      123
--------------------------------------------------------------------------------

FULL GAME BOX SCORE:
================================================================================

Team_072
--------------------------------------------------------------------------------
Player                MIN  PTS  REB  AST  TO      FG   FG%      3P   3P%      FT STL BLK
--------------------------------------------------------------------------------
Collin Griffin         29   10    0    5   0   5/7    71.4   0/1     0.0   4/4     0   0
Cade Poole             29   17    0    1   2   7/11   63.6   2/4    50.0   1/1     1   0
Wendell Anthony        29   12    4    5   1   5/9    55.6   1/4    25.0   6/7     0   0
Tracy Giddey           29   18    3    4   1   8/13   61.5   0/3     0.0   1/2     0   0
Tyrese Williamson      29   12    9    2   0   6/7    85.7   0/0     0.0   2/3     1   0
Giannis Gobert         20    4    0    2   1   2/4    50.0   0/2     0.0   1/2     0   0
CJ Jokic               20   19    1    4   1   5/8    62.5   3/5    60.0   3/3     0   0
CJ Bane                20    6    0    1   4   4/9    44.4   0/4     0.0   0/0     0   1
Brandon Durant         20    7    6    3   1   4/8    50.0   1/2    50.0   0/0     0   0
Stephen Holiday        20    3    7    1   2   0/0     0.0   0/0     0.0   0/0     1   1

TEAM: FG: 48/78 (61.5%), 3PT: 7/25 (28.0%), REB: 30 (6 off, 24 def), AST: 28, TO: 13


Team_046
--------------------------------------------------------------------------------
Player                MIN  PTS  REB  AST  TO      FG   FG%      3P   3P%      FT STL BLK
--------------------------------------------------------------------------------
D'Angelo O'Neal        29   19    0    7   0   7/9    77.8   2/3    66.7   2/2     0   0
Victor Nowitzki        29   22    0    1   1  10/14   71.4   1/3    33.3   5/5     0   1
Lauri Carter           29   22    9    6   3   8/9    88.9   4/5    80.0   7/8     0   0
Cade Wall              29    8    8    1   0   5/8    62.5   1/2    50.0   1/1     1   1
Kevin Allen            29    6    5    2   2   3/5    60.0   0/0     0.0   3/4     1   1
Collin Butler          20   11    0    0   2   4/6    66.7   3/5    60.0   0/0     1   0
Manu Dosunmu           20    3    8    2   0   1/5    20.0   1/3    33.3   0/0     0   1
Josh Barrett           20   14    0    4   2   6/7    85.7   0/0     0.0   8/8     2   0
Chris LaVine           20    4    4    0   0   2/3    66.7   0/0     0.0   2/4     2   1
Paul DeRozan           20   12    7    1   3   5/8    62.5   0/2     0.0   4/5     0   0

TEAM: FG: 52/76 (68.4%), 3PT: 12/23 (52.2%), REB: 41 (11 off, 30 def), AST: 24, TO: 13

================================================================================
