================================================================================
                        FULL GAME - Team_016 vs Team_038                        
================================================================================

================================================================================
                       1ST QUARTER - Team_016 vs Team_038                       
================================================================================

[12:00] Team_016 possession (Score: 0-0)
Giannis Ginobili drives, Tracy LaVine stays with him. Giannis Ginobili attempts a Dunk. Wide open! Tracy LaVine is 6.6 feet away. [ZONE] GIANNIS GINOBILI MAKES IT! Assist: Collin Barnes
Score: 2-0

[11:48] Team_038 possession (Score: 2-0)
Luka Barnes drives, Vince Duncan stays with him. Luka Barnes attempts a Layup. Contested by Vince Duncan (3.8 feet, ZONE). LUKA BARNES MAKES IT! Assist: Malcolm Poole
Score: 2-2

[11:34] Team_016 possession (Score: 2-2)
Ben Barrett attempts a Layup. Contested by Tracy LaVine (5.7 feet, MAN). BEN BARRETT MAKES IT! Assist: Vince Quickley
Score: 4-2

[11:22] Team_038 possession (Score: 4-2)
DeMar Harris drives to the basket... DeMar Harris loses the ball! Stripped by Vince Duncan! TURNOVER! (live ball)

[11:04] Team_016 possession (Score: 4-2)
Collin Barnes attempts a Midrange. Contested by Rudy Thompson (2.3 feet, MAN). COLLIN BARNES MAKES IT! Assist: Vince Quickley
Score: 6-2

[10:51] Team_038 possession (Score: 6-2)
Tracy LaVine attempts a Midrange. Contested by Ben Barrett (2.2 feet, MAN). TRACY LAVINE MAKES IT! Assist: DeMar Harris
Score: 6-4

[10:37] Team_016 possession (Score: 6-4)
Vince Quickley drives and kicks out. Collin Barnes attempts a Midrange. Contested by Rudy Thompson (4.6 feet, MAN). COLLIN BARNES MAKES IT! Assist: Vince Quickley
Score: 8-4

[10:23] Team_038 possession (Score: 8-4)
DeMar Harris attempts a 3Pt. Contested by Vince Quickley (3.0 feet, MAN). DeMar Harris misses. Offensive rebound by Tracy LaVine! Tracy LaVine puts it back in!
Score: 8-6

[10:13] Team_016 possession (Score: 8-6)
Giannis Ginobili attempts a 3Pt. Contested by Malcolm Poole (5.4 feet, MAN). GIANNIS GINOBILI MAKES IT! Assist: Vince Quickley
Score: 11-6

[09:59] Team_038 possession (Score: 11-6)
FOUL! Offensive foul on Rudy Thompson! Collin Barnes drew the charge! [Team fouls: 1] (Rudy Thompson: 1 personal fouls) TURNOVER! (dead ball)

[09:45] Team_016 possession (Score: 11-6)
Giannis Ginobili attempts a 3Pt. Contested by Malcolm Poole (5.9 feet, MAN). Giannis Ginobili misses. Rebound secured by Tracy LaVine.

[09:32] Team_038 possession (Score: 11-6)
Malcolm Poole attempts a 3Pt. Wide open! Collin Barnes is 6.8 feet away. [ZONE] Malcolm Poole misses. Rebound secured by Vince Quickley.

[09:17] Team_016 possession (Score: 11-6)
Vince Quickley attempts a 3Pt. Heavily contested by DeMar Harris (1.0 feet, MAN)! Vince Quickley misses. Rebound secured by Tracy LaVine.

[09:00] Team_038 possession (Score: 11-6)
Luka Barnes attempts a Layup. BLOCKED BY COLLIN BARNES! Ball deflects out of bounds off Luka Barnes.

[08:43] Team_016 possession (Score: 11-6)
Ben Barrett attempts a Midrange. Contested by Tracy LaVine (4.4 feet, MAN). Ben Barrett misses. Rebound secured by Tracy LaVine.

[08:27] Team_038 possession (Score: 11-6)
DeMar Harris attempts a Midrange. Contested by Giannis Ginobili (5.7 feet, ZONE). DEMAR HARRIS MAKES IT! Assist: Tracy LaVine
Score: 11-8

[08:14] Team_016 possession (Score: 11-8)
Vince Duncan attempts a 3Pt. Contested by DeMar Harris (2.9 feet, ZONE). Vince Duncan misses. Rebound secured by Tracy LaVine.

[08:00] Team_038 possession (Score: 11-8)
FOUL! Holding foul on Vince Quickley. [Team fouls: 1] No free throws, side out. (Vince Quickley: 1 personal fouls)

[07:44] Team_038 possession (Score: 11-8)
Rudy Thompson attempts a Layup. Contested by Vince Duncan (6.0 feet, ZONE). RUDY THOMPSON MAKES IT! Assist: DeMar Harris
Score: 11-10

[07:30] Team_016 possession (Score: 11-10)
Giannis Ginobili attempts a 3Pt. Contested by Malcolm Poole (3.8 feet, MAN). Giannis Ginobili misses. Rebound secured by Luka Barnes.

[07:15] Team_038 possession (Score: 11-10)
FOUL! Shooting foul on Vince Quickley. DeMar Harris to the line for 2 free throws. [Team fouls: 2] (Vince Quickley: 2 personal fouls)   FT 1/2: GOOD   FT 2/2: GOOD DeMar Harris makes 2/2 from the line.
Score: 11-12

[07:03] Team_016 possession (Score: 11-12)
Collin Barnes attempts a Layup. Contested by Rudy Thompson (2.3 feet, MAN). COLLIN BARNES MAKES IT!
Score: 13-12

[06:46] Team_038 possession (Score: 13-12)
FOUL! Reach-in foul on Collin Barnes during the drive. [Team fouls: 3] No free throws, side out. (Collin Barnes: 1 personal fouls)

[06:34] Team_038 possession (Score: 13-12)
Malcolm Poole attempts a Layup. Contested by Giannis Ginobili (2.7 feet, MAN). MALCOLM POOLE MAKES IT! Assist: DeMar Harris
Score: 13-14

[06:24] Team_016 possession (Score: 13-14)
Vince Duncan drives and kicks out. Ben Barrett attempts a 3Pt. Contested by Tracy LaVine (5.8 feet, MAN). Ben Barrett misses. Offensive rebound by Vince Duncan! Vince Duncan puts it back in!
Score: 15-14

[06:09] Team_038 possession (Score: 15-14)
FOUL! Reach-in foul on Vince Duncan during the drive. [Team fouls: 4] No free throws, side out. (Vince Duncan: 1 personal fouls)

[05:59] Team_038 possession (Score: 15-14)
Luka Barnes drives, Vince Duncan stays with him. Luka Barnes attempts a Dunk. Contested by Vince Duncan (4.3 feet, ZONE). Luka Barnes misses. Offensive rebound by Tracy LaVine! Tracy LaVine puts it back in!
Score: 15-16

[05:46] Team_016 possession (Score: 15-16)
Vince Quickley attempts a 3Pt. Contested by DeMar Harris (3.0 feet, ZONE). Vince Quickley misses. Rebound secured by DeMar Harris.

[05:33] Team_038 possession (Score: 15-16)
FOUL! Offensive foul on Malcolm Poole! Giannis Ginobili drew the charge! [Team fouls: 2] (Malcolm Poole: 1 personal fouls) TURNOVER! (dead ball)

[05:19] Team_016 possession (Score: 15-16)
Ben Barrett attempts a Midrange. Contested by Tracy LaVine (6.0 feet, MAN). BEN BARRETT MAKES IT! Assist: Giannis Ginobili
Score: 17-16

[05:03] Team_038 possession (Score: 17-16)
Luka Barnes drives to the basket... FOUL! Offensive foul on Luka Barnes! Vince Duncan drew the charge! [Team fouls: 3] (Luka Barnes: 1 personal fouls) TURNOVER! (dead ball)

[04:46] Team_016 possession (Score: 17-16)
Vince Quickley attempts a Layup. Heavily contested by DeMar Harris (1.2 feet, MAN)! VINCE QUICKLEY MAKES IT! Assist: Vince Duncan
Score: 19-16

[04:36] Team_038 possession (Score: 19-16)
Malcolm Poole attempts a 3Pt. Wide open! Giannis Ginobili is 7.6 feet away. [MAN] Malcolm Poole misses. Offensive rebound by Tracy LaVine! Tracy LaVine's putback is no good. Rebound secured by Vince Quickley.

[04:23] Team_016 possession (Score: 19-16)
Vince Duncan drives, Tracy LaVine stays with him. Vince Duncan attempts a Dunk. Contested by Tracy LaVine (2.3 feet, ZONE). VINCE DUNCAN MAKES IT! Assist: Giannis Ginobili
Score: 21-16

[04:07] Team_038 possession (Score: 21-16)
Malcolm Poole attempts a Layup. Contested by Ben Barrett (5.5 feet, ZONE). Malcolm Poole misses. Rebound secured by Ben Barrett.

[03:53] Team_016 possession (Score: 21-16)
Vince Duncan attempts a Layup. Contested by Tracy LaVine (3.2 feet, ZONE). VINCE DUNCAN MAKES IT! Assist: Vince Quickley
Score: 23-16

[03:36] Team_038 possession (Score: 23-16)
Tracy LaVine attempts a Midrange. Wide open! Ben Barrett is 6.7 feet away. [MAN] Tracy LaVine misses. Rebound secured by Vince Duncan.

[03:25] Team_016 possession (Score: 23-16)
FOUL! Reach-in foul on Tracy LaVine during the drive. [Team fouls: 4] No free throws, side out. (Tracy LaVine: 1 personal fouls)

[03:07] Team_016 possession (Score: 23-16)
Vince Quickley attempts a Midrange. Heavily contested by DeMar Harris (0.5 feet, MAN)! VINCE QUICKLEY MAKES IT!
Score: 25-16

[02:54] Team_038 possession (Score: 25-16)
Malcolm Poole drives, Vince Duncan stays with him. Malcolm Poole attempts a Layup. Contested by Vince Duncan (5.9 feet, ZONE). Malcolm Poole misses. Rebound secured by Vince Quickley.

[02:38] Team_016 possession (Score: 25-16)
Collin Barnes drives and kicks out. Vince Duncan attempts a Midrange. Heavily contested by Rudy Thompson (1.4 feet, ZONE)! Vince Duncan misses. Rebound secured by DeMar Harris.

[02:23] Team_038 possession (Score: 25-16)
DeMar Harris attempts a Midrange. Heavily contested by Ben Barrett (0.8 feet, ZONE)! DeMar Harris misses. FOUL! Loose ball foul on Ben Barrett during the rebound battle. [IN THE BONUS! 5 team fouls] Tracy LaVine to the line for 2 free throws. (Ben Barrett: 1 personal fouls)   FT 1/2: GOOD   FT 2/2: MISS Tracy LaVine makes 1/2 from the line. Rebound secured by Ben Barrett.
Score: 25-17

[02:10] Team_016 possession (Score: 25-17)
Vince Duncan attempts a Midrange. Contested by Luka Barnes (3.0 feet, ZONE). Vince Duncan misses. Rebound secured by DeMar Harris.

[01:59] Team_038 possession (Score: 25-17)
Tracy LaVine attempts a 3Pt. Contested by Giannis Ginobili (3.7 feet, ZONE). TRACY LAVINE MAKES IT! Assist: Malcolm Poole
Score: 25-20

[01:45] Team_016 possession (Score: 25-20)
Collin Barnes attempts a Midrange. Contested by Malcolm Poole (4.5 feet, ZONE). COLLIN BARNES MAKES IT!
Score: 27-20

[01:30] Team_038 possession (Score: 27-20)
FOUL! Reach-in foul on Giannis Ginobili during the drive. [IN THE BONUS! 6 team fouls] Malcolm Poole to the line for 2 free throws. (Giannis Ginobili: 1 personal fouls)   FT 1/2: GOOD   FT 2/2: GOOD Malcolm Poole makes 2/2 from the line.
Score: 27-22

[01:18] Team_016 possession (Score: 27-22)
FOUL! Shooting foul on Luka Barnes. Vince Duncan to the line for 2 free throws. [BONUS: 5 team fouls] (Luka Barnes: 2 personal fouls)   FT 1/2: GOOD   FT 2/2: GOOD Vince Duncan makes 2/2 from the line.
Score: 29-22

[01:08] Team_038 possession (Score: 29-22)
DeMar Harris makes the Midrange and draws the foul on Ben Barrett! And-1! DeMar Harris to the line for 1. [BONUS: 7 team fouls] (Ben Barrett: 2 personal fouls)   FT 1/1: GOOD DeMar Harris makes 1/1 from the line.
Score: 29-25

[00:58] Team_016 possession (Score: 29-25)
FOUL! Shooting foul on Tracy LaVine. Ben Barrett to the line for 3 free throws. [BONUS: 6 team fouls] (Tracy LaVine: 2 personal fouls)   FT 1/3: GOOD   FT 2/3: GOOD   FT 3/3: GOOD Ben Barrett makes 3/3 from the line.
Score: 32-25

[00:42] Team_038 possession (Score: 32-25)
Tracy LaVine attempts a 3Pt. Wide open! Ben Barrett is 6.3 feet away. [MAN] TRACY LAVINE MAKES IT! Assist: DeMar Harris
Score: 32-28

[00:29] Team_016 possession (Score: 32-28)
Collin Barnes attempts a Midrange. Contested by Malcolm Poole (3.0 feet, ZONE). Collin Barnes misses. Rebound secured by Tracy LaVine.

[00:16] Team_038 possession (Score: 32-28)
DeMar Harris attempts a Midrange. Wide open! Vince Quickley is 7.1 feet away. [MAN] DeMar Harris misses. Offensive rebound by Tracy LaVine! Tracy LaVine kicks it out.

================================================================================
                              1ST QUARTER COMPLETE                              
================================================================================

1ST QUARTER SCORE: Team_016 32, Team_038 28

BOX SCORE:
================================================================================

Team_016
--------------------------------------------------------------------------------
Player                MIN  PTS  REB  AST  TO      FG   FG%      3P   3P%
--------------------------------------------------------------------------------
Collin Barnes          12    8    0    1   0   4/6    66.7     0/0   0.0
Vince Duncan           12    8    2    1   0   4/6    66.7     0/0   0.0
Ben Barrett            12    7    2    0   0   3/4    75.0     0/0   0.0
Giannis Ginobili       12    5    0    2   0   2/4    50.0     0/0   0.0
Vince Quickley         12    4    3    5   0   2/4    50.0     0/0   0.0

TEAM: FG: 15/24 (62.5%), 3PT: 2/7 (28.6%), REB: 5 (1 off, 4 def), AST: 9, TO: 0
TEAM FOULS: 7 [Team_038 in BONUS]


Team_038
--------------------------------------------------------------------------------
Player                MIN  PTS  REB  AST  TO      FG   FG%      3P   3P%
--------------------------------------------------------------------------------
Tracy LaVine           12   12    8    1   0   5/6    83.3     0/0   0.0
DeMar Harris           12    7    3    4   0   3/4    75.0     0/0   0.0
Malcolm Poole          12    4    0    2   0   2/6    33.3     0/0   0.0
Luka Barnes            12    2    1    0   0   1/2    50.0     0/0   0.0
Rudy Thompson          12    2    0    0   0   1/1   100.0     0/0   0.0

TEAM: FG: 12/19 (63.2%), 3PT: 3/5 (60.0%), REB: 14 (5 off, 9 def), AST: 7, TO: 4
TEAM FOULS: 6 [Team_016 in BONUS]

================================================================================

================================================================================
                       2ND QUARTER - Team_016 vs Team_038                       
================================================================================

[12:00] Team_016 possession (Score: 32-28)
Giannis Ginobili drives and kicks out. Vince Duncan attempts a Midrange. Contested by Tracy LaVine (5.6 feet, ZONE). VINCE DUNCAN MAKES IT! Assist: Vince Quickley
Score: 34-28

[11:45] Team_038 possession (Score: 34-28)
Malcolm Poole attempts a 3Pt. Heavily contested by Collin Barnes (0.9 feet, ZONE)! Malcolm Poole misses. Offensive rebound by Luka Barnes! Luka Barnes kicks it out.

[11:31] Team_038 possession (Score: 34-28)
DeMar Harris drives and kicks out. DeMar Harris attempts a 3Pt. Contested by Vince Quickley (4.2 feet, MAN). DeMar Harris misses. Rebound secured by Vince Duncan.

[11:19] Team_016 possession (Score: 34-28)
Vince Duncan drives and kicks out. Collin Barnes attempts a 3Pt. Contested by Rudy Thompson (3.0 feet, MAN). Collin Barnes misses. Rebound secured by Luka Barnes.

[11:00] Team_038 possession (Score: 34-28)
DeMar Harris drives and kicks out. Tracy LaVine attempts a Midrange. Contested by Ben Barrett (3.4 feet, ZONE). TRACY LAVINE MAKES IT!
Score: 34-30

[10:44] Team_016 possession (Score: 34-30)
Ben Barrett drives, Tracy LaVine stays with him. Ben Barrett attempts a Dunk. Contested by Tracy LaVine (5.6 feet, MAN). BEN BARRETT MAKES IT! Assist: Vince Duncan
Score: 36-30

[10:30] Team_038 possession (Score: 36-30)
Rudy Thompson drives, Collin Barnes stays with him. Rudy Thompson attempts a Dunk. Wide open! Collin Barnes is 8.1 feet away. [MAN] RUDY THOMPSON MAKES IT! Assist: Luka Barnes
Score: 36-32

[10:19] Team_016 possession (Score: 36-32)
Giannis Ginobili drives and kicks out. Ben Barrett attempts a 3Pt. Contested by DeMar Harris (3.8 feet, ZONE). Ben Barrett misses. Offensive rebound by Vince Duncan! Vince Duncan kicks it out.

[10:05] Team_016 possession (Score: 36-32)
Vince Duncan attempts a 3Pt. Heavily contested by DeMar Harris (1.5 feet, ZONE)! Vince Duncan misses. Rebound secured by DeMar Harris.

[09:51] Team_038 possession (Score: 36-32)
Rudy Thompson attempts a Midrange. Contested by Collin Barnes (4.5 feet, MAN). RUDY THOMPSON MAKES IT!
Score: 36-34

[09:33] Team_016 possession (Score: 36-34)
Giannis Ginobili attempts a Layup. Contested by Malcolm Poole (4.9 feet, MAN). GIANNIS GINOBILI MAKES IT! Assist: Collin Barnes
Score: 38-34

[09:19] Team_038 possession (Score: 38-34)
FOUL! Reach-in foul on Vince Duncan during the drive. [Team fouls: 1] No free throws, side out. (Vince Duncan: 1 personal fouls)

[09:02] Team_038 possession (Score: 38-34)
Rudy Thompson drives, Collin Barnes stays with him. Rudy Thompson attempts a Dunk. Wide open! Collin Barnes is 6.2 feet away. [MAN] RUDY THOMPSON MAKES IT! Assist: Tracy LaVine
Score: 38-36

[08:48] Team_016 possession (Score: 38-36)
Vince Duncan attempts a Midrange. Heavily contested by Luka Barnes (1.9 feet, MAN)! Vince Duncan misses. FOUL! Loose ball foul on DeMar Harris during the rebound battle. [Team fouls: 1] No free throws, side out. (DeMar Harris: 1 personal fouls)

[08:32] Team_016 possession (Score: 38-36)
Collin Barnes attempts a 3Pt. Contested by Rudy Thompson (4.0 feet, MAN). Collin Barnes misses. Rebound secured by Luka Barnes.

[08:17] Team_038 possession (Score: 38-36)
Tracy LaVine attempts a Midrange. Heavily contested by Ben Barrett (0.5 feet, MAN)! Tracy LaVine misses. Rebound secured by Vince Quickley.

[08:02] Team_016 possession (Score: 38-36)
Vince Duncan attempts a Layup. Wide open! Tracy LaVine is 8.1 feet away. [ZONE] Vince Duncan misses. Offensive rebound by Ben Barrett! Ben Barrett puts it back in!
Score: 40-36

[07:48] Team_038 possession (Score: 40-36)
Rudy Thompson drives, Vince Duncan stays with him. Rudy Thompson attempts a Dunk. Contested by Vince Duncan (5.8 feet, ZONE). Rudy Thompson misses. Rebound secured by Vince Quickley.

[07:34] Team_016 possession (Score: 40-36)
Vince Duncan drives to the basket... Vince Duncan throws a bad pass! Stolen by Tracy LaVine! TURNOVER! (live ball)

[07:19] Team_038 possession (Score: 40-36)
Tracy LaVine throws a bad pass out of bounds! TURNOVER! (dead ball)

[07:19] Substitution (Team_016): Collin Barnes OUT → Lamelo Herro IN (stamina_rule2)

[07:19] Substitution (Team_016): Giannis Ginobili OUT → Immanuel Nowitzki IN (stamina_rule2)

[07:19] Substitution (Team_016): Vince Quickley OUT → Kevin Butler IN (stamina_rule2)

[07:19] Substitution (Team_016): Ben Barrett OUT → Giannis Doncic IN (stamina_rule2)

[07:19] Substitution (Team_016): Vince Duncan OUT → Trae Barnes IN (stamina_rule2)

[07:19] Substitution (Team_038): Rudy Thompson OUT → Jalen Hyland IN (stamina_rule2)

[07:19] Substitution (Team_038): Malcolm Poole OUT → Jaren Jokic IN (stamina_rule2)

[07:19] Substitution (Team_038): DeMar Harris OUT → Magic Dosunmu IN (stamina_rule2)

[07:19] Substitution (Team_038): Tracy LaVine OUT → Jabari Carter IN (stamina_rule2)

[07:19] Substitution (Team_038): Luka Barnes OUT → Ja Smith IN (stamina_rule2)

[07:05] Team_016 possession (Score: 40-36)
Kevin Butler attempts a Layup. BLOCKED BY JA SMITH! Ball deflects out of bounds off Kevin Butler.

[06:51] Team_038 possession (Score: 40-36)
Magic Dosunmu attempts a Midrange. Contested by Kevin Butler (3.2 feet, MAN). Magic Dosunmu misses. Offensive rebound by Ja Smith! Ja Smith's putback is no good. Offensive rebound by Jabari Carter! Jabari Carter kicks it out.

[06:38] Team_038 possession (Score: 40-36)
Jaren Jokic drives to the basket... Jaren Jokic throws a bad pass out of bounds! TURNOVER! (dead ball)

[06:28] Team_016 possession (Score: 40-36)
Lamelo Herro drives to the basket... Lamelo Herro throws a bad pass! Stolen by Ja Smith! TURNOVER! (live ball)

[06:15] Team_038 possession (Score: 40-36)
Jaren Jokic attempts a Midrange. BLOCKED BY GIANNIS DONCIC! Ball is loose! Rebound secured by Lamelo Herro.

[05:59] Team_016 possession (Score: 40-36)
Lamelo Herro attempts a 3Pt. Contested by Jalen Hyland (3.3 feet, ZONE). Lamelo Herro misses. Rebound secured by Jalen Hyland.

[05:50] Team_038 possession (Score: 40-36)
Jalen Hyland attempts a 3Pt. Heavily contested by Kevin Butler (1.1 feet, ZONE)! Jalen Hyland misses. Rebound secured by Lamelo Herro.

[05:36] Team_016 possession (Score: 40-36)
Trae Barnes drives, picks up Ja Smith. Help arrives from Jalen Hyland! Trae Barnes attempts a Layup. Contested by Jalen Hyland (3.9 feet, MAN). Trae Barnes misses. Rebound secured by Jabari Carter.

[05:17] Team_038 possession (Score: 40-36)
Magic Dosunmu drives, Giannis Doncic stays with him. Magic Dosunmu attempts a Layup. Heavily contested by Giannis Doncic (1.9 feet, ZONE)! MAGIC DOSUNMU MAKES IT!
Score: 40-38

[04:59] Team_016 possession (Score: 40-38)
Trae Barnes attempts a Midrange. Contested by Ja Smith (3.4 feet, MAN). TRAE BARNES MAKES IT!
Score: 42-38

[04:44] Team_038 possession (Score: 42-38)
Jalen Hyland drives, picks up Lamelo Herro. Help arrives from Kevin Butler! Jalen Hyland attempts a Layup. Heavily contested by Kevin Butler (0.7 feet, MAN)! Jalen Hyland misses. Offensive rebound by Jabari Carter! Jabari Carter's putback is no good. Rebound secured by Lamelo Herro.

[04:30] Team_016 possession (Score: 42-38)
Kevin Butler attempts a Midrange. Heavily contested by Magic Dosunmu (1.7 feet, MAN)! Kevin Butler misses. Rebound secured by Ja Smith.

[04:19] Team_038 possession (Score: 42-38)
Ja Smith attempts a 3Pt. Wide open! Trae Barnes is 9.3 feet away. [MAN] Ja Smith misses. Rebound secured by Trae Barnes.

[04:04] Team_016 possession (Score: 42-38)
Giannis Doncic drives, picks up Jabari Carter. Help arrives from Jalen Hyland! Giannis Doncic attempts a Dunk. Contested by Jalen Hyland (2.8 feet, MAN). GIANNIS DONCIC MAKES IT!
Score: 44-38

[03:46] Team_038 possession (Score: 44-38)
Jaren Jokic attempts a 3Pt. Wide open! Immanuel Nowitzki is 6.5 feet away. [MAN] Jaren Jokic misses. Rebound secured by Giannis Doncic.

[03:33] Team_016 possession (Score: 44-38)
Trae Barnes drives, Ja Smith stays with him. Trae Barnes attempts a Dunk. Contested by Ja Smith (5.4 feet, ZONE). Trae Barnes misses. Rebound secured by Jalen Hyland.

[03:17] Team_038 possession (Score: 44-38)
Ja Smith drives, Trae Barnes stays with him. Ja Smith attempts a Layup. Wide open! Trae Barnes is 6.9 feet away. [MAN] JA SMITH MAKES IT! Assist: Magic Dosunmu
Score: 44-40

[02:58] Team_016 possession (Score: 44-40)
Giannis Doncic attempts a Midrange. Contested by Jaren Jokic (3.1 feet, ZONE). GIANNIS DONCIC MAKES IT! Assist: Kevin Butler
Score: 46-40

[02:44] Team_038 possession (Score: 46-40)
Jaren Jokic attempts a 3Pt. Heavily contested by Lamelo Herro (0.5 feet, ZONE)! Jaren Jokic misses. Rebound secured by Giannis Doncic.

[02:31] Team_016 possession (Score: 46-40)
Trae Barnes makes the Dunk and draws the foul on Jalen Hyland! And-1! Trae Barnes to the line for 1. [Team fouls: 2] (Jalen Hyland: 1 personal fouls)   FT 1/1: MISS Trae Barnes makes 0/1 from the line. Offensive rebound by Giannis Doncic! Giannis Doncic kicks it out.
Score: 48-40

[02:17] Team_016 possession (Score: 48-40)
Giannis Doncic attempts a 3Pt. Contested by Jabari Carter (5.7 feet, MAN). Giannis Doncic misses. Rebound secured by Ja Smith.

[02:07] Team_038 possession (Score: 48-40)
Jalen Hyland attempts a 3Pt. Contested by Lamelo Herro (5.4 feet, ZONE). Jalen Hyland misses. Rebound secured by Lamelo Herro.

[01:50] Team_016 possession (Score: 48-40)
Trae Barnes drives, Ja Smith stays with him. Trae Barnes attempts a Layup. Contested by Ja Smith (5.6 feet, MAN). TRAE BARNES MAKES IT! Assist: Kevin Butler
Score: 50-40

[01:39] Team_038 possession (Score: 50-40)
Jaren Jokic attempts a Layup. Heavily contested by Giannis Doncic (0.8 feet, ZONE)! Jaren Jokic misses. Rebound secured by Trae Barnes.

[01:25] Team_016 possession (Score: 50-40)
FOUL! Reach-in foul on Ja Smith during the drive. [Team fouls: 3] No free throws, side out. (Ja Smith: 1 personal fouls)

[01:11] Team_016 possession (Score: 50-40)
FOUL! Reach-in foul on Jabari Carter during the drive. [Team fouls: 4] No free throws, side out. (Jabari Carter: 1 personal fouls)

[00:53] Team_016 possession (Score: 50-40)
Lamelo Herro attempts a 3Pt. Contested by Jalen Hyland (4.3 feet, MAN). Lamelo Herro misses. Rebound secured by Ja Smith.

[00:39] Team_038 possession (Score: 50-40)
Jaren Jokic drives, picks up Giannis Doncic. Help arrives from Lamelo Herro! Jaren Jokic attempts a Dunk. Contested by Lamelo Herro (4.0 feet, ZONE). JAREN JOKIC MAKES IT!
Score: 50-42

[00:23] Team_016 possession (Score: 50-42)
Lamelo Herro attempts a 3Pt. Contested by Jalen Hyland (3.9 feet, ZONE). Lamelo Herro misses. Rebound secured by Jalen Hyland.

[00:12] Team_038 possession (Score: 50-42)
Magic Dosunmu attempts a 3Pt. Contested by Kevin Butler (4.7 feet, MAN). Magic Dosunmu misses. Rebound secured by Giannis Doncic.

================================================================================
                              2ND QUARTER COMPLETE                              
================================================================================

2ND QUARTER SCORE: Team_016 18, Team_038 14

BOX SCORE:
================================================================================

Team_016
--------------------------------------------------------------------------------
Player                MIN  PTS  REB  AST  TO      FG   FG%      3P   3P%
--------------------------------------------------------------------------------
Ben Barrett            17    4    1    0   0   2/2   100.0     0/0   0.0
Trae Barnes             7    4    2    0   0   2/4    50.0     0/0   0.0
Giannis Doncic          7    4    4    0   0   2/3    66.7     0/0   0.0
Vince Duncan           17    2    3    1   0   1/3    33.3     0/0   0.0
Giannis Ginobili       17    2    0    0   0   1/1   100.0     0/0   0.0
Vince Quickley         17    0    2    1   0   0/0     0.0     0/0   0.0
Collin Barnes          17    0    0    1   0   0/1     0.0     0/0   0.0
Kevin Butler            7    0    0    2   0   0/2     0.0     0/0   0.0
Lamelo Herro            7    0    4    0   0   0/3     0.0     0/0   0.0

TEAM: FG: 8/19 (42.1%), 3PT: 0/6 (0.0%), REB: 15 (4 off, 11 def), AST: 5, TO: 2
TEAM FOULS: 1


Team_038
--------------------------------------------------------------------------------
Player                MIN  PTS  REB  AST  TO      FG   FG%      3P   3P%
--------------------------------------------------------------------------------
Rudy Thompson          17    6    0    0   0   3/4    75.0     0/0   0.0
Tracy LaVine           17    2    0    1   0   1/2    50.0     0/0   0.0
Jaren Jokic             7    2    0    0   0   1/5    20.0     0/0   0.0
Magic Dosunmu           7    2    0    1   0   1/2    50.0     0/0   0.0
Ja Smith                7    2    3    0   0   1/2    50.0     0/0   0.0
Luka Barnes            17    0    3    1   0   0/0     0.0     0/0   0.0
DeMar Harris           17    0    1    0   0   0/1     0.0     0/0   0.0
Jabari Carter           7    0    2    0   0   0/0     0.0     0/0   0.0
Jalen Hyland            7    0    3    0   0   0/3     0.0     0/0   0.0

TEAM: FG: 7/19 (36.8%), 3PT: 0/6 (0.0%), REB: 13 (3 off, 10 def), AST: 3, TO: 2
TEAM FOULS: 4

================================================================================

================================================================================
                       3RD QUARTER - Team_016 vs Team_038                       
================================================================================

[12:00] Team_016 possession (Score: 50-42)
Ben Barrett throws a bad pass out of bounds! TURNOVER! (dead ball)

[11:43] Team_038 possession (Score: 50-42)
DeMar Harris attempts a 3Pt. Contested by Collin Barnes (3.4 feet, ZONE). DeMar Harris misses. Rebound secured by Vince Duncan.

[11:26] Team_016 possession (Score: 50-42)
Vince Duncan attempts a 3Pt. Contested by Luka Barnes (4.3 feet, MAN). Vince Duncan misses. Offensive rebound by Vince Duncan! Vince Duncan puts it back in!
Score: 52-42

[11:15] Team_038 possession (Score: 52-42)
Luka Barnes attempts a Midrange. Heavily contested by Vince Duncan (1.0 feet, MAN)! Luka Barnes misses. Rebound secured by Ben Barrett.

[11:00] Team_016 possession (Score: 52-42)
Ben Barrett attempts a 3Pt. Wide open! Tracy LaVine is 7.3 feet away. [MAN] Ben Barrett misses. Rebound secured by Tracy LaVine.

[10:45] Team_038 possession (Score: 52-42)
DeMar Harris drives and kicks out. DeMar Harris attempts a 3Pt. Wide open! Collin Barnes is 7.0 feet away. [ZONE] DeMar Harris misses. Rebound secured by Vince Duncan.

[10:33] Team_016 possession (Score: 52-42)
Ben Barrett attempts a 3Pt. Contested by Tracy LaVine (2.1 feet, MAN). Ben Barrett misses. Offensive rebound by Vince Duncan! Vince Duncan puts it back in!
Score: 54-42

[10:15] Team_038 possession (Score: 54-42)
Malcolm Poole attempts a 3Pt. Contested by Collin Barnes (3.9 feet, ZONE). Malcolm Poole misses. Rebound secured by Vince Quickley.

[10:00] Team_016 possession (Score: 54-42)
Collin Barnes drives, Tracy LaVine stays with him. Collin Barnes attempts a Dunk. Contested by Tracy LaVine (3.4 feet, ZONE). Collin Barnes misses. FOUL! Loose ball foul on Tracy LaVine during the rebound battle. [Team fouls: 1] No free throws, side out. (Tracy LaVine: 1 personal fouls)

[09:48] Team_016 possession (Score: 54-42)
Vince Duncan drives, Tracy LaVine stays with him. Vince Duncan attempts a Dunk. Wide open! Tracy LaVine is 6.1 feet away. [ZONE] VINCE DUNCAN MAKES IT!
Score: 56-42

[09:39] Team_038 possession (Score: 56-42)
Tracy LaVine drives and kicks out. Tracy LaVine attempts a 3Pt. Contested by Ben Barrett (3.2 feet, MAN). Tracy LaVine misses. Rebound secured by Vince Duncan.

[09:25] Team_016 possession (Score: 56-42)
Vince Quickley drives and kicks out. Giannis Ginobili attempts a Midrange. Wide open! Malcolm Poole is 8.5 feet away. [ZONE] GIANNIS GINOBILI MAKES IT!
Score: 58-42

[09:10] Team_038 possession (Score: 58-42)
FOUL! Shooting foul on Vince Duncan. Luka Barnes to the line for 3 free throws. [Team fouls: 1] (Vince Duncan: 1 personal fouls)   FT 1/3: MISS   FT 2/3: MISS   FT 3/3: GOOD Luka Barnes makes 1/3 from the line.
Score: 58-43

[08:58] Team_016 possession (Score: 58-43)
Giannis Ginobili attempts a 3Pt. Contested by Malcolm Poole (2.6 feet, MAN). GIANNIS GINOBILI MAKES IT! Assist: Vince Quickley
Score: 61-43

[08:46] Team_038 possession (Score: 61-43)
Rudy Thompson drives, Collin Barnes stays with him. Rudy Thompson attempts a Layup. Contested by Collin Barnes (4.5 feet, MAN). RUDY THOMPSON MAKES IT! Assist: Tracy LaVine
Score: 61-45

[08:34] Team_016 possession (Score: 61-45)
Collin Barnes drives and kicks out. Collin Barnes attempts a 3Pt. Wide open! Rudy Thompson is 6.4 feet away. [MAN] Collin Barnes misses. Rebound secured by DeMar Harris.

[08:21] Team_038 possession (Score: 61-45)
Luka Barnes makes the Layup and draws the foul on Collin Barnes! And-1! Luka Barnes to the line for 1. [Team fouls: 2] (Collin Barnes: 1 personal fouls)   FT 1/1: GOOD Luka Barnes makes 1/1 from the line.
Score: 61-48

[08:06] Team_016 possession (Score: 61-48)
FOUL! Reach-in foul on Luka Barnes during the drive. [Team fouls: 2] No free throws, side out. (Luka Barnes: 1 personal fouls)

[07:55] Team_016 possession (Score: 61-48)
Vince Quickley attempts a Midrange. Heavily contested by DeMar Harris (0.5 feet, MAN)! Vince Quickley misses. Rebound secured by DeMar Harris.

[07:40] Team_038 possession (Score: 61-48)
Rudy Thompson drives, picks up Collin Barnes. Help arrives from Vince Quickley! Rudy Thompson attempts a Layup. Wide open! Vince Quickley is 9.0 feet away. [MAN] RUDY THOMPSON MAKES IT!
Score: 61-50

[07:23] Team_016 possession (Score: 61-50)
Giannis Ginobili attempts a 3Pt. Contested by DeMar Harris (2.7 feet, ZONE). GIANNIS GINOBILI MAKES IT! Assist: Vince Duncan
Score: 64-50

[07:13] Team_038 possession (Score: 64-50)
Luka Barnes attempts a Midrange. Contested by Vince Quickley (4.8 feet, ZONE). LUKA BARNES MAKES IT! Assist: DeMar Harris
Score: 64-52

[06:58] Team_016 possession (Score: 64-52)
Vince Quickley drives and kicks out. Giannis Ginobili attempts a 3Pt. Contested by Malcolm Poole (2.9 feet, MAN). GIANNIS GINOBILI MAKES IT! Assist: Vince Quickley
Score: 67-52

[06:44] Team_038 possession (Score: 67-52)
FOUL! Reach-in foul on Vince Duncan during the drive. [Team fouls: 3] No free throws, side out. (Vince Duncan: 2 personal fouls)

[06:29] Team_038 possession (Score: 67-52)
DeMar Harris loses the ball! Stripped by Vince Quickley! TURNOVER! (live ball)

[06:18] Team_016 possession (Score: 67-52)
Ben Barrett attempts a 3Pt. Contested by DeMar Harris (3.5 feet, ZONE). BEN BARRETT MAKES IT!
Score: 70-52

[06:04] Team_038 possession (Score: 70-52)
Tracy LaVine attempts a 3Pt. Contested by Collin Barnes (3.3 feet, ZONE). Tracy LaVine misses. Offensive rebound by Tracy LaVine! Tracy LaVine's putback is no good. Rebound secured by Vince Duncan.

[05:49] Team_016 possession (Score: 70-52)
Vince Duncan drives and kicks out. Vince Duncan attempts a Midrange. Contested by Luka Barnes (5.8 feet, MAN). Vince Duncan misses. Rebound secured by Luka Barnes.

[05:34] Team_038 possession (Score: 70-52)
Rudy Thompson attempts a Layup. Contested by Vince Duncan (4.3 feet, ZONE). RUDY THOMPSON MAKES IT!
Score: 70-54

[05:21] Team_016 possession (Score: 70-54)
FOUL! Shooting foul on Tracy LaVine. Vince Duncan to the line for 2 free throws. [Team fouls: 3] (Tracy LaVine: 2 personal fouls)   FT 1/2: MISS   FT 2/2: GOOD Vince Duncan makes 1/2 from the line.
Score: 71-54

[05:06] Team_038 possession (Score: 71-54)
Malcolm Poole attempts a 3Pt. Contested by Giannis Ginobili (4.5 feet, MAN). Malcolm Poole misses. Offensive rebound by Luka Barnes! Luka Barnes kicks it out.

[04:50] Team_038 possession (Score: 71-54)
Malcolm Poole attempts a 3Pt. Wide open! Giannis Ginobili is 6.6 feet away. [MAN] Malcolm Poole misses. Offensive rebound by Tracy LaVine! Tracy LaVine's putback is no good. Offensive rebound by Tracy LaVine! Tracy LaVine kicks it out.

[04:33] Team_038 possession (Score: 71-54)
Tracy LaVine drives and kicks out. Tracy LaVine attempts a 3Pt. Contested by Ben Barrett (4.0 feet, ZONE). Tracy LaVine misses. Rebound secured by Ben Barrett.

[04:18] Team_016 possession (Score: 71-54)
Giannis Ginobili attempts a 3Pt. Contested by DeMar Harris (5.5 feet, ZONE). Giannis Ginobili misses. Rebound secured by Tracy LaVine.

[04:06] Team_038 possession (Score: 71-54)
Tracy LaVine makes the Layup and draws the foul on Vince Duncan! And-1! Tracy LaVine to the line for 1. [BONUS: 5 team fouls] (Vince Duncan: 4 personal fouls)   FT 1/1: GOOD Tracy LaVine makes 1/1 from the line.
Score: 71-57

[03:55] Team_016 possession (Score: 71-57)
Collin Barnes attempts a 3Pt. Contested by Rudy Thompson (5.7 feet, MAN). Collin Barnes misses. Rebound secured by Tracy LaVine.

[03:42] Team_038 possession (Score: 71-57)
Tracy LaVine attempts a Midrange. Contested by Ben Barrett (4.2 feet, MAN). Tracy LaVine misses. Offensive rebound by Luka Barnes! Luka Barnes kicks it out.

[03:30] Team_038 possession (Score: 71-57)
FOUL! Shooting foul on Giannis Ginobili. Tracy LaVine to the line for 2 free throws. [BONUS: 6 team fouls] (Giannis Ginobili: 1 personal fouls)   FT 1/2: GOOD   FT 2/2: GOOD Tracy LaVine makes 2/2 from the line.
Score: 71-59

[03:13] Team_016 possession (Score: 71-59)
Vince Quickley attempts a Layup. BLOCKED BY DEMAR HARRIS! Ball deflects out of bounds off Vince Quickley.

[02:58] Team_038 possession (Score: 71-59)
DeMar Harris drives and kicks out. Rudy Thompson attempts a 3Pt. Heavily contested by Collin Barnes (1.3 feet, ZONE)! Rudy Thompson misses. Offensive rebound by Tracy LaVine! Tracy LaVine kicks it out.

[02:42] Team_038 possession (Score: 71-59)
Rudy Thompson attempts a 3Pt. Contested by Collin Barnes (4.6 feet, ZONE). RUDY THOMPSON MAKES IT! Assist: Tracy LaVine
Score: 71-62

[02:27] Team_016 possession (Score: 71-62)
Vince Duncan makes the Layup and draws the foul on Luka Barnes! And-1! Vince Duncan to the line for 1. [Team fouls: 4] (Luka Barnes: 2 personal fouls)   FT 1/1: GOOD Vince Duncan makes 1/1 from the line.
Score: 74-62

[02:13] Team_038 possession (Score: 74-62)
DeMar Harris attempts a Midrange. Contested by Collin Barnes (2.2 feet, ZONE). DEMAR HARRIS MAKES IT!
Score: 74-64

[01:56] Team_016 possession (Score: 74-64)
Vince Duncan drives, picks up Luka Barnes. Help arrives from Malcolm Poole! Vince Duncan attempts a Layup. Wide open! Malcolm Poole is 7.6 feet away. [MAN] VINCE DUNCAN MAKES IT! Assist: Giannis Ginobili
Score: 76-64

[01:44] Team_038 possession (Score: 76-64)
Rudy Thompson attempts a Midrange. Wide open! Collin Barnes is 8.9 feet away. [MAN] RUDY THOMPSON MAKES IT!
Score: 76-66

[01:31] Team_016 possession (Score: 76-66)
Vince Quickley drives, DeMar Harris stays with him. Vince Quickley attempts a Dunk. Wide open! DeMar Harris is 7.8 feet away. [MAN] VINCE QUICKLEY MAKES IT! Assist: Ben Barrett
Score: 78-66

[01:15] Team_038 possession (Score: 78-66)
Malcolm Poole attempts a Layup. Contested by Vince Duncan (5.7 feet, ZONE). Malcolm Poole misses. Rebound secured by Vince Duncan.

[01:02] Team_016 possession (Score: 78-66)
Ben Barrett attempts a Layup. Contested by Tracy LaVine (4.8 feet, MAN). Ben Barrett misses. Rebound secured by Tracy LaVine.

[00:51] Team_038 possession (Score: 78-66)
Rudy Thompson attempts a 3Pt. Heavily contested by Collin Barnes (1.8 feet, ZONE)! RUDY THOMPSON MAKES IT! Assist: Luka Barnes
Score: 78-69

[00:37] Team_016 possession (Score: 78-69)
Collin Barnes drives, picks up Rudy Thompson. Help arrives from DeMar Harris! Collin Barnes attempts a Dunk. Wide open! DeMar Harris is 7.9 feet away. [MAN] COLLIN BARNES MAKES IT! Assist: Giannis Ginobili
Score: 80-69

[00:26] Team_038 possession (Score: 80-69)
DeMar Harris attempts a 3Pt. Contested by Collin Barnes (5.9 feet, ZONE). DeMar Harris misses. Rebound secured by Vince Duncan.

[00:14] Team_016 possession (Score: 80-69)
Ben Barrett attempts a 3Pt. Contested by Tracy LaVine (4.5 feet, MAN). Ben Barrett misses. Rebound secured by Tracy LaVine.

[00:02] Team_038 possession (Score: 80-69)
DeMar Harris attempts a 3Pt. Contested by Collin Barnes (5.6 feet, ZONE). DEMAR HARRIS MAKES IT! Assist: Tracy LaVine
Score: 80-72

================================================================================
                              3RD QUARTER COMPLETE                              
================================================================================

3RD QUARTER SCORE: Team_016 30, Team_038 30

BOX SCORE:
================================================================================

Team_016
--------------------------------------------------------------------------------
Player                MIN  PTS  REB  AST  TO      FG   FG%      3P   3P%
--------------------------------------------------------------------------------
Vince Duncan           29   12    9    1   0   6/7    85.7     0/0   0.0
Giannis Ginobili       29   11    0    2   0   4/5    80.0     0/0   0.0
Ben Barrett            29    3    2    1   0   1/4    25.0     0/0   0.0
Vince Quickley         29    2    1    2   0   1/3    33.3     0/0   0.0
Collin Barnes          29    2    0    0   0   1/3    33.3     0/0   0.0

TEAM: FG: 13/22 (59.1%), 3PT: 5/9 (55.6%), REB: 11 (3 off, 8 def), AST: 6, TO: 1
TEAM FOULS: 6 [Team_038 in BONUS]


Team_038
--------------------------------------------------------------------------------
Player                MIN  PTS  REB  AST  TO      FG   FG%      3P   3P%
--------------------------------------------------------------------------------
Rudy Thompson          29   14    0    0   0   6/6   100.0     0/0   0.0
Luka Barnes            29    6    3    1   0   3/4    75.0     0/0   0.0
DeMar Harris           29    5    2    1   0   2/5    40.0     0/0   0.0
Tracy LaVine           29    5    7    3   0   2/5    40.0     0/0   0.0
Malcolm Poole          29    0    0    0   0   0/2     0.0     0/0   0.0

TEAM: FG: 13/22 (59.1%), 3PT: 4/8 (50.0%), REB: 13 (5 off, 8 def), AST: 5, TO: 1
TEAM FOULS: 4

================================================================================

================================================================================
                       4TH QUARTER - Team_016 vs Team_038                       
================================================================================

[12:00] Team_016 possession (Score: 80-72)
Vince Quickley drives and kicks out. FOUL! Shooting foul on DeMar Harris. Collin Barnes to the line for 2 free throws. [Team fouls: 1] (DeMar Harris: 1 personal fouls)   FT 1/2: MISS   FT 2/2: GOOD Collin Barnes makes 1/2 from the line.
Score: 81-72

[11:51] Team_038 possession (Score: 81-72)
Luka Barnes drives to the basket... Luka Barnes throws a bad pass! Stolen by Vince Duncan! TURNOVER! (live ball)

[11:39] Team_016 possession (Score: 81-72)
Collin Barnes attempts a 3Pt. Wide open! DeMar Harris is 6.7 feet away. [ZONE] Collin Barnes misses. Rebound secured by Luka Barnes.

[11:28] Team_038 possession (Score: 81-72)
Malcolm Poole drives to the basket... Malcolm Poole throws a bad pass out of bounds! TURNOVER! (dead ball)

[11:28] Substitution (Team_016): Collin Barnes OUT → Lamelo Herro IN (stamina_rule2)

[11:28] Substitution (Team_016): Giannis Ginobili OUT → Immanuel Nowitzki IN (stamina_rule2)

[11:28] Substitution (Team_016): Vince Quickley OUT → Kevin Butler IN (stamina_rule2)

[11:28] Substitution (Team_016): Ben Barrett OUT → Giannis Doncic IN (stamina_rule2)

[11:28] Substitution (Team_016): Vince Duncan OUT → Trae Barnes IN (stamina_rule2)

[11:28] Substitution (Team_038): Rudy Thompson OUT → Jalen Hyland IN (stamina_rule2)

[11:28] Substitution (Team_038): Malcolm Poole OUT → Jaren Jokic IN (stamina_rule2)

[11:28] Substitution (Team_038): DeMar Harris OUT → Magic Dosunmu IN (stamina_rule2)

[11:28] Substitution (Team_038): Tracy LaVine OUT → Jabari Carter IN (stamina_rule2)

[11:28] Substitution (Team_038): Luka Barnes OUT → Ja Smith IN (stamina_rule2)

[11:14] Team_016 possession (Score: 81-72)
Trae Barnes attempts a Midrange. Contested by Jabari Carter (4.5 feet, ZONE). TRAE BARNES MAKES IT! Assist: Immanuel Nowitzki
Score: 83-72

[11:03] Team_038 possession (Score: 83-72)
FOUL! Reach-in foul on Kevin Butler during the drive. [Team fouls: 1] No free throws, side out. (Kevin Butler: 1 personal fouls)

[10:46] Team_038 possession (Score: 83-72)
Jabari Carter attempts a Midrange. Contested by Kevin Butler (4.0 feet, ZONE). Jabari Carter misses. Offensive rebound by Ja Smith! Ja Smith's putback is no good. Rebound secured by Giannis Doncic.

[10:34] Team_016 possession (Score: 83-72)
FOUL! Offensive foul on Giannis Doncic! Jabari Carter drew the charge! [Team fouls: 2] (Giannis Doncic: 1 personal fouls) TURNOVER! (dead ball)

[10:18] Team_038 possession (Score: 83-72)
Jabari Carter attempts a Midrange. Contested by Giannis Doncic (3.6 feet, ZONE). Jabari Carter misses. Rebound secured by Trae Barnes.

[10:05] Team_016 possession (Score: 83-72)
Immanuel Nowitzki drives to the basket... FOUL! Offensive foul on Immanuel Nowitzki! Jaren Jokic drew the charge! [Team fouls: 3] (Immanuel Nowitzki: 1 personal fouls) TURNOVER! (dead ball)

[09:55] Team_038 possession (Score: 83-72)
Jaren Jokic attempts a Layup. Wide open! Immanuel Nowitzki is 6.8 feet away. [MAN] JAREN JOKIC MAKES IT! Assist: Jabari Carter
Score: 83-74

[09:44] Team_016 possession (Score: 83-74)
Trae Barnes attempts a Midrange. Contested by Ja Smith (5.0 feet, MAN). TRAE BARNES MAKES IT! Assist: Kevin Butler
Score: 85-74

[09:27] Team_038 possession (Score: 85-74)
FOUL! Holding foul on Immanuel Nowitzki. [Team fouls: 4] No free throws, side out. (Immanuel Nowitzki: 2 personal fouls)

[09:13] Team_038 possession (Score: 85-74)
Jalen Hyland attempts a Layup. BLOCKED BY GIANNIS DONCIC! Ball is loose! Rebound secured by Giannis Doncic.

[08:58] Team_016 possession (Score: 85-74)
Kevin Butler drives and kicks out. Giannis Doncic attempts a Midrange. Contested by Jabari Carter (4.9 feet, ZONE). Giannis Doncic misses. Rebound secured by Jalen Hyland.

[08:46] Team_038 possession (Score: 85-74)
Jaren Jokic attempts a Midrange. Contested by Immanuel Nowitzki (3.6 feet, ZONE). Jaren Jokic misses. Rebound secured by Lamelo Herro.

[08:30] Team_016 possession (Score: 85-74)
Lamelo Herro attempts a Midrange. Heavily contested by Jaren Jokic (1.2 feet, ZONE)! LAMELO HERRO MAKES IT!
Score: 87-74

[08:17] Team_038 possession (Score: 87-74)
Ja Smith attempts a Layup. Wide open! Giannis Doncic is 8.7 feet away. [ZONE] JA SMITH MAKES IT! Assist: Jaren Jokic
Score: 87-76

[08:06] Team_016 possession (Score: 87-76)
Immanuel Nowitzki attempts a 3Pt. Wide open! Jalen Hyland is 6.8 feet away. [ZONE] IMMANUEL NOWITZKI MAKES IT! Assist: Lamelo Herro
Score: 90-76

[07:51] Team_038 possession (Score: 90-76)
FOUL! Offensive foul on Jalen Hyland! Lamelo Herro drew the charge! [Team fouls: 2] (Jalen Hyland: 1 personal fouls) TURNOVER! (dead ball)

[07:36] Team_016 possession (Score: 90-76)
Trae Barnes drives, Jabari Carter stays with him. Trae Barnes attempts a Layup. Contested by Jabari Carter (3.3 feet, ZONE). Trae Barnes misses. Rebound secured by Ja Smith.

[07:19] Team_038 possession (Score: 90-76)
FOUL! Holding foul on Trae Barnes. [IN THE BONUS! 5 team fouls] Ja Smith to the line for 2 free throws. (Trae Barnes: 1 personal fouls)   FT 1/2: GOOD   FT 2/2: MISS Ja Smith makes 1/2 from the line. Rebound secured by Giannis Doncic.
Score: 90-77

[07:00] Team_016 possession (Score: 90-77)
FOUL! Shooting foul on Jabari Carter. Trae Barnes to the line for 2 free throws. [Team fouls: 3] (Jabari Carter: 1 personal fouls)   FT 1/2: GOOD   FT 2/2: MISS Trae Barnes makes 1/2 from the line. Rebound secured by Ja Smith.
Score: 91-77

[06:45] Team_038 possession (Score: 91-77)
Magic Dosunmu attempts a Midrange. Contested by Kevin Butler (2.1 feet, MAN). Magic Dosunmu misses. Rebound secured by Giannis Doncic.

[06:33] Team_016 possession (Score: 91-77)
Kevin Butler attempts a 3Pt. Contested by Jalen Hyland (3.2 feet, ZONE). Kevin Butler misses. Rebound secured by Ja Smith.

[06:19] Team_038 possession (Score: 91-77)
Ja Smith attempts a Midrange. Contested by Giannis Doncic (3.4 feet, ZONE). JA SMITH MAKES IT!
Score: 91-79

[06:04] Team_016 possession (Score: 91-79)
Kevin Butler attempts a Midrange. Contested by Magic Dosunmu (5.1 feet, ZONE). KEVIN BUTLER MAKES IT! Assist: Giannis Doncic
Score: 93-79

[05:50] Team_038 possession (Score: 93-79)
Magic Dosunmu attempts a 3Pt. Contested by Lamelo Herro (3.5 feet, ZONE). MAGIC DOSUNMU MAKES IT! Assist: Jaren Jokic
Score: 93-82

[05:33] Team_016 possession (Score: 93-82)
Trae Barnes drives, Ja Smith stays with him. Trae Barnes attempts a Dunk. Contested by Ja Smith (5.6 feet, MAN). TRAE BARNES MAKES IT! Assist: Immanuel Nowitzki
Score: 95-82

[05:19] Team_038 possession (Score: 95-82)
Magic Dosunmu attempts a 3Pt. Contested by Lamelo Herro (4.5 feet, ZONE). Magic Dosunmu misses. Offensive rebound by Ja Smith! Ja Smith puts it back in!
Score: 95-84

[05:01] Team_016 possession (Score: 95-84)
Immanuel Nowitzki attempts a Layup. Heavily contested by Ja Smith (1.7 feet, ZONE)! Immanuel Nowitzki misses. Rebound secured by Ja Smith.

[04:47] Team_038 possession (Score: 95-84)
Magic Dosunmu attempts a Midrange. Contested by Giannis Doncic (4.4 feet, ZONE). Magic Dosunmu misses. Offensive rebound by Jabari Carter! Jabari Carter puts it back in!
Score: 95-86

[04:29] Team_016 possession (Score: 95-86)
Giannis Doncic attempts a 3Pt. Contested by Jalen Hyland (5.9 feet, ZONE). GIANNIS DONCIC MAKES IT! Assist: Immanuel Nowitzki
Score: 98-86

[04:17] Team_038 possession (Score: 98-86)
Jaren Jokic attempts a Layup. BLOCKED BY GIANNIS DONCIC! Ball is loose! Rebound secured by Giannis Doncic.

[04:07] Team_016 possession (Score: 98-86)
Kevin Butler attempts a Layup. Contested by Ja Smith (3.5 feet, ZONE). KEVIN BUTLER MAKES IT!
Score: 100-86

[03:53] Team_038 possession (Score: 100-86)
Ja Smith makes the Layup and draws the foul on Trae Barnes! And-1! Ja Smith to the line for 1. [BONUS: 6 team fouls] (Trae Barnes: 2 personal fouls)   FT 1/1: GOOD Ja Smith makes 1/1 from the line.
Score: 100-89

[03:38] Team_016 possession (Score: 100-89)
Kevin Butler attempts a Midrange. Contested by Magic Dosunmu (4.4 feet, ZONE). Kevin Butler misses. Rebound secured by Jalen Hyland.

[03:25] Team_038 possession (Score: 100-89)
FOUL! Shooting foul on Giannis Doncic. Jabari Carter to the line for 2 free throws. [BONUS: 7 team fouls] (Giannis Doncic: 2 personal fouls)   FT 1/2: GOOD   FT 2/2: GOOD Jabari Carter makes 2/2 from the line.
Score: 100-91

[03:11] Team_016 possession (Score: 100-91)
Immanuel Nowitzki attempts a 3Pt. Contested by Jalen Hyland (2.9 feet, ZONE). Immanuel Nowitzki misses. Offensive rebound by Trae Barnes! Trae Barnes kicks it out.

[02:55] Team_016 possession (Score: 100-91)
Immanuel Nowitzki attempts a Layup. Heavily contested by Jaren Jokic (1.6 feet, MAN)! Immanuel Nowitzki misses. Rebound secured by Jabari Carter.

[02:37] Team_038 possession (Score: 100-91)
Jaren Jokic drives, Giannis Doncic stays with him. Jaren Jokic attempts a Layup. Contested by Giannis Doncic (4.5 feet, ZONE). JAREN JOKIC MAKES IT!
Score: 100-93

[02:27] Team_016 possession (Score: 100-93)
Immanuel Nowitzki attempts a Midrange. Contested by Jaren Jokic (2.8 feet, MAN). Immanuel Nowitzki misses. Rebound secured by Ja Smith.

[02:12] Team_038 possession (Score: 100-93)
Magic Dosunmu drives, Giannis Doncic stays with him. Magic Dosunmu attempts a Dunk. Heavily contested by Giannis Doncic (1.1 feet, ZONE)! MAGIC DOSUNMU MAKES IT!
Score: 100-95

[01:58] Team_016 possession (Score: 100-95)
Lamelo Herro attempts a 3Pt. Contested by Jalen Hyland (2.4 feet, ZONE). Lamelo Herro misses. FOUL! Loose ball foul on Jabari Carter during the rebound battle. [Team fouls: 4] No free throws, side out. (Jabari Carter: 2 personal fouls)

[01:40] Team_016 possession (Score: 100-95)
Immanuel Nowitzki attempts a 3Pt. Contested by Jaren Jokic (4.8 feet, MAN). Immanuel Nowitzki misses. Rebound secured by Jabari Carter.

[01:26] Team_038 possession (Score: 100-95)
Jalen Hyland attempts a 3Pt. Contested by Lamelo Herro (3.8 feet, ZONE). Jalen Hyland misses. Offensive rebound by Jabari Carter! Jabari Carter puts it back in!
Score: 100-97

[01:07] Team_016 possession (Score: 100-97)
FOUL! Shooting foul on Ja Smith. Giannis Doncic to the line for 2 free throws. [BONUS: 5 team fouls] (Ja Smith: 1 personal fouls)   FT 1/2: GOOD   FT 2/2: GOOD Giannis Doncic makes 2/2 from the line.
Score: 102-97

[00:52] Team_038 possession (Score: 102-97)
Jaren Jokic makes the 3Pt and draws the foul on Lamelo Herro! And-1! Jaren Jokic to the line for 1. [BONUS: 8 team fouls] (Lamelo Herro: 1 personal fouls)   FT 1/1: GOOD Jaren Jokic makes 1/1 from the line.
Score: 102-101

[00:36] Team_016 possession (Score: 102-101)
FOUL! Shooting foul on Magic Dosunmu. Kevin Butler to the line for 2 free throws. [BONUS: 6 team fouls] (Magic Dosunmu: 1 personal fouls)   FT 1/2: GOOD   FT 2/2: MISS Kevin Butler makes 1/2 from the line. Rebound secured by Jalen Hyland.
Score: 103-101

[00:25] Team_038 possession (Score: 103-101)
Jaren Jokic attempts a 3Pt. Contested by Immanuel Nowitzki (3.1 feet, MAN). Jaren Jokic misses. Offensive rebound by Ja Smith! Ja Smith puts it back in!
Score: 103-103

[00:13] Team_016 possession (Score: 103-103)
Trae Barnes attempts a Layup. Contested by Ja Smith (4.3 feet, ZONE). TRAE BARNES MAKES IT! Assist: Giannis Doncic
Score: 105-103

================================================================================
                              4TH QUARTER COMPLETE                              
================================================================================

4TH QUARTER SCORE: Team_016 25, Team_038 31

BOX SCORE:
================================================================================

Team_016
--------------------------------------------------------------------------------
Player                MIN  PTS  REB  AST  TO      FG   FG%      3P   3P%
--------------------------------------------------------------------------------
Trae Barnes            18    8    2    0   0   4/6    66.7     0/0   0.0
Giannis Doncic         18    5    6    2   0   2/2   100.0     0/0   0.0
Kevin Butler           18    4    0    1   0   2/6    33.3     0/0   0.0
Immanuel Nowitzki      18    3    0    3   0   1/5    20.0     0/0   0.0
Lamelo Herro           18    2    1    1   0   1/1   100.0     0/0   0.0
Collin Barnes          30    1    0    0   0   1/2    50.0     0/0   0.0

TEAM: FG: 11/22 (50.0%), 3PT: 2/5 (40.0%), REB: 8 (2 off, 6 def), AST: 7, TO: 2
TEAM FOULS: 8 [Team_038 in BONUS]


Team_038
--------------------------------------------------------------------------------
Player                MIN  PTS  REB  AST  TO      FG   FG%      3P   3P%
--------------------------------------------------------------------------------
Ja Smith               18   11    7    0   0   5/5   100.0     0/0   0.0
Jaren Jokic            18    8    0    2   0   3/5    60.0     0/0   0.0
Jabari Carter          18    6    4    1   0   3/5    60.0     0/0   0.0
Magic Dosunmu          18    5    0    0   0   2/3    66.7     0/0   0.0
Luka Barnes            30    0    1    0   0   0/0     0.0     0/0   0.0
Jalen Hyland           18    0    3    0   0   0/1     0.0     0/0   0.0

TEAM: FG: 13/20 (65.0%), 3PT: 5/5 (100.0%), REB: 16 (5 off, 11 def), AST: 3, TO: 3
TEAM FOULS: 6 [Team_016 in BONUS]

================================================================================

================================================================================
                               FULL GAME COMPLETE                               
================================================================================

FINAL SCORE: Team_016 105, Team_038 103

SCORING BY QUARTER:
--------------------------------------------------------------------------------
Team                     Q1     Q2     Q3     Q4    FINAL
--------------------------------------------------------------------------------
Team_016                 32     18     30     25      105
Team_038                 28     14     30     31      103
--------------------------------------------------------------------------------

FULL GAME BOX SCORE:
================================================================================

Team_016
--------------------------------------------------------------------------------
Player                MIN  PTS  REB  AST  TO      FG   FG%      3P   3P%      FT STL BLK
--------------------------------------------------------------------------------
Collin Barnes          30   11    0    2   1   4/10   40.0   0/3     0.0   1/2     0   1
Giannis Ginobili       30   18    0    4   0   6/9    66.7   3/6    50.0   0/0     0   0
Vince Quickley         30    6    6    8   0   7/11   63.6   0/2     0.0   0/0     1   0
Ben Barrett            30   14    5    1   1   6/10   60.0   3/5    60.0   3/3     0   0
Vince Duncan           30   22   14    3   0  10/15   66.7   1/3    33.3   4/5     2   0
Lamelo Herro           18    2    5    1   1   1/4    25.0   0/3     0.0   0/0     0   0
Immanuel Nowitzki      18    3    0    3   0   1/5    20.0   1/2    50.0   0/0     0   0
Kevin Butler           18    4    0    3   0   2/8    25.0   0/1     0.0   1/2     0   0
Giannis Doncic         18    9   10    2   1   4/5    80.0   1/2    50.0   2/2     0   3
Trae Barnes            18   12    4    0   1   6/10   60.0   0/0     0.0   1/3     0   0

TEAM: FG: 47/87 (54.0%), 3PT: 9/27 (33.3%), REB: 39 (10 off, 29 def), AST: 27, TO: 5


Team_038
--------------------------------------------------------------------------------
Player                MIN  PTS  REB  AST  TO      FG   FG%      3P   3P%      FT STL BLK
--------------------------------------------------------------------------------
Rudy Thompson          30   22    0    0   1  10/11   90.9   2/2   100.0   0/0     0   0
Malcolm Poole          30    4    0    2   2   2/8    25.0   0/3     0.0   2/2     0   0
DeMar Harris           30   12    6    5   2   7/12   58.3   2/4    50.0   3/3     0   1
Tracy LaVine           30   19   15    5   2   5/10   50.0   2/3    66.7   4/5     1   0
Luka Barnes            30    8    8    2   1   5/7    71.4   1/1   100.0   2/4     0   0
Jalen Hyland           18    0    6    0   1   1/5    20.0   1/3    33.3   0/0     0   0
Jaren Jokic            18   10    0    2   0   5/11   45.5   2/4    50.0   1/1     0   0
Magic Dosunmu          18    7    0    1   1   5/7    71.4   2/3    66.7   0/0     0   0
Jabari Carter          18    6    6    1   0   1/3    33.3   0/0     0.0   2/2     0   0
Ja Smith               18   13   10    0   0   4/5    80.0   0/1     0.0   2/3     1   1

TEAM: FG: 45/80 (56.2%), 3PT: 12/24 (50.0%), REB: 56 (18 off, 38 def), AST: 18, TO: 10

================================================================================
