================================================================================
                        FULL GAME - Team_027 vs Team_024                        
================================================================================

================================================================================
                       1ST QUARTER - Team_027 vs Team_024                       
================================================================================

[12:00] Team_027 possession (Score: 0-0)
Tony Doncic attempts a Layup. Contested by Anfernee Williamson (3.2 feet, ZONE). TONY DONCIC MAKES IT! Assist: Scottie Harden
Score: 2-0

[11:43] Team_024 possession (Score: 2-0)
Bradley Allen attempts a Midrange. Wide open! Tony Doncic is 6.2 feet away. [ZONE] BRADLEY ALLEN MAKES IT! Assist: Anfernee Williamson
Score: 2-2

[11:25] Team_027 possession (Score: 2-2)
Scottie Harden attempts a Layup. Contested by Bradley Allen (5.0 feet, MAN). SCOTTIE HARDEN MAKES IT! Assist: Bradley Dosunmu
Score: 4-2

[11:11] Team_024 possession (Score: 4-2)
Anfernee Williamson attempts a Layup. Contested by Bradley Dosunmu (3.8 feet, MAN). Anfernee Williamson misses. Rebound secured by Tony Doncic.

[10:57] Team_027 possession (Score: 4-2)
FOUL! Reach-in foul on Zach Fox during the drive. [Team fouls: 1] No free throws, side out. (Zach Fox: 1 personal fouls)

[10:45] Team_027 possession (Score: 4-2)
Bradley Dosunmu drives and kicks out. John Russell attempts a Midrange. Contested by Anfernee Williamson (4.2 feet, MAN). JOHN RUSSELL MAKES IT!
Score: 6-2

[10:32] Team_024 possession (Score: 6-2)
FOUL! Reach-in foul on John Russell during the drive. [Team fouls: 1] No free throws, side out. (John Russell: 1 personal fouls)

[10:20] Team_024 possession (Score: 6-2)
Zach Fox makes the Layup and draws the foul on Tony Doncic! And-1! Zach Fox to the line for 1. [Team fouls: 2] (Tony Doncic: 1 personal fouls)   FT 1/1: GOOD Zach Fox makes 1/1 from the line.
Score: 6-5

[10:04] Team_027 possession (Score: 6-5)
Bradley Dosunmu attempts a Layup. BLOCKED BY ANFERNEE WILLIAMSON! Ball is loose! Rebound secured by Zach Fox.

[09:53] Team_024 possession (Score: 6-5)
Ja Reaves attempts a Layup. Heavily contested by Tim Johnson (1.3 feet, MAN)! Ja Reaves misses. Offensive rebound by Draymond Towns! Draymond Towns puts it back in!
Score: 6-7

[09:41] Team_027 possession (Score: 6-7)
Tim Johnson attempts a 3Pt. Contested by Zach Fox (5.7 feet, ZONE). Tim Johnson misses. Rebound secured by Zach Fox.

[09:30] Team_024 possession (Score: 6-7)
Draymond Towns drives, picks up John Russell. Help arrives from Tony Doncic! Draymond Towns attempts a Dunk. Contested by Tony Doncic (4.2 feet, MAN). DRAYMOND TOWNS MAKES IT! Assist: Zach Fox
Score: 6-9

[09:15] Team_027 possession (Score: 6-9)
Tony Doncic attempts a Layup. Heavily contested by Draymond Towns (1.8 feet, ZONE)! Tony Doncic misses. Offensive rebound by John Russell! John Russell's putback is no good. Rebound secured by Draymond Towns.

[09:02] Team_024 possession (Score: 6-9)
Bradley Allen attempts a 3Pt. Contested by Tim Johnson (2.6 feet, ZONE). Bradley Allen misses. Rebound secured by Tony Doncic.

[08:46] Team_027 possession (Score: 6-9)
Tim Johnson attempts a 3Pt. Contested by Zach Fox (5.3 feet, ZONE). Tim Johnson misses. Offensive rebound by Bradley Dosunmu! Bradley Dosunmu kicks it out.

[08:30] Team_027 possession (Score: 6-9)
Tony Doncic attempts a Layup. Heavily contested by Zach Fox (0.5 feet, MAN)! TONY DONCIC MAKES IT!
Score: 8-9

[08:13] Team_024 possession (Score: 8-9)
Draymond Towns attempts a 3Pt. Contested by Bradley Dosunmu (4.8 feet, ZONE). Draymond Towns misses. Offensive rebound by Draymond Towns! Draymond Towns's putback is no good. Rebound secured by Tony Doncic.

[07:59] Team_027 possession (Score: 8-9)
John Russell throws a bad pass out of bounds! TURNOVER! (dead ball)

[07:46] Team_024 possession (Score: 8-9)
Draymond Towns drives, John Russell stays with him. Draymond Towns attempts a Dunk. Contested by John Russell (3.0 feet, MAN). DRAYMOND TOWNS MAKES IT! Assist: Bradley Allen
Score: 8-11

[07:31] Team_027 possession (Score: 8-11)
Tony Doncic attempts a Midrange. Contested by Zach Fox (4.0 feet, MAN). Tony Doncic misses. Offensive rebound by Bradley Dosunmu! Bradley Dosunmu kicks it out.

[07:18] Team_027 possession (Score: 8-11)
Bradley Dosunmu makes the Layup and draws the foul on Anfernee Williamson! And-1! Bradley Dosunmu to the line for 1. [Team fouls: 2] (Anfernee Williamson: 1 personal fouls)   FT 1/1: GOOD Bradley Dosunmu makes 1/1 from the line.
Score: 11-11

[07:04] Team_024 possession (Score: 11-11)
FOUL! Shooting foul on Bradley Dosunmu. Anfernee Williamson to the line for 2 free throws. [Team fouls: 3] (Bradley Dosunmu: 1 personal fouls)   FT 1/2: GOOD   FT 2/2: GOOD Anfernee Williamson makes 2/2 from the line.
Score: 11-13

[06:45] Team_027 possession (Score: 11-13)
Tony Doncic drives to the basket... Tony Doncic throws a bad pass! Stolen by Anfernee Williamson! TURNOVER! (live ball)

[06:32] Team_024 possession (Score: 11-13)
Zach Fox attempts a 3Pt. Contested by Tony Doncic (3.6 feet, MAN). Zach Fox misses. Rebound secured by John Russell.

[06:16] Team_027 possession (Score: 11-13)
Bradley Dosunmu attempts a 3Pt. Contested by Zach Fox (3.9 feet, ZONE). Bradley Dosunmu misses. Rebound secured by Draymond Towns.

[06:01] Team_024 possession (Score: 11-13)
Bradley Allen attempts a Midrange. Contested by Scottie Harden (4.2 feet, ZONE). BRADLEY ALLEN MAKES IT! Assist: Anfernee Williamson
Score: 11-15

[05:49] Team_027 possession (Score: 11-15)
Tony Doncic attempts a 3Pt. Wide open! Zach Fox is 7.0 feet away. [MAN] Tony Doncic misses. Rebound secured by Zach Fox.

[05:33] Team_024 possession (Score: 11-15)
Ja Reaves drives and kicks out. Ja Reaves attempts a 3Pt. Contested by Tim Johnson (5.6 feet, MAN). JA REAVES MAKES IT! Assist: Anfernee Williamson
Score: 11-18

[05:20] Team_027 possession (Score: 11-18)
John Russell loses the ball! Stripped by Anfernee Williamson! TURNOVER! (live ball)

[05:07] Team_024 possession (Score: 11-18)
Zach Fox loses the ball! Stripped by Tony Doncic! TURNOVER! (live ball)

[04:54] Team_027 possession (Score: 11-18)
FOUL! Reach-in foul on Zach Fox during the drive. [Team fouls: 3] No free throws, side out. (Zach Fox: 2 personal fouls)

[04:42] Team_027 possession (Score: 11-18)
FOUL! Shooting foul on Zach Fox. Tony Doncic to the line for 3 free throws. [Team fouls: 4] (Zach Fox: 3 personal fouls)   FT 1/3: GOOD   FT 2/3: GOOD   FT 3/3: GOOD Tony Doncic makes 3/3 from the line.
Score: 14-18

[04:31] Team_024 possession (Score: 14-18)
Bradley Allen attempts a 3Pt. Wide open! Scottie Harden is 7.6 feet away. [MAN] BRADLEY ALLEN MAKES IT! Assist: Anfernee Williamson
Score: 14-21

[04:17] Team_027 possession (Score: 14-21)
John Russell attempts a 3Pt. Contested by Zach Fox (4.0 feet, ZONE). John Russell misses. Rebound secured by Anfernee Williamson.

[03:58] Team_024 possession (Score: 14-21)
Anfernee Williamson loses control! Ball rolls out of bounds! TURNOVER! (dead ball)

[03:42] Team_027 possession (Score: 14-21)
Scottie Harden attempts a 3Pt. Contested by Bradley Allen (5.2 feet, MAN). Scottie Harden misses. Rebound secured by Anfernee Williamson.

[03:32] Team_024 possession (Score: 14-21)
Draymond Towns drives, John Russell stays with him. Draymond Towns attempts a Dunk. Heavily contested by John Russell (1.2 feet, ZONE)! Draymond Towns misses. Rebound secured by Bradley Dosunmu.

[03:22] Team_027 possession (Score: 14-21)
FOUL! Shooting foul on Anfernee Williamson. Tim Johnson to the line for 2 free throws. [BONUS: 5 team fouls] (Anfernee Williamson: 2 personal fouls)   FT 1/2: GOOD   FT 2/2: GOOD Tim Johnson makes 2/2 from the line.
Score: 16-21

[03:03] Team_024 possession (Score: 16-21)
FOUL! Holding foul on John Russell. [Team fouls: 4] No free throws, side out. (John Russell: 2 personal fouls)

[02:47] Team_024 possession (Score: 16-21)
Anfernee Williamson attempts a Midrange. Contested by Tony Doncic (4.9 feet, ZONE). Anfernee Williamson misses. Rebound secured by Tony Doncic.

[02:32] Team_027 possession (Score: 16-21)
Tim Johnson attempts a 3Pt. Contested by Ja Reaves (5.2 feet, MAN). Tim Johnson misses. Rebound secured by Zach Fox.

[02:17] Team_024 possession (Score: 16-21)
Ja Reaves attempts a 3Pt. Contested by Tim Johnson (4.0 feet, MAN). JA REAVES MAKES IT! Assist: Anfernee Williamson
Score: 16-24

[02:04] Team_027 possession (Score: 16-24)
John Russell drives and kicks out. Tim Johnson attempts a 3Pt. Contested by Ja Reaves (5.6 feet, MAN). Tim Johnson misses. Rebound secured by Zach Fox.

[01:46] Team_024 possession (Score: 16-24)
Zach Fox drives, John Russell stays with him. Zach Fox attempts a Dunk. Contested by John Russell (4.5 feet, ZONE). Zach Fox misses. Rebound secured by John Russell.

[01:35] Team_027 possession (Score: 16-24)
Scottie Harden drives and kicks out. Bradley Dosunmu attempts a 3Pt. Contested by Bradley Allen (5.6 feet, ZONE). Bradley Dosunmu misses. Rebound secured by Draymond Towns.

[01:24] Team_024 possession (Score: 16-24)
FOUL! Reach-in foul on John Russell during the drive. [IN THE BONUS! 5 team fouls] Anfernee Williamson to the line for 2 free throws. (John Russell: 3 personal fouls)   FT 1/2: GOOD   FT 2/2: GOOD Anfernee Williamson makes 2/2 from the line.
Score: 16-26

[01:06] Team_027 possession (Score: 16-26)
Scottie Harden commits a violation (traveling/carry)! TURNOVER! (dead ball)

[01:06] Substitution (Team_027): Tim Johnson OUT → CJ Green IN (stamina_rule2)

[01:06] Substitution (Team_027): Tony Doncic OUT → Dirk Lillard IN (stamina_rule2)

[01:06] Substitution (Team_027): Scottie Harden OUT → Rudy Quickley IN (stamina_rule2)

[01:06] Substitution (Team_027): Bradley Dosunmu OUT → LeBron Russell IN (stamina_rule2)

[01:06] Substitution (Team_027): John Russell OUT → Ben Stewart IN (stamina_rule2)

[01:06] Substitution (Team_024): Ja Reaves OUT → Victor Simons IN (stamina_rule2)

[01:06] Substitution (Team_024): Zach Fox OUT → Vince Irving IN (stamina_rule2)

[01:06] Substitution (Team_024): Bradley Allen OUT → Zach Durant IN (stamina_rule2)

[01:06] Substitution (Team_024): Anfernee Williamson OUT → Julius Harris IN (stamina_rule2)

[01:06] Substitution (Team_024): Draymond Towns OUT → Terry Rozier IN (stamina_rule2)

[00:49] Team_024 possession (Score: 16-26)
Vince Irving attempts a 3Pt. Wide open! CJ Green is 7.3 feet away. [ZONE] VINCE IRVING MAKES IT! Assist: Julius Harris
Score: 16-29

[00:32] Team_027 possession (Score: 16-29)
Rudy Quickley drives to the basket... Rudy Quickley throws a bad pass! Stolen by Terry Rozier! TURNOVER! (live ball)

[00:22] Team_024 possession (Score: 16-29)
Julius Harris attempts a Midrange. Contested by LeBron Russell (3.1 feet, MAN). JULIUS HARRIS MAKES IT!
Score: 16-31

[00:09] Team_027 possession (Score: 16-31)
CJ Green makes the Layup and draws the foul on Vince Irving! And-1! CJ Green to the line for 1. [BONUS: 6 team fouls] (Vince Irving: 1 personal fouls)   FT 1/1: GOOD CJ Green makes 1/1 from the line.
Score: 19-31

================================================================================
                              1ST QUARTER COMPLETE                              
================================================================================

1ST QUARTER SCORE: Team_027 19, Team_024 31

BOX SCORE:
================================================================================

Team_027
--------------------------------------------------------------------------------
Player                MIN  PTS  REB  AST  TO      FG   FG%      3P   3P%
--------------------------------------------------------------------------------
Tony Doncic            11    7    4    0   0   3/5    60.0     0/0   0.0
Bradley Dosunmu        11    3    3    1   0   1/3    33.3     0/0   0.0
CJ Green                1    3    0    0   0   1/1   100.0     0/0   0.0
Scottie Harden         11    2    0    1   0   1/3    33.3     0/0   0.0
John Russell           11    2    2    0   0   1/3    33.3     0/0   0.0
Tim Johnson            11    2    0    0   0   1/3    33.3     0/0   0.0

TEAM: FG: 8/18 (44.4%), 3PT: 1/7 (14.3%), REB: 9 (3 off, 6 def), AST: 2, TO: 5
TEAM FOULS: 5 [Team_024 in BONUS]


Team_024
--------------------------------------------------------------------------------
Player                MIN  PTS  REB  AST  TO      FG   FG%      3P   3P%
--------------------------------------------------------------------------------
Bradley Allen          11    7    0    1   0   3/4    75.0     0/0   0.0
Draymond Towns         11    6    4    0   0   3/5    60.0     0/0   0.0
Ja Reaves              11    6    0    0   0   2/2   100.0     0/0   0.0
Anfernee Williamson    11    4    2    5   0   2/4    50.0     0/0   0.0
Zach Fox               11    3    5    1   0   1/3    33.3     0/0   0.0
Vince Irving            1    3    0    0   0   1/1   100.0     0/0   0.0
Julius Harris           1    2    0    1   0   1/1   100.0     0/0   0.0

TEAM: FG: 13/20 (65.0%), 3PT: 3/6 (50.0%), REB: 11 (2 off, 9 def), AST: 8, TO: 2
TEAM FOULS: 6 [Team_027 in BONUS]

================================================================================

================================================================================
                       2ND QUARTER - Team_027 vs Team_024                       
================================================================================

[12:00] Team_027 possession (Score: 19-31)
Bradley Dosunmu makes the Midrange and draws the foul on Anfernee Williamson! And-1! Bradley Dosunmu to the line for 1. [Team fouls: 1] (Anfernee Williamson: 1 personal fouls)   FT 1/1: GOOD Bradley Dosunmu makes 1/1 from the line.
Score: 22-31

[11:47] Team_024 possession (Score: 22-31)
Zach Fox attempts a 3Pt. Contested by Tim Johnson (4.1 feet, ZONE). ZACH FOX MAKES IT! Assist: Draymond Towns
Score: 22-34

[11:32] Team_027 possession (Score: 22-34)
Bradley Dosunmu attempts a Midrange. Contested by Anfernee Williamson (5.0 feet, MAN). Bradley Dosunmu misses. Offensive rebound by John Russell! John Russell puts it back in!
Score: 24-34

[11:14] Team_024 possession (Score: 24-34)
Ja Reaves loses the ball! Stripped by Tim Johnson! TURNOVER! (live ball)

[11:03] Team_027 possession (Score: 24-34)
Bradley Dosunmu drives and kicks out. Scottie Harden attempts a 3Pt. Contested by Bradley Allen (3.7 feet, MAN). Scottie Harden misses. Rebound secured by Anfernee Williamson.

[10:48] Team_024 possession (Score: 24-34)
FOUL! Shooting foul on Tim Johnson. Ja Reaves to the line for 3 free throws. [Team fouls: 1] (Tim Johnson: 1 personal fouls)   FT 1/3: GOOD   FT 2/3: GOOD   FT 3/3: GOOD Ja Reaves makes 3/3 from the line.
Score: 24-37

[10:34] Team_027 possession (Score: 24-37)
John Russell attempts a Dunk. BLOCKED BY DRAYMOND TOWNS! Ball is loose! Rebound secured by Zach Fox.

[10:17] Team_024 possession (Score: 24-37)
FOUL! Shooting foul on Tim Johnson. Ja Reaves to the line for 2 free throws. [Team fouls: 2] (Tim Johnson: 2 personal fouls)   FT 1/2: GOOD   FT 2/2: GOOD Ja Reaves makes 2/2 from the line.
Score: 24-39

[10:04] Team_027 possession (Score: 24-39)
John Russell drives to the basket... John Russell throws a bad pass! Stolen by Anfernee Williamson! TURNOVER! (live ball)

[09:52] Team_024 possession (Score: 24-39)
Ja Reaves attempts a Midrange. Wide open! Tim Johnson is 9.0 feet away. [MAN] JA REAVES MAKES IT! Assist: Bradley Allen
Score: 24-41

[09:36] Team_027 possession (Score: 24-41)
Tony Doncic drives and kicks out. Bradley Dosunmu attempts a 3Pt. Contested by Anfernee Williamson (4.6 feet, MAN). BRADLEY DOSUNMU MAKES IT! Assist: Tony Doncic
Score: 27-41

[09:21] Team_024 possession (Score: 27-41)
Ja Reaves attempts a Midrange. Contested by Tim Johnson (4.9 feet, MAN). JA REAVES MAKES IT!
Score: 27-43

[09:05] Team_027 possession (Score: 27-43)
Tim Johnson attempts a 3Pt. Contested by Ja Reaves (5.1 feet, MAN). Tim Johnson misses. Rebound secured by Anfernee Williamson.

[08:50] Team_024 possession (Score: 27-43)
Draymond Towns attempts a Midrange. Heavily contested by Bradley Dosunmu (1.2 feet, ZONE)! Draymond Towns misses. Rebound secured by Bradley Dosunmu.

[08:35] Team_027 possession (Score: 27-43)
Scottie Harden attempts a Midrange. Contested by Anfernee Williamson (4.5 feet, ZONE). Scottie Harden misses. FOUL! Loose ball foul on Anfernee Williamson during the rebound battle. [Team fouls: 2] No free throws, side out. (Anfernee Williamson: 2 personal fouls)

[08:20] Team_027 possession (Score: 27-43)
Tim Johnson attempts a 3Pt. Wide open! Bradley Allen is 6.7 feet away. [ZONE] Tim Johnson misses. Rebound secured by Draymond Towns.

[08:01] Team_024 possession (Score: 27-43)
Draymond Towns attempts a Layup. BLOCKED BY TONY DONCIC! Ball is loose! Rebound secured by Tony Doncic.

[07:47] Team_027 possession (Score: 27-43)
Tim Johnson attempts a Layup. Wide open! Ja Reaves is 6.5 feet away. [MAN] TIM JOHNSON MAKES IT! Assist: Tony Doncic
Score: 29-43

[07:30] Team_024 possession (Score: 29-43)
Zach Fox makes the Layup and draws the foul on Scottie Harden! And-1! Zach Fox to the line for 1. [Team fouls: 3] (Scottie Harden: 1 personal fouls)   FT 1/1: GOOD Zach Fox makes 1/1 from the line.
Score: 29-46

[07:14] Team_027 possession (Score: 29-46)
Tim Johnson drives and kicks out. Bradley Dosunmu attempts a 3Pt. Contested by Zach Fox (2.8 feet, ZONE). Bradley Dosunmu misses. Rebound secured by Anfernee Williamson.

[06:58] Team_024 possession (Score: 29-46)
Bradley Allen makes the Dunk and draws the foul on Tony Doncic! And-1! Bradley Allen to the line for 1. [Team fouls: 4] (Tony Doncic: 1 personal fouls)   FT 1/1: GOOD Bradley Allen makes 1/1 from the line.
Score: 29-49

[06:44] Team_027 possession (Score: 29-49)
Tim Johnson attempts a Layup. BLOCKED BY ANFERNEE WILLIAMSON! Ball is loose! Rebound secured by Zach Fox.

[06:31] Team_024 possession (Score: 29-49)
FOUL! Reach-in foul on Scottie Harden during the drive. [IN THE BONUS! 5 team fouls] Bradley Allen to the line for 2 free throws. (Scottie Harden: 2 personal fouls)   FT 1/2: GOOD   FT 2/2: MISS Bradley Allen makes 1/2 from the line. Rebound secured by Tony Doncic.
Score: 29-50

[06:19] Team_027 possession (Score: 29-50)
Tim Johnson attempts a 3Pt. Contested by Zach Fox (3.4 feet, ZONE). Tim Johnson misses. Rebound secured by Zach Fox.

[06:06] Team_024 possession (Score: 29-50)
Anfernee Williamson drives to the basket... Anfernee Williamson loses the ball! Stripped by Bradley Dosunmu! TURNOVER! (live ball)

[05:54] Team_027 possession (Score: 29-50)
Tony Doncic attempts a 3Pt. Contested by Zach Fox (2.3 feet, MAN). Tony Doncic misses. Rebound secured by Draymond Towns.

[05:38] Team_024 possession (Score: 29-50)
Ja Reaves makes the Layup and draws the foul on Tim Johnson! And-1! Ja Reaves to the line for 1. [BONUS: 6 team fouls] (Tim Johnson: 3 personal fouls)   FT 1/1: GOOD Ja Reaves makes 1/1 from the line.
Score: 29-53

[05:29] Team_027 possession (Score: 29-53)
Tony Doncic drives and kicks out. Tony Doncic attempts a Midrange. Contested by Anfernee Williamson (4.8 feet, ZONE). Tony Doncic misses. Offensive rebound by Bradley Dosunmu! Bradley Dosunmu kicks it out.

[05:14] Team_027 possession (Score: 29-53)
Bradley Dosunmu attempts a Layup. Wide open! Anfernee Williamson is 6.6 feet away. [ZONE] BRADLEY DOSUNMU MAKES IT! Assist: John Russell
Score: 31-53

[05:02] Team_024 possession (Score: 31-53)
Anfernee Williamson attempts a 3Pt. Contested by Bradley Dosunmu (3.8 feet, ZONE). Anfernee Williamson misses. Rebound secured by John Russell.

[04:46] Team_027 possession (Score: 31-53)
Bradley Dosunmu attempts a 3Pt. Contested by Anfernee Williamson (4.3 feet, MAN). Bradley Dosunmu misses. Rebound secured by Zach Fox.

[04:29] Team_024 possession (Score: 31-53)
FOUL! Shooting foul on John Russell. Draymond Towns to the line for 2 free throws. [BONUS: 7 team fouls] (John Russell: 1 personal fouls)   FT 1/2: GOOD   FT 2/2: GOOD Draymond Towns makes 2/2 from the line.
Score: 31-55

[04:13] Team_027 possession (Score: 31-55)
Bradley Dosunmu drives to the basket... Bradley Dosunmu throws a bad pass out of bounds! TURNOVER! (dead ball)

[04:13] Substitution (Team_027): Tim Johnson OUT → CJ Green IN (stamina_rule2)

[04:13] Substitution (Team_027): Tony Doncic OUT → Dirk Lillard IN (stamina_rule2)

[04:13] Substitution (Team_027): Scottie Harden OUT → Rudy Quickley IN (stamina_rule2)

[04:13] Substitution (Team_027): Bradley Dosunmu OUT → LeBron Russell IN (stamina_rule2)

[04:13] Substitution (Team_027): John Russell OUT → Ben Stewart IN (stamina_rule2)

[04:13] Substitution (Team_024): Ja Reaves OUT → Victor Simons IN (stamina_rule2)

[04:13] Substitution (Team_024): Zach Fox OUT → Vince Irving IN (stamina_rule2)

[04:13] Substitution (Team_024): Bradley Allen OUT → Zach Durant IN (stamina_rule2)

[04:13] Substitution (Team_024): Anfernee Williamson OUT → Julius Harris IN (stamina_rule2)

[04:13] Substitution (Team_024): Draymond Towns OUT → Terry Rozier IN (stamina_rule2)

[04:03] Team_024 possession (Score: 31-55)
Vince Irving drives, picks up Dirk Lillard. Help arrives from Rudy Quickley! Vince Irving attempts a Layup. Contested by Rudy Quickley (3.4 feet, MAN). VINCE IRVING MAKES IT! Assist: Zach Durant
Score: 31-57

[03:48] Team_027 possession (Score: 31-57)
CJ Green attempts a 3Pt. Wide open! Victor Simons is 7.3 feet away. [MAN] CJ GREEN MAKES IT!
Score: 34-57

[03:35] Team_024 possession (Score: 34-57)
Victor Simons attempts a 3Pt. Contested by Rudy Quickley (2.7 feet, ZONE). Victor Simons misses. Offensive rebound by Terry Rozier! Terry Rozier puts it back in!
Score: 34-59

[03:21] Team_027 possession (Score: 34-59)
Dirk Lillard attempts a 3Pt. Heavily contested by Zach Durant (2.0 feet, ZONE)! DIRK LILLARD MAKES IT!
Score: 37-59

[03:07] Team_024 possession (Score: 37-59)
Terry Rozier attempts a 3Pt. Contested by Rudy Quickley (3.4 feet, ZONE). Terry Rozier misses. FOUL! Loose ball foul on Ben Stewart during the rebound battle. [IN THE BONUS! 8 team fouls] Julius Harris to the line for 2 free throws. (Ben Stewart: 1 personal fouls)   FT 1/2: MISS   FT 2/2: GOOD Julius Harris makes 1/2 from the line.
Score: 37-60

[02:54] Team_027 possession (Score: 37-60)
LeBron Russell attempts a Midrange. Contested by Vince Irving (3.8 feet, ZONE). LeBron Russell misses. Rebound secured by Terry Rozier.

[02:44] Team_024 possession (Score: 37-60)
Victor Simons drives to the basket... Victor Simons loses control! Ball rolls out of bounds! TURNOVER! (dead ball)

[02:28] Team_027 possession (Score: 37-60)
LeBron Russell attempts a 3Pt. Wide open! Julius Harris is 6.4 feet away. [MAN] LeBron Russell misses. Rebound secured by Zach Durant.

[02:16] Team_024 possession (Score: 37-60)
Vince Irving attempts a 3Pt. Contested by Dirk Lillard (3.3 feet, MAN). Vince Irving misses. Rebound secured by Dirk Lillard.

[02:01] Team_027 possession (Score: 37-60)
Ben Stewart drives, picks up Terry Rozier. Help arrives from Vince Irving! Ben Stewart attempts a Dunk. Heavily contested by Vince Irving (0.5 feet, MAN)! BEN STEWART MAKES IT! Assist: LeBron Russell
Score: 39-60

[01:49] Team_024 possession (Score: 39-60)
Zach Durant attempts a Midrange. Heavily contested by Dirk Lillard (0.5 feet, ZONE)! ZACH DURANT MAKES IT!
Score: 39-62

[01:32] Team_027 possession (Score: 39-62)
CJ Green attempts a 3Pt. Contested by Victor Simons (3.8 feet, MAN). CJ GREEN MAKES IT! Assist: Dirk Lillard
Score: 42-62

[01:18] Team_024 possession (Score: 42-62)
Victor Simons attempts a Midrange. Wide open! CJ Green is 6.9 feet away. [ZONE] VICTOR SIMONS MAKES IT! Assist: Terry Rozier
Score: 42-64

[01:03] Team_027 possession (Score: 42-64)
LeBron Russell drives, Terry Rozier stays with him. LeBron Russell attempts a Dunk. Contested by Terry Rozier (2.4 feet, ZONE). LEBRON RUSSELL MAKES IT! Assist: Dirk Lillard
Score: 44-64

[00:49] Team_024 possession (Score: 44-64)
FOUL! Shooting foul on Dirk Lillard. Vince Irving to the line for 2 free throws. [BONUS: 9 team fouls] (Dirk Lillard: 1 personal fouls)   FT 1/2: GOOD   FT 2/2: GOOD Vince Irving makes 2/2 from the line.
Score: 44-66

[00:33] Team_027 possession (Score: 44-66)
Dirk Lillard attempts a Layup. Contested by Terry Rozier (4.2 feet, ZONE). DIRK LILLARD MAKES IT! Assist: Rudy Quickley
Score: 46-66

[00:17] Team_024 possession (Score: 46-66)
Victor Simons attempts a 3Pt. Contested by CJ Green (4.5 feet, MAN). Victor Simons misses. FOUL! Loose ball foul on LeBron Russell during the rebound battle. [IN THE BONUS! 10 team fouls] Julius Harris to the line for 2 free throws. (LeBron Russell: 1 personal fouls)   FT 1/2: MISS   FT 2/2: GOOD Julius Harris makes 1/2 from the line.
Score: 46-67

================================================================================
                              2ND QUARTER COMPLETE                              
================================================================================

2ND QUARTER SCORE: Team_027 27, Team_024 36

BOX SCORE:
================================================================================

Team_027
--------------------------------------------------------------------------------
Player                MIN  PTS  REB  AST  TO      FG   FG%      3P   3P%
--------------------------------------------------------------------------------
Bradley Dosunmu        19    8    2    0   0   3/5    60.0     0/0   0.0
CJ Green                5    6    0    0   0   2/2   100.0     0/0   0.0
Dirk Lillard            5    5    1    2   0   2/2   100.0     0/0   0.0
John Russell           19    2    3    1   0   1/2    50.0     0/0   0.0
Tim Johnson            19    2    0    0   0   1/6    16.7     0/0   0.0
LeBron Russell          5    2    0    1   0   1/3    33.3     0/0   0.0
Ben Stewart             5    2    0    0   0   1/1   100.0     0/0   0.0
Tony Doncic            19    0    2    2   0   0/1     0.0     0/0   0.0
Rudy Quickley           5    0    0    1   0   0/0     0.0     0/0   0.0

TEAM: FG: 11/22 (50.0%), 3PT: 3/9 (33.3%), REB: 8 (3 off, 5 def), AST: 7, TO: 2
TEAM FOULS: 10 [Team_024 in BONUS]


Team_024
--------------------------------------------------------------------------------
Player                MIN  PTS  REB  AST  TO      FG   FG%      3P   3P%
--------------------------------------------------------------------------------
Ja Reaves              19   12    0    0   0   5/5   100.0     0/0   0.0
Zach Fox               19    6    4    0   0   2/2   100.0     0/0   0.0
Vince Irving            5    4    0    0   0   2/3    66.7     0/0   0.0
Bradley Allen          19    3    0    1   0   1/2    50.0     0/0   0.0
Draymond Towns         19    2    2    1   0   1/3    33.3     0/0   0.0
Zach Durant             5    2    1    1   0   1/1   100.0     0/0   0.0
Terry Rozier            5    2    2    1   0   1/1   100.0     0/0   0.0
Julius Harris           5    2    0    0   0   2/2   100.0     0/0   0.0
Victor Simons           5    2    0    0   0   1/1   100.0     0/0   0.0
Anfernee Williamson    19    0    3    0   0   0/1     0.0     0/0   0.0

TEAM: FG: 16/21 (76.2%), 3PT: 5/7 (71.4%), REB: 12 (1 off, 11 def), AST: 4, TO: 3
TEAM FOULS: 2

================================================================================

================================================================================
                       3RD QUARTER - Team_027 vs Team_024                       
================================================================================

[12:00] Team_027 possession (Score: 46-67)
FOUL! Reach-in foul on Ja Reaves during the drive. [Team fouls: 1] No free throws, side out. (Ja Reaves: 1 personal fouls)

[11:48] Team_027 possession (Score: 46-67)
Scottie Harden drives and kicks out. Tony Doncic attempts a 3Pt. Contested by Zach Fox (2.6 feet, MAN). Tony Doncic misses. Rebound secured by Anfernee Williamson.

[11:34] Team_024 possession (Score: 46-67)
FOUL! Reach-in foul on John Russell during the drive. [Team fouls: 1] No free throws, side out. (John Russell: 1 personal fouls)

[11:23] Team_024 possession (Score: 46-67)
Bradley Allen drives, Scottie Harden stays with him. Bradley Allen attempts a Dunk. Wide open! Scottie Harden is 7.0 feet away. [MAN] Bradley Allen misses. Offensive rebound by Draymond Towns! Draymond Towns puts it back in!
Score: 46-69

[11:07] Team_027 possession (Score: 46-69)
Tim Johnson drives to the basket... Tim Johnson throws a bad pass out of bounds! TURNOVER! (dead ball)

[10:53] Team_024 possession (Score: 46-69)
Anfernee Williamson drives, Bradley Dosunmu stays with him. Anfernee Williamson attempts a Layup. Contested by Bradley Dosunmu (5.7 feet, MAN). ANFERNEE WILLIAMSON MAKES IT!
Score: 46-71

[10:41] Team_027 possession (Score: 46-71)
John Russell drives, Anfernee Williamson stays with him. John Russell attempts a Dunk. Contested by Anfernee Williamson (2.8 feet, MAN). JOHN RUSSELL MAKES IT!
Score: 48-71

[10:28] Team_024 possession (Score: 48-71)
Bradley Allen attempts a Midrange. Contested by Scottie Harden (3.5 feet, MAN). Bradley Allen misses. Rebound secured by Bradley Dosunmu.

[10:18] Team_027 possession (Score: 48-71)
FOUL! Shooting foul on Zach Fox. Scottie Harden to the line for 3 free throws. [Team fouls: 2] (Zach Fox: 1 personal fouls)   FT 1/3: MISS   FT 2/3: GOOD   FT 3/3: GOOD Scottie Harden makes 2/3 from the line.
Score: 50-71

[10:01] Team_024 possession (Score: 50-71)
Draymond Towns attempts a Midrange. Contested by John Russell (5.7 feet, MAN). DRAYMOND TOWNS MAKES IT!
Score: 50-73

[09:51] Team_027 possession (Score: 50-73)
Scottie Harden drives and kicks out. FOUL! Shooting foul on Anfernee Williamson. Bradley Dosunmu to the line for 3 free throws. [Team fouls: 3] (Anfernee Williamson: 1 personal fouls)   FT 1/3: GOOD   FT 2/3: GOOD   FT 3/3: GOOD Bradley Dosunmu makes 3/3 from the line.
Score: 53-73

[09:37] Team_024 possession (Score: 53-73)
Zach Fox drives to the basket... Zach Fox throws a bad pass out of bounds! TURNOVER! (dead ball)

[09:18] Team_027 possession (Score: 53-73)
John Russell attempts a 3Pt. Contested by Anfernee Williamson (3.4 feet, MAN). John Russell misses. Offensive rebound by John Russell! John Russell puts it back in!
Score: 55-73

[09:04] Team_024 possession (Score: 55-73)
Draymond Towns drives and kicks out. Zach Fox attempts a Midrange. Contested by Tony Doncic (5.0 feet, MAN). Zach Fox misses. Rebound secured by John Russell.

[08:47] Team_027 possession (Score: 55-73)
John Russell attempts a 3Pt. Contested by Anfernee Williamson (4.3 feet, MAN). John Russell misses. Offensive rebound by John Russell! John Russell's putback is no good. Rebound secured by Zach Fox.

[08:30] Team_024 possession (Score: 55-73)
Zach Fox attempts a Layup. Contested by Tony Doncic (3.6 feet, MAN). ZACH FOX MAKES IT! Assist: Anfernee Williamson
Score: 55-75

[08:15] Team_027 possession (Score: 55-75)
Bradley Dosunmu attempts a Midrange. Contested by Anfernee Williamson (3.0 feet, MAN). Bradley Dosunmu misses. Offensive rebound by Bradley Dosunmu! Bradley Dosunmu kicks it out.

[08:05] Team_027 possession (Score: 55-75)
FOUL! Offensive foul on Scottie Harden! Bradley Allen drew the charge! [Team fouls: 2] (Scottie Harden: 1 personal fouls) TURNOVER! (dead ball)

[07:54] Team_024 possession (Score: 55-75)
Draymond Towns attempts a Midrange. Contested by Scottie Harden (3.8 feet, ZONE). Draymond Towns misses. Rebound secured by John Russell.

[07:41] Team_027 possession (Score: 55-75)
Tony Doncic attempts a Layup. Contested by Zach Fox (4.1 feet, MAN). Tony Doncic misses. Rebound secured by Draymond Towns.

[07:27] Team_024 possession (Score: 55-75)
Ja Reaves attempts a Layup. Heavily contested by John Russell (1.7 feet, ZONE)! JA REAVES MAKES IT! Assist: Bradley Allen
Score: 55-77

[07:13] Team_027 possession (Score: 55-77)
Scottie Harden attempts a 3Pt. Contested by Bradley Allen (5.6 feet, MAN). Scottie Harden misses. Rebound secured by Anfernee Williamson.

[06:59] Team_024 possession (Score: 55-77)
Zach Fox attempts a Midrange. Contested by Tony Doncic (2.8 feet, MAN). ZACH FOX MAKES IT! Assist: Anfernee Williamson
Score: 55-79

[06:46] Team_027 possession (Score: 55-79)
Bradley Dosunmu drives to the basket... FOUL! Offensive foul on Bradley Dosunmu! Anfernee Williamson drew the charge! [Team fouls: 3] (Bradley Dosunmu: 1 personal fouls) TURNOVER! (dead ball)

[06:35] Team_024 possession (Score: 55-79)
Zach Fox attempts a Midrange. Contested by Tony Doncic (3.4 feet, MAN). Zach Fox misses. Rebound secured by Bradley Dosunmu.

[06:18] Team_027 possession (Score: 55-79)
Scottie Harden attempts a 3Pt. Heavily contested by Bradley Allen (1.9 feet, MAN)! SCOTTIE HARDEN MAKES IT! Assist: John Russell
Score: 58-79

[06:06] Team_024 possession (Score: 58-79)
Bradley Allen attempts a Midrange. Contested by Tony Doncic (4.6 feet, ZONE). Bradley Allen misses. Rebound secured by John Russell.

[05:50] Team_027 possession (Score: 58-79)
Scottie Harden drives, picks up Bradley Allen. Help arrives from Zach Fox! Scottie Harden attempts a Layup. Heavily contested by Zach Fox (0.5 feet, MAN)! SCOTTIE HARDEN MAKES IT!
Score: 60-79

[05:32] Team_024 possession (Score: 60-79)
Ja Reaves attempts a 3Pt. Wide open! Tim Johnson is 7.8 feet away. [ZONE] Ja Reaves misses. Rebound secured by Tony Doncic.

[05:17] Team_027 possession (Score: 60-79)
Tony Doncic attempts a Midrange. Contested by Zach Fox (3.6 feet, MAN). Tony Doncic misses. Rebound secured by Anfernee Williamson.

[04:59] Team_024 possession (Score: 60-79)
Draymond Towns drives and kicks out. Draymond Towns attempts a Midrange. Contested by John Russell (4.4 feet, MAN). DRAYMOND TOWNS MAKES IT! Assist: Zach Fox
Score: 60-81

[04:46] Team_027 possession (Score: 60-81)
Bradley Dosunmu attempts a Layup. BLOCKED BY ANFERNEE WILLIAMSON! Ball deflects out of bounds off Bradley Dosunmu.

[04:36] Team_024 possession (Score: 60-81)
Bradley Allen attempts a 3Pt. Contested by Scottie Harden (2.4 feet, MAN). Bradley Allen misses. Rebound secured by Bradley Dosunmu.

[04:20] Team_027 possession (Score: 60-81)
Tony Doncic attempts a 3Pt. Contested by Zach Fox (2.3 feet, ZONE). Tony Doncic misses. Rebound secured by Zach Fox.

[04:05] Team_024 possession (Score: 60-81)
Draymond Towns attempts a 3Pt. Heavily contested by John Russell (0.5 feet, MAN)! Draymond Towns misses. Rebound secured by Tony Doncic.

[03:52] Team_027 possession (Score: 60-81)
Tim Johnson drives to the basket... Tim Johnson loses the ball! Stripped by Ja Reaves! TURNOVER! (live ball)

[03:38] Team_024 possession (Score: 60-81)
Bradley Allen attempts a 3Pt. Contested by Scottie Harden (5.5 feet, MAN). Bradley Allen misses. Offensive rebound by Zach Fox! Zach Fox kicks it out.

[03:23] Team_024 possession (Score: 60-81)
Bradley Allen makes the Midrange and draws the foul on Scottie Harden! And-1! Bradley Allen to the line for 1. [Team fouls: 4] (Scottie Harden: 2 personal fouls)   FT 1/1: GOOD Bradley Allen makes 1/1 from the line.
Score: 60-84

[03:04] Team_027 possession (Score: 60-84)
Scottie Harden attempts a 3Pt. Contested by Bradley Allen (5.2 feet, MAN). SCOTTIE HARDEN MAKES IT! Assist: John Russell
Score: 63-84

[02:50] Team_024 possession (Score: 63-84)
Zach Fox attempts a 3Pt. Contested by Tim Johnson (2.4 feet, ZONE). Zach Fox misses. Rebound secured by Tony Doncic.

[02:33] Team_027 possession (Score: 63-84)
Scottie Harden attempts a 3Pt. Wide open! Zach Fox is 7.4 feet away. [ZONE] Scottie Harden misses. Rebound secured by Anfernee Williamson.

[02:16] Team_024 possession (Score: 63-84)
Draymond Towns attempts a Layup. BLOCKED BY JOHN RUSSELL! Ball is loose! Offensive rebound by Draymond Towns! Draymond Towns kicks it out.

[02:02] Team_024 possession (Score: 63-84)
Ja Reaves attempts a 3Pt. Contested by Tim Johnson (5.8 feet, ZONE). Ja Reaves misses. Offensive rebound by Draymond Towns! Draymond Towns's putback is no good. Rebound secured by Bradley Dosunmu.

[01:49] Team_027 possession (Score: 63-84)
Bradley Dosunmu drives, picks up Anfernee Williamson. Help arrives from Zach Fox! Bradley Dosunmu attempts a Dunk. Contested by Zach Fox (4.0 feet, MAN). Bradley Dosunmu misses. Rebound secured by Draymond Towns.

[01:35] Team_024 possession (Score: 63-84)
Anfernee Williamson drives to the basket... Anfernee Williamson throws a bad pass out of bounds! TURNOVER! (dead ball)

[01:35] Substitution (Team_027): Tim Johnson OUT → CJ Green IN (stamina_rule2)

[01:35] Substitution (Team_027): Tony Doncic OUT → Dirk Lillard IN (stamina_rule2)

[01:35] Substitution (Team_027): Scottie Harden OUT → Rudy Quickley IN (stamina_rule2)

[01:35] Substitution (Team_027): Bradley Dosunmu OUT → LeBron Russell IN (stamina_rule2)

[01:35] Substitution (Team_027): John Russell OUT → Ben Stewart IN (stamina_rule2)

[01:35] Substitution (Team_024): Ja Reaves OUT → Victor Simons IN (stamina_rule2)

[01:35] Substitution (Team_024): Zach Fox OUT → Vince Irving IN (stamina_rule2)

[01:35] Substitution (Team_024): Bradley Allen OUT → Zach Durant IN (stamina_rule2)

[01:35] Substitution (Team_024): Anfernee Williamson OUT → Julius Harris IN (stamina_rule2)

[01:35] Substitution (Team_024): Draymond Towns OUT → Terry Rozier IN (stamina_rule2)

[01:22] Team_027 possession (Score: 63-84)
FOUL! Reach-in foul on Terry Rozier during the drive. [Team fouls: 4] No free throws, side out. (Terry Rozier: 1 personal fouls)

[01:02] Team_027 possession (Score: 63-84)
LeBron Russell drives to the basket... LeBron Russell throws a bad pass! Stolen by Julius Harris! TURNOVER! (live ball)

[00:48] Team_024 possession (Score: 63-84)
FOUL! Reach-in foul on Ben Stewart during the drive. [IN THE BONUS! 5 team fouls] Zach Durant to the line for 2 free throws. (Ben Stewart: 1 personal fouls)   FT 1/2: GOOD   FT 2/2: GOOD Zach Durant makes 2/2 from the line.
Score: 63-86

[00:35] Team_027 possession (Score: 63-86)
Dirk Lillard makes the Layup and draws the foul on Vince Irving! And-1! Dirk Lillard to the line for 1. [BONUS: 5 team fouls] (Vince Irving: 1 personal fouls)   FT 1/1: MISS Dirk Lillard makes 0/1 from the line. Rebound secured by Zach Durant.
Score: 65-86

[00:23] Team_024 possession (Score: 65-86)
Vince Irving attempts a 3Pt. Contested by Rudy Quickley (2.9 feet, ZONE). Vince Irving misses. Rebound secured by LeBron Russell.

[00:08] Team_027 possession (Score: 65-86)
CJ Green drives, Victor Simons stays with him. CJ Green attempts a Layup. Heavily contested by Victor Simons (2.0 feet, MAN)! CJ Green misses. Rebound secured by Terry Rozier.

================================================================================
                              3RD QUARTER COMPLETE                              
================================================================================

3RD QUARTER SCORE: Team_027 19, Team_024 19

BOX SCORE:
================================================================================

Team_027
--------------------------------------------------------------------------------
Player                MIN  PTS  REB  AST  TO      FG   FG%      3P   3P%
--------------------------------------------------------------------------------
Scottie Harden         30   10    0    0   0   4/7    57.1     0/0   0.0
John Russell           30    4    4    2   0   2/3    66.7     0/0   0.0
Bradley Dosunmu        30    3    5    0   0   1/3    33.3     0/0   0.0
Tony Doncic            30    0    3    0   0   0/3     0.0     0/0   0.0
Dirk Lillard            6    0    0    0   0   0/1     0.0     0/0   0.0
LeBron Russell          6    0    1    0   0   0/0     0.0     0/0   0.0
CJ Green                6    0    0    0   0   0/1     0.0     0/0   0.0

TEAM: FG: 7/18 (38.9%), 3PT: 4/8 (50.0%), REB: 13 (3 off, 10 def), AST: 2, TO: 5
TEAM FOULS: 5 [Team_024 in BONUS]


Team_024
--------------------------------------------------------------------------------
Player                MIN  PTS  REB  AST  TO      FG   FG%      3P   3P%
--------------------------------------------------------------------------------
Draymond Towns         30    6    4    0   0   3/6    50.0     0/0   0.0
Zach Fox               30    4    3    1   0   2/4    50.0     0/0   0.0
Bradley Allen          30    3    0    1   0   1/4    25.0     0/0   0.0
Anfernee Williamson    30    2    4    2   0   1/1   100.0     0/0   0.0
Ja Reaves              30    2    0    0   0   1/3    33.3     0/0   0.0
Zach Durant             6    2    1    0   0   1/1   100.0     0/0   0.0
Vince Irving            6    0    0    0   0   0/1     0.0     0/0   0.0
Terry Rozier            6    0    1    0   0   0/0     0.0     0/0   0.0

TEAM: FG: 9/20 (45.0%), 3PT: 0/6 (0.0%), REB: 13 (4 off, 9 def), AST: 4, TO: 2
TEAM FOULS: 5 [Team_027 in BONUS]

================================================================================

================================================================================
                       4TH QUARTER - Team_027 vs Team_024                       
================================================================================

[12:00] Substitution (Team_027): Tim Johnson OUT (stamina: 74) → CJ Green IN (comeback_detected)

[12:00] Substitution (Team_024): Ja Reaves OUT (stamina: 76) → Victor Simons IN (comeback_detected)

[12:00] Team_027 possession (Score: 65-86)
CJ Green makes the Layup and draws the foul on Zach Fox! And-1! CJ Green to the line for 1. [Team fouls: 1] (Zach Fox: 1 personal fouls)   FT 1/1: GOOD CJ Green makes 1/1 from the line.
Score: 68-86

[11:44] Team_024 possession (Score: 68-86)
Draymond Towns makes the Layup and draws the foul on Bradley Dosunmu! And-1! Draymond Towns to the line for 1. [Team fouls: 1] (Bradley Dosunmu: 1 personal fouls)   FT 1/1: GOOD Draymond Towns makes 1/1 from the line.
Score: 68-89

[11:32] Team_027 possession (Score: 68-89)
Tony Doncic attempts a 3Pt. Wide open! Zach Fox is 6.8 feet away. [ZONE] Tony Doncic misses. Rebound secured by Anfernee Williamson.

[11:16] Team_024 possession (Score: 68-89)
Zach Fox attempts a Midrange. Contested by Tony Doncic (4.5 feet, MAN). Zach Fox misses. Rebound secured by Tony Doncic.

[11:03] Team_027 possession (Score: 68-89)
Tony Doncic attempts a 3Pt. Contested by Zach Fox (4.2 feet, MAN). Tony Doncic misses. Offensive rebound by John Russell! John Russell puts it back in!
Score: 70-89

[10:51] Team_024 possession (Score: 70-89)
Bradley Allen attempts a 3Pt. Wide open! Bradley Dosunmu is 6.6 feet away. [ZONE] Bradley Allen misses. Rebound secured by Tony Doncic.

[10:39] Team_027 possession (Score: 70-89)
Tony Doncic attempts a 3Pt. Contested by Anfernee Williamson (2.4 feet, ZONE). TONY DONCIC MAKES IT! Assist: John Russell
Score: 73-89

[10:27] Team_024 possession (Score: 73-89)
Victor Simons attempts a 3Pt. Heavily contested by Bradley Dosunmu (1.9 feet, ZONE)! Victor Simons misses. Rebound secured by John Russell.

[10:12] Team_027 possession (Score: 73-89)
Scottie Harden attempts a Midrange. Contested by Bradley Allen (4.6 feet, MAN). SCOTTIE HARDEN MAKES IT! Assist: John Russell
Score: 75-89

[10:01] Team_024 possession (Score: 75-89)
Anfernee Williamson attempts a Midrange. Contested by Bradley Dosunmu (5.4 feet, ZONE). Anfernee Williamson misses. Rebound secured by Tony Doncic.

[09:46] Team_027 possession (Score: 75-89)
John Russell drives, Anfernee Williamson stays with him. John Russell attempts a Layup. Wide open! Anfernee Williamson is 7.0 feet away. [ZONE] JOHN RUSSELL MAKES IT! Assist: Scottie Harden
Score: 77-89

[09:29] Team_024 possession (Score: 77-89)
Bradley Allen attempts a Layup. Contested by John Russell (3.8 feet, ZONE). BRADLEY ALLEN MAKES IT! Assist: Draymond Towns
Score: 77-91

[09:16] Team_027 possession (Score: 77-91)
Tony Doncic attempts a 3Pt. Contested by Victor Simons (5.5 feet, ZONE). Tony Doncic misses. Offensive rebound by John Russell! John Russell's putback is no good. Rebound secured by Draymond Towns.

[09:04] Team_024 possession (Score: 77-91)
Bradley Allen attempts a 3Pt. Contested by Bradley Dosunmu (4.1 feet, ZONE). Bradley Allen misses. Rebound secured by Bradley Dosunmu.

[08:51] Team_027 possession (Score: 77-91)
John Russell drives and kicks out. Bradley Dosunmu attempts a Midrange. Contested by Anfernee Williamson (2.3 feet, ZONE). Bradley Dosunmu misses. Rebound secured by Anfernee Williamson.

[08:35] Team_024 possession (Score: 77-91)
Anfernee Williamson attempts a 3Pt. Contested by Bradley Dosunmu (4.4 feet, ZONE). Anfernee Williamson misses. Rebound secured by John Russell.

[08:19] Team_027 possession (Score: 77-91)
Bradley Dosunmu drives and kicks out. Tony Doncic attempts a 3Pt. Contested by Victor Simons (4.2 feet, ZONE). Tony Doncic misses. Rebound secured by Draymond Towns.

[08:04] Team_024 possession (Score: 77-91)
Zach Fox makes the Layup and draws the foul on John Russell! And-1! Zach Fox to the line for 1. [Team fouls: 2] (John Russell: 1 personal fouls)   FT 1/1: GOOD Zach Fox makes 1/1 from the line.
Score: 77-94

[07:50] Team_027 possession (Score: 77-94)
Tony Doncic attempts a 3Pt. Wide open! Zach Fox is 7.4 feet away. [MAN] Tony Doncic misses. Offensive rebound by Bradley Dosunmu! Bradley Dosunmu kicks it out.

[07:33] Team_027 possession (Score: 77-94)
John Russell drives and kicks out. Tony Doncic attempts a Midrange. Contested by Zach Fox (4.6 feet, ZONE). TONY DONCIC MAKES IT!
Score: 79-94

[07:15] Team_024 possession (Score: 79-94)
FOUL! Shooting foul on Tony Doncic. Zach Fox to the line for 3 free throws. [Team fouls: 3] (Tony Doncic: 1 personal fouls)   FT 1/3: MISS   FT 2/3: GOOD   FT 3/3: GOOD Zach Fox makes 2/3 from the line.
Score: 79-96

[07:05] Team_027 possession (Score: 79-96)
Tony Doncic attempts a Layup. Contested by Zach Fox (5.7 feet, MAN). TONY DONCIC MAKES IT!
Score: 81-96

[06:51] Team_024 possession (Score: 81-96)
FOUL! Reach-in foul on John Russell during the drive. [Team fouls: 4] No free throws, side out. (John Russell: 2 personal fouls)

[06:35] Team_024 possession (Score: 81-96)
Draymond Towns drives, John Russell stays with him. Draymond Towns attempts a Layup. Contested by John Russell (4.3 feet, ZONE). DRAYMOND TOWNS MAKES IT! Assist: Anfernee Williamson
Score: 81-98

[06:20] Team_027 possession (Score: 81-98)
Scottie Harden attempts a 3Pt. Contested by Bradley Allen (5.8 feet, MAN). Scottie Harden misses. Rebound secured by Zach Fox.

[06:08] Team_024 possession (Score: 81-98)
Bradley Allen loses the ball! Stripped by Scottie Harden! TURNOVER! (live ball)

[05:53] Team_027 possession (Score: 81-98)
John Russell attempts a Midrange. Contested by Draymond Towns (5.8 feet, MAN). John Russell misses. Rebound secured by Draymond Towns.

[05:41] Team_024 possession (Score: 81-98)
Anfernee Williamson attempts a 3Pt. Contested by CJ Green (4.5 feet, ZONE). Anfernee Williamson misses. Rebound secured by Tony Doncic.

[05:25] Team_027 possession (Score: 81-98)
Scottie Harden drives to the basket... Scottie Harden throws a bad pass out of bounds! TURNOVER! (dead ball)

[05:25] Substitution (Team_027): Tony Doncic OUT → Dirk Lillard IN (stamina_rule2)

[05:25] Substitution (Team_027): Scottie Harden OUT → Rudy Quickley IN (stamina_rule2)

[05:25] Substitution (Team_027): Bradley Dosunmu OUT → LeBron Russell IN (stamina_rule2)

[05:25] Substitution (Team_027): John Russell OUT → Ben Stewart IN (stamina_rule2)

[05:25] Substitution (Team_024): Zach Fox OUT → Vince Irving IN (stamina_rule2)

[05:25] Substitution (Team_024): Bradley Allen OUT → Zach Durant IN (stamina_rule2)

[05:25] Substitution (Team_024): Anfernee Williamson OUT → Julius Harris IN (stamina_rule2)

[05:25] Substitution (Team_024): Draymond Towns OUT → Terry Rozier IN (stamina_rule2)

[05:06] Team_024 possession (Score: 81-98)
Victor Simons attempts a Midrange. Wide open! CJ Green is 6.7 feet away. [MAN] VICTOR SIMONS MAKES IT!
Score: 81-100

[04:50] Team_027 possession (Score: 81-100)
CJ Green attempts a Midrange. Contested by Vince Irving (4.0 feet, ZONE). CJ GREEN MAKES IT! Assist: LeBron Russell
Score: 83-100

[04:32] Team_024 possession (Score: 83-100)
Zach Durant attempts a 3Pt. Contested by Rudy Quickley (4.1 feet, ZONE). Zach Durant misses. Offensive rebound by Julius Harris! Julius Harris kicks it out.

[04:17] Team_024 possession (Score: 83-100)
Vince Irving drives, Ben Stewart stays with him. Vince Irving attempts a Dunk. Contested by Ben Stewart (2.6 feet, ZONE). VINCE IRVING MAKES IT! Assist: Zach Durant
Score: 83-102

[04:02] Team_027 possession (Score: 83-102)
Rudy Quickley attempts a 3Pt. Contested by Zach Durant (4.9 feet, MAN). RUDY QUICKLEY MAKES IT! Assist: LeBron Russell
Score: 86-102

[03:49] Team_024 possession (Score: 86-102)
Terry Rozier attempts a Midrange. Contested by Ben Stewart (5.2 feet, MAN). Terry Rozier misses. Rebound secured by Ben Stewart.

[03:35] Team_027 possession (Score: 86-102)
Rudy Quickley attempts a Midrange. Contested by Zach Durant (5.6 feet, MAN). Rudy Quickley misses. FOUL! Loose ball foul on Julius Harris during the rebound battle. [Team fouls: 2] No free throws, side out. (Julius Harris: 1 personal fouls)

[03:21] Team_027 possession (Score: 86-102)
Rudy Quickley drives and kicks out. CJ Green attempts a Midrange. Contested by Victor Simons (4.5 feet, MAN). CJ Green misses. Rebound secured by Zach Durant.

[03:08] Team_024 possession (Score: 86-102)
Julius Harris drives, Ben Stewart stays with him. Julius Harris attempts a Dunk. Contested by Ben Stewart (4.4 feet, ZONE). JULIUS HARRIS MAKES IT! Assist: Terry Rozier
Score: 86-104

[02:56] Team_027 possession (Score: 86-104)
LeBron Russell attempts a Midrange. Wide open! Julius Harris is 7.2 feet away. [MAN] LeBron Russell misses. Rebound secured by Julius Harris.

[02:42] Team_024 possession (Score: 86-104)
Victor Simons attempts a Midrange. Heavily contested by CJ Green (0.5 feet, MAN)! VICTOR SIMONS MAKES IT!
Score: 86-106

[02:30] Team_027 possession (Score: 86-106)
Rudy Quickley attempts a 3Pt. Contested by Zach Durant (3.6 feet, MAN). Rudy Quickley misses. Rebound secured by Julius Harris.

[02:14] Team_024 possession (Score: 86-106)
Victor Simons drives and kicks out. Zach Durant attempts a Midrange. Contested by Rudy Quickley (4.5 feet, MAN). Zach Durant misses. Rebound secured by LeBron Russell.

[02:02] Team_027 possession (Score: 86-106)
Rudy Quickley attempts a 3Pt. Contested by Zach Durant (5.1 feet, MAN). Rudy Quickley misses. Offensive rebound by Ben Stewart! Ben Stewart's putback is no good. Rebound secured by Terry Rozier.

[01:46] Team_024 possession (Score: 86-106)
FOUL! Shooting foul on Rudy Quickley. Zach Durant to the line for 3 free throws. [BONUS: 5 team fouls] (Rudy Quickley: 1 personal fouls)   FT 1/3: GOOD   FT 2/3: GOOD   FT 3/3: GOOD Zach Durant makes 3/3 from the line.
Score: 86-109

[01:33] Team_027 possession (Score: 86-109)
Dirk Lillard attempts a 3Pt. Heavily contested by Zach Durant (1.2 feet, ZONE)! Dirk Lillard misses. Rebound secured by Terry Rozier.

[01:20] Team_024 possession (Score: 86-109)
Vince Irving drives, Ben Stewart stays with him. Vince Irving attempts a Layup. Wide open! Ben Stewart is 6.1 feet away. [ZONE] VINCE IRVING MAKES IT! Assist: Julius Harris
Score: 86-111

[01:05] Team_027 possession (Score: 86-111)
Rudy Quickley attempts a 3Pt. Contested by Zach Durant (2.7 feet, ZONE). Rudy Quickley misses. Rebound secured by Terry Rozier.

[00:52] Team_024 possession (Score: 86-111)
Victor Simons attempts a 3Pt. Heavily contested by Rudy Quickley (0.5 feet, ZONE)! Victor Simons misses. Offensive rebound by Terry Rozier! Terry Rozier puts it back in!
Score: 86-113

[00:37] Team_027 possession (Score: 86-113)
Rudy Quickley attempts a Midrange. Contested by Zach Durant (5.1 feet, ZONE). Rudy Quickley misses. Rebound secured by Julius Harris.

[00:21] Team_024 possession (Score: 86-113)
Victor Simons throws a bad pass out of bounds! TURNOVER! (dead ball)

[00:21] Substitution (Team_027): CJ Green OUT → Tim Johnson IN (starter_return_rule1)

[00:21] Substitution (Team_024): Victor Simons OUT → Ja Reaves IN (starter_return_rule1)

[00:10] Team_027 possession (Score: 86-113)
LeBron Russell attempts a Midrange. Contested by Julius Harris (3.9 feet, ZONE). LEBRON RUSSELL MAKES IT!
Score: 88-113

================================================================================
                              4TH QUARTER COMPLETE                              
================================================================================

4TH QUARTER SCORE: Team_027 23, Team_024 27

BOX SCORE:
================================================================================

Team_027
--------------------------------------------------------------------------------
Player                MIN  PTS  REB  AST  TO      FG   FG%      3P   3P%
--------------------------------------------------------------------------------
Tony Doncic            37    7    4    0   0   3/5    60.0     0/0   0.0
CJ Green               18    5    0    0   0   2/2   100.0     0/0   0.0
John Russell           37    4    3    2   0   2/4    50.0     0/0   0.0
Rudy Quickley          12    3    0    0   0   1/6    16.7     0/0   0.0
Scottie Harden         37    2    0    1   0   1/2    50.0     0/0   0.0
LeBron Russell         12    2    1    2   0   1/2    50.0     0/0   0.0
Bradley Dosunmu        37    0    2    0   0   0/1     0.0     0/0   0.0
Ben Stewart            12    0    2    0   0   0/0     0.0     0/0   0.0
Dirk Lillard           12    0    0    0   0   0/1     0.0     0/0   0.0

TEAM: FG: 10/23 (43.5%), 3PT: 3/10 (30.0%), REB: 14 (5 off, 9 def), AST: 5, TO: 1
TEAM FOULS: 5 [Team_024 in BONUS]


Team_024
--------------------------------------------------------------------------------
Player                MIN  PTS  REB  AST  TO      FG   FG%      3P   3P%
--------------------------------------------------------------------------------
Draymond Towns         37    5    3    1   0   2/2   100.0     0/0   0.0
Zach Fox               37    5    1    0   0   2/3    66.7     0/0   0.0
Victor Simons          18    4    0    0   0   2/4    50.0     0/0   0.0
Vince Irving           12    4    0    0   0   2/2   100.0     0/0   0.0
Zach Durant            12    3    1    1   0   1/1   100.0     0/0   0.0
Bradley Allen          37    2    0    0   0   1/3    33.3     0/0   0.0
Julius Harris          12    2    4    1   0   1/1   100.0     0/0   0.0
Terry Rozier           12    2    4    1   0   1/2    50.0     0/0   0.0
Anfernee Williamson    37    0    2    1   0   0/3     0.0     0/0   0.0

TEAM: FG: 12/21 (57.1%), 3PT: 3/8 (37.5%), REB: 13 (2 off, 11 def), AST: 5, TO: 2
TEAM FOULS: 2

================================================================================

================================================================================
                               FULL GAME COMPLETE                               
================================================================================

FINAL SCORE: Team_027 88, Team_024 113

SCORING BY QUARTER:
--------------------------------------------------------------------------------
Team                     Q1     Q2     Q3     Q4    FINAL
--------------------------------------------------------------------------------
Team_027                 19     27     19     23       88
Team_024                 31     36     19     27      113
--------------------------------------------------------------------------------

FULL GAME BOX SCORE:
================================================================================

Team_027
--------------------------------------------------------------------------------
Player                MIN  PTS  REB  AST  TO      FG   FG%      3P   3P%      FT STL BLK
--------------------------------------------------------------------------------
Tony Doncic            37   14   13    2   3   7/15   46.7   3/8    37.5   3/3     1   1
Scottie Harden         37   14    0    2   3   7/13   53.8   3/7    42.9   2/3     1   0
Bradley Dosunmu        37   14   12    1   1   5/12   41.7   0/2     0.0   5/5     1   0
John Russell           37   12   12    5   4   4/10   40.0   1/3    33.3   0/0     0   1
Tim Johnson            30    4    0    0   0   2/9    22.2   0/5     0.0   2/2     1   0
CJ Green               18   14    0    0   0   5/6    83.3   2/2   100.0   2/2     0   0
Dirk Lillard           12    5    1    2   0   2/4    50.0   1/2    50.0   0/1     0   0
Rudy Quickley          12    3    0    1   1   1/6    16.7   1/4    25.0   0/0     0   0
LeBron Russell         12    4    2    3   1   2/5    40.0   0/1     0.0   0/0     0   0
Ben Stewart            12    2    2    0   0   1/1   100.0   0/0     0.0   0/0     0   0

TEAM: FG: 36/81 (44.4%), 3PT: 11/34 (32.4%), REB: 44 (14 off, 30 def), AST: 16, TO: 13


Team_024
--------------------------------------------------------------------------------
Player                MIN  PTS  REB  AST  TO      FG   FG%      3P   3P%      FT STL BLK
--------------------------------------------------------------------------------
Zach Fox               37   18   13    2   1   7/12   58.3   2/4    50.0   5/6     0   0
Bradley Allen          37   15    0    3   3   7/14   50.0   1/5    20.0   3/4     0   0
Anfernee Williamson    37    6   11    8   1   3/9    33.3   0/3     0.0   4/4     3   3
Draymond Towns         37   19   13    2   0   7/14   50.0   0/2     0.0   3/3     0   1
Ja Reaves              30   20    0    0   2   9/11   81.8   2/4    50.0   6/6     1   0
Victor Simons          18    6    0    0   1   6/8    75.0   3/4    75.0   0/0     0   0
Vince Irving           12   11    0    0   0   5/7    71.4   1/3    33.3   2/2     0   0
Zach Durant            12    7    3    2   1   3/3   100.0   1/1   100.0   5/5     0   0
Julius Harris          12    6    4    2   0   2/2   100.0   0/0     0.0   2/4     1   0
Terry Rozier           12    4    7    2   0   1/2    50.0   1/1   100.0   0/0     1   0

TEAM: FG: 50/82 (61.0%), 3PT: 11/27 (40.7%), REB: 49 (9 off, 40 def), AST: 21, TO: 9

================================================================================
