================================================================================
                        FULL GAME - Team_093 vs Team_042                        
================================================================================

================================================================================
                       1ST QUARTER - Team_093 vs Team_042                       
================================================================================

[12:00] Team_093 possession (Score: 0-0)
Trae Westbrook drives, picks up Cade Dosunmu. Help arrives from Tyler Barrett! Trae Westbrook attempts a Layup. Contested by Tyler Barrett (3.7 feet, ZONE). TRAE WESTBROOK MAKES IT! Assist: Damian Williamson
Score: 2-0

[11:47] Team_042 possession (Score: 2-0)
Cade Dosunmu drives, Ben Cunningham stays with him. Cade Dosunmu attempts a Dunk. Wide open! Ben Cunningham is 6.7 feet away. [MAN] CADE DOSUNMU MAKES IT!
Score: 2-2

[11:33] Team_093 possession (Score: 2-2)
Carmelo Wagner drives, Jarrett Sabonis stays with him. Carmelo Wagner attempts a Layup. Wide open! Jarrett Sabonis is 6.3 feet away. [MAN] CARMELO WAGNER MAKES IT! Assist: Damian Williamson
Score: 4-2

[11:15] Team_042 possession (Score: 4-2)
Dejounte Butler throws a bad pass out of bounds! TURNOVER! (dead ball)

[11:03] Team_093 possession (Score: 4-2)
Damian Williamson attempts a 3Pt. Contested by Tyler Barrett (3.6 feet, MAN). Damian Williamson misses. Rebound secured by Dejounte Butler.

[10:47] Team_042 possession (Score: 4-2)
Kristaps Parker attempts a 3Pt. Contested by Trae Westbrook (5.6 feet, MAN). KRISTAPS PARKER MAKES IT! Assist: Jarrett Sabonis
Score: 4-5

[10:33] Team_093 possession (Score: 4-5)
FOUL! Reach-in foul on Cade Dosunmu during the drive. [Team fouls: 1] No free throws, side out. (Cade Dosunmu: 1 personal fouls)

[10:17] Team_093 possession (Score: 4-5)
Carmelo Wagner attempts a Midrange. Contested by Dejounte Butler (2.7 feet, ZONE). Carmelo Wagner misses. Rebound secured by Dejounte Butler.

[10:03] Team_042 possession (Score: 4-5)
Kristaps Parker attempts a Midrange. Contested by Trae Westbrook (5.9 feet, MAN). KRISTAPS PARKER MAKES IT! Assist: Cade Dosunmu
Score: 4-7

[09:49] Team_093 possession (Score: 4-7)
Ben Cunningham attempts a Layup. Contested by Cade Dosunmu (3.9 feet, MAN). BEN CUNNINGHAM MAKES IT! Assist: Trae Westbrook
Score: 6-7

[09:30] Team_042 possession (Score: 6-7)
Cade Dosunmu drives and kicks out. Cade Dosunmu attempts a 3Pt. Contested by Ben Cunningham (4.4 feet, MAN). Cade Dosunmu misses. Rebound secured by Ben Cunningham.

[09:18] Team_093 possession (Score: 6-7)
Damian Williamson attempts a Midrange. Contested by Tyler Barrett (2.3 feet, MAN). DAMIAN WILLIAMSON MAKES IT!
Score: 8-7

[09:04] Team_042 possession (Score: 8-7)
FOUL! Holding foul on Damian Williamson. [Team fouls: 1] No free throws, side out. (Damian Williamson: 1 personal fouls)

[08:46] Team_042 possession (Score: 8-7)
Jarrett Sabonis attempts a Layup. Contested by Ben Cunningham (5.7 feet, ZONE). Jarrett Sabonis misses. Rebound secured by Vince Barnes.

[08:32] Team_093 possession (Score: 8-7)
FOUL! Shooting foul on Jarrett Sabonis. Carmelo Wagner to the line for 2 free throws. [Team fouls: 2] (Jarrett Sabonis: 1 personal fouls)   FT 1/2: GOOD   FT 2/2: GOOD Carmelo Wagner makes 2/2 from the line.
Score: 10-7

[08:17] Team_042 possession (Score: 10-7)
FOUL! Shooting foul on Carmelo Wagner. Tyler Barrett to the line for 2 free throws. [Team fouls: 2] (Carmelo Wagner: 1 personal fouls)   FT 1/2: MISS   FT 2/2: MISS Tyler Barrett makes 0/2 from the line. Rebound secured by Vince Barnes.

[08:04] Team_093 possession (Score: 10-7)
Damian Williamson attempts a 3Pt. Contested by Tyler Barrett (2.9 feet, ZONE). Damian Williamson misses. Rebound secured by Dejounte Butler.

[07:53] Team_042 possession (Score: 10-7)
Tyler Barrett attempts a Layup. Wide open! Ben Cunningham is 8.2 feet away. [ZONE] TYLER BARRETT MAKES IT!
Score: 10-9

[07:39] Team_093 possession (Score: 10-9)
Ben Cunningham drives, Cade Dosunmu stays with him. Ben Cunningham attempts a Layup. Contested by Cade Dosunmu (4.3 feet, ZONE). Ben Cunningham misses. Rebound secured by Tyler Barrett.

[07:25] Team_042 possession (Score: 10-9)
FOUL! Holding foul on Vince Barnes. [Team fouls: 3] No free throws, side out. (Vince Barnes: 1 personal fouls)

[07:13] Team_042 possession (Score: 10-9)
Tyler Barrett attempts a Midrange. Wide open! Damian Williamson is 8.5 feet away. [MAN] Tyler Barrett misses. Rebound secured by Carmelo Wagner.

[06:57] Team_093 possession (Score: 10-9)
Ben Cunningham throws a bad pass! Stolen by Cade Dosunmu! TURNOVER! (live ball)

[06:38] Team_042 possession (Score: 10-9)
Cade Dosunmu attempts a Layup. Contested by Ben Cunningham (2.9 feet, MAN). Cade Dosunmu misses. FOUL! Loose ball foul on Ben Cunningham during the rebound battle. [Team fouls: 4] No free throws, side out. (Ben Cunningham: 1 personal fouls)

[06:19] Team_042 possession (Score: 10-9)
Cade Dosunmu attempts a Midrange. Contested by Ben Cunningham (4.7 feet, MAN). Cade Dosunmu misses. Offensive rebound by Cade Dosunmu! Cade Dosunmu puts it back in!
Score: 10-11

[06:07] Team_093 possession (Score: 10-11)
FOUL! Shooting foul on Tyler Barrett. Carmelo Wagner to the line for 3 free throws. [Team fouls: 3] (Tyler Barrett: 1 personal fouls)   FT 1/3: MISS   FT 2/3: GOOD   FT 3/3: MISS Carmelo Wagner makes 1/3 from the line. Rebound secured by Dejounte Butler.
Score: 11-11

[05:54] Team_042 possession (Score: 11-11)
FOUL! Holding foul on Vince Barnes. [IN THE BONUS! 5 team fouls] Dejounte Butler to the line for 2 free throws. (Vince Barnes: 2 personal fouls)   FT 1/2: GOOD   FT 2/2: GOOD Dejounte Butler makes 2/2 from the line.
Score: 11-13

[05:40] Team_093 possession (Score: 11-13)
Ben Cunningham drives and kicks out. Ben Cunningham attempts a Midrange. Contested by Tyler Barrett (4.1 feet, ZONE). Ben Cunningham misses. Rebound secured by Cade Dosunmu.

[05:26] Team_042 possession (Score: 11-13)
FOUL! Holding foul on Ben Cunningham. [IN THE BONUS! 6 team fouls] Cade Dosunmu to the line for 2 free throws. (Ben Cunningham: 2 personal fouls)   FT 1/2: GOOD   FT 2/2: GOOD Cade Dosunmu makes 2/2 from the line.
Score: 11-15

[05:14] Team_093 possession (Score: 11-15)
FOUL! Offensive foul on Ben Cunningham! Cade Dosunmu drew the charge! [Team fouls: 7] (Ben Cunningham: 3 personal fouls) TURNOVER! (dead ball)

[05:02] Team_042 possession (Score: 11-15)
Jarrett Sabonis attempts a 3Pt. Contested by Carmelo Wagner (5.1 feet, MAN). Jarrett Sabonis misses. Rebound secured by Carmelo Wagner.

[04:47] Team_093 possession (Score: 11-15)
Damian Williamson attempts a Midrange. Contested by Jarrett Sabonis (3.4 feet, ZONE). Damian Williamson misses. Offensive rebound by Carmelo Wagner! Carmelo Wagner kicks it out.

[04:32] Team_093 possession (Score: 11-15)
Carmelo Wagner loses control! Ball rolls out of bounds! TURNOVER! (dead ball)

[04:18] Team_042 possession (Score: 11-15)
FOUL! Holding foul on Damian Williamson. [IN THE BONUS! 8 team fouls] Tyler Barrett to the line for 2 free throws. (Damian Williamson: 2 personal fouls)   FT 1/2: GOOD   FT 2/2: GOOD Tyler Barrett makes 2/2 from the line.
Score: 11-17

[04:05] Team_093 possession (Score: 11-17)
Ben Cunningham attempts a Midrange. Contested by Dejounte Butler (5.8 feet, ZONE). Ben Cunningham misses. Rebound secured by Cade Dosunmu.

[03:53] Team_042 possession (Score: 11-17)
Cade Dosunmu drives and kicks out. Tyler Barrett attempts a Midrange. Contested by Damian Williamson (4.9 feet, MAN). Tyler Barrett misses. Rebound secured by Ben Cunningham.

[03:38] Team_093 possession (Score: 11-17)
Carmelo Wagner attempts a 3Pt. Heavily contested by Tyler Barrett (1.9 feet, ZONE)! Carmelo Wagner misses. Rebound secured by Tyler Barrett.

[03:27] Team_042 possession (Score: 11-17)
Jarrett Sabonis attempts a 3Pt. Wide open! Carmelo Wagner is 6.4 feet away. [MAN] Jarrett Sabonis misses. Offensive rebound by Dejounte Butler! Dejounte Butler puts it back in!
Score: 11-19

[03:15] Team_093 possession (Score: 11-19)
Carmelo Wagner drives and kicks out. Damian Williamson attempts a 3Pt. Contested by Tyler Barrett (2.8 feet, ZONE). DAMIAN WILLIAMSON MAKES IT! Assist: Carmelo Wagner
Score: 14-19

[03:04] Team_042 possession (Score: 14-19)
Jarrett Sabonis attempts a Midrange. Heavily contested by Vince Barnes (0.8 feet, ZONE)! JARRETT SABONIS MAKES IT!
Score: 14-21

[02:52] Team_093 possession (Score: 14-21)
Ben Cunningham attempts a Layup. Wide open! Cade Dosunmu is 6.2 feet away. [MAN] BEN CUNNINGHAM MAKES IT! Assist: Vince Barnes
Score: 16-21

[02:39] Team_042 possession (Score: 16-21)
Jarrett Sabonis attempts a 3Pt. Contested by Carmelo Wagner (3.9 feet, ZONE). Jarrett Sabonis misses. Rebound secured by Vince Barnes.

[02:25] Team_093 possession (Score: 16-21)
Ben Cunningham drives, picks up Cade Dosunmu. Help arrives from Tyler Barrett! Ben Cunningham attempts a Layup. Contested by Tyler Barrett (3.7 feet, MAN). BEN CUNNINGHAM MAKES IT! Assist: Carmelo Wagner
Score: 18-21

[02:08] Team_042 possession (Score: 18-21)
Jarrett Sabonis attempts a 3Pt. Contested by Carmelo Wagner (3.9 feet, ZONE). Jarrett Sabonis misses. Offensive rebound by Dejounte Butler! Dejounte Butler puts it back in!
Score: 18-23

[01:55] Team_093 possession (Score: 18-23)
Trae Westbrook attempts a 3Pt. Contested by Tyler Barrett (4.8 feet, ZONE). Trae Westbrook misses. Offensive rebound by Carmelo Wagner! Carmelo Wagner kicks it out.

[01:43] Team_093 possession (Score: 18-23)
Trae Westbrook drives and kicks out. Vince Barnes attempts a Midrange. Contested by Dejounte Butler (2.6 feet, ZONE). Vince Barnes misses. Rebound secured by Dejounte Butler.

[01:29] Team_042 possession (Score: 18-23)
Jarrett Sabonis attempts a Layup. BLOCKED BY CARMELO WAGNER! Ball is loose! Rebound secured by Carmelo Wagner.

[01:13] Team_093 possession (Score: 18-23)
Damian Williamson drives and kicks out. Vince Barnes attempts a 3Pt. Contested by Kristaps Parker (4.6 feet, ZONE). Vince Barnes misses. Rebound secured by Dejounte Butler.

[00:55] Team_042 possession (Score: 18-23)
Cade Dosunmu commits a violation (traveling/carry)! TURNOVER! (dead ball)

[00:55] Substitution (Team_093): Damian Williamson OUT → Shaquille George IN (stamina_rule2)

[00:55] Substitution (Team_093): Trae Westbrook OUT → Immanuel Cunningham IN (stamina_rule2)

[00:55] Substitution (Team_093): Carmelo Wagner OUT → Lauri Parker IN (stamina_rule2)

[00:55] Substitution (Team_093): Vince Barnes OUT → Kobe Murray IN (stamina_rule2)

[00:55] Substitution (Team_093): Ben Cunningham OUT → Cade O'Neal IN (stamina_rule2)

[00:55] Substitution (Team_042): Tyler Barrett OUT → Khris George IN (stamina_rule2)

[00:55] Substitution (Team_042): Kristaps Parker OUT → Isaiah Randle IN (stamina_rule2)

[00:55] Substitution (Team_042): Jarrett Sabonis OUT → Gary Jackson IN (stamina_rule2)

[00:55] Substitution (Team_042): Dejounte Butler OUT → Allen Towns IN (stamina_rule2)

[00:55] Substitution (Team_042): Cade Dosunmu OUT → Lamelo Stewart IN (stamina_rule2)

[00:39] Team_093 possession (Score: 18-23)
FOUL! Shooting foul on Allen Towns. Kobe Murray to the line for 2 free throws. [Team fouls: 4] (Allen Towns: 1 personal fouls)   FT 1/2: GOOD   FT 2/2: MISS Kobe Murray makes 1/2 from the line. Rebound secured by Allen Towns.
Score: 19-23

[00:24] Team_042 possession (Score: 19-23)
Khris George attempts a 3Pt. Contested by Shaquille George (5.8 feet, MAN). Khris George misses. Rebound secured by Lauri Parker.

[00:09] Team_093 possession (Score: 19-23)
Shaquille George attempts a Midrange. Contested by Allen Towns (4.5 feet, ZONE). Shaquille George misses. Rebound secured by Allen Towns.

================================================================================
                              1ST QUARTER COMPLETE                              
================================================================================

1ST QUARTER SCORE: Team_093 19, Team_042 23

BOX SCORE:
================================================================================

Team_093
--------------------------------------------------------------------------------
Player                MIN  PTS  REB  AST  TO      FG   FG%      3P   3P%
--------------------------------------------------------------------------------
Ben Cunningham         11    6    2    0   0   3/6    50.0     0/0   0.0
Damian Williamson      11    5    0    2   0   2/5    40.0     0/0   0.0
Carmelo Wagner         11    4    5    2   0   2/5    40.0     0/0   0.0
Trae Westbrook         11    2    0    1   0   1/2    50.0     0/0   0.0
Vince Barnes           11    0    3    1   0   0/0     0.0     0/0   0.0
Kobe Murray             1    0    0    0   0   0/1     0.0     0/0   0.0
Lauri Parker            1    0    1    0   0   0/0     0.0     0/0   0.0
Shaquille George        1    0    0    0   0   0/1     0.0     0/0   0.0

TEAM: FG: 8/20 (40.0%), 3PT: 0/4 (0.0%), REB: 11 (2 off, 9 def), AST: 6, TO: 3
TEAM FOULS: 8 [Team_042 in BONUS]


Team_042
--------------------------------------------------------------------------------
Player                MIN  PTS  REB  AST  TO      FG   FG%      3P   3P%
--------------------------------------------------------------------------------
Cade Dosunmu           11    6    3    1   0   3/5    60.0     0/0   0.0
Dejounte Butler        11    6    9    0   0   3/3   100.0     0/0   0.0
Kristaps Parker        11    5    0    0   0   2/2   100.0     0/0   0.0
Tyler Barrett          11    4    2    0   0   2/4    50.0     0/0   0.0
Jarrett Sabonis        11    2    0    1   0   1/5    20.0     0/0   0.0
Allen Towns             1    0    2    0   0   0/0     0.0     0/0   0.0
Khris George            1    0    0    0   0   0/1     0.0     0/0   0.0

TEAM: FG: 11/20 (55.0%), 3PT: 3/6 (50.0%), REB: 16 (4 off, 12 def), AST: 2, TO: 2
TEAM FOULS: 4

================================================================================

================================================================================
                       2ND QUARTER - Team_093 vs Team_042                       
================================================================================

[12:00] Team_093 possession (Score: 19-23)
Trae Westbrook drives and kicks out. Trae Westbrook attempts a 3Pt. Contested by Tyler Barrett (2.1 feet, ZONE). TRAE WESTBROOK MAKES IT! Assist: Ben Cunningham
Score: 22-23

[11:47] Team_042 possession (Score: 22-23)
Kristaps Parker attempts a 3Pt. Heavily contested by Vince Barnes (0.5 feet, ZONE)! KRISTAPS PARKER MAKES IT! Assist: Cade Dosunmu
Score: 22-26

[11:34] Team_093 possession (Score: 22-26)
Vince Barnes attempts a Midrange. Contested by Dejounte Butler (5.9 feet, MAN). VINCE BARNES MAKES IT! Assist: Carmelo Wagner
Score: 24-26

[11:19] Team_042 possession (Score: 24-26)
Cade Dosunmu attempts a Layup. Contested by Ben Cunningham (4.0 feet, MAN). Cade Dosunmu misses. Rebound secured by Carmelo Wagner.

[11:03] Team_093 possession (Score: 24-26)
Carmelo Wagner attempts a Layup. BLOCKED BY JARRETT SABONIS! Ball deflects out of bounds off Carmelo Wagner.

[10:49] Team_042 possession (Score: 24-26)
Jarrett Sabonis attempts a 3Pt. Heavily contested by Carmelo Wagner (0.7 feet, MAN)! Jarrett Sabonis misses. Rebound secured by Carmelo Wagner.

[10:36] Team_093 possession (Score: 24-26)
FOUL! Holding foul on Jarrett Sabonis. [Team fouls: 1] No free throws, side out. (Jarrett Sabonis: 1 personal fouls)

[10:20] Team_093 possession (Score: 24-26)
Carmelo Wagner drives to the basket... Carmelo Wagner throws a bad pass out of bounds! TURNOVER! (dead ball)

[10:20] Substitution (Team_093): Damian Williamson OUT → Shaquille George IN (stamina_rule2)

[10:20] Substitution (Team_093): Trae Westbrook OUT → Immanuel Cunningham IN (stamina_rule2)

[10:20] Substitution (Team_093): Carmelo Wagner OUT → Lauri Parker IN (stamina_rule2)

[10:20] Substitution (Team_093): Vince Barnes OUT → Kobe Murray IN (stamina_rule2)

[10:20] Substitution (Team_093): Ben Cunningham OUT → Cade O'Neal IN (stamina_rule2)

[10:20] Substitution (Team_042): Tyler Barrett OUT → Khris George IN (stamina_rule2)

[10:20] Substitution (Team_042): Kristaps Parker OUT → Isaiah Randle IN (stamina_rule2)

[10:20] Substitution (Team_042): Jarrett Sabonis OUT → Gary Jackson IN (stamina_rule2)

[10:20] Substitution (Team_042): Dejounte Butler OUT → Allen Towns IN (stamina_rule2)

[10:20] Substitution (Team_042): Cade Dosunmu OUT → Lamelo Stewart IN (stamina_rule2)

[10:07] Team_042 possession (Score: 24-26)
Khris George drives and kicks out. Lamelo Stewart attempts a 3Pt. Heavily contested by Shaquille George (0.5 feet, ZONE)! LAMELO STEWART MAKES IT! Assist: Allen Towns
Score: 24-29

[09:51] Team_093 possession (Score: 24-29)
Lauri Parker attempts a 3Pt. Wide open! Allen Towns is 6.5 feet away. [ZONE] LAURI PARKER MAKES IT! Assist: Immanuel Cunningham
Score: 27-29

[09:37] Team_042 possession (Score: 27-29)
Khris George attempts a 3Pt. Wide open! Shaquille George is 6.4 feet away. [MAN] KHRIS GEORGE MAKES IT! Assist: Lamelo Stewart
Score: 27-32

[09:22] Team_093 possession (Score: 27-32)
Lauri Parker attempts a Midrange. Contested by Gary Jackson (3.2 feet, MAN). LAURI PARKER MAKES IT!
Score: 29-32

[09:08] Team_042 possession (Score: 29-32)
Gary Jackson attempts a Midrange. Contested by Lauri Parker (3.7 feet, MAN). GARY JACKSON MAKES IT!
Score: 29-34

[08:55] Team_093 possession (Score: 29-34)
Immanuel Cunningham attempts a 3Pt. Contested by Gary Jackson (4.9 feet, ZONE). IMMANUEL CUNNINGHAM MAKES IT! Assist: Kobe Murray
Score: 32-34

[08:45] Team_042 possession (Score: 32-34)
Isaiah Randle attempts a 3Pt. Wide open! Immanuel Cunningham is 6.7 feet away. [MAN] ISAIAH RANDLE MAKES IT! Assist: Gary Jackson
Score: 32-37

[08:33] Team_093 possession (Score: 32-37)
Kobe Murray attempts a Midrange. Wide open! Allen Towns is 6.2 feet away. [MAN] Kobe Murray misses. Offensive rebound by Kobe Murray! Kobe Murray's putback is no good. Rebound secured by Allen Towns.

[08:18] Team_042 possession (Score: 32-37)
Gary Jackson attempts a 3Pt. Contested by Lauri Parker (3.5 feet, MAN). Gary Jackson misses. Rebound secured by Kobe Murray.

[08:05] Team_093 possession (Score: 32-37)
Kobe Murray drives and kicks out. FOUL! Shooting foul on Khris George. Lauri Parker to the line for 3 free throws. [Team fouls: 2] (Khris George: 1 personal fouls)   FT 1/3: GOOD   FT 2/3: MISS   FT 3/3: GOOD Lauri Parker makes 2/3 from the line.
Score: 34-37

[07:53] Team_042 possession (Score: 34-37)
Lamelo Stewart attempts a Layup. Contested by Kobe Murray (2.2 feet, ZONE). Lamelo Stewart misses. FOUL! Loose ball foul on Kobe Murray during the rebound battle. [Team fouls: 1] No free throws, side out. (Kobe Murray: 1 personal fouls)

[07:43] Team_042 possession (Score: 34-37)
FOUL! Holding foul on Shaquille George. [Team fouls: 2] No free throws, side out. (Shaquille George: 1 personal fouls)

[07:33] Team_042 possession (Score: 34-37)
Lamelo Stewart attempts a 3Pt. Contested by Shaquille George (5.0 feet, ZONE). Lamelo Stewart misses. Rebound secured by Kobe Murray.

[07:20] Team_093 possession (Score: 34-37)
Lauri Parker attempts a 3Pt. Contested by Gary Jackson (3.7 feet, MAN). Lauri Parker misses. FOUL! Loose ball foul on Allen Towns during the rebound battle. [Team fouls: 3] No free throws, side out. (Allen Towns: 1 personal fouls)

[07:09] Team_093 possession (Score: 34-37)
Lauri Parker attempts a 3Pt. Contested by Gary Jackson (3.5 feet, MAN). Lauri Parker misses. Rebound secured by Gary Jackson.

[06:57] Team_042 possession (Score: 34-37)
Isaiah Randle attempts a 3Pt. Contested by Shaquille George (5.3 feet, ZONE). Isaiah Randle misses. Rebound secured by Cade O'Neal.

[06:41] Team_093 possession (Score: 34-37)
Immanuel Cunningham drives to the basket... FOUL! Offensive foul on Immanuel Cunningham! Allen Towns drew the charge! [Team fouls: 3] (Immanuel Cunningham: 1 personal fouls) TURNOVER! (dead ball)

[06:28] Team_042 possession (Score: 34-37)
FOUL! Shooting foul on Kobe Murray. Isaiah Randle to the line for 2 free throws. [Team fouls: 4] (Kobe Murray: 2 personal fouls)   FT 1/2: GOOD   FT 2/2: GOOD Isaiah Randle makes 2/2 from the line.
Score: 34-39

[06:17] Team_093 possession (Score: 34-39)
Cade O'Neal loses the ball! Stripped by Lamelo Stewart! TURNOVER! (live ball)

[06:02] Team_042 possession (Score: 34-39)
Allen Towns attempts a Midrange. Contested by Kobe Murray (4.7 feet, MAN). Allen Towns misses. Rebound secured by Cade O'Neal.

[05:44] Team_093 possession (Score: 34-39)
Kobe Murray loses control! Ball rolls out of bounds! TURNOVER! (dead ball)

[05:29] Team_042 possession (Score: 34-39)
Gary Jackson attempts a Layup. Contested by Lauri Parker (3.9 feet, MAN). Gary Jackson misses. Offensive rebound by Lamelo Stewart! Lamelo Stewart kicks it out.

[05:16] Team_042 possession (Score: 34-39)
Khris George attempts a 3Pt. Contested by Shaquille George (3.2 feet, MAN). Khris George misses. Rebound secured by Cade O'Neal.

[05:02] Team_093 possession (Score: 34-39)
Shaquille George attempts a 3Pt. Contested by Khris George (4.2 feet, MAN). Shaquille George misses. Rebound secured by Gary Jackson.

[04:50] Team_042 possession (Score: 34-39)
Lamelo Stewart drives, Cade O'Neal stays with him. Lamelo Stewart attempts a Dunk. Contested by Cade O'Neal (4.8 feet, ZONE). LAMELO STEWART MAKES IT! Assist: Gary Jackson
Score: 34-41

[04:38] Team_093 possession (Score: 34-41)
Shaquille George attempts a 3Pt. Contested by Khris George (2.6 feet, ZONE). Shaquille George misses. Rebound secured by Lamelo Stewart.

[04:24] Team_042 possession (Score: 34-41)
Khris George attempts a 3Pt. Wide open! Shaquille George is 6.7 feet away. [ZONE] KHRIS GEORGE MAKES IT! Assist: Isaiah Randle
Score: 34-44

[04:09] Team_093 possession (Score: 34-44)
Lauri Parker throws a bad pass! Stolen by Gary Jackson! TURNOVER! (live ball)

[03:54] Team_042 possession (Score: 34-44)
Isaiah Randle attempts a 3Pt. Contested by Shaquille George (5.3 feet, ZONE). Isaiah Randle misses. Rebound secured by Lauri Parker.

[03:39] Team_093 possession (Score: 34-44)
Cade O'Neal attempts a 3Pt. Contested by Lamelo Stewart (2.0 feet, MAN). Cade O'Neal misses. Offensive rebound by Cade O'Neal! Cade O'Neal kicks it out.

[03:27] Team_093 possession (Score: 34-44)
Lauri Parker attempts a Midrange. Contested by Gary Jackson (3.0 feet, MAN). LAURI PARKER MAKES IT! Assist: Immanuel Cunningham
Score: 36-44

[03:14] Team_042 possession (Score: 36-44)
Isaiah Randle attempts a Layup. Contested by Kobe Murray (5.2 feet, ZONE). ISAIAH RANDLE MAKES IT! Assist: Allen Towns
Score: 36-46

[02:57] Team_093 possession (Score: 36-46)
Kobe Murray makes the Layup and draws the foul on Allen Towns! And-1! Kobe Murray to the line for 1. [Team fouls: 4] (Allen Towns: 2 personal fouls)   FT 1/1: GOOD Kobe Murray makes 1/1 from the line.
Score: 39-46

[02:47] Team_042 possession (Score: 39-46)
FOUL! Offensive foul on Allen Towns! Kobe Murray drew the charge! [Team fouls: 5] (Allen Towns: 3 personal fouls) TURNOVER! (dead ball)

[02:33] Team_093 possession (Score: 39-46)
Kobe Murray attempts a 3Pt. Contested by Khris George (3.2 feet, ZONE). KOBE MURRAY MAKES IT! Assist: Immanuel Cunningham
Score: 42-46

[02:20] Team_042 possession (Score: 42-46)
Gary Jackson attempts a 3Pt. Wide open! Lauri Parker is 7.2 feet away. [MAN] Gary Jackson misses. Rebound secured by Kobe Murray.

[02:04] Team_093 possession (Score: 42-46)
Immanuel Cunningham attempts a Layup. Wide open! Isaiah Randle is 8.4 feet away. [MAN] IMMANUEL CUNNINGHAM MAKES IT! Assist: Cade O'Neal
Score: 44-46

[01:50] Team_042 possession (Score: 44-46)
Isaiah Randle drives and kicks out. Allen Towns makes the Midrange and draws the foul on Immanuel Cunningham! And-1! Allen Towns to the line for 1. [BONUS: 5 team fouls] (Immanuel Cunningham: 2 personal fouls)   FT 1/1: GOOD Allen Towns makes 1/1 from the line.
Score: 44-49

[01:31] Team_093 possession (Score: 44-49)
Shaquille George attempts a Layup. Heavily contested by Allen Towns (0.5 feet, ZONE)! SHAQUILLE GEORGE MAKES IT! Assist: Lauri Parker
Score: 46-49

[01:21] Team_042 possession (Score: 46-49)
Isaiah Randle attempts a 3Pt. Wide open! Immanuel Cunningham is 7.6 feet away. [MAN] ISAIAH RANDLE MAKES IT! Assist: Lamelo Stewart
Score: 46-52

[01:10] Team_093 possession (Score: 46-52)
Cade O'Neal attempts a Layup. Contested by Lamelo Stewart (3.8 feet, MAN). CADE O'NEAL MAKES IT! Assist: Shaquille George
Score: 48-52

[00:56] Team_042 possession (Score: 48-52)
Allen Towns attempts a Layup. BLOCKED BY CADE O'NEAL! Ball is loose! Rebound secured by Lauri Parker.

[00:40] Team_093 possession (Score: 48-52)
Shaquille George attempts a Layup. Wide open! Allen Towns is 7.5 feet away. [ZONE] SHAQUILLE GEORGE MAKES IT! Assist: Cade O'Neal
Score: 50-52

[00:23] Team_042 possession (Score: 50-52)
Khris George drives to the basket... Khris George commits a violation (traveling/carry)! TURNOVER! (dead ball)

[00:08] Team_093 possession (Score: 50-52)
Shaquille George attempts a 3Pt. Contested by Khris George (4.1 feet, ZONE). Shaquille George misses. Rebound secured by Allen Towns.

================================================================================
                              2ND QUARTER COMPLETE                              
================================================================================

2ND QUARTER SCORE: Team_093 31, Team_042 29

BOX SCORE:
================================================================================

Team_093
--------------------------------------------------------------------------------
Player                MIN  PTS  REB  AST  TO      FG   FG%      3P   3P%
--------------------------------------------------------------------------------
Lauri Parker           11    9    2    1   0   4/5    80.0     0/0   0.0
Kobe Murray            11    6    4    1   0   2/3    66.7     0/0   0.0
Immanuel Cunningham    11    5    0    3   0   2/2   100.0     0/0   0.0
Shaquille George       11    4    0    1   0   2/5    40.0     0/0   0.0
Trae Westbrook         13    3    0    0   0   1/1   100.0     0/0   0.0
Vince Barnes           13    2    0    0   0   1/1   100.0     0/0   0.0
Cade O'Neal            11    2    4    2   0   1/1   100.0     0/0   0.0
Ben Cunningham         13    0    0    1   0   0/0     0.0     0/0   0.0
Carmelo Wagner         13    0    2    1   0   0/1     0.0     0/0   0.0

TEAM: FG: 13/19 (68.4%), 3PT: 3/7 (42.9%), REB: 13 (3 off, 10 def), AST: 10, TO: 5
TEAM FOULS: 5 [Team_042 in BONUS]


Team_042
--------------------------------------------------------------------------------
Player                MIN  PTS  REB  AST  TO      FG   FG%      3P   3P%
--------------------------------------------------------------------------------
Isaiah Randle          11   10    0    1   0   4/6    66.7     0/0   0.0
Khris George           11    6    0    0   0   2/3    66.7     0/0   0.0
Lamelo Stewart         11    5    3    2   0   2/3    66.7     0/0   0.0
Kristaps Parker        13    3    0    0   0   1/1   100.0     0/0   0.0
Allen Towns            11    3    2    2   0   1/3    33.3     0/0   0.0
Gary Jackson           11    2    2    2   0   1/3    33.3     0/0   0.0
Cade Dosunmu           13    0    0    1   0   0/1     0.0     0/0   0.0
Jarrett Sabonis        13    0    0    0   0   0/1     0.0     0/0   0.0

TEAM: FG: 11/21 (52.4%), 3PT: 5/12 (41.7%), REB: 6 (2 off, 4 def), AST: 8, TO: 2
TEAM FOULS: 5 [Team_093 in BONUS]

================================================================================

================================================================================
                       3RD QUARTER - Team_093 vs Team_042                       
================================================================================

[12:00] Team_093 possession (Score: 50-52)
Carmelo Wagner drives, Cade Dosunmu stays with him. Carmelo Wagner attempts a Dunk. Contested by Cade Dosunmu (4.4 feet, ZONE). Carmelo Wagner misses. Rebound secured by Cade Dosunmu.

[11:42] Team_042 possession (Score: 50-52)
Tyler Barrett attempts a Layup. Wide open! Damian Williamson is 6.2 feet away. [MAN] Tyler Barrett misses. Offensive rebound by Dejounte Butler! Dejounte Butler's putback is no good. Rebound secured by Ben Cunningham.

[11:29] Team_093 possession (Score: 50-52)
Vince Barnes attempts a Midrange. Heavily contested by Dejounte Butler (0.5 feet, MAN)! VINCE BARNES MAKES IT! Assist: Trae Westbrook
Score: 52-52

[11:11] Team_042 possession (Score: 52-52)
Cade Dosunmu attempts a Midrange. Contested by Ben Cunningham (4.4 feet, MAN). Cade Dosunmu misses. Offensive rebound by Dejounte Butler! Dejounte Butler's putback is no good. Rebound secured by Carmelo Wagner.

[10:57] Team_093 possession (Score: 52-52)
Carmelo Wagner drives to the basket... Carmelo Wagner throws a bad pass out of bounds! TURNOVER! (dead ball)

[10:40] Team_042 possession (Score: 52-52)
Tyler Barrett drives and kicks out. Kristaps Parker attempts a Midrange. Contested by Vince Barnes (4.1 feet, ZONE). Kristaps Parker misses. Rebound secured by Ben Cunningham.

[10:27] Team_093 possession (Score: 52-52)
Ben Cunningham attempts a 3Pt. Contested by Cade Dosunmu (3.9 feet, MAN). Ben Cunningham misses. Rebound secured by Tyler Barrett.

[10:11] Team_042 possession (Score: 52-52)
Kristaps Parker attempts a 3Pt. Contested by Carmelo Wagner (5.1 feet, ZONE). KRISTAPS PARKER MAKES IT!
Score: 52-55

[09:54] Team_093 possession (Score: 52-55)
Ben Cunningham attempts a Midrange. Contested by Jarrett Sabonis (4.8 feet, ZONE). Ben Cunningham misses. Rebound secured by Dejounte Butler.

[09:37] Team_042 possession (Score: 52-55)
FOUL! Reach-in foul on Ben Cunningham during the drive. [Team fouls: 1] No free throws, side out. (Ben Cunningham: 1 personal fouls)

[09:23] Team_042 possession (Score: 52-55)
Tyler Barrett attempts a 3Pt. Wide open! Trae Westbrook is 7.1 feet away. [ZONE] TYLER BARRETT MAKES IT! Assist: Kristaps Parker
Score: 52-58

[09:10] Team_093 possession (Score: 52-58)
Carmelo Wagner throws a bad pass out of bounds! TURNOVER! (dead ball)

[08:58] Team_042 possession (Score: 52-58)
Jarrett Sabonis drives and kicks out. Jarrett Sabonis attempts a 3Pt. Contested by Carmelo Wagner (3.5 feet, ZONE). JARRETT SABONIS MAKES IT! Assist: Tyler Barrett
Score: 52-61

[08:43] Team_093 possession (Score: 52-61)
Damian Williamson attempts a Midrange. Contested by Tyler Barrett (4.3 feet, MAN). DAMIAN WILLIAMSON MAKES IT! Assist: Trae Westbrook
Score: 54-61

[08:28] Team_042 possession (Score: 54-61)
FOUL! Shooting foul on Vince Barnes. Dejounte Butler to the line for 2 free throws. [Team fouls: 2] (Vince Barnes: 1 personal fouls)   FT 1/2: MISS   FT 2/2: GOOD Dejounte Butler makes 1/2 from the line.
Score: 54-62

[08:12] Team_093 possession (Score: 54-62)
Ben Cunningham drives and kicks out. Ben Cunningham attempts a Midrange. Contested by Cade Dosunmu (3.1 feet, MAN). Ben Cunningham misses. Rebound secured by Dejounte Butler.

[08:01] Team_042 possession (Score: 54-62)
Cade Dosunmu drives, Ben Cunningham stays with him. Cade Dosunmu attempts a Layup. Wide open! Ben Cunningham is 6.1 feet away. [ZONE] CADE DOSUNMU MAKES IT! Assist: Tyler Barrett
Score: 54-64

[07:47] Team_093 possession (Score: 54-64)
Carmelo Wagner attempts a Midrange. Contested by Jarrett Sabonis (3.8 feet, MAN). Carmelo Wagner misses. Rebound secured by Dejounte Butler.

[07:32] Team_042 possession (Score: 54-64)
Dejounte Butler drives and kicks out. Kristaps Parker attempts a 3Pt. Contested by Trae Westbrook (6.0 feet, MAN). Kristaps Parker misses. Rebound secured by Ben Cunningham.

[07:17] Team_093 possession (Score: 54-64)
Damian Williamson attempts a Midrange. Contested by Kristaps Parker (4.8 feet, ZONE). Damian Williamson misses. Rebound secured by Dejounte Butler.

[07:01] Team_042 possession (Score: 54-64)
Dejounte Butler loses control! Ball rolls out of bounds! TURNOVER! (dead ball)

[06:46] Team_093 possession (Score: 54-64)
Carmelo Wagner makes the Layup and draws the foul on Cade Dosunmu! And-1! Carmelo Wagner to the line for 1. [Team fouls: 1] (Cade Dosunmu: 1 personal fouls)   FT 1/1: GOOD Carmelo Wagner makes 1/1 from the line.
Score: 57-64

[06:31] Team_042 possession (Score: 57-64)
Cade Dosunmu attempts a Layup. Contested by Ben Cunningham (5.5 feet, ZONE). Cade Dosunmu misses. Rebound secured by Vince Barnes.

[06:19] Team_093 possession (Score: 57-64)
Carmelo Wagner attempts a Midrange. Heavily contested by Jarrett Sabonis (0.8 feet, ZONE)! CARMELO WAGNER MAKES IT!
Score: 59-64

[06:09] Team_042 possession (Score: 59-64)
Kristaps Parker drives to the basket... FOUL! Offensive foul on Kristaps Parker! Ben Cunningham drew the charge! [Team fouls: 2] (Kristaps Parker: 1 personal fouls) TURNOVER! (dead ball)

[05:55] Team_093 possession (Score: 59-64)
Vince Barnes attempts a Midrange. Contested by Dejounte Butler (4.3 feet, MAN). VINCE BARNES MAKES IT!
Score: 61-64

[05:42] Team_042 possession (Score: 61-64)
Jarrett Sabonis drives, picks up Ben Cunningham. Help arrives from Trae Westbrook! Jarrett Sabonis attempts a Dunk. Wide open! Trae Westbrook is 10.0 feet away. [ZONE] Jarrett Sabonis misses. Rebound secured by Carmelo Wagner.

[05:27] Team_093 possession (Score: 61-64)
Carmelo Wagner drives to the basket... Carmelo Wagner throws a bad pass! Stolen by Jarrett Sabonis! TURNOVER! (live ball)

[05:09] Team_042 possession (Score: 61-64)
Kristaps Parker attempts a 3Pt. Wide open! Trae Westbrook is 6.9 feet away. [MAN] KRISTAPS PARKER MAKES IT! Assist: Cade Dosunmu
Score: 61-67

[04:57] Team_093 possession (Score: 61-67)
Trae Westbrook drives and kicks out. Trae Westbrook attempts a 3Pt. Contested by Kristaps Parker (2.7 feet, MAN). Trae Westbrook misses. Offensive rebound by Carmelo Wagner! Carmelo Wagner kicks it out.

[04:48] Team_093 possession (Score: 61-67)
FOUL! Offensive foul on Carmelo Wagner! Jarrett Sabonis drew the charge! [Team fouls: 3] (Carmelo Wagner: 1 personal fouls) TURNOVER! (dead ball)

[04:34] Team_042 possession (Score: 61-67)
Tyler Barrett drives to the basket... Tyler Barrett throws a bad pass! Stolen by Damian Williamson! TURNOVER! (live ball)

[04:23] Team_093 possession (Score: 61-67)
FOUL! Holding foul on Jarrett Sabonis. [Team fouls: 3] No free throws, side out. (Jarrett Sabonis: 1 personal fouls)

[04:06] Team_093 possession (Score: 61-67)
FOUL! Shooting foul on Cade Dosunmu. Carmelo Wagner to the line for 2 free throws. [Team fouls: 4] (Cade Dosunmu: 2 personal fouls)   FT 1/2: MISS   FT 2/2: MISS Carmelo Wagner makes 0/2 from the line. Offensive rebound by Ben Cunningham! Ben Cunningham kicks it out.

[03:56] Team_093 possession (Score: 61-67)
Carmelo Wagner attempts a 3Pt. Contested by Tyler Barrett (5.0 feet, ZONE). Carmelo Wagner misses. FOUL! Loose ball foul on Tyler Barrett during the rebound battle. [IN THE BONUS! 5 team fouls] Ben Cunningham to the line for 2 free throws. (Tyler Barrett: 1 personal fouls)   FT 1/2: GOOD   FT 2/2: GOOD Ben Cunningham makes 2/2 from the line.
Score: 63-67

[03:46] Team_042 possession (Score: 63-67)
Tyler Barrett attempts a Layup. Contested by Ben Cunningham (3.3 feet, ZONE). TYLER BARRETT MAKES IT! Assist: Dejounte Butler
Score: 63-69

[03:32] Team_093 possession (Score: 63-69)
Carmelo Wagner attempts a 3Pt. Contested by Jarrett Sabonis (3.2 feet, MAN). CARMELO WAGNER MAKES IT!
Score: 66-69

[03:15] Team_042 possession (Score: 66-69)
Cade Dosunmu drives, Vince Barnes stays with him. Cade Dosunmu attempts a Layup. Contested by Vince Barnes (4.7 feet, ZONE). Cade Dosunmu misses. Rebound secured by Ben Cunningham.

[03:00] Team_093 possession (Score: 66-69)
Trae Westbrook drives to the basket... Trae Westbrook loses the ball! Stripped by Cade Dosunmu! TURNOVER! (live ball)

[02:44] Team_042 possession (Score: 66-69)
Tyler Barrett attempts a 3Pt. Contested by Damian Williamson (4.5 feet, MAN). Tyler Barrett misses. Rebound secured by Vince Barnes.

[02:29] Team_093 possession (Score: 66-69)
Vince Barnes attempts a Layup. Contested by Cade Dosunmu (4.9 feet, ZONE). VINCE BARNES MAKES IT! Assist: Damian Williamson
Score: 68-69

[02:13] Team_042 possession (Score: 68-69)
Jarrett Sabonis attempts a 3Pt. Wide open! Carmelo Wagner is 7.5 feet away. [MAN] Jarrett Sabonis misses. Rebound secured by Carmelo Wagner.

[01:58] Team_093 possession (Score: 68-69)
FOUL! Reach-in foul on Tyler Barrett during the drive. [IN THE BONUS! 6 team fouls] Damian Williamson to the line for 2 free throws. (Tyler Barrett: 2 personal fouls)   FT 1/2: GOOD   FT 2/2: GOOD Damian Williamson makes 2/2 from the line.
Score: 70-69

[01:46] Team_042 possession (Score: 70-69)
Jarrett Sabonis attempts a Midrange. Contested by Carmelo Wagner (4.5 feet, MAN). Jarrett Sabonis misses. Rebound secured by Vince Barnes.

[01:28] Team_093 possession (Score: 70-69)
Trae Westbrook drives, Cade Dosunmu stays with him. Trae Westbrook attempts a Layup. Wide open! Cade Dosunmu is 6.2 feet away. [ZONE] Trae Westbrook misses. Rebound secured by Cade Dosunmu.

[01:17] Team_042 possession (Score: 70-69)
Jarrett Sabonis attempts a 3Pt. Contested by Carmelo Wagner (4.9 feet, MAN). Jarrett Sabonis misses. Offensive rebound by Cade Dosunmu! Cade Dosunmu's putback is no good. Rebound secured by Ben Cunningham.

[01:01] Team_093 possession (Score: 70-69)
Vince Barnes drives to the basket... Vince Barnes commits a violation (traveling/carry)! TURNOVER! (dead ball)

[01:01] Substitution (Team_093): Damian Williamson OUT → Shaquille George IN (stamina_rule2)

[01:01] Substitution (Team_093): Trae Westbrook OUT → Immanuel Cunningham IN (stamina_rule2)

[01:01] Substitution (Team_093): Carmelo Wagner OUT → Lauri Parker IN (stamina_rule2)

[01:01] Substitution (Team_093): Vince Barnes OUT → Kobe Murray IN (stamina_rule2)

[01:01] Substitution (Team_093): Ben Cunningham OUT → Cade O'Neal IN (stamina_rule2)

[01:01] Substitution (Team_042): Tyler Barrett OUT → Khris George IN (stamina_rule2)

[01:01] Substitution (Team_042): Kristaps Parker OUT → Isaiah Randle IN (stamina_rule2)

[01:01] Substitution (Team_042): Jarrett Sabonis OUT → Gary Jackson IN (stamina_rule2)

[01:01] Substitution (Team_042): Dejounte Butler OUT → Allen Towns IN (stamina_rule2)

[01:01] Substitution (Team_042): Cade Dosunmu OUT → Lamelo Stewart IN (stamina_rule2)

[00:46] Team_042 possession (Score: 70-69)
Khris George attempts a 3Pt. Contested by Shaquille George (5.9 feet, ZONE). Khris George misses. Rebound secured by Kobe Murray.

[00:34] Team_093 possession (Score: 70-69)
Cade O'Neal drives and kicks out. Kobe Murray attempts a 3Pt. Contested by Allen Towns (4.1 feet, MAN). Kobe Murray misses. Rebound secured by Lamelo Stewart.

[00:23] Team_042 possession (Score: 70-69)
FOUL! Reach-in foul on Kobe Murray during the drive. [Team fouls: 4] No free throws, side out. (Kobe Murray: 1 personal fouls)

[00:03] Team_042 possession (Score: 70-69)
Gary Jackson attempts a Layup. BLOCKED BY KOBE MURRAY! Ball deflects out of bounds off Gary Jackson.

================================================================================
                              3RD QUARTER COMPLETE                              
================================================================================

3RD QUARTER SCORE: Team_093 20, Team_042 17

BOX SCORE:
================================================================================

Team_093
--------------------------------------------------------------------------------
Player                MIN  PTS  REB  AST  TO      FG   FG%      3P   3P%
--------------------------------------------------------------------------------
Carmelo Wagner         24    8    4    0   0   3/5    60.0     0/0   0.0
Vince Barnes           24    6    3    0   0   3/3   100.0     0/0   0.0
Damian Williamson      24    4    0    1   0   2/3    66.7     0/0   0.0
Trae Westbrook         24    0    0    2   0   0/1     0.0     0/0   0.0
Kobe Murray            12    0    1    0   0   0/0     0.0     0/0   0.0
Cade O'Neal            12    0    0    0   0   0/1     0.0     0/0   0.0

TEAM: FG: 9/17 (52.9%), 3PT: 2/3 (66.7%), REB: 11 (2 off, 9 def), AST: 3, TO: 6
TEAM FOULS: 4


Team_042
--------------------------------------------------------------------------------
Player                MIN  PTS  REB  AST  TO      FG   FG%      3P   3P%
--------------------------------------------------------------------------------
Kristaps Parker        24    6    0    1   0   2/2   100.0     0/0   0.0
Tyler Barrett          24    5    1    2   0   2/5    40.0     0/0   0.0
Jarrett Sabonis        24    3    0    0   0   1/5    20.0     0/0   0.0
Cade Dosunmu           24    2    2    1   0   1/4    25.0     0/0   0.0
Ben Cunningham         24    2    6    0   0   1/4    25.0     0/0   0.0
Dejounte Butler        24    1    4    1   0   1/2    50.0     0/0   0.0
Khris George           12    0    0    0   0   0/1     0.0     0/0   0.0
Lamelo Stewart         12    0    1    0   0   0/0     0.0     0/0   0.0
Gary Jackson           12    0    0    0   0   0/1     0.0     0/0   0.0

TEAM: FG: 7/20 (35.0%), 3PT: 3/7 (42.9%), REB: 11 (3 off, 8 def), AST: 5, TO: 3
TEAM FOULS: 6 [Team_093 in BONUS]

================================================================================

================================================================================
                       4TH QUARTER - Team_093 vs Team_042                       
================================================================================

[12:00] Team_093 possession (Score: 70-69)
Damian Williamson drives, Cade Dosunmu stays with him. Damian Williamson attempts a Layup. Contested by Cade Dosunmu (4.9 feet, ZONE). Damian Williamson misses. Rebound secured by Dejounte Butler.

[11:41] Team_042 possession (Score: 70-69)
Tyler Barrett attempts a Midrange. Heavily contested by Damian Williamson (0.5 feet, MAN)! Tyler Barrett misses. Rebound secured by Vince Barnes.

[11:27] Team_093 possession (Score: 70-69)
Vince Barnes drives and kicks out. Trae Westbrook attempts a 3Pt. Contested by Kristaps Parker (5.4 feet, MAN). TRAE WESTBROOK MAKES IT! Assist: Vince Barnes
Score: 73-69

[11:14] Team_042 possession (Score: 73-69)
Tyler Barrett attempts a Layup. Wide open! Ben Cunningham is 8.5 feet away. [ZONE] Tyler Barrett misses. Rebound secured by Ben Cunningham.

[11:01] Team_093 possession (Score: 73-69)
Ben Cunningham drives, picks up Cade Dosunmu. Help arrives from Tyler Barrett! Ben Cunningham attempts a Dunk. Wide open! Tyler Barrett is 7.7 feet away. [ZONE] BEN CUNNINGHAM MAKES IT! Assist: Damian Williamson
Score: 75-69

[10:48] Team_042 possession (Score: 75-69)
FOUL! Shooting foul on Vince Barnes. Dejounte Butler to the line for 2 free throws. [Team fouls: 1] (Vince Barnes: 1 personal fouls)   FT 1/2: GOOD   FT 2/2: GOOD Dejounte Butler makes 2/2 from the line.
Score: 75-71

[10:29] Team_093 possession (Score: 75-71)
Trae Westbrook attempts a 3Pt. Wide open! Jarrett Sabonis is 7.8 feet away. [ZONE] Trae Westbrook misses. Rebound secured by Tyler Barrett.

[10:10] Team_042 possession (Score: 75-71)
Dejounte Butler drives to the basket... Dejounte Butler throws a bad pass out of bounds! TURNOVER! (dead ball)

[10:10] Substitution (Team_093): Damian Williamson OUT → Shaquille George IN (stamina_rule2)

[10:10] Substitution (Team_093): Trae Westbrook OUT → Immanuel Cunningham IN (stamina_rule2)

[10:10] Substitution (Team_093): Carmelo Wagner OUT → Lauri Parker IN (stamina_rule2)

[10:10] Substitution (Team_093): Vince Barnes OUT → Kobe Murray IN (stamina_rule2)

[10:10] Substitution (Team_093): Ben Cunningham OUT → Cade O'Neal IN (stamina_rule2)

[10:10] Substitution (Team_042): Tyler Barrett OUT → Khris George IN (stamina_rule2)

[10:10] Substitution (Team_042): Kristaps Parker OUT → Isaiah Randle IN (stamina_rule2)

[10:10] Substitution (Team_042): Jarrett Sabonis OUT → Gary Jackson IN (stamina_rule2)

[10:10] Substitution (Team_042): Dejounte Butler OUT → Allen Towns IN (stamina_rule2)

[10:10] Substitution (Team_042): Cade Dosunmu OUT → Lamelo Stewart IN (stamina_rule2)

[09:52] Team_093 possession (Score: 75-71)
Cade O'Neal attempts a Midrange. Contested by Lamelo Stewart (2.7 feet, MAN). CADE O'NEAL MAKES IT! Assist: Shaquille George
Score: 77-71

[09:37] Team_042 possession (Score: 77-71)
Khris George attempts a 3Pt. Contested by Shaquille George (5.1 feet, ZONE). KHRIS GEORGE MAKES IT! Assist: Isaiah Randle
Score: 77-74

[09:24] Team_093 possession (Score: 77-74)
Cade O'Neal attempts a Layup. BLOCKED BY LAMELO STEWART! Ball is loose! Rebound secured by Allen Towns.

[09:07] Team_042 possession (Score: 77-74)
Khris George drives to the basket... Khris George throws a bad pass! Stolen by Shaquille George! TURNOVER! (live ball)

[08:58] Team_093 possession (Score: 77-74)
Shaquille George drives and kicks out. Lauri Parker attempts a Midrange. Contested by Isaiah Randle (5.8 feet, ZONE). Lauri Parker misses. Rebound secured by Allen Towns.

[08:49] Team_042 possession (Score: 77-74)
Gary Jackson attempts a Midrange. Contested by Kobe Murray (4.7 feet, ZONE). Gary Jackson misses. Rebound secured by Kobe Murray.

[08:31] Team_093 possession (Score: 77-74)
FOUL! Shooting foul on Gary Jackson. Lauri Parker to the line for 3 free throws. [Team fouls: 1] (Gary Jackson: 1 personal fouls)   FT 1/3: GOOD   FT 2/3: GOOD   FT 3/3: GOOD Lauri Parker makes 3/3 from the line.
Score: 80-74

[08:17] Team_042 possession (Score: 80-74)
Khris George attempts a 3Pt. Wide open! Shaquille George is 6.3 feet away. [ZONE] KHRIS GEORGE MAKES IT! Assist: Isaiah Randle
Score: 80-77

[08:05] Team_093 possession (Score: 80-77)
Cade O'Neal attempts a Midrange. Wide open! Lamelo Stewart is 6.2 feet away. [MAN] CADE O'NEAL MAKES IT! Assist: Lauri Parker
Score: 82-77

[07:53] Team_042 possession (Score: 82-77)
Khris George attempts a 3Pt. Wide open! Shaquille George is 6.5 feet away. [MAN] Khris George misses. Offensive rebound by Allen Towns! Allen Towns kicks it out.

[07:39] Team_042 possession (Score: 82-77)
Isaiah Randle attempts a Midrange. Wide open! Immanuel Cunningham is 6.8 feet away. [ZONE] Isaiah Randle misses. Rebound secured by Lauri Parker.

[07:23] Team_093 possession (Score: 82-77)
Kobe Murray drives and kicks out. Shaquille George attempts a Midrange. Contested by Khris George (3.2 feet, MAN). SHAQUILLE GEORGE MAKES IT! Assist: Immanuel Cunningham
Score: 84-77

[07:11] Team_042 possession (Score: 84-77)
Lamelo Stewart drives to the basket... FOUL! Offensive foul on Lamelo Stewart! Kobe Murray drew the charge! [Team fouls: 2] (Lamelo Stewart: 1 personal fouls) TURNOVER! (dead ball)

[06:57] Team_093 possession (Score: 84-77)
Cade O'Neal drives to the basket... FOUL! Offensive foul on Cade O'Neal! Lamelo Stewart drew the charge! [Team fouls: 2] (Cade O'Neal: 1 personal fouls) TURNOVER! (dead ball)

[06:46] Team_042 possession (Score: 84-77)
Khris George drives, picks up Kobe Murray. Help arrives from Shaquille George! Khris George attempts a Layup. Wide open! Shaquille George is 7.1 feet away. [ZONE] KHRIS GEORGE MAKES IT!
Score: 84-79

[06:33] Team_093 possession (Score: 84-79)
FOUL! Holding foul on Gary Jackson. [Team fouls: 3] No free throws, side out. (Gary Jackson: 2 personal fouls)

[06:17] Team_093 possession (Score: 84-79)
Lauri Parker makes the Dunk and draws the foul on Gary Jackson! And-1! Lauri Parker to the line for 1. [Team fouls: 4] (Gary Jackson: 3 personal fouls)   FT 1/1: MISS Lauri Parker makes 0/1 from the line. Rebound secured by Lamelo Stewart.
Score: 86-79

[06:08] Team_042 possession (Score: 86-79)
Gary Jackson attempts a Midrange. Contested by Immanuel Cunningham (4.4 feet, ZONE). Gary Jackson misses. Offensive rebound by Lamelo Stewart! Lamelo Stewart kicks it out.

[05:55] Team_042 possession (Score: 86-79)
Allen Towns drives and kicks out. Gary Jackson attempts a 3Pt. Wide open! Lauri Parker is 6.7 feet away. [MAN] Gary Jackson misses. Rebound secured by Lauri Parker.

[05:40] Team_093 possession (Score: 86-79)
Cade O'Neal drives, picks up Lamelo Stewart. Help arrives from Khris George! Cade O'Neal attempts a Layup. Wide open! Khris George is 7.0 feet away. [MAN] CADE O'NEAL MAKES IT!
Score: 88-79

[05:22] Team_042 possession (Score: 88-79)
Lamelo Stewart drives, Kobe Murray stays with him. Lamelo Stewart attempts a Dunk. Contested by Kobe Murray (4.6 feet, MAN). Lamelo Stewart misses. Rebound secured by Lauri Parker.

[05:11] Team_093 possession (Score: 88-79)
Cade O'Neal attempts a Layup. Wide open! Allen Towns is 7.1 feet away. [ZONE] Cade O'Neal misses. Offensive rebound by Cade O'Neal! Cade O'Neal kicks it out.

[04:59] Team_093 possession (Score: 88-79)
Cade O'Neal drives, picks up Allen Towns. Help arrives from Khris George! Cade O'Neal attempts a Layup. Wide open! Khris George is 6.5 feet away. [ZONE] CADE O'NEAL MAKES IT!
Score: 90-79

[04:42] Team_042 possession (Score: 90-79)
Lamelo Stewart attempts a Layup. Wide open! Cade O'Neal is 7.1 feet away. [ZONE] LAMELO STEWART MAKES IT! Assist: Khris George
Score: 90-81

[04:28] Team_093 possession (Score: 90-81)
Shaquille George attempts a 3Pt. Contested by Khris George (4.6 feet, MAN). Shaquille George misses. Offensive rebound by Kobe Murray! Kobe Murray's putback is no good. Rebound secured by Gary Jackson.

[04:18] Team_042 possession (Score: 90-81)
Gary Jackson attempts a 3Pt. Contested by Lauri Parker (3.7 feet, MAN). Gary Jackson misses. Rebound secured by Cade O'Neal.

[04:03] Team_093 possession (Score: 90-81)
Kobe Murray attempts a Layup. Wide open! Allen Towns is 9.9 feet away. [MAN] KOBE MURRAY MAKES IT!
Score: 92-81

[03:49] Team_042 possession (Score: 92-81)
Allen Towns attempts a Dunk. BLOCKED BY KOBE MURRAY! Ball deflects out of bounds off Allen Towns.

[03:32] Team_093 possession (Score: 92-81)
Shaquille George throws a bad pass! Stolen by Khris George! TURNOVER! (live ball)

[03:16] Team_042 possession (Score: 92-81)
Gary Jackson attempts a 3Pt. Contested by Shaquille George (2.8 feet, ZONE). Gary Jackson misses. FOUL! Loose ball foul on Kobe Murray during the rebound battle. [Team fouls: 3] No free throws, side out. (Kobe Murray: 1 personal fouls)

[02:59] Team_042 possession (Score: 92-81)
Isaiah Randle attempts a 3Pt. Contested by Immanuel Cunningham (4.9 feet, MAN). ISAIAH RANDLE MAKES IT!
Score: 92-84

[02:48] Team_093 possession (Score: 92-84)
Immanuel Cunningham attempts a Midrange. Wide open! Isaiah Randle is 8.6 feet away. [ZONE] IMMANUEL CUNNINGHAM MAKES IT! Assist: Kobe Murray
Score: 94-84

[02:36] Team_042 possession (Score: 94-84)
Allen Towns drives, Kobe Murray stays with him. Allen Towns attempts a Layup. Contested by Kobe Murray (4.5 feet, ZONE). ALLEN TOWNS MAKES IT! Assist: Isaiah Randle
Score: 94-86

[02:19] Team_093 possession (Score: 94-86)
Lauri Parker drives and kicks out. Cade O'Neal attempts a 3Pt. Wide open! Lamelo Stewart is 9.1 feet away. [MAN] Cade O'Neal misses. Rebound secured by Gary Jackson.

[02:07] Team_042 possession (Score: 94-86)
FOUL! Holding foul on Lauri Parker. [Team fouls: 4] No free throws, side out. (Lauri Parker: 1 personal fouls)

[01:55] Team_042 possession (Score: 94-86)
Lamelo Stewart throws a bad pass! Stolen by Kobe Murray! TURNOVER! (live ball)

[01:39] Team_093 possession (Score: 94-86)
Immanuel Cunningham attempts a Midrange. Contested by Allen Towns (2.9 feet, ZONE). Immanuel Cunningham misses. Rebound secured by Lamelo Stewart.

[01:24] Team_042 possession (Score: 94-86)
Gary Jackson drives, Kobe Murray stays with him. Gary Jackson attempts a Dunk. Wide open! Kobe Murray is 9.8 feet away. [ZONE] GARY JACKSON MAKES IT!
Score: 94-88

[01:13] Team_093 possession (Score: 94-88)
Cade O'Neal drives to the basket... Cade O'Neal throws a bad pass! Stolen by Allen Towns! TURNOVER! (live ball)

[01:00] Team_042 possession (Score: 94-88)
Khris George makes the Midrange and draws the foul on Shaquille George! And-1! Khris George to the line for 1. [BONUS: 5 team fouls] (Shaquille George: 1 personal fouls)   FT 1/1: GOOD Khris George makes 1/1 from the line.
Score: 94-91

[00:48] Team_093 possession (Score: 94-91)
Kobe Murray attempts a Midrange. Contested by Lamelo Stewart (4.3 feet, ZONE). Kobe Murray misses. Rebound secured by Lamelo Stewart.

[00:34] Team_042 possession (Score: 94-91)
Khris George attempts a 3Pt. Contested by Shaquille George (4.9 feet, MAN). Khris George misses. Rebound secured by Lauri Parker.

[00:25] Team_093 possession (Score: 94-91)
Shaquille George attempts a Midrange. Contested by Khris George (5.0 feet, MAN). SHAQUILLE GEORGE MAKES IT! Assist: Kobe Murray
Score: 96-91

[00:09] Team_042 possession (Score: 96-91)
Khris George attempts a 3Pt. Wide open! Shaquille George is 7.2 feet away. [MAN] Khris George misses. Rebound secured by Kobe Murray.

================================================================================
                              4TH QUARTER COMPLETE                              
================================================================================

4TH QUARTER SCORE: Team_093 26, Team_042 22

BOX SCORE:
================================================================================

Team_093
--------------------------------------------------------------------------------
Player                MIN  PTS  REB  AST  TO      FG   FG%      3P   3P%
--------------------------------------------------------------------------------
Cade O'Neal            22    8    2    0   0   4/5    80.0     0/0   0.0
Shaquille George       22    4    0    1   0   2/4    50.0     0/0   0.0
Trae Westbrook         27    3    0    0   0   1/2    50.0     0/0   0.0
Lauri Parker           22    3    4    1   0   1/3    33.3     0/0   0.0
Ben Cunningham         27    2    1    0   0   1/1   100.0     0/0   0.0
Kobe Murray            22    2    2    2   0   1/2    50.0     0/0   0.0
Immanuel Cunningham    22    2    0    1   0   1/2    50.0     0/0   0.0
Damian Williamson      27    0    0    1   0   0/1     0.0     0/0   0.0
Vince Barnes           27    0    1    1   0   0/0     0.0     0/0   0.0

TEAM: FG: 11/20 (55.0%), 3PT: 1/3 (33.3%), REB: 11 (2 off, 9 def), AST: 7, TO: 3
TEAM FOULS: 5 [Team_042 in BONUS]


Team_042
--------------------------------------------------------------------------------
Player                MIN  PTS  REB  AST  TO      FG   FG%      3P   3P%
--------------------------------------------------------------------------------
Khris George           22   11    0    1   0   4/6    66.7     0/0   0.0
Isaiah Randle          22    3    0    3   0   1/2    50.0     0/0   0.0
Dejounte Butler        27    2    1    0   0   1/1   100.0     0/0   0.0
Allen Towns            22    2    3    0   0   1/3    33.3     0/0   0.0
Gary Jackson           22    2    2    0   0   1/3    33.3     0/0   0.0
Lamelo Stewart         22    2    5    0   0   1/2    50.0     0/0   0.0
Tyler Barrett          27    0    1    0   0   0/2     0.0     0/0   0.0

TEAM: FG: 9/19 (47.4%), 3PT: 3/6 (50.0%), REB: 11 (3 off, 8 def), AST: 4, TO: 4
TEAM FOULS: 4

================================================================================

================================================================================
                               FULL GAME COMPLETE                               
================================================================================

FINAL SCORE: Team_093 96, Team_042 91

SCORING BY QUARTER:
--------------------------------------------------------------------------------
Team                     Q1     Q2     Q3     Q4    FINAL
--------------------------------------------------------------------------------
Team_093                 19     31     20     26       96
Team_042                 23     29     17     22       91
--------------------------------------------------------------------------------

FULL GAME BOX SCORE:
================================================================================

Team_093
--------------------------------------------------------------------------------
Player                MIN  PTS  REB  AST  TO      FG   FG%      3P   3P%      FT STL BLK
--------------------------------------------------------------------------------
Damian Williamson      27    9    0    4   1   3/8    37.5   0/2     0.0   2/2     1   0
Trae Westbrook         27    8    0    3   0   2/5    40.0   0/1     0.0   0/0     0   0
Carmelo Wagner         27   12   11    3   3   7/13   53.8   2/4    50.0   4/8     0   1
Vince Barnes           27    8    7    2   2   5/5   100.0   0/0     0.0   0/0     0   0
Ben Cunningham         27   10    9    1   4   4/10   40.0   0/1     0.0   2/2     0   0
Shaquille George       22    8    0    2   1   3/9    33.3   0/4     0.0   0/0     1   0
Immanuel Cunningham    22    7    0    4   0   3/4    75.0   1/1   100.0   0/0     0   0
Lauri Parker           22   12    7    2   2   4/7    57.1   2/3    66.7   5/7     0   0
Kobe Murray            22    8    7    3   2   5/8    62.5   1/1   100.0   2/3     1   2
Cade O'Neal            22   10    6    2   2   5/7    71.4   0/0     0.0   0/0     0   1

TEAM: FG: 41/76 (53.9%), 3PT: 6/17 (35.3%), REB: 46 (9 off, 37 def), AST: 26, TO: 17


Team_042
--------------------------------------------------------------------------------
Player                MIN  PTS  REB  AST  TO      FG   FG%      3P   3P%      FT STL BLK
--------------------------------------------------------------------------------
Tyler Barrett          27    9    4    2   0   3/10   30.0   1/2    50.0   2/4     0   0
Kristaps Parker        27   14    0    1   0   5/5   100.0   4/4   100.0   0/0     0   0
Jarrett Sabonis        27    5    0    1   0   4/13   30.8   2/7    28.6   0/0     1   1
Dejounte Butler        27    9   14    1   2   2/3    66.7   0/0     0.0   5/6     0   0
Cade Dosunmu           27    8    5    3   4   3/9    33.3   0/0     0.0   2/2     2   0
Khris George           22   17    0    1   1   7/12   58.3   4/9    44.4   1/1     1   0
Isaiah Randle          22   13    0    4   1   6/9    66.7   3/5    60.0   2/2     0   0
Gary Jackson           22    4    4    2   0   2/7    28.6   0/3     0.0   0/0     1   0
Allen Towns            22    5    7    2   1   1/5    20.0   0/0     0.0   1/1     1   0
Lamelo Stewart         22    7    9    2   2   2/4    50.0   0/1     0.0   0/0     1   1

TEAM: FG: 38/80 (47.5%), 3PT: 14/31 (45.2%), REB: 44 (12 off, 32 def), AST: 19, TO: 11

================================================================================
