================================================================================
                        FULL GAME - Team_021 vs Team_050                        
================================================================================

================================================================================
                       1ST QUARTER - Team_021 vs Team_050                       
================================================================================

[12:00] Team_021 possession (Score: 0-0)
Kyrie Wagner drives to the basket... Kyrie Wagner throws a bad pass out of bounds! TURNOVER! (dead ball)

[11:46] Team_050 possession (Score: 0-0)
Joel Banchero drives, Anthony Oladipo stays with him. Joel Banchero attempts a Dunk. Contested by Anthony Oladipo (3.8 feet, MAN). JOEL BANCHERO MAKES IT!
Score: 0-2

[11:30] Team_021 possession (Score: 0-2)
Karl Bridges attempts a 3Pt. Heavily contested by Collin Bane (1.1 feet, MAN)! KARL BRIDGES MAKES IT! Assist: Zach Carter
Score: 3-2

[11:18] Team_050 possession (Score: 3-2)
FOUL! Holding foul on Zach Carter. [Team fouls: 1] No free throws, side out. (Zach Carter: 1 personal fouls)

[11:04] Team_050 possession (Score: 3-2)
Giannis LaVine attempts a Layup. Wide open! Kyrie Leonard is 6.7 feet away. [MAN] Giannis LaVine misses. Rebound secured by Zach Carter.

[10:53] Team_021 possession (Score: 3-2)
Kyrie Leonard attempts a 3Pt. Contested by Giannis LaVine (4.8 feet, MAN). KYRIE LEONARD MAKES IT! Assist: Zach Carter
Score: 6-2

[10:33] Team_050 possession (Score: 6-2)
Joel Banchero attempts a 3Pt. Contested by Karl Bridges (5.1 feet, ZONE). JOEL BANCHERO MAKES IT! Assist: Collin Bane
Score: 6-5

[10:19] Team_021 possession (Score: 6-5)
Karl Bridges attempts a 3Pt. Contested by Giannis LaVine (2.2 feet, ZONE). Karl Bridges misses. Offensive rebound by Kyrie Leonard! Kyrie Leonard kicks it out.

[10:03] Team_021 possession (Score: 6-5)
Zach Carter attempts a 3Pt. Contested by Giannis LaVine (3.1 feet, ZONE). ZACH CARTER MAKES IT! Assist: Karl Bridges
Score: 9-5

[09:46] Team_050 possession (Score: 9-5)
Donovan Trent drives and kicks out. Collin Bane attempts a 3Pt. Heavily contested by Kyrie Wagner (1.5 feet, ZONE)! COLLIN BANE MAKES IT! Assist: Donovan Trent
Score: 9-8

[09:33] Team_021 possession (Score: 9-8)
Kyrie Leonard attempts a 3Pt. Contested by Giannis LaVine (2.4 feet, ZONE). KYRIE LEONARD MAKES IT! Assist: Karl Bridges
Score: 12-8

[09:19] Team_050 possession (Score: 12-8)
Donovan Trent drives, Zach Carter stays with him. Donovan Trent attempts a Layup. Contested by Zach Carter (2.7 feet, ZONE). DONOVAN TRENT MAKES IT! Assist: LeBron Bridges
Score: 12-10

[09:04] Team_021 possession (Score: 12-10)
Zach Carter drives, picks up Donovan Trent. Help arrives from Joel Banchero! Zach Carter attempts a Dunk. Contested by Joel Banchero (5.2 feet, MAN). ZACH CARTER MAKES IT! Assist: Kyrie Wagner
Score: 14-10

[08:51] Team_050 possession (Score: 14-10)
Collin Bane attempts a 3Pt. Contested by Karl Bridges (3.9 feet, MAN). Collin Bane misses. Offensive rebound by LeBron Bridges! LeBron Bridges kicks it out.

[08:36] Team_050 possession (Score: 14-10)
Joel Banchero drives and kicks out. Giannis LaVine attempts a Midrange. Contested by Kyrie Leonard (3.7 feet, MAN). GIANNIS LAVINE MAKES IT! Assist: Joel Banchero
Score: 14-12

[08:22] Team_021 possession (Score: 14-12)
Kyrie Wagner attempts a 3Pt. Heavily contested by LeBron Bridges (1.1 feet, MAN)! Kyrie Wagner misses. Rebound secured by Collin Bane.

[08:06] Team_050 possession (Score: 14-12)
LeBron Bridges attempts a Layup. Heavily contested by Zach Carter (1.8 feet, ZONE)! LEBRON BRIDGES MAKES IT! Assist: Joel Banchero
Score: 14-14

[07:47] Team_021 possession (Score: 14-14)
Kyrie Wagner loses the ball! Stripped by LeBron Bridges! TURNOVER! (live ball)

[07:31] Team_050 possession (Score: 14-14)
Giannis LaVine attempts a 3Pt. Contested by Kyrie Wagner (3.4 feet, ZONE). Giannis LaVine misses. Rebound secured by Kyrie Leonard.

[07:11] Team_021 possession (Score: 14-14)
Kyrie Leonard attempts a Midrange. Contested by Giannis LaVine (5.7 feet, MAN). KYRIE LEONARD MAKES IT!
Score: 16-14

[06:57] Team_050 possession (Score: 16-14)
Donovan Trent throws a bad pass out of bounds! TURNOVER! (dead ball)

[06:42] Team_021 possession (Score: 16-14)
Kyrie Wagner throws a bad pass out of bounds! TURNOVER! (dead ball)

[06:27] Team_050 possession (Score: 16-14)
Joel Banchero drives to the basket... Joel Banchero loses the ball! Stripped by Zach Carter! TURNOVER! (live ball)

[06:09] Team_021 possession (Score: 16-14)
Kyrie Wagner attempts a Midrange. Contested by Joel Banchero (5.8 feet, ZONE). Kyrie Wagner misses. Rebound secured by LeBron Bridges.

[05:53] Team_050 possession (Score: 16-14)
Joel Banchero attempts a 3Pt. Contested by Kyrie Wagner (4.4 feet, ZONE). Joel Banchero misses. Rebound secured by Kyrie Leonard.

[05:40] Team_021 possession (Score: 16-14)
Kyrie Leonard drives, picks up Giannis LaVine. Help arrives from Collin Bane! Kyrie Leonard attempts a Dunk. Contested by Collin Bane (3.6 feet, MAN). Kyrie Leonard misses. Rebound secured by Collin Bane.

[05:24] Team_050 possession (Score: 16-14)
Joel Banchero attempts a Layup. Wide open! Zach Carter is 6.3 feet away. [ZONE] JOEL BANCHERO MAKES IT!
Score: 16-16

[05:08] Team_021 possession (Score: 16-16)
Karl Bridges attempts a 3Pt. Contested by Giannis LaVine (2.7 feet, ZONE). Karl Bridges misses. Rebound secured by Joel Banchero.

[04:53] Team_050 possession (Score: 16-16)
Joel Banchero attempts a 3Pt. Heavily contested by Kyrie Wagner (0.7 feet, ZONE)! JOEL BANCHERO MAKES IT! Assist: Donovan Trent
Score: 16-19

[04:41] Team_021 possession (Score: 16-19)
Anthony Oladipo attempts a 3Pt. Heavily contested by Giannis LaVine (1.9 feet, ZONE)! Anthony Oladipo misses. Rebound secured by Collin Bane.

[04:29] Team_050 possession (Score: 16-19)
Joel Banchero drives, picks up Anthony Oladipo. Help arrives from Kyrie Leonard! Joel Banchero attempts a Layup. Wide open! Kyrie Leonard is 6.5 feet away. [MAN] Joel Banchero misses. Rebound secured by Kyrie Leonard.

[04:17] Team_021 possession (Score: 16-19)
Anthony Oladipo attempts a 3Pt. Wide open! Giannis LaVine is 7.4 feet away. [ZONE] Anthony Oladipo misses. Rebound secured by Collin Bane.

[04:02] Team_050 possession (Score: 16-19)
Joel Banchero attempts a 3Pt. Contested by Kyrie Wagner (2.8 feet, ZONE). Joel Banchero misses. Offensive rebound by LeBron Bridges! LeBron Bridges kicks it out.

[03:48] Team_050 possession (Score: 16-19)
Collin Bane throws a bad pass out of bounds! TURNOVER! (dead ball)

[03:34] Team_021 possession (Score: 16-19)
FOUL! Reach-in foul on Donovan Trent during the drive. [Team fouls: 1] No free throws, side out. (Donovan Trent: 1 personal fouls)

[03:14] Team_021 possession (Score: 16-19)
FOUL! Offensive foul on Kyrie Wagner! LeBron Bridges drew the charge! [Team fouls: 2] (Kyrie Wagner: 1 personal fouls) TURNOVER! (dead ball)

[03:02] Team_050 possession (Score: 16-19)
Joel Banchero attempts a 3Pt. Contested by Kyrie Wagner (5.7 feet, ZONE). Joel Banchero misses. Rebound secured by Zach Carter.

[02:46] Team_021 possession (Score: 16-19)
Zach Carter attempts a 3Pt. Wide open! Donovan Trent is 6.4 feet away. [MAN] Zach Carter misses. Rebound secured by LeBron Bridges.

[02:32] Team_050 possession (Score: 16-19)
Collin Bane attempts a Midrange. Wide open! Anthony Oladipo is 7.8 feet away. [ZONE] COLLIN BANE MAKES IT! Assist: Joel Banchero
Score: 16-21

[02:18] Team_021 possession (Score: 16-21)
Zach Carter drives, Donovan Trent stays with him. Zach Carter attempts a Layup. Wide open! Donovan Trent is 6.8 feet away. [MAN] Zach Carter misses. Rebound secured by Joel Banchero.

[02:04] Team_050 possession (Score: 16-21)
LeBron Bridges attempts a Layup. Wide open! Kyrie Wagner is 6.3 feet away. [MAN] LEBRON BRIDGES MAKES IT! Assist: Giannis LaVine
Score: 16-23

[01:53] Team_021 possession (Score: 16-23)
Kyrie Leonard drives and kicks out. Anthony Oladipo attempts a 3Pt. Contested by Giannis LaVine (5.9 feet, ZONE). Anthony Oladipo misses. Rebound secured by LeBron Bridges.

[01:43] Team_050 possession (Score: 16-23)
FOUL! Reach-in foul on Zach Carter during the drive. [Team fouls: 3] No free throws, side out. (Zach Carter: 2 personal fouls)

[01:30] Team_050 possession (Score: 16-23)
LeBron Bridges throws a bad pass! Stolen by Kyrie Wagner! TURNOVER! (live ball)

[01:14] Team_021 possession (Score: 16-23)
Kyrie Leonard makes the Layup and draws the foul on Giannis LaVine! And-1! Kyrie Leonard to the line for 1. [Team fouls: 2] (Giannis LaVine: 1 personal fouls)   FT 1/1: GOOD Kyrie Leonard makes 1/1 from the line.
Score: 19-23

[00:57] Team_050 possession (Score: 19-23)
Giannis LaVine drives to the basket... Giannis LaVine loses control! Ball rolls out of bounds! TURNOVER! (dead ball)

[00:57] Substitution (Team_021): Kyrie Leonard OUT → Joel LaVine IN (stamina_rule2)

[00:57] Substitution (Team_021): Anthony Oladipo OUT → Victor Mitchell IN (stamina_rule2)

[00:57] Substitution (Team_021): Karl Bridges OUT → Paul Allen IN (stamina_rule2)

[00:57] Substitution (Team_021): Kyrie Wagner OUT → Vince George IN (stamina_rule2)

[00:57] Substitution (Team_021): Zach Carter OUT → Magic Ingram IN (stamina_rule2)

[00:57] Substitution (Team_050): Giannis LaVine OUT → Damian O'Neal IN (stamina_rule2)

[00:57] Substitution (Team_050): Joel Banchero OUT → Dwyane Towns IN (stamina_rule2)

[00:57] Substitution (Team_050): Collin Bane OUT → Larry Curry IN (stamina_rule2)

[00:57] Substitution (Team_050): LeBron Bridges OUT → Luka Gasol IN (stamina_rule2)

[00:57] Substitution (Team_050): Donovan Trent OUT → Tyler Smith IN (stamina_rule2)

[00:40] Team_021 possession (Score: 19-23)
Vince George drives to the basket... FOUL! Offensive foul on Vince George! Luka Gasol drew the charge! [Team fouls: 4] (Vince George: 1 personal fouls) TURNOVER! (dead ball)

[00:25] Team_050 possession (Score: 19-23)
Larry Curry throws a bad pass! Stolen by Paul Allen! TURNOVER! (live ball)

[00:14] Team_021 possession (Score: 19-23)
Victor Mitchell attempts a Layup. Contested by Tyler Smith (5.9 feet, ZONE). Victor Mitchell misses. Rebound secured by Tyler Smith.

================================================================================
                              1ST QUARTER COMPLETE                              
================================================================================

1ST QUARTER SCORE: Team_021 19, Team_050 23

BOX SCORE:
================================================================================

Team_021
--------------------------------------------------------------------------------
Player                MIN  PTS  REB  AST  TO      FG   FG%      3P   3P%
--------------------------------------------------------------------------------
Kyrie Leonard          11   11    4    0   0   4/6    66.7     0/0   0.0
Zach Carter            11    5    2    2   0   2/4    50.0     0/0   0.0
Karl Bridges           11    3    0    2   0   1/2    50.0     0/0   0.0
Kyrie Wagner           11    0    0    1   0   0/2     0.0     0/0   0.0
Anthony Oladipo        11    0    0    0   0   0/2     0.0     0/0   0.0
Victor Mitchell         1    0    0    0   0   0/1     0.0     0/0   0.0

TEAM: FG: 7/17 (41.2%), 3PT: 4/9 (44.4%), REB: 6 (1 off, 5 def), AST: 5, TO: 5
TEAM FOULS: 4


Team_050
--------------------------------------------------------------------------------
Player                MIN  PTS  REB  AST  TO      FG   FG%      3P   3P%
--------------------------------------------------------------------------------
Joel Banchero          11   10    2    3   0   4/7    57.1     0/0   0.0
Collin Bane            11    5    4    1   0   2/2   100.0     0/0   0.0
LeBron Bridges         11    4    5    1   0   2/2   100.0     0/0   0.0
Giannis LaVine         11    2    0    1   0   1/3    33.3     0/0   0.0
Donovan Trent          11    2    0    2   0   1/1   100.0     0/0   0.0
Tyler Smith             1    0    1    0   0   0/0     0.0     0/0   0.0

TEAM: FG: 10/15 (66.7%), 3PT: 2/5 (40.0%), REB: 12 (2 off, 10 def), AST: 8, TO: 6
TEAM FOULS: 2

================================================================================

================================================================================
                       2ND QUARTER - Team_021 vs Team_050                       
================================================================================

[12:00] Team_021 possession (Score: 19-23)
Kyrie Wagner attempts a Midrange. Heavily contested by Joel Banchero (2.0 feet, ZONE)! Kyrie Wagner misses. Rebound secured by Collin Bane.

[11:45] Team_050 possession (Score: 19-23)
Giannis LaVine attempts a Midrange. Contested by Kyrie Leonard (3.5 feet, MAN). Giannis LaVine misses. Rebound secured by Kyrie Leonard.

[11:30] Team_021 possession (Score: 19-23)
Karl Bridges attempts a Midrange. Contested by Collin Bane (5.7 feet, MAN). Karl Bridges misses. Rebound secured by LeBron Bridges.

[11:16] Team_050 possession (Score: 19-23)
Giannis LaVine drives and kicks out. FOUL! Shooting foul on Anthony Oladipo. Giannis LaVine to the line for 2 free throws. [Team fouls: 1] (Anthony Oladipo: 1 personal fouls)   FT 1/2: MISS   FT 2/2: GOOD Giannis LaVine makes 1/2 from the line.
Score: 19-24

[10:57] Team_021 possession (Score: 19-24)
FOUL! Holding foul on Collin Bane. [Team fouls: 1] No free throws, side out. (Collin Bane: 1 personal fouls)

[10:40] Team_021 possession (Score: 19-24)
Kyrie Leonard makes the Dunk and draws the foul on Donovan Trent! And-1! Kyrie Leonard to the line for 1. [Team fouls: 2] (Donovan Trent: 1 personal fouls)   FT 1/1: GOOD Kyrie Leonard makes 1/1 from the line.
Score: 22-24

[10:28] Team_050 possession (Score: 22-24)
FOUL! Reach-in foul on Zach Carter during the drive. [Team fouls: 2] No free throws, side out. (Zach Carter: 1 personal fouls)

[10:12] Team_050 possession (Score: 22-24)
Joel Banchero attempts a 3Pt. Heavily contested by Kyrie Wagner (1.7 feet, ZONE)! JOEL BANCHERO MAKES IT! Assist: Giannis LaVine
Score: 22-27

[10:01] Team_021 possession (Score: 22-27)
Kyrie Leonard drives, picks up Giannis LaVine. Help arrives from Collin Bane! Kyrie Leonard attempts a Dunk. Contested by Collin Bane (3.2 feet, MAN). KYRIE LEONARD MAKES IT!
Score: 24-27

[09:42] Team_050 possession (Score: 24-27)
Collin Bane drives to the basket... Collin Bane loses control! Ball rolls out of bounds! TURNOVER! (dead ball)

[09:42] Substitution (Team_021): Kyrie Leonard OUT → Joel LaVine IN (stamina_rule2)

[09:42] Substitution (Team_021): Anthony Oladipo OUT → Victor Mitchell IN (stamina_rule2)

[09:42] Substitution (Team_021): Karl Bridges OUT → Paul Allen IN (stamina_rule2)

[09:42] Substitution (Team_021): Kyrie Wagner OUT → Vince George IN (stamina_rule2)

[09:42] Substitution (Team_021): Zach Carter OUT → Magic Ingram IN (stamina_rule2)

[09:42] Substitution (Team_050): Giannis LaVine OUT → Damian O'Neal IN (stamina_rule2)

[09:42] Substitution (Team_050): Joel Banchero OUT → Dwyane Towns IN (stamina_rule2)

[09:42] Substitution (Team_050): Collin Bane OUT → Larry Curry IN (stamina_rule2)

[09:42] Substitution (Team_050): LeBron Bridges OUT → Luka Gasol IN (stamina_rule2)

[09:42] Substitution (Team_050): Donovan Trent OUT → Tyler Smith IN (stamina_rule2)

[09:31] Team_021 possession (Score: 24-27)
Paul Allen attempts a Midrange. Wide open! Larry Curry is 6.7 feet away. [MAN] PAUL ALLEN MAKES IT! Assist: Vince George
Score: 26-27

[09:14] Team_050 possession (Score: 26-27)
Dwyane Towns attempts a 3Pt. Wide open! Victor Mitchell is 6.6 feet away. [ZONE] DWYANE TOWNS MAKES IT! Assist: Luka Gasol
Score: 26-30

[09:03] Team_021 possession (Score: 26-30)
FOUL! Shooting foul on Tyler Smith. Paul Allen to the line for 2 free throws. [Team fouls: 3] (Tyler Smith: 1 personal fouls)   FT 1/2: GOOD   FT 2/2: GOOD Paul Allen makes 2/2 from the line.
Score: 28-30

[08:49] Team_050 possession (Score: 28-30)
Larry Curry attempts a 3Pt. Contested by Victor Mitchell (2.1 feet, ZONE). Larry Curry misses. Rebound secured by Vince George.

[08:33] Team_021 possession (Score: 28-30)
Vince George drives and kicks out. Joel LaVine attempts a Midrange. Contested by Larry Curry (2.3 feet, ZONE). Joel LaVine misses. Rebound secured by Larry Curry.

[08:17] Team_050 possession (Score: 28-30)
Damian O'Neal drives, Joel LaVine stays with him. Damian O'Neal attempts a Dunk. Contested by Joel LaVine (5.2 feet, MAN). Damian O'Neal misses. Rebound secured by Victor Mitchell.

[08:02] Team_021 possession (Score: 28-30)
Joel LaVine attempts a Midrange. Wide open! Damian O'Neal is 8.7 feet away. [MAN] JOEL LAVINE MAKES IT! Assist: Vince George
Score: 30-30

[07:44] Team_050 possession (Score: 30-30)
Damian O'Neal attempts a Midrange. Wide open! Vince George is 9.8 feet away. [ZONE] Damian O'Neal misses. Rebound secured by Magic Ingram.

[07:31] Team_021 possession (Score: 30-30)
Joel LaVine attempts a 3Pt. Contested by Luka Gasol (3.4 feet, ZONE). Joel LaVine misses. Rebound secured by Tyler Smith.

[07:14] Team_050 possession (Score: 30-30)
Dwyane Towns attempts a 3Pt. Wide open! Victor Mitchell is 6.3 feet away. [ZONE] Dwyane Towns misses. Rebound secured by Vince George.

[06:56] Team_021 possession (Score: 30-30)
Magic Ingram drives to the basket... Magic Ingram loses control! Ball rolls out of bounds! TURNOVER! (dead ball)

[06:44] Team_050 possession (Score: 30-30)
Tyler Smith attempts a Midrange. Wide open! Vince George is 8.9 feet away. [ZONE] Tyler Smith misses. Rebound secured by Magic Ingram.

[06:33] Team_021 possession (Score: 30-30)
Joel LaVine attempts a 3Pt. Contested by Larry Curry (4.0 feet, ZONE). Joel LaVine misses. Rebound secured by Dwyane Towns.

[06:19] Team_050 possession (Score: 30-30)
Dwyane Towns attempts a Midrange. Wide open! Victor Mitchell is 7.8 feet away. [MAN] Dwyane Towns misses. Rebound secured by Magic Ingram.

[06:02] Team_021 possession (Score: 30-30)
Vince George drives, Luka Gasol stays with him. Vince George attempts a Dunk. Contested by Luka Gasol (5.4 feet, MAN). Vince George misses. Rebound secured by Dwyane Towns.

[05:46] Team_050 possession (Score: 30-30)
Tyler Smith drives, picks up Magic Ingram. Help arrives from Victor Mitchell! Tyler Smith attempts a Dunk. Contested by Victor Mitchell (5.2 feet, MAN). TYLER SMITH MAKES IT!
Score: 30-32

[05:30] Team_021 possession (Score: 30-32)
Vince George drives to the basket... Vince George throws a bad pass! Stolen by Luka Gasol! TURNOVER! (live ball)

[05:15] Team_050 possession (Score: 30-32)
Larry Curry attempts a 3Pt. Contested by Joel LaVine (5.7 feet, ZONE). Larry Curry misses. Rebound secured by Victor Mitchell.

[04:58] Team_021 possession (Score: 30-32)
Victor Mitchell attempts a Layup. Wide open! Tyler Smith is 6.9 feet away. [ZONE] VICTOR MITCHELL MAKES IT! Assist: Joel LaVine
Score: 32-32

[04:42] Team_050 possession (Score: 32-32)
Damian O'Neal attempts a Layup. Wide open! Joel LaVine is 6.7 feet away. [MAN] DAMIAN O'NEAL MAKES IT! Assist: Luka Gasol
Score: 32-34

[04:29] Team_021 possession (Score: 32-34)
Magic Ingram makes the Layup and draws the foul on Tyler Smith! And-1! Magic Ingram to the line for 1. [Team fouls: 4] (Tyler Smith: 2 personal fouls)   FT 1/1: GOOD Magic Ingram makes 1/1 from the line.
Score: 35-34

[04:19] Team_050 possession (Score: 35-34)
Larry Curry attempts a 3Pt. Wide open! Paul Allen is 7.0 feet away. [MAN] Larry Curry misses. Offensive rebound by Tyler Smith! Tyler Smith kicks it out.

[04:03] Team_050 possession (Score: 35-34)
Larry Curry attempts a 3Pt. Wide open! Victor Mitchell is 6.0 feet away. [ZONE] Larry Curry misses. Rebound secured by Victor Mitchell.

[03:46] Team_021 possession (Score: 35-34)
FOUL! Offensive foul on Vince George! Luka Gasol drew the charge! [Team fouls: 3] (Vince George: 1 personal fouls) TURNOVER! (dead ball)

[03:31] Team_050 possession (Score: 35-34)
Dwyane Towns attempts a Midrange. Contested by Victor Mitchell (3.0 feet, ZONE). DWYANE TOWNS MAKES IT!
Score: 35-36

[03:15] Team_021 possession (Score: 35-36)
Joel LaVine attempts a Midrange. Contested by Luka Gasol (4.9 feet, ZONE). Joel LaVine misses. Rebound secured by Tyler Smith.

[02:58] Team_050 possession (Score: 35-36)
Damian O'Neal attempts a 3Pt. Contested by Victor Mitchell (4.5 feet, ZONE). Damian O'Neal misses. Rebound secured by Magic Ingram.

[02:43] Team_021 possession (Score: 35-36)
FOUL! Shooting foul on Larry Curry. Joel LaVine to the line for 2 free throws. [BONUS: 5 team fouls] (Larry Curry: 1 personal fouls)   FT 1/2: GOOD   FT 2/2: MISS Joel LaVine makes 1/2 from the line. Rebound secured by Larry Curry.
Score: 36-36

[02:30] Team_050 possession (Score: 36-36)
Damian O'Neal attempts a Midrange. BLOCKED BY PAUL ALLEN! Ball is loose! Rebound secured by Victor Mitchell.

[02:16] Team_021 possession (Score: 36-36)
Magic Ingram attempts a Layup. BLOCKED BY TYLER SMITH! Ball deflects out of bounds off Magic Ingram.

[02:03] Team_050 possession (Score: 36-36)
Dwyane Towns drives and kicks out. Damian O'Neal attempts a 3Pt. Wide open! Victor Mitchell is 6.9 feet away. [ZONE] Damian O'Neal misses. Offensive rebound by Tyler Smith! Tyler Smith kicks it out.

[01:52] Team_050 possession (Score: 36-36)
Dwyane Towns attempts a 3Pt. Heavily contested by Victor Mitchell (1.8 feet, MAN)! Dwyane Towns misses. Rebound secured by Magic Ingram.

[01:35] Team_021 possession (Score: 36-36)
FOUL! Shooting foul on Dwyane Towns. Magic Ingram to the line for 2 free throws. [BONUS: 6 team fouls] (Dwyane Towns: 1 personal fouls)   FT 1/2: GOOD   FT 2/2: GOOD Magic Ingram makes 2/2 from the line.
Score: 38-36

[01:24] Team_050 possession (Score: 38-36)
Luka Gasol attempts a Midrange. Contested by Vince George (2.6 feet, MAN). Luka Gasol misses. Rebound secured by Magic Ingram.

[01:09] Team_021 possession (Score: 38-36)
Joel LaVine attempts a Midrange. Wide open! Damian O'Neal is 7.5 feet away. [MAN] JOEL LAVINE MAKES IT!
Score: 40-36

[00:56] Team_050 possession (Score: 40-36)
FOUL! Shooting foul on Vince George. Tyler Smith to the line for 2 free throws. [Team fouls: 4] (Vince George: 2 personal fouls)   FT 1/2: GOOD   FT 2/2: GOOD Tyler Smith makes 2/2 from the line.
Score: 40-38

[00:43] Team_021 possession (Score: 40-38)
Joel LaVine drives, Damian O'Neal stays with him. Joel LaVine attempts a Layup. Wide open! Damian O'Neal is 6.1 feet away. [MAN] JOEL LAVINE MAKES IT! Assist: Vince George
Score: 42-38

[00:31] Team_050 possession (Score: 42-38)
Larry Curry attempts a 3Pt. Heavily contested by Victor Mitchell (1.9 feet, ZONE)! LARRY CURRY MAKES IT! Assist: Damian O'Neal
Score: 42-41

[00:14] Team_021 possession (Score: 42-41)
Joel LaVine drives, picks up Tyler Smith. Help arrives from Dwyane Towns! Joel LaVine attempts a Layup. Heavily contested by Dwyane Towns (1.0 feet, ZONE)! JOEL LAVINE MAKES IT! Assist: Magic Ingram
Score: 44-41

================================================================================
                              2ND QUARTER COMPLETE                              
================================================================================

2ND QUARTER SCORE: Team_021 25, Team_050 18

BOX SCORE:
================================================================================

Team_021
--------------------------------------------------------------------------------
Player                MIN  PTS  REB  AST  TO      FG   FG%      3P   3P%
--------------------------------------------------------------------------------
Joel LaVine            10    8    0    1   0   4/8    50.0     0/0   0.0
Kyrie Leonard          14    5    1    0   0   2/2   100.0     0/0   0.0
Magic Ingram           10    5    6    1   0   2/3    66.7     0/0   0.0
Paul Allen             10    4    0    0   0   2/2   100.0     0/0   0.0
Victor Mitchell        10    2    4    0   0   1/1   100.0     0/0   0.0
Kyrie Wagner           14    0    0    0   0   0/1     0.0     0/0   0.0
Karl Bridges           14    0    0    0   0   0/1     0.0     0/0   0.0
Vince George           10    0    2    3   0   0/2     0.0     0/0   0.0

TEAM: FG: 11/20 (55.0%), 3PT: 0/2 (0.0%), REB: 13 (0 off, 13 def), AST: 5, TO: 3
TEAM FOULS: 4


Team_050
--------------------------------------------------------------------------------
Player                MIN  PTS  REB  AST  TO      FG   FG%      3P   3P%
--------------------------------------------------------------------------------
Dwyane Towns           10    5    2    0   0   2/5    40.0     0/0   0.0
Tyler Smith            10    4    4    0   0   2/3    66.7     0/0   0.0
Joel Banchero          14    3    0    0   0   1/1   100.0     0/0   0.0
Larry Curry            10    3    2    0   0   1/4    25.0     0/0   0.0
Damian O'Neal          10    2    0    1   0   1/5    20.0     0/0   0.0
Giannis LaVine         14    1    0    1   0   1/2    50.0     0/0   0.0
Collin Bane            14    0    1    0   0   0/0     0.0     0/0   0.0
LeBron Bridges         14    0    1    0   0   0/0     0.0     0/0   0.0
Luka Gasol             10    0    0    2   0   0/1     0.0     0/0   0.0

TEAM: FG: 8/21 (38.1%), 3PT: 3/9 (33.3%), REB: 10 (2 off, 8 def), AST: 4, TO: 1
TEAM FOULS: 6 [Team_021 in BONUS]

================================================================================

================================================================================
                       3RD QUARTER - Team_021 vs Team_050                       
================================================================================

[12:00] Team_021 possession (Score: 44-41)
Kyrie Wagner attempts a 3Pt. Contested by Giannis LaVine (4.9 feet, ZONE). Kyrie Wagner misses. Rebound secured by Collin Bane.

[11:45] Team_050 possession (Score: 44-41)
Joel Banchero attempts a 3Pt. Contested by Kyrie Wagner (3.9 feet, ZONE). JOEL BANCHERO MAKES IT! Assist: LeBron Bridges
Score: 44-44

[11:30] Team_021 possession (Score: 44-44)
Zach Carter drives and kicks out. Kyrie Wagner attempts a 3Pt. Heavily contested by LeBron Bridges (0.7 feet, MAN)! Kyrie Wagner misses. Rebound secured by Collin Bane.

[11:19] Team_050 possession (Score: 44-44)
FOUL! Holding foul on Anthony Oladipo. [Team fouls: 1] No free throws, side out. (Anthony Oladipo: 1 personal fouls)

[11:08] Team_050 possession (Score: 44-44)
Donovan Trent drives to the basket... Donovan Trent loses the ball! Stripped by Zach Carter! TURNOVER! (live ball)

[10:54] Team_021 possession (Score: 44-44)
Kyrie Wagner drives and kicks out. Kyrie Wagner attempts a 3Pt. Contested by LeBron Bridges (3.5 feet, MAN). Kyrie Wagner misses. Rebound secured by Collin Bane.

[10:40] Team_050 possession (Score: 44-44)
LeBron Bridges drives to the basket... LeBron Bridges throws a bad pass out of bounds! TURNOVER! (dead ball)

[10:27] Team_021 possession (Score: 44-44)
Zach Carter attempts a Layup. Wide open! Donovan Trent is 8.2 feet away. [MAN] ZACH CARTER MAKES IT! Assist: Karl Bridges
Score: 46-44

[10:12] Team_050 possession (Score: 46-44)
Donovan Trent attempts a Layup. Wide open! Kyrie Wagner is 7.6 feet away. [ZONE] Donovan Trent misses. Offensive rebound by LeBron Bridges! LeBron Bridges kicks it out.

[09:56] Team_050 possession (Score: 46-44)
Donovan Trent attempts a Layup. Wide open! Zach Carter is 6.1 feet away. [MAN] DONOVAN TRENT MAKES IT!
Score: 46-46

[09:41] Team_021 possession (Score: 46-46)
Zach Carter attempts a Layup. Wide open! Donovan Trent is 7.0 feet away. [ZONE] ZACH CARTER MAKES IT! Assist: Kyrie Wagner
Score: 48-46

[09:29] Team_050 possession (Score: 48-46)
Joel Banchero attempts a 3Pt. Contested by Anthony Oladipo (3.5 feet, MAN). JOEL BANCHERO MAKES IT! Assist: Collin Bane
Score: 48-49

[09:14] Team_021 possession (Score: 48-49)
Kyrie Wagner throws a bad pass! Stolen by LeBron Bridges! TURNOVER! (live ball)

[08:56] Team_050 possession (Score: 48-49)
Giannis LaVine drives, Kyrie Leonard stays with him. Giannis LaVine attempts a Layup. Wide open! Kyrie Leonard is 7.2 feet away. [MAN] GIANNIS LAVINE MAKES IT! Assist: LeBron Bridges
Score: 48-51

[08:40] Team_021 possession (Score: 48-51)
Anthony Oladipo drives and kicks out. Kyrie Leonard attempts a Midrange. Contested by LeBron Bridges (3.1 feet, ZONE). Kyrie Leonard misses. Rebound secured by LeBron Bridges.

[08:22] Team_050 possession (Score: 48-51)
LeBron Bridges drives, picks up Zach Carter. Help arrives from Kyrie Leonard! LeBron Bridges attempts a Layup. Contested by Kyrie Leonard (3.0 feet, ZONE). LeBron Bridges misses. Rebound secured by Anthony Oladipo.

[08:11] Team_021 possession (Score: 48-51)
Anthony Oladipo attempts a 3Pt. Contested by Joel Banchero (2.7 feet, MAN). ANTHONY OLADIPO MAKES IT! Assist: Kyrie Wagner
Score: 51-51

[07:57] Team_050 possession (Score: 51-51)
Giannis LaVine makes the Layup and draws the foul on Zach Carter! And-1! Giannis LaVine to the line for 1. [Team fouls: 2] (Zach Carter: 1 personal fouls)   FT 1/1: GOOD Giannis LaVine makes 1/1 from the line.
Score: 51-54

[07:42] Team_021 possession (Score: 51-54)
Anthony Oladipo throws a bad pass out of bounds! TURNOVER! (dead ball)

[07:31] Team_050 possession (Score: 51-54)
Joel Banchero attempts a 3Pt. Wide open! Anthony Oladipo is 7.8 feet away. [MAN] Joel Banchero misses. Rebound secured by Zach Carter.

[07:19] Team_021 possession (Score: 51-54)
Karl Bridges attempts a 3Pt. Contested by Giannis LaVine (2.7 feet, ZONE). KARL BRIDGES MAKES IT! Assist: Zach Carter
Score: 54-54

[07:02] Team_050 possession (Score: 54-54)
FOUL! Reach-in foul on Zach Carter during the drive. [Team fouls: 3] No free throws, side out. (Zach Carter: 2 personal fouls)

[06:47] Team_050 possession (Score: 54-54)
Giannis LaVine drives and kicks out. LeBron Bridges attempts a 3Pt. Wide open! Kyrie Wagner is 6.3 feet away. [MAN] LeBron Bridges misses. Rebound secured by Zach Carter.

[06:31] Team_021 possession (Score: 54-54)
Kyrie Wagner drives, Donovan Trent stays with him. Kyrie Wagner attempts a Dunk. Contested by Donovan Trent (3.4 feet, ZONE). KYRIE WAGNER MAKES IT! Assist: Kyrie Leonard
Score: 56-54

[06:15] Team_050 possession (Score: 56-54)
Donovan Trent attempts a Layup. Contested by Zach Carter (2.2 feet, MAN). Donovan Trent misses. Rebound secured by Zach Carter.

[05:58] Team_021 possession (Score: 56-54)
Zach Carter loses control! Ball rolls out of bounds! TURNOVER! (dead ball)

[05:47] Team_050 possession (Score: 56-54)
FOUL! Holding foul on Zach Carter. [Team fouls: 4] No free throws, side out. (Zach Carter: 3 personal fouls)

[05:31] Team_050 possession (Score: 56-54)
Donovan Trent attempts a 3Pt. Contested by Kyrie Wagner (2.9 feet, ZONE). Donovan Trent misses. Offensive rebound by LeBron Bridges! LeBron Bridges kicks it out.

[05:17] Team_050 possession (Score: 56-54)
Collin Bane attempts a Layup. Contested by Zach Carter (2.3 feet, ZONE). COLLIN BANE MAKES IT! Assist: Giannis LaVine
Score: 56-56

[05:05] Team_021 possession (Score: 56-56)
Kyrie Leonard attempts a 3Pt. Wide open! Giannis LaVine is 6.1 feet away. [MAN] KYRIE LEONARD MAKES IT! Assist: Zach Carter
Score: 59-56

[04:47] Team_050 possession (Score: 59-56)
Donovan Trent drives and kicks out. LeBron Bridges attempts a Midrange. Contested by Karl Bridges (5.1 feet, ZONE). LeBron Bridges misses. Rebound secured by Zach Carter.

[04:28] Team_021 possession (Score: 59-56)
Anthony Oladipo drives and kicks out. Zach Carter attempts a 3Pt. Contested by Donovan Trent (3.6 feet, MAN). Zach Carter misses. Rebound secured by LeBron Bridges.

[04:13] Team_050 possession (Score: 59-56)
FOUL! Reach-in foul on Zach Carter during the drive. [IN THE BONUS! 5 team fouls] LeBron Bridges to the line for 2 free throws. (Zach Carter: 4 personal fouls)   FT 1/2: GOOD   FT 2/2: MISS LeBron Bridges makes 1/2 from the line. Rebound secured by Anthony Oladipo.
Score: 59-57

[03:58] Team_021 possession (Score: 59-57)
Karl Bridges attempts a 3Pt. Contested by Giannis LaVine (3.1 feet, ZONE). Karl Bridges misses. Rebound secured by LeBron Bridges.

[03:40] Team_050 possession (Score: 59-57)
Joel Banchero attempts a 3Pt. Contested by Kyrie Wagner (4.1 feet, ZONE). Joel Banchero misses. Rebound secured by Zach Carter.

[03:29] Team_021 possession (Score: 59-57)
Kyrie Leonard loses control! Ball rolls out of bounds! TURNOVER! (dead ball)

[03:16] Team_050 possession (Score: 59-57)
LeBron Bridges drives and kicks out. FOUL! Shooting foul on Anthony Oladipo. Donovan Trent to the line for 2 free throws. [BONUS: 6 team fouls] (Anthony Oladipo: 2 personal fouls)   FT 1/2: MISS   FT 2/2: GOOD Donovan Trent makes 1/2 from the line.
Score: 59-58

[03:00] Team_021 possession (Score: 59-58)
Karl Bridges drives, Donovan Trent stays with him. Karl Bridges attempts a Layup. Wide open! Donovan Trent is 6.3 feet away. [ZONE] KARL BRIDGES MAKES IT! Assist: Zach Carter
Score: 61-58

[02:46] Team_050 possession (Score: 61-58)
Giannis LaVine drives, picks up Kyrie Leonard. Help arrives from Anthony Oladipo! Giannis LaVine attempts a Layup. Wide open! Anthony Oladipo is 8.0 feet away. [MAN] GIANNIS LAVINE MAKES IT! Assist: Donovan Trent
Score: 61-60

[02:36] Team_021 possession (Score: 61-60)
Karl Bridges attempts a 3Pt. Contested by Collin Bane (5.5 feet, MAN). KARL BRIDGES MAKES IT! Assist: Kyrie Leonard
Score: 64-60

[02:22] Team_050 possession (Score: 64-60)
LeBron Bridges attempts a 3Pt. Wide open! Anthony Oladipo is 6.3 feet away. [ZONE] LEBRON BRIDGES MAKES IT! Assist: Donovan Trent
Score: 64-63

[02:05] Team_021 possession (Score: 64-63)
Kyrie Leonard drives, picks up Giannis LaVine. Help arrives from Collin Bane! Kyrie Leonard attempts a Dunk. Wide open! Collin Bane is 7.5 feet away. [MAN] KYRIE LEONARD MAKES IT! Assist: Karl Bridges
Score: 66-63

[01:52] Team_050 possession (Score: 66-63)
Collin Bane throws a bad pass out of bounds! TURNOVER! (dead ball)

[01:52] Substitution (Team_021): Kyrie Leonard OUT → Joel LaVine IN (stamina_rule2)

[01:52] Substitution (Team_021): Anthony Oladipo OUT → Victor Mitchell IN (stamina_rule2)

[01:52] Substitution (Team_021): Karl Bridges OUT → Paul Allen IN (stamina_rule2)

[01:52] Substitution (Team_021): Kyrie Wagner OUT → Vince George IN (stamina_rule2)

[01:52] Substitution (Team_021): Zach Carter OUT → Magic Ingram IN (stamina_rule2)

[01:52] Substitution (Team_050): Giannis LaVine OUT → Damian O'Neal IN (stamina_rule2)

[01:52] Substitution (Team_050): Joel Banchero OUT → Dwyane Towns IN (stamina_rule2)

[01:52] Substitution (Team_050): Collin Bane OUT → Larry Curry IN (stamina_rule2)

[01:52] Substitution (Team_050): LeBron Bridges OUT → Luka Gasol IN (stamina_rule2)

[01:52] Substitution (Team_050): Donovan Trent OUT → Tyler Smith IN (stamina_rule2)

[01:39] Team_021 possession (Score: 66-63)
FOUL! Shooting foul on Tyler Smith. Victor Mitchell to the line for 2 free throws. [Team fouls: 1] (Tyler Smith: 1 personal fouls)   FT 1/2: GOOD   FT 2/2: GOOD Victor Mitchell makes 2/2 from the line.
Score: 68-63

[01:21] Team_050 possession (Score: 68-63)
Larry Curry attempts a 3Pt. Contested by Victor Mitchell (4.1 feet, ZONE). Larry Curry misses. Rebound secured by Victor Mitchell.

[01:10] Team_021 possession (Score: 68-63)
Paul Allen drives to the basket... Paul Allen throws a bad pass out of bounds! TURNOVER! (dead ball)

[00:53] Team_050 possession (Score: 68-63)
Luka Gasol makes the Layup and draws the foul on Magic Ingram! And-1! Luka Gasol to the line for 1. [BONUS: 7 team fouls] (Magic Ingram: 1 personal fouls)   FT 1/1: MISS Luka Gasol makes 0/1 from the line. FOUL! Loose ball foul on Victor Mitchell during the free throw rebound! [IN THE BONUS! 8 team fouls] Larry Curry to the line for 2 free throws. (Victor Mitchell: 1 personal fouls)   FT 1/2: GOOD   FT 2/2: GOOD Larry Curry makes 2/2 from the line.
Score: 68-67

[00:34] Team_021 possession (Score: 68-67)
Victor Mitchell drives, Dwyane Towns stays with him. Victor Mitchell attempts a Dunk. Heavily contested by Dwyane Towns (1.8 feet, MAN)! Victor Mitchell misses. FOUL! Loose ball foul on Dwyane Towns during the rebound battle. [Team fouls: 2] No free throws, side out. (Dwyane Towns: 1 personal fouls)

[00:23] Team_021 possession (Score: 68-67)
FOUL! Holding foul on Larry Curry. [Team fouls: 3] No free throws, side out. (Larry Curry: 1 personal fouls)

[00:08] Team_021 possession (Score: 68-67)
Vince George attempts a 3Pt. Contested by Dwyane Towns (3.6 feet, ZONE). Vince George misses. Rebound secured by Dwyane Towns.

================================================================================
                              3RD QUARTER COMPLETE                              
================================================================================

3RD QUARTER SCORE: Team_021 24, Team_050 26

BOX SCORE:
================================================================================

Team_021
--------------------------------------------------------------------------------
Player                MIN  PTS  REB  AST  TO      FG   FG%      3P   3P%
--------------------------------------------------------------------------------
Karl Bridges           24    8    0    2   0   3/4    75.0     0/0   0.0
Kyrie Leonard          24    5    0    2   0   2/2   100.0     0/0   0.0
Zach Carter            24    4    5    3   0   2/3    66.7     0/0   0.0
Anthony Oladipo        24    3    2    0   0   1/3    33.3     0/0   0.0
Kyrie Wagner           24    2    0    2   0   1/3    33.3     0/0   0.0
Victor Mitchell        12    2    1    0   0   1/1   100.0     0/0   0.0
Magic Ingram           12    0    1    0   0   0/0     0.0     0/0   0.0
Vince George           12    0    0    0   0   0/1     0.0     0/0   0.0

TEAM: FG: 10/17 (58.8%), 3PT: 4/7 (57.1%), REB: 9 (1 off, 8 def), AST: 9, TO: 5
TEAM FOULS: 8 [Team_050 in BONUS]


Team_050
--------------------------------------------------------------------------------
Player                MIN  PTS  REB  AST  TO      FG   FG%      3P   3P%
--------------------------------------------------------------------------------
Giannis LaVine         24    7    0    1   0   3/4    75.0     0/0   0.0
Joel Banchero          24    6    0    0   0   2/4    50.0     0/0   0.0
Larry Curry            12    4    0    0   0   1/2    50.0     0/0   0.0
LeBron Bridges         24    3    5    2   0   1/3    33.3     0/0   0.0
Donovan Trent          24    3    0    2   0   2/4    50.0     0/0   0.0
Collin Bane            24    2    3    1   0   1/1   100.0     0/0   0.0
Dwyane Towns           12    0    1    0   0   0/0     0.0     0/0   0.0

TEAM: FG: 10/18 (55.6%), 3PT: 3/6 (50.0%), REB: 9 (2 off, 7 def), AST: 6, TO: 3
TEAM FOULS: 3

================================================================================

================================================================================
                       4TH QUARTER - Team_021 vs Team_050                       
================================================================================

[12:00] Team_021 possession (Score: 68-67)
Kyrie Leonard attempts a 3Pt. Wide open! Giannis LaVine is 6.5 feet away. [MAN] Kyrie Leonard misses. Rebound secured by Joel Banchero.

[11:43] Team_050 possession (Score: 68-67)
Joel Banchero attempts a 3Pt. Contested by Anthony Oladipo (2.6 feet, MAN). Joel Banchero misses. Rebound secured by Zach Carter.

[11:28] Team_021 possession (Score: 68-67)
Anthony Oladipo attempts a 3Pt. Contested by Joel Banchero (4.5 feet, MAN). Anthony Oladipo misses. Offensive rebound by Zach Carter! Zach Carter kicks it out.

[11:14] Team_021 possession (Score: 68-67)
Anthony Oladipo attempts a Midrange. Contested by Joel Banchero (2.2 feet, ZONE). Anthony Oladipo misses. Rebound secured by Collin Bane.

[11:00] Team_050 possession (Score: 68-67)
Giannis LaVine attempts a Midrange. Contested by Kyrie Wagner (5.4 feet, ZONE). Giannis LaVine misses. Rebound secured by Zach Carter.

[10:46] Team_021 possession (Score: 68-67)
Anthony Oladipo attempts a Layup. Wide open! Donovan Trent is 6.5 feet away. [ZONE] Anthony Oladipo misses. FOUL! Loose ball foul on LeBron Bridges during the rebound battle. [Team fouls: 1] No free throws, side out. (LeBron Bridges: 1 personal fouls)

[10:29] Team_021 possession (Score: 68-67)
Anthony Oladipo attempts a 3Pt. Contested by Giannis LaVine (4.6 feet, ZONE). Anthony Oladipo misses. Rebound secured by LeBron Bridges.

[10:17] Team_050 possession (Score: 68-67)
FOUL! Holding foul on Karl Bridges. [Team fouls: 1] No free throws, side out. (Karl Bridges: 1 personal fouls)

[10:06] Team_050 possession (Score: 68-67)
Collin Bane drives, picks up Zach Carter. Help arrives from Kyrie Leonard! Collin Bane attempts a Layup. Heavily contested by Kyrie Leonard (1.8 feet, ZONE)! COLLIN BANE MAKES IT! Assist: Joel Banchero
Score: 68-69

[09:48] Team_021 possession (Score: 68-69)
Kyrie Wagner attempts a 3Pt. BLOCKED BY GIANNIS LAVINE! Ball goes out off Giannis LaVine. Kyrie Wagner's ball!

[09:35] Team_021 possession (Score: 68-69)
Anthony Oladipo drives to the basket... FOUL! Offensive foul on Anthony Oladipo! Joel Banchero drew the charge! [Team fouls: 2] (Anthony Oladipo: 1 personal fouls) TURNOVER! (dead ball)

[09:23] Team_050 possession (Score: 68-69)
Joel Banchero attempts a Midrange. Contested by Karl Bridges (5.8 feet, ZONE). Joel Banchero misses. Rebound secured by Kyrie Leonard.

[09:09] Team_021 possession (Score: 68-69)
Zach Carter drives, picks up Donovan Trent. Help arrives from Joel Banchero! Zach Carter attempts a Dunk. Contested by Joel Banchero (4.6 feet, MAN). ZACH CARTER MAKES IT! Assist: Kyrie Leonard
Score: 70-69

[08:54] Team_050 possession (Score: 70-69)
Donovan Trent drives and kicks out. LeBron Bridges attempts a Midrange. Contested by Karl Bridges (3.1 feet, ZONE). LeBron Bridges misses. Rebound secured by Zach Carter.

[08:38] Team_021 possession (Score: 70-69)
Anthony Oladipo attempts a Layup. Heavily contested by Donovan Trent (2.0 feet, ZONE)! Anthony Oladipo misses. Rebound secured by Joel Banchero.

[08:26] Team_050 possession (Score: 70-69)
LeBron Bridges drives, Zach Carter stays with him. LeBron Bridges attempts a Dunk. Wide open! Zach Carter is 6.1 feet away. [ZONE] LEBRON BRIDGES MAKES IT! Assist: Joel Banchero
Score: 70-71

[08:14] Team_021 possession (Score: 70-71)
Karl Bridges attempts a 3Pt. Wide open! Collin Bane is 7.5 feet away. [MAN] Karl Bridges misses. Offensive rebound by Kyrie Leonard! Kyrie Leonard kicks it out.

[07:58] Team_021 possession (Score: 70-71)
Kyrie Wagner attempts a 3Pt. Wide open! Giannis LaVine is 6.5 feet away. [ZONE] Kyrie Wagner misses. Rebound secured by LeBron Bridges.

[07:44] Team_050 possession (Score: 70-71)
FOUL! Offensive foul on Donovan Trent! Zach Carter drew the charge! [Team fouls: 2] (Donovan Trent: 1 personal fouls) TURNOVER! (dead ball)

[07:30] Team_021 possession (Score: 70-71)
FOUL! Reach-in foul on Donovan Trent during the drive. [Team fouls: 3] No free throws, side out. (Donovan Trent: 2 personal fouls)

[07:11] Team_021 possession (Score: 70-71)
Karl Bridges attempts a 3Pt. Contested by Giannis LaVine (5.0 feet, ZONE). Karl Bridges misses. Rebound secured by Collin Bane.

[06:55] Team_050 possession (Score: 70-71)
Donovan Trent drives and kicks out. Collin Bane attempts a Midrange. Wide open! Kyrie Wagner is 6.5 feet away. [ZONE] COLLIN BANE MAKES IT!
Score: 70-73

[06:38] Team_021 possession (Score: 70-73)
Kyrie Leonard attempts a 3Pt. Contested by Giannis LaVine (2.8 feet, MAN). Kyrie Leonard misses. Rebound secured by Joel Banchero.

[06:20] Team_050 possession (Score: 70-73)
Collin Bane attempts a 3Pt. BLOCKED BY KYRIE WAGNER! Ball deflects out of bounds off Collin Bane.

[06:02] Team_021 possession (Score: 70-73)
Anthony Oladipo attempts a 3Pt. Contested by Giannis LaVine (4.6 feet, ZONE). Anthony Oladipo misses. Rebound secured by Collin Bane.

[05:46] Team_050 possession (Score: 70-73)
Donovan Trent attempts a 3Pt. Wide open! Kyrie Wagner is 6.9 feet away. [ZONE] Donovan Trent misses. Offensive rebound by Collin Bane! Collin Bane kicks it out.

[05:32] Team_050 possession (Score: 70-73)
LeBron Bridges drives to the basket... LeBron Bridges commits a violation (traveling/carry)! TURNOVER! (dead ball)

[05:32] Substitution (Team_021): Kyrie Leonard OUT → Joel LaVine IN (stamina_rule2)

[05:32] Substitution (Team_021): Anthony Oladipo OUT → Victor Mitchell IN (stamina_rule2)

[05:32] Substitution (Team_021): Karl Bridges OUT → Paul Allen IN (stamina_rule2)

[05:32] Substitution (Team_021): Kyrie Wagner OUT → Vince George IN (stamina_rule2)

[05:32] Substitution (Team_021): Zach Carter OUT → Magic Ingram IN (stamina_rule2)

[05:32] Substitution (Team_050): Giannis LaVine OUT → Damian O'Neal IN (stamina_rule2)

[05:32] Substitution (Team_050): Joel Banchero OUT → Dwyane Towns IN (stamina_rule2)

[05:32] Substitution (Team_050): Collin Bane OUT → Larry Curry IN (stamina_rule2)

[05:32] Substitution (Team_050): LeBron Bridges OUT → Luka Gasol IN (stamina_rule2)

[05:32] Substitution (Team_050): Donovan Trent OUT → Tyler Smith IN (stamina_rule2)

[05:17] Team_021 possession (Score: 70-73)
Paul Allen drives and kicks out. Victor Mitchell attempts a Midrange. Heavily contested by Dwyane Towns (1.8 feet, MAN)! Victor Mitchell misses. Rebound secured by Larry Curry.

[05:01] Team_050 possession (Score: 70-73)
Luka Gasol drives to the basket... Luka Gasol commits a violation (traveling/carry)! TURNOVER! (dead ball)

[04:46] Team_021 possession (Score: 70-73)
Victor Mitchell drives and kicks out. Vince George attempts a 3Pt. Heavily contested by Luka Gasol (1.7 feet, ZONE)! Vince George misses. Offensive rebound by Magic Ingram! Magic Ingram kicks it out.

[04:30] Team_021 possession (Score: 70-73)
Joel LaVine attempts a 3Pt. Wide open! Damian O'Neal is 8.1 feet away. [MAN] JOEL LAVINE MAKES IT! Assist: Magic Ingram
Score: 73-73

[04:17] Team_050 possession (Score: 73-73)
Tyler Smith makes the Layup and draws the foul on Magic Ingram! And-1! Tyler Smith to the line for 1. [Team fouls: 3] (Magic Ingram: 1 personal fouls)   FT 1/1: GOOD Tyler Smith makes 1/1 from the line.
Score: 73-76

[04:02] Team_021 possession (Score: 73-76)
Magic Ingram loses control! Ball rolls out of bounds! TURNOVER! (dead ball)

[03:46] Team_050 possession (Score: 73-76)
Dwyane Towns drives, Magic Ingram stays with him. Dwyane Towns attempts a Dunk. Contested by Magic Ingram (5.5 feet, ZONE). DWYANE TOWNS MAKES IT! Assist: Tyler Smith
Score: 73-78

[03:30] Team_021 possession (Score: 73-78)
Joel LaVine attempts a Layup. Contested by Tyler Smith (2.2 feet, ZONE). Joel LaVine misses. Offensive rebound by Magic Ingram! Magic Ingram kicks it out.

[03:12] Team_021 possession (Score: 73-78)
Magic Ingram attempts a Midrange. Heavily contested by Tyler Smith (1.1 feet, MAN)! MAGIC INGRAM MAKES IT!
Score: 75-78

[02:52] Team_050 possession (Score: 75-78)
Dwyane Towns attempts a Midrange. Contested by Victor Mitchell (3.9 feet, MAN). DWYANE TOWNS MAKES IT!
Score: 75-80

[02:38] Team_021 possession (Score: 75-80)
Paul Allen attempts a 3Pt. Heavily contested by Larry Curry (0.5 feet, MAN)! PAUL ALLEN MAKES IT! Assist: Victor Mitchell
Score: 78-80

[02:23] Team_050 possession (Score: 78-80)
Luka Gasol attempts a 3Pt. Contested by Vince George (5.0 feet, MAN). Luka Gasol misses. Offensive rebound by Tyler Smith! Tyler Smith kicks it out.

[02:10] Team_050 possession (Score: 78-80)
Tyler Smith attempts a Midrange. Contested by Victor Mitchell (5.8 feet, ZONE). TYLER SMITH MAKES IT!
Score: 78-82

[01:52] Team_021 possession (Score: 78-82)
Joel LaVine attempts a Layup. Wide open! Tyler Smith is 6.1 feet away. [ZONE] JOEL LAVINE MAKES IT!
Score: 80-82

[01:38] Team_050 possession (Score: 80-82)
Luka Gasol attempts a 3Pt. Heavily contested by Victor Mitchell (1.3 feet, ZONE)! Luka Gasol misses. Rebound secured by Magic Ingram.

[01:21] Team_021 possession (Score: 80-82)
Victor Mitchell throws a bad pass! Stolen by Dwyane Towns! TURNOVER! (live ball)

[01:05] Team_050 possession (Score: 80-82)
Damian O'Neal attempts a Layup. Wide open! Vince George is 7.4 feet away. [ZONE] DAMIAN O'NEAL MAKES IT!
Score: 80-84

[00:51] Team_021 possession (Score: 80-84)
Victor Mitchell attempts a 3Pt. Wide open! Dwyane Towns is 6.0 feet away. [MAN] VICTOR MITCHELL MAKES IT! Assist: Magic Ingram
Score: 83-84

[00:34] Team_050 possession (Score: 83-84)
Damian O'Neal attempts a 3Pt. Wide open! Joel LaVine is 8.4 feet away. [ZONE] DAMIAN O'NEAL MAKES IT! Assist: Larry Curry
Score: 83-87

[00:19] Team_021 possession (Score: 83-87)
Victor Mitchell attempts a 3Pt. Contested by Dwyane Towns (3.7 feet, MAN). Victor Mitchell misses. Rebound secured by Tyler Smith.

[00:03] Team_050 possession (Score: 83-87)
Damian O'Neal throws a bad pass out of bounds! TURNOVER! (dead ball)

================================================================================
                              4TH QUARTER COMPLETE                              
================================================================================

4TH QUARTER SCORE: Team_021 15, Team_050 20

BOX SCORE:
================================================================================

Team_021
--------------------------------------------------------------------------------
Player                MIN  PTS  REB  AST  TO      FG   FG%      3P   3P%
--------------------------------------------------------------------------------
Joel LaVine            17    5    0    0   0   2/2   100.0     0/0   0.0
Paul Allen             17    3    0    0   0   1/2    50.0     0/0   0.0
Victor Mitchell        17    3    0    1   0   1/2    50.0     0/0   0.0
Zach Carter            31    2    5    0   0   1/1   100.0     0/0   0.0
Magic Ingram           17    2    3    2   0   1/1   100.0     0/0   0.0
Kyrie Leonard          31    0    2    1   0   0/2     0.0     0/0   0.0
Anthony Oladipo        31    0    0    0   0   0/4     0.0     0/0   0.0
Kyrie Wagner           31    0    0    0   0   0/1     0.0     0/0   0.0
Karl Bridges           31    0    0    0   0   0/1     0.0     0/0   0.0

TEAM: FG: 6/16 (37.5%), 3PT: 3/10 (30.0%), REB: 10 (5 off, 5 def), AST: 4, TO: 3
TEAM FOULS: 3


Team_050
--------------------------------------------------------------------------------
Player                MIN  PTS  REB  AST  TO      FG   FG%      3P   3P%
--------------------------------------------------------------------------------
Tyler Smith            17    5    2    1   0   2/2   100.0     0/0   0.0
Damian O'Neal          17    5    0    0   0   2/2   100.0     0/0   0.0
Collin Bane            31    4    4    0   0   2/3    66.7     0/0   0.0
Dwyane Towns           17    4    0    0   0   2/2   100.0     0/0   0.0
LeBron Bridges         31    2    2    0   0   1/1   100.0     0/0   0.0
Joel Banchero          31    0    3    2   0   0/2     0.0     0/0   0.0
Giannis LaVine         31    0    0    0   0   0/1     0.0     0/0   0.0
Donovan Trent          31    0    0    0   0   0/1     0.0     0/0   0.0
Larry Curry            17    0    1    1   0   0/0     0.0     0/0   0.0
Luka Gasol             17    0    0    0   0   0/1     0.0     0/0   0.0

TEAM: FG: 9/15 (60.0%), 3PT: 1/4 (25.0%), REB: 12 (2 off, 10 def), AST: 4, TO: 4
TEAM FOULS: 3

================================================================================

================================================================================
                               FULL GAME COMPLETE                               
================================================================================

FINAL SCORE: Team_021 83, Team_050 87

SCORING BY QUARTER:
--------------------------------------------------------------------------------
Team                     Q1     Q2     Q3     Q4    FINAL
--------------------------------------------------------------------------------
Team_021                 19     25     24     15       83
Team_050                 23     18     26     20       87
--------------------------------------------------------------------------------

FULL GAME BOX SCORE:
================================================================================

Team_021
--------------------------------------------------------------------------------
Player                MIN  PTS  REB  AST  TO      FG   FG%      3P   3P%      FT STL BLK
--------------------------------------------------------------------------------
Kyrie Leonard          31   21    7    3   1   8/12   66.7   3/5    60.0   2/2     0   0
Anthony Oladipo        31    3    2    0   2   1/9    11.1   1/5    20.0   0/0     0   0
Karl Bridges           31   11    0    4   1   4/8    50.0   3/6    50.0   0/0     0   0
Kyrie Wagner           31    2    0    3   4   1/7    14.3   0/3     0.0   0/0     1   1
Zach Carter            31   11   12    5   1   5/8    62.5   1/2    50.0   0/0     2   0
Joel LaVine            17   13    0    1   0   6/10   60.0   1/3    33.3   1/2     0   0
Victor Mitchell        17    7    5    1   1   3/5    60.0   1/2    50.0   2/2     0   0
Paul Allen             17    7    0    0   1   3/4    75.0   1/1   100.0   2/2     1   1
Vince George           17    0    2    3   3   0/3     0.0   0/1     0.0   0/0     0   0
Magic Ingram           17    7   10    3   2   3/4    75.0   0/0     0.0   3/3     0   0

TEAM: FG: 34/70 (48.6%), 3PT: 11/28 (39.3%), REB: 38 (7 off, 31 def), AST: 23, TO: 16


Team_050
--------------------------------------------------------------------------------
Player                MIN  PTS  REB  AST  TO      FG   FG%      3P   3P%      FT STL BLK
--------------------------------------------------------------------------------
Giannis LaVine         31   10    0    3   0   4/9    44.4   0/1     0.0   2/3     0   1
Joel Banchero          31   19    5    5   3   8/15   53.3   5/10   50.0   0/0     0   0
Collin Bane            31   11   12    2   4   3/4    75.0   0/1     0.0   0/0     0   0
LeBron Bridges         31    9   13    3   1   5/7    71.4   1/1   100.0   1/2     2   0
Donovan Trent          31    5    0    4   3   4/7    57.1   0/0     0.0   1/2     0   0
Damian O'Neal          17    7    0    1   1   3/7    42.9   1/2    50.0   0/0     0   0
Dwyane Towns           17    9    3    0   0   4/7    57.1   1/3    33.3   0/0     1   0
Larry Curry            17    7    3    1   1   1/5    20.0   1/5    20.0   0/0     0   0
Luka Gasol             17    0    0    2   1   1/3    33.3   0/1     0.0   0/1     1   0
Tyler Smith            17    9    7    1   0   4/5    80.0   0/0     0.0   3/3     0   1

TEAM: FG: 37/69 (53.6%), 3PT: 9/24 (37.5%), REB: 43 (8 off, 35 def), AST: 22, TO: 14

================================================================================
