================================================================================
                        FULL GAME - Team_051 vs Team_040                        
================================================================================

================================================================================
                       1ST QUARTER - Team_051 vs Team_040                       
================================================================================

[12:00] Team_051 possession (Score: 0-0)
Austin Sexton attempts a Midrange. Contested by Ayo Rose (3.3 feet, MAN). Austin Sexton misses. Offensive rebound by Franz Simmons! Franz Simmons kicks it out.

[11:49] Team_051 possession (Score: 0-0)
Larry McGrady attempts a 3Pt. Contested by Ayo Rose (4.9 feet, ZONE). LARRY MCGRADY MAKES IT! Assist: OG Siakam
Score: 3-0

[11:34] Team_040 possession (Score: 3-0)
Shaquille Bane throws a bad pass! Stolen by Larry McGrady! TURNOVER! (live ball)

[11:21] Team_051 possession (Score: 3-0)
Austin Sexton attempts a Midrange. Contested by Ayo Rose (5.2 feet, MAN). AUSTIN SEXTON MAKES IT! Assist: Larry McGrady
Score: 5-0

[11:05] Team_040 possession (Score: 5-0)
Dirk Johnson attempts a Midrange. Contested by Larry McGrady (4.0 feet, ZONE). Dirk Johnson misses. Rebound secured by OG Siakam.

[10:52] Team_051 possession (Score: 5-0)
Larry McGrady attempts a 3Pt. Contested by Shaquille Bane (2.5 feet, MAN). Larry McGrady misses. Rebound secured by Bam Gobert.

[10:39] Team_040 possession (Score: 5-0)
FOUL! Holding foul on OG Siakam. [Team fouls: 1] No free throws, side out. (OG Siakam: 1 personal fouls)

[10:21] Team_040 possession (Score: 5-0)
Dirk Johnson attempts a 3Pt. Contested by Austin Sexton (3.2 feet, ZONE). Dirk Johnson misses. Offensive rebound by Bam Gobert! Bam Gobert kicks it out.

[10:04] Team_040 possession (Score: 5-0)
FOUL! Reach-in foul on Franz Simmons during the drive. [Team fouls: 2] No free throws, side out. (Franz Simmons: 1 personal fouls)

[09:50] Team_040 possession (Score: 5-0)
Shaquille Bane drives to the basket... Shaquille Bane loses control! Ball rolls out of bounds! TURNOVER! (dead ball)

[09:37] Team_051 possession (Score: 5-0)
OG Siakam attempts a 3Pt. Wide open! Carmelo Murray is 6.0 feet away. [MAN] OG Siakam misses. Rebound secured by Shaquille Bane.

[09:23] Team_040 possession (Score: 5-0)
Bam Gobert makes the Dunk and draws the foul on Shaquille Harden! And-1! Bam Gobert to the line for 1. [Team fouls: 3] (Shaquille Harden: 1 personal fouls)   FT 1/1: GOOD Bam Gobert makes 1/1 from the line.
Score: 5-3

[09:07] Team_051 possession (Score: 5-3)
Franz Simmons attempts a Layup. Heavily contested by Bam Gobert (1.9 feet, ZONE)! FRANZ SIMMONS MAKES IT! Assist: Larry McGrady
Score: 7-3

[08:51] Team_040 possession (Score: 7-3)
Ayo Rose drives, picks up Austin Sexton. Help arrives from OG Siakam! Ayo Rose attempts a Layup. Contested by OG Siakam (4.5 feet, MAN). AYO ROSE MAKES IT!
Score: 7-5

[08:38] Team_051 possession (Score: 7-5)
Franz Simmons drives, Dirk Johnson stays with him. Franz Simmons attempts a Dunk. Wide open! Dirk Johnson is 6.1 feet away. [MAN] FRANZ SIMMONS MAKES IT! Assist: Austin Sexton
Score: 9-5

[08:23] Team_040 possession (Score: 9-5)
Ayo Rose attempts a 3Pt. Wide open! Austin Sexton is 9.2 feet away. [MAN] Ayo Rose misses. Rebound secured by OG Siakam.

[08:12] Team_051 possession (Score: 9-5)
Shaquille Harden attempts a Layup. BLOCKED BY BAM GOBERT! Ball deflects out of bounds off Shaquille Harden.

[07:58] Team_040 possession (Score: 9-5)
Carmelo Murray attempts a 3Pt. Contested by OG Siakam (4.7 feet, MAN). Carmelo Murray misses. Rebound secured by Shaquille Harden.

[07:44] Team_051 possession (Score: 9-5)
OG Siakam attempts a Midrange. Contested by Shaquille Bane (5.3 feet, ZONE). OG Siakam misses. Rebound secured by Shaquille Bane.

[07:31] Team_040 possession (Score: 9-5)
Dirk Johnson attempts a 3Pt. BLOCKED BY AUSTIN SEXTON! Ball is loose! Rebound secured by Shaquille Harden.

[07:17] Team_051 possession (Score: 9-5)
OG Siakam attempts a Midrange. Heavily contested by Carmelo Murray (1.1 feet, MAN)! OG Siakam misses. Rebound secured by Bam Gobert.

[06:59] Team_040 possession (Score: 9-5)
Carmelo Murray drives, OG Siakam stays with him. Carmelo Murray attempts a Layup. Contested by OG Siakam (3.3 feet, MAN). CARMELO MURRAY MAKES IT!
Score: 9-7

[06:45] Team_051 possession (Score: 9-7)
FOUL! Holding foul on Ayo Rose. [Team fouls: 1] No free throws, side out. (Ayo Rose: 1 personal fouls)

[06:31] Team_051 possession (Score: 9-7)
Austin Sexton attempts a Midrange. Contested by Shaquille Bane (5.7 feet, ZONE). Austin Sexton misses. Rebound secured by Dirk Johnson.

[06:18] Team_040 possession (Score: 9-7)
Shaquille Bane attempts a 3Pt. Contested by Larry McGrady (5.9 feet, MAN). Shaquille Bane misses. Rebound secured by Shaquille Harden.

[06:02] Team_051 possession (Score: 9-7)
FOUL! Shooting foul on Shaquille Bane. Larry McGrady to the line for 2 free throws. [Team fouls: 2] (Shaquille Bane: 1 personal fouls)   FT 1/2: GOOD   FT 2/2: GOOD Larry McGrady makes 2/2 from the line.
Score: 11-7

[05:47] Team_040 possession (Score: 11-7)
Carmelo Murray attempts a Layup. Wide open! Franz Simmons is 7.0 feet away. [ZONE] Carmelo Murray misses. Rebound secured by Shaquille Harden.

[05:37] Team_051 possession (Score: 11-7)
OG Siakam attempts a 3Pt. Contested by Carmelo Murray (4.7 feet, MAN). OG Siakam misses. Offensive rebound by Shaquille Harden! Shaquille Harden's putback is no good. Rebound secured by Bam Gobert.

[05:27] Team_040 possession (Score: 11-7)
Ayo Rose attempts a 3Pt. Contested by Austin Sexton (5.0 feet, MAN). Ayo Rose misses. Rebound secured by Shaquille Harden.

[05:11] Team_051 possession (Score: 11-7)
Larry McGrady attempts a Midrange. Contested by Shaquille Bane (3.4 feet, MAN). Larry McGrady misses. Rebound secured by Dirk Johnson.

[04:58] Team_040 possession (Score: 11-7)
Bam Gobert drives to the basket... Bam Gobert throws a bad pass out of bounds! TURNOVER! (dead ball)

[04:48] Team_051 possession (Score: 11-7)
Shaquille Harden drives, Bam Gobert stays with him. Shaquille Harden attempts a Layup. Contested by Bam Gobert (2.8 feet, MAN). SHAQUILLE HARDEN MAKES IT!
Score: 13-7

[04:31] Team_040 possession (Score: 13-7)
Ayo Rose drives and kicks out. Carmelo Murray attempts a 3Pt. Contested by OG Siakam (3.9 feet, ZONE). Carmelo Murray misses. Rebound secured by Franz Simmons.

[04:17] Team_051 possession (Score: 13-7)
Austin Sexton attempts a 3Pt. Contested by Ayo Rose (5.6 feet, ZONE). AUSTIN SEXTON MAKES IT! Assist: Shaquille Harden
Score: 16-7

[04:03] Team_040 possession (Score: 16-7)
Shaquille Bane loses the ball! Stripped by Larry McGrady! TURNOVER! (live ball)

[03:47] Team_051 possession (Score: 16-7)
Larry McGrady attempts a Midrange. Wide open! Shaquille Bane is 7.8 feet away. [MAN] Larry McGrady misses. Rebound secured by Shaquille Bane.

[03:37] Team_040 possession (Score: 16-7)
Ayo Rose attempts a 3Pt. Contested by Austin Sexton (3.3 feet, ZONE). Ayo Rose misses. Rebound secured by Shaquille Harden.

[03:25] Team_051 possession (Score: 16-7)
Franz Simmons attempts a Layup. Contested by Bam Gobert (3.1 feet, ZONE). FRANZ SIMMONS MAKES IT! Assist: OG Siakam
Score: 18-7

[03:12] Team_040 possession (Score: 18-7)
Carmelo Murray attempts a Midrange. Contested by OG Siakam (3.4 feet, MAN). Carmelo Murray misses. Rebound secured by OG Siakam.

[03:01] Team_051 possession (Score: 18-7)
Franz Simmons drives, picks up Dirk Johnson. Help arrives from Shaquille Bane! Franz Simmons attempts a Dunk. Wide open! Shaquille Bane is 7.9 feet away. [MAN] FRANZ SIMMONS MAKES IT! Assist: OG Siakam
Score: 20-7

[02:47] Team_040 possession (Score: 20-7)
Dirk Johnson attempts a 3Pt. Contested by Austin Sexton (4.1 feet, ZONE). DIRK JOHNSON MAKES IT! Assist: Ayo Rose
Score: 20-10

[02:34] Team_051 possession (Score: 20-10)
Austin Sexton drives, Bam Gobert stays with him. Austin Sexton attempts a Layup. Wide open! Bam Gobert is 8.8 feet away. [ZONE] Austin Sexton misses. Rebound secured by Dirk Johnson.

[02:18] Team_040 possession (Score: 20-10)
Bam Gobert attempts a Layup. Wide open! Franz Simmons is 8.5 feet away. [ZONE] BAM GOBERT MAKES IT! Assist: Dirk Johnson
Score: 20-12

[02:05] Team_051 possession (Score: 20-12)
Austin Sexton drives to the basket... Austin Sexton loses control! Ball rolls out of bounds! TURNOVER! (dead ball)

[02:05] Substitution (Team_051): Austin Sexton OUT → Myles Harden IN (stamina_rule2)

[02:05] Substitution (Team_051): Larry McGrady OUT → Zion Morant IN (stamina_rule2)

[02:05] Substitution (Team_051): OG Siakam OUT → Jrue Carter IN (stamina_rule2)

[02:05] Substitution (Team_051): Franz Simmons OUT → Tobias Jokic IN (stamina_rule2)

[02:05] Substitution (Team_051): Shaquille Harden OUT → Pau Tatum IN (stamina_rule2)

[02:05] Substitution (Team_040): Ayo Rose OUT → Cole O'Neal IN (stamina_rule2)

[02:05] Substitution (Team_040): Shaquille Bane OUT → Tracy Middleton IN (stamina_rule2)

[02:05] Substitution (Team_040): Carmelo Murray OUT → Klay Leonard IN (stamina_rule2)

[02:05] Substitution (Team_040): Dirk Johnson OUT → RJ Curry IN (stamina_rule2)

[02:05] Substitution (Team_040): Bam Gobert OUT → Josh Banchero IN (stamina_rule2)

[01:51] Team_040 possession (Score: 20-12)
Klay Leonard attempts a 3Pt. Wide open! Tobias Jokic is 6.1 feet away. [ZONE] Klay Leonard misses. Offensive rebound by RJ Curry! RJ Curry kicks it out.

[01:38] Team_040 possession (Score: 20-12)
Cole O'Neal attempts a Layup. Contested by Pau Tatum (3.8 feet, ZONE). Cole O'Neal misses. Rebound secured by Tobias Jokic.

[01:21] Team_051 possession (Score: 20-12)
Tobias Jokic attempts a 3Pt. Contested by RJ Curry (4.6 feet, MAN). Tobias Jokic misses. Offensive rebound by Tobias Jokic! Tobias Jokic kicks it out.

[01:12] Team_051 possession (Score: 20-12)
Myles Harden attempts a 3Pt. Wide open! Cole O'Neal is 10.0 feet away. [MAN] MYLES HARDEN MAKES IT!
Score: 23-12

[00:59] Team_040 possession (Score: 23-12)
Tracy Middleton attempts a Midrange. Wide open! Tobias Jokic is 6.3 feet away. [ZONE] TRACY MIDDLETON MAKES IT! Assist: RJ Curry
Score: 23-14

[00:44] Team_051 possession (Score: 23-14)
Jrue Carter attempts a 3Pt. Contested by RJ Curry (4.7 feet, ZONE). JRUE CARTER MAKES IT! Assist: Myles Harden
Score: 26-14

[00:28] Team_040 possession (Score: 26-14)
Cole O'Neal attempts a Layup. Contested by Pau Tatum (3.3 feet, ZONE). Cole O'Neal misses. Rebound secured by Tobias Jokic.

[00:16] Team_051 possession (Score: 26-14)
Jrue Carter attempts a 3Pt. Wide open! Cole O'Neal is 6.5 feet away. [ZONE] Jrue Carter misses. Offensive rebound by Pau Tatum! Pau Tatum's putback is no good. Rebound secured by RJ Curry.

[00:05] Team_040 possession (Score: 26-14)
Cole O'Neal makes the Layup and draws the foul on Myles Harden! And-1! Cole O'Neal to the line for 1. [Team fouls: 4] (Myles Harden: 1 personal fouls)   FT 1/1: GOOD Cole O'Neal makes 1/1 from the line.
Score: 26-17

================================================================================
                              1ST QUARTER COMPLETE                              
================================================================================

1ST QUARTER SCORE: Team_051 26, Team_040 17

BOX SCORE:
================================================================================

Team_051
--------------------------------------------------------------------------------
Player                MIN  PTS  REB  AST  TO      FG   FG%      3P   3P%
--------------------------------------------------------------------------------
Franz Simmons          10    8    2    0   0   4/4   100.0     0/0   0.0
Larry McGrady          10    5    0    2   0   2/5    40.0     0/0   0.0
Austin Sexton          10    5    0    1   0   2/4    50.0     0/0   0.0
Myles Harden            2    3    0    1   0   1/1   100.0     0/0   0.0
Jrue Carter             2    3    0    0   0   1/2    50.0     0/0   0.0
Shaquille Harden       10    2    6    1   0   1/2    50.0     0/0   0.0
OG Siakam              10    0    3    3   0   0/4     0.0     0/0   0.0
RJ Curry                2    0    2    1   0   0/0     0.0     0/0   0.0
Tobias Jokic            2    0    3    0   0   0/0     0.0     0/0   0.0

TEAM: FG: 11/22 (50.0%), 3PT: 4/8 (50.0%), REB: 16 (4 off, 12 def), AST: 8, TO: 1
TEAM FOULS: 4


Team_040
--------------------------------------------------------------------------------
Player                MIN  PTS  REB  AST  TO      FG   FG%      3P   3P%
--------------------------------------------------------------------------------
Bam Gobert             10    5    4    0   0   2/2   100.0     0/0   0.0
Dirk Johnson           10    3    3    1   0   1/3    33.3     0/0   0.0
Cole O'Neal             2    3    0    0   0   1/3    33.3     0/0   0.0
Ayo Rose               10    2    0    1   0   1/5    20.0     0/0   0.0
Carmelo Murray         10    2    0    0   0   1/4    25.0     0/0   0.0
Tracy Middleton         2    2    0    0   0   1/1   100.0     0/0   0.0
Shaquille Bane         10    0    3    0   0   0/1     0.0     0/0   0.0

TEAM: FG: 7/19 (36.8%), 3PT: 1/7 (14.3%), REB: 10 (2 off, 8 def), AST: 3, TO: 4
TEAM FOULS: 2

================================================================================

================================================================================
                       2ND QUARTER - Team_051 vs Team_040                       
================================================================================

[12:00] Team_051 possession (Score: 26-17)
Shaquille Harden drives and kicks out. Austin Sexton attempts a 3Pt. Contested by Ayo Rose (4.3 feet, MAN). AUSTIN SEXTON MAKES IT! Assist: Franz Simmons
Score: 29-17

[11:43] Team_040 possession (Score: 29-17)
Ayo Rose attempts a Midrange. Contested by OG Siakam (4.1 feet, ZONE). AYO ROSE MAKES IT!
Score: 29-19

[11:29] Team_051 possession (Score: 29-19)
Austin Sexton drives, picks up Ayo Rose. Help arrives from Shaquille Bane! Austin Sexton attempts a Dunk. Contested by Shaquille Bane (5.1 feet, MAN). AUSTIN SEXTON MAKES IT!
Score: 31-19

[11:14] Team_040 possession (Score: 31-19)
Dirk Johnson attempts a Midrange. Wide open! Franz Simmons is 6.4 feet away. [MAN] Dirk Johnson misses. Rebound secured by Franz Simmons.

[10:58] Team_051 possession (Score: 31-19)
Larry McGrady attempts a 3Pt. Wide open! Shaquille Bane is 6.9 feet away. [MAN] Larry McGrady misses. Offensive rebound by Shaquille Harden! Shaquille Harden's putback is no good. Rebound secured by Bam Gobert.

[10:42] Team_040 possession (Score: 31-19)
Carmelo Murray attempts a 3Pt. Contested by OG Siakam (5.0 feet, MAN). Carmelo Murray misses. Rebound secured by OG Siakam.

[10:25] Team_051 possession (Score: 31-19)
Larry McGrady attempts a 3Pt. Contested by Shaquille Bane (3.5 feet, MAN). Larry McGrady misses. Offensive rebound by Franz Simmons! Franz Simmons kicks it out.

[10:15] Team_051 possession (Score: 31-19)
Larry McGrady attempts a 3Pt. Contested by Ayo Rose (2.6 feet, ZONE). Larry McGrady misses. Rebound secured by Shaquille Bane.

[10:01] Team_040 possession (Score: 31-19)
Shaquille Bane drives to the basket... FOUL! Offensive foul on Shaquille Bane! Larry McGrady drew the charge! [Team fouls: 1] (Shaquille Bane: 1 personal fouls) TURNOVER! (dead ball)

[09:45] Team_051 possession (Score: 31-19)
Shaquille Harden attempts a Midrange. Wide open! Shaquille Bane is 6.8 feet away. [ZONE] SHAQUILLE HARDEN MAKES IT! Assist: Larry McGrady
Score: 33-19

[09:27] Team_040 possession (Score: 33-19)
Bam Gobert drives, Shaquille Harden stays with him. Bam Gobert attempts a Dunk. Wide open! Shaquille Harden is 6.0 feet away. [MAN] BAM GOBERT MAKES IT! Assist: Dirk Johnson
Score: 33-21

[09:11] Team_051 possession (Score: 33-21)
FOUL! Reach-in foul on Bam Gobert during the drive. [Team fouls: 2] No free throws, side out. (Bam Gobert: 1 personal fouls)

[08:55] Team_051 possession (Score: 33-21)
OG Siakam attempts a Layup. Contested by Carmelo Murray (4.6 feet, MAN). OG Siakam misses. Rebound secured by Dirk Johnson.

[08:40] Team_040 possession (Score: 33-21)
FOUL! Reach-in foul on Franz Simmons during the drive. [Team fouls: 1] No free throws, side out. (Franz Simmons: 1 personal fouls)

[08:27] Team_040 possession (Score: 33-21)
Shaquille Bane drives to the basket... Shaquille Bane throws a bad pass! Stolen by Franz Simmons! TURNOVER! (live ball)

[08:12] Team_051 possession (Score: 33-21)
Larry McGrady commits a violation (traveling/carry)! TURNOVER! (dead ball)

[08:12] Substitution (Team_051): Austin Sexton OUT → Myles Harden IN (stamina_rule2)

[08:12] Substitution (Team_051): Larry McGrady OUT → Zion Morant IN (stamina_rule2)

[08:12] Substitution (Team_051): OG Siakam OUT → Jrue Carter IN (stamina_rule2)

[08:12] Substitution (Team_051): Franz Simmons OUT → Tobias Jokic IN (stamina_rule2)

[08:12] Substitution (Team_051): Shaquille Harden OUT → Pau Tatum IN (stamina_rule2)

[08:12] Substitution (Team_040): Ayo Rose OUT → Cole O'Neal IN (stamina_rule2)

[08:12] Substitution (Team_040): Shaquille Bane OUT → Tracy Middleton IN (stamina_rule2)

[08:12] Substitution (Team_040): Carmelo Murray OUT → Klay Leonard IN (stamina_rule2)

[08:12] Substitution (Team_040): Dirk Johnson OUT → RJ Curry IN (stamina_rule2)

[08:12] Substitution (Team_040): Bam Gobert OUT → Josh Banchero IN (stamina_rule2)

[07:57] Team_040 possession (Score: 33-21)
Klay Leonard attempts a 3Pt. Contested by Jrue Carter (3.7 feet, MAN). Klay Leonard misses. Rebound secured by Tobias Jokic.

[07:43] Team_051 possession (Score: 33-21)
FOUL! Reach-in foul on Josh Banchero during the drive. [Team fouls: 3] No free throws, side out. (Josh Banchero: 1 personal fouls)

[07:29] Team_051 possession (Score: 33-21)
Myles Harden attempts a 3Pt. Wide open! Cole O'Neal is 6.2 feet away. [MAN] Myles Harden misses. Offensive rebound by Tobias Jokic! Tobias Jokic kicks it out.

[07:16] Team_051 possession (Score: 33-21)
Myles Harden attempts a Midrange. Wide open! Cole O'Neal is 9.1 feet away. [MAN] Myles Harden misses. Rebound secured by Josh Banchero.

[07:01] Team_040 possession (Score: 33-21)
Cole O'Neal attempts a 3Pt. Contested by Myles Harden (5.7 feet, ZONE). Cole O'Neal misses. Rebound secured by Myles Harden.

[06:44] Team_051 possession (Score: 33-21)
FOUL! Shooting foul on RJ Curry. Tobias Jokic to the line for 2 free throws. [Team fouls: 4] (RJ Curry: 1 personal fouls)   FT 1/2: GOOD   FT 2/2: GOOD Tobias Jokic makes 2/2 from the line.
Score: 35-21

[06:28] Team_040 possession (Score: 35-21)
RJ Curry makes the Layup and draws the foul on Pau Tatum! And-1! RJ Curry to the line for 1. [Team fouls: 2] (Pau Tatum: 1 personal fouls)   FT 1/1: GOOD RJ Curry makes 1/1 from the line.
Score: 35-24

[06:13] Team_051 possession (Score: 35-24)
Jrue Carter attempts a 3Pt. Contested by RJ Curry (3.7 feet, ZONE). Jrue Carter misses. Rebound secured by RJ Curry.

[06:00] Team_040 possession (Score: 35-24)
Josh Banchero drives and kicks out. Josh Banchero attempts a 3Pt. Contested by Pau Tatum (4.0 feet, MAN). JOSH BANCHERO MAKES IT! Assist: Klay Leonard
Score: 35-27

[05:44] Team_051 possession (Score: 35-27)
Myles Harden attempts a Layup. Wide open! Josh Banchero is 8.8 feet away. [ZONE] MYLES HARDEN MAKES IT! Assist: Pau Tatum
Score: 37-27

[05:29] Team_040 possession (Score: 37-27)
Josh Banchero drives, Pau Tatum stays with him. Josh Banchero attempts a Layup. Contested by Pau Tatum (5.1 feet, MAN). Josh Banchero misses. Offensive rebound by Josh Banchero! Josh Banchero kicks it out.

[05:14] Team_040 possession (Score: 37-27)
Klay Leonard attempts a Midrange. Contested by Jrue Carter (5.7 feet, MAN). KLAY LEONARD MAKES IT! Assist: Cole O'Neal
Score: 37-29

[05:01] Team_051 possession (Score: 37-29)
Pau Tatum makes the Dunk and draws the foul on Josh Banchero! And-1! Pau Tatum to the line for 1. [BONUS: 5 team fouls] (Josh Banchero: 2 personal fouls)   FT 1/1: MISS Pau Tatum makes 0/1 from the line. Rebound secured by RJ Curry.
Score: 39-29

[04:47] Team_040 possession (Score: 39-29)
Josh Banchero attempts a Layup. Contested by Pau Tatum (2.1 feet, ZONE). JOSH BANCHERO MAKES IT! Assist: RJ Curry
Score: 39-31

[04:34] Team_051 possession (Score: 39-31)
Jrue Carter drives, picks up Josh Banchero. Help arrives from Tracy Middleton! Jrue Carter attempts a Layup. Wide open! Tracy Middleton is 7.3 feet away. [ZONE] JRUE CARTER MAKES IT! Assist: Myles Harden
Score: 41-31

[04:19] Team_040 possession (Score: 41-31)
Klay Leonard makes the Dunk and draws the foul on Myles Harden! And-1! Klay Leonard to the line for 1. [Team fouls: 3] (Myles Harden: 1 personal fouls)   FT 1/1: GOOD Klay Leonard makes 1/1 from the line.
Score: 41-34

[04:06] Team_051 possession (Score: 41-34)
Myles Harden attempts a 3Pt. Heavily contested by RJ Curry (0.5 feet, ZONE)! Myles Harden misses. Offensive rebound by Pau Tatum! Pau Tatum puts it back in!
Score: 43-34

[03:51] Team_040 possession (Score: 43-34)
RJ Curry commits a violation (traveling/carry)! TURNOVER! (dead ball)

[03:37] Team_051 possession (Score: 43-34)
Pau Tatum drives to the basket... Pau Tatum throws a bad pass! Stolen by Josh Banchero! TURNOVER! (live ball)

[03:24] Team_040 possession (Score: 43-34)
Klay Leonard drives, Tobias Jokic stays with him. Klay Leonard attempts a Layup. Contested by Tobias Jokic (5.3 feet, ZONE). KLAY LEONARD MAKES IT! Assist: Tracy Middleton
Score: 43-36

[03:13] Team_051 possession (Score: 43-36)
FOUL! Shooting foul on Klay Leonard. Jrue Carter to the line for 2 free throws. [BONUS: 6 team fouls] (Klay Leonard: 1 personal fouls)   FT 1/2: GOOD   FT 2/2: GOOD Jrue Carter makes 2/2 from the line.
Score: 45-36

[02:59] Team_040 possession (Score: 45-36)
Josh Banchero attempts a Midrange. Contested by Tobias Jokic (4.2 feet, ZONE). JOSH BANCHERO MAKES IT!
Score: 45-38

[02:47] Team_051 possession (Score: 45-38)
Pau Tatum attempts a Midrange. Wide open! Josh Banchero is 6.9 feet away. [MAN] PAU TATUM MAKES IT! Assist: Zion Morant
Score: 47-38

[02:33] Team_040 possession (Score: 47-38)
Klay Leonard attempts a 3Pt. Contested by Myles Harden (3.7 feet, ZONE). KLAY LEONARD MAKES IT! Assist: Cole O'Neal
Score: 47-41

[02:19] Team_051 possession (Score: 47-41)
Jrue Carter attempts a 3Pt. BLOCKED BY RJ CURRY! Ball is loose! Rebound secured by Klay Leonard.

[02:07] Team_040 possession (Score: 47-41)
RJ Curry attempts a Midrange. Wide open! Tobias Jokic is 6.1 feet away. [MAN] RJ CURRY MAKES IT! Assist: Josh Banchero
Score: 47-43

[01:54] Team_051 possession (Score: 47-43)
Myles Harden drives, Josh Banchero stays with him. Myles Harden attempts a Layup. Wide open! Josh Banchero is 6.2 feet away. [ZONE] MYLES HARDEN MAKES IT! Assist: Tobias Jokic
Score: 49-43

[01:42] Team_040 possession (Score: 49-43)
Tracy Middleton attempts a 3Pt. Contested by Zion Morant (4.8 feet, MAN). TRACY MIDDLETON MAKES IT! Assist: Josh Banchero
Score: 49-46

[01:25] Team_051 possession (Score: 49-46)
Myles Harden attempts a 3Pt. Wide open! Cole O'Neal is 7.0 feet away. [MAN] MYLES HARDEN MAKES IT!
Score: 52-46

[01:10] Team_040 possession (Score: 52-46)
Tracy Middleton attempts a 3Pt. Contested by Myles Harden (4.7 feet, ZONE). Tracy Middleton misses. Rebound secured by Pau Tatum.

[00:52] Team_051 possession (Score: 52-46)
FOUL! Reach-in foul on Josh Banchero during the drive. [IN THE BONUS! 7 team fouls] Pau Tatum to the line for 2 free throws. (Josh Banchero: 3 personal fouls)   FT 1/2: GOOD   FT 2/2: MISS Pau Tatum makes 1/2 from the line. Rebound secured by RJ Curry.
Score: 53-46

[00:33] Team_040 possession (Score: 53-46)
FOUL! Offensive foul on Klay Leonard! Jrue Carter drew the charge! [Team fouls: 8] (Klay Leonard: 2 personal fouls) TURNOVER! (dead ball)

[00:15] Team_051 possession (Score: 53-46)
Zion Morant drives, Josh Banchero stays with him. Zion Morant attempts a Layup. Wide open! Josh Banchero is 7.3 feet away. [ZONE] Zion Morant misses. Rebound secured by RJ Curry.

================================================================================
                              2ND QUARTER COMPLETE                              
================================================================================

2ND QUARTER SCORE: Team_051 27, Team_040 29

BOX SCORE:
================================================================================

Team_051
--------------------------------------------------------------------------------
Player                MIN  PTS  REB  AST  TO      FG   FG%      3P   3P%
--------------------------------------------------------------------------------
Myles Harden           10    7    1    1   0   3/4    75.0     0/0   0.0
Austin Sexton          14    5    0    0   0   2/2   100.0     0/0   0.0
Jrue Carter            10    4    0    0   0   2/4    50.0     0/0   0.0
Pau Tatum              10    4    2    1   0   2/4    50.0     0/0   0.0
Shaquille Harden       14    2    0    0   0   1/1   100.0     0/0   0.0
Tobias Jokic           10    2    2    1   0   1/1   100.0     0/0   0.0
Franz Simmons          14    0    2    1   0   0/0     0.0     0/0   0.0
Larry McGrady          14    0    0    1   0   0/2     0.0     0/0   0.0
OG Siakam              14    0    1    0   0   0/1     0.0     0/0   0.0
Zion Morant            10    0    0    1   0   0/1     0.0     0/0   0.0

TEAM: FG: 11/20 (55.0%), 3PT: 2/6 (33.3%), REB: 9 (4 off, 5 def), AST: 6, TO: 2
TEAM FOULS: 3


Team_040
--------------------------------------------------------------------------------
Player                MIN  PTS  REB  AST  TO      FG   FG%      3P   3P%
--------------------------------------------------------------------------------
Klay Leonard           10   10    1    1   0   4/5    80.0     0/0   0.0
Josh Banchero          10    7    2    2   0   3/3   100.0     0/0   0.0
RJ Curry               10    5    4    1   0   2/2   100.0     0/0   0.0
Tracy Middleton        10    3    0    1   0   1/2    50.0     0/0   0.0
Ayo Rose               14    2    0    0   0   1/1   100.0     0/0   0.0
Bam Gobert             14    2    1    0   0   1/1   100.0     0/0   0.0
Dirk Johnson           14    0    1    1   0   0/1     0.0     0/0   0.0
Carmelo Murray         14    0    0    0   0   0/1     0.0     0/0   0.0
Shaquille Bane         14    0    1    0   0   0/0     0.0     0/0   0.0
Cole O'Neal            10    0    0    2   0   0/1     0.0     0/0   0.0

TEAM: FG: 12/17 (70.6%), 3PT: 2/6 (33.3%), REB: 9 (1 off, 8 def), AST: 8, TO: 4
TEAM FOULS: 8 [Team_051 in BONUS]

================================================================================

================================================================================
                       3RD QUARTER - Team_051 vs Team_040                       
================================================================================

[12:00] Team_051 possession (Score: 53-46)
Larry McGrady attempts a Midrange. Wide open! Shaquille Bane is 7.1 feet away. [MAN] LARRY MCGRADY MAKES IT!
Score: 55-46

[11:44] Team_040 possession (Score: 55-46)
FOUL! Shooting foul on Larry McGrady. Shaquille Bane to the line for 2 free throws. [Team fouls: 1] (Larry McGrady: 1 personal fouls)   FT 1/2: GOOD   FT 2/2: GOOD Shaquille Bane makes 2/2 from the line.
Score: 55-48

[11:34] Team_051 possession (Score: 55-48)
FOUL! Holding foul on Carmelo Murray. [Team fouls: 1] No free throws, side out. (Carmelo Murray: 1 personal fouls)

[11:24] Team_051 possession (Score: 55-48)
Franz Simmons drives, Dirk Johnson stays with him. Franz Simmons attempts a Dunk. Contested by Dirk Johnson (4.1 feet, MAN). FRANZ SIMMONS MAKES IT! Assist: OG Siakam
Score: 57-48

[11:12] Team_040 possession (Score: 57-48)
Ayo Rose attempts a 3Pt. Contested by Austin Sexton (5.0 feet, ZONE). Ayo Rose misses. Rebound secured by Shaquille Harden.

[10:58] Team_051 possession (Score: 57-48)
Larry McGrady attempts a 3Pt. Contested by Ayo Rose (5.4 feet, ZONE). LARRY MCGRADY MAKES IT! Assist: Franz Simmons
Score: 60-48

[10:42] Team_040 possession (Score: 60-48)
Bam Gobert drives and kicks out. Shaquille Bane attempts a Midrange. Contested by Franz Simmons (5.6 feet, ZONE). SHAQUILLE BANE MAKES IT! Assist: Dirk Johnson
Score: 60-50

[10:26] Team_051 possession (Score: 60-50)
Franz Simmons attempts a Layup. Wide open! Dirk Johnson is 6.1 feet away. [MAN] FRANZ SIMMONS MAKES IT!
Score: 62-50

[10:11] Team_040 possession (Score: 62-50)
FOUL! Holding foul on Shaquille Harden. [Team fouls: 2] No free throws, side out. (Shaquille Harden: 1 personal fouls)

[09:58] Team_040 possession (Score: 62-50)
FOUL! Shooting foul on OG Siakam. Carmelo Murray to the line for 2 free throws. [Team fouls: 3] (OG Siakam: 1 personal fouls)   FT 1/2: MISS   FT 2/2: GOOD Carmelo Murray makes 1/2 from the line.
Score: 62-51

[09:40] Team_051 possession (Score: 62-51)
Franz Simmons loses the ball! Stripped by Dirk Johnson! TURNOVER! (live ball)

[09:23] Team_040 possession (Score: 62-51)
Carmelo Murray drives to the basket... Carmelo Murray throws a bad pass out of bounds! TURNOVER! (dead ball)

[09:09] Team_051 possession (Score: 62-51)
FOUL! Reach-in foul on Dirk Johnson during the drive. [Team fouls: 2] No free throws, side out. (Dirk Johnson: 1 personal fouls)

[08:59] Team_051 possession (Score: 62-51)
Franz Simmons makes the Layup and draws the foul on Bam Gobert! And-1! Franz Simmons to the line for 1. [Team fouls: 3] (Bam Gobert: 1 personal fouls)   FT 1/1: MISS Franz Simmons makes 0/1 from the line. Rebound secured by Dirk Johnson.
Score: 64-51

[08:44] Team_040 possession (Score: 64-51)
Bam Gobert attempts a Midrange. Contested by Shaquille Harden (3.6 feet, ZONE). BAM GOBERT MAKES IT! Assist: Dirk Johnson
Score: 64-53

[08:26] Team_051 possession (Score: 64-53)
Larry McGrady attempts a 3Pt. Heavily contested by Shaquille Bane (1.4 feet, ZONE)! Larry McGrady misses. Offensive rebound by Franz Simmons! Franz Simmons kicks it out.

[08:14] Team_051 possession (Score: 64-53)
Shaquille Harden attempts a Midrange. Contested by Dirk Johnson (4.0 feet, ZONE). Shaquille Harden misses. Rebound secured by Dirk Johnson.

[08:00] Team_040 possession (Score: 64-53)
Carmelo Murray attempts a 3Pt. Contested by Austin Sexton (5.1 feet, ZONE). Carmelo Murray misses. Rebound secured by OG Siakam.

[07:45] Team_051 possession (Score: 64-53)
Larry McGrady makes the 3Pt and draws the foul on Ayo Rose! And-1! Larry McGrady to the line for 1. [Team fouls: 4] (Ayo Rose: 1 personal fouls)   FT 1/1: GOOD Larry McGrady makes 1/1 from the line.
Score: 68-53

[07:34] Team_040 possession (Score: 68-53)
Dirk Johnson attempts a Midrange. Contested by Austin Sexton (4.3 feet, ZONE). DIRK JOHNSON MAKES IT!
Score: 68-55

[07:19] Team_051 possession (Score: 68-55)
Shaquille Harden drives, picks up Bam Gobert. Help arrives from Shaquille Bane! Shaquille Harden attempts a Dunk. Contested by Shaquille Bane (4.5 feet, ZONE). SHAQUILLE HARDEN MAKES IT! Assist: Franz Simmons
Score: 70-55

[07:01] Team_040 possession (Score: 70-55)
Carmelo Murray attempts a 3Pt. Contested by OG Siakam (4.4 feet, MAN). CARMELO MURRAY MAKES IT! Assist: Shaquille Bane
Score: 70-58

[06:45] Team_051 possession (Score: 70-58)
Austin Sexton throws a bad pass out of bounds! TURNOVER! (dead ball)

[06:30] Team_040 possession (Score: 70-58)
Ayo Rose attempts a 3Pt. Contested by Austin Sexton (5.6 feet, ZONE). Ayo Rose misses. Offensive rebound by Bam Gobert! Bam Gobert kicks it out.

[06:21] Team_040 possession (Score: 70-58)
Ayo Rose attempts a Layup. Contested by Austin Sexton (5.4 feet, MAN). AYO ROSE MAKES IT! Assist: Shaquille Bane
Score: 70-60

[06:02] Team_051 possession (Score: 70-60)
Larry McGrady attempts a Midrange. Contested by Shaquille Bane (4.2 feet, ZONE). LARRY MCGRADY MAKES IT! Assist: Austin Sexton
Score: 72-60

[05:45] Team_040 possession (Score: 72-60)
Bam Gobert attempts a Midrange. Contested by Shaquille Harden (3.9 feet, MAN). BAM GOBERT MAKES IT!
Score: 72-62

[05:31] Team_051 possession (Score: 72-62)
OG Siakam attempts a 3Pt. Contested by Ayo Rose (2.3 feet, ZONE). OG Siakam misses. Rebound secured by Bam Gobert.

[05:12] Team_040 possession (Score: 72-62)
Dirk Johnson attempts a Midrange. Heavily contested by Shaquille Harden (1.7 feet, ZONE)! Dirk Johnson misses. Rebound secured by OG Siakam.

[04:56] Team_051 possession (Score: 72-62)
Austin Sexton attempts a Midrange. Contested by Ayo Rose (5.1 feet, MAN). Austin Sexton misses. Offensive rebound by Franz Simmons! Franz Simmons kicks it out.

[04:42] Team_051 possession (Score: 72-62)
Larry McGrady drives, picks up Bam Gobert. Help arrives from Shaquille Bane! Larry McGrady attempts a Dunk. Contested by Shaquille Bane (2.5 feet, ZONE). Larry McGrady misses. Rebound secured by Bam Gobert.

[04:27] Team_040 possession (Score: 72-62)
Shaquille Bane attempts a 3Pt. Contested by Austin Sexton (3.2 feet, ZONE). Shaquille Bane misses. Rebound secured by Franz Simmons.

[04:10] Team_051 possession (Score: 72-62)
Larry McGrady attempts a Layup. Wide open! Bam Gobert is 6.8 feet away. [ZONE] LARRY MCGRADY MAKES IT! Assist: OG Siakam
Score: 74-62

[03:54] Team_040 possession (Score: 74-62)
Carmelo Murray attempts a 3Pt. Wide open! OG Siakam is 7.2 feet away. [MAN] CARMELO MURRAY MAKES IT! Assist: Ayo Rose
Score: 74-65

[03:39] Team_051 possession (Score: 74-65)
Franz Simmons attempts a 3Pt. Contested by Ayo Rose (5.0 feet, ZONE). Franz Simmons misses. Rebound secured by Dirk Johnson.

[03:23] Team_040 possession (Score: 74-65)
Ayo Rose attempts a 3Pt. Contested by Franz Simmons (3.6 feet, ZONE). Ayo Rose misses. Rebound secured by OG Siakam.

[03:11] Team_051 possession (Score: 74-65)
OG Siakam attempts a 3Pt. Wide open! Carmelo Murray is 7.6 feet away. [MAN] OG Siakam misses. Rebound secured by Dirk Johnson.

[02:57] Team_040 possession (Score: 74-65)
Ayo Rose attempts a 3Pt. Wide open! Austin Sexton is 7.7 feet away. [ZONE] Ayo Rose misses. Rebound secured by Shaquille Harden.

[02:46] Team_051 possession (Score: 74-65)
Shaquille Harden attempts a 3Pt. Contested by Ayo Rose (3.1 feet, ZONE). Shaquille Harden misses. Rebound secured by Shaquille Bane.

[02:33] Team_040 possession (Score: 74-65)
Ayo Rose attempts a Midrange. Contested by Austin Sexton (2.9 feet, MAN). Ayo Rose misses. Rebound secured by OG Siakam.

[02:17] Team_051 possession (Score: 74-65)
Larry McGrady attempts a Midrange. Heavily contested by Carmelo Murray (0.5 feet, ZONE)! LARRY MCGRADY MAKES IT!
Score: 76-65

[02:05] Team_040 possession (Score: 76-65)
Dirk Johnson attempts a 3Pt. Contested by Franz Simmons (5.6 feet, MAN). Dirk Johnson misses. Rebound secured by Franz Simmons.

[01:49] Team_051 possession (Score: 76-65)
Austin Sexton drives to the basket... FOUL! Offensive foul on Austin Sexton! Bam Gobert drew the charge! [Team fouls: 4] (Austin Sexton: 1 personal fouls) TURNOVER! (dead ball)

[01:33] Team_040 possession (Score: 76-65)
Carmelo Murray attempts a 3Pt. Contested by OG Siakam (3.4 feet, MAN). Carmelo Murray misses. Rebound secured by OG Siakam.

[01:19] Team_051 possession (Score: 76-65)
Austin Sexton drives, picks up Ayo Rose. Help arrives from Shaquille Bane! Austin Sexton attempts a Dunk. Contested by Shaquille Bane (4.2 feet, MAN). AUSTIN SEXTON MAKES IT!
Score: 78-65

[01:07] Team_040 possession (Score: 78-65)
Carmelo Murray attempts a Midrange. Wide open! OG Siakam is 8.0 feet away. [MAN] Carmelo Murray misses. Offensive rebound by Dirk Johnson! Dirk Johnson kicks it out.

[00:52] Team_040 possession (Score: 78-65)
Bam Gobert attempts a 3Pt. Contested by Larry McGrady (4.8 feet, ZONE). Bam Gobert misses. Offensive rebound by Bam Gobert! Bam Gobert kicks it out.

[00:36] Team_040 possession (Score: 78-65)
FOUL! Shooting foul on OG Siakam. Carmelo Murray to the line for 3 free throws. [BONUS: 5 team fouls] (OG Siakam: 2 personal fouls)   FT 1/3: MISS   FT 2/3: GOOD   FT 3/3: GOOD Carmelo Murray makes 2/3 from the line.
Score: 78-67

[00:24] Team_051 possession (Score: 78-67)
Austin Sexton attempts a 3Pt. Contested by Ayo Rose (3.5 feet, MAN). AUSTIN SEXTON MAKES IT! Assist: Larry McGrady
Score: 81-67

[00:08] Team_040 possession (Score: 81-67)
Carmelo Murray throws a bad pass! Stolen by OG Siakam! TURNOVER! (live ball)

================================================================================
                              3RD QUARTER COMPLETE                              
================================================================================

3RD QUARTER SCORE: Team_051 28, Team_040 21

BOX SCORE:
================================================================================

Team_051
--------------------------------------------------------------------------------
Player                MIN  PTS  REB  AST  TO      FG   FG%      3P   3P%
--------------------------------------------------------------------------------
Larry McGrady          26   15    0    1   0   6/7    85.7     0/0   0.0
Austin Sexton          26    5    0    1   0   2/2   100.0     0/0   0.0
Franz Simmons          26    4    4    2   0   2/4    50.0     0/0   0.0
Shaquille Harden       26    2    2    0   0   1/3    33.3     0/0   0.0
OG Siakam              26    0    5    2   0   0/2     0.0     0/0   0.0

TEAM: FG: 11/18 (61.1%), 3PT: 3/7 (42.9%), REB: 11 (2 off, 9 def), AST: 6, TO: 3
TEAM FOULS: 5 [Team_040 in BONUS]


Team_040
--------------------------------------------------------------------------------
Player                MIN  PTS  REB  AST  TO      FG   FG%      3P   3P%
--------------------------------------------------------------------------------
Carmelo Murray         26    9    0    0   0   4/6    66.7     0/0   0.0
Shaquille Bane         26    4    1    2   0   2/3    66.7     0/0   0.0
Bam Gobert             26    4    4    0   0   2/2   100.0     0/0   0.0
Ayo Rose               26    2    0    1   0   1/5    20.0     0/0   0.0
Dirk Johnson           26    2    5    2   0   1/3    33.3     0/0   0.0

TEAM: FG: 10/19 (52.6%), 3PT: 3/10 (30.0%), REB: 10 (3 off, 7 def), AST: 5, TO: 2
TEAM FOULS: 4

================================================================================

================================================================================
                       4TH QUARTER - Team_051 vs Team_040                       
================================================================================

[12:00] Team_051 possession (Score: 81-67)
OG Siakam attempts a 3Pt. Contested by Carmelo Murray (3.4 feet, MAN). OG SIAKAM MAKES IT! Assist: Austin Sexton
Score: 84-67

[11:44] Team_040 possession (Score: 84-67)
FOUL! Holding foul on Austin Sexton. [Team fouls: 1] No free throws, side out. (Austin Sexton: 1 personal fouls)

[11:28] Team_040 possession (Score: 84-67)
Dirk Johnson drives and kicks out. Carmelo Murray attempts a Midrange. Wide open! OG Siakam is 6.9 feet away. [MAN] CARMELO MURRAY MAKES IT!
Score: 84-69

[11:18] Team_051 possession (Score: 84-69)
OG Siakam attempts a 3Pt. Contested by Carmelo Murray (5.5 feet, MAN). OG SIAKAM MAKES IT! Assist: Austin Sexton
Score: 87-69

[11:05] Team_040 possession (Score: 87-69)
Ayo Rose makes the Layup and draws the foul on Austin Sexton! And-1! Ayo Rose to the line for 1. [Team fouls: 2] (Austin Sexton: 2 personal fouls)   FT 1/1: GOOD Ayo Rose makes 1/1 from the line.
Score: 87-72

[10:47] Team_051 possession (Score: 87-72)
OG Siakam attempts a 3Pt. Contested by Carmelo Murray (4.5 feet, MAN). OG Siakam misses. Rebound secured by Dirk Johnson.

[10:36] Team_040 possession (Score: 87-72)
Ayo Rose drives, Austin Sexton stays with him. Ayo Rose attempts a Dunk. Wide open! Austin Sexton is 6.2 feet away. [MAN] Ayo Rose misses. Offensive rebound by Dirk Johnson! Dirk Johnson kicks it out.

[10:24] Team_040 possession (Score: 87-72)
Carmelo Murray attempts a Layup. Contested by OG Siakam (4.3 feet, MAN). CARMELO MURRAY MAKES IT!
Score: 87-74

[10:07] Team_051 possession (Score: 87-74)
Austin Sexton attempts a Midrange. Contested by Ayo Rose (5.7 feet, MAN). Austin Sexton misses. Offensive rebound by Shaquille Harden! Shaquille Harden puts it back in!
Score: 89-74

[09:51] Team_040 possession (Score: 89-74)
Carmelo Murray attempts a 3Pt. Contested by OG Siakam (4.8 feet, MAN). Carmelo Murray misses. Rebound secured by Shaquille Harden.

[09:39] Team_051 possession (Score: 89-74)
Larry McGrady attempts a 3Pt. Contested by Ayo Rose (4.0 feet, ZONE). Larry McGrady misses. Offensive rebound by Franz Simmons! Franz Simmons kicks it out.

[09:26] Team_051 possession (Score: 89-74)
FOUL! Shooting foul on Carmelo Murray. OG Siakam to the line for 2 free throws. [Team fouls: 1] (Carmelo Murray: 1 personal fouls)   FT 1/2: GOOD   FT 2/2: GOOD OG Siakam makes 2/2 from the line.
Score: 91-74

[09:11] Team_040 possession (Score: 91-74)
Bam Gobert attempts a Midrange. Contested by Shaquille Harden (2.5 feet, MAN). BAM GOBERT MAKES IT!
Score: 91-76

[08:52] Team_051 possession (Score: 91-76)
Franz Simmons drives, Dirk Johnson stays with him. Franz Simmons attempts a Layup. Wide open! Dirk Johnson is 8.7 feet away. [MAN] FRANZ SIMMONS MAKES IT! Assist: OG Siakam
Score: 93-76

[08:35] Team_040 possession (Score: 93-76)
Carmelo Murray attempts a Midrange. Wide open! OG Siakam is 6.6 feet away. [MAN] Carmelo Murray misses. Rebound secured by OG Siakam.

[08:18] Team_051 possession (Score: 93-76)
FOUL! Shooting foul on Ayo Rose. Austin Sexton to the line for 2 free throws. [Team fouls: 2] (Ayo Rose: 1 personal fouls)   FT 1/2: GOOD   FT 2/2: GOOD Austin Sexton makes 2/2 from the line.
Score: 95-76

[08:03] Team_040 possession (Score: 95-76)
Ayo Rose attempts a Midrange. Contested by Austin Sexton (3.6 feet, MAN). AYO ROSE MAKES IT!
Score: 95-78

[07:53] Team_051 possession (Score: 95-78)
Austin Sexton drives, picks up Ayo Rose. Help arrives from Shaquille Bane! Austin Sexton attempts a Layup. Contested by Shaquille Bane (5.5 feet, MAN). Austin Sexton misses. FOUL! Loose ball foul on Bam Gobert during the rebound battle. [Team fouls: 3] No free throws, side out. (Bam Gobert: 1 personal fouls)

[07:43] Team_051 possession (Score: 95-78)
Larry McGrady drives, Shaquille Bane stays with him. Larry McGrady attempts a Layup. Wide open! Shaquille Bane is 6.3 feet away. [MAN] LARRY MCGRADY MAKES IT! Assist: Austin Sexton
Score: 97-78

[07:31] Team_040 possession (Score: 97-78)
Dirk Johnson attempts a 3Pt. Contested by Austin Sexton (4.8 feet, ZONE). Dirk Johnson misses. Rebound secured by OG Siakam.

[07:13] Team_051 possession (Score: 97-78)
Austin Sexton drives and kicks out. Franz Simmons attempts a 3Pt. Contested by Ayo Rose (4.1 feet, ZONE). Franz Simmons misses. Rebound secured by Bam Gobert.

[06:56] Team_040 possession (Score: 97-78)
Bam Gobert drives, Shaquille Harden stays with him. Bam Gobert attempts a Layup. Wide open! Shaquille Harden is 7.7 feet away. [MAN] BAM GOBERT MAKES IT!
Score: 97-80

[06:42] Team_051 possession (Score: 97-80)
Austin Sexton attempts a Midrange. Contested by Ayo Rose (4.0 feet, MAN). Austin Sexton misses. Rebound secured by Shaquille Bane.

[06:25] Team_040 possession (Score: 97-80)
Dirk Johnson attempts a Midrange. Contested by OG Siakam (2.8 feet, ZONE). Dirk Johnson misses. Rebound secured by Franz Simmons.

[06:08] Team_051 possession (Score: 97-80)
Larry McGrady attempts a 3Pt. Wide open! Ayo Rose is 7.3 feet away. [ZONE] Larry McGrady misses. Rebound secured by Bam Gobert.

[05:49] Team_040 possession (Score: 97-80)
FOUL! Offensive foul on Dirk Johnson! Franz Simmons drew the charge! [Team fouls: 4] (Dirk Johnson: 1 personal fouls) TURNOVER! (dead ball)

[05:34] Team_051 possession (Score: 97-80)
OG Siakam attempts a 3Pt. Contested by Ayo Rose (4.6 feet, ZONE). OG SIAKAM MAKES IT! Assist: Austin Sexton
Score: 100-80

[05:15] Team_040 possession (Score: 100-80)
Ayo Rose attempts a 3Pt. Contested by Austin Sexton (4.1 feet, ZONE). AYO ROSE MAKES IT! Assist: Carmelo Murray
Score: 100-83

[05:02] Team_051 possession (Score: 100-83)
Larry McGrady attempts a 3Pt. Contested by Carmelo Murray (3.6 feet, ZONE). Larry McGrady misses. Offensive rebound by Franz Simmons! Franz Simmons kicks it out.

[04:50] Team_051 possession (Score: 100-83)
Franz Simmons attempts a Midrange. Contested by Dirk Johnson (5.5 feet, MAN). Franz Simmons misses. Rebound secured by Dirk Johnson.

[04:33] Team_040 possession (Score: 100-83)
Ayo Rose attempts a Midrange. Contested by Austin Sexton (3.8 feet, MAN). Ayo Rose misses. Rebound secured by Shaquille Harden.

[04:18] Team_051 possession (Score: 100-83)
OG Siakam drives and kicks out. Franz Simmons makes the 3Pt and draws the foul on Dirk Johnson! And-1! Franz Simmons to the line for 1. [BONUS: 5 team fouls] (Dirk Johnson: 2 personal fouls)   FT 1/1: GOOD Franz Simmons makes 1/1 from the line.
Score: 104-83

[04:03] Team_040 possession (Score: 104-83)
Bam Gobert attempts a 3Pt. Contested by Shaquille Harden (4.6 feet, MAN). Bam Gobert misses. Offensive rebound by Dirk Johnson! Dirk Johnson kicks it out.

[03:50] Team_040 possession (Score: 104-83)
Dirk Johnson attempts a Midrange. Wide open! Franz Simmons is 7.2 feet away. [MAN] Dirk Johnson misses. Rebound secured by OG Siakam.

[03:35] Team_051 possession (Score: 104-83)
Franz Simmons makes the Dunk and draws the foul on Bam Gobert! And-1! Franz Simmons to the line for 1. [BONUS: 6 team fouls] (Bam Gobert: 2 personal fouls)   FT 1/1: GOOD Franz Simmons makes 1/1 from the line.
Score: 107-83

[03:20] Team_040 possession (Score: 107-83)
Shaquille Bane attempts a 3Pt. Wide open! Larry McGrady is 7.1 feet away. [MAN] SHAQUILLE BANE MAKES IT! Assist: Bam Gobert
Score: 107-86

[03:05] Team_051 possession (Score: 107-86)
Shaquille Harden drives, Bam Gobert stays with him. Shaquille Harden attempts a Dunk. Wide open! Bam Gobert is 6.3 feet away. [MAN] Shaquille Harden misses. Rebound secured by Dirk Johnson.

[02:50] Team_040 possession (Score: 107-86)
Shaquille Bane attempts a 3Pt. Contested by Austin Sexton (4.0 feet, ZONE). SHAQUILLE BANE MAKES IT!
Score: 107-89

[02:32] Team_051 possession (Score: 107-89)
Shaquille Harden throws a bad pass! Stolen by Bam Gobert! TURNOVER! (live ball)

[02:20] Team_040 possession (Score: 107-89)
Bam Gobert attempts a Layup. Wide open! Shaquille Harden is 8.1 feet away. [MAN] Bam Gobert misses. Offensive rebound by Bam Gobert! Bam Gobert kicks it out.

[02:08] Team_040 possession (Score: 107-89)
Carmelo Murray attempts a 3Pt. Wide open! OG Siakam is 8.7 feet away. [MAN] Carmelo Murray misses. Rebound secured by Franz Simmons.

[01:51] Team_051 possession (Score: 107-89)
OG Siakam drives, picks up Bam Gobert. Help arrives from Shaquille Bane! OG Siakam attempts a Dunk. Wide open! Shaquille Bane is 7.0 feet away. [ZONE] OG Siakam misses. Rebound secured by Shaquille Bane.

[01:35] Team_040 possession (Score: 107-89)
Dirk Johnson attempts a Midrange. Wide open! Shaquille Harden is 8.0 feet away. [ZONE] Dirk Johnson misses. Rebound secured by OG Siakam.

[01:20] Team_051 possession (Score: 107-89)
OG Siakam attempts a 3Pt. Wide open! Carmelo Murray is 6.2 feet away. [MAN] OG Siakam misses. Rebound secured by Shaquille Bane.

[01:08] Team_040 possession (Score: 107-89)
Dirk Johnson attempts a 3Pt. Wide open! Austin Sexton is 7.4 feet away. [ZONE] Dirk Johnson misses. Rebound secured by Shaquille Harden.

[00:48] Team_051 possession (Score: 107-89)
Shaquille Harden attempts a Midrange. Wide open! Bam Gobert is 6.5 feet away. [MAN] Shaquille Harden misses. Rebound secured by Bam Gobert.

[00:35] Team_040 possession (Score: 107-89)
Shaquille Bane attempts a 3Pt. Wide open! Larry McGrady is 7.6 feet away. [MAN] Shaquille Bane misses. Rebound secured by Franz Simmons.

[00:17] Team_051 possession (Score: 107-89)
Austin Sexton attempts a Midrange. Wide open! Bam Gobert is 6.7 feet away. [ZONE] Austin Sexton misses. Offensive rebound by Franz Simmons! Franz Simmons kicks it out.

[00:04] Team_051 possession (Score: 107-89)
Larry McGrady throws a bad pass out of bounds! TURNOVER! (dead ball)

[00:04] Substitution (Team_051): Austin Sexton OUT → Myles Harden IN (stamina_rule2)

[00:04] Substitution (Team_051): Larry McGrady OUT → Zion Morant IN (stamina_rule2)

[00:04] Substitution (Team_051): OG Siakam OUT → Jrue Carter IN (stamina_rule2)

[00:04] Substitution (Team_051): Franz Simmons OUT → Tobias Jokic IN (stamina_rule2)

[00:04] Substitution (Team_051): Shaquille Harden OUT → Pau Tatum IN (stamina_rule2)

[00:04] Substitution (Team_040): Ayo Rose OUT → Cole O'Neal IN (stamina_rule2)

[00:04] Substitution (Team_040): Shaquille Bane OUT → Tracy Middleton IN (stamina_rule2)

[00:04] Substitution (Team_040): Carmelo Murray OUT → Klay Leonard IN (stamina_rule2)

[00:04] Substitution (Team_040): Dirk Johnson OUT → RJ Curry IN (stamina_rule2)

[00:04] Substitution (Team_040): Bam Gobert OUT → Josh Banchero IN (stamina_rule2)

================================================================================
                              4TH QUARTER COMPLETE                              
================================================================================

4TH QUARTER SCORE: Team_051 26, Team_040 22

BOX SCORE:
================================================================================

Team_051
--------------------------------------------------------------------------------
Player                MIN  PTS  REB  AST  TO      FG   FG%      3P   3P%
--------------------------------------------------------------------------------
OG Siakam              39   11    4    1   0   4/7    57.1     0/0   0.0
Franz Simmons          39    9    6    0   0   3/4    75.0     0/0   0.0
Austin Sexton          39    2    0    4   0   1/3    33.3     0/0   0.0
Shaquille Harden       39    2    5    0   0   1/3    33.3     0/0   0.0
Larry McGrady          39    2    0    0   0   1/2    50.0     0/0   0.0

TEAM: FG: 10/19 (52.6%), 3PT: 3/6 (50.0%), REB: 15 (5 off, 10 def), AST: 5, TO: 2
TEAM FOULS: 2


Team_040
--------------------------------------------------------------------------------
Player                MIN  PTS  REB  AST  TO      FG   FG%      3P   3P%
--------------------------------------------------------------------------------
Ayo Rose               39    8    0    0   0   3/4    75.0     0/0   0.0
Shaquille Bane         39    6    3    0   0   2/3    66.7     0/0   0.0
Carmelo Murray         39    4    0    1   0   2/5    40.0     0/0   0.0
Bam Gobert             39    4    4    1   0   2/2   100.0     0/0   0.0
Dirk Johnson           39    0    5    0   0   0/5     0.0     0/0   0.0

TEAM: FG: 9/19 (47.4%), 3PT: 3/8 (37.5%), REB: 12 (3 off, 9 def), AST: 2, TO: 1
TEAM FOULS: 6 [Team_051 in BONUS]

================================================================================

================================================================================
                               FULL GAME COMPLETE                               
================================================================================

FINAL SCORE: Team_051 107, Team_040 89

SCORING BY QUARTER:
--------------------------------------------------------------------------------
Team                     Q1     Q2     Q3     Q4    FINAL
--------------------------------------------------------------------------------
Team_051                 26     27     28     26      107
Team_040                 17     29     21     22       89
--------------------------------------------------------------------------------

FULL GAME BOX SCORE:
================================================================================

Team_051
--------------------------------------------------------------------------------
Player                MIN  PTS  REB  AST  TO      FG   FG%      3P   3P%      FT STL BLK
--------------------------------------------------------------------------------
Austin Sexton          39   17    0    6   1   7/11   63.6   2/2   100.0   2/2     0   1
Larry McGrady          39   22    0    4   2   9/16   56.2   3/7    42.9   3/3     2   0
OG Siakam              39   11   13    6   1   5/15   33.3   3/9    33.3   2/2     1   0
Franz Simmons          39   21   14    3   2   8/11   72.7   0/1     0.0   2/3     1   0
Shaquille Harden       39    8   13    1   1   4/9    44.4   0/1     0.0   0/0     0   0
Myles Harden           10   10    1    2   1   5/6    83.3   3/3   100.0   0/0     0   0
Zion Morant            10    0    0    1   0   0/1     0.0   0/0     0.0   0/0     0   0
Jrue Carter            10    7    0    0   0   3/6    50.0   1/4    25.0   2/2     0   0
Tobias Jokic           10    2    5    1   0   1/1   100.0   0/0     0.0   2/2     0   0
Pau Tatum              10    4    2    1   0   1/3    33.3   0/0     0.0   1/3     0   0

TEAM: FG: 43/79 (54.4%), 3PT: 12/27 (44.4%), REB: 51 (15 off, 36 def), AST: 25, TO: 8


Team_040
--------------------------------------------------------------------------------
Player                MIN  PTS  REB  AST  TO      FG   FG%      3P   3P%      FT STL BLK
--------------------------------------------------------------------------------
Ayo Rose               39   14    0    2   1   6/15   40.0   1/7    14.3   1/1     0   0
Shaquille Bane         39   10    8    2   5   3/6    50.0   2/5    40.0   2/2     0   0
Carmelo Murray         39   15    0    1   1   6/15   40.0   3/9    33.3   3/5     0   0
Dirk Johnson           39    5   14    4   2   3/13   23.1   1/5    20.0   0/0     1   0
Bam Gobert             39   15   13    1   0   8/8   100.0   0/0     0.0   1/1     1   1
Cole O'Neal            10    3    0    2   0   1/4    25.0   0/1     0.0   1/1     0   0
Tracy Middleton        10    5    0    1   0   2/3    66.7   1/2    50.0   0/0     0   0
Klay Leonard           10   10    1    1   1   4/5    80.0   1/2    50.0   1/1     0   0
RJ Curry               10    5    6    2   1   2/2   100.0   0/0     0.0   1/1     0   1
Josh Banchero          10    7    2    2   0   3/3   100.0   0/0     0.0   0/0     1   0

TEAM: FG: 38/74 (51.4%), 3PT: 9/31 (29.0%), REB: 41 (9 off, 32 def), AST: 18, TO: 11

================================================================================
