================================================================================
                        FULL GAME - Team_076 vs Team_054                        
================================================================================

================================================================================
                       1ST QUARTER - Team_076 vs Team_054                       
================================================================================

[12:00] Team_076 possession (Score: 0-0)
Paul Leonard attempts a 3Pt. Wide open! Vince Ball is 7.0 feet away. [MAN] Paul Leonard misses. Rebound secured by Luka Brogdon.

[11:44] Team_054 possession (Score: 0-0)
Vince Ball drives, picks up Paul Leonard. Help arrives from Tobias Mitchell! Vince Ball attempts a Dunk. Contested by Tobias Mitchell (3.7 feet, MAN). Vince Ball misses. FOUL! Loose ball foul on Tobias Mitchell during the rebound battle. [Team fouls: 1] No free throws, side out. (Tobias Mitchell: 1 personal fouls)

[11:29] Team_054 possession (Score: 0-0)
Blake Russell attempts a Layup. Wide open! Cade Barnes is 7.0 feet away. [ZONE] BLAKE RUSSELL MAKES IT! Assist: Vince Ball
Score: 0-2

[11:14] Team_076 possession (Score: 0-2)
Paul Leonard attempts a 3Pt. Contested by Lauri Irving (2.7 feet, ZONE). Paul Leonard misses. Offensive rebound by Cade Barnes! Cade Barnes kicks it out.

[11:03] Team_076 possession (Score: 0-2)
Paul Leonard attempts a 3Pt. Wide open! Lauri Irving is 6.1 feet away. [ZONE] PAUL LEONARD MAKES IT! Assist: Tobias Mitchell
Score: 3-2

[10:49] Team_054 possession (Score: 3-2)
FOUL! Reach-in foul on Cade Barnes during the drive. [Team fouls: 2] No free throws, side out. (Cade Barnes: 1 personal fouls)

[10:35] Team_054 possession (Score: 3-2)
Lauri Irving drives and kicks out. Lauri Irving attempts a 3Pt. Contested by Cade Barnes (2.6 feet, ZONE). Lauri Irving misses. Rebound secured by Cade Barnes.

[10:21] Team_076 possession (Score: 3-2)
Paul Leonard attempts a Midrange. Contested by Luka Brogdon (3.4 feet, ZONE). Paul Leonard misses. Offensive rebound by D'Angelo Tatum! D'Angelo Tatum kicks it out.

[10:04] Team_076 possession (Score: 3-2)
D'Angelo Tatum attempts a Layup. Contested by Blake Russell (5.8 feet, MAN). D'Angelo Tatum misses. Offensive rebound by Cade Barnes! Cade Barnes kicks it out.

[09:46] Team_076 possession (Score: 3-2)
FOUL! Holding foul on Luka Brogdon. [Team fouls: 1] No free throws, side out. (Luka Brogdon: 1 personal fouls)

[09:34] Team_076 possession (Score: 3-2)
D'Angelo Tatum drives to the basket... D'Angelo Tatum loses control! Ball rolls out of bounds! TURNOVER! (dead ball)

[09:20] Team_054 possession (Score: 3-2)
Malcolm Harden attempts a 3Pt. Wide open! Cade Barnes is 6.9 feet away. [ZONE] Malcolm Harden misses. Offensive rebound by Luka Brogdon! Luka Brogdon kicks it out.

[09:01] Team_054 possession (Score: 3-2)
Malcolm Harden commits a violation (traveling/carry)! TURNOVER! (dead ball)

[08:46] Team_076 possession (Score: 3-2)
Cade Barnes drives and kicks out. Dejounte LaVine attempts a Midrange. Contested by Blake Russell (2.8 feet, ZONE). Dejounte LaVine misses. Rebound secured by Luka Brogdon.

[08:28] Team_054 possession (Score: 3-2)
Luka Brogdon drives to the basket... Luka Brogdon throws a bad pass! Stolen by Cade Barnes! TURNOVER! (live ball)

[08:14] Team_076 possession (Score: 3-2)
FOUL! Offensive foul on Dejounte LaVine! Malcolm Harden drew the charge! [Team fouls: 3] (Dejounte LaVine: 1 personal fouls) TURNOVER! (dead ball)

[07:55] Team_054 possession (Score: 3-2)
Luka Brogdon attempts a 3Pt. Contested by Cade Barnes (4.8 feet, ZONE). LUKA BROGDON MAKES IT! Assist: Lauri Irving
Score: 3-5

[07:44] Team_076 possession (Score: 3-5)
FOUL! Reach-in foul on Luka Brogdon during the drive. [Team fouls: 2] No free throws, side out. (Luka Brogdon: 2 personal fouls)

[07:33] Team_076 possession (Score: 3-5)
D'Angelo Tatum attempts a Layup. BLOCKED BY BLAKE RUSSELL! Ball deflects out of bounds off D'Angelo Tatum.

[07:20] Team_054 possession (Score: 3-5)
FOUL! Holding foul on Paul Leonard. [Team fouls: 4] No free throws, side out. (Paul Leonard: 1 personal fouls)

[07:06] Team_054 possession (Score: 3-5)
Luka Brogdon attempts a Layup. BLOCKED BY CADE BARNES! Ball deflects out of bounds off Luka Brogdon.

[06:54] Team_076 possession (Score: 3-5)
Paul Leonard attempts a 3Pt. Contested by Vince Ball (4.7 feet, MAN). Paul Leonard misses. Rebound secured by Luka Brogdon.

[06:41] Team_054 possession (Score: 3-5)
Blake Russell drives to the basket... Blake Russell loses the ball! Stripped by D'Angelo Tatum! TURNOVER! (live ball)

[06:29] Team_076 possession (Score: 3-5)
Paul Leonard attempts a 3Pt. Contested by Vince Ball (3.9 feet, MAN). Paul Leonard misses. Rebound secured by Luka Brogdon.

[06:16] Team_054 possession (Score: 3-5)
FOUL! Reach-in foul on Dejounte LaVine during the drive. [IN THE BONUS! 5 team fouls] Malcolm Harden to the line for 2 free throws. (Dejounte LaVine: 2 personal fouls)   FT 1/2: GOOD   FT 2/2: GOOD Malcolm Harden makes 2/2 from the line.
Score: 3-7

[06:01] Team_076 possession (Score: 3-7)
D'Angelo Tatum drives to the basket... D'Angelo Tatum throws a bad pass! Stolen by Blake Russell! TURNOVER! (live ball)

[05:45] Team_054 possession (Score: 3-7)
FOUL! Shooting foul on Cade Barnes. Luka Brogdon to the line for 2 free throws. [BONUS: 6 team fouls] (Cade Barnes: 2 personal fouls)   FT 1/2: MISS   FT 2/2: GOOD Luka Brogdon makes 1/2 from the line.
Score: 3-8

[05:31] Team_076 possession (Score: 3-8)
Tobias Mitchell loses the ball! Stripped by Lauri Irving! TURNOVER! (live ball)

[05:15] Team_054 possession (Score: 3-8)
FOUL! Reach-in foul on Cade Barnes during the drive. [IN THE BONUS! 7 team fouls] Blake Russell to the line for 2 free throws. (Cade Barnes: 3 personal fouls)   FT 1/2: GOOD   FT 2/2: GOOD Blake Russell makes 2/2 from the line.
Score: 3-10

[05:01] Team_076 possession (Score: 3-10)
Paul Leonard attempts a 3Pt. Contested by Lauri Irving (4.8 feet, ZONE). PAUL LEONARD MAKES IT! Assist: D'Angelo Tatum
Score: 6-10

[04:47] Team_054 possession (Score: 6-10)
Vince Ball attempts a 3Pt. Wide open! Paul Leonard is 7.0 feet away. [MAN] Vince Ball misses. Rebound secured by D'Angelo Tatum.

[04:30] Team_076 possession (Score: 6-10)
Tobias Mitchell attempts a 3Pt. Contested by Malcolm Harden (5.6 feet, ZONE). TOBIAS MITCHELL MAKES IT! Assist: Dejounte LaVine
Score: 9-10

[04:18] Team_054 possession (Score: 9-10)
Luka Brogdon attempts a Layup. Contested by D'Angelo Tatum (5.7 feet, ZONE). LUKA BROGDON MAKES IT!
Score: 9-12

[04:04] Team_076 possession (Score: 9-12)
Cade Barnes drives and kicks out. Cade Barnes attempts a 3Pt. Contested by Luka Brogdon (4.5 feet, MAN). Cade Barnes misses. Rebound secured by Vince Ball.

[03:51] Team_054 possession (Score: 9-12)
Vince Ball drives and kicks out. Vince Ball attempts a 3Pt. Wide open! Cade Barnes is 9.7 feet away. [ZONE] Vince Ball misses. Rebound secured by D'Angelo Tatum.

[03:36] Team_076 possession (Score: 9-12)
Dejounte LaVine attempts a 3Pt. Contested by Lauri Irving (2.6 feet, ZONE). Dejounte LaVine misses. Offensive rebound by Cade Barnes! Cade Barnes kicks it out.

[03:21] Team_076 possession (Score: 9-12)
FOUL! Holding foul on Vince Ball. [Team fouls: 3] No free throws, side out. (Vince Ball: 1 personal fouls)

[03:08] Team_076 possession (Score: 9-12)
Cade Barnes attempts a Midrange. Contested by Lauri Irving (4.7 feet, ZONE). Cade Barnes misses. Rebound secured by Vince Ball.

[02:54] Team_054 possession (Score: 9-12)
Vince Ball attempts a Midrange. Wide open! Paul Leonard is 6.3 feet away. [MAN] Vince Ball misses. Rebound secured by Tobias Mitchell.

[02:42] Team_076 possession (Score: 9-12)
Dejounte LaVine attempts a Midrange. Heavily contested by Malcolm Harden (0.7 feet, MAN)! Dejounte LaVine misses. Rebound secured by Vince Ball.

[02:31] Team_054 possession (Score: 9-12)
Malcolm Harden attempts a 3Pt. Wide open! Dejounte LaVine is 8.2 feet away. [MAN] MALCOLM HARDEN MAKES IT! Assist: Vince Ball
Score: 9-15

[02:18] Team_076 possession (Score: 9-15)
Dejounte LaVine drives, Blake Russell stays with him. Dejounte LaVine attempts a Layup. Contested by Blake Russell (2.6 feet, ZONE). Dejounte LaVine misses. Offensive rebound by Cade Barnes! Cade Barnes kicks it out.

[02:03] Team_076 possession (Score: 9-15)
D'Angelo Tatum drives, Blake Russell stays with him. D'Angelo Tatum attempts a Layup. Contested by Blake Russell (3.9 feet, ZONE). D'Angelo Tatum misses. Rebound secured by Vince Ball.

[01:49] Team_054 possession (Score: 9-15)
Malcolm Harden attempts a Layup. Wide open! Cade Barnes is 6.6 feet away. [ZONE] MALCOLM HARDEN MAKES IT! Assist: Vince Ball
Score: 9-17

[01:34] Team_076 possession (Score: 9-17)
Tobias Mitchell attempts a 3Pt. Heavily contested by Lauri Irving (1.9 feet, ZONE)! Tobias Mitchell misses. Offensive rebound by Cade Barnes! Cade Barnes kicks it out.

[01:17] Team_076 possession (Score: 9-17)
Cade Barnes drives and kicks out. Tobias Mitchell attempts a Midrange. Contested by Lauri Irving (3.3 feet, MAN). Tobias Mitchell misses. Rebound secured by Luka Brogdon.

[01:02] Team_054 possession (Score: 9-17)
Lauri Irving attempts a Layup. Wide open! Tobias Mitchell is 6.3 feet away. [MAN] LAURI IRVING MAKES IT! Assist: Vince Ball
Score: 9-19

[00:50] Team_076 possession (Score: 9-19)
Cade Barnes attempts a Midrange. Contested by Luka Brogdon (3.5 feet, ZONE). CADE BARNES MAKES IT!
Score: 11-19

[00:37] Team_054 possession (Score: 11-19)
Blake Russell drives and kicks out. Malcolm Harden attempts a 3Pt. Wide open! Dejounte LaVine is 9.1 feet away. [ZONE] MALCOLM HARDEN MAKES IT! Assist: Luka Brogdon
Score: 11-22

[00:20] Team_076 possession (Score: 11-22)
Cade Barnes attempts a 3Pt. Contested by Lauri Irving (4.1 feet, ZONE). CADE BARNES MAKES IT! Assist: D'Angelo Tatum
Score: 14-22

[00:06] Team_054 possession (Score: 14-22)
Blake Russell drives and kicks out. Blake Russell attempts a 3Pt. Contested by Cade Barnes (3.9 feet, ZONE). Blake Russell misses. Offensive rebound by Blake Russell! Blake Russell puts it back in!
Score: 14-24

================================================================================
                              1ST QUARTER COMPLETE                              
================================================================================

1ST QUARTER SCORE: Team_076 14, Team_054 24

BOX SCORE:
================================================================================

Team_076
--------------------------------------------------------------------------------
Player                MIN  PTS  REB  AST  TO      FG   FG%      3P   3P%
--------------------------------------------------------------------------------
Paul Leonard           12    6    0    0   0   2/5    40.0     0/0   0.0
Cade Barnes            12    5    6    0   0   2/6    33.3     0/0   0.0
Tobias Mitchell        12    3    1    1   0   1/1   100.0     0/0   0.0
D'Angelo Tatum         12    0    3    2   0   0/2     0.0     0/0   0.0
Dejounte LaVine        12    0    0    1   0   0/1     0.0     0/0   0.0

TEAM: FG: 5/15 (33.3%), 3PT: 4/7 (57.1%), REB: 10 (6 off, 4 def), AST: 4, TO: 4
TEAM FOULS: 7 [Team_054 in BONUS]


Team_054
--------------------------------------------------------------------------------
Player                MIN  PTS  REB  AST  TO      FG   FG%      3P   3P%
--------------------------------------------------------------------------------
Malcolm Harden         12   10    0    0   0   4/4   100.0     0/0   0.0
Luka Brogdon           12    6    6    1   0   3/4    75.0     0/0   0.0
Blake Russell          12    6    2    0   0   3/3   100.0     0/0   0.0
Lauri Irving           12    2    0    1   0   1/2    50.0     0/0   0.0
Vince Ball             12    0    4    4   0   0/3     0.0     0/0   0.0

TEAM: FG: 11/16 (68.8%), 3PT: 2/3 (66.7%), REB: 12 (3 off, 9 def), AST: 6, TO: 3
TEAM FOULS: 3

================================================================================

================================================================================
                       2ND QUARTER - Team_076 vs Team_054                       
================================================================================

[12:00] Team_076 possession (Score: 14-24)
Tobias Mitchell attempts a Midrange. Contested by Luka Brogdon (3.1 feet, ZONE). TOBIAS MITCHELL MAKES IT! Assist: Cade Barnes
Score: 16-24

[11:41] Team_054 possession (Score: 16-24)
Lauri Irving attempts a 3Pt. Contested by Tobias Mitchell (3.4 feet, MAN). Lauri Irving misses. Rebound secured by Cade Barnes.

[11:26] Team_076 possession (Score: 16-24)
Dejounte LaVine attempts a 3Pt. Contested by Lauri Irving (5.0 feet, ZONE). Dejounte LaVine misses. Offensive rebound by Cade Barnes! Cade Barnes kicks it out.

[11:10] Team_076 possession (Score: 16-24)
Cade Barnes drives and kicks out. Tobias Mitchell attempts a 3Pt. Contested by Lauri Irving (3.2 feet, MAN). TOBIAS MITCHELL MAKES IT! Assist: Dejounte LaVine
Score: 19-24

[10:54] Team_054 possession (Score: 19-24)
Malcolm Harden attempts a 3Pt. Contested by Cade Barnes (3.3 feet, ZONE). MALCOLM HARDEN MAKES IT! Assist: Lauri Irving
Score: 19-27

[10:35] Team_076 possession (Score: 19-27)
Dejounte LaVine attempts a 3Pt. Contested by Lauri Irving (3.8 feet, ZONE). DEJOUNTE LAVINE MAKES IT! Assist: Tobias Mitchell
Score: 22-27

[10:22] Team_054 possession (Score: 22-27)
Luka Brogdon attempts a Midrange. Heavily contested by Cade Barnes (0.5 feet, MAN)! Luka Brogdon misses. Rebound secured by Tobias Mitchell.

[10:07] Team_076 possession (Score: 22-27)
FOUL! Shooting foul on Blake Russell. Paul Leonard to the line for 2 free throws. [Team fouls: 1] (Blake Russell: 1 personal fouls)   FT 1/2: MISS   FT 2/2: GOOD Paul Leonard makes 1/2 from the line.
Score: 23-27

[09:52] Team_054 possession (Score: 23-27)
Blake Russell attempts a 3Pt. Wide open! Cade Barnes is 7.8 feet away. [ZONE] Blake Russell misses. Rebound secured by Tobias Mitchell.

[09:34] Team_076 possession (Score: 23-27)
Dejounte LaVine attempts a 3Pt. Contested by Malcolm Harden (5.6 feet, MAN). Dejounte LaVine misses. Offensive rebound by D'Angelo Tatum! D'Angelo Tatum kicks it out.

[09:15] Team_076 possession (Score: 23-27)
Tobias Mitchell attempts a 3Pt. Wide open! Lauri Irving is 7.1 feet away. [MAN] Tobias Mitchell misses. Rebound secured by Blake Russell.

[09:02] Team_054 possession (Score: 23-27)
Luka Brogdon attempts a 3Pt. Contested by Cade Barnes (3.5 feet, MAN). Luka Brogdon misses. Rebound secured by Tobias Mitchell.

[08:46] Team_076 possession (Score: 23-27)
Tobias Mitchell attempts a 3Pt. Contested by Lauri Irving (5.8 feet, MAN). Tobias Mitchell misses. Offensive rebound by Cade Barnes! Cade Barnes kicks it out.

[08:35] Team_076 possession (Score: 23-27)
Cade Barnes drives, Luka Brogdon stays with him. Cade Barnes attempts a Dunk. Contested by Luka Brogdon (5.8 feet, MAN). CADE BARNES MAKES IT!
Score: 25-27

[08:21] Team_054 possession (Score: 25-27)
Luka Brogdon drives and kicks out. Vince Ball attempts a Midrange. Wide open! Paul Leonard is 10.0 feet away. [MAN] VINCE BALL MAKES IT! Assist: Blake Russell
Score: 25-29

[08:09] Team_076 possession (Score: 25-29)
Dejounte LaVine attempts a Midrange. Heavily contested by Malcolm Harden (0.5 feet, MAN)! Dejounte LaVine misses. Rebound secured by Luka Brogdon.

[07:56] Team_054 possession (Score: 25-29)
Luka Brogdon attempts a Layup. Wide open! Cade Barnes is 8.1 feet away. [ZONE] LUKA BROGDON MAKES IT! Assist: Vince Ball
Score: 25-31

[07:43] Team_076 possession (Score: 25-31)
FOUL! Offensive foul on Dejounte LaVine! Malcolm Harden drew the charge! [Team fouls: 1] (Dejounte LaVine: 1 personal fouls) TURNOVER! (dead ball)

[07:28] Team_054 possession (Score: 25-31)
FOUL! Reach-in foul on D'Angelo Tatum during the drive. [Team fouls: 2] No free throws, side out. (D'Angelo Tatum: 1 personal fouls)

[07:09] Team_054 possession (Score: 25-31)
Malcolm Harden attempts a 3Pt. Wide open! Dejounte LaVine is 8.8 feet away. [MAN] Malcolm Harden misses. Rebound secured by D'Angelo Tatum.

[06:58] Team_076 possession (Score: 25-31)
Dejounte LaVine attempts a 3Pt. Wide open! Malcolm Harden is 6.9 feet away. [MAN] DEJOUNTE LAVINE MAKES IT!
Score: 28-31

[06:44] Team_054 possession (Score: 28-31)
Luka Brogdon attempts a Midrange. Wide open! Paul Leonard is 8.1 feet away. [ZONE] Luka Brogdon misses. Rebound secured by D'Angelo Tatum.

[06:27] Team_076 possession (Score: 28-31)
Dejounte LaVine drives, Malcolm Harden stays with him. Dejounte LaVine attempts a Dunk. Wide open! Malcolm Harden is 9.0 feet away. [MAN] DEJOUNTE LAVINE MAKES IT! Assist: Tobias Mitchell
Score: 30-31

[06:12] Team_054 possession (Score: 30-31)
Vince Ball attempts a 3Pt. Contested by Dejounte LaVine (5.0 feet, ZONE). Vince Ball misses. Rebound secured by D'Angelo Tatum.

[05:57] Team_076 possession (Score: 30-31)
D'Angelo Tatum attempts a Midrange. Contested by Vince Ball (5.9 feet, ZONE). D'ANGELO TATUM MAKES IT! Assist: Paul Leonard
Score: 32-31

[05:44] Team_054 possession (Score: 32-31)
Blake Russell attempts a 3Pt. Contested by Cade Barnes (3.9 feet, ZONE). Blake Russell misses. Rebound secured by Cade Barnes.

[05:28] Team_076 possession (Score: 32-31)
Cade Barnes attempts a Midrange. Contested by Luka Brogdon (4.7 feet, MAN). Cade Barnes misses. Offensive rebound by D'Angelo Tatum! D'Angelo Tatum kicks it out.

[05:17] Team_076 possession (Score: 32-31)
Tobias Mitchell attempts a Midrange. Contested by Lauri Irving (5.7 feet, MAN). TOBIAS MITCHELL MAKES IT!
Score: 34-31

[05:05] Team_054 possession (Score: 34-31)
Vince Ball attempts a Midrange. Wide open! Paul Leonard is 6.0 feet away. [MAN] VINCE BALL MAKES IT! Assist: Blake Russell
Score: 34-33

[04:50] Team_076 possession (Score: 34-33)
Paul Leonard attempts a 3Pt. Wide open! Vince Ball is 8.2 feet away. [MAN] PAUL LEONARD MAKES IT! Assist: Cade Barnes
Score: 37-33

[04:32] Team_054 possession (Score: 37-33)
FOUL! Shooting foul on Tobias Mitchell. Blake Russell to the line for 2 free throws. [Team fouls: 3] (Tobias Mitchell: 1 personal fouls)   FT 1/2: GOOD   FT 2/2: GOOD Blake Russell makes 2/2 from the line.
Score: 37-35

[04:18] Team_076 possession (Score: 37-35)
Cade Barnes throws a bad pass! Stolen by Luka Brogdon! TURNOVER! (live ball)

[04:04] Team_054 possession (Score: 37-35)
Blake Russell drives, Cade Barnes stays with him. Blake Russell attempts a Dunk. Contested by Cade Barnes (5.9 feet, ZONE). BLAKE RUSSELL MAKES IT! Assist: Lauri Irving
Score: 37-37

[03:54] Team_076 possession (Score: 37-37)
D'Angelo Tatum drives and kicks out. Tobias Mitchell attempts a 3Pt. Wide open! Malcolm Harden is 7.2 feet away. [ZONE] Tobias Mitchell misses. Offensive rebound by Cade Barnes! Cade Barnes kicks it out.

[03:43] Team_076 possession (Score: 37-37)
Dejounte LaVine attempts a Midrange. Wide open! Malcolm Harden is 7.0 feet away. [MAN] Dejounte LaVine misses. Rebound secured by Vince Ball.

[03:28] Team_054 possession (Score: 37-37)
Luka Brogdon attempts a 3Pt. Contested by Cade Barnes (4.2 feet, MAN). LUKA BROGDON MAKES IT! Assist: Lauri Irving
Score: 37-40

[03:15] Team_076 possession (Score: 37-40)
Dejounte LaVine attempts a Midrange. Contested by Malcolm Harden (2.6 feet, MAN). Dejounte LaVine misses. Rebound secured by Blake Russell.

[03:05] Team_054 possession (Score: 37-40)
Lauri Irving attempts a Layup. Wide open! Tobias Mitchell is 6.2 feet away. [MAN] LAURI IRVING MAKES IT!
Score: 37-42

[02:52] Team_076 possession (Score: 37-42)
D'Angelo Tatum attempts a Midrange. Contested by Blake Russell (5.8 feet, MAN). D'Angelo Tatum misses. Rebound secured by Luka Brogdon.

[02:39] Team_054 possession (Score: 37-42)
FOUL! Holding foul on Dejounte LaVine. [Team fouls: 4] No free throws, side out. (Dejounte LaVine: 2 personal fouls)

[02:27] Team_054 possession (Score: 37-42)
Lauri Irving attempts a 3Pt. Contested by Cade Barnes (4.5 feet, ZONE). LAURI IRVING MAKES IT!
Score: 37-45

[02:11] Team_076 possession (Score: 37-45)
Tobias Mitchell attempts a 3Pt. Contested by Lauri Irving (5.0 feet, MAN). Tobias Mitchell misses. Offensive rebound by D'Angelo Tatum! D'Angelo Tatum kicks it out.

[01:58] Team_076 possession (Score: 37-45)
Cade Barnes attempts a 3Pt. Wide open! Lauri Irving is 7.9 feet away. [ZONE] CADE BARNES MAKES IT! Assist: Paul Leonard
Score: 40-45

[01:40] Team_054 possession (Score: 40-45)
Vince Ball attempts a 3Pt. Wide open! Cade Barnes is 6.8 feet away. [ZONE] VINCE BALL MAKES IT! Assist: Malcolm Harden
Score: 40-48

[01:23] Team_076 possession (Score: 40-48)
Cade Barnes drives to the basket... Cade Barnes loses control! Ball rolls out of bounds! TURNOVER! (dead ball)

[01:23] Substitution (Team_076): Dejounte LaVine OUT → Pascal Lowry IN (stamina_rule2)

[01:23] Substitution (Team_076): Tobias Mitchell OUT → Jalen Poole IN (stamina_rule2)

[01:23] Substitution (Team_076): Paul Leonard OUT → Vince Lowry IN (stamina_rule2)

[01:23] Substitution (Team_076): Cade Barnes OUT → Kevin Nowitzki IN (stamina_rule2)

[01:23] Substitution (Team_076): D'Angelo Tatum OUT → Jordan Doncic IN (stamina_rule2)

[01:23] Substitution (Team_054): Malcolm Harden OUT → Shaquille Irving IN (stamina_rule2)

[01:23] Substitution (Team_054): Lauri Irving OUT → Bradley Quickley IN (stamina_rule2)

[01:23] Substitution (Team_054): Vince Ball OUT → Vince James IN (stamina_rule2)

[01:23] Substitution (Team_054): Luka Brogdon OUT → Tobias Nowitzki IN (stamina_rule2)

[01:23] Substitution (Team_054): Blake Russell OUT → Devin Jackson IN (stamina_rule2)

[01:07] Team_054 possession (Score: 40-48)
Tobias Nowitzki attempts a Midrange. Contested by Kevin Nowitzki (5.3 feet, ZONE). TOBIAS NOWITZKI MAKES IT! Assist: Shaquille Irving
Score: 40-50

[00:55] Team_076 possession (Score: 40-50)
Vince Lowry attempts a 3Pt. Contested by Vince James (4.6 feet, MAN). Vince Lowry misses. FOUL! Loose ball foul on Vince James during the rebound battle. [Team fouls: 2] No free throws, side out. (Vince James: 1 personal fouls)

[00:43] Team_076 possession (Score: 40-50)
Jalen Poole drives, picks up Bradley Quickley. Help arrives from Vince James! Jalen Poole attempts a Layup. Contested by Vince James (4.4 feet, MAN). Jalen Poole misses. Rebound secured by Tobias Nowitzki.

[00:30] Team_054 possession (Score: 40-50)
Devin Jackson attempts a Layup. Contested by Jordan Doncic (3.4 feet, ZONE). DEVIN JACKSON MAKES IT! Assist: Shaquille Irving
Score: 40-52

[00:16] Team_076 possession (Score: 40-52)
Vince Lowry drives and kicks out. Pascal Lowry attempts a 3Pt. Contested by Bradley Quickley (5.9 feet, ZONE). PASCAL LOWRY MAKES IT! Assist: Kevin Nowitzki
Score: 43-52

[00:05] Team_054 possession (Score: 43-52)
Vince James drives and kicks out. FOUL! Shooting foul on Vince Lowry. Tobias Nowitzki to the line for 3 free throws. [BONUS: 5 team fouls] (Vince Lowry: 1 personal fouls)   FT 1/3: MISS   FT 2/3: GOOD   FT 3/3: GOOD Tobias Nowitzki makes 2/3 from the line.
Score: 43-54

================================================================================
                              2ND QUARTER COMPLETE                              
================================================================================

2ND QUARTER SCORE: Team_076 29, Team_054 30

BOX SCORE:
================================================================================

Team_076
--------------------------------------------------------------------------------
Player                MIN  PTS  REB  AST  TO      FG   FG%      3P   3P%
--------------------------------------------------------------------------------
Dejounte LaVine        23    8    0    1   0   3/6    50.0     0/0   0.0
Tobias Mitchell        23    7    3    2   0   3/4    75.0     0/0   0.0
Cade Barnes            23    5    5    2   0   2/2   100.0     0/0   0.0
Paul Leonard           23    4    0    2   0   2/2   100.0     0/0   0.0
Pascal Lowry            1    3    0    0   0   1/1   100.0     0/0   0.0
D'Angelo Tatum         23    2    6    0   0   1/2    50.0     0/0   0.0
Jordan Doncic           1    0    1    0   0   0/0     0.0     0/0   0.0
Jalen Poole             1    0    0    0   0   0/1     0.0     0/0   0.0
Kevin Nowitzki          1    0    0    1   0   0/0     0.0     0/0   0.0

TEAM: FG: 12/18 (66.7%), 3PT: 4/5 (80.0%), REB: 15 (7 off, 8 def), AST: 8, TO: 3
TEAM FOULS: 5 [Team_054 in BONUS]


Team_054
--------------------------------------------------------------------------------
Player                MIN  PTS  REB  AST  TO      FG   FG%      3P   3P%
--------------------------------------------------------------------------------
Vince Ball             23    7    1    1   0   3/4    75.0     0/0   0.0
Lauri Irving           23    5    0    3   0   2/3    66.7     0/0   0.0
Luka Brogdon           23    5    2    0   0   2/5    40.0     0/0   0.0
Blake Russell          23    4    2    2   0   2/4    50.0     0/0   0.0
Tobias Nowitzki         1    4    1    0   0   2/2   100.0     0/0   0.0
Malcolm Harden         23    3    0    1   0   1/2    50.0     0/0   0.0
Devin Jackson           1    2    0    0   0   1/1   100.0     0/0   0.0
Shaquille Irving        1    0    0    2   0   0/0     0.0     0/0   0.0

TEAM: FG: 13/21 (61.9%), 3PT: 4/10 (40.0%), REB: 6 (0 off, 6 def), AST: 9, TO: 0
TEAM FOULS: 2

================================================================================

================================================================================
                       3RD QUARTER - Team_076 vs Team_054                       
================================================================================

[12:00] Team_076 possession (Score: 43-54)
Dejounte LaVine attempts a 3Pt. Contested by Malcolm Harden (3.1 feet, MAN). DEJOUNTE LAVINE MAKES IT! Assist: D'Angelo Tatum
Score: 46-54

[11:48] Team_054 possession (Score: 46-54)
Lauri Irving makes the Layup and draws the foul on Cade Barnes! And-1! Lauri Irving to the line for 1. [Team fouls: 1] (Cade Barnes: 1 personal fouls)   FT 1/1: MISS Lauri Irving makes 0/1 from the line. Rebound secured by Tobias Mitchell.
Score: 46-56

[11:37] Team_076 possession (Score: 46-56)
Paul Leonard makes the Layup and draws the foul on Blake Russell! And-1! Paul Leonard to the line for 1. [Team fouls: 1] (Blake Russell: 1 personal fouls)   FT 1/1: GOOD Paul Leonard makes 1/1 from the line.
Score: 49-56

[11:21] Team_054 possession (Score: 49-56)
Vince Ball attempts a Layup. Contested by Paul Leonard (4.1 feet, MAN). VINCE BALL MAKES IT! Assist: Lauri Irving
Score: 49-58

[11:09] Team_076 possession (Score: 49-58)
Cade Barnes drives, Blake Russell stays with him. Cade Barnes attempts a Layup. Wide open! Blake Russell is 7.2 feet away. [ZONE] CADE BARNES MAKES IT!
Score: 51-58

[10:54] Team_054 possession (Score: 51-58)
Lauri Irving drives, picks up Tobias Mitchell. Help arrives from Dejounte LaVine! Lauri Irving attempts a Dunk. Contested by Dejounte LaVine (3.1 feet, MAN). Lauri Irving misses. Offensive rebound by Luka Brogdon! Luka Brogdon kicks it out.

[10:36] Team_054 possession (Score: 51-58)
Luka Brogdon attempts a 3Pt. Contested by Cade Barnes (3.2 feet, ZONE). Luka Brogdon misses. Rebound secured by Cade Barnes.

[10:23] Team_076 possession (Score: 51-58)
Dejounte LaVine attempts a Midrange. Contested by Malcolm Harden (2.2 feet, MAN). Dejounte LaVine misses. Offensive rebound by D'Angelo Tatum! D'Angelo Tatum kicks it out.

[10:08] Team_076 possession (Score: 51-58)
Paul Leonard drives, picks up Blake Russell. Help arrives from Lauri Irving! Paul Leonard attempts a Layup. Heavily contested by Lauri Irving (1.9 feet, ZONE)! Paul Leonard misses. Offensive rebound by D'Angelo Tatum! D'Angelo Tatum kicks it out.

[09:53] Team_076 possession (Score: 51-58)
Tobias Mitchell attempts a 3Pt. Contested by Lauri Irving (3.1 feet, MAN). TOBIAS MITCHELL MAKES IT! Assist: Cade Barnes
Score: 54-58

[09:40] Team_054 possession (Score: 54-58)
Lauri Irving commits a violation (traveling/carry)! TURNOVER! (dead ball)

[09:28] Team_076 possession (Score: 54-58)
Dejounte LaVine drives to the basket... FOUL! Offensive foul on Dejounte LaVine! Malcolm Harden drew the charge! [Team fouls: 2] (Dejounte LaVine: 1 personal fouls) TURNOVER! (dead ball)

[09:09] Team_054 possession (Score: 54-58)
Luka Brogdon attempts a Midrange. Contested by D'Angelo Tatum (4.1 feet, ZONE). Luka Brogdon misses. Rebound secured by D'Angelo Tatum.

[08:58] Team_076 possession (Score: 54-58)
Dejounte LaVine attempts a Layup. Wide open! Malcolm Harden is 6.3 feet away. [MAN] DEJOUNTE LAVINE MAKES IT! Assist: Tobias Mitchell
Score: 56-58

[08:45] Team_054 possession (Score: 56-58)
Lauri Irving drives and kicks out. Blake Russell attempts a 3Pt. Wide open! D'Angelo Tatum is 6.9 feet away. [MAN] Blake Russell misses. Rebound secured by Cade Barnes.

[08:32] Team_076 possession (Score: 56-58)
Paul Leonard attempts a Layup. Contested by Vince Ball (4.8 feet, MAN). Paul Leonard misses. Rebound secured by Blake Russell.

[08:18] Team_054 possession (Score: 56-58)
Lauri Irving attempts a 3Pt. Contested by Tobias Mitchell (2.8 feet, MAN). LAURI IRVING MAKES IT! Assist: Blake Russell
Score: 56-61

[08:02] Team_076 possession (Score: 56-61)
FOUL! Shooting foul on Malcolm Harden. D'Angelo Tatum to the line for 2 free throws. [Team fouls: 2] (Malcolm Harden: 1 personal fouls)   FT 1/2: GOOD   FT 2/2: GOOD D'Angelo Tatum makes 2/2 from the line.
Score: 58-61

[07:48] Team_054 possession (Score: 58-61)
Luka Brogdon attempts a 3Pt. Heavily contested by Cade Barnes (0.5 feet, ZONE)! Luka Brogdon misses. Rebound secured by Tobias Mitchell.

[07:36] Team_076 possession (Score: 58-61)
Dejounte LaVine attempts a 3Pt. Contested by Lauri Irving (2.1 feet, ZONE). Dejounte LaVine misses. Rebound secured by Blake Russell.

[07:18] Team_054 possession (Score: 58-61)
Vince Ball drives, picks up Paul Leonard. Help arrives from Tobias Mitchell! Vince Ball attempts a Layup. Wide open! Tobias Mitchell is 6.8 feet away. [MAN] VINCE BALL MAKES IT!
Score: 58-63

[07:03] Team_076 possession (Score: 58-63)
Tobias Mitchell attempts a 3Pt. Wide open! Lauri Irving is 6.3 feet away. [MAN] TOBIAS MITCHELL MAKES IT! Assist: D'Angelo Tatum
Score: 61-63

[06:49] Team_054 possession (Score: 61-63)
Vince Ball drives, Cade Barnes stays with him. Vince Ball attempts a Dunk. Contested by Cade Barnes (4.7 feet, ZONE). Vince Ball misses. Offensive rebound by Blake Russell! Blake Russell puts it back in!
Score: 61-65

[06:35] Team_076 possession (Score: 61-65)
D'Angelo Tatum drives and kicks out. Paul Leonard attempts a 3Pt. Contested by Luka Brogdon (2.0 feet, ZONE). PAUL LEONARD MAKES IT! Assist: Dejounte LaVine
Score: 64-65

[06:25] Team_054 possession (Score: 64-65)
Luka Brogdon drives, Cade Barnes stays with him. Luka Brogdon attempts a Dunk. Heavily contested by Cade Barnes (1.6 feet, ZONE)! Luka Brogdon misses. Rebound secured by D'Angelo Tatum.

[06:09] Team_076 possession (Score: 64-65)
Cade Barnes attempts a Midrange. Wide open! Luka Brogdon is 7.6 feet away. [MAN] Cade Barnes misses. Offensive rebound by D'Angelo Tatum! D'Angelo Tatum kicks it out.

[05:56] Team_076 possession (Score: 64-65)
Cade Barnes attempts a Layup. Heavily contested by Luka Brogdon (1.8 feet, MAN)! CADE BARNES MAKES IT! Assist: D'Angelo Tatum
Score: 66-65

[05:41] Team_054 possession (Score: 66-65)
Luka Brogdon attempts a Layup. Contested by Cade Barnes (3.7 feet, ZONE). LUKA BROGDON MAKES IT! Assist: Malcolm Harden
Score: 66-67

[05:25] Team_076 possession (Score: 66-67)
Paul Leonard drives, Blake Russell stays with him. Paul Leonard attempts a Layup. Contested by Blake Russell (5.8 feet, ZONE). Paul Leonard misses. Rebound secured by Luka Brogdon.

[05:10] Team_054 possession (Score: 66-67)
Lauri Irving makes the Layup and draws the foul on Cade Barnes! And-1! Lauri Irving to the line for 1. [Team fouls: 3] (Cade Barnes: 2 personal fouls)   FT 1/1: GOOD Lauri Irving makes 1/1 from the line.
Score: 66-70

[04:54] Team_076 possession (Score: 66-70)
Dejounte LaVine attempts a 3Pt. Contested by Lauri Irving (3.4 feet, ZONE). Dejounte LaVine misses. Rebound secured by Blake Russell.

[04:43] Team_054 possession (Score: 66-70)
Lauri Irving drives, picks up Tobias Mitchell. Help arrives from Dejounte LaVine! Lauri Irving attempts a Dunk. Contested by Dejounte LaVine (5.7 feet, MAN). Lauri Irving misses. Rebound secured by D'Angelo Tatum.

[04:31] Team_076 possession (Score: 66-70)
Paul Leonard drives to the basket... Paul Leonard loses the ball! Stripped by Vince Ball! TURNOVER! (live ball)

[04:15] Team_054 possession (Score: 66-70)
Lauri Irving drives and kicks out. Lauri Irving attempts a Midrange. Contested by Tobias Mitchell (4.6 feet, MAN). LAURI IRVING MAKES IT! Assist: Blake Russell
Score: 66-72

[04:01] Team_076 possession (Score: 66-72)
Tobias Mitchell attempts a 3Pt. Contested by Lauri Irving (2.9 feet, MAN). Tobias Mitchell misses. Rebound secured by Vince Ball.

[03:43] Team_054 possession (Score: 66-72)
FOUL! Reach-in foul on Paul Leonard during the drive. [Team fouls: 4] No free throws, side out. (Paul Leonard: 1 personal fouls)

[03:29] Team_054 possession (Score: 66-72)
Vince Ball attempts a 3Pt. Wide open! Cade Barnes is 7.1 feet away. [ZONE] VINCE BALL MAKES IT! Assist: Blake Russell
Score: 66-75

[03:19] Team_076 possession (Score: 66-75)
D'Angelo Tatum makes the Layup and draws the foul on Lauri Irving! And-1! D'Angelo Tatum to the line for 1. [Team fouls: 3] (Lauri Irving: 1 personal fouls)   FT 1/1: GOOD D'Angelo Tatum makes 1/1 from the line.
Score: 69-75

[03:04] Team_054 possession (Score: 69-75)
Blake Russell attempts a Midrange. Wide open! D'Angelo Tatum is 8.1 feet away. [MAN] BLAKE RUSSELL MAKES IT!
Score: 69-77

[02:47] Team_076 possession (Score: 69-77)
Dejounte LaVine attempts a 3Pt. Contested by Lauri Irving (3.4 feet, ZONE). Dejounte LaVine misses. Rebound secured by Blake Russell.

[02:30] Team_054 possession (Score: 69-77)
Malcolm Harden attempts a Midrange. Contested by Dejounte LaVine (2.9 feet, MAN). MALCOLM HARDEN MAKES IT! Assist: Lauri Irving
Score: 69-79

[02:15] Team_076 possession (Score: 69-79)
D'Angelo Tatum attempts a 3Pt. Contested by Blake Russell (2.3 feet, MAN). D'Angelo Tatum misses. Offensive rebound by D'Angelo Tatum! D'Angelo Tatum kicks it out.

[02:02] Team_076 possession (Score: 69-79)
Dejounte LaVine drives, picks up Malcolm Harden. Help arrives from Lauri Irving! Dejounte LaVine attempts a Layup. Contested by Lauri Irving (2.8 feet, MAN). Dejounte LaVine misses. Offensive rebound by Cade Barnes! Cade Barnes kicks it out.

[01:44] Team_076 possession (Score: 69-79)
D'Angelo Tatum attempts a 3Pt. Contested by Lauri Irving (5.4 feet, ZONE). D'Angelo Tatum misses. Rebound secured by Vince Ball.

[01:30] Team_054 possession (Score: 69-79)
FOUL! Reach-in foul on Cade Barnes during the drive. [IN THE BONUS! 5 team fouls] Vince Ball to the line for 2 free throws. (Cade Barnes: 3 personal fouls)   FT 1/2: GOOD   FT 2/2: GOOD Vince Ball makes 2/2 from the line.
Score: 69-81

[01:15] Team_076 possession (Score: 69-81)
Tobias Mitchell attempts a 3Pt. Contested by Lauri Irving (3.8 feet, ZONE). Tobias Mitchell misses. Offensive rebound by D'Angelo Tatum! D'Angelo Tatum kicks it out.

[01:02] Team_076 possession (Score: 69-81)
Dejounte LaVine attempts a Midrange. Wide open! Lauri Irving is 7.6 feet away. [ZONE] DEJOUNTE LAVINE MAKES IT! Assist: Tobias Mitchell
Score: 71-81

[00:45] Team_054 possession (Score: 71-81)
FOUL! Holding foul on Paul Leonard. [IN THE BONUS! 6 team fouls] Vince Ball to the line for 2 free throws. (Paul Leonard: 2 personal fouls)   FT 1/2: GOOD   FT 2/2: GOOD Vince Ball makes 2/2 from the line.
Score: 71-83

[00:29] Team_076 possession (Score: 71-83)
Tobias Mitchell attempts a Midrange. Contested by Vince Ball (4.1 feet, ZONE). Tobias Mitchell misses. Rebound secured by Luka Brogdon.

[00:14] Team_054 possession (Score: 71-83)
Malcolm Harden attempts a Midrange. Contested by Paul Leonard (3.8 feet, ZONE). Malcolm Harden misses. Rebound secured by Tobias Mitchell.

[00:01] Team_076 possession (Score: 71-83)
Paul Leonard attempts a Layup. Wide open! Vince Ball is 7.2 feet away. [MAN] Paul Leonard misses. Rebound secured by Blake Russell.

================================================================================
                              3RD QUARTER COMPLETE                              
================================================================================

3RD QUARTER SCORE: Team_076 28, Team_054 29

BOX SCORE:
================================================================================

Team_076
--------------------------------------------------------------------------------
Player                MIN  PTS  REB  AST  TO      FG   FG%      3P   3P%
--------------------------------------------------------------------------------
Dejounte LaVine        35    7    0    1   0   3/6    50.0     0/0   0.0
Tobias Mitchell        35    6    3    2   0   2/4    50.0     0/0   0.0
Paul Leonard           35    6    0    0   0   2/5    40.0     0/0   0.0
D'Angelo Tatum         35    5    8    3   0   2/3    66.7     0/0   0.0
Cade Barnes            35    4    3    1   0   2/2   100.0     0/0   0.0

TEAM: FG: 11/20 (55.0%), 3PT: 3/8 (37.5%), REB: 14 (6 off, 8 def), AST: 7, TO: 2
TEAM FOULS: 6 [Team_054 in BONUS]


Team_054
--------------------------------------------------------------------------------
Player                MIN  PTS  REB  AST  TO      FG   FG%      3P   3P%
--------------------------------------------------------------------------------
Vince Ball             35   11    2    0   0   5/5   100.0     0/0   0.0
Lauri Irving           35    8    0    2   0   3/6    50.0     0/0   0.0
Blake Russell          35    4    6    3   0   2/2   100.0     0/0   0.0
Luka Brogdon           35    2    3    0   0   1/5    20.0     0/0   0.0
Malcolm Harden         35    2    0    1   0   1/2    50.0     0/0   0.0

TEAM: FG: 12/20 (60.0%), 3PT: 2/4 (50.0%), REB: 11 (2 off, 9 def), AST: 6, TO: 1
TEAM FOULS: 3

================================================================================

================================================================================
                       4TH QUARTER - Team_076 vs Team_054                       
================================================================================

[12:00] Substitution (Team_076): Dejounte LaVine OUT (stamina: 68) → Pascal Lowry IN (comeback_detected)

[12:00] Substitution (Team_054): Malcolm Harden OUT (stamina: 69) → Shaquille Irving IN (comeback_detected)

[12:00] Team_076 possession (Score: 71-83)
Pascal Lowry attempts a Midrange. Contested by Shaquille Irving (5.7 feet, MAN). PASCAL LOWRY MAKES IT! Assist: Paul Leonard
Score: 73-83

[11:43] Team_054 possession (Score: 73-83)
FOUL! Shooting foul on D'Angelo Tatum. Blake Russell to the line for 2 free throws. [Team fouls: 1] (D'Angelo Tatum: 1 personal fouls)   FT 1/2: GOOD   FT 2/2: MISS Blake Russell makes 1/2 from the line. Rebound secured by D'Angelo Tatum.
Score: 73-84

[11:27] Team_076 possession (Score: 73-84)
Paul Leonard attempts a 3Pt. Wide open! Vince Ball is 6.8 feet away. [MAN] Paul Leonard misses. Rebound secured by Luka Brogdon.

[11:14] Team_054 possession (Score: 73-84)
Vince Ball attempts a 3Pt. Wide open! Paul Leonard is 6.8 feet away. [MAN] Vince Ball misses. Rebound secured by D'Angelo Tatum.

[10:59] Team_076 possession (Score: 73-84)
FOUL! Shooting foul on Luka Brogdon. Cade Barnes to the line for 2 free throws. [Team fouls: 1] (Luka Brogdon: 1 personal fouls)   FT 1/2: MISS   FT 2/2: GOOD Cade Barnes makes 1/2 from the line.
Score: 74-84

[10:42] Team_054 possession (Score: 74-84)
Vince Ball attempts a Midrange. Contested by Paul Leonard (3.3 feet, MAN). Vince Ball misses. Rebound secured by Cade Barnes.

[10:31] Team_076 possession (Score: 74-84)
Pascal Lowry attempts a Midrange. Heavily contested by Shaquille Irving (0.9 feet, MAN)! PASCAL LOWRY MAKES IT! Assist: Cade Barnes
Score: 76-84

[10:17] Team_054 possession (Score: 76-84)
Luka Brogdon attempts a 3Pt. Wide open! Cade Barnes is 7.1 feet away. [ZONE] LUKA BROGDON MAKES IT! Assist: Shaquille Irving
Score: 76-87

[10:02] Team_076 possession (Score: 76-87)
FOUL! Shooting foul on Lauri Irving. D'Angelo Tatum to the line for 2 free throws. [Team fouls: 2] (Lauri Irving: 1 personal fouls)   FT 1/2: MISS   FT 2/2: GOOD D'Angelo Tatum makes 1/2 from the line.
Score: 77-87

[09:49] Team_054 possession (Score: 77-87)
Luka Brogdon attempts a Midrange. Contested by Cade Barnes (4.3 feet, ZONE). Luka Brogdon misses. Offensive rebound by Luka Brogdon! Luka Brogdon kicks it out.

[09:35] Team_054 possession (Score: 77-87)
Luka Brogdon makes the Midrange and draws the foul on Cade Barnes! And-1! Luka Brogdon to the line for 1. [Team fouls: 2] (Cade Barnes: 1 personal fouls)   FT 1/1: GOOD Luka Brogdon makes 1/1 from the line.
Score: 77-90

[09:20] Team_076 possession (Score: 77-90)
D'Angelo Tatum drives and kicks out. Tobias Mitchell attempts a Midrange. Contested by Lauri Irving (4.7 feet, MAN). TOBIAS MITCHELL MAKES IT!
Score: 79-90

[09:10] Team_054 possession (Score: 79-90)
Vince Ball attempts a 3Pt. Contested by Cade Barnes (4.0 feet, ZONE). Vince Ball misses. Rebound secured by D'Angelo Tatum.

[08:55] Team_076 possession (Score: 79-90)
Paul Leonard attempts a 3Pt. Wide open! Vince Ball is 6.1 feet away. [MAN] Paul Leonard misses. Rebound secured by Luka Brogdon.

[08:40] Team_054 possession (Score: 79-90)
Shaquille Irving drives and kicks out. Lauri Irving attempts a 3Pt. Contested by Paul Leonard (4.4 feet, ZONE). LAURI IRVING MAKES IT! Assist: Vince Ball
Score: 79-93

[08:25] Team_076 possession (Score: 79-93)
FOUL! Reach-in foul on Blake Russell during the drive. [Team fouls: 3] No free throws, side out. (Blake Russell: 1 personal fouls)

[08:11] Team_076 possession (Score: 79-93)
Tobias Mitchell drives and kicks out. Cade Barnes attempts a Midrange. Contested by Luka Brogdon (4.4 feet, MAN). CADE BARNES MAKES IT!
Score: 81-93

[07:54] Team_054 possession (Score: 81-93)
Lauri Irving attempts a 3Pt. Contested by Cade Barnes (5.6 feet, ZONE). LAURI IRVING MAKES IT! Assist: Luka Brogdon
Score: 81-96

[07:40] Team_076 possession (Score: 81-96)
Pascal Lowry drives and kicks out. D'Angelo Tatum attempts a 3Pt. Contested by Shaquille Irving (5.8 feet, ZONE). D'Angelo Tatum misses. Rebound secured by Blake Russell.

[07:29] Team_054 possession (Score: 81-96)
Blake Russell drives and kicks out. Shaquille Irving attempts a Midrange. Contested by Cade Barnes (4.4 feet, ZONE). Shaquille Irving misses. Rebound secured by Cade Barnes.

[07:14] Team_076 possession (Score: 81-96)
Pascal Lowry drives and kicks out. Pascal Lowry attempts a Midrange. Wide open! Shaquille Irving is 7.5 feet away. [ZONE] PASCAL LOWRY MAKES IT! Assist: Tobias Mitchell
Score: 83-96

[07:00] Team_054 possession (Score: 83-96)
Blake Russell makes the Layup and draws the foul on Tobias Mitchell! And-1! Blake Russell to the line for 1. [Team fouls: 3] (Tobias Mitchell: 1 personal fouls)   FT 1/1: MISS Blake Russell makes 0/1 from the line. Rebound secured by Cade Barnes.
Score: 83-98

[06:44] Team_076 possession (Score: 83-98)
D'Angelo Tatum drives, Blake Russell stays with him. D'Angelo Tatum attempts a Layup. Wide open! Blake Russell is 8.7 feet away. [MAN] D'Angelo Tatum misses. Rebound secured by Blake Russell.

[06:26] Team_054 possession (Score: 83-98)
Lauri Irving attempts a Midrange. Contested by Tobias Mitchell (4.3 feet, MAN). LAURI IRVING MAKES IT!
Score: 83-100

[06:16] Team_076 possession (Score: 83-100)
Pascal Lowry attempts a 3Pt. Contested by Shaquille Irving (6.0 feet, MAN). Pascal Lowry misses. Offensive rebound by Cade Barnes! Cade Barnes kicks it out.

[06:00] Team_076 possession (Score: 83-100)
Cade Barnes attempts a 3Pt. Contested by Shaquille Irving (5.0 feet, ZONE). Cade Barnes misses. Rebound secured by Vince Ball.

[05:41] Team_054 possession (Score: 83-100)
Shaquille Irving throws a bad pass out of bounds! TURNOVER! (dead ball)

[05:41] Substitution (Team_076): Tobias Mitchell OUT → Jalen Poole IN (stamina_rule2)

[05:41] Substitution (Team_076): Paul Leonard OUT → Vince Lowry IN (stamina_rule2)

[05:41] Substitution (Team_076): Cade Barnes OUT → Kevin Nowitzki IN (stamina_rule2)

[05:41] Substitution (Team_076): D'Angelo Tatum OUT → Jordan Doncic IN (stamina_rule2)

[05:41] Substitution (Team_054): Lauri Irving OUT → Bradley Quickley IN (stamina_rule2)

[05:41] Substitution (Team_054): Vince Ball OUT → Vince James IN (stamina_rule2)

[05:41] Substitution (Team_054): Luka Brogdon OUT → Tobias Nowitzki IN (stamina_rule2)

[05:41] Substitution (Team_054): Blake Russell OUT → Devin Jackson IN (stamina_rule2)

[05:30] Team_076 possession (Score: 83-100)
Pascal Lowry attempts a 3Pt. Wide open! Shaquille Irving is 6.8 feet away. [ZONE] Pascal Lowry misses. FOUL! Loose ball foul on Devin Jackson during the rebound battle. [Team fouls: 4] No free throws, side out. (Devin Jackson: 1 personal fouls)

[05:16] Team_076 possession (Score: 83-100)
Jalen Poole attempts a Layup. Wide open! Devin Jackson is 6.0 feet away. [ZONE] Jalen Poole misses. Rebound secured by Vince James.

[04:58] Team_054 possession (Score: 83-100)
Tobias Nowitzki attempts a Layup. Wide open! Kevin Nowitzki is 7.0 feet away. [MAN] TOBIAS NOWITZKI MAKES IT! Assist: Shaquille Irving
Score: 83-102

[04:43] Team_076 possession (Score: 83-102)
Jalen Poole drives, picks up Devin Jackson. Help arrives from Bradley Quickley! Jalen Poole attempts a Layup. Wide open! Bradley Quickley is 8.3 feet away. [ZONE] JALEN POOLE MAKES IT! Assist: Pascal Lowry
Score: 85-102

[04:27] Team_054 possession (Score: 85-102)
Devin Jackson attempts a Layup. Contested by Jordan Doncic (2.1 feet, MAN). DEVIN JACKSON MAKES IT! Assist: Bradley Quickley
Score: 85-104

[04:10] Team_076 possession (Score: 85-104)
Kevin Nowitzki drives to the basket... Kevin Nowitzki throws a bad pass! Stolen by Devin Jackson! TURNOVER! (live ball)

[03:56] Team_054 possession (Score: 85-104)
Bradley Quickley attempts a 3Pt. Contested by Vince Lowry (4.6 feet, ZONE). Bradley Quickley misses. Rebound secured by Vince Lowry.

[03:42] Team_076 possession (Score: 85-104)
FOUL! Reach-in foul on Devin Jackson during the drive. [IN THE BONUS! 5 team fouls] Jordan Doncic to the line for 2 free throws. (Devin Jackson: 2 personal fouls)   FT 1/2: GOOD   FT 2/2: GOOD Jordan Doncic makes 2/2 from the line.
Score: 87-104

[03:30] Team_054 possession (Score: 87-104)
Shaquille Irving attempts a Midrange. Contested by Kevin Nowitzki (5.8 feet, ZONE). SHAQUILLE IRVING MAKES IT!
Score: 87-106

[03:11] Team_076 possession (Score: 87-106)
Jalen Poole attempts a 3Pt. Contested by Bradley Quickley (2.8 feet, MAN). Jalen Poole misses. Rebound secured by Tobias Nowitzki.

[02:59] Team_054 possession (Score: 87-106)
FOUL! Holding foul on Jordan Doncic. [Team fouls: 4] No free throws, side out. (Jordan Doncic: 1 personal fouls)

[02:41] Team_054 possession (Score: 87-106)
Shaquille Irving attempts a 3Pt. Wide open! Pascal Lowry is 9.2 feet away. [MAN] Shaquille Irving misses. Rebound secured by Vince Lowry.

[02:27] Team_076 possession (Score: 87-106)
Pascal Lowry attempts a 3Pt. Contested by Shaquille Irving (3.5 feet, ZONE). PASCAL LOWRY MAKES IT! Assist: Kevin Nowitzki
Score: 90-106

[02:13] Team_054 possession (Score: 90-106)
Devin Jackson attempts a Layup. BLOCKED BY JORDAN DONCIC! Ball is loose! Rebound secured by Kevin Nowitzki.

[01:59] Team_076 possession (Score: 90-106)
Vince Lowry drives and kicks out. Kevin Nowitzki attempts a 3Pt. Contested by Shaquille Irving (2.9 feet, ZONE). Kevin Nowitzki misses. Rebound secured by Vince James.

[01:44] Team_054 possession (Score: 90-106)
Devin Jackson attempts a Layup. BLOCKED BY JORDAN DONCIC! Ball goes out off Jordan Doncic. Devin Jackson's ball!

[01:29] Team_054 possession (Score: 90-106)
Devin Jackson drives, Jordan Doncic stays with him. Devin Jackson attempts a Layup. Contested by Jordan Doncic (4.9 feet, ZONE). DEVIN JACKSON MAKES IT! Assist: Shaquille Irving
Score: 90-108

[01:18] Team_076 possession (Score: 90-108)
Jalen Poole makes the Layup and draws the foul on Devin Jackson! And-1! Jalen Poole to the line for 1. [BONUS: 6 team fouls] (Devin Jackson: 3 personal fouls)   FT 1/1: MISS Jalen Poole makes 0/1 from the line. Offensive rebound by Jordan Doncic! Jordan Doncic kicks it out.
Score: 92-108

[01:05] Team_076 possession (Score: 92-108)
Jordan Doncic drives, Devin Jackson stays with him. Jordan Doncic attempts a Layup. Contested by Devin Jackson (4.4 feet, ZONE). Jordan Doncic misses. FOUL! Loose ball foul on Vince James during the rebound battle. [IN THE BONUS! 7 team fouls] Kevin Nowitzki to the line for 2 free throws. (Vince James: 1 personal fouls)   FT 1/2: GOOD   FT 2/2: GOOD Kevin Nowitzki makes 2/2 from the line.
Score: 94-108

[00:55] Team_054 possession (Score: 94-108)
Devin Jackson drives and kicks out. Tobias Nowitzki attempts a 3Pt. Contested by Kevin Nowitzki (4.1 feet, MAN). Tobias Nowitzki misses. Rebound secured by Vince Lowry.

[00:42] Team_076 possession (Score: 94-108)
Vince Lowry attempts a 3Pt. Contested by Shaquille Irving (2.6 feet, ZONE). Vince Lowry misses. Rebound secured by Vince James.

[00:27] Team_054 possession (Score: 94-108)
Bradley Quickley attempts a Midrange. Contested by Vince Lowry (5.5 feet, ZONE). Bradley Quickley misses. Offensive rebound by Vince James! Vince James kicks it out.

[00:10] Team_054 possession (Score: 94-108)
Devin Jackson attempts a 3Pt. Wide open! Vince Lowry is 6.4 feet away. [ZONE] Devin Jackson misses. Rebound secured by Vince Lowry.

================================================================================
                              4TH QUARTER COMPLETE                              
================================================================================

4TH QUARTER SCORE: Team_076 23, Team_054 25

BOX SCORE:
================================================================================

Team_076
--------------------------------------------------------------------------------
Player                MIN  PTS  REB  AST  TO      FG   FG%      3P   3P%
--------------------------------------------------------------------------------
Pascal Lowry           13    9    0    1   0   4/5    80.0     0/0   0.0
Cade Barnes            42    3    4    1   0   2/3    66.7     0/0   0.0
Tobias Mitchell        42    2    0    1   0   1/1   100.0     0/0   0.0
Kevin Nowitzki          7    2    2    1   0   1/1   100.0     0/0   0.0
Jalen Poole             7    2    0    0   0   1/3    33.3     0/0   0.0
Jordan Doncic           7    2    1    0   0   1/1   100.0     0/0   0.0
D'Angelo Tatum         42    1    3    0   0   1/2    50.0     0/0   0.0
Paul Leonard           42    0    0    1   0   0/2     0.0     0/0   0.0
Vince Lowry             7    0    4    0   0   0/2     0.0     0/0   0.0

TEAM: FG: 11/20 (55.0%), 3PT: 1/6 (16.7%), REB: 14 (3 off, 11 def), AST: 5, TO: 1
TEAM FOULS: 4


Team_054
--------------------------------------------------------------------------------
Player                MIN  PTS  REB  AST  TO      FG   FG%      3P   3P%
--------------------------------------------------------------------------------
Lauri Irving           42    8    0    0   0   3/3   100.0     0/0   0.0
Luka Brogdon           42    6    3    1   0   2/2   100.0     0/0   0.0
Devin Jackson           7    4    0    0   0   2/5    40.0     0/0   0.0
Shaquille Irving       13    2    0    3   0   1/2    50.0     0/0   0.0
Tobias Nowitzki         7    2    1    0   0   1/1   100.0     0/0   0.0
Blake Russell          42    0    2    0   0   0/3     0.0     0/0   0.0
Vince Ball             42    0    1    1   0   0/3     0.0     0/0   0.0
Vince James             7    0    4    0   0   0/0     0.0     0/0   0.0
Bradley Quickley        7    0    0    1   0   0/1     0.0     0/0   0.0

TEAM: FG: 9/20 (45.0%), 3PT: 2/7 (28.6%), REB: 11 (2 off, 9 def), AST: 6, TO: 1
TEAM FOULS: 7 [Team_076 in BONUS]

================================================================================

================================================================================
                               FULL GAME COMPLETE                               
================================================================================

FINAL SCORE: Team_076 94, Team_054 108

SCORING BY QUARTER:
--------------------------------------------------------------------------------
Team                     Q1     Q2     Q3     Q4    FINAL
--------------------------------------------------------------------------------
Team_076                 14     29     28     23       94
Team_054                 24     30     29     25      108
--------------------------------------------------------------------------------

FULL GAME BOX SCORE:
================================================================================

Team_076
--------------------------------------------------------------------------------
Player                MIN  PTS  REB  AST  TO      FG   FG%      3P   3P%      FT STL BLK
--------------------------------------------------------------------------------
Tobias Mitchell        42   18    7    6   2   6/9    66.7   3/5    60.0   0/0     0   0
Paul Leonard           42   16    0    3   1   5/13   38.5   3/8    37.5   2/3     0   0
Cade Barnes            42   17   18    4   2   8/13   61.5   2/3    66.7   1/2     1   1
D'Angelo Tatum         42    8   20    5   1   6/11   54.5   0/1     0.0   4/5     1   0
Dejounte LaVine        35   15    0    3   3   6/13   46.2   3/6    50.0   0/0     0   0
Pascal Lowry           13   12    0    1   1   4/5    80.0   1/1   100.0   0/0     0   0
Jalen Poole             7    2    0    0   0   1/4    25.0   0/1     0.0   0/1     0   0
Vince Lowry             7    0    4    0   0   1/3    33.3   0/1     0.0   0/0     0   0
Kevin Nowitzki          7    2    2    2   0   0/0     0.0   0/0     0.0   2/2     0   0
Jordan Doncic           7    2    2    0   0   2/2   100.0   0/0     0.0   2/2     0   2

TEAM: FG: 39/73 (53.4%), 3PT: 12/26 (46.2%), REB: 53 (22 off, 31 def), AST: 24, TO: 10


Team_054
--------------------------------------------------------------------------------
Player                MIN  PTS  REB  AST  TO      FG   FG%      3P   3P%      FT STL BLK
--------------------------------------------------------------------------------
Lauri Irving           42   23    0    6   1   8/13   61.5   3/4    75.0   1/2     1   0
Vince Ball             42   18    8    6   0   7/14   50.0   2/6    33.3   4/4     1   0
Luka Brogdon           42   19   14    2   0   9/17   52.9   3/6    50.0   2/3     1   0
Blake Russell          42   14   12    5   1   7/12   58.3   0/2     0.0   5/7     1   1
Malcolm Harden         35   15    0    2   2   5/7    71.4   2/3    66.7   2/2     0   0
Shaquille Irving       13    2    0    5   1   2/3    66.7   0/1     0.0   0/0     0   0
Bradley Quickley        7    0    0    1   0   0/1     0.0   0/1     0.0   0/0     0   0
Vince James             7    0    4    0   0   1/1   100.0   0/0     0.0   0/0     0   0
Tobias Nowitzki         7    6    2    0   0   2/2   100.0   0/0     0.0   2/3     0   0
Devin Jackson           7    6    0    0   0   3/6    50.0   0/1     0.0   0/0     1   0

TEAM: FG: 45/77 (58.4%), 3PT: 10/24 (41.7%), REB: 40 (7 off, 33 def), AST: 27, TO: 5

================================================================================
