================================================================================
                        FULL GAME - Team_030 vs Team_039                        
================================================================================

================================================================================
                       1ST QUARTER - Team_030 vs Team_039                       
================================================================================

[12:00] Team_030 possession (Score: 0-0)
FOUL! Reach-in foul on Klay Wade during the drive. [Team fouls: 1] No free throws, side out. (Klay Wade: 1 personal fouls)

[11:48] Team_030 possession (Score: 0-0)
Joel Anunoby drives, picks up Austin O'Neal. Help arrives from Donovan Markkanen! Joel Anunoby attempts a Layup. Contested by Donovan Markkanen (4.8 feet, MAN). JOEL ANUNOBY MAKES IT! Assist: Tim Barrett
Score: 2-0

[11:35] Team_039 possession (Score: 2-0)
FOUL! Shooting foul on Joel Anunoby. Donovan Markkanen to the line for 2 free throws. [Team fouls: 1] (Joel Anunoby: 1 personal fouls)   FT 1/2: GOOD   FT 2/2: GOOD Donovan Markkanen makes 2/2 from the line.
Score: 2-2

[11:18] Team_030 possession (Score: 2-2)
Jordan Nowitzki attempts a Midrange. Contested by Donovan Markkanen (4.5 feet, ZONE). Jordan Nowitzki misses. Rebound secured by Klay Wade.

[11:04] Team_039 possession (Score: 2-2)
Austin O'Neal attempts a Midrange. Heavily contested by Joel Anunoby (0.5 feet, ZONE)! Austin O'Neal misses. Offensive rebound by Austin O'Neal! Austin O'Neal kicks it out.

[10:54] Team_039 possession (Score: 2-2)
Klay Wade drives and kicks out. Jrue Bridges attempts a 3Pt. Contested by Tyler Beal (3.8 feet, MAN). Jrue Bridges misses. Offensive rebound by Klay Wade! Klay Wade kicks it out.

[10:38] Team_039 possession (Score: 2-2)
Anfernee Carter drives to the basket... Anfernee Carter loses control! Ball rolls out of bounds! TURNOVER! (dead ball)

[10:26] Team_030 possession (Score: 2-2)
Tyler Beal attempts a Midrange. Contested by Donovan Markkanen (2.1 feet, ZONE). TYLER BEAL MAKES IT!
Score: 4-2

[10:09] Team_039 possession (Score: 4-2)
Jrue Bridges drives, picks up Tyler Beal. Help arrives from Joel Anunoby! Jrue Bridges attempts a Layup. Wide open! Joel Anunoby is 6.2 feet away. [MAN] Jrue Bridges misses. Offensive rebound by Austin O'Neal! Austin O'Neal kicks it out.

[09:50] Team_039 possession (Score: 4-2)
Donovan Markkanen attempts a 3Pt. Wide open! Tyler Beal is 7.0 feet away. [ZONE] DONOVAN MARKKANEN MAKES IT! Assist: Anfernee Carter
Score: 4-5

[09:31] Team_030 possession (Score: 4-5)
FOUL! Shooting foul on Klay Wade. Jordan Nowitzki to the line for 2 free throws. [Team fouls: 2] (Klay Wade: 2 personal fouls)   FT 1/2: GOOD   FT 2/2: GOOD Jordan Nowitzki makes 2/2 from the line.
Score: 6-5

[09:15] Team_039 possession (Score: 6-5)
Jrue Bridges drives and kicks out. Jrue Bridges attempts a 3Pt. Heavily contested by Tyler Beal (1.9 feet, ZONE)! Jrue Bridges misses. Rebound secured by Jordan Nowitzki.

[09:00] Team_030 possession (Score: 6-5)
Tim Barrett loses control! Ball rolls out of bounds! TURNOVER! (dead ball)

[08:50] Team_039 possession (Score: 6-5)
Klay Wade attempts a 3Pt. Contested by Tyler Beal (2.7 feet, ZONE). KLAY WADE MAKES IT! Assist: Austin O'Neal
Score: 6-8

[08:35] Team_030 possession (Score: 6-8)
Jaren Green makes the Midrange and draws the foul on Klay Wade! And-1! Jaren Green to the line for 1. [Team fouls: 3] (Klay Wade: 3 personal fouls)   FT 1/1: GOOD Jaren Green makes 1/1 from the line.
Score: 9-8

[08:21] Team_039 possession (Score: 9-8)
Austin O'Neal attempts a Midrange. Contested by Joel Anunoby (2.5 feet, MAN). AUSTIN O'NEAL MAKES IT!
Score: 9-10

[08:05] Team_030 possession (Score: 9-10)
Tyler Beal loses the ball! Stripped by Jrue Bridges! TURNOVER! (live ball)

[07:51] Team_039 possession (Score: 9-10)
Donovan Markkanen attempts a Midrange. Wide open! Tim Barrett is 6.7 feet away. [MAN] DONOVAN MARKKANEN MAKES IT!
Score: 9-12

[07:37] Team_030 possession (Score: 9-12)
Jordan Nowitzki drives and kicks out. Tim Barrett attempts a Midrange. Heavily contested by Donovan Markkanen (0.5 feet, MAN)! Tim Barrett misses. FOUL! Loose ball foul on Klay Wade during the rebound battle. [Team fouls: 4] No free throws, side out. (Klay Wade: 4 personal fouls)

[07:22] Team_030 possession (Score: 9-12)
Jaren Green attempts a Midrange. Wide open! Klay Wade is 7.5 feet away. [MAN] Jaren Green misses. Rebound secured by Klay Wade.

[07:08] Team_039 possession (Score: 9-12)
Austin O'Neal attempts a 3Pt. Contested by Joel Anunoby (5.9 feet, MAN). AUSTIN O'NEAL MAKES IT! Assist: Jrue Bridges
Score: 9-15

[06:50] Team_030 possession (Score: 9-15)
Joel Anunoby attempts a Layup. Contested by Austin O'Neal (4.4 feet, MAN). JOEL ANUNOBY MAKES IT! Assist: Tim Barrett
Score: 11-15

[06:36] Team_039 possession (Score: 11-15)
Anfernee Carter drives and kicks out. Klay Wade attempts a 3Pt. Contested by Jaren Green (5.2 feet, MAN). Klay Wade misses. Rebound secured by Joel Anunoby.

[06:20] Team_030 possession (Score: 11-15)
Tim Barrett attempts a 3Pt. Contested by Donovan Markkanen (4.4 feet, MAN). Tim Barrett misses. Rebound secured by Donovan Markkanen.

[06:06] Team_039 possession (Score: 11-15)
Anfernee Carter attempts a 3Pt. Contested by Jordan Nowitzki (2.6 feet, MAN). ANFERNEE CARTER MAKES IT! Assist: Donovan Markkanen
Score: 11-18

[05:56] Team_030 possession (Score: 11-18)
Jordan Nowitzki drives, Klay Wade stays with him. Jordan Nowitzki attempts a Dunk. Heavily contested by Klay Wade (1.6 feet, MAN)! Jordan Nowitzki misses. Rebound secured by Donovan Markkanen.

[05:43] Team_039 possession (Score: 11-18)
FOUL! Reach-in foul on Tyler Beal during the drive. [Team fouls: 2] No free throws, side out. (Tyler Beal: 1 personal fouls)

[05:26] Team_039 possession (Score: 11-18)
Jrue Bridges drives and kicks out. Donovan Markkanen attempts a 3Pt. Wide open! Tyler Beal is 8.0 feet away. [ZONE] Donovan Markkanen misses. Rebound secured by Joel Anunoby.

[05:09] Team_030 possession (Score: 11-18)
Tim Barrett makes the Layup and draws the foul on Donovan Markkanen! And-1! Tim Barrett to the line for 1. [BONUS: 5 team fouls] (Donovan Markkanen: 1 personal fouls)   FT 1/1: GOOD Tim Barrett makes 1/1 from the line.
Score: 14-18

[04:52] Team_039 possession (Score: 14-18)
Austin O'Neal attempts a Midrange. Contested by Joel Anunoby (3.9 feet, ZONE). Austin O'Neal misses. Rebound secured by Jordan Nowitzki.

[04:38] Team_030 possession (Score: 14-18)
Jordan Nowitzki attempts a 3Pt. Contested by Klay Wade (4.6 feet, MAN). Jordan Nowitzki misses. Rebound secured by Austin O'Neal.

[04:24] Team_039 possession (Score: 14-18)
Austin O'Neal attempts a 3Pt. Contested by Tyler Beal (4.6 feet, ZONE). AUSTIN O'NEAL MAKES IT! Assist: Jrue Bridges
Score: 14-21

[04:07] Team_030 possession (Score: 14-21)
Joel Anunoby makes the Midrange and draws the foul on Austin O'Neal! And-1! Joel Anunoby to the line for 1. [BONUS: 6 team fouls] (Austin O'Neal: 1 personal fouls)   FT 1/1: GOOD Joel Anunoby makes 1/1 from the line.
Score: 17-21

[03:55] Team_039 possession (Score: 17-21)
Anfernee Carter drives, Jaren Green stays with him. Anfernee Carter attempts a Layup. Contested by Jaren Green (4.4 feet, ZONE). Anfernee Carter misses. Rebound secured by Joel Anunoby.

[03:43] Team_030 possession (Score: 17-21)
Jordan Nowitzki attempts a 3Pt. Heavily contested by Jrue Bridges (1.4 feet, ZONE)! Jordan Nowitzki misses. Rebound secured by Austin O'Neal.

[03:32] Team_039 possession (Score: 17-21)
Austin O'Neal attempts a 3Pt. Contested by Tyler Beal (3.1 feet, ZONE). AUSTIN O'NEAL MAKES IT! Assist: Jrue Bridges
Score: 17-24

[03:16] Team_030 possession (Score: 17-24)
Jaren Green attempts a Layup. Wide open! Klay Wade is 8.1 feet away. [ZONE] JAREN GREEN MAKES IT! Assist: Tim Barrett
Score: 19-24

[03:02] Team_039 possession (Score: 19-24)
Klay Wade makes the Layup and draws the foul on Jaren Green! And-1! Klay Wade to the line for 1. [Team fouls: 3] (Jaren Green: 1 personal fouls)   FT 1/1: GOOD Klay Wade makes 1/1 from the line.
Score: 19-27

[02:45] Team_030 possession (Score: 19-27)
Joel Anunoby attempts a Midrange. Contested by Jrue Bridges (4.0 feet, ZONE). Joel Anunoby misses. Offensive rebound by Joel Anunoby! Joel Anunoby kicks it out.

[02:27] Team_030 possession (Score: 19-27)
Jaren Green commits a violation (traveling/carry)! TURNOVER! (dead ball)

[02:27] Substitution (Team_039): Jrue Bridges OUT → Tracy Mitchell IN (stamina_rule2)

[02:27] Substitution (Team_039): Austin O'Neal OUT → Yao Carter IN (stamina_rule2)

[02:27] Substitution (Team_039): Anfernee Carter OUT → Victor Gasol IN (stamina_rule2)

[02:13] Team_039 possession (Score: 19-27)
Yao Carter throws a bad pass out of bounds! TURNOVER! (dead ball)

[02:13] Substitution (Team_030): Tim Barrett OUT → Josh Smith IN (stamina_rule2)

[02:13] Substitution (Team_030): Jordan Nowitzki OUT → Damian Green IN (stamina_rule2)

[02:13] Substitution (Team_030): Jaren Green OUT → Franz Anunoby IN (stamina_rule2)

[02:13] Substitution (Team_039): Klay Wade OUT → Bam Booker IN (stamina_rule2)

[02:00] Team_030 possession (Score: 19-27)
Damian Green attempts a 3Pt. Contested by Tracy Mitchell (4.1 feet, ZONE). Damian Green misses. Rebound secured by Yao Carter.

[01:44] Team_039 possession (Score: 19-27)
Victor Gasol drives to the basket... Victor Gasol commits a violation (traveling/carry)! TURNOVER! (dead ball)

[01:44] Substitution (Team_030): Tyler Beal OUT → RJ Carter IN (stamina_rule2)

[01:44] Substitution (Team_030): Joel Anunoby OUT → Pau James IN (stamina_rule2)

[01:44] Substitution (Team_039): Donovan Markkanen OUT → Jayson Cunningham IN (stamina_rule2)

[01:29] Team_030 possession (Score: 19-27)
Franz Anunoby drives, Bam Booker stays with him. Franz Anunoby attempts a Dunk. Wide open! Bam Booker is 6.8 feet away. [MAN] FRANZ ANUNOBY MAKES IT! Assist: Josh Smith
Score: 21-27

[01:11] Team_039 possession (Score: 21-27)
Bam Booker drives to the basket... Bam Booker throws a bad pass! Stolen by Damian Green! TURNOVER! (live ball)

[00:53] Team_030 possession (Score: 21-27)
FOUL! Holding foul on Jayson Cunningham. [IN THE BONUS! 7 team fouls] Josh Smith to the line for 2 free throws. (Jayson Cunningham: 1 personal fouls)   FT 1/2: GOOD   FT 2/2: MISS Josh Smith makes 1/2 from the line. Rebound secured by Victor Gasol.
Score: 22-27

[00:39] Team_039 possession (Score: 22-27)
Bam Booker drives, picks up Franz Anunoby. Help arrives from Josh Smith! Bam Booker attempts a Layup. Wide open! Josh Smith is 7.6 feet away. [MAN] BAM BOOKER MAKES IT! Assist: Yao Carter
Score: 22-29

[00:22] Team_030 possession (Score: 22-29)
Josh Smith drives, picks up Jayson Cunningham. Help arrives from Yao Carter! Josh Smith attempts a Layup. Wide open! Yao Carter is 6.6 feet away. [MAN] JOSH SMITH MAKES IT! Assist: RJ Carter
Score: 24-29

[00:07] Team_039 possession (Score: 24-29)
Yao Carter attempts a 3Pt. Contested by RJ Carter (5.9 feet, ZONE). YAO CARTER MAKES IT! Assist: Jayson Cunningham
Score: 24-32

================================================================================
                              1ST QUARTER COMPLETE                              
================================================================================

1ST QUARTER SCORE: Team_030 24, Team_039 32

BOX SCORE:
================================================================================

Team_030
--------------------------------------------------------------------------------
Player                MIN  PTS  REB  AST  TO      FG   FG%      3P   3P%
--------------------------------------------------------------------------------
Joel Anunoby           11    7    4    0   0   3/3   100.0     0/0   0.0
Jaren Green            10    5    0    0   0   2/3    66.7     0/0   0.0
Tim Barrett            10    3    0    3   0   1/2    50.0     0/0   0.0
Jordan Nowitzki        10    2    3    0   0   1/5    20.0     0/0   0.0
Tyler Beal             11    2    0    0   0   1/1   100.0     0/0   0.0
Franz Anunoby           2    2    0    0   0   1/1   100.0     0/0   0.0
Josh Smith              2    2    0    1   0   1/1   100.0     0/0   0.0
Damian Green            2    0    0    0   0   0/1     0.0     0/0   0.0
RJ Carter               2    0    0    1   0   0/0     0.0     0/0   0.0

TEAM: FG: 10/18 (55.6%), 3PT: 0/4 (0.0%), REB: 7 (2 off, 5 def), AST: 5, TO: 3
TEAM FOULS: 3


Team_039
--------------------------------------------------------------------------------
Player                MIN  PTS  REB  AST  TO      FG   FG%      3P   3P%
--------------------------------------------------------------------------------
Austin O'Neal          10   11    4    1   0   4/5    80.0     0/0   0.0
Donovan Markkanen      11    7    2    1   0   3/3   100.0     0/0   0.0
Klay Wade              10    6    3    0   0   2/2   100.0     0/0   0.0
Anfernee Carter        10    3    0    1   0   1/3    33.3     0/0   0.0
Yao Carter              2    3    1    1   0   1/1   100.0     0/0   0.0
Bam Booker              2    2    0    0   0   1/1   100.0     0/0   0.0
Jrue Bridges           10    0    0    3   0   0/2     0.0     0/0   0.0
Victor Gasol            2    0    1    0   0   0/0     0.0     0/0   0.0
Jayson Cunningham       2    0    0    1   0   0/0     0.0     0/0   0.0

TEAM: FG: 12/17 (70.6%), 3PT: 7/7 (100.0%), REB: 11 (3 off, 8 def), AST: 8, TO: 4
TEAM FOULS: 7 [Team_030 in BONUS]

================================================================================

================================================================================
                       2ND QUARTER - Team_030 vs Team_039                       
================================================================================

[12:00] Team_030 possession (Score: 24-32)
Tim Barrett attempts a 3Pt. Heavily contested by Jrue Bridges (0.5 feet, ZONE)! TIM BARRETT MAKES IT! Assist: Jordan Nowitzki
Score: 27-32

[11:45] Team_039 possession (Score: 27-32)
FOUL! Reach-in foul on Jaren Green during the drive. [Team fouls: 1] No free throws, side out. (Jaren Green: 1 personal fouls)

[11:33] Team_039 possession (Score: 27-32)
Klay Wade makes the Dunk and draws the foul on Jaren Green! And-1! Klay Wade to the line for 1. [Team fouls: 2] (Jaren Green: 2 personal fouls)   FT 1/1: GOOD Klay Wade makes 1/1 from the line.
Score: 27-35

[11:15] Team_030 possession (Score: 27-35)
Tyler Beal drives, Klay Wade stays with him. Tyler Beal attempts a Layup. Contested by Klay Wade (4.3 feet, ZONE). TYLER BEAL MAKES IT! Assist: Jaren Green
Score: 29-35

[11:00] Team_039 possession (Score: 29-35)
Klay Wade drives, Jaren Green stays with him. Klay Wade attempts a Dunk. Contested by Jaren Green (5.7 feet, MAN). KLAY WADE MAKES IT!
Score: 29-37

[10:47] Team_030 possession (Score: 29-37)
Joel Anunoby attempts a 3Pt. Contested by Jrue Bridges (3.5 feet, ZONE). Joel Anunoby misses. Rebound secured by Donovan Markkanen.

[10:31] Team_039 possession (Score: 29-37)
Austin O'Neal attempts a 3Pt. Contested by Joel Anunoby (3.4 feet, MAN). AUSTIN O'NEAL MAKES IT! Assist: Jrue Bridges
Score: 29-40

[10:15] Team_030 possession (Score: 29-40)
Jaren Green commits a violation (traveling/carry)! TURNOVER! (dead ball)

[09:57] Team_039 possession (Score: 29-40)
Anfernee Carter attempts a Layup. Wide open! Jaren Green is 6.5 feet away. [ZONE] Anfernee Carter misses. Rebound secured by Jaren Green.

[09:42] Team_030 possession (Score: 29-40)
Joel Anunoby attempts a Midrange. Contested by Donovan Markkanen (5.9 feet, ZONE). JOEL ANUNOBY MAKES IT!
Score: 31-40

[09:26] Team_039 possession (Score: 31-40)
Donovan Markkanen drives, picks up Tim Barrett. Help arrives from Joel Anunoby! Donovan Markkanen attempts a Dunk. Contested by Joel Anunoby (4.9 feet, MAN). DONOVAN MARKKANEN MAKES IT! Assist: Klay Wade
Score: 31-42

[09:09] Team_030 possession (Score: 31-42)
Joel Anunoby attempts a Midrange. Wide open! Anfernee Carter is 7.8 feet away. [ZONE] Joel Anunoby misses. Rebound secured by Donovan Markkanen.

[08:55] Team_039 possession (Score: 31-42)
FOUL! Shooting foul on Jaren Green. Donovan Markkanen to the line for 2 free throws. [Team fouls: 3] (Jaren Green: 3 personal fouls)   FT 1/2: GOOD   FT 2/2: MISS Donovan Markkanen makes 1/2 from the line. FOUL! Loose ball foul on Jordan Nowitzki during the free throw rebound! [Team fouls: 4] No free throws, side out. (Jordan Nowitzki: 1 personal fouls)
Score: 31-43

[08:41] Team_039 possession (Score: 31-43)
Klay Wade attempts a 3Pt. Wide open! Jaren Green is 6.1 feet away. [MAN] KLAY WADE MAKES IT! Assist: Jrue Bridges
Score: 31-46

[08:30] Team_030 possession (Score: 31-46)
Jordan Nowitzki attempts a 3Pt. Heavily contested by Jrue Bridges (1.4 feet, ZONE)! Jordan Nowitzki misses. Rebound secured by Klay Wade.

[08:15] Team_039 possession (Score: 31-46)
Jrue Bridges attempts a 3Pt. Contested by Tyler Beal (3.6 feet, ZONE). Jrue Bridges misses. Rebound secured by Joel Anunoby.

[08:03] Team_030 possession (Score: 31-46)
Joel Anunoby attempts a Layup. Wide open! Austin O'Neal is 6.6 feet away. [MAN] JOEL ANUNOBY MAKES IT! Assist: Jaren Green
Score: 33-46

[07:47] Team_039 possession (Score: 33-46)
Austin O'Neal attempts a 3Pt. Contested by Joel Anunoby (3.9 feet, MAN). Austin O'Neal misses. Rebound secured by Jordan Nowitzki.

[07:30] Team_030 possession (Score: 33-46)
Jordan Nowitzki drives to the basket... Jordan Nowitzki throws a bad pass! Stolen by Klay Wade! TURNOVER! (live ball)

[07:20] Team_039 possession (Score: 33-46)
Austin O'Neal attempts a Layup. Contested by Jaren Green (5.0 feet, ZONE). AUSTIN O'NEAL MAKES IT!
Score: 33-48

[07:05] Team_030 possession (Score: 33-48)
Jordan Nowitzki attempts a Layup. Contested by Klay Wade (5.7 feet, ZONE). JORDAN NOWITZKI MAKES IT! Assist: Tyler Beal
Score: 35-48

[06:47] Team_039 possession (Score: 35-48)
Austin O'Neal attempts a 3Pt. Contested by Tyler Beal (4.9 feet, ZONE). Austin O'Neal misses. Rebound secured by Jaren Green.

[06:33] Team_030 possession (Score: 35-48)
Tim Barrett attempts a Midrange. Contested by Austin O'Neal (5.7 feet, ZONE). TIM BARRETT MAKES IT! Assist: Joel Anunoby
Score: 37-48

[06:23] Team_039 possession (Score: 37-48)
Austin O'Neal attempts a 3Pt. Contested by Joel Anunoby (3.8 feet, MAN). Austin O'Neal misses. FOUL! Loose ball foul on Jaren Green during the rebound battle. [IN THE BONUS! 5 team fouls] Klay Wade to the line for 2 free throws. (Jaren Green: 4 personal fouls)   FT 1/2: GOOD   FT 2/2: GOOD Klay Wade makes 2/2 from the line.
Score: 37-50

[06:10] Team_030 possession (Score: 37-50)
Jaren Green attempts a Midrange. Wide open! Anfernee Carter is 8.6 feet away. [ZONE] JAREN GREEN MAKES IT! Assist: Tyler Beal
Score: 39-50

[06:00] Team_039 possession (Score: 39-50)
Anfernee Carter attempts a Layup. Wide open! Jordan Nowitzki is 9.6 feet away. [MAN] ANFERNEE CARTER MAKES IT! Assist: Jrue Bridges
Score: 39-52

[05:47] Team_030 possession (Score: 39-52)
Joel Anunoby drives to the basket... Joel Anunoby throws a bad pass out of bounds! TURNOVER! (dead ball)

[05:47] Substitution (Team_030): Tyler Beal OUT → RJ Carter IN (stamina_rule2)

[05:47] Substitution (Team_030): Tim Barrett OUT → Josh Smith IN (stamina_rule2)

[05:47] Substitution (Team_030): Joel Anunoby OUT → Pau James IN (stamina_rule2)

[05:47] Substitution (Team_030): Jordan Nowitzki OUT → Damian Green IN (stamina_rule2)

[05:47] Substitution (Team_030): Jaren Green OUT → Franz Anunoby IN (stamina_rule2)

[05:47] Substitution (Team_039): Jrue Bridges OUT → Tracy Mitchell IN (stamina_rule2)

[05:47] Substitution (Team_039): Donovan Markkanen OUT → Jayson Cunningham IN (stamina_rule2)

[05:47] Substitution (Team_039): Austin O'Neal OUT → Yao Carter IN (stamina_rule2)

[05:47] Substitution (Team_039): Anfernee Carter OUT → Victor Gasol IN (stamina_rule2)

[05:47] Substitution (Team_039): Klay Wade OUT → Bam Booker IN (stamina_rule2)

[05:34] Team_039 possession (Score: 39-52)
Jayson Cunningham attempts a 3Pt. Contested by Josh Smith (3.7 feet, MAN). JAYSON CUNNINGHAM MAKES IT! Assist: Yao Carter
Score: 39-55

[05:24] Team_030 possession (Score: 39-55)
Pau James attempts a Midrange. Contested by Yao Carter (5.1 feet, MAN). PAU JAMES MAKES IT!
Score: 41-55

[05:10] Team_039 possession (Score: 41-55)
Bam Booker attempts a Midrange. Heavily contested by Franz Anunoby (1.9 feet, MAN)! BAM BOOKER MAKES IT!
Score: 41-57

[04:57] Team_030 possession (Score: 41-57)
RJ Carter attempts a 3Pt. Wide open! Tracy Mitchell is 6.0 feet away. [MAN] RJ Carter misses. Offensive rebound by Pau James! Pau James kicks it out.

[04:42] Team_030 possession (Score: 41-57)
Franz Anunoby drives to the basket... Franz Anunoby throws a bad pass! Stolen by Bam Booker! TURNOVER! (live ball)

[04:29] Team_039 possession (Score: 41-57)
Bam Booker attempts a 3Pt. Contested by RJ Carter (2.2 feet, ZONE). Bam Booker misses. Offensive rebound by Victor Gasol! Victor Gasol kicks it out.

[04:16] Team_039 possession (Score: 41-57)
Victor Gasol drives and kicks out. Bam Booker attempts a Midrange. Contested by Franz Anunoby (5.8 feet, MAN). BAM BOOKER MAKES IT! Assist: Tracy Mitchell
Score: 41-59

[03:59] Team_030 possession (Score: 41-59)
RJ Carter throws a bad pass out of bounds! TURNOVER! (dead ball)

[03:41] Team_039 possession (Score: 41-59)
Tracy Mitchell attempts a Midrange. Wide open! RJ Carter is 7.6 feet away. [MAN] TRACY MITCHELL MAKES IT! Assist: Yao Carter
Score: 41-61

[03:27] Team_030 possession (Score: 41-61)
RJ Carter drives and kicks out. Franz Anunoby attempts a 3Pt. Wide open! Bam Booker is 6.6 feet away. [MAN] Franz Anunoby misses. Offensive rebound by Pau James! Pau James kicks it out.

[03:16] Team_030 possession (Score: 41-61)
Josh Smith drives, picks up Jayson Cunningham. Help arrives from Yao Carter! Josh Smith attempts a Layup. Wide open! Yao Carter is 8.0 feet away. [MAN] JOSH SMITH MAKES IT! Assist: Franz Anunoby
Score: 43-61

[03:05] Team_039 possession (Score: 43-61)
Jayson Cunningham attempts a 3Pt. Contested by Pau James (2.4 feet, ZONE). JAYSON CUNNINGHAM MAKES IT! Assist: Yao Carter
Score: 43-64

[02:47] Team_030 possession (Score: 43-64)
Damian Green drives, Victor Gasol stays with him. Damian Green attempts a Dunk. Contested by Victor Gasol (2.7 feet, MAN). Damian Green misses. Offensive rebound by Pau James! Pau James kicks it out.

[02:34] Team_030 possession (Score: 43-64)
Pau James attempts a Midrange. Heavily contested by Yao Carter (0.7 feet, MAN)! Pau James misses. Offensive rebound by Damian Green! Damian Green kicks it out.

[02:20] Team_030 possession (Score: 43-64)
Josh Smith attempts a 3Pt. Contested by Jayson Cunningham (5.7 feet, MAN). JOSH SMITH MAKES IT! Assist: RJ Carter
Score: 46-64

[02:03] Team_039 possession (Score: 46-64)
Bam Booker drives and kicks out. FOUL! Shooting foul on Franz Anunoby. Bam Booker to the line for 2 free throws. [BONUS: 6 team fouls] (Franz Anunoby: 1 personal fouls)   FT 1/2: GOOD   FT 2/2: MISS Bam Booker makes 1/2 from the line. Offensive rebound by Yao Carter! Yao Carter kicks it out.
Score: 46-65

[01:53] Team_039 possession (Score: 46-65)
Tracy Mitchell throws a bad pass! Stolen by RJ Carter! TURNOVER! (live ball)

[01:40] Team_030 possession (Score: 46-65)
Josh Smith attempts a Midrange. Wide open! Bam Booker is 8.3 feet away. [ZONE] Josh Smith misses. Offensive rebound by Damian Green! Damian Green kicks it out.

[01:28] Team_030 possession (Score: 46-65)
FOUL! Holding foul on Victor Gasol. [Team fouls: 1] No free throws, side out. (Victor Gasol: 1 personal fouls)

[01:09] Team_030 possession (Score: 46-65)
Damian Green attempts a Layup. Contested by Victor Gasol (3.0 feet, ZONE). Damian Green misses. Rebound secured by Yao Carter.

[00:54] Team_039 possession (Score: 46-65)
Tracy Mitchell attempts a Midrange. Contested by Josh Smith (3.6 feet, ZONE). Tracy Mitchell misses. Offensive rebound by Victor Gasol! Victor Gasol kicks it out.

[00:37] Team_039 possession (Score: 46-65)
Tracy Mitchell attempts a Midrange. Wide open! RJ Carter is 7.1 feet away. [MAN] TRACY MITCHELL MAKES IT!
Score: 46-67

[00:21] Team_030 possession (Score: 46-67)
Franz Anunoby attempts a Midrange. Contested by Victor Gasol (2.7 feet, ZONE). Franz Anunoby misses. Offensive rebound by Pau James! Pau James kicks it out.

[00:08] Team_030 possession (Score: 46-67)
Josh Smith throws a bad pass out of bounds! TURNOVER! (dead ball)

================================================================================
                              2ND QUARTER COMPLETE                              
================================================================================

2ND QUARTER SCORE: Team_030 22, Team_039 35

BOX SCORE:
================================================================================

Team_030
--------------------------------------------------------------------------------
Player                MIN  PTS  REB  AST  TO      FG   FG%      3P   3P%
--------------------------------------------------------------------------------
Tim Barrett            16    5    0    0   0   2/2   100.0     0/0   0.0
Josh Smith              8    5    0    0   0   2/2   100.0     0/0   0.0
Joel Anunoby           17    4    1    1   0   2/4    50.0     0/0   0.0
Jordan Nowitzki        16    2    1    1   0   1/2    50.0     0/0   0.0
Tyler Beal             17    2    0    2   0   1/1   100.0     0/0   0.0
Jaren Green            16    2    2    2   0   1/1   100.0     0/0   0.0
Pau James               7    2    4    0   0   1/1   100.0     0/0   0.0
Franz Anunoby           8    0    0    1   0   0/0     0.0     0/0   0.0
Damian Green            8    0    2    0   0   0/1     0.0     0/0   0.0
RJ Carter               7    0    0    1   0   0/0     0.0     0/0   0.0

TEAM: FG: 10/14 (71.4%), 3PT: 2/4 (50.0%), REB: 10 (6 off, 4 def), AST: 8, TO: 6
TEAM FOULS: 6 [Team_039 in BONUS]


Team_039
--------------------------------------------------------------------------------
Player                MIN  PTS  REB  AST  TO      FG   FG%      3P   3P%
--------------------------------------------------------------------------------
Klay Wade              16   10    1    1   0   4/4   100.0     0/0   0.0
Jayson Cunningham       7    6    0    0   0   2/2   100.0     0/0   0.0
Austin O'Neal          16    5    1    0   0   2/4    50.0     0/0   0.0
Bam Booker              8    4    0    0   0   2/2   100.0     0/0   0.0
Tracy Mitchell          8    4    0    1   0   2/2   100.0     0/0   0.0
Donovan Markkanen      17    2    2    0   0   1/1   100.0     0/0   0.0
Anfernee Carter        16    2    0    0   0   1/2    50.0     0/0   0.0
Jrue Bridges           16    0    0    3   0   0/1     0.0     0/0   0.0
Yao Carter              8    0    2    3   0   0/0     0.0     0/0   0.0
Victor Gasol            8    0    2    0   0   0/0     0.0     0/0   0.0

TEAM: FG: 14/18 (77.8%), 3PT: 5/8 (62.5%), REB: 8 (4 off, 4 def), AST: 8, TO: 1
TEAM FOULS: 1

================================================================================

================================================================================
                       3RD QUARTER - Team_030 vs Team_039                       
================================================================================

[12:00] Team_030 possession (Score: 46-67)
Tyler Beal drives, Klay Wade stays with him. Tyler Beal attempts a Layup. Contested by Klay Wade (2.7 feet, ZONE). TYLER BEAL MAKES IT! Assist: Jaren Green
Score: 48-67

[11:46] Team_039 possession (Score: 48-67)
Jrue Bridges drives, Jordan Nowitzki stays with him. Jrue Bridges attempts a Layup. Wide open! Jordan Nowitzki is 7.1 feet away. [ZONE] Jrue Bridges misses. Rebound secured by Joel Anunoby.

[11:31] Team_030 possession (Score: 48-67)
Tyler Beal attempts a 3Pt. Contested by Jrue Bridges (4.1 feet, ZONE). Tyler Beal misses. Rebound secured by Austin O'Neal.

[11:17] Team_039 possession (Score: 48-67)
Austin O'Neal attempts a 3Pt. Contested by Tyler Beal (3.0 feet, ZONE). AUSTIN O'NEAL MAKES IT! Assist: Jrue Bridges
Score: 48-70

[11:02] Team_030 possession (Score: 48-70)
Jaren Green drives, Klay Wade stays with him. Jaren Green attempts a Dunk. Contested by Klay Wade (5.4 feet, MAN). Jaren Green misses. Offensive rebound by Jordan Nowitzki! Jordan Nowitzki's putback is no good. Offensive rebound by Joel Anunoby! Joel Anunoby kicks it out.

[10:44] Team_030 possession (Score: 48-70)
Jaren Green commits a violation (traveling/carry)! TURNOVER! (dead ball)

[10:30] Team_039 possession (Score: 48-70)
Austin O'Neal makes the Layup and draws the foul on Joel Anunoby! And-1! Austin O'Neal to the line for 1. [Team fouls: 1] (Joel Anunoby: 1 personal fouls)   FT 1/1: GOOD Austin O'Neal makes 1/1 from the line.
Score: 48-73

[10:18] Team_030 possession (Score: 48-73)
Jaren Green attempts a Midrange. Wide open! Klay Wade is 6.5 feet away. [MAN] Jaren Green misses. Rebound secured by Donovan Markkanen.

[10:04] Team_039 possession (Score: 48-73)
Donovan Markkanen drives and kicks out. Klay Wade attempts a Midrange. Wide open! Joel Anunoby is 7.9 feet away. [ZONE] Klay Wade misses. Rebound secured by Joel Anunoby.

[09:50] Team_030 possession (Score: 48-73)
Joel Anunoby attempts a Layup. BLOCKED BY AUSTIN O'NEAL! Ball is loose! Offensive rebound by Joel Anunoby! Joel Anunoby kicks it out.

[09:36] Team_030 possession (Score: 48-73)
Tyler Beal drives and kicks out. Tim Barrett attempts a 3Pt. Contested by Jrue Bridges (2.4 feet, ZONE). TIM BARRETT MAKES IT! Assist: Jordan Nowitzki
Score: 51-73

[09:21] Team_039 possession (Score: 51-73)
Donovan Markkanen drives and kicks out. Donovan Markkanen attempts a Midrange. Contested by Tim Barrett (5.6 feet, MAN). DONOVAN MARKKANEN MAKES IT! Assist: Austin O'Neal
Score: 51-75

[09:06] Team_030 possession (Score: 51-75)
Jaren Green makes the Layup and draws the foul on Klay Wade! And-1! Jaren Green to the line for 1. [Team fouls: 2] (Klay Wade: 1 personal fouls)   FT 1/1: GOOD Jaren Green makes 1/1 from the line.
Score: 54-75

[08:54] Team_039 possession (Score: 54-75)
Anfernee Carter makes the 3Pt and draws the foul on Tyler Beal! And-1! Anfernee Carter to the line for 1. [Team fouls: 2] (Tyler Beal: 1 personal fouls)   FT 1/1: GOOD Anfernee Carter makes 1/1 from the line.
Score: 54-79

[08:37] Team_030 possession (Score: 54-79)
Jaren Green attempts a Dunk. BLOCKED BY KLAY WADE! Ball is loose! Rebound secured by Donovan Markkanen.

[08:18] Team_039 possession (Score: 54-79)
Anfernee Carter attempts a Midrange. Wide open! Jordan Nowitzki is 6.1 feet away. [MAN] ANFERNEE CARTER MAKES IT!
Score: 54-81

[08:00] Team_030 possession (Score: 54-81)
Tyler Beal attempts a 3Pt. Heavily contested by Jrue Bridges (1.6 feet, MAN)! TYLER BEAL MAKES IT! Assist: Jaren Green
Score: 57-81

[07:46] Team_039 possession (Score: 57-81)
Anfernee Carter drives to the basket... Anfernee Carter loses the ball! Stripped by Jordan Nowitzki! TURNOVER! (live ball)

[07:32] Team_030 possession (Score: 57-81)
Joel Anunoby attempts a 3Pt. Contested by Jrue Bridges (3.6 feet, ZONE). Joel Anunoby misses. Rebound secured by Klay Wade.

[07:17] Team_039 possession (Score: 57-81)
Austin O'Neal attempts a 3Pt. Contested by Tyler Beal (3.5 feet, ZONE). Austin O'Neal misses. FOUL! Loose ball foul on Jaren Green during the rebound battle. [Team fouls: 3] No free throws, side out. (Jaren Green: 1 personal fouls)

[07:04] Team_039 possession (Score: 57-81)
Anfernee Carter attempts a Layup. Contested by Jaren Green (4.5 feet, ZONE). ANFERNEE CARTER MAKES IT! Assist: Jrue Bridges
Score: 57-83

[06:47] Team_030 possession (Score: 57-83)
Joel Anunoby drives, Klay Wade stays with him. Joel Anunoby attempts a Layup. Contested by Klay Wade (5.9 feet, ZONE). JOEL ANUNOBY MAKES IT!
Score: 59-83

[06:32] Team_039 possession (Score: 59-83)
Anfernee Carter attempts a 3Pt. Heavily contested by Tyler Beal (0.5 feet, ZONE)! Anfernee Carter misses. Rebound secured by Joel Anunoby.

[06:20] Team_030 possession (Score: 59-83)
Jaren Green drives to the basket... Jaren Green throws a bad pass! Stolen by Klay Wade! TURNOVER! (live ball)

[06:09] Team_039 possession (Score: 59-83)
Austin O'Neal drives, Jaren Green stays with him. Austin O'Neal attempts a Dunk. Heavily contested by Jaren Green (0.5 feet, ZONE)! AUSTIN O'NEAL MAKES IT! Assist: Jrue Bridges
Score: 59-85

[05:54] Team_030 possession (Score: 59-85)
Joel Anunoby makes the Layup and draws the foul on Austin O'Neal! And-1! Joel Anunoby to the line for 1. [Team fouls: 3] (Austin O'Neal: 1 personal fouls)   FT 1/1: GOOD Joel Anunoby makes 1/1 from the line.
Score: 62-85

[05:39] Team_039 possession (Score: 62-85)
Klay Wade drives, picks up Jordan Nowitzki. Help arrives from Tyler Beal! Klay Wade attempts a Dunk. Wide open! Tyler Beal is 7.0 feet away. [ZONE] KLAY WADE MAKES IT! Assist: Donovan Markkanen
Score: 62-87

[05:29] Team_030 possession (Score: 62-87)
Tim Barrett attempts a 3Pt. Heavily contested by Donovan Markkanen (0.5 feet, MAN)! Tim Barrett misses. Offensive rebound by Joel Anunoby! Joel Anunoby kicks it out.

[05:17] Team_030 possession (Score: 62-87)
FOUL! Shooting foul on Jrue Bridges. Jordan Nowitzki to the line for 3 free throws. [Team fouls: 4] (Jrue Bridges: 1 personal fouls)   FT 1/3: GOOD   FT 2/3: GOOD   FT 3/3: MISS Jordan Nowitzki makes 2/3 from the line. Rebound secured by Austin O'Neal.
Score: 64-87

[05:03] Team_039 possession (Score: 64-87)
Donovan Markkanen attempts a Midrange. Contested by Joel Anunoby (3.5 feet, ZONE). Donovan Markkanen misses. Rebound secured by Joel Anunoby.

[04:51] Team_030 possession (Score: 64-87)
Tyler Beal attempts a Midrange. Contested by Jrue Bridges (2.3 feet, MAN). Tyler Beal misses. Rebound secured by Donovan Markkanen.

[04:36] Team_039 possession (Score: 64-87)
Klay Wade attempts a Midrange. BLOCKED BY JAREN GREEN! Ball is loose! Offensive rebound by Austin O'Neal! Austin O'Neal kicks it out.

[04:22] Team_039 possession (Score: 64-87)
Jrue Bridges attempts a 3Pt. Contested by Tyler Beal (5.0 feet, ZONE). Jrue Bridges misses. Rebound secured by Joel Anunoby.

[04:08] Team_030 possession (Score: 64-87)
Tyler Beal attempts a Layup. Wide open! Jrue Bridges is 7.3 feet away. [MAN] TYLER BEAL MAKES IT! Assist: Jordan Nowitzki
Score: 66-87

[03:53] Team_039 possession (Score: 66-87)
Austin O'Neal drives and kicks out. Klay Wade attempts a 3Pt. Heavily contested by Tyler Beal (1.1 feet, ZONE)! Klay Wade misses. Rebound secured by Joel Anunoby.

[03:40] Team_030 possession (Score: 66-87)
Joel Anunoby attempts a Midrange. Wide open! Anfernee Carter is 6.6 feet away. [ZONE] JOEL ANUNOBY MAKES IT! Assist: Tim Barrett
Score: 68-87

[03:29] Team_039 possession (Score: 68-87)
Klay Wade drives and kicks out. Donovan Markkanen attempts a Midrange. Wide open! Tim Barrett is 6.1 feet away. [ZONE] DONOVAN MARKKANEN MAKES IT! Assist: Austin O'Neal
Score: 68-89

[03:12] Team_030 possession (Score: 68-89)
Tyler Beal attempts a Midrange. Heavily contested by Jrue Bridges (1.4 feet, MAN)! TYLER BEAL MAKES IT!
Score: 70-89

[02:53] Team_039 possession (Score: 70-89)
Anfernee Carter throws a bad pass out of bounds! TURNOVER! (dead ball)

[02:53] Substitution (Team_039): Austin O'Neal OUT → Yao Carter IN (stamina_rule2)

[02:53] Substitution (Team_039): Anfernee Carter OUT → Victor Gasol IN (stamina_rule2)

[02:40] Team_030 possession (Score: 70-89)
Jaren Green drives, picks up Klay Wade. Help arrives from Donovan Markkanen! Jaren Green attempts a Dunk. Wide open! Donovan Markkanen is 6.6 feet away. [MAN] JAREN GREEN MAKES IT! Assist: Tyler Beal
Score: 72-89

[02:25] Team_039 possession (Score: 72-89)
Yao Carter attempts a Layup. Wide open! Joel Anunoby is 8.3 feet away. [MAN] Yao Carter misses. Rebound secured by Joel Anunoby.

[02:12] Team_030 possession (Score: 72-89)
Jaren Green attempts a Layup. Contested by Klay Wade (4.0 feet, ZONE). JAREN GREEN MAKES IT! Assist: Tyler Beal
Score: 74-89

[01:59] Team_039 possession (Score: 74-89)
Klay Wade drives and kicks out. Yao Carter attempts a Midrange. Wide open! Joel Anunoby is 7.6 feet away. [MAN] YAO CARTER MAKES IT!
Score: 74-91

[01:43] Team_030 possession (Score: 74-91)
Tyler Beal attempts a Midrange. Contested by Jrue Bridges (3.7 feet, MAN). TYLER BEAL MAKES IT! Assist: Jordan Nowitzki
Score: 76-91

[01:31] Team_039 possession (Score: 76-91)
FOUL! Reach-in foul on Tim Barrett during the drive. [Team fouls: 4] No free throws, side out. (Tim Barrett: 1 personal fouls)

[01:16] Team_039 possession (Score: 76-91)
Klay Wade attempts a Midrange. Contested by Jaren Green (5.7 feet, MAN). Klay Wade misses. Rebound secured by Jaren Green.

[00:58] Team_030 possession (Score: 76-91)
FOUL! Reach-in foul on Jrue Bridges during the drive. [IN THE BONUS! 5 team fouls] Tyler Beal to the line for 2 free throws. (Jrue Bridges: 2 personal fouls)   FT 1/2: GOOD   FT 2/2: MISS Tyler Beal makes 1/2 from the line. Rebound secured by Victor Gasol.
Score: 77-91

[00:39] Team_039 possession (Score: 77-91)
Klay Wade attempts a Layup. Wide open! Jaren Green is 6.2 feet away. [MAN] KLAY WADE MAKES IT! Assist: Jrue Bridges
Score: 77-93

[00:26] Team_030 possession (Score: 77-93)
Jordan Nowitzki attempts a 3Pt. Contested by Jrue Bridges (2.3 feet, ZONE). Jordan Nowitzki misses. Rebound secured by Klay Wade.

[00:09] Team_039 possession (Score: 77-93)
Klay Wade attempts a 3Pt. Wide open! Jordan Nowitzki is 6.4 feet away. [ZONE] Klay Wade misses. Rebound secured by Jaren Green.

================================================================================
                              3RD QUARTER COMPLETE                              
================================================================================

3RD QUARTER SCORE: Team_030 31, Team_039 26

BOX SCORE:
================================================================================

Team_030
--------------------------------------------------------------------------------
Player                MIN  PTS  REB  AST  TO      FG   FG%      3P   3P%
--------------------------------------------------------------------------------
Tyler Beal             29   11    0    2   0   5/8    62.5     0/0   0.0
Jaren Green            29    7    2    2   0   3/5    60.0     0/0   0.0
Joel Anunoby           29    7   10    0   0   3/4    75.0     0/0   0.0
Tim Barrett            29    3    0    1   0   1/1   100.0     0/0   0.0
Jordan Nowitzki        29    0    0    3   0   0/2     0.0     0/0   0.0

TEAM: FG: 12/20 (60.0%), 3PT: 1/5 (20.0%), REB: 12 (3 off, 9 def), AST: 8, TO: 2
TEAM FOULS: 4


Team_039
--------------------------------------------------------------------------------
Player                MIN  PTS  REB  AST  TO      FG   FG%      3P   3P%
--------------------------------------------------------------------------------
Austin O'Neal          26    8    4    2   0   3/4    75.0     0/0   0.0
Anfernee Carter        26    8    0    0   0   3/4    75.0     0/0   0.0
Donovan Markkanen      29    4    3    1   0   2/4    50.0     0/0   0.0
Klay Wade              29    4    2    0   0   2/4    50.0     0/0   0.0
Yao Carter             11    2    0    0   0   1/2    50.0     0/0   0.0
Jrue Bridges           28    0    0    4   0   0/2     0.0     0/0   0.0
Victor Gasol           11    0    1    0   0   0/0     0.0     0/0   0.0

TEAM: FG: 11/20 (55.0%), 3PT: 2/5 (40.0%), REB: 10 (2 off, 8 def), AST: 7, TO: 2
TEAM FOULS: 5 [Team_030 in BONUS]

================================================================================

================================================================================
                       4TH QUARTER - Team_030 vs Team_039                       
================================================================================

[12:00] Substitution (Team_030): Tyler Beal OUT (stamina: 71) → RJ Carter IN (comeback_detected)

[12:00] Substitution (Team_039): Jrue Bridges OUT (stamina: 68) → Tracy Mitchell IN (comeback_detected)

[12:00] Team_030 possession (Score: 77-93)
Joel Anunoby attempts a Layup. BLOCKED BY AUSTIN O'NEAL! Ball is loose! Rebound secured by Austin O'Neal.

[11:46] Team_039 possession (Score: 77-93)
Klay Wade attempts a 3Pt. Wide open! Tim Barrett is 8.7 feet away. [ZONE] Klay Wade misses. Rebound secured by Jaren Green.

[11:31] Team_030 possession (Score: 77-93)
RJ Carter drives, Klay Wade stays with him. RJ Carter attempts a Dunk. Contested by Klay Wade (4.6 feet, ZONE). RJ CARTER MAKES IT! Assist: Joel Anunoby
Score: 79-93

[11:21] Team_039 possession (Score: 79-93)
Austin O'Neal attempts a Midrange. Contested by Jordan Nowitzki (4.8 feet, ZONE). AUSTIN O'NEAL MAKES IT!
Score: 79-95

[11:05] Team_030 possession (Score: 79-95)
FOUL! Holding foul on Klay Wade. [Team fouls: 1] No free throws, side out. (Klay Wade: 1 personal fouls)

[10:48] Team_030 possession (Score: 79-95)
Joel Anunoby drives, Klay Wade stays with him. Joel Anunoby attempts a Layup. Wide open! Klay Wade is 7.6 feet away. [ZONE] Joel Anunoby misses. Rebound secured by Anfernee Carter.

[10:35] Team_039 possession (Score: 79-95)
Austin O'Neal attempts a 3Pt. Contested by Joel Anunoby (4.9 feet, MAN). Austin O'Neal misses. Rebound secured by Joel Anunoby.

[10:22] Team_030 possession (Score: 79-95)
Jordan Nowitzki attempts a Midrange. Contested by Klay Wade (5.7 feet, MAN). Jordan Nowitzki misses. Rebound secured by Klay Wade.

[10:08] Team_039 possession (Score: 79-95)
Klay Wade attempts a Midrange. Contested by Jaren Green (3.0 feet, MAN). KLAY WADE MAKES IT!
Score: 79-97

[09:53] Team_030 possession (Score: 79-97)
RJ Carter attempts a 3Pt. Wide open! Tracy Mitchell is 7.5 feet away. [MAN] RJ CARTER MAKES IT! Assist: Joel Anunoby
Score: 82-97

[09:37] Team_039 possession (Score: 82-97)
Donovan Markkanen drives, Tim Barrett stays with him. Donovan Markkanen attempts a Layup. Wide open! Tim Barrett is 7.9 feet away. [MAN] DONOVAN MARKKANEN MAKES IT! Assist: Klay Wade
Score: 82-99

[09:24] Team_030 possession (Score: 82-99)
Joel Anunoby drives, Klay Wade stays with him. Joel Anunoby attempts a Layup. Wide open! Klay Wade is 10.0 feet away. [ZONE] JOEL ANUNOBY MAKES IT! Assist: Jaren Green
Score: 84-99

[09:06] Team_039 possession (Score: 84-99)
Tracy Mitchell attempts a Midrange. Contested by RJ Carter (5.4 feet, MAN). TRACY MITCHELL MAKES IT! Assist: Donovan Markkanen
Score: 84-101

[08:47] Team_030 possession (Score: 84-101)
Jaren Green attempts a Layup. Wide open! Klay Wade is 6.5 feet away. [ZONE] JAREN GREEN MAKES IT! Assist: Tim Barrett
Score: 86-101

[08:35] Team_039 possession (Score: 86-101)
Tracy Mitchell attempts a 3Pt. Contested by RJ Carter (4.7 feet, ZONE). Tracy Mitchell misses. Rebound secured by Jordan Nowitzki.

[08:21] Team_030 possession (Score: 86-101)
Jaren Green attempts a Layup. Wide open! Klay Wade is 6.7 feet away. [ZONE] JAREN GREEN MAKES IT! Assist: RJ Carter
Score: 88-101

[08:02] Team_039 possession (Score: 88-101)
Tracy Mitchell drives to the basket... Tracy Mitchell throws a bad pass! Stolen by Jaren Green! TURNOVER! (live ball)

[07:45] Team_030 possession (Score: 88-101)
FOUL! Reach-in foul on Anfernee Carter during the drive. [Team fouls: 2] No free throws, side out. (Anfernee Carter: 1 personal fouls)

[07:30] Team_030 possession (Score: 88-101)
Jaren Green attempts a 3Pt. Contested by Klay Wade (5.8 feet, MAN). Jaren Green misses. Rebound secured by Klay Wade.

[07:16] Team_039 possession (Score: 88-101)
Tracy Mitchell attempts a 3Pt. Wide open! RJ Carter is 7.7 feet away. [ZONE] TRACY MITCHELL MAKES IT! Assist: Klay Wade
Score: 88-104

[07:06] Team_030 possession (Score: 88-104)
Tim Barrett attempts a Layup. BLOCKED BY DONOVAN MARKKANEN! Ball deflects out of bounds off Tim Barrett.

[06:56] Team_039 possession (Score: 88-104)
Donovan Markkanen attempts a 3Pt. Wide open! Tim Barrett is 7.6 feet away. [MAN] DONOVAN MARKKANEN MAKES IT! Assist: Klay Wade
Score: 88-107

[06:38] Team_030 possession (Score: 88-107)
Jaren Green drives and kicks out. Tim Barrett attempts a Midrange. Wide open! Anfernee Carter is 7.3 feet away. [ZONE] TIM BARRETT MAKES IT!
Score: 90-107

[06:25] Team_039 possession (Score: 90-107)
Donovan Markkanen attempts a Midrange. Wide open! Tim Barrett is 6.2 feet away. [MAN] DONOVAN MARKKANEN MAKES IT!
Score: 90-109

[06:11] Team_030 possession (Score: 90-109)
Jordan Nowitzki commits a violation (traveling/carry)! TURNOVER! (dead ball)

[06:11] Substitution (Team_030): Tim Barrett OUT → Josh Smith IN (stamina_rule2)

[06:11] Substitution (Team_030): Joel Anunoby OUT → Pau James IN (stamina_rule2)

[06:11] Substitution (Team_030): Jordan Nowitzki OUT → Damian Green IN (stamina_rule2)

[06:11] Substitution (Team_030): Jaren Green OUT → Franz Anunoby IN (stamina_rule2)

[06:11] Substitution (Team_039): Donovan Markkanen OUT → Jayson Cunningham IN (stamina_rule2)

[06:11] Substitution (Team_039): Austin O'Neal OUT → Yao Carter IN (stamina_rule2)

[06:11] Substitution (Team_039): Anfernee Carter OUT → Victor Gasol IN (stamina_rule2)

[06:11] Substitution (Team_039): Klay Wade OUT → Bam Booker IN (stamina_rule2)

[05:57] Team_039 possession (Score: 90-109)
Jayson Cunningham drives, Josh Smith stays with him. Jayson Cunningham attempts a Layup. Wide open! Josh Smith is 7.8 feet away. [MAN] JAYSON CUNNINGHAM MAKES IT!
Score: 90-111

[05:41] Team_030 possession (Score: 90-111)
Josh Smith attempts a Midrange. Contested by Victor Gasol (5.9 feet, ZONE). JOSH SMITH MAKES IT! Assist: Damian Green
Score: 92-111

[05:30] Team_039 possession (Score: 92-111)
Bam Booker attempts a Layup. Contested by Franz Anunoby (6.0 feet, MAN). BAM BOOKER MAKES IT!
Score: 92-113

[05:15] Team_030 possession (Score: 92-113)
Damian Green attempts a Midrange. Contested by Yao Carter (3.8 feet, ZONE). Damian Green misses. FOUL! Loose ball foul on Victor Gasol during the rebound battle. [Team fouls: 3] No free throws, side out. (Victor Gasol: 1 personal fouls)

[05:02] Team_030 possession (Score: 92-113)
FOUL! Shooting foul on Victor Gasol. Damian Green to the line for 2 free throws. [Team fouls: 4] (Victor Gasol: 2 personal fouls)   FT 1/2: GOOD   FT 2/2: GOOD Damian Green makes 2/2 from the line.
Score: 94-113

[04:49] Team_039 possession (Score: 94-113)
Jayson Cunningham attempts a 3Pt. Contested by RJ Carter (5.4 feet, ZONE). Jayson Cunningham misses. Rebound secured by Pau James.

[04:35] Team_030 possession (Score: 94-113)
RJ Carter attempts a 3Pt. Contested by Tracy Mitchell (5.7 feet, MAN). RJ Carter misses. Rebound secured by Yao Carter.

[04:18] Team_039 possession (Score: 94-113)
Yao Carter drives to the basket... FOUL! Offensive foul on Yao Carter! Damian Green drew the charge! [Team fouls: 5] (Yao Carter: 1 personal fouls) TURNOVER! (dead ball)

[04:03] Team_030 possession (Score: 94-113)
Damian Green attempts a Layup. Contested by Victor Gasol (2.0 feet, ZONE). DAMIAN GREEN MAKES IT!
Score: 96-113

[03:52] Team_039 possession (Score: 96-113)
Jayson Cunningham makes the Dunk and draws the foul on Pau James! And-1! Jayson Cunningham to the line for 1. [Team fouls: 1] (Pau James: 1 personal fouls)   FT 1/1: GOOD Jayson Cunningham makes 1/1 from the line.
Score: 96-116

[03:38] Team_030 possession (Score: 96-116)
Pau James attempts a 3Pt. Wide open! Tracy Mitchell is 6.3 feet away. [ZONE] PAU JAMES MAKES IT! Assist: Josh Smith
Score: 99-116

[03:24] Team_039 possession (Score: 99-116)
Jayson Cunningham drives to the basket... Jayson Cunningham throws a bad pass! Stolen by Josh Smith! TURNOVER! (live ball)

[03:08] Team_030 possession (Score: 99-116)
RJ Carter attempts a Midrange. Contested by Tracy Mitchell (5.8 feet, MAN). RJ CARTER MAKES IT! Assist: Josh Smith
Score: 101-116

[02:50] Team_039 possession (Score: 101-116)
Tracy Mitchell throws a bad pass out of bounds! TURNOVER! (dead ball)

[02:37] Team_030 possession (Score: 101-116)
RJ Carter attempts a 3Pt. Wide open! Tracy Mitchell is 6.7 feet away. [ZONE] RJ CARTER MAKES IT! Assist: Franz Anunoby
Score: 104-116

[02:21] Team_039 possession (Score: 104-116)
FOUL! Shooting foul on Damian Green. Victor Gasol to the line for 3 free throws. [Team fouls: 2] (Damian Green: 1 personal fouls)   FT 1/3: GOOD   FT 2/3: GOOD   FT 3/3: GOOD Victor Gasol makes 3/3 from the line.
Score: 104-119

[02:08] Team_030 possession (Score: 104-119)
Josh Smith attempts a 3Pt. Contested by Jayson Cunningham (5.4 feet, MAN). Josh Smith misses. Rebound secured by Bam Booker.

[01:54] Team_039 possession (Score: 104-119)
Bam Booker loses the ball! Stripped by Franz Anunoby! TURNOVER! (live ball)

[01:39] Team_030 possession (Score: 104-119)
Josh Smith attempts a Midrange. Contested by Jayson Cunningham (4.4 feet, MAN). Josh Smith misses. Rebound secured by Yao Carter.

[01:22] Team_039 possession (Score: 104-119)
Tracy Mitchell attempts a 3Pt. Wide open! RJ Carter is 7.1 feet away. [MAN] TRACY MITCHELL MAKES IT!
Score: 104-122

[01:09] Team_030 possession (Score: 104-122)
Pau James attempts a 3Pt. Heavily contested by Yao Carter (0.5 feet, MAN)! Pau James misses. Offensive rebound by Damian Green! Damian Green kicks it out.

[00:53] Team_030 possession (Score: 104-122)
Franz Anunoby commits a violation (traveling/carry)! TURNOVER! (dead ball)

[00:37] Team_039 possession (Score: 104-122)
Victor Gasol drives to the basket... Victor Gasol throws a bad pass! Stolen by Damian Green! TURNOVER! (live ball)

[00:21] Team_030 possession (Score: 104-122)
Pau James attempts a Layup. Wide open! Yao Carter is 6.6 feet away. [MAN] Pau James misses. Rebound secured by Bam Booker.

[00:06] Team_039 possession (Score: 104-122)
Victor Gasol drives and kicks out. Victor Gasol attempts a 3Pt. Contested by Josh Smith (4.1 feet, ZONE). Victor Gasol misses. Rebound secured by Pau James.

================================================================================
                              4TH QUARTER COMPLETE                              
================================================================================

4TH QUARTER SCORE: Team_030 27, Team_039 29

BOX SCORE:
================================================================================

Team_030
--------------------------------------------------------------------------------
Player                MIN  PTS  REB  AST  TO      FG   FG%      3P   3P%
--------------------------------------------------------------------------------
RJ Carter              19   10    0    1   0   4/5    80.0     0/0   0.0
Jaren Green            35    4    1    1   0   2/3    66.7     0/0   0.0
Damian Green           14    4    2    1   0   2/2   100.0     0/0   0.0
Pau James              13    3    2    0   0   1/2    50.0     0/0   0.0
Joel Anunoby           35    2    1    2   0   1/3    33.3     0/0   0.0
Tim Barrett            35    2    0    1   0   1/2    50.0     0/0   0.0
Josh Smith             14    2    0    2   0   1/3    33.3     0/0   0.0
Jordan Nowitzki        35    0    1    0   0   0/1     0.0     0/0   0.0
Franz Anunoby          14    0    0    1   0   0/0     0.0     0/0   0.0

TEAM: FG: 12/21 (57.1%), 3PT: 3/6 (50.0%), REB: 7 (2 off, 5 def), AST: 9, TO: 2
TEAM FOULS: 2


Team_039
--------------------------------------------------------------------------------
Player                MIN  PTS  REB  AST  TO      FG   FG%      3P   3P%
--------------------------------------------------------------------------------
Tracy Mitchell         20    8    0    0   0   3/4    75.0     0/0   0.0
Donovan Markkanen      35    7    0    1   0   3/3   100.0     0/0   0.0
Jayson Cunningham      13    5    0    0   0   2/3    66.7     0/0   0.0
Victor Gasol           17    3    0    0   0   1/2    50.0     0/0   0.0
Austin O'Neal          32    2    1    0   0   1/2    50.0     0/0   0.0
Klay Wade              35    2    2    3   0   1/2    50.0     0/0   0.0
Bam Booker             14    2    2    0   0   1/1   100.0     0/0   0.0
Anfernee Carter        32    0    1    0   0   0/0     0.0     0/0   0.0
Yao Carter             17    0    2    0   0   0/0     0.0     0/0   0.0

TEAM: FG: 12/17 (70.6%), 3PT: 4/8 (50.0%), REB: 8 (0 off, 8 def), AST: 4, TO: 6
TEAM FOULS: 5 [Team_030 in BONUS]

================================================================================

================================================================================
                               FULL GAME COMPLETE                               
================================================================================

FINAL SCORE: Team_030 104, Team_039 122

SCORING BY QUARTER:
--------------------------------------------------------------------------------
Team                     Q1     Q2     Q3     Q4    FINAL
--------------------------------------------------------------------------------
Team_030                 24     22     31     27      104
Team_039                 32     35     26     29      122
--------------------------------------------------------------------------------

FULL GAME BOX SCORE:
================================================================================

Team_030
--------------------------------------------------------------------------------
Player                MIN  PTS  REB  AST  TO      FG   FG%      3P   3P%      FT STL BLK
--------------------------------------------------------------------------------
Joel Anunoby           35   20   16    3   2   9/14   64.3   0/2     0.0   2/2     0   0
Tim Barrett            35   13    0    5   1   3/5    60.0   1/2    50.0   1/1     0   0
Jordan Nowitzki        35    4    5    4   1   2/10   20.0   0/5     0.0   4/5     1   0
Jaren Green            35   18    5    5   4   9/13   69.2   0/1     0.0   2/2     1   1
Tyler Beal             29   15    0    4   1   8/11   72.7   1/2    50.0   1/2     0   0
RJ Carter              19   10    0    3   1   4/5    80.0   2/3    66.7   0/0     1   0
Josh Smith             14    9    0    3   1   4/6    66.7   1/2    50.0   1/2     1   0
Damian Green           14    4    4    1   1   2/4    50.0   0/1     0.0   2/2     2   0
Franz Anunoby          14    2    0    2   1   1/1   100.0   0/0     0.0   0/0     1   0
Pau James              13    5    6    0   0   2/3    66.7   1/1   100.0   0/0     0   0

TEAM: FG: 44/73 (60.3%), 3PT: 6/19 (31.6%), REB: 36 (13 off, 23 def), AST: 30, TO: 13


Team_039
--------------------------------------------------------------------------------
Player                MIN  PTS  REB  AST  TO      FG   FG%      3P   3P%      FT STL BLK
--------------------------------------------------------------------------------
Donovan Markkanen      35   20    7    3   1   8/10   80.0   2/2   100.0   3/4     0   1
Klay Wade              35   22    8    4   1  10/13   76.9   2/4    50.0   4/4     2   1
Austin O'Neal          32   26   10    3   0  11/16   68.8   6/9    66.7   1/1     0   2
Anfernee Carter        32   13    1    1   1   5/9    55.6   2/3    66.7   1/1     0   0
Jrue Bridges           28    0    0   10   1   0/5     0.0   0/2     0.0   0/0     1   0
Tracy Mitchell         20   12    0    1   4   5/6    83.3   2/3    66.7   0/0     0   0
Yao Carter             17    5    5    4   2   1/2    50.0   1/1   100.0   0/0     0   0
Victor Gasol           17    3    4    0   0   2/3    66.7   1/1   100.0   3/3     0   0
Bam Booker             14    8    2    0   2   3/3   100.0   0/0     0.0   1/2     1   0
Jayson Cunningham      13   11    0    1   1   4/5    80.0   2/3    66.7   1/1     0   0

TEAM: FG: 49/72 (68.1%), 3PT: 18/28 (64.3%), REB: 37 (9 off, 28 def), AST: 27, TO: 13

================================================================================
