================================================================================
                        FULL GAME - Team_042 vs Team_066                        
================================================================================

================================================================================
                       1ST QUARTER - Team_042 vs Team_066                       
================================================================================

[12:00] Team_042 possession (Score: 0-0)
Kristaps Parker attempts a 3Pt. Wide open! Pau Curry is 8.4 feet away. [MAN] Kristaps Parker misses. Rebound secured by Yao Brogdon.

[11:46] Team_066 possession (Score: 0-0)
FOUL! Shooting foul on Cade Dosunmu. Kyle Wagner to the line for 2 free throws. [Team fouls: 1] (Cade Dosunmu: 1 personal fouls)   FT 1/2: MISS   FT 2/2: GOOD Kyle Wagner makes 1/2 from the line.
Score: 0-1

[11:28] Team_042 possession (Score: 0-1)
Kristaps Parker attempts a Midrange. Wide open! Pau Curry is 7.0 feet away. [MAN] KRISTAPS PARKER MAKES IT!
Score: 2-1

[11:14] Team_066 possession (Score: 2-1)
Jimmy Davis attempts a 3Pt. Contested by Tyler Barrett (3.4 feet, ZONE). Jimmy Davis misses. Rebound secured by Tyler Barrett.

[10:58] Team_042 possession (Score: 2-1)
FOUL! Reach-in foul on Kyle Wagner during the drive. [Team fouls: 1] No free throws, side out. (Kyle Wagner: 1 personal fouls)

[10:44] Team_042 possession (Score: 2-1)
Kristaps Parker drives, picks up Pau Curry. Help arrives from Jimmy Davis! Kristaps Parker attempts a Dunk. Wide open! Jimmy Davis is 9.6 feet away. [MAN] Kristaps Parker misses. Rebound secured by Yao Brogdon.

[10:29] Team_066 possession (Score: 2-1)
Pau Curry drives and kicks out. Pau Curry attempts a 3Pt. Wide open! Kristaps Parker is 6.8 feet away. [MAN] PAU CURRY MAKES IT! Assist: Jimmy Davis
Score: 2-4

[10:12] Team_042 possession (Score: 2-4)
Dejounte Butler makes the Layup and draws the foul on Kyle Wagner! And-1! Dejounte Butler to the line for 1. [Team fouls: 2] (Kyle Wagner: 2 personal fouls)   FT 1/1: MISS Dejounte Butler makes 0/1 from the line. Rebound secured by Brandon Reaves.
Score: 4-4

[09:59] Team_066 possession (Score: 4-4)
Pau Curry attempts a Midrange. Contested by Kristaps Parker (4.8 feet, MAN). Pau Curry misses. Offensive rebound by Yao Brogdon! Yao Brogdon kicks it out.

[09:49] Team_066 possession (Score: 4-4)
Yao Brogdon drives and kicks out. Jimmy Davis attempts a 3Pt. Contested by Tyler Barrett (4.8 feet, MAN). Jimmy Davis misses. FOUL! Loose ball foul on Tyler Barrett during the rebound battle. [Team fouls: 2] No free throws, side out. (Tyler Barrett: 1 personal fouls)

[09:33] Team_066 possession (Score: 4-4)
Pau Curry attempts a 3Pt. Contested by Tyler Barrett (4.4 feet, ZONE). Pau Curry misses. Offensive rebound by Yao Brogdon! Yao Brogdon kicks it out.

[09:20] Team_066 possession (Score: 4-4)
Brandon Reaves drives, Cade Dosunmu stays with him. Brandon Reaves attempts a Dunk. Wide open! Cade Dosunmu is 6.1 feet away. [ZONE] BRANDON REAVES MAKES IT!
Score: 4-6

[09:11] Team_042 possession (Score: 4-6)
Jarrett Sabonis drives, Kyle Wagner stays with him. Jarrett Sabonis attempts a Layup. Contested by Kyle Wagner (5.1 feet, ZONE). JARRETT SABONIS MAKES IT!
Score: 6-6

[08:58] Team_066 possession (Score: 6-6)
Brandon Reaves attempts a 3Pt. Contested by Tyler Barrett (3.5 feet, ZONE). Brandon Reaves misses. Rebound secured by Cade Dosunmu.

[08:42] Team_042 possession (Score: 6-6)
FOUL! Shooting foul on Yao Brogdon. Tyler Barrett to the line for 2 free throws. [Team fouls: 3] (Yao Brogdon: 1 personal fouls)   FT 1/2: GOOD   FT 2/2: GOOD Tyler Barrett makes 2/2 from the line.
Score: 8-6

[08:29] Team_066 possession (Score: 8-6)
Pau Curry drives and kicks out. Pau Curry attempts a 3Pt. Contested by Kristaps Parker (2.8 feet, MAN). Pau Curry misses. Rebound secured by Tyler Barrett.

[08:17] Team_042 possession (Score: 8-6)
Jarrett Sabonis drives, picks up Kyle Wagner. Help arrives from Jimmy Davis! Jarrett Sabonis attempts a Dunk. Contested by Jimmy Davis (5.7 feet, ZONE). Jarrett Sabonis misses. Offensive rebound by Cade Dosunmu! Cade Dosunmu puts it back in!
Score: 10-6

[08:06] Team_066 possession (Score: 10-6)
FOUL! Reach-in foul on Cade Dosunmu during the drive. [Team fouls: 3] No free throws, side out. (Cade Dosunmu: 2 personal fouls)

[07:55] Team_066 possession (Score: 10-6)
Brandon Reaves attempts a 3Pt. Contested by Jarrett Sabonis (5.2 feet, MAN). Brandon Reaves misses. Offensive rebound by Kyle Wagner! Kyle Wagner kicks it out.

[07:36] Team_066 possession (Score: 10-6)
Brandon Reaves attempts a 3Pt. Contested by Jarrett Sabonis (3.9 feet, MAN). Brandon Reaves misses. Offensive rebound by Kyle Wagner! Kyle Wagner kicks it out.

[07:18] Team_066 possession (Score: 10-6)
Kyle Wagner attempts a Midrange. Contested by Cade Dosunmu (5.3 feet, MAN). Kyle Wagner misses. Offensive rebound by Yao Brogdon! Yao Brogdon kicks it out.

[07:03] Team_066 possession (Score: 10-6)
Kyle Wagner attempts a Midrange. Contested by Kristaps Parker (3.1 feet, ZONE). KYLE WAGNER MAKES IT!
Score: 10-8

[06:53] Team_042 possession (Score: 10-8)
Tyler Barrett attempts a 3Pt. Wide open! Pau Curry is 6.2 feet away. [ZONE] Tyler Barrett misses. Rebound secured by Kyle Wagner.

[06:36] Team_066 possession (Score: 10-8)
Pau Curry attempts a 3Pt. Wide open! Kristaps Parker is 6.2 feet away. [MAN] Pau Curry misses. Rebound secured by Tyler Barrett.

[06:22] Team_042 possession (Score: 10-8)
Kristaps Parker attempts a Layup. Contested by Pau Curry (4.5 feet, MAN). KRISTAPS PARKER MAKES IT! Assist: Dejounte Butler
Score: 12-8

[06:10] Team_066 possession (Score: 12-8)
Kyle Wagner makes the Midrange and draws the foul on Kristaps Parker! And-1! Kyle Wagner to the line for 1. [Team fouls: 4] (Kristaps Parker: 1 personal fouls)   FT 1/1: GOOD Kyle Wagner makes 1/1 from the line.
Score: 12-11

[05:53] Team_042 possession (Score: 12-11)
Jarrett Sabonis drives and kicks out. Cade Dosunmu attempts a 3Pt. Contested by Pau Curry (4.9 feet, ZONE). Cade Dosunmu misses. Rebound secured by Brandon Reaves.

[05:40] Team_066 possession (Score: 12-11)
Brandon Reaves drives, Cade Dosunmu stays with him. Brandon Reaves attempts a Layup. Wide open! Cade Dosunmu is 6.0 feet away. [ZONE] Brandon Reaves misses. Rebound secured by Tyler Barrett.

[05:30] Team_042 possession (Score: 12-11)
Kristaps Parker attempts a 3Pt. Contested by Pau Curry (4.2 feet, MAN). KRISTAPS PARKER MAKES IT!
Score: 15-11

[05:15] Team_066 possession (Score: 15-11)
Pau Curry drives and kicks out. Jimmy Davis attempts a Midrange. Contested by Tyler Barrett (2.8 feet, MAN). Jimmy Davis misses. Rebound secured by Cade Dosunmu.

[05:00] Team_042 possession (Score: 15-11)
Kristaps Parker attempts a 3Pt. Wide open! Pau Curry is 6.2 feet away. [MAN] KRISTAPS PARKER MAKES IT! Assist: Dejounte Butler
Score: 18-11

[04:48] Team_066 possession (Score: 18-11)
Brandon Reaves makes the Layup and draws the foul on Tyler Barrett! And-1! Brandon Reaves to the line for 1. [BONUS: 5 team fouls] (Tyler Barrett: 2 personal fouls)   FT 1/1: MISS Brandon Reaves makes 0/1 from the line. Rebound secured by Tyler Barrett.
Score: 18-13

[04:32] Team_042 possession (Score: 18-13)
Kristaps Parker loses control! Ball rolls out of bounds! TURNOVER! (dead ball)

[04:12] Team_066 possession (Score: 18-13)
Brandon Reaves attempts a 3Pt. Contested by Tyler Barrett (4.3 feet, ZONE). Brandon Reaves misses. Rebound secured by Cade Dosunmu.

[04:01] Team_042 possession (Score: 18-13)
Dejounte Butler attempts a Midrange. Contested by Yao Brogdon (5.0 feet, MAN). Dejounte Butler misses. Rebound secured by Yao Brogdon.

[03:48] Team_066 possession (Score: 18-13)
FOUL! Shooting foul on Jarrett Sabonis. Brandon Reaves to the line for 3 free throws. [BONUS: 6 team fouls] (Jarrett Sabonis: 1 personal fouls)   FT 1/3: GOOD   FT 2/3: GOOD   FT 3/3: GOOD Brandon Reaves makes 3/3 from the line.
Score: 18-16

[03:34] Team_042 possession (Score: 18-16)
Tyler Barrett attempts a Midrange. Wide open! Jimmy Davis is 6.4 feet away. [ZONE] TYLER BARRETT MAKES IT!
Score: 20-16

[03:18] Team_066 possession (Score: 20-16)
Kyle Wagner attempts a Layup. Contested by Cade Dosunmu (4.2 feet, MAN). Kyle Wagner misses. Rebound secured by Cade Dosunmu.

[03:08] Team_042 possession (Score: 20-16)
Dejounte Butler drives, Kyle Wagner stays with him. Dejounte Butler attempts a Layup. Heavily contested by Kyle Wagner (1.2 feet, ZONE)! DEJOUNTE BUTLER MAKES IT! Assist: Kristaps Parker
Score: 22-16

[02:52] Team_066 possession (Score: 22-16)
Pau Curry attempts a 3Pt. Contested by Tyler Barrett (3.9 feet, ZONE). Pau Curry misses. Rebound secured by Cade Dosunmu.

[02:35] Team_042 possession (Score: 22-16)
Jarrett Sabonis attempts a 3Pt. Contested by Brandon Reaves (5.2 feet, MAN). JARRETT SABONIS MAKES IT! Assist: Dejounte Butler
Score: 25-16

[02:20] Team_066 possession (Score: 25-16)
Brandon Reaves attempts a 3Pt. Contested by Jarrett Sabonis (3.6 feet, MAN). Brandon Reaves misses. Rebound secured by Dejounte Butler.

[02:06] Team_042 possession (Score: 25-16)
Kristaps Parker attempts a 3Pt. Wide open! Pau Curry is 7.2 feet away. [ZONE] Kristaps Parker misses. Rebound secured by Brandon Reaves.

[01:51] Team_066 possession (Score: 25-16)
Pau Curry attempts a Midrange. Wide open! Kristaps Parker is 8.3 feet away. [MAN] PAU CURRY MAKES IT!
Score: 25-18

[01:35] Team_042 possession (Score: 25-18)
Tyler Barrett drives, Jimmy Davis stays with him. Tyler Barrett attempts a Layup. Wide open! Jimmy Davis is 7.1 feet away. [MAN] TYLER BARRETT MAKES IT!
Score: 27-18

[01:19] Team_066 possession (Score: 27-18)
FOUL! Shooting foul on Kristaps Parker. Pau Curry to the line for 2 free throws. [BONUS: 7 team fouls] (Kristaps Parker: 2 personal fouls)   FT 1/2: GOOD   FT 2/2: GOOD Pau Curry makes 2/2 from the line.
Score: 27-20

[01:05] Team_042 possession (Score: 27-20)
Kristaps Parker attempts a 3Pt. Heavily contested by Pau Curry (1.7 feet, MAN)! Kristaps Parker misses. Rebound secured by Brandon Reaves.

[00:53] Team_066 possession (Score: 27-20)
Pau Curry attempts a 3Pt. Contested by Tyler Barrett (5.1 feet, ZONE). Pau Curry misses. Rebound secured by Cade Dosunmu.

[00:40] Team_042 possession (Score: 27-20)
Tyler Barrett attempts a Midrange. Wide open! Pau Curry is 8.8 feet away. [ZONE] Tyler Barrett misses. Rebound secured by Yao Brogdon.

[00:23] Team_066 possession (Score: 27-20)
Kyle Wagner attempts a Layup. Contested by Cade Dosunmu (4.0 feet, MAN). KYLE WAGNER MAKES IT! Assist: Jimmy Davis
Score: 27-22

[00:08] Team_042 possession (Score: 27-22)
Dejounte Butler attempts a Midrange. Contested by Brandon Reaves (5.3 feet, ZONE). Dejounte Butler misses. Offensive rebound by Cade Dosunmu! Cade Dosunmu's putback is no good. Rebound secured by Kyle Wagner.

================================================================================
                              1ST QUARTER COMPLETE                              
================================================================================

1ST QUARTER SCORE: Team_042 27, Team_066 22

BOX SCORE:
================================================================================

Team_042
--------------------------------------------------------------------------------
Player                MIN  PTS  REB  AST  TO      FG   FG%      3P   3P%
--------------------------------------------------------------------------------
Kristaps Parker        12   10    0    1   0   4/8    50.0     0/0   0.0
Kyle Wagner            12    8    4    0   0   4/5    80.0     0/0   0.0
Tyler Barrett          12    6    5    0   0   3/5    60.0     0/0   0.0
Jarrett Sabonis        12    5    0    0   0   2/3    66.7     0/0   0.0
Dejounte Butler        12    2    1    3   0   1/4    25.0     0/0   0.0
Cade Dosunmu           12    2    7    0   0   1/1   100.0     0/0   0.0

TEAM: FG: 11/21 (52.4%), 3PT: 3/7 (42.9%), REB: 14 (2 off, 12 def), AST: 4, TO: 1
TEAM FOULS: 7 [Team_066 in BONUS]


Team_066
--------------------------------------------------------------------------------
Player                MIN  PTS  REB  AST  TO      FG   FG%      3P   3P%
--------------------------------------------------------------------------------
Pau Curry              12    7    0    0   0   3/8    37.5     0/0   0.0
Brandon Reaves         12    5    4    0   0   2/7    28.6     0/0   0.0
Yao Brogdon            12    0    8    0   0   0/0     0.0     0/0   0.0
Jimmy Davis            12    0    0    2   0   0/1     0.0     0/0   0.0

TEAM: FG: 9/21 (42.9%), 3PT: 1/8 (12.5%), REB: 15 (6 off, 9 def), AST: 2, TO: 0
TEAM FOULS: 3

================================================================================

================================================================================
                       2ND QUARTER - Team_042 vs Team_066                       
================================================================================

[12:00] Team_042 possession (Score: 27-22)
Cade Dosunmu attempts a 3Pt. Wide open! Yao Brogdon is 6.1 feet away. [ZONE] Cade Dosunmu misses. Offensive rebound by Dejounte Butler! Dejounte Butler puts it back in!
Score: 29-22

[11:45] Team_066 possession (Score: 29-22)
FOUL! Holding foul on Jarrett Sabonis. [Team fouls: 1] No free throws, side out. (Jarrett Sabonis: 1 personal fouls)

[11:33] Team_066 possession (Score: 29-22)
Jimmy Davis attempts a 3Pt. Contested by Tyler Barrett (4.2 feet, ZONE). Jimmy Davis misses. FOUL! Loose ball foul on Cade Dosunmu during the rebound battle. [Team fouls: 2] No free throws, side out. (Cade Dosunmu: 1 personal fouls)

[11:13] Team_066 possession (Score: 29-22)
Kyle Wagner throws a bad pass out of bounds! TURNOVER! (dead ball)

[11:13] Substitution (Team_042): Tyler Barrett OUT → Khris George IN (stamina_rule2)

[11:13] Substitution (Team_042): Kristaps Parker OUT → Isaiah Randle IN (stamina_rule2)

[11:13] Substitution (Team_042): Jarrett Sabonis OUT → Gary Jackson IN (stamina_rule2)

[11:13] Substitution (Team_042): Dejounte Butler OUT → Allen Towns IN (stamina_rule2)

[11:13] Substitution (Team_042): Cade Dosunmu OUT → Lamelo Stewart IN (stamina_rule2)

[11:13] Substitution (Team_066): Jimmy Davis OUT → Pascal Carter IN (stamina_rule2)

[11:13] Substitution (Team_066): Pau Curry OUT → Lauri LaVine IN (stamina_rule2)

[11:13] Substitution (Team_066): Brandon Reaves OUT → Brandon Middleton IN (stamina_rule2)

[11:13] Substitution (Team_066): Yao Brogdon OUT → Cole Morant IN (stamina_rule2)

[11:13] Substitution (Team_066): Kyle Wagner OUT → Donovan Simmons IN (stamina_rule2)

[11:03] Team_042 possession (Score: 29-22)
Lamelo Stewart attempts a Layup. Wide open! Donovan Simmons is 6.1 feet away. [MAN] Lamelo Stewart misses. Rebound secured by Brandon Middleton.

[10:44] Team_066 possession (Score: 29-22)
Brandon Middleton attempts a 3Pt. Contested by Gary Jackson (5.3 feet, ZONE). Brandon Middleton misses. Rebound secured by Gary Jackson.

[10:32] Team_042 possession (Score: 29-22)
Isaiah Randle attempts a 3Pt. Contested by Lauri LaVine (5.3 feet, ZONE). Isaiah Randle misses. Rebound secured by Brandon Middleton.

[10:21] Team_066 possession (Score: 29-22)
Cole Morant drives, Allen Towns stays with him. Cole Morant attempts a Dunk. Wide open! Allen Towns is 7.7 feet away. [MAN] COLE MORANT MAKES IT!
Score: 29-24

[10:06] Team_042 possession (Score: 29-24)
Lamelo Stewart drives, Donovan Simmons stays with him. Lamelo Stewart attempts a Layup. Contested by Donovan Simmons (5.2 feet, MAN). LAMELO STEWART MAKES IT! Assist: Khris George
Score: 31-24

[09:48] Team_066 possession (Score: 31-24)
FOUL! Reach-in foul on Allen Towns during the drive. [Team fouls: 3] No free throws, side out. (Allen Towns: 1 personal fouls)

[09:37] Team_066 possession (Score: 31-24)
Pascal Carter drives to the basket... FOUL! Offensive foul on Pascal Carter! Khris George drew the charge! [Team fouls: 1] (Pascal Carter: 1 personal fouls) TURNOVER! (dead ball)

[09:22] Team_042 possession (Score: 31-24)
Allen Towns attempts a 3Pt. Wide open! Lauri LaVine is 8.0 feet away. [ZONE] Allen Towns misses. Rebound secured by Donovan Simmons.

[09:07] Team_066 possession (Score: 31-24)
Lauri LaVine attempts a 3Pt. Contested by Khris George (3.7 feet, ZONE). Lauri LaVine misses. Rebound secured by Lamelo Stewart.

[08:54] Team_042 possession (Score: 31-24)
Isaiah Randle makes the Layup and draws the foul on Lauri LaVine! And-1! Isaiah Randle to the line for 1. [Team fouls: 2] (Lauri LaVine: 1 personal fouls)   FT 1/1: MISS Isaiah Randle makes 0/1 from the line. Rebound secured by Brandon Middleton.
Score: 33-24

[08:43] Team_066 possession (Score: 33-24)
Donovan Simmons drives, picks up Lamelo Stewart. Help arrives from Khris George! Donovan Simmons attempts a Layup. Contested by Khris George (3.1 feet, MAN). Donovan Simmons misses. Rebound secured by Lamelo Stewart.

[08:28] Team_042 possession (Score: 33-24)
Isaiah Randle attempts a Layup. Wide open! Lauri LaVine is 6.7 feet away. [MAN] ISAIAH RANDLE MAKES IT! Assist: Allen Towns
Score: 35-24

[08:16] Team_066 possession (Score: 35-24)
Lauri LaVine attempts a 3Pt. Contested by Allen Towns (5.7 feet, ZONE). Lauri LaVine misses. Rebound secured by Allen Towns.

[07:59] Team_042 possession (Score: 35-24)
Lamelo Stewart attempts a Midrange. Heavily contested by Lauri LaVine (0.5 feet, ZONE)! Lamelo Stewart misses. Rebound secured by Donovan Simmons.

[07:49] Team_066 possession (Score: 35-24)
Cole Morant makes the Layup and draws the foul on Allen Towns! And-1! Cole Morant to the line for 1. [Team fouls: 4] (Allen Towns: 2 personal fouls)   FT 1/1: GOOD Cole Morant makes 1/1 from the line.
Score: 35-27

[07:31] Team_042 possession (Score: 35-27)
Khris George attempts a Midrange. Contested by Brandon Middleton (3.7 feet, ZONE). KHRIS GEORGE MAKES IT! Assist: Allen Towns
Score: 37-27

[07:17] Team_066 possession (Score: 37-27)
Pascal Carter makes the Layup and draws the foul on Gary Jackson! And-1! Pascal Carter to the line for 1. [BONUS: 5 team fouls] (Gary Jackson: 1 personal fouls)   FT 1/1: GOOD Pascal Carter makes 1/1 from the line.
Score: 37-30

[07:04] Team_042 possession (Score: 37-30)
Khris George attempts a Midrange. Contested by Lauri LaVine (4.0 feet, ZONE). Khris George misses. Rebound secured by Lauri LaVine.

[06:53] Team_066 possession (Score: 37-30)
Cole Morant loses the ball! Stripped by Allen Towns! TURNOVER! (live ball)

[06:39] Team_042 possession (Score: 37-30)
Khris George attempts a 3Pt. Contested by Lauri LaVine (5.4 feet, ZONE). KHRIS GEORGE MAKES IT!
Score: 40-30

[06:20] Team_066 possession (Score: 40-30)
Pascal Carter attempts a 3Pt. Contested by Khris George (2.8 feet, ZONE). PASCAL CARTER MAKES IT! Assist: Lauri LaVine
Score: 40-33

[06:07] Team_042 possession (Score: 40-33)
Gary Jackson attempts a Midrange. Wide open! Brandon Middleton is 6.7 feet away. [MAN] Gary Jackson misses. Rebound secured by Brandon Middleton.

[05:47] Team_066 possession (Score: 40-33)
Pascal Carter attempts a 3Pt. Contested by Khris George (3.6 feet, MAN). Pascal Carter misses. Rebound secured by Gary Jackson.

[05:29] Team_042 possession (Score: 40-33)
Gary Jackson drives, Donovan Simmons stays with him. Gary Jackson attempts a Layup. Wide open! Donovan Simmons is 6.3 feet away. [ZONE] Gary Jackson misses. Rebound secured by Lauri LaVine.

[05:15] Team_066 possession (Score: 40-33)
FOUL! Shooting foul on Allen Towns. Cole Morant to the line for 3 free throws. [BONUS: 6 team fouls] (Allen Towns: 3 personal fouls)   FT 1/3: MISS   FT 2/3: MISS   FT 3/3: GOOD Cole Morant makes 1/3 from the line.
Score: 40-34

[05:02] Team_042 possession (Score: 40-34)
Isaiah Randle throws a bad pass! Stolen by Lauri LaVine! TURNOVER! (live ball)

[04:52] Team_066 possession (Score: 40-34)
Brandon Middleton loses control! Ball rolls out of bounds! TURNOVER! (dead ball)

[04:41] Team_042 possession (Score: 40-34)
FOUL! Holding foul on Donovan Simmons. [Team fouls: 3] No free throws, side out. (Donovan Simmons: 1 personal fouls)

[04:26] Team_042 possession (Score: 40-34)
Khris George drives and kicks out. Allen Towns attempts a 3Pt. Wide open! Cole Morant is 6.5 feet away. [MAN] ALLEN TOWNS MAKES IT! Assist: Khris George
Score: 43-34

[04:10] Team_066 possession (Score: 43-34)
Donovan Simmons attempts a Layup. BLOCKED BY LAMELO STEWART! Ball is loose! Rebound secured by Lamelo Stewart.

[03:59] Team_042 possession (Score: 43-34)
FOUL! Holding foul on Cole Morant. [Team fouls: 4] No free throws, side out. (Cole Morant: 1 personal fouls)

[03:43] Team_042 possession (Score: 43-34)
Lamelo Stewart drives, Donovan Simmons stays with him. Lamelo Stewart attempts a Dunk. Wide open! Donovan Simmons is 8.2 feet away. [MAN] LAMELO STEWART MAKES IT! Assist: Allen Towns
Score: 45-34

[03:31] Team_066 possession (Score: 45-34)
FOUL! Holding foul on Allen Towns. [IN THE BONUS! 7 team fouls] Cole Morant to the line for 2 free throws. (Allen Towns: 4 personal fouls)   FT 1/2: MISS   FT 2/2: GOOD Cole Morant makes 1/2 from the line.
Score: 45-35

[03:13] Team_042 possession (Score: 45-35)
Khris George attempts a Midrange. Wide open! Cole Morant is 9.2 feet away. [ZONE] KHRIS GEORGE MAKES IT!
Score: 47-35

[02:57] Team_066 possession (Score: 47-35)
Lauri LaVine attempts a 3Pt. Contested by Khris George (3.3 feet, ZONE). Lauri LaVine misses. Offensive rebound by Donovan Simmons! Donovan Simmons kicks it out.

[02:39] Team_066 possession (Score: 47-35)
Donovan Simmons attempts a 3Pt. Contested by Khris George (2.0 feet, ZONE). Donovan Simmons misses. Offensive rebound by Donovan Simmons! Donovan Simmons kicks it out.

[02:25] Team_066 possession (Score: 47-35)
Cole Morant attempts a Midrange. Wide open! Gary Jackson is 6.4 feet away. [ZONE] COLE MORANT MAKES IT! Assist: Lauri LaVine
Score: 47-37

[02:07] Team_042 possession (Score: 47-37)
Khris George attempts a Midrange. Contested by Lauri LaVine (5.4 feet, ZONE). KHRIS GEORGE MAKES IT!
Score: 49-37

[01:56] Team_066 possession (Score: 49-37)
Lauri LaVine attempts a Layup. Contested by Allen Towns (3.7 feet, ZONE). LAURI LAVINE MAKES IT! Assist: Brandon Middleton
Score: 49-39

[01:41] Team_042 possession (Score: 49-39)
Isaiah Randle attempts a 3Pt. Wide open! Brandon Middleton is 9.8 feet away. [ZONE] Isaiah Randle misses. Rebound secured by Lauri LaVine.

[01:28] Team_066 possession (Score: 49-39)
Cole Morant drives to the basket... Cole Morant throws a bad pass out of bounds! TURNOVER! (dead ball)

[01:14] Team_042 possession (Score: 49-39)
Gary Jackson drives to the basket... Gary Jackson loses the ball! Stripped by Brandon Middleton! TURNOVER! (live ball)

[01:02] Team_066 possession (Score: 49-39)
FOUL! Shooting foul on Allen Towns. Brandon Middleton to the line for 2 free throws. [BONUS: 8 team fouls] (Allen Towns: 5 personal fouls)   FT 1/2: GOOD   FT 2/2: GOOD Brandon Middleton makes 2/2 from the line.
Score: 49-41

[00:45] Team_042 possession (Score: 49-41)
FOUL! Reach-in foul on Cole Morant during the drive. [IN THE BONUS! 5 team fouls] Allen Towns to the line for 2 free throws. (Cole Morant: 2 personal fouls)   FT 1/2: GOOD   FT 2/2: GOOD Allen Towns makes 2/2 from the line.
Score: 51-41

[00:31] Team_066 possession (Score: 51-41)
Donovan Simmons attempts a Layup. Wide open! Allen Towns is 6.4 feet away. [ZONE] DONOVAN SIMMONS MAKES IT!
Score: 51-43

[00:16] Team_042 possession (Score: 51-43)
Gary Jackson attempts a Layup. Contested by Donovan Simmons (4.1 feet, ZONE). GARY JACKSON MAKES IT! Assist: Khris George
Score: 53-43

================================================================================
                              2ND QUARTER COMPLETE                              
================================================================================

2ND QUARTER SCORE: Team_042 26, Team_066 21

BOX SCORE:
================================================================================

Team_042
--------------------------------------------------------------------------------
Player                MIN  PTS  REB  AST  TO      FG   FG%      3P   3P%
--------------------------------------------------------------------------------
Khris George           11    9    0    3   0   4/5    80.0     0/0   0.0
Allen Towns            11    5    1    3   0   2/3    66.7     0/0   0.0
Lamelo Stewart         11    4    3    0   0   2/4    50.0     0/0   0.0
Dejounte Butler        13    2    1    0   0   1/1   100.0     0/0   0.0
Gary Jackson           11    2    2    0   0   1/3    33.3     0/0   0.0
Isaiah Randle          11    2    0    0   0   1/4    25.0     0/0   0.0

TEAM: FG: 11/20 (55.0%), 3PT: 2/5 (40.0%), REB: 7 (1 off, 6 def), AST: 6, TO: 2
TEAM FOULS: 8 [Team_066 in BONUS]


Team_066
--------------------------------------------------------------------------------
Player                MIN  PTS  REB  AST  TO      FG   FG%      3P   3P%
--------------------------------------------------------------------------------
Cole Morant            11    9    0    0   0   5/5   100.0     0/0   0.0
Pascal Carter          11    6    0    0   0   2/3    66.7     0/0   0.0
Brandon Middleton      11    2    4    1   0   1/2    50.0     0/0   0.0
Donovan Simmons        11    2    4    0   0   1/3    33.3     0/0   0.0
Lauri LaVine           11    2    3    2   0   1/3    33.3     0/0   0.0
Yao Brogdon            13    0    1    0   0   0/0     0.0     0/0   0.0

TEAM: FG: 10/16 (62.5%), 3PT: 2/6 (33.3%), REB: 12 (3 off, 9 def), AST: 3, TO: 5
TEAM FOULS: 5 [Team_042 in BONUS]

================================================================================

================================================================================
                       3RD QUARTER - Team_042 vs Team_066                       
================================================================================

[12:00] Team_042 possession (Score: 53-43)
Kristaps Parker attempts a Midrange. Wide open! Yao Brogdon is 6.9 feet away. [ZONE] KRISTAPS PARKER MAKES IT!
Score: 55-43

[11:43] Team_066 possession (Score: 55-43)
Pau Curry attempts a 3Pt. Wide open! Kristaps Parker is 6.3 feet away. [MAN] Pau Curry misses. Rebound secured by Dejounte Butler.

[11:28] Team_042 possession (Score: 55-43)
Dejounte Butler attempts a 3Pt. Contested by Yao Brogdon (3.3 feet, MAN). Dejounte Butler misses. Offensive rebound by Cade Dosunmu! Cade Dosunmu puts it back in!
Score: 57-43

[11:17] Team_066 possession (Score: 57-43)
Jimmy Davis makes the Layup and draws the foul on Cade Dosunmu! And-1! Jimmy Davis to the line for 1. [Team fouls: 1] (Cade Dosunmu: 1 personal fouls)   FT 1/1: GOOD Jimmy Davis makes 1/1 from the line.
Score: 57-46

[11:02] Team_042 possession (Score: 57-46)
Cade Dosunmu attempts a Layup. Wide open! Kyle Wagner is 6.6 feet away. [MAN] CADE DOSUNMU MAKES IT! Assist: Dejounte Butler
Score: 59-46

[10:48] Team_066 possession (Score: 59-46)
FOUL! Holding foul on Dejounte Butler. [Team fouls: 2] No free throws, side out. (Dejounte Butler: 1 personal fouls)

[10:32] Team_066 possession (Score: 59-46)
FOUL! Shooting foul on Dejounte Butler. Yao Brogdon to the line for 2 free throws. [Team fouls: 3] (Dejounte Butler: 2 personal fouls)   FT 1/2: GOOD   FT 2/2: GOOD Yao Brogdon makes 2/2 from the line.
Score: 59-48

[10:19] Team_042 possession (Score: 59-48)
Cade Dosunmu drives and kicks out. Jarrett Sabonis attempts a 3Pt. Contested by Pau Curry (5.1 feet, ZONE). JARRETT SABONIS MAKES IT!
Score: 62-48

[10:08] Team_066 possession (Score: 62-48)
Pau Curry attempts a Layup. Wide open! Kristaps Parker is 7.6 feet away. [MAN] Pau Curry misses. Rebound secured by Dejounte Butler.

[09:55] Team_042 possession (Score: 62-48)
Jarrett Sabonis attempts a Layup. Wide open! Brandon Reaves is 7.9 feet away. [MAN] JARRETT SABONIS MAKES IT!
Score: 64-48

[09:38] Team_066 possession (Score: 64-48)
Pau Curry attempts a 3Pt. Wide open! Jarrett Sabonis is 8.6 feet away. [ZONE] PAU CURRY MAKES IT! Assist: Jimmy Davis
Score: 64-51

[09:25] Team_042 possession (Score: 64-51)
Jarrett Sabonis drives and kicks out. Cade Dosunmu attempts a 3Pt. Contested by Kyle Wagner (5.5 feet, MAN). Cade Dosunmu misses. Rebound secured by Brandon Reaves.

[09:13] Team_066 possession (Score: 64-51)
Jimmy Davis attempts a Midrange. Wide open! Kristaps Parker is 7.8 feet away. [ZONE] Jimmy Davis misses. Rebound secured by Tyler Barrett.

[09:03] Team_042 possession (Score: 64-51)
Tyler Barrett attempts a 3Pt. Contested by Jimmy Davis (4.2 feet, MAN). Tyler Barrett misses. Rebound secured by Kyle Wagner.

[08:48] Team_066 possession (Score: 64-51)
Kyle Wagner drives, Cade Dosunmu stays with him. Kyle Wagner attempts a Layup. Contested by Cade Dosunmu (4.2 feet, MAN). KYLE WAGNER MAKES IT! Assist: Jimmy Davis
Score: 64-53

[08:33] Team_042 possession (Score: 64-53)
Kristaps Parker drives and kicks out. Dejounte Butler attempts a 3Pt. Contested by Pau Curry (4.9 feet, ZONE). Dejounte Butler misses. Offensive rebound by Cade Dosunmu! Cade Dosunmu puts it back in!
Score: 66-53

[08:19] Team_066 possession (Score: 66-53)
Jimmy Davis attempts a 3Pt. Contested by Dejounte Butler (3.8 feet, ZONE). Jimmy Davis misses. Rebound secured by Cade Dosunmu.

[08:03] Team_042 possession (Score: 66-53)
Cade Dosunmu attempts a 3Pt. Contested by Yao Brogdon (5.0 feet, ZONE). Cade Dosunmu misses. Offensive rebound by Cade Dosunmu! Cade Dosunmu puts it back in!
Score: 68-53

[07:48] Team_066 possession (Score: 68-53)
Yao Brogdon attempts a 3Pt. Heavily contested by Dejounte Butler (1.5 feet, MAN)! Yao Brogdon misses. Rebound secured by Cade Dosunmu.

[07:31] Team_042 possession (Score: 68-53)
FOUL! Reach-in foul on Jimmy Davis during the drive. [Team fouls: 1] No free throws, side out. (Jimmy Davis: 1 personal fouls)

[07:16] Team_042 possession (Score: 68-53)
Dejounte Butler attempts a 3Pt. Contested by Pau Curry (5.4 feet, ZONE). Dejounte Butler misses. Offensive rebound by Cade Dosunmu! Cade Dosunmu puts it back in!
Score: 70-53

[07:01] Team_066 possession (Score: 70-53)
Jimmy Davis attempts a 3Pt. Contested by Tyler Barrett (3.8 feet, ZONE). Jimmy Davis misses. Rebound secured by Cade Dosunmu.

[06:49] Team_042 possession (Score: 70-53)
Dejounte Butler attempts a 3Pt. Wide open! Yao Brogdon is 7.1 feet away. [MAN] Dejounte Butler misses. Rebound secured by Kyle Wagner.

[06:37] Team_066 possession (Score: 70-53)
Kyle Wagner attempts a Layup. BLOCKED BY CADE DOSUNMU! Ball is loose! Offensive rebound by Kyle Wagner! Kyle Wagner kicks it out.

[06:25] Team_066 possession (Score: 70-53)
Yao Brogdon attempts a 3Pt. Heavily contested by Dejounte Butler (0.9 feet, MAN)! Yao Brogdon misses. Offensive rebound by Yao Brogdon! Yao Brogdon kicks it out.

[06:13] Team_066 possession (Score: 70-53)
Pau Curry attempts a 3Pt. Contested by Tyler Barrett (4.8 feet, ZONE). Pau Curry misses. FOUL! Loose ball foul on Cade Dosunmu during the rebound battle. [Team fouls: 4] No free throws, side out. (Cade Dosunmu: 2 personal fouls)

[05:59] Team_066 possession (Score: 70-53)
Pau Curry attempts a 3Pt. Contested by Dejounte Butler (4.4 feet, ZONE). Pau Curry misses. Rebound secured by Cade Dosunmu.

[05:46] Team_042 possession (Score: 70-53)
Jarrett Sabonis attempts a Layup. Contested by Brandon Reaves (3.4 feet, MAN). Jarrett Sabonis misses. Offensive rebound by Cade Dosunmu! Cade Dosunmu puts it back in!
Score: 72-53

[05:29] Team_066 possession (Score: 72-53)
Pau Curry attempts a 3Pt. Wide open! Kristaps Parker is 6.1 feet away. [MAN] Pau Curry misses. Rebound secured by Tyler Barrett.

[05:15] Team_042 possession (Score: 72-53)
FOUL! Shooting foul on Jimmy Davis. Kristaps Parker to the line for 2 free throws. [Team fouls: 2] (Jimmy Davis: 2 personal fouls)   FT 1/2: GOOD   FT 2/2: GOOD Kristaps Parker makes 2/2 from the line.
Score: 74-53

[05:01] Team_066 possession (Score: 74-53)
Yao Brogdon makes the Midrange and draws the foul on Dejounte Butler! And-1! Yao Brogdon to the line for 1. [BONUS: 5 team fouls] (Dejounte Butler: 3 personal fouls)   FT 1/1: GOOD Yao Brogdon makes 1/1 from the line.
Score: 74-56

[04:42] Team_042 possession (Score: 74-56)
Jarrett Sabonis attempts a 3Pt. Wide open! Brandon Reaves is 7.6 feet away. [MAN] JARRETT SABONIS MAKES IT! Assist: Cade Dosunmu
Score: 77-56

[04:26] Team_066 possession (Score: 77-56)
Jimmy Davis attempts a 3Pt. Contested by Tyler Barrett (3.5 feet, ZONE). Jimmy Davis misses. Rebound secured by Cade Dosunmu.

[04:17] Team_042 possession (Score: 77-56)
Tyler Barrett drives, picks up Kyle Wagner. Help arrives from Jimmy Davis! Tyler Barrett attempts a Dunk. Contested by Jimmy Davis (5.7 feet, ZONE). Tyler Barrett misses. Rebound secured by Yao Brogdon.

[04:06] Team_066 possession (Score: 77-56)
Kyle Wagner attempts a Layup. Wide open! Cade Dosunmu is 6.1 feet away. [ZONE] KYLE WAGNER MAKES IT! Assist: Brandon Reaves
Score: 77-58

[03:49] Team_042 possession (Score: 77-58)
Tyler Barrett attempts a 3Pt. Wide open! Pau Curry is 9.2 feet away. [ZONE] TYLER BARRETT MAKES IT! Assist: Jarrett Sabonis
Score: 80-58

[03:33] Team_066 possession (Score: 80-58)
Brandon Reaves attempts a 3Pt. Wide open! Tyler Barrett is 6.4 feet away. [ZONE] Brandon Reaves misses. Rebound secured by Dejounte Butler.

[03:16] Team_042 possession (Score: 80-58)
Dejounte Butler attempts a 3Pt. Contested by Yao Brogdon (5.6 feet, MAN). Dejounte Butler misses. Rebound secured by Brandon Reaves.

[03:02] Team_066 possession (Score: 80-58)
Jimmy Davis drives, picks up Cade Dosunmu. Help arrives from Tyler Barrett! Jimmy Davis attempts a Dunk. Wide open! Tyler Barrett is 8.4 feet away. [ZONE] Jimmy Davis misses. Rebound secured by Tyler Barrett.

[02:49] Team_042 possession (Score: 80-58)
Tyler Barrett makes the Layup and draws the foul on Jimmy Davis! And-1! Tyler Barrett to the line for 1. [Team fouls: 3] (Jimmy Davis: 3 personal fouls)   FT 1/1: GOOD Tyler Barrett makes 1/1 from the line.
Score: 83-58

[02:32] Team_066 possession (Score: 83-58)
Jimmy Davis attempts a Layup. Contested by Cade Dosunmu (5.4 feet, ZONE). Jimmy Davis misses. Rebound secured by Tyler Barrett.

[02:15] Team_042 possession (Score: 83-58)
Jarrett Sabonis makes the Layup and draws the foul on Kyle Wagner! And-1! Jarrett Sabonis to the line for 1. [Team fouls: 4] (Kyle Wagner: 1 personal fouls)   FT 1/1: GOOD Jarrett Sabonis makes 1/1 from the line.
Score: 86-58

[02:04] Team_066 possession (Score: 86-58)
Kyle Wagner drives to the basket... FOUL! Offensive foul on Kyle Wagner! Cade Dosunmu drew the charge! [Team fouls: 5] (Kyle Wagner: 2 personal fouls) TURNOVER! (dead ball)

[01:55] Team_042 possession (Score: 86-58)
FOUL! Reach-in foul on Kyle Wagner during the drive. [IN THE BONUS! 6 team fouls] Kristaps Parker to the line for 2 free throws. (Kyle Wagner: 3 personal fouls)   FT 1/2: GOOD   FT 2/2: MISS Kristaps Parker makes 1/2 from the line. Rebound secured by Brandon Reaves.
Score: 87-58

[01:40] Team_066 possession (Score: 87-58)
Brandon Reaves drives and kicks out. Brandon Reaves attempts a 3Pt. Contested by Jarrett Sabonis (4.9 feet, MAN). Brandon Reaves misses. Rebound secured by Cade Dosunmu.

[01:24] Team_042 possession (Score: 87-58)
Dejounte Butler drives, Yao Brogdon stays with him. Dejounte Butler attempts a Dunk. Contested by Yao Brogdon (3.0 feet, MAN). Dejounte Butler misses. Offensive rebound by Cade Dosunmu! Cade Dosunmu puts it back in!
Score: 89-58

[01:11] Team_066 possession (Score: 89-58)
Brandon Reaves attempts a 3Pt. Heavily contested by Jarrett Sabonis (1.6 feet, MAN)! Brandon Reaves misses. FOUL! Loose ball foul on Dejounte Butler during the rebound battle. [IN THE BONUS! 6 team fouls] Kyle Wagner to the line for 2 free throws. (Dejounte Butler: 4 personal fouls)   FT 1/2: GOOD   FT 2/2: GOOD Kyle Wagner makes 2/2 from the line.
Score: 89-60

[01:00] Team_042 possession (Score: 89-60)
Kristaps Parker loses control! Ball rolls out of bounds! TURNOVER! (dead ball)

[01:00] Substitution (Team_042): Tyler Barrett OUT → Khris George IN (stamina_rule2)

[01:00] Substitution (Team_042): Kristaps Parker OUT → Isaiah Randle IN (stamina_rule2)

[01:00] Substitution (Team_042): Jarrett Sabonis OUT → Gary Jackson IN (stamina_rule2)

[01:00] Substitution (Team_042): Dejounte Butler OUT → Allen Towns IN (stamina_rule2)

[01:00] Substitution (Team_042): Cade Dosunmu OUT → Lamelo Stewart IN (stamina_rule2)

[01:00] Substitution (Team_066): Jimmy Davis OUT → Pascal Carter IN (stamina_rule2)

[01:00] Substitution (Team_066): Pau Curry OUT → Lauri LaVine IN (stamina_rule2)

[01:00] Substitution (Team_066): Brandon Reaves OUT → Brandon Middleton IN (stamina_rule2)

[01:00] Substitution (Team_066): Yao Brogdon OUT → Cole Morant IN (stamina_rule2)

[01:00] Substitution (Team_066): Kyle Wagner OUT → Donovan Simmons IN (stamina_rule2)

[00:44] Team_066 possession (Score: 89-60)
Lauri LaVine drives to the basket... Lauri LaVine throws a bad pass out of bounds! TURNOVER! (dead ball)

[00:32] Team_042 possession (Score: 89-60)
Lamelo Stewart drives to the basket... Lamelo Stewart loses control! Ball rolls out of bounds! TURNOVER! (dead ball)

[00:18] Team_066 possession (Score: 89-60)
Donovan Simmons attempts a Midrange. BLOCKED BY LAMELO STEWART! Ball is loose! Rebound secured by Lamelo Stewart.

[00:07] Team_042 possession (Score: 89-60)
Allen Towns drives and kicks out. Allen Towns attempts a Midrange. Contested by Pascal Carter (2.5 feet, ZONE). ALLEN TOWNS MAKES IT! Assist: Khris George
Score: 91-60

================================================================================
                              3RD QUARTER COMPLETE                              
================================================================================

3RD QUARTER SCORE: Team_042 38, Team_066 17

BOX SCORE:
================================================================================

Team_042
--------------------------------------------------------------------------------
Player                MIN  PTS  REB  AST  TO      FG   FG%      3P   3P%
--------------------------------------------------------------------------------
Cade Dosunmu           24   14   12    1   0   7/7   100.0     0/0   0.0
Jarrett Sabonis        24   11    0    1   0   4/5    80.0     0/0   0.0
Tyler Barrett          24    6    4    0   0   2/4    50.0     0/0   0.0
Kristaps Parker        24    4    0    0   0   2/3    66.7     0/0   0.0
Allen Towns            12    2    0    0   0   1/1   100.0     0/0   0.0
Dejounte Butler        24    0    3    1   0   0/2     0.0     0/0   0.0
Lamelo Stewart         12    0    1    0   0   0/0     0.0     0/0   0.0
Khris George           12    0    0    1   0   0/0     0.0     0/0   0.0

TEAM: FG: 16/22 (72.7%), 3PT: 5/8 (62.5%), REB: 20 (6 off, 14 def), AST: 4, TO: 2
TEAM FOULS: 6 [Team_066 in BONUS]


Team_066
--------------------------------------------------------------------------------
Player                MIN  PTS  REB  AST  TO      FG   FG%      3P   3P%
--------------------------------------------------------------------------------
Kyle Wagner            24    6    4    0   0   3/3   100.0     0/0   0.0
Yao Brogdon            24    5    2    0   0   2/3    66.7     0/0   0.0
Pau Curry              24    3    0    0   0   1/5    20.0     0/0   0.0
Jimmy Davis            24    3    0    2   0   1/7    14.3     0/0   0.0
Brandon Reaves         24    0    3    1   0   0/2     0.0     0/0   0.0
Donovan Simmons        12    0    0    0   0   0/1     0.0     0/0   0.0

TEAM: FG: 7/21 (33.3%), 3PT: 2/10 (20.0%), REB: 9 (3 off, 6 def), AST: 3, TO: 2
TEAM FOULS: 6 [Team_042 in BONUS]

================================================================================

================================================================================
                       4TH QUARTER - Team_042 vs Team_066                       
================================================================================

[12:00] Team_042 possession (Score: 91-60)
Cade Dosunmu drives and kicks out. Cade Dosunmu attempts a Midrange. Contested by Kyle Wagner (4.5 feet, MAN). CADE DOSUNMU MAKES IT! Assist: Dejounte Butler
Score: 93-60

[11:45] Team_066 possession (Score: 93-60)
Pau Curry attempts a Midrange. Contested by Jarrett Sabonis (2.8 feet, ZONE). Pau Curry misses. Rebound secured by Dejounte Butler.

[11:32] Team_042 possession (Score: 93-60)
FOUL! Reach-in foul on Kyle Wagner during the drive. [Team fouls: 1] No free throws, side out. (Kyle Wagner: 1 personal fouls)

[11:16] Team_042 possession (Score: 93-60)
Dejounte Butler drives to the basket... Dejounte Butler commits a violation (traveling/carry)! TURNOVER! (dead ball)

[11:16] Substitution (Team_042): Tyler Barrett OUT → Khris George IN (stamina_rule2)

[11:16] Substitution (Team_042): Kristaps Parker OUT → Isaiah Randle IN (stamina_rule2)

[11:16] Substitution (Team_042): Jarrett Sabonis OUT → Gary Jackson IN (stamina_rule2)

[11:16] Substitution (Team_042): Dejounte Butler OUT → Allen Towns IN (stamina_rule2)

[11:16] Substitution (Team_042): Cade Dosunmu OUT → Lamelo Stewart IN (stamina_rule2)

[11:16] Substitution (Team_066): Jimmy Davis OUT → Pascal Carter IN (stamina_rule2)

[11:16] Substitution (Team_066): Pau Curry OUT → Lauri LaVine IN (stamina_rule2)

[11:16] Substitution (Team_066): Yao Brogdon OUT → Cole Morant IN (stamina_rule2)

[10:58] Team_066 possession (Score: 93-60)
Lauri LaVine attempts a 3Pt. Contested by Khris George (4.3 feet, ZONE). Lauri LaVine misses. Rebound secured by Lamelo Stewart.

[10:44] Team_042 possession (Score: 93-60)
Khris George attempts a 3Pt. Contested by Lauri LaVine (3.2 feet, ZONE). Khris George misses. Offensive rebound by Lamelo Stewart! Lamelo Stewart kicks it out.

[10:29] Team_042 possession (Score: 93-60)
Lamelo Stewart drives to the basket... Lamelo Stewart throws a bad pass out of bounds! TURNOVER! (dead ball)

[10:29] Substitution (Team_066): Brandon Reaves OUT → Brandon Middleton IN (stamina_rule2)

[10:29] Substitution (Team_066): Kyle Wagner OUT → Donovan Simmons IN (stamina_rule2)

[10:13] Team_066 possession (Score: 93-60)
Donovan Simmons drives, Lamelo Stewart stays with him. Donovan Simmons attempts a Layup. Contested by Lamelo Stewart (2.4 feet, MAN). DONOVAN SIMMONS MAKES IT! Assist: Pascal Carter
Score: 93-62

[10:01] Team_042 possession (Score: 93-62)
FOUL! Shooting foul on Donovan Simmons. Lamelo Stewart to the line for 2 free throws. [Team fouls: 2] (Donovan Simmons: 1 personal fouls)   FT 1/2: MISS   FT 2/2: GOOD Lamelo Stewart makes 1/2 from the line.
Score: 94-62

[09:48] Team_066 possession (Score: 94-62)
FOUL! Shooting foul on Gary Jackson. Lauri LaVine to the line for 2 free throws. [Team fouls: 1] (Gary Jackson: 1 personal fouls)   FT 1/2: GOOD   FT 2/2: GOOD Lauri LaVine makes 2/2 from the line.
Score: 94-64

[09:36] Team_042 possession (Score: 94-64)
Khris George attempts a 3Pt. Wide open! Pascal Carter is 7.2 feet away. [MAN] Khris George misses. Offensive rebound by Allen Towns! Allen Towns kicks it out.

[09:22] Team_042 possession (Score: 94-64)
Khris George attempts a Layup. Wide open! Donovan Simmons is 6.5 feet away. [ZONE] KHRIS GEORGE MAKES IT!
Score: 96-64

[09:06] Team_066 possession (Score: 96-64)
Pascal Carter attempts a 3Pt. Heavily contested by Khris George (0.5 feet, ZONE)! Pascal Carter misses. Rebound secured by Lamelo Stewart.

[08:50] Team_042 possession (Score: 96-64)
Gary Jackson attempts a Midrange. Wide open! Brandon Middleton is 6.3 feet away. [MAN] GARY JACKSON MAKES IT! Assist: Isaiah Randle
Score: 98-64

[08:37] Team_066 possession (Score: 98-64)
Lauri LaVine attempts a 3Pt. Heavily contested by Khris George (1.6 feet, ZONE)! Lauri LaVine misses. Offensive rebound by Lauri LaVine! Lauri LaVine kicks it out.

[08:20] Team_066 possession (Score: 98-64)
Lauri LaVine attempts a Midrange. Heavily contested by Isaiah Randle (0.7 feet, MAN)! Lauri LaVine misses. Rebound secured by Lamelo Stewart.

[08:03] Team_042 possession (Score: 98-64)
Lamelo Stewart attempts a Midrange. Wide open! Brandon Middleton is 8.1 feet away. [ZONE] Lamelo Stewart misses. Offensive rebound by Allen Towns! Allen Towns kicks it out.

[07:50] Team_042 possession (Score: 98-64)
Khris George attempts a 3Pt. Wide open! Pascal Carter is 7.2 feet away. [MAN] Khris George misses. Rebound secured by Donovan Simmons.

[07:38] Team_066 possession (Score: 98-64)
Lauri LaVine drives and kicks out. Cole Morant attempts a Midrange. Contested by Allen Towns (4.6 feet, MAN). COLE MORANT MAKES IT!
Score: 98-66

[07:24] Team_042 possession (Score: 98-66)
Allen Towns attempts a 3Pt. Contested by Lauri LaVine (3.4 feet, ZONE). Allen Towns misses. Rebound secured by Lauri LaVine.

[07:09] Team_066 possession (Score: 98-66)
Brandon Middleton attempts a Midrange. Contested by Allen Towns (5.0 feet, ZONE). Brandon Middleton misses. Rebound secured by Gary Jackson.

[06:53] Team_042 possession (Score: 98-66)
FOUL! Holding foul on Donovan Simmons. [Team fouls: 3] No free throws, side out. (Donovan Simmons: 2 personal fouls)

[06:37] Team_042 possession (Score: 98-66)
Allen Towns drives, Cole Morant stays with him. Allen Towns attempts a Dunk. Wide open! Cole Morant is 7.0 feet away. [MAN] ALLEN TOWNS MAKES IT!
Score: 100-66

[06:26] Team_066 possession (Score: 100-66)
Cole Morant drives to the basket... Cole Morant loses the ball! Stripped by Allen Towns! TURNOVER! (live ball)

[06:11] Team_042 possession (Score: 100-66)
Isaiah Randle attempts a Midrange. Contested by Lauri LaVine (2.9 feet, MAN). ISAIAH RANDLE MAKES IT! Assist: Allen Towns
Score: 102-66

[05:54] Team_066 possession (Score: 102-66)
Cole Morant attempts a Midrange. Wide open! Allen Towns is 7.0 feet away. [MAN] Cole Morant misses. Rebound secured by Gary Jackson.

[05:38] Team_042 possession (Score: 102-66)
Allen Towns makes the Layup and draws the foul on Donovan Simmons! And-1! Allen Towns to the line for 1. [Team fouls: 4] (Donovan Simmons: 3 personal fouls)   FT 1/1: GOOD Allen Towns makes 1/1 from the line.
Score: 105-66

[05:25] Team_066 possession (Score: 105-66)
FOUL! Shooting foul on Khris George. Donovan Simmons to the line for 3 free throws. [Team fouls: 2] (Khris George: 1 personal fouls)   FT 1/3: GOOD   FT 2/3: GOOD   FT 3/3: GOOD Donovan Simmons makes 3/3 from the line.
Score: 105-69

[05:10] Team_042 possession (Score: 105-69)
Gary Jackson attempts a Midrange. Contested by Brandon Middleton (5.7 feet, MAN). Gary Jackson misses. FOUL! Loose ball foul on Donovan Simmons during the rebound battle. [IN THE BONUS! 5 team fouls] Allen Towns to the line for 2 free throws. (Donovan Simmons: 4 personal fouls)   FT 1/2: GOOD   FT 2/2: GOOD Allen Towns makes 2/2 from the line.
Score: 107-69

[04:55] Team_066 possession (Score: 107-69)
Pascal Carter attempts a 3Pt. Wide open! Khris George is 7.5 feet away. [ZONE] PASCAL CARTER MAKES IT! Assist: Cole Morant
Score: 107-72

[04:37] Team_042 possession (Score: 107-72)
Lamelo Stewart attempts a Midrange. Contested by Donovan Simmons (5.3 feet, MAN). Lamelo Stewart misses. Offensive rebound by Lamelo Stewart! Lamelo Stewart kicks it out.

[04:21] Team_042 possession (Score: 107-72)
Allen Towns attempts a Midrange. Wide open! Donovan Simmons is 6.7 feet away. [ZONE] Allen Towns misses. Rebound secured by Lauri LaVine.

[04:07] Team_066 possession (Score: 107-72)
FOUL! Holding foul on Lamelo Stewart. [Team fouls: 3] No free throws, side out. (Lamelo Stewart: 1 personal fouls)

[03:52] Team_066 possession (Score: 107-72)
Cole Morant attempts a 3Pt. Contested by Allen Towns (5.3 feet, MAN). Cole Morant misses. Rebound secured by Gary Jackson.

[03:37] Team_042 possession (Score: 107-72)
Gary Jackson attempts a 3Pt. Heavily contested by Brandon Middleton (1.9 feet, MAN)! GARY JACKSON MAKES IT! Assist: Khris George
Score: 110-72

[03:22] Team_066 possession (Score: 110-72)
Pascal Carter attempts a Layup. Contested by Khris George (5.7 feet, MAN). PASCAL CARTER MAKES IT!
Score: 110-74

[03:08] Team_042 possession (Score: 110-74)
Khris George attempts a 3Pt. Wide open! Cole Morant is 9.9 feet away. [ZONE] Khris George misses. Rebound secured by Donovan Simmons.

[02:50] Team_066 possession (Score: 110-74)
Brandon Middleton attempts a 3Pt. Contested by Gary Jackson (3.5 feet, MAN). Brandon Middleton misses. Rebound secured by Allen Towns.

[02:37] Team_042 possession (Score: 110-74)
Lamelo Stewart attempts a 3Pt. Contested by Donovan Simmons (4.4 feet, MAN). LAMELO STEWART MAKES IT! Assist: Isaiah Randle
Score: 113-74

[02:19] Team_066 possession (Score: 113-74)
Brandon Middleton attempts a 3Pt. Contested by Khris George (2.5 feet, ZONE). Brandon Middleton misses. Rebound secured by Lamelo Stewart.

[02:07] Team_042 possession (Score: 113-74)
Gary Jackson drives, Brandon Middleton stays with him. Gary Jackson attempts a Layup. Contested by Brandon Middleton (5.9 feet, MAN). GARY JACKSON MAKES IT! Assist: Lamelo Stewart
Score: 115-74

[01:55] Team_066 possession (Score: 115-74)
Pascal Carter attempts a Midrange. Contested by Khris George (2.2 feet, MAN). Pascal Carter misses. Rebound secured by Allen Towns.

[01:38] Team_042 possession (Score: 115-74)
Khris George attempts a 3Pt. Wide open! Pascal Carter is 6.0 feet away. [MAN] Khris George misses. Rebound secured by Lauri LaVine.

[01:24] Team_066 possession (Score: 115-74)
Donovan Simmons drives to the basket... Donovan Simmons throws a bad pass out of bounds! TURNOVER! (dead ball)

[01:09] Team_042 possession (Score: 115-74)
Gary Jackson makes the Midrange and draws the foul on Lauri LaVine! And-1! Gary Jackson to the line for 1. [BONUS: 6 team fouls] (Lauri LaVine: 1 personal fouls)   FT 1/1: MISS Gary Jackson makes 0/1 from the line. FOUL! Loose ball foul on Brandon Middleton during the free throw rebound! [IN THE BONUS! 7 team fouls] Allen Towns to the line for 2 free throws. (Brandon Middleton: 1 personal fouls)   FT 1/2: GOOD   FT 2/2: MISS Allen Towns makes 1/2 from the line. Rebound secured by Donovan Simmons.
Score: 118-74

[00:55] Team_066 possession (Score: 118-74)
FOUL! Shooting foul on Isaiah Randle. Lauri LaVine to the line for 2 free throws. [Team fouls: 4] (Isaiah Randle: 1 personal fouls)   FT 1/2: GOOD   FT 2/2: GOOD Lauri LaVine makes 2/2 from the line.
Score: 118-76

[00:41] Team_042 possession (Score: 118-76)
Gary Jackson attempts a 3Pt. Contested by Lauri LaVine (2.7 feet, ZONE). GARY JACKSON MAKES IT! Assist: Isaiah Randle
Score: 121-76

[00:25] Team_066 possession (Score: 121-76)
Donovan Simmons attempts a Layup. BLOCKED BY LAMELO STEWART! Ball is loose! Rebound secured by Lamelo Stewart.

[00:11] Team_042 possession (Score: 121-76)
Isaiah Randle loses the ball! Stripped by Lauri LaVine! TURNOVER! (live ball)

================================================================================
                              4TH QUARTER COMPLETE                              
================================================================================

4TH QUARTER SCORE: Team_042 30, Team_066 16

BOX SCORE:
================================================================================

Team_042
--------------------------------------------------------------------------------
Player                MIN  PTS  REB  AST  TO      FG   FG%      3P   3P%
--------------------------------------------------------------------------------
Gary Jackson           23   10    3    0   0   4/5    80.0     0/0   0.0
Allen Towns            23    7    4    1   0   3/5    60.0     0/0   0.0
Lamelo Stewart         23    4    7    1   0   2/2   100.0     0/0   0.0
Cade Dosunmu           25    2    0    0   0   1/1   100.0     0/0   0.0
Khris George           23    2    0    1   0   1/4    25.0     0/0   0.0
Isaiah Randle          23    2    0    3   0   1/1   100.0     0/0   0.0
Dejounte Butler        25    0    1    1   0   0/0     0.0     0/0   0.0

TEAM: FG: 12/18 (66.7%), 3PT: 3/7 (42.9%), REB: 15 (4 off, 11 def), AST: 7, TO: 3
TEAM FOULS: 4


Team_066
--------------------------------------------------------------------------------
Player                MIN  PTS  REB  AST  TO      FG   FG%      3P   3P%
--------------------------------------------------------------------------------
Donovan Simmons        22    5    3    0   0   2/3    66.7     0/0   0.0
Pascal Carter          23    5    0    1   0   2/4    50.0     0/0   0.0
Lauri LaVine           23    4    4    0   0   2/4    50.0     0/0   0.0
Cole Morant            23    2    0    1   0   1/3    33.3     0/0   0.0
Pau Curry              25    0    0    0   0   0/1     0.0     0/0   0.0
Brandon Middleton      22    0    0    0   0   0/3     0.0     0/0   0.0

TEAM: FG: 7/18 (38.9%), 3PT: 2/7 (28.6%), REB: 7 (1 off, 6 def), AST: 2, TO: 2
TEAM FOULS: 7 [Team_042 in BONUS]

================================================================================

================================================================================
                               FULL GAME COMPLETE                               
================================================================================

FINAL SCORE: Team_042 121, Team_066 76

SCORING BY QUARTER:
--------------------------------------------------------------------------------
Team                     Q1     Q2     Q3     Q4    FINAL
--------------------------------------------------------------------------------
Team_042                 27     26     38     30      121
Team_066                 22     21     17     16       76
--------------------------------------------------------------------------------

FULL GAME BOX SCORE:
================================================================================

Team_042
--------------------------------------------------------------------------------
Player                MIN  PTS  REB  AST  TO      FG   FG%      3P   3P%      FT STL BLK
--------------------------------------------------------------------------------
Tyler Barrett          25   12    9    0   0   5/9    55.6   1/3    33.3   3/3     0   0
Kristaps Parker        25   14    0    1   3   7/12   58.3   2/5    40.0   3/4     0   0
Jarrett Sabonis        25   16    0    1   0   7/9    77.8   2/2   100.0   1/1     0   0
Dejounte Butler        25    4    6    5   0   4/9    44.4   2/4    50.0   0/1     0   0
Cade Dosunmu           25   18   19    1   0   5/5   100.0   2/2   100.0   0/0     0   1
Khris George           23   11    0    5   0   6/10   60.0   1/4    25.0   0/0     0   0
Isaiah Randle          23    4    0    3   3   2/5    40.0   0/2     0.0   0/1     0   0
Gary Jackson           23   12    5    0   1   6/9    66.7   2/2   100.0   0/1     0   0
Allen Towns            23   14    5    4   0   4/7    57.1   0/2     0.0   5/5     2   0
Lamelo Stewart         23    8   11    1   1   4/6    66.7   1/1   100.0   1/2     0   3

TEAM: FG: 50/81 (61.7%), 3PT: 13/27 (48.1%), REB: 56 (13 off, 43 def), AST: 21, TO: 8


Team_066
--------------------------------------------------------------------------------
Player                MIN  PTS  REB  AST  TO      FG   FG%      3P   3P%      FT STL BLK
--------------------------------------------------------------------------------
Brandon Reaves         26    5    7    1   0   3/10   30.0   2/6    33.3   3/4     0   0
Kyle Wagner            26   14    8    0   1   6/7    85.7   0/0     0.0   4/5     0   0
Jimmy Davis            25    3    0    4   0   1/8    12.5   0/4     0.0   1/1     0   0
Pau Curry              25   10    0    0   0   4/14   28.6   1/7    14.3   2/2     0   0
Yao Brogdon            25    5   11    0   1   2/3    66.7   0/1     0.0   3/3     0   0
Pascal Carter          23   11    0    1   1   4/7    57.1   2/4    50.0   1/1     0   0
Lauri LaVine           23    6    7    2   2   4/8    50.0   0/3     0.0   4/4     2   0
Cole Morant            23   11    0    1   1   4/6    66.7   1/2    50.0   3/6     0   0
Brandon Middleton      22    2    4    1   2   1/5    20.0   0/3     0.0   2/2     1   0
Donovan Simmons        22    7    7    0   1   3/7    42.9   1/1   100.0   3/3     0   0

TEAM: FG: 33/76 (43.4%), 3PT: 7/31 (22.6%), REB: 43 (13 off, 30 def), AST: 10, TO: 9

================================================================================
