================================================================================
                        FULL GAME - Team_042 vs Team_010                        
================================================================================

================================================================================
                       1ST QUARTER - Team_042 vs Team_010                       
================================================================================

[12:00] Team_042 possession (Score: 0-0)
Jarrett Sabonis attempts a 3Pt. Contested by Cade Morant (4.7 feet, ZONE). JARRETT SABONIS MAKES IT! Assist: Cade Dosunmu
Score: 3-0

[11:46] Team_010 possession (Score: 3-0)
Desmond Antetokounmpo makes the Midrange and draws the foul on Cade Dosunmu! And-1! Desmond Antetokounmpo to the line for 1. [Team fouls: 1] (Cade Dosunmu: 1 personal fouls)   FT 1/1: GOOD Desmond Antetokounmpo makes 1/1 from the line.
Score: 3-3

[11:33] Team_042 possession (Score: 3-3)
Dejounte Butler attempts a Layup. Contested by Desmond Antetokounmpo (4.5 feet, MAN). DEJOUNTE BUTLER MAKES IT! Assist: Cade Dosunmu
Score: 5-3

[11:18] Team_010 possession (Score: 5-3)
FOUL! Shooting foul on Dejounte Butler. Desmond Antetokounmpo to the line for 2 free throws. [Team fouls: 2] (Dejounte Butler: 1 personal fouls)   FT 1/2: GOOD   FT 2/2: GOOD Desmond Antetokounmpo makes 2/2 from the line.
Score: 5-5

[11:01] Team_042 possession (Score: 5-5)
Dejounte Butler attempts a 3Pt. Contested by Cade Morant (5.8 feet, ZONE). Dejounte Butler misses. Rebound secured by Cade Morant.

[10:47] Team_010 possession (Score: 5-5)
Michael Turner drives, Kristaps Parker stays with him. Michael Turner attempts a Layup. Wide open! Kristaps Parker is 7.6 feet away. [MAN] MICHAEL TURNER MAKES IT! Assist: Anthony Durant
Score: 5-7

[10:34] Team_042 possession (Score: 5-7)
Dejounte Butler attempts a 3Pt. Contested by Desmond Antetokounmpo (5.2 feet, MAN). Dejounte Butler misses. Rebound secured by Desmond Antetokounmpo.

[10:21] Team_010 possession (Score: 5-7)
Michael Turner drives and kicks out. Michael Turner attempts a 3Pt. Contested by Kristaps Parker (3.0 feet, MAN). MICHAEL TURNER MAKES IT!
Score: 5-10

[10:05] Team_042 possession (Score: 5-10)
Cade Dosunmu attempts a Midrange. Contested by Anthony Durant (3.2 feet, MAN). CADE DOSUNMU MAKES IT! Assist: Kristaps Parker
Score: 7-10

[09:48] Team_010 possession (Score: 7-10)
Michael Turner attempts a Midrange. Contested by Jarrett Sabonis (4.7 feet, ZONE). Michael Turner misses. Rebound secured by Dejounte Butler.

[09:36] Team_042 possession (Score: 7-10)
Dejounte Butler attempts a 3Pt. Contested by Desmond Antetokounmpo (3.7 feet, MAN). Dejounte Butler misses. Rebound secured by Desmond Antetokounmpo.

[09:21] Team_010 possession (Score: 7-10)
Cade Morant makes the Midrange and draws the foul on Jarrett Sabonis! And-1! Cade Morant to the line for 1. [Team fouls: 3] (Jarrett Sabonis: 1 personal fouls)   FT 1/1: GOOD Cade Morant makes 1/1 from the line.
Score: 7-13

[09:05] Team_042 possession (Score: 7-13)
Dejounte Butler attempts a 3Pt. Contested by Desmond Antetokounmpo (5.7 feet, MAN). Dejounte Butler misses. Rebound secured by Anthony Durant.

[08:53] Team_010 possession (Score: 7-13)
Cade Morant attempts a 3Pt. Contested by Tyler Barrett (5.4 feet, MAN). CADE MORANT MAKES IT!
Score: 7-16

[08:34] Team_042 possession (Score: 7-16)
Jarrett Sabonis attempts a 3Pt. Heavily contested by RJ Young (0.8 feet, MAN)! Jarrett Sabonis misses. Rebound secured by Anthony Durant.

[08:15] Team_010 possession (Score: 7-16)
Michael Turner drives to the basket... FOUL! Offensive foul on Michael Turner! Cade Dosunmu drew the charge! [Team fouls: 1] (Michael Turner: 1 personal fouls) TURNOVER! (dead ball)

[07:58] Team_042 possession (Score: 7-16)
Cade Dosunmu attempts a Midrange. Contested by Desmond Antetokounmpo (2.6 feet, ZONE). Cade Dosunmu misses. Rebound secured by Desmond Antetokounmpo.

[07:45] Team_010 possession (Score: 7-16)
Anthony Durant makes the Layup and draws the foul on Cade Dosunmu! And-1! Anthony Durant to the line for 1. [Team fouls: 4] (Cade Dosunmu: 2 personal fouls)   FT 1/1: GOOD Anthony Durant makes 1/1 from the line.
Score: 7-19

[07:33] Team_042 possession (Score: 7-19)
Kristaps Parker loses the ball! Stripped by Michael Turner! TURNOVER! (live ball)

[07:15] Team_010 possession (Score: 7-19)
Cade Morant attempts a 3Pt. Contested by Tyler Barrett (5.6 feet, ZONE). Cade Morant misses. Offensive rebound by Anthony Durant! Anthony Durant kicks it out.

[07:01] Team_010 possession (Score: 7-19)
FOUL! Shooting foul on Kristaps Parker. Michael Turner to the line for 2 free throws. [BONUS: 5 team fouls] (Kristaps Parker: 1 personal fouls)   FT 1/2: GOOD   FT 2/2: MISS Michael Turner makes 1/2 from the line. Rebound secured by Tyler Barrett.
Score: 7-20

[06:47] Team_042 possession (Score: 7-20)
FOUL! Shooting foul on Anthony Durant. Cade Dosunmu to the line for 2 free throws. [Team fouls: 2] (Anthony Durant: 1 personal fouls)   FT 1/2: MISS   FT 2/2: MISS Cade Dosunmu makes 0/2 from the line. Rebound secured by Cade Morant.

[06:35] Team_010 possession (Score: 7-20)
RJ Young drives, picks up Jarrett Sabonis. Help arrives from Tyler Barrett! RJ Young attempts a Dunk. Contested by Tyler Barrett (2.4 feet, MAN). RJ Young misses. Offensive rebound by Cade Morant! Cade Morant kicks it out.

[06:23] Team_010 possession (Score: 7-20)
Michael Turner drives, Kristaps Parker stays with him. Michael Turner attempts a Layup. Contested by Kristaps Parker (4.7 feet, MAN). MICHAEL TURNER MAKES IT!
Score: 7-22

[06:08] Team_042 possession (Score: 7-22)
Kristaps Parker attempts a 3Pt. Contested by Cade Morant (4.3 feet, ZONE). Kristaps Parker misses. Rebound secured by Anthony Durant.

[05:52] Team_010 possession (Score: 7-22)
Michael Turner drives and kicks out. RJ Young attempts a Midrange. Contested by Jarrett Sabonis (6.0 feet, ZONE). RJ Young misses. FOUL! Loose ball foul on Dejounte Butler during the rebound battle. [IN THE BONUS! 6 team fouls] Cade Morant to the line for 2 free throws. (Dejounte Butler: 2 personal fouls)   FT 1/2: GOOD   FT 2/2: GOOD Cade Morant makes 2/2 from the line.
Score: 7-24

[05:37] Team_042 possession (Score: 7-24)
FOUL! Reach-in foul on Anthony Durant during the drive. [Team fouls: 3] No free throws, side out. (Anthony Durant: 2 personal fouls)

[05:27] Team_042 possession (Score: 7-24)
Dejounte Butler attempts a Layup. BLOCKED BY ANTHONY DURANT! Ball is loose! Rebound secured by Anthony Durant.

[05:08] Team_010 possession (Score: 7-24)
Cade Morant drives and kicks out. Anthony Durant attempts a 3Pt. Heavily contested by Cade Dosunmu (0.5 feet, MAN)! Anthony Durant misses. Rebound secured by Cade Dosunmu.

[04:57] Team_042 possession (Score: 7-24)
Jarrett Sabonis attempts a 3Pt. Wide open! RJ Young is 6.2 feet away. [MAN] JARRETT SABONIS MAKES IT! Assist: Cade Dosunmu
Score: 10-24

[04:38] Team_010 possession (Score: 10-24)
FOUL! Shooting foul on Tyler Barrett. Michael Turner to the line for 3 free throws. [BONUS: 7 team fouls] (Tyler Barrett: 1 personal fouls)   FT 1/3: GOOD   FT 2/3: GOOD   FT 3/3: GOOD Michael Turner makes 3/3 from the line.
Score: 10-27

[04:24] Team_042 possession (Score: 10-27)
Cade Dosunmu attempts a Layup. Contested by Anthony Durant (4.5 feet, ZONE). CADE DOSUNMU MAKES IT! Assist: Kristaps Parker
Score: 12-27

[04:11] Team_010 possession (Score: 12-27)
Michael Turner throws a bad pass! Stolen by Kristaps Parker! TURNOVER! (live ball)

[03:57] Team_042 possession (Score: 12-27)
Jarrett Sabonis attempts a Midrange. Contested by RJ Young (3.4 feet, MAN). Jarrett Sabonis misses. FOUL! Loose ball foul on Anthony Durant during the rebound battle. [Team fouls: 4] No free throws, side out. (Anthony Durant: 3 personal fouls)

[03:41] Team_042 possession (Score: 12-27)
Dejounte Butler attempts a Layup. BLOCKED BY ANTHONY DURANT! Ball deflects out of bounds off Dejounte Butler.

[03:27] Team_010 possession (Score: 12-27)
Anthony Durant attempts a Midrange. Contested by Cade Dosunmu (3.9 feet, MAN). ANTHONY DURANT MAKES IT!
Score: 12-29

[03:17] Team_042 possession (Score: 12-29)
Jarrett Sabonis attempts a 3Pt. Contested by Cade Morant (4.6 feet, ZONE). Jarrett Sabonis misses. Rebound secured by Cade Morant.

[03:01] Team_010 possession (Score: 12-29)
Michael Turner attempts a 3Pt. Wide open! Kristaps Parker is 6.0 feet away. [MAN] Michael Turner misses. Rebound secured by Dejounte Butler.

[02:44] Team_042 possession (Score: 12-29)
Cade Dosunmu attempts a Layup. Contested by Anthony Durant (5.1 feet, MAN). CADE DOSUNMU MAKES IT! Assist: Jarrett Sabonis
Score: 14-29

[02:31] Team_010 possession (Score: 14-29)
FOUL! Reach-in foul on Cade Dosunmu during the drive. [IN THE BONUS! 8 team fouls] Anthony Durant to the line for 2 free throws. (Cade Dosunmu: 3 personal fouls)   FT 1/2: GOOD   FT 2/2: GOOD Anthony Durant makes 2/2 from the line.
Score: 14-31

[02:16] Team_042 possession (Score: 14-31)
Dejounte Butler attempts a Layup. Wide open! Desmond Antetokounmpo is 6.2 feet away. [MAN] Dejounte Butler misses. Rebound secured by Cade Morant.

[02:03] Team_010 possession (Score: 14-31)
RJ Young attempts a 3Pt. Wide open! Tyler Barrett is 7.1 feet away. [ZONE] RJ Young misses. Rebound secured by Cade Dosunmu.

[01:50] Team_042 possession (Score: 14-31)
Dejounte Butler attempts a 3Pt. Contested by Cade Morant (3.6 feet, ZONE). Dejounte Butler misses. Rebound secured by Anthony Durant.

[01:35] Team_010 possession (Score: 14-31)
RJ Young attempts a Layup. BLOCKED BY JARRETT SABONIS! Ball is loose! Offensive rebound by Anthony Durant! Anthony Durant kicks it out.

[01:21] Team_010 possession (Score: 14-31)
RJ Young attempts a 3Pt. Contested by Jarrett Sabonis (5.4 feet, MAN). RJ Young misses. Rebound secured by Cade Dosunmu.

[01:09] Team_042 possession (Score: 14-31)
Jarrett Sabonis attempts a 3Pt. Wide open! RJ Young is 6.2 feet away. [MAN] Jarrett Sabonis misses. FOUL! Loose ball foul on Cade Morant during the rebound battle. [IN THE BONUS! 5 team fouls] Cade Dosunmu to the line for 2 free throws. (Cade Morant: 1 personal fouls)   FT 1/2: GOOD   FT 2/2: MISS Cade Dosunmu makes 1/2 from the line. Rebound secured by Cade Morant.
Score: 15-31

[00:53] Team_010 possession (Score: 15-31)
Desmond Antetokounmpo drives and kicks out. Desmond Antetokounmpo attempts a 3Pt. Wide open! Tyler Barrett is 7.4 feet away. [ZONE] DESMOND ANTETOKOUNMPO MAKES IT! Assist: Anthony Durant
Score: 15-34

[00:38] Team_042 possession (Score: 15-34)
Jarrett Sabonis attempts a Midrange. Wide open! RJ Young is 7.2 feet away. [MAN] JARRETT SABONIS MAKES IT! Assist: Kristaps Parker
Score: 17-34

[00:24] Team_010 possession (Score: 17-34)
Anthony Durant attempts a 3Pt. Contested by Cade Dosunmu (5.9 feet, MAN). Anthony Durant misses. Rebound secured by Tyler Barrett.

[00:06] Team_042 possession (Score: 17-34)
Dejounte Butler attempts a Layup. Contested by Anthony Durant (4.4 feet, ZONE). DEJOUNTE BUTLER MAKES IT! Assist: Jarrett Sabonis
Score: 19-34

================================================================================
                              1ST QUARTER COMPLETE                              
================================================================================

1ST QUARTER SCORE: Team_042 19, Team_010 34

BOX SCORE:
================================================================================

Team_042
--------------------------------------------------------------------------------
Player                MIN  PTS  REB  AST  TO      FG   FG%      3P   3P%
--------------------------------------------------------------------------------
Jarrett Sabonis        12    8    0    2   0   3/6    50.0     0/0   0.0
Cade Morant            12    8    6    0   0   3/4    75.0     0/0   0.0
Cade Dosunmu           12    6    3    3   0   3/5    60.0     0/0   0.0
Dejounte Butler        12    4    3    0   0   2/10   20.0     0/0   0.0
Kristaps Parker        12    0    0    3   0   0/1     0.0     0/0   0.0
Tyler Barrett          12    0    2    0   0   0/0     0.0     0/0   0.0

TEAM: FG: 8/22 (36.4%), 3PT: 2/11 (18.2%), REB: 9 (2 off, 7 def), AST: 8, TO: 1
TEAM FOULS: 8 [Team_010 in BONUS]


Team_010
--------------------------------------------------------------------------------
Player                MIN  PTS  REB  AST  TO      FG   FG%      3P   3P%
--------------------------------------------------------------------------------
Michael Turner         12   10    0    0   0   4/7    57.1     0/0   0.0
Desmond Antetokounmpo   12    8    3    0   0   3/3   100.0     0/0   0.0
Anthony Durant         12    7    7    2   0   3/4    75.0     0/0   0.0
RJ Young               12    0    0    0   0   0/2     0.0     0/0   0.0

TEAM: FG: 13/20 (65.0%), 3PT: 2/6 (33.3%), REB: 15 (3 off, 12 def), AST: 2, TO: 2
TEAM FOULS: 5 [Team_042 in BONUS]

================================================================================

================================================================================
                       2ND QUARTER - Team_042 vs Team_010                       
================================================================================

[12:00] Team_042 possession (Score: 19-34)
Jarrett Sabonis drives, picks up Anthony Durant. Help arrives from Cade Morant! Jarrett Sabonis attempts a Layup. Contested by Cade Morant (5.6 feet, ZONE). JARRETT SABONIS MAKES IT! Assist: Kristaps Parker
Score: 21-34

[11:48] Team_010 possession (Score: 21-34)
RJ Young loses control! Ball rolls out of bounds! TURNOVER! (dead ball)

[11:48] Substitution (Team_042): Tyler Barrett OUT → Khris George IN (stamina_rule2)

[11:48] Substitution (Team_042): Kristaps Parker OUT → Isaiah Randle IN (stamina_rule2)

[11:48] Substitution (Team_042): Jarrett Sabonis OUT → Gary Jackson IN (stamina_rule2)

[11:48] Substitution (Team_042): Dejounte Butler OUT → Allen Towns IN (stamina_rule2)

[11:48] Substitution (Team_042): Cade Dosunmu OUT → Lamelo Stewart IN (stamina_rule2)

[11:48] Substitution (Team_010): Cade Morant OUT → Draymond Leonard IN (stamina_rule2)

[11:48] Substitution (Team_010): Michael Turner OUT → Blake Harden IN (stamina_rule2)

[11:48] Substitution (Team_010): RJ Young OUT → Ben Gilgeous-Alexander IN (stamina_rule2)

[11:48] Substitution (Team_010): Desmond Antetokounmpo OUT → Vince Ingram IN (stamina_rule2)

[11:48] Substitution (Team_010): Anthony Durant OUT → Paolo Wade IN (stamina_rule2)

[11:38] Team_042 possession (Score: 21-34)
Isaiah Randle attempts a 3Pt. Contested by Draymond Leonard (5.8 feet, ZONE). ISAIAH RANDLE MAKES IT!
Score: 24-34

[11:23] Team_010 possession (Score: 24-34)
Ben Gilgeous-Alexander attempts a Midrange. Heavily contested by Gary Jackson (0.8 feet, MAN)! BEN GILGEOUS-ALEXANDER MAKES IT! Assist: Vince Ingram
Score: 24-36

[11:10] Team_042 possession (Score: 24-36)
Allen Towns attempts a Midrange. Wide open! Vince Ingram is 7.9 feet away. [MAN] ALLEN TOWNS MAKES IT!
Score: 26-36

[10:55] Team_010 possession (Score: 26-36)
Ben Gilgeous-Alexander attempts a Midrange. Contested by Gary Jackson (3.7 feet, MAN). Ben Gilgeous-Alexander misses. Rebound secured by Allen Towns.

[10:37] Team_042 possession (Score: 26-36)
Gary Jackson attempts a Midrange. Contested by Ben Gilgeous-Alexander (3.7 feet, ZONE). Gary Jackson misses. Rebound secured by Paolo Wade.

[10:25] Team_010 possession (Score: 26-36)
Paolo Wade drives to the basket... Paolo Wade loses the ball! Stripped by Allen Towns! TURNOVER! (live ball)

[10:10] Team_042 possession (Score: 26-36)
Lamelo Stewart drives, Paolo Wade stays with him. Lamelo Stewart attempts a Dunk. Contested by Paolo Wade (3.9 feet, ZONE). LAMELO STEWART MAKES IT!
Score: 28-36

[09:55] Team_010 possession (Score: 28-36)
Blake Harden attempts a 3Pt. Contested by Khris George (4.1 feet, ZONE). Blake Harden misses. Rebound secured by Allen Towns.

[09:40] Team_042 possession (Score: 28-36)
FOUL! Holding foul on Vince Ingram. [Team fouls: 1] No free throws, side out. (Vince Ingram: 1 personal fouls)

[09:26] Team_042 possession (Score: 28-36)
Allen Towns attempts a 3Pt. Contested by Vince Ingram (3.1 feet, MAN). ALLEN TOWNS MAKES IT! Assist: Lamelo Stewart
Score: 31-36

[09:12] Team_010 possession (Score: 31-36)
Ben Gilgeous-Alexander drives, Gary Jackson stays with him. Ben Gilgeous-Alexander attempts a Layup. Contested by Gary Jackson (5.5 feet, MAN). BEN GILGEOUS-ALEXANDER MAKES IT!
Score: 31-38

[09:01] Team_042 possession (Score: 31-38)
FOUL! Reach-in foul on Paolo Wade during the drive. [Team fouls: 2] No free throws, side out. (Paolo Wade: 1 personal fouls)

[08:49] Team_042 possession (Score: 31-38)
Khris George attempts a Midrange. Contested by Draymond Leonard (4.2 feet, MAN). KHRIS GEORGE MAKES IT! Assist: Isaiah Randle
Score: 33-38

[08:32] Team_010 possession (Score: 33-38)
Ben Gilgeous-Alexander throws a bad pass out of bounds! TURNOVER! (dead ball)

[08:16] Team_042 possession (Score: 33-38)
Khris George attempts a 3Pt. Wide open! Draymond Leonard is 6.8 feet away. [ZONE] KHRIS GEORGE MAKES IT! Assist: Allen Towns
Score: 36-38

[07:59] Team_010 possession (Score: 36-38)
Vince Ingram drives, Allen Towns stays with him. Vince Ingram attempts a Layup. Wide open! Allen Towns is 10.0 feet away. [MAN] VINCE INGRAM MAKES IT! Assist: Blake Harden
Score: 36-40

[07:50] Team_042 possession (Score: 36-40)
Gary Jackson attempts a Midrange. Contested by Ben Gilgeous-Alexander (5.4 feet, ZONE). Gary Jackson misses. Rebound secured by Ben Gilgeous-Alexander.

[07:37] Team_010 possession (Score: 36-40)
Vince Ingram attempts a 3Pt. Contested by Khris George (3.9 feet, ZONE). Vince Ingram misses. Rebound secured by Lamelo Stewart.

[07:22] Team_042 possession (Score: 36-40)
Lamelo Stewart attempts a Layup. BLOCKED BY PAOLO WADE! Ball is loose! Rebound secured by Blake Harden.

[07:07] Team_010 possession (Score: 36-40)
FOUL! Holding foul on Gary Jackson. [Team fouls: 1] No free throws, side out. (Gary Jackson: 1 personal fouls)

[06:56] Team_010 possession (Score: 36-40)
Ben Gilgeous-Alexander attempts a 3Pt. Contested by Khris George (3.9 feet, ZONE). Ben Gilgeous-Alexander misses. Offensive rebound by Blake Harden! Blake Harden kicks it out.

[06:40] Team_010 possession (Score: 36-40)
Blake Harden attempts a 3Pt. Wide open! Isaiah Randle is 8.1 feet away. [MAN] Blake Harden misses. Rebound secured by Allen Towns.

[06:21] Team_042 possession (Score: 36-40)
Isaiah Randle drives, Paolo Wade stays with him. Isaiah Randle attempts a Layup. Wide open! Paolo Wade is 6.2 feet away. [ZONE] Isaiah Randle misses. Rebound secured by Paolo Wade.

[06:07] Team_010 possession (Score: 36-40)
Draymond Leonard attempts a 3Pt. Contested by Khris George (4.7 feet, MAN). Draymond Leonard misses. Rebound secured by Gary Jackson.

[05:54] Team_042 possession (Score: 36-40)
Gary Jackson attempts a 3Pt. Wide open! Ben Gilgeous-Alexander is 6.1 feet away. [MAN] GARY JACKSON MAKES IT! Assist: Isaiah Randle
Score: 39-40

[05:42] Team_010 possession (Score: 39-40)
Draymond Leonard attempts a 3Pt. Contested by Khris George (3.5 feet, ZONE). Draymond Leonard misses. Offensive rebound by Blake Harden! Blake Harden kicks it out.

[05:29] Team_010 possession (Score: 39-40)
FOUL! Shooting foul on Allen Towns. Vince Ingram to the line for 3 free throws. [Team fouls: 2] (Allen Towns: 1 personal fouls)   FT 1/3: GOOD   FT 2/3: GOOD   FT 3/3: GOOD Vince Ingram makes 3/3 from the line.
Score: 39-43

[05:14] Team_042 possession (Score: 39-43)
Gary Jackson drives and kicks out. Isaiah Randle attempts a 3Pt. Contested by Ben Gilgeous-Alexander (5.0 feet, ZONE). Isaiah Randle misses. Rebound secured by Blake Harden.

[04:57] Team_010 possession (Score: 39-43)
Blake Harden drives and kicks out. Ben Gilgeous-Alexander attempts a 3Pt. Heavily contested by Khris George (0.6 feet, ZONE)! Ben Gilgeous-Alexander misses. Offensive rebound by Blake Harden! Blake Harden kicks it out.

[04:46] Team_010 possession (Score: 39-43)
Draymond Leonard drives, Allen Towns stays with him. Draymond Leonard attempts a Layup. Wide open! Allen Towns is 6.2 feet away. [ZONE] Draymond Leonard misses. Offensive rebound by Blake Harden! Blake Harden kicks it out.

[04:32] Team_010 possession (Score: 39-43)
FOUL! Holding foul on Allen Towns. [Team fouls: 3] No free throws, side out. (Allen Towns: 2 personal fouls)

[04:19] Team_010 possession (Score: 39-43)
Blake Harden attempts a Midrange. Contested by Isaiah Randle (4.8 feet, MAN). BLAKE HARDEN MAKES IT! Assist: Paolo Wade
Score: 39-45

[04:10] Team_042 possession (Score: 39-45)
Lamelo Stewart attempts a 3Pt. Wide open! Paolo Wade is 6.2 feet away. [MAN] Lamelo Stewart misses. Rebound secured by Blake Harden.

[04:00] Team_010 possession (Score: 39-45)
Draymond Leonard attempts a Layup. Contested by Khris George (3.3 feet, MAN). Draymond Leonard misses. FOUL! Loose ball foul on Allen Towns during the rebound battle. [Team fouls: 4] No free throws, side out. (Allen Towns: 3 personal fouls)

[03:44] Team_010 possession (Score: 39-45)
Blake Harden attempts a 3Pt. Heavily contested by Khris George (1.5 feet, ZONE)! Blake Harden misses. Rebound secured by Gary Jackson.

[03:29] Team_042 possession (Score: 39-45)
Allen Towns attempts a 3Pt. Contested by Vince Ingram (5.2 feet, MAN). Allen Towns misses. Offensive rebound by Lamelo Stewart! Lamelo Stewart kicks it out.

[03:10] Team_042 possession (Score: 39-45)
Allen Towns attempts a Midrange. Contested by Draymond Leonard (5.4 feet, ZONE). ALLEN TOWNS MAKES IT! Assist: Gary Jackson
Score: 41-45

[02:57] Team_010 possession (Score: 41-45)
Draymond Leonard attempts a 3Pt. Contested by Khris George (4.0 feet, ZONE). Draymond Leonard misses. Rebound secured by Lamelo Stewart.

[02:42] Team_042 possession (Score: 41-45)
Isaiah Randle drives and kicks out. Lamelo Stewart attempts a 3Pt. Contested by Paolo Wade (4.9 feet, MAN). Lamelo Stewart misses. Rebound secured by Ben Gilgeous-Alexander.

[02:25] Team_010 possession (Score: 41-45)
Vince Ingram attempts a Layup. Wide open! Allen Towns is 6.2 feet away. [MAN] VINCE INGRAM MAKES IT! Assist: Draymond Leonard
Score: 41-47

[02:12] Team_042 possession (Score: 41-47)
FOUL! Shooting foul on Paolo Wade. Lamelo Stewart to the line for 2 free throws. [Team fouls: 3] (Paolo Wade: 2 personal fouls)   FT 1/2: GOOD   FT 2/2: GOOD Lamelo Stewart makes 2/2 from the line.
Score: 43-47

[01:58] Team_010 possession (Score: 43-47)
Ben Gilgeous-Alexander drives, picks up Gary Jackson. Help arrives from Khris George! Ben Gilgeous-Alexander attempts a Layup. Wide open! Khris George is 6.4 feet away. [MAN] Ben Gilgeous-Alexander misses. Offensive rebound by Paolo Wade! Paolo Wade kicks it out.

[01:43] Team_010 possession (Score: 43-47)
Blake Harden attempts a Midrange. Contested by Allen Towns (6.0 feet, ZONE). Blake Harden misses. Rebound secured by Lamelo Stewart.

[01:31] Team_042 possession (Score: 43-47)
Gary Jackson loses the ball! Stripped by Ben Gilgeous-Alexander! TURNOVER! (live ball)

[01:16] Team_010 possession (Score: 43-47)
Blake Harden drives and kicks out. Blake Harden attempts a 3Pt. Wide open! Khris George is 6.6 feet away. [ZONE] Blake Harden misses. Rebound secured by Lamelo Stewart.

[00:59] Team_042 possession (Score: 43-47)
Khris George attempts a 3Pt. Contested by Blake Harden (5.3 feet, ZONE). KHRIS GEORGE MAKES IT! Assist: Isaiah Randle
Score: 46-47

[00:47] Team_010 possession (Score: 46-47)
Draymond Leonard commits a violation (traveling/carry)! TURNOVER! (dead ball)

[00:31] Team_042 possession (Score: 46-47)
Allen Towns attempts a Midrange. Contested by Blake Harden (4.1 feet, ZONE). Allen Towns misses. Rebound secured by Ben Gilgeous-Alexander.

[00:14] Team_010 possession (Score: 46-47)
Blake Harden attempts a 3Pt. Contested by Isaiah Randle (5.5 feet, MAN). BLAKE HARDEN MAKES IT! Assist: Ben Gilgeous-Alexander
Score: 46-50

[00:01] Team_042 possession (Score: 46-50)
Khris George makes the Dunk and draws the foul on Draymond Leonard! And-1! Khris George to the line for 1. [Team fouls: 4] (Draymond Leonard: 1 personal fouls)   FT 1/1: GOOD Khris George makes 1/1 from the line.
Score: 49-50

================================================================================
                              2ND QUARTER COMPLETE                              
================================================================================

2ND QUARTER SCORE: Team_042 30, Team_010 16

BOX SCORE:
================================================================================

Team_042
--------------------------------------------------------------------------------
Player                MIN  PTS  REB  AST  TO      FG   FG%      3P   3P%
--------------------------------------------------------------------------------
Khris George           12   11    0    0   0   4/4   100.0     0/0   0.0
Allen Towns            12    7    3    1   0   3/4    75.0     0/0   0.0
Lamelo Stewart         12    4    5    1   0   2/4    50.0     0/0   0.0
Isaiah Randle          12    3    0    3   0   1/3    33.3     0/0   0.0
Gary Jackson           12    3    2    1   0   1/4    25.0     0/0   0.0
Jarrett Sabonis        13    2    0    0   0   1/1   100.0     0/0   0.0
Kristaps Parker        13    0    0    1   0   0/0     0.0     0/0   0.0

TEAM: FG: 12/20 (60.0%), 3PT: 5/6 (83.3%), REB: 10 (1 off, 9 def), AST: 7, TO: 1
TEAM FOULS: 4


Team_010
--------------------------------------------------------------------------------
Player                MIN  PTS  REB  AST  TO      FG   FG%      3P   3P%
--------------------------------------------------------------------------------
Vince Ingram           12    7    0    1   0   3/4    75.0     0/0   0.0
Blake Harden           12    5    8    1   0   2/7    28.6     0/0   0.0
Ben Gilgeous-Alexander   12    4    3    1   0   2/3    66.7     0/0   0.0
Paolo Wade             12    0    3    1   0   0/0     0.0     0/0   0.0
Draymond Leonard       12    0    0    1   0   0/2     0.0     0/0   0.0

TEAM: FG: 7/16 (43.8%), 3PT: 2/8 (25.0%), REB: 14 (6 off, 8 def), AST: 5, TO: 4
TEAM FOULS: 4

================================================================================

================================================================================
                       3RD QUARTER - Team_042 vs Team_010                       
================================================================================

[12:00] Team_042 possession (Score: 49-50)
Tyler Barrett attempts a 3Pt. Contested by Cade Morant (4.0 feet, MAN). TYLER BARRETT MAKES IT!
Score: 52-50

[11:44] Team_010 possession (Score: 52-50)
Michael Turner attempts a Midrange. Wide open! Cade Dosunmu is 6.2 feet away. [ZONE] MICHAEL TURNER MAKES IT!
Score: 52-52

[11:28] Team_042 possession (Score: 52-52)
Cade Dosunmu drives, Anthony Durant stays with him. Cade Dosunmu attempts a Dunk. Heavily contested by Anthony Durant (1.6 feet, ZONE)! CADE DOSUNMU MAKES IT! Assist: Kristaps Parker
Score: 54-52

[11:14] Team_010 possession (Score: 54-52)
Cade Morant attempts a Midrange. Contested by Jarrett Sabonis (3.8 feet, ZONE). Cade Morant misses. Offensive rebound by Anthony Durant! Anthony Durant kicks it out.

[10:57] Team_010 possession (Score: 54-52)
Cade Morant makes the Midrange and draws the foul on Tyler Barrett! And-1! Cade Morant to the line for 1. [Team fouls: 1] (Tyler Barrett: 1 personal fouls)   FT 1/1: GOOD Cade Morant makes 1/1 from the line.
Score: 54-55

[10:43] Team_042 possession (Score: 54-55)
Kristaps Parker attempts a 3Pt. Contested by Michael Turner (5.6 feet, MAN). KRISTAPS PARKER MAKES IT! Assist: Jarrett Sabonis
Score: 57-55

[10:26] Team_010 possession (Score: 57-55)
Michael Turner makes the Layup and draws the foul on Cade Dosunmu! And-1! Michael Turner to the line for 1. [Team fouls: 2] (Cade Dosunmu: 1 personal fouls)   FT 1/1: GOOD Michael Turner makes 1/1 from the line.
Score: 57-58

[10:15] Team_042 possession (Score: 57-58)
Dejounte Butler drives and kicks out. Cade Dosunmu attempts a Midrange. Contested by Anthony Durant (5.3 feet, MAN). Cade Dosunmu misses. Rebound secured by Anthony Durant.

[10:05] Team_010 possession (Score: 57-58)
Cade Morant attempts a Midrange. Wide open! Kristaps Parker is 6.3 feet away. [ZONE] CADE MORANT MAKES IT!
Score: 57-60

[09:49] Team_042 possession (Score: 57-60)
Jarrett Sabonis drives and kicks out. Jarrett Sabonis makes the Midrange and draws the foul on RJ Young! And-1! Jarrett Sabonis to the line for 1. [Team fouls: 1] (RJ Young: 1 personal fouls)   FT 1/1: GOOD Jarrett Sabonis makes 1/1 from the line.
Score: 60-60

[09:36] Team_010 possession (Score: 60-60)
Michael Turner attempts a Layup. Contested by Kristaps Parker (6.0 feet, MAN). MICHAEL TURNER MAKES IT!
Score: 60-62

[09:21] Team_042 possession (Score: 60-62)
FOUL! Reach-in foul on Anthony Durant during the drive. [Team fouls: 2] No free throws, side out. (Anthony Durant: 1 personal fouls)

[09:04] Team_042 possession (Score: 60-62)
Jarrett Sabonis attempts a 3Pt. Wide open! RJ Young is 9.5 feet away. [MAN] JARRETT SABONIS MAKES IT! Assist: Kristaps Parker
Score: 63-62

[08:50] Team_010 possession (Score: 63-62)
Michael Turner attempts a 3Pt. Contested by Kristaps Parker (3.6 feet, MAN). Michael Turner misses. Offensive rebound by Cade Morant! Cade Morant kicks it out.

[08:38] Team_010 possession (Score: 63-62)
Anthony Durant attempts a Midrange. Contested by Tyler Barrett (3.8 feet, ZONE). Anthony Durant misses. Rebound secured by Dejounte Butler.

[08:21] Team_042 possession (Score: 63-62)
Jarrett Sabonis attempts a 3Pt. Heavily contested by Cade Morant (1.7 feet, ZONE)! Jarrett Sabonis misses. Rebound secured by Anthony Durant.

[08:06] Team_010 possession (Score: 63-62)
Cade Morant attempts a Layup. Contested by Tyler Barrett (3.7 feet, MAN). Cade Morant misses. Rebound secured by Tyler Barrett.

[07:50] Team_042 possession (Score: 63-62)
Jarrett Sabonis attempts a Midrange. Contested by RJ Young (3.5 feet, ZONE). Jarrett Sabonis misses. Rebound secured by Anthony Durant.

[07:35] Team_010 possession (Score: 63-62)
RJ Young drives, Jarrett Sabonis stays with him. RJ Young attempts a Dunk. Contested by Jarrett Sabonis (4.2 feet, MAN). RJ Young misses. Rebound secured by Dejounte Butler.

[07:21] Team_042 possession (Score: 63-62)
Kristaps Parker attempts a Midrange. Contested by RJ Young (2.2 feet, ZONE). Kristaps Parker misses. Offensive rebound by Dejounte Butler! Dejounte Butler's putback is no good. Rebound secured by Desmond Antetokounmpo.

[07:07] Team_010 possession (Score: 63-62)
Anthony Durant attempts a Midrange. Contested by Cade Dosunmu (4.1 feet, MAN). ANTHONY DURANT MAKES IT!
Score: 63-64

[06:50] Team_042 possession (Score: 63-64)
Tyler Barrett attempts a 3Pt. Wide open! Cade Morant is 6.1 feet away. [ZONE] Tyler Barrett misses. Offensive rebound by Dejounte Butler! Dejounte Butler's putback is no good. Offensive rebound by Dejounte Butler! Dejounte Butler kicks it out.

[06:37] Team_042 possession (Score: 63-64)
Kristaps Parker attempts a 3Pt. Heavily contested by Cade Morant (1.5 feet, ZONE)! Kristaps Parker misses. Rebound secured by Desmond Antetokounmpo.

[06:24] Team_010 possession (Score: 63-64)
Anthony Durant drives to the basket... Anthony Durant loses control! Ball rolls out of bounds! TURNOVER! (dead ball)

[06:10] Team_042 possession (Score: 63-64)
Cade Dosunmu drives to the basket... Cade Dosunmu loses control! Ball rolls out of bounds! TURNOVER! (dead ball)

[05:56] Team_010 possession (Score: 63-64)
FOUL! Reach-in foul on Cade Dosunmu during the drive. [Team fouls: 3] No free throws, side out. (Cade Dosunmu: 2 personal fouls)

[05:40] Team_010 possession (Score: 63-64)
Michael Turner attempts a Midrange. Contested by Kristaps Parker (5.9 feet, MAN). MICHAEL TURNER MAKES IT!
Score: 63-66

[05:22] Team_042 possession (Score: 63-66)
Dejounte Butler makes the Layup and draws the foul on Desmond Antetokounmpo! And-1! Dejounte Butler to the line for 1. [Team fouls: 4] (Desmond Antetokounmpo: 1 personal fouls)   FT 1/1: GOOD Dejounte Butler makes 1/1 from the line.
Score: 66-66

[05:07] Team_010 possession (Score: 66-66)
Anthony Durant drives and kicks out. Michael Turner attempts a 3Pt. Contested by Jarrett Sabonis (5.0 feet, ZONE). Michael Turner misses. Rebound secured by Cade Dosunmu.

[04:56] Team_042 possession (Score: 66-66)
Cade Dosunmu commits a violation (traveling/carry)! TURNOVER! (dead ball)

[04:42] Team_010 possession (Score: 66-66)
Anthony Durant drives and kicks out. Michael Turner attempts a 3Pt. Contested by Kristaps Parker (4.8 feet, ZONE). Michael Turner misses. Rebound secured by Cade Dosunmu.

[04:26] Team_042 possession (Score: 66-66)
Dejounte Butler attempts a 3Pt. Contested by Cade Morant (4.0 feet, ZONE). Dejounte Butler misses. Rebound secured by Cade Morant.

[04:10] Team_010 possession (Score: 66-66)
Michael Turner drives and kicks out. Desmond Antetokounmpo attempts a Midrange. Contested by Cade Dosunmu (2.9 feet, ZONE). Desmond Antetokounmpo misses. Rebound secured by Tyler Barrett.

[03:52] Team_042 possession (Score: 66-66)
Cade Dosunmu attempts a Midrange. Contested by Anthony Durant (3.7 feet, MAN). Cade Dosunmu misses. Rebound secured by Anthony Durant.

[03:37] Team_010 possession (Score: 66-66)
Cade Morant attempts a Layup. Contested by Tyler Barrett (5.2 feet, MAN). CADE MORANT MAKES IT! Assist: RJ Young
Score: 66-68

[03:20] Team_042 possession (Score: 66-68)
Kristaps Parker attempts a Layup. Wide open! Anthony Durant is 6.3 feet away. [ZONE] KRISTAPS PARKER MAKES IT! Assist: Cade Dosunmu
Score: 68-68

[03:06] Team_010 possession (Score: 68-68)
Michael Turner attempts a Layup. Wide open! Kristaps Parker is 7.1 feet away. [MAN] MICHAEL TURNER MAKES IT!
Score: 68-70

[02:47] Team_042 possession (Score: 68-70)
FOUL! Holding foul on Cade Morant. [IN THE BONUS! 5 team fouls] Tyler Barrett to the line for 2 free throws. (Cade Morant: 2 personal fouls)   FT 1/2: GOOD   FT 2/2: GOOD Tyler Barrett makes 2/2 from the line.
Score: 70-70

[02:33] Team_010 possession (Score: 70-70)
Anthony Durant drives, Cade Dosunmu stays with him. Anthony Durant attempts a Dunk. Contested by Cade Dosunmu (4.4 feet, MAN). ANTHONY DURANT MAKES IT!
Score: 70-72

[02:16] Team_042 possession (Score: 70-72)
Tyler Barrett loses the ball! Stripped by Cade Morant! TURNOVER! (live ball)

[02:02] Team_010 possession (Score: 70-72)
Cade Morant throws a bad pass out of bounds! TURNOVER! (dead ball)

[02:02] Substitution (Team_042): Tyler Barrett OUT → Khris George IN (stamina_rule2)

[02:02] Substitution (Team_042): Kristaps Parker OUT → Isaiah Randle IN (stamina_rule2)

[02:02] Substitution (Team_042): Jarrett Sabonis OUT → Gary Jackson IN (stamina_rule2)

[02:02] Substitution (Team_042): Dejounte Butler OUT → Allen Towns IN (stamina_rule2)

[02:02] Substitution (Team_042): Cade Dosunmu OUT → Lamelo Stewart IN (stamina_rule2)

[02:02] Substitution (Team_010): Cade Morant OUT → Draymond Leonard IN (stamina_rule2)

[02:02] Substitution (Team_010): Michael Turner OUT → Blake Harden IN (stamina_rule2)

[02:02] Substitution (Team_010): RJ Young OUT → Ben Gilgeous-Alexander IN (stamina_rule2)

[02:02] Substitution (Team_010): Desmond Antetokounmpo OUT → Vince Ingram IN (stamina_rule2)

[02:02] Substitution (Team_010): Anthony Durant OUT → Paolo Wade IN (stamina_rule2)

[01:42] Team_042 possession (Score: 70-72)
Allen Towns attempts a 3Pt. Wide open! Vince Ingram is 8.5 feet away. [MAN] ALLEN TOWNS MAKES IT! Assist: Khris George
Score: 73-72

[01:27] Team_010 possession (Score: 73-72)
Ben Gilgeous-Alexander drives and kicks out. Vince Ingram attempts a 3Pt. Contested by Khris George (6.0 feet, ZONE). Vince Ingram misses. Offensive rebound by Blake Harden! Blake Harden kicks it out.

[01:08] Team_010 possession (Score: 73-72)
Paolo Wade attempts a Layup. Wide open! Lamelo Stewart is 7.5 feet away. [MAN] PAOLO WADE MAKES IT!
Score: 73-74

[00:56] Team_042 possession (Score: 73-74)
Allen Towns attempts a Midrange. Contested by Vince Ingram (5.0 feet, ZONE). ALLEN TOWNS MAKES IT!
Score: 75-74

[00:42] Team_010 possession (Score: 75-74)
Vince Ingram attempts a Layup. Wide open! Allen Towns is 6.9 feet away. [ZONE] VINCE INGRAM MAKES IT!
Score: 75-76

[00:27] Team_042 possession (Score: 75-76)
Isaiah Randle makes the Layup and draws the foul on Paolo Wade! And-1! Isaiah Randle to the line for 1. [BONUS: 6 team fouls] (Paolo Wade: 1 personal fouls)   FT 1/1: GOOD Isaiah Randle makes 1/1 from the line.
Score: 78-76

[00:10] Team_010 possession (Score: 78-76)
Blake Harden attempts a 3Pt. Contested by Khris George (5.1 feet, ZONE). Blake Harden misses. Rebound secured by Allen Towns.

================================================================================
                              3RD QUARTER COMPLETE                              
================================================================================

3RD QUARTER SCORE: Team_042 29, Team_010 26

BOX SCORE:
================================================================================

Team_042
--------------------------------------------------------------------------------
Player                MIN  PTS  REB  AST  TO      FG   FG%      3P   3P%
--------------------------------------------------------------------------------
Jarrett Sabonis        23    6    0    1   0   2/4    50.0     0/0   0.0
Tyler Barrett          23    5    2    0   0   2/2   100.0     0/0   0.0
Kristaps Parker        23    5    0    2   0   2/4    50.0     0/0   0.0
Allen Towns            14    5    1    0   0   2/2   100.0     0/0   0.0
Dejounte Butler        23    3    3    0   0   1/3    33.3     0/0   0.0
Isaiah Randle          14    3    0    0   0   1/1   100.0     0/0   0.0
Cade Dosunmu           23    2    2    1   0   1/2    50.0     0/0   0.0
Khris George           14    0    0    1   0   0/0     0.0     0/0   0.0

TEAM: FG: 11/18 (61.1%), 3PT: 4/7 (57.1%), REB: 9 (2 off, 7 def), AST: 5, TO: 3
TEAM FOULS: 3


Team_010
--------------------------------------------------------------------------------
Player                MIN  PTS  REB  AST  TO      FG   FG%      3P   3P%
--------------------------------------------------------------------------------
Michael Turner         23   11    0    0   0   5/6    83.3     0/0   0.0
Cade Morant            23    7    2    0   0   3/4    75.0     0/0   0.0
Anthony Durant         23    4    5    0   0   2/5    40.0     0/0   0.0
Paolo Wade             14    2    0    0   0   1/1   100.0     0/0   0.0
Vince Ingram           14    2    0    0   0   1/1   100.0     0/0   0.0
RJ Young               23    0    0    1   0   0/1     0.0     0/0   0.0
Desmond Antetokounmpo   23    0    2    0   0   0/0     0.0     0/0   0.0
Blake Harden           14    0    1    0   0   0/1     0.0     0/0   0.0

TEAM: FG: 12/19 (63.2%), 3PT: 0/1 (0.0%), REB: 9 (3 off, 6 def), AST: 1, TO: 2
TEAM FOULS: 6 [Team_042 in BONUS]

================================================================================

================================================================================
                       4TH QUARTER - Team_042 vs Team_010                       
================================================================================

[12:00] Team_042 possession (Score: 78-76)
FOUL! Holding foul on Desmond Antetokounmpo. [Team fouls: 1] No free throws, side out. (Desmond Antetokounmpo: 1 personal fouls)

[11:49] Team_042 possession (Score: 78-76)
Dejounte Butler attempts a 3Pt. Contested by Cade Morant (3.0 feet, ZONE). DEJOUNTE BUTLER MAKES IT! Assist: Kristaps Parker
Score: 81-76

[11:31] Team_010 possession (Score: 81-76)
RJ Young attempts a 3Pt. Contested by Jarrett Sabonis (2.0 feet, MAN). RJ YOUNG MAKES IT! Assist: Cade Morant
Score: 81-79

[11:17] Team_042 possession (Score: 81-79)
Dejounte Butler attempts a 3Pt. Contested by RJ Young (4.7 feet, ZONE). Dejounte Butler misses. Rebound secured by Anthony Durant.

[11:05] Team_010 possession (Score: 81-79)
RJ Young attempts a Midrange. Contested by Dejounte Butler (4.4 feet, ZONE). RJ Young misses. Rebound secured by Tyler Barrett.

[10:56] Team_042 possession (Score: 81-79)
Cade Dosunmu attempts a 3Pt. Contested by Cade Morant (3.5 feet, ZONE). Cade Dosunmu misses. Rebound secured by Michael Turner.

[10:40] Team_010 possession (Score: 81-79)
Desmond Antetokounmpo makes the Layup and draws the foul on Cade Dosunmu! And-1! Desmond Antetokounmpo to the line for 1. [Team fouls: 1] (Cade Dosunmu: 1 personal fouls)   FT 1/1: GOOD Desmond Antetokounmpo makes 1/1 from the line.
Score: 81-82

[10:27] Team_042 possession (Score: 81-82)
Kristaps Parker attempts a Layup. Contested by Anthony Durant (3.0 feet, ZONE). KRISTAPS PARKER MAKES IT! Assist: Dejounte Butler
Score: 83-82

[10:15] Team_010 possession (Score: 83-82)
Desmond Antetokounmpo attempts a Midrange. Heavily contested by Dejounte Butler (1.5 feet, MAN)! DESMOND ANTETOKOUNMPO MAKES IT! Assist: RJ Young
Score: 83-84

[10:05] Team_042 possession (Score: 83-84)
Jarrett Sabonis drives and kicks out. Jarrett Sabonis attempts a 3Pt. Contested by Cade Morant (2.3 feet, ZONE). Jarrett Sabonis misses. Rebound secured by Cade Morant.

[09:53] Team_010 possession (Score: 83-84)
Anthony Durant drives, picks up Cade Dosunmu. Help arrives from Tyler Barrett! Anthony Durant attempts a Dunk. Contested by Tyler Barrett (4.9 feet, MAN). Anthony Durant misses. Offensive rebound by Anthony Durant! Anthony Durant kicks it out.

[09:37] Team_010 possession (Score: 83-84)
RJ Young attempts a 3Pt. Contested by Tyler Barrett (5.5 feet, ZONE). RJ Young misses. Rebound secured by Tyler Barrett.

[09:25] Team_042 possession (Score: 83-84)
Cade Dosunmu drives to the basket... FOUL! Offensive foul on Cade Dosunmu! Anthony Durant drew the charge! [Team fouls: 2] (Cade Dosunmu: 2 personal fouls) TURNOVER! (dead ball)

[09:13] Team_010 possession (Score: 83-84)
RJ Young attempts a 3Pt. Wide open! Jarrett Sabonis is 6.1 feet away. [MAN] RJ Young misses. Rebound secured by Tyler Barrett.

[08:59] Team_042 possession (Score: 83-84)
Jarrett Sabonis attempts a Midrange. Contested by RJ Young (4.5 feet, ZONE). Jarrett Sabonis misses. Rebound secured by Anthony Durant.

[08:43] Team_010 possession (Score: 83-84)
RJ Young attempts a Layup. BLOCKED BY CADE DOSUNMU! Ball is loose! Offensive rebound by Cade Morant! Cade Morant kicks it out.

[08:30] Team_010 possession (Score: 83-84)
RJ Young attempts a 3Pt. Heavily contested by Jarrett Sabonis (1.7 feet, MAN)! RJ YOUNG MAKES IT! Assist: Cade Morant
Score: 83-87

[08:16] Team_042 possession (Score: 83-87)
Tyler Barrett drives, picks up Anthony Durant. Help arrives from Cade Morant! Tyler Barrett attempts a Layup. Contested by Cade Morant (3.4 feet, ZONE). TYLER BARRETT MAKES IT!
Score: 85-87

[07:57] Team_010 possession (Score: 85-87)
RJ Young attempts a Midrange. Contested by Kristaps Parker (5.2 feet, ZONE). RJ Young misses. Offensive rebound by Cade Morant! Cade Morant kicks it out.

[07:44] Team_010 possession (Score: 85-87)
RJ Young attempts a Layup. Contested by Jarrett Sabonis (5.2 feet, MAN). RJ YOUNG MAKES IT! Assist: Anthony Durant
Score: 85-89

[07:29] Team_042 possession (Score: 85-89)
Tyler Barrett attempts a 3Pt. Contested by Cade Morant (3.5 feet, ZONE). TYLER BARRETT MAKES IT! Assist: Cade Dosunmu
Score: 88-89

[07:12] Team_010 possession (Score: 88-89)
Cade Morant attempts a 3Pt. Contested by Tyler Barrett (2.3 feet, ZONE). Cade Morant misses. Offensive rebound by Anthony Durant! Anthony Durant kicks it out.

[06:56] Team_010 possession (Score: 88-89)
Michael Turner attempts a 3Pt. Wide open! Tyler Barrett is 8.9 feet away. [ZONE] MICHAEL TURNER MAKES IT! Assist: Anthony Durant
Score: 88-92

[06:39] Team_042 possession (Score: 88-92)
Dejounte Butler makes the Dunk and draws the foul on Anthony Durant! And-1! Dejounte Butler to the line for 1. [Team fouls: 2] (Anthony Durant: 1 personal fouls)   FT 1/1: MISS Dejounte Butler makes 0/1 from the line. Rebound secured by Anthony Durant.
Score: 90-92

[06:26] Team_010 possession (Score: 90-92)
Desmond Antetokounmpo attempts a 3Pt. Contested by Tyler Barrett (3.6 feet, ZONE). Desmond Antetokounmpo misses. Rebound secured by Dejounte Butler.

[06:09] Team_042 possession (Score: 90-92)
Jarrett Sabonis attempts a 3Pt. Contested by Cade Morant (4.6 feet, ZONE). Jarrett Sabonis misses. Rebound secured by Cade Morant.

[05:53] Team_010 possession (Score: 90-92)
Michael Turner drives and kicks out. Anthony Durant attempts a Midrange. Contested by Cade Dosunmu (2.9 feet, MAN). ANTHONY DURANT MAKES IT!
Score: 90-94

[05:39] Team_042 possession (Score: 90-94)
Kristaps Parker attempts a 3Pt. Contested by Michael Turner (3.8 feet, MAN). Kristaps Parker misses. FOUL! Loose ball foul on Michael Turner during the rebound battle. [Team fouls: 3] No free throws, side out. (Michael Turner: 1 personal fouls)

[05:25] Team_042 possession (Score: 90-94)
Tyler Barrett drives, Cade Morant stays with him. Tyler Barrett attempts a Dunk. Contested by Cade Morant (5.3 feet, MAN). TYLER BARRETT MAKES IT! Assist: Dejounte Butler
Score: 92-94

[05:11] Team_010 possession (Score: 92-94)
Cade Morant throws a bad pass! Stolen by Tyler Barrett! TURNOVER! (live ball)

[04:57] Team_042 possession (Score: 92-94)
Tyler Barrett attempts a Layup. BLOCKED BY ANTHONY DURANT! Ball is loose! Rebound secured by Michael Turner.

[04:40] Team_010 possession (Score: 92-94)
Desmond Antetokounmpo attempts a Midrange. Wide open! Kristaps Parker is 6.2 feet away. [ZONE] Desmond Antetokounmpo misses. Offensive rebound by Anthony Durant! Anthony Durant kicks it out.

[04:26] Team_010 possession (Score: 92-94)
FOUL! Holding foul on Jarrett Sabonis. [Team fouls: 3] No free throws, side out. (Jarrett Sabonis: 1 personal fouls)

[04:08] Team_010 possession (Score: 92-94)
Desmond Antetokounmpo makes the Midrange and draws the foul on Kristaps Parker! And-1! Desmond Antetokounmpo to the line for 1. [Team fouls: 4] (Kristaps Parker: 1 personal fouls)   FT 1/1: GOOD Desmond Antetokounmpo makes 1/1 from the line.
Score: 92-97

[03:53] Team_042 possession (Score: 92-97)
Jarrett Sabonis throws a bad pass out of bounds! TURNOVER! (dead ball)

[03:53] Substitution (Team_042): Tyler Barrett OUT → Khris George IN (stamina_rule2)

[03:53] Substitution (Team_042): Kristaps Parker OUT → Isaiah Randle IN (stamina_rule2)

[03:53] Substitution (Team_042): Jarrett Sabonis OUT → Gary Jackson IN (stamina_rule2)

[03:53] Substitution (Team_042): Dejounte Butler OUT → Allen Towns IN (stamina_rule2)

[03:53] Substitution (Team_042): Cade Dosunmu OUT → Lamelo Stewart IN (stamina_rule2)

[03:53] Substitution (Team_010): Cade Morant OUT → Draymond Leonard IN (stamina_rule2)

[03:53] Substitution (Team_010): Michael Turner OUT → Blake Harden IN (stamina_rule2)

[03:53] Substitution (Team_010): RJ Young OUT → Ben Gilgeous-Alexander IN (stamina_rule2)

[03:53] Substitution (Team_010): Desmond Antetokounmpo OUT → Vince Ingram IN (stamina_rule2)

[03:53] Substitution (Team_010): Anthony Durant OUT → Paolo Wade IN (stamina_rule2)

[03:41] Team_010 possession (Score: 92-97)
Draymond Leonard attempts a Layup. Contested by Allen Towns (5.1 feet, ZONE). DRAYMOND LEONARD MAKES IT! Assist: Ben Gilgeous-Alexander
Score: 92-99

[03:24] Team_042 possession (Score: 92-99)
Khris George drives, picks up Paolo Wade. Help arrives from Blake Harden! Khris George attempts a Layup. Contested by Blake Harden (4.3 feet, ZONE). KHRIS GEORGE MAKES IT!
Score: 94-99

[03:08] Team_010 possession (Score: 94-99)
Ben Gilgeous-Alexander attempts a 3Pt. Contested by Gary Jackson (2.5 feet, MAN). Ben Gilgeous-Alexander misses. FOUL! Loose ball foul on Lamelo Stewart during the rebound battle. [IN THE BONUS! 5 team fouls] Blake Harden to the line for 2 free throws. (Lamelo Stewart: 1 personal fouls)   FT 1/2: GOOD   FT 2/2: GOOD Blake Harden makes 2/2 from the line.
Score: 94-101

[02:51] Team_042 possession (Score: 94-101)
Khris George drives and kicks out. Lamelo Stewart attempts a Midrange. Contested by Ben Gilgeous-Alexander (5.1 feet, ZONE). LAMELO STEWART MAKES IT!
Score: 96-101

[02:37] Team_010 possession (Score: 96-101)
Blake Harden attempts a Layup. Heavily contested by Lamelo Stewart (0.7 feet, ZONE)! Blake Harden misses. Rebound secured by Lamelo Stewart.

[02:24] Team_042 possession (Score: 96-101)
FOUL! Holding foul on Vince Ingram. [Team fouls: 4] No free throws, side out. (Vince Ingram: 1 personal fouls)

[02:10] Team_042 possession (Score: 96-101)
FOUL! Reach-in foul on Paolo Wade during the drive. [IN THE BONUS! 5 team fouls] Isaiah Randle to the line for 2 free throws. (Paolo Wade: 1 personal fouls)   FT 1/2: MISS   FT 2/2: GOOD Isaiah Randle makes 1/2 from the line.
Score: 97-101

[01:53] Team_010 possession (Score: 97-101)
Paolo Wade drives, Allen Towns stays with him. Paolo Wade attempts a Layup. Contested by Allen Towns (5.2 feet, ZONE). Paolo Wade misses. Rebound secured by Lamelo Stewart.

[01:35] Team_042 possession (Score: 97-101)
Allen Towns attempts a 3Pt. Wide open! Vince Ingram is 6.4 feet away. [MAN] Allen Towns misses. Rebound secured by Blake Harden.

[01:22] Team_010 possession (Score: 97-101)
Draymond Leonard attempts a Midrange. Wide open! Gary Jackson is 6.5 feet away. [ZONE] DRAYMOND LEONARD MAKES IT! Assist: Vince Ingram
Score: 97-103

[01:07] Team_042 possession (Score: 97-103)
Allen Towns drives to the basket... Allen Towns loses control! Ball rolls out of bounds! TURNOVER! (dead ball)

[00:52] Team_010 possession (Score: 97-103)
Blake Harden makes the Layup and draws the foul on Isaiah Randle! And-1! Blake Harden to the line for 1. [BONUS: 6 team fouls] (Isaiah Randle: 1 personal fouls)   FT 1/1: GOOD Blake Harden makes 1/1 from the line.
Score: 97-106

[00:38] Team_042 possession (Score: 97-106)
Isaiah Randle attempts a 3Pt. Contested by Draymond Leonard (2.0 feet, ZONE). Isaiah Randle misses. Rebound secured by Paolo Wade.

[00:22] Team_010 possession (Score: 97-106)
Paolo Wade drives and kicks out. Paolo Wade attempts a Midrange. Contested by Lamelo Stewart (4.0 feet, MAN). Paolo Wade misses. Offensive rebound by Paolo Wade! Paolo Wade kicks it out.

[00:06] Team_010 possession (Score: 97-106)
Vince Ingram attempts a Layup. Contested by Allen Towns (4.0 feet, ZONE). Vince Ingram misses. FOUL! Loose ball foul on Allen Towns during the rebound battle. [IN THE BONUS! 7 team fouls] Paolo Wade to the line for 2 free throws. (Allen Towns: 1 personal fouls)   FT 1/2: GOOD   FT 2/2: GOOD Paolo Wade makes 2/2 from the line.
Score: 97-108

================================================================================
                              4TH QUARTER COMPLETE                              
================================================================================

4TH QUARTER SCORE: Team_042 19, Team_010 32

BOX SCORE:
================================================================================

Team_042
--------------------------------------------------------------------------------
Player                MIN  PTS  REB  AST  TO      FG   FG%      3P   3P%
--------------------------------------------------------------------------------
Tyler Barrett          31    7    3    0   0   3/4    75.0     0/0   0.0
Dejounte Butler        31    3    2    2   0   1/3    33.3     0/0   0.0
Kristaps Parker        31    2    0    1   0   1/1   100.0     0/0   0.0
Khris George           17    2    0    0   0   1/1   100.0     0/0   0.0
Lamelo Stewart         17    2    2    0   0   1/1   100.0     0/0   0.0
Isaiah Randle          17    1    0    0   0   1/2    50.0     0/0   0.0
Cade Dosunmu           31    0    0    1   0   0/1     0.0     0/0   0.0
Jarrett Sabonis        31    0    0    0   0   0/3     0.0     0/0   0.0
Allen Towns            17    0    0    0   0   0/1     0.0     0/0   0.0

TEAM: FG: 8/17 (47.1%), 3PT: 2/7 (28.6%), REB: 7 (1 off, 6 def), AST: 4, TO: 3
TEAM FOULS: 7 [Team_010 in BONUS]


Team_010
--------------------------------------------------------------------------------
Player                MIN  PTS  REB  AST  TO      FG   FG%      3P   3P%
--------------------------------------------------------------------------------
RJ Young               31    8    0    1   0   3/6    50.0     0/0   0.0
Desmond Antetokounmpo   31    8    0    0   0   3/4    75.0     0/0   0.0
Blake Harden           17    5    1    0   0   2/3    66.7     0/0   0.0
Draymond Leonard       17    4    0    0   0   2/2   100.0     0/0   0.0
Michael Turner         31    3    2    0   0   1/1   100.0     0/0   0.0
Anthony Durant         31    2    6    2   0   1/1   100.0     0/0   0.0
Paolo Wade             17    2    2    0   0   1/2    50.0     0/0   0.0
Cade Morant            31    0    4    2   0   0/0     0.0     0/0   0.0
Ben Gilgeous-Alexander   17    0    0    1   0   0/0     0.0     0/0   0.0
Vince Ingram           17    0    0    1   0   0/0     0.0     0/0   0.0

TEAM: FG: 13/19 (68.4%), 3PT: 4/7 (57.1%), REB: 15 (6 off, 9 def), AST: 7, TO: 1
TEAM FOULS: 5 [Team_042 in BONUS]

================================================================================

================================================================================
                               FULL GAME COMPLETE                               
================================================================================

FINAL SCORE: Team_042 97, Team_010 108

SCORING BY QUARTER:
--------------------------------------------------------------------------------
Team                     Q1     Q2     Q3     Q4    FINAL
--------------------------------------------------------------------------------
Team_042                 19     30     29     19       97
Team_010                 34     16     26     32      108
--------------------------------------------------------------------------------

FULL GAME BOX SCORE:
================================================================================

Team_042
--------------------------------------------------------------------------------
Player                MIN  PTS  REB  AST  TO      FG   FG%      3P   3P%      FT STL BLK
--------------------------------------------------------------------------------
Tyler Barrett          31   12    7    0   2   4/5    80.0   2/2   100.0   2/2     1   0
Kristaps Parker        31    7    0    7   2   3/6    50.0   1/3    33.3   0/0     1   0
Jarrett Sabonis        31   16    0    3   1   6/14   42.9   3/8    37.5   1/1     0   1
Dejounte Butler        31   10    8    2   0   4/16   25.0   1/8    12.5   1/2     0   0
Cade Dosunmu           31    8    5    5   1   4/8    50.0   0/1     0.0   1/4     0   1
Khris George           17   13    0    1   0   6/6   100.0   2/2   100.0   1/1     0   0
Isaiah Randle          17    7    0    3   0   3/6    50.0   1/2    50.0   2/3     0   0
Gary Jackson           17    3    2    1   2   1/4    25.0   1/1   100.0   0/0     0   0
Allen Towns            17   12    4    1   0   5/7    71.4   2/3    66.7   0/0     1   0
Lamelo Stewart         17    6    7    1   0   2/4    50.0   0/1     0.0   2/2     0   0

TEAM: FG: 39/77 (50.6%), 3PT: 13/31 (41.9%), REB: 35 (6 off, 29 def), AST: 24, TO: 8


Team_010
--------------------------------------------------------------------------------
Player                MIN  PTS  REB  AST  TO      FG   FG%      3P   3P%      FT STL BLK
--------------------------------------------------------------------------------
Cade Morant            31   15   12    2   3   5/7    71.4   1/1   100.0   4/4     1   0
Michael Turner         31   24    2    0   2  12/16   75.0   2/3    66.7   5/6     1   0
RJ Young               31    8    0    2   1   3/9    33.3   2/6    33.3   0/0     0   0
Desmond Antetokounmpo   31   16    5    0   0   6/7    85.7   0/1     0.0   5/5     0   0
Anthony Durant         31   13   18    4   0   5/9    55.6   0/1     0.0   3/3     0   3
Draymond Leonard       17    4    0    1   1   2/4    50.0   0/2     0.0   0/0     0   0
Blake Harden           17   10   10    1   0   3/10   30.0   1/5    20.0   3/3     0   0
Ben Gilgeous-Alexander   17    4    3    2   2   3/4    75.0   1/1   100.0   0/0     1   0
Vince Ingram           17    9    0    2   0   5/6    83.3   1/2    50.0   3/3     0   0
Paolo Wade             17    4    5    1   0   1/2    50.0   0/0     0.0   2/2     0   1

TEAM: FG: 45/74 (60.8%), 3PT: 8/22 (36.4%), REB: 53 (18 off, 35 def), AST: 15, TO: 9

================================================================================
