================================================================================
                        FULL GAME - Team_078 vs Team_065                        
================================================================================

================================================================================
                       1ST QUARTER - Team_078 vs Team_065                       
================================================================================

[12:00] Team_078 possession (Score: 0-0)
Jabari Barrett drives, Karl Booker stays with him. Jabari Barrett attempts a Dunk. Wide open! Karl Booker is 6.4 feet away. [ZONE] Jabari Barrett misses. Offensive rebound by Isaiah Simmons! Isaiah Simmons puts it back in!
Score: 2-0

[11:49] Team_065 possession (Score: 2-0)
RJ Harden attempts a 3Pt. Heavily contested by Jabari Barnes (0.5 feet, MAN)! RJ Harden misses. Rebound secured by Isaiah Simmons.

[11:36] Team_078 possession (Score: 2-0)
Isaiah Simmons attempts a Midrange. Heavily contested by Russell Wade (1.9 feet, ZONE)! Isaiah Simmons misses. Rebound secured by Russell Wade.

[11:20] Team_065 possession (Score: 2-0)
Russell Wade drives and kicks out. Karl Booker attempts a 3Pt. Contested by Jabari Barrett (2.9 feet, MAN). Karl Booker misses. Rebound secured by Ben Ginobili.

[11:01] Team_078 possession (Score: 2-0)
Isaiah Simmons drives and kicks out. Kyrie Carter attempts a 3Pt. Wide open! RJ Harden is 7.3 feet away. [ZONE] Kyrie Carter misses. Rebound secured by Russell Wade.

[10:49] Team_065 possession (Score: 2-0)
Manu McGrady attempts a Layup. Contested by Jabari Barrett (3.2 feet, ZONE). Manu McGrady misses. Rebound secured by Ben Ginobili.

[10:35] Team_078 possession (Score: 2-0)
Jabari Barnes drives to the basket... Jabari Barnes loses control! Ball rolls out of bounds! TURNOVER! (dead ball)

[10:25] Team_065 possession (Score: 2-0)
Paul Williamson makes the Midrange and draws the foul on Kyrie Carter! And-1! Paul Williamson to the line for 1. [Team fouls: 1] (Kyrie Carter: 1 personal fouls)   FT 1/1: GOOD Paul Williamson makes 1/1 from the line.
Score: 2-3

[10:07] Team_078 possession (Score: 2-3)
Ben Ginobili drives, picks up Russell Wade. Help arrives from Paul Williamson! Ben Ginobili attempts a Dunk. Contested by Paul Williamson (5.4 feet, ZONE). BEN GINOBILI MAKES IT! Assist: Jabari Barrett
Score: 4-3

[09:53] Team_065 possession (Score: 4-3)
Karl Booker attempts a Midrange. Contested by Jabari Barrett (3.8 feet, ZONE). Karl Booker misses. Offensive rebound by Russell Wade! Russell Wade puts it back in!
Score: 4-5

[09:42] Team_078 possession (Score: 4-5)
Jabari Barrett drives and kicks out. Ben Ginobili attempts a 3Pt. Contested by RJ Harden (3.3 feet, ZONE). Ben Ginobili misses. Rebound secured by RJ Harden.

[09:28] Team_065 possession (Score: 4-5)
Russell Wade makes the Midrange and draws the foul on Kyrie Carter! And-1! Russell Wade to the line for 1. [Team fouls: 2] (Kyrie Carter: 2 personal fouls)   FT 1/1: MISS Russell Wade makes 0/1 from the line. Rebound secured by Isaiah Simmons.
Score: 4-7

[09:11] Team_078 possession (Score: 4-7)
Jabari Barrett attempts a 3Pt. Wide open! Russell Wade is 8.0 feet away. [MAN] JABARI BARRETT MAKES IT! Assist: Ben Ginobili
Score: 7-7

[08:56] Team_065 possession (Score: 7-7)
Manu McGrady attempts a 3Pt. Contested by Isaiah Simmons (4.4 feet, ZONE). MANU MCGRADY MAKES IT!
Score: 7-10

[08:41] Team_078 possession (Score: 7-10)
FOUL! Holding foul on Russell Wade. [Team fouls: 1] No free throws, side out. (Russell Wade: 1 personal fouls)

[08:31] Team_078 possession (Score: 7-10)
Jabari Barrett drives, picks up Russell Wade. Help arrives from Paul Williamson! Jabari Barrett attempts a Layup. Heavily contested by Paul Williamson (1.2 feet, ZONE)! JABARI BARRETT MAKES IT! Assist: Kyrie Carter
Score: 9-10

[08:17] Team_065 possession (Score: 9-10)
Russell Wade drives and kicks out. RJ Harden attempts a Midrange. Contested by Jabari Barnes (4.2 feet, MAN). RJ Harden misses. Rebound secured by Jabari Barrett.

[08:04] Team_078 possession (Score: 9-10)
Isaiah Simmons attempts a Midrange. Wide open! Paul Williamson is 6.0 feet away. [ZONE] ISAIAH SIMMONS MAKES IT! Assist: Kyrie Carter
Score: 11-10

[07:51] Team_065 possession (Score: 11-10)
Paul Williamson drives, picks up Kyrie Carter. Help arrives from Isaiah Simmons! Paul Williamson attempts a Layup. Contested by Isaiah Simmons (2.5 feet, MAN). PAUL WILLIAMSON MAKES IT! Assist: Karl Booker
Score: 11-12

[07:35] Team_078 possession (Score: 11-12)
Ben Ginobili attempts a Midrange. Contested by Paul Williamson (2.0 feet, ZONE). BEN GINOBILI MAKES IT!
Score: 13-12

[07:24] Team_065 possession (Score: 13-12)
Karl Booker attempts a Midrange. Contested by Isaiah Simmons (4.9 feet, ZONE). KARL BOOKER MAKES IT!
Score: 13-14

[07:09] Team_078 possession (Score: 13-14)
Ben Ginobili drives and kicks out. Kyrie Carter attempts a 3Pt. Heavily contested by Paul Williamson (1.0 feet, MAN)! Kyrie Carter misses. Rebound secured by RJ Harden.

[06:53] Team_065 possession (Score: 13-14)
RJ Harden loses the ball! Stripped by Jabari Barnes! TURNOVER! (live ball)

[06:36] Team_078 possession (Score: 13-14)
Jabari Barnes drives and kicks out. Ben Ginobili attempts a Midrange. Heavily contested by Russell Wade (0.7 feet, ZONE)! Ben Ginobili misses. Rebound secured by Russell Wade.

[06:20] Team_065 possession (Score: 13-14)
Karl Booker drives to the basket... Karl Booker throws a bad pass! Stolen by Jabari Barrett! TURNOVER! (live ball)

[06:09] Team_078 possession (Score: 13-14)
Kyrie Carter attempts a 3Pt. Contested by Paul Williamson (3.2 feet, MAN). Kyrie Carter misses. Rebound secured by Russell Wade.

[05:55] Team_065 possession (Score: 13-14)
FOUL! Shooting foul on Isaiah Simmons. Manu McGrady to the line for 3 free throws. [Team fouls: 3] (Isaiah Simmons: 1 personal fouls)   FT 1/3: MISS   FT 2/3: GOOD   FT 3/3: GOOD Manu McGrady makes 2/3 from the line.
Score: 13-16

[05:39] Team_078 possession (Score: 13-16)
FOUL! Holding foul on Russell Wade. [Team fouls: 2] No free throws, side out. (Russell Wade: 2 personal fouls)

[05:21] Team_078 possession (Score: 13-16)
Kyrie Carter attempts a 3Pt. Heavily contested by Paul Williamson (0.5 feet, MAN)! Kyrie Carter misses. Rebound secured by Russell Wade.

[05:06] Team_065 possession (Score: 13-16)
Paul Williamson attempts a 3Pt. Wide open! Kyrie Carter is 6.5 feet away. [MAN] PAUL WILLIAMSON MAKES IT! Assist: RJ Harden
Score: 13-19

[04:52] Team_078 possession (Score: 13-19)
FOUL! Holding foul on Russell Wade. [Team fouls: 3] No free throws, side out. (Russell Wade: 3 personal fouls)

[04:40] Team_078 possession (Score: 13-19)
Jabari Barrett attempts a Midrange. Contested by Russell Wade (2.2 feet, MAN). JABARI BARRETT MAKES IT!
Score: 15-19

[04:27] Team_065 possession (Score: 15-19)
Karl Booker loses control! Ball rolls out of bounds! TURNOVER! (dead ball)

[04:17] Team_078 possession (Score: 15-19)
Isaiah Simmons drives and kicks out. Jabari Barrett attempts a Midrange. Contested by Russell Wade (2.6 feet, MAN). Jabari Barrett misses. Rebound secured by RJ Harden.

[04:02] Team_065 possession (Score: 15-19)
FOUL! Holding foul on Jabari Barrett. [Team fouls: 4] No free throws, side out. (Jabari Barrett: 1 personal fouls)

[03:45] Team_065 possession (Score: 15-19)
Karl Booker attempts a Midrange. Contested by Isaiah Simmons (4.0 feet, ZONE). Karl Booker misses. Rebound secured by Jabari Barrett.

[03:29] Team_078 possession (Score: 15-19)
Ben Ginobili drives, picks up Russell Wade. Help arrives from Paul Williamson! Ben Ginobili attempts a Dunk. Heavily contested by Paul Williamson (1.8 feet, MAN)! BEN GINOBILI MAKES IT! Assist: Jabari Barnes
Score: 17-19

[03:10] Team_065 possession (Score: 17-19)
Russell Wade attempts a Layup. Wide open! Ben Ginobili is 7.4 feet away. [MAN] RUSSELL WADE MAKES IT! Assist: Karl Booker
Score: 17-21

[02:57] Team_078 possession (Score: 17-21)
Isaiah Simmons drives and kicks out. Jabari Barnes attempts a Midrange. Heavily contested by Russell Wade (1.6 feet, ZONE)! Jabari Barnes misses. Offensive rebound by Jabari Barrett! Jabari Barrett kicks it out.

[02:42] Team_078 possession (Score: 17-21)
Ben Ginobili drives, Russell Wade stays with him. Ben Ginobili attempts a Layup. Contested by Russell Wade (3.0 feet, ZONE). BEN GINOBILI MAKES IT! Assist: Jabari Barrett
Score: 19-21

[02:31] Team_065 possession (Score: 19-21)
Manu McGrady attempts a Midrange. BLOCKED BY JABARI BARRETT! Ball goes out off Jabari Barrett. Manu McGrady's ball!

[02:12] Team_065 possession (Score: 19-21)
RJ Harden attempts a Midrange. Contested by Jabari Barnes (3.0 feet, MAN). RJ HARDEN MAKES IT! Assist: Paul Williamson
Score: 19-23

[01:57] Team_078 possession (Score: 19-23)
Kyrie Carter attempts a 3Pt. Contested by Paul Williamson (4.0 feet, MAN). Kyrie Carter misses. Rebound secured by Manu McGrady.

[01:41] Team_065 possession (Score: 19-23)
Russell Wade attempts a Midrange. Contested by Ben Ginobili (3.9 feet, ZONE). Russell Wade misses. Rebound secured by Isaiah Simmons.

[01:29] Team_078 possession (Score: 19-23)
Jabari Barrett attempts a Midrange. Contested by Russell Wade (5.8 feet, ZONE). Jabari Barrett misses. Rebound secured by Manu McGrady.

[01:15] Team_065 possession (Score: 19-23)
Russell Wade attempts a Midrange. Wide open! Ben Ginobili is 9.1 feet away. [ZONE] RUSSELL WADE MAKES IT! Assist: Karl Booker
Score: 19-25

[01:03] Team_078 possession (Score: 19-25)
Kyrie Carter attempts a Layup. Wide open! Paul Williamson is 6.5 feet away. [MAN] Kyrie Carter misses. Offensive rebound by Jabari Barrett! Jabari Barrett kicks it out.

[00:48] Team_078 possession (Score: 19-25)
FOUL! Reach-in foul on Russell Wade during the drive. [Team fouls: 4] No free throws, side out. (Russell Wade: 4 personal fouls)

[00:34] Team_078 possession (Score: 19-25)
Jabari Barnes attempts a 3Pt. Wide open! RJ Harden is 7.2 feet away. [MAN] JABARI BARNES MAKES IT!
Score: 22-25

[00:19] Team_065 possession (Score: 22-25)
Manu McGrady throws a bad pass! Stolen by Isaiah Simmons! TURNOVER! (live ball)

[00:01] Team_078 possession (Score: 22-25)
Isaiah Simmons drives and kicks out. Jabari Barrett attempts a 3Pt. Contested by RJ Harden (4.3 feet, ZONE). JABARI BARRETT MAKES IT! Assist: Ben Ginobili
Score: 25-25

================================================================================
                              1ST QUARTER COMPLETE                              
================================================================================

1ST QUARTER SCORE: Team_078 25, Team_065 25

BOX SCORE:
================================================================================

Team_078
--------------------------------------------------------------------------------
Player                MIN  PTS  REB  AST  TO      FG   FG%      3P   3P%
--------------------------------------------------------------------------------
Jabari Barrett         12   10    4    2   0   4/6    66.7     0/0   0.0
Ben Ginobili           12    8    2    2   0   4/5    80.0     0/0   0.0
Isaiah Simmons         12    4    4    0   0   2/5    40.0     0/0   0.0
Jabari Barnes          12    3    0    1   0   1/2    50.0     0/0   0.0
Kyrie Carter           12    0    0    2   0   0/3     0.0     0/0   0.0

TEAM: FG: 11/21 (52.4%), 3PT: 2/5 (40.0%), REB: 10 (3 off, 7 def), AST: 7, TO: 1
TEAM FOULS: 4


Team_065
--------------------------------------------------------------------------------
Player                MIN  PTS  REB  AST  TO      FG   FG%      3P   3P%
--------------------------------------------------------------------------------
Paul Williamson        12    8    0    1   0   3/3   100.0     0/0   0.0
Russell Wade           12    6    6    0   0   3/7    42.9     0/0   0.0
Manu McGrady           12    5    2    0   0   2/3    66.7     0/0   0.0
RJ Harden              12    2    3    1   0   1/2    50.0     0/0   0.0
Karl Booker            12    2    0    3   0   1/2    50.0     0/0   0.0

TEAM: FG: 10/17 (58.8%), 3PT: 3/4 (75.0%), REB: 11 (1 off, 10 def), AST: 5, TO: 4
TEAM FOULS: 4

================================================================================

================================================================================
                       2ND QUARTER - Team_078 vs Team_065                       
================================================================================

[12:00] Team_078 possession (Score: 25-25)
Jabari Barrett attempts a Midrange. Heavily contested by Russell Wade (1.4 feet, MAN)! Jabari Barrett misses. Offensive rebound by Jabari Barrett! Jabari Barrett kicks it out.

[11:41] Team_078 possession (Score: 25-25)
Jabari Barnes attempts a 3Pt. Contested by RJ Harden (3.5 feet, ZONE). JABARI BARNES MAKES IT! Assist: Jabari Barrett
Score: 28-25

[11:24] Team_065 possession (Score: 28-25)
Manu McGrady attempts a 3Pt. Contested by Isaiah Simmons (4.9 feet, MAN). Manu McGrady misses. Rebound secured by Ben Ginobili.

[11:09] Team_078 possession (Score: 28-25)
Kyrie Carter attempts a Midrange. Wide open! Paul Williamson is 9.5 feet away. [MAN] Kyrie Carter misses. Rebound secured by Manu McGrady.

[10:54] Team_065 possession (Score: 28-25)
Karl Booker attempts a 3Pt. Contested by Jabari Barrett (5.5 feet, MAN). Karl Booker misses. Offensive rebound by Russell Wade! Russell Wade's putback is no good. Rebound secured by Jabari Barrett.

[10:38] Team_078 possession (Score: 28-25)
Ben Ginobili makes the Layup and draws the foul on Russell Wade! And-1! Ben Ginobili to the line for 1. [Team fouls: 1] (Russell Wade: 1 personal fouls)   FT 1/1: MISS Ben Ginobili makes 0/1 from the line. Rebound secured by Russell Wade.
Score: 30-25

[10:26] Team_065 possession (Score: 30-25)
Manu McGrady drives and kicks out. Russell Wade attempts a 3Pt. Heavily contested by Ben Ginobili (1.1 feet, MAN)! Russell Wade misses. Rebound secured by Ben Ginobili.

[10:12] Team_078 possession (Score: 30-25)
Kyrie Carter attempts a 3Pt. Heavily contested by RJ Harden (2.0 feet, ZONE)! Kyrie Carter misses. Rebound secured by Manu McGrady.

[09:56] Team_065 possession (Score: 30-25)
Paul Williamson attempts a Midrange. Heavily contested by Isaiah Simmons (1.7 feet, ZONE)! Paul Williamson misses. Rebound secured by Isaiah Simmons.

[09:37] Team_078 possession (Score: 30-25)
Kyrie Carter attempts a 3Pt. Heavily contested by Paul Williamson (1.9 feet, MAN)! KYRIE CARTER MAKES IT!
Score: 33-25

[09:24] Team_065 possession (Score: 33-25)
Karl Booker drives to the basket... Karl Booker throws a bad pass out of bounds! TURNOVER! (dead ball)

[09:24] Substitution (Team_078): Jabari Barnes OUT → Magic Barrett IN (stamina_rule2)

[09:24] Substitution (Team_078): Kyrie Carter OUT → Damian Allen IN (stamina_rule2)

[09:24] Substitution (Team_078): Isaiah Simmons OUT → Malcolm Randle IN (stamina_rule2)

[09:24] Substitution (Team_078): Ben Ginobili OUT → Paul Ming IN (stamina_rule2)

[09:24] Substitution (Team_078): Jabari Barrett OUT → Draymond Irving IN (stamina_rule2)

[09:24] Substitution (Team_065): RJ Harden OUT → Paul Curry IN (stamina_rule2)

[09:24] Substitution (Team_065): Paul Williamson OUT → Derrick Poole IN (stamina_rule2)

[09:24] Substitution (Team_065): Manu McGrady OUT → D'Angelo Porzingis IN (stamina_rule2)

[09:24] Substitution (Team_065): Russell Wade OUT → Karl Leonard IN (stamina_rule2)

[09:24] Substitution (Team_065): Karl Booker OUT → Vince Mobley IN (stamina_rule2)

[09:08] Team_078 possession (Score: 33-25)
Draymond Irving attempts a Layup. Contested by Vince Mobley (2.2 feet, ZONE). Draymond Irving misses. Rebound secured by Vince Mobley.

[08:53] Team_065 possession (Score: 33-25)
Paul Curry makes the Layup and draws the foul on Magic Barrett! And-1! Paul Curry to the line for 1. [Team fouls: 1] (Magic Barrett: 1 personal fouls)   FT 1/1: GOOD Paul Curry makes 1/1 from the line.
Score: 33-28

[08:37] Team_078 possession (Score: 33-28)
Draymond Irving attempts a Midrange. Wide open! Karl Leonard is 6.1 feet away. [ZONE] DRAYMOND IRVING MAKES IT! Assist: Damian Allen
Score: 35-28

[08:22] Team_065 possession (Score: 35-28)
D'Angelo Porzingis drives and kicks out. Vince Mobley attempts a Midrange. Wide open! Draymond Irving is 7.1 feet away. [MAN] Vince Mobley misses. Rebound secured by Paul Ming.

[08:10] Team_078 possession (Score: 35-28)
Damian Allen attempts a 3Pt. Wide open! Paul Curry is 8.0 feet away. [ZONE] DAMIAN ALLEN MAKES IT! Assist: Malcolm Randle
Score: 38-28

[07:54] Team_065 possession (Score: 38-28)
FOUL! Reach-in foul on Damian Allen during the drive. [Team fouls: 2] No free throws, side out. (Damian Allen: 1 personal fouls)

[07:42] Team_065 possession (Score: 38-28)
Derrick Poole attempts a Midrange. Contested by Malcolm Randle (4.4 feet, ZONE). Derrick Poole misses. Rebound secured by Paul Ming.

[07:28] Team_078 possession (Score: 38-28)
Magic Barrett loses control! Ball rolls out of bounds! TURNOVER! (dead ball)

[07:19] Team_065 possession (Score: 38-28)
D'Angelo Porzingis commits a violation (traveling/carry)! TURNOVER! (dead ball)

[07:05] Team_078 possession (Score: 38-28)
Malcolm Randle attempts a 3Pt. Wide open! D'Angelo Porzingis is 6.2 feet away. [MAN] Malcolm Randle misses. Offensive rebound by Draymond Irving! Draymond Irving kicks it out.

[06:53] Team_078 possession (Score: 38-28)
Magic Barrett attempts a 3Pt. Contested by Paul Curry (4.1 feet, MAN). Magic Barrett misses. Rebound secured by Vince Mobley.

[06:40] Team_065 possession (Score: 38-28)
Vince Mobley attempts a Midrange. Contested by Malcolm Randle (3.7 feet, ZONE). Vince Mobley misses. Rebound secured by Malcolm Randle.

[06:28] Team_078 possession (Score: 38-28)
Draymond Irving attempts a 3Pt. Wide open! Paul Curry is 8.7 feet away. [ZONE] Draymond Irving misses. Offensive rebound by Draymond Irving! Draymond Irving kicks it out.

[06:14] Team_078 possession (Score: 38-28)
Paul Ming attempts a Layup. BLOCKED BY DERRICK POOLE! Ball is loose! Offensive rebound by Draymond Irving! Draymond Irving kicks it out.

[06:01] Team_078 possession (Score: 38-28)
Damian Allen attempts a 3Pt. Wide open! Paul Curry is 7.3 feet away. [ZONE] Damian Allen misses. Rebound secured by Karl Leonard.

[05:41] Team_065 possession (Score: 38-28)
Vince Mobley attempts a Layup. Contested by Paul Ming (5.7 feet, ZONE). Vince Mobley misses. Rebound secured by Paul Ming.

[05:27] Team_078 possession (Score: 38-28)
Damian Allen drives, picks up Karl Leonard. Help arrives from Derrick Poole! Damian Allen attempts a Layup. Wide open! Derrick Poole is 8.0 feet away. [ZONE] DAMIAN ALLEN MAKES IT!
Score: 40-28

[05:11] Team_065 possession (Score: 40-28)
Karl Leonard attempts a 3Pt. Contested by Paul Ming (4.4 feet, MAN). Karl Leonard misses. Rebound secured by Draymond Irving.

[04:55] Team_078 possession (Score: 40-28)
Magic Barrett makes the 3Pt and draws the foul on Paul Curry! And-1! Magic Barrett to the line for 1. [Team fouls: 2] (Paul Curry: 1 personal fouls)   FT 1/1: GOOD Magic Barrett makes 1/1 from the line.
Score: 44-28

[04:40] Team_065 possession (Score: 44-28)
D'Angelo Porzingis attempts a 3Pt. Wide open! Malcolm Randle is 6.0 feet away. [MAN] D'Angelo Porzingis misses. Rebound secured by Malcolm Randle.

[04:21] Team_078 possession (Score: 44-28)
Magic Barrett attempts a 3Pt. Contested by Paul Curry (5.9 feet, ZONE). Magic Barrett misses. Rebound secured by D'Angelo Porzingis.

[04:06] Team_065 possession (Score: 44-28)
FOUL! Reach-in foul on Paul Ming during the drive. [Team fouls: 3] No free throws, side out. (Paul Ming: 1 personal fouls)

[03:56] Team_065 possession (Score: 44-28)
FOUL! Holding foul on Malcolm Randle. [Team fouls: 4] No free throws, side out. (Malcolm Randle: 1 personal fouls)

[03:40] Team_065 possession (Score: 44-28)
Derrick Poole attempts a Layup. Wide open! Paul Ming is 8.8 feet away. [ZONE] DERRICK POOLE MAKES IT!
Score: 44-30

[03:27] Team_078 possession (Score: 44-30)
Damian Allen drives, Derrick Poole stays with him. Damian Allen attempts a Dunk. Wide open! Derrick Poole is 9.0 feet away. [MAN] DAMIAN ALLEN MAKES IT!
Score: 46-30

[03:12] Team_065 possession (Score: 46-30)
Paul Curry attempts a 3Pt. Wide open! Magic Barrett is 8.0 feet away. [MAN] Paul Curry misses. Rebound secured by Malcolm Randle.

[02:56] Team_078 possession (Score: 46-30)
Malcolm Randle attempts a 3Pt. Contested by D'Angelo Porzingis (3.7 feet, ZONE). Malcolm Randle misses. Offensive rebound by Draymond Irving! Draymond Irving kicks it out.

[02:39] Team_078 possession (Score: 46-30)
Damian Allen loses the ball! Stripped by Derrick Poole! TURNOVER! (live ball)

[02:27] Team_065 possession (Score: 46-30)
Paul Curry attempts a 3Pt. Contested by Magic Barrett (5.0 feet, MAN). Paul Curry misses. Rebound secured by Draymond Irving.

[02:13] Team_078 possession (Score: 46-30)
FOUL! Holding foul on Vince Mobley. [Team fouls: 3] No free throws, side out. (Vince Mobley: 1 personal fouls)

[02:00] Team_078 possession (Score: 46-30)
Magic Barrett drives to the basket... Magic Barrett loses the ball! Stripped by Paul Curry! TURNOVER! (live ball)

[01:46] Team_065 possession (Score: 46-30)
D'Angelo Porzingis makes the Layup and draws the foul on Damian Allen! And-1! D'Angelo Porzingis to the line for 1. [BONUS: 5 team fouls] (Damian Allen: 2 personal fouls)   FT 1/1: MISS D'Angelo Porzingis makes 0/1 from the line. Offensive rebound by Vince Mobley! Vince Mobley puts it back in!
Score: 46-34

[01:27] Team_078 possession (Score: 46-34)
Damian Allen throws a bad pass out of bounds! TURNOVER! (dead ball)

[01:15] Team_065 possession (Score: 46-34)
D'Angelo Porzingis drives, Paul Ming stays with him. D'Angelo Porzingis attempts a Dunk. Contested by Paul Ming (3.5 feet, ZONE). D'ANGELO PORZINGIS MAKES IT!
Score: 46-36

[01:00] Team_078 possession (Score: 46-36)
FOUL! Reach-in foul on Paul Curry during the drive. [Team fouls: 4] No free throws, side out. (Paul Curry: 2 personal fouls)

[00:48] Team_078 possession (Score: 46-36)
Damian Allen attempts a 3Pt. Heavily contested by D'Angelo Porzingis (1.7 feet, ZONE)! Damian Allen misses. Rebound secured by Vince Mobley.

[00:32] Team_065 possession (Score: 46-36)
Derrick Poole drives, picks up Paul Ming. Help arrives from Damian Allen! Derrick Poole attempts a Layup. Heavily contested by Damian Allen (1.8 feet, ZONE)! Derrick Poole misses. Rebound secured by Draymond Irving.

[00:21] Team_078 possession (Score: 46-36)
Magic Barrett attempts a 3Pt. Contested by Paul Curry (3.5 feet, MAN). Magic Barrett misses. Rebound secured by Vince Mobley.

[00:10] Team_065 possession (Score: 46-36)
FOUL! Shooting foul on Damian Allen. Derrick Poole to the line for 3 free throws. [BONUS: 6 team fouls] (Damian Allen: 3 personal fouls)   FT 1/3: GOOD   FT 2/3: GOOD   FT 3/3: GOOD Derrick Poole makes 3/3 from the line.
Score: 46-39

================================================================================
                              2ND QUARTER COMPLETE                              
================================================================================

2ND QUARTER SCORE: Team_078 21, Team_065 14

BOX SCORE:
================================================================================

Team_078
--------------------------------------------------------------------------------
Player                MIN  PTS  REB  AST  TO      FG   FG%      3P   3P%
--------------------------------------------------------------------------------
Damian Allen            9    7    0    1   0   3/5    60.0     0/0   0.0
Magic Barrett           9    4    0    0   0   1/4    25.0     0/0   0.0
Jabari Barnes          15    3    0    0   0   1/1   100.0     0/0   0.0
Kyrie Carter           15    3    0    0   0   1/3    33.3     0/0   0.0
Draymond Irving         9    2    7    0   0   1/2    50.0     0/0   0.0
Ben Ginobili           15    0    2    0   0   0/1     0.0     0/0   0.0
Isaiah Simmons         15    0    1    0   0   0/0     0.0     0/0   0.0
Paul Ming               9    0    3    0   0   0/0     0.0     0/0   0.0
Malcolm Randle          9    0    3    1   0   0/0     0.0     0/0   0.0

TEAM: FG: 7/16 (43.8%), 3PT: 4/10 (40.0%), REB: 17 (5 off, 12 def), AST: 3, TO: 4
TEAM FOULS: 6 [Team_065 in BONUS]


Team_065
--------------------------------------------------------------------------------
Player                MIN  PTS  REB  AST  TO      FG   FG%      3P   3P%
--------------------------------------------------------------------------------
Derrick Poole           9    5    0    0   0   2/4    50.0     0/0   0.0
Vince Mobley            9    4    4    0   0   1/3    33.3     0/0   0.0
Paul Curry              9    3    0    0   0   1/3    33.3     0/0   0.0
D'Angelo Porzingis      9    2    1    0   0   1/3    33.3     0/0   0.0
Jabari Barrett         15    0    2    1   0   0/0     0.0     0/0   0.0
Manu McGrady           15    0    2    0   0   0/2     0.0     0/0   0.0
Karl Booker            15    0    0    0   0   0/1     0.0     0/0   0.0
Russell Wade           15    0    1    0   0   0/0     0.0     0/0   0.0
Paul Williamson        15    0    0    0   0   0/1     0.0     0/0   0.0
Karl Leonard            9    0    1    0   0   0/1     0.0     0/0   0.0

TEAM: FG: 5/18 (27.8%), 3PT: 1/7 (14.3%), REB: 10 (1 off, 9 def), AST: 0, TO: 2
TEAM FOULS: 4

================================================================================

================================================================================
                       3RD QUARTER - Team_078 vs Team_065                       
================================================================================

[12:00] Team_078 possession (Score: 46-39)
FOUL! Shooting foul on Russell Wade. Ben Ginobili to the line for 2 free throws. [Team fouls: 1] (Russell Wade: 1 personal fouls)   FT 1/2: GOOD   FT 2/2: GOOD Ben Ginobili makes 2/2 from the line.
Score: 48-39

[11:43] Team_065 possession (Score: 48-39)
Manu McGrady attempts a 3Pt. Heavily contested by Isaiah Simmons (1.9 feet, MAN)! MANU MCGRADY MAKES IT! Assist: RJ Harden
Score: 48-42

[11:34] Team_078 possession (Score: 48-42)
Jabari Barnes attempts a 3Pt. Contested by RJ Harden (3.9 feet, MAN). Jabari Barnes misses. Offensive rebound by Jabari Barrett! Jabari Barrett kicks it out.

[11:25] Team_078 possession (Score: 48-42)
Isaiah Simmons attempts a 3Pt. Contested by RJ Harden (6.0 feet, ZONE). Isaiah Simmons misses. Offensive rebound by Isaiah Simmons! Isaiah Simmons's putback is no good. Offensive rebound by Isaiah Simmons! Isaiah Simmons kicks it out.

[11:13] Team_078 possession (Score: 48-42)
Jabari Barrett drives and kicks out. Isaiah Simmons attempts a 3Pt. Contested by Manu McGrady (2.4 feet, MAN). ISAIAH SIMMONS MAKES IT! Assist: Kyrie Carter
Score: 51-42

[10:59] Team_065 possession (Score: 51-42)
Russell Wade attempts a 3Pt. Contested by Ben Ginobili (5.5 feet, MAN). Russell Wade misses. Rebound secured by Ben Ginobili.

[10:47] Team_078 possession (Score: 51-42)
Jabari Barnes attempts a 3Pt. Contested by RJ Harden (5.3 feet, ZONE). Jabari Barnes misses. Rebound secured by Russell Wade.

[10:33] Team_065 possession (Score: 51-42)
Manu McGrady drives and kicks out. RJ Harden attempts a Midrange. Contested by Jabari Barnes (3.1 feet, MAN). RJ Harden misses. Offensive rebound by Manu McGrady! Manu McGrady kicks it out.

[10:17] Team_065 possession (Score: 51-42)
Manu McGrady attempts a 3Pt. Contested by Isaiah Simmons (3.5 feet, MAN). Manu McGrady misses. Rebound secured by Ben Ginobili.

[09:59] Team_078 possession (Score: 51-42)
Jabari Barrett attempts a Layup. BLOCKED BY RUSSELL WADE! Ball deflects out of bounds off Jabari Barrett.

[09:44] Team_065 possession (Score: 51-42)
Karl Booker attempts a Midrange. Wide open! Ben Ginobili is 8.8 feet away. [ZONE] KARL BOOKER MAKES IT! Assist: RJ Harden
Score: 51-44

[09:29] Team_078 possession (Score: 51-44)
Jabari Barrett drives, Russell Wade stays with him. Jabari Barrett attempts a Dunk. Wide open! Russell Wade is 7.3 feet away. [ZONE] Jabari Barrett misses. Rebound secured by RJ Harden.

[09:15] Team_065 possession (Score: 51-44)
Karl Booker drives to the basket... Karl Booker loses control! Ball rolls out of bounds! TURNOVER! (dead ball)

[08:56] Team_078 possession (Score: 51-44)
Kyrie Carter attempts a Midrange. Heavily contested by Paul Williamson (1.4 feet, ZONE)! Kyrie Carter misses. Rebound secured by Manu McGrady.

[08:39] Team_065 possession (Score: 51-44)
Karl Booker attempts a Layup. BLOCKED BY JABARI BARRETT! Ball is loose! Rebound secured by Isaiah Simmons.

[08:24] Team_078 possession (Score: 51-44)
FOUL! Shooting foul on Russell Wade. Ben Ginobili to the line for 3 free throws. [Team fouls: 2] (Russell Wade: 2 personal fouls)   FT 1/3: GOOD   FT 2/3: MISS   FT 3/3: GOOD Ben Ginobili makes 2/3 from the line.
Score: 53-44

[08:09] Team_065 possession (Score: 53-44)
Paul Williamson attempts a 3Pt. Heavily contested by Kyrie Carter (0.5 feet, MAN)! Paul Williamson misses. Rebound secured by Isaiah Simmons.

[07:57] Team_078 possession (Score: 53-44)
FOUL! Shooting foul on Russell Wade. Jabari Barnes to the line for 2 free throws. [Team fouls: 3] (Russell Wade: 3 personal fouls)   FT 1/2: GOOD   FT 2/2: GOOD Jabari Barnes makes 2/2 from the line.
Score: 55-44

[07:43] Team_065 possession (Score: 55-44)
Karl Booker drives, Jabari Barrett stays with him. Karl Booker attempts a Dunk. Contested by Jabari Barrett (3.9 feet, ZONE). KARL BOOKER MAKES IT! Assist: RJ Harden
Score: 55-46

[07:32] Team_078 possession (Score: 55-46)
FOUL! Reach-in foul on Paul Williamson during the drive. [Team fouls: 4] No free throws, side out. (Paul Williamson: 1 personal fouls)

[07:13] Team_078 possession (Score: 55-46)
Isaiah Simmons attempts a 3Pt. Contested by Manu McGrady (5.9 feet, MAN). Isaiah Simmons misses. Rebound secured by RJ Harden.

[06:56] Team_065 possession (Score: 55-46)
Russell Wade makes the Layup and draws the foul on Ben Ginobili! And-1! Russell Wade to the line for 1. [Team fouls: 1] (Ben Ginobili: 1 personal fouls)   FT 1/1: GOOD Russell Wade makes 1/1 from the line.
Score: 55-49

[06:46] Team_078 possession (Score: 55-49)
Ben Ginobili attempts a Midrange. Wide open! Russell Wade is 6.8 feet away. [MAN] Ben Ginobili misses. Rebound secured by RJ Harden.

[06:29] Team_065 possession (Score: 55-49)
Paul Williamson drives and kicks out. Paul Williamson attempts a 3Pt. Heavily contested by Isaiah Simmons (1.8 feet, ZONE)! Paul Williamson misses. Rebound secured by Ben Ginobili.

[06:14] Team_078 possession (Score: 55-49)
Isaiah Simmons drives to the basket... Isaiah Simmons loses control! Ball rolls out of bounds! TURNOVER! (dead ball)

[06:00] Team_065 possession (Score: 55-49)
Russell Wade drives, picks up Ben Ginobili. Help arrives from Kyrie Carter! Russell Wade attempts a Layup. Wide open! Kyrie Carter is 6.2 feet away. [MAN] Russell Wade misses. Rebound secured by Jabari Barrett.

[05:45] Team_078 possession (Score: 55-49)
FOUL! Shooting foul on Russell Wade. Kyrie Carter to the line for 3 free throws. [BONUS: 5 team fouls] (Russell Wade: 4 personal fouls)   FT 1/3: GOOD   FT 2/3: MISS   FT 3/3: GOOD Kyrie Carter makes 2/3 from the line.
Score: 57-49

[05:30] Team_065 possession (Score: 57-49)
Paul Williamson attempts a 3Pt. Contested by Kyrie Carter (4.0 feet, MAN). PAUL WILLIAMSON MAKES IT! Assist: Manu McGrady
Score: 57-52

[05:18] Team_078 possession (Score: 57-52)
Jabari Barrett attempts a Layup. Contested by Karl Booker (2.3 feet, ZONE). Jabari Barrett misses. Rebound secured by Manu McGrady.

[05:02] Team_065 possession (Score: 57-52)
Karl Booker drives to the basket... Karl Booker commits a violation (traveling/carry)! TURNOVER! (dead ball)

[04:46] Team_078 possession (Score: 57-52)
Jabari Barnes throws a bad pass! Stolen by RJ Harden! TURNOVER! (live ball)

[04:33] Team_065 possession (Score: 57-52)
Paul Williamson attempts a Midrange. Wide open! Kyrie Carter is 6.8 feet away. [MAN] Paul Williamson misses. Rebound secured by Isaiah Simmons.

[04:21] Team_078 possession (Score: 57-52)
Jabari Barrett attempts a Midrange. Heavily contested by Paul Williamson (2.0 feet, ZONE)! Jabari Barrett misses. Rebound secured by Russell Wade.

[04:06] Team_065 possession (Score: 57-52)
Russell Wade attempts a Layup. Wide open! Ben Ginobili is 7.5 feet away. [MAN] RUSSELL WADE MAKES IT! Assist: Karl Booker
Score: 57-54

[03:55] Team_078 possession (Score: 57-54)
Isaiah Simmons attempts a 3Pt. Contested by Manu McGrady (3.8 feet, MAN). Isaiah Simmons misses. Offensive rebound by Isaiah Simmons! Isaiah Simmons puts it back in!
Score: 59-54

[03:40] Team_065 possession (Score: 59-54)
RJ Harden attempts a 3Pt. Contested by Isaiah Simmons (3.6 feet, ZONE). RJ HARDEN MAKES IT! Assist: Russell Wade
Score: 59-57

[03:27] Team_078 possession (Score: 59-57)
Ben Ginobili drives, Russell Wade stays with him. Ben Ginobili attempts a Dunk. Wide open! Russell Wade is 6.9 feet away. [MAN] BEN GINOBILI MAKES IT! Assist: Jabari Barrett
Score: 61-57

[03:11] Team_065 possession (Score: 61-57)
Russell Wade attempts a 3Pt. Contested by Ben Ginobili (5.7 feet, MAN). Russell Wade misses. Rebound secured by Isaiah Simmons.

[02:52] Team_078 possession (Score: 61-57)
Jabari Barrett drives, picks up Russell Wade. Help arrives from Paul Williamson! Jabari Barrett attempts a Layup. Contested by Paul Williamson (4.7 feet, MAN). Jabari Barrett misses. Rebound secured by Russell Wade.

[02:41] Team_065 possession (Score: 61-57)
Paul Williamson attempts a 3Pt. Wide open! Isaiah Simmons is 6.2 feet away. [ZONE] Paul Williamson misses. Rebound secured by Ben Ginobili.

[02:24] Team_078 possession (Score: 61-57)
Isaiah Simmons attempts a 3Pt. Contested by RJ Harden (2.3 feet, ZONE). Isaiah Simmons misses. Rebound secured by Manu McGrady.

[02:06] Team_065 possession (Score: 61-57)
Russell Wade attempts a Midrange. Wide open! Ben Ginobili is 6.1 feet away. [MAN] RUSSELL WADE MAKES IT!
Score: 61-59

[01:50] Team_078 possession (Score: 61-59)
Jabari Barrett drives to the basket... Jabari Barrett commits a violation (traveling/carry)! TURNOVER! (dead ball)

[01:50] Substitution (Team_078): Jabari Barnes OUT → Magic Barrett IN (stamina_rule2)

[01:50] Substitution (Team_078): Kyrie Carter OUT → Damian Allen IN (stamina_rule2)

[01:50] Substitution (Team_078): Isaiah Simmons OUT → Malcolm Randle IN (stamina_rule2)

[01:50] Substitution (Team_078): Ben Ginobili OUT → Paul Ming IN (stamina_rule2)

[01:50] Substitution (Team_078): Jabari Barrett OUT → Draymond Irving IN (stamina_rule2)

[01:50] Substitution (Team_065): RJ Harden OUT → Paul Curry IN (stamina_rule2)

[01:50] Substitution (Team_065): Paul Williamson OUT → Derrick Poole IN (stamina_rule2)

[01:50] Substitution (Team_065): Manu McGrady OUT → D'Angelo Porzingis IN (stamina_rule2)

[01:50] Substitution (Team_065): Russell Wade OUT → Karl Leonard IN (stamina_rule2)

[01:50] Substitution (Team_065): Karl Booker OUT → Vince Mobley IN (stamina_rule2)

[01:39] Team_065 possession (Score: 61-59)
Paul Curry attempts a 3Pt. Wide open! Magic Barrett is 8.1 feet away. [ZONE] PAUL CURRY MAKES IT! Assist: D'Angelo Porzingis
Score: 61-62

[01:25] Team_078 possession (Score: 61-62)
Magic Barrett attempts a 3Pt. Contested by Paul Curry (4.3 feet, ZONE). MAGIC BARRETT MAKES IT!
Score: 64-62

[01:13] Team_065 possession (Score: 64-62)
Derrick Poole loses the ball! Stripped by Damian Allen! TURNOVER! (live ball)

[01:00] Team_078 possession (Score: 64-62)
Magic Barrett attempts a 3Pt. Wide open! Paul Curry is 7.7 feet away. [MAN] MAGIC BARRETT MAKES IT! Assist: Damian Allen
Score: 67-62

[00:44] Team_065 possession (Score: 67-62)
Derrick Poole attempts a 3Pt. Contested by Damian Allen (4.7 feet, MAN). DERRICK POOLE MAKES IT! Assist: Karl Leonard
Score: 67-65

[00:28] Team_078 possession (Score: 67-65)
Malcolm Randle attempts a 3Pt. Contested by D'Angelo Porzingis (5.7 feet, MAN). MALCOLM RANDLE MAKES IT!
Score: 70-65

[00:11] Team_065 possession (Score: 70-65)
D'Angelo Porzingis attempts a 3Pt. BLOCKED BY MALCOLM RANDLE! Ball is loose! Rebound secured by Malcolm Randle.

================================================================================
                              3RD QUARTER COMPLETE                              
================================================================================

3RD QUARTER SCORE: Team_078 24, Team_065 26

BOX SCORE:
================================================================================

Team_078
--------------------------------------------------------------------------------
Player                MIN  PTS  REB  AST  TO      FG   FG%      3P   3P%
--------------------------------------------------------------------------------
Ben Ginobili           25    6    4    0   0   3/4    75.0     0/0   0.0
Magic Barrett          11    6    0    0   0   2/2   100.0     0/0   0.0
Isaiah Simmons         25    5    6    0   0   2/4    50.0     0/0   0.0
Malcolm Randle         11    3    1    0   0   1/1   100.0     0/0   0.0
Kyrie Carter           25    2    0    1   0   1/2    50.0     0/0   0.0
Jabari Barnes          25    2    0    0   0   1/2    50.0     0/0   0.0
Jabari Barrett         25    0    2    1   0   0/5     0.0     0/0   0.0
Damian Allen           11    0    0    1   0   0/0     0.0     0/0   0.0

TEAM: FG: 10/20 (50.0%), 3PT: 6/9 (66.7%), REB: 13 (3 off, 10 def), AST: 3, TO: 3
TEAM FOULS: 1


Team_065
--------------------------------------------------------------------------------
Player                MIN  PTS  REB  AST  TO      FG   FG%      3P   3P%
--------------------------------------------------------------------------------
Russell Wade           25    7    3    1   0   3/6    50.0     0/0   0.0
Karl Booker            25    4    0    1   0   2/3    66.7     0/0   0.0
Manu McGrady           25    3    4    1   0   1/2    50.0     0/0   0.0
RJ Harden              25    3    3    3   0   1/1   100.0     0/0   0.0
Paul Williamson        25    3    0    0   0   1/5    20.0     0/0   0.0
Paul Curry             11    3    0    0   0   1/1   100.0     0/0   0.0
Derrick Poole          11    3    0    0   0   1/1   100.0     0/0   0.0
D'Angelo Porzingis     11    0    0    1   0   0/1     0.0     0/0   0.0
Karl Leonard           11    0    0    1   0   0/0     0.0     0/0   0.0

TEAM: FG: 10/20 (50.0%), 3PT: 5/11 (45.5%), REB: 10 (1 off, 9 def), AST: 8, TO: 3
TEAM FOULS: 5 [Team_078 in BONUS]

================================================================================

================================================================================
                       4TH QUARTER - Team_078 vs Team_065                       
================================================================================

[12:00] Team_078 possession (Score: 70-65)
Isaiah Simmons attempts a Dunk. BLOCKED BY RUSSELL WADE! Ball is loose! Rebound secured by Manu McGrady.

[11:48] Team_065 possession (Score: 70-65)
Manu McGrady attempts a Midrange. Contested by Isaiah Simmons (2.6 feet, ZONE). MANU MCGRADY MAKES IT! Assist: Russell Wade
Score: 70-67

[11:37] Team_078 possession (Score: 70-67)
Ben Ginobili attempts a Layup. Contested by Russell Wade (2.1 feet, ZONE). Ben Ginobili misses. Rebound secured by RJ Harden.

[11:20] Team_065 possession (Score: 70-67)
RJ Harden attempts a Midrange. Contested by Jabari Barnes (2.9 feet, MAN). RJ HARDEN MAKES IT!
Score: 70-69

[11:06] Team_078 possession (Score: 70-69)
FOUL! Shooting foul on Russell Wade. Ben Ginobili to the line for 2 free throws. [Team fouls: 1] (Russell Wade: 1 personal fouls)   FT 1/2: GOOD   FT 2/2: MISS Ben Ginobili makes 1/2 from the line. Rebound secured by Manu McGrady.
Score: 71-69

[10:47] Team_065 possession (Score: 71-69)
Manu McGrady attempts a Midrange. Contested by Isaiah Simmons (4.1 feet, MAN). MANU MCGRADY MAKES IT!
Score: 71-71

[10:36] Team_078 possession (Score: 71-71)
Ben Ginobili attempts a Midrange. Wide open! Manu McGrady is 7.6 feet away. [ZONE] BEN GINOBILI MAKES IT! Assist: Kyrie Carter
Score: 73-71

[10:25] Team_065 possession (Score: 73-71)
Manu McGrady attempts a 3Pt. BLOCKED BY BEN GINOBILI! Ball is loose! Rebound secured by Isaiah Simmons.

[10:05] Team_078 possession (Score: 73-71)
Jabari Barrett drives, Russell Wade stays with him. Jabari Barrett attempts a Layup. Heavily contested by Russell Wade (0.5 feet, MAN)! JABARI BARRETT MAKES IT! Assist: Isaiah Simmons
Score: 75-71

[09:47] Team_065 possession (Score: 75-71)
Paul Williamson drives and kicks out. Russell Wade attempts a 3Pt. Wide open! Isaiah Simmons is 7.0 feet away. [ZONE] RUSSELL WADE MAKES IT! Assist: Paul Williamson
Score: 75-74

[09:34] Team_078 possession (Score: 75-74)
Jabari Barnes drives, RJ Harden stays with him. Jabari Barnes attempts a Dunk. Contested by RJ Harden (5.6 feet, MAN). JABARI BARNES MAKES IT! Assist: Kyrie Carter
Score: 77-74

[09:22] Team_065 possession (Score: 77-74)
Karl Booker drives to the basket... Karl Booker throws a bad pass! Stolen by Jabari Barrett! TURNOVER! (live ball)

[09:11] Team_078 possession (Score: 77-74)
Ben Ginobili drives, Russell Wade stays with him. Ben Ginobili attempts a Dunk. Wide open! Russell Wade is 6.1 feet away. [MAN] BEN GINOBILI MAKES IT!
Score: 79-74

[08:55] Team_065 possession (Score: 79-74)
RJ Harden attempts a 3Pt. Contested by Isaiah Simmons (3.6 feet, ZONE). RJ Harden misses. Rebound secured by Isaiah Simmons.

[08:41] Team_078 possession (Score: 79-74)
Ben Ginobili attempts a Midrange. Contested by Manu McGrady (4.1 feet, ZONE). BEN GINOBILI MAKES IT!
Score: 81-74

[08:26] Team_065 possession (Score: 81-74)
FOUL! Shooting foul on Kyrie Carter. Karl Booker to the line for 2 free throws. [Team fouls: 1] (Kyrie Carter: 1 personal fouls)   FT 1/2: GOOD   FT 2/2: GOOD Karl Booker makes 2/2 from the line.
Score: 81-76

[08:13] Team_078 possession (Score: 81-76)
Ben Ginobili drives and kicks out. Isaiah Simmons attempts a Midrange. Contested by Manu McGrady (3.5 feet, ZONE). Isaiah Simmons misses. Rebound secured by Manu McGrady.

[08:02] Team_065 possession (Score: 81-76)
Karl Booker drives to the basket... Karl Booker loses control! Ball rolls out of bounds! TURNOVER! (dead ball)

[08:02] Substitution (Team_078): Jabari Barnes OUT → Magic Barrett IN (stamina_rule2)

[08:02] Substitution (Team_078): Kyrie Carter OUT → Damian Allen IN (stamina_rule2)

[08:02] Substitution (Team_078): Isaiah Simmons OUT → Malcolm Randle IN (stamina_rule2)

[08:02] Substitution (Team_078): Ben Ginobili OUT → Paul Ming IN (stamina_rule2)

[08:02] Substitution (Team_078): Jabari Barrett OUT → Draymond Irving IN (stamina_rule2)

[08:02] Substitution (Team_065): RJ Harden OUT → Paul Curry IN (stamina_rule2)

[08:02] Substitution (Team_065): Paul Williamson OUT → Derrick Poole IN (stamina_rule2)

[08:02] Substitution (Team_065): Manu McGrady OUT → D'Angelo Porzingis IN (stamina_rule2)

[08:02] Substitution (Team_065): Russell Wade OUT → Karl Leonard IN (stamina_rule2)

[08:02] Substitution (Team_065): Karl Booker OUT → Vince Mobley IN (stamina_rule2)

[07:47] Team_078 possession (Score: 81-76)
Paul Ming drives to the basket... FOUL! Offensive foul on Paul Ming! Vince Mobley drew the charge! [Team fouls: 2] (Paul Ming: 1 personal fouls) TURNOVER! (dead ball)

[07:31] Team_065 possession (Score: 81-76)
Derrick Poole attempts a 3Pt. Contested by Damian Allen (4.7 feet, MAN). DERRICK POOLE MAKES IT! Assist: Paul Curry
Score: 81-79

[07:13] Team_078 possession (Score: 81-79)
Malcolm Randle loses control! Ball rolls out of bounds! TURNOVER! (dead ball)

[07:00] Team_065 possession (Score: 81-79)
D'Angelo Porzingis attempts a 3Pt. Wide open! Damian Allen is 6.5 feet away. [ZONE] D'Angelo Porzingis misses. Rebound secured by Paul Ming.

[06:42] Team_078 possession (Score: 81-79)
FOUL! Holding foul on Vince Mobley. [Team fouls: 2] No free throws, side out. (Vince Mobley: 1 personal fouls)

[06:25] Team_078 possession (Score: 81-79)
FOUL! Reach-in foul on Karl Leonard during the drive. [Team fouls: 3] No free throws, side out. (Karl Leonard: 1 personal fouls)

[06:10] Team_078 possession (Score: 81-79)
Draymond Irving attempts a Midrange. Contested by Vince Mobley (5.3 feet, MAN). Draymond Irving misses. Rebound secured by D'Angelo Porzingis.

[05:53] Team_065 possession (Score: 81-79)
Paul Curry drives and kicks out. Vince Mobley attempts a 3Pt. Contested by Damian Allen (4.4 feet, ZONE). VINCE MOBLEY MAKES IT! Assist: D'Angelo Porzingis
Score: 81-82

[05:41] Team_078 possession (Score: 81-82)
FOUL! Shooting foul on D'Angelo Porzingis. Malcolm Randle to the line for 2 free throws. [Team fouls: 4] (D'Angelo Porzingis: 1 personal fouls)   FT 1/2: MISS   FT 2/2: GOOD Malcolm Randle makes 1/2 from the line.
Score: 82-82

[05:28] Team_065 possession (Score: 82-82)
D'Angelo Porzingis attempts a 3Pt. Contested by Damian Allen (5.2 feet, ZONE). D'ANGELO PORZINGIS MAKES IT! Assist: Paul Curry
Score: 82-85

[05:11] Team_078 possession (Score: 82-85)
Draymond Irving attempts a Midrange. Contested by Karl Leonard (5.2 feet, ZONE). Draymond Irving misses. Rebound secured by Vince Mobley.

[04:59] Team_065 possession (Score: 82-85)
Paul Curry attempts a Midrange. Contested by Magic Barrett (5.6 feet, MAN). Paul Curry misses. Rebound secured by Draymond Irving.

[04:47] Team_078 possession (Score: 82-85)
Draymond Irving attempts a Midrange. Heavily contested by Paul Curry (0.8 feet, ZONE)! Draymond Irving misses. Rebound secured by D'Angelo Porzingis.

[04:33] Team_065 possession (Score: 82-85)
D'Angelo Porzingis attempts a 3Pt. Wide open! Damian Allen is 7.6 feet away. [ZONE] D'ANGELO PORZINGIS MAKES IT! Assist: Vince Mobley
Score: 82-88

[04:19] Team_078 possession (Score: 82-88)
Damian Allen attempts a 3Pt. Wide open! Derrick Poole is 7.1 feet away. [MAN] Damian Allen misses. Rebound secured by Vince Mobley.

[04:07] Team_065 possession (Score: 82-88)
Vince Mobley drives and kicks out. Paul Curry attempts a Midrange. Contested by Magic Barrett (5.1 feet, MAN). Paul Curry misses. Rebound secured by Draymond Irving.

[03:56] Team_078 possession (Score: 82-88)
Paul Ming drives, Vince Mobley stays with him. Paul Ming attempts a Dunk. Contested by Vince Mobley (4.1 feet, ZONE). PAUL MING MAKES IT!
Score: 84-88

[03:40] Team_065 possession (Score: 84-88)
Karl Leonard drives and kicks out. Paul Curry attempts a Midrange. Wide open! Damian Allen is 6.8 feet away. [ZONE] PAUL CURRY MAKES IT! Assist: Vince Mobley
Score: 84-90

[03:23] Team_078 possession (Score: 84-90)
Paul Ming attempts a Layup. Contested by Karl Leonard (4.6 feet, MAN). PAUL MING MAKES IT!
Score: 86-90

[03:08] Team_065 possession (Score: 86-90)
Vince Mobley attempts a Midrange. Wide open! Draymond Irving is 7.2 feet away. [MAN] Vince Mobley misses. Rebound secured by Paul Ming.

[02:55] Team_078 possession (Score: 86-90)
Magic Barrett attempts a 3Pt. Wide open! Derrick Poole is 6.4 feet away. [ZONE] Magic Barrett misses. Rebound secured by D'Angelo Porzingis.

[02:44] Team_065 possession (Score: 86-90)
D'Angelo Porzingis attempts a 3Pt. Contested by Malcolm Randle (5.9 feet, MAN). D'ANGELO PORZINGIS MAKES IT! Assist: Derrick Poole
Score: 86-93

[02:29] Team_078 possession (Score: 86-93)
Magic Barrett attempts a Midrange. Contested by Derrick Poole (5.7 feet, ZONE). Magic Barrett misses. Rebound secured by Karl Leonard.

[02:14] Team_065 possession (Score: 86-93)
Vince Mobley attempts a Layup. Wide open! Draymond Irving is 7.1 feet away. [MAN] VINCE MOBLEY MAKES IT!
Score: 86-95

[01:58] Team_078 possession (Score: 86-95)
Paul Ming attempts a 3Pt. Wide open! Karl Leonard is 7.4 feet away. [ZONE] PAUL MING MAKES IT!
Score: 89-95

[01:43] Team_065 possession (Score: 89-95)
Vince Mobley attempts a Midrange. Contested by Draymond Irving (5.4 feet, MAN). Vince Mobley misses. Rebound secured by Paul Ming.

[01:31] Team_078 possession (Score: 89-95)
Paul Ming attempts a 3Pt. Heavily contested by D'Angelo Porzingis (1.8 feet, ZONE)! Paul Ming misses. Rebound secured by Vince Mobley.

[01:15] Team_065 possession (Score: 89-95)
Derrick Poole drives, picks up Damian Allen. Help arrives from Malcolm Randle! Derrick Poole attempts a Layup. Contested by Malcolm Randle (4.1 feet, MAN). Derrick Poole misses. Offensive rebound by Vince Mobley! Vince Mobley puts it back in!
Score: 89-97

[00:58] Team_078 possession (Score: 89-97)
Malcolm Randle drives, picks up Vince Mobley. Help arrives from Derrick Poole! Malcolm Randle attempts a Dunk. Contested by Derrick Poole (3.5 feet, ZONE). MALCOLM RANDLE MAKES IT! Assist: Damian Allen
Score: 91-97

[00:41] Team_065 possession (Score: 91-97)
Derrick Poole attempts a Midrange. Contested by Paul Ming (5.4 feet, ZONE). Derrick Poole misses. Rebound secured by Malcolm Randle.

[00:24] Team_078 possession (Score: 91-97)
Magic Barrett attempts a 3Pt. Contested by Paul Curry (5.0 feet, MAN). Magic Barrett misses. Rebound secured by Karl Leonard.

[00:12] Team_065 possession (Score: 91-97)
Vince Mobley attempts a Midrange. Wide open! Draymond Irving is 7.7 feet away. [MAN] VINCE MOBLEY MAKES IT!
Score: 91-99

================================================================================
                              4TH QUARTER COMPLETE                              
================================================================================

4TH QUARTER SCORE: Team_078 21, Team_065 34

BOX SCORE:
================================================================================

Team_078
--------------------------------------------------------------------------------
Player                MIN  PTS  REB  AST  TO      FG   FG%      3P   3P%
--------------------------------------------------------------------------------
Paul Ming              19    7    3    0   0   3/4    75.0     0/0   0.0
Ben Ginobili           30    6    0    0   0   3/6    50.0     0/0   0.0
Malcolm Randle         19    3    1    0   0   2/2   100.0     0/0   0.0
Jabari Barrett         30    2    0    0   0   1/1   100.0     0/0   0.0
Jabari Barnes          30    2    0    0   0   1/1   100.0     0/0   0.0
Isaiah Simmons         30    0    2    1   0   0/1     0.0     0/0   0.0
Kyrie Carter           30    0    0    2   0   0/0     0.0     0/0   0.0
Draymond Irving        19    0    2    0   0   0/3     0.0     0/0   0.0
Damian Allen           19    0    0    1   0   0/1     0.0     0/0   0.0
Magic Barrett          19    0    0    0   0   0/3     0.0     0/0   0.0

TEAM: FG: 10/22 (45.5%), 3PT: 1/5 (20.0%), REB: 8 (0 off, 8 def), AST: 4, TO: 2
TEAM FOULS: 2


Team_065
--------------------------------------------------------------------------------
Player                MIN  PTS  REB  AST  TO      FG   FG%      3P   3P%
--------------------------------------------------------------------------------
D'Angelo Porzingis     19    9    3    1   0   3/4    75.0     0/0   0.0
Vince Mobley           19    9    4    2   0   4/7    57.1     0/0   0.0
Manu McGrady           30    4    3    0   0   2/3    66.7     0/0   0.0
Russell Wade           30    3    0    1   0   1/1   100.0     0/0   0.0
Derrick Poole          19    3    0    1   0   1/2    50.0     0/0   0.0
RJ Harden              30    2    1    0   0   1/2    50.0     0/0   0.0
Karl Booker            30    2    0    0   0   1/1   100.0     0/0   0.0
Paul Curry             19    2    0    2   0   1/2    50.0     0/0   0.0
Paul Williamson        30    0    0    1   0   0/0     0.0     0/0   0.0
Karl Leonard           19    0    2    0   0   0/0     0.0     0/0   0.0

TEAM: FG: 14/22 (63.6%), 3PT: 4/7 (57.1%), REB: 13 (1 off, 12 def), AST: 8, TO: 2
TEAM FOULS: 4

================================================================================

================================================================================
                               FULL GAME COMPLETE                               
================================================================================

FINAL SCORE: Team_078 91, Team_065 99

SCORING BY QUARTER:
--------------------------------------------------------------------------------
Team                     Q1     Q2     Q3     Q4    FINAL
--------------------------------------------------------------------------------
Team_078                 25     21     24     21       91
Team_065                 25     14     26     34       99
--------------------------------------------------------------------------------

FULL GAME BOX SCORE:
================================================================================

Team_078
--------------------------------------------------------------------------------
Player                MIN  PTS  REB  AST  TO      FG   FG%      3P   3P%      FT STL BLK
--------------------------------------------------------------------------------
Jabari Barnes          30   10    0    1   1   4/6    66.7   2/3    66.7   2/2     1   0
Kyrie Carter           30    5    0    5   1   2/8    25.0   2/6    33.3   2/3     0   0
Isaiah Simmons         30    9   13    1   0   3/9    33.3   1/3    33.3   0/0     1   0
Ben Ginobili           30   20    8    2   2  10/16   62.5   1/1   100.0   5/8     0   1
Jabari Barrett         30   12    8    4   0   6/13   46.2   1/1   100.0   0/0     2   2
Magic Barrett          19   10    0    0   2   3/9    33.3   3/8    37.5   1/1     0   0
Damian Allen           19    7    0    3   3   3/6    50.0   1/4    25.0   0/0     1   0
Malcolm Randle         19    6    5    1   1   3/3   100.0   1/1   100.0   1/2     0   1
Paul Ming              19    7    6    0   0   3/4    75.0   1/2    50.0   0/0     0   0
Draymond Irving        19    2    9    0   0   1/5    20.0   0/0     0.0   0/0     0   0

TEAM: FG: 38/79 (48.1%), 3PT: 13/29 (44.8%), REB: 48 (11 off, 37 def), AST: 17, TO: 10


Team_065
--------------------------------------------------------------------------------
Player                MIN  PTS  REB  AST  TO      FG   FG%      3P   3P%      FT STL BLK
--------------------------------------------------------------------------------
RJ Harden              30    7    7    4   2   3/5    60.0   1/3    33.3   0/0     1   0
Paul Williamson        30   11    0    2   0   5/10   50.0   2/4    50.0   1/1     0   0
Manu McGrady           30   12   11    1   3   5/10   50.0   3/6    50.0   2/3     0   0
Russell Wade           30   16   10    2   1   5/12   41.7   0/2     0.0   1/2     0   2
Karl Booker            30    8    0    4   3   5/8    62.5   0/1     0.0   2/2     0   0
Paul Curry             19    8    0    2   0   3/6    50.0   1/3    33.3   1/1     1   0
Derrick Poole          19   11    0    1   1   5/8    62.5   3/3   100.0   3/3     1   1
D'Angelo Porzingis     19   11    4    2   1   5/9    55.6   3/6    50.0   0/1     0   0
Karl Leonard           19    0    3    1   0   1/2    50.0   0/1     0.0   0/0     0   0
Vince Mobley           19   13    9    2   0   2/7    28.6   0/0     0.0   0/0     0   0

TEAM: FG: 39/77 (50.6%), 3PT: 13/29 (44.8%), REB: 44 (4 off, 40 def), AST: 21, TO: 11

================================================================================
