================================================================================
                        FULL GAME - Team_022 vs Team_090                        
================================================================================

================================================================================
                       1ST QUARTER - Team_022 vs Team_090                       
================================================================================

[12:00] Team_022 possession (Score: 0-0)
Lamelo Dosunmu attempts a Midrange. Heavily contested by Gary Brogdon (1.1 feet, MAN)! Lamelo Dosunmu misses. Offensive rebound by Michael Ginobili! Michael Ginobili kicks it out.

[11:42] Team_022 possession (Score: 0-0)
Michael Ginobili makes the Layup and draws the foul on Gary Brogdon! And-1! Michael Ginobili to the line for 1. [Team fouls: 1] (Gary Brogdon: 1 personal fouls)   FT 1/1: GOOD Michael Ginobili makes 1/1 from the line.
Score: 3-0

[11:31] Team_090 possession (Score: 3-0)
Gary Brogdon drives and kicks out. Tracy Adebayo attempts a Midrange. Contested by Dirk Markkanen (4.3 feet, MAN). TRACY ADEBAYO MAKES IT!
Score: 3-2

[11:17] Team_022 possession (Score: 3-2)
Dirk Markkanen throws a bad pass! Stolen by Tracy Adebayo! TURNOVER! (live ball)

[11:02] Team_090 possession (Score: 3-2)
Zach Wall attempts a 3Pt. Contested by Myles Anthony (5.6 feet, MAN). Zach Wall misses. Offensive rebound by Tracy Adebayo! Tracy Adebayo kicks it out.

[10:50] Team_090 possession (Score: 3-2)
Derrick Mitchell drives and kicks out. Gary Brogdon attempts a 3Pt. Heavily contested by Michael Ginobili (1.9 feet, ZONE)! Gary Brogdon misses. Offensive rebound by Gary Brogdon! Gary Brogdon kicks it out.

[10:36] Team_090 possession (Score: 3-2)
Zach Wall attempts a 3Pt. Contested by Myles Anthony (5.7 feet, MAN). Zach Wall misses. Rebound secured by Dirk Markkanen.

[10:20] Team_022 possession (Score: 3-2)
Myles Anthony drives, Gary Brogdon stays with him. Myles Anthony attempts a Layup. Heavily contested by Gary Brogdon (1.7 feet, ZONE)! MYLES ANTHONY MAKES IT! Assist: Michael Ginobili
Score: 5-2

[10:05] Team_090 possession (Score: 5-2)
Gary Brogdon drives, Lamelo Dosunmu stays with him. Gary Brogdon attempts a Dunk. Wide open! Lamelo Dosunmu is 6.1 feet away. [MAN] GARY BROGDON MAKES IT! Assist: Derrick Mitchell
Score: 5-4

[09:50] Team_022 possession (Score: 5-4)
Lamelo Dosunmu attempts a Layup. Contested by Gary Brogdon (5.8 feet, ZONE). LAMELO DOSUNMU MAKES IT! Assist: Michael Ginobili
Score: 7-4

[09:32] Team_090 possession (Score: 7-4)
Gary Brogdon makes the Layup and draws the foul on Lamelo Dosunmu! And-1! Gary Brogdon to the line for 1. [Team fouls: 1] (Lamelo Dosunmu: 1 personal fouls)   FT 1/1: GOOD Gary Brogdon makes 1/1 from the line.
Score: 7-7

[09:17] Team_022 possession (Score: 7-7)
Malcolm Allen attempts a 3Pt. Contested by Derrick Mitchell (2.9 feet, ZONE). Malcolm Allen misses. Rebound secured by Tracy Adebayo.

[09:03] Team_090 possession (Score: 7-7)
Tracy Adebayo makes the Midrange and draws the foul on Dirk Markkanen! And-1! Tracy Adebayo to the line for 1. [Team fouls: 2] (Dirk Markkanen: 1 personal fouls)   FT 1/1: GOOD Tracy Adebayo makes 1/1 from the line.
Score: 7-10

[08:45] Team_022 possession (Score: 7-10)
Lamelo Dosunmu attempts a 3Pt. Heavily contested by Derrick Mitchell (1.5 feet, ZONE)! Lamelo Dosunmu misses. Rebound secured by Tracy Adebayo.

[08:31] Team_090 possession (Score: 7-10)
Gary Brogdon attempts a Layup. BLOCKED BY MICHAEL GINOBILI! Ball goes out off Michael Ginobili. Gary Brogdon's ball!

[08:15] Team_090 possession (Score: 7-10)
Larry Bridges drives, Dirk Markkanen stays with him. Larry Bridges attempts a Dunk. Contested by Dirk Markkanen (5.0 feet, ZONE). Larry Bridges misses. Offensive rebound by Gary Brogdon! Gary Brogdon kicks it out.

[07:56] Team_090 possession (Score: 7-10)
Derrick Mitchell attempts a Midrange. Contested by Malcolm Allen (5.5 feet, MAN). Derrick Mitchell misses. Rebound secured by Myles Anthony.

[07:40] Team_022 possession (Score: 7-10)
FOUL! Reach-in foul on Gary Brogdon during the drive. [Team fouls: 2] No free throws, side out. (Gary Brogdon: 2 personal fouls)

[07:30] Team_022 possession (Score: 7-10)
Michael Ginobili attempts a 3Pt. Wide open! Larry Bridges is 8.1 feet away. [MAN] MICHAEL GINOBILI MAKES IT! Assist: Lamelo Dosunmu
Score: 10-10

[07:16] Team_090 possession (Score: 10-10)
Tracy Adebayo drives, picks up Dirk Markkanen. Help arrives from Michael Ginobili! Tracy Adebayo attempts a Layup. Wide open! Michael Ginobili is 6.3 feet away. [ZONE] TRACY ADEBAYO MAKES IT!
Score: 10-12

[07:04] Team_022 possession (Score: 10-12)
Myles Anthony throws a bad pass out of bounds! TURNOVER! (dead ball)

[06:50] Team_090 possession (Score: 10-12)
Tracy Adebayo drives to the basket... Tracy Adebayo throws a bad pass! Stolen by Dirk Markkanen! TURNOVER! (live ball)

[06:40] Team_022 possession (Score: 10-12)
Dirk Markkanen drives and kicks out. FOUL! Shooting foul on Derrick Mitchell. Myles Anthony to the line for 3 free throws. [Team fouls: 3] (Derrick Mitchell: 1 personal fouls)   FT 1/3: GOOD   FT 2/3: GOOD   FT 3/3: MISS Myles Anthony makes 2/3 from the line. Rebound secured by Zach Wall.
Score: 12-12

[06:25] Team_090 possession (Score: 12-12)
Gary Brogdon attempts a 3Pt. Contested by Michael Ginobili (2.5 feet, ZONE). Gary Brogdon misses. Offensive rebound by Gary Brogdon! Gary Brogdon kicks it out.

[06:14] Team_090 possession (Score: 12-12)
Zach Wall makes the Midrange and draws the foul on Myles Anthony! And-1! Zach Wall to the line for 1. [Team fouls: 3] (Myles Anthony: 1 personal fouls)   FT 1/1: GOOD Zach Wall makes 1/1 from the line.
Score: 12-15

[06:01] Team_022 possession (Score: 12-15)
Myles Anthony drives to the basket... Myles Anthony throws a bad pass out of bounds! TURNOVER! (dead ball)

[05:50] Team_090 possession (Score: 12-15)
FOUL! Shooting foul on Dirk Markkanen. Tracy Adebayo to the line for 2 free throws. [Team fouls: 4] (Dirk Markkanen: 2 personal fouls)   FT 1/2: GOOD   FT 2/2: GOOD Tracy Adebayo makes 2/2 from the line.
Score: 12-17

[05:37] Team_022 possession (Score: 12-17)
Lamelo Dosunmu drives, Gary Brogdon stays with him. Lamelo Dosunmu attempts a Layup. Contested by Gary Brogdon (3.7 feet, ZONE). Lamelo Dosunmu misses. Offensive rebound by Dirk Markkanen! Dirk Markkanen's putback is no good. Rebound secured by Zach Wall.

[05:22] Team_090 possession (Score: 12-17)
Zach Wall attempts a Layup. Contested by Dirk Markkanen (2.8 feet, ZONE). ZACH WALL MAKES IT!
Score: 12-19

[05:08] Team_022 possession (Score: 12-19)
FOUL! Shooting foul on Gary Brogdon. Michael Ginobili to the line for 2 free throws. [Team fouls: 4] (Gary Brogdon: 3 personal fouls)   FT 1/2: GOOD   FT 2/2: MISS Michael Ginobili makes 1/2 from the line. FOUL! Loose ball foul on Zach Wall during the free throw rebound! [IN THE BONUS! 5 team fouls] Michael Ginobili to the line for 2 free throws. (Zach Wall: 1 personal fouls)   FT 1/2: GOOD   FT 2/2: GOOD Michael Ginobili makes 2/2 from the line.
Score: 15-19

[04:52] Team_090 possession (Score: 15-19)
Gary Brogdon attempts a Layup. Wide open! Lamelo Dosunmu is 7.8 feet away. [ZONE] GARY BROGDON MAKES IT! Assist: Larry Bridges
Score: 15-21

[04:39] Team_022 possession (Score: 15-21)
Lamelo Dosunmu drives, picks up Gary Brogdon. Help arrives from Larry Bridges! Lamelo Dosunmu attempts a Layup. Contested by Larry Bridges (3.4 feet, MAN). LAMELO DOSUNMU MAKES IT! Assist: Malcolm Allen
Score: 17-21

[04:29] Team_090 possession (Score: 17-21)
Gary Brogdon attempts a Layup. Wide open! Lamelo Dosunmu is 6.2 feet away. [MAN] GARY BROGDON MAKES IT! Assist: Tracy Adebayo
Score: 17-23

[04:15] Team_022 possession (Score: 17-23)
Michael Ginobili attempts a 3Pt. Contested by Derrick Mitchell (5.0 feet, ZONE). Michael Ginobili misses. Rebound secured by Gary Brogdon.

[04:01] Team_090 possession (Score: 17-23)
Zach Wall attempts a Layup. Contested by Myles Anthony (2.1 feet, MAN). ZACH WALL MAKES IT!
Score: 17-25

[03:45] Team_022 possession (Score: 17-25)
Dirk Markkanen attempts a Layup. BLOCKED BY LARRY BRIDGES! Ball deflects out of bounds off Dirk Markkanen.

[03:33] Team_090 possession (Score: 17-25)
Gary Brogdon attempts a Midrange. Contested by Lamelo Dosunmu (5.5 feet, MAN). GARY BROGDON MAKES IT! Assist: Tracy Adebayo
Score: 17-27

[03:20] Team_022 possession (Score: 17-27)
Malcolm Allen makes the Layup and draws the foul on Gary Brogdon! And-1! Malcolm Allen to the line for 1. [BONUS: 6 team fouls] (Gary Brogdon: 4 personal fouls)   FT 1/1: GOOD Malcolm Allen makes 1/1 from the line.
Score: 20-27

[03:05] Team_090 possession (Score: 20-27)
Gary Brogdon attempts a 3Pt. Wide open! Lamelo Dosunmu is 10.0 feet away. [MAN] Gary Brogdon misses. Offensive rebound by Zach Wall! Zach Wall kicks it out.

[02:47] Team_090 possession (Score: 20-27)
Larry Bridges drives and kicks out. Tracy Adebayo attempts a 3Pt. Contested by Dirk Markkanen (5.4 feet, MAN). Tracy Adebayo misses. Rebound secured by Myles Anthony.

[02:33] Team_022 possession (Score: 20-27)
FOUL! Offensive foul on Dirk Markkanen! Tracy Adebayo drew the charge! [Team fouls: 5] (Dirk Markkanen: 3 personal fouls) TURNOVER! (dead ball)

[02:21] Team_090 possession (Score: 20-27)
FOUL! Reach-in foul on Malcolm Allen during the drive. [IN THE BONUS! 6 team fouls] Derrick Mitchell to the line for 2 free throws. (Malcolm Allen: 1 personal fouls)   FT 1/2: GOOD   FT 2/2: MISS Derrick Mitchell makes 1/2 from the line. Rebound secured by Michael Ginobili.
Score: 20-28

[02:05] Team_022 possession (Score: 20-28)
Michael Ginobili attempts a Midrange. Contested by Larry Bridges (5.4 feet, MAN). Michael Ginobili misses. Rebound secured by Tracy Adebayo.

[01:55] Team_090 possession (Score: 20-28)
FOUL! Shooting foul on Michael Ginobili. Gary Brogdon to the line for 3 free throws. [BONUS: 7 team fouls] (Michael Ginobili: 1 personal fouls)   FT 1/3: GOOD   FT 2/3: GOOD   FT 3/3: GOOD Gary Brogdon makes 3/3 from the line.
Score: 20-31

[01:40] Team_022 possession (Score: 20-31)
Lamelo Dosunmu attempts a Layup. Contested by Gary Brogdon (2.4 feet, MAN). Lamelo Dosunmu misses. Offensive rebound by Michael Ginobili! Michael Ginobili kicks it out.

[01:23] Team_022 possession (Score: 20-31)
Dirk Markkanen attempts a Layup. Contested by Tracy Adebayo (4.3 feet, MAN). Dirk Markkanen misses. Offensive rebound by Michael Ginobili! Michael Ginobili kicks it out.

[01:11] Team_022 possession (Score: 20-31)
Michael Ginobili attempts a 3Pt. Contested by Zach Wall (2.6 feet, ZONE). Michael Ginobili misses. Rebound secured by Zach Wall.

[00:59] Team_090 possession (Score: 20-31)
Tracy Adebayo drives and kicks out. Derrick Mitchell attempts a 3Pt. Contested by Michael Ginobili (4.3 feet, ZONE). DERRICK MITCHELL MAKES IT! Assist: Larry Bridges
Score: 20-34

[00:44] Team_022 possession (Score: 20-34)
Dirk Markkanen attempts a Layup. Contested by Tracy Adebayo (5.0 feet, MAN). Dirk Markkanen misses. FOUL! Loose ball foul on Tracy Adebayo during the rebound battle. [IN THE BONUS! 7 team fouls] Dirk Markkanen to the line for 2 free throws. (Tracy Adebayo: 1 personal fouls)   FT 1/2: GOOD   FT 2/2: GOOD Dirk Markkanen makes 2/2 from the line.
Score: 22-34

[00:24] Team_090 possession (Score: 22-34)
Tracy Adebayo drives and kicks out. Tracy Adebayo attempts a 3Pt. Contested by Michael Ginobili (2.8 feet, ZONE). Tracy Adebayo misses. Rebound secured by Dirk Markkanen.

[00:09] Team_022 possession (Score: 22-34)
Lamelo Dosunmu attempts a 3Pt. Wide open! Gary Brogdon is 7.4 feet away. [MAN] Lamelo Dosunmu misses. Rebound secured by Tracy Adebayo.

================================================================================
                              1ST QUARTER COMPLETE                              
================================================================================

1ST QUARTER SCORE: Team_022 22, Team_090 34

BOX SCORE:
================================================================================

Team_022
--------------------------------------------------------------------------------
Player                MIN  PTS  REB  AST  TO      FG   FG%      3P   3P%
--------------------------------------------------------------------------------
Michael Ginobili       12    9    4    2   0   3/6    50.0     0/0   0.0
Lamelo Dosunmu         12    4    0    1   0   2/5    40.0     0/0   0.0
Malcolm Allen          12    3    0    1   0   1/2    50.0     0/0   0.0
Dirk Markkanen         12    2    2    0   0   1/3    33.3     0/0   0.0
Myles Anthony          12    2    2    0   0   1/1   100.0     0/0   0.0

TEAM: FG: 8/17 (47.1%), 3PT: 1/6 (16.7%), REB: 9 (4 off, 5 def), AST: 4, TO: 4
TEAM FOULS: 7 [Team_090 in BONUS]


Team_090
--------------------------------------------------------------------------------
Player                MIN  PTS  REB  AST  TO      FG   FG%      3P   3P%
--------------------------------------------------------------------------------
Gary Brogdon           12   14    4    0   0   6/6   100.0     0/0   0.0
Tracy Adebayo          12    9    5    2   0   4/5    80.0     0/0   0.0
Zach Wall              12    7    4    0   0   3/4    75.0     0/0   0.0
Derrick Mitchell       12    3    0    1   0   1/3    33.3     0/0   0.0
Larry Bridges          12    0    0    2   0   0/1     0.0     0/0   0.0

TEAM: FG: 14/19 (73.7%), 3PT: 1/2 (50.0%), REB: 12 (5 off, 7 def), AST: 5, TO: 1
TEAM FOULS: 7 [Team_022 in BONUS]

================================================================================

================================================================================
                       2ND QUARTER - Team_022 vs Team_090                       
================================================================================

[12:00] Team_022 possession (Score: 22-34)
Myles Anthony attempts a 3Pt. Heavily contested by Zach Wall (1.8 feet, MAN)! Myles Anthony misses. Rebound secured by Tracy Adebayo.

[11:46] Team_090 possession (Score: 22-34)
Zach Wall attempts a 3Pt. Contested by Michael Ginobili (3.6 feet, ZONE). Zach Wall misses. Rebound secured by Michael Ginobili.

[11:33] Team_022 possession (Score: 22-34)
Myles Anthony attempts a 3Pt. BLOCKED BY DERRICK MITCHELL! Ball is loose! Rebound secured by Gary Brogdon.

[11:21] Team_090 possession (Score: 22-34)
Gary Brogdon attempts a 3Pt. Wide open! Michael Ginobili is 7.1 feet away. [ZONE] Gary Brogdon misses. Rebound secured by Myles Anthony.

[11:07] Team_022 possession (Score: 22-34)
Malcolm Allen throws a bad pass! Stolen by Derrick Mitchell! TURNOVER! (live ball)

[10:56] Team_090 possession (Score: 22-34)
Larry Bridges drives, Dirk Markkanen stays with him. Larry Bridges attempts a Dunk. Wide open! Dirk Markkanen is 7.9 feet away. [ZONE] LARRY BRIDGES MAKES IT! Assist: Gary Brogdon
Score: 22-36

[10:41] Team_022 possession (Score: 22-36)
FOUL! Shooting foul on Derrick Mitchell. Dirk Markkanen to the line for 3 free throws. [Team fouls: 1] (Derrick Mitchell: 1 personal fouls)   FT 1/3: GOOD   FT 2/3: GOOD   FT 3/3: GOOD Dirk Markkanen makes 3/3 from the line.
Score: 25-36

[10:30] Team_090 possession (Score: 25-36)
Gary Brogdon attempts a 3Pt. Wide open! Lamelo Dosunmu is 8.6 feet away. [MAN] GARY BROGDON MAKES IT! Assist: Larry Bridges
Score: 25-39

[10:16] Team_022 possession (Score: 25-39)
Myles Anthony attempts a Midrange. Wide open! Zach Wall is 6.4 feet away. [ZONE] Myles Anthony misses. Rebound secured by Tracy Adebayo.

[09:59] Team_090 possession (Score: 25-39)
Larry Bridges attempts a 3Pt. Contested by Michael Ginobili (5.2 feet, MAN). LARRY BRIDGES MAKES IT!
Score: 25-42

[09:46] Team_022 possession (Score: 25-42)
Michael Ginobili attempts a 3Pt. Contested by Larry Bridges (4.0 feet, MAN). Michael Ginobili misses. Rebound secured by Gary Brogdon.

[09:31] Team_090 possession (Score: 25-42)
FOUL! Holding foul on Malcolm Allen. [Team fouls: 1] No free throws, side out. (Malcolm Allen: 1 personal fouls)

[09:19] Team_090 possession (Score: 25-42)
Derrick Mitchell attempts a 3Pt. Contested by Malcolm Allen (4.3 feet, MAN). DERRICK MITCHELL MAKES IT! Assist: Gary Brogdon
Score: 25-45

[09:04] Team_022 possession (Score: 25-45)
Lamelo Dosunmu attempts a Midrange. Contested by Gary Brogdon (4.5 feet, MAN). Lamelo Dosunmu misses. Rebound secured by Zach Wall.

[08:51] Team_090 possession (Score: 25-45)
Zach Wall attempts a 3Pt. Contested by Myles Anthony (4.3 feet, ZONE). Zach Wall misses. Rebound secured by Myles Anthony.

[08:33] Team_022 possession (Score: 25-45)
Michael Ginobili attempts a 3Pt. Contested by Derrick Mitchell (2.8 feet, ZONE). MICHAEL GINOBILI MAKES IT! Assist: Malcolm Allen
Score: 28-45

[08:16] Team_090 possession (Score: 28-45)
Zach Wall attempts a Midrange. Contested by Myles Anthony (4.4 feet, ZONE). Zach Wall misses. Offensive rebound by Tracy Adebayo! Tracy Adebayo kicks it out.

[07:58] Team_090 possession (Score: 28-45)
Tracy Adebayo drives, picks up Dirk Markkanen. Help arrives from Michael Ginobili! Tracy Adebayo attempts a Dunk. Wide open! Michael Ginobili is 8.3 feet away. [ZONE] TRACY ADEBAYO MAKES IT!
Score: 28-47

[07:43] Team_022 possession (Score: 28-47)
FOUL! Holding foul on Larry Bridges. [Team fouls: 2] No free throws, side out. (Larry Bridges: 1 personal fouls)

[07:27] Team_022 possession (Score: 28-47)
Malcolm Allen attempts a 3Pt. Wide open! Derrick Mitchell is 6.2 feet away. [MAN] Malcolm Allen misses. Offensive rebound by Michael Ginobili! Michael Ginobili kicks it out.

[07:11] Team_022 possession (Score: 28-47)
Myles Anthony drives, picks up Zach Wall. Help arrives from Larry Bridges! Myles Anthony attempts a Layup. Wide open! Larry Bridges is 9.0 feet away. [MAN] Myles Anthony misses. Rebound secured by Tracy Adebayo.

[07:00] Team_090 possession (Score: 28-47)
Gary Brogdon attempts a Midrange. Contested by Lamelo Dosunmu (4.6 feet, MAN). Gary Brogdon misses. Rebound secured by Dirk Markkanen.

[06:41] Team_022 possession (Score: 28-47)
Malcolm Allen attempts a 3Pt. Contested by Derrick Mitchell (3.2 feet, ZONE). Malcolm Allen misses. Offensive rebound by Michael Ginobili! Michael Ginobili kicks it out.

[06:30] Team_022 possession (Score: 28-47)
FOUL! Reach-in foul on Tracy Adebayo during the drive. [Team fouls: 3] No free throws, side out. (Tracy Adebayo: 1 personal fouls)

[06:14] Team_022 possession (Score: 28-47)
Dirk Markkanen attempts a Midrange. Contested by Tracy Adebayo (5.8 feet, MAN). DIRK MARKKANEN MAKES IT! Assist: Lamelo Dosunmu
Score: 30-47

[05:59] Team_090 possession (Score: 30-47)
FOUL! Reach-in foul on Malcolm Allen during the drive. [Team fouls: 2] No free throws, side out. (Malcolm Allen: 2 personal fouls)

[05:43] Team_090 possession (Score: 30-47)
Larry Bridges attempts a 3Pt. Contested by Michael Ginobili (3.9 feet, MAN). Larry Bridges misses. Rebound secured by Dirk Markkanen.

[05:31] Team_022 possession (Score: 30-47)
Michael Ginobili attempts a 3Pt. Contested by Derrick Mitchell (3.3 feet, ZONE). Michael Ginobili misses. Rebound secured by Tracy Adebayo.

[05:12] Team_090 possession (Score: 30-47)
Gary Brogdon attempts a Midrange. Contested by Lamelo Dosunmu (4.9 feet, ZONE). Gary Brogdon misses. Offensive rebound by Tracy Adebayo! Tracy Adebayo kicks it out.

[04:58] Team_090 possession (Score: 30-47)
Zach Wall makes the Midrange and draws the foul on Michael Ginobili! And-1! Zach Wall to the line for 1. [Team fouls: 3] (Michael Ginobili: 1 personal fouls)   FT 1/1: GOOD Zach Wall makes 1/1 from the line.
Score: 30-50

[04:41] Team_022 possession (Score: 30-50)
Dirk Markkanen attempts a Layup. Wide open! Gary Brogdon is 8.4 feet away. [ZONE] DIRK MARKKANEN MAKES IT!
Score: 32-50

[04:27] Team_090 possession (Score: 32-50)
Zach Wall drives, Myles Anthony stays with him. Zach Wall attempts a Dunk. Wide open! Myles Anthony is 6.8 feet away. [MAN] ZACH WALL MAKES IT! Assist: Gary Brogdon
Score: 32-52

[04:11] Team_022 possession (Score: 32-52)
Malcolm Allen makes the Layup and draws the foul on Larry Bridges! And-1! Malcolm Allen to the line for 1. [Team fouls: 4] (Larry Bridges: 2 personal fouls)   FT 1/1: GOOD Malcolm Allen makes 1/1 from the line.
Score: 35-52

[04:00] Team_090 possession (Score: 35-52)
Larry Bridges attempts a 3Pt. Contested by Michael Ginobili (3.2 feet, MAN). LARRY BRIDGES MAKES IT! Assist: Tracy Adebayo
Score: 35-55

[03:45] Team_022 possession (Score: 35-55)
Dirk Markkanen drives, Tracy Adebayo stays with him. Dirk Markkanen attempts a Dunk. Wide open! Tracy Adebayo is 8.0 feet away. [MAN] Dirk Markkanen misses. Rebound secured by Larry Bridges.

[03:31] Team_090 possession (Score: 35-55)
Gary Brogdon makes the Midrange and draws the foul on Lamelo Dosunmu! And-1! Gary Brogdon to the line for 1. [Team fouls: 4] (Lamelo Dosunmu: 1 personal fouls)   FT 1/1: GOOD Gary Brogdon makes 1/1 from the line.
Score: 35-58

[03:18] Team_022 possession (Score: 35-58)
Michael Ginobili attempts a 3Pt. Wide open! Larry Bridges is 8.5 feet away. [MAN] Michael Ginobili misses. Rebound secured by Tracy Adebayo.

[03:05] Team_090 possession (Score: 35-58)
Tracy Adebayo attempts a Midrange. Wide open! Michael Ginobili is 6.6 feet away. [ZONE] TRACY ADEBAYO MAKES IT!
Score: 35-60

[02:53] Team_022 possession (Score: 35-60)
Lamelo Dosunmu attempts a Layup. BLOCKED BY GARY BROGDON! Ball is loose! Offensive rebound by Michael Ginobili! Michael Ginobili kicks it out.

[02:40] Team_022 possession (Score: 35-60)
Michael Ginobili attempts a 3Pt. Contested by Derrick Mitchell (4.0 feet, ZONE). MICHAEL GINOBILI MAKES IT! Assist: Malcolm Allen
Score: 38-60

[02:29] Team_090 possession (Score: 38-60)
Derrick Mitchell attempts a 3Pt. Wide open! Malcolm Allen is 7.1 feet away. [MAN] Derrick Mitchell misses. Offensive rebound by Zach Wall! Zach Wall kicks it out.

[02:14] Team_090 possession (Score: 38-60)
Derrick Mitchell attempts a 3Pt. Wide open! Michael Ginobili is 6.4 feet away. [ZONE] DERRICK MITCHELL MAKES IT! Assist: Zach Wall
Score: 38-63

[01:56] Team_022 possession (Score: 38-63)
Myles Anthony drives to the basket... Myles Anthony loses control! Ball rolls out of bounds! TURNOVER! (dead ball)

[01:56] Substitution (Team_022): Malcolm Allen OUT → DeMar Harden IN (stamina_rule2)

[01:56] Substitution (Team_022): Michael Ginobili OUT → Lauri Gobert IN (stamina_rule2)

[01:56] Substitution (Team_022): Myles Anthony OUT → Dejounte Towns IN (stamina_rule2)

[01:56] Substitution (Team_022): Lamelo Dosunmu OUT → Kawhi Russell IN (stamina_rule2)

[01:56] Substitution (Team_022): Dirk Markkanen OUT → Cole Iverson IN (stamina_rule2)

[01:56] Substitution (Team_090): Derrick Mitchell OUT → OG Anunoby IN (stamina_rule2)

[01:56] Substitution (Team_090): Larry Bridges OUT → Josh Wall IN (stamina_rule2)

[01:56] Substitution (Team_090): Zach Wall OUT → Russell Smith IN (stamina_rule2)

[01:56] Substitution (Team_090): Gary Brogdon OUT → Derrick Nowitzki IN (stamina_rule2)

[01:56] Substitution (Team_090): Tracy Adebayo OUT → Tobias Tatum IN (stamina_rule2)

[01:46] Team_090 possession (Score: 38-63)
Russell Smith makes the Layup and draws the foul on Kawhi Russell! And-1! Russell Smith to the line for 1. [BONUS: 5 team fouls] (Kawhi Russell: 1 personal fouls)   FT 1/1: GOOD Russell Smith makes 1/1 from the line.
Score: 38-66

[01:27] Team_022 possession (Score: 38-66)
DeMar Harden attempts a 3Pt. Contested by Josh Wall (3.0 feet, ZONE). DeMar Harden misses. Rebound secured by Tobias Tatum.

[01:11] Team_090 possession (Score: 38-66)
Derrick Nowitzki attempts a Midrange. Contested by Kawhi Russell (5.5 feet, ZONE). Derrick Nowitzki misses. Rebound secured by Kawhi Russell.

[00:53] Team_022 possession (Score: 38-66)
Cole Iverson attempts a Midrange. Contested by Tobias Tatum (4.4 feet, MAN). COLE IVERSON MAKES IT!
Score: 40-66

[00:38] Team_090 possession (Score: 40-66)
OG Anunoby attempts a 3Pt. Wide open! DeMar Harden is 7.5 feet away. [MAN] OG ANUNOBY MAKES IT! Assist: Derrick Nowitzki
Score: 40-69

[00:24] Team_022 possession (Score: 40-69)
Dejounte Towns drives and kicks out. Kawhi Russell attempts a 3Pt. Wide open! Derrick Nowitzki is 6.9 feet away. [MAN] Kawhi Russell misses. Rebound secured by Tobias Tatum.

[00:11] Team_090 possession (Score: 40-69)
Derrick Nowitzki attempts a 3Pt. Heavily contested by Kawhi Russell (1.0 feet, ZONE)! Derrick Nowitzki misses. Offensive rebound by Tobias Tatum! Tobias Tatum kicks it out.

================================================================================
                              2ND QUARTER COMPLETE                              
================================================================================

2ND QUARTER SCORE: Team_022 18, Team_090 35

BOX SCORE:
================================================================================

Team_022
--------------------------------------------------------------------------------
Player                MIN  PTS  REB  AST  TO      FG   FG%      3P   3P%
--------------------------------------------------------------------------------
Dirk Markkanen         22    7    2    0   0   3/4    75.0     0/0   0.0
Michael Ginobili       22    6    4    0   0   2/5    40.0     0/0   0.0
Malcolm Allen          22    3    0    2   0   1/1   100.0     0/0   0.0
Cole Iverson            2    2    0    0   0   1/1   100.0     0/0   0.0
Myles Anthony          22    0    2    0   0   0/4     0.0     0/0   0.0
Lamelo Dosunmu         22    0    0    1   0   0/1     0.0     0/0   0.0
DeMar Harden            2    0    0    0   0   0/1     0.0     0/0   0.0
Kawhi Russell           2    0    1    0   0   0/0     0.0     0/0   0.0
Dejounte Towns          2    0    0    0   0   0/1     0.0     0/0   0.0

TEAM: FG: 7/18 (38.9%), 3PT: 3/9 (33.3%), REB: 9 (3 off, 6 def), AST: 3, TO: 2
TEAM FOULS: 5 [Team_090 in BONUS]


Team_090
--------------------------------------------------------------------------------
Player                MIN  PTS  REB  AST  TO      FG   FG%      3P   3P%
--------------------------------------------------------------------------------
Larry Bridges          22    8    1    1   0   3/4    75.0     0/0   0.0
Gary Brogdon           22    6    2    3   0   2/4    50.0     0/0   0.0
Derrick Mitchell       22    6    0    0   0   2/2   100.0     0/0   0.0
Zach Wall              22    5    2    1   0   2/4    50.0     0/0   0.0
Tracy Adebayo          22    4    7    1   0   2/2   100.0     0/0   0.0
Russell Smith           2    3    0    0   0   1/1   100.0     0/0   0.0
OG Anunoby              2    3    0    0   0   1/1   100.0     0/0   0.0
Tobias Tatum            2    0    3    0   0   0/0     0.0     0/0   0.0
Derrick Nowitzki        2    0    0    1   0   0/1     0.0     0/0   0.0

TEAM: FG: 13/19 (68.4%), 3PT: 6/10 (60.0%), REB: 15 (4 off, 11 def), AST: 7, TO: 0
TEAM FOULS: 4

================================================================================

================================================================================
                       3RD QUARTER - Team_022 vs Team_090                       
================================================================================

[12:00] Team_022 possession (Score: 40-69)
FOUL! Reach-in foul on Gary Brogdon during the drive. [Team fouls: 1] No free throws, side out. (Gary Brogdon: 1 personal fouls)

[11:47] Team_022 possession (Score: 40-69)
Myles Anthony attempts a 3Pt. Wide open! Zach Wall is 6.0 feet away. [MAN] Myles Anthony misses. Rebound secured by Gary Brogdon.

[11:36] Team_090 possession (Score: 40-69)
Zach Wall makes the Layup and draws the foul on Dirk Markkanen! And-1! Zach Wall to the line for 1. [Team fouls: 1] (Dirk Markkanen: 1 personal fouls)   FT 1/1: GOOD Zach Wall makes 1/1 from the line.
Score: 40-72

[11:24] Team_022 possession (Score: 40-72)
Myles Anthony attempts a 3Pt. Wide open! Zach Wall is 7.7 feet away. [MAN] Myles Anthony misses. Rebound secured by Tracy Adebayo.

[11:12] Team_090 possession (Score: 40-72)
Zach Wall attempts a 3Pt. Contested by Myles Anthony (4.7 feet, MAN). Zach Wall misses. Offensive rebound by Gary Brogdon! Gary Brogdon kicks it out.

[11:01] Team_090 possession (Score: 40-72)
Gary Brogdon attempts a Layup. Contested by Dirk Markkanen (5.2 feet, ZONE). Gary Brogdon misses. Offensive rebound by Tracy Adebayo! Tracy Adebayo kicks it out.

[10:48] Team_090 possession (Score: 40-72)
FOUL! Shooting foul on Lamelo Dosunmu. Derrick Mitchell to the line for 2 free throws. [Team fouls: 2] (Lamelo Dosunmu: 1 personal fouls)   FT 1/2: GOOD   FT 2/2: GOOD Derrick Mitchell makes 2/2 from the line.
Score: 40-74

[10:37] Team_022 possession (Score: 40-74)
Lamelo Dosunmu drives, Gary Brogdon stays with him. Lamelo Dosunmu attempts a Layup. Contested by Gary Brogdon (2.7 feet, ZONE). LAMELO DOSUNMU MAKES IT! Assist: Dirk Markkanen
Score: 42-74

[10:19] Team_090 possession (Score: 42-74)
Derrick Mitchell drives and kicks out. Tracy Adebayo attempts a Midrange. Contested by Dirk Markkanen (2.9 feet, MAN). Tracy Adebayo misses. Rebound secured by Myles Anthony.

[10:08] Team_022 possession (Score: 42-74)
Lamelo Dosunmu drives to the basket... Lamelo Dosunmu throws a bad pass! Stolen by Gary Brogdon! TURNOVER! (live ball)

[09:52] Team_090 possession (Score: 42-74)
Tracy Adebayo attempts a 3Pt. Contested by Michael Ginobili (3.6 feet, ZONE). Tracy Adebayo misses. Rebound secured by Michael Ginobili.

[09:41] Team_022 possession (Score: 42-74)
Michael Ginobili drives, Larry Bridges stays with him. Michael Ginobili attempts a Layup. Contested by Larry Bridges (3.1 feet, MAN). Michael Ginobili misses. Rebound secured by Zach Wall.

[09:30] Team_090 possession (Score: 42-74)
FOUL! Offensive foul on Zach Wall! Myles Anthony drew the charge! [Team fouls: 2] (Zach Wall: 1 personal fouls) TURNOVER! (dead ball)

[09:18] Team_022 possession (Score: 42-74)
Myles Anthony attempts a 3Pt. Contested by Derrick Mitchell (4.0 feet, ZONE). Myles Anthony misses. Rebound secured by Zach Wall.

[09:04] Team_090 possession (Score: 42-74)
Tracy Adebayo drives and kicks out. Derrick Mitchell attempts a Midrange. Contested by Myles Anthony (3.2 feet, ZONE). Derrick Mitchell misses. Rebound secured by Dirk Markkanen.

[08:53] Team_022 possession (Score: 42-74)
Michael Ginobili attempts a 3Pt. Heavily contested by Derrick Mitchell (1.0 feet, ZONE)! MICHAEL GINOBILI MAKES IT! Assist: Myles Anthony
Score: 45-74

[08:38] Team_090 possession (Score: 45-74)
Derrick Mitchell attempts a 3Pt. Contested by Malcolm Allen (3.1 feet, MAN). Derrick Mitchell misses. Offensive rebound by Tracy Adebayo! Tracy Adebayo kicks it out.

[08:25] Team_090 possession (Score: 45-74)
FOUL! Reach-in foul on Myles Anthony during the drive. [Team fouls: 3] No free throws, side out. (Myles Anthony: 1 personal fouls)

[08:14] Team_090 possession (Score: 45-74)
Zach Wall drives to the basket... Zach Wall throws a bad pass! Stolen by Myles Anthony! TURNOVER! (live ball)

[07:55] Team_022 possession (Score: 45-74)
Dirk Markkanen attempts a Midrange. Wide open! Larry Bridges is 6.1 feet away. [ZONE] Dirk Markkanen misses. Rebound secured by Gary Brogdon.

[07:44] Team_090 possession (Score: 45-74)
Larry Bridges attempts a 3Pt. Contested by Michael Ginobili (2.8 feet, MAN). LARRY BRIDGES MAKES IT! Assist: Tracy Adebayo
Score: 45-77

[07:30] Team_022 possession (Score: 45-77)
Myles Anthony drives, Zach Wall stays with him. Myles Anthony attempts a Dunk. Wide open! Zach Wall is 8.2 feet away. [MAN] MYLES ANTHONY MAKES IT! Assist: Lamelo Dosunmu
Score: 47-77

[07:17] Team_090 possession (Score: 47-77)
Gary Brogdon attempts a 3Pt. Wide open! Lamelo Dosunmu is 7.8 feet away. [ZONE] Gary Brogdon misses. Offensive rebound by Tracy Adebayo! Tracy Adebayo kicks it out.

[07:02] Team_090 possession (Score: 47-77)
Larry Bridges attempts a Midrange. Contested by Lamelo Dosunmu (4.6 feet, ZONE). Larry Bridges misses. Offensive rebound by Tracy Adebayo! Tracy Adebayo kicks it out.

[06:52] Team_090 possession (Score: 47-77)
Derrick Mitchell attempts a Layup. Contested by Malcolm Allen (4.4 feet, MAN). Derrick Mitchell misses. Offensive rebound by Gary Brogdon! Gary Brogdon kicks it out.

[06:38] Team_090 possession (Score: 47-77)
Derrick Mitchell attempts a 3Pt. Contested by Malcolm Allen (5.9 feet, MAN). Derrick Mitchell misses. Rebound secured by Dirk Markkanen.

[06:22] Team_022 possession (Score: 47-77)
Michael Ginobili drives and kicks out. Myles Anthony attempts a 3Pt. Contested by Zach Wall (5.1 feet, MAN). Myles Anthony misses. FOUL! Loose ball foul on Tracy Adebayo during the rebound battle. [Team fouls: 3] No free throws, side out. (Tracy Adebayo: 1 personal fouls)

[06:06] Team_022 possession (Score: 47-77)
FOUL! Reach-in foul on Tracy Adebayo during the drive. [Team fouls: 4] No free throws, side out. (Tracy Adebayo: 2 personal fouls)

[05:51] Team_022 possession (Score: 47-77)
Lamelo Dosunmu attempts a Layup. BLOCKED BY LARRY BRIDGES! Ball is loose! Rebound secured by Gary Brogdon.

[05:37] Team_090 possession (Score: 47-77)
FOUL! Shooting foul on Michael Ginobili. Derrick Mitchell to the line for 3 free throws. [Team fouls: 4] (Michael Ginobili: 1 personal fouls)   FT 1/3: MISS   FT 2/3: GOOD   FT 3/3: GOOD Derrick Mitchell makes 2/3 from the line.
Score: 47-79

[05:25] Team_022 possession (Score: 47-79)
Michael Ginobili attempts a 3Pt. Contested by Larry Bridges (4.7 feet, MAN). Michael Ginobili misses. Rebound secured by Gary Brogdon.

[05:12] Team_090 possession (Score: 47-79)
Zach Wall attempts a Layup. BLOCKED BY DIRK MARKKANEN! Ball is loose! Rebound secured by Dirk Markkanen.

[04:57] Team_022 possession (Score: 47-79)
Malcolm Allen attempts a 3Pt. Contested by Derrick Mitchell (2.8 feet, MAN). Malcolm Allen misses. Rebound secured by Gary Brogdon.

[04:45] Team_090 possession (Score: 47-79)
Derrick Mitchell drives and kicks out. Tracy Adebayo attempts a 3Pt. Wide open! Dirk Markkanen is 7.8 feet away. [MAN] Tracy Adebayo misses. Rebound secured by Dirk Markkanen.

[04:30] Team_022 possession (Score: 47-79)
Dirk Markkanen attempts a Midrange. Wide open! Zach Wall is 8.3 feet away. [ZONE] Dirk Markkanen misses. Rebound secured by Gary Brogdon.

[04:16] Team_090 possession (Score: 47-79)
FOUL! Offensive foul on Zach Wall! Myles Anthony drew the charge! [Team fouls: 5] (Zach Wall: 2 personal fouls) TURNOVER! (dead ball)

[03:57] Team_022 possession (Score: 47-79)
Myles Anthony attempts a Midrange. Contested by Zach Wall (5.7 feet, MAN). MYLES ANTHONY MAKES IT!
Score: 49-79

[03:39] Team_090 possession (Score: 49-79)
Gary Brogdon attempts a Layup. Contested by Dirk Markkanen (2.6 feet, ZONE). GARY BROGDON MAKES IT!
Score: 49-81

[03:28] Team_022 possession (Score: 49-81)
Michael Ginobili throws a bad pass out of bounds! TURNOVER! (dead ball)

[03:28] Substitution (Team_022): Malcolm Allen OUT → DeMar Harden IN (stamina_rule2)

[03:28] Substitution (Team_022): Myles Anthony OUT → Dejounte Towns IN (stamina_rule2)

[03:28] Substitution (Team_022): Lamelo Dosunmu OUT → Kawhi Russell IN (stamina_rule2)

[03:28] Substitution (Team_022): Dirk Markkanen OUT → Cole Iverson IN (stamina_rule2)

[03:28] Substitution (Team_090): Gary Brogdon OUT → Derrick Nowitzki IN (stamina_rule2)

[03:28] Substitution (Team_090): Tracy Adebayo OUT → Tobias Tatum IN (stamina_rule2)

[03:16] Team_090 possession (Score: 49-81)
Tobias Tatum throws a bad pass! Stolen by Cole Iverson! TURNOVER! (live ball)

[03:00] Team_022 possession (Score: 49-81)
Michael Ginobili drives and kicks out. Dejounte Towns attempts a Midrange. Contested by Zach Wall (4.4 feet, MAN). DEJOUNTE TOWNS MAKES IT! Assist: DeMar Harden
Score: 51-81

[02:46] Team_090 possession (Score: 51-81)
Derrick Mitchell attempts a 3Pt. Heavily contested by Michael Ginobili (1.9 feet, ZONE)! Derrick Mitchell misses. Rebound secured by Dejounte Towns.

[02:34] Team_022 possession (Score: 51-81)
Michael Ginobili drives, Larry Bridges stays with him. Michael Ginobili attempts a Dunk. Contested by Larry Bridges (5.3 feet, MAN). Michael Ginobili misses. Rebound secured by Derrick Nowitzki.

[02:17] Team_090 possession (Score: 51-81)
Larry Bridges attempts a 3Pt. Contested by Michael Ginobili (5.4 feet, ZONE). LARRY BRIDGES MAKES IT! Assist: Derrick Nowitzki
Score: 51-84

[02:00] Team_022 possession (Score: 51-84)
FOUL! Shooting foul on Derrick Mitchell. DeMar Harden to the line for 2 free throws. [BONUS: 6 team fouls] (Derrick Mitchell: 1 personal fouls)   FT 1/2: GOOD   FT 2/2: GOOD DeMar Harden makes 2/2 from the line.
Score: 53-84

[01:48] Team_090 possession (Score: 53-84)
Larry Bridges attempts a 3Pt. Contested by Michael Ginobili (5.5 feet, ZONE). LARRY BRIDGES MAKES IT! Assist: Zach Wall
Score: 53-87

[01:33] Team_022 possession (Score: 53-87)
FOUL! Shooting foul on Tobias Tatum. Cole Iverson to the line for 2 free throws. [BONUS: 7 team fouls] (Tobias Tatum: 1 personal fouls)   FT 1/2: GOOD   FT 2/2: MISS Cole Iverson makes 1/2 from the line. Rebound secured by Zach Wall.
Score: 54-87

[01:19] Team_090 possession (Score: 54-87)
FOUL! Holding foul on Kawhi Russell. [IN THE BONUS! 5 team fouls] Derrick Nowitzki to the line for 2 free throws. (Kawhi Russell: 1 personal fouls)   FT 1/2: GOOD   FT 2/2: GOOD Derrick Nowitzki makes 2/2 from the line.
Score: 54-89

[01:03] Team_022 possession (Score: 54-89)
Cole Iverson drives, Tobias Tatum stays with him. Cole Iverson attempts a Dunk. Contested by Tobias Tatum (4.6 feet, MAN). Cole Iverson misses. Rebound secured by Tobias Tatum.

[00:47] Team_090 possession (Score: 54-89)
Derrick Nowitzki attempts a Layup. Wide open! Kawhi Russell is 6.8 feet away. [MAN] DERRICK NOWITZKI MAKES IT! Assist: Tobias Tatum
Score: 54-91

[00:31] Team_022 possession (Score: 54-91)
Michael Ginobili attempts a Layup. BLOCKED BY LARRY BRIDGES! Ball deflects out of bounds off Michael Ginobili.

[00:13] Team_090 possession (Score: 54-91)
Derrick Mitchell attempts a 3Pt. Contested by Dejounte Towns (5.3 feet, ZONE). Derrick Mitchell misses. Rebound secured by Kawhi Russell.

================================================================================
                              3RD QUARTER COMPLETE                              
================================================================================

3RD QUARTER SCORE: Team_022 14, Team_090 22

BOX SCORE:
================================================================================

Team_022
--------------------------------------------------------------------------------
Player                MIN  PTS  REB  AST  TO      FG   FG%      3P   3P%
--------------------------------------------------------------------------------
Myles Anthony          31    4    1    1   0   2/5    40.0     0/0   0.0
Michael Ginobili       34    3    1    0   0   1/5    20.0     0/0   0.0
Lamelo Dosunmu         31    2    0    1   0   1/2    50.0     0/0   0.0
Dejounte Towns          5    2    1    0   0   1/1   100.0     0/0   0.0
DeMar Harden            5    2    0    1   0   1/1   100.0     0/0   0.0
Dirk Markkanen         31    0    5    1   0   0/2     0.0     0/0   0.0
Malcolm Allen          31    0    0    0   0   0/1     0.0     0/0   0.0
Cole Iverson            5    0    0    0   0   0/2     0.0     0/0   0.0
Kawhi Russell           5    0    1    0   0   0/0     0.0     0/0   0.0

TEAM: FG: 6/19 (31.6%), 3PT: 1/6 (16.7%), REB: 9 (1 off, 8 def), AST: 4, TO: 2
TEAM FOULS: 5 [Team_090 in BONUS]


Team_090
--------------------------------------------------------------------------------
Player                MIN  PTS  REB  AST  TO      FG   FG%      3P   3P%
--------------------------------------------------------------------------------
Larry Bridges          34    9    0    0   0   3/3   100.0     0/0   0.0
Derrick Mitchell       34    4    0    0   0   2/7    28.6     0/0   0.0
Derrick Nowitzki        5    4    1    1   0   2/2   100.0     0/0   0.0
Zach Wall              34    3    3    1   0   1/2    50.0     0/0   0.0
Gary Brogdon           31    2    8    0   0   1/1   100.0     0/0   0.0
Tracy Adebayo          31    0    5    1   0   0/2     0.0     0/0   0.0
Tobias Tatum            5    0    1    1   0   0/0     0.0     0/0   0.0

TEAM: FG: 9/17 (52.9%), 3PT: 4/8 (50.0%), REB: 18 (6 off, 12 def), AST: 4, TO: 4
TEAM FOULS: 7 [Team_022 in BONUS]

================================================================================

================================================================================
                       4TH QUARTER - Team_022 vs Team_090                       
================================================================================

[12:00] Substitution (Team_022): Malcolm Allen OUT (stamina: 81) → DeMar Harden IN (comeback_detected)

[12:00] Substitution (Team_090): Derrick Mitchell OUT (stamina: 71) → OG Anunoby IN (comeback_detected)

[12:00] Team_022 possession (Score: 54-91)
DeMar Harden loses the ball! Stripped by OG Anunoby! TURNOVER! (live ball)

[11:40] Team_090 possession (Score: 54-91)
OG Anunoby attempts a 3Pt. Contested by DeMar Harden (5.7 feet, MAN). OG Anunoby misses. Rebound secured by Dirk Markkanen.

[11:24] Team_022 possession (Score: 54-91)
Lamelo Dosunmu drives and kicks out. Dirk Markkanen attempts a 3Pt. Contested by Tracy Adebayo (5.4 feet, MAN). Dirk Markkanen misses. Rebound secured by Tracy Adebayo.

[11:06] Team_090 possession (Score: 54-91)
Larry Bridges drives to the basket... Larry Bridges loses the ball! Stripped by Michael Ginobili! TURNOVER! (live ball)

[10:53] Team_022 possession (Score: 54-91)
FOUL! Shooting foul on Zach Wall. Myles Anthony to the line for 3 free throws. [Team fouls: 1] (Zach Wall: 1 personal fouls)   FT 1/3: GOOD   FT 2/3: GOOD   FT 3/3: GOOD Myles Anthony makes 3/3 from the line.
Score: 57-91

[10:39] Team_090 possession (Score: 57-91)
OG Anunoby attempts a 3Pt. Contested by Michael Ginobili (2.1 feet, ZONE). OG Anunoby misses. Offensive rebound by Gary Brogdon! Gary Brogdon kicks it out.

[10:25] Team_090 possession (Score: 57-91)
FOUL! Shooting foul on DeMar Harden. Tracy Adebayo to the line for 2 free throws. [Team fouls: 1] (DeMar Harden: 1 personal fouls)   FT 1/2: GOOD   FT 2/2: GOOD Tracy Adebayo makes 2/2 from the line.
Score: 57-93

[10:13] Team_022 possession (Score: 57-93)
DeMar Harden attempts a Midrange. Contested by OG Anunoby (4.4 feet, MAN). DeMar Harden misses. Rebound secured by Gary Brogdon.

[09:58] Team_090 possession (Score: 57-93)
Zach Wall attempts a Midrange. Contested by Myles Anthony (5.9 feet, MAN). Zach Wall misses. Rebound secured by Dirk Markkanen.

[09:45] Team_022 possession (Score: 57-93)
Lamelo Dosunmu attempts a Layup. Contested by Gary Brogdon (3.5 feet, ZONE). LAMELO DOSUNMU MAKES IT! Assist: Michael Ginobili
Score: 59-93

[09:32] Team_090 possession (Score: 59-93)
OG Anunoby attempts a Midrange. Wide open! DeMar Harden is 8.8 feet away. [MAN] OG Anunoby misses. Offensive rebound by Gary Brogdon! Gary Brogdon kicks it out.

[09:17] Team_090 possession (Score: 59-93)
FOUL! Shooting foul on Dirk Markkanen. Larry Bridges to the line for 2 free throws. [Team fouls: 2] (Dirk Markkanen: 1 personal fouls)   FT 1/2: MISS   FT 2/2: GOOD Larry Bridges makes 1/2 from the line.
Score: 59-94

[09:05] Team_022 possession (Score: 59-94)
Dirk Markkanen attempts a Midrange. Contested by Larry Bridges (5.4 feet, ZONE). DIRK MARKKANEN MAKES IT! Assist: DeMar Harden
Score: 61-94

[08:53] Team_090 possession (Score: 61-94)
Zach Wall attempts a Layup. Contested by Myles Anthony (4.4 feet, MAN). ZACH WALL MAKES IT! Assist: Larry Bridges
Score: 61-96

[08:42] Team_022 possession (Score: 61-96)
Myles Anthony throws a bad pass out of bounds! TURNOVER! (dead ball)

[08:42] Substitution (Team_022): Michael Ginobili OUT → Lauri Gobert IN (stamina_rule2)

[08:42] Substitution (Team_022): Myles Anthony OUT → Dejounte Towns IN (stamina_rule2)

[08:42] Substitution (Team_022): Lamelo Dosunmu OUT → Kawhi Russell IN (stamina_rule2)

[08:42] Substitution (Team_022): Dirk Markkanen OUT → Cole Iverson IN (stamina_rule2)

[08:42] Substitution (Team_090): Larry Bridges OUT → Josh Wall IN (stamina_rule2)

[08:42] Substitution (Team_090): Zach Wall OUT → Russell Smith IN (stamina_rule2)

[08:42] Substitution (Team_090): Gary Brogdon OUT → Derrick Nowitzki IN (stamina_rule2)

[08:42] Substitution (Team_090): Tracy Adebayo OUT → Tobias Tatum IN (stamina_rule2)

[08:26] Team_090 possession (Score: 61-96)
Josh Wall attempts a Midrange. Wide open! Lauri Gobert is 6.8 feet away. [MAN] JOSH WALL MAKES IT! Assist: Russell Smith
Score: 61-98

[08:15] Team_022 possession (Score: 61-98)
DeMar Harden attempts a 3Pt. Contested by OG Anunoby (3.3 feet, MAN). DeMar Harden misses. Rebound secured by Tobias Tatum.

[08:02] Team_090 possession (Score: 61-98)
Josh Wall attempts a 3Pt. Wide open! Kawhi Russell is 7.8 feet away. [ZONE] Josh Wall misses. Offensive rebound by Tobias Tatum! Tobias Tatum kicks it out.

[07:49] Team_090 possession (Score: 61-98)
Derrick Nowitzki throws a bad pass! Stolen by Kawhi Russell! TURNOVER! (live ball)

[07:36] Team_022 possession (Score: 61-98)
Kawhi Russell attempts a Layup. Contested by Derrick Nowitzki (2.3 feet, MAN). Kawhi Russell misses. Rebound secured by Derrick Nowitzki.

[07:22] Team_090 possession (Score: 61-98)
Derrick Nowitzki attempts a Layup. BLOCKED BY KAWHI RUSSELL! Ball deflects out of bounds off Derrick Nowitzki.

[07:07] Team_022 possession (Score: 61-98)
Dejounte Towns attempts a 3Pt. Contested by Russell Smith (2.1 feet, MAN). DEJOUNTE TOWNS MAKES IT! Assist: Kawhi Russell
Score: 64-98

[06:51] Team_090 possession (Score: 64-98)
Tobias Tatum attempts a Layup. Contested by Cole Iverson (4.7 feet, MAN). Tobias Tatum misses. Rebound secured by Dejounte Towns.

[06:36] Team_022 possession (Score: 64-98)
FOUL! Shooting foul on Josh Wall. Lauri Gobert to the line for 2 free throws. [Team fouls: 2] (Josh Wall: 1 personal fouls)   FT 1/2: GOOD   FT 2/2: GOOD Lauri Gobert makes 2/2 from the line.
Score: 66-98

[06:19] Team_090 possession (Score: 66-98)
OG Anunoby attempts a 3Pt. Contested by Kawhi Russell (3.0 feet, ZONE). OG Anunoby misses. Rebound secured by Kawhi Russell.

[06:07] Team_022 possession (Score: 66-98)
FOUL! Holding foul on Tobias Tatum. [Team fouls: 3] No free throws, side out. (Tobias Tatum: 1 personal fouls)

[05:50] Team_022 possession (Score: 66-98)
Cole Iverson attempts a 3Pt. Wide open! Russell Smith is 7.3 feet away. [ZONE] Cole Iverson misses. Rebound secured by Tobias Tatum.

[05:37] Team_090 possession (Score: 66-98)
Derrick Nowitzki drives to the basket... FOUL! Offensive foul on Derrick Nowitzki! Kawhi Russell drew the charge! [Team fouls: 4] (Derrick Nowitzki: 1 personal fouls) TURNOVER! (dead ball)

[05:20] Team_022 possession (Score: 66-98)
Dejounte Towns attempts a 3Pt. Contested by Russell Smith (4.5 feet, MAN). Dejounte Towns misses. Rebound secured by Tobias Tatum.

[05:08] Team_090 possession (Score: 66-98)
Josh Wall attempts a 3Pt. Contested by Dejounte Towns (4.0 feet, ZONE). JOSH WALL MAKES IT! Assist: Tobias Tatum
Score: 66-101

[04:55] Team_022 possession (Score: 66-101)
Cole Iverson drives and kicks out. Lauri Gobert attempts a Midrange. Wide open! Josh Wall is 6.7 feet away. [MAN] Lauri Gobert misses. Rebound secured by Tobias Tatum.

[04:37] Team_090 possession (Score: 66-101)
OG Anunoby attempts a Layup. Wide open! DeMar Harden is 6.9 feet away. [MAN] OG ANUNOBY MAKES IT!
Score: 66-103

[04:26] Team_022 possession (Score: 66-103)
FOUL! Offensive foul on Kawhi Russell! Derrick Nowitzki drew the charge! [Team fouls: 3] (Kawhi Russell: 1 personal fouls) TURNOVER! (dead ball)

[04:15] Team_090 possession (Score: 66-103)
Russell Smith attempts a 3Pt. Heavily contested by Kawhi Russell (1.4 feet, ZONE)! Russell Smith misses. Rebound secured by Kawhi Russell.

[04:03] Team_022 possession (Score: 66-103)
Lauri Gobert attempts a 3Pt. Contested by Russell Smith (3.0 feet, ZONE). Lauri Gobert misses. Rebound secured by Tobias Tatum.

[03:49] Team_090 possession (Score: 66-103)
FOUL! Shooting foul on Lauri Gobert. Josh Wall to the line for 2 free throws. [Team fouls: 4] (Lauri Gobert: 1 personal fouls)   FT 1/2: MISS   FT 2/2: GOOD Josh Wall makes 1/2 from the line.
Score: 66-104

[03:31] Team_022 possession (Score: 66-104)
Cole Iverson drives to the basket... Cole Iverson throws a bad pass! Stolen by Tobias Tatum! TURNOVER! (live ball)

[03:13] Team_090 possession (Score: 66-104)
Derrick Nowitzki makes the Layup and draws the foul on Kawhi Russell! And-1! Derrick Nowitzki to the line for 1. [BONUS: 5 team fouls] (Kawhi Russell: 2 personal fouls)   FT 1/1: MISS Derrick Nowitzki makes 0/1 from the line. Rebound secured by Dejounte Towns.
Score: 66-106

[02:58] Team_022 possession (Score: 66-106)
Dejounte Towns attempts a 3Pt. Heavily contested by OG Anunoby (1.9 feet, ZONE)! Dejounte Towns misses. Rebound secured by Derrick Nowitzki.

[02:41] Team_090 possession (Score: 66-106)
Russell Smith attempts a 3Pt. Contested by Dejounte Towns (5.4 feet, MAN). Russell Smith misses. Rebound secured by Lauri Gobert.

[02:30] Team_022 possession (Score: 66-106)
FOUL! Reach-in foul on Josh Wall during the drive. [IN THE BONUS! 5 team fouls] Lauri Gobert to the line for 2 free throws. (Josh Wall: 2 personal fouls)   FT 1/2: GOOD   FT 2/2: GOOD Lauri Gobert makes 2/2 from the line.
Score: 68-106

[02:14] Team_090 possession (Score: 68-106)
OG Anunoby attempts a 3Pt. Heavily contested by Kawhi Russell (1.2 feet, ZONE)! OG Anunoby misses. Rebound secured by Lauri Gobert.

[01:57] Team_022 possession (Score: 68-106)
Kawhi Russell attempts a 3Pt. Contested by Derrick Nowitzki (2.5 feet, MAN). Kawhi Russell misses. Rebound secured by Russell Smith.

[01:38] Team_090 possession (Score: 68-106)
OG Anunoby makes the 3Pt and draws the foul on Kawhi Russell! And-1! OG Anunoby to the line for 1. [BONUS: 6 team fouls] (Kawhi Russell: 3 personal fouls)   FT 1/1: GOOD OG Anunoby makes 1/1 from the line.
Score: 68-110

[01:27] Team_022 possession (Score: 68-110)
Kawhi Russell drives, Derrick Nowitzki stays with him. Kawhi Russell attempts a Dunk. Heavily contested by Derrick Nowitzki (1.0 feet, ZONE)! KAWHI RUSSELL MAKES IT!
Score: 70-110

[01:08] Team_090 possession (Score: 70-110)
Tobias Tatum drives and kicks out. OG Anunoby attempts a Midrange. Contested by DeMar Harden (3.7 feet, MAN). OG ANUNOBY MAKES IT!
Score: 70-112

[00:52] Team_022 possession (Score: 70-112)
Dejounte Towns attempts a 3Pt. Contested by Russell Smith (5.2 feet, MAN). Dejounte Towns misses. Rebound secured by Derrick Nowitzki.

[00:39] Team_090 possession (Score: 70-112)
Tobias Tatum attempts a Midrange. Contested by Cole Iverson (5.4 feet, MAN). Tobias Tatum misses. Offensive rebound by Russell Smith! Russell Smith kicks it out.

[00:27] Team_090 possession (Score: 70-112)
Russell Smith attempts a Midrange. Contested by Dejounte Towns (3.5 feet, MAN). Russell Smith misses. Offensive rebound by Russell Smith! Russell Smith kicks it out.

[00:11] Team_090 possession (Score: 70-112)
Tobias Tatum attempts a 3Pt. Contested by Kawhi Russell (4.7 feet, ZONE). Tobias Tatum misses. Rebound secured by Lauri Gobert.

================================================================================
                              4TH QUARTER COMPLETE                              
================================================================================

4TH QUARTER SCORE: Team_022 16, Team_090 21

BOX SCORE:
================================================================================

Team_022
--------------------------------------------------------------------------------
Player                MIN  PTS  REB  AST  TO      FG   FG%      3P   3P%
--------------------------------------------------------------------------------
Lauri Gobert           10    4    3    0   0   2/3    66.7     0/0   0.0
Myles Anthony          35    3    0    0   0   1/1   100.0     0/0   0.0
Dejounte Towns         14    3    2    0   0   1/4    25.0     0/0   0.0
Dirk Markkanen         35    2    2    0   0   1/1   100.0     0/0   0.0
Lamelo Dosunmu         35    2    0    0   0   1/2    50.0     0/0   0.0
Kawhi Russell          14    2    2    1   0   1/3    33.3     0/0   0.0
DeMar Harden           17    0    0    1   0   0/2     0.0     0/0   0.0
Michael Ginobili       38    0    0    1   0   0/0     0.0     0/0   0.0
Cole Iverson           14    0    0    0   0   0/2     0.0     0/0   0.0

TEAM: FG: 7/18 (38.9%), 3PT: 2/9 (22.2%), REB: 9 (0 off, 9 def), AST: 3, TO: 4
TEAM FOULS: 6 [Team_090 in BONUS]


Team_090
--------------------------------------------------------------------------------
Player                MIN  PTS  REB  AST  TO      FG   FG%      3P   3P%
--------------------------------------------------------------------------------
OG Anunoby             14    8    0    0   0   3/6    50.0     0/0   0.0
Josh Wall              10    6    0    0   0   3/3   100.0     0/0   0.0
Tracy Adebayo          35    2    1    0   0   1/1   100.0     0/0   0.0
Zach Wall              38    2    0    0   0   1/2    50.0     0/0   0.0
Larry Bridges          38    1    0    1   0   1/1   100.0     0/0   0.0
Gary Brogdon           35    0    3    0   0   0/0     0.0     0/0   0.0
Russell Smith          10    0    3    1   0   0/2     0.0     0/0   0.0
Tobias Tatum           14    0    6    1   0   0/2     0.0     0/0   0.0
Derrick Nowitzki       14    0    3    0   0   0/2     0.0     0/0   0.0

TEAM: FG: 9/19 (47.4%), 3PT: 2/8 (25.0%), REB: 16 (5 off, 11 def), AST: 3, TO: 3
TEAM FOULS: 5 [Team_022 in BONUS]

================================================================================

================================================================================
                               FULL GAME COMPLETE                               
================================================================================

FINAL SCORE: Team_022 70, Team_090 112

SCORING BY QUARTER:
--------------------------------------------------------------------------------
Team                     Q1     Q2     Q3     Q4    FINAL
--------------------------------------------------------------------------------
Team_022                 22     18     14     16       70
Team_090                 34     35     22     21      112
--------------------------------------------------------------------------------

FULL GAME BOX SCORE:
================================================================================

Team_022
--------------------------------------------------------------------------------
Player                MIN  PTS  REB  AST  TO      FG   FG%      3P   3P%      FT STL BLK
--------------------------------------------------------------------------------
Michael Ginobili       38   18    9    3   3   7/17   41.2   4/10   40.0   2/3     1   1
Myles Anthony          35    9    5    1   2   4/11   36.4   1/6    16.7   5/6     1   0
Lamelo Dosunmu         35    8    0    3   0   4/10   40.0   0/2     0.0   0/0     0   0
Dirk Markkanen         35   11   11    1   3   5/10   50.0   1/1   100.0   5/5     1   1
Malcolm Allen          31    6    0    3   1   2/4    50.0   0/2     0.0   2/2     0   0
DeMar Harden           17    2    0    2   1   1/4    25.0   0/2     0.0   2/2     0   0
Dejounte Towns         14    5    3    0   0   1/5    20.0   1/4    25.0   0/0     0   0
Kawhi Russell          14    2    4    1   2   1/3    33.3   0/1     0.0   0/0     1   1
Cole Iverson           14    2    0    0   0   1/5    20.0   0/1     0.0   1/2     1   0
Lauri Gobert           10    4    3    0   0   2/3    66.7   0/1     0.0   4/4     0   0

TEAM: FG: 28/72 (38.9%), 3PT: 7/30 (23.3%), REB: 36 (8 off, 28 def), AST: 14, TO: 12


Team_090
--------------------------------------------------------------------------------
Player                MIN  PTS  REB  AST  TO      FG   FG%      3P   3P%      FT STL BLK
--------------------------------------------------------------------------------
Larry Bridges          38   18    1    4   0   7/9    77.8   5/6    83.3   1/2     0   3
Zach Wall              38   17    9    2   3   7/12   58.3   0/3     0.0   3/3     0   0
Gary Brogdon           35   22   17    3   1  10/12   83.3   2/3    66.7   5/5     1   1
Tracy Adebayo          35   15   18    4   1   7/10   70.0   0/1     0.0   5/5     1   0
Derrick Mitchell       34   13    0    1   0   4/11   36.4   3/6    50.0   5/7     1   1
OG Anunoby             14   11    0    0   0   3/6    50.0   2/5    40.0   1/1     1   0
Derrick Nowitzki       14    4    4    2   2   1/4    25.0   0/0     0.0   2/3     0   0
Tobias Tatum           14    0   10    2   1   1/3    33.3   0/1     0.0   0/0     1   0
Josh Wall              10    6    0    0   0   3/3   100.0   1/1   100.0   1/2     0   0
Russell Smith          10    3    3    1   0   1/3    33.3   0/2     0.0   1/1     0   0

TEAM: FG: 45/74 (60.8%), 3PT: 13/28 (46.4%), REB: 61 (20 off, 41 def), AST: 19, TO: 8

================================================================================
