================================================================================
                        FULL GAME - Team_078 vs Team_037                        
================================================================================

================================================================================
                       1ST QUARTER - Team_078 vs Team_037                       
================================================================================

[12:00] Team_078 possession (Score: 0-0)
Jabari Barnes attempts a 3Pt. Contested by RJ Mitchell (2.6 feet, MAN). JABARI BARNES MAKES IT! Assist: Ben Ginobili
Score: 3-0

[11:45] Team_037 possession (Score: 3-0)
Scottie Jackson attempts a Midrange. Contested by Ben Ginobili (3.4 feet, MAN). Scottie Jackson misses. Rebound secured by Isaiah Simmons.

[11:31] Team_078 possession (Score: 3-0)
Isaiah Simmons attempts a 3Pt. Contested by Scottie Jackson (5.3 feet, ZONE). Isaiah Simmons misses. Rebound secured by Scottie Jackson.

[11:18] Team_037 possession (Score: 3-0)
Scottie Jackson drives and kicks out. Collin Young attempts a Midrange. Wide open! Jabari Barrett is 6.2 feet away. [MAN] COLLIN YOUNG MAKES IT!
Score: 3-2

[11:04] Team_078 possession (Score: 3-2)
Ben Ginobili attempts a Midrange. Contested by Scottie Jackson (4.7 feet, MAN). Ben Ginobili misses. Rebound secured by Collin Young.

[10:45] Team_037 possession (Score: 3-2)
RJ Mitchell attempts a Midrange. Contested by Jabari Barnes (5.5 feet, MAN). RJ MITCHELL MAKES IT!
Score: 3-4

[10:32] Team_078 possession (Score: 3-4)
Isaiah Simmons attempts a 3Pt. Contested by Scottie Jackson (3.9 feet, ZONE). Isaiah Simmons misses. Rebound secured by Collin Young.

[10:14] Team_037 possession (Score: 3-4)
Collin Young drives, Jabari Barrett stays with him. Collin Young attempts a Dunk. Contested by Jabari Barrett (2.7 feet, ZONE). Collin Young misses. Rebound secured by Isaiah Simmons.

[09:57] Team_078 possession (Score: 3-4)
Jabari Barnes attempts a Midrange. Contested by Giannis Middleton (3.6 feet, ZONE). Jabari Barnes misses. Rebound secured by Scottie Jackson.

[09:37] Team_037 possession (Score: 3-4)
Collin Young attempts a Layup. Contested by Jabari Barrett (4.0 feet, MAN). COLLIN YOUNG MAKES IT! Assist: Scottie Jackson
Score: 3-6

[09:21] Team_078 possession (Score: 3-6)
Jabari Barrett makes the Midrange and draws the foul on Giannis Middleton! And-1! Jabari Barrett to the line for 1. [Team fouls: 1] (Giannis Middleton: 1 personal fouls)   FT 1/1: GOOD Jabari Barrett makes 1/1 from the line.
Score: 6-6

[09:02] Team_037 possession (Score: 6-6)
RJ Mitchell attempts a 3Pt. Wide open! Isaiah Simmons is 6.5 feet away. [ZONE] RJ Mitchell misses. Offensive rebound by Scottie Jackson! Scottie Jackson puts it back in!
Score: 6-8

[08:52] Team_078 possession (Score: 6-8)
Jabari Barnes drives and kicks out. Jabari Barnes attempts a Midrange. Contested by RJ Mitchell (3.6 feet, MAN). JABARI BARNES MAKES IT!
Score: 8-8

[08:35] Team_037 possession (Score: 8-8)
Scottie Jackson drives, picks up Jabari Barrett. Help arrives from Kyrie Carter! Scottie Jackson attempts a Dunk. Wide open! Kyrie Carter is 7.6 feet away. [ZONE] SCOTTIE JACKSON MAKES IT! Assist: Jarrett Tatum
Score: 8-10

[08:17] Team_078 possession (Score: 8-10)
Jabari Barrett drives, Collin Young stays with him. Jabari Barrett attempts a Dunk. Contested by Collin Young (5.5 feet, MAN). JABARI BARRETT MAKES IT! Assist: Kyrie Carter
Score: 10-10

[08:06] Team_037 possession (Score: 10-10)
Jarrett Tatum attempts a 3Pt. Heavily contested by Isaiah Simmons (0.5 feet, MAN)! JARRETT TATUM MAKES IT! Assist: Giannis Middleton
Score: 10-13

[07:49] Team_078 possession (Score: 10-13)
Jabari Barnes drives, Scottie Jackson stays with him. Jabari Barnes attempts a Layup. Contested by Scottie Jackson (3.6 feet, ZONE). Jabari Barnes misses. Rebound secured by Scottie Jackson.

[07:34] Team_037 possession (Score: 10-13)
FOUL! Reach-in foul on Jabari Barrett during the drive. [Team fouls: 1] No free throws, side out. (Jabari Barrett: 1 personal fouls)

[07:21] Team_037 possession (Score: 10-13)
Giannis Middleton drives, picks up Kyrie Carter. Help arrives from Isaiah Simmons! Giannis Middleton attempts a Layup. Contested by Isaiah Simmons (3.8 feet, MAN). Giannis Middleton misses. Rebound secured by Jabari Barrett.

[07:11] Team_078 possession (Score: 10-13)
Kyrie Carter attempts a Layup. Wide open! Scottie Jackson is 6.5 feet away. [ZONE] KYRIE CARTER MAKES IT! Assist: Ben Ginobili
Score: 12-13

[07:00] Team_037 possession (Score: 12-13)
Collin Young drives and kicks out. Giannis Middleton attempts a 3Pt. Contested by Isaiah Simmons (5.9 feet, ZONE). Giannis Middleton misses. Rebound secured by Isaiah Simmons.

[06:47] Team_078 possession (Score: 12-13)
Jabari Barrett attempts a 3Pt. Contested by Collin Young (2.9 feet, MAN). Jabari Barrett misses. Offensive rebound by Jabari Barrett! Jabari Barrett kicks it out.

[06:32] Team_078 possession (Score: 12-13)
Jabari Barrett drives and kicks out. Kyrie Carter attempts a 3Pt. Contested by Scottie Jackson (4.4 feet, ZONE). Kyrie Carter misses. Rebound secured by Jarrett Tatum.

[06:21] Team_037 possession (Score: 12-13)
RJ Mitchell attempts a 3Pt. Contested by Isaiah Simmons (3.8 feet, ZONE). RJ Mitchell misses. Rebound secured by Jabari Barrett.

[06:04] Team_078 possession (Score: 12-13)
Kyrie Carter attempts a 3Pt. Heavily contested by Giannis Middleton (0.5 feet, MAN)! KYRIE CARTER MAKES IT! Assist: Jabari Barrett
Score: 15-13

[05:53] Team_037 possession (Score: 15-13)
Collin Young throws a bad pass! Stolen by Jabari Barrett! TURNOVER! (live ball)

[05:38] Team_078 possession (Score: 15-13)
Isaiah Simmons makes the Layup and draws the foul on Jarrett Tatum! And-1! Isaiah Simmons to the line for 1. [Team fouls: 2] (Jarrett Tatum: 1 personal fouls)   FT 1/1: GOOD Isaiah Simmons makes 1/1 from the line.
Score: 18-13

[05:26] Team_037 possession (Score: 18-13)
Giannis Middleton makes the Dunk and draws the foul on Isaiah Simmons! And-1! Giannis Middleton to the line for 1. [Team fouls: 2] (Isaiah Simmons: 1 personal fouls)   FT 1/1: GOOD Giannis Middleton makes 1/1 from the line.
Score: 18-16

[05:13] Team_078 possession (Score: 18-16)
Isaiah Simmons drives and kicks out. Jabari Barnes attempts a Midrange. Heavily contested by Scottie Jackson (1.7 feet, ZONE)! Jabari Barnes misses. Rebound secured by Scottie Jackson.

[04:57] Team_037 possession (Score: 18-16)
Scottie Jackson attempts a 3Pt. Contested by Ben Ginobili (5.9 feet, MAN). SCOTTIE JACKSON MAKES IT!
Score: 18-19

[04:41] Team_078 possession (Score: 18-19)
Jabari Barrett attempts a Midrange. Heavily contested by Collin Young (0.5 feet, MAN)! JABARI BARRETT MAKES IT! Assist: Jabari Barnes
Score: 20-19

[04:23] Team_037 possession (Score: 20-19)
Jarrett Tatum drives, picks up Jabari Barrett. Help arrives from Kyrie Carter! Jarrett Tatum attempts a Layup. Contested by Kyrie Carter (4.7 feet, ZONE). JARRETT TATUM MAKES IT!
Score: 20-21

[04:10] Team_078 possession (Score: 20-21)
Jabari Barrett drives, picks up Scottie Jackson. Help arrives from Giannis Middleton! Jabari Barrett attempts a Dunk. Wide open! Giannis Middleton is 6.4 feet away. [ZONE] Jabari Barrett misses. Rebound secured by Jarrett Tatum.

[03:56] Team_037 possession (Score: 20-21)
Scottie Jackson drives, Jabari Barrett stays with him. Scottie Jackson attempts a Dunk. Wide open! Jabari Barrett is 9.2 feet away. [ZONE] SCOTTIE JACKSON MAKES IT! Assist: Collin Young
Score: 20-23

[03:40] Team_078 possession (Score: 20-23)
Jabari Barnes attempts a 3Pt. Contested by Scottie Jackson (4.3 feet, ZONE). Jabari Barnes misses. Rebound secured by Scottie Jackson.

[03:24] Team_037 possession (Score: 20-23)
Scottie Jackson attempts a 3Pt. Contested by Isaiah Simmons (2.2 feet, ZONE). Scottie Jackson misses. Offensive rebound by Scottie Jackson! Scottie Jackson's putback is no good. Rebound secured by Isaiah Simmons.

[03:11] Team_078 possession (Score: 20-23)
Isaiah Simmons attempts a 3Pt. Contested by Jarrett Tatum (3.2 feet, MAN). Isaiah Simmons misses. Rebound secured by Scottie Jackson.

[02:54] Team_037 possession (Score: 20-23)
Scottie Jackson attempts a 3Pt. Contested by Isaiah Simmons (3.4 feet, ZONE). SCOTTIE JACKSON MAKES IT! Assist: Giannis Middleton
Score: 20-26

[02:37] Team_078 possession (Score: 20-26)
Jabari Barrett drives to the basket... Jabari Barrett loses the ball! Stripped by Collin Young! TURNOVER! (live ball)

[02:23] Team_037 possession (Score: 20-26)
Giannis Middleton attempts a Midrange. Contested by Ben Ginobili (4.9 feet, ZONE). Giannis Middleton misses. Offensive rebound by Scottie Jackson! Scottie Jackson's putback is no good. Rebound secured by Isaiah Simmons.

[02:10] Team_078 possession (Score: 20-26)
FOUL! Shooting foul on Giannis Middleton. Ben Ginobili to the line for 2 free throws. [Team fouls: 3] (Giannis Middleton: 2 personal fouls)   FT 1/2: GOOD   FT 2/2: GOOD Ben Ginobili makes 2/2 from the line.
Score: 22-26

[01:58] Team_037 possession (Score: 22-26)
Collin Young drives, Jabari Barrett stays with him. Collin Young attempts a Layup. Heavily contested by Jabari Barrett (1.5 feet, MAN)! COLLIN YOUNG MAKES IT! Assist: Jarrett Tatum
Score: 22-28

[01:42] Team_078 possession (Score: 22-28)
Jabari Barrett attempts a 3Pt. Wide open! Collin Young is 8.5 feet away. [MAN] JABARI BARRETT MAKES IT! Assist: Kyrie Carter
Score: 25-28

[01:29] Team_037 possession (Score: 25-28)
Jarrett Tatum attempts a 3Pt. Contested by Isaiah Simmons (2.8 feet, ZONE). JARRETT TATUM MAKES IT! Assist: Giannis Middleton
Score: 25-31

[01:13] Team_078 possession (Score: 25-31)
Isaiah Simmons attempts a 3Pt. Contested by Scottie Jackson (4.2 feet, ZONE). Isaiah Simmons misses. Rebound secured by Collin Young.

[01:00] Team_037 possession (Score: 25-31)
Collin Young drives and kicks out. RJ Mitchell attempts a 3Pt. Wide open! Isaiah Simmons is 7.8 feet away. [ZONE] RJ MITCHELL MAKES IT! Assist: Collin Young
Score: 25-34

[00:46] Team_078 possession (Score: 25-34)
Jabari Barnes drives to the basket... Jabari Barnes loses control! Ball rolls out of bounds! TURNOVER! (dead ball)

[00:46] Substitution (Team_078): Jabari Barnes OUT → Magic Barrett IN (stamina_rule2)

[00:46] Substitution (Team_078): Kyrie Carter OUT → Damian Allen IN (stamina_rule2)

[00:46] Substitution (Team_078): Isaiah Simmons OUT → Malcolm Randle IN (stamina_rule2)

[00:46] Substitution (Team_078): Ben Ginobili OUT → Paul Ming IN (stamina_rule2)

[00:46] Substitution (Team_078): Jabari Barrett OUT → Draymond Irving IN (stamina_rule2)

[00:46] Substitution (Team_037): RJ Mitchell OUT → Jarrett Randle IN (stamina_rule2)

[00:46] Substitution (Team_037): Giannis Middleton OUT → Collin Trent IN (stamina_rule2)

[00:46] Substitution (Team_037): Jarrett Tatum OUT → Julius Bird IN (stamina_rule2)

[00:46] Substitution (Team_037): Scottie Jackson OUT → Russell Anthony IN (stamina_rule2)

[00:46] Substitution (Team_037): Collin Young OUT → Wendell Herro IN (stamina_rule2)

[00:32] Team_037 possession (Score: 25-34)
Julius Bird drives, Paul Ming stays with him. Julius Bird attempts a Dunk. Wide open! Paul Ming is 8.1 feet away. [ZONE] JULIUS BIRD MAKES IT! Assist: Jarrett Randle
Score: 25-36

[00:17] Team_078 possession (Score: 25-36)
Damian Allen attempts a Layup. Contested by Russell Anthony (3.2 feet, ZONE). DAMIAN ALLEN MAKES IT!
Score: 27-36

[00:05] Team_037 possession (Score: 27-36)
FOUL! Offensive foul on Wendell Herro! Draymond Irving drew the charge! [Team fouls: 4] (Wendell Herro: 1 personal fouls) TURNOVER! (dead ball)

================================================================================
                              1ST QUARTER COMPLETE                              
================================================================================

1ST QUARTER SCORE: Team_078 27, Team_037 36

BOX SCORE:
================================================================================

Team_078
--------------------------------------------------------------------------------
Player                MIN  PTS  REB  AST  TO      FG   FG%      3P   3P%
--------------------------------------------------------------------------------
Jabari Barrett         11   10    3    1   0   4/6    66.7     0/0   0.0
Jabari Barnes          11    5    0    1   0   2/5    40.0     0/0   0.0
Kyrie Carter           11    5    0    2   0   2/2   100.0     0/0   0.0
Isaiah Simmons         11    3    5    0   0   1/6    16.7     0/0   0.0
Ben Ginobili           11    2    0    2   0   1/2    50.0     0/0   0.0
Damian Allen            1    2    0    0   0   1/1   100.0     0/0   0.0

TEAM: FG: 11/22 (50.0%), 3PT: 3/8 (37.5%), REB: 6 (1 off, 5 def), AST: 6, TO: 2
TEAM FOULS: 2


Team_037
--------------------------------------------------------------------------------
Player                MIN  PTS  REB  AST  TO      FG   FG%      3P   3P%
--------------------------------------------------------------------------------
Scottie Jackson        11   12    7    1   0   5/7    71.4     0/0   0.0
Jarrett Tatum          11    8    2    2   0   3/3   100.0     0/0   0.0
Collin Young           11    6    3    2   0   3/5    60.0     0/0   0.0
RJ Mitchell            11    5    0    0   0   2/3    66.7     0/0   0.0
Giannis Middleton      11    3    0    3   0   1/3    33.3     0/0   0.0
Julius Bird             1    2    0    0   0   1/1   100.0     0/0   0.0
Jarrett Randle          1    0    0    1   0   0/0     0.0     0/0   0.0

TEAM: FG: 15/22 (68.2%), 3PT: 5/7 (71.4%), REB: 14 (3 off, 11 def), AST: 9, TO: 2
TEAM FOULS: 4

================================================================================

================================================================================
                       2ND QUARTER - Team_078 vs Team_037                       
================================================================================

[12:00] Team_078 possession (Score: 27-36)
Kyrie Carter drives, Giannis Middleton stays with him. Kyrie Carter attempts a Dunk. Wide open! Giannis Middleton is 6.3 feet away. [MAN] KYRIE CARTER MAKES IT! Assist: Ben Ginobili
Score: 29-36

[11:47] Team_037 possession (Score: 29-36)
Scottie Jackson attempts a Midrange. Contested by Ben Ginobili (4.5 feet, ZONE). SCOTTIE JACKSON MAKES IT!
Score: 29-38

[11:31] Team_078 possession (Score: 29-38)
Isaiah Simmons attempts a 3Pt. Heavily contested by Scottie Jackson (1.6 feet, ZONE)! Isaiah Simmons misses. Rebound secured by Jarrett Tatum.

[11:20] Team_037 possession (Score: 29-38)
FOUL! Shooting foul on Kyrie Carter. Collin Young to the line for 2 free throws. [Team fouls: 1] (Kyrie Carter: 1 personal fouls)   FT 1/2: GOOD   FT 2/2: MISS Collin Young makes 1/2 from the line. Rebound secured by Jabari Barrett.
Score: 29-39

[11:09] Team_078 possession (Score: 29-39)
Kyrie Carter attempts a 3Pt. Contested by Scottie Jackson (3.7 feet, ZONE). Kyrie Carter misses. Rebound secured by Jarrett Tatum.

[10:55] Team_037 possession (Score: 29-39)
Collin Young drives, Jabari Barrett stays with him. Collin Young attempts a Dunk. Wide open! Jabari Barrett is 8.6 feet away. [MAN] Collin Young misses. Offensive rebound by Scottie Jackson! Scottie Jackson's putback is no good. Rebound secured by Ben Ginobili.

[10:40] Team_078 possession (Score: 29-39)
FOUL! Shooting foul on Jarrett Tatum. Kyrie Carter to the line for 2 free throws. [Team fouls: 1] (Jarrett Tatum: 1 personal fouls)   FT 1/2: GOOD   FT 2/2: GOOD Kyrie Carter makes 2/2 from the line.
Score: 31-39

[10:28] Team_037 possession (Score: 31-39)
Scottie Jackson drives, picks up Ben Ginobili. Help arrives from Kyrie Carter! Scottie Jackson attempts a Dunk. Wide open! Kyrie Carter is 6.7 feet away. [MAN] SCOTTIE JACKSON MAKES IT!
Score: 31-41

[10:15] Team_078 possession (Score: 31-41)
Jabari Barnes drives to the basket... Jabari Barnes loses control! Ball rolls out of bounds! TURNOVER! (dead ball)

[10:15] Substitution (Team_078): Jabari Barnes OUT → Magic Barrett IN (stamina_rule2)

[10:15] Substitution (Team_078): Kyrie Carter OUT → Damian Allen IN (stamina_rule2)

[10:15] Substitution (Team_078): Isaiah Simmons OUT → Malcolm Randle IN (stamina_rule2)

[10:15] Substitution (Team_078): Ben Ginobili OUT → Paul Ming IN (stamina_rule2)

[10:15] Substitution (Team_078): Jabari Barrett OUT → Draymond Irving IN (stamina_rule2)

[10:15] Substitution (Team_037): RJ Mitchell OUT → Jarrett Randle IN (stamina_rule2)

[10:15] Substitution (Team_037): Giannis Middleton OUT → Collin Trent IN (stamina_rule2)

[10:15] Substitution (Team_037): Jarrett Tatum OUT → Julius Bird IN (stamina_rule2)

[10:15] Substitution (Team_037): Scottie Jackson OUT → Russell Anthony IN (stamina_rule2)

[10:15] Substitution (Team_037): Collin Young OUT → Wendell Herro IN (stamina_rule2)

[10:00] Team_037 possession (Score: 31-41)
Russell Anthony attempts a Layup. Contested by Paul Ming (6.0 feet, MAN). Russell Anthony misses. Offensive rebound by Russell Anthony! Russell Anthony's putback is no good. Offensive rebound by Julius Bird! Julius Bird kicks it out.

[09:43] Team_037 possession (Score: 31-41)
Jarrett Randle attempts a Midrange. Contested by Magic Barrett (5.9 feet, ZONE). Jarrett Randle misses. Rebound secured by Paul Ming.

[09:30] Team_078 possession (Score: 31-41)
Draymond Irving makes the Midrange and draws the foul on Russell Anthony! And-1! Draymond Irving to the line for 1. [Team fouls: 2] (Russell Anthony: 1 personal fouls)   FT 1/1: GOOD Draymond Irving makes 1/1 from the line.
Score: 34-41

[09:20] Team_037 possession (Score: 34-41)
Collin Trent drives and kicks out. Julius Bird attempts a 3Pt. Wide open! Malcolm Randle is 7.1 feet away. [MAN] Julius Bird misses. Rebound secured by Paul Ming.

[09:05] Team_078 possession (Score: 34-41)
Draymond Irving attempts a Midrange. Heavily contested by Russell Anthony (0.5 feet, MAN)! Draymond Irving misses. FOUL! Loose ball foul on Russell Anthony during the rebound battle. [Team fouls: 3] No free throws, side out. (Russell Anthony: 2 personal fouls)

[08:46] Team_078 possession (Score: 34-41)
FOUL! Reach-in foul on Russell Anthony during the drive. [Team fouls: 4] No free throws, side out. (Russell Anthony: 3 personal fouls)

[08:32] Team_078 possession (Score: 34-41)
Malcolm Randle attempts a 3Pt. Wide open! Jarrett Randle is 9.1 feet away. [ZONE] Malcolm Randle misses. Rebound secured by Wendell Herro.

[08:14] Team_037 possession (Score: 34-41)
Wendell Herro makes the Layup and draws the foul on Paul Ming! And-1! Wendell Herro to the line for 1. [Team fouls: 2] (Paul Ming: 1 personal fouls)   FT 1/1: GOOD Wendell Herro makes 1/1 from the line.
Score: 34-44

[07:59] Team_078 possession (Score: 34-44)
Draymond Irving drives, Russell Anthony stays with him. Draymond Irving attempts a Layup. Contested by Russell Anthony (3.5 feet, ZONE). Draymond Irving misses. Rebound secured by Julius Bird.

[07:43] Team_037 possession (Score: 34-44)
Jarrett Randle attempts a 3Pt. Contested by Magic Barrett (5.2 feet, MAN). Jarrett Randle misses. Rebound secured by Paul Ming.

[07:25] Team_078 possession (Score: 34-44)
Paul Ming drives and kicks out. Paul Ming attempts a 3Pt. Wide open! Russell Anthony is 7.6 feet away. [MAN] Paul Ming misses. Offensive rebound by Draymond Irving! Draymond Irving kicks it out.

[07:10] Team_078 possession (Score: 34-44)
Draymond Irving attempts a Layup. Heavily contested by Russell Anthony (1.9 feet, ZONE)! Draymond Irving misses. FOUL! Loose ball foul on Wendell Herro during the rebound battle. [IN THE BONUS! 5 team fouls] Paul Ming to the line for 2 free throws. (Wendell Herro: 1 personal fouls)   FT 1/2: GOOD   FT 2/2: MISS Paul Ming makes 1/2 from the line. Rebound secured by Julius Bird.
Score: 35-44

[06:54] Team_037 possession (Score: 35-44)
Julius Bird attempts a 3Pt. Contested by Malcolm Randle (5.6 feet, MAN). Julius Bird misses. Rebound secured by Malcolm Randle.

[06:36] Team_078 possession (Score: 35-44)
Damian Allen makes the Layup and draws the foul on Collin Trent! And-1! Damian Allen to the line for 1. [BONUS: 6 team fouls] (Collin Trent: 1 personal fouls)   FT 1/1: GOOD Damian Allen makes 1/1 from the line.
Score: 38-44

[06:22] Team_037 possession (Score: 38-44)
Julius Bird drives, Paul Ming stays with him. Julius Bird attempts a Layup. Contested by Paul Ming (3.5 feet, ZONE). JULIUS BIRD MAKES IT! Assist: Wendell Herro
Score: 38-46

[06:10] Team_078 possession (Score: 38-46)
Magic Barrett attempts a 3Pt. Contested by Julius Bird (5.9 feet, ZONE). Magic Barrett misses. Rebound secured by Wendell Herro.

[05:53] Team_037 possession (Score: 38-46)
Collin Trent attempts a Midrange. Contested by Paul Ming (2.0 feet, ZONE). COLLIN TRENT MAKES IT!
Score: 38-48

[05:37] Team_078 possession (Score: 38-48)
Malcolm Randle attempts a 3Pt. Wide open! Julius Bird is 6.2 feet away. [MAN] MALCOLM RANDLE MAKES IT! Assist: Paul Ming
Score: 41-48

[05:26] Team_037 possession (Score: 41-48)
Julius Bird attempts a 3Pt. Contested by Damian Allen (5.4 feet, ZONE). JULIUS BIRD MAKES IT! Assist: Jarrett Randle
Score: 41-51

[05:13] Team_078 possession (Score: 41-51)
Magic Barrett drives to the basket... Magic Barrett commits a violation (traveling/carry)! TURNOVER! (dead ball)

[04:55] Team_037 possession (Score: 41-51)
Russell Anthony attempts a Layup. Contested by Paul Ming (5.0 feet, MAN). RUSSELL ANTHONY MAKES IT! Assist: Julius Bird
Score: 41-53

[04:41] Team_078 possession (Score: 41-53)
Paul Ming commits a violation (traveling/carry)! TURNOVER! (dead ball)

[04:22] Team_037 possession (Score: 41-53)
Russell Anthony attempts a 3Pt. Contested by Damian Allen (3.8 feet, ZONE). Russell Anthony misses. Rebound secured by Paul Ming.

[04:08] Team_078 possession (Score: 41-53)
Magic Barrett attempts a Layup. Contested by Jarrett Randle (4.1 feet, MAN). Magic Barrett misses. Rebound secured by Julius Bird.

[03:53] Team_037 possession (Score: 41-53)
Jarrett Randle attempts a Midrange. Wide open! Magic Barrett is 7.1 feet away. [MAN] Jarrett Randle misses. Rebound secured by Paul Ming.

[03:40] Team_078 possession (Score: 41-53)
Magic Barrett attempts a 3Pt. Contested by Jarrett Randle (5.5 feet, MAN). Magic Barrett misses. Rebound secured by Wendell Herro.

[03:23] Team_037 possession (Score: 41-53)
Wendell Herro drives, Paul Ming stays with him. Wendell Herro attempts a Dunk. Contested by Paul Ming (4.8 feet, ZONE). WENDELL HERRO MAKES IT!
Score: 41-55

[03:08] Team_078 possession (Score: 41-55)
Magic Barrett attempts a Layup. Wide open! Russell Anthony is 6.1 feet away. [ZONE] MAGIC BARRETT MAKES IT!
Score: 43-55

[02:58] Team_037 possession (Score: 43-55)
Collin Trent attempts a 3Pt. Wide open! Damian Allen is 8.9 feet away. [ZONE] COLLIN TRENT MAKES IT! Assist: Wendell Herro
Score: 43-58

[02:43] Team_078 possession (Score: 43-58)
FOUL! Reach-in foul on Collin Trent during the drive. [IN THE BONUS! 7 team fouls] Damian Allen to the line for 2 free throws. (Collin Trent: 2 personal fouls)   FT 1/2: GOOD   FT 2/2: MISS Damian Allen makes 1/2 from the line. Rebound secured by Julius Bird.
Score: 44-58

[02:30] Team_037 possession (Score: 44-58)
Julius Bird attempts a 3Pt. Contested by Malcolm Randle (2.9 feet, MAN). Julius Bird misses. FOUL! Loose ball foul on Draymond Irving during the rebound battle. [Team fouls: 3] No free throws, side out. (Draymond Irving: 1 personal fouls)

[02:18] Team_037 possession (Score: 44-58)
FOUL! Reach-in foul on Paul Ming during the drive. [Team fouls: 4] No free throws, side out. (Paul Ming: 2 personal fouls)

[01:58] Team_037 possession (Score: 44-58)
Julius Bird drives to the basket... Julius Bird throws a bad pass! Stolen by Malcolm Randle! TURNOVER! (live ball)

[01:43] Team_078 possession (Score: 44-58)
Draymond Irving attempts a Layup. Contested by Russell Anthony (4.6 feet, MAN). Draymond Irving misses. FOUL! Loose ball foul on Russell Anthony during the rebound battle. [IN THE BONUS! 8 team fouls] Draymond Irving to the line for 2 free throws. (Russell Anthony: 4 personal fouls)   FT 1/2: GOOD   FT 2/2: GOOD Draymond Irving makes 2/2 from the line.
Score: 46-58

[01:27] Team_037 possession (Score: 46-58)
Julius Bird attempts a 3Pt. Contested by Malcolm Randle (4.9 feet, MAN). JULIUS BIRD MAKES IT! Assist: Wendell Herro
Score: 46-61

[01:12] Team_078 possession (Score: 46-61)
Paul Ming makes the Midrange and draws the foul on Russell Anthony! And-1! Paul Ming to the line for 1. [BONUS: 9 team fouls] (Russell Anthony: 5 personal fouls)   FT 1/1: GOOD Paul Ming makes 1/1 from the line.
Score: 49-61

[00:55] Team_037 possession (Score: 49-61)
FOUL! Shooting foul on Paul Ming. Jarrett Randle to the line for 2 free throws. [BONUS: 5 team fouls] (Paul Ming: 3 personal fouls)   FT 1/2: GOOD   FT 2/2: GOOD Jarrett Randle makes 2/2 from the line.
Score: 49-63

[00:38] Team_078 possession (Score: 49-63)
Damian Allen attempts a Midrange. Wide open! Collin Trent is 7.9 feet away. [MAN] DAMIAN ALLEN MAKES IT!
Score: 51-63

[00:24] Team_037 possession (Score: 51-63)
Wendell Herro loses control! Ball rolls out of bounds! TURNOVER! (dead ball)

[00:10] Team_078 possession (Score: 51-63)
Paul Ming attempts a Midrange. Contested by Collin Trent (5.3 feet, ZONE). PAUL MING MAKES IT! Assist: Draymond Irving
Score: 53-63

================================================================================
                              2ND QUARTER COMPLETE                              
================================================================================

2ND QUARTER SCORE: Team_078 26, Team_037 27

BOX SCORE:
================================================================================

Team_078
--------------------------------------------------------------------------------
Player                MIN  PTS  REB  AST  TO      FG   FG%      3P   3P%
--------------------------------------------------------------------------------
Paul Ming              11    5    5    1   0   2/2   100.0     0/0   0.0
Draymond Irving        11    5    2    1   0   2/4    50.0     0/0   0.0
Damian Allen           11    5    0    0   0   2/3    66.7     0/0   0.0
Kyrie Carter           13    4    0    0   0   2/3    66.7     0/0   0.0
Malcolm Randle         11    3    1    0   0   1/2    50.0     0/0   0.0
Magic Barrett          11    2    0    0   0   1/4    25.0     0/0   0.0
Isaiah Simmons         13    0    0    0   0   0/1     0.0     0/0   0.0
Jabari Barrett         13    0    1    0   0   0/0     0.0     0/0   0.0

TEAM: FG: 10/19 (52.6%), 3PT: 1/6 (16.7%), REB: 10 (3 off, 7 def), AST: 3, TO: 3
TEAM FOULS: 5 [Team_037 in BONUS]


Team_037
--------------------------------------------------------------------------------
Player                MIN  PTS  REB  AST  TO      FG   FG%      3P   3P%
--------------------------------------------------------------------------------
Julius Bird            11    8    5    1   0   3/4    75.0     0/0   0.0
Collin Trent           11    5    0    0   0   2/3    66.7     0/0   0.0
Wendell Herro          11    5    3    3   0   2/2   100.0     0/0   0.0
Scottie Jackson        13    4    0    0   0   2/2   100.0     0/0   0.0
Jarrett Randle         11    2    0    1   0   1/4    25.0     0/0   0.0
Russell Anthony        11    2    1    0   0   1/2    50.0     0/0   0.0
Ben Ginobili           13    0    1    1   0   0/0     0.0     0/0   0.0
Jarrett Tatum          13    0    2    0   0   0/0     0.0     0/0   0.0
Collin Young           13    0    0    0   0   0/2     0.0     0/0   0.0

TEAM: FG: 11/19 (57.9%), 3PT: 3/6 (50.0%), REB: 11 (3 off, 8 def), AST: 5, TO: 2
TEAM FOULS: 9 [Team_078 in BONUS]

================================================================================

================================================================================
                       3RD QUARTER - Team_078 vs Team_037                       
================================================================================

[12:00] Team_078 possession (Score: 53-63)
Jabari Barnes attempts a 3Pt. Wide open! Giannis Middleton is 6.3 feet away. [ZONE] Jabari Barnes misses. Rebound secured by Jarrett Tatum.

[11:50] Team_037 possession (Score: 53-63)
FOUL! Reach-in foul on Jabari Barnes during the drive. [Team fouls: 1] No free throws, side out. (Jabari Barnes: 1 personal fouls)

[11:31] Team_037 possession (Score: 53-63)
Jarrett Tatum attempts a 3Pt. Contested by Isaiah Simmons (2.3 feet, ZONE). Jarrett Tatum misses. Rebound secured by Isaiah Simmons.

[11:18] Team_078 possession (Score: 53-63)
FOUL! Holding foul on RJ Mitchell. [Team fouls: 1] No free throws, side out. (RJ Mitchell: 1 personal fouls)

[11:07] Team_078 possession (Score: 53-63)
Ben Ginobili attempts a Midrange. Wide open! Giannis Middleton is 7.5 feet away. [ZONE] BEN GINOBILI MAKES IT! Assist: Jabari Barrett
Score: 55-63

[10:54] Team_037 possession (Score: 55-63)
RJ Mitchell attempts a 3Pt. Contested by Jabari Barnes (2.9 feet, MAN). RJ Mitchell misses. Rebound secured by Isaiah Simmons.

[10:39] Team_078 possession (Score: 55-63)
Kyrie Carter attempts a Midrange. Contested by RJ Mitchell (5.8 feet, ZONE). KYRIE CARTER MAKES IT! Assist: Jabari Barnes
Score: 57-63

[10:23] Team_037 possession (Score: 57-63)
RJ Mitchell attempts a 3Pt. Heavily contested by Jabari Barnes (1.7 feet, MAN)! RJ MITCHELL MAKES IT! Assist: Scottie Jackson
Score: 57-66

[10:11] Team_078 possession (Score: 57-66)
Ben Ginobili attempts a 3Pt. Contested by Scottie Jackson (3.8 feet, MAN). Ben Ginobili misses. Offensive rebound by Jabari Barrett! Jabari Barrett kicks it out.

[09:56] Team_078 possession (Score: 57-66)
Ben Ginobili attempts a 3Pt. Heavily contested by Scottie Jackson (1.2 feet, MAN)! Ben Ginobili misses. Rebound secured by Collin Young.

[09:41] Team_037 possession (Score: 57-66)
FOUL! Holding foul on Ben Ginobili. [Team fouls: 2] No free throws, side out. (Ben Ginobili: 1 personal fouls)

[09:27] Team_037 possession (Score: 57-66)
Giannis Middleton drives to the basket... Giannis Middleton throws a bad pass out of bounds! TURNOVER! (dead ball)

[09:08] Team_078 possession (Score: 57-66)
Kyrie Carter attempts a 3Pt. Wide open! Giannis Middleton is 6.2 feet away. [MAN] Kyrie Carter misses. Offensive rebound by Jabari Barrett! Jabari Barrett kicks it out.

[08:55] Team_078 possession (Score: 57-66)
Jabari Barrett attempts a Midrange. Contested by Collin Young (5.2 feet, MAN). Jabari Barrett misses. Rebound secured by Collin Young.

[08:40] Team_037 possession (Score: 57-66)
Giannis Middleton attempts a Layup. BLOCKED BY KYRIE CARTER! Ball is loose! Offensive rebound by Scottie Jackson! Scottie Jackson kicks it out.

[08:28] Team_037 possession (Score: 57-66)
Scottie Jackson attempts a 3Pt. Contested by Isaiah Simmons (4.0 feet, ZONE). Scottie Jackson misses. Rebound secured by Ben Ginobili.

[08:15] Team_078 possession (Score: 57-66)
Jabari Barnes attempts a Midrange. Heavily contested by RJ Mitchell (0.5 feet, MAN)! Jabari Barnes misses. Rebound secured by Jarrett Tatum.

[07:59] Team_037 possession (Score: 57-66)
RJ Mitchell attempts a 3Pt. Contested by Jabari Barnes (4.7 feet, MAN). RJ Mitchell misses. Rebound secured by Isaiah Simmons.

[07:41] Team_078 possession (Score: 57-66)
Kyrie Carter drives and kicks out. Jabari Barrett attempts a 3Pt. Contested by Scottie Jackson (3.2 feet, ZONE). Jabari Barrett misses. Offensive rebound by Isaiah Simmons! Isaiah Simmons puts it back in!
Score: 59-66

[07:25] Team_037 possession (Score: 59-66)
Collin Young attempts a Midrange. Wide open! Jabari Barrett is 7.3 feet away. [MAN] COLLIN YOUNG MAKES IT!
Score: 59-68

[07:12] Team_078 possession (Score: 59-68)
Jabari Barnes drives and kicks out. FOUL! Shooting foul on Scottie Jackson. Isaiah Simmons to the line for 3 free throws. [Team fouls: 2] (Scottie Jackson: 1 personal fouls)   FT 1/3: GOOD   FT 2/3: GOOD   FT 3/3: GOOD Isaiah Simmons makes 3/3 from the line.
Score: 62-68

[06:57] Team_037 possession (Score: 62-68)
Giannis Middleton attempts a 3Pt. Heavily contested by Kyrie Carter (1.0 feet, MAN)! GIANNIS MIDDLETON MAKES IT! Assist: RJ Mitchell
Score: 62-71

[06:38] Team_078 possession (Score: 62-71)
Ben Ginobili attempts a 3Pt. Contested by Scottie Jackson (5.0 feet, MAN). Ben Ginobili misses. Rebound secured by Scottie Jackson.

[06:29] Team_037 possession (Score: 62-71)
RJ Mitchell attempts a Midrange. Contested by Ben Ginobili (3.3 feet, ZONE). RJ MITCHELL MAKES IT!
Score: 62-73

[06:16] Team_078 possession (Score: 62-73)
FOUL! Reach-in foul on Scottie Jackson during the drive. [Team fouls: 3] No free throws, side out. (Scottie Jackson: 2 personal fouls)

[06:04] Team_078 possession (Score: 62-73)
Jabari Barnes attempts a 3Pt. Contested by Scottie Jackson (4.1 feet, ZONE). JABARI BARNES MAKES IT! Assist: Kyrie Carter
Score: 65-73

[05:48] Team_037 possession (Score: 65-73)
RJ Mitchell attempts a Layup. Contested by Jabari Barrett (5.7 feet, ZONE). RJ MITCHELL MAKES IT! Assist: Giannis Middleton
Score: 65-75

[05:37] Team_078 possession (Score: 65-75)
Kyrie Carter attempts a Midrange. Contested by Giannis Middleton (3.4 feet, MAN). Kyrie Carter misses. Rebound secured by Scottie Jackson.

[05:24] Team_037 possession (Score: 65-75)
Scottie Jackson attempts a 3Pt. Contested by Isaiah Simmons (3.2 feet, ZONE). Scottie Jackson misses. Rebound secured by Ben Ginobili.

[05:09] Team_078 possession (Score: 65-75)
Kyrie Carter attempts a 3Pt. Heavily contested by Giannis Middleton (0.5 feet, MAN)! KYRIE CARTER MAKES IT! Assist: Ben Ginobili
Score: 68-75

[04:55] Team_037 possession (Score: 68-75)
Jarrett Tatum makes the Layup and draws the foul on Isaiah Simmons! And-1! Jarrett Tatum to the line for 1. [Team fouls: 4] (Isaiah Simmons: 1 personal fouls)   FT 1/1: GOOD Jarrett Tatum makes 1/1 from the line.
Score: 68-78

[04:41] Team_078 possession (Score: 68-78)
Kyrie Carter attempts a 3Pt. Heavily contested by Giannis Middleton (1.4 feet, MAN)! Kyrie Carter misses. FOUL! Loose ball foul on Scottie Jackson during the rebound battle. [Team fouls: 4] No free throws, side out. (Scottie Jackson: 3 personal fouls)

[04:25] Team_078 possession (Score: 68-78)
Kyrie Carter attempts a 3Pt. Contested by Giannis Middleton (2.7 feet, MAN). KYRIE CARTER MAKES IT! Assist: Isaiah Simmons
Score: 71-78

[04:11] Team_037 possession (Score: 71-78)
Scottie Jackson attempts a 3Pt. Wide open! Ben Ginobili is 6.6 feet away. [MAN] SCOTTIE JACKSON MAKES IT! Assist: Giannis Middleton
Score: 71-81

[03:54] Team_078 possession (Score: 71-81)
Jabari Barnes attempts a 3Pt. Wide open! RJ Mitchell is 6.5 feet away. [MAN] JABARI BARNES MAKES IT! Assist: Jabari Barrett
Score: 74-81

[03:38] Team_037 possession (Score: 74-81)
Collin Young attempts a Midrange. Contested by Ben Ginobili (5.5 feet, ZONE). COLLIN YOUNG MAKES IT! Assist: Scottie Jackson
Score: 74-83

[03:22] Team_078 possession (Score: 74-83)
Kyrie Carter drives to the basket... FOUL! Offensive foul on Kyrie Carter! Collin Young drew the charge! [Team fouls: 5] (Kyrie Carter: 1 personal fouls) TURNOVER! (dead ball)

[03:11] Team_037 possession (Score: 74-83)
Giannis Middleton drives to the basket... Giannis Middleton commits a violation (traveling/carry)! TURNOVER! (dead ball)

[03:11] Substitution (Team_078): Jabari Barnes OUT → Magic Barrett IN (stamina_rule2)

[03:11] Substitution (Team_037): Collin Young OUT → Wendell Herro IN (stamina_rule2)

[02:55] Team_078 possession (Score: 74-83)
Isaiah Simmons attempts a 3Pt. Contested by Scottie Jackson (5.3 feet, ZONE). ISAIAH SIMMONS MAKES IT! Assist: Jabari Barrett
Score: 77-83

[02:41] Team_037 possession (Score: 77-83)
Jarrett Tatum attempts a Midrange. Contested by Isaiah Simmons (2.0 feet, ZONE). JARRETT TATUM MAKES IT!
Score: 77-85

[02:27] Team_078 possession (Score: 77-85)
Magic Barrett drives, picks up RJ Mitchell. Help arrives from Giannis Middleton! Magic Barrett attempts a Dunk. Wide open! Giannis Middleton is 8.0 feet away. [MAN] Magic Barrett misses. Rebound secured by Scottie Jackson.

[02:11] Team_037 possession (Score: 77-85)
Wendell Herro attempts a Layup. Wide open! Jabari Barrett is 8.0 feet away. [ZONE] Wendell Herro misses. Rebound secured by Isaiah Simmons.

[02:00] Team_078 possession (Score: 77-85)
Magic Barrett attempts a 3Pt. Contested by RJ Mitchell (6.0 feet, ZONE). Magic Barrett misses. Rebound secured by Wendell Herro.

[01:47] Team_037 possession (Score: 77-85)
Jarrett Tatum attempts a Layup. BLOCKED BY KYRIE CARTER! Ball is loose! Rebound secured by Ben Ginobili.

[01:36] Team_078 possession (Score: 77-85)
Jabari Barrett attempts a Midrange. Contested by RJ Mitchell (5.6 feet, ZONE). Jabari Barrett misses. Rebound secured by Scottie Jackson.

[01:23] Team_037 possession (Score: 77-85)
Giannis Middleton attempts a 3Pt. Heavily contested by Ben Ginobili (0.9 feet, ZONE)! Giannis Middleton misses. Rebound secured by Jabari Barrett.

[01:09] Team_078 possession (Score: 77-85)
Magic Barrett attempts a 3Pt. Heavily contested by Scottie Jackson (1.3 feet, ZONE)! MAGIC BARRETT MAKES IT! Assist: Ben Ginobili
Score: 80-85

[00:52] Team_037 possession (Score: 80-85)
Jarrett Tatum attempts a 3Pt. Wide open! Magic Barrett is 6.2 feet away. [ZONE] Jarrett Tatum misses. Rebound secured by Isaiah Simmons.

[00:37] Team_078 possession (Score: 80-85)
Jabari Barrett attempts a Layup. Wide open! Scottie Jackson is 6.3 feet away. [MAN] Jabari Barrett misses. Rebound secured by Wendell Herro.

[00:21] Team_037 possession (Score: 80-85)
RJ Mitchell makes the Layup and draws the foul on Magic Barrett! And-1! RJ Mitchell to the line for 1. [BONUS: 6 team fouls] (Magic Barrett: 1 personal fouls)   FT 1/1: GOOD RJ Mitchell makes 1/1 from the line.
Score: 80-88

[00:08] Team_078 possession (Score: 80-88)
Kyrie Carter attempts a 3Pt. Heavily contested by Giannis Middleton (0.5 feet, MAN)! Kyrie Carter misses. Rebound secured by Wendell Herro.

================================================================================
                              3RD QUARTER COMPLETE                              
================================================================================

3RD QUARTER SCORE: Team_078 27, Team_037 25

BOX SCORE:
================================================================================

Team_078
--------------------------------------------------------------------------------
Player                MIN  PTS  REB  AST  TO      FG   FG%      3P   3P%
--------------------------------------------------------------------------------
Isaiah Simmons         26    8    6    1   0   3/3   100.0     0/0   0.0
Kyrie Carter           26    8    0    1   0   3/5    60.0     0/0   0.0
Jabari Barnes          23    6    0    1   0   2/4    50.0     0/0   0.0
Magic Barrett          14    3    0    0   0   1/3    33.3     0/0   0.0
Ben Ginobili           26    2    3    2   0   1/3    33.3     0/0   0.0
Jabari Barrett         26    0    4    3   0   0/3     0.0     0/0   0.0

TEAM: FG: 10/21 (47.6%), 3PT: 6/11 (54.5%), REB: 13 (4 off, 9 def), AST: 8, TO: 1
TEAM FOULS: 6 [Team_037 in BONUS]


Team_037
--------------------------------------------------------------------------------
Player                MIN  PTS  REB  AST  TO      FG   FG%      3P   3P%
--------------------------------------------------------------------------------
RJ Mitchell            26   10    0    1   0   4/6    66.7     0/0   0.0
Jarrett Tatum          26    5    2    0   0   2/5    40.0     0/0   0.0
Collin Young           23    4    2    0   0   2/2   100.0     0/0   0.0
Scottie Jackson        26    3    5    2   0   1/3    33.3     0/0   0.0
Giannis Middleton      26    3    0    2   0   1/2    50.0     0/0   0.0
Wendell Herro          14    0    3    0   0   0/1     0.0     0/0   0.0

TEAM: FG: 10/19 (52.6%), 3PT: 3/10 (30.0%), REB: 12 (1 off, 11 def), AST: 5, TO: 2
TEAM FOULS: 4

================================================================================

================================================================================
                       4TH QUARTER - Team_078 vs Team_037                       
================================================================================

[12:00] Team_078 possession (Score: 80-88)
Ben Ginobili drives, picks up Scottie Jackson. Help arrives from Giannis Middleton! Ben Ginobili attempts a Layup. Contested by Giannis Middleton (3.9 feet, MAN). Ben Ginobili misses. Rebound secured by Scottie Jackson.

[11:47] Team_037 possession (Score: 80-88)
Collin Young attempts a Layup. Contested by Jabari Barrett (5.4 feet, ZONE). COLLIN YOUNG MAKES IT! Assist: Scottie Jackson
Score: 80-90

[11:31] Team_078 possession (Score: 80-90)
Jabari Barnes throws a bad pass! Stolen by RJ Mitchell! TURNOVER! (live ball)

[11:19] Team_037 possession (Score: 80-90)
Collin Young makes the Layup and draws the foul on Jabari Barrett! And-1! Collin Young to the line for 1. [Team fouls: 1] (Jabari Barrett: 1 personal fouls)   FT 1/1: GOOD Collin Young makes 1/1 from the line.
Score: 80-93

[11:05] Team_078 possession (Score: 80-93)
Kyrie Carter drives and kicks out. Kyrie Carter attempts a 3Pt. Wide open! Giannis Middleton is 7.3 feet away. [MAN] Kyrie Carter misses. Rebound secured by Jarrett Tatum.

[10:54] Team_037 possession (Score: 80-93)
Scottie Jackson attempts a 3Pt. Wide open! Ben Ginobili is 8.2 feet away. [MAN] Scottie Jackson misses. Rebound secured by Jabari Barrett.

[10:43] Team_078 possession (Score: 80-93)
FOUL! Shooting foul on Collin Young. Jabari Barrett to the line for 2 free throws. [Team fouls: 1] (Collin Young: 1 personal fouls)   FT 1/2: MISS   FT 2/2: GOOD Jabari Barrett makes 1/2 from the line.
Score: 81-93

[10:28] Team_037 possession (Score: 81-93)
Jarrett Tatum attempts a Layup. Wide open! Jabari Barrett is 7.3 feet away. [ZONE] JARRETT TATUM MAKES IT! Assist: Collin Young
Score: 81-95

[10:10] Team_078 possession (Score: 81-95)
Jabari Barrett drives to the basket... FOUL! Offensive foul on Jabari Barrett! Collin Young drew the charge! [Team fouls: 2] (Jabari Barrett: 2 personal fouls) TURNOVER! (dead ball)

[09:58] Team_037 possession (Score: 81-95)
Giannis Middleton attempts a Midrange. Wide open! Kyrie Carter is 6.6 feet away. [MAN] Giannis Middleton misses. Rebound secured by Jabari Barrett.

[09:43] Team_078 possession (Score: 81-95)
Jabari Barrett makes the Layup and draws the foul on Scottie Jackson! And-1! Jabari Barrett to the line for 1. [Team fouls: 2] (Scottie Jackson: 1 personal fouls)   FT 1/1: MISS Jabari Barrett makes 0/1 from the line. Rebound secured by Collin Young.
Score: 83-95

[09:25] Team_037 possession (Score: 83-95)
Giannis Middleton attempts a Midrange. Contested by Kyrie Carter (3.9 feet, ZONE). Giannis Middleton misses. Rebound secured by Jabari Barrett.

[09:08] Team_078 possession (Score: 83-95)
Ben Ginobili loses the ball! Stripped by Scottie Jackson! TURNOVER! (live ball)

[08:52] Team_037 possession (Score: 83-95)
Scottie Jackson drives to the basket... Scottie Jackson throws a bad pass! Stolen by Ben Ginobili! TURNOVER! (live ball)

[08:36] Team_078 possession (Score: 83-95)
Ben Ginobili attempts a Midrange. Wide open! Giannis Middleton is 8.0 feet away. [ZONE] BEN GINOBILI MAKES IT! Assist: Isaiah Simmons
Score: 85-95

[08:24] Team_037 possession (Score: 85-95)
Jarrett Tatum attempts a 3Pt. Contested by Jabari Barnes (3.4 feet, ZONE). Jarrett Tatum misses. Offensive rebound by Collin Young! Collin Young puts it back in!
Score: 85-97

[08:09] Team_078 possession (Score: 85-97)
Jabari Barrett attempts a Layup. Contested by Collin Young (3.5 feet, MAN). Jabari Barrett misses. FOUL! Loose ball foul on Jarrett Tatum during the rebound battle. [Team fouls: 3] No free throws, side out. (Jarrett Tatum: 1 personal fouls)

[07:56] Team_078 possession (Score: 85-97)
Jabari Barnes drives, Collin Young stays with him. Jabari Barnes attempts a Dunk. Wide open! Collin Young is 10.0 feet away. [ZONE] Jabari Barnes misses. FOUL! Loose ball foul on Collin Young during the rebound battle. [Team fouls: 4] No free throws, side out. (Collin Young: 2 personal fouls)

[07:38] Team_078 possession (Score: 85-97)
Isaiah Simmons makes the Layup and draws the foul on Jarrett Tatum! And-1! Isaiah Simmons to the line for 1. [BONUS: 5 team fouls] (Jarrett Tatum: 2 personal fouls)   FT 1/1: GOOD Isaiah Simmons makes 1/1 from the line.
Score: 88-97

[07:18] Team_037 possession (Score: 88-97)
RJ Mitchell drives, picks up Jabari Barnes. Help arrives from Isaiah Simmons! RJ Mitchell attempts a Layup. Wide open! Isaiah Simmons is 9.2 feet away. [MAN] RJ MITCHELL MAKES IT! Assist: Giannis Middleton
Score: 88-99

[07:04] Team_078 possession (Score: 88-99)
Ben Ginobili attempts a Midrange. Contested by Scottie Jackson (5.2 feet, MAN). Ben Ginobili misses. Offensive rebound by Jabari Barrett! Jabari Barrett kicks it out.

[06:51] Team_078 possession (Score: 88-99)
Jabari Barrett attempts a 3Pt. Wide open! Scottie Jackson is 6.9 feet away. [ZONE] Jabari Barrett misses. Rebound secured by Collin Young.

[06:33] Team_037 possession (Score: 88-99)
Jarrett Tatum attempts a Layup. Contested by Jabari Barrett (4.9 feet, ZONE). JARRETT TATUM MAKES IT!
Score: 88-101

[06:17] Team_078 possession (Score: 88-101)
Jabari Barnes drives, picks up Scottie Jackson. Help arrives from Giannis Middleton! Jabari Barnes attempts a Dunk. Contested by Giannis Middleton (4.6 feet, ZONE). Jabari Barnes misses. Rebound secured by Collin Young.

[06:06] Team_037 possession (Score: 88-101)
RJ Mitchell attempts a 3Pt. Wide open! Jabari Barnes is 6.2 feet away. [ZONE] RJ MITCHELL MAKES IT! Assist: Jarrett Tatum
Score: 88-104

[05:47] Team_078 possession (Score: 88-104)
Ben Ginobili attempts a 3Pt. Contested by Scottie Jackson (5.8 feet, MAN). Ben Ginobili misses. Rebound secured by Collin Young.

[05:33] Team_037 possession (Score: 88-104)
Giannis Middleton attempts a 3Pt. Contested by Kyrie Carter (4.7 feet, MAN). Giannis Middleton misses. Rebound secured by Isaiah Simmons.

[05:18] Team_078 possession (Score: 88-104)
Jabari Barnes attempts a 3Pt. Wide open! RJ Mitchell is 6.2 feet away. [MAN] JABARI BARNES MAKES IT! Assist: Jabari Barrett
Score: 91-104

[05:04] Team_037 possession (Score: 91-104)
Jarrett Tatum attempts a 3Pt. Wide open! Jabari Barnes is 6.7 feet away. [ZONE] JARRETT TATUM MAKES IT! Assist: Scottie Jackson
Score: 91-107

[04:49] Team_078 possession (Score: 91-107)
Kyrie Carter attempts a 3Pt. Wide open! Giannis Middleton is 6.8 feet away. [MAN] Kyrie Carter misses. Offensive rebound by Jabari Barrett! Jabari Barrett kicks it out.

[04:31] Team_078 possession (Score: 91-107)
Isaiah Simmons attempts a Layup. Contested by Scottie Jackson (2.1 feet, ZONE). Isaiah Simmons misses. Rebound secured by Scottie Jackson.

[04:20] Team_037 possession (Score: 91-107)
RJ Mitchell attempts a Midrange. Contested by Jabari Barnes (4.9 feet, MAN). RJ MITCHELL MAKES IT! Assist: Scottie Jackson
Score: 91-109

[04:08] Team_078 possession (Score: 91-109)
Jabari Barrett drives and kicks out. Jabari Barrett attempts a 3Pt. Wide open! Giannis Middleton is 8.7 feet away. [ZONE] Jabari Barrett misses. Rebound secured by Collin Young.

[03:55] Team_037 possession (Score: 91-109)
FOUL! Shooting foul on Ben Ginobili. Collin Young to the line for 2 free throws. [Team fouls: 3] (Ben Ginobili: 1 personal fouls)   FT 1/2: GOOD   FT 2/2: MISS Collin Young makes 1/2 from the line. Rebound secured by Jabari Barrett.
Score: 91-110

[03:45] Team_078 possession (Score: 91-110)
Kyrie Carter attempts a Midrange. Contested by Giannis Middleton (2.2 feet, MAN). Kyrie Carter misses. Rebound secured by Collin Young.

[03:30] Team_037 possession (Score: 91-110)
Scottie Jackson drives to the basket... Scottie Jackson loses the ball! Stripped by Jabari Barrett! TURNOVER! (live ball)

[03:11] Team_078 possession (Score: 91-110)
Kyrie Carter attempts a Midrange. Wide open! Giannis Middleton is 7.7 feet away. [MAN] Kyrie Carter misses. Offensive rebound by Isaiah Simmons! Isaiah Simmons kicks it out.

[02:57] Team_078 possession (Score: 91-110)
Kyrie Carter attempts a Midrange. Wide open! Giannis Middleton is 6.7 feet away. [MAN] Kyrie Carter misses. Offensive rebound by Isaiah Simmons! Isaiah Simmons kicks it out.

[02:43] Team_078 possession (Score: 91-110)
Jabari Barnes attempts a 3Pt. Contested by RJ Mitchell (5.0 feet, MAN). JABARI BARNES MAKES IT! Assist: Jabari Barrett
Score: 94-110

[02:29] Team_037 possession (Score: 94-110)
Scottie Jackson drives to the basket... Scottie Jackson throws a bad pass out of bounds! TURNOVER! (dead ball)

[02:29] Substitution (Team_078): Jabari Barnes OUT → Magic Barrett IN (stamina_rule2)

[02:29] Substitution (Team_078): Kyrie Carter OUT → Damian Allen IN (stamina_rule2)

[02:29] Substitution (Team_078): Isaiah Simmons OUT → Malcolm Randle IN (stamina_rule2)

[02:29] Substitution (Team_078): Ben Ginobili OUT → Paul Ming IN (stamina_rule2)

[02:29] Substitution (Team_078): Jabari Barrett OUT → Draymond Irving IN (stamina_rule2)

[02:29] Substitution (Team_037): RJ Mitchell OUT → Jarrett Randle IN (stamina_rule2)

[02:29] Substitution (Team_037): Giannis Middleton OUT → Collin Trent IN (stamina_rule2)

[02:29] Substitution (Team_037): Jarrett Tatum OUT → Julius Bird IN (stamina_rule2)

[02:29] Substitution (Team_037): Scottie Jackson OUT → Russell Anthony IN (stamina_rule2)

[02:29] Substitution (Team_037): Collin Young OUT → Wendell Herro IN (stamina_rule2)

[02:10] Team_078 possession (Score: 94-110)
Malcolm Randle makes the Dunk and draws the foul on Julius Bird! And-1! Malcolm Randle to the line for 1. [BONUS: 6 team fouls] (Julius Bird: 1 personal fouls)   FT 1/1: GOOD Malcolm Randle makes 1/1 from the line.
Score: 97-110

[01:56] Team_037 possession (Score: 97-110)
Julius Bird attempts a Layup. Contested by Paul Ming (3.5 feet, ZONE). JULIUS BIRD MAKES IT! Assist: Wendell Herro
Score: 97-112

[01:41] Team_078 possession (Score: 97-112)
Paul Ming attempts a 3Pt. Contested by Jarrett Randle (4.9 feet, ZONE). Paul Ming misses. FOUL! Loose ball foul on Julius Bird during the rebound battle. [IN THE BONUS! 7 team fouls] Paul Ming to the line for 2 free throws. (Julius Bird: 2 personal fouls)   FT 1/2: MISS   FT 2/2: MISS Paul Ming makes 0/2 from the line. Rebound secured by Julius Bird.

[01:30] Team_037 possession (Score: 97-112)
Wendell Herro drives, picks up Paul Ming. Help arrives from Damian Allen! Wendell Herro attempts a Layup. Contested by Damian Allen (3.0 feet, ZONE). WENDELL HERRO MAKES IT! Assist: Jarrett Randle
Score: 97-114

[01:17] Team_078 possession (Score: 97-114)
Draymond Irving attempts a Midrange. Wide open! Julius Bird is 6.7 feet away. [ZONE] Draymond Irving misses. Rebound secured by Wendell Herro.

[01:03] Team_037 possession (Score: 97-114)
FOUL! Reach-in foul on Draymond Irving during the drive. [Team fouls: 4] No free throws, side out. (Draymond Irving: 1 personal fouls)

[00:49] Team_037 possession (Score: 97-114)
Russell Anthony attempts a Layup. Heavily contested by Paul Ming (1.9 feet, ZONE)! RUSSELL ANTHONY MAKES IT!
Score: 97-116

[00:37] Team_078 possession (Score: 97-116)
Draymond Irving drives, Russell Anthony stays with him. Draymond Irving attempts a Layup. Contested by Russell Anthony (2.2 feet, ZONE). DRAYMOND IRVING MAKES IT! Assist: Damian Allen
Score: 99-116

[00:25] Team_037 possession (Score: 99-116)
Jarrett Randle attempts a Midrange. Contested by Magic Barrett (5.3 feet, MAN). JARRETT RANDLE MAKES IT! Assist: Wendell Herro
Score: 99-118

[00:13] Team_078 possession (Score: 99-118)
FOUL! Shooting foul on Russell Anthony. Paul Ming to the line for 2 free throws. [BONUS: 8 team fouls] (Russell Anthony: 1 personal fouls)   FT 1/2: GOOD   FT 2/2: GOOD Paul Ming makes 2/2 from the line.
Score: 101-118

[00:02] Team_037 possession (Score: 101-118)
Jarrett Randle attempts a Midrange. Wide open! Magic Barrett is 7.4 feet away. [MAN] JARRETT RANDLE MAKES IT!
Score: 101-120

================================================================================
                              4TH QUARTER COMPLETE                              
================================================================================

4TH QUARTER SCORE: Team_078 21, Team_037 32

BOX SCORE:
================================================================================

Team_078
--------------------------------------------------------------------------------
Player                MIN  PTS  REB  AST  TO      FG   FG%      3P   3P%
--------------------------------------------------------------------------------
Jabari Barnes          32    6    0    0   0   2/3    66.7     0/0   0.0
Isaiah Simmons         35    3    4    1   0   1/2    50.0     0/0   0.0
Malcolm Randle         13    3    0    0   0   1/1   100.0     0/0   0.0
Ben Ginobili           35    2    0    0   0   1/3    33.3     0/0   0.0
Julius Bird            13    2    1    0   0   1/1   100.0     0/0   0.0
Paul Ming              13    2    0    0   0   1/2    50.0     0/0   0.0
Draymond Irving        13    2    0    0   0   1/2    50.0     0/0   0.0
Jabari Barrett         35    1    7    2   0   1/4    25.0     0/0   0.0
Kyrie Carter           35    0    0    0   0   0/2     0.0     0/0   0.0
Damian Allen           13    0    0    1   0   0/0     0.0     0/0   0.0

TEAM: FG: 8/19 (42.1%), 3PT: 2/5 (40.0%), REB: 12 (7 off, 5 def), AST: 4, TO: 3
TEAM FOULS: 4


Team_037
--------------------------------------------------------------------------------
Player                MIN  PTS  REB  AST  TO      FG   FG%      3P   3P%
--------------------------------------------------------------------------------
Collin Young           32    7    7    1   0   3/4    75.0     0/0   0.0
Jarrett Tatum          35    7    1    1   0   3/3   100.0     0/0   0.0
RJ Mitchell            35    7    0    0   0   3/3   100.0     0/0   0.0
Jarrett Randle         13    4    0    1   0   2/2   100.0     0/0   0.0
Wendell Herro          16    2    1    2   0   1/1   100.0     0/0   0.0
Russell Anthony        13    2    0    0   0   1/1   100.0     0/0   0.0
Scottie Jackson        35    0    2    3   0   0/1     0.0     0/0   0.0
Giannis Middleton      35    0    0    1   0   0/3     0.0     0/0   0.0

TEAM: FG: 14/19 (73.7%), 3PT: 3/5 (60.0%), REB: 11 (1 off, 10 def), AST: 9, TO: 3
TEAM FOULS: 8 [Team_078 in BONUS]

================================================================================

================================================================================
                               FULL GAME COMPLETE                               
================================================================================

FINAL SCORE: Team_078 101, Team_037 120

SCORING BY QUARTER:
--------------------------------------------------------------------------------
Team                     Q1     Q2     Q3     Q4    FINAL
--------------------------------------------------------------------------------
Team_078                 27     26     27     21      101
Team_037                 36     27     25     32      120
--------------------------------------------------------------------------------

FULL GAME BOX SCORE:
================================================================================

Team_078
--------------------------------------------------------------------------------
Player                MIN  PTS  REB  AST  TO      FG   FG%      3P   3P%      FT STL BLK
--------------------------------------------------------------------------------
Kyrie Carter           35   17    0    3   1   8/13   61.5   3/5    60.0   2/2     0   2
Isaiah Simmons         35   14   15    2   1   3/10   30.0   1/6    16.7   5/5     0   0
Ben Ginobili           35    6    4    5   2   3/8    37.5   0/3     0.0   2/2     1   0
Jabari Barrett         35   11   15    6   0   5/13   38.5   1/2    50.0   2/4     2   0
Jabari Barnes          32   17    0    2   3   7/13   53.8   5/7    71.4   0/0     0   0
Magic Barrett          16    5    0    0   1   2/7    28.6   1/4    25.0   0/0     0   0
Damian Allen           13    7    0    1   0   3/4    75.0   0/0     0.0   2/3     0   0
Malcolm Randle         13    6    1    0   0   2/3    66.7   1/2    50.0   1/1     1   0
Paul Ming              13    7    5    1   1   3/4    75.0   0/1     0.0   4/7     0   0
Draymond Irving        13    7    2    1   0   3/6    50.0   0/0     0.0   3/3     0   0

TEAM: FG: 39/81 (48.1%), 3PT: 12/30 (40.0%), REB: 41 (15 off, 26 def), AST: 21, TO: 9


Team_037
--------------------------------------------------------------------------------
Player                MIN  PTS  REB  AST  TO      FG   FG%      3P   3P%      FT STL BLK
--------------------------------------------------------------------------------
RJ Mitchell            35   22    0    1   1   9/12   75.0   3/6    50.0   1/1     1   0
Giannis Middleton      35    6    0    6   2   2/8    25.0   1/3    33.3   1/1     0   0
Jarrett Tatum          35   20    7    3   0   9/12   75.0   4/6    66.7   1/1     0   0
Scottie Jackson        35   19   14    6   2   8/13   61.5   3/7    42.9   0/0     1   0
Collin Young           32   17   12    3   1   7/12   58.3   0/0     0.0   3/5     1   0
Wendell Herro          16    7    7    5   3   3/4    75.0   0/0     0.0   1/1     0   0
Jarrett Randle         13    6    0    3   0   3/6    50.0   0/1     0.0   2/2     0   0
Collin Trent           13    5    0    0   0   2/3    66.7   1/1   100.0   0/0     0   0
Julius Bird            13   12    6    1   0   5/6    83.3   2/3    66.7   0/0     0   0
Russell Anthony        13    4    1    0   0   2/3    66.7   0/1     0.0   0/0     0   0

TEAM: FG: 50/79 (63.3%), 3PT: 14/28 (50.0%), REB: 48 (8 off, 40 def), AST: 28, TO: 9

================================================================================
