================================================================================
                        FULL GAME - Team_059 vs Team_084                        
================================================================================

================================================================================
                       1ST QUARTER - Team_059 vs Team_084                       
================================================================================

[12:00] Team_059 possession (Score: 0-0)
Bam Wade attempts a Layup. Wide open! Luka Sexton is 6.4 feet away. [MAN] BAM WADE MAKES IT! Assist: Nikola Jokic
Score: 2-0

[11:46] Team_084 possession (Score: 2-0)
Dejounte Ginobili attempts a Layup. Contested by Blake Tatum (5.0 feet, MAN). DEJOUNTE GINOBILI MAKES IT!
Score: 2-2

[11:34] Team_059 possession (Score: 2-2)
John Iverson drives and kicks out. Nikola Jokic attempts a Midrange. Contested by Dejounte Ginobili (4.2 feet, ZONE). Nikola Jokic misses. Rebound secured by Dejounte Ginobili.

[11:19] Team_084 possession (Score: 2-2)
FOUL! Reach-in foul on Jarrett Smith during the drive. [Team fouls: 1] No free throws, side out. (Jarrett Smith: 1 personal fouls)

[11:00] Team_084 possession (Score: 2-2)
Giannis Quickley attempts a Midrange. Wide open! Jarrett Smith is 7.4 feet away. [MAN] Giannis Quickley misses. Rebound secured by Bam Wade.

[10:47] Team_059 possession (Score: 2-2)
John Iverson attempts a Midrange. Wide open! Jarrett Booker is 7.2 feet away. [ZONE] John Iverson misses. Rebound secured by Giannis Quickley.

[10:29] Team_084 possession (Score: 2-2)
Luka Sexton attempts a 3Pt. Heavily contested by Bam Wade (1.9 feet, MAN)! Luka Sexton misses. Rebound secured by John Iverson.

[10:11] Team_059 possession (Score: 2-2)
Jarrett Smith drives and kicks out. FOUL! Shooting foul on Luka Sexton. Blake Tatum to the line for 3 free throws. [Team fouls: 1] (Luka Sexton: 1 personal fouls)   FT 1/3: GOOD   FT 2/3: GOOD   FT 3/3: GOOD Blake Tatum makes 3/3 from the line.
Score: 5-2

[10:00] Team_084 possession (Score: 5-2)
Dejounte Ginobili attempts a 3Pt. Contested by Blake Tatum (4.2 feet, MAN). DEJOUNTE GINOBILI MAKES IT! Assist: Klay Thompson
Score: 5-5

[09:44] Team_059 possession (Score: 5-5)
Blake Tatum drives, Giannis Quickley stays with him. Blake Tatum attempts a Layup. Contested by Giannis Quickley (5.1 feet, ZONE). Blake Tatum misses. Offensive rebound by John Iverson! John Iverson kicks it out.

[09:29] Team_059 possession (Score: 5-5)
Nikola Jokic attempts a Layup. Wide open! Giannis Quickley is 6.9 feet away. [ZONE] NIKOLA JOKIC MAKES IT!
Score: 7-5

[09:19] Team_084 possession (Score: 7-5)
Klay Thompson loses control! Ball rolls out of bounds! TURNOVER! (dead ball)

[09:10] Team_059 possession (Score: 7-5)
Blake Tatum drives, Giannis Quickley stays with him. Blake Tatum attempts a Dunk. Contested by Giannis Quickley (4.6 feet, ZONE). Blake Tatum misses. Rebound secured by Giannis Quickley.

[08:54] Team_084 possession (Score: 7-5)
Dejounte Ginobili attempts a Layup. Contested by Blake Tatum (4.9 feet, MAN). DEJOUNTE GINOBILI MAKES IT! Assist: Klay Thompson
Score: 7-7

[08:37] Team_059 possession (Score: 7-7)
Blake Tatum attempts a 3Pt. Contested by Dejounte Ginobili (5.7 feet, MAN). Blake Tatum misses. Rebound secured by Giannis Quickley.

[08:26] Team_084 possession (Score: 7-7)
Klay Thompson attempts a 3Pt. Contested by Bam Wade (5.1 feet, ZONE). Klay Thompson misses. Offensive rebound by Dejounte Ginobili! Dejounte Ginobili kicks it out.

[08:13] Team_084 possession (Score: 7-7)
Luka Sexton drives and kicks out. Giannis Quickley attempts a 3Pt. Contested by Bam Wade (2.2 feet, ZONE). Giannis Quickley misses. Rebound secured by John Iverson.

[08:03] Team_059 possession (Score: 7-7)
John Iverson attempts a 3Pt. Contested by Klay Thompson (4.8 feet, MAN). John Iverson misses. Offensive rebound by Jarrett Smith! Jarrett Smith kicks it out.

[07:50] Team_059 possession (Score: 7-7)
Jarrett Smith drives to the basket... Jarrett Smith commits a violation (traveling/carry)! TURNOVER! (dead ball)

[07:40] Team_084 possession (Score: 7-7)
Giannis Quickley attempts a Midrange. Heavily contested by Blake Tatum (1.0 feet, ZONE)! GIANNIS QUICKLEY MAKES IT! Assist: Luka Sexton
Score: 7-9

[07:25] Team_059 possession (Score: 7-9)
Nikola Jokic attempts a Midrange. Contested by Jarrett Booker (5.1 feet, MAN). Nikola Jokic misses. Offensive rebound by John Iverson! John Iverson kicks it out.

[07:08] Team_059 possession (Score: 7-9)
Blake Tatum throws a bad pass! Stolen by Dejounte Ginobili! TURNOVER! (live ball)

[06:51] Team_084 possession (Score: 7-9)
FOUL! Reach-in foul on Blake Tatum during the drive. [Team fouls: 2] No free throws, side out. (Blake Tatum: 1 personal fouls)

[06:34] Team_084 possession (Score: 7-9)
Dejounte Ginobili attempts a Midrange. Heavily contested by Blake Tatum (1.8 feet, MAN)! Dejounte Ginobili misses. Rebound secured by Jarrett Smith.

[06:22] Team_059 possession (Score: 7-9)
Nikola Jokic attempts a 3Pt. Contested by Jarrett Booker (5.2 feet, MAN). NIKOLA JOKIC MAKES IT! Assist: Jarrett Smith
Score: 10-9

[06:06] Team_084 possession (Score: 10-9)
Giannis Quickley drives and kicks out. Dejounte Ginobili attempts a 3Pt. Contested by Blake Tatum (4.8 feet, MAN). DEJOUNTE GINOBILI MAKES IT! Assist: Jarrett Booker
Score: 10-12

[05:51] Team_059 possession (Score: 10-12)
John Iverson attempts a Midrange. Contested by Klay Thompson (4.9 feet, MAN). John Iverson misses. Offensive rebound by John Iverson! John Iverson kicks it out.

[05:37] Team_059 possession (Score: 10-12)
Blake Tatum drives and kicks out. FOUL! Shooting foul on Luka Sexton. Jarrett Smith to the line for 3 free throws. [Team fouls: 2] (Luka Sexton: 2 personal fouls)   FT 1/3: GOOD   FT 2/3: GOOD   FT 3/3: GOOD Jarrett Smith makes 3/3 from the line.
Score: 13-12

[05:24] Team_084 possession (Score: 13-12)
Klay Thompson throws a bad pass! Stolen by John Iverson! TURNOVER! (live ball)

[05:07] Team_059 possession (Score: 13-12)
Nikola Jokic drives, Giannis Quickley stays with him. Nikola Jokic attempts a Layup. Contested by Giannis Quickley (4.8 feet, ZONE). Nikola Jokic misses. Rebound secured by Klay Thompson.

[04:57] Team_084 possession (Score: 13-12)
Dejounte Ginobili drives, Jarrett Smith stays with him. Dejounte Ginobili attempts a Dunk. Contested by Jarrett Smith (5.4 feet, ZONE). Dejounte Ginobili misses. Rebound secured by Jarrett Smith.

[04:38] Team_059 possession (Score: 13-12)
John Iverson attempts a 3Pt. Contested by Klay Thompson (4.2 feet, MAN). John Iverson misses. Rebound secured by Klay Thompson.

[04:23] Team_084 possession (Score: 13-12)
Giannis Quickley attempts a Midrange. Wide open! Jarrett Smith is 6.1 feet away. [MAN] Giannis Quickley misses. Rebound secured by Jarrett Smith.

[04:08] Team_059 possession (Score: 13-12)
Nikola Jokic attempts a 3Pt. Wide open! Jarrett Booker is 6.3 feet away. [MAN] Nikola Jokic misses. Rebound secured by Giannis Quickley.

[03:52] Team_084 possession (Score: 13-12)
Giannis Quickley attempts a Layup. Wide open! Jarrett Smith is 6.1 feet away. [MAN] GIANNIS QUICKLEY MAKES IT! Assist: Dejounte Ginobili
Score: 13-14

[03:40] Team_059 possession (Score: 13-14)
Blake Tatum attempts a Midrange. Contested by Dejounte Ginobili (3.4 feet, MAN). Blake Tatum misses. Rebound secured by Klay Thompson.

[03:27] Team_084 possession (Score: 13-14)
Luka Sexton attempts a 3Pt. Contested by Bam Wade (4.1 feet, ZONE). Luka Sexton misses. Rebound secured by John Iverson.

[03:17] Team_059 possession (Score: 13-14)
Nikola Jokic attempts a Layup. Contested by Giannis Quickley (4.2 feet, ZONE). Nikola Jokic misses. Rebound secured by Dejounte Ginobili.

[03:04] Team_084 possession (Score: 13-14)
Giannis Quickley drives, Jarrett Smith stays with him. Giannis Quickley attempts a Layup. Wide open! Jarrett Smith is 6.6 feet away. [MAN] GIANNIS QUICKLEY MAKES IT! Assist: Klay Thompson
Score: 13-16

[02:53] Team_059 possession (Score: 13-16)
John Iverson attempts a 3Pt. Contested by Klay Thompson (5.9 feet, MAN). JOHN IVERSON MAKES IT! Assist: Nikola Jokic
Score: 16-16

[02:43] Team_084 possession (Score: 16-16)
Jarrett Booker attempts a 3Pt. Contested by Bam Wade (3.7 feet, ZONE). Jarrett Booker misses. Rebound secured by Jarrett Smith.

[02:27] Team_059 possession (Score: 16-16)
John Iverson attempts a Midrange. Contested by Jarrett Booker (4.0 feet, ZONE). John Iverson misses. Rebound secured by Giannis Quickley.

[02:12] Team_084 possession (Score: 16-16)
Luka Sexton attempts a 3Pt. Contested by Bam Wade (3.4 feet, ZONE). Luka Sexton misses. Rebound secured by John Iverson.

[01:54] Team_059 possession (Score: 16-16)
Blake Tatum attempts a Layup. BLOCKED BY DEJOUNTE GINOBILI! Ball is loose! Rebound secured by Dejounte Ginobili.

[01:37] Team_084 possession (Score: 16-16)
Jarrett Booker attempts a Layup. Contested by Jarrett Smith (4.6 feet, ZONE). Jarrett Booker misses. Offensive rebound by Giannis Quickley! Giannis Quickley puts it back in!
Score: 16-18

[01:25] Team_059 possession (Score: 16-18)
Jarrett Smith attempts a Midrange. Contested by Giannis Quickley (3.8 feet, MAN). Jarrett Smith misses. Offensive rebound by John Iverson! John Iverson kicks it out.

[01:11] Team_059 possession (Score: 16-18)
Blake Tatum attempts a Layup. Contested by Giannis Quickley (4.0 feet, ZONE). Blake Tatum misses. Rebound secured by Dejounte Ginobili.

[00:58] Team_084 possession (Score: 16-18)
FOUL! Holding foul on Bam Wade. [Team fouls: 3] No free throws, side out. (Bam Wade: 1 personal fouls)

[00:47] Team_084 possession (Score: 16-18)
Giannis Quickley drives to the basket... Giannis Quickley loses control! Ball rolls out of bounds! TURNOVER! (dead ball)

[00:47] Substitution (Team_059): Bam Wade OUT → Russell Quickley IN (stamina_rule2)

[00:47] Substitution (Team_059): Blake Tatum OUT → Scottie Ginobili IN (stamina_rule2)

[00:47] Substitution (Team_059): John Iverson OUT → Allen Giddey IN (stamina_rule2)

[00:47] Substitution (Team_059): Nikola Jokic OUT → Bones Middleton IN (stamina_rule2)

[00:47] Substitution (Team_059): Jarrett Smith OUT → LeBron Lowry IN (stamina_rule2)

[00:47] Substitution (Team_084): Luka Sexton OUT → Magic Bryant IN (stamina_rule2)

[00:47] Substitution (Team_084): Dejounte Ginobili OUT → Chris Parker IN (stamina_rule2)

[00:47] Substitution (Team_084): Klay Thompson OUT → Evan Quickley IN (stamina_rule2)

[00:47] Substitution (Team_084): Jarrett Booker OUT → Pascal Jackson IN (stamina_rule2)

[00:47] Substitution (Team_084): Giannis Quickley OUT → Dejounte Porzingis IN (stamina_rule2)

[00:33] Team_059 possession (Score: 16-18)
FOUL! Offensive foul on Scottie Ginobili! Chris Parker drew the charge! [Team fouls: 4] (Scottie Ginobili: 1 personal fouls) TURNOVER! (dead ball)

[00:17] Team_084 possession (Score: 16-18)
Chris Parker drives and kicks out. Evan Quickley attempts a Midrange. Contested by Allen Giddey (4.8 feet, MAN). Evan Quickley misses. Offensive rebound by Pascal Jackson! Pascal Jackson kicks it out.

[00:02] Team_084 possession (Score: 16-18)
Pascal Jackson attempts a 3Pt. Wide open! Scottie Ginobili is 6.4 feet away. [ZONE] PASCAL JACKSON MAKES IT! Assist: Evan Quickley
Score: 16-21

================================================================================
                              1ST QUARTER COMPLETE                              
================================================================================

1ST QUARTER SCORE: Team_059 16, Team_084 21

BOX SCORE:
================================================================================

Team_059
--------------------------------------------------------------------------------
Player                MIN  PTS  REB  AST  TO      FG   FG%      3P   3P%
--------------------------------------------------------------------------------
Nikola Jokic           11    5    0    2   0   2/5    40.0     0/0   0.0
John Iverson           11    3    8    0   0   1/5    20.0     0/0   0.0
Blake Tatum            11    3    0    0   0   1/6    16.7     0/0   0.0
Jarrett Smith          11    3    5    1   0   1/1   100.0     0/0   0.0
Bam Wade               11    2    1    0   0   1/1   100.0     0/0   0.0

TEAM: FG: 6/18 (33.3%), 3PT: 2/5 (40.0%), REB: 14 (5 off, 9 def), AST: 3, TO: 3
TEAM FOULS: 4


Team_084
--------------------------------------------------------------------------------
Player                MIN  PTS  REB  AST  TO      FG   FG%      3P   3P%
--------------------------------------------------------------------------------
Dejounte Ginobili      11   10    5    1   0   4/6    66.7     0/0   0.0
Giannis Quickley       11    8    6    0   0   4/6    66.7     0/0   0.0
Pascal Jackson          1    3    1    0   0   1/1   100.0     0/0   0.0
Luka Sexton            11    0    0    1   0   0/4     0.0     0/0   0.0
Klay Thompson          11    0    3    3   0   0/0     0.0     0/0   0.0
Jarrett Booker         11    0    0    1   0   0/1     0.0     0/0   0.0
Evan Quickley           1    0    0    1   0   0/0     0.0     0/0   0.0

TEAM: FG: 9/18 (50.0%), 3PT: 2/6 (33.3%), REB: 15 (3 off, 12 def), AST: 7, TO: 3
TEAM FOULS: 2

================================================================================

================================================================================
                       2ND QUARTER - Team_059 vs Team_084                       
================================================================================

[12:00] Team_059 possession (Score: 16-21)
FOUL! Shooting foul on Giannis Quickley. Nikola Jokic to the line for 2 free throws. [Team fouls: 1] (Giannis Quickley: 1 personal fouls)   FT 1/2: GOOD   FT 2/2: MISS Nikola Jokic makes 1/2 from the line. Rebound secured by Dejounte Ginobili.
Score: 17-21

[11:45] Team_084 possession (Score: 17-21)
FOUL! Shooting foul on Bam Wade. Jarrett Booker to the line for 3 free throws. [Team fouls: 1] (Bam Wade: 1 personal fouls)   FT 1/3: MISS   FT 2/3: GOOD   FT 3/3: MISS Jarrett Booker makes 1/3 from the line. Rebound secured by Jarrett Smith.
Score: 17-22

[11:33] Team_059 possession (Score: 17-22)
Bam Wade attempts a 3Pt. Contested by Luka Sexton (3.5 feet, MAN). BAM WADE MAKES IT! Assist: John Iverson
Score: 20-22

[11:20] Team_084 possession (Score: 20-22)
Klay Thompson attempts a 3Pt. Wide open! John Iverson is 6.7 feet away. [MAN] Klay Thompson misses. Offensive rebound by Dejounte Ginobili! Dejounte Ginobili kicks it out.

[11:03] Team_084 possession (Score: 20-22)
Luka Sexton attempts a Layup. Contested by Jarrett Smith (2.3 feet, ZONE). LUKA SEXTON MAKES IT! Assist: Jarrett Booker
Score: 20-24

[10:47] Team_059 possession (Score: 20-24)
Nikola Jokic attempts a Layup. Wide open! Giannis Quickley is 6.3 feet away. [ZONE] NIKOLA JOKIC MAKES IT! Assist: Jarrett Smith
Score: 22-24

[10:32] Team_084 possession (Score: 22-24)
FOUL! Shooting foul on Nikola Jokic. Jarrett Booker to the line for 2 free throws. [Team fouls: 2] (Nikola Jokic: 1 personal fouls)   FT 1/2: GOOD   FT 2/2: GOOD Jarrett Booker makes 2/2 from the line.
Score: 22-26

[10:20] Team_059 possession (Score: 22-26)
Nikola Jokic attempts a Midrange. Wide open! Jarrett Booker is 8.5 feet away. [MAN] Nikola Jokic misses. Rebound secured by Klay Thompson.

[10:03] Team_084 possession (Score: 22-26)
Dejounte Ginobili attempts a 3Pt. Heavily contested by Blake Tatum (0.7 feet, MAN)! Dejounte Ginobili misses. Rebound secured by John Iverson.

[09:48] Team_059 possession (Score: 22-26)
John Iverson drives to the basket... John Iverson loses control! Ball rolls out of bounds! TURNOVER! (dead ball)

[09:48] Substitution (Team_059): Bam Wade OUT → Russell Quickley IN (stamina_rule2)

[09:48] Substitution (Team_059): Blake Tatum OUT → Scottie Ginobili IN (stamina_rule2)

[09:48] Substitution (Team_059): John Iverson OUT → Allen Giddey IN (stamina_rule2)

[09:48] Substitution (Team_059): Nikola Jokic OUT → Bones Middleton IN (stamina_rule2)

[09:48] Substitution (Team_059): Jarrett Smith OUT → LeBron Lowry IN (stamina_rule2)

[09:48] Substitution (Team_084): Luka Sexton OUT → Magic Bryant IN (stamina_rule2)

[09:48] Substitution (Team_084): Dejounte Ginobili OUT → Chris Parker IN (stamina_rule2)

[09:48] Substitution (Team_084): Klay Thompson OUT → Evan Quickley IN (stamina_rule2)

[09:48] Substitution (Team_084): Jarrett Booker OUT → Pascal Jackson IN (stamina_rule2)

[09:48] Substitution (Team_084): Giannis Quickley OUT → Dejounte Porzingis IN (stamina_rule2)

[09:34] Team_084 possession (Score: 22-26)
FOUL! Reach-in foul on Allen Giddey during the drive. [Team fouls: 3] No free throws, side out. (Allen Giddey: 1 personal fouls)

[09:21] Team_084 possession (Score: 22-26)
Dejounte Porzingis drives, LeBron Lowry stays with him. Dejounte Porzingis attempts a Dunk. Wide open! LeBron Lowry is 7.8 feet away. [MAN] DEJOUNTE PORZINGIS MAKES IT! Assist: Magic Bryant
Score: 22-28

[09:08] Team_059 possession (Score: 22-28)
FOUL! Shooting foul on Dejounte Porzingis. LeBron Lowry to the line for 2 free throws. [Team fouls: 2] (Dejounte Porzingis: 1 personal fouls)   FT 1/2: GOOD   FT 2/2: GOOD LeBron Lowry makes 2/2 from the line.
Score: 24-28

[08:51] Team_084 possession (Score: 24-28)
Chris Parker drives and kicks out. Dejounte Porzingis attempts a 3Pt. Contested by Russell Quickley (4.0 feet, ZONE). Dejounte Porzingis misses. Rebound secured by LeBron Lowry.

[08:38] Team_059 possession (Score: 24-28)
Allen Giddey attempts a 3Pt. Heavily contested by Evan Quickley (0.5 feet, MAN)! Allen Giddey misses. Rebound secured by Dejounte Porzingis.

[08:24] Team_084 possession (Score: 24-28)
Magic Bryant attempts a Layup. BLOCKED BY RUSSELL QUICKLEY! Ball is loose! Rebound secured by LeBron Lowry.

[08:11] Team_059 possession (Score: 24-28)
LeBron Lowry drives to the basket... LeBron Lowry throws a bad pass out of bounds! TURNOVER! (dead ball)

[07:55] Team_084 possession (Score: 24-28)
Dejounte Porzingis attempts a Layup. Contested by LeBron Lowry (4.3 feet, MAN). Dejounte Porzingis misses. Offensive rebound by Dejounte Porzingis! Dejounte Porzingis kicks it out.

[07:40] Team_084 possession (Score: 24-28)
Pascal Jackson attempts a Midrange. Wide open! Allen Giddey is 7.3 feet away. [ZONE] Pascal Jackson misses. Rebound secured by Bones Middleton.

[07:29] Team_059 possession (Score: 24-28)
FOUL! Shooting foul on Dejounte Porzingis. LeBron Lowry to the line for 2 free throws. [Team fouls: 3] (Dejounte Porzingis: 2 personal fouls)   FT 1/2: GOOD   FT 2/2: MISS LeBron Lowry makes 1/2 from the line. Rebound secured by Evan Quickley.
Score: 25-28

[07:16] Team_084 possession (Score: 25-28)
Dejounte Porzingis drives to the basket... FOUL! Offensive foul on Dejounte Porzingis! Bones Middleton drew the charge! [Team fouls: 4] (Dejounte Porzingis: 3 personal fouls) TURNOVER! (dead ball)

[07:02] Team_059 possession (Score: 25-28)
Russell Quickley attempts a 3Pt. Heavily contested by Magic Bryant (0.5 feet, ZONE)! RUSSELL QUICKLEY MAKES IT! Assist: LeBron Lowry
Score: 28-28

[06:50] Team_084 possession (Score: 28-28)
Magic Bryant attempts a 3Pt. Heavily contested by Russell Quickley (0.7 feet, ZONE)! Magic Bryant misses. Rebound secured by Bones Middleton.

[06:35] Team_059 possession (Score: 28-28)
Scottie Ginobili loses the ball! Stripped by Chris Parker! TURNOVER! (live ball)

[06:19] Team_084 possession (Score: 28-28)
Dejounte Porzingis loses the ball! Stripped by LeBron Lowry! TURNOVER! (live ball)

[06:03] Team_059 possession (Score: 28-28)
Allen Giddey makes the 3Pt and draws the foul on Pascal Jackson! And-1! Allen Giddey to the line for 1. [BONUS: 5 team fouls] (Pascal Jackson: 1 personal fouls)   FT 1/1: GOOD Allen Giddey makes 1/1 from the line.
Score: 32-28

[05:47] Team_084 possession (Score: 32-28)
Pascal Jackson attempts a Midrange. Wide open! Bones Middleton is 6.3 feet away. [MAN] Pascal Jackson misses. Rebound secured by Bones Middleton.

[05:33] Team_059 possession (Score: 32-28)
Allen Giddey drives to the basket... Allen Giddey throws a bad pass! Stolen by Evan Quickley! TURNOVER! (live ball)

[05:15] Team_084 possession (Score: 32-28)
Chris Parker drives, Bones Middleton stays with him. Chris Parker attempts a Layup. Contested by Bones Middleton (3.9 feet, ZONE). Chris Parker misses. Rebound secured by LeBron Lowry.

[05:02] Team_059 possession (Score: 32-28)
Allen Giddey attempts a 3Pt. Contested by Pascal Jackson (5.2 feet, ZONE). Allen Giddey misses. Offensive rebound by Scottie Ginobili! Scottie Ginobili kicks it out.

[04:48] Team_059 possession (Score: 32-28)
Allen Giddey attempts a 3Pt. Contested by Evan Quickley (4.5 feet, MAN). Allen Giddey misses. Rebound secured by Evan Quickley.

[04:31] Team_084 possession (Score: 32-28)
Dejounte Porzingis attempts a 3Pt. Wide open! Russell Quickley is 7.4 feet away. [ZONE] Dejounte Porzingis misses. Rebound secured by Scottie Ginobili.

[04:18] Team_059 possession (Score: 32-28)
LeBron Lowry drives, Dejounte Porzingis stays with him. LeBron Lowry attempts a Dunk. Wide open! Dejounte Porzingis is 6.8 feet away. [MAN] LeBron Lowry misses. Offensive rebound by Bones Middleton! Bones Middleton kicks it out.

[04:03] Team_059 possession (Score: 32-28)
Bones Middleton attempts a Layup. Wide open! Dejounte Porzingis is 6.5 feet away. [ZONE] BONES MIDDLETON MAKES IT! Assist: Allen Giddey
Score: 34-28

[03:53] Team_084 possession (Score: 34-28)
Chris Parker drives, Bones Middleton stays with him. Chris Parker attempts a Layup. Wide open! Bones Middleton is 6.6 feet away. [ZONE] Chris Parker misses. Offensive rebound by Dejounte Porzingis! Dejounte Porzingis kicks it out.

[03:37] Team_084 possession (Score: 34-28)
Chris Parker attempts a 3Pt. Contested by Scottie Ginobili (5.4 feet, MAN). Chris Parker misses. Rebound secured by LeBron Lowry.

[03:19] Team_059 possession (Score: 34-28)
Allen Giddey attempts a 3Pt. Contested by Evan Quickley (5.6 feet, MAN). ALLEN GIDDEY MAKES IT! Assist: Russell Quickley
Score: 37-28

[03:00] Team_084 possession (Score: 37-28)
Chris Parker attempts a Midrange. Wide open! Scottie Ginobili is 7.2 feet away. [MAN] Chris Parker misses. Offensive rebound by Dejounte Porzingis! Dejounte Porzingis kicks it out.

[02:45] Team_084 possession (Score: 37-28)
Evan Quickley attempts a 3Pt. Contested by Russell Quickley (3.7 feet, ZONE). EVAN QUICKLEY MAKES IT! Assist: Chris Parker
Score: 37-31

[02:30] Team_059 possession (Score: 37-31)
Russell Quickley drives, Magic Bryant stays with him. Russell Quickley attempts a Dunk. Contested by Magic Bryant (5.2 feet, MAN). Russell Quickley misses. FOUL! Loose ball foul on Evan Quickley during the rebound battle. [IN THE BONUS! 6 team fouls] Scottie Ginobili to the line for 2 free throws. (Evan Quickley: 1 personal fouls)   FT 1/2: GOOD   FT 2/2: MISS Scottie Ginobili makes 1/2 from the line. Offensive rebound by Bones Middleton! Bones Middleton kicks it out.
Score: 38-31

[02:16] Team_059 possession (Score: 38-31)
FOUL! Reach-in foul on Magic Bryant during the drive. [IN THE BONUS! 7 team fouls] Russell Quickley to the line for 2 free throws. (Magic Bryant: 1 personal fouls)   FT 1/2: GOOD   FT 2/2: MISS Russell Quickley makes 1/2 from the line. Rebound secured by Pascal Jackson.
Score: 39-31

[02:02] Team_084 possession (Score: 39-31)
Magic Bryant drives, picks up Russell Quickley. Help arrives from Scottie Ginobili! Magic Bryant attempts a Layup. Contested by Scottie Ginobili (4.1 feet, MAN). Magic Bryant misses. Rebound secured by Scottie Ginobili.

[01:45] Team_059 possession (Score: 39-31)
Scottie Ginobili attempts a Layup. Wide open! Dejounte Porzingis is 7.0 feet away. [ZONE] Scottie Ginobili misses. Offensive rebound by Scottie Ginobili! Scottie Ginobili kicks it out.

[01:32] Team_059 possession (Score: 39-31)
LeBron Lowry drives, Dejounte Porzingis stays with him. LeBron Lowry attempts a Layup. Wide open! Dejounte Porzingis is 6.3 feet away. [ZONE] LeBron Lowry misses. Rebound secured by Dejounte Porzingis.

[01:18] Team_084 possession (Score: 39-31)
FOUL! Holding foul on Allen Giddey. [Team fouls: 4] No free throws, side out. (Allen Giddey: 2 personal fouls)

[01:07] Team_084 possession (Score: 39-31)
FOUL! Shooting foul on Russell Quickley. Evan Quickley to the line for 3 free throws. [BONUS: 5 team fouls] (Russell Quickley: 1 personal fouls)   FT 1/3: GOOD   FT 2/3: GOOD   FT 3/3: GOOD Evan Quickley makes 3/3 from the line.
Score: 39-34

[00:53] Team_059 possession (Score: 39-34)
FOUL! Shooting foul on Dejounte Porzingis. LeBron Lowry to the line for 2 free throws. [BONUS: 8 team fouls] (Dejounte Porzingis: 4 personal fouls)   FT 1/2: GOOD   FT 2/2: GOOD LeBron Lowry makes 2/2 from the line.
Score: 41-34

[00:41] Team_084 possession (Score: 41-34)
Pascal Jackson attempts a 3Pt. Contested by Scottie Ginobili (4.9 feet, ZONE). Pascal Jackson misses. FOUL! Loose ball foul on Bones Middleton during the rebound battle. [IN THE BONUS! 6 team fouls] Dejounte Porzingis to the line for 2 free throws. (Bones Middleton: 1 personal fouls)   FT 1/2: GOOD   FT 2/2: MISS Dejounte Porzingis makes 1/2 from the line. Offensive rebound by Pascal Jackson! Pascal Jackson kicks it out.
Score: 41-35

[00:25] Team_084 possession (Score: 41-35)
Pascal Jackson attempts a Midrange. Contested by Bones Middleton (3.4 feet, ZONE). Pascal Jackson misses. Offensive rebound by Pascal Jackson! Pascal Jackson kicks it out.

[00:09] Team_084 possession (Score: 41-35)
Evan Quickley drives and kicks out. Pascal Jackson attempts a Midrange. Contested by Scottie Ginobili (4.6 feet, ZONE). Pascal Jackson misses. Offensive rebound by Dejounte Porzingis! Dejounte Porzingis kicks it out.

================================================================================
                              2ND QUARTER COMPLETE                              
================================================================================

2ND QUARTER SCORE: Team_059 25, Team_084 14

BOX SCORE:
================================================================================

Team_059
--------------------------------------------------------------------------------
Player                MIN  PTS  REB  AST  TO      FG   FG%      3P   3P%
--------------------------------------------------------------------------------
Allen Giddey           10    7    0    1   0   2/4    50.0     0/0   0.0
LeBron Lowry           10    4    4    1   0   2/4    50.0     0/0   0.0
Bam Wade               14    3    0    0   0   1/1   100.0     0/0   0.0
Russell Quickley       10    3    0    1   0   1/2    50.0     0/0   0.0
Nikola Jokic           14    2    0    0   0   1/3    33.3     0/0   0.0
Bones Middleton        10    2    5    0   0   1/1   100.0     0/0   0.0
Jarrett Smith          14    0    1    1   0   0/0     0.0     0/0   0.0
John Iverson           14    0    1    1   0   0/0     0.0     0/0   0.0
Scottie Ginobili       10    0    4    0   0   0/0     0.0     0/0   0.0

TEAM: FG: 8/15 (53.3%), 3PT: 4/6 (66.7%), REB: 15 (4 off, 11 def), AST: 5, TO: 4
TEAM FOULS: 6 [Team_084 in BONUS]


Team_084
--------------------------------------------------------------------------------
Player                MIN  PTS  REB  AST  TO      FG   FG%      3P   3P%
--------------------------------------------------------------------------------
Evan Quickley          10    6    2    0   0   2/2   100.0     0/0   0.0
Jarrett Booker         14    2    0    1   0   1/2    50.0     0/0   0.0
Luka Sexton            14    2    0    0   0   1/1   100.0     0/0   0.0
Dejounte Porzingis     10    2    6    0   0   1/2    50.0     0/0   0.0
Dejounte Ginobili      14    0    2    0   0   0/1     0.0     0/0   0.0
Klay Thompson          14    0    1    0   0   0/0     0.0     0/0   0.0
Magic Bryant           10    0    0    1   0   0/3     0.0     0/0   0.0
Chris Parker           10    0    0    1   0   0/3     0.0     0/0   0.0
Pascal Jackson         10    0    3    0   0   0/2     0.0     0/0   0.0

TEAM: FG: 5/16 (31.2%), 3PT: 2/7 (28.6%), REB: 14 (7 off, 7 def), AST: 3, TO: 2
TEAM FOULS: 8 [Team_059 in BONUS]

================================================================================

================================================================================
                       3RD QUARTER - Team_059 vs Team_084                       
================================================================================

[12:00] Team_059 possession (Score: 41-35)
Jarrett Smith drives, Giannis Quickley stays with him. Jarrett Smith attempts a Dunk. Wide open! Giannis Quickley is 6.0 feet away. [ZONE] JARRETT SMITH MAKES IT!
Score: 43-35

[11:50] Team_084 possession (Score: 43-35)
Giannis Quickley drives and kicks out. Giannis Quickley attempts a 3Pt. Wide open! Bam Wade is 7.4 feet away. [ZONE] Giannis Quickley misses. Rebound secured by John Iverson.

[11:35] Team_059 possession (Score: 43-35)
Blake Tatum attempts a Midrange. Wide open! Dejounte Ginobili is 7.5 feet away. [MAN] Blake Tatum misses. Rebound secured by Dejounte Ginobili.

[11:23] Team_084 possession (Score: 43-35)
Klay Thompson drives, Jarrett Smith stays with him. Klay Thompson attempts a Dunk. Contested by Jarrett Smith (2.7 feet, ZONE). KLAY THOMPSON MAKES IT!
Score: 43-37

[11:06] Team_059 possession (Score: 43-37)
John Iverson attempts a Layup. BLOCKED BY KLAY THOMPSON! Ball is loose! Rebound secured by Giannis Quickley.

[10:54] Team_084 possession (Score: 43-37)
Giannis Quickley drives, Jarrett Smith stays with him. Giannis Quickley attempts a Dunk. Contested by Jarrett Smith (4.9 feet, ZONE). GIANNIS QUICKLEY MAKES IT! Assist: Jarrett Booker
Score: 43-39

[10:40] Team_059 possession (Score: 43-39)
Jarrett Smith loses the ball! Stripped by Giannis Quickley! TURNOVER! (live ball)

[10:23] Team_084 possession (Score: 43-39)
Klay Thompson attempts a 3Pt. Wide open! John Iverson is 6.5 feet away. [MAN] Klay Thompson misses. Rebound secured by John Iverson.

[10:09] Team_059 possession (Score: 43-39)
Jarrett Smith attempts a Layup. Wide open! Giannis Quickley is 7.3 feet away. [MAN] JARRETT SMITH MAKES IT! Assist: John Iverson
Score: 45-39

[09:49] Team_084 possession (Score: 45-39)
Dejounte Ginobili attempts a 3Pt. Contested by Blake Tatum (5.1 feet, MAN). Dejounte Ginobili misses. Rebound secured by Jarrett Smith.

[09:34] Team_059 possession (Score: 45-39)
Blake Tatum drives and kicks out. Bam Wade attempts a 3Pt. Contested by Luka Sexton (3.5 feet, ZONE). Bam Wade misses. Rebound secured by Klay Thompson.

[09:18] Team_084 possession (Score: 45-39)
Jarrett Booker makes the Layup and draws the foul on Jarrett Smith! And-1! Jarrett Booker to the line for 1. [Team fouls: 1] (Jarrett Smith: 1 personal fouls)   FT 1/1: GOOD Jarrett Booker makes 1/1 from the line.
Score: 45-42

[09:06] Team_059 possession (Score: 45-42)
Nikola Jokic drives, Giannis Quickley stays with him. Nikola Jokic attempts a Dunk. Wide open! Giannis Quickley is 6.9 feet away. [ZONE] NIKOLA JOKIC MAKES IT! Assist: Blake Tatum
Score: 47-42

[08:50] Team_084 possession (Score: 47-42)
Jarrett Booker attempts a Midrange. Wide open! Nikola Jokic is 7.9 feet away. [MAN] JARRETT BOOKER MAKES IT! Assist: Giannis Quickley
Score: 47-44

[08:33] Team_059 possession (Score: 47-44)
Bam Wade attempts a 3Pt. Contested by Luka Sexton (4.3 feet, MAN). Bam Wade misses. Rebound secured by Giannis Quickley.

[08:23] Team_084 possession (Score: 47-44)
Klay Thompson attempts a Midrange. Contested by John Iverson (5.8 feet, MAN). Klay Thompson misses. Rebound secured by John Iverson.

[08:10] Team_059 possession (Score: 47-44)
Bam Wade attempts a 3Pt. Contested by Luka Sexton (4.5 feet, MAN). Bam Wade misses. Offensive rebound by Jarrett Smith! Jarrett Smith kicks it out.

[07:53] Team_059 possession (Score: 47-44)
Blake Tatum attempts a 3Pt. Heavily contested by Dejounte Ginobili (0.5 feet, MAN)! Blake Tatum misses. Rebound secured by Klay Thompson.

[07:40] Team_084 possession (Score: 47-44)
Luka Sexton attempts a Midrange. Contested by Jarrett Smith (5.9 feet, ZONE). Luka Sexton misses. Offensive rebound by Dejounte Ginobili! Dejounte Ginobili kicks it out.

[07:27] Team_084 possession (Score: 47-44)
Giannis Quickley attempts a Layup. Contested by Jarrett Smith (3.4 feet, MAN). GIANNIS QUICKLEY MAKES IT!
Score: 47-46

[07:14] Team_059 possession (Score: 47-46)
Nikola Jokic drives and kicks out. Blake Tatum attempts a 3Pt. BLOCKED BY DEJOUNTE GINOBILI! Ball deflects out of bounds off Blake Tatum.

[07:01] Team_084 possession (Score: 47-46)
Luka Sexton attempts a 3Pt. Contested by Bam Wade (2.9 feet, ZONE). Luka Sexton misses. FOUL! Loose ball foul on Jarrett Smith during the rebound battle. [Team fouls: 2] No free throws, side out. (Jarrett Smith: 2 personal fouls)

[06:48] Team_084 possession (Score: 47-46)
Giannis Quickley makes the Layup and draws the foul on Jarrett Smith! And-1! Giannis Quickley to the line for 1. [Team fouls: 3] (Jarrett Smith: 3 personal fouls)   FT 1/1: GOOD Giannis Quickley makes 1/1 from the line.
Score: 47-49

[06:32] Team_059 possession (Score: 47-49)
Blake Tatum attempts a Midrange. Contested by Jarrett Booker (5.2 feet, ZONE). BLAKE TATUM MAKES IT! Assist: Nikola Jokic
Score: 49-49

[06:18] Team_084 possession (Score: 49-49)
FOUL! Reach-in foul on John Iverson during the drive. [Team fouls: 4] No free throws, side out. (John Iverson: 1 personal fouls)

[06:01] Team_084 possession (Score: 49-49)
Luka Sexton attempts a 3Pt. Contested by Bam Wade (2.1 feet, MAN). Luka Sexton misses. Rebound secured by Jarrett Smith.

[05:48] Team_059 possession (Score: 49-49)
Jarrett Smith drives and kicks out. John Iverson attempts a 3Pt. Heavily contested by Luka Sexton (0.5 feet, ZONE)! John Iverson misses. Offensive rebound by John Iverson! John Iverson kicks it out.

[05:36] Team_059 possession (Score: 49-49)
Bam Wade throws a bad pass out of bounds! TURNOVER! (dead ball)

[05:23] Team_084 possession (Score: 49-49)
Luka Sexton drives and kicks out. Jarrett Booker attempts a Midrange. Contested by Nikola Jokic (5.8 feet, MAN). Jarrett Booker misses. Rebound secured by John Iverson.

[05:09] Team_059 possession (Score: 49-49)
Blake Tatum attempts a 3Pt. Contested by Luka Sexton (4.5 feet, ZONE). Blake Tatum misses. Offensive rebound by Jarrett Smith! Jarrett Smith kicks it out.

[05:00] Team_059 possession (Score: 49-49)
Nikola Jokic attempts a Layup. BLOCKED BY JARRETT BOOKER! Ball is loose! Rebound secured by Giannis Quickley.

[04:44] Team_084 possession (Score: 49-49)
Jarrett Booker attempts a 3Pt. Contested by Nikola Jokic (5.0 feet, MAN). Jarrett Booker misses. Offensive rebound by Giannis Quickley! Giannis Quickley puts it back in!
Score: 49-51

[04:28] Team_059 possession (Score: 49-51)
Bam Wade attempts a 3Pt. Contested by Luka Sexton (3.4 feet, ZONE). BAM WADE MAKES IT! Assist: Blake Tatum
Score: 52-51

[04:11] Team_084 possession (Score: 52-51)
FOUL! Shooting foul on Nikola Jokic. Giannis Quickley to the line for 2 free throws. [BONUS: 5 team fouls] (Nikola Jokic: 1 personal fouls)   FT 1/2: GOOD   FT 2/2: GOOD Giannis Quickley makes 2/2 from the line.
Score: 52-53

[04:00] Team_059 possession (Score: 52-53)
Nikola Jokic attempts a Midrange. Contested by Klay Thompson (5.5 feet, ZONE). NIKOLA JOKIC MAKES IT!
Score: 54-53

[03:45] Team_084 possession (Score: 54-53)
FOUL! Reach-in foul on John Iverson during the drive. [IN THE BONUS! 6 team fouls] Klay Thompson to the line for 2 free throws. (John Iverson: 2 personal fouls)   FT 1/2: GOOD   FT 2/2: GOOD Klay Thompson makes 2/2 from the line.
Score: 54-55

[03:27] Team_059 possession (Score: 54-55)
Jarrett Smith attempts a Layup. Contested by Giannis Quickley (5.3 feet, MAN). JARRETT SMITH MAKES IT! Assist: Nikola Jokic
Score: 56-55

[03:12] Team_084 possession (Score: 56-55)
Klay Thompson attempts a Midrange. Contested by Blake Tatum (3.8 feet, ZONE). Klay Thompson misses. Rebound secured by Bam Wade.

[02:58] Team_059 possession (Score: 56-55)
Nikola Jokic attempts a 3Pt. Contested by Jarrett Booker (3.7 feet, MAN). Nikola Jokic misses. Rebound secured by Klay Thompson.

[02:42] Team_084 possession (Score: 56-55)
Dejounte Ginobili attempts a 3Pt. Contested by Blake Tatum (4.3 feet, MAN). Dejounte Ginobili misses. Rebound secured by John Iverson.

[02:28] Team_059 possession (Score: 56-55)
Bam Wade attempts a 3Pt. Contested by Luka Sexton (2.6 feet, MAN). Bam Wade misses. Rebound secured by Dejounte Ginobili.

[02:09] Team_084 possession (Score: 56-55)
Giannis Quickley drives, Jarrett Smith stays with him. Giannis Quickley attempts a Layup. Contested by Jarrett Smith (5.7 feet, MAN). Giannis Quickley misses. Offensive rebound by Giannis Quickley! Giannis Quickley puts it back in!
Score: 56-57

[01:55] Team_059 possession (Score: 56-57)
FOUL! Holding foul on Dejounte Ginobili. [Team fouls: 1] No free throws, side out. (Dejounte Ginobili: 1 personal fouls)

[01:37] Team_059 possession (Score: 56-57)
Jarrett Smith attempts a Layup. Contested by Giannis Quickley (3.3 feet, ZONE). Jarrett Smith misses. Rebound secured by Dejounte Ginobili.

[01:23] Team_084 possession (Score: 56-57)
Dejounte Ginobili makes the Dunk and draws the foul on Bam Wade! And-1! Dejounte Ginobili to the line for 1. [BONUS: 7 team fouls] (Bam Wade: 1 personal fouls)   FT 1/1: GOOD Dejounte Ginobili makes 1/1 from the line.
Score: 56-60

[01:09] Team_059 possession (Score: 56-60)
Blake Tatum attempts a Midrange. Wide open! Dejounte Ginobili is 6.5 feet away. [ZONE] Blake Tatum misses. Rebound secured by Dejounte Ginobili.

[00:57] Team_084 possession (Score: 56-60)
Klay Thompson attempts a Midrange. Contested by John Iverson (4.7 feet, MAN). Klay Thompson misses. Rebound secured by John Iverson.

[00:42] Team_059 possession (Score: 56-60)
Blake Tatum attempts a Midrange. Wide open! Dejounte Ginobili is 6.4 feet away. [MAN] Blake Tatum misses. FOUL! Loose ball foul on Giannis Quickley during the rebound battle. [Team fouls: 2] No free throws, side out. (Giannis Quickley: 1 personal fouls)

[00:26] Team_059 possession (Score: 56-60)
Nikola Jokic drives, Jarrett Booker stays with him. Nikola Jokic attempts a Dunk. Wide open! Jarrett Booker is 7.0 feet away. [MAN] NIKOLA JOKIC MAKES IT! Assist: Blake Tatum
Score: 58-60

[00:12] Team_084 possession (Score: 58-60)
Luka Sexton attempts a Layup. Wide open! Jarrett Smith is 7.1 feet away. [ZONE] LUKA SEXTON MAKES IT!
Score: 58-62

[00:01] Team_059 possession (Score: 58-62)
Jarrett Smith drives and kicks out. John Iverson attempts a Midrange. Heavily contested by Klay Thompson (1.3 feet, ZONE)! JOHN IVERSON MAKES IT! Assist: Bam Wade
Score: 60-62

================================================================================
                              3RD QUARTER COMPLETE                              
================================================================================

3RD QUARTER SCORE: Team_059 19, Team_084 27

BOX SCORE:
================================================================================

Team_059
--------------------------------------------------------------------------------
Player                MIN  PTS  REB  AST  TO      FG   FG%      3P   3P%
--------------------------------------------------------------------------------
Jarrett Smith          26    6    5    0   0   3/4    75.0     0/0   0.0
Nikola Jokic           26    6    0    2   0   3/6    50.0     0/0   0.0
Bam Wade               26    3    1    1   0   1/3    33.3     0/0   0.0
John Iverson           26    2    7    1   0   1/2    50.0     0/0   0.0
Blake Tatum            26    2    0    3   0   1/5    20.0     0/0   0.0

TEAM: FG: 9/20 (45.0%), 3PT: 1/5 (20.0%), REB: 13 (4 off, 9 def), AST: 7, TO: 2
TEAM FOULS: 7 [Team_084 in BONUS]


Team_084
--------------------------------------------------------------------------------
Player                MIN  PTS  REB  AST  TO      FG   FG%      3P   3P%
--------------------------------------------------------------------------------
Giannis Quickley       26   13    6    1   0   6/7    85.7     0/0   0.0
Jarrett Booker         26    5    0    1   0   2/2   100.0     0/0   0.0
Klay Thompson          26    4    3    0   0   2/6    33.3     0/0   0.0
Dejounte Ginobili      26    3    5    0   0   1/3    33.3     0/0   0.0
Luka Sexton            26    2    0    0   0   1/3    33.3     0/0   0.0

TEAM: FG: 12/21 (57.1%), 3PT: 1/5 (20.0%), REB: 14 (4 off, 10 def), AST: 2, TO: 0
TEAM FOULS: 2

================================================================================

================================================================================
                       4TH QUARTER - Team_059 vs Team_084                       
================================================================================

[12:00] Team_059 possession (Score: 60-62)
Bam Wade attempts a 3Pt. Wide open! Luka Sexton is 6.0 feet away. [MAN] Bam Wade misses. Rebound secured by Dejounte Ginobili.

[11:43] Team_084 possession (Score: 60-62)
Jarrett Booker attempts a Midrange. Contested by Nikola Jokic (6.0 feet, MAN). JARRETT BOOKER MAKES IT! Assist: Luka Sexton
Score: 60-64

[11:33] Team_059 possession (Score: 60-64)
Blake Tatum attempts a 3Pt. Heavily contested by Luka Sexton (1.9 feet, ZONE)! BLAKE TATUM MAKES IT! Assist: John Iverson
Score: 63-64

[11:15] Team_084 possession (Score: 63-64)
Dejounte Ginobili drives and kicks out. Luka Sexton attempts a 3Pt. Contested by Bam Wade (3.7 feet, MAN). Luka Sexton misses. Rebound secured by John Iverson.

[10:59] Team_059 possession (Score: 63-64)
John Iverson attempts a 3Pt. Contested by Klay Thompson (3.9 feet, MAN). John Iverson misses. Offensive rebound by Jarrett Smith! Jarrett Smith kicks it out.

[10:45] Team_059 possession (Score: 63-64)
FOUL! Shooting foul on Jarrett Booker. Nikola Jokic to the line for 2 free throws. [Team fouls: 1] (Jarrett Booker: 1 personal fouls)   FT 1/2: MISS   FT 2/2: GOOD Nikola Jokic makes 1/2 from the line.
Score: 64-64

[10:32] Team_084 possession (Score: 64-64)
Klay Thompson drives, Jarrett Smith stays with him. Klay Thompson attempts a Dunk. Contested by Jarrett Smith (6.0 feet, ZONE). Klay Thompson misses. Offensive rebound by Giannis Quickley! Giannis Quickley's putback is no good. Rebound secured by Jarrett Smith.

[10:15] Team_059 possession (Score: 64-64)
Blake Tatum attempts a 3Pt. Contested by Jarrett Booker (5.8 feet, ZONE). Blake Tatum misses. Rebound secured by Giannis Quickley.

[09:59] Team_084 possession (Score: 64-64)
Dejounte Ginobili attempts a Layup. Wide open! Jarrett Smith is 7.8 feet away. [ZONE] DEJOUNTE GINOBILI MAKES IT!
Score: 64-66

[09:45] Team_059 possession (Score: 64-66)
FOUL! Shooting foul on Giannis Quickley. Jarrett Smith to the line for 2 free throws. [Team fouls: 2] (Giannis Quickley: 1 personal fouls)   FT 1/2: GOOD   FT 2/2: GOOD Jarrett Smith makes 2/2 from the line.
Score: 66-66

[09:34] Team_084 possession (Score: 66-66)
Klay Thompson attempts a 3Pt. Wide open! John Iverson is 6.8 feet away. [MAN] KLAY THOMPSON MAKES IT! Assist: Dejounte Ginobili
Score: 66-69

[09:19] Team_059 possession (Score: 66-69)
John Iverson drives, picks up Giannis Quickley. Help arrives from Dejounte Ginobili! John Iverson attempts a Dunk. Wide open! Dejounte Ginobili is 6.4 feet away. [ZONE] JOHN IVERSON MAKES IT! Assist: Bam Wade
Score: 68-69

[09:05] Team_084 possession (Score: 68-69)
Giannis Quickley makes the Layup and draws the foul on Jarrett Smith! And-1! Giannis Quickley to the line for 1. [Team fouls: 1] (Jarrett Smith: 1 personal fouls)   FT 1/1: GOOD Giannis Quickley makes 1/1 from the line.
Score: 68-72

[08:47] Team_059 possession (Score: 68-72)
Blake Tatum attempts a 3Pt. Wide open! Dejounte Ginobili is 6.0 feet away. [MAN] Blake Tatum misses. Offensive rebound by Jarrett Smith! Jarrett Smith kicks it out.

[08:29] Team_059 possession (Score: 68-72)
Nikola Jokic drives and kicks out. FOUL! Shooting foul on Luka Sexton. Jarrett Smith to the line for 3 free throws. [Team fouls: 3] (Luka Sexton: 1 personal fouls)   FT 1/3: MISS   FT 2/3: GOOD   FT 3/3: GOOD Jarrett Smith makes 2/3 from the line.
Score: 70-72

[08:16] Team_084 possession (Score: 70-72)
Jarrett Booker drives, picks up Jarrett Smith. Help arrives from Bam Wade! Jarrett Booker attempts a Dunk. Wide open! Bam Wade is 6.2 feet away. [ZONE] JARRETT BOOKER MAKES IT! Assist: Luka Sexton
Score: 70-74

[07:58] Team_059 possession (Score: 70-74)
Blake Tatum attempts a 3Pt. Contested by Dejounte Ginobili (4.1 feet, MAN). BLAKE TATUM MAKES IT! Assist: Bam Wade
Score: 73-74

[07:41] Team_084 possession (Score: 73-74)
Klay Thompson attempts a Midrange. Contested by John Iverson (4.9 feet, MAN). KLAY THOMPSON MAKES IT! Assist: Jarrett Booker
Score: 73-76

[07:30] Team_059 possession (Score: 73-76)
John Iverson loses the ball! Stripped by Klay Thompson! TURNOVER! (live ball)

[07:14] Team_084 possession (Score: 73-76)
Klay Thompson attempts a 3Pt. Contested by Bam Wade (5.5 feet, ZONE). Klay Thompson misses. Rebound secured by John Iverson.

[07:03] Team_059 possession (Score: 73-76)
Jarrett Smith attempts a Layup. Heavily contested by Giannis Quickley (1.5 feet, ZONE)! JARRETT SMITH MAKES IT!
Score: 75-76

[06:47] Team_084 possession (Score: 75-76)
Jarrett Booker attempts a 3Pt. Contested by Nikola Jokic (4.0 feet, MAN). JARRETT BOOKER MAKES IT! Assist: Klay Thompson
Score: 75-79

[06:29] Team_059 possession (Score: 75-79)
Bam Wade attempts a 3Pt. Wide open! Klay Thompson is 6.6 feet away. [ZONE] Bam Wade misses. Rebound secured by Klay Thompson.

[06:12] Team_084 possession (Score: 75-79)
FOUL! Shooting foul on Nikola Jokic. Klay Thompson to the line for 2 free throws. [Team fouls: 2] (Nikola Jokic: 1 personal fouls)   FT 1/2: GOOD   FT 2/2: GOOD Klay Thompson makes 2/2 from the line.
Score: 75-81

[05:58] Team_059 possession (Score: 75-81)
Jarrett Smith drives and kicks out. Jarrett Smith attempts a 3Pt. Contested by Luka Sexton (3.9 feet, ZONE). Jarrett Smith misses. Offensive rebound by Jarrett Smith! Jarrett Smith kicks it out.

[05:40] Team_059 possession (Score: 75-81)
Nikola Jokic attempts a 3Pt. Wide open! Jarrett Booker is 6.0 feet away. [MAN] Nikola Jokic misses. Offensive rebound by John Iverson! John Iverson kicks it out.

[05:22] Team_059 possession (Score: 75-81)
Blake Tatum attempts a Layup. Wide open! Giannis Quickley is 6.2 feet away. [ZONE] BLAKE TATUM MAKES IT! Assist: Jarrett Smith
Score: 77-81

[05:08] Team_084 possession (Score: 77-81)
Dejounte Ginobili drives, picks up Blake Tatum. Help arrives from Bam Wade! Dejounte Ginobili attempts a Layup. Contested by Bam Wade (5.9 feet, MAN). DEJOUNTE GINOBILI MAKES IT! Assist: Giannis Quickley
Score: 77-83

[04:49] Team_059 possession (Score: 77-83)
Nikola Jokic attempts a Midrange. Wide open! Luka Sexton is 6.3 feet away. [ZONE] NIKOLA JOKIC MAKES IT!
Score: 79-83

[04:33] Team_084 possession (Score: 79-83)
Giannis Quickley attempts a Layup. Contested by Jarrett Smith (5.5 feet, ZONE). GIANNIS QUICKLEY MAKES IT!
Score: 79-85

[04:20] Team_059 possession (Score: 79-85)
John Iverson throws a bad pass! Stolen by Klay Thompson! TURNOVER! (live ball)

[04:06] Team_084 possession (Score: 79-85)
Klay Thompson drives, Jarrett Smith stays with him. Klay Thompson attempts a Layup. Wide open! Jarrett Smith is 6.2 feet away. [ZONE] Klay Thompson misses. Offensive rebound by Giannis Quickley! Giannis Quickley kicks it out.

[03:50] Team_084 possession (Score: 79-85)
Luka Sexton drives and kicks out. Giannis Quickley attempts a 3Pt. Contested by Bam Wade (5.8 feet, ZONE). Giannis Quickley misses. Rebound secured by John Iverson.

[03:37] Team_059 possession (Score: 79-85)
Blake Tatum attempts a Layup. Wide open! Dejounte Ginobili is 7.4 feet away. [MAN] BLAKE TATUM MAKES IT! Assist: John Iverson
Score: 81-85

[03:23] Team_084 possession (Score: 81-85)
Luka Sexton makes the Layup and draws the foul on Bam Wade! And-1! Luka Sexton to the line for 1. [Team fouls: 3] (Bam Wade: 1 personal fouls)   FT 1/1: GOOD Luka Sexton makes 1/1 from the line.
Score: 81-88

[03:05] Team_059 possession (Score: 81-88)
Nikola Jokic attempts a 3Pt. Contested by Luka Sexton (4.5 feet, ZONE). NIKOLA JOKIC MAKES IT! Assist: Bam Wade
Score: 84-88

[02:52] Team_084 possession (Score: 84-88)
Dejounte Ginobili attempts a 3Pt. Wide open! Bam Wade is 6.7 feet away. [ZONE] DEJOUNTE GINOBILI MAKES IT! Assist: Giannis Quickley
Score: 84-91

[02:37] Team_059 possession (Score: 84-91)
Bam Wade attempts a 3Pt. Wide open! Luka Sexton is 7.1 feet away. [ZONE] Bam Wade misses. Rebound secured by Giannis Quickley.

[02:22] Team_084 possession (Score: 84-91)
Jarrett Booker attempts a 3Pt. Contested by Bam Wade (5.8 feet, ZONE). Jarrett Booker misses. Offensive rebound by Giannis Quickley! Giannis Quickley kicks it out.

[02:10] Team_084 possession (Score: 84-91)
Luka Sexton drives and kicks out. Luka Sexton attempts a 3Pt. Wide open! Bam Wade is 7.2 feet away. [ZONE] Luka Sexton misses. Rebound secured by Nikola Jokic.

[01:55] Team_059 possession (Score: 84-91)
Jarrett Smith makes the Layup and draws the foul on Giannis Quickley! And-1! Jarrett Smith to the line for 1. [Team fouls: 4] (Giannis Quickley: 2 personal fouls)   FT 1/1: GOOD Jarrett Smith makes 1/1 from the line.
Score: 87-91

[01:40] Team_084 possession (Score: 87-91)
FOUL! Reach-in foul on Jarrett Smith during the drive. [Team fouls: 4] No free throws, side out. (Jarrett Smith: 2 personal fouls)

[01:24] Team_084 possession (Score: 87-91)
Giannis Quickley attempts a Midrange. Wide open! John Iverson is 8.4 feet away. [ZONE] Giannis Quickley misses. Rebound secured by Jarrett Smith.

[01:12] Team_059 possession (Score: 87-91)
FOUL! Shooting foul on Giannis Quickley. John Iverson to the line for 2 free throws. [BONUS: 5 team fouls] (Giannis Quickley: 3 personal fouls)   FT 1/2: GOOD   FT 2/2: GOOD John Iverson makes 2/2 from the line.
Score: 89-91

[01:00] Team_084 possession (Score: 89-91)
Jarrett Booker drives to the basket... Jarrett Booker throws a bad pass! Stolen by Nikola Jokic! TURNOVER! (live ball)

[00:43] Team_059 possession (Score: 89-91)
Nikola Jokic drives to the basket... Nikola Jokic commits a violation (traveling/carry)! TURNOVER! (dead ball)

[00:43] Substitution (Team_059): Bam Wade OUT → Russell Quickley IN (stamina_rule2)

[00:43] Substitution (Team_059): Blake Tatum OUT → Scottie Ginobili IN (stamina_rule2)

[00:43] Substitution (Team_059): John Iverson OUT → Allen Giddey IN (stamina_rule2)

[00:43] Substitution (Team_059): Nikola Jokic OUT → Bones Middleton IN (stamina_rule2)

[00:43] Substitution (Team_059): Jarrett Smith OUT → LeBron Lowry IN (stamina_rule2)

[00:43] Substitution (Team_084): Luka Sexton OUT → Magic Bryant IN (stamina_rule2)

[00:43] Substitution (Team_084): Dejounte Ginobili OUT → Chris Parker IN (stamina_rule2)

[00:43] Substitution (Team_084): Klay Thompson OUT → Evan Quickley IN (stamina_rule2)

[00:43] Substitution (Team_084): Jarrett Booker OUT → Pascal Jackson IN (stamina_rule2)

[00:43] Substitution (Team_084): Giannis Quickley OUT → Dejounte Porzingis IN (stamina_rule2)

[00:27] Team_084 possession (Score: 89-91)
Pascal Jackson attempts a Layup. Wide open! Bones Middleton is 6.1 feet away. [MAN] Pascal Jackson misses. Rebound secured by LeBron Lowry.

[00:09] Team_059 possession (Score: 89-91)
Bones Middleton attempts a 3Pt. Wide open! Magic Bryant is 6.7 feet away. [ZONE] Bones Middleton misses. Rebound secured by Evan Quickley.

================================================================================
                              4TH QUARTER COMPLETE                              
================================================================================

4TH QUARTER SCORE: Team_059 29, Team_084 29

BOX SCORE:
================================================================================

Team_059
--------------------------------------------------------------------------------
Player                MIN  PTS  REB  AST  TO      FG   FG%      3P   3P%
--------------------------------------------------------------------------------
Blake Tatum            38   10    0    0   0   4/5    80.0     0/0   0.0
Jarrett Smith          38    9    5    1   0   4/4   100.0     0/0   0.0
Nikola Jokic           38    6    1    0   0   3/3   100.0     0/0   0.0
John Iverson           38    4    4    2   0   2/2   100.0     0/0   0.0
Bam Wade               38    0    0    3   0   0/3     0.0     0/0   0.0
LeBron Lowry           11    0    1    0   0   0/0     0.0     0/0   0.0
Bones Middleton        11    0    0    0   0   0/1     0.0     0/0   0.0

TEAM: FG: 13/18 (72.2%), 3PT: 3/8 (37.5%), REB: 10 (4 off, 6 def), AST: 6, TO: 3
TEAM FOULS: 4


Team_084
--------------------------------------------------------------------------------
Player                MIN  PTS  REB  AST  TO      FG   FG%      3P   3P%
--------------------------------------------------------------------------------
Dejounte Ginobili      38    7    1    1   0   3/4    75.0     0/0   0.0
Jarrett Booker         38    7    0    1   0   3/3   100.0     0/0   0.0
Klay Thompson          38    7    1    1   0   3/5    60.0     0/0   0.0
Giannis Quickley       38    5    4    2   0   2/3    66.7     0/0   0.0
Luka Sexton            38    3    0    2   0   1/3    33.3     0/0   0.0
Pascal Jackson         11    0    0    0   0   0/1     0.0     0/0   0.0
Evan Quickley          11    0    1    0   0   0/0     0.0     0/0   0.0

TEAM: FG: 12/19 (63.2%), 3PT: 3/4 (75.0%), REB: 8 (3 off, 5 def), AST: 7, TO: 1
TEAM FOULS: 5 [Team_059 in BONUS]

================================================================================

================================================================================
                               FULL GAME COMPLETE                               
================================================================================

FINAL SCORE: Team_059 89, Team_084 91

SCORING BY QUARTER:
--------------------------------------------------------------------------------
Team                     Q1     Q2     Q3     Q4    FINAL
--------------------------------------------------------------------------------
Team_059                 16     25     19     29       89
Team_084                 21     14     27     29       91
--------------------------------------------------------------------------------

FULL GAME BOX SCORE:
================================================================================

Team_059
--------------------------------------------------------------------------------
Player                MIN  PTS  REB  AST  TO      FG   FG%      3P   3P%      FT STL BLK
--------------------------------------------------------------------------------
Bam Wade               38    8    2    4   2   3/8    37.5   2/7    28.6   0/0     0   0
Blake Tatum            38   15    0    3   2   6/16   37.5   2/5    40.0   3/3     0   0
John Iverson           38    9   20    4   2   3/8    37.5   1/2    50.0   2/2     1   0
Nikola Jokic           38   19    1    4   1  10/18   55.6   2/4    50.0   2/4     1   0
Jarrett Smith          38   18   16    3   1   8/9    88.9   0/0     0.0   8/9     0   0
Russell Quickley       11    3    0    1   1   1/2    50.0   1/1   100.0   1/2     0   1
Scottie Ginobili       11    0    4    0   3   0/0     0.0   0/0     0.0   1/2     0   0
Allen Giddey           11    7    0    1   0   2/4    50.0   2/4    50.0   1/1     0   0
Bones Middleton        11    2    5    0   0   1/2    50.0   0/1     0.0   0/0     0   0
LeBron Lowry           11    4    5    1   0   2/4    50.0   0/0     0.0   5/6     1   0

TEAM: FG: 36/71 (50.7%), 3PT: 10/24 (41.7%), REB: 52 (17 off, 35 def), AST: 21, TO: 12


Team_084
--------------------------------------------------------------------------------
Player                MIN  PTS  REB  AST  TO      FG   FG%      3P   3P%      FT STL BLK
--------------------------------------------------------------------------------
Luka Sexton            38    7    0    3   0   3/11   27.3   0/4     0.0   1/1     0   0
Dejounte Ginobili      38   20   13    2   1   7/13   53.8   2/5    40.0   1/1     1   2
Klay Thompson          38   11    8    4   2   5/11   45.5   1/3    33.3   4/4     2   1
Jarrett Booker         38   14    0    4   1   8/10   80.0   2/4    50.0   4/6     0   1
Giannis Quickley       38   26   16    3   0  11/15   73.3   0/0     0.0   4/4     1   0
Magic Bryant           11    0    0    1   1   0/3     0.0   0/1     0.0   0/0     0   0
Chris Parker           11    0    0    1   0   0/3     0.0   0/1     0.0   0/0     1   0
Evan Quickley          11    6    3    1   0   2/2   100.0   2/2   100.0   3/3     1   0
Pascal Jackson         11    3    4    0   0   1/4    25.0   1/1   100.0   0/0     0   0
Dejounte Porzingis     11    2    6    0   1   1/2    50.0   0/1     0.0   1/2     0   0

TEAM: FG: 38/74 (51.4%), 3PT: 8/22 (36.4%), REB: 51 (17 off, 34 def), AST: 19, TO: 6

================================================================================
