================================================================================
                        FULL GAME - Team_050 vs Team_096                        
================================================================================

================================================================================
                       1ST QUARTER - Team_050 vs Team_096                       
================================================================================

[12:00] Team_050 possession (Score: 0-0)
Giannis LaVine throws a bad pass! Stolen by Terry Mobley! TURNOVER! (live ball)

[11:48] Team_096 possession (Score: 0-0)
Kyrie Adebayo attempts a Layup. Wide open! Donovan Trent is 6.3 feet away. [ZONE] KYRIE ADEBAYO MAKES IT!
Score: 0-2

[11:32] Team_050 possession (Score: 0-2)
Donovan Trent makes the Layup and draws the foul on Kyrie Adebayo! And-1! Donovan Trent to the line for 1. [Team fouls: 1] (Kyrie Adebayo: 1 personal fouls)   FT 1/1: GOOD Donovan Trent makes 1/1 from the line.
Score: 3-2

[11:19] Team_096 possession (Score: 3-2)
Scottie Herro attempts a Midrange. Contested by LeBron Bridges (4.2 feet, ZONE). Scottie Herro misses. Rebound secured by Collin Bane.

[11:02] Team_050 possession (Score: 3-2)
Collin Bane attempts a 3Pt. Contested by Cole Griffin (3.7 feet, ZONE). Collin Bane misses. Rebound secured by Kyrie Adebayo.

[10:49] Team_096 possession (Score: 3-2)
Scottie Herro loses the ball! Stripped by LeBron Bridges! TURNOVER! (live ball)

[10:33] Team_050 possession (Score: 3-2)
Donovan Trent attempts a Layup. BLOCKED BY LAMELO QUICKLEY! Ball goes out off Lamelo Quickley. Donovan Trent's ball!

[10:18] Team_050 possession (Score: 3-2)
Collin Bane attempts a Midrange. Contested by Cole Griffin (3.1 feet, MAN). Collin Bane misses. Offensive rebound by Collin Bane! Collin Bane kicks it out.

[10:02] Team_050 possession (Score: 3-2)
Giannis LaVine attempts a 3Pt. Contested by Cole Griffin (3.8 feet, ZONE). Giannis LaVine misses. Offensive rebound by Collin Bane! Collin Bane kicks it out.

[09:49] Team_050 possession (Score: 3-2)
LeBron Bridges drives, picks up Scottie Herro. Help arrives from Lamelo Quickley! LeBron Bridges attempts a Dunk. Contested by Lamelo Quickley (5.6 feet, MAN). LeBron Bridges misses. Offensive rebound by LeBron Bridges! LeBron Bridges kicks it out.

[09:35] Team_050 possession (Score: 3-2)
Giannis LaVine attempts a 3Pt. Contested by Cole Griffin (3.4 feet, ZONE). Giannis LaVine misses. Rebound secured by Cole Griffin.

[09:19] Team_096 possession (Score: 3-2)
Terry Mobley drives, LeBron Bridges stays with him. Terry Mobley attempts a Layup. Contested by LeBron Bridges (4.3 feet, ZONE). TERRY MOBLEY MAKES IT!
Score: 3-4

[09:02] Team_050 possession (Score: 3-4)
Donovan Trent attempts a Layup. BLOCKED BY KYRIE ADEBAYO! Ball is loose! Rebound secured by Kyrie Adebayo.

[08:45] Team_096 possession (Score: 3-4)
FOUL! Shooting foul on LeBron Bridges. Scottie Herro to the line for 2 free throws. [Team fouls: 1] (LeBron Bridges: 1 personal fouls)   FT 1/2: GOOD   FT 2/2: MISS Scottie Herro makes 1/2 from the line. Rebound secured by LeBron Bridges.
Score: 3-5

[08:30] Team_050 possession (Score: 3-5)
LeBron Bridges attempts a Midrange. Contested by Scottie Herro (2.0 feet, ZONE). LEBRON BRIDGES MAKES IT!
Score: 5-5

[08:16] Team_096 possession (Score: 5-5)
Scottie Herro attempts a 3Pt. Contested by LeBron Bridges (5.6 feet, MAN). Scottie Herro misses. Rebound secured by LeBron Bridges.

[08:03] Team_050 possession (Score: 5-5)
Donovan Trent drives to the basket... Donovan Trent loses control! Ball rolls out of bounds! TURNOVER! (dead ball)

[07:48] Team_096 possession (Score: 5-5)
Terry Mobley attempts a Layup. Wide open! Donovan Trent is 7.2 feet away. [ZONE] TERRY MOBLEY MAKES IT! Assist: Cole Griffin
Score: 5-7

[07:32] Team_050 possession (Score: 5-7)
Donovan Trent attempts a Layup. Contested by Kyrie Adebayo (3.6 feet, MAN). Donovan Trent misses. Rebound secured by Scottie Herro.

[07:18] Team_096 possession (Score: 5-7)
Lamelo Quickley attempts a Midrange. Contested by Joel Banchero (3.0 feet, MAN). LAMELO QUICKLEY MAKES IT!
Score: 5-9

[07:05] Team_050 possession (Score: 5-9)
LeBron Bridges attempts a 3Pt. Contested by Scottie Herro (5.1 feet, MAN). LeBron Bridges misses. Rebound secured by Kyrie Adebayo.

[06:52] Team_096 possession (Score: 5-9)
Scottie Herro attempts a 3Pt. Contested by Giannis LaVine (2.2 feet, ZONE). Scottie Herro misses. Rebound secured by Collin Bane.

[06:36] Team_050 possession (Score: 5-9)
Giannis LaVine attempts a 3Pt. Wide open! Terry Mobley is 7.7 feet away. [MAN] Giannis LaVine misses. Rebound secured by Kyrie Adebayo.

[06:23] Team_096 possession (Score: 5-9)
Scottie Herro makes the Layup and draws the foul on Donovan Trent! And-1! Scottie Herro to the line for 1. [Team fouls: 2] (Donovan Trent: 1 personal fouls)   FT 1/1: GOOD Scottie Herro makes 1/1 from the line.
Score: 5-12

[06:08] Team_050 possession (Score: 5-12)
LeBron Bridges drives and kicks out. LeBron Bridges attempts a 3Pt. Contested by Scottie Herro (2.4 feet, MAN). LeBron Bridges misses. Offensive rebound by LeBron Bridges! LeBron Bridges kicks it out.

[05:53] Team_050 possession (Score: 5-12)
LeBron Bridges attempts a 3Pt. Heavily contested by Cole Griffin (1.5 feet, ZONE)! LeBron Bridges misses. Offensive rebound by LeBron Bridges! LeBron Bridges kicks it out.

[05:39] Team_050 possession (Score: 5-12)
FOUL! Reach-in foul on Kyrie Adebayo during the drive. [Team fouls: 2] No free throws, side out. (Kyrie Adebayo: 2 personal fouls)

[05:22] Team_050 possession (Score: 5-12)
Giannis LaVine drives, picks up Terry Mobley. Help arrives from Cole Griffin! Giannis LaVine attempts a Layup. Wide open! Cole Griffin is 8.0 feet away. [MAN] Giannis LaVine misses. Rebound secured by Cole Griffin.

[05:08] Team_096 possession (Score: 5-12)
FOUL! Shooting foul on Giannis LaVine. Lamelo Quickley to the line for 3 free throws. [Team fouls: 3] (Giannis LaVine: 1 personal fouls)   FT 1/3: GOOD   FT 2/3: MISS   FT 3/3: GOOD Lamelo Quickley makes 2/3 from the line.
Score: 5-14

[04:53] Team_050 possession (Score: 5-14)
LeBron Bridges attempts a Midrange. Contested by Lamelo Quickley (5.0 feet, ZONE). LEBRON BRIDGES MAKES IT!
Score: 7-14

[04:35] Team_096 possession (Score: 7-14)
Cole Griffin drives, picks up Donovan Trent. Help arrives from Joel Banchero! Cole Griffin attempts a Layup. Contested by Joel Banchero (2.8 feet, ZONE). Cole Griffin misses. Rebound secured by LeBron Bridges.

[04:21] Team_050 possession (Score: 7-14)
Joel Banchero drives to the basket... Joel Banchero loses the ball! Stripped by Lamelo Quickley! TURNOVER! (live ball)

[04:05] Team_096 possession (Score: 7-14)
Terry Mobley drives and kicks out. Lamelo Quickley attempts a Midrange. Contested by Joel Banchero (4.2 feet, MAN). LAMELO QUICKLEY MAKES IT! Assist: Terry Mobley
Score: 7-16

[03:48] Team_050 possession (Score: 7-16)
Giannis LaVine attempts a Midrange. Contested by Terry Mobley (3.2 feet, MAN). Giannis LaVine misses. Rebound secured by Scottie Herro.

[03:33] Team_096 possession (Score: 7-16)
Kyrie Adebayo drives and kicks out. Lamelo Quickley attempts a Midrange. Wide open! Joel Banchero is 7.1 feet away. [MAN] Lamelo Quickley misses. Rebound secured by LeBron Bridges.

[03:23] Team_050 possession (Score: 7-16)
Donovan Trent drives and kicks out. Joel Banchero attempts a Midrange. Heavily contested by Lamelo Quickley (1.6 feet, MAN)! Joel Banchero misses. FOUL! Loose ball foul on Kyrie Adebayo during the rebound battle. [Team fouls: 3] No free throws, side out. (Kyrie Adebayo: 3 personal fouls)

[03:05] Team_050 possession (Score: 7-16)
FOUL! Reach-in foul on Cole Griffin during the drive. [Team fouls: 4] No free throws, side out. (Cole Griffin: 1 personal fouls)

[02:53] Team_050 possession (Score: 7-16)
Giannis LaVine attempts a Layup. Contested by Terry Mobley (3.0 feet, MAN). Giannis LaVine misses. Offensive rebound by Collin Bane! Collin Bane kicks it out.

[02:37] Team_050 possession (Score: 7-16)
Collin Bane attempts a Midrange. Contested by Cole Griffin (4.8 feet, MAN). Collin Bane misses. Rebound secured by Kyrie Adebayo.

[02:25] Team_096 possession (Score: 7-16)
Terry Mobley makes the Layup and draws the foul on Donovan Trent! And-1! Terry Mobley to the line for 1. [Team fouls: 4] (Donovan Trent: 2 personal fouls)   FT 1/1: GOOD Terry Mobley makes 1/1 from the line.
Score: 7-19

[02:13] Team_050 possession (Score: 7-19)
LeBron Bridges drives and kicks out. LeBron Bridges attempts a Midrange. Contested by Scottie Herro (5.8 feet, MAN). LeBron Bridges misses. Rebound secured by Scottie Herro.

[02:01] Team_096 possession (Score: 7-19)
Cole Griffin attempts a 3Pt. Contested by Giannis LaVine (4.2 feet, ZONE). Cole Griffin misses. Rebound secured by Collin Bane.

[01:48] Team_050 possession (Score: 7-19)
Giannis LaVine attempts a 3Pt. Contested by Cole Griffin (4.5 feet, ZONE). Giannis LaVine misses. Rebound secured by Kyrie Adebayo.

[01:38] Team_096 possession (Score: 7-19)
Scottie Herro attempts a 3Pt. Contested by Giannis LaVine (5.3 feet, ZONE). SCOTTIE HERRO MAKES IT! Assist: Cole Griffin
Score: 7-22

[01:25] Team_050 possession (Score: 7-22)
Donovan Trent attempts a Midrange. Contested by Cole Griffin (5.0 feet, ZONE). Donovan Trent misses. Rebound secured by Scottie Herro.

[01:12] Team_096 possession (Score: 7-22)
Terry Mobley attempts a Layup. BLOCKED BY DONOVAN TRENT! Ball is loose! Rebound secured by Collin Bane.

[01:01] Team_050 possession (Score: 7-22)
Donovan Trent attempts a Layup. Wide open! Kyrie Adebayo is 7.2 feet away. [ZONE] DONOVAN TRENT MAKES IT!
Score: 9-22

[00:44] Team_096 possession (Score: 9-22)
Terry Mobley attempts a Layup. Heavily contested by Donovan Trent (1.7 feet, ZONE)! TERRY MOBLEY MAKES IT!
Score: 9-24

[00:29] Team_050 possession (Score: 9-24)
Collin Bane drives to the basket... Collin Bane throws a bad pass out of bounds! TURNOVER! (dead ball)

[00:29] Substitution (Team_050): Giannis LaVine OUT → Damian O'Neal IN (stamina_rule2)

[00:29] Substitution (Team_050): Joel Banchero OUT → Dwyane Towns IN (stamina_rule2)

[00:29] Substitution (Team_050): Collin Bane OUT → Larry Curry IN (stamina_rule2)

[00:29] Substitution (Team_050): LeBron Bridges OUT → Luka Gasol IN (stamina_rule2)

[00:29] Substitution (Team_050): Donovan Trent OUT → Tyler Smith IN (stamina_rule2)

[00:29] Substitution (Team_096): Terry Mobley OUT → Cade Jokic IN (stamina_rule2)

[00:29] Substitution (Team_096): Lamelo Quickley OUT → Jarrett Markkanen IN (stamina_rule2)

[00:29] Substitution (Team_096): Cole Griffin OUT → Cole Holiday IN (stamina_rule2)

[00:29] Substitution (Team_096): Scottie Herro OUT → Tyler Haliburton IN (stamina_rule2)

[00:29] Substitution (Team_096): Kyrie Adebayo OUT → Devin Griffin IN (stamina_rule2)

[00:12] Team_096 possession (Score: 9-24)
Cole Holiday drives to the basket... Cole Holiday throws a bad pass! Stolen by Larry Curry! TURNOVER! (live ball)

================================================================================
                              1ST QUARTER COMPLETE                              
================================================================================

1ST QUARTER SCORE: Team_050 9, Team_096 24

BOX SCORE:
================================================================================

Team_050
--------------------------------------------------------------------------------
Player                MIN  PTS  REB  AST  TO      FG   FG%      3P   3P%
--------------------------------------------------------------------------------
Donovan Trent          12    5    0    0   0   2/5    40.0     0/0   0.0
LeBron Bridges         12    4    7    0   0   2/4    50.0     0/0   0.0
Collin Bane            12    0    8    0   0   0/2     0.0     0/0   0.0
Giannis LaVine         12    0    0    0   0   0/5     0.0     0/0   0.0

TEAM: FG: 4/16 (25.0%), 3PT: 0/5 (0.0%), REB: 15 (7 off, 8 def), AST: 0, TO: 4
TEAM FOULS: 4


Team_096
--------------------------------------------------------------------------------
Player                MIN  PTS  REB  AST  TO      FG   FG%      3P   3P%
--------------------------------------------------------------------------------
Terry Mobley           12    9    0    1   0   4/5    80.0     0/0   0.0
Scottie Herro          12    6    4    0   0   2/6    33.3     0/0   0.0
Lamelo Quickley        12    6    0    0   0   3/3   100.0     0/0   0.0
Kyrie Adebayo          12    2    6    0   0   1/2    50.0     0/0   0.0
Cole Griffin           12    0    2    2   0   0/2     0.0     0/0   0.0

TEAM: FG: 10/18 (55.6%), 3PT: 2/5 (40.0%), REB: 12 (0 off, 12 def), AST: 3, TO: 2
TEAM FOULS: 4

================================================================================

================================================================================
                       2ND QUARTER - Team_050 vs Team_096                       
================================================================================

[12:00] Team_050 possession (Score: 9-24)
Giannis LaVine attempts a 3Pt. Contested by Scottie Herro (6.0 feet, ZONE). GIANNIS LAVINE MAKES IT! Assist: Joel Banchero
Score: 12-24

[11:48] Team_096 possession (Score: 12-24)
Terry Mobley attempts a Midrange. Contested by Giannis LaVine (5.3 feet, MAN). TERRY MOBLEY MAKES IT!
Score: 12-26

[11:36] Team_050 possession (Score: 12-26)
Collin Bane makes the Layup and draws the foul on Scottie Herro! And-1! Collin Bane to the line for 1. [Team fouls: 1] (Scottie Herro: 1 personal fouls)   FT 1/1: GOOD Collin Bane makes 1/1 from the line.
Score: 15-26

[11:18] Team_096 possession (Score: 15-26)
FOUL! Offensive foul on Terry Mobley! Giannis LaVine drew the charge! [Team fouls: 2] (Terry Mobley: 1 personal fouls) TURNOVER! (dead ball)

[11:03] Team_050 possession (Score: 15-26)
Collin Bane drives, picks up Kyrie Adebayo. Help arrives from Lamelo Quickley! Collin Bane attempts a Dunk. Contested by Lamelo Quickley (5.8 feet, ZONE). COLLIN BANE MAKES IT! Assist: Joel Banchero
Score: 17-26

[10:47] Team_096 possession (Score: 17-26)
Lamelo Quickley attempts a 3Pt. Heavily contested by Joel Banchero (2.0 feet, MAN)! Lamelo Quickley misses. FOUL! Loose ball foul on Joel Banchero during the rebound battle. [Team fouls: 1] No free throws, side out. (Joel Banchero: 1 personal fouls)

[10:35] Team_096 possession (Score: 17-26)
Scottie Herro attempts a 3Pt. Contested by Giannis LaVine (5.3 feet, ZONE). Scottie Herro misses. Rebound secured by LeBron Bridges.

[10:23] Team_050 possession (Score: 17-26)
Joel Banchero attempts a 3Pt. Contested by Lamelo Quickley (3.1 feet, MAN). Joel Banchero misses. Offensive rebound by LeBron Bridges! LeBron Bridges kicks it out.

[10:11] Team_050 possession (Score: 17-26)
Collin Bane drives, picks up Cole Griffin. Help arrives from Lamelo Quickley! Collin Bane attempts a Layup. Contested by Lamelo Quickley (3.5 feet, MAN). COLLIN BANE MAKES IT! Assist: Giannis LaVine
Score: 19-26

[09:56] Team_096 possession (Score: 19-26)
Terry Mobley drives to the basket... Terry Mobley throws a bad pass out of bounds! TURNOVER! (dead ball)

[09:56] Substitution (Team_050): Giannis LaVine OUT → Damian O'Neal IN (stamina_rule2)

[09:56] Substitution (Team_050): Joel Banchero OUT → Dwyane Towns IN (stamina_rule2)

[09:56] Substitution (Team_050): Collin Bane OUT → Larry Curry IN (stamina_rule2)

[09:56] Substitution (Team_050): LeBron Bridges OUT → Luka Gasol IN (stamina_rule2)

[09:56] Substitution (Team_050): Donovan Trent OUT → Tyler Smith IN (stamina_rule2)

[09:56] Substitution (Team_096): Terry Mobley OUT → Cade Jokic IN (stamina_rule2)

[09:56] Substitution (Team_096): Lamelo Quickley OUT → Jarrett Markkanen IN (stamina_rule2)

[09:56] Substitution (Team_096): Cole Griffin OUT → Cole Holiday IN (stamina_rule2)

[09:56] Substitution (Team_096): Scottie Herro OUT → Tyler Haliburton IN (stamina_rule2)

[09:56] Substitution (Team_096): Kyrie Adebayo OUT → Devin Griffin IN (stamina_rule2)

[09:44] Team_050 possession (Score: 19-26)
Tyler Smith attempts a Midrange. Wide open! Tyler Haliburton is 6.6 feet away. [ZONE] Tyler Smith misses. Rebound secured by Tyler Haliburton.

[09:34] Team_096 possession (Score: 19-26)
Jarrett Markkanen drives to the basket... Jarrett Markkanen throws a bad pass out of bounds! TURNOVER! (dead ball)

[09:17] Team_050 possession (Score: 19-26)
Damian O'Neal attempts a 3Pt. Contested by Cade Jokic (2.1 feet, ZONE). Damian O'Neal misses. Rebound secured by Tyler Haliburton.

[09:01] Team_096 possession (Score: 19-26)
Tyler Haliburton attempts a 3Pt. Contested by Luka Gasol (5.2 feet, MAN). TYLER HALIBURTON MAKES IT! Assist: Cade Jokic
Score: 19-29

[08:48] Team_050 possession (Score: 19-29)
Larry Curry attempts a Midrange. Contested by Cole Holiday (5.8 feet, MAN). Larry Curry misses. Rebound secured by Jarrett Markkanen.

[08:32] Team_096 possession (Score: 19-29)
Cade Jokic drives and kicks out. Jarrett Markkanen attempts a 3Pt. Heavily contested by Dwyane Towns (1.9 feet, MAN)! Jarrett Markkanen misses. Offensive rebound by Devin Griffin! Devin Griffin kicks it out.

[08:17] Team_096 possession (Score: 19-29)
Jarrett Markkanen attempts a 3Pt. Heavily contested by Dwyane Towns (2.0 feet, MAN)! JARRETT MARKKANEN MAKES IT! Assist: Devin Griffin
Score: 19-32

[07:59] Team_050 possession (Score: 19-32)
Larry Curry attempts a 3Pt. Contested by Cade Jokic (4.8 feet, ZONE). Larry Curry misses. Rebound secured by Jarrett Markkanen.

[07:44] Team_096 possession (Score: 19-32)
Tyler Haliburton attempts a 3Pt. Contested by Luka Gasol (2.6 feet, MAN). Tyler Haliburton misses. Rebound secured by Dwyane Towns.

[07:28] Team_050 possession (Score: 19-32)
Luka Gasol attempts a 3Pt. Wide open! Tyler Haliburton is 8.1 feet away. [MAN] LUKA GASOL MAKES IT! Assist: Damian O'Neal
Score: 22-32

[07:12] Team_096 possession (Score: 22-32)
Jarrett Markkanen attempts a 3Pt. Contested by Dwyane Towns (6.0 feet, MAN). Jarrett Markkanen misses. Rebound secured by Larry Curry.

[06:55] Team_050 possession (Score: 22-32)
Larry Curry attempts a 3Pt. Wide open! Cade Jokic is 6.8 feet away. [ZONE] LARRY CURRY MAKES IT!
Score: 25-32

[06:41] Team_096 possession (Score: 25-32)
Tyler Haliburton attempts a Midrange. Contested by Luka Gasol (3.2 feet, MAN). Tyler Haliburton misses. Rebound secured by Larry Curry.

[06:29] Team_050 possession (Score: 25-32)
Luka Gasol attempts a Layup. Contested by Devin Griffin (5.9 feet, ZONE). LUKA GASOL MAKES IT! Assist: Tyler Smith
Score: 27-32

[06:14] Team_096 possession (Score: 27-32)
Tyler Haliburton attempts a Layup. Contested by Luka Gasol (4.5 feet, MAN). Tyler Haliburton misses. Rebound secured by Dwyane Towns.

[06:00] Team_050 possession (Score: 27-32)
Damian O'Neal attempts a Layup. Contested by Cade Jokic (5.3 feet, MAN). Damian O'Neal misses. Rebound secured by Tyler Haliburton.

[05:43] Team_096 possession (Score: 27-32)
Cade Jokic attempts a Midrange. Wide open! Damian O'Neal is 7.3 feet away. [MAN] Cade Jokic misses. Rebound secured by Dwyane Towns.

[05:30] Team_050 possession (Score: 27-32)
Larry Curry attempts a 3Pt. Heavily contested by Cade Jokic (1.1 feet, ZONE)! Larry Curry misses. Rebound secured by Devin Griffin.

[05:15] Team_096 possession (Score: 27-32)
FOUL! Holding foul on Dwyane Towns. [Team fouls: 2] No free throws, side out. (Dwyane Towns: 1 personal fouls)

[05:02] Team_096 possession (Score: 27-32)
Tyler Haliburton attempts a 3Pt. Wide open! Luka Gasol is 7.9 feet away. [ZONE] Tyler Haliburton misses. Offensive rebound by Tyler Haliburton! Tyler Haliburton kicks it out.

[04:46] Team_096 possession (Score: 27-32)
Cole Holiday throws a bad pass out of bounds! TURNOVER! (dead ball)

[04:34] Team_050 possession (Score: 27-32)
Damian O'Neal drives to the basket... Damian O'Neal loses control! Ball rolls out of bounds! TURNOVER! (dead ball)

[04:20] Team_096 possession (Score: 27-32)
Cole Holiday drives to the basket... FOUL! Offensive foul on Cole Holiday! Larry Curry drew the charge! [Team fouls: 3] (Cole Holiday: 1 personal fouls) TURNOVER! (dead ball)

[04:03] Team_050 possession (Score: 27-32)
Damian O'Neal attempts a Midrange. Contested by Cole Holiday (4.1 feet, ZONE). Damian O'Neal misses. Rebound secured by Tyler Haliburton.

[03:48] Team_096 possession (Score: 27-32)
FOUL! Shooting foul on Tyler Smith. Cade Jokic to the line for 2 free throws. [Team fouls: 3] (Tyler Smith: 1 personal fouls)   FT 1/2: GOOD   FT 2/2: GOOD Cade Jokic makes 2/2 from the line.
Score: 27-34

[03:35] Team_050 possession (Score: 27-34)
FOUL! Holding foul on Jarrett Markkanen. [Team fouls: 4] No free throws, side out. (Jarrett Markkanen: 1 personal fouls)

[03:21] Team_050 possession (Score: 27-34)
Larry Curry attempts a Midrange. Contested by Cole Holiday (4.0 feet, ZONE). Larry Curry misses. Offensive rebound by Larry Curry! Larry Curry kicks it out.

[03:07] Team_050 possession (Score: 27-34)
Damian O'Neal drives and kicks out. Tyler Smith attempts a 3Pt. Wide open! Cade Jokic is 6.3 feet away. [ZONE] TYLER SMITH MAKES IT! Assist: Damian O'Neal
Score: 30-34

[02:53] Team_096 possession (Score: 30-34)
Devin Griffin drives, Tyler Smith stays with him. Devin Griffin attempts a Layup. Contested by Tyler Smith (3.4 feet, ZONE). Devin Griffin misses. Rebound secured by Larry Curry.

[02:42] Team_050 possession (Score: 30-34)
Damian O'Neal attempts a 3Pt. Contested by Cade Jokic (5.7 feet, ZONE). Damian O'Neal misses. Rebound secured by Tyler Haliburton.

[02:29] Team_096 possession (Score: 30-34)
Devin Griffin attempts a Midrange. Contested by Larry Curry (5.9 feet, ZONE). DEVIN GRIFFIN MAKES IT! Assist: Cade Jokic
Score: 30-36

[02:17] Team_050 possession (Score: 30-36)
Luka Gasol attempts a Midrange. Contested by Tyler Haliburton (4.4 feet, MAN). Luka Gasol misses. Rebound secured by Tyler Haliburton.

[02:07] Team_096 possession (Score: 30-36)
Tyler Haliburton attempts a 3Pt. Contested by Luka Gasol (4.0 feet, MAN). Tyler Haliburton misses. Rebound secured by Larry Curry.

[01:51] Team_050 possession (Score: 30-36)
Larry Curry drives to the basket... Larry Curry throws a bad pass! Stolen by Devin Griffin! TURNOVER! (live ball)

[01:31] Team_096 possession (Score: 30-36)
FOUL! Holding foul on Tyler Smith. [Team fouls: 4] No free throws, side out. (Tyler Smith: 2 personal fouls)

[01:18] Team_096 possession (Score: 30-36)
Cole Holiday drives, Tyler Smith stays with him. Cole Holiday attempts a Layup. Contested by Tyler Smith (5.6 feet, ZONE). Cole Holiday misses. Offensive rebound by Tyler Haliburton! Tyler Haliburton kicks it out.

[01:03] Team_096 possession (Score: 30-36)
Cole Holiday attempts a Midrange. Wide open! Luka Gasol is 6.3 feet away. [ZONE] Cole Holiday misses. Rebound secured by Larry Curry.

[00:47] Team_050 possession (Score: 30-36)
Tyler Smith drives to the basket... Tyler Smith throws a bad pass! Stolen by Devin Griffin! TURNOVER! (live ball)

[00:32] Team_096 possession (Score: 30-36)
FOUL! Holding foul on Luka Gasol. [IN THE BONUS! 5 team fouls] Tyler Haliburton to the line for 2 free throws. (Luka Gasol: 1 personal fouls)   FT 1/2: GOOD   FT 2/2: GOOD Tyler Haliburton makes 2/2 from the line.
Score: 30-38

[00:15] Team_050 possession (Score: 30-38)
FOUL! Shooting foul on Cade Jokic. Damian O'Neal to the line for 3 free throws. [BONUS: 5 team fouls] (Cade Jokic: 1 personal fouls)   FT 1/3: GOOD   FT 2/3: GOOD   FT 3/3: MISS Damian O'Neal makes 2/3 from the line. Rebound secured by Jarrett Markkanen.
Score: 32-38

[00:01] Team_096 possession (Score: 32-38)
Tyler Haliburton attempts a 3Pt. Contested by Luka Gasol (4.3 feet, ZONE). Tyler Haliburton misses. Rebound secured by Tyler Smith.

================================================================================
                              2ND QUARTER COMPLETE                              
================================================================================

2ND QUARTER SCORE: Team_050 23, Team_096 14

BOX SCORE:
================================================================================

Team_050
--------------------------------------------------------------------------------
Player                MIN  PTS  REB  AST  TO      FG   FG%      3P   3P%
--------------------------------------------------------------------------------
Collin Bane            14    7    0    0   0   3/3   100.0     0/0   0.0
Luka Gasol             10    5    0    0   0   2/3    66.7     0/0   0.0
Giannis LaVine         14    3    0    1   0   1/1   100.0     0/0   0.0
Tyler Smith            10    3    1    1   0   1/2    50.0     0/0   0.0
Larry Curry            10    3    6    0   0   1/4    25.0     0/0   0.0
Joel Banchero          14    0    0    2   0   0/0     0.0     0/0   0.0
LeBron Bridges         14    0    2    0   0   0/0     0.0     0/0   0.0
Damian O'Neal          10    0    0    2   0   0/5     0.0     0/0   0.0
Dwyane Towns           10    0    3    0   0   0/0     0.0     0/0   0.0

TEAM: FG: 8/18 (44.4%), 3PT: 3/8 (37.5%), REB: 12 (2 off, 10 def), AST: 6, TO: 3
TEAM FOULS: 5 [Team_096 in BONUS]


Team_096
--------------------------------------------------------------------------------
Player                MIN  PTS  REB  AST  TO      FG   FG%      3P   3P%
--------------------------------------------------------------------------------
Tyler Haliburton       10    5    8    0   0   2/7    28.6     0/0   0.0
Jarrett Markkanen      10    3    3    0   0   1/2    50.0     0/0   0.0
Terry Mobley           14    2    0    0   0   1/1   100.0     0/0   0.0
Cade Jokic             10    2    0    2   0   1/2    50.0     0/0   0.0
Devin Griffin          10    2    2    1   0   1/2    50.0     0/0   0.0
Kyrie Adebayo          14    0    1    0   0   0/0     0.0     0/0   0.0
Scottie Herro          14    0    0    0   0   0/1     0.0     0/0   0.0
Cole Holiday           10    0    0    0   0   0/1     0.0     0/0   0.0

TEAM: FG: 6/16 (37.5%), 3PT: 2/7 (28.6%), REB: 14 (4 off, 10 def), AST: 3, TO: 5
TEAM FOULS: 5 [Team_050 in BONUS]

================================================================================

================================================================================
                       3RD QUARTER - Team_050 vs Team_096                       
================================================================================

[12:00] Team_050 possession (Score: 32-38)
Donovan Trent drives, Kyrie Adebayo stays with him. Donovan Trent attempts a Dunk. Heavily contested by Kyrie Adebayo (0.5 feet, ZONE)! DONOVAN TRENT MAKES IT!
Score: 34-38

[11:43] Team_096 possession (Score: 34-38)
FOUL! Holding foul on Donovan Trent. [Team fouls: 1] No free throws, side out. (Donovan Trent: 1 personal fouls)

[11:29] Team_096 possession (Score: 34-38)
Lamelo Quickley attempts a 3Pt. Contested by Giannis LaVine (2.2 feet, ZONE). Lamelo Quickley misses. FOUL! Loose ball foul on LeBron Bridges during the rebound battle. [Team fouls: 2] No free throws, side out. (LeBron Bridges: 1 personal fouls)

[11:15] Team_096 possession (Score: 34-38)
Kyrie Adebayo drives to the basket... Kyrie Adebayo throws a bad pass! Stolen by Donovan Trent! TURNOVER! (live ball)

[11:01] Team_050 possession (Score: 34-38)
Collin Bane makes the Layup and draws the foul on Kyrie Adebayo! And-1! Collin Bane to the line for 1. [Team fouls: 1] (Kyrie Adebayo: 1 personal fouls)   FT 1/1: GOOD Collin Bane makes 1/1 from the line.
Score: 37-38

[10:49] Team_096 possession (Score: 37-38)
Cole Griffin attempts a 3Pt. Contested by Giannis LaVine (6.0 feet, ZONE). Cole Griffin misses. Offensive rebound by Kyrie Adebayo! Kyrie Adebayo's putback is no good. Rebound secured by Joel Banchero.

[10:35] Team_050 possession (Score: 37-38)
Joel Banchero drives, Lamelo Quickley stays with him. Joel Banchero attempts a Dunk. Heavily contested by Lamelo Quickley (1.2 feet, MAN)! Joel Banchero misses. FOUL! Loose ball foul on Kyrie Adebayo during the rebound battle. [Team fouls: 2] No free throws, side out. (Kyrie Adebayo: 2 personal fouls)

[10:23] Team_050 possession (Score: 37-38)
Joel Banchero attempts a 3Pt. Wide open! Lamelo Quickley is 6.8 feet away. [MAN] Joel Banchero misses. Rebound secured by Cole Griffin.

[10:08] Team_096 possession (Score: 37-38)
Lamelo Quickley attempts a Midrange. Contested by LeBron Bridges (2.6 feet, ZONE). Lamelo Quickley misses. Rebound secured by LeBron Bridges.

[09:54] Team_050 possession (Score: 37-38)
Donovan Trent drives to the basket... Donovan Trent throws a bad pass! Stolen by Kyrie Adebayo! TURNOVER! (live ball)

[09:40] Team_096 possession (Score: 37-38)
Scottie Herro attempts a Midrange. Contested by LeBron Bridges (2.2 feet, ZONE). Scottie Herro misses. Rebound secured by LeBron Bridges.

[09:25] Team_050 possession (Score: 37-38)
Donovan Trent attempts a Midrange. Wide open! Kyrie Adebayo is 6.0 feet away. [MAN] Donovan Trent misses. Offensive rebound by LeBron Bridges! LeBron Bridges kicks it out.

[09:13] Team_050 possession (Score: 37-38)
Donovan Trent attempts a Layup. Contested by Kyrie Adebayo (4.0 feet, ZONE). DONOVAN TRENT MAKES IT! Assist: Giannis LaVine
Score: 39-38

[08:57] Team_096 possession (Score: 39-38)
Kyrie Adebayo drives and kicks out. Scottie Herro attempts a Midrange. Contested by LeBron Bridges (2.2 feet, ZONE). Scottie Herro misses. FOUL! Loose ball foul on LeBron Bridges during the rebound battle. [Team fouls: 3] No free throws, side out. (LeBron Bridges: 2 personal fouls)

[08:42] Team_096 possession (Score: 39-38)
Terry Mobley drives to the basket... Terry Mobley loses control! Ball rolls out of bounds! TURNOVER! (dead ball)

[08:27] Team_050 possession (Score: 39-38)
LeBron Bridges attempts a Layup. Contested by Kyrie Adebayo (4.9 feet, ZONE). LeBron Bridges misses. Rebound secured by Scottie Herro.

[08:08] Team_096 possession (Score: 39-38)
FOUL! Shooting foul on Giannis LaVine. Lamelo Quickley to the line for 3 free throws. [Team fouls: 4] (Giannis LaVine: 1 personal fouls)   FT 1/3: GOOD   FT 2/3: GOOD   FT 3/3: GOOD Lamelo Quickley makes 3/3 from the line.
Score: 39-41

[07:56] Team_050 possession (Score: 39-41)
Giannis LaVine attempts a Midrange. Wide open! Scottie Herro is 6.8 feet away. [ZONE] Giannis LaVine misses. Rebound secured by Scottie Herro.

[07:43] Team_096 possession (Score: 39-41)
Scottie Herro drives, picks up Donovan Trent. Help arrives from Joel Banchero! Scottie Herro attempts a Layup. Contested by Joel Banchero (5.7 feet, ZONE). SCOTTIE HERRO MAKES IT!
Score: 39-43

[07:33] Team_050 possession (Score: 39-43)
Joel Banchero drives to the basket... Joel Banchero loses control! Ball rolls out of bounds! TURNOVER! (dead ball)

[07:20] Team_096 possession (Score: 39-43)
Terry Mobley attempts a 3Pt. Contested by Giannis LaVine (4.6 feet, MAN). TERRY MOBLEY MAKES IT! Assist: Kyrie Adebayo
Score: 39-46

[07:08] Team_050 possession (Score: 39-46)
Donovan Trent attempts a 3Pt. Contested by Cole Griffin (3.0 feet, ZONE). Donovan Trent misses. Offensive rebound by LeBron Bridges! LeBron Bridges kicks it out.

[06:56] Team_050 possession (Score: 39-46)
Donovan Trent drives and kicks out. Giannis LaVine attempts a 3Pt. Contested by Cole Griffin (4.5 feet, ZONE). Giannis LaVine misses. Rebound secured by Cole Griffin.

[06:39] Team_096 possession (Score: 39-46)
Lamelo Quickley attempts a Layup. BLOCKED BY JOEL BANCHERO! Ball is loose! Rebound secured by Joel Banchero.

[06:24] Team_050 possession (Score: 39-46)
Joel Banchero attempts a 3Pt. Wide open! Terry Mobley is 8.1 feet away. [ZONE] Joel Banchero misses. Rebound secured by Cole Griffin.

[06:09] Team_096 possession (Score: 39-46)
Cole Griffin attempts a 3Pt. Contested by Giannis LaVine (3.0 feet, ZONE). Cole Griffin misses. Offensive rebound by Scottie Herro! Scottie Herro kicks it out.

[05:51] Team_096 possession (Score: 39-46)
Scottie Herro attempts a Midrange. Contested by Collin Bane (5.1 feet, ZONE). Scottie Herro misses. Offensive rebound by Kyrie Adebayo! Kyrie Adebayo's putback is no good. Rebound secured by Joel Banchero.

[05:38] Team_050 possession (Score: 39-46)
Collin Bane attempts a Midrange. Contested by Cole Griffin (4.9 feet, ZONE). COLLIN BANE MAKES IT! Assist: Giannis LaVine
Score: 41-46

[05:26] Team_096 possession (Score: 41-46)
Scottie Herro attempts a Midrange. Contested by LeBron Bridges (5.3 feet, MAN). Scottie Herro misses. FOUL! Loose ball foul on Collin Bane during the rebound battle. [IN THE BONUS! 5 team fouls] Kyrie Adebayo to the line for 2 free throws. (Collin Bane: 1 personal fouls)   FT 1/2: MISS   FT 2/2: GOOD Kyrie Adebayo makes 1/2 from the line.
Score: 41-47

[05:16] Team_050 possession (Score: 41-47)
Collin Bane attempts a 3Pt. Heavily contested by Cole Griffin (0.8 feet, ZONE)! COLLIN BANE MAKES IT! Assist: Giannis LaVine
Score: 44-47

[05:01] Team_096 possession (Score: 44-47)
Cole Griffin drives and kicks out. FOUL! Shooting foul on Collin Bane. Cole Griffin to the line for 2 free throws. [BONUS: 6 team fouls] (Collin Bane: 2 personal fouls)   FT 1/2: GOOD   FT 2/2: GOOD Cole Griffin makes 2/2 from the line.
Score: 44-49

[04:50] Team_050 possession (Score: 44-49)
LeBron Bridges attempts a 3Pt. Contested by Cole Griffin (5.1 feet, ZONE). LeBron Bridges misses. Offensive rebound by LeBron Bridges! LeBron Bridges kicks it out.

[04:34] Team_050 possession (Score: 44-49)
LeBron Bridges attempts a 3Pt. Contested by Lamelo Quickley (5.9 feet, ZONE). LeBron Bridges misses. Rebound secured by Cole Griffin.

[04:19] Team_096 possession (Score: 44-49)
Lamelo Quickley attempts a 3Pt. Contested by Giannis LaVine (4.5 feet, ZONE). LAMELO QUICKLEY MAKES IT! Assist: Kyrie Adebayo
Score: 44-52

[04:05] Team_050 possession (Score: 44-52)
Giannis LaVine attempts a 3Pt. Wide open! Cole Griffin is 6.5 feet away. [ZONE] Giannis LaVine misses. Rebound secured by Scottie Herro.

[03:50] Team_096 possession (Score: 44-52)
Lamelo Quickley attempts a 3Pt. Contested by Giannis LaVine (3.6 feet, ZONE). Lamelo Quickley misses. Offensive rebound by Scottie Herro! Scottie Herro kicks it out.

[03:37] Team_096 possession (Score: 44-52)
Lamelo Quickley attempts a Layup. Contested by Donovan Trent (5.1 feet, ZONE). LAMELO QUICKLEY MAKES IT!
Score: 44-54

[03:25] Team_050 possession (Score: 44-54)
LeBron Bridges drives to the basket... LeBron Bridges throws a bad pass out of bounds! TURNOVER! (dead ball)

[03:25] Substitution (Team_050): LeBron Bridges OUT → Luka Gasol IN (stamina_rule2)

[03:25] Substitution (Team_050): Donovan Trent OUT → Tyler Smith IN (stamina_rule2)

[03:13] Team_096 possession (Score: 44-54)
Cole Griffin throws a bad pass out of bounds! TURNOVER! (dead ball)

[02:55] Team_050 possession (Score: 44-54)
Joel Banchero attempts a 3Pt. Contested by Lamelo Quickley (4.4 feet, MAN). Joel Banchero misses. Rebound secured by Kyrie Adebayo.

[02:42] Team_096 possession (Score: 44-54)
Terry Mobley attempts a Midrange. Contested by Joel Banchero (2.1 feet, ZONE). Terry Mobley misses. Rebound secured by Tyler Smith.

[02:29] Team_050 possession (Score: 44-54)
Tyler Smith drives, Kyrie Adebayo stays with him. Tyler Smith attempts a Dunk. Contested by Kyrie Adebayo (3.4 feet, MAN). TYLER SMITH MAKES IT! Assist: Collin Bane
Score: 46-54

[02:10] Team_096 possession (Score: 46-54)
Cole Griffin throws a bad pass! Stolen by Collin Bane! TURNOVER! (live ball)

[01:55] Team_050 possession (Score: 46-54)
Tyler Smith drives, picks up Kyrie Adebayo. Help arrives from Lamelo Quickley! Tyler Smith attempts a Dunk. Wide open! Lamelo Quickley is 6.3 feet away. [MAN] TYLER SMITH MAKES IT! Assist: Luka Gasol
Score: 48-54

[01:43] Team_096 possession (Score: 48-54)
Scottie Herro attempts a 3Pt. Contested by Luka Gasol (4.2 feet, ZONE). Scottie Herro misses. Rebound secured by Collin Bane.

[01:27] Team_050 possession (Score: 48-54)
Tyler Smith loses control! Ball rolls out of bounds! TURNOVER! (dead ball)

[01:27] Substitution (Team_050): Giannis LaVine OUT → Damian O'Neal IN (stamina_rule2)

[01:27] Substitution (Team_050): Joel Banchero OUT → Dwyane Towns IN (stamina_rule2)

[01:27] Substitution (Team_050): Collin Bane OUT → Larry Curry IN (stamina_rule2)

[01:27] Substitution (Team_096): Terry Mobley OUT → Cade Jokic IN (stamina_rule2)

[01:27] Substitution (Team_096): Lamelo Quickley OUT → Jarrett Markkanen IN (stamina_rule2)

[01:27] Substitution (Team_096): Cole Griffin OUT → Cole Holiday IN (stamina_rule2)

[01:27] Substitution (Team_096): Scottie Herro OUT → Tyler Haliburton IN (stamina_rule2)

[01:27] Substitution (Team_096): Kyrie Adebayo OUT → Devin Griffin IN (stamina_rule2)

[01:12] Team_096 possession (Score: 48-54)
FOUL! Shooting foul on Tyler Smith. Devin Griffin to the line for 2 free throws. [BONUS: 7 team fouls] (Tyler Smith: 1 personal fouls)   FT 1/2: GOOD   FT 2/2: GOOD Devin Griffin makes 2/2 from the line.
Score: 48-56

[01:01] Team_050 possession (Score: 48-56)
Luka Gasol attempts a 3Pt. Contested by Tyler Haliburton (3.8 feet, MAN). Luka Gasol misses. Rebound secured by Devin Griffin.

[00:50] Team_096 possession (Score: 48-56)
FOUL! Holding foul on Tyler Smith. [IN THE BONUS! 8 team fouls] Devin Griffin to the line for 2 free throws. (Tyler Smith: 2 personal fouls)   FT 1/2: GOOD   FT 2/2: MISS Devin Griffin makes 1/2 from the line. Rebound secured by Tyler Smith.
Score: 48-57

[00:36] Team_050 possession (Score: 48-57)
Dwyane Towns attempts a 3Pt. Contested by Jarrett Markkanen (4.4 feet, MAN). DWYANE TOWNS MAKES IT! Assist: Damian O'Neal
Score: 51-57

[00:24] Team_096 possession (Score: 51-57)
Tyler Haliburton attempts a Layup. Wide open! Tyler Smith is 9.1 feet away. [ZONE] TYLER HALIBURTON MAKES IT!
Score: 51-59

[00:09] Team_050 possession (Score: 51-59)
Dwyane Towns attempts a 3Pt. Contested by Cade Jokic (4.6 feet, ZONE). Dwyane Towns misses. Rebound secured by Tyler Haliburton.

================================================================================
                              3RD QUARTER COMPLETE                              
================================================================================

3RD QUARTER SCORE: Team_050 19, Team_096 21

BOX SCORE:
================================================================================

Team_050
--------------------------------------------------------------------------------
Player                MIN  PTS  REB  AST  TO      FG   FG%      3P   3P%
--------------------------------------------------------------------------------
Collin Bane            25    8    1    1   0   3/3   100.0     0/0   0.0
Donovan Trent          23    4    0    0   0   2/3    66.7     0/0   0.0
Tyler Smith            13    4    2    0   0   2/2   100.0     0/0   0.0
Dwyane Towns           11    3    0    0   0   1/2    50.0     0/0   0.0
Joel Banchero          25    0    3    0   0   0/3     0.0     0/0   0.0
LeBron Bridges         23    0    6    0   0   0/2     0.0     0/0   0.0
Giannis LaVine         25    0    0    3   0   0/2     0.0     0/0   0.0
Luka Gasol             13    0    0    1   0   0/1     0.0     0/0   0.0
Damian O'Neal          11    0    0    1   0   0/0     0.0     0/0   0.0

TEAM: FG: 8/18 (44.4%), 3PT: 2/9 (22.2%), REB: 10 (4 off, 6 def), AST: 6, TO: 4
TEAM FOULS: 8 [Team_096 in BONUS]


Team_096
--------------------------------------------------------------------------------
Player                MIN  PTS  REB  AST  TO      FG   FG%      3P   3P%
--------------------------------------------------------------------------------
Lamelo Quickley        25    8    0    0   0   3/5    60.0     0/0   0.0
Terry Mobley           25    3    0    0   0   1/2    50.0     0/0   0.0
Cole Griffin           25    2    4    0   0   1/2    50.0     0/0   0.0
Scottie Herro          25    2    6    0   0   1/4    25.0     0/0   0.0
Devin Griffin          11    2    1    0   0   1/1   100.0     0/0   0.0
Tyler Haliburton       11    2    1    0   0   1/1   100.0     0/0   0.0
Kyrie Adebayo          25    1    2    2   0   1/1   100.0     0/0   0.0

TEAM: FG: 9/17 (52.9%), 3PT: 3/5 (60.0%), REB: 16 (6 off, 10 def), AST: 2, TO: 4
TEAM FOULS: 2

================================================================================

================================================================================
                       4TH QUARTER - Team_050 vs Team_096                       
================================================================================

[12:00] Team_050 possession (Score: 51-59)
Donovan Trent loses the ball! Stripped by Kyrie Adebayo! TURNOVER! (live ball)

[11:44] Team_096 possession (Score: 51-59)
Terry Mobley drives, picks up Giannis LaVine. Help arrives from Collin Bane! Terry Mobley attempts a Layup. Contested by Collin Bane (3.8 feet, MAN). TERRY MOBLEY MAKES IT! Assist: Scottie Herro
Score: 51-61

[11:25] Team_050 possession (Score: 51-61)
LeBron Bridges drives, Scottie Herro stays with him. LeBron Bridges attempts a Dunk. Wide open! Scottie Herro is 6.1 feet away. [MAN] LeBron Bridges misses. Rebound secured by Scottie Herro.

[11:15] Team_096 possession (Score: 51-61)
Kyrie Adebayo attempts a Midrange. Contested by Donovan Trent (3.9 feet, MAN). Kyrie Adebayo misses. Rebound secured by LeBron Bridges.

[11:02] Team_050 possession (Score: 51-61)
LeBron Bridges attempts a Layup. Contested by Scottie Herro (4.1 feet, MAN). LeBron Bridges misses. Offensive rebound by Collin Bane! Collin Bane kicks it out.

[10:52] Team_050 possession (Score: 51-61)
LeBron Bridges attempts a 3Pt. Contested by Scottie Herro (5.9 feet, MAN). LeBron Bridges misses. Rebound secured by Kyrie Adebayo.

[10:42] Team_096 possession (Score: 51-61)
Kyrie Adebayo attempts a Midrange. Contested by Donovan Trent (4.4 feet, MAN). Kyrie Adebayo misses. Offensive rebound by Scottie Herro! Scottie Herro kicks it out.

[10:29] Team_096 possession (Score: 51-61)
Scottie Herro drives and kicks out. Cole Griffin attempts a 3Pt. Contested by Giannis LaVine (4.9 feet, ZONE). Cole Griffin misses. Rebound secured by Donovan Trent.

[10:15] Team_050 possession (Score: 51-61)
FOUL! Reach-in foul on Kyrie Adebayo during the drive. [Team fouls: 1] No free throws, side out. (Kyrie Adebayo: 1 personal fouls)

[09:58] Team_050 possession (Score: 51-61)
Donovan Trent drives, Kyrie Adebayo stays with him. Donovan Trent attempts a Dunk. Contested by Kyrie Adebayo (2.7 feet, ZONE). DONOVAN TRENT MAKES IT! Assist: Giannis LaVine
Score: 53-61

[09:44] Team_096 possession (Score: 53-61)
Cole Griffin attempts a Layup. BLOCKED BY COLLIN BANE! Ball is loose! Rebound secured by LeBron Bridges.

[09:30] Team_050 possession (Score: 53-61)
Giannis LaVine throws a bad pass! Stolen by Terry Mobley! TURNOVER! (live ball)

[09:19] Team_096 possession (Score: 53-61)
Scottie Herro attempts a Midrange. Contested by LeBron Bridges (3.0 feet, MAN). Scottie Herro misses. Rebound secured by Donovan Trent.

[09:03] Team_050 possession (Score: 53-61)
FOUL! Holding foul on Cole Griffin. [Team fouls: 2] No free throws, side out. (Cole Griffin: 1 personal fouls)

[08:48] Team_050 possession (Score: 53-61)
Donovan Trent attempts a 3Pt. Contested by Cole Griffin (4.3 feet, ZONE). Donovan Trent misses. Rebound secured by Cole Griffin.

[08:34] Team_096 possession (Score: 53-61)
Terry Mobley attempts a 3Pt. Contested by Giannis LaVine (3.2 feet, ZONE). Terry Mobley misses. Rebound secured by Collin Bane.

[08:19] Team_050 possession (Score: 53-61)
Joel Banchero attempts a Midrange. Contested by Scottie Herro (5.9 feet, ZONE). Joel Banchero misses. Offensive rebound by LeBron Bridges! LeBron Bridges kicks it out.

[08:02] Team_050 possession (Score: 53-61)
LeBron Bridges attempts a Midrange. Contested by Lamelo Quickley (2.8 feet, ZONE). LEBRON BRIDGES MAKES IT!
Score: 55-61

[07:47] Team_096 possession (Score: 55-61)
Kyrie Adebayo drives, Donovan Trent stays with him. Kyrie Adebayo attempts a Layup. Contested by Donovan Trent (4.0 feet, MAN). KYRIE ADEBAYO MAKES IT!
Score: 55-63

[07:31] Team_050 possession (Score: 55-63)
Giannis LaVine drives, Kyrie Adebayo stays with him. Giannis LaVine attempts a Dunk. Wide open! Kyrie Adebayo is 6.5 feet away. [ZONE] Giannis LaVine misses. Rebound secured by Scottie Herro.

[07:17] Team_096 possession (Score: 55-63)
Kyrie Adebayo drives to the basket... Kyrie Adebayo loses the ball! Stripped by Donovan Trent! TURNOVER! (live ball)

[07:00] Team_050 possession (Score: 55-63)
LeBron Bridges attempts a Layup. Contested by Kyrie Adebayo (4.3 feet, ZONE). LEBRON BRIDGES MAKES IT! Assist: Giannis LaVine
Score: 57-63

[06:45] Team_096 possession (Score: 57-63)
Lamelo Quickley attempts a 3Pt. Heavily contested by Joel Banchero (0.7 feet, MAN)! LAMELO QUICKLEY MAKES IT!
Score: 57-66

[06:33] Team_050 possession (Score: 57-66)
LeBron Bridges drives, Scottie Herro stays with him. LeBron Bridges attempts a Dunk. Contested by Scottie Herro (5.2 feet, ZONE). LEBRON BRIDGES MAKES IT! Assist: Joel Banchero
Score: 59-66

[06:19] Team_096 possession (Score: 59-66)
Cole Griffin attempts a 3Pt. Contested by Collin Bane (5.5 feet, MAN). Cole Griffin misses. Rebound secured by Donovan Trent.

[06:03] Team_050 possession (Score: 59-66)
LeBron Bridges attempts a Layup. Wide open! Scottie Herro is 7.9 feet away. [MAN] LEBRON BRIDGES MAKES IT!
Score: 61-66

[05:47] Team_096 possession (Score: 61-66)
Lamelo Quickley attempts a Midrange. Heavily contested by Joel Banchero (0.5 feet, MAN)! LAMELO QUICKLEY MAKES IT! Assist: Scottie Herro
Score: 61-68

[05:33] Team_050 possession (Score: 61-68)
FOUL! Offensive foul on Collin Bane! Cole Griffin drew the charge! [Team fouls: 1] (Collin Bane: 1 personal fouls) TURNOVER! (dead ball)

[05:18] Team_096 possession (Score: 61-68)
Kyrie Adebayo attempts a Layup. Wide open! Donovan Trent is 6.2 feet away. [MAN] KYRIE ADEBAYO MAKES IT! Assist: Terry Mobley
Score: 61-70

[05:04] Team_050 possession (Score: 61-70)
Joel Banchero attempts a Layup. BLOCKED BY COLE GRIFFIN! Ball is loose! Rebound secured by Cole Griffin.

[04:50] Team_096 possession (Score: 61-70)
FOUL! Reach-in foul on Donovan Trent during the drive. [Team fouls: 2] No free throws, side out. (Donovan Trent: 1 personal fouls)

[04:38] Team_096 possession (Score: 61-70)
FOUL! Shooting foul on LeBron Bridges. Scottie Herro to the line for 2 free throws. [Team fouls: 3] (LeBron Bridges: 1 personal fouls)   FT 1/2: GOOD   FT 2/2: GOOD Scottie Herro makes 2/2 from the line.
Score: 61-72

[04:24] Team_050 possession (Score: 61-72)
LeBron Bridges attempts a 3Pt. Contested by Cole Griffin (4.9 feet, ZONE). LEBRON BRIDGES MAKES IT! Assist: Collin Bane
Score: 64-72

[04:12] Team_096 possession (Score: 64-72)
Scottie Herro attempts a Layup. Wide open! LeBron Bridges is 6.9 feet away. [MAN] SCOTTIE HERRO MAKES IT! Assist: Terry Mobley
Score: 64-74

[04:00] Team_050 possession (Score: 64-74)
FOUL! Reach-in foul on Scottie Herro during the drive. [Team fouls: 3] No free throws, side out. (Scottie Herro: 1 personal fouls)

[03:43] Team_050 possession (Score: 64-74)
LeBron Bridges attempts a Layup. Wide open! Scottie Herro is 7.2 feet away. [MAN] LeBron Bridges misses. Offensive rebound by LeBron Bridges! LeBron Bridges kicks it out.

[03:31] Team_050 possession (Score: 64-74)
Giannis LaVine attempts a Midrange. Wide open! Terry Mobley is 8.8 feet away. [MAN] GIANNIS LAVINE MAKES IT!
Score: 66-74

[03:12] Team_096 possession (Score: 66-74)
FOUL! Shooting foul on Collin Bane. Cole Griffin to the line for 2 free throws. [Team fouls: 4] (Collin Bane: 2 personal fouls)   FT 1/2: GOOD   FT 2/2: MISS Cole Griffin makes 1/2 from the line. Rebound secured by LeBron Bridges.
Score: 66-75

[03:01] Team_050 possession (Score: 66-75)
LeBron Bridges loses control! Ball rolls out of bounds! TURNOVER! (dead ball)

[03:01] Substitution (Team_050): Giannis LaVine OUT → Damian O'Neal IN (stamina_rule2)

[03:01] Substitution (Team_050): Joel Banchero OUT → Dwyane Towns IN (stamina_rule2)

[03:01] Substitution (Team_050): Collin Bane OUT → Larry Curry IN (stamina_rule2)

[03:01] Substitution (Team_050): LeBron Bridges OUT → Luka Gasol IN (stamina_rule2)

[03:01] Substitution (Team_050): Donovan Trent OUT → Tyler Smith IN (stamina_rule2)

[03:01] Substitution (Team_096): Terry Mobley OUT → Cade Jokic IN (stamina_rule2)

[03:01] Substitution (Team_096): Lamelo Quickley OUT → Jarrett Markkanen IN (stamina_rule2)

[03:01] Substitution (Team_096): Cole Griffin OUT → Cole Holiday IN (stamina_rule2)

[03:01] Substitution (Team_096): Scottie Herro OUT → Tyler Haliburton IN (stamina_rule2)

[03:01] Substitution (Team_096): Kyrie Adebayo OUT → Devin Griffin IN (stamina_rule2)

[02:46] Team_096 possession (Score: 66-75)
FOUL! Holding foul on Luka Gasol. [IN THE BONUS! 5 team fouls] Tyler Haliburton to the line for 2 free throws. (Luka Gasol: 1 personal fouls)   FT 1/2: GOOD   FT 2/2: GOOD Tyler Haliburton makes 2/2 from the line.
Score: 66-77

[02:30] Team_050 possession (Score: 66-77)
Damian O'Neal commits a violation (traveling/carry)! TURNOVER! (dead ball)

[02:16] Team_096 possession (Score: 66-77)
Cade Jokic drives, Tyler Smith stays with him. Cade Jokic attempts a Dunk. Wide open! Tyler Smith is 6.7 feet away. [ZONE] Cade Jokic misses. Offensive rebound by Tyler Haliburton! Tyler Haliburton kicks it out.

[02:01] Team_096 possession (Score: 66-77)
Tyler Haliburton drives, Luka Gasol stays with him. Tyler Haliburton attempts a Layup. Wide open! Luka Gasol is 6.4 feet away. [ZONE] TYLER HALIBURTON MAKES IT!
Score: 66-79

[01:45] Team_050 possession (Score: 66-79)
FOUL! Shooting foul on Tyler Haliburton. Luka Gasol to the line for 2 free throws. [Team fouls: 4] (Tyler Haliburton: 1 personal fouls)   FT 1/2: GOOD   FT 2/2: GOOD Luka Gasol makes 2/2 from the line.
Score: 68-79

[01:34] Team_096 possession (Score: 68-79)
Jarrett Markkanen drives, Dwyane Towns stays with him. Jarrett Markkanen attempts a Layup. Wide open! Dwyane Towns is 6.1 feet away. [MAN] JARRETT MARKKANEN MAKES IT! Assist: Cade Jokic
Score: 68-81

[01:22] Team_050 possession (Score: 68-81)
Luka Gasol attempts a 3Pt. Contested by Cade Jokic (5.9 feet, ZONE). LUKA GASOL MAKES IT! Assist: Tyler Smith
Score: 71-81

[01:11] Team_096 possession (Score: 71-81)
FOUL! Holding foul on Larry Curry. [IN THE BONUS! 6 team fouls] Cole Holiday to the line for 2 free throws. (Larry Curry: 1 personal fouls)   FT 1/2: GOOD   FT 2/2: MISS Cole Holiday makes 1/2 from the line. Rebound secured by Dwyane Towns.
Score: 71-82

[00:59] Team_050 possession (Score: 71-82)
Luka Gasol attempts a Midrange. Contested by Tyler Haliburton (5.9 feet, MAN). Luka Gasol misses. Rebound secured by Devin Griffin.

[00:47] Team_096 possession (Score: 71-82)
Jarrett Markkanen attempts a 3Pt. Contested by Luka Gasol (5.9 feet, ZONE). Jarrett Markkanen misses. Rebound secured by Larry Curry.

[00:28] Team_050 possession (Score: 71-82)
Larry Curry attempts a 3Pt. Contested by Cade Jokic (3.8 feet, ZONE). LARRY CURRY MAKES IT! Assist: Tyler Smith
Score: 74-82

[00:14] Team_096 possession (Score: 74-82)
Cade Jokic attempts a Layup. Wide open! Tyler Smith is 6.6 feet away. [ZONE] CADE JOKIC MAKES IT! Assist: Cole Holiday
Score: 74-84

================================================================================
                              4TH QUARTER COMPLETE                              
================================================================================

4TH QUARTER SCORE: Team_050 23, Team_096 25

BOX SCORE:
================================================================================

Team_050
--------------------------------------------------------------------------------
Player                MIN  PTS  REB  AST  TO      FG   FG%      3P   3P%
--------------------------------------------------------------------------------
LeBron Bridges         32   11    5    0   0   5/7    71.4     0/0   0.0
Luka Gasol             16    5    0    0   0   2/3    66.7     0/0   0.0
Larry Curry            14    3    1    0   0   1/1   100.0     0/0   0.0
Donovan Trent          32    2    3    0   0   1/2    50.0     0/0   0.0
Giannis LaVine         34    2    0    2   0   1/2    50.0     0/0   0.0
Collin Bane            34    0    2    1   0   0/0     0.0     0/0   0.0
Joel Banchero          34    0    0    1   0   0/1     0.0     0/0   0.0
Tyler Smith            16    0    0    2   0   0/0     0.0     0/0   0.0
Dwyane Towns           14    0    1    0   0   0/0     0.0     0/0   0.0

TEAM: FG: 10/16 (62.5%), 3PT: 3/5 (60.0%), REB: 12 (3 off, 9 def), AST: 6, TO: 5
TEAM FOULS: 6 [Team_096 in BONUS]


Team_096
--------------------------------------------------------------------------------
Player                MIN  PTS  REB  AST  TO      FG   FG%      3P   3P%
--------------------------------------------------------------------------------
Lamelo Quickley        34    5    0    0   0   2/2   100.0     0/0   0.0
Scottie Herro          34    4    3    2   0   2/4    50.0     0/0   0.0
Kyrie Adebayo          34    4    1    0   0   2/3    66.7     0/0   0.0
Tyler Haliburton       14    4    1    0   0   2/2   100.0     0/0   0.0
Terry Mobley           34    2    0    2   0   1/2    50.0     0/0   0.0
Jarrett Markkanen      14    2    0    0   0   1/2    50.0     0/0   0.0
Cade Jokic             14    2    0    1   0   1/1   100.0     0/0   0.0
Cole Griffin           34    0    2    0   0   0/3     0.0     0/0   0.0
Devin Griffin          14    0    1    0   0   0/0     0.0     0/0   0.0
Cole Holiday           14    0    0    1   0   0/0     0.0     0/0   0.0

TEAM: FG: 11/20 (55.0%), 3PT: 1/4 (25.0%), REB: 8 (2 off, 6 def), AST: 6, TO: 1
TEAM FOULS: 4

================================================================================

================================================================================
                               FULL GAME COMPLETE                               
================================================================================

FINAL SCORE: Team_050 74, Team_096 84

SCORING BY QUARTER:
--------------------------------------------------------------------------------
Team                     Q1     Q2     Q3     Q4    FINAL
--------------------------------------------------------------------------------
Team_050                  9     23     19     23       74
Team_096                 24     14     21     25       84
--------------------------------------------------------------------------------

FULL GAME BOX SCORE:
================================================================================

Team_050
--------------------------------------------------------------------------------
Player                MIN  PTS  REB  AST  TO      FG   FG%      3P   3P%      FT STL BLK
--------------------------------------------------------------------------------
Giannis LaVine         34    5    0    6   2   2/10   20.0   1/5    20.0   0/0     0   0
Joel Banchero          34    0    3    3   4   0/4     0.0   0/3     0.0   0/0     0   1
Collin Bane            34   15   11    2   2   6/8    75.0   1/2    50.0   2/2     1   1
LeBron Bridges         32   15   20    0   1   7/13   53.8   1/4    25.0   0/0     1   0
Donovan Trent          32   11    3    0   2   5/10   50.0   0/1     0.0   1/1     2   1
Luka Gasol             16   10    0    1   2   4/7    57.1   2/3    66.7   2/2     0   0
Tyler Smith            16    7    3    3   1   2/3    66.7   0/0     0.0   0/0     0   0
Damian O'Neal          14    0    0    3   2   1/6    16.7   0/3     0.0   2/3     0   0
Dwyane Towns           14    3    4    0   0   1/2    50.0   1/2    50.0   0/0     0   0
Larry Curry            14    6    7    0   0   2/5    40.0   2/4    50.0   0/0     1   0

TEAM: FG: 30/68 (44.1%), 3PT: 8/27 (29.6%), REB: 49 (16 off, 33 def), AST: 18, TO: 16


Team_096
--------------------------------------------------------------------------------
Player                MIN  PTS  REB  AST  TO      FG   FG%      3P   3P%      FT STL BLK
--------------------------------------------------------------------------------
Terry Mobley           34   16    0    3   1   8/11   72.7   1/2    50.0   1/1     2   0
Lamelo Quickley        34   19    0    0   0   7/9    77.8   4/4   100.0   5/6     1   1
Cole Griffin           34    2    8    2   4   1/7    14.3   0/3     0.0   3/4     0   1
Scottie Herro          34   12   13    2   3   6/16   37.5   1/5    20.0   4/5     0   0
Kyrie Adebayo          34    7   10    2   0   3/5    60.0   0/0     0.0   1/2     2   1
Cade Jokic             14    4    0    3   1   2/3    66.7   0/0     0.0   2/2     0   0
Jarrett Markkanen      14    5    3    0   2   2/4    50.0   1/3    33.3   0/0     0   0
Cole Holiday           14    0    0    1   1   0/1     0.0   0/0     0.0   1/2     0   0
Tyler Haliburton       14   11   10    0   0   3/8    37.5   1/4    25.0   4/4     0   0
Devin Griffin          14    4    4    1   0   2/3    66.7   0/0     0.0   3/4     2   0

TEAM: FG: 36/71 (50.7%), 3PT: 8/21 (38.1%), REB: 50 (12 off, 38 def), AST: 14, TO: 12

================================================================================
