================================================================================
                        FULL GAME - Team_058 vs Team_027                        
================================================================================

================================================================================
                       1ST QUARTER - Team_058 vs Team_027                       
================================================================================

[12:00] Team_058 possession (Score: 0-0)
FOUL! Shooting foul on John Russell. Tyrese Doncic to the line for 2 free throws. [Team fouls: 1] (John Russell: 1 personal fouls)   FT 1/2: GOOD   FT 2/2: GOOD Tyrese Doncic makes 2/2 from the line.
Score: 2-0

[11:45] Team_027 possession (Score: 2-0)
John Russell attempts a Midrange. Wide open! Tyrese Doncic is 6.0 feet away. [MAN] JOHN RUSSELL MAKES IT!
Score: 2-2

[11:34] Team_058 possession (Score: 2-2)
Bradley Sexton drives to the basket... FOUL! Offensive foul on Bradley Sexton! John Russell drew the charge! [Team fouls: 1] (Bradley Sexton: 1 personal fouls) TURNOVER! (dead ball)

[11:19] Team_027 possession (Score: 2-2)
Tony Doncic attempts a 3Pt. Contested by Kyle Westbrook (5.9 feet, MAN). Tony Doncic misses. Offensive rebound by Bradley Dosunmu! Bradley Dosunmu kicks it out.

[11:05] Team_027 possession (Score: 2-2)
Tim Johnson attempts a 3Pt. Contested by Bradley Sexton (2.9 feet, MAN). Tim Johnson misses. Offensive rebound by John Russell! John Russell puts it back in!
Score: 2-4

[10:52] Team_058 possession (Score: 2-4)
Bradley Sexton drives, picks up Tim Johnson. Help arrives from Tony Doncic! Bradley Sexton attempts a Layup. Wide open! Tony Doncic is 7.9 feet away. [MAN] Bradley Sexton misses. Offensive rebound by Stephen Haliburton! Stephen Haliburton puts it back in!
Score: 4-4

[10:40] Team_027 possession (Score: 4-4)
John Russell commits a violation (traveling/carry)! TURNOVER! (dead ball)

[10:26] Team_058 possession (Score: 4-4)
FOUL! Shooting foul on John Russell. Stephen Haliburton to the line for 2 free throws. [Team fouls: 2] (John Russell: 2 personal fouls)   FT 1/2: GOOD   FT 2/2: GOOD Stephen Haliburton makes 2/2 from the line.
Score: 6-4

[10:10] Team_027 possession (Score: 6-4)
Scottie Harden attempts a Midrange. BLOCKED BY KYLE WESTBROOK! Ball deflects out of bounds off Scottie Harden.

[09:56] Team_058 possession (Score: 6-4)
Tyrese Doncic drives, picks up John Russell. Help arrives from Tony Doncic! Tyrese Doncic attempts a Dunk. Contested by Tony Doncic (3.4 feet, MAN). TYRESE DONCIC MAKES IT! Assist: Kyle Westbrook
Score: 8-4

[09:46] Team_027 possession (Score: 8-4)
Tim Johnson attempts a 3Pt. Contested by Bradley Sexton (2.8 feet, ZONE). TIM JOHNSON MAKES IT! Assist: Tony Doncic
Score: 8-7

[09:28] Team_058 possession (Score: 8-7)
Stephen Haliburton drives, Bradley Dosunmu stays with him. Stephen Haliburton attempts a Layup. Wide open! Bradley Dosunmu is 8.5 feet away. [MAN] STEPHEN HALIBURTON MAKES IT!
Score: 10-7

[09:12] Team_027 possession (Score: 10-7)
Tony Doncic attempts a Midrange. Contested by Bradley Sexton (4.9 feet, ZONE). TONY DONCIC MAKES IT! Assist: Scottie Harden
Score: 10-9

[08:58] Team_058 possession (Score: 10-9)
Vince Hyland attempts a Midrange. Contested by Scottie Harden (5.9 feet, MAN). VINCE HYLAND MAKES IT! Assist: Bradley Sexton
Score: 12-9

[08:45] Team_027 possession (Score: 12-9)
FOUL! Shooting foul on Stephen Haliburton. Scottie Harden to the line for 2 free throws. [Team fouls: 2] (Stephen Haliburton: 1 personal fouls)   FT 1/2: GOOD   FT 2/2: MISS Scottie Harden makes 1/2 from the line. Rebound secured by Tyrese Doncic.
Score: 12-10

[08:27] Team_058 possession (Score: 12-10)
Kyle Westbrook attempts a Midrange. Contested by Tony Doncic (5.2 feet, MAN). KYLE WESTBROOK MAKES IT! Assist: Bradley Sexton
Score: 14-10

[08:14] Team_027 possession (Score: 14-10)
FOUL! Holding foul on Bradley Sexton. [Team fouls: 3] No free throws, side out. (Bradley Sexton: 2 personal fouls)

[08:01] Team_027 possession (Score: 14-10)
Tony Doncic attempts a Midrange. Wide open! Kyle Westbrook is 7.9 feet away. [MAN] Tony Doncic misses. Rebound secured by Stephen Haliburton.

[07:47] Team_058 possession (Score: 14-10)
Vince Hyland drives, picks up John Russell. Help arrives from Tony Doncic! Vince Hyland attempts a Dunk. Contested by Tony Doncic (2.6 feet, ZONE). Vince Hyland misses. Rebound secured by John Russell.

[07:32] Team_027 possession (Score: 14-10)
John Russell attempts a Midrange. Contested by Tyrese Doncic (4.1 feet, MAN). John Russell misses. FOUL! Loose ball foul on Bradley Sexton during the rebound battle. [Team fouls: 4] No free throws, side out. (Bradley Sexton: 3 personal fouls)

[07:20] Team_027 possession (Score: 14-10)
Tony Doncic loses control! Ball rolls out of bounds! TURNOVER! (dead ball)

[07:01] Team_058 possession (Score: 14-10)
Bradley Sexton drives, picks up John Russell. Help arrives from Tony Doncic! Bradley Sexton attempts a Dunk. Contested by Tony Doncic (3.4 feet, ZONE). BRADLEY SEXTON MAKES IT! Assist: Tyrese Doncic
Score: 16-10

[06:47] Team_027 possession (Score: 16-10)
Bradley Dosunmu makes the Layup and draws the foul on Stephen Haliburton! And-1! Bradley Dosunmu to the line for 1. [BONUS: 5 team fouls] (Stephen Haliburton: 2 personal fouls)   FT 1/1: GOOD Bradley Dosunmu makes 1/1 from the line.
Score: 16-13

[06:32] Team_058 possession (Score: 16-13)
Tyrese Doncic drives to the basket... Tyrese Doncic throws a bad pass! Stolen by John Russell! TURNOVER! (live ball)

[06:16] Team_027 possession (Score: 16-13)
Bradley Dosunmu attempts a 3Pt. Heavily contested by Stephen Haliburton (0.9 feet, MAN)! Bradley Dosunmu misses. Rebound secured by Stephen Haliburton.

[06:01] Team_058 possession (Score: 16-13)
Bradley Sexton attempts a Midrange. Contested by Tim Johnson (3.2 feet, MAN). Bradley Sexton misses. Rebound secured by John Russell.

[05:47] Team_027 possession (Score: 16-13)
FOUL! Holding foul on Kyle Westbrook. [IN THE BONUS! 6 team fouls] Tony Doncic to the line for 2 free throws. (Kyle Westbrook: 1 personal fouls)   FT 1/2: MISS   FT 2/2: GOOD Tony Doncic makes 1/2 from the line.
Score: 16-14

[05:31] Team_058 possession (Score: 16-14)
Vince Hyland drives and kicks out. Bradley Sexton attempts a 3Pt. Contested by Tim Johnson (5.0 feet, MAN). Bradley Sexton misses. Rebound secured by Bradley Dosunmu.

[05:16] Team_027 possession (Score: 16-14)
Bradley Dosunmu makes the Midrange and draws the foul on Bradley Sexton! And-1! Bradley Dosunmu to the line for 1. [BONUS: 7 team fouls] (Bradley Sexton: 4 personal fouls)   FT 1/1: GOOD Bradley Dosunmu makes 1/1 from the line.
Score: 16-17

[05:01] Team_058 possession (Score: 16-17)
Kyle Westbrook drives to the basket... FOUL! Offensive foul on Kyle Westbrook! John Russell drew the charge! [Team fouls: 8] (Kyle Westbrook: 2 personal fouls) TURNOVER! (dead ball)

[04:48] Team_027 possession (Score: 16-17)
John Russell drives, Tyrese Doncic stays with him. John Russell attempts a Dunk. Wide open! Tyrese Doncic is 6.8 feet away. [MAN] JOHN RUSSELL MAKES IT!
Score: 16-19

[04:37] Team_058 possession (Score: 16-19)
Stephen Haliburton attempts a 3Pt. Contested by Tim Johnson (2.6 feet, ZONE). STEPHEN HALIBURTON MAKES IT! Assist: Vince Hyland
Score: 19-19

[04:17] Team_027 possession (Score: 19-19)
Scottie Harden drives and kicks out. Bradley Dosunmu attempts a 3Pt. Contested by Bradley Sexton (4.2 feet, ZONE). Bradley Dosunmu misses. Rebound secured by Tyrese Doncic.

[04:03] Team_058 possession (Score: 19-19)
Bradley Sexton attempts a Layup. Wide open! John Russell is 6.7 feet away. [ZONE] BRADLEY SEXTON MAKES IT! Assist: Stephen Haliburton
Score: 21-19

[03:52] Team_027 possession (Score: 21-19)
FOUL! Reach-in foul on Stephen Haliburton during the drive. [IN THE BONUS! 9 team fouls] Scottie Harden to the line for 2 free throws. (Stephen Haliburton: 3 personal fouls)   FT 1/2: GOOD   FT 2/2: GOOD Scottie Harden makes 2/2 from the line.
Score: 21-21

[03:37] Team_058 possession (Score: 21-21)
Bradley Sexton attempts a Layup. Contested by Tim Johnson (3.6 feet, MAN). BRADLEY SEXTON MAKES IT! Assist: Tyrese Doncic
Score: 23-21

[03:27] Team_027 possession (Score: 23-21)
John Russell loses control! Ball rolls out of bounds! TURNOVER! (dead ball)

[03:15] Team_058 possession (Score: 23-21)
Kyle Westbrook drives, John Russell stays with him. Kyle Westbrook attempts a Layup. Contested by John Russell (4.1 feet, ZONE). KYLE WESTBROOK MAKES IT! Assist: Vince Hyland
Score: 25-21

[02:57] Team_027 possession (Score: 25-21)
Bradley Dosunmu makes the Dunk and draws the foul on Bradley Sexton! And-1! Bradley Dosunmu to the line for 1. [BONUS: 10 team fouls] (Bradley Sexton: 5 personal fouls)   FT 1/1: GOOD Bradley Dosunmu makes 1/1 from the line.
Score: 25-24

[02:40] Team_058 possession (Score: 25-24)
Vince Hyland attempts a Layup. Contested by John Russell (5.2 feet, ZONE). Vince Hyland misses. Offensive rebound by Stephen Haliburton! Stephen Haliburton's putback is no good. Rebound secured by John Russell.

[02:27] Team_027 possession (Score: 25-24)
Tim Johnson drives to the basket... Tim Johnson throws a bad pass out of bounds! TURNOVER! (dead ball)

[02:27] Substitution (Team_058): Bradley Sexton OUT → Draymond Williamson IN (stamina_rule2)

[02:27] Substitution (Team_058): Kyle Westbrook OUT → Jordan Ingram IN (stamina_rule2)

[02:27] Substitution (Team_058): Stephen Haliburton OUT → Shai Lowry IN (stamina_rule2)

[02:27] Substitution (Team_058): Tyrese Doncic OUT → Jarrett Gilgeous-Alexander IN (stamina_rule2)

[02:27] Substitution (Team_027): Tim Johnson OUT → CJ Green IN (stamina_rule2)

[02:27] Substitution (Team_027): Scottie Harden OUT → Rudy Quickley IN (stamina_rule2)

[02:27] Substitution (Team_027): Bradley Dosunmu OUT → LeBron Russell IN (stamina_rule2)

[02:27] Substitution (Team_027): John Russell OUT → Ben Stewart IN (stamina_rule2)

[02:13] Team_058 possession (Score: 25-24)
FOUL! Reach-in foul on Rudy Quickley during the drive. [Team fouls: 3] No free throws, side out. (Rudy Quickley: 1 personal fouls)

[02:02] Team_058 possession (Score: 25-24)
Vince Hyland attempts a 3Pt. Contested by Rudy Quickley (3.1 feet, ZONE). VINCE HYLAND MAKES IT!
Score: 28-24

[01:46] Team_027 possession (Score: 28-24)
FOUL! Offensive foul on Ben Stewart! Jarrett Gilgeous-Alexander drew the charge! [Team fouls: 4] (Ben Stewart: 1 personal fouls) TURNOVER! (dead ball)

[01:32] Team_058 possession (Score: 28-24)
Jarrett Gilgeous-Alexander drives, Ben Stewart stays with him. Jarrett Gilgeous-Alexander attempts a Layup. Contested by Ben Stewart (5.9 feet, MAN). Jarrett Gilgeous-Alexander misses. Rebound secured by Ben Stewart.

[01:17] Team_027 possession (Score: 28-24)
Tony Doncic attempts a Midrange. Contested by Jordan Ingram (5.2 feet, MAN). Tony Doncic misses. Rebound secured by Jarrett Gilgeous-Alexander.

[01:04] Team_058 possession (Score: 28-24)
Jarrett Gilgeous-Alexander drives, Ben Stewart stays with him. Jarrett Gilgeous-Alexander attempts a Dunk. Contested by Ben Stewart (3.2 feet, MAN). JARRETT GILGEOUS-ALEXANDER MAKES IT!
Score: 30-24

[00:47] Team_027 possession (Score: 30-24)
Rudy Quickley attempts a Midrange. Contested by Vince Hyland (5.2 feet, MAN). RUDY QUICKLEY MAKES IT! Assist: LeBron Russell
Score: 30-26

[00:32] Team_058 possession (Score: 30-26)
Jarrett Gilgeous-Alexander attempts a Layup. Heavily contested by Ben Stewart (1.2 feet, MAN)! JARRETT GILGEOUS-ALEXANDER MAKES IT! Assist: Jordan Ingram
Score: 32-26

[00:19] Team_027 possession (Score: 32-26)
Ben Stewart makes the Dunk and draws the foul on Jarrett Gilgeous-Alexander! And-1! Ben Stewart to the line for 1. [BONUS: 11 team fouls] (Jarrett Gilgeous-Alexander: 1 personal fouls)   FT 1/1: GOOD Ben Stewart makes 1/1 from the line.
Score: 32-29

[00:04] Team_058 possession (Score: 32-29)
Jordan Ingram attempts a Layup. Wide open! Ben Stewart is 6.4 feet away. [ZONE] Jordan Ingram misses. Rebound secured by Tony Doncic.

================================================================================
                              1ST QUARTER COMPLETE                              
================================================================================

1ST QUARTER SCORE: Team_058 32, Team_027 29

BOX SCORE:
================================================================================

Team_058
--------------------------------------------------------------------------------
Player                MIN  PTS  REB  AST  TO      FG   FG%      3P   3P%
--------------------------------------------------------------------------------
Stephen Haliburton     10    9    3    1   0   4/4   100.0     0/0   0.0
John Russell           10    6    4    0   0   3/3   100.0     0/0   0.0
Bradley Sexton         10    6    0    2   0   3/4    75.0     0/0   0.0
Vince Hyland           12    5    0    2   0   2/5    40.0     0/0   0.0
Tyrese Doncic          10    4    2    2   0   2/2   100.0     0/0   0.0
Kyle Westbrook         10    4    0    1   0   2/2   100.0     0/0   0.0
Jarrett Gilgeous-Alexander    2    4    1    0   0   2/3    66.7     0/0   0.0
Jordan Ingram           2    0    0    1   0   0/1     0.0     0/0   0.0

TEAM: FG: 15/21 (71.4%), 3PT: 2/2 (100.0%), REB: 7 (2 off, 5 def), AST: 9, TO: 3
TEAM FOULS: 11 [Team_027 in BONUS]


Team_027
--------------------------------------------------------------------------------
Player                MIN  PTS  REB  AST  TO      FG   FG%      3P   3P%
--------------------------------------------------------------------------------
Bradley Dosunmu        10    9    3    0   0   3/4    75.0     0/0   0.0
Tim Johnson            10    3    0    0   0   1/1   100.0     0/0   0.0
Tony Doncic            12    3    1    1   0   2/4    50.0     0/0   0.0
Ben Stewart             2    3    1    0   0   1/1   100.0     0/0   0.0
Scottie Harden         10    2    0    1   0   1/4    25.0     0/0   0.0
Rudy Quickley           2    2    0    0   0   1/1   100.0     0/0   0.0
LeBron Russell          2    0    0    1   0   0/0     0.0     0/0   0.0

TEAM: FG: 12/18 (66.7%), 3PT: 2/3 (66.7%), REB: 8 (3 off, 5 def), AST: 3, TO: 5
TEAM FOULS: 4

================================================================================

================================================================================
                       2ND QUARTER - Team_058 vs Team_027                       
================================================================================

[12:00] Team_058 possession (Score: 32-29)
Stephen Haliburton drives, Bradley Dosunmu stays with him. Stephen Haliburton attempts a Dunk. Wide open! Bradley Dosunmu is 6.4 feet away. [MAN] Stephen Haliburton misses. Offensive rebound by Tyrese Doncic! Tyrese Doncic kicks it out.

[11:43] Team_058 possession (Score: 32-29)
Tyrese Doncic drives to the basket... Tyrese Doncic loses control! Ball rolls out of bounds! TURNOVER! (dead ball)

[11:43] Substitution (Team_058): Vince Hyland OUT → Pascal Holiday IN (stamina_rule2)

[11:43] Substitution (Team_027): Tony Doncic OUT → Dirk Lillard IN (stamina_rule2)

[11:26] Team_027 possession (Score: 32-29)
FOUL! Reach-in foul on Pascal Holiday during the drive. [Team fouls: 1] No free throws, side out. (Pascal Holiday: 1 personal fouls)

[11:14] Team_027 possession (Score: 32-29)
Dirk Lillard drives and kicks out. Bradley Dosunmu attempts a 3Pt. Contested by Stephen Haliburton (4.6 feet, MAN). Bradley Dosunmu misses. FOUL! Loose ball foul on Stephen Haliburton during the rebound battle. [Team fouls: 2] No free throws, side out. (Stephen Haliburton: 1 personal fouls)

[11:00] Team_027 possession (Score: 32-29)
Scottie Harden attempts a Layup. BLOCKED BY PASCAL HOLIDAY! Ball is loose! Rebound secured by Tyrese Doncic.

[10:42] Team_058 possession (Score: 32-29)
Tyrese Doncic drives, John Russell stays with him. Tyrese Doncic attempts a Dunk. Wide open! John Russell is 6.8 feet away. [ZONE] TYRESE DONCIC MAKES IT! Assist: Stephen Haliburton
Score: 34-29

[10:27] Team_027 possession (Score: 34-29)
Bradley Dosunmu makes the Layup and draws the foul on Stephen Haliburton! And-1! Bradley Dosunmu to the line for 1. [Team fouls: 3] (Stephen Haliburton: 2 personal fouls)   FT 1/1: GOOD Bradley Dosunmu makes 1/1 from the line.
Score: 34-32

[10:11] Team_058 possession (Score: 34-32)
FOUL! Shooting foul on Bradley Dosunmu. Stephen Haliburton to the line for 3 free throws. [Team fouls: 1] (Bradley Dosunmu: 1 personal fouls)   FT 1/3: GOOD   FT 2/3: MISS   FT 3/3: GOOD Stephen Haliburton makes 2/3 from the line.
Score: 36-32

[10:01] Team_027 possession (Score: 36-32)
John Russell attempts a Layup. Contested by Tyrese Doncic (5.1 feet, MAN). JOHN RUSSELL MAKES IT!
Score: 36-34

[09:43] Team_058 possession (Score: 36-34)
Tyrese Doncic attempts a Midrange. Contested by Scottie Harden (4.3 feet, ZONE). Tyrese Doncic misses. Rebound secured by John Russell.

[09:26] Team_027 possession (Score: 36-34)
Tim Johnson drives and kicks out. Dirk Lillard attempts a 3Pt. Contested by Kyle Westbrook (2.9 feet, MAN). Dirk Lillard misses. Rebound secured by Stephen Haliburton.

[09:07] Team_058 possession (Score: 36-34)
Pascal Holiday drives, picks up Scottie Harden. Help arrives from Dirk Lillard! Pascal Holiday attempts a Layup. Contested by Dirk Lillard (4.1 feet, MAN). PASCAL HOLIDAY MAKES IT! Assist: Kyle Westbrook
Score: 38-34

[08:54] Team_027 possession (Score: 38-34)
Dirk Lillard attempts a 3Pt. Wide open! Kyle Westbrook is 7.7 feet away. [MAN] Dirk Lillard misses. Rebound secured by Stephen Haliburton.

[08:39] Team_058 possession (Score: 38-34)
Stephen Haliburton attempts a Midrange. Contested by Bradley Dosunmu (2.9 feet, MAN). Stephen Haliburton misses. Offensive rebound by Stephen Haliburton! Stephen Haliburton's putback is no good. Rebound secured by Bradley Dosunmu.

[08:23] Team_027 possession (Score: 38-34)
Dirk Lillard attempts a Midrange. Contested by Kyle Westbrook (5.2 feet, ZONE). Dirk Lillard misses. Rebound secured by Tyrese Doncic.

[08:12] Team_058 possession (Score: 38-34)
Stephen Haliburton drives, Bradley Dosunmu stays with him. Stephen Haliburton attempts a Layup. Wide open! Bradley Dosunmu is 6.2 feet away. [MAN] STEPHEN HALIBURTON MAKES IT! Assist: Kyle Westbrook
Score: 40-34

[08:02] Team_027 possession (Score: 40-34)
FOUL! Shooting foul on Stephen Haliburton. Bradley Dosunmu to the line for 2 free throws. [Team fouls: 4] (Stephen Haliburton: 3 personal fouls)   FT 1/2: MISS   FT 2/2: GOOD Bradley Dosunmu makes 1/2 from the line.
Score: 40-35

[07:50] Team_058 possession (Score: 40-35)
Stephen Haliburton drives to the basket... Stephen Haliburton throws a bad pass! Stolen by Bradley Dosunmu! TURNOVER! (live ball)

[07:39] Team_027 possession (Score: 40-35)
Bradley Dosunmu attempts a 3Pt. Contested by Bradley Sexton (3.1 feet, ZONE). Bradley Dosunmu misses. Rebound secured by Tyrese Doncic.

[07:23] Team_058 possession (Score: 40-35)
Tyrese Doncic drives and kicks out. Stephen Haliburton attempts a 3Pt. Wide open! Bradley Dosunmu is 6.2 feet away. [MAN] Stephen Haliburton misses. Offensive rebound by Stephen Haliburton! Stephen Haliburton puts it back in!
Score: 42-35

[07:04] Team_027 possession (Score: 42-35)
Tim Johnson drives and kicks out. Dirk Lillard attempts a 3Pt. Contested by Bradley Sexton (2.5 feet, ZONE). Dirk Lillard misses. Rebound secured by Tyrese Doncic.

[06:50] Team_058 possession (Score: 42-35)
Pascal Holiday attempts a Midrange. Contested by Dirk Lillard (5.7 feet, ZONE). PASCAL HOLIDAY MAKES IT!
Score: 44-35

[06:33] Team_027 possession (Score: 44-35)
FOUL! Reach-in foul on Stephen Haliburton during the drive. [IN THE BONUS! 5 team fouls] Bradley Dosunmu to the line for 2 free throws. (Stephen Haliburton: 4 personal fouls)   FT 1/2: GOOD   FT 2/2: GOOD Bradley Dosunmu makes 2/2 from the line.
Score: 44-37

[06:22] Team_058 possession (Score: 44-37)
Bradley Sexton attempts a 3Pt. Wide open! Tim Johnson is 7.2 feet away. [MAN] Bradley Sexton misses. Offensive rebound by Tyrese Doncic! Tyrese Doncic kicks it out.

[06:11] Team_058 possession (Score: 44-37)
FOUL! Shooting foul on Dirk Lillard. Kyle Westbrook to the line for 2 free throws. [Team fouls: 2] (Dirk Lillard: 1 personal fouls)   FT 1/2: MISS   FT 2/2: GOOD Kyle Westbrook makes 1/2 from the line.
Score: 45-37

[05:52] Team_027 possession (Score: 45-37)
Scottie Harden drives, Pascal Holiday stays with him. Scottie Harden attempts a Dunk. Contested by Pascal Holiday (4.8 feet, MAN). SCOTTIE HARDEN MAKES IT! Assist: Tim Johnson
Score: 45-39

[05:40] Team_058 possession (Score: 45-39)
Kyle Westbrook attempts a Midrange. Wide open! Dirk Lillard is 7.3 feet away. [MAN] Kyle Westbrook misses. Offensive rebound by Pascal Holiday! Pascal Holiday's putback is no good. Rebound secured by Bradley Dosunmu.

[05:24] Team_027 possession (Score: 45-39)
Dirk Lillard makes the Layup and draws the foul on Kyle Westbrook! And-1! Dirk Lillard to the line for 1. [BONUS: 6 team fouls] (Kyle Westbrook: 1 personal fouls)   FT 1/1: GOOD Dirk Lillard makes 1/1 from the line.
Score: 45-42

[05:08] Team_058 possession (Score: 45-42)
Bradley Sexton attempts a 3Pt. Wide open! Tim Johnson is 8.5 feet away. [MAN] BRADLEY SEXTON MAKES IT! Assist: Kyle Westbrook
Score: 48-42

[04:50] Team_027 possession (Score: 48-42)
Tim Johnson attempts a Midrange. Contested by Bradley Sexton (4.7 feet, MAN). Tim Johnson misses. FOUL! Loose ball foul on Pascal Holiday during the rebound battle. [IN THE BONUS! 7 team fouls] John Russell to the line for 2 free throws. (Pascal Holiday: 2 personal fouls)   FT 1/2: GOOD   FT 2/2: GOOD John Russell makes 2/2 from the line.
Score: 48-44

[04:38] Team_058 possession (Score: 48-44)
Tyrese Doncic drives, John Russell stays with him. Tyrese Doncic attempts a Layup. Wide open! John Russell is 6.5 feet away. [ZONE] TYRESE DONCIC MAKES IT! Assist: Kyle Westbrook
Score: 50-44

[04:23] Team_027 possession (Score: 50-44)
FOUL! Holding foul on Kyle Westbrook. [IN THE BONUS! 8 team fouls] Dirk Lillard to the line for 2 free throws. (Kyle Westbrook: 2 personal fouls)   FT 1/2: GOOD   FT 2/2: GOOD Dirk Lillard makes 2/2 from the line.
Score: 50-46

[04:08] Team_058 possession (Score: 50-46)
Bradley Sexton attempts a 3Pt. Wide open! Tim Johnson is 6.7 feet away. [MAN] BRADLEY SEXTON MAKES IT! Assist: Kyle Westbrook
Score: 53-46

[03:58] Team_027 possession (Score: 53-46)
Tim Johnson throws a bad pass! Stolen by Bradley Sexton! TURNOVER! (live ball)

[03:43] Team_058 possession (Score: 53-46)
Bradley Sexton attempts a 3Pt. Contested by Dirk Lillard (4.5 feet, ZONE). BRADLEY SEXTON MAKES IT! Assist: Pascal Holiday
Score: 56-46

[03:30] Team_027 possession (Score: 56-46)
John Russell attempts a Midrange. Contested by Pascal Holiday (4.6 feet, ZONE). John Russell misses. Rebound secured by Tyrese Doncic.

[03:16] Team_058 possession (Score: 56-46)
Kyle Westbrook attempts a 3Pt. Contested by Dirk Lillard (4.6 feet, MAN). Kyle Westbrook misses. Rebound secured by Dirk Lillard.

[03:05] Team_027 possession (Score: 56-46)
Dirk Lillard attempts a Layup. Contested by Stephen Haliburton (3.0 feet, ZONE). DIRK LILLARD MAKES IT!
Score: 56-48

[02:52] Team_058 possession (Score: 56-48)
FOUL! Holding foul on Bradley Dosunmu. [Team fouls: 3] No free throws, side out. (Bradley Dosunmu: 2 personal fouls)

[02:34] Team_058 possession (Score: 56-48)
Kyle Westbrook attempts a Midrange. Contested by Dirk Lillard (5.4 feet, MAN). Kyle Westbrook misses. Offensive rebound by Tyrese Doncic! Tyrese Doncic kicks it out.

[02:19] Team_058 possession (Score: 56-48)
Stephen Haliburton attempts a 3Pt. Contested by Dirk Lillard (4.2 feet, ZONE). Stephen Haliburton misses. Rebound secured by Bradley Dosunmu.

[02:09] Team_027 possession (Score: 56-48)
Dirk Lillard makes the Dunk and draws the foul on Stephen Haliburton! And-1! Dirk Lillard to the line for 1. [BONUS: 9 team fouls] (Stephen Haliburton: 5 personal fouls)   FT 1/1: MISS Dirk Lillard makes 0/1 from the line. Rebound secured by Pascal Holiday.
Score: 56-50

[01:53] Team_058 possession (Score: 56-50)
Pascal Holiday attempts a 3Pt. Contested by Scottie Harden (3.7 feet, MAN). Pascal Holiday misses. Rebound secured by Bradley Dosunmu.

[01:40] Team_027 possession (Score: 56-50)
Bradley Dosunmu attempts a 3Pt. Wide open! Stephen Haliburton is 9.0 feet away. [MAN] Bradley Dosunmu misses. Rebound secured by Pascal Holiday.

[01:28] Team_058 possession (Score: 56-50)
Tyrese Doncic makes the Layup and draws the foul on John Russell! And-1! Tyrese Doncic to the line for 1. [Team fouls: 4] (John Russell: 1 personal fouls)   FT 1/1: GOOD Tyrese Doncic makes 1/1 from the line.
Score: 59-50

[01:15] Team_027 possession (Score: 59-50)
Tim Johnson attempts a 3Pt. Contested by Bradley Sexton (4.3 feet, MAN). Tim Johnson misses. Rebound secured by Pascal Holiday.

[01:01] Team_058 possession (Score: 59-50)
Tyrese Doncic attempts a 3Pt. Contested by Dirk Lillard (2.1 feet, ZONE). TYRESE DONCIC MAKES IT! Assist: Kyle Westbrook
Score: 62-50

[00:47] Team_027 possession (Score: 62-50)
Dirk Lillard attempts a 3Pt. Contested by Bradley Sexton (3.9 feet, ZONE). Dirk Lillard misses. Rebound secured by Pascal Holiday.

[00:33] Team_058 possession (Score: 62-50)
FOUL! Reach-in foul on Bradley Dosunmu during the drive. [IN THE BONUS! 5 team fouls] Stephen Haliburton to the line for 2 free throws. (Bradley Dosunmu: 3 personal fouls)   FT 1/2: GOOD   FT 2/2: GOOD Stephen Haliburton makes 2/2 from the line.
Score: 64-50

[00:21] Team_027 possession (Score: 64-50)
Dirk Lillard attempts a 3Pt. Contested by Kyle Westbrook (4.8 feet, MAN). Dirk Lillard misses. Rebound secured by Tyrese Doncic.

[00:05] Team_058 possession (Score: 64-50)
Tyrese Doncic attempts a Midrange. Wide open! John Russell is 7.8 feet away. [MAN] Tyrese Doncic misses. Rebound secured by Dirk Lillard.

================================================================================
                              2ND QUARTER COMPLETE                              
================================================================================

2ND QUARTER SCORE: Team_058 32, Team_027 21

BOX SCORE:
================================================================================

Team_058
--------------------------------------------------------------------------------
Player                MIN  PTS  REB  AST  TO      FG   FG%      3P   3P%
--------------------------------------------------------------------------------
Tyrese Doncic          22   10    9    0   0   4/6    66.7     0/0   0.0
Bradley Sexton         22    9    0    0   0   3/3   100.0     0/0   0.0
Stephen Haliburton     22    8    3    1   0   4/6    66.7     0/0   0.0
Pascal Holiday         12    4    4    1   0   2/3    66.7     0/0   0.0
Kyle Westbrook         22    1    0    6   0   1/3    33.3     0/0   0.0

TEAM: FG: 14/21 (66.7%), 3PT: 5/8 (62.5%), REB: 18 (6 off, 12 def), AST: 8, TO: 2
TEAM FOULS: 9 [Team_027 in BONUS]


Team_027
--------------------------------------------------------------------------------
Player                MIN  PTS  REB  AST  TO      FG   FG%      3P   3P%
--------------------------------------------------------------------------------
Dirk Lillard           12    7    2    0   0   3/8    37.5     0/0   0.0
Bradley Dosunmu        22    6    4    0   0   3/5    60.0     0/0   0.0
John Russell           22    4    2    0   0   2/3    66.7     0/0   0.0
Scottie Harden         22    2    0    0   0   1/2    50.0     0/0   0.0
Tim Johnson            22    0    0    1   0   0/3     0.0     0/0   0.0

TEAM: FG: 9/21 (42.9%), 3PT: 0/6 (0.0%), REB: 6 (1 off, 5 def), AST: 1, TO: 1
TEAM FOULS: 5 [Team_058 in BONUS]

================================================================================

================================================================================
                       3RD QUARTER - Team_058 vs Team_027                       
================================================================================

[12:00] Team_058 possession (Score: 64-50)
FOUL! Shooting foul on John Russell. Tyrese Doncic to the line for 2 free throws. [Team fouls: 1] (John Russell: 1 personal fouls)   FT 1/2: GOOD   FT 2/2: MISS Tyrese Doncic makes 1/2 from the line. Rebound secured by John Russell.
Score: 65-50

[11:46] Team_027 possession (Score: 65-50)
Scottie Harden attempts a 3Pt. Contested by Bradley Sexton (3.1 feet, ZONE). Scottie Harden misses. Offensive rebound by Bradley Dosunmu! Bradley Dosunmu kicks it out.

[11:33] Team_027 possession (Score: 65-50)
Bradley Dosunmu attempts a 3Pt. Heavily contested by Bradley Sexton (0.5 feet, ZONE)! Bradley Dosunmu misses. Rebound secured by Tyrese Doncic.

[11:19] Team_058 possession (Score: 65-50)
Tyrese Doncic attempts a Midrange. Heavily contested by Tony Doncic (1.9 feet, ZONE)! Tyrese Doncic misses. Rebound secured by Tony Doncic.

[11:04] Team_027 possession (Score: 65-50)
Tim Johnson makes the Layup and draws the foul on Stephen Haliburton! And-1! Tim Johnson to the line for 1. [Team fouls: 1] (Stephen Haliburton: 1 personal fouls)   FT 1/1: GOOD Tim Johnson makes 1/1 from the line.
Score: 65-53

[10:53] Team_058 possession (Score: 65-53)
Bradley Sexton attempts a Midrange. Contested by Tim Johnson (4.2 feet, MAN). Bradley Sexton misses. FOUL! Loose ball foul on Tony Doncic during the rebound battle. [Team fouls: 2] No free throws, side out. (Tony Doncic: 1 personal fouls)

[10:36] Team_058 possession (Score: 65-53)
Stephen Haliburton drives, John Russell stays with him. Stephen Haliburton attempts a Layup. Heavily contested by John Russell (1.8 feet, ZONE)! STEPHEN HALIBURTON MAKES IT!
Score: 67-53

[10:20] Team_027 possession (Score: 67-53)
Scottie Harden attempts a 3Pt. Contested by Bradley Sexton (3.1 feet, ZONE). SCOTTIE HARDEN MAKES IT! Assist: Tim Johnson
Score: 67-56

[10:05] Team_058 possession (Score: 67-56)
Vince Hyland attempts a Layup. Wide open! John Russell is 6.4 feet away. [ZONE] VINCE HYLAND MAKES IT!
Score: 69-56

[09:53] Team_027 possession (Score: 69-56)
Tim Johnson attempts a 3Pt. Contested by Bradley Sexton (4.1 feet, MAN). Tim Johnson misses. Rebound secured by Tyrese Doncic.

[09:37] Team_058 possession (Score: 69-56)
Vince Hyland attempts a Midrange. Contested by Scottie Harden (2.1 feet, ZONE). Vince Hyland misses. Rebound secured by Bradley Dosunmu.

[09:26] Team_027 possession (Score: 69-56)
Scottie Harden drives, picks up Stephen Haliburton. Help arrives from Bradley Sexton! Scottie Harden attempts a Layup. Heavily contested by Bradley Sexton (0.5 feet, ZONE)! SCOTTIE HARDEN MAKES IT! Assist: Bradley Dosunmu
Score: 69-58

[09:13] Team_058 possession (Score: 69-58)
Kyle Westbrook loses control! Ball rolls out of bounds! TURNOVER! (dead ball)

[08:58] Team_027 possession (Score: 69-58)
Bradley Dosunmu loses control! Ball rolls out of bounds! TURNOVER! (dead ball)

[08:47] Team_058 possession (Score: 69-58)
Vince Hyland attempts a 3Pt. Heavily contested by Tim Johnson (1.3 feet, ZONE)! VINCE HYLAND MAKES IT! Assist: Kyle Westbrook
Score: 72-58

[08:32] Team_027 possession (Score: 72-58)
Scottie Harden makes the Midrange and draws the foul on Bradley Sexton! And-1! Scottie Harden to the line for 1. [Team fouls: 2] (Bradley Sexton: 1 personal fouls)   FT 1/1: GOOD Scottie Harden makes 1/1 from the line.
Score: 72-61

[08:15] Team_058 possession (Score: 72-61)
Stephen Haliburton attempts a Layup. Contested by John Russell (4.7 feet, ZONE). STEPHEN HALIBURTON MAKES IT!
Score: 74-61

[07:58] Team_027 possession (Score: 74-61)
Tony Doncic drives, Stephen Haliburton stays with him. Tony Doncic attempts a Dunk. Contested by Stephen Haliburton (2.5 feet, ZONE). TONY DONCIC MAKES IT! Assist: Tim Johnson
Score: 74-63

[07:46] Team_058 possession (Score: 74-63)
FOUL! Holding foul on John Russell. [Team fouls: 3] No free throws, side out. (John Russell: 2 personal fouls)

[07:27] Team_058 possession (Score: 74-63)
Stephen Haliburton drives, John Russell stays with him. Stephen Haliburton attempts a Layup. Contested by John Russell (4.7 feet, ZONE). STEPHEN HALIBURTON MAKES IT! Assist: Tyrese Doncic
Score: 76-63

[07:14] Team_027 possession (Score: 76-63)
FOUL! Shooting foul on Bradley Sexton. Tony Doncic to the line for 3 free throws. [Team fouls: 3] (Bradley Sexton: 2 personal fouls)   FT 1/3: MISS   FT 2/3: GOOD   FT 3/3: GOOD Tony Doncic makes 2/3 from the line.
Score: 76-65

[07:00] Team_058 possession (Score: 76-65)
Stephen Haliburton loses control! Ball rolls out of bounds! TURNOVER! (dead ball)

[06:46] Team_027 possession (Score: 76-65)
Tony Doncic attempts a Midrange. Wide open! Kyle Westbrook is 9.0 feet away. [MAN] TONY DONCIC MAKES IT!
Score: 76-67

[06:32] Team_058 possession (Score: 76-67)
Stephen Haliburton attempts a 3Pt. Wide open! Tim Johnson is 6.8 feet away. [ZONE] Stephen Haliburton misses. Rebound secured by John Russell.

[06:13] Team_027 possession (Score: 76-67)
Tim Johnson attempts a Layup. Contested by Bradley Sexton (2.7 feet, MAN). TIM JOHNSON MAKES IT!
Score: 76-69

[06:02] Team_058 possession (Score: 76-69)
Vince Hyland attempts a Layup. BLOCKED BY SCOTTIE HARDEN! Ball is loose! Rebound secured by Tony Doncic.

[05:49] Team_027 possession (Score: 76-69)
Tony Doncic attempts a 3Pt. Contested by Kyle Westbrook (4.2 feet, MAN). Tony Doncic misses. Rebound secured by Bradley Sexton.

[05:33] Team_058 possession (Score: 76-69)
Tyrese Doncic makes the Layup and draws the foul on John Russell! And-1! Tyrese Doncic to the line for 1. [Team fouls: 4] (John Russell: 3 personal fouls)   FT 1/1: GOOD Tyrese Doncic makes 1/1 from the line.
Score: 79-69

[05:19] Team_027 possession (Score: 79-69)
Bradley Dosunmu attempts a Layup. BLOCKED BY BRADLEY SEXTON! Ball is loose! Rebound secured by Stephen Haliburton.

[05:03] Team_058 possession (Score: 79-69)
Stephen Haliburton drives and kicks out. Vince Hyland attempts a 3Pt. Contested by Tim Johnson (5.3 feet, ZONE). Vince Hyland misses. Offensive rebound by Tyrese Doncic! Tyrese Doncic kicks it out.

[04:48] Team_058 possession (Score: 79-69)
Kyle Westbrook attempts a 3Pt. Contested by Tim Johnson (3.7 feet, ZONE). Kyle Westbrook misses. Rebound secured by Bradley Dosunmu.

[04:37] Team_027 possession (Score: 79-69)
Bradley Dosunmu attempts a 3Pt. Contested by Bradley Sexton (2.3 feet, ZONE). BRADLEY DOSUNMU MAKES IT! Assist: Tim Johnson
Score: 79-72

[04:22] Team_058 possession (Score: 79-72)
Bradley Sexton attempts a 3Pt. Wide open! Tim Johnson is 6.4 feet away. [MAN] Bradley Sexton misses. Rebound secured by John Russell.

[04:03] Team_027 possession (Score: 79-72)
FOUL! Holding foul on Tyrese Doncic. [Team fouls: 4] No free throws, side out. (Tyrese Doncic: 1 personal fouls)

[03:49] Team_027 possession (Score: 79-72)
FOUL! Reach-in foul on Stephen Haliburton during the drive. [IN THE BONUS! 5 team fouls] Tim Johnson to the line for 2 free throws. (Stephen Haliburton: 2 personal fouls)   FT 1/2: GOOD   FT 2/2: GOOD Tim Johnson makes 2/2 from the line.
Score: 79-74

[03:36] Team_058 possession (Score: 79-74)
Stephen Haliburton attempts a 3Pt. Wide open! Bradley Dosunmu is 6.1 feet away. [MAN] STEPHEN HALIBURTON MAKES IT! Assist: Bradley Sexton
Score: 82-74

[03:22] Team_027 possession (Score: 82-74)
Bradley Dosunmu attempts a Layup. Heavily contested by Stephen Haliburton (1.7 feet, MAN)! Bradley Dosunmu misses. Rebound secured by Tyrese Doncic.

[03:10] Team_058 possession (Score: 82-74)
FOUL! Holding foul on Tim Johnson. [IN THE BONUS! 5 team fouls] Bradley Sexton to the line for 2 free throws. (Tim Johnson: 1 personal fouls)   FT 1/2: GOOD   FT 2/2: GOOD Bradley Sexton makes 2/2 from the line.
Score: 84-74

[02:54] Team_027 possession (Score: 84-74)
Tim Johnson attempts a 3Pt. Contested by Bradley Sexton (5.4 feet, ZONE). TIM JOHNSON MAKES IT! Assist: Tony Doncic
Score: 84-77

[02:40] Team_058 possession (Score: 84-77)
Bradley Sexton attempts a Layup. BLOCKED BY TONY DONCIC! Ball deflects out of bounds off Bradley Sexton.

[02:29] Team_027 possession (Score: 84-77)
Bradley Dosunmu attempts a Midrange. Contested by Stephen Haliburton (5.1 feet, MAN). BRADLEY DOSUNMU MAKES IT!
Score: 84-79

[02:15] Team_058 possession (Score: 84-79)
Tyrese Doncic drives, picks up John Russell. Help arrives from Tony Doncic! Tyrese Doncic attempts a Dunk. Contested by Tony Doncic (5.5 feet, ZONE). TYRESE DONCIC MAKES IT!
Score: 86-79

[01:59] Team_027 possession (Score: 86-79)
John Russell attempts a 3Pt. Contested by Tyrese Doncic (3.6 feet, MAN). JOHN RUSSELL MAKES IT! Assist: Tim Johnson
Score: 86-82

[01:44] Team_058 possession (Score: 86-82)
Tyrese Doncic attempts a Layup. Contested by John Russell (3.3 feet, ZONE). Tyrese Doncic misses. Offensive rebound by Stephen Haliburton! Stephen Haliburton puts it back in!
Score: 88-82

[01:31] Team_027 possession (Score: 88-82)
Tim Johnson attempts a 3Pt. Contested by Bradley Sexton (3.1 feet, MAN). Tim Johnson misses. Rebound secured by Stephen Haliburton.

[01:20] Team_058 possession (Score: 88-82)
Kyle Westbrook attempts a Midrange. Contested by Tony Doncic (5.3 feet, MAN). KYLE WESTBROOK MAKES IT! Assist: Bradley Sexton
Score: 90-82

[01:01] Team_027 possession (Score: 90-82)
Tim Johnson drives, picks up Bradley Sexton. Help arrives from Kyle Westbrook! Tim Johnson attempts a Dunk. Contested by Kyle Westbrook (3.7 feet, MAN). Tim Johnson misses. Rebound secured by Stephen Haliburton.

[00:46] Team_058 possession (Score: 90-82)
Kyle Westbrook attempts a Midrange. Wide open! Tim Johnson is 6.6 feet away. [ZONE] KYLE WESTBROOK MAKES IT! Assist: Tyrese Doncic
Score: 92-82

[00:34] Team_027 possession (Score: 92-82)
Tim Johnson drives, Stephen Haliburton stays with him. Tim Johnson attempts a Dunk. Contested by Stephen Haliburton (3.1 feet, ZONE). TIM JOHNSON MAKES IT!
Score: 92-84

[00:20] Team_058 possession (Score: 92-84)
Vince Hyland attempts a 3Pt. Wide open! Tim Johnson is 8.0 feet away. [ZONE] VINCE HYLAND MAKES IT! Assist: Kyle Westbrook
Score: 95-84

[00:09] Team_027 possession (Score: 95-84)
Tim Johnson drives and kicks out. Tony Doncic attempts a 3Pt. Wide open! Bradley Sexton is 6.8 feet away. [ZONE] TONY DONCIC MAKES IT! Assist: John Russell
Score: 95-87

================================================================================
                              3RD QUARTER COMPLETE                              
================================================================================

3RD QUARTER SCORE: Team_058 31, Team_027 37

BOX SCORE:
================================================================================

Team_058
--------------------------------------------------------------------------------
Player                MIN  PTS  REB  AST  TO      FG   FG%      3P   3P%
--------------------------------------------------------------------------------
Stephen Haliburton     34   11    5    0   0   5/6    83.3     0/0   0.0
Vince Hyland           25    8    0    0   0   3/5    60.0     0/0   0.0
Tyrese Doncic          34    5    4    2   0   2/4    50.0     0/0   0.0
Kyle Westbrook         34    4    0    2   0   2/3    66.7     0/0   0.0
Bradley Sexton         34    2    1    2   0   1/3    33.3     0/0   0.0

TEAM: FG: 13/21 (61.9%), 3PT: 3/6 (50.0%), REB: 10 (3 off, 7 def), AST: 6, TO: 2
TEAM FOULS: 5 [Team_027 in BONUS]


Team_027
--------------------------------------------------------------------------------
Player                MIN  PTS  REB  AST  TO      FG   FG%      3P   3P%
--------------------------------------------------------------------------------
Tim Johnson            34   12    0    4   0   5/8    62.5     0/0   0.0
Tony Doncic            25    9    2    1   0   4/5    80.0     0/0   0.0
Scottie Harden         34    8    0    0   0   3/3   100.0     0/0   0.0
Bradley Dosunmu        34    5    3    1   0   2/5    40.0     0/0   0.0
John Russell           34    3    3    1   0   1/1   100.0     0/0   0.0

TEAM: FG: 15/22 (68.2%), 3PT: 5/9 (55.6%), REB: 8 (1 off, 7 def), AST: 7, TO: 1
TEAM FOULS: 5 [Team_058 in BONUS]

================================================================================

================================================================================
                       4TH QUARTER - Team_058 vs Team_027                       
================================================================================

[12:00] Team_058 possession (Score: 95-87)
Tyrese Doncic attempts a Layup. Contested by John Russell (5.2 feet, MAN). TYRESE DONCIC MAKES IT!
Score: 97-87

[11:45] Team_027 possession (Score: 97-87)
Tim Johnson attempts a Midrange. Contested by Kyle Westbrook (5.4 feet, ZONE). Tim Johnson misses. Rebound secured by Stephen Haliburton.

[11:34] Team_058 possession (Score: 97-87)
Vince Hyland attempts a 3Pt. Contested by Scottie Harden (4.7 feet, MAN). Vince Hyland misses. Rebound secured by Tony Doncic.

[11:24] Team_027 possession (Score: 97-87)
John Russell attempts a Midrange. Wide open! Tyrese Doncic is 6.1 feet away. [MAN] JOHN RUSSELL MAKES IT! Assist: Bradley Dosunmu
Score: 97-89

[11:09] Team_058 possession (Score: 97-89)
Tyrese Doncic attempts a 3Pt. Wide open! Scottie Harden is 8.8 feet away. [ZONE] TYRESE DONCIC MAKES IT! Assist: Stephen Haliburton
Score: 100-89

[10:55] Team_027 possession (Score: 100-89)
Scottie Harden drives to the basket... Scottie Harden throws a bad pass out of bounds! TURNOVER! (dead ball)

[10:55] Substitution (Team_058): Bradley Sexton OUT → Draymond Williamson IN (stamina_rule2)

[10:55] Substitution (Team_058): Kyle Westbrook OUT → Jordan Ingram IN (stamina_rule2)

[10:55] Substitution (Team_058): Vince Hyland OUT → Pascal Holiday IN (stamina_rule2)

[10:55] Substitution (Team_058): Stephen Haliburton OUT → Shai Lowry IN (stamina_rule2)

[10:55] Substitution (Team_058): Tyrese Doncic OUT → Jarrett Gilgeous-Alexander IN (stamina_rule2)

[10:55] Substitution (Team_027): Tim Johnson OUT → CJ Green IN (stamina_rule2)

[10:55] Substitution (Team_027): Tony Doncic OUT → Dirk Lillard IN (stamina_rule2)

[10:55] Substitution (Team_027): Scottie Harden OUT → Rudy Quickley IN (stamina_rule2)

[10:55] Substitution (Team_027): Bradley Dosunmu OUT → LeBron Russell IN (stamina_rule2)

[10:55] Substitution (Team_027): John Russell OUT → Ben Stewart IN (stamina_rule2)

[10:37] Team_058 possession (Score: 100-89)
Draymond Williamson attempts a 3Pt. Contested by CJ Green (5.4 feet, MAN). Draymond Williamson misses. Rebound secured by LeBron Russell.

[10:21] Team_027 possession (Score: 100-89)
Rudy Quickley attempts a 3Pt. Contested by Pascal Holiday (5.3 feet, MAN). Rudy Quickley misses. Rebound secured by Shai Lowry.

[10:10] Team_058 possession (Score: 100-89)
Jordan Ingram drives, Ben Stewart stays with him. Jordan Ingram attempts a Layup. Contested by Ben Stewart (2.1 feet, ZONE). Jordan Ingram misses. Offensive rebound by Pascal Holiday! Pascal Holiday puts it back in!
Score: 102-89

[09:51] Team_027 possession (Score: 102-89)
LeBron Russell drives to the basket... LeBron Russell throws a bad pass out of bounds! TURNOVER! (dead ball)

[09:35] Team_058 possession (Score: 102-89)
Jarrett Gilgeous-Alexander drives, Ben Stewart stays with him. Jarrett Gilgeous-Alexander attempts a Dunk. Contested by Ben Stewart (5.2 feet, ZONE). Jarrett Gilgeous-Alexander misses. Rebound secured by LeBron Russell.

[09:18] Team_027 possession (Score: 102-89)
Ben Stewart attempts a Layup. Contested by Shai Lowry (4.4 feet, ZONE). BEN STEWART MAKES IT! Assist: CJ Green
Score: 102-91

[08:58] Team_058 possession (Score: 102-91)
Pascal Holiday attempts a 3Pt. Wide open! Rudy Quickley is 6.9 feet away. [ZONE] Pascal Holiday misses. Rebound secured by LeBron Russell.

[08:47] Team_027 possession (Score: 102-91)
Ben Stewart attempts a 3Pt. Contested by Jarrett Gilgeous-Alexander (5.0 feet, MAN). Ben Stewart misses. Rebound secured by Pascal Holiday.

[08:33] Team_058 possession (Score: 102-91)
Pascal Holiday attempts a 3Pt. Heavily contested by Rudy Quickley (0.5 feet, MAN)! Pascal Holiday misses. Rebound secured by Dirk Lillard.

[08:19] Team_027 possession (Score: 102-91)
CJ Green attempts a 3Pt. Contested by Draymond Williamson (5.7 feet, MAN). CJ GREEN MAKES IT! Assist: Ben Stewart
Score: 102-94

[08:06] Team_058 possession (Score: 102-94)
Jordan Ingram attempts a 3Pt. Contested by Dirk Lillard (2.0 feet, MAN). JORDAN INGRAM MAKES IT! Assist: Jarrett Gilgeous-Alexander
Score: 105-94

[07:54] Team_027 possession (Score: 105-94)
Dirk Lillard attempts a 3Pt. Contested by Shai Lowry (2.5 feet, ZONE). Dirk Lillard misses. Rebound secured by Jarrett Gilgeous-Alexander.

[07:37] Team_058 possession (Score: 105-94)
Jordan Ingram loses the ball! Stripped by Dirk Lillard! TURNOVER! (live ball)

[07:20] Team_027 possession (Score: 105-94)
Rudy Quickley drives, Pascal Holiday stays with him. Rudy Quickley attempts a Layup. Contested by Pascal Holiday (4.8 feet, MAN). Rudy Quickley misses. Offensive rebound by Ben Stewart! Ben Stewart puts it back in!
Score: 105-96

[07:07] Team_058 possession (Score: 105-96)
FOUL! Holding foul on Rudy Quickley. [Team fouls: 1] No free throws, side out. (Rudy Quickley: 1 personal fouls)

[06:51] Team_058 possession (Score: 105-96)
Jordan Ingram attempts a 3Pt. Contested by Dirk Lillard (3.4 feet, MAN). Jordan Ingram misses. Offensive rebound by Shai Lowry! Shai Lowry kicks it out.

[06:36] Team_058 possession (Score: 105-96)
Jarrett Gilgeous-Alexander attempts a Layup. Wide open! Ben Stewart is 6.5 feet away. [MAN] Jarrett Gilgeous-Alexander misses. Rebound secured by Dirk Lillard.

[06:23] Team_027 possession (Score: 105-96)
FOUL! Shooting foul on Shai Lowry. LeBron Russell to the line for 2 free throws. [Team fouls: 1] (Shai Lowry: 1 personal fouls)   FT 1/2: GOOD   FT 2/2: GOOD LeBron Russell makes 2/2 from the line.
Score: 105-98

[06:07] Team_058 possession (Score: 105-98)
Shai Lowry attempts a 3Pt. Heavily contested by Rudy Quickley (1.2 feet, ZONE)! SHAI LOWRY MAKES IT! Assist: Pascal Holiday
Score: 108-98

[05:54] Team_027 possession (Score: 108-98)
Rudy Quickley attempts a 3Pt. Contested by Pascal Holiday (4.6 feet, MAN). Rudy Quickley misses. Rebound secured by Shai Lowry.

[05:36] Team_058 possession (Score: 108-98)
FOUL! Holding foul on Ben Stewart. [Team fouls: 2] No free throws, side out. (Ben Stewart: 1 personal fouls)

[05:19] Team_058 possession (Score: 108-98)
Shai Lowry loses control! Ball rolls out of bounds! TURNOVER! (dead ball)

[05:04] Team_027 possession (Score: 108-98)
Rudy Quickley attempts a 3Pt. Contested by Draymond Williamson (2.7 feet, ZONE). RUDY QUICKLEY MAKES IT! Assist: Dirk Lillard
Score: 108-101

[04:46] Team_058 possession (Score: 108-101)
Draymond Williamson attempts a 3Pt. Contested by Rudy Quickley (3.6 feet, ZONE). Draymond Williamson misses. Offensive rebound by Pascal Holiday! Pascal Holiday puts it back in!
Score: 110-101

[04:32] Team_027 possession (Score: 110-101)
Ben Stewart attempts a 3Pt. Wide open! Jarrett Gilgeous-Alexander is 6.0 feet away. [MAN] Ben Stewart misses. Offensive rebound by Ben Stewart! Ben Stewart puts it back in!
Score: 110-103

[04:19] Team_058 possession (Score: 110-103)
Shai Lowry drives, picks up Ben Stewart. Help arrives from Dirk Lillard! Shai Lowry attempts a Dunk. Contested by Dirk Lillard (3.4 feet, ZONE). SHAI LOWRY MAKES IT! Assist: Jordan Ingram
Score: 112-103

[03:59] Team_027 possession (Score: 112-103)
Ben Stewart attempts a Midrange. Wide open! Jarrett Gilgeous-Alexander is 7.2 feet away. [MAN] BEN STEWART MAKES IT!
Score: 112-105

[03:43] Team_058 possession (Score: 112-105)
Pascal Holiday attempts a 3Pt. Contested by Rudy Quickley (4.3 feet, ZONE). Pascal Holiday misses. Rebound secured by Dirk Lillard.

[03:29] Team_027 possession (Score: 112-105)
CJ Green attempts a 3Pt. Contested by Draymond Williamson (5.9 feet, MAN). CJ Green misses. Rebound secured by Pascal Holiday.

[03:15] Team_058 possession (Score: 112-105)
Jordan Ingram attempts a 3Pt. Contested by Dirk Lillard (3.9 feet, MAN). Jordan Ingram misses. FOUL! Loose ball foul on Ben Stewart during the rebound battle. [Team fouls: 3] No free throws, side out. (Ben Stewart: 2 personal fouls)

[02:58] Team_058 possession (Score: 112-105)
Shai Lowry makes the Layup and draws the foul on LeBron Russell! And-1! Shai Lowry to the line for 1. [Team fouls: 4] (LeBron Russell: 1 personal fouls)   FT 1/1: MISS Shai Lowry makes 0/1 from the line. Rebound secured by Dirk Lillard.
Score: 114-105

[02:46] Team_027 possession (Score: 114-105)
Rudy Quickley attempts a 3Pt. Contested by Jordan Ingram (2.5 feet, ZONE). Rudy Quickley misses. Rebound secured by Pascal Holiday.

[02:35] Team_058 possession (Score: 114-105)
Pascal Holiday attempts a 3Pt. Contested by Rudy Quickley (3.0 feet, MAN). Pascal Holiday misses. Rebound secured by LeBron Russell.

[02:22] Team_027 possession (Score: 114-105)
Ben Stewart attempts a 3Pt. Contested by Pascal Holiday (5.7 feet, ZONE). Ben Stewart misses. Rebound secured by Shai Lowry.

[02:04] Team_058 possession (Score: 114-105)
Jordan Ingram attempts a 3Pt. Contested by Dirk Lillard (2.8 feet, MAN). JORDAN INGRAM MAKES IT! Assist: Pascal Holiday
Score: 117-105

[01:51] Team_027 possession (Score: 117-105)
LeBron Russell drives, Jarrett Gilgeous-Alexander stays with him. LeBron Russell attempts a Layup. Wide open! Jarrett Gilgeous-Alexander is 7.6 feet away. [ZONE] LeBron Russell misses. Rebound secured by Pascal Holiday.

[01:37] Team_058 possession (Score: 117-105)
Draymond Williamson attempts a Layup. Contested by Ben Stewart (4.7 feet, ZONE). DRAYMOND WILLIAMSON MAKES IT! Assist: Pascal Holiday
Score: 119-105

[01:19] Team_027 possession (Score: 119-105)
CJ Green attempts a Layup. Contested by Draymond Williamson (4.3 feet, MAN). CJ GREEN MAKES IT! Assist: Rudy Quickley
Score: 119-107

[01:01] Team_058 possession (Score: 119-107)
Shai Lowry attempts a 3Pt. Contested by LeBron Russell (5.0 feet, MAN). SHAI LOWRY MAKES IT! Assist: Pascal Holiday
Score: 122-107

[00:47] Team_027 possession (Score: 122-107)
Dirk Lillard attempts a Midrange. Wide open! Shai Lowry is 6.2 feet away. [ZONE] DIRK LILLARD MAKES IT! Assist: Ben Stewart
Score: 122-109

[00:37] Team_058 possession (Score: 122-109)
Jordan Ingram drives, picks up Dirk Lillard. Help arrives from Rudy Quickley! Jordan Ingram attempts a Dunk. Contested by Rudy Quickley (5.1 feet, MAN). JORDAN INGRAM MAKES IT!
Score: 124-109

[00:21] Team_027 possession (Score: 124-109)
CJ Green attempts a Midrange. Wide open! Jordan Ingram is 6.6 feet away. [ZONE] CJ Green misses. FOUL! Loose ball foul on Jarrett Gilgeous-Alexander during the rebound battle. [Team fouls: 2] No free throws, side out. (Jarrett Gilgeous-Alexander: 1 personal fouls)

[00:02] Team_027 possession (Score: 124-109)
Rudy Quickley drives, Shai Lowry stays with him. Rudy Quickley attempts a Layup. Contested by Shai Lowry (4.5 feet, ZONE). Rudy Quickley misses. Rebound secured by Shai Lowry.

================================================================================
                              4TH QUARTER COMPLETE                              
================================================================================

4TH QUARTER SCORE: Team_058 29, Team_027 22

BOX SCORE:
================================================================================

Team_058
--------------------------------------------------------------------------------
Player                MIN  PTS  REB  AST  TO      FG   FG%      3P   3P%
--------------------------------------------------------------------------------
Shai Lowry             13    8    5    0   0   3/4    75.0     0/0   0.0
Jordan Ingram          13    8    0    1   0   3/3   100.0     0/0   0.0
Tyrese Doncic          35    5    0    0   0   2/2   100.0     0/0   0.0
Pascal Holiday         22    4    7    4   0   2/6    33.3     0/0   0.0
Draymond Williamson    13    2    0    0   0   1/2    50.0     0/0   0.0
Stephen Haliburton     35    0    1    1   0   0/0     0.0     0/0   0.0
Vince Hyland           26    0    0    0   0   0/1     0.0     0/0   0.0
Jarrett Gilgeous-Alexander   13    0    1    1   0   0/2     0.0     0/0   0.0

TEAM: FG: 11/20 (55.0%), 3PT: 6/12 (50.0%), REB: 14 (4 off, 10 def), AST: 7, TO: 2
TEAM FOULS: 2


Team_027
--------------------------------------------------------------------------------
Player                MIN  PTS  REB  AST  TO      FG   FG%      3P   3P%
--------------------------------------------------------------------------------
Ben Stewart            13    8    2    2   0   4/6    66.7     0/0   0.0
CJ Green               13    5    0    1   0   2/3    66.7     0/0   0.0
Rudy Quickley          13    3    0    1   0   1/5    20.0     0/0   0.0
John Russell           35    2    0    0   0   1/1   100.0     0/0   0.0
LeBron Russell         13    2    4    0   0   1/2    50.0     0/0   0.0
Dirk Lillard           22    2    5    1   0   1/2    50.0     0/0   0.0
Tim Johnson            35    0    0    0   0   0/1     0.0     0/0   0.0
Tony Doncic            26    0    1    0   0   0/0     0.0     0/0   0.0
Bradley Dosunmu        35    0    0    1   0   0/0     0.0     0/0   0.0

TEAM: FG: 10/20 (50.0%), 3PT: 3/10 (30.0%), REB: 12 (3 off, 9 def), AST: 6, TO: 2
TEAM FOULS: 4

================================================================================

================================================================================
                               FULL GAME COMPLETE                               
================================================================================

FINAL SCORE: Team_058 124, Team_027 109

SCORING BY QUARTER:
--------------------------------------------------------------------------------
Team                     Q1     Q2     Q3     Q4    FINAL
--------------------------------------------------------------------------------
Team_058                 32     32     31     29      124
Team_027                 29     21     37     22      109
--------------------------------------------------------------------------------

FULL GAME BOX SCORE:
================================================================================

Team_058
--------------------------------------------------------------------------------
Player                MIN  PTS  REB  AST  TO      FG   FG%      3P   3P%      FT STL BLK
--------------------------------------------------------------------------------
Bradley Sexton         35   17    1    4   0   7/10   70.0   3/4    75.0   2/2     1   1
Kyle Westbrook         35    9    0    9   2   5/8    62.5   0/2     0.0   1/2     0   1
Stephen Haliburton     35   28   12    3   4  10/13   76.9   3/5    60.0   6/7     0   0
Tyrese Doncic          35   24   15    4   1  12/16   75.0   2/2   100.0   5/6     0   0
Vince Hyland           26   13    0    2   0   5/11   45.5   3/4    75.0   0/0     0   0
Pascal Holiday         22    8   11    5   0   2/7    28.6   0/5     0.0   0/0     0   1
Draymond Williamson    13    2    0    0   0   2/3    66.7   1/2    50.0   0/0     0   0
Jordan Ingram          13    8    0    2   1   4/5    80.0   2/2   100.0   0/0     0   0
Shai Lowry             13    8    5    0   1   3/4    75.0   2/2   100.0   0/1     0   0
Jarrett Gilgeous-Alexander   13    4    2    1   0   2/5    40.0   0/0     0.0   0/0     0   0

TEAM: FG: 53/83 (63.9%), 3PT: 16/28 (57.1%), REB: 49 (15 off, 34 def), AST: 30, TO: 9


Team_027
--------------------------------------------------------------------------------
Player                MIN  PTS  REB  AST  TO      FG   FG%      3P   3P%      FT STL BLK
--------------------------------------------------------------------------------
Tim Johnson            35   15    0    5   1   9/16   56.2   3/6    50.0   3/3     0   0
Scottie Harden         35   12    0    1   0   5/9    55.6   1/1   100.0   4/5     0   1
Bradley Dosunmu        35   20   10    2   2   8/14   57.1   1/5    20.0   7/8     1   0
John Russell           35   15    9    1   2   5/6    83.3   1/1   100.0   2/2     1   0
Tony Doncic            26   12    4    2   2   4/7    57.1   1/2    50.0   3/5     0   1
Dirk Lillard           22    9    7    1   0   3/9    33.3   0/4     0.0   3/4     1   0
CJ Green               13    5    0    1   0   2/3    66.7   1/2    50.0   0/0     0   0
Rudy Quickley          13    5    0    1   0   3/7    42.9   1/4    25.0   0/0     0   0
LeBron Russell         13    2    4    1   0   1/2    50.0   0/0     0.0   2/2     0   0
Ben Stewart            13   11    3    2   2   4/6    66.7   1/3    33.3   1/1     0   0

TEAM: FG: 46/81 (56.8%), 3PT: 10/28 (35.7%), REB: 34 (8 off, 26 def), AST: 17, TO: 9

================================================================================
