================================================================================
                        FULL GAME - Team_025 vs Team_024                        
================================================================================

================================================================================
                       1ST QUARTER - Team_025 vs Team_024                       
================================================================================

[12:00] Team_025 possession (Score: 0-0)
FOUL! Holding foul on Anfernee Williamson. [Team fouls: 1] No free throws, side out. (Anfernee Williamson: 1 personal fouls)

[11:42] Team_025 possession (Score: 0-0)
Paolo Lowry attempts a Layup. Contested by Ja Reaves (2.7 feet, MAN). Paolo Lowry misses. Rebound secured by Draymond Towns.

[11:23] Team_024 possession (Score: 0-0)
FOUL! Shooting foul on Ben Giddey. Zach Fox to the line for 2 free throws. [Team fouls: 1] (Ben Giddey: 1 personal fouls)   FT 1/2: GOOD   FT 2/2: MISS Zach Fox makes 1/2 from the line. Rebound secured by Desmond Jordan.
Score: 0-1

[11:11] Team_025 possession (Score: 0-1)
FOUL! Holding foul on Anfernee Williamson. [Team fouls: 2] No free throws, side out. (Anfernee Williamson: 2 personal fouls)

[11:01] Team_025 possession (Score: 0-1)
Ben Giddey drives and kicks out. Cade Anthony attempts a 3Pt. Contested by Anfernee Williamson (2.6 feet, MAN). Cade Anthony misses. Offensive rebound by Desmond Jordan! Desmond Jordan's putback is no good. Rebound secured by Draymond Towns.

[10:46] Team_024 possession (Score: 0-1)
Anfernee Williamson attempts a 3Pt. Contested by Cade Anthony (4.1 feet, MAN). ANFERNEE WILLIAMSON MAKES IT! Assist: Draymond Towns
Score: 0-4

[10:30] Team_025 possession (Score: 0-4)
FOUL! Holding foul on Anfernee Williamson. [Team fouls: 3] No free throws, side out. (Anfernee Williamson: 3 personal fouls)

[10:13] Team_025 possession (Score: 0-4)
Desmond Jordan drives, Bradley Allen stays with him. Desmond Jordan attempts a Dunk. Contested by Bradley Allen (3.3 feet, MAN). DESMOND JORDAN MAKES IT!
Score: 2-4

[09:59] Team_024 possession (Score: 2-4)
FOUL! Shooting foul on Allen Embiid. Draymond Towns to the line for 2 free throws. [Team fouls: 2] (Allen Embiid: 1 personal fouls)   FT 1/2: GOOD   FT 2/2: MISS Draymond Towns makes 1/2 from the line. Offensive rebound by Draymond Towns! Draymond Towns puts it back in!
Score: 2-7

[09:41] Team_025 possession (Score: 2-7)
Cade Anthony attempts a Midrange. Wide open! Anfernee Williamson is 6.2 feet away. [MAN] CADE ANTHONY MAKES IT!
Score: 4-7

[09:23] Team_024 possession (Score: 4-7)
Anfernee Williamson attempts a Midrange. Contested by Desmond Jordan (3.0 feet, ZONE). Anfernee Williamson misses. Rebound secured by Allen Embiid.

[09:09] Team_025 possession (Score: 4-7)
Ben Giddey attempts a 3Pt. Wide open! Zach Fox is 6.4 feet away. [ZONE] Ben Giddey misses. Rebound secured by Draymond Towns.

[08:58] Team_024 possession (Score: 4-7)
Draymond Towns attempts a Layup. Contested by Allen Embiid (4.3 feet, MAN). DRAYMOND TOWNS MAKES IT! Assist: Bradley Allen
Score: 4-9

[08:42] Team_025 possession (Score: 4-9)
Allen Embiid attempts a Layup. Contested by Anfernee Williamson (4.4 feet, ZONE). ALLEN EMBIID MAKES IT! Assist: Paolo Lowry
Score: 6-9

[08:28] Team_024 possession (Score: 6-9)
FOUL! Shooting foul on Allen Embiid. Anfernee Williamson to the line for 2 free throws. [Team fouls: 3] (Allen Embiid: 2 personal fouls)   FT 1/2: GOOD   FT 2/2: GOOD Anfernee Williamson makes 2/2 from the line.
Score: 6-11

[08:12] Team_025 possession (Score: 6-11)
Ben Giddey attempts a Layup. Contested by Anfernee Williamson (2.7 feet, ZONE). BEN GIDDEY MAKES IT! Assist: Paolo Lowry
Score: 8-11

[07:56] Team_024 possession (Score: 8-11)
Draymond Towns drives, picks up Allen Embiid. Help arrives from Ben Giddey! Draymond Towns attempts a Layup. Heavily contested by Ben Giddey (1.5 feet, ZONE)! Draymond Towns misses. Rebound secured by Allen Embiid.

[07:43] Team_025 possession (Score: 8-11)
Cade Anthony attempts a Layup. Wide open! Anfernee Williamson is 6.6 feet away. [ZONE] CADE ANTHONY MAKES IT! Assist: Allen Embiid
Score: 10-11

[07:29] Team_024 possession (Score: 10-11)
Ja Reaves drives, Paolo Lowry stays with him. Ja Reaves attempts a Dunk. Contested by Paolo Lowry (5.4 feet, MAN). Ja Reaves misses. Rebound secured by Allen Embiid.

[07:11] Team_025 possession (Score: 10-11)
Allen Embiid makes the Layup and draws the foul on Anfernee Williamson! And-1! Allen Embiid to the line for 1. [Team fouls: 4] (Anfernee Williamson: 4 personal fouls)   FT 1/1: GOOD Allen Embiid makes 1/1 from the line.
Score: 13-11

[06:52] Team_024 possession (Score: 13-11)
Zach Fox attempts a 3Pt. Contested by Ben Giddey (2.6 feet, MAN). Zach Fox misses. Rebound secured by Cade Anthony.

[06:40] Team_025 possession (Score: 13-11)
Paolo Lowry attempts a 3Pt. Contested by Ja Reaves (4.7 feet, MAN). Paolo Lowry misses. Rebound secured by Draymond Towns.

[06:23] Team_024 possession (Score: 13-11)
Draymond Towns attempts a Midrange. Heavily contested by Ben Giddey (0.6 feet, ZONE)! DRAYMOND TOWNS MAKES IT! Assist: Anfernee Williamson
Score: 13-13

[06:08] Team_025 possession (Score: 13-13)
Cade Anthony attempts a 3Pt. Contested by Zach Fox (5.0 feet, ZONE). Cade Anthony misses. Rebound secured by Anfernee Williamson.

[05:55] Team_024 possession (Score: 13-13)
Draymond Towns drives and kicks out. Anfernee Williamson attempts a 3Pt. Contested by Cade Anthony (4.2 feet, MAN). Anfernee Williamson misses. Rebound secured by Desmond Jordan.

[05:42] Team_025 possession (Score: 13-13)
FOUL! Reach-in foul on Bradley Allen during the drive. [IN THE BONUS! 5 team fouls] Desmond Jordan to the line for 2 free throws. (Bradley Allen: 1 personal fouls)   FT 1/2: GOOD   FT 2/2: GOOD Desmond Jordan makes 2/2 from the line.
Score: 15-13

[05:27] Team_024 possession (Score: 15-13)
FOUL! Shooting foul on Ben Giddey. Zach Fox to the line for 2 free throws. [Team fouls: 4] (Ben Giddey: 2 personal fouls)   FT 1/2: GOOD   FT 2/2: GOOD Zach Fox makes 2/2 from the line.
Score: 15-15

[05:14] Team_025 possession (Score: 15-15)
Ben Giddey attempts a 3Pt. Contested by Zach Fox (5.4 feet, ZONE). Ben Giddey misses. Rebound secured by Anfernee Williamson.

[04:56] Team_024 possession (Score: 15-15)
Draymond Towns attempts a Layup. Heavily contested by Allen Embiid (0.5 feet, ZONE)! DRAYMOND TOWNS MAKES IT! Assist: Anfernee Williamson
Score: 15-17

[04:41] Team_025 possession (Score: 15-17)
Ben Giddey attempts a 3Pt. Contested by Zach Fox (4.9 feet, ZONE). Ben Giddey misses. Rebound secured by Zach Fox.

[04:22] Team_024 possession (Score: 15-17)
FOUL! Shooting foul on Allen Embiid. Ja Reaves to the line for 2 free throws. [BONUS: 5 team fouls] (Allen Embiid: 3 personal fouls)   FT 1/2: MISS   FT 2/2: GOOD Ja Reaves makes 1/2 from the line.
Score: 15-18

[04:09] Team_025 possession (Score: 15-18)
Cade Anthony attempts a Layup. Contested by Anfernee Williamson (4.9 feet, MAN). Cade Anthony misses. Offensive rebound by Allen Embiid! Allen Embiid puts it back in!
Score: 17-18

[03:50] Team_024 possession (Score: 17-18)
FOUL! Reach-in foul on Desmond Jordan during the drive. [IN THE BONUS! 6 team fouls] Bradley Allen to the line for 2 free throws. (Desmond Jordan: 1 personal fouls)   FT 1/2: MISS   FT 2/2: MISS Bradley Allen makes 0/2 from the line. Rebound secured by Cade Anthony.

[03:35] Team_025 possession (Score: 17-18)
Cade Anthony attempts a Midrange. Contested by Zach Fox (4.0 feet, ZONE). Cade Anthony misses. FOUL! Loose ball foul on Draymond Towns during the rebound battle. [IN THE BONUS! 6 team fouls] Desmond Jordan to the line for 2 free throws. (Draymond Towns: 1 personal fouls)   FT 1/2: GOOD   FT 2/2: GOOD Desmond Jordan makes 2/2 from the line.
Score: 19-18

[03:18] Team_024 possession (Score: 19-18)
Ja Reaves attempts a 3Pt. Contested by Paolo Lowry (4.9 feet, MAN). JA REAVES MAKES IT! Assist: Anfernee Williamson
Score: 19-21

[03:04] Team_025 possession (Score: 19-21)
Paolo Lowry attempts a Midrange. Contested by Anfernee Williamson (4.1 feet, ZONE). PAOLO LOWRY MAKES IT! Assist: Cade Anthony
Score: 21-21

[02:49] Team_024 possession (Score: 21-21)
Bradley Allen drives and kicks out. Zach Fox attempts a Midrange. Contested by Cade Anthony (4.4 feet, ZONE). ZACH FOX MAKES IT!
Score: 21-23

[02:36] Team_025 possession (Score: 21-23)
Ben Giddey attempts a 3Pt. Wide open! Zach Fox is 7.8 feet away. [ZONE] Ben Giddey misses. Rebound secured by Anfernee Williamson.

[02:23] Team_024 possession (Score: 21-23)
Anfernee Williamson attempts a 3Pt. Contested by Ben Giddey (2.5 feet, ZONE). Anfernee Williamson misses. Offensive rebound by Draymond Towns! Draymond Towns's putback is no good. Offensive rebound by Draymond Towns! Draymond Towns kicks it out.

[02:10] Team_024 possession (Score: 21-23)
FOUL! Offensive foul on Ja Reaves! Paolo Lowry drew the charge! [Team fouls: 7] (Ja Reaves: 1 personal fouls) TURNOVER! (dead ball)

[01:53] Team_025 possession (Score: 21-23)
Desmond Jordan makes the Layup and draws the foul on Bradley Allen! And-1! Desmond Jordan to the line for 1. [BONUS: 8 team fouls] (Bradley Allen: 2 personal fouls)   FT 1/1: GOOD Desmond Jordan makes 1/1 from the line.
Score: 24-23

[01:40] Team_024 possession (Score: 24-23)
Ja Reaves drives, Allen Embiid stays with him. Ja Reaves attempts a Layup. Heavily contested by Allen Embiid (1.9 feet, ZONE)! JA REAVES MAKES IT! Assist: Zach Fox
Score: 24-25

[01:22] Team_025 possession (Score: 24-25)
Allen Embiid attempts a Midrange. Contested by Draymond Towns (5.8 feet, MAN). Allen Embiid misses. Rebound secured by Anfernee Williamson.

[01:07] Team_024 possession (Score: 24-25)
Bradley Allen makes the Midrange and draws the foul on Ben Giddey! And-1! Bradley Allen to the line for 1. [BONUS: 7 team fouls] (Ben Giddey: 3 personal fouls)   FT 1/1: GOOD Bradley Allen makes 1/1 from the line.
Score: 24-28

[00:57] Team_025 possession (Score: 24-28)
FOUL! Offensive foul on Cade Anthony! Anfernee Williamson drew the charge! [Team fouls: 8] (Cade Anthony: 1 personal fouls) TURNOVER! (dead ball)

[00:37] Team_024 possession (Score: 24-28)
FOUL! Reach-in foul on Cade Anthony during the drive. [IN THE BONUS! 9 team fouls] Anfernee Williamson to the line for 2 free throws. (Cade Anthony: 2 personal fouls)   FT 1/2: GOOD   FT 2/2: GOOD Anfernee Williamson makes 2/2 from the line.
Score: 24-30

[00:21] Team_025 possession (Score: 24-30)
Allen Embiid drives and kicks out. Desmond Jordan attempts a 3Pt. Contested by Zach Fox (3.1 feet, ZONE). Desmond Jordan misses. Rebound secured by Zach Fox.

[00:08] Team_024 possession (Score: 24-30)
Anfernee Williamson attempts a Layup. BLOCKED BY ALLEN EMBIID! Ball is loose! Rebound secured by Allen Embiid.

================================================================================
                              1ST QUARTER COMPLETE                              
================================================================================

1ST QUARTER SCORE: Team_025 24, Team_024 30

BOX SCORE:
================================================================================

Team_025
--------------------------------------------------------------------------------
Player                MIN  PTS  REB  AST  TO      FG   FG%      3P   3P%
--------------------------------------------------------------------------------
Desmond Jordan         12    9    2    0   0   4/4   100.0     0/0   0.0
Allen Embiid           12    7    5    1   0   3/5    60.0     0/0   0.0
Cade Anthony           12    4    2    1   0   2/3    66.7     0/0   0.0
Paolo Lowry            12    2    0    2   0   1/3    33.3     0/0   0.0
Ben Giddey             12    2    0    0   0   1/6    16.7     0/0   0.0

TEAM: FG: 11/21 (52.4%), 3PT: 0/6 (0.0%), REB: 10 (2 off, 8 def), AST: 4, TO: 1
TEAM FOULS: 9 [Team_024 in BONUS]


Team_024
--------------------------------------------------------------------------------
Player                MIN  PTS  REB  AST  TO      FG   FG%      3P   3P%
--------------------------------------------------------------------------------
Draymond Towns         12    9    5    1   0   4/6    66.7     0/0   0.0
Anfernee Williamson    12    7    4    3   0   3/5    60.0     0/0   0.0
Ja Reaves              12    6    0    0   0   3/4    75.0     0/0   0.0
Zach Fox               12    4    2    1   0   2/4    50.0     0/0   0.0
Bradley Allen          12    3    0    1   0   1/2    50.0     0/0   0.0

TEAM: FG: 13/21 (61.9%), 3PT: 2/3 (66.7%), REB: 10 (1 off, 9 def), AST: 6, TO: 1
TEAM FOULS: 8 [Team_025 in BONUS]

================================================================================

================================================================================
                       2ND QUARTER - Team_025 vs Team_024                       
================================================================================

[12:00] Team_025 possession (Score: 24-30)
Desmond Jordan attempts a Midrange. Contested by Bradley Allen (4.9 feet, MAN). Desmond Jordan misses. Rebound secured by Zach Fox.

[11:50] Team_024 possession (Score: 24-30)
Bradley Allen drives and kicks out. Ja Reaves attempts a Midrange. Wide open! Cade Anthony is 7.1 feet away. [ZONE] JA REAVES MAKES IT! Assist: Anfernee Williamson
Score: 24-32

[11:36] Team_025 possession (Score: 24-32)
Allen Embiid drives to the basket... Allen Embiid loses the ball! Stripped by Draymond Towns! TURNOVER! (live ball)

[11:21] Team_024 possession (Score: 24-32)
Draymond Towns drives and kicks out. Draymond Towns attempts a 3Pt. Contested by Allen Embiid (4.8 feet, MAN). DRAYMOND TOWNS MAKES IT! Assist: Zach Fox
Score: 24-35

[11:07] Team_025 possession (Score: 24-35)
Ben Giddey attempts a Midrange. Wide open! Anfernee Williamson is 7.3 feet away. [ZONE] BEN GIDDEY MAKES IT!
Score: 26-35

[10:55] Team_024 possession (Score: 26-35)
Ja Reaves attempts a 3Pt. Contested by Paolo Lowry (3.6 feet, MAN). Ja Reaves misses. Rebound secured by Desmond Jordan.

[10:44] Team_025 possession (Score: 26-35)
Desmond Jordan attempts a 3Pt. Heavily contested by Zach Fox (0.8 feet, ZONE)! Desmond Jordan misses. Rebound secured by Zach Fox.

[10:30] Team_024 possession (Score: 26-35)
Zach Fox attempts a Midrange. Contested by Cade Anthony (4.1 feet, ZONE). Zach Fox misses. Rebound secured by Cade Anthony.

[10:14] Team_025 possession (Score: 26-35)
Ben Giddey attempts a Layup. Contested by Anfernee Williamson (3.2 feet, ZONE). BEN GIDDEY MAKES IT! Assist: Desmond Jordan
Score: 28-35

[09:58] Team_024 possession (Score: 28-35)
FOUL! Shooting foul on Allen Embiid. Anfernee Williamson to the line for 2 free throws. [Team fouls: 1] (Allen Embiid: 1 personal fouls)   FT 1/2: GOOD   FT 2/2: GOOD Anfernee Williamson makes 2/2 from the line.
Score: 28-37

[09:48] Team_025 possession (Score: 28-37)
Ben Giddey attempts a Layup. Contested by Anfernee Williamson (4.6 feet, ZONE). Ben Giddey misses. Rebound secured by Zach Fox.

[09:37] Team_024 possession (Score: 28-37)
Ja Reaves attempts a 3Pt. Wide open! Paolo Lowry is 6.3 feet away. [ZONE] Ja Reaves misses. Rebound secured by Allen Embiid.

[09:22] Team_025 possession (Score: 28-37)
Ben Giddey attempts a 3Pt. Contested by Zach Fox (5.0 feet, ZONE). Ben Giddey misses. Rebound secured by Anfernee Williamson.

[09:07] Team_024 possession (Score: 28-37)
Zach Fox attempts a 3Pt. Wide open! Cade Anthony is 7.7 feet away. [ZONE] Zach Fox misses. Rebound secured by Desmond Jordan.

[08:54] Team_025 possession (Score: 28-37)
Paolo Lowry drives and kicks out. Paolo Lowry attempts a Midrange. Contested by Ja Reaves (4.0 feet, MAN). Paolo Lowry misses. Rebound secured by Draymond Towns.

[08:40] Team_024 possession (Score: 28-37)
Anfernee Williamson attempts a Layup. Contested by Allen Embiid (3.4 feet, ZONE). ANFERNEE WILLIAMSON MAKES IT! Assist: Draymond Towns
Score: 28-39

[08:25] Team_025 possession (Score: 28-39)
Desmond Jordan attempts a Midrange. Contested by Bradley Allen (3.2 feet, MAN). Desmond Jordan misses. Rebound secured by Zach Fox.

[08:12] Team_024 possession (Score: 28-39)
Zach Fox attempts a Midrange. Contested by Desmond Jordan (4.2 feet, ZONE). ZACH FOX MAKES IT!
Score: 28-41

[07:59] Team_025 possession (Score: 28-41)
FOUL! Holding foul on Anfernee Williamson. [Team fouls: 1] No free throws, side out. (Anfernee Williamson: 1 personal fouls)

[07:41] Team_025 possession (Score: 28-41)
Paolo Lowry drives and kicks out. Cade Anthony attempts a Midrange. Contested by Anfernee Williamson (3.3 feet, MAN). Cade Anthony misses. Rebound secured by Draymond Towns.

[07:30] Team_024 possession (Score: 28-41)
Ja Reaves attempts a Layup. Wide open! Paolo Lowry is 8.0 feet away. [MAN] JA REAVES MAKES IT!
Score: 28-43

[07:20] Team_025 possession (Score: 28-43)
Ben Giddey attempts a Midrange. Contested by Bradley Allen (2.0 feet, ZONE). BEN GIDDEY MAKES IT! Assist: Paolo Lowry
Score: 30-43

[07:01] Team_024 possession (Score: 30-43)
Zach Fox attempts a Layup. Wide open! Ben Giddey is 6.3 feet away. [MAN] ZACH FOX MAKES IT!
Score: 30-45

[06:50] Team_025 possession (Score: 30-45)
Desmond Jordan attempts a Midrange. Wide open! Ja Reaves is 6.3 feet away. [ZONE] Desmond Jordan misses. Rebound secured by Draymond Towns.

[06:36] Team_024 possession (Score: 30-45)
Zach Fox drives to the basket... Zach Fox commits a violation (traveling/carry)! TURNOVER! (dead ball)

[06:36] Substitution (Team_025): Paolo Lowry OUT → LeBron Griffin IN (stamina_rule2)

[06:36] Substitution (Team_025): Ben Giddey OUT → Dirk Gilgeous-Alexander IN (stamina_rule2)

[06:36] Substitution (Team_025): Desmond Jordan OUT → Immanuel LaVine IN (stamina_rule2)

[06:36] Substitution (Team_025): Cade Anthony OUT → Damian Adebayo IN (stamina_rule2)

[06:36] Substitution (Team_025): Allen Embiid OUT → Nikola Lillard IN (stamina_rule2)

[06:36] Substitution (Team_024): Ja Reaves OUT → Victor Simons IN (stamina_rule2)

[06:36] Substitution (Team_024): Zach Fox OUT → Vince Irving IN (stamina_rule2)

[06:36] Substitution (Team_024): Bradley Allen OUT → Zach Durant IN (stamina_rule2)

[06:36] Substitution (Team_024): Anfernee Williamson OUT → Julius Harris IN (stamina_rule2)

[06:36] Substitution (Team_024): Draymond Towns OUT → Terry Rozier IN (stamina_rule2)

[06:27] Team_025 possession (Score: 30-45)
Nikola Lillard attempts a Midrange. Contested by Vince Irving (3.0 feet, ZONE). NIKOLA LILLARD MAKES IT!
Score: 32-45

[06:11] Team_024 possession (Score: 32-45)
Vince Irving attempts a 3Pt. Contested by Dirk Gilgeous-Alexander (4.3 feet, MAN). Vince Irving misses. Rebound secured by Nikola Lillard.

[05:58] Team_025 possession (Score: 32-45)
Nikola Lillard drives and kicks out. Immanuel LaVine attempts a Midrange. Contested by Zach Durant (5.3 feet, MAN). Immanuel LaVine misses. Rebound secured by Terry Rozier.

[05:46] Team_024 possession (Score: 32-45)
Zach Durant attempts a Midrange. Wide open! Dirk Gilgeous-Alexander is 7.5 feet away. [ZONE] ZACH DURANT MAKES IT!
Score: 32-47

[05:32] Team_025 possession (Score: 32-47)
Dirk Gilgeous-Alexander drives to the basket... Dirk Gilgeous-Alexander loses the ball! Stripped by Terry Rozier! TURNOVER! (live ball)

[05:18] Team_024 possession (Score: 32-47)
Zach Durant attempts a 3Pt. Contested by LeBron Griffin (3.0 feet, ZONE). Zach Durant misses. Rebound secured by Nikola Lillard.

[05:04] Team_025 possession (Score: 32-47)
LeBron Griffin makes the Midrange and draws the foul on Victor Simons! And-1! LeBron Griffin to the line for 1. [Team fouls: 2] (Victor Simons: 1 personal fouls)   FT 1/1: GOOD LeBron Griffin makes 1/1 from the line.
Score: 35-47

[04:47] Team_024 possession (Score: 35-47)
Zach Durant attempts a Midrange. Contested by Immanuel LaVine (3.8 feet, MAN). ZACH DURANT MAKES IT! Assist: Terry Rozier
Score: 35-49

[04:35] Team_025 possession (Score: 35-49)
Damian Adebayo drives and kicks out. LeBron Griffin makes the Midrange and draws the foul on Victor Simons! And-1! LeBron Griffin to the line for 1. [Team fouls: 3] (Victor Simons: 2 personal fouls)   FT 1/1: GOOD LeBron Griffin makes 1/1 from the line.
Score: 38-49

[04:19] Team_024 possession (Score: 38-49)
Zach Durant attempts a 3Pt. Contested by LeBron Griffin (5.8 feet, ZONE). ZACH DURANT MAKES IT! Assist: Julius Harris
Score: 38-52

[04:09] Team_025 possession (Score: 38-52)
Nikola Lillard attempts a 3Pt. Contested by Victor Simons (2.6 feet, ZONE). Nikola Lillard misses. Rebound secured by Zach Durant.

[03:55] Team_024 possession (Score: 38-52)
Vince Irving attempts a Layup. Heavily contested by Nikola Lillard (1.9 feet, ZONE)! Vince Irving misses. Rebound secured by Nikola Lillard.

[03:43] Team_025 possession (Score: 38-52)
Damian Adebayo attempts a 3Pt. Contested by Victor Simons (2.8 feet, ZONE). Damian Adebayo misses. Rebound secured by Zach Durant.

[03:29] Team_024 possession (Score: 38-52)
FOUL! Shooting foul on LeBron Griffin. Victor Simons to the line for 2 free throws. [Team fouls: 2] (LeBron Griffin: 1 personal fouls)   FT 1/2: GOOD   FT 2/2: GOOD Victor Simons makes 2/2 from the line.
Score: 38-54

[03:11] Team_025 possession (Score: 38-54)
LeBron Griffin attempts a Layup. Contested by Terry Rozier (2.5 feet, ZONE). LeBron Griffin misses. Offensive rebound by Nikola Lillard! Nikola Lillard kicks it out.

[02:56] Team_025 possession (Score: 38-54)
LeBron Griffin attempts a 3Pt. Contested by Victor Simons (5.3 feet, ZONE). LeBron Griffin misses. Rebound secured by Terry Rozier.

[02:37] Team_024 possession (Score: 38-54)
Victor Simons attempts a Layup. Wide open! Damian Adebayo is 8.1 feet away. [ZONE] VICTOR SIMONS MAKES IT! Assist: Zach Durant
Score: 38-56

[02:21] Team_025 possession (Score: 38-56)
Damian Adebayo attempts a 3Pt. Contested by Julius Harris (4.5 feet, MAN). DAMIAN ADEBAYO MAKES IT! Assist: Immanuel LaVine
Score: 41-56

[02:06] Team_024 possession (Score: 41-56)
Terry Rozier drives, picks up Nikola Lillard. Help arrives from LeBron Griffin! Terry Rozier attempts a Layup. Contested by LeBron Griffin (5.4 feet, MAN). Terry Rozier misses. Rebound secured by Dirk Gilgeous-Alexander.

[01:50] Team_025 possession (Score: 41-56)
Immanuel LaVine attempts a 3Pt. Contested by Victor Simons (5.2 feet, ZONE). Immanuel LaVine misses. Rebound secured by Zach Durant.

[01:30] Team_024 possession (Score: 41-56)
Terry Rozier attempts a Midrange. Contested by Nikola Lillard (4.7 feet, MAN). Terry Rozier misses. Offensive rebound by Julius Harris! Julius Harris kicks it out.

[01:17] Team_024 possession (Score: 41-56)
Vince Irving attempts a 3Pt. Contested by LeBron Griffin (4.1 feet, ZONE). VINCE IRVING MAKES IT! Assist: Terry Rozier
Score: 41-59

[01:00] Team_025 possession (Score: 41-59)
Dirk Gilgeous-Alexander makes the Layup and draws the foul on Vince Irving! And-1! Dirk Gilgeous-Alexander to the line for 1. [Team fouls: 4] (Vince Irving: 1 personal fouls)   FT 1/1: GOOD Dirk Gilgeous-Alexander makes 1/1 from the line.
Score: 44-59

[00:46] Team_024 possession (Score: 44-59)
Julius Harris attempts a 3Pt. Contested by Damian Adebayo (3.6 feet, MAN). JULIUS HARRIS MAKES IT! Assist: Terry Rozier
Score: 44-62

[00:30] Team_025 possession (Score: 44-62)
FOUL! Reach-in foul on Terry Rozier during the drive. [IN THE BONUS! 5 team fouls] Dirk Gilgeous-Alexander to the line for 2 free throws. (Terry Rozier: 1 personal fouls)   FT 1/2: GOOD   FT 2/2: GOOD Dirk Gilgeous-Alexander makes 2/2 from the line.
Score: 46-62

[00:17] Team_024 possession (Score: 46-62)
FOUL! Shooting foul on Damian Adebayo. Julius Harris to the line for 2 free throws. [Team fouls: 3] (Damian Adebayo: 1 personal fouls)   FT 1/2: GOOD   FT 2/2: GOOD Julius Harris makes 2/2 from the line.
Score: 46-64

[00:04] Team_025 possession (Score: 46-64)
Nikola Lillard attempts a Layup. Contested by Terry Rozier (2.9 feet, ZONE). NIKOLA LILLARD MAKES IT! Assist: Immanuel LaVine
Score: 48-64

================================================================================
                              2ND QUARTER COMPLETE                              
================================================================================

2ND QUARTER SCORE: Team_025 24, Team_024 34

BOX SCORE:
================================================================================

Team_025
--------------------------------------------------------------------------------
Player                MIN  PTS  REB  AST  TO      FG   FG%      3P   3P%
--------------------------------------------------------------------------------
Ben Giddey             18    6    0    0   0   3/5    60.0     0/0   0.0
LeBron Griffin          7    6    0    0   0   2/3    66.7     0/0   0.0
Dirk Gilgeous-Alexander    7    5    1    0   0   2/2   100.0     0/0   0.0
Nikola Lillard          7    4    4    0   0   2/4    50.0     0/0   0.0
Damian Adebayo          7    3    0    0   0   1/2    50.0     0/0   0.0
Desmond Jordan         18    0    2    1   0   0/4     0.0     0/0   0.0
Cade Anthony           18    0    1    0   0   0/0     0.0     0/0   0.0
Allen Embiid           18    0    1    0   0   0/0     0.0     0/0   0.0
Paolo Lowry            18    0    0    1   0   0/2     0.0     0/0   0.0
Immanuel LaVine         7    0    0    2   0   0/1     0.0     0/0   0.0

TEAM: FG: 10/23 (43.5%), 3PT: 1/7 (14.3%), REB: 9 (1 off, 8 def), AST: 4, TO: 2
TEAM FOULS: 3


Team_024
--------------------------------------------------------------------------------
Player                MIN  PTS  REB  AST  TO      FG   FG%      3P   3P%
--------------------------------------------------------------------------------
Zach Durant             7    7    3    1   0   3/4    75.0     0/0   0.0
Julius Harris           7    5    1    1   0   2/2   100.0     0/0   0.0
Zach Fox               18    4    4    1   0   2/4    50.0     0/0   0.0
Ja Reaves              18    4    0    0   0   2/4    50.0     0/0   0.0
Anfernee Williamson    18    4    1    1   0   2/2   100.0     0/0   0.0
Victor Simons           7    4    0    0   0   2/2   100.0     0/0   0.0
Draymond Towns         18    3    3    1   0   1/1   100.0     0/0   0.0
Vince Irving            7    3    0    0   0   1/3    33.3     0/0   0.0
Terry Rozier            7    0    2    3   0   0/1     0.0     0/0   0.0

TEAM: FG: 15/23 (65.2%), 3PT: 3/8 (37.5%), REB: 14 (1 off, 13 def), AST: 8, TO: 1
TEAM FOULS: 5 [Team_025 in BONUS]

================================================================================

================================================================================
                       3RD QUARTER - Team_025 vs Team_024                       
================================================================================

[12:00] Team_025 possession (Score: 48-64)
Allen Embiid drives, picks up Anfernee Williamson. Help arrives from Zach Fox! Allen Embiid attempts a Dunk. Contested by Zach Fox (4.5 feet, ZONE). ALLEN EMBIID MAKES IT! Assist: Desmond Jordan
Score: 50-64

[11:46] Team_024 possession (Score: 50-64)
Ja Reaves attempts a 3Pt. Contested by Desmond Jordan (5.1 feet, ZONE). Ja Reaves misses. Offensive rebound by Draymond Towns! Draymond Towns's putback is no good. Rebound secured by Desmond Jordan.

[11:37] Team_025 possession (Score: 50-64)
Ben Giddey loses the ball! Stripped by Zach Fox! TURNOVER! (live ball)

[11:24] Team_024 possession (Score: 50-64)
Anfernee Williamson drives and kicks out. Ja Reaves attempts a 3Pt. Wide open! Ben Giddey is 6.0 feet away. [ZONE] JA REAVES MAKES IT!
Score: 50-67

[11:05] Team_025 possession (Score: 50-67)
Allen Embiid attempts a Layup. Contested by Anfernee Williamson (5.2 feet, MAN). ALLEN EMBIID MAKES IT! Assist: Paolo Lowry
Score: 52-67

[10:52] Team_024 possession (Score: 52-67)
Anfernee Williamson drives and kicks out. Draymond Towns attempts a Midrange. Contested by Allen Embiid (3.0 feet, MAN). Draymond Towns misses. Rebound secured by Cade Anthony.

[10:39] Team_025 possession (Score: 52-67)
Paolo Lowry attempts a 3Pt. Wide open! Ja Reaves is 6.3 feet away. [MAN] Paolo Lowry misses. Rebound secured by Anfernee Williamson.

[10:21] Team_024 possession (Score: 52-67)
Anfernee Williamson drives and kicks out. Draymond Towns attempts a 3Pt. Contested by Ben Giddey (3.9 feet, ZONE). DRAYMOND TOWNS MAKES IT!
Score: 52-70

[10:10] Team_025 possession (Score: 52-70)
Paolo Lowry attempts a 3Pt. Wide open! Ja Reaves is 7.1 feet away. [MAN] Paolo Lowry misses. Offensive rebound by Desmond Jordan! Desmond Jordan puts it back in!
Score: 54-70

[09:57] Team_024 possession (Score: 54-70)
Ja Reaves throws a bad pass! Stolen by Paolo Lowry! TURNOVER! (live ball)

[09:43] Team_025 possession (Score: 54-70)
Paolo Lowry attempts a 3Pt. Contested by Zach Fox (5.0 feet, ZONE). Paolo Lowry misses. Rebound secured by Anfernee Williamson.

[09:25] Team_024 possession (Score: 54-70)
Bradley Allen makes the Layup and draws the foul on Ben Giddey! And-1! Bradley Allen to the line for 1. [Team fouls: 1] (Ben Giddey: 1 personal fouls)   FT 1/1: GOOD Bradley Allen makes 1/1 from the line.
Score: 54-73

[09:15] Team_025 possession (Score: 54-73)
Ben Giddey attempts a 3Pt. Contested by Zach Fox (5.2 feet, MAN). Ben Giddey misses. Rebound secured by Draymond Towns.

[09:01] Team_024 possession (Score: 54-73)
Bradley Allen attempts a 3Pt. Contested by Ben Giddey (2.8 feet, ZONE). Bradley Allen misses. Rebound secured by Cade Anthony.

[08:45] Team_025 possession (Score: 54-73)
Allen Embiid attempts a Layup. Contested by Anfernee Williamson (4.9 feet, MAN). ALLEN EMBIID MAKES IT! Assist: Desmond Jordan
Score: 56-73

[08:35] Team_024 possession (Score: 56-73)
Anfernee Williamson drives and kicks out. Draymond Towns attempts a 3Pt. Heavily contested by Allen Embiid (0.6 feet, MAN)! Draymond Towns misses. Offensive rebound by Draymond Towns! Draymond Towns puts it back in!
Score: 56-75

[08:18] Team_025 possession (Score: 56-75)
Paolo Lowry attempts a Layup. Heavily contested by Anfernee Williamson (0.8 feet, ZONE)! PAOLO LOWRY MAKES IT!
Score: 58-75

[08:05] Team_024 possession (Score: 58-75)
Draymond Towns attempts a Midrange. Contested by Ben Giddey (4.2 feet, ZONE). DRAYMOND TOWNS MAKES IT!
Score: 58-77

[07:50] Team_025 possession (Score: 58-77)
Desmond Jordan attempts a Midrange. Contested by Bradley Allen (5.4 feet, MAN). DESMOND JORDAN MAKES IT! Assist: Ben Giddey
Score: 60-77

[07:34] Team_024 possession (Score: 60-77)
Ja Reaves attempts a 3Pt. Contested by Ben Giddey (4.8 feet, ZONE). JA REAVES MAKES IT! Assist: Anfernee Williamson
Score: 60-80

[07:21] Team_025 possession (Score: 60-80)
Allen Embiid attempts a Dunk. BLOCKED BY ANFERNEE WILLIAMSON! Ball deflects out of bounds off Allen Embiid.

[07:07] Team_024 possession (Score: 60-80)
Ja Reaves attempts a 3Pt. Wide open! Paolo Lowry is 6.7 feet away. [MAN] Ja Reaves misses. Rebound secured by Cade Anthony.

[06:53] Team_025 possession (Score: 60-80)
FOUL! Offensive foul on Paolo Lowry! Ja Reaves drew the charge! [Team fouls: 2] (Paolo Lowry: 1 personal fouls) TURNOVER! (dead ball)

[06:39] Team_024 possession (Score: 60-80)
Draymond Towns attempts a 3Pt. Heavily contested by Ben Giddey (1.3 feet, ZONE)! Draymond Towns misses. Rebound secured by Allen Embiid.

[06:22] Team_025 possession (Score: 60-80)
Desmond Jordan attempts a 3Pt. Contested by Ja Reaves (5.6 feet, ZONE). Desmond Jordan misses. FOUL! Loose ball foul on Zach Fox during the rebound battle. [Team fouls: 1] No free throws, side out. (Zach Fox: 1 personal fouls)

[06:08] Team_025 possession (Score: 60-80)
Paolo Lowry attempts a Layup. Heavily contested by Anfernee Williamson (0.5 feet, ZONE)! Paolo Lowry misses. Rebound secured by Zach Fox.

[05:51] Team_024 possession (Score: 60-80)
Ja Reaves drives to the basket... Ja Reaves loses the ball! Stripped by Paolo Lowry! TURNOVER! (live ball)

[05:40] Team_025 possession (Score: 60-80)
Ben Giddey attempts a Midrange. Contested by Bradley Allen (4.4 feet, ZONE). BEN GIDDEY MAKES IT!
Score: 62-80

[05:26] Team_024 possession (Score: 62-80)
Ja Reaves loses control! Ball rolls out of bounds! TURNOVER! (dead ball)

[05:10] Team_025 possession (Score: 62-80)
Allen Embiid drives and kicks out. Cade Anthony attempts a Midrange. Contested by Anfernee Williamson (4.2 feet, MAN). CADE ANTHONY MAKES IT!
Score: 64-80

[04:59] Team_024 possession (Score: 64-80)
Anfernee Williamson attempts a Layup. Contested by Cade Anthony (5.4 feet, MAN). Anfernee Williamson misses. Rebound secured by Allen Embiid.

[04:42] Team_025 possession (Score: 64-80)
Paolo Lowry attempts a 3Pt. Contested by Ja Reaves (4.0 feet, MAN). Paolo Lowry misses. Rebound secured by Zach Fox.

[04:23] Team_024 possession (Score: 64-80)
Ja Reaves attempts a 3Pt. Wide open! Paolo Lowry is 8.3 feet away. [MAN] Ja Reaves misses. FOUL! Loose ball foul on Cade Anthony during the rebound battle. [Team fouls: 3] No free throws, side out. (Cade Anthony: 1 personal fouls)

[04:09] Team_024 possession (Score: 64-80)
Draymond Towns drives, Allen Embiid stays with him. Draymond Towns attempts a Layup. Contested by Allen Embiid (3.3 feet, MAN). DRAYMOND TOWNS MAKES IT! Assist: Anfernee Williamson
Score: 64-82

[03:53] Team_025 possession (Score: 64-82)
FOUL! Reach-in foul on Anfernee Williamson during the drive. [Team fouls: 2] No free throws, side out. (Anfernee Williamson: 1 personal fouls)

[03:40] Team_025 possession (Score: 64-82)
Allen Embiid attempts a Dunk. BLOCKED BY DRAYMOND TOWNS! Ball is loose! Rebound secured by Draymond Towns.

[03:27] Team_024 possession (Score: 64-82)
Draymond Towns drives, Allen Embiid stays with him. Draymond Towns attempts a Layup. Contested by Allen Embiid (2.5 feet, MAN). Draymond Towns misses. Rebound secured by Cade Anthony.

[03:16] Team_025 possession (Score: 64-82)
FOUL! Shooting foul on Zach Fox. Desmond Jordan to the line for 2 free throws. [Team fouls: 3] (Zach Fox: 2 personal fouls)   FT 1/2: MISS   FT 2/2: GOOD Desmond Jordan makes 1/2 from the line.
Score: 65-82

[03:04] Team_024 possession (Score: 65-82)
Anfernee Williamson loses the ball! Stripped by Cade Anthony! TURNOVER! (live ball)

[02:51] Team_025 possession (Score: 65-82)
Desmond Jordan attempts a Midrange. Contested by Bradley Allen (4.5 feet, MAN). DESMOND JORDAN MAKES IT! Assist: Allen Embiid
Score: 67-82

[02:37] Team_024 possession (Score: 67-82)
Ja Reaves makes the Layup and draws the foul on Paolo Lowry! And-1! Ja Reaves to the line for 1. [Team fouls: 4] (Paolo Lowry: 2 personal fouls)   FT 1/1: MISS Ja Reaves makes 0/1 from the line. FOUL! Loose ball foul on Allen Embiid during the free throw rebound! [IN THE BONUS! 5 team fouls] Draymond Towns to the line for 2 free throws. (Allen Embiid: 1 personal fouls)   FT 1/2: GOOD   FT 2/2: MISS Draymond Towns makes 1/2 from the line. FOUL! Loose ball foul on Cade Anthony during the free throw rebound! [IN THE BONUS! 6 team fouls] Draymond Towns to the line for 2 free throws. (Cade Anthony: 2 personal fouls)   FT 1/2: GOOD   FT 2/2: MISS Draymond Towns makes 1/2 from the line. Rebound secured by Desmond Jordan.
Score: 67-86

[02:22] Team_025 possession (Score: 67-86)
Allen Embiid attempts a Midrange. BLOCKED BY ZACH FOX! Ball is loose! Rebound secured by Draymond Towns.

[02:07] Team_024 possession (Score: 67-86)
Bradley Allen drives, picks up Allen Embiid. Help arrives from Ben Giddey! Bradley Allen attempts a Layup. Contested by Ben Giddey (5.1 feet, ZONE). Bradley Allen misses. Rebound secured by Desmond Jordan.

[01:48] Team_025 possession (Score: 67-86)
Desmond Jordan attempts a Layup. BLOCKED BY ANFERNEE WILLIAMSON! Ball is loose! Rebound secured by Zach Fox.

[01:35] Team_024 possession (Score: 67-86)
Anfernee Williamson attempts a Midrange. Contested by Cade Anthony (5.0 feet, MAN). ANFERNEE WILLIAMSON MAKES IT! Assist: Ja Reaves
Score: 67-88

[01:20] Team_025 possession (Score: 67-88)
FOUL! Offensive foul on Desmond Jordan! Bradley Allen drew the charge! [Team fouls: 7] (Desmond Jordan: 1 personal fouls) TURNOVER! (dead ball)

[01:02] Team_024 possession (Score: 67-88)
Zach Fox loses control! Ball rolls out of bounds! TURNOVER! (dead ball)

[01:02] Substitution (Team_025): Paolo Lowry OUT → LeBron Griffin IN (stamina_rule2)

[01:02] Substitution (Team_025): Ben Giddey OUT → Dirk Gilgeous-Alexander IN (stamina_rule2)

[01:02] Substitution (Team_025): Desmond Jordan OUT → Immanuel LaVine IN (stamina_rule2)

[01:02] Substitution (Team_025): Cade Anthony OUT → Damian Adebayo IN (stamina_rule2)

[01:02] Substitution (Team_025): Allen Embiid OUT → Nikola Lillard IN (stamina_rule2)

[01:02] Substitution (Team_024): Ja Reaves OUT → Victor Simons IN (stamina_rule2)

[01:02] Substitution (Team_024): Zach Fox OUT → Vince Irving IN (stamina_rule2)

[01:02] Substitution (Team_024): Bradley Allen OUT → Zach Durant IN (stamina_rule2)

[01:02] Substitution (Team_024): Anfernee Williamson OUT → Julius Harris IN (stamina_rule2)

[01:02] Substitution (Team_024): Draymond Towns OUT → Terry Rozier IN (stamina_rule2)

[00:45] Team_025 possession (Score: 67-88)
Nikola Lillard drives, picks up Terry Rozier. Help arrives from Vince Irving! Nikola Lillard attempts a Dunk. Contested by Vince Irving (5.6 feet, ZONE). Nikola Lillard misses. Offensive rebound by Immanuel LaVine! Immanuel LaVine kicks it out.

[00:35] Team_025 possession (Score: 67-88)
LeBron Griffin attempts a 3Pt. Wide open! Julius Harris is 6.5 feet away. [ZONE] LEBRON GRIFFIN MAKES IT! Assist: Dirk Gilgeous-Alexander
Score: 70-88

[00:19] Team_024 possession (Score: 70-88)
Zach Durant attempts a Layup. Wide open! Nikola Lillard is 7.2 feet away. [ZONE] ZACH DURANT MAKES IT!
Score: 70-90

[00:04] Team_025 possession (Score: 70-90)
LeBron Griffin attempts a 3Pt. Wide open! Victor Simons is 7.8 feet away. [ZONE] LeBron Griffin misses. Rebound secured by Terry Rozier.

================================================================================
                              3RD QUARTER COMPLETE                              
================================================================================

3RD QUARTER SCORE: Team_025 22, Team_024 26

BOX SCORE:
================================================================================

Team_025
--------------------------------------------------------------------------------
Player                MIN  PTS  REB  AST  TO      FG   FG%      3P   3P%
--------------------------------------------------------------------------------
Desmond Jordan         29    7    5    2   0   4/5    80.0     0/0   0.0
Allen Embiid           29    6    2    1   0   3/6    50.0     0/0   0.0
LeBron Griffin          7    3    0    0   0   1/2    50.0     0/0   0.0
Paolo Lowry            29    2    0    1   0   1/5    20.0     0/0   0.0
Cade Anthony           29    2    4    0   0   1/1   100.0     0/0   0.0
Ben Giddey             29    2    0    1   0   1/2    50.0     0/0   0.0
Immanuel LaVine         7    0    1    0   0   0/0     0.0     0/0   0.0
Dirk Gilgeous-Alexander    7    0    0    1   0   0/0     0.0     0/0   0.0

TEAM: FG: 11/21 (52.4%), 3PT: 2/7 (28.6%), REB: 11 (3 off, 8 def), AST: 6, TO: 3
TEAM FOULS: 7 [Team_024 in BONUS]


Team_024
--------------------------------------------------------------------------------
Player                MIN  PTS  REB  AST  TO      FG   FG%      3P   3P%
--------------------------------------------------------------------------------
Draymond Towns         29    9    5    0   0   4/6    66.7     0/0   0.0
Ja Reaves              29    6    0    1   0   2/5    40.0     0/0   0.0
Bradley Allen          29    3    0    0   0   1/3    33.3     0/0   0.0
Anfernee Williamson    29    2    2    2   0   1/3    33.3     0/0   0.0
Zach Durant             7    2    0    0   0   1/1   100.0     0/0   0.0
Zach Fox               29    0    3    0   0   0/0     0.0     0/0   0.0
Terry Rozier            7    0    1    0   0   0/0     0.0     0/0   0.0

TEAM: FG: 9/18 (50.0%), 3PT: 1/5 (20.0%), REB: 12 (3 off, 9 def), AST: 3, TO: 5
TEAM FOULS: 3

================================================================================

================================================================================
                       4TH QUARTER - Team_025 vs Team_024                       
================================================================================

[12:00] Substitution (Team_025): Paolo Lowry OUT (stamina: 74) → LeBron Griffin IN (comeback_detected)

[12:00] Substitution (Team_024): Ja Reaves OUT (stamina: 73) → Victor Simons IN (comeback_detected)

[12:00] Team_025 possession (Score: 70-90)
LeBron Griffin attempts a 3Pt. Contested by Zach Fox (4.6 feet, ZONE). LeBron Griffin misses. Rebound secured by Anfernee Williamson.

[11:45] Team_024 possession (Score: 70-90)
Victor Simons attempts a Midrange. Contested by Desmond Jordan (4.6 feet, ZONE). Victor Simons misses. Rebound secured by Cade Anthony.

[11:27] Team_025 possession (Score: 70-90)
Ben Giddey drives, Anfernee Williamson stays with him. Ben Giddey attempts a Layup. Wide open! Anfernee Williamson is 8.0 feet away. [ZONE] BEN GIDDEY MAKES IT! Assist: LeBron Griffin
Score: 72-90

[11:13] Team_024 possession (Score: 72-90)
Victor Simons drives, picks up Allen Embiid. Help arrives from Ben Giddey! Victor Simons attempts a Dunk. Contested by Ben Giddey (3.8 feet, ZONE). VICTOR SIMONS MAKES IT! Assist: Anfernee Williamson
Score: 72-92

[11:00] Team_025 possession (Score: 72-92)
Desmond Jordan attempts a 3Pt. Contested by Victor Simons (3.0 feet, ZONE). DESMOND JORDAN MAKES IT! Assist: Allen Embiid
Score: 75-92

[10:50] Team_024 possession (Score: 75-92)
Bradley Allen attempts a Midrange. Contested by Allen Embiid (2.9 feet, ZONE). Bradley Allen misses. Rebound secured by Desmond Jordan.

[10:35] Team_025 possession (Score: 75-92)
Allen Embiid throws a bad pass! Stolen by Draymond Towns! TURNOVER! (live ball)

[10:23] Team_024 possession (Score: 75-92)
Zach Fox throws a bad pass out of bounds! TURNOVER! (dead ball)

[10:23] Substitution (Team_025): Ben Giddey OUT → Dirk Gilgeous-Alexander IN (stamina_rule2)

[10:23] Substitution (Team_025): Desmond Jordan OUT → Immanuel LaVine IN (stamina_rule2)

[10:23] Substitution (Team_025): Cade Anthony OUT → Damian Adebayo IN (stamina_rule2)

[10:23] Substitution (Team_025): Allen Embiid OUT → Nikola Lillard IN (stamina_rule2)

[10:23] Substitution (Team_024): Zach Fox OUT → Vince Irving IN (stamina_rule2)

[10:23] Substitution (Team_024): Bradley Allen OUT → Zach Durant IN (stamina_rule2)

[10:23] Substitution (Team_024): Anfernee Williamson OUT → Julius Harris IN (stamina_rule2)

[10:23] Substitution (Team_024): Draymond Towns OUT → Terry Rozier IN (stamina_rule2)

[10:09] Team_025 possession (Score: 75-92)
Immanuel LaVine attempts a 3Pt. Heavily contested by Zach Durant (1.6 feet, MAN)! Immanuel LaVine misses. Rebound secured by Zach Durant.

[09:50] Team_024 possession (Score: 75-92)
Victor Simons attempts a 3Pt. Wide open! LeBron Griffin is 6.0 feet away. [MAN] VICTOR SIMONS MAKES IT! Assist: Zach Durant
Score: 75-95

[09:41] Team_025 possession (Score: 75-95)
Immanuel LaVine attempts a Layup. BLOCKED BY VINCE IRVING! Ball is loose! Offensive rebound by Immanuel LaVine! Immanuel LaVine kicks it out.

[09:24] Team_025 possession (Score: 75-95)
LeBron Griffin attempts a 3Pt. Contested by Victor Simons (3.7 feet, MAN). LEBRON GRIFFIN MAKES IT! Assist: Damian Adebayo
Score: 78-95

[09:10] Team_024 possession (Score: 78-95)
Terry Rozier drives, Nikola Lillard stays with him. Terry Rozier attempts a Layup. Contested by Nikola Lillard (5.3 feet, MAN). TERRY ROZIER MAKES IT! Assist: Zach Durant
Score: 78-97

[08:56] Team_025 possession (Score: 78-97)
Immanuel LaVine drives, picks up Julius Harris. Help arrives from Vince Irving! Immanuel LaVine attempts a Dunk. Heavily contested by Vince Irving (1.7 feet, ZONE)! IMMANUEL LAVINE MAKES IT! Assist: LeBron Griffin
Score: 80-97

[08:44] Team_024 possession (Score: 80-97)
FOUL! Holding foul on LeBron Griffin. [Team fouls: 1] No free throws, side out. (LeBron Griffin: 1 personal fouls)

[08:28] Team_024 possession (Score: 80-97)
Zach Durant attempts a Layup. Wide open! Immanuel LaVine is 6.1 feet away. [MAN] Zach Durant misses. Rebound secured by Nikola Lillard.

[08:10] Team_025 possession (Score: 80-97)
Immanuel LaVine attempts a 3Pt. Wide open! Victor Simons is 8.9 feet away. [ZONE] IMMANUEL LAVINE MAKES IT! Assist: Damian Adebayo
Score: 83-97

[07:50] Team_024 possession (Score: 83-97)
Vince Irving attempts a Layup. Contested by Nikola Lillard (3.6 feet, ZONE). VINCE IRVING MAKES IT!
Score: 83-99

[07:40] Team_025 possession (Score: 83-99)
Nikola Lillard drives to the basket... FOUL! Offensive foul on Nikola Lillard! Terry Rozier drew the charge! [Team fouls: 2] (Nikola Lillard: 1 personal fouls) TURNOVER! (dead ball)

[07:26] Team_024 possession (Score: 83-99)
Vince Irving drives, picks up Dirk Gilgeous-Alexander. Help arrives from Immanuel LaVine! Vince Irving attempts a Dunk. Wide open! Immanuel LaVine is 6.6 feet away. [MAN] Vince Irving misses. Rebound secured by Nikola Lillard.

[07:14] Team_025 possession (Score: 83-99)
Immanuel LaVine loses the ball! Stripped by Zach Durant! TURNOVER! (live ball)

[07:02] Team_024 possession (Score: 83-99)
Vince Irving attempts a Midrange. Wide open! Dirk Gilgeous-Alexander is 7.2 feet away. [MAN] VINCE IRVING MAKES IT!
Score: 83-101

[06:50] Team_025 possession (Score: 83-101)
Damian Adebayo attempts a Midrange. Contested by Julius Harris (5.2 feet, MAN). DAMIAN ADEBAYO MAKES IT!
Score: 85-101

[06:33] Team_024 possession (Score: 85-101)
Terry Rozier makes the Layup and draws the foul on Nikola Lillard! And-1! Terry Rozier to the line for 1. [Team fouls: 3] (Nikola Lillard: 2 personal fouls)   FT 1/1: MISS Terry Rozier makes 0/1 from the line. Rebound secured by Nikola Lillard.
Score: 85-103

[06:17] Team_025 possession (Score: 85-103)
LeBron Griffin attempts a 3Pt. Contested by Victor Simons (2.3 feet, MAN). LeBron Griffin misses. Rebound secured by Zach Durant.

[06:01] Team_024 possession (Score: 85-103)
Julius Harris throws a bad pass out of bounds! TURNOVER! (dead ball)

[05:45] Team_025 possession (Score: 85-103)
LeBron Griffin attempts a 3Pt. Contested by Victor Simons (2.4 feet, MAN). LeBron Griffin misses. Rebound secured by Julius Harris.

[05:33] Team_024 possession (Score: 85-103)
Julius Harris attempts a 3Pt. Heavily contested by Damian Adebayo (1.0 feet, MAN)! Julius Harris misses. Rebound secured by Dirk Gilgeous-Alexander.

[05:20] Team_025 possession (Score: 85-103)
LeBron Griffin drives and kicks out. FOUL! Shooting foul on Victor Simons. Damian Adebayo to the line for 3 free throws. [Team fouls: 1] (Victor Simons: 1 personal fouls)   FT 1/3: GOOD   FT 2/3: GOOD   FT 3/3: GOOD Damian Adebayo makes 3/3 from the line.
Score: 88-103

[05:07] Team_024 possession (Score: 88-103)
Zach Durant attempts a Layup. Contested by Immanuel LaVine (3.5 feet, MAN). ZACH DURANT MAKES IT! Assist: Victor Simons
Score: 88-105

[04:55] Team_025 possession (Score: 88-105)
Dirk Gilgeous-Alexander attempts a Midrange. Wide open! Vince Irving is 6.1 feet away. [MAN] DIRK GILGEOUS-ALEXANDER MAKES IT!
Score: 90-105

[04:43] Team_024 possession (Score: 90-105)
Zach Durant drives and kicks out. Zach Durant attempts a 3Pt. Contested by Immanuel LaVine (5.9 feet, MAN). ZACH DURANT MAKES IT! Assist: Victor Simons
Score: 90-108

[04:29] Team_025 possession (Score: 90-108)
FOUL! Shooting foul on Zach Durant. Immanuel LaVine to the line for 3 free throws. [Team fouls: 2] (Zach Durant: 1 personal fouls)   FT 1/3: GOOD   FT 2/3: GOOD   FT 3/3: MISS Immanuel LaVine makes 2/3 from the line. Rebound secured by Julius Harris.
Score: 92-108

[04:16] Team_024 possession (Score: 92-108)
Vince Irving attempts a Layup. Contested by Nikola Lillard (4.5 feet, ZONE). VINCE IRVING MAKES IT! Assist: Victor Simons
Score: 92-110

[04:03] Team_025 possession (Score: 92-110)
Nikola Lillard attempts a Layup. Contested by Terry Rozier (4.8 feet, MAN). Nikola Lillard misses. Rebound secured by Julius Harris.

[03:49] Team_024 possession (Score: 92-110)
Julius Harris loses the ball! Stripped by Damian Adebayo! TURNOVER! (live ball)

[03:34] Team_025 possession (Score: 92-110)
FOUL! Reach-in foul on Terry Rozier during the drive. [Team fouls: 3] No free throws, side out. (Terry Rozier: 1 personal fouls)

[03:19] Team_025 possession (Score: 92-110)
Damian Adebayo drives and kicks out. Dirk Gilgeous-Alexander attempts a Midrange. Wide open! Vince Irving is 8.1 feet away. [ZONE] DIRK GILGEOUS-ALEXANDER MAKES IT!
Score: 94-110

[03:00] Team_024 possession (Score: 94-110)
Terry Rozier attempts a Layup. Wide open! Nikola Lillard is 7.2 feet away. [ZONE] TERRY ROZIER MAKES IT!
Score: 94-112

[02:46] Team_025 possession (Score: 94-112)
Immanuel LaVine throws a bad pass! Stolen by Zach Durant! TURNOVER! (live ball)

[02:32] Team_024 possession (Score: 94-112)
Terry Rozier attempts a Midrange. Contested by Immanuel LaVine (5.4 feet, ZONE). TERRY ROZIER MAKES IT!
Score: 94-114

[02:14] Team_025 possession (Score: 94-114)
Dirk Gilgeous-Alexander attempts a 3Pt. Contested by Zach Durant (2.5 feet, ZONE). Dirk Gilgeous-Alexander misses. Rebound secured by Terry Rozier.

[02:00] Team_024 possession (Score: 94-114)
Victor Simons attempts a 3Pt. Contested by LeBron Griffin (5.6 feet, ZONE). VICTOR SIMONS MAKES IT! Assist: Vince Irving
Score: 94-117

[01:45] Team_025 possession (Score: 94-117)
LeBron Griffin attempts a 3Pt. Contested by Victor Simons (3.4 feet, MAN). LeBron Griffin misses. Rebound secured by Zach Durant.

[01:28] Team_024 possession (Score: 94-117)
Julius Harris attempts a 3Pt. Contested by Damian Adebayo (3.9 feet, MAN). JULIUS HARRIS MAKES IT! Assist: Victor Simons
Score: 94-120

[01:13] Team_025 possession (Score: 94-120)
LeBron Griffin attempts a Midrange. Wide open! Victor Simons is 7.7 feet away. [MAN] LeBron Griffin misses. Rebound secured by Terry Rozier.

[00:57] Team_024 possession (Score: 94-120)
Zach Durant attempts a 3Pt. Wide open! Immanuel LaVine is 6.5 feet away. [MAN] Zach Durant misses. Rebound secured by Dirk Gilgeous-Alexander.

[00:39] Team_025 possession (Score: 94-120)
Nikola Lillard drives, picks up Terry Rozier. Help arrives from Vince Irving! Nikola Lillard attempts a Layup. Contested by Vince Irving (3.8 feet, MAN). NIKOLA LILLARD MAKES IT! Assist: Dirk Gilgeous-Alexander
Score: 96-120

[00:20] Team_024 possession (Score: 96-120)
FOUL! Reach-in foul on Damian Adebayo during the drive. [Team fouls: 4] No free throws, side out. (Damian Adebayo: 1 personal fouls)

[00:05] Team_024 possession (Score: 96-120)
Julius Harris loses control! Ball rolls out of bounds! TURNOVER! (dead ball)

[00:05] Substitution (Team_025): LeBron Griffin OUT → Paolo Lowry IN (starter_return_rule1)

[00:05] Substitution (Team_024): Victor Simons OUT → Ja Reaves IN (starter_return_rule1)

================================================================================
                              4TH QUARTER COMPLETE                              
================================================================================

4TH QUARTER SCORE: Team_025 26, Team_024 30

BOX SCORE:
================================================================================

Team_025
--------------------------------------------------------------------------------
Player                MIN  PTS  REB  AST  TO      FG   FG%      3P   3P%
--------------------------------------------------------------------------------
Immanuel LaVine        18    5    1    0   0   2/4    50.0     0/0   0.0
Damian Adebayo         18    5    0    2   0   2/2   100.0     0/0   0.0
Dirk Gilgeous-Alexander   18    4    2    1   0   2/3    66.7     0/0   0.0
LeBron Griffin         20    3    0    2   0   1/6    16.7     0/0   0.0
Desmond Jordan         31    3    1    0   0   1/1   100.0     0/0   0.0
Ben Giddey             31    2    0    0   0   1/1   100.0     0/0   0.0
Nikola Lillard         18    2    3    0   0   1/2    50.0     0/0   0.0
Cade Anthony           31    0    1    0   0   0/0     0.0     0/0   0.0
Allen Embiid           31    0    0    1   0   0/0     0.0     0/0   0.0

TEAM: FG: 10/19 (52.6%), 3PT: 3/10 (30.0%), REB: 8 (1 off, 7 def), AST: 6, TO: 4
TEAM FOULS: 4


Team_024
--------------------------------------------------------------------------------
Player                MIN  PTS  REB  AST  TO      FG   FG%      3P   3P%
--------------------------------------------------------------------------------
Victor Simons          20    8    0    4   0   3/4    75.0     0/0   0.0
Terry Rozier           18    6    2    0   0   3/4    75.0     0/0   0.0
Vince Irving           18    6    0    1   0   3/4    75.0     0/0   0.0
Zach Durant            18    5    3    2   0   2/4    50.0     0/0   0.0
Julius Harris          18    3    3    0   0   1/2    50.0     0/0   0.0
Anfernee Williamson    31    0    1    1   0   0/0     0.0     0/0   0.0
Bradley Allen          31    0    0    0   0   0/1     0.0     0/0   0.0

TEAM: FG: 12/19 (63.2%), 3PT: 3/5 (60.0%), REB: 9 (0 off, 9 def), AST: 8, TO: 4
TEAM FOULS: 3

================================================================================

================================================================================
                               FULL GAME COMPLETE                               
================================================================================

FINAL SCORE: Team_025 96, Team_024 120

SCORING BY QUARTER:
--------------------------------------------------------------------------------
Team                     Q1     Q2     Q3     Q4    FINAL
--------------------------------------------------------------------------------
Team_025                 24     24     22     26       96
Team_024                 30     34     26     30      120
--------------------------------------------------------------------------------

FULL GAME BOX SCORE:
================================================================================

Team_025
--------------------------------------------------------------------------------
Player                MIN  PTS  REB  AST  TO      FG   FG%      3P   3P%      FT STL BLK
--------------------------------------------------------------------------------
Ben Giddey             31   12    0    1   1   6/14   42.9   0/6     0.0   0/0     0   0
Desmond Jordan         31   19   10    3   1   7/12   58.3   1/2    50.0   6/7     0   0
Cade Anthony           31    6    8    1   2   4/5    80.0   0/1     0.0   0/0     1   0
Allen Embiid           31   13    8    3   1   6/11   54.5   0/0     0.0   1/1     0   1
Paolo Lowry            29    4    0    4   1   3/11   27.3   1/5    20.0   0/0     2   0
LeBron Griffin         20   12    0    2   0   4/11   36.4   2/8    25.0   2/2     0   0
Dirk Gilgeous-Alexander   18    9    3    2   1   3/4    75.0   0/1     0.0   3/3     0   0
Immanuel LaVine        18    5    2    2   3   2/5    40.0   1/4    25.0   2/3     0   0
Damian Adebayo         18    8    0    2   0   4/5    80.0   1/2    50.0   3/3     1   0
Nikola Lillard         18    6    7    0   0   3/6    50.0   0/1     0.0   0/0     0   0

TEAM: FG: 42/84 (50.0%), 3PT: 6/30 (20.0%), REB: 38 (7 off, 31 def), AST: 20, TO: 10


Team_024
--------------------------------------------------------------------------------
Player                MIN  PTS  REB  AST  TO      FG   FG%      3P   3P%      FT STL BLK
--------------------------------------------------------------------------------
Zach Fox               31    8    9    2   2   3/7    42.9   0/2     0.0   3/4     1   1
Bradley Allen          31    6    0    1   0   4/8    50.0   0/1     0.0   2/4     0   0
Anfernee Williamson    31   13    8    7   2   9/13   69.2   1/1   100.0   6/6     0   2
Draymond Towns         31   21   14    2   1   7/11   63.6   0/1     0.0   1/2     2   1
Ja Reaves              29   16    0    1   3   5/11   45.5   2/6    33.3   1/3     0   0
Victor Simons          20   12    0    4   0   5/6    83.3   2/2   100.0   2/2     0   0
Vince Irving           18    9    0    1   0   4/7    57.1   1/2    50.0   0/0     0   1
Zach Durant            18   14    6    3   0   6/9    66.7   1/3    33.3   0/0     2   0
Julius Harris          18    8    4    1   3   3/4    75.0   2/3    66.7   2/2     0   0
Terry Rozier           18    6    5    3   0   3/5    60.0   0/0     0.0   0/1     1   0

TEAM: FG: 49/81 (60.5%), 3PT: 9/21 (42.9%), REB: 45 (5 off, 40 def), AST: 25, TO: 11

================================================================================
