================================================================================
                        FULL GAME - Team_001 vs Team_062                        
================================================================================

================================================================================
                       1ST QUARTER - Team_001 vs Team_062                       
================================================================================

[12:00] Team_001 possession (Score: 0-0)
Dirk Young attempts a 3Pt. Wide open! Kawhi Thompson is 6.7 feet away. [ZONE] Dirk Young misses. Rebound secured by Jalen Reaves.

[11:47] Team_062 possession (Score: 0-0)
Kawhi Thompson drives and kicks out. RJ Williamson attempts a Midrange. Wide open! Dejounte McCollum is 6.1 feet away. [ZONE] RJ Williamson misses. Rebound secured by Miles Griffin.

[11:30] Team_001 possession (Score: 0-0)
Dirk Young attempts a 3Pt. Wide open! RJ Williamson is 6.7 feet away. [MAN] Dirk Young misses. Rebound secured by Michael Hyland.

[11:17] Team_062 possession (Score: 0-0)
Michael Hyland attempts a Midrange. Heavily contested by Cole Ball (1.4 feet, ZONE)! Michael Hyland misses. Offensive rebound by Jalen Reaves! Jalen Reaves puts it back in!
Score: 0-2

[11:03] Team_001 possession (Score: 0-2)
Miles Griffin attempts a Midrange. Wide open! Jalen Reaves is 6.5 feet away. [MAN] MILES GRIFFIN MAKES IT!
Score: 2-2

[10:46] Team_062 possession (Score: 2-2)
RJ Williamson attempts a Midrange. Contested by Dirk Young (2.4 feet, MAN). RJ WILLIAMSON MAKES IT! Assist: Jalen Reaves
Score: 2-4

[10:34] Team_001 possession (Score: 2-4)
Dejounte McCollum drives, Kawhi Thompson stays with him. Dejounte McCollum attempts a Dunk. Wide open! Kawhi Thompson is 6.7 feet away. [MAN] DEJOUNTE MCCOLLUM MAKES IT!
Score: 4-4

[10:18] Team_062 possession (Score: 4-4)
RJ Williamson attempts a 3Pt. Contested by Dirk Young (4.4 feet, MAN). RJ WILLIAMSON MAKES IT! Assist: Kawhi Thompson
Score: 4-7

[10:03] Team_001 possession (Score: 4-7)
Miles Griffin drives, Jalen Reaves stays with him. Miles Griffin attempts a Dunk. Contested by Jalen Reaves (2.5 feet, MAN). MILES GRIFFIN MAKES IT!
Score: 6-7

[09:46] Team_062 possession (Score: 6-7)
Chris Bird loses control! Ball rolls out of bounds! TURNOVER! (dead ball)

[09:33] Team_001 possession (Score: 6-7)
Cole Ball attempts a 3Pt. Heavily contested by RJ Williamson (1.7 feet, ZONE)! Cole Ball misses. Rebound secured by Jalen Reaves.

[09:20] Team_062 possession (Score: 6-7)
RJ Williamson throws a bad pass out of bounds! TURNOVER! (dead ball)

[09:05] Team_001 possession (Score: 6-7)
Dejounte McCollum attempts a Midrange. Contested by Kawhi Thompson (5.1 feet, MAN). DEJOUNTE MCCOLLUM MAKES IT!
Score: 8-7

[08:51] Team_062 possession (Score: 8-7)
RJ Williamson attempts a 3Pt. Heavily contested by Klay Harden (0.5 feet, ZONE)! RJ WILLIAMSON MAKES IT! Assist: Jalen Reaves
Score: 8-10

[08:39] Team_001 possession (Score: 8-10)
Klay Harden loses the ball! Stripped by Chris Bird! TURNOVER! (live ball)

[08:25] Team_062 possession (Score: 8-10)
Michael Hyland attempts a 3Pt. Contested by Klay Harden (2.6 feet, ZONE). MICHAEL HYLAND MAKES IT!
Score: 8-13

[08:09] Team_001 possession (Score: 8-13)
Dirk Young drives, Kawhi Thompson stays with him. Dirk Young attempts a Dunk. Heavily contested by Kawhi Thompson (1.9 feet, ZONE)! DIRK YOUNG MAKES IT!
Score: 10-13

[07:58] Team_062 possession (Score: 10-13)
Kawhi Thompson attempts a 3Pt. Contested by Klay Harden (4.6 feet, ZONE). KAWHI THOMPSON MAKES IT! Assist: Jalen Reaves
Score: 10-16

[07:43] Team_001 possession (Score: 10-16)
Miles Griffin attempts a Layup. Wide open! Jalen Reaves is 7.1 feet away. [ZONE] Miles Griffin misses. Rebound secured by Jalen Reaves.

[07:28] Team_062 possession (Score: 10-16)
RJ Williamson makes the Layup and draws the foul on Miles Griffin! And-1! RJ Williamson to the line for 1. [Team fouls: 1] (Miles Griffin: 1 personal fouls)   FT 1/1: GOOD RJ Williamson makes 1/1 from the line.
Score: 10-19

[07:14] Team_001 possession (Score: 10-19)
Klay Harden attempts a Midrange. Contested by Michael Hyland (3.0 feet, ZONE). Klay Harden misses. Rebound secured by Kawhi Thompson.

[07:03] Team_062 possession (Score: 10-19)
Jalen Reaves attempts a Midrange. Contested by Dirk Young (4.6 feet, ZONE). JALEN REAVES MAKES IT!
Score: 10-21

[06:53] Team_001 possession (Score: 10-21)
Dejounte McCollum drives to the basket... Dejounte McCollum throws a bad pass out of bounds! TURNOVER! (dead ball)

[06:35] Team_062 possession (Score: 10-21)
Chris Bird attempts a 3Pt. Heavily contested by Dirk Young (1.8 feet, ZONE)! Chris Bird misses. Rebound secured by Dejounte McCollum.

[06:21] Team_001 possession (Score: 10-21)
Dejounte McCollum attempts a Midrange. Contested by Kawhi Thompson (4.2 feet, MAN). Dejounte McCollum misses. Rebound secured by Kawhi Thompson.

[06:07] Team_062 possession (Score: 10-21)
Kawhi Thompson drives and kicks out. Jalen Reaves attempts a Midrange. Wide open! Miles Griffin is 7.0 feet away. [MAN] JALEN REAVES MAKES IT!
Score: 10-23

[05:53] Team_001 possession (Score: 10-23)
Dejounte McCollum attempts a 3Pt. Contested by Kawhi Thompson (4.3 feet, MAN). DEJOUNTE MCCOLLUM MAKES IT! Assist: Klay Harden
Score: 13-23

[05:39] Team_062 possession (Score: 13-23)
RJ Williamson attempts a 3Pt. Contested by Klay Harden (3.0 feet, ZONE). RJ Williamson misses. Rebound secured by Cole Ball.

[05:24] Team_001 possession (Score: 13-23)
Miles Griffin attempts a 3Pt. Contested by RJ Williamson (3.2 feet, ZONE). Miles Griffin misses. Rebound secured by Kawhi Thompson.

[05:05] Team_062 possession (Score: 13-23)
Jalen Reaves attempts a Layup. Contested by Dejounte McCollum (5.0 feet, ZONE). Jalen Reaves misses. Rebound secured by Miles Griffin.

[04:54] Team_001 possession (Score: 13-23)
Cole Ball attempts a 3Pt. Wide open! RJ Williamson is 8.9 feet away. [ZONE] COLE BALL MAKES IT! Assist: Klay Harden
Score: 16-23

[04:42] Team_062 possession (Score: 16-23)
FOUL! Shooting foul on Miles Griffin. RJ Williamson to the line for 2 free throws. [Team fouls: 2] (Miles Griffin: 2 personal fouls)   FT 1/2: GOOD   FT 2/2: MISS RJ Williamson makes 1/2 from the line. Rebound secured by Dejounte McCollum.
Score: 16-24

[04:28] Team_001 possession (Score: 16-24)
Cole Ball commits a violation (traveling/carry)! TURNOVER! (dead ball)

[04:14] Team_062 possession (Score: 16-24)
RJ Williamson attempts a 3Pt. Contested by Klay Harden (5.5 feet, ZONE). RJ Williamson misses. Rebound secured by Dejounte McCollum.

[03:55] Team_001 possession (Score: 16-24)
Miles Griffin attempts a Layup. Contested by Jalen Reaves (4.0 feet, MAN). MILES GRIFFIN MAKES IT! Assist: Dirk Young
Score: 18-24

[03:41] Team_062 possession (Score: 18-24)
Kawhi Thompson attempts a 3Pt. Contested by Dejounte McCollum (4.3 feet, MAN). Kawhi Thompson misses. Rebound secured by Dejounte McCollum.

[03:28] Team_001 possession (Score: 18-24)
Dejounte McCollum attempts a Layup. Contested by Kawhi Thompson (4.5 feet, MAN). DEJOUNTE MCCOLLUM MAKES IT! Assist: Miles Griffin
Score: 20-24

[03:12] Team_062 possession (Score: 20-24)
Michael Hyland attempts a 3Pt. Contested by Klay Harden (4.0 feet, ZONE). Michael Hyland misses. FOUL! Loose ball foul on Dejounte McCollum during the rebound battle. [Team fouls: 3] No free throws, side out. (Dejounte McCollum: 1 personal fouls)

[02:58] Team_062 possession (Score: 20-24)
Kawhi Thompson drives to the basket... Kawhi Thompson throws a bad pass out of bounds! TURNOVER! (dead ball)

[02:58] Substitution (Team_001): Klay Harden OUT → Ja Dosunmu IN (stamina_rule2)

[02:58] Substitution (Team_001): Miles Griffin OUT → Kristaps Ming IN (stamina_rule2)

[02:58] Substitution (Team_062): Jalen Reaves OUT → Devin Young IN (stamina_rule2)

[02:46] Team_001 possession (Score: 20-24)
Ja Dosunmu drives to the basket... Ja Dosunmu loses the ball! Stripped by Kawhi Thompson! TURNOVER! (live ball)

[02:29] Team_062 possession (Score: 20-24)
Chris Bird attempts a 3Pt. Contested by Ja Dosunmu (4.6 feet, ZONE). Chris Bird misses. Rebound secured by Dejounte McCollum.

[02:16] Team_001 possession (Score: 20-24)
Cole Ball attempts a 3Pt. Contested by Michael Hyland (2.8 feet, MAN). Cole Ball misses. Rebound secured by Kawhi Thompson.

[02:02] Team_062 possession (Score: 20-24)
RJ Williamson attempts a 3Pt. Contested by Dirk Young (3.1 feet, MAN). RJ Williamson misses. Rebound secured by Dejounte McCollum.

[01:52] Team_001 possession (Score: 20-24)
Dirk Young attempts a Layup. Contested by RJ Williamson (2.5 feet, MAN). DIRK YOUNG MAKES IT! Assist: Dejounte McCollum
Score: 22-24

[01:39] Team_062 possession (Score: 22-24)
Kawhi Thompson makes the Layup and draws the foul on Dejounte McCollum! And-1! Kawhi Thompson to the line for 1. [Team fouls: 4] (Dejounte McCollum: 2 personal fouls)   FT 1/1: GOOD Kawhi Thompson makes 1/1 from the line.
Score: 22-27

[01:29] Team_001 possession (Score: 22-27)
Cole Ball attempts a 3Pt. Contested by Michael Hyland (3.0 feet, MAN). Cole Ball misses. Rebound secured by Michael Hyland.

[01:13] Team_062 possession (Score: 22-27)
Kawhi Thompson drives and kicks out. Michael Hyland attempts a 3Pt. Heavily contested by Dirk Young (0.8 feet, ZONE)! Michael Hyland misses. Rebound secured by Cole Ball.

[00:57] Team_001 possession (Score: 22-27)
Dirk Young attempts a 3Pt. Wide open! RJ Williamson is 6.1 feet away. [ZONE] Dirk Young misses. Rebound secured by Kawhi Thompson.

[00:44] Team_062 possession (Score: 22-27)
Michael Hyland makes the Layup and draws the foul on Cole Ball! And-1! Michael Hyland to the line for 1. [BONUS: 5 team fouls] (Cole Ball: 1 personal fouls)   FT 1/1: MISS Michael Hyland makes 0/1 from the line. FOUL! Loose ball foul on Kristaps Ming during the free throw rebound! [IN THE BONUS! 6 team fouls] Kawhi Thompson to the line for 2 free throws. (Kristaps Ming: 1 personal fouls)   FT 1/2: GOOD   FT 2/2: GOOD Kawhi Thompson makes 2/2 from the line.
Score: 22-31

[00:32] Team_001 possession (Score: 22-31)
Cole Ball attempts a Midrange. Contested by Michael Hyland (2.6 feet, ZONE). Cole Ball misses. Rebound secured by Devin Young.

[00:23] Team_062 possession (Score: 22-31)
Kawhi Thompson attempts a 3Pt. Contested by Dejounte McCollum (5.2 feet, MAN). KAWHI THOMPSON MAKES IT! Assist: Devin Young
Score: 22-34

[00:04] Team_001 possession (Score: 22-34)
Dirk Young makes the 3Pt and draws the foul on RJ Williamson! And-1! Dirk Young to the line for 1. [Team fouls: 1] (RJ Williamson: 1 personal fouls)   FT 1/1: GOOD Dirk Young makes 1/1 from the line.
Score: 26-34

================================================================================
                              1ST QUARTER COMPLETE                              
================================================================================

1ST QUARTER SCORE: Team_001 26, Team_062 34

BOX SCORE:
================================================================================

Team_001
--------------------------------------------------------------------------------
Player                MIN  PTS  REB  AST  TO      FG   FG%      3P   3P%
--------------------------------------------------------------------------------
Dejounte McCollum      12    9    6    1   0   4/5    80.0     0/0   0.0
Dirk Young             12    8    0    1   0   3/6    50.0     0/0   0.0
Miles Griffin           9    6    2    1   0   3/5    60.0     0/0   0.0
Cole Ball              12    3    2    0   0   1/5    20.0     0/0   0.0
Klay Harden             9    0    0    2   0   0/1     0.0     0/0   0.0

TEAM: FG: 11/22 (50.0%), 3PT: 3/10 (30.0%), REB: 10 (0 off, 10 def), AST: 5, TO: 4
TEAM FOULS: 6 [Team_062 in BONUS]


Team_062
--------------------------------------------------------------------------------
Player                MIN  PTS  REB  AST  TO      FG   FG%      3P   3P%
--------------------------------------------------------------------------------
Kawhi Thompson         12   13    5    1   0   4/7    57.1     0/0   0.0
RJ Williamson          12   11    0    0   0   4/8    50.0     0/0   0.0
Jalen Reaves            9    6    5    3   0   3/4    75.0     0/0   0.0
Michael Hyland         12    3    2    0   0   1/1   100.0     0/0   0.0
Chris Bird             12    0    0    0   0   0/2     0.0     0/0   0.0
Devin Young             3    0    1    1   0   0/0     0.0     0/0   0.0

TEAM: FG: 12/22 (54.5%), 3PT: 5/11 (45.5%), REB: 13 (2 off, 11 def), AST: 5, TO: 3
TEAM FOULS: 1

================================================================================

================================================================================
                       2ND QUARTER - Team_001 vs Team_062                       
================================================================================

[12:00] Team_001 possession (Score: 26-34)
Dirk Young attempts a 3Pt. Wide open! RJ Williamson is 9.1 feet away. [ZONE] DIRK YOUNG MAKES IT! Assist: Cole Ball
Score: 29-34

[11:43] Team_062 possession (Score: 29-34)
FOUL! Shooting foul on Miles Griffin. Jalen Reaves to the line for 2 free throws. [Team fouls: 1] (Miles Griffin: 1 personal fouls)   FT 1/2: GOOD   FT 2/2: GOOD Jalen Reaves makes 2/2 from the line.
Score: 29-36

[11:32] Team_001 possession (Score: 29-36)
Dejounte McCollum attempts a Layup. Contested by Kawhi Thompson (3.5 feet, ZONE). DEJOUNTE MCCOLLUM MAKES IT! Assist: Dirk Young
Score: 31-36

[11:16] Team_062 possession (Score: 31-36)
RJ Williamson drives and kicks out. Kawhi Thompson attempts a 3Pt. Wide open! Dejounte McCollum is 7.9 feet away. [MAN] Kawhi Thompson misses. Offensive rebound by Kawhi Thompson! Kawhi Thompson kicks it out.

[11:05] Team_062 possession (Score: 31-36)
Jalen Reaves attempts a Layup. Wide open! Miles Griffin is 6.4 feet away. [ZONE] JALEN REAVES MAKES IT!
Score: 31-38

[10:54] Team_001 possession (Score: 31-38)
Dejounte McCollum attempts a 3Pt. Wide open! Kawhi Thompson is 6.6 feet away. [MAN] DEJOUNTE MCCOLLUM MAKES IT! Assist: Miles Griffin
Score: 34-38

[10:37] Team_062 possession (Score: 34-38)
Chris Bird drives, Miles Griffin stays with him. Chris Bird attempts a Dunk. Heavily contested by Miles Griffin (1.9 feet, ZONE)! Chris Bird misses. Offensive rebound by Kawhi Thompson! Kawhi Thompson kicks it out.

[10:24] Team_062 possession (Score: 34-38)
RJ Williamson attempts a 3Pt. Contested by Dirk Young (3.5 feet, MAN). RJ Williamson misses. Offensive rebound by Jalen Reaves! Jalen Reaves's putback is no good. Rebound secured by Cole Ball.

[10:07] Team_001 possession (Score: 34-38)
Miles Griffin loses the ball! Stripped by Jalen Reaves! TURNOVER! (live ball)

[09:55] Team_062 possession (Score: 34-38)
Chris Bird attempts a 3Pt. Heavily contested by Klay Harden (1.5 feet, MAN)! Chris Bird misses. Rebound secured by Miles Griffin.

[09:41] Team_001 possession (Score: 34-38)
Dejounte McCollum attempts a Layup. Wide open! Jalen Reaves is 6.4 feet away. [ZONE] DEJOUNTE MCCOLLUM MAKES IT!
Score: 36-38

[09:28] Team_062 possession (Score: 36-38)
Michael Hyland drives, picks up Cole Ball. Help arrives from Klay Harden! Michael Hyland attempts a Dunk. Contested by Klay Harden (3.6 feet, MAN). MICHAEL HYLAND MAKES IT! Assist: Chris Bird
Score: 36-40

[09:12] Team_001 possession (Score: 36-40)
Dirk Young drives to the basket... Dirk Young loses the ball! Stripped by Jalen Reaves! TURNOVER! (live ball)

[08:59] Team_062 possession (Score: 36-40)
Michael Hyland attempts a Midrange. Contested by Cole Ball (3.1 feet, ZONE). MICHAEL HYLAND MAKES IT! Assist: Chris Bird
Score: 36-42

[08:44] Team_001 possession (Score: 36-42)
Dirk Young drives, picks up Jalen Reaves. Help arrives from Chris Bird! Dirk Young attempts a Layup. Wide open! Chris Bird is 6.2 feet away. [ZONE] Dirk Young misses. Rebound secured by Michael Hyland.

[08:28] Team_062 possession (Score: 36-42)
RJ Williamson attempts a 3Pt. Contested by Klay Harden (5.6 feet, ZONE). RJ Williamson misses. Rebound secured by Miles Griffin.

[08:12] Team_001 possession (Score: 36-42)
Klay Harden drives, Jalen Reaves stays with him. Klay Harden attempts a Layup. Wide open! Jalen Reaves is 6.9 feet away. [ZONE] KLAY HARDEN MAKES IT!
Score: 38-42

[07:57] Team_062 possession (Score: 38-42)
Kawhi Thompson attempts a Layup. Contested by Miles Griffin (4.1 feet, ZONE). Kawhi Thompson misses. Rebound secured by Dejounte McCollum.

[07:42] Team_001 possession (Score: 38-42)
Dejounte McCollum throws a bad pass! Stolen by Kawhi Thompson! TURNOVER! (live ball)

[07:24] Team_062 possession (Score: 38-42)
FOUL! Shooting foul on Dirk Young. RJ Williamson to the line for 2 free throws. [Team fouls: 2] (Dirk Young: 1 personal fouls)   FT 1/2: GOOD   FT 2/2: GOOD RJ Williamson makes 2/2 from the line.
Score: 38-44

[07:10] Team_001 possession (Score: 38-44)
Miles Griffin drives, Jalen Reaves stays with him. Miles Griffin attempts a Layup. Contested by Jalen Reaves (5.1 feet, MAN). MILES GRIFFIN MAKES IT!
Score: 40-44

[06:54] Team_062 possession (Score: 40-44)
RJ Williamson attempts a Layup. Wide open! Dirk Young is 6.7 feet away. [MAN] RJ Williamson misses. Rebound secured by Miles Griffin.

[06:42] Team_001 possession (Score: 40-44)
Dejounte McCollum attempts a 3Pt. Contested by Michael Hyland (2.4 feet, ZONE). Dejounte McCollum misses. Offensive rebound by Cole Ball! Cole Ball kicks it out.

[06:25] Team_001 possession (Score: 40-44)
Miles Griffin drives, Jalen Reaves stays with him. Miles Griffin attempts a Layup. Wide open! Jalen Reaves is 6.4 feet away. [ZONE] MILES GRIFFIN MAKES IT!
Score: 42-44

[06:09] Team_062 possession (Score: 42-44)
RJ Williamson attempts a 3Pt. Contested by Dirk Young (4.8 feet, MAN). RJ Williamson misses. Rebound secured by Miles Griffin.

[05:55] Team_001 possession (Score: 42-44)
Dirk Young drives to the basket... Dirk Young throws a bad pass! Stolen by RJ Williamson! TURNOVER! (live ball)

[05:40] Team_062 possession (Score: 42-44)
Kawhi Thompson attempts a 3Pt. Contested by Dejounte McCollum (5.0 feet, MAN). Kawhi Thompson misses. Rebound secured by Dejounte McCollum.

[05:23] Team_001 possession (Score: 42-44)
Cole Ball attempts a 3Pt. Contested by Michael Hyland (5.2 feet, MAN). Cole Ball misses. Offensive rebound by Cole Ball! Cole Ball kicks it out.

[05:11] Team_001 possession (Score: 42-44)
Miles Griffin attempts a Layup. Wide open! Jalen Reaves is 7.1 feet away. [MAN] MILES GRIFFIN MAKES IT! Assist: Cole Ball
Score: 44-44

[05:00] Team_062 possession (Score: 44-44)
Kawhi Thompson attempts a Midrange. Contested by Dejounte McCollum (6.0 feet, MAN). Kawhi Thompson misses. Rebound secured by Cole Ball.

[04:47] Team_001 possession (Score: 44-44)
Cole Ball attempts a Midrange. Contested by RJ Williamson (3.5 feet, ZONE). Cole Ball misses. Offensive rebound by Miles Griffin! Miles Griffin kicks it out.

[04:33] Team_001 possession (Score: 44-44)
Miles Griffin attempts a Layup. Wide open! Jalen Reaves is 8.9 feet away. [ZONE] MILES GRIFFIN MAKES IT! Assist: Cole Ball
Score: 46-44

[04:18] Team_062 possession (Score: 46-44)
Chris Bird throws a bad pass! Stolen by Klay Harden! TURNOVER! (live ball)

[03:59] Team_001 possession (Score: 46-44)
Cole Ball attempts a 3Pt. Contested by RJ Williamson (2.9 feet, ZONE). Cole Ball misses. Rebound secured by Kawhi Thompson.

[03:45] Team_062 possession (Score: 46-44)
Kawhi Thompson attempts a Midrange. Wide open! Dejounte McCollum is 7.3 feet away. [MAN] Kawhi Thompson misses. Rebound secured by Dejounte McCollum.

[03:32] Team_001 possession (Score: 46-44)
Dirk Young drives, Jalen Reaves stays with him. Dirk Young attempts a Layup. Wide open! Jalen Reaves is 6.9 feet away. [ZONE] DIRK YOUNG MAKES IT!
Score: 48-44

[03:20] Team_062 possession (Score: 48-44)
RJ Williamson attempts a 3Pt. Contested by Klay Harden (4.4 feet, ZONE). RJ Williamson misses. Rebound secured by Cole Ball.

[03:05] Team_001 possession (Score: 48-44)
Cole Ball makes the Dunk and draws the foul on Jalen Reaves! And-1! Cole Ball to the line for 1. [Team fouls: 1] (Jalen Reaves: 1 personal fouls)   FT 1/1: GOOD Cole Ball makes 1/1 from the line.
Score: 51-44

[02:50] Team_062 possession (Score: 51-44)
Kawhi Thompson attempts a 3Pt. Contested by Dejounte McCollum (4.1 feet, MAN). Kawhi Thompson misses. Offensive rebound by Kawhi Thompson! Kawhi Thompson kicks it out.

[02:36] Team_062 possession (Score: 51-44)
RJ Williamson drives and kicks out. RJ Williamson attempts a Midrange. Contested by Miles Griffin (3.7 feet, ZONE). RJ Williamson misses. Rebound secured by Cole Ball.

[02:21] Team_001 possession (Score: 51-44)
Dejounte McCollum attempts a Midrange. Contested by Michael Hyland (5.2 feet, ZONE). Dejounte McCollum misses. Offensive rebound by Miles Griffin! Miles Griffin kicks it out.

[02:10] Team_001 possession (Score: 51-44)
Dejounte McCollum attempts a Midrange. Contested by Chris Bird (2.5 feet, ZONE). Dejounte McCollum misses. Rebound secured by Jalen Reaves.

[01:59] Team_062 possession (Score: 51-44)
Michael Hyland attempts a 3Pt. Contested by Cole Ball (4.7 feet, MAN). Michael Hyland misses. Rebound secured by Cole Ball.

[01:49] Team_001 possession (Score: 51-44)
Miles Griffin drives and kicks out. Klay Harden attempts a 3Pt. Contested by Chris Bird (4.8 feet, MAN). Klay Harden misses. Rebound secured by Michael Hyland.

[01:31] Team_062 possession (Score: 51-44)
Michael Hyland attempts a 3Pt. Contested by Klay Harden (2.3 feet, ZONE). MICHAEL HYLAND MAKES IT! Assist: Kawhi Thompson
Score: 51-47

[01:21] Team_001 possession (Score: 51-47)
FOUL! Shooting foul on Kawhi Thompson. Dejounte McCollum to the line for 3 free throws. [Team fouls: 2] (Kawhi Thompson: 1 personal fouls)   FT 1/3: GOOD   FT 2/3: MISS   FT 3/3: GOOD Dejounte McCollum makes 2/3 from the line.
Score: 53-47

[01:06] Team_062 possession (Score: 53-47)
Jalen Reaves drives to the basket... Jalen Reaves loses control! Ball rolls out of bounds! TURNOVER! (dead ball)

[01:06] Substitution (Team_001): Klay Harden OUT → Ja Dosunmu IN (stamina_rule2)

[01:06] Substitution (Team_001): Dirk Young OUT → Rudy George IN (stamina_rule2)

[01:06] Substitution (Team_001): Cole Ball OUT → Larry Trent IN (stamina_rule2)

[01:06] Substitution (Team_001): Dejounte McCollum OUT → Franz Bryant IN (stamina_rule2)

[01:06] Substitution (Team_001): Miles Griffin OUT → Kristaps Ming IN (stamina_rule2)

[01:06] Substitution (Team_062): Chris Bird OUT → Paolo McCollum IN (stamina_rule2)

[01:06] Substitution (Team_062): RJ Williamson OUT → Tony LaVine IN (stamina_rule2)

[01:06] Substitution (Team_062): Michael Hyland OUT → Paul Poole IN (stamina_rule2)

[01:06] Substitution (Team_062): Kawhi Thompson OUT → RJ Wall IN (stamina_rule2)

[01:06] Substitution (Team_062): Jalen Reaves OUT → Devin Young IN (stamina_rule2)

[00:55] Team_001 possession (Score: 53-47)
Franz Bryant attempts a 3Pt. Wide open! RJ Wall is 6.7 feet away. [MAN] Franz Bryant misses. Offensive rebound by Larry Trent! Larry Trent kicks it out.

[00:44] Team_001 possession (Score: 53-47)
Franz Bryant attempts a Midrange. Wide open! RJ Wall is 6.9 feet away. [MAN] Franz Bryant misses. Rebound secured by RJ Wall.

[00:30] Team_062 possession (Score: 53-47)
FOUL! Reach-in foul on Kristaps Ming during the drive. [Team fouls: 3] No free throws, side out. (Kristaps Ming: 1 personal fouls)

[00:16] Team_062 possession (Score: 53-47)
Paul Poole attempts a Midrange. Contested by Rudy George (3.6 feet, ZONE). PAUL POOLE MAKES IT! Assist: RJ Wall
Score: 53-49

[00:01] Team_001 possession (Score: 53-49)
Franz Bryant drives to the basket... FOUL! Offensive foul on Franz Bryant! RJ Wall drew the charge! [Team fouls: 4] (Franz Bryant: 1 personal fouls) TURNOVER! (dead ball)

================================================================================
                              2ND QUARTER COMPLETE                              
================================================================================

2ND QUARTER SCORE: Team_001 27, Team_062 15

BOX SCORE:
================================================================================

Team_001
--------------------------------------------------------------------------------
Player                MIN  PTS  REB  AST  TO      FG   FG%      3P   3P%
--------------------------------------------------------------------------------
Dejounte McCollum      23    9    3    0   0   4/5    80.0     0/0   0.0
Miles Griffin          20    8    6    1   0   4/5    80.0     0/0   0.0
Dirk Young             23    5    0    1   0   2/3    66.7     0/0   0.0
Cole Ball              23    3    7    3   0   1/2    50.0     0/0   0.0
Klay Harden            20    2    0    0   0   1/1   100.0     0/0   0.0
Larry Trent             1    0    1    0   0   0/0     0.0     0/0   0.0
Franz Bryant            1    0    0    0   0   0/1     0.0     0/0   0.0

TEAM: FG: 12/17 (70.6%), 3PT: 3/4 (75.0%), REB: 16 (5 off, 11 def), AST: 5, TO: 5
TEAM FOULS: 4


Team_062
--------------------------------------------------------------------------------
Player                MIN  PTS  REB  AST  TO      FG   FG%      3P   3P%
--------------------------------------------------------------------------------
Michael Hyland         23    7    2    0   0   3/4    75.0     0/0   0.0
Jalen Reaves           20    4    1    0   0   2/2   100.0     0/0   0.0
RJ Williamson          23    2    0    0   0   1/7    14.3     0/0   0.0
Paul Poole              1    2    0    0   0   1/1   100.0     0/0   0.0
Kawhi Thompson         23    0    4    1   0   0/4     0.0     0/0   0.0
Chris Bird             23    0    0    2   0   0/1     0.0     0/0   0.0
RJ Wall                 1    0    1    1   0   0/0     0.0     0/0   0.0

TEAM: FG: 7/19 (36.8%), 3PT: 1/8 (12.5%), REB: 9 (4 off, 5 def), AST: 4, TO: 2
TEAM FOULS: 2

================================================================================

================================================================================
                       3RD QUARTER - Team_001 vs Team_062                       
================================================================================

[12:00] Team_001 possession (Score: 53-49)
FOUL! Reach-in foul on Chris Bird during the drive. [Team fouls: 1] No free throws, side out. (Chris Bird: 1 personal fouls)

[11:46] Team_001 possession (Score: 53-49)
Dejounte McCollum attempts a 3Pt. Contested by Kawhi Thompson (4.8 feet, MAN). Dejounte McCollum misses. Rebound secured by Kawhi Thompson.

[11:27] Team_062 possession (Score: 53-49)
Jalen Reaves drives, picks up Miles Griffin. Help arrives from Klay Harden! Jalen Reaves attempts a Dunk. Contested by Klay Harden (4.4 feet, MAN). JALEN REAVES MAKES IT!
Score: 53-51

[11:14] Team_001 possession (Score: 53-51)
Miles Griffin attempts a Midrange. Wide open! Jalen Reaves is 6.0 feet away. [MAN] MILES GRIFFIN MAKES IT!
Score: 55-51

[10:58] Team_062 possession (Score: 55-51)
Kawhi Thompson throws a bad pass out of bounds! TURNOVER! (dead ball)

[10:43] Team_001 possession (Score: 55-51)
Dejounte McCollum throws a bad pass out of bounds! TURNOVER! (dead ball)

[10:27] Team_062 possession (Score: 55-51)
RJ Williamson makes the Dunk and draws the foul on Dirk Young! And-1! RJ Williamson to the line for 1. [Team fouls: 1] (Dirk Young: 1 personal fouls)   FT 1/1: GOOD RJ Williamson makes 1/1 from the line.
Score: 55-54

[10:12] Team_001 possession (Score: 55-54)
Dirk Young attempts a 3Pt. Contested by RJ Williamson (4.2 feet, MAN). Dirk Young misses. Rebound secured by Michael Hyland.

[09:59] Team_062 possession (Score: 55-54)
Chris Bird drives to the basket... Chris Bird loses the ball! Stripped by Miles Griffin! TURNOVER! (live ball)

[09:41] Team_001 possession (Score: 55-54)
Dejounte McCollum drives and kicks out. Dejounte McCollum attempts a 3Pt. Wide open! RJ Williamson is 6.1 feet away. [ZONE] Dejounte McCollum misses. Rebound secured by Michael Hyland.

[09:29] Team_062 possession (Score: 55-54)
Michael Hyland attempts a 3Pt. Heavily contested by Cole Ball (0.5 feet, MAN)! Michael Hyland misses. Offensive rebound by Jalen Reaves! Jalen Reaves puts it back in!
Score: 55-56

[09:16] Team_001 possession (Score: 55-56)
Dirk Young attempts a Layup. BLOCKED BY MICHAEL HYLAND! Ball is loose! Offensive rebound by Miles Griffin! Miles Griffin kicks it out.

[09:01] Team_001 possession (Score: 55-56)
Miles Griffin attempts a 3Pt. Contested by Jalen Reaves (5.7 feet, MAN). Miles Griffin misses. Offensive rebound by Cole Ball! Cole Ball kicks it out.

[08:45] Team_001 possession (Score: 55-56)
Dejounte McCollum attempts a Midrange. Contested by Kawhi Thompson (2.2 feet, MAN). Dejounte McCollum misses. Rebound secured by Jalen Reaves.

[08:28] Team_062 possession (Score: 55-56)
Chris Bird drives, Klay Harden stays with him. Chris Bird attempts a Dunk. Contested by Klay Harden (5.2 feet, MAN). CHRIS BIRD MAKES IT! Assist: RJ Williamson
Score: 55-58

[08:15] Team_001 possession (Score: 55-58)
FOUL! Shooting foul on RJ Williamson. Dirk Young to the line for 3 free throws. [Team fouls: 2] (RJ Williamson: 1 personal fouls)   FT 1/3: GOOD   FT 2/3: MISS   FT 3/3: GOOD Dirk Young makes 2/3 from the line.
Score: 57-58

[08:00] Team_062 possession (Score: 57-58)
Chris Bird attempts a 3Pt. Contested by Klay Harden (4.0 feet, MAN). CHRIS BIRD MAKES IT! Assist: Michael Hyland
Score: 57-61

[07:46] Team_001 possession (Score: 57-61)
Dirk Young attempts a 3Pt. Contested by RJ Williamson (5.5 feet, ZONE). Dirk Young misses. FOUL! Loose ball foul on Jalen Reaves during the rebound battle. [Team fouls: 3] No free throws, side out. (Jalen Reaves: 1 personal fouls)

[07:33] Team_001 possession (Score: 57-61)
Cole Ball attempts a Midrange. Wide open! Michael Hyland is 6.7 feet away. [MAN] Cole Ball misses. Rebound secured by Kawhi Thompson.

[07:23] Team_062 possession (Score: 57-61)
Kawhi Thompson drives to the basket... Kawhi Thompson loses the ball! Stripped by Miles Griffin! TURNOVER! (live ball)

[07:09] Team_001 possession (Score: 57-61)
Dirk Young makes the Layup and draws the foul on Jalen Reaves! And-1! Dirk Young to the line for 1. [Team fouls: 4] (Jalen Reaves: 2 personal fouls)   FT 1/1: MISS Dirk Young makes 0/1 from the line. Rebound secured by Jalen Reaves.
Score: 59-61

[06:51] Team_062 possession (Score: 59-61)
Chris Bird attempts a Midrange. Contested by Cole Ball (3.6 feet, ZONE). Chris Bird misses. Offensive rebound by Jalen Reaves! Jalen Reaves puts it back in!
Score: 59-63

[06:34] Team_001 possession (Score: 59-63)
Klay Harden throws a bad pass out of bounds! TURNOVER! (dead ball)

[06:16] Team_062 possession (Score: 59-63)
RJ Williamson attempts a 3Pt. Heavily contested by Dirk Young (1.2 feet, MAN)! RJ Williamson misses. Rebound secured by Cole Ball.

[06:06] Team_001 possession (Score: 59-63)
Dirk Young attempts a 3Pt. Contested by Chris Bird (5.3 feet, ZONE). DIRK YOUNG MAKES IT! Assist: Miles Griffin
Score: 62-63

[05:49] Team_062 possession (Score: 62-63)
Chris Bird attempts a 3Pt. Heavily contested by Klay Harden (1.4 feet, ZONE)! Chris Bird misses. Rebound secured by Miles Griffin.

[05:30] Team_001 possession (Score: 62-63)
Miles Griffin drives and kicks out. Miles Griffin attempts a 3Pt. Contested by RJ Williamson (4.7 feet, ZONE). MILES GRIFFIN MAKES IT! Assist: Klay Harden
Score: 65-63

[05:15] Team_062 possession (Score: 65-63)
RJ Williamson attempts a 3Pt. Contested by Klay Harden (5.7 feet, ZONE). RJ WILLIAMSON MAKES IT! Assist: Kawhi Thompson
Score: 65-66

[05:00] Team_001 possession (Score: 65-66)
Miles Griffin attempts a Midrange. Wide open! Jalen Reaves is 6.6 feet away. [MAN] Miles Griffin misses. Rebound secured by Michael Hyland.

[04:43] Team_062 possession (Score: 65-66)
Jalen Reaves attempts a Layup. Contested by Miles Griffin (4.1 feet, MAN). JALEN REAVES MAKES IT! Assist: RJ Williamson
Score: 65-68

[04:28] Team_001 possession (Score: 65-68)
Dejounte McCollum drives to the basket... Dejounte McCollum throws a bad pass out of bounds! TURNOVER! (dead ball)

[04:19] Team_062 possession (Score: 65-68)
FOUL! Holding foul on Dejounte McCollum. [Team fouls: 2] No free throws, side out. (Dejounte McCollum: 1 personal fouls)

[04:04] Team_062 possession (Score: 65-68)
RJ Williamson attempts a Midrange. Heavily contested by Dirk Young (1.6 feet, MAN)! RJ Williamson misses. Rebound secured by Miles Griffin.

[03:51] Team_001 possession (Score: 65-68)
FOUL! Shooting foul on Chris Bird. Klay Harden to the line for 2 free throws. [BONUS: 5 team fouls] (Chris Bird: 2 personal fouls)   FT 1/2: GOOD   FT 2/2: GOOD Klay Harden makes 2/2 from the line.
Score: 67-68

[03:34] Team_062 possession (Score: 67-68)
Jalen Reaves drives and kicks out. Michael Hyland attempts a 3Pt. Contested by Cole Ball (4.5 feet, MAN). Michael Hyland misses. Rebound secured by Dejounte McCollum.

[03:22] Team_001 possession (Score: 67-68)
Dirk Young drives, RJ Williamson stays with him. Dirk Young attempts a Layup. Wide open! RJ Williamson is 7.9 feet away. [MAN] DIRK YOUNG MAKES IT! Assist: Klay Harden
Score: 69-68

[03:06] Team_062 possession (Score: 69-68)
Kawhi Thompson attempts a Layup. Wide open! Dejounte McCollum is 7.7 feet away. [MAN] KAWHI THOMPSON MAKES IT! Assist: Chris Bird
Score: 69-70

[02:54] Team_001 possession (Score: 69-70)
Dejounte McCollum attempts a Layup. Wide open! Kawhi Thompson is 8.1 feet away. [MAN] Dejounte McCollum misses. Offensive rebound by Miles Griffin! Miles Griffin kicks it out.

[02:37] Team_001 possession (Score: 69-70)
Klay Harden drives and kicks out. Dirk Young attempts a Midrange. Contested by RJ Williamson (4.6 feet, MAN). DIRK YOUNG MAKES IT! Assist: Miles Griffin
Score: 71-70

[02:22] Team_062 possession (Score: 71-70)
Kawhi Thompson drives, Dejounte McCollum stays with him. Kawhi Thompson attempts a Layup. Contested by Dejounte McCollum (2.0 feet, ZONE). KAWHI THOMPSON MAKES IT! Assist: Jalen Reaves
Score: 71-72

[02:10] Team_001 possession (Score: 71-72)
Miles Griffin drives to the basket... Miles Griffin loses the ball! Stripped by Jalen Reaves! TURNOVER! (live ball)

[01:57] Team_062 possession (Score: 71-72)
RJ Williamson attempts a 3Pt. Contested by Klay Harden (5.4 feet, ZONE). RJ Williamson misses. Rebound secured by Dejounte McCollum.

[01:39] Team_001 possession (Score: 71-72)
Dirk Young makes the Dunk and draws the foul on Jalen Reaves! And-1! Dirk Young to the line for 1. [BONUS: 6 team fouls] (Jalen Reaves: 3 personal fouls)   FT 1/1: GOOD Dirk Young makes 1/1 from the line.
Score: 74-72

[01:25] Team_062 possession (Score: 74-72)
RJ Williamson drives to the basket... RJ Williamson loses the ball! Stripped by Miles Griffin! TURNOVER! (live ball)

[01:09] Team_001 possession (Score: 74-72)
Klay Harden attempts a Layup. Contested by Chris Bird (5.7 feet, MAN). Klay Harden misses. Rebound secured by Kawhi Thompson.

[00:54] Team_062 possession (Score: 74-72)
Kawhi Thompson makes the Layup and draws the foul on Miles Griffin! And-1! Kawhi Thompson to the line for 1. [Team fouls: 3] (Miles Griffin: 1 personal fouls)   FT 1/1: MISS Kawhi Thompson makes 0/1 from the line. Rebound secured by Cole Ball.
Score: 74-74

[00:43] Team_001 possession (Score: 74-74)
Cole Ball drives to the basket... Cole Ball throws a bad pass out of bounds! TURNOVER! (dead ball)

[00:43] Substitution (Team_001): Klay Harden OUT → Ja Dosunmu IN (stamina_rule2)

[00:43] Substitution (Team_001): Dirk Young OUT → Rudy George IN (stamina_rule2)

[00:43] Substitution (Team_001): Cole Ball OUT → Larry Trent IN (stamina_rule2)

[00:43] Substitution (Team_001): Dejounte McCollum OUT → Franz Bryant IN (stamina_rule2)

[00:43] Substitution (Team_001): Miles Griffin OUT → Kristaps Ming IN (stamina_rule2)

[00:43] Substitution (Team_062): Chris Bird OUT → Paolo McCollum IN (stamina_rule2)

[00:43] Substitution (Team_062): RJ Williamson OUT → Tony LaVine IN (stamina_rule2)

[00:43] Substitution (Team_062): Michael Hyland OUT → Paul Poole IN (stamina_rule2)

[00:43] Substitution (Team_062): Kawhi Thompson OUT → RJ Wall IN (stamina_rule2)

[00:43] Substitution (Team_062): Jalen Reaves OUT → Devin Young IN (stamina_rule2)

[00:27] Team_062 possession (Score: 74-74)
Tony LaVine attempts a 3Pt. Contested by Ja Dosunmu (4.9 feet, ZONE). Tony LaVine misses. Offensive rebound by Devin Young! Devin Young kicks it out.

[00:12] Team_062 possession (Score: 74-74)
FOUL! Offensive foul on Paul Poole! Larry Trent drew the charge! [Team fouls: 7] (Paul Poole: 1 personal fouls) TURNOVER! (dead ball)

================================================================================
                              3RD QUARTER COMPLETE                              
================================================================================

3RD QUARTER SCORE: Team_001 21, Team_062 25

BOX SCORE:
================================================================================

Team_001
--------------------------------------------------------------------------------
Player                MIN  PTS  REB  AST  TO      FG   FG%      3P   3P%
--------------------------------------------------------------------------------
Dirk Young             35   12    0    0   0   5/7    71.4     0/0   0.0
Miles Griffin          32    5    4    2   0   2/3    66.7     0/0   0.0
Klay Harden            32    2    0    2   0   1/2    50.0     0/0   0.0
Dejounte McCollum      35    0    2    0   0   0/3     0.0     0/0   0.0
Cole Ball              35    0    4    0   0   0/1     0.0     0/0   0.0

TEAM: FG: 8/16 (50.0%), 3PT: 2/4 (50.0%), REB: 10 (4 off, 6 def), AST: 4, TO: 5
TEAM FOULS: 3


Team_062
--------------------------------------------------------------------------------
Player                MIN  PTS  REB  AST  TO      FG   FG%      3P   3P%
--------------------------------------------------------------------------------
Jalen Reaves           32    8    4    1   0   4/5    80.0     0/0   0.0
RJ Williamson          35    6    0    2   0   2/5    40.0     0/0   0.0
Chris Bird             35    5    0    1   0   2/3    66.7     0/0   0.0
Kawhi Thompson         35    4    3    1   0   2/3    66.7     0/0   0.0
Michael Hyland         35    0    3    1   0   0/0     0.0     0/0   0.0
Devin Young             5    0    1    0   0   0/0     0.0     0/0   0.0

TEAM: FG: 10/16 (62.5%), 3PT: 3/6 (50.0%), REB: 11 (3 off, 8 def), AST: 6, TO: 5
TEAM FOULS: 7 [Team_001 in BONUS]

================================================================================

================================================================================
                       4TH QUARTER - Team_001 vs Team_062                       
================================================================================

[12:00] Team_001 possession (Score: 74-74)
Dirk Young drives and kicks out. Cole Ball attempts a 3Pt. Wide open! Kawhi Thompson is 7.6 feet away. [ZONE] Cole Ball misses. Rebound secured by Kawhi Thompson.

[11:45] Team_062 possession (Score: 74-74)
Jalen Reaves drives, Miles Griffin stays with him. Jalen Reaves attempts a Dunk. Wide open! Miles Griffin is 6.8 feet away. [ZONE] JALEN REAVES MAKES IT! Assist: Chris Bird
Score: 74-76

[11:28] Team_001 possession (Score: 74-76)
FOUL! Holding foul on RJ Williamson. [Team fouls: 1] No free throws, side out. (RJ Williamson: 1 personal fouls)

[11:13] Team_001 possession (Score: 74-76)
Klay Harden attempts a Midrange. Contested by Jalen Reaves (3.0 feet, ZONE). Klay Harden misses. Rebound secured by Kawhi Thompson.

[10:57] Team_062 possession (Score: 74-76)
Chris Bird attempts a 3Pt. Contested by Klay Harden (5.7 feet, ZONE). CHRIS BIRD MAKES IT!
Score: 74-79

[10:41] Team_001 possession (Score: 74-79)
Cole Ball drives and kicks out. Dirk Young attempts a 3Pt. Wide open! RJ Williamson is 6.7 feet away. [ZONE] DIRK YOUNG MAKES IT! Assist: Miles Griffin
Score: 77-79

[10:25] Team_062 possession (Score: 77-79)
Michael Hyland attempts a Midrange. Heavily contested by Cole Ball (2.0 feet, MAN)! Michael Hyland misses. Offensive rebound by Kawhi Thompson! Kawhi Thompson kicks it out.

[10:07] Team_062 possession (Score: 77-79)
RJ Williamson attempts a Midrange. Wide open! Dirk Young is 6.2 feet away. [MAN] RJ WILLIAMSON MAKES IT! Assist: Jalen Reaves
Score: 77-81

[09:53] Team_001 possession (Score: 77-81)
Klay Harden attempts a 3Pt. Contested by RJ Williamson (5.4 feet, ZONE). KLAY HARDEN MAKES IT! Assist: Dirk Young
Score: 80-81

[09:39] Team_062 possession (Score: 80-81)
Chris Bird makes the Dunk and draws the foul on Klay Harden! And-1! Chris Bird to the line for 1. [Team fouls: 1] (Klay Harden: 1 personal fouls)   FT 1/1: GOOD Chris Bird makes 1/1 from the line.
Score: 80-84

[09:23] Team_001 possession (Score: 80-84)
Klay Harden throws a bad pass out of bounds! TURNOVER! (dead ball)

[09:23] Substitution (Team_001): Klay Harden OUT → Ja Dosunmu IN (stamina_rule2)

[09:23] Substitution (Team_001): Dirk Young OUT → Rudy George IN (stamina_rule2)

[09:23] Substitution (Team_001): Cole Ball OUT → Larry Trent IN (stamina_rule2)

[09:23] Substitution (Team_001): Dejounte McCollum OUT → Franz Bryant IN (stamina_rule2)

[09:23] Substitution (Team_001): Miles Griffin OUT → Kristaps Ming IN (stamina_rule2)

[09:23] Substitution (Team_062): Chris Bird OUT → Paolo McCollum IN (stamina_rule2)

[09:23] Substitution (Team_062): RJ Williamson OUT → Tony LaVine IN (stamina_rule2)

[09:23] Substitution (Team_062): Michael Hyland OUT → Paul Poole IN (stamina_rule2)

[09:23] Substitution (Team_062): Kawhi Thompson OUT → RJ Wall IN (stamina_rule2)

[09:23] Substitution (Team_062): Jalen Reaves OUT → Devin Young IN (stamina_rule2)

[09:13] Team_062 possession (Score: 80-84)
Tony LaVine attempts a 3Pt. Contested by Ja Dosunmu (2.8 feet, ZONE). Tony LaVine misses. Rebound secured by Larry Trent.

[08:58] Team_001 possession (Score: 80-84)
Franz Bryant makes the Midrange and draws the foul on RJ Wall! And-1! Franz Bryant to the line for 1. [Team fouls: 2] (RJ Wall: 1 personal fouls)   FT 1/1: GOOD Franz Bryant makes 1/1 from the line.
Score: 83-84

[08:44] Team_062 possession (Score: 83-84)
Paul Poole drives and kicks out. Paolo McCollum attempts a 3Pt. Contested by Ja Dosunmu (4.6 feet, MAN). Paolo McCollum misses. Rebound secured by Rudy George.

[08:26] Team_001 possession (Score: 83-84)
FOUL! Reach-in foul on Tony LaVine during the drive. [Team fouls: 3] No free throws, side out. (Tony LaVine: 1 personal fouls)

[08:11] Team_001 possession (Score: 83-84)
Franz Bryant drives, RJ Wall stays with him. Franz Bryant attempts a Layup. Contested by RJ Wall (3.8 feet, MAN). Franz Bryant misses. Rebound secured by Devin Young.

[07:55] Team_062 possession (Score: 83-84)
Paolo McCollum drives to the basket... Paolo McCollum loses control! Ball rolls out of bounds! TURNOVER! (dead ball)

[07:38] Team_001 possession (Score: 83-84)
FOUL! Holding foul on RJ Wall. [Team fouls: 4] No free throws, side out. (RJ Wall: 2 personal fouls)

[07:25] Team_001 possession (Score: 83-84)
Franz Bryant attempts a Layup. Contested by Devin Young (5.0 feet, ZONE). FRANZ BRYANT MAKES IT! Assist: Ja Dosunmu
Score: 85-84

[07:13] Team_062 possession (Score: 85-84)
Devin Young drives and kicks out. Tony LaVine attempts a 3Pt. Contested by Rudy George (2.5 feet, MAN). Tony LaVine misses. Rebound secured by Larry Trent.

[06:59] Team_001 possession (Score: 85-84)
Franz Bryant attempts a 3Pt. Wide open! Paolo McCollum is 6.7 feet away. [ZONE] Franz Bryant misses. Rebound secured by RJ Wall.

[06:45] Team_062 possession (Score: 85-84)
Paolo McCollum attempts a 3Pt. Wide open! Ja Dosunmu is 7.4 feet away. [ZONE] Paolo McCollum misses. Rebound secured by Larry Trent.

[06:30] Team_001 possession (Score: 85-84)
Rudy George makes the Layup and draws the foul on Paolo McCollum! And-1! Rudy George to the line for 1. [BONUS: 5 team fouls] (Paolo McCollum: 1 personal fouls)   FT 1/1: GOOD Rudy George makes 1/1 from the line.
Score: 88-84

[06:17] Team_062 possession (Score: 88-84)
Paolo McCollum drives to the basket... Paolo McCollum loses the ball! Stripped by Franz Bryant! TURNOVER! (live ball)

[06:05] Team_001 possession (Score: 88-84)
Rudy George attempts a 3Pt. Wide open! Paolo McCollum is 7.4 feet away. [ZONE] Rudy George misses. Rebound secured by RJ Wall.

[05:54] Team_062 possession (Score: 88-84)
Paolo McCollum attempts a 3Pt. Heavily contested by Ja Dosunmu (1.9 feet, MAN)! Paolo McCollum misses. Offensive rebound by Devin Young! Devin Young kicks it out.

[05:37] Team_062 possession (Score: 88-84)
RJ Wall attempts a 3Pt. Contested by Ja Dosunmu (5.8 feet, ZONE). RJ Wall misses. Rebound secured by Rudy George.

[05:24] Team_001 possession (Score: 88-84)
Ja Dosunmu attempts a Midrange. Contested by Paolo McCollum (5.0 feet, MAN). Ja Dosunmu misses. Rebound secured by Devin Young.

[05:12] Team_062 possession (Score: 88-84)
Paolo McCollum drives and kicks out. RJ Wall attempts a 3Pt. Wide open! Franz Bryant is 7.4 feet away. [MAN] RJ WALL MAKES IT! Assist: Devin Young
Score: 88-87

[04:59] Team_001 possession (Score: 88-87)
Kristaps Ming drives and kicks out. Rudy George attempts a 3Pt. Wide open! Tony LaVine is 8.5 feet away. [MAN] Rudy George misses. Offensive rebound by Rudy George! Rudy George kicks it out.

[04:47] Team_001 possession (Score: 88-87)
Kristaps Ming attempts a 3Pt. Wide open! Devin Young is 8.0 feet away. [MAN] Kristaps Ming misses. Offensive rebound by Larry Trent! Larry Trent kicks it out.

[04:31] Team_001 possession (Score: 88-87)
Larry Trent attempts a 3Pt. Wide open! Paul Poole is 7.8 feet away. [MAN] LARRY TRENT MAKES IT! Assist: Kristaps Ming
Score: 91-87

[04:20] Team_062 possession (Score: 91-87)
RJ Wall attempts a 3Pt. Contested by Larry Trent (5.3 feet, ZONE). RJ Wall misses. Offensive rebound by RJ Wall! RJ Wall kicks it out.

[04:07] Team_062 possession (Score: 91-87)
Paolo McCollum attempts a 3Pt. Heavily contested by Ja Dosunmu (0.5 feet, MAN)! Paolo McCollum misses. Rebound secured by Larry Trent.

[03:53] Team_001 possession (Score: 91-87)
FOUL! Holding foul on Paolo McCollum. [IN THE BONUS! 6 team fouls] Ja Dosunmu to the line for 2 free throws. (Paolo McCollum: 2 personal fouls)   FT 1/2: MISS   FT 2/2: GOOD Ja Dosunmu makes 1/2 from the line.
Score: 92-87

[03:36] Team_062 possession (Score: 92-87)
Devin Young drives to the basket... Devin Young throws a bad pass out of bounds! TURNOVER! (dead ball)

[03:22] Team_001 possession (Score: 92-87)
Ja Dosunmu attempts a Midrange. Wide open! Paolo McCollum is 7.3 feet away. [ZONE] Ja Dosunmu misses. Rebound secured by RJ Wall.

[03:07] Team_062 possession (Score: 92-87)
RJ Wall attempts a Midrange. Contested by Rudy George (4.9 feet, ZONE). RJ WALL MAKES IT! Assist: Tony LaVine
Score: 92-89

[02:52] Team_001 possession (Score: 92-89)
Larry Trent attempts a Layup. Wide open! Paul Poole is 6.8 feet away. [MAN] LARRY TRENT MAKES IT! Assist: Ja Dosunmu
Score: 94-89

[02:40] Team_062 possession (Score: 94-89)
Tony LaVine attempts a 3Pt. Contested by Rudy George (5.8 feet, MAN). TONY LAVINE MAKES IT!
Score: 94-92

[02:30] Team_001 possession (Score: 94-92)
Ja Dosunmu drives and kicks out. Larry Trent attempts a Midrange. Wide open! Paul Poole is 7.4 feet away. [MAN] Larry Trent misses. Rebound secured by RJ Wall.

[02:16] Team_062 possession (Score: 94-92)
RJ Wall attempts a Midrange. Contested by Larry Trent (5.9 feet, ZONE). RJ Wall misses. Rebound secured by Larry Trent.

[01:58] Team_001 possession (Score: 94-92)
Larry Trent attempts a Midrange. Wide open! Paul Poole is 7.7 feet away. [ZONE] LARRY TRENT MAKES IT! Assist: Kristaps Ming
Score: 96-92

[01:45] Team_062 possession (Score: 96-92)
Paolo McCollum attempts a Layup. Contested by Ja Dosunmu (3.0 feet, MAN). Paolo McCollum misses. Rebound secured by Kristaps Ming.

[01:30] Team_001 possession (Score: 96-92)
Kristaps Ming makes the Layup and draws the foul on RJ Wall! And-1! Kristaps Ming to the line for 1. [BONUS: 7 team fouls] (RJ Wall: 3 personal fouls)   FT 1/1: MISS Kristaps Ming makes 0/1 from the line. Rebound secured by Paul Poole.
Score: 98-92

[01:12] Team_062 possession (Score: 98-92)
Paul Poole drives and kicks out. Paul Poole attempts a 3Pt. Contested by Ja Dosunmu (2.9 feet, ZONE). Paul Poole misses. Offensive rebound by RJ Wall! RJ Wall kicks it out.

[00:56] Team_062 possession (Score: 98-92)
Paolo McCollum attempts a 3Pt. Contested by Ja Dosunmu (3.8 feet, ZONE). Paolo McCollum misses. Rebound secured by Rudy George.

[00:43] Team_001 possession (Score: 98-92)
Franz Bryant attempts a 3Pt. Contested by Paolo McCollum (4.8 feet, ZONE). Franz Bryant misses. Rebound secured by RJ Wall.

[00:26] Team_062 possession (Score: 98-92)
RJ Wall attempts a Layup. BLOCKED BY FRANZ BRYANT! Ball is loose! Offensive rebound by RJ Wall! RJ Wall kicks it out.

[00:11] Team_062 possession (Score: 98-92)
Paolo McCollum attempts a Layup. BLOCKED BY JA DOSUNMU! Ball is loose! Rebound secured by Kristaps Ming.

================================================================================
                              4TH QUARTER COMPLETE                              
================================================================================

4TH QUARTER SCORE: Team_001 24, Team_062 18

BOX SCORE:
================================================================================

Team_001
--------------------------------------------------------------------------------
Player                MIN  PTS  REB  AST  TO      FG   FG%      3P   3P%
--------------------------------------------------------------------------------
Larry Trent            11    7    6    0   0   3/3   100.0     0/0   0.0
Franz Bryant           11    5    0    0   0   2/5    40.0     0/0   0.0
Dirk Young             38    3    0    1   0   1/2    50.0     0/0   0.0
Klay Harden            35    3    0    0   0   1/2    50.0     0/0   0.0
Rudy George            11    3    4    0   0   1/2    50.0     0/0   0.0
Ja Dosunmu             14    1    0    2   0   1/4    25.0     0/0   0.0
Miles Griffin          35    0    0    1   0   0/0     0.0     0/0   0.0
Kristaps Ming          14    0    2    2   0   0/1     0.0     0/0   0.0

TEAM: FG: 9/19 (47.4%), 3PT: 2/5 (40.0%), REB: 12 (2 off, 10 def), AST: 6, TO: 1
TEAM FOULS: 1


Team_062
--------------------------------------------------------------------------------
Player                MIN  PTS  REB  AST  TO      FG   FG%      3P   3P%
--------------------------------------------------------------------------------
Chris Bird             38    6    0    1   0   2/2   100.0     0/0   0.0
RJ Wall                11    5    8    0   0   2/4    50.0     0/0   0.0
Tony LaVine            11    3    0    1   0   1/2    50.0     0/0   0.0
Jalen Reaves           35    2    0    1   0   1/1   100.0     0/0   0.0
RJ Williamson          38    2    0    0   0   1/1   100.0     0/0   0.0
Kawhi Thompson         38    0    3    0   0   0/0     0.0     0/0   0.0
Paul Poole             11    0    1    0   0   0/1     0.0     0/0   0.0
Devin Young            14    0    3    1   0   0/1     0.0     0/0   0.0
Paolo McCollum         11    0    0    0   0   0/5     0.0     0/0   0.0

TEAM: FG: 7/17 (41.2%), 3PT: 2/7 (28.6%), REB: 15 (5 off, 10 def), AST: 4, TO: 3
TEAM FOULS: 7 [Team_001 in BONUS]

================================================================================

================================================================================
                               FULL GAME COMPLETE                               
================================================================================

FINAL SCORE: Team_001 98, Team_062 92

SCORING BY QUARTER:
--------------------------------------------------------------------------------
Team                     Q1     Q2     Q3     Q4    FINAL
--------------------------------------------------------------------------------
Team_001                 26     27     21     24       98
Team_062                 34     15     25     18       92
--------------------------------------------------------------------------------

FULL GAME BOX SCORE:
================================================================================

Team_001
--------------------------------------------------------------------------------
Player                MIN  PTS  REB  AST  TO      FG   FG%      3P   3P%      FT STL BLK
--------------------------------------------------------------------------------
Dirk Young             38   28    0    3   0   9/16   56.2   4/8    50.0   4/6     0   0
Cole Ball              38    6   13    3   4   3/9    33.3   1/5    20.0   1/1     0   0
Dejounte McCollum      38   18   11    1   2   8/13   61.5   3/4    75.0   2/3     0   0
Klay Harden            35    7    0    4   4   4/7    57.1   1/1   100.0   2/2     1   0
Miles Griffin          35   19   12    5   3   9/13   69.2   0/1     0.0   0/0     3   0
Ja Dosunmu             14    1    0    2   1   0/3     0.0   0/0     0.0   1/2     0   1
Kristaps Ming          14    0    2    2   1   0/1     0.0   0/0     0.0   0/1     0   0
Rudy George            11    3    4    0   0   1/2    50.0   0/1     0.0   1/1     0   0
Larry Trent            11    7    7    0   0   3/3   100.0   1/1   100.0   0/0     0   0
Franz Bryant           11    5    0    0   0   2/6    33.3   0/2     0.0   1/1     1   1

TEAM: FG: 40/74 (54.1%), 3PT: 10/23 (43.5%), REB: 48 (11 off, 37 def), AST: 20, TO: 15


Team_062
--------------------------------------------------------------------------------
Player                MIN  PTS  REB  AST  TO      FG   FG%      3P   3P%      FT STL BLK
--------------------------------------------------------------------------------
Chris Bird             38   11    0    4   3   5/9    55.6   2/6    33.3   1/1     1   0
RJ Williamson          38   21    0    2   3   8/21   38.1   3/12   25.0   5/6     1   0
Michael Hyland         38   10    7    1   0   7/8    87.5   3/4    75.0   0/1     0   1
Kawhi Thompson         38   17   15    3   2   6/14   42.9   2/4    50.0   1/2     2   0
Jalen Reaves           35   20   10    5   1   6/8    75.0   0/0     0.0   2/2     3   0
Devin Young            14    0    5    2   0   0/1     0.0   0/0     0.0   0/0     0   0
Paolo McCollum         11    0    0    0   1   1/6    16.7   0/3     0.0   0/0     0   0
Tony LaVine            11    3    0    1   0   1/2    50.0   1/2    50.0   0/0     0   0
Paul Poole             11    2    1    0   3   1/2    50.0   0/0     0.0   0/0     0   0
RJ Wall                11    5    9    1   0   1/3    33.3   0/1     0.0   0/0     0   0

TEAM: FG: 36/74 (48.6%), 3PT: 11/32 (34.4%), REB: 48 (14 off, 34 def), AST: 19, TO: 13

================================================================================
