================================================================================
                        FULL GAME - Team_082 vs Team_015                        
================================================================================

================================================================================
                       1ST QUARTER - Team_082 vs Team_015                       
================================================================================

[12:00] Team_082 possession (Score: 0-0)
Julius Carter attempts a 3Pt. Contested by Manu Anthony (5.3 feet, ZONE). JULIUS CARTER MAKES IT! Assist: Julius Anthony
Score: 3-0

[11:45] Team_015 possession (Score: 3-0)
FOUL! Reach-in foul on Jrue Green during the drive. [Team fouls: 1] No free throws, side out. (Jrue Green: 1 personal fouls)

[11:28] Team_015 possession (Score: 3-0)
Michael Simmons attempts a Midrange. Contested by Dwyane O'Neal (4.6 feet, MAN). MICHAEL SIMMONS MAKES IT! Assist: Manu Anthony
Score: 3-2

[11:15] Team_082 possession (Score: 3-2)
Dwyane O'Neal attempts a 3Pt. Heavily contested by Manu Anthony (1.4 feet, ZONE)! Dwyane O'Neal misses. Rebound secured by Michael Simmons.

[11:04] Team_015 possession (Score: 3-2)
CJ Banchero attempts a Layup. Contested by Kristaps Fox (4.6 feet, MAN). CJ BANCHERO MAKES IT! Assist: Trae Turner
Score: 3-4

[10:50] Team_082 possession (Score: 3-4)
Jrue Green drives and kicks out. Dwyane O'Neal attempts a 3Pt. Contested by Manu Anthony (3.6 feet, ZONE). DWYANE O'NEAL MAKES IT! Assist: Julius Carter
Score: 6-4

[10:37] Team_015 possession (Score: 6-4)
FOUL! Holding foul on Dwyane O'Neal. [Team fouls: 2] No free throws, side out. (Dwyane O'Neal: 1 personal fouls)

[10:21] Team_015 possession (Score: 6-4)
Scottie Gasol drives, picks up Jrue Green. Help arrives from Dwyane O'Neal! Scottie Gasol attempts a Layup. Wide open! Dwyane O'Neal is 7.5 feet away. [MAN] Scottie Gasol misses. Rebound secured by Julius Carter.

[10:02] Team_082 possession (Score: 6-4)
Jrue Green drives to the basket... Jrue Green loses the ball! Stripped by Scottie Gasol! TURNOVER! (live ball)

[09:46] Team_015 possession (Score: 6-4)
CJ Banchero attempts a 3Pt. Contested by Dwyane O'Neal (4.7 feet, ZONE). CJ BANCHERO MAKES IT! Assist: Scottie Gasol
Score: 6-7

[09:33] Team_082 possession (Score: 6-7)
Dwyane O'Neal attempts a 3Pt. Contested by Michael Simmons (5.6 feet, MAN). Dwyane O'Neal misses. Offensive rebound by Jrue Green! Jrue Green kicks it out.

[09:17] Team_082 possession (Score: 6-7)
Julius Carter attempts a Midrange. Contested by Trae Turner (3.0 feet, MAN). JULIUS CARTER MAKES IT!
Score: 8-7

[09:03] Team_015 possession (Score: 8-7)
Trae Turner drives, picks up Julius Carter. Help arrives from Dwyane O'Neal! Trae Turner attempts a Layup. Wide open! Dwyane O'Neal is 6.6 feet away. [MAN] Trae Turner misses. Rebound secured by Dwyane O'Neal.

[08:43] Team_082 possession (Score: 8-7)
Kristaps Fox attempts a Midrange. Contested by CJ Banchero (3.4 feet, MAN). Kristaps Fox misses. Offensive rebound by Jrue Green! Jrue Green kicks it out.

[08:26] Team_082 possession (Score: 8-7)
Kristaps Fox throws a bad pass out of bounds! TURNOVER! (dead ball)

[08:13] Team_015 possession (Score: 8-7)
Scottie Gasol attempts a Midrange. Wide open! Jrue Green is 9.1 feet away. [MAN] Scottie Gasol misses. Rebound secured by Dwyane O'Neal.

[07:56] Team_082 possession (Score: 8-7)
FOUL! Shooting foul on Scottie Gasol. Julius Carter to the line for 2 free throws. [Team fouls: 1] (Scottie Gasol: 1 personal fouls)   FT 1/2: GOOD   FT 2/2: GOOD Julius Carter makes 2/2 from the line.
Score: 10-7

[07:41] Team_015 possession (Score: 10-7)
Trae Turner drives and kicks out. Michael Simmons attempts a Midrange. Contested by Kristaps Fox (4.9 feet, ZONE). Michael Simmons misses. Offensive rebound by Trae Turner! Trae Turner puts it back in!
Score: 10-9

[07:23] Team_082 possession (Score: 10-9)
Dwyane O'Neal attempts a Midrange. Contested by Trae Turner (3.6 feet, ZONE). DWYANE O'NEAL MAKES IT! Assist: Julius Carter
Score: 12-9

[07:07] Team_015 possession (Score: 12-9)
Scottie Gasol attempts a Midrange. Heavily contested by Jrue Green (0.7 feet, MAN)! Scottie Gasol misses. FOUL! Loose ball foul on Jrue Green during the rebound battle. [Team fouls: 3] No free throws, side out. (Jrue Green: 2 personal fouls)

[06:55] Team_015 possession (Score: 12-9)
Michael Simmons drives, Dwyane O'Neal stays with him. Michael Simmons attempts a Dunk. Heavily contested by Dwyane O'Neal (0.5 feet, MAN)! MICHAEL SIMMONS MAKES IT! Assist: Scottie Gasol
Score: 12-11

[06:41] Team_082 possession (Score: 12-11)
Dwyane O'Neal commits a violation (traveling/carry)! TURNOVER! (dead ball)

[06:26] Team_015 possession (Score: 12-11)
Scottie Gasol attempts a Midrange. Contested by Jrue Green (4.1 feet, MAN). SCOTTIE GASOL MAKES IT! Assist: Michael Simmons
Score: 12-13

[06:13] Team_082 possession (Score: 12-13)
Jrue Green attempts a Midrange. Contested by Michael Simmons (3.2 feet, ZONE). Jrue Green misses. Rebound secured by CJ Banchero.

[05:58] Team_015 possession (Score: 12-13)
Manu Anthony attempts a 3Pt. Contested by Julius Anthony (6.0 feet, MAN). Manu Anthony misses. Rebound secured by Julius Carter.

[05:45] Team_082 possession (Score: 12-13)
Kristaps Fox attempts a 3Pt. Contested by Scottie Gasol (4.9 feet, ZONE). Kristaps Fox misses. Rebound secured by Michael Simmons.

[05:31] Team_015 possession (Score: 12-13)
Michael Simmons attempts a 3Pt. Contested by Dwyane O'Neal (3.8 feet, MAN). Michael Simmons misses. Rebound secured by Jrue Green.

[05:18] Team_082 possession (Score: 12-13)
Julius Anthony attempts a 3Pt. Contested by Manu Anthony (2.9 feet, ZONE). Julius Anthony misses. FOUL! Loose ball foul on CJ Banchero during the rebound battle. [Team fouls: 2] No free throws, side out. (CJ Banchero: 1 personal fouls)

[05:05] Team_082 possession (Score: 12-13)
Kristaps Fox makes the Layup and draws the foul on Michael Simmons! And-1! Kristaps Fox to the line for 1. [Team fouls: 3] (Michael Simmons: 1 personal fouls)   FT 1/1: GOOD Kristaps Fox makes 1/1 from the line.
Score: 15-13

[04:50] Team_015 possession (Score: 15-13)
Manu Anthony attempts a Midrange. Contested by Kristaps Fox (3.6 feet, ZONE). Manu Anthony misses. Rebound secured by Jrue Green.

[04:32] Team_082 possession (Score: 15-13)
Dwyane O'Neal throws a bad pass out of bounds! TURNOVER! (dead ball)

[04:19] Team_015 possession (Score: 15-13)
Michael Simmons attempts a Layup. Wide open! Jrue Green is 7.0 feet away. [ZONE] MICHAEL SIMMONS MAKES IT!
Score: 15-15

[04:04] Team_082 possession (Score: 15-15)
Julius Carter attempts a Midrange. Wide open! CJ Banchero is 6.2 feet away. [ZONE] Julius Carter misses. Rebound secured by CJ Banchero.

[03:47] Team_015 possession (Score: 15-15)
Scottie Gasol attempts a Midrange. Contested by Kristaps Fox (2.3 feet, ZONE). Scottie Gasol misses. Rebound secured by Jrue Green.

[03:30] Team_082 possession (Score: 15-15)
FOUL! Offensive foul on Dwyane O'Neal! Michael Simmons drew the charge! [Team fouls: 4] (Dwyane O'Neal: 2 personal fouls) TURNOVER! (dead ball)

[03:18] Team_015 possession (Score: 15-15)
Michael Simmons attempts a 3Pt. Contested by Dwyane O'Neal (4.2 feet, MAN). Michael Simmons misses. Rebound secured by Jrue Green.

[03:06] Team_082 possession (Score: 15-15)
Kristaps Fox drives, picks up Scottie Gasol. Help arrives from Michael Simmons! Kristaps Fox attempts a Dunk. Contested by Michael Simmons (3.5 feet, ZONE). KRISTAPS FOX MAKES IT! Assist: Julius Anthony
Score: 17-15

[02:52] Team_015 possession (Score: 17-15)
Manu Anthony attempts a 3Pt. Contested by Julius Anthony (5.1 feet, MAN). Manu Anthony misses. Rebound secured by Julius Carter.

[02:35] Team_082 possession (Score: 17-15)
Kristaps Fox commits a violation (traveling/carry)! TURNOVER! (dead ball)

[02:35] Substitution (Team_082): Jrue Green OUT → Tony Jokic IN (stamina_rule2)

[02:35] Substitution (Team_015): Trae Turner OUT → Allen Curry IN (stamina_rule2)

[02:21] Team_015 possession (Score: 17-15)
Allen Curry throws a bad pass! Stolen by Julius Carter! TURNOVER! (live ball)

[02:01] Team_082 possession (Score: 17-15)
Kristaps Fox attempts a Midrange. Contested by CJ Banchero (4.9 feet, MAN). KRISTAPS FOX MAKES IT!
Score: 19-15

[01:45] Team_015 possession (Score: 19-15)
Manu Anthony attempts a 3Pt. Heavily contested by Dwyane O'Neal (1.4 feet, ZONE)! Manu Anthony misses. Rebound secured by Julius Carter.

[01:30] Team_082 possession (Score: 19-15)
Julius Carter attempts a 3Pt. Contested by Manu Anthony (5.1 feet, ZONE). Julius Carter misses. Offensive rebound by Tony Jokic! Tony Jokic kicks it out.

[01:15] Team_082 possession (Score: 19-15)
Julius Anthony attempts a 3Pt. Contested by Manu Anthony (2.6 feet, MAN). Julius Anthony misses. Rebound secured by CJ Banchero.

[01:02] Team_015 possession (Score: 19-15)
CJ Banchero attempts a 3Pt. Heavily contested by Dwyane O'Neal (0.5 feet, ZONE)! CJ Banchero misses. Rebound secured by Tony Jokic.

[00:51] Team_082 possession (Score: 19-15)
Kristaps Fox attempts a 3Pt. Contested by CJ Banchero (2.1 feet, MAN). KRISTAPS FOX MAKES IT! Assist: Dwyane O'Neal
Score: 22-15

[00:34] Team_015 possession (Score: 22-15)
Michael Simmons attempts a 3Pt. Contested by Dwyane O'Neal (3.4 feet, ZONE). MICHAEL SIMMONS MAKES IT! Assist: Manu Anthony
Score: 22-18

[00:16] Team_082 possession (Score: 22-18)
Kristaps Fox attempts a 3Pt. Contested by CJ Banchero (5.7 feet, MAN). KRISTAPS FOX MAKES IT! Assist: Dwyane O'Neal
Score: 25-18

================================================================================
                              1ST QUARTER COMPLETE                              
================================================================================

1ST QUARTER SCORE: Team_082 25, Team_015 18

BOX SCORE:
================================================================================

Team_082
--------------------------------------------------------------------------------
Player                MIN  PTS  REB  AST  TO      FG   FG%      3P   3P%
--------------------------------------------------------------------------------
Kristaps Fox           12   13    0    0   0   5/6    83.3     0/0   0.0
Julius Carter          12    7    5    2   0   3/4    75.0     0/0   0.0
Dwyane O'Neal          12    5    2    2   0   2/3    66.7     0/0   0.0
Julius Anthony         12    0    0    2   0   0/1     0.0     0/0   0.0
Jrue Green             10    0    6    0   0   0/1     0.0     0/0   0.0
Tony Jokic              2    0    2    0   0   0/0     0.0     0/0   0.0

TEAM: FG: 10/15 (66.7%), 3PT: 3/6 (50.0%), REB: 15 (4 off, 11 def), AST: 6, TO: 6
TEAM FOULS: 4


Team_015
--------------------------------------------------------------------------------
Player                MIN  PTS  REB  AST  TO      FG   FG%      3P   3P%
--------------------------------------------------------------------------------
Michael Simmons        12    9    2    1   0   4/6    66.7     0/0   0.0
CJ Banchero            12    5    3    0   0   2/3    66.7     0/0   0.0
Trae Turner            10    2    2    1   0   1/2    50.0     0/0   0.0
Scottie Gasol          12    2    0    2   0   1/4    25.0     0/0   0.0
Manu Anthony           12    0    0    2   0   0/4     0.0     0/0   0.0

TEAM: FG: 8/19 (42.1%), 3PT: 2/8 (25.0%), REB: 7 (2 off, 5 def), AST: 6, TO: 1
TEAM FOULS: 3

================================================================================

================================================================================
                       2ND QUARTER - Team_082 vs Team_015                       
================================================================================

[12:00] Team_082 possession (Score: 25-18)
Jrue Green drives and kicks out. Dwyane O'Neal attempts a Midrange. Contested by Michael Simmons (2.4 feet, ZONE). Dwyane O'Neal misses. Rebound secured by Trae Turner.

[11:41] Team_015 possession (Score: 25-18)
Manu Anthony attempts a 3Pt. Contested by Dwyane O'Neal (3.2 feet, ZONE). MANU ANTHONY MAKES IT! Assist: Michael Simmons
Score: 25-21

[11:28] Team_082 possession (Score: 25-21)
Kristaps Fox attempts a Midrange. Contested by CJ Banchero (3.6 feet, MAN). KRISTAPS FOX MAKES IT!
Score: 27-21

[11:12] Team_015 possession (Score: 27-21)
Manu Anthony attempts a 3Pt. Contested by Dwyane O'Neal (3.0 feet, ZONE). Manu Anthony misses. Offensive rebound by Trae Turner! Trae Turner puts it back in!
Score: 27-23

[10:57] Team_082 possession (Score: 27-23)
Kristaps Fox attempts a 3Pt. Wide open! CJ Banchero is 10.0 feet away. [MAN] Kristaps Fox misses. Rebound secured by Michael Simmons.

[10:46] Team_015 possession (Score: 27-23)
FOUL! Offensive foul on Michael Simmons! Dwyane O'Neal drew the charge! [Team fouls: 1] (Michael Simmons: 1 personal fouls) TURNOVER! (dead ball)

[10:32] Team_082 possession (Score: 27-23)
FOUL! Shooting foul on Scottie Gasol. Jrue Green to the line for 2 free throws. [Team fouls: 2] (Scottie Gasol: 1 personal fouls)   FT 1/2: GOOD   FT 2/2: GOOD Jrue Green makes 2/2 from the line.
Score: 29-23

[10:16] Team_015 possession (Score: 29-23)
Manu Anthony attempts a 3Pt. Contested by Dwyane O'Neal (5.4 feet, ZONE). Manu Anthony misses. Rebound secured by Dwyane O'Neal.

[10:02] Team_082 possession (Score: 29-23)
Julius Anthony attempts a Layup. Contested by Manu Anthony (3.5 feet, MAN). Julius Anthony misses. Rebound secured by Trae Turner.

[09:48] Team_015 possession (Score: 29-23)
Scottie Gasol attempts a Midrange. Contested by Jrue Green (4.0 feet, ZONE). Scottie Gasol misses. Offensive rebound by Trae Turner! Trae Turner kicks it out.

[09:37] Team_015 possession (Score: 29-23)
FOUL! Shooting foul on Jrue Green. Trae Turner to the line for 2 free throws. [Team fouls: 1] (Jrue Green: 1 personal fouls)   FT 1/2: GOOD   FT 2/2: MISS Trae Turner makes 1/2 from the line. Offensive rebound by CJ Banchero! CJ Banchero kicks it out.
Score: 29-24

[09:26] Team_015 possession (Score: 29-24)
Michael Simmons drives and kicks out. Michael Simmons attempts a Midrange. Contested by Dwyane O'Neal (3.8 feet, MAN). MICHAEL SIMMONS MAKES IT!
Score: 29-26

[09:11] Team_082 possession (Score: 29-26)
Julius Anthony makes the Layup and draws the foul on Manu Anthony! And-1! Julius Anthony to the line for 1. [Team fouls: 3] (Manu Anthony: 1 personal fouls)   FT 1/1: GOOD Julius Anthony makes 1/1 from the line.
Score: 32-26

[09:00] Team_015 possession (Score: 32-26)
Scottie Gasol drives, Julius Carter stays with him. Scottie Gasol attempts a Dunk. Wide open! Julius Carter is 7.6 feet away. [ZONE] SCOTTIE GASOL MAKES IT!
Score: 32-28

[08:49] Team_082 possession (Score: 32-28)
Kristaps Fox attempts a 3Pt. Wide open! CJ Banchero is 7.3 feet away. [MAN] Kristaps Fox misses. Rebound secured by Trae Turner.

[08:36] Team_015 possession (Score: 32-28)
Michael Simmons attempts a 3Pt. Contested by Julius Anthony (5.1 feet, ZONE). Michael Simmons misses. Rebound secured by Dwyane O'Neal.

[08:21] Team_082 possession (Score: 32-28)
Julius Carter attempts a 3Pt. Contested by Manu Anthony (4.3 feet, ZONE). Julius Carter misses. Rebound secured by CJ Banchero.

[08:04] Team_015 possession (Score: 32-28)
Manu Anthony attempts a Layup. Wide open! Julius Anthony is 6.3 feet away. [MAN] MANU ANTHONY MAKES IT! Assist: CJ Banchero
Score: 32-30

[07:55] Team_082 possession (Score: 32-30)
Julius Anthony drives and kicks out. Jrue Green attempts a 3Pt. Wide open! Scottie Gasol is 6.3 feet away. [MAN] JRUE GREEN MAKES IT! Assist: Kristaps Fox
Score: 35-30

[07:42] Team_015 possession (Score: 35-30)
Manu Anthony attempts a 3Pt. Contested by Dwyane O'Neal (3.4 feet, ZONE). Manu Anthony misses. Offensive rebound by CJ Banchero! CJ Banchero kicks it out.

[07:29] Team_015 possession (Score: 35-30)
Michael Simmons attempts a Midrange. Contested by Kristaps Fox (3.1 feet, ZONE). MICHAEL SIMMONS MAKES IT!
Score: 35-32

[07:14] Team_082 possession (Score: 35-32)
Kristaps Fox throws a bad pass out of bounds! TURNOVER! (dead ball)

[07:14] Substitution (Team_082): Julius Anthony OUT → Jordan Rozier IN (stamina_rule2)

[07:14] Substitution (Team_082): Dwyane O'Neal OUT → Kawhi Poole IN (stamina_rule2)

[07:14] Substitution (Team_082): Kristaps Fox OUT → Shaquille Griffin IN (stamina_rule2)

[07:14] Substitution (Team_082): Jrue Green OUT → Tony Jokic IN (stamina_rule2)

[07:14] Substitution (Team_082): Julius Carter OUT → D'Angelo Parker IN (stamina_rule2)

[07:14] Substitution (Team_015): Manu Anthony OUT → Dwyane Sabonis IN (stamina_rule2)

[07:14] Substitution (Team_015): Michael Simmons OUT → Paolo Jokic IN (stamina_rule2)

[07:14] Substitution (Team_015): CJ Banchero OUT → Magic Wagner IN (stamina_rule2)

[07:14] Substitution (Team_015): Scottie Gasol OUT → Rudy Paul IN (stamina_rule2)

[07:14] Substitution (Team_015): Trae Turner OUT → Allen Curry IN (stamina_rule2)

[06:57] Team_015 possession (Score: 35-32)
Magic Wagner attempts a 3Pt. Contested by Kawhi Poole (4.5 feet, ZONE). MAGIC WAGNER MAKES IT!
Score: 35-35

[06:44] Team_082 possession (Score: 35-35)
Jordan Rozier attempts a Layup. Wide open! Dwyane Sabonis is 6.4 feet away. [MAN] JORDAN ROZIER MAKES IT! Assist: Tony Jokic
Score: 37-35

[06:28] Team_015 possession (Score: 37-35)
Allen Curry makes the Dunk and draws the foul on Kawhi Poole! And-1! Allen Curry to the line for 1. [Team fouls: 2] (Kawhi Poole: 1 personal fouls)   FT 1/1: GOOD Allen Curry makes 1/1 from the line.
Score: 37-38

[06:11] Team_082 possession (Score: 37-38)
Tony Jokic drives and kicks out. Kawhi Poole attempts a 3Pt. Wide open! Paolo Jokic is 6.0 feet away. [MAN] Kawhi Poole misses. Rebound secured by Allen Curry.

[05:57] Team_015 possession (Score: 37-38)
FOUL! Reach-in foul on D'Angelo Parker during the drive. [Team fouls: 3] No free throws, side out. (D'Angelo Parker: 1 personal fouls)

[05:46] Team_015 possession (Score: 37-38)
Allen Curry attempts a Midrange. Wide open! Kawhi Poole is 7.2 feet away. [ZONE] ALLEN CURRY MAKES IT! Assist: Magic Wagner
Score: 37-40

[05:31] Team_082 possession (Score: 37-40)
D'Angelo Parker attempts a 3Pt. Contested by Rudy Paul (2.8 feet, ZONE). D'Angelo Parker misses. Rebound secured by Rudy Paul.

[05:20] Team_015 possession (Score: 37-40)
Dwyane Sabonis attempts a 3Pt. Wide open! Kawhi Poole is 6.9 feet away. [ZONE] Dwyane Sabonis misses. Rebound secured by Shaquille Griffin.

[05:04] Team_082 possession (Score: 37-40)
Shaquille Griffin attempts a 3Pt. Contested by Rudy Paul (4.5 feet, ZONE). Shaquille Griffin misses. Rebound secured by Allen Curry.

[04:52] Team_015 possession (Score: 37-40)
FOUL! Reach-in foul on Kawhi Poole during the drive. [Team fouls: 4] No free throws, side out. (Kawhi Poole: 2 personal fouls)

[04:40] Team_015 possession (Score: 37-40)
Allen Curry attempts a Layup. Contested by D'Angelo Parker (3.2 feet, MAN). ALLEN CURRY MAKES IT! Assist: Paolo Jokic
Score: 37-42

[04:27] Team_082 possession (Score: 37-42)
Jordan Rozier commits a violation (traveling/carry)! TURNOVER! (dead ball)

[04:13] Team_015 possession (Score: 37-42)
Dwyane Sabonis attempts a 3Pt. Wide open! Jordan Rozier is 8.9 feet away. [MAN] DWYANE SABONIS MAKES IT! Assist: Paolo Jokic
Score: 37-45

[04:00] Team_082 possession (Score: 37-45)
Shaquille Griffin drives, picks up Magic Wagner. Help arrives from Dwyane Sabonis! Shaquille Griffin attempts a Layup. Wide open! Dwyane Sabonis is 9.0 feet away. [MAN] SHAQUILLE GRIFFIN MAKES IT!
Score: 39-45

[03:45] Team_015 possession (Score: 39-45)
Dwyane Sabonis drives, picks up Jordan Rozier. Help arrives from Shaquille Griffin! Dwyane Sabonis attempts a Layup. Wide open! Shaquille Griffin is 8.0 feet away. [MAN] Dwyane Sabonis misses. FOUL! Loose ball foul on Tony Jokic during the rebound battle. [IN THE BONUS! 5 team fouls] Allen Curry to the line for 2 free throws. (Tony Jokic: 1 personal fouls)   FT 1/2: MISS   FT 2/2: MISS Allen Curry makes 0/2 from the line. Rebound secured by Tony Jokic.

[03:29] Team_082 possession (Score: 39-45)
Kawhi Poole attempts a 3Pt. Contested by Rudy Paul (4.3 feet, ZONE). KAWHI POOLE MAKES IT! Assist: D'Angelo Parker
Score: 42-45

[03:19] Team_015 possession (Score: 42-45)
Magic Wagner drives, picks up D'Angelo Parker. Help arrives from Kawhi Poole! Magic Wagner attempts a Dunk. Wide open! Kawhi Poole is 6.1 feet away. [ZONE] MAGIC WAGNER MAKES IT! Assist: Paolo Jokic
Score: 42-47

[03:08] Team_082 possession (Score: 42-47)
Shaquille Griffin attempts a Midrange. Wide open! Magic Wagner is 8.0 feet away. [ZONE] Shaquille Griffin misses. Offensive rebound by Shaquille Griffin! Shaquille Griffin kicks it out.

[02:56] Team_082 possession (Score: 42-47)
Kawhi Poole drives, Paolo Jokic stays with him. Kawhi Poole attempts a Layup. Contested by Paolo Jokic (3.2 feet, MAN). KAWHI POOLE MAKES IT! Assist: Jordan Rozier
Score: 44-47

[02:37] Team_015 possession (Score: 44-47)
Rudy Paul drives to the basket... Rudy Paul throws a bad pass! Stolen by D'Angelo Parker! TURNOVER! (live ball)

[02:25] Team_082 possession (Score: 44-47)
Tony Jokic drives and kicks out. Tony Jokic attempts a 3Pt. Contested by Rudy Paul (2.7 feet, MAN). Tony Jokic misses. Rebound secured by Allen Curry.

[02:11] Team_015 possession (Score: 44-47)
Rudy Paul attempts a Midrange. Contested by Shaquille Griffin (5.5 feet, ZONE). Rudy Paul misses. Rebound secured by D'Angelo Parker.

[02:00] Team_082 possession (Score: 44-47)
Kawhi Poole drives and kicks out. Jordan Rozier attempts a 3Pt. Contested by Rudy Paul (2.1 feet, ZONE). Jordan Rozier misses. Rebound secured by Magic Wagner.

[01:44] Team_015 possession (Score: 44-47)
FOUL! Offensive foul on Paolo Jokic! Kawhi Poole drew the charge! [Team fouls: 4] (Paolo Jokic: 1 personal fouls) TURNOVER! (dead ball)

[01:29] Team_082 possession (Score: 44-47)
Shaquille Griffin drives, picks up Rudy Paul. Help arrives from Dwyane Sabonis! Shaquille Griffin attempts a Layup. Contested by Dwyane Sabonis (3.2 feet, ZONE). Shaquille Griffin misses. Rebound secured by Rudy Paul.

[01:15] Team_015 possession (Score: 44-47)
Rudy Paul attempts a 3Pt. Wide open! Kawhi Poole is 7.6 feet away. [ZONE] RUDY PAUL MAKES IT!
Score: 44-50

[01:01] Team_082 possession (Score: 44-50)
Kawhi Poole drives to the basket... Kawhi Poole loses the ball! Stripped by Rudy Paul! TURNOVER! (live ball)

[00:50] Team_015 possession (Score: 44-50)
Dwyane Sabonis throws a bad pass! Stolen by Jordan Rozier! TURNOVER! (live ball)

[00:37] Team_082 possession (Score: 44-50)
Tony Jokic attempts a 3Pt. Heavily contested by Rudy Paul (0.5 feet, ZONE)! Tony Jokic misses. FOUL! Loose ball foul on Rudy Paul during the rebound battle. [IN THE BONUS! 5 team fouls] Tony Jokic to the line for 2 free throws. (Rudy Paul: 1 personal fouls)   FT 1/2: MISS   FT 2/2: GOOD Tony Jokic makes 1/2 from the line.
Score: 45-50

[00:19] Team_015 possession (Score: 45-50)
Allen Curry drives, D'Angelo Parker stays with him. Allen Curry attempts a Layup. Wide open! D'Angelo Parker is 9.4 feet away. [MAN] ALLEN CURRY MAKES IT! Assist: Paolo Jokic
Score: 45-52

[00:06] Team_082 possession (Score: 45-52)
Tony Jokic drives and kicks out. Tony Jokic attempts a Midrange. Contested by Rudy Paul (2.7 feet, MAN). Tony Jokic misses. Offensive rebound by Tony Jokic! Tony Jokic kicks it out.

================================================================================
                              2ND QUARTER COMPLETE                              
================================================================================

2ND QUARTER SCORE: Team_082 20, Team_015 34

BOX SCORE:
================================================================================

Team_082
--------------------------------------------------------------------------------
Player                MIN  PTS  REB  AST  TO      FG   FG%      3P   3P%
--------------------------------------------------------------------------------
Jrue Green             15    5    0    0   0   2/3    66.7     0/0   0.0
Kawhi Poole             7    5    0    0   0   2/3    66.7     0/0   0.0
Julius Anthony         17    3    0    0   0   1/2    50.0     0/0   0.0
Kristaps Fox           17    2    0    1   0   1/3    33.3     0/0   0.0
Jordan Rozier           7    2    0    1   0   1/1   100.0     0/0   0.0
Shaquille Griffin       7    2    2    0   0   1/3    33.3     0/0   0.0
Tony Jokic              9    1    2    1   0   1/3    33.3     0/0   0.0
Dwyane O'Neal          17    0    2    0   0   0/0     0.0     0/0   0.0
Julius Carter          17    0    0    0   0   0/1     0.0     0/0   0.0
D'Angelo Parker         7    0    1    1   0   0/1     0.0     0/0   0.0

TEAM: FG: 9/20 (45.0%), 3PT: 2/7 (28.6%), REB: 6 (2 off, 4 def), AST: 4, TO: 3
TEAM FOULS: 5 [Team_015 in BONUS]


Team_015
--------------------------------------------------------------------------------
Player                MIN  PTS  REB  AST  TO      FG   FG%      3P   3P%
--------------------------------------------------------------------------------
Allen Curry             9    9    3    0   0   4/4   100.0     0/0   0.0
Manu Anthony           17    5    0    0   0   2/3    66.7     0/0   0.0
Magic Wagner            7    5    1    1   0   2/2   100.0     0/0   0.0
Michael Simmons        17    4    1    1   0   2/3    66.7     0/0   0.0
Rudy Paul               7    3    2    0   0   1/2    50.0     0/0   0.0
Dwyane Sabonis          7    3    0    0   0   1/3    33.3     0/0   0.0
Trae Turner            15    2    5    0   0   1/1   100.0     0/0   0.0
Scottie Gasol          17    2    0    0   0   1/1   100.0     0/0   0.0
CJ Banchero            17    0    3    1   0   0/0     0.0     0/0   0.0
Paolo Jokic             7    0    0    4   0   0/0     0.0     0/0   0.0

TEAM: FG: 14/19 (73.7%), 3PT: 5/8 (62.5%), REB: 16 (5 off, 11 def), AST: 7, TO: 4
TEAM FOULS: 5 [Team_082 in BONUS]

================================================================================

================================================================================
                       3RD QUARTER - Team_082 vs Team_015                       
================================================================================

[12:00] Team_082 possession (Score: 45-52)
Jrue Green drives to the basket... Jrue Green loses the ball! Stripped by Scottie Gasol! TURNOVER! (live ball)

[11:44] Team_015 possession (Score: 45-52)
Trae Turner attempts a Midrange. Contested by Julius Carter (3.4 feet, MAN). Trae Turner misses. Rebound secured by Julius Carter.

[11:26] Team_082 possession (Score: 45-52)
Dwyane O'Neal attempts a 3Pt. Contested by Manu Anthony (4.0 feet, ZONE). Dwyane O'Neal misses. Rebound secured by Trae Turner.

[11:11] Team_015 possession (Score: 45-52)
Michael Simmons commits a violation (traveling/carry)! TURNOVER! (dead ball)

[10:59] Team_082 possession (Score: 45-52)
Julius Anthony drives to the basket... Julius Anthony loses control! Ball rolls out of bounds! TURNOVER! (dead ball)

[10:46] Team_015 possession (Score: 45-52)
Scottie Gasol attempts a Layup. Wide open! Jrue Green is 6.1 feet away. [MAN] Scottie Gasol misses. Rebound secured by Dwyane O'Neal.

[10:28] Team_082 possession (Score: 45-52)
Dwyane O'Neal drives to the basket... Dwyane O'Neal loses the ball! Stripped by Scottie Gasol! TURNOVER! (live ball)

[10:16] Team_015 possession (Score: 45-52)
CJ Banchero attempts a Layup. Wide open! Jrue Green is 7.4 feet away. [ZONE] CJ BANCHERO MAKES IT! Assist: Manu Anthony
Score: 45-54

[10:03] Team_082 possession (Score: 45-54)
Dwyane O'Neal drives, picks up Scottie Gasol. Help arrives from Michael Simmons! Dwyane O'Neal attempts a Dunk. Heavily contested by Michael Simmons (0.5 feet, ZONE)! DWYANE O'NEAL MAKES IT!
Score: 47-54

[09:50] Team_015 possession (Score: 47-54)
Manu Anthony attempts a 3Pt. Contested by Julius Anthony (4.7 feet, MAN). Manu Anthony misses. Rebound secured by Julius Carter.

[09:34] Team_082 possession (Score: 47-54)
Julius Carter drives, Trae Turner stays with him. Julius Carter attempts a Dunk. Heavily contested by Trae Turner (1.4 feet, MAN)! Julius Carter misses. Rebound secured by CJ Banchero.

[09:20] Team_015 possession (Score: 47-54)
Trae Turner drives to the basket... Trae Turner throws a bad pass! Stolen by Jrue Green! TURNOVER! (live ball)

[09:06] Team_082 possession (Score: 47-54)
Julius Carter attempts a Layup. Contested by Trae Turner (4.5 feet, MAN). Julius Carter misses. Rebound secured by CJ Banchero.

[08:51] Team_015 possession (Score: 47-54)
FOUL! Holding foul on Jrue Green. [Team fouls: 1] No free throws, side out. (Jrue Green: 1 personal fouls)

[08:41] Team_015 possession (Score: 47-54)
Michael Simmons attempts a 3Pt. Contested by Dwyane O'Neal (2.6 feet, MAN). Michael Simmons misses. Rebound secured by Jrue Green.

[08:31] Team_082 possession (Score: 47-54)
Dwyane O'Neal attempts a 3Pt. Wide open! Michael Simmons is 7.8 feet away. [MAN] DWYANE O'NEAL MAKES IT! Assist: Julius Carter
Score: 50-54

[08:15] Team_015 possession (Score: 50-54)
Manu Anthony drives to the basket... Manu Anthony commits a violation (traveling/carry)! TURNOVER! (dead ball)

[08:00] Team_082 possession (Score: 50-54)
Jrue Green attempts a Midrange. Contested by Michael Simmons (5.2 feet, ZONE). JRUE GREEN MAKES IT!
Score: 52-54

[07:48] Team_015 possession (Score: 52-54)
Michael Simmons attempts a 3Pt. Contested by Dwyane O'Neal (5.1 feet, ZONE). Michael Simmons misses. Rebound secured by Dwyane O'Neal.

[07:32] Team_082 possession (Score: 52-54)
Julius Anthony drives to the basket... Julius Anthony loses the ball! Stripped by Scottie Gasol! TURNOVER! (live ball)

[07:19] Team_015 possession (Score: 52-54)
Michael Simmons attempts a Layup. Wide open! Jrue Green is 6.1 feet away. [ZONE] MICHAEL SIMMONS MAKES IT! Assist: Trae Turner
Score: 52-56

[07:03] Team_082 possession (Score: 52-56)
Julius Anthony attempts a 3Pt. Heavily contested by Manu Anthony (1.1 feet, MAN)! Julius Anthony misses. Rebound secured by CJ Banchero.

[06:51] Team_015 possession (Score: 52-56)
CJ Banchero attempts a Layup. Wide open! Jrue Green is 8.5 feet away. [ZONE] CJ BANCHERO MAKES IT!
Score: 52-58

[06:38] Team_082 possession (Score: 52-58)
FOUL! Reach-in foul on Scottie Gasol during the drive. [Team fouls: 1] No free throws, side out. (Scottie Gasol: 1 personal fouls)

[06:23] Team_082 possession (Score: 52-58)
FOUL! Offensive foul on Julius Anthony! Manu Anthony drew the charge! [Team fouls: 2] (Julius Anthony: 1 personal fouls) TURNOVER! (dead ball)

[06:07] Team_015 possession (Score: 52-58)
Manu Anthony attempts a Midrange. Contested by Julius Anthony (5.4 feet, MAN). Manu Anthony misses. Rebound secured by Julius Carter.

[05:57] Team_082 possession (Score: 52-58)
Julius Anthony drives to the basket... FOUL! Offensive foul on Julius Anthony! Scottie Gasol drew the charge! [Team fouls: 3] (Julius Anthony: 2 personal fouls) TURNOVER! (dead ball)

[05:39] Team_015 possession (Score: 52-58)
Trae Turner drives to the basket... Trae Turner throws a bad pass! Stolen by Julius Carter! TURNOVER! (live ball)

[05:22] Team_082 possession (Score: 52-58)
Julius Carter drives and kicks out. Jrue Green attempts a Midrange. Wide open! Scottie Gasol is 6.2 feet away. [MAN] JRUE GREEN MAKES IT!
Score: 54-58

[05:07] Team_015 possession (Score: 54-58)
CJ Banchero attempts a 3Pt. Contested by Kristaps Fox (5.6 feet, MAN). CJ BANCHERO MAKES IT! Assist: Trae Turner
Score: 54-61

[04:54] Team_082 possession (Score: 54-61)
Julius Anthony attempts a 3Pt. Wide open! Manu Anthony is 7.8 feet away. [ZONE] Julius Anthony misses. Offensive rebound by Julius Carter! Julius Carter kicks it out.

[04:43] Team_082 possession (Score: 54-61)
Julius Anthony attempts a Midrange. Wide open! Manu Anthony is 6.5 feet away. [MAN] Julius Anthony misses. Rebound secured by Trae Turner.

[04:30] Team_015 possession (Score: 54-61)
Manu Anthony attempts a 3Pt. Heavily contested by Dwyane O'Neal (1.8 feet, ZONE)! Manu Anthony misses. Rebound secured by Julius Carter.

[04:13] Team_082 possession (Score: 54-61)
Kristaps Fox attempts a 3Pt. Contested by CJ Banchero (2.6 feet, MAN). Kristaps Fox misses. Rebound secured by Michael Simmons.

[03:59] Team_015 possession (Score: 54-61)
CJ Banchero drives and kicks out. Trae Turner attempts a Midrange. Wide open! Julius Carter is 6.6 feet away. [MAN] Trae Turner misses. Rebound secured by Dwyane O'Neal.

[03:45] Team_082 possession (Score: 54-61)
Jrue Green attempts a Midrange. Contested by Scottie Gasol (5.8 feet, MAN). Jrue Green misses. Rebound secured by Michael Simmons.

[03:31] Team_015 possession (Score: 54-61)
CJ Banchero attempts a Midrange. Contested by Kristaps Fox (2.8 feet, MAN). CJ Banchero misses. Rebound secured by Julius Carter.

[03:18] Team_082 possession (Score: 54-61)
Dwyane O'Neal makes the Dunk and draws the foul on Michael Simmons! And-1! Dwyane O'Neal to the line for 1. [Team fouls: 2] (Michael Simmons: 1 personal fouls)   FT 1/1: MISS Dwyane O'Neal makes 0/1 from the line. Rebound secured by CJ Banchero.
Score: 56-61

[02:59] Team_015 possession (Score: 56-61)
Manu Anthony attempts a Midrange. Wide open! Jrue Green is 6.3 feet away. [ZONE] MANU ANTHONY MAKES IT!
Score: 56-63

[02:43] Team_082 possession (Score: 56-63)
Julius Anthony drives, picks up Manu Anthony. Help arrives from Michael Simmons! Julius Anthony attempts a Layup. Heavily contested by Michael Simmons (0.5 feet, MAN)! JULIUS ANTHONY MAKES IT!
Score: 58-63

[02:25] Team_015 possession (Score: 58-63)
Michael Simmons attempts a 3Pt. Contested by Dwyane O'Neal (3.9 feet, MAN). Michael Simmons misses. Rebound secured by Jrue Green.

[02:13] Team_082 possession (Score: 58-63)
Julius Anthony attempts a 3Pt. Heavily contested by Manu Anthony (1.7 feet, MAN)! Julius Anthony misses. Offensive rebound by Jrue Green! Jrue Green kicks it out.

[01:58] Team_082 possession (Score: 58-63)
FOUL! Shooting foul on Manu Anthony. Julius Anthony to the line for 3 free throws. [Team fouls: 3] (Manu Anthony: 1 personal fouls)   FT 1/3: GOOD   FT 2/3: GOOD   FT 3/3: GOOD Julius Anthony makes 3/3 from the line.
Score: 61-63

[01:45] Team_015 possession (Score: 61-63)
Trae Turner drives and kicks out. Manu Anthony attempts a 3Pt. Heavily contested by Dwyane O'Neal (1.3 feet, ZONE)! Manu Anthony misses. Rebound secured by Julius Carter.

[01:27] Team_082 possession (Score: 61-63)
Kristaps Fox attempts a 3Pt. Contested by CJ Banchero (4.2 feet, MAN). KRISTAPS FOX MAKES IT! Assist: Julius Carter
Score: 64-63

[01:13] Team_015 possession (Score: 64-63)
Scottie Gasol drives and kicks out. Trae Turner attempts a 3Pt. Contested by Julius Carter (3.6 feet, MAN). TRAE TURNER MAKES IT! Assist: Scottie Gasol
Score: 64-66

[00:56] Team_082 possession (Score: 64-66)
Dwyane O'Neal attempts a 3Pt. Contested by Manu Anthony (4.3 feet, ZONE). Dwyane O'Neal misses. Rebound secured by Michael Simmons.

[00:46] Team_015 possession (Score: 64-66)
Trae Turner drives, Julius Carter stays with him. Trae Turner attempts a Dunk. Wide open! Julius Carter is 8.6 feet away. [ZONE] TRAE TURNER MAKES IT! Assist: Scottie Gasol
Score: 64-68

[00:33] Team_082 possession (Score: 64-68)
FOUL! Holding foul on Scottie Gasol. [Team fouls: 4] No free throws, side out. (Scottie Gasol: 2 personal fouls)

[00:19] Team_082 possession (Score: 64-68)
FOUL! Reach-in foul on Scottie Gasol during the drive. [IN THE BONUS! 5 team fouls] Julius Carter to the line for 2 free throws. (Scottie Gasol: 3 personal fouls)   FT 1/2: GOOD   FT 2/2: GOOD Julius Carter makes 2/2 from the line.
Score: 66-68

[00:02] Team_015 possession (Score: 66-68)
Manu Anthony attempts a Midrange. Wide open! Julius Anthony is 8.0 feet away. [MAN] Manu Anthony misses. Rebound secured by Jrue Green.

================================================================================
                              3RD QUARTER COMPLETE                              
================================================================================

3RD QUARTER SCORE: Team_082 21, Team_015 16

BOX SCORE:
================================================================================

Team_082
--------------------------------------------------------------------------------
Player                MIN  PTS  REB  AST  TO      FG   FG%      3P   3P%
--------------------------------------------------------------------------------
Dwyane O'Neal          29    5    3    0   0   2/5    40.0     0/0   0.0
Julius Anthony         29    5    0    0   0   2/4    50.0     0/0   0.0
Jrue Green             27    4    4    0   0   2/3    66.7     0/0   0.0
Kristaps Fox           29    3    0    0   0   1/2    50.0     0/0   0.0
Julius Carter          29    2    7    2   0   1/3    33.3     0/0   0.0

TEAM: FG: 8/17 (47.1%), 3PT: 3/7 (42.9%), REB: 14 (2 off, 12 def), AST: 2, TO: 6
TEAM FOULS: 3


Team_015
--------------------------------------------------------------------------------
Player                MIN  PTS  REB  AST  TO      FG   FG%      3P   3P%
--------------------------------------------------------------------------------
CJ Banchero            29    7    4    0   0   3/5    60.0     0/0   0.0
Trae Turner            27    5    2    2   0   2/4    50.0     0/0   0.0
Manu Anthony           29    2    0    1   0   1/5    20.0     0/0   0.0
Michael Simmons        29    2    3    0   0   1/4    25.0     0/0   0.0
Scottie Gasol          29    0    0    2   0   0/1     0.0     0/0   0.0

TEAM: FG: 7/19 (36.8%), 3PT: 1/6 (16.7%), REB: 9 (0 off, 9 def), AST: 5, TO: 4
TEAM FOULS: 5 [Team_082 in BONUS]

================================================================================

================================================================================
                       4TH QUARTER - Team_082 vs Team_015                       
================================================================================

[12:00] Team_082 possession (Score: 66-68)
Dwyane O'Neal attempts a 3Pt. Contested by Manu Anthony (4.1 feet, ZONE). Dwyane O'Neal misses. Rebound secured by Trae Turner.

[11:44] Team_015 possession (Score: 66-68)
Manu Anthony attempts a Midrange. Contested by Jrue Green (5.9 feet, ZONE). Manu Anthony misses. Rebound secured by Dwyane O'Neal.

[11:34] Team_082 possession (Score: 66-68)
Kristaps Fox drives, Scottie Gasol stays with him. Kristaps Fox attempts a Dunk. Contested by Scottie Gasol (3.8 feet, ZONE). KRISTAPS FOX MAKES IT! Assist: Julius Carter
Score: 68-68

[11:19] Team_015 possession (Score: 68-68)
FOUL! Shooting foul on Jrue Green. Scottie Gasol to the line for 2 free throws. [Team fouls: 1] (Jrue Green: 1 personal fouls)   FT 1/2: GOOD   FT 2/2: MISS Scottie Gasol makes 1/2 from the line. Rebound secured by Dwyane O'Neal.
Score: 68-69

[11:02] Team_082 possession (Score: 68-69)
Kristaps Fox attempts a 3Pt. Contested by Manu Anthony (3.6 feet, ZONE). KRISTAPS FOX MAKES IT! Assist: Julius Anthony
Score: 71-69

[10:46] Team_015 possession (Score: 71-69)
FOUL! Offensive foul on Trae Turner! Julius Carter drew the charge! [Team fouls: 1] (Trae Turner: 1 personal fouls) TURNOVER! (dead ball)

[10:36] Team_082 possession (Score: 71-69)
FOUL! Shooting foul on Scottie Gasol. Julius Anthony to the line for 2 free throws. [Team fouls: 2] (Scottie Gasol: 1 personal fouls)   FT 1/2: GOOD   FT 2/2: GOOD Julius Anthony makes 2/2 from the line.
Score: 73-69

[10:19] Team_015 possession (Score: 73-69)
Michael Simmons attempts a 3Pt. Contested by Dwyane O'Neal (2.7 feet, MAN). MICHAEL SIMMONS MAKES IT!
Score: 73-72

[09:59] Team_082 possession (Score: 73-72)
Julius Carter attempts a 3Pt. Contested by Trae Turner (2.0 feet, MAN). Julius Carter misses. Rebound secured by Trae Turner.

[09:45] Team_015 possession (Score: 73-72)
Trae Turner throws a bad pass! Stolen by Julius Carter! TURNOVER! (live ball)

[09:27] Team_082 possession (Score: 73-72)
Dwyane O'Neal drives, picks up Michael Simmons. Help arrives from CJ Banchero! Dwyane O'Neal attempts a Dunk. Contested by CJ Banchero (3.3 feet, MAN). DWYANE O'NEAL MAKES IT! Assist: Kristaps Fox
Score: 75-72

[09:14] Team_015 possession (Score: 75-72)
CJ Banchero attempts a 3Pt. Heavily contested by Dwyane O'Neal (1.7 feet, ZONE)! CJ Banchero misses. Rebound secured by Julius Carter.

[08:57] Team_082 possession (Score: 75-72)
Jrue Green attempts a 3Pt. Wide open! Manu Anthony is 7.1 feet away. [ZONE] Jrue Green misses. Rebound secured by Trae Turner.

[08:46] Team_015 possession (Score: 75-72)
Scottie Gasol attempts a Layup. Wide open! Jrue Green is 8.0 feet away. [MAN] Scottie Gasol misses. Rebound secured by Dwyane O'Neal.

[08:33] Team_082 possession (Score: 75-72)
Dwyane O'Neal attempts a 3Pt. Contested by Manu Anthony (5.6 feet, ZONE). DWYANE O'NEAL MAKES IT! Assist: Julius Anthony
Score: 78-72

[08:18] Team_015 possession (Score: 78-72)
Michael Simmons attempts a 3Pt. Contested by Dwyane O'Neal (5.8 feet, ZONE). Michael Simmons misses. Rebound secured by Jrue Green.

[08:00] Team_082 possession (Score: 78-72)
Julius Carter attempts a Layup. Contested by Scottie Gasol (3.1 feet, ZONE). Julius Carter misses. Offensive rebound by Jrue Green! Jrue Green kicks it out.

[07:44] Team_082 possession (Score: 78-72)
FOUL! Shooting foul on Trae Turner. Julius Carter to the line for 2 free throws. [Team fouls: 3] (Trae Turner: 2 personal fouls)   FT 1/2: MISS   FT 2/2: MISS Julius Carter makes 0/2 from the line. FOUL! Loose ball foul on Michael Simmons during the free throw rebound! [Team fouls: 4] No free throws, side out. (Michael Simmons: 1 personal fouls)

[07:33] Team_082 possession (Score: 78-72)
Julius Carter attempts a Midrange. Wide open! CJ Banchero is 6.6 feet away. [ZONE] Julius Carter misses. Offensive rebound by Jrue Green! Jrue Green kicks it out.

[07:19] Team_082 possession (Score: 78-72)
Jrue Green attempts a Layup. Wide open! Scottie Gasol is 7.0 feet away. [ZONE] Jrue Green misses. Rebound secured by Scottie Gasol.

[07:07] Team_015 possession (Score: 78-72)
Trae Turner attempts a 3Pt. Wide open! Julius Carter is 10.0 feet away. [MAN] Trae Turner misses. Rebound secured by Dwyane O'Neal.

[06:54] Team_082 possession (Score: 78-72)
Jrue Green drives, picks up Scottie Gasol. Help arrives from Michael Simmons! Jrue Green attempts a Dunk. Contested by Michael Simmons (4.6 feet, ZONE). Jrue Green misses. Rebound secured by CJ Banchero.

[06:40] Team_015 possession (Score: 78-72)
Trae Turner attempts a Midrange. Wide open! Julius Carter is 8.0 feet away. [MAN] TRAE TURNER MAKES IT! Assist: Scottie Gasol
Score: 78-74

[06:25] Team_082 possession (Score: 78-74)
Julius Anthony makes the Dunk and draws the foul on Scottie Gasol! And-1! Julius Anthony to the line for 1. [BONUS: 5 team fouls] (Scottie Gasol: 2 personal fouls)   FT 1/1: GOOD Julius Anthony makes 1/1 from the line.
Score: 81-74

[06:10] Team_015 possession (Score: 81-74)
Scottie Gasol drives, picks up Jrue Green. Help arrives from Dwyane O'Neal! Scottie Gasol attempts a Layup. Contested by Dwyane O'Neal (5.4 feet, ZONE). SCOTTIE GASOL MAKES IT!
Score: 81-76

[05:59] Team_082 possession (Score: 81-76)
Dwyane O'Neal attempts a Midrange. Contested by CJ Banchero (4.3 feet, ZONE). Dwyane O'Neal misses. Rebound secured by Michael Simmons.

[05:44] Team_015 possession (Score: 81-76)
Michael Simmons attempts a Midrange. Contested by Dwyane O'Neal (4.1 feet, MAN). Michael Simmons misses. Rebound secured by Jrue Green.

[05:26] Team_082 possession (Score: 81-76)
Jrue Green attempts a 3Pt. Contested by Michael Simmons (5.5 feet, ZONE). JRUE GREEN MAKES IT! Assist: Dwyane O'Neal
Score: 84-76

[05:13] Team_015 possession (Score: 84-76)
CJ Banchero attempts a Midrange. Contested by Kristaps Fox (4.0 feet, MAN). CJ Banchero misses. Rebound secured by Jrue Green.

[04:56] Team_082 possession (Score: 84-76)
Kristaps Fox drives and kicks out. Julius Anthony attempts a 3Pt. Contested by Manu Anthony (3.3 feet, MAN). Julius Anthony misses. Rebound secured by Scottie Gasol.

[04:43] Team_015 possession (Score: 84-76)
Scottie Gasol attempts a 3Pt. Contested by Jrue Green (2.4 feet, MAN). Scottie Gasol misses. Offensive rebound by Michael Simmons! Michael Simmons kicks it out.

[04:31] Team_015 possession (Score: 84-76)
Trae Turner attempts a Midrange. Wide open! Julius Carter is 8.3 feet away. [MAN] Trae Turner misses. Rebound secured by Jrue Green.

[04:18] Team_082 possession (Score: 84-76)
FOUL! Reach-in foul on Scottie Gasol during the drive. [IN THE BONUS! 6 team fouls] Dwyane O'Neal to the line for 2 free throws. (Scottie Gasol: 3 personal fouls)   FT 1/2: GOOD   FT 2/2: GOOD Dwyane O'Neal makes 2/2 from the line.
Score: 86-76

[04:06] Team_015 possession (Score: 86-76)
Scottie Gasol attempts a Midrange. Contested by Jrue Green (5.7 feet, MAN). SCOTTIE GASOL MAKES IT!
Score: 86-78

[03:50] Team_082 possession (Score: 86-78)
Dwyane O'Neal attempts a 3Pt. Contested by Manu Anthony (3.3 feet, ZONE). Dwyane O'Neal misses. Rebound secured by Michael Simmons.

[03:37] Team_015 possession (Score: 86-78)
Scottie Gasol attempts a 3Pt. Contested by Dwyane O'Neal (3.1 feet, ZONE). Scottie Gasol misses. Rebound secured by Julius Carter.

[03:23] Team_082 possession (Score: 86-78)
Julius Carter attempts a Layup. Contested by Trae Turner (4.1 feet, MAN). Julius Carter misses. Rebound secured by CJ Banchero.

[03:12] Team_015 possession (Score: 86-78)
Scottie Gasol attempts a Midrange. Wide open! Kristaps Fox is 8.3 feet away. [ZONE] SCOTTIE GASOL MAKES IT! Assist: CJ Banchero
Score: 86-80

[02:58] Team_082 possession (Score: 86-80)
Kristaps Fox attempts a 3Pt. Contested by Manu Anthony (4.3 feet, ZONE). KRISTAPS FOX MAKES IT! Assist: Julius Carter
Score: 89-80

[02:40] Team_015 possession (Score: 89-80)
Michael Simmons drives, Jrue Green stays with him. Michael Simmons attempts a Dunk. Contested by Jrue Green (4.5 feet, ZONE). Michael Simmons misses. Offensive rebound by CJ Banchero! CJ Banchero kicks it out.

[02:26] Team_015 possession (Score: 89-80)
Scottie Gasol attempts a Layup. Wide open! Jrue Green is 6.9 feet away. [MAN] Scottie Gasol misses. Offensive rebound by CJ Banchero! CJ Banchero kicks it out.

[02:08] Team_015 possession (Score: 89-80)
Manu Anthony drives, Julius Anthony stays with him. Manu Anthony attempts a Dunk. Wide open! Julius Anthony is 6.4 feet away. [MAN] MANU ANTHONY MAKES IT!
Score: 89-82

[01:56] Team_082 possession (Score: 89-82)
FOUL! Reach-in foul on Michael Simmons during the drive. [IN THE BONUS! 7 team fouls] Dwyane O'Neal to the line for 2 free throws. (Michael Simmons: 2 personal fouls)   FT 1/2: MISS   FT 2/2: GOOD Dwyane O'Neal makes 1/2 from the line.
Score: 90-82

[01:42] Team_015 possession (Score: 90-82)
Manu Anthony attempts a 3Pt. Contested by Dwyane O'Neal (2.8 feet, ZONE). Manu Anthony misses. Rebound secured by Julius Carter.

[01:30] Team_082 possession (Score: 90-82)
Dwyane O'Neal attempts a 3Pt. Wide open! Manu Anthony is 6.6 feet away. [ZONE] DWYANE O'NEAL MAKES IT!
Score: 93-82

[01:13] Team_015 possession (Score: 93-82)
Manu Anthony attempts a 3Pt. Wide open! Dwyane O'Neal is 9.8 feet away. [ZONE] MANU ANTHONY MAKES IT! Assist: Michael Simmons
Score: 93-85

[01:03] Team_082 possession (Score: 93-85)
Jrue Green attempts a 3Pt. Wide open! Scottie Gasol is 7.4 feet away. [MAN] Jrue Green misses. Rebound secured by Michael Simmons.

[00:49] Team_015 possession (Score: 93-85)
Scottie Gasol attempts a Layup. BLOCKED BY JRUE GREEN! Ball goes out off Jrue Green. Scottie Gasol's ball!

[00:37] Team_015 possession (Score: 93-85)
Michael Simmons attempts a 3Pt. Wide open! Dwyane O'Neal is 8.3 feet away. [MAN] Michael Simmons misses. Rebound secured by Julius Carter.

[00:22] Team_082 possession (Score: 93-85)
Dwyane O'Neal attempts a Layup. Wide open! Michael Simmons is 6.0 feet away. [MAN] Dwyane O'Neal misses. Rebound secured by Scottie Gasol.

[00:08] Team_015 possession (Score: 93-85)
Manu Anthony drives, Julius Anthony stays with him. Manu Anthony attempts a Dunk. Wide open! Julius Anthony is 9.0 feet away. [MAN] MANU ANTHONY MAKES IT! Assist: CJ Banchero
Score: 93-87

================================================================================
                              4TH QUARTER COMPLETE                              
================================================================================

4TH QUARTER SCORE: Team_082 27, Team_015 19

BOX SCORE:
================================================================================

Team_082
--------------------------------------------------------------------------------
Player                MIN  PTS  REB  AST  TO      FG   FG%      3P   3P%
--------------------------------------------------------------------------------
Dwyane O'Neal          41   11    4    1   0   5/9    55.6     0/0   0.0
Kristaps Fox           41    8    0    1   0   3/4    75.0     0/0   0.0
Julius Anthony         41    5    0    2   0   2/2   100.0     0/0   0.0
Jrue Green             39    3    6    0   0   1/5    20.0     0/0   0.0
Julius Carter          41    0    5    2   0   0/2     0.0     0/0   0.0

TEAM: FG: 11/22 (50.0%), 3PT: 5/10 (50.0%), REB: 15 (3 off, 12 def), AST: 6, TO: 0
TEAM FOULS: 1


Team_015
--------------------------------------------------------------------------------
Player                MIN  PTS  REB  AST  TO      FG   FG%      3P   3P%
--------------------------------------------------------------------------------
Manu Anthony           41    7    0    0   0   3/5    60.0     0/0   0.0
Scottie Gasol          41    6    3    1   0   3/6    50.0     0/0   0.0
Michael Simmons        41    3    4    1   0   1/4    25.0     0/0   0.0
Trae Turner            39    2    3    0   0   1/3    33.3     0/0   0.0
CJ Banchero            41    0    4    2   0   0/2     0.0     0/0   0.0

TEAM: FG: 8/20 (40.0%), 3PT: 2/8 (25.0%), REB: 14 (3 off, 11 def), AST: 4, TO: 2
TEAM FOULS: 7 [Team_082 in BONUS]

================================================================================

================================================================================
                               FULL GAME COMPLETE                               
================================================================================

FINAL SCORE: Team_082 93, Team_015 87

SCORING BY QUARTER:
--------------------------------------------------------------------------------
Team                     Q1     Q2     Q3     Q4    FINAL
--------------------------------------------------------------------------------
Team_082                 25     20     21     27       93
Team_015                 18     34     16     19       87
--------------------------------------------------------------------------------

FULL GAME BOX SCORE:
================================================================================

Team_082
--------------------------------------------------------------------------------
Player                MIN  PTS  REB  AST  TO      FG   FG%      3P   3P%      FT STL BLK
--------------------------------------------------------------------------------
Julius Anthony         41   13    0    4   1   6/10   60.0   1/3    33.3   7/7     0   0
Dwyane O'Neal          41   21   11    3   4   8/16   50.0   3/8    37.5   3/5     0   0
Kristaps Fox           41   26    0    2   6  10/15   66.7   5/9    55.6   1/1     0   0
Julius Carter          41    9   17    6   2   5/11   45.5   1/3    33.3   4/6     3   0
Jrue Green             39   12   16    0   0   4/11   36.4   1/3    33.3   2/2     1   1
Tony Jokic              9    1    4    1   0   1/3    33.3   1/1   100.0   1/2     0   0
Jordan Rozier           7    2    0    1   1   1/1   100.0   0/0     0.0   0/0     1   0
Kawhi Poole             7    5    0    0   0   2/3    66.7   1/1   100.0   0/0     0   0
Shaquille Griffin       7    2    2    0   0   1/3    33.3   0/1     0.0   0/0     0   0
D'Angelo Parker         7    0    1    1   1   0/1     0.0   0/1     0.0   0/0     1   0

TEAM: FG: 38/74 (51.4%), 3PT: 13/30 (43.3%), REB: 50 (11 off, 39 def), AST: 18, TO: 15


Team_015
--------------------------------------------------------------------------------
Player                MIN  PTS  REB  AST  TO      FG   FG%      3P   3P%      FT STL BLK
--------------------------------------------------------------------------------
Manu Anthony           41   14    0    3   1   7/18   38.9   3/10   30.0   0/0     0   0
Michael Simmons        41   18   10    3   4   8/17   47.1   2/10   20.0   0/0     0   0
CJ Banchero            41   12   14    3   0   5/10   50.0   2/4    50.0   0/0     0   0
Scottie Gasol          41   10    3    5   0   6/13   46.2   0/1     0.0   1/2     4   0
Trae Turner            39   11   12    3   2   3/8    37.5   0/1     0.0   1/2     0   0
Allen Curry             9    9    3    0   1   4/4   100.0   0/0     0.0   1/3     0   0
Dwyane Sabonis          7    3    0    0   2   1/3    33.3   1/2    50.0   0/0     0   0
Paolo Jokic             7    0    0    4   1   0/0     0.0   0/0     0.0   0/0     0   0
Magic Wagner            7    5    1    1   0   2/2   100.0   1/1   100.0   0/0     0   0
Rudy Paul               7    3    2    0   0   1/2    50.0   1/1   100.0   0/0     1   0

TEAM: FG: 37/77 (48.1%), 3PT: 10/30 (33.3%), REB: 46 (10 off, 36 def), AST: 22, TO: 11

================================================================================
