================================================================================
                        FULL GAME - Team_007 vs Team_079                        
================================================================================

================================================================================
                       1ST QUARTER - Team_007 vs Team_079                       
================================================================================

[12:00] Team_007 possession (Score: 0-0)
John Quickley attempts a Layup. Contested by Donovan Randle (2.3 feet, ZONE). JOHN QUICKLEY MAKES IT!
Score: 2-0

[11:50] Team_079 possession (Score: 2-0)
Trae Durant attempts a Midrange. Contested by John Quickley (3.3 feet, MAN). Trae Durant misses. Rebound secured by John Quickley.

[11:33] Team_007 possession (Score: 2-0)
FOUL! Reach-in foul on Miles Ming during the drive. [Team fouls: 1] No free throws, side out. (Miles Ming: 1 personal fouls)

[11:21] Team_007 possession (Score: 2-0)
John Quickley attempts a Midrange. Contested by Bam Randle (4.5 feet, ZONE). John Quickley misses. Rebound secured by Trae Durant.

[11:02] Team_079 possession (Score: 2-0)
Trae Durant attempts a 3Pt. Contested by John Quickley (2.4 feet, MAN). Trae Durant misses. Rebound secured by Bones Siakam.

[10:48] Team_007 possession (Score: 2-0)
FOUL! Shooting foul on Trae Durant. Tobias Johnson to the line for 3 free throws. [Team fouls: 2] (Trae Durant: 1 personal fouls)   FT 1/3: GOOD   FT 2/3: GOOD   FT 3/3: GOOD Tobias Johnson makes 3/3 from the line.
Score: 5-0

[10:31] Team_079 possession (Score: 5-0)
Bam Randle attempts a 3Pt. Contested by John Quickley (3.3 feet, ZONE). Bam Randle misses. Rebound secured by Bones Siakam.

[10:20] Team_007 possession (Score: 5-0)
John Quickley drives, picks up Trae Durant. Help arrives from Miles Ming! John Quickley attempts a Dunk. Contested by Miles Ming (5.6 feet, MAN). John Quickley misses. Rebound secured by Trae Durant.

[10:07] Team_079 possession (Score: 5-0)
Bam Randle attempts a 3Pt. Contested by John Quickley (5.1 feet, ZONE). Bam Randle misses. Rebound secured by Bones Siakam.

[09:51] Team_007 possession (Score: 5-0)
Carmelo Siakam attempts a Midrange. Contested by Miles Ming (4.5 feet, ZONE). Carmelo Siakam misses. Offensive rebound by Bones Siakam! Bones Siakam's putback is no good. Rebound secured by Trae Durant.

[09:34] Team_079 possession (Score: 5-0)
Trae Durant attempts a Midrange. Heavily contested by Bones Siakam (1.9 feet, ZONE)! Trae Durant misses. Rebound secured by Carmelo Siakam.

[09:19] Team_007 possession (Score: 5-0)
Jaren Dosunmu attempts a 3Pt. Contested by Trae Durant (4.4 feet, ZONE). JAREN DOSUNMU MAKES IT! Assist: John Quickley
Score: 8-0

[09:09] Team_079 possession (Score: 8-0)
Miles Ming commits a violation (traveling/carry)! TURNOVER! (dead ball)

[08:57] Team_007 possession (Score: 8-0)
Jaren Dosunmu drives, picks up Trae Durant. Help arrives from Miles Ming! Jaren Dosunmu attempts a Dunk. Heavily contested by Miles Ming (1.1 feet, ZONE)! JAREN DOSUNMU MAKES IT! Assist: Tobias Johnson
Score: 10-0

[08:42] Team_079 possession (Score: 10-0)
Trae Durant attempts a 3Pt. Contested by Bones Siakam (3.5 feet, ZONE). TRAE DURANT MAKES IT!
Score: 10-3

[08:26] Team_007 possession (Score: 10-3)
Tobias Johnson attempts a 3Pt. Wide open! Khris Embiid is 6.4 feet away. [MAN] Tobias Johnson misses. Rebound secured by Bam Randle.

[08:12] Team_079 possession (Score: 10-3)
Trae Durant makes the Layup and draws the foul on John Quickley! And-1! Trae Durant to the line for 1. [Team fouls: 1] (John Quickley: 1 personal fouls)   FT 1/1: GOOD Trae Durant makes 1/1 from the line.
Score: 10-6

[07:55] Team_007 possession (Score: 10-6)
Tobias Johnson attempts a Midrange. Wide open! Khris Embiid is 7.6 feet away. [MAN] TOBIAS JOHNSON MAKES IT! Assist: Jaren Dosunmu
Score: 12-6

[07:38] Team_079 possession (Score: 12-6)
FOUL! Shooting foul on John Quickley. Trae Durant to the line for 2 free throws. [Team fouls: 2] (John Quickley: 2 personal fouls)   FT 1/2: GOOD   FT 2/2: MISS Trae Durant makes 1/2 from the line. Offensive rebound by Trae Durant! Trae Durant puts it back in!
Score: 12-9

[07:25] Team_007 possession (Score: 12-9)
Tobias Johnson attempts a 3Pt. Contested by Khris Embiid (4.4 feet, MAN). Tobias Johnson misses. Offensive rebound by Bones Siakam! Bones Siakam puts it back in!
Score: 14-9

[07:06] Team_079 possession (Score: 14-9)
Khris Embiid attempts a Midrange. Wide open! Jaren Dosunmu is 6.1 feet away. [ZONE] Khris Embiid misses. Offensive rebound by Trae Durant! Trae Durant's putback is no good. Offensive rebound by Donovan Randle! Donovan Randle kicks it out.

[06:55] Team_079 possession (Score: 14-9)
Donovan Randle drives, John Quickley stays with him. Donovan Randle attempts a Layup. Contested by John Quickley (3.4 feet, MAN). Donovan Randle misses. Rebound secured by Bones Siakam.

[06:41] Team_007 possession (Score: 14-9)
Jaren Dosunmu makes the Dunk and draws the foul on Miles Ming! And-1! Jaren Dosunmu to the line for 1. [Team fouls: 3] (Miles Ming: 2 personal fouls)   FT 1/1: GOOD Jaren Dosunmu makes 1/1 from the line.
Score: 17-9

[06:24] Team_079 possession (Score: 17-9)
Trae Durant attempts a 3Pt. Contested by John Quickley (5.8 feet, ZONE). Trae Durant misses. Rebound secured by John Quickley.

[06:09] Team_007 possession (Score: 17-9)
Jaren Dosunmu attempts a Midrange. Contested by Miles Ming (3.0 feet, ZONE). Jaren Dosunmu misses. Offensive rebound by Carmelo Siakam! Carmelo Siakam puts it back in!
Score: 19-9

[05:58] Team_079 possession (Score: 19-9)
Miles Ming attempts a 3Pt. Heavily contested by John Quickley (2.0 feet, ZONE)! Miles Ming misses. Rebound secured by Bones Siakam.

[05:42] Team_007 possession (Score: 19-9)
John Quickley attempts a Midrange. Contested by Bam Randle (5.0 feet, ZONE). John Quickley misses. Rebound secured by Bam Randle.

[05:28] Team_079 possession (Score: 19-9)
Donovan Randle drives to the basket... Donovan Randle loses the ball! Stripped by John Quickley! TURNOVER! (live ball)

[05:16] Team_007 possession (Score: 19-9)
John Quickley attempts a Midrange. Contested by Bam Randle (3.0 feet, ZONE). John Quickley misses. Offensive rebound by Carmelo Siakam! Carmelo Siakam puts it back in!
Score: 21-9

[05:04] Team_079 possession (Score: 21-9)
Khris Embiid attempts a 3Pt. Wide open! Tobias Johnson is 6.2 feet away. [ZONE] Khris Embiid misses. Offensive rebound by Donovan Randle! Donovan Randle kicks it out.

[04:50] Team_079 possession (Score: 21-9)
Khris Embiid drives to the basket... Khris Embiid throws a bad pass! Stolen by Tobias Johnson! TURNOVER! (live ball)

[04:34] Team_007 possession (Score: 21-9)
Jaren Dosunmu attempts a 3Pt. Wide open! Miles Ming is 7.5 feet away. [MAN] JAREN DOSUNMU MAKES IT! Assist: Carmelo Siakam
Score: 24-9

[04:18] Team_079 possession (Score: 24-9)
Bam Randle attempts a 3Pt. Contested by John Quickley (3.5 feet, ZONE). Bam Randle misses. FOUL! Loose ball foul on Bones Siakam during the rebound battle. [Team fouls: 3] No free throws, side out. (Bones Siakam: 1 personal fouls)

[04:01] Team_079 possession (Score: 24-9)
Bam Randle attempts a Midrange. Contested by Bones Siakam (5.2 feet, MAN). BAM RANDLE MAKES IT!
Score: 24-11

[03:46] Team_007 possession (Score: 24-11)
Jaren Dosunmu attempts a 3Pt. Heavily contested by Trae Durant (0.6 feet, ZONE)! Jaren Dosunmu misses. Rebound secured by Bam Randle.

[03:35] Team_079 possession (Score: 24-11)
Trae Durant attempts a 3Pt. Contested by John Quickley (2.3 feet, MAN). Trae Durant misses. Rebound secured by Carmelo Siakam.

[03:18] Team_007 possession (Score: 24-11)
Jaren Dosunmu drives to the basket... Jaren Dosunmu loses the ball! Stripped by Miles Ming! TURNOVER! (live ball)

[03:02] Team_079 possession (Score: 24-11)
Trae Durant attempts a 3Pt. Contested by John Quickley (2.5 feet, MAN). Trae Durant misses. Rebound secured by Bones Siakam.

[02:48] Team_007 possession (Score: 24-11)
Carmelo Siakam drives, Donovan Randle stays with him. Carmelo Siakam attempts a Dunk. Contested by Donovan Randle (5.5 feet, MAN). Carmelo Siakam misses. FOUL! Loose ball foul on Bam Randle during the rebound battle. [Team fouls: 4] No free throws, side out. (Bam Randle: 1 personal fouls)

[02:33] Team_007 possession (Score: 24-11)
John Quickley attempts a 3Pt. Wide open! Trae Durant is 6.8 feet away. [ZONE] John Quickley misses. FOUL! Loose ball foul on Donovan Randle during the rebound battle. [IN THE BONUS! 5 team fouls] Carmelo Siakam to the line for 2 free throws. (Donovan Randle: 1 personal fouls)   FT 1/2: MISS   FT 2/2: GOOD Carmelo Siakam makes 1/2 from the line.
Score: 25-11

[02:19] Team_079 possession (Score: 25-11)
Donovan Randle drives to the basket... Donovan Randle throws a bad pass! Stolen by John Quickley! TURNOVER! (live ball)

[02:02] Team_007 possession (Score: 25-11)
John Quickley attempts a Layup. Contested by Trae Durant (2.3 feet, ZONE). John Quickley misses. Rebound secured by Trae Durant.

[01:46] Team_079 possession (Score: 25-11)
Khris Embiid attempts a 3Pt. Wide open! John Quickley is 9.3 feet away. [ZONE] Khris Embiid misses. Rebound secured by Carmelo Siakam.

[01:32] Team_007 possession (Score: 25-11)
Carmelo Siakam attempts a Midrange. Wide open! Khris Embiid is 7.9 feet away. [ZONE] Carmelo Siakam misses. Rebound secured by Trae Durant.

[01:16] Team_079 possession (Score: 25-11)
Donovan Randle attempts a Midrange. Contested by John Quickley (3.4 feet, MAN). DONOVAN RANDLE MAKES IT!
Score: 25-13

[01:00] Team_007 possession (Score: 25-13)
Jaren Dosunmu attempts a 3Pt. Contested by Trae Durant (3.7 feet, ZONE). Jaren Dosunmu misses. Rebound secured by Bam Randle.

[00:49] Team_079 possession (Score: 25-13)
FOUL! Reach-in foul on Tobias Johnson during the drive. [Team fouls: 4] No free throws, side out. (Tobias Johnson: 1 personal fouls)

[00:39] Team_079 possession (Score: 25-13)
Donovan Randle drives to the basket... FOUL! Offensive foul on Donovan Randle! John Quickley drew the charge! [Team fouls: 6] (Donovan Randle: 2 personal fouls) TURNOVER! (dead ball)

[00:24] Team_007 possession (Score: 25-13)
John Quickley drives and kicks out. Tobias Johnson attempts a 3Pt. Contested by Trae Durant (4.3 feet, ZONE). TOBIAS JOHNSON MAKES IT! Assist: Carmelo Siakam
Score: 28-13

[00:13] Team_079 possession (Score: 28-13)
Bam Randle attempts a 3Pt. Contested by John Quickley (3.1 feet, ZONE). Bam Randle misses. FOUL! Loose ball foul on Bones Siakam during the rebound battle. [IN THE BONUS! 5 team fouls] Donovan Randle to the line for 2 free throws. (Bones Siakam: 2 personal fouls)   FT 1/2: GOOD   FT 2/2: MISS Donovan Randle makes 1/2 from the line. Rebound secured by John Quickley.
Score: 28-14

================================================================================
                              1ST QUARTER COMPLETE                              
================================================================================

1ST QUARTER SCORE: Team_007 28, Team_079 14

BOX SCORE:
================================================================================

Team_007
--------------------------------------------------------------------------------
Player                MIN  PTS  REB  AST  TO      FG   FG%      3P   3P%
--------------------------------------------------------------------------------
Jaren Dosunmu          12   11    0    1   0   4/6    66.7     0/0   0.0
Tobias Johnson         12    8    0    1   0   3/4    75.0     0/0   0.0
Carmelo Siakam         12    5    5    2   0   3/5    60.0     0/0   0.0
Bones Siakam           12    2    8    0   0   1/1   100.0     0/0   0.0

TEAM: FG: 12/21 (57.1%), 3PT: 5/8 (62.5%), REB: 16 (5 off, 11 def), AST: 5, TO: 1
TEAM FOULS: 5 [Team_079 in BONUS]


Team_079
--------------------------------------------------------------------------------
Player                MIN  PTS  REB  AST  TO      FG   FG%      3P   3P%
--------------------------------------------------------------------------------
Trae Durant            12    9    5    0   0   3/9    33.3     0/0   0.0
John Quickley          12    2    3    1   0   1/5    20.0     0/0   0.0
Bam Randle             12    2    4    0   0   1/4    25.0     0/0   0.0
Donovan Randle         12    2    3    0   0   1/2    50.0     0/0   0.0
Miles Ming             12    0    0    0   0   0/1     0.0     0/0   0.0
Khris Embiid           12    0    0    0   0   0/1     0.0     0/0   0.0

TEAM: FG: 5/17 (29.4%), 3PT: 1/10 (10.0%), REB: 12 (4 off, 8 def), AST: 0, TO: 5
TEAM FOULS: 6 [Team_007 in BONUS]

================================================================================

================================================================================
                       2ND QUARTER - Team_007 vs Team_079                       
================================================================================

[12:00] Team_007 possession (Score: 28-14)
Bones Siakam attempts a 3Pt. BLOCKED BY TRAE DURANT! Ball is loose! Offensive rebound by Bones Siakam! Bones Siakam kicks it out.

[11:43] Team_007 possession (Score: 28-14)
FOUL! Reach-in foul on Bam Randle during the drive. [Team fouls: 1] No free throws, side out. (Bam Randle: 1 personal fouls)

[11:29] Team_007 possession (Score: 28-14)
FOUL! Shooting foul on Trae Durant. Tobias Johnson to the line for 2 free throws. [Team fouls: 2] (Trae Durant: 1 personal fouls)   FT 1/2: GOOD   FT 2/2: GOOD Tobias Johnson makes 2/2 from the line.
Score: 30-14

[11:14] Team_079 possession (Score: 30-14)
FOUL! Shooting foul on Tobias Johnson. Khris Embiid to the line for 3 free throws. [Team fouls: 1] (Tobias Johnson: 1 personal fouls)   FT 1/3: MISS   FT 2/3: GOOD   FT 3/3: GOOD Khris Embiid makes 2/3 from the line.
Score: 30-16

[11:00] Team_007 possession (Score: 30-16)
Jaren Dosunmu commits a violation (traveling/carry)! TURNOVER! (dead ball)

[11:00] Substitution (Team_007): Tobias Johnson OUT → Wendell Poole IN (stamina_rule2)

[11:00] Substitution (Team_007): Jaren Dosunmu OUT → OG Porzingis IN (stamina_rule2)

[11:00] Substitution (Team_007): Bones Siakam OUT → Gary LaVine IN (stamina_rule2)

[11:00] Substitution (Team_007): John Quickley OUT → Austin Simons IN (stamina_rule2)

[11:00] Substitution (Team_007): Carmelo Siakam OUT → Draymond Harris IN (stamina_rule2)

[11:00] Substitution (Team_079): Khris Embiid OUT → Evan Mobley IN (stamina_rule2)

[11:00] Substitution (Team_079): Miles Ming OUT → Karl Ingram IN (stamina_rule2)

[11:00] Substitution (Team_079): Bam Randle OUT → Anthony Wade IN (stamina_rule2)

[11:00] Substitution (Team_079): Trae Durant OUT → Kobe Curry IN (stamina_rule2)

[11:00] Substitution (Team_079): Donovan Randle OUT → James LaVine IN (stamina_rule2)

[10:47] Team_079 possession (Score: 30-16)
James LaVine attempts a Layup. Contested by Draymond Harris (3.6 feet, MAN). JAMES LAVINE MAKES IT! Assist: Evan Mobley
Score: 30-18

[10:28] Team_007 possession (Score: 30-18)
OG Porzingis attempts a 3Pt. Contested by Karl Ingram (5.4 feet, MAN). OG Porzingis misses. Rebound secured by Anthony Wade.

[10:18] Team_079 possession (Score: 30-18)
Anthony Wade attempts a Layup. Contested by Gary LaVine (3.6 feet, MAN). ANTHONY WADE MAKES IT! Assist: Kobe Curry
Score: 30-20

[10:07] Team_007 possession (Score: 30-20)
Gary LaVine attempts a 3Pt. Heavily contested by Anthony Wade (1.4 feet, MAN)! Gary LaVine misses. Rebound secured by James LaVine.

[09:56] Team_079 possession (Score: 30-20)
James LaVine attempts a Layup. Contested by Austin Simons (2.1 feet, ZONE). JAMES LAVINE MAKES IT! Assist: Evan Mobley
Score: 30-22

[09:38] Team_007 possession (Score: 30-22)
OG Porzingis attempts a 3Pt. Wide open! Evan Mobley is 6.4 feet away. [ZONE] OG Porzingis misses. Rebound secured by Kobe Curry.

[09:24] Team_079 possession (Score: 30-22)
Anthony Wade attempts a 3Pt. Contested by Gary LaVine (5.7 feet, MAN). Anthony Wade misses. Offensive rebound by Kobe Curry! Kobe Curry kicks it out.

[09:13] Team_079 possession (Score: 30-22)
Karl Ingram loses the ball! Stripped by OG Porzingis! TURNOVER! (live ball)

[09:04] Team_007 possession (Score: 30-22)
Gary LaVine drives to the basket... Gary LaVine throws a bad pass! Stolen by Kobe Curry! TURNOVER! (live ball)

[08:47] Team_079 possession (Score: 30-22)
Anthony Wade throws a bad pass! Stolen by Gary LaVine! TURNOVER! (live ball)

[08:30] Team_007 possession (Score: 30-22)
Austin Simons drives, Kobe Curry stays with him. Austin Simons attempts a Dunk. Heavily contested by Kobe Curry (0.7 feet, MAN)! AUSTIN SIMONS MAKES IT!
Score: 32-22

[08:15] Team_079 possession (Score: 32-22)
Kobe Curry attempts a 3Pt. Contested by OG Porzingis (5.3 feet, ZONE). KOBE CURRY MAKES IT! Assist: Karl Ingram
Score: 32-25

[07:59] Team_007 possession (Score: 32-25)
Gary LaVine attempts a Midrange. Contested by Anthony Wade (3.0 feet, ZONE). GARY LAVINE MAKES IT! Assist: Austin Simons
Score: 34-25

[07:45] Team_079 possession (Score: 34-25)
Karl Ingram attempts a 3Pt. Wide open! OG Porzingis is 7.6 feet away. [ZONE] Karl Ingram misses. Rebound secured by Gary LaVine.

[07:34] Team_007 possession (Score: 34-25)
OG Porzingis attempts a 3Pt. Contested by Karl Ingram (4.8 feet, MAN). OG Porzingis misses. Rebound secured by James LaVine.

[07:17] Team_079 possession (Score: 34-25)
James LaVine commits a violation (traveling/carry)! TURNOVER! (dead ball)

[07:04] Team_007 possession (Score: 34-25)
Austin Simons attempts a Midrange. Contested by Kobe Curry (5.9 feet, ZONE). AUSTIN SIMONS MAKES IT! Assist: Wendell Poole
Score: 36-25

[06:55] Team_079 possession (Score: 36-25)
FOUL! Shooting foul on Gary LaVine. Kobe Curry to the line for 2 free throws. [Team fouls: 2] (Gary LaVine: 1 personal fouls)   FT 1/2: GOOD   FT 2/2: GOOD Kobe Curry makes 2/2 from the line.
Score: 36-27

[06:40] Team_007 possession (Score: 36-27)
OG Porzingis attempts a 3Pt. Contested by Evan Mobley (4.9 feet, ZONE). OG Porzingis misses. Offensive rebound by Draymond Harris! Draymond Harris kicks it out.

[06:26] Team_007 possession (Score: 36-27)
Austin Simons drives, picks up James LaVine. Help arrives from Karl Ingram! Austin Simons attempts a Dunk. Wide open! Karl Ingram is 7.6 feet away. [ZONE] AUSTIN SIMONS MAKES IT! Assist: Gary LaVine
Score: 38-27

[06:13] Team_079 possession (Score: 38-27)
James LaVine drives and kicks out. Evan Mobley attempts a 3Pt. Wide open! Wendell Poole is 6.5 feet away. [MAN] Evan Mobley misses. Offensive rebound by Kobe Curry! Kobe Curry kicks it out.

[06:00] Team_079 possession (Score: 38-27)
FOUL! Holding foul on Draymond Harris. [Team fouls: 3] No free throws, side out. (Draymond Harris: 1 personal fouls)

[05:46] Team_079 possession (Score: 38-27)
Kobe Curry attempts a 3Pt. Contested by Austin Simons (4.0 feet, MAN). KOBE CURRY MAKES IT! Assist: Anthony Wade
Score: 38-30

[05:34] Team_007 possession (Score: 38-30)
Gary LaVine attempts a Midrange. Contested by Anthony Wade (5.8 feet, MAN). Gary LaVine misses. Rebound secured by James LaVine.

[05:23] Team_079 possession (Score: 38-30)
Kobe Curry drives, Austin Simons stays with him. Kobe Curry attempts a Layup. Contested by Austin Simons (4.3 feet, ZONE). Kobe Curry misses. Rebound secured by Austin Simons.

[05:04] Team_007 possession (Score: 38-30)
Austin Simons attempts a 3Pt. Wide open! Kobe Curry is 6.5 feet away. [MAN] AUSTIN SIMONS MAKES IT! Assist: Wendell Poole
Score: 41-30

[04:53] Team_079 possession (Score: 41-30)
Evan Mobley attempts a 3Pt. Contested by OG Porzingis (5.9 feet, ZONE). Evan Mobley misses. Rebound secured by Gary LaVine.

[04:37] Team_007 possession (Score: 41-30)
FOUL! Shooting foul on James LaVine. Draymond Harris to the line for 2 free throws. [Team fouls: 3] (James LaVine: 1 personal fouls)   FT 1/2: GOOD   FT 2/2: GOOD Draymond Harris makes 2/2 from the line.
Score: 43-30

[04:25] Team_079 possession (Score: 43-30)
Kobe Curry drives to the basket... FOUL! Offensive foul on Kobe Curry! Austin Simons drew the charge! [Team fouls: 4] (Kobe Curry: 1 personal fouls) TURNOVER! (dead ball)

[04:09] Team_007 possession (Score: 43-30)
Draymond Harris attempts a Midrange. Wide open! Anthony Wade is 6.4 feet away. [ZONE] DRAYMOND HARRIS MAKES IT!
Score: 45-30

[03:54] Team_079 possession (Score: 45-30)
James LaVine attempts a Midrange. Contested by Draymond Harris (5.7 feet, MAN). JAMES LAVINE MAKES IT! Assist: Anthony Wade
Score: 45-32

[03:39] Team_007 possession (Score: 45-32)
Austin Simons attempts a 3Pt. BLOCKED BY KOBE CURRY! Ball deflects out of bounds off Austin Simons.

[03:25] Team_079 possession (Score: 45-32)
Karl Ingram attempts a 3Pt. Wide open! OG Porzingis is 6.5 feet away. [MAN] KARL INGRAM MAKES IT! Assist: Evan Mobley
Score: 45-35

[03:15] Team_007 possession (Score: 45-35)
FOUL! Reach-in foul on James LaVine during the drive. [IN THE BONUS! 5 team fouls] Wendell Poole to the line for 2 free throws. (James LaVine: 2 personal fouls)   FT 1/2: GOOD   FT 2/2: MISS Wendell Poole makes 1/2 from the line. Rebound secured by Kobe Curry.
Score: 46-35

[03:05] Team_079 possession (Score: 46-35)
Anthony Wade drives and kicks out. Anthony Wade attempts a Midrange. Contested by Gary LaVine (4.3 feet, MAN). Anthony Wade misses. Rebound secured by Austin Simons.

[02:47] Team_007 possession (Score: 46-35)
Draymond Harris attempts a Layup. Wide open! James LaVine is 7.2 feet away. [ZONE] Draymond Harris misses. Rebound secured by Anthony Wade.

[02:33] Team_079 possession (Score: 46-35)
Karl Ingram attempts a 3Pt. Contested by OG Porzingis (5.9 feet, MAN). Karl Ingram misses. Rebound secured by Gary LaVine.

[02:19] Team_007 possession (Score: 46-35)
OG Porzingis attempts a Midrange. Wide open! Anthony Wade is 6.8 feet away. [ZONE] OG Porzingis misses. Rebound secured by Anthony Wade.

[02:04] Team_079 possession (Score: 46-35)
James LaVine drives and kicks out. Karl Ingram attempts a 3Pt. Contested by OG Porzingis (4.3 feet, MAN). KARL INGRAM MAKES IT! Assist: Kobe Curry
Score: 46-38

[01:52] Team_007 possession (Score: 46-38)
Wendell Poole attempts a 3Pt. Wide open! Karl Ingram is 6.3 feet away. [ZONE] WENDELL POOLE MAKES IT! Assist: Draymond Harris
Score: 49-38

[01:36] Team_079 possession (Score: 49-38)
Karl Ingram attempts a 3Pt. Wide open! OG Porzingis is 8.7 feet away. [MAN] Karl Ingram misses. Rebound secured by Draymond Harris.

[01:24] Team_007 possession (Score: 49-38)
Wendell Poole drives and kicks out. Wendell Poole attempts a 3Pt. Contested by Karl Ingram (5.9 feet, ZONE). Wendell Poole misses. Rebound secured by Kobe Curry.

[01:12] Team_079 possession (Score: 49-38)
James LaVine attempts a Layup. Wide open! Draymond Harris is 7.3 feet away. [MAN] James LaVine misses. Rebound secured by Draymond Harris.

[00:57] Team_007 possession (Score: 49-38)
Wendell Poole attempts a 3Pt. Contested by Evan Mobley (5.6 feet, MAN). WENDELL POOLE MAKES IT! Assist: OG Porzingis
Score: 52-38

[00:42] Team_079 possession (Score: 52-38)
FOUL! Holding foul on Draymond Harris. [Team fouls: 4] No free throws, side out. (Draymond Harris: 2 personal fouls)

[00:25] Team_079 possession (Score: 52-38)
James LaVine attempts a Midrange. Contested by Draymond Harris (4.0 feet, MAN). JAMES LAVINE MAKES IT!
Score: 52-40

[00:06] Team_007 possession (Score: 52-40)
OG Porzingis attempts a 3Pt. Wide open! Karl Ingram is 7.9 feet away. [ZONE] OG PORZINGIS MAKES IT! Assist: Gary LaVine
Score: 55-40

================================================================================
                              2ND QUARTER COMPLETE                              
================================================================================

2ND QUARTER SCORE: Team_007 27, Team_079 26

BOX SCORE:
================================================================================

Team_007
--------------------------------------------------------------------------------
Player                MIN  PTS  REB  AST  TO      FG   FG%      3P   3P%
--------------------------------------------------------------------------------
Austin Simons          11    9    2    1   0   4/5    80.0     0/0   0.0
Wendell Poole          11    6    0    2   0   2/4    50.0     0/0   0.0
Draymond Harris        11    4    3    1   0   2/3    66.7     0/0   0.0
OG Porzingis           11    3    0    1   0   1/5    20.0     0/0   0.0
Tobias Johnson         13    2    0    0   0   1/1   100.0     0/0   0.0
Gary LaVine            11    2    3    2   0   1/3    33.3     0/0   0.0
Bones Siakam           13    0    1    0   0   0/0     0.0     0/0   0.0

TEAM: FG: 11/21 (52.4%), 3PT: 4/9 (44.4%), REB: 9 (2 off, 7 def), AST: 7, TO: 2
TEAM FOULS: 4


Team_079
--------------------------------------------------------------------------------
Player                MIN  PTS  REB  AST  TO      FG   FG%      3P   3P%
--------------------------------------------------------------------------------
James LaVine           11    8    3    0   0   4/5    80.0     0/0   0.0
Kobe Curry             11    8    5    2   0   3/4    75.0     0/0   0.0
Karl Ingram            11    6    0    1   0   2/5    40.0     0/0   0.0
Khris Embiid           13    2    0    0   0   1/1   100.0     0/0   0.0
Anthony Wade           11    2    3    2   0   1/2    50.0     0/0   0.0
Evan Mobley            11    0    0    3   0   0/1     0.0     0/0   0.0

TEAM: FG: 11/18 (61.1%), 3PT: 4/8 (50.0%), REB: 11 (2 off, 9 def), AST: 8, TO: 4
TEAM FOULS: 5 [Team_007 in BONUS]

================================================================================

================================================================================
                       3RD QUARTER - Team_007 vs Team_079                       
================================================================================

[12:00] Team_007 possession (Score: 55-40)
Carmelo Siakam attempts a 3Pt. Wide open! Donovan Randle is 7.3 feet away. [MAN] Carmelo Siakam misses. Offensive rebound by Carmelo Siakam! Carmelo Siakam puts it back in!
Score: 57-40

[11:45] Team_079 possession (Score: 57-40)
Miles Ming attempts a 3Pt. Wide open! Jaren Dosunmu is 8.0 feet away. [MAN] MILES MING MAKES IT! Assist: Bam Randle
Score: 57-43

[11:31] Team_007 possession (Score: 57-43)
Jaren Dosunmu attempts a 3Pt. Wide open! Miles Ming is 6.5 feet away. [MAN] Jaren Dosunmu misses. Rebound secured by Bam Randle.

[11:16] Team_079 possession (Score: 57-43)
Khris Embiid drives, picks up Tobias Johnson. Help arrives from Bones Siakam! Khris Embiid attempts a Layup. Contested by Bones Siakam (5.5 feet, MAN). KHRIS EMBIID MAKES IT! Assist: Miles Ming
Score: 57-45

[11:02] Team_007 possession (Score: 57-45)
Bones Siakam attempts a 3Pt. Heavily contested by Trae Durant (1.7 feet, ZONE)! Bones Siakam misses. Offensive rebound by Carmelo Siakam! Carmelo Siakam's putback is no good. Offensive rebound by Bones Siakam! Bones Siakam kicks it out.

[10:45] Team_007 possession (Score: 57-45)
Tobias Johnson drives and kicks out. Jaren Dosunmu attempts a 3Pt. Wide open! Miles Ming is 6.4 feet away. [MAN] Jaren Dosunmu misses. Offensive rebound by Carmelo Siakam! Carmelo Siakam puts it back in!
Score: 59-45

[10:30] Team_079 possession (Score: 59-45)
Trae Durant drives to the basket... Trae Durant throws a bad pass out of bounds! TURNOVER! (dead ball)

[10:14] Team_007 possession (Score: 59-45)
Jaren Dosunmu makes the 3Pt and draws the foul on Miles Ming! And-1! Jaren Dosunmu to the line for 1. [Team fouls: 1] (Miles Ming: 1 personal fouls)   FT 1/1: MISS Jaren Dosunmu makes 0/1 from the line. Rebound secured by Trae Durant.
Score: 62-45

[10:02] Team_079 possession (Score: 62-45)
Miles Ming attempts a Midrange. Wide open! Jaren Dosunmu is 7.6 feet away. [MAN] Miles Ming misses. Rebound secured by Carmelo Siakam.

[09:45] Team_007 possession (Score: 62-45)
Jaren Dosunmu attempts a Layup. BLOCKED BY TRAE DURANT! Ball is loose! Rebound secured by Trae Durant.

[09:34] Team_079 possession (Score: 62-45)
Donovan Randle attempts a Midrange. Contested by John Quickley (2.7 feet, MAN). Donovan Randle misses. Rebound secured by Carmelo Siakam.

[09:19] Team_007 possession (Score: 62-45)
Carmelo Siakam attempts a Midrange. BLOCKED BY DONOVAN RANDLE! Ball is loose! Offensive rebound by Carmelo Siakam! Carmelo Siakam kicks it out.

[09:07] Team_007 possession (Score: 62-45)
Carmelo Siakam makes the Layup and draws the foul on Miles Ming! And-1! Carmelo Siakam to the line for 1. [Team fouls: 2] (Miles Ming: 2 personal fouls)   FT 1/1: GOOD Carmelo Siakam makes 1/1 from the line.
Score: 65-45

[08:55] Team_079 possession (Score: 65-45)
FOUL! Reach-in foul on John Quickley during the drive. [Team fouls: 1] No free throws, side out. (John Quickley: 1 personal fouls)

[08:41] Team_079 possession (Score: 65-45)
Trae Durant makes the Dunk and draws the foul on John Quickley! And-1! Trae Durant to the line for 1. [Team fouls: 2] (John Quickley: 2 personal fouls)   FT 1/1: GOOD Trae Durant makes 1/1 from the line.
Score: 65-48

[08:28] Team_007 possession (Score: 65-48)
Bones Siakam attempts a 3Pt. Contested by Trae Durant (2.4 feet, ZONE). BONES SIAKAM MAKES IT! Assist: Tobias Johnson
Score: 68-48

[08:14] Team_079 possession (Score: 68-48)
Donovan Randle drives and kicks out. Khris Embiid attempts a Midrange. Contested by Carmelo Siakam (4.5 feet, ZONE). Khris Embiid misses. Rebound secured by Bones Siakam.

[07:56] Team_007 possession (Score: 68-48)
FOUL! Reach-in foul on Trae Durant during the drive. [Team fouls: 3] No free throws, side out. (Trae Durant: 1 personal fouls)

[07:37] Team_007 possession (Score: 68-48)
Tobias Johnson attempts a 3Pt. Wide open! Khris Embiid is 6.6 feet away. [MAN] Tobias Johnson misses. Rebound secured by Trae Durant.

[07:25] Team_079 possession (Score: 68-48)
Donovan Randle attempts a Layup. Wide open! John Quickley is 6.8 feet away. [ZONE] Donovan Randle misses. Rebound secured by Carmelo Siakam.

[07:06] Team_007 possession (Score: 68-48)
John Quickley drives and kicks out. Bones Siakam attempts a 3Pt. Contested by Bam Randle (5.2 feet, MAN). Bones Siakam misses. Rebound secured by Bam Randle.

[06:48] Team_079 possession (Score: 68-48)
Trae Durant throws a bad pass out of bounds! TURNOVER! (dead ball)

[06:29] Team_007 possession (Score: 68-48)
Tobias Johnson commits a violation (traveling/carry)! TURNOVER! (dead ball)

[06:18] Team_079 possession (Score: 68-48)
Khris Embiid attempts a Midrange. Contested by Bones Siakam (3.3 feet, ZONE). Khris Embiid misses. Rebound secured by Bones Siakam.

[06:04] Team_007 possession (Score: 68-48)
FOUL! Offensive foul on Carmelo Siakam! Donovan Randle drew the charge! [Team fouls: 3] (Carmelo Siakam: 1 personal fouls) TURNOVER! (dead ball)

[05:46] Team_079 possession (Score: 68-48)
FOUL! Offensive foul on Miles Ming! Jaren Dosunmu drew the charge! [Team fouls: 4] (Miles Ming: 3 personal fouls) TURNOVER! (dead ball)

[05:35] Team_007 possession (Score: 68-48)
Bones Siakam attempts a Midrange. Wide open! Bam Randle is 7.4 feet away. [ZONE] BONES SIAKAM MAKES IT! Assist: Carmelo Siakam
Score: 70-48

[05:22] Team_079 possession (Score: 70-48)
Donovan Randle attempts a 3Pt. Contested by John Quickley (3.1 feet, MAN). Donovan Randle misses. Offensive rebound by Donovan Randle! Donovan Randle kicks it out.

[05:11] Team_079 possession (Score: 70-48)
Donovan Randle loses control! Ball rolls out of bounds! TURNOVER! (dead ball)

[04:57] Team_007 possession (Score: 70-48)
Bones Siakam drives, Bam Randle stays with him. Bones Siakam attempts a Dunk. Wide open! Bam Randle is 6.8 feet away. [MAN] Bones Siakam misses. Rebound secured by Bam Randle.

[04:45] Team_079 possession (Score: 70-48)
Donovan Randle drives, John Quickley stays with him. Donovan Randle attempts a Dunk. Contested by John Quickley (5.5 feet, ZONE). DONOVAN RANDLE MAKES IT! Assist: Trae Durant
Score: 70-50

[04:35] Team_007 possession (Score: 70-50)
Carmelo Siakam attempts a 3Pt. Contested by Trae Durant (2.5 feet, ZONE). Carmelo Siakam misses. Rebound secured by Trae Durant.

[04:21] Team_079 possession (Score: 70-50)
FOUL! Shooting foul on John Quickley. Bam Randle to the line for 3 free throws. [Team fouls: 4] (John Quickley: 3 personal fouls)   FT 1/3: GOOD   FT 2/3: GOOD   FT 3/3: GOOD Bam Randle makes 3/3 from the line.
Score: 70-53

[04:08] Team_007 possession (Score: 70-53)
John Quickley attempts a 3Pt. Contested by Trae Durant (5.3 feet, MAN). John Quickley misses. Rebound secured by Donovan Randle.

[03:56] Team_079 possession (Score: 70-53)
Khris Embiid attempts a Midrange. Wide open! Tobias Johnson is 7.5 feet away. [MAN] KHRIS EMBIID MAKES IT!
Score: 70-55

[03:45] Team_007 possession (Score: 70-55)
Carmelo Siakam drives, picks up Donovan Randle. Help arrives from Miles Ming! Carmelo Siakam attempts a Layup. Heavily contested by Miles Ming (2.0 feet, MAN)! Carmelo Siakam misses. Rebound secured by Donovan Randle.

[03:31] Team_079 possession (Score: 70-55)
Bam Randle drives, John Quickley stays with him. Bam Randle attempts a Layup. Contested by John Quickley (4.1 feet, ZONE). Bam Randle misses. Rebound secured by Bones Siakam.

[03:13] Team_007 possession (Score: 70-55)
John Quickley drives and kicks out. Tobias Johnson attempts a 3Pt. Contested by Khris Embiid (4.1 feet, MAN). Tobias Johnson misses. FOUL! Loose ball foul on Bam Randle during the rebound battle. [IN THE BONUS! 5 team fouls] Carmelo Siakam to the line for 2 free throws. (Bam Randle: 1 personal fouls)   FT 1/2: GOOD   FT 2/2: GOOD Carmelo Siakam makes 2/2 from the line.
Score: 72-55

[02:54] Team_079 possession (Score: 72-55)
Bam Randle throws a bad pass! Stolen by Bones Siakam! TURNOVER! (live ball)

[02:40] Team_007 possession (Score: 72-55)
Tobias Johnson makes the Layup and draws the foul on Trae Durant! And-1! Tobias Johnson to the line for 1. [BONUS: 6 team fouls] (Trae Durant: 2 personal fouls)   FT 1/1: GOOD Tobias Johnson makes 1/1 from the line.
Score: 75-55

[02:28] Team_079 possession (Score: 75-55)
Donovan Randle attempts a Midrange. Contested by Bones Siakam (4.1 feet, ZONE). DONOVAN RANDLE MAKES IT! Assist: Trae Durant
Score: 75-57

[02:15] Team_007 possession (Score: 75-57)
Tobias Johnson attempts a Midrange. Contested by Bam Randle (5.2 feet, ZONE). TOBIAS JOHNSON MAKES IT!
Score: 77-57

[02:02] Team_079 possession (Score: 77-57)
Miles Ming attempts a 3Pt. Contested by Jaren Dosunmu (4.0 feet, MAN). MILES MING MAKES IT! Assist: Bam Randle
Score: 77-60

[01:50] Team_007 possession (Score: 77-60)
Carmelo Siakam makes the Dunk and draws the foul on Donovan Randle! And-1! Carmelo Siakam to the line for 1. [BONUS: 7 team fouls] (Donovan Randle: 1 personal fouls)   FT 1/1: GOOD Carmelo Siakam makes 1/1 from the line.
Score: 80-60

[01:34] Team_079 possession (Score: 80-60)
Miles Ming attempts a Layup. Wide open! John Quickley is 8.2 feet away. [ZONE] MILES MING MAKES IT!
Score: 80-62

[01:20] Team_007 possession (Score: 80-62)
John Quickley attempts a 3Pt. Contested by Trae Durant (3.3 feet, MAN). John Quickley misses. Offensive rebound by Bones Siakam! Bones Siakam kicks it out.

[01:08] Team_007 possession (Score: 80-62)
John Quickley attempts a Layup. Contested by Trae Durant (3.7 feet, ZONE). JOHN QUICKLEY MAKES IT! Assist: Jaren Dosunmu
Score: 82-62

[00:52] Team_079 possession (Score: 82-62)
FOUL! Shooting foul on Bones Siakam. Donovan Randle to the line for 2 free throws. [BONUS: 5 team fouls] (Bones Siakam: 1 personal fouls)   FT 1/2: GOOD   FT 2/2: MISS Donovan Randle makes 1/2 from the line. Rebound secured by Bones Siakam.
Score: 82-63

[00:36] Team_007 possession (Score: 82-63)
Bones Siakam attempts a Midrange. Wide open! Bam Randle is 6.2 feet away. [MAN] BONES SIAKAM MAKES IT!
Score: 84-63

[00:21] Team_079 possession (Score: 84-63)
Miles Ming attempts a 3Pt. Contested by Jaren Dosunmu (5.5 feet, MAN). Miles Ming misses. Offensive rebound by Trae Durant! Trae Durant kicks it out.

[00:03] Team_079 possession (Score: 84-63)
Khris Embiid drives, Carmelo Siakam stays with him. Khris Embiid attempts a Dunk. Wide open! Carmelo Siakam is 9.2 feet away. [ZONE] KHRIS EMBIID MAKES IT!
Score: 84-65

================================================================================
                              3RD QUARTER COMPLETE                              
================================================================================

3RD QUARTER SCORE: Team_007 29, Team_079 25

BOX SCORE:
================================================================================

Team_007
--------------------------------------------------------------------------------
Player                MIN  PTS  REB  AST  TO      FG   FG%      3P   3P%
--------------------------------------------------------------------------------
Carmelo Siakam         25   12    6    1   0   5/7    71.4     0/0   0.0
Bones Siakam           25    7    6    0   0   3/4    75.0     0/0   0.0
Tobias Johnson         25    5    0    1   0   2/3    66.7     0/0   0.0
John Quickley          25    2    0    0   0   1/3    33.3     0/0   0.0
Jaren Dosunmu          25    0    0    1   0   0/3     0.0     0/0   0.0

TEAM: FG: 11/20 (55.0%), 3PT: 2/7 (28.6%), REB: 12 (5 off, 7 def), AST: 3, TO: 2
TEAM FOULS: 5 [Team_079 in BONUS]


Team_079
--------------------------------------------------------------------------------
Player                MIN  PTS  REB  AST  TO      FG   FG%      3P   3P%
--------------------------------------------------------------------------------
Miles Ming             25    8    0    1   0   3/4    75.0     0/0   0.0
Khris Embiid           25    6    0    0   0   3/4    75.0     0/0   0.0
Donovan Randle         25    4    3    0   0   2/6    33.3     0/0   0.0
Bam Randle             25    3    3    2   0   1/2    50.0     0/0   0.0
Trae Durant            25    3    5    2   0   1/1   100.0     0/0   0.0

TEAM: FG: 10/17 (58.8%), 3PT: 3/3 (100.0%), REB: 11 (2 off, 9 def), AST: 5, TO: 5
TEAM FOULS: 7 [Team_007 in BONUS]

================================================================================

================================================================================
                       4TH QUARTER - Team_007 vs Team_079                       
================================================================================

[12:00] Team_007 possession (Score: 84-65)
Tobias Johnson attempts a 3Pt. Contested by Khris Embiid (3.1 feet, MAN). TOBIAS JOHNSON MAKES IT! Assist: Bones Siakam
Score: 87-65

[11:45] Team_079 possession (Score: 87-65)
Khris Embiid attempts a 3Pt. Contested by John Quickley (4.8 feet, ZONE). Khris Embiid misses. Rebound secured by John Quickley.

[11:30] Team_007 possession (Score: 87-65)
Bones Siakam attempts a Midrange. Contested by Bam Randle (2.4 feet, ZONE). Bones Siakam misses. Rebound secured by Donovan Randle.

[11:16] Team_079 possession (Score: 87-65)
Donovan Randle attempts a Layup. Contested by John Quickley (4.9 feet, MAN). DONOVAN RANDLE MAKES IT! Assist: Khris Embiid
Score: 87-67

[11:01] Team_007 possession (Score: 87-67)
John Quickley drives, picks up Trae Durant. Help arrives from Miles Ming! John Quickley attempts a Dunk. Wide open! Miles Ming is 6.8 feet away. [ZONE] JOHN QUICKLEY MAKES IT!
Score: 89-67

[10:46] Team_079 possession (Score: 89-67)
Trae Durant attempts a 3Pt. Contested by John Quickley (3.8 feet, MAN). Trae Durant misses. Rebound secured by John Quickley.

[10:33] Team_007 possession (Score: 89-67)
Tobias Johnson attempts a Layup. Contested by Trae Durant (4.3 feet, ZONE). TOBIAS JOHNSON MAKES IT!
Score: 91-67

[10:14] Team_079 possession (Score: 91-67)
Trae Durant drives and kicks out. Donovan Randle attempts a 3Pt. Contested by Jaren Dosunmu (2.8 feet, ZONE). Donovan Randle misses. Rebound secured by Carmelo Siakam.

[10:03] Team_007 possession (Score: 91-67)
Jaren Dosunmu attempts a 3Pt. Contested by Miles Ming (5.7 feet, MAN). JAREN DOSUNMU MAKES IT!
Score: 94-67

[09:46] Team_079 possession (Score: 94-67)
Bam Randle drives, picks up John Quickley. Help arrives from Jaren Dosunmu! Bam Randle attempts a Layup. Contested by Jaren Dosunmu (5.2 feet, ZONE). BAM RANDLE MAKES IT! Assist: Khris Embiid
Score: 94-69

[09:33] Team_007 possession (Score: 94-69)
Carmelo Siakam attempts a Midrange. Contested by Donovan Randle (2.0 feet, MAN). Carmelo Siakam misses. Rebound secured by Donovan Randle.

[09:18] Team_079 possession (Score: 94-69)
Bam Randle drives, picks up Bones Siakam. Help arrives from Jaren Dosunmu! Bam Randle attempts a Layup. Contested by Jaren Dosunmu (2.5 feet, MAN). BAM RANDLE MAKES IT! Assist: Trae Durant
Score: 94-71

[09:04] Team_007 possession (Score: 94-71)
Carmelo Siakam makes the Dunk and draws the foul on Miles Ming! And-1! Carmelo Siakam to the line for 1. [Team fouls: 1] (Miles Ming: 1 personal fouls)   FT 1/1: GOOD Carmelo Siakam makes 1/1 from the line.
Score: 97-71

[08:54] Team_079 possession (Score: 97-71)
Khris Embiid attempts a 3Pt. Heavily contested by John Quickley (1.1 feet, ZONE)! Khris Embiid misses. Rebound secured by Carmelo Siakam.

[08:40] Team_007 possession (Score: 97-71)
Jaren Dosunmu attempts a 3Pt. Contested by Trae Durant (3.8 feet, ZONE). Jaren Dosunmu misses. Rebound secured by Donovan Randle.

[08:30] Team_079 possession (Score: 97-71)
Khris Embiid makes the Midrange and draws the foul on Tobias Johnson! And-1! Khris Embiid to the line for 1. [Team fouls: 1] (Tobias Johnson: 1 personal fouls)   FT 1/1: GOOD Khris Embiid makes 1/1 from the line.
Score: 97-74

[08:15] Team_007 possession (Score: 97-74)
Jaren Dosunmu attempts a Layup. BLOCKED BY MILES MING! Ball is loose! Rebound secured by Bam Randle.

[08:03] Team_079 possession (Score: 97-74)
Miles Ming attempts a Layup. Contested by John Quickley (3.1 feet, ZONE). MILES MING MAKES IT! Assist: Donovan Randle
Score: 97-76

[07:52] Team_007 possession (Score: 97-76)
FOUL! Shooting foul on Trae Durant. John Quickley to the line for 3 free throws. [Team fouls: 2] (Trae Durant: 1 personal fouls)   FT 1/3: GOOD   FT 2/3: MISS   FT 3/3: GOOD John Quickley makes 2/3 from the line.
Score: 99-76

[07:42] Team_079 possession (Score: 99-76)
Miles Ming attempts a Midrange. Wide open! Carmelo Siakam is 8.2 feet away. [ZONE] Miles Ming misses. Rebound secured by Carmelo Siakam.

[07:29] Team_007 possession (Score: 99-76)
Carmelo Siakam drives to the basket... Carmelo Siakam throws a bad pass out of bounds! TURNOVER! (dead ball)

[07:29] Substitution (Team_007): Tobias Johnson OUT → Wendell Poole IN (stamina_rule2)

[07:29] Substitution (Team_007): Jaren Dosunmu OUT → OG Porzingis IN (stamina_rule2)

[07:29] Substitution (Team_007): Bones Siakam OUT → Gary LaVine IN (stamina_rule2)

[07:29] Substitution (Team_007): John Quickley OUT → Austin Simons IN (stamina_rule2)

[07:29] Substitution (Team_007): Carmelo Siakam OUT → Draymond Harris IN (stamina_rule2)

[07:29] Substitution (Team_079): Khris Embiid OUT → Evan Mobley IN (stamina_rule2)

[07:29] Substitution (Team_079): Miles Ming OUT → Karl Ingram IN (stamina_rule2)

[07:29] Substitution (Team_079): Bam Randle OUT → Anthony Wade IN (stamina_rule2)

[07:29] Substitution (Team_079): Trae Durant OUT → Kobe Curry IN (stamina_rule2)

[07:29] Substitution (Team_079): Donovan Randle OUT → James LaVine IN (stamina_rule2)

[07:17] Team_079 possession (Score: 99-76)
Karl Ingram attempts a 3Pt. Contested by OG Porzingis (4.5 feet, ZONE). Karl Ingram misses. Offensive rebound by James LaVine! James LaVine's putback is no good. Rebound secured by Austin Simons.

[07:01] Team_007 possession (Score: 99-76)
FOUL! Holding foul on Kobe Curry. [Team fouls: 3] No free throws, side out. (Kobe Curry: 1 personal fouls)

[06:48] Team_007 possession (Score: 99-76)
Gary LaVine drives to the basket... Gary LaVine loses control! Ball rolls out of bounds! TURNOVER! (dead ball)

[06:33] Team_079 possession (Score: 99-76)
FOUL! Reach-in foul on Gary LaVine during the drive. [Team fouls: 2] No free throws, side out. (Gary LaVine: 1 personal fouls)

[06:23] Team_079 possession (Score: 99-76)
Kobe Curry attempts a Layup. Wide open! Draymond Harris is 7.9 feet away. [ZONE] KOBE CURRY MAKES IT! Assist: James LaVine
Score: 99-78

[06:08] Team_007 possession (Score: 99-78)
Wendell Poole attempts a Midrange. Contested by Evan Mobley (2.0 feet, MAN). Wendell Poole misses. Rebound secured by Kobe Curry.

[05:49] Team_079 possession (Score: 99-78)
Evan Mobley attempts a 3Pt. Contested by Austin Simons (5.5 feet, ZONE). Evan Mobley misses. Rebound secured by Gary LaVine.

[05:36] Team_007 possession (Score: 99-78)
FOUL! Reach-in foul on Kobe Curry during the drive. [Team fouls: 4] No free throws, side out. (Kobe Curry: 2 personal fouls)

[05:19] Team_007 possession (Score: 99-78)
OG Porzingis attempts a Midrange. Contested by Karl Ingram (5.2 feet, MAN). OG Porzingis misses. Rebound secured by Kobe Curry.

[05:02] Team_079 possession (Score: 99-78)
Karl Ingram attempts a 3Pt. Wide open! OG Porzingis is 7.6 feet away. [ZONE] KARL INGRAM MAKES IT! Assist: James LaVine
Score: 99-81

[04:53] Team_007 possession (Score: 99-81)
FOUL! Shooting foul on Kobe Curry. Wendell Poole to the line for 2 free throws. [BONUS: 5 team fouls] (Kobe Curry: 3 personal fouls)   FT 1/2: GOOD   FT 2/2: GOOD Wendell Poole makes 2/2 from the line.
Score: 101-81

[04:42] Team_079 possession (Score: 101-81)
Karl Ingram attempts a 3Pt. Contested by OG Porzingis (5.6 feet, MAN). Karl Ingram misses. Rebound secured by Austin Simons.

[04:31] Team_007 possession (Score: 101-81)
OG Porzingis attempts a Layup. Contested by Karl Ingram (5.1 feet, MAN). OG Porzingis misses. Offensive rebound by Austin Simons! Austin Simons puts it back in!
Score: 103-81

[04:18] Team_079 possession (Score: 103-81)
FOUL! Shooting foul on Austin Simons. Anthony Wade to the line for 2 free throws. [Team fouls: 3] (Austin Simons: 1 personal fouls)   FT 1/2: GOOD   FT 2/2: GOOD Anthony Wade makes 2/2 from the line.
Score: 103-83

[04:04] Team_007 possession (Score: 103-83)
Wendell Poole attempts a Midrange. Wide open! Karl Ingram is 8.0 feet away. [ZONE] WENDELL POOLE MAKES IT!
Score: 105-83

[03:46] Team_079 possession (Score: 105-83)
Kobe Curry drives, picks up Austin Simons. Help arrives from OG Porzingis! Kobe Curry attempts a Dunk. Wide open! OG Porzingis is 6.5 feet away. [MAN] KOBE CURRY MAKES IT!
Score: 105-85

[03:31] Team_007 possession (Score: 105-85)
Austin Simons drives to the basket... Austin Simons throws a bad pass! Stolen by Kobe Curry! TURNOVER! (live ball)

[03:15] Team_079 possession (Score: 105-85)
Evan Mobley throws a bad pass out of bounds! TURNOVER! (dead ball)

[03:01] Team_007 possession (Score: 105-85)
OG Porzingis attempts a 3Pt. Contested by Evan Mobley (3.0 feet, ZONE). OG PORZINGIS MAKES IT! Assist: Wendell Poole
Score: 108-85

[02:48] Team_079 possession (Score: 108-85)
James LaVine attempts a Layup. Contested by Draymond Harris (5.7 feet, MAN). James LaVine misses. Rebound secured by Draymond Harris.

[02:31] Team_007 possession (Score: 108-85)
OG Porzingis attempts a 3Pt. Contested by Karl Ingram (2.6 feet, ZONE). OG PORZINGIS MAKES IT! Assist: Wendell Poole
Score: 111-85

[02:16] Team_079 possession (Score: 111-85)
FOUL! Shooting foul on OG Porzingis. Karl Ingram to the line for 3 free throws. [Team fouls: 4] (OG Porzingis: 1 personal fouls)   FT 1/3: GOOD   FT 2/3: GOOD   FT 3/3: GOOD Karl Ingram makes 3/3 from the line.
Score: 111-88

[01:58] Team_007 possession (Score: 111-88)
OG Porzingis attempts a Layup. Wide open! Karl Ingram is 6.7 feet away. [MAN] OG PORZINGIS MAKES IT! Assist: Gary LaVine
Score: 113-88

[01:41] Team_079 possession (Score: 113-88)
James LaVine drives, Draymond Harris stays with him. James LaVine attempts a Layup. Contested by Draymond Harris (5.1 feet, MAN). JAMES LAVINE MAKES IT! Assist: Karl Ingram
Score: 113-90

[01:27] Team_007 possession (Score: 113-90)
Wendell Poole drives, picks up Evan Mobley. Help arrives from Karl Ingram! Wendell Poole attempts a Dunk. Wide open! Karl Ingram is 7.1 feet away. [MAN] WENDELL POOLE MAKES IT! Assist: Gary LaVine
Score: 115-90

[01:13] Team_079 possession (Score: 115-90)
James LaVine attempts a 3Pt. Contested by Draymond Harris (4.5 feet, MAN). James LaVine misses. Rebound secured by Gary LaVine.

[01:00] Team_007 possession (Score: 115-90)
OG Porzingis attempts a 3Pt. Wide open! Karl Ingram is 6.6 feet away. [ZONE] OG PORZINGIS MAKES IT! Assist: Wendell Poole
Score: 118-90

[00:50] Team_079 possession (Score: 118-90)
James LaVine throws a bad pass! Stolen by Draymond Harris! TURNOVER! (live ball)

[00:32] Team_007 possession (Score: 118-90)
Wendell Poole drives and kicks out. FOUL! Shooting foul on Karl Ingram. Austin Simons to the line for 2 free throws. [BONUS: 6 team fouls] (Karl Ingram: 1 personal fouls)   FT 1/2: GOOD   FT 2/2: MISS Austin Simons makes 1/2 from the line. Offensive rebound by Draymond Harris! Draymond Harris kicks it out.
Score: 119-90

[00:18] Team_007 possession (Score: 119-90)
FOUL! Shooting foul on James LaVine. OG Porzingis to the line for 2 free throws. [BONUS: 7 team fouls] (James LaVine: 1 personal fouls)   FT 1/2: GOOD   FT 2/2: GOOD OG Porzingis makes 2/2 from the line.
Score: 121-90

[00:02] Team_079 possession (Score: 121-90)
Kobe Curry drives and kicks out. Karl Ingram attempts a 3Pt. Contested by OG Porzingis (4.5 feet, ZONE). KARL INGRAM MAKES IT! Assist: Kobe Curry
Score: 121-93

================================================================================
                              4TH QUARTER COMPLETE                              
================================================================================

4TH QUARTER SCORE: Team_007 37, Team_079 28

BOX SCORE:
================================================================================

Team_007
--------------------------------------------------------------------------------
Player                MIN  PTS  REB  AST  TO      FG   FG%      3P   3P%
--------------------------------------------------------------------------------
OG Porzingis           18   13    0    0   0   5/6    83.3     0/0   0.0
Wendell Poole          18    6    0    3   0   3/4    75.0     0/0   0.0
Tobias Johnson         30    5    0    0   0   2/2   100.0     0/0   0.0
John Quickley          30    4    2    0   0   2/2   100.0     0/0   0.0
Carmelo Siakam         30    3    3    0   0   1/2    50.0     0/0   0.0
Jaren Dosunmu          30    3    0    0   0   1/3    33.3     0/0   0.0
Austin Simons          18    2    3    0   0   1/1   100.0     0/0   0.0
Bones Siakam           30    0    0    1   0   0/1     0.0     0/0   0.0
Gary LaVine            18    0    2    2   0   0/0     0.0     0/0   0.0
Draymond Harris        18    0    2    0   0   0/0     0.0     0/0   0.0

TEAM: FG: 15/21 (71.4%), 3PT: 6/7 (85.7%), REB: 11 (2 off, 9 def), AST: 6, TO: 3
TEAM FOULS: 4


Team_079
--------------------------------------------------------------------------------
Player                MIN  PTS  REB  AST  TO      FG   FG%      3P   3P%
--------------------------------------------------------------------------------
Karl Ingram            18    9    0    1   0   3/5    60.0     0/0   0.0
Bam Randle             30    4    1    0   0   2/2   100.0     0/0   0.0
Kobe Curry             18    4    2    1   0   2/2   100.0     0/0   0.0
Khris Embiid           30    3    0    2   0   1/3    33.3     0/0   0.0
Donovan Randle         30    2    3    1   0   1/1   100.0     0/0   0.0
Miles Ming             30    2    0    0   0   1/2    50.0     0/0   0.0
James LaVine           18    2    0    2   0   1/3    33.3     0/0   0.0
Anthony Wade           18    2    0    0   0   1/1   100.0     0/0   0.0
Trae Durant            30    0    0    1   0   0/2     0.0     0/0   0.0
Evan Mobley            18    0    0    0   0   0/1     0.0     0/0   0.0

TEAM: FG: 12/22 (54.5%), 3PT: 2/9 (22.2%), REB: 7 (1 off, 6 def), AST: 8, TO: 2
TEAM FOULS: 7 [Team_007 in BONUS]

================================================================================

================================================================================
                               FULL GAME COMPLETE                               
================================================================================

FINAL SCORE: Team_007 121, Team_079 93

SCORING BY QUARTER:
--------------------------------------------------------------------------------
Team                     Q1     Q2     Q3     Q4    FINAL
--------------------------------------------------------------------------------
Team_007                 28     27     29     37      121
Team_079                 14     26     25     28       93
--------------------------------------------------------------------------------

FULL GAME BOX SCORE:
================================================================================

Team_007
--------------------------------------------------------------------------------
Player                MIN  PTS  REB  AST  TO      FG   FG%      3P   3P%      FT STL BLK
--------------------------------------------------------------------------------
Tobias Johnson         30   20    0    2   1   9/11   81.8   3/5    60.0   6/6     1   0
Jaren Dosunmu          30   14    0    2   2   6/13   46.2   3/8    37.5   1/2     0   0
Bones Siakam           30    9   15    1   0   3/5    60.0   1/1   100.0   0/0     1   0
John Quickley          30    8    5    1   0   8/14   57.1   2/3    66.7   2/3     2   0
Carmelo Siakam         30   20   14    3   2   4/9    44.4   1/2    50.0   6/7     0   0
Wendell Poole          18   12    0    5   0   5/8    62.5   2/2   100.0   3/4     0   0
OG Porzingis           18   16    0    1   0   7/12   58.3   4/7    57.1   2/2     1   0
Gary LaVine            18    2    5    4   1   1/3    33.3   0/1     0.0   0/0     1   0
Austin Simons          18   11    5    1   0   4/5    80.0   1/2    50.0   1/2     0   0
Draymond Harris        18    4    5    1   2   2/3    66.7   0/0     0.0   2/2     1   0

TEAM: FG: 49/83 (59.0%), 3PT: 17/31 (54.8%), REB: 48 (14 off, 34 def), AST: 21, TO: 8


Team_079
--------------------------------------------------------------------------------
Player                MIN  PTS  REB  AST  TO      FG   FG%      3P   3P%      FT STL BLK
--------------------------------------------------------------------------------
Khris Embiid           30   11    0    2   0   5/9    55.6   1/4    25.0   3/4     0   0
Miles Ming             30   10    0    1   4   4/7    57.1   2/3    66.7   0/0     1   1
Bam Randle             30    9    8    2   1   4/8    50.0   1/4    25.0   3/3     0   0
Trae Durant            30   12   11    3   1   4/12   33.3   1/6    16.7   3/4     0   2
Donovan Randle         30    8    9    1   4   4/9    44.4   0/0     0.0   2/4     0   1
Evan Mobley            18    0    0    3   1   0/2     0.0   0/2     0.0   0/0     0   0
Karl Ingram            18   15    0    2   1   3/8    37.5   3/8    37.5   3/3     0   0
Anthony Wade           18    4    3    2   1   2/3    66.7   0/0     0.0   2/2     0   0
Kobe Curry             18   12    7    3   0   6/7    85.7   2/2   100.0   2/2     2   1
James LaVine           18   10    3    2   3   6/9    66.7   0/1     0.0   0/0     0   0

TEAM: FG: 38/74 (51.4%), 3PT: 10/30 (33.3%), REB: 41 (9 off, 32 def), AST: 21, TO: 16

================================================================================
