================================================================================
                        FULL GAME - Team_069 vs Team_078                        
================================================================================

================================================================================
                       1ST QUARTER - Team_069 vs Team_078                       
================================================================================

[12:00] Team_069 possession (Score: 0-0)
Pau Middleton attempts a 3Pt. Contested by Isaiah Simmons (2.2 feet, MAN). PAU MIDDLETON MAKES IT! Assist: CJ Fox
Score: 3-0

[11:42] Team_078 possession (Score: 3-0)
Kyrie Carter attempts a 3Pt. Contested by Domantas Lowry (5.9 feet, MAN). Kyrie Carter misses. Rebound secured by Domantas Towns.

[11:26] Team_069 possession (Score: 3-0)
Pau Middleton attempts a Layup. BLOCKED BY JABARI BARRETT! Ball deflects out of bounds off Pau Middleton.

[11:08] Team_078 possession (Score: 3-0)
Kyrie Carter drives to the basket... Kyrie Carter loses control! Ball rolls out of bounds! TURNOVER! (dead ball)

[10:57] Team_069 possession (Score: 3-0)
FOUL! Reach-in foul on Jabari Barrett during the drive. [Team fouls: 1] No free throws, side out. (Jabari Barrett: 1 personal fouls)

[10:43] Team_069 possession (Score: 3-0)
James Sexton attempts a Layup. Contested by Jabari Barnes (4.7 feet, MAN). JAMES SEXTON MAKES IT! Assist: CJ Fox
Score: 5-0

[10:31] Team_078 possession (Score: 5-0)
Ben Ginobili drives to the basket... Ben Ginobili loses the ball! Stripped by Domantas Towns! TURNOVER! (live ball)

[10:16] Team_069 possession (Score: 5-0)
CJ Fox attempts a Layup. Wide open! Jabari Barrett is 7.1 feet away. [ZONE] CJ Fox misses. Rebound secured by Ben Ginobili.

[10:01] Team_078 possession (Score: 5-0)
Isaiah Simmons commits a violation (traveling/carry)! TURNOVER! (dead ball)

[09:46] Team_069 possession (Score: 5-0)
James Sexton drives and kicks out. Pau Middleton attempts a 3Pt. Heavily contested by Isaiah Simmons (1.5 feet, MAN)! Pau Middleton misses. Rebound secured by Ben Ginobili.

[09:30] Team_078 possession (Score: 5-0)
Ben Ginobili attempts a Layup. BLOCKED BY DOMANTAS TOWNS! Ball deflects out of bounds off Ben Ginobili.

[09:17] Team_069 possession (Score: 5-0)
James Sexton attempts a 3Pt. Contested by Jabari Barnes (2.3 feet, MAN). James Sexton misses. Rebound secured by Ben Ginobili.

[09:01] Team_078 possession (Score: 5-0)
Jabari Barnes drives, picks up James Sexton. Help arrives from Pau Middleton! Jabari Barnes attempts a Dunk. Contested by Pau Middleton (5.0 feet, MAN). Jabari Barnes misses. Offensive rebound by Jabari Barrett! Jabari Barrett kicks it out.

[08:47] Team_078 possession (Score: 5-0)
Ben Ginobili drives and kicks out. FOUL! Shooting foul on Pau Middleton. Jabari Barrett to the line for 2 free throws. [Team fouls: 1] (Pau Middleton: 1 personal fouls)   FT 1/2: GOOD   FT 2/2: GOOD Jabari Barrett makes 2/2 from the line.
Score: 5-2

[08:29] Team_069 possession (Score: 5-2)
FOUL! Shooting foul on Kyrie Carter. Domantas Towns to the line for 2 free throws. [Team fouls: 2] (Kyrie Carter: 1 personal fouls)   FT 1/2: MISS   FT 2/2: GOOD Domantas Towns makes 1/2 from the line.
Score: 6-2

[08:11] Team_078 possession (Score: 6-2)
Jabari Barnes drives and kicks out. Isaiah Simmons attempts a Midrange. BLOCKED BY PAU MIDDLETON! Ball deflects out of bounds off Isaiah Simmons.

[07:57] Team_069 possession (Score: 6-2)
CJ Fox drives, picks up Jabari Barrett. Help arrives from Kyrie Carter! CJ Fox attempts a Dunk. Contested by Kyrie Carter (4.1 feet, ZONE). CJ FOX MAKES IT! Assist: Domantas Lowry
Score: 8-2

[07:42] Team_078 possession (Score: 8-2)
Kyrie Carter drives and kicks out. Ben Ginobili attempts a 3Pt. Wide open! Domantas Towns is 9.2 feet away. [MAN] BEN GINOBILI MAKES IT! Assist: Jabari Barnes
Score: 8-5

[07:31] Team_069 possession (Score: 8-5)
CJ Fox drives to the basket... CJ Fox loses the ball! Stripped by Jabari Barrett! TURNOVER! (live ball)

[07:22] Team_078 possession (Score: 8-5)
Jabari Barrett drives and kicks out. Ben Ginobili attempts a 3Pt. Contested by Domantas Towns (3.0 feet, MAN). Ben Ginobili misses. Rebound secured by CJ Fox.

[07:09] Team_069 possession (Score: 8-5)
FOUL! Holding foul on Jabari Barrett. [Team fouls: 3] No free throws, side out. (Jabari Barrett: 2 personal fouls)

[06:51] Team_069 possession (Score: 8-5)
James Sexton attempts a 3Pt. Contested by Jabari Barnes (2.7 feet, MAN). James Sexton misses. Rebound secured by Jabari Barrett.

[06:40] Team_078 possession (Score: 8-5)
Kyrie Carter drives, picks up Domantas Lowry. Help arrives from James Sexton! Kyrie Carter attempts a Layup. Wide open! James Sexton is 7.1 feet away. [MAN] Kyrie Carter misses. Rebound secured by Pau Middleton.

[06:29] Team_069 possession (Score: 8-5)
Domantas Lowry makes the Layup and draws the foul on Kyrie Carter! And-1! Domantas Lowry to the line for 1. [Team fouls: 4] (Kyrie Carter: 2 personal fouls)   FT 1/1: GOOD Domantas Lowry makes 1/1 from the line.
Score: 11-5

[06:12] Team_078 possession (Score: 11-5)
Jabari Barnes drives, James Sexton stays with him. Jabari Barnes attempts a Dunk. Contested by James Sexton (5.1 feet, MAN). JABARI BARNES MAKES IT! Assist: Ben Ginobili
Score: 11-7

[06:00] Team_069 possession (Score: 11-7)
Domantas Lowry attempts a Midrange. Wide open! Jabari Barrett is 6.3 feet away. [ZONE] DOMANTAS LOWRY MAKES IT! Assist: James Sexton
Score: 13-7

[05:46] Team_078 possession (Score: 13-7)
Jabari Barnes attempts a Midrange. Wide open! Domantas Lowry is 7.7 feet away. [ZONE] Jabari Barnes misses. Rebound secured by CJ Fox.

[05:33] Team_069 possession (Score: 13-7)
FOUL! Shooting foul on Kyrie Carter. Domantas Towns to the line for 2 free throws. [BONUS: 5 team fouls] (Kyrie Carter: 3 personal fouls)   FT 1/2: MISS   FT 2/2: GOOD Domantas Towns makes 1/2 from the line.
Score: 14-7

[05:24] Team_078 possession (Score: 14-7)
Jabari Barrett attempts a Layup. Contested by Domantas Towns (5.6 feet, ZONE). Jabari Barrett misses. Offensive rebound by Jabari Barrett! Jabari Barrett kicks it out.

[05:10] Team_078 possession (Score: 14-7)
Jabari Barnes drives, Domantas Towns stays with him. Jabari Barnes attempts a Dunk. Wide open! Domantas Towns is 7.0 feet away. [ZONE] JABARI BARNES MAKES IT! Assist: Kyrie Carter
Score: 14-9

[04:55] Team_069 possession (Score: 14-9)
CJ Fox drives and kicks out. James Sexton attempts a 3Pt. Contested by Jabari Barnes (4.3 feet, MAN). James Sexton misses. Offensive rebound by CJ Fox! CJ Fox kicks it out.

[04:36] Team_069 possession (Score: 14-9)
CJ Fox attempts a Layup. Contested by Jabari Barrett (4.3 feet, ZONE). CJ FOX MAKES IT! Assist: Domantas Lowry
Score: 16-9

[04:22] Team_078 possession (Score: 16-9)
Jabari Barrett makes the Layup and draws the foul on CJ Fox! And-1! Jabari Barrett to the line for 1. [Team fouls: 2] (CJ Fox: 1 personal fouls)   FT 1/1: GOOD Jabari Barrett makes 1/1 from the line.
Score: 16-12

[04:09] Team_069 possession (Score: 16-12)
Domantas Lowry drives, picks up Kyrie Carter. Help arrives from Isaiah Simmons! Domantas Lowry attempts a Layup. Contested by Isaiah Simmons (3.4 feet, MAN). Domantas Lowry misses. Rebound secured by Jabari Barrett.

[03:52] Team_078 possession (Score: 16-12)
Kyrie Carter attempts a 3Pt. Contested by Domantas Lowry (2.2 feet, MAN). Kyrie Carter misses. Rebound secured by Pau Middleton.

[03:35] Team_069 possession (Score: 16-12)
Pau Middleton drives, picks up Jabari Barrett. Help arrives from Kyrie Carter! Pau Middleton attempts a Dunk. Contested by Kyrie Carter (3.5 feet, ZONE). Pau Middleton misses. Offensive rebound by CJ Fox! CJ Fox kicks it out.

[03:20] Team_069 possession (Score: 16-12)
CJ Fox attempts a 3Pt. Wide open! Isaiah Simmons is 7.7 feet away. [ZONE] CJ Fox misses. Offensive rebound by CJ Fox! CJ Fox kicks it out.

[03:06] Team_069 possession (Score: 16-12)
FOUL! Reach-in foul on Jabari Barrett during the drive. [IN THE BONUS! 6 team fouls] CJ Fox to the line for 2 free throws. (Jabari Barrett: 3 personal fouls)   FT 1/2: GOOD   FT 2/2: MISS CJ Fox makes 1/2 from the line. Offensive rebound by CJ Fox! CJ Fox kicks it out.
Score: 17-12

[02:47] Team_069 possession (Score: 17-12)
CJ Fox attempts a Layup. Wide open! Jabari Barrett is 7.9 feet away. [ZONE] CJ Fox misses. Offensive rebound by Domantas Towns! Domantas Towns kicks it out.

[02:32] Team_069 possession (Score: 17-12)
Domantas Towns drives to the basket... Domantas Towns throws a bad pass out of bounds! TURNOVER! (dead ball)

[02:32] Substitution (Team_069): James Sexton OUT → Jarrett Murray IN (stamina_rule2)

[02:32] Substitution (Team_069): Pau Middleton OUT → Tyrese Simons IN (stamina_rule2)

[02:32] Substitution (Team_069): Domantas Towns OUT → Devin Giddey IN (stamina_rule2)

[02:32] Substitution (Team_069): CJ Fox OUT → Shai Quickley IN (stamina_rule2)

[02:32] Substitution (Team_078): Jabari Barnes OUT → Magic Barrett IN (stamina_rule2)

[02:32] Substitution (Team_078): Ben Ginobili OUT → Paul Ming IN (stamina_rule2)

[02:32] Substitution (Team_078): Jabari Barrett OUT → Draymond Irving IN (stamina_rule2)

[02:14] Team_078 possession (Score: 17-12)
Isaiah Simmons attempts a 3Pt. Contested by Tyrese Simons (3.4 feet, ZONE). Isaiah Simmons misses. Rebound secured by Domantas Lowry.

[01:54] Team_069 possession (Score: 17-12)
Jarrett Murray attempts a 3Pt. Wide open! Magic Barrett is 6.4 feet away. [MAN] JARRETT MURRAY MAKES IT! Assist: Devin Giddey
Score: 20-12

[01:38] Team_078 possession (Score: 20-12)
Isaiah Simmons attempts a Layup. Contested by Devin Giddey (5.2 feet, ZONE). ISAIAH SIMMONS MAKES IT!
Score: 20-14

[01:26] Team_069 possession (Score: 20-14)
Shai Quickley attempts a 3Pt. Contested by Draymond Irving (2.8 feet, MAN). Shai Quickley misses. FOUL! Loose ball foul on Draymond Irving during the rebound battle. [IN THE BONUS! 7 team fouls] Shai Quickley to the line for 2 free throws. (Draymond Irving: 1 personal fouls)   FT 1/2: GOOD   FT 2/2: MISS Shai Quickley makes 1/2 from the line. Rebound secured by Isaiah Simmons.
Score: 21-14

[01:14] Team_078 possession (Score: 21-14)
FOUL! Shooting foul on Devin Giddey. Magic Barrett to the line for 3 free throws. [Team fouls: 3] (Devin Giddey: 1 personal fouls)   FT 1/3: GOOD   FT 2/3: MISS   FT 3/3: GOOD Magic Barrett makes 2/3 from the line.
Score: 21-16

[00:56] Team_069 possession (Score: 21-16)
FOUL! Shooting foul on Paul Ming. Tyrese Simons to the line for 2 free throws. [BONUS: 8 team fouls] (Paul Ming: 1 personal fouls)   FT 1/2: MISS   FT 2/2: MISS Tyrese Simons makes 0/2 from the line. Rebound secured by Draymond Irving.

[00:40] Team_078 possession (Score: 21-16)
Isaiah Simmons attempts a Layup. Contested by Tyrese Simons (4.1 feet, MAN). ISAIAH SIMMONS MAKES IT! Assist: Paul Ming
Score: 21-18

[00:29] Team_069 possession (Score: 21-18)
Domantas Lowry attempts a 3Pt. Contested by Kyrie Carter (3.6 feet, MAN). DOMANTAS LOWRY MAKES IT!
Score: 24-18

[00:10] Team_078 possession (Score: 24-18)
Paul Ming drives, picks up Devin Giddey. Help arrives from Domantas Lowry! Paul Ming attempts a Layup. Contested by Domantas Lowry (6.0 feet, MAN). PAUL MING MAKES IT! Assist: Isaiah Simmons
Score: 24-20

================================================================================
                              1ST QUARTER COMPLETE                              
================================================================================

1ST QUARTER SCORE: Team_069 24, Team_078 20

BOX SCORE:
================================================================================

Team_069
--------------------------------------------------------------------------------
Player                MIN  PTS  REB  AST  TO      FG   FG%      3P   3P%
--------------------------------------------------------------------------------
Domantas Lowry         12    8    1    2   0   3/4    75.0     0/0   0.0
CJ Fox                 10    4    6    2   0   2/3    66.7     0/0   0.0
Pau Middleton          10    3    2    0   0   1/2    50.0     0/0   0.0
Jarrett Murray          2    3    0    0   0   1/1   100.0     0/0   0.0
Domantas Towns         10    2    2    0   0   2/2   100.0     0/0   0.0
James Sexton           10    2    0    1   0   1/4    25.0     0/0   0.0
Devin Giddey            2    0    0    1   0   0/0     0.0     0/0   0.0
Shai Quickley           2    0    0    0   0   0/1     0.0     0/0   0.0
Tyrese Simons           2    0    0    0   0   0/1     0.0     0/0   0.0

TEAM: FG: 10/18 (55.6%), 3PT: 3/6 (50.0%), REB: 12 (6 off, 6 def), AST: 6, TO: 2
TEAM FOULS: 3


Team_078
--------------------------------------------------------------------------------
Player                MIN  PTS  REB  AST  TO      FG   FG%      3P   3P%
--------------------------------------------------------------------------------
Jabari Barrett         10    5    4    0   0   2/3    66.7     0/0   0.0
Jabari Barnes          10    4    0    1   0   2/4    50.0     0/0   0.0
Isaiah Simmons         12    4    1    1   0   2/3    66.7     0/0   0.0
Ben Ginobili           10    3    3    1   0   1/2    50.0     0/0   0.0
Magic Barrett           2    2    0    0   0   1/1   100.0     0/0   0.0
Paul Ming               2    2    0    1   0   1/1   100.0     0/0   0.0
Kyrie Carter           12    0    0    1   0   0/3     0.0     0/0   0.0
Draymond Irving         2    0    1    0   0   0/0     0.0     0/0   0.0

TEAM: FG: 9/17 (52.9%), 3PT: 1/4 (25.0%), REB: 8 (2 off, 6 def), AST: 5, TO: 3
TEAM FOULS: 8 [Team_069 in BONUS]

================================================================================

================================================================================
                       2ND QUARTER - Team_069 vs Team_078                       
================================================================================

[12:00] Team_069 possession (Score: 24-20)
Domantas Towns attempts a Midrange. Contested by Ben Ginobili (3.4 feet, MAN). Domantas Towns misses. Rebound secured by Ben Ginobili.

[11:49] Team_078 possession (Score: 24-20)
Isaiah Simmons attempts a Layup. Contested by Domantas Towns (4.2 feet, ZONE). ISAIAH SIMMONS MAKES IT!
Score: 24-22

[11:36] Team_069 possession (Score: 24-22)
Domantas Lowry attempts a Layup. Wide open! Jabari Barrett is 6.3 feet away. [ZONE] DOMANTAS LOWRY MAKES IT! Assist: Domantas Towns
Score: 26-22

[11:22] Team_078 possession (Score: 26-22)
Jabari Barrett drives, Domantas Towns stays with him. Jabari Barrett attempts a Dunk. Contested by Domantas Towns (5.4 feet, ZONE). JABARI BARRETT MAKES IT! Assist: Ben Ginobili
Score: 26-24

[11:11] Team_069 possession (Score: 26-24)
Pau Middleton attempts a 3Pt. Contested by Isaiah Simmons (3.4 feet, MAN). Pau Middleton misses. Rebound secured by Isaiah Simmons.

[10:54] Team_078 possession (Score: 26-24)
FOUL! Holding foul on James Sexton. [Team fouls: 1] No free throws, side out. (James Sexton: 1 personal fouls)

[10:35] Team_078 possession (Score: 26-24)
Ben Ginobili attempts a Midrange. Contested by Domantas Lowry (2.2 feet, ZONE). Ben Ginobili misses. Offensive rebound by Jabari Barrett! Jabari Barrett kicks it out.

[10:20] Team_078 possession (Score: 26-24)
Kyrie Carter attempts a Midrange. Contested by Domantas Lowry (2.7 feet, MAN). Kyrie Carter misses. Offensive rebound by Jabari Barrett! Jabari Barrett kicks it out.

[10:06] Team_078 possession (Score: 26-24)
Isaiah Simmons drives, Domantas Towns stays with him. Isaiah Simmons attempts a Dunk. Contested by Domantas Towns (5.9 feet, ZONE). ISAIAH SIMMONS MAKES IT! Assist: Jabari Barnes
Score: 26-26

[09:53] Team_069 possession (Score: 26-26)
James Sexton attempts a 3Pt. Wide open! Isaiah Simmons is 8.0 feet away. [ZONE] James Sexton misses. Rebound secured by Isaiah Simmons.

[09:40] Team_078 possession (Score: 26-26)
FOUL! Reach-in foul on Domantas Towns during the drive. [Team fouls: 2] No free throws, side out. (Domantas Towns: 1 personal fouls)

[09:27] Team_078 possession (Score: 26-26)
Kyrie Carter attempts a 3Pt. Contested by James Sexton (3.5 feet, ZONE). Kyrie Carter misses. Rebound secured by Domantas Towns.

[09:10] Team_069 possession (Score: 26-26)
CJ Fox attempts a Layup. Contested by Jabari Barrett (4.4 feet, ZONE). CJ FOX MAKES IT! Assist: Pau Middleton
Score: 28-26

[08:54] Team_078 possession (Score: 28-26)
Jabari Barnes loses the ball! Stripped by James Sexton! TURNOVER! (live ball)

[08:39] Team_069 possession (Score: 28-26)
Domantas Towns makes the Layup and draws the foul on Jabari Barrett! And-1! Domantas Towns to the line for 1. [Team fouls: 1] (Jabari Barrett: 1 personal fouls)   FT 1/1: MISS Domantas Towns makes 0/1 from the line. Rebound secured by Ben Ginobili.
Score: 30-26

[08:25] Team_078 possession (Score: 30-26)
FOUL! Offensive foul on Jabari Barrett! CJ Fox drew the charge! [Team fouls: 2] (Jabari Barrett: 2 personal fouls) TURNOVER! (dead ball)

[08:11] Team_069 possession (Score: 30-26)
Domantas Lowry attempts a Midrange. Contested by Kyrie Carter (5.0 feet, MAN). DOMANTAS LOWRY MAKES IT!
Score: 32-26

[07:55] Team_078 possession (Score: 32-26)
Isaiah Simmons attempts a Layup. Wide open! Domantas Towns is 6.4 feet away. [ZONE] Isaiah Simmons misses. Rebound secured by CJ Fox.

[07:37] Team_069 possession (Score: 32-26)
Domantas Towns attempts a Midrange. Contested by Ben Ginobili (5.6 feet, MAN). DOMANTAS TOWNS MAKES IT! Assist: James Sexton
Score: 34-26

[07:25] Team_078 possession (Score: 34-26)
Kyrie Carter throws a bad pass! Stolen by Domantas Lowry! TURNOVER! (live ball)

[07:11] Team_069 possession (Score: 34-26)
Domantas Lowry attempts a Layup. Contested by Kyrie Carter (5.8 feet, MAN). DOMANTAS LOWRY MAKES IT! Assist: CJ Fox
Score: 36-26

[06:55] Team_078 possession (Score: 36-26)
Jabari Barnes attempts a 3Pt. Contested by James Sexton (4.7 feet, ZONE). Jabari Barnes misses. Rebound secured by CJ Fox.

[06:42] Team_069 possession (Score: 36-26)
Domantas Towns attempts a Layup. Wide open! Jabari Barrett is 6.2 feet away. [ZONE] DOMANTAS TOWNS MAKES IT!
Score: 38-26

[06:30] Team_078 possession (Score: 38-26)
Ben Ginobili makes the Layup and draws the foul on Domantas Towns! And-1! Ben Ginobili to the line for 1. [Team fouls: 3] (Domantas Towns: 2 personal fouls)   FT 1/1: GOOD Ben Ginobili makes 1/1 from the line.
Score: 38-29

[06:16] Team_069 possession (Score: 38-29)
FOUL! Shooting foul on Kyrie Carter. Domantas Lowry to the line for 2 free throws. [Team fouls: 3] (Kyrie Carter: 1 personal fouls)   FT 1/2: GOOD   FT 2/2: GOOD Domantas Lowry makes 2/2 from the line.
Score: 40-29

[06:03] Team_078 possession (Score: 40-29)
Isaiah Simmons attempts a Midrange. Contested by Domantas Lowry (5.6 feet, ZONE). ISAIAH SIMMONS MAKES IT!
Score: 40-31

[05:49] Team_069 possession (Score: 40-31)
Domantas Towns attempts a Midrange. Contested by Jabari Barrett (2.0 feet, ZONE). Domantas Towns misses. Rebound secured by Jabari Barrett.

[05:33] Team_078 possession (Score: 40-31)
Kyrie Carter drives to the basket... Kyrie Carter loses control! Ball rolls out of bounds! TURNOVER! (dead ball)

[05:33] Substitution (Team_069): James Sexton OUT → Jarrett Murray IN (stamina_rule2)

[05:33] Substitution (Team_069): Domantas Lowry OUT → Trae Antetokounmpo IN (stamina_rule2)

[05:33] Substitution (Team_069): Pau Middleton OUT → Tyrese Simons IN (stamina_rule2)

[05:33] Substitution (Team_069): Domantas Towns OUT → Devin Giddey IN (stamina_rule2)

[05:33] Substitution (Team_069): CJ Fox OUT → Shai Quickley IN (stamina_rule2)

[05:33] Substitution (Team_078): Jabari Barnes OUT → Magic Barrett IN (stamina_rule2)

[05:33] Substitution (Team_078): Kyrie Carter OUT → Damian Allen IN (stamina_rule2)

[05:33] Substitution (Team_078): Isaiah Simmons OUT → Malcolm Randle IN (stamina_rule2)

[05:33] Substitution (Team_078): Ben Ginobili OUT → Paul Ming IN (stamina_rule2)

[05:33] Substitution (Team_078): Jabari Barrett OUT → Draymond Irving IN (stamina_rule2)

[05:19] Team_069 possession (Score: 40-31)
FOUL! Reach-in foul on Paul Ming during the drive. [Team fouls: 4] No free throws, side out. (Paul Ming: 1 personal fouls)

[05:07] Team_069 possession (Score: 40-31)
Trae Antetokounmpo attempts a 3Pt. BLOCKED BY DAMIAN ALLEN! Ball is loose! Rebound secured by Draymond Irving.

[04:52] Team_078 possession (Score: 40-31)
Draymond Irving attempts a Layup. Heavily contested by Shai Quickley (1.9 feet, MAN)! DRAYMOND IRVING MAKES IT! Assist: Paul Ming
Score: 40-33

[04:34] Team_069 possession (Score: 40-33)
Tyrese Simons attempts a Layup. BLOCKED BY DAMIAN ALLEN! Ball goes out off Damian Allen. Tyrese Simons's ball!

[04:19] Team_069 possession (Score: 40-33)
Jarrett Murray drives, Magic Barrett stays with him. Jarrett Murray attempts a Layup. Wide open! Magic Barrett is 6.1 feet away. [MAN] JARRETT MURRAY MAKES IT!
Score: 42-33

[04:08] Team_078 possession (Score: 42-33)
Malcolm Randle drives and kicks out. Magic Barrett attempts a Midrange. Contested by Jarrett Murray (5.5 feet, MAN). MAGIC BARRETT MAKES IT!
Score: 42-35

[03:56] Team_069 possession (Score: 42-35)
Tyrese Simons attempts a 3Pt. Contested by Damian Allen (4.7 feet, ZONE). Tyrese Simons misses. Rebound secured by Paul Ming.

[03:37] Team_078 possession (Score: 42-35)
Damian Allen attempts a Midrange. Wide open! Tyrese Simons is 8.9 feet away. [ZONE] DAMIAN ALLEN MAKES IT!
Score: 42-37

[03:23] Team_069 possession (Score: 42-37)
Jarrett Murray attempts a Layup. Wide open! Magic Barrett is 6.2 feet away. [MAN] JARRETT MURRAY MAKES IT!
Score: 44-37

[03:06] Team_078 possession (Score: 44-37)
FOUL! Shooting foul on Trae Antetokounmpo. Damian Allen to the line for 2 free throws. [Team fouls: 4] (Trae Antetokounmpo: 1 personal fouls)   FT 1/2: GOOD   FT 2/2: GOOD Damian Allen makes 2/2 from the line.
Score: 44-39

[02:49] Team_069 possession (Score: 44-39)
FOUL! Reach-in foul on Draymond Irving during the drive. [IN THE BONUS! 5 team fouls] Shai Quickley to the line for 2 free throws. (Draymond Irving: 1 personal fouls)   FT 1/2: GOOD   FT 2/2: GOOD Shai Quickley makes 2/2 from the line.
Score: 46-39

[02:36] Team_078 possession (Score: 46-39)
FOUL! Reach-in foul on Devin Giddey during the drive. [IN THE BONUS! 5 team fouls] Draymond Irving to the line for 2 free throws. (Devin Giddey: 1 personal fouls)   FT 1/2: GOOD   FT 2/2: GOOD Draymond Irving makes 2/2 from the line.
Score: 46-41

[02:22] Team_069 possession (Score: 46-41)
Tyrese Simons attempts a Midrange. Contested by Paul Ming (3.7 feet, ZONE). Tyrese Simons misses. Rebound secured by Malcolm Randle.

[02:11] Team_078 possession (Score: 46-41)
Draymond Irving attempts a Layup. Contested by Shai Quickley (4.3 feet, MAN). Draymond Irving misses. Offensive rebound by Paul Ming! Paul Ming kicks it out.

[01:52] Team_078 possession (Score: 46-41)
Malcolm Randle attempts a 3Pt. Contested by Tyrese Simons (4.8 feet, ZONE). MALCOLM RANDLE MAKES IT!
Score: 46-44

[01:36] Team_069 possession (Score: 46-44)
Devin Giddey drives to the basket... Devin Giddey loses the ball! Stripped by Paul Ming! TURNOVER! (live ball)

[01:26] Team_078 possession (Score: 46-44)
Damian Allen attempts a Layup. Wide open! Trae Antetokounmpo is 6.9 feet away. [MAN] DAMIAN ALLEN MAKES IT! Assist: Magic Barrett
Score: 46-46

[01:15] Team_069 possession (Score: 46-46)
Trae Antetokounmpo throws a bad pass! Stolen by Damian Allen! TURNOVER! (live ball)

[00:57] Team_078 possession (Score: 46-46)
Paul Ming drives, picks up Devin Giddey. Help arrives from Trae Antetokounmpo! Paul Ming attempts a Dunk. Contested by Trae Antetokounmpo (5.7 feet, MAN). PAUL MING MAKES IT! Assist: Draymond Irving
Score: 46-48

[00:40] Team_069 possession (Score: 46-48)
Jarrett Murray drives and kicks out. Trae Antetokounmpo attempts a Midrange. Contested by Damian Allen (4.6 feet, ZONE). TRAE ANTETOKOUNMPO MAKES IT!
Score: 48-48

[00:25] Team_078 possession (Score: 48-48)
Paul Ming attempts a Layup. Contested by Devin Giddey (4.3 feet, MAN). Paul Ming misses. Rebound secured by Tyrese Simons.

[00:07] Team_069 possession (Score: 48-48)
Tyrese Simons attempts a Midrange. Contested by Malcolm Randle (4.1 feet, MAN). Tyrese Simons misses. FOUL! Loose ball foul on Draymond Irving during the rebound battle. [IN THE BONUS! 6 team fouls] Tyrese Simons to the line for 2 free throws. (Draymond Irving: 2 personal fouls)   FT 1/2: GOOD   FT 2/2: GOOD Tyrese Simons makes 2/2 from the line.
Score: 50-48

================================================================================
                              2ND QUARTER COMPLETE                              
================================================================================

2ND QUARTER SCORE: Team_069 26, Team_078 28

BOX SCORE:
================================================================================

Team_069
--------------------------------------------------------------------------------
Player                MIN  PTS  REB  AST  TO      FG   FG%      3P   3P%
--------------------------------------------------------------------------------
Domantas Lowry         19    8    0    0   0   4/4   100.0     0/0   0.0
Domantas Towns         16    4    1    1   0   2/5    40.0     0/0   0.0
Jarrett Murray          8    4    0    0   0   2/2   100.0     0/0   0.0
CJ Fox                 16    2    2    1   0   1/1   100.0     0/0   0.0
Trae Antetokounmpo      5    2    0    0   0   1/2    50.0     0/0   0.0
Tyrese Simons           8    2    1    0   0   1/3    33.3     0/0   0.0
Shai Quickley           8    2    0    0   0   1/1   100.0     0/0   0.0
Pau Middleton          16    0    0    1   0   0/1     0.0     0/0   0.0
James Sexton           16    0    0    1   0   0/1     0.0     0/0   0.0

TEAM: FG: 12/20 (60.0%), 3PT: 0/4 (0.0%), REB: 4 (0 off, 4 def), AST: 4, TO: 2
TEAM FOULS: 5 [Team_078 in BONUS]


Team_078
--------------------------------------------------------------------------------
Player                MIN  PTS  REB  AST  TO      FG   FG%      3P   3P%
--------------------------------------------------------------------------------
Isaiah Simmons         19    6    2    0   0   3/4    75.0     0/0   0.0
Damian Allen            5    6    0    0   0   3/3   100.0     0/0   0.0
Draymond Irving         8    4    1    1   0   2/2   100.0     0/0   0.0
Ben Ginobili           16    3    2    1   0   1/1   100.0     0/0   0.0
Malcolm Randle          5    3    1    0   0   1/1   100.0     0/0   0.0
Jabari Barrett         16    2    3    0   0   1/1   100.0     0/0   0.0
Paul Ming               8    2    2    1   0   1/2    50.0     0/0   0.0
Magic Barrett           8    2    0    1   0   1/1   100.0     0/0   0.0
Jabari Barnes          16    0    0    1   0   0/1     0.0     0/0   0.0
Kyrie Carter           19    0    0    0   0   0/1     0.0     0/0   0.0

TEAM: FG: 13/17 (76.5%), 3PT: 1/3 (33.3%), REB: 11 (3 off, 8 def), AST: 5, TO: 4
TEAM FOULS: 6 [Team_069 in BONUS]

================================================================================

================================================================================
                       3RD QUARTER - Team_069 vs Team_078                       
================================================================================

[12:00] Team_069 possession (Score: 50-48)
Domantas Lowry attempts a 3Pt. Contested by Isaiah Simmons (3.4 feet, ZONE). DOMANTAS LOWRY MAKES IT!
Score: 53-48

[11:47] Team_078 possession (Score: 53-48)
Kyrie Carter drives and kicks out. Kyrie Carter attempts a 3Pt. Wide open! Domantas Lowry is 6.4 feet away. [MAN] Kyrie Carter misses. Rebound secured by Domantas Towns.

[11:37] Team_069 possession (Score: 53-48)
Pau Middleton drives and kicks out. Pau Middleton attempts a 3Pt. Heavily contested by Isaiah Simmons (0.5 feet, MAN)! Pau Middleton misses. Offensive rebound by Domantas Towns! Domantas Towns kicks it out.

[11:17] Team_069 possession (Score: 53-48)
CJ Fox attempts a Layup. Contested by Jabari Barrett (4.8 feet, ZONE). CJ Fox misses. Rebound secured by Isaiah Simmons.

[11:01] Team_078 possession (Score: 53-48)
FOUL! Holding foul on CJ Fox. [Team fouls: 1] No free throws, side out. (CJ Fox: 1 personal fouls)

[10:50] Team_078 possession (Score: 53-48)
Jabari Barrett drives and kicks out. Jabari Barnes attempts a Midrange. Contested by James Sexton (5.1 feet, MAN). Jabari Barnes misses. Rebound secured by Domantas Towns.

[10:40] Team_069 possession (Score: 53-48)
Domantas Lowry attempts a 3Pt. Heavily contested by Kyrie Carter (1.1 feet, MAN)! Domantas Lowry misses. Rebound secured by Isaiah Simmons.

[10:26] Team_078 possession (Score: 53-48)
Isaiah Simmons attempts a Layup. Contested by Pau Middleton (2.5 feet, MAN). Isaiah Simmons misses. Offensive rebound by Jabari Barrett! Jabari Barrett kicks it out.

[10:14] Team_078 possession (Score: 53-48)
Ben Ginobili makes the Dunk and draws the foul on James Sexton! And-1! Ben Ginobili to the line for 1. [Team fouls: 2] (James Sexton: 1 personal fouls)   FT 1/1: GOOD Ben Ginobili makes 1/1 from the line.
Score: 53-51

[10:01] Team_069 possession (Score: 53-51)
CJ Fox attempts a Midrange. Heavily contested by Jabari Barrett (1.3 feet, MAN)! CJ FOX MAKES IT! Assist: Pau Middleton
Score: 55-51

[09:48] Team_078 possession (Score: 55-51)
Jabari Barrett attempts a 3Pt. Contested by James Sexton (2.4 feet, ZONE). Jabari Barrett misses. Rebound secured by Pau Middleton.

[09:32] Team_069 possession (Score: 55-51)
Domantas Lowry attempts a Midrange. Wide open! Kyrie Carter is 7.0 feet away. [MAN] DOMANTAS LOWRY MAKES IT! Assist: James Sexton
Score: 57-51

[09:19] Team_078 possession (Score: 57-51)
Isaiah Simmons attempts a 3Pt. Contested by James Sexton (2.5 feet, ZONE). Isaiah Simmons misses. Rebound secured by Pau Middleton.

[09:05] Team_069 possession (Score: 57-51)
Pau Middleton throws a bad pass! Stolen by Isaiah Simmons! TURNOVER! (live ball)

[08:51] Team_078 possession (Score: 57-51)
FOUL! Shooting foul on Domantas Towns. Ben Ginobili to the line for 2 free throws. [Team fouls: 3] (Domantas Towns: 1 personal fouls)   FT 1/2: GOOD   FT 2/2: GOOD Ben Ginobili makes 2/2 from the line.
Score: 57-53

[08:34] Team_069 possession (Score: 57-53)
FOUL! Reach-in foul on Kyrie Carter during the drive. [Team fouls: 1] No free throws, side out. (Kyrie Carter: 1 personal fouls)

[08:16] Team_069 possession (Score: 57-53)
Pau Middleton throws a bad pass! Stolen by Isaiah Simmons! TURNOVER! (live ball)

[08:03] Team_078 possession (Score: 57-53)
Jabari Barnes drives, picks up Domantas Towns. Help arrives from James Sexton! Jabari Barnes attempts a Layup. Contested by James Sexton (5.3 feet, ZONE). JABARI BARNES MAKES IT!
Score: 57-55

[07:51] Team_069 possession (Score: 57-55)
Domantas Lowry attempts a Layup. Contested by Kyrie Carter (4.6 feet, MAN). DOMANTAS LOWRY MAKES IT! Assist: CJ Fox
Score: 59-55

[07:35] Team_078 possession (Score: 59-55)
Isaiah Simmons attempts a 3Pt. Contested by Domantas Lowry (4.5 feet, ZONE). Isaiah Simmons misses. Rebound secured by Domantas Towns.

[07:22] Team_069 possession (Score: 59-55)
CJ Fox drives, Jabari Barrett stays with him. CJ Fox attempts a Dunk. Contested by Jabari Barrett (3.8 feet, ZONE). CJ FOX MAKES IT!
Score: 61-55

[07:04] Team_078 possession (Score: 61-55)
FOUL! Shooting foul on James Sexton. Isaiah Simmons to the line for 3 free throws. [Team fouls: 4] (James Sexton: 2 personal fouls)   FT 1/3: GOOD   FT 2/3: GOOD   FT 3/3: GOOD Isaiah Simmons makes 3/3 from the line.
Score: 61-58

[06:49] Team_069 possession (Score: 61-58)
CJ Fox attempts a Midrange. Contested by Ben Ginobili (3.9 feet, ZONE). CJ FOX MAKES IT! Assist: James Sexton
Score: 63-58

[06:36] Team_078 possession (Score: 63-58)
FOUL! Offensive foul on Isaiah Simmons! Pau Middleton drew the charge! [Team fouls: 2] (Isaiah Simmons: 1 personal fouls) TURNOVER! (dead ball)

[06:23] Team_069 possession (Score: 63-58)
FOUL! Holding foul on Ben Ginobili. [Team fouls: 3] No free throws, side out. (Ben Ginobili: 1 personal fouls)

[06:07] Team_069 possession (Score: 63-58)
Domantas Towns attempts a Midrange. Contested by Ben Ginobili (3.3 feet, MAN). Domantas Towns misses. Offensive rebound by Domantas Towns! Domantas Towns kicks it out.

[05:53] Team_069 possession (Score: 63-58)
Domantas Towns throws a bad pass! Stolen by Ben Ginobili! TURNOVER! (live ball)

[05:38] Team_078 possession (Score: 63-58)
Ben Ginobili attempts a Layup. Wide open! CJ Fox is 6.7 feet away. [ZONE] BEN GINOBILI MAKES IT!
Score: 63-60

[05:29] Team_069 possession (Score: 63-60)
Pau Middleton drives, Jabari Barrett stays with him. Pau Middleton attempts a Dunk. Contested by Jabari Barrett (5.7 feet, ZONE). Pau Middleton misses. Rebound secured by Jabari Barrett.

[05:14] Team_078 possession (Score: 63-60)
FOUL! Holding foul on Pau Middleton. [IN THE BONUS! 5 team fouls] Isaiah Simmons to the line for 2 free throws. (Pau Middleton: 1 personal fouls)   FT 1/2: GOOD   FT 2/2: MISS Isaiah Simmons makes 1/2 from the line. Rebound secured by Domantas Towns.
Score: 63-61

[04:56] Team_069 possession (Score: 63-61)
CJ Fox attempts a Midrange. Contested by Jabari Barrett (3.8 feet, MAN). CJ FOX MAKES IT!
Score: 65-61

[04:43] Team_078 possession (Score: 65-61)
Kyrie Carter attempts a Midrange. Contested by Domantas Lowry (5.9 feet, MAN). KYRIE CARTER MAKES IT! Assist: Jabari Barnes
Score: 65-63

[04:26] Team_069 possession (Score: 65-63)
Pau Middleton attempts a 3Pt. Wide open! Ben Ginobili is 7.9 feet away. [ZONE] PAU MIDDLETON MAKES IT! Assist: James Sexton
Score: 68-63

[04:14] Team_078 possession (Score: 68-63)
FOUL! Shooting foul on Domantas Lowry. Kyrie Carter to the line for 3 free throws. [BONUS: 6 team fouls] (Domantas Lowry: 1 personal fouls)   FT 1/3: GOOD   FT 2/3: MISS   FT 3/3: MISS Kyrie Carter makes 1/3 from the line. Rebound secured by CJ Fox.
Score: 68-64

[04:01] Team_069 possession (Score: 68-64)
CJ Fox attempts a Midrange. Wide open! Jabari Barrett is 7.0 feet away. [MAN] CJ Fox misses. Offensive rebound by Domantas Towns! Domantas Towns kicks it out.

[03:44] Team_069 possession (Score: 68-64)
James Sexton attempts a Midrange. Heavily contested by Isaiah Simmons (0.5 feet, ZONE)! James Sexton misses. Rebound secured by Ben Ginobili.

[03:33] Team_078 possession (Score: 68-64)
Kyrie Carter attempts a 3Pt. Wide open! James Sexton is 8.3 feet away. [ZONE] Kyrie Carter misses. Rebound secured by Pau Middleton.

[03:18] Team_069 possession (Score: 68-64)
Domantas Lowry attempts a Layup. Contested by Jabari Barrett (3.3 feet, ZONE). Domantas Lowry misses. FOUL! Loose ball foul on Isaiah Simmons during the rebound battle. [Team fouls: 4] No free throws, side out. (Isaiah Simmons: 2 personal fouls)

[03:04] Team_069 possession (Score: 68-64)
Domantas Lowry attempts a 3Pt. Wide open! Isaiah Simmons is 6.9 feet away. [ZONE] Domantas Lowry misses. Rebound secured by Ben Ginobili.

[02:49] Team_078 possession (Score: 68-64)
Jabari Barrett drives, picks up CJ Fox. Help arrives from James Sexton! Jabari Barrett attempts a Dunk. Wide open! James Sexton is 8.5 feet away. [MAN] JABARI BARRETT MAKES IT! Assist: Ben Ginobili
Score: 68-66

[02:35] Team_069 possession (Score: 68-66)
CJ Fox drives, picks up Jabari Barrett. Help arrives from Kyrie Carter! CJ Fox attempts a Layup. Contested by Kyrie Carter (2.8 feet, MAN). CJ FOX MAKES IT!
Score: 70-66

[02:17] Team_078 possession (Score: 70-66)
Isaiah Simmons drives and kicks out. Ben Ginobili attempts a 3Pt. Contested by James Sexton (2.0 feet, ZONE). Ben Ginobili misses. FOUL! Loose ball foul on Domantas Towns during the rebound battle. [IN THE BONUS! 7 team fouls] Jabari Barrett to the line for 2 free throws. (Domantas Towns: 2 personal fouls)   FT 1/2: GOOD   FT 2/2: GOOD Jabari Barrett makes 2/2 from the line.
Score: 70-68

[01:58] Team_069 possession (Score: 70-68)
Domantas Lowry drives, picks up Kyrie Carter. Help arrives from Isaiah Simmons! Domantas Lowry attempts a Dunk. Heavily contested by Isaiah Simmons (1.8 feet, MAN)! DOMANTAS LOWRY MAKES IT!
Score: 72-68

[01:46] Team_078 possession (Score: 72-68)
Kyrie Carter drives, Domantas Towns stays with him. Kyrie Carter attempts a Dunk. Contested by Domantas Towns (4.6 feet, ZONE). Kyrie Carter misses. Rebound secured by CJ Fox.

[01:31] Team_069 possession (Score: 72-68)
James Sexton attempts a 3Pt. Contested by Jabari Barnes (4.0 feet, MAN). James Sexton misses. Rebound secured by Ben Ginobili.

[01:17] Team_078 possession (Score: 72-68)
Kyrie Carter attempts a 3Pt. Contested by Domantas Lowry (5.0 feet, MAN). Kyrie Carter misses. Offensive rebound by Isaiah Simmons! Isaiah Simmons puts it back in!
Score: 72-70

[01:04] Team_069 possession (Score: 72-70)
CJ Fox makes the Midrange and draws the foul on Kyrie Carter! And-1! CJ Fox to the line for 1. [BONUS: 5 team fouls] (Kyrie Carter: 2 personal fouls)   FT 1/1: GOOD CJ Fox makes 1/1 from the line.
Score: 75-70

[00:46] Team_078 possession (Score: 75-70)
Jabari Barnes attempts a Midrange. Contested by James Sexton (2.2 feet, MAN). JABARI BARNES MAKES IT!
Score: 75-72

[00:33] Team_069 possession (Score: 75-72)
FOUL! Offensive foul on Domantas Towns! Ben Ginobili drew the charge! [Team fouls: 8] (Domantas Towns: 3 personal fouls) TURNOVER! (dead ball)

[00:19] Team_078 possession (Score: 75-72)
Kyrie Carter attempts a Midrange. Contested by Domantas Lowry (2.8 feet, MAN). Kyrie Carter misses. Rebound secured by Domantas Towns.

[00:08] Team_069 possession (Score: 75-72)
James Sexton attempts a 3Pt. Contested by Isaiah Simmons (3.9 feet, ZONE). James Sexton misses. Offensive rebound by CJ Fox! CJ Fox kicks it out.

================================================================================
                              3RD QUARTER COMPLETE                              
================================================================================

3RD QUARTER SCORE: Team_069 25, Team_078 24

BOX SCORE:
================================================================================

Team_069
--------------------------------------------------------------------------------
Player                MIN  PTS  REB  AST  TO      FG   FG%      3P   3P%
--------------------------------------------------------------------------------
CJ Fox                 29   13    3    1   0   6/7    85.7     0/0   0.0
Domantas Lowry         31    9    0    0   0   4/6    66.7     0/0   0.0
Pau Middleton          29    3    3    1   0   1/2    50.0     0/0   0.0
Domantas Towns         29    0    9    0   0   0/0     0.0     0/0   0.0
James Sexton           29    0    0    3   0   0/2     0.0     0/0   0.0

TEAM: FG: 11/17 (64.7%), 3PT: 2/5 (40.0%), REB: 15 (5 off, 10 def), AST: 5, TO: 4
TEAM FOULS: 8 [Team_078 in BONUS]


Team_078
--------------------------------------------------------------------------------
Player                MIN  PTS  REB  AST  TO      FG   FG%      3P   3P%
--------------------------------------------------------------------------------
Ben Ginobili           29    7    3    1   0   3/3   100.0     0/0   0.0
Isaiah Simmons         31    5    3    0   0   2/4    50.0     0/0   0.0
Jabari Barrett         29    4    2    0   0   2/4    50.0     0/0   0.0
Jabari Barnes          29    4    0    1   0   2/2   100.0     0/0   0.0
Kyrie Carter           31    2    0    0   0   1/6    16.7     0/0   0.0

TEAM: FG: 10/20 (50.0%), 3PT: 2/7 (28.6%), REB: 8 (2 off, 6 def), AST: 2, TO: 1
TEAM FOULS: 5 [Team_069 in BONUS]

================================================================================

================================================================================
                       4TH QUARTER - Team_069 vs Team_078                       
================================================================================

[12:00] Team_069 possession (Score: 75-72)
Domantas Towns attempts a 3Pt. Contested by Jabari Barnes (4.6 feet, ZONE). Domantas Towns misses. Rebound secured by Ben Ginobili.

[11:47] Team_078 possession (Score: 75-72)
Jabari Barrett attempts a Layup. Contested by Domantas Towns (4.8 feet, ZONE). JABARI BARRETT MAKES IT! Assist: Ben Ginobili
Score: 75-74

[11:33] Team_069 possession (Score: 75-74)
Domantas Towns attempts a Midrange. Contested by Ben Ginobili (5.6 feet, MAN). Domantas Towns misses. Rebound secured by Isaiah Simmons.

[11:17] Team_078 possession (Score: 75-74)
Ben Ginobili attempts a Layup. Contested by Domantas Towns (5.4 feet, ZONE). Ben Ginobili misses. Rebound secured by Pau Middleton.

[11:02] Team_069 possession (Score: 75-74)
Domantas Towns attempts a 3Pt. Contested by Isaiah Simmons (3.1 feet, ZONE). Domantas Towns misses. Rebound secured by Jabari Barrett.

[10:52] Team_078 possession (Score: 75-74)
Kyrie Carter drives, picks up Domantas Lowry. Help arrives from James Sexton! Kyrie Carter attempts a Layup. Contested by James Sexton (5.3 feet, MAN). Kyrie Carter misses. Offensive rebound by Jabari Barrett! Jabari Barrett kicks it out.

[10:36] Team_078 possession (Score: 75-74)
Jabari Barnes attempts a 3Pt. Wide open! James Sexton is 10.0 feet away. [ZONE] JABARI BARNES MAKES IT! Assist: Kyrie Carter
Score: 75-77

[10:21] Team_069 possession (Score: 75-77)
Domantas Lowry drives, picks up Kyrie Carter. Help arrives from Isaiah Simmons! Domantas Lowry attempts a Layup. Contested by Isaiah Simmons (3.5 feet, MAN). Domantas Lowry misses. Offensive rebound by Domantas Towns! Domantas Towns kicks it out.

[10:06] Team_069 possession (Score: 75-77)
CJ Fox drives and kicks out. James Sexton attempts a 3Pt. Contested by Jabari Barnes (3.2 feet, MAN). James Sexton misses. Rebound secured by Ben Ginobili.

[09:54] Team_078 possession (Score: 75-77)
FOUL! Reach-in foul on Domantas Towns during the drive. [Team fouls: 1] No free throws, side out. (Domantas Towns: 1 personal fouls)

[09:41] Team_078 possession (Score: 75-77)
Ben Ginobili drives, picks up Domantas Towns. Help arrives from James Sexton! Ben Ginobili attempts a Layup. Wide open! James Sexton is 7.7 feet away. [MAN] Ben Ginobili misses. Rebound secured by Pau Middleton.

[09:23] Team_069 possession (Score: 75-77)
James Sexton attempts a 3Pt. Contested by Jabari Barnes (4.2 feet, MAN). James Sexton misses. Rebound secured by Ben Ginobili.

[09:06] Team_078 possession (Score: 75-77)
Jabari Barnes attempts a Midrange. Contested by Pau Middleton (5.8 feet, ZONE). JABARI BARNES MAKES IT!
Score: 75-79

[08:49] Team_069 possession (Score: 75-79)
Domantas Towns attempts a 3Pt. Contested by Isaiah Simmons (2.9 feet, ZONE). DOMANTAS TOWNS MAKES IT! Assist: Pau Middleton
Score: 78-79

[08:33] Team_078 possession (Score: 78-79)
FOUL! Holding foul on Domantas Lowry. [Team fouls: 2] No free throws, side out. (Domantas Lowry: 1 personal fouls)

[08:18] Team_078 possession (Score: 78-79)
Isaiah Simmons attempts a Midrange. Contested by Pau Middleton (5.4 feet, MAN). Isaiah Simmons misses. Rebound secured by CJ Fox.

[08:05] Team_069 possession (Score: 78-79)
Domantas Lowry attempts a 3Pt. Contested by Kyrie Carter (3.2 feet, MAN). DOMANTAS LOWRY MAKES IT! Assist: Domantas Towns
Score: 81-79

[07:50] Team_078 possession (Score: 81-79)
FOUL! Reach-in foul on Domantas Towns during the drive. [Team fouls: 3] No free throws, side out. (Domantas Towns: 2 personal fouls)

[07:38] Team_078 possession (Score: 81-79)
Jabari Barnes attempts a Layup. Wide open! Domantas Towns is 6.8 feet away. [ZONE] JABARI BARNES MAKES IT!
Score: 81-81

[07:28] Team_069 possession (Score: 81-81)
Domantas Towns drives, Ben Ginobili stays with him. Domantas Towns attempts a Dunk. Wide open! Ben Ginobili is 7.5 feet away. [MAN] Domantas Towns misses. Rebound secured by Isaiah Simmons.

[07:13] Team_078 possession (Score: 81-81)
Jabari Barrett attempts a Layup. Wide open! CJ Fox is 7.3 feet away. [MAN] JABARI BARRETT MAKES IT!
Score: 81-83

[07:03] Team_069 possession (Score: 81-83)
Domantas Towns attempts a Midrange. Contested by Ben Ginobili (3.7 feet, MAN). DOMANTAS TOWNS MAKES IT!
Score: 83-83

[06:50] Team_078 possession (Score: 83-83)
Isaiah Simmons attempts a 3Pt. Contested by James Sexton (5.5 feet, ZONE). Isaiah Simmons misses. Rebound secured by CJ Fox.

[06:37] Team_069 possession (Score: 83-83)
Domantas Towns attempts a 3Pt. Contested by Isaiah Simmons (4.7 feet, ZONE). Domantas Towns misses. Rebound secured by Isaiah Simmons.

[06:22] Team_078 possession (Score: 83-83)
Kyrie Carter drives and kicks out. Jabari Barnes attempts a 3Pt. Contested by James Sexton (4.3 feet, MAN). JABARI BARNES MAKES IT!
Score: 83-86

[06:06] Team_069 possession (Score: 83-86)
Domantas Towns drives, Ben Ginobili stays with him. Domantas Towns attempts a Layup. Wide open! Ben Ginobili is 7.8 feet away. [MAN] Domantas Towns misses. Offensive rebound by CJ Fox! CJ Fox kicks it out.

[05:52] Team_069 possession (Score: 83-86)
Domantas Towns attempts a 3Pt. Contested by Isaiah Simmons (5.9 feet, ZONE). DOMANTAS TOWNS MAKES IT! Assist: Pau Middleton
Score: 86-86

[05:41] Team_078 possession (Score: 86-86)
Ben Ginobili makes the Layup and draws the foul on Domantas Towns! And-1! Ben Ginobili to the line for 1. [Team fouls: 4] (Domantas Towns: 3 personal fouls)   FT 1/1: GOOD Ben Ginobili makes 1/1 from the line.
Score: 86-89

[05:26] Team_069 possession (Score: 86-89)
Domantas Lowry attempts a Midrange. Heavily contested by Kyrie Carter (0.5 feet, MAN)! Domantas Lowry misses. Rebound secured by Jabari Barrett.

[05:14] Team_078 possession (Score: 86-89)
Jabari Barnes attempts a 3Pt. Wide open! James Sexton is 6.1 feet away. [MAN] Jabari Barnes misses. Rebound secured by Pau Middleton.

[05:01] Team_069 possession (Score: 86-89)
CJ Fox attempts a Layup. Wide open! Jabari Barrett is 7.7 feet away. [ZONE] CJ FOX MAKES IT!
Score: 88-89

[04:45] Team_078 possession (Score: 88-89)
Kyrie Carter attempts a 3Pt. Wide open! Domantas Lowry is 7.0 feet away. [MAN] KYRIE CARTER MAKES IT! Assist: Ben Ginobili
Score: 88-92

[04:32] Team_069 possession (Score: 88-92)
Domantas Towns drives and kicks out. James Sexton attempts a 3Pt. Wide open! Jabari Barnes is 7.1 feet away. [MAN] James Sexton misses. Rebound secured by Isaiah Simmons.

[04:22] Team_078 possession (Score: 88-92)
Kyrie Carter attempts a 3Pt. Contested by James Sexton (4.5 feet, ZONE). KYRIE CARTER MAKES IT! Assist: Jabari Barrett
Score: 88-95

[04:08] Team_069 possession (Score: 88-95)
Pau Middleton attempts a 3Pt. Contested by Jabari Barnes (5.2 feet, ZONE). PAU MIDDLETON MAKES IT!
Score: 91-95

[03:51] Team_078 possession (Score: 91-95)
Isaiah Simmons attempts a Midrange. Contested by Domantas Towns (3.2 feet, ZONE). Isaiah Simmons misses. Rebound secured by Domantas Towns.

[03:38] Team_069 possession (Score: 91-95)
Domantas Towns attempts a Midrange. Contested by Ben Ginobili (5.7 feet, MAN). Domantas Towns misses. FOUL! Loose ball foul on Ben Ginobili during the rebound battle. [Team fouls: 1] No free throws, side out. (Ben Ginobili: 1 personal fouls)

[03:24] Team_069 possession (Score: 91-95)
Domantas Towns drives and kicks out. CJ Fox attempts a 3Pt. Wide open! Jabari Barrett is 6.1 feet away. [MAN] CJ Fox misses. Offensive rebound by CJ Fox! CJ Fox kicks it out.

[03:08] Team_069 possession (Score: 91-95)
CJ Fox attempts a Layup. Wide open! Jabari Barrett is 6.5 feet away. [ZONE] CJ FOX MAKES IT! Assist: James Sexton
Score: 93-95

[02:55] Team_078 possession (Score: 93-95)
FOUL! Reach-in foul on CJ Fox during the drive. [IN THE BONUS! 5 team fouls] Jabari Barrett to the line for 2 free throws. (CJ Fox: 1 personal fouls)   FT 1/2: GOOD   FT 2/2: GOOD Jabari Barrett makes 2/2 from the line.
Score: 93-97

[02:40] Team_069 possession (Score: 93-97)
Pau Middleton attempts a 3Pt. Wide open! Isaiah Simmons is 6.2 feet away. [ZONE] PAU MIDDLETON MAKES IT! Assist: James Sexton
Score: 96-97

[02:23] Team_078 possession (Score: 96-97)
Jabari Barnes attempts a Layup. Wide open! Domantas Towns is 7.8 feet away. [ZONE] JABARI BARNES MAKES IT! Assist: Kyrie Carter
Score: 96-99

[02:07] Team_069 possession (Score: 96-99)
Domantas Lowry drives, Kyrie Carter stays with him. Domantas Lowry attempts a Layup. Contested by Kyrie Carter (3.4 feet, MAN). Domantas Lowry misses. Rebound secured by Isaiah Simmons.

[01:49] Team_078 possession (Score: 96-99)
Jabari Barrett attempts a 3Pt. Wide open! CJ Fox is 6.2 feet away. [MAN] Jabari Barrett misses. Rebound secured by Domantas Towns.

[01:33] Team_069 possession (Score: 96-99)
CJ Fox attempts a Midrange. Wide open! Isaiah Simmons is 10.0 feet away. [ZONE] CJ Fox misses. Rebound secured by Ben Ginobili.

[01:22] Team_078 possession (Score: 96-99)
Jabari Barrett makes the Layup and draws the foul on Domantas Towns! And-1! Jabari Barrett to the line for 1. [BONUS: 6 team fouls] (Domantas Towns: 4 personal fouls)   FT 1/1: MISS Jabari Barrett makes 0/1 from the line. Rebound secured by Pau Middleton.
Score: 96-101

[01:09] Team_069 possession (Score: 96-101)
James Sexton attempts a Midrange. Wide open! Ben Ginobili is 7.4 feet away. [ZONE] JAMES SEXTON MAKES IT! Assist: Domantas Towns
Score: 98-101

[00:52] Team_078 possession (Score: 98-101)
Jabari Barrett attempts a Layup. Wide open! Domantas Towns is 7.8 feet away. [ZONE] Jabari Barrett misses. Rebound secured by Domantas Towns.

[00:36] Team_069 possession (Score: 98-101)
Domantas Lowry attempts a Midrange. Wide open! Kyrie Carter is 8.5 feet away. [MAN] Domantas Lowry misses. Rebound secured by Jabari Barrett.

[00:22] Team_078 possession (Score: 98-101)
Ben Ginobili attempts a Midrange. Wide open! Domantas Towns is 9.1 feet away. [MAN] Ben Ginobili misses. Rebound secured by CJ Fox.

[00:08] Team_069 possession (Score: 98-101)
Domantas Towns drives, Jabari Barrett stays with him. Domantas Towns attempts a Dunk. Contested by Jabari Barrett (4.6 feet, ZONE). Domantas Towns misses. Rebound secured by Jabari Barrett.

================================================================================
                              4TH QUARTER COMPLETE                              
================================================================================

4TH QUARTER SCORE: Team_069 23, Team_078 29

BOX SCORE:
================================================================================

Team_069
--------------------------------------------------------------------------------
Player                MIN  PTS  REB  AST  TO      FG   FG%      3P   3P%
--------------------------------------------------------------------------------
Domantas Towns         41    8    4    2   0   3/10   30.0     0/0   0.0
Pau Middleton          41    6    4    2   0   2/2   100.0     0/0   0.0
CJ Fox                 41    4    6    0   0   2/4    50.0     0/0   0.0
Domantas Lowry         43    3    0    0   0   1/4    25.0     0/0   0.0
James Sexton           41    2    0    2   0   1/2    50.0     0/0   0.0

TEAM: FG: 9/22 (40.9%), 3PT: 5/9 (55.6%), REB: 14 (4 off, 10 def), AST: 6, TO: 0
TEAM FOULS: 6 [Team_078 in BONUS]


Team_078
--------------------------------------------------------------------------------
Player                MIN  PTS  REB  AST  TO      FG   FG%      3P   3P%
--------------------------------------------------------------------------------
Jabari Barnes          41   12    0    0   0   5/6    83.3     0/0   0.0
Jabari Barrett         41    6    5    1   0   3/6    50.0     0/0   0.0
Kyrie Carter           43    6    0    2   0   2/2   100.0     0/0   0.0
Ben Ginobili           41    3    4    2   0   1/4    25.0     0/0   0.0
Isaiah Simmons         43    0    5    0   0   0/3     0.0     0/0   0.0

TEAM: FG: 11/21 (52.4%), 3PT: 3/6 (50.0%), REB: 14 (1 off, 13 def), AST: 5, TO: 0
TEAM FOULS: 1

================================================================================

================================================================================
                               FULL GAME COMPLETE                               
================================================================================

FINAL SCORE: Team_069 98, Team_078 101

SCORING BY QUARTER:
--------------------------------------------------------------------------------
Team                     Q1     Q2     Q3     Q4    FINAL
--------------------------------------------------------------------------------
Team_069                 24     26     25     23       98
Team_078                 20     28     24     29      101
--------------------------------------------------------------------------------

FULL GAME BOX SCORE:
================================================================================

Team_069
--------------------------------------------------------------------------------
Player                MIN  PTS  REB  AST  TO      FG   FG%      3P   3P%      FT STL BLK
--------------------------------------------------------------------------------
Domantas Lowry         43   28    1    2   0  12/18   66.7   3/5    60.0   3/3     1   0
James Sexton           41    4    0    7   0   2/9    22.2   0/5     0.0   0/0     1   0
Pau Middleton          41   12    9    4   3   4/7    57.1   4/5    80.0   0/0     0   1
Domantas Towns         41   14   16    3   2   7/17   41.2   2/5    40.0   2/5     1   1
CJ Fox                 41   23   17    4   1  11/15   73.3   0/0     0.0   2/3     0   0
Jarrett Murray          8    7    0    0   0   4/4   100.0   1/1   100.0   0/0     0   0
Tyrese Simons           8    2    1    0   0   1/4    25.0   0/1     0.0   2/4     0   0
Devin Giddey            8    0    0    1   0   0/0     0.0   0/0     0.0   0/0     0   0
Shai Quickley           8    2    0    0   0   1/2    50.0   0/1     0.0   3/4     0   0
Trae Antetokounmpo      5    2    0    0   2   0/1     0.0   0/1     0.0   0/0     0   0

TEAM: FG: 42/77 (54.5%), 3PT: 10/24 (41.7%), REB: 45 (15 off, 30 def), AST: 21, TO: 8


Team_078
--------------------------------------------------------------------------------
Player                MIN  PTS  REB  AST  TO      FG   FG%      3P   3P%      FT STL BLK
--------------------------------------------------------------------------------
Kyrie Carter           43    8    0    3   3   6/15   40.0   3/8    37.5   1/3     0   0
Isaiah Simmons         43   15   11    1   3   7/14   50.0   1/5    20.0   4/5     2   0
Jabari Barnes          41   20    0    3   1   8/12   66.7   1/3    33.3   0/0     0   0
Ben Ginobili           41   16   12    5   0   6/10   60.0   0/0     0.0   5/5     1   0
Jabari Barrett         41   17   14    1   1   6/12   50.0   0/2     0.0   7/8     1   1
Magic Barrett           8    4    0    1   0   1/1   100.0   1/1   100.0   2/3     0   0
Paul Ming               8    4    2    2   0   2/3    66.7   0/0     0.0   0/0     1   0
Draymond Irving         8    4    2    1   0   2/2   100.0   0/0     0.0   2/2     0   0
Damian Allen            5    6    0    0   0   3/3   100.0   0/0     0.0   2/2     1   2
Malcolm Randle          5    3    1    0   0   2/2   100.0   1/1   100.0   0/0     0   0

TEAM: FG: 43/75 (57.3%), 3PT: 7/20 (35.0%), REB: 41 (8 off, 33 def), AST: 17, TO: 8

================================================================================
