================================================================================
                        FULL GAME - Team_084 vs Team_044                        
================================================================================

================================================================================
                       1ST QUARTER - Team_084 vs Team_044                       
================================================================================

[12:00] Team_084 possession (Score: 0-0)
Luka Sexton drives, picks up Zach McGrady. Help arrives from Victor Westbrook! Luka Sexton attempts a Layup. Contested by Victor Westbrook (4.2 feet, MAN). LUKA SEXTON MAKES IT! Assist: Klay Thompson
Score: 2-0

[11:48] Team_044 possession (Score: 2-0)
Isaiah Murray attempts a Midrange. Contested by Jarrett Booker (5.2 feet, ZONE). ISAIAH MURRAY MAKES IT! Assist: Karl Fox
Score: 2-2

[11:30] Team_084 possession (Score: 2-2)
Giannis Quickley throws a bad pass out of bounds! TURNOVER! (dead ball)

[11:19] Team_044 possession (Score: 2-2)
FOUL! Holding foul on Klay Thompson. [Team fouls: 1] No free throws, side out. (Klay Thompson: 1 personal fouls)

[11:03] Team_044 possession (Score: 2-2)
Zach McGrady drives to the basket... Zach McGrady throws a bad pass! Stolen by Luka Sexton! TURNOVER! (live ball)

[10:47] Team_084 possession (Score: 2-2)
Jarrett Booker attempts a 3Pt. Contested by Isaiah Murray (5.9 feet, ZONE). Jarrett Booker misses. Rebound secured by Ayo McCollum.

[10:27] Team_044 possession (Score: 2-2)
Victor Westbrook drives and kicks out. Isaiah Murray attempts a Midrange. Contested by Dejounte Ginobili (2.3 feet, MAN). Isaiah Murray misses. Rebound secured by Dejounte Ginobili.

[10:11] Team_084 possession (Score: 2-2)
Jarrett Booker throws a bad pass! Stolen by Karl Fox! TURNOVER! (live ball)

[09:52] Team_044 possession (Score: 2-2)
Karl Fox attempts a Layup. Contested by Giannis Quickley (5.0 feet, ZONE). KARL FOX MAKES IT! Assist: Victor Westbrook
Score: 2-4

[09:37] Team_084 possession (Score: 2-4)
Klay Thompson loses control! Ball rolls out of bounds! TURNOVER! (dead ball)

[09:25] Team_044 possession (Score: 2-4)
Ayo McCollum attempts a Midrange. Contested by Giannis Quickley (4.6 feet, ZONE). Ayo McCollum misses. Rebound secured by Klay Thompson.

[09:11] Team_084 possession (Score: 2-4)
Jarrett Booker drives to the basket... Jarrett Booker throws a bad pass out of bounds! TURNOVER! (dead ball)

[08:52] Team_044 possession (Score: 2-4)
Zach McGrady attempts a Midrange. Heavily contested by Luka Sexton (0.9 feet, MAN)! ZACH MCGRADY MAKES IT!
Score: 2-6

[08:35] Team_084 possession (Score: 2-6)
FOUL! Holding foul on Zach McGrady. [Team fouls: 1] No free throws, side out. (Zach McGrady: 1 personal fouls)

[08:18] Team_084 possession (Score: 2-6)
Dejounte Ginobili attempts a Layup. Contested by Ayo McCollum (4.5 feet, ZONE). DEJOUNTE GINOBILI MAKES IT! Assist: Luka Sexton
Score: 4-6

[08:08] Team_044 possession (Score: 4-6)
Zach McGrady commits a violation (traveling/carry)! TURNOVER! (dead ball)

[07:56] Team_084 possession (Score: 4-6)
Luka Sexton drives, picks up Zach McGrady. Help arrives from Victor Westbrook! Luka Sexton attempts a Layup. Heavily contested by Victor Westbrook (1.4 feet, MAN)! LUKA SEXTON MAKES IT! Assist: Jarrett Booker
Score: 6-6

[07:41] Team_044 possession (Score: 6-6)
Isaiah Murray attempts a Midrange. Contested by Dejounte Ginobili (2.3 feet, ZONE). ISAIAH MURRAY MAKES IT! Assist: Karl Fox
Score: 6-8

[07:32] Team_084 possession (Score: 6-8)
Klay Thompson attempts a Midrange. Wide open! Isaiah Murray is 6.5 feet away. [ZONE] Klay Thompson misses. Rebound secured by Karl Fox.

[07:13] Team_044 possession (Score: 6-8)
FOUL! Shooting foul on Jarrett Booker. Karl Fox to the line for 2 free throws. [Team fouls: 2] (Jarrett Booker: 1 personal fouls)   FT 1/2: GOOD   FT 2/2: GOOD Karl Fox makes 2/2 from the line.
Score: 6-10

[07:03] Team_084 possession (Score: 6-10)
Giannis Quickley drives, Ayo McCollum stays with him. Giannis Quickley attempts a Dunk. Wide open! Ayo McCollum is 6.7 feet away. [MAN] GIANNIS QUICKLEY MAKES IT! Assist: Jarrett Booker
Score: 8-10

[06:48] Team_044 possession (Score: 8-10)
Karl Fox attempts a Midrange. Contested by Jarrett Booker (3.3 feet, ZONE). KARL FOX MAKES IT! Assist: Victor Westbrook
Score: 8-12

[06:29] Team_084 possession (Score: 8-12)
Luka Sexton attempts a Midrange. Wide open! Isaiah Murray is 8.0 feet away. [ZONE] Luka Sexton misses. Rebound secured by Ayo McCollum.

[06:14] Team_044 possession (Score: 8-12)
Isaiah Murray drives to the basket... Isaiah Murray commits a violation (traveling/carry)! TURNOVER! (dead ball)

[06:00] Team_084 possession (Score: 8-12)
Klay Thompson attempts a 3Pt. Contested by Victor Westbrook (3.3 feet, MAN). Klay Thompson misses. Offensive rebound by Dejounte Ginobili! Dejounte Ginobili kicks it out.

[05:48] Team_084 possession (Score: 8-12)
Giannis Quickley drives, Ayo McCollum stays with him. Giannis Quickley attempts a Layup. Contested by Ayo McCollum (5.9 feet, ZONE). GIANNIS QUICKLEY MAKES IT! Assist: Luka Sexton
Score: 10-12

[05:33] Team_044 possession (Score: 10-12)
Isaiah Murray attempts a 3Pt. Contested by Luka Sexton (4.0 feet, ZONE). Isaiah Murray misses. Rebound secured by Giannis Quickley.

[05:16] Team_084 possession (Score: 10-12)
Klay Thompson attempts a Midrange. Wide open! Victor Westbrook is 7.7 feet away. [ZONE] KLAY THOMPSON MAKES IT! Assist: Luka Sexton
Score: 12-12

[04:59] Team_044 possession (Score: 12-12)
Zach McGrady commits a violation (traveling/carry)! TURNOVER! (dead ball)

[04:44] Team_084 possession (Score: 12-12)
Luka Sexton attempts a 3Pt. Contested by Isaiah Murray (3.5 feet, ZONE). Luka Sexton misses. Rebound secured by Ayo McCollum.

[04:32] Team_044 possession (Score: 12-12)
Zach McGrady attempts a 3Pt. Contested by Luka Sexton (4.2 feet, MAN). Zach McGrady misses. Rebound secured by Klay Thompson.

[04:18] Team_084 possession (Score: 12-12)
FOUL! Reach-in foul on Victor Westbrook during the drive. [Team fouls: 2] No free throws, side out. (Victor Westbrook: 1 personal fouls)

[03:59] Team_084 possession (Score: 12-12)
Dejounte Ginobili drives and kicks out. Klay Thompson attempts a 3Pt. Contested by Victor Westbrook (3.0 feet, MAN). Klay Thompson misses. Rebound secured by Karl Fox.

[03:44] Team_044 possession (Score: 12-12)
Zach McGrady attempts a 3Pt. Contested by Luka Sexton (4.0 feet, MAN). ZACH MCGRADY MAKES IT! Assist: Karl Fox
Score: 12-15

[03:27] Team_084 possession (Score: 12-15)
Dejounte Ginobili attempts a 3Pt. Contested by Isaiah Murray (5.8 feet, MAN). Dejounte Ginobili misses. Offensive rebound by Giannis Quickley! Giannis Quickley puts it back in!
Score: 14-15

[03:14] Team_044 possession (Score: 14-15)
Victor Westbrook attempts a Midrange. Heavily contested by Klay Thompson (0.5 feet, ZONE)! Victor Westbrook misses. Rebound secured by Giannis Quickley.

[02:59] Team_084 possession (Score: 14-15)
Luka Sexton attempts a 3Pt. Contested by Isaiah Murray (2.2 feet, ZONE). Luka Sexton misses. Rebound secured by Karl Fox.

[02:44] Team_044 possession (Score: 14-15)
Karl Fox attempts a Midrange. Wide open! Klay Thompson is 6.3 feet away. [ZONE] KARL FOX MAKES IT!
Score: 14-17

[02:33] Team_084 possession (Score: 14-17)
Luka Sexton attempts a 3Pt. Wide open! Victor Westbrook is 6.9 feet away. [ZONE] LUKA SEXTON MAKES IT!
Score: 17-17

[02:13] Team_044 possession (Score: 17-17)
Ayo McCollum attempts a Midrange. Contested by Giannis Quickley (5.7 feet, ZONE). AYO MCCOLLUM MAKES IT! Assist: Isaiah Murray
Score: 17-19

[02:03] Team_084 possession (Score: 17-19)
Giannis Quickley drives to the basket... Giannis Quickley commits a violation (traveling/carry)! TURNOVER! (dead ball)

[02:03] Substitution (Team_084): Dejounte Ginobili OUT → Chris Parker IN (stamina_rule2)

[02:03] Substitution (Team_084): Klay Thompson OUT → Evan Quickley IN (stamina_rule2)

[02:03] Substitution (Team_084): Jarrett Booker OUT → Pascal Jackson IN (stamina_rule2)

[02:03] Substitution (Team_084): Giannis Quickley OUT → Dejounte Porzingis IN (stamina_rule2)

[02:03] Substitution (Team_044): Isaiah Murray OUT → Tim Towns IN (stamina_rule2)

[02:03] Substitution (Team_044): Victor Westbrook OUT → Tim Siakam IN (stamina_rule2)

[02:03] Substitution (Team_044): Ayo McCollum OUT → Victor Anthony IN (stamina_rule2)

[01:49] Team_044 possession (Score: 17-19)
Tim Towns attempts a 3Pt. Contested by Chris Parker (2.6 feet, MAN). Tim Towns misses. Rebound secured by Evan Quickley.

[01:37] Team_084 possession (Score: 17-19)
Evan Quickley attempts a Layup. Contested by Victor Anthony (3.4 feet, ZONE). Evan Quickley misses. Rebound secured by Victor Anthony.

[01:21] Team_044 possession (Score: 17-19)
FOUL! Offensive foul on Tim Towns! Chris Parker drew the charge! [Team fouls: 3] (Tim Towns: 1 personal fouls) TURNOVER! (dead ball)

[01:06] Team_084 possession (Score: 17-19)
Evan Quickley attempts a Midrange. Wide open! Tim Towns is 6.1 feet away. [ZONE] Evan Quickley misses. Rebound secured by Tim Siakam.

[00:52] Team_044 possession (Score: 17-19)
Zach McGrady attempts a 3Pt. Contested by Luka Sexton (4.8 feet, MAN). Zach McGrady misses. Rebound secured by Evan Quickley.

[00:33] Team_084 possession (Score: 17-19)
Luka Sexton attempts a 3Pt. Contested by Zach McGrady (4.8 feet, MAN). Luka Sexton misses. Rebound secured by Karl Fox.

[00:24] Team_044 possession (Score: 17-19)
Tim Towns attempts a Midrange. Contested by Chris Parker (2.6 feet, MAN). TIM TOWNS MAKES IT! Assist: Victor Anthony
Score: 17-21

[00:05] Team_084 possession (Score: 17-21)
Evan Quickley attempts a 3Pt. Contested by Tim Towns (5.3 feet, ZONE). EVAN QUICKLEY MAKES IT! Assist: Pascal Jackson
Score: 20-21

================================================================================
                              1ST QUARTER COMPLETE                              
================================================================================

1ST QUARTER SCORE: Team_084 20, Team_044 21

BOX SCORE:
================================================================================

Team_084
--------------------------------------------------------------------------------
Player                MIN  PTS  REB  AST  TO      FG   FG%      3P   3P%
--------------------------------------------------------------------------------
Luka Sexton            12    7    0    3   0   3/7    42.9     0/0   0.0
Giannis Quickley       10    6    3    0   0   3/3   100.0     0/0   0.0
Evan Quickley           2    3    2    0   0   1/3    33.3     0/0   0.0
Klay Thompson          10    2    2    1   0   1/2    50.0     0/0   0.0
Dejounte Ginobili      10    2    2    0   0   1/2    50.0     0/0   0.0
Jarrett Booker         10    0    0    2   0   0/1     0.0     0/0   0.0
Pascal Jackson          2    0    0    1   0   0/0     0.0     0/0   0.0

TEAM: FG: 9/18 (50.0%), 3PT: 3/7 (42.9%), REB: 9 (2 off, 7 def), AST: 7, TO: 5
TEAM FOULS: 2


Team_044
--------------------------------------------------------------------------------
Player                MIN  PTS  REB  AST  TO      FG   FG%      3P   3P%
--------------------------------------------------------------------------------
Karl Fox               12    8    4    3   0   4/4   100.0     0/0   0.0
Zach McGrady           12    5    0    0   0   2/4    50.0     0/0   0.0
Isaiah Murray          10    4    0    1   0   2/3    66.7     0/0   0.0
Ayo McCollum           10    2    3    0   0   1/2    50.0     0/0   0.0
Tim Towns               2    2    0    0   0   1/2    50.0     0/0   0.0
Victor Westbrook       10    0    0    2   0   0/2     0.0     0/0   0.0
Victor Anthony          2    0    1    1   0   0/0     0.0     0/0   0.0
Tim Siakam              2    0    1    0   0   0/0     0.0     0/0   0.0

TEAM: FG: 10/17 (58.8%), 3PT: 1/5 (20.0%), REB: 9 (0 off, 9 def), AST: 7, TO: 5
TEAM FOULS: 3

================================================================================

================================================================================
                       2ND QUARTER - Team_084 vs Team_044                       
================================================================================

[12:00] Team_084 possession (Score: 20-21)
Luka Sexton attempts a 3Pt. Wide open! Zach McGrady is 7.2 feet away. [MAN] Luka Sexton misses. Rebound secured by Victor Westbrook.

[11:43] Team_044 possession (Score: 20-21)
Isaiah Murray drives and kicks out. Isaiah Murray attempts a 3Pt. Contested by Luka Sexton (3.3 feet, ZONE). ISAIAH MURRAY MAKES IT! Assist: Zach McGrady
Score: 20-24

[11:28] Team_084 possession (Score: 20-24)
Jarrett Booker makes the 3Pt and draws the foul on Isaiah Murray! And-1! Jarrett Booker to the line for 1. [Team fouls: 1] (Isaiah Murray: 1 personal fouls)   FT 1/1: MISS Jarrett Booker makes 0/1 from the line. Offensive rebound by Giannis Quickley! Giannis Quickley puts it back in!
Score: 25-24

[11:13] Team_044 possession (Score: 25-24)
Karl Fox attempts a 3Pt. Heavily contested by Luka Sexton (1.6 feet, ZONE)! Karl Fox misses. Rebound secured by Klay Thompson.

[11:00] Team_084 possession (Score: 25-24)
Klay Thompson attempts a 3Pt. Wide open! Victor Westbrook is 7.2 feet away. [MAN] KLAY THOMPSON MAKES IT! Assist: Luka Sexton
Score: 28-24

[10:47] Team_044 possession (Score: 28-24)
Karl Fox attempts a Layup. Contested by Giannis Quickley (5.6 feet, ZONE). KARL FOX MAKES IT! Assist: Zach McGrady
Score: 28-26

[10:29] Team_084 possession (Score: 28-26)
Luka Sexton drives to the basket... Luka Sexton throws a bad pass out of bounds! TURNOVER! (dead ball)

[10:29] Substitution (Team_084): Luka Sexton OUT → Magic Bryant IN (stamina_rule2)

[10:29] Substitution (Team_044): Zach McGrady OUT → Kyrie Poole IN (stamina_rule2)

[10:29] Substitution (Team_044): Victor Westbrook OUT → Tim Siakam IN (stamina_rule2)

[10:29] Substitution (Team_044): Karl Fox OUT → Pau Quickley IN (stamina_rule2)

[10:29] Substitution (Team_044): Ayo McCollum OUT → Victor Anthony IN (stamina_rule2)

[10:19] Team_044 possession (Score: 28-26)
Pau Quickley drives and kicks out. Isaiah Murray attempts a 3Pt. Wide open! Dejounte Ginobili is 6.9 feet away. [MAN] Isaiah Murray misses. Rebound secured by Klay Thompson.

[10:08] Team_084 possession (Score: 28-26)
Dejounte Ginobili drives to the basket... Dejounte Ginobili throws a bad pass out of bounds! TURNOVER! (dead ball)

[09:55] Team_044 possession (Score: 28-26)
Victor Anthony drives to the basket... Victor Anthony throws a bad pass out of bounds! TURNOVER! (dead ball)

[09:55] Substitution (Team_084): Klay Thompson OUT → Evan Quickley IN (stamina_rule2)

[09:55] Substitution (Team_084): Giannis Quickley OUT → Dejounte Porzingis IN (stamina_rule2)

[09:40] Team_084 possession (Score: 28-26)
Dejounte Porzingis attempts a Midrange. Wide open! Isaiah Murray is 6.6 feet away. [ZONE] DEJOUNTE PORZINGIS MAKES IT! Assist: Magic Bryant
Score: 30-26

[09:29] Team_044 possession (Score: 30-26)
Isaiah Murray attempts a Layup. Wide open! Dejounte Ginobili is 6.3 feet away. [MAN] Isaiah Murray misses. Rebound secured by Jarrett Booker.

[09:16] Team_084 possession (Score: 30-26)
Dejounte Porzingis drives and kicks out. Dejounte Porzingis attempts a 3Pt. Heavily contested by Tim Siakam (0.5 feet, ZONE)! Dejounte Porzingis misses. Rebound secured by Tim Siakam.

[09:01] Team_044 possession (Score: 30-26)
Victor Anthony attempts a Midrange. Contested by Jarrett Booker (3.8 feet, ZONE). Victor Anthony misses. Rebound secured by Jarrett Booker.

[08:45] Team_084 possession (Score: 30-26)
Dejounte Ginobili attempts a Layup. Contested by Isaiah Murray (4.1 feet, MAN). DEJOUNTE GINOBILI MAKES IT!
Score: 32-26

[08:30] Team_044 possession (Score: 32-26)
Isaiah Murray attempts a 3Pt. Contested by Evan Quickley (4.1 feet, ZONE). ISAIAH MURRAY MAKES IT!
Score: 32-29

[08:17] Team_084 possession (Score: 32-29)
Evan Quickley attempts a 3Pt. Heavily contested by Tim Siakam (1.5 feet, ZONE)! Evan Quickley misses. Offensive rebound by Dejounte Porzingis! Dejounte Porzingis kicks it out.

[08:03] Team_084 possession (Score: 32-29)
Dejounte Porzingis drives and kicks out. Dejounte Porzingis attempts a 3Pt. Contested by Victor Anthony (2.8 feet, MAN). Dejounte Porzingis misses. Rebound secured by Tim Siakam.

[07:53] Team_044 possession (Score: 32-29)
Tim Siakam attempts a Layup. Contested by Evan Quickley (3.4 feet, MAN). TIM SIAKAM MAKES IT! Assist: Victor Anthony
Score: 32-31

[07:38] Team_084 possession (Score: 32-31)
Evan Quickley attempts a Midrange. Heavily contested by Pau Quickley (0.6 feet, ZONE)! Evan Quickley misses. Rebound secured by Victor Anthony.

[07:22] Team_044 possession (Score: 32-31)
Kyrie Poole commits a violation (traveling/carry)! TURNOVER! (dead ball)

[07:22] Substitution (Team_084): Dejounte Ginobili OUT → Chris Parker IN (stamina_rule2)

[07:22] Substitution (Team_084): Jarrett Booker OUT → Pascal Jackson IN (stamina_rule2)

[07:22] Substitution (Team_044): Isaiah Murray OUT → Tim Towns IN (stamina_rule2)

[07:07] Team_084 possession (Score: 32-31)
Magic Bryant attempts a 3Pt. Heavily contested by Tim Siakam (1.3 feet, ZONE)! Magic Bryant misses. Rebound secured by Tim Siakam.

[06:54] Team_044 possession (Score: 32-31)
FOUL! Offensive foul on Kyrie Poole! Magic Bryant drew the charge! [Team fouls: 2] (Kyrie Poole: 1 personal fouls) TURNOVER! (dead ball)

[06:38] Team_084 possession (Score: 32-31)
Pascal Jackson attempts a Layup. Contested by Pau Quickley (2.1 feet, MAN). PASCAL JACKSON MAKES IT! Assist: Evan Quickley
Score: 34-31

[06:21] Team_044 possession (Score: 34-31)
Kyrie Poole attempts a 3Pt. Heavily contested by Magic Bryant (0.5 feet, ZONE)! KYRIE POOLE MAKES IT! Assist: Victor Anthony
Score: 34-34

[06:04] Team_084 possession (Score: 34-34)
Evan Quickley attempts a Layup. Contested by Pau Quickley (2.3 feet, ZONE). EVAN QUICKLEY MAKES IT! Assist: Dejounte Porzingis
Score: 36-34

[05:48] Team_044 possession (Score: 36-34)
Pau Quickley attempts a Midrange. Wide open! Pascal Jackson is 8.6 feet away. [MAN] Pau Quickley misses. Rebound secured by Pascal Jackson.

[05:35] Team_084 possession (Score: 36-34)
Pascal Jackson attempts a Layup. Contested by Pau Quickley (5.7 feet, MAN). PASCAL JACKSON MAKES IT!
Score: 38-34

[05:17] Team_044 possession (Score: 38-34)
Kyrie Poole attempts a Midrange. Wide open! Evan Quickley is 6.2 feet away. [ZONE] KYRIE POOLE MAKES IT!
Score: 38-36

[05:06] Team_084 possession (Score: 38-36)
Evan Quickley attempts a 3Pt. Contested by Tim Siakam (4.2 feet, MAN). Evan Quickley misses. Rebound secured by Tim Siakam.

[04:52] Team_044 possession (Score: 38-36)
Tim Siakam drives and kicks out. Kyrie Poole attempts a Midrange. Wide open! Evan Quickley is 6.3 feet away. [ZONE] KYRIE POOLE MAKES IT!
Score: 38-38

[04:41] Team_084 possession (Score: 38-38)
Chris Parker drives, Pau Quickley stays with him. Chris Parker attempts a Layup. Contested by Pau Quickley (3.4 feet, ZONE). Chris Parker misses. Rebound secured by Tim Siakam.

[04:24] Team_044 possession (Score: 38-38)
Tim Siakam drives and kicks out. Victor Anthony attempts a Midrange. Wide open! Chris Parker is 6.1 feet away. [ZONE] Victor Anthony misses. Offensive rebound by Pau Quickley! Pau Quickley's putback is no good. Rebound secured by Dejounte Porzingis.

[04:08] Team_084 possession (Score: 38-38)
Pascal Jackson drives to the basket... Pascal Jackson loses control! Ball rolls out of bounds! TURNOVER! (dead ball)

[03:54] Team_044 possession (Score: 38-38)
Tim Siakam attempts a Layup. Wide open! Evan Quickley is 8.2 feet away. [MAN] Tim Siakam misses. Rebound secured by Pascal Jackson.

[03:40] Team_084 possession (Score: 38-38)
Dejounte Porzingis attempts a Midrange. Contested by Tim Siakam (3.8 feet, ZONE). Dejounte Porzingis misses. Rebound secured by Pau Quickley.

[03:26] Team_044 possession (Score: 38-38)
Kyrie Poole attempts a 3Pt. Wide open! Magic Bryant is 6.7 feet away. [MAN] KYRIE POOLE MAKES IT! Assist: Victor Anthony
Score: 38-41

[03:12] Team_084 possession (Score: 38-41)
Pascal Jackson attempts a Midrange. Contested by Pau Quickley (4.9 feet, MAN). Pascal Jackson misses. Rebound secured by Pau Quickley.

[02:59] Team_044 possession (Score: 38-41)
Tim Siakam drives, picks up Pascal Jackson. Help arrives from Magic Bryant! Tim Siakam attempts a Layup. Heavily contested by Magic Bryant (1.0 feet, ZONE)! TIM SIAKAM MAKES IT!
Score: 38-43

[02:44] Team_084 possession (Score: 38-43)
Evan Quickley attempts a 3Pt. Contested by Tim Siakam (3.9 feet, ZONE). EVAN QUICKLEY MAKES IT!
Score: 41-43

[02:30] Team_044 possession (Score: 41-43)
Tim Towns drives, Chris Parker stays with him. Tim Towns attempts a Dunk. Contested by Chris Parker (3.8 feet, MAN). TIM TOWNS MAKES IT! Assist: Kyrie Poole
Score: 41-45

[02:15] Team_084 possession (Score: 41-45)
Dejounte Porzingis drives to the basket... Dejounte Porzingis throws a bad pass out of bounds! TURNOVER! (dead ball)

[01:57] Team_044 possession (Score: 41-45)
Tim Siakam attempts a 3Pt. Contested by Magic Bryant (4.9 feet, ZONE). Tim Siakam misses. Offensive rebound by Tim Siakam! Tim Siakam kicks it out.

[01:42] Team_044 possession (Score: 41-45)
Victor Anthony attempts a Layup. Contested by Dejounte Porzingis (4.0 feet, MAN). VICTOR ANTHONY MAKES IT! Assist: Kyrie Poole
Score: 41-47

[01:23] Team_084 possession (Score: 41-47)
Magic Bryant makes the Layup and draws the foul on Victor Anthony! And-1! Magic Bryant to the line for 1. [Team fouls: 3] (Victor Anthony: 1 personal fouls)   FT 1/1: GOOD Magic Bryant makes 1/1 from the line.
Score: 44-47

[01:13] Team_044 possession (Score: 44-47)
Pau Quickley drives, Pascal Jackson stays with him. Pau Quickley attempts a Layup. Wide open! Pascal Jackson is 6.4 feet away. [MAN] Pau Quickley misses. Rebound secured by Evan Quickley.

[00:58] Team_084 possession (Score: 44-47)
FOUL! Holding foul on Pau Quickley. [Team fouls: 4] No free throws, side out. (Pau Quickley: 1 personal fouls)

[00:46] Team_084 possession (Score: 44-47)
FOUL! Shooting foul on Pau Quickley. Pascal Jackson to the line for 2 free throws. [BONUS: 5 team fouls] (Pau Quickley: 2 personal fouls)   FT 1/2: GOOD   FT 2/2: GOOD Pascal Jackson makes 2/2 from the line.
Score: 46-47

[00:34] Team_044 possession (Score: 46-47)
Kyrie Poole drives and kicks out. Tim Towns attempts a 3Pt. Contested by Magic Bryant (4.7 feet, ZONE). Tim Towns misses. Rebound secured by Pascal Jackson.

[00:17] Team_084 possession (Score: 46-47)
Evan Quickley attempts a 3Pt. Contested by Tim Siakam (3.1 feet, ZONE). EVAN QUICKLEY MAKES IT! Assist: Chris Parker
Score: 49-47

================================================================================
                              2ND QUARTER COMPLETE                              
================================================================================

2ND QUARTER SCORE: Team_084 29, Team_044 26

BOX SCORE:
================================================================================

Team_084
--------------------------------------------------------------------------------
Player                MIN  PTS  REB  AST  TO      FG   FG%      3P   3P%
--------------------------------------------------------------------------------
Evan Quickley          12    8    1    1   0   3/5    60.0     0/0   0.0
Pascal Jackson          9    6    3    0   0   3/4    75.0     0/0   0.0
Giannis Quickley       13    5    0    0   0   1/1   100.0     0/0   0.0
Klay Thompson          13    3    2    0   0   1/1   100.0     0/0   0.0
Magic Bryant           10    3    0    1   0   1/2    50.0     0/0   0.0
Dejounte Porzingis     12    2    2    1   0   1/4    25.0     0/0   0.0
Dejounte Ginobili      15    2    0    0   0   1/1   100.0     0/0   0.0
Luka Sexton            14    0    0    1   0   0/1     0.0     0/0   0.0
Jarrett Booker         15    0    2    0   0   0/0     0.0     0/0   0.0
Chris Parker            9    0    0    1   0   0/1     0.0     0/0   0.0

TEAM: FG: 11/20 (55.0%), 3PT: 4/7 (57.1%), REB: 9 (1 off, 8 def), AST: 5, TO: 4
TEAM FOULS: 0


Team_044
--------------------------------------------------------------------------------
Player                MIN  PTS  REB  AST  TO      FG   FG%      3P   3P%
--------------------------------------------------------------------------------
Kyrie Poole            10   10    0    2   0   4/5    80.0     0/0   0.0
Isaiah Murray          15    6    0    0   0   2/3    66.7     0/0   0.0
Tim Siakam             12    4    6    0   0   2/4    50.0     0/0   0.0
Karl Fox               14    2    0    0   0   1/2    50.0     0/0   0.0
Victor Anthony         12    2    1    3   0   1/2    50.0     0/0   0.0
Tim Towns               9    2    0    0   0   1/1   100.0     0/0   0.0
Victor Westbrook       12    0    1    0   0   0/0     0.0     0/0   0.0
Zach McGrady           14    0    0    2   0   0/0     0.0     0/0   0.0
Pau Quickley           10    0    2    0   0   0/3     0.0     0/0   0.0

TEAM: FG: 11/20 (55.0%), 3PT: 3/4 (75.0%), REB: 11 (2 off, 9 def), AST: 7, TO: 3
TEAM FOULS: 5 [Team_084 in BONUS]

================================================================================

================================================================================
                       3RD QUARTER - Team_084 vs Team_044                       
================================================================================

[12:00] Team_084 possession (Score: 49-47)
FOUL! Shooting foul on Victor Westbrook. Klay Thompson to the line for 3 free throws. [Team fouls: 1] (Victor Westbrook: 1 personal fouls)   FT 1/3: GOOD   FT 2/3: GOOD   FT 3/3: GOOD Klay Thompson makes 3/3 from the line.
Score: 52-47

[11:45] Team_044 possession (Score: 52-47)
Ayo McCollum drives and kicks out. Zach McGrady attempts a Midrange. Contested by Jarrett Booker (4.2 feet, ZONE). ZACH MCGRADY MAKES IT!
Score: 52-49

[11:29] Team_084 possession (Score: 52-49)
Klay Thompson attempts a 3Pt. Wide open! Victor Westbrook is 6.2 feet away. [ZONE] Klay Thompson misses. Offensive rebound by Dejounte Ginobili! Dejounte Ginobili kicks it out.

[11:13] Team_084 possession (Score: 52-49)
Jarrett Booker attempts a Layup. BLOCKED BY KARL FOX! Ball deflects out of bounds off Jarrett Booker.

[11:03] Team_044 possession (Score: 52-49)
Ayo McCollum attempts a Midrange. Contested by Klay Thompson (3.4 feet, ZONE). AYO MCCOLLUM MAKES IT!
Score: 52-51

[10:48] Team_084 possession (Score: 52-51)
Luka Sexton drives and kicks out. Giannis Quickley attempts a 3Pt. Contested by Isaiah Murray (5.6 feet, ZONE). Giannis Quickley misses. Rebound secured by Karl Fox.

[10:32] Team_044 possession (Score: 52-51)
Isaiah Murray attempts a Midrange. Contested by Dejounte Ginobili (4.9 feet, MAN). ISAIAH MURRAY MAKES IT! Assist: Victor Westbrook
Score: 52-53

[10:21] Team_084 possession (Score: 52-53)
FOUL! Shooting foul on Ayo McCollum. Luka Sexton to the line for 2 free throws. [Team fouls: 2] (Ayo McCollum: 1 personal fouls)   FT 1/2: GOOD   FT 2/2: GOOD Luka Sexton makes 2/2 from the line.
Score: 54-53

[10:10] Team_044 possession (Score: 54-53)
Victor Westbrook attempts a 3Pt. Contested by Luka Sexton (2.3 feet, ZONE). Victor Westbrook misses. Rebound secured by Giannis Quickley.

[09:51] Team_084 possession (Score: 54-53)
Luka Sexton attempts a Layup. Contested by Ayo McCollum (4.6 feet, ZONE). Luka Sexton misses. Offensive rebound by Giannis Quickley! Giannis Quickley's putback is no good. Rebound secured by Ayo McCollum.

[09:32] Team_044 possession (Score: 54-53)
Zach McGrady drives and kicks out. Ayo McCollum attempts a 3Pt. Contested by Luka Sexton (5.6 feet, ZONE). AYO MCCOLLUM MAKES IT! Assist: Isaiah Murray
Score: 54-56

[09:16] Team_084 possession (Score: 54-56)
Jarrett Booker attempts a Midrange. Heavily contested by Karl Fox (1.5 feet, MAN)! JARRETT BOOKER MAKES IT! Assist: Giannis Quickley
Score: 56-56

[09:01] Team_044 possession (Score: 56-56)
Victor Westbrook attempts a 3Pt. Contested by Klay Thompson (5.8 feet, ZONE). Victor Westbrook misses. Rebound secured by Klay Thompson.

[08:50] Team_084 possession (Score: 56-56)
Dejounte Ginobili drives to the basket... Dejounte Ginobili commits a violation (traveling/carry)! TURNOVER! (dead ball)

[08:38] Team_044 possession (Score: 56-56)
Zach McGrady attempts a Midrange. Contested by Jarrett Booker (5.2 feet, ZONE). ZACH MCGRADY MAKES IT!
Score: 56-58

[08:24] Team_084 possession (Score: 56-58)
Giannis Quickley attempts a Layup. Contested by Ayo McCollum (4.6 feet, MAN). GIANNIS QUICKLEY MAKES IT! Assist: Klay Thompson
Score: 58-58

[08:08] Team_044 possession (Score: 58-58)
Isaiah Murray attempts a 3Pt. Wide open! Dejounte Ginobili is 7.1 feet away. [MAN] Isaiah Murray misses. Rebound secured by Dejounte Ginobili.

[07:54] Team_084 possession (Score: 58-58)
Klay Thompson commits a violation (traveling/carry)! TURNOVER! (dead ball)

[07:41] Team_044 possession (Score: 58-58)
Victor Westbrook attempts a 3Pt. Contested by Luka Sexton (5.1 feet, ZONE). VICTOR WESTBROOK MAKES IT! Assist: Ayo McCollum
Score: 58-61

[07:30] Team_084 possession (Score: 58-61)
Dejounte Ginobili drives, picks up Isaiah Murray. Help arrives from Victor Westbrook! Dejounte Ginobili attempts a Dunk. Contested by Victor Westbrook (2.3 feet, MAN). DEJOUNTE GINOBILI MAKES IT! Assist: Giannis Quickley
Score: 60-61

[07:18] Team_044 possession (Score: 60-61)
Karl Fox makes the Dunk and draws the foul on Dejounte Ginobili! And-1! Karl Fox to the line for 1. [Team fouls: 1] (Dejounte Ginobili: 1 personal fouls)   FT 1/1: GOOD Karl Fox makes 1/1 from the line.
Score: 60-64

[07:06] Team_084 possession (Score: 60-64)
Klay Thompson attempts a Layup. Contested by Ayo McCollum (4.4 feet, ZONE). Klay Thompson misses. Rebound secured by Ayo McCollum.

[06:55] Team_044 possession (Score: 60-64)
Zach McGrady attempts a Layup. Heavily contested by Giannis Quickley (1.0 feet, ZONE)! ZACH MCGRADY MAKES IT! Assist: Isaiah Murray
Score: 60-66

[06:38] Team_084 possession (Score: 60-66)
Dejounte Ginobili makes the Layup and draws the foul on Ayo McCollum! And-1! Dejounte Ginobili to the line for 1. [Team fouls: 3] (Ayo McCollum: 2 personal fouls)   FT 1/1: MISS Dejounte Ginobili makes 0/1 from the line. Rebound secured by Victor Westbrook.
Score: 62-66

[06:25] Team_044 possession (Score: 62-66)
FOUL! Shooting foul on Giannis Quickley. Ayo McCollum to the line for 2 free throws. [Team fouls: 2] (Giannis Quickley: 1 personal fouls)   FT 1/2: MISS   FT 2/2: GOOD Ayo McCollum makes 1/2 from the line.
Score: 62-67

[06:14] Team_084 possession (Score: 62-67)
Giannis Quickley commits a violation (traveling/carry)! TURNOVER! (dead ball)

[06:02] Team_044 possession (Score: 62-67)
Isaiah Murray drives to the basket... Isaiah Murray commits a violation (traveling/carry)! TURNOVER! (dead ball)

[05:47] Team_084 possession (Score: 62-67)
Giannis Quickley drives, Ayo McCollum stays with him. Giannis Quickley attempts a Dunk. Contested by Ayo McCollum (5.9 feet, MAN). GIANNIS QUICKLEY MAKES IT! Assist: Jarrett Booker
Score: 64-67

[05:30] Team_044 possession (Score: 64-67)
Zach McGrady makes the Dunk and draws the foul on Dejounte Ginobili! And-1! Zach McGrady to the line for 1. [Team fouls: 3] (Dejounte Ginobili: 2 personal fouls)   FT 1/1: GOOD Zach McGrady makes 1/1 from the line.
Score: 64-70

[05:16] Team_084 possession (Score: 64-70)
Giannis Quickley attempts a Layup. Wide open! Ayo McCollum is 9.6 feet away. [MAN] GIANNIS QUICKLEY MAKES IT!
Score: 66-70

[05:01] Team_044 possession (Score: 66-70)
Zach McGrady drives, picks up Giannis Quickley. Help arrives from Dejounte Ginobili! Zach McGrady attempts a Dunk. Contested by Dejounte Ginobili (4.8 feet, ZONE). ZACH MCGRADY MAKES IT!
Score: 66-72

[04:47] Team_084 possession (Score: 66-72)
FOUL! Shooting foul on Ayo McCollum. Giannis Quickley to the line for 2 free throws. [Team fouls: 4] (Ayo McCollum: 3 personal fouls)   FT 1/2: GOOD   FT 2/2: GOOD Giannis Quickley makes 2/2 from the line.
Score: 68-72

[04:31] Team_044 possession (Score: 68-72)
Ayo McCollum attempts a Layup. BLOCKED BY DEJOUNTE GINOBILI! Ball deflects out of bounds off Ayo McCollum.

[04:13] Team_084 possession (Score: 68-72)
Dejounte Ginobili drives and kicks out. Giannis Quickley attempts a Midrange. Contested by Ayo McCollum (2.2 feet, ZONE). Giannis Quickley misses. Rebound secured by Karl Fox.

[04:02] Team_044 possession (Score: 68-72)
Victor Westbrook attempts a Layup. BLOCKED BY KLAY THOMPSON! Ball is loose! Rebound secured by Klay Thompson.

[03:43] Team_084 possession (Score: 68-72)
Klay Thompson makes the Dunk and draws the foul on Zach McGrady! And-1! Klay Thompson to the line for 1. [BONUS: 5 team fouls] (Zach McGrady: 1 personal fouls)   FT 1/1: GOOD Klay Thompson makes 1/1 from the line.
Score: 71-72

[03:29] Team_044 possession (Score: 71-72)
FOUL! Reach-in foul on Giannis Quickley during the drive. [Team fouls: 4] No free throws, side out. (Giannis Quickley: 2 personal fouls)

[03:11] Team_044 possession (Score: 71-72)
FOUL! Holding foul on Klay Thompson. [IN THE BONUS! 5 team fouls] Victor Westbrook to the line for 2 free throws. (Klay Thompson: 1 personal fouls)   FT 1/2: GOOD   FT 2/2: GOOD Victor Westbrook makes 2/2 from the line.
Score: 71-74

[02:53] Team_084 possession (Score: 71-74)
FOUL! Shooting foul on Ayo McCollum. Giannis Quickley to the line for 2 free throws. [BONUS: 6 team fouls] (Ayo McCollum: 4 personal fouls)   FT 1/2: GOOD   FT 2/2: GOOD Giannis Quickley makes 2/2 from the line.
Score: 73-74

[02:42] Team_044 possession (Score: 73-74)
Zach McGrady attempts a 3Pt. Contested by Luka Sexton (2.0 feet, MAN). ZACH MCGRADY MAKES IT! Assist: Victor Westbrook
Score: 73-77

[02:32] Team_084 possession (Score: 73-77)
Luka Sexton throws a bad pass! Stolen by Zach McGrady! TURNOVER! (live ball)

[02:16] Team_044 possession (Score: 73-77)
Isaiah Murray attempts a 3Pt. Wide open! Luka Sexton is 6.2 feet away. [ZONE] ISAIAH MURRAY MAKES IT! Assist: Zach McGrady
Score: 73-80

[02:06] Team_084 possession (Score: 73-80)
Luka Sexton attempts a 3Pt. Heavily contested by Isaiah Murray (0.5 feet, ZONE)! Luka Sexton misses. Rebound secured by Ayo McCollum.

[01:51] Team_044 possession (Score: 73-80)
Victor Westbrook drives and kicks out. Karl Fox attempts a 3Pt. Wide open! Klay Thompson is 7.3 feet away. [ZONE] KARL FOX MAKES IT! Assist: Zach McGrady
Score: 73-83

[01:38] Team_084 possession (Score: 73-83)
Luka Sexton attempts a Layup. BLOCKED BY VICTOR WESTBROOK! Ball is loose! Rebound secured by Ayo McCollum.

[01:20] Team_044 possession (Score: 73-83)
Ayo McCollum attempts a 3Pt. Contested by Giannis Quickley (4.6 feet, MAN). AYO MCCOLLUM MAKES IT! Assist: Zach McGrady
Score: 73-86

[01:07] Team_084 possession (Score: 73-86)
Jarrett Booker drives, picks up Karl Fox. Help arrives from Zach McGrady! Jarrett Booker attempts a Dunk. Wide open! Zach McGrady is 7.3 feet away. [MAN] Jarrett Booker misses. Rebound secured by Ayo McCollum.

[00:50] Team_044 possession (Score: 73-86)
Isaiah Murray attempts a Midrange. Wide open! Klay Thompson is 6.6 feet away. [ZONE] ISAIAH MURRAY MAKES IT! Assist: Victor Westbrook
Score: 73-88

[00:39] Team_084 possession (Score: 73-88)
Dejounte Ginobili attempts a 3Pt. Wide open! Victor Westbrook is 7.0 feet away. [ZONE] Dejounte Ginobili misses. Rebound secured by Karl Fox.

[00:26] Team_044 possession (Score: 73-88)
Victor Westbrook drives, Klay Thompson stays with him. Victor Westbrook attempts a Dunk. Wide open! Klay Thompson is 7.8 feet away. [MAN] Victor Westbrook misses. Rebound secured by Giannis Quickley.

[00:12] Team_084 possession (Score: 73-88)
Luka Sexton attempts a 3Pt. Contested by Isaiah Murray (3.0 feet, ZONE). LUKA SEXTON MAKES IT! Assist: Klay Thompson
Score: 76-88

================================================================================
                              3RD QUARTER COMPLETE                              
================================================================================

3RD QUARTER SCORE: Team_084 27, Team_044 41

BOX SCORE:
================================================================================

Team_084
--------------------------------------------------------------------------------
Player                MIN  PTS  REB  AST  TO      FG   FG%      3P   3P%
--------------------------------------------------------------------------------
Giannis Quickley       25   10    2    2   0   5/5   100.0     0/0   0.0
Klay Thompson          25    6    2    2   0   2/3    66.7     0/0   0.0
Luka Sexton            26    5    0    0   0   2/6    33.3     0/0   0.0
Dejounte Ginobili      27    2    2    0   0   1/4    25.0     0/0   0.0
Jarrett Booker         27    2    0    1   0   1/3    33.3     0/0   0.0

TEAM: FG: 11/21 (52.4%), 3PT: 2/4 (50.0%), REB: 7 (2 off, 5 def), AST: 5, TO: 4
TEAM FOULS: 5 [Team_044 in BONUS]


Team_044
--------------------------------------------------------------------------------
Player                MIN  PTS  REB  AST  TO      FG   FG%      3P   3P%
--------------------------------------------------------------------------------
Zach McGrady           26   14    0    3   0   6/6   100.0     0/0   0.0
Ayo McCollum           24    9    5    1   0   4/5    80.0     0/0   0.0
Isaiah Murray          27    7    0    2   0   3/4    75.0     0/0   0.0
Karl Fox               26    6    3    0   0   2/2   100.0     0/0   0.0
Victor Westbrook       24    5    1    3   0   2/6    33.3     0/0   0.0

TEAM: FG: 17/23 (73.9%), 3PT: 4/7 (57.1%), REB: 8 (0 off, 8 def), AST: 9, TO: 1
TEAM FOULS: 6 [Team_084 in BONUS]

================================================================================

================================================================================
                       4TH QUARTER - Team_084 vs Team_044                       
================================================================================

[12:00] Substitution (Team_084): Luka Sexton OUT (stamina: 70) → Magic Bryant IN (comeback_detected)

[12:00] Substitution (Team_044): Zach McGrady OUT (stamina: 70) → Kyrie Poole IN (comeback_detected)

[12:00] Team_084 possession (Score: 76-88)
Magic Bryant attempts a 3Pt. Contested by Kyrie Poole (3.8 feet, MAN). MAGIC BRYANT MAKES IT! Assist: Giannis Quickley
Score: 79-88

[11:48] Team_044 possession (Score: 79-88)
Ayo McCollum attempts a 3Pt. Contested by Magic Bryant (4.8 feet, ZONE). Ayo McCollum misses. Rebound secured by Dejounte Ginobili.

[11:32] Team_084 possession (Score: 79-88)
FOUL! Reach-in foul on Isaiah Murray during the drive. [Team fouls: 1] No free throws, side out. (Isaiah Murray: 1 personal fouls)

[11:20] Team_084 possession (Score: 79-88)
Klay Thompson attempts a 3Pt. Contested by Kyrie Poole (3.4 feet, ZONE). KLAY THOMPSON MAKES IT! Assist: Magic Bryant
Score: 82-88

[11:10] Team_044 possession (Score: 82-88)
FOUL! Reach-in foul on Giannis Quickley during the drive. [Team fouls: 1] No free throws, side out. (Giannis Quickley: 1 personal fouls)

[10:53] Team_044 possession (Score: 82-88)
Karl Fox attempts a 3Pt. Wide open! Magic Bryant is 6.4 feet away. [ZONE] Karl Fox misses. Offensive rebound by Victor Westbrook! Victor Westbrook kicks it out.

[10:42] Team_044 possession (Score: 82-88)
Karl Fox loses the ball! Stripped by Jarrett Booker! TURNOVER! (live ball)

[10:28] Team_084 possession (Score: 82-88)
Dejounte Ginobili makes the Layup and draws the foul on Isaiah Murray! And-1! Dejounte Ginobili to the line for 1. [Team fouls: 2] (Isaiah Murray: 2 personal fouls)   FT 1/1: GOOD Dejounte Ginobili makes 1/1 from the line.
Score: 85-88

[10:17] Team_044 possession (Score: 85-88)
FOUL! Shooting foul on Magic Bryant. Victor Westbrook to the line for 3 free throws. [Team fouls: 2] (Magic Bryant: 1 personal fouls)   FT 1/3: GOOD   FT 2/3: GOOD   FT 3/3: GOOD Victor Westbrook makes 3/3 from the line.
Score: 85-91

[10:06] Team_084 possession (Score: 85-91)
Magic Bryant throws a bad pass out of bounds! TURNOVER! (dead ball)

[10:06] Substitution (Team_084): Dejounte Ginobili OUT → Chris Parker IN (stamina_rule2)

[10:06] Substitution (Team_084): Klay Thompson OUT → Evan Quickley IN (stamina_rule2)

[10:06] Substitution (Team_084): Jarrett Booker OUT → Pascal Jackson IN (stamina_rule2)

[10:06] Substitution (Team_084): Giannis Quickley OUT → Dejounte Porzingis IN (stamina_rule2)

[10:06] Substitution (Team_044): Isaiah Murray OUT → Tim Towns IN (stamina_rule2)

[10:06] Substitution (Team_044): Victor Westbrook OUT → Tim Siakam IN (stamina_rule2)

[10:06] Substitution (Team_044): Karl Fox OUT → Pau Quickley IN (stamina_rule2)

[10:06] Substitution (Team_044): Ayo McCollum OUT → Victor Anthony IN (stamina_rule2)

[09:50] Team_044 possession (Score: 85-91)
Victor Anthony loses control! Ball rolls out of bounds! TURNOVER! (dead ball)

[09:39] Team_084 possession (Score: 85-91)
Pascal Jackson drives and kicks out. Chris Parker attempts a Midrange. Heavily contested by Tim Towns (1.7 feet, MAN)! CHRIS PARKER MAKES IT!
Score: 87-91

[09:27] Team_044 possession (Score: 87-91)
Kyrie Poole attempts a Midrange. Contested by Magic Bryant (6.0 feet, MAN). Kyrie Poole misses. Rebound secured by Dejounte Porzingis.

[09:09] Team_084 possession (Score: 87-91)
Magic Bryant attempts a Midrange. Contested by Tim Towns (4.2 feet, ZONE). MAGIC BRYANT MAKES IT!
Score: 89-91

[08:58] Team_044 possession (Score: 89-91)
FOUL! Reach-in foul on Chris Parker during the drive. [Team fouls: 3] No free throws, side out. (Chris Parker: 1 personal fouls)

[08:46] Team_044 possession (Score: 89-91)
Tim Towns drives and kicks out. Tim Towns attempts a Midrange. Contested by Chris Parker (5.2 feet, MAN). Tim Towns misses. FOUL! Loose ball foul on Dejounte Porzingis during the rebound battle. [Team fouls: 4] No free throws, side out. (Dejounte Porzingis: 1 personal fouls)

[08:32] Team_044 possession (Score: 89-91)
FOUL! Shooting foul on Chris Parker. Tim Siakam to the line for 2 free throws. [BONUS: 5 team fouls] (Chris Parker: 2 personal fouls)   FT 1/2: GOOD   FT 2/2: GOOD Tim Siakam makes 2/2 from the line.
Score: 89-93

[08:21] Team_084 possession (Score: 89-93)
Dejounte Porzingis attempts a Layup. Heavily contested by Victor Anthony (1.2 feet, MAN)! DEJOUNTE PORZINGIS MAKES IT! Assist: Magic Bryant
Score: 91-93

[08:07] Team_044 possession (Score: 91-93)
Kyrie Poole attempts a Midrange. Contested by Evan Quickley (3.9 feet, ZONE). Kyrie Poole misses. Offensive rebound by Tim Siakam! Tim Siakam kicks it out.

[07:50] Team_044 possession (Score: 91-93)
Pau Quickley attempts a Layup. Wide open! Pascal Jackson is 6.5 feet away. [ZONE] Pau Quickley misses. Rebound secured by Dejounte Porzingis.

[07:39] Team_084 possession (Score: 91-93)
Chris Parker attempts a 3Pt. Contested by Tim Siakam (2.5 feet, ZONE). Chris Parker misses. Rebound secured by Pau Quickley.

[07:25] Team_044 possession (Score: 91-93)
Pau Quickley attempts a 3Pt. Contested by Magic Bryant (5.3 feet, ZONE). Pau Quickley misses. Rebound secured by Pascal Jackson.

[07:07] Team_084 possession (Score: 91-93)
Pascal Jackson attempts a Midrange. Contested by Tim Siakam (4.9 feet, ZONE). Pascal Jackson misses. Rebound secured by Tim Siakam.

[06:49] Team_044 possession (Score: 91-93)
Tim Towns attempts a Midrange. Contested by Pascal Jackson (4.6 feet, ZONE). TIM TOWNS MAKES IT!
Score: 91-95

[06:36] Team_084 possession (Score: 91-95)
FOUL! Shooting foul on Pau Quickley. Pascal Jackson to the line for 2 free throws. [Team fouls: 3] (Pau Quickley: 1 personal fouls)   FT 1/2: MISS   FT 2/2: MISS Pascal Jackson makes 0/2 from the line. Rebound secured by Tim Siakam.

[06:24] Team_044 possession (Score: 91-95)
Pau Quickley attempts a Midrange. Contested by Pascal Jackson (3.0 feet, MAN). Pau Quickley misses. Rebound secured by Pascal Jackson.

[06:04] Team_084 possession (Score: 91-95)
Chris Parker drives to the basket... Chris Parker loses the ball! Stripped by Pau Quickley! TURNOVER! (live ball)

[05:54] Team_044 possession (Score: 91-95)
Victor Anthony attempts a Midrange. Wide open! Dejounte Porzingis is 9.8 feet away. [MAN] Victor Anthony misses. Offensive rebound by Victor Anthony! Victor Anthony kicks it out.

[05:37] Team_044 possession (Score: 91-95)
Kyrie Poole loses the ball! Stripped by Magic Bryant! TURNOVER! (live ball)

[05:19] Team_084 possession (Score: 91-95)
Magic Bryant attempts a 3Pt. Heavily contested by Kyrie Poole (1.1 feet, MAN)! MAGIC BRYANT MAKES IT! Assist: Dejounte Porzingis
Score: 94-95

[05:05] Team_044 possession (Score: 94-95)
FOUL! Shooting foul on Dejounte Porzingis. Tim Towns to the line for 2 free throws. [BONUS: 6 team fouls] (Dejounte Porzingis: 2 personal fouls)   FT 1/2: MISS   FT 2/2: GOOD Tim Towns makes 1/2 from the line.
Score: 94-96

[04:51] Team_084 possession (Score: 94-96)
Evan Quickley drives, picks up Pau Quickley. Help arrives from Tim Towns! Evan Quickley attempts a Layup. Contested by Tim Towns (3.5 feet, ZONE). EVAN QUICKLEY MAKES IT! Assist: Magic Bryant
Score: 96-96

[04:35] Team_044 possession (Score: 96-96)
Tim Towns attempts a Midrange. Contested by Chris Parker (2.8 feet, MAN). TIM TOWNS MAKES IT! Assist: Tim Siakam
Score: 96-98

[04:23] Team_084 possession (Score: 96-98)
Evan Quickley attempts a Layup. Contested by Pau Quickley (4.1 feet, ZONE). Evan Quickley misses. Rebound secured by Tim Siakam.

[04:09] Team_044 possession (Score: 96-98)
Tim Towns attempts a 3Pt. Heavily contested by Chris Parker (0.5 feet, MAN)! TIM TOWNS MAKES IT! Assist: Pau Quickley
Score: 96-101

[03:52] Team_084 possession (Score: 96-101)
Chris Parker drives to the basket... Chris Parker throws a bad pass out of bounds! TURNOVER! (dead ball)

[03:38] Team_044 possession (Score: 96-101)
Tim Siakam attempts a Layup. Contested by Dejounte Porzingis (3.2 feet, ZONE). Tim Siakam misses. Offensive rebound by Victor Anthony! Victor Anthony kicks it out.

[03:20] Team_044 possession (Score: 96-101)
Kyrie Poole attempts a Midrange. Wide open! Evan Quickley is 6.4 feet away. [ZONE] Kyrie Poole misses. Rebound secured by Dejounte Porzingis.

[03:01] Team_084 possession (Score: 96-101)
Chris Parker attempts a Midrange. Contested by Pau Quickley (2.2 feet, ZONE). Chris Parker misses. Rebound secured by Victor Anthony.

[02:47] Team_044 possession (Score: 96-101)
Victor Anthony attempts a 3Pt. Wide open! Dejounte Porzingis is 6.8 feet away. [MAN] Victor Anthony misses. Rebound secured by Evan Quickley.

[02:28] Team_084 possession (Score: 96-101)
Evan Quickley attempts a Layup. Contested by Pau Quickley (2.4 feet, ZONE). Evan Quickley misses. Rebound secured by Tim Siakam.

[02:16] Team_044 possession (Score: 96-101)
Tim Siakam attempts a Layup. Wide open! Evan Quickley is 6.8 feet away. [MAN] TIM SIAKAM MAKES IT! Assist: Victor Anthony
Score: 96-103

[02:00] Team_084 possession (Score: 96-103)
Pascal Jackson drives to the basket... Pascal Jackson loses control! Ball rolls out of bounds! TURNOVER! (dead ball)

[01:44] Team_044 possession (Score: 96-103)
Kyrie Poole attempts a 3Pt. Contested by Magic Bryant (2.8 feet, MAN). Kyrie Poole misses. Offensive rebound by Tim Siakam! Tim Siakam kicks it out.

[01:27] Team_044 possession (Score: 96-103)
Tim Siakam attempts a 3Pt. Heavily contested by Evan Quickley (1.9 feet, MAN)! Tim Siakam misses. Rebound secured by Dejounte Porzingis.

[01:11] Team_084 possession (Score: 96-103)
Evan Quickley makes the Layup and draws the foul on Tim Siakam! And-1! Evan Quickley to the line for 1. [Team fouls: 4] (Tim Siakam: 1 personal fouls)   FT 1/1: MISS Evan Quickley makes 0/1 from the line. Offensive rebound by Dejounte Porzingis! Dejounte Porzingis kicks it out.
Score: 98-103

[00:56] Team_084 possession (Score: 98-103)
Magic Bryant attempts a 3Pt. Wide open! Kyrie Poole is 6.1 feet away. [MAN] MAGIC BRYANT MAKES IT! Assist: Evan Quickley
Score: 101-103

[00:45] Team_044 possession (Score: 101-103)
Tim Towns attempts a 3Pt. Contested by Chris Parker (2.3 feet, MAN). Tim Towns misses. Offensive rebound by Victor Anthony! Victor Anthony kicks it out.

[00:32] Team_044 possession (Score: 101-103)
Victor Anthony attempts a Midrange. Wide open! Dejounte Porzingis is 6.5 feet away. [MAN] Victor Anthony misses. FOUL! Loose ball foul on Evan Quickley during the rebound battle. [IN THE BONUS! 7 team fouls] Tim Siakam to the line for 2 free throws. (Evan Quickley: 1 personal fouls)   FT 1/2: MISS   FT 2/2: GOOD Tim Siakam makes 1/2 from the line.
Score: 101-104

[00:19] Team_084 possession (Score: 101-104)
Magic Bryant drives, Pau Quickley stays with him. Magic Bryant attempts a Dunk. Contested by Pau Quickley (4.3 feet, ZONE). MAGIC BRYANT MAKES IT! Assist: Pascal Jackson
Score: 103-104

[00:02] Team_044 possession (Score: 103-104)
FOUL! Holding foul on Magic Bryant. [IN THE BONUS! 8 team fouls] Kyrie Poole to the line for 2 free throws. (Magic Bryant: 2 personal fouls)   FT 1/2: GOOD   FT 2/2: GOOD Kyrie Poole makes 2/2 from the line.
Score: 103-106

================================================================================
                              4TH QUARTER COMPLETE                              
================================================================================

4TH QUARTER SCORE: Team_084 27, Team_044 18

BOX SCORE:
================================================================================

Team_084
--------------------------------------------------------------------------------
Player                MIN  PTS  REB  AST  TO      FG   FG%      3P   3P%
--------------------------------------------------------------------------------
Magic Bryant           23   13    0    3   0   5/5   100.0     0/0   0.0
Dejounte Ginobili      29    3    1    0   0   1/1   100.0     0/0   0.0
Klay Thompson          27    3    0    0   0   1/1   100.0     0/0   0.0
Chris Parker           19    2    0    0   0   1/3    33.3     0/0   0.0
Dejounte Porzingis     22    2    5    1   0   1/1   100.0     0/0   0.0
Evan Quickley          22    2    1    1   0   1/3    33.3     0/0   0.0
Giannis Quickley       27    0    0    1   0   0/0     0.0     0/0   0.0
Pascal Jackson         19    0    2    1   0   0/2     0.0     0/0   0.0

TEAM: FG: 10/16 (62.5%), 3PT: 4/5 (80.0%), REB: 9 (1 off, 8 def), AST: 7, TO: 4
TEAM FOULS: 8 [Team_044 in BONUS]


Team_044
--------------------------------------------------------------------------------
Player                MIN  PTS  REB  AST  TO      FG   FG%      3P   3P%
--------------------------------------------------------------------------------
Tim Towns              19    8    0    0   0   4/4   100.0     0/0   0.0
Tim Siakam             22    5    6    1   0   3/4    75.0     0/0   0.0
Victor Westbrook       26    3    1    0   0   1/1   100.0     0/0   0.0
Kyrie Poole            23    2    0    0   0   1/3    33.3     0/0   0.0
Ayo McCollum           26    0    0    0   0   0/1     0.0     0/0   0.0
Victor Anthony         22    0    5    1   0   0/1     0.0     0/0   0.0
Pau Quickley           20    0    1    1   0   0/3     0.0     0/0   0.0

TEAM: FG: 9/17 (52.9%), 3PT: 2/6 (33.3%), REB: 13 (7 off, 6 def), AST: 3, TO: 3
TEAM FOULS: 4

================================================================================

================================================================================
                               FULL GAME COMPLETE                               
================================================================================

FINAL SCORE: Team_084 103, Team_044 106

SCORING BY QUARTER:
--------------------------------------------------------------------------------
Team                     Q1     Q2     Q3     Q4    FINAL
--------------------------------------------------------------------------------
Team_084                 20     29     27     27      103
Team_044                 21     26     41     18      106
--------------------------------------------------------------------------------

FULL GAME BOX SCORE:
================================================================================

Team_084
--------------------------------------------------------------------------------
Player                MIN  PTS  REB  AST  TO      FG   FG%      3P   3P%      FT STL BLK
--------------------------------------------------------------------------------
Dejounte Ginobili      29    9    5    0   0   5/9    55.6   1/2    50.0   1/2     0   1
Jarrett Booker         29    2    2    3   1   2/5    40.0   1/2    50.0   0/1     1   0
Klay Thompson          27   14    6    3   6   5/7    71.4   3/3   100.0   4/4     0   1
Giannis Quickley       27   21    6    3   2   7/7   100.0   0/0     0.0   4/4     0   0
Luka Sexton            26   12    0    4   2   5/14   35.7   2/7    28.6   2/2     1   0
Magic Bryant           23   16    0    4   2   6/7    85.7   3/4    75.0   1/1     1   0
Evan Quickley          22   13    4    2   0   5/11   45.5   3/4    75.0   0/1     0   0
Dejounte Porzingis     22    4    7    2   1   2/5    40.0   0/0     0.0   0/0     0   0
Chris Parker           19    2    0    1   1   0/3     0.0   0/1     0.0   0/0     0   0
Pascal Jackson         19    6    5    2   2   4/7    57.1   0/0     0.0   2/4     0   0

TEAM: FG: 41/75 (54.7%), 3PT: 13/23 (56.5%), REB: 34 (6 off, 28 def), AST: 24, TO: 17


Team_044
--------------------------------------------------------------------------------
Player                MIN  PTS  REB  AST  TO      FG   FG%      3P   3P%      FT STL BLK
--------------------------------------------------------------------------------
Isaiah Murray          29   17    0    3   0   7/10   70.0   2/4    50.0   0/0     0   0
Karl Fox               28   16    7    3   1   6/7    85.7   0/1     0.0   3/3     1   1
Victor Westbrook       26    8    3    5   1   3/9    33.3   2/4    50.0   5/5     0   1
Ayo McCollum           26   11    8    1   2   5/8    62.5   1/2    50.0   1/2     0   0
Zach McGrady           26   19    0    5   2   8/10   80.0   2/4    50.0   1/1     1   0
Kyrie Poole            23   12    0    2   3   3/6    50.0   2/2   100.0   2/2     0   0
Tim Siakam             22    9   13    1   1   5/8    62.5   0/1     0.0   3/4     0   0
Victor Anthony         22    2    7    5   1   2/4    50.0   0/1     0.0   0/0     0   0
Pau Quickley           20    0    3    1   0   0/6     0.0   0/1     0.0   0/0     1   0
Tim Towns              19   12    0    0   1   6/7    85.7   1/2    50.0   1/2     0   0

TEAM: FG: 47/77 (61.0%), 3PT: 10/22 (45.5%), REB: 41 (9 off, 32 def), AST: 26, TO: 12

================================================================================
