================================================================================
                        FULL GAME - Team_065 vs Team_076                        
================================================================================

================================================================================
                       1ST QUARTER - Team_065 vs Team_076                       
================================================================================

[12:00] Team_065 possession (Score: 0-0)
Paul Williamson drives, Tobias Mitchell stays with him. Paul Williamson attempts a Layup. Contested by Tobias Mitchell (5.9 feet, MAN). Paul Williamson misses. Offensive rebound by Russell Wade! Russell Wade's putback is no good. Offensive rebound by Manu McGrady! Manu McGrady kicks it out.

[11:44] Team_065 possession (Score: 0-0)
RJ Harden drives, Cade Barnes stays with him. RJ Harden attempts a Dunk. Contested by Cade Barnes (4.9 feet, ZONE). RJ HARDEN MAKES IT! Assist: Manu McGrady
Score: 2-0

[11:33] Team_076 possession (Score: 2-0)
Cade Barnes attempts a 3Pt. Contested by RJ Harden (2.2 feet, ZONE). Cade Barnes misses. Rebound secured by RJ Harden.

[11:19] Team_065 possession (Score: 2-0)
Manu McGrady attempts a 3Pt. Contested by Cade Barnes (5.6 feet, ZONE). Manu McGrady misses. Rebound secured by Cade Barnes.

[11:04] Team_076 possession (Score: 2-0)
D'Angelo Tatum attempts a Layup. BLOCKED BY KARL BOOKER! Ball is loose! Rebound secured by Russell Wade.

[10:50] Team_065 possession (Score: 2-0)
Paul Williamson makes the Layup and draws the foul on Cade Barnes! And-1! Paul Williamson to the line for 1. [Team fouls: 1] (Cade Barnes: 1 personal fouls)   FT 1/1: GOOD Paul Williamson makes 1/1 from the line.
Score: 5-0

[10:33] Team_076 possession (Score: 5-0)
FOUL! Offensive foul on Tobias Mitchell! Paul Williamson drew the charge! [Team fouls: 2] (Tobias Mitchell: 1 personal fouls) TURNOVER! (dead ball)

[10:22] Team_065 possession (Score: 5-0)
Manu McGrady loses control! Ball rolls out of bounds! TURNOVER! (dead ball)

[10:09] Team_076 possession (Score: 5-0)
Dejounte LaVine attempts a Midrange. Contested by RJ Harden (2.9 feet, MAN). Dejounte LaVine misses. Rebound secured by RJ Harden.

[09:51] Team_065 possession (Score: 5-0)
FOUL! Shooting foul on Cade Barnes. Russell Wade to the line for 2 free throws. [Team fouls: 3] (Cade Barnes: 2 personal fouls)   FT 1/2: GOOD   FT 2/2: GOOD Russell Wade makes 2/2 from the line.
Score: 7-0

[09:36] Team_076 possession (Score: 7-0)
Dejounte LaVine drives to the basket... Dejounte LaVine throws a bad pass! Stolen by RJ Harden! TURNOVER! (live ball)

[09:21] Team_065 possession (Score: 7-0)
Russell Wade attempts a Midrange. Contested by Tobias Mitchell (4.8 feet, ZONE). Russell Wade misses. Rebound secured by D'Angelo Tatum.

[09:07] Team_076 possession (Score: 7-0)
Cade Barnes attempts a Midrange. Wide open! Russell Wade is 7.7 feet away. [ZONE] Cade Barnes misses. Rebound secured by Manu McGrady.

[08:54] Team_065 possession (Score: 7-0)
RJ Harden drives, D'Angelo Tatum stays with him. RJ Harden attempts a Dunk. Contested by D'Angelo Tatum (4.0 feet, ZONE). RJ HARDEN MAKES IT! Assist: Paul Williamson
Score: 9-0

[08:41] Team_076 possession (Score: 9-0)
Tobias Mitchell makes the Midrange and draws the foul on Paul Williamson! And-1! Tobias Mitchell to the line for 1. [Team fouls: 1] (Paul Williamson: 1 personal fouls)   FT 1/1: GOOD Tobias Mitchell makes 1/1 from the line.
Score: 9-3

[08:29] Team_065 possession (Score: 9-3)
Paul Williamson attempts a Midrange. Contested by Tobias Mitchell (5.1 feet, MAN). Paul Williamson misses. Rebound secured by Cade Barnes.

[08:14] Team_076 possession (Score: 9-3)
Cade Barnes attempts a 3Pt. Contested by Russell Wade (4.1 feet, MAN). Cade Barnes misses. Rebound secured by Russell Wade.

[08:03] Team_065 possession (Score: 9-3)
Karl Booker drives to the basket... Karl Booker throws a bad pass out of bounds! TURNOVER! (dead ball)

[07:46] Team_076 possession (Score: 9-3)
D'Angelo Tatum attempts a Layup. Heavily contested by Russell Wade (1.1 feet, MAN)! D'ANGELO TATUM MAKES IT! Assist: Tobias Mitchell
Score: 9-5

[07:33] Team_065 possession (Score: 9-5)
Paul Williamson attempts a Midrange. Heavily contested by Paul Leonard (0.5 feet, ZONE)! PAUL WILLIAMSON MAKES IT! Assist: RJ Harden
Score: 11-5

[07:16] Team_076 possession (Score: 11-5)
D'Angelo Tatum attempts a Midrange. Contested by Russell Wade (5.2 feet, MAN). D'ANGELO TATUM MAKES IT! Assist: Paul Leonard
Score: 11-7

[07:00] Team_065 possession (Score: 11-7)
Karl Booker attempts a 3Pt. Heavily contested by D'Angelo Tatum (0.5 feet, MAN)! Karl Booker misses. Rebound secured by Tobias Mitchell.

[06:50] Team_076 possession (Score: 11-7)
FOUL! Offensive foul on D'Angelo Tatum! Russell Wade drew the charge! [Team fouls: 4] (D'Angelo Tatum: 1 personal fouls) TURNOVER! (dead ball)

[06:37] Team_065 possession (Score: 11-7)
Karl Booker attempts a Layup. Contested by Cade Barnes (2.9 feet, ZONE). KARL BOOKER MAKES IT! Assist: Paul Williamson
Score: 13-7

[06:27] Team_076 possession (Score: 13-7)
Paul Leonard attempts a 3Pt. Wide open! Manu McGrady is 6.7 feet away. [MAN] Paul Leonard misses. Offensive rebound by D'Angelo Tatum! D'Angelo Tatum kicks it out.

[06:14] Team_076 possession (Score: 13-7)
D'Angelo Tatum attempts a Layup. BLOCKED BY RUSSELL WADE! Ball goes out off Russell Wade. D'Angelo Tatum's ball!

[05:58] Team_076 possession (Score: 13-7)
Tobias Mitchell drives and kicks out. Cade Barnes attempts a 3Pt. Heavily contested by RJ Harden (1.1 feet, ZONE)! Cade Barnes misses. Rebound secured by RJ Harden.

[05:42] Team_065 possession (Score: 13-7)
Manu McGrady attempts a Midrange. Wide open! Paul Leonard is 6.8 feet away. [MAN] MANU MCGRADY MAKES IT! Assist: Paul Williamson
Score: 15-7

[05:27] Team_076 possession (Score: 15-7)
FOUL! Reach-in foul on Karl Booker during the drive. [Team fouls: 2] No free throws, side out. (Karl Booker: 1 personal fouls)

[05:14] Team_076 possession (Score: 15-7)
FOUL! Shooting foul on Karl Booker. D'Angelo Tatum to the line for 2 free throws. [Team fouls: 3] (Karl Booker: 2 personal fouls)   FT 1/2: MISS   FT 2/2: GOOD D'Angelo Tatum makes 1/2 from the line.
Score: 15-8

[04:59] Team_065 possession (Score: 15-8)
FOUL! Shooting foul on Tobias Mitchell. Paul Williamson to the line for 2 free throws. [BONUS: 5 team fouls] (Tobias Mitchell: 2 personal fouls)   FT 1/2: MISS   FT 2/2: GOOD Paul Williamson makes 1/2 from the line.
Score: 16-8

[04:41] Team_076 possession (Score: 16-8)
FOUL! Holding foul on Paul Williamson. [Team fouls: 4] No free throws, side out. (Paul Williamson: 2 personal fouls)

[04:25] Team_076 possession (Score: 16-8)
Dejounte LaVine attempts a 3Pt. Heavily contested by RJ Harden (1.4 feet, ZONE)! Dejounte LaVine misses. Rebound secured by Manu McGrady.

[04:14] Team_065 possession (Score: 16-8)
Paul Williamson attempts a 3Pt. Heavily contested by Cade Barnes (2.0 feet, ZONE)! Paul Williamson misses. Rebound secured by D'Angelo Tatum.

[04:02] Team_076 possession (Score: 16-8)
FOUL! Holding foul on Manu McGrady. [IN THE BONUS! 5 team fouls] Paul Leonard to the line for 2 free throws. (Manu McGrady: 1 personal fouls)   FT 1/2: GOOD   FT 2/2: GOOD Paul Leonard makes 2/2 from the line.
Score: 16-10

[03:46] Team_065 possession (Score: 16-10)
Karl Booker attempts a Midrange. Contested by D'Angelo Tatum (4.1 feet, MAN). Karl Booker misses. Rebound secured by D'Angelo Tatum.

[03:32] Team_076 possession (Score: 16-10)
Cade Barnes attempts a 3Pt. Contested by Russell Wade (2.1 feet, MAN). Cade Barnes misses. Offensive rebound by Cade Barnes! Cade Barnes kicks it out.

[03:16] Team_076 possession (Score: 16-10)
Paul Leonard attempts a Layup. Contested by Russell Wade (4.2 feet, ZONE). Paul Leonard misses. Rebound secured by Manu McGrady.

[03:04] Team_065 possession (Score: 16-10)
FOUL! Holding foul on Cade Barnes. [IN THE BONUS! 6 team fouls] Russell Wade to the line for 2 free throws. (Cade Barnes: 3 personal fouls)   FT 1/2: GOOD   FT 2/2: MISS Russell Wade makes 1/2 from the line. Rebound secured by D'Angelo Tatum.
Score: 17-10

[02:49] Team_076 possession (Score: 17-10)
Paul Leonard attempts a Midrange. Heavily contested by Russell Wade (1.3 feet, ZONE)! Paul Leonard misses. Rebound secured by Russell Wade.

[02:35] Team_065 possession (Score: 17-10)
Karl Booker attempts a Midrange. Contested by D'Angelo Tatum (2.9 feet, MAN). KARL BOOKER MAKES IT! Assist: Russell Wade
Score: 19-10

[02:20] Team_076 possession (Score: 19-10)
Dejounte LaVine attempts a 3Pt. Contested by RJ Harden (4.2 feet, MAN). Dejounte LaVine misses. Rebound secured by Manu McGrady.

[02:06] Team_065 possession (Score: 19-10)
Karl Booker attempts a 3Pt. Contested by Cade Barnes (2.4 feet, ZONE). KARL BOOKER MAKES IT! Assist: Manu McGrady
Score: 22-10

[01:50] Team_076 possession (Score: 22-10)
Paul Leonard commits a violation (traveling/carry)! TURNOVER! (dead ball)

[01:50] Substitution (Team_065): RJ Harden OUT → Paul Curry IN (stamina_rule2)

[01:50] Substitution (Team_065): Paul Williamson OUT → Derrick Poole IN (stamina_rule2)

[01:50] Substitution (Team_065): Manu McGrady OUT → D'Angelo Porzingis IN (stamina_rule2)

[01:50] Substitution (Team_065): Russell Wade OUT → Karl Leonard IN (stamina_rule2)

[01:50] Substitution (Team_065): Karl Booker OUT → Vince Mobley IN (stamina_rule2)

[01:50] Substitution (Team_076): Dejounte LaVine OUT → Pascal Lowry IN (stamina_rule2)

[01:50] Substitution (Team_076): Tobias Mitchell OUT → Jalen Poole IN (stamina_rule2)

[01:50] Substitution (Team_076): Paul Leonard OUT → Vince Lowry IN (stamina_rule2)

[01:50] Substitution (Team_076): Cade Barnes OUT → Kevin Nowitzki IN (stamina_rule2)

[01:50] Substitution (Team_076): D'Angelo Tatum OUT → Jordan Doncic IN (stamina_rule2)

[01:39] Team_065 possession (Score: 22-10)
D'Angelo Porzingis throws a bad pass! Stolen by Vince Lowry! TURNOVER! (live ball)

[01:24] Team_076 possession (Score: 22-10)
Pascal Lowry attempts a Midrange. Heavily contested by Paul Curry (1.7 feet, MAN)! PASCAL LOWRY MAKES IT! Assist: Vince Lowry
Score: 22-12

[01:12] Team_065 possession (Score: 22-12)
Paul Curry attempts a 3Pt. Contested by Pascal Lowry (4.1 feet, MAN). Paul Curry misses. Offensive rebound by Vince Mobley! Vince Mobley's putback is no good. Offensive rebound by D'Angelo Porzingis! D'Angelo Porzingis kicks it out.

[00:55] Team_065 possession (Score: 22-12)
Vince Mobley makes the Dunk and draws the foul on Jalen Poole! And-1! Vince Mobley to the line for 1. [BONUS: 7 team fouls] (Jalen Poole: 1 personal fouls)   FT 1/1: GOOD Vince Mobley makes 1/1 from the line.
Score: 25-12

[00:39] Team_076 possession (Score: 25-12)
Jalen Poole attempts a 3Pt. Wide open! Derrick Poole is 7.3 feet away. [MAN] JALEN POOLE MAKES IT! Assist: Pascal Lowry
Score: 25-15

[00:23] Team_065 possession (Score: 25-15)
D'Angelo Porzingis attempts a 3Pt. Heavily contested by Vince Lowry (0.5 feet, ZONE)! D'Angelo Porzingis misses. FOUL! Loose ball foul on Vince Lowry during the rebound battle. [IN THE BONUS! 8 team fouls] Vince Mobley to the line for 2 free throws. (Vince Lowry: 1 personal fouls)   FT 1/2: GOOD   FT 2/2: GOOD Vince Mobley makes 2/2 from the line.
Score: 27-15

[00:07] Team_076 possession (Score: 27-15)
Pascal Lowry drives to the basket... Pascal Lowry loses the ball! Stripped by Vince Mobley! TURNOVER! (live ball)

================================================================================
                              1ST QUARTER COMPLETE                              
================================================================================

1ST QUARTER SCORE: Team_065 27, Team_076 15

BOX SCORE:
================================================================================

Team_065
--------------------------------------------------------------------------------
Player                MIN  PTS  REB  AST  TO      FG   FG%      3P   3P%
--------------------------------------------------------------------------------
Karl Booker            10    7    0    0   0   3/5    60.0     0/0   0.0
Paul Williamson        10    6    0    3   0   3/5    60.0     0/0   0.0
Vince Mobley            2    5    0    0   0   2/2   100.0     0/0   0.0
RJ Harden              10    4    3    1   0   2/2   100.0     0/0   0.0
Manu McGrady           10    2    5    2   0   1/2    50.0     0/0   0.0
Russell Wade           10    2    3    1   0   1/2    50.0     0/0   0.0
D'Angelo Porzingis      2    0    1    0   0   0/0     0.0     0/0   0.0

TEAM: FG: 12/19 (63.2%), 3PT: 2/5 (40.0%), REB: 12 (2 off, 10 def), AST: 7, TO: 3
TEAM FOULS: 5 [Team_076 in BONUS]


Team_076
--------------------------------------------------------------------------------
Player                MIN  PTS  REB  AST  TO      FG   FG%      3P   3P%
--------------------------------------------------------------------------------
D'Angelo Tatum         10    5    5    0   0   3/4    75.0     0/0   0.0
Tobias Mitchell        10    3    1    1   0   1/2    50.0     0/0   0.0
Jalen Poole             2    3    0    0   0   1/1   100.0     0/0   0.0
Paul Leonard           10    2    0    1   0   1/3    33.3     0/0   0.0
Pascal Lowry            2    2    0    1   0   1/1   100.0     0/0   0.0
Cade Barnes            10    0    3    0   0   0/3     0.0     0/0   0.0
Dejounte LaVine        10    0    0    0   0   0/3     0.0     0/0   0.0
Vince Lowry             2    0    0    1   0   0/0     0.0     0/0   0.0

TEAM: FG: 7/17 (41.2%), 3PT: 1/5 (20.0%), REB: 9 (2 off, 7 def), AST: 4, TO: 5
TEAM FOULS: 8 [Team_065 in BONUS]

================================================================================

================================================================================
                       2ND QUARTER - Team_065 vs Team_076                       
================================================================================

[12:00] Team_065 possession (Score: 27-15)
RJ Harden attempts a 3Pt. Heavily contested by Cade Barnes (0.5 feet, ZONE)! RJ Harden misses. Rebound secured by Cade Barnes.

[11:45] Team_076 possession (Score: 27-15)
FOUL! Reach-in foul on Russell Wade during the drive. [Team fouls: 1] No free throws, side out. (Russell Wade: 1 personal fouls)

[11:32] Team_076 possession (Score: 27-15)
Dejounte LaVine drives, picks up Russell Wade. Help arrives from Paul Williamson! Dejounte LaVine attempts a Layup. Contested by Paul Williamson (5.8 feet, ZONE). DEJOUNTE LAVINE MAKES IT! Assist: D'Angelo Tatum
Score: 27-17

[11:17] Team_065 possession (Score: 27-17)
RJ Harden attempts a 3Pt. Wide open! Cade Barnes is 8.4 feet away. [ZONE] RJ HARDEN MAKES IT!
Score: 30-17

[11:01] Team_076 possession (Score: 30-17)
Tobias Mitchell attempts a 3Pt. Contested by Paul Williamson (2.9 feet, MAN). Tobias Mitchell misses. Offensive rebound by Cade Barnes! Cade Barnes kicks it out.

[10:45] Team_076 possession (Score: 30-17)
Paul Leonard drives and kicks out. Tobias Mitchell attempts a Midrange. Wide open! Paul Williamson is 6.5 feet away. [MAN] TOBIAS MITCHELL MAKES IT! Assist: D'Angelo Tatum
Score: 30-19

[10:29] Team_065 possession (Score: 30-19)
Manu McGrady attempts a 3Pt. Wide open! Cade Barnes is 7.8 feet away. [ZONE] Manu McGrady misses. Rebound secured by Tobias Mitchell.

[10:12] Team_076 possession (Score: 30-19)
Tobias Mitchell drives, Russell Wade stays with him. Tobias Mitchell attempts a Dunk. Contested by Russell Wade (5.9 feet, ZONE). TOBIAS MITCHELL MAKES IT! Assist: Paul Leonard
Score: 30-21

[09:59] Team_065 possession (Score: 30-21)
RJ Harden throws a bad pass! Stolen by Dejounte LaVine! TURNOVER! (live ball)

[09:48] Team_076 possession (Score: 30-21)
Paul Leonard loses control! Ball rolls out of bounds! TURNOVER! (dead ball)

[09:48] Substitution (Team_065): Karl Booker OUT → Vince Mobley IN (stamina_rule2)

[09:48] Substitution (Team_076): Dejounte LaVine OUT → Pascal Lowry IN (stamina_rule2)

[09:48] Substitution (Team_076): Tobias Mitchell OUT → Jalen Poole IN (stamina_rule2)

[09:48] Substitution (Team_076): Paul Leonard OUT → Vince Lowry IN (stamina_rule2)

[09:48] Substitution (Team_076): Cade Barnes OUT → Kevin Nowitzki IN (stamina_rule2)

[09:30] Team_065 possession (Score: 30-21)
Manu McGrady attempts a 3Pt. Wide open! Vince Lowry is 7.4 feet away. [ZONE] Manu McGrady misses. Rebound secured by Kevin Nowitzki.

[09:15] Team_076 possession (Score: 30-21)
Vince Lowry attempts a Layup. Contested by Manu McGrady (5.4 feet, MAN). VINCE LOWRY MAKES IT!
Score: 30-23

[09:01] Team_065 possession (Score: 30-23)
FOUL! Holding foul on Kevin Nowitzki. [Team fouls: 1] No free throws, side out. (Kevin Nowitzki: 1 personal fouls)

[08:44] Team_065 possession (Score: 30-23)
Vince Mobley attempts a Layup. Heavily contested by D'Angelo Tatum (1.2 feet, MAN)! VINCE MOBLEY MAKES IT!
Score: 32-23

[08:33] Team_076 possession (Score: 32-23)
Vince Lowry attempts a 3Pt. Contested by RJ Harden (2.9 feet, ZONE). Vince Lowry misses. Offensive rebound by D'Angelo Tatum! D'Angelo Tatum kicks it out.

[08:14] Team_076 possession (Score: 32-23)
Pascal Lowry drives to the basket... Pascal Lowry loses the ball! Stripped by Russell Wade! TURNOVER! (live ball)

[07:56] Team_065 possession (Score: 32-23)
RJ Harden attempts a 3Pt. Contested by Vince Lowry (2.3 feet, ZONE). RJ Harden misses. Rebound secured by D'Angelo Tatum.

[07:46] Team_076 possession (Score: 32-23)
Jalen Poole attempts a 3Pt. Contested by Paul Williamson (5.3 feet, MAN). JALEN POOLE MAKES IT! Assist: Kevin Nowitzki
Score: 32-26

[07:32] Team_065 possession (Score: 32-26)
FOUL! Holding foul on Pascal Lowry. [Team fouls: 2] No free throws, side out. (Pascal Lowry: 1 personal fouls)

[07:13] Team_065 possession (Score: 32-26)
Paul Williamson attempts a 3Pt. Contested by Vince Lowry (3.4 feet, ZONE). PAUL WILLIAMSON MAKES IT! Assist: Manu McGrady
Score: 35-26

[07:02] Team_076 possession (Score: 35-26)
Jalen Poole makes the Midrange and draws the foul on Paul Williamson! And-1! Jalen Poole to the line for 1. [Team fouls: 2] (Paul Williamson: 1 personal fouls)   FT 1/1: GOOD Jalen Poole makes 1/1 from the line.
Score: 35-29

[06:47] Team_065 possession (Score: 35-29)
RJ Harden attempts a 3Pt. Contested by Pascal Lowry (5.8 feet, MAN). RJ Harden misses. Rebound secured by Kevin Nowitzki.

[06:32] Team_076 possession (Score: 35-29)
Jalen Poole drives to the basket... Jalen Poole throws a bad pass! Stolen by Paul Williamson! TURNOVER! (live ball)

[06:21] Team_065 possession (Score: 35-29)
RJ Harden drives and kicks out. RJ Harden attempts a 3Pt. Contested by Vince Lowry (3.4 feet, ZONE). RJ Harden misses. Rebound secured by Vince Lowry.

[06:11] Team_076 possession (Score: 35-29)
Jalen Poole attempts a Layup. BLOCKED BY PAUL WILLIAMSON! Ball goes out off Paul Williamson. Jalen Poole's ball!

[05:58] Team_076 possession (Score: 35-29)
Vince Lowry makes the Layup and draws the foul on Manu McGrady! And-1! Vince Lowry to the line for 1. [Team fouls: 3] (Manu McGrady: 1 personal fouls)   FT 1/1: GOOD Vince Lowry makes 1/1 from the line.
Score: 35-32

[05:41] Team_065 possession (Score: 35-32)
Russell Wade drives, Kevin Nowitzki stays with him. Russell Wade attempts a Layup. Contested by Kevin Nowitzki (2.4 feet, MAN). RUSSELL WADE MAKES IT! Assist: RJ Harden
Score: 37-32

[05:30] Team_076 possession (Score: 37-32)
Jalen Poole attempts a Midrange. Contested by Paul Williamson (4.9 feet, ZONE). Jalen Poole misses. Rebound secured by Manu McGrady.

[05:14] Team_065 possession (Score: 37-32)
Vince Mobley drives, picks up D'Angelo Tatum. Help arrives from Jalen Poole! Vince Mobley attempts a Dunk. Wide open! Jalen Poole is 6.7 feet away. [MAN] VINCE MOBLEY MAKES IT!
Score: 39-32

[04:57] Team_076 possession (Score: 39-32)
Jalen Poole drives and kicks out. Kevin Nowitzki attempts a 3Pt. Contested by RJ Harden (4.1 feet, ZONE). KEVIN NOWITZKI MAKES IT! Assist: Pascal Lowry
Score: 39-35

[04:43] Team_065 possession (Score: 39-35)
Russell Wade attempts a 3Pt. Wide open! Kevin Nowitzki is 6.1 feet away. [MAN] RUSSELL WADE MAKES IT! Assist: Manu McGrady
Score: 42-35

[04:28] Team_076 possession (Score: 42-35)
Kevin Nowitzki attempts a Midrange. Wide open! Paul Williamson is 6.1 feet away. [ZONE] Kevin Nowitzki misses. Rebound secured by Manu McGrady.

[04:15] Team_065 possession (Score: 42-35)
Manu McGrady attempts a Layup. Contested by Vince Lowry (3.8 feet, MAN). Manu McGrady misses. Offensive rebound by Vince Mobley! Vince Mobley's putback is no good. Rebound secured by Vince Lowry.

[04:01] Team_076 possession (Score: 42-35)
Vince Lowry attempts a 3Pt. Contested by Manu McGrady (4.2 feet, MAN). Vince Lowry misses. Rebound secured by Russell Wade.

[03:45] Team_065 possession (Score: 42-35)
Manu McGrady attempts a 3Pt. Wide open! Jalen Poole is 9.5 feet away. [ZONE] Manu McGrady misses. Offensive rebound by Russell Wade! Russell Wade puts it back in!
Score: 44-35

[03:26] Team_076 possession (Score: 44-35)
Jalen Poole attempts a 3Pt. Contested by RJ Harden (4.7 feet, ZONE). Jalen Poole misses. Rebound secured by Vince Mobley.

[03:10] Team_065 possession (Score: 44-35)
Manu McGrady throws a bad pass! Stolen by Vince Lowry! TURNOVER! (live ball)

[02:54] Team_076 possession (Score: 44-35)
Jalen Poole attempts a Midrange. Wide open! Manu McGrady is 9.3 feet away. [ZONE] JALEN POOLE MAKES IT! Assist: Kevin Nowitzki
Score: 44-37

[02:37] Team_065 possession (Score: 44-37)
Manu McGrady attempts a 3Pt. Contested by Vince Lowry (3.0 feet, MAN). Manu McGrady misses. Offensive rebound by Vince Mobley! Vince Mobley's putback is no good. Rebound secured by D'Angelo Tatum.

[02:25] Team_076 possession (Score: 44-37)
D'Angelo Tatum throws a bad pass out of bounds! TURNOVER! (dead ball)

[02:25] Substitution (Team_065): RJ Harden OUT → Paul Curry IN (stamina_rule2)

[02:25] Substitution (Team_065): Paul Williamson OUT → Derrick Poole IN (stamina_rule2)

[02:25] Substitution (Team_065): Manu McGrady OUT → D'Angelo Porzingis IN (stamina_rule2)

[02:25] Substitution (Team_065): Russell Wade OUT → Karl Leonard IN (stamina_rule2)

[02:25] Substitution (Team_076): D'Angelo Tatum OUT → Jordan Doncic IN (stamina_rule2)

[02:09] Team_065 possession (Score: 44-37)
Paul Curry attempts a 3Pt. Wide open! Pascal Lowry is 8.0 feet away. [MAN] PAUL CURRY MAKES IT! Assist: D'Angelo Porzingis
Score: 47-37

[01:54] Team_076 possession (Score: 47-37)
Vince Lowry attempts a Midrange. Contested by D'Angelo Porzingis (2.9 feet, MAN). Vince Lowry misses. Offensive rebound by Kevin Nowitzki! Kevin Nowitzki kicks it out.

[01:45] Team_076 possession (Score: 47-37)
Kevin Nowitzki attempts a 3Pt. Contested by Paul Curry (4.9 feet, ZONE). Kevin Nowitzki misses. Offensive rebound by Jordan Doncic! Jordan Doncic kicks it out.

[01:27] Team_076 possession (Score: 47-37)
Pascal Lowry attempts a 3Pt. Contested by Paul Curry (2.0 feet, ZONE). Pascal Lowry misses. Rebound secured by D'Angelo Porzingis.

[01:12] Team_065 possession (Score: 47-37)
Paul Curry attempts a 3Pt. Wide open! Pascal Lowry is 10.0 feet away. [MAN] Paul Curry misses. Rebound secured by Jordan Doncic.

[00:57] Team_076 possession (Score: 47-37)
Jalen Poole attempts a 3Pt. Heavily contested by Paul Curry (1.9 feet, ZONE)! Jalen Poole misses. Rebound secured by D'Angelo Porzingis.

[00:42] Team_065 possession (Score: 47-37)
FOUL! Holding foul on Kevin Nowitzki. [Team fouls: 3] No free throws, side out. (Kevin Nowitzki: 2 personal fouls)

[00:27] Team_065 possession (Score: 47-37)
Paul Curry throws a bad pass out of bounds! TURNOVER! (dead ball)

[00:10] Team_076 possession (Score: 47-37)
Pascal Lowry drives to the basket... Pascal Lowry loses control! Ball rolls out of bounds! TURNOVER! (dead ball)

================================================================================
                              2ND QUARTER COMPLETE                              
================================================================================

2ND QUARTER SCORE: Team_065 20, Team_076 22

BOX SCORE:
================================================================================

Team_065
--------------------------------------------------------------------------------
Player                MIN  PTS  REB  AST  TO      FG   FG%      3P   3P%
--------------------------------------------------------------------------------
Russell Wade           20    7    2    0   0   3/3   100.0     0/0   0.0
Vince Mobley           11    4    1    0   0   2/2   100.0     0/0   0.0
RJ Harden              20    3    0    1   0   1/5    20.0     0/0   0.0
Paul Williamson        20    3    0    0   0   1/1   100.0     0/0   0.0
Paul Curry              4    3    0    0   0   1/2    50.0     0/0   0.0
D'Angelo Tatum         20    0    3    2   0   0/0     0.0     0/0   0.0
Manu McGrady           20    0    2    2   0   0/4     0.0     0/0   0.0
D'Angelo Porzingis      4    0    2    1   0   0/0     0.0     0/0   0.0

TEAM: FG: 8/17 (47.1%), 3PT: 5/12 (41.7%), REB: 9 (3 off, 6 def), AST: 4, TO: 3
TEAM FOULS: 3


Team_076
--------------------------------------------------------------------------------
Player                MIN  PTS  REB  AST  TO      FG   FG%      3P   3P%
--------------------------------------------------------------------------------
Jalen Poole            11    8    0    0   0   3/6    50.0     0/0   0.0
Vince Lowry            11    5    2    0   0   2/3    66.7     0/0   0.0
Tobias Mitchell        13    4    1    0   0   2/2   100.0     0/0   0.0
Kevin Nowitzki         11    3    3    2   0   1/2    50.0     0/0   0.0
Dejounte LaVine        13    2    0    0   0   1/1   100.0     0/0   0.0
Cade Barnes            13    0    2    0   0   0/0     0.0     0/0   0.0
Paul Leonard           13    0    0    1   0   0/0     0.0     0/0   0.0
Pascal Lowry           11    0    0    1   0   0/1     0.0     0/0   0.0
Jordan Doncic           4    0    2    0   0   0/0     0.0     0/0   0.0

TEAM: FG: 9/15 (60.0%), 3PT: 1/5 (20.0%), REB: 11 (4 off, 7 def), AST: 6, TO: 5
TEAM FOULS: 3

================================================================================

================================================================================
                       3RD QUARTER - Team_065 vs Team_076                       
================================================================================

[12:00] Team_065 possession (Score: 47-37)
RJ Harden attempts a Midrange. Wide open! Paul Leonard is 8.7 feet away. [ZONE] RJ HARDEN MAKES IT!
Score: 49-37

[11:44] Team_076 possession (Score: 49-37)
Tobias Mitchell attempts a 3Pt. Wide open! Paul Williamson is 7.3 feet away. [MAN] Tobias Mitchell misses. Rebound secured by RJ Harden.

[11:30] Team_065 possession (Score: 49-37)
Russell Wade drives, Cade Barnes stays with him. Russell Wade attempts a Layup. Heavily contested by Cade Barnes (2.0 feet, ZONE)! Russell Wade misses. Rebound secured by Cade Barnes.

[11:15] Team_076 possession (Score: 49-37)
FOUL! Holding foul on Russell Wade. [Team fouls: 1] No free throws, side out. (Russell Wade: 1 personal fouls)

[11:04] Team_076 possession (Score: 49-37)
Tobias Mitchell attempts a 3Pt. Wide open! RJ Harden is 6.8 feet away. [ZONE] TOBIAS MITCHELL MAKES IT! Assist: D'Angelo Tatum
Score: 49-40

[10:51] Team_065 possession (Score: 49-40)
Manu McGrady attempts a Midrange. Wide open! Paul Leonard is 6.3 feet away. [MAN] MANU MCGRADY MAKES IT! Assist: RJ Harden
Score: 51-40

[10:37] Team_076 possession (Score: 51-40)
Tobias Mitchell drives to the basket... Tobias Mitchell throws a bad pass! Stolen by Paul Williamson! TURNOVER! (live ball)

[10:18] Team_065 possession (Score: 51-40)
Paul Williamson makes the Midrange and draws the foul on Dejounte LaVine! And-1! Paul Williamson to the line for 1. [Team fouls: 1] (Dejounte LaVine: 1 personal fouls)   FT 1/1: GOOD Paul Williamson makes 1/1 from the line.
Score: 54-40

[10:04] Team_076 possession (Score: 54-40)
Tobias Mitchell drives and kicks out. Dejounte LaVine attempts a 3Pt. Heavily contested by RJ Harden (0.5 feet, ZONE)! Dejounte LaVine misses. Rebound secured by RJ Harden.

[09:48] Team_065 possession (Score: 54-40)
RJ Harden attempts a 3Pt. Contested by Cade Barnes (5.2 feet, ZONE). RJ Harden misses. Rebound secured by Cade Barnes.

[09:32] Team_076 possession (Score: 54-40)
D'Angelo Tatum drives, picks up Russell Wade. Help arrives from Paul Williamson! D'Angelo Tatum attempts a Dunk. Contested by Paul Williamson (3.4 feet, ZONE). D'ANGELO TATUM MAKES IT! Assist: Cade Barnes
Score: 54-42

[09:17] Team_065 possession (Score: 54-42)
Manu McGrady attempts a 3Pt. Contested by Cade Barnes (2.2 feet, ZONE). Manu McGrady misses. Rebound secured by D'Angelo Tatum.

[09:00] Team_076 possession (Score: 54-42)
FOUL! Holding foul on Paul Williamson. [Team fouls: 2] No free throws, side out. (Paul Williamson: 1 personal fouls)

[08:45] Team_076 possession (Score: 54-42)
D'Angelo Tatum attempts a 3Pt. Heavily contested by Paul Williamson (1.9 feet, ZONE)! D'Angelo Tatum misses. Rebound secured by Manu McGrady.

[08:25] Team_065 possession (Score: 54-42)
RJ Harden attempts a 3Pt. Heavily contested by Dejounte LaVine (1.6 feet, MAN)! RJ HARDEN MAKES IT! Assist: Manu McGrady
Score: 57-42

[08:05] Team_076 possession (Score: 57-42)
Cade Barnes drives to the basket... Cade Barnes commits a violation (traveling/carry)! TURNOVER! (dead ball)

[07:52] Team_065 possession (Score: 57-42)
Karl Booker attempts a Midrange. Contested by D'Angelo Tatum (4.8 feet, MAN). Karl Booker misses. Rebound secured by Cade Barnes.

[07:35] Team_076 possession (Score: 57-42)
Cade Barnes makes the Layup and draws the foul on Russell Wade! And-1! Cade Barnes to the line for 1. [Team fouls: 3] (Russell Wade: 2 personal fouls)   FT 1/1: MISS Cade Barnes makes 0/1 from the line. Rebound secured by RJ Harden.
Score: 57-44

[07:23] Team_065 possession (Score: 57-44)
Karl Booker drives, picks up Cade Barnes. Help arrives from Tobias Mitchell! Karl Booker attempts a Layup. Wide open! Tobias Mitchell is 6.1 feet away. [ZONE] KARL BOOKER MAKES IT!
Score: 59-44

[07:06] Team_076 possession (Score: 59-44)
D'Angelo Tatum attempts a Midrange. Contested by Manu McGrady (3.2 feet, ZONE). D'Angelo Tatum misses. Rebound secured by RJ Harden.

[06:53] Team_065 possession (Score: 59-44)
Manu McGrady attempts a 3Pt. Contested by Cade Barnes (5.3 feet, ZONE). MANU MCGRADY MAKES IT! Assist: Russell Wade
Score: 62-44

[06:37] Team_076 possession (Score: 62-44)
Dejounte LaVine drives to the basket... Dejounte LaVine loses the ball! Stripped by RJ Harden! TURNOVER! (live ball)

[06:26] Team_065 possession (Score: 62-44)
Manu McGrady drives, Cade Barnes stays with him. Manu McGrady attempts a Dunk. Contested by Cade Barnes (2.9 feet, ZONE). Manu McGrady misses. Rebound secured by D'Angelo Tatum.

[06:13] Team_076 possession (Score: 62-44)
Dejounte LaVine attempts a Midrange. Heavily contested by RJ Harden (1.8 feet, MAN)! Dejounte LaVine misses. Rebound secured by RJ Harden.

[05:58] Team_065 possession (Score: 62-44)
Manu McGrady attempts a 3Pt. Heavily contested by Cade Barnes (1.3 feet, ZONE)! Manu McGrady misses. Rebound secured by D'Angelo Tatum.

[05:44] Team_076 possession (Score: 62-44)
Paul Leonard attempts a 3Pt. Contested by RJ Harden (3.9 feet, ZONE). Paul Leonard misses. Rebound secured by Manu McGrady.

[05:31] Team_065 possession (Score: 62-44)
Paul Williamson loses the ball! Stripped by Tobias Mitchell! TURNOVER! (live ball)

[05:20] Team_076 possession (Score: 62-44)
D'Angelo Tatum drives and kicks out. Paul Leonard attempts a 3Pt. Contested by RJ Harden (3.9 feet, ZONE). PAUL LEONARD MAKES IT! Assist: Tobias Mitchell
Score: 62-47

[05:01] Team_065 possession (Score: 62-47)
Manu McGrady attempts a 3Pt. Contested by Paul Leonard (4.6 feet, MAN). Manu McGrady misses. Rebound secured by Tobias Mitchell.

[04:46] Team_076 possession (Score: 62-47)
FOUL! Reach-in foul on Russell Wade during the drive. [Team fouls: 4] No free throws, side out. (Russell Wade: 3 personal fouls)

[04:31] Team_076 possession (Score: 62-47)
Paul Leonard attempts a 3Pt. Wide open! RJ Harden is 7.2 feet away. [ZONE] Paul Leonard misses. Rebound secured by Russell Wade.

[04:13] Team_065 possession (Score: 62-47)
RJ Harden attempts a 3Pt. Contested by Dejounte LaVine (3.0 feet, MAN). RJ Harden misses. Rebound secured by D'Angelo Tatum.

[03:55] Team_076 possession (Score: 62-47)
Paul Leonard drives and kicks out. Paul Leonard attempts a 3Pt. Contested by Manu McGrady (3.1 feet, MAN). PAUL LEONARD MAKES IT!
Score: 62-50

[03:40] Team_065 possession (Score: 62-50)
FOUL! Holding foul on Cade Barnes. [Team fouls: 2] No free throws, side out. (Cade Barnes: 1 personal fouls)

[03:25] Team_065 possession (Score: 62-50)
RJ Harden attempts a Midrange. Wide open! Dejounte LaVine is 7.4 feet away. [MAN] RJ HARDEN MAKES IT! Assist: Manu McGrady
Score: 64-50

[03:11] Team_076 possession (Score: 64-50)
Tobias Mitchell drives, picks up Russell Wade. Help arrives from Paul Williamson! Tobias Mitchell attempts a Layup. Contested by Paul Williamson (3.4 feet, ZONE). TOBIAS MITCHELL MAKES IT! Assist: Dejounte LaVine
Score: 64-52

[02:56] Team_065 possession (Score: 64-52)
FOUL! Reach-in foul on Dejounte LaVine during the drive. [Team fouls: 3] No free throws, side out. (Dejounte LaVine: 2 personal fouls)

[02:40] Team_065 possession (Score: 64-52)
Russell Wade drives, picks up Cade Barnes. Help arrives from Tobias Mitchell! Russell Wade attempts a Dunk. Wide open! Tobias Mitchell is 7.0 feet away. [MAN] Russell Wade misses. Rebound secured by Cade Barnes.

[02:24] Team_076 possession (Score: 64-52)
FOUL! Shooting foul on Russell Wade. Cade Barnes to the line for 2 free throws. [BONUS: 5 team fouls] (Russell Wade: 4 personal fouls)   FT 1/2: GOOD   FT 2/2: GOOD Cade Barnes makes 2/2 from the line.
Score: 64-54

[02:13] Team_065 possession (Score: 64-54)
Manu McGrady attempts a Layup. Contested by Paul Leonard (5.8 feet, MAN). Manu McGrady misses. Offensive rebound by Russell Wade! Russell Wade puts it back in!
Score: 66-54

[01:58] Team_076 possession (Score: 66-54)
D'Angelo Tatum throws a bad pass out of bounds! TURNOVER! (dead ball)

[01:58] Substitution (Team_065): Manu McGrady OUT → D'Angelo Porzingis IN (stamina_rule2)

[01:58] Substitution (Team_065): Karl Booker OUT → Vince Mobley IN (stamina_rule2)

[01:58] Substitution (Team_076): Dejounte LaVine OUT → Pascal Lowry IN (stamina_rule2)

[01:58] Substitution (Team_076): Tobias Mitchell OUT → Jalen Poole IN (stamina_rule2)

[01:58] Substitution (Team_076): Paul Leonard OUT → Vince Lowry IN (stamina_rule2)

[01:58] Substitution (Team_076): Cade Barnes OUT → Kevin Nowitzki IN (stamina_rule2)

[01:58] Substitution (Team_076): D'Angelo Tatum OUT → Jordan Doncic IN (stamina_rule2)

[01:48] Team_065 possession (Score: 66-54)
D'Angelo Porzingis attempts a 3Pt. Contested by Vince Lowry (5.3 feet, MAN). D'ANGELO PORZINGIS MAKES IT! Assist: Paul Williamson
Score: 69-54

[01:33] Team_076 possession (Score: 69-54)
Kevin Nowitzki attempts a Midrange. Heavily contested by Paul Williamson (1.5 feet, ZONE)! Kevin Nowitzki misses. Rebound secured by Russell Wade.

[01:14] Team_065 possession (Score: 69-54)
RJ Harden attempts a 3Pt. Contested by Pascal Lowry (5.5 feet, MAN). RJ Harden misses. Rebound secured by Kevin Nowitzki.

[00:57] Team_076 possession (Score: 69-54)
Kevin Nowitzki attempts a Layup. Contested by Russell Wade (3.2 feet, MAN). Kevin Nowitzki misses. Rebound secured by Russell Wade.

[00:40] Team_065 possession (Score: 69-54)
Paul Williamson attempts a 3Pt. Heavily contested by Vince Lowry (1.5 feet, ZONE)! Paul Williamson misses. Rebound secured by Kevin Nowitzki.

[00:26] Team_076 possession (Score: 69-54)
Jalen Poole attempts a 3Pt. Wide open! D'Angelo Porzingis is 6.1 feet away. [ZONE] Jalen Poole misses. Offensive rebound by Kevin Nowitzki! Kevin Nowitzki kicks it out.

[00:11] Team_076 possession (Score: 69-54)
Vince Lowry attempts a 3Pt. Heavily contested by Russell Wade (1.9 feet, ZONE)! Vince Lowry misses. FOUL! Loose ball foul on Russell Wade during the rebound battle. [IN THE BONUS! 6 team fouls] Jordan Doncic to the line for 2 free throws. (Russell Wade: 5 personal fouls)   FT 1/2: MISS   FT 2/2: GOOD Jordan Doncic makes 1/2 from the line.
Score: 69-55

================================================================================
                              3RD QUARTER COMPLETE                              
================================================================================

3RD QUARTER SCORE: Team_065 22, Team_076 18

BOX SCORE:
================================================================================

Team_065
--------------------------------------------------------------------------------
Player                MIN  PTS  REB  AST  TO      FG   FG%      3P   3P%
--------------------------------------------------------------------------------
RJ Harden              32    7    5    1   0   3/6    50.0     0/0   0.0
Manu McGrady           30    5    2    2   0   2/6    33.3     0/0   0.0
Paul Williamson        32    3    0    1   0   1/2    50.0     0/0   0.0
D'Angelo Porzingis      6    3    0    0   0   1/1   100.0     0/0   0.0
Russell Wade           32    2    4    1   0   1/3    33.3     0/0   0.0
Karl Booker            23    2    0    0   0   1/2    50.0     0/0   0.0

TEAM: FG: 9/20 (45.0%), 3PT: 3/10 (30.0%), REB: 11 (1 off, 10 def), AST: 5, TO: 1
TEAM FOULS: 6 [Team_076 in BONUS]


Team_076
--------------------------------------------------------------------------------
Player                MIN  PTS  REB  AST  TO      FG   FG%      3P   3P%
--------------------------------------------------------------------------------
Paul Leonard           23    6    0    0   0   2/4    50.0     0/0   0.0
Tobias Mitchell        23    5    1    1   0   2/4    50.0     0/0   0.0
Cade Barnes            23    2    4    1   0   1/2    50.0     0/0   0.0
D'Angelo Tatum         30    2    4    1   0   1/3    33.3     0/0   0.0
Jordan Doncic           6    1    0    0   0   1/1   100.0     0/0   0.0
Dejounte LaVine        23    0    0    1   0   0/1     0.0     0/0   0.0
Kevin Nowitzki         13    0    3    0   0   0/2     0.0     0/0   0.0

TEAM: FG: 7/17 (41.2%), 3PT: 2/6 (33.3%), REB: 12 (1 off, 11 def), AST: 4, TO: 4
TEAM FOULS: 3

================================================================================

================================================================================
                       4TH QUARTER - Team_065 vs Team_076                       
================================================================================

[12:00] Team_065 possession (Score: 69-55)
Karl Booker drives and kicks out. Manu McGrady attempts a 3Pt. Wide open! Paul Leonard is 6.6 feet away. [MAN] Manu McGrady misses. Rebound secured by Tobias Mitchell.

[11:46] Team_076 possession (Score: 69-55)
D'Angelo Tatum attempts a Layup. Contested by Russell Wade (5.4 feet, ZONE). D'ANGELO TATUM MAKES IT! Assist: Paul Leonard
Score: 69-57

[11:30] Team_065 possession (Score: 69-57)
Karl Booker attempts a Layup. Wide open! D'Angelo Tatum is 6.3 feet away. [MAN] KARL BOOKER MAKES IT! Assist: Manu McGrady
Score: 71-57

[11:14] Team_076 possession (Score: 71-57)
Paul Leonard makes the Layup and draws the foul on Russell Wade! And-1! Paul Leonard to the line for 1. [Team fouls: 1] (Russell Wade: 1 personal fouls)   FT 1/1: GOOD Paul Leonard makes 1/1 from the line.
Score: 71-60

[11:00] Team_065 possession (Score: 71-60)
Russell Wade attempts a 3Pt. Contested by Dejounte LaVine (3.6 feet, ZONE). Russell Wade misses. Rebound secured by Cade Barnes.

[10:47] Team_076 possession (Score: 71-60)
D'Angelo Tatum attempts a 3Pt. Contested by Russell Wade (3.7 feet, MAN). D'ANGELO TATUM MAKES IT!
Score: 71-63

[10:29] Team_065 possession (Score: 71-63)
Manu McGrady drives, picks up Paul Leonard. Help arrives from Tobias Mitchell! Manu McGrady attempts a Dunk. Contested by Tobias Mitchell (5.3 feet, MAN). MANU MCGRADY MAKES IT! Assist: Paul Williamson
Score: 73-63

[10:14] Team_076 possession (Score: 73-63)
Dejounte LaVine drives and kicks out. Dejounte LaVine attempts a 3Pt. Contested by RJ Harden (5.8 feet, MAN). DEJOUNTE LAVINE MAKES IT! Assist: Cade Barnes
Score: 73-66

[09:58] Team_065 possession (Score: 73-66)
RJ Harden drives and kicks out. Manu McGrady attempts a Midrange. Heavily contested by Cade Barnes (2.0 feet, ZONE)! Manu McGrady misses. Rebound secured by D'Angelo Tatum.

[09:45] Team_076 possession (Score: 73-66)
D'Angelo Tatum attempts a Layup. Heavily contested by Russell Wade (1.8 feet, MAN)! D'Angelo Tatum misses. Rebound secured by Manu McGrady.

[09:33] Team_065 possession (Score: 73-66)
Manu McGrady attempts a 3Pt. Contested by Paul Leonard (3.6 feet, MAN). Manu McGrady misses. Rebound secured by Cade Barnes.

[09:21] Team_076 possession (Score: 73-66)
FOUL! Holding foul on Russell Wade. [Team fouls: 2] No free throws, side out. (Russell Wade: 2 personal fouls)

[09:07] Team_076 possession (Score: 73-66)
D'Angelo Tatum attempts a Layup. BLOCKED BY RUSSELL WADE! Ball deflects out of bounds off D'Angelo Tatum.

[08:48] Team_065 possession (Score: 73-66)
Manu McGrady attempts a Midrange. Contested by Tobias Mitchell (3.8 feet, ZONE). Manu McGrady misses. Rebound secured by D'Angelo Tatum.

[08:35] Team_076 possession (Score: 73-66)
Dejounte LaVine attempts a 3Pt. Contested by RJ Harden (5.4 feet, MAN). Dejounte LaVine misses. Offensive rebound by Cade Barnes! Cade Barnes kicks it out.

[08:21] Team_076 possession (Score: 73-66)
Dejounte LaVine attempts a 3Pt. Contested by RJ Harden (4.5 feet, ZONE). Dejounte LaVine misses. Rebound secured by Karl Booker.

[08:03] Team_065 possession (Score: 73-66)
Karl Booker attempts a Midrange. Contested by Paul Leonard (3.5 feet, ZONE). KARL BOOKER MAKES IT!
Score: 75-66

[07:47] Team_076 possession (Score: 75-66)
Cade Barnes drives, picks up Russell Wade. Help arrives from Paul Williamson! Cade Barnes attempts a Dunk. Contested by Paul Williamson (4.7 feet, MAN). Cade Barnes misses. Rebound secured by Manu McGrady.

[07:28] Team_065 possession (Score: 75-66)
RJ Harden makes the Dunk and draws the foul on Cade Barnes! And-1! RJ Harden to the line for 1. [Team fouls: 1] (Cade Barnes: 1 personal fouls)   FT 1/1: GOOD RJ Harden makes 1/1 from the line.
Score: 78-66

[07:16] Team_076 possession (Score: 78-66)
D'Angelo Tatum drives, Russell Wade stays with him. D'Angelo Tatum attempts a Layup. Contested by Russell Wade (5.3 feet, ZONE). D'ANGELO TATUM MAKES IT! Assist: Dejounte LaVine
Score: 78-68

[06:59] Team_065 possession (Score: 78-68)
Paul Williamson throws a bad pass out of bounds! TURNOVER! (dead ball)

[06:59] Substitution (Team_065): RJ Harden OUT → Paul Curry IN (stamina_rule2)

[06:59] Substitution (Team_065): Paul Williamson OUT → Derrick Poole IN (stamina_rule2)

[06:59] Substitution (Team_065): Manu McGrady OUT → D'Angelo Porzingis IN (stamina_rule2)

[06:59] Substitution (Team_065): Russell Wade OUT → Karl Leonard IN (stamina_rule2)

[06:59] Substitution (Team_065): Karl Booker OUT → Vince Mobley IN (stamina_rule2)

[06:59] Substitution (Team_076): Dejounte LaVine OUT → Pascal Lowry IN (stamina_rule2)

[06:59] Substitution (Team_076): Tobias Mitchell OUT → Jalen Poole IN (stamina_rule2)

[06:59] Substitution (Team_076): Paul Leonard OUT → Vince Lowry IN (stamina_rule2)

[06:59] Substitution (Team_076): Cade Barnes OUT → Kevin Nowitzki IN (stamina_rule2)

[06:59] Substitution (Team_076): D'Angelo Tatum OUT → Jordan Doncic IN (stamina_rule2)

[06:41] Team_076 possession (Score: 78-68)
Kevin Nowitzki drives and kicks out. Vince Lowry attempts a 3Pt. Heavily contested by Karl Leonard (2.0 feet, ZONE)! Vince Lowry misses. Offensive rebound by Jordan Doncic! Jordan Doncic kicks it out.

[06:26] Team_076 possession (Score: 78-68)
Kevin Nowitzki drives, Karl Leonard stays with him. Kevin Nowitzki attempts a Layup. Contested by Karl Leonard (2.7 feet, MAN). KEVIN NOWITZKI MAKES IT!
Score: 78-70

[06:08] Team_065 possession (Score: 78-70)
FOUL! Reach-in foul on Vince Lowry during the drive. [Team fouls: 2] No free throws, side out. (Vince Lowry: 1 personal fouls)

[05:55] Team_065 possession (Score: 78-70)
Karl Leonard drives to the basket... Karl Leonard commits a violation (traveling/carry)! TURNOVER! (dead ball)

[05:40] Team_076 possession (Score: 78-70)
Vince Lowry attempts a 3Pt. Contested by Paul Curry (3.8 feet, ZONE). VINCE LOWRY MAKES IT! Assist: Kevin Nowitzki
Score: 78-73

[05:26] Team_065 possession (Score: 78-73)
Derrick Poole attempts a 3Pt. Contested by Jalen Poole (4.1 feet, MAN). Derrick Poole misses. Rebound secured by Kevin Nowitzki.

[05:14] Team_076 possession (Score: 78-73)
Kevin Nowitzki drives to the basket... Kevin Nowitzki throws a bad pass out of bounds! TURNOVER! (dead ball)

[04:57] Team_065 possession (Score: 78-73)
D'Angelo Porzingis attempts a 3Pt. Contested by Vince Lowry (5.2 feet, ZONE). D'Angelo Porzingis misses. Offensive rebound by D'Angelo Porzingis! D'Angelo Porzingis kicks it out.

[04:42] Team_065 possession (Score: 78-73)
Derrick Poole attempts a 3Pt. Wide open! Vince Lowry is 6.3 feet away. [ZONE] DERRICK POOLE MAKES IT!
Score: 81-73

[04:30] Team_076 possession (Score: 81-73)
FOUL! Shooting foul on Vince Mobley. Vince Lowry to the line for 2 free throws. [Team fouls: 3] (Vince Mobley: 1 personal fouls)   FT 1/2: GOOD   FT 2/2: GOOD Vince Lowry makes 2/2 from the line.
Score: 81-75

[04:13] Team_065 possession (Score: 81-75)
D'Angelo Porzingis drives, Vince Lowry stays with him. D'Angelo Porzingis attempts a Layup. Heavily contested by Vince Lowry (0.5 feet, MAN)! D'ANGELO PORZINGIS MAKES IT! Assist: Vince Mobley
Score: 83-75

[03:59] Team_076 possession (Score: 83-75)
Jordan Doncic makes the Layup and draws the foul on Derrick Poole! And-1! Jordan Doncic to the line for 1. [Team fouls: 4] (Derrick Poole: 1 personal fouls)   FT 1/1: GOOD Jordan Doncic makes 1/1 from the line.
Score: 83-78

[03:40] Team_065 possession (Score: 83-78)
FOUL! Holding foul on Jordan Doncic. [Team fouls: 3] No free throws, side out. (Jordan Doncic: 1 personal fouls)

[03:26] Team_065 possession (Score: 83-78)
Vince Mobley attempts a 3Pt. Contested by Jordan Doncic (3.5 feet, MAN). Vince Mobley misses. Offensive rebound by D'Angelo Porzingis! D'Angelo Porzingis kicks it out.

[03:12] Team_065 possession (Score: 83-78)
D'Angelo Porzingis drives and kicks out. Karl Leonard attempts a 3Pt. Heavily contested by Vince Lowry (1.0 feet, ZONE)! KARL LEONARD MAKES IT! Assist: Derrick Poole
Score: 86-78

[02:54] Team_076 possession (Score: 86-78)
Kevin Nowitzki loses the ball! Stripped by Karl Leonard! TURNOVER! (live ball)

[02:38] Team_065 possession (Score: 86-78)
D'Angelo Porzingis drives to the basket... D'Angelo Porzingis throws a bad pass out of bounds! TURNOVER! (dead ball)

[02:24] Team_076 possession (Score: 86-78)
Kevin Nowitzki drives to the basket... Kevin Nowitzki loses the ball! Stripped by Vince Mobley! TURNOVER! (live ball)

[02:07] Team_065 possession (Score: 86-78)
Karl Leonard attempts a 3Pt. Contested by Kevin Nowitzki (3.6 feet, MAN). KARL LEONARD MAKES IT!
Score: 89-78

[01:53] Team_076 possession (Score: 89-78)
Jalen Poole attempts a 3Pt. Contested by Paul Curry (2.8 feet, ZONE). JALEN POOLE MAKES IT!
Score: 89-81

[01:40] Team_065 possession (Score: 89-81)
D'Angelo Porzingis attempts a 3Pt. Contested by Vince Lowry (3.3 feet, MAN). D'Angelo Porzingis misses. Rebound secured by Vince Lowry.

[01:29] Team_076 possession (Score: 89-81)
Jalen Poole drives, picks up Derrick Poole. Help arrives from D'Angelo Porzingis! Jalen Poole attempts a Layup. Wide open! D'Angelo Porzingis is 8.3 feet away. [MAN] JALEN POOLE MAKES IT! Assist: Kevin Nowitzki
Score: 89-83

[01:12] Team_065 possession (Score: 89-83)
Paul Curry attempts a 3Pt. Contested by Pascal Lowry (5.4 feet, MAN). PAUL CURRY MAKES IT! Assist: Derrick Poole
Score: 92-83

[00:53] Team_076 possession (Score: 92-83)
Jalen Poole attempts a 3Pt. Contested by Paul Curry (5.0 feet, ZONE). Jalen Poole misses. Rebound secured by Vince Mobley.

[00:38] Team_065 possession (Score: 92-83)
Karl Leonard makes the Layup and draws the foul on Kevin Nowitzki! And-1! Karl Leonard to the line for 1. [Team fouls: 4] (Kevin Nowitzki: 1 personal fouls)   FT 1/1: GOOD Karl Leonard makes 1/1 from the line.
Score: 95-83

[00:27] Team_076 possession (Score: 95-83)
Vince Lowry drives, Karl Leonard stays with him. Vince Lowry attempts a Layup. Contested by Karl Leonard (4.4 feet, ZONE). Vince Lowry misses. Offensive rebound by Kevin Nowitzki! Kevin Nowitzki kicks it out.

[00:12] Team_076 possession (Score: 95-83)
Jalen Poole attempts a 3Pt. Wide open! Derrick Poole is 6.0 feet away. [MAN] Jalen Poole misses. Rebound secured by Vince Mobley.

================================================================================
                              4TH QUARTER COMPLETE                              
================================================================================

4TH QUARTER SCORE: Team_065 26, Team_076 28

BOX SCORE:
================================================================================

Team_065
--------------------------------------------------------------------------------
Player                MIN  PTS  REB  AST  TO      FG   FG%      3P   3P%
--------------------------------------------------------------------------------
Karl Leonard           11    9    0    0   0   3/3   100.0     0/0   0.0
Karl Booker            28    4    1    0   0   2/3    66.7     0/0   0.0
RJ Harden              38    3    0    0   0   1/2    50.0     0/0   0.0
Derrick Poole          11    3    0    2   0   1/2    50.0     0/0   0.0
Paul Curry             11    3    0    0   0   1/1   100.0     0/0   0.0
Manu McGrady           36    2    2    1   0   1/3    33.3     0/0   0.0
D'Angelo Porzingis     13    2    2    0   0   1/2    50.0     0/0   0.0
Russell Wade           38    0    0    0   0   0/1     0.0     0/0   0.0
Paul Williamson        38    0    0    1   0   0/0     0.0     0/0   0.0
Vince Mobley           20    0    2    1   0   0/0     0.0     0/0   0.0

TEAM: FG: 10/17 (58.8%), 3PT: 3/7 (42.9%), REB: 7 (2 off, 5 def), AST: 5, TO: 3
TEAM FOULS: 4


Team_076
--------------------------------------------------------------------------------
Player                MIN  PTS  REB  AST  TO      FG   FG%      3P   3P%
--------------------------------------------------------------------------------
D'Angelo Tatum         36    7    2    0   0   3/5    60.0     0/0   0.0
Vince Lowry            20    5    1    0   0   2/2   100.0     0/0   0.0
Jalen Poole            20    5    0    0   0   2/4    50.0     0/0   0.0
Paul Leonard           28    3    0    1   0   1/1   100.0     0/0   0.0
Dejounte LaVine        28    3    0    1   0   1/2    50.0     0/0   0.0
Jordan Doncic          13    3    1    0   0   1/1   100.0     0/0   0.0
Kevin Nowitzki         20    2    2    2   0   1/1   100.0     0/0   0.0
Tobias Mitchell        28    0    1    0   0   0/0     0.0     0/0   0.0
Cade Barnes            28    0    3    1   0   0/1     0.0     0/0   0.0

TEAM: FG: 11/17 (64.7%), 3PT: 3/6 (50.0%), REB: 10 (3 off, 7 def), AST: 5, TO: 3
TEAM FOULS: 4

================================================================================

================================================================================
                               FULL GAME COMPLETE                               
================================================================================

FINAL SCORE: Team_065 95, Team_076 83

SCORING BY QUARTER:
--------------------------------------------------------------------------------
Team                     Q1     Q2     Q3     Q4    FINAL
--------------------------------------------------------------------------------
Team_065                 27     20     22     26       95
Team_076                 15     22     18     28       83
--------------------------------------------------------------------------------

FULL GAME BOX SCORE:
================================================================================

Team_065
--------------------------------------------------------------------------------
Player                MIN  PTS  REB  AST  TO      FG   FG%      3P   3P%      FT STL BLK
--------------------------------------------------------------------------------
RJ Harden              38   17    8    3   1   7/15   46.7   2/8    25.0   1/1     2   0
Paul Williamson        38   12    0    5   2   5/8    62.5   1/3    33.3   3/4     2   1
Russell Wade           38   11    9    2   0   3/7    42.9   1/2    50.0   3/4     1   2
Manu McGrady           36    9   11    7   2   6/17   35.3   2/10   20.0   0/0     0   0
Karl Booker            28   13    1    0   1   6/10   60.0   1/2    50.0   0/0     0   1
Vince Mobley           20    9    3    1   0   3/3   100.0   0/0     0.0   3/3     2   0
D'Angelo Porzingis     13    5    5    1   2   4/5    80.0   2/3    66.7   0/0     0   0
Paul Curry             11    6    0    0   2   2/3    66.7   2/3    66.7   0/0     0   0
Derrick Poole          11    3    0    2   0   1/2    50.0   1/2    50.0   0/0     0   0
Karl Leonard           11    9    0    0   0   2/2   100.0   1/1   100.0   1/1     1   0

TEAM: FG: 39/73 (53.4%), 3PT: 13/34 (38.2%), REB: 39 (8 off, 31 def), AST: 21, TO: 10


Team_076
--------------------------------------------------------------------------------
Player                MIN  PTS  REB  AST  TO      FG   FG%      3P   3P%      FT STL BLK
--------------------------------------------------------------------------------
D'Angelo Tatum         36   14   14    3   4   8/13   61.5   1/2    50.0   1/2     0   0
Dejounte LaVine        28    5    0    2   0   2/7    28.6   0/3     0.0   0/0     1   0
Tobias Mitchell        28   12    4    2   2   4/7    57.1   1/2    50.0   1/1     1   0
Paul Leonard           28   11    0    3   3   3/7    42.9   0/2     0.0   3/3     0   0
Cade Barnes            28    2   12    2   1   1/6    16.7   0/2     0.0   2/3     0   0
Pascal Lowry           20    2    0    2   1   1/2    50.0   0/1     0.0   0/0     0   0
Jalen Poole            20   16    0    0   2   7/12   58.3   3/7    42.9   1/1     0   0
Vince Lowry            20   10    3    1   2   5/6    83.3   2/3    66.7   3/3     2   0
Kevin Nowitzki         20    5    8    4   1   1/4    25.0   0/0     0.0   0/0     0   0
Jordan Doncic          13    4    3    0   1   1/1   100.0   0/0     0.0   2/3     0   0

TEAM: FG: 34/66 (51.5%), 3PT: 7/22 (31.8%), REB: 42 (10 off, 32 def), AST: 19, TO: 17

================================================================================
