================================================================================
                        FULL GAME - Team_082 vs Team_018                        
================================================================================

================================================================================
                       1ST QUARTER - Team_082 vs Team_018                       
================================================================================

[12:00] Team_082 possession (Score: 0-0)
FOUL! Reach-in foul on Domantas Wall during the drive. [Team fouls: 1] No free throws, side out. (Domantas Wall: 1 personal fouls)

[11:46] Team_082 possession (Score: 0-0)
FOUL! Holding foul on Domantas Wall. [Team fouls: 2] No free throws, side out. (Domantas Wall: 2 personal fouls)

[11:32] Team_082 possession (Score: 0-0)
Jrue Green attempts a 3Pt. Contested by Bones Anunoby (3.6 feet, MAN). JRUE GREEN MAKES IT! Assist: Julius Anthony
Score: 3-0

[11:16] Team_018 possession (Score: 3-0)
Domantas Wall loses the ball! Stripped by Julius Carter! TURNOVER! (live ball)

[11:05] Team_082 possession (Score: 3-0)
FOUL! Shooting foul on Allen Markkanen. Dwyane O'Neal to the line for 2 free throws. [Team fouls: 3] (Allen Markkanen: 1 personal fouls)   FT 1/2: GOOD   FT 2/2: GOOD Dwyane O'Neal makes 2/2 from the line.
Score: 5-0

[10:47] Team_018 possession (Score: 5-0)
FOUL! Reach-in foul on Jrue Green during the drive. [Team fouls: 1] No free throws, side out. (Jrue Green: 1 personal fouls)

[10:31] Team_018 possession (Score: 5-0)
Domantas Wall drives and kicks out. Allen Markkanen attempts a 3Pt. Contested by Dwyane O'Neal (3.3 feet, ZONE). Allen Markkanen misses. Rebound secured by Dwyane O'Neal.

[10:15] Team_082 possession (Score: 5-0)
Julius Anthony drives, picks up Domantas Wall. Help arrives from Klay Stewart! Julius Anthony attempts a Dunk. Contested by Klay Stewart (3.8 feet, ZONE). Julius Anthony misses. Rebound secured by Allen Markkanen.

[09:58] Team_018 possession (Score: 5-0)
Klay Stewart loses the ball! Stripped by Julius Anthony! TURNOVER! (live ball)

[09:44] Team_082 possession (Score: 5-0)
Dwyane O'Neal loses control! Ball rolls out of bounds! TURNOVER! (dead ball)

[09:27] Team_018 possession (Score: 5-0)
Bones Anunoby drives, picks up Jrue Green. Help arrives from Dwyane O'Neal! Bones Anunoby attempts a Layup. Contested by Dwyane O'Neal (5.4 feet, ZONE). BONES ANUNOBY MAKES IT! Assist: Tracy Bryant
Score: 5-2

[09:16] Team_082 possession (Score: 5-2)
Julius Carter attempts a Layup. Contested by Domantas Wall (3.8 feet, MAN). Julius Carter misses. Rebound secured by Allen Markkanen.

[09:06] Team_018 possession (Score: 5-2)
Domantas Wall attempts a Layup. Wide open! Julius Carter is 6.0 feet away. [MAN] Domantas Wall misses. Rebound secured by Jrue Green.

[08:50] Team_082 possession (Score: 5-2)
Julius Carter attempts a Midrange. Contested by Tracy Bryant (3.8 feet, ZONE). Julius Carter misses. Rebound secured by Domantas Wall.

[08:35] Team_018 possession (Score: 5-2)
Bones Anunoby attempts a Midrange. Contested by Dwyane O'Neal (3.6 feet, ZONE). Bones Anunoby misses. Rebound secured by Jrue Green.

[08:23] Team_082 possession (Score: 5-2)
Kristaps Fox attempts a Layup. BLOCKED BY DOMANTAS WALL! Ball deflects out of bounds off Kristaps Fox.

[08:12] Team_018 possession (Score: 5-2)
Allen Markkanen attempts a Midrange. Contested by Kristaps Fox (4.6 feet, MAN). Allen Markkanen misses. Offensive rebound by Domantas Wall! Domantas Wall puts it back in!
Score: 5-4

[08:00] Team_082 possession (Score: 5-4)
Julius Anthony drives, picks up Klay Stewart. Help arrives from Allen Markkanen! Julius Anthony attempts a Dunk. Contested by Allen Markkanen (4.5 feet, MAN). JULIUS ANTHONY MAKES IT! Assist: Kristaps Fox
Score: 7-4

[07:47] Team_018 possession (Score: 7-4)
Allen Markkanen makes the Layup and draws the foul on Kristaps Fox! And-1! Allen Markkanen to the line for 1. [Team fouls: 2] (Kristaps Fox: 1 personal fouls)   FT 1/1: GOOD Allen Markkanen makes 1/1 from the line.
Score: 7-7

[07:30] Team_082 possession (Score: 7-7)
FOUL! Offensive foul on Julius Carter! Domantas Wall drew the charge! [Team fouls: 3] (Julius Carter: 1 personal fouls) TURNOVER! (dead ball)

[07:16] Team_018 possession (Score: 7-7)
Bones Anunoby makes the Layup and draws the foul on Dwyane O'Neal! And-1! Bones Anunoby to the line for 1. [Team fouls: 4] (Dwyane O'Neal: 1 personal fouls)   FT 1/1: MISS Bones Anunoby makes 0/1 from the line. Offensive rebound by Bones Anunoby! Bones Anunoby kicks it out.
Score: 7-9

[07:00] Team_018 possession (Score: 7-9)
Klay Stewart attempts a Midrange. Contested by Jrue Green (5.3 feet, ZONE). KLAY STEWART MAKES IT!
Score: 7-11

[06:46] Team_082 possession (Score: 7-11)
Kristaps Fox drives, picks up Domantas Wall. Help arrives from Klay Stewart! Kristaps Fox attempts a Layup. Contested by Klay Stewart (3.5 feet, ZONE). KRISTAPS FOX MAKES IT!
Score: 9-11

[06:35] Team_018 possession (Score: 9-11)
Klay Stewart attempts a Layup. Contested by Jrue Green (5.3 feet, ZONE). Klay Stewart misses. Rebound secured by Dwyane O'Neal.

[06:23] Team_082 possession (Score: 9-11)
Kristaps Fox attempts a 3Pt. Contested by Allen Markkanen (3.9 feet, MAN). Kristaps Fox misses. Rebound secured by Allen Markkanen.

[06:12] Team_018 possession (Score: 9-11)
Klay Stewart attempts a 3Pt. Contested by Dwyane O'Neal (3.5 feet, ZONE). Klay Stewart misses. Rebound secured by Jrue Green.

[06:00] Team_082 possession (Score: 9-11)
Kristaps Fox attempts a Midrange. Contested by Allen Markkanen (3.9 feet, MAN). KRISTAPS FOX MAKES IT!
Score: 11-11

[05:42] Team_018 possession (Score: 11-11)
Domantas Wall drives and kicks out. Bones Anunoby attempts a 3Pt. Contested by Dwyane O'Neal (3.3 feet, ZONE). Bones Anunoby misses. Rebound secured by Dwyane O'Neal.

[05:27] Team_082 possession (Score: 11-11)
Jrue Green attempts a Layup. Contested by Bones Anunoby (3.6 feet, MAN). Jrue Green misses. Rebound secured by Domantas Wall.

[05:17] Team_018 possession (Score: 11-11)
Bones Anunoby drives, Julius Carter stays with him. Bones Anunoby attempts a Dunk. Wide open! Julius Carter is 6.1 feet away. [ZONE] BONES ANUNOBY MAKES IT! Assist: Tracy Bryant
Score: 11-13

[04:59] Team_082 possession (Score: 11-13)
Kristaps Fox drives to the basket... Kristaps Fox throws a bad pass! Stolen by Allen Markkanen! TURNOVER! (live ball)

[04:46] Team_018 possession (Score: 11-13)
Bones Anunoby attempts a Midrange. Contested by Jrue Green (5.5 feet, MAN). Bones Anunoby misses. Offensive rebound by Domantas Wall! Domantas Wall puts it back in!
Score: 11-15

[04:33] Team_082 possession (Score: 11-15)
Julius Anthony attempts a Layup. Contested by Domantas Wall (3.9 feet, ZONE). JULIUS ANTHONY MAKES IT! Assist: Kristaps Fox
Score: 13-15

[04:18] Team_018 possession (Score: 13-15)
Allen Markkanen drives, Jrue Green stays with him. Allen Markkanen attempts a Dunk. Contested by Jrue Green (5.5 feet, ZONE). ALLEN MARKKANEN MAKES IT!
Score: 13-17

[04:06] Team_082 possession (Score: 13-17)
Julius Carter drives to the basket... Julius Carter commits a violation (traveling/carry)! TURNOVER! (dead ball)

[03:49] Team_018 possession (Score: 13-17)
Tracy Bryant drives and kicks out. Bones Anunoby attempts a 3Pt. Contested by Jrue Green (5.2 feet, MAN). Bones Anunoby misses. Rebound secured by Julius Carter.

[03:38] Team_082 possession (Score: 13-17)
FOUL! Holding foul on Domantas Wall. [Team fouls: 4] No free throws, side out. (Domantas Wall: 3 personal fouls)

[03:25] Team_082 possession (Score: 13-17)
Kristaps Fox attempts a Midrange. Contested by Tracy Bryant (3.6 feet, ZONE). Kristaps Fox misses. Rebound secured by Bones Anunoby.

[03:09] Team_018 possession (Score: 13-17)
Tracy Bryant drives and kicks out. Allen Markkanen attempts a Midrange. Contested by Kristaps Fox (4.5 feet, MAN). Allen Markkanen misses. Rebound secured by Dwyane O'Neal.

[02:56] Team_082 possession (Score: 13-17)
FOUL! Reach-in foul on Domantas Wall during the drive. [IN THE BONUS! 5 team fouls] Julius Carter to the line for 2 free throws. (Domantas Wall: 4 personal fouls)   FT 1/2: GOOD   FT 2/2: GOOD Julius Carter makes 2/2 from the line.
Score: 15-17

[02:37] Team_018 possession (Score: 15-17)
Bones Anunoby attempts a Midrange. Contested by Jrue Green (5.6 feet, MAN). Bones Anunoby misses. Rebound secured by Jrue Green.

[02:23] Team_082 possession (Score: 15-17)
Jrue Green attempts a Midrange. Contested by Bones Anunoby (4.0 feet, ZONE). Jrue Green misses. Rebound secured by Bones Anunoby.

[02:13] Team_018 possession (Score: 15-17)
Tracy Bryant attempts a 3Pt. Contested by Dwyane O'Neal (3.9 feet, MAN). Tracy Bryant misses. Rebound secured by Dwyane O'Neal.

[01:58] Team_082 possession (Score: 15-17)
Dwyane O'Neal attempts a 3Pt. Contested by Bones Anunoby (3.8 feet, ZONE). DWYANE O'NEAL MAKES IT! Assist: Kristaps Fox
Score: 18-17

[01:45] Team_018 possession (Score: 18-17)
Tracy Bryant attempts a 3Pt. Contested by Dwyane O'Neal (4.0 feet, ZONE). Tracy Bryant misses. Rebound secured by Dwyane O'Neal.

[01:33] Team_082 possession (Score: 18-17)
Julius Anthony drives and kicks out. Julius Carter attempts a 3Pt. Contested by Domantas Wall (4.0 feet, MAN). Julius Carter misses. Offensive rebound by Jrue Green! Jrue Green kicks it out.

[01:14] Team_082 possession (Score: 18-17)
Kristaps Fox attempts a 3Pt. Contested by Klay Stewart (4.6 feet, ZONE). KRISTAPS FOX MAKES IT! Assist: Jrue Green
Score: 21-17

[01:00] Team_018 possession (Score: 21-17)
Allen Markkanen throws a bad pass out of bounds! TURNOVER! (dead ball)

[01:00] Substitution (Team_082): Julius Anthony OUT → Jordan Rozier IN (stamina_rule2)

[01:00] Substitution (Team_082): Dwyane O'Neal OUT → Kawhi Poole IN (stamina_rule2)

[01:00] Substitution (Team_082): Kristaps Fox OUT → Shaquille Griffin IN (stamina_rule2)

[01:00] Substitution (Team_082): Jrue Green OUT → Tony Jokic IN (stamina_rule2)

[01:00] Substitution (Team_082): Julius Carter OUT → D'Angelo Parker IN (stamina_rule2)

[01:00] Substitution (Team_018): Klay Stewart OUT → Michael Simons IN (stamina_rule2)

[01:00] Substitution (Team_018): Tracy Bryant OUT → Miles Herro IN (stamina_rule2)

[01:00] Substitution (Team_018): Allen Markkanen OUT → Austin Antetokounmpo IN (stamina_rule2)

[01:00] Substitution (Team_018): Bones Anunoby OUT → Shai Wade IN (stamina_rule2)

[01:00] Substitution (Team_018): Domantas Wall OUT → Julius Jackson IN (stamina_rule2)

[00:44] Team_082 possession (Score: 21-17)
D'Angelo Parker drives and kicks out. Kawhi Poole makes the 3Pt and draws the foul on Miles Herro! And-1! Kawhi Poole to the line for 1. [BONUS: 6 team fouls] (Miles Herro: 1 personal fouls)   FT 1/1: GOOD Kawhi Poole makes 1/1 from the line.
Score: 25-17

[00:28] Team_018 possession (Score: 25-17)
Michael Simons attempts a 3Pt. Contested by Kawhi Poole (5.7 feet, ZONE). Michael Simons misses. Offensive rebound by Shai Wade! Shai Wade kicks it out.

[00:12] Team_018 possession (Score: 25-17)
Michael Simons attempts a 3Pt. Wide open! Jordan Rozier is 6.3 feet away. [MAN] Michael Simons misses. Rebound secured by Tony Jokic.

================================================================================
                              1ST QUARTER COMPLETE                              
================================================================================

1ST QUARTER SCORE: Team_082 25, Team_018 17

BOX SCORE:
================================================================================

Team_082
--------------------------------------------------------------------------------
Player                MIN  PTS  REB  AST  TO      FG   FG%      3P   3P%
--------------------------------------------------------------------------------
Kristaps Fox           11    7    0    3   0   3/6    50.0     0/0   0.0
Dwyane O'Neal          11    5    6    0   0   2/2   100.0     0/0   0.0
Julius Anthony         11    4    0    1   0   2/3    66.7     0/0   0.0
Kawhi Poole             1    4    0    0   0   1/1   100.0     0/0   0.0
Jrue Green             11    3    5    1   0   1/3    33.3     0/0   0.0
Julius Carter          11    2    1    0   0   1/3    33.3     0/0   0.0
Tony Jokic              1    0    1    0   0   0/0     0.0     0/0   0.0

TEAM: FG: 10/18 (55.6%), 3PT: 3/4 (75.0%), REB: 13 (1 off, 12 def), AST: 5, TO: 4
TEAM FOULS: 4


Team_018
--------------------------------------------------------------------------------
Player                MIN  PTS  REB  AST  TO      FG   FG%      3P   3P%
--------------------------------------------------------------------------------
Allen Markkanen        11    5    3    0   0   2/2   100.0     0/0   0.0
Domantas Wall          11    4    4    0   0   2/5    40.0     0/0   0.0
Bones Anunoby          11    4    3    0   0   2/4    50.0     0/0   0.0
Klay Stewart           11    2    0    0   0   1/3    33.3     0/0   0.0
Tracy Bryant           11    0    0    2   0   0/4     0.0     0/0   0.0
Shai Wade               1    0    1    0   0   0/0     0.0     0/0   0.0
Michael Simons          1    0    0    0   0   0/1     0.0     0/0   0.0

TEAM: FG: 7/19 (36.8%), 3PT: 0/4 (0.0%), REB: 11 (4 off, 7 def), AST: 2, TO: 3
TEAM FOULS: 6 [Team_082 in BONUS]

================================================================================

================================================================================
                       2ND QUARTER - Team_082 vs Team_018                       
================================================================================

[12:00] Team_082 possession (Score: 25-17)
Dwyane O'Neal drives, picks up Tracy Bryant. Help arrives from Allen Markkanen! Dwyane O'Neal attempts a Dunk. Contested by Allen Markkanen (3.6 feet, MAN). DWYANE O'NEAL MAKES IT! Assist: Jrue Green
Score: 27-17

[11:43] Team_018 possession (Score: 27-17)
Klay Stewart drives and kicks out. Domantas Wall attempts a 3Pt. Contested by Dwyane O'Neal (3.5 feet, ZONE). DOMANTAS WALL MAKES IT! Assist: Tracy Bryant
Score: 27-20

[11:31] Team_082 possession (Score: 27-20)
Kristaps Fox drives, Allen Markkanen stays with him. Kristaps Fox attempts a Layup. Contested by Allen Markkanen (4.0 feet, MAN). Kristaps Fox misses. Rebound secured by Bones Anunoby.

[11:17] Team_018 possession (Score: 27-20)
Bones Anunoby drives, Jrue Green stays with him. Bones Anunoby attempts a Dunk. Contested by Jrue Green (5.7 feet, MAN). BONES ANUNOBY MAKES IT!
Score: 27-22

[11:06] Team_082 possession (Score: 27-22)
Kristaps Fox drives, Allen Markkanen stays with him. Kristaps Fox attempts a Layup. Contested by Allen Markkanen (4.1 feet, MAN). KRISTAPS FOX MAKES IT! Assist: Julius Carter
Score: 29-22

[10:50] Team_018 possession (Score: 29-22)
Klay Stewart drives to the basket... Klay Stewart loses the ball! Stripped by Julius Anthony! TURNOVER! (live ball)

[10:34] Team_082 possession (Score: 29-22)
Dwyane O'Neal loses control! Ball rolls out of bounds! TURNOVER! (dead ball)

[10:34] Substitution (Team_082): Julius Anthony OUT → Jordan Rozier IN (stamina_rule2)

[10:34] Substitution (Team_082): Dwyane O'Neal OUT → Kawhi Poole IN (stamina_rule2)

[10:34] Substitution (Team_082): Kristaps Fox OUT → Shaquille Griffin IN (stamina_rule2)

[10:34] Substitution (Team_082): Jrue Green OUT → Tony Jokic IN (stamina_rule2)

[10:34] Substitution (Team_082): Julius Carter OUT → D'Angelo Parker IN (stamina_rule2)

[10:34] Substitution (Team_018): Klay Stewart OUT → Michael Simons IN (stamina_rule2)

[10:34] Substitution (Team_018): Tracy Bryant OUT → Miles Herro IN (stamina_rule2)

[10:34] Substitution (Team_018): Bones Anunoby OUT → Shai Wade IN (stamina_rule2)

[10:34] Substitution (Team_018): Domantas Wall OUT → Julius Jackson IN (stamina_rule2)

[10:20] Team_018 possession (Score: 29-22)
Miles Herro attempts a Layup. Contested by D'Angelo Parker (5.3 feet, ZONE). MILES HERRO MAKES IT! Assist: Shai Wade
Score: 29-24

[10:10] Team_082 possession (Score: 29-24)
FOUL! Reach-in foul on Allen Markkanen during the drive. [Team fouls: 1] No free throws, side out. (Allen Markkanen: 1 personal fouls)

[09:52] Team_082 possession (Score: 29-24)
Kawhi Poole drives, Julius Jackson stays with him. Kawhi Poole attempts a Dunk. Contested by Julius Jackson (5.3 feet, ZONE). KAWHI POOLE MAKES IT! Assist: Tony Jokic
Score: 31-24

[09:38] Team_018 possession (Score: 31-24)
Michael Simons drives and kicks out. Michael Simons attempts a Midrange. Contested by Shaquille Griffin (4.6 feet, ZONE). Michael Simons misses. Rebound secured by Shaquille Griffin.

[09:25] Team_082 possession (Score: 31-24)
D'Angelo Parker attempts a Midrange. Contested by Julius Jackson (5.2 feet, MAN). D'Angelo Parker misses. Rebound secured by Shai Wade.

[09:10] Team_018 possession (Score: 31-24)
FOUL! Shooting foul on Shaquille Griffin. Allen Markkanen to the line for 3 free throws. [Team fouls: 1] (Shaquille Griffin: 1 personal fouls)   FT 1/3: GOOD   FT 2/3: GOOD   FT 3/3: GOOD Allen Markkanen makes 3/3 from the line.
Score: 31-27

[08:54] Team_082 possession (Score: 31-27)
Shaquille Griffin drives and kicks out. D'Angelo Parker attempts a Midrange. Contested by Julius Jackson (4.8 feet, MAN). D'Angelo Parker misses. Rebound secured by Allen Markkanen.

[08:40] Team_018 possession (Score: 31-27)
Julius Jackson attempts a Midrange. Contested by Shaquille Griffin (5.1 feet, ZONE). Julius Jackson misses. Rebound secured by Shaquille Griffin.

[08:24] Team_082 possession (Score: 31-27)
Jordan Rozier attempts a Midrange. Contested by Michael Simons (5.5 feet, MAN). Jordan Rozier misses. Rebound secured by Julius Jackson.

[08:07] Team_018 possession (Score: 31-27)
Julius Jackson drives, picks up D'Angelo Parker. Help arrives from Kawhi Poole! Julius Jackson attempts a Dunk. Contested by Kawhi Poole (5.5 feet, ZONE). JULIUS JACKSON MAKES IT! Assist: Michael Simons
Score: 31-29

[07:55] Team_082 possession (Score: 31-29)
FOUL! Holding foul on Julius Jackson. [Team fouls: 2] No free throws, side out. (Julius Jackson: 1 personal fouls)

[07:39] Team_082 possession (Score: 31-29)
Tony Jokic attempts a Layup. Contested by Julius Jackson (4.5 feet, ZONE). TONY JOKIC MAKES IT! Assist: Kawhi Poole
Score: 33-29

[07:25] Team_018 possession (Score: 33-29)
Allen Markkanen attempts a Midrange. Contested by Shaquille Griffin (4.9 feet, MAN). ALLEN MARKKANEN MAKES IT!
Score: 33-31

[07:09] Team_082 possession (Score: 33-31)
D'Angelo Parker makes the Dunk and draws the foul on Julius Jackson! And-1! D'Angelo Parker to the line for 1. [Team fouls: 3] (Julius Jackson: 2 personal fouls)   FT 1/1: GOOD D'Angelo Parker makes 1/1 from the line.
Score: 36-31

[06:57] Team_018 possession (Score: 36-31)
Miles Herro attempts a Midrange. Contested by Shaquille Griffin (4.9 feet, ZONE). MILES HERRO MAKES IT!
Score: 36-33

[06:39] Team_082 possession (Score: 36-33)
Kawhi Poole drives and kicks out. Jordan Rozier attempts a 3Pt. Contested by Michael Simons (5.4 feet, ZONE). Jordan Rozier misses. Offensive rebound by Shaquille Griffin! Shaquille Griffin kicks it out.

[06:27] Team_082 possession (Score: 36-33)
Shaquille Griffin drives, Allen Markkanen stays with him. Shaquille Griffin attempts a Layup. Contested by Allen Markkanen (4.5 feet, MAN). Shaquille Griffin misses. Rebound secured by Julius Jackson.

[06:11] Team_018 possession (Score: 36-33)
FOUL! Reach-in foul on Shaquille Griffin during the drive. [Team fouls: 2] No free throws, side out. (Shaquille Griffin: 2 personal fouls)

[05:56] Team_018 possession (Score: 36-33)
Michael Simons attempts a 3Pt. Contested by Kawhi Poole (5.7 feet, ZONE). Michael Simons misses. Rebound secured by Tony Jokic.

[05:40] Team_082 possession (Score: 36-33)
D'Angelo Parker attempts a Midrange. Contested by Shai Wade (5.3 feet, ZONE). D'Angelo Parker misses. Rebound secured by Allen Markkanen.

[05:25] Team_018 possession (Score: 36-33)
Julius Jackson attempts a 3Pt. Contested by D'Angelo Parker (5.5 feet, MAN). Julius Jackson misses. Rebound secured by Shaquille Griffin.

[05:05] Team_082 possession (Score: 36-33)
FOUL! Shooting foul on Julius Jackson. D'Angelo Parker to the line for 2 free throws. [Team fouls: 4] (Julius Jackson: 3 personal fouls)   FT 1/2: MISS   FT 2/2: GOOD D'Angelo Parker makes 1/2 from the line.
Score: 37-33

[04:51] Team_018 possession (Score: 37-33)
Julius Jackson drives and kicks out. Miles Herro attempts a 3Pt. Contested by Shaquille Griffin (4.6 feet, ZONE). Miles Herro misses. Rebound secured by Shaquille Griffin.

[04:37] Team_082 possession (Score: 37-33)
Tony Jokic attempts a Midrange. Contested by Shai Wade (4.6 feet, ZONE). Tony Jokic misses. Rebound secured by Julius Jackson.

[04:24] Team_018 possession (Score: 37-33)
FOUL! Shooting foul on Kawhi Poole. Michael Simons to the line for 3 free throws. [Team fouls: 3] (Kawhi Poole: 1 personal fouls)   FT 1/3: GOOD   FT 2/3: GOOD   FT 3/3: GOOD Michael Simons makes 3/3 from the line.
Score: 37-36

[04:08] Team_082 possession (Score: 37-36)
Jordan Rozier attempts a Midrange. Contested by Shai Wade (5.1 feet, ZONE). JORDAN ROZIER MAKES IT!
Score: 39-36

[03:57] Team_018 possession (Score: 39-36)
Miles Herro attempts a 3Pt. Contested by Kawhi Poole (5.7 feet, MAN). Miles Herro misses. Rebound secured by Tony Jokic.

[03:44] Team_082 possession (Score: 39-36)
Tony Jokic drives, picks up Shai Wade. Help arrives from Miles Herro! Tony Jokic attempts a Dunk. Contested by Miles Herro (4.7 feet, MAN). Tony Jokic misses. Offensive rebound by D'Angelo Parker! D'Angelo Parker kicks it out.

[03:27] Team_082 possession (Score: 39-36)
Kawhi Poole attempts a Midrange. Wide open! Miles Herro is 6.1 feet away. [ZONE] KAWHI POOLE MAKES IT! Assist: Tony Jokic
Score: 41-36

[03:10] Team_018 possession (Score: 41-36)
Julius Jackson drives to the basket... Julius Jackson throws a bad pass! Stolen by D'Angelo Parker! TURNOVER! (live ball)

[02:54] Team_082 possession (Score: 41-36)
Shaquille Griffin attempts a 3Pt. Contested by Allen Markkanen (5.0 feet, MAN). Shaquille Griffin misses. Offensive rebound by Tony Jokic! Tony Jokic kicks it out.

[02:42] Team_082 possession (Score: 41-36)
Jordan Rozier attempts a 3Pt. Contested by Michael Simons (5.6 feet, ZONE). Jordan Rozier misses. Rebound secured by Allen Markkanen.

[02:26] Team_018 possession (Score: 41-36)
Shai Wade loses the ball! Stripped by Tony Jokic! TURNOVER! (live ball)

[02:15] Team_082 possession (Score: 41-36)
D'Angelo Parker drives to the basket... D'Angelo Parker loses the ball! Stripped by Julius Jackson! TURNOVER! (live ball)

[02:03] Team_018 possession (Score: 41-36)
Miles Herro attempts a 3Pt. Contested by Kawhi Poole (5.8 feet, ZONE). Miles Herro misses. Rebound secured by Shaquille Griffin.

[01:48] Team_082 possession (Score: 41-36)
Shaquille Griffin attempts a Layup. Contested by Allen Markkanen (5.2 feet, MAN). SHAQUILLE GRIFFIN MAKES IT! Assist: Tony Jokic
Score: 43-36

[01:32] Team_018 possession (Score: 43-36)
Julius Jackson attempts a Layup. Contested by D'Angelo Parker (5.6 feet, MAN). JULIUS JACKSON MAKES IT!
Score: 43-38

[01:21] Team_082 possession (Score: 43-38)
FOUL! Offensive foul on D'Angelo Parker! Julius Jackson drew the charge! [Team fouls: 4] (D'Angelo Parker: 1 personal fouls) TURNOVER! (dead ball)

[01:04] Team_018 possession (Score: 43-38)
Shai Wade attempts a 3Pt. Contested by Tony Jokic (4.8 feet, MAN). SHAI WADE MAKES IT! Assist: Allen Markkanen
Score: 43-41

[00:49] Team_082 possession (Score: 43-41)
Jordan Rozier attempts a 3Pt. Contested by Michael Simons (5.7 feet, MAN). Jordan Rozier misses. Rebound secured by Allen Markkanen.

[00:33] Team_018 possession (Score: 43-41)
Shai Wade drives, picks up Tony Jokic. Help arrives from Kawhi Poole! Shai Wade attempts a Layup. Contested by Kawhi Poole (4.9 feet, MAN). SHAI WADE MAKES IT!
Score: 43-43

[00:20] Team_082 possession (Score: 43-43)
Tony Jokic attempts a Layup. Contested by Julius Jackson (4.9 feet, ZONE). Tony Jokic misses. Rebound secured by Julius Jackson.

[00:08] Team_018 possession (Score: 43-43)
Miles Herro attempts a 3Pt. Contested by Kawhi Poole (6.0 feet, ZONE). Miles Herro misses. Rebound secured by D'Angelo Parker.

================================================================================
                              2ND QUARTER COMPLETE                              
================================================================================

2ND QUARTER SCORE: Team_082 18, Team_018 26

BOX SCORE:
================================================================================

Team_082
--------------------------------------------------------------------------------
Player                MIN  PTS  REB  AST  TO      FG   FG%      3P   3P%
--------------------------------------------------------------------------------
Kawhi Poole            11    4    0    1   0   2/2   100.0     0/0   0.0
D'Angelo Parker        11    4    2    0   0   2/4    50.0     0/0   0.0
Dwyane O'Neal          13    2    0    0   0   1/1   100.0     0/0   0.0
Kristaps Fox           13    2    0    0   0   1/2    50.0     0/0   0.0
Tony Jokic             11    2    3    3   0   1/3    33.3     0/0   0.0
Shaquille Griffin      11    2    6    0   0   1/3    33.3     0/0   0.0
Jordan Rozier          11    2    0    0   0   1/4    25.0     0/0   0.0
Jrue Green             13    0    0    1   0   0/0     0.0     0/0   0.0
Julius Carter          13    0    0    1   0   0/0     0.0     0/0   0.0

TEAM: FG: 9/19 (47.4%), 3PT: 0/2 (0.0%), REB: 11 (3 off, 8 def), AST: 6, TO: 3
TEAM FOULS: 4


Team_018
--------------------------------------------------------------------------------
Player                MIN  PTS  REB  AST  TO      FG   FG%      3P   3P%
--------------------------------------------------------------------------------
Shai Wade              11    5    1    1   0   2/2   100.0     0/0   0.0
Allen Markkanen        23    5    4    1   0   2/2   100.0     0/0   0.0
Miles Herro            11    4    0    0   0   2/5    40.0     0/0   0.0
Julius Jackson         11    4    4    0   0   2/5    40.0     0/0   0.0
Domantas Wall          13    3    0    0   0   1/1   100.0     0/0   0.0
Michael Simons         11    3    0    1   0   1/3    33.3     0/0   0.0
Bones Anunoby          13    2    1    0   0   1/1   100.0     0/0   0.0
Tracy Bryant           13    0    0    1   0   0/0     0.0     0/0   0.0

TEAM: FG: 11/19 (57.9%), 3PT: 3/8 (37.5%), REB: 10 (0 off, 10 def), AST: 4, TO: 3
TEAM FOULS: 4

================================================================================

================================================================================
                       3RD QUARTER - Team_082 vs Team_018                       
================================================================================

[12:00] Team_082 possession (Score: 43-43)
Julius Carter drives, picks up Domantas Wall. Help arrives from Klay Stewart! Julius Carter attempts a Dunk. Contested by Klay Stewart (3.8 feet, MAN). JULIUS CARTER MAKES IT! Assist: Kristaps Fox
Score: 45-43

[11:47] Team_018 possession (Score: 45-43)
Tracy Bryant attempts a 3Pt. Contested by Dwyane O'Neal (3.6 feet, MAN). Tracy Bryant misses. Offensive rebound by Domantas Wall! Domantas Wall puts it back in!
Score: 45-45

[11:35] Team_082 possession (Score: 45-45)
Kristaps Fox attempts a Midrange. Contested by Tracy Bryant (3.5 feet, ZONE). KRISTAPS FOX MAKES IT!
Score: 47-45

[11:18] Team_018 possession (Score: 47-45)
Bones Anunoby makes the Layup and draws the foul on Jrue Green! And-1! Bones Anunoby to the line for 1. [Team fouls: 1] (Jrue Green: 1 personal fouls)   FT 1/1: GOOD Bones Anunoby makes 1/1 from the line.
Score: 47-48

[11:03] Team_082 possession (Score: 47-48)
Kristaps Fox attempts a 3Pt. Contested by Klay Stewart (4.2 feet, ZONE). Kristaps Fox misses. Rebound secured by Allen Markkanen.

[10:49] Team_018 possession (Score: 47-48)
Tracy Bryant attempts a 3Pt. Contested by Dwyane O'Neal (3.6 feet, MAN). Tracy Bryant misses. Rebound secured by Jrue Green.

[10:39] Team_082 possession (Score: 47-48)
Jrue Green drives and kicks out. Julius Carter attempts a Midrange. Contested by Domantas Wall (3.4 feet, MAN). Julius Carter misses. Rebound secured by Bones Anunoby.

[10:26] Team_018 possession (Score: 47-48)
Domantas Wall drives and kicks out. Klay Stewart attempts a 3Pt. Contested by Julius Anthony (4.5 feet, MAN). KLAY STEWART MAKES IT! Assist: Tracy Bryant
Score: 47-51

[10:10] Team_082 possession (Score: 47-51)
Dwyane O'Neal attempts a Midrange. Contested by Tracy Bryant (3.4 feet, MAN). Dwyane O'Neal misses. Rebound secured by Domantas Wall.

[09:54] Team_018 possession (Score: 47-51)
Tracy Bryant attempts a 3Pt. BLOCKED BY DWYANE O'NEAL! Ball is loose! Offensive rebound by Bones Anunoby! Bones Anunoby kicks it out.

[09:39] Team_018 possession (Score: 47-51)
Domantas Wall drives and kicks out. Allen Markkanen attempts a 3Pt. Contested by Dwyane O'Neal (3.3 feet, ZONE). ALLEN MARKKANEN MAKES IT! Assist: Bones Anunoby
Score: 47-54

[09:26] Team_082 possession (Score: 47-54)
Julius Carter commits a violation (traveling/carry)! TURNOVER! (dead ball)

[09:07] Team_018 possession (Score: 47-54)
Bones Anunoby attempts a Midrange. Contested by Jrue Green (5.4 feet, MAN). BONES ANUNOBY MAKES IT! Assist: Klay Stewart
Score: 47-56

[08:50] Team_082 possession (Score: 47-56)
Dwyane O'Neal attempts a Layup. Contested by Tracy Bryant (3.4 feet, MAN). DWYANE O'NEAL MAKES IT! Assist: Jrue Green
Score: 49-56

[08:36] Team_018 possession (Score: 49-56)
Tracy Bryant attempts a Layup. Contested by Jrue Green (5.4 feet, ZONE). TRACY BRYANT MAKES IT!
Score: 49-58

[08:22] Team_082 possession (Score: 49-58)
Jrue Green makes the Midrange and draws the foul on Bones Anunoby! And-1! Jrue Green to the line for 1. [Team fouls: 1] (Bones Anunoby: 1 personal fouls)   FT 1/1: GOOD Jrue Green makes 1/1 from the line.
Score: 52-58

[08:12] Team_018 possession (Score: 52-58)
Tracy Bryant drives to the basket... Tracy Bryant loses control! Ball rolls out of bounds! TURNOVER! (dead ball)

[08:00] Team_082 possession (Score: 52-58)
Julius Carter drives and kicks out. Julius Anthony attempts a Midrange. Contested by Allen Markkanen (3.8 feet, ZONE). Julius Anthony misses. Rebound secured by Domantas Wall.

[07:46] Team_018 possession (Score: 52-58)
Klay Stewart attempts a 3Pt. Contested by Dwyane O'Neal (3.5 feet, ZONE). Klay Stewart misses. Rebound secured by Jrue Green.

[07:32] Team_082 possession (Score: 52-58)
Jrue Green attempts a 3Pt. Contested by Allen Markkanen (4.1 feet, ZONE). Jrue Green misses. Rebound secured by Allen Markkanen.

[07:13] Team_018 possession (Score: 52-58)
Allen Markkanen attempts a Midrange. Contested by Kristaps Fox (4.6 feet, ZONE). Allen Markkanen misses. Rebound secured by Julius Carter.

[06:54] Team_082 possession (Score: 52-58)
Kristaps Fox attempts a 3Pt. Contested by Allen Markkanen (3.9 feet, MAN). KRISTAPS FOX MAKES IT! Assist: Julius Carter
Score: 55-58

[06:40] Team_018 possession (Score: 55-58)
Bones Anunoby makes the Layup and draws the foul on Jrue Green! And-1! Bones Anunoby to the line for 1. [Team fouls: 2] (Jrue Green: 2 personal fouls)   FT 1/1: GOOD Bones Anunoby makes 1/1 from the line.
Score: 55-61

[06:25] Team_082 possession (Score: 55-61)
Kristaps Fox drives to the basket... Kristaps Fox loses control! Ball rolls out of bounds! TURNOVER! (dead ball)

[06:11] Team_018 possession (Score: 55-61)
Bones Anunoby attempts a Midrange. Contested by Jrue Green (5.4 feet, MAN). Bones Anunoby misses. Rebound secured by Jrue Green.

[05:56] Team_082 possession (Score: 55-61)
FOUL! Shooting foul on Klay Stewart. Julius Anthony to the line for 2 free throws. [Team fouls: 2] (Klay Stewart: 1 personal fouls)   FT 1/2: GOOD   FT 2/2: GOOD Julius Anthony makes 2/2 from the line.
Score: 57-61

[05:45] Team_018 possession (Score: 57-61)
Bones Anunoby attempts a 3Pt. Contested by Kristaps Fox (4.5 feet, ZONE). Bones Anunoby misses. Rebound secured by Dwyane O'Neal.

[05:34] Team_082 possession (Score: 57-61)
Jrue Green attempts a Layup. Contested by Domantas Wall (3.8 feet, ZONE). JRUE GREEN MAKES IT! Assist: Julius Anthony
Score: 59-61

[05:16] Team_018 possession (Score: 59-61)
Klay Stewart attempts a Midrange. Contested by Julius Anthony (4.7 feet, MAN). KLAY STEWART MAKES IT! Assist: Allen Markkanen
Score: 59-63

[05:01] Team_082 possession (Score: 59-63)
Dwyane O'Neal drives and kicks out. Julius Carter attempts a 3Pt. Contested by Domantas Wall (3.5 feet, MAN). Julius Carter misses. Rebound secured by Domantas Wall.

[04:48] Team_018 possession (Score: 59-63)
Domantas Wall attempts a Midrange. Wide open! Julius Carter is 6.0 feet away. [MAN] Domantas Wall misses. Offensive rebound by Bones Anunoby! Bones Anunoby kicks it out.

[04:31] Team_018 possession (Score: 59-63)
Domantas Wall attempts a 3Pt. Contested by Dwyane O'Neal (3.6 feet, ZONE). Domantas Wall misses. FOUL! Loose ball foul on Dwyane O'Neal during the rebound battle. [Team fouls: 3] No free throws, side out. (Dwyane O'Neal: 1 personal fouls)

[04:17] Team_018 possession (Score: 59-63)
Allen Markkanen drives to the basket... Allen Markkanen loses the ball! Stripped by Jrue Green! TURNOVER! (live ball)

[04:08] Team_082 possession (Score: 59-63)
Dwyane O'Neal attempts a Midrange. Contested by Tracy Bryant (3.5 feet, MAN). DWYANE O'NEAL MAKES IT! Assist: Kristaps Fox
Score: 61-63

[03:54] Team_018 possession (Score: 61-63)
Klay Stewart attempts a 3Pt. Contested by Julius Anthony (4.8 feet, MAN). KLAY STEWART MAKES IT! Assist: Allen Markkanen
Score: 61-66

[03:44] Team_082 possession (Score: 61-66)
Jrue Green attempts a Layup. Contested by Domantas Wall (4.0 feet, ZONE). JRUE GREEN MAKES IT! Assist: Julius Anthony
Score: 63-66

[03:34] Team_018 possession (Score: 63-66)
FOUL! Offensive foul on Tracy Bryant! Dwyane O'Neal drew the charge! [Team fouls: 3] (Tracy Bryant: 1 personal fouls) TURNOVER! (dead ball)

[03:24] Team_082 possession (Score: 63-66)
Dwyane O'Neal attempts a 3Pt. Contested by Tracy Bryant (3.6 feet, MAN). DWYANE O'NEAL MAKES IT! Assist: Julius Carter
Score: 66-66

[03:11] Team_018 possession (Score: 66-66)
Klay Stewart attempts a Layup. Contested by Julius Anthony (4.9 feet, MAN). KLAY STEWART MAKES IT!
Score: 66-68

[02:54] Team_082 possession (Score: 66-68)
Kristaps Fox attempts a Layup. Contested by Domantas Wall (3.9 feet, ZONE). Kristaps Fox misses. Rebound secured by Bones Anunoby.

[02:37] Team_018 possession (Score: 66-68)
FOUL! Shooting foul on Dwyane O'Neal. Tracy Bryant to the line for 2 free throws. [Team fouls: 4] (Dwyane O'Neal: 2 personal fouls)   FT 1/2: MISS   FT 2/2: GOOD Tracy Bryant makes 1/2 from the line.
Score: 66-69

[02:19] Team_082 possession (Score: 66-69)
FOUL! Reach-in foul on Tracy Bryant during the drive. [Team fouls: 4] No free throws, side out. (Tracy Bryant: 2 personal fouls)

[02:06] Team_082 possession (Score: 66-69)
FOUL! Holding foul on Bones Anunoby. [IN THE BONUS! 5 team fouls] Jrue Green to the line for 2 free throws. (Bones Anunoby: 2 personal fouls)   FT 1/2: GOOD   FT 2/2: GOOD Jrue Green makes 2/2 from the line.
Score: 68-69

[01:53] Team_018 possession (Score: 68-69)
Tracy Bryant attempts a 3Pt. Contested by Dwyane O'Neal (4.0 feet, ZONE). Tracy Bryant misses. Offensive rebound by Domantas Wall! Domantas Wall puts it back in!
Score: 68-71

[01:38] Team_082 possession (Score: 68-71)
Julius Anthony makes the 3Pt and draws the foul on Klay Stewart! And-1! Julius Anthony to the line for 1. [BONUS: 6 team fouls] (Klay Stewart: 2 personal fouls)   FT 1/1: GOOD Julius Anthony makes 1/1 from the line.
Score: 72-71

[01:24] Team_018 possession (Score: 72-71)
Klay Stewart attempts a Layup. BLOCKED BY DWYANE O'NEAL! Ball is loose! Rebound secured by Julius Carter.

[01:10] Team_082 possession (Score: 72-71)
Kristaps Fox attempts a Midrange. Contested by Bones Anunoby (4.0 feet, ZONE). Kristaps Fox misses. Rebound secured by Domantas Wall.

[00:56] Team_018 possession (Score: 72-71)
Domantas Wall drives, Julius Carter stays with him. Domantas Wall attempts a Dunk. Wide open! Julius Carter is 6.3 feet away. [MAN] DOMANTAS WALL MAKES IT! Assist: Allen Markkanen
Score: 72-73

[00:42] Team_082 possession (Score: 72-73)
Julius Anthony attempts a 3Pt. Contested by Klay Stewart (4.8 feet, ZONE). Julius Anthony misses. Rebound secured by Bones Anunoby.

[00:28] Team_018 possession (Score: 72-73)
Domantas Wall makes the Layup and draws the foul on Jrue Green! And-1! Domantas Wall to the line for 1. [BONUS: 5 team fouls] (Jrue Green: 3 personal fouls)   FT 1/1: GOOD Domantas Wall makes 1/1 from the line.
Score: 72-76

[00:18] Team_082 possession (Score: 72-76)
Julius Carter attempts a Layup. Contested by Domantas Wall (4.5 feet, MAN). Julius Carter misses. Rebound secured by Bones Anunoby.

[00:02] Team_018 possession (Score: 72-76)
Tracy Bryant attempts a Midrange. Wide open! Julius Carter is 6.5 feet away. [ZONE] Tracy Bryant misses. Offensive rebound by Domantas Wall! Domantas Wall's putback is no good. Rebound secured by Dwyane O'Neal.

================================================================================
                              3RD QUARTER COMPLETE                              
================================================================================

3RD QUARTER SCORE: Team_082 29, Team_018 33

BOX SCORE:
================================================================================

Team_082
--------------------------------------------------------------------------------
Player                MIN  PTS  REB  AST  TO      FG   FG%      3P   3P%
--------------------------------------------------------------------------------
Jrue Green             25    9    3    1   0   4/6    66.7     0/0   0.0
Julius Anthony         25    6    0    2   0   2/3    66.7     0/0   0.0
Kristaps Fox           25    5    0    2   0   2/5    40.0     0/0   0.0
Julius Carter          25    2    2    2   0   1/3    33.3     0/0   0.0

TEAM: FG: 12/22 (54.5%), 3PT: 3/6 (50.0%), REB: 6 (0 off, 6 def), AST: 7, TO: 2
TEAM FOULS: 5 [Team_018 in BONUS]


Team_018
--------------------------------------------------------------------------------
Player                MIN  PTS  REB  AST  TO      FG   FG%      3P   3P%
--------------------------------------------------------------------------------
Klay Stewart           25   10    0    1   0   4/6    66.7     0/0   0.0
Domantas Wall          25    9    7    0   0   4/4   100.0     0/0   0.0
Bones Anunoby          25    8    6    1   0   3/5    60.0     0/0   0.0
Dwyane O'Neal          25    7    2    0   0   3/5    60.0     0/0   0.0
Allen Markkanen        36    3    2    3   0   1/2    50.0     0/0   0.0
Tracy Bryant           25    3    0    1   0   2/4    50.0     0/0   0.0

TEAM: FG: 14/21 (66.7%), 3PT: 3/6 (50.0%), REB: 16 (6 off, 10 def), AST: 6, TO: 3
TEAM FOULS: 6 [Team_082 in BONUS]

================================================================================

================================================================================
                       4TH QUARTER - Team_082 vs Team_018                       
================================================================================

[12:00] Team_082 possession (Score: 72-76)
Jrue Green throws a bad pass! Stolen by Bones Anunoby! TURNOVER! (live ball)

[11:45] Team_018 possession (Score: 72-76)
Tracy Bryant attempts a 3Pt. Contested by Dwyane O'Neal (4.0 feet, MAN). Tracy Bryant misses. Offensive rebound by Domantas Wall! Domantas Wall's putback is no good. Rebound secured by Dwyane O'Neal.

[11:26] Team_082 possession (Score: 72-76)
Julius Carter drives and kicks out. Jrue Green attempts a 3Pt. Contested by Bones Anunoby (3.9 feet, MAN). Jrue Green misses. Rebound secured by Bones Anunoby.

[11:12] Team_018 possession (Score: 72-76)
Allen Markkanen attempts a 3Pt. Contested by Kristaps Fox (5.0 feet, ZONE). ALLEN MARKKANEN MAKES IT! Assist: Domantas Wall
Score: 72-79

[10:59] Team_082 possession (Score: 72-79)
FOUL! Reach-in foul on Klay Stewart during the drive. [Team fouls: 1] No free throws, side out. (Klay Stewart: 1 personal fouls)

[10:41] Team_082 possession (Score: 72-79)
Kristaps Fox attempts a 3Pt. Contested by Allen Markkanen (4.2 feet, MAN). Kristaps Fox misses. Rebound secured by Allen Markkanen.

[10:30] Team_018 possession (Score: 72-79)
FOUL! Offensive foul on Tracy Bryant! Dwyane O'Neal drew the charge! [Team fouls: 2] (Tracy Bryant: 1 personal fouls) TURNOVER! (dead ball)

[10:13] Team_082 possession (Score: 72-79)
Julius Carter attempts a Midrange. Contested by Domantas Wall (4.5 feet, MAN). Julius Carter misses. Rebound secured by Domantas Wall.

[09:55] Team_018 possession (Score: 72-79)
Allen Markkanen drives to the basket... Allen Markkanen throws a bad pass out of bounds! TURNOVER! (dead ball)

[09:55] Substitution (Team_082): Julius Anthony OUT → Jordan Rozier IN (stamina_rule2)

[09:55] Substitution (Team_082): Dwyane O'Neal OUT → Kawhi Poole IN (stamina_rule2)

[09:55] Substitution (Team_082): Kristaps Fox OUT → Shaquille Griffin IN (stamina_rule2)

[09:55] Substitution (Team_082): Jrue Green OUT → Tony Jokic IN (stamina_rule2)

[09:55] Substitution (Team_082): Julius Carter OUT → D'Angelo Parker IN (stamina_rule2)

[09:55] Substitution (Team_018): Klay Stewart OUT → Michael Simons IN (stamina_rule2)

[09:55] Substitution (Team_018): Tracy Bryant OUT → Miles Herro IN (stamina_rule2)

[09:55] Substitution (Team_018): Allen Markkanen OUT → Austin Antetokounmpo IN (stamina_rule2)

[09:55] Substitution (Team_018): Bones Anunoby OUT → Shai Wade IN (stamina_rule2)

[09:55] Substitution (Team_018): Domantas Wall OUT → Julius Jackson IN (stamina_rule2)

[09:42] Team_082 possession (Score: 72-79)
FOUL! Holding foul on Austin Antetokounmpo. [Team fouls: 3] No free throws, side out. (Austin Antetokounmpo: 1 personal fouls)

[09:31] Team_082 possession (Score: 72-79)
Kawhi Poole attempts a 3Pt. Contested by Michael Simons (6.0 feet, ZONE). Kawhi Poole misses. Rebound secured by Austin Antetokounmpo.

[09:13] Team_018 possession (Score: 72-79)
Shai Wade throws a bad pass! Stolen by Tony Jokic! TURNOVER! (live ball)

[08:57] Team_082 possession (Score: 72-79)
Kawhi Poole attempts a Layup. Contested by Julius Jackson (5.3 feet, ZONE). Kawhi Poole misses. Rebound secured by Julius Jackson.

[08:38] Team_018 possession (Score: 72-79)
Julius Jackson attempts a Layup. Contested by D'Angelo Parker (5.5 feet, ZONE). Julius Jackson misses. Rebound secured by D'Angelo Parker.

[08:21] Team_082 possession (Score: 72-79)
Kawhi Poole drives, picks up Miles Herro. Help arrives from Austin Antetokounmpo! Kawhi Poole attempts a Dunk. Wide open! Austin Antetokounmpo is 6.0 feet away. [MAN] KAWHI POOLE MAKES IT!
Score: 74-79

[08:05] Team_018 possession (Score: 74-79)
Austin Antetokounmpo attempts a Midrange. Contested by Shaquille Griffin (4.1 feet, MAN). AUSTIN ANTETOKOUNMPO MAKES IT!
Score: 74-81

[07:50] Team_082 possession (Score: 74-81)
D'Angelo Parker drives, Julius Jackson stays with him. D'Angelo Parker attempts a Layup. Contested by Julius Jackson (5.2 feet, ZONE). D'ANGELO PARKER MAKES IT! Assist: Tony Jokic
Score: 76-81

[07:39] Team_018 possession (Score: 76-81)
Michael Simons loses control! Ball rolls out of bounds! TURNOVER! (dead ball)

[07:22] Team_082 possession (Score: 76-81)
Kawhi Poole attempts a Midrange. Wide open! Miles Herro is 6.0 feet away. [ZONE] Kawhi Poole misses. Rebound secured by Austin Antetokounmpo.

[07:09] Team_018 possession (Score: 76-81)
Austin Antetokounmpo makes the Layup and draws the foul on D'Angelo Parker! And-1! Austin Antetokounmpo to the line for 1. [Team fouls: 1] (D'Angelo Parker: 1 personal fouls)   FT 1/1: MISS Austin Antetokounmpo makes 0/1 from the line. Rebound secured by D'Angelo Parker.
Score: 76-83

[06:56] Team_082 possession (Score: 76-83)
Shaquille Griffin attempts a 3Pt. Contested by Shai Wade (4.9 feet, ZONE). SHAQUILLE GRIFFIN MAKES IT! Assist: Tony Jokic
Score: 79-83

[06:43] Team_018 possession (Score: 79-83)
FOUL! Shooting foul on Tony Jokic. Austin Antetokounmpo to the line for 2 free throws. [Team fouls: 2] (Tony Jokic: 1 personal fouls)   FT 1/2: GOOD   FT 2/2: MISS Austin Antetokounmpo makes 1/2 from the line. Rebound secured by D'Angelo Parker.
Score: 79-84

[06:30] Team_082 possession (Score: 79-84)
Kawhi Poole attempts a 3Pt. Wide open! Miles Herro is 6.0 feet away. [MAN] KAWHI POOLE MAKES IT! Assist: Shaquille Griffin
Score: 82-84

[06:15] Team_018 possession (Score: 82-84)
Austin Antetokounmpo attempts a Layup. Contested by Shaquille Griffin (4.1 feet, MAN). Austin Antetokounmpo misses. Offensive rebound by Shai Wade! Shai Wade kicks it out.

[06:02] Team_018 possession (Score: 82-84)
Austin Antetokounmpo attempts a 3Pt. Contested by Shaquille Griffin (4.1 feet, MAN). AUSTIN ANTETOKOUNMPO MAKES IT! Assist: Shai Wade
Score: 82-87

[05:48] Team_082 possession (Score: 82-87)
D'Angelo Parker attempts a Midrange. Contested by Miles Herro (5.9 feet, ZONE). D'Angelo Parker misses. Rebound secured by Shai Wade.

[05:31] Team_018 possession (Score: 82-87)
Michael Simons loses control! Ball rolls out of bounds! TURNOVER! (dead ball)

[05:16] Team_082 possession (Score: 82-87)
Jordan Rozier attempts a 3Pt. Contested by Michael Simons (5.5 feet, ZONE). Jordan Rozier misses. Rebound secured by Shai Wade.

[04:58] Team_018 possession (Score: 82-87)
Miles Herro drives, picks up Kawhi Poole. Help arrives from Shaquille Griffin! Miles Herro attempts a Dunk. Contested by Shaquille Griffin (5.7 feet, MAN). MILES HERRO MAKES IT!
Score: 82-89

[04:46] Team_082 possession (Score: 82-89)
Jordan Rozier attempts a 3Pt. Contested by Michael Simons (5.5 feet, ZONE). Jordan Rozier misses. Rebound secured by Shai Wade.

[04:31] Team_018 possession (Score: 82-89)
Shai Wade attempts a Midrange. Contested by Tony Jokic (4.6 feet, MAN). SHAI WADE MAKES IT! Assist: Austin Antetokounmpo
Score: 82-91

[04:14] Team_082 possession (Score: 82-91)
Kawhi Poole attempts a 3Pt. Contested by Michael Simons (6.0 feet, ZONE). Kawhi Poole misses. Rebound secured by Shai Wade.

[03:56] Team_018 possession (Score: 82-91)
Michael Simons attempts a Midrange. Wide open! Jordan Rozier is 6.3 feet away. [MAN] MICHAEL SIMONS MAKES IT! Assist: Shai Wade
Score: 82-93

[03:46] Team_082 possession (Score: 82-93)
D'Angelo Parker drives, Shai Wade stays with him. D'Angelo Parker attempts a Dunk. Contested by Shai Wade (5.3 feet, ZONE). D'ANGELO PARKER MAKES IT! Assist: Jordan Rozier
Score: 84-93

[03:32] Team_018 possession (Score: 84-93)
Julius Jackson attempts a 3Pt. Contested by D'Angelo Parker (5.5 feet, MAN). Julius Jackson misses. Rebound secured by Shaquille Griffin.

[03:19] Team_082 possession (Score: 84-93)
Tony Jokic attempts a 3Pt. Contested by Shai Wade (4.7 feet, MAN). Tony Jokic misses. Rebound secured by Julius Jackson.

[03:05] Team_018 possession (Score: 84-93)
Michael Simons throws a bad pass! Stolen by Jordan Rozier! TURNOVER! (live ball)

[02:55] Team_082 possession (Score: 84-93)
Jordan Rozier attempts a Layup. Contested by Julius Jackson (4.9 feet, ZONE). Jordan Rozier misses. Rebound secured by Julius Jackson.

[02:41] Team_018 possession (Score: 84-93)
Miles Herro attempts a Midrange. Wide open! Jordan Rozier is 6.3 feet away. [ZONE] Miles Herro misses. Rebound secured by Tony Jokic.

[02:28] Team_082 possession (Score: 84-93)
Shaquille Griffin attempts a Midrange. Contested by Austin Antetokounmpo (5.3 feet, MAN). SHAQUILLE GRIFFIN MAKES IT! Assist: Jordan Rozier
Score: 86-93

[02:16] Team_018 possession (Score: 86-93)
Julius Jackson drives and kicks out. FOUL! Shooting foul on Shaquille Griffin. Austin Antetokounmpo to the line for 2 free throws. [Team fouls: 3] (Shaquille Griffin: 1 personal fouls)   FT 1/2: GOOD   FT 2/2: GOOD Austin Antetokounmpo makes 2/2 from the line.
Score: 86-95

[01:59] Team_082 possession (Score: 86-95)
Jordan Rozier attempts a 3Pt. Contested by Michael Simons (5.6 feet, ZONE). Jordan Rozier misses. Rebound secured by Austin Antetokounmpo.

[01:44] Team_018 possession (Score: 86-95)
FOUL! Reach-in foul on D'Angelo Parker during the drive. [Team fouls: 4] No free throws, side out. (D'Angelo Parker: 2 personal fouls)

[01:26] Team_018 possession (Score: 86-95)
Michael Simons attempts a 3Pt. Wide open! Jordan Rozier is 6.4 feet away. [MAN] Michael Simons misses. Rebound secured by Tony Jokic.

[01:13] Team_082 possession (Score: 86-95)
Tony Jokic drives and kicks out. FOUL! Shooting foul on Shai Wade. Tony Jokic to the line for 3 free throws. [Team fouls: 4] (Shai Wade: 1 personal fouls)   FT 1/3: GOOD   FT 2/3: GOOD   FT 3/3: GOOD Tony Jokic makes 3/3 from the line.
Score: 89-95

[00:57] Team_018 possession (Score: 89-95)
FOUL! Reach-in foul on D'Angelo Parker during the drive. [IN THE BONUS! 5 team fouls] Austin Antetokounmpo to the line for 2 free throws. (D'Angelo Parker: 3 personal fouls)   FT 1/2: MISS   FT 2/2: GOOD Austin Antetokounmpo makes 1/2 from the line.
Score: 89-96

[00:41] Team_082 possession (Score: 89-96)
FOUL! Holding foul on Michael Simons. [IN THE BONUS! 5 team fouls] Jordan Rozier to the line for 2 free throws. (Michael Simons: 1 personal fouls)   FT 1/2: MISS   FT 2/2: GOOD Jordan Rozier makes 1/2 from the line.
Score: 90-96

[00:26] Team_018 possession (Score: 90-96)
Miles Herro drives, Kawhi Poole stays with him. Miles Herro attempts a Dunk. Contested by Kawhi Poole (5.9 feet, MAN). MILES HERRO MAKES IT! Assist: Julius Jackson
Score: 90-98

[00:10] Team_082 possession (Score: 90-98)
Jordan Rozier attempts a 3Pt. Contested by Michael Simons (5.7 feet, MAN). Jordan Rozier misses. Rebound secured by Austin Antetokounmpo.

================================================================================
                              4TH QUARTER COMPLETE                              
================================================================================

4TH QUARTER SCORE: Team_082 18, Team_018 22

BOX SCORE:
================================================================================

Team_082
--------------------------------------------------------------------------------
Player                MIN  PTS  REB  AST  TO      FG   FG%      3P   3P%
--------------------------------------------------------------------------------
Kawhi Poole            21    5    0    0   0   2/6    33.3     0/0   0.0
Shaquille Griffin      21    5    1    1   0   2/2   100.0     0/0   0.0
D'Angelo Parker        21    4    3    0   0   2/3    66.7     0/0   0.0
Tony Jokic             21    3    2    2   0   1/2    50.0     0/0   0.0
Jordan Rozier          21    1    0    2   0   1/6    16.7     0/0   0.0
Julius Carter          27    0    0    0   0   0/2     0.0     0/0   0.0
Kristaps Fox           27    0    0    0   0   0/1     0.0     0/0   0.0

TEAM: FG: 8/22 (36.4%), 3PT: 2/10 (20.0%), REB: 6 (0 off, 6 def), AST: 5, TO: 1
TEAM FOULS: 5 [Team_018 in BONUS]


Team_018
--------------------------------------------------------------------------------
Player                MIN  PTS  REB  AST  TO      FG   FG%      3P   3P%
--------------------------------------------------------------------------------
Austin Antetokounmpo   11    8    4    1   0   4/6    66.7     0/0   0.0
Miles Herro            21    4    0    0   0   2/3    66.7     0/0   0.0
Allen Markkanen        38    3    1    0   0   1/1   100.0     0/0   0.0
Shai Wade              21    2    5    2   0   1/1   100.0     0/0   0.0
Michael Simons         21    2    0    0   0   1/2    50.0     0/0   0.0
Tracy Bryant           27    0    0    0   0   0/1     0.0     0/0   0.0
Dwyane O'Neal          27    0    1    0   0   0/0     0.0     0/0   0.0
Bones Anunoby          27    0    1    0   0   0/0     0.0     0/0   0.0
Domantas Wall          27    0    1    1   0   0/0     0.0     0/0   0.0
Julius Jackson         21    0    3    1   0   0/2     0.0     0/0   0.0

TEAM: FG: 9/16 (56.2%), 3PT: 2/5 (40.0%), REB: 16 (2 off, 14 def), AST: 5, TO: 6
TEAM FOULS: 5 [Team_082 in BONUS]

================================================================================

================================================================================
                               FULL GAME COMPLETE                               
================================================================================

FINAL SCORE: Team_082 90, Team_018 98

SCORING BY QUARTER:
--------------------------------------------------------------------------------
Team                     Q1     Q2     Q3     Q4    FINAL
--------------------------------------------------------------------------------
Team_082                 25     18     29     18       90
Team_018                 17     26     33     22       98
--------------------------------------------------------------------------------

FULL GAME BOX SCORE:
================================================================================

Team_082
--------------------------------------------------------------------------------
Player                MIN  PTS  REB  AST  TO      FG   FG%      3P   3P%      FT STL BLK
--------------------------------------------------------------------------------
Julius Anthony         27   10    0    3   0   4/6    66.7   1/2    50.0   3/3     2   0
Dwyane O'Neal          27   14    9    0   5   6/8    75.0   2/2   100.0   2/2     0   2
Kristaps Fox           27   14    0    5   0   6/14   42.9   2/5    40.0   0/0     0   0
Jrue Green             27   12    8    3   1   4/8    50.0   1/2    50.0   3/3     1   0
Julius Carter          27    4    3    3   2   2/8    25.0   0/0     0.0   2/2     1   0
Jordan Rozier          21    3    0    2   0   1/9    11.1   0/6     0.0   1/2     1   0
Kawhi Poole            21   13    0    1   0   4/8    50.0   1/3    33.3   1/1     0   0
Shaquille Griffin      21    7    7    1   0   3/5    60.0   1/1   100.0   0/0     0   0
Tony Jokic             21    5    6    5   1   2/5    40.0   0/1     0.0   3/3     2   0
D'Angelo Parker        21    8    5    0   1   5/8    62.5   0/0     0.0   2/3     1   0

TEAM: FG: 39/81 (48.1%), 3PT: 8/22 (36.4%), REB: 36 (4 off, 32 def), AST: 23, TO: 10


Team_018
--------------------------------------------------------------------------------
Player                MIN  PTS  REB  AST  TO      FG   FG%      3P   3P%      FT STL BLK
--------------------------------------------------------------------------------
Allen Markkanen        38   16   10    4   2   6/7    85.7   2/2   100.0   4/4     1   0
Klay Stewart           27   12    0    1   2   5/9    55.6   1/3    33.3   0/0     0   0
Tracy Bryant           27    3    0    4   3   4/11   36.4   2/6    33.3   1/2     0   0
Bones Anunoby          27   14   11    1   1   7/11   63.6   0/1     0.0   2/3     1   0
Domantas Wall          27   16   12    1   1   4/7    57.1   0/0     0.0   1/1     0   1
Michael Simons         21    5    0    1   3   2/6    33.3   1/4    25.0   3/3     0   0
Miles Herro            21    8    0    0   0   4/8    50.0   0/3     0.0   0/0     0   0
Shai Wade              21    7    7    3   2   3/3   100.0   1/1   100.0   0/0     0   0
Julius Jackson         21    4    7    1   1   3/8    37.5   0/2     0.0   0/0     1   0
Austin Antetokounmpo   11    8    4    1   0   3/5    60.0   1/1   100.0   4/7     0   0

TEAM: FG: 41/75 (54.7%), 3PT: 8/23 (34.8%), REB: 53 (12 off, 41 def), AST: 17, TO: 15

================================================================================
