================================================================================
                        FULL GAME - Team_016 vs Team_046                        
================================================================================

================================================================================
                       1ST QUARTER - Team_016 vs Team_046                       
================================================================================

[12:00] Team_016 possession (Score: 0-0)
Collin Barnes makes the 3Pt and draws the foul on Lauri Carter! And-1! Collin Barnes to the line for 1. [Team fouls: 1] (Lauri Carter: 1 personal fouls)   FT 1/1: GOOD Collin Barnes makes 1/1 from the line.
Score: 4-0

[11:44] Team_046 possession (Score: 4-0)
Cade Wall attempts a 3Pt. Contested by Ben Barrett (4.3 feet, MAN). Cade Wall misses. Offensive rebound by Cade Wall! Cade Wall kicks it out.

[11:29] Team_046 possession (Score: 4-0)
Cade Wall attempts a 3Pt. Contested by Collin Barnes (4.6 feet, ZONE). Cade Wall misses. Rebound secured by Vince Quickley.

[11:19] Team_016 possession (Score: 4-0)
Vince Duncan attempts a Layup. Contested by Kevin Allen (5.0 feet, ZONE). VINCE DUNCAN MAKES IT! Assist: Vince Quickley
Score: 6-0

[11:07] Team_046 possession (Score: 6-0)
FOUL! Shooting foul on Vince Duncan. Kevin Allen to the line for 2 free throws. [Team fouls: 1] (Vince Duncan: 1 personal fouls)   FT 1/2: MISS   FT 2/2: GOOD Kevin Allen makes 1/2 from the line.
Score: 6-1

[10:57] Team_016 possession (Score: 6-1)
Collin Barnes attempts a 3Pt. Contested by Lauri Carter (3.3 feet, ZONE). Collin Barnes misses. Rebound secured by Kevin Allen.

[10:40] Team_046 possession (Score: 6-1)
Victor Nowitzki attempts a 3Pt. Contested by Giannis Ginobili (5.8 feet, MAN). Victor Nowitzki misses. Rebound secured by Ben Barrett.

[10:27] Team_016 possession (Score: 6-1)
Collin Barnes attempts a 3Pt. Contested by D'Angelo O'Neal (4.1 feet, MAN). Collin Barnes misses. Rebound secured by Cade Wall.

[10:10] Team_046 possession (Score: 6-1)
D'Angelo O'Neal attempts a 3Pt. Contested by Collin Barnes (4.2 feet, MAN). D'Angelo O'Neal misses. Rebound secured by Vince Quickley.

[09:51] Team_016 possession (Score: 6-1)
Vince Quickley attempts a 3Pt. Contested by Lauri Carter (2.8 feet, MAN). Vince Quickley misses. Rebound secured by Kevin Allen.

[09:37] Team_046 possession (Score: 6-1)
Cade Wall attempts a 3Pt. Contested by Ben Barrett (4.3 feet, MAN). CADE WALL MAKES IT! Assist: Victor Nowitzki
Score: 6-4

[09:23] Team_016 possession (Score: 6-4)
Ben Barrett attempts a Layup. Contested by Kevin Allen (5.2 feet, ZONE). Ben Barrett misses. Rebound secured by Cade Wall.

[09:10] Team_046 possession (Score: 6-4)
Cade Wall attempts a Layup. Contested by Ben Barrett (4.3 feet, MAN). CADE WALL MAKES IT!
Score: 6-6

[08:54] Team_016 possession (Score: 6-6)
Collin Barnes attempts a Layup. Contested by Cade Wall (3.8 feet, ZONE). COLLIN BARNES MAKES IT!
Score: 8-6

[08:39] Team_046 possession (Score: 8-6)
Cade Wall attempts a 3Pt. Contested by Collin Barnes (4.6 feet, ZONE). CADE WALL MAKES IT!
Score: 8-9

[08:28] Team_016 possession (Score: 8-9)
Ben Barrett drives, picks up Cade Wall. Help arrives from D'Angelo O'Neal! Ben Barrett attempts a Layup. Contested by D'Angelo O'Neal (4.3 feet, MAN). BEN BARRETT MAKES IT! Assist: Vince Quickley
Score: 10-9

[08:13] Team_046 possession (Score: 10-9)
FOUL! Shooting foul on Collin Barnes. Kevin Allen to the line for 2 free throws. [Team fouls: 2] (Collin Barnes: 1 personal fouls)   FT 1/2: GOOD   FT 2/2: GOOD Kevin Allen makes 2/2 from the line.
Score: 10-11

[08:00] Team_016 possession (Score: 10-11)
Collin Barnes makes the Layup and draws the foul on D'Angelo O'Neal! And-1! Collin Barnes to the line for 1. [Team fouls: 2] (D'Angelo O'Neal: 1 personal fouls)   FT 1/1: MISS Collin Barnes makes 0/1 from the line. Rebound secured by Kevin Allen.
Score: 12-11

[07:48] Team_046 possession (Score: 12-11)
D'Angelo O'Neal attempts a 3Pt. Contested by Collin Barnes (4.2 feet, MAN). D'Angelo O'Neal misses. Rebound secured by Vince Quickley.

[07:39] Team_016 possession (Score: 12-11)
Vince Quickley attempts a 3Pt. Contested by Lauri Carter (2.8 feet, MAN). Vince Quickley misses. Rebound secured by Kevin Allen.

[07:20] Team_046 possession (Score: 12-11)
Cade Wall attempts a Midrange. Contested by Ben Barrett (4.3 feet, ZONE). Cade Wall misses. Rebound secured by Vince Quickley.

[07:04] Team_016 possession (Score: 12-11)
Vince Quickley attempts a 3Pt. Contested by Lauri Carter (2.8 feet, MAN). Vince Quickley misses. Rebound secured by Kevin Allen.

[06:45] Team_046 possession (Score: 12-11)
Cade Wall makes the Midrange and draws the foul on Ben Barrett! And-1! Cade Wall to the line for 1. [Team fouls: 3] (Ben Barrett: 1 personal fouls)   FT 1/1: GOOD Cade Wall makes 1/1 from the line.
Score: 12-14

[06:34] Team_016 possession (Score: 12-14)
FOUL! Shooting foul on Lauri Carter. Vince Quickley to the line for 3 free throws. [Team fouls: 3] (Lauri Carter: 2 personal fouls)   FT 1/3: GOOD   FT 2/3: GOOD   FT 3/3: GOOD Vince Quickley makes 3/3 from the line.
Score: 15-14

[06:15] Team_046 possession (Score: 15-14)
Kevin Allen attempts a Layup. Contested by Vince Duncan (3.5 feet, ZONE). Kevin Allen misses. Rebound secured by Vince Duncan.

[05:56] Team_016 possession (Score: 15-14)
Giannis Ginobili attempts a 3Pt. Contested by Victor Nowitzki (5.6 feet, MAN). Giannis Ginobili misses. Rebound secured by Lauri Carter.

[05:37] Team_046 possession (Score: 15-14)
D'Angelo O'Neal attempts a 3Pt. Contested by Collin Barnes (4.2 feet, MAN). D'Angelo O'Neal misses. Offensive rebound by Cade Wall! Cade Wall kicks it out.

[05:24] Team_046 possession (Score: 15-14)
D'Angelo O'Neal attempts a 3Pt. Contested by Collin Barnes (4.3 feet, MAN). D'Angelo O'Neal misses. Rebound secured by Vince Quickley.

[05:09] Team_016 possession (Score: 15-14)
Giannis Ginobili attempts a Layup. BLOCKED BY D'ANGELO O'NEAL! Ball deflects out of bounds off Giannis Ginobili.

[04:56] Team_046 possession (Score: 15-14)
D'Angelo O'Neal attempts a 3Pt. Contested by Collin Barnes (4.3 feet, MAN). D'ANGELO O'NEAL MAKES IT! Assist: Kevin Allen
Score: 15-17

[04:41] Team_016 possession (Score: 15-17)
Ben Barrett drives, picks up Kevin Allen. Help arrives from D'Angelo O'Neal! Ben Barrett attempts a Layup. Contested by D'Angelo O'Neal (5.3 feet, ZONE). BEN BARRETT MAKES IT! Assist: Giannis Ginobili
Score: 17-17

[04:23] Team_046 possession (Score: 17-17)
FOUL! Shooting foul on Vince Quickley. Lauri Carter to the line for 3 free throws. [Team fouls: 4] (Vince Quickley: 1 personal fouls)   FT 1/3: GOOD   FT 2/3: MISS   FT 3/3: MISS Lauri Carter makes 1/3 from the line. Rebound secured by Vince Duncan.
Score: 17-18

[04:03] Team_016 possession (Score: 17-18)
Vince Quickley drives and kicks out. Vince Quickley attempts a 3Pt. Contested by Lauri Carter (3.3 feet, MAN). Vince Quickley misses. Rebound secured by Kevin Allen.

[03:49] Team_046 possession (Score: 17-18)
D'Angelo O'Neal attempts a 3Pt. Contested by Collin Barnes (4.4 feet, ZONE). D'ANGELO O'NEAL MAKES IT! Assist: Kevin Allen
Score: 17-21

[03:34] Team_016 possession (Score: 17-21)
Vince Quickley attempts a Layup. BLOCKED BY D'ANGELO O'NEAL! Ball is loose! Offensive rebound by Vince Duncan! Vince Duncan kicks it out.

[03:19] Team_016 possession (Score: 17-21)
FOUL! Holding foul on Lauri Carter. [Team fouls: 4] No free throws, side out. (Lauri Carter: 3 personal fouls)

[03:04] Team_016 possession (Score: 17-21)
Ben Barrett attempts a Midrange. Contested by Cade Wall (4.5 feet, ZONE). Ben Barrett misses. Offensive rebound by Ben Barrett! Ben Barrett puts it back in!
Score: 19-21

[02:51] Team_046 possession (Score: 19-21)
Cade Wall drives and kicks out. Victor Nowitzki makes the Midrange and draws the foul on Giannis Ginobili! And-1! Victor Nowitzki to the line for 1. [BONUS: 5 team fouls] (Giannis Ginobili: 1 personal fouls)   FT 1/1: GOOD Victor Nowitzki makes 1/1 from the line.
Score: 19-24

[02:37] Team_016 possession (Score: 19-24)
Vince Duncan drives and kicks out. Collin Barnes attempts a Midrange. Contested by D'Angelo O'Neal (4.3 feet, MAN). Collin Barnes misses. Rebound secured by Cade Wall.

[02:26] Team_046 possession (Score: 19-24)
Lauri Carter drives, picks up Vince Duncan. Help arrives from Collin Barnes! Lauri Carter attempts a Layup. Contested by Collin Barnes (3.6 feet, ZONE). Lauri Carter misses. Rebound secured by Ben Barrett.

[02:11] Team_016 possession (Score: 19-24)
Giannis Ginobili drives and kicks out. Giannis Ginobili attempts a 3Pt. Contested by Victor Nowitzki (5.8 feet, MAN). GIANNIS GINOBILI MAKES IT! Assist: Collin Barnes
Score: 22-24

[01:57] Team_046 possession (Score: 22-24)
Victor Nowitzki attempts a 3Pt. Contested by Collin Barnes (4.5 feet, ZONE). Victor Nowitzki misses. Rebound secured by Ben Barrett.

[01:42] Team_016 possession (Score: 22-24)
Ben Barrett attempts a 3Pt. Contested by Cade Wall (4.7 feet, MAN). Ben Barrett misses. Rebound secured by Cade Wall.

[01:27] Team_046 possession (Score: 22-24)
Lauri Carter drives and kicks out. Cade Wall attempts a Midrange. Contested by Giannis Ginobili (5.9 feet, ZONE). Cade Wall misses. Rebound secured by Ben Barrett.

[01:17] Team_016 possession (Score: 22-24)
Giannis Ginobili attempts a Midrange. Contested by Victor Nowitzki (5.9 feet, MAN). GIANNIS GINOBILI MAKES IT!
Score: 24-24

[01:06] Team_046 possession (Score: 24-24)
Lauri Carter attempts a 3Pt. Contested by Vince Quickley (4.7 feet, MAN). Lauri Carter misses. Rebound secured by Vince Duncan.

[00:52] Team_016 possession (Score: 24-24)
Giannis Ginobili attempts a Layup. Contested by Victor Nowitzki (6.0 feet, MAN). Giannis Ginobili misses. Rebound secured by Lauri Carter.

[00:39] Team_046 possession (Score: 24-24)
D'Angelo O'Neal attempts a 3Pt. Contested by Collin Barnes (4.7 feet, MAN). D'ANGELO O'NEAL MAKES IT!
Score: 24-27

[00:27] Team_016 possession (Score: 24-27)
FOUL! Reach-in foul on Kevin Allen during the drive. [IN THE BONUS! 5 team fouls] Vince Duncan to the line for 2 free throws. (Kevin Allen: 1 personal fouls)   FT 1/2: GOOD   FT 2/2: GOOD Vince Duncan makes 2/2 from the line.
Score: 26-27

[00:13] Team_046 possession (Score: 26-27)
FOUL! Reach-in foul on Vince Duncan during the drive. [IN THE BONUS! 6 team fouls] Cade Wall to the line for 2 free throws. (Vince Duncan: 2 personal fouls)   FT 1/2: GOOD   FT 2/2: GOOD Cade Wall makes 2/2 from the line.
Score: 26-29

================================================================================
                              1ST QUARTER COMPLETE                              
================================================================================

1ST QUARTER SCORE: Team_016 26, Team_046 29

BOX SCORE:
================================================================================

Team_016
--------------------------------------------------------------------------------
Player                MIN  PTS  REB  AST  TO      FG   FG%      3P   3P%
--------------------------------------------------------------------------------
Collin Barnes          12    6    0    1   0   2/5    40.0     0/0   0.0
Ben Barrett            12    6    5    0   0   3/5    60.0     0/0   0.0
Giannis Ginobili       12    5    0    1   0   2/5    40.0     0/0   0.0
Vince Duncan           12    4    4    0   0   2/3    66.7     0/0   0.0
Vince Quickley         12    3    5    2   0   1/5    20.0     0/0   0.0

TEAM: FG: 10/23 (43.5%), 3PT: 2/9 (22.2%), REB: 14 (2 off, 12 def), AST: 4, TO: 0
TEAM FOULS: 6 [Team_046 in BONUS]


Team_046
--------------------------------------------------------------------------------
Player                MIN  PTS  REB  AST  TO      FG   FG%      3P   3P%
--------------------------------------------------------------------------------
Cade Wall              12   13    6    0   0   5/7    71.4     0/0   0.0
D'Angelo O'Neal        12    9    0    0   0   3/6    50.0     0/0   0.0
Kevin Allen            12    3    6    2   0   2/3    66.7     0/0   0.0
Victor Nowitzki        12    3    0    1   0   1/3    33.3     0/0   0.0
Lauri Carter           12    0    2    0   0   0/4     0.0     0/0   0.0

TEAM: FG: 11/23 (47.8%), 3PT: 5/13 (38.5%), REB: 14 (2 off, 12 def), AST: 3, TO: 0
TEAM FOULS: 5 [Team_016 in BONUS]

================================================================================

================================================================================
                       2ND QUARTER - Team_016 vs Team_046                       
================================================================================

[12:00] Team_016 possession (Score: 26-29)
Ben Barrett drives to the basket... Ben Barrett loses the ball! Stripped by Cade Wall! TURNOVER! (live ball)

[11:48] Team_046 possession (Score: 26-29)
Victor Nowitzki attempts a Midrange. Contested by Vince Quickley (4.5 feet, ZONE). Victor Nowitzki misses. Rebound secured by Ben Barrett.

[11:35] Team_016 possession (Score: 26-29)
Giannis Ginobili attempts a 3Pt. Contested by Victor Nowitzki (5.9 feet, MAN). Giannis Ginobili misses. Rebound secured by Cade Wall.

[11:22] Team_046 possession (Score: 26-29)
Victor Nowitzki drives to the basket... Victor Nowitzki loses the ball! Stripped by Vince Duncan! TURNOVER! (live ball)

[11:09] Team_016 possession (Score: 26-29)
Vince Quickley attempts a 3Pt. Contested by Lauri Carter (3.2 feet, MAN). Vince Quickley misses. Offensive rebound by Ben Barrett! Ben Barrett puts it back in!
Score: 28-29

[10:54] Team_046 possession (Score: 28-29)
Kevin Allen drives and kicks out. Victor Nowitzki attempts a 3Pt. Contested by Giannis Ginobili (5.9 feet, MAN). Victor Nowitzki misses. Rebound secured by Ben Barrett.

[10:35] Team_016 possession (Score: 28-29)
Vince Quickley drives to the basket... Vince Quickley loses the ball! Stripped by Kevin Allen! TURNOVER! (live ball)

[10:23] Team_046 possession (Score: 28-29)
Kevin Allen attempts a Layup. BLOCKED BY VINCE DUNCAN! Ball deflects out of bounds off Kevin Allen.

[10:10] Team_016 possession (Score: 28-29)
Giannis Ginobili drives and kicks out. Ben Barrett attempts a 3Pt. Contested by Cade Wall (4.4 feet, MAN). Ben Barrett misses. Rebound secured by Kevin Allen.

[09:56] Team_046 possession (Score: 28-29)
Lauri Carter attempts a Midrange. Contested by Vince Quickley (4.8 feet, MAN). LAURI CARTER MAKES IT! Assist: Kevin Allen
Score: 28-31

[09:45] Team_016 possession (Score: 28-31)
Vince Duncan attempts a Layup. Contested by Kevin Allen (5.6 feet, MAN). Vince Duncan misses. Offensive rebound by Ben Barrett! Ben Barrett's putback is no good. Rebound secured by Cade Wall.

[09:32] Team_046 possession (Score: 28-31)
Kevin Allen drives, picks up Vince Duncan. Help arrives from Giannis Ginobili! Kevin Allen attempts a Dunk. Contested by Giannis Ginobili (4.1 feet, MAN). KEVIN ALLEN MAKES IT! Assist: Cade Wall
Score: 28-33

[09:18] Team_016 possession (Score: 28-33)
Vince Quickley attempts a Midrange. Contested by Victor Nowitzki (5.6 feet, ZONE). Vince Quickley misses. Rebound secured by Kevin Allen.

[09:02] Team_046 possession (Score: 28-33)
Lauri Carter drives to the basket... FOUL! Offensive foul on Lauri Carter! Vince Duncan drew the charge! [Team fouls: 1] (Lauri Carter: 1 personal fouls) TURNOVER! (dead ball)

[08:48] Team_016 possession (Score: 28-33)
Vince Duncan drives and kicks out. Collin Barnes attempts a Midrange. Contested by D'Angelo O'Neal (4.9 feet, MAN). COLLIN BARNES MAKES IT! Assist: Vince Quickley
Score: 30-33

[08:38] Team_046 possession (Score: 30-33)
FOUL! Reach-in foul on Vince Quickley during the drive. [Team fouls: 1] No free throws, side out. (Vince Quickley: 1 personal fouls)

[08:23] Team_046 possession (Score: 30-33)
Lauri Carter attempts a 3Pt. Contested by Vince Quickley (5.0 feet, MAN). LAURI CARTER MAKES IT! Assist: Kevin Allen
Score: 30-36

[08:09] Team_016 possession (Score: 30-36)
Giannis Ginobili attempts a 3Pt. Wide open! Victor Nowitzki is 6.3 feet away. [MAN] GIANNIS GINOBILI MAKES IT! Assist: Collin Barnes
Score: 33-36

[07:55] Team_046 possession (Score: 33-36)
Lauri Carter attempts a Midrange. Wide open! Giannis Ginobili is 6.3 feet away. [ZONE] Lauri Carter misses. Rebound secured by Vince Duncan.

[07:39] Team_016 possession (Score: 33-36)
FOUL! Reach-in foul on Kevin Allen during the drive. [Team fouls: 2] No free throws, side out. (Kevin Allen: 1 personal fouls)

[07:26] Team_016 possession (Score: 33-36)
FOUL! Holding foul on Kevin Allen. [Team fouls: 3] No free throws, side out. (Kevin Allen: 2 personal fouls)

[07:12] Team_016 possession (Score: 33-36)
Ben Barrett drives and kicks out. Giannis Ginobili attempts a 3Pt. Wide open! Victor Nowitzki is 6.4 feet away. [MAN] GIANNIS GINOBILI MAKES IT!
Score: 36-36

[06:55] Team_046 possession (Score: 36-36)
Cade Wall attempts a Midrange. Contested by Collin Barnes (5.6 feet, ZONE). Cade Wall misses. FOUL! Loose ball foul on Ben Barrett during the rebound battle. [Team fouls: 2] No free throws, side out. (Ben Barrett: 1 personal fouls)

[06:39] Team_046 possession (Score: 36-36)
Kevin Allen attempts a 3Pt. Contested by Collin Barnes (5.3 feet, ZONE). KEVIN ALLEN MAKES IT! Assist: Victor Nowitzki
Score: 36-39

[06:24] Team_016 possession (Score: 36-39)
Collin Barnes attempts a Midrange. Wide open! Victor Nowitzki is 6.4 feet away. [ZONE] Collin Barnes misses. Rebound secured by Lauri Carter.

[06:07] Team_046 possession (Score: 36-39)
FOUL! Holding foul on Vince Duncan. [Team fouls: 3] No free throws, side out. (Vince Duncan: 1 personal fouls)

[05:50] Team_046 possession (Score: 36-39)
Victor Nowitzki attempts a 3Pt. Wide open! Giannis Ginobili is 6.4 feet away. [MAN] Victor Nowitzki misses. Rebound secured by Vince Duncan.

[05:32] Team_016 possession (Score: 36-39)
Vince Duncan drives to the basket... Vince Duncan throws a bad pass out of bounds! TURNOVER! (dead ball)

[05:32] Substitution (Team_016): Collin Barnes OUT → Lamelo Herro IN (stamina_rule2)

[05:32] Substitution (Team_016): Giannis Ginobili OUT → Immanuel Nowitzki IN (stamina_rule2)

[05:32] Substitution (Team_016): Vince Quickley OUT → Kevin Butler IN (stamina_rule2)

[05:32] Substitution (Team_016): Ben Barrett OUT → Giannis Doncic IN (stamina_rule2)

[05:32] Substitution (Team_016): Vince Duncan OUT → Trae Barnes IN (stamina_rule2)

[05:32] Substitution (Team_046): D'Angelo O'Neal OUT → Collin Butler IN (stamina_rule2)

[05:32] Substitution (Team_046): Victor Nowitzki OUT → Manu Dosunmu IN (stamina_rule2)

[05:32] Substitution (Team_046): Lauri Carter OUT → Josh Barrett IN (stamina_rule2)

[05:32] Substitution (Team_046): Cade Wall OUT → Chris LaVine IN (stamina_rule2)

[05:32] Substitution (Team_046): Kevin Allen OUT → Paul DeRozan IN (stamina_rule2)

[05:20] Team_046 possession (Score: 36-39)
FOUL! Holding foul on Immanuel Nowitzki. [Team fouls: 4] No free throws, side out. (Immanuel Nowitzki: 1 personal fouls)

[05:04] Team_046 possession (Score: 36-39)
FOUL! Shooting foul on Giannis Doncic. Collin Butler to the line for 2 free throws. [BONUS: 5 team fouls] (Giannis Doncic: 1 personal fouls)   FT 1/2: GOOD   FT 2/2: GOOD Collin Butler makes 2/2 from the line.
Score: 36-41

[04:53] Team_016 possession (Score: 36-41)
FOUL! Shooting foul on Chris LaVine. Trae Barnes to the line for 2 free throws. [Team fouls: 4] (Chris LaVine: 1 personal fouls)   FT 1/2: MISS   FT 2/2: GOOD Trae Barnes makes 1/2 from the line.
Score: 37-41

[04:39] Team_046 possession (Score: 37-41)
Collin Butler drives to the basket... FOUL! Offensive foul on Collin Butler! Lamelo Herro drew the charge! [Team fouls: 5] (Collin Butler: 1 personal fouls) TURNOVER! (dead ball)

[04:26] Team_016 possession (Score: 37-41)
FOUL! Shooting foul on Chris LaVine. Trae Barnes to the line for 2 free throws. [BONUS: 6 team fouls] (Chris LaVine: 2 personal fouls)   FT 1/2: GOOD   FT 2/2: GOOD Trae Barnes makes 2/2 from the line.
Score: 39-41

[04:17] Team_046 possession (Score: 39-41)
FOUL! Reach-in foul on Giannis Doncic during the drive. [IN THE BONUS! 6 team fouls] Collin Butler to the line for 2 free throws. (Giannis Doncic: 2 personal fouls)   FT 1/2: GOOD   FT 2/2: GOOD Collin Butler makes 2/2 from the line.
Score: 39-43

[03:59] Team_016 possession (Score: 39-43)
Lamelo Herro attempts a Layup. Contested by Paul DeRozan (4.9 feet, ZONE). LAMELO HERRO MAKES IT!
Score: 41-43

[03:41] Team_046 possession (Score: 41-43)
Chris LaVine attempts a 3Pt. Contested by Lamelo Herro (4.3 feet, ZONE). Chris LaVine misses. Rebound secured by Lamelo Herro.

[03:24] Team_016 possession (Score: 41-43)
Lamelo Herro drives, Collin Butler stays with him. Lamelo Herro attempts a Layup. Contested by Collin Butler (3.8 feet, MAN). Lamelo Herro misses. Rebound secured by Paul DeRozan.

[03:11] Team_046 possession (Score: 41-43)
Collin Butler attempts a 3Pt. Contested by Lamelo Herro (4.1 feet, MAN). COLLIN BUTLER MAKES IT! Assist: Josh Barrett
Score: 41-46

[03:00] Team_016 possession (Score: 41-46)
Trae Barnes drives, Chris LaVine stays with him. Trae Barnes attempts a Layup. Contested by Chris LaVine (3.7 feet, ZONE). TRAE BARNES MAKES IT! Assist: Lamelo Herro
Score: 43-46

[02:44] Team_046 possession (Score: 43-46)
Chris LaVine drives to the basket... FOUL! Offensive foul on Chris LaVine! Giannis Doncic drew the charge! [Team fouls: 7] (Chris LaVine: 3 personal fouls) TURNOVER! (dead ball)

[02:26] Team_016 possession (Score: 43-46)
Kevin Butler attempts a 3Pt. Contested by Josh Barrett (4.6 feet, MAN). Kevin Butler misses. Offensive rebound by Trae Barnes! Trae Barnes kicks it out.

[02:12] Team_016 possession (Score: 43-46)
Kevin Butler attempts a 3Pt. Contested by Josh Barrett (4.6 feet, MAN). Kevin Butler misses. Rebound secured by Paul DeRozan.

[01:53] Team_046 possession (Score: 43-46)
Josh Barrett attempts a Layup. Contested by Kevin Butler (4.5 feet, MAN). Josh Barrett misses. Rebound secured by Trae Barnes.

[01:37] Team_016 possession (Score: 43-46)
FOUL! Shooting foul on Collin Butler. Lamelo Herro to the line for 3 free throws. [BONUS: 8 team fouls] (Collin Butler: 2 personal fouls)   FT 1/3: GOOD   FT 2/3: MISS   FT 3/3: GOOD Lamelo Herro makes 2/3 from the line.
Score: 45-46

[01:27] Team_046 possession (Score: 45-46)
Josh Barrett attempts a Midrange. Contested by Kevin Butler (4.5 feet, ZONE). JOSH BARRETT MAKES IT!
Score: 45-48

[01:15] Team_016 possession (Score: 45-48)
Trae Barnes attempts a Midrange. Contested by Manu Dosunmu (4.6 feet, ZONE). TRAE BARNES MAKES IT!
Score: 47-48

[01:00] Team_046 possession (Score: 47-48)
FOUL! Shooting foul on Giannis Doncic. Manu Dosunmu to the line for 2 free throws. [BONUS: 7 team fouls] (Giannis Doncic: 3 personal fouls)   FT 1/2: GOOD   FT 2/2: GOOD Manu Dosunmu makes 2/2 from the line.
Score: 47-50

[00:45] Team_016 possession (Score: 47-50)
Giannis Doncic throws a bad pass out of bounds! TURNOVER! (dead ball)

[00:30] Team_046 possession (Score: 47-50)
Paul DeRozan drives to the basket... Paul DeRozan loses control! Ball rolls out of bounds! TURNOVER! (dead ball)

[00:19] Team_016 possession (Score: 47-50)
Immanuel Nowitzki attempts a 3Pt. Contested by Manu Dosunmu (4.8 feet, MAN). Immanuel Nowitzki misses. Rebound secured by Manu Dosunmu.

[00:04] Team_046 possession (Score: 47-50)
FOUL! Shooting foul on Lamelo Herro. Collin Butler to the line for 3 free throws. [BONUS: 8 team fouls] (Lamelo Herro: 1 personal fouls)   FT 1/3: GOOD   FT 2/3: GOOD   FT 3/3: GOOD Collin Butler makes 3/3 from the line.
Score: 47-53

================================================================================
                              2ND QUARTER COMPLETE                              
================================================================================

2ND QUARTER SCORE: Team_016 21, Team_046 24

BOX SCORE:
================================================================================

Team_016
--------------------------------------------------------------------------------
Player                MIN  PTS  REB  AST  TO      FG   FG%      3P   3P%
--------------------------------------------------------------------------------
Trae Barnes             6    7    2    0   0   4/4   100.0     0/0   0.0
Giannis Ginobili       19    6    0    0   0   2/4    50.0     0/0   0.0
Lamelo Herro            6    4    1    1   0   2/3    66.7     0/0   0.0
Ben Barrett            19    2    3    0   0   1/1   100.0     0/0   0.0
Collin Barnes          19    2    0    1   0   1/2    50.0     0/0   0.0
Vince Duncan           19    0    2    0   0   0/1     0.0     0/0   0.0
Vince Quickley         19    0    0    1   0   0/1     0.0     0/0   0.0
Kevin Butler            6    0    0    0   0   0/1     0.0     0/0   0.0
Immanuel Nowitzki       6    0    0    0   0   0/1     0.0     0/0   0.0

TEAM: FG: 10/18 (55.6%), 3PT: 3/6 (50.0%), REB: 9 (3 off, 6 def), AST: 3, TO: 4
TEAM FOULS: 8 [Team_046 in BONUS]


Team_046
--------------------------------------------------------------------------------
Player                MIN  PTS  REB  AST  TO      FG   FG%      3P   3P%
--------------------------------------------------------------------------------
Collin Butler           6   10    0    0   0   4/4   100.0     0/0   0.0
Kevin Allen            19    5    2    2   0   2/4    50.0     0/0   0.0
Lauri Carter           19    5    1    0   0   2/3    66.7     0/0   0.0
Josh Barrett            6    2    0    1   0   1/2    50.0     0/0   0.0
Manu Dosunmu            6    2    1    0   0   1/1   100.0     0/0   0.0
Victor Nowitzki        19    0    0    1   0   0/2     0.0     0/0   0.0
Cade Wall              19    0    3    1   0   0/0     0.0     0/0   0.0
Chris LaVine            6    0    0    0   0   0/1     0.0     0/0   0.0
Paul DeRozan            6    0    2    0   0   0/0     0.0     0/0   0.0

TEAM: FG: 10/17 (58.8%), 3PT: 4/6 (66.7%), REB: 8 (1 off, 7 def), AST: 5, TO: 5
TEAM FOULS: 8 [Team_016 in BONUS]

================================================================================

================================================================================
                       3RD QUARTER - Team_016 vs Team_046                       
================================================================================

[12:00] Team_016 possession (Score: 47-53)
Vince Quickley drives and kicks out. Collin Barnes attempts a 3Pt. Contested by D'Angelo O'Neal (4.0 feet, MAN). COLLIN BARNES MAKES IT! Assist: Vince Quickley
Score: 50-53

[11:47] Team_046 possession (Score: 50-53)
Victor Nowitzki drives to the basket... Victor Nowitzki loses the ball! Stripped by Giannis Ginobili! TURNOVER! (live ball)

[11:28] Team_016 possession (Score: 50-53)
Ben Barrett makes the Layup and draws the foul on Kevin Allen! And-1! Ben Barrett to the line for 1. [Team fouls: 1] (Kevin Allen: 1 personal fouls)   FT 1/1: GOOD Ben Barrett makes 1/1 from the line.
Score: 53-53

[11:13] Team_046 possession (Score: 53-53)
FOUL! Reach-in foul on Ben Barrett during the drive. [Team fouls: 1] No free throws, side out. (Ben Barrett: 1 personal fouls)

[11:02] Team_046 possession (Score: 53-53)
Cade Wall drives, picks up Ben Barrett. Help arrives from Collin Barnes! Cade Wall attempts a Dunk. Contested by Collin Barnes (4.3 feet, MAN). CADE WALL MAKES IT!
Score: 53-55

[10:44] Team_016 possession (Score: 53-55)
Vince Quickley attempts a 3Pt. Contested by Lauri Carter (2.8 feet, ZONE). Vince Quickley misses. Offensive rebound by Vince Duncan! Vince Duncan puts it back in!
Score: 55-55

[10:35] Team_046 possession (Score: 55-55)
Victor Nowitzki attempts a 3Pt. Contested by Collin Barnes (4.1 feet, ZONE). Victor Nowitzki misses. Rebound secured by Vince Quickley.

[10:25] Team_016 possession (Score: 55-55)
Ben Barrett attempts a 3Pt. Contested by Lauri Carter (3.8 feet, ZONE). Ben Barrett misses. Rebound secured by Kevin Allen.

[10:14] Team_046 possession (Score: 55-55)
Lauri Carter attempts a 3Pt. Contested by Vince Quickley (4.4 feet, MAN). Lauri Carter misses. Rebound secured by Ben Barrett.

[10:00] Team_016 possession (Score: 55-55)
Vince Duncan attempts a 3Pt. Contested by Cade Wall (4.1 feet, ZONE). Vince Duncan misses. Rebound secured by Kevin Allen.

[09:46] Team_046 possession (Score: 55-55)
Kevin Allen attempts a Layup. Contested by Vince Duncan (3.5 feet, ZONE). Kevin Allen misses. Rebound secured by Vince Duncan.

[09:34] Team_016 possession (Score: 55-55)
Vince Duncan drives, picks up Kevin Allen. Help arrives from D'Angelo O'Neal! Vince Duncan attempts a Dunk. Contested by D'Angelo O'Neal (5.0 feet, MAN). VINCE DUNCAN MAKES IT! Assist: Collin Barnes
Score: 57-55

[09:22] Team_046 possession (Score: 57-55)
Kevin Allen drives and kicks out. Kevin Allen attempts a Midrange. Contested by Vince Duncan (3.2 feet, ZONE). KEVIN ALLEN MAKES IT! Assist: D'Angelo O'Neal
Score: 57-57

[09:06] Team_016 possession (Score: 57-57)
FOUL! Holding foul on Lauri Carter. [Team fouls: 2] No free throws, side out. (Lauri Carter: 1 personal fouls)

[08:54] Team_016 possession (Score: 57-57)
Collin Barnes drives to the basket... Collin Barnes loses control! Ball rolls out of bounds! TURNOVER! (dead ball)

[08:44] Team_046 possession (Score: 57-57)
Kevin Allen makes the Dunk and draws the foul on Collin Barnes! And-1! Kevin Allen to the line for 1. [Team fouls: 2] (Collin Barnes: 1 personal fouls)   FT 1/1: GOOD Kevin Allen makes 1/1 from the line.
Score: 57-60

[08:34] Team_016 possession (Score: 57-60)
Vince Duncan makes the Layup and draws the foul on Kevin Allen! And-1! Vince Duncan to the line for 1. [Team fouls: 3] (Kevin Allen: 2 personal fouls)   FT 1/1: GOOD Vince Duncan makes 1/1 from the line.
Score: 60-60

[08:15] Team_046 possession (Score: 60-60)
Cade Wall attempts a Midrange. Contested by Ben Barrett (4.3 feet, MAN). Cade Wall misses. Rebound secured by Vince Duncan.

[08:02] Team_016 possession (Score: 60-60)
Collin Barnes attempts a Midrange. Contested by D'Angelo O'Neal (4.1 feet, MAN). COLLIN BARNES MAKES IT! Assist: Vince Quickley
Score: 62-60

[07:50] Team_046 possession (Score: 62-60)
D'Angelo O'Neal attempts a 3Pt. Contested by Collin Barnes (4.2 feet, MAN). D'Angelo O'Neal misses. Rebound secured by Vince Duncan.

[07:37] Team_016 possession (Score: 62-60)
Collin Barnes attempts a 3Pt. Contested by Lauri Carter (3.3 feet, ZONE). Collin Barnes misses. Rebound secured by Kevin Allen.

[07:25] Team_046 possession (Score: 62-60)
D'Angelo O'Neal drives and kicks out. D'Angelo O'Neal attempts a Midrange. Contested by Ben Barrett (3.6 feet, ZONE). D'Angelo O'Neal misses. Rebound secured by Vince Duncan.

[07:15] Team_016 possession (Score: 62-60)
FOUL! Reach-in foul on Victor Nowitzki during the drive. [Team fouls: 4] No free throws, side out. (Victor Nowitzki: 1 personal fouls)

[07:03] Team_016 possession (Score: 62-60)
Collin Barnes attempts a 3Pt. Contested by D'Angelo O'Neal (4.1 feet, MAN). COLLIN BARNES MAKES IT! Assist: Ben Barrett
Score: 65-60

[06:45] Team_046 possession (Score: 65-60)
Victor Nowitzki attempts a 3Pt. Contested by Collin Barnes (4.1 feet, ZONE). VICTOR NOWITZKI MAKES IT! Assist: Lauri Carter
Score: 65-63

[06:31] Team_016 possession (Score: 65-63)
Vince Quickley drives, Lauri Carter stays with him. Vince Quickley attempts a Layup. Contested by Lauri Carter (2.8 feet, MAN). VINCE QUICKLEY MAKES IT! Assist: Collin Barnes
Score: 67-63

[06:18] Team_046 possession (Score: 67-63)
Cade Wall attempts a Midrange. Contested by Ben Barrett (4.3 feet, MAN). Cade Wall misses. Offensive rebound by Kevin Allen! Kevin Allen kicks it out.

[06:02] Team_046 possession (Score: 67-63)
Cade Wall attempts a Layup. Contested by Vince Duncan (3.8 feet, ZONE). CADE WALL MAKES IT!
Score: 67-65

[05:48] Team_016 possession (Score: 67-65)
Vince Duncan drives to the basket... FOUL! Offensive foul on Vince Duncan! Kevin Allen drew the charge! [Team fouls: 3] (Vince Duncan: 1 personal fouls) TURNOVER! (dead ball)

[05:35] Team_046 possession (Score: 67-65)
D'Angelo O'Neal drives to the basket... FOUL! Offensive foul on D'Angelo O'Neal! Vince Duncan drew the charge! [Team fouls: 5] (D'Angelo O'Neal: 1 personal fouls) TURNOVER! (dead ball)

[05:20] Team_016 possession (Score: 67-65)
Collin Barnes drives, D'Angelo O'Neal stays with him. Collin Barnes attempts a Layup. Contested by D'Angelo O'Neal (4.1 feet, MAN). COLLIN BARNES MAKES IT!
Score: 69-65

[05:05] Team_046 possession (Score: 69-65)
Lauri Carter attempts a 3Pt. Contested by Giannis Ginobili (5.8 feet, ZONE). Lauri Carter misses. Rebound secured by Vince Duncan.

[04:51] Team_016 possession (Score: 69-65)
Collin Barnes drives and kicks out. Collin Barnes attempts a 3Pt. Contested by Lauri Carter (3.3 feet, ZONE). Collin Barnes misses. Rebound secured by Cade Wall.

[04:39] Team_046 possession (Score: 69-65)
Cade Wall throws a bad pass! Stolen by Ben Barrett! TURNOVER! (live ball)

[04:20] Team_016 possession (Score: 69-65)
FOUL! Offensive foul on Giannis Ginobili! Victor Nowitzki drew the charge! [Team fouls: 4] (Giannis Ginobili: 1 personal fouls) TURNOVER! (dead ball)

[04:07] Team_046 possession (Score: 69-65)
FOUL! Shooting foul on Vince Quickley. Lauri Carter to the line for 2 free throws. [BONUS: 5 team fouls] (Vince Quickley: 1 personal fouls)   FT 1/2: GOOD   FT 2/2: GOOD Lauri Carter makes 2/2 from the line.
Score: 69-67

[03:48] Team_016 possession (Score: 69-67)
Collin Barnes attempts a Midrange. Contested by D'Angelo O'Neal (4.3 feet, MAN). COLLIN BARNES MAKES IT!
Score: 71-67

[03:33] Team_046 possession (Score: 71-67)
FOUL! Reach-in foul on Vince Duncan during the drive. [IN THE BONUS! 6 team fouls] Kevin Allen to the line for 2 free throws. (Vince Duncan: 2 personal fouls)   FT 1/2: MISS   FT 2/2: GOOD Kevin Allen makes 1/2 from the line.
Score: 71-68

[03:18] Team_016 possession (Score: 71-68)
Collin Barnes attempts a 3Pt. Contested by Cade Wall (4.0 feet, ZONE). COLLIN BARNES MAKES IT!
Score: 74-68

[03:07] Team_046 possession (Score: 74-68)
FOUL! Reach-in foul on Vince Duncan during the drive. [IN THE BONUS! 7 team fouls] Victor Nowitzki to the line for 2 free throws. (Vince Duncan: 3 personal fouls)   FT 1/2: GOOD   FT 2/2: GOOD Victor Nowitzki makes 2/2 from the line.
Score: 74-70

[02:49] Team_016 possession (Score: 74-70)
Collin Barnes attempts a 3Pt. Contested by Lauri Carter (3.5 feet, ZONE). COLLIN BARNES MAKES IT! Assist: Ben Barrett
Score: 77-70

[02:38] Team_046 possession (Score: 77-70)
Kevin Allen drives to the basket... Kevin Allen throws a bad pass out of bounds! TURNOVER! (dead ball)

[02:38] Substitution (Team_016): Collin Barnes OUT → Lamelo Herro IN (stamina_rule2)

[02:38] Substitution (Team_016): Ben Barrett OUT → Giannis Doncic IN (stamina_rule2)

[02:38] Substitution (Team_016): Vince Duncan OUT → Trae Barnes IN (stamina_rule2)

[02:38] Substitution (Team_046): D'Angelo O'Neal OUT → Collin Butler IN (stamina_rule2)

[02:38] Substitution (Team_046): Victor Nowitzki OUT → Manu Dosunmu IN (stamina_rule2)

[02:38] Substitution (Team_046): Lauri Carter OUT → Josh Barrett IN (stamina_rule2)

[02:38] Substitution (Team_046): Cade Wall OUT → Chris LaVine IN (stamina_rule2)

[02:38] Substitution (Team_046): Kevin Allen OUT → Paul DeRozan IN (stamina_rule2)

[02:22] Team_016 possession (Score: 77-70)
Lamelo Herro attempts a 3Pt. Contested by Collin Butler (3.8 feet, ZONE). Lamelo Herro misses. Rebound secured by Chris LaVine.

[02:07] Team_046 possession (Score: 77-70)
Chris LaVine drives and kicks out. Paul DeRozan attempts a 3Pt. Contested by Lamelo Herro (3.8 feet, ZONE). Paul DeRozan misses. FOUL! Loose ball foul on Giannis Doncic during the rebound battle. [IN THE BONUS! 8 team fouls] Chris LaVine to the line for 2 free throws. (Giannis Doncic: 1 personal fouls)   FT 1/2: GOOD   FT 2/2: GOOD Chris LaVine makes 2/2 from the line.
Score: 77-72

[01:56] Team_016 possession (Score: 77-72)
Giannis Doncic attempts a Midrange. BLOCKED BY MANU DOSUNMU! Ball is loose! Rebound secured by Paul DeRozan.

[01:40] Team_046 possession (Score: 77-72)
FOUL! Holding foul on Trae Barnes. [IN THE BONUS! 9 team fouls] Paul DeRozan to the line for 2 free throws. (Trae Barnes: 1 personal fouls)   FT 1/2: GOOD   FT 2/2: MISS Paul DeRozan makes 1/2 from the line. Rebound secured by Giannis Doncic.
Score: 77-73

[01:29] Team_016 possession (Score: 77-73)
Giannis Ginobili drives to the basket... Giannis Ginobili commits a violation (traveling/carry)! TURNOVER! (dead ball)

[01:29] Substitution (Team_016): Giannis Ginobili OUT → Immanuel Nowitzki IN (stamina_rule2)

[01:29] Substitution (Team_016): Vince Quickley OUT → Kevin Butler IN (stamina_rule2)

[01:14] Team_046 possession (Score: 77-73)
Paul DeRozan drives and kicks out. Manu Dosunmu attempts a 3Pt. Contested by Immanuel Nowitzki (4.6 feet, MAN). MANU DOSUNMU MAKES IT! Assist: Collin Butler
Score: 77-76

[01:01] Team_016 possession (Score: 77-76)
Immanuel Nowitzki attempts a Midrange. Contested by Chris LaVine (4.0 feet, ZONE). Immanuel Nowitzki misses. Rebound secured by Paul DeRozan.

[00:48] Team_046 possession (Score: 77-76)
Collin Butler attempts a 3Pt. Contested by Lamelo Herro (4.1 feet, MAN). Collin Butler misses. Offensive rebound by Paul DeRozan! Paul DeRozan puts it back in!
Score: 77-78

[00:31] Team_016 possession (Score: 77-78)
Lamelo Herro attempts a 3Pt. Contested by Manu Dosunmu (4.7 feet, ZONE). Lamelo Herro misses. Rebound secured by Manu Dosunmu.

[00:21] Team_046 possession (Score: 77-78)
Collin Butler drives and kicks out. Paul DeRozan attempts a 3Pt. Contested by Immanuel Nowitzki (4.6 feet, ZONE). PAUL DEROZAN MAKES IT! Assist: Collin Butler
Score: 77-81

[00:06] Team_016 possession (Score: 77-81)
Kevin Butler drives, picks up Chris LaVine. Help arrives from Manu Dosunmu! Kevin Butler attempts a Layup. Contested by Manu Dosunmu (3.6 feet, ZONE). Kevin Butler misses. Rebound secured by Manu Dosunmu.

================================================================================
                              3RD QUARTER COMPLETE                              
================================================================================

3RD QUARTER SCORE: Team_016 30, Team_046 28

BOX SCORE:
================================================================================

Team_016
--------------------------------------------------------------------------------
Player                MIN  PTS  REB  AST  TO      FG   FG%      3P   3P%
--------------------------------------------------------------------------------
Collin Barnes          28   18    0    2   0   7/9    77.8     0/0   0.0
Vince Duncan           28    7    6    0   0   3/4    75.0     0/0   0.0
Ben Barrett            28    3    1    2   0   1/2    50.0     0/0   0.0
Vince Quickley         29    2    1    2   0   1/1   100.0     0/0   0.0
Lamelo Herro            8    0    0    0   0   0/2     0.0     0/0   0.0
Giannis Doncic          8    0    1    0   0   0/1     0.0     0/0   0.0
Immanuel Nowitzki       7    0    0    0   0   0/1     0.0     0/0   0.0
Kevin Butler            7    0    0    0   0   0/1     0.0     0/0   0.0

TEAM: FG: 12/21 (57.1%), 3PT: 4/9 (44.4%), REB: 9 (1 off, 8 def), AST: 6, TO: 4
TEAM FOULS: 9 [Team_046 in BONUS]


Team_046
--------------------------------------------------------------------------------
Player                MIN  PTS  REB  AST  TO      FG   FG%      3P   3P%
--------------------------------------------------------------------------------
Kevin Allen            28    6    4    0   0   3/4    75.0     0/0   0.0
Victor Nowitzki        28    5    0    0   0   2/3    66.7     0/0   0.0
Paul DeRozan            8    5    3    0   0   2/2   100.0     0/0   0.0
Cade Wall              28    4    1    0   0   2/3    66.7     0/0   0.0
Manu Dosunmu            8    3    2    0   0   1/1   100.0     0/0   0.0
Lauri Carter           28    2    0    1   0   1/3    33.3     0/0   0.0
Chris LaVine            8    2    1    0   0   1/1   100.0     0/0   0.0
D'Angelo O'Neal        28    0    0    1   0   0/2     0.0     0/0   0.0
Collin Butler           8    0    0    2   0   0/0     0.0     0/0   0.0

TEAM: FG: 12/20 (60.0%), 3PT: 2/6 (33.3%), REB: 11 (2 off, 9 def), AST: 4, TO: 4
TEAM FOULS: 5 [Team_016 in BONUS]

================================================================================

================================================================================
                       4TH QUARTER - Team_016 vs Team_046                       
================================================================================

[12:00] Team_016 possession (Score: 77-81)
Vince Duncan makes the Layup and draws the foul on D'Angelo O'Neal! And-1! Vince Duncan to the line for 1. [Team fouls: 1] (D'Angelo O'Neal: 1 personal fouls)   FT 1/1: GOOD Vince Duncan makes 1/1 from the line.
Score: 80-81

[11:45] Team_046 possession (Score: 80-81)
D'Angelo O'Neal attempts a Midrange. Contested by Collin Barnes (4.3 feet, MAN). D'Angelo O'Neal misses. Rebound secured by Ben Barrett.

[11:29] Team_016 possession (Score: 80-81)
Collin Barnes attempts a 3Pt. Contested by Lauri Carter (3.3 feet, ZONE). Collin Barnes misses. Rebound secured by Cade Wall.

[11:17] Team_046 possession (Score: 80-81)
Lauri Carter drives and kicks out. Victor Nowitzki attempts a 3Pt. Contested by Collin Barnes (4.1 feet, ZONE). Victor Nowitzki misses. Rebound secured by Vince Duncan.

[11:04] Team_016 possession (Score: 80-81)
FOUL! Holding foul on D'Angelo O'Neal. [Team fouls: 2] No free throws, side out. (D'Angelo O'Neal: 2 personal fouls)

[10:52] Team_016 possession (Score: 80-81)
Vince Duncan attempts a 3Pt. Contested by Lauri Carter (3.7 feet, ZONE). Vince Duncan misses. Rebound secured by Lauri Carter.

[10:40] Team_046 possession (Score: 80-81)
D'Angelo O'Neal attempts a Layup. Contested by Collin Barnes (4.4 feet, MAN). D'ANGELO O'NEAL MAKES IT!
Score: 80-83

[10:24] Team_016 possession (Score: 80-83)
Giannis Ginobili attempts a 3Pt. Contested by Victor Nowitzki (5.7 feet, MAN). GIANNIS GINOBILI MAKES IT! Assist: Collin Barnes
Score: 83-83

[10:10] Team_046 possession (Score: 83-83)
D'Angelo O'Neal attempts a Midrange. Contested by Collin Barnes (4.4 feet, MAN). D'Angelo O'Neal misses. Offensive rebound by Lauri Carter! Lauri Carter kicks it out.

[09:59] Team_046 possession (Score: 83-83)
D'Angelo O'Neal attempts a Midrange. Contested by Collin Barnes (4.5 feet, MAN). D'ANGELO O'NEAL MAKES IT! Assist: Lauri Carter
Score: 83-85

[09:50] Team_016 possession (Score: 83-85)
Vince Duncan drives and kicks out. Ben Barrett attempts a 3Pt. Contested by Cade Wall (4.1 feet, MAN). Ben Barrett misses. Rebound secured by Cade Wall.

[09:37] Team_046 possession (Score: 83-85)
Victor Nowitzki attempts a 3Pt. Contested by Giannis Ginobili (6.0 feet, MAN). Victor Nowitzki misses. Rebound secured by Vince Duncan.

[09:27] Team_016 possession (Score: 83-85)
Vince Duncan attempts a Layup. Contested by Kevin Allen (5.3 feet, ZONE). VINCE DUNCAN MAKES IT! Assist: Vince Quickley
Score: 85-85

[09:15] Team_046 possession (Score: 85-85)
Kevin Allen drives and kicks out. Victor Nowitzki attempts a 3Pt. Contested by Collin Barnes (4.4 feet, ZONE). VICTOR NOWITZKI MAKES IT! Assist: Cade Wall
Score: 85-88

[09:00] Team_016 possession (Score: 85-88)
Giannis Ginobili attempts a 3Pt. Contested by Lauri Carter (3.6 feet, ZONE). Giannis Ginobili misses. Rebound secured by Cade Wall.

[08:46] Team_046 possession (Score: 85-88)
FOUL! Holding foul on Giannis Ginobili. [Team fouls: 1] No free throws, side out. (Giannis Ginobili: 1 personal fouls)

[08:29] Team_046 possession (Score: 85-88)
Lauri Carter makes the Layup and draws the foul on Vince Duncan! And-1! Lauri Carter to the line for 1. [Team fouls: 2] (Vince Duncan: 1 personal fouls)   FT 1/1: GOOD Lauri Carter makes 1/1 from the line.
Score: 85-91

[08:13] Team_016 possession (Score: 85-91)
Vince Duncan drives and kicks out. Giannis Ginobili attempts a 3Pt. Contested by Victor Nowitzki (5.9 feet, MAN). Giannis Ginobili misses. Rebound secured by Lauri Carter.

[08:00] Team_046 possession (Score: 85-91)
FOUL! Holding foul on Vince Duncan. [Team fouls: 3] No free throws, side out. (Vince Duncan: 2 personal fouls)

[07:46] Team_046 possession (Score: 85-91)
Victor Nowitzki makes the Midrange and draws the foul on Ben Barrett! And-1! Victor Nowitzki to the line for 1. [Team fouls: 4] (Ben Barrett: 1 personal fouls)   FT 1/1: GOOD Victor Nowitzki makes 1/1 from the line.
Score: 85-94

[07:36] Team_016 possession (Score: 85-94)
Vince Quickley attempts a 3Pt. Contested by Lauri Carter (3.3 feet, MAN). Vince Quickley misses. Rebound secured by Kevin Allen.

[07:22] Team_046 possession (Score: 85-94)
D'Angelo O'Neal attempts a Midrange. Contested by Ben Barrett (4.4 feet, ZONE). D'ANGELO O'NEAL MAKES IT! Assist: Kevin Allen
Score: 85-96

[07:08] Team_016 possession (Score: 85-96)
FOUL! Reach-in foul on Victor Nowitzki during the drive. [Team fouls: 3] No free throws, side out. (Victor Nowitzki: 1 personal fouls)

[06:55] Team_016 possession (Score: 85-96)
Collin Barnes attempts a 3Pt. Contested by Lauri Carter (3.9 feet, ZONE). Collin Barnes misses. Rebound secured by Cade Wall.

[06:41] Team_046 possession (Score: 85-96)
FOUL! Offensive foul on Cade Wall! Ben Barrett drew the charge! [Team fouls: 4] (Cade Wall: 1 personal fouls) TURNOVER! (dead ball)

[06:26] Team_016 possession (Score: 85-96)
Vince Quickley attempts a Midrange. Contested by Lauri Carter (3.5 feet, MAN). Vince Quickley misses. Offensive rebound by Vince Duncan! Vince Duncan kicks it out.

[06:13] Team_016 possession (Score: 85-96)
Collin Barnes attempts a 3Pt. Contested by D'Angelo O'Neal (4.8 feet, MAN). Collin Barnes misses. Rebound secured by Cade Wall.

[06:01] Team_046 possession (Score: 85-96)
FOUL! Holding foul on Ben Barrett. [IN THE BONUS! 5 team fouls] Cade Wall to the line for 2 free throws. (Ben Barrett: 2 personal fouls)   FT 1/2: GOOD   FT 2/2: MISS Cade Wall makes 1/2 from the line. Rebound secured by Ben Barrett.
Score: 85-97

[05:47] Team_016 possession (Score: 85-97)
Collin Barnes attempts a 3Pt. Contested by Lauri Carter (4.0 feet, ZONE). Collin Barnes misses. Rebound secured by Kevin Allen.

[05:31] Team_046 possession (Score: 85-97)
Cade Wall attempts a Layup. BLOCKED BY COLLIN BARNES! Ball is loose! Rebound secured by Vince Duncan.

[05:12] Team_016 possession (Score: 85-97)
Collin Barnes attempts a 3Pt. Contested by Lauri Carter (4.1 feet, ZONE). Collin Barnes misses. Rebound secured by Lauri Carter.

[04:57] Team_046 possession (Score: 85-97)
Victor Nowitzki attempts a 3Pt. Contested by Collin Barnes (5.1 feet, ZONE). Victor Nowitzki misses. Rebound secured by Vince Duncan.

[04:42] Team_016 possession (Score: 85-97)
Collin Barnes attempts a 3Pt. Contested by D'Angelo O'Neal (5.0 feet, MAN). Collin Barnes misses. Offensive rebound by Vince Duncan! Vince Duncan kicks it out.

[04:30] Team_016 possession (Score: 85-97)
Vince Quickley attempts a Layup. Contested by Lauri Carter (3.8 feet, MAN). Vince Quickley misses. Rebound secured by Lauri Carter.

[04:18] Team_046 possession (Score: 85-97)
Kevin Allen attempts a Layup. Contested by Vince Duncan (4.5 feet, ZONE). KEVIN ALLEN MAKES IT! Assist: Lauri Carter
Score: 85-99

[04:06] Team_016 possession (Score: 85-99)
Giannis Ginobili attempts a 3Pt. Contested by Lauri Carter (4.3 feet, ZONE). Giannis Ginobili misses. Rebound secured by Kevin Allen.

[03:56] Team_046 possession (Score: 85-99)
Cade Wall attempts a Midrange. Contested by Ben Barrett (5.2 feet, MAN). CADE WALL MAKES IT! Assist: D'Angelo O'Neal
Score: 85-101

[03:37] Team_016 possession (Score: 85-101)
Vince Duncan attempts a Layup. Wide open! Kevin Allen is 6.1 feet away. [MAN] VINCE DUNCAN MAKES IT!
Score: 87-101

[03:26] Team_046 possession (Score: 87-101)
Kevin Allen makes the Layup and draws the foul on Vince Duncan! And-1! Kevin Allen to the line for 1. [BONUS: 6 team fouls] (Vince Duncan: 3 personal fouls)   FT 1/1: GOOD Kevin Allen makes 1/1 from the line.
Score: 87-104

[03:10] Team_016 possession (Score: 87-104)
Ben Barrett drives, picks up Kevin Allen. Help arrives from D'Angelo O'Neal! Ben Barrett attempts a Dunk. Wide open! D'Angelo O'Neal is 6.3 feet away. [ZONE] Ben Barrett misses. Rebound secured by Kevin Allen.

[02:55] Team_046 possession (Score: 87-104)
FOUL! Reach-in foul on Ben Barrett during the drive. [IN THE BONUS! 7 team fouls] Cade Wall to the line for 2 free throws. (Ben Barrett: 3 personal fouls)   FT 1/2: MISS   FT 2/2: GOOD Cade Wall makes 1/2 from the line.
Score: 87-105

[02:38] Team_016 possession (Score: 87-105)
Vince Quickley attempts a 3Pt. Contested by Lauri Carter (4.1 feet, ZONE). Vince Quickley misses. Rebound secured by Kevin Allen.

[02:20] Team_046 possession (Score: 87-105)
Victor Nowitzki drives and kicks out. Cade Wall attempts a Midrange. Contested by Vince Quickley (5.5 feet, ZONE). Cade Wall misses. Rebound secured by Vince Quickley.

[02:04] Team_016 possession (Score: 87-105)
Vince Duncan attempts a Layup. Wide open! Kevin Allen is 6.3 feet away. [ZONE] VINCE DUNCAN MAKES IT!
Score: 89-105

[01:52] Team_046 possession (Score: 89-105)
D'Angelo O'Neal attempts a 3Pt. Contested by Collin Barnes (5.6 feet, ZONE). D'ANGELO O'NEAL MAKES IT! Assist: Cade Wall
Score: 89-108

[01:37] Team_016 possession (Score: 89-108)
Vince Quickley throws a bad pass! Stolen by Lauri Carter! TURNOVER! (live ball)

[01:19] Team_046 possession (Score: 89-108)
FOUL! Shooting foul on Vince Duncan. Lauri Carter to the line for 2 free throws. [BONUS: 8 team fouls] (Vince Duncan: 4 personal fouls)   FT 1/2: GOOD   FT 2/2: GOOD Lauri Carter makes 2/2 from the line.
Score: 89-110

[01:10] Team_016 possession (Score: 89-110)
Collin Barnes attempts a 3Pt. Contested by Lauri Carter (4.7 feet, ZONE). Collin Barnes misses. Rebound secured by Lauri Carter.

[00:55] Team_046 possession (Score: 89-110)
D'Angelo O'Neal drives, Vince Duncan stays with him. D'Angelo O'Neal attempts a Layup. Contested by Vince Duncan (5.0 feet, ZONE). D'Angelo O'Neal misses. Offensive rebound by Lauri Carter! Lauri Carter kicks it out.

[00:46] Team_046 possession (Score: 89-110)
Kevin Allen drives and kicks out. Lauri Carter attempts a Midrange. Contested by Vince Quickley (5.8 feet, ZONE). Lauri Carter misses. Rebound secured by Vince Duncan.

[00:30] Team_016 possession (Score: 89-110)
Collin Barnes attempts a Midrange. Contested by Lauri Carter (4.8 feet, ZONE). COLLIN BARNES MAKES IT! Assist: Vince Duncan
Score: 91-110

[00:12] Team_046 possession (Score: 91-110)
Cade Wall attempts a Midrange. Contested by Ben Barrett (5.7 feet, MAN). Cade Wall misses. Rebound secured by Vince Quickley.

================================================================================
                              4TH QUARTER COMPLETE                              
================================================================================

4TH QUARTER SCORE: Team_016 14, Team_046 29

BOX SCORE:
================================================================================

Team_016
--------------------------------------------------------------------------------
Player                MIN  PTS  REB  AST  TO      FG   FG%      3P   3P%
--------------------------------------------------------------------------------
Vince Duncan           40    9    7    1   0   4/7    57.1     0/0   0.0
Giannis Ginobili       41    3    0    0   0   1/3    33.3     0/0   0.0
Collin Barnes          40    2    0    1   0   1/7    14.3     0/0   0.0
Ben Barrett            40    0    2    0   0   0/1     0.0     0/0   0.0
Vince Quickley         41    0    2    1   0   0/3     0.0     0/0   0.0

TEAM: FG: 6/21 (28.6%), 3PT: 1/12 (8.3%), REB: 11 (2 off, 9 def), AST: 3, TO: 1
TEAM FOULS: 8 [Team_046 in BONUS]


Team_046
--------------------------------------------------------------------------------
Player                MIN  PTS  REB  AST  TO      FG   FG%      3P   3P%
--------------------------------------------------------------------------------
D'Angelo O'Neal        40    9    0    1   0   4/5    80.0     0/0   0.0
Victor Nowitzki        40    6    0    0   0   2/5    40.0     0/0   0.0
Lauri Carter           40    5    7    2   0   2/3    66.7     0/0   0.0
Kevin Allen            40    5    5    1   0   2/3    66.7     0/0   0.0
Cade Wall              40    3    5    2   0   2/4    50.0     0/0   0.0

TEAM: FG: 12/21 (57.1%), 3PT: 1/3 (33.3%), REB: 17 (2 off, 15 def), AST: 6, TO: 1
TEAM FOULS: 4

================================================================================

================================================================================
                               FULL GAME COMPLETE                               
================================================================================

FINAL SCORE: Team_016 91, Team_046 110

SCORING BY QUARTER:
--------------------------------------------------------------------------------
Team                     Q1     Q2     Q3     Q4    FINAL
--------------------------------------------------------------------------------
Team_016                 26     21     30     14       91
Team_046                 29     24     28     29      110
--------------------------------------------------------------------------------

FULL GAME BOX SCORE:
================================================================================

Team_016
--------------------------------------------------------------------------------
Player                MIN  PTS  REB  AST  TO      FG   FG%      3P   3P%      FT STL BLK
--------------------------------------------------------------------------------
Giannis Ginobili       41   14    0    1   3   4/11   36.4   2/6    33.3   0/0     1   0
Vince Quickley         41    5    8    6   2   5/13   38.5   3/8    37.5   3/3     0   0
Collin Barnes          40   28    0    5   0   9/21   42.9   4/13   30.8   1/2     0   1
Ben Barrett            40   11   11    2   2   5/9    55.6   0/2     0.0   1/1     1   0
Vince Duncan           40   20   19    1   1   9/15   60.0   0/2     0.0   4/4     1   1
Lamelo Herro            8    4    1    1   0   2/5    40.0   1/3    33.3   2/3     0   0
Giannis Doncic          8    0    1    0   1   0/1     0.0   0/0     0.0   0/0     0   0
Trae Barnes             8    7    2    0   0   4/4   100.0   0/0     0.0   3/4     0   0
Immanuel Nowitzki       7    0    0    0   0   0/2     0.0   0/1     0.0   0/0     0   0
Kevin Butler            7    0    0    0   0   0/2     0.0   0/1     0.0   0/0     0   0

TEAM: FG: 38/83 (45.8%), 3PT: 10/36 (27.8%), REB: 43 (8 off, 35 def), AST: 16, TO: 9


Team_046
--------------------------------------------------------------------------------
Player                MIN  PTS  REB  AST  TO      FG   FG%      3P   3P%      FT STL BLK
--------------------------------------------------------------------------------
D'Angelo O'Neal        40   18    0    2   0   7/13   53.8   4/8    50.0   0/0     0   2
Victor Nowitzki        40   14    0    2   3   3/11   27.3   1/7    14.3   4/4     0   0
Lauri Carter           40   12   10    3   1   5/13   38.5   1/5    20.0   6/8     1   0
Cade Wall              40   20   15    3   3  10/15   66.7   2/3    66.7   5/7     1   0
Kevin Allen            40   19   17    5   0  10/15   66.7   1/1   100.0   6/8     1   0
Collin Butler           8   10    0    2   1   6/6   100.0   3/3   100.0   7/7     0   0
Manu Dosunmu            8    5    3    0   0   1/1   100.0   0/0     0.0   2/2     0   1
Josh Barrett            8    2    0    1   0   1/2    50.0   0/0     0.0   0/0     0   0
Chris LaVine            8    2    1    0   0   1/2    50.0   0/1     0.0   2/2     0   0
Paul DeRozan            8    5    5    0   2   1/1   100.0   0/0     0.0   1/2     0   0

TEAM: FG: 45/81 (55.6%), 3PT: 12/28 (42.9%), REB: 50 (7 off, 43 def), AST: 18, TO: 10

================================================================================
