================================================================================
                        FULL GAME - Team_095 vs Team_001                        
================================================================================

================================================================================
                       1ST QUARTER - Team_095 vs Team_001                       
================================================================================

[12:00] Team_095 possession (Score: 0-0)
Kyrie Ming attempts a Midrange. Contested by Miles Griffin (4.2 feet, MAN). Kyrie Ming misses. Rebound secured by Miles Griffin.

[11:46] Team_001 possession (Score: 0-0)
Dejounte McCollum drives and kicks out. Klay Harden attempts a Midrange. Contested by Immanuel Middleton (4.8 feet, ZONE). KLAY HARDEN MAKES IT! Assist: Dirk Young
Score: 0-2

[11:31] Team_095 possession (Score: 0-2)
Immanuel Middleton attempts a 3Pt. Contested by Klay Harden (3.9 feet, ZONE). IMMANUEL MIDDLETON MAKES IT! Assist: Evan Carter
Score: 3-2

[11:18] Team_001 possession (Score: 3-2)
FOUL! Shooting foul on Evan Carter. Cole Ball to the line for 2 free throws. [Team fouls: 1] (Evan Carter: 1 personal fouls)   FT 1/2: GOOD   FT 2/2: GOOD Cole Ball makes 2/2 from the line.
Score: 3-4

[11:05] Team_095 possession (Score: 3-4)
Shaquille Ball drives, picks up Dirk Young. Help arrives from Cole Ball! Shaquille Ball attempts a Layup. Contested by Cole Ball (3.5 feet, MAN). Shaquille Ball misses. Rebound secured by Dejounte McCollum.

[10:50] Team_001 possession (Score: 3-4)
Dirk Young attempts a 3Pt. Contested by Evan Carter (4.1 feet, ZONE). Dirk Young misses. Offensive rebound by Cole Ball! Cole Ball kicks it out.

[10:36] Team_001 possession (Score: 3-4)
Dirk Young attempts a 3Pt. Contested by Shaquille Ball (4.6 feet, MAN). Dirk Young misses. Rebound secured by Shaquille Ball.

[10:20] Team_095 possession (Score: 3-4)
Evan Carter attempts a Midrange. Contested by Dirk Young (3.8 feet, ZONE). Evan Carter misses. Rebound secured by Cole Ball.

[10:07] Team_001 possession (Score: 3-4)
Dirk Young attempts a Layup. Contested by Immanuel Middleton (5.1 feet, ZONE). DIRK YOUNG MAKES IT! Assist: Cole Ball
Score: 3-6

[09:53] Team_095 possession (Score: 3-6)
Shaquille Ball drives, picks up Miles Griffin. Help arrives from Klay Harden! Shaquille Ball attempts a Dunk. Contested by Klay Harden (4.0 feet, ZONE). SHAQUILLE BALL MAKES IT!
Score: 5-6

[09:39] Team_001 possession (Score: 5-6)
Dirk Young attempts a 3Pt. Contested by Evan Carter (4.1 feet, ZONE). Dirk Young misses. Rebound secured by Dejounte Hyland.

[09:26] Team_095 possession (Score: 5-6)
FOUL! Shooting foul on Dirk Young. Shaquille Ball to the line for 3 free throws. [Team fouls: 1] (Dirk Young: 1 personal fouls)   FT 1/3: GOOD   FT 2/3: GOOD   FT 3/3: GOOD Shaquille Ball makes 3/3 from the line.
Score: 8-6

[09:07] Team_001 possession (Score: 8-6)
Cole Ball attempts a Layup. BLOCKED BY IMMANUEL MIDDLETON! Ball deflects out of bounds off Cole Ball.

[08:52] Team_095 possession (Score: 8-6)
Kyrie Ming attempts a Layup. Contested by Miles Griffin (4.2 feet, MAN). Kyrie Ming misses. Rebound secured by Cole Ball.

[08:37] Team_001 possession (Score: 8-6)
Cole Ball attempts a Midrange. Contested by Evan Carter (3.6 feet, MAN). Cole Ball misses. Rebound secured by Shaquille Ball.

[08:26] Team_095 possession (Score: 8-6)
Evan Carter drives, Cole Ball stays with him. Evan Carter attempts a Dunk. Contested by Cole Ball (3.3 feet, MAN). EVAN CARTER MAKES IT! Assist: Shaquille Ball
Score: 10-6

[08:13] Team_001 possession (Score: 10-6)
Dirk Young attempts a 3Pt. Contested by Shaquille Ball (4.6 feet, MAN). DIRK YOUNG MAKES IT! Assist: Dejounte McCollum
Score: 10-9

[08:03] Team_095 possession (Score: 10-9)
Dejounte Hyland attempts a 3Pt. Contested by Klay Harden (3.9 feet, MAN). Dejounte Hyland misses. Rebound secured by Cole Ball.

[07:49] Team_001 possession (Score: 10-9)
Dirk Young loses the ball! Stripped by Shaquille Ball! TURNOVER! (live ball)

[07:36] Team_095 possession (Score: 10-9)
Evan Carter makes the Midrange and draws the foul on Cole Ball! And-1! Evan Carter to the line for 1. [Team fouls: 2] (Cole Ball: 1 personal fouls)   FT 1/1: GOOD Evan Carter makes 1/1 from the line.
Score: 13-9

[07:24] Team_001 possession (Score: 13-9)
Dejounte McCollum drives and kicks out. Klay Harden attempts a 3Pt. Contested by Dejounte Hyland (4.9 feet, MAN). KLAY HARDEN MAKES IT! Assist: Miles Griffin
Score: 13-12

[07:06] Team_095 possession (Score: 13-12)
Evan Carter drives, picks up Miles Griffin. Help arrives from Klay Harden! Evan Carter attempts a Dunk. Contested by Klay Harden (4.2 feet, ZONE). Evan Carter misses. Rebound secured by Dejounte McCollum.

[06:48] Team_001 possession (Score: 13-12)
Dirk Young attempts a 3Pt. Contested by Shaquille Ball (4.6 feet, MAN). Dirk Young misses. Rebound secured by Shaquille Ball.

[06:35] Team_095 possession (Score: 13-12)
FOUL! Holding foul on Miles Griffin. [Team fouls: 3] No free throws, side out. (Miles Griffin: 1 personal fouls)

[06:22] Team_095 possession (Score: 13-12)
Dejounte Hyland attempts a Layup. Contested by Klay Harden (3.9 feet, MAN). DEJOUNTE HYLAND MAKES IT! Assist: Kyrie Ming
Score: 15-12

[06:09] Team_001 possession (Score: 15-12)
FOUL! Shooting foul on Immanuel Middleton. Dejounte McCollum to the line for 2 free throws. [Team fouls: 2] (Immanuel Middleton: 1 personal fouls)   FT 1/2: MISS   FT 2/2: GOOD Dejounte McCollum makes 1/2 from the line.
Score: 15-13

[05:58] Team_095 possession (Score: 15-13)
Dejounte Hyland drives to the basket... Dejounte Hyland loses control! Ball rolls out of bounds! TURNOVER! (dead ball)

[05:47] Team_001 possession (Score: 15-13)
Cole Ball attempts a 3Pt. Contested by Evan Carter (3.6 feet, MAN). Cole Ball misses. Rebound secured by Shaquille Ball.

[05:30] Team_095 possession (Score: 15-13)
Dejounte Hyland drives and kicks out. Dejounte Hyland attempts a Midrange. Contested by Dejounte McCollum (3.7 feet, ZONE). Dejounte Hyland misses. Rebound secured by Cole Ball.

[05:16] Team_001 possession (Score: 15-13)
Klay Harden makes the Midrange and draws the foul on Shaquille Ball! And-1! Klay Harden to the line for 1. [Team fouls: 3] (Shaquille Ball: 1 personal fouls)   FT 1/1: GOOD Klay Harden makes 1/1 from the line.
Score: 15-16

[05:04] Team_095 possession (Score: 15-16)
Shaquille Ball attempts a Midrange. Contested by Dirk Young (3.6 feet, ZONE). Shaquille Ball misses. Offensive rebound by Evan Carter! Evan Carter's putback is no good. Rebound secured by Miles Griffin.

[04:53] Team_001 possession (Score: 15-16)
Miles Griffin drives and kicks out. Dirk Young attempts a 3Pt. Contested by Shaquille Ball (4.4 feet, MAN). Dirk Young misses. Rebound secured by Dejounte Hyland.

[04:41] Team_095 possession (Score: 15-16)
Immanuel Middleton makes the Layup and draws the foul on Miles Griffin! And-1! Immanuel Middleton to the line for 1. [Team fouls: 4] (Miles Griffin: 2 personal fouls)   FT 1/1: GOOD Immanuel Middleton makes 1/1 from the line.
Score: 18-16

[04:21] Team_001 possession (Score: 18-16)
Klay Harden attempts a 3Pt. Contested by Evan Carter (3.8 feet, ZONE). Klay Harden misses. Rebound secured by Dejounte Hyland.

[04:08] Team_095 possession (Score: 18-16)
Immanuel Middleton drives, Dejounte McCollum stays with him. Immanuel Middleton attempts a Dunk. Contested by Dejounte McCollum (3.8 feet, MAN). IMMANUEL MIDDLETON MAKES IT!
Score: 20-16

[03:50] Team_001 possession (Score: 20-16)
Cole Ball attempts a Layup. Contested by Immanuel Middleton (4.8 feet, ZONE). Cole Ball misses. Rebound secured by Shaquille Ball.

[03:36] Team_095 possession (Score: 20-16)
Evan Carter attempts a 3Pt. Contested by Cole Ball (3.4 feet, MAN). EVAN CARTER MAKES IT! Assist: Kyrie Ming
Score: 23-16

[03:19] Team_001 possession (Score: 23-16)
FOUL! Shooting foul on Dejounte Hyland. Klay Harden to the line for 2 free throws. [Team fouls: 4] (Dejounte Hyland: 1 personal fouls)   FT 1/2: GOOD   FT 2/2: MISS Klay Harden makes 1/2 from the line. Rebound secured by Shaquille Ball.
Score: 23-17

[03:04] Team_095 possession (Score: 23-17)
Dejounte Hyland drives and kicks out. Immanuel Middleton makes the Midrange and draws the foul on Dirk Young! And-1! Immanuel Middleton to the line for 1. [BONUS: 5 team fouls] (Dirk Young: 2 personal fouls)   FT 1/1: GOOD Immanuel Middleton makes 1/1 from the line.
Score: 26-17

[02:52] Team_001 possession (Score: 26-17)
Miles Griffin drives to the basket... Miles Griffin loses control! Ball rolls out of bounds! TURNOVER! (dead ball)

[02:52] Substitution (Team_095): Dejounte Hyland OUT → Kyle Poole IN (stamina_rule2)

[02:52] Substitution (Team_095): Immanuel Middleton OUT → Gary Davis IN (stamina_rule2)

[02:52] Substitution (Team_095): Kyrie Ming OUT → DeMar McCollum IN (stamina_rule2)

[02:52] Substitution (Team_001): Klay Harden OUT → Ja Dosunmu IN (stamina_rule2)

[02:52] Substitution (Team_001): Miles Griffin OUT → Kristaps Ming IN (stamina_rule2)

[02:33] Team_095 possession (Score: 26-17)
Shaquille Ball attempts a Midrange. Contested by Dirk Young (3.8 feet, MAN). SHAQUILLE BALL MAKES IT! Assist: Evan Carter
Score: 28-17

[02:22] Team_001 possession (Score: 28-17)
Kristaps Ming attempts a Layup. Contested by DeMar McCollum (4.9 feet, MAN). KRISTAPS MING MAKES IT! Assist: Ja Dosunmu
Score: 28-19

[02:10] Team_095 possession (Score: 28-19)
Evan Carter attempts a 3Pt. Contested by Ja Dosunmu (4.2 feet, ZONE). EVAN CARTER MAKES IT! Assist: Kyle Poole
Score: 31-19

[01:59] Team_001 possession (Score: 31-19)
FOUL! Reach-in foul on Gary Davis during the drive. [IN THE BONUS! 5 team fouls] Dejounte McCollum to the line for 2 free throws. (Gary Davis: 1 personal fouls)   FT 1/2: GOOD   FT 2/2: GOOD Dejounte McCollum makes 2/2 from the line.
Score: 31-21

[01:46] Team_095 possession (Score: 31-21)
Evan Carter attempts a 3Pt. Contested by Ja Dosunmu (4.2 feet, ZONE). Evan Carter misses. Offensive rebound by Gary Davis! Gary Davis kicks it out.

[01:29] Team_095 possession (Score: 31-21)
Gary Davis drives to the basket... Gary Davis throws a bad pass! Stolen by Kristaps Ming! TURNOVER! (live ball)

[01:16] Team_001 possession (Score: 31-21)
Dirk Young attempts a 3Pt. Contested by Shaquille Ball (4.9 feet, MAN). Dirk Young misses. Rebound secured by Evan Carter.

[01:02] Team_095 possession (Score: 31-21)
DeMar McCollum attempts a 3Pt. Contested by Kristaps Ming (6.0 feet, MAN). DeMar McCollum misses. Rebound secured by Cole Ball.

[00:52] Team_001 possession (Score: 31-21)
Kristaps Ming attempts a 3Pt. Contested by DeMar McCollum (4.9 feet, MAN). Kristaps Ming misses. Rebound secured by Evan Carter.

[00:37] Team_095 possession (Score: 31-21)
Shaquille Ball loses the ball! Stripped by Dirk Young! TURNOVER! (live ball)

[00:24] Team_001 possession (Score: 31-21)
Dejounte McCollum makes the 3Pt and draws the foul on Evan Carter! And-1! Dejounte McCollum to the line for 1. [BONUS: 6 team fouls] (Evan Carter: 2 personal fouls)   FT 1/1: MISS Dejounte McCollum makes 0/1 from the line. Rebound secured by Evan Carter.
Score: 31-24

[00:08] Team_095 possession (Score: 31-24)
DeMar McCollum attempts a 3Pt. Contested by Ja Dosunmu (4.6 feet, ZONE). DeMar McCollum misses. Rebound secured by Cole Ball.

================================================================================
                              1ST QUARTER COMPLETE                              
================================================================================

1ST QUARTER SCORE: Team_095 31, Team_001 24

BOX SCORE:
================================================================================

Team_095
--------------------------------------------------------------------------------
Player                MIN  PTS  REB  AST  TO      FG   FG%      3P   3P%
--------------------------------------------------------------------------------
Immanuel Middleton      9   11    0    0   0   4/4   100.0     0/0   0.0
Evan Carter            12   11    3    2   0   4/6    66.7     0/0   0.0
Shaquille Ball         12    7    6    1   0   3/5    60.0     0/0   0.0
Dejounte Hyland         9    2    3    0   0   1/3    33.3     0/0   0.0
Kyrie Ming              9    0    0    2   0   0/2     0.0     0/0   0.0
Kyle Poole              3    0    0    1   0   0/0     0.0     0/0   0.0
Gary Davis              3    0    1    0   0   0/0     0.0     0/0   0.0
DeMar McCollum          3    0    0    0   0   0/2     0.0     0/0   0.0

TEAM: FG: 12/22 (54.5%), 3PT: 4/7 (57.1%), REB: 14 (2 off, 12 def), AST: 6, TO: 3
TEAM FOULS: 6 [Team_001 in BONUS]


Team_001
--------------------------------------------------------------------------------
Player                MIN  PTS  REB  AST  TO      FG   FG%      3P   3P%
--------------------------------------------------------------------------------
Klay Harden             9    8    0    0   0   3/5    60.0     0/0   0.0
Dirk Young             12    5    0    1   0   2/6    33.3     0/0   0.0
Dejounte McCollum      12    3    2    1   0   2/3    66.7     0/0   0.0
Cole Ball              12    2    7    1   0   1/5    20.0     0/0   0.0
Kristaps Ming           3    2    0    0   0   1/2    50.0     0/0   0.0
Miles Griffin           9    0    2    1   0   0/1     0.0     0/0   0.0
Ja Dosunmu              3    0    0    1   0   0/0     0.0     0/0   0.0

TEAM: FG: 9/22 (40.9%), 3PT: 1/9 (11.1%), REB: 10 (1 off, 9 def), AST: 5, TO: 2
TEAM FOULS: 5 [Team_095 in BONUS]

================================================================================

================================================================================
                       2ND QUARTER - Team_095 vs Team_001                       
================================================================================

[12:00] Team_095 possession (Score: 31-24)
Shaquille Ball attempts a 3Pt. Contested by Klay Harden (3.8 feet, ZONE). SHAQUILLE BALL MAKES IT! Assist: Evan Carter
Score: 34-24

[11:46] Team_001 possession (Score: 34-24)
Cole Ball attempts a 3Pt. Contested by Evan Carter (4.0 feet, MAN). Cole Ball misses. Rebound secured by Kyrie Ming.

[11:34] Team_095 possession (Score: 34-24)
Dejounte Hyland drives to the basket... Dejounte Hyland loses the ball! Stripped by Miles Griffin! TURNOVER! (live ball)

[11:17] Team_001 possession (Score: 34-24)
Klay Harden throws a bad pass out of bounds! TURNOVER! (dead ball)

[11:17] Substitution (Team_095): Shaquille Ball OUT → Cade Beal IN (stamina_rule2)

[11:17] Substitution (Team_095): Evan Carter OUT → Tobias Wagner IN (stamina_rule2)

[11:17] Substitution (Team_001): Dirk Young OUT → Rudy George IN (stamina_rule2)

[11:17] Substitution (Team_001): Cole Ball OUT → Larry Trent IN (stamina_rule2)

[11:17] Substitution (Team_001): Dejounte McCollum OUT → Franz Bryant IN (stamina_rule2)

[11:06] Team_095 possession (Score: 34-24)
Dejounte Hyland drives, picks up Miles Griffin. Help arrives from Klay Harden! Dejounte Hyland attempts a Dunk. Contested by Klay Harden (4.1 feet, ZONE). Dejounte Hyland misses. Offensive rebound by Tobias Wagner! Tobias Wagner kicks it out.

[10:57] Team_095 possession (Score: 34-24)
Kyrie Ming attempts a 3Pt. Contested by Klay Harden (4.2 feet, ZONE). KYRIE MING MAKES IT! Assist: Tobias Wagner
Score: 37-24

[10:41] Team_001 possession (Score: 37-24)
FOUL! Reach-in foul on Immanuel Middleton during the drive. [Team fouls: 1] No free throws, side out. (Immanuel Middleton: 1 personal fouls)

[10:25] Team_001 possession (Score: 37-24)
Larry Trent attempts a 3Pt. Contested by Cade Beal (4.9 feet, ZONE). Larry Trent misses. Rebound secured by Tobias Wagner.

[10:11] Team_095 possession (Score: 37-24)
Cade Beal attempts a 3Pt. Contested by Klay Harden (4.0 feet, ZONE). Cade Beal misses. Rebound secured by Klay Harden.

[10:00] Team_001 possession (Score: 37-24)
Miles Griffin makes the 3Pt and draws the foul on Cade Beal! And-1! Miles Griffin to the line for 1. [Team fouls: 2] (Cade Beal: 1 personal fouls)   FT 1/1: GOOD Miles Griffin makes 1/1 from the line.
Score: 37-28

[09:44] Team_095 possession (Score: 37-28)
Cade Beal attempts a 3Pt. Contested by Klay Harden (4.1 feet, ZONE). CADE BEAL MAKES IT! Assist: Kyrie Ming
Score: 40-28

[09:30] Team_001 possession (Score: 40-28)
Rudy George attempts a 3Pt. Contested by Cade Beal (4.5 feet, ZONE). Rudy George misses. Offensive rebound by Miles Griffin! Miles Griffin kicks it out.

[09:19] Team_001 possession (Score: 40-28)
Franz Bryant attempts a 3Pt. Contested by Immanuel Middleton (5.3 feet, MAN). Franz Bryant misses. Rebound secured by Cade Beal.

[09:02] Team_095 possession (Score: 40-28)
Dejounte Hyland attempts a 3Pt. Contested by Klay Harden (4.2 feet, ZONE). Dejounte Hyland misses. Offensive rebound by Dejounte Hyland! Dejounte Hyland kicks it out.

[08:42] Team_095 possession (Score: 40-28)
FOUL! Shooting foul on Miles Griffin. Kyrie Ming to the line for 2 free throws. [Team fouls: 1] (Miles Griffin: 1 personal fouls)   FT 1/2: GOOD   FT 2/2: GOOD Kyrie Ming makes 2/2 from the line.
Score: 42-28

[08:30] Team_001 possession (Score: 42-28)
Klay Harden attempts a 3Pt. Contested by Cade Beal (4.3 feet, ZONE). Klay Harden misses. Rebound secured by Dejounte Hyland.

[08:17] Team_095 possession (Score: 42-28)
Dejounte Hyland attempts a 3Pt. Contested by Klay Harden (4.3 feet, ZONE). Dejounte Hyland misses. Rebound secured by Miles Griffin.

[08:05] Team_001 possession (Score: 42-28)
Klay Harden drives, Dejounte Hyland stays with him. Klay Harden attempts a Dunk. Contested by Dejounte Hyland (5.1 feet, MAN). KLAY HARDEN MAKES IT! Assist: Larry Trent
Score: 42-30

[07:49] Team_095 possession (Score: 42-30)
FOUL! Offensive foul on Immanuel Middleton! Franz Bryant drew the charge! [Team fouls: 3] (Immanuel Middleton: 2 personal fouls) TURNOVER! (dead ball)

[07:33] Team_001 possession (Score: 42-30)
Franz Bryant drives, picks up Kyrie Ming. Help arrives from Cade Beal! Franz Bryant attempts a Dunk. Contested by Cade Beal (5.7 feet, ZONE). Franz Bryant misses. Rebound secured by Dejounte Hyland.

[07:19] Team_095 possession (Score: 42-30)
Cade Beal drives and kicks out. FOUL! Shooting foul on Klay Harden. Dejounte Hyland to the line for 3 free throws. [Team fouls: 2] (Klay Harden: 1 personal fouls)   FT 1/3: GOOD   FT 2/3: GOOD   FT 3/3: GOOD Dejounte Hyland makes 3/3 from the line.
Score: 45-30

[07:07] Team_001 possession (Score: 45-30)
Larry Trent throws a bad pass! Stolen by Tobias Wagner! TURNOVER! (live ball)

[06:53] Team_095 possession (Score: 45-30)
Immanuel Middleton attempts a Layup. Contested by Franz Bryant (4.0 feet, MAN). IMMANUEL MIDDLETON MAKES IT! Assist: Dejounte Hyland
Score: 47-30

[06:35] Team_001 possession (Score: 47-30)
Larry Trent attempts a 3Pt. Contested by Tobias Wagner (4.3 feet, MAN). Larry Trent misses. Rebound secured by Dejounte Hyland.

[06:18] Team_095 possession (Score: 47-30)
Tobias Wagner drives to the basket... Tobias Wagner throws a bad pass! Stolen by Franz Bryant! TURNOVER! (live ball)

[06:06] Team_001 possession (Score: 47-30)
Miles Griffin attempts a Midrange. Wide open! Kyrie Ming is 6.1 feet away. [MAN] MILES GRIFFIN MAKES IT! Assist: Klay Harden
Score: 47-32

[05:50] Team_095 possession (Score: 47-32)
Kyrie Ming attempts a Layup. Contested by Miles Griffin (4.9 feet, MAN). KYRIE MING MAKES IT! Assist: Cade Beal
Score: 49-32

[05:34] Team_001 possession (Score: 49-32)
Klay Harden drives and kicks out. Larry Trent attempts a 3Pt. Contested by Tobias Wagner (3.8 feet, MAN). LARRY TRENT MAKES IT! Assist: Klay Harden
Score: 49-35

[05:18] Team_095 possession (Score: 49-35)
Kyrie Ming drives, Miles Griffin stays with him. Kyrie Ming attempts a Layup. Contested by Miles Griffin (5.0 feet, ZONE). Kyrie Ming misses. Rebound secured by Rudy George.

[05:04] Team_001 possession (Score: 49-35)
Klay Harden attempts a 3Pt. Contested by Dejounte Hyland (5.4 feet, MAN). Klay Harden misses. Rebound secured by Dejounte Hyland.

[04:51] Team_095 possession (Score: 49-35)
Kyrie Ming makes the Layup and draws the foul on Miles Griffin! And-1! Kyrie Ming to the line for 1. [Team fouls: 3] (Miles Griffin: 2 personal fouls)   FT 1/1: GOOD Kyrie Ming makes 1/1 from the line.
Score: 52-35

[04:36] Team_001 possession (Score: 52-35)
Klay Harden attempts a 3Pt. Contested by Dejounte Hyland (5.5 feet, MAN). KLAY HARDEN MAKES IT! Assist: Rudy George
Score: 52-38

[04:22] Team_095 possession (Score: 52-38)
FOUL! Holding foul on Franz Bryant. [Team fouls: 4] No free throws, side out. (Franz Bryant: 1 personal fouls)

[04:05] Team_095 possession (Score: 52-38)
Tobias Wagner makes the 3Pt and draws the foul on Larry Trent! And-1! Tobias Wagner to the line for 1. [BONUS: 5 team fouls] (Larry Trent: 1 personal fouls)   FT 1/1: GOOD Tobias Wagner makes 1/1 from the line.
Score: 56-38

[03:48] Team_001 possession (Score: 56-38)
Klay Harden attempts a 3Pt. Contested by Dejounte Hyland (5.5 feet, MAN). Klay Harden misses. Rebound secured by Tobias Wagner.

[03:33] Team_095 possession (Score: 56-38)
Kyrie Ming drives to the basket... Kyrie Ming loses the ball! Stripped by Miles Griffin! TURNOVER! (live ball)

[03:18] Team_001 possession (Score: 56-38)
Franz Bryant attempts a Layup. Wide open! Immanuel Middleton is 6.1 feet away. [ZONE] FRANZ BRYANT MAKES IT! Assist: Miles Griffin
Score: 56-40

[03:03] Team_095 possession (Score: 56-40)
Dejounte Hyland drives, picks up Klay Harden. Help arrives from Larry Trent! Dejounte Hyland attempts a Layup. Contested by Larry Trent (5.0 feet, MAN). Dejounte Hyland misses. Rebound secured by Rudy George.

[02:46] Team_001 possession (Score: 56-40)
Larry Trent attempts a Midrange. Contested by Tobias Wagner (4.4 feet, MAN). LARRY TRENT MAKES IT!
Score: 56-42

[02:35] Team_095 possession (Score: 56-42)
Cade Beal attempts a Midrange. Contested by Rudy George (4.4 feet, MAN). Cade Beal misses. Rebound secured by Larry Trent.

[02:20] Team_001 possession (Score: 56-42)
Larry Trent attempts a Layup. Contested by Tobias Wagner (4.5 feet, MAN). LARRY TRENT MAKES IT! Assist: Miles Griffin
Score: 56-44

[02:06] Team_095 possession (Score: 56-44)
Immanuel Middleton attempts a Layup. Contested by Franz Bryant (4.2 feet, ZONE). Immanuel Middleton misses. Rebound secured by Miles Griffin.

[01:49] Team_001 possession (Score: 56-44)
Miles Griffin attempts a Midrange. Contested by Cade Beal (4.7 feet, ZONE). Miles Griffin misses. Rebound secured by Dejounte Hyland.

[01:38] Team_095 possession (Score: 56-44)
FOUL! Reach-in foul on Franz Bryant during the drive. [IN THE BONUS! 6 team fouls] Immanuel Middleton to the line for 2 free throws. (Franz Bryant: 2 personal fouls)   FT 1/2: GOOD   FT 2/2: GOOD Immanuel Middleton makes 2/2 from the line.
Score: 58-44

[01:25] Team_001 possession (Score: 58-44)
Larry Trent attempts a 3Pt. Contested by Tobias Wagner (4.6 feet, MAN). Larry Trent misses. Rebound secured by Tobias Wagner.

[01:14] Team_095 possession (Score: 58-44)
Immanuel Middleton attempts a Layup. Contested by Franz Bryant (4.3 feet, ZONE). IMMANUEL MIDDLETON MAKES IT! Assist: Kyrie Ming
Score: 60-44

[00:55] Team_001 possession (Score: 60-44)
Klay Harden drives, picks up Immanuel Middleton. Help arrives from Cade Beal! Klay Harden attempts a Layup. Wide open! Cade Beal is 6.1 feet away. [ZONE] KLAY HARDEN MAKES IT! Assist: Miles Griffin
Score: 60-46

[00:40] Team_095 possession (Score: 60-46)
Kyrie Ming drives, Miles Griffin stays with him. Kyrie Ming attempts a Layup. Contested by Miles Griffin (5.6 feet, MAN). KYRIE MING MAKES IT! Assist: Cade Beal
Score: 62-46

[00:28] Team_001 possession (Score: 62-46)
Franz Bryant drives, picks up Immanuel Middleton. Help arrives from Cade Beal! Franz Bryant attempts a Layup. Wide open! Cade Beal is 6.5 feet away. [ZONE] FRANZ BRYANT MAKES IT! Assist: Larry Trent
Score: 62-48

[00:11] Team_095 possession (Score: 62-48)
Tobias Wagner drives and kicks out. Kyrie Ming attempts a Midrange. Contested by Miles Griffin (5.8 feet, MAN). Kyrie Ming misses. Rebound secured by Rudy George.

================================================================================
                              2ND QUARTER COMPLETE                              
================================================================================

2ND QUARTER SCORE: Team_095 31, Team_001 24

BOX SCORE:
================================================================================

Team_095
--------------------------------------------------------------------------------
Player                MIN  PTS  REB  AST  TO      FG   FG%      3P   3P%
--------------------------------------------------------------------------------
Kyrie Ming             22   12    1    2   0   5/6    83.3     0/0   0.0
Immanuel Middleton     22    6    0    0   0   3/4    75.0     0/0   0.0
Tobias Wagner          11    4    4    1   0   1/2    50.0     0/0   0.0
Shaquille Ball         13    3    0    0   0   1/1   100.0     0/0   0.0
Cade Beal              11    3    1    2   0   1/3    33.3     0/0   0.0
Dejounte Hyland        22    3    6    1   0   1/3    33.3     0/0   0.0
Evan Carter            13    0    0    1   0   0/0     0.0     0/0   0.0

TEAM: FG: 12/19 (63.2%), 3PT: 4/6 (66.7%), REB: 12 (2 off, 10 def), AST: 7, TO: 4
TEAM FOULS: 3


Team_001
--------------------------------------------------------------------------------
Player                MIN  PTS  REB  AST  TO      FG   FG%      3P   3P%
--------------------------------------------------------------------------------
Larry Trent            11    7    1    2   0   3/6    50.0     0/0   0.0
Klay Harden            22    7    1    2   0   3/6    50.0     0/0   0.0
Miles Griffin          22    6    3    3   0   2/3    66.7     0/0   0.0
Franz Bryant           11    4    0    0   0   2/4    50.0     0/0   0.0
Cole Ball              13    0    0    0   0   0/1     0.0     0/0   0.0
Rudy George            11    0    3    1   0   0/0     0.0     0/0   0.0

TEAM: FG: 10/20 (50.0%), 3PT: 2/10 (20.0%), REB: 8 (1 off, 7 def), AST: 8, TO: 2
TEAM FOULS: 6 [Team_095 in BONUS]

================================================================================

================================================================================
                       3RD QUARTER - Team_095 vs Team_001                       
================================================================================

[12:00] Team_095 possession (Score: 62-48)
Immanuel Middleton attempts a Midrange. Contested by Dejounte McCollum (3.7 feet, MAN). IMMANUEL MIDDLETON MAKES IT! Assist: Shaquille Ball
Score: 64-48

[11:46] Team_001 possession (Score: 64-48)
Dejounte McCollum attempts a Midrange. Contested by Immanuel Middleton (4.8 feet, MAN). DEJOUNTE MCCOLLUM MAKES IT! Assist: Miles Griffin
Score: 64-50

[11:31] Team_095 possession (Score: 64-50)
Evan Carter attempts a 3Pt. Contested by Dirk Young (3.8 feet, ZONE). Evan Carter misses. Rebound secured by Cole Ball.

[11:14] Team_001 possession (Score: 64-50)
Cole Ball attempts a 3Pt. Contested by Evan Carter (3.6 feet, MAN). Cole Ball misses. Rebound secured by Shaquille Ball.

[11:01] Team_095 possession (Score: 64-50)
Immanuel Middleton drives and kicks out. Shaquille Ball attempts a 3Pt. Contested by Klay Harden (3.9 feet, ZONE). Shaquille Ball misses. Rebound secured by Miles Griffin.

[10:44] Team_001 possession (Score: 64-50)
Cole Ball makes the Layup and draws the foul on Immanuel Middleton! And-1! Cole Ball to the line for 1. [Team fouls: 1] (Immanuel Middleton: 1 personal fouls)   FT 1/1: GOOD Cole Ball makes 1/1 from the line.
Score: 64-53

[10:29] Team_095 possession (Score: 64-53)
FOUL! Shooting foul on Dejounte McCollum. Immanuel Middleton to the line for 2 free throws. [Team fouls: 1] (Dejounte McCollum: 1 personal fouls)   FT 1/2: GOOD   FT 2/2: GOOD Immanuel Middleton makes 2/2 from the line.
Score: 66-53

[10:11] Team_001 possession (Score: 66-53)
Cole Ball drives, Immanuel Middleton stays with him. Cole Ball attempts a Dunk. Contested by Immanuel Middleton (4.6 feet, ZONE). Cole Ball misses. Rebound secured by Dejounte Hyland.

[09:51] Team_095 possession (Score: 66-53)
FOUL! Holding foul on Miles Griffin. [Team fouls: 2] No free throws, side out. (Miles Griffin: 1 personal fouls)

[09:39] Team_095 possession (Score: 66-53)
Immanuel Middleton attempts a Midrange. Contested by Dejounte McCollum (3.7 feet, MAN). Immanuel Middleton misses. Offensive rebound by Dejounte Hyland! Dejounte Hyland kicks it out.

[09:30] Team_095 possession (Score: 66-53)
Kyrie Ming attempts a Midrange. Contested by Miles Griffin (4.2 feet, MAN). Kyrie Ming misses. Rebound secured by Miles Griffin.

[09:16] Team_001 possession (Score: 66-53)
Klay Harden makes the Layup and draws the foul on Immanuel Middleton! And-1! Klay Harden to the line for 1. [Team fouls: 2] (Immanuel Middleton: 2 personal fouls)   FT 1/1: GOOD Klay Harden makes 1/1 from the line.
Score: 66-56

[09:03] Team_095 possession (Score: 66-56)
Kyrie Ming attempts a 3Pt. Contested by Klay Harden (4.1 feet, ZONE). Kyrie Ming misses. Rebound secured by Cole Ball.

[08:48] Team_001 possession (Score: 66-56)
Dirk Young attempts a Layup. Contested by Shaquille Ball (4.6 feet, MAN). DIRK YOUNG MAKES IT!
Score: 66-58

[08:31] Team_095 possession (Score: 66-58)
Immanuel Middleton attempts a 3Pt. Contested by Dejounte McCollum (3.7 feet, MAN). Immanuel Middleton misses. Rebound secured by Cole Ball.

[08:16] Team_001 possession (Score: 66-58)
Miles Griffin attempts a Midrange. Contested by Dejounte Hyland (5.3 feet, ZONE). MILES GRIFFIN MAKES IT! Assist: Cole Ball
Score: 66-60

[08:01] Team_095 possession (Score: 66-60)
Immanuel Middleton attempts a Midrange. Contested by Cole Ball (3.1 feet, ZONE). IMMANUEL MIDDLETON MAKES IT!
Score: 68-60

[07:44] Team_001 possession (Score: 68-60)
Klay Harden attempts a 3Pt. Contested by Evan Carter (3.8 feet, ZONE). Klay Harden misses. Rebound secured by Dejounte Hyland.

[07:29] Team_095 possession (Score: 68-60)
FOUL! Shooting foul on Klay Harden. Dejounte Hyland to the line for 2 free throws. [Team fouls: 3] (Klay Harden: 1 personal fouls)   FT 1/2: GOOD   FT 2/2: MISS Dejounte Hyland makes 1/2 from the line. Rebound secured by Dejounte McCollum.
Score: 69-60

[07:19] Team_001 possession (Score: 69-60)
Dirk Young drives, picks up Immanuel Middleton. Help arrives from Dejounte Hyland! Dirk Young attempts a Dunk. Contested by Dejounte Hyland (5.1 feet, ZONE). DIRK YOUNG MAKES IT! Assist: Klay Harden
Score: 69-62

[07:08] Team_095 possession (Score: 69-62)
Evan Carter attempts a 3Pt. Contested by Cole Ball (3.3 feet, MAN). EVAN CARTER MAKES IT! Assist: Dejounte Hyland
Score: 72-62

[06:55] Team_001 possession (Score: 72-62)
Klay Harden attempts a 3Pt. Contested by Dejounte Hyland (4.8 feet, MAN). Klay Harden misses. Offensive rebound by Miles Griffin! Miles Griffin kicks it out.

[06:40] Team_001 possession (Score: 72-62)
Klay Harden attempts a 3Pt. Contested by Dejounte Hyland (4.8 feet, MAN). Klay Harden misses. Rebound secured by Evan Carter.

[06:26] Team_095 possession (Score: 72-62)
Evan Carter attempts a Midrange. Contested by Dirk Young (3.8 feet, ZONE). EVAN CARTER MAKES IT! Assist: Immanuel Middleton
Score: 74-62

[06:11] Team_001 possession (Score: 74-62)
Klay Harden attempts a Midrange. Contested by Evan Carter (3.8 feet, ZONE). Klay Harden misses. Rebound secured by Evan Carter.

[05:55] Team_095 possession (Score: 74-62)
Immanuel Middleton attempts a Midrange. Contested by Cole Ball (3.1 feet, ZONE). Immanuel Middleton misses. Rebound secured by Dejounte McCollum.

[05:37] Team_001 possession (Score: 74-62)
Dejounte McCollum drives to the basket... Dejounte McCollum loses control! Ball rolls out of bounds! TURNOVER! (dead ball)

[05:25] Team_095 possession (Score: 74-62)
Dejounte Hyland attempts a 3Pt. Contested by Klay Harden (3.9 feet, MAN). Dejounte Hyland misses. Rebound secured by Dejounte McCollum.

[05:12] Team_001 possession (Score: 74-62)
Dirk Young attempts a Midrange. Contested by Shaquille Ball (4.6 feet, MAN). DIRK YOUNG MAKES IT!
Score: 74-64

[04:59] Team_095 possession (Score: 74-64)
Shaquille Ball attempts a 3Pt. Contested by Dirk Young (3.6 feet, MAN). Shaquille Ball misses. FOUL! Loose ball foul on Miles Griffin during the rebound battle. [Team fouls: 4] No free throws, side out. (Miles Griffin: 2 personal fouls)

[04:49] Team_095 possession (Score: 74-64)
Kyrie Ming attempts a 3Pt. Contested by Klay Harden (4.1 feet, ZONE). Kyrie Ming misses. Rebound secured by Cole Ball.

[04:38] Team_001 possession (Score: 74-64)
Dejounte McCollum attempts a Midrange. Contested by Immanuel Middleton (4.9 feet, MAN). Dejounte McCollum misses. Rebound secured by Shaquille Ball.

[04:26] Team_095 possession (Score: 74-64)
Kyrie Ming drives to the basket... Kyrie Ming throws a bad pass! Stolen by Miles Griffin! TURNOVER! (live ball)

[04:11] Team_001 possession (Score: 74-64)
Klay Harden attempts a 3Pt. Contested by Dejounte Hyland (4.9 feet, ZONE). KLAY HARDEN MAKES IT! Assist: Dirk Young
Score: 74-67

[03:53] Team_095 possession (Score: 74-67)
Immanuel Middleton drives, picks up Miles Griffin. Help arrives from Klay Harden! Immanuel Middleton attempts a Dunk. Contested by Klay Harden (4.2 feet, ZONE). IMMANUEL MIDDLETON MAKES IT!
Score: 76-67

[03:38] Team_001 possession (Score: 76-67)
Dirk Young loses the ball! Stripped by Shaquille Ball! TURNOVER! (live ball)

[03:22] Team_095 possession (Score: 76-67)
Shaquille Ball attempts a Midrange. Contested by Dirk Young (3.7 feet, MAN). Shaquille Ball misses. Rebound secured by Cole Ball.

[03:04] Team_001 possession (Score: 76-67)
FOUL! Shooting foul on Dejounte Hyland. Cole Ball to the line for 3 free throws. [Team fouls: 3] (Dejounte Hyland: 1 personal fouls)   FT 1/3: GOOD   FT 2/3: GOOD   FT 3/3: GOOD Cole Ball makes 3/3 from the line.
Score: 76-70

[02:51] Team_095 possession (Score: 76-70)
Evan Carter makes the Layup and draws the foul on Cole Ball! And-1! Evan Carter to the line for 1. [BONUS: 5 team fouls] (Cole Ball: 1 personal fouls)   FT 1/1: GOOD Evan Carter makes 1/1 from the line.
Score: 79-70

[02:34] Team_001 possession (Score: 79-70)
Klay Harden attempts a Layup. Contested by Dejounte Hyland (5.0 feet, MAN). KLAY HARDEN MAKES IT!
Score: 79-72

[02:22] Team_095 possession (Score: 79-72)
Kyrie Ming drives to the basket... Kyrie Ming commits a violation (traveling/carry)! TURNOVER! (dead ball)

[02:22] Substitution (Team_095): Dejounte Hyland OUT → Kyle Poole IN (stamina_rule2)

[02:22] Substitution (Team_095): Evan Carter OUT → Tobias Wagner IN (stamina_rule2)

[02:22] Substitution (Team_095): Immanuel Middleton OUT → Gary Davis IN (stamina_rule2)

[02:22] Substitution (Team_095): Kyrie Ming OUT → DeMar McCollum IN (stamina_rule2)

[02:22] Substitution (Team_001): Klay Harden OUT → Ja Dosunmu IN (stamina_rule2)

[02:22] Substitution (Team_001): Dirk Young OUT → Rudy George IN (stamina_rule2)

[02:22] Substitution (Team_001): Miles Griffin OUT → Kristaps Ming IN (stamina_rule2)

[02:11] Team_001 possession (Score: 79-72)
Rudy George drives to the basket... Rudy George throws a bad pass! Stolen by DeMar McCollum! TURNOVER! (live ball)

[01:52] Team_095 possession (Score: 79-72)
Gary Davis attempts a 3Pt. Contested by Ja Dosunmu (3.8 feet, ZONE). GARY DAVIS MAKES IT! Assist: Shaquille Ball
Score: 82-72

[01:37] Team_001 possession (Score: 82-72)
Rudy George drives to the basket... Rudy George throws a bad pass! Stolen by DeMar McCollum! TURNOVER! (live ball)

[01:21] Team_095 possession (Score: 82-72)
Tobias Wagner drives, Cole Ball stays with him. Tobias Wagner attempts a Layup. Contested by Cole Ball (3.8 feet, MAN). TOBIAS WAGNER MAKES IT! Assist: Gary Davis
Score: 84-72

[01:05] Team_001 possession (Score: 84-72)
FOUL! Shooting foul on Shaquille Ball. Dejounte McCollum to the line for 2 free throws. [Team fouls: 4] (Shaquille Ball: 1 personal fouls)   FT 1/2: GOOD   FT 2/2: GOOD Dejounte McCollum makes 2/2 from the line.
Score: 84-74

[00:56] Team_095 possession (Score: 84-74)
Kyle Poole attempts a 3Pt. Contested by Dejounte McCollum (4.5 feet, ZONE). Kyle Poole misses. Offensive rebound by Tobias Wagner! Tobias Wagner kicks it out.

[00:41] Team_095 possession (Score: 84-74)
DeMar McCollum attempts a 3Pt. Contested by Ja Dosunmu (4.6 feet, ZONE). DEMAR MCCOLLUM MAKES IT! Assist: Shaquille Ball
Score: 87-74

[00:25] Team_001 possession (Score: 87-74)
FOUL! Shooting foul on Shaquille Ball. Rudy George to the line for 2 free throws. [BONUS: 5 team fouls] (Shaquille Ball: 2 personal fouls)   FT 1/2: GOOD   FT 2/2: GOOD Rudy George makes 2/2 from the line.
Score: 87-76

[00:10] Team_095 possession (Score: 87-76)
Shaquille Ball attempts a 3Pt. Contested by Cole Ball (3.6 feet, ZONE). Shaquille Ball misses. Offensive rebound by Tobias Wagner! Tobias Wagner kicks it out.

================================================================================
                              3RD QUARTER COMPLETE                              
================================================================================

3RD QUARTER SCORE: Team_095 25, Team_001 28

BOX SCORE:
================================================================================

Team_095
--------------------------------------------------------------------------------
Player                MIN  PTS  REB  AST  TO      FG   FG%      3P   3P%
--------------------------------------------------------------------------------
Immanuel Middleton     31    8    0    1   0   4/7    57.1     0/0   0.0
Evan Carter            23    8    2    0   0   3/4    75.0     0/0   0.0
Gary Davis              5    3    0    1   0   1/1   100.0     0/0   0.0
DeMar McCollum          5    3    0    0   0   1/1   100.0     0/0   0.0
Tobias Wagner          13    2    2    0   0   1/1   100.0     0/0   0.0
Shaquille Ball         25    0    2    3   0   0/1     0.0     0/0   0.0
Dejounte Hyland        31    0    4    1   0   0/2     0.0     0/0   0.0
Kyrie Ming             31    0    0    0   0   0/3     0.0     0/0   0.0

TEAM: FG: 10/20 (50.0%), 3PT: 3/8 (37.5%), REB: 10 (4 off, 6 def), AST: 6, TO: 2
TEAM FOULS: 5 [Team_001 in BONUS]


Team_001
--------------------------------------------------------------------------------
Player                MIN  PTS  REB  AST  TO      FG   FG%      3P   3P%
--------------------------------------------------------------------------------
Klay Harden            31    8    0    1   0   3/6    50.0     0/0   0.0
Cole Ball              25    6    5    1   0   2/4    50.0     0/0   0.0
Dirk Young             23    6    0    1   0   3/3   100.0     0/0   0.0
Dejounte McCollum      25    4    3    0   0   2/3    66.7     0/0   0.0
Miles Griffin          31    2    3    1   0   1/1   100.0     0/0   0.0
Rudy George            13    2    0    0   0   1/1   100.0     0/0   0.0

TEAM: FG: 12/18 (66.7%), 3PT: 2/5 (40.0%), REB: 11 (1 off, 10 def), AST: 4, TO: 4
TEAM FOULS: 5 [Team_095 in BONUS]

================================================================================

================================================================================
                       4TH QUARTER - Team_095 vs Team_001                       
================================================================================

[12:00] Team_095 possession (Score: 87-76)
FOUL! Offensive foul on Immanuel Middleton! Dejounte McCollum drew the charge! [Team fouls: 1] (Immanuel Middleton: 1 personal fouls) TURNOVER! (dead ball)

[11:45] Team_001 possession (Score: 87-76)
FOUL! Holding foul on Dejounte Hyland. [Team fouls: 2] No free throws, side out. (Dejounte Hyland: 1 personal fouls)

[11:34] Team_001 possession (Score: 87-76)
Dirk Young attempts a 3Pt. Contested by Evan Carter (4.1 feet, ZONE). Dirk Young misses. Rebound secured by Dejounte Hyland.

[11:20] Team_095 possession (Score: 87-76)
Immanuel Middleton drives and kicks out. Evan Carter attempts a Midrange. Contested by Cole Ball (3.5 feet, MAN). EVAN CARTER MAKES IT!
Score: 89-76

[11:05] Team_001 possession (Score: 89-76)
Miles Griffin attempts a Layup. Contested by Kyrie Ming (5.6 feet, MAN). MILES GRIFFIN MAKES IT! Assist: Dirk Young
Score: 89-78

[10:51] Team_095 possession (Score: 89-78)
Dejounte Hyland drives to the basket... Dejounte Hyland loses the ball! Stripped by Klay Harden! TURNOVER! (live ball)

[10:33] Team_001 possession (Score: 89-78)
Dirk Young makes the Midrange and draws the foul on Shaquille Ball! And-1! Dirk Young to the line for 1. [Team fouls: 3] (Shaquille Ball: 1 personal fouls)   FT 1/1: GOOD Dirk Young makes 1/1 from the line.
Score: 89-81

[10:19] Team_095 possession (Score: 89-81)
Dejounte Hyland attempts a 3Pt. Contested by Klay Harden (4.1 feet, ZONE). Dejounte Hyland misses. Offensive rebound by Evan Carter! Evan Carter's putback is no good. Offensive rebound by Evan Carter! Evan Carter kicks it out.

[10:07] Team_095 possession (Score: 89-81)
Shaquille Ball attempts a Layup. Contested by Miles Griffin (4.2 feet, ZONE). SHAQUILLE BALL MAKES IT! Assist: Kyrie Ming
Score: 91-81

[09:49] Team_001 possession (Score: 91-81)
Klay Harden attempts a Midrange. Contested by Dejounte Hyland (4.9 feet, MAN). KLAY HARDEN MAKES IT!
Score: 91-83

[09:36] Team_095 possession (Score: 91-83)
Dejounte Hyland attempts a 3Pt. Contested by Klay Harden (4.1 feet, ZONE). Dejounte Hyland misses. Rebound secured by Cole Ball.

[09:18] Team_001 possession (Score: 91-83)
FOUL! Holding foul on Immanuel Middleton. [Team fouls: 4] No free throws, side out. (Immanuel Middleton: 2 personal fouls)

[09:07] Team_001 possession (Score: 91-83)
Cole Ball drives to the basket... FOUL! Offensive foul on Cole Ball! Evan Carter drew the charge! [Team fouls: 1] (Cole Ball: 1 personal fouls) TURNOVER! (dead ball)

[08:53] Team_095 possession (Score: 91-83)
Shaquille Ball attempts a 3Pt. Contested by Dirk Young (3.8 feet, MAN). Shaquille Ball misses. Offensive rebound by Dejounte Hyland! Dejounte Hyland kicks it out.

[08:42] Team_095 possession (Score: 91-83)
Dejounte Hyland attempts a 3Pt. Contested by Klay Harden (4.2 feet, ZONE). Dejounte Hyland misses. Rebound secured by Dejounte McCollum.

[08:29] Team_001 possession (Score: 91-83)
FOUL! Shooting foul on Dejounte Hyland. Dejounte McCollum to the line for 2 free throws. [BONUS: 5 team fouls] (Dejounte Hyland: 2 personal fouls)   FT 1/2: MISS   FT 2/2: GOOD Dejounte McCollum makes 1/2 from the line.
Score: 91-84

[08:11] Team_095 possession (Score: 91-84)
Kyrie Ming drives and kicks out. Dejounte Hyland attempts a Midrange. Contested by Klay Harden (4.4 feet, ZONE). Dejounte Hyland misses. Offensive rebound by Dejounte Hyland! Dejounte Hyland kicks it out.

[07:57] Team_095 possession (Score: 91-84)
Shaquille Ball makes the Midrange and draws the foul on Dirk Young! And-1! Shaquille Ball to the line for 1. [Team fouls: 2] (Dirk Young: 1 personal fouls)   FT 1/1: GOOD Shaquille Ball makes 1/1 from the line.
Score: 94-84

[07:43] Team_001 possession (Score: 94-84)
FOUL! Holding foul on Evan Carter. [IN THE BONUS! 6 team fouls] Cole Ball to the line for 2 free throws. (Evan Carter: 1 personal fouls)   FT 1/2: GOOD   FT 2/2: GOOD Cole Ball makes 2/2 from the line.
Score: 94-86

[07:31] Team_095 possession (Score: 94-86)
Dejounte Hyland drives, Miles Griffin stays with him. Dejounte Hyland attempts a Layup. Contested by Miles Griffin (4.5 feet, ZONE). DEJOUNTE HYLAND MAKES IT! Assist: Shaquille Ball
Score: 96-86

[07:15] Team_001 possession (Score: 96-86)
Miles Griffin attempts a Midrange. Contested by Immanuel Middleton (5.8 feet, ZONE). Miles Griffin misses. Rebound secured by Kyrie Ming.

[06:59] Team_095 possession (Score: 96-86)
Evan Carter attempts a 3Pt. Contested by Klay Harden (4.7 feet, ZONE). Evan Carter misses. Offensive rebound by Dejounte Hyland! Dejounte Hyland kicks it out.

[06:42] Team_095 possession (Score: 96-86)
Kyrie Ming attempts a Layup. Contested by Miles Griffin (4.8 feet, ZONE). KYRIE MING MAKES IT!
Score: 98-86

[06:24] Team_001 possession (Score: 98-86)
Dejounte McCollum drives, Immanuel Middleton stays with him. Dejounte McCollum attempts a Layup. Contested by Immanuel Middleton (5.3 feet, MAN). DEJOUNTE MCCOLLUM MAKES IT!
Score: 98-88

[06:14] Team_095 possession (Score: 98-88)
FOUL! Holding foul on Cole Ball. [Team fouls: 3] No free throws, side out. (Cole Ball: 2 personal fouls)

[06:00] Team_095 possession (Score: 98-88)
Dejounte Hyland makes the Dunk and draws the foul on Klay Harden! And-1! Dejounte Hyland to the line for 1. [Team fouls: 4] (Klay Harden: 1 personal fouls)   FT 1/1: GOOD Dejounte Hyland makes 1/1 from the line.
Score: 101-88

[05:46] Team_001 possession (Score: 101-88)
Cole Ball attempts a 3Pt. Contested by Evan Carter (4.2 feet, ZONE). Cole Ball misses. Rebound secured by Kyrie Ming.

[05:30] Team_095 possession (Score: 101-88)
Immanuel Middleton attempts a Midrange. Contested by Dejounte McCollum (4.8 feet, MAN). IMMANUEL MIDDLETON MAKES IT!
Score: 103-88

[05:12] Team_001 possession (Score: 103-88)
Klay Harden attempts a 3Pt. Contested by Evan Carter (4.5 feet, ZONE). Klay Harden misses. Rebound secured by Dejounte Hyland.

[05:00] Team_095 possession (Score: 103-88)
FOUL! Shooting foul on Klay Harden. Dejounte Hyland to the line for 2 free throws. [BONUS: 5 team fouls] (Klay Harden: 2 personal fouls)   FT 1/2: GOOD   FT 2/2: MISS Dejounte Hyland makes 1/2 from the line. Offensive rebound by Dejounte Hyland! Dejounte Hyland kicks it out.
Score: 104-88

[04:48] Team_095 possession (Score: 104-88)
Kyrie Ming drives and kicks out. Dejounte Hyland attempts a 3Pt. Contested by Klay Harden (4.9 feet, MAN). Dejounte Hyland misses. Rebound secured by Cole Ball.

[04:34] Team_001 possession (Score: 104-88)
Dirk Young attempts a 3Pt. Contested by Shaquille Ball (5.7 feet, MAN). Dirk Young misses. Rebound secured by Evan Carter.

[04:20] Team_095 possession (Score: 104-88)
Dejounte Hyland makes the Layup and draws the foul on Klay Harden! And-1! Dejounte Hyland to the line for 1. [BONUS: 6 team fouls] (Klay Harden: 3 personal fouls)   FT 1/1: GOOD Dejounte Hyland makes 1/1 from the line.
Score: 107-88

[04:09] Team_001 possession (Score: 107-88)
Klay Harden drives, picks up Dejounte Hyland. Help arrives from Evan Carter! Klay Harden attempts a Dunk. Contested by Evan Carter (5.6 feet, MAN). KLAY HARDEN MAKES IT! Assist: Miles Griffin
Score: 107-90

[03:55] Team_095 possession (Score: 107-90)
Shaquille Ball attempts a 3Pt. Contested by Klay Harden (4.9 feet, ZONE). Shaquille Ball misses. Rebound secured by Cole Ball.

[03:44] Team_001 possession (Score: 107-90)
Klay Harden attempts a Midrange. Contested by Immanuel Middleton (5.8 feet, ZONE). KLAY HARDEN MAKES IT! Assist: Cole Ball
Score: 107-92

[03:34] Team_095 possession (Score: 107-92)
Shaquille Ball drives and kicks out. Evan Carter attempts a 3Pt. Contested by Dirk Young (4.7 feet, ZONE). Evan Carter misses. Offensive rebound by Evan Carter! Evan Carter kicks it out.

[03:18] Team_095 possession (Score: 107-92)
Kyrie Ming makes the Dunk and draws the foul on Miles Griffin! And-1! Kyrie Ming to the line for 1. [BONUS: 7 team fouls] (Miles Griffin: 1 personal fouls)   FT 1/1: GOOD Kyrie Ming makes 1/1 from the line.
Score: 110-92

[03:04] Team_001 possession (Score: 110-92)
Dejounte McCollum attempts a Layup. Contested by Immanuel Middleton (5.8 feet, MAN). DEJOUNTE MCCOLLUM MAKES IT! Assist: Miles Griffin
Score: 110-94

[02:55] Team_095 possession (Score: 110-94)
Kyrie Ming attempts a Midrange. Contested by Miles Griffin (5.4 feet, MAN). Kyrie Ming misses. Rebound secured by Cole Ball.

[02:37] Team_001 possession (Score: 110-94)
Klay Harden attempts a Layup. Contested by Immanuel Middleton (5.9 feet, ZONE). KLAY HARDEN MAKES IT! Assist: Dirk Young
Score: 110-96

[02:20] Team_095 possession (Score: 110-96)
Kyrie Ming drives and kicks out. Evan Carter attempts a 3Pt. Contested by Klay Harden (5.4 feet, ZONE). Evan Carter misses. Rebound secured by Dejounte McCollum.

[02:06] Team_001 possession (Score: 110-96)
Dejounte McCollum attempts a Midrange. Contested by Shaquille Ball (5.7 feet, ZONE). Dejounte McCollum misses. Rebound secured by Dejounte Hyland.

[01:50] Team_095 possession (Score: 110-96)
Dejounte Hyland attempts a 3Pt. Contested by Klay Harden (5.3 feet, ZONE). Dejounte Hyland misses. FOUL! Loose ball foul on Cole Ball during the rebound battle. [IN THE BONUS! 8 team fouls] Evan Carter to the line for 2 free throws. (Cole Ball: 3 personal fouls)   FT 1/2: GOOD   FT 2/2: GOOD Evan Carter makes 2/2 from the line.
Score: 112-96

[01:32] Team_001 possession (Score: 112-96)
FOUL! Reach-in foul on Kyrie Ming during the drive. [IN THE BONUS! 7 team fouls] Miles Griffin to the line for 2 free throws. (Kyrie Ming: 1 personal fouls)   FT 1/2: GOOD   FT 2/2: GOOD Miles Griffin makes 2/2 from the line.
Score: 112-98

[01:15] Team_095 possession (Score: 112-98)
FOUL! Shooting foul on Dirk Young. Shaquille Ball to the line for 2 free throws. [BONUS: 9 team fouls] (Dirk Young: 2 personal fouls)   FT 1/2: GOOD   FT 2/2: GOOD Shaquille Ball makes 2/2 from the line.
Score: 114-98

[01:02] Team_001 possession (Score: 114-98)
Dejounte McCollum attempts a 3Pt. Wide open! Immanuel Middleton is 6.1 feet away. [MAN] Dejounte McCollum misses. Rebound secured by Dejounte Hyland.

[00:48] Team_095 possession (Score: 114-98)
Kyrie Ming attempts a Layup. Contested by Miles Griffin (5.7 feet, MAN). KYRIE MING MAKES IT!
Score: 116-98

[00:32] Team_001 possession (Score: 116-98)
Dejounte McCollum drives, picks up Immanuel Middleton. Help arrives from Dejounte Hyland! Dejounte McCollum attempts a Layup. Wide open! Dejounte Hyland is 6.2 feet away. [ZONE] Dejounte McCollum misses. Rebound secured by Evan Carter.

[00:19] Team_095 possession (Score: 116-98)
Kyrie Ming attempts a Midrange. BLOCKED BY MILES GRIFFIN! Ball goes out off Miles Griffin. Kyrie Ming's ball!

[00:08] Team_095 possession (Score: 116-98)
FOUL! Shooting foul on Klay Harden. Evan Carter to the line for 3 free throws. [BONUS: 10 team fouls] (Klay Harden: 4 personal fouls)   FT 1/3: MISS   FT 2/3: GOOD   FT 3/3: GOOD Evan Carter makes 2/3 from the line.
Score: 118-98

================================================================================
                              4TH QUARTER COMPLETE                              
================================================================================

4TH QUARTER SCORE: Team_095 31, Team_001 22

BOX SCORE:
================================================================================

Team_095
--------------------------------------------------------------------------------
Player                MIN  PTS  REB  AST  TO      FG   FG%      3P   3P%
--------------------------------------------------------------------------------
Dejounte Hyland        43    8    8    0   0   3/5    60.0     0/0   0.0
Shaquille Ball         37    7    0    1   0   3/4    75.0     0/0   0.0
Kyrie Ming             43    7    2    1   0   3/6    50.0     0/0   0.0
Evan Carter            35    6    4    0   0   3/3   100.0     0/0   0.0
Immanuel Middleton     43    2    0    0   0   1/1   100.0     0/0   0.0

TEAM: FG: 13/19 (68.4%), 3PT: 2/5 (40.0%), REB: 14 (6 off, 8 def), AST: 2, TO: 2
TEAM FOULS: 7 [Team_001 in BONUS]


Team_001
--------------------------------------------------------------------------------
Player                MIN  PTS  REB  AST  TO      FG   FG%      3P   3P%
--------------------------------------------------------------------------------
Klay Harden            43    8    0    0   0   4/5    80.0     0/0   0.0
Dejounte McCollum      37    5    2    0   0   3/6    50.0     0/0   0.0
Miles Griffin          43    4    0    2   0   2/3    66.7     0/0   0.0
Dirk Young             35    3    0    2   0   1/3    33.3     0/0   0.0
Cole Ball              37    2    4    1   0   1/2    50.0     0/0   0.0

TEAM: FG: 11/19 (57.9%), 3PT: 0/5 (0.0%), REB: 6 (0 off, 6 def), AST: 5, TO: 1
TEAM FOULS: 10 [Team_095 in BONUS]

================================================================================

================================================================================
                               FULL GAME COMPLETE                               
================================================================================

FINAL SCORE: Team_095 118, Team_001 98

SCORING BY QUARTER:
--------------------------------------------------------------------------------
Team                     Q1     Q2     Q3     Q4    FINAL
--------------------------------------------------------------------------------
Team_095                 31     31     25     31      118
Team_001                 24     24     28     22       98
--------------------------------------------------------------------------------

FULL GAME BOX SCORE:
================================================================================

Team_095
--------------------------------------------------------------------------------
Player                MIN  PTS  REB  AST  TO      FG   FG%      3P   3P%      FT STL BLK
--------------------------------------------------------------------------------
Dejounte Hyland        43   13   21    2   1   6/14   42.9   1/6    16.7   7/9     0   0
Immanuel Middleton     43   27    0    1   3  12/16   75.0   1/2    50.0   6/6     0   1
Kyrie Ming             43   19    3    5   3   8/17   47.1   1/3    33.3   4/4     0   0
Shaquille Ball         37   17    8    5   2   7/11   63.6   2/3    66.7   6/6     2   0
Evan Carter            35   25    9    3   0   8/11   72.7   4/5    80.0   6/7     0   0
Tobias Wagner          13    6    6    1   1   2/3    66.7   1/1   100.0   1/1     1   0
Cade Beal              11    3    1    2   0   2/4    50.0   1/2    50.0   0/0     0   0
Kyle Poole              5    0    0    1   0   0/0     0.0   0/0     0.0   0/0     0   0
Gary Davis              5    3    1    1   1   1/1   100.0   1/1   100.0   0/0     0   0
DeMar McCollum          5    3    0    0   0   1/3    33.3   1/3    33.3   0/0     2   0

TEAM: FG: 47/80 (58.8%), 3PT: 13/26 (50.0%), REB: 50 (14 off, 36 def), AST: 21, TO: 11


Team_001
--------------------------------------------------------------------------------
Player                MIN  PTS  REB  AST  TO      FG   FG%      3P   3P%      FT STL BLK
--------------------------------------------------------------------------------
Klay Harden            43   31    1    3   1  12/21   57.1   2/9    22.2   3/4     1   0
Miles Griffin          43   12    8    7   0   5/8    62.5   1/1   100.0   3/3     3   1
Cole Ball              37   10   16    3   2   3/11   27.3   1/5    20.0   8/8     0   0
Dejounte McCollum      37   12    7    1   0   9/14   64.3   0/2     0.0   6/9     0   0
Dirk Young             35   14    0    4   3   6/12   50.0   1/7    14.3   1/1     1   0
Rudy George            13    2    3    1   0   1/1   100.0   0/0     0.0   2/2     0   0
Larry Trent            11    7    1    2   1   2/5    40.0   0/3     0.0   0/0     0   0
Franz Bryant           11    4    0    0   0   2/4    50.0   0/1     0.0   0/0     1   0
Ja Dosunmu              5    0    0    1   0   0/0     0.0   0/0     0.0   0/0     0   0
Kristaps Ming           5    2    0    0   2   1/2    50.0   0/1     0.0   0/0     1   0

TEAM: FG: 42/79 (53.2%), 3PT: 5/29 (17.2%), REB: 35 (3 off, 32 def), AST: 22, TO: 9

================================================================================
