================================================================================
                        FULL GAME - Team_011 vs Team_065                        
================================================================================

================================================================================
                       1ST QUARTER - Team_011 vs Team_065                       
================================================================================

[12:00] Team_011 possession (Score: 0-0)
Pau Barnes attempts a Midrange. Contested by Russell Wade (3.7 feet, MAN). PAU BARNES MAKES IT! Assist: Magic Tatum
Score: 2-0

[11:44] Team_065 possession (Score: 2-0)
RJ Harden attempts a 3Pt. Contested by Magic Tatum (3.9 feet, ZONE). RJ Harden misses. Rebound secured by Evan George.

[11:31] Team_011 possession (Score: 2-0)
Trae Tatum attempts a Midrange. Contested by Paul Williamson (3.3 feet, MAN). Trae Tatum misses. Rebound secured by Russell Wade.

[11:12] Team_065 possession (Score: 2-0)
Paul Williamson drives to the basket... Paul Williamson throws a bad pass out of bounds! TURNOVER! (dead ball)

[10:58] Team_011 possession (Score: 2-0)
Pau Barnes attempts a Layup. Contested by Russell Wade (3.7 feet, ZONE). PAU BARNES MAKES IT! Assist: Evan George
Score: 4-0

[10:43] Team_065 possession (Score: 4-0)
Russell Wade attempts a 3Pt. Contested by Pau Barnes (3.0 feet, MAN). Russell Wade misses. FOUL! Loose ball foul on Michael Carter during the rebound battle. [Team fouls: 1] No free throws, side out. (Michael Carter: 1 personal fouls)

[10:25] Team_065 possession (Score: 4-0)
Paul Williamson attempts a 3Pt. Contested by Magic Tatum (3.6 feet, ZONE). Paul Williamson misses. Rebound secured by Pau Barnes.

[10:08] Team_011 possession (Score: 4-0)
Magic Tatum makes the Midrange and draws the foul on RJ Harden! And-1! Magic Tatum to the line for 1. [Team fouls: 1] (RJ Harden: 1 personal fouls)   FT 1/1: GOOD Magic Tatum makes 1/1 from the line.
Score: 7-0

[09:53] Team_065 possession (Score: 7-0)
FOUL! Shooting foul on Pau Barnes. Russell Wade to the line for 2 free throws. [Team fouls: 2] (Pau Barnes: 1 personal fouls)   FT 1/2: GOOD   FT 2/2: GOOD Russell Wade makes 2/2 from the line.
Score: 7-2

[09:39] Team_011 possession (Score: 7-2)
Michael Carter attempts a 3Pt. Contested by RJ Harden (3.8 feet, ZONE). Michael Carter misses. Rebound secured by RJ Harden.

[09:27] Team_065 possession (Score: 7-2)
RJ Harden attempts a 3Pt. Contested by Magic Tatum (3.9 feet, ZONE). RJ Harden misses. Offensive rebound by Manu McGrady! Manu McGrady kicks it out.

[09:08] Team_065 possession (Score: 7-2)
FOUL! Shooting foul on Magic Tatum. Manu McGrady to the line for 2 free throws. [Team fouls: 3] (Magic Tatum: 1 personal fouls)   FT 1/2: GOOD   FT 2/2: GOOD Manu McGrady makes 2/2 from the line.
Score: 7-4

[08:56] Team_011 possession (Score: 7-4)
Evan George makes the Layup and draws the foul on Russell Wade! And-1! Evan George to the line for 1. [Team fouls: 2] (Russell Wade: 1 personal fouls)   FT 1/1: GOOD Evan George makes 1/1 from the line.
Score: 10-4

[08:42] Team_065 possession (Score: 10-4)
Karl Booker drives, picks up Pau Barnes. Help arrives from Magic Tatum! Karl Booker attempts a Layup. Contested by Magic Tatum (2.9 feet, MAN). KARL BOOKER MAKES IT!
Score: 10-6

[08:25] Team_011 possession (Score: 10-6)
Trae Tatum attempts a 3Pt. Contested by RJ Harden (3.8 feet, ZONE). Trae Tatum misses. FOUL! Loose ball foul on Manu McGrady during the rebound battle. [Team fouls: 3] No free throws, side out. (Manu McGrady: 1 personal fouls)

[08:12] Team_011 possession (Score: 10-6)
Magic Tatum attempts a 3Pt. Contested by Russell Wade (3.2 feet, ZONE). Magic Tatum misses. Rebound secured by Russell Wade.

[08:02] Team_065 possession (Score: 10-6)
Karl Booker drives and kicks out. FOUL! Shooting foul on Magic Tatum. Paul Williamson to the line for 3 free throws. [Team fouls: 4] (Magic Tatum: 2 personal fouls)   FT 1/3: GOOD   FT 2/3: GOOD   FT 3/3: GOOD Paul Williamson makes 3/3 from the line.
Score: 10-9

[07:46] Team_011 possession (Score: 10-9)
Trae Tatum attempts a 3Pt. Contested by Paul Williamson (3.3 feet, MAN). Trae Tatum misses. Rebound secured by Russell Wade.

[07:30] Team_065 possession (Score: 10-9)
Russell Wade attempts a Midrange. Contested by Michael Carter (4.2 feet, ZONE). RUSSELL WADE MAKES IT!
Score: 10-11

[07:14] Team_011 possession (Score: 10-11)
Trae Tatum attempts a 3Pt. Contested by RJ Harden (3.8 feet, ZONE). Trae Tatum misses. Rebound secured by RJ Harden.

[07:00] Team_065 possession (Score: 10-11)
RJ Harden drives and kicks out. Karl Booker attempts a 3Pt. Contested by Magic Tatum (3.4 feet, ZONE). KARL BOOKER MAKES IT! Assist: RJ Harden
Score: 10-14

[06:44] Team_011 possession (Score: 10-14)
FOUL! Reach-in foul on Russell Wade during the drive. [Team fouls: 4] No free throws, side out. (Russell Wade: 2 personal fouls)

[06:28] Team_011 possession (Score: 10-14)
Trae Tatum attempts a Midrange. Contested by Paul Williamson (3.3 feet, MAN). Trae Tatum misses. FOUL! Loose ball foul on Manu McGrady during the rebound battle. [IN THE BONUS! 5 team fouls] Evan George to the line for 2 free throws. (Manu McGrady: 2 personal fouls)   FT 1/2: GOOD   FT 2/2: MISS Evan George makes 1/2 from the line. Rebound secured by RJ Harden.
Score: 11-14

[06:11] Team_065 possession (Score: 11-14)
Paul Williamson attempts a 3Pt. Contested by Magic Tatum (3.6 feet, ZONE). PAUL WILLIAMSON MAKES IT!
Score: 11-17

[05:56] Team_011 possession (Score: 11-17)
Michael Carter drives, picks up Manu McGrady. Help arrives from Paul Williamson! Michael Carter attempts a Layup. Contested by Paul Williamson (4.5 feet, MAN). MICHAEL CARTER MAKES IT! Assist: Trae Tatum
Score: 13-17

[05:43] Team_065 possession (Score: 13-17)
Russell Wade loses the ball! Stripped by Pau Barnes! TURNOVER! (live ball)

[05:30] Team_011 possession (Score: 13-17)
Magic Tatum attempts a 3Pt. Contested by RJ Harden (4.0 feet, ZONE). Magic Tatum misses. Rebound secured by RJ Harden.

[05:14] Team_065 possession (Score: 13-17)
Paul Williamson attempts a 3Pt. Contested by Trae Tatum (4.7 feet, MAN). Paul Williamson misses. Rebound secured by Michael Carter.

[04:57] Team_011 possession (Score: 13-17)
Evan George drives to the basket... Evan George loses the ball! Stripped by Russell Wade! TURNOVER! (live ball)

[04:44] Team_065 possession (Score: 13-17)
Paul Williamson attempts a Midrange. Contested by Trae Tatum (4.8 feet, MAN). Paul Williamson misses. Rebound secured by Evan George.

[04:29] Team_011 possession (Score: 13-17)
Evan George attempts a Midrange. Contested by Russell Wade (3.3 feet, ZONE). Evan George misses. Offensive rebound by Evan George! Evan George puts it back in!
Score: 15-17

[04:15] Team_065 possession (Score: 15-17)
FOUL! Shooting foul on Pau Barnes. Karl Booker to the line for 2 free throws. [BONUS: 5 team fouls] (Pau Barnes: 2 personal fouls)   FT 1/2: GOOD   FT 2/2: MISS Karl Booker makes 1/2 from the line. Rebound secured by Evan George.
Score: 15-18

[04:01] Team_011 possession (Score: 15-18)
Michael Carter attempts a Midrange. Contested by Manu McGrady (4.5 feet, MAN). MICHAEL CARTER MAKES IT! Assist: Trae Tatum
Score: 17-18

[03:46] Team_065 possession (Score: 17-18)
Manu McGrady attempts a Midrange. Contested by Michael Carter (4.2 feet, MAN). MANU MCGRADY MAKES IT! Assist: Paul Williamson
Score: 17-20

[03:31] Team_011 possession (Score: 17-20)
Michael Carter attempts a 3Pt. Contested by Manu McGrady (4.6 feet, ZONE). Michael Carter misses. Rebound secured by Russell Wade.

[03:18] Team_065 possession (Score: 17-20)
FOUL! Shooting foul on Magic Tatum. Russell Wade to the line for 2 free throws. [BONUS: 6 team fouls] (Magic Tatum: 3 personal fouls)   FT 1/2: GOOD   FT 2/2: GOOD Russell Wade makes 2/2 from the line.
Score: 17-22

[03:05] Team_011 possession (Score: 17-22)
Magic Tatum attempts a Layup. BLOCKED BY RJ HARDEN! Ball is loose! Offensive rebound by Evan George! Evan George kicks it out.

[02:52] Team_011 possession (Score: 17-22)
Michael Carter attempts a 3Pt. Contested by RJ Harden (3.9 feet, ZONE). Michael Carter misses. Rebound secured by RJ Harden.

[02:35] Team_065 possession (Score: 17-22)
RJ Harden commits a violation (traveling/carry)! TURNOVER! (dead ball)

[02:35] Substitution (Team_011): Trae Tatum OUT → De'Aaron George IN (stamina_rule2)

[02:35] Substitution (Team_011): Pau Barnes OUT → Russell Davis IN (stamina_rule2)

[02:35] Substitution (Team_011): Evan George OUT → Pau Towns IN (stamina_rule2)

[02:22] Team_011 possession (Score: 17-22)
De'Aaron George attempts a 3Pt. Contested by Paul Williamson (3.9 feet, MAN). DE'AARON GEORGE MAKES IT! Assist: Magic Tatum
Score: 20-22

[02:08] Team_065 possession (Score: 20-22)
RJ Harden attempts a 3Pt. Contested by Magic Tatum (4.1 feet, ZONE). RJ Harden misses. Rebound secured by Michael Carter.

[01:54] Team_011 possession (Score: 20-22)
Magic Tatum attempts a 3Pt. Contested by RJ Harden (4.3 feet, MAN). Magic Tatum misses. Offensive rebound by Pau Towns! Pau Towns kicks it out.

[01:40] Team_011 possession (Score: 20-22)
De'Aaron George attempts a 3Pt. Contested by Paul Williamson (4.0 feet, MAN). De'Aaron George misses. Offensive rebound by Pau Towns! Pau Towns kicks it out.

[01:27] Team_011 possession (Score: 20-22)
Russell Davis attempts a 3Pt. Contested by RJ Harden (3.8 feet, ZONE). Russell Davis misses. Rebound secured by Manu McGrady.

[01:09] Team_065 possession (Score: 20-22)
Russell Wade drives and kicks out. Karl Booker attempts a 3Pt. Contested by Pau Towns (5.0 feet, MAN). Karl Booker misses. Rebound secured by Pau Towns.

[00:58] Team_011 possession (Score: 20-22)
Michael Carter attempts a 3Pt. Contested by Manu McGrady (4.8 feet, MAN). MICHAEL CARTER MAKES IT! Assist: Pau Towns
Score: 23-22

[00:46] Team_065 possession (Score: 23-22)
FOUL! Shooting foul on Michael Carter. Manu McGrady to the line for 3 free throws. [BONUS: 7 team fouls] (Michael Carter: 2 personal fouls)   FT 1/3: GOOD   FT 2/3: GOOD   FT 3/3: GOOD Manu McGrady makes 3/3 from the line.
Score: 23-25

[00:36] Team_011 possession (Score: 23-25)
Russell Davis drives, Russell Wade stays with him. Russell Davis attempts a Layup. Contested by Russell Wade (3.1 feet, ZONE). RUSSELL DAVIS MAKES IT! Assist: Pau Towns
Score: 25-25

[00:20] Team_065 possession (Score: 25-25)
FOUL! Shooting foul on Michael Carter. RJ Harden to the line for 2 free throws. [BONUS: 8 team fouls] (Michael Carter: 3 personal fouls)   FT 1/2: GOOD   FT 2/2: MISS RJ Harden makes 1/2 from the line. Rebound secured by Russell Davis.
Score: 25-26

[00:10] Team_011 possession (Score: 25-26)
FOUL! Shooting foul on Manu McGrady. Michael Carter to the line for 2 free throws. [BONUS: 6 team fouls] (Manu McGrady: 3 personal fouls)   FT 1/2: GOOD   FT 2/2: GOOD Michael Carter makes 2/2 from the line.
Score: 27-26

================================================================================
                              1ST QUARTER COMPLETE                              
================================================================================

1ST QUARTER SCORE: Team_011 27, Team_065 26

BOX SCORE:
================================================================================

Team_011
--------------------------------------------------------------------------------
Player                MIN  PTS  REB  AST  TO      FG   FG%      3P   3P%
--------------------------------------------------------------------------------
Michael Carter         12    9    2    0   0   4/7    57.1     0/0   0.0
Evan George            10    5    6    1   0   2/2   100.0     0/0   0.0
Pau Barnes             10    4    1    0   0   2/2   100.0     0/0   0.0
Magic Tatum            12    3    0    2   0   1/3    33.3     0/0   0.0
De'Aaron George         2    3    0    0   0   1/1   100.0     0/0   0.0
Russell Davis           2    2    1    0   0   1/2    50.0     0/0   0.0
Trae Tatum             10    0    0    2   0   0/4     0.0     0/0   0.0
Pau Towns               2    0    3    2   0   0/0     0.0     0/0   0.0

TEAM: FG: 11/21 (52.4%), 3PT: 2/10 (20.0%), REB: 14 (6 off, 8 def), AST: 7, TO: 1
TEAM FOULS: 8 [Team_065 in BONUS]


Team_065
--------------------------------------------------------------------------------
Player                MIN  PTS  REB  AST  TO      FG   FG%      3P   3P%
--------------------------------------------------------------------------------
Manu McGrady           12    7    3    0   0   3/3   100.0     0/0   0.0
Russell Wade           12    6    4    0   0   3/4    75.0     0/0   0.0
Paul Williamson        12    6    0    1   0   2/5    40.0     0/0   0.0
Karl Booker            12    5    0    0   0   2/3    66.7     0/0   0.0
RJ Harden              12    0    5    1   0   0/3     0.0     0/0   0.0

TEAM: FG: 10/18 (55.6%), 3PT: 2/6 (33.3%), REB: 11 (2 off, 9 def), AST: 2, TO: 3
TEAM FOULS: 6 [Team_011 in BONUS]

================================================================================

================================================================================
                       2ND QUARTER - Team_011 vs Team_065                       
================================================================================

[12:00] Team_011 possession (Score: 27-26)
Evan George attempts a 3Pt. Contested by RJ Harden (4.4 feet, ZONE). EVAN GEORGE MAKES IT! Assist: Michael Carter
Score: 30-26

[11:47] Team_065 possession (Score: 30-26)
FOUL! Shooting foul on Pau Barnes. Karl Booker to the line for 2 free throws. [Team fouls: 1] (Pau Barnes: 1 personal fouls)   FT 1/2: GOOD   FT 2/2: GOOD Karl Booker makes 2/2 from the line.
Score: 30-28

[11:36] Team_011 possession (Score: 30-28)
Michael Carter attempts a Midrange. Contested by Manu McGrady (4.7 feet, MAN). MICHAEL CARTER MAKES IT! Assist: Magic Tatum
Score: 32-28

[11:19] Team_065 possession (Score: 32-28)
Karl Booker drives and kicks out. Manu McGrady attempts a 3Pt. Contested by Magic Tatum (3.8 feet, ZONE). Manu McGrady misses. Rebound secured by Evan George.

[11:07] Team_011 possession (Score: 32-28)
FOUL! Shooting foul on Russell Wade. Trae Tatum to the line for 2 free throws. [Team fouls: 1] (Russell Wade: 1 personal fouls)   FT 1/2: GOOD   FT 2/2: GOOD Trae Tatum makes 2/2 from the line.
Score: 34-28

[10:53] Team_065 possession (Score: 34-28)
Karl Booker attempts a Midrange. Contested by Pau Barnes (3.0 feet, MAN). Karl Booker misses. Rebound secured by Pau Barnes.

[10:41] Team_011 possession (Score: 34-28)
Trae Tatum attempts a 3Pt. Contested by Russell Wade (3.4 feet, ZONE). Trae Tatum misses. Rebound secured by Manu McGrady.

[10:23] Team_065 possession (Score: 34-28)
Manu McGrady loses the ball! Stripped by Michael Carter! TURNOVER! (live ball)

[10:09] Team_011 possession (Score: 34-28)
Michael Carter attempts a 3Pt. Contested by Russell Wade (3.4 feet, ZONE). Michael Carter misses. FOUL! Loose ball foul on RJ Harden during the rebound battle. [Team fouls: 2] No free throws, side out. (RJ Harden: 1 personal fouls)

[09:50] Team_011 possession (Score: 34-28)
Pau Barnes makes the Midrange and draws the foul on Russell Wade! And-1! Pau Barnes to the line for 1. [Team fouls: 3] (Russell Wade: 2 personal fouls)   FT 1/1: GOOD Pau Barnes makes 1/1 from the line.
Score: 37-28

[09:36] Team_065 possession (Score: 37-28)
FOUL! Holding foul on Michael Carter. [Team fouls: 2] No free throws, side out. (Michael Carter: 1 personal fouls)

[09:24] Team_065 possession (Score: 37-28)
RJ Harden attempts a 3Pt. Contested by Magic Tatum (4.4 feet, ZONE). RJ Harden misses. Rebound secured by Evan George.

[09:13] Team_011 possession (Score: 37-28)
Magic Tatum drives and kicks out. Evan George attempts a Midrange. Contested by Russell Wade (3.7 feet, MAN). Evan George misses. Rebound secured by Manu McGrady.

[08:59] Team_065 possession (Score: 37-28)
Manu McGrady makes the Layup and draws the foul on Pau Barnes! And-1! Manu McGrady to the line for 1. [Team fouls: 3] (Pau Barnes: 2 personal fouls)   FT 1/1: GOOD Manu McGrady makes 1/1 from the line.
Score: 37-31

[08:48] Team_011 possession (Score: 37-31)
Pau Barnes attempts a 3Pt. Contested by RJ Harden (5.2 feet, ZONE). PAU BARNES MAKES IT! Assist: Trae Tatum
Score: 40-31

[08:35] Team_065 possession (Score: 40-31)
Russell Wade attempts a Midrange. Contested by Pau Barnes (3.4 feet, MAN). Russell Wade misses. Rebound secured by Pau Barnes.

[08:22] Team_011 possession (Score: 40-31)
Evan George drives and kicks out. Michael Carter attempts a Midrange. Contested by Russell Wade (3.9 feet, ZONE). Michael Carter misses. Rebound secured by RJ Harden.

[08:10] Team_065 possession (Score: 40-31)
Karl Booker attempts a Midrange. Contested by Trae Tatum (4.9 feet, ZONE). KARL BOOKER MAKES IT!
Score: 40-33

[07:58] Team_011 possession (Score: 40-33)
Magic Tatum makes the Layup and draws the foul on RJ Harden! And-1! Magic Tatum to the line for 1. [Team fouls: 4] (RJ Harden: 2 personal fouls)   FT 1/1: GOOD Magic Tatum makes 1/1 from the line.
Score: 43-33

[07:39] Team_065 possession (Score: 43-33)
Russell Wade attempts a 3Pt. Contested by Magic Tatum (4.3 feet, ZONE). Russell Wade misses. Offensive rebound by Manu McGrady! Manu McGrady kicks it out.

[07:24] Team_065 possession (Score: 43-33)
Manu McGrady attempts a Midrange. Contested by Michael Carter (5.0 feet, MAN). Manu McGrady misses. Rebound secured by Evan George.

[07:11] Team_011 possession (Score: 43-33)
Michael Carter attempts a 3Pt. Contested by RJ Harden (4.6 feet, ZONE). Michael Carter misses. Offensive rebound by Pau Barnes! Pau Barnes kicks it out.

[07:00] Team_011 possession (Score: 43-33)
Evan George drives and kicks out. Michael Carter attempts a Midrange. Contested by Manu McGrady (5.5 feet, ZONE). Michael Carter misses. Rebound secured by Russell Wade.

[06:42] Team_065 possession (Score: 43-33)
RJ Harden drives to the basket... FOUL! Offensive foul on RJ Harden! Pau Barnes drew the charge! [Team fouls: 5] (RJ Harden: 3 personal fouls) TURNOVER! (dead ball)

[06:27] Team_011 possession (Score: 43-33)
FOUL! Reach-in foul on Russell Wade during the drive. [IN THE BONUS! 6 team fouls] Pau Barnes to the line for 2 free throws. (Russell Wade: 3 personal fouls)   FT 1/2: GOOD   FT 2/2: GOOD Pau Barnes makes 2/2 from the line.
Score: 45-33

[06:14] Team_065 possession (Score: 45-33)
FOUL! Shooting foul on Pau Barnes. Russell Wade to the line for 2 free throws. [Team fouls: 4] (Pau Barnes: 3 personal fouls)   FT 1/2: GOOD   FT 2/2: GOOD Russell Wade makes 2/2 from the line.
Score: 45-35

[05:59] Team_011 possession (Score: 45-35)
Magic Tatum attempts a 3Pt. Contested by RJ Harden (5.0 feet, MAN). Magic Tatum misses. Offensive rebound by Evan George! Evan George's putback is no good. Offensive rebound by Pau Barnes! Pau Barnes kicks it out.

[05:44] Team_011 possession (Score: 45-35)
Trae Tatum makes the Layup and draws the foul on Russell Wade! And-1! Trae Tatum to the line for 1. [BONUS: 7 team fouls] (Russell Wade: 4 personal fouls)   FT 1/1: GOOD Trae Tatum makes 1/1 from the line.
Score: 48-35

[05:27] Team_065 possession (Score: 48-35)
RJ Harden attempts a Midrange. Contested by Michael Carter (5.7 feet, ZONE). RJ Harden misses. Rebound secured by Trae Tatum.

[05:14] Team_011 possession (Score: 48-35)
Pau Barnes makes the Midrange and draws the foul on Russell Wade! And-1! Pau Barnes to the line for 1. [BONUS: 8 team fouls] (Russell Wade: 5 personal fouls)   FT 1/1: GOOD Pau Barnes makes 1/1 from the line.
Score: 51-35

[04:57] Team_065 possession (Score: 51-35)
RJ Harden attempts a Layup. Contested by Magic Tatum (5.0 feet, MAN). RJ HARDEN MAKES IT!
Score: 51-37

[04:44] Team_011 possession (Score: 51-37)
Trae Tatum attempts a Layup. Contested by Paul Williamson (4.7 feet, MAN). TRAE TATUM MAKES IT!
Score: 53-37

[04:33] Team_065 possession (Score: 53-37)
Paul Williamson attempts a Midrange. Contested by Pau Barnes (4.1 feet, ZONE). Paul Williamson misses. Rebound secured by Evan George.

[04:20] Team_011 possession (Score: 53-37)
Evan George drives, picks up Russell Wade. Help arrives from Paul Williamson! Evan George attempts a Layup. Contested by Paul Williamson (4.7 feet, ZONE). EVAN GEORGE MAKES IT! Assist: Michael Carter
Score: 55-37

[04:05] Team_065 possession (Score: 55-37)
Paul Williamson attempts a 3Pt. Contested by Trae Tatum (5.5 feet, MAN). PAUL WILLIAMSON MAKES IT! Assist: Manu McGrady
Score: 55-40

[03:51] Team_011 possession (Score: 55-40)
Trae Tatum makes the 3Pt and draws the foul on Paul Williamson! And-1! Trae Tatum to the line for 1. [BONUS: 9 team fouls] (Paul Williamson: 1 personal fouls)   FT 1/1: GOOD Trae Tatum makes 1/1 from the line.
Score: 59-40

[03:41] Team_065 possession (Score: 59-40)
Karl Booker drives, picks up Pau Barnes. Help arrives from Magic Tatum! Karl Booker attempts a Layup. Contested by Magic Tatum (4.1 feet, MAN). Karl Booker misses. Rebound secured by Pau Barnes.

[03:24] Team_011 possession (Score: 59-40)
Evan George attempts a 3Pt. Contested by RJ Harden (5.5 feet, ZONE). Evan George misses. Rebound secured by Manu McGrady.

[03:09] Team_065 possession (Score: 59-40)
Russell Wade attempts a Midrange. Contested by Pau Barnes (4.3 feet, MAN). Russell Wade misses. Rebound secured by Evan George.

[02:55] Team_011 possession (Score: 59-40)
FOUL! Reach-in foul on Russell Wade during the drive. [IN THE BONUS! 10 team fouls] Evan George to the line for 2 free throws. (Russell Wade: 6 personal fouls) Russell Wade FOULS OUT!   FT 1/2: GOOD   FT 2/2: MISS Evan George makes 1/2 from the line. Offensive rebound by Evan George! Evan George kicks it out.
Score: 60-40

[02:55] Substitution (Team_065): Russell Wade OUT (stamina: 44) → Paul Curry IN (foul_out)

[02:36] Team_011 possession (Score: 60-40)
Evan George attempts a 3Pt. Contested by Paul Curry (4.9 feet, ZONE). Evan George misses. Offensive rebound by Pau Barnes! Pau Barnes kicks it out.

[02:22] Team_011 possession (Score: 60-40)
Pau Barnes drives and kicks out. Michael Carter attempts a 3Pt. Wide open! Manu McGrady is 6.2 feet away. [MAN] Michael Carter misses. Rebound secured by RJ Harden.

[02:10] Team_065 possession (Score: 60-40)
Paul Curry drives to the basket... Paul Curry loses the ball! Stripped by Magic Tatum! TURNOVER! (live ball)

[01:57] Team_011 possession (Score: 60-40)
Magic Tatum attempts a Midrange. Wide open! Manu McGrady is 6.2 feet away. [ZONE] Magic Tatum misses. Rebound secured by Paul Curry.

[01:40] Team_065 possession (Score: 60-40)
FOUL! Shooting foul on Pau Barnes. Paul Curry to the line for 2 free throws. [BONUS: 5 team fouls] (Pau Barnes: 4 personal fouls)   FT 1/2: GOOD   FT 2/2: GOOD Paul Curry makes 2/2 from the line.
Score: 60-42

[01:26] Team_011 possession (Score: 60-42)
Pau Barnes throws a bad pass! Stolen by Karl Booker! TURNOVER! (live ball)

[01:12] Team_065 possession (Score: 60-42)
RJ Harden attempts a 3Pt. Contested by Magic Tatum (5.6 feet, MAN). RJ Harden misses. Rebound secured by Pau Barnes.

[00:57] Team_011 possession (Score: 60-42)
Evan George attempts a 3Pt. Wide open! Manu McGrady is 6.5 feet away. [ZONE] EVAN GEORGE MAKES IT! Assist: Trae Tatum
Score: 63-42

[00:41] Team_065 possession (Score: 63-42)
Karl Booker attempts a 3Pt. Contested by Trae Tatum (5.8 feet, ZONE). KARL BOOKER MAKES IT! Assist: Paul Williamson
Score: 63-45

[00:31] Team_011 possession (Score: 63-45)
Michael Carter drives and kicks out. Michael Carter attempts a 3Pt. Wide open! Manu McGrady is 6.6 feet away. [MAN] Michael Carter misses. Rebound secured by Manu McGrady.

[00:18] Team_065 possession (Score: 63-45)
Paul Williamson attempts a Layup. Wide open! Evan George is 6.5 feet away. [ZONE] PAUL WILLIAMSON MAKES IT! Assist: Karl Booker
Score: 63-47

[00:06] Team_011 possession (Score: 63-47)
FOUL! Offensive foul on Magic Tatum! Paul Curry drew the charge! [Team fouls: 6] (Magic Tatum: 1 personal fouls) TURNOVER! (dead ball)

================================================================================
                              2ND QUARTER COMPLETE                              
================================================================================

2ND QUARTER SCORE: Team_011 36, Team_065 21

BOX SCORE:
================================================================================

Team_011
--------------------------------------------------------------------------------
Player                MIN  PTS  REB  AST  TO      FG   FG%      3P   3P%
--------------------------------------------------------------------------------
Trae Tatum             22   11    1    2   0   4/5    80.0     0/0   0.0
Pau Barnes             22   11    7    0   0   4/5    80.0     0/0   0.0
Evan George            22    8    7    0   0   3/6    50.0     0/0   0.0
Magic Tatum            24    3    0    1   0   1/3    33.3     0/0   0.0
Michael Carter         24    2    0    2   0   1/2    50.0     0/0   0.0

TEAM: FG: 13/21 (61.9%), 3PT: 4/6 (66.7%), REB: 15 (5 off, 10 def), AST: 5, TO: 2
TEAM FOULS: 6 [Team_065 in BONUS]


Team_065
--------------------------------------------------------------------------------
Player                MIN  PTS  REB  AST  TO      FG   FG%      3P   3P%
--------------------------------------------------------------------------------
Karl Booker            24    7    0    1   0   3/6    50.0     0/0   0.0
Paul Williamson        24    5    0    1   0   2/3    66.7     0/0   0.0
Manu McGrady           24    3    5    1   0   1/2    50.0     0/0   0.0
RJ Harden              24    2    2    0   0   1/4    25.0     0/0   0.0
Russell Wade           21    2    1    0   0   1/3    33.3     0/0   0.0
Paul Curry              3    2    1    0   0   1/1   100.0     0/0   0.0

TEAM: FG: 9/19 (47.4%), 3PT: 2/4 (50.0%), REB: 9 (1 off, 8 def), AST: 3, TO: 3
TEAM FOULS: 10 [Team_011 in BONUS]

================================================================================

================================================================================
                       3RD QUARTER - Team_011 vs Team_065                       
================================================================================

[12:00] Team_011 possession (Score: 63-47)
FOUL! Reach-in foul on Russell Wade during the drive. [Team fouls: 1] No free throws, side out. (Russell Wade: 1 personal fouls)

[11:45] Team_011 possession (Score: 63-47)
Michael Carter drives and kicks out. Trae Tatum attempts a 3Pt. Contested by RJ Harden (3.9 feet, ZONE). Trae Tatum misses. Rebound secured by RJ Harden.

[11:35] Team_065 possession (Score: 63-47)
Karl Booker attempts a Midrange. Contested by Pau Barnes (2.9 feet, MAN). Karl Booker misses. Offensive rebound by Russell Wade! Russell Wade's putback is no good. Rebound secured by Pau Barnes.

[11:23] Team_011 possession (Score: 63-47)
Pau Barnes drives, Russell Wade stays with him. Pau Barnes attempts a Layup. Contested by Russell Wade (3.7 feet, MAN). Pau Barnes misses. Rebound secured by RJ Harden.

[11:03] Team_065 possession (Score: 63-47)
Russell Wade drives to the basket... Russell Wade throws a bad pass! Stolen by Pau Barnes! TURNOVER! (live ball)

[10:49] Team_011 possession (Score: 63-47)
Magic Tatum drives, picks up RJ Harden. Help arrives from Manu McGrady! Magic Tatum attempts a Dunk. Contested by Manu McGrady (4.0 feet, MAN). Magic Tatum misses. Rebound secured by Manu McGrady.

[10:35] Team_065 possession (Score: 63-47)
Manu McGrady attempts a 3Pt. Contested by Michael Carter (4.1 feet, MAN). Manu McGrady misses. Offensive rebound by Russell Wade! Russell Wade puts it back in!
Score: 63-49

[10:23] Team_011 possession (Score: 63-49)
Trae Tatum attempts a 3Pt. Contested by Paul Williamson (3.3 feet, MAN). Trae Tatum misses. Rebound secured by Manu McGrady.

[10:07] Team_065 possession (Score: 63-49)
Russell Wade commits a violation (traveling/carry)! TURNOVER! (dead ball)

[09:54] Team_011 possession (Score: 63-49)
Magic Tatum attempts a 3Pt. Contested by RJ Harden (4.0 feet, MAN). Magic Tatum misses. Offensive rebound by Evan George! Evan George puts it back in!
Score: 65-49

[09:37] Team_065 possession (Score: 65-49)
Manu McGrady attempts a 3Pt. Contested by Magic Tatum (3.4 feet, ZONE). Manu McGrady misses. Offensive rebound by Manu McGrady! Manu McGrady kicks it out.

[09:24] Team_065 possession (Score: 65-49)
Manu McGrady attempts a 3Pt. Contested by Magic Tatum (3.4 feet, ZONE). Manu McGrady misses. Rebound secured by Evan George.

[09:05] Team_011 possession (Score: 65-49)
Pau Barnes attempts a Dunk. BLOCKED BY RUSSELL WADE! Ball is loose! Rebound secured by Russell Wade.

[08:51] Team_065 possession (Score: 65-49)
Manu McGrady attempts a Midrange. Contested by Trae Tatum (4.5 feet, ZONE). Manu McGrady misses. Rebound secured by Michael Carter.

[08:37] Team_011 possession (Score: 65-49)
Magic Tatum drives and kicks out. Pau Barnes attempts a 3Pt. Contested by Russell Wade (3.0 feet, MAN). PAU BARNES MAKES IT! Assist: Magic Tatum
Score: 68-49

[08:21] Team_065 possession (Score: 68-49)
Russell Wade drives and kicks out. Paul Williamson attempts a 3Pt. Contested by Magic Tatum (3.4 feet, ZONE). Paul Williamson misses. Rebound secured by Pau Barnes.

[08:04] Team_011 possession (Score: 68-49)
Pau Barnes drives and kicks out. Evan George attempts a 3Pt. Contested by RJ Harden (3.9 feet, ZONE). Evan George misses. Rebound secured by RJ Harden.

[07:50] Team_065 possession (Score: 68-49)
Paul Williamson attempts a 3Pt. Contested by Magic Tatum (3.6 feet, ZONE). Paul Williamson misses. Offensive rebound by Russell Wade! Russell Wade puts it back in!
Score: 68-51

[07:36] Team_011 possession (Score: 68-51)
Evan George drives, picks up Russell Wade. Help arrives from Paul Williamson! Evan George attempts a Dunk. Contested by Paul Williamson (3.3 feet, ZONE). EVAN GEORGE MAKES IT! Assist: Trae Tatum
Score: 70-51

[07:20] Team_065 possession (Score: 70-51)
RJ Harden drives to the basket... FOUL! Offensive foul on RJ Harden! Magic Tatum drew the charge! [Team fouls: 2] (RJ Harden: 1 personal fouls) TURNOVER! (dead ball)

[07:03] Team_011 possession (Score: 70-51)
Magic Tatum attempts a Midrange. Contested by RJ Harden (4.0 feet, MAN). Magic Tatum misses. Offensive rebound by Pau Barnes! Pau Barnes puts it back in!
Score: 72-51

[06:54] Team_065 possession (Score: 72-51)
Paul Williamson attempts a Midrange. Contested by Magic Tatum (3.6 feet, ZONE). PAUL WILLIAMSON MAKES IT! Assist: RJ Harden
Score: 72-53

[06:40] Team_011 possession (Score: 72-53)
Trae Tatum attempts a 3Pt. Contested by Paul Williamson (3.3 feet, MAN). Trae Tatum misses. Rebound secured by Manu McGrady.

[06:24] Team_065 possession (Score: 72-53)
FOUL! Shooting foul on Magic Tatum. Russell Wade to the line for 3 free throws. [Team fouls: 1] (Magic Tatum: 1 personal fouls)   FT 1/3: GOOD   FT 2/3: GOOD   FT 3/3: GOOD Russell Wade makes 3/3 from the line.
Score: 72-56

[06:08] Team_011 possession (Score: 72-56)
Evan George drives and kicks out. Pau Barnes attempts a 3Pt. Contested by Russell Wade (3.0 feet, MAN). Pau Barnes misses. Rebound secured by Russell Wade.

[05:54] Team_065 possession (Score: 72-56)
Russell Wade drives to the basket... Russell Wade throws a bad pass! Stolen by Pau Barnes! TURNOVER! (live ball)

[05:44] Team_011 possession (Score: 72-56)
Pau Barnes attempts a 3Pt. Contested by Russell Wade (3.7 feet, MAN). Pau Barnes misses. Rebound secured by Russell Wade.

[05:31] Team_065 possession (Score: 72-56)
Paul Williamson attempts a Midrange. Contested by Trae Tatum (4.7 feet, MAN). PAUL WILLIAMSON MAKES IT! Assist: Manu McGrady
Score: 72-58

[05:18] Team_011 possession (Score: 72-58)
Evan George loses the ball! Stripped by Russell Wade! TURNOVER! (live ball)

[05:01] Team_065 possession (Score: 72-58)
FOUL! Shooting foul on Pau Barnes. Russell Wade to the line for 2 free throws. [Team fouls: 2] (Pau Barnes: 1 personal fouls)   FT 1/2: GOOD   FT 2/2: GOOD Russell Wade makes 2/2 from the line.
Score: 72-60

[04:43] Team_011 possession (Score: 72-60)
Evan George loses the ball! Stripped by Russell Wade! TURNOVER! (live ball)

[04:28] Team_065 possession (Score: 72-60)
RJ Harden loses control! Ball rolls out of bounds! TURNOVER! (dead ball)

[04:10] Team_011 possession (Score: 72-60)
Trae Tatum drives and kicks out. Trae Tatum attempts a Midrange. Contested by Paul Williamson (3.5 feet, MAN). Trae Tatum misses. Rebound secured by Manu McGrady.

[03:55] Team_065 possession (Score: 72-60)
FOUL! Offensive foul on Manu McGrady! Michael Carter drew the charge! [Team fouls: 3] (Manu McGrady: 1 personal fouls) TURNOVER! (dead ball)

[03:43] Team_011 possession (Score: 72-60)
Magic Tatum drives to the basket... FOUL! Offensive foul on Magic Tatum! RJ Harden drew the charge! [Team fouls: 3] (Magic Tatum: 2 personal fouls) TURNOVER! (dead ball)

[03:30] Team_065 possession (Score: 72-60)
Paul Williamson attempts a Midrange. Contested by Michael Carter (4.4 feet, ZONE). Paul Williamson misses. Rebound secured by Evan George.

[03:14] Team_011 possession (Score: 72-60)
Evan George drives and kicks out. Evan George attempts a 3Pt. Contested by Russell Wade (3.2 feet, MAN). EVAN GEORGE MAKES IT! Assist: Trae Tatum
Score: 75-60

[02:59] Team_065 possession (Score: 75-60)
Paul Williamson attempts a 3Pt. Contested by Trae Tatum (4.9 feet, MAN). Paul Williamson misses. Rebound secured by Michael Carter.

[02:44] Team_011 possession (Score: 75-60)
Trae Tatum makes the Layup and draws the foul on Russell Wade! And-1! Trae Tatum to the line for 1. [Team fouls: 4] (Russell Wade: 2 personal fouls)   FT 1/1: GOOD Trae Tatum makes 1/1 from the line.
Score: 78-60

[02:31] Team_065 possession (Score: 78-60)
Manu McGrady drives, Pau Barnes stays with him. Manu McGrady attempts a Layup. Contested by Pau Barnes (3.2 feet, ZONE). Manu McGrady misses. Offensive rebound by Manu McGrady! Manu McGrady kicks it out.

[02:14] Team_065 possession (Score: 78-60)
Karl Booker makes the Layup and draws the foul on Magic Tatum! And-1! Karl Booker to the line for 1. [Team fouls: 4] (Magic Tatum: 3 personal fouls)   FT 1/1: GOOD Karl Booker makes 1/1 from the line.
Score: 78-63

[01:58] Team_011 possession (Score: 78-63)
FOUL! Reach-in foul on Karl Booker during the drive. [IN THE BONUS! 5 team fouls] Pau Barnes to the line for 2 free throws. (Karl Booker: 1 personal fouls)   FT 1/2: GOOD   FT 2/2: GOOD Pau Barnes makes 2/2 from the line.
Score: 80-63

[01:42] Team_065 possession (Score: 80-63)
Russell Wade attempts a Midrange. Contested by Michael Carter (4.5 feet, ZONE). Russell Wade misses. Offensive rebound by Russell Wade! Russell Wade's putback is no good. Rebound secured by Evan George.

[01:28] Team_011 possession (Score: 80-63)
Pau Barnes attempts a 3Pt. Contested by Russell Wade (4.0 feet, MAN). Pau Barnes misses. Rebound secured by Manu McGrady.

[01:15] Team_065 possession (Score: 80-63)
FOUL! Shooting foul on Michael Carter. RJ Harden to the line for 2 free throws. [BONUS: 5 team fouls] (Michael Carter: 1 personal fouls)   FT 1/2: GOOD   FT 2/2: GOOD RJ Harden makes 2/2 from the line.
Score: 80-65

[01:03] Team_011 possession (Score: 80-65)
FOUL! Shooting foul on Karl Booker. Evan George to the line for 2 free throws. [BONUS: 6 team fouls] (Karl Booker: 2 personal fouls)   FT 1/2: GOOD   FT 2/2: MISS Evan George makes 1/2 from the line. Rebound secured by Manu McGrady.
Score: 81-65

[00:44] Team_065 possession (Score: 81-65)
Manu McGrady attempts a Midrange. Contested by Trae Tatum (5.0 feet, ZONE). Manu McGrady misses. Rebound secured by Michael Carter.

[00:31] Team_011 possession (Score: 81-65)
Magic Tatum attempts a 3Pt. Contested by RJ Harden (4.4 feet, ZONE). Magic Tatum misses. FOUL! Loose ball foul on Manu McGrady during the rebound battle. [IN THE BONUS! 7 team fouls] Pau Barnes to the line for 2 free throws. (Manu McGrady: 2 personal fouls)   FT 1/2: GOOD   FT 2/2: MISS Pau Barnes makes 1/2 from the line. Rebound secured by Manu McGrady.
Score: 82-65

[00:17] Team_065 possession (Score: 82-65)
Karl Booker drives, Pau Barnes stays with him. Karl Booker attempts a Dunk. Contested by Pau Barnes (3.6 feet, MAN). Karl Booker misses. Rebound secured by Michael Carter.

[00:02] Team_011 possession (Score: 82-65)
Michael Carter attempts a 3Pt. Contested by RJ Harden (4.2 feet, ZONE). MICHAEL CARTER MAKES IT! Assist: Pau Barnes
Score: 85-65

================================================================================
                              3RD QUARTER COMPLETE                              
================================================================================

3RD QUARTER SCORE: Team_011 22, Team_065 18

BOX SCORE:
================================================================================

Team_011
--------------------------------------------------------------------------------
Player                MIN  PTS  REB  AST  TO      FG   FG%      3P   3P%
--------------------------------------------------------------------------------
Pau Barnes             34    7    3    1   0   3/8    37.5     0/0   0.0
Evan George            34    7    4    0   0   3/5    60.0     0/0   0.0
Michael Carter         36    3    4    0   0   1/2    50.0     0/0   0.0
Trae Tatum             34    3    0    2   0   1/4    25.0     0/0   0.0
Magic Tatum            36    0    0    1   0   0/2     0.0     0/0   0.0
Manu McGrady           36    0    9    1   0   0/3     0.0     0/0   0.0

TEAM: FG: 8/21 (38.1%), 3PT: 2/7 (28.6%), REB: 10 (3 off, 7 def), AST: 4, TO: 3
TEAM FOULS: 5 [Team_065 in BONUS]


Team_065
--------------------------------------------------------------------------------
Player                MIN  PTS  REB  AST  TO      FG   FG%      3P   3P%
--------------------------------------------------------------------------------
Russell Wade           34    9    5    0   0   4/6    66.7     0/0   0.0
Paul Williamson        36    4    0    0   0   2/4    50.0     0/0   0.0
Karl Booker            36    3    0    0   0   1/3    33.3     0/0   0.0
RJ Harden              36    2    3    1   0   1/1   100.0     0/0   0.0

TEAM: FG: 8/17 (47.1%), 3PT: 3/5 (60.0%), REB: 18 (6 off, 12 def), AST: 2, TO: 6
TEAM FOULS: 7 [Team_011 in BONUS]

================================================================================

================================================================================
                       4TH QUARTER - Team_011 vs Team_065                       
================================================================================

[12:00] Team_011 possession (Score: 85-65)
Michael Carter drives, picks up Manu McGrady. Help arrives from Paul Williamson! Michael Carter attempts a Dunk. Contested by Paul Williamson (4.7 feet, MAN). MICHAEL CARTER MAKES IT! Assist: Pau Barnes
Score: 87-65

[11:41] Team_065 possession (Score: 87-65)
Manu McGrady attempts a 3Pt. Contested by Michael Carter (4.4 feet, MAN). Manu McGrady misses. Offensive rebound by Manu McGrady! Manu McGrady kicks it out.

[11:28] Team_065 possession (Score: 87-65)
Manu McGrady attempts a 3Pt. Contested by Michael Carter (4.4 feet, MAN). Manu McGrady misses. Offensive rebound by Russell Wade! Russell Wade's putback is no good. Rebound secured by Pau Barnes.

[11:18] Team_011 possession (Score: 87-65)
Evan George drives and kicks out. Magic Tatum attempts a 3Pt. Contested by RJ Harden (4.2 feet, ZONE). MAGIC TATUM MAKES IT! Assist: Evan George
Score: 90-65

[11:01] Team_065 possession (Score: 90-65)
RJ Harden attempts a 3Pt. Contested by Magic Tatum (4.2 feet, ZONE). RJ Harden misses. Rebound secured by Pau Barnes.

[10:44] Team_011 possession (Score: 90-65)
Evan George drives, picks up Russell Wade. Help arrives from Paul Williamson! Evan George attempts a Dunk. Contested by Paul Williamson (3.7 feet, MAN). EVAN GEORGE MAKES IT! Assist: Magic Tatum
Score: 92-65

[10:26] Team_065 possession (Score: 92-65)
Paul Williamson drives and kicks out. Russell Wade attempts a 3Pt. Contested by Trae Tatum (5.1 feet, ZONE). Russell Wade misses. Rebound secured by Evan George.

[10:11] Team_011 possession (Score: 92-65)
Michael Carter attempts a Layup. Contested by Manu McGrady (4.9 feet, MAN). Michael Carter misses. Rebound secured by RJ Harden.

[09:54] Team_065 possession (Score: 92-65)
Paul Williamson attempts a 3Pt. Contested by Trae Tatum (5.2 feet, MAN). Paul Williamson misses. Rebound secured by Pau Barnes.

[09:38] Team_011 possession (Score: 92-65)
Evan George attempts a Layup. Contested by Russell Wade (3.8 feet, MAN). Evan George misses. Rebound secured by Manu McGrady.

[09:23] Team_065 possession (Score: 92-65)
FOUL! Reach-in foul on Pau Barnes during the drive. [Team fouls: 1] No free throws, side out. (Pau Barnes: 1 personal fouls)

[09:10] Team_065 possession (Score: 92-65)
Russell Wade attempts a Layup. Contested by Pau Barnes (3.8 feet, MAN). Russell Wade misses. Rebound secured by Pau Barnes.

[08:53] Team_011 possession (Score: 92-65)
Michael Carter attempts a Midrange. Contested by Russell Wade (3.5 feet, ZONE). MICHAEL CARTER MAKES IT!
Score: 94-65

[08:35] Team_065 possession (Score: 94-65)
RJ Harden attempts a 3Pt. Contested by Magic Tatum (4.5 feet, MAN). RJ Harden misses. Rebound secured by Evan George.

[08:21] Team_011 possession (Score: 94-65)
FOUL! Shooting foul on Russell Wade. Pau Barnes to the line for 2 free throws. [Team fouls: 1] (Russell Wade: 1 personal fouls)   FT 1/2: MISS   FT 2/2: GOOD Pau Barnes makes 1/2 from the line.
Score: 95-65

[08:06] Team_065 possession (Score: 95-65)
Paul Williamson attempts a Layup. BLOCKED BY TRAE TATUM! Ball deflects out of bounds off Paul Williamson.

[07:54] Team_011 possession (Score: 95-65)
FOUL! Reach-in foul on Russell Wade during the drive. [Team fouls: 2] No free throws, side out. (Russell Wade: 2 personal fouls)

[07:37] Team_011 possession (Score: 95-65)
Trae Tatum throws a bad pass out of bounds! TURNOVER! (dead ball)

[07:37] Substitution (Team_011): Magic Tatum OUT → Shai Leonard IN (stamina_rule2)

[07:37] Substitution (Team_011): Trae Tatum OUT → De'Aaron George IN (stamina_rule2)

[07:37] Substitution (Team_011): Michael Carter OUT → Tyrese Nowitzki IN (stamina_rule2)

[07:37] Substitution (Team_011): Pau Barnes OUT → Russell Davis IN (stamina_rule2)

[07:37] Substitution (Team_011): Evan George OUT → Pau Towns IN (stamina_rule2)

[07:37] Substitution (Team_065): RJ Harden OUT → Paul Curry IN (stamina_rule2)

[07:37] Substitution (Team_065): Paul Williamson OUT → Derrick Poole IN (stamina_rule2)

[07:37] Substitution (Team_065): Manu McGrady OUT → D'Angelo Porzingis IN (stamina_rule2)

[07:37] Substitution (Team_065): Russell Wade OUT → Karl Leonard IN (stamina_rule2)

[07:37] Substitution (Team_065): Karl Booker OUT → Vince Mobley IN (stamina_rule2)

[07:19] Team_065 possession (Score: 95-65)
Derrick Poole attempts a Layup. Contested by Russell Davis (3.8 feet, ZONE). Derrick Poole misses. Offensive rebound by D'Angelo Porzingis! D'Angelo Porzingis kicks it out.

[07:10] Team_065 possession (Score: 95-65)
D'Angelo Porzingis attempts a Layup. Contested by Tyrese Nowitzki (4.8 feet, MAN). D'ANGELO PORZINGIS MAKES IT! Assist: Derrick Poole
Score: 95-67

[06:55] Team_011 possession (Score: 95-67)
Russell Davis attempts a Midrange. BLOCKED BY KARL LEONARD! Ball goes out off Karl Leonard. Russell Davis's ball!

[06:40] Team_011 possession (Score: 95-67)
Pau Towns attempts a Midrange. Contested by Vince Mobley (4.1 feet, MAN). PAU TOWNS MAKES IT! Assist: Russell Davis
Score: 97-67

[06:28] Team_065 possession (Score: 97-67)
Derrick Poole attempts a 3Pt. Contested by De'Aaron George (4.8 feet, MAN). Derrick Poole misses. Rebound secured by Tyrese Nowitzki.

[06:12] Team_011 possession (Score: 97-67)
Tyrese Nowitzki commits a violation (traveling/carry)! TURNOVER! (dead ball)

[05:56] Team_065 possession (Score: 97-67)
Derrick Poole drives, picks up Russell Davis. Help arrives from Shai Leonard! Derrick Poole attempts a Dunk. Contested by Shai Leonard (3.8 feet, ZONE). DERRICK POOLE MAKES IT! Assist: Vince Mobley
Score: 97-69

[05:41] Team_011 possession (Score: 97-69)
FOUL! Offensive foul on De'Aaron George! Derrick Poole drew the charge! [Team fouls: 2] (De'Aaron George: 1 personal fouls) TURNOVER! (dead ball)

[05:26] Team_065 possession (Score: 97-69)
Paul Curry attempts a 3Pt. Contested by Shai Leonard (4.7 feet, MAN). Paul Curry misses. Rebound secured by Pau Towns.

[05:15] Team_011 possession (Score: 97-69)
FOUL! Reach-in foul on Karl Leonard during the drive. [Team fouls: 3] No free throws, side out. (Karl Leonard: 1 personal fouls)

[05:03] Team_011 possession (Score: 97-69)
Tyrese Nowitzki attempts a Midrange. Contested by D'Angelo Porzingis (4.2 feet, ZONE). Tyrese Nowitzki misses. Rebound secured by Karl Leonard.

[04:52] Team_065 possession (Score: 97-69)
Paul Curry makes the Dunk and draws the foul on Russell Davis! And-1! Paul Curry to the line for 1. [Team fouls: 3] (Russell Davis: 1 personal fouls)   FT 1/1: GOOD Paul Curry makes 1/1 from the line.
Score: 97-72

[04:35] Team_011 possession (Score: 97-72)
De'Aaron George drives to the basket... De'Aaron George loses control! Ball rolls out of bounds! TURNOVER! (dead ball)

[04:19] Team_065 possession (Score: 97-72)
Derrick Poole attempts a 3Pt. Contested by Shai Leonard (4.4 feet, ZONE). Derrick Poole misses. Offensive rebound by Vince Mobley! Vince Mobley's putback is no good. Rebound secured by Russell Davis.

[04:03] Team_011 possession (Score: 97-72)
Tyrese Nowitzki attempts a 3Pt. Contested by Paul Curry (4.8 feet, ZONE). Tyrese Nowitzki misses. Rebound secured by Karl Leonard.

[03:48] Team_065 possession (Score: 97-72)
Paul Curry attempts a Midrange. Contested by Shai Leonard (4.7 feet, MAN). Paul Curry misses. Rebound secured by Pau Towns.

[03:33] Team_011 possession (Score: 97-72)
Pau Towns drives, picks up Vince Mobley. Help arrives from Derrick Poole! Pau Towns attempts a Layup. Contested by Derrick Poole (4.1 feet, MAN). Pau Towns misses. Rebound secured by Vince Mobley.

[03:20] Team_065 possession (Score: 97-72)
D'Angelo Porzingis attempts a Midrange. Contested by Russell Davis (3.9 feet, ZONE). D'ANGELO PORZINGIS MAKES IT!
Score: 97-74

[03:05] Team_011 possession (Score: 97-74)
Shai Leonard throws a bad pass out of bounds! TURNOVER! (dead ball)

[02:52] Team_065 possession (Score: 97-74)
Derrick Poole attempts a 3Pt. Contested by Shai Leonard (4.4 feet, ZONE). Derrick Poole misses. Rebound secured by Pau Towns.

[02:41] Team_011 possession (Score: 97-74)
Pau Towns drives to the basket... FOUL! Offensive foul on Pau Towns! Vince Mobley drew the charge! [Team fouls: 4] (Pau Towns: 1 personal fouls) TURNOVER! (dead ball)

[02:28] Team_065 possession (Score: 97-74)
Vince Mobley attempts a Layup. Contested by Pau Towns (5.0 feet, ZONE). VINCE MOBLEY MAKES IT!
Score: 97-76

[02:09] Team_011 possession (Score: 97-76)
Shai Leonard attempts a Layup. Contested by Vince Mobley (4.2 feet, ZONE). SHAI LEONARD MAKES IT!
Score: 99-76

[01:58] Team_065 possession (Score: 99-76)
FOUL! Offensive foul on Derrick Poole! De'Aaron George drew the charge! [Team fouls: 4] (Derrick Poole: 1 personal fouls) TURNOVER! (dead ball)

[01:42] Team_011 possession (Score: 99-76)
Tyrese Nowitzki attempts a Midrange. Contested by D'Angelo Porzingis (4.2 feet, MAN). Tyrese Nowitzki misses. Offensive rebound by Pau Towns! Pau Towns kicks it out.

[01:26] Team_011 possession (Score: 99-76)
Shai Leonard makes the Dunk and draws the foul on Vince Mobley! And-1! Shai Leonard to the line for 1. [BONUS: 5 team fouls] (Vince Mobley: 1 personal fouls)   FT 1/1: GOOD Shai Leonard makes 1/1 from the line.
Score: 102-76

[01:09] Team_065 possession (Score: 102-76)
D'Angelo Porzingis drives to the basket... D'Angelo Porzingis loses the ball! Stripped by Tyrese Nowitzki! TURNOVER! (live ball)

[00:57] Team_011 possession (Score: 102-76)
Pau Towns attempts a 3Pt. Contested by Vince Mobley (4.2 feet, MAN). Pau Towns misses. Offensive rebound by Pau Towns! Pau Towns kicks it out.

[00:43] Team_011 possession (Score: 102-76)
Shai Leonard drives to the basket... Shai Leonard throws a bad pass out of bounds! TURNOVER! (dead ball)

[00:31] Team_065 possession (Score: 102-76)
D'Angelo Porzingis attempts a Midrange. Contested by Pau Towns (5.2 feet, ZONE). D'ANGELO PORZINGIS MAKES IT!
Score: 102-78

[00:18] Team_011 possession (Score: 102-78)
FOUL! Holding foul on Vince Mobley. [IN THE BONUS! 6 team fouls] Pau Towns to the line for 2 free throws. (Vince Mobley: 2 personal fouls)   FT 1/2: GOOD   FT 2/2: GOOD Pau Towns makes 2/2 from the line.
Score: 104-78

[00:01] Team_065 possession (Score: 104-78)
Karl Leonard drives and kicks out. Vince Mobley attempts a Midrange. Contested by Pau Towns (5.1 feet, MAN). VINCE MOBLEY MAKES IT!
Score: 104-80

================================================================================
                              4TH QUARTER COMPLETE                              
================================================================================

4TH QUARTER SCORE: Team_011 19, Team_065 15

BOX SCORE:
================================================================================

Team_011
--------------------------------------------------------------------------------
Player                MIN  PTS  REB  AST  TO      FG   FG%      3P   3P%
--------------------------------------------------------------------------------
Shai Leonard            8    5    0    0   0   2/2   100.0     0/0   0.0
Michael Carter         41    4    0    0   0   2/3    66.7     0/0   0.0
Pau Towns              10    4    5    0   0   2/3    66.7     0/0   0.0
Magic Tatum            41    3    0    1   0   1/1   100.0     0/0   0.0
Evan George            39    2    2    1   0   1/2    50.0     0/0   0.0
Pau Barnes             39    1    4    1   0   1/1   100.0     0/0   0.0
Tyrese Nowitzki         8    0    1    0   0   0/2     0.0     0/0   0.0

TEAM: FG: 9/14 (64.3%), 3PT: 0/1 (0.0%), REB: 11 (2 off, 9 def), AST: 4, TO: 7
TEAM FOULS: 4


Team_065
--------------------------------------------------------------------------------
Player                MIN  PTS  REB  AST  TO      FG   FG%      3P   3P%
--------------------------------------------------------------------------------
D'Angelo Porzingis      8    6    1    0   0   3/3   100.0     0/0   0.0
Vince Mobley            8    4    1    1   0   2/2   100.0     0/0   0.0
Paul Curry             10    3    0    0   0   1/3    33.3     0/0   0.0
Derrick Poole           8    2    0    1   0   1/4    25.0     0/0   0.0
Manu McGrady           41    0    2    0   0   0/1     0.0     0/0   0.0
RJ Harden              41    0    1    0   0   0/2     0.0     0/0   0.0
Paul Williamson        41    0    0    0   0   0/3     0.0     0/0   0.0
Russell Wade           38    0    0    0   0   0/1     0.0     0/0   0.0
Russell Davis          10    0    1    1   0   0/0     0.0     0/0   0.0
Karl Leonard            8    0    2    0   0   0/0     0.0     0/0   0.0

TEAM: FG: 7/19 (36.8%), 3PT: 0/8 (0.0%), REB: 9 (4 off, 5 def), AST: 2, TO: 2
TEAM FOULS: 6 [Team_011 in BONUS]

================================================================================

================================================================================
                               FULL GAME COMPLETE                               
================================================================================

FINAL SCORE: Team_011 104, Team_065 80

SCORING BY QUARTER:
--------------------------------------------------------------------------------
Team                     Q1     Q2     Q3     Q4    FINAL
--------------------------------------------------------------------------------
Team_011                 27     36     22     19      104
Team_065                 26     21     18     15       80
--------------------------------------------------------------------------------

FULL GAME BOX SCORE:
================================================================================

Team_011
--------------------------------------------------------------------------------
Player                MIN  PTS  REB  AST  TO      FG   FG%      3P   3P%      FT STL BLK
--------------------------------------------------------------------------------
Magic Tatum            41    9    0    5   2   5/11   45.5   1/4    25.0   2/2     1   0
Michael Carter         41   18    6    2   0   8/14   57.1   2/5    40.0   2/2     1   0
Trae Tatum             39   14    1    6   2   5/13   38.5   1/6    16.7   5/5     0   1
Pau Barnes             39   23   15    2   1   8/14   57.1   1/3    33.3   8/10    3   0
Evan George            39   22   19    2   2   9/15   60.0   2/3    66.7   4/7     0   0
De'Aaron George        10    3    0    0   1   1/1   100.0   1/1   100.0   0/0     0   0
Russell Davis          10    2    2    1   1   1/2    50.0   0/1     0.0   0/0     0   0
Pau Towns              10    4    8    2   1   1/2    50.0   0/0     0.0   2/2     0   0
Shai Leonard            8    5    0    0   1   2/2   100.0   0/0     0.0   1/1     0   0
Tyrese Nowitzki         8    0    1    0   2   0/2     0.0   0/1     0.0   0/0     1   0

TEAM: FG: 41/77 (53.2%), 3PT: 8/24 (33.3%), REB: 50 (16 off, 34 def), AST: 20, TO: 13


Team_065
--------------------------------------------------------------------------------
Player                MIN  PTS  REB  AST  TO      FG   FG%      3P   3P%      FT STL BLK
--------------------------------------------------------------------------------
RJ Harden              41    4   11    2   5   3/11   27.3   0/6     0.0   3/4     0   1
Paul Williamson        41   15    0    2   0   6/15   40.0   3/7    42.9   3/3     0   0
Manu McGrady           41   10   19    2   5   5/10   50.0   2/4    50.0   6/6     0   0
Karl Booker            41   15    0    1   0   6/12   50.0   1/1   100.0   4/5     1   0
Russell Wade           38   17   10    0   2   6/12   50.0   1/1   100.0  11/11    3   1
Paul Curry             10    5    1    0   0   2/4    50.0   0/1     0.0   3/3     0   0
Derrick Poole           8    2    0    1   1   1/4    25.0   0/3     0.0   0/0     0   0
D'Angelo Porzingis      8    6    1    0   0   3/3   100.0   0/0     0.0   0/0     0   0
Karl Leonard            8    0    2    0   1   1/1   100.0   0/0     0.0   0/0     0   1
Vince Mobley            8    4    1    1   0   1/1   100.0   0/0     0.0   0/0     0   0

TEAM: FG: 34/73 (46.6%), 3PT: 7/23 (30.4%), REB: 47 (13 off, 34 def), AST: 9, TO: 14

================================================================================
