================================================================================
                        FULL GAME - Team_097 vs Team_088                        
================================================================================

================================================================================
                       1ST QUARTER - Team_097 vs Team_088                       
================================================================================

[12:00] Team_097 possession (Score: 0-0)
Jrue Haliburton drives, Giannis Smith stays with him. Jrue Haliburton attempts a Layup. Contested by Giannis Smith (4.4 feet, ZONE). JRUE HALIBURTON MAKES IT! Assist: Evan Brogdon
Score: 2-0

[11:41] Team_088 possession (Score: 2-0)
Giannis Smith drives to the basket... Giannis Smith throws a bad pass! Stolen by Anthony Haliburton! TURNOVER! (live ball)

[11:27] Team_097 possession (Score: 2-0)
Anthony Haliburton attempts a Midrange. Contested by Giannis Smith (4.4 feet, MAN). Anthony Haliburton misses. FOUL! Loose ball foul on Allen Ming during the rebound battle. [Team fouls: 1] No free throws, side out. (Allen Ming: 1 personal fouls)

[11:12] Team_097 possession (Score: 2-0)
Shai Poole drives, Giannis Smith stays with him. Shai Poole attempts a Dunk. Contested by Giannis Smith (4.5 feet, ZONE). Shai Poole misses. Rebound secured by Giannis Smith.

[10:56] Team_088 possession (Score: 2-0)
Tobias Haliburton attempts a Layup. BLOCKED BY JRUE HALIBURTON! Ball is loose! Offensive rebound by Giannis Smith! Giannis Smith kicks it out.

[10:46] Team_088 possession (Score: 2-0)
FOUL! Holding foul on Anthony Haliburton. [Team fouls: 1] No free throws, side out. (Anthony Haliburton: 1 personal fouls)

[10:33] Team_088 possession (Score: 2-0)
Tobias Haliburton attempts a 3Pt. Contested by Evan Brogdon (4.7 feet, ZONE). Tobias Haliburton misses. Offensive rebound by Giannis Smith! Giannis Smith puts it back in!
Score: 2-2

[10:18] Team_097 possession (Score: 2-2)
Shai Poole attempts a 3Pt. Contested by Tobias Haliburton (5.6 feet, ZONE). SHAI POOLE MAKES IT! Assist: Anthony Haliburton
Score: 5-2

[10:04] Team_088 possession (Score: 5-2)
Tobias Haliburton commits a violation (traveling/carry)! TURNOVER! (dead ball)

[09:51] Team_097 possession (Score: 5-2)
Tyrese Stewart throws a bad pass! Stolen by Allen Ming! TURNOVER! (live ball)

[09:42] Team_088 possession (Score: 5-2)
Giannis Smith attempts a Layup. Contested by Anthony Haliburton (3.5 feet, ZONE). GIANNIS SMITH MAKES IT! Assist: Josh Duncan
Score: 5-4

[09:26] Team_097 possession (Score: 5-4)
Shai Poole attempts a 3Pt. Contested by Tobias Haliburton (5.6 feet, ZONE). SHAI POOLE MAKES IT! Assist: Anthony Haliburton
Score: 8-4

[09:07] Team_088 possession (Score: 8-4)
Tobias Haliburton drives to the basket... Tobias Haliburton throws a bad pass out of bounds! TURNOVER! (dead ball)

[08:52] Team_097 possession (Score: 8-4)
Jrue Haliburton attempts a 3Pt. Contested by Tobias Haliburton (5.5 feet, ZONE). JRUE HALIBURTON MAKES IT! Assist: Evan Brogdon
Score: 11-4

[08:38] Team_088 possession (Score: 11-4)
Giannis Smith attempts a 3Pt. Contested by Shai Poole (3.6 feet, ZONE). Giannis Smith misses. Rebound secured by Anthony Haliburton.

[08:23] Team_097 possession (Score: 11-4)
Jrue Haliburton attempts a Midrange. Contested by Tobias Haliburton (5.5 feet, ZONE). JRUE HALIBURTON MAKES IT! Assist: Shai Poole
Score: 13-4

[08:13] Team_088 possession (Score: 13-4)
Tyler Hyland makes the 3Pt and draws the foul on Shai Poole! And-1! Tyler Hyland to the line for 1. [Team fouls: 2] (Shai Poole: 1 personal fouls)   FT 1/1: GOOD Tyler Hyland makes 1/1 from the line.
Score: 13-8

[07:54] Team_097 possession (Score: 13-8)
Shai Poole attempts a 3Pt. Contested by Tyler Hyland (5.1 feet, MAN). SHAI POOLE MAKES IT! Assist: Evan Brogdon
Score: 16-8

[07:39] Team_088 possession (Score: 16-8)
Tyler Hyland drives, Anthony Haliburton stays with him. Tyler Hyland attempts a Layup. Contested by Anthony Haliburton (3.2 feet, ZONE). Tyler Hyland misses. Offensive rebound by Giannis Smith! Giannis Smith puts it back in!
Score: 16-10

[07:25] Team_097 possession (Score: 16-10)
Tyrese Stewart attempts a Layup. Contested by Giannis Smith (4.8 feet, ZONE). Tyrese Stewart misses. Rebound secured by Allen Ming.

[07:12] Team_088 possession (Score: 16-10)
Allen Ming attempts a Layup. Contested by Anthony Haliburton (3.5 feet, MAN). ALLEN MING MAKES IT!
Score: 16-12

[06:56] Team_097 possession (Score: 16-12)
Tyrese Stewart attempts a 3Pt. Contested by Allen Ming (5.1 feet, MAN). Tyrese Stewart misses. Rebound secured by Allen Ming.

[06:43] Team_088 possession (Score: 16-12)
Allen Ming attempts a Midrange. Contested by Jrue Haliburton (5.4 feet, ZONE). ALLEN MING MAKES IT! Assist: Tyler Hyland
Score: 16-14

[06:27] Team_097 possession (Score: 16-14)
FOUL! Reach-in foul on Giannis Smith during the drive. [Team fouls: 2] No free throws, side out. (Giannis Smith: 1 personal fouls)

[06:13] Team_097 possession (Score: 16-14)
Jrue Haliburton attempts a 3Pt. Contested by Giannis Smith (4.4 feet, ZONE). Jrue Haliburton misses. Rebound secured by Tyler Hyland.

[05:58] Team_088 possession (Score: 16-14)
Giannis Smith drives, picks up Anthony Haliburton. Help arrives from Jrue Haliburton! Giannis Smith attempts a Dunk. Contested by Jrue Haliburton (3.5 feet, ZONE). GIANNIS SMITH MAKES IT! Assist: Tyler Hyland
Score: 16-16

[05:45] Team_097 possession (Score: 16-16)
Jrue Haliburton attempts a 3Pt. Contested by Tobias Haliburton (5.5 feet, ZONE). Jrue Haliburton misses. Rebound secured by Allen Ming.

[05:29] Team_088 possession (Score: 16-16)
Josh Duncan attempts a 3Pt. Contested by Evan Brogdon (4.7 feet, MAN). Josh Duncan misses. Rebound secured by Tyrese Stewart.

[05:13] Team_097 possession (Score: 16-16)
FOUL! Offensive foul on Tyrese Stewart! Allen Ming drew the charge! [Team fouls: 3] (Tyrese Stewart: 1 personal fouls) TURNOVER! (dead ball)

[04:59] Team_088 possession (Score: 16-16)
Allen Ming drives, picks up Anthony Haliburton. Help arrives from Jrue Haliburton! Allen Ming attempts a Layup. Contested by Jrue Haliburton (3.5 feet, ZONE). ALLEN MING MAKES IT! Assist: Tyler Hyland
Score: 16-18

[04:48] Team_097 possession (Score: 16-18)
FOUL! Reach-in foul on Allen Ming during the drive. [Team fouls: 3] No free throws, side out. (Allen Ming: 2 personal fouls)

[04:38] Team_097 possession (Score: 16-18)
Tyrese Stewart attempts a Midrange. Contested by Tyler Hyland (5.4 feet, ZONE). Tyrese Stewart misses. Offensive rebound by Tyrese Stewart! Tyrese Stewart kicks it out.

[04:28] Team_097 possession (Score: 16-18)
Tyrese Stewart makes the Layup and draws the foul on Allen Ming! And-1! Tyrese Stewart to the line for 1. [Team fouls: 4] (Allen Ming: 3 personal fouls)   FT 1/1: GOOD Tyrese Stewart makes 1/1 from the line.
Score: 19-18

[04:13] Team_088 possession (Score: 19-18)
Josh Duncan attempts a Midrange. Contested by Jrue Haliburton (5.3 feet, ZONE). JOSH DUNCAN MAKES IT! Assist: Tyler Hyland
Score: 19-20

[03:56] Team_097 possession (Score: 19-20)
Evan Brogdon drives and kicks out. FOUL! Shooting foul on Giannis Smith. Shai Poole to the line for 2 free throws. [BONUS: 5 team fouls] (Giannis Smith: 2 personal fouls)   FT 1/2: MISS   FT 2/2: GOOD Shai Poole makes 1/2 from the line.
Score: 20-20

[03:42] Team_088 possession (Score: 20-20)
Allen Ming drives and kicks out. Allen Ming attempts a 3Pt. Contested by Anthony Haliburton (3.5 feet, MAN). Allen Ming misses. Rebound secured by Shai Poole.

[03:27] Team_097 possession (Score: 20-20)
Tyrese Stewart attempts a Layup. Contested by Giannis Smith (5.1 feet, ZONE). TYRESE STEWART MAKES IT! Assist: Anthony Haliburton
Score: 22-20

[03:12] Team_088 possession (Score: 22-20)
Tyler Hyland attempts a 3Pt. Contested by Shai Poole (3.5 feet, MAN). Tyler Hyland misses. Rebound secured by Anthony Haliburton.

[02:58] Team_097 possession (Score: 22-20)
FOUL! Holding foul on Allen Ming. [IN THE BONUS! 6 team fouls] Tyrese Stewart to the line for 2 free throws. (Allen Ming: 4 personal fouls)   FT 1/2: GOOD   FT 2/2: GOOD Tyrese Stewart makes 2/2 from the line.
Score: 24-20

[02:44] Team_088 possession (Score: 24-20)
FOUL! Offensive foul on Tobias Haliburton! Jrue Haliburton drew the charge! [Team fouls: 7] (Tobias Haliburton: 1 personal fouls) TURNOVER! (dead ball)

[02:31] Team_097 possession (Score: 24-20)
Shai Poole attempts a 3Pt. Contested by Giannis Smith (4.9 feet, ZONE). Shai Poole misses. Rebound secured by Allen Ming.

[02:17] Team_088 possession (Score: 24-20)
Giannis Smith attempts a Layup. BLOCKED BY ANTHONY HALIBURTON! Ball deflects out of bounds off Giannis Smith.

[01:59] Team_097 possession (Score: 24-20)
FOUL! Reach-in foul on Giannis Smith during the drive. [IN THE BONUS! 8 team fouls] Tyrese Stewart to the line for 2 free throws. (Giannis Smith: 3 personal fouls)   FT 1/2: GOOD   FT 2/2: GOOD Tyrese Stewart makes 2/2 from the line.
Score: 26-20

[01:47] Team_088 possession (Score: 26-20)
Josh Duncan makes the Layup and draws the foul on Shai Poole! And-1! Josh Duncan to the line for 1. [Team fouls: 4] (Shai Poole: 2 personal fouls)   FT 1/1: MISS Josh Duncan makes 0/1 from the line. FOUL! Loose ball foul on Shai Poole during the free throw rebound! [IN THE BONUS! 5 team fouls] Allen Ming to the line for 2 free throws. (Shai Poole: 3 personal fouls)   FT 1/2: GOOD   FT 2/2: GOOD Allen Ming makes 2/2 from the line.
Score: 26-24

[01:33] Team_097 possession (Score: 26-24)
Jrue Haliburton attempts a 3Pt. Contested by Tobias Haliburton (5.8 feet, ZONE). Jrue Haliburton misses. Rebound secured by Giannis Smith.

[01:16] Team_088 possession (Score: 26-24)
Tobias Haliburton makes the Layup and draws the foul on Jrue Haliburton! And-1! Tobias Haliburton to the line for 1. [BONUS: 6 team fouls] (Jrue Haliburton: 1 personal fouls)   FT 1/1: GOOD Tobias Haliburton makes 1/1 from the line.
Score: 26-27

[01:05] Team_097 possession (Score: 26-27)
Anthony Haliburton attempts a 3Pt. Contested by Tobias Haliburton (5.9 feet, ZONE). Anthony Haliburton misses. Rebound secured by Tyler Hyland.

[00:50] Team_088 possession (Score: 26-27)
Allen Ming attempts a Midrange. Contested by Anthony Haliburton (4.0 feet, MAN). Allen Ming misses. Rebound secured by Anthony Haliburton.

[00:37] Team_097 possession (Score: 26-27)
Jrue Haliburton drives, picks up Giannis Smith. Help arrives from Tobias Haliburton! Jrue Haliburton attempts a Layup. Contested by Tobias Haliburton (5.1 feet, ZONE). JRUE HALIBURTON MAKES IT!
Score: 28-27

[00:24] Team_088 possession (Score: 28-27)
Allen Ming attempts a Layup. Contested by Anthony Haliburton (4.0 feet, ZONE). Allen Ming misses. FOUL! Loose ball foul on Shai Poole during the rebound battle. [IN THE BONUS! 7 team fouls] Allen Ming to the line for 2 free throws. (Shai Poole: 4 personal fouls)   FT 1/2: GOOD   FT 2/2: GOOD Allen Ming makes 2/2 from the line.
Score: 28-29

[00:09] Team_097 possession (Score: 28-29)
Evan Brogdon attempts a Midrange. Wide open! Josh Duncan is 6.4 feet away. [MAN] EVAN BROGDON MAKES IT! Assist: Shai Poole
Score: 30-29

================================================================================
                              1ST QUARTER COMPLETE                              
================================================================================

1ST QUARTER SCORE: Team_097 30, Team_088 29

BOX SCORE:
================================================================================

Team_097
--------------------------------------------------------------------------------
Player                MIN  PTS  REB  AST  TO      FG   FG%      3P   3P%
--------------------------------------------------------------------------------
Shai Poole             12   10    1    2   0   4/6    66.7     0/0   0.0
Jrue Haliburton        12    9    0    0   0   4/7    57.1     0/0   0.0
Tyrese Stewart         12    9    3    0   0   4/6    66.7     0/0   0.0
Evan Brogdon           12    2    0    3   0   1/1   100.0     0/0   0.0
Anthony Haliburton     12    0    3    3   0   0/1     0.0     0/0   0.0

TEAM: FG: 13/21 (61.9%), 3PT: 4/10 (40.0%), REB: 7 (2 off, 5 def), AST: 8, TO: 2
TEAM FOULS: 7 [Team_088 in BONUS]


Team_088
--------------------------------------------------------------------------------
Player                MIN  PTS  REB  AST  TO      FG   FG%      3P   3P%
--------------------------------------------------------------------------------
Allen Ming             12   12    4    0   0   5/7    71.4     0/0   0.0
Giannis Smith          12    8    5    0   0   4/6    66.7     0/0   0.0
Tyler Hyland           12    4    2    4   0   1/2    50.0     0/0   0.0
Tobias Haliburton      12    3    0    0   0   1/1   100.0     0/0   0.0
Josh Duncan            12    2    0    1   0   1/2    50.0     0/0   0.0

TEAM: FG: 12/18 (66.7%), 3PT: 2/5 (40.0%), REB: 11 (3 off, 8 def), AST: 5, TO: 4
TEAM FOULS: 8 [Team_097 in BONUS]

================================================================================

================================================================================
                       2ND QUARTER - Team_097 vs Team_088                       
================================================================================

[12:00] Team_097 possession (Score: 30-29)
Evan Brogdon attempts a 3Pt. Contested by Tobias Haliburton (6.0 feet, ZONE). EVAN BROGDON MAKES IT! Assist: Jrue Haliburton
Score: 33-29

[11:48] Team_088 possession (Score: 33-29)
FOUL! Shooting foul on Anthony Haliburton. Giannis Smith to the line for 2 free throws. [Team fouls: 1] (Anthony Haliburton: 1 personal fouls)   FT 1/2: GOOD   FT 2/2: GOOD Giannis Smith makes 2/2 from the line.
Score: 33-31

[11:31] Team_097 possession (Score: 33-31)
Tyrese Stewart drives, picks up Allen Ming. Help arrives from Tobias Haliburton! Tyrese Stewart attempts a Layup. Contested by Tobias Haliburton (5.5 feet, MAN). Tyrese Stewart misses. Rebound secured by Tyler Hyland.

[11:14] Team_088 possession (Score: 33-31)
Tobias Haliburton drives and kicks out. Tobias Haliburton attempts a Midrange. Contested by Tyrese Stewart (5.7 feet, ZONE). Tobias Haliburton misses. Offensive rebound by Giannis Smith! Giannis Smith kicks it out.

[10:55] Team_088 possession (Score: 33-31)
Allen Ming drives, Anthony Haliburton stays with him. Allen Ming attempts a Layup. Contested by Anthony Haliburton (3.9 feet, ZONE). ALLEN MING MAKES IT! Assist: Josh Duncan
Score: 33-33

[10:38] Team_097 possession (Score: 33-33)
Tyrese Stewart attempts a Midrange. Contested by Tyler Hyland (5.8 feet, ZONE). Tyrese Stewart misses. Rebound secured by Giannis Smith.

[10:22] Team_088 possession (Score: 33-33)
Tyler Hyland attempts a Midrange. Contested by Jrue Haliburton (5.4 feet, ZONE). Tyler Hyland misses. Rebound secured by Tyrese Stewart.

[10:07] Team_097 possession (Score: 33-33)
Evan Brogdon attempts a Midrange. Wide open! Tobias Haliburton is 6.2 feet away. [ZONE] Evan Brogdon misses. Rebound secured by Giannis Smith.

[09:54] Team_088 possession (Score: 33-33)
Tyler Hyland attempts a 3Pt. Contested by Shai Poole (3.9 feet, ZONE). Tyler Hyland misses. FOUL! Loose ball foul on Anthony Haliburton during the rebound battle. [Team fouls: 2] No free throws, side out. (Anthony Haliburton: 2 personal fouls)

[09:40] Team_088 possession (Score: 33-33)
Allen Ming attempts a Midrange. Contested by Anthony Haliburton (4.1 feet, ZONE). Allen Ming misses. Rebound secured by Anthony Haliburton.

[09:22] Team_097 possession (Score: 33-33)
Evan Brogdon attempts a 3Pt. Wide open! Tobias Haliburton is 6.2 feet away. [ZONE] Evan Brogdon misses. Rebound secured by Allen Ming.

[09:12] Team_088 possession (Score: 33-33)
Giannis Smith attempts a Midrange. Contested by Anthony Haliburton (4.2 feet, MAN). GIANNIS SMITH MAKES IT! Assist: Josh Duncan
Score: 33-35

[08:56] Team_097 possession (Score: 33-35)
Tyrese Stewart attempts a Midrange. Wide open! Tobias Haliburton is 6.4 feet away. [ZONE] Tyrese Stewart misses. Rebound secured by Allen Ming.

[08:42] Team_088 possession (Score: 33-35)
Tyler Hyland makes the Dunk and draws the foul on Anthony Haliburton! And-1! Tyler Hyland to the line for 1. [Team fouls: 3] (Anthony Haliburton: 3 personal fouls)   FT 1/1: GOOD Tyler Hyland makes 1/1 from the line.
Score: 33-38

[08:23] Team_097 possession (Score: 33-38)
FOUL! Reach-in foul on Allen Ming during the drive. [Team fouls: 1] No free throws, side out. (Allen Ming: 1 personal fouls)

[08:11] Team_097 possession (Score: 33-38)
Shai Poole attempts a 3Pt. Contested by Tyler Hyland (5.8 feet, MAN). Shai Poole misses. Offensive rebound by Anthony Haliburton! Anthony Haliburton kicks it out.

[07:57] Team_097 possession (Score: 33-38)
Evan Brogdon attempts a Midrange. Contested by Tyler Hyland (5.9 feet, ZONE). EVAN BROGDON MAKES IT! Assist: Anthony Haliburton
Score: 35-38

[07:47] Team_088 possession (Score: 35-38)
FOUL! Shooting foul on Shai Poole. Tobias Haliburton to the line for 3 free throws. [Team fouls: 4] (Shai Poole: 1 personal fouls)   FT 1/3: GOOD   FT 2/3: GOOD   FT 3/3: GOOD Tobias Haliburton makes 3/3 from the line.
Score: 35-41

[07:33] Team_097 possession (Score: 35-41)
Anthony Haliburton makes the Layup and draws the foul on Giannis Smith! And-1! Anthony Haliburton to the line for 1. [Team fouls: 2] (Giannis Smith: 1 personal fouls)   FT 1/1: MISS Anthony Haliburton makes 0/1 from the line. Offensive rebound by Anthony Haliburton! Anthony Haliburton kicks it out.
Score: 37-41

[07:18] Team_097 possession (Score: 37-41)
Anthony Haliburton loses control! Ball rolls out of bounds! TURNOVER! (dead ball)

[07:18] Substitution (Team_097): Evan Brogdon OUT → Gary Carter IN (stamina_rule2)

[07:18] Substitution (Team_097): Jrue Haliburton OUT → Dwyane Ginobili IN (stamina_rule2)

[07:18] Substitution (Team_097): Shai Poole OUT → Miles Dosunmu IN (stamina_rule2)

[07:18] Substitution (Team_097): Anthony Haliburton OUT → Joel Simons IN (stamina_rule2)

[07:18] Substitution (Team_097): Tyrese Stewart OUT → Miles Banchero IN (stamina_rule2)

[07:18] Substitution (Team_088): Josh Duncan OUT → Klay Quickley IN (stamina_rule2)

[07:18] Substitution (Team_088): Tobias Haliburton OUT → Vince Carter IN (stamina_rule2)

[07:18] Substitution (Team_088): Tyler Hyland OUT → Pau Bird IN (stamina_rule2)

[07:18] Substitution (Team_088): Giannis Smith OUT → Zion Harris IN (stamina_rule2)

[07:18] Substitution (Team_088): Allen Ming OUT → Josh Embiid IN (stamina_rule2)

[07:08] Team_088 possession (Score: 37-41)
Josh Embiid makes the Layup and draws the foul on Dwyane Ginobili! And-1! Josh Embiid to the line for 1. [BONUS: 5 team fouls] (Dwyane Ginobili: 1 personal fouls)   FT 1/1: GOOD Josh Embiid makes 1/1 from the line.
Score: 37-44

[06:51] Team_097 possession (Score: 37-44)
Joel Simons attempts a Midrange. Contested by Vince Carter (4.9 feet, ZONE). JOEL SIMONS MAKES IT! Assist: Dwyane Ginobili
Score: 39-44

[06:36] Team_088 possession (Score: 39-44)
Josh Embiid attempts a Midrange. Contested by Joel Simons (3.4 feet, MAN). JOSH EMBIID MAKES IT! Assist: Klay Quickley
Score: 39-46

[06:19] Team_097 possession (Score: 39-46)
FOUL! Shooting foul on Pau Bird. Miles Banchero to the line for 3 free throws. [Team fouls: 3] (Pau Bird: 1 personal fouls)   FT 1/3: GOOD   FT 2/3: GOOD   FT 3/3: GOOD Miles Banchero makes 3/3 from the line.
Score: 42-46

[06:08] Team_088 possession (Score: 42-46)
Josh Embiid attempts a 3Pt. Contested by Miles Dosunmu (3.7 feet, ZONE). Josh Embiid misses. FOUL! Loose ball foul on Miles Banchero during the rebound battle. [IN THE BONUS! 6 team fouls] Pau Bird to the line for 2 free throws. (Miles Banchero: 1 personal fouls)   FT 1/2: GOOD   FT 2/2: GOOD Pau Bird makes 2/2 from the line.
Score: 42-48

[05:57] Team_097 possession (Score: 42-48)
FOUL! Shooting foul on Pau Bird. Miles Dosunmu to the line for 2 free throws. [Team fouls: 4] (Pau Bird: 2 personal fouls)   FT 1/2: MISS   FT 2/2: GOOD Miles Dosunmu makes 1/2 from the line.
Score: 43-48

[05:45] Team_088 possession (Score: 43-48)
Josh Embiid drives and kicks out. Zion Harris attempts a Midrange. Contested by Joel Simons (3.6 feet, ZONE). Zion Harris misses. Rebound secured by Joel Simons.

[05:30] Team_097 possession (Score: 43-48)
Joel Simons attempts a 3Pt. Contested by Pau Bird (5.2 feet, ZONE). Joel Simons misses. Offensive rebound by Miles Dosunmu! Miles Dosunmu kicks it out.

[05:17] Team_097 possession (Score: 43-48)
Gary Carter attempts a 3Pt. Contested by Klay Quickley (5.6 feet, MAN). Gary Carter misses. Offensive rebound by Miles Dosunmu! Miles Dosunmu kicks it out.

[05:00] Team_097 possession (Score: 43-48)
Dwyane Ginobili attempts a 3Pt. Contested by Vince Carter (4.6 feet, MAN). Dwyane Ginobili misses. Rebound secured by Pau Bird.

[04:46] Team_088 possession (Score: 43-48)
Pau Bird attempts a Midrange. Contested by Miles Dosunmu (4.1 feet, MAN). Pau Bird misses. Rebound secured by Joel Simons.

[04:26] Team_097 possession (Score: 43-48)
Miles Dosunmu attempts a 3Pt. Contested by Pau Bird (5.5 feet, MAN). Miles Dosunmu misses. Rebound secured by Zion Harris.

[04:07] Team_088 possession (Score: 43-48)
Josh Embiid attempts a Layup. Contested by Joel Simons (3.4 feet, ZONE). Josh Embiid misses. Rebound secured by Joel Simons.

[03:52] Team_097 possession (Score: 43-48)
Dwyane Ginobili attempts a 3Pt. BLOCKED BY VINCE CARTER! Ball is loose! Rebound secured by Zion Harris.

[03:40] Team_088 possession (Score: 43-48)
FOUL! Shooting foul on Joel Simons. Josh Embiid to the line for 2 free throws. [BONUS: 7 team fouls] (Joel Simons: 1 personal fouls)   FT 1/2: GOOD   FT 2/2: GOOD Josh Embiid makes 2/2 from the line.
Score: 43-50

[03:26] Team_097 possession (Score: 43-50)
Miles Dosunmu attempts a 3Pt. Contested by Pau Bird (5.5 feet, MAN). Miles Dosunmu misses. Rebound secured by Pau Bird.

[03:07] Team_088 possession (Score: 43-50)
Vince Carter attempts a 3Pt. Contested by Joel Simons (3.3 feet, ZONE). VINCE CARTER MAKES IT! Assist: Klay Quickley
Score: 43-53

[02:48] Team_097 possession (Score: 43-53)
Miles Dosunmu attempts a 3Pt. BLOCKED BY PAU BIRD! Ball is loose! Rebound secured by Pau Bird.

[02:36] Team_088 possession (Score: 43-53)
Zion Harris attempts a 3Pt. Contested by Joel Simons (4.1 feet, MAN). Zion Harris misses. Offensive rebound by Josh Embiid! Josh Embiid kicks it out.

[02:20] Team_088 possession (Score: 43-53)
Josh Embiid attempts a Layup. Contested by Joel Simons (3.4 feet, MAN). Josh Embiid misses. Rebound secured by Miles Dosunmu.

[02:05] Team_097 possession (Score: 43-53)
Miles Dosunmu attempts a 3Pt. Contested by Pau Bird (5.5 feet, ZONE). MILES DOSUNMU MAKES IT! Assist: Gary Carter
Score: 46-53

[01:51] Team_088 possession (Score: 46-53)
Klay Quickley attempts a 3Pt. Contested by Gary Carter (4.8 feet, MAN). Klay Quickley misses. Rebound secured by Joel Simons.

[01:37] Team_097 possession (Score: 46-53)
FOUL! Reach-in foul on Josh Embiid during the drive. [IN THE BONUS! 5 team fouls] Miles Banchero to the line for 2 free throws. (Josh Embiid: 1 personal fouls)   FT 1/2: GOOD   FT 2/2: GOOD Miles Banchero makes 2/2 from the line.
Score: 48-53

[01:21] Team_088 possession (Score: 48-53)
Zion Harris attempts a Layup. Contested by Joel Simons (4.1 feet, MAN). ZION HARRIS MAKES IT!
Score: 48-55

[01:03] Team_097 possession (Score: 48-55)
Dwyane Ginobili drives and kicks out. Miles Dosunmu attempts a Midrange. Contested by Pau Bird (5.0 feet, MAN). Miles Dosunmu misses. Rebound secured by Josh Embiid.

[00:52] Team_088 possession (Score: 48-55)
Josh Embiid attempts a Midrange. Contested by Joel Simons (3.4 feet, MAN). Josh Embiid misses. Rebound secured by Miles Banchero.

[00:37] Team_097 possession (Score: 48-55)
Dwyane Ginobili attempts a Layup. Contested by Zion Harris (5.7 feet, ZONE). DWYANE GINOBILI MAKES IT! Assist: Miles Banchero
Score: 50-55

[00:21] Team_088 possession (Score: 50-55)
Vince Carter loses control! Ball rolls out of bounds! TURNOVER! (dead ball)

[00:06] Team_097 possession (Score: 50-55)
Miles Dosunmu attempts a 3Pt. Contested by Pau Bird (5.5 feet, MAN). MILES DOSUNMU MAKES IT! Assist: Miles Banchero
Score: 53-55

================================================================================
                              2ND QUARTER COMPLETE                              
================================================================================

2ND QUARTER SCORE: Team_097 23, Team_088 26

BOX SCORE:
================================================================================

Team_097
--------------------------------------------------------------------------------
Player                MIN  PTS  REB  AST  TO      FG   FG%      3P   3P%
--------------------------------------------------------------------------------
Miles Dosunmu           7    7    3    0   0   3/6    50.0     0/0   0.0
Evan Brogdon           17    5    0    0   0   2/4    50.0     0/0   0.0
Miles Banchero          7    5    1    2   0   2/2   100.0     0/0   0.0
Joel Simons             7    2    4    0   0   1/1   100.0     0/0   0.0
Dwyane Ginobili         7    2    0    1   0   1/4    25.0     0/0   0.0
Jrue Haliburton        17    0    0    1   0   0/0     0.0     0/0   0.0
Tyrese Stewart         17    0    1    0   0   0/3     0.0     0/0   0.0
Anthony Haliburton     17    0    3    1   0   0/0     0.0     0/0   0.0
Gary Carter             7    0    0    1   0   0/0     0.0     0/0   0.0

TEAM: FG: 9/20 (45.0%), 3PT: 4/10 (40.0%), REB: 12 (4 off, 8 def), AST: 6, TO: 1
TEAM FOULS: 7 [Team_088 in BONUS]


Team_088
--------------------------------------------------------------------------------
Player                MIN  PTS  REB  AST  TO      FG   FG%      3P   3P%
--------------------------------------------------------------------------------
Josh Embiid             7    7    2    0   0   3/7    42.9     0/0   0.0
Giannis Smith          17    4    3    0   0   2/2   100.0     0/0   0.0
Tyler Hyland           17    3    1    0   0   1/2    50.0     0/0   0.0
Tobias Haliburton      17    3    0    0   0   1/1   100.0     0/0   0.0
Vince Carter            7    3    0    0   0   1/1   100.0     0/0   0.0
Allen Ming             17    2    3    0   0   1/2    50.0     0/0   0.0
Pau Bird                7    2    3    0   0   1/2    50.0     0/0   0.0
Zion Harris             7    2    2    0   0   1/1   100.0     0/0   0.0
Josh Duncan            17    0    0    2   0   0/0     0.0     0/0   0.0
Klay Quickley           7    0    0    2   0   0/1     0.0     0/0   0.0

TEAM: FG: 11/19 (57.9%), 3PT: 3/4 (75.0%), REB: 14 (3 off, 11 def), AST: 4, TO: 1
TEAM FOULS: 5 [Team_097 in BONUS]

================================================================================

================================================================================
                       3RD QUARTER - Team_097 vs Team_088                       
================================================================================

[12:00] Team_097 possession (Score: 53-55)
Evan Brogdon makes the Layup and draws the foul on Tobias Haliburton! And-1! Evan Brogdon to the line for 1. [Team fouls: 1] (Tobias Haliburton: 1 personal fouls)   FT 1/1: GOOD Evan Brogdon makes 1/1 from the line.
Score: 56-55

[11:49] Team_088 possession (Score: 56-55)
Allen Ming makes the Layup and draws the foul on Anthony Haliburton! And-1! Allen Ming to the line for 1. [Team fouls: 1] (Anthony Haliburton: 1 personal fouls)   FT 1/1: GOOD Allen Ming makes 1/1 from the line.
Score: 56-58

[11:35] Team_097 possession (Score: 56-58)
Tyrese Stewart drives to the basket... Tyrese Stewart loses the ball! Stripped by Allen Ming! TURNOVER! (live ball)

[11:21] Team_088 possession (Score: 56-58)
Josh Duncan loses the ball! Stripped by Evan Brogdon! TURNOVER! (live ball)

[11:04] Team_097 possession (Score: 56-58)
Jrue Haliburton attempts a Midrange. Contested by Tobias Haliburton (5.5 feet, MAN). JRUE HALIBURTON MAKES IT!
Score: 58-58

[10:51] Team_088 possession (Score: 58-58)
Tyler Hyland loses the ball! Stripped by Shai Poole! TURNOVER! (live ball)

[10:34] Team_097 possession (Score: 58-58)
FOUL! Holding foul on Giannis Smith. [Team fouls: 2] No free throws, side out. (Giannis Smith: 1 personal fouls)

[10:17] Team_097 possession (Score: 58-58)
Tyrese Stewart drives to the basket... FOUL! Offensive foul on Tyrese Stewart! Giannis Smith drew the charge! [Team fouls: 2] (Tyrese Stewart: 1 personal fouls) TURNOVER! (dead ball)

[10:06] Team_088 possession (Score: 58-58)
Giannis Smith drives and kicks out. Tobias Haliburton attempts a Midrange. Contested by Jrue Haliburton (5.2 feet, MAN). Tobias Haliburton misses. Rebound secured by Tyrese Stewart.

[09:49] Team_097 possession (Score: 58-58)
Tyrese Stewart makes the Dunk and draws the foul on Allen Ming! And-1! Tyrese Stewart to the line for 1. [Team fouls: 3] (Allen Ming: 1 personal fouls)   FT 1/1: MISS Tyrese Stewart makes 0/1 from the line. Rebound secured by Tyler Hyland.
Score: 60-58

[09:33] Team_088 possession (Score: 60-58)
Allen Ming attempts a 3Pt. Contested by Anthony Haliburton (3.5 feet, MAN). Allen Ming misses. Offensive rebound by Giannis Smith! Giannis Smith puts it back in!
Score: 60-60

[09:18] Team_097 possession (Score: 60-60)
Anthony Haliburton drives and kicks out. Shai Poole attempts a 3Pt. Contested by Tobias Haliburton (5.0 feet, ZONE). Shai Poole misses. Rebound secured by Tyler Hyland.

[09:05] Team_088 possession (Score: 60-60)
Giannis Smith attempts a 3Pt. Contested by Shai Poole (3.6 feet, ZONE). Giannis Smith misses. Rebound secured by Tyrese Stewart.

[08:52] Team_097 possession (Score: 60-60)
FOUL! Holding foul on Giannis Smith. [Team fouls: 4] No free throws, side out. (Giannis Smith: 2 personal fouls)

[08:37] Team_097 possession (Score: 60-60)
Tyrese Stewart makes the Layup and draws the foul on Allen Ming! And-1! Tyrese Stewart to the line for 1. [BONUS: 5 team fouls] (Allen Ming: 2 personal fouls)   FT 1/1: GOOD Tyrese Stewart makes 1/1 from the line.
Score: 63-60

[08:25] Team_088 possession (Score: 63-60)
FOUL! Reach-in foul on Anthony Haliburton during the drive. [Team fouls: 3] No free throws, side out. (Anthony Haliburton: 2 personal fouls)

[08:11] Team_088 possession (Score: 63-60)
Allen Ming drives, Anthony Haliburton stays with him. Allen Ming attempts a Dunk. Contested by Anthony Haliburton (3.5 feet, MAN). ALLEN MING MAKES IT! Assist: Giannis Smith
Score: 63-62

[08:02] Team_097 possession (Score: 63-62)
Evan Brogdon attempts a Midrange. Contested by Tobias Haliburton (5.7 feet, ZONE). Evan Brogdon misses. Rebound secured by Tyler Hyland.

[07:46] Team_088 possession (Score: 63-62)
FOUL! Holding foul on Evan Brogdon. [Team fouls: 4] No free throws, side out. (Evan Brogdon: 1 personal fouls)

[07:31] Team_088 possession (Score: 63-62)
FOUL! Reach-in foul on Shai Poole during the drive. [IN THE BONUS! 5 team fouls] Tyler Hyland to the line for 2 free throws. (Shai Poole: 1 personal fouls)   FT 1/2: GOOD   FT 2/2: MISS Tyler Hyland makes 1/2 from the line. Rebound secured by Shai Poole.
Score: 63-63

[07:15] Team_097 possession (Score: 63-63)
Tyrese Stewart makes the Dunk and draws the foul on Allen Ming! And-1! Tyrese Stewart to the line for 1. [BONUS: 6 team fouls] (Allen Ming: 3 personal fouls)   FT 1/1: GOOD Tyrese Stewart makes 1/1 from the line.
Score: 66-63

[07:04] Team_088 possession (Score: 66-63)
Giannis Smith attempts a Midrange. Contested by Jrue Haliburton (5.4 feet, ZONE). Giannis Smith misses. Rebound secured by Tyrese Stewart.

[06:49] Team_097 possession (Score: 66-63)
Jrue Haliburton attempts a 3Pt. Contested by Tobias Haliburton (5.5 feet, MAN). Jrue Haliburton misses. Offensive rebound by Anthony Haliburton! Anthony Haliburton puts it back in!
Score: 68-63

[06:35] Team_088 possession (Score: 68-63)
Tyler Hyland attempts a Midrange. Contested by Shai Poole (3.3 feet, MAN). TYLER HYLAND MAKES IT! Assist: Josh Duncan
Score: 68-65

[06:17] Team_097 possession (Score: 68-65)
Evan Brogdon attempts a Midrange. Contested by Josh Duncan (6.0 feet, MAN). EVAN BROGDON MAKES IT! Assist: Anthony Haliburton
Score: 70-65

[06:07] Team_088 possession (Score: 70-65)
Tobias Haliburton attempts a 3Pt. Contested by Shai Poole (3.4 feet, ZONE). Tobias Haliburton misses. FOUL! Loose ball foul on Shai Poole during the rebound battle. [IN THE BONUS! 6 team fouls] Allen Ming to the line for 2 free throws. (Shai Poole: 2 personal fouls)   FT 1/2: GOOD   FT 2/2: MISS Allen Ming makes 1/2 from the line. Rebound secured by Tyrese Stewart.
Score: 70-66

[05:52] Team_097 possession (Score: 70-66)
Evan Brogdon attempts a 3Pt. Contested by Josh Duncan (6.0 feet, MAN). Evan Brogdon misses. Rebound secured by Giannis Smith.

[05:38] Team_088 possession (Score: 70-66)
Tobias Haliburton drives, picks up Jrue Haliburton. Help arrives from Shai Poole! Tobias Haliburton attempts a Layup. Contested by Shai Poole (5.2 feet, MAN). Tobias Haliburton misses. Rebound secured by Tyrese Stewart.

[05:20] Team_097 possession (Score: 70-66)
Anthony Haliburton makes the Layup and draws the foul on Giannis Smith! And-1! Anthony Haliburton to the line for 1. [BONUS: 7 team fouls] (Giannis Smith: 3 personal fouls)   FT 1/1: GOOD Anthony Haliburton makes 1/1 from the line.
Score: 73-66

[05:05] Team_088 possession (Score: 73-66)
Allen Ming makes the Layup and draws the foul on Anthony Haliburton! And-1! Allen Ming to the line for 1. [BONUS: 7 team fouls] (Anthony Haliburton: 3 personal fouls)   FT 1/1: GOOD Allen Ming makes 1/1 from the line.
Score: 73-69

[04:50] Team_097 possession (Score: 73-69)
FOUL! Reach-in foul on Tyler Hyland during the drive. [IN THE BONUS! 8 team fouls] Shai Poole to the line for 2 free throws. (Tyler Hyland: 1 personal fouls)   FT 1/2: GOOD   FT 2/2: GOOD Shai Poole makes 2/2 from the line.
Score: 75-69

[04:35] Team_088 possession (Score: 75-69)
FOUL! Shooting foul on Anthony Haliburton. Giannis Smith to the line for 2 free throws. [BONUS: 8 team fouls] (Anthony Haliburton: 4 personal fouls)   FT 1/2: GOOD   FT 2/2: GOOD Giannis Smith makes 2/2 from the line.
Score: 75-71

[04:24] Team_097 possession (Score: 75-71)
Shai Poole attempts a Layup. BLOCKED BY GIANNIS SMITH! Ball is loose! Rebound secured by Allen Ming.

[04:07] Team_088 possession (Score: 75-71)
Allen Ming attempts a Layup. Contested by Anthony Haliburton (3.6 feet, MAN). ALLEN MING MAKES IT! Assist: Giannis Smith
Score: 75-73

[03:53] Team_097 possession (Score: 75-73)
Evan Brogdon attempts a Midrange. Wide open! Josh Duncan is 6.1 feet away. [MAN] EVAN BROGDON MAKES IT!
Score: 77-73

[03:39] Team_088 possession (Score: 77-73)
Tyler Hyland drives to the basket... Tyler Hyland loses control! Ball rolls out of bounds! TURNOVER! (dead ball)

[03:29] Team_097 possession (Score: 77-73)
Jrue Haliburton attempts a 3Pt. Contested by Tobias Haliburton (5.6 feet, MAN). Jrue Haliburton misses. Offensive rebound by Anthony Haliburton! Anthony Haliburton kicks it out.

[03:14] Team_097 possession (Score: 77-73)
Tyrese Stewart attempts a Midrange. Contested by Tyler Hyland (5.6 feet, ZONE). Tyrese Stewart misses. Rebound secured by Tyler Hyland.

[03:00] Team_088 possession (Score: 77-73)
Allen Ming drives, Anthony Haliburton stays with him. Allen Ming attempts a Dunk. Contested by Anthony Haliburton (3.7 feet, ZONE). Allen Ming misses. Rebound secured by Anthony Haliburton.

[02:45] Team_097 possession (Score: 77-73)
Jrue Haliburton attempts a Midrange. Contested by Giannis Smith (4.8 feet, ZONE). Jrue Haliburton misses. Rebound secured by Giannis Smith.

[02:27] Team_088 possession (Score: 77-73)
Tobias Haliburton attempts a Layup. Contested by Jrue Haliburton (5.4 feet, MAN). TOBIAS HALIBURTON MAKES IT! Assist: Giannis Smith
Score: 77-75

[02:12] Team_097 possession (Score: 77-75)
Jrue Haliburton attempts a Layup. BLOCKED BY TYLER HYLAND! Ball deflects out of bounds off Jrue Haliburton.

[01:52] Team_088 possession (Score: 77-75)
Giannis Smith attempts a Midrange. Contested by Anthony Haliburton (3.8 feet, MAN). Giannis Smith misses. Rebound secured by Anthony Haliburton.

[01:33] Team_097 possession (Score: 77-75)
Jrue Haliburton attempts a 3Pt. Contested by Tobias Haliburton (5.8 feet, MAN). Jrue Haliburton misses. Rebound secured by Allen Ming.

[01:20] Team_088 possession (Score: 77-75)
Josh Duncan throws a bad pass out of bounds! TURNOVER! (dead ball)

[01:20] Substitution (Team_097): Evan Brogdon OUT → Gary Carter IN (stamina_rule2)

[01:20] Substitution (Team_097): Jrue Haliburton OUT → Dwyane Ginobili IN (stamina_rule2)

[01:20] Substitution (Team_097): Shai Poole OUT → Miles Dosunmu IN (stamina_rule2)

[01:20] Substitution (Team_097): Anthony Haliburton OUT → Joel Simons IN (stamina_rule2)

[01:20] Substitution (Team_097): Tyrese Stewart OUT → Miles Banchero IN (stamina_rule2)

[01:20] Substitution (Team_088): Josh Duncan OUT → Klay Quickley IN (stamina_rule2)

[01:20] Substitution (Team_088): Tobias Haliburton OUT → Vince Carter IN (stamina_rule2)

[01:20] Substitution (Team_088): Tyler Hyland OUT → Pau Bird IN (stamina_rule2)

[01:20] Substitution (Team_088): Giannis Smith OUT → Zion Harris IN (stamina_rule2)

[01:20] Substitution (Team_088): Allen Ming OUT → Josh Embiid IN (stamina_rule2)

[01:07] Team_097 possession (Score: 77-75)
FOUL! Reach-in foul on Josh Embiid during the drive. [IN THE BONUS! 9 team fouls] Miles Banchero to the line for 2 free throws. (Josh Embiid: 1 personal fouls)   FT 1/2: GOOD   FT 2/2: GOOD Miles Banchero makes 2/2 from the line.
Score: 79-75

[00:53] Team_088 possession (Score: 79-75)
Vince Carter attempts a 3Pt. Contested by Dwyane Ginobili (4.3 feet, MAN). Vince Carter misses. Rebound secured by Miles Dosunmu.

[00:43] Team_097 possession (Score: 79-75)
Miles Banchero attempts a Layup. Contested by Zion Harris (5.9 feet, ZONE). MILES BANCHERO MAKES IT!
Score: 81-75

[00:29] Team_088 possession (Score: 81-75)
Vince Carter drives and kicks out. Pau Bird attempts a Midrange. Contested by Miles Dosunmu (3.8 feet, MAN). Pau Bird misses. Rebound secured by Miles Banchero.

[00:13] Team_097 possession (Score: 81-75)
Miles Banchero attempts a 3Pt. Contested by Pau Bird (5.1 feet, ZONE). Miles Banchero misses. Rebound secured by Zion Harris.

================================================================================
                              3RD QUARTER COMPLETE                              
================================================================================

3RD QUARTER SCORE: Team_097 28, Team_088 20

BOX SCORE:
================================================================================

Team_097
--------------------------------------------------------------------------------
Player                MIN  PTS  REB  AST  TO      FG   FG%      3P   3P%
--------------------------------------------------------------------------------
Evan Brogdon           28    7    0    0   0   3/5    60.0     0/0   0.0
Tyrese Stewart         28    6    5    0   0   2/4    50.0     0/0   0.0
Anthony Haliburton     28    5    4    1   0   2/3    66.7     0/0   0.0
Miles Banchero          8    4    1    0   0   2/3    66.7     0/0   0.0
Jrue Haliburton        28    2    0    0   0   1/4    25.0     0/0   0.0
Shai Poole             28    2    1    0   0   1/2    50.0     0/0   0.0
Miles Dosunmu           8    0    1    0   0   0/0     0.0     0/0   0.0

TEAM: FG: 11/21 (52.4%), 3PT: 1/4 (25.0%), REB: 11 (2 off, 9 def), AST: 1, TO: 2
TEAM FOULS: 8 [Team_088 in BONUS]


Team_088
--------------------------------------------------------------------------------
Player                MIN  PTS  REB  AST  TO      FG   FG%      3P   3P%
--------------------------------------------------------------------------------
Allen Ming             28   10    2    0   0   4/5    80.0     0/0   0.0
Giannis Smith          28    4    3    3   0   2/6    33.3     0/0   0.0
Tyler Hyland           28    2    4    0   0   1/2    50.0     0/0   0.0
Tobias Haliburton      28    2    0    0   0   1/3    33.3     0/0   0.0
Josh Duncan            28    0    0    1   0   0/0     0.0     0/0   0.0
Vince Carter            8    0    0    0   0   0/2     0.0     0/0   0.0
Zion Harris             8    0    1    0   0   0/0     0.0     0/0   0.0

TEAM: FG: 8/18 (44.4%), 3PT: 1/4 (25.0%), REB: 11 (2 off, 9 def), AST: 4, TO: 4
TEAM FOULS: 9 [Team_097 in BONUS]

================================================================================

================================================================================
                       4TH QUARTER - Team_097 vs Team_088                       
================================================================================

[12:00] Team_097 possession (Score: 81-75)
Evan Brogdon drives, Josh Duncan stays with him. Evan Brogdon attempts a Dunk. Wide open! Josh Duncan is 6.1 feet away. [MAN] EVAN BROGDON MAKES IT! Assist: Anthony Haliburton
Score: 83-75

[11:43] Team_088 possession (Score: 83-75)
Giannis Smith makes the Layup and draws the foul on Anthony Haliburton! And-1! Giannis Smith to the line for 1. [Team fouls: 1] (Anthony Haliburton: 1 personal fouls)   FT 1/1: GOOD Giannis Smith makes 1/1 from the line.
Score: 83-78

[11:30] Team_097 possession (Score: 83-78)
Evan Brogdon attempts a Midrange. Wide open! Josh Duncan is 6.1 feet away. [MAN] Evan Brogdon misses. Offensive rebound by Anthony Haliburton! Anthony Haliburton's putback is no good. Rebound secured by Tyler Hyland.

[11:16] Team_088 possession (Score: 83-78)
Allen Ming attempts a Midrange. Contested by Jrue Haliburton (5.5 feet, ZONE). ALLEN MING MAKES IT! Assist: Josh Duncan
Score: 83-80

[10:57] Team_097 possession (Score: 83-80)
Evan Brogdon attempts a 3Pt. Contested by Tobias Haliburton (5.9 feet, ZONE). EVAN BROGDON MAKES IT!
Score: 86-80

[10:45] Team_088 possession (Score: 86-80)
Josh Duncan attempts a Layup. Contested by Anthony Haliburton (3.6 feet, ZONE). JOSH DUNCAN MAKES IT! Assist: Tobias Haliburton
Score: 86-82

[10:31] Team_097 possession (Score: 86-82)
Evan Brogdon attempts a 3Pt. Contested by Tobias Haliburton (5.9 feet, ZONE). EVAN BROGDON MAKES IT! Assist: Anthony Haliburton
Score: 89-82

[10:20] Team_088 possession (Score: 89-82)
Josh Duncan attempts a 3Pt. Contested by Evan Brogdon (5.0 feet, MAN). Josh Duncan misses. Rebound secured by Tyrese Stewart.

[10:04] Team_097 possession (Score: 89-82)
Jrue Haliburton attempts a Midrange. Contested by Tobias Haliburton (5.8 feet, MAN). Jrue Haliburton misses. Offensive rebound by Anthony Haliburton! Anthony Haliburton kicks it out.

[09:49] Team_097 possession (Score: 89-82)
Anthony Haliburton attempts a 3Pt. Contested by Tobias Haliburton (5.8 feet, ZONE). Anthony Haliburton misses. Rebound secured by Allen Ming.

[09:36] Team_088 possession (Score: 89-82)
FOUL! Reach-in foul on Anthony Haliburton during the drive. [Team fouls: 2] No free throws, side out. (Anthony Haliburton: 2 personal fouls)

[09:20] Team_088 possession (Score: 89-82)
FOUL! Reach-in foul on Anthony Haliburton during the drive. [Team fouls: 3] No free throws, side out. (Anthony Haliburton: 3 personal fouls)

[09:04] Team_088 possession (Score: 89-82)
Tyler Hyland attempts a 3Pt. Contested by Shai Poole (3.7 feet, MAN). Tyler Hyland misses. Offensive rebound by Giannis Smith! Giannis Smith kicks it out.

[08:49] Team_088 possession (Score: 89-82)
Tobias Haliburton drives and kicks out. Tobias Haliburton attempts a Midrange. Contested by Shai Poole (3.9 feet, ZONE). Tobias Haliburton misses. Rebound secured by Anthony Haliburton.

[08:38] Team_097 possession (Score: 89-82)
Shai Poole attempts a 3Pt. Contested by Tyler Hyland (5.5 feet, MAN). Shai Poole misses. Rebound secured by Allen Ming.

[08:28] Team_088 possession (Score: 89-82)
Tyler Hyland makes the Midrange and draws the foul on Anthony Haliburton! And-1! Tyler Hyland to the line for 1. [Team fouls: 4] (Anthony Haliburton: 4 personal fouls)   FT 1/1: GOOD Tyler Hyland makes 1/1 from the line.
Score: 89-85

[08:17] Team_097 possession (Score: 89-85)
Tyrese Stewart drives to the basket... FOUL! Offensive foul on Tyrese Stewart! Giannis Smith drew the charge! [Team fouls: 5] (Tyrese Stewart: 1 personal fouls) TURNOVER! (dead ball)

[08:03] Team_088 possession (Score: 89-85)
Tobias Haliburton attempts a Midrange. Contested by Jrue Haliburton (5.6 feet, MAN). Tobias Haliburton misses. Rebound secured by Anthony Haliburton.

[07:53] Team_097 possession (Score: 89-85)
Anthony Haliburton attempts a Layup. Contested by Giannis Smith (5.2 feet, ZONE). Anthony Haliburton misses. Offensive rebound by Anthony Haliburton! Anthony Haliburton kicks it out.

[07:43] Team_097 possession (Score: 89-85)
Anthony Haliburton attempts a 3Pt. Wide open! Tobias Haliburton is 6.0 feet away. [ZONE] Anthony Haliburton misses. Rebound secured by Allen Ming.

[07:31] Team_088 possession (Score: 89-85)
Giannis Smith attempts a 3Pt. Contested by Shai Poole (4.2 feet, ZONE). Giannis Smith misses. Rebound secured by Tyrese Stewart.

[07:18] Team_097 possession (Score: 89-85)
Evan Brogdon attempts a 3Pt. Wide open! Tobias Haliburton is 6.3 feet away. [ZONE] EVAN BROGDON MAKES IT! Assist: Jrue Haliburton
Score: 92-85

[07:02] Team_088 possession (Score: 92-85)
Josh Duncan drives to the basket... Josh Duncan loses the ball! Stripped by Evan Brogdon! TURNOVER! (live ball)

[06:50] Team_097 possession (Score: 92-85)
Evan Brogdon attempts a Layup. Contested by Giannis Smith (5.6 feet, ZONE). Evan Brogdon misses. Rebound secured by Tyler Hyland.

[06:39] Team_088 possession (Score: 92-85)
Giannis Smith attempts a 3Pt. Contested by Jrue Haliburton (5.9 feet, ZONE). Giannis Smith misses. Rebound secured by Shai Poole.

[06:25] Team_097 possession (Score: 92-85)
Evan Brogdon attempts a 3Pt. Wide open! Tobias Haliburton is 6.4 feet away. [ZONE] Evan Brogdon misses. Offensive rebound by Anthony Haliburton! Anthony Haliburton kicks it out.

[06:09] Team_097 possession (Score: 92-85)
Jrue Haliburton attempts a Midrange. Wide open! Tobias Haliburton is 6.3 feet away. [ZONE] Jrue Haliburton misses. FOUL! Loose ball foul on Allen Ming during the rebound battle. [Team fouls: 1] No free throws, side out. (Allen Ming: 1 personal fouls)

[05:56] Team_097 possession (Score: 92-85)
Shai Poole attempts a 3Pt. Contested by Tyler Hyland (5.9 feet, MAN). Shai Poole misses. FOUL! Loose ball foul on Tyler Hyland during the rebound battle. [Team fouls: 2] No free throws, side out. (Tyler Hyland: 1 personal fouls)

[05:46] Team_097 possession (Score: 92-85)
Jrue Haliburton attempts a 3Pt. Contested by Giannis Smith (5.6 feet, ZONE). Jrue Haliburton misses. Rebound secured by Allen Ming.

[05:33] Team_088 possession (Score: 92-85)
FOUL! Reach-in foul on Tyrese Stewart during the drive. [IN THE BONUS! 6 team fouls] Allen Ming to the line for 2 free throws. (Tyrese Stewart: 2 personal fouls)   FT 1/2: GOOD   FT 2/2: GOOD Allen Ming makes 2/2 from the line.
Score: 92-87

[05:16] Team_097 possession (Score: 92-87)
Tyrese Stewart attempts a Layup. Contested by Giannis Smith (6.0 feet, ZONE). TYRESE STEWART MAKES IT! Assist: Anthony Haliburton
Score: 94-87

[05:00] Team_088 possession (Score: 94-87)
Tobias Haliburton makes the Layup and draws the foul on Anthony Haliburton! And-1! Tobias Haliburton to the line for 1. [BONUS: 7 team fouls] (Anthony Haliburton: 5 personal fouls)   FT 1/1: GOOD Tobias Haliburton makes 1/1 from the line.
Score: 94-90

[04:48] Team_097 possession (Score: 94-90)
Shai Poole attempts a Midrange. Wide open! Tyler Hyland is 6.1 feet away. [ZONE] Shai Poole misses. Offensive rebound by Tyrese Stewart! Tyrese Stewart kicks it out.

[04:36] Team_097 possession (Score: 94-90)
Tyrese Stewart drives and kicks out. Anthony Haliburton attempts a 3Pt. Wide open! Tobias Haliburton is 6.2 feet away. [ZONE] Anthony Haliburton misses. Rebound secured by Allen Ming.

[04:25] Team_088 possession (Score: 94-90)
Giannis Smith attempts a 3Pt. Contested by Shai Poole (4.7 feet, ZONE). Giannis Smith misses. Rebound secured by Tyrese Stewart.

[04:12] Team_097 possession (Score: 94-90)
Jrue Haliburton attempts a Midrange. Wide open! Tobias Haliburton is 6.5 feet away. [MAN] JRUE HALIBURTON MAKES IT!
Score: 96-90

[04:00] Team_088 possession (Score: 96-90)
Tobias Haliburton attempts a 3Pt. Contested by Shai Poole (4.7 feet, ZONE). Tobias Haliburton misses. Offensive rebound by Allen Ming! Allen Ming kicks it out.

[03:48] Team_088 possession (Score: 96-90)
Tobias Haliburton drives, Anthony Haliburton stays with him. Tobias Haliburton attempts a Layup. Contested by Anthony Haliburton (4.7 feet, ZONE). TOBIAS HALIBURTON MAKES IT!
Score: 96-92

[03:33] Team_097 possession (Score: 96-92)
Tyrese Stewart attempts a Midrange. Wide open! Giannis Smith is 6.3 feet away. [ZONE] TYRESE STEWART MAKES IT! Assist: Anthony Haliburton
Score: 98-92

[03:15] Team_088 possession (Score: 98-92)
Josh Duncan attempts a Layup. BLOCKED BY ANTHONY HALIBURTON! Ball is loose! Rebound secured by Tyrese Stewart.

[02:56] Team_097 possession (Score: 98-92)
Evan Brogdon attempts a Midrange. Wide open! Josh Duncan is 7.1 feet away. [MAN] EVAN BROGDON MAKES IT! Assist: Anthony Haliburton
Score: 100-92

[02:42] Team_088 possession (Score: 100-92)
Tobias Haliburton attempts a 3Pt. Wide open! Jrue Haliburton is 6.2 feet away. [MAN] TOBIAS HALIBURTON MAKES IT!
Score: 100-95

[02:24] Team_097 possession (Score: 100-95)
Shai Poole attempts a 3Pt. Wide open! Tyler Hyland is 6.4 feet away. [MAN] Shai Poole misses. Offensive rebound by Tyrese Stewart! Tyrese Stewart kicks it out.

[02:09] Team_097 possession (Score: 100-95)
FOUL! Reach-in foul on Giannis Smith during the drive. [Team fouls: 3] No free throws, side out. (Giannis Smith: 1 personal fouls)

[01:56] Team_097 possession (Score: 100-95)
Tyrese Stewart attempts a Midrange. Wide open! Allen Ming is 6.6 feet away. [MAN] Tyrese Stewart misses. Offensive rebound by Anthony Haliburton! Anthony Haliburton kicks it out.

[01:39] Team_097 possession (Score: 100-95)
FOUL! Reach-in foul on Tyler Hyland during the drive. [Team fouls: 4] No free throws, side out. (Tyler Hyland: 2 personal fouls)

[01:24] Team_097 possession (Score: 100-95)
Evan Brogdon attempts a 3Pt. Wide open! Tobias Haliburton is 7.0 feet away. [ZONE] Evan Brogdon misses. Offensive rebound by Tyrese Stewart! Tyrese Stewart kicks it out.

[01:07] Team_097 possession (Score: 100-95)
Anthony Haliburton drives, Giannis Smith stays with him. Anthony Haliburton attempts a Dunk. Wide open! Giannis Smith is 6.3 feet away. [MAN] ANTHONY HALIBURTON MAKES IT!
Score: 102-95

[00:52] Team_088 possession (Score: 102-95)
FOUL! Shooting foul on Anthony Haliburton. Tobias Haliburton to the line for 2 free throws. [BONUS: 8 team fouls] (Anthony Haliburton: 6 personal fouls) Anthony Haliburton FOULS OUT!   FT 1/2: GOOD   FT 2/2: MISS Tobias Haliburton makes 1/2 from the line. Rebound secured by Anthony Haliburton.
Score: 102-96

[00:52] Substitution (Team_097): Anthony Haliburton OUT (stamina: 38) → Gary Carter IN (foul_out)

[00:34] Team_097 possession (Score: 102-96)
Gary Carter drives, picks up Josh Duncan. Help arrives from Tobias Haliburton! Gary Carter attempts a Layup. Wide open! Tobias Haliburton is 6.9 feet away. [MAN] GARY CARTER MAKES IT!
Score: 104-96

[00:21] Team_088 possession (Score: 104-96)
Tobias Haliburton attempts a Midrange. Contested by Shai Poole (5.2 feet, ZONE). Tobias Haliburton misses. Rebound secured by Tyrese Stewart.

[00:03] Team_097 possession (Score: 104-96)
Tyrese Stewart throws a bad pass! Stolen by Allen Ming! TURNOVER! (live ball)

================================================================================
                              4TH QUARTER COMPLETE                              
================================================================================

4TH QUARTER SCORE: Team_097 23, Team_088 21

BOX SCORE:
================================================================================

Team_097
--------------------------------------------------------------------------------
Player                MIN  PTS  REB  AST  TO      FG   FG%      3P   3P%
--------------------------------------------------------------------------------
Evan Brogdon           40   13    0    0   0   5/7    71.4     0/0   0.0
Tyrese Stewart         40    4    9    0   0   2/3    66.7     0/0   0.0
Anthony Haliburton     39    2    8    5   0   1/3    33.3     0/0   0.0
Jrue Haliburton        40    2    0    1   0   1/2    50.0     0/0   0.0
Gary Carter             9    2    0    0   0   1/1   100.0     0/0   0.0
Shai Poole             40    0    1    0   0   0/1     0.0     0/0   0.0

TEAM: FG: 10/17 (58.8%), 3PT: 3/7 (42.9%), REB: 19 (10 off, 9 def), AST: 6, TO: 2
TEAM FOULS: 8 [Team_088 in BONUS]


Team_088
--------------------------------------------------------------------------------
Player                MIN  PTS  REB  AST  TO      FG   FG%      3P   3P%
--------------------------------------------------------------------------------
Tobias Haliburton      40    8    0    1   0   3/7    42.9     0/0   0.0
Allen Ming             40    4    6    0   0   2/2   100.0     0/0   0.0
Giannis Smith          40    3    1    0   0   1/4    25.0     0/0   0.0
Tyler Hyland           40    3    2    0   0   1/1   100.0     0/0   0.0
Josh Duncan            40    2    0    1   0   1/3    33.3     0/0   0.0

TEAM: FG: 8/17 (47.1%), 3PT: 1/5 (20.0%), REB: 8 (2 off, 6 def), AST: 2, TO: 1
TEAM FOULS: 4

================================================================================

================================================================================
                               FULL GAME COMPLETE                               
================================================================================

FINAL SCORE: Team_097 104, Team_088 96

SCORING BY QUARTER:
--------------------------------------------------------------------------------
Team                     Q1     Q2     Q3     Q4    FINAL
--------------------------------------------------------------------------------
Team_097                 30     23     28     23      104
Team_088                 29     26     20     21       96
--------------------------------------------------------------------------------

FULL GAME BOX SCORE:
================================================================================

Team_097
--------------------------------------------------------------------------------
Player                MIN  PTS  REB  AST  TO      FG   FG%      3P   3P%      FT STL BLK
--------------------------------------------------------------------------------
Evan Brogdon           40   27    0    3   1  12/18   66.7   4/6    66.7   1/1     2   0
Jrue Haliburton        40   13    0    2   0   7/14   50.0   2/7    28.6   0/0     0   1
Shai Poole             40   12    3    2   0   4/8    50.0   3/5    60.0   3/4     1   0
Tyrese Stewart         40   19   18    0   5   7/15   46.7   0/1     0.0   7/8     0   0
Anthony Haliburton     39    7   18   10   1   2/6    33.3   0/3     0.0   1/2     1   2
Gary Carter             9    2    0    1   0   1/1   100.0   0/0     0.0   0/0     0   0
Dwyane Ginobili         8    2    0    1   0   1/4    25.0   0/2     0.0   0/0     0   0
Miles Dosunmu           8    7    4    0   0   3/6    50.0   2/5    40.0   1/2     0   0
Joel Simons             8    2    4    0   0   1/1   100.0   0/0     0.0   0/0     0   0
Miles Banchero          8    9    2    2   0   4/5    80.0   1/2    50.0   7/7     0   0

TEAM: FG: 43/79 (54.4%), 3PT: 12/31 (38.7%), REB: 49 (18 off, 31 def), AST: 21, TO: 7


Team_088
--------------------------------------------------------------------------------
Player                MIN  PTS  REB  AST  TO      FG   FG%      3P   3P%      FT STL BLK
--------------------------------------------------------------------------------
Josh Duncan            40    4    0    5   3   3/6    50.0   0/2     0.0   0/1     0   0
Tobias Haliburton      40   16    0    1   3   7/13   53.8   3/4    75.0   6/7     0   0
Tyler Hyland           40   12    9    4   2   5/8    62.5   1/2    50.0   4/5     0   1
Giannis Smith          40   19   12    3   0   6/15   40.0   0/5     0.0   5/5     0   1
Allen Ming             40   28   15    0   1  12/16   75.0   1/1   100.0   7/8     3   0
Klay Quickley           8    0    0    2   0   0/1     0.0   0/1     0.0   0/0     0   0
Vince Carter            8    3    0    0   1   1/3    33.3   1/2    50.0   0/0     0   1
Pau Bird                8    2    3    0   0   0/1     0.0   0/0     0.0   2/2     0   1
Zion Harris             8    2    3    0   0   1/1   100.0   0/0     0.0   0/0     0   0
Josh Embiid             8    7    2    0   0   4/8    50.0   1/1   100.0   3/3     0   0

TEAM: FG: 39/72 (54.2%), 3PT: 7/18 (38.9%), REB: 44 (10 off, 34 def), AST: 15, TO: 10

================================================================================
