================================================================================
                        FULL GAME - Team_070 vs Team_046                        
================================================================================

================================================================================
                       1ST QUARTER - Team_070 vs Team_046                       
================================================================================

[12:00] Team_070 possession (Score: 0-0)
FOUL! Shooting foul on Lauri Carter. John Hyland to the line for 2 free throws. [Team fouls: 1] (Lauri Carter: 1 personal fouls)   FT 1/2: GOOD   FT 2/2: GOOD John Hyland makes 2/2 from the line.
Score: 2-0

[11:48] Team_046 possession (Score: 2-0)
Kevin Allen attempts a Layup. BLOCKED BY LEBRON BARNES! Ball is loose! Offensive rebound by Cade Wall! Cade Wall kicks it out.

[11:32] Team_046 possession (Score: 2-0)
Kevin Allen attempts a Layup. BLOCKED BY LEBRON BARNES! Ball deflects out of bounds off Kevin Allen.

[11:15] Team_070 possession (Score: 2-0)
John Hyland attempts a 3Pt. Contested by Lauri Carter (3.2 feet, MAN). John Hyland misses. Offensive rebound by Khris Bryant! Khris Bryant puts it back in!
Score: 4-0

[11:05] Team_046 possession (Score: 4-0)
Lauri Carter attempts a Midrange. Contested by Khris Bryant (2.6 feet, ZONE). LAURI CARTER MAKES IT! Assist: Cade Wall
Score: 4-2

[10:49] Team_070 possession (Score: 4-2)
Khris Bryant attempts a 3Pt. Contested by Cade Wall (3.6 feet, MAN). Khris Bryant misses. Rebound secured by Lauri Carter.

[10:37] Team_046 possession (Score: 4-2)
FOUL! Reach-in foul on Khris Bryant during the drive. [Team fouls: 1] No free throws, side out. (Khris Bryant: 1 personal fouls)

[10:24] Team_046 possession (Score: 4-2)
D'Angelo O'Neal attempts a Midrange. Contested by Khris Bryant (2.7 feet, ZONE). D'Angelo O'Neal misses. Rebound secured by LeBron Barnes.

[10:10] Team_070 possession (Score: 4-2)
LeBron Barnes attempts a Layup. BLOCKED BY KEVIN ALLEN! Ball deflects out of bounds off LeBron Barnes.

[09:55] Team_046 possession (Score: 4-2)
D'Angelo O'Neal attempts a 3Pt. Contested by Cole Gasol (5.5 feet, MAN). D'ANGELO O'NEAL MAKES IT!
Score: 4-5

[09:42] Team_070 possession (Score: 4-5)
Jabari Paul drives and kicks out. Jabari Paul attempts a 3Pt. Contested by Lauri Carter (3.2 feet, ZONE). Jabari Paul misses. Rebound secured by Lauri Carter.

[09:27] Team_046 possession (Score: 4-5)
Kevin Allen drives and kicks out. Lauri Carter attempts a Midrange. Contested by John Hyland (4.5 feet, MAN). LAURI CARTER MAKES IT!
Score: 4-7

[09:16] Team_070 possession (Score: 4-7)
FOUL! Shooting foul on Kevin Allen. Jabari Paul to the line for 2 free throws. [Team fouls: 2] (Kevin Allen: 1 personal fouls)   FT 1/2: GOOD   FT 2/2: GOOD Jabari Paul makes 2/2 from the line.
Score: 6-7

[09:01] Team_046 possession (Score: 6-7)
Kevin Allen attempts a 3Pt. Contested by Khris Bryant (2.7 feet, MAN). Kevin Allen misses. Offensive rebound by Cade Wall! Cade Wall kicks it out.

[08:50] Team_046 possession (Score: 6-7)
Victor Nowitzki attempts a 3Pt. Contested by LeBron Barnes (3.7 feet, MAN). Victor Nowitzki misses. Offensive rebound by Kevin Allen! Kevin Allen kicks it out.

[08:40] Team_046 possession (Score: 6-7)
D'Angelo O'Neal drives, Khris Bryant stays with him. D'Angelo O'Neal attempts a Layup. Contested by Khris Bryant (2.7 feet, ZONE). D'Angelo O'Neal misses. Offensive rebound by Cade Wall! Cade Wall kicks it out.

[08:24] Team_046 possession (Score: 6-7)
Victor Nowitzki drives and kicks out. D'Angelo O'Neal attempts a 3Pt. Contested by Khris Bryant (2.4 feet, ZONE). D'Angelo O'Neal misses. Rebound secured by Khris Bryant.

[08:12] Team_070 possession (Score: 6-7)
Cole Gasol attempts a 3Pt. Contested by Victor Nowitzki (5.7 feet, ZONE). Cole Gasol misses. Rebound secured by Lauri Carter.

[07:54] Team_046 possession (Score: 6-7)
FOUL! Holding foul on Khris Bryant. [Team fouls: 2] No free throws, side out. (Khris Bryant: 2 personal fouls)

[07:43] Team_046 possession (Score: 6-7)
Lauri Carter drives to the basket... Lauri Carter throws a bad pass! Stolen by John Hyland! TURNOVER! (live ball)

[07:24] Team_070 possession (Score: 6-7)
Jabari Paul attempts a Midrange. Wide open! Victor Nowitzki is 6.2 feet away. [ZONE] JABARI PAUL MAKES IT!
Score: 8-7

[07:08] Team_046 possession (Score: 8-7)
Kevin Allen makes the Layup and draws the foul on LeBron Barnes! And-1! Kevin Allen to the line for 1. [Team fouls: 3] (LeBron Barnes: 1 personal fouls)   FT 1/1: GOOD Kevin Allen makes 1/1 from the line.
Score: 8-10

[06:54] Team_070 possession (Score: 8-10)
John Hyland drives and kicks out. John Hyland attempts a 3Pt. Contested by Lauri Carter (3.2 feet, MAN). JOHN HYLAND MAKES IT! Assist: Khris Bryant
Score: 11-10

[06:41] Team_046 possession (Score: 11-10)
Cade Wall attempts a 3Pt. Contested by Khris Bryant (3.1 feet, ZONE). Cade Wall misses. Rebound secured by Khris Bryant.

[06:24] Team_070 possession (Score: 11-10)
LeBron Barnes attempts a 3Pt. Contested by Victor Nowitzki (6.0 feet, MAN). LeBron Barnes misses. Rebound secured by Lauri Carter.

[06:11] Team_046 possession (Score: 11-10)
Cade Wall attempts a 3Pt. Contested by Khris Bryant (3.1 feet, MAN). Cade Wall misses. Rebound secured by Khris Bryant.

[05:58] Team_070 possession (Score: 11-10)
FOUL! Reach-in foul on Kevin Allen during the drive. [Team fouls: 3] No free throws, side out. (Kevin Allen: 2 personal fouls)

[05:46] Team_070 possession (Score: 11-10)
Khris Bryant drives and kicks out. Khris Bryant attempts a 3Pt. Contested by Lauri Carter (3.2 feet, ZONE). Khris Bryant misses. Rebound secured by Lauri Carter.

[05:30] Team_046 possession (Score: 11-10)
D'Angelo O'Neal drives, Cole Gasol stays with him. D'Angelo O'Neal attempts a Layup. Contested by Cole Gasol (5.5 feet, MAN). D'Angelo O'Neal misses. Rebound secured by Jabari Paul.

[05:16] Team_070 possession (Score: 11-10)
John Hyland attempts a Layup. BLOCKED BY KEVIN ALLEN! Ball is loose! Offensive rebound by LeBron Barnes! LeBron Barnes kicks it out.

[05:06] Team_070 possession (Score: 11-10)
John Hyland attempts a Midrange. Contested by Lauri Carter (3.2 feet, MAN). John Hyland misses. Offensive rebound by Khris Bryant! Khris Bryant's putback is no good. Offensive rebound by Khris Bryant! Khris Bryant kicks it out.

[04:54] Team_070 possession (Score: 11-10)
LeBron Barnes attempts a 3Pt. Wide open! Victor Nowitzki is 6.0 feet away. [MAN] LeBron Barnes misses. Rebound secured by Kevin Allen.

[04:43] Team_046 possession (Score: 11-10)
D'Angelo O'Neal attempts a 3Pt. Contested by Cole Gasol (5.5 feet, MAN). D'Angelo O'Neal misses. Offensive rebound by Kevin Allen! Kevin Allen kicks it out.

[04:34] Team_046 possession (Score: 11-10)
Lauri Carter attempts a Layup. Contested by John Hyland (4.8 feet, MAN). Lauri Carter misses. Rebound secured by LeBron Barnes.

[04:17] Team_070 possession (Score: 11-10)
Cole Gasol attempts a 3Pt. Contested by D'Angelo O'Neal (4.4 feet, MAN). COLE GASOL MAKES IT! Assist: LeBron Barnes
Score: 14-10

[04:01] Team_046 possession (Score: 14-10)
Victor Nowitzki attempts a 3Pt. Contested by Khris Bryant (2.7 feet, ZONE). Victor Nowitzki misses. Rebound secured by Khris Bryant.

[03:46] Team_070 possession (Score: 14-10)
Jabari Paul attempts a Midrange. Contested by Lauri Carter (4.2 feet, ZONE). Jabari Paul misses. Offensive rebound by Khris Bryant! Khris Bryant puts it back in!
Score: 16-10

[03:31] Team_046 possession (Score: 16-10)
Lauri Carter attempts a Layup. Contested by John Hyland (4.8 feet, MAN). Lauri Carter misses. Offensive rebound by Cade Wall! Cade Wall kicks it out.

[03:13] Team_046 possession (Score: 16-10)
Cade Wall attempts a Layup. Contested by Khris Bryant (3.3 feet, ZONE). CADE WALL MAKES IT!
Score: 16-12

[03:02] Team_070 possession (Score: 16-12)
LeBron Barnes throws a bad pass out of bounds! TURNOVER! (dead ball)

[03:02] Substitution (Team_070): LeBron Barnes OUT → Allen Quickley IN (stamina_rule2)

[03:02] Substitution (Team_070): Khris Bryant OUT → Luka Gobert IN (stamina_rule2)

[03:02] Substitution (Team_046): D'Angelo O'Neal OUT → Collin Butler IN (stamina_rule2)

[03:02] Substitution (Team_046): Victor Nowitzki OUT → Manu Dosunmu IN (stamina_rule2)

[03:02] Substitution (Team_046): Cade Wall OUT → Chris LaVine IN (stamina_rule2)

[03:02] Substitution (Team_046): Kevin Allen OUT → Paul DeRozan IN (stamina_rule2)

[02:50] Team_046 possession (Score: 16-12)
Paul DeRozan throws a bad pass! Stolen by Jabari Paul! TURNOVER! (live ball)

[02:34] Team_070 possession (Score: 16-12)
Allen Quickley attempts a Layup. Contested by Manu Dosunmu (4.8 feet, MAN). Allen Quickley misses. Rebound secured by Paul DeRozan.

[02:22] Team_046 possession (Score: 16-12)
Lauri Carter attempts a 3Pt. Contested by Allen Quickley (5.3 feet, ZONE). LAURI CARTER MAKES IT! Assist: Manu Dosunmu
Score: 16-15

[02:09] Team_070 possession (Score: 16-15)
Jabari Paul makes the Dunk and draws the foul on Chris LaVine! And-1! Jabari Paul to the line for 1. [Team fouls: 4] (Chris LaVine: 1 personal fouls)   FT 1/1: GOOD Jabari Paul makes 1/1 from the line.
Score: 19-15

[01:57] Team_046 possession (Score: 19-15)
Paul DeRozan attempts a Midrange. Contested by Jabari Paul (4.8 feet, MAN). Paul DeRozan misses. Offensive rebound by Chris LaVine! Chris LaVine kicks it out.

[01:44] Team_046 possession (Score: 19-15)
Manu Dosunmu drives to the basket... Manu Dosunmu throws a bad pass out of bounds! TURNOVER! (dead ball)

[01:44] Substitution (Team_070): Cole Gasol OUT → Paul Quickley IN (stamina_rule2)

[01:44] Substitution (Team_070): John Hyland OUT → D'Angelo McGrady IN (stamina_rule2)

[01:44] Substitution (Team_070): Jabari Paul OUT → Russell Morant IN (stamina_rule2)

[01:44] Substitution (Team_046): Lauri Carter OUT → Josh Barrett IN (stamina_rule2)

[01:29] Team_070 possession (Score: 19-15)
FOUL! Shooting foul on Manu Dosunmu. D'Angelo McGrady to the line for 2 free throws. [BONUS: 5 team fouls] (Manu Dosunmu: 1 personal fouls)   FT 1/2: GOOD   FT 2/2: MISS D'Angelo McGrady makes 1/2 from the line. Offensive rebound by Russell Morant! Russell Morant's putback is no good.
Score: 20-15

[01:17] Team_046 possession (Score: 20-15)
Chris LaVine attempts a 3Pt. Contested by Paul Quickley (4.8 feet, ZONE). Chris LaVine misses. Rebound secured by D'Angelo McGrady.

[01:04] Team_070 possession (Score: 20-15)
Luka Gobert attempts a Midrange. Contested by Chris LaVine (4.0 feet, MAN). Luka Gobert misses. Offensive rebound by Russell Morant! Russell Morant puts it back in!
Score: 22-15

[00:52] Team_046 possession (Score: 22-15)
Chris LaVine drives, Luka Gobert stays with him. Chris LaVine attempts a Dunk. Contested by Luka Gobert (5.2 feet, MAN). CHRIS LAVINE MAKES IT! Assist: Manu Dosunmu
Score: 22-17

[00:33] Team_070 possession (Score: 22-17)
Allen Quickley drives to the basket... Allen Quickley throws a bad pass out of bounds! TURNOVER! (dead ball)

[00:19] Team_046 possession (Score: 22-17)
Josh Barrett attempts a 3Pt. Contested by D'Angelo McGrady (5.7 feet, MAN). Josh Barrett misses. Rebound secured by D'Angelo McGrady.

[00:04] Team_070 possession (Score: 22-17)
Allen Quickley attempts a 3Pt. Contested by Collin Butler (3.9 feet, ZONE). Allen Quickley misses. FOUL! Loose ball foul on Manu Dosunmu during the rebound battle. [IN THE BONUS! 6 team fouls] Russell Morant to the line for 2 free throws. (Manu Dosunmu: 2 personal fouls)   FT 1/2: GOOD   FT 2/2: GOOD Russell Morant makes 2/2 from the line.
Score: 24-17

================================================================================
                              1ST QUARTER COMPLETE                              
================================================================================

1ST QUARTER SCORE: Team_070 24, Team_046 17

BOX SCORE:
================================================================================

Team_070
--------------------------------------------------------------------------------
Player                MIN  PTS  REB  AST  TO      FG   FG%      3P   3P%
--------------------------------------------------------------------------------
Jabari Paul            11    7    1    0   0   3/4    75.0     0/0   0.0
John Hyland            11    5    0    0   0   2/2   100.0     0/0   0.0
Khris Bryant            9    4    7    1   0   2/4    50.0     0/0   0.0
Russell Morant          2    4    2    0   0   2/2   100.0     0/0   0.0
Cole Gasol             11    3    0    0   0   1/2    50.0     0/0   0.0
LeBron Barnes           9    0    3    1   0   0/3     0.0     0/0   0.0
Allen Quickley          3    0    0    0   0   0/1     0.0     0/0   0.0
D'Angelo McGrady        2    0    2    0   0   0/1     0.0     0/0   0.0

TEAM: FG: 10/19 (52.6%), 3PT: 3/7 (42.9%), REB: 14 (5 off, 9 def), AST: 2, TO: 2
TEAM FOULS: 3


Team_046
--------------------------------------------------------------------------------
Player                MIN  PTS  REB  AST  TO      FG   FG%      3P   3P%
--------------------------------------------------------------------------------
Lauri Carter           11    7    5    0   0   3/4    75.0     0/0   0.0
Kevin Allen             9    3    3    0   0   1/2    50.0     0/0   0.0
D'Angelo O'Neal         9    3    0    0   0   1/3    33.3     0/0   0.0
Cade Wall               9    2    4    1   0   1/3    33.3     0/0   0.0
Chris LaVine            3    2    1    0   0   1/2    50.0     0/0   0.0
Victor Nowitzki         9    0    0    0   0   0/2     0.0     0/0   0.0
Paul DeRozan            3    0    1    0   0   0/0     0.0     0/0   0.0
Manu Dosunmu            3    0    0    2   0   0/0     0.0     0/0   0.0
Josh Barrett            2    0    0    0   0   0/1     0.0     0/0   0.0

TEAM: FG: 7/17 (41.2%), 3PT: 2/7 (28.6%), REB: 15 (7 off, 8 def), AST: 3, TO: 3
TEAM FOULS: 6 [Team_070 in BONUS]

================================================================================

================================================================================
                       2ND QUARTER - Team_070 vs Team_046                       
================================================================================

[12:00] Team_070 possession (Score: 24-17)
Khris Bryant makes the Layup and draws the foul on Kevin Allen! And-1! Khris Bryant to the line for 1. [Team fouls: 1] (Kevin Allen: 1 personal fouls)   FT 1/1: GOOD Khris Bryant makes 1/1 from the line.
Score: 27-17

[11:50] Team_046 possession (Score: 27-17)
Lauri Carter attempts a 3Pt. Contested by John Hyland (4.8 feet, ZONE). LAURI CARTER MAKES IT! Assist: Victor Nowitzki
Score: 27-20

[11:31] Team_070 possession (Score: 27-20)
Jabari Paul throws a bad pass! Stolen by Kevin Allen! TURNOVER! (live ball)

[11:22] Team_046 possession (Score: 27-20)
Victor Nowitzki attempts a 3Pt. Contested by Khris Bryant (2.6 feet, ZONE). Victor Nowitzki misses. Offensive rebound by Cade Wall! Cade Wall kicks it out.

[11:10] Team_046 possession (Score: 27-20)
Cade Wall drives, Khris Bryant stays with him. Cade Wall attempts a Dunk. Contested by Khris Bryant (3.1 feet, MAN). CADE WALL MAKES IT!
Score: 27-22

[10:52] Team_070 possession (Score: 27-22)
FOUL! Shooting foul on Lauri Carter. John Hyland to the line for 2 free throws. [Team fouls: 2] (Lauri Carter: 1 personal fouls)   FT 1/2: GOOD   FT 2/2: MISS John Hyland makes 1/2 from the line. Offensive rebound by Khris Bryant! Khris Bryant puts it back in!
Score: 30-22

[10:37] Team_046 possession (Score: 30-22)
Kevin Allen attempts a Midrange. Contested by Khris Bryant (2.8 feet, MAN). KEVIN ALLEN MAKES IT!
Score: 30-24

[10:21] Team_070 possession (Score: 30-24)
LeBron Barnes drives, picks up Victor Nowitzki. Help arrives from Lauri Carter! LeBron Barnes attempts a Dunk. Wide open! Lauri Carter is 6.0 feet away. [MAN] LEBRON BARNES MAKES IT! Assist: Khris Bryant
Score: 32-24

[10:05] Team_046 possession (Score: 32-24)
Victor Nowitzki drives and kicks out. Kevin Allen attempts a 3Pt. Contested by Khris Bryant (2.6 feet, MAN). Kevin Allen misses. Rebound secured by LeBron Barnes.

[09:53] Team_070 possession (Score: 32-24)
Khris Bryant drives, Cade Wall stays with him. Khris Bryant attempts a Layup. Contested by Cade Wall (3.8 feet, MAN). KHRIS BRYANT MAKES IT! Assist: John Hyland
Score: 34-24

[09:44] Team_046 possession (Score: 34-24)
Cade Wall attempts a Midrange. Contested by Khris Bryant (3.2 feet, ZONE). Cade Wall misses. Rebound secured by LeBron Barnes.

[09:32] Team_070 possession (Score: 34-24)
Khris Bryant drives, picks up Kevin Allen. Help arrives from D'Angelo O'Neal! Khris Bryant attempts a Dunk. Contested by D'Angelo O'Neal (4.8 feet, ZONE). KHRIS BRYANT MAKES IT! Assist: Cole Gasol
Score: 36-24

[09:17] Team_046 possession (Score: 36-24)
FOUL! Shooting foul on Khris Bryant. D'Angelo O'Neal to the line for 2 free throws. [Team fouls: 1] (Khris Bryant: 1 personal fouls)   FT 1/2: MISS   FT 2/2: GOOD D'Angelo O'Neal makes 1/2 from the line.
Score: 36-25

[08:58] Team_070 possession (Score: 36-25)
Jabari Paul attempts a Midrange. Contested by Cade Wall (4.7 feet, ZONE). Jabari Paul misses. Rebound secured by Kevin Allen.

[08:42] Team_046 possession (Score: 36-25)
D'Angelo O'Neal attempts a 3Pt. Contested by Cole Gasol (5.8 feet, MAN). D'Angelo O'Neal misses. Rebound secured by Khris Bryant.

[08:28] Team_070 possession (Score: 36-25)
Cole Gasol drives to the basket... Cole Gasol loses the ball! Stripped by Cade Wall! TURNOVER! (live ball)

[08:13] Team_046 possession (Score: 36-25)
Lauri Carter drives to the basket... Lauri Carter throws a bad pass! Stolen by John Hyland! TURNOVER! (live ball)

[07:57] Team_070 possession (Score: 36-25)
LeBron Barnes attempts a 3Pt. Contested by Lauri Carter (4.3 feet, ZONE). LeBron Barnes misses. Rebound secured by Cade Wall.

[07:42] Team_046 possession (Score: 36-25)
Cade Wall drives and kicks out. D'Angelo O'Neal attempts a Midrange. Contested by Khris Bryant (2.9 feet, ZONE). D'Angelo O'Neal misses. Rebound secured by Jabari Paul.

[07:24] Team_070 possession (Score: 36-25)
Cole Gasol attempts a Midrange. Contested by Cade Wall (4.4 feet, ZONE). Cole Gasol misses. Offensive rebound by LeBron Barnes! LeBron Barnes kicks it out.

[07:11] Team_070 possession (Score: 36-25)
FOUL! Shooting foul on Lauri Carter. LeBron Barnes to the line for 3 free throws. [Team fouls: 3] (Lauri Carter: 2 personal fouls)   FT 1/3: GOOD   FT 2/3: MISS   FT 3/3: MISS LeBron Barnes makes 1/3 from the line. Offensive rebound by Khris Bryant! Khris Bryant's putback is no good.
Score: 37-25

[06:54] Team_046 possession (Score: 37-25)
Lauri Carter attempts a 3Pt. Contested by John Hyland (5.2 feet, MAN). Lauri Carter misses. Rebound secured by Khris Bryant.

[06:37] Team_070 possession (Score: 37-25)
Cole Gasol attempts a 3Pt. Contested by Lauri Carter (4.2 feet, ZONE). Cole Gasol misses. Rebound secured by Cade Wall.

[06:22] Team_046 possession (Score: 37-25)
Victor Nowitzki attempts a 3Pt. Contested by Khris Bryant (3.2 feet, ZONE). Victor Nowitzki misses. Offensive rebound by Cade Wall! Cade Wall kicks it out.

[06:10] Team_046 possession (Score: 37-25)
Kevin Allen attempts a Midrange. Contested by LeBron Barnes (4.3 feet, ZONE). Kevin Allen misses. Rebound secured by Jabari Paul.

[05:57] Team_070 possession (Score: 37-25)
FOUL! Reach-in foul on Kevin Allen during the drive. [Team fouls: 4] No free throws, side out. (Kevin Allen: 2 personal fouls)

[05:42] Team_070 possession (Score: 37-25)
LeBron Barnes attempts a 3Pt. Contested by Lauri Carter (4.6 feet, ZONE). LeBron Barnes misses. Rebound secured by Cade Wall.

[05:25] Team_046 possession (Score: 37-25)
Victor Nowitzki drives and kicks out. Victor Nowitzki attempts a Midrange. Contested by Khris Bryant (3.3 feet, ZONE). Victor Nowitzki misses. Offensive rebound by Kevin Allen! Kevin Allen kicks it out.

[05:07] Team_046 possession (Score: 37-25)
D'Angelo O'Neal attempts a Layup. Wide open! Cole Gasol is 6.1 feet away. [MAN] D'ANGELO O'NEAL MAKES IT!
Score: 37-27

[04:56] Team_070 possession (Score: 37-27)
FOUL! Offensive foul on Khris Bryant! Cade Wall drew the charge! [Team fouls: 2] (Khris Bryant: 2 personal fouls) TURNOVER! (dead ball)

[04:45] Team_046 possession (Score: 37-27)
Lauri Carter attempts a 3Pt. Contested by Khris Bryant (3.5 feet, ZONE). Lauri Carter misses. Rebound secured by Khris Bryant.

[04:29] Team_070 possession (Score: 37-27)
FOUL! Reach-in foul on Kevin Allen during the drive. [IN THE BONUS! 5 team fouls] Khris Bryant to the line for 2 free throws. (Kevin Allen: 3 personal fouls)   FT 1/2: GOOD   FT 2/2: GOOD Khris Bryant makes 2/2 from the line.
Score: 39-27

[04:13] Team_046 possession (Score: 39-27)
Lauri Carter attempts a 3Pt. Contested by John Hyland (5.5 feet, MAN). Lauri Carter misses. Rebound secured by Jabari Paul.

[04:03] Team_070 possession (Score: 39-27)
Jabari Paul attempts a Midrange. Contested by Lauri Carter (5.0 feet, ZONE). JABARI PAUL MAKES IT! Assist: Khris Bryant
Score: 41-27

[03:46] Team_046 possession (Score: 41-27)
D'Angelo O'Neal drives to the basket... D'Angelo O'Neal throws a bad pass out of bounds! TURNOVER! (dead ball)

[03:46] Substitution (Team_070): Cole Gasol OUT → Paul Quickley IN (stamina_rule2)

[03:46] Substitution (Team_070): LeBron Barnes OUT → Allen Quickley IN (stamina_rule2)

[03:46] Substitution (Team_070): John Hyland OUT → D'Angelo McGrady IN (stamina_rule2)

[03:46] Substitution (Team_070): Khris Bryant OUT → Luka Gobert IN (stamina_rule2)

[03:46] Substitution (Team_070): Jabari Paul OUT → Russell Morant IN (stamina_rule2)

[03:46] Substitution (Team_046): D'Angelo O'Neal OUT → Collin Butler IN (stamina_rule2)

[03:46] Substitution (Team_046): Victor Nowitzki OUT → Manu Dosunmu IN (stamina_rule2)

[03:46] Substitution (Team_046): Lauri Carter OUT → Josh Barrett IN (stamina_rule2)

[03:46] Substitution (Team_046): Cade Wall OUT → Chris LaVine IN (stamina_rule2)

[03:46] Substitution (Team_046): Kevin Allen OUT → Paul DeRozan IN (stamina_rule2)

[03:31] Team_070 possession (Score: 41-27)
D'Angelo McGrady attempts a Layup. Contested by Josh Barrett (4.9 feet, MAN). D'ANGELO MCGRADY MAKES IT!
Score: 43-27

[03:12] Team_046 possession (Score: 43-27)
Paul DeRozan attempts a Layup. BLOCKED BY RUSSELL MORANT! Ball goes out off Russell Morant. Paul DeRozan's ball!

[02:57] Team_046 possession (Score: 43-27)
Paul DeRozan attempts a Midrange. Contested by Russell Morant (3.7 feet, MAN). Paul DeRozan misses. Offensive rebound by Paul DeRozan! Paul DeRozan puts it back in!
Score: 43-29

[02:47] Team_070 possession (Score: 43-29)
Russell Morant drives, Chris LaVine stays with him. Russell Morant attempts a Layup. Contested by Chris LaVine (4.0 feet, MAN). Russell Morant misses. Rebound secured by Chris LaVine.

[02:34] Team_046 possession (Score: 43-29)
Chris LaVine attempts a Layup. Contested by Luka Gobert (5.2 feet, MAN). CHRIS LAVINE MAKES IT! Assist: Paul DeRozan
Score: 43-31

[02:19] Team_070 possession (Score: 43-31)
Luka Gobert throws a bad pass out of bounds! TURNOVER! (dead ball)

[02:06] Team_046 possession (Score: 43-31)
Collin Butler attempts a 3Pt. Contested by Paul Quickley (4.6 feet, MAN). Collin Butler misses. Rebound secured by Russell Morant.

[01:47] Team_070 possession (Score: 43-31)
Paul Quickley attempts a 3Pt. Contested by Collin Butler (3.8 feet, ZONE). Paul Quickley misses. Offensive rebound by Russell Morant! Russell Morant's putback is no good. Rebound secured by Paul DeRozan.

[01:32] Team_046 possession (Score: 43-31)
Manu Dosunmu attempts a Layup. Contested by Russell Morant (4.3 feet, ZONE). Manu Dosunmu misses. Offensive rebound by Paul DeRozan! Paul DeRozan puts it back in!
Score: 43-33

[01:14] Team_070 possession (Score: 43-33)
Paul Quickley attempts a 3Pt. Contested by Josh Barrett (4.7 feet, ZONE). Paul Quickley misses. Offensive rebound by Russell Morant! Russell Morant puts it back in!
Score: 45-33

[00:57] Team_046 possession (Score: 45-33)
Josh Barrett drives, Russell Morant stays with him. Josh Barrett attempts a Dunk. Contested by Russell Morant (3.8 feet, ZONE). JOSH BARRETT MAKES IT!
Score: 45-35

[00:46] Team_070 possession (Score: 45-35)
Paul Quickley attempts a Midrange. Contested by Collin Butler (3.8 feet, MAN). PAUL QUICKLEY MAKES IT!
Score: 47-35

[00:31] Team_046 possession (Score: 47-35)
Manu Dosunmu attempts a 3Pt. Contested by Paul Quickley (4.9 feet, ZONE). Manu Dosunmu misses. Offensive rebound by Paul DeRozan! Paul DeRozan puts it back in!
Score: 47-37

[00:18] Team_070 possession (Score: 47-37)
Luka Gobert attempts a 3Pt. Contested by Collin Butler (3.9 feet, ZONE). Luka Gobert misses. Rebound secured by Chris LaVine.

[00:05] Team_046 possession (Score: 47-37)
Josh Barrett attempts a 3Pt. Contested by D'Angelo McGrady (5.7 feet, MAN). Josh Barrett misses. Rebound secured by Russell Morant.

================================================================================
                              2ND QUARTER COMPLETE                              
================================================================================

2ND QUARTER SCORE: Team_070 23, Team_046 20

BOX SCORE:
================================================================================

Team_070
--------------------------------------------------------------------------------
Player                MIN  PTS  REB  AST  TO      FG   FG%      3P   3P%
--------------------------------------------------------------------------------
Khris Bryant           18   12    4    2   0   5/5   100.0     0/0   0.0
LeBron Barnes          18    2    3    0   0   1/4    25.0     0/0   0.0
Jabari Paul            19    2    3    0   0   1/2    50.0     0/0   0.0
D'Angelo McGrady        5    2    0    0   0   1/1   100.0     0/0   0.0
Russell Morant          5    2    3    0   0   1/2    50.0     0/0   0.0
Paul Quickley           5    2    0    0   0   1/2    50.0     0/0   0.0
John Hyland            19    0    0    1   0   0/0     0.0     0/0   0.0
Cole Gasol             19    0    0    1   0   0/1     0.0     0/0   0.0
Luka Gobert             7    0    0    0   0   0/1     0.0     0/0   0.0

TEAM: FG: 10/18 (55.6%), 3PT: 1/7 (14.3%), REB: 13 (3 off, 10 def), AST: 4, TO: 4
TEAM FOULS: 2


Team_046
--------------------------------------------------------------------------------
Player                MIN  PTS  REB  AST  TO      FG   FG%      3P   3P%
--------------------------------------------------------------------------------
Paul DeRozan            7    6    4    1   0   3/3   100.0     0/0   0.0
Lauri Carter           19    3    0    0   0   1/4    25.0     0/0   0.0
D'Angelo O'Neal        18    3    0    0   0   2/3    66.7     0/0   0.0
Cade Wall              18    2    5    0   0   1/3    33.3     0/0   0.0
Kevin Allen            18    2    2    0   0   1/2    50.0     0/0   0.0
Chris LaVine            7    2    2    0   0   1/1   100.0     0/0   0.0
Josh Barrett            5    2    0    0   0   1/2    50.0     0/0   0.0
Victor Nowitzki        18    0    0    1   0   0/1     0.0     0/0   0.0
Collin Butler           7    0    0    0   0   0/1     0.0     0/0   0.0

TEAM: FG: 10/20 (50.0%), 3PT: 2/8 (25.0%), REB: 13 (6 off, 7 def), AST: 2, TO: 2
TEAM FOULS: 5 [Team_070 in BONUS]

================================================================================

================================================================================
                       3RD QUARTER - Team_070 vs Team_046                       
================================================================================

[12:00] Team_070 possession (Score: 47-37)
LeBron Barnes attempts a Midrange. Contested by Victor Nowitzki (6.0 feet, MAN). LeBron Barnes misses. Offensive rebound by LeBron Barnes! LeBron Barnes kicks it out.

[11:44] Team_070 possession (Score: 47-37)
LeBron Barnes drives, picks up Kevin Allen. Help arrives from D'Angelo O'Neal! LeBron Barnes attempts a Dunk. Contested by D'Angelo O'Neal (5.1 feet, ZONE). LeBron Barnes misses. Rebound secured by Cade Wall.

[11:27] Team_046 possession (Score: 47-37)
Victor Nowitzki attempts a Midrange. Contested by LeBron Barnes (3.7 feet, MAN). Victor Nowitzki misses. Rebound secured by Jabari Paul.

[11:13] Team_070 possession (Score: 47-37)
Jabari Paul makes the Dunk and draws the foul on D'Angelo O'Neal! And-1! Jabari Paul to the line for 1. [Team fouls: 1] (D'Angelo O'Neal: 1 personal fouls)   FT 1/1: MISS Jabari Paul makes 0/1 from the line. Rebound secured by Lauri Carter.
Score: 49-37

[10:55] Team_046 possession (Score: 49-37)
FOUL! Shooting foul on John Hyland. D'Angelo O'Neal to the line for 2 free throws. [Team fouls: 1] (John Hyland: 1 personal fouls)   FT 1/2: GOOD   FT 2/2: GOOD D'Angelo O'Neal makes 2/2 from the line.
Score: 49-39

[10:39] Team_070 possession (Score: 49-39)
Cole Gasol attempts a Midrange. Contested by D'Angelo O'Neal (4.2 feet, MAN). Cole Gasol misses. Rebound secured by Kevin Allen.

[10:26] Team_046 possession (Score: 49-39)
D'Angelo O'Neal attempts a Layup. Contested by Khris Bryant (2.7 feet, ZONE). D'ANGELO O'NEAL MAKES IT!
Score: 49-41

[10:13] Team_070 possession (Score: 49-41)
Cole Gasol attempts a 3Pt. Contested by D'Angelo O'Neal (4.2 feet, MAN). Cole Gasol misses. Rebound secured by Kevin Allen.

[09:59] Team_046 possession (Score: 49-41)
Cade Wall attempts a 3Pt. Contested by Khris Bryant (3.1 feet, MAN). Cade Wall misses. Offensive rebound by Cade Wall! Cade Wall kicks it out.

[09:40] Team_046 possession (Score: 49-41)
Lauri Carter drives and kicks out. D'Angelo O'Neal attempts a 3Pt. Contested by Cole Gasol (5.3 feet, MAN). D'Angelo O'Neal misses. Offensive rebound by Cade Wall! Cade Wall kicks it out.

[09:21] Team_046 possession (Score: 49-41)
Victor Nowitzki attempts a 3Pt. Contested by Khris Bryant (2.6 feet, ZONE). Victor Nowitzki misses. Rebound secured by Khris Bryant.

[09:06] Team_070 possession (Score: 49-41)
Jabari Paul drives to the basket... Jabari Paul commits a violation (traveling/carry)! TURNOVER! (dead ball)

[08:54] Team_046 possession (Score: 49-41)
Kevin Allen makes the Layup and draws the foul on Khris Bryant! And-1! Kevin Allen to the line for 1. [Team fouls: 2] (Khris Bryant: 1 personal fouls)   FT 1/1: GOOD Kevin Allen makes 1/1 from the line.
Score: 49-44

[08:39] Team_070 possession (Score: 49-44)
Khris Bryant attempts a Layup. Contested by Kevin Allen (4.5 feet, ZONE). KHRIS BRYANT MAKES IT! Assist: John Hyland
Score: 51-44

[08:20] Team_046 possession (Score: 51-44)
D'Angelo O'Neal attempts a 3Pt. Contested by Khris Bryant (2.7 feet, ZONE). D'Angelo O'Neal misses. Rebound secured by Jabari Paul.

[08:08] Team_070 possession (Score: 51-44)
LeBron Barnes attempts a Layup. BLOCKED BY VICTOR NOWITZKI! Ball goes out off Victor Nowitzki. LeBron Barnes's ball!

[07:54] Team_070 possession (Score: 51-44)
Khris Bryant drives and kicks out. John Hyland attempts a Midrange. Contested by Lauri Carter (3.2 feet, MAN). John Hyland misses. Rebound secured by Cade Wall.

[07:40] Team_046 possession (Score: 51-44)
FOUL! Reach-in foul on Khris Bryant during the drive. [Team fouls: 3] No free throws, side out. (Khris Bryant: 2 personal fouls)

[07:27] Team_046 possession (Score: 51-44)
FOUL! Shooting foul on LeBron Barnes. Kevin Allen to the line for 2 free throws. [Team fouls: 4] (LeBron Barnes: 1 personal fouls)   FT 1/2: MISS   FT 2/2: MISS Kevin Allen makes 0/2 from the line. Rebound secured by LeBron Barnes.

[07:14] Team_070 possession (Score: 51-44)
Jabari Paul drives and kicks out. Cole Gasol attempts a 3Pt. Contested by Lauri Carter (3.2 feet, ZONE). Cole Gasol misses. Offensive rebound by Khris Bryant! Khris Bryant's putback is no good. Rebound secured by Cade Wall.

[06:59] Team_046 possession (Score: 51-44)
Cade Wall attempts a 3Pt. Contested by Khris Bryant (3.1 feet, MAN). Cade Wall misses. Rebound secured by Khris Bryant.

[06:41] Team_070 possession (Score: 51-44)
Cole Gasol attempts a 3Pt. Contested by D'Angelo O'Neal (4.2 feet, MAN). Cole Gasol misses. Offensive rebound by LeBron Barnes! LeBron Barnes kicks it out.

[06:27] Team_070 possession (Score: 51-44)
LeBron Barnes attempts a Midrange. Contested by Cade Wall (4.2 feet, ZONE). LEBRON BARNES MAKES IT!
Score: 53-44

[06:10] Team_046 possession (Score: 53-44)
Lauri Carter attempts a Midrange. Contested by John Hyland (4.7 feet, ZONE). Lauri Carter misses. Rebound secured by Khris Bryant.

[05:56] Team_070 possession (Score: 53-44)
Cole Gasol drives, D'Angelo O'Neal stays with him. Cole Gasol attempts a Dunk. Contested by D'Angelo O'Neal (4.2 feet, MAN). COLE GASOL MAKES IT!
Score: 55-44

[05:42] Team_046 possession (Score: 55-44)
Victor Nowitzki attempts a Layup. Contested by Jabari Paul (4.6 feet, ZONE). Victor Nowitzki misses. Rebound secured by Jabari Paul.

[05:27] Team_070 possession (Score: 55-44)
Jabari Paul drives and kicks out. John Hyland attempts a 3Pt. Contested by Lauri Carter (3.2 feet, ZONE). John Hyland misses. Rebound secured by Lauri Carter.

[05:13] Team_046 possession (Score: 55-44)
Victor Nowitzki attempts a 3Pt. Contested by Khris Bryant (2.6 feet, ZONE). Victor Nowitzki misses. Rebound secured by Jabari Paul.

[04:56] Team_070 possession (Score: 55-44)
John Hyland makes the Layup and draws the foul on Lauri Carter! And-1! John Hyland to the line for 1. [Team fouls: 2] (Lauri Carter: 1 personal fouls)   FT 1/1: GOOD John Hyland makes 1/1 from the line.
Score: 58-44

[04:46] Team_046 possession (Score: 58-44)
D'Angelo O'Neal drives to the basket... D'Angelo O'Neal throws a bad pass out of bounds! TURNOVER! (dead ball)

[04:29] Team_070 possession (Score: 58-44)
Cole Gasol attempts a 3Pt. Contested by Lauri Carter (3.5 feet, ZONE). COLE GASOL MAKES IT! Assist: LeBron Barnes
Score: 61-44

[04:11] Team_046 possession (Score: 61-44)
Victor Nowitzki drives to the basket... FOUL! Offensive foul on Victor Nowitzki! LeBron Barnes drew the charge! [Team fouls: 3] (Victor Nowitzki: 1 personal fouls) TURNOVER! (dead ball)

[03:56] Team_070 possession (Score: 61-44)
LeBron Barnes attempts a 3Pt. Contested by Lauri Carter (3.8 feet, ZONE). LeBron Barnes misses. Rebound secured by Lauri Carter.

[03:42] Team_046 possession (Score: 61-44)
Kevin Allen makes the Dunk and draws the foul on Khris Bryant! And-1! Kevin Allen to the line for 1. [BONUS: 5 team fouls] (Khris Bryant: 3 personal fouls)   FT 1/1: GOOD Kevin Allen makes 1/1 from the line.
Score: 61-47

[03:27] Team_070 possession (Score: 61-47)
Cole Gasol drives, picks up D'Angelo O'Neal. Help arrives from Lauri Carter! Cole Gasol attempts a Dunk. Contested by Lauri Carter (4.4 feet, MAN). Cole Gasol misses. Rebound secured by Cade Wall.

[03:09] Team_046 possession (Score: 61-47)
D'Angelo O'Neal makes the 3Pt and draws the foul on Cole Gasol! And-1! D'Angelo O'Neal to the line for 1. [BONUS: 6 team fouls] (Cole Gasol: 1 personal fouls)   FT 1/1: GOOD D'Angelo O'Neal makes 1/1 from the line.
Score: 61-51

[02:55] Team_070 possession (Score: 61-51)
John Hyland attempts a 3Pt. Contested by Lauri Carter (3.4 feet, ZONE). John Hyland misses. Rebound secured by Cade Wall.

[02:41] Team_046 possession (Score: 61-51)
Lauri Carter attempts a 3Pt. Contested by Khris Bryant (2.8 feet, ZONE). Lauri Carter misses. Rebound secured by Jabari Paul.

[02:27] Team_070 possession (Score: 61-51)
John Hyland attempts a 3Pt. Contested by Lauri Carter (3.4 feet, MAN). John Hyland misses. Rebound secured by Lauri Carter.

[02:08] Team_046 possession (Score: 61-51)
D'Angelo O'Neal attempts a Layup. BLOCKED BY LEBRON BARNES! Ball is loose! Offensive rebound by Cade Wall! Cade Wall kicks it out.

[01:50] Team_046 possession (Score: 61-51)
Cade Wall attempts a Midrange. Contested by Khris Bryant (3.3 feet, MAN). Cade Wall misses. Rebound secured by LeBron Barnes.

[01:31] Team_070 possession (Score: 61-51)
Cole Gasol attempts a Layup. BLOCKED BY D'ANGELO O'NEAL! Ball is loose! Offensive rebound by LeBron Barnes! LeBron Barnes kicks it out.

[01:18] Team_070 possession (Score: 61-51)
John Hyland drives, picks up Lauri Carter. Help arrives from D'Angelo O'Neal! John Hyland attempts a Layup. Contested by D'Angelo O'Neal (3.5 feet, MAN). JOHN HYLAND MAKES IT!
Score: 63-51

[01:00] Team_046 possession (Score: 63-51)
Victor Nowitzki throws a bad pass out of bounds! TURNOVER! (dead ball)

[01:00] Substitution (Team_070): Cole Gasol OUT → Paul Quickley IN (stamina_rule2)

[01:00] Substitution (Team_070): LeBron Barnes OUT → Allen Quickley IN (stamina_rule2)

[01:00] Substitution (Team_070): John Hyland OUT → D'Angelo McGrady IN (stamina_rule2)

[01:00] Substitution (Team_070): Khris Bryant OUT → Luka Gobert IN (stamina_rule2)

[01:00] Substitution (Team_070): Jabari Paul OUT → Russell Morant IN (stamina_rule2)

[01:00] Substitution (Team_046): D'Angelo O'Neal OUT → Collin Butler IN (stamina_rule2)

[01:00] Substitution (Team_046): Victor Nowitzki OUT → Manu Dosunmu IN (stamina_rule2)

[01:00] Substitution (Team_046): Lauri Carter OUT → Josh Barrett IN (stamina_rule2)

[01:00] Substitution (Team_046): Cade Wall OUT → Chris LaVine IN (stamina_rule2)

[01:00] Substitution (Team_046): Kevin Allen OUT → Paul DeRozan IN (stamina_rule2)

[00:46] Team_070 possession (Score: 63-51)
D'Angelo McGrady attempts a 3Pt. Contested by Josh Barrett (4.9 feet, MAN). D'Angelo McGrady misses. Offensive rebound by Luka Gobert! Luka Gobert kicks it out.

[00:27] Team_070 possession (Score: 63-51)
Paul Quickley makes the Layup and draws the foul on Collin Butler! And-1! Paul Quickley to the line for 1. [Team fouls: 4] (Collin Butler: 1 personal fouls)   FT 1/1: GOOD Paul Quickley makes 1/1 from the line.
Score: 66-51

[00:14] Team_046 possession (Score: 66-51)
Collin Butler makes the 3Pt and draws the foul on Paul Quickley! And-1! Collin Butler to the line for 1. [BONUS: 7 team fouls] (Paul Quickley: 1 personal fouls)   FT 1/1: GOOD Collin Butler makes 1/1 from the line.
Score: 66-55

================================================================================
                              3RD QUARTER COMPLETE                              
================================================================================

3RD QUARTER SCORE: Team_070 19, Team_046 18

BOX SCORE:
================================================================================

Team_070
--------------------------------------------------------------------------------
Player                MIN  PTS  REB  AST  TO      FG   FG%      3P   3P%
--------------------------------------------------------------------------------
Cole Gasol             30    5    0    0   0   2/5    40.0     0/0   0.0
John Hyland            30    5    0    1   0   2/4    50.0     0/0   0.0
Paul Quickley           6    3    0    0   0   1/1   100.0     0/0   0.0
LeBron Barnes          29    2    5    1   0   1/3    33.3     0/0   0.0
Khris Bryant           29    2    3    0   0   1/2    50.0     0/0   0.0
Jabari Paul            30    0    5    0   0   0/3     0.0     0/0   0.0
Luka Gobert             7    0    1    0   0   0/0     0.0     0/0   0.0

TEAM: FG: 7/18 (38.9%), 3PT: 1/5 (20.0%), REB: 15 (5 off, 10 def), AST: 2, TO: 1
TEAM FOULS: 7 [Team_046 in BONUS]


Team_046
--------------------------------------------------------------------------------
Player                MIN  PTS  REB  AST  TO      FG   FG%      3P   3P%
--------------------------------------------------------------------------------
D'Angelo O'Neal        29    8    0    0   0   3/4    75.0     0/0   0.0
Kevin Allen            29    6    2    0   0   2/3    66.7     0/0   0.0
Collin Butler           7    4    0    0   0   1/1   100.0     0/0   0.0
Cade Wall              29    0    8    0   0   0/2     0.0     0/0   0.0
Victor Nowitzki        29    0    0    0   0   0/4     0.0     0/0   0.0
Lauri Carter           30    0    4    0   0   0/2     0.0     0/0   0.0

TEAM: FG: 6/16 (37.5%), 3PT: 2/7 (28.6%), REB: 13 (3 off, 10 def), AST: 0, TO: 3
TEAM FOULS: 4

================================================================================

================================================================================
                       4TH QUARTER - Team_070 vs Team_046                       
================================================================================

[12:00] Team_070 possession (Score: 66-55)
Cole Gasol attempts a 3Pt. Contested by Lauri Carter (3.6 feet, ZONE). Cole Gasol misses. Rebound secured by Lauri Carter.

[11:42] Team_046 possession (Score: 66-55)
Lauri Carter attempts a Midrange. Contested by Jabari Paul (4.7 feet, ZONE). LAURI CARTER MAKES IT! Assist: Cade Wall
Score: 66-57

[11:26] Team_070 possession (Score: 66-57)
FOUL! Reach-in foul on Kevin Allen during the drive. [Team fouls: 1] No free throws, side out. (Kevin Allen: 1 personal fouls)

[11:16] Team_070 possession (Score: 66-57)
Jabari Paul drives and kicks out. Jabari Paul attempts a Midrange. Contested by Kevin Allen (4.9 feet, MAN). JABARI PAUL MAKES IT! Assist: John Hyland
Score: 68-57

[10:57] Team_046 possession (Score: 68-57)
Cade Wall drives and kicks out. D'Angelo O'Neal attempts a 3Pt. Contested by Khris Bryant (2.7 feet, ZONE). D'ANGELO O'NEAL MAKES IT! Assist: Victor Nowitzki
Score: 68-60

[10:41] Team_070 possession (Score: 68-60)
FOUL! Offensive foul on Khris Bryant! Cade Wall drew the charge! [Team fouls: 1] (Khris Bryant: 1 personal fouls) TURNOVER! (dead ball)

[10:24] Team_046 possession (Score: 68-60)
D'Angelo O'Neal attempts a 3Pt. Contested by Khris Bryant (3.0 feet, ZONE). D'ANGELO O'NEAL MAKES IT! Assist: Victor Nowitzki
Score: 68-63

[10:07] Team_070 possession (Score: 68-63)
John Hyland attempts a Layup. Contested by Lauri Carter (3.5 feet, MAN). John Hyland misses. Offensive rebound by LeBron Barnes! LeBron Barnes kicks it out.

[09:54] Team_070 possession (Score: 68-63)
FOUL! Reach-in foul on D'Angelo O'Neal during the drive. [Team fouls: 2] No free throws, side out. (D'Angelo O'Neal: 1 personal fouls)

[09:40] Team_070 possession (Score: 68-63)
FOUL! Shooting foul on Kevin Allen. Jabari Paul to the line for 2 free throws. [Team fouls: 3] (Kevin Allen: 2 personal fouls)   FT 1/2: GOOD   FT 2/2: MISS Jabari Paul makes 1/2 from the line. Rebound secured by Kevin Allen.
Score: 69-63

[09:29] Team_046 possession (Score: 69-63)
FOUL! Holding foul on Cole Gasol. [Team fouls: 2] No free throws, side out. (Cole Gasol: 1 personal fouls)

[09:16] Team_046 possession (Score: 69-63)
D'Angelo O'Neal attempts a Midrange. Contested by Cole Gasol (5.7 feet, MAN). D'Angelo O'Neal misses. Rebound secured by Khris Bryant.

[09:00] Team_070 possession (Score: 69-63)
Cole Gasol drives to the basket... Cole Gasol loses control! Ball rolls out of bounds! TURNOVER! (dead ball)

[09:00] Substitution (Team_070): Cole Gasol OUT → Paul Quickley IN (stamina_rule2)

[09:00] Substitution (Team_070): LeBron Barnes OUT → Allen Quickley IN (stamina_rule2)

[09:00] Substitution (Team_070): John Hyland OUT → D'Angelo McGrady IN (stamina_rule2)

[09:00] Substitution (Team_070): Khris Bryant OUT → Luka Gobert IN (stamina_rule2)

[09:00] Substitution (Team_070): Jabari Paul OUT → Russell Morant IN (stamina_rule2)

[09:00] Substitution (Team_046): D'Angelo O'Neal OUT → Collin Butler IN (stamina_rule2)

[09:00] Substitution (Team_046): Victor Nowitzki OUT → Manu Dosunmu IN (stamina_rule2)

[09:00] Substitution (Team_046): Lauri Carter OUT → Josh Barrett IN (stamina_rule2)

[09:00] Substitution (Team_046): Cade Wall OUT → Chris LaVine IN (stamina_rule2)

[09:00] Substitution (Team_046): Kevin Allen OUT → Paul DeRozan IN (stamina_rule2)

[08:47] Team_046 possession (Score: 69-63)
Paul DeRozan drives to the basket... FOUL! Offensive foul on Paul DeRozan! Russell Morant drew the charge! [Team fouls: 4] (Paul DeRozan: 1 personal fouls) TURNOVER! (dead ball)

[08:30] Team_070 possession (Score: 69-63)
Allen Quickley attempts a 3Pt. Contested by Manu Dosunmu (4.8 feet, MAN). ALLEN QUICKLEY MAKES IT! Assist: Paul Quickley
Score: 72-63

[08:15] Team_046 possession (Score: 72-63)
Chris LaVine attempts a Midrange. Wide open! D'Angelo McGrady is 6.1 feet away. [ZONE] Chris LaVine misses. Rebound secured by D'Angelo McGrady.

[08:02] Team_070 possession (Score: 72-63)
Allen Quickley attempts a Midrange. Contested by Manu Dosunmu (4.8 feet, MAN). ALLEN QUICKLEY MAKES IT! Assist: D'Angelo McGrady
Score: 74-63

[07:49] Team_046 possession (Score: 74-63)
Collin Butler drives and kicks out. FOUL! Shooting foul on Russell Morant. Paul DeRozan to the line for 2 free throws. [Team fouls: 3] (Russell Morant: 1 personal fouls)   FT 1/2: MISS   FT 2/2: GOOD Paul DeRozan makes 1/2 from the line.
Score: 74-64

[07:33] Team_070 possession (Score: 74-64)
Paul Quickley attempts a 3Pt. Contested by Collin Butler (3.8 feet, MAN). PAUL QUICKLEY MAKES IT! Assist: D'Angelo McGrady
Score: 77-64

[07:18] Team_046 possession (Score: 77-64)
Chris LaVine attempts a Midrange. Contested by Luka Gobert (5.2 feet, ZONE). Chris LaVine misses. Offensive rebound by Chris LaVine! Chris LaVine kicks it out.

[07:04] Team_046 possession (Score: 77-64)
Manu Dosunmu attempts a 3Pt. Contested by Allen Quickley (5.8 feet, MAN). Manu Dosunmu misses. Rebound secured by Russell Morant.

[06:49] Team_070 possession (Score: 77-64)
Russell Morant attempts a 3Pt. Contested by Josh Barrett (5.0 feet, ZONE). Russell Morant misses. Offensive rebound by Luka Gobert! Luka Gobert kicks it out.

[06:34] Team_070 possession (Score: 77-64)
D'Angelo McGrady attempts a 3Pt. Contested by Josh Barrett (4.9 feet, MAN). D'Angelo McGrady misses. Rebound secured by Manu Dosunmu.

[06:19] Team_046 possession (Score: 77-64)
Manu Dosunmu throws a bad pass out of bounds! TURNOVER! (dead ball)

[06:05] Team_070 possession (Score: 77-64)
Allen Quickley attempts a 3Pt. Contested by Manu Dosunmu (4.8 feet, MAN). Allen Quickley misses. Offensive rebound by Luka Gobert! Luka Gobert kicks it out.

[05:50] Team_070 possession (Score: 77-64)
Paul Quickley drives, Collin Butler stays with him. Paul Quickley attempts a Layup. Contested by Collin Butler (3.8 feet, MAN). Paul Quickley misses. Rebound secured by Chris LaVine.

[05:31] Team_046 possession (Score: 77-64)
Paul DeRozan drives to the basket... Paul DeRozan loses control! Ball rolls out of bounds! TURNOVER! (dead ball)

[05:18] Team_070 possession (Score: 77-64)
Allen Quickley drives to the basket... Allen Quickley loses control! Ball rolls out of bounds! TURNOVER! (dead ball)

[05:05] Team_046 possession (Score: 77-64)
Manu Dosunmu attempts a Midrange. Contested by Allen Quickley (5.8 feet, MAN). Manu Dosunmu misses. Rebound secured by D'Angelo McGrady.

[04:55] Team_070 possession (Score: 77-64)
Luka Gobert attempts a Midrange. Contested by Chris LaVine (4.0 feet, MAN). Luka Gobert misses. Rebound secured by Manu Dosunmu.

[04:43] Team_046 possession (Score: 77-64)
Chris LaVine attempts a 3Pt. Contested by Paul Quickley (4.8 feet, ZONE). Chris LaVine misses. Rebound secured by D'Angelo McGrady.

[04:30] Team_070 possession (Score: 77-64)
Allen Quickley drives, picks up Manu Dosunmu. Help arrives from Collin Butler! Allen Quickley attempts a Dunk. Contested by Collin Butler (4.8 feet, MAN). Allen Quickley misses. Rebound secured by Chris LaVine.

[04:15] Team_046 possession (Score: 77-64)
Collin Butler attempts a 3Pt. Contested by Paul Quickley (4.6 feet, ZONE). Collin Butler misses. Rebound secured by Russell Morant.

[04:01] Team_070 possession (Score: 77-64)
Allen Quickley drives, Chris LaVine stays with him. Allen Quickley attempts a Dunk. Contested by Chris LaVine (3.9 feet, ZONE). Allen Quickley misses. Rebound secured by Chris LaVine.

[03:45] Team_046 possession (Score: 77-64)
Manu Dosunmu attempts a 3Pt. Contested by Paul Quickley (4.9 feet, ZONE). Manu Dosunmu misses. Rebound secured by D'Angelo McGrady.

[03:32] Team_070 possession (Score: 77-64)
Russell Morant drives to the basket... Russell Morant loses control! Ball rolls out of bounds! TURNOVER! (dead ball)

[03:18] Team_046 possession (Score: 77-64)
Manu Dosunmu attempts a 3Pt. Contested by Paul Quickley (4.9 feet, ZONE). Manu Dosunmu misses. Offensive rebound by Chris LaVine! Chris LaVine kicks it out.

[03:04] Team_046 possession (Score: 77-64)
Chris LaVine attempts a 3Pt. Contested by Luka Gobert (5.3 feet, MAN). CHRIS LAVINE MAKES IT! Assist: Manu Dosunmu
Score: 77-67

[02:48] Team_070 possession (Score: 77-67)
Allen Quickley attempts a Layup. Contested by Chris LaVine (3.9 feet, ZONE). Allen Quickley misses. Rebound secured by Chris LaVine.

[02:34] Team_046 possession (Score: 77-67)
FOUL! Offensive foul on Chris LaVine! Luka Gobert drew the charge! [Team fouls: 5] (Chris LaVine: 1 personal fouls) TURNOVER! (dead ball)

[02:18] Team_070 possession (Score: 77-67)
FOUL! Shooting foul on Chris LaVine. D'Angelo McGrady to the line for 2 free throws. [BONUS: 6 team fouls] (Chris LaVine: 2 personal fouls)   FT 1/2: GOOD   FT 2/2: GOOD D'Angelo McGrady makes 2/2 from the line.
Score: 79-67

[02:03] Team_046 possession (Score: 79-67)
Paul DeRozan drives to the basket... Paul DeRozan throws a bad pass out of bounds! TURNOVER! (dead ball)

[01:52] Team_070 possession (Score: 79-67)
Paul Quickley attempts a Layup. Contested by Chris LaVine (3.9 feet, ZONE). PAUL QUICKLEY MAKES IT! Assist: Russell Morant
Score: 81-67

[01:39] Team_046 possession (Score: 81-67)
FOUL! Reach-in foul on Luka Gobert during the drive. [Team fouls: 4] No free throws, side out. (Luka Gobert: 1 personal fouls)

[01:23] Team_046 possession (Score: 81-67)
Paul DeRozan attempts a Midrange. Contested by Russell Morant (3.8 feet, MAN). Paul DeRozan misses. Offensive rebound by Paul DeRozan! Paul DeRozan puts it back in!
Score: 81-69

[01:06] Team_070 possession (Score: 81-69)
Paul Quickley attempts a Layup. Contested by Collin Butler (3.9 feet, MAN). PAUL QUICKLEY MAKES IT! Assist: Russell Morant
Score: 83-69

[00:46] Team_046 possession (Score: 83-69)
FOUL! Shooting foul on Luka Gobert. Chris LaVine to the line for 2 free throws. [BONUS: 5 team fouls] (Luka Gobert: 2 personal fouls)   FT 1/2: GOOD   FT 2/2: GOOD Chris LaVine makes 2/2 from the line.
Score: 83-71

[00:31] Team_070 possession (Score: 83-71)
FOUL! Reach-in foul on Chris LaVine during the drive. [IN THE BONUS! 7 team fouls] Russell Morant to the line for 2 free throws. (Chris LaVine: 3 personal fouls)   FT 1/2: MISS   FT 2/2: MISS Russell Morant makes 0/2 from the line. Rebound secured by Paul DeRozan.

[00:14] Team_046 possession (Score: 83-71)
Josh Barrett attempts a 3Pt. Contested by D'Angelo McGrady (5.8 feet, MAN). Josh Barrett misses. Rebound secured by Russell Morant.

================================================================================
                              4TH QUARTER COMPLETE                              
================================================================================

4TH QUARTER SCORE: Team_070 17, Team_046 16

BOX SCORE:
================================================================================

Team_070
--------------------------------------------------------------------------------
Player                MIN  PTS  REB  AST  TO      FG   FG%      3P   3P%
--------------------------------------------------------------------------------
Paul Quickley          15    7    0    1   0   3/4    75.0     0/0   0.0
Allen Quickley         16    5    0    0   0   2/5    40.0     0/0   0.0
Jabari Paul            33    2    0    0   0   1/2    50.0     0/0   0.0
D'Angelo McGrady       15    2    4    2   0   1/2    50.0     0/0   0.0
Cole Gasol             33    0    0    0   0   0/1     0.0     0/0   0.0
John Hyland            33    0    0    1   0   0/0     0.0     0/0   0.0
LeBron Barnes          32    0    1    0   0   0/0     0.0     0/0   0.0
Khris Bryant           32    0    1    0   0   0/0     0.0     0/0   0.0
Russell Morant         15    0    3    2   0   0/1     0.0     0/0   0.0
Luka Gobert            16    0    2    0   0   0/1     0.0     0/0   0.0

TEAM: FG: 7/16 (43.8%), 3PT: 2/4 (50.0%), REB: 11 (3 off, 8 def), AST: 6, TO: 4
TEAM FOULS: 5 [Team_046 in BONUS]


Team_046
--------------------------------------------------------------------------------
Player                MIN  PTS  REB  AST  TO      FG   FG%      3P   3P%
--------------------------------------------------------------------------------
D'Angelo O'Neal        32    6    0    0   0   2/3    66.7     0/0   0.0
Chris LaVine           16    5    6    0   0   2/4    50.0     0/0   0.0
Paul DeRozan           16    3    2    0   0   2/2   100.0     0/0   0.0
Lauri Carter           33    2    1    0   0   1/1   100.0     0/0   0.0
Cade Wall              32    0    0    1   0   0/0     0.0     0/0   0.0
Victor Nowitzki        32    0    0    2   0   0/0     0.0     0/0   0.0
Kevin Allen            32    0    1    0   0   0/0     0.0     0/0   0.0
Manu Dosunmu           16    0    2    1   0   0/3     0.0     0/0   0.0
Collin Butler          16    0    0    0   0   0/1     0.0     0/0   0.0
Josh Barrett           15    0    0    0   0   0/1     0.0     0/0   0.0

TEAM: FG: 7/15 (46.7%), 3PT: 2/7 (28.6%), REB: 12 (3 off, 9 def), AST: 4, TO: 5
TEAM FOULS: 7 [Team_070 in BONUS]

================================================================================

================================================================================
                               FULL GAME COMPLETE                               
================================================================================

FINAL SCORE: Team_070 83, Team_046 71

SCORING BY QUARTER:
--------------------------------------------------------------------------------
Team                     Q1     Q2     Q3     Q4    FINAL
--------------------------------------------------------------------------------
Team_070                 24     23     19     17       83
Team_046                 17     20     18     16       71
--------------------------------------------------------------------------------

FULL GAME BOX SCORE:
================================================================================

Team_070
--------------------------------------------------------------------------------
Player                MIN  PTS  REB  AST  TO      FG   FG%      3P   3P%      FT STL BLK
--------------------------------------------------------------------------------
Cole Gasol             33    8    0    1   1   3/9    33.3   2/6    33.3   0/0     0   0
John Hyland            33   10    0    3   0   6/8    75.0   1/3    33.3   4/5     2   0
Jabari Paul            33   11    9    0   2   6/12   50.0   0/0     0.0   4/6     1   0
LeBron Barnes          32    4   12    2   1   2/10   20.0   0/6     0.0   1/3     0   3
Khris Bryant           32   18   16    3   3   5/8    62.5   0/1     0.0   3/3     0   0
Allen Quickley         16    5    0    0   0   3/7    42.9   2/2   100.0   0/0     0   0
Luka Gobert            16    0    3    0   2   1/3    33.3   0/1     0.0   0/0     0   0
Paul Quickley          15   12    0    1   1   6/8    75.0   2/3    66.7   1/1     0   0
D'Angelo McGrady       15    4    6    2   1   2/4    50.0   0/1     0.0   3/4     0   0
Russell Morant         15    6    8    2   0   0/2     0.0   0/0     0.0   2/4     0   1

TEAM: FG: 34/71 (47.9%), 3PT: 7/23 (30.4%), REB: 53 (16 off, 37 def), AST: 14, TO: 11


Team_046
--------------------------------------------------------------------------------
Player                MIN  PTS  REB  AST  TO      FG   FG%      3P   3P%      FT STL BLK
--------------------------------------------------------------------------------
Lauri Carter           33   12   10    0   3   4/10   40.0   2/6    33.3   0/0     0   0
D'Angelo O'Neal        32   20    0    0   0   7/12   58.3   3/5    60.0   4/5     0   1
Victor Nowitzki        32    0    0    3   2   0/7     0.0   0/3     0.0   0/0     0   1
Cade Wall              32    4   17    2   2   3/9    33.3   0/3     0.0   0/0     1   0
Kevin Allen            32   11    8    0   0   5/8    62.5   0/0     0.0   3/5     1   2
Collin Butler          16    4    0    0   0   2/4    50.0   1/3    33.3   1/1     0   0
Manu Dosunmu           16    0    2    3   1   2/5    40.0   1/3    33.3   0/0     0   0
Chris LaVine           16    9    9    0   2   4/7    57.1   1/3    33.3   2/2     0   0
Paul DeRozan           16    9    7    1   1   2/2   100.0   0/0     0.0   1/2     0   0
Josh Barrett           15    2    0    0   2   1/4    25.0   0/3     0.0   0/0     0   0

TEAM: FG: 30/68 (44.1%), 3PT: 8/29 (27.6%), REB: 53 (19 off, 34 def), AST: 9, TO: 13

================================================================================
