================================================================================
                        FULL GAME - Team_009 vs Team_090                        
================================================================================

================================================================================
                       1ST QUARTER - Team_009 vs Team_090                       
================================================================================

[12:00] Team_009 possession (Score: 0-0)
Cole Mitchell drives and kicks out. Desmond Harden attempts a Midrange. Contested by Larry Bridges (4.7 feet, MAN). Desmond Harden misses. Rebound secured by Tracy Adebayo.

[11:45] Team_090 possession (Score: 0-0)
Larry Bridges attempts a Layup. Contested by Desmond Harden (4.9 feet, MAN). LARRY BRIDGES MAKES IT!
Score: 0-2

[11:30] Team_009 possession (Score: 0-2)
Cole Mitchell attempts a Layup. BLOCKED BY GARY BROGDON! Ball is loose! Rebound secured by Gary Brogdon.

[11:17] Team_090 possession (Score: 0-2)
Tracy Adebayo drives and kicks out. Gary Brogdon attempts a 3Pt. Contested by Miles Sabonis (5.3 feet, ZONE). Gary Brogdon misses. Rebound secured by Cole Mitchell.

[11:00] Team_009 possession (Score: 0-2)
Kyle Brogdon attempts a Midrange. Contested by Tracy Adebayo (4.3 feet, MAN). KYLE BROGDON MAKES IT! Assist: Anfernee Anunoby
Score: 2-2

[10:43] Team_090 possession (Score: 2-2)
Derrick Mitchell attempts a Midrange. Contested by Miles Sabonis (5.6 feet, MAN). DERRICK MITCHELL MAKES IT!
Score: 2-4

[10:26] Team_009 possession (Score: 2-4)
Cole Mitchell attempts a Midrange. Contested by Gary Brogdon (3.5 feet, MAN). COLE MITCHELL MAKES IT!
Score: 4-4

[10:13] Team_090 possession (Score: 4-4)
Zach Wall attempts a Midrange. Contested by Cole Mitchell (4.7 feet, ZONE). Zach Wall misses. Rebound secured by Kyle Brogdon.

[09:59] Team_009 possession (Score: 4-4)
Miles Sabonis attempts a 3Pt. Contested by Derrick Mitchell (3.1 feet, ZONE). Miles Sabonis misses. Rebound secured by Gary Brogdon.

[09:43] Team_090 possession (Score: 4-4)
Derrick Mitchell attempts a 3Pt. Contested by Miles Sabonis (5.6 feet, ZONE). DERRICK MITCHELL MAKES IT! Assist: Zach Wall
Score: 4-7

[09:29] Team_009 possession (Score: 4-7)
FOUL! Holding foul on Derrick Mitchell. [Team fouls: 1] No free throws, side out. (Derrick Mitchell: 1 personal fouls)

[09:15] Team_009 possession (Score: 4-7)
Miles Sabonis attempts a 3Pt. Contested by Derrick Mitchell (3.1 feet, ZONE). Miles Sabonis misses. Rebound secured by Gary Brogdon.

[09:01] Team_090 possession (Score: 4-7)
FOUL! Shooting foul on Cole Mitchell. Derrick Mitchell to the line for 2 free throws. [Team fouls: 1] (Cole Mitchell: 1 personal fouls)   FT 1/2: GOOD   FT 2/2: MISS Derrick Mitchell makes 1/2 from the line. Rebound secured by Cole Mitchell.
Score: 4-8

[08:47] Team_009 possession (Score: 4-8)
Anfernee Anunoby attempts a Midrange. Contested by Zach Wall (4.9 feet, MAN). Anfernee Anunoby misses. Offensive rebound by Kyle Brogdon! Kyle Brogdon's putback is no good. Rebound secured by Gary Brogdon.

[08:33] Team_090 possession (Score: 4-8)
Larry Bridges makes the Dunk and draws the foul on Desmond Harden! And-1! Larry Bridges to the line for 1. [Team fouls: 2] (Desmond Harden: 1 personal fouls)   FT 1/1: GOOD Larry Bridges makes 1/1 from the line.
Score: 4-11

[08:22] Team_009 possession (Score: 4-11)
Desmond Harden attempts a Midrange. Contested by Larry Bridges (4.8 feet, MAN). Desmond Harden misses. FOUL! Loose ball foul on Zach Wall during the rebound battle. [Team fouls: 2] No free throws, side out. (Zach Wall: 1 personal fouls)

[08:09] Team_009 possession (Score: 4-11)
Kyle Brogdon attempts a Layup. Contested by Tracy Adebayo (4.3 feet, MAN). KYLE BROGDON MAKES IT! Assist: Miles Sabonis
Score: 6-11

[07:51] Team_090 possession (Score: 6-11)
Derrick Mitchell throws a bad pass! Stolen by Miles Sabonis! TURNOVER! (live ball)

[07:33] Team_009 possession (Score: 6-11)
Kyle Brogdon drives and kicks out. Kyle Brogdon attempts a 3Pt. Contested by Larry Bridges (4.7 feet, ZONE). Kyle Brogdon misses. Rebound secured by Zach Wall.

[07:19] Team_090 possession (Score: 6-11)
Derrick Mitchell attempts a 3Pt. Contested by Miles Sabonis (5.6 feet, MAN). Derrick Mitchell misses. Rebound secured by Kyle Brogdon.

[07:06] Team_009 possession (Score: 6-11)
Desmond Harden drives, Gary Brogdon stays with him. Desmond Harden attempts a Dunk. Contested by Gary Brogdon (3.7 feet, ZONE). Desmond Harden misses. Rebound secured by Gary Brogdon.

[06:52] Team_090 possession (Score: 6-11)
Gary Brogdon attempts a Layup. BLOCKED BY MILES SABONIS! Ball goes out off Miles Sabonis. Gary Brogdon's ball!

[06:40] Team_090 possession (Score: 6-11)
Tracy Adebayo drives, Kyle Brogdon stays with him. Tracy Adebayo attempts a Layup. Contested by Kyle Brogdon (4.7 feet, MAN). Tracy Adebayo misses. Offensive rebound by Tracy Adebayo! Tracy Adebayo kicks it out.

[06:29] Team_090 possession (Score: 6-11)
Tracy Adebayo attempts a Layup. Contested by Cole Mitchell (4.3 feet, ZONE). Tracy Adebayo misses. Rebound secured by Anfernee Anunoby.

[06:17] Team_009 possession (Score: 6-11)
Cole Mitchell attempts a 3Pt. Contested by Gary Brogdon (3.5 feet, MAN). Cole Mitchell misses. Rebound secured by Gary Brogdon.

[06:01] Team_090 possession (Score: 6-11)
Zach Wall attempts a 3Pt. Contested by Miles Sabonis (5.5 feet, ZONE). Zach Wall misses. Rebound secured by Cole Mitchell.

[05:52] Team_009 possession (Score: 6-11)
Kyle Brogdon attempts a Midrange. Contested by Tracy Adebayo (4.4 feet, MAN). Kyle Brogdon misses. FOUL! Loose ball foul on Zach Wall during the rebound battle. [Team fouls: 3] No free throws, side out. (Zach Wall: 2 personal fouls)

[05:39] Team_009 possession (Score: 6-11)
Anfernee Anunoby attempts a 3Pt. Contested by Zach Wall (4.9 feet, MAN). Anfernee Anunoby misses. Rebound secured by Tracy Adebayo.

[05:23] Team_090 possession (Score: 6-11)
FOUL! Offensive foul on Derrick Mitchell! Miles Sabonis drew the charge! [Team fouls: 4] (Derrick Mitchell: 2 personal fouls) TURNOVER! (dead ball)

[05:11] Team_009 possession (Score: 6-11)
Cole Mitchell attempts a Layup. Contested by Gary Brogdon (3.6 feet, ZONE). Cole Mitchell misses. Rebound secured by Gary Brogdon.

[04:56] Team_090 possession (Score: 6-11)
Zach Wall attempts a 3Pt. Contested by Anfernee Anunoby (5.4 feet, MAN). Zach Wall misses. Rebound secured by Cole Mitchell.

[04:39] Team_009 possession (Score: 6-11)
Anfernee Anunoby attempts a 3Pt. Contested by Derrick Mitchell (3.2 feet, ZONE). Anfernee Anunoby misses. Rebound secured by Tracy Adebayo.

[04:26] Team_090 possession (Score: 6-11)
Larry Bridges attempts a 3Pt. Contested by Desmond Harden (5.0 feet, MAN). LARRY BRIDGES MAKES IT! Assist: Derrick Mitchell
Score: 6-14

[04:13] Team_009 possession (Score: 6-14)
Kyle Brogdon drives and kicks out. Anfernee Anunoby attempts a 3Pt. Contested by Zach Wall (5.0 feet, MAN). ANFERNEE ANUNOBY MAKES IT! Assist: Miles Sabonis
Score: 9-14

[04:00] Team_090 possession (Score: 9-14)
Derrick Mitchell attempts a 3Pt. Contested by Miles Sabonis (5.7 feet, MAN). DERRICK MITCHELL MAKES IT! Assist: Larry Bridges
Score: 9-17

[03:44] Team_009 possession (Score: 9-17)
Desmond Harden attempts a Layup. Contested by Gary Brogdon (3.9 feet, ZONE). Desmond Harden misses. Rebound secured by Zach Wall.

[03:29] Team_090 possession (Score: 9-17)
Zach Wall attempts a 3Pt. Contested by Miles Sabonis (5.7 feet, ZONE). ZACH WALL MAKES IT!
Score: 9-20

[03:16] Team_009 possession (Score: 9-20)
Cole Mitchell attempts a 3Pt. Contested by Gary Brogdon (3.9 feet, MAN). Cole Mitchell misses. Rebound secured by Tracy Adebayo.

[02:58] Team_090 possession (Score: 9-20)
FOUL! Reach-in foul on Kyle Brogdon during the drive. [Team fouls: 3] No free throws, side out. (Kyle Brogdon: 1 personal fouls)

[02:41] Team_090 possession (Score: 9-20)
Tracy Adebayo drives to the basket... Tracy Adebayo throws a bad pass! Stolen by Kyle Brogdon! TURNOVER! (live ball)

[02:29] Team_009 possession (Score: 9-20)
Desmond Harden makes the Layup and draws the foul on Larry Bridges! And-1! Desmond Harden to the line for 1. [BONUS: 5 team fouls] (Larry Bridges: 1 personal fouls)   FT 1/1: GOOD Desmond Harden makes 1/1 from the line.
Score: 12-20

[02:18] Team_090 possession (Score: 12-20)
Derrick Mitchell attempts a 3Pt. Contested by Miles Sabonis (5.8 feet, ZONE). DERRICK MITCHELL MAKES IT! Assist: Tracy Adebayo
Score: 12-23

[02:02] Team_009 possession (Score: 12-23)
Cole Mitchell attempts a Midrange. Contested by Gary Brogdon (4.0 feet, MAN). Cole Mitchell misses. Rebound secured by Tracy Adebayo.

[01:46] Team_090 possession (Score: 12-23)
Zach Wall drives to the basket... FOUL! Offensive foul on Zach Wall! Cole Mitchell drew the charge! [Team fouls: 6] (Zach Wall: 3 personal fouls) TURNOVER! (dead ball)

[01:27] Team_009 possession (Score: 12-23)
Miles Sabonis attempts a Midrange. Contested by Zach Wall (5.1 feet, ZONE). Miles Sabonis misses. Rebound secured by Gary Brogdon.

[01:14] Team_090 possession (Score: 12-23)
Gary Brogdon throws a bad pass! Stolen by Cole Mitchell! TURNOVER! (live ball)

[00:59] Team_009 possession (Score: 12-23)
Kyle Brogdon attempts a Midrange. Contested by Zach Wall (4.8 feet, ZONE). Kyle Brogdon misses. Rebound secured by Zach Wall.

[00:44] Team_090 possession (Score: 12-23)
FOUL! Holding foul on Kyle Brogdon. [Team fouls: 4] No free throws, side out. (Kyle Brogdon: 2 personal fouls)

[00:29] Team_090 possession (Score: 12-23)
Tracy Adebayo drives, Kyle Brogdon stays with him. Tracy Adebayo attempts a Layup. Contested by Kyle Brogdon (5.2 feet, ZONE). TRACY ADEBAYO MAKES IT! Assist: Zach Wall
Score: 12-25

[00:14] Team_009 possession (Score: 12-25)
Anfernee Anunoby attempts a 3Pt. Contested by Zach Wall (5.3 feet, MAN). Anfernee Anunoby misses. Rebound secured by Zach Wall.

================================================================================
                              1ST QUARTER COMPLETE                              
================================================================================

1ST QUARTER SCORE: Team_009 12, Team_090 25

BOX SCORE:
================================================================================

Team_009
--------------------------------------------------------------------------------
Player                MIN  PTS  REB  AST  TO      FG   FG%      3P   3P%
--------------------------------------------------------------------------------
Kyle Brogdon           12    4    2    0   0   2/4    50.0     0/0   0.0
Anfernee Anunoby       12    3    1    1   0   1/5    20.0     0/0   0.0
Desmond Harden         12    3    0    0   0   1/3    33.3     0/0   0.0
Cole Mitchell          12    2    6    0   0   1/7    14.3     0/0   0.0
Miles Sabonis          12    0    0    2   0   0/3     0.0     0/0   0.0

TEAM: FG: 5/22 (22.7%), 3PT: 0/7 (0.0%), REB: 10 (3 off, 7 def), AST: 3, TO: 0
TEAM FOULS: 4


Team_090
--------------------------------------------------------------------------------
Player                MIN  PTS  REB  AST  TO      FG   FG%      3P   3P%
--------------------------------------------------------------------------------
Derrick Mitchell       12   11    0    1   0   4/6    66.7     0/0   0.0
Larry Bridges          12    8    0    1   0   3/3   100.0     0/0   0.0
Zach Wall              12    3    4    2   0   1/4    25.0     0/0   0.0
Tracy Adebayo          12    2    6    1   0   1/3    33.3     0/0   0.0
Gary Brogdon           12    0    8    0   0   0/0     0.0     0/0   0.0

TEAM: FG: 9/16 (56.2%), 3PT: 5/8 (62.5%), REB: 17 (1 off, 16 def), AST: 5, TO: 5
TEAM FOULS: 6 [Team_009 in BONUS]

================================================================================

================================================================================
                       2ND QUARTER - Team_009 vs Team_090                       
================================================================================

[12:00] Team_009 possession (Score: 12-25)
Anfernee Anunoby attempts a Midrange. Contested by Zach Wall (5.1 feet, ZONE). Anfernee Anunoby misses. Rebound secured by Gary Brogdon.

[11:44] Team_090 possession (Score: 12-25)
Zach Wall drives and kicks out. Derrick Mitchell attempts a 3Pt. Contested by Miles Sabonis (5.6 feet, ZONE). Derrick Mitchell misses. Offensive rebound by Zach Wall! Zach Wall kicks it out.

[11:30] Team_090 possession (Score: 12-25)
Derrick Mitchell attempts a Midrange. Contested by Cole Mitchell (5.2 feet, ZONE). Derrick Mitchell misses. Rebound secured by Cole Mitchell.

[11:15] Team_009 possession (Score: 12-25)
Desmond Harden attempts a 3Pt. Contested by Larry Bridges (5.1 feet, MAN). Desmond Harden misses. Rebound secured by Gary Brogdon.

[11:04] Team_090 possession (Score: 12-25)
Gary Brogdon attempts a Midrange. Contested by Anfernee Anunoby (5.6 feet, ZONE). GARY BROGDON MAKES IT! Assist: Derrick Mitchell
Score: 12-27

[10:49] Team_009 possession (Score: 12-27)
Cole Mitchell makes the Layup and draws the foul on Gary Brogdon! And-1! Cole Mitchell to the line for 1. [Team fouls: 1] (Gary Brogdon: 1 personal fouls)   FT 1/1: MISS Cole Mitchell makes 0/1 from the line. Rebound secured by Zach Wall.
Score: 14-27

[10:38] Team_090 possession (Score: 14-27)
Zach Wall throws a bad pass! Stolen by Anfernee Anunoby! TURNOVER! (live ball)

[10:26] Team_009 possession (Score: 14-27)
Desmond Harden attempts a 3Pt. Contested by Larry Bridges (5.1 feet, MAN). Desmond Harden misses. Rebound secured by Gary Brogdon.

[10:11] Team_090 possession (Score: 14-27)
FOUL! Holding foul on Desmond Harden. [Team fouls: 1] No free throws, side out. (Desmond Harden: 1 personal fouls)

[09:57] Team_090 possession (Score: 14-27)
Tracy Adebayo attempts a Layup. Contested by Cole Mitchell (4.9 feet, ZONE). TRACY ADEBAYO MAKES IT! Assist: Zach Wall
Score: 14-29

[09:42] Team_009 possession (Score: 14-29)
Desmond Harden makes the Layup and draws the foul on Larry Bridges! And-1! Desmond Harden to the line for 1. [Team fouls: 2] (Larry Bridges: 1 personal fouls)   FT 1/1: GOOD Desmond Harden makes 1/1 from the line.
Score: 17-29

[09:25] Team_090 possession (Score: 17-29)
Gary Brogdon makes the Dunk and draws the foul on Kyle Brogdon! And-1! Gary Brogdon to the line for 1. [Team fouls: 2] (Kyle Brogdon: 1 personal fouls)   FT 1/1: GOOD Gary Brogdon makes 1/1 from the line.
Score: 17-32

[09:09] Team_009 possession (Score: 17-32)
Desmond Harden drives, Larry Bridges stays with him. Desmond Harden attempts a Dunk. Contested by Larry Bridges (5.3 feet, MAN). Desmond Harden misses. Rebound secured by Zach Wall.

[08:55] Team_090 possession (Score: 17-32)
Tracy Adebayo drives, picks up Kyle Brogdon. Help arrives from Miles Sabonis! Tracy Adebayo attempts a Layup. Contested by Miles Sabonis (5.4 feet, ZONE). TRACY ADEBAYO MAKES IT!
Score: 17-34

[08:42] Team_009 possession (Score: 17-34)
Cole Mitchell drives, picks up Gary Brogdon. Help arrives from Larry Bridges! Cole Mitchell attempts a Dunk. Contested by Larry Bridges (4.5 feet, ZONE). Cole Mitchell misses. Rebound secured by Gary Brogdon.

[08:28] Team_090 possession (Score: 17-34)
Tracy Adebayo attempts a Midrange. Contested by Kyle Brogdon (5.4 feet, MAN). TRACY ADEBAYO MAKES IT! Assist: Derrick Mitchell
Score: 17-36

[08:14] Team_009 possession (Score: 17-36)
Kyle Brogdon attempts a Layup. Contested by Tracy Adebayo (5.2 feet, MAN). KYLE BROGDON MAKES IT! Assist: Miles Sabonis
Score: 19-36

[07:59] Team_090 possession (Score: 19-36)
Larry Bridges attempts a 3Pt. Contested by Miles Sabonis (6.0 feet, ZONE). LARRY BRIDGES MAKES IT! Assist: Zach Wall
Score: 19-39

[07:43] Team_009 possession (Score: 19-39)
Miles Sabonis attempts a Midrange. Contested by Derrick Mitchell (3.8 feet, MAN). Miles Sabonis misses. Rebound secured by Tracy Adebayo.

[07:34] Team_090 possession (Score: 19-39)
Gary Brogdon attempts a 3Pt. Contested by Cole Mitchell (5.5 feet, MAN). Gary Brogdon misses. Rebound secured by Kyle Brogdon.

[07:23] Team_009 possession (Score: 19-39)
Kyle Brogdon drives, picks up Gary Brogdon. Help arrives from Larry Bridges! Kyle Brogdon attempts a Layup. Contested by Larry Bridges (4.5 feet, ZONE). KYLE BROGDON MAKES IT!
Score: 21-39

[07:06] Team_090 possession (Score: 21-39)
Gary Brogdon attempts a Layup. Contested by Cole Mitchell (5.6 feet, MAN). Gary Brogdon misses. Rebound secured by Kyle Brogdon.

[06:53] Team_009 possession (Score: 21-39)
Miles Sabonis attempts a 3Pt. Contested by Derrick Mitchell (3.9 feet, MAN). Miles Sabonis misses. Offensive rebound by Kyle Brogdon! Kyle Brogdon kicks it out.

[06:35] Team_009 possession (Score: 21-39)
Cole Mitchell attempts a Midrange. Contested by Gary Brogdon (4.9 feet, MAN). Cole Mitchell misses. Rebound secured by Zach Wall.

[06:21] Team_090 possession (Score: 21-39)
Gary Brogdon attempts a Layup. Wide open! Kyle Brogdon is 6.0 feet away. [ZONE] GARY BROGDON MAKES IT! Assist: Tracy Adebayo
Score: 21-41

[06:04] Team_009 possession (Score: 21-41)
Anfernee Anunoby attempts a 3Pt. Contested by Zach Wall (5.6 feet, MAN). Anfernee Anunoby misses. Rebound secured by Zach Wall.

[05:50] Team_090 possession (Score: 21-41)
Gary Brogdon commits a violation (traveling/carry)! TURNOVER! (dead ball)

[05:50] Substitution (Team_009): Miles Sabonis OUT → Paul Trent IN (stamina_rule2)

[05:50] Substitution (Team_009): Desmond Harden OUT → Evan Curry IN (stamina_rule2)

[05:50] Substitution (Team_009): Anfernee Anunoby OUT → RJ Jokic IN (stamina_rule2)

[05:50] Substitution (Team_009): Cole Mitchell OUT → Kawhi Herro IN (stamina_rule2)

[05:50] Substitution (Team_009): Kyle Brogdon OUT → Shaquille Green IN (stamina_rule2)

[05:50] Substitution (Team_090): Derrick Mitchell OUT → OG Anunoby IN (stamina_rule2)

[05:50] Substitution (Team_090): Larry Bridges OUT → Josh Wall IN (stamina_rule2)

[05:50] Substitution (Team_090): Zach Wall OUT → Russell Smith IN (stamina_rule2)

[05:50] Substitution (Team_090): Gary Brogdon OUT → Derrick Nowitzki IN (stamina_rule2)

[05:50] Substitution (Team_090): Tracy Adebayo OUT → Tobias Tatum IN (stamina_rule2)

[05:37] Team_009 possession (Score: 21-41)
Evan Curry attempts a Midrange. Contested by Josh Wall (4.2 feet, MAN). Evan Curry misses. Rebound secured by Derrick Nowitzki.

[05:23] Team_090 possession (Score: 21-41)
Josh Wall attempts a 3Pt. Contested by Evan Curry (5.7 feet, MAN). Josh Wall misses. Rebound secured by Shaquille Green.

[05:07] Team_009 possession (Score: 21-41)
Shaquille Green drives and kicks out. Paul Trent attempts a 3Pt. Contested by Russell Smith (4.3 feet, ZONE). PAUL TRENT MAKES IT! Assist: RJ Jokic
Score: 24-41

[04:55] Team_090 possession (Score: 24-41)
Derrick Nowitzki drives, Shaquille Green stays with him. Derrick Nowitzki attempts a Dunk. Contested by Shaquille Green (4.3 feet, ZONE). Derrick Nowitzki misses. Rebound secured by Shaquille Green.

[04:42] Team_009 possession (Score: 24-41)
Shaquille Green attempts a Midrange. Contested by Tobias Tatum (4.8 feet, MAN). SHAQUILLE GREEN MAKES IT! Assist: RJ Jokic
Score: 26-41

[04:30] Team_090 possession (Score: 26-41)
Derrick Nowitzki attempts a 3Pt. Contested by Paul Trent (5.2 feet, ZONE). Derrick Nowitzki misses. Rebound secured by RJ Jokic.

[04:15] Team_009 possession (Score: 26-41)
Paul Trent attempts a 3Pt. Contested by OG Anunoby (4.3 feet, MAN). PAUL TRENT MAKES IT! Assist: Evan Curry
Score: 29-41

[04:03] Team_090 possession (Score: 29-41)
Russell Smith attempts a Midrange. Contested by Kawhi Herro (3.9 feet, ZONE). Russell Smith misses. Rebound secured by Kawhi Herro.

[03:49] Team_009 possession (Score: 29-41)
Kawhi Herro makes the Layup and draws the foul on Derrick Nowitzki! And-1! Kawhi Herro to the line for 1. [Team fouls: 3] (Derrick Nowitzki: 1 personal fouls)   FT 1/1: GOOD Kawhi Herro makes 1/1 from the line.
Score: 32-41

[03:31] Team_090 possession (Score: 32-41)
Russell Smith attempts a 3Pt. Contested by Kawhi Herro (3.9 feet, ZONE). Russell Smith misses. Rebound secured by RJ Jokic.

[03:17] Team_009 possession (Score: 32-41)
Evan Curry attempts a Layup. Contested by Josh Wall (4.2 feet, MAN). Evan Curry misses. Rebound secured by Derrick Nowitzki.

[03:02] Team_090 possession (Score: 32-41)
Josh Wall attempts a 3Pt. Wide open! Paul Trent is 6.0 feet away. [ZONE] Josh Wall misses. Rebound secured by Kawhi Herro.

[02:44] Team_009 possession (Score: 32-41)
Paul Trent attempts a 3Pt. Contested by OG Anunoby (4.3 feet, MAN). Paul Trent misses. Rebound secured by Derrick Nowitzki.

[02:33] Team_090 possession (Score: 32-41)
Derrick Nowitzki makes the Dunk and draws the foul on Kawhi Herro! And-1! Derrick Nowitzki to the line for 1. [Team fouls: 3] (Kawhi Herro: 1 personal fouls)   FT 1/1: MISS Derrick Nowitzki makes 0/1 from the line. Rebound secured by Kawhi Herro.
Score: 32-43

[02:19] Team_009 possession (Score: 32-43)
Shaquille Green attempts a Midrange. Contested by Tobias Tatum (4.8 feet, MAN). Shaquille Green misses. Rebound secured by Tobias Tatum.

[02:05] Team_090 possession (Score: 32-43)
Russell Smith attempts a Layup. Contested by RJ Jokic (4.7 feet, MAN). Russell Smith misses. Rebound secured by Kawhi Herro.

[01:53] Team_009 possession (Score: 32-43)
Shaquille Green attempts a Layup. Contested by Derrick Nowitzki (4.5 feet, ZONE). Shaquille Green misses. Rebound secured by Derrick Nowitzki.

[01:37] Team_090 possession (Score: 32-43)
FOUL! Shooting foul on Paul Trent. Josh Wall to the line for 3 free throws. [Team fouls: 4] (Paul Trent: 1 personal fouls)   FT 1/3: GOOD   FT 2/3: GOOD   FT 3/3: GOOD Josh Wall makes 3/3 from the line.
Score: 32-46

[01:26] Team_009 possession (Score: 32-46)
RJ Jokic attempts a 3Pt. Contested by Josh Wall (3.9 feet, ZONE). RJ Jokic misses. Rebound secured by Russell Smith.

[01:13] Team_090 possession (Score: 32-46)
Russell Smith attempts a 3Pt. Contested by Paul Trent (5.9 feet, ZONE). RUSSELL SMITH MAKES IT! Assist: OG Anunoby
Score: 32-49

[00:58] Team_009 possession (Score: 32-49)
RJ Jokic throws a bad pass out of bounds! TURNOVER! (dead ball)

[00:39] Team_090 possession (Score: 32-49)
Derrick Nowitzki attempts a 3Pt. Contested by Paul Trent (5.2 feet, ZONE). Derrick Nowitzki misses. Rebound secured by Shaquille Green.

[00:24] Team_009 possession (Score: 32-49)
Paul Trent makes the Layup and draws the foul on OG Anunoby! And-1! Paul Trent to the line for 1. [Team fouls: 4] (OG Anunoby: 1 personal fouls)   FT 1/1: GOOD Paul Trent makes 1/1 from the line.
Score: 35-49

[00:10] Team_090 possession (Score: 35-49)
Derrick Nowitzki drives to the basket... Derrick Nowitzki throws a bad pass! Stolen by Kawhi Herro! TURNOVER! (live ball)

================================================================================
                              2ND QUARTER COMPLETE                              
================================================================================

2ND QUARTER SCORE: Team_009 23, Team_090 24

BOX SCORE:
================================================================================

Team_009
--------------------------------------------------------------------------------
Player                MIN  PTS  REB  AST  TO      FG   FG%      3P   3P%
--------------------------------------------------------------------------------
Paul Trent              6    9    0    0   0   3/4    75.0     0/0   0.0
Kyle Brogdon           18    4    3    0   0   2/2   100.0     0/0   0.0
Desmond Harden         18    3    0    0   0   1/4    25.0     0/0   0.0
Kawhi Herro             6    3    4    0   0   1/1   100.0     0/0   0.0
Shaquille Green         6    2    3    0   0   1/3    33.3     0/0   0.0
Anfernee Anunoby       18    0    0    0   0   0/2     0.0     0/0   0.0
Cole Mitchell          18    0    1    0   0   0/3     0.0     0/0   0.0
Miles Sabonis          18    0    0    1   0   0/1     0.0     0/0   0.0
Evan Curry              6    0    0    1   0   0/2     0.0     0/0   0.0
RJ Jokic                6    0    2    2   0   0/1     0.0     0/0   0.0

TEAM: FG: 8/23 (34.8%), 3PT: 1/6 (16.7%), REB: 13 (1 off, 12 def), AST: 4, TO: 1
TEAM FOULS: 4


Team_090
--------------------------------------------------------------------------------
Player                MIN  PTS  REB  AST  TO      FG   FG%      3P   3P%
--------------------------------------------------------------------------------
Gary Brogdon           18    7    4    0   0   3/5    60.0     0/0   0.0
Tracy Adebayo          18    6    1    1   0   3/3   100.0     0/0   0.0
Larry Bridges          18    3    0    0   0   1/1   100.0     0/0   0.0
Josh Wall               6    3    0    0   0   1/3    33.3     0/0   0.0
Russell Smith           6    3    1    0   0   1/4    25.0     0/0   0.0
Zach Wall              18    0    5    2   0   0/0     0.0     0/0   0.0
Derrick Mitchell       18    0    0    2   0   0/1     0.0     0/0   0.0
Derrick Nowitzki        6    0    4    0   0   0/4     0.0     0/0   0.0
Tobias Tatum            6    0    1    0   0   0/0     0.0     0/0   0.0
OG Anunoby              6    0    0    1   0   0/0     0.0     0/0   0.0

TEAM: FG: 9/21 (42.9%), 3PT: 3/9 (33.3%), REB: 16 (1 off, 15 def), AST: 6, TO: 3
TEAM FOULS: 4

================================================================================

================================================================================
                       3RD QUARTER - Team_009 vs Team_090                       
================================================================================

[12:00] Team_009 possession (Score: 35-49)
Anfernee Anunoby makes the Dunk and draws the foul on Gary Brogdon! And-1! Anfernee Anunoby to the line for 1. [Team fouls: 1] (Gary Brogdon: 1 personal fouls)   FT 1/1: GOOD Anfernee Anunoby makes 1/1 from the line.
Score: 38-49

[11:46] Team_090 possession (Score: 38-49)
FOUL! Holding foul on Anfernee Anunoby. [Team fouls: 1] No free throws, side out. (Anfernee Anunoby: 1 personal fouls)

[11:34] Team_090 possession (Score: 38-49)
Derrick Mitchell attempts a Layup. BLOCKED BY MILES SABONIS! Ball is loose! Offensive rebound by Gary Brogdon! Gary Brogdon kicks it out.

[11:21] Team_090 possession (Score: 38-49)
Tracy Adebayo attempts a Layup. Contested by Kyle Brogdon (4.7 feet, ZONE). TRACY ADEBAYO MAKES IT! Assist: Derrick Mitchell
Score: 38-51

[11:07] Team_009 possession (Score: 38-51)
Desmond Harden attempts a Layup. BLOCKED BY LARRY BRIDGES! Ball goes out off Larry Bridges. Desmond Harden's ball!

[10:48] Team_009 possession (Score: 38-51)
Desmond Harden attempts a 3Pt. Contested by Larry Bridges (4.8 feet, MAN). DESMOND HARDEN MAKES IT! Assist: Anfernee Anunoby
Score: 41-51

[10:32] Team_090 possession (Score: 41-51)
FOUL! Holding foul on Miles Sabonis. [Team fouls: 2] No free throws, side out. (Miles Sabonis: 1 personal fouls)

[10:22] Team_090 possession (Score: 41-51)
Larry Bridges attempts a 3Pt. Contested by Miles Sabonis (5.3 feet, ZONE). LARRY BRIDGES MAKES IT! Assist: Zach Wall
Score: 41-54

[10:07] Team_009 possession (Score: 41-54)
Anfernee Anunoby drives, Zach Wall stays with him. Anfernee Anunoby attempts a Dunk. Contested by Zach Wall (4.9 feet, MAN). ANFERNEE ANUNOBY MAKES IT!
Score: 43-54

[09:51] Team_090 possession (Score: 43-54)
Tracy Adebayo attempts a Midrange. Contested by Kyle Brogdon (4.7 feet, MAN). TRACY ADEBAYO MAKES IT!
Score: 43-56

[09:36] Team_009 possession (Score: 43-56)
Anfernee Anunoby attempts a Layup. BLOCKED BY GARY BROGDON! Ball is loose! Rebound secured by Zach Wall.

[09:26] Team_090 possession (Score: 43-56)
Derrick Mitchell drives, Kyle Brogdon stays with him. Derrick Mitchell attempts a Dunk. Contested by Kyle Brogdon (5.2 feet, ZONE). Derrick Mitchell misses. Rebound secured by Anfernee Anunoby.

[09:13] Team_009 possession (Score: 43-56)
Desmond Harden attempts a 3Pt. Contested by Derrick Mitchell (3.3 feet, ZONE). Desmond Harden misses. Rebound secured by Gary Brogdon.

[08:57] Team_090 possession (Score: 43-56)
Tracy Adebayo attempts a Layup. Contested by Kyle Brogdon (4.7 feet, MAN). TRACY ADEBAYO MAKES IT! Assist: Gary Brogdon
Score: 43-58

[08:46] Team_009 possession (Score: 43-58)
Cole Mitchell attempts a 3Pt. Contested by Gary Brogdon (3.5 feet, MAN). Cole Mitchell misses. Offensive rebound by Kyle Brogdon! Kyle Brogdon puts it back in!
Score: 45-58

[08:27] Team_090 possession (Score: 45-58)
Tracy Adebayo throws a bad pass out of bounds! TURNOVER! (dead ball)

[08:13] Team_009 possession (Score: 45-58)
Anfernee Anunoby attempts a 3Pt. Contested by Zach Wall (4.9 feet, MAN). ANFERNEE ANUNOBY MAKES IT! Assist: Kyle Brogdon
Score: 48-58

[08:02] Team_090 possession (Score: 48-58)
Tracy Adebayo drives, picks up Kyle Brogdon. Help arrives from Miles Sabonis! Tracy Adebayo attempts a Dunk. Contested by Miles Sabonis (4.7 feet, ZONE). TRACY ADEBAYO MAKES IT! Assist: Derrick Mitchell
Score: 48-60

[07:45] Team_009 possession (Score: 48-60)
Anfernee Anunoby drives and kicks out. Miles Sabonis attempts a 3Pt. Contested by Derrick Mitchell (3.2 feet, ZONE). MILES SABONIS MAKES IT! Assist: Kyle Brogdon
Score: 51-60

[07:28] Team_090 possession (Score: 51-60)
Gary Brogdon drives to the basket... Gary Brogdon throws a bad pass! Stolen by Kyle Brogdon! TURNOVER! (live ball)

[07:18] Team_009 possession (Score: 51-60)
FOUL! Shooting foul on Gary Brogdon. Anfernee Anunoby to the line for 2 free throws. [Team fouls: 2] (Gary Brogdon: 2 personal fouls)   FT 1/2: GOOD   FT 2/2: GOOD Anfernee Anunoby makes 2/2 from the line.
Score: 53-60

[07:05] Team_090 possession (Score: 53-60)
Larry Bridges drives and kicks out. FOUL! Shooting foul on Desmond Harden. Larry Bridges to the line for 2 free throws. [Team fouls: 3] (Desmond Harden: 1 personal fouls)   FT 1/2: GOOD   FT 2/2: MISS Larry Bridges makes 1/2 from the line. Offensive rebound by Tracy Adebayo! Tracy Adebayo kicks it out.
Score: 53-61

[06:49] Team_090 possession (Score: 53-61)
Tracy Adebayo attempts a 3Pt. Contested by Miles Sabonis (5.1 feet, ZONE). Tracy Adebayo misses. Rebound secured by Kyle Brogdon.

[06:40] Team_009 possession (Score: 53-61)
Desmond Harden attempts a 3Pt. Contested by Derrick Mitchell (3.3 feet, ZONE). Desmond Harden misses. Rebound secured by Gary Brogdon.

[06:25] Team_090 possession (Score: 53-61)
Gary Brogdon attempts a Midrange. Contested by Cole Mitchell (4.6 feet, MAN). GARY BROGDON MAKES IT!
Score: 53-63

[06:09] Team_009 possession (Score: 53-63)
Kyle Brogdon attempts a Layup. Contested by Tracy Adebayo (4.4 feet, MAN). KYLE BROGDON MAKES IT! Assist: Cole Mitchell
Score: 55-63

[05:54] Team_090 possession (Score: 55-63)
Gary Brogdon attempts a 3Pt. Contested by Cole Mitchell (4.6 feet, MAN). Gary Brogdon misses. Rebound secured by Cole Mitchell.

[05:40] Team_009 possession (Score: 55-63)
FOUL! Shooting foul on Gary Brogdon. Kyle Brogdon to the line for 2 free throws. [Team fouls: 3] (Gary Brogdon: 3 personal fouls)   FT 1/2: GOOD   FT 2/2: GOOD Kyle Brogdon makes 2/2 from the line.
Score: 57-63

[05:27] Team_090 possession (Score: 57-63)
Larry Bridges attempts a 3Pt. Contested by Desmond Harden (4.9 feet, MAN). Larry Bridges misses. Rebound secured by Kyle Brogdon.

[05:15] Team_009 possession (Score: 57-63)
Kyle Brogdon attempts a Layup. BLOCKED BY TRACY ADEBAYO! Ball is loose! Offensive rebound by Kyle Brogdon! Kyle Brogdon kicks it out.

[04:56] Team_009 possession (Score: 57-63)
Desmond Harden drives and kicks out. Kyle Brogdon attempts a Midrange. Contested by Zach Wall (5.0 feet, ZONE). Kyle Brogdon misses. Offensive rebound by Cole Mitchell! Cole Mitchell kicks it out.

[04:45] Team_009 possession (Score: 57-63)
Kyle Brogdon drives, picks up Tracy Adebayo. Help arrives from Larry Bridges! Kyle Brogdon attempts a Layup. Contested by Larry Bridges (4.5 feet, MAN). KYLE BROGDON MAKES IT!
Score: 59-63

[04:31] Team_090 possession (Score: 59-63)
Derrick Mitchell attempts a 3Pt. Contested by Miles Sabonis (5.7 feet, ZONE). Derrick Mitchell misses. Rebound secured by Cole Mitchell.

[04:17] Team_009 possession (Score: 59-63)
FOUL! Shooting foul on Tracy Adebayo. Kyle Brogdon to the line for 2 free throws. [Team fouls: 4] (Tracy Adebayo: 1 personal fouls)   FT 1/2: GOOD   FT 2/2: MISS Kyle Brogdon makes 1/2 from the line. Rebound secured by Gary Brogdon.
Score: 60-63

[04:05] Team_090 possession (Score: 60-63)
Larry Bridges attempts a 3Pt. Contested by Desmond Harden (5.0 feet, MAN). Larry Bridges misses. Rebound secured by Kyle Brogdon.

[03:50] Team_009 possession (Score: 60-63)
FOUL! Shooting foul on Derrick Mitchell. Miles Sabonis to the line for 3 free throws. [BONUS: 5 team fouls] (Derrick Mitchell: 1 personal fouls)   FT 1/3: GOOD   FT 2/3: MISS   FT 3/3: GOOD Miles Sabonis makes 2/3 from the line.
Score: 62-63

[03:37] Team_090 possession (Score: 62-63)
Derrick Mitchell drives to the basket... Derrick Mitchell loses control! Ball rolls out of bounds! TURNOVER! (dead ball)

[03:37] Substitution (Team_090): Gary Brogdon OUT → Derrick Nowitzki IN (stamina_rule2)

[03:20] Team_009 possession (Score: 62-63)
Anfernee Anunoby throws a bad pass! Stolen by Zach Wall! TURNOVER! (live ball)

[03:04] Team_090 possession (Score: 62-63)
Derrick Nowitzki attempts a 3Pt. Contested by Cole Mitchell (4.3 feet, MAN). DERRICK NOWITZKI MAKES IT! Assist: Larry Bridges
Score: 62-66

[02:51] Team_009 possession (Score: 62-66)
Desmond Harden attempts a Layup. Contested by Larry Bridges (5.0 feet, MAN). DESMOND HARDEN MAKES IT! Assist: Anfernee Anunoby
Score: 64-66

[02:36] Team_090 possession (Score: 64-66)
Derrick Nowitzki drives, Kyle Brogdon stays with him. Derrick Nowitzki attempts a Layup. Contested by Kyle Brogdon (4.8 feet, ZONE). DERRICK NOWITZKI MAKES IT!
Score: 64-68

[02:21] Team_009 possession (Score: 64-68)
Desmond Harden attempts a Midrange. BLOCKED BY LARRY BRIDGES! Ball is loose! Rebound secured by Tracy Adebayo.

[02:05] Team_090 possession (Score: 64-68)
Larry Bridges attempts a Layup. BLOCKED BY DESMOND HARDEN! Ball deflects out of bounds off Larry Bridges.

[01:47] Team_009 possession (Score: 64-68)
Miles Sabonis attempts a 3Pt. Contested by Derrick Mitchell (3.4 feet, ZONE). Miles Sabonis misses. Offensive rebound by Cole Mitchell! Cole Mitchell kicks it out.

[01:35] Team_009 possession (Score: 64-68)
Kyle Brogdon drives, Derrick Nowitzki stays with him. Kyle Brogdon attempts a Dunk. Contested by Derrick Nowitzki (3.9 feet, ZONE). Kyle Brogdon misses. Rebound secured by Derrick Nowitzki.

[01:23] Team_090 possession (Score: 64-68)
Derrick Nowitzki attempts a Layup. Contested by Cole Mitchell (4.6 feet, MAN). Derrick Nowitzki misses. Offensive rebound by Tracy Adebayo! Tracy Adebayo kicks it out.

[01:09] Team_090 possession (Score: 64-68)
Tracy Adebayo drives to the basket... Tracy Adebayo loses control! Ball rolls out of bounds! TURNOVER! (dead ball)

[01:09] Substitution (Team_009): Miles Sabonis OUT → Paul Trent IN (stamina_rule2)

[01:09] Substitution (Team_009): Desmond Harden OUT → Evan Curry IN (stamina_rule2)

[01:09] Substitution (Team_009): Anfernee Anunoby OUT → RJ Jokic IN (stamina_rule2)

[01:09] Substitution (Team_009): Cole Mitchell OUT → Kawhi Herro IN (stamina_rule2)

[01:09] Substitution (Team_009): Kyle Brogdon OUT → Shaquille Green IN (stamina_rule2)

[01:09] Substitution (Team_090): Derrick Mitchell OUT → OG Anunoby IN (stamina_rule2)

[01:09] Substitution (Team_090): Larry Bridges OUT → Josh Wall IN (stamina_rule2)

[01:09] Substitution (Team_090): Zach Wall OUT → Russell Smith IN (stamina_rule2)

[01:09] Substitution (Team_090): Tracy Adebayo OUT → Tobias Tatum IN (stamina_rule2)

[00:55] Team_009 possession (Score: 64-68)
Paul Trent attempts a Layup. Contested by OG Anunoby (4.3 feet, MAN). Paul Trent misses. Rebound secured by Tobias Tatum.

[00:41] Team_090 possession (Score: 64-68)
FOUL! Shooting foul on RJ Jokic. Russell Smith to the line for 2 free throws. [Team fouls: 4] (RJ Jokic: 1 personal fouls)   FT 1/2: GOOD   FT 2/2: GOOD Russell Smith makes 2/2 from the line.
Score: 64-70

[00:28] Team_009 possession (Score: 64-70)
Evan Curry attempts a 3Pt. Contested by Russell Smith (4.5 feet, ZONE). EVAN CURRY MAKES IT! Assist: Shaquille Green
Score: 67-70

[00:13] Team_090 possession (Score: 67-70)
OG Anunoby drives, Paul Trent stays with him. OG Anunoby attempts a Layup. Contested by Paul Trent (5.7 feet, MAN). OG ANUNOBY MAKES IT!
Score: 67-72

================================================================================
                              3RD QUARTER COMPLETE                              
================================================================================

3RD QUARTER SCORE: Team_009 32, Team_090 23

BOX SCORE:
================================================================================

Team_009
--------------------------------------------------------------------------------
Player                MIN  PTS  REB  AST  TO      FG   FG%      3P   3P%
--------------------------------------------------------------------------------
Anfernee Anunoby       29   10    1    2   0   4/5    80.0     0/0   0.0
Kyle Brogdon           29    8    5    2   0   4/6    66.7     0/0   0.0
Desmond Harden         29    5    0    0   0   2/5    40.0     0/0   0.0
Miles Sabonis          29    5    0    0   0   2/2   100.0     0/0   0.0
Evan Curry              7    3    0    0   0   1/1   100.0     0/0   0.0
Cole Mitchell          29    0    4    1   0   0/0     0.0     0/0   0.0
Paul Trent              7    0    0    0   0   0/1     0.0     0/0   0.0
Shaquille Green         7    0    0    1   0   0/0     0.0     0/0   0.0

TEAM: FG: 13/20 (65.0%), 3PT: 5/7 (71.4%), REB: 10 (4 off, 6 def), AST: 6, TO: 1
TEAM FOULS: 4


Team_090
--------------------------------------------------------------------------------
Player                MIN  PTS  REB  AST  TO      FG   FG%      3P   3P%
--------------------------------------------------------------------------------
Tracy Adebayo          29    8    3    0   0   4/5    80.0     0/0   0.0
Derrick Nowitzki        9    5    1    0   0   2/2   100.0     0/0   0.0
Larry Bridges          29    3    0    1   0   1/4    25.0     0/0   0.0
Gary Brogdon           27    2    4    1   0   1/2    50.0     0/0   0.0
Russell Smith           7    2    0    0   0   1/1   100.0     0/0   0.0
OG Anunoby              7    2    0    0   0   1/1   100.0     0/0   0.0
Derrick Mitchell       29    0    0    2   0   0/2     0.0     0/0   0.0
Zach Wall              29    0    1    1   0   0/0     0.0     0/0   0.0
Tobias Tatum            7    0    1    0   0   0/0     0.0     0/0   0.0

TEAM: FG: 10/17 (58.8%), 3PT: 2/7 (28.6%), REB: 10 (3 off, 7 def), AST: 5, TO: 4
TEAM FOULS: 5 [Team_009 in BONUS]

================================================================================

================================================================================
                       4TH QUARTER - Team_009 vs Team_090                       
================================================================================

[12:00] Team_009 possession (Score: 67-72)
Kyle Brogdon drives and kicks out. Miles Sabonis attempts a Midrange. Contested by Gary Brogdon (3.6 feet, ZONE). MILES SABONIS MAKES IT!
Score: 69-72

[11:45] Team_090 possession (Score: 69-72)
FOUL! Shooting foul on Kyle Brogdon. Tracy Adebayo to the line for 2 free throws. [Team fouls: 1] (Kyle Brogdon: 1 personal fouls)   FT 1/2: MISS   FT 2/2: MISS Tracy Adebayo makes 0/2 from the line. Rebound secured by Cole Mitchell.

[11:29] Team_009 possession (Score: 69-72)
Anfernee Anunoby attempts a Midrange. Contested by Zach Wall (5.0 feet, ZONE). Anfernee Anunoby misses. Rebound secured by Zach Wall.

[11:16] Team_090 possession (Score: 69-72)
Derrick Mitchell attempts a Midrange. Contested by Anfernee Anunoby (5.6 feet, ZONE). Derrick Mitchell misses. Rebound secured by Kyle Brogdon.

[11:05] Team_009 possession (Score: 69-72)
Anfernee Anunoby attempts a 3Pt. Contested by Zach Wall (5.1 feet, MAN). Anfernee Anunoby misses. Rebound secured by Gary Brogdon.

[10:48] Team_090 possession (Score: 69-72)
Tracy Adebayo drives, Kyle Brogdon stays with him. Tracy Adebayo attempts a Dunk. Contested by Kyle Brogdon (5.0 feet, ZONE). TRACY ADEBAYO MAKES IT!
Score: 69-74

[10:34] Team_009 possession (Score: 69-74)
Cole Mitchell drives, Gary Brogdon stays with him. Cole Mitchell attempts a Dunk. Contested by Gary Brogdon (3.6 feet, MAN). Cole Mitchell misses. Rebound secured by Gary Brogdon.

[10:17] Team_090 possession (Score: 69-74)
Gary Brogdon attempts a 3Pt. Contested by Miles Sabonis (5.8 feet, ZONE). Gary Brogdon misses. Offensive rebound by Gary Brogdon! Gary Brogdon kicks it out.

[10:06] Team_090 possession (Score: 69-74)
Tracy Adebayo drives and kicks out. Tracy Adebayo attempts a Midrange. Contested by Anfernee Anunoby (5.4 feet, ZONE). Tracy Adebayo misses. Rebound secured by Kyle Brogdon.

[09:54] Team_009 possession (Score: 69-74)
FOUL! Shooting foul on Gary Brogdon. Kyle Brogdon to the line for 2 free throws. [Team fouls: 1] (Gary Brogdon: 1 personal fouls)   FT 1/2: GOOD   FT 2/2: MISS Kyle Brogdon makes 1/2 from the line. Rebound secured by Gary Brogdon.
Score: 70-74

[09:35] Team_090 possession (Score: 70-74)
Tracy Adebayo drives and kicks out. Larry Bridges attempts a 3Pt. Contested by Desmond Harden (5.3 feet, MAN). Larry Bridges misses. Rebound secured by Anfernee Anunoby.

[09:20] Team_009 possession (Score: 70-74)
Anfernee Anunoby attempts a 3Pt. Contested by Zach Wall (5.2 feet, MAN). Anfernee Anunoby misses. Rebound secured by Zach Wall.

[09:08] Team_090 possession (Score: 70-74)
FOUL! Shooting foul on Kyle Brogdon. Derrick Mitchell to the line for 2 free throws. [Team fouls: 2] (Kyle Brogdon: 2 personal fouls)   FT 1/2: GOOD   FT 2/2: GOOD Derrick Mitchell makes 2/2 from the line.
Score: 70-76

[08:56] Team_009 possession (Score: 70-76)
Miles Sabonis attempts a Midrange. Contested by Larry Bridges (5.0 feet, ZONE). MILES SABONIS MAKES IT! Assist: Desmond Harden
Score: 72-76

[08:39] Team_090 possession (Score: 72-76)
Zach Wall attempts a 3Pt. Contested by Miles Sabonis (6.0 feet, ZONE). Zach Wall misses. Rebound secured by Kyle Brogdon.

[08:26] Team_009 possession (Score: 72-76)
Miles Sabonis loses the ball! Stripped by Derrick Mitchell! TURNOVER! (live ball)

[08:11] Team_090 possession (Score: 72-76)
Larry Bridges drives and kicks out. Gary Brogdon attempts a Midrange. Contested by Cole Mitchell (5.2 feet, MAN). Gary Brogdon misses. Offensive rebound by Gary Brogdon! Gary Brogdon kicks it out.

[07:56] Team_090 possession (Score: 72-76)
Zach Wall attempts a 3Pt. Wide open! Miles Sabonis is 6.0 feet away. [ZONE] Zach Wall misses. Rebound secured by Anfernee Anunoby.

[07:40] Team_009 possession (Score: 72-76)
Desmond Harden attempts a Layup. Contested by Gary Brogdon (4.1 feet, ZONE). Desmond Harden misses. Offensive rebound by Kyle Brogdon! Kyle Brogdon kicks it out.

[07:26] Team_009 possession (Score: 72-76)
Desmond Harden attempts a 3Pt. Contested by Derrick Mitchell (3.8 feet, ZONE). DESMOND HARDEN MAKES IT! Assist: Miles Sabonis
Score: 75-76

[07:10] Team_090 possession (Score: 75-76)
Larry Bridges attempts a Layup. BLOCKED BY DESMOND HARDEN! Ball is loose! Rebound secured by Kyle Brogdon.

[06:58] Team_009 possession (Score: 75-76)
Anfernee Anunoby drives to the basket... Anfernee Anunoby throws a bad pass out of bounds! TURNOVER! (dead ball)

[06:58] Substitution (Team_009): Miles Sabonis OUT → Paul Trent IN (stamina_rule2)

[06:58] Substitution (Team_009): Desmond Harden OUT → Evan Curry IN (stamina_rule2)

[06:58] Substitution (Team_009): Anfernee Anunoby OUT → RJ Jokic IN (stamina_rule2)

[06:58] Substitution (Team_009): Cole Mitchell OUT → Kawhi Herro IN (stamina_rule2)

[06:58] Substitution (Team_009): Kyle Brogdon OUT → Shaquille Green IN (stamina_rule2)

[06:58] Substitution (Team_090): Derrick Mitchell OUT → OG Anunoby IN (stamina_rule2)

[06:58] Substitution (Team_090): Larry Bridges OUT → Josh Wall IN (stamina_rule2)

[06:58] Substitution (Team_090): Zach Wall OUT → Russell Smith IN (stamina_rule2)

[06:58] Substitution (Team_090): Gary Brogdon OUT → Derrick Nowitzki IN (stamina_rule2)

[06:58] Substitution (Team_090): Tracy Adebayo OUT → Tobias Tatum IN (stamina_rule2)

[06:43] Team_090 possession (Score: 75-76)
Josh Wall attempts a Midrange. Contested by Evan Curry (5.7 feet, MAN). Josh Wall misses. Rebound secured by Shaquille Green.

[06:27] Team_009 possession (Score: 75-76)
Shaquille Green drives, picks up Derrick Nowitzki. Help arrives from Josh Wall! Shaquille Green attempts a Dunk. Contested by Josh Wall (4.5 feet, ZONE). Shaquille Green misses. Rebound secured by Derrick Nowitzki.

[06:16] Team_090 possession (Score: 75-76)
Tobias Tatum attempts a Midrange. Contested by Shaquille Green (5.5 feet, MAN). TOBIAS TATUM MAKES IT! Assist: Russell Smith
Score: 75-78

[06:02] Team_009 possession (Score: 75-78)
RJ Jokic attempts a 3Pt. Contested by Russell Smith (4.1 feet, ZONE). RJ Jokic misses. Rebound secured by Russell Smith.

[05:51] Team_090 possession (Score: 75-78)
Derrick Nowitzki attempts a Layup. Contested by Kawhi Herro (3.2 feet, MAN). DERRICK NOWITZKI MAKES IT!
Score: 75-80

[05:34] Team_009 possession (Score: 75-80)
Paul Trent attempts a 3Pt. Contested by Russell Smith (3.6 feet, ZONE). Paul Trent misses. Rebound secured by Russell Smith.

[05:23] Team_090 possession (Score: 75-80)
Josh Wall drives and kicks out. Derrick Nowitzki attempts a 3Pt. Contested by Kawhi Herro (3.6 feet, MAN). Derrick Nowitzki misses. Rebound secured by Shaquille Green.

[05:05] Team_009 possession (Score: 75-80)
Paul Trent attempts a Midrange. Contested by OG Anunoby (4.3 feet, MAN). PAUL TRENT MAKES IT!
Score: 77-80

[04:52] Team_090 possession (Score: 77-80)
Russell Smith attempts a Midrange. Contested by RJ Jokic (4.7 feet, MAN). RUSSELL SMITH MAKES IT!
Score: 77-82

[04:35] Team_009 possession (Score: 77-82)
Kawhi Herro attempts a 3Pt. Contested by Russell Smith (4.5 feet, ZONE). KAWHI HERRO MAKES IT! Assist: Paul Trent
Score: 80-82

[04:24] Team_090 possession (Score: 80-82)
Tobias Tatum makes the Dunk and draws the foul on Shaquille Green! And-1! Tobias Tatum to the line for 1. [Team fouls: 3] (Shaquille Green: 1 personal fouls)   FT 1/1: GOOD Tobias Tatum makes 1/1 from the line.
Score: 80-85

[04:10] Team_009 possession (Score: 80-85)
RJ Jokic attempts a 3Pt. Contested by Russell Smith (4.1 feet, MAN). RJ Jokic misses. Rebound secured by Tobias Tatum.

[03:56] Team_090 possession (Score: 80-85)
Josh Wall attempts a 3Pt. Wide open! Paul Trent is 6.0 feet away. [ZONE] JOSH WALL MAKES IT! Assist: Tobias Tatum
Score: 80-88

[03:38] Team_009 possession (Score: 80-88)
Shaquille Green attempts a Midrange. Contested by Tobias Tatum (4.8 feet, MAN). SHAQUILLE GREEN MAKES IT!
Score: 82-88

[03:23] Team_090 possession (Score: 82-88)
Josh Wall drives and kicks out. Derrick Nowitzki attempts a 3Pt. Contested by Paul Trent (5.6 feet, ZONE). DERRICK NOWITZKI MAKES IT! Assist: OG Anunoby
Score: 82-91

[03:11] Team_009 possession (Score: 82-91)
RJ Jokic attempts a 3Pt. Contested by Russell Smith (4.1 feet, ZONE). RJ JOKIC MAKES IT! Assist: Paul Trent
Score: 85-91

[02:55] Team_090 possession (Score: 85-91)
Russell Smith attempts a 3Pt. Contested by RJ Jokic (4.7 feet, MAN). Russell Smith misses. Rebound secured by RJ Jokic.

[02:39] Team_009 possession (Score: 85-91)
Paul Trent drives and kicks out. Paul Trent attempts a 3Pt. Contested by Josh Wall (4.1 feet, ZONE). PAUL TRENT MAKES IT! Assist: Shaquille Green
Score: 88-91

[02:24] Team_090 possession (Score: 88-91)
FOUL! Offensive foul on Tobias Tatum! Shaquille Green drew the charge! [Team fouls: 2] (Tobias Tatum: 1 personal fouls) TURNOVER! (dead ball)

[02:10] Team_009 possession (Score: 88-91)
FOUL! Holding foul on Tobias Tatum. [Team fouls: 3] No free throws, side out. (Tobias Tatum: 2 personal fouls)

[01:56] Team_009 possession (Score: 88-91)
Shaquille Green drives and kicks out. Kawhi Herro attempts a Midrange. Contested by Derrick Nowitzki (4.4 feet, MAN). KAWHI HERRO MAKES IT! Assist: RJ Jokic
Score: 90-91

[01:36] Team_090 possession (Score: 90-91)
Russell Smith attempts a 3Pt. Contested by RJ Jokic (4.7 feet, MAN). RUSSELL SMITH MAKES IT! Assist: OG Anunoby
Score: 90-94

[01:19] Team_009 possession (Score: 90-94)
FOUL! Holding foul on Josh Wall. [Team fouls: 4] No free throws, side out. (Josh Wall: 1 personal fouls)

[01:04] Team_009 possession (Score: 90-94)
FOUL! Shooting foul on Derrick Nowitzki. Kawhi Herro to the line for 2 free throws. [BONUS: 5 team fouls] (Derrick Nowitzki: 1 personal fouls)   FT 1/2: GOOD   FT 2/2: GOOD Kawhi Herro makes 2/2 from the line.
Score: 92-94

[00:46] Team_090 possession (Score: 92-94)
Tobias Tatum attempts a Layup. Contested by Shaquille Green (5.5 feet, MAN). TOBIAS TATUM MAKES IT! Assist: OG Anunoby
Score: 92-96

[00:33] Team_009 possession (Score: 92-96)
RJ Jokic makes the 3Pt and draws the foul on Russell Smith! And-1! RJ Jokic to the line for 1. [BONUS: 6 team fouls] (Russell Smith: 1 personal fouls)   FT 1/1: GOOD RJ Jokic makes 1/1 from the line.
Score: 96-96

[00:18] Team_090 possession (Score: 96-96)
Tobias Tatum attempts a 3Pt. Contested by Shaquille Green (5.5 feet, MAN). Tobias Tatum misses. Offensive rebound by Tobias Tatum! Tobias Tatum kicks it out.

[00:03] Team_090 possession (Score: 96-96)
Russell Smith attempts a 3Pt. Contested by Paul Trent (5.9 feet, ZONE). Russell Smith misses. Rebound secured by Shaquille Green.

================================================================================
                              4TH QUARTER COMPLETE                              
================================================================================

4TH QUARTER SCORE: Team_009 29, Team_090 24

BOX SCORE:
================================================================================

Team_009
--------------------------------------------------------------------------------
Player                MIN  PTS  REB  AST  TO      FG   FG%      3P   3P%
--------------------------------------------------------------------------------
RJ Jokic               14    7    1    1   0   2/4    50.0     0/0   0.0
Kawhi Herro            14    7    0    0   0   3/3   100.0     0/0   0.0
Paul Trent             14    5    0    2   0   2/3    66.7     0/0   0.0
Miles Sabonis          35    4    0    1   0   2/2   100.0     0/0   0.0
Desmond Harden         35    3    0    1   0   1/1   100.0     0/0   0.0
Shaquille Green        14    2    3    1   0   1/2    50.0     0/0   0.0
Cole Mitchell          35    0    1    0   0   0/1     0.0     0/0   0.0
Anfernee Anunoby       35    0    2    0   0   0/3     0.0     0/0   0.0
Kyle Brogdon           35    0    5    0   0   0/1     0.0     0/0   0.0

TEAM: FG: 11/20 (55.0%), 3PT: 4/9 (44.4%), REB: 12 (1 off, 11 def), AST: 6, TO: 2
TEAM FOULS: 3


Team_090
--------------------------------------------------------------------------------
Player                MIN  PTS  REB  AST  TO      FG   FG%      3P   3P%
--------------------------------------------------------------------------------
Tobias Tatum           14    7    2    1   0   3/3   100.0     0/0   0.0
Derrick Nowitzki       16    5    1    0   0   2/2   100.0     0/0   0.0
Russell Smith          14    5    2    1   0   2/4    50.0     0/0   0.0
Josh Wall              14    3    0    0   0   1/3    33.3     0/0   0.0
Tracy Adebayo          35    2    0    0   0   1/4    25.0     0/0   0.0
Derrick Mitchell       35    2    0    0   0   1/2    50.0     0/0   0.0
Zach Wall              35    0    2    0   0   0/2     0.0     0/0   0.0
Gary Brogdon           32    0    5    0   0   0/0     0.0     0/0   0.0
Larry Bridges          35    0    0    0   0   0/1     0.0     0/0   0.0
OG Anunoby             14    0    0    3   0   0/0     0.0     0/0   0.0

TEAM: FG: 10/21 (47.6%), 3PT: 2/6 (33.3%), REB: 12 (3 off, 9 def), AST: 5, TO: 1
TEAM FOULS: 6 [Team_009 in BONUS]

================================================================================

================================================================================
                               FULL GAME COMPLETE                               
================================================================================

FINAL SCORE: Team_009 96, Team_090 96

SCORING BY QUARTER:
--------------------------------------------------------------------------------
Team                     Q1     Q2     Q3     Q4    FINAL
--------------------------------------------------------------------------------
Team_009                 12     23     32     29       96
Team_090                 25     24     23     24       96
--------------------------------------------------------------------------------

FULL GAME BOX SCORE:
================================================================================

Team_009
--------------------------------------------------------------------------------
Player                MIN  PTS  REB  AST  TO      FG   FG%      3P   3P%      FT STL BLK
--------------------------------------------------------------------------------
Miles Sabonis          35    9    0    4   1   2/6    33.3   1/3    33.3   2/3     1   2
Desmond Harden         35   14    0    1   0   5/13   38.5   2/6    33.3   2/2     0   2
Anfernee Anunoby       35   13    4    3   2   5/15   33.3   1/7    14.3   3/3     1   0
Cole Mitchell          35    2   12    1   0   2/12   16.7   1/3    33.3   0/1     1   0
Kyle Brogdon           35   16   15    2   0   9/14   64.3   0/0     0.0   4/6     2   0
Paul Trent             14   14    0    2   0   4/7    57.1   1/3    33.3   1/1     0   0
Evan Curry             14    3    0    1   0   1/3    33.3   1/1   100.0   0/0     0   0
RJ Jokic               14    7    3    3   1   2/5    40.0   2/5    40.0   1/1     0   0
Kawhi Herro            14   10    4    0   0   3/3   100.0   1/1   100.0   3/3     1   0
Shaquille Green        14    4    6    2   0   4/7    57.1   0/0     0.0   0/0     0   0

TEAM: FG: 37/85 (43.5%), 3PT: 10/29 (34.5%), REB: 45 (9 off, 36 def), AST: 19, TO: 4


Team_090
--------------------------------------------------------------------------------
Player                MIN  PTS  REB  AST  TO      FG   FG%      3P   3P%      FT STL BLK
--------------------------------------------------------------------------------
Derrick Mitchell       35   13    0    5   3   5/11   45.5   3/5    60.0   3/4     1   0
Larry Bridges          35   14    0    2   1   5/9    55.6   3/5    60.0   2/3     0   2
Zach Wall              35    3   12    5   2   1/6    16.7   1/5    20.0   0/0     1   0
Tracy Adebayo          35   18   10    2   3   9/15   60.0   0/1     0.0   0/2     0   1
Gary Brogdon           32    9   21    1   2   4/7    57.1   0/2     0.0   1/1     0   2
Derrick Nowitzki       16   10    6    0   0   3/7    42.9   1/3    33.3   0/1     0   0
OG Anunoby             14    2    0    4   0   1/1   100.0   0/0     0.0   0/0     0   0
Josh Wall              14    6    0    0   1   3/7    42.9   2/4    50.0   3/3     0   0
Russell Smith          14   10    3    1   0   4/9    44.4   2/5    40.0   2/2     0   0
Tobias Tatum           14    7    4    1   1   3/3   100.0   0/0     0.0   1/1     0   0

TEAM: FG: 38/75 (50.7%), 3PT: 12/30 (40.0%), REB: 55 (8 off, 47 def), AST: 21, TO: 13

================================================================================
