================================================================================
                        FULL GAME - Team_012 vs Team_042                        
================================================================================

================================================================================
                       1ST QUARTER - Team_012 vs Team_042                       
================================================================================

[12:00] Team_012 possession (Score: 0-0)
Pascal Herro attempts a Midrange. Contested by Kristaps Parker (5.5 feet, ZONE). PASCAL HERRO MAKES IT!
Score: 2-0

[11:44] Team_042 possession (Score: 2-0)
Jarrett Sabonis attempts a Layup. Contested by Shaquille Booker (4.4 feet, MAN). JARRETT SABONIS MAKES IT!
Score: 2-2

[11:29] Team_012 possession (Score: 2-2)
Pascal Herro attempts a Layup. Contested by Tyler Barrett (3.9 feet, MAN). Pascal Herro misses. Rebound secured by Tyler Barrett.

[11:15] Team_042 possession (Score: 2-2)
Jarrett Sabonis drives and kicks out. Kristaps Parker attempts a 3Pt. Contested by RJ Nowitzki (3.4 feet, MAN). Kristaps Parker misses. Rebound secured by Paolo Durant.

[10:55] Team_012 possession (Score: 2-2)
Ayo McGrady drives to the basket... Ayo McGrady commits a violation (traveling/carry)! TURNOVER! (dead ball)

[10:36] Team_042 possession (Score: 2-2)
Jarrett Sabonis attempts a 3Pt. Contested by Shaquille Booker (4.4 feet, MAN). Jarrett Sabonis misses. Rebound secured by Ayo McGrady.

[10:21] Team_012 possession (Score: 2-2)
Ayo McGrady attempts a Midrange. Contested by Dejounte Butler (3.5 feet, ZONE). AYO MCGRADY MAKES IT! Assist: RJ Nowitzki
Score: 4-2

[10:08] Team_042 possession (Score: 4-2)
Tyler Barrett attempts a 3Pt. Contested by RJ Nowitzki (3.9 feet, ZONE). Tyler Barrett misses. Rebound secured by RJ Nowitzki.

[09:55] Team_012 possession (Score: 4-2)
Paolo Durant drives, Dejounte Butler stays with him. Paolo Durant attempts a Dunk. Contested by Dejounte Butler (3.7 feet, MAN). PAOLO DURANT MAKES IT! Assist: RJ Nowitzki
Score: 6-2

[09:45] Team_042 possession (Score: 6-2)
Jarrett Sabonis attempts a Midrange. Contested by Paolo Durant (4.0 feet, ZONE). JARRETT SABONIS MAKES IT! Assist: Tyler Barrett
Score: 6-4

[09:29] Team_012 possession (Score: 6-4)
Pascal Herro attempts a 3Pt. Contested by Tyler Barrett (3.9 feet, MAN). PASCAL HERRO MAKES IT! Assist: Shaquille Booker
Score: 9-4

[09:18] Team_042 possession (Score: 9-4)
Jarrett Sabonis attempts a Layup. Contested by Shaquille Booker (4.4 feet, MAN). Jarrett Sabonis misses. Offensive rebound by Cade Dosunmu! Cade Dosunmu puts it back in!
Score: 9-6

[09:07] Team_012 possession (Score: 9-6)
Paolo Durant attempts a Midrange. Contested by Dejounte Butler (3.7 feet, MAN). Paolo Durant misses. Rebound secured by Dejounte Butler.

[08:54] Team_042 possession (Score: 9-6)
Jarrett Sabonis drives, Paolo Durant stays with him. Jarrett Sabonis attempts a Dunk. Contested by Paolo Durant (4.0 feet, ZONE). Jarrett Sabonis misses. Rebound secured by Paolo Durant.

[08:42] Team_012 possession (Score: 9-6)
Shaquille Booker attempts a Layup. BLOCKED BY TYLER BARRETT! Ball is loose! Rebound secured by Tyler Barrett.

[08:26] Team_042 possession (Score: 9-6)
FOUL! Shooting foul on Pascal Herro. Tyler Barrett to the line for 2 free throws. [Team fouls: 1] (Pascal Herro: 1 personal fouls)   FT 1/2: GOOD   FT 2/2: GOOD Tyler Barrett makes 2/2 from the line.
Score: 9-8

[08:10] Team_012 possession (Score: 9-8)
Paolo Durant attempts a Layup. BLOCKED BY TYLER BARRETT! Ball is loose! Rebound secured by Tyler Barrett.

[07:54] Team_042 possession (Score: 9-8)
Cade Dosunmu drives and kicks out. Cade Dosunmu attempts a 3Pt. Contested by RJ Nowitzki (3.4 feet, ZONE). Cade Dosunmu misses. Rebound secured by Ayo McGrady.

[07:40] Team_012 possession (Score: 9-8)
Shaquille Booker attempts a Layup. Contested by Jarrett Sabonis (3.8 feet, MAN). SHAQUILLE BOOKER MAKES IT! Assist: RJ Nowitzki
Score: 11-8

[07:22] Team_042 possession (Score: 11-8)
Jarrett Sabonis attempts a 3Pt. Contested by Shaquille Booker (4.4 feet, MAN). Jarrett Sabonis misses. Offensive rebound by Cade Dosunmu! Cade Dosunmu's putback is no good. Rebound secured by Paolo Durant.

[07:10] Team_012 possession (Score: 11-8)
Ayo McGrady drives to the basket... Ayo McGrady commits a violation (traveling/carry)! TURNOVER! (dead ball)

[06:55] Team_042 possession (Score: 11-8)
Kristaps Parker attempts a 3Pt. Contested by RJ Nowitzki (3.3 feet, MAN). Kristaps Parker misses. Rebound secured by Ayo McGrady.

[06:36] Team_012 possession (Score: 11-8)
Ayo McGrady throws a bad pass! Stolen by Cade Dosunmu! TURNOVER! (live ball)

[06:19] Team_042 possession (Score: 11-8)
Kristaps Parker attempts a 3Pt. Contested by RJ Nowitzki (3.3 feet, ZONE). KRISTAPS PARKER MAKES IT! Assist: Jarrett Sabonis
Score: 11-11

[06:08] Team_012 possession (Score: 11-11)
Pascal Herro attempts a 3Pt. Contested by Kristaps Parker (5.5 feet, ZONE). PASCAL HERRO MAKES IT! Assist: RJ Nowitzki
Score: 14-11

[05:49] Team_042 possession (Score: 14-11)
FOUL! Reach-in foul on RJ Nowitzki during the drive. [Team fouls: 2] No free throws, side out. (RJ Nowitzki: 1 personal fouls)

[05:35] Team_042 possession (Score: 14-11)
Jarrett Sabonis attempts a 3Pt. Contested by Shaquille Booker (4.4 feet, MAN). JARRETT SABONIS MAKES IT! Assist: Cade Dosunmu
Score: 14-14

[05:21] Team_012 possession (Score: 14-14)
FOUL! Shooting foul on Cade Dosunmu. Ayo McGrady to the line for 2 free throws. [Team fouls: 1] (Cade Dosunmu: 1 personal fouls)   FT 1/2: GOOD   FT 2/2: GOOD Ayo McGrady makes 2/2 from the line.
Score: 16-14

[05:07] Team_042 possession (Score: 16-14)
FOUL! Shooting foul on Pascal Herro. Kristaps Parker to the line for 2 free throws. [Team fouls: 3] (Pascal Herro: 2 personal fouls)   FT 1/2: GOOD   FT 2/2: MISS Kristaps Parker makes 1/2 from the line. Rebound secured by Paolo Durant.
Score: 16-15

[04:50] Team_012 possession (Score: 16-15)
Paolo Durant drives and kicks out. Pascal Herro attempts a 3Pt. Contested by Tyler Barrett (3.4 feet, ZONE). Pascal Herro misses. Rebound secured by Dejounte Butler.

[04:33] Team_042 possession (Score: 16-15)
Tyler Barrett drives and kicks out. Cade Dosunmu attempts a Midrange. Contested by Ayo McGrady (4.3 feet, ZONE). Cade Dosunmu misses. Rebound secured by Ayo McGrady.

[04:19] Team_012 possession (Score: 16-15)
Ayo McGrady drives and kicks out. Shaquille Booker attempts a 3Pt. Contested by Tyler Barrett (3.4 feet, ZONE). Shaquille Booker misses. Rebound secured by Tyler Barrett.

[04:05] Team_042 possession (Score: 16-15)
FOUL! Shooting foul on RJ Nowitzki. Jarrett Sabonis to the line for 2 free throws. [Team fouls: 4] (RJ Nowitzki: 2 personal fouls)   FT 1/2: GOOD   FT 2/2: MISS Jarrett Sabonis makes 1/2 from the line. Rebound secured by Ayo McGrady.
Score: 16-16

[03:49] Team_012 possession (Score: 16-16)
RJ Nowitzki drives, picks up Kristaps Parker. Help arrives from Tyler Barrett! RJ Nowitzki attempts a Layup. Contested by Tyler Barrett (5.4 feet, MAN). RJ NOWITZKI MAKES IT! Assist: Ayo McGrady
Score: 18-16

[03:36] Team_042 possession (Score: 18-16)
Cade Dosunmu drives, Ayo McGrady stays with him. Cade Dosunmu attempts a Dunk. Contested by Ayo McGrady (4.6 feet, MAN). Cade Dosunmu misses. Rebound secured by Paolo Durant.

[03:24] Team_012 possession (Score: 18-16)
Ayo McGrady attempts a 3Pt. Contested by Cade Dosunmu (4.1 feet, MAN). Ayo McGrady misses. Rebound secured by Dejounte Butler.

[03:08] Team_042 possession (Score: 18-16)
FOUL! Reach-in foul on RJ Nowitzki during the drive. [IN THE BONUS! 5 team fouls] Kristaps Parker to the line for 2 free throws. (RJ Nowitzki: 3 personal fouls)   FT 1/2: GOOD   FT 2/2: GOOD Kristaps Parker makes 2/2 from the line.
Score: 18-18

[02:57] Team_012 possession (Score: 18-18)
RJ Nowitzki drives and kicks out. Shaquille Booker attempts a 3Pt. Contested by Jarrett Sabonis (4.1 feet, MAN). Shaquille Booker misses. Rebound secured by Dejounte Butler.

[02:48] Team_042 possession (Score: 18-18)
Kristaps Parker drives to the basket... Kristaps Parker loses control! Ball rolls out of bounds! TURNOVER! (dead ball)

[02:48] Substitution (Team_012): Pascal Herro OUT → Desmond Irving IN (stamina_rule2)

[02:48] Substitution (Team_042): Cade Dosunmu OUT → Lamelo Stewart IN (stamina_rule2)

[02:35] Team_012 possession (Score: 18-18)
Desmond Irving drives and kicks out. Desmond Irving attempts a 3Pt. Contested by Tyler Barrett (3.7 feet, ZONE). Desmond Irving misses. Rebound secured by Dejounte Butler.

[02:16] Team_042 possession (Score: 18-18)
FOUL! Holding foul on Desmond Irving. [IN THE BONUS! 6 team fouls] Tyler Barrett to the line for 2 free throws. (Desmond Irving: 1 personal fouls)   FT 1/2: GOOD   FT 2/2: GOOD Tyler Barrett makes 2/2 from the line.
Score: 18-20

[02:01] Team_012 possession (Score: 18-20)
FOUL! Reach-in foul on Dejounte Butler during the drive. [Team fouls: 2] No free throws, side out. (Dejounte Butler: 1 personal fouls)

[01:46] Team_012 possession (Score: 18-20)
FOUL! Shooting foul on Kristaps Parker. RJ Nowitzki to the line for 2 free throws. [Team fouls: 3] (Kristaps Parker: 1 personal fouls)   FT 1/2: GOOD   FT 2/2: GOOD RJ Nowitzki makes 2/2 from the line.
Score: 20-20

[01:29] Team_042 possession (Score: 20-20)
Lamelo Stewart attempts a Midrange. Contested by Ayo McGrady (4.6 feet, MAN). LAMELO STEWART MAKES IT! Assist: Tyler Barrett
Score: 20-22

[01:12] Team_012 possession (Score: 20-22)
RJ Nowitzki makes the Midrange and draws the foul on Kristaps Parker! And-1! RJ Nowitzki to the line for 1. [Team fouls: 4] (Kristaps Parker: 2 personal fouls)   FT 1/1: GOOD RJ Nowitzki makes 1/1 from the line.
Score: 23-22

[00:58] Team_042 possession (Score: 23-22)
Dejounte Butler makes the Dunk and draws the foul on Paolo Durant! And-1! Dejounte Butler to the line for 1. [BONUS: 7 team fouls] (Paolo Durant: 1 personal fouls)   FT 1/1: MISS Dejounte Butler makes 0/1 from the line. Rebound secured by Paolo Durant.
Score: 23-24

[00:41] Team_012 possession (Score: 23-24)
Shaquille Booker attempts a 3Pt. Contested by Jarrett Sabonis (4.3 feet, MAN). SHAQUILLE BOOKER MAKES IT! Assist: Ayo McGrady
Score: 26-24

[00:26] Team_042 possession (Score: 26-24)
FOUL! Holding foul on Ayo McGrady. [IN THE BONUS! 8 team fouls] Lamelo Stewart to the line for 2 free throws. (Ayo McGrady: 1 personal fouls)   FT 1/2: GOOD   FT 2/2: MISS Lamelo Stewart makes 1/2 from the line. Rebound secured by Ayo McGrady.
Score: 26-25

[00:10] Team_012 possession (Score: 26-25)
Desmond Irving attempts a 3Pt. Contested by Tyler Barrett (4.1 feet, MAN). Desmond Irving misses. Rebound secured by Tyler Barrett.

================================================================================
                              1ST QUARTER COMPLETE                              
================================================================================

1ST QUARTER SCORE: Team_012 26, Team_042 25

BOX SCORE:
================================================================================

Team_012
--------------------------------------------------------------------------------
Player                MIN  PTS  REB  AST  TO      FG   FG%      3P   3P%
--------------------------------------------------------------------------------
Pascal Herro            9    8    0    0   0   3/4    75.0     0/0   0.0
RJ Nowitzki            12    7    1    4   0   3/4    75.0     0/0   0.0
Shaquille Booker       12    5    0    1   0   2/3    66.7     0/0   0.0
Ayo McGrady            12    4    6    2   0   2/4    50.0     0/0   0.0
Paolo Durant           12    2    6    0   0   1/4    25.0     0/0   0.0
Desmond Irving          3    0    0    0   0   0/2     0.0     0/0   0.0

TEAM: FG: 11/21 (52.4%), 3PT: 3/5 (60.0%), REB: 12 (0 off, 12 def), AST: 7, TO: 3
TEAM FOULS: 8 [Team_042 in BONUS]


Team_042
--------------------------------------------------------------------------------
Player                MIN  PTS  REB  AST  TO      FG   FG%      3P   3P%
--------------------------------------------------------------------------------
Jarrett Sabonis        12    7    0    1   0   3/8    37.5     0/0   0.0
Kristaps Parker        12    5    0    0   0   2/4    50.0     0/0   0.0
Tyler Barrett          12    4    5    2   0   2/4    50.0     0/0   0.0
Cade Dosunmu            9    2    1    1   0   1/3    33.3     0/0   0.0
Lamelo Stewart          3    2    0    0   0   1/1   100.0     0/0   0.0
Dejounte Butler        12    0    5    0   0   0/1     0.0     0/0   0.0

TEAM: FG: 9/22 (40.9%), 3PT: 2/6 (33.3%), REB: 12 (2 off, 10 def), AST: 4, TO: 1
TEAM FOULS: 4

================================================================================

================================================================================
                       2ND QUARTER - Team_012 vs Team_042                       
================================================================================

[12:00] Team_012 possession (Score: 26-25)
Pascal Herro attempts a 3Pt. Contested by Tyler Barrett (4.3 feet, MAN). Pascal Herro misses. Rebound secured by Dejounte Butler.

[11:47] Team_042 possession (Score: 26-25)
FOUL! Shooting foul on Paolo Durant. Dejounte Butler to the line for 2 free throws. [Team fouls: 1] (Paolo Durant: 1 personal fouls)   FT 1/2: GOOD   FT 2/2: GOOD Dejounte Butler makes 2/2 from the line.
Score: 26-27

[11:30] Team_012 possession (Score: 26-27)
Pascal Herro attempts a 3Pt. Contested by Tyler Barrett (4.3 feet, ZONE). PASCAL HERRO MAKES IT! Assist: Ayo McGrady
Score: 29-27

[11:18] Team_042 possession (Score: 29-27)
Jarrett Sabonis attempts a 3Pt. Contested by RJ Nowitzki (4.2 feet, ZONE). Jarrett Sabonis misses. Rebound secured by Paolo Durant.

[11:00] Team_012 possession (Score: 29-27)
Ayo McGrady drives to the basket... FOUL! Offensive foul on Ayo McGrady! Cade Dosunmu drew the charge! [Team fouls: 2] (Ayo McGrady: 1 personal fouls) TURNOVER! (dead ball)

[10:46] Team_042 possession (Score: 29-27)
Jarrett Sabonis attempts a 3Pt. Contested by Shaquille Booker (4.8 feet, MAN). JARRETT SABONIS MAKES IT! Assist: Kristaps Parker
Score: 29-30

[10:30] Team_012 possession (Score: 29-30)
Paolo Durant drives and kicks out. Paolo Durant attempts a Midrange. Contested by Kristaps Parker (5.4 feet, ZONE). Paolo Durant misses. Offensive rebound by RJ Nowitzki! RJ Nowitzki kicks it out.

[10:15] Team_012 possession (Score: 29-30)
Shaquille Booker attempts a 3Pt. Contested by Tyler Barrett (3.8 feet, ZONE). Shaquille Booker misses. Rebound secured by Cade Dosunmu.

[10:02] Team_042 possession (Score: 29-30)
Tyler Barrett attempts a 3Pt. Contested by RJ Nowitzki (4.4 feet, ZONE). Tyler Barrett misses. Rebound secured by Paolo Durant.

[09:46] Team_012 possession (Score: 29-30)
Shaquille Booker attempts a Midrange. Contested by Jarrett Sabonis (4.4 feet, MAN). Shaquille Booker misses. Rebound secured by Cade Dosunmu.

[09:30] Team_042 possession (Score: 29-30)
Cade Dosunmu makes the 3Pt and draws the foul on Paolo Durant! And-1! Cade Dosunmu to the line for 1. [Team fouls: 3] (Paolo Durant: 2 personal fouls)   FT 1/1: GOOD Cade Dosunmu makes 1/1 from the line.
Score: 29-34

[09:15] Team_012 possession (Score: 29-34)
Shaquille Booker drives to the basket... Shaquille Booker throws a bad pass! Stolen by Jarrett Sabonis! TURNOVER! (live ball)

[08:58] Team_042 possession (Score: 29-34)
Kristaps Parker attempts a Layup. Contested by Paolo Durant (4.1 feet, ZONE). KRISTAPS PARKER MAKES IT! Assist: Jarrett Sabonis
Score: 29-36

[08:45] Team_012 possession (Score: 29-36)
Pascal Herro attempts a 3Pt. Contested by Tyler Barrett (4.6 feet, ZONE). Pascal Herro misses. Rebound secured by Tyler Barrett.

[08:32] Team_042 possession (Score: 29-36)
Kristaps Parker drives and kicks out. Kristaps Parker attempts a Midrange. Contested by RJ Nowitzki (4.2 feet, MAN). KRISTAPS PARKER MAKES IT! Assist: Tyler Barrett
Score: 29-38

[08:21] Team_012 possession (Score: 29-38)
Ayo McGrady attempts a Layup. BLOCKED BY CADE DOSUNMU! Ball is loose! Rebound secured by Dejounte Butler.

[08:02] Team_042 possession (Score: 29-38)
Tyler Barrett attempts a 3Pt. Contested by RJ Nowitzki (4.6 feet, ZONE). Tyler Barrett misses. Rebound secured by Ayo McGrady.

[07:48] Team_012 possession (Score: 29-38)
Pascal Herro drives and kicks out. Paolo Durant attempts a 3Pt. Contested by Jarrett Sabonis (4.8 feet, ZONE). Paolo Durant misses. Offensive rebound by RJ Nowitzki! RJ Nowitzki kicks it out.

[07:34] Team_012 possession (Score: 29-38)
RJ Nowitzki drives, Dejounte Butler stays with him. RJ Nowitzki attempts a Layup. Contested by Dejounte Butler (4.7 feet, ZONE). RJ NOWITZKI MAKES IT! Assist: Pascal Herro
Score: 31-38

[07:16] Team_042 possession (Score: 31-38)
Kristaps Parker attempts a 3Pt. Contested by RJ Nowitzki (4.2 feet, ZONE). Kristaps Parker misses. Rebound secured by Paolo Durant.

[07:01] Team_012 possession (Score: 31-38)
Shaquille Booker drives and kicks out. Ayo McGrady attempts a 3Pt. Contested by Tyler Barrett (4.4 feet, ZONE). Ayo McGrady misses. Rebound secured by Tyler Barrett.

[06:50] Team_042 possession (Score: 31-38)
Tyler Barrett attempts a 3Pt. Contested by RJ Nowitzki (4.8 feet, ZONE). Tyler Barrett misses. Offensive rebound by Cade Dosunmu! Cade Dosunmu's putback is no good. Rebound secured by Ayo McGrady.

[06:38] Team_012 possession (Score: 31-38)
Pascal Herro drives to the basket... FOUL! Offensive foul on Pascal Herro! Tyler Barrett drew the charge! [Team fouls: 4] (Pascal Herro: 1 personal fouls) TURNOVER! (dead ball)

[06:26] Team_042 possession (Score: 31-38)
FOUL! Holding foul on Pascal Herro. [IN THE BONUS! 5 team fouls] Tyler Barrett to the line for 2 free throws. (Pascal Herro: 2 personal fouls)   FT 1/2: GOOD   FT 2/2: GOOD Tyler Barrett makes 2/2 from the line.
Score: 31-40

[06:09] Team_012 possession (Score: 31-40)
Paolo Durant makes the Layup and draws the foul on Cade Dosunmu! And-1! Paolo Durant to the line for 1. [Team fouls: 1] (Cade Dosunmu: 1 personal fouls)   FT 1/1: MISS Paolo Durant makes 0/1 from the line. Rebound secured by Cade Dosunmu.
Score: 33-40

[05:59] Team_042 possession (Score: 33-40)
Kristaps Parker attempts a 3Pt. Contested by RJ Nowitzki (4.4 feet, MAN). Kristaps Parker misses. Rebound secured by RJ Nowitzki.

[05:41] Team_012 possession (Score: 33-40)
Shaquille Booker attempts a 3Pt. Contested by Tyler Barrett (4.5 feet, ZONE). Shaquille Booker misses. FOUL! Loose ball foul on Dejounte Butler during the rebound battle. [Team fouls: 2] No free throws, side out. (Dejounte Butler: 1 personal fouls)

[05:22] Team_012 possession (Score: 33-40)
Shaquille Booker attempts a 3Pt. Contested by Tyler Barrett (4.5 feet, ZONE). Shaquille Booker misses. Rebound secured by Dejounte Butler.

[05:05] Team_042 possession (Score: 33-40)
Tyler Barrett attempts a Midrange. Contested by Pascal Herro (5.9 feet, MAN). Tyler Barrett misses. Rebound secured by Paolo Durant.

[04:47] Team_012 possession (Score: 33-40)
Paolo Durant makes the Dunk and draws the foul on Tyler Barrett! And-1! Paolo Durant to the line for 1. [Team fouls: 3] (Tyler Barrett: 1 personal fouls)   FT 1/1: MISS Paolo Durant makes 0/1 from the line. Rebound secured by Cade Dosunmu.
Score: 35-40

[04:30] Team_042 possession (Score: 35-40)
Cade Dosunmu drives, Ayo McGrady stays with him. Cade Dosunmu attempts a Layup. Contested by Ayo McGrady (5.7 feet, ZONE). Cade Dosunmu misses. Rebound secured by RJ Nowitzki.

[04:17] Team_012 possession (Score: 35-40)
RJ Nowitzki attempts a 3Pt. Wide open! Kristaps Parker is 6.3 feet away. [MAN] RJ Nowitzki misses. Rebound secured by Cade Dosunmu.

[04:05] Team_042 possession (Score: 35-40)
Kristaps Parker attempts a 3Pt. Contested by RJ Nowitzki (4.7 feet, ZONE). KRISTAPS PARKER MAKES IT! Assist: Dejounte Butler
Score: 35-43

[03:47] Team_012 possession (Score: 35-43)
Pascal Herro attempts a 3Pt. Contested by Tyler Barrett (5.3 feet, ZONE). Pascal Herro misses. Rebound secured by Cade Dosunmu.

[03:33] Team_042 possession (Score: 35-43)
Tyler Barrett attempts a 3Pt. Contested by RJ Nowitzki (5.2 feet, ZONE). Tyler Barrett misses. Offensive rebound by Cade Dosunmu! Cade Dosunmu puts it back in!
Score: 35-45

[03:15] Team_012 possession (Score: 35-45)
Pascal Herro throws a bad pass! Stolen by Tyler Barrett! TURNOVER! (live ball)

[03:00] Team_042 possession (Score: 35-45)
Cade Dosunmu drives, Paolo Durant stays with him. Cade Dosunmu attempts a Dunk. Contested by Paolo Durant (5.3 feet, ZONE). CADE DOSUNMU MAKES IT! Assist: Tyler Barrett
Score: 35-47

[02:43] Team_012 possession (Score: 35-47)
FOUL! Shooting foul on Dejounte Butler. Ayo McGrady to the line for 3 free throws. [Team fouls: 4] (Dejounte Butler: 2 personal fouls)   FT 1/3: MISS   FT 2/3: GOOD   FT 3/3: GOOD Ayo McGrady makes 2/3 from the line.
Score: 37-47

[02:31] Team_042 possession (Score: 37-47)
Dejounte Butler attempts a Layup. Contested by Paolo Durant (5.3 feet, ZONE). Dejounte Butler misses. Offensive rebound by Cade Dosunmu! Cade Dosunmu puts it back in!
Score: 37-49

[02:17] Team_012 possession (Score: 37-49)
Shaquille Booker attempts a 3Pt. Contested by Dejounte Butler (5.2 feet, ZONE). Shaquille Booker misses. Rebound secured by Tyler Barrett.

[02:02] Team_042 possession (Score: 37-49)
Kristaps Parker attempts a Midrange. Contested by RJ Nowitzki (5.0 feet, MAN). Kristaps Parker misses. Rebound secured by RJ Nowitzki.

[01:46] Team_012 possession (Score: 37-49)
Paolo Durant makes the Layup and draws the foul on Dejounte Butler! And-1! Paolo Durant to the line for 1. [BONUS: 5 team fouls] (Dejounte Butler: 3 personal fouls)   FT 1/1: GOOD Paolo Durant makes 1/1 from the line.
Score: 40-49

[01:35] Team_042 possession (Score: 40-49)
Jarrett Sabonis throws a bad pass! Stolen by Shaquille Booker! TURNOVER! (live ball)

[01:23] Team_012 possession (Score: 40-49)
Pascal Herro drives to the basket... FOUL! Offensive foul on Pascal Herro! Cade Dosunmu drew the charge! [Team fouls: 6] (Pascal Herro: 3 personal fouls) TURNOVER! (dead ball)

[01:04] Team_042 possession (Score: 40-49)
Cade Dosunmu attempts a 3Pt. Contested by RJ Nowitzki (5.5 feet, ZONE). Cade Dosunmu misses. Rebound secured by Paolo Durant.

[00:53] Team_012 possession (Score: 40-49)
Pascal Herro drives and kicks out. Paolo Durant attempts a Midrange. Contested by Dejounte Butler (5.8 feet, MAN). PAOLO DURANT MAKES IT! Assist: Ayo McGrady
Score: 42-49

[00:38] Team_042 possession (Score: 42-49)
Kristaps Parker attempts a Midrange. Contested by RJ Nowitzki (5.3 feet, MAN). KRISTAPS PARKER MAKES IT! Assist: Cade Dosunmu
Score: 42-51

[00:26] Team_012 possession (Score: 42-51)
Shaquille Booker attempts a Layup. Contested by Cade Dosunmu (5.3 feet, ZONE). Shaquille Booker misses. Rebound secured by Tyler Barrett.

[00:13] Team_042 possession (Score: 42-51)
Kristaps Parker attempts a Midrange. Contested by RJ Nowitzki (5.4 feet, MAN). KRISTAPS PARKER MAKES IT! Assist: Tyler Barrett
Score: 42-53

================================================================================
                              2ND QUARTER COMPLETE                              
================================================================================

2ND QUARTER SCORE: Team_012 16, Team_042 28

BOX SCORE:
================================================================================

Team_012
--------------------------------------------------------------------------------
Player                MIN  PTS  REB  AST  TO      FG   FG%      3P   3P%
--------------------------------------------------------------------------------
Paolo Durant           24    5    6    0   0   2/4    50.0     0/0   0.0
Pascal Herro           22    3    0    1   0   1/4    25.0     0/0   0.0
Ayo McGrady            24    2    2    2   0   1/2    50.0     0/0   0.0
RJ Nowitzki            24    2    5    0   0   1/2    50.0     0/0   0.0
Shaquille Booker       24    0    0    0   0   0/6     0.0     0/0   0.0

TEAM: FG: 5/18 (27.8%), 3PT: 2/9 (22.2%), REB: 12 (3 off, 9 def), AST: 3, TO: 5
TEAM FOULS: 6 [Team_042 in BONUS]


Team_042
--------------------------------------------------------------------------------
Player                MIN  PTS  REB  AST  TO      FG   FG%      3P   3P%
--------------------------------------------------------------------------------
Kristaps Parker        24   11    0    1   0   5/8    62.5     0/0   0.0
Cade Dosunmu           22   10    8    1   0   4/6    66.7     0/0   0.0
Jarrett Sabonis        24    3    0    1   0   1/2    50.0     0/0   0.0
Dejounte Butler        24    2    3    1   0   1/1   100.0     0/0   0.0
Tyler Barrett          24    2    4    3   0   1/5    20.0     0/0   0.0

TEAM: FG: 12/22 (54.5%), 3PT: 4/11 (36.4%), REB: 16 (3 off, 13 def), AST: 7, TO: 1
TEAM FOULS: 5 [Team_012 in BONUS]

================================================================================

================================================================================
                       3RD QUARTER - Team_012 vs Team_042                       
================================================================================

[12:00] Team_012 possession (Score: 42-53)
Shaquille Booker attempts a 3Pt. Contested by Jarrett Sabonis (3.8 feet, MAN). SHAQUILLE BOOKER MAKES IT! Assist: Paolo Durant
Score: 45-53

[11:44] Team_042 possession (Score: 45-53)
Cade Dosunmu makes the Layup and draws the foul on Ayo McGrady! And-1! Cade Dosunmu to the line for 1. [Team fouls: 1] (Ayo McGrady: 1 personal fouls)   FT 1/1: GOOD Cade Dosunmu makes 1/1 from the line.
Score: 45-56

[11:28] Team_012 possession (Score: 45-56)
Paolo Durant attempts a Layup. Contested by Dejounte Butler (3.7 feet, MAN). PAOLO DURANT MAKES IT! Assist: RJ Nowitzki
Score: 47-56

[11:13] Team_042 possession (Score: 47-56)
Kristaps Parker attempts a Midrange. Contested by RJ Nowitzki (3.3 feet, MAN). Kristaps Parker misses. Rebound secured by RJ Nowitzki.

[11:00] Team_012 possession (Score: 47-56)
FOUL! Reach-in foul on Cade Dosunmu during the drive. [Team fouls: 1] No free throws, side out. (Cade Dosunmu: 1 personal fouls)

[10:48] Team_012 possession (Score: 47-56)
Paolo Durant throws a bad pass out of bounds! TURNOVER! (dead ball)

[10:37] Team_042 possession (Score: 47-56)
Kristaps Parker attempts a 3Pt. Contested by RJ Nowitzki (3.3 feet, ZONE). Kristaps Parker misses. Offensive rebound by Cade Dosunmu! Cade Dosunmu's putback is no good. Rebound secured by RJ Nowitzki.

[10:20] Team_012 possession (Score: 47-56)
RJ Nowitzki drives and kicks out. Ayo McGrady attempts a 3Pt. Contested by Cade Dosunmu (3.9 feet, MAN). Ayo McGrady misses. Offensive rebound by RJ Nowitzki! RJ Nowitzki kicks it out.

[10:08] Team_012 possession (Score: 47-56)
Pascal Herro attempts a 3Pt. Contested by Tyler Barrett (3.9 feet, ZONE). PASCAL HERRO MAKES IT! Assist: Shaquille Booker
Score: 50-56

[09:53] Team_042 possession (Score: 50-56)
Kristaps Parker loses the ball! Stripped by RJ Nowitzki! TURNOVER! (live ball)

[09:40] Team_012 possession (Score: 50-56)
RJ Nowitzki drives and kicks out. Paolo Durant attempts a 3Pt. Contested by Dejounte Butler (3.6 feet, MAN). Paolo Durant misses. Rebound secured by Dejounte Butler.

[09:22] Team_042 possession (Score: 50-56)
Dejounte Butler attempts a Midrange. Contested by RJ Nowitzki (3.7 feet, ZONE). Dejounte Butler misses. Rebound secured by Ayo McGrady.

[09:05] Team_012 possession (Score: 50-56)
RJ Nowitzki drives, Cade Dosunmu stays with him. RJ Nowitzki attempts a Dunk. Contested by Cade Dosunmu (4.2 feet, ZONE). RJ Nowitzki misses. Rebound secured by Dejounte Butler.

[08:53] Team_042 possession (Score: 50-56)
Jarrett Sabonis attempts a Layup. Contested by Shaquille Booker (4.4 feet, MAN). Jarrett Sabonis misses. Rebound secured by Ayo McGrady.

[08:38] Team_012 possession (Score: 50-56)
Ayo McGrady drives and kicks out. Paolo Durant attempts a Midrange. Contested by Dejounte Butler (3.6 feet, MAN). Paolo Durant misses. Rebound secured by Dejounte Butler.

[08:23] Team_042 possession (Score: 50-56)
Cade Dosunmu attempts a 3Pt. Contested by RJ Nowitzki (3.7 feet, ZONE). Cade Dosunmu misses. Offensive rebound by Cade Dosunmu! Cade Dosunmu's putback is no good. Rebound secured by RJ Nowitzki.

[08:07] Team_012 possession (Score: 50-56)
Ayo McGrady drives, picks up Cade Dosunmu. Help arrives from Tyler Barrett! Ayo McGrady attempts a Layup. Contested by Tyler Barrett (3.9 feet, ZONE). AYO MCGRADY MAKES IT!
Score: 52-56

[07:54] Team_042 possession (Score: 52-56)
Jarrett Sabonis attempts a Layup. BLOCKED BY RJ NOWITZKI! Ball is loose! Rebound secured by RJ Nowitzki.

[07:41] Team_012 possession (Score: 52-56)
RJ Nowitzki drives and kicks out. FOUL! Shooting foul on Cade Dosunmu. Ayo McGrady to the line for 2 free throws. [Team fouls: 2] (Cade Dosunmu: 2 personal fouls)   FT 1/2: GOOD   FT 2/2: GOOD Ayo McGrady makes 2/2 from the line.
Score: 54-56

[07:28] Team_042 possession (Score: 54-56)
FOUL! Reach-in foul on Pascal Herro during the drive. [Team fouls: 2] No free throws, side out. (Pascal Herro: 1 personal fouls)

[07:11] Team_042 possession (Score: 54-56)
Jarrett Sabonis attempts a 3Pt. Contested by RJ Nowitzki (3.8 feet, ZONE). Jarrett Sabonis misses. Rebound secured by Ayo McGrady.

[06:56] Team_012 possession (Score: 54-56)
Shaquille Booker attempts a 3Pt. Contested by Jarrett Sabonis (3.8 feet, MAN). Shaquille Booker misses. Rebound secured by Tyler Barrett.

[06:42] Team_042 possession (Score: 54-56)
Cade Dosunmu attempts a Layup. Contested by Ayo McGrady (4.5 feet, MAN). Cade Dosunmu misses. Rebound secured by Paolo Durant.

[06:27] Team_012 possession (Score: 54-56)
Paolo Durant drives to the basket... FOUL! Offensive foul on Paolo Durant! Cade Dosunmu drew the charge! [Team fouls: 3] (Paolo Durant: 1 personal fouls) TURNOVER! (dead ball)

[06:09] Team_042 possession (Score: 54-56)
Tyler Barrett attempts a 3Pt. Contested by Pascal Herro (5.4 feet, MAN). TYLER BARRETT MAKES IT!
Score: 54-59

[05:54] Team_012 possession (Score: 54-59)
RJ Nowitzki attempts a 3Pt. Contested by Tyler Barrett (3.7 feet, ZONE). RJ Nowitzki misses. Rebound secured by Cade Dosunmu.

[05:41] Team_042 possession (Score: 54-59)
Cade Dosunmu attempts a Midrange. Contested by Ayo McGrady (4.5 feet, MAN). Cade Dosunmu misses. Rebound secured by RJ Nowitzki.

[05:28] Team_012 possession (Score: 54-59)
RJ Nowitzki drives, Kristaps Parker stays with him. RJ Nowitzki attempts a Dunk. Contested by Kristaps Parker (5.3 feet, MAN). RJ Nowitzki misses. Rebound secured by Tyler Barrett.

[05:14] Team_042 possession (Score: 54-59)
Cade Dosunmu drives and kicks out. FOUL! Shooting foul on Pascal Herro. Tyler Barrett to the line for 3 free throws. [Team fouls: 4] (Pascal Herro: 2 personal fouls)   FT 1/3: GOOD   FT 2/3: GOOD   FT 3/3: GOOD Tyler Barrett makes 3/3 from the line.
Score: 54-62

[05:01] Team_012 possession (Score: 54-62)
Pascal Herro throws a bad pass! Stolen by Tyler Barrett! TURNOVER! (live ball)

[04:49] Team_042 possession (Score: 54-62)
Dejounte Butler attempts a Midrange. Contested by RJ Nowitzki (3.7 feet, ZONE). Dejounte Butler misses. Rebound secured by Ayo McGrady.

[04:39] Team_012 possession (Score: 54-62)
Paolo Durant attempts a Layup. BLOCKED BY TYLER BARRETT! Ball is loose! Rebound secured by Cade Dosunmu.

[04:25] Team_042 possession (Score: 54-62)
Dejounte Butler attempts a 3Pt. Contested by Paolo Durant (3.8 feet, MAN). DEJOUNTE BUTLER MAKES IT! Assist: Cade Dosunmu
Score: 54-65

[04:15] Team_012 possession (Score: 54-65)
Pascal Herro attempts a Layup. Contested by Tyler Barrett (4.0 feet, MAN). Pascal Herro misses. FOUL! Loose ball foul on Dejounte Butler during the rebound battle. [Team fouls: 3] No free throws, side out. (Dejounte Butler: 1 personal fouls)

[04:01] Team_012 possession (Score: 54-65)
Shaquille Booker makes the Layup and draws the foul on Cade Dosunmu! And-1! Shaquille Booker to the line for 1. [Team fouls: 4] (Cade Dosunmu: 3 personal fouls)   FT 1/1: GOOD Shaquille Booker makes 1/1 from the line.
Score: 57-65

[03:43] Team_042 possession (Score: 57-65)
Jarrett Sabonis attempts a 3Pt. Contested by RJ Nowitzki (4.0 feet, ZONE). Jarrett Sabonis misses. Rebound secured by Paolo Durant.

[03:29] Team_012 possession (Score: 57-65)
Paolo Durant makes the Midrange and draws the foul on Dejounte Butler! And-1! Paolo Durant to the line for 1. [BONUS: 5 team fouls] (Dejounte Butler: 2 personal fouls)   FT 1/1: GOOD Paolo Durant makes 1/1 from the line.
Score: 60-65

[03:15] Team_042 possession (Score: 60-65)
Kristaps Parker drives to the basket... Kristaps Parker throws a bad pass! Stolen by Paolo Durant! TURNOVER! (live ball)

[03:05] Team_012 possession (Score: 60-65)
Ayo McGrady drives to the basket... Ayo McGrady throws a bad pass! Stolen by Cade Dosunmu! TURNOVER! (live ball)

[02:50] Team_042 possession (Score: 60-65)
Tyler Barrett attempts a 3Pt. Contested by Pascal Herro (5.6 feet, ZONE). Tyler Barrett misses. Rebound secured by Ayo McGrady.

[02:35] Team_012 possession (Score: 60-65)
RJ Nowitzki loses control! Ball rolls out of bounds! TURNOVER! (dead ball)

[02:35] Substitution (Team_012): Pascal Herro OUT → Desmond Irving IN (stamina_rule2)

[02:35] Substitution (Team_012): RJ Nowitzki OUT → Jalen Barnes IN (stamina_rule2)

[02:35] Substitution (Team_012): Shaquille Booker OUT → Domantas Bird IN (stamina_rule2)

[02:35] Substitution (Team_012): Paolo Durant OUT → Jimmy Quickley IN (stamina_rule2)

[02:35] Substitution (Team_012): Ayo McGrady OUT → Karl Young IN (stamina_rule2)

[02:35] Substitution (Team_042): Tyler Barrett OUT → Khris George IN (stamina_rule2)

[02:35] Substitution (Team_042): Kristaps Parker OUT → Isaiah Randle IN (stamina_rule2)

[02:35] Substitution (Team_042): Jarrett Sabonis OUT → Gary Jackson IN (stamina_rule2)

[02:35] Substitution (Team_042): Dejounte Butler OUT → Allen Towns IN (stamina_rule2)

[02:35] Substitution (Team_042): Cade Dosunmu OUT → Lamelo Stewart IN (stamina_rule2)

[02:20] Team_042 possession (Score: 60-65)
Khris George attempts a Midrange. Contested by Desmond Irving (5.2 feet, MAN). KHRIS GEORGE MAKES IT!
Score: 60-67

[02:06] Team_012 possession (Score: 60-67)
Jimmy Quickley attempts a 3Pt. Contested by Allen Towns (4.5 feet, MAN). Jimmy Quickley misses. Rebound secured by Lamelo Stewart.

[01:54] Team_042 possession (Score: 60-67)
Isaiah Randle attempts a 3Pt. Contested by Jalen Barnes (5.4 feet, MAN). Isaiah Randle misses. Offensive rebound by Allen Towns! Allen Towns kicks it out.

[01:39] Team_042 possession (Score: 60-67)
Lamelo Stewart makes the 3Pt and draws the foul on Karl Young! And-1! Lamelo Stewart to the line for 1. [BONUS: 5 team fouls] (Karl Young: 1 personal fouls)   FT 1/1: GOOD Lamelo Stewart makes 1/1 from the line.
Score: 60-71

[01:22] Team_012 possession (Score: 60-71)
Jimmy Quickley attempts a 3Pt. Contested by Allen Towns (4.5 feet, MAN). JIMMY QUICKLEY MAKES IT! Assist: Jalen Barnes
Score: 63-71

[01:06] Team_042 possession (Score: 63-71)
Gary Jackson throws a bad pass out of bounds! TURNOVER! (dead ball)

[00:48] Team_012 possession (Score: 63-71)
Jimmy Quickley attempts a 3Pt. Contested by Khris George (4.2 feet, ZONE). Jimmy Quickley misses. Rebound secured by Lamelo Stewart.

[00:32] Team_042 possession (Score: 63-71)
Gary Jackson drives and kicks out. Allen Towns attempts a 3Pt. Contested by Desmond Irving (4.5 feet, ZONE). Allen Towns misses. Rebound secured by Jalen Barnes.

[00:18] Team_012 possession (Score: 63-71)
Domantas Bird attempts a 3Pt. Contested by Khris George (3.9 feet, ZONE). DOMANTAS BIRD MAKES IT! Assist: Karl Young
Score: 66-71

[00:02] Team_042 possession (Score: 66-71)
Allen Towns attempts a Midrange. Contested by Jimmy Quickley (5.4 feet, ZONE). Allen Towns misses. Rebound secured by Jimmy Quickley.

================================================================================
                              3RD QUARTER COMPLETE                              
================================================================================

3RD QUARTER SCORE: Team_012 24, Team_042 18

BOX SCORE:
================================================================================

Team_012
--------------------------------------------------------------------------------
Player                MIN  PTS  REB  AST  TO      FG   FG%      3P   3P%
--------------------------------------------------------------------------------
Shaquille Booker       34    6    0    1   0   2/3    66.7     0/0   0.0
Paolo Durant           34    5    3    1   0   2/3    66.7     0/0   0.0
Ayo McGrady            34    4    5    0   0   2/3    66.7     0/0   0.0
Pascal Herro           31    3    0    0   0   1/1   100.0     0/0   0.0
Jimmy Quickley          3    3    1    0   0   1/3    33.3     0/0   0.0
Domantas Bird           3    3    0    0   0   1/1   100.0     0/0   0.0
RJ Nowitzki            34    0    6    1   0   0/4     0.0     0/0   0.0
Jalen Barnes            3    0    1    1   0   0/0     0.0     0/0   0.0
Karl Young              3    0    0    1   0   0/0     0.0     0/0   0.0

TEAM: FG: 9/18 (50.0%), 3PT: 4/8 (50.0%), REB: 14 (2 off, 12 def), AST: 5, TO: 5
TEAM FOULS: 5 [Team_042 in BONUS]


Team_042
--------------------------------------------------------------------------------
Player                MIN  PTS  REB  AST  TO      FG   FG%      3P   3P%
--------------------------------------------------------------------------------
Tyler Barrett          34    6    2    0   0   2/3    66.7     0/0   0.0
Lamelo Stewart          5    4    2    0   0   1/1   100.0     0/0   0.0
Cade Dosunmu           31    3    2    1   0   1/4    25.0     0/0   0.0
Dejounte Butler        34    3    3    0   0   1/3    33.3     0/0   0.0
Khris George            3    2    0    0   0   1/1   100.0     0/0   0.0
Kristaps Parker        34    0    0    0   0   0/2     0.0     0/0   0.0
Jarrett Sabonis        34    0    0    0   0   0/4     0.0     0/0   0.0
Allen Towns             3    0    1    0   0   0/1     0.0     0/0   0.0
Gary Jackson            3    0    0    0   0   0/1     0.0     0/0   0.0

TEAM: FG: 6/20 (30.0%), 3PT: 3/8 (37.5%), REB: 12 (3 off, 9 def), AST: 1, TO: 3
TEAM FOULS: 5 [Team_012 in BONUS]

================================================================================

================================================================================
                       4TH QUARTER - Team_012 vs Team_042                       
================================================================================

[12:00] Team_012 possession (Score: 66-71)
Paolo Durant makes the Dunk and draws the foul on Dejounte Butler! And-1! Paolo Durant to the line for 1. [Team fouls: 1] (Dejounte Butler: 1 personal fouls)   FT 1/1: MISS Paolo Durant makes 0/1 from the line. Offensive rebound by Paolo Durant! Paolo Durant puts it back in!
Score: 70-71

[11:49] Team_042 possession (Score: 70-71)
Cade Dosunmu attempts a Layup. Contested by Ayo McGrady (4.6 feet, MAN). CADE DOSUNMU MAKES IT! Assist: Dejounte Butler
Score: 70-73

[11:35] Team_012 possession (Score: 70-73)
Paolo Durant attempts a Midrange. BLOCKED BY KRISTAPS PARKER! Ball is loose! Offensive rebound by RJ Nowitzki! RJ Nowitzki kicks it out.

[11:24] Team_012 possession (Score: 70-73)
Shaquille Booker makes the Layup and draws the foul on Cade Dosunmu! And-1! Shaquille Booker to the line for 1. [Team fouls: 2] (Cade Dosunmu: 1 personal fouls)   FT 1/1: GOOD Shaquille Booker makes 1/1 from the line.
Score: 73-73

[11:13] Team_042 possession (Score: 73-73)
Tyler Barrett drives, picks up Paolo Durant. Help arrives from RJ Nowitzki! Tyler Barrett attempts a Dunk. Contested by RJ Nowitzki (4.1 feet, ZONE). TYLER BARRETT MAKES IT!
Score: 73-75

[11:00] Team_012 possession (Score: 73-75)
Pascal Herro attempts a Midrange. Contested by Tyler Barrett (4.0 feet, MAN). Pascal Herro misses. Rebound secured by Cade Dosunmu.

[10:46] Team_042 possession (Score: 73-75)
Dejounte Butler attempts a 3Pt. Contested by Paolo Durant (3.9 feet, MAN). Dejounte Butler misses. Offensive rebound by Dejounte Butler! Dejounte Butler's putback is no good. Rebound secured by Ayo McGrady.

[10:36] Team_012 possession (Score: 73-75)
RJ Nowitzki attempts a Midrange. Contested by Kristaps Parker (5.4 feet, MAN). RJ Nowitzki misses. FOUL! Loose ball foul on Cade Dosunmu during the rebound battle. [Team fouls: 3] No free throws, side out. (Cade Dosunmu: 2 personal fouls)

[10:23] Team_012 possession (Score: 73-75)
RJ Nowitzki attempts a 3Pt. Contested by Kristaps Parker (5.4 feet, MAN). RJ Nowitzki misses. Rebound secured by Dejounte Butler.

[10:07] Team_042 possession (Score: 73-75)
Jarrett Sabonis attempts a Midrange. Contested by Paolo Durant (4.1 feet, ZONE). JARRETT SABONIS MAKES IT! Assist: Dejounte Butler
Score: 73-77

[09:48] Team_012 possession (Score: 73-77)
Shaquille Booker attempts a 3Pt. Contested by Tyler Barrett (3.5 feet, ZONE). Shaquille Booker misses. Rebound secured by Tyler Barrett.

[09:32] Team_042 possession (Score: 73-77)
Dejounte Butler attempts a 3Pt. Contested by Paolo Durant (4.0 feet, MAN). Dejounte Butler misses. Rebound secured by Paolo Durant.

[09:19] Team_012 possession (Score: 73-77)
Ayo McGrady drives and kicks out. Paolo Durant attempts a 3Pt. Contested by Tyler Barrett (3.7 feet, ZONE). Paolo Durant misses. Rebound secured by Tyler Barrett.

[09:05] Team_042 possession (Score: 73-77)
Jarrett Sabonis drives to the basket... Jarrett Sabonis loses the ball! Stripped by Paolo Durant! TURNOVER! (live ball)

[08:48] Team_012 possession (Score: 73-77)
Paolo Durant attempts a Midrange. Contested by Jarrett Sabonis (4.3 feet, ZONE). PAOLO DURANT MAKES IT! Assist: Ayo McGrady
Score: 75-77

[08:35] Team_042 possession (Score: 75-77)
Dejounte Butler drives and kicks out. Kristaps Parker attempts a 3Pt. Contested by RJ Nowitzki (3.8 feet, ZONE). Kristaps Parker misses. Offensive rebound by Cade Dosunmu! Cade Dosunmu's putback is no good. Rebound secured by Ayo McGrady.

[08:17] Team_012 possession (Score: 75-77)
Shaquille Booker attempts a 3Pt. Contested by Tyler Barrett (3.7 feet, ZONE). Shaquille Booker misses. Rebound secured by Dejounte Butler.

[08:03] Team_042 possession (Score: 75-77)
Dejounte Butler attempts a 3Pt. Contested by Paolo Durant (4.1 feet, MAN). Dejounte Butler misses. Rebound secured by Paolo Durant.

[07:50] Team_012 possession (Score: 75-77)
Pascal Herro attempts a 3Pt. Contested by Tyler Barrett (4.3 feet, ZONE). Pascal Herro misses. Offensive rebound by Paolo Durant! Paolo Durant's putback is no good. Rebound secured by Dejounte Butler.

[07:36] Team_042 possession (Score: 75-77)
Jarrett Sabonis drives and kicks out. Kristaps Parker attempts a 3Pt. Contested by RJ Nowitzki (3.9 feet, ZONE). KRISTAPS PARKER MAKES IT!
Score: 75-80

[07:16] Team_012 possession (Score: 75-80)
RJ Nowitzki attempts a 3Pt. Contested by Tyler Barrett (4.2 feet, ZONE). RJ Nowitzki misses. Offensive rebound by Paolo Durant! Paolo Durant puts it back in!
Score: 77-80

[06:57] Team_042 possession (Score: 77-80)
FOUL! Holding foul on Pascal Herro. [Team fouls: 1] No free throws, side out. (Pascal Herro: 1 personal fouls)

[06:45] Team_042 possession (Score: 77-80)
Dejounte Butler drives and kicks out. Jarrett Sabonis attempts a Midrange. Contested by Shaquille Booker (4.6 feet, MAN). JARRETT SABONIS MAKES IT!
Score: 77-82

[06:32] Team_012 possession (Score: 77-82)
FOUL! Shooting foul on Tyler Barrett. Pascal Herro to the line for 2 free throws. [Team fouls: 4] (Tyler Barrett: 1 personal fouls)   FT 1/2: GOOD   FT 2/2: GOOD Pascal Herro makes 2/2 from the line.
Score: 79-82

[06:16] Team_042 possession (Score: 79-82)
Tyler Barrett attempts a 3Pt. Contested by Pascal Herro (6.0 feet, MAN). Tyler Barrett misses. Rebound secured by Paolo Durant.

[06:06] Team_012 possession (Score: 79-82)
Paolo Durant makes the Layup and draws the foul on Tyler Barrett! And-1! Paolo Durant to the line for 1. [BONUS: 5 team fouls] (Tyler Barrett: 2 personal fouls)   FT 1/1: GOOD Paolo Durant makes 1/1 from the line.
Score: 82-82

[05:53] Team_042 possession (Score: 82-82)
FOUL! Reach-in foul on Paolo Durant during the drive. [Team fouls: 2] No free throws, side out. (Paolo Durant: 1 personal fouls)

[05:42] Team_042 possession (Score: 82-82)
Jarrett Sabonis attempts a 3Pt. Contested by Shaquille Booker (5.0 feet, MAN). Jarrett Sabonis misses. Rebound secured by RJ Nowitzki.

[05:27] Team_012 possession (Score: 82-82)
Shaquille Booker commits a violation (traveling/carry)! TURNOVER! (dead ball)

[05:27] Substitution (Team_012): Pascal Herro OUT → Desmond Irving IN (stamina_rule2)

[05:27] Substitution (Team_012): RJ Nowitzki OUT → Jalen Barnes IN (stamina_rule2)

[05:27] Substitution (Team_012): Shaquille Booker OUT → Domantas Bird IN (stamina_rule2)

[05:27] Substitution (Team_012): Paolo Durant OUT → Jimmy Quickley IN (stamina_rule2)

[05:27] Substitution (Team_012): Ayo McGrady OUT → Karl Young IN (stamina_rule2)

[05:27] Substitution (Team_042): Tyler Barrett OUT → Khris George IN (stamina_rule2)

[05:27] Substitution (Team_042): Kristaps Parker OUT → Isaiah Randle IN (stamina_rule2)

[05:27] Substitution (Team_042): Jarrett Sabonis OUT → Gary Jackson IN (stamina_rule2)

[05:27] Substitution (Team_042): Dejounte Butler OUT → Allen Towns IN (stamina_rule2)

[05:27] Substitution (Team_042): Cade Dosunmu OUT → Lamelo Stewart IN (stamina_rule2)

[05:14] Team_042 possession (Score: 82-82)
Lamelo Stewart drives, picks up Jimmy Quickley. Help arrives from Jalen Barnes! Lamelo Stewart attempts a Layup. Contested by Jalen Barnes (4.9 feet, ZONE). LAMELO STEWART MAKES IT! Assist: Gary Jackson
Score: 82-84

[05:02] Team_012 possession (Score: 82-84)
Jimmy Quickley attempts a 3Pt. Contested by Khris George (4.2 feet, ZONE). JIMMY QUICKLEY MAKES IT! Assist: Karl Young
Score: 85-84

[04:46] Team_042 possession (Score: 85-84)
Lamelo Stewart attempts a Midrange. Contested by Karl Young (3.8 feet, MAN). Lamelo Stewart misses. Rebound secured by Karl Young.

[04:29] Team_012 possession (Score: 85-84)
Desmond Irving attempts a 3Pt. Contested by Khris George (4.1 feet, MAN). Desmond Irving misses. Rebound secured by Lamelo Stewart.

[04:19] Team_042 possession (Score: 85-84)
Gary Jackson attempts a 3Pt. Contested by Domantas Bird (5.2 feet, MAN). Gary Jackson misses. Rebound secured by Jalen Barnes.

[04:01] Team_012 possession (Score: 85-84)
Desmond Irving drives and kicks out. Desmond Irving attempts a 3Pt. Contested by Khris George (4.0 feet, MAN). Desmond Irving misses. Rebound secured by Gary Jackson.

[03:52] Team_042 possession (Score: 85-84)
Gary Jackson drives and kicks out. Khris George attempts a Midrange. Contested by Jalen Barnes (5.3 feet, ZONE). KHRIS GEORGE MAKES IT! Assist: Isaiah Randle
Score: 85-86

[03:37] Team_012 possession (Score: 85-86)
Domantas Bird drives and kicks out. Jalen Barnes attempts a 3Pt. Contested by Isaiah Randle (5.1 feet, MAN). JALEN BARNES MAKES IT! Assist: Desmond Irving
Score: 88-86

[03:22] Team_042 possession (Score: 88-86)
Gary Jackson attempts a Midrange. Contested by Desmond Irving (4.5 feet, ZONE). Gary Jackson misses. Rebound secured by Jimmy Quickley.

[03:08] Team_012 possession (Score: 88-86)
Domantas Bird drives to the basket... Domantas Bird loses the ball! Stripped by Gary Jackson! TURNOVER! (live ball)

[02:56] Team_042 possession (Score: 88-86)
Khris George attempts a 3Pt. Contested by Desmond Irving (5.2 feet, MAN). Khris George misses. Rebound secured by Karl Young.

[02:43] Team_012 possession (Score: 88-86)
Domantas Bird attempts a 3Pt. Contested by Khris George (3.9 feet, ZONE). DOMANTAS BIRD MAKES IT! Assist: Jalen Barnes
Score: 91-86

[02:27] Team_042 possession (Score: 91-86)
Gary Jackson drives to the basket... FOUL! Offensive foul on Gary Jackson! Domantas Bird drew the charge! [Team fouls: 6] (Gary Jackson: 1 personal fouls) TURNOVER! (dead ball)

[02:13] Team_012 possession (Score: 91-86)
Desmond Irving attempts a Layup. Contested by Khris George (4.1 feet, MAN). DESMOND IRVING MAKES IT! Assist: Karl Young
Score: 93-86

[01:57] Team_042 possession (Score: 93-86)
Isaiah Randle attempts a Midrange. Contested by Jalen Barnes (5.4 feet, MAN). Isaiah Randle misses. Offensive rebound by Allen Towns! Allen Towns kicks it out.

[01:45] Team_042 possession (Score: 93-86)
FOUL! Shooting foul on Jimmy Quickley. Allen Towns to the line for 2 free throws. [Team fouls: 3] (Jimmy Quickley: 1 personal fouls)   FT 1/2: MISS   FT 2/2: GOOD Allen Towns makes 1/2 from the line.
Score: 93-87

[01:30] Team_012 possession (Score: 93-87)
Domantas Bird makes the Layup and draws the foul on Allen Towns! And-1! Domantas Bird to the line for 1. [BONUS: 7 team fouls] (Allen Towns: 1 personal fouls)   FT 1/1: GOOD Domantas Bird makes 1/1 from the line.
Score: 96-87

[01:13] Team_042 possession (Score: 96-87)
FOUL! Reach-in foul on Karl Young during the drive. [Team fouls: 4] No free throws, side out. (Karl Young: 1 personal fouls)

[01:02] Team_042 possession (Score: 96-87)
FOUL! Shooting foul on Jimmy Quickley. Khris George to the line for 2 free throws. [BONUS: 5 team fouls] (Jimmy Quickley: 2 personal fouls)   FT 1/2: GOOD   FT 2/2: GOOD Khris George makes 2/2 from the line.
Score: 96-89

[00:47] Team_012 possession (Score: 96-89)
FOUL! Shooting foul on Isaiah Randle. Jalen Barnes to the line for 2 free throws. [BONUS: 8 team fouls] (Isaiah Randle: 1 personal fouls)   FT 1/2: GOOD   FT 2/2: GOOD Jalen Barnes makes 2/2 from the line.
Score: 98-89

[00:32] Team_042 possession (Score: 98-89)
Isaiah Randle attempts a 3Pt. Contested by Desmond Irving (4.7 feet, ZONE). Isaiah Randle misses. Rebound secured by Jalen Barnes.

[00:15] Team_012 possession (Score: 98-89)
Karl Young throws a bad pass out of bounds! TURNOVER! (dead ball)

================================================================================
                              4TH QUARTER COMPLETE                              
================================================================================

4TH QUARTER SCORE: Team_012 32, Team_042 18

BOX SCORE:
================================================================================

Team_012
--------------------------------------------------------------------------------
Player                MIN  PTS  REB  AST  TO      FG   FG%      3P   3P%
--------------------------------------------------------------------------------
Paolo Durant           41   11    5    0   0   4/4   100.0     0/0   0.0
Domantas Bird           8    6    0    0   0   2/2   100.0     0/0   0.0
Jalen Barnes            8    5    2    1   0   2/2   100.0     0/0   0.0
Shaquille Booker       41    3    0    0   0   1/3    33.3     0/0   0.0
Jimmy Quickley          8    3    1    0   0   1/1   100.0     0/0   0.0
Pascal Herro           38    2    0    0   0   1/3    33.3     0/0   0.0
Desmond Irving         10    2    0    1   0   1/3    33.3     0/0   0.0
Dejounte Butler        41    0    3    2   0   0/4     0.0     0/0   0.0
RJ Nowitzki            41    0    2    0   0   0/1     0.0     0/0   0.0
Karl Young              8    0    2    2   0   0/0     0.0     0/0   0.0

TEAM: FG: 12/20 (60.0%), 3PT: 3/8 (37.5%), REB: 13 (4 off, 9 def), AST: 5, TO: 3
TEAM FOULS: 5 [Team_042 in BONUS]


Team_042
--------------------------------------------------------------------------------
Player                MIN  PTS  REB  AST  TO      FG   FG%      3P   3P%
--------------------------------------------------------------------------------
Jarrett Sabonis        41    4    0    0   0   2/3    66.7     0/0   0.0
Khris George            8    4    0    0   0   2/3    66.7     0/0   0.0
Kristaps Parker        41    3    0    0   0   1/1   100.0     0/0   0.0
Cade Dosunmu           38    2    1    0   0   1/1   100.0     0/0   0.0
Tyler Barrett          41    2    2    0   0   1/2    50.0     0/0   0.0
Lamelo Stewart         10    2    1    0   0   1/2    50.0     0/0   0.0
Allen Towns             8    1    1    0   0   1/1   100.0     0/0   0.0
Ayo McGrady            41    0    2    1   0   0/1     0.0     0/0   0.0
Gary Jackson            8    0    1    1   0   0/2     0.0     0/0   0.0
Isaiah Randle           8    0    0    1   0   0/1     0.0     0/0   0.0

TEAM: FG: 9/20 (45.0%), 3PT: 0/8 (0.0%), REB: 10 (3 off, 7 def), AST: 4, TO: 2
TEAM FOULS: 8 [Team_012 in BONUS]

================================================================================

================================================================================
                               FULL GAME COMPLETE                               
================================================================================

FINAL SCORE: Team_012 98, Team_042 89

SCORING BY QUARTER:
--------------------------------------------------------------------------------
Team                     Q1     Q2     Q3     Q4    FINAL
--------------------------------------------------------------------------------
Team_012                 26     16     24     32       98
Team_042                 25     28     18     18       89
--------------------------------------------------------------------------------

FULL GAME BOX SCORE:
================================================================================

Team_012
--------------------------------------------------------------------------------
Player                MIN  PTS  REB  AST  TO      FG   FG%      3P   3P%      FT STL BLK
--------------------------------------------------------------------------------
RJ Nowitzki            41    9   14    5   2   6/13   46.2   1/4    25.0   3/3     1   1
Shaquille Booker       41   14    0    2   1   5/15   33.3   2/8    25.0   2/2     1   0
Paolo Durant           41   23   21    1   4   7/13   53.8   0/0     0.0   3/6     2   0
Ayo McGrady            41   10   15    5   3   4/9    44.4   1/2    50.0   6/7     0   0
Pascal Herro           38   16    0    1   4   7/13   53.8   4/8    50.0   2/2     0   0
Desmond Irving         10    2    0    1   0   1/5    20.0   0/2     0.0   0/0     0   0
Jalen Barnes            8    5    3    2   1   1/1   100.0   0/0     0.0   2/2     0   0
Domantas Bird           8    9    0    0   0   4/4   100.0   2/2   100.0   1/1     0   0
Jimmy Quickley          8    6    2    0   0   2/4    50.0   2/4    50.0   0/0     0   0
Karl Young              8    0    2    3   1   0/0     0.0   0/0     0.0   0/0     0   0

TEAM: FG: 37/77 (48.1%), 3PT: 12/30 (40.0%), REB: 51 (9 off, 42 def), AST: 20, TO: 16


Team_042
--------------------------------------------------------------------------------
Player                MIN  PTS  REB  AST  TO      FG   FG%      3P   3P%      FT STL BLK
--------------------------------------------------------------------------------
Tyler Barrett          41   14   13    5   2   4/12   33.3   2/8    25.0   9/9     2   3
Kristaps Parker        41   19    0    1   1   7/14   50.0   2/6    33.3   3/4     0   1
Jarrett Sabonis        41   14    0    2   1   7/18   38.9   2/8    25.0   1/2     1   0
Dejounte Butler        41    5   14    3   0   4/11   36.4   1/4    25.0   2/3     0   0
Cade Dosunmu           38   17   12    3   1   5/12   41.7   1/3    33.3   2/2     2   1
Lamelo Stewart         10    8    3    0   0   3/4    75.0   1/1   100.0   2/3     0   0
Khris George            8    6    0    0   0   2/3    66.7   0/1     0.0   2/2     0   0
Isaiah Randle           8    0    0    1   1   0/1     0.0   0/1     0.0   0/0     0   0
Gary Jackson            8    0    1    1   1   1/4    25.0   0/1     0.0   0/0     1   0
Allen Towns             8    1    2    0   0   1/2    50.0   0/0     0.0   1/2     0   0

TEAM: FG: 36/84 (42.9%), 3PT: 9/33 (27.3%), REB: 50 (11 off, 39 def), AST: 16, TO: 7

================================================================================
