================================================================================
                        FULL GAME - Team_097 vs Team_005                        
================================================================================

================================================================================
                       1ST QUARTER - Team_097 vs Team_005                       
================================================================================

[12:00] Team_097 possession (Score: 0-0)
Tyrese Stewart attempts a Layup. Contested by Cade Markkanen (4.1 feet, MAN). Tyrese Stewart misses. Rebound secured by Cade Markkanen.

[11:46] Team_005 possession (Score: 0-0)
Jalen Rozier makes the Dunk and draws the foul on Anthony Haliburton! And-1! Jalen Rozier to the line for 1. [Team fouls: 1] (Anthony Haliburton: 1 personal fouls)   FT 1/1: GOOD Jalen Rozier makes 1/1 from the line.
Score: 0-3

[11:33] Team_097 possession (Score: 0-3)
Anthony Haliburton attempts a 3Pt. Contested by Cade Markkanen (3.7 feet, MAN). Anthony Haliburton misses. Rebound secured by Jalen Rozier.

[11:19] Team_005 possession (Score: 0-3)
Derrick Allen attempts a 3Pt. Contested by Shai Poole (3.8 feet, MAN). Derrick Allen misses. Rebound secured by Tyrese Stewart.

[11:05] Team_097 possession (Score: 0-3)
Tyrese Stewart makes the Dunk and draws the foul on Cade Markkanen! And-1! Tyrese Stewart to the line for 1. [Team fouls: 1] (Cade Markkanen: 1 personal fouls)   FT 1/1: GOOD Tyrese Stewart makes 1/1 from the line.
Score: 3-3

[10:50] Team_005 possession (Score: 3-3)
Cade Markkanen drives and kicks out. Derrick Allen attempts a 3Pt. Contested by Shai Poole (3.4 feet, MAN). Derrick Allen misses. Rebound secured by Anthony Haliburton.

[10:33] Team_097 possession (Score: 3-3)
Tyrese Stewart attempts a Midrange. Contested by Cade Markkanen (4.1 feet, MAN). Tyrese Stewart misses. Rebound secured by Cade Markkanen.

[10:17] Team_005 possession (Score: 3-3)
Derrick Allen drives and kicks out. Brandon George attempts a 3Pt. Contested by Shai Poole (3.4 feet, ZONE). Brandon George misses. Rebound secured by Shai Poole.

[10:03] Team_097 possession (Score: 3-3)
Anthony Haliburton attempts a Dunk. BLOCKED BY CADE MARKKANEN! Ball is loose! Rebound secured by Jalen Rozier.

[09:45] Team_005 possession (Score: 3-3)
Jalen Rozier attempts a 3Pt. Contested by Shai Poole (3.7 feet, ZONE). Jalen Rozier misses. Rebound secured by Shai Poole.

[09:34] Team_097 possession (Score: 3-3)
Evan Brogdon attempts a Layup. Contested by Brandon George (5.8 feet, MAN). Evan Brogdon misses. Rebound secured by Derrick Allen.

[09:20] Team_005 possession (Score: 3-3)
Brandon George attempts a 3Pt. Contested by Evan Brogdon (4.9 feet, MAN). BRANDON GEORGE MAKES IT! Assist: Cade Markkanen
Score: 3-6

[09:03] Team_097 possession (Score: 3-6)
Evan Brogdon attempts a Midrange. Contested by Brandon George (5.8 feet, MAN). Evan Brogdon misses. Rebound secured by Jalen Rozier.

[08:51] Team_005 possession (Score: 3-6)
Anthony Rozier attempts a Layup. Contested by Jrue Haliburton (5.3 feet, MAN). Anthony Rozier misses. Rebound secured by Shai Poole.

[08:40] Team_097 possession (Score: 3-6)
Anthony Haliburton throws a bad pass! Stolen by Cade Markkanen! TURNOVER! (live ball)

[08:24] Team_005 possession (Score: 3-6)
Anthony Rozier attempts a 3Pt. Contested by Jrue Haliburton (5.3 feet, MAN). ANTHONY ROZIER MAKES IT! Assist: Derrick Allen
Score: 3-9

[08:07] Team_097 possession (Score: 3-9)
Jrue Haliburton drives to the basket... Jrue Haliburton commits a violation (traveling/carry)! TURNOVER! (dead ball)

[07:54] Team_005 possession (Score: 3-9)
Cade Markkanen attempts a 3Pt. Contested by Shai Poole (3.2 feet, ZONE). CADE MARKKANEN MAKES IT! Assist: Jalen Rozier
Score: 3-12

[07:37] Team_097 possession (Score: 3-12)
Tyrese Stewart attempts a 3Pt. Contested by Derrick Allen (5.1 feet, ZONE). Tyrese Stewart misses. Rebound secured by Jalen Rozier.

[07:27] Team_005 possession (Score: 3-12)
Jalen Rozier attempts a Midrange. Contested by Anthony Haliburton (3.6 feet, MAN). Jalen Rozier misses. Rebound secured by Tyrese Stewart.

[07:13] Team_097 possession (Score: 3-12)
Tyrese Stewart drives, picks up Cade Markkanen. Help arrives from Anthony Rozier! Tyrese Stewart attempts a Layup. Contested by Anthony Rozier (4.1 feet, MAN). TYRESE STEWART MAKES IT! Assist: Jrue Haliburton
Score: 5-12

[07:02] Team_005 possession (Score: 5-12)
Brandon George drives to the basket... Brandon George throws a bad pass! Stolen by Anthony Haliburton! TURNOVER! (live ball)

[06:51] Team_097 possession (Score: 5-12)
Jrue Haliburton throws a bad pass out of bounds! TURNOVER! (dead ball)

[06:36] Team_005 possession (Score: 5-12)
Derrick Allen drives and kicks out. Brandon George attempts a Midrange. Contested by Shai Poole (3.4 feet, ZONE). Brandon George misses. Rebound secured by Anthony Haliburton.

[06:20] Team_097 possession (Score: 5-12)
Evan Brogdon drives and kicks out. Evan Brogdon attempts a Midrange. Contested by Jalen Rozier (4.9 feet, ZONE). EVAN BROGDON MAKES IT! Assist: Tyrese Stewart
Score: 7-12

[06:09] Team_005 possession (Score: 7-12)
Derrick Allen attempts a Midrange. Contested by Shai Poole (3.8 feet, MAN). Derrick Allen misses. Rebound secured by Anthony Haliburton.

[05:57] Team_097 possession (Score: 7-12)
Shai Poole attempts a 3Pt. Contested by Derrick Allen (4.8 feet, ZONE). Shai Poole misses. Offensive rebound by Tyrese Stewart! Tyrese Stewart kicks it out.

[05:45] Team_097 possession (Score: 7-12)
Shai Poole makes the Dunk and draws the foul on Derrick Allen! And-1! Shai Poole to the line for 1. [Team fouls: 2] (Derrick Allen: 1 personal fouls)   FT 1/1: GOOD Shai Poole makes 1/1 from the line.
Score: 10-12

[05:30] Team_005 possession (Score: 10-12)
FOUL! Holding foul on Shai Poole. [Team fouls: 2] No free throws, side out. (Shai Poole: 1 personal fouls)

[05:16] Team_005 possession (Score: 10-12)
FOUL! Holding foul on Anthony Haliburton. [Team fouls: 3] No free throws, side out. (Anthony Haliburton: 2 personal fouls)

[05:06] Team_005 possession (Score: 10-12)
Jalen Rozier attempts a 3Pt. Contested by Evan Brogdon (5.0 feet, ZONE). Jalen Rozier misses. Offensive rebound by Cade Markkanen! Cade Markkanen's putback is no good. Offensive rebound by Jalen Rozier! Jalen Rozier kicks it out.

[04:49] Team_005 possession (Score: 10-12)
Jalen Rozier attempts a Layup. Contested by Anthony Haliburton (3.7 feet, MAN). Jalen Rozier misses. Rebound secured by Tyrese Stewart.

[04:35] Team_097 possession (Score: 10-12)
Shai Poole attempts a Layup. BLOCKED BY ANTHONY ROZIER! Ball is loose! Rebound secured by Derrick Allen.

[04:19] Team_005 possession (Score: 10-12)
Cade Markkanen drives and kicks out. Anthony Rozier attempts a 3Pt. Contested by Shai Poole (3.5 feet, ZONE). ANTHONY ROZIER MAKES IT! Assist: Brandon George
Score: 10-15

[04:04] Team_097 possession (Score: 10-15)
FOUL! Shooting foul on Derrick Allen. Shai Poole to the line for 2 free throws. [Team fouls: 3] (Derrick Allen: 2 personal fouls)   FT 1/2: GOOD   FT 2/2: MISS Shai Poole makes 1/2 from the line. Offensive rebound by Tyrese Stewart! Tyrese Stewart kicks it out.
Score: 11-15

[03:50] Team_097 possession (Score: 11-15)
Jrue Haliburton attempts a 3Pt. Contested by Anthony Rozier (5.2 feet, MAN). Jrue Haliburton misses. Rebound secured by Cade Markkanen.

[03:33] Team_005 possession (Score: 11-15)
Derrick Allen attempts a Layup. Contested by Shai Poole (3.9 feet, MAN). Derrick Allen misses. Rebound secured by Tyrese Stewart.

[03:18] Team_097 possession (Score: 11-15)
Jrue Haliburton drives and kicks out. Anthony Haliburton attempts a Midrange. Contested by Derrick Allen (4.4 feet, ZONE). Anthony Haliburton misses. Rebound secured by Derrick Allen.

[03:04] Team_005 possession (Score: 11-15)
Brandon George drives, Evan Brogdon stays with him. Brandon George attempts a Layup. Contested by Evan Brogdon (5.0 feet, MAN). Brandon George misses. Rebound secured by Shai Poole.

[02:51] Team_097 possession (Score: 11-15)
Jrue Haliburton drives and kicks out. Shai Poole attempts a Midrange. Contested by Derrick Allen (4.5 feet, MAN). Shai Poole misses. Offensive rebound by Tyrese Stewart! Tyrese Stewart kicks it out.

[02:38] Team_097 possession (Score: 11-15)
Anthony Haliburton attempts a Layup. Contested by Cade Markkanen (4.1 feet, ZONE). Anthony Haliburton misses. Offensive rebound by Anthony Haliburton! Anthony Haliburton kicks it out.

[02:20] Team_097 possession (Score: 11-15)
Evan Brogdon attempts a 3Pt. Wide open! Brandon George is 6.1 feet away. [MAN] Evan Brogdon misses. Rebound secured by Jalen Rozier.

[02:06] Team_005 possession (Score: 11-15)
Anthony Rozier drives and kicks out. Jalen Rozier attempts a Midrange. Contested by Jrue Haliburton (5.5 feet, ZONE). Jalen Rozier misses. Offensive rebound by Cade Markkanen! Cade Markkanen kicks it out.

[01:49] Team_005 possession (Score: 11-15)
Jalen Rozier attempts a 3Pt. Contested by Evan Brogdon (5.3 feet, ZONE). JALEN ROZIER MAKES IT!
Score: 11-18

[01:32] Team_097 possession (Score: 11-18)
Anthony Haliburton attempts a Layup. Contested by Cade Markkanen (4.2 feet, ZONE). ANTHONY HALIBURTON MAKES IT!
Score: 13-18

[01:20] Team_005 possession (Score: 13-18)
FOUL! Reach-in foul on Anthony Haliburton during the drive. [Team fouls: 4] No free throws, side out. (Anthony Haliburton: 3 personal fouls)

[01:05] Team_005 possession (Score: 13-18)
Cade Markkanen attempts a Midrange. Contested by Shai Poole (3.6 feet, ZONE). CADE MARKKANEN MAKES IT!
Score: 13-20

[00:51] Team_097 possession (Score: 13-20)
FOUL! Offensive foul on Jrue Haliburton! Anthony Rozier drew the charge! [Team fouls: 5] (Jrue Haliburton: 1 personal fouls) TURNOVER! (dead ball)

[00:38] Team_005 possession (Score: 13-20)
FOUL! Shooting foul on Evan Brogdon. Anthony Rozier to the line for 3 free throws. [BONUS: 6 team fouls] (Evan Brogdon: 1 personal fouls)   FT 1/3: GOOD   FT 2/3: GOOD   FT 3/3: GOOD Anthony Rozier makes 3/3 from the line.
Score: 13-23

[00:24] Team_097 possession (Score: 13-23)
Evan Brogdon attempts a Midrange. Contested by Derrick Allen (5.3 feet, ZONE). Evan Brogdon misses. Rebound secured by Jalen Rozier.

[00:08] Team_005 possession (Score: 13-23)
Brandon George attempts a 3Pt. Contested by Evan Brogdon (5.3 feet, MAN). Brandon George misses. Rebound secured by Tyrese Stewart.

================================================================================
                              1ST QUARTER COMPLETE                              
================================================================================

1ST QUARTER SCORE: Team_097 13, Team_005 23

BOX SCORE:
================================================================================

Team_097
--------------------------------------------------------------------------------
Player                MIN  PTS  REB  AST  TO      FG   FG%      3P   3P%
--------------------------------------------------------------------------------
Tyrese Stewart         12    5    8    1   0   2/5    40.0     0/0   0.0
Shai Poole             12    3    4    0   0   1/2    50.0     0/0   0.0
Anthony Haliburton     12    2    4    0   0   1/3    33.3     0/0   0.0
Evan Brogdon           12    2    0    0   0   1/5    20.0     0/0   0.0
Jrue Haliburton        12    0    0    1   0   0/2     0.0     0/0   0.0

TEAM: FG: 5/17 (29.4%), 3PT: 0/4 (0.0%), REB: 16 (4 off, 12 def), AST: 2, TO: 4
TEAM FOULS: 6 [Team_005 in BONUS]


Team_005
--------------------------------------------------------------------------------
Player                MIN  PTS  REB  AST  TO      FG   FG%      3P   3P%
--------------------------------------------------------------------------------
Anthony Rozier         12    9    0    0   0   3/4    75.0     0/0   0.0
Jalen Rozier           12    6    7    1   0   2/5    40.0     0/0   0.0
Cade Markkanen         12    5    4    1   0   2/3    66.7     0/0   0.0
Brandon George         12    3    0    1   0   1/3    33.3     0/0   0.0
Derrick Allen          12    0    3    1   0   0/5     0.0     0/0   0.0

TEAM: FG: 8/20 (40.0%), 3PT: 5/8 (62.5%), REB: 14 (2 off, 12 def), AST: 4, TO: 1
TEAM FOULS: 3

================================================================================

================================================================================
                       2ND QUARTER - Team_097 vs Team_005                       
================================================================================

[12:00] Team_097 possession (Score: 13-23)
Jrue Haliburton attempts a 3Pt. Contested by Derrick Allen (4.9 feet, ZONE). Jrue Haliburton misses. Rebound secured by Derrick Allen.

[11:50] Team_005 possession (Score: 13-23)
Cade Markkanen drives to the basket... FOUL! Offensive foul on Cade Markkanen! Anthony Haliburton drew the charge! [Team fouls: 1] (Cade Markkanen: 1 personal fouls) TURNOVER! (dead ball)

[11:34] Team_097 possession (Score: 13-23)
Tyrese Stewart attempts a Midrange. Contested by Cade Markkanen (4.6 feet, MAN). Tyrese Stewart misses. Offensive rebound by Tyrese Stewart! Tyrese Stewart kicks it out.

[11:16] Team_097 possession (Score: 13-23)
Shai Poole attempts a Midrange. Contested by Anthony Rozier (5.6 feet, ZONE). SHAI POOLE MAKES IT!
Score: 15-23

[10:59] Team_005 possession (Score: 15-23)
Derrick Allen attempts a 3Pt. Contested by Shai Poole (4.2 feet, ZONE). Derrick Allen misses. Rebound secured by Tyrese Stewart.

[10:43] Team_097 possession (Score: 15-23)
Shai Poole attempts a 3Pt. Contested by Derrick Allen (5.1 feet, ZONE). Shai Poole misses. Rebound secured by Jalen Rozier.

[10:34] Team_005 possession (Score: 15-23)
Brandon George loses control! Ball rolls out of bounds! TURNOVER! (dead ball)

[10:34] Substitution (Team_097): Evan Brogdon OUT → Gary Carter IN (stamina_rule2)

[10:34] Substitution (Team_097): Jrue Haliburton OUT → Dwyane Ginobili IN (stamina_rule2)

[10:34] Substitution (Team_097): Shai Poole OUT → Miles Dosunmu IN (stamina_rule2)

[10:34] Substitution (Team_097): Anthony Haliburton OUT → Joel Simons IN (stamina_rule2)

[10:34] Substitution (Team_097): Tyrese Stewart OUT → Miles Banchero IN (stamina_rule2)

[10:34] Substitution (Team_005): Brandon George OUT → Blake O'Neal IN (stamina_rule2)

[10:34] Substitution (Team_005): Anthony Rozier OUT → Draymond Smith IN (stamina_rule2)

[10:34] Substitution (Team_005): Derrick Allen OUT → Lauri Wade IN (stamina_rule2)

[10:34] Substitution (Team_005): Jalen Rozier OUT → Isaiah Durant IN (stamina_rule2)

[10:34] Substitution (Team_005): Cade Markkanen OUT → Zion Parker IN (stamina_rule2)

[10:17] Team_097 possession (Score: 15-23)
FOUL! Shooting foul on Lauri Wade. Miles Dosunmu to the line for 2 free throws. [Team fouls: 2] (Lauri Wade: 1 personal fouls)   FT 1/2: GOOD   FT 2/2: GOOD Miles Dosunmu makes 2/2 from the line.
Score: 17-23

[10:05] Team_005 possession (Score: 17-23)
Blake O'Neal attempts a Midrange. Contested by Miles Banchero (5.2 feet, ZONE). BLAKE O'NEAL MAKES IT! Assist: Isaiah Durant
Score: 17-25

[09:51] Team_097 possession (Score: 17-25)
Dwyane Ginobili drives, picks up Draymond Smith. Help arrives from Blake O'Neal! Dwyane Ginobili attempts a Layup. Contested by Blake O'Neal (4.2 feet, MAN). Dwyane Ginobili misses. Rebound secured by Lauri Wade.

[09:35] Team_005 possession (Score: 17-25)
Blake O'Neal attempts a 3Pt. Contested by Gary Carter (5.1 feet, MAN). BLAKE O'NEAL MAKES IT! Assist: Zion Parker
Score: 17-28

[09:19] Team_097 possession (Score: 17-28)
Dwyane Ginobili attempts a Midrange. Contested by Draymond Smith (4.2 feet, MAN). DWYANE GINOBILI MAKES IT!
Score: 19-28

[09:05] Team_005 possession (Score: 19-28)
FOUL! Holding foul on Miles Dosunmu. [Team fouls: 1] No free throws, side out. (Miles Dosunmu: 1 personal fouls)

[08:49] Team_005 possession (Score: 19-28)
Blake O'Neal attempts a 3Pt. Contested by Gary Carter (5.1 feet, ZONE). Blake O'Neal misses. Rebound secured by Miles Banchero.

[08:33] Team_097 possession (Score: 19-28)
Miles Banchero drives, Zion Parker stays with him. Miles Banchero attempts a Dunk. Contested by Zion Parker (4.2 feet, MAN). MILES BANCHERO MAKES IT! Assist: Gary Carter
Score: 21-28

[08:19] Team_005 possession (Score: 21-28)
Lauri Wade attempts a 3Pt. Contested by Joel Simons (3.6 feet, ZONE). LAURI WADE MAKES IT!
Score: 21-31

[08:06] Team_097 possession (Score: 21-31)
FOUL! Shooting foul on Zion Parker. Miles Banchero to the line for 2 free throws. [Team fouls: 3] (Zion Parker: 1 personal fouls)   FT 1/2: GOOD   FT 2/2: GOOD Miles Banchero makes 2/2 from the line.
Score: 23-31

[07:55] Team_005 possession (Score: 23-31)
Draymond Smith drives and kicks out. Lauri Wade attempts a Midrange. Contested by Miles Dosunmu (3.8 feet, MAN). Lauri Wade misses. Rebound secured by Miles Dosunmu.

[07:40] Team_097 possession (Score: 23-31)
Gary Carter attempts a Midrange. Contested by Blake O'Neal (3.9 feet, MAN). Gary Carter misses. Rebound secured by Draymond Smith.

[07:26] Team_005 possession (Score: 23-31)
Zion Parker throws a bad pass! Stolen by Joel Simons! TURNOVER! (live ball)

[07:09] Team_097 possession (Score: 23-31)
Joel Simons makes the 3Pt and draws the foul on Blake O'Neal! And-1! Joel Simons to the line for 1. [Team fouls: 4] (Blake O'Neal: 1 personal fouls)   FT 1/1: GOOD Joel Simons makes 1/1 from the line.
Score: 27-31

[06:54] Team_005 possession (Score: 27-31)
Draymond Smith drives, picks up Joel Simons. Help arrives from Dwyane Ginobili! Draymond Smith attempts a Layup. Contested by Dwyane Ginobili (3.3 feet, ZONE). Draymond Smith misses. Rebound secured by Miles Banchero.

[06:40] Team_097 possession (Score: 27-31)
Joel Simons attempts a Layup. Contested by Isaiah Durant (4.6 feet, MAN). JOEL SIMONS MAKES IT! Assist: Miles Dosunmu
Score: 29-31

[06:26] Team_005 possession (Score: 29-31)
Draymond Smith throws a bad pass! Stolen by Dwyane Ginobili! TURNOVER! (live ball)

[06:12] Team_097 possession (Score: 29-31)
Gary Carter drives, Zion Parker stays with him. Gary Carter attempts a Layup. Contested by Zion Parker (3.8 feet, ZONE). GARY CARTER MAKES IT! Assist: Joel Simons
Score: 31-31

[05:59] Team_005 possession (Score: 31-31)
Isaiah Durant attempts a 3Pt. Contested by Joel Simons (3.8 feet, MAN). Isaiah Durant misses. Offensive rebound by Draymond Smith! Draymond Smith kicks it out.

[05:49] Team_005 possession (Score: 31-31)
Blake O'Neal attempts a Layup. BLOCKED BY JOEL SIMONS! Ball is loose! Offensive rebound by Zion Parker! Zion Parker kicks it out.

[05:34] Team_005 possession (Score: 31-31)
Isaiah Durant makes the Layup and draws the foul on Joel Simons! And-1! Isaiah Durant to the line for 1. [Team fouls: 3] (Joel Simons: 1 personal fouls)   FT 1/1: MISS Isaiah Durant makes 0/1 from the line. Rebound secured by Joel Simons.
Score: 31-33

[05:17] Team_097 possession (Score: 31-33)
Miles Dosunmu attempts a Midrange. Contested by Draymond Smith (4.8 feet, ZONE). Miles Dosunmu misses. Offensive rebound by Miles Dosunmu! Miles Dosunmu kicks it out.

[04:59] Team_097 possession (Score: 31-33)
Gary Carter drives and kicks out. Miles Banchero attempts a 3Pt. Contested by Zion Parker (4.0 feet, MAN). Miles Banchero misses. Rebound secured by Zion Parker.

[04:45] Team_005 possession (Score: 31-33)
Blake O'Neal drives and kicks out. Blake O'Neal attempts a 3Pt. Contested by Joel Simons (3.6 feet, ZONE). Blake O'Neal misses. Rebound secured by Miles Dosunmu.

[04:34] Team_097 possession (Score: 31-33)
Gary Carter attempts a 3Pt. Contested by Lauri Wade (4.8 feet, ZONE). Gary Carter misses. Rebound secured by Lauri Wade.

[04:23] Team_005 possession (Score: 31-33)
Draymond Smith attempts a 3Pt. Contested by Dwyane Ginobili (4.4 feet, MAN). Draymond Smith misses. Rebound secured by Miles Dosunmu.

[04:04] Team_097 possession (Score: 31-33)
Miles Dosunmu attempts a Layup. Contested by Zion Parker (4.5 feet, ZONE). Miles Dosunmu misses. Offensive rebound by Miles Dosunmu! Miles Dosunmu kicks it out.

[03:46] Team_097 possession (Score: 31-33)
Dwyane Ginobili attempts a 3Pt. Contested by Lauri Wade (4.9 feet, ZONE). Dwyane Ginobili misses. Rebound secured by Lauri Wade.

[03:32] Team_005 possession (Score: 31-33)
Blake O'Neal drives, Gary Carter stays with him. Blake O'Neal attempts a Dunk. Contested by Gary Carter (5.1 feet, MAN). Blake O'Neal misses. Rebound secured by Miles Banchero.

[03:16] Team_097 possession (Score: 31-33)
Miles Dosunmu attempts a Layup. BLOCKED BY LAURI WADE! Ball deflects out of bounds off Miles Dosunmu.

[03:04] Team_005 possession (Score: 31-33)
Zion Parker attempts a 3Pt. Contested by Gary Carter (4.7 feet, ZONE). Zion Parker misses. Rebound secured by Miles Banchero.

[02:48] Team_097 possession (Score: 31-33)
Miles Banchero drives to the basket... Miles Banchero throws a bad pass out of bounds! TURNOVER! (dead ball)

[02:35] Team_005 possession (Score: 31-33)
Zion Parker makes the Dunk and draws the foul on Joel Simons! And-1! Zion Parker to the line for 1. [Team fouls: 4] (Joel Simons: 2 personal fouls)   FT 1/1: GOOD Zion Parker makes 1/1 from the line.
Score: 31-36

[02:25] Team_097 possession (Score: 31-36)
Joel Simons drives to the basket... Joel Simons loses control! Ball rolls out of bounds! TURNOVER! (dead ball)

[02:08] Team_005 possession (Score: 31-36)
Isaiah Durant attempts a 3Pt. Contested by Joel Simons (3.9 feet, ZONE). Isaiah Durant misses. Rebound secured by Joel Simons.

[01:54] Team_097 possession (Score: 31-36)
Dwyane Ginobili attempts a 3Pt. Contested by Blake O'Neal (4.1 feet, ZONE). Dwyane Ginobili misses. Rebound secured by Lauri Wade.

[01:37] Team_005 possession (Score: 31-36)
Draymond Smith attempts a Midrange. Contested by Dwyane Ginobili (4.5 feet, ZONE). Draymond Smith misses. Offensive rebound by Zion Parker! Zion Parker's putback is no good. Rebound secured by Miles Dosunmu.

[01:21] Team_097 possession (Score: 31-36)
Gary Carter attempts a 3Pt. Contested by Blake O'Neal (4.1 feet, ZONE). Gary Carter misses. Rebound secured by Zion Parker.

[01:10] Team_005 possession (Score: 31-36)
Lauri Wade attempts a 3Pt. Contested by Joel Simons (3.8 feet, ZONE). Lauri Wade misses. Rebound secured by Miles Dosunmu.

[00:55] Team_097 possession (Score: 31-36)
Miles Banchero drives, picks up Zion Parker. Help arrives from Blake O'Neal! Miles Banchero attempts a Dunk. Contested by Blake O'Neal (4.4 feet, MAN). MILES BANCHERO MAKES IT! Assist: Gary Carter
Score: 33-36

[00:43] Team_005 possession (Score: 33-36)
Draymond Smith attempts a Layup. BLOCKED BY JOEL SIMONS! Ball is loose! Offensive rebound by Zion Parker! Zion Parker kicks it out.

[00:27] Team_005 possession (Score: 33-36)
Blake O'Neal attempts a 3Pt. Contested by Gary Carter (5.2 feet, MAN). BLAKE O'NEAL MAKES IT! Assist: Zion Parker
Score: 33-39

[00:12] Team_097 possession (Score: 33-39)
Miles Banchero attempts a Layup. BLOCKED BY ZION PARKER! Ball is loose! Rebound secured by Draymond Smith.

[00:01] Team_005 possession (Score: 33-39)
Draymond Smith drives to the basket... Draymond Smith throws a bad pass! Stolen by Dwyane Ginobili! TURNOVER! (live ball)

================================================================================
                              2ND QUARTER COMPLETE                              
================================================================================

2ND QUARTER SCORE: Team_097 20, Team_005 16

BOX SCORE:
================================================================================

Team_097
--------------------------------------------------------------------------------
Player                MIN  PTS  REB  AST  TO      FG   FG%      3P   3P%
--------------------------------------------------------------------------------
Miles Banchero         11    6    4    0   0   3/4    75.0     0/0   0.0
Joel Simons            11    6    2    1   0   2/2   100.0     0/0   0.0
Shai Poole             14    2    0    0   0   1/2    50.0     0/0   0.0
Miles Dosunmu          11    2    7    1   0   1/2    50.0     0/0   0.0
Dwyane Ginobili        11    2    0    0   0   1/4    25.0     0/0   0.0
Gary Carter            11    2    0    2   0   1/5    20.0     0/0   0.0
Jrue Haliburton        14    0    0    0   0   0/1     0.0     0/0   0.0
Tyrese Stewart         14    0    2    0   0   0/0     0.0     0/0   0.0

TEAM: FG: 9/20 (45.0%), 3PT: 1/7 (14.3%), REB: 14 (3 off, 11 def), AST: 4, TO: 2
TEAM FOULS: 4


Team_005
--------------------------------------------------------------------------------
Player                MIN  PTS  REB  AST  TO      FG   FG%      3P   3P%
--------------------------------------------------------------------------------
Blake O'Neal           11    8    0    0   0   3/6    50.0     0/0   0.0
Lauri Wade             11    3    4    0   0   1/2    50.0     0/0   0.0
Zion Parker            11    3    4    2   0   1/2    50.0     0/0   0.0
Derrick Allen          14    0    1    0   0   0/1     0.0     0/0   0.0
Jalen Rozier           14    0    1    0   0   0/0     0.0     0/0   0.0
Isaiah Durant          11    0    0    1   0   0/2     0.0     0/0   0.0
Draymond Smith         11    0    3    0   0   0/4     0.0     0/0   0.0

TEAM: FG: 5/17 (29.4%), 3PT: 3/9 (33.3%), REB: 14 (4 off, 10 def), AST: 3, TO: 5
TEAM FOULS: 4

================================================================================

================================================================================
                       3RD QUARTER - Team_097 vs Team_005                       
================================================================================

[12:00] Team_097 possession (Score: 33-39)
Anthony Haliburton attempts a 3Pt. Contested by Brandon George (5.6 feet, ZONE). Anthony Haliburton misses. FOUL! Loose ball foul on Cade Markkanen during the rebound battle. [Team fouls: 1] No free throws, side out. (Cade Markkanen: 1 personal fouls)

[11:44] Team_097 possession (Score: 33-39)
FOUL! Shooting foul on Cade Markkanen. Tyrese Stewart to the line for 2 free throws. [Team fouls: 2] (Cade Markkanen: 2 personal fouls)   FT 1/2: GOOD   FT 2/2: GOOD Tyrese Stewart makes 2/2 from the line.
Score: 35-39

[11:34] Team_005 possession (Score: 35-39)
Derrick Allen attempts a Midrange. Contested by Shai Poole (3.8 feet, MAN). Derrick Allen misses. Rebound secured by Shai Poole.

[11:17] Team_097 possession (Score: 35-39)
Tyrese Stewart makes the Midrange and draws the foul on Derrick Allen! And-1! Tyrese Stewart to the line for 1. [Team fouls: 3] (Derrick Allen: 1 personal fouls)   FT 1/1: GOOD Tyrese Stewart makes 1/1 from the line.
Score: 38-39

[11:02] Team_005 possession (Score: 38-39)
Jalen Rozier attempts a 3Pt. Contested by Shai Poole (3.7 feet, ZONE). Jalen Rozier misses. Rebound secured by Shai Poole.

[10:46] Team_097 possession (Score: 38-39)
Evan Brogdon attempts a 3Pt. Contested by Derrick Allen (4.9 feet, ZONE). EVAN BROGDON MAKES IT! Assist: Jrue Haliburton
Score: 41-39

[10:29] Team_005 possession (Score: 41-39)
Cade Markkanen drives, picks up Anthony Haliburton. Help arrives from Jrue Haliburton! Cade Markkanen attempts a Dunk. Contested by Jrue Haliburton (3.1 feet, ZONE). Cade Markkanen misses. Rebound secured by Anthony Haliburton.

[10:15] Team_097 possession (Score: 41-39)
Jrue Haliburton drives, Anthony Rozier stays with him. Jrue Haliburton attempts a Layup. Contested by Anthony Rozier (5.0 feet, MAN). JRUE HALIBURTON MAKES IT! Assist: Evan Brogdon
Score: 43-39

[10:01] Team_005 possession (Score: 43-39)
Cade Markkanen drives, Anthony Haliburton stays with him. Cade Markkanen attempts a Dunk. Contested by Anthony Haliburton (3.1 feet, MAN). CADE MARKKANEN MAKES IT!
Score: 43-41

[09:47] Team_097 possession (Score: 43-41)
Tyrese Stewart attempts a 3Pt. Contested by Derrick Allen (5.1 feet, ZONE). TYRESE STEWART MAKES IT! Assist: Jrue Haliburton
Score: 46-41

[09:32] Team_005 possession (Score: 46-41)
Brandon George drives to the basket... Brandon George loses control! Ball rolls out of bounds! TURNOVER! (dead ball)

[09:21] Team_097 possession (Score: 46-41)
Tyrese Stewart attempts a 3Pt. Contested by Derrick Allen (5.1 feet, ZONE). Tyrese Stewart misses. Rebound secured by Cade Markkanen.

[09:05] Team_005 possession (Score: 46-41)
Anthony Rozier throws a bad pass out of bounds! TURNOVER! (dead ball)

[08:49] Team_097 possession (Score: 46-41)
Evan Brogdon drives to the basket... Evan Brogdon throws a bad pass! Stolen by Jalen Rozier! TURNOVER! (live ball)

[08:35] Team_005 possession (Score: 46-41)
Anthony Rozier attempts a 3Pt. Contested by Jrue Haliburton (5.3 feet, MAN). Anthony Rozier misses. Rebound secured by Anthony Haliburton.

[08:19] Team_097 possession (Score: 46-41)
Evan Brogdon attempts a Midrange. Contested by Derrick Allen (4.9 feet, ZONE). Evan Brogdon misses. Rebound secured by Cade Markkanen.

[08:07] Team_005 possession (Score: 46-41)
Brandon George loses the ball! Stripped by Evan Brogdon! TURNOVER! (live ball)

[07:51] Team_097 possession (Score: 46-41)
Tyrese Stewart makes the Layup and draws the foul on Cade Markkanen! And-1! Tyrese Stewart to the line for 1. [Team fouls: 4] (Cade Markkanen: 3 personal fouls)   FT 1/1: GOOD Tyrese Stewart makes 1/1 from the line.
Score: 49-41

[07:36] Team_005 possession (Score: 49-41)
Anthony Rozier attempts a 3Pt. Contested by Shai Poole (3.5 feet, ZONE). ANTHONY ROZIER MAKES IT!
Score: 49-44

[07:23] Team_097 possession (Score: 49-44)
FOUL! Shooting foul on Cade Markkanen. Anthony Haliburton to the line for 2 free throws. [BONUS: 5 team fouls] (Cade Markkanen: 4 personal fouls)   FT 1/2: GOOD   FT 2/2: GOOD Anthony Haliburton makes 2/2 from the line.
Score: 51-44

[07:07] Team_005 possession (Score: 51-44)
Anthony Rozier attempts a Midrange. Contested by Jrue Haliburton (5.3 feet, MAN). Anthony Rozier misses. Rebound secured by Anthony Haliburton.

[06:53] Team_097 possession (Score: 51-44)
FOUL! Shooting foul on Cade Markkanen. Evan Brogdon to the line for 2 free throws. [BONUS: 6 team fouls] (Cade Markkanen: 5 personal fouls)   FT 1/2: GOOD   FT 2/2: GOOD Evan Brogdon makes 2/2 from the line.
Score: 53-44

[06:37] Team_005 possession (Score: 53-44)
Derrick Allen attempts a 3Pt. Contested by Shai Poole (3.8 feet, MAN). Derrick Allen misses. Rebound secured by Tyrese Stewart.

[06:28] Team_097 possession (Score: 53-44)
Evan Brogdon attempts a 3Pt. Contested by Brandon George (5.8 feet, ZONE). Evan Brogdon misses. Rebound secured by Derrick Allen.

[06:15] Team_005 possession (Score: 53-44)
Jalen Rozier attempts a 3Pt. Contested by Anthony Haliburton (3.6 feet, MAN). JALEN ROZIER MAKES IT! Assist: Brandon George
Score: 53-47

[06:06] Team_097 possession (Score: 53-47)
FOUL! Shooting foul on Cade Markkanen. Tyrese Stewart to the line for 2 free throws. [BONUS: 7 team fouls] (Cade Markkanen: 6 personal fouls) Cade Markkanen FOULS OUT!   FT 1/2: MISS   FT 2/2: MISS Tyrese Stewart makes 0/2 from the line. Rebound secured by Jalen Rozier.

[06:06] Substitution (Team_005): Cade Markkanen OUT (stamina: 79) → Blake O'Neal IN (foul_out)

[05:52] Team_005 possession (Score: 53-47)
Derrick Allen attempts a 3Pt. Contested by Shai Poole (3.8 feet, MAN). Derrick Allen misses. Rebound secured by Anthony Haliburton.

[05:37] Team_097 possession (Score: 53-47)
Shai Poole drives to the basket... FOUL! Offensive foul on Shai Poole! Jalen Rozier drew the charge! [Team fouls: 1] (Shai Poole: 1 personal fouls) TURNOVER! (dead ball)

[05:22] Team_005 possession (Score: 53-47)
FOUL! Holding foul on Evan Brogdon. [Team fouls: 2] No free throws, side out. (Evan Brogdon: 1 personal fouls)

[05:04] Team_005 possession (Score: 53-47)
FOUL! Holding foul on Evan Brogdon. [Team fouls: 3] No free throws, side out. (Evan Brogdon: 2 personal fouls)

[04:52] Team_005 possession (Score: 53-47)
Jalen Rozier drives to the basket... FOUL! Offensive foul on Jalen Rozier! Anthony Haliburton drew the charge! [Team fouls: 8] (Jalen Rozier: 1 personal fouls) TURNOVER! (dead ball)

[04:37] Team_097 possession (Score: 53-47)
FOUL! Reach-in foul on Jalen Rozier during the drive. [IN THE BONUS! 9 team fouls] Evan Brogdon to the line for 2 free throws. (Jalen Rozier: 2 personal fouls)   FT 1/2: GOOD   FT 2/2: GOOD Evan Brogdon makes 2/2 from the line.
Score: 55-47

[04:24] Team_005 possession (Score: 55-47)
Anthony Rozier attempts a Layup. Contested by Tyrese Stewart (5.4 feet, ZONE). Anthony Rozier misses. Offensive rebound by Derrick Allen! Derrick Allen kicks it out.

[04:06] Team_005 possession (Score: 55-47)
FOUL! Holding foul on Shai Poole. [Team fouls: 4] No free throws, side out. (Shai Poole: 2 personal fouls)

[03:50] Team_005 possession (Score: 55-47)
Jalen Rozier drives, Anthony Haliburton stays with him. Jalen Rozier attempts a Dunk. Contested by Anthony Haliburton (3.8 feet, ZONE). JALEN ROZIER MAKES IT! Assist: Derrick Allen
Score: 55-49

[03:38] Team_097 possession (Score: 55-49)
Anthony Haliburton attempts a Layup. BLOCKED BY ANTHONY ROZIER! Ball is loose! Rebound secured by Derrick Allen.

[03:27] Team_005 possession (Score: 55-49)
FOUL! Shooting foul on Anthony Haliburton. Jalen Rozier to the line for 2 free throws. [BONUS: 5 team fouls] (Anthony Haliburton: 1 personal fouls)   FT 1/2: GOOD   FT 2/2: GOOD Jalen Rozier makes 2/2 from the line.
Score: 55-51

[03:10] Team_097 possession (Score: 55-51)
Evan Brogdon attempts a 3Pt. Contested by Blake O'Neal (4.7 feet, MAN). Evan Brogdon misses. Rebound secured by Jalen Rozier.

[02:54] Team_005 possession (Score: 55-51)
Blake O'Neal drives, Anthony Haliburton stays with him. Blake O'Neal attempts a Layup. Contested by Anthony Haliburton (3.9 feet, ZONE). BLAKE O'NEAL MAKES IT! Assist: Anthony Rozier
Score: 55-53

[02:41] Team_097 possession (Score: 55-53)
Tyrese Stewart attempts a Midrange. Contested by Jalen Rozier (6.0 feet, ZONE). TYRESE STEWART MAKES IT! Assist: Evan Brogdon
Score: 57-53

[02:25] Team_005 possession (Score: 57-53)
Anthony Rozier attempts a Midrange. Contested by Jrue Haliburton (5.4 feet, ZONE). ANTHONY ROZIER MAKES IT!
Score: 57-55

[02:11] Team_097 possession (Score: 57-55)
Shai Poole attempts a 3Pt. Contested by Derrick Allen (5.0 feet, MAN). Shai Poole misses. Rebound secured by Jalen Rozier.

[01:59] Team_005 possession (Score: 57-55)
Anthony Rozier loses the ball! Stripped by Jrue Haliburton! TURNOVER! (live ball)

[01:45] Team_097 possession (Score: 57-55)
Jrue Haliburton makes the Dunk and draws the foul on Jalen Rozier! And-1! Jrue Haliburton to the line for 1. [BONUS: 10 team fouls] (Jalen Rozier: 3 personal fouls)   FT 1/1: GOOD Jrue Haliburton makes 1/1 from the line.
Score: 60-55

[01:32] Team_005 possession (Score: 60-55)
Derrick Allen attempts a 3Pt. Contested by Shai Poole (4.1 feet, MAN). DERRICK ALLEN MAKES IT! Assist: Blake O'Neal
Score: 60-58

[01:17] Team_097 possession (Score: 60-58)
Jrue Haliburton attempts a 3Pt. Contested by Blake O'Neal (4.5 feet, ZONE). JRUE HALIBURTON MAKES IT! Assist: Anthony Haliburton
Score: 63-58

[01:04] Team_005 possession (Score: 63-58)
Jalen Rozier attempts a 3Pt. Contested by Shai Poole (4.1 feet, ZONE). Jalen Rozier misses. Rebound secured by Anthony Haliburton.

[00:49] Team_097 possession (Score: 63-58)
Tyrese Stewart drives, Jalen Rozier stays with him. Tyrese Stewart attempts a Layup. Wide open! Jalen Rozier is 6.1 feet away. [ZONE] TYRESE STEWART MAKES IT!
Score: 65-58

[00:37] Team_005 possession (Score: 65-58)
Brandon George attempts a Midrange. Contested by Tyrese Stewart (5.9 feet, ZONE). BRANDON GEORGE MAKES IT!
Score: 65-60

[00:24] Team_097 possession (Score: 65-60)
Evan Brogdon drives, Blake O'Neal stays with him. Evan Brogdon attempts a Dunk. Contested by Blake O'Neal (4.6 feet, MAN). Evan Brogdon misses. Rebound secured by Derrick Allen.

[00:09] Team_005 possession (Score: 65-60)
Derrick Allen attempts a Midrange. BLOCKED BY SHAI POOLE! Ball is loose! Rebound secured by Anthony Haliburton.

================================================================================
                              3RD QUARTER COMPLETE                              
================================================================================

3RD QUARTER SCORE: Team_097 32, Team_005 21

BOX SCORE:
================================================================================

Team_097
--------------------------------------------------------------------------------
Player                MIN  PTS  REB  AST  TO      FG   FG%      3P   3P%
--------------------------------------------------------------------------------
Tyrese Stewart         26   15    2    0   0   6/8    75.0     0/0   0.0
Jrue Haliburton        26    8    0    2   0   3/3   100.0     0/0   0.0
Evan Brogdon           26    7    0    2   0   3/7    42.9     0/0   0.0
Anthony Haliburton     26    2    6    1   0   1/2    50.0     0/0   0.0
Shai Poole             26    0    2    0   0   0/1     0.0     0/0   0.0

TEAM: FG: 13/21 (61.9%), 3PT: 3/7 (42.9%), REB: 10 (1 off, 9 def), AST: 5, TO: 2
TEAM FOULS: 5 [Team_005 in BONUS]


Team_005
--------------------------------------------------------------------------------
Player                MIN  PTS  REB  AST  TO      FG   FG%      3P   3P%
--------------------------------------------------------------------------------
Jalen Rozier           26    7    3    0   0   3/5    60.0     0/0   0.0
Anthony Rozier         26    5    0    1   0   2/4    50.0     0/0   0.0
Derrick Allen          26    3    4    1   0   1/5    20.0     0/0   0.0
Cade Markkanen         20    2    2    0   0   1/2    50.0     0/0   0.0
Brandon George         26    2    0    1   0   1/1   100.0     0/0   0.0
Blake O'Neal           17    2    0    1   0   1/1   100.0     0/0   0.0

TEAM: FG: 9/18 (50.0%), 3PT: 3/8 (37.5%), REB: 9 (1 off, 8 def), AST: 4, TO: 5
TEAM FOULS: 10 [Team_097 in BONUS]

================================================================================

================================================================================
                       4TH QUARTER - Team_097 vs Team_005                       
================================================================================

[12:00] Team_097 possession (Score: 65-60)
FOUL! Shooting foul on Anthony Rozier. Jrue Haliburton to the line for 2 free throws. [Team fouls: 1] (Anthony Rozier: 1 personal fouls)   FT 1/2: GOOD   FT 2/2: GOOD Jrue Haliburton makes 2/2 from the line.
Score: 67-60

[11:46] Team_005 possession (Score: 67-60)
Derrick Allen attempts a 3Pt. Contested by Shai Poole (4.1 feet, ZONE). DERRICK ALLEN MAKES IT! Assist: Cade Markkanen
Score: 67-63

[11:30] Team_097 possession (Score: 67-63)
Tyrese Stewart makes the Layup and draws the foul on Cade Markkanen! And-1! Tyrese Stewart to the line for 1. [Team fouls: 2] (Cade Markkanen: 1 personal fouls)   FT 1/1: GOOD Tyrese Stewart makes 1/1 from the line.
Score: 70-63

[11:18] Team_005 possession (Score: 70-63)
Jalen Rozier attempts a 3Pt. Contested by Evan Brogdon (5.3 feet, ZONE). Jalen Rozier misses. Offensive rebound by Cade Markkanen! Cade Markkanen puts it back in!
Score: 70-65

[11:01] Team_097 possession (Score: 70-65)
Anthony Haliburton makes the Layup and draws the foul on Cade Markkanen! And-1! Anthony Haliburton to the line for 1. [Team fouls: 3] (Cade Markkanen: 2 personal fouls)   FT 1/1: GOOD Anthony Haliburton makes 1/1 from the line.
Score: 73-65

[10:42] Team_005 possession (Score: 73-65)
Derrick Allen attempts a Midrange. Contested by Shai Poole (4.2 feet, MAN). Derrick Allen misses. Rebound secured by Tyrese Stewart.

[10:31] Team_097 possession (Score: 73-65)
Tyrese Stewart drives and kicks out. Evan Brogdon attempts a Midrange. Contested by Brandon George (5.7 feet, MAN). EVAN BROGDON MAKES IT!
Score: 75-65

[10:16] Team_005 possession (Score: 75-65)
Brandon George drives, picks up Anthony Haliburton. Help arrives from Jrue Haliburton! Brandon George attempts a Layup. Contested by Jrue Haliburton (4.0 feet, ZONE). Brandon George misses. Offensive rebound by Derrick Allen! Derrick Allen kicks it out.

[10:05] Team_005 possession (Score: 75-65)
Anthony Rozier drives to the basket... Anthony Rozier loses the ball! Stripped by Anthony Haliburton! TURNOVER! (live ball)

[09:47] Team_097 possession (Score: 75-65)
Jrue Haliburton attempts a 3Pt. Contested by Anthony Rozier (5.7 feet, MAN). Jrue Haliburton misses. Rebound secured by Jalen Rozier.

[09:33] Team_005 possession (Score: 75-65)
Cade Markkanen drives, Tyrese Stewart stays with him. Cade Markkanen attempts a Dunk. Contested by Tyrese Stewart (5.7 feet, MAN). Cade Markkanen misses. Rebound secured by Shai Poole.

[09:17] Team_097 possession (Score: 75-65)
Shai Poole attempts a 3Pt. Contested by Derrick Allen (5.3 feet, ZONE). SHAI POOLE MAKES IT! Assist: Evan Brogdon
Score: 78-65

[08:57] Team_005 possession (Score: 78-65)
Derrick Allen attempts a 3Pt. Contested by Shai Poole (4.4 feet, MAN). Derrick Allen misses. Offensive rebound by Cade Markkanen! Cade Markkanen puts it back in!
Score: 78-67

[08:41] Team_097 possession (Score: 78-67)
Anthony Haliburton attempts a 3Pt. Contested by Derrick Allen (5.2 feet, ZONE). Anthony Haliburton misses. Rebound secured by Cade Markkanen.

[08:29] Team_005 possession (Score: 78-67)
Derrick Allen attempts a 3Pt. Contested by Shai Poole (4.5 feet, MAN). DERRICK ALLEN MAKES IT!
Score: 78-70

[08:14] Team_097 possession (Score: 78-70)
Anthony Haliburton attempts a Midrange. Contested by Cade Markkanen (3.6 feet, MAN). Anthony Haliburton misses. Rebound secured by Cade Markkanen.

[08:00] Team_005 possession (Score: 78-70)
Derrick Allen attempts a Layup. Contested by Anthony Haliburton (4.5 feet, ZONE). DERRICK ALLEN MAKES IT!
Score: 78-72

[07:41] Team_097 possession (Score: 78-72)
Jrue Haliburton loses the ball! Stripped by Anthony Rozier! TURNOVER! (live ball)

[07:22] Team_005 possession (Score: 78-72)
Cade Markkanen drives, Tyrese Stewart stays with him. Cade Markkanen attempts a Dunk. Contested by Tyrese Stewart (5.9 feet, MAN). CADE MARKKANEN MAKES IT! Assist: Brandon George
Score: 78-74

[07:11] Team_097 possession (Score: 78-74)
Anthony Haliburton drives to the basket... Anthony Haliburton loses the ball! Stripped by Cade Markkanen! TURNOVER! (live ball)

[06:55] Team_005 possession (Score: 78-74)
Derrick Allen makes the Midrange and draws the foul on Shai Poole! And-1! Derrick Allen to the line for 1. [Team fouls: 1] (Shai Poole: 1 personal fouls)   FT 1/1: GOOD Derrick Allen makes 1/1 from the line.
Score: 78-77

[06:43] Team_097 possession (Score: 78-77)
Evan Brogdon attempts a 3Pt. Contested by Derrick Allen (5.7 feet, ZONE). Evan Brogdon misses. Rebound secured by Cade Markkanen.

[06:33] Team_005 possession (Score: 78-77)
Derrick Allen attempts a 3Pt. Contested by Shai Poole (4.8 feet, MAN). Derrick Allen misses. FOUL! Loose ball foul on Anthony Haliburton during the rebound battle. [Team fouls: 2] No free throws, side out. (Anthony Haliburton: 1 personal fouls)

[06:18] Team_005 possession (Score: 78-77)
Jalen Rozier makes the Midrange and draws the foul on Anthony Haliburton! And-1! Jalen Rozier to the line for 1. [Team fouls: 3] (Anthony Haliburton: 2 personal fouls)   FT 1/1: GOOD Jalen Rozier makes 1/1 from the line.
Score: 78-80

[06:01] Team_097 possession (Score: 78-80)
Evan Brogdon attempts a Midrange. Wide open! Jalen Rozier is 6.5 feet away. [ZONE] Evan Brogdon misses. Rebound secured by Jalen Rozier.

[05:44] Team_005 possession (Score: 78-80)
Anthony Rozier attempts a 3Pt. Contested by Jrue Haliburton (6.0 feet, MAN). Anthony Rozier misses. Offensive rebound by Cade Markkanen! Cade Markkanen puts it back in!
Score: 78-82

[05:34] Team_097 possession (Score: 78-82)
Anthony Haliburton attempts a Midrange. Wide open! Anthony Rozier is 6.2 feet away. [ZONE] Anthony Haliburton misses. Offensive rebound by Anthony Haliburton! Anthony Haliburton kicks it out.

[05:22] Team_097 possession (Score: 78-82)
Jrue Haliburton drives, picks up Cade Markkanen. Help arrives from Anthony Rozier! Jrue Haliburton attempts a Layup. Contested by Anthony Rozier (3.9 feet, ZONE). JRUE HALIBURTON MAKES IT!
Score: 80-82

[05:09] Team_005 possession (Score: 80-82)
FOUL! Shooting foul on Shai Poole. Derrick Allen to the line for 3 free throws. [Team fouls: 4] (Shai Poole: 2 personal fouls)   FT 1/3: GOOD   FT 2/3: GOOD   FT 3/3: MISS Derrick Allen makes 2/3 from the line. Offensive rebound by Cade Markkanen! Cade Markkanen kicks it out.
Score: 80-84

[04:56] Team_005 possession (Score: 80-84)
Derrick Allen attempts a 3Pt. Contested by Shai Poole (5.0 feet, MAN). Derrick Allen misses. Offensive rebound by Cade Markkanen! Cade Markkanen kicks it out.

[04:38] Team_005 possession (Score: 80-84)
FOUL! Reach-in foul on Tyrese Stewart during the drive. [IN THE BONUS! 5 team fouls] Cade Markkanen to the line for 2 free throws. (Tyrese Stewart: 1 personal fouls)   FT 1/2: GOOD   FT 2/2: GOOD Cade Markkanen makes 2/2 from the line.
Score: 80-86

[04:27] Team_097 possession (Score: 80-86)
FOUL! Reach-in foul on Brandon George during the drive. [Team fouls: 4] No free throws, side out. (Brandon George: 1 personal fouls)

[04:14] Team_097 possession (Score: 80-86)
Jrue Haliburton attempts a 3Pt. Wide open! Anthony Rozier is 6.5 feet away. [MAN] Jrue Haliburton misses. Rebound secured by Derrick Allen.

[04:00] Team_005 possession (Score: 80-86)
Derrick Allen attempts a Midrange. Contested by Shai Poole (5.2 feet, MAN). Derrick Allen misses. Offensive rebound by Derrick Allen! Derrick Allen kicks it out.

[03:45] Team_005 possession (Score: 80-86)
Cade Markkanen attempts a Midrange. Contested by Shai Poole (4.9 feet, ZONE). Cade Markkanen misses. Rebound secured by Anthony Haliburton.

[03:31] Team_097 possession (Score: 80-86)
Shai Poole attempts a 3Pt. Contested by Derrick Allen (6.0 feet, ZONE). Shai Poole misses. Offensive rebound by Anthony Haliburton! Anthony Haliburton kicks it out.

[03:17] Team_097 possession (Score: 80-86)
Tyrese Stewart attempts a Midrange. Contested by Cade Markkanen (4.5 feet, MAN). Tyrese Stewart misses. FOUL! Loose ball foul on Jalen Rozier during the rebound battle. [IN THE BONUS! 5 team fouls] Tyrese Stewart to the line for 2 free throws. (Jalen Rozier: 1 personal fouls)   FT 1/2: GOOD   FT 2/2: MISS Tyrese Stewart makes 1/2 from the line. Offensive rebound by Anthony Haliburton! Anthony Haliburton kicks it out.
Score: 81-86

[03:05] Team_097 possession (Score: 81-86)
Shai Poole attempts a Midrange. Wide open! Anthony Rozier is 6.7 feet away. [ZONE] SHAI POOLE MAKES IT! Assist: Tyrese Stewart
Score: 83-86

[02:51] Team_005 possession (Score: 83-86)
Anthony Rozier attempts a 3Pt. Wide open! Jrue Haliburton is 6.3 feet away. [MAN] ANTHONY ROZIER MAKES IT! Assist: Derrick Allen
Score: 83-89

[02:37] Team_097 possession (Score: 83-89)
Anthony Haliburton attempts a Layup. Contested by Cade Markkanen (4.3 feet, MAN). ANTHONY HALIBURTON MAKES IT! Assist: Shai Poole
Score: 85-89

[02:23] Team_005 possession (Score: 85-89)
Cade Markkanen drives and kicks out. Derrick Allen attempts a 3Pt. Contested by Shai Poole (5.4 feet, ZONE). Derrick Allen misses. Rebound secured by Shai Poole.

[02:08] Team_097 possession (Score: 85-89)
Shai Poole attempts a 3Pt. Wide open! Derrick Allen is 6.2 feet away. [ZONE] SHAI POOLE MAKES IT! Assist: Jrue Haliburton
Score: 88-89

[01:50] Team_005 possession (Score: 88-89)
Brandon George attempts a 3Pt. Wide open! Evan Brogdon is 6.3 feet away. [MAN] Brandon George misses. Rebound secured by Anthony Haliburton.

[01:35] Team_097 possession (Score: 88-89)
Evan Brogdon drives to the basket... Evan Brogdon loses control! Ball rolls out of bounds! TURNOVER! (dead ball)

[01:35] Substitution (Team_097): Evan Brogdon OUT → Gary Carter IN (stamina_rule2)

[01:35] Substitution (Team_097): Jrue Haliburton OUT → Dwyane Ginobili IN (stamina_rule2)

[01:35] Substitution (Team_097): Shai Poole OUT → Miles Dosunmu IN (stamina_rule2)

[01:35] Substitution (Team_097): Anthony Haliburton OUT → Joel Simons IN (stamina_rule2)

[01:35] Substitution (Team_097): Tyrese Stewart OUT → Miles Banchero IN (stamina_rule2)

[01:35] Substitution (Team_005): Brandon George OUT → Blake O'Neal IN (stamina_rule2)

[01:35] Substitution (Team_005): Anthony Rozier OUT → Draymond Smith IN (stamina_rule2)

[01:35] Substitution (Team_005): Derrick Allen OUT → Lauri Wade IN (stamina_rule2)

[01:35] Substitution (Team_005): Jalen Rozier OUT → Isaiah Durant IN (stamina_rule2)

[01:22] Team_005 possession (Score: 88-89)
Draymond Smith loses the ball! Stripped by Dwyane Ginobili! TURNOVER! (live ball)

[01:03] Team_097 possession (Score: 88-89)
Miles Dosunmu attempts a Layup. BLOCKED BY BLAKE O'NEAL! Ball is loose! Offensive rebound by Miles Dosunmu! Miles Dosunmu kicks it out.

[00:48] Team_097 possession (Score: 88-89)
Miles Dosunmu attempts a Midrange. Contested by Lauri Wade (5.5 feet, ZONE). MILES DOSUNMU MAKES IT!
Score: 90-89

[00:31] Team_005 possession (Score: 90-89)
Draymond Smith attempts a Midrange. Contested by Miles Dosunmu (3.6 feet, ZONE). Draymond Smith misses. Rebound secured by Miles Dosunmu.

[00:19] Team_097 possession (Score: 90-89)
Joel Simons attempts a Midrange. Contested by Isaiah Durant (4.6 feet, MAN). JOEL SIMONS MAKES IT! Assist: Gary Carter
Score: 92-89

[00:04] Team_005 possession (Score: 92-89)
Lauri Wade attempts a 3Pt. Contested by Joel Simons (3.6 feet, ZONE). Lauri Wade misses. Rebound secured by Miles Banchero.

================================================================================
                              4TH QUARTER COMPLETE                              
================================================================================

4TH QUARTER SCORE: Team_097 27, Team_005 29

BOX SCORE:
================================================================================

Team_097
--------------------------------------------------------------------------------
Player                MIN  PTS  REB  AST  TO      FG   FG%      3P   3P%
--------------------------------------------------------------------------------
Shai Poole             37    8    2    1   0   3/3   100.0     0/0   0.0
Anthony Haliburton     37    5    5    0   0   2/4    50.0     0/0   0.0
Jrue Haliburton        37    4    0    1   0   2/4    50.0     0/0   0.0
Tyrese Stewart         37    3    1    1   0   1/1   100.0     0/0   0.0
Evan Brogdon           37    2    0    1   0   1/3    33.3     0/0   0.0
Miles Dosunmu          12    2    2    0   0   1/1   100.0     0/0   0.0
Joel Simons            12    2    0    0   0   1/1   100.0     0/0   0.0
Gary Carter            12    0    0    1   0   0/0     0.0     0/0   0.0
Miles Banchero         12    0    1    0   0   0/0     0.0     0/0   0.0

TEAM: FG: 11/17 (64.7%), 3PT: 2/6 (33.3%), REB: 11 (4 off, 7 def), AST: 5, TO: 3
TEAM FOULS: 5 [Team_005 in BONUS]


Team_005
--------------------------------------------------------------------------------
Player                MIN  PTS  REB  AST  TO      FG   FG%      3P   3P%
--------------------------------------------------------------------------------
Derrick Allen          37   11    4    1   0   4/5    80.0     0/0   0.0
Cade Markkanen         32   10    8    1   0   5/8    62.5     0/0   0.0
Jalen Rozier           37    3    2    0   0   1/1   100.0     0/0   0.0
Anthony Rozier         37    3    0    0   0   1/1   100.0     0/0   0.0
Brandon George         37    0    0    1   0   0/1     0.0     0/0   0.0
Draymond Smith         12    0    0    0   0   0/1     0.0     0/0   0.0
Lauri Wade             12    0    0    0   0   0/1     0.0     0/0   0.0

TEAM: FG: 11/18 (61.1%), 3PT: 6/8 (75.0%), REB: 14 (8 off, 6 def), AST: 3, TO: 2
TEAM FOULS: 5 [Team_097 in BONUS]

================================================================================

================================================================================
                               FULL GAME COMPLETE                               
================================================================================

FINAL SCORE: Team_097 92, Team_005 89

SCORING BY QUARTER:
--------------------------------------------------------------------------------
Team                     Q1     Q2     Q3     Q4    FINAL
--------------------------------------------------------------------------------
Team_097                 13     20     32     27       92
Team_005                 23     16     21     29       89
--------------------------------------------------------------------------------

FULL GAME BOX SCORE:
================================================================================

Team_097
--------------------------------------------------------------------------------
Player                MIN  PTS  REB  AST  TO      FG   FG%      3P   3P%      FT STL BLK
--------------------------------------------------------------------------------
Evan Brogdon           37   11    0    3   0   4/14   28.6   1/5    20.0   4/4     1   0
Jrue Haliburton        37   12    0    4   3   5/10   50.0   1/5    20.0   3/3     1   0
Shai Poole             37   13    8    1   1   5/8    62.5   2/4    50.0   2/3     0   1
Anthony Haliburton     37    9   15    1   4   4/9    44.4   0/2     0.0   3/3     2   0
Tyrese Stewart         37   23   13    2   1  10/15   66.7   1/3    33.3   7/10    0   0
Gary Carter            12    2    0    3   2   1/5    20.0   0/2     0.0   0/0     0   0
Dwyane Ginobili        12    2    0    0   0   1/4    25.0   0/2     0.0   0/0     3   0
Miles Dosunmu          12    4    9    1   0   2/3    66.7   0/0     0.0   2/2     0   0
Joel Simons            12    8    2    1   0   3/3   100.0   1/1   100.0   1/1     1   2
Miles Banchero         12    6    5    0   0   3/4    75.0   0/0     0.0   2/2     0   0

TEAM: FG: 38/75 (50.7%), 3PT: 6/24 (25.0%), REB: 51 (12 off, 39 def), AST: 16, TO: 11


Team_005
--------------------------------------------------------------------------------
Player                MIN  PTS  REB  AST  TO      FG   FG%      3P   3P%      FT STL BLK
--------------------------------------------------------------------------------
Brandon George         37    5    0    3   2   2/5    40.0   1/3    33.3   0/0     0   0
Anthony Rozier         37   17    0    1   4   6/9    66.7   5/6    83.3   3/3     1   2
Derrick Allen          37   14   12    3   0   6/17   35.3   4/8    50.0   3/4     0   0
Jalen Rozier           37   16   13    1   2   7/12   58.3   3/6    50.0   4/4     1   0
Cade Markkanen         32   17   14    2   1   6/11   54.5   1/1   100.0   2/2     2   1
Blake O'Neal           18   10    0    1   0   4/7    57.1   2/3    66.7   0/0     0   1
Draymond Smith         12    0    3    0   3   0/5     0.0   0/1     0.0   0/0     0   0
Lauri Wade             12    3    4    0   0   1/3    33.3   1/3    33.3   0/0     0   1
Isaiah Durant          12    0    0    1   0   0/2     0.0   0/1     0.0   0/1     0   0
Zion Parker            11    3    4    2   1   1/2    50.0   0/1     0.0   1/1     0   1

TEAM: FG: 33/73 (45.2%), 3PT: 17/33 (51.5%), REB: 51 (15 off, 36 def), AST: 14, TO: 13

================================================================================
