================================================================================
                        FULL GAME - Team_034 vs Team_043                        
================================================================================

================================================================================
                       1ST QUARTER - Team_034 vs Team_043                       
================================================================================

[12:00] Team_034 possession (Score: 0-0)
Devin Poole attempts a Midrange. Contested by Manu Carter (4.1 feet, ZONE). Devin Poole misses. Rebound secured by Dwyane Dosunmu.

[11:41] Team_043 possession (Score: 0-0)
Manu Carter attempts a Midrange. Contested by Terry Doncic (4.5 feet, MAN). Manu Carter misses. Rebound secured by Terry Doncic.

[11:23] Team_034 possession (Score: 0-0)
Terry Doncic attempts a Midrange. Contested by D'Angelo Iverson (3.0 feet, ZONE). TERRY DONCIC MAKES IT!
Score: 2-0

[11:08] Team_043 possession (Score: 2-0)
FOUL! Shooting foul on Ben Hyland. Manu Carter to the line for 2 free throws. [Team fouls: 1] (Ben Hyland: 1 personal fouls)   FT 1/2: GOOD   FT 2/2: GOOD Manu Carter makes 2/2 from the line.
Score: 2-2

[10:50] Team_034 possession (Score: 2-2)
FOUL! Offensive foul on Terry Doncic! Manu Carter drew the charge! [Team fouls: 2] (Terry Doncic: 1 personal fouls) TURNOVER! (dead ball)

[10:36] Team_043 possession (Score: 2-2)
Malcolm Murray attempts a 3Pt. Contested by Devin Poole (4.0 feet, MAN). Malcolm Murray misses. FOUL! Loose ball foul on Terry Doncic during the rebound battle. [Team fouls: 3] No free throws, side out. (Terry Doncic: 2 personal fouls)

[10:19] Team_043 possession (Score: 2-2)
Dwyane Dosunmu attempts a Layup. Contested by Anthony Bane (5.2 feet, MAN). Dwyane Dosunmu misses. Rebound secured by Terry Doncic.

[10:02] Team_034 possession (Score: 2-2)
Devin Poole attempts a 3Pt. Contested by D'Angelo Iverson (2.8 feet, ZONE). Devin Poole misses. Rebound secured by Manu Carter.

[09:46] Team_043 possession (Score: 2-2)
Malcolm Murray attempts a 3Pt. Contested by Devin Poole (4.0 feet, ZONE). MALCOLM MURRAY MAKES IT!
Score: 2-5

[09:33] Team_034 possession (Score: 2-5)
Terry Doncic makes the Layup and draws the foul on Manu Carter! And-1! Terry Doncic to the line for 1. [Team fouls: 1] (Manu Carter: 1 personal fouls)   FT 1/1: GOOD Terry Doncic makes 1/1 from the line.
Score: 5-5

[09:19] Team_043 possession (Score: 5-5)
FOUL! Holding foul on Cole Antetokounmpo. [Team fouls: 4] No free throws, side out. (Cole Antetokounmpo: 1 personal fouls)

[09:09] Team_043 possession (Score: 5-5)
Magic Durant attempts a Midrange. Contested by Ben Hyland (3.6 feet, MAN). Magic Durant misses. Rebound secured by Terry Doncic.

[08:57] Team_034 possession (Score: 5-5)
FOUL! Shooting foul on D'Angelo Iverson. Devin Poole to the line for 3 free throws. [Team fouls: 2] (D'Angelo Iverson: 1 personal fouls)   FT 1/3: GOOD   FT 2/3: GOOD   FT 3/3: GOOD Devin Poole makes 3/3 from the line.
Score: 8-5

[08:45] Team_043 possession (Score: 8-5)
Manu Carter makes the Layup and draws the foul on Terry Doncic! And-1! Manu Carter to the line for 1. [BONUS: 5 team fouls] (Terry Doncic: 3 personal fouls)   FT 1/1: GOOD Manu Carter makes 1/1 from the line.
Score: 8-8

[08:30] Team_034 possession (Score: 8-8)
Terry Doncic drives, picks up Manu Carter. Help arrives from Malcolm Murray! Terry Doncic attempts a Dunk. Contested by Malcolm Murray (4.3 feet, MAN). TERRY DONCIC MAKES IT!
Score: 10-8

[08:15] Team_043 possession (Score: 10-8)
Magic Durant drives and kicks out. Magic Durant attempts a 3Pt. Contested by Ben Hyland (3.6 feet, MAN). Magic Durant misses. Rebound secured by Cole Antetokounmpo.

[08:01] Team_034 possession (Score: 10-8)
FOUL! Holding foul on Manu Carter. [Team fouls: 3] No free throws, side out. (Manu Carter: 2 personal fouls)

[07:45] Team_034 possession (Score: 10-8)
FOUL! Shooting foul on Manu Carter. Anthony Bane to the line for 2 free throws. [Team fouls: 4] (Manu Carter: 3 personal fouls)   FT 1/2: GOOD   FT 2/2: GOOD Anthony Bane makes 2/2 from the line.
Score: 12-8

[07:33] Team_043 possession (Score: 12-8)
D'Angelo Iverson attempts a 3Pt. Contested by Cole Antetokounmpo (4.6 feet, MAN). D'ANGELO IVERSON MAKES IT! Assist: Malcolm Murray
Score: 12-11

[07:22] Team_034 possession (Score: 12-11)
Anthony Bane drives, Manu Carter stays with him. Anthony Bane attempts a Dunk. Contested by Manu Carter (4.3 feet, MAN). Anthony Bane misses. Rebound secured by Dwyane Dosunmu.

[07:07] Team_043 possession (Score: 12-11)
D'Angelo Iverson makes the Layup and draws the foul on Cole Antetokounmpo! And-1! D'Angelo Iverson to the line for 1. [BONUS: 6 team fouls] (Cole Antetokounmpo: 2 personal fouls)   FT 1/1: GOOD D'Angelo Iverson makes 1/1 from the line.
Score: 12-14

[06:55] Team_034 possession (Score: 12-14)
Cole Antetokounmpo makes the Dunk and draws the foul on Malcolm Murray! And-1! Cole Antetokounmpo to the line for 1. [BONUS: 5 team fouls] (Malcolm Murray: 1 personal fouls)   FT 1/1: GOOD Cole Antetokounmpo makes 1/1 from the line.
Score: 15-14

[06:40] Team_043 possession (Score: 15-14)
Malcolm Murray attempts a 3Pt. Contested by Devin Poole (4.0 feet, ZONE). MALCOLM MURRAY MAKES IT! Assist: Dwyane Dosunmu
Score: 15-17

[06:24] Team_034 possession (Score: 15-17)
FOUL! Reach-in foul on Manu Carter during the drive. [IN THE BONUS! 6 team fouls] Devin Poole to the line for 2 free throws. (Manu Carter: 4 personal fouls)   FT 1/2: GOOD   FT 2/2: GOOD Devin Poole makes 2/2 from the line.
Score: 17-17

[06:14] Team_043 possession (Score: 17-17)
Manu Carter attempts a 3Pt. Contested by Terry Doncic (4.5 feet, ZONE). Manu Carter misses. FOUL! Loose ball foul on Cole Antetokounmpo during the rebound battle. [IN THE BONUS! 7 team fouls] Manu Carter to the line for 2 free throws. (Cole Antetokounmpo: 3 personal fouls)   FT 1/2: GOOD   FT 2/2: MISS Manu Carter makes 1/2 from the line. Rebound secured by Cole Antetokounmpo.
Score: 17-18

[06:04] Team_034 possession (Score: 17-18)
Devin Poole attempts a 3Pt. Contested by Malcolm Murray (3.6 feet, MAN). Devin Poole misses. Rebound secured by Dwyane Dosunmu.

[05:46] Team_043 possession (Score: 17-18)
Dwyane Dosunmu drives to the basket... Dwyane Dosunmu throws a bad pass out of bounds! TURNOVER! (dead ball)

[05:35] Team_034 possession (Score: 17-18)
Terry Doncic attempts a 3Pt. Contested by D'Angelo Iverson (3.0 feet, ZONE). Terry Doncic misses. Rebound secured by D'Angelo Iverson.

[05:26] Team_043 possession (Score: 17-18)
Malcolm Murray drives, Terry Doncic stays with him. Malcolm Murray attempts a Dunk. Contested by Terry Doncic (4.2 feet, ZONE). MALCOLM MURRAY MAKES IT!
Score: 17-20

[05:13] Team_034 possession (Score: 17-20)
Cole Antetokounmpo attempts a Midrange. Contested by D'Angelo Iverson (3.4 feet, MAN). Cole Antetokounmpo misses. Offensive rebound by Anthony Bane! Anthony Bane kicks it out.

[05:02] Team_034 possession (Score: 17-20)
Ben Hyland attempts a 3Pt. Contested by Magic Durant (5.2 feet, MAN). Ben Hyland misses. Offensive rebound by Anthony Bane! Anthony Bane kicks it out.

[04:50] Team_034 possession (Score: 17-20)
Devin Poole drives, Manu Carter stays with him. Devin Poole attempts a Layup. Contested by Manu Carter (4.2 feet, ZONE). Devin Poole misses. Rebound secured by D'Angelo Iverson.

[04:35] Team_043 possession (Score: 17-20)
Manu Carter drives, Terry Doncic stays with him. Manu Carter attempts a Layup. Contested by Terry Doncic (4.6 feet, MAN). Manu Carter misses. Rebound secured by Terry Doncic.

[04:24] Team_034 possession (Score: 17-20)
Anthony Bane drives, Dwyane Dosunmu stays with him. Anthony Bane attempts a Dunk. Contested by Dwyane Dosunmu (5.1 feet, ZONE). ANTHONY BANE MAKES IT! Assist: Ben Hyland
Score: 19-20

[04:13] Team_043 possession (Score: 19-20)
Manu Carter drives to the basket... Manu Carter throws a bad pass! Stolen by Terry Doncic! TURNOVER! (live ball)

[03:58] Team_034 possession (Score: 19-20)
Terry Doncic drives, Manu Carter stays with him. Terry Doncic attempts a Layup. Contested by Manu Carter (4.4 feet, MAN). TERRY DONCIC MAKES IT!
Score: 21-20

[03:48] Team_043 possession (Score: 21-20)
Malcolm Murray drives, Devin Poole stays with him. Malcolm Murray attempts a Layup. Contested by Devin Poole (4.2 feet, MAN). MALCOLM MURRAY MAKES IT!
Score: 21-22

[03:32] Team_034 possession (Score: 21-22)
FOUL! Reach-in foul on Manu Carter during the drive. [IN THE BONUS! 7 team fouls] Terry Doncic to the line for 2 free throws. (Manu Carter: 5 personal fouls)   FT 1/2: MISS   FT 2/2: MISS Terry Doncic makes 0/2 from the line. Rebound secured by Dwyane Dosunmu.

[03:20] Team_043 possession (Score: 21-22)
Malcolm Murray attempts a Midrange. Contested by Ben Hyland (3.9 feet, ZONE). Malcolm Murray misses. Rebound secured by Anthony Bane.

[03:05] Team_034 possession (Score: 21-22)
FOUL! Holding foul on Manu Carter. [IN THE BONUS! 8 team fouls] Terry Doncic to the line for 2 free throws. (Manu Carter: 6 personal fouls) Manu Carter FOULS OUT!   FT 1/2: MISS   FT 2/2: GOOD Terry Doncic makes 1/2 from the line.
Score: 22-22

[03:05] Substitution (Team_043): Manu Carter OUT (stamina: 70) → Jabari Holiday IN (foul_out)

[02:52] Team_043 possession (Score: 22-22)
Magic Durant throws a bad pass out of bounds! TURNOVER! (dead ball)

[02:52] Substitution (Team_034): Devin Poole OUT → Manu Jokic IN (stamina_rule2)

[02:52] Substitution (Team_034): Cole Antetokounmpo OUT → Vince Paul IN (stamina_rule2)

[02:52] Substitution (Team_034): Terry Doncic OUT → Nikola Wagner IN (stamina_rule2)

[02:52] Substitution (Team_034): Anthony Bane OUT → Carmelo Anunoby IN (stamina_rule2)

[02:52] Substitution (Team_043): Malcolm Murray OUT → Ben LaVine IN (stamina_rule2)

[02:52] Substitution (Team_043): Magic Durant OUT → Malcolm Murray IN (stamina_rule2)

[02:52] Substitution (Team_043): Dwyane Dosunmu OUT → Terry Randle IN (stamina_rule2)

[02:41] Team_034 possession (Score: 22-22)
Carmelo Anunoby drives and kicks out. Ben Hyland attempts a 3Pt. Contested by Ben LaVine (5.1 feet, MAN). Ben Hyland misses. Offensive rebound by Vince Paul! Vince Paul puts it back in!
Score: 24-22

[02:23] Team_043 possession (Score: 24-22)
Jabari Holiday attempts a Midrange. Contested by Ben Hyland (4.4 feet, ZONE). JABARI HOLIDAY MAKES IT!
Score: 24-24

[02:06] Team_034 possession (Score: 24-24)
Manu Jokic attempts a 3Pt. Contested by D'Angelo Iverson (3.3 feet, ZONE). Manu Jokic misses. Rebound secured by Malcolm Murray.

[01:50] Team_043 possession (Score: 24-24)
Terry Randle throws a bad pass! Stolen by Carmelo Anunoby! TURNOVER! (live ball)

[01:33] Team_034 possession (Score: 24-24)
Carmelo Anunoby attempts a Layup. Contested by Terry Randle (4.5 feet, MAN). Carmelo Anunoby misses. Rebound secured by D'Angelo Iverson.

[01:17] Team_043 possession (Score: 24-24)
Ben LaVine drives, Nikola Wagner stays with him. Ben LaVine attempts a Layup. Wide open! Nikola Wagner is 6.4 feet away. [ZONE] Ben LaVine misses. Rebound secured by Vince Paul.

[01:06] Team_034 possession (Score: 24-24)
Manu Jokic attempts a 3Pt. Contested by Malcolm Murray (4.3 feet, MAN). Manu Jokic misses. Rebound secured by Terry Randle.

[00:50] Team_043 possession (Score: 24-24)
FOUL! Holding foul on Manu Jokic. [IN THE BONUS! 8 team fouls] Malcolm Murray to the line for 2 free throws. (Manu Jokic: 1 personal fouls)   FT 1/2: GOOD   FT 2/2: GOOD Malcolm Murray makes 2/2 from the line.
Score: 24-26

[00:39] Team_034 possession (Score: 24-26)
Manu Jokic drives and kicks out. Nikola Wagner attempts a Midrange. Contested by D'Angelo Iverson (3.5 feet, ZONE). Nikola Wagner misses. Rebound secured by Malcolm Murray.

[00:26] Team_043 possession (Score: 24-26)
D'Angelo Iverson drives to the basket... D'Angelo Iverson loses the ball! Stripped by Vince Paul! TURNOVER! (live ball)

[00:09] Team_034 possession (Score: 24-26)
Carmelo Anunoby makes the Layup and draws the foul on Malcolm Murray! And-1! Carmelo Anunoby to the line for 1. [BONUS: 9 team fouls] (Malcolm Murray: 2 personal fouls)   FT 1/1: GOOD Carmelo Anunoby makes 1/1 from the line.
Score: 27-26

================================================================================
                              1ST QUARTER COMPLETE                              
================================================================================

1ST QUARTER SCORE: Team_034 27, Team_043 26

BOX SCORE:
================================================================================

Team_034
--------------------------------------------------------------------------------
Player                MIN  PTS  REB  AST  TO      FG   FG%      3P   3P%
--------------------------------------------------------------------------------
Terry Doncic            9   10    4    0   0   5/7    71.4     0/0   0.0
Devin Poole             9    5    0    0   0   2/6    33.3     0/0   0.0
Anthony Bane            9    4    3    0   0   2/3    66.7     0/0   0.0
Carmelo Anunoby         3    3    0    0   0   1/2    50.0     0/0   0.0
Vince Paul              3    2    2    0   0   1/1   100.0     0/0   0.0
Ben Hyland             12    0    0    1   0   0/0     0.0     0/0   0.0
Manu Jokic              3    0    0    0   0   0/3     0.0     0/0   0.0

TEAM: FG: 12/23 (52.2%), 3PT: 1/6 (16.7%), REB: 10 (3 off, 7 def), AST: 1, TO: 1
TEAM FOULS: 8 [Team_043 in BONUS]


Team_043
--------------------------------------------------------------------------------
Player                MIN  PTS  REB  AST  TO      FG   FG%      3P   3P%
--------------------------------------------------------------------------------
Malcolm Murray         12   12    2    1   0   5/6    83.3     0/0   0.0
D'Angelo Iverson       12    6    4    0   0   2/2   100.0     0/0   0.0
Manu Carter             9    5    1    0   0   2/5    40.0     0/0   0.0
Cole Antetokounmpo      9    3    2    0   0   1/1   100.0     0/0   0.0
Jabari Holiday          3    2    0    0   0   1/1   100.0     0/0   0.0
Dwyane Dosunmu          9    0    4    1   0   0/1     0.0     0/0   0.0
Magic Durant            9    0    0    0   0   0/2     0.0     0/0   0.0
Ben LaVine              3    0    0    0   0   0/1     0.0     0/0   0.0
Terry Randle            3    0    1    0   0   0/0     0.0     0/0   0.0

TEAM: FG: 10/18 (55.6%), 3PT: 3/4 (75.0%), REB: 13 (2 off, 11 def), AST: 2, TO: 5
TEAM FOULS: 9 [Team_034 in BONUS]

================================================================================

================================================================================
                       2ND QUARTER - Team_034 vs Team_043                       
================================================================================

[12:00] Substitution (Team_034): Ben Hyland OUT → Damian Turner IN (stamina_rule2)

[12:00] Substitution (Team_043): Malcolm Murray OUT → Jabari Holiday IN (stamina_rule2)

[12:00] Substitution (Team_043): D'Angelo Iverson OUT → Dirk Herro IN (stamina_rule2)

[12:00] Team_034 possession (Score: 27-26)
Terry Doncic commits a violation (traveling/carry)! TURNOVER! (dead ball)

[11:46] Team_043 possession (Score: 27-26)
Dwyane Dosunmu attempts a Midrange. Contested by Cole Antetokounmpo (4.6 feet, ZONE). Dwyane Dosunmu misses. Rebound secured by Terry Doncic.

[11:29] Team_034 possession (Score: 27-26)
Damian Turner attempts a 3Pt. Contested by Magic Durant (5.5 feet, MAN). Damian Turner misses. Rebound secured by Manu Carter.

[11:17] Team_043 possession (Score: 27-26)
FOUL! Holding foul on Cole Antetokounmpo. [Team fouls: 1] No free throws, side out. (Cole Antetokounmpo: 1 personal fouls)

[11:04] Team_043 possession (Score: 27-26)
Magic Durant attempts a 3Pt. Contested by Devin Poole (4.0 feet, ZONE). Magic Durant misses. Rebound secured by Anthony Bane.

[10:49] Team_034 possession (Score: 27-26)
Damian Turner makes the Dunk and draws the foul on Magic Durant! And-1! Damian Turner to the line for 1. [Team fouls: 1] (Magic Durant: 1 personal fouls)   FT 1/1: MISS Damian Turner makes 0/1 from the line. Rebound secured by Manu Carter.
Score: 29-26

[10:34] Team_043 possession (Score: 29-26)
Manu Carter drives, picks up Terry Doncic. Help arrives from Damian Turner! Manu Carter attempts a Dunk. Contested by Damian Turner (4.6 feet, ZONE). MANU CARTER MAKES IT!
Score: 29-28

[10:19] Team_034 possession (Score: 29-28)
Damian Turner drives, picks up Magic Durant. Help arrives from Dirk Herro! Damian Turner attempts a Layup. Contested by Dirk Herro (5.7 feet, MAN). Damian Turner misses. Rebound secured by Manu Carter.

[10:08] Team_043 possession (Score: 29-28)
Dwyane Dosunmu attempts a Midrange. Contested by Anthony Bane (5.3 feet, MAN). DWYANE DOSUNMU MAKES IT! Assist: Manu Carter
Score: 29-30

[09:51] Team_034 possession (Score: 29-30)
Devin Poole drives to the basket... Devin Poole loses control! Ball rolls out of bounds! TURNOVER! (dead ball)

[09:51] Substitution (Team_034): Devin Poole OUT → Manu Jokic IN (stamina_rule2)

[09:51] Substitution (Team_043): Dwyane Dosunmu OUT → Terry Randle IN (stamina_rule2)

[09:33] Team_043 possession (Score: 29-30)
Dirk Herro attempts a 3Pt. Contested by Cole Antetokounmpo (5.0 feet, ZONE). Dirk Herro misses. Rebound secured by Cole Antetokounmpo.

[09:19] Team_034 possession (Score: 29-30)
Damian Turner throws a bad pass out of bounds! TURNOVER! (dead ball)

[09:19] Substitution (Team_043): Magic Durant OUT → Ben LaVine IN (stamina_rule2)

[09:02] Team_043 possession (Score: 29-30)
Jabari Holiday drives and kicks out. Dirk Herro attempts a Midrange. Contested by Anthony Bane (5.4 feet, ZONE). DIRK HERRO MAKES IT! Assist: Jabari Holiday
Score: 29-32

[08:44] Team_034 possession (Score: 29-32)
Terry Doncic attempts a Layup. Contested by Manu Carter (4.5 feet, ZONE). TERRY DONCIC MAKES IT! Assist: Manu Jokic
Score: 31-32

[08:32] Team_043 possession (Score: 31-32)
Jabari Holiday attempts a 3Pt. Contested by Damian Turner (5.9 feet, ZONE). JABARI HOLIDAY MAKES IT! Assist: Manu Carter
Score: 31-35

[08:16] Team_034 possession (Score: 31-35)
Cole Antetokounmpo attempts a 3Pt. Contested by Dirk Herro (4.4 feet, MAN). Cole Antetokounmpo misses. Rebound secured by Terry Randle.

[08:01] Team_043 possession (Score: 31-35)
Dirk Herro attempts a 3Pt. Contested by Cole Antetokounmpo (5.1 feet, MAN). DIRK HERRO MAKES IT! Assist: Jabari Holiday
Score: 31-38

[07:46] Team_034 possession (Score: 31-38)
Anthony Bane drives to the basket... Anthony Bane commits a violation (traveling/carry)! TURNOVER! (dead ball)

[07:46] Substitution (Team_034): Cole Antetokounmpo OUT → Vince Paul IN (stamina_rule2)

[07:46] Substitution (Team_034): Terry Doncic OUT → Nikola Wagner IN (stamina_rule2)

[07:46] Substitution (Team_034): Anthony Bane OUT → Carmelo Anunoby IN (stamina_rule2)

[07:46] Substitution (Team_043): Manu Carter OUT → Joel Murray IN (stamina_rule2)

[07:34] Team_043 possession (Score: 31-38)
Ben LaVine throws a bad pass out of bounds! TURNOVER! (dead ball)

[07:23] Team_034 possession (Score: 31-38)
FOUL! Holding foul on Ben LaVine. [Team fouls: 2] No free throws, side out. (Ben LaVine: 1 personal fouls)

[07:11] Team_034 possession (Score: 31-38)
Nikola Wagner attempts a Midrange. Contested by Joel Murray (5.8 feet, ZONE). Nikola Wagner misses. Rebound secured by Dirk Herro.

[07:00] Team_043 possession (Score: 31-38)
Terry Randle attempts a Midrange. Contested by Vince Paul (4.6 feet, ZONE). TERRY RANDLE MAKES IT! Assist: Joel Murray
Score: 31-40

[06:45] Team_034 possession (Score: 31-40)
FOUL! Reach-in foul on Terry Randle during the drive. [Team fouls: 3] No free throws, side out. (Terry Randle: 1 personal fouls)

[06:31] Team_034 possession (Score: 31-40)
Vince Paul attempts a Layup. Contested by Dirk Herro (4.4 feet, MAN). Vince Paul misses. Rebound secured by Ben LaVine.

[06:13] Team_043 possession (Score: 31-40)
Terry Randle drives, Carmelo Anunoby stays with him. Terry Randle attempts a Layup. Contested by Carmelo Anunoby (5.8 feet, ZONE). TERRY RANDLE MAKES IT!
Score: 31-42

[06:00] Team_034 possession (Score: 31-42)
Manu Jokic attempts a 3Pt. Contested by Jabari Holiday (4.8 feet, MAN). Manu Jokic misses. Rebound secured by Ben LaVine.

[05:49] Team_043 possession (Score: 31-42)
Dirk Herro drives to the basket... FOUL! Offensive foul on Dirk Herro! Vince Paul drew the charge! [Team fouls: 4] (Dirk Herro: 1 personal fouls) TURNOVER! (dead ball)

[05:35] Team_034 possession (Score: 31-42)
Damian Turner attempts a 3Pt. Contested by Ben LaVine (5.5 feet, MAN). Damian Turner misses. Offensive rebound by Vince Paul! Vince Paul puts it back in!
Score: 33-42

[05:23] Team_043 possession (Score: 33-42)
Jabari Holiday attempts a 3Pt. Contested by Vince Paul (4.6 feet, ZONE). Jabari Holiday misses. Rebound secured by Nikola Wagner.

[05:14] Team_034 possession (Score: 33-42)
Carmelo Anunoby attempts a 3Pt. Contested by Dirk Herro (4.1 feet, ZONE). Carmelo Anunoby misses. FOUL! Loose ball foul on Terry Randle during the rebound battle. [IN THE BONUS! 5 team fouls] Carmelo Anunoby to the line for 2 free throws. (Terry Randle: 2 personal fouls)   FT 1/2: GOOD   FT 2/2: GOOD Carmelo Anunoby makes 2/2 from the line.
Score: 35-42

[05:03] Team_043 possession (Score: 35-42)
Joel Murray attempts a 3Pt. Contested by Vince Paul (4.5 feet, ZONE). Joel Murray misses. Rebound secured by Vince Paul.

[04:50] Team_034 possession (Score: 35-42)
Damian Turner attempts a Midrange. Contested by Ben LaVine (5.5 feet, MAN). Damian Turner misses. Offensive rebound by Vince Paul! Vince Paul's putback is no good. Offensive rebound by Vince Paul! Vince Paul kicks it out.

[04:36] Team_034 possession (Score: 35-42)
Nikola Wagner attempts a Layup. BLOCKED BY JOEL MURRAY! Ball is loose! Rebound secured by Dirk Herro.

[04:21] Team_043 possession (Score: 35-42)
Jabari Holiday attempts a 3Pt. Contested by Vince Paul (4.6 feet, ZONE). JABARI HOLIDAY MAKES IT! Assist: Terry Randle
Score: 35-45

[04:10] Team_034 possession (Score: 35-45)
Carmelo Anunoby drives, Terry Randle stays with him. Carmelo Anunoby attempts a Layup. Contested by Terry Randle (4.6 feet, MAN). CARMELO ANUNOBY MAKES IT! Assist: Damian Turner
Score: 37-45

[03:55] Team_043 possession (Score: 37-45)
Jabari Holiday attempts a Layup. Contested by Carmelo Anunoby (5.8 feet, ZONE). Jabari Holiday misses. Rebound secured by Vince Paul.

[03:42] Team_034 possession (Score: 37-45)
Manu Jokic attempts a 3Pt. Contested by Jabari Holiday (5.1 feet, MAN). Manu Jokic misses. Offensive rebound by Carmelo Anunoby! Carmelo Anunoby kicks it out.

[03:31] Team_034 possession (Score: 37-45)
FOUL! Shooting foul on Joel Murray. Nikola Wagner to the line for 2 free throws. [BONUS: 6 team fouls] (Joel Murray: 1 personal fouls)   FT 1/2: GOOD   FT 2/2: GOOD Nikola Wagner makes 2/2 from the line.
Score: 39-45

[03:16] Team_043 possession (Score: 39-45)
FOUL! Shooting foul on Vince Paul. Joel Murray to the line for 3 free throws. [Team fouls: 2] (Vince Paul: 1 personal fouls)   FT 1/3: GOOD   FT 2/3: GOOD   FT 3/3: GOOD Joel Murray makes 3/3 from the line.
Score: 39-48

[03:01] Team_034 possession (Score: 39-48)
Damian Turner attempts a 3Pt. Contested by Dirk Herro (4.5 feet, ZONE). Damian Turner misses. Rebound secured by Dirk Herro.

[02:46] Team_043 possession (Score: 39-48)
Jabari Holiday attempts a Midrange. Contested by Manu Jokic (5.3 feet, MAN). Jabari Holiday misses. Offensive rebound by Dirk Herro! Dirk Herro puts it back in!
Score: 39-50

[02:28] Team_034 possession (Score: 39-50)
FOUL! Reach-in foul on Terry Randle during the drive. [IN THE BONUS! 7 team fouls] Carmelo Anunoby to the line for 2 free throws. (Terry Randle: 3 personal fouls)   FT 1/2: GOOD   FT 2/2: GOOD Carmelo Anunoby makes 2/2 from the line.
Score: 41-50

[02:17] Team_043 possession (Score: 41-50)
Jabari Holiday attempts a Layup. Contested by Manu Jokic (5.3 feet, MAN). Jabari Holiday misses. Rebound secured by Nikola Wagner.

[02:01] Team_034 possession (Score: 41-50)
Nikola Wagner attempts a Midrange. Contested by Dirk Herro (4.4 feet, ZONE). Nikola Wagner misses. Rebound secured by Dirk Herro.

[01:47] Team_043 possession (Score: 41-50)
Terry Randle drives and kicks out. Jabari Holiday attempts a Midrange. Contested by Damian Turner (5.9 feet, ZONE). Jabari Holiday misses. Rebound secured by Carmelo Anunoby.

[01:33] Team_034 possession (Score: 41-50)
Damian Turner attempts a 3Pt. Contested by Ben LaVine (5.7 feet, MAN). Damian Turner misses. Rebound secured by Dirk Herro.

[01:17] Team_043 possession (Score: 41-50)
Joel Murray attempts a Midrange. Wide open! Nikola Wagner is 6.5 feet away. [MAN] Joel Murray misses. Rebound secured by Vince Paul.

[01:02] Team_034 possession (Score: 41-50)
Carmelo Anunoby attempts a 3Pt. Contested by Dirk Herro (4.5 feet, ZONE). Carmelo Anunoby misses. Rebound secured by Dirk Herro.

[00:52] Team_043 possession (Score: 41-50)
Ben LaVine attempts a 3Pt. Contested by Manu Jokic (5.4 feet, ZONE). BEN LAVINE MAKES IT! Assist: Dirk Herro
Score: 41-53

[00:39] Team_034 possession (Score: 41-53)
Damian Turner attempts a Midrange. Contested by Jabari Holiday (5.8 feet, ZONE). Damian Turner misses. Rebound secured by Dirk Herro.

[00:24] Team_043 possession (Score: 41-53)
Dirk Herro makes the Layup and draws the foul on Carmelo Anunoby! And-1! Dirk Herro to the line for 1. [Team fouls: 3] (Carmelo Anunoby: 1 personal fouls)   FT 1/1: GOOD Dirk Herro makes 1/1 from the line.
Score: 41-56

[00:11] Team_034 possession (Score: 41-56)
Damian Turner attempts a 3Pt. Contested by Ben LaVine (5.8 feet, MAN). Damian Turner misses. Rebound secured by Dirk Herro.

================================================================================
                              2ND QUARTER COMPLETE                              
================================================================================

2ND QUARTER SCORE: Team_034 14, Team_043 30

BOX SCORE:
================================================================================

Team_034
--------------------------------------------------------------------------------
Player                MIN  PTS  REB  AST  TO      FG   FG%      3P   3P%
--------------------------------------------------------------------------------
Carmelo Anunoby        11    6    2    0   0   3/4    75.0     0/0   0.0
Terry Doncic           14    2    1    0   0   1/1   100.0     0/0   0.0
Nikola Wagner          11    2    2    0   0   1/4    25.0     0/0   0.0
Vince Paul             11    2    5    0   0   1/2    50.0     0/0   0.0
Damian Turner          12    0    0    1   0   0/7     0.0     0/0   0.0
Anthony Bane           14    0    1    0   0   0/0     0.0     0/0   0.0
Cole Antetokounmpo     14    0    1    0   0   0/1     0.0     0/0   0.0
Manu Jokic             13    0    0    1   0   0/1     0.0     0/0   0.0

TEAM: FG: 6/20 (30.0%), 3PT: 2/9 (22.2%), REB: 12 (3 off, 9 def), AST: 2, TO: 4
TEAM FOULS: 3


Team_043
--------------------------------------------------------------------------------
Player                MIN  PTS  REB  AST  TO      FG   FG%      3P   3P%
--------------------------------------------------------------------------------
Dirk Herro             12   10    9    1   0   4/5    80.0     0/0   0.0
Jabari Holiday         15    6    0    2   0   2/5    40.0     0/0   0.0
Terry Randle           13    4    1    1   0   2/3    66.7     0/0   0.0
Joel Murray             8    3    0    1   0   1/3    33.3     0/0   0.0
Ben LaVine             12    3    2    0   0   1/1   100.0     0/0   0.0
Dwyane Dosunmu         12    2    0    0   0   1/2    50.0     0/0   0.0
Manu Carter            14    2    3    2   0   1/1   100.0     0/0   0.0
Magic Durant           12    0    0    0   0   0/1     0.0     0/0   0.0

TEAM: FG: 12/21 (57.1%), 3PT: 5/9 (55.6%), REB: 15 (1 off, 14 def), AST: 7, TO: 2
TEAM FOULS: 7 [Team_034 in BONUS]

================================================================================

================================================================================
                       3RD QUARTER - Team_034 vs Team_043                       
================================================================================

[12:00] Team_034 possession (Score: 41-56)
Anthony Bane drives to the basket... Anthony Bane throws a bad pass! Stolen by Manu Carter! TURNOVER! (live ball)

[11:46] Team_043 possession (Score: 41-56)
Magic Durant drives to the basket... Magic Durant loses control! Ball rolls out of bounds! TURNOVER! (dead ball)

[11:32] Team_034 possession (Score: 41-56)
Anthony Bane drives, picks up Manu Carter. Help arrives from Malcolm Murray! Anthony Bane attempts a Layup. Contested by Malcolm Murray (4.3 feet, ZONE). Anthony Bane misses. Offensive rebound by Terry Doncic! Terry Doncic's putback is no good. Rebound secured by D'Angelo Iverson.

[11:20] Team_043 possession (Score: 41-56)
Magic Durant attempts a Midrange. Contested by Ben Hyland (3.6 feet, ZONE). MAGIC DURANT MAKES IT!
Score: 41-58

[11:09] Team_034 possession (Score: 41-58)
Devin Poole makes the Layup and draws the foul on Manu Carter! And-1! Devin Poole to the line for 1. [Team fouls: 1] (Manu Carter: 1 personal fouls)   FT 1/1: GOOD Devin Poole makes 1/1 from the line.
Score: 44-58

[10:54] Team_043 possession (Score: 44-58)
Malcolm Murray makes the Midrange and draws the foul on Terry Doncic! And-1! Malcolm Murray to the line for 1. [Team fouls: 1] (Terry Doncic: 1 personal fouls)   FT 1/1: GOOD Malcolm Murray makes 1/1 from the line.
Score: 44-61

[10:39] Team_034 possession (Score: 44-61)
Ben Hyland drives, Manu Carter stays with him. Ben Hyland attempts a Dunk. Contested by Manu Carter (4.2 feet, ZONE). BEN HYLAND MAKES IT!
Score: 46-61

[10:22] Team_043 possession (Score: 46-61)
Manu Carter drives to the basket... Manu Carter loses the ball! Stripped by Terry Doncic! TURNOVER! (live ball)

[10:08] Team_034 possession (Score: 46-61)
Devin Poole attempts a 3Pt. Contested by Magic Durant (5.0 feet, ZONE). Devin Poole misses. Offensive rebound by Terry Doncic! Terry Doncic puts it back in!
Score: 48-61

[09:51] Team_043 possession (Score: 48-61)
Magic Durant attempts a 3Pt. Contested by Devin Poole (3.9 feet, ZONE). Magic Durant misses. Rebound secured by Terry Doncic.

[09:37] Team_034 possession (Score: 48-61)
Cole Antetokounmpo attempts a 3Pt. Contested by D'Angelo Iverson (3.4 feet, ZONE). COLE ANTETOKOUNMPO MAKES IT! Assist: Ben Hyland
Score: 51-61

[09:22] Team_043 possession (Score: 51-61)
Magic Durant drives and kicks out. Malcolm Murray attempts a 3Pt. Contested by Devin Poole (3.9 feet, MAN). Malcolm Murray misses. Rebound secured by Terry Doncic.

[09:07] Team_034 possession (Score: 51-61)
Terry Doncic drives to the basket... Terry Doncic loses the ball! Stripped by Manu Carter! TURNOVER! (live ball)

[08:55] Team_043 possession (Score: 51-61)
D'Angelo Iverson drives and kicks out. Malcolm Murray attempts a 3Pt. Contested by Devin Poole (3.9 feet, ZONE). Malcolm Murray misses. Rebound secured by Anthony Bane.

[08:40] Team_034 possession (Score: 51-61)
Cole Antetokounmpo attempts a 3Pt. Contested by D'Angelo Iverson (3.4 feet, ZONE). Cole Antetokounmpo misses. Rebound secured by Dwyane Dosunmu.

[08:29] Team_043 possession (Score: 51-61)
FOUL! Holding foul on Devin Poole. [Team fouls: 2] No free throws, side out. (Devin Poole: 1 personal fouls)

[08:14] Team_043 possession (Score: 51-61)
Manu Carter drives, picks up Terry Doncic. Help arrives from Ben Hyland! Manu Carter attempts a Layup. Contested by Ben Hyland (4.5 feet, ZONE). MANU CARTER MAKES IT!
Score: 51-63

[07:58] Team_034 possession (Score: 51-63)
Terry Doncic throws a bad pass! Stolen by Manu Carter! TURNOVER! (live ball)

[07:44] Team_043 possession (Score: 51-63)
Manu Carter drives to the basket... Manu Carter throws a bad pass! Stolen by Terry Doncic! TURNOVER! (live ball)

[07:32] Team_034 possession (Score: 51-63)
Devin Poole attempts a 3Pt. Contested by Malcolm Murray (3.6 feet, MAN). Devin Poole misses. Offensive rebound by Anthony Bane! Anthony Bane kicks it out.

[07:22] Team_034 possession (Score: 51-63)
Terry Doncic attempts a 3Pt. Contested by Manu Carter (4.3 feet, MAN). Terry Doncic misses. Rebound secured by Dwyane Dosunmu.

[07:07] Team_043 possession (Score: 51-63)
Magic Durant attempts a Layup. BLOCKED BY BEN HYLAND! Ball is loose! Rebound secured by Anthony Bane.

[06:54] Team_034 possession (Score: 51-63)
FOUL! Shooting foul on Magic Durant. Cole Antetokounmpo to the line for 2 free throws. [Team fouls: 2] (Magic Durant: 1 personal fouls)   FT 1/2: GOOD   FT 2/2: GOOD Cole Antetokounmpo makes 2/2 from the line.
Score: 53-63

[06:40] Team_043 possession (Score: 53-63)
Malcolm Murray attempts a Layup. BLOCKED BY BEN HYLAND! Ball deflects out of bounds off Malcolm Murray.

[06:26] Team_034 possession (Score: 53-63)
Terry Doncic attempts a 3Pt. Contested by D'Angelo Iverson (3.0 feet, ZONE). Terry Doncic misses. Rebound secured by D'Angelo Iverson.

[06:17] Team_043 possession (Score: 53-63)
Malcolm Murray drives, Anthony Bane stays with him. Malcolm Murray attempts a Layup. Contested by Anthony Bane (5.3 feet, ZONE). Malcolm Murray misses. Rebound secured by Terry Doncic.

[06:01] Team_034 possession (Score: 53-63)
Anthony Bane throws a bad pass out of bounds! TURNOVER! (dead ball)

[05:48] Team_043 possession (Score: 53-63)
Malcolm Murray attempts a Layup. Contested by Terry Doncic (4.1 feet, ZONE). MALCOLM MURRAY MAKES IT! Assist: Dwyane Dosunmu
Score: 53-65

[05:38] Team_034 possession (Score: 53-65)
Terry Doncic attempts a Layup. Contested by Manu Carter (4.3 feet, MAN). TERRY DONCIC MAKES IT! Assist: Ben Hyland
Score: 55-65

[05:23] Team_043 possession (Score: 55-65)
Dwyane Dosunmu attempts a Midrange. Contested by Cole Antetokounmpo (4.6 feet, ZONE). DWYANE DOSUNMU MAKES IT! Assist: Malcolm Murray
Score: 55-67

[05:05] Team_034 possession (Score: 55-67)
Devin Poole attempts a Midrange. Contested by D'Angelo Iverson (2.8 feet, ZONE). DEVIN POOLE MAKES IT! Assist: Anthony Bane
Score: 57-67

[04:47] Team_043 possession (Score: 57-67)
FOUL! Offensive foul on Manu Carter! Terry Doncic drew the charge! [Team fouls: 3] (Manu Carter: 2 personal fouls) TURNOVER! (dead ball)

[04:36] Team_034 possession (Score: 57-67)
Cole Antetokounmpo attempts a 3Pt. Contested by D'Angelo Iverson (3.4 feet, MAN). Cole Antetokounmpo misses. Offensive rebound by Terry Doncic! Terry Doncic puts it back in!
Score: 59-67

[04:20] Team_043 possession (Score: 59-67)
Manu Carter makes the Dunk and draws the foul on Anthony Bane! And-1! Manu Carter to the line for 1. [Team fouls: 3] (Anthony Bane: 1 personal fouls)   FT 1/1: GOOD Manu Carter makes 1/1 from the line.
Score: 59-70

[04:08] Team_034 possession (Score: 59-70)
Ben Hyland attempts a Midrange. Contested by Magic Durant (5.3 feet, ZONE). BEN HYLAND MAKES IT! Assist: Anthony Bane
Score: 61-70

[03:52] Team_043 possession (Score: 61-70)
Manu Carter attempts a 3Pt. Contested by Devin Poole (4.6 feet, ZONE). MANU CARTER MAKES IT! Assist: Magic Durant
Score: 61-73

[03:41] Team_034 possession (Score: 61-73)
FOUL! Offensive foul on Cole Antetokounmpo! D'Angelo Iverson drew the charge! [Team fouls: 4] (Cole Antetokounmpo: 1 personal fouls) TURNOVER! (dead ball)

[03:29] Team_043 possession (Score: 61-73)
Malcolm Murray attempts a 3Pt. Contested by Devin Poole (4.2 feet, ZONE). MALCOLM MURRAY MAKES IT! Assist: Magic Durant
Score: 61-76

[03:12] Team_034 possession (Score: 61-76)
Devin Poole attempts a Midrange. Contested by Malcolm Murray (3.8 feet, MAN). DEVIN POOLE MAKES IT! Assist: Cole Antetokounmpo
Score: 63-76

[02:58] Team_043 possession (Score: 63-76)
Dwyane Dosunmu attempts a Midrange. Contested by Ben Hyland (3.8 feet, ZONE). DWYANE DOSUNMU MAKES IT!
Score: 63-78

[02:46] Team_034 possession (Score: 63-78)
Anthony Bane drives and kicks out. Ben Hyland attempts a 3Pt. Contested by Magic Durant (5.4 feet, MAN). BEN HYLAND MAKES IT! Assist: Devin Poole
Score: 66-78

[02:32] Team_043 possession (Score: 66-78)
FOUL! Holding foul on Anthony Bane. [IN THE BONUS! 5 team fouls] Dwyane Dosunmu to the line for 2 free throws. (Anthony Bane: 2 personal fouls)   FT 1/2: GOOD   FT 2/2: MISS Dwyane Dosunmu makes 1/2 from the line. Rebound secured by Terry Doncic.
Score: 66-79

[02:21] Team_034 possession (Score: 66-79)
Devin Poole attempts a 3Pt. Contested by D'Angelo Iverson (3.1 feet, ZONE). Devin Poole misses. Rebound secured by D'Angelo Iverson.

[02:10] Team_043 possession (Score: 66-79)
FOUL! Reach-in foul on Ben Hyland during the drive. [IN THE BONUS! 6 team fouls] Magic Durant to the line for 2 free throws. (Ben Hyland: 1 personal fouls)   FT 1/2: GOOD   FT 2/2: GOOD Magic Durant makes 2/2 from the line.
Score: 66-81

[01:55] Team_034 possession (Score: 66-81)
Cole Antetokounmpo drives and kicks out. FOUL! Shooting foul on D'Angelo Iverson. Anthony Bane to the line for 2 free throws. [Team fouls: 4] (D'Angelo Iverson: 1 personal fouls)   FT 1/2: GOOD   FT 2/2: GOOD Anthony Bane makes 2/2 from the line.
Score: 68-81

[01:42] Team_043 possession (Score: 68-81)
FOUL! Holding foul on Devin Poole. [IN THE BONUS! 7 team fouls] Malcolm Murray to the line for 2 free throws. (Devin Poole: 2 personal fouls)   FT 1/2: GOOD   FT 2/2: GOOD Malcolm Murray makes 2/2 from the line.
Score: 68-83

[01:24] Team_034 possession (Score: 68-83)
Ben Hyland attempts a 3Pt. Contested by D'Angelo Iverson (3.4 feet, ZONE). Ben Hyland misses. Rebound secured by Manu Carter.

[01:10] Team_043 possession (Score: 68-83)
Manu Carter attempts a 3Pt. Contested by Terry Doncic (5.0 feet, MAN). Manu Carter misses. Rebound secured by Terry Doncic.

[00:56] Team_034 possession (Score: 68-83)
Terry Doncic attempts a 3Pt. Contested by Manu Carter (4.8 feet, MAN). Terry Doncic misses. Rebound secured by Dwyane Dosunmu.

[00:42] Team_043 possession (Score: 68-83)
Magic Durant attempts a 3Pt. Contested by Devin Poole (4.5 feet, ZONE). MAGIC DURANT MAKES IT!
Score: 68-86

[00:27] Team_034 possession (Score: 68-86)
Ben Hyland attempts a 3Pt. Contested by D'Angelo Iverson (3.5 feet, ZONE). BEN HYLAND MAKES IT! Assist: Terry Doncic
Score: 71-86

[00:16] Team_043 possession (Score: 71-86)
Magic Durant attempts a Midrange. Contested by Ben Hyland (4.1 feet, MAN). MAGIC DURANT MAKES IT! Assist: Manu Carter
Score: 71-88

[00:05] Team_034 possession (Score: 71-88)
Terry Doncic drives, Manu Carter stays with him. Terry Doncic attempts a Dunk. Contested by Manu Carter (4.9 feet, ZONE). TERRY DONCIC MAKES IT! Assist: Devin Poole
Score: 73-88

================================================================================
                              3RD QUARTER COMPLETE                              
================================================================================

3RD QUARTER SCORE: Team_034 32, Team_043 32

BOX SCORE:
================================================================================

Team_034
--------------------------------------------------------------------------------
Player                MIN  PTS  REB  AST  TO      FG   FG%      3P   3P%
--------------------------------------------------------------------------------
Ben Hyland             25   10    0    2   0   4/5    80.0     0/0   0.0
Terry Doncic           26    8    7    1   0   4/7    57.1     0/0   0.0
Devin Poole            24    7    0    2   0   3/4    75.0     0/0   0.0
Cole Antetokounmpo     26    5    0    1   0   2/3    66.7     0/0   0.0
Anthony Bane           26    2    3    2   0   1/2    50.0     0/0   0.0

TEAM: FG: 14/21 (66.7%), 3PT: 4/10 (40.0%), REB: 11 (4 off, 7 def), AST: 8, TO: 5
TEAM FOULS: 7 [Team_043 in BONUS]


Team_043
--------------------------------------------------------------------------------
Player                MIN  PTS  REB  AST  TO      FG   FG%      3P   3P%
--------------------------------------------------------------------------------
Malcolm Murray         25   10    0    1   0   4/6    66.7     0/0   0.0
Magic Durant           24    9    0    2   0   4/7    57.1     0/0   0.0
Manu Carter            26    8    1    1   0   3/4    75.0     0/0   0.0
Dwyane Dosunmu         24    4    3    1   0   2/2   100.0     0/0   0.0
D'Angelo Iverson       25    0    3    0   0   0/1     0.0     0/0   0.0

TEAM: FG: 13/21 (61.9%), 3PT: 3/5 (60.0%), REB: 6 (0 off, 6 def), AST: 5, TO: 4
TEAM FOULS: 4

================================================================================

================================================================================
                       4TH QUARTER - Team_034 vs Team_043                       
================================================================================

[12:00] Substitution (Team_034): Devin Poole OUT (stamina: 65) → Manu Jokic IN (comeback_detected)

[12:00] Substitution (Team_043): Malcolm Murray OUT (stamina: 68) → Jabari Holiday IN (comeback_detected)

[12:00] Team_034 possession (Score: 73-88)
FOUL! Shooting foul on Manu Carter. Terry Doncic to the line for 2 free throws. [Team fouls: 1] (Manu Carter: 1 personal fouls)   FT 1/2: GOOD   FT 2/2: GOOD Terry Doncic makes 2/2 from the line.
Score: 75-88

[11:42] Team_043 possession (Score: 75-88)
Manu Carter drives to the basket... Manu Carter throws a bad pass! Stolen by Anthony Bane! TURNOVER! (live ball)

[11:27] Team_034 possession (Score: 75-88)
Ben Hyland attempts a 3Pt. Contested by D'Angelo Iverson (3.4 feet, ZONE). Ben Hyland misses. Rebound secured by Manu Carter.

[11:12] Team_043 possession (Score: 75-88)
Manu Carter attempts a 3Pt. Contested by Terry Doncic (4.9 feet, MAN). Manu Carter misses. Rebound secured by Cole Antetokounmpo.

[10:53] Team_034 possession (Score: 75-88)
Manu Jokic attempts a 3Pt. Contested by D'Angelo Iverson (3.5 feet, ZONE). Manu Jokic misses. Rebound secured by Manu Carter.

[10:40] Team_043 possession (Score: 75-88)
Magic Durant attempts a 3Pt. Contested by Ben Hyland (4.0 feet, ZONE). MAGIC DURANT MAKES IT! Assist: D'Angelo Iverson
Score: 75-91

[10:26] Team_034 possession (Score: 75-91)
Anthony Bane attempts a Midrange. Contested by Manu Carter (4.8 feet, MAN). Anthony Bane misses. Rebound secured by D'Angelo Iverson.

[10:15] Team_043 possession (Score: 75-91)
Dwyane Dosunmu drives to the basket... Dwyane Dosunmu throws a bad pass! Stolen by Terry Doncic! TURNOVER! (live ball)

[10:03] Team_034 possession (Score: 75-91)
Anthony Bane attempts a Midrange. Contested by Manu Carter (4.9 feet, MAN). Anthony Bane misses. Offensive rebound by Terry Doncic! Terry Doncic kicks it out.

[09:49] Team_034 possession (Score: 75-91)
Terry Doncic makes the Layup and draws the foul on Manu Carter! And-1! Terry Doncic to the line for 1. [Team fouls: 2] (Manu Carter: 2 personal fouls)   FT 1/1: GOOD Terry Doncic makes 1/1 from the line.
Score: 78-91

[09:36] Team_043 possession (Score: 78-91)
FOUL! Shooting foul on Manu Jokic. Jabari Holiday to the line for 3 free throws. [Team fouls: 1] (Manu Jokic: 1 personal fouls)   FT 1/3: GOOD   FT 2/3: GOOD   FT 3/3: GOOD Jabari Holiday makes 3/3 from the line.
Score: 78-94

[09:26] Team_034 possession (Score: 78-94)
FOUL! Reach-in foul on Jabari Holiday during the drive. [Team fouls: 3] No free throws, side out. (Jabari Holiday: 1 personal fouls)

[09:10] Team_034 possession (Score: 78-94)
FOUL! Shooting foul on Magic Durant. Ben Hyland to the line for 3 free throws. [Team fouls: 4] (Magic Durant: 1 personal fouls)   FT 1/3: GOOD   FT 2/3: GOOD   FT 3/3: GOOD Ben Hyland makes 3/3 from the line.
Score: 81-94

[08:55] Team_043 possession (Score: 81-94)
Manu Carter throws a bad pass out of bounds! TURNOVER! (dead ball)

[08:55] Substitution (Team_034): Ben Hyland OUT → Damian Turner IN (stamina_rule2)

[08:55] Substitution (Team_034): Cole Antetokounmpo OUT → Vince Paul IN (stamina_rule2)

[08:55] Substitution (Team_034): Terry Doncic OUT → Nikola Wagner IN (stamina_rule2)

[08:55] Substitution (Team_034): Anthony Bane OUT → Carmelo Anunoby IN (stamina_rule2)

[08:55] Substitution (Team_043): Magic Durant OUT → Ben LaVine IN (stamina_rule2)

[08:55] Substitution (Team_043): D'Angelo Iverson OUT → Dirk Herro IN (stamina_rule2)

[08:55] Substitution (Team_043): Manu Carter OUT → Joel Murray IN (stamina_rule2)

[08:55] Substitution (Team_043): Dwyane Dosunmu OUT → Terry Randle IN (stamina_rule2)

[08:38] Team_034 possession (Score: 81-94)
Nikola Wagner drives to the basket... FOUL! Offensive foul on Nikola Wagner! Joel Murray drew the charge! [Team fouls: 2] (Nikola Wagner: 1 personal fouls) TURNOVER! (dead ball)

[08:21] Team_043 possession (Score: 81-94)
Terry Randle drives, Carmelo Anunoby stays with him. Terry Randle attempts a Layup. Contested by Carmelo Anunoby (5.8 feet, MAN). Terry Randle misses. Rebound secured by Carmelo Anunoby.

[08:08] Team_034 possession (Score: 81-94)
Carmelo Anunoby drives and kicks out. Manu Jokic attempts a 3Pt. Contested by Dirk Herro (4.0 feet, ZONE). Manu Jokic misses. Rebound secured by Terry Randle.

[07:53] Team_043 possession (Score: 81-94)
FOUL! Shooting foul on Vince Paul. Dirk Herro to the line for 2 free throws. [Team fouls: 3] (Vince Paul: 1 personal fouls)   FT 1/2: GOOD   FT 2/2: GOOD Dirk Herro makes 2/2 from the line.
Score: 81-96

[07:37] Team_034 possession (Score: 81-96)
Vince Paul throws a bad pass out of bounds! TURNOVER! (dead ball)

[07:25] Team_043 possession (Score: 81-96)
Jabari Holiday attempts a Midrange. Wide open! Nikola Wagner is 6.5 feet away. [ZONE] Jabari Holiday misses. Rebound secured by Vince Paul.

[07:09] Team_034 possession (Score: 81-96)
Carmelo Anunoby makes the Layup and draws the foul on Terry Randle! And-1! Carmelo Anunoby to the line for 1. [BONUS: 5 team fouls] (Terry Randle: 1 personal fouls)   FT 1/1: GOOD Carmelo Anunoby makes 1/1 from the line.
Score: 84-96

[06:57] Team_043 possession (Score: 84-96)
FOUL! Holding foul on Manu Jokic. [Team fouls: 4] No free throws, side out. (Manu Jokic: 2 personal fouls)

[06:45] Team_043 possession (Score: 84-96)
Joel Murray attempts a Midrange. Wide open! Nikola Wagner is 6.3 feet away. [MAN] JOEL MURRAY MAKES IT! Assist: Jabari Holiday
Score: 84-98

[06:30] Team_034 possession (Score: 84-98)
FOUL! Holding foul on Ben LaVine. [IN THE BONUS! 6 team fouls] Damian Turner to the line for 2 free throws. (Ben LaVine: 1 personal fouls)   FT 1/2: GOOD   FT 2/2: MISS Damian Turner makes 1/2 from the line. Offensive rebound by Carmelo Anunoby! Carmelo Anunoby kicks it out.
Score: 85-98

[06:19] Team_034 possession (Score: 85-98)
Carmelo Anunoby attempts a Layup. Contested by Terry Randle (4.5 feet, ZONE). Carmelo Anunoby misses. FOUL! Loose ball foul on Terry Randle during the rebound battle. [IN THE BONUS! 7 team fouls] Carmelo Anunoby to the line for 2 free throws. (Terry Randle: 2 personal fouls)   FT 1/2: GOOD   FT 2/2: MISS Carmelo Anunoby makes 1/2 from the line. Rebound secured by Ben LaVine.
Score: 86-98

[06:03] Team_043 possession (Score: 86-98)
Joel Murray makes the Layup and draws the foul on Carmelo Anunoby! And-1! Joel Murray to the line for 1. [BONUS: 5 team fouls] (Carmelo Anunoby: 1 personal fouls)   FT 1/1: GOOD Joel Murray makes 1/1 from the line.
Score: 86-101

[05:48] Team_034 possession (Score: 86-101)
Manu Jokic drives, picks up Terry Randle. Help arrives from Ben LaVine! Manu Jokic attempts a Dunk. Contested by Ben LaVine (4.4 feet, ZONE). Manu Jokic misses. Rebound secured by Terry Randle.

[05:34] Team_043 possession (Score: 86-101)
FOUL! Shooting foul on Carmelo Anunoby. Terry Randle to the line for 2 free throws. [BONUS: 6 team fouls] (Carmelo Anunoby: 2 personal fouls)   FT 1/2: GOOD   FT 2/2: GOOD Terry Randle makes 2/2 from the line.
Score: 86-103

[05:22] Team_034 possession (Score: 86-103)
Vince Paul attempts a 3Pt. Contested by Dirk Herro (4.4 feet, MAN). Vince Paul misses. Rebound secured by Terry Randle.

[05:08] Team_043 possession (Score: 86-103)
Ben LaVine loses the ball! Stripped by Damian Turner! TURNOVER! (live ball)

[04:54] Team_034 possession (Score: 86-103)
Carmelo Anunoby drives and kicks out. Damian Turner attempts a 3Pt. Contested by Ben LaVine (5.1 feet, MAN). Damian Turner misses. Rebound secured by Ben LaVine.

[04:34] Team_043 possession (Score: 86-103)
Ben LaVine attempts a 3Pt. Contested by Vince Paul (4.6 feet, ZONE). Ben LaVine misses. Rebound secured by Nikola Wagner.

[04:19] Team_034 possession (Score: 86-103)
Nikola Wagner attempts a Midrange. Contested by Joel Murray (5.8 feet, MAN). Nikola Wagner misses. Rebound secured by Dirk Herro.

[04:02] Team_043 possession (Score: 86-103)
Terry Randle makes the Dunk and draws the foul on Carmelo Anunoby! And-1! Terry Randle to the line for 1. [BONUS: 7 team fouls] (Carmelo Anunoby: 3 personal fouls)   FT 1/1: GOOD Terry Randle makes 1/1 from the line.
Score: 86-106

[03:48] Team_034 possession (Score: 86-106)
Manu Jokic attempts a 3Pt. Contested by Dirk Herro (4.0 feet, ZONE). Manu Jokic misses. Rebound secured by Ben LaVine.

[03:31] Team_043 possession (Score: 86-106)
FOUL! Shooting foul on Nikola Wagner. Terry Randle to the line for 2 free throws. [BONUS: 8 team fouls] (Nikola Wagner: 2 personal fouls)   FT 1/2: MISS   FT 2/2: MISS Terry Randle makes 0/2 from the line. Rebound secured by Carmelo Anunoby.

[03:14] Team_034 possession (Score: 86-106)
FOUL! Holding foul on Jabari Holiday. [IN THE BONUS! 8 team fouls] Manu Jokic to the line for 2 free throws. (Jabari Holiday: 2 personal fouls)   FT 1/2: GOOD   FT 2/2: GOOD Manu Jokic makes 2/2 from the line.
Score: 88-106

[03:00] Team_043 possession (Score: 88-106)
Dirk Herro drives and kicks out. Dirk Herro attempts a Midrange. Contested by Vince Paul (4.2 feet, ZONE). Dirk Herro misses. Rebound secured by Carmelo Anunoby.

[02:45] Team_034 possession (Score: 88-106)
Manu Jokic makes the Layup and draws the foul on Dirk Herro! And-1! Manu Jokic to the line for 1. [BONUS: 9 team fouls] (Dirk Herro: 1 personal fouls)   FT 1/1: GOOD Manu Jokic makes 1/1 from the line.
Score: 91-106

[02:31] Team_043 possession (Score: 91-106)
Terry Randle attempts a Layup. Contested by Carmelo Anunoby (5.8 feet, ZONE). Terry Randle misses. Rebound secured by Vince Paul.

[02:17] Team_034 possession (Score: 91-106)
Carmelo Anunoby makes the Layup and draws the foul on Terry Randle! And-1! Carmelo Anunoby to the line for 1. [BONUS: 10 team fouls] (Terry Randle: 3 personal fouls)   FT 1/1: MISS Carmelo Anunoby makes 0/1 from the line. FOUL! Loose ball foul on Ben LaVine during the free throw rebound! [IN THE BONUS! 11 team fouls] Carmelo Anunoby to the line for 2 free throws. (Ben LaVine: 2 personal fouls)   FT 1/2: GOOD   FT 2/2: GOOD Carmelo Anunoby makes 2/2 from the line.
Score: 95-106

[01:59] Team_043 possession (Score: 95-106)
Ben LaVine attempts a 3Pt. Contested by Vince Paul (4.6 feet, ZONE). BEN LAVINE MAKES IT! Assist: Dirk Herro
Score: 95-109

[01:46] Team_034 possession (Score: 95-109)
Vince Paul attempts a Midrange. Contested by Dirk Herro (4.4 feet, MAN). Vince Paul misses. Offensive rebound by Vince Paul! Vince Paul's putback is no good. Offensive rebound by Vince Paul! Vince Paul kicks it out.

[01:34] Team_034 possession (Score: 95-109)
Carmelo Anunoby drives to the basket... Carmelo Anunoby loses the ball! Stripped by Terry Randle! TURNOVER! (live ball)

[01:19] Team_043 possession (Score: 95-109)
FOUL! Holding foul on Damian Turner. [IN THE BONUS! 9 team fouls] Ben LaVine to the line for 2 free throws. (Damian Turner: 1 personal fouls)   FT 1/2: MISS   FT 2/2: GOOD Ben LaVine makes 1/2 from the line.
Score: 95-110

[01:07] Team_034 possession (Score: 95-110)
Vince Paul drives and kicks out. Manu Jokic attempts a 3Pt. Contested by Jabari Holiday (5.1 feet, MAN). MANU JOKIC MAKES IT! Assist: Vince Paul
Score: 98-110

[00:53] Team_043 possession (Score: 98-110)
FOUL! Holding foul on Carmelo Anunoby. [IN THE BONUS! 10 team fouls] Terry Randle to the line for 2 free throws. (Carmelo Anunoby: 4 personal fouls)   FT 1/2: GOOD   FT 2/2: GOOD Terry Randle makes 2/2 from the line.
Score: 98-112

[00:44] Team_034 possession (Score: 98-112)
Manu Jokic attempts a 3Pt. Contested by Jabari Holiday (5.1 feet, MAN). Manu Jokic misses. Rebound secured by Terry Randle.

[00:28] Team_043 possession (Score: 98-112)
FOUL! Offensive foul on Jabari Holiday! Manu Jokic drew the charge! [Team fouls: 12] (Jabari Holiday: 3 personal fouls) TURNOVER! (dead ball)

[00:14] Team_034 possession (Score: 98-112)
Nikola Wagner attempts a 3Pt. Contested by Joel Murray (6.0 feet, MAN). Nikola Wagner misses. Rebound secured by Ben LaVine.

================================================================================
                              4TH QUARTER COMPLETE                              
================================================================================

4TH QUARTER SCORE: Team_034 25, Team_043 24

BOX SCORE:
================================================================================

Team_034
--------------------------------------------------------------------------------
Player                MIN  PTS  REB  AST  TO      FG   FG%      3P   3P%
--------------------------------------------------------------------------------
Manu Jokic             25    8    0    0   0   3/7    42.9     0/0   0.0
Carmelo Anunoby        19    7    4    0   0   2/5    40.0     0/0   0.0
Terry Doncic           29    5    1    0   0   2/2   100.0     0/0   0.0
Ben Hyland             28    3    0    0   0   1/2    50.0     0/0   0.0
Cole Antetokounmpo     29    0    1    0   0   0/0     0.0     0/0   0.0
Anthony Bane           29    0    0    0   0   0/1     0.0     0/0   0.0
Vince Paul             19    0    3    1   0   0/1     0.0     0/0   0.0
Nikola Wagner          19    0    1    0   0   0/2     0.0     0/0   0.0

TEAM: FG: 8/20 (40.0%), 3PT: 1/7 (14.3%), REB: 11 (4 off, 7 def), AST: 1, TO: 3
TEAM FOULS: 10 [Team_043 in BONUS]


Team_043
--------------------------------------------------------------------------------
Player                MIN  PTS  REB  AST  TO      FG   FG%      3P   3P%
--------------------------------------------------------------------------------
Terry Randle           21    7    4    0   0   3/6    50.0     0/0   0.0
Joel Murray            16    5    0    0   0   2/2   100.0     0/0   0.0
Ben LaVine             21    4    4    0   0   2/3    66.7     0/0   0.0
Magic Durant           28    3    0    0   0   1/1   100.0     0/0   0.0
Jabari Holiday         27    3    0    1   0   1/2    50.0     0/0   0.0
Dirk Herro             21    2    1    1   0   1/2    50.0     0/0   0.0
Manu Carter            29    0    2    0   0   0/1     0.0     0/0   0.0
D'Angelo Iverson       28    0    1    1   0   0/0     0.0     0/0   0.0

TEAM: FG: 10/17 (58.8%), 3PT: 3/5 (60.0%), REB: 11 (0 off, 11 def), AST: 3, TO: 5
TEAM FOULS: 12 [Team_034 in BONUS]

================================================================================

================================================================================
                               FULL GAME COMPLETE                               
================================================================================

FINAL SCORE: Team_034 98, Team_043 112

SCORING BY QUARTER:
--------------------------------------------------------------------------------
Team                     Q1     Q2     Q3     Q4    FINAL
--------------------------------------------------------------------------------
Team_034                 27     14     32     25       98
Team_043                 26     30     32     24      112
--------------------------------------------------------------------------------

FULL GAME BOX SCORE:
================================================================================

Team_034
--------------------------------------------------------------------------------
Player                MIN  PTS  REB  AST  TO      FG   FG%      3P   3P%      FT STL BLK
--------------------------------------------------------------------------------
Cole Antetokounmpo     29    8    4    1   1   5/7    71.4   2/4    50.0   3/3     0   0
Terry Doncic           29   25   13    1   6   9/14   64.3   0/4     0.0   5/8     4   0
Anthony Bane           29    6    7    2   1   3/6    50.0   0/0     0.0   4/4     1   0
Ben Hyland             28   13    0    3   1   4/6    66.7   2/4    50.0   3/3     0   2
Manu Jokic             25    8    0    1   0   1/9    11.1   0/6     0.0   3/3     0   0
Devin Poole            24   12    0    2   0   6/11   54.5   2/5    40.0   6/6     0   0
Damian Turner          21    0    0    1   2   1/8    12.5   1/5    20.0   1/3     1   0
Vince Paul             19    4   10    1   2   1/3    33.3   0/1     0.0   0/0     1   0
Nikola Wagner          19    2    3    0   0   1/6    16.7   0/1     0.0   2/2     0   0
Carmelo Anunoby        19   16    6    0   0   7/12   58.3   1/2    50.0   7/9     1   0

TEAM: FG: 40/84 (47.6%), 3PT: 8/32 (25.0%), REB: 44 (14 off, 30 def), AST: 12, TO: 13


Team_043
--------------------------------------------------------------------------------
Player                MIN  PTS  REB  AST  TO      FG   FG%      3P   3P%      FT STL BLK
--------------------------------------------------------------------------------
Manu Carter            29   15    7    3   3   6/11   54.5   1/4    25.0   5/6     3   0
D'Angelo Iverson       28    6    8    1   2   2/3    66.7   1/1   100.0   1/1     0   0
Magic Durant           28   12    0    2   3   5/11   45.5   2/4    50.0   2/2     0   0
Dwyane Dosunmu         27    6    7    2   1   3/5    60.0   0/0     0.0   1/2     0   0
Jabari Holiday         27   11    0    3   2   6/10   60.0   3/4    75.0   3/3     0   0
Malcolm Murray         25   22    2    2   0   7/10   70.0   3/3   100.0   5/5     0   0
Terry Randle           21   11    6    1   1   4/8    50.0   0/0     0.0   5/7     1   0
Ben LaVine             21    7    6    0   3   2/4    50.0   2/3    66.7   1/2     0   0
Dirk Herro             21   12   10    2   1   3/5    60.0   1/2    50.0   3/3     0   0
Joel Murray            16    8    0    1   0   3/5    60.0   1/2    50.0   4/4     0   1

TEAM: FG: 45/77 (58.4%), 3PT: 14/23 (60.9%), REB: 45 (3 off, 42 def), AST: 17, TO: 16

================================================================================
