================================================================================
                        FULL GAME - Team_054 vs Team_025                        
================================================================================

================================================================================
                       1ST QUARTER - Team_054 vs Team_025                       
================================================================================

[12:00] Team_054 possession (Score: 0-0)
FOUL! Shooting foul on Desmond Jordan. Vince Ball to the line for 2 free throws. [Team fouls: 1] (Desmond Jordan: 1 personal fouls)   FT 1/2: MISS   FT 2/2: GOOD Vince Ball makes 1/2 from the line.
Score: 1-0

[11:43] Team_025 possession (Score: 1-0)
Desmond Jordan attempts a 3Pt. Contested by Lauri Irving (3.6 feet, ZONE). Desmond Jordan misses. Rebound secured by Lauri Irving.

[11:29] Team_054 possession (Score: 1-0)
FOUL! Holding foul on Ben Giddey. [Team fouls: 2] No free throws, side out. (Ben Giddey: 1 personal fouls)

[11:18] Team_054 possession (Score: 1-0)
Lauri Irving drives and kicks out. Luka Brogdon attempts a 3Pt. Contested by Cade Anthony (4.2 feet, MAN). LUKA BROGDON MAKES IT! Assist: Malcolm Harden
Score: 4-0

[11:06] Team_025 possession (Score: 4-0)
FOUL! Shooting foul on Blake Russell. Ben Giddey to the line for 2 free throws. [Team fouls: 1] (Blake Russell: 1 personal fouls)   FT 1/2: GOOD   FT 2/2: GOOD Ben Giddey makes 2/2 from the line.
Score: 4-2

[10:50] Team_054 possession (Score: 4-2)
Blake Russell attempts a Layup. Contested by Allen Embiid (3.3 feet, MAN). BLAKE RUSSELL MAKES IT! Assist: Malcolm Harden
Score: 6-2

[10:36] Team_025 possession (Score: 6-2)
Allen Embiid attempts a Midrange. Contested by Blake Russell (3.2 feet, MAN). Allen Embiid misses. Rebound secured by Lauri Irving.

[10:19] Team_054 possession (Score: 6-2)
Luka Brogdon attempts a Midrange. Contested by Cade Anthony (4.6 feet, MAN). LUKA BROGDON MAKES IT! Assist: Blake Russell
Score: 8-2

[10:05] Team_025 possession (Score: 8-2)
Ben Giddey drives, picks up Lauri Irving. Help arrives from Vince Ball! Ben Giddey attempts a Layup. Contested by Vince Ball (3.9 feet, MAN). BEN GIDDEY MAKES IT!
Score: 8-4

[09:54] Team_054 possession (Score: 8-4)
Luka Brogdon drives, Allen Embiid stays with him. Luka Brogdon attempts a Dunk. Contested by Allen Embiid (3.2 feet, ZONE). Luka Brogdon misses. Offensive rebound by Luka Brogdon! Luka Brogdon kicks it out.

[09:42] Team_054 possession (Score: 8-4)
Luka Brogdon drives, picks up Cade Anthony. Help arrives from Ben Giddey! Luka Brogdon attempts a Dunk. Contested by Ben Giddey (4.6 feet, MAN). Luka Brogdon misses. Rebound secured by Desmond Jordan.

[09:27] Team_025 possession (Score: 8-4)
Desmond Jordan attempts a 3Pt. Contested by Vince Ball (4.3 feet, MAN). DESMOND JORDAN MAKES IT! Assist: Ben Giddey
Score: 8-7

[09:13] Team_054 possession (Score: 8-7)
Luka Brogdon attempts a 3Pt. Contested by Cade Anthony (4.6 feet, MAN). Luka Brogdon misses. Rebound secured by Allen Embiid.

[09:02] Team_025 possession (Score: 8-7)
Desmond Jordan attempts a 3Pt. Contested by Lauri Irving (3.6 feet, ZONE). DESMOND JORDAN MAKES IT! Assist: Paolo Lowry
Score: 8-10

[08:51] Team_054 possession (Score: 8-10)
Vince Ball attempts a 3Pt. Contested by Desmond Jordan (3.5 feet, MAN). Vince Ball misses. Rebound secured by Cade Anthony.

[08:35] Team_025 possession (Score: 8-10)
Desmond Jordan attempts a Midrange. Contested by Lauri Irving (3.6 feet, ZONE). Desmond Jordan misses. Rebound secured by Luka Brogdon.

[08:19] Team_054 possession (Score: 8-10)
Luka Brogdon drives and kicks out. Vince Ball attempts a Midrange. Contested by Desmond Jordan (3.3 feet, MAN). VINCE BALL MAKES IT! Assist: Malcolm Harden
Score: 10-10

[08:09] Team_025 possession (Score: 10-10)
Ben Giddey attempts a 3Pt. Contested by Malcolm Harden (4.6 feet, ZONE). Ben Giddey misses. Rebound secured by Blake Russell.

[07:54] Team_054 possession (Score: 10-10)
Blake Russell attempts a Midrange. Contested by Ben Giddey (4.1 feet, ZONE). Blake Russell misses. Rebound secured by Desmond Jordan.

[07:35] Team_025 possession (Score: 10-10)
Ben Giddey attempts a 3Pt. Contested by Vince Ball (4.6 feet, ZONE). Ben Giddey misses. Rebound secured by Lauri Irving.

[07:23] Team_054 possession (Score: 10-10)
Luka Brogdon drives and kicks out. Luka Brogdon attempts a 3Pt. Contested by Ben Giddey (3.6 feet, ZONE). LUKA BROGDON MAKES IT! Assist: Blake Russell
Score: 13-10

[07:04] Team_025 possession (Score: 13-10)
Desmond Jordan attempts a 3Pt. Contested by Vince Ball (4.3 feet, MAN). Desmond Jordan misses. Rebound secured by Lauri Irving.

[06:51] Team_054 possession (Score: 13-10)
FOUL! Reach-in foul on Allen Embiid during the drive. [Team fouls: 3] No free throws, side out. (Allen Embiid: 1 personal fouls)

[06:38] Team_054 possession (Score: 13-10)
Malcolm Harden attempts a Midrange. Contested by Desmond Jordan (3.6 feet, ZONE). Malcolm Harden misses. Rebound secured by Cade Anthony.

[06:22] Team_025 possession (Score: 13-10)
Desmond Jordan attempts a 3Pt. Contested by Lauri Irving (3.6 feet, ZONE). DESMOND JORDAN MAKES IT! Assist: Cade Anthony
Score: 13-13

[06:09] Team_054 possession (Score: 13-13)
Malcolm Harden drives, Allen Embiid stays with him. Malcolm Harden attempts a Dunk. Contested by Allen Embiid (3.2 feet, ZONE). Malcolm Harden misses. FOUL! Loose ball foul on Allen Embiid during the rebound battle. [Team fouls: 4] No free throws, side out. (Allen Embiid: 2 personal fouls)

[05:56] Team_054 possession (Score: 13-13)
Vince Ball drives and kicks out. Blake Russell attempts a 3Pt. Contested by Ben Giddey (3.6 feet, ZONE). Blake Russell misses. Rebound secured by Desmond Jordan.

[05:40] Team_025 possession (Score: 13-13)
Allen Embiid attempts a Midrange. Contested by Lauri Irving (3.6 feet, ZONE). Allen Embiid misses. Rebound secured by Blake Russell.

[05:27] Team_054 possession (Score: 13-13)
Luka Brogdon attempts a 3Pt. Contested by Ben Giddey (4.0 feet, ZONE). Luka Brogdon misses. Rebound secured by Desmond Jordan.

[05:14] Team_025 possession (Score: 13-13)
Paolo Lowry makes the Layup and draws the foul on Malcolm Harden! And-1! Paolo Lowry to the line for 1. [Team fouls: 2] (Malcolm Harden: 1 personal fouls)   FT 1/1: MISS Paolo Lowry makes 0/1 from the line. Offensive rebound by Desmond Jordan! Desmond Jordan puts it back in!
Score: 13-17

[05:03] Team_054 possession (Score: 13-17)
Vince Ball drives and kicks out. Malcolm Harden makes the 3Pt and draws the foul on Paolo Lowry! And-1! Malcolm Harden to the line for 1. [BONUS: 5 team fouls] (Paolo Lowry: 1 personal fouls)   FT 1/1: MISS Malcolm Harden makes 0/1 from the line. Rebound secured by Desmond Jordan.
Score: 16-17

[04:46] Team_025 possession (Score: 16-17)
Cade Anthony attempts a Layup. Contested by Luka Brogdon (4.7 feet, MAN). CADE ANTHONY MAKES IT!
Score: 16-19

[04:32] Team_054 possession (Score: 16-19)
Vince Ball attempts a 3Pt. Contested by Ben Giddey (3.8 feet, ZONE). Vince Ball misses. Rebound secured by Desmond Jordan.

[04:16] Team_025 possession (Score: 16-19)
Ben Giddey drives and kicks out. Cade Anthony attempts a 3Pt. Contested by Luka Brogdon (4.1 feet, MAN). Cade Anthony misses. Rebound secured by Luka Brogdon.

[04:05] Team_054 possession (Score: 16-19)
Vince Ball attempts a 3Pt. Contested by Ben Giddey (3.9 feet, ZONE). Vince Ball misses. Offensive rebound by Luka Brogdon! Luka Brogdon kicks it out.

[03:52] Team_054 possession (Score: 16-19)
Blake Russell makes the Dunk and draws the foul on Allen Embiid! And-1! Blake Russell to the line for 1. [BONUS: 6 team fouls] (Allen Embiid: 3 personal fouls)   FT 1/1: GOOD Blake Russell makes 1/1 from the line.
Score: 19-19

[03:43] Team_025 possession (Score: 19-19)
Cade Anthony attempts a Midrange. Contested by Luka Brogdon (4.8 feet, MAN). CADE ANTHONY MAKES IT! Assist: Paolo Lowry
Score: 19-21

[03:28] Team_054 possession (Score: 19-21)
Luka Brogdon drives, Cade Anthony stays with him. Luka Brogdon attempts a Dunk. Contested by Cade Anthony (4.7 feet, MAN). LUKA BROGDON MAKES IT! Assist: Malcolm Harden
Score: 21-21

[03:14] Team_025 possession (Score: 21-21)
Paolo Lowry throws a bad pass out of bounds! TURNOVER! (dead ball)

[03:14] Substitution (Team_054): Blake Russell OUT → Devin Jackson IN (stamina_rule2)

[03:14] Substitution (Team_025): Allen Embiid OUT → Nikola Lillard IN (stamina_rule2)

[03:00] Team_054 possession (Score: 21-21)
Luka Brogdon loses control! Ball rolls out of bounds! TURNOVER! (dead ball)

[02:44] Team_025 possession (Score: 21-21)
Cade Anthony attempts a 3Pt. Contested by Lauri Irving (4.4 feet, ZONE). Cade Anthony misses. Rebound secured by Lauri Irving.

[02:34] Team_054 possession (Score: 21-21)
Lauri Irving attempts a 3Pt. Contested by Ben Giddey (4.4 feet, MAN). Lauri Irving misses. Offensive rebound by Vince Ball! Vince Ball kicks it out.

[02:18] Team_054 possession (Score: 21-21)
FOUL! Reach-in foul on Paolo Lowry during the drive. [IN THE BONUS! 7 team fouls] Malcolm Harden to the line for 2 free throws. (Paolo Lowry: 2 personal fouls)   FT 1/2: GOOD   FT 2/2: GOOD Malcolm Harden makes 2/2 from the line.
Score: 23-21

[02:05] Team_025 possession (Score: 23-21)
FOUL! Shooting foul on Luka Brogdon. Paolo Lowry to the line for 2 free throws. [Team fouls: 3] (Luka Brogdon: 1 personal fouls)   FT 1/2: GOOD   FT 2/2: GOOD Paolo Lowry makes 2/2 from the line.
Score: 23-23

[01:52] Team_054 possession (Score: 23-23)
Lauri Irving attempts a Midrange. Contested by Cade Anthony (5.0 feet, ZONE). Lauri Irving misses. FOUL! Loose ball foul on Ben Giddey during the rebound battle. [IN THE BONUS! 8 team fouls] Vince Ball to the line for 2 free throws. (Ben Giddey: 2 personal fouls)   FT 1/2: MISS   FT 2/2: GOOD Vince Ball makes 1/2 from the line.
Score: 24-23

[01:39] Team_025 possession (Score: 24-23)
Ben Giddey drives, Luka Brogdon stays with him. Ben Giddey attempts a Dunk. Contested by Luka Brogdon (4.7 feet, ZONE). BEN GIDDEY MAKES IT! Assist: Cade Anthony
Score: 24-25

[01:21] Team_054 possession (Score: 24-25)
Malcolm Harden attempts a 3Pt. Contested by Paolo Lowry (5.5 feet, MAN). Malcolm Harden misses. Offensive rebound by Vince Ball! Vince Ball kicks it out.

[01:10] Team_054 possession (Score: 24-25)
Lauri Irving attempts a 3Pt. Contested by Ben Giddey (4.6 feet, MAN). Lauri Irving misses. Rebound secured by Cade Anthony.

[00:57] Team_025 possession (Score: 24-25)
Cade Anthony drives to the basket... Cade Anthony loses the ball! Stripped by Luka Brogdon! TURNOVER! (live ball)

[00:43] Team_054 possession (Score: 24-25)
Vince Ball drives, picks up Cade Anthony. Help arrives from Ben Giddey! Vince Ball attempts a Layup. Contested by Ben Giddey (4.8 feet, ZONE). Vince Ball misses. Offensive rebound by Luka Brogdon! Luka Brogdon kicks it out.

[00:29] Team_054 possession (Score: 24-25)
Lauri Irving attempts a Midrange. Contested by Ben Giddey (4.6 feet, MAN). LAURI IRVING MAKES IT! Assist: Devin Jackson
Score: 26-25

[00:18] Team_025 possession (Score: 26-25)
Paolo Lowry attempts a 3Pt. Contested by Malcolm Harden (5.0 feet, MAN). Paolo Lowry misses. Rebound secured by Vince Ball.

[00:01] Team_054 possession (Score: 26-25)
Malcolm Harden drives, picks up Paolo Lowry. Help arrives from Desmond Jordan! Malcolm Harden attempts a Layup. Contested by Desmond Jordan (5.7 feet, MAN). Malcolm Harden misses. Rebound secured by Desmond Jordan.

================================================================================
                              1ST QUARTER COMPLETE                              
================================================================================

1ST QUARTER SCORE: Team_054 26, Team_025 25

BOX SCORE:
================================================================================

Team_054
--------------------------------------------------------------------------------
Player                MIN  PTS  REB  AST  TO      FG   FG%      3P   3P%
--------------------------------------------------------------------------------
Luka Brogdon           12   10    5    0   0   4/7    57.1     0/0   0.0
Blake Russell           9    5    3    2   0   2/3    66.7     0/0   0.0
Vince Ball             12    4    3    0   0   3/7    42.9     0/0   0.0
Lauri Irving           12    2    5    0   0   1/2    50.0     0/0   0.0
Malcolm Harden         12    2    0    4   0   1/3    33.3     0/0   0.0
Devin Jackson           3    0    0    1   0   0/0     0.0     0/0   0.0

TEAM: FG: 11/22 (50.0%), 3PT: 0/5 (0.0%), REB: 16 (6 off, 10 def), AST: 7, TO: 1
TEAM FOULS: 3


Team_025
--------------------------------------------------------------------------------
Player                MIN  PTS  REB  AST  TO      FG   FG%      3P   3P%
--------------------------------------------------------------------------------
Desmond Jordan         12   13    7    0   0   4/7    57.1     0/0   0.0
Ben Giddey             12    6    0    1   0   3/6    50.0     0/0   0.0
Cade Anthony           12    4    3    2   0   2/3    66.7     0/0   0.0
Paolo Lowry            12    2    0    2   0   1/2    50.0     0/0   0.0
Allen Embiid            9    0    1    0   0   0/2     0.0     0/0   0.0

TEAM: FG: 10/20 (50.0%), 3PT: 3/9 (33.3%), REB: 11 (0 off, 11 def), AST: 5, TO: 2
TEAM FOULS: 8 [Team_054 in BONUS]

================================================================================

================================================================================
                       2ND QUARTER - Team_054 vs Team_025                       
================================================================================

[12:00] Team_054 possession (Score: 26-25)
Malcolm Harden attempts a 3Pt. Contested by Paolo Lowry (5.5 feet, MAN). Malcolm Harden misses. Offensive rebound by Blake Russell! Blake Russell puts it back in!
Score: 28-25

[11:42] Team_025 possession (Score: 28-25)
Paolo Lowry attempts a 3Pt. Contested by Lauri Irving (4.2 feet, ZONE). Paolo Lowry misses. Rebound secured by Luka Brogdon.

[11:24] Team_054 possession (Score: 28-25)
Luka Brogdon attempts a Layup. Contested by Cade Anthony (4.9 feet, MAN). Luka Brogdon misses. Rebound secured by Desmond Jordan.

[11:14] Team_025 possession (Score: 28-25)
Cade Anthony attempts a Layup. Contested by Luka Brogdon (5.0 feet, MAN). CADE ANTHONY MAKES IT! Assist: Desmond Jordan
Score: 28-27

[11:00] Team_054 possession (Score: 28-27)
Lauri Irving attempts a Midrange. Contested by Cade Anthony (5.1 feet, ZONE). LAURI IRVING MAKES IT!
Score: 30-27

[10:48] Team_025 possession (Score: 30-27)
Paolo Lowry drives, Blake Russell stays with him. Paolo Lowry attempts a Layup. Contested by Blake Russell (3.4 feet, ZONE). Paolo Lowry misses. Rebound secured by Blake Russell.

[10:29] Team_054 possession (Score: 30-27)
Vince Ball attempts a 3Pt. Contested by Paolo Lowry (5.5 feet, ZONE). Vince Ball misses. FOUL! Loose ball foul on Desmond Jordan during the rebound battle. [Team fouls: 1] No free throws, side out. (Desmond Jordan: 1 personal fouls)

[10:12] Team_054 possession (Score: 30-27)
Blake Russell attempts a Layup. Contested by Cade Anthony (5.2 feet, ZONE). BLAKE RUSSELL MAKES IT!
Score: 32-27

[09:59] Team_025 possession (Score: 32-27)
Allen Embiid drives to the basket... Allen Embiid throws a bad pass out of bounds! TURNOVER! (dead ball)

[09:59] Substitution (Team_054): Malcolm Harden OUT → Shaquille Irving IN (stamina_rule2)

[09:59] Substitution (Team_054): Lauri Irving OUT → Bradley Quickley IN (stamina_rule2)

[09:59] Substitution (Team_054): Vince Ball OUT → Vince James IN (stamina_rule2)

[09:59] Substitution (Team_054): Luka Brogdon OUT → Tobias Nowitzki IN (stamina_rule2)

[09:59] Substitution (Team_025): Paolo Lowry OUT → LeBron Griffin IN (stamina_rule2)

[09:59] Substitution (Team_025): Ben Giddey OUT → Dirk Gilgeous-Alexander IN (stamina_rule2)

[09:59] Substitution (Team_025): Desmond Jordan OUT → Immanuel LaVine IN (stamina_rule2)

[09:59] Substitution (Team_025): Cade Anthony OUT → Damian Adebayo IN (stamina_rule2)

[09:47] Team_054 possession (Score: 32-27)
Vince James attempts a 3Pt. Contested by Immanuel LaVine (5.2 feet, MAN). Vince James misses. Rebound secured by Dirk Gilgeous-Alexander.

[09:31] Team_025 possession (Score: 32-27)
LeBron Griffin attempts a Midrange. Contested by Vince James (4.8 feet, ZONE). LEBRON GRIFFIN MAKES IT!
Score: 32-29

[09:16] Team_054 possession (Score: 32-29)
Blake Russell attempts a Midrange. Wide open! Dirk Gilgeous-Alexander is 6.1 feet away. [ZONE] Blake Russell misses. Rebound secured by Allen Embiid.

[09:00] Team_025 possession (Score: 32-29)
Dirk Gilgeous-Alexander attempts a Midrange. Contested by Bradley Quickley (4.3 feet, MAN). Dirk Gilgeous-Alexander misses. Rebound secured by Vince James.

[08:50] Team_054 possession (Score: 32-29)
Blake Russell attempts a Layup. Contested by Allen Embiid (3.6 feet, MAN). BLAKE RUSSELL MAKES IT! Assist: Bradley Quickley
Score: 34-29

[08:36] Team_025 possession (Score: 34-29)
Dirk Gilgeous-Alexander attempts a Midrange. Contested by Bradley Quickley (4.3 feet, MAN). Dirk Gilgeous-Alexander misses. Rebound secured by Tobias Nowitzki.

[08:20] Team_054 possession (Score: 34-29)
Blake Russell attempts a Midrange. Contested by Allen Embiid (3.7 feet, MAN). Blake Russell misses. Rebound secured by Dirk Gilgeous-Alexander.

[08:02] Team_025 possession (Score: 34-29)
Dirk Gilgeous-Alexander drives to the basket... Dirk Gilgeous-Alexander loses the ball! Stripped by Bradley Quickley! TURNOVER! (live ball)

[07:47] Team_054 possession (Score: 34-29)
Shaquille Irving attempts a Midrange. Contested by LeBron Griffin (5.1 feet, MAN). SHAQUILLE IRVING MAKES IT!
Score: 36-29

[07:33] Team_025 possession (Score: 36-29)
LeBron Griffin attempts a 3Pt. Contested by Shaquille Irving (4.5 feet, ZONE). LeBron Griffin misses. Rebound secured by Vince James.

[07:16] Team_054 possession (Score: 36-29)
Shaquille Irving attempts a 3Pt. Contested by LeBron Griffin (5.1 feet, MAN). Shaquille Irving misses. Rebound secured by Dirk Gilgeous-Alexander.

[07:03] Team_025 possession (Score: 36-29)
Dirk Gilgeous-Alexander attempts a Layup. BLOCKED BY VINCE JAMES! Ball goes out off Vince James. Dirk Gilgeous-Alexander's ball!

[06:48] Team_025 possession (Score: 36-29)
FOUL! Shooting foul on Blake Russell. Damian Adebayo to the line for 2 free throws. [Team fouls: 1] (Blake Russell: 1 personal fouls)   FT 1/2: GOOD   FT 2/2: GOOD Damian Adebayo makes 2/2 from the line.
Score: 36-31

[06:39] Team_054 possession (Score: 36-31)
Vince James attempts a Midrange. Wide open! Dirk Gilgeous-Alexander is 6.4 feet away. [ZONE] VINCE JAMES MAKES IT!
Score: 38-31

[06:24] Team_025 possession (Score: 38-31)
Dirk Gilgeous-Alexander drives to the basket... FOUL! Offensive foul on Dirk Gilgeous-Alexander! Bradley Quickley drew the charge! [Team fouls: 2] (Dirk Gilgeous-Alexander: 1 personal fouls) TURNOVER! (dead ball)

[06:11] Team_054 possession (Score: 38-31)
Vince James drives and kicks out. Shaquille Irving attempts a Midrange. Contested by LeBron Griffin (4.7 feet, MAN). SHAQUILLE IRVING MAKES IT!
Score: 40-31

[05:54] Team_025 possession (Score: 40-31)
Damian Adebayo attempts a Midrange. Contested by Blake Russell (3.7 feet, MAN). Damian Adebayo misses. Rebound secured by Vince James.

[05:37] Team_054 possession (Score: 40-31)
Shaquille Irving attempts a Midrange. Contested by Damian Adebayo (5.4 feet, ZONE). SHAQUILLE IRVING MAKES IT!
Score: 42-31

[05:18] Team_025 possession (Score: 42-31)
Immanuel LaVine attempts a Layup. Contested by Blake Russell (4.0 feet, ZONE). Immanuel LaVine misses. Offensive rebound by Immanuel LaVine! Immanuel LaVine kicks it out.

[05:02] Team_025 possession (Score: 42-31)
Dirk Gilgeous-Alexander attempts a Layup. Contested by Bradley Quickley (4.3 feet, MAN). DIRK GILGEOUS-ALEXANDER MAKES IT!
Score: 42-33

[04:51] Team_054 possession (Score: 42-33)
FOUL! Holding foul on Immanuel LaVine. [Team fouls: 3] No free throws, side out. (Immanuel LaVine: 1 personal fouls)

[04:40] Team_054 possession (Score: 42-33)
Tobias Nowitzki makes the Layup and draws the foul on Damian Adebayo! And-1! Tobias Nowitzki to the line for 1. [Team fouls: 4] (Damian Adebayo: 1 personal fouls)   FT 1/1: GOOD Tobias Nowitzki makes 1/1 from the line.
Score: 45-33

[04:27] Team_025 possession (Score: 45-33)
Damian Adebayo attempts a 3Pt. Contested by Blake Russell (4.0 feet, MAN). DAMIAN ADEBAYO MAKES IT! Assist: LeBron Griffin
Score: 45-36

[04:15] Team_054 possession (Score: 45-36)
Tobias Nowitzki attempts a 3Pt. Contested by Damian Adebayo (4.9 feet, MAN). Tobias Nowitzki misses. Rebound secured by Allen Embiid.

[03:59] Team_025 possession (Score: 45-36)
FOUL! Offensive foul on Immanuel LaVine! Vince James drew the charge! [Team fouls: 5] (Immanuel LaVine: 2 personal fouls) TURNOVER! (dead ball)

[03:45] Team_054 possession (Score: 45-36)
Bradley Quickley drives, picks up Allen Embiid. Help arrives from LeBron Griffin! Bradley Quickley attempts a Dunk. Contested by LeBron Griffin (3.7 feet, ZONE). Bradley Quickley misses. Offensive rebound by Blake Russell! Blake Russell's putback is no good. Rebound secured by Allen Embiid.

[03:27] Team_025 possession (Score: 45-36)
Immanuel LaVine throws a bad pass out of bounds! TURNOVER! (dead ball)

[03:27] Substitution (Team_054): Blake Russell OUT → Devin Jackson IN (stamina_rule2)

[03:27] Substitution (Team_025): Allen Embiid OUT → Nikola Lillard IN (stamina_rule2)

[03:12] Team_054 possession (Score: 45-36)
FOUL! Reach-in foul on Nikola Lillard during the drive. [IN THE BONUS! 6 team fouls] Devin Jackson to the line for 2 free throws. (Nikola Lillard: 1 personal fouls)   FT 1/2: GOOD   FT 2/2: MISS Devin Jackson makes 1/2 from the line. Rebound secured by Immanuel LaVine.
Score: 46-36

[03:00] Team_025 possession (Score: 46-36)
Damian Adebayo drives and kicks out. Nikola Lillard attempts a 3Pt. Contested by Shaquille Irving (4.6 feet, ZONE). Nikola Lillard misses. Rebound secured by Devin Jackson.

[02:45] Team_054 possession (Score: 46-36)
FOUL! Shooting foul on Immanuel LaVine. Vince James to the line for 2 free throws. [BONUS: 7 team fouls] (Immanuel LaVine: 3 personal fouls)   FT 1/2: MISS   FT 2/2: MISS Vince James makes 0/2 from the line. Offensive rebound by Tobias Nowitzki! Tobias Nowitzki kicks it out.

[02:34] Team_054 possession (Score: 46-36)
Bradley Quickley drives, Nikola Lillard stays with him. Bradley Quickley attempts a Dunk. Contested by Nikola Lillard (4.1 feet, ZONE). Bradley Quickley misses. Rebound secured by Dirk Gilgeous-Alexander.

[02:18] Team_025 possession (Score: 46-36)
LeBron Griffin attempts a 3Pt. Contested by Shaquille Irving (4.6 feet, ZONE). LeBron Griffin misses. FOUL! Loose ball foul on Devin Jackson during the rebound battle. [Team fouls: 2] No free throws, side out. (Devin Jackson: 1 personal fouls)

[02:03] Team_025 possession (Score: 46-36)
Immanuel LaVine attempts a Midrange. Contested by Vince James (5.1 feet, ZONE). IMMANUEL LAVINE MAKES IT!
Score: 46-38

[01:47] Team_054 possession (Score: 46-38)
FOUL! Offensive foul on Tobias Nowitzki! Damian Adebayo drew the charge! [Team fouls: 3] (Tobias Nowitzki: 1 personal fouls) TURNOVER! (dead ball)

[01:34] Team_025 possession (Score: 46-38)
Immanuel LaVine attempts a Midrange. Contested by Bradley Quickley (4.4 feet, ZONE). Immanuel LaVine misses. Offensive rebound by Nikola Lillard! Nikola Lillard kicks it out.

[01:20] Team_025 possession (Score: 46-38)
Nikola Lillard attempts a Layup. BLOCKED BY DEVIN JACKSON! Ball is loose! Rebound secured by Vince James.

[01:07] Team_054 possession (Score: 46-38)
Devin Jackson drives to the basket... FOUL! Offensive foul on Devin Jackson! Nikola Lillard drew the charge! [Team fouls: 4] (Devin Jackson: 2 personal fouls) TURNOVER! (dead ball)

[00:52] Team_025 possession (Score: 46-38)
Damian Adebayo attempts a 3Pt. Contested by Shaquille Irving (4.7 feet, ZONE). Damian Adebayo misses. Rebound secured by Tobias Nowitzki.

[00:38] Team_054 possession (Score: 46-38)
Bradley Quickley attempts a 3Pt. Contested by LeBron Griffin (4.6 feet, ZONE). Bradley Quickley misses. Offensive rebound by Devin Jackson! Devin Jackson kicks it out.

[00:23] Team_054 possession (Score: 46-38)
Bradley Quickley attempts a Midrange. Contested by Dirk Gilgeous-Alexander (5.5 feet, MAN). Bradley Quickley misses. Rebound secured by Immanuel LaVine.

[00:11] Team_025 possession (Score: 46-38)
Damian Adebayo attempts a Midrange. Contested by Devin Jackson (5.2 feet, ZONE). Damian Adebayo misses. Offensive rebound by Immanuel LaVine! Immanuel LaVine kicks it out.

================================================================================
                              2ND QUARTER COMPLETE                              
================================================================================

2ND QUARTER SCORE: Team_054 20, Team_025 13

BOX SCORE:
================================================================================

Team_054
--------------------------------------------------------------------------------
Player                MIN  PTS  REB  AST  TO      FG   FG%      3P   3P%
--------------------------------------------------------------------------------
Blake Russell          18    6    3    0   0   3/5    60.0     0/0   0.0
Shaquille Irving       10    6    0    0   0   3/4    75.0     0/0   0.0
Tobias Nowitzki        10    3    3    0   0   1/2    50.0     0/0   0.0
Lauri Irving           15    2    0    0   0   1/1   100.0     0/0   0.0
Vince James            10    2    4    0   0   1/2    50.0     0/0   0.0
Luka Brogdon           15    0    1    0   0   0/1     0.0     0/0   0.0
Allen Embiid           18    0    3    0   0   0/0     0.0     0/0   0.0
Bradley Quickley       10    0    0    1   0   0/3     0.0     0/0   0.0
Devin Jackson           7    0    2    0   0   0/1     0.0     0/0   0.0

TEAM: FG: 9/19 (47.4%), 3PT: 1/4 (25.0%), REB: 14 (5 off, 9 def), AST: 1, TO: 2
TEAM FOULS: 4


Team_025
--------------------------------------------------------------------------------
Player                MIN  PTS  REB  AST  TO      FG   FG%      3P   3P%
--------------------------------------------------------------------------------
Damian Adebayo         10    5    0    0   0   2/5    40.0     0/0   0.0
Cade Anthony           15    2    0    0   0   1/1   100.0     0/0   0.0
Dirk Gilgeous-Alexander   10    2    4    0   0   1/3    33.3     0/0   0.0
LeBron Griffin         10    2    0    1   0   1/2    50.0     0/0   0.0
Immanuel LaVine        10    2    4    0   0   1/1   100.0     0/0   0.0
Paolo Lowry            15    0    0    0   0   0/2     0.0     0/0   0.0
Desmond Jordan         15    0    1    1   0   0/0     0.0     0/0   0.0
Nikola Lillard          7    0    2    0   0   0/1     0.0     0/0   0.0

TEAM: FG: 6/15 (40.0%), 3PT: 1/4 (25.0%), REB: 13 (4 off, 9 def), AST: 2, TO: 5
TEAM FOULS: 7 [Team_054 in BONUS]

================================================================================

================================================================================
                       3RD QUARTER - Team_054 vs Team_025                       
================================================================================

[12:00] Team_054 possession (Score: 46-38)
Lauri Irving drives, Allen Embiid stays with him. Lauri Irving attempts a Layup. Contested by Allen Embiid (3.4 feet, ZONE). LAURI IRVING MAKES IT! Assist: Luka Brogdon
Score: 48-38

[11:43] Team_025 possession (Score: 48-38)
Allen Embiid drives, picks up Blake Russell. Help arrives from Lauri Irving! Allen Embiid attempts a Dunk. Contested by Lauri Irving (3.2 feet, ZONE). Allen Embiid misses. Rebound secured by Luka Brogdon.

[11:27] Team_054 possession (Score: 48-38)
Vince Ball drives to the basket... FOUL! Offensive foul on Vince Ball! Allen Embiid drew the charge! [Team fouls: 1] (Vince Ball: 1 personal fouls) TURNOVER! (dead ball)

[11:17] Team_025 possession (Score: 48-38)
Paolo Lowry drives and kicks out. Allen Embiid attempts a Midrange. Contested by Luka Brogdon (4.0 feet, ZONE). Allen Embiid misses. Rebound secured by Blake Russell.

[11:03] Team_054 possession (Score: 48-38)
Vince Ball attempts a 3Pt. Contested by Desmond Jordan (3.5 feet, MAN). VINCE BALL MAKES IT! Assist: Malcolm Harden
Score: 51-38

[10:47] Team_025 possession (Score: 51-38)
Cade Anthony attempts a Midrange. Contested by Luka Brogdon (4.7 feet, MAN). Cade Anthony misses. Rebound secured by Luka Brogdon.

[10:33] Team_054 possession (Score: 51-38)
Luka Brogdon drives and kicks out. FOUL! Shooting foul on Desmond Jordan. Vince Ball to the line for 2 free throws. [Team fouls: 1] (Desmond Jordan: 1 personal fouls)   FT 1/2: GOOD   FT 2/2: GOOD Vince Ball makes 2/2 from the line.
Score: 53-38

[10:19] Team_025 possession (Score: 53-38)
Paolo Lowry attempts a Midrange. Contested by Lauri Irving (3.8 feet, ZONE). PAOLO LOWRY MAKES IT!
Score: 53-40

[10:08] Team_054 possession (Score: 53-40)
Blake Russell attempts a Midrange. Contested by Cade Anthony (4.7 feet, ZONE). Blake Russell misses. Rebound secured by Cade Anthony.

[09:53] Team_025 possession (Score: 53-40)
Allen Embiid attempts a Layup. Contested by Blake Russell (3.2 feet, ZONE). ALLEN EMBIID MAKES IT! Assist: Desmond Jordan
Score: 53-42

[09:36] Team_054 possession (Score: 53-42)
Vince Ball attempts a Midrange. Contested by Paolo Lowry (5.0 feet, ZONE). Vince Ball misses. FOUL! Loose ball foul on Cade Anthony during the rebound battle. [Team fouls: 2] No free throws, side out. (Cade Anthony: 1 personal fouls)

[09:22] Team_054 possession (Score: 53-42)
Lauri Irving loses the ball! Stripped by Ben Giddey! TURNOVER! (live ball)

[09:03] Team_025 possession (Score: 53-42)
Ben Giddey loses the ball! Stripped by Lauri Irving! TURNOVER! (live ball)

[08:49] Team_054 possession (Score: 53-42)
Luka Brogdon attempts a Layup. Contested by Allen Embiid (3.2 feet, ZONE). Luka Brogdon misses. FOUL! Loose ball foul on Desmond Jordan during the rebound battle. [Team fouls: 3] No free throws, side out. (Desmond Jordan: 2 personal fouls)

[08:40] Team_054 possession (Score: 53-42)
Luka Brogdon attempts a Layup. Contested by Cade Anthony (4.6 feet, MAN). LUKA BROGDON MAKES IT! Assist: Blake Russell
Score: 55-42

[08:27] Team_025 possession (Score: 55-42)
Cade Anthony drives and kicks out. Ben Giddey attempts a Midrange. Contested by Lauri Irving (3.4 feet, MAN). BEN GIDDEY MAKES IT! Assist: Paolo Lowry
Score: 55-44

[08:09] Team_054 possession (Score: 55-44)
Blake Russell makes the Layup and draws the foul on Ben Giddey! And-1! Blake Russell to the line for 1. [Team fouls: 4] (Ben Giddey: 1 personal fouls)   FT 1/1: GOOD Blake Russell makes 1/1 from the line.
Score: 58-44

[07:53] Team_025 possession (Score: 58-44)
Allen Embiid attempts a Midrange. Contested by Lauri Irving (3.6 feet, ZONE). Allen Embiid misses. Rebound secured by Luka Brogdon.

[07:43] Team_054 possession (Score: 58-44)
Vince Ball attempts a 3Pt. Contested by Desmond Jordan (3.5 feet, MAN). VINCE BALL MAKES IT! Assist: Luka Brogdon
Score: 61-44

[07:26] Team_025 possession (Score: 61-44)
Paolo Lowry drives, Blake Russell stays with him. Paolo Lowry attempts a Dunk. Contested by Blake Russell (3.4 feet, ZONE). PAOLO LOWRY MAKES IT!
Score: 61-46

[07:09] Team_054 possession (Score: 61-46)
FOUL! Reach-in foul on Allen Embiid during the drive. [IN THE BONUS! 5 team fouls] Blake Russell to the line for 2 free throws. (Allen Embiid: 1 personal fouls)   FT 1/2: GOOD   FT 2/2: MISS Blake Russell makes 1/2 from the line. Offensive rebound by Luka Brogdon! Luka Brogdon kicks it out.
Score: 62-46

[06:55] Team_054 possession (Score: 62-46)
Blake Russell commits a violation (traveling/carry)! TURNOVER! (dead ball)

[06:38] Team_025 possession (Score: 62-46)
FOUL! Holding foul on Malcolm Harden. [Team fouls: 2] No free throws, side out. (Malcolm Harden: 1 personal fouls)

[06:23] Team_025 possession (Score: 62-46)
FOUL! Reach-in foul on Blake Russell during the drive. [Team fouls: 3] No free throws, side out. (Blake Russell: 1 personal fouls)

[06:07] Team_025 possession (Score: 62-46)
Ben Giddey attempts a 3Pt. Contested by Lauri Irving (3.9 feet, MAN). BEN GIDDEY MAKES IT! Assist: Paolo Lowry
Score: 62-49

[05:51] Team_054 possession (Score: 62-49)
Blake Russell makes the Layup and draws the foul on Allen Embiid! And-1! Blake Russell to the line for 1. [BONUS: 6 team fouls] (Allen Embiid: 2 personal fouls)   FT 1/1: GOOD Blake Russell makes 1/1 from the line.
Score: 65-49

[05:38] Team_025 possession (Score: 65-49)
FOUL! Reach-in foul on Luka Brogdon during the drive. [Team fouls: 4] No free throws, side out. (Luka Brogdon: 1 personal fouls)

[05:25] Team_025 possession (Score: 65-49)
Paolo Lowry makes the Midrange and draws the foul on Malcolm Harden! And-1! Paolo Lowry to the line for 1. [BONUS: 5 team fouls] (Malcolm Harden: 2 personal fouls)   FT 1/1: GOOD Paolo Lowry makes 1/1 from the line.
Score: 65-52

[05:07] Team_054 possession (Score: 65-52)
Luka Brogdon attempts a 3Pt. Contested by Desmond Jordan (3.7 feet, ZONE). LUKA BROGDON MAKES IT! Assist: Blake Russell
Score: 68-52

[04:53] Team_025 possession (Score: 68-52)
Allen Embiid throws a bad pass out of bounds! TURNOVER! (dead ball)

[04:40] Team_054 possession (Score: 68-52)
Malcolm Harden attempts a Midrange. Contested by Ben Giddey (3.9 feet, ZONE). Malcolm Harden misses. Rebound secured by Allen Embiid.

[04:23] Team_025 possession (Score: 68-52)
Allen Embiid attempts a Layup. Contested by Blake Russell (3.3 feet, ZONE). ALLEN EMBIID MAKES IT! Assist: Ben Giddey
Score: 68-54

[04:09] Team_054 possession (Score: 68-54)
FOUL! Offensive foul on Vince Ball! Desmond Jordan drew the charge! [Team fouls: 6] (Vince Ball: 2 personal fouls) TURNOVER! (dead ball)

[03:54] Team_025 possession (Score: 68-54)
Ben Giddey drives and kicks out. Paolo Lowry attempts a 3Pt. Contested by Luka Brogdon (4.1 feet, ZONE). PAOLO LOWRY MAKES IT! Assist: Desmond Jordan
Score: 68-57

[03:37] Team_054 possession (Score: 68-57)
Vince Ball attempts a 3Pt. Contested by Desmond Jordan (3.6 feet, MAN). Vince Ball misses. Offensive rebound by Blake Russell! Blake Russell's putback is no good. Rebound secured by Desmond Jordan.

[03:23] Team_025 possession (Score: 68-57)
FOUL! Holding foul on Vince Ball. [IN THE BONUS! 7 team fouls] Desmond Jordan to the line for 2 free throws. (Vince Ball: 3 personal fouls)   FT 1/2: GOOD   FT 2/2: GOOD Desmond Jordan makes 2/2 from the line.
Score: 68-59

[03:10] Team_054 possession (Score: 68-59)
Blake Russell drives, Allen Embiid stays with him. Blake Russell attempts a Layup. Contested by Allen Embiid (3.5 feet, ZONE). Blake Russell misses. Rebound secured by Allen Embiid.

[02:54] Team_025 possession (Score: 68-59)
Allen Embiid attempts a Midrange. Contested by Lauri Irving (3.7 feet, ZONE). Allen Embiid misses. FOUL! Loose ball foul on Luka Brogdon during the rebound battle. [IN THE BONUS! 8 team fouls] Allen Embiid to the line for 2 free throws. (Luka Brogdon: 2 personal fouls)   FT 1/2: GOOD   FT 2/2: GOOD Allen Embiid makes 2/2 from the line.
Score: 68-61

[02:39] Team_054 possession (Score: 68-61)
FOUL! Shooting foul on Allen Embiid. Blake Russell to the line for 2 free throws. [BONUS: 7 team fouls] (Allen Embiid: 3 personal fouls)   FT 1/2: GOOD   FT 2/2: GOOD Blake Russell makes 2/2 from the line.
Score: 70-61

[02:29] Team_025 possession (Score: 70-61)
Allen Embiid attempts a Layup. Contested by Blake Russell (3.5 feet, ZONE). ALLEN EMBIID MAKES IT! Assist: Cade Anthony
Score: 70-63

[02:19] Team_054 possession (Score: 70-63)
Blake Russell makes the Layup and draws the foul on Allen Embiid! And-1! Blake Russell to the line for 1. [BONUS: 8 team fouls] (Allen Embiid: 4 personal fouls)   FT 1/1: GOOD Blake Russell makes 1/1 from the line.
Score: 73-63

[02:06] Team_025 possession (Score: 73-63)
Allen Embiid attempts a Midrange. Contested by Blake Russell (3.5 feet, MAN). Allen Embiid misses. Rebound secured by Luka Brogdon.

[01:52] Team_054 possession (Score: 73-63)
Lauri Irving attempts a Midrange. BLOCKED BY DESMOND JORDAN! Ball goes out off Desmond Jordan. Lauri Irving's ball!

[01:37] Team_054 possession (Score: 73-63)
Malcolm Harden attempts a 3Pt. Contested by Ben Giddey (4.2 feet, ZONE). Malcolm Harden misses. FOUL! Loose ball foul on Desmond Jordan during the rebound battle. [IN THE BONUS! 9 team fouls] Luka Brogdon to the line for 2 free throws. (Desmond Jordan: 3 personal fouls)   FT 1/2: GOOD   FT 2/2: GOOD Luka Brogdon makes 2/2 from the line.
Score: 75-63

[01:23] Team_025 possession (Score: 75-63)
Desmond Jordan attempts a 3Pt. Contested by Lauri Irving (4.0 feet, ZONE). Desmond Jordan misses. Rebound secured by Blake Russell.

[01:10] Team_054 possession (Score: 75-63)
Malcolm Harden attempts a 3Pt. Contested by Ben Giddey (4.3 feet, ZONE). Malcolm Harden misses. Rebound secured by Cade Anthony.

[00:52] Team_025 possession (Score: 75-63)
Ben Giddey attempts a 3Pt. Contested by Lauri Irving (4.3 feet, MAN). Ben Giddey misses. Rebound secured by Blake Russell.

[00:39] Team_054 possession (Score: 75-63)
Malcolm Harden attempts a Midrange. Contested by Desmond Jordan (4.1 feet, ZONE). MALCOLM HARDEN MAKES IT!
Score: 77-63

[00:26] Team_025 possession (Score: 77-63)
FOUL! Reach-in foul on Blake Russell during the drive. [IN THE BONUS! 9 team fouls] Allen Embiid to the line for 2 free throws. (Blake Russell: 2 personal fouls)   FT 1/2: MISS   FT 2/2: GOOD Allen Embiid makes 1/2 from the line.
Score: 77-64

[00:11] Team_054 possession (Score: 77-64)
Blake Russell throws a bad pass! Stolen by Allen Embiid! TURNOVER! (live ball)

================================================================================
                              3RD QUARTER COMPLETE                              
================================================================================

3RD QUARTER SCORE: Team_054 31, Team_025 26

BOX SCORE:
================================================================================

Team_054
--------------------------------------------------------------------------------
Player                MIN  PTS  REB  AST  TO      FG   FG%      3P   3P%
--------------------------------------------------------------------------------
Blake Russell          30   11    4    2   0   4/6    66.7     0/0   0.0
Vince Ball             27    8    0    0   0   3/4    75.0     0/0   0.0
Luka Brogdon           27    7    6    2   0   3/3   100.0     0/0   0.0
Lauri Irving           27    2    0    0   0   1/1   100.0     0/0   0.0
Malcolm Harden         27    2    0    1   0   1/3    33.3     0/0   0.0

TEAM: FG: 12/17 (70.6%), 3PT: 4/6 (66.7%), REB: 11 (4 off, 7 def), AST: 5, TO: 5
TEAM FOULS: 9 [Team_025 in BONUS]


Team_025
--------------------------------------------------------------------------------
Player                MIN  PTS  REB  AST  TO      FG   FG%      3P   3P%
--------------------------------------------------------------------------------
Paolo Lowry            27   10    0    2   0   4/5    80.0     0/0   0.0
Allen Embiid           30    9    2    0   0   5/8    62.5     0/0   0.0
Ben Giddey             27    5    0    1   0   2/3    66.7     0/0   0.0
Desmond Jordan         27    2    1    2   0   1/2    50.0     0/0   0.0
Cade Anthony           27    0    2    1   0   0/1     0.0     0/0   0.0

TEAM: FG: 12/19 (63.2%), 3PT: 1/3 (33.3%), REB: 4 (0 off, 4 def), AST: 6, TO: 2
TEAM FOULS: 9 [Team_054 in BONUS]

================================================================================

================================================================================
                       4TH QUARTER - Team_054 vs Team_025                       
================================================================================

[12:00] Team_054 possession (Score: 77-64)
Luka Brogdon drives, Cade Anthony stays with him. Luka Brogdon attempts a Layup. Contested by Cade Anthony (4.8 feet, MAN). LUKA BROGDON MAKES IT!
Score: 79-64

[11:43] Team_025 possession (Score: 79-64)
Allen Embiid attempts a Midrange. Contested by Blake Russell (3.6 feet, MAN). Allen Embiid misses. Offensive rebound by Desmond Jordan! Desmond Jordan's putback is no good. Rebound secured by Vince Ball.

[11:29] Team_054 possession (Score: 79-64)
FOUL! Shooting foul on Desmond Jordan. Vince Ball to the line for 2 free throws. [Team fouls: 1] (Desmond Jordan: 1 personal fouls)   FT 1/2: GOOD   FT 2/2: MISS Vince Ball makes 1/2 from the line. Offensive rebound by Luka Brogdon! Luka Brogdon kicks it out.
Score: 80-64

[11:13] Team_054 possession (Score: 80-64)
Blake Russell attempts a 3Pt. Contested by Allen Embiid (3.8 feet, MAN). Blake Russell misses. Rebound secured by Desmond Jordan.

[11:01] Team_025 possession (Score: 80-64)
Paolo Lowry drives and kicks out. Allen Embiid attempts a Midrange. Contested by Lauri Irving (3.9 feet, ZONE). ALLEN EMBIID MAKES IT!
Score: 80-66

[10:42] Team_054 possession (Score: 80-66)
Luka Brogdon throws a bad pass! Stolen by Cade Anthony! TURNOVER! (live ball)

[10:23] Team_025 possession (Score: 80-66)
Allen Embiid attempts a 3Pt. Contested by Blake Russell (3.8 feet, MAN). ALLEN EMBIID MAKES IT! Assist: Cade Anthony
Score: 80-69

[10:12] Team_054 possession (Score: 80-69)
Blake Russell attempts a 3Pt. Contested by Ben Giddey (4.5 feet, ZONE). Blake Russell misses. Rebound secured by Allen Embiid.

[09:57] Team_025 possession (Score: 80-69)
FOUL! Shooting foul on Luka Brogdon. Cade Anthony to the line for 2 free throws. [Team fouls: 1] (Luka Brogdon: 1 personal fouls)   FT 1/2: GOOD   FT 2/2: GOOD Cade Anthony makes 2/2 from the line.
Score: 80-71

[09:41] Team_054 possession (Score: 80-71)
Vince Ball attempts a 3Pt. Contested by Cade Anthony (4.8 feet, ZONE). Vince Ball misses. Rebound secured by Allen Embiid.

[09:24] Team_025 possession (Score: 80-71)
Ben Giddey makes the Layup and draws the foul on Blake Russell! And-1! Ben Giddey to the line for 1. [Team fouls: 2] (Blake Russell: 1 personal fouls)   FT 1/1: MISS Ben Giddey makes 0/1 from the line. Rebound secured by Vince Ball.
Score: 80-73

[09:08] Team_054 possession (Score: 80-73)
Vince Ball attempts a 3Pt. Contested by Cade Anthony (4.8 feet, ZONE). VINCE BALL MAKES IT! Assist: Lauri Irving
Score: 83-73

[08:51] Team_025 possession (Score: 83-73)
FOUL! Holding foul on Vince Ball. [Team fouls: 3] No free throws, side out. (Vince Ball: 1 personal fouls)

[08:38] Team_025 possession (Score: 83-73)
Paolo Lowry loses the ball! Stripped by Malcolm Harden! TURNOVER! (live ball)

[08:26] Team_054 possession (Score: 83-73)
Lauri Irving attempts a 3Pt. Contested by Cade Anthony (5.3 feet, ZONE). Lauri Irving misses. Rebound secured by Allen Embiid.

[08:16] Team_025 possession (Score: 83-73)
Paolo Lowry attempts a 3Pt. Contested by Malcolm Harden (5.2 feet, MAN). Paolo Lowry misses. Rebound secured by Blake Russell.

[08:03] Team_054 possession (Score: 83-73)
Blake Russell drives, Allen Embiid stays with him. Blake Russell attempts a Dunk. Contested by Allen Embiid (4.3 feet, MAN). Blake Russell misses. Rebound secured by Cade Anthony.

[07:51] Team_025 possession (Score: 83-73)
FOUL! Reach-in foul on Blake Russell during the drive. [Team fouls: 4] No free throws, side out. (Blake Russell: 2 personal fouls)

[07:39] Team_025 possession (Score: 83-73)
Allen Embiid attempts a Midrange. Contested by Blake Russell (4.2 feet, MAN). Allen Embiid misses. Offensive rebound by Desmond Jordan! Desmond Jordan puts it back in!
Score: 83-75

[07:20] Team_054 possession (Score: 83-75)
Blake Russell drives and kicks out. Blake Russell attempts a 3Pt. Contested by Allen Embiid (4.1 feet, MAN). Blake Russell misses. Rebound secured by Allen Embiid.

[07:07] Team_025 possession (Score: 83-75)
FOUL! Holding foul on Vince Ball. [IN THE BONUS! 5 team fouls] Desmond Jordan to the line for 2 free throws. (Vince Ball: 2 personal fouls)   FT 1/2: GOOD   FT 2/2: MISS Desmond Jordan makes 1/2 from the line. Rebound secured by Blake Russell.
Score: 83-76

[06:55] Team_054 possession (Score: 83-76)
Vince Ball attempts a Midrange. Contested by Desmond Jordan (4.5 feet, MAN). Vince Ball misses. Rebound secured by Cade Anthony.

[06:41] Team_025 possession (Score: 83-76)
FOUL! Reach-in foul on Lauri Irving during the drive. [IN THE BONUS! 6 team fouls] Ben Giddey to the line for 2 free throws. (Lauri Irving: 1 personal fouls)   FT 1/2: GOOD   FT 2/2: MISS Ben Giddey makes 1/2 from the line. Rebound secured by Vince Ball.
Score: 83-77

[06:23] Team_054 possession (Score: 83-77)
Malcolm Harden drives and kicks out. Vince Ball attempts a 3Pt. Contested by Desmond Jordan (4.5 feet, MAN). VINCE BALL MAKES IT! Assist: Luka Brogdon
Score: 86-77

[06:11] Team_025 possession (Score: 86-77)
Desmond Jordan attempts a Layup. Contested by Blake Russell (4.5 feet, ZONE). DESMOND JORDAN MAKES IT!
Score: 86-79

[05:57] Team_054 possession (Score: 86-79)
Vince Ball drives and kicks out. Malcolm Harden attempts a 3Pt. Contested by Cade Anthony (5.3 feet, ZONE). Malcolm Harden misses. Rebound secured by Desmond Jordan.

[05:45] Team_025 possession (Score: 86-79)
FOUL! Reach-in foul on Blake Russell during the drive. [IN THE BONUS! 7 team fouls] Allen Embiid to the line for 2 free throws. (Blake Russell: 3 personal fouls)   FT 1/2: GOOD   FT 2/2: GOOD Allen Embiid makes 2/2 from the line.
Score: 86-81

[05:29] Team_054 possession (Score: 86-81)
Malcolm Harden drives to the basket... Malcolm Harden commits a violation (traveling/carry)! TURNOVER! (dead ball)

[05:29] Substitution (Team_054): Malcolm Harden OUT → Shaquille Irving IN (stamina_rule2)

[05:29] Substitution (Team_054): Lauri Irving OUT → Bradley Quickley IN (stamina_rule2)

[05:29] Substitution (Team_054): Vince Ball OUT → Vince James IN (stamina_rule2)

[05:29] Substitution (Team_054): Luka Brogdon OUT → Tobias Nowitzki IN (stamina_rule2)

[05:29] Substitution (Team_054): Blake Russell OUT → Devin Jackson IN (stamina_rule2)

[05:29] Substitution (Team_025): Paolo Lowry OUT → LeBron Griffin IN (stamina_rule2)

[05:29] Substitution (Team_025): Ben Giddey OUT → Dirk Gilgeous-Alexander IN (stamina_rule2)

[05:29] Substitution (Team_025): Desmond Jordan OUT → Immanuel LaVine IN (stamina_rule2)

[05:29] Substitution (Team_025): Cade Anthony OUT → Damian Adebayo IN (stamina_rule2)

[05:29] Substitution (Team_025): Allen Embiid OUT → Nikola Lillard IN (stamina_rule2)

[05:11] Team_025 possession (Score: 86-81)
FOUL! Holding foul on Tobias Nowitzki. [IN THE BONUS! 8 team fouls] Damian Adebayo to the line for 2 free throws. (Tobias Nowitzki: 1 personal fouls)   FT 1/2: GOOD   FT 2/2: GOOD Damian Adebayo makes 2/2 from the line.
Score: 86-83

[04:56] Team_054 possession (Score: 86-83)
Bradley Quickley attempts a 3Pt. Contested by LeBron Griffin (4.4 feet, ZONE). Bradley Quickley misses. Rebound secured by Dirk Gilgeous-Alexander.

[04:41] Team_025 possession (Score: 86-83)
LeBron Griffin attempts a 3Pt. Contested by Shaquille Irving (4.5 feet, ZONE). LEBRON GRIFFIN MAKES IT!
Score: 86-86

[04:29] Team_054 possession (Score: 86-86)
Bradley Quickley attempts a Midrange. Contested by Dirk Gilgeous-Alexander (5.3 feet, MAN). Bradley Quickley misses. FOUL! Loose ball foul on Nikola Lillard during the rebound battle. [Team fouls: 2] No free throws, side out. (Nikola Lillard: 1 personal fouls)

[04:14] Team_054 possession (Score: 86-86)
Shaquille Irving attempts a 3Pt. Contested by LeBron Griffin (5.1 feet, MAN). Shaquille Irving misses. Rebound secured by Immanuel LaVine.

[04:03] Team_025 possession (Score: 86-86)
FOUL! Reach-in foul on Devin Jackson during the drive. [IN THE BONUS! 9 team fouls] Immanuel LaVine to the line for 2 free throws. (Devin Jackson: 1 personal fouls)   FT 1/2: GOOD   FT 2/2: GOOD Immanuel LaVine makes 2/2 from the line.
Score: 86-88

[03:49] Team_054 possession (Score: 86-88)
Devin Jackson drives and kicks out. Tobias Nowitzki attempts a 3Pt. Contested by Damian Adebayo (4.9 feet, MAN). Tobias Nowitzki misses. Rebound secured by Dirk Gilgeous-Alexander.

[03:33] Team_025 possession (Score: 86-88)
Dirk Gilgeous-Alexander attempts a 3Pt. Contested by Shaquille Irving (4.8 feet, ZONE). Dirk Gilgeous-Alexander misses. Rebound secured by Devin Jackson.

[03:17] Team_054 possession (Score: 86-88)
Tobias Nowitzki attempts a Midrange. Contested by LeBron Griffin (4.7 feet, ZONE). Tobias Nowitzki misses. Rebound secured by Nikola Lillard.

[03:05] Team_025 possession (Score: 86-88)
Nikola Lillard attempts a Midrange. Contested by Tobias Nowitzki (5.9 feet, ZONE). Nikola Lillard misses. Rebound secured by Tobias Nowitzki.

[02:49] Team_054 possession (Score: 86-88)
FOUL! Reach-in foul on Dirk Gilgeous-Alexander during the drive. [Team fouls: 3] No free throws, side out. (Dirk Gilgeous-Alexander: 1 personal fouls)

[02:37] Team_054 possession (Score: 86-88)
Shaquille Irving attempts a 3Pt. Contested by LeBron Griffin (5.1 feet, ZONE). Shaquille Irving misses. Offensive rebound by Vince James! Vince James kicks it out.

[02:25] Team_054 possession (Score: 86-88)
Vince James attempts a Layup. Contested by Nikola Lillard (5.2 feet, ZONE). Vince James misses. Rebound secured by Nikola Lillard.

[02:12] Team_025 possession (Score: 86-88)
LeBron Griffin makes the Layup and draws the foul on Devin Jackson! And-1! LeBron Griffin to the line for 1. [BONUS: 10 team fouls] (Devin Jackson: 2 personal fouls)   FT 1/1: MISS LeBron Griffin makes 0/1 from the line. Rebound secured by Tobias Nowitzki.
Score: 86-90

[01:58] Team_054 possession (Score: 86-90)
FOUL! Offensive foul on Shaquille Irving! LeBron Griffin drew the charge! [Team fouls: 11] (Shaquille Irving: 1 personal fouls) TURNOVER! (dead ball)

[01:46] Team_025 possession (Score: 86-90)
Nikola Lillard drives, Devin Jackson stays with him. Nikola Lillard attempts a Layup. Contested by Devin Jackson (5.5 feet, MAN). NIKOLA LILLARD MAKES IT! Assist: Damian Adebayo
Score: 86-92

[01:32] Team_054 possession (Score: 86-92)
Devin Jackson attempts a Layup. Contested by Nikola Lillard (4.6 feet, ZONE). Devin Jackson misses. Rebound secured by Nikola Lillard.

[01:22] Team_025 possession (Score: 86-92)
Nikola Lillard drives, Devin Jackson stays with him. Nikola Lillard attempts a Layup. Contested by Devin Jackson (5.5 feet, ZONE). Nikola Lillard misses. Offensive rebound by Nikola Lillard! Nikola Lillard kicks it out.

[01:07] Team_025 possession (Score: 86-92)
Dirk Gilgeous-Alexander attempts a 3Pt. Contested by Bradley Quickley (4.3 feet, MAN). Dirk Gilgeous-Alexander misses. Rebound secured by Vince James.

[00:56] Team_054 possession (Score: 86-92)
Devin Jackson attempts a Midrange. Contested by Damian Adebayo (5.1 feet, ZONE). Devin Jackson misses. Offensive rebound by Vince James! Vince James kicks it out.

[00:41] Team_054 possession (Score: 86-92)
Bradley Quickley attempts a Midrange. Contested by Dirk Gilgeous-Alexander (5.3 feet, MAN). Bradley Quickley misses. Rebound secured by Dirk Gilgeous-Alexander.

[00:25] Team_025 possession (Score: 86-92)
Nikola Lillard attempts a Layup. Contested by Devin Jackson (5.5 feet, MAN). NIKOLA LILLARD MAKES IT! Assist: Dirk Gilgeous-Alexander
Score: 86-94

[00:11] Team_054 possession (Score: 86-94)
FOUL! Shooting foul on Damian Adebayo. Tobias Nowitzki to the line for 2 free throws. [Team fouls: 4] (Damian Adebayo: 1 personal fouls)   FT 1/2: GOOD   FT 2/2: MISS Tobias Nowitzki makes 1/2 from the line. Rebound secured by Immanuel LaVine.
Score: 87-94

================================================================================
                              4TH QUARTER COMPLETE                              
================================================================================

4TH QUARTER SCORE: Team_054 10, Team_025 30

BOX SCORE:
================================================================================

Team_054
--------------------------------------------------------------------------------
Player                MIN  PTS  REB  AST  TO      FG   FG%      3P   3P%
--------------------------------------------------------------------------------
Vince Ball             33    6    3    0   0   2/5    40.0     0/0   0.0
Luka Brogdon           33    2    1    1   0   1/1   100.0     0/0   0.0
Blake Russell          37    0    2    0   0   0/4     0.0     0/0   0.0
Lauri Irving           33    0    0    1   0   0/1     0.0     0/0   0.0
Bradley Quickley       15    0    0    0   0   0/2     0.0     0/0   0.0
Vince James            15    0    4    0   0   0/1     0.0     0/0   0.0
Shaquille Irving       15    0    0    0   0   0/1     0.0     0/0   0.0
Devin Jackson          12    0    1    0   0   0/2     0.0     0/0   0.0
Tobias Nowitzki        15    0    2    0   0   0/2     0.0     0/0   0.0

TEAM: FG: 3/19 (15.8%), 3PT: 1/7 (14.3%), REB: 12 (4 off, 8 def), AST: 2, TO: 3
TEAM FOULS: 11 [Team_025 in BONUS]


Team_025
--------------------------------------------------------------------------------
Player                MIN  PTS  REB  AST  TO      FG   FG%      3P   3P%
--------------------------------------------------------------------------------
Allen Embiid           37    7    4    0   0   3/4    75.0     0/0   0.0
Desmond Jordan         33    4    3    0   0   2/2   100.0     0/0   0.0
Nikola Lillard         12    4    4    0   0   2/3    66.7     0/0   0.0
LeBron Griffin         15    3    0    0   0   1/2    50.0     0/0   0.0
Cade Anthony           33    2    2    1   0   1/1   100.0     0/0   0.0
Damian Adebayo         15    2    0    1   0   1/1   100.0     0/0   0.0
Immanuel LaVine        15    2    2    0   0   1/1   100.0     0/0   0.0
Ben Giddey             33    0    0    0   0   0/2     0.0     0/0   0.0
Paolo Lowry            33    0    0    0   0   0/1     0.0     0/0   0.0
Dirk Gilgeous-Alexander   15    0    3    1   0   0/2     0.0     0/0   0.0

TEAM: FG: 11/20 (55.0%), 3PT: 2/5 (40.0%), REB: 19 (3 off, 16 def), AST: 3, TO: 1
TEAM FOULS: 4

================================================================================

================================================================================
                               FULL GAME COMPLETE                               
================================================================================

FINAL SCORE: Team_054 87, Team_025 94

SCORING BY QUARTER:
--------------------------------------------------------------------------------
Team                     Q1     Q2     Q3     Q4    FINAL
--------------------------------------------------------------------------------
Team_054                 26     20     31     10       87
Team_025                 25     13     26     30       94
--------------------------------------------------------------------------------

FULL GAME BOX SCORE:
================================================================================

Team_054
--------------------------------------------------------------------------------
Player                MIN  PTS  REB  AST  TO      FG   FG%      3P   3P%      FT STL BLK
--------------------------------------------------------------------------------
Blake Russell          37   22   12    4   2   8/17   47.1   0/2     0.0   7/8     0   0
Malcolm Harden         33    4    0    5   0   5/9    55.6   2/3    66.7   2/3     1   0
Lauri Irving           33    6    5    1   1   5/7    71.4   0/2     0.0   0/0     1   0
Vince Ball             33   18    6    0   2   4/12   33.3   3/7    42.9   5/8     0   0
Luka Brogdon           33   19   13    3   3   8/12   66.7   1/3    33.3   2/2     1   0
Shaquille Irving       15    6    0    0   1   2/4    50.0   0/2     0.0   0/0     0   0
Bradley Quickley       15    0    0    1   0   0/5     0.0   0/1     0.0   0/0     1   0
Vince James            15    2    8    0   0   2/4    50.0   0/1     0.0   0/2     0   1
Tobias Nowitzki        15    3    5    0   1   1/4    25.0   0/1     0.0   2/3     0   0
Devin Jackson          12    0    3    1   1   0/3     0.0   0/0     0.0   1/2     0   1

TEAM: FG: 35/77 (45.5%), 3PT: 6/22 (27.3%), REB: 53 (19 off, 34 def), AST: 15, TO: 11


Team_025
--------------------------------------------------------------------------------
Player                MIN  PTS  REB  AST  TO      FG   FG%      3P   3P%      FT STL BLK
--------------------------------------------------------------------------------
Allen Embiid           37   16   10    0   2   8/14   57.1   1/1   100.0   5/6     1   0
Paolo Lowry            33   12    0    4   3   6/11   54.5   0/3     0.0   3/4     0   0
Ben Giddey             33   11    0    2   1   5/11   45.5   1/4    25.0   3/5     1   0
Desmond Jordan         33   19   13    3   0   4/8    50.0   3/6    50.0   3/4     0   1
Cade Anthony           33    8    7    4   0   5/7    71.4   0/1     0.0   2/2     1   0
LeBron Griffin         15    5    0    1   0   2/4    50.0   1/2    50.0   0/1     0   0
Dirk Gilgeous-Alexander   15    2    7    1   1   1/5    20.0   0/2     0.0   0/0     0   0
Immanuel LaVine        15    4    6    0   3   2/2   100.0   0/0     0.0   2/2     0   0
Damian Adebayo         15    7    0    1   0   2/5    40.0   1/2    50.0   4/4     0   0
Nikola Lillard         12    4    6    0   0   2/4    50.0   0/0     0.0   0/0     0   0

TEAM: FG: 39/74 (52.7%), 3PT: 7/21 (33.3%), REB: 47 (7 off, 40 def), AST: 16, TO: 10

================================================================================
