================================================================================
                        FULL GAME - Team_005 vs Team_027                        
================================================================================

================================================================================
                       1ST QUARTER - Team_005 vs Team_027                       
================================================================================

[12:00] Team_005 possession (Score: 0-0)
FOUL! Reach-in foul on John Russell during the drive. [Team fouls: 1] No free throws, side out. (John Russell: 1 personal fouls)

[11:47] Team_005 possession (Score: 0-0)
Derrick Allen attempts a Layup. Contested by Scottie Harden (4.9 feet, MAN). DERRICK ALLEN MAKES IT! Assist: Anthony Rozier
Score: 2-0

[11:33] Team_027 possession (Score: 2-0)
Tony Doncic throws a bad pass! Stolen by Anthony Rozier! TURNOVER! (live ball)

[11:23] Team_005 possession (Score: 2-0)
Jalen Rozier attempts a 3Pt. Contested by Bradley Dosunmu (4.7 feet, MAN). Jalen Rozier misses. Rebound secured by Bradley Dosunmu.

[11:09] Team_027 possession (Score: 2-0)
Tony Doncic attempts a 3Pt. Contested by Derrick Allen (4.4 feet, ZONE). TONY DONCIC MAKES IT! Assist: Tim Johnson
Score: 2-3

[10:52] Team_005 possession (Score: 2-3)
Jalen Rozier drives to the basket... Jalen Rozier throws a bad pass! Stolen by Bradley Dosunmu! TURNOVER! (live ball)

[10:36] Team_027 possession (Score: 2-3)
FOUL! Reach-in foul on Cade Markkanen during the drive. [Team fouls: 1] No free throws, side out. (Cade Markkanen: 1 personal fouls)

[10:20] Team_027 possession (Score: 2-3)
Bradley Dosunmu attempts a 3Pt. Contested by Anthony Rozier (4.7 feet, ZONE). Bradley Dosunmu misses. Rebound secured by Derrick Allen.

[10:05] Team_005 possession (Score: 2-3)
Anthony Rozier attempts a Midrange. Contested by John Russell (4.0 feet, ZONE). Anthony Rozier misses. Rebound secured by John Russell.

[09:52] Team_027 possession (Score: 2-3)
FOUL! Holding foul on Cade Markkanen. [Team fouls: 2] No free throws, side out. (Cade Markkanen: 2 personal fouls)

[09:38] Team_027 possession (Score: 2-3)
Tim Johnson drives to the basket... Tim Johnson loses the ball! Stripped by Cade Markkanen! TURNOVER! (live ball)

[09:25] Team_005 possession (Score: 2-3)
Anthony Rozier attempts a 3Pt. Contested by Tony Doncic (4.0 feet, MAN). Anthony Rozier misses. Rebound secured by John Russell.

[09:07] Team_027 possession (Score: 2-3)
Tim Johnson drives and kicks out. FOUL! Shooting foul on Brandon George. Tim Johnson to the line for 3 free throws. [Team fouls: 3] (Brandon George: 1 personal fouls)   FT 1/3: MISS   FT 2/3: GOOD   FT 3/3: GOOD Tim Johnson makes 2/3 from the line.
Score: 2-5

[08:52] Team_005 possession (Score: 2-5)
FOUL! Shooting foul on Scottie Harden. Anthony Rozier to the line for 2 free throws. [Team fouls: 2] (Scottie Harden: 1 personal fouls)   FT 1/2: GOOD   FT 2/2: GOOD Anthony Rozier makes 2/2 from the line.
Score: 4-5

[08:35] Team_027 possession (Score: 4-5)
Scottie Harden attempts a Midrange. Contested by Derrick Allen (4.3 feet, MAN). Scottie Harden misses. Rebound secured by Cade Markkanen.

[08:24] Team_005 possession (Score: 4-5)
Derrick Allen drives, Scottie Harden stays with him. Derrick Allen attempts a Layup. Contested by Scottie Harden (4.9 feet, MAN). DERRICK ALLEN MAKES IT! Assist: Anthony Rozier
Score: 6-5

[08:08] Team_027 possession (Score: 6-5)
Scottie Harden attempts a 3Pt. Contested by Anthony Rozier (4.6 feet, ZONE). Scottie Harden misses. Rebound secured by Cade Markkanen.

[07:54] Team_005 possession (Score: 6-5)
Derrick Allen attempts a 3Pt. Contested by Tim Johnson (5.3 feet, ZONE). Derrick Allen misses. Rebound secured by John Russell.

[07:42] Team_027 possession (Score: 6-5)
Bradley Dosunmu attempts a 3Pt. Contested by Cade Markkanen (3.3 feet, MAN). Bradley Dosunmu misses. Rebound secured by Jalen Rozier.

[07:28] Team_005 possession (Score: 6-5)
Derrick Allen attempts a 3Pt. Contested by Scottie Harden (4.9 feet, MAN). Derrick Allen misses. Rebound secured by Bradley Dosunmu.

[07:13] Team_027 possession (Score: 6-5)
Scottie Harden attempts a 3Pt. Contested by Derrick Allen (4.3 feet, ZONE). Scottie Harden misses. Rebound secured by Derrick Allen.

[06:55] Team_005 possession (Score: 6-5)
Jalen Rozier drives and kicks out. Brandon George attempts a Midrange. Contested by Tim Johnson (4.9 feet, MAN). Brandon George misses. Rebound secured by Bradley Dosunmu.

[06:41] Team_027 possession (Score: 6-5)
Tony Doncic attempts a 3Pt. Contested by Derrick Allen (4.4 feet, ZONE). Tony Doncic misses. Offensive rebound by Bradley Dosunmu! Bradley Dosunmu kicks it out.

[06:26] Team_027 possession (Score: 6-5)
Bradley Dosunmu drives to the basket... Bradley Dosunmu throws a bad pass! Stolen by Cade Markkanen! TURNOVER! (live ball)

[06:13] Team_005 possession (Score: 6-5)
Derrick Allen drives, John Russell stays with him. Derrick Allen attempts a Layup. Contested by John Russell (4.3 feet, ZONE). DERRICK ALLEN MAKES IT!
Score: 8-5

[06:01] Team_027 possession (Score: 8-5)
John Russell drives, picks up Cade Markkanen. Help arrives from Anthony Rozier! John Russell attempts a Dunk. Contested by Anthony Rozier (4.1 feet, ZONE). JOHN RUSSELL MAKES IT! Assist: Bradley Dosunmu
Score: 8-7

[05:44] Team_005 possession (Score: 8-7)
Brandon George attempts a Layup. Contested by John Russell (4.1 feet, ZONE). BRANDON GEORGE MAKES IT! Assist: Cade Markkanen
Score: 10-7

[05:28] Team_027 possession (Score: 10-7)
Scottie Harden attempts a 3Pt. Contested by Derrick Allen (4.3 feet, MAN). Scottie Harden misses. Rebound secured by Cade Markkanen.

[05:14] Team_005 possession (Score: 10-7)
FOUL! Shooting foul on Bradley Dosunmu. Cade Markkanen to the line for 2 free throws. [Team fouls: 3] (Bradley Dosunmu: 1 personal fouls)   FT 1/2: GOOD   FT 2/2: GOOD Cade Markkanen makes 2/2 from the line.
Score: 12-7

[05:02] Team_027 possession (Score: 12-7)
Tony Doncic loses the ball! Stripped by Anthony Rozier! TURNOVER! (live ball)

[04:45] Team_005 possession (Score: 12-7)
Anthony Rozier makes the 3Pt and draws the foul on Tony Doncic! And-1! Anthony Rozier to the line for 1. [Team fouls: 4] (Tony Doncic: 1 personal fouls)   FT 1/1: GOOD Anthony Rozier makes 1/1 from the line.
Score: 16-7

[04:30] Team_027 possession (Score: 16-7)
FOUL! Shooting foul on Cade Markkanen. Bradley Dosunmu to the line for 2 free throws. [Team fouls: 4] (Cade Markkanen: 3 personal fouls)   FT 1/2: GOOD   FT 2/2: GOOD Bradley Dosunmu makes 2/2 from the line.
Score: 16-9

[04:15] Team_005 possession (Score: 16-9)
Anthony Rozier drives, John Russell stays with him. Anthony Rozier attempts a Layup. Contested by John Russell (4.1 feet, ZONE). ANTHONY ROZIER MAKES IT! Assist: Cade Markkanen
Score: 18-9

[04:02] Team_027 possession (Score: 18-9)
John Russell attempts a Midrange. Contested by Cade Markkanen (4.2 feet, MAN). JOHN RUSSELL MAKES IT! Assist: Tony Doncic
Score: 18-11

[03:43] Team_005 possession (Score: 18-11)
Brandon George attempts a 3Pt. Contested by Tim Johnson (5.2 feet, MAN). Brandon George misses. Rebound secured by Tony Doncic.

[03:30] Team_027 possession (Score: 18-11)
Bradley Dosunmu drives, picks up Jalen Rozier. Help arrives from Anthony Rozier! Bradley Dosunmu attempts a Layup. Contested by Anthony Rozier (5.1 feet, ZONE). Bradley Dosunmu misses. Rebound secured by Cade Markkanen.

[03:15] Team_005 possession (Score: 18-11)
Anthony Rozier attempts a Layup. Contested by Tony Doncic (4.1 feet, MAN). ANTHONY ROZIER MAKES IT!
Score: 20-11

[03:02] Team_027 possession (Score: 20-11)
John Russell attempts a Layup. Contested by Cade Markkanen (4.3 feet, MAN). JOHN RUSSELL MAKES IT!
Score: 20-13

[02:44] Team_005 possession (Score: 20-13)
Derrick Allen attempts a 3Pt. Contested by Tim Johnson (5.5 feet, ZONE). DERRICK ALLEN MAKES IT! Assist: Anthony Rozier
Score: 23-13

[02:33] Team_027 possession (Score: 23-13)
John Russell attempts a 3Pt. Contested by Cade Markkanen (4.4 feet, MAN). John Russell misses. Rebound secured by Jalen Rozier.

[02:16] Team_005 possession (Score: 23-13)
FOUL! Holding foul on Scottie Harden. [IN THE BONUS! 5 team fouls] Derrick Allen to the line for 2 free throws. (Scottie Harden: 2 personal fouls)   FT 1/2: GOOD   FT 2/2: GOOD Derrick Allen makes 2/2 from the line.
Score: 25-13

[02:04] Team_027 possession (Score: 25-13)
Scottie Harden drives, picks up Derrick Allen. Help arrives from Anthony Rozier! Scottie Harden attempts a Dunk. Contested by Anthony Rozier (4.5 feet, MAN). Scottie Harden misses. Rebound secured by Jalen Rozier.

[01:46] Team_005 possession (Score: 25-13)
FOUL! Shooting foul on Bradley Dosunmu. Jalen Rozier to the line for 2 free throws. [BONUS: 6 team fouls] (Bradley Dosunmu: 2 personal fouls)   FT 1/2: MISS   FT 2/2: GOOD Jalen Rozier makes 1/2 from the line.
Score: 26-13

[01:30] Team_027 possession (Score: 26-13)
Scottie Harden drives, Cade Markkanen stays with him. Scottie Harden attempts a Layup. Contested by Cade Markkanen (3.8 feet, ZONE). SCOTTIE HARDEN MAKES IT! Assist: Tim Johnson
Score: 26-15

[01:15] Team_005 possession (Score: 26-15)
Cade Markkanen drives and kicks out. Brandon George attempts a 3Pt. Contested by Tim Johnson (5.3 feet, ZONE). BRANDON GEORGE MAKES IT! Assist: Derrick Allen
Score: 29-15

[01:00] Team_027 possession (Score: 29-15)
FOUL! Holding foul on Brandon George. [IN THE BONUS! 5 team fouls] Tim Johnson to the line for 2 free throws. (Brandon George: 2 personal fouls)   FT 1/2: GOOD   FT 2/2: GOOD Tim Johnson makes 2/2 from the line.
Score: 29-17

[00:43] Team_005 possession (Score: 29-17)
FOUL! Reach-in foul on Tony Doncic during the drive. [IN THE BONUS! 7 team fouls] Anthony Rozier to the line for 2 free throws. (Tony Doncic: 2 personal fouls)   FT 1/2: GOOD   FT 2/2: GOOD Anthony Rozier makes 2/2 from the line.
Score: 31-17

[00:30] Team_027 possession (Score: 31-17)
Tony Doncic attempts a 3Pt. Contested by Anthony Rozier (5.3 feet, MAN). Tony Doncic misses. Rebound secured by Cade Markkanen.

[00:17] Team_005 possession (Score: 31-17)
Brandon George attempts a Layup. Contested by Bradley Dosunmu (5.0 feet, ZONE). Brandon George misses. Rebound secured by John Russell.

[00:01] Team_027 possession (Score: 31-17)
John Russell drives and kicks out. Scottie Harden attempts a 3Pt. Contested by Derrick Allen (4.7 feet, ZONE). Scottie Harden misses. Offensive rebound by Bradley Dosunmu! Bradley Dosunmu kicks it out.

================================================================================
                              1ST QUARTER COMPLETE                              
================================================================================

1ST QUARTER SCORE: Team_005 31, Team_027 17

BOX SCORE:
================================================================================

Team_005
--------------------------------------------------------------------------------
Player                MIN  PTS  REB  AST  TO      FG   FG%      3P   3P%
--------------------------------------------------------------------------------
Anthony Rozier         12   12    0    3   0   5/7    71.4     0/0   0.0
Derrick Allen          12   11    2    1   0   5/7    71.4     0/0   0.0
Brandon George         12    5    0    0   0   2/4    50.0     0/0   0.0
Cade Markkanen         12    2    5    2   0   1/1   100.0     0/0   0.0
Jalen Rozier           12    1    3    0   0   1/3    33.3     0/0   0.0

TEAM: FG: 14/22 (63.6%), 3PT: 2/7 (28.6%), REB: 10 (0 off, 10 def), AST: 6, TO: 1
TEAM FOULS: 5 [Team_027 in BONUS]


Team_027
--------------------------------------------------------------------------------
Player                MIN  PTS  REB  AST  TO      FG   FG%      3P   3P%
--------------------------------------------------------------------------------
John Russell           12    6    4    0   0   3/4    75.0     0/0   0.0
Tim Johnson            12    4    0    2   0   2/2   100.0     0/0   0.0
Tony Doncic            12    3    1    1   0   1/2    50.0     0/0   0.0
Bradley Dosunmu        12    2    5    1   0   1/4    25.0     0/0   0.0
Scottie Harden         12    2    0    0   0   1/6    16.7     0/0   0.0

TEAM: FG: 8/18 (44.4%), 3PT: 1/8 (12.5%), REB: 10 (2 off, 8 def), AST: 4, TO: 4
TEAM FOULS: 7 [Team_005 in BONUS]

================================================================================

================================================================================
                       2ND QUARTER - Team_005 vs Team_027                       
================================================================================

[12:00] Team_005 possession (Score: 31-17)
Anthony Rozier drives to the basket... Anthony Rozier loses the ball! Stripped by John Russell! TURNOVER! (live ball)

[11:43] Team_027 possession (Score: 31-17)
John Russell makes the Layup and draws the foul on Cade Markkanen! And-1! John Russell to the line for 1. [Team fouls: 1] (Cade Markkanen: 1 personal fouls)   FT 1/1: GOOD John Russell makes 1/1 from the line.
Score: 31-20

[11:26] Team_005 possession (Score: 31-20)
FOUL! Reach-in foul on John Russell during the drive. [Team fouls: 1] No free throws, side out. (John Russell: 1 personal fouls)

[11:15] Team_005 possession (Score: 31-20)
Anthony Rozier attempts a 3Pt. Contested by Tony Doncic (4.2 feet, MAN). Anthony Rozier misses. Offensive rebound by Jalen Rozier! Jalen Rozier kicks it out.

[11:04] Team_005 possession (Score: 31-20)
Brandon George drives, John Russell stays with him. Brandon George attempts a Layup. Contested by John Russell (4.5 feet, ZONE). BRANDON GEORGE MAKES IT! Assist: Anthony Rozier
Score: 33-20

[10:46] Team_027 possession (Score: 33-20)
Tony Doncic attempts a 3Pt. Contested by Derrick Allen (4.7 feet, ZONE). Tony Doncic misses. FOUL! Loose ball foul on Jalen Rozier during the rebound battle. [Team fouls: 2] No free throws, side out. (Jalen Rozier: 1 personal fouls)

[10:31] Team_027 possession (Score: 33-20)
Tony Doncic attempts a Midrange. Contested by Anthony Rozier (5.3 feet, MAN). TONY DONCIC MAKES IT!
Score: 33-22

[10:15] Team_005 possession (Score: 33-22)
FOUL! Holding foul on Bradley Dosunmu. [Team fouls: 2] No free throws, side out. (Bradley Dosunmu: 1 personal fouls)

[10:02] Team_005 possession (Score: 33-22)
Brandon George attempts a 3Pt. Contested by Tim Johnson (5.6 feet, ZONE). Brandon George misses. Rebound secured by John Russell.

[09:47] Team_027 possession (Score: 33-22)
Scottie Harden attempts a 3Pt. Contested by Derrick Allen (4.7 feet, ZONE). Scottie Harden misses. Rebound secured by Cade Markkanen.

[09:29] Team_005 possession (Score: 33-22)
Cade Markkanen attempts a Midrange. Contested by John Russell (4.4 feet, MAN). Cade Markkanen misses. Rebound secured by John Russell.

[09:15] Team_027 possession (Score: 33-22)
Scottie Harden drives to the basket... Scottie Harden throws a bad pass out of bounds! TURNOVER! (dead ball)

[09:15] Substitution (Team_005): Brandon George OUT → Blake O'Neal IN (stamina_rule2)

[09:15] Substitution (Team_005): Anthony Rozier OUT → Draymond Smith IN (stamina_rule2)

[09:15] Substitution (Team_005): Derrick Allen OUT → Lauri Wade IN (stamina_rule2)

[09:15] Substitution (Team_005): Jalen Rozier OUT → Isaiah Durant IN (stamina_rule2)

[09:15] Substitution (Team_005): Cade Markkanen OUT → Zion Parker IN (stamina_rule2)

[09:15] Substitution (Team_027): Tim Johnson OUT → CJ Green IN (stamina_rule2)

[09:15] Substitution (Team_027): Tony Doncic OUT → Dirk Lillard IN (stamina_rule2)

[09:15] Substitution (Team_027): Scottie Harden OUT → Rudy Quickley IN (stamina_rule2)

[09:15] Substitution (Team_027): Bradley Dosunmu OUT → LeBron Russell IN (stamina_rule2)

[09:15] Substitution (Team_027): John Russell OUT → Ben Stewart IN (stamina_rule2)

[08:59] Team_005 possession (Score: 33-22)
Draymond Smith attempts a Layup. Contested by Dirk Lillard (3.9 feet, MAN). Draymond Smith misses. Offensive rebound by Draymond Smith! Draymond Smith kicks it out.

[08:44] Team_005 possession (Score: 33-22)
Isaiah Durant drives and kicks out. Zion Parker attempts a Midrange. Contested by Ben Stewart (4.7 feet, MAN). Zion Parker misses. Rebound secured by Dirk Lillard.

[08:31] Team_027 possession (Score: 33-22)
Ben Stewart attempts a Midrange. Contested by Zion Parker (3.9 feet, MAN). BEN STEWART MAKES IT! Assist: CJ Green
Score: 33-24

[08:16] Team_005 possession (Score: 33-24)
Draymond Smith attempts a Midrange. Contested by Dirk Lillard (3.9 feet, MAN). Draymond Smith misses. Offensive rebound by Draymond Smith! Draymond Smith kicks it out.

[08:01] Team_005 possession (Score: 33-24)
Blake O'Neal attempts a Midrange. Contested by LeBron Russell (5.8 feet, ZONE). Blake O'Neal misses. Rebound secured by Dirk Lillard.

[07:50] Team_027 possession (Score: 33-24)
CJ Green attempts a Layup. Contested by Blake O'Neal (4.2 feet, MAN). CJ Green misses. Rebound secured by Lauri Wade.

[07:36] Team_005 possession (Score: 33-24)
Blake O'Neal attempts a 3Pt. Contested by CJ Green (5.5 feet, MAN). Blake O'Neal misses. Offensive rebound by Zion Parker! Zion Parker puts it back in!
Score: 35-24

[07:19] Team_027 possession (Score: 35-24)
LeBron Russell drives to the basket... LeBron Russell commits a violation (traveling/carry)! TURNOVER! (dead ball)

[07:00] Team_005 possession (Score: 35-24)
Lauri Wade attempts a Midrange. Contested by Rudy Quickley (3.4 feet, MAN). Lauri Wade misses. Rebound secured by Ben Stewart.

[06:48] Team_027 possession (Score: 35-24)
Dirk Lillard makes the Midrange and draws the foul on Draymond Smith! And-1! Dirk Lillard to the line for 1. [Team fouls: 3] (Draymond Smith: 1 personal fouls)   FT 1/1: MISS Dirk Lillard makes 0/1 from the line. Rebound secured by Lauri Wade.
Score: 35-26

[06:33] Team_005 possession (Score: 35-26)
Draymond Smith makes the Layup and draws the foul on Dirk Lillard! And-1! Draymond Smith to the line for 1. [Team fouls: 3] (Dirk Lillard: 1 personal fouls)   FT 1/1: GOOD Draymond Smith makes 1/1 from the line.
Score: 38-26

[06:14] Team_027 possession (Score: 38-26)
FOUL! Shooting foul on Blake O'Neal. CJ Green to the line for 2 free throws. [Team fouls: 4] (Blake O'Neal: 1 personal fouls)   FT 1/2: GOOD   FT 2/2: GOOD CJ Green makes 2/2 from the line.
Score: 38-28

[05:58] Team_005 possession (Score: 38-28)
Blake O'Neal attempts a 3Pt. Contested by Rudy Quickley (3.7 feet, ZONE). Blake O'Neal misses. Rebound secured by Ben Stewart.

[05:44] Team_027 possession (Score: 38-28)
Rudy Quickley attempts a 3Pt. Contested by Blake O'Neal (4.5 feet, ZONE). Rudy Quickley misses. Rebound secured by Zion Parker.

[05:31] Team_005 possession (Score: 38-28)
Blake O'Neal attempts a Midrange. Contested by Dirk Lillard (4.5 feet, ZONE). BLAKE O'NEAL MAKES IT!
Score: 40-28

[05:18] Team_027 possession (Score: 40-28)
FOUL! Holding foul on Blake O'Neal. [IN THE BONUS! 5 team fouls] CJ Green to the line for 2 free throws. (Blake O'Neal: 2 personal fouls)   FT 1/2: GOOD   FT 2/2: MISS CJ Green makes 1/2 from the line. Offensive rebound by Dirk Lillard! Dirk Lillard kicks it out.
Score: 40-29

[05:02] Team_027 possession (Score: 40-29)
Dirk Lillard attempts a 3Pt. Contested by Lauri Wade (5.1 feet, ZONE). Dirk Lillard misses. Rebound secured by Draymond Smith.

[04:51] Team_005 possession (Score: 40-29)
Blake O'Neal attempts a 3Pt. Contested by CJ Green (5.5 feet, MAN). Blake O'Neal misses. Offensive rebound by Draymond Smith! Draymond Smith kicks it out.

[04:39] Team_005 possession (Score: 40-29)
Isaiah Durant attempts a Layup. Contested by LeBron Russell (5.7 feet, MAN). ISAIAH DURANT MAKES IT! Assist: Lauri Wade
Score: 42-29

[04:29] Team_027 possession (Score: 42-29)
Dirk Lillard makes the Layup and draws the foul on Draymond Smith! And-1! Dirk Lillard to the line for 1. [BONUS: 6 team fouls] (Draymond Smith: 2 personal fouls)   FT 1/1: GOOD Dirk Lillard makes 1/1 from the line.
Score: 42-32

[04:12] Team_005 possession (Score: 42-32)
Draymond Smith makes the Layup and draws the foul on Dirk Lillard! And-1! Draymond Smith to the line for 1. [Team fouls: 4] (Dirk Lillard: 2 personal fouls)   FT 1/1: GOOD Draymond Smith makes 1/1 from the line.
Score: 45-32

[03:59] Team_027 possession (Score: 45-32)
CJ Green attempts a 3Pt. Contested by Blake O'Neal (4.2 feet, MAN). CJ Green misses. Offensive rebound by Dirk Lillard! Dirk Lillard kicks it out.

[03:46] Team_027 possession (Score: 45-32)
FOUL! Reach-in foul on Zion Parker during the drive. [IN THE BONUS! 7 team fouls] Ben Stewart to the line for 2 free throws. (Zion Parker: 1 personal fouls)   FT 1/2: MISS   FT 2/2: GOOD Ben Stewart makes 1/2 from the line.
Score: 45-33

[03:30] Team_005 possession (Score: 45-33)
FOUL! Shooting foul on Ben Stewart. Zion Parker to the line for 2 free throws. [BONUS: 5 team fouls] (Ben Stewart: 1 personal fouls)   FT 1/2: MISS   FT 2/2: MISS Zion Parker makes 0/2 from the line. Rebound secured by LeBron Russell.

[03:17] Team_027 possession (Score: 45-33)
LeBron Russell attempts a 3Pt. Contested by Isaiah Durant (4.4 feet, MAN). LeBron Russell misses. Rebound secured by Zion Parker.

[03:01] Team_005 possession (Score: 45-33)
Zion Parker drives to the basket... Zion Parker throws a bad pass out of bounds! TURNOVER! (dead ball)

[02:46] Team_027 possession (Score: 45-33)
CJ Green attempts a 3Pt. Contested by Blake O'Neal (4.2 feet, ZONE). CJ Green misses. Rebound secured by Draymond Smith.

[02:34] Team_005 possession (Score: 45-33)
Zion Parker attempts a 3Pt. Contested by Ben Stewart (4.7 feet, MAN). Zion Parker misses. Rebound secured by Ben Stewart.

[02:21] Team_027 possession (Score: 45-33)
Rudy Quickley commits a violation (traveling/carry)! TURNOVER! (dead ball)

[02:06] Team_005 possession (Score: 45-33)
Blake O'Neal attempts a 3Pt. Contested by CJ Green (5.5 feet, MAN). BLAKE O'NEAL MAKES IT!
Score: 48-33

[01:52] Team_027 possession (Score: 48-33)
Dirk Lillard attempts a 3Pt. Contested by Draymond Smith (4.4 feet, MAN). Dirk Lillard misses. Offensive rebound by Dirk Lillard! Dirk Lillard kicks it out.

[01:33] Team_027 possession (Score: 48-33)
CJ Green attempts a 3Pt. Contested by Draymond Smith (4.5 feet, ZONE). CJ Green misses. Rebound secured by Lauri Wade.

[01:20] Team_005 possession (Score: 48-33)
Zion Parker drives and kicks out. Zion Parker attempts a Midrange. Contested by Dirk Lillard (4.2 feet, ZONE). Zion Parker misses. FOUL! Loose ball foul on LeBron Russell during the rebound battle. [IN THE BONUS! 6 team fouls] Draymond Smith to the line for 2 free throws. (LeBron Russell: 1 personal fouls)   FT 1/2: GOOD   FT 2/2: MISS Draymond Smith makes 1/2 from the line. Rebound secured by Dirk Lillard.
Score: 49-33

[01:04] Team_027 possession (Score: 49-33)
CJ Green attempts a 3Pt. Contested by Blake O'Neal (4.4 feet, ZONE). CJ Green misses. Offensive rebound by Dirk Lillard! Dirk Lillard kicks it out.

[00:47] Team_027 possession (Score: 49-33)
Ben Stewart attempts a Layup. Contested by Zion Parker (4.1 feet, ZONE). Ben Stewart misses. Rebound secured by Zion Parker.

[00:32] Team_005 possession (Score: 49-33)
Draymond Smith attempts a Midrange. BLOCKED BY DIRK LILLARD! Ball is loose! Rebound secured by Ben Stewart.

[00:18] Team_027 possession (Score: 49-33)
LeBron Russell drives to the basket... LeBron Russell throws a bad pass out of bounds! TURNOVER! (dead ball)

================================================================================
                              2ND QUARTER COMPLETE                              
================================================================================

2ND QUARTER SCORE: Team_005 18, Team_027 16

BOX SCORE:
================================================================================

Team_005
--------------------------------------------------------------------------------
Player                MIN  PTS  REB  AST  TO      FG   FG%      3P   3P%
--------------------------------------------------------------------------------
Draymond Smith          9    6    5    0   0   2/3    66.7     0/0   0.0
Blake O'Neal            9    5    0    0   0   2/4    50.0     0/0   0.0
Brandon George         15    2    0    0   0   1/2    50.0     0/0   0.0
Isaiah Durant           9    2    0    0   0   1/2    50.0     0/0   0.0
Zion Parker             9    2    4    0   0   1/4    25.0     0/0   0.0
Jalen Rozier           15    0    1    0   0   0/0     0.0     0/0   0.0
Anthony Rozier         15    0    0    1   0   0/0     0.0     0/0   0.0
Cade Markkanen         15    0    1    0   0   0/1     0.0     0/0   0.0
Lauri Wade              9    0    3    1   0   0/1     0.0     0/0   0.0

TEAM: FG: 7/17 (41.2%), 3PT: 2/5 (40.0%), REB: 15 (6 off, 9 def), AST: 2, TO: 2
TEAM FOULS: 7 [Team_027 in BONUS]


Team_027
--------------------------------------------------------------------------------
Player                MIN  PTS  REB  AST  TO      FG   FG%      3P   3P%
--------------------------------------------------------------------------------
John Russell           15    3    3    0   0   1/1   100.0     0/0   0.0
Dirk Lillard            9    3    7    0   0   1/3    33.3     0/0   0.0
Ben Stewart             9    3    4    0   0   2/3    66.7     0/0   0.0
Tony Doncic            15    2    0    0   0   1/1   100.0     0/0   0.0
CJ Green                9    2    0    1   0   1/4    25.0     0/0   0.0
Scottie Harden         15    0    0    0   0   0/1     0.0     0/0   0.0
Rudy Quickley           9    0    0    0   0   0/1     0.0     0/0   0.0
LeBron Russell          9    0    1    0   0   0/1     0.0     0/0   0.0

TEAM: FG: 6/15 (40.0%), 3PT: 0/6 (0.0%), REB: 14 (5 off, 9 def), AST: 1, TO: 4
TEAM FOULS: 6 [Team_005 in BONUS]

================================================================================

================================================================================
                       3RD QUARTER - Team_005 vs Team_027                       
================================================================================

[12:00] Team_005 possession (Score: 49-33)
Jalen Rozier attempts a Midrange. Contested by Bradley Dosunmu (4.7 feet, MAN). JALEN ROZIER MAKES IT!
Score: 51-33

[11:47] Team_027 possession (Score: 51-33)
FOUL! Shooting foul on Brandon George. Bradley Dosunmu to the line for 2 free throws. [Team fouls: 1] (Brandon George: 1 personal fouls)   FT 1/2: MISS   FT 2/2: GOOD Bradley Dosunmu makes 1/2 from the line.
Score: 51-34

[11:35] Team_005 possession (Score: 51-34)
Jalen Rozier attempts a Midrange. Contested by Bradley Dosunmu (4.7 feet, ZONE). Jalen Rozier misses. Rebound secured by Bradley Dosunmu.

[11:21] Team_027 possession (Score: 51-34)
Tony Doncic drives to the basket... Tony Doncic throws a bad pass out of bounds! TURNOVER! (dead ball)

[11:05] Team_005 possession (Score: 51-34)
FOUL! Reach-in foul on Scottie Harden during the drive. [Team fouls: 1] No free throws, side out. (Scottie Harden: 1 personal fouls)

[10:49] Team_005 possession (Score: 51-34)
Derrick Allen drives, John Russell stays with him. Derrick Allen attempts a Layup. Contested by John Russell (4.3 feet, ZONE). DERRICK ALLEN MAKES IT!
Score: 53-34

[10:36] Team_027 possession (Score: 53-34)
Scottie Harden attempts a 3Pt. Contested by Derrick Allen (4.3 feet, ZONE). Scottie Harden misses. Rebound secured by Cade Markkanen.

[10:23] Team_005 possession (Score: 53-34)
Jalen Rozier attempts a 3Pt. Contested by Tim Johnson (5.2 feet, ZONE). JALEN ROZIER MAKES IT!
Score: 56-34

[10:06] Team_027 possession (Score: 56-34)
Tony Doncic drives and kicks out. Tim Johnson attempts a 3Pt. Contested by Brandon George (5.1 feet, MAN). Tim Johnson misses. Rebound secured by Jalen Rozier.

[09:56] Team_005 possession (Score: 56-34)
Anthony Rozier attempts a Midrange. Contested by Scottie Harden (4.6 feet, ZONE). Anthony Rozier misses. Rebound secured by John Russell.

[09:46] Team_027 possession (Score: 56-34)
Tony Doncic attempts a Midrange. Contested by Anthony Rozier (4.7 feet, ZONE). TONY DONCIC MAKES IT!
Score: 56-36

[09:30] Team_005 possession (Score: 56-36)
Brandon George attempts a 3Pt. Contested by Tim Johnson (5.1 feet, MAN). BRANDON GEORGE MAKES IT! Assist: Jalen Rozier
Score: 59-36

[09:14] Team_027 possession (Score: 59-36)
FOUL! Holding foul on Anthony Rozier. [Team fouls: 2] No free throws, side out. (Anthony Rozier: 1 personal fouls)

[08:58] Team_027 possession (Score: 59-36)
Scottie Harden attempts a Layup. Contested by Cade Markkanen (3.3 feet, ZONE). SCOTTIE HARDEN MAKES IT!
Score: 59-38

[08:42] Team_005 possession (Score: 59-38)
Anthony Rozier makes the 3Pt and draws the foul on Tim Johnson! And-1! Anthony Rozier to the line for 1. [Team fouls: 2] (Tim Johnson: 1 personal fouls)   FT 1/1: GOOD Anthony Rozier makes 1/1 from the line.
Score: 63-38

[08:29] Team_027 possession (Score: 63-38)
John Russell attempts a Midrange. Contested by Cade Markkanen (4.0 feet, MAN). John Russell misses. Rebound secured by Cade Markkanen.

[08:12] Team_005 possession (Score: 63-38)
Anthony Rozier attempts a 3Pt. Contested by Tim Johnson (5.0 feet, ZONE). Anthony Rozier misses. Rebound secured by Tony Doncic.

[07:54] Team_027 possession (Score: 63-38)
Tony Doncic drives, picks up Cade Markkanen. Help arrives from Anthony Rozier! Tony Doncic attempts a Dunk. Contested by Anthony Rozier (3.4 feet, ZONE). Tony Doncic misses. Rebound secured by Cade Markkanen.

[07:40] Team_005 possession (Score: 63-38)
Derrick Allen attempts a 3Pt. Contested by Scottie Harden (4.9 feet, MAN). Derrick Allen misses. Rebound secured by Bradley Dosunmu.

[07:21] Team_027 possession (Score: 63-38)
Scottie Harden attempts a Midrange. Contested by Derrick Allen (4.3 feet, MAN). Scottie Harden misses. Rebound secured by Jalen Rozier.

[07:01] Team_005 possession (Score: 63-38)
Jalen Rozier attempts a 3Pt. Contested by Bradley Dosunmu (4.7 feet, ZONE). Jalen Rozier misses. FOUL! Loose ball foul on Tony Doncic during the rebound battle. [Team fouls: 3] No free throws, side out. (Tony Doncic: 1 personal fouls)

[06:48] Team_005 possession (Score: 63-38)
Derrick Allen drives and kicks out. Cade Markkanen attempts a 3Pt. Contested by Tim Johnson (4.9 feet, ZONE). Cade Markkanen misses. Rebound secured by Tony Doncic.

[06:30] Team_027 possession (Score: 63-38)
Scottie Harden attempts a Midrange. Contested by Derrick Allen (4.3 feet, MAN). Scottie Harden misses. Offensive rebound by John Russell! John Russell's putback is no good. Offensive rebound by Bradley Dosunmu! Bradley Dosunmu kicks it out.

[06:17] Team_027 possession (Score: 63-38)
John Russell drives, Cade Markkanen stays with him. John Russell attempts a Layup. Contested by Cade Markkanen (4.0 feet, ZONE). John Russell misses. Rebound secured by Derrick Allen.

[06:04] Team_005 possession (Score: 63-38)
Derrick Allen attempts a Midrange. Contested by Scottie Harden (4.9 feet, ZONE). DERRICK ALLEN MAKES IT! Assist: Brandon George
Score: 65-38

[05:49] Team_027 possession (Score: 65-38)
John Russell commits a violation (traveling/carry)! TURNOVER! (dead ball)

[05:34] Team_005 possession (Score: 65-38)
FOUL! Reach-in foul on John Russell during the drive. [Team fouls: 4] No free throws, side out. (John Russell: 1 personal fouls)

[05:18] Team_005 possession (Score: 65-38)
Anthony Rozier drives, Tony Doncic stays with him. Anthony Rozier attempts a Layup. Contested by Tony Doncic (4.0 feet, MAN). ANTHONY ROZIER MAKES IT!
Score: 67-38

[05:03] Team_027 possession (Score: 67-38)
John Russell attempts a Midrange. Contested by Cade Markkanen (4.1 feet, MAN). John Russell misses. Offensive rebound by Bradley Dosunmu! Bradley Dosunmu kicks it out.

[04:50] Team_027 possession (Score: 67-38)
Tim Johnson throws a bad pass! Stolen by Brandon George! TURNOVER! (live ball)

[04:31] Team_005 possession (Score: 67-38)
Cade Markkanen attempts a Midrange. Contested by Scottie Harden (4.4 feet, ZONE). CADE MARKKANEN MAKES IT!
Score: 69-38

[04:20] Team_027 possession (Score: 69-38)
John Russell makes the Layup and draws the foul on Cade Markkanen! And-1! John Russell to the line for 1. [Team fouls: 3] (Cade Markkanen: 1 personal fouls)   FT 1/1: MISS John Russell makes 0/1 from the line. Rebound secured by Derrick Allen.
Score: 69-40

[04:07] Team_005 possession (Score: 69-40)
Brandon George makes the Midrange and draws the foul on Bradley Dosunmu! And-1! Brandon George to the line for 1. [BONUS: 5 team fouls] (Bradley Dosunmu: 1 personal fouls)   FT 1/1: GOOD Brandon George makes 1/1 from the line.
Score: 72-40

[03:52] Team_027 possession (Score: 72-40)
Scottie Harden drives to the basket... FOUL! Offensive foul on Scottie Harden! Cade Markkanen drew the charge! [Team fouls: 6] (Scottie Harden: 2 personal fouls) TURNOVER! (dead ball)

[03:36] Team_005 possession (Score: 72-40)
Brandon George attempts a Midrange. Contested by Tim Johnson (5.2 feet, MAN). BRANDON GEORGE MAKES IT!
Score: 74-40

[03:21] Team_027 possession (Score: 74-40)
Tony Doncic attempts a Layup. Contested by Anthony Rozier (4.9 feet, MAN). TONY DONCIC MAKES IT!
Score: 74-42

[03:09] Team_005 possession (Score: 74-42)
Jalen Rozier makes the Dunk and draws the foul on Tony Doncic! And-1! Jalen Rozier to the line for 1. [BONUS: 7 team fouls] (Tony Doncic: 2 personal fouls)   FT 1/1: MISS Jalen Rozier makes 0/1 from the line. Rebound secured by Bradley Dosunmu.
Score: 76-42

[02:55] Team_027 possession (Score: 76-42)
Tony Doncic drives, picks up Anthony Rozier. Help arrives from Derrick Allen! Tony Doncic attempts a Dunk. Contested by Derrick Allen (5.0 feet, MAN). Tony Doncic misses. Offensive rebound by John Russell! John Russell puts it back in!
Score: 76-44

[02:42] Team_005 possession (Score: 76-44)
Brandon George drives, picks up John Russell. Help arrives from Tony Doncic! Brandon George attempts a Layup. Contested by Tony Doncic (4.3 feet, ZONE). Brandon George misses. Rebound secured by John Russell.

[02:27] Team_027 possession (Score: 76-44)
Bradley Dosunmu attempts a Layup. Contested by Cade Markkanen (3.7 feet, ZONE). Bradley Dosunmu misses. Rebound secured by Derrick Allen.

[02:12] Team_005 possession (Score: 76-44)
Brandon George drives, Tim Johnson stays with him. Brandon George attempts a Dunk. Contested by Tim Johnson (5.3 feet, MAN). Brandon George misses. Rebound secured by Tony Doncic.

[01:54] Team_027 possession (Score: 76-44)
Bradley Dosunmu drives, Jalen Rozier stays with him. Bradley Dosunmu attempts a Layup. Contested by Jalen Rozier (5.3 feet, MAN). BRADLEY DOSUNMU MAKES IT!
Score: 76-46

[01:37] Team_005 possession (Score: 76-46)
Brandon George attempts a 3Pt. Contested by Tim Johnson (5.4 feet, MAN). BRANDON GEORGE MAKES IT! Assist: Derrick Allen
Score: 79-46

[01:18] Team_027 possession (Score: 79-46)
Bradley Dosunmu attempts a 3Pt. Contested by Jalen Rozier (5.3 feet, MAN). Bradley Dosunmu misses. Rebound secured by Cade Markkanen.

[01:08] Team_005 possession (Score: 79-46)
Derrick Allen drives to the basket... Derrick Allen throws a bad pass! Stolen by Scottie Harden! TURNOVER! (live ball)

[00:56] Team_027 possession (Score: 79-46)
Tony Doncic attempts a 3Pt. Contested by Anthony Rozier (5.2 feet, ZONE). TONY DONCIC MAKES IT!
Score: 79-49

[00:45] Team_005 possession (Score: 79-49)
Brandon George attempts a Midrange. BLOCKED BY TIM JOHNSON! Ball deflects out of bounds off Brandon George.

[00:32] Team_027 possession (Score: 79-49)
FOUL! Shooting foul on Anthony Rozier. Tony Doncic to the line for 2 free throws. [Team fouls: 4] (Anthony Rozier: 2 personal fouls)   FT 1/2: GOOD   FT 2/2: GOOD Tony Doncic makes 2/2 from the line.
Score: 79-51

[00:19] Team_005 possession (Score: 79-51)
Brandon George attempts a Midrange. Contested by Tim Johnson (5.5 feet, MAN). BRANDON GEORGE MAKES IT! Assist: Cade Markkanen
Score: 81-51

[00:02] Team_027 possession (Score: 81-51)
Tim Johnson attempts a 3Pt. Contested by Derrick Allen (4.9 feet, ZONE). Tim Johnson misses. Offensive rebound by John Russell! John Russell's putback is no good. Rebound secured by Derrick Allen.

================================================================================
                              3RD QUARTER COMPLETE                              
================================================================================

3RD QUARTER SCORE: Team_005 32, Team_027 18

BOX SCORE:
================================================================================

Team_005
--------------------------------------------------------------------------------
Player                MIN  PTS  REB  AST  TO      FG   FG%      3P   3P%
--------------------------------------------------------------------------------
Brandon George         27   13    0    1   0   5/8    62.5     0/0   0.0
Anthony Rozier         27    6    0    0   0   2/4    50.0     0/0   0.0
Jalen Rozier           27    5    3    1   0   2/4    50.0     0/0   0.0
Cade Markkanen         27    2    4    1   0   1/1   100.0     0/0   0.0

TEAM: FG: 12/21 (57.1%), 3PT: 4/6 (66.7%), REB: 10 (1 off, 9 def), AST: 4, TO: 1
TEAM FOULS: 4


Team_027
--------------------------------------------------------------------------------
Player                MIN  PTS  REB  AST  TO      FG   FG%      3P   3P%
--------------------------------------------------------------------------------
Tony Doncic            27    9    3    0   0   4/6    66.7     0/0   0.0
Derrick Allen          27    4    4    1   0   2/4    50.0     0/0   0.0
Bradley Dosunmu        27    3    5    0   0   2/4    50.0     0/0   0.0
Scottie Harden         27    2    0    0   0   1/3    33.3     0/0   0.0
John Russell           27    2    3    0   0   1/4    25.0     0/0   0.0
Tim Johnson            27    0    0    0   0   0/1     0.0     0/0   0.0

TEAM: FG: 8/18 (44.4%), 3PT: 1/4 (25.0%), REB: 12 (4 off, 8 def), AST: 0, TO: 4
TEAM FOULS: 7 [Team_005 in BONUS]

================================================================================

================================================================================
                       4TH QUARTER - Team_005 vs Team_027                       
================================================================================

[12:00] Team_005 possession (Score: 81-51)
FOUL! Reach-in foul on John Russell during the drive. [Team fouls: 1] No free throws, side out. (John Russell: 1 personal fouls)

[11:47] Team_005 possession (Score: 81-51)
Brandon George drives, picks up Tim Johnson. Help arrives from Tony Doncic! Brandon George attempts a Dunk. Contested by Tony Doncic (5.4 feet, MAN). Brandon George misses. Rebound secured by Tony Doncic.

[11:32] Team_027 possession (Score: 81-51)
Bradley Dosunmu makes the Layup and draws the foul on Jalen Rozier! And-1! Bradley Dosunmu to the line for 1. [Team fouls: 1] (Jalen Rozier: 1 personal fouls)   FT 1/1: GOOD Bradley Dosunmu makes 1/1 from the line.
Score: 81-54

[11:17] Team_005 possession (Score: 81-54)
Jalen Rozier attempts a Layup. Contested by Bradley Dosunmu (5.0 feet, MAN). JALEN ROZIER MAKES IT! Assist: Cade Markkanen
Score: 83-54

[11:04] Team_027 possession (Score: 83-54)
Bradley Dosunmu attempts a Midrange. Contested by Jalen Rozier (5.4 feet, MAN). Bradley Dosunmu misses. Offensive rebound by John Russell! John Russell's putback is no good. Rebound secured by Derrick Allen.

[10:48] Team_005 possession (Score: 83-54)
Derrick Allen attempts a Layup. Contested by Scottie Harden (5.3 feet, MAN). DERRICK ALLEN MAKES IT! Assist: Cade Markkanen
Score: 85-54

[10:31] Team_027 possession (Score: 85-54)
FOUL! Holding foul on Anthony Rozier. [Team fouls: 2] No free throws, side out. (Anthony Rozier: 1 personal fouls)

[10:18] Team_027 possession (Score: 85-54)
FOUL! Shooting foul on Jalen Rozier. Bradley Dosunmu to the line for 2 free throws. [Team fouls: 3] (Jalen Rozier: 2 personal fouls)   FT 1/2: MISS   FT 2/2: MISS Bradley Dosunmu makes 0/2 from the line. Rebound secured by Jalen Rozier.

[10:07] Team_005 possession (Score: 85-54)
Anthony Rozier attempts a 3Pt. Contested by Tony Doncic (4.4 feet, MAN). Anthony Rozier misses. Rebound secured by John Russell.

[09:50] Team_027 possession (Score: 85-54)
Bradley Dosunmu attempts a 3Pt. Contested by Derrick Allen (4.8 feet, ZONE). Bradley Dosunmu misses. Rebound secured by Jalen Rozier.

[09:37] Team_005 possession (Score: 85-54)
Brandon George attempts a 3Pt. Contested by Bradley Dosunmu (5.0 feet, ZONE). BRANDON GEORGE MAKES IT!
Score: 88-54

[09:25] Team_027 possession (Score: 88-54)
FOUL! Holding foul on Derrick Allen. [Team fouls: 4] No free throws, side out. (Derrick Allen: 1 personal fouls)

[09:10] Team_027 possession (Score: 88-54)
John Russell attempts a Midrange. Wide open! Brandon George is 6.5 feet away. [ZONE] JOHN RUSSELL MAKES IT! Assist: Scottie Harden
Score: 88-56

[09:01] Team_005 possession (Score: 88-56)
Jalen Rozier attempts a Layup. Contested by John Russell (5.0 feet, ZONE). Jalen Rozier misses. Rebound secured by Tony Doncic.

[08:46] Team_027 possession (Score: 88-56)
Tim Johnson drives, Brandon George stays with him. Tim Johnson attempts a Layup. Wide open! Brandon George is 6.1 feet away. [MAN] Tim Johnson misses. Rebound secured by Cade Markkanen.

[08:29] Team_005 possession (Score: 88-56)
Jalen Rozier attempts a Layup. Contested by John Russell (5.0 feet, ZONE). JALEN ROZIER MAKES IT!
Score: 90-56

[08:14] Team_027 possession (Score: 90-56)
FOUL! Holding foul on Cade Markkanen. [IN THE BONUS! 5 team fouls] John Russell to the line for 2 free throws. (Cade Markkanen: 1 personal fouls)   FT 1/2: MISS   FT 2/2: GOOD John Russell makes 1/2 from the line.
Score: 90-57

[07:59] Team_005 possession (Score: 90-57)
Anthony Rozier drives and kicks out. Brandon George attempts a Midrange. Contested by John Russell (4.9 feet, ZONE). BRANDON GEORGE MAKES IT!
Score: 92-57

[07:42] Team_027 possession (Score: 92-57)
Tony Doncic attempts a Layup. BLOCKED BY ANTHONY ROZIER! Ball deflects out of bounds off Tony Doncic.

[07:25] Team_005 possession (Score: 92-57)
Anthony Rozier attempts a 3Pt. Contested by Bradley Dosunmu (5.2 feet, ZONE). Anthony Rozier misses. Rebound secured by Bradley Dosunmu.

[07:09] Team_027 possession (Score: 92-57)
Tim Johnson attempts a Layup. Contested by Cade Markkanen (4.7 feet, ZONE). TIM JOHNSON MAKES IT!
Score: 92-59

[06:58] Team_005 possession (Score: 92-59)
Anthony Rozier attempts a Midrange. Contested by Scottie Harden (5.5 feet, ZONE). ANTHONY ROZIER MAKES IT! Assist: Derrick Allen
Score: 94-59

[06:41] Team_027 possession (Score: 94-59)
John Russell drives and kicks out. Tim Johnson attempts a Midrange. Contested by Derrick Allen (5.2 feet, ZONE). Tim Johnson misses. Rebound secured by Cade Markkanen.

[06:25] Team_005 possession (Score: 94-59)
Cade Markkanen attempts a Layup. BLOCKED BY JOHN RUSSELL! Ball is loose! Rebound secured by Tony Doncic.

[06:08] Team_027 possession (Score: 94-59)
John Russell drives, picks up Jalen Rozier. Help arrives from Anthony Rozier! John Russell attempts a Layup. Wide open! Anthony Rozier is 6.5 feet away. [ZONE] John Russell misses. Offensive rebound by John Russell! John Russell puts it back in!
Score: 94-61

[05:51] Team_005 possession (Score: 94-61)
Derrick Allen attempts a 3Pt. Contested by Bradley Dosunmu (5.7 feet, ZONE). DERRICK ALLEN MAKES IT! Assist: Jalen Rozier
Score: 97-61

[05:38] Team_027 possession (Score: 97-61)
Bradley Dosunmu attempts a 3Pt. Contested by Derrick Allen (5.3 feet, ZONE). Bradley Dosunmu misses. Rebound secured by Derrick Allen.

[05:20] Team_005 possession (Score: 97-61)
Derrick Allen attempts a 3Pt. Contested by Bradley Dosunmu (5.8 feet, ZONE). DERRICK ALLEN MAKES IT! Assist: Brandon George
Score: 100-61

[05:08] Team_027 possession (Score: 100-61)
FOUL! Reach-in foul on Brandon George during the drive. [IN THE BONUS! 6 team fouls] Tim Johnson to the line for 2 free throws. (Brandon George: 1 personal fouls)   FT 1/2: GOOD   FT 2/2: GOOD Tim Johnson makes 2/2 from the line.
Score: 100-63

[04:55] Team_005 possession (Score: 100-63)
FOUL! Shooting foul on Bradley Dosunmu. Jalen Rozier to the line for 2 free throws. [Team fouls: 2] (Bradley Dosunmu: 1 personal fouls)   FT 1/2: GOOD   FT 2/2: GOOD Jalen Rozier makes 2/2 from the line.
Score: 102-63

[04:36] Team_027 possession (Score: 102-63)
Scottie Harden attempts a 3Pt. Contested by Derrick Allen (5.4 feet, ZONE). SCOTTIE HARDEN MAKES IT! Assist: Tony Doncic
Score: 102-66

[04:21] Team_005 possession (Score: 102-66)
Brandon George drives and kicks out. Anthony Rozier attempts a Midrange. Wide open! Scottie Harden is 6.0 feet away. [ZONE] ANTHONY ROZIER MAKES IT! Assist: Derrick Allen
Score: 104-66

[04:06] Team_027 possession (Score: 104-66)
FOUL! Holding foul on Jalen Rozier. [IN THE BONUS! 7 team fouls] Bradley Dosunmu to the line for 2 free throws. (Jalen Rozier: 3 personal fouls)   FT 1/2: GOOD   FT 2/2: GOOD Bradley Dosunmu makes 2/2 from the line.
Score: 104-68

[03:52] Team_005 possession (Score: 104-68)
Jalen Rozier attempts a Layup. Contested by Bradley Dosunmu (5.9 feet, MAN). Jalen Rozier misses. Rebound secured by Tony Doncic.

[03:36] Team_027 possession (Score: 104-68)
John Russell drives, Cade Markkanen stays with him. John Russell attempts a Dunk. Contested by Cade Markkanen (5.7 feet, ZONE). John Russell misses. Rebound secured by Derrick Allen.

[03:19] Team_005 possession (Score: 104-68)
Brandon George attempts a 3Pt. Wide open! Tim Johnson is 6.4 feet away. [MAN] Brandon George misses. Offensive rebound by Cade Markkanen! Cade Markkanen kicks it out.

[03:06] Team_005 possession (Score: 104-68)
FOUL! Shooting foul on John Russell. Cade Markkanen to the line for 2 free throws. [Team fouls: 3] (John Russell: 2 personal fouls)   FT 1/2: MISS   FT 2/2: GOOD Cade Markkanen makes 1/2 from the line.
Score: 105-68

[02:52] Team_027 possession (Score: 105-68)
Bradley Dosunmu attempts a Midrange. Wide open! Jalen Rozier is 6.4 feet away. [ZONE] Bradley Dosunmu misses. Rebound secured by Cade Markkanen.

[02:35] Team_005 possession (Score: 105-68)
Brandon George drives, John Russell stays with him. Brandon George attempts a Dunk. Contested by John Russell (5.7 feet, ZONE). BRANDON GEORGE MAKES IT!
Score: 107-68

[02:19] Team_027 possession (Score: 107-68)
Bradley Dosunmu attempts a Midrange. Wide open! Brandon George is 6.8 feet away. [ZONE] BRADLEY DOSUNMU MAKES IT! Assist: Tim Johnson
Score: 107-70

[02:03] Team_005 possession (Score: 107-70)
Anthony Rozier drives to the basket... Anthony Rozier commits a violation (traveling/carry)! TURNOVER! (dead ball)

[02:03] Substitution (Team_005): Brandon George OUT → Blake O'Neal IN (stamina_rule2)

[02:03] Substitution (Team_005): Anthony Rozier OUT → Draymond Smith IN (stamina_rule2)

[02:03] Substitution (Team_005): Derrick Allen OUT → Lauri Wade IN (stamina_rule2)

[02:03] Substitution (Team_005): Jalen Rozier OUT → Isaiah Durant IN (stamina_rule2)

[02:03] Substitution (Team_005): Cade Markkanen OUT → Zion Parker IN (stamina_rule2)

[02:03] Substitution (Team_027): Tim Johnson OUT → CJ Green IN (stamina_rule2)

[02:03] Substitution (Team_027): Tony Doncic OUT → Dirk Lillard IN (stamina_rule2)

[02:03] Substitution (Team_027): Scottie Harden OUT → Rudy Quickley IN (stamina_rule2)

[02:03] Substitution (Team_027): Bradley Dosunmu OUT → LeBron Russell IN (stamina_rule2)

[02:03] Substitution (Team_027): John Russell OUT → Ben Stewart IN (stamina_rule2)

[01:49] Team_027 possession (Score: 107-70)
Dirk Lillard attempts a 3Pt. Contested by Draymond Smith (4.3 feet, MAN). DIRK LILLARD MAKES IT! Assist: CJ Green
Score: 107-73

[01:37] Team_005 possession (Score: 107-73)
Lauri Wade attempts a 3Pt. Contested by CJ Green (5.1 feet, ZONE). Lauri Wade misses. FOUL! Loose ball foul on Ben Stewart during the rebound battle. [Team fouls: 4] No free throws, side out. (Ben Stewart: 1 personal fouls)

[01:25] Team_005 possession (Score: 107-73)
Zion Parker attempts a Layup. Contested by Ben Stewart (4.7 feet, ZONE). ZION PARKER MAKES IT! Assist: Blake O'Neal
Score: 109-73

[01:08] Team_027 possession (Score: 109-73)
Rudy Quickley attempts a 3Pt. Contested by Lauri Wade (5.5 feet, MAN). RUDY QUICKLEY MAKES IT!
Score: 109-76

[00:54] Team_005 possession (Score: 109-76)
Isaiah Durant attempts a 3Pt. Contested by Rudy Quickley (3.5 feet, ZONE). Isaiah Durant misses. Rebound secured by Ben Stewart.

[00:39] Team_027 possession (Score: 109-76)
LeBron Russell makes the Layup and draws the foul on Zion Parker! And-1! LeBron Russell to the line for 1. [BONUS: 8 team fouls] (Zion Parker: 1 personal fouls)   FT 1/1: GOOD LeBron Russell makes 1/1 from the line.
Score: 109-79

[00:23] Team_005 possession (Score: 109-79)
FOUL! Shooting foul on Dirk Lillard. Lauri Wade to the line for 2 free throws. [BONUS: 5 team fouls] (Dirk Lillard: 1 personal fouls)   FT 1/2: GOOD   FT 2/2: GOOD Lauri Wade makes 2/2 from the line.
Score: 111-79

[00:08] Team_027 possession (Score: 111-79)
FOUL! Shooting foul on Isaiah Durant. LeBron Russell to the line for 2 free throws. [BONUS: 9 team fouls] (Isaiah Durant: 1 personal fouls)   FT 1/2: GOOD   FT 2/2: GOOD LeBron Russell makes 2/2 from the line.
Score: 111-81

================================================================================
                              4TH QUARTER COMPLETE                              
================================================================================

4TH QUARTER SCORE: Team_005 30, Team_027 30

BOX SCORE:
================================================================================

Team_005
--------------------------------------------------------------------------------
Player                MIN  PTS  REB  AST  TO      FG   FG%      3P   3P%
--------------------------------------------------------------------------------
Derrick Allen          38    8    3    2   0   3/3   100.0     0/0   0.0
Brandon George         38    7    0    1   0   3/4    75.0     0/0   0.0
Jalen Rozier           38    6    2    1   0   3/5    60.0     0/0   0.0
Anthony Rozier         38    4    0    0   0   2/4    50.0     0/0   0.0
Zion Parker            11    2    0    0   0   1/1   100.0     0/0   0.0
Lauri Wade             11    2    0    0   0   1/1   100.0     0/0   0.0
Cade Markkanen         38    1    4    2   0   1/2    50.0     0/0   0.0
Draymond Smith         11    0    1    0   0   0/0     0.0     0/0   0.0
Blake O'Neal           11    0    0    1   0   0/0     0.0     0/0   0.0
Isaiah Durant          11    0    0    0   0   0/1     0.0     0/0   0.0

TEAM: FG: 14/21 (66.7%), 3PT: 3/6 (50.0%), REB: 9 (2 off, 7 def), AST: 7, TO: 1
TEAM FOULS: 9 [Team_027 in BONUS]


Team_027
--------------------------------------------------------------------------------
Player                MIN  PTS  REB  AST  TO      FG   FG%      3P   3P%
--------------------------------------------------------------------------------
Bradley Dosunmu        38    7    1    0   0   3/8    37.5     0/0   0.0
John Russell           38    5    2    0   0   3/5    60.0     0/0   0.0
LeBron Russell         11    5    0    0   0   2/2   100.0     0/0   0.0
Tim Johnson            38    4    0    1   0   2/3    66.7     0/0   0.0
Scottie Harden         38    3    0    1   0   1/1   100.0     0/0   0.0
Dirk Lillard           11    3    0    0   0   1/1   100.0     0/0   0.0
Rudy Quickley          11    3    0    0   0   1/1   100.0     0/0   0.0
Tony Doncic            38    0    4    1   0   0/1     0.0     0/0   0.0
CJ Green               11    0    0    1   0   0/0     0.0     0/0   0.0
Ben Stewart            11    0    1    0   0   0/0     0.0     0/0   0.0

TEAM: FG: 13/22 (59.1%), 3PT: 3/5 (60.0%), REB: 9 (2 off, 7 def), AST: 4, TO: 0
TEAM FOULS: 5 [Team_005 in BONUS]

================================================================================

================================================================================
                               FULL GAME COMPLETE                               
================================================================================

FINAL SCORE: Team_005 111, Team_027 81

SCORING BY QUARTER:
--------------------------------------------------------------------------------
Team                     Q1     Q2     Q3     Q4    FINAL
--------------------------------------------------------------------------------
Team_005                 31     18     32     30      111
Team_027                 17     16     18     30       81
--------------------------------------------------------------------------------

FULL GAME BOX SCORE:
================================================================================

Team_005
--------------------------------------------------------------------------------
Player                MIN  PTS  REB  AST  TO      FG   FG%      3P   3P%      FT STL BLK
--------------------------------------------------------------------------------
Brandon George         38   27    0    2   1  10/17   58.8   3/5    60.0   1/1     1   0
Anthony Rozier         38   22    0    4   0   9/15   60.0   2/6    33.3   6/6     2   1
Derrick Allen          38   23    9    4   1   9/13   69.2   3/6    50.0   2/2     0   0
Jalen Rozier           38   12    9    2   2   6/12   50.0   1/2    50.0   3/5     0   0
Cade Markkanen         38    5   14    5   0   4/6    66.7   0/0     0.0   3/4     2   0
Blake O'Neal           11    5    0    1   0   3/5    60.0   2/3    66.7   0/0     0   0
Draymond Smith         11    6    6    0   0   2/3    66.7   0/0     0.0   3/4     0   0
Lauri Wade             11    2    3    1   0   1/2    50.0   0/0     0.0   2/2     0   0
Isaiah Durant          11    2    0    0   1   1/3    33.3   0/1     0.0   0/0     0   0
Zion Parker            11    4    4    0   0   1/4    25.0   0/1     0.0   0/2     0   0

TEAM: FG: 47/81 (58.0%), 3PT: 11/24 (45.8%), REB: 44 (9 off, 35 def), AST: 19, TO: 5


Team_027
--------------------------------------------------------------------------------
Player                MIN  PTS  REB  AST  TO      FG   FG%      3P   3P%      FT STL BLK
--------------------------------------------------------------------------------
Tim Johnson            38    8    0    3   2   3/5    60.0   0/1     0.0   6/7     0   1
Tony Doncic            38   14    8    2   2   7/11   63.6   2/3    66.7   2/2     0   0
Scottie Harden         38    7    0    1   1   3/11   27.3   1/6    16.7   0/0     1   0
Bradley Dosunmu        38   12   11    1   0   5/15   33.3   0/5     0.0   6/9     1   0
John Russell           38   16   12    0   4   6/12   50.0   0/1     0.0   2/4     1   1
CJ Green               11    2    0    2   0   1/4    25.0   0/2     0.0   3/4     0   0
Dirk Lillard           11    6    7    0   1   2/4    50.0   1/2    50.0   1/2     0   1
Rudy Quickley          11    3    0    0   1   1/2    50.0   1/2    50.0   0/0     0   0
LeBron Russell         11    5    1    0   1   2/3    66.7   0/1     0.0   3/3     0   0
Ben Stewart            11    3    5    0   0   2/3    66.7   0/0     0.0   1/2     0   0

TEAM: FG: 35/73 (47.9%), 3PT: 5/23 (21.7%), REB: 45 (13 off, 32 def), AST: 9, TO: 12

================================================================================
