================================================================================
                        FULL GAME - Team_063 vs Team_069                        
================================================================================

================================================================================
                       1ST QUARTER - Team_063 vs Team_069                       
================================================================================

[12:00] Team_063 possession (Score: 0-0)
Dirk Reaves attempts a Layup. Contested by Domantas Towns (4.8 feet, ZONE). Dirk Reaves misses. Rebound secured by Domantas Towns.

[11:47] Team_069 possession (Score: 0-0)
Pau Middleton drives to the basket... Pau Middleton throws a bad pass! Stolen by Terry Reaves! TURNOVER! (live ball)

[11:32] Team_063 possession (Score: 0-0)
Malcolm Quickley drives and kicks out. Tyler Harris attempts a 3Pt. Contested by James Sexton (3.3 feet, ZONE). Tyler Harris misses. Rebound secured by CJ Fox.

[11:18] Team_069 possession (Score: 0-0)
James Sexton attempts a 3Pt. Contested by Bradley Davis (5.5 feet, MAN). James Sexton misses. Rebound secured by Tyler Harris.

[11:04] Team_063 possession (Score: 0-0)
FOUL! Reach-in foul on CJ Fox during the drive. [Team fouls: 1] No free throws, side out. (CJ Fox: 1 personal fouls)

[10:50] Team_063 possession (Score: 0-0)
Malcolm Quickley attempts a 3Pt. Contested by James Sexton (3.1 feet, ZONE). Malcolm Quickley misses. Rebound secured by Pau Middleton.

[10:32] Team_069 possession (Score: 0-0)
Pau Middleton drives and kicks out. Pau Middleton attempts a 3Pt. Contested by Terry Reaves (4.6 feet, MAN). Pau Middleton misses. Rebound secured by Malcolm Quickley.

[10:21] Team_063 possession (Score: 0-0)
Dirk Reaves makes the Midrange and draws the foul on Pau Middleton! And-1! Dirk Reaves to the line for 1. [Team fouls: 2] (Pau Middleton: 1 personal fouls)   FT 1/1: GOOD Dirk Reaves makes 1/1 from the line.
Score: 3-0

[10:07] Team_069 possession (Score: 3-0)
FOUL! Shooting foul on Bradley Davis. James Sexton to the line for 2 free throws. [Team fouls: 1] (Bradley Davis: 1 personal fouls)   FT 1/2: GOOD   FT 2/2: GOOD James Sexton makes 2/2 from the line.
Score: 3-2

[09:54] Team_063 possession (Score: 3-2)
Dirk Reaves drives, Domantas Towns stays with him. Dirk Reaves attempts a Layup. Contested by Domantas Towns (4.8 feet, ZONE). DIRK REAVES MAKES IT! Assist: Bradley Davis
Score: 5-2

[09:40] Team_069 possession (Score: 5-2)
Domantas Towns attempts a Layup. Contested by Dirk Reaves (3.9 feet, MAN). DOMANTAS TOWNS MAKES IT! Assist: James Sexton
Score: 5-4

[09:26] Team_063 possession (Score: 5-4)
Dirk Reaves drives, Domantas Towns stays with him. Dirk Reaves attempts a Layup. Contested by Domantas Towns (4.8 feet, ZONE). DIRK REAVES MAKES IT!
Score: 7-4

[09:08] Team_069 possession (Score: 7-4)
Domantas Towns attempts a 3Pt. Contested by Malcolm Quickley (3.8 feet, ZONE). Domantas Towns misses. Rebound secured by Malcolm Quickley.

[08:53] Team_063 possession (Score: 7-4)
Terry Reaves attempts a Midrange. Contested by Pau Middleton (4.2 feet, ZONE). Terry Reaves misses. Rebound secured by Pau Middleton.

[08:41] Team_069 possession (Score: 7-4)
FOUL! Reach-in foul on Tyler Harris during the drive. [Team fouls: 2] No free throws, side out. (Tyler Harris: 1 personal fouls)

[08:30] Team_069 possession (Score: 7-4)
FOUL! Shooting foul on Tyler Harris. CJ Fox to the line for 2 free throws. [Team fouls: 3] (Tyler Harris: 2 personal fouls)   FT 1/2: GOOD   FT 2/2: GOOD CJ Fox makes 2/2 from the line.
Score: 7-6

[08:17] Team_063 possession (Score: 7-6)
Tyler Harris attempts a Midrange. Contested by James Sexton (3.2 feet, ZONE). TYLER HARRIS MAKES IT!
Score: 9-6

[08:03] Team_069 possession (Score: 9-6)
James Sexton makes the Layup and draws the foul on Tyler Harris! And-1! James Sexton to the line for 1. [Team fouls: 4] (Tyler Harris: 3 personal fouls)   FT 1/1: GOOD James Sexton makes 1/1 from the line.
Score: 9-9

[07:49] Team_063 possession (Score: 9-9)
Terry Reaves drives and kicks out. Terry Reaves attempts a Midrange. Contested by Pau Middleton (3.9 feet, MAN). Terry Reaves misses. Rebound secured by Domantas Towns.

[07:37] Team_069 possession (Score: 9-9)
Pau Middleton attempts a Layup. Contested by Terry Reaves (4.9 feet, MAN). Pau Middleton misses. Rebound secured by Malcolm Quickley.

[07:24] Team_063 possession (Score: 9-9)
Malcolm Quickley attempts a Midrange. Contested by Domantas Lowry (4.1 feet, MAN). Malcolm Quickley misses. Offensive rebound by Tyler Harris! Tyler Harris's putback is no good. Rebound secured by Pau Middleton.

[07:07] Team_069 possession (Score: 9-9)
CJ Fox attempts a Layup. Contested by Tyler Harris (4.6 feet, ZONE). CJ FOX MAKES IT! Assist: James Sexton
Score: 9-11

[06:49] Team_063 possession (Score: 9-11)
Bradley Davis attempts a 3Pt. Contested by Pau Middleton (4.1 feet, ZONE). Bradley Davis misses. Rebound secured by Domantas Towns.

[06:31] Team_069 possession (Score: 9-11)
FOUL! Holding foul on Tyler Harris. [IN THE BONUS! 5 team fouls] CJ Fox to the line for 2 free throws. (Tyler Harris: 4 personal fouls)   FT 1/2: GOOD   FT 2/2: GOOD CJ Fox makes 2/2 from the line.
Score: 9-13

[06:11] Team_063 possession (Score: 9-13)
Terry Reaves attempts a 3Pt. Contested by James Sexton (3.6 feet, ZONE). Terry Reaves misses. Offensive rebound by Tyler Harris! Tyler Harris's putback is no good. Offensive rebound by Dirk Reaves! Dirk Reaves kicks it out.

[05:59] Team_063 possession (Score: 9-13)
Tyler Harris attempts a Layup. Contested by Domantas Towns (4.5 feet, ZONE). Tyler Harris misses. Rebound secured by CJ Fox.

[05:43] Team_069 possession (Score: 9-13)
Domantas Towns attempts a Midrange. Contested by Dirk Reaves (3.9 feet, ZONE). Domantas Towns misses. Offensive rebound by CJ Fox! CJ Fox kicks it out.

[05:31] Team_069 possession (Score: 9-13)
CJ Fox drives and kicks out. Pau Middleton attempts a Midrange. Contested by Terry Reaves (4.6 feet, MAN). Pau Middleton misses. Rebound secured by Malcolm Quickley.

[05:18] Team_063 possession (Score: 9-13)
Malcolm Quickley drives to the basket... Malcolm Quickley loses control! Ball rolls out of bounds! TURNOVER! (dead ball)

[05:03] Team_069 possession (Score: 9-13)
James Sexton attempts a 3Pt. Contested by Bradley Davis (5.5 feet, MAN). James Sexton misses. Rebound secured by Malcolm Quickley.

[04:47] Team_063 possession (Score: 9-13)
Tyler Harris drives and kicks out. Malcolm Quickley attempts a 3Pt. Contested by James Sexton (3.4 feet, ZONE). Malcolm Quickley misses. Offensive rebound by Tyler Harris! Tyler Harris's putback is no good. Rebound secured by CJ Fox.

[04:33] Team_069 possession (Score: 9-13)
Pau Middleton attempts a 3Pt. Contested by Malcolm Quickley (3.9 feet, ZONE). PAU MIDDLETON MAKES IT! Assist: James Sexton
Score: 9-16

[04:17] Team_063 possession (Score: 9-16)
Bradley Davis attempts a 3Pt. Contested by James Sexton (3.6 feet, ZONE). BRADLEY DAVIS MAKES IT! Assist: Terry Reaves
Score: 12-16

[04:02] Team_069 possession (Score: 12-16)
CJ Fox attempts a Midrange. Contested by Tyler Harris (4.7 feet, MAN). CJ Fox misses. Rebound secured by Tyler Harris.

[03:47] Team_063 possession (Score: 12-16)
Terry Reaves attempts a 3Pt. Contested by James Sexton (3.7 feet, ZONE). Terry Reaves misses. Rebound secured by Domantas Towns.

[03:33] Team_069 possession (Score: 12-16)
FOUL! Reach-in foul on Malcolm Quickley during the drive. [IN THE BONUS! 6 team fouls] Domantas Lowry to the line for 2 free throws. (Malcolm Quickley: 1 personal fouls)   FT 1/2: GOOD   FT 2/2: GOOD Domantas Lowry makes 2/2 from the line.
Score: 12-18

[03:22] Team_063 possession (Score: 12-18)
Bradley Davis drives to the basket... Bradley Davis throws a bad pass out of bounds! TURNOVER! (dead ball)

[03:22] Substitution (Team_069): Pau Middleton OUT → Tyrese Simons IN (stamina_rule2)

[03:22] Substitution (Team_069): Domantas Towns OUT → Devin Giddey IN (stamina_rule2)

[03:08] Team_069 possession (Score: 12-18)
Domantas Lowry drives and kicks out. CJ Fox attempts a 3Pt. Contested by Malcolm Quickley (3.7 feet, ZONE). CJ Fox misses. Rebound secured by Dirk Reaves.

[02:55] Team_063 possession (Score: 12-18)
FOUL! Shooting foul on Tyrese Simons. Terry Reaves to the line for 3 free throws. [Team fouls: 3] (Tyrese Simons: 1 personal fouls)   FT 1/3: GOOD   FT 2/3: GOOD   FT 3/3: GOOD Terry Reaves makes 3/3 from the line.
Score: 15-18

[02:42] Team_069 possession (Score: 15-18)
FOUL! Shooting foul on Dirk Reaves. Devin Giddey to the line for 2 free throws. [BONUS: 7 team fouls] (Dirk Reaves: 1 personal fouls)   FT 1/2: MISS   FT 2/2: GOOD Devin Giddey makes 1/2 from the line.
Score: 15-19

[02:29] Team_063 possession (Score: 15-19)
FOUL! Holding foul on Tyrese Simons. [Team fouls: 4] No free throws, side out. (Tyrese Simons: 2 personal fouls)

[02:16] Team_063 possession (Score: 15-19)
Tyler Harris throws a bad pass! Stolen by CJ Fox! TURNOVER! (live ball)

[02:07] Team_069 possession (Score: 15-19)
Devin Giddey attempts a 3Pt. Contested by Malcolm Quickley (3.7 feet, ZONE). Devin Giddey misses. Rebound secured by Tyler Harris.

[01:54] Team_063 possession (Score: 15-19)
Terry Reaves drives to the basket... Terry Reaves throws a bad pass! Stolen by Tyrese Simons! TURNOVER! (live ball)

[01:41] Team_069 possession (Score: 15-19)
CJ Fox drives to the basket... CJ Fox throws a bad pass out of bounds! TURNOVER! (dead ball)

[01:41] Substitution (Team_063): Bradley Davis OUT → DeMar Banchero IN (stamina_rule2)

[01:41] Substitution (Team_063): Malcolm Quickley OUT → Cole Durant IN (stamina_rule2)

[01:41] Substitution (Team_063): Terry Reaves OUT → Jaren James IN (stamina_rule2)

[01:41] Substitution (Team_063): Dirk Reaves OUT → Lamelo Ball IN (stamina_rule2)

[01:41] Substitution (Team_063): Tyler Harris OUT → Kyle Green IN (stamina_rule2)

[01:41] Substitution (Team_069): James Sexton OUT → Jarrett Murray IN (stamina_rule2)

[01:41] Substitution (Team_069): Domantas Lowry OUT → Trae Antetokounmpo IN (stamina_rule2)

[01:41] Substitution (Team_069): CJ Fox OUT → Shai Quickley IN (stamina_rule2)

[01:26] Team_063 possession (Score: 15-19)
Kyle Green attempts a Midrange. Contested by Shai Quickley (4.3 feet, MAN). KYLE GREEN MAKES IT!
Score: 17-19

[01:10] Team_069 possession (Score: 17-19)
Tyrese Simons attempts a 3Pt. Contested by Jaren James (4.3 feet, MAN). TYRESE SIMONS MAKES IT! Assist: Jarrett Murray
Score: 17-22

[00:57] Team_063 possession (Score: 17-22)
Cole Durant attempts a Layup. Contested by Devin Giddey (5.5 feet, ZONE). Cole Durant misses. Rebound secured by Shai Quickley.

[00:43] Team_069 possession (Score: 17-22)
Trae Antetokounmpo attempts a 3Pt. Contested by Cole Durant (4.4 feet, MAN). Trae Antetokounmpo misses. Offensive rebound by Shai Quickley! Shai Quickley puts it back in!
Score: 17-24

[00:26] Team_063 possession (Score: 17-24)
Jaren James drives, picks up Devin Giddey. Help arrives from Trae Antetokounmpo! Jaren James attempts a Dunk. Contested by Trae Antetokounmpo (5.3 feet, ZONE). JAREN JAMES MAKES IT! Assist: Cole Durant
Score: 19-24

[00:09] Team_069 possession (Score: 19-24)
Trae Antetokounmpo attempts a Midrange. Contested by Lamelo Ball (4.9 feet, ZONE). Trae Antetokounmpo misses. Rebound secured by Lamelo Ball.

================================================================================
                              1ST QUARTER COMPLETE                              
================================================================================

1ST QUARTER SCORE: Team_063 19, Team_069 24

BOX SCORE:
================================================================================

Team_063
--------------------------------------------------------------------------------
Player                MIN  PTS  REB  AST  TO      FG   FG%      3P   3P%
--------------------------------------------------------------------------------
Dirk Reaves            11    7    2    0   0   3/4    75.0     0/0   0.0
Bradley Davis          11    3    0    1   0   1/2    50.0     0/0   0.0
Terry Reaves           11    3    0    1   0   1/4    25.0     0/0   0.0
Tyler Harris           11    2    3    0   0   1/3    33.3     0/0   0.0
Kyle Green              2    2    0    0   0   1/1   100.0     0/0   0.0
Jaren James             2    2    0    0   0   1/1   100.0     0/0   0.0
Malcolm Quickley       11    0    5    0   0   0/3     0.0     0/0   0.0
Cole Durant             2    0    0    1   0   0/1     0.0     0/0   0.0
Lamelo Ball             2    0    1    0   0   0/0     0.0     0/0   0.0

TEAM: FG: 8/19 (42.1%), 3PT: 2/5 (40.0%), REB: 13 (3 off, 10 def), AST: 3, TO: 4
TEAM FOULS: 7 [Team_069 in BONUS]


Team_069
--------------------------------------------------------------------------------
Player                MIN  PTS  REB  AST  TO      FG   FG%      3P   3P%
--------------------------------------------------------------------------------
CJ Fox                 11    6    4    0   0   3/5    60.0     0/0   0.0
James Sexton           11    5    0    3   0   2/4    50.0     0/0   0.0
Pau Middleton           9    3    3    0   0   1/3    33.3     0/0   0.0
Tyrese Simons           3    3    0    0   0   1/1   100.0     0/0   0.0
Domantas Towns          9    2    4    0   0   1/2    50.0     0/0   0.0
Domantas Lowry         11    2    0    0   0   1/2    50.0     0/0   0.0
Shai Quickley           2    2    2    0   0   1/1   100.0     0/0   0.0
Devin Giddey            3    1    0    0   0   1/2    50.0     0/0   0.0
Jarrett Murray          2    0    0    1   0   0/0     0.0     0/0   0.0
Trae Antetokounmpo      2    0    0    0   0   0/1     0.0     0/0   0.0

TEAM: FG: 11/21 (52.4%), 3PT: 3/7 (42.9%), REB: 11 (2 off, 9 def), AST: 4, TO: 2
TEAM FOULS: 4

================================================================================

================================================================================
                       2ND QUARTER - Team_063 vs Team_069                       
================================================================================

[12:00] Team_063 possession (Score: 19-24)
Bradley Davis attempts a 3Pt. Contested by James Sexton (3.6 feet, MAN). Bradley Davis misses. Rebound secured by CJ Fox.

[11:41] Team_069 possession (Score: 19-24)
Domantas Lowry makes the Layup and draws the foul on Tyler Harris! And-1! Domantas Lowry to the line for 1. [Team fouls: 1] (Tyler Harris: 1 personal fouls)   FT 1/1: MISS Domantas Lowry makes 0/1 from the line. Rebound secured by Malcolm Quickley.
Score: 19-26

[11:27] Team_063 possession (Score: 19-26)
Bradley Davis attempts a 3Pt. Contested by James Sexton (3.7 feet, MAN). Bradley Davis misses. Rebound secured by Pau Middleton.

[11:17] Team_069 possession (Score: 19-26)
James Sexton drives and kicks out. Domantas Lowry attempts a 3Pt. Contested by Malcolm Quickley (3.7 feet, MAN). DOMANTAS LOWRY MAKES IT! Assist: CJ Fox
Score: 19-29

[11:03] Team_063 possession (Score: 19-29)
Malcolm Quickley attempts a 3Pt. Contested by Domantas Towns (4.4 feet, ZONE). Malcolm Quickley misses. Rebound secured by Pau Middleton.

[10:49] Team_069 possession (Score: 19-29)
Domantas Lowry attempts a 3Pt. Contested by Malcolm Quickley (3.7 feet, ZONE). DOMANTAS LOWRY MAKES IT!
Score: 19-32

[10:35] Team_063 possession (Score: 19-32)
FOUL! Shooting foul on Domantas Towns. Malcolm Quickley to the line for 2 free throws. [Team fouls: 1] (Domantas Towns: 1 personal fouls)   FT 1/2: GOOD   FT 2/2: GOOD Malcolm Quickley makes 2/2 from the line.
Score: 21-32

[10:21] Team_069 possession (Score: 21-32)
Pau Middleton attempts a Midrange. Contested by Malcolm Quickley (4.1 feet, ZONE). Pau Middleton misses. Rebound secured by Malcolm Quickley.

[10:06] Team_063 possession (Score: 21-32)
Tyler Harris drives to the basket... Tyler Harris throws a bad pass out of bounds! TURNOVER! (dead ball)

[10:06] Substitution (Team_063): Bradley Davis OUT → DeMar Banchero IN (stamina_rule2)

[10:06] Substitution (Team_063): Malcolm Quickley OUT → Cole Durant IN (stamina_rule2)

[10:06] Substitution (Team_063): Terry Reaves OUT → Jaren James IN (stamina_rule2)

[10:06] Substitution (Team_063): Dirk Reaves OUT → Lamelo Ball IN (stamina_rule2)

[10:06] Substitution (Team_063): Tyler Harris OUT → Kyle Green IN (stamina_rule2)

[10:06] Substitution (Team_069): James Sexton OUT → Jarrett Murray IN (stamina_rule2)

[10:06] Substitution (Team_069): CJ Fox OUT → Shai Quickley IN (stamina_rule2)

[09:56] Team_069 possession (Score: 21-32)
FOUL! Reach-in foul on Lamelo Ball during the drive. [Team fouls: 2] No free throws, side out. (Lamelo Ball: 1 personal fouls)

[09:41] Team_069 possession (Score: 21-32)
Shai Quickley attempts a Layup. BLOCKED BY KYLE GREEN! Ball is loose! Rebound secured by Lamelo Ball.

[09:25] Team_063 possession (Score: 21-32)
Cole Durant attempts a Midrange. Contested by Shai Quickley (4.5 feet, ZONE). Cole Durant misses. FOUL! Loose ball foul on Shai Quickley during the rebound battle. [Team fouls: 2] No free throws, side out. (Shai Quickley: 1 personal fouls)

[09:15] Team_063 possession (Score: 21-32)
Jaren James attempts a 3Pt. Contested by Pau Middleton (4.3 feet, MAN). Jaren James misses. Rebound secured by Shai Quickley.

[08:59] Team_069 possession (Score: 21-32)
Domantas Towns attempts a Midrange. Contested by Lamelo Ball (4.9 feet, MAN). Domantas Towns misses. Rebound secured by Cole Durant.

[08:45] Team_063 possession (Score: 21-32)
Cole Durant attempts a Midrange. Contested by Domantas Towns (5.2 feet, ZONE). COLE DURANT MAKES IT!
Score: 23-32

[08:32] Team_069 possession (Score: 23-32)
Shai Quickley drives, picks up Kyle Green. Help arrives from Cole Durant! Shai Quickley attempts a Layup. Contested by Cole Durant (4.7 feet, ZONE). Shai Quickley misses. Rebound secured by Kyle Green.

[08:17] Team_063 possession (Score: 23-32)
DeMar Banchero attempts a 3Pt. Contested by Jarrett Murray (5.6 feet, MAN). DeMar Banchero misses. Rebound secured by Pau Middleton.

[07:59] Team_069 possession (Score: 23-32)
Shai Quickley drives to the basket... Shai Quickley throws a bad pass out of bounds! TURNOVER! (dead ball)

[07:59] Substitution (Team_069): Domantas Lowry OUT → Trae Antetokounmpo IN (stamina_rule2)

[07:59] Substitution (Team_069): Pau Middleton OUT → Tyrese Simons IN (stamina_rule2)

[07:59] Substitution (Team_069): Domantas Towns OUT → Devin Giddey IN (stamina_rule2)

[07:47] Team_063 possession (Score: 23-32)
FOUL! Shooting foul on Jarrett Murray. DeMar Banchero to the line for 2 free throws. [Team fouls: 3] (Jarrett Murray: 1 personal fouls)   FT 1/2: GOOD   FT 2/2: GOOD DeMar Banchero makes 2/2 from the line.
Score: 25-32

[07:36] Team_069 possession (Score: 25-32)
FOUL! Reach-in foul on Lamelo Ball during the drive. [Team fouls: 3] No free throws, side out. (Lamelo Ball: 2 personal fouls)

[07:20] Team_069 possession (Score: 25-32)
Jarrett Murray drives to the basket... FOUL! Offensive foul on Jarrett Murray! DeMar Banchero drew the charge! [Team fouls: 4] (Jarrett Murray: 2 personal fouls) TURNOVER! (dead ball)

[07:05] Team_063 possession (Score: 25-32)
FOUL! Shooting foul on Trae Antetokounmpo. Cole Durant to the line for 3 free throws. [BONUS: 5 team fouls] (Trae Antetokounmpo: 1 personal fouls)   FT 1/3: GOOD   FT 2/3: GOOD   FT 3/3: GOOD Cole Durant makes 3/3 from the line.
Score: 28-32

[06:50] Team_069 possession (Score: 28-32)
Jarrett Murray attempts a Midrange. Contested by DeMar Banchero (4.2 feet, MAN). Jarrett Murray misses. Rebound secured by Lamelo Ball.

[06:40] Team_063 possession (Score: 28-32)
Kyle Green attempts a Layup. Contested by Shai Quickley (4.3 feet, MAN). Kyle Green misses. Rebound secured by Shai Quickley.

[06:25] Team_069 possession (Score: 28-32)
FOUL! Offensive foul on Shai Quickley! Kyle Green drew the charge! [Team fouls: 6] (Shai Quickley: 2 personal fouls) TURNOVER! (dead ball)

[06:06] Team_063 possession (Score: 28-32)
Lamelo Ball attempts a 3Pt. Contested by Devin Giddey (5.5 feet, MAN). Lamelo Ball misses. Rebound secured by Trae Antetokounmpo.

[05:52] Team_069 possession (Score: 28-32)
Shai Quickley drives and kicks out. Shai Quickley attempts a Midrange. Contested by Cole Durant (4.1 feet, ZONE). SHAI QUICKLEY MAKES IT!
Score: 28-34

[05:39] Team_063 possession (Score: 28-34)
Cole Durant drives, Devin Giddey stays with him. Cole Durant attempts a Layup. Contested by Devin Giddey (5.5 feet, ZONE). Cole Durant misses. Rebound secured by Shai Quickley.

[05:23] Team_069 possession (Score: 28-34)
Devin Giddey attempts a 3Pt. Contested by DeMar Banchero (3.8 feet, ZONE). DEVIN GIDDEY MAKES IT! Assist: Trae Antetokounmpo
Score: 28-37

[05:11] Team_063 possession (Score: 28-37)
Cole Durant attempts a 3Pt. Contested by Trae Antetokounmpo (5.9 feet, MAN). Cole Durant misses. FOUL! Loose ball foul on Tyrese Simons during the rebound battle. [IN THE BONUS! 7 team fouls] Lamelo Ball to the line for 2 free throws. (Tyrese Simons: 1 personal fouls)   FT 1/2: GOOD   FT 2/2: GOOD Lamelo Ball makes 2/2 from the line.
Score: 30-37

[04:55] Team_069 possession (Score: 30-37)
Trae Antetokounmpo attempts a 3Pt. Contested by Cole Durant (4.4 feet, MAN). Trae Antetokounmpo misses. Offensive rebound by Tyrese Simons! Tyrese Simons kicks it out.

[04:40] Team_069 possession (Score: 30-37)
Trae Antetokounmpo drives to the basket... Trae Antetokounmpo loses control! Ball rolls out of bounds! TURNOVER! (dead ball)

[04:23] Team_063 possession (Score: 30-37)
Cole Durant attempts a Layup. Contested by Devin Giddey (5.5 feet, ZONE). COLE DURANT MAKES IT!
Score: 32-37

[04:05] Team_069 possession (Score: 32-37)
Jarrett Murray attempts a Midrange. Contested by DeMar Banchero (4.2 feet, MAN). JARRETT MURRAY MAKES IT! Assist: Trae Antetokounmpo
Score: 32-39

[03:56] Team_063 possession (Score: 32-39)
Lamelo Ball attempts a Midrange. Contested by Devin Giddey (5.5 feet, MAN). Lamelo Ball misses. Rebound secured by Trae Antetokounmpo.

[03:45] Team_069 possession (Score: 32-39)
Trae Antetokounmpo attempts a Layup. Contested by Kyle Green (4.7 feet, ZONE). TRAE ANTETOKOUNMPO MAKES IT! Assist: Tyrese Simons
Score: 32-41

[03:28] Team_063 possession (Score: 32-41)
Kyle Green drives, picks up Devin Giddey. Help arrives from Trae Antetokounmpo! Kyle Green attempts a Layup. Contested by Trae Antetokounmpo (5.3 feet, ZONE). KYLE GREEN MAKES IT!
Score: 34-41

[03:15] Team_069 possession (Score: 34-41)
FOUL! Offensive foul on Trae Antetokounmpo! Cole Durant drew the charge! [Team fouls: 8] (Trae Antetokounmpo: 2 personal fouls) TURNOVER! (dead ball)

[03:03] Team_063 possession (Score: 34-41)
Jaren James attempts a 3Pt. Contested by Tyrese Simons (5.3 feet, ZONE). Jaren James misses. FOUL! Loose ball foul on Shai Quickley during the rebound battle. [IN THE BONUS! 9 team fouls] Lamelo Ball to the line for 2 free throws. (Shai Quickley: 3 personal fouls)   FT 1/2: GOOD   FT 2/2: GOOD Lamelo Ball makes 2/2 from the line.
Score: 36-41

[02:50] Team_069 possession (Score: 36-41)
Devin Giddey attempts a Midrange. Contested by Cole Durant (4.2 feet, ZONE). DEVIN GIDDEY MAKES IT! Assist: Jarrett Murray
Score: 36-43

[02:34] Team_063 possession (Score: 36-43)
Kyle Green attempts a Layup. Contested by Devin Giddey (5.3 feet, ZONE). KYLE GREEN MAKES IT! Assist: Cole Durant
Score: 38-43

[02:16] Team_069 possession (Score: 38-43)
Devin Giddey loses the ball! Stripped by Lamelo Ball! TURNOVER! (live ball)

[02:03] Team_063 possession (Score: 38-43)
FOUL! Shooting foul on Tyrese Simons. Jaren James to the line for 2 free throws. [BONUS: 10 team fouls] (Tyrese Simons: 2 personal fouls)   FT 1/2: GOOD   FT 2/2: GOOD Jaren James makes 2/2 from the line.
Score: 40-43

[01:50] Team_069 possession (Score: 40-43)
Shai Quickley attempts a Midrange. Contested by Kyle Green (4.9 feet, MAN). Shai Quickley misses. Rebound secured by Cole Durant.

[01:35] Team_063 possession (Score: 40-43)
Kyle Green attempts a Midrange. Contested by Shai Quickley (4.5 feet, MAN). Kyle Green misses. Rebound secured by Shai Quickley.

[01:23] Team_069 possession (Score: 40-43)
Trae Antetokounmpo drives, Kyle Green stays with him. Trae Antetokounmpo attempts a Layup. Contested by Kyle Green (4.9 feet, ZONE). Trae Antetokounmpo misses. Rebound secured by Cole Durant.

[01:06] Team_063 possession (Score: 40-43)
Lamelo Ball drives and kicks out. DeMar Banchero attempts a 3Pt. Contested by Jarrett Murray (5.6 feet, MAN). DEMAR BANCHERO MAKES IT! Assist: Kyle Green
Score: 43-43

[00:48] Team_069 possession (Score: 43-43)
Jarrett Murray attempts a 3Pt. Contested by DeMar Banchero (4.5 feet, MAN). JARRETT MURRAY MAKES IT! Assist: Trae Antetokounmpo
Score: 43-46

[00:37] Team_063 possession (Score: 43-46)
DeMar Banchero loses the ball! Stripped by Jarrett Murray! TURNOVER! (live ball)

[00:24] Team_069 possession (Score: 43-46)
Devin Giddey drives to the basket... Devin Giddey loses control! Ball rolls out of bounds! TURNOVER! (dead ball)

[00:10] Team_063 possession (Score: 43-46)
Kyle Green makes the Midrange and draws the foul on Shai Quickley! And-1! Kyle Green to the line for 1. [BONUS: 11 team fouls] (Shai Quickley: 4 personal fouls)   FT 1/1: GOOD Kyle Green makes 1/1 from the line.
Score: 46-46

================================================================================
                              2ND QUARTER COMPLETE                              
================================================================================

2ND QUARTER SCORE: Team_063 27, Team_069 22

BOX SCORE:
================================================================================

Team_063
--------------------------------------------------------------------------------
Player                MIN  PTS  REB  AST  TO      FG   FG%      3P   3P%
--------------------------------------------------------------------------------
Kyle Green             12    7    2    1   0   3/5    60.0     0/0   0.0
Cole Durant            12    7    3    1   0   3/4    75.0     0/0   0.0
DeMar Banchero         12    5    0    0   0   2/3    66.7     0/0   0.0
Lamelo Ball            12    4    2    0   0   2/4    50.0     0/0   0.0
Malcolm Quickley       13    2    2    0   0   1/2    50.0     0/0   0.0
Jaren James            12    2    0    0   0   1/2    50.0     0/0   0.0
Bradley Davis          13    0    0    0   0   0/2     0.0     0/0   0.0

TEAM: FG: 12/22 (54.5%), 3PT: 3/9 (33.3%), REB: 9 (1 off, 8 def), AST: 2, TO: 2
TEAM FOULS: 3


Team_069
--------------------------------------------------------------------------------
Player                MIN  PTS  REB  AST  TO      FG   FG%      3P   3P%
--------------------------------------------------------------------------------
Domantas Lowry         15    6    0    0   0   2/3    66.7     0/0   0.0
Jarrett Murray         12    5    0    1   0   2/3    66.7     0/0   0.0
Devin Giddey           11    5    0    0   0   2/2   100.0     0/0   0.0
Shai Quickley          12    2    4    0   0   1/4    25.0     0/0   0.0
Trae Antetokounmpo     10    2    2    3   0   1/2    50.0     0/0   0.0
CJ Fox                 13    0    1    1   0   0/0     0.0     0/0   0.0
Pau Middleton          13    0    3    0   0   0/1     0.0     0/0   0.0
Domantas Towns         13    0    0    0   0   0/1     0.0     0/0   0.0
Tyrese Simons          11    0    1    1   0   0/0     0.0     0/0   0.0

TEAM: FG: 8/16 (50.0%), 3PT: 3/3 (100.0%), REB: 11 (1 off, 10 def), AST: 6, TO: 7
TEAM FOULS: 11 [Team_063 in BONUS]

================================================================================

================================================================================
                       3RD QUARTER - Team_063 vs Team_069                       
================================================================================

[12:00] Team_063 possession (Score: 46-46)
FOUL! Holding foul on Pau Middleton. [Team fouls: 1] No free throws, side out. (Pau Middleton: 1 personal fouls)

[11:45] Team_063 possession (Score: 46-46)
Terry Reaves attempts a 3Pt. Contested by Pau Middleton (4.2 feet, MAN). Terry Reaves misses. Rebound secured by Pau Middleton.

[11:30] Team_069 possession (Score: 46-46)
Domantas Towns attempts a Layup. Contested by Dirk Reaves (3.9 feet, MAN). Domantas Towns misses. Rebound secured by Malcolm Quickley.

[11:16] Team_063 possession (Score: 46-46)
Terry Reaves attempts a Midrange. Contested by Domantas Lowry (4.6 feet, ZONE). TERRY REAVES MAKES IT!
Score: 48-46

[11:02] Team_069 possession (Score: 48-46)
CJ Fox drives and kicks out. Domantas Towns attempts a 3Pt. Contested by Dirk Reaves (3.7 feet, MAN). Domantas Towns misses. Rebound secured by Dirk Reaves.

[10:51] Team_063 possession (Score: 48-46)
Malcolm Quickley drives, CJ Fox stays with him. Malcolm Quickley attempts a Layup. Contested by CJ Fox (5.1 feet, ZONE). MALCOLM QUICKLEY MAKES IT!
Score: 50-46

[10:37] Team_069 possession (Score: 50-46)
Domantas Lowry attempts a 3Pt. Contested by Malcolm Quickley (3.5 feet, MAN). Domantas Lowry misses. Offensive rebound by Pau Middleton! Pau Middleton kicks it out.

[10:27] Team_069 possession (Score: 50-46)
Domantas Lowry drives, picks up Malcolm Quickley. Help arrives from Bradley Davis! Domantas Lowry attempts a Layup. Contested by Bradley Davis (3.5 feet, MAN). DOMANTAS LOWRY MAKES IT! Assist: Pau Middleton
Score: 50-48

[10:12] Team_063 possession (Score: 50-48)
Tyler Harris attempts a Layup. Contested by CJ Fox (5.3 feet, MAN). TYLER HARRIS MAKES IT!
Score: 52-48

[10:00] Team_069 possession (Score: 52-48)
Domantas Lowry attempts a Layup. BLOCKED BY TYLER HARRIS! Ball goes out off Tyler Harris. Domantas Lowry's ball!

[09:45] Team_069 possession (Score: 52-48)
Domantas Towns drives, Tyler Harris stays with him. Domantas Towns attempts a Dunk. Contested by Tyler Harris (4.6 feet, ZONE). DOMANTAS TOWNS MAKES IT! Assist: James Sexton
Score: 52-50

[09:29] Team_063 possession (Score: 52-50)
Malcolm Quickley drives, picks up Domantas Towns. Help arrives from James Sexton! Malcolm Quickley attempts a Dunk. Contested by James Sexton (4.3 feet, ZONE). MALCOLM QUICKLEY MAKES IT! Assist: Bradley Davis
Score: 54-50

[09:14] Team_069 possession (Score: 54-50)
James Sexton drives and kicks out. CJ Fox makes the Midrange and draws the foul on Tyler Harris! And-1! CJ Fox to the line for 1. [Team fouls: 1] (Tyler Harris: 1 personal fouls)   FT 1/1: MISS CJ Fox makes 0/1 from the line. Rebound secured by Malcolm Quickley.
Score: 54-52

[08:55] Team_063 possession (Score: 54-52)
Bradley Davis drives and kicks out. Terry Reaves attempts a Midrange. Contested by Domantas Lowry (4.3 feet, ZONE). TERRY REAVES MAKES IT! Assist: Dirk Reaves
Score: 56-52

[08:35] Team_069 possession (Score: 56-52)
James Sexton attempts a 3Pt. Contested by Malcolm Quickley (4.2 feet, ZONE). JAMES SEXTON MAKES IT! Assist: Pau Middleton
Score: 56-55

[08:22] Team_063 possession (Score: 56-55)
Tyler Harris throws a bad pass out of bounds! TURNOVER! (dead ball)

[08:08] Team_069 possession (Score: 56-55)
CJ Fox drives, picks up Tyler Harris. Help arrives from Malcolm Quickley! CJ Fox attempts a Dunk. Contested by Malcolm Quickley (4.6 feet, MAN). CJ Fox misses. Offensive rebound by Domantas Towns! Domantas Towns kicks it out.

[07:51] Team_069 possession (Score: 56-55)
Domantas Lowry attempts a 3Pt. Contested by Bradley Davis (4.8 feet, ZONE). Domantas Lowry misses. Rebound secured by Dirk Reaves.

[07:41] Team_063 possession (Score: 56-55)
Malcolm Quickley drives and kicks out. Bradley Davis attempts a Midrange. Contested by James Sexton (3.3 feet, ZONE). Bradley Davis misses. Rebound secured by Domantas Towns.

[07:28] Team_069 possession (Score: 56-55)
FOUL! Offensive foul on CJ Fox! Tyler Harris drew the charge! [Team fouls: 2] (CJ Fox: 1 personal fouls) TURNOVER! (dead ball)

[07:12] Team_063 possession (Score: 56-55)
Malcolm Quickley drives, picks up Domantas Towns. Help arrives from James Sexton! Malcolm Quickley attempts a Dunk. Contested by James Sexton (4.3 feet, ZONE). MALCOLM QUICKLEY MAKES IT!
Score: 58-55

[06:55] Team_069 possession (Score: 58-55)
FOUL! Shooting foul on Malcolm Quickley. Pau Middleton to the line for 2 free throws. [Team fouls: 2] (Malcolm Quickley: 1 personal fouls)   FT 1/2: MISS   FT 2/2: MISS Pau Middleton makes 0/2 from the line. Rebound secured by Dirk Reaves.

[06:39] Team_063 possession (Score: 58-55)
FOUL! Offensive foul on Bradley Davis! James Sexton drew the charge! [Team fouls: 3] (Bradley Davis: 1 personal fouls) TURNOVER! (dead ball)

[06:21] Team_069 possession (Score: 58-55)
James Sexton attempts a 3Pt. Contested by Bradley Davis (5.5 feet, MAN). James Sexton misses. Rebound secured by Tyler Harris.

[06:03] Team_063 possession (Score: 58-55)
Terry Reaves attempts a Midrange. Contested by Domantas Towns (4.8 feet, ZONE). TERRY REAVES MAKES IT!
Score: 60-55

[05:49] Team_069 possession (Score: 60-55)
Domantas Lowry attempts a 3Pt. Contested by Malcolm Quickley (3.5 feet, ZONE). Domantas Lowry misses. Rebound secured by Malcolm Quickley.

[05:39] Team_063 possession (Score: 60-55)
Dirk Reaves attempts a Midrange. Contested by Pau Middleton (4.2 feet, ZONE). Dirk Reaves misses. Rebound secured by Domantas Towns.

[05:24] Team_069 possession (Score: 60-55)
CJ Fox makes the Layup and draws the foul on Tyler Harris! And-1! CJ Fox to the line for 1. [Team fouls: 4] (Tyler Harris: 2 personal fouls)   FT 1/1: GOOD CJ Fox makes 1/1 from the line.
Score: 60-58

[05:09] Team_063 possession (Score: 60-58)
Terry Reaves attempts a Midrange. Contested by Domantas Lowry (4.6 feet, ZONE). Terry Reaves misses. Rebound secured by Domantas Towns.

[04:54] Team_069 possession (Score: 60-58)
FOUL! Shooting foul on Malcolm Quickley. Pau Middleton to the line for 3 free throws. [BONUS: 5 team fouls] (Malcolm Quickley: 2 personal fouls)   FT 1/3: GOOD   FT 2/3: GOOD   FT 3/3: GOOD Pau Middleton makes 3/3 from the line.
Score: 60-61

[04:43] Team_063 possession (Score: 60-61)
Terry Reaves drives to the basket... Terry Reaves throws a bad pass out of bounds! TURNOVER! (dead ball)

[04:27] Team_069 possession (Score: 60-61)
Domantas Lowry attempts a Midrange. Contested by Malcolm Quickley (3.5 feet, MAN). Domantas Lowry misses. Rebound secured by Tyler Harris.

[04:12] Team_063 possession (Score: 60-61)
Tyler Harris drives, Domantas Towns stays with him. Tyler Harris attempts a Dunk. Contested by Domantas Towns (4.6 feet, ZONE). Tyler Harris misses. Rebound secured by Domantas Towns.

[04:02] Team_069 possession (Score: 60-61)
James Sexton throws a bad pass! Stolen by Bradley Davis! TURNOVER! (live ball)

[03:45] Team_063 possession (Score: 60-61)
Bradley Davis makes the Midrange and draws the foul on Pau Middleton! And-1! Bradley Davis to the line for 1. [Team fouls: 3] (Pau Middleton: 2 personal fouls)   FT 1/1: GOOD Bradley Davis makes 1/1 from the line.
Score: 63-61

[03:36] Team_069 possession (Score: 63-61)
James Sexton throws a bad pass! Stolen by Bradley Davis! TURNOVER! (live ball)

[03:23] Team_063 possession (Score: 63-61)
Bradley Davis attempts a 3Pt. Contested by James Sexton (3.7 feet, ZONE). BRADLEY DAVIS MAKES IT!
Score: 66-61

[03:08] Team_069 possession (Score: 66-61)
Pau Middleton drives and kicks out. Domantas Towns attempts a 3Pt. Contested by Dirk Reaves (3.9 feet, MAN). DOMANTAS TOWNS MAKES IT! Assist: CJ Fox
Score: 66-64

[02:59] Team_063 possession (Score: 66-64)
Malcolm Quickley makes the Layup and draws the foul on Domantas Lowry! And-1! Malcolm Quickley to the line for 1. [Team fouls: 4] (Domantas Lowry: 1 personal fouls)   FT 1/1: GOOD Malcolm Quickley makes 1/1 from the line.
Score: 69-64

[02:44] Team_069 possession (Score: 69-64)
Domantas Lowry attempts a 3Pt. Contested by Bradley Davis (5.0 feet, ZONE). Domantas Lowry misses. Offensive rebound by CJ Fox! CJ Fox kicks it out.

[02:31] Team_069 possession (Score: 69-64)
Pau Middleton drives and kicks out. Domantas Towns makes the Midrange and draws the foul on Dirk Reaves! And-1! Domantas Towns to the line for 1. [BONUS: 6 team fouls] (Dirk Reaves: 1 personal fouls)   FT 1/1: GOOD Domantas Towns makes 1/1 from the line.
Score: 69-67

[02:14] Team_063 possession (Score: 69-67)
Malcolm Quickley makes the 3Pt and draws the foul on Domantas Lowry! And-1! Malcolm Quickley to the line for 1. [BONUS: 5 team fouls] (Domantas Lowry: 2 personal fouls)   FT 1/1: GOOD Malcolm Quickley makes 1/1 from the line.
Score: 73-67

[02:00] Team_069 possession (Score: 73-67)
CJ Fox attempts a Layup. Contested by Tyler Harris (4.9 feet, MAN). CJ Fox misses. Rebound secured by Dirk Reaves.

[01:44] Team_063 possession (Score: 73-67)
Tyler Harris attempts a Layup. Contested by CJ Fox (5.5 feet, MAN). TYLER HARRIS MAKES IT! Assist: Bradley Davis
Score: 75-67

[01:31] Team_069 possession (Score: 75-67)
Pau Middleton attempts a Midrange. Contested by Dirk Reaves (4.4 feet, ZONE). Pau Middleton misses. Rebound secured by Tyler Harris.

[01:14] Team_063 possession (Score: 75-67)
Terry Reaves attempts a Layup. Contested by Domantas Towns (5.3 feet, ZONE). Terry Reaves misses. Rebound secured by CJ Fox.

[01:00] Team_069 possession (Score: 75-67)
FOUL! Reach-in foul on Tyler Harris during the drive. [IN THE BONUS! 7 team fouls] Domantas Towns to the line for 2 free throws. (Tyler Harris: 3 personal fouls)   FT 1/2: GOOD   FT 2/2: GOOD Domantas Towns makes 2/2 from the line.
Score: 75-69

[00:45] Team_063 possession (Score: 75-69)
Tyler Harris drives and kicks out. Tyler Harris attempts a Midrange. Contested by CJ Fox (5.7 feet, MAN). Tyler Harris misses. Rebound secured by CJ Fox.

[00:34] Team_069 possession (Score: 75-69)
Pau Middleton attempts a Layup. Contested by Terry Reaves (5.3 feet, MAN). Pau Middleton misses. Rebound secured by Malcolm Quickley.

[00:20] Team_063 possession (Score: 75-69)
Dirk Reaves attempts a Layup. BLOCKED BY DOMANTAS TOWNS! Ball is loose! Offensive rebound by Dirk Reaves! Dirk Reaves kicks it out.

[00:06] Team_063 possession (Score: 75-69)
Tyler Harris attempts a 3Pt. Contested by James Sexton (3.9 feet, ZONE). Tyler Harris misses. Rebound secured by Domantas Towns.

================================================================================
                              3RD QUARTER COMPLETE                              
================================================================================

3RD QUARTER SCORE: Team_063 29, Team_069 23

BOX SCORE:
================================================================================

Team_063
--------------------------------------------------------------------------------
Player                MIN  PTS  REB  AST  TO      FG   FG%      3P   3P%
--------------------------------------------------------------------------------
Malcolm Quickley       25   13    4    0   0   5/6    83.3     0/0   0.0
Terry Reaves           25    6    0    0   0   3/6    50.0     0/0   0.0
Bradley Davis          25    6    0    2   0   2/2   100.0     0/0   0.0
Tyler Harris           25    4    3    0   0   2/5    40.0     0/0   0.0
Dirk Reaves            25    0    5    1   0   0/1     0.0     0/0   0.0

TEAM: FG: 12/20 (60.0%), 3PT: 2/4 (50.0%), REB: 12 (1 off, 11 def), AST: 3, TO: 3
TEAM FOULS: 7 [Team_069 in BONUS]


Team_069
--------------------------------------------------------------------------------
Player                MIN  PTS  REB  AST  TO      FG   FG%      3P   3P%
--------------------------------------------------------------------------------
Domantas Towns         25   10    6    0   0   4/5    80.0     0/0   0.0
Pau Middleton          25    3    2    2   0   1/4    25.0     0/0   0.0
CJ Fox                 25    3    3    1   0   1/3    33.3     0/0   0.0
James Sexton           25    3    0    1   0   1/3    33.3     0/0   0.0
Domantas Lowry         27    2    0    0   0   1/4    25.0     0/0   0.0

TEAM: FG: 8/19 (42.1%), 3PT: 2/5 (40.0%), REB: 11 (3 off, 8 def), AST: 4, TO: 3
TEAM FOULS: 5 [Team_063 in BONUS]

================================================================================

================================================================================
                       4TH QUARTER - Team_063 vs Team_069                       
================================================================================

[12:00] Team_063 possession (Score: 75-69)
Malcolm Quickley attempts a 3Pt. Contested by James Sexton (3.5 feet, ZONE). Malcolm Quickley misses. Offensive rebound by Tyler Harris! Tyler Harris's putback is no good. Rebound secured by Domantas Towns.

[11:48] Team_069 possession (Score: 75-69)
Domantas Towns attempts a Layup. Contested by Dirk Reaves (4.3 feet, MAN). DOMANTAS TOWNS MAKES IT! Assist: CJ Fox
Score: 75-71

[11:34] Team_063 possession (Score: 75-71)
Tyler Harris attempts a Layup. Contested by CJ Fox (5.5 feet, MAN). TYLER HARRIS MAKES IT!
Score: 77-71

[11:19] Team_069 possession (Score: 77-71)
CJ Fox drives and kicks out. Domantas Lowry attempts a Midrange. Contested by Dirk Reaves (4.2 feet, ZONE). Domantas Lowry misses. FOUL! Loose ball foul on Malcolm Quickley during the rebound battle. [Team fouls: 1] No free throws, side out. (Malcolm Quickley: 1 personal fouls)

[11:06] Team_069 possession (Score: 77-71)
Pau Middleton attempts a 3Pt. Contested by Terry Reaves (5.3 feet, MAN). Pau Middleton misses. Rebound secured by Tyler Harris.

[10:57] Team_063 possession (Score: 77-71)
Dirk Reaves drives, picks up Domantas Towns. Help arrives from James Sexton! Dirk Reaves attempts a Layup. Contested by James Sexton (5.4 feet, ZONE). Dirk Reaves misses. Offensive rebound by Tyler Harris! Tyler Harris puts it back in!
Score: 79-71

[10:44] Team_069 possession (Score: 79-71)
Domantas Towns drives and kicks out. FOUL! Shooting foul on Bradley Davis. Pau Middleton to the line for 2 free throws. [Team fouls: 2] (Bradley Davis: 1 personal fouls)   FT 1/2: GOOD   FT 2/2: GOOD Pau Middleton makes 2/2 from the line.
Score: 79-73

[10:32] Team_063 possession (Score: 79-73)
Bradley Davis attempts a 3Pt. Contested by James Sexton (4.1 feet, ZONE). BRADLEY DAVIS MAKES IT! Assist: Terry Reaves
Score: 82-73

[10:17] Team_069 possession (Score: 82-73)
Domantas Lowry attempts a 3Pt. Contested by Malcolm Quickley (4.0 feet, MAN). Domantas Lowry misses. Offensive rebound by Domantas Towns! Domantas Towns kicks it out.

[10:05] Team_069 possession (Score: 82-73)
Pau Middleton attempts a Layup. Contested by Tyler Harris (5.3 feet, ZONE). PAU MIDDLETON MAKES IT! Assist: Domantas Lowry
Score: 82-75

[09:54] Team_063 possession (Score: 82-75)
Tyler Harris makes the Dunk and draws the foul on James Sexton! And-1! Tyler Harris to the line for 1. [Team fouls: 1] (James Sexton: 1 personal fouls)   FT 1/1: MISS Tyler Harris makes 0/1 from the line. Rebound secured by CJ Fox.
Score: 84-75

[09:39] Team_069 possession (Score: 84-75)
Domantas Lowry attempts a 3Pt. Contested by Malcolm Quickley (4.1 feet, MAN). Domantas Lowry misses. Rebound secured by Tyler Harris.

[09:23] Team_063 possession (Score: 84-75)
Tyler Harris attempts a 3Pt. Contested by CJ Fox (5.8 feet, MAN). TYLER HARRIS MAKES IT! Assist: Terry Reaves
Score: 87-75

[09:08] Team_069 possession (Score: 87-75)
James Sexton drives, picks up Bradley Davis. Help arrives from Malcolm Quickley! James Sexton attempts a Layup. Contested by Malcolm Quickley (6.0 feet, MAN). James Sexton misses. Rebound secured by Tyler Harris.

[08:53] Team_063 possession (Score: 87-75)
Terry Reaves attempts a Midrange. Contested by Pau Middleton (5.1 feet, ZONE). TERRY REAVES MAKES IT!
Score: 89-75

[08:37] Team_069 possession (Score: 89-75)
Domantas Lowry drives to the basket... FOUL! Offensive foul on Domantas Lowry! Malcolm Quickley drew the charge! [Team fouls: 2] (Domantas Lowry: 1 personal fouls) TURNOVER! (dead ball)

[08:25] Team_063 possession (Score: 89-75)
Tyler Harris attempts a Layup. Contested by CJ Fox (5.9 feet, MAN). TYLER HARRIS MAKES IT! Assist: Terry Reaves
Score: 91-75

[08:11] Team_069 possession (Score: 91-75)
FOUL! Offensive foul on CJ Fox! Tyler Harris drew the charge! [Team fouls: 3] (CJ Fox: 1 personal fouls) TURNOVER! (dead ball)

[08:02] Team_063 possession (Score: 91-75)
Malcolm Quickley attempts a Layup. BLOCKED BY DOMANTAS TOWNS! Ball is loose! Offensive rebound by Malcolm Quickley! Malcolm Quickley kicks it out.

[07:46] Team_063 possession (Score: 91-75)
Tyler Harris attempts a 3Pt. Contested by CJ Fox (6.0 feet, MAN). TYLER HARRIS MAKES IT! Assist: Malcolm Quickley
Score: 94-75

[07:28] Team_069 possession (Score: 94-75)
Domantas Lowry attempts a Midrange. Contested by Malcolm Quickley (4.4 feet, MAN). Domantas Lowry misses. Rebound secured by Dirk Reaves.

[07:13] Team_063 possession (Score: 94-75)
Malcolm Quickley drives, picks up Domantas Lowry. Help arrives from James Sexton! Malcolm Quickley attempts a Dunk. Contested by James Sexton (5.0 feet, MAN). MALCOLM QUICKLEY MAKES IT! Assist: Bradley Davis
Score: 96-75

[07:02] Team_069 possession (Score: 96-75)
James Sexton attempts a Midrange. Wide open! Bradley Davis is 6.2 feet away. [MAN] JAMES SEXTON MAKES IT!
Score: 96-77

[06:49] Team_063 possession (Score: 96-77)
Malcolm Quickley attempts a Midrange. Contested by Domantas Lowry (5.0 feet, MAN). Malcolm Quickley misses. Rebound secured by CJ Fox.

[06:34] Team_069 possession (Score: 96-77)
Domantas Towns attempts a Midrange. Contested by Terry Reaves (5.8 feet, ZONE). Domantas Towns misses. Rebound secured by Malcolm Quickley.

[06:22] Team_063 possession (Score: 96-77)
Malcolm Quickley attempts a 3Pt. Contested by James Sexton (4.4 feet, ZONE). Malcolm Quickley misses. Rebound secured by Pau Middleton.

[06:08] Team_069 possession (Score: 96-77)
Domantas Towns drives and kicks out. James Sexton makes the 3Pt and draws the foul on Malcolm Quickley! And-1! James Sexton to the line for 1. [Team fouls: 3] (Malcolm Quickley: 2 personal fouls)   FT 1/1: GOOD James Sexton makes 1/1 from the line.
Score: 96-81

[05:56] Team_063 possession (Score: 96-81)
Bradley Davis attempts a Midrange. Contested by Pau Middleton (5.6 feet, ZONE). Bradley Davis misses. Rebound secured by Domantas Towns.

[05:40] Team_069 possession (Score: 96-81)
CJ Fox drives and kicks out. CJ Fox attempts a 3Pt. Contested by Malcolm Quickley (4.9 feet, ZONE). CJ Fox misses. Rebound secured by Tyler Harris.

[05:27] Team_063 possession (Score: 96-81)
Bradley Davis attempts a 3Pt. Contested by James Sexton (4.9 feet, MAN). BRADLEY DAVIS MAKES IT! Assist: Tyler Harris
Score: 99-81

[05:18] Team_069 possession (Score: 99-81)
Domantas Towns attempts a Midrange. Contested by Terry Reaves (6.0 feet, ZONE). Domantas Towns misses. Rebound secured by Malcolm Quickley.

[05:04] Team_063 possession (Score: 99-81)
Terry Reaves makes the Layup and draws the foul on Pau Middleton! And-1! Terry Reaves to the line for 1. [Team fouls: 4] (Pau Middleton: 1 personal fouls)   FT 1/1: GOOD Terry Reaves makes 1/1 from the line.
Score: 102-81

[04:51] Team_069 possession (Score: 102-81)
CJ Fox attempts a 3Pt. Contested by Malcolm Quickley (5.1 feet, ZONE). CJ Fox misses. Rebound secured by Dirk Reaves.

[04:40] Team_063 possession (Score: 102-81)
Bradley Davis makes the Dunk and draws the foul on James Sexton! And-1! Bradley Davis to the line for 1. [BONUS: 5 team fouls] (James Sexton: 2 personal fouls)   FT 1/1: MISS Bradley Davis makes 0/1 from the line. Rebound secured by Domantas Towns.
Score: 104-81

[04:23] Team_069 possession (Score: 104-81)
Domantas Lowry attempts a 3Pt. Contested by Malcolm Quickley (5.0 feet, MAN). Domantas Lowry misses. Rebound secured by Tyler Harris.

[04:07] Team_063 possession (Score: 104-81)
Malcolm Quickley makes the Layup and draws the foul on Domantas Lowry! And-1! Malcolm Quickley to the line for 1. [BONUS: 6 team fouls] (Domantas Lowry: 2 personal fouls)   FT 1/1: GOOD Malcolm Quickley makes 1/1 from the line.
Score: 107-81

[03:56] Team_069 possession (Score: 107-81)
James Sexton drives, picks up Bradley Davis. Help arrives from Malcolm Quickley! James Sexton attempts a Layup. Wide open! Malcolm Quickley is 6.6 feet away. [MAN] James Sexton misses. Rebound secured by Dirk Reaves.

[03:38] Team_063 possession (Score: 107-81)
FOUL! Shooting foul on Pau Middleton. Terry Reaves to the line for 3 free throws. [BONUS: 7 team fouls] (Pau Middleton: 2 personal fouls)   FT 1/3: GOOD   FT 2/3: GOOD   FT 3/3: GOOD Terry Reaves makes 3/3 from the line.
Score: 110-81

[03:24] Team_069 possession (Score: 110-81)
Domantas Towns attempts a Midrange. Contested by Dirk Reaves (5.6 feet, MAN). Domantas Towns misses. Rebound secured by Malcolm Quickley.

[03:12] Team_063 possession (Score: 110-81)
Dirk Reaves makes the Layup and draws the foul on Domantas Towns! And-1! Dirk Reaves to the line for 1. [BONUS: 8 team fouls] (Domantas Towns: 1 personal fouls)   FT 1/1: GOOD Dirk Reaves makes 1/1 from the line.
Score: 113-81

[02:59] Team_069 possession (Score: 113-81)
Domantas Towns attempts a Midrange. Contested by Dirk Reaves (5.7 feet, MAN). Domantas Towns misses. FOUL! Loose ball foul on Malcolm Quickley during the rebound battle. [Team fouls: 4] No free throws, side out. (Malcolm Quickley: 3 personal fouls)

[02:43] Team_069 possession (Score: 113-81)
CJ Fox drives, Tyler Harris stays with him. CJ Fox attempts a Layup. Wide open! Tyler Harris is 6.3 feet away. [ZONE] CJ FOX MAKES IT!
Score: 113-83

[02:27] Team_063 possession (Score: 113-83)
FOUL! Holding foul on Pau Middleton. [IN THE BONUS! 9 team fouls] Terry Reaves to the line for 2 free throws. (Pau Middleton: 3 personal fouls)   FT 1/2: MISS   FT 2/2: MISS Terry Reaves makes 0/2 from the line. Rebound secured by CJ Fox.

[02:10] Team_069 possession (Score: 113-83)
Domantas Towns attempts a Layup. Contested by Dirk Reaves (5.8 feet, MAN). Domantas Towns misses. Rebound secured by Tyler Harris.

[01:57] Team_063 possession (Score: 113-83)
Dirk Reaves drives, Domantas Towns stays with him. Dirk Reaves attempts a Layup. Wide open! Domantas Towns is 6.8 feet away. [ZONE] DIRK REAVES MAKES IT! Assist: Malcolm Quickley
Score: 115-83

[01:42] Team_069 possession (Score: 115-83)
Pau Middleton drives, Tyler Harris stays with him. Pau Middleton attempts a Layup. Wide open! Tyler Harris is 6.5 feet away. [ZONE] Pau Middleton misses. Offensive rebound by CJ Fox! CJ Fox kicks it out.

[01:29] Team_069 possession (Score: 115-83)
James Sexton attempts a Midrange. Wide open! Terry Reaves is 6.8 feet away. [ZONE] JAMES SEXTON MAKES IT! Assist: CJ Fox
Score: 115-85

[01:15] Team_063 possession (Score: 115-85)
Bradley Davis drives to the basket... FOUL! Offensive foul on Bradley Davis! James Sexton drew the charge! [Team fouls: 5] (Bradley Davis: 2 personal fouls) TURNOVER! (dead ball)

[01:04] Team_069 possession (Score: 115-85)
Pau Middleton attempts a 3Pt. Contested by Malcolm Quickley (5.7 feet, ZONE). PAU MIDDLETON MAKES IT! Assist: Domantas Lowry
Score: 115-88

[00:51] Team_063 possession (Score: 115-88)
Terry Reaves attempts a 3Pt. Contested by James Sexton (5.8 feet, ZONE). Terry Reaves misses. Rebound secured by CJ Fox.

[00:33] Team_069 possession (Score: 115-88)
Pau Middleton throws a bad pass! Stolen by Terry Reaves! TURNOVER! (live ball)

[00:19] Team_063 possession (Score: 115-88)
Tyler Harris attempts a Midrange. Wide open! CJ Fox is 6.9 feet away. [MAN] TYLER HARRIS MAKES IT! Assist: Dirk Reaves
Score: 117-88

[00:05] Team_069 possession (Score: 117-88)
CJ Fox drives, Tyler Harris stays with him. CJ Fox attempts a Layup. Wide open! Tyler Harris is 6.8 feet away. [ZONE] CJ FOX MAKES IT! Assist: Domantas Towns
Score: 117-90

================================================================================
                              4TH QUARTER COMPLETE                              
================================================================================

4TH QUARTER SCORE: Team_063 42, Team_069 21

BOX SCORE:
================================================================================

Team_063
--------------------------------------------------------------------------------
Player                MIN  PTS  REB  AST  TO      FG   FG%      3P   3P%
--------------------------------------------------------------------------------
Tyler Harris           37   14    7    1   0   6/7    85.7     0/0   0.0
Terry Reaves           37    8    0    3   0   3/4    75.0     0/0   0.0
Bradley Davis          37    6    0    1   0   2/4    50.0     0/0   0.0
Malcolm Quickley       37    5    4    2   0   2/5    40.0     0/0   0.0
Dirk Reaves            37    5    3    1   0   2/2   100.0     0/0   0.0

TEAM: FG: 15/23 (65.2%), 3PT: 5/8 (62.5%), REB: 15 (3 off, 12 def), AST: 8, TO: 1
TEAM FOULS: 5 [Team_069 in BONUS]


Team_069
--------------------------------------------------------------------------------
Player                MIN  PTS  REB  AST  TO      FG   FG%      3P   3P%
--------------------------------------------------------------------------------
James Sexton           37    8    0    0   0   3/5    60.0     0/0   0.0
Pau Middleton          37    7    1    0   0   3/4    75.0     0/0   0.0
CJ Fox                 37    4    6    2   0   2/4    50.0     0/0   0.0
Domantas Towns         37    2    5    1   0   1/5    20.0     0/0   0.0
Domantas Lowry         39    0    0    2   0   0/3     0.0     0/0   0.0

TEAM: FG: 9/21 (42.9%), 3PT: 1/5 (20.0%), REB: 11 (4 off, 7 def), AST: 5, TO: 3
TEAM FOULS: 9 [Team_063 in BONUS]

================================================================================

================================================================================
                               FULL GAME COMPLETE                               
================================================================================

FINAL SCORE: Team_063 117, Team_069 90

SCORING BY QUARTER:
--------------------------------------------------------------------------------
Team                     Q1     Q2     Q3     Q4    FINAL
--------------------------------------------------------------------------------
Team_063                 19     27     29     42      117
Team_069                 24     22     23     21       90
--------------------------------------------------------------------------------

FULL GAME BOX SCORE:
================================================================================

Team_063
--------------------------------------------------------------------------------
Player                MIN  PTS  REB  AST  TO      FG   FG%      3P   3P%      FT STL BLK
--------------------------------------------------------------------------------
Bradley Davis          37   15    0    4   2   6/11   54.5   4/7    57.1   1/2     2   0
Malcolm Quickley       37   20   15    2   4   8/16   50.0   1/5    20.0   5/5     0   0
Terry Reaves           37   17    0    4   1   6/13   46.2   2/5    40.0   7/9     2   0
Dirk Reaves            37   12   10    2   0   6/8    75.0   0/0     0.0   2/2     0   0
Tyler Harris           37   20   13    1   2   8/14   57.1   2/3    66.7   0/1     0   1
DeMar Banchero         12    5    0    0   1   1/2    50.0   0/1     0.0   2/2     0   0
Cole Durant            12    7    3    2   0   4/6    66.7   2/2   100.0   3/3     0   0
Jaren James            12    4    0    0   0   3/4    75.0   1/2    50.0   2/2     0   0
Lamelo Ball            12    4    3    0   0   1/3    33.3   0/1     0.0   4/4     1   0
Kyle Green             12    9    2    1   0   4/6    66.7   0/0     0.0   1/1     0   1

TEAM: FG: 47/84 (56.0%), 3PT: 12/26 (46.2%), REB: 49 (8 off, 41 def), AST: 16, TO: 10


Team_069
--------------------------------------------------------------------------------
Player                MIN  PTS  REB  AST  TO      FG   FG%      3P   3P%      FT STL BLK
--------------------------------------------------------------------------------
Domantas Lowry         39   10    0    2   0   3/11   27.3   1/5    20.0   2/3     0   0
Pau Middleton          37   13    9    2   1   6/13   46.2   3/4    75.0   5/7     0   0
Domantas Towns         37   14   15    1   0   6/13   46.2   0/1     0.0   3/3     0   2
James Sexton           37   16    0    4   3   6/12   50.0   1/4    25.0   4/4     0   0
CJ Fox                 37   13   14    4   4   5/11   45.5   0/1     0.0   5/6     1   0
Jarrett Murray         12    5    0    2   1   2/3    66.7   1/1   100.0   0/0     1   0
Shai Quickley          12    4    6    0   3   1/4    25.0   0/0     0.0   0/0     0   0
Tyrese Simons          11    3    1    1   1   1/1   100.0   1/1   100.0   0/0     1   0
Devin Giddey           11    6    0    0   1   3/4    75.0   1/2    50.0   1/2     0   0
Trae Antetokounmpo     10    2    2    3   1   2/4    50.0   1/1   100.0   0/0     0   0

TEAM: FG: 36/77 (46.8%), 3PT: 9/20 (45.0%), REB: 44 (10 off, 34 def), AST: 19, TO: 15

================================================================================
