================================================================================
                        FULL GAME - Team_054 vs Team_036                        
================================================================================

================================================================================
                       1ST QUARTER - Team_054 vs Team_036                       
================================================================================

[12:00] Team_054 possession (Score: 0-0)
FOUL! Shooting foul on Giannis Booker. Malcolm Harden to the line for 2 free throws. [Team fouls: 1] (Giannis Booker: 1 personal fouls)   FT 1/2: MISS   FT 2/2: GOOD Malcolm Harden makes 1/2 from the line.
Score: 1-0

[11:48] Team_036 possession (Score: 1-0)
FOUL! Shooting foul on Lauri Irving. Terry Durant to the line for 3 free throws. [Team fouls: 1] (Lauri Irving: 1 personal fouls)   FT 1/3: GOOD   FT 2/3: GOOD   FT 3/3: GOOD Terry Durant makes 3/3 from the line.
Score: 1-3

[11:36] Team_054 possession (Score: 1-3)
Luka Brogdon makes the Dunk and draws the foul on Giannis Booker! And-1! Luka Brogdon to the line for 1. [Team fouls: 2] (Giannis Booker: 2 personal fouls)   FT 1/1: MISS Luka Brogdon makes 0/1 from the line. Rebound secured by Kobe Simmons.
Score: 3-3

[11:17] Team_036 possession (Score: 3-3)
Terry Durant attempts a 3Pt. Contested by Luka Brogdon (4.5 feet, MAN). Terry Durant misses. Rebound secured by Blake Russell.

[11:03] Team_054 possession (Score: 3-3)
Blake Russell attempts a Dunk. BLOCKED BY KOBE SIMMONS! Ball is loose! Rebound secured by Kobe Simmons.

[10:46] Team_036 possession (Score: 3-3)
FOUL! Shooting foul on Vince Ball. Anthony Poole to the line for 2 free throws. [Team fouls: 2] (Vince Ball: 1 personal fouls)   FT 1/2: GOOD   FT 2/2: GOOD Anthony Poole makes 2/2 from the line.
Score: 3-5

[10:27] Team_054 possession (Score: 3-5)
Blake Russell drives and kicks out. Lauri Irving attempts a Midrange. Contested by Giannis Booker (4.5 feet, MAN). Lauri Irving misses. Rebound secured by Kobe Simmons.

[10:15] Team_036 possession (Score: 3-5)
Michael Westbrook drives and kicks out. Anthony Poole attempts a 3Pt. Contested by Vince Ball (4.1 feet, MAN). Anthony Poole misses. Rebound secured by Luka Brogdon.

[09:59] Team_054 possession (Score: 3-5)
Lauri Irving attempts a Midrange. Contested by Anthony Poole (5.4 feet, ZONE). LAURI IRVING MAKES IT! Assist: Blake Russell
Score: 5-5

[09:49] Team_036 possession (Score: 5-5)
Anthony Poole makes the Layup and draws the foul on Blake Russell! And-1! Anthony Poole to the line for 1. [Team fouls: 3] (Blake Russell: 1 personal fouls)   FT 1/1: GOOD Anthony Poole makes 1/1 from the line.
Score: 5-8

[09:38] Team_054 possession (Score: 5-8)
Lauri Irving drives, Giannis Booker stays with him. Lauri Irving attempts a Dunk. Contested by Giannis Booker (5.1 feet, MAN). Lauri Irving misses. Rebound secured by Kobe Simmons.

[09:23] Team_036 possession (Score: 5-8)
Giannis Booker attempts a 3Pt. Contested by Lauri Irving (3.8 feet, MAN). Giannis Booker misses. Rebound secured by Lauri Irving.

[09:10] Team_054 possession (Score: 5-8)
Luka Brogdon drives, picks up Kobe Simmons. Help arrives from Giannis Booker! Luka Brogdon attempts a Layup. Contested by Giannis Booker (3.8 feet, ZONE). LUKA BROGDON MAKES IT!
Score: 7-8

[08:58] Team_036 possession (Score: 7-8)
Anthony Poole attempts a 3Pt. Contested by Vince Ball (4.8 feet, MAN). Anthony Poole misses. Rebound secured by Blake Russell.

[08:39] Team_054 possession (Score: 7-8)
Blake Russell drives to the basket... Blake Russell loses control! Ball rolls out of bounds! TURNOVER! (dead ball)

[08:26] Team_036 possession (Score: 7-8)
Michael Westbrook loses the ball! Stripped by Malcolm Harden! TURNOVER! (live ball)

[08:11] Team_054 possession (Score: 7-8)
Vince Ball attempts a Layup. BLOCKED BY GIANNIS BOOKER! Ball is loose! Rebound secured by Giannis Booker.

[07:58] Team_036 possession (Score: 7-8)
Giannis Booker attempts a Midrange. Contested by Lauri Irving (3.8 feet, MAN). Giannis Booker misses. Offensive rebound by Kobe Simmons! Kobe Simmons's putback is no good. Rebound secured by Blake Russell.

[07:47] Team_054 possession (Score: 7-8)
Lauri Irving attempts a Layup. Contested by Kobe Simmons (4.0 feet, ZONE). Lauri Irving misses. Rebound secured by Kobe Simmons.

[07:31] Team_036 possession (Score: 7-8)
FOUL! Shooting foul on Lauri Irving. Giannis Booker to the line for 2 free throws. [Team fouls: 4] (Lauri Irving: 2 personal fouls)   FT 1/2: MISS   FT 2/2: GOOD Giannis Booker makes 1/2 from the line.
Score: 7-9

[07:19] Team_054 possession (Score: 7-9)
Luka Brogdon drives, Kobe Simmons stays with him. Luka Brogdon attempts a Layup. Contested by Kobe Simmons (3.8 feet, ZONE). LUKA BROGDON MAKES IT! Assist: Lauri Irving
Score: 9-9

[07:04] Team_036 possession (Score: 9-9)
Anthony Poole attempts a Midrange. Contested by Vince Ball (4.8 feet, MAN). Anthony Poole misses. Rebound secured by Lauri Irving.

[06:49] Team_054 possession (Score: 9-9)
Vince Ball attempts a 3Pt. Contested by Michael Westbrook (4.8 feet, ZONE). Vince Ball misses. Rebound secured by Kobe Simmons.

[06:40] Team_036 possession (Score: 9-9)
Michael Westbrook drives and kicks out. FOUL! Shooting foul on Vince Ball. Anthony Poole to the line for 3 free throws. [BONUS: 5 team fouls] (Vince Ball: 2 personal fouls)   FT 1/3: GOOD   FT 2/3: GOOD   FT 3/3: MISS Anthony Poole makes 2/3 from the line. Offensive rebound by Terry Durant! Terry Durant puts it back in!
Score: 9-13

[06:24] Team_054 possession (Score: 9-13)
Lauri Irving attempts a Midrange. Contested by Kobe Simmons (4.0 feet, ZONE). Lauri Irving misses. Rebound secured by Giannis Booker.

[06:05] Team_036 possession (Score: 9-13)
Michael Westbrook makes the Midrange and draws the foul on Malcolm Harden! And-1! Michael Westbrook to the line for 1. [BONUS: 6 team fouls] (Malcolm Harden: 1 personal fouls)   FT 1/1: GOOD Michael Westbrook makes 1/1 from the line.
Score: 9-16

[05:49] Team_054 possession (Score: 9-16)
Malcolm Harden attempts a 3Pt. Contested by Terry Durant (4.7 feet, ZONE). Malcolm Harden misses. Offensive rebound by Blake Russell! Blake Russell puts it back in!
Score: 11-16

[05:32] Team_036 possession (Score: 11-16)
Michael Westbrook drives to the basket... Michael Westbrook loses control! Ball rolls out of bounds! TURNOVER! (dead ball)

[05:19] Team_054 possession (Score: 11-16)
Blake Russell drives, picks up Kobe Simmons. Help arrives from Giannis Booker! Blake Russell attempts a Dunk. Contested by Giannis Booker (3.9 feet, ZONE). BLAKE RUSSELL MAKES IT!
Score: 13-16

[05:03] Team_036 possession (Score: 13-16)
Terry Durant makes the Layup and draws the foul on Blake Russell! And-1! Terry Durant to the line for 1. [BONUS: 7 team fouls] (Blake Russell: 2 personal fouls)   FT 1/1: GOOD Terry Durant makes 1/1 from the line.
Score: 13-19

[04:50] Team_054 possession (Score: 13-19)
FOUL! Shooting foul on Giannis Booker. Lauri Irving to the line for 2 free throws. [Team fouls: 3] (Giannis Booker: 3 personal fouls)   FT 1/2: GOOD   FT 2/2: MISS Lauri Irving makes 1/2 from the line. Rebound secured by Giannis Booker.
Score: 14-19

[04:36] Team_036 possession (Score: 14-19)
Giannis Booker attempts a 3Pt. Contested by Lauri Irving (3.9 feet, ZONE). Giannis Booker misses. Rebound secured by Lauri Irving.

[04:25] Team_054 possession (Score: 14-19)
Blake Russell attempts a Layup. Contested by Kobe Simmons (4.0 feet, MAN). BLAKE RUSSELL MAKES IT! Assist: Luka Brogdon
Score: 16-19

[04:11] Team_036 possession (Score: 16-19)
Giannis Booker attempts a Midrange. Contested by Lauri Irving (3.9 feet, ZONE). Giannis Booker misses. Rebound secured by Blake Russell.

[03:56] Team_054 possession (Score: 16-19)
Lauri Irving attempts a 3Pt. Contested by Michael Westbrook (5.3 feet, ZONE). LAURI IRVING MAKES IT! Assist: Blake Russell
Score: 19-19

[03:47] Team_036 possession (Score: 19-19)
Michael Westbrook attempts a 3Pt. Contested by Lauri Irving (4.0 feet, ZONE). Michael Westbrook misses. Rebound secured by Luka Brogdon.

[03:31] Team_054 possession (Score: 19-19)
FOUL! Reach-in foul on Kobe Simmons during the drive. [Team fouls: 4] No free throws, side out. (Kobe Simmons: 1 personal fouls)

[03:17] Team_054 possession (Score: 19-19)
Malcolm Harden loses the ball! Stripped by Michael Westbrook! TURNOVER! (live ball)

[03:02] Team_036 possession (Score: 19-19)
FOUL! Reach-in foul on Malcolm Harden during the drive. [IN THE BONUS! 8 team fouls] Michael Westbrook to the line for 2 free throws. (Malcolm Harden: 2 personal fouls)   FT 1/2: GOOD   FT 2/2: GOOD Michael Westbrook makes 2/2 from the line.
Score: 19-21

[02:49] Team_054 possession (Score: 19-21)
Blake Russell drives to the basket... Blake Russell loses the ball! Stripped by Kobe Simmons! TURNOVER! (live ball)

[02:34] Team_036 possession (Score: 19-21)
Kobe Simmons attempts a Layup. Contested by Blake Russell (3.8 feet, MAN). KOBE SIMMONS MAKES IT!
Score: 19-23

[02:20] Team_054 possession (Score: 19-23)
FOUL! Shooting foul on Kobe Simmons. Malcolm Harden to the line for 2 free throws. [BONUS: 5 team fouls] (Kobe Simmons: 2 personal fouls)   FT 1/2: GOOD   FT 2/2: GOOD Malcolm Harden makes 2/2 from the line.
Score: 21-23

[02:09] Team_036 possession (Score: 21-23)
FOUL! Reach-in foul on Malcolm Harden during the drive. [IN THE BONUS! 9 team fouls] Michael Westbrook to the line for 2 free throws. (Malcolm Harden: 3 personal fouls)   FT 1/2: GOOD   FT 2/2: GOOD Michael Westbrook makes 2/2 from the line.
Score: 21-25

[01:56] Team_054 possession (Score: 21-25)
Lauri Irving drives and kicks out. Luka Brogdon attempts a 3Pt. Contested by Terry Durant (4.8 feet, MAN). LUKA BROGDON MAKES IT! Assist: Malcolm Harden
Score: 24-25

[01:40] Team_036 possession (Score: 24-25)
FOUL! Reach-in foul on Blake Russell during the drive. [IN THE BONUS! 10 team fouls] Terry Durant to the line for 2 free throws. (Blake Russell: 3 personal fouls)   FT 1/2: MISS   FT 2/2: GOOD Terry Durant makes 1/2 from the line.
Score: 24-26

[01:25] Team_054 possession (Score: 24-26)
Luka Brogdon drives and kicks out. Lauri Irving attempts a Midrange. Contested by Giannis Booker (4.9 feet, MAN). Lauri Irving misses. Rebound secured by Kobe Simmons.

[01:13] Team_036 possession (Score: 24-26)
Kobe Simmons drives and kicks out. Anthony Poole attempts a Midrange. Contested by Luka Brogdon (4.4 feet, ZONE). Anthony Poole misses. Offensive rebound by Terry Durant! Terry Durant puts it back in!
Score: 24-28

[01:02] Team_054 possession (Score: 24-28)
Malcolm Harden attempts a 3Pt. Contested by Michael Westbrook (5.3 feet, MAN). MALCOLM HARDEN MAKES IT! Assist: Vince Ball
Score: 27-28

[00:45] Team_036 possession (Score: 27-28)
Terry Durant drives and kicks out. Kobe Simmons attempts a 3Pt. Contested by Blake Russell (3.7 feet, MAN). Kobe Simmons misses. Rebound secured by Luka Brogdon.

[00:27] Team_054 possession (Score: 27-28)
Malcolm Harden makes the Layup and draws the foul on Michael Westbrook! And-1! Malcolm Harden to the line for 1. [BONUS: 6 team fouls] (Michael Westbrook: 1 personal fouls)   FT 1/1: GOOD Malcolm Harden makes 1/1 from the line.
Score: 30-28

[00:15] Team_036 possession (Score: 30-28)
Michael Westbrook attempts a Layup. Contested by Blake Russell (4.2 feet, ZONE). MICHAEL WESTBROOK MAKES IT! Assist: Kobe Simmons
Score: 30-30

[00:01] Team_054 possession (Score: 30-30)
Vince Ball attempts a Midrange. Contested by Terry Durant (5.1 feet, ZONE). Vince Ball misses. Rebound secured by Giannis Booker.

================================================================================
                              1ST QUARTER COMPLETE                              
================================================================================

1ST QUARTER SCORE: Team_054 30, Team_036 30

BOX SCORE:
================================================================================

Team_054
--------------------------------------------------------------------------------
Player                MIN  PTS  REB  AST  TO      FG   FG%      3P   3P%
--------------------------------------------------------------------------------
Malcolm Harden         12    9    0    1   0   4/4   100.0     0/0   0.0
Luka Brogdon           12    7    3    1   0   3/5    60.0     0/0   0.0
Blake Russell          12    6    5    2   0   3/5    60.0     0/0   0.0
Lauri Irving           12    5    3    1   0   2/6    33.3     0/0   0.0
Vince Ball             12    0    0    1   0   0/3     0.0     0/0   0.0

TEAM: FG: 12/23 (52.2%), 3PT: 3/4 (75.0%), REB: 10 (1 off, 9 def), AST: 6, TO: 3
TEAM FOULS: 10 [Team_036 in BONUS]


Team_036
--------------------------------------------------------------------------------
Player                MIN  PTS  REB  AST  TO      FG   FG%      3P   3P%
--------------------------------------------------------------------------------
Terry Durant           12   13    1    0   0   5/7    71.4     0/0   0.0
Michael Westbrook      12    9    0    0   0   4/6    66.7     0/0   0.0
Anthony Poole          12    5    0    0   0   2/4    50.0     0/0   0.0
Kobe Simmons           12    2    7    1   0   1/1   100.0     0/0   0.0
Giannis Booker         12    1    4    0   0   1/5    20.0     0/0   0.0

TEAM: FG: 13/23 (56.5%), 3PT: 1/6 (16.7%), REB: 13 (2 off, 11 def), AST: 1, TO: 2
TEAM FOULS: 6 [Team_054 in BONUS]

================================================================================

================================================================================
                       2ND QUARTER - Team_054 vs Team_036                       
================================================================================

[12:00] Team_054 possession (Score: 30-30)
Luka Brogdon attempts a Midrange. Contested by Terry Durant (5.1 feet, ZONE). LUKA BROGDON MAKES IT!
Score: 32-30

[11:45] Team_036 possession (Score: 32-30)
Kobe Simmons attempts a Midrange. Contested by Luka Brogdon (4.6 feet, ZONE). Kobe Simmons misses. Rebound secured by Luka Brogdon.

[11:31] Team_054 possession (Score: 32-30)
Luka Brogdon attempts a Layup. BLOCKED BY GIANNIS BOOKER! Ball is loose! Rebound secured by Giannis Booker.

[11:16] Team_036 possession (Score: 32-30)
Kobe Simmons attempts a 3Pt. Contested by Lauri Irving (4.2 feet, ZONE). Kobe Simmons misses. Rebound secured by Vince Ball.

[11:00] Team_054 possession (Score: 32-30)
Vince Ball attempts a 3Pt. Contested by Anthony Poole (5.4 feet, MAN). Vince Ball misses. Offensive rebound by Luka Brogdon! Luka Brogdon kicks it out.

[10:42] Team_054 possession (Score: 32-30)
Luka Brogdon attempts a Midrange. Contested by Anthony Poole (5.6 feet, ZONE). LUKA BROGDON MAKES IT!
Score: 34-30

[10:27] Team_036 possession (Score: 34-30)
Giannis Booker attempts a Midrange. Contested by Luka Brogdon (4.7 feet, ZONE). Giannis Booker misses. Rebound secured by Vince Ball.

[10:10] Team_054 possession (Score: 34-30)
Luka Brogdon attempts a 3Pt. Contested by Michael Westbrook (5.5 feet, ZONE). LUKA BROGDON MAKES IT! Assist: Lauri Irving
Score: 37-30

[09:58] Team_036 possession (Score: 37-30)
Michael Westbrook drives to the basket... Michael Westbrook throws a bad pass! Stolen by Malcolm Harden! TURNOVER! (live ball)

[09:45] Team_054 possession (Score: 37-30)
Lauri Irving makes the Layup and draws the foul on Giannis Booker! And-1! Lauri Irving to the line for 1. [Team fouls: 1] (Giannis Booker: 1 personal fouls)   FT 1/1: GOOD Lauri Irving makes 1/1 from the line.
Score: 40-30

[09:32] Team_036 possession (Score: 40-30)
Terry Durant attempts a 3Pt. Contested by Luka Brogdon (4.9 feet, MAN). Terry Durant misses. Offensive rebound by Terry Durant! Terry Durant kicks it out.

[09:16] Team_036 possession (Score: 40-30)
Giannis Booker attempts a 3Pt. Contested by Lauri Irving (4.5 feet, ZONE). Giannis Booker misses. Rebound secured by Blake Russell.

[09:05] Team_054 possession (Score: 40-30)
Luka Brogdon attempts a 3Pt. Contested by Michael Westbrook (5.6 feet, ZONE). LUKA BROGDON MAKES IT! Assist: Blake Russell
Score: 43-30

[08:54] Team_036 possession (Score: 43-30)
Giannis Booker attempts a 3Pt. Contested by Lauri Irving (4.5 feet, MAN). Giannis Booker misses. Offensive rebound by Terry Durant! Terry Durant kicks it out.

[08:37] Team_036 possession (Score: 43-30)
Terry Durant attempts a Midrange. Contested by Malcolm Harden (5.3 feet, ZONE). Terry Durant misses. Rebound secured by Blake Russell.

[08:25] Team_054 possession (Score: 43-30)
Vince Ball attempts a Layup. Contested by Kobe Simmons (4.5 feet, ZONE). Vince Ball misses. Rebound secured by Kobe Simmons.

[08:10] Team_036 possession (Score: 43-30)
Anthony Poole attempts a 3Pt. Contested by Lauri Irving (4.9 feet, ZONE). Anthony Poole misses. Rebound secured by Luka Brogdon.

[07:57] Team_054 possession (Score: 43-30)
Vince Ball drives to the basket... Vince Ball loses control! Ball rolls out of bounds! TURNOVER! (dead ball)

[07:57] Substitution (Team_054): Malcolm Harden OUT → Shaquille Irving IN (stamina_rule2)

[07:57] Substitution (Team_054): Lauri Irving OUT → Bradley Quickley IN (stamina_rule2)

[07:57] Substitution (Team_054): Vince Ball OUT → Vince James IN (stamina_rule2)

[07:57] Substitution (Team_054): Luka Brogdon OUT → Tobias Nowitzki IN (stamina_rule2)

[07:57] Substitution (Team_054): Blake Russell OUT → Devin Jackson IN (stamina_rule2)

[07:57] Substitution (Team_036): Michael Westbrook OUT → Dirk Anunoby IN (stamina_rule2)

[07:57] Substitution (Team_036): Giannis Booker OUT → Tobias Fox IN (stamina_rule2)

[07:57] Substitution (Team_036): Anthony Poole OUT → Pascal Antetokounmpo IN (stamina_rule2)

[07:57] Substitution (Team_036): Terry Durant OUT → Devin Simmons IN (stamina_rule2)

[07:57] Substitution (Team_036): Kobe Simmons OUT → Bradley Murray IN (stamina_rule2)

[07:41] Team_036 possession (Score: 43-30)
Tobias Fox attempts a 3Pt. Contested by Shaquille Irving (5.0 feet, ZONE). Tobias Fox misses. Rebound secured by Tobias Nowitzki.

[07:23] Team_054 possession (Score: 43-30)
Bradley Quickley attempts a Midrange. Contested by Tobias Fox (4.2 feet, MAN). Bradley Quickley misses. Rebound secured by Bradley Murray.

[07:08] Team_036 possession (Score: 43-30)
Pascal Antetokounmpo drives and kicks out. Bradley Murray attempts a 3Pt. Contested by Vince James (4.9 feet, ZONE). BRADLEY MURRAY MAKES IT!
Score: 43-33

[06:57] Team_054 possession (Score: 43-33)
Shaquille Irving attempts a Midrange. Contested by Pascal Antetokounmpo (5.3 feet, ZONE). Shaquille Irving misses. Offensive rebound by Tobias Nowitzki! Tobias Nowitzki kicks it out.

[06:42] Team_054 possession (Score: 43-33)
Shaquille Irving drives, Bradley Murray stays with him. Shaquille Irving attempts a Layup. Contested by Bradley Murray (5.1 feet, ZONE). SHAQUILLE IRVING MAKES IT! Assist: Vince James
Score: 45-33

[06:27] Team_036 possession (Score: 45-33)
Bradley Murray attempts a Midrange. Contested by Bradley Quickley (4.1 feet, ZONE). Bradley Murray misses. Rebound secured by Devin Jackson.

[06:14] Team_054 possession (Score: 45-33)
Bradley Quickley attempts a 3Pt. Contested by Tobias Fox (4.2 feet, ZONE). Bradley Quickley misses. Rebound secured by Devin Simmons.

[06:03] Team_036 possession (Score: 45-33)
FOUL! Offensive foul on Tobias Fox! Bradley Quickley drew the charge! [Team fouls: 2] (Tobias Fox: 1 personal fouls) TURNOVER! (dead ball)

[05:48] Team_054 possession (Score: 45-33)
Bradley Quickley drives and kicks out. Devin Jackson attempts a Midrange. Contested by Devin Simmons (5.2 feet, ZONE). Devin Jackson misses. Rebound secured by Devin Simmons.

[05:33] Team_036 possession (Score: 45-33)
Tobias Fox throws a bad pass! Stolen by Bradley Quickley! TURNOVER! (live ball)

[05:16] Team_054 possession (Score: 45-33)
Devin Jackson attempts a Midrange. Contested by Tobias Fox (4.7 feet, ZONE). Devin Jackson misses. Rebound secured by Devin Simmons.

[05:01] Team_036 possession (Score: 45-33)
Bradley Murray attempts a Layup. Contested by Devin Jackson (5.2 feet, MAN). BRADLEY MURRAY MAKES IT!
Score: 45-35

[04:47] Team_054 possession (Score: 45-35)
Devin Jackson attempts a 3Pt. Contested by Bradley Murray (4.8 feet, MAN). Devin Jackson misses. Rebound secured by Bradley Murray.

[04:28] Team_036 possession (Score: 45-35)
Devin Simmons attempts a Midrange. Contested by Tobias Nowitzki (5.8 feet, MAN). Devin Simmons misses. FOUL! Loose ball foul on Vince James during the rebound battle. [Team fouls: 1] No free throws, side out. (Vince James: 1 personal fouls)

[04:08] Team_036 possession (Score: 45-35)
FOUL! Shooting foul on Shaquille Irving. Pascal Antetokounmpo to the line for 3 free throws. [Team fouls: 2] (Shaquille Irving: 1 personal fouls)   FT 1/3: MISS   FT 2/3: MISS   FT 3/3: GOOD Pascal Antetokounmpo makes 1/3 from the line.
Score: 45-36

[03:50] Team_054 possession (Score: 45-36)
Bradley Quickley attempts a Midrange. Contested by Tobias Fox (4.2 feet, MAN). Bradley Quickley misses. Rebound secured by Devin Simmons.

[03:35] Team_036 possession (Score: 45-36)
Bradley Murray drives, picks up Devin Jackson. Help arrives from Bradley Quickley! Bradley Murray attempts a Layup. Contested by Bradley Quickley (5.2 feet, ZONE). BRADLEY MURRAY MAKES IT! Assist: Dirk Anunoby
Score: 45-38

[03:21] Team_054 possession (Score: 45-38)
Bradley Quickley attempts a 3Pt. Contested by Tobias Fox (4.2 feet, MAN). Bradley Quickley misses. Rebound secured by Devin Simmons.

[03:06] Team_036 possession (Score: 45-38)
Dirk Anunoby attempts a 3Pt. Contested by Shaquille Irving (5.0 feet, MAN). DIRK ANUNOBY MAKES IT!
Score: 45-41

[02:49] Team_054 possession (Score: 45-41)
Shaquille Irving drives and kicks out. Bradley Quickley attempts a 3Pt. Contested by Tobias Fox (4.5 feet, MAN). Bradley Quickley misses. Rebound secured by Bradley Murray.

[02:33] Team_036 possession (Score: 45-41)
FOUL! Shooting foul on Vince James. Pascal Antetokounmpo to the line for 2 free throws. [Team fouls: 3] (Vince James: 2 personal fouls)   FT 1/2: GOOD   FT 2/2: GOOD Pascal Antetokounmpo makes 2/2 from the line.
Score: 45-43

[02:16] Team_054 possession (Score: 45-43)
Devin Jackson drives and kicks out. Shaquille Irving attempts a 3Pt. Contested by Tobias Fox (4.5 feet, ZONE). Shaquille Irving misses. Rebound secured by Devin Simmons.

[02:03] Team_036 possession (Score: 45-43)
Devin Simmons attempts a Midrange. Contested by Tobias Nowitzki (5.8 feet, ZONE). DEVIN SIMMONS MAKES IT!
Score: 45-45

[01:45] Team_054 possession (Score: 45-45)
Shaquille Irving attempts a 3Pt. Contested by Dirk Anunoby (6.0 feet, MAN). Shaquille Irving misses. Rebound secured by Bradley Murray.

[01:31] Team_036 possession (Score: 45-45)
Tobias Fox attempts a Layup. Contested by Devin Jackson (5.7 feet, ZONE). TOBIAS FOX MAKES IT! Assist: Dirk Anunoby
Score: 45-47

[01:17] Team_054 possession (Score: 45-47)
Tobias Nowitzki drives, Devin Simmons stays with him. Tobias Nowitzki attempts a Dunk. Contested by Devin Simmons (5.2 feet, MAN). Tobias Nowitzki misses. Offensive rebound by Tobias Nowitzki! Tobias Nowitzki kicks it out.

[01:01] Team_054 possession (Score: 45-47)
Shaquille Irving attempts a 3Pt. Contested by Pascal Antetokounmpo (5.3 feet, ZONE). SHAQUILLE IRVING MAKES IT!
Score: 48-47

[00:46] Team_036 possession (Score: 48-47)
Dirk Anunoby attempts a Midrange. Contested by Bradley Quickley (4.6 feet, ZONE). Dirk Anunoby misses. Rebound secured by Vince James.

[00:36] Team_054 possession (Score: 48-47)
Devin Jackson drives, picks up Bradley Murray. Help arrives from Dirk Anunoby! Devin Jackson attempts a Dunk. Contested by Dirk Anunoby (4.8 feet, MAN). DEVIN JACKSON MAKES IT!
Score: 50-47

[00:22] Team_036 possession (Score: 50-47)
Tobias Fox drives, picks up Bradley Quickley. Help arrives from Vince James! Tobias Fox attempts a Layup. Contested by Vince James (4.6 feet, MAN). TOBIAS FOX MAKES IT! Assist: Dirk Anunoby
Score: 50-49

[00:07] Team_054 possession (Score: 50-49)
Vince James drives and kicks out. Vince James attempts a Midrange. Contested by Pascal Antetokounmpo (4.8 feet, MAN). Vince James misses. Offensive rebound by Tobias Nowitzki! Tobias Nowitzki kicks it out.

================================================================================
                              2ND QUARTER COMPLETE                              
================================================================================

2ND QUARTER SCORE: Team_054 20, Team_036 19

BOX SCORE:
================================================================================

Team_054
--------------------------------------------------------------------------------
Player                MIN  PTS  REB  AST  TO      FG   FG%      3P   3P%
--------------------------------------------------------------------------------
Luka Brogdon           17   10    3    0   0   4/5    80.0     0/0   0.0
Shaquille Irving        8    5    0    0   0   2/4    50.0     0/0   0.0
Lauri Irving           17    3    0    1   0   1/1   100.0     0/0   0.0
Devin Jackson           8    2    1    0   0   1/4    25.0     0/0   0.0
Vince Ball             17    0    2    0   0   0/1     0.0     0/0   0.0
Blake Russell          17    0    2    1   0   0/0     0.0     0/0   0.0
Tobias Nowitzki         8    0    4    0   0   0/0     0.0     0/0   0.0
Bradley Quickley        8    0    0    0   0   0/5     0.0     0/0   0.0
Vince James             8    0    1    1   0   0/0     0.0     0/0   0.0

TEAM: FG: 8/20 (40.0%), 3PT: 3/7 (42.9%), REB: 13 (4 off, 9 def), AST: 3, TO: 1
TEAM FOULS: 3


Team_036
--------------------------------------------------------------------------------
Player                MIN  PTS  REB  AST  TO      FG   FG%      3P   3P%
--------------------------------------------------------------------------------
Bradley Murray          8    7    5    0   0   3/4    75.0     0/0   0.0
Tobias Fox              8    4    0    0   0   2/3    66.7     0/0   0.0
Pascal Antetokounmpo    8    3    0    0   0   2/2   100.0     0/0   0.0
Dirk Anunoby            8    3    0    3   0   1/2    50.0     0/0   0.0
Devin Simmons           8    2    6    0   0   1/1   100.0     0/0   0.0
Kobe Simmons           17    0    1    0   0   0/2     0.0     0/0   0.0
Giannis Booker         17    0    1    0   0   0/2     0.0     0/0   0.0
Terry Durant           17    0    2    0   0   0/1     0.0     0/0   0.0
Anthony Poole          17    0    0    0   0   0/1     0.0     0/0   0.0

TEAM: FG: 9/18 (50.0%), 3PT: 2/6 (33.3%), REB: 15 (3 off, 12 def), AST: 3, TO: 3
TEAM FOULS: 2

================================================================================

================================================================================
                       3RD QUARTER - Team_054 vs Team_036                       
================================================================================

[12:00] Team_054 possession (Score: 50-49)
FOUL! Shooting foul on Terry Durant. Luka Brogdon to the line for 3 free throws. [Team fouls: 1] (Terry Durant: 1 personal fouls)   FT 1/3: GOOD   FT 2/3: MISS   FT 3/3: GOOD Luka Brogdon makes 2/3 from the line.
Score: 52-49

[11:43] Team_036 possession (Score: 52-49)
Anthony Poole attempts a 3Pt. Contested by Vince Ball (4.8 feet, MAN). Anthony Poole misses. Rebound secured by Blake Russell.

[11:28] Team_054 possession (Score: 52-49)
FOUL! Reach-in foul on Terry Durant during the drive. [Team fouls: 2] No free throws, side out. (Terry Durant: 2 personal fouls)

[11:10] Team_054 possession (Score: 52-49)
Blake Russell attempts a Midrange. Contested by Anthony Poole (5.4 feet, ZONE). BLAKE RUSSELL MAKES IT!
Score: 54-49

[11:00] Team_036 possession (Score: 54-49)
Terry Durant drives to the basket... Terry Durant loses the ball! Stripped by Blake Russell! TURNOVER! (live ball)

[10:47] Team_054 possession (Score: 54-49)
Vince Ball attempts a 3Pt. Contested by Michael Westbrook (4.8 feet, ZONE). Vince Ball misses. Rebound secured by Giannis Booker.

[10:34] Team_036 possession (Score: 54-49)
Anthony Poole attempts a Midrange. Contested by Vince Ball (4.8 feet, ZONE). Anthony Poole misses. Rebound secured by Blake Russell.

[10:21] Team_054 possession (Score: 54-49)
Luka Brogdon throws a bad pass! Stolen by Terry Durant! TURNOVER! (live ball)

[10:07] Team_036 possession (Score: 54-49)
Giannis Booker attempts a 3Pt. Contested by Lauri Irving (3.8 feet, ZONE). GIANNIS BOOKER MAKES IT! Assist: Kobe Simmons
Score: 54-52

[09:51] Team_054 possession (Score: 54-52)
Blake Russell attempts a 3Pt. BLOCKED BY MICHAEL WESTBROOK! Ball is loose! Rebound secured by Terry Durant.

[09:33] Team_036 possession (Score: 54-52)
Giannis Booker attempts a 3Pt. Contested by Lauri Irving (3.8 feet, ZONE). Giannis Booker misses. Rebound secured by Blake Russell.

[09:20] Team_054 possession (Score: 54-52)
Luka Brogdon makes the Dunk and draws the foul on Terry Durant! And-1! Luka Brogdon to the line for 1. [Team fouls: 3] (Terry Durant: 3 personal fouls)   FT 1/1: MISS Luka Brogdon makes 0/1 from the line. Rebound secured by Kobe Simmons.
Score: 56-52

[09:02] Team_036 possession (Score: 56-52)
Kobe Simmons drives to the basket... FOUL! Offensive foul on Kobe Simmons! Blake Russell drew the charge! [Team fouls: 4] (Kobe Simmons: 1 personal fouls) TURNOVER! (dead ball)

[08:49] Team_054 possession (Score: 56-52)
Malcolm Harden attempts a Midrange. Contested by Terry Durant (4.7 feet, ZONE). MALCOLM HARDEN MAKES IT!
Score: 58-52

[08:36] Team_036 possession (Score: 58-52)
Terry Durant throws a bad pass! Stolen by Luka Brogdon! TURNOVER! (live ball)

[08:22] Team_054 possession (Score: 58-52)
Lauri Irving attempts a Layup. Contested by Terry Durant (5.0 feet, ZONE). LAURI IRVING MAKES IT! Assist: Malcolm Harden
Score: 60-52

[08:06] Team_036 possession (Score: 60-52)
Giannis Booker attempts a 3Pt. Contested by Lauri Irving (3.8 feet, ZONE). Giannis Booker misses. Rebound secured by Blake Russell.

[07:52] Team_054 possession (Score: 60-52)
Lauri Irving makes the Dunk and draws the foul on Kobe Simmons! And-1! Lauri Irving to the line for 1. [BONUS: 5 team fouls] (Kobe Simmons: 2 personal fouls)   FT 1/1: GOOD Lauri Irving makes 1/1 from the line.
Score: 63-52

[07:36] Team_036 possession (Score: 63-52)
Giannis Booker drives, Blake Russell stays with him. Giannis Booker attempts a Layup. Contested by Blake Russell (3.4 feet, ZONE). GIANNIS BOOKER MAKES IT! Assist: Terry Durant
Score: 63-54

[07:21] Team_054 possession (Score: 63-54)
Vince Ball attempts a 3Pt. Contested by Anthony Poole (5.0 feet, MAN). Vince Ball misses. Rebound secured by Giannis Booker.

[07:09] Team_036 possession (Score: 63-54)
Michael Westbrook drives and kicks out. Terry Durant attempts a Midrange. Contested by Luka Brogdon (4.0 feet, MAN). Terry Durant misses. Offensive rebound by Kobe Simmons! Kobe Simmons puts it back in!
Score: 63-56

[06:55] Team_054 possession (Score: 63-56)
Blake Russell attempts a Layup. Contested by Kobe Simmons (3.9 feet, ZONE). BLAKE RUSSELL MAKES IT!
Score: 65-56

[06:41] Team_036 possession (Score: 65-56)
Michael Westbrook drives, picks up Malcolm Harden. Help arrives from Lauri Irving! Michael Westbrook attempts a Layup. Contested by Lauri Irving (4.6 feet, MAN). Michael Westbrook misses. Rebound secured by Blake Russell.

[06:24] Team_054 possession (Score: 65-56)
Blake Russell attempts a Midrange. Contested by Giannis Booker (5.0 feet, ZONE). BLAKE RUSSELL MAKES IT! Assist: Lauri Irving
Score: 67-56

[06:06] Team_036 possession (Score: 67-56)
Michael Westbrook attempts a 3Pt. Contested by Lauri Irving (3.9 feet, ZONE). MICHAEL WESTBROOK MAKES IT! Assist: Anthony Poole
Score: 67-59

[05:53] Team_054 possession (Score: 67-59)
Lauri Irving attempts a 3Pt. Contested by Giannis Booker (5.1 feet, MAN). LAURI IRVING MAKES IT! Assist: Vince Ball
Score: 70-59

[05:42] Team_036 possession (Score: 70-59)
Kobe Simmons drives, picks up Blake Russell. Help arrives from Lauri Irving! Kobe Simmons attempts a Layup. Contested by Lauri Irving (3.4 feet, MAN). KOBE SIMMONS MAKES IT!
Score: 70-61

[05:32] Team_054 possession (Score: 70-61)
FOUL! Reach-in foul on Michael Westbrook during the drive. [IN THE BONUS! 6 team fouls] Malcolm Harden to the line for 2 free throws. (Michael Westbrook: 1 personal fouls)   FT 1/2: GOOD   FT 2/2: GOOD Malcolm Harden makes 2/2 from the line.
Score: 72-61

[05:16] Team_036 possession (Score: 72-61)
Terry Durant drives to the basket... FOUL! Offensive foul on Terry Durant! Blake Russell drew the charge! [Team fouls: 7] (Terry Durant: 4 personal fouls) TURNOVER! (dead ball)

[05:00] Team_054 possession (Score: 72-61)
Malcolm Harden throws a bad pass! Stolen by Michael Westbrook! TURNOVER! (live ball)

[04:45] Team_036 possession (Score: 72-61)
Kobe Simmons drives, Blake Russell stays with him. Kobe Simmons attempts a Layup. Contested by Blake Russell (3.5 feet, MAN). KOBE SIMMONS MAKES IT! Assist: Anthony Poole
Score: 72-63

[04:32] Team_054 possession (Score: 72-63)
Malcolm Harden attempts a 3Pt. Contested by Michael Westbrook (5.0 feet, ZONE). Malcolm Harden misses. Rebound secured by Terry Durant.

[04:15] Team_036 possession (Score: 72-63)
Anthony Poole attempts a 3Pt. Contested by Vince Ball (4.9 feet, MAN). Anthony Poole misses. Rebound secured by Luka Brogdon.

[03:58] Team_054 possession (Score: 72-63)
Malcolm Harden attempts a 3Pt. Contested by Michael Westbrook (5.0 feet, ZONE). MALCOLM HARDEN MAKES IT! Assist: Lauri Irving
Score: 75-63

[03:41] Team_036 possession (Score: 75-63)
Anthony Poole attempts a Layup. BLOCKED BY VINCE BALL! Ball is loose! Offensive rebound by Kobe Simmons! Kobe Simmons kicks it out.

[03:26] Team_036 possession (Score: 75-63)
Anthony Poole attempts a 3Pt. Contested by Lauri Irving (4.3 feet, ZONE). Anthony Poole misses. Rebound secured by Blake Russell.

[03:12] Team_054 possession (Score: 75-63)
Luka Brogdon makes the Layup and draws the foul on Kobe Simmons! And-1! Luka Brogdon to the line for 1. [BONUS: 8 team fouls] (Kobe Simmons: 3 personal fouls)   FT 1/1: GOOD Luka Brogdon makes 1/1 from the line.
Score: 78-63

[02:57] Team_036 possession (Score: 78-63)
Terry Durant makes the Dunk and draws the foul on Luka Brogdon! And-1! Terry Durant to the line for 1. [Team fouls: 2] (Luka Brogdon: 1 personal fouls)   FT 1/1: GOOD Terry Durant makes 1/1 from the line.
Score: 78-66

[02:45] Team_054 possession (Score: 78-66)
Malcolm Harden drives and kicks out. Luka Brogdon attempts a 3Pt. Contested by Michael Westbrook (4.9 feet, ZONE). LUKA BROGDON MAKES IT! Assist: Lauri Irving
Score: 81-66

[02:33] Team_036 possession (Score: 81-66)
Terry Durant attempts a 3Pt. Contested by Lauri Irving (4.1 feet, ZONE). Terry Durant misses. Rebound secured by Luka Brogdon.

[02:21] Team_054 possession (Score: 81-66)
Blake Russell attempts a Layup. Contested by Kobe Simmons (4.2 feet, MAN). BLAKE RUSSELL MAKES IT! Assist: Vince Ball
Score: 83-66

[02:06] Team_036 possession (Score: 83-66)
Terry Durant drives to the basket... FOUL! Offensive foul on Terry Durant! Blake Russell drew the charge! [Team fouls: 9] (Terry Durant: 5 personal fouls) TURNOVER! (dead ball)

[01:56] Team_054 possession (Score: 83-66)
Lauri Irving drives, Kobe Simmons stays with him. Lauri Irving attempts a Layup. Contested by Kobe Simmons (4.4 feet, ZONE). LAURI IRVING MAKES IT! Assist: Vince Ball
Score: 85-66

[01:40] Team_036 possession (Score: 85-66)
Michael Westbrook attempts a Midrange. Contested by Luka Brogdon (4.7 feet, ZONE). MICHAEL WESTBROOK MAKES IT! Assist: Terry Durant
Score: 85-68

[01:29] Team_054 possession (Score: 85-68)
Malcolm Harden attempts a 3Pt. Contested by Terry Durant (5.1 feet, ZONE). Malcolm Harden misses. Rebound secured by Terry Durant.

[01:14] Team_036 possession (Score: 85-68)
Terry Durant attempts a Layup. Contested by Blake Russell (4.0 feet, ZONE). TERRY DURANT MAKES IT! Assist: Giannis Booker
Score: 85-70

[01:03] Team_054 possession (Score: 85-70)
Malcolm Harden drives and kicks out. Blake Russell attempts a 3Pt. Contested by Michael Westbrook (5.1 feet, ZONE). Blake Russell misses. FOUL! Loose ball foul on Kobe Simmons during the rebound battle. [IN THE BONUS! 10 team fouls] Luka Brogdon to the line for 2 free throws. (Kobe Simmons: 4 personal fouls)   FT 1/2: MISS   FT 2/2: MISS Luka Brogdon makes 0/2 from the line. Rebound secured by Terry Durant.

[00:51] Team_036 possession (Score: 85-70)
Anthony Poole attempts a Midrange. Contested by Vince Ball (5.1 feet, MAN). Anthony Poole misses. Rebound secured by Vince Ball.

[00:36] Team_054 possession (Score: 85-70)
Blake Russell attempts a 3Pt. Contested by Kobe Simmons (4.4 feet, MAN). BLAKE RUSSELL MAKES IT! Assist: Malcolm Harden
Score: 88-70

[00:21] Team_036 possession (Score: 88-70)
Terry Durant drives and kicks out. Michael Westbrook attempts a Midrange. Contested by Luka Brogdon (4.5 feet, ZONE). Michael Westbrook misses. Offensive rebound by Kobe Simmons! Kobe Simmons puts it back in!
Score: 88-72

[00:04] Team_054 possession (Score: 88-72)
Luka Brogdon attempts a 3Pt. Contested by Michael Westbrook (5.5 feet, ZONE). LUKA BROGDON MAKES IT! Assist: Blake Russell
Score: 91-72

================================================================================
                              3RD QUARTER COMPLETE                              
================================================================================

3RD QUARTER SCORE: Team_054 41, Team_036 23

BOX SCORE:
================================================================================

Team_054
--------------------------------------------------------------------------------
Player                MIN  PTS  REB  AST  TO      FG   FG%      3P   3P%
--------------------------------------------------------------------------------
Luka Brogdon           29   11    2    0   0   4/5    80.0     0/0   0.0
Blake Russell          29   11    6    1   0   5/6    83.3     0/0   0.0
Lauri Irving           29   10    0    3   0   4/4   100.0     0/0   0.0
Malcolm Harden         29    7    0    2   0   3/6    50.0     0/0   0.0
Terry Durant           29    5    4    2   0   2/3    66.7     0/0   0.0
Vince Ball             29    0    1    3   0   0/2     0.0     0/0   0.0

TEAM: FG: 16/23 (69.6%), 3PT: 5/10 (50.0%), REB: 10 (1 off, 9 def), AST: 9, TO: 2
TEAM FOULS: 2


Team_036
--------------------------------------------------------------------------------
Player                MIN  PTS  REB  AST  TO      FG   FG%      3P   3P%
--------------------------------------------------------------------------------
Kobe Simmons           29    8    4    1   0   4/4   100.0     0/0   0.0
Giannis Booker         29    5    2    1   0   2/4    50.0     0/0   0.0
Michael Westbrook      29    5    0    0   0   2/3    66.7     0/0   0.0
Anthony Poole          29    0    0    2   0   0/5     0.0     0/0   0.0

TEAM: FG: 10/19 (52.6%), 3PT: 2/8 (25.0%), REB: 9 (3 off, 6 def), AST: 6, TO: 5
TEAM FOULS: 10 [Team_054 in BONUS]

================================================================================

================================================================================
                       4TH QUARTER - Team_054 vs Team_036                       
================================================================================

[12:00] Team_054 possession (Score: 91-72)
Blake Russell drives and kicks out. Vince Ball attempts a 3Pt. Contested by Michael Westbrook (5.0 feet, ZONE). VINCE BALL MAKES IT! Assist: Blake Russell
Score: 94-72

[11:43] Team_036 possession (Score: 94-72)
Kobe Simmons attempts a Midrange. Contested by Blake Russell (3.8 feet, MAN). Kobe Simmons misses. Rebound secured by Vince Ball.

[11:29] Team_054 possession (Score: 94-72)
Luka Brogdon makes the Midrange and draws the foul on Terry Durant! And-1! Luka Brogdon to the line for 1. [Team fouls: 1] (Terry Durant: 1 personal fouls)   FT 1/1: GOOD Luka Brogdon makes 1/1 from the line.
Score: 97-72

[11:11] Team_036 possession (Score: 97-72)
Michael Westbrook attempts a 3Pt. Contested by Lauri Irving (4.3 feet, ZONE). Michael Westbrook misses. Rebound secured by Blake Russell.

[10:56] Team_054 possession (Score: 97-72)
Lauri Irving drives to the basket... Lauri Irving throws a bad pass! Stolen by Giannis Booker! TURNOVER! (live ball)

[10:44] Team_036 possession (Score: 97-72)
Michael Westbrook attempts a 3Pt. Contested by Lauri Irving (4.3 feet, ZONE). Michael Westbrook misses. Rebound secured by Vince Ball.

[10:27] Team_054 possession (Score: 97-72)
Malcolm Harden drives, picks up Kobe Simmons. Help arrives from Giannis Booker! Malcolm Harden attempts a Dunk. Contested by Giannis Booker (4.3 feet, ZONE). Malcolm Harden misses. Offensive rebound by Luka Brogdon! Luka Brogdon kicks it out.

[10:12] Team_054 possession (Score: 97-72)
Luka Brogdon attempts a Midrange. Contested by Terry Durant (5.3 feet, MAN). LUKA BROGDON MAKES IT!
Score: 99-72

[09:57] Team_036 possession (Score: 99-72)
Giannis Booker attempts a 3Pt. Contested by Lauri Irving (4.3 feet, ZONE). GIANNIS BOOKER MAKES IT! Assist: Kobe Simmons
Score: 99-75

[09:45] Team_054 possession (Score: 99-75)
Vince Ball attempts a Midrange. Contested by Terry Durant (5.1 feet, ZONE). Vince Ball misses. FOUL! Loose ball foul on Kobe Simmons during the rebound battle. [Team fouls: 2] No free throws, side out. (Kobe Simmons: 1 personal fouls)

[09:28] Team_054 possession (Score: 99-75)
FOUL! Reach-in foul on Kobe Simmons during the drive. [Team fouls: 3] No free throws, side out. (Kobe Simmons: 2 personal fouls)

[09:12] Team_054 possession (Score: 99-75)
Luka Brogdon attempts a 3Pt. Contested by Michael Westbrook (5.5 feet, ZONE). Luka Brogdon misses. Rebound secured by Giannis Booker.

[08:54] Team_036 possession (Score: 99-75)
Kobe Simmons makes the Layup and draws the foul on Lauri Irving! And-1! Kobe Simmons to the line for 1. [Team fouls: 1] (Lauri Irving: 1 personal fouls)   FT 1/1: GOOD Kobe Simmons makes 1/1 from the line.
Score: 99-78

[08:37] Team_054 possession (Score: 99-78)
FOUL! Holding foul on Kobe Simmons. [Team fouls: 4] No free throws, side out. (Kobe Simmons: 3 personal fouls)

[08:25] Team_054 possession (Score: 99-78)
Malcolm Harden attempts a Layup. BLOCKED BY MICHAEL WESTBROOK! Ball is loose! Rebound secured by Terry Durant.

[08:11] Team_036 possession (Score: 99-78)
Terry Durant attempts a 3Pt. Contested by Lauri Irving (4.6 feet, ZONE). Terry Durant misses. Offensive rebound by Terry Durant! Terry Durant kicks it out.

[07:57] Team_036 possession (Score: 99-78)
Anthony Poole throws a bad pass! Stolen by Vince Ball! TURNOVER! (live ball)

[07:37] Team_054 possession (Score: 99-78)
Lauri Irving attempts a Midrange. Contested by Anthony Poole (6.0 feet, ZONE). Lauri Irving misses. Rebound secured by Giannis Booker.

[07:21] Team_036 possession (Score: 99-78)
Anthony Poole drives and kicks out. Giannis Booker attempts a Midrange. Contested by Vince Ball (4.8 feet, ZONE). GIANNIS BOOKER MAKES IT! Assist: Kobe Simmons
Score: 99-80

[07:10] Team_054 possession (Score: 99-80)
Malcolm Harden drives, picks up Terry Durant. Help arrives from Giannis Booker! Malcolm Harden attempts a Dunk. Contested by Giannis Booker (5.5 feet, ZONE). MALCOLM HARDEN MAKES IT! Assist: Lauri Irving
Score: 101-80

[06:52] Team_036 possession (Score: 101-80)
Terry Durant attempts a Midrange. Contested by Vince Ball (5.1 feet, ZONE). TERRY DURANT MAKES IT! Assist: Anthony Poole
Score: 101-82

[06:36] Team_054 possession (Score: 101-82)
Lauri Irving attempts a Midrange. Contested by Giannis Booker (5.8 feet, MAN). Lauri Irving misses. Rebound secured by Kobe Simmons.

[06:21] Team_036 possession (Score: 101-82)
Michael Westbrook drives, picks up Malcolm Harden. Help arrives from Lauri Irving! Michael Westbrook attempts a Dunk. Contested by Lauri Irving (5.5 feet, MAN). MICHAEL WESTBROOK MAKES IT!
Score: 101-84

[06:03] Team_054 possession (Score: 101-84)
Blake Russell drives and kicks out. Vince Ball attempts a Midrange. Contested by Anthony Poole (5.8 feet, MAN). Vince Ball misses. Rebound secured by Giannis Booker.

[05:46] Team_036 possession (Score: 101-84)
Giannis Booker attempts a Midrange. Contested by Lauri Irving (4.9 feet, MAN). Giannis Booker misses. Rebound secured by Vince Ball.

[05:30] Team_054 possession (Score: 101-84)
Vince Ball attempts a Midrange. Contested by Anthony Poole (5.9 feet, ZONE). VINCE BALL MAKES IT!
Score: 103-84

[05:18] Team_036 possession (Score: 103-84)
Michael Westbrook drives, Malcolm Harden stays with him. Michael Westbrook attempts a Layup. Contested by Malcolm Harden (5.6 feet, MAN). MICHAEL WESTBROOK MAKES IT! Assist: Terry Durant
Score: 103-86

[05:04] Team_054 possession (Score: 103-86)
Malcolm Harden attempts a 3Pt. Contested by Michael Westbrook (5.9 feet, ZONE). Malcolm Harden misses. Rebound secured by Terry Durant.

[04:50] Team_036 possession (Score: 103-86)
Anthony Poole loses the ball! Stripped by Vince Ball! TURNOVER! (live ball)

[04:33] Team_054 possession (Score: 103-86)
FOUL! Holding foul on Anthony Poole. [IN THE BONUS! 5 team fouls] Vince Ball to the line for 2 free throws. (Anthony Poole: 1 personal fouls)   FT 1/2: MISS   FT 2/2: GOOD Vince Ball makes 1/2 from the line.
Score: 104-86

[04:18] Team_036 possession (Score: 104-86)
Terry Durant drives, picks up Luka Brogdon. Help arrives from Lauri Irving! Terry Durant attempts a Dunk. Contested by Lauri Irving (5.4 feet, MAN). TERRY DURANT MAKES IT!
Score: 104-88

[04:02] Team_054 possession (Score: 104-88)
Vince Ball attempts a 3Pt. Contested by Michael Westbrook (6.0 feet, ZONE). VINCE BALL MAKES IT!
Score: 107-88

[03:47] Team_036 possession (Score: 107-88)
Giannis Booker attempts a 3Pt. Contested by Lauri Irving (5.2 feet, MAN). Giannis Booker misses. Rebound secured by Vince Ball.

[03:28] Team_054 possession (Score: 107-88)
Blake Russell drives to the basket... Blake Russell loses the ball! Stripped by Kobe Simmons! TURNOVER! (live ball)

[03:14] Team_036 possession (Score: 107-88)
Giannis Booker attempts a 3Pt. Contested by Lauri Irving (5.2 feet, ZONE). Giannis Booker misses. Rebound secured by Vince Ball.

[03:04] Team_054 possession (Score: 107-88)
Malcolm Harden attempts a 3Pt. Wide open! Michael Westbrook is 6.2 feet away. [MAN] Malcolm Harden misses. Rebound secured by Giannis Booker.

[02:49] Team_036 possession (Score: 107-88)
Terry Durant attempts a 3Pt. Contested by Lauri Irving (5.3 feet, ZONE). Terry Durant misses. Rebound secured by Luka Brogdon.

[02:35] Team_054 possession (Score: 107-88)
Blake Russell attempts a Midrange. Wide open! Giannis Booker is 6.1 feet away. [ZONE] BLAKE RUSSELL MAKES IT! Assist: Vince Ball
Score: 109-88

[02:18] Team_036 possession (Score: 109-88)
Giannis Booker attempts a 3Pt. Contested by Lauri Irving (5.4 feet, ZONE). Giannis Booker misses. Rebound secured by Blake Russell.

[02:00] Team_054 possession (Score: 109-88)
Blake Russell drives, Kobe Simmons stays with him. Blake Russell attempts a Dunk. Contested by Kobe Simmons (5.6 feet, MAN). BLAKE RUSSELL MAKES IT!
Score: 111-88

[01:43] Team_036 possession (Score: 111-88)
Terry Durant drives, Blake Russell stays with him. Terry Durant attempts a Dunk. Contested by Blake Russell (5.4 feet, ZONE). TERRY DURANT MAKES IT!
Score: 111-90

[01:29] Team_054 possession (Score: 111-90)
Vince Ball attempts a 3Pt. Wide open! Anthony Poole is 6.4 feet away. [MAN] VINCE BALL MAKES IT! Assist: Blake Russell
Score: 114-90

[01:15] Team_036 possession (Score: 114-90)
Anthony Poole attempts a Midrange. Contested by Vince Ball (6.0 feet, ZONE). Anthony Poole misses. Rebound secured by Blake Russell.

[01:03] Team_054 possession (Score: 114-90)
Lauri Irving drives and kicks out. Luka Brogdon attempts a Midrange. Wide open! Terry Durant is 6.4 feet away. [MAN] LUKA BROGDON MAKES IT!
Score: 116-90

[00:49] Team_036 possession (Score: 116-90)
Michael Westbrook attempts a 3Pt. Contested by Lauri Irving (5.7 feet, ZONE). Michael Westbrook misses. Rebound secured by Blake Russell.

[00:38] Team_054 possession (Score: 116-90)
Luka Brogdon makes the Layup and draws the foul on Giannis Booker! And-1! Luka Brogdon to the line for 1. [BONUS: 6 team fouls] (Giannis Booker: 1 personal fouls)   FT 1/1: MISS Luka Brogdon makes 0/1 from the line. Rebound secured by Giannis Booker.
Score: 118-90

[00:26] Team_036 possession (Score: 118-90)
Terry Durant attempts a Midrange. Contested by Luka Brogdon (5.9 feet, MAN). Terry Durant misses. Rebound secured by Blake Russell.

[00:15] Team_054 possession (Score: 118-90)
Malcolm Harden drives and kicks out. Luka Brogdon attempts a 3Pt. Wide open! Terry Durant is 6.6 feet away. [MAN] Luka Brogdon misses. Rebound secured by Kobe Simmons.

================================================================================
                              4TH QUARTER COMPLETE                              
================================================================================

4TH QUARTER SCORE: Team_054 27, Team_036 18

BOX SCORE:
================================================================================

Team_054
--------------------------------------------------------------------------------
Player                MIN  PTS  REB  AST  TO      FG   FG%      3P   3P%
--------------------------------------------------------------------------------
Vince Ball             41   12    5    1   0   5/5   100.0     0/0   0.0
Luka Brogdon           41    7    3    0   0   3/5    60.0     0/0   0.0
Blake Russell          41    4    5    2   0   2/3    66.7     0/0   0.0
Malcolm Harden         41    2    0    0   0   1/5    20.0     0/0   0.0
Lauri Irving           41    0    0    1   0   0/2     0.0     0/0   0.0

TEAM: FG: 11/20 (55.0%), 3PT: 2/5 (40.0%), REB: 13 (2 off, 11 def), AST: 4, TO: 2
TEAM FOULS: 1


Team_036
--------------------------------------------------------------------------------
Player                MIN  PTS  REB  AST  TO      FG   FG%      3P   3P%
--------------------------------------------------------------------------------
Terry Durant           41    6    3    1   0   3/5    60.0     0/0   0.0
Giannis Booker         41    5    5    0   0   2/6    33.3     0/0   0.0
Michael Westbrook      41    4    0    0   0   2/5    40.0     0/0   0.0
Kobe Simmons           41    3    2    2   0   1/2    50.0     0/0   0.0
Anthony Poole          41    0    0    1   0   0/1     0.0     0/0   0.0

TEAM: FG: 8/19 (42.1%), 3PT: 1/8 (12.5%), REB: 10 (1 off, 9 def), AST: 4, TO: 2
TEAM FOULS: 6 [Team_054 in BONUS]

================================================================================

================================================================================
                               FULL GAME COMPLETE                               
================================================================================

FINAL SCORE: Team_054 118, Team_036 90

SCORING BY QUARTER:
--------------------------------------------------------------------------------
Team                     Q1     Q2     Q3     Q4    FINAL
--------------------------------------------------------------------------------
Team_054                 30     20     41     27      118
Team_036                 30     19     23     18       90
--------------------------------------------------------------------------------

FULL GAME BOX SCORE:
================================================================================

Team_054
--------------------------------------------------------------------------------
Player                MIN  PTS  REB  AST  TO      FG   FG%      3P   3P%      FT STL BLK
--------------------------------------------------------------------------------
Malcolm Harden         41   18    0    3   2  10/17   58.8   3/7    42.9   6/7     2   0
Lauri Irving           41   18    3    6   1   9/15   60.0   2/2   100.0   3/4     0   0
Vince Ball             41   12    8    5   2   3/9    33.3   2/5    40.0   1/2     2   1
Luka Brogdon           41   35   11    1   3  11/17   64.7   4/5    80.0   4/10    1   0
Blake Russell          41   21   18    6   0  10/14   71.4   1/2    50.0   0/0     1   0
Shaquille Irving        8    5    0    0   0   2/4    50.0   1/2    50.0   0/0     0   0
Bradley Quickley        8    0    0    0   0   0/5     0.0   0/2     0.0   0/0     1   0
Vince James             8    0    1    1   0   0/0     0.0   0/0     0.0   0/0     0   0
Tobias Nowitzki         8    0    4    0   0   0/0     0.0   0/0     0.0   0/0     0   0
Devin Jackson           8    2    1    0   0   1/4    25.0   0/1     0.0   0/0     0   0

TEAM: FG: 47/86 (54.7%), 3PT: 13/26 (50.0%), REB: 46 (8 off, 38 def), AST: 22, TO: 8


Team_036
--------------------------------------------------------------------------------
Player                MIN  PTS  REB  AST  TO      FG   FG%      3P   3P%      FT STL BLK
--------------------------------------------------------------------------------
Michael Westbrook      41   18    0    0   3  10/16   62.5   1/5    20.0   5/5     2   2
Giannis Booker         41   11   12    1   1   4/16   25.0   2/10   20.0   1/2     1   2
Anthony Poole          41    5    0    3   5   3/12   25.0   0/5     0.0   5/6     0   0
Terry Durant           41   24   11    3   1   9/15   60.0   1/4    25.0   6/7     1   0
Kobe Simmons           41   13   14    4   0   5/8    62.5   0/1     0.0   1/1     2   1
Dirk Anunoby            8    3    0    3   0   1/2    50.0   1/1   100.0   0/0     0   0
Tobias Fox              8    4    0    0   2   2/3    66.7   0/1     0.0   0/0     0   0
Pascal Antetokounmpo    8    3    0    0   0   3/3   100.0   1/1   100.0   3/5     0   0
Devin Simmons           8    2    6    0   0   1/1   100.0   0/0     0.0   0/0     0   0
Bradley Murray          8    7    5    0   0   2/3    66.7   0/0     0.0   0/0     0   0

TEAM: FG: 40/79 (50.6%), 3PT: 6/28 (21.4%), REB: 47 (9 off, 38 def), AST: 14, TO: 12

================================================================================
