================================================================================
                        FULL GAME - Team_083 vs Team_072                        
================================================================================

================================================================================
                       1ST QUARTER - Team_083 vs Team_072                       
================================================================================

[12:00] Team_083 possession (Score: 0-0)
Yao Oladipo attempts a Layup. Contested by Wendell Anthony (4.5 feet, MAN). Yao Oladipo misses. Rebound secured by Tracy Giddey.

[11:44] Team_072 possession (Score: 0-0)
FOUL! Shooting foul on Kyrie Griffin. Tyrese Williamson to the line for 2 free throws. [Team fouls: 1] (Kyrie Griffin: 1 personal fouls)   FT 1/2: GOOD   FT 2/2: GOOD Tyrese Williamson makes 2/2 from the line.
Score: 0-2

[11:31] Team_083 possession (Score: 0-2)
FOUL! Reach-in foul on Tyrese Williamson during the drive. [Team fouls: 1] No free throws, side out. (Tyrese Williamson: 1 personal fouls)

[11:20] Team_083 possession (Score: 0-2)
Yao Oladipo attempts a Midrange. Contested by Wendell Anthony (4.5 feet, ZONE). YAO OLADIPO MAKES IT! Assist: Bradley Thompson
Score: 2-2

[11:07] Team_072 possession (Score: 2-2)
Collin Griffin drives and kicks out. Cade Poole attempts a 3Pt. Contested by Karl Jokic (4.6 feet, MAN). CADE POOLE MAKES IT! Assist: Tyrese Williamson
Score: 2-5

[10:49] Team_083 possession (Score: 2-5)
Kyrie Griffin attempts a Layup. Contested by Tracy Giddey (4.6 feet, MAN). KYRIE GRIFFIN MAKES IT!
Score: 4-5

[10:33] Team_072 possession (Score: 4-5)
Tracy Giddey loses the ball! Stripped by Kyrie Griffin! TURNOVER! (live ball)

[10:19] Team_083 possession (Score: 4-5)
Malcolm Brogdon attempts a 3Pt. Contested by Cade Poole (3.8 feet, ZONE). Malcolm Brogdon misses. Rebound secured by Tracy Giddey.

[10:07] Team_072 possession (Score: 4-5)
Tyrese Williamson attempts a 3Pt. Contested by Bradley Thompson (4.0 feet, MAN). Tyrese Williamson misses. Rebound secured by Yao Oladipo.

[09:50] Team_083 possession (Score: 4-5)
Malcolm Brogdon attempts a Midrange. BLOCKED BY COLLIN GRIFFIN! Ball deflects out of bounds off Malcolm Brogdon.

[09:35] Team_072 possession (Score: 4-5)
Tyrese Williamson drives and kicks out. Cade Poole attempts a 3Pt. Contested by Karl Jokic (4.6 feet, MAN). Cade Poole misses. Rebound secured by Bradley Thompson.

[09:21] Team_083 possession (Score: 4-5)
Kyrie Griffin attempts a 3Pt. Contested by Tracy Giddey (4.6 feet, MAN). KYRIE GRIFFIN MAKES IT! Assist: Bradley Thompson
Score: 7-5

[09:04] Team_072 possession (Score: 7-5)
Tracy Giddey attempts a 3Pt. Contested by Kyrie Griffin (4.0 feet, MAN). TRACY GIDDEY MAKES IT! Assist: Wendell Anthony
Score: 7-8

[08:51] Team_083 possession (Score: 7-8)
Kyrie Griffin drives, Tracy Giddey stays with him. Kyrie Griffin attempts a Dunk. Contested by Tracy Giddey (4.6 feet, MAN). KYRIE GRIFFIN MAKES IT! Assist: Bradley Thompson
Score: 9-8

[08:35] Team_072 possession (Score: 9-8)
Tyrese Williamson attempts a 3Pt. Contested by Malcolm Brogdon (5.1 feet, ZONE). Tyrese Williamson misses. Rebound secured by Kyrie Griffin.

[08:17] Team_083 possession (Score: 9-8)
Malcolm Brogdon attempts a 3Pt. Contested by Cade Poole (3.8 feet, ZONE). Malcolm Brogdon misses. Rebound secured by Tyrese Williamson.

[08:03] Team_072 possession (Score: 9-8)
Collin Griffin attempts a Layup. BLOCKED BY MALCOLM BROGDON! Ball deflects out of bounds off Collin Griffin.

[07:49] Team_083 possession (Score: 9-8)
Karl Jokic loses control! Ball rolls out of bounds! TURNOVER! (dead ball)

[07:37] Team_072 possession (Score: 9-8)
Cade Poole attempts a 3Pt. Contested by Karl Jokic (5.2 feet, MAN). Cade Poole misses. Rebound secured by Kyrie Griffin.

[07:25] Team_083 possession (Score: 9-8)
Karl Jokic attempts a Midrange. Contested by Cade Poole (4.7 feet, MAN). Karl Jokic misses. Offensive rebound by Kyrie Griffin! Kyrie Griffin kicks it out.

[07:06] Team_083 possession (Score: 9-8)
Yao Oladipo makes the Layup and draws the foul on Collin Griffin! And-1! Yao Oladipo to the line for 1. [Team fouls: 2] (Collin Griffin: 1 personal fouls)   FT 1/1: MISS Yao Oladipo makes 0/1 from the line. Rebound secured by Tyrese Williamson.
Score: 11-8

[06:53] Team_072 possession (Score: 11-8)
Tracy Giddey attempts a 3Pt. Contested by Yao Oladipo (4.0 feet, ZONE). Tracy Giddey misses. Rebound secured by Kyrie Griffin.

[06:40] Team_083 possession (Score: 11-8)
Malcolm Brogdon makes the Dunk and draws the foul on Wendell Anthony! And-1! Malcolm Brogdon to the line for 1. [Team fouls: 3] (Wendell Anthony: 1 personal fouls)   FT 1/1: GOOD Malcolm Brogdon makes 1/1 from the line.
Score: 14-8

[06:29] Team_072 possession (Score: 14-8)
Collin Griffin drives, picks up Malcolm Brogdon. Help arrives from Yao Oladipo! Collin Griffin attempts a Dunk. Contested by Yao Oladipo (5.2 feet, MAN). COLLIN GRIFFIN MAKES IT!
Score: 14-10

[06:14] Team_083 possession (Score: 14-10)
FOUL! Shooting foul on Wendell Anthony. Yao Oladipo to the line for 2 free throws. [Team fouls: 4] (Wendell Anthony: 2 personal fouls)   FT 1/2: GOOD   FT 2/2: GOOD Yao Oladipo makes 2/2 from the line.
Score: 16-10

[05:57] Team_072 possession (Score: 16-10)
Collin Griffin attempts a Layup. Contested by Kyrie Griffin (3.7 feet, ZONE). Collin Griffin misses. Rebound secured by Kyrie Griffin.

[05:40] Team_083 possession (Score: 16-10)
Malcolm Brogdon attempts a 3Pt. Contested by Cade Poole (3.8 feet, ZONE). Malcolm Brogdon misses. Offensive rebound by Bradley Thompson! Bradley Thompson puts it back in!
Score: 18-10

[05:22] Team_072 possession (Score: 18-10)
Tracy Giddey makes the Layup and draws the foul on Kyrie Griffin! And-1! Tracy Giddey to the line for 1. [Team fouls: 2] (Kyrie Griffin: 2 personal fouls)   FT 1/1: GOOD Tracy Giddey makes 1/1 from the line.
Score: 18-13

[05:10] Team_083 possession (Score: 18-13)
Bradley Thompson attempts a Layup. Contested by Tyrese Williamson (4.4 feet, MAN). BRADLEY THOMPSON MAKES IT! Assist: Kyrie Griffin
Score: 20-13

[04:52] Team_072 possession (Score: 20-13)
Wendell Anthony loses control! Ball rolls out of bounds! TURNOVER! (dead ball)

[04:36] Team_083 possession (Score: 20-13)
Kyrie Griffin drives to the basket... FOUL! Offensive foul on Kyrie Griffin! Tracy Giddey drew the charge! [Team fouls: 3] (Kyrie Griffin: 3 personal fouls) TURNOVER! (dead ball)

[04:25] Team_072 possession (Score: 20-13)
Cade Poole drives and kicks out. Cade Poole attempts a Midrange. Contested by Karl Jokic (4.6 feet, ZONE). Cade Poole misses. FOUL! Loose ball foul on Bradley Thompson during the rebound battle. [Team fouls: 4] No free throws, side out. (Bradley Thompson: 1 personal fouls)

[04:16] Team_072 possession (Score: 20-13)
Tyrese Williamson makes the Dunk and draws the foul on Bradley Thompson! And-1! Tyrese Williamson to the line for 1. [BONUS: 5 team fouls] (Bradley Thompson: 2 personal fouls)   FT 1/1: GOOD Tyrese Williamson makes 1/1 from the line.
Score: 20-16

[04:01] Team_083 possession (Score: 20-16)
Yao Oladipo attempts a Layup. Contested by Tyrese Williamson (4.7 feet, ZONE). Yao Oladipo misses. Rebound secured by Wendell Anthony.

[03:47] Team_072 possession (Score: 20-16)
Tracy Giddey attempts a 3Pt. Contested by Kyrie Griffin (4.1 feet, MAN). Tracy Giddey misses. Rebound secured by Bradley Thompson.

[03:34] Team_083 possession (Score: 20-16)
FOUL! Shooting foul on Cade Poole. Malcolm Brogdon to the line for 3 free throws. [BONUS: 5 team fouls] (Cade Poole: 1 personal fouls)   FT 1/3: MISS   FT 2/3: GOOD   FT 3/3: GOOD Malcolm Brogdon makes 2/3 from the line.
Score: 22-16

[03:17] Team_072 possession (Score: 22-16)
Cade Poole makes the Layup and draws the foul on Kyrie Griffin! And-1! Cade Poole to the line for 1. [BONUS: 6 team fouls] (Kyrie Griffin: 4 personal fouls)   FT 1/1: GOOD Cade Poole makes 1/1 from the line.
Score: 22-19

[02:59] Team_083 possession (Score: 22-19)
Bradley Thompson drives and kicks out. Kyrie Griffin attempts a 3Pt. Contested by Tracy Giddey (4.4 feet, MAN). KYRIE GRIFFIN MAKES IT! Assist: Yao Oladipo
Score: 25-19

[02:44] Team_072 possession (Score: 25-19)
Cade Poole attempts a Layup. Contested by Karl Jokic (5.4 feet, MAN). Cade Poole misses. Rebound secured by Bradley Thompson.

[02:32] Team_083 possession (Score: 25-19)
Malcolm Brogdon attempts a 3Pt. Contested by Collin Griffin (4.2 feet, MAN). Malcolm Brogdon misses. Rebound secured by Tracy Giddey.

[02:16] Team_072 possession (Score: 25-19)
Cade Poole attempts a Midrange. Contested by Karl Jokic (5.4 feet, MAN). Cade Poole misses. Offensive rebound by Tyrese Williamson! Tyrese Williamson kicks it out.

[02:06] Team_072 possession (Score: 25-19)
Cade Poole attempts a 3Pt. Contested by Karl Jokic (5.4 feet, MAN). Cade Poole misses. Rebound secured by Bradley Thompson.

[01:50] Team_083 possession (Score: 25-19)
Yao Oladipo attempts a 3Pt. Contested by Wendell Anthony (4.8 feet, MAN). YAO OLADIPO MAKES IT! Assist: Malcolm Brogdon
Score: 28-19

[01:34] Team_072 possession (Score: 28-19)
Tyrese Williamson drives and kicks out. FOUL! Shooting foul on Bradley Thompson. Tyrese Williamson to the line for 2 free throws. [BONUS: 7 team fouls] (Bradley Thompson: 3 personal fouls)   FT 1/2: GOOD   FT 2/2: GOOD Tyrese Williamson makes 2/2 from the line.
Score: 28-21

[01:18] Team_083 possession (Score: 28-21)
Kyrie Griffin attempts a Midrange. Contested by Tracy Giddey (4.9 feet, MAN). Kyrie Griffin misses. Rebound secured by Tracy Giddey.

[01:05] Team_072 possession (Score: 28-21)
FOUL! Reach-in foul on Kyrie Griffin during the drive. [IN THE BONUS! 8 team fouls] Wendell Anthony to the line for 2 free throws. (Kyrie Griffin: 5 personal fouls)   FT 1/2: MISS   FT 2/2: GOOD Wendell Anthony makes 1/2 from the line.
Score: 28-22

[00:53] Team_083 possession (Score: 28-22)
Kyrie Griffin attempts a Midrange. Contested by Tracy Giddey (4.9 feet, ZONE). Kyrie Griffin misses. Rebound secured by Wendell Anthony.

[00:38] Team_072 possession (Score: 28-22)
Wendell Anthony attempts a Layup. Contested by Yao Oladipo (3.9 feet, MAN). Wendell Anthony misses. Offensive rebound by Tyrese Williamson! Tyrese Williamson kicks it out.

[00:28] Team_072 possession (Score: 28-22)
Cade Poole drives, Karl Jokic stays with him. Cade Poole attempts a Layup. Contested by Karl Jokic (5.5 feet, MAN). Cade Poole misses. Rebound secured by Bradley Thompson.

[00:11] Team_083 possession (Score: 28-22)
FOUL! Shooting foul on Tracy Giddey. Kyrie Griffin to the line for 2 free throws. [BONUS: 6 team fouls] (Tracy Giddey: 1 personal fouls)   FT 1/2: GOOD   FT 2/2: GOOD Kyrie Griffin makes 2/2 from the line.
Score: 30-22

================================================================================
                              1ST QUARTER COMPLETE                              
================================================================================

1ST QUARTER SCORE: Team_083 30, Team_072 22

BOX SCORE:
================================================================================

Team_083
--------------------------------------------------------------------------------
Player                MIN  PTS  REB  AST  TO      FG   FG%      3P   3P%
--------------------------------------------------------------------------------
Kyrie Griffin          12   12    5    1   0   5/7    71.4     0/0   0.0
Yao Oladipo            12    7    1    1   0   3/6    50.0     0/0   0.0
Malcolm Brogdon        12    5    0    1   0   2/6    33.3     0/0   0.0
Bradley Thompson       12    4    6    3   0   2/2   100.0     0/0   0.0

TEAM: FG: 12/21 (57.1%), 3PT: 4/7 (57.1%), REB: 12 (2 off, 10 def), AST: 6, TO: 2
TEAM FOULS: 8 [Team_072 in BONUS]


Team_072
--------------------------------------------------------------------------------
Player                MIN  PTS  REB  AST  TO      FG   FG%      3P   3P%
--------------------------------------------------------------------------------
Tyrese Williamson      12    7    4    1   0   3/6    50.0     0/0   0.0
Tracy Giddey           12    6    5    0   0   2/4    50.0     0/0   0.0
Cade Poole             12    6    0    0   0   2/6    33.3     0/0   0.0
Collin Griffin         12    2    0    0   0   1/3    33.3     0/0   0.0
Wendell Anthony        12    1    2    1   0   1/1   100.0     0/0   0.0

TEAM: FG: 9/20 (45.0%), 3PT: 1/7 (14.3%), REB: 11 (3 off, 8 def), AST: 2, TO: 2
TEAM FOULS: 6 [Team_083 in BONUS]

================================================================================

================================================================================
                       2ND QUARTER - Team_083 vs Team_072                       
================================================================================

[12:00] Team_083 possession (Score: 30-22)
Malcolm Brogdon attempts a 3Pt. Contested by Collin Griffin (4.3 feet, MAN). Malcolm Brogdon misses. Rebound secured by Tyrese Williamson.

[11:44] Team_072 possession (Score: 30-22)
Tyrese Williamson makes the Midrange and draws the foul on Karl Jokic! And-1! Tyrese Williamson to the line for 1. [Team fouls: 1] (Karl Jokic: 1 personal fouls)   FT 1/1: GOOD Tyrese Williamson makes 1/1 from the line.
Score: 30-25

[11:26] Team_083 possession (Score: 30-25)
Yao Oladipo attempts a 3Pt. Contested by Wendell Anthony (4.9 feet, MAN). Yao Oladipo misses. Rebound secured by Wendell Anthony.

[11:12] Team_072 possession (Score: 30-25)
FOUL! Reach-in foul on Kyrie Griffin during the drive. [Team fouls: 2] No free throws, side out. (Kyrie Griffin: 1 personal fouls)

[10:56] Team_072 possession (Score: 30-25)
Collin Griffin attempts a Layup. BLOCKED BY KYRIE GRIFFIN! Ball is loose! Rebound secured by Yao Oladipo.

[10:38] Team_083 possession (Score: 30-25)
Yao Oladipo drives and kicks out. Bradley Thompson attempts a Midrange. Contested by Tyrese Williamson (4.7 feet, MAN). BRADLEY THOMPSON MAKES IT!
Score: 32-25

[10:28] Team_072 possession (Score: 32-25)
Tracy Giddey attempts a Layup. BLOCKED BY KYRIE GRIFFIN! Ball is loose! Offensive rebound by Tyrese Williamson! Tyrese Williamson kicks it out.

[10:17] Team_072 possession (Score: 32-25)
Collin Griffin attempts a 3Pt. Contested by Malcolm Brogdon (5.6 feet, MAN). Collin Griffin misses. Rebound secured by Kyrie Griffin.

[10:00] Team_083 possession (Score: 32-25)
Yao Oladipo drives to the basket... Yao Oladipo throws a bad pass! Stolen by Wendell Anthony! TURNOVER! (live ball)

[09:46] Team_072 possession (Score: 32-25)
Wendell Anthony attempts a 3Pt. Contested by Yao Oladipo (4.0 feet, MAN). Wendell Anthony misses. Rebound secured by Bradley Thompson.

[09:32] Team_083 possession (Score: 32-25)
FOUL! Reach-in foul on Tracy Giddey during the drive. [Team fouls: 1] No free throws, side out. (Tracy Giddey: 1 personal fouls)

[09:18] Team_083 possession (Score: 32-25)
Malcolm Brogdon drives, Collin Griffin stays with him. Malcolm Brogdon attempts a Dunk. Contested by Collin Griffin (4.6 feet, MAN). Malcolm Brogdon misses. Rebound secured by Wendell Anthony.

[09:03] Team_072 possession (Score: 32-25)
Collin Griffin makes the Layup and draws the foul on Kyrie Griffin! And-1! Collin Griffin to the line for 1. [Team fouls: 3] (Kyrie Griffin: 2 personal fouls)   FT 1/1: GOOD Collin Griffin makes 1/1 from the line.
Score: 32-28

[08:52] Team_083 possession (Score: 32-28)
Yao Oladipo drives to the basket... Yao Oladipo loses control! Ball rolls out of bounds! TURNOVER! (dead ball)

[08:52] Substitution (Team_083): Malcolm Brogdon OUT → Zion Markkanen IN (stamina_rule2)

[08:52] Substitution (Team_083): Karl Jokic OUT → Damian Towns IN (stamina_rule2)

[08:52] Substitution (Team_083): Yao Oladipo OUT → Domantas Doncic IN (stamina_rule2)

[08:52] Substitution (Team_083): Kyrie Griffin OUT → Cole Simmons IN (stamina_rule2)

[08:52] Substitution (Team_083): Bradley Thompson OUT → Victor McCollum IN (stamina_rule2)

[08:52] Substitution (Team_072): Collin Griffin OUT → Giannis Gobert IN (stamina_rule2)

[08:52] Substitution (Team_072): Cade Poole OUT → CJ Jokic IN (stamina_rule2)

[08:52] Substitution (Team_072): Wendell Anthony OUT → CJ Bane IN (stamina_rule2)

[08:52] Substitution (Team_072): Tracy Giddey OUT → Brandon Durant IN (stamina_rule2)

[08:52] Substitution (Team_072): Tyrese Williamson OUT → Stephen Holiday IN (stamina_rule2)

[08:34] Team_072 possession (Score: 32-28)
Brandon Durant attempts a Midrange. Contested by Cole Simmons (4.6 feet, MAN). BRANDON DURANT MAKES IT! Assist: Stephen Holiday
Score: 32-30

[08:20] Team_083 possession (Score: 32-30)
FOUL! Holding foul on Stephen Holiday. [Team fouls: 2] No free throws, side out. (Stephen Holiday: 1 personal fouls)

[08:08] Team_083 possession (Score: 32-30)
FOUL! Shooting foul on Stephen Holiday. Victor McCollum to the line for 2 free throws. [Team fouls: 3] (Stephen Holiday: 2 personal fouls)   FT 1/2: GOOD   FT 2/2: MISS Victor McCollum makes 1/2 from the line. Rebound secured by CJ Jokic.
Score: 33-30

[07:54] Team_072 possession (Score: 33-30)
CJ Bane drives, Domantas Doncic stays with him. CJ Bane attempts a Dunk. Contested by Domantas Doncic (4.2 feet, MAN). CJ Bane misses. Rebound secured by Damian Towns.

[07:43] Team_083 possession (Score: 33-30)
Damian Towns drives and kicks out. Domantas Doncic attempts a 3Pt. Contested by CJ Bane (4.5 feet, MAN). Domantas Doncic misses. Rebound secured by CJ Jokic.

[07:27] Team_072 possession (Score: 33-30)
Giannis Gobert drives to the basket... Giannis Gobert throws a bad pass out of bounds! TURNOVER! (dead ball)

[07:12] Team_083 possession (Score: 33-30)
Victor McCollum attempts a Midrange. Contested by Brandon Durant (4.4 feet, ZONE). VICTOR MCCOLLUM MAKES IT! Assist: Zion Markkanen
Score: 35-30

[06:56] Team_072 possession (Score: 35-30)
Brandon Durant attempts a 3Pt. Contested by Zion Markkanen (5.2 feet, ZONE). Brandon Durant misses. Rebound secured by Victor McCollum.

[06:42] Team_083 possession (Score: 35-30)
Zion Markkanen loses control! Ball rolls out of bounds! TURNOVER! (dead ball)

[06:27] Team_072 possession (Score: 35-30)
Brandon Durant drives to the basket... FOUL! Offensive foul on Brandon Durant! Victor McCollum drew the charge! [Team fouls: 4] (Brandon Durant: 1 personal fouls) TURNOVER! (dead ball)

[06:12] Team_083 possession (Score: 35-30)
Domantas Doncic attempts a Midrange. Contested by CJ Bane (4.6 feet, MAN). Domantas Doncic misses. Rebound secured by CJ Jokic.

[06:01] Team_072 possession (Score: 35-30)
Brandon Durant attempts a Layup. Contested by Cole Simmons (4.6 feet, MAN). BRANDON DURANT MAKES IT! Assist: CJ Jokic
Score: 35-32

[05:47] Team_083 possession (Score: 35-32)
Damian Towns attempts a 3Pt. Contested by CJ Jokic (5.8 feet, MAN). DAMIAN TOWNS MAKES IT! Assist: Victor McCollum
Score: 38-32

[05:33] Team_072 possession (Score: 38-32)
CJ Jokic drives and kicks out. CJ Bane attempts a 3Pt. Contested by Domantas Doncic (4.5 feet, MAN). CJ BANE MAKES IT! Assist: CJ Jokic
Score: 38-35

[05:19] Team_083 possession (Score: 38-35)
Cole Simmons attempts a 3Pt. Contested by Brandon Durant (3.8 feet, MAN). Cole Simmons misses. Rebound secured by Stephen Holiday.

[05:00] Team_072 possession (Score: 38-35)
FOUL! Reach-in foul on Cole Simmons during the drive. [Team fouls: 4] No free throws, side out. (Cole Simmons: 1 personal fouls)

[04:47] Team_072 possession (Score: 38-35)
CJ Bane attempts a 3Pt. Contested by Domantas Doncic (4.2 feet, MAN). CJ Bane misses. Offensive rebound by Stephen Holiday! Stephen Holiday kicks it out.

[04:28] Team_072 possession (Score: 38-35)
Brandon Durant drives to the basket... FOUL! Offensive foul on Brandon Durant! Cole Simmons drew the charge! [Team fouls: 5] (Brandon Durant: 2 personal fouls) TURNOVER! (dead ball)

[04:14] Team_083 possession (Score: 38-35)
Zion Markkanen attempts a Midrange. Contested by Giannis Gobert (5.1 feet, MAN). ZION MARKKANEN MAKES IT! Assist: Victor McCollum
Score: 40-35

[04:04] Team_072 possession (Score: 40-35)
CJ Jokic attempts a 3Pt. Contested by Zion Markkanen (5.2 feet, ZONE). CJ Jokic misses. Offensive rebound by Brandon Durant! Brandon Durant kicks it out.

[03:49] Team_072 possession (Score: 40-35)
Brandon Durant attempts a Midrange. Contested by Cole Simmons (4.6 feet, MAN). Brandon Durant misses. Rebound secured by Victor McCollum.

[03:38] Team_083 possession (Score: 40-35)
Domantas Doncic attempts a 3Pt. Contested by Giannis Gobert (5.1 feet, ZONE). DOMANTAS DONCIC MAKES IT! Assist: Cole Simmons
Score: 43-35

[03:24] Team_072 possession (Score: 43-35)
FOUL! Shooting foul on Zion Markkanen. Giannis Gobert to the line for 3 free throws. [BONUS: 5 team fouls] (Zion Markkanen: 1 personal fouls)   FT 1/3: GOOD   FT 2/3: GOOD   FT 3/3: GOOD Giannis Gobert makes 3/3 from the line.
Score: 43-38

[03:13] Team_083 possession (Score: 43-38)
Cole Simmons attempts a Layup. Contested by Brandon Durant (3.8 feet, MAN). Cole Simmons misses. Rebound secured by Stephen Holiday.

[02:58] Team_072 possession (Score: 43-38)
Brandon Durant attempts a 3Pt. Contested by Cole Simmons (4.6 feet, MAN). BRANDON DURANT MAKES IT! Assist: CJ Jokic
Score: 43-41

[02:41] Team_083 possession (Score: 43-41)
Cole Simmons attempts a 3Pt. Contested by Giannis Gobert (4.9 feet, ZONE). Cole Simmons misses. Offensive rebound by Victor McCollum! Victor McCollum's putback is no good. Rebound secured by CJ Jokic.

[02:25] Team_072 possession (Score: 43-41)
Stephen Holiday attempts a Midrange. Contested by Victor McCollum (4.5 feet, ZONE). Stephen Holiday misses. Offensive rebound by Stephen Holiday! Stephen Holiday kicks it out.

[02:08] Team_072 possession (Score: 43-41)
Giannis Gobert drives, picks up Victor McCollum. Help arrives from Damian Towns! Giannis Gobert attempts a Dunk. Contested by Damian Towns (4.3 feet, ZONE). GIANNIS GOBERT MAKES IT!
Score: 43-43

[01:53] Team_083 possession (Score: 43-43)
Damian Towns drives and kicks out. Zion Markkanen attempts a 3Pt. Contested by Giannis Gobert (4.9 feet, MAN). Zion Markkanen misses. Rebound secured by Brandon Durant.

[01:36] Team_072 possession (Score: 43-43)
Brandon Durant loses the ball! Stripped by Cole Simmons! TURNOVER! (live ball)

[01:24] Team_083 possession (Score: 43-43)
FOUL! Offensive foul on Damian Towns! CJ Jokic drew the charge! [Team fouls: 6] (Damian Towns: 1 personal fouls) TURNOVER! (dead ball)

[01:11] Team_072 possession (Score: 43-43)
Giannis Gobert attempts a 3Pt. Contested by Zion Markkanen (5.7 feet, ZONE). Giannis Gobert misses. Rebound secured by Cole Simmons.

[00:52] Team_083 possession (Score: 43-43)
Cole Simmons attempts a Layup. Contested by Brandon Durant (3.9 feet, MAN). Cole Simmons misses. Offensive rebound by Victor McCollum! Victor McCollum's putback is no good. Offensive rebound by Damian Towns! Damian Towns kicks it out.

[00:39] Team_083 possession (Score: 43-43)
Damian Towns attempts a Layup. Contested by Stephen Holiday (5.6 feet, ZONE). Damian Towns misses. Rebound secured by Brandon Durant.

[00:29] Team_072 possession (Score: 43-43)
CJ Bane makes the Layup and draws the foul on Victor McCollum! And-1! CJ Bane to the line for 1. [BONUS: 7 team fouls] (Victor McCollum: 1 personal fouls)   FT 1/1: GOOD CJ Bane makes 1/1 from the line.
Score: 43-46

[00:13] Team_083 possession (Score: 43-46)
Victor McCollum attempts a Midrange. Contested by Brandon Durant (4.6 feet, ZONE). Victor McCollum misses. Rebound secured by Stephen Holiday.

================================================================================
                              2ND QUARTER COMPLETE                              
================================================================================

2ND QUARTER SCORE: Team_083 13, Team_072 24

BOX SCORE:
================================================================================

Team_083
--------------------------------------------------------------------------------
Player                MIN  PTS  REB  AST  TO      FG   FG%      3P   3P%
--------------------------------------------------------------------------------
Damian Towns            9    3    2    0   0   1/4    25.0     0/0   0.0
Domantas Doncic         9    3    0    0   0   1/2    50.0     0/0   0.0
Bradley Thompson       15    2    1    0   0   1/1   100.0     0/0   0.0
Victor McCollum         9    2    2    2   0   1/3    33.3     0/0   0.0
Zion Markkanen          9    2    0    1   0   1/1   100.0     0/0   0.0
Malcolm Brogdon        15    0    0    0   0   0/2     0.0     0/0   0.0
Yao Oladipo            15    0    1    0   0   0/1     0.0     0/0   0.0
Kyrie Griffin          15    0    1    0   0   0/0     0.0     0/0   0.0
CJ Jokic                9    0    4    3   0   0/0     0.0     0/0   0.0
Cole Simmons            9    0    1    1   0   0/3     0.0     0/0   0.0

TEAM: FG: 5/17 (29.4%), 3PT: 2/6 (33.3%), REB: 9 (2 off, 7 def), AST: 4, TO: 4
TEAM FOULS: 7 [Team_072 in BONUS]


Team_072
--------------------------------------------------------------------------------
Player                MIN  PTS  REB  AST  TO      FG   FG%      3P   3P%
--------------------------------------------------------------------------------
Brandon Durant          9    7    3    0   0   3/5    60.0     0/0   0.0
CJ Bane                 9    6    0    0   0   2/3    66.7     0/0   0.0
Giannis Gobert          9    5    0    0   0   2/3    66.7     0/0   0.0
Tyrese Williamson      15    3    2    0   0   1/1   100.0     0/0   0.0
Collin Griffin         15    3    0    0   0   1/3    33.3     0/0   0.0
Wendell Anthony        15    0    2    0   0   0/1     0.0     0/0   0.0
Stephen Holiday         9    0    5    1   0   0/0     0.0     0/0   0.0

TEAM: FG: 9/16 (56.2%), 3PT: 2/6 (33.3%), REB: 15 (4 off, 11 def), AST: 4, TO: 4
TEAM FOULS: 5 [Team_083 in BONUS]

================================================================================

================================================================================
                       3RD QUARTER - Team_083 vs Team_072                       
================================================================================

[12:00] Team_083 possession (Score: 43-46)
Malcolm Brogdon attempts a 3Pt. Contested by Collin Griffin (4.0 feet, MAN). Malcolm Brogdon misses. Rebound secured by Wendell Anthony.

[11:45] Team_072 possession (Score: 43-46)
Tyrese Williamson attempts a Midrange. Contested by Bradley Thompson (4.0 feet, MAN). TYRESE WILLIAMSON MAKES IT! Assist: Collin Griffin
Score: 43-48

[11:33] Team_083 possession (Score: 43-48)
Malcolm Brogdon drives to the basket... FOUL! Offensive foul on Malcolm Brogdon! Tyrese Williamson drew the charge! [Team fouls: 1] (Malcolm Brogdon: 1 personal fouls) TURNOVER! (dead ball)

[11:16] Team_072 possession (Score: 43-48)
Collin Griffin attempts a 3Pt. Contested by Malcolm Brogdon (5.2 feet, MAN). COLLIN GRIFFIN MAKES IT!
Score: 43-51

[10:57] Team_083 possession (Score: 43-51)
FOUL! Holding foul on Collin Griffin. [Team fouls: 1] No free throws, side out. (Collin Griffin: 1 personal fouls)

[10:44] Team_083 possession (Score: 43-51)
Kyrie Griffin makes the Layup and draws the foul on Tracy Giddey! And-1! Kyrie Griffin to the line for 1. [Team fouls: 2] (Tracy Giddey: 1 personal fouls)   FT 1/1: MISS Kyrie Griffin makes 0/1 from the line. FOUL! Loose ball foul on Tracy Giddey during the free throw rebound! [Team fouls: 3] No free throws, side out. (Tracy Giddey: 2 personal fouls)
Score: 45-51

[10:30] Team_083 possession (Score: 45-51)
Yao Oladipo attempts a 3Pt. Contested by Wendell Anthony (4.5 feet, MAN). Yao Oladipo misses. Rebound secured by Tyrese Williamson.

[10:17] Team_072 possession (Score: 45-51)
Collin Griffin attempts a Layup. Contested by Bradley Thompson (4.0 feet, ZONE). COLLIN GRIFFIN MAKES IT! Assist: Tracy Giddey
Score: 45-53

[10:04] Team_083 possession (Score: 45-53)
Malcolm Brogdon attempts a 3Pt. Contested by Cade Poole (3.8 feet, ZONE). MALCOLM BROGDON MAKES IT! Assist: Yao Oladipo
Score: 48-53

[09:46] Team_072 possession (Score: 48-53)
Wendell Anthony attempts a 3Pt. Contested by Yao Oladipo (3.5 feet, ZONE). Wendell Anthony misses. Rebound secured by Yao Oladipo.

[09:31] Team_083 possession (Score: 48-53)
Bradley Thompson drives and kicks out. Yao Oladipo attempts a 3Pt. Contested by Wendell Anthony (4.2 feet, MAN). YAO OLADIPO MAKES IT! Assist: Bradley Thompson
Score: 51-53

[09:14] Team_072 possession (Score: 51-53)
Collin Griffin attempts a 3Pt. Contested by Yao Oladipo (3.7 feet, ZONE). Collin Griffin misses. Rebound secured by Kyrie Griffin.

[09:01] Team_083 possession (Score: 51-53)
Malcolm Brogdon attempts a Layup. BLOCKED BY TYRESE WILLIAMSON! Ball is loose! Rebound secured by Wendell Anthony.

[08:50] Team_072 possession (Score: 51-53)
Cade Poole attempts a 3Pt. Contested by Yao Oladipo (4.0 feet, ZONE). CADE POOLE MAKES IT! Assist: Wendell Anthony
Score: 51-56

[08:34] Team_083 possession (Score: 51-56)
Kyrie Griffin drives, Tracy Giddey stays with him. Kyrie Griffin attempts a Layup. Contested by Tracy Giddey (4.6 feet, MAN). KYRIE GRIFFIN MAKES IT! Assist: Malcolm Brogdon
Score: 53-56

[08:21] Team_072 possession (Score: 53-56)
Tracy Giddey drives, picks up Kyrie Griffin. Help arrives from Karl Jokic! Tracy Giddey attempts a Layup. Contested by Karl Jokic (4.0 feet, MAN). TRACY GIDDEY MAKES IT!
Score: 53-58

[08:08] Team_083 possession (Score: 53-58)
Yao Oladipo attempts a Midrange. Contested by Wendell Anthony (4.5 feet, MAN). Yao Oladipo misses. Rebound secured by Wendell Anthony.

[07:55] Team_072 possession (Score: 53-58)
FOUL! Holding foul on Malcolm Brogdon. [Team fouls: 2] No free throws, side out. (Malcolm Brogdon: 2 personal fouls)

[07:41] Team_072 possession (Score: 53-58)
Collin Griffin attempts a 3Pt. Contested by Malcolm Brogdon (5.2 feet, MAN). Collin Griffin misses. Offensive rebound by Tracy Giddey! Tracy Giddey kicks it out.

[07:29] Team_072 possession (Score: 53-58)
Tyrese Williamson makes the Layup and draws the foul on Kyrie Griffin! And-1! Tyrese Williamson to the line for 1. [Team fouls: 3] (Kyrie Griffin: 1 personal fouls)   FT 1/1: GOOD Tyrese Williamson makes 1/1 from the line.
Score: 53-61

[07:13] Team_083 possession (Score: 53-61)
FOUL! Shooting foul on Tyrese Williamson. Bradley Thompson to the line for 2 free throws. [Team fouls: 4] (Tyrese Williamson: 1 personal fouls)   FT 1/2: GOOD   FT 2/2: GOOD Bradley Thompson makes 2/2 from the line.
Score: 55-61

[06:56] Team_072 possession (Score: 55-61)
Cade Poole drives and kicks out. Tyrese Williamson attempts a 3Pt. Contested by Yao Oladipo (3.4 feet, ZONE). Tyrese Williamson misses. Rebound secured by Yao Oladipo.

[06:40] Team_083 possession (Score: 55-61)
Malcolm Brogdon attempts a 3Pt. Contested by Tracy Giddey (3.9 feet, ZONE). Malcolm Brogdon misses. Offensive rebound by Kyrie Griffin! Kyrie Griffin kicks it out.

[06:24] Team_083 possession (Score: 55-61)
Bradley Thompson makes the Midrange and draws the foul on Cade Poole! And-1! Bradley Thompson to the line for 1. [BONUS: 5 team fouls] (Cade Poole: 1 personal fouls)   FT 1/1: GOOD Bradley Thompson makes 1/1 from the line.
Score: 58-61

[06:13] Team_072 possession (Score: 58-61)
Cade Poole attempts a 3Pt. Contested by Karl Jokic (5.2 feet, MAN). CADE POOLE MAKES IT! Assist: Collin Griffin
Score: 58-64

[06:03] Team_083 possession (Score: 58-64)
FOUL! Reach-in foul on Wendell Anthony during the drive. [IN THE BONUS! 6 team fouls] Yao Oladipo to the line for 2 free throws. (Wendell Anthony: 1 personal fouls)   FT 1/2: GOOD   FT 2/2: GOOD Yao Oladipo makes 2/2 from the line.
Score: 60-64

[05:49] Team_072 possession (Score: 60-64)
FOUL! Reach-in foul on Kyrie Griffin during the drive. [Team fouls: 4] No free throws, side out. (Kyrie Griffin: 2 personal fouls)

[05:34] Team_072 possession (Score: 60-64)
Tyrese Williamson attempts a Layup. Contested by Bradley Thompson (4.0 feet, MAN). Tyrese Williamson misses. Rebound secured by Kyrie Griffin.

[05:22] Team_083 possession (Score: 60-64)
FOUL! Holding foul on Tyrese Williamson. [IN THE BONUS! 7 team fouls] Bradley Thompson to the line for 2 free throws. (Tyrese Williamson: 2 personal fouls)   FT 1/2: GOOD   FT 2/2: GOOD Bradley Thompson makes 2/2 from the line.
Score: 62-64

[05:07] Team_072 possession (Score: 62-64)
Wendell Anthony drives to the basket... Wendell Anthony loses the ball! Stripped by Kyrie Griffin! TURNOVER! (live ball)

[04:50] Team_083 possession (Score: 62-64)
Yao Oladipo attempts a 3Pt. Contested by Cade Poole (4.5 feet, ZONE). YAO OLADIPO MAKES IT! Assist: Kyrie Griffin
Score: 65-64

[04:34] Team_072 possession (Score: 65-64)
Collin Griffin attempts a 3Pt. Contested by Malcolm Brogdon (5.2 feet, MAN). COLLIN GRIFFIN MAKES IT! Assist: Tyrese Williamson
Score: 65-67

[04:15] Team_083 possession (Score: 65-67)
FOUL! Shooting foul on Wendell Anthony. Malcolm Brogdon to the line for 2 free throws. [BONUS: 8 team fouls] (Wendell Anthony: 2 personal fouls)   FT 1/2: GOOD   FT 2/2: GOOD Malcolm Brogdon makes 2/2 from the line.
Score: 67-67

[03:57] Team_072 possession (Score: 67-67)
Cade Poole attempts a 3Pt. Contested by Karl Jokic (5.3 feet, MAN). CADE POOLE MAKES IT! Assist: Tyrese Williamson
Score: 67-70

[03:46] Team_083 possession (Score: 67-70)
Kyrie Griffin attempts a 3Pt. Contested by Tracy Giddey (4.7 feet, MAN). Kyrie Griffin misses. Rebound secured by Wendell Anthony.

[03:30] Team_072 possession (Score: 67-70)
Cade Poole drives and kicks out. Tyrese Williamson attempts a Midrange. Contested by Bradley Thompson (3.9 feet, MAN). Tyrese Williamson misses. Rebound secured by Yao Oladipo.

[03:16] Team_083 possession (Score: 67-70)
Malcolm Brogdon attempts a 3Pt. Contested by Collin Griffin (4.2 feet, MAN). Malcolm Brogdon misses. Rebound secured by Tracy Giddey.

[03:03] Team_072 possession (Score: 67-70)
Tyrese Williamson loses the ball! Stripped by Bradley Thompson! TURNOVER! (live ball)

[02:52] Team_083 possession (Score: 67-70)
Kyrie Griffin drives, picks up Tyrese Williamson. Help arrives from Collin Griffin! Kyrie Griffin attempts a Dunk. Contested by Collin Griffin (4.8 feet, ZONE). Kyrie Griffin misses. Rebound secured by Tyrese Williamson.

[02:41] Team_072 possession (Score: 67-70)
Cade Poole attempts a Midrange. Contested by Karl Jokic (5.4 feet, ZONE). Cade Poole misses. Rebound secured by Yao Oladipo.

[02:24] Team_083 possession (Score: 67-70)
Karl Jokic attempts a Midrange. Contested by Cade Poole (5.0 feet, MAN). Karl Jokic misses. Rebound secured by Tyrese Williamson.

[02:11] Team_072 possession (Score: 67-70)
Tracy Giddey attempts a 3Pt. Contested by Kyrie Griffin (4.3 feet, MAN). Tracy Giddey misses. FOUL! Loose ball foul on Kyrie Griffin during the rebound battle. [IN THE BONUS! 5 team fouls] Tyrese Williamson to the line for 2 free throws. (Kyrie Griffin: 3 personal fouls)   FT 1/2: GOOD   FT 2/2: GOOD Tyrese Williamson makes 2/2 from the line.
Score: 67-72

[02:01] Team_083 possession (Score: 67-72)
FOUL! Shooting foul on Collin Griffin. Malcolm Brogdon to the line for 2 free throws. [BONUS: 9 team fouls] (Collin Griffin: 2 personal fouls)   FT 1/2: GOOD   FT 2/2: GOOD Malcolm Brogdon makes 2/2 from the line.
Score: 69-72

[01:51] Team_072 possession (Score: 69-72)
Tyrese Williamson attempts a Layup. BLOCKED BY BRADLEY THOMPSON! Ball deflects out of bounds off Tyrese Williamson.

[01:36] Team_083 possession (Score: 69-72)
Kyrie Griffin drives to the basket... Kyrie Griffin loses control! Ball rolls out of bounds! TURNOVER! (dead ball)

[01:36] Substitution (Team_083): Malcolm Brogdon OUT → Zion Markkanen IN (stamina_rule2)

[01:36] Substitution (Team_083): Karl Jokic OUT → Damian Towns IN (stamina_rule2)

[01:36] Substitution (Team_083): Yao Oladipo OUT → Domantas Doncic IN (stamina_rule2)

[01:36] Substitution (Team_083): Kyrie Griffin OUT → Cole Simmons IN (stamina_rule2)

[01:36] Substitution (Team_083): Bradley Thompson OUT → Victor McCollum IN (stamina_rule2)

[01:36] Substitution (Team_072): Collin Griffin OUT → Giannis Gobert IN (stamina_rule2)

[01:36] Substitution (Team_072): Cade Poole OUT → CJ Jokic IN (stamina_rule2)

[01:36] Substitution (Team_072): Wendell Anthony OUT → CJ Bane IN (stamina_rule2)

[01:36] Substitution (Team_072): Tracy Giddey OUT → Brandon Durant IN (stamina_rule2)

[01:36] Substitution (Team_072): Tyrese Williamson OUT → Stephen Holiday IN (stamina_rule2)

[01:20] Team_072 possession (Score: 69-72)
CJ Bane attempts a 3Pt. Contested by Domantas Doncic (4.2 feet, MAN). CJ Bane misses. Rebound secured by Cole Simmons.

[01:05] Team_083 possession (Score: 69-72)
FOUL! Holding foul on Giannis Gobert. [IN THE BONUS! 10 team fouls] Zion Markkanen to the line for 2 free throws. (Giannis Gobert: 1 personal fouls)   FT 1/2: GOOD   FT 2/2: GOOD Zion Markkanen makes 2/2 from the line.
Score: 71-72

[00:53] Team_072 possession (Score: 71-72)
Giannis Gobert attempts a 3Pt. Contested by Zion Markkanen (5.7 feet, ZONE). Giannis Gobert misses. Rebound secured by Damian Towns.

[00:37] Team_083 possession (Score: 71-72)
Damian Towns drives and kicks out. Domantas Doncic attempts a Midrange. Contested by CJ Bane (4.5 feet, ZONE). Domantas Doncic misses. Offensive rebound by Damian Towns! Damian Towns kicks it out.

[00:21] Team_083 possession (Score: 71-72)
Damian Towns attempts a 3Pt. Contested by CJ Jokic (5.8 feet, MAN). Damian Towns misses. Offensive rebound by Victor McCollum! Victor McCollum puts it back in!
Score: 73-72

[00:06] Team_072 possession (Score: 73-72)
Giannis Gobert attempts a 3Pt. Contested by Zion Markkanen (5.7 feet, MAN). Giannis Gobert misses. Rebound secured by Victor McCollum.

================================================================================
                              3RD QUARTER COMPLETE                              
================================================================================

3RD QUARTER SCORE: Team_083 30, Team_072 26

BOX SCORE:
================================================================================

Team_083
--------------------------------------------------------------------------------
Player                MIN  PTS  REB  AST  TO      FG   FG%      3P   3P%
--------------------------------------------------------------------------------
Yao Oladipo            26    8    4    1   0   3/5    60.0     0/0   0.0
Malcolm Brogdon        26    7    0    1   0   3/6    50.0     0/0   0.0
Bradley Thompson       26    7    1    1   0   3/3   100.0     0/0   0.0
Kyrie Griffin          26    2    3    1   0   1/3    33.3     0/0   0.0
Zion Markkanen         10    2    0    0   0   1/1   100.0     0/0   0.0
Victor McCollum        10    2    2    0   0   1/1   100.0     0/0   0.0
Karl Jokic             26    0    0    0   0   0/1     0.0     0/0   0.0
Cole Simmons           10    0    1    0   0   0/0     0.0     0/0   0.0
Damian Towns           10    0    2    0   0   0/0     0.0     0/0   0.0

TEAM: FG: 12/20 (60.0%), 3PT: 3/7 (42.9%), REB: 13 (4 off, 9 def), AST: 4, TO: 2
TEAM FOULS: 5 [Team_072 in BONUS]


Team_072
--------------------------------------------------------------------------------
Player                MIN  PTS  REB  AST  TO      FG   FG%      3P   3P%
--------------------------------------------------------------------------------
Cade Poole             26    9    0    0   0   3/6    50.0     0/0   0.0
Collin Griffin         26    8    0    2   0   3/4    75.0     0/0   0.0
Tyrese Williamson      26    7    3    2   0   3/5    60.0     0/0   0.0
Tracy Giddey           26    2    2    1   0   1/1   100.0     0/0   0.0
Wendell Anthony        26    0    4    1   0   0/1     0.0     0/0   0.0
CJ Bane                10    0    0    0   0   0/1     0.0     0/0   0.0
Giannis Gobert         10    0    0    0   0   0/2     0.0     0/0   0.0

TEAM: FG: 10/20 (50.0%), 3PT: 6/11 (54.5%), REB: 9 (1 off, 8 def), AST: 6, TO: 2
TEAM FOULS: 10 [Team_083 in BONUS]

================================================================================

================================================================================
                       4TH QUARTER - Team_083 vs Team_072                       
================================================================================

[12:00] Team_083 possession (Score: 73-72)
Malcolm Brogdon attempts a Midrange. Contested by Tracy Giddey (4.0 feet, ZONE). Malcolm Brogdon misses. Rebound secured by Wendell Anthony.

[11:44] Team_072 possession (Score: 73-72)
FOUL! Offensive foul on Cade Poole! Karl Jokic drew the charge! [Team fouls: 1] (Cade Poole: 1 personal fouls) TURNOVER! (dead ball)

[11:33] Team_083 possession (Score: 73-72)
Kyrie Griffin drives and kicks out. Bradley Thompson makes the Midrange and draws the foul on Tyrese Williamson! And-1! Bradley Thompson to the line for 1. [Team fouls: 2] (Tyrese Williamson: 1 personal fouls)   FT 1/1: GOOD Bradley Thompson makes 1/1 from the line.
Score: 76-72

[11:22] Team_072 possession (Score: 76-72)
Collin Griffin attempts a Midrange. Contested by Karl Jokic (5.0 feet, ZONE). Collin Griffin misses. Rebound secured by Bradley Thompson.

[11:03] Team_083 possession (Score: 76-72)
Malcolm Brogdon attempts a 3Pt. Contested by Cade Poole (4.0 feet, ZONE). Malcolm Brogdon misses. Rebound secured by Tracy Giddey.

[10:44] Team_072 possession (Score: 76-72)
Wendell Anthony attempts a Layup. Contested by Yao Oladipo (3.7 feet, MAN). WENDELL ANTHONY MAKES IT! Assist: Tyrese Williamson
Score: 76-74

[10:30] Team_083 possession (Score: 76-74)
Bradley Thompson attempts a 3Pt. Contested by Cade Poole (4.5 feet, ZONE). Bradley Thompson misses. Rebound secured by Wendell Anthony.

[10:15] Team_072 possession (Score: 76-74)
Tracy Giddey makes the Midrange and draws the foul on Kyrie Griffin! And-1! Tracy Giddey to the line for 1. [Team fouls: 1] (Kyrie Griffin: 1 personal fouls)   FT 1/1: GOOD Tracy Giddey makes 1/1 from the line.
Score: 76-77

[10:00] Team_083 possession (Score: 76-77)
FOUL! Holding foul on Tyrese Williamson. [Team fouls: 3] No free throws, side out. (Tyrese Williamson: 2 personal fouls)

[09:45] Team_083 possession (Score: 76-77)
Karl Jokic attempts a 3Pt. Contested by Cade Poole (5.0 feet, MAN). Karl Jokic misses. Rebound secured by Tyrese Williamson.

[09:33] Team_072 possession (Score: 76-77)
Collin Griffin attempts a 3Pt. Contested by Yao Oladipo (4.0 feet, ZONE). Collin Griffin misses. Rebound secured by Bradley Thompson.

[09:19] Team_083 possession (Score: 76-77)
Kyrie Griffin makes the Dunk and draws the foul on Collin Griffin! And-1! Kyrie Griffin to the line for 1. [Team fouls: 4] (Collin Griffin: 1 personal fouls)   FT 1/1: GOOD Kyrie Griffin makes 1/1 from the line.
Score: 79-77

[09:03] Team_072 possession (Score: 79-77)
Cade Poole attempts a 3Pt. Contested by Karl Jokic (5.5 feet, MAN). CADE POOLE MAKES IT! Assist: Wendell Anthony
Score: 79-80

[08:47] Team_083 possession (Score: 79-80)
Karl Jokic drives and kicks out. FOUL! Shooting foul on Tracy Giddey. Yao Oladipo to the line for 2 free throws. [BONUS: 5 team fouls] (Tracy Giddey: 1 personal fouls)   FT 1/2: GOOD   FT 2/2: GOOD Yao Oladipo makes 2/2 from the line.
Score: 81-80

[08:30] Team_072 possession (Score: 81-80)
Collin Griffin attempts a 3Pt. Contested by Malcolm Brogdon (5.5 feet, MAN). COLLIN GRIFFIN MAKES IT! Assist: Cade Poole
Score: 81-83

[08:15] Team_083 possession (Score: 81-83)
Kyrie Griffin attempts a 3Pt. Contested by Wendell Anthony (5.0 feet, ZONE). Kyrie Griffin misses. Offensive rebound by Bradley Thompson! Bradley Thompson kicks it out.

[08:03] Team_083 possession (Score: 81-83)
Yao Oladipo drives to the basket... Yao Oladipo commits a violation (traveling/carry)! TURNOVER! (dead ball)

[08:03] Substitution (Team_083): Malcolm Brogdon OUT → Zion Markkanen IN (stamina_rule2)

[08:03] Substitution (Team_083): Karl Jokic OUT → Damian Towns IN (stamina_rule2)

[08:03] Substitution (Team_083): Yao Oladipo OUT → Domantas Doncic IN (stamina_rule2)

[08:03] Substitution (Team_083): Kyrie Griffin OUT → Cole Simmons IN (stamina_rule2)

[08:03] Substitution (Team_083): Bradley Thompson OUT → Victor McCollum IN (stamina_rule2)

[08:03] Substitution (Team_072): Collin Griffin OUT → Giannis Gobert IN (stamina_rule2)

[08:03] Substitution (Team_072): Cade Poole OUT → CJ Jokic IN (stamina_rule2)

[08:03] Substitution (Team_072): Wendell Anthony OUT → CJ Bane IN (stamina_rule2)

[08:03] Substitution (Team_072): Tracy Giddey OUT → Brandon Durant IN (stamina_rule2)

[08:03] Substitution (Team_072): Tyrese Williamson OUT → Stephen Holiday IN (stamina_rule2)

[07:50] Team_072 possession (Score: 81-83)
CJ Jokic attempts a Layup. Contested by Victor McCollum (3.9 feet, ZONE). CJ JOKIC MAKES IT! Assist: Stephen Holiday
Score: 81-85

[07:32] Team_083 possession (Score: 81-85)
FOUL! Holding foul on Stephen Holiday. [IN THE BONUS! 6 team fouls] Victor McCollum to the line for 2 free throws. (Stephen Holiday: 1 personal fouls)   FT 1/2: GOOD   FT 2/2: GOOD Victor McCollum makes 2/2 from the line.
Score: 83-85

[07:18] Team_072 possession (Score: 83-85)
CJ Bane drives, picks up Domantas Doncic. Help arrives from Damian Towns! CJ Bane attempts a Layup. Contested by Damian Towns (4.2 feet, MAN). CJ BANE MAKES IT!
Score: 83-87

[07:03] Team_083 possession (Score: 83-87)
Victor McCollum makes the Midrange and draws the foul on Stephen Holiday! And-1! Victor McCollum to the line for 1. [BONUS: 7 team fouls] (Stephen Holiday: 2 personal fouls)   FT 1/1: GOOD Victor McCollum makes 1/1 from the line.
Score: 86-87

[06:51] Team_072 possession (Score: 86-87)
Giannis Gobert attempts a Layup. Contested by Victor McCollum (4.3 feet, ZONE). Giannis Gobert misses. Rebound secured by Victor McCollum.

[06:35] Team_083 possession (Score: 86-87)
Cole Simmons makes the 3Pt and draws the foul on Giannis Gobert! And-1! Cole Simmons to the line for 1. [BONUS: 8 team fouls] (Giannis Gobert: 1 personal fouls)   FT 1/1: GOOD Cole Simmons makes 1/1 from the line.
Score: 90-87

[06:18] Team_072 possession (Score: 90-87)
CJ Jokic attempts a Layup. BLOCKED BY VICTOR MCCOLLUM! Ball is loose! Offensive rebound by Brandon Durant! Brandon Durant kicks it out.

[06:05] Team_072 possession (Score: 90-87)
Brandon Durant attempts a 3Pt. Contested by Zion Markkanen (5.2 feet, ZONE). Brandon Durant misses. Offensive rebound by Stephen Holiday! Stephen Holiday kicks it out.

[05:48] Team_072 possession (Score: 90-87)
CJ Bane drives, Domantas Doncic stays with him. CJ Bane attempts a Layup. Contested by Domantas Doncic (4.2 feet, MAN). CJ BANE MAKES IT! Assist: CJ Jokic
Score: 90-89

[05:35] Team_083 possession (Score: 90-89)
FOUL! Shooting foul on Stephen Holiday. Damian Towns to the line for 2 free throws. [BONUS: 9 team fouls] (Stephen Holiday: 3 personal fouls)   FT 1/2: GOOD   FT 2/2: GOOD Damian Towns makes 2/2 from the line.
Score: 92-89

[05:21] Team_072 possession (Score: 92-89)
CJ Bane makes the Dunk and draws the foul on Damian Towns! And-1! CJ Bane to the line for 1. [Team fouls: 2] (Damian Towns: 1 personal fouls)   FT 1/1: MISS CJ Bane makes 0/1 from the line. Rebound secured by Damian Towns.
Score: 92-91

[05:05] Team_083 possession (Score: 92-91)
Damian Towns attempts a 3Pt. Contested by CJ Jokic (5.8 feet, MAN). DAMIAN TOWNS MAKES IT!
Score: 95-91

[04:50] Team_072 possession (Score: 95-91)
CJ Bane drives to the basket... CJ Bane throws a bad pass! Stolen by Domantas Doncic! TURNOVER! (live ball)

[04:36] Team_083 possession (Score: 95-91)
Cole Simmons attempts a Layup. BLOCKED BY STEPHEN HOLIDAY! Ball is loose! Rebound secured by Brandon Durant.

[04:19] Team_072 possession (Score: 95-91)
Stephen Holiday attempts a Layup. Contested by Victor McCollum (4.5 feet, MAN). Stephen Holiday misses. Rebound secured by Victor McCollum.

[04:08] Team_083 possession (Score: 95-91)
Cole Simmons attempts a Midrange. Contested by Brandon Durant (3.8 feet, MAN). Cole Simmons misses. Offensive rebound by Victor McCollum! Victor McCollum puts it back in!
Score: 97-91

[03:49] Team_072 possession (Score: 97-91)
Brandon Durant attempts a Midrange. Contested by Domantas Doncic (4.3 feet, ZONE). BRANDON DURANT MAKES IT!
Score: 97-93

[03:33] Team_083 possession (Score: 97-93)
FOUL! Shooting foul on Giannis Gobert. Zion Markkanen to the line for 3 free throws. [BONUS: 10 team fouls] (Giannis Gobert: 2 personal fouls)   FT 1/3: GOOD   FT 2/3: GOOD   FT 3/3: GOOD Zion Markkanen makes 3/3 from the line.
Score: 100-93

[03:20] Team_072 possession (Score: 100-93)
CJ Bane attempts a 3Pt. Contested by Domantas Doncic (4.2 feet, MAN). CJ Bane misses. Rebound secured by Cole Simmons.

[03:08] Team_083 possession (Score: 100-93)
Zion Markkanen attempts a 3Pt. Contested by Giannis Gobert (5.1 feet, ZONE). Zion Markkanen misses. Rebound secured by Stephen Holiday.

[02:49] Team_072 possession (Score: 100-93)
Giannis Gobert drives, picks up Zion Markkanen. Help arrives from Damian Towns! Giannis Gobert attempts a Layup. Contested by Damian Towns (5.7 feet, MAN). GIANNIS GOBERT MAKES IT! Assist: Stephen Holiday
Score: 100-95

[02:39] Team_083 possession (Score: 100-95)
Cole Simmons drives, Stephen Holiday stays with him. Cole Simmons attempts a Layup. Contested by Stephen Holiday (5.0 feet, ZONE). COLE SIMMONS MAKES IT! Assist: Damian Towns
Score: 102-95

[02:24] Team_072 possession (Score: 102-95)
Brandon Durant attempts a Midrange. Contested by Cole Simmons (4.6 feet, MAN). Brandon Durant misses. Rebound secured by Cole Simmons.

[02:09] Team_083 possession (Score: 102-95)
FOUL! Shooting foul on Brandon Durant. Domantas Doncic to the line for 2 free throws. [BONUS: 11 team fouls] (Brandon Durant: 1 personal fouls)   FT 1/2: MISS   FT 2/2: GOOD Domantas Doncic makes 1/2 from the line.
Score: 103-95

[01:57] Team_072 possession (Score: 103-95)
CJ Bane drives to the basket... CJ Bane throws a bad pass! Stolen by Domantas Doncic! TURNOVER! (live ball)

[01:40] Team_083 possession (Score: 103-95)
Cole Simmons drives and kicks out. Victor McCollum attempts a Midrange. Contested by Brandon Durant (3.8 feet, ZONE). Victor McCollum misses. Rebound secured by CJ Jokic.

[01:23] Team_072 possession (Score: 103-95)
Giannis Gobert attempts a 3Pt. Contested by Cole Simmons (5.1 feet, ZONE). Giannis Gobert misses. FOUL! Loose ball foul on Cole Simmons during the rebound battle. [Team fouls: 3] No free throws, side out. (Cole Simmons: 1 personal fouls)

[01:10] Team_072 possession (Score: 103-95)
CJ Jokic makes the Midrange and draws the foul on Damian Towns! And-1! CJ Jokic to the line for 1. [Team fouls: 4] (Damian Towns: 2 personal fouls)   FT 1/1: GOOD CJ Jokic makes 1/1 from the line.
Score: 103-98

[00:54] Team_083 possession (Score: 103-98)
Zion Markkanen makes the 3Pt and draws the foul on Giannis Gobert! And-1! Zion Markkanen to the line for 1. [BONUS: 12 team fouls] (Giannis Gobert: 3 personal fouls)   FT 1/1: GOOD Zion Markkanen makes 1/1 from the line.
Score: 107-98

[00:37] Team_072 possession (Score: 107-98)
CJ Jokic attempts a Midrange. Contested by Damian Towns (4.9 feet, MAN). CJ JOKIC MAKES IT!
Score: 107-100

[00:23] Team_083 possession (Score: 107-100)
FOUL! Offensive foul on Domantas Doncic! CJ Bane drew the charge! [Team fouls: 5] (Domantas Doncic: 1 personal fouls) TURNOVER! (dead ball)

[00:06] Team_072 possession (Score: 107-100)
CJ Jokic drives and kicks out. Stephen Holiday attempts a 3Pt. Contested by Zion Markkanen (5.5 feet, ZONE). Stephen Holiday misses. Offensive rebound by Stephen Holiday! Stephen Holiday kicks it out.

================================================================================
                              4TH QUARTER COMPLETE                              
================================================================================

4TH QUARTER SCORE: Team_083 34, Team_072 28

BOX SCORE:
================================================================================

Team_083
--------------------------------------------------------------------------------
Player                MIN  PTS  REB  AST  TO      FG   FG%      3P   3P%
--------------------------------------------------------------------------------
Victor McCollum        18    7    3    0   0   3/3   100.0     0/0   0.0
Zion Markkanen         18    7    0    0   0   2/3    66.7     0/0   0.0
Cole Simmons           18    6    2    0   0   2/4    50.0     0/0   0.0
Damian Towns           18    5    1    1   0   2/2   100.0     0/0   0.0
Bradley Thompson       30    3    3    0   0   1/2    50.0     0/0   0.0
Kyrie Griffin          30    3    0    0   0   1/1   100.0     0/0   0.0
Yao Oladipo            30    2    0    0   0   1/1   100.0     0/0   0.0
Domantas Doncic        18    1    0    0   0   1/1   100.0     0/0   0.0
Malcolm Brogdon        30    0    0    0   0   0/2     0.0     0/0   0.0
Karl Jokic             30    0    0    0   0   0/1     0.0     0/0   0.0

TEAM: FG: 13/20 (65.0%), 3PT: 4/8 (50.0%), REB: 9 (2 off, 7 def), AST: 1, TO: 2
TEAM FOULS: 5 [Team_072 in BONUS]


Team_072
--------------------------------------------------------------------------------
Player                MIN  PTS  REB  AST  TO      FG   FG%      3P   3P%
--------------------------------------------------------------------------------
CJ Jokic               18    7    1    1   0   3/3   100.0     0/0   0.0
CJ Bane                18    4    0    0   0   2/4    50.0     0/0   0.0
Collin Griffin         30    3    0    0   0   1/3    33.3     0/0   0.0
Tracy Giddey           30    3    1    0   0   1/1   100.0     0/0   0.0
Cade Poole             30    3    0    1   0   1/1   100.0     0/0   0.0
Wendell Anthony        30    2    2    1   0   1/1   100.0     0/0   0.0
Giannis Gobert         18    2    0    0   0   1/2    50.0     0/0   0.0
Brandon Durant         18    2    3    0   0   1/2    50.0     0/0   0.0
Tyrese Williamson      30    0    1    1   0   0/0     0.0     0/0   0.0
Stephen Holiday        18    0    3    2   0   0/1     0.0     0/0   0.0

TEAM: FG: 11/18 (61.1%), 3PT: 2/4 (50.0%), REB: 11 (4 off, 7 def), AST: 6, TO: 3
TEAM FOULS: 12 [Team_083 in BONUS]

================================================================================

================================================================================
                               FULL GAME COMPLETE                               
================================================================================

FINAL SCORE: Team_083 107, Team_072 100

SCORING BY QUARTER:
--------------------------------------------------------------------------------
Team                     Q1     Q2     Q3     Q4    FINAL
--------------------------------------------------------------------------------
Team_083                 30     13     30     34      107
Team_072                 22     24     26     28      100
--------------------------------------------------------------------------------

FULL GAME BOX SCORE:
================================================================================

Team_083
--------------------------------------------------------------------------------
Player                MIN  PTS  REB  AST  TO      FG   FG%      3P   3P%      FT STL BLK
--------------------------------------------------------------------------------
Malcolm Brogdon        30   12    0    2   1   6/17   35.3   3/10   30.0   7/8     0   1
Karl Jokic             30    0    0    0   2   1/3    33.3   0/1     0.0   0/0     0   0
Yao Oladipo            30   17    6    2   1   6/12   50.0   2/4    50.0   6/7     0   0
Kyrie Griffin          30   17    9    2   2   7/11   63.6   1/2    50.0   3/4     2   2
Bradley Thompson       30   16   11    4   1   5/6    83.3   0/1     0.0   6/6     1   1
Zion Markkanen         18   11    0    1   1   3/4    75.0   2/3    66.7   6/6     0   0
Damian Towns           18    8    5    1   1   4/7    57.1   3/3   100.0   2/2     0   0
Domantas Doncic        18    4    0    0   1   2/3    66.7   1/1   100.0   1/2     2   0
Cole Simmons           18    6    4    1   0   3/8    37.5   1/3    33.3   1/1     1   0
Victor McCollum        18   11    7    2   0   2/4    50.0   0/0     0.0   4/5     0   1

TEAM: FG: 42/78 (53.8%), 3PT: 13/28 (46.4%), REB: 43 (10 off, 33 def), AST: 15, TO: 10


Team_072
--------------------------------------------------------------------------------
Player                MIN  PTS  REB  AST  TO      FG   FG%      3P   3P%      FT STL BLK
--------------------------------------------------------------------------------
Collin Griffin         30   16    0    2   0   7/14   50.0   3/6    50.0   1/1     0   1
Cade Poole             30   18    0    1   1   5/12   41.7   4/6    66.7   1/1     0   0
Wendell Anthony        30    3   10    3   2   2/4    50.0   0/2     0.0   1/2     1   0
Tracy Giddey           30   11    8    1   1   5/7    71.4   2/4    50.0   2/2     0   0
Tyrese Williamson      30   17   10    4   1   6/11   54.5   0/2     0.0   9/9     0   1
Giannis Gobert         18    7    0    0   1   3/7    42.9   1/4    25.0   3/3     0   0
CJ Jokic               18    7    5    4   1   4/4   100.0   0/0     0.0   1/1     0   0
CJ Bane                18   10    0    0   2   3/7    42.9   0/2     0.0   1/2     0   0
Brandon Durant         18    9    6    0   2   4/7    57.1   1/2    50.0   0/0     0   0
Stephen Holiday        18    0    8    3   0   0/1     0.0   0/0     0.0   0/0     0   1

TEAM: FG: 39/74 (52.7%), 3PT: 11/28 (39.3%), REB: 46 (12 off, 34 def), AST: 18, TO: 11

================================================================================
