================================================================================
                        FULL GAME - Team_078 vs Team_061                        
================================================================================

================================================================================
                       1ST QUARTER - Team_078 vs Team_061                       
================================================================================

[12:00] Team_078 possession (Score: 0-0)
Jabari Barrett drives, Draymond Banchero stays with him. Jabari Barrett attempts a Dunk. Contested by Draymond Banchero (2.6 feet, ZONE). JABARI BARRETT MAKES IT! Assist: Kyrie Carter
Score: 2-0

[11:46] Team_061 possession (Score: 2-0)
Bam Sexton drives, Ben Ginobili stays with him. Bam Sexton attempts a Layup. Contested by Ben Ginobili (5.1 feet, MAN). Bam Sexton misses. Rebound secured by Ben Ginobili.

[11:29] Team_078 possession (Score: 2-0)
Isaiah Simmons attempts a 3Pt. Contested by Michael Russell (3.9 feet, MAN). Isaiah Simmons misses. Rebound secured by Michael Russell.

[11:16] Team_061 possession (Score: 2-0)
Draymond Banchero drives, Jabari Barrett stays with him. Draymond Banchero attempts a Dunk. Contested by Jabari Barrett (5.3 feet, ZONE). DRAYMOND BANCHERO MAKES IT! Assist: Jayson Holiday
Score: 2-2

[11:02] Team_078 possession (Score: 2-2)
Isaiah Simmons attempts a Midrange. Contested by Michael Russell (3.9 feet, MAN). Isaiah Simmons misses. Rebound secured by Draymond Banchero.

[10:51] Team_061 possession (Score: 2-2)
Michael Russell drives to the basket... Michael Russell loses the ball! Stripped by Isaiah Simmons! TURNOVER! (live ball)

[10:32] Team_078 possession (Score: 2-2)
FOUL! Shooting foul on Draymond Banchero. Jabari Barrett to the line for 2 free throws. [Team fouls: 1] (Draymond Banchero: 1 personal fouls)   FT 1/2: GOOD   FT 2/2: MISS Jabari Barrett makes 1/2 from the line. Rebound secured by Draymond Banchero.
Score: 3-2

[10:17] Team_061 possession (Score: 3-2)
Brandon Russell attempts a 3Pt. Contested by Isaiah Simmons (3.3 feet, ZONE). Brandon Russell misses. Rebound secured by Jabari Barrett.

[10:05] Team_078 possession (Score: 3-2)
Isaiah Simmons drives, Michael Russell stays with him. Isaiah Simmons attempts a Layup. Contested by Michael Russell (3.9 feet, MAN). ISAIAH SIMMONS MAKES IT! Assist: Kyrie Carter
Score: 5-2

[09:50] Team_061 possession (Score: 5-2)
Bam Sexton makes the Dunk and draws the foul on Ben Ginobili! And-1! Bam Sexton to the line for 1. [Team fouls: 1] (Ben Ginobili: 1 personal fouls)   FT 1/1: GOOD Bam Sexton makes 1/1 from the line.
Score: 5-5

[09:36] Team_078 possession (Score: 5-5)
Jabari Barrett drives, picks up Draymond Banchero. Help arrives from Jayson Holiday! Jabari Barrett attempts a Layup. Contested by Jayson Holiday (2.6 feet, MAN). Jabari Barrett misses. Offensive rebound by Jabari Barrett! Jabari Barrett kicks it out.

[09:21] Team_078 possession (Score: 5-5)
Jabari Barnes loses the ball! Stripped by Brandon Russell! TURNOVER! (live ball)

[09:06] Team_061 possession (Score: 5-5)
Michael Russell throws a bad pass! Stolen by Isaiah Simmons! TURNOVER! (live ball)

[08:54] Team_078 possession (Score: 5-5)
Jabari Barrett drives, Draymond Banchero stays with him. Jabari Barrett attempts a Dunk. Contested by Draymond Banchero (2.6 feet, ZONE). JABARI BARRETT MAKES IT! Assist: Ben Ginobili
Score: 7-5

[08:41] Team_061 possession (Score: 7-5)
Draymond Banchero drives to the basket... Draymond Banchero commits a violation (traveling/carry)! TURNOVER! (dead ball)

[08:26] Team_078 possession (Score: 7-5)
Kyrie Carter attempts a 3Pt. Contested by Jayson Holiday (3.9 feet, MAN). Kyrie Carter misses. Offensive rebound by Isaiah Simmons! Isaiah Simmons puts it back in!
Score: 9-5

[08:08] Team_061 possession (Score: 9-5)
FOUL! Shooting foul on Jabari Barrett. Draymond Banchero to the line for 2 free throws. [Team fouls: 2] (Jabari Barrett: 1 personal fouls)   FT 1/2: GOOD   FT 2/2: GOOD Draymond Banchero makes 2/2 from the line.
Score: 9-7

[07:52] Team_078 possession (Score: 9-7)
Jabari Barnes throws a bad pass out of bounds! TURNOVER! (dead ball)

[07:40] Team_061 possession (Score: 9-7)
FOUL! Holding foul on Isaiah Simmons. [Team fouls: 3] No free throws, side out. (Isaiah Simmons: 1 personal fouls)

[07:27] Team_061 possession (Score: 9-7)
FOUL! Shooting foul on Ben Ginobili. Bam Sexton to the line for 2 free throws. [Team fouls: 4] (Ben Ginobili: 2 personal fouls)   FT 1/2: GOOD   FT 2/2: GOOD Bam Sexton makes 2/2 from the line.
Score: 9-9

[07:08] Team_078 possession (Score: 9-9)
Ben Ginobili attempts a Midrange. Contested by Jayson Holiday (4.3 feet, ZONE). BEN GINOBILI MAKES IT!
Score: 11-9

[06:55] Team_061 possession (Score: 11-9)
Draymond Banchero attempts a Midrange. Contested by Kyrie Carter (4.5 feet, ZONE). DRAYMOND BANCHERO MAKES IT!
Score: 11-11

[06:43] Team_078 possession (Score: 11-11)
Ben Ginobili attempts a 3Pt. Contested by Bam Sexton (5.2 feet, MAN). Ben Ginobili misses. Offensive rebound by Isaiah Simmons! Isaiah Simmons puts it back in!
Score: 13-11

[06:27] Team_061 possession (Score: 13-11)
FOUL! Shooting foul on Kyrie Carter. Jayson Holiday to the line for 2 free throws. [BONUS: 5 team fouls] (Kyrie Carter: 1 personal fouls)   FT 1/2: GOOD   FT 2/2: GOOD Jayson Holiday makes 2/2 from the line.
Score: 13-13

[06:14] Team_078 possession (Score: 13-13)
Ben Ginobili attempts a Layup. Contested by Bam Sexton (5.2 feet, MAN). BEN GINOBILI MAKES IT! Assist: Isaiah Simmons
Score: 15-13

[05:59] Team_061 possession (Score: 15-13)
FOUL! Shooting foul on Isaiah Simmons. Michael Russell to the line for 2 free throws. [BONUS: 6 team fouls] (Isaiah Simmons: 2 personal fouls)   FT 1/2: GOOD   FT 2/2: GOOD Michael Russell makes 2/2 from the line.
Score: 15-15

[05:42] Team_078 possession (Score: 15-15)
Kyrie Carter attempts a 3Pt. Contested by Jayson Holiday (3.9 feet, MAN). Kyrie Carter misses. Rebound secured by Bam Sexton.

[05:25] Team_061 possession (Score: 15-15)
Bam Sexton drives to the basket... Bam Sexton commits a violation (traveling/carry)! TURNOVER! (dead ball)

[05:09] Team_078 possession (Score: 15-15)
Ben Ginobili drives, Draymond Banchero stays with him. Ben Ginobili attempts a Layup. Contested by Draymond Banchero (2.9 feet, ZONE). Ben Ginobili misses. Offensive rebound by Isaiah Simmons! Isaiah Simmons puts it back in!
Score: 17-15

[04:50] Team_061 possession (Score: 17-15)
Draymond Banchero drives to the basket... Draymond Banchero commits a violation (traveling/carry)! TURNOVER! (dead ball)

[04:35] Team_078 possession (Score: 17-15)
Ben Ginobili attempts a Midrange. Contested by Bam Sexton (5.2 feet, MAN). Ben Ginobili misses. Rebound secured by Bam Sexton.

[04:25] Team_061 possession (Score: 17-15)
Jayson Holiday attempts a 3Pt. Contested by Isaiah Simmons (3.5 feet, ZONE). Jayson Holiday misses. Rebound secured by Isaiah Simmons.

[04:10] Team_078 possession (Score: 17-15)
Jabari Barnes attempts a 3Pt. Contested by Brandon Russell (4.3 feet, MAN). Jabari Barnes misses. Offensive rebound by Jabari Barrett! Jabari Barrett kicks it out.

[03:57] Team_078 possession (Score: 17-15)
FOUL! Reach-in foul on Draymond Banchero during the drive. [Team fouls: 2] No free throws, side out. (Draymond Banchero: 2 personal fouls)

[03:39] Team_078 possession (Score: 17-15)
Jabari Barrett drives, picks up Draymond Banchero. Help arrives from Jayson Holiday! Jabari Barrett attempts a Dunk. Contested by Jayson Holiday (2.7 feet, MAN). JABARI BARRETT MAKES IT!
Score: 19-15

[03:25] Team_061 possession (Score: 19-15)
Michael Russell attempts a 3Pt. Contested by Isaiah Simmons (3.5 feet, MAN). MICHAEL RUSSELL MAKES IT! Assist: Bam Sexton
Score: 19-18

[03:13] Team_078 possession (Score: 19-18)
Jabari Barnes drives, Draymond Banchero stays with him. Jabari Barnes attempts a Layup. Contested by Draymond Banchero (3.1 feet, ZONE). JABARI BARNES MAKES IT! Assist: Jabari Barrett
Score: 21-18

[03:00] Team_061 possession (Score: 21-18)
Draymond Banchero attempts a Midrange. Contested by Kyrie Carter (4.7 feet, ZONE). DRAYMOND BANCHERO MAKES IT! Assist: Jayson Holiday
Score: 21-20

[02:47] Team_078 possession (Score: 21-20)
FOUL! Holding foul on Brandon Russell. [Team fouls: 3] No free throws, side out. (Brandon Russell: 1 personal fouls)

[02:35] Team_078 possession (Score: 21-20)
Jabari Barrett attempts a Midrange. Contested by Draymond Banchero (2.8 feet, MAN). Jabari Barrett misses. Rebound secured by Draymond Banchero.

[02:23] Team_061 possession (Score: 21-20)
Bam Sexton attempts a Midrange. Contested by Kyrie Carter (4.5 feet, ZONE). BAM SEXTON MAKES IT!
Score: 21-22

[02:13] Team_078 possession (Score: 21-22)
Ben Ginobili attempts a Layup. Contested by Bam Sexton (5.3 feet, MAN). Ben Ginobili misses. Rebound secured by Bam Sexton.

[01:57] Team_061 possession (Score: 21-22)
FOUL! Reach-in foul on Jabari Barrett during the drive. [IN THE BONUS! 7 team fouls] Draymond Banchero to the line for 2 free throws. (Jabari Barrett: 2 personal fouls)   FT 1/2: GOOD   FT 2/2: MISS Draymond Banchero makes 1/2 from the line. Rebound secured by Isaiah Simmons.
Score: 21-23

[01:39] Team_078 possession (Score: 21-23)
Kyrie Carter loses the ball! Stripped by Jayson Holiday! TURNOVER! (live ball)

[01:27] Team_061 possession (Score: 21-23)
Bam Sexton attempts a Midrange. Contested by Ben Ginobili (5.5 feet, ZONE). BAM SEXTON MAKES IT! Assist: Draymond Banchero
Score: 21-25

[01:14] Team_078 possession (Score: 21-25)
FOUL! Reach-in foul on Draymond Banchero during the drive. [Team fouls: 4] No free throws, side out. (Draymond Banchero: 3 personal fouls)

[01:01] Team_078 possession (Score: 21-25)
Isaiah Simmons attempts a 3Pt. Contested by Brandon Russell (4.4 feet, ZONE). Isaiah Simmons misses. Offensive rebound by Isaiah Simmons! Isaiah Simmons puts it back in!
Score: 23-25

[00:42] Team_061 possession (Score: 23-25)
Draymond Banchero throws a bad pass! Stolen by Jabari Barrett! TURNOVER! (live ball)

[00:29] Team_078 possession (Score: 23-25)
Ben Ginobili attempts a Midrange. Contested by Bam Sexton (5.4 feet, MAN). BEN GINOBILI MAKES IT!
Score: 25-25

[00:15] Team_061 possession (Score: 25-25)
Brandon Russell attempts a 3Pt. Contested by Jabari Barnes (4.7 feet, MAN). Brandon Russell misses. FOUL! Loose ball foul on Jabari Barrett during the rebound battle. [IN THE BONUS! 8 team fouls] Draymond Banchero to the line for 2 free throws. (Jabari Barrett: 3 personal fouls)   FT 1/2: GOOD   FT 2/2: MISS Draymond Banchero makes 1/2 from the line. Offensive rebound by Draymond Banchero! Draymond Banchero puts it back in!
Score: 25-28

[00:01] Team_078 possession (Score: 25-28)
Jabari Barnes attempts a 3Pt. Contested by Brandon Russell (4.7 feet, ZONE). Jabari Barnes misses. Rebound secured by Draymond Banchero.

================================================================================
                              1ST QUARTER COMPLETE                              
================================================================================

1ST QUARTER SCORE: Team_078 25, Team_061 28

BOX SCORE:
================================================================================

Team_078
--------------------------------------------------------------------------------
Player                MIN  PTS  REB  AST  TO      FG   FG%      3P   3P%
--------------------------------------------------------------------------------
Isaiah Simmons         12   10    6    1   0   5/7    71.4     0/0   0.0
Jabari Barrett         12    6    3    1   0   3/5    60.0     0/0   0.0
Ben Ginobili           12    6    1    1   0   3/5    60.0     0/0   0.0
Jabari Barnes          12    2    0    0   0   1/2    50.0     0/0   0.0
Kyrie Carter           12    0    0    2   0   0/1     0.0     0/0   0.0

TEAM: FG: 12/20 (60.0%), 3PT: 3/6 (50.0%), REB: 10 (6 off, 4 def), AST: 5, TO: 3
TEAM FOULS: 8 [Team_061 in BONUS]


Team_061
--------------------------------------------------------------------------------
Player                MIN  PTS  REB  AST  TO      FG   FG%      3P   3P%
--------------------------------------------------------------------------------
Draymond Banchero      12   11    5    1   0   5/6    83.3     0/0   0.0
Bam Sexton             12    9    3    1   0   4/5    80.0     0/0   0.0
Michael Russell        12    5    1    0   0   2/2   100.0     0/0   0.0
Jayson Holiday         12    2    0    2   0   1/2    50.0     0/0   0.0
Brandon Russell        12    0    0    0   0   0/1     0.0     0/0   0.0

TEAM: FG: 12/16 (75.0%), 3PT: 2/4 (50.0%), REB: 9 (1 off, 8 def), AST: 4, TO: 6
TEAM FOULS: 4

================================================================================

================================================================================
                       2ND QUARTER - Team_078 vs Team_061                       
================================================================================

[12:00] Team_078 possession (Score: 25-28)
Kyrie Carter attempts a 3Pt. Contested by Jayson Holiday (4.2 feet, MAN). KYRIE CARTER MAKES IT! Assist: Isaiah Simmons
Score: 28-28

[11:49] Team_061 possession (Score: 28-28)
FOUL! Holding foul on Isaiah Simmons. [Team fouls: 1] No free throws, side out. (Isaiah Simmons: 1 personal fouls)

[11:32] Team_061 possession (Score: 28-28)
Michael Russell attempts a Midrange. BLOCKED BY ISAIAH SIMMONS! Ball is loose! Offensive rebound by Michael Russell! Michael Russell kicks it out.

[11:16] Team_061 possession (Score: 28-28)
Draymond Banchero drives, Ben Ginobili stays with him. Draymond Banchero attempts a Layup. Contested by Ben Ginobili (5.7 feet, ZONE). Draymond Banchero misses. Rebound secured by Jabari Barrett.

[10:59] Team_078 possession (Score: 28-28)
Isaiah Simmons attempts a Midrange. Contested by Bam Sexton (5.3 feet, ZONE). Isaiah Simmons misses. Rebound secured by Michael Russell.

[10:49] Team_061 possession (Score: 28-28)
Bam Sexton attempts a 3Pt. Contested by Isaiah Simmons (4.0 feet, ZONE). Bam Sexton misses. Rebound secured by Jabari Barrett.

[10:34] Team_078 possession (Score: 28-28)
Jabari Barrett attempts a 3Pt. Contested by Brandon Russell (4.2 feet, ZONE). Jabari Barrett misses. Rebound secured by Bam Sexton.

[10:19] Team_061 possession (Score: 28-28)
Bam Sexton drives to the basket... Bam Sexton loses the ball! Stripped by Ben Ginobili! TURNOVER! (live ball)

[10:05] Team_078 possession (Score: 28-28)
Jabari Barrett attempts a Layup. BLOCKED BY DRAYMOND BANCHERO! Ball is loose! Rebound secured by Michael Russell.

[09:49] Team_061 possession (Score: 28-28)
Jayson Holiday drives to the basket... FOUL! Offensive foul on Jayson Holiday! Kyrie Carter drew the charge! [Team fouls: 1] (Jayson Holiday: 1 personal fouls) TURNOVER! (dead ball)

[09:39] Team_078 possession (Score: 28-28)
Jabari Barrett drives to the basket... Jabari Barrett loses control! Ball rolls out of bounds! TURNOVER! (dead ball)

[09:39] Substitution (Team_078): Jabari Barnes OUT → Magic Barrett IN (stamina_rule2)

[09:39] Substitution (Team_078): Kyrie Carter OUT → Damian Allen IN (stamina_rule2)

[09:39] Substitution (Team_078): Isaiah Simmons OUT → Malcolm Randle IN (stamina_rule2)

[09:39] Substitution (Team_078): Ben Ginobili OUT → Paul Ming IN (stamina_rule2)

[09:39] Substitution (Team_078): Jabari Barrett OUT → Draymond Irving IN (stamina_rule2)

[09:39] Substitution (Team_061): Brandon Russell OUT → Evan Rose IN (stamina_rule2)

[09:39] Substitution (Team_061): Jayson Holiday OUT → Gary Fox IN (stamina_rule2)

[09:39] Substitution (Team_061): Michael Russell OUT → Desmond Morant IN (stamina_rule2)

[09:39] Substitution (Team_061): Bam Sexton OUT → Stephen Towns IN (stamina_rule2)

[09:39] Substitution (Team_061): Draymond Banchero OUT → Tim Durant IN (stamina_rule2)

[09:20] Team_061 possession (Score: 28-28)
Tim Durant loses the ball! Stripped by Draymond Irving! TURNOVER! (live ball)

[09:05] Team_078 possession (Score: 28-28)
Paul Ming drives to the basket... Paul Ming throws a bad pass! Stolen by Tim Durant! TURNOVER! (live ball)

[08:48] Team_061 possession (Score: 28-28)
Tim Durant drives to the basket... Tim Durant throws a bad pass! Stolen by Paul Ming! TURNOVER! (live ball)

[08:36] Team_078 possession (Score: 28-28)
Draymond Irving attempts a Layup. Contested by Tim Durant (4.5 feet, MAN). Draymond Irving misses. Offensive rebound by Draymond Irving! Draymond Irving kicks it out.

[08:19] Team_078 possession (Score: 28-28)
Draymond Irving attempts a Midrange. Contested by Tim Durant (4.5 feet, MAN). DRAYMOND IRVING MAKES IT! Assist: Malcolm Randle
Score: 30-28

[08:03] Team_061 possession (Score: 30-28)
Tim Durant drives to the basket... FOUL! Offensive foul on Tim Durant! Draymond Irving drew the charge! [Team fouls: 2] (Tim Durant: 1 personal fouls) TURNOVER! (dead ball)

[07:45] Team_078 possession (Score: 30-28)
Damian Allen attempts a 3Pt. Wide open! Gary Fox is 6.0 feet away. [MAN] Damian Allen misses. Rebound secured by Stephen Towns.

[07:34] Team_061 possession (Score: 30-28)
Tim Durant drives to the basket... Tim Durant loses control! Ball rolls out of bounds! TURNOVER! (dead ball)

[07:21] Team_078 possession (Score: 30-28)
Magic Barrett attempts a 3Pt. Contested by Desmond Morant (5.0 feet, ZONE). Magic Barrett misses. Rebound secured by Stephen Towns.

[07:06] Team_061 possession (Score: 30-28)
Evan Rose drives and kicks out. Evan Rose attempts a Midrange. Contested by Magic Barrett (4.9 feet, MAN). Evan Rose misses. Rebound secured by Paul Ming.

[06:54] Team_078 possession (Score: 30-28)
Magic Barrett attempts a Midrange. Contested by Evan Rose (5.5 feet, MAN). MAGIC BARRETT MAKES IT! Assist: Malcolm Randle
Score: 32-28

[06:42] Team_061 possession (Score: 32-28)
Gary Fox attempts a Layup. Contested by Damian Allen (5.0 feet, MAN). Gary Fox misses. Rebound secured by Draymond Irving.

[06:27] Team_078 possession (Score: 32-28)
Draymond Irving drives, picks up Tim Durant. Help arrives from Evan Rose! Draymond Irving attempts a Dunk. Contested by Evan Rose (4.5 feet, MAN). Draymond Irving misses. Offensive rebound by Draymond Irving! Draymond Irving kicks it out.

[06:13] Team_078 possession (Score: 32-28)
Damian Allen attempts a 3Pt. Contested by Desmond Morant (4.6 feet, ZONE). Damian Allen misses. Rebound secured by Stephen Towns.

[06:00] Team_061 possession (Score: 32-28)
Gary Fox drives, picks up Damian Allen. Help arrives from Malcolm Randle! Gary Fox attempts a Dunk. Contested by Malcolm Randle (5.0 feet, MAN). GARY FOX MAKES IT! Assist: Tim Durant
Score: 32-30

[05:48] Team_078 possession (Score: 32-30)
Draymond Irving attempts a Layup. Contested by Tim Durant (4.5 feet, ZONE). DRAYMOND IRVING MAKES IT! Assist: Magic Barrett
Score: 34-30

[05:34] Team_061 possession (Score: 34-30)
FOUL! Shooting foul on Damian Allen. Evan Rose to the line for 3 free throws. [Team fouls: 2] (Damian Allen: 1 personal fouls)   FT 1/3: MISS   FT 2/3: MISS   FT 3/3: GOOD Evan Rose makes 1/3 from the line.
Score: 34-31

[05:22] Team_078 possession (Score: 34-31)
FOUL! Shooting foul on Tim Durant. Draymond Irving to the line for 2 free throws. [Team fouls: 3] (Tim Durant: 2 personal fouls)   FT 1/2: GOOD   FT 2/2: GOOD Draymond Irving makes 2/2 from the line.
Score: 36-31

[05:09] Team_061 possession (Score: 36-31)
Tim Durant attempts a Midrange. Contested by Draymond Irving (6.0 feet, MAN). TIM DURANT MAKES IT!
Score: 36-33

[04:54] Team_078 possession (Score: 36-33)
Magic Barrett attempts a 3Pt. Contested by Desmond Morant (5.0 feet, ZONE). MAGIC BARRETT MAKES IT! Assist: Paul Ming
Score: 39-33

[04:40] Team_061 possession (Score: 39-33)
Stephen Towns attempts a 3Pt. Contested by Damian Allen (5.2 feet, ZONE). STEPHEN TOWNS MAKES IT! Assist: Gary Fox
Score: 39-36

[04:23] Team_078 possession (Score: 39-36)
Magic Barrett commits a violation (traveling/carry)! TURNOVER! (dead ball)

[04:07] Team_061 possession (Score: 39-36)
Stephen Towns drives, Paul Ming stays with him. Stephen Towns attempts a Dunk. Contested by Paul Ming (4.6 feet, MAN). Stephen Towns misses. Rebound secured by Draymond Irving.

[03:49] Team_078 possession (Score: 39-36)
Draymond Irving drives, picks up Tim Durant. Help arrives from Evan Rose! Draymond Irving attempts a Dunk. Contested by Evan Rose (4.5 feet, ZONE). DRAYMOND IRVING MAKES IT!
Score: 41-36

[03:32] Team_061 possession (Score: 41-36)
Desmond Morant attempts a 3Pt. Contested by Damian Allen (5.2 feet, ZONE). Desmond Morant misses. Rebound secured by Draymond Irving.

[03:18] Team_078 possession (Score: 41-36)
Damian Allen drives to the basket... Damian Allen loses control! Ball rolls out of bounds! TURNOVER! (dead ball)

[02:59] Team_061 possession (Score: 41-36)
Evan Rose attempts a 3Pt. Contested by Damian Allen (5.2 feet, ZONE). Evan Rose misses. Rebound secured by Paul Ming.

[02:43] Team_078 possession (Score: 41-36)
Damian Allen drives and kicks out. Magic Barrett attempts a 3Pt. Contested by Desmond Morant (4.5 feet, ZONE). MAGIC BARRETT MAKES IT! Assist: Draymond Irving
Score: 44-36

[02:26] Team_061 possession (Score: 44-36)
Stephen Towns drives and kicks out. Tim Durant attempts a 3Pt. Contested by Damian Allen (4.9 feet, ZONE). Tim Durant misses. Rebound secured by Draymond Irving.

[02:13] Team_078 possession (Score: 44-36)
Magic Barrett attempts a Layup. BLOCKED BY EVAN ROSE! Ball is loose! Rebound secured by Stephen Towns.

[01:54] Team_061 possession (Score: 44-36)
Tim Durant drives to the basket... Tim Durant loses control! Ball rolls out of bounds! TURNOVER! (dead ball)

[01:38] Team_078 possession (Score: 44-36)
Malcolm Randle drives, Tim Durant stays with him. Malcolm Randle attempts a Dunk. Contested by Tim Durant (4.5 feet, ZONE). MALCOLM RANDLE MAKES IT! Assist: Draymond Irving
Score: 46-36

[01:22] Team_061 possession (Score: 46-36)
Stephen Towns attempts a 3Pt. Contested by Damian Allen (5.3 feet, ZONE). STEPHEN TOWNS MAKES IT! Assist: Desmond Morant
Score: 46-39

[01:10] Team_078 possession (Score: 46-39)
Damian Allen drives and kicks out. Malcolm Randle attempts a Midrange. Contested by Desmond Morant (4.6 feet, ZONE). Malcolm Randle misses. Rebound secured by Tim Durant.

[00:59] Team_061 possession (Score: 46-39)
Stephen Towns attempts a 3Pt. Contested by Damian Allen (5.3 feet, ZONE). STEPHEN TOWNS MAKES IT! Assist: Evan Rose
Score: 46-42

[00:42] Team_078 possession (Score: 46-42)
Magic Barrett attempts a Midrange. Contested by Evan Rose (5.6 feet, MAN). Magic Barrett misses. Offensive rebound by Paul Ming! Paul Ming kicks it out.

[00:29] Team_078 possession (Score: 46-42)
Magic Barrett attempts a Layup. Contested by Evan Rose (5.6 feet, MAN). MAGIC BARRETT MAKES IT! Assist: Damian Allen
Score: 48-42

[00:17] Team_061 possession (Score: 48-42)
FOUL! Shooting foul on Paul Ming. Tim Durant to the line for 2 free throws. [Team fouls: 3] (Paul Ming: 1 personal fouls)   FT 1/2: GOOD   FT 2/2: MISS Tim Durant makes 1/2 from the line. Rebound secured by Paul Ming.
Score: 48-43

[00:03] Team_078 possession (Score: 48-43)
Draymond Irving drives, Tim Durant stays with him. Draymond Irving attempts a Dunk. Contested by Tim Durant (4.8 feet, MAN). DRAYMOND IRVING MAKES IT!
Score: 50-43

================================================================================
                              2ND QUARTER COMPLETE                              
================================================================================

2ND QUARTER SCORE: Team_078 25, Team_061 15

BOX SCORE:
================================================================================

Team_078
--------------------------------------------------------------------------------
Player                MIN  PTS  REB  AST  TO      FG   FG%      3P   3P%
--------------------------------------------------------------------------------
Draymond Irving         9   10    6    2   0   5/5   100.0     0/0   0.0
Magic Barrett           9   10    0    1   0   4/6    66.7     0/0   0.0
Kyrie Carter           15    3    0    0   0   1/1   100.0     0/0   0.0
Malcolm Randle          9    2    0    2   0   1/1   100.0     0/0   0.0
Isaiah Simmons         15    0    0    1   0   0/1     0.0     0/0   0.0
Jabari Barrett         15    0    2    0   0   0/2     0.0     0/0   0.0
Damian Allen            9    0    0    1   0   0/3     0.0     0/0   0.0
Paul Ming               9    0    4    1   0   0/0     0.0     0/0   0.0

TEAM: FG: 11/19 (57.9%), 3PT: 2/6 (33.3%), REB: 12 (3 off, 9 def), AST: 8, TO: 4
TEAM FOULS: 3


Team_061
--------------------------------------------------------------------------------
Player                MIN  PTS  REB  AST  TO      FG   FG%      3P   3P%
--------------------------------------------------------------------------------
Stephen Towns           9    9    4    0   0   3/5    60.0     0/0   0.0
Gary Fox                9    2    0    1   0   1/2    50.0     0/0   0.0
Tim Durant              9    2    1    1   0   1/2    50.0     0/0   0.0
Evan Rose               9    1    0    1   0   1/3    33.3     0/0   0.0
Michael Russell        15    0    3    0   0   0/0     0.0     0/0   0.0
Draymond Banchero      15    0    0    0   0   0/1     0.0     0/0   0.0
Bam Sexton             15    0    1    0   0   0/1     0.0     0/0   0.0
Desmond Morant          9    0    0    1   0   0/1     0.0     0/0   0.0

TEAM: FG: 6/15 (40.0%), 3PT: 4/7 (57.1%), REB: 9 (1 off, 8 def), AST: 4, TO: 7
TEAM FOULS: 3

================================================================================

================================================================================
                       3RD QUARTER - Team_078 vs Team_061                       
================================================================================

[12:00] Team_078 possession (Score: 50-43)
Kyrie Carter drives to the basket... FOUL! Offensive foul on Kyrie Carter! Jayson Holiday drew the charge! [Team fouls: 1] (Kyrie Carter: 1 personal fouls) TURNOVER! (dead ball)

[11:44] Team_061 possession (Score: 50-43)
Jayson Holiday makes the 3Pt and draws the foul on Isaiah Simmons! And-1! Jayson Holiday to the line for 1. [Team fouls: 2] (Isaiah Simmons: 1 personal fouls)   FT 1/1: GOOD Jayson Holiday makes 1/1 from the line.
Score: 50-47

[11:33] Team_078 possession (Score: 50-47)
Isaiah Simmons attempts a Midrange. Contested by Michael Russell (3.9 feet, MAN). Isaiah Simmons misses. Offensive rebound by Jabari Barrett! Jabari Barrett kicks it out.

[11:23] Team_078 possession (Score: 50-47)
Kyrie Carter attempts a 3Pt. Contested by Brandon Russell (3.8 feet, ZONE). KYRIE CARTER MAKES IT! Assist: Jabari Barnes
Score: 53-47

[11:10] Team_061 possession (Score: 53-47)
Jayson Holiday attempts a 3Pt. Contested by Isaiah Simmons (3.5 feet, ZONE). Jayson Holiday misses. Rebound secured by Ben Ginobili.

[10:56] Team_078 possession (Score: 53-47)
Ben Ginobili drives and kicks out. Jabari Barrett attempts a 3Pt. Contested by Brandon Russell (3.9 feet, ZONE). Jabari Barrett misses. Rebound secured by Michael Russell.

[10:45] Team_061 possession (Score: 53-47)
Jayson Holiday attempts a Midrange. Contested by Isaiah Simmons (3.5 feet, ZONE). Jayson Holiday misses. Rebound secured by Isaiah Simmons.

[10:29] Team_078 possession (Score: 53-47)
FOUL! Shooting foul on Michael Russell. Isaiah Simmons to the line for 2 free throws. [Team fouls: 1] (Michael Russell: 1 personal fouls)   FT 1/2: MISS   FT 2/2: GOOD Isaiah Simmons makes 1/2 from the line.
Score: 54-47

[10:11] Team_061 possession (Score: 54-47)
Brandon Russell attempts a 3Pt. Contested by Jabari Barnes (4.1 feet, MAN). BRANDON RUSSELL MAKES IT! Assist: Jayson Holiday
Score: 54-50

[09:56] Team_078 possession (Score: 54-50)
Isaiah Simmons attempts a 3Pt. Contested by Michael Russell (3.9 feet, MAN). Isaiah Simmons misses. Offensive rebound by Isaiah Simmons! Isaiah Simmons's putback is no good. Rebound secured by Draymond Banchero.

[09:40] Team_061 possession (Score: 54-50)
Michael Russell drives to the basket... Michael Russell loses control! Ball rolls out of bounds! TURNOVER! (dead ball)

[09:22] Team_078 possession (Score: 54-50)
Isaiah Simmons attempts a 3Pt. Contested by Michael Russell (3.9 feet, MAN). ISAIAH SIMMONS MAKES IT! Assist: Ben Ginobili
Score: 57-50

[09:11] Team_061 possession (Score: 57-50)
Michael Russell drives to the basket... Michael Russell commits a violation (traveling/carry)! TURNOVER! (dead ball)

[08:56] Team_078 possession (Score: 57-50)
Isaiah Simmons attempts a Layup. Contested by Draymond Banchero (2.8 feet, ZONE). ISAIAH SIMMONS MAKES IT! Assist: Jabari Barrett
Score: 59-50

[08:37] Team_061 possession (Score: 59-50)
FOUL! Holding foul on Isaiah Simmons. [Team fouls: 3] No free throws, side out. (Isaiah Simmons: 2 personal fouls)

[08:24] Team_061 possession (Score: 59-50)
Bam Sexton drives and kicks out. Bam Sexton attempts a 3Pt. Contested by Ben Ginobili (4.6 feet, MAN). Bam Sexton misses. Rebound secured by Jabari Barrett.

[08:07] Team_078 possession (Score: 59-50)
Ben Ginobili drives to the basket... Ben Ginobili throws a bad pass! Stolen by Bam Sexton! TURNOVER! (live ball)

[07:52] Team_061 possession (Score: 59-50)
Draymond Banchero attempts a Midrange. Contested by Jabari Barrett (5.3 feet, MAN). Draymond Banchero misses. Offensive rebound by Michael Russell! Michael Russell puts it back in!
Score: 59-52

[07:42] Team_078 possession (Score: 59-52)
Kyrie Carter attempts a 3Pt. Contested by Jayson Holiday (3.9 feet, MAN). Kyrie Carter misses. Rebound secured by Draymond Banchero.

[07:25] Team_061 possession (Score: 59-52)
FOUL! Reach-in foul on Ben Ginobili during the drive. [Team fouls: 4] No free throws, side out. (Ben Ginobili: 1 personal fouls)

[07:16] Team_061 possession (Score: 59-52)
Jayson Holiday attempts a 3Pt. Contested by Kyrie Carter (4.2 feet, MAN). Jayson Holiday misses. Rebound secured by Jabari Barrett.

[07:00] Team_078 possession (Score: 59-52)
Jabari Barnes attempts a 3Pt. Contested by Brandon Russell (4.3 feet, MAN). Jabari Barnes misses. Rebound secured by Bam Sexton.

[06:49] Team_061 possession (Score: 59-52)
Draymond Banchero drives and kicks out. Bam Sexton attempts a 3Pt. Contested by Ben Ginobili (4.6 feet, MAN). Bam Sexton misses. Rebound secured by Jabari Barrett.

[06:36] Team_078 possession (Score: 59-52)
Ben Ginobili drives, picks up Draymond Banchero. Help arrives from Jayson Holiday! Ben Ginobili attempts a Dunk. Contested by Jayson Holiday (2.9 feet, ZONE). Ben Ginobili misses. Rebound secured by Bam Sexton.

[06:19] Team_061 possession (Score: 59-52)
Michael Russell attempts a 3Pt. Contested by Ben Ginobili (4.9 feet, ZONE). MICHAEL RUSSELL MAKES IT! Assist: Brandon Russell
Score: 59-55

[06:10] Team_078 possession (Score: 59-55)
Jabari Barnes drives and kicks out. Isaiah Simmons attempts a 3Pt. Contested by Michael Russell (3.7 feet, MAN). Isaiah Simmons misses. Rebound secured by Draymond Banchero.

[06:00] Team_061 possession (Score: 59-55)
Jayson Holiday attempts a 3Pt. Contested by Isaiah Simmons (3.5 feet, ZONE). Jayson Holiday misses. Rebound secured by Ben Ginobili.

[05:46] Team_078 possession (Score: 59-55)
Ben Ginobili attempts a Layup. BLOCKED BY JAYSON HOLIDAY! Ball deflects out of bounds off Ben Ginobili.

[05:30] Team_061 possession (Score: 59-55)
Draymond Banchero attempts a Midrange. Contested by Jabari Barrett (5.4 feet, MAN). DRAYMOND BANCHERO MAKES IT! Assist: Brandon Russell
Score: 59-57

[05:13] Team_078 possession (Score: 59-57)
Kyrie Carter attempts a Layup. Contested by Draymond Banchero (2.5 feet, ZONE). KYRIE CARTER MAKES IT!
Score: 61-57

[04:59] Team_061 possession (Score: 61-57)
FOUL! Shooting foul on Jabari Barnes. Brandon Russell to the line for 3 free throws. [BONUS: 5 team fouls] (Jabari Barnes: 1 personal fouls)   FT 1/3: MISS   FT 2/3: GOOD   FT 3/3: GOOD Brandon Russell makes 2/3 from the line.
Score: 61-59

[04:45] Team_078 possession (Score: 61-59)
FOUL! Holding foul on Draymond Banchero. [Team fouls: 2] No free throws, side out. (Draymond Banchero: 1 personal fouls)

[04:30] Team_078 possession (Score: 61-59)
Jabari Barnes attempts a Midrange. Contested by Jayson Holiday (4.5 feet, ZONE). Jabari Barnes misses. Rebound secured by Michael Russell.

[04:14] Team_061 possession (Score: 61-59)
FOUL! Shooting foul on Jabari Barrett. Draymond Banchero to the line for 2 free throws. [BONUS: 6 team fouls] (Jabari Barrett: 1 personal fouls)   FT 1/2: MISS   FT 2/2: MISS Draymond Banchero makes 0/2 from the line. Rebound secured by Ben Ginobili.

[04:02] Team_078 possession (Score: 61-59)
Jabari Barrett loses the ball! Stripped by Draymond Banchero! TURNOVER! (live ball)

[03:44] Team_061 possession (Score: 61-59)
Bam Sexton attempts a Midrange. Contested by Ben Ginobili (5.3 feet, MAN). Bam Sexton misses. Rebound secured by Jabari Barrett.

[03:35] Team_078 possession (Score: 61-59)
Isaiah Simmons attempts a 3Pt. Contested by Brandon Russell (4.2 feet, ZONE). Isaiah Simmons misses. Rebound secured by Draymond Banchero.

[03:17] Team_061 possession (Score: 61-59)
Brandon Russell drives and kicks out. Draymond Banchero makes the Midrange and draws the foul on Jabari Barrett! And-1! Draymond Banchero to the line for 1. [BONUS: 7 team fouls] (Jabari Barrett: 2 personal fouls)   FT 1/1: GOOD Draymond Banchero makes 1/1 from the line.
Score: 61-62

[03:02] Team_078 possession (Score: 61-62)
Ben Ginobili attempts a Midrange. Contested by Bam Sexton (5.3 feet, MAN). Ben Ginobili misses. Offensive rebound by Jabari Barrett! Jabari Barrett kicks it out.

[02:47] Team_078 possession (Score: 61-62)
Kyrie Carter makes the Dunk and draws the foul on Jayson Holiday! And-1! Kyrie Carter to the line for 1. [Team fouls: 3] (Jayson Holiday: 1 personal fouls)   FT 1/1: MISS Kyrie Carter makes 0/1 from the line. Rebound secured by Bam Sexton.
Score: 63-62

[02:36] Team_061 possession (Score: 63-62)
Bam Sexton drives, Jabari Barrett stays with him. Bam Sexton attempts a Layup. Contested by Jabari Barrett (5.4 feet, ZONE). BAM SEXTON MAKES IT! Assist: Draymond Banchero
Score: 63-64

[02:22] Team_078 possession (Score: 63-64)
Jabari Barnes attempts a 3Pt. Contested by Brandon Russell (4.5 feet, ZONE). Jabari Barnes misses. Rebound secured by Bam Sexton.

[02:09] Team_061 possession (Score: 63-64)
Draymond Banchero attempts a Midrange. Contested by Jabari Barrett (5.6 feet, MAN). Draymond Banchero misses. Offensive rebound by Draymond Banchero! Draymond Banchero's putback is no good. Rebound secured by Ben Ginobili.

[01:51] Team_078 possession (Score: 63-64)
Jabari Barrett attempts a 3Pt. Contested by Draymond Banchero (2.9 feet, MAN). Jabari Barrett misses. Rebound secured by Michael Russell.

[01:36] Team_061 possession (Score: 63-64)
Michael Russell commits a violation (traveling/carry)! TURNOVER! (dead ball)

[01:36] Substitution (Team_078): Jabari Barnes OUT → Magic Barrett IN (stamina_rule2)

[01:36] Substitution (Team_078): Kyrie Carter OUT → Damian Allen IN (stamina_rule2)

[01:36] Substitution (Team_078): Isaiah Simmons OUT → Malcolm Randle IN (stamina_rule2)

[01:36] Substitution (Team_078): Ben Ginobili OUT → Paul Ming IN (stamina_rule2)

[01:36] Substitution (Team_078): Jabari Barrett OUT → Draymond Irving IN (stamina_rule2)

[01:36] Substitution (Team_061): Brandon Russell OUT → Evan Rose IN (stamina_rule2)

[01:36] Substitution (Team_061): Jayson Holiday OUT → Gary Fox IN (stamina_rule2)

[01:36] Substitution (Team_061): Michael Russell OUT → Desmond Morant IN (stamina_rule2)

[01:36] Substitution (Team_061): Bam Sexton OUT → Stephen Towns IN (stamina_rule2)

[01:36] Substitution (Team_061): Draymond Banchero OUT → Tim Durant IN (stamina_rule2)

[01:23] Team_078 possession (Score: 63-64)
Malcolm Randle attempts a Layup. Contested by Desmond Morant (4.7 feet, MAN). Malcolm Randle misses. FOUL! Loose ball foul on Stephen Towns during the rebound battle. [Team fouls: 4] No free throws, side out. (Stephen Towns: 1 personal fouls)

[01:08] Team_078 possession (Score: 63-64)
Paul Ming attempts a 3Pt. Contested by Desmond Morant (4.5 feet, ZONE). Paul Ming misses. Rebound secured by Desmond Morant.

[00:54] Team_061 possession (Score: 63-64)
Desmond Morant attempts a 3Pt. Contested by Damian Allen (5.2 feet, ZONE). Desmond Morant misses. Rebound secured by Paul Ming.

[00:38] Team_078 possession (Score: 63-64)
Paul Ming attempts a 3Pt. Contested by Stephen Towns (4.8 feet, MAN). Paul Ming misses. Rebound secured by Tim Durant.

[00:20] Team_061 possession (Score: 63-64)
Stephen Towns attempts a 3Pt. Contested by Paul Ming (4.6 feet, MAN). Stephen Towns misses. Rebound secured by Malcolm Randle.

[00:10] Team_078 possession (Score: 63-64)
Magic Barrett attempts a 3Pt. Contested by Desmond Morant (5.0 feet, ZONE). MAGIC BARRETT MAKES IT! Assist: Paul Ming
Score: 66-64

================================================================================
                              3RD QUARTER COMPLETE                              
================================================================================

3RD QUARTER SCORE: Team_078 16, Team_061 21

BOX SCORE:
================================================================================

Team_078
--------------------------------------------------------------------------------
Player                MIN  PTS  REB  AST  TO      FG   FG%      3P   3P%
--------------------------------------------------------------------------------
Isaiah Simmons         25    6    1    0   0   3/5    60.0     0/0   0.0
Kyrie Carter           25    5    0    0   0   2/4    50.0     0/0   0.0
Magic Barrett          11    3    0    0   0   1/1   100.0     0/0   0.0
Jabari Barrett         25    0    6    1   0   0/1     0.0     0/0   0.0
Jabari Barnes          25    0    0    1   0   0/4     0.0     0/0   0.0
Paul Ming              11    0    2    1   0   0/2     0.0     0/0   0.0
Malcolm Randle         11    0    1    0   0   0/0     0.0     0/0   0.0

TEAM: FG: 6/20 (30.0%), 3PT: 3/11 (27.3%), REB: 14 (4 off, 10 def), AST: 4, TO: 3
TEAM FOULS: 7 [Team_061 in BONUS]


Team_061
--------------------------------------------------------------------------------
Player                MIN  PTS  REB  AST  TO      FG   FG%      3P   3P%
--------------------------------------------------------------------------------
Michael Russell        25    5    4    0   0   2/2   100.0     0/0   0.0
Brandon Russell        25    5    0    2   0   2/2   100.0     0/0   0.0
Draymond Banchero      25    5    4    1   0   2/5    40.0     0/0   0.0
Jayson Holiday         25    4    0    1   0   1/5    20.0     0/0   0.0
Bam Sexton             25    2    4    0   0   1/3    33.3     0/0   0.0
Ben Ginobili           25    0    4    1   0   0/3     0.0     0/0   0.0
Desmond Morant         11    0    1    0   0   0/1     0.0     0/0   0.0
Tim Durant             11    0    1    0   0   0/0     0.0     0/0   0.0
Stephen Towns          11    0    0    0   0   0/1     0.0     0/0   0.0

TEAM: FG: 8/19 (42.1%), 3PT: 4/9 (44.4%), REB: 14 (2 off, 12 def), AST: 4, TO: 3
TEAM FOULS: 4

================================================================================

================================================================================
                       4TH QUARTER - Team_078 vs Team_061                       
================================================================================

[12:00] Team_078 possession (Score: 66-64)
Ben Ginobili attempts a Layup. Contested by Bam Sexton (5.2 feet, MAN). Ben Ginobili misses. Rebound secured by Bam Sexton.

[11:43] Team_061 possession (Score: 66-64)
Michael Russell attempts a 3Pt. Contested by Isaiah Simmons (3.4 feet, ZONE). MICHAEL RUSSELL MAKES IT! Assist: Bam Sexton
Score: 66-67

[11:30] Team_078 possession (Score: 66-67)
Kyrie Carter attempts a Midrange. Contested by Jayson Holiday (4.0 feet, MAN). KYRIE CARTER MAKES IT!
Score: 68-67

[11:15] Team_061 possession (Score: 68-67)
Draymond Banchero loses the ball! Stripped by Jabari Barrett! TURNOVER! (live ball)

[10:56] Team_078 possession (Score: 68-67)
Ben Ginobili attempts a Midrange. Contested by Bam Sexton (5.2 feet, ZONE). BEN GINOBILI MAKES IT!
Score: 70-67

[10:42] Team_061 possession (Score: 70-67)
Draymond Banchero drives, Jabari Barrett stays with him. Draymond Banchero attempts a Layup. Contested by Jabari Barrett (5.6 feet, ZONE). Draymond Banchero misses. Rebound secured by Isaiah Simmons.

[10:29] Team_078 possession (Score: 70-67)
Jabari Barrett drives, picks up Draymond Banchero. Help arrives from Jayson Holiday! Jabari Barrett attempts a Layup. Contested by Jayson Holiday (2.8 feet, ZONE). JABARI BARRETT MAKES IT! Assist: Jabari Barnes
Score: 72-67

[10:14] Team_061 possession (Score: 72-67)
Brandon Russell attempts a 3Pt. Contested by Isaiah Simmons (3.5 feet, ZONE). Brandon Russell misses. Rebound secured by Isaiah Simmons.

[09:58] Team_078 possession (Score: 72-67)
Jabari Barrett attempts a Midrange. Contested by Jayson Holiday (4.3 feet, ZONE). JABARI BARRETT MAKES IT! Assist: Isaiah Simmons
Score: 74-67

[09:40] Team_061 possession (Score: 74-67)
Michael Russell drives, Jabari Barrett stays with him. Michael Russell attempts a Layup. Contested by Jabari Barrett (5.3 feet, ZONE). MICHAEL RUSSELL MAKES IT! Assist: Brandon Russell
Score: 74-69

[09:28] Team_078 possession (Score: 74-69)
Kyrie Carter attempts a Layup. Contested by Jayson Holiday (4.2 feet, MAN). KYRIE CARTER MAKES IT! Assist: Jabari Barnes
Score: 76-69

[09:15] Team_061 possession (Score: 76-69)
Draymond Banchero attempts a Layup. Contested by Jabari Barrett (5.7 feet, ZONE). DRAYMOND BANCHERO MAKES IT! Assist: Michael Russell
Score: 76-71

[08:57] Team_078 possession (Score: 76-71)
Ben Ginobili attempts a Layup. Contested by Bam Sexton (5.4 feet, MAN). BEN GINOBILI MAKES IT! Assist: Isaiah Simmons
Score: 78-71

[08:43] Team_061 possession (Score: 78-71)
Jayson Holiday attempts a Midrange. Contested by Kyrie Carter (4.6 feet, MAN). Jayson Holiday misses. Rebound secured by Jabari Barrett.

[08:28] Team_078 possession (Score: 78-71)
FOUL! Shooting foul on Bam Sexton. Ben Ginobili to the line for 2 free throws. [Team fouls: 1] (Bam Sexton: 1 personal fouls)   FT 1/2: GOOD   FT 2/2: GOOD Ben Ginobili makes 2/2 from the line.
Score: 80-71

[08:12] Team_061 possession (Score: 80-71)
Bam Sexton attempts a Midrange. Contested by Ben Ginobili (5.6 feet, MAN). Bam Sexton misses. Offensive rebound by Draymond Banchero! Draymond Banchero puts it back in!
Score: 80-73

[07:53] Team_078 possession (Score: 80-73)
Kyrie Carter drives, Jayson Holiday stays with him. Kyrie Carter attempts a Dunk. Contested by Jayson Holiday (4.4 feet, MAN). KYRIE CARTER MAKES IT! Assist: Ben Ginobili
Score: 82-73

[07:35] Team_061 possession (Score: 82-73)
Brandon Russell attempts a 3Pt. Contested by Jabari Barnes (4.8 feet, MAN). Brandon Russell misses. FOUL! Loose ball foul on Ben Ginobili during the rebound battle. [Team fouls: 1] No free throws, side out. (Ben Ginobili: 1 personal fouls)

[07:20] Team_061 possession (Score: 82-73)
FOUL! Reach-in foul on Jabari Barnes during the drive. [Team fouls: 2] No free throws, side out. (Jabari Barnes: 1 personal fouls)

[07:05] Team_061 possession (Score: 82-73)
Bam Sexton attempts a Layup. Contested by Jabari Barrett (5.7 feet, ZONE). BAM SEXTON MAKES IT! Assist: Jayson Holiday
Score: 82-75

[06:51] Team_078 possession (Score: 82-75)
Jabari Barnes attempts a Midrange. Contested by Michael Russell (4.8 feet, ZONE). JABARI BARNES MAKES IT!
Score: 84-75

[06:35] Team_061 possession (Score: 84-75)
Brandon Russell attempts a 3Pt. Contested by Isaiah Simmons (4.0 feet, ZONE). Brandon Russell misses. Rebound secured by Ben Ginobili.

[06:20] Team_078 possession (Score: 84-75)
Isaiah Simmons attempts a 3Pt. Contested by Michael Russell (4.7 feet, MAN). Isaiah Simmons misses. Rebound secured by Draymond Banchero.

[06:05] Team_061 possession (Score: 84-75)
Jayson Holiday drives and kicks out. Brandon Russell attempts a Midrange. Contested by Kyrie Carter (4.6 feet, ZONE). Brandon Russell misses. Rebound secured by Ben Ginobili.

[05:53] Team_078 possession (Score: 84-75)
Ben Ginobili drives, Draymond Banchero stays with him. Ben Ginobili attempts a Dunk. Contested by Draymond Banchero (3.6 feet, ZONE). BEN GINOBILI MAKES IT! Assist: Jabari Barrett
Score: 86-75

[05:39] Team_061 possession (Score: 86-75)
Michael Russell makes the Dunk and draws the foul on Jabari Barrett! And-1! Michael Russell to the line for 1. [Team fouls: 3] (Jabari Barrett: 1 personal fouls)   FT 1/1: GOOD Michael Russell makes 1/1 from the line.
Score: 86-78

[05:28] Team_078 possession (Score: 86-78)
FOUL! Shooting foul on Bam Sexton. Ben Ginobili to the line for 2 free throws. [Team fouls: 2] (Bam Sexton: 2 personal fouls)   FT 1/2: GOOD   FT 2/2: GOOD Ben Ginobili makes 2/2 from the line.
Score: 88-78

[05:15] Team_061 possession (Score: 88-78)
Jayson Holiday attempts a Layup. Contested by Jabari Barrett (5.9 feet, ZONE). Jayson Holiday misses. Rebound secured by Jabari Barrett.

[05:03] Team_078 possession (Score: 88-78)
Ben Ginobili drives, Bam Sexton stays with him. Ben Ginobili attempts a Layup. Contested by Bam Sexton (5.7 feet, MAN). BEN GINOBILI MAKES IT! Assist: Jabari Barrett
Score: 90-78

[04:45] Team_061 possession (Score: 90-78)
Michael Russell attempts a 3Pt. Contested by Isaiah Simmons (4.3 feet, ZONE). MICHAEL RUSSELL MAKES IT!
Score: 90-81

[04:33] Team_078 possession (Score: 90-81)
Jabari Barrett attempts a Midrange. Contested by Jayson Holiday (4.9 feet, ZONE). JABARI BARRETT MAKES IT! Assist: Jabari Barnes
Score: 92-81

[04:18] Team_061 possession (Score: 92-81)
Michael Russell attempts a 3Pt. Contested by Isaiah Simmons (4.4 feet, MAN). Michael Russell misses. Rebound secured by Isaiah Simmons.

[04:04] Team_078 possession (Score: 92-81)
Jabari Barrett drives and kicks out. Ben Ginobili attempts a Midrange. Contested by Bam Sexton (5.7 feet, MAN). Ben Ginobili misses. Rebound secured by Michael Russell.

[03:54] Team_061 possession (Score: 92-81)
Jayson Holiday attempts a Midrange. Contested by Kyrie Carter (5.2 feet, ZONE). Jayson Holiday misses. Offensive rebound by Bam Sexton! Bam Sexton kicks it out.

[03:41] Team_061 possession (Score: 92-81)
Michael Russell attempts a Midrange. Contested by Isaiah Simmons (4.5 feet, MAN). Michael Russell misses. Rebound secured by Ben Ginobili.

[03:27] Team_078 possession (Score: 92-81)
Ben Ginobili drives, picks up Draymond Banchero. Help arrives from Jayson Holiday! Ben Ginobili attempts a Layup. Contested by Jayson Holiday (4.0 feet, ZONE). Ben Ginobili misses. Rebound secured by Bam Sexton.

[03:09] Team_061 possession (Score: 92-81)
Draymond Banchero drives and kicks out. Bam Sexton attempts a Midrange. Contested by Ben Ginobili (6.0 feet, MAN). BAM SEXTON MAKES IT!
Score: 92-83

[02:50] Team_078 possession (Score: 92-83)
Jabari Barrett drives and kicks out. Isaiah Simmons attempts a 3Pt. Contested by Michael Russell (5.3 feet, MAN). Isaiah Simmons misses. Rebound secured by Bam Sexton.

[02:39] Team_061 possession (Score: 92-83)
Bam Sexton attempts a Layup. Wide open! Jabari Barrett is 6.3 feet away. [ZONE] Bam Sexton misses. Rebound secured by Ben Ginobili.

[02:27] Team_078 possession (Score: 92-83)
Jabari Barnes attempts a Midrange. Contested by Jayson Holiday (5.6 feet, ZONE). JABARI BARNES MAKES IT!
Score: 94-83

[02:11] Team_061 possession (Score: 94-83)
FOUL! Holding foul on Ben Ginobili. [Team fouls: 4] No free throws, side out. (Ben Ginobili: 2 personal fouls)

[01:56] Team_061 possession (Score: 94-83)
Michael Russell attempts a 3Pt. Contested by Kyrie Carter (5.4 feet, ZONE). Michael Russell misses. Offensive rebound by Draymond Banchero! Draymond Banchero's putback is no good. Offensive rebound by Bam Sexton! Bam Sexton kicks it out.

[01:36] Team_061 possession (Score: 94-83)
Jayson Holiday makes the Layup and draws the foul on Kyrie Carter! And-1! Jayson Holiday to the line for 1. [BONUS: 5 team fouls] (Kyrie Carter: 1 personal fouls)   FT 1/1: MISS Jayson Holiday makes 0/1 from the line. Rebound secured by Ben Ginobili.
Score: 94-85

[01:23] Team_078 possession (Score: 94-85)
Isaiah Simmons attempts a 3Pt. Contested by Brandon Russell (5.2 feet, ZONE). ISAIAH SIMMONS MAKES IT! Assist: Jabari Barnes
Score: 97-85

[01:04] Team_061 possession (Score: 97-85)
Bam Sexton attempts a Layup. Wide open! Jabari Barrett is 6.5 feet away. [ZONE] BAM SEXTON MAKES IT! Assist: Draymond Banchero
Score: 97-87

[00:47] Team_078 possession (Score: 97-87)
Ben Ginobili attempts a 3Pt. Contested by Brandon Russell (5.3 feet, ZONE). Ben Ginobili misses. Offensive rebound by Isaiah Simmons! Isaiah Simmons kicks it out.

[00:31] Team_078 possession (Score: 97-87)
Ben Ginobili attempts a 3Pt. Wide open! Bam Sexton is 6.1 feet away. [MAN] Ben Ginobili misses. Offensive rebound by Isaiah Simmons! Isaiah Simmons kicks it out.

[00:17] Team_078 possession (Score: 97-87)
Kyrie Carter attempts a 3Pt. Contested by Jayson Holiday (5.5 feet, MAN). Kyrie Carter misses. Offensive rebound by Isaiah Simmons! Isaiah Simmons kicks it out.

================================================================================
                              4TH QUARTER COMPLETE                              
================================================================================

4TH QUARTER SCORE: Team_078 31, Team_061 23

BOX SCORE:
================================================================================

Team_078
--------------------------------------------------------------------------------
Player                MIN  PTS  REB  AST  TO      FG   FG%      3P   3P%
--------------------------------------------------------------------------------
Ben Ginobili           38   12    5    1   0   6/8    75.0     0/0   0.0
Kyrie Carter           38    6    0    0   0   3/3   100.0     0/0   0.0
Jabari Barrett         38    6    2    2   0   3/5    60.0     0/0   0.0
Jabari Barnes          38    4    0    4   0   2/2   100.0     0/0   0.0
Isaiah Simmons         38    3    6    2   0   1/2    50.0     0/0   0.0

TEAM: FG: 15/20 (75.0%), 3PT: 1/2 (50.0%), REB: 13 (3 off, 10 def), AST: 9, TO: 0
TEAM FOULS: 5 [Team_061 in BONUS]


Team_061
--------------------------------------------------------------------------------
Player                MIN  PTS  REB  AST  TO      FG   FG%      3P   3P%
--------------------------------------------------------------------------------
Michael Russell        38   11    1    1   0   4/6    66.7     0/0   0.0
Bam Sexton             38    6    5    1   0   3/4    75.0     0/0   0.0
Draymond Banchero      38    4    3    1   0   2/3    66.7     0/0   0.0
Brandon Russell        38    0    0    1   0   0/2     0.0     0/0   0.0
Jayson Holiday         38    0    0    1   0   0/4     0.0     0/0   0.0

TEAM: FG: 9/19 (47.4%), 3PT: 2/5 (40.0%), REB: 9 (4 off, 5 def), AST: 5, TO: 1
TEAM FOULS: 2

================================================================================

================================================================================
                               FULL GAME COMPLETE                               
================================================================================

FINAL SCORE: Team_078 97, Team_061 87

SCORING BY QUARTER:
--------------------------------------------------------------------------------
Team                     Q1     Q2     Q3     Q4    FINAL
--------------------------------------------------------------------------------
Team_078                 25     25     16     31       97
Team_061                 28     15     21     23       87
--------------------------------------------------------------------------------

FULL GAME BOX SCORE:
================================================================================

Team_078
--------------------------------------------------------------------------------
Player                MIN  PTS  REB  AST  TO      FG   FG%      3P   3P%      FT STL BLK
--------------------------------------------------------------------------------
Jabari Barnes          38    6    0    5   2   3/8    37.5   0/3     0.0   0/0     0   0
Kyrie Carter           38   14    0    2   3   7/10   70.0   3/5    60.0   0/1     0   0
Isaiah Simmons         38   19   13    4   0   6/12   50.0   3/7    42.9   1/2     2   1
Ben Ginobili           38   18   10    3   0  11/18   61.1   1/1   100.0   4/4     1   0
Jabari Barrett         38   12   13    4   2   6/13   46.2   0/2     0.0   1/2     2   0
Magic Barrett          11   13    0    1   1   4/6    66.7   2/3    66.7   0/0     0   0
Damian Allen           11    0    0    1   0   1/4    25.0   0/2     0.0   0/0     0   0
Malcolm Randle         11    2    1    2   0   1/1   100.0   0/0     0.0   0/0     0   0
Paul Ming              11    0    6    2   1   0/2     0.0   0/2     0.0   0/0     1   0
Draymond Irving        11   10    6    2   1   5/5   100.0   0/0     0.0   2/2     1   0

TEAM: FG: 44/79 (55.7%), 3PT: 9/25 (36.0%), REB: 49 (16 off, 33 def), AST: 26, TO: 10


Team_061
--------------------------------------------------------------------------------
Player                MIN  PTS  REB  AST  TO      FG   FG%      3P   3P%      FT STL BLK
--------------------------------------------------------------------------------
Brandon Russell        38    5    0    3   4   4/7    57.1   3/6    50.0   2/3     1   0
Jayson Holiday         38    6    0    4   1   2/11   18.2   1/5    20.0   3/4     1   1
Michael Russell        38   21    9    1   3   7/9    77.8   4/5    80.0   3/3     0   0
Bam Sexton             38   17   13    2   0   8/13   61.5   0/1     0.0   3/3     1   0
Draymond Banchero      38   20   12    3   4   8/14   57.1   0/0     0.0   5/9     1   1
Evan Rose              11    1    0    1   1   1/3    33.3   1/2    50.0   1/3     0   1
Gary Fox               11    2    0    1   1   1/2    50.0   0/0     0.0   0/0     0   0
Desmond Morant         11    0    1    1   0   0/2     0.0   0/2     0.0   0/0     0   0
Stephen Towns          11    9    4    0   1   3/6    50.0   3/4    75.0   0/0     0   0
Tim Durant             11    2    2    1   2   1/2    50.0   0/0     0.0   1/2     1   0

TEAM: FG: 35/69 (50.7%), 3PT: 12/25 (48.0%), REB: 41 (8 off, 33 def), AST: 17, TO: 17

================================================================================
