================================================================================
                        FULL GAME - Team_087 vs Team_022                        
================================================================================

================================================================================
                       1ST QUARTER - Team_087 vs Team_022                       
================================================================================

[12:00] Team_087 possession (Score: 0-0)
Jimmy Ming attempts a 3Pt. Contested by Michael Ginobili (4.2 feet, MAN). Jimmy Ming misses. Rebound secured by Michael Ginobili.

[11:49] Team_022 possession (Score: 0-0)
Myles Anthony throws a bad pass! Stolen by Devin Anunoby! TURNOVER! (live ball)

[11:38] Team_087 possession (Score: 0-0)
FOUL! Holding foul on Malcolm Allen. [Team fouls: 1] No free throws, side out. (Malcolm Allen: 1 personal fouls)

[11:27] Team_087 possession (Score: 0-0)
Malcolm Embiid drives, Lamelo Dosunmu stays with him. Malcolm Embiid attempts a Dunk. Contested by Lamelo Dosunmu (4.9 feet, ZONE). Malcolm Embiid misses. Rebound secured by Myles Anthony.

[11:18] Team_022 possession (Score: 0-0)
Myles Anthony drives and kicks out. Malcolm Allen attempts a Midrange. Contested by Malcolm Embiid (3.3 feet, ZONE). Malcolm Allen misses. Rebound secured by Devin Anunoby.

[11:05] Team_087 possession (Score: 0-0)
FOUL! Shooting foul on Myles Anthony. Devin Anunoby to the line for 2 free throws. [Team fouls: 2] (Myles Anthony: 1 personal fouls)   FT 1/2: GOOD   FT 2/2: MISS Devin Anunoby makes 1/2 from the line. FOUL! Loose ball foul on Dirk Markkanen during the free throw rebound! [Team fouls: 3] No free throws, side out. (Dirk Markkanen: 1 personal fouls)
Score: 1-0

[10:51] Team_087 possession (Score: 1-0)
FOUL! Reach-in foul on Malcolm Allen during the drive. [Team fouls: 4] No free throws, side out. (Malcolm Allen: 2 personal fouls)

[10:38] Team_087 possession (Score: 1-0)
Malcolm Embiid attempts a 3Pt. Contested by Michael Ginobili (3.8 feet, ZONE). Malcolm Embiid misses. Rebound secured by Dirk Markkanen.

[10:25] Team_022 possession (Score: 1-0)
Lamelo Dosunmu attempts a 3Pt. Contested by Malcolm Embiid (3.8 feet, MAN). Lamelo Dosunmu misses. Offensive rebound by Michael Ginobili! Michael Ginobili kicks it out.

[10:08] Team_022 possession (Score: 1-0)
Dirk Markkanen drives, Malcolm Embiid stays with him. Dirk Markkanen attempts a Layup. Contested by Malcolm Embiid (3.8 feet, MAN). DIRK MARKKANEN MAKES IT! Assist: Malcolm Allen
Score: 1-2

[09:53] Team_087 possession (Score: 1-2)
Jimmy Ming loses control! Ball rolls out of bounds! TURNOVER! (dead ball)

[09:39] Team_022 possession (Score: 1-2)
Dirk Markkanen drives to the basket... Dirk Markkanen throws a bad pass out of bounds! TURNOVER! (dead ball)

[09:25] Team_087 possession (Score: 1-2)
Ben Brogdon drives to the basket... FOUL! Offensive foul on Ben Brogdon! Dirk Markkanen drew the charge! [Team fouls: 1] (Ben Brogdon: 1 personal fouls) TURNOVER! (dead ball)

[09:10] Team_022 possession (Score: 1-2)
FOUL! Shooting foul on Malcolm Embiid. Myles Anthony to the line for 2 free throws. [Team fouls: 2] (Malcolm Embiid: 1 personal fouls)   FT 1/2: GOOD   FT 2/2: MISS Myles Anthony makes 1/2 from the line. FOUL! Loose ball foul on Ben Brogdon during the free throw rebound! [Team fouls: 3] No free throws, side out. (Ben Brogdon: 2 personal fouls)
Score: 1-3

[08:54] Team_022 possession (Score: 1-3)
Myles Anthony throws a bad pass! Stolen by Devin Anunoby! TURNOVER! (live ball)

[08:40] Team_087 possession (Score: 1-3)
Jimmy Ming drives, picks up Michael Ginobili. Help arrives from Myles Anthony! Jimmy Ming attempts a Layup. Contested by Myles Anthony (4.2 feet, MAN). JIMMY MING MAKES IT!
Score: 3-3

[08:30] Team_022 possession (Score: 3-3)
Michael Ginobili drives to the basket... Michael Ginobili throws a bad pass out of bounds! TURNOVER! (dead ball)

[08:14] Team_087 possession (Score: 3-3)
Malcolm Embiid drives, Lamelo Dosunmu stays with him. Malcolm Embiid attempts a Dunk. Contested by Lamelo Dosunmu (4.9 feet, MAN). MALCOLM EMBIID MAKES IT!
Score: 5-3

[07:59] Team_022 possession (Score: 5-3)
Dirk Markkanen drives and kicks out. Michael Ginobili attempts a 3Pt. Contested by Allen Mitchell (4.8 feet, ZONE). MICHAEL GINOBILI MAKES IT! Assist: Lamelo Dosunmu
Score: 5-6

[07:48] Team_087 possession (Score: 5-6)
FOUL! Holding foul on Dirk Markkanen. [IN THE BONUS! 5 team fouls] Ben Brogdon to the line for 2 free throws. (Dirk Markkanen: 2 personal fouls)   FT 1/2: GOOD   FT 2/2: GOOD Ben Brogdon makes 2/2 from the line.
Score: 7-6

[07:37] Team_022 possession (Score: 7-6)
Lamelo Dosunmu loses the ball! Stripped by Malcolm Embiid! TURNOVER! (live ball)

[07:23] Team_087 possession (Score: 7-6)
Jimmy Ming attempts a Layup. Contested by Dirk Markkanen (5.3 feet, ZONE). Jimmy Ming misses. Offensive rebound by Malcolm Embiid! Malcolm Embiid puts it back in!
Score: 9-6

[07:12] Team_022 possession (Score: 9-6)
Lamelo Dosunmu attempts a Midrange. Contested by Malcolm Embiid (3.8 feet, MAN). Lamelo Dosunmu misses. Rebound secured by Devin Anunoby.

[06:57] Team_087 possession (Score: 9-6)
Allen Mitchell attempts a Midrange. Contested by Michael Ginobili (3.9 feet, ZONE). Allen Mitchell misses. Rebound secured by Myles Anthony.

[06:38] Team_022 possession (Score: 9-6)
Malcolm Allen attempts a 3Pt. Contested by Allen Mitchell (5.5 feet, ZONE). Malcolm Allen misses. Rebound secured by Malcolm Embiid.

[06:24] Team_087 possession (Score: 9-6)
Allen Mitchell drives, Malcolm Allen stays with him. Allen Mitchell attempts a Dunk. Contested by Malcolm Allen (4.8 feet, MAN). Allen Mitchell misses. Rebound secured by Dirk Markkanen.

[06:07] Team_022 possession (Score: 9-6)
Dirk Markkanen attempts a Midrange. Contested by Malcolm Embiid (3.8 feet, MAN). DIRK MARKKANEN MAKES IT!
Score: 9-8

[05:52] Team_087 possession (Score: 9-8)
Devin Anunoby makes the 3Pt and draws the foul on Myles Anthony! And-1! Devin Anunoby to the line for 1. [BONUS: 6 team fouls] (Myles Anthony: 2 personal fouls)   FT 1/1: GOOD Devin Anunoby makes 1/1 from the line.
Score: 13-8

[05:37] Team_022 possession (Score: 13-8)
Myles Anthony drives to the basket... FOUL! Offensive foul on Myles Anthony! Devin Anunoby drew the charge! [Team fouls: 7] (Myles Anthony: 3 personal fouls) TURNOVER! (dead ball)

[05:25] Team_087 possession (Score: 13-8)
Allen Mitchell attempts a Layup. Contested by Dirk Markkanen (5.0 feet, ZONE). ALLEN MITCHELL MAKES IT! Assist: Malcolm Embiid
Score: 15-8

[05:10] Team_022 possession (Score: 15-8)
Lamelo Dosunmu attempts a 3Pt. Contested by Allen Mitchell (5.2 feet, ZONE). Lamelo Dosunmu misses. Offensive rebound by Michael Ginobili! Michael Ginobili kicks it out.

[04:55] Team_022 possession (Score: 15-8)
Dirk Markkanen attempts a Midrange. Contested by Malcolm Embiid (3.9 feet, MAN). DIRK MARKKANEN MAKES IT!
Score: 15-10

[04:44] Team_087 possession (Score: 15-10)
Allen Mitchell attempts a Layup. BLOCKED BY MALCOLM ALLEN! Ball deflects out of bounds off Allen Mitchell.

[04:29] Team_022 possession (Score: 15-10)
Dirk Markkanen attempts a Midrange. Contested by Malcolm Embiid (3.9 feet, MAN). Dirk Markkanen misses. Rebound secured by Devin Anunoby.

[04:15] Team_087 possession (Score: 15-10)
Devin Anunoby drives and kicks out. Ben Brogdon attempts a 3Pt. Contested by Lamelo Dosunmu (4.8 feet, ZONE). Ben Brogdon misses. Rebound secured by Michael Ginobili.

[03:56] Team_022 possession (Score: 15-10)
Michael Ginobili attempts a Midrange. Contested by Jimmy Ming (5.0 feet, ZONE). MICHAEL GINOBILI MAKES IT!
Score: 15-12

[03:44] Team_087 possession (Score: 15-12)
FOUL! Reach-in foul on Lamelo Dosunmu during the drive. [IN THE BONUS! 8 team fouls] Malcolm Embiid to the line for 2 free throws. (Lamelo Dosunmu: 1 personal fouls)   FT 1/2: GOOD   FT 2/2: GOOD Malcolm Embiid makes 2/2 from the line.
Score: 17-12

[03:28] Team_022 possession (Score: 17-12)
Myles Anthony attempts a Midrange. Contested by Ben Brogdon (5.4 feet, ZONE). Myles Anthony misses. Rebound secured by Ben Brogdon.

[03:10] Team_087 possession (Score: 17-12)
Devin Anunoby attempts a 3Pt. Contested by Myles Anthony (4.9 feet, MAN). DEVIN ANUNOBY MAKES IT! Assist: Allen Mitchell
Score: 20-12

[02:54] Team_022 possession (Score: 20-12)
FOUL! Holding foul on Malcolm Embiid. [Team fouls: 4] No free throws, side out. (Malcolm Embiid: 2 personal fouls)

[02:41] Team_022 possession (Score: 20-12)
Dirk Markkanen attempts a Midrange. Contested by Malcolm Embiid (4.1 feet, ZONE). Dirk Markkanen misses. Rebound secured by Malcolm Embiid.

[02:30] Team_087 possession (Score: 20-12)
Devin Anunoby drives and kicks out. FOUL! Shooting foul on Michael Ginobili. Devin Anunoby to the line for 2 free throws. [BONUS: 9 team fouls] (Michael Ginobili: 1 personal fouls)   FT 1/2: GOOD   FT 2/2: GOOD Devin Anunoby makes 2/2 from the line.
Score: 22-12

[02:16] Team_022 possession (Score: 22-12)
Dirk Markkanen attempts a 3Pt. Contested by Malcolm Embiid (4.2 feet, MAN). Dirk Markkanen misses. Rebound secured by Malcolm Embiid.

[02:01] Team_087 possession (Score: 22-12)
Devin Anunoby attempts a Midrange. Contested by Myles Anthony (5.0 feet, MAN). Devin Anunoby misses. Rebound secured by Myles Anthony.

[01:44] Team_022 possession (Score: 22-12)
Malcolm Allen attempts a 3Pt. Contested by Devin Anunoby (5.4 feet, ZONE). Malcolm Allen misses. Rebound secured by Ben Brogdon.

[01:31] Team_087 possession (Score: 22-12)
Jimmy Ming attempts a 3Pt. Contested by Michael Ginobili (4.6 feet, ZONE). Jimmy Ming misses. Rebound secured by Dirk Markkanen.

[01:19] Team_022 possession (Score: 22-12)
Malcolm Allen attempts a Midrange. Contested by Allen Mitchell (5.7 feet, MAN). MALCOLM ALLEN MAKES IT! Assist: Michael Ginobili
Score: 22-14

[01:00] Team_087 possession (Score: 22-14)
FOUL! Reach-in foul on Dirk Markkanen during the drive. [IN THE BONUS! 10 team fouls] Ben Brogdon to the line for 2 free throws. (Dirk Markkanen: 3 personal fouls)   FT 1/2: MISS   FT 2/2: GOOD Ben Brogdon makes 1/2 from the line.
Score: 23-14

[00:42] Team_022 possession (Score: 23-14)
Michael Ginobili attempts a 3Pt. Contested by Allen Mitchell (5.2 feet, ZONE). Michael Ginobili misses. Rebound secured by Malcolm Embiid.

[00:25] Team_087 possession (Score: 23-14)
Ben Brogdon attempts a Layup. Contested by Dirk Markkanen (5.4 feet, ZONE). Ben Brogdon misses. FOUL! Loose ball foul on Dirk Markkanen during the rebound battle. [IN THE BONUS! 11 team fouls] Malcolm Embiid to the line for 2 free throws. (Dirk Markkanen: 4 personal fouls)   FT 1/2: GOOD   FT 2/2: GOOD Malcolm Embiid makes 2/2 from the line.
Score: 25-14

[00:13] Team_022 possession (Score: 25-14)
Dirk Markkanen makes the Layup and draws the foul on Malcolm Embiid! And-1! Dirk Markkanen to the line for 1. [BONUS: 5 team fouls] (Malcolm Embiid: 3 personal fouls)   FT 1/1: GOOD Dirk Markkanen makes 1/1 from the line.
Score: 25-17

================================================================================
                              1ST QUARTER COMPLETE                              
================================================================================

1ST QUARTER SCORE: Team_087 25, Team_022 17

BOX SCORE:
================================================================================

Team_087
--------------------------------------------------------------------------------
Player                MIN  PTS  REB  AST  TO      FG   FG%      3P   3P%
--------------------------------------------------------------------------------
Devin Anunoby          12    9    3    0   0   3/5    60.0     0/0   0.0
Malcolm Embiid         12    8    6    1   0   4/6    66.7     0/0   0.0
Ben Brogdon            12    3    2    0   0   2/2   100.0     0/0   0.0
Jimmy Ming             12    2    0    0   0   1/3    33.3     0/0   0.0
Allen Mitchell         12    2    0    1   0   1/4    25.0     0/0   0.0

TEAM: FG: 11/20 (55.0%), 3PT: 2/5 (40.0%), REB: 11 (2 off, 9 def), AST: 2, TO: 2
TEAM FOULS: 5 [Team_022 in BONUS]


Team_022
--------------------------------------------------------------------------------
Player                MIN  PTS  REB  AST  TO      FG   FG%      3P   3P%
--------------------------------------------------------------------------------
Dirk Markkanen         12    9    4    0   0   4/7    57.1     0/0   0.0
Michael Ginobili       12    5    4    1   0   2/3    66.7     0/0   0.0
Malcolm Allen          12    2    0    1   0   1/3    33.3     0/0   0.0
Myles Anthony          12    0    3    0   0   0/2     0.0     0/0   0.0
Lamelo Dosunmu         12    0    0    1   0   0/1     0.0     0/0   0.0

TEAM: FG: 7/16 (43.8%), 3PT: 0/4 (0.0%), REB: 11 (3 off, 8 def), AST: 3, TO: 6
TEAM FOULS: 11 [Team_087 in BONUS]

================================================================================

================================================================================
                       2ND QUARTER - Team_087 vs Team_022                       
================================================================================

[12:00] Team_087 possession (Score: 25-17)
Jimmy Ming attempts a 3Pt. Contested by Michael Ginobili (4.5 feet, MAN). JIMMY MING MAKES IT! Assist: Devin Anunoby
Score: 28-17

[11:46] Team_022 possession (Score: 28-17)
Dirk Markkanen attempts a 3Pt. Contested by Malcolm Embiid (4.2 feet, MAN). Dirk Markkanen misses. Rebound secured by Malcolm Embiid.

[11:31] Team_087 possession (Score: 28-17)
Ben Brogdon attempts a 3Pt. Contested by Dirk Markkanen (5.3 feet, MAN). Ben Brogdon misses. Rebound secured by Michael Ginobili.

[11:13] Team_022 possession (Score: 28-17)
Dirk Markkanen drives, Malcolm Embiid stays with him. Dirk Markkanen attempts a Layup. Contested by Malcolm Embiid (4.2 feet, MAN). DIRK MARKKANEN MAKES IT! Assist: Michael Ginobili
Score: 28-19

[11:00] Team_087 possession (Score: 28-19)
Jimmy Ming attempts a 3Pt. Contested by Myles Anthony (5.6 feet, ZONE). JIMMY MING MAKES IT! Assist: Malcolm Embiid
Score: 31-19

[10:42] Team_022 possession (Score: 31-19)
FOUL! Holding foul on Malcolm Embiid. [Team fouls: 1] No free throws, side out. (Malcolm Embiid: 1 personal fouls)

[10:29] Team_022 possession (Score: 31-19)
Michael Ginobili attempts a 3Pt. Contested by Allen Mitchell (5.2 feet, ZONE). Michael Ginobili misses. Rebound secured by Ben Brogdon.

[10:11] Team_087 possession (Score: 31-19)
Devin Anunoby attempts a 3Pt. Contested by Myles Anthony (5.2 feet, MAN). Devin Anunoby misses. Offensive rebound by Devin Anunoby! Devin Anunoby kicks it out.

[09:55] Team_087 possession (Score: 31-19)
Allen Mitchell makes the Midrange and draws the foul on Malcolm Allen! And-1! Allen Mitchell to the line for 1. [Team fouls: 1] (Malcolm Allen: 1 personal fouls)   FT 1/1: GOOD Allen Mitchell makes 1/1 from the line.
Score: 34-19

[09:37] Team_022 possession (Score: 34-19)
Myles Anthony attempts a Midrange. Contested by Jimmy Ming (5.4 feet, ZONE). Myles Anthony misses. Rebound secured by Devin Anunoby.

[09:21] Team_087 possession (Score: 34-19)
Malcolm Embiid attempts a Midrange. Contested by Michael Ginobili (4.4 feet, ZONE). Malcolm Embiid misses. Rebound secured by Dirk Markkanen.

[09:12] Team_022 possession (Score: 34-19)
Malcolm Allen attempts a Midrange. Contested by Devin Anunoby (5.6 feet, ZONE). MALCOLM ALLEN MAKES IT!
Score: 34-21

[09:02] Team_087 possession (Score: 34-21)
FOUL! Holding foul on Malcolm Allen. [Team fouls: 2] No free throws, side out. (Malcolm Allen: 2 personal fouls)

[08:50] Team_087 possession (Score: 34-21)
Ben Brogdon makes the Layup and draws the foul on Lamelo Dosunmu! And-1! Ben Brogdon to the line for 1. [Team fouls: 3] (Lamelo Dosunmu: 1 personal fouls)   FT 1/1: GOOD Ben Brogdon makes 1/1 from the line.
Score: 37-21

[08:34] Team_022 possession (Score: 37-21)
Dirk Markkanen attempts a 3Pt. Contested by Malcolm Embiid (4.6 feet, MAN). DIRK MARKKANEN MAKES IT! Assist: Myles Anthony
Score: 37-24

[08:18] Team_087 possession (Score: 37-24)
FOUL! Shooting foul on Lamelo Dosunmu. Malcolm Embiid to the line for 2 free throws. [Team fouls: 4] (Lamelo Dosunmu: 2 personal fouls)   FT 1/2: GOOD   FT 2/2: GOOD Malcolm Embiid makes 2/2 from the line.
Score: 39-24

[08:02] Team_022 possession (Score: 39-24)
Dirk Markkanen attempts a Midrange. Contested by Malcolm Embiid (4.6 feet, MAN). Dirk Markkanen misses. Rebound secured by Devin Anunoby.

[07:50] Team_087 possession (Score: 39-24)
Jimmy Ming attempts a 3Pt. Contested by Michael Ginobili (5.0 feet, ZONE). JIMMY MING MAKES IT! Assist: Ben Brogdon
Score: 42-24

[07:38] Team_022 possession (Score: 42-24)
Lamelo Dosunmu drives to the basket... Lamelo Dosunmu throws a bad pass out of bounds! TURNOVER! (dead ball)

[07:38] Substitution (Team_087): Allen Mitchell OUT → Wendell Haliburton IN (stamina_rule2)

[07:38] Substitution (Team_087): Jimmy Ming OUT → Ben Lillard IN (stamina_rule2)

[07:38] Substitution (Team_087): Devin Anunoby OUT → Larry Green IN (stamina_rule2)

[07:38] Substitution (Team_087): Malcolm Embiid OUT → Pau Russell IN (stamina_rule2)

[07:38] Substitution (Team_087): Ben Brogdon OUT → Kristaps Young IN (stamina_rule2)

[07:38] Substitution (Team_022): Malcolm Allen OUT → DeMar Harden IN (stamina_rule2)

[07:38] Substitution (Team_022): Michael Ginobili OUT → Lauri Gobert IN (stamina_rule2)

[07:38] Substitution (Team_022): Myles Anthony OUT → Dejounte Towns IN (stamina_rule2)

[07:38] Substitution (Team_022): Lamelo Dosunmu OUT → Kawhi Russell IN (stamina_rule2)

[07:38] Substitution (Team_022): Dirk Markkanen OUT → Cole Iverson IN (stamina_rule2)

[07:22] Team_087 possession (Score: 42-24)
Pau Russell drives, Kawhi Russell stays with him. Pau Russell attempts a Dunk. Contested by Kawhi Russell (4.1 feet, ZONE). PAU RUSSELL MAKES IT! Assist: Kristaps Young
Score: 44-24

[07:10] Team_022 possession (Score: 44-24)
DeMar Harden attempts a Layup. BLOCKED BY KRISTAPS YOUNG! Ball is loose! Rebound secured by Larry Green.

[06:58] Team_087 possession (Score: 44-24)
FOUL! Shooting foul on Dejounte Towns. Larry Green to the line for 2 free throws. [BONUS: 5 team fouls] (Dejounte Towns: 1 personal fouls)   FT 1/2: GOOD   FT 2/2: GOOD Larry Green makes 2/2 from the line.
Score: 46-24

[06:44] Team_022 possession (Score: 46-24)
Kawhi Russell attempts a Layup. Contested by Kristaps Young (5.2 feet, ZONE). Kawhi Russell misses. Rebound secured by Larry Green.

[06:33] Team_087 possession (Score: 46-24)
Wendell Haliburton attempts a 3Pt. Contested by DeMar Harden (5.9 feet, ZONE). WENDELL HALIBURTON MAKES IT! Assist: Ben Lillard
Score: 49-24

[06:19] Team_022 possession (Score: 49-24)
FOUL! Shooting foul on Larry Green. Dejounte Towns to the line for 2 free throws. [Team fouls: 2] (Larry Green: 1 personal fouls)   FT 1/2: GOOD   FT 2/2: GOOD Dejounte Towns makes 2/2 from the line.
Score: 49-26

[06:08] Team_087 possession (Score: 49-26)
FOUL! Reach-in foul on Kawhi Russell during the drive. [IN THE BONUS! 6 team fouls] Pau Russell to the line for 2 free throws. (Kawhi Russell: 1 personal fouls)   FT 1/2: GOOD   FT 2/2: GOOD Pau Russell makes 2/2 from the line.
Score: 51-26

[05:52] Team_022 possession (Score: 51-26)
Lauri Gobert attempts a 3Pt. Contested by Ben Lillard (5.3 feet, MAN). Lauri Gobert misses. FOUL! Loose ball foul on Kristaps Young during the rebound battle. [Team fouls: 3] No free throws, side out. (Kristaps Young: 1 personal fouls)

[05:36] Team_022 possession (Score: 51-26)
Cole Iverson attempts a Midrange. Contested by Larry Green (4.1 feet, ZONE). COLE IVERSON MAKES IT! Assist: Kawhi Russell
Score: 51-28

[05:24] Team_087 possession (Score: 51-28)
Wendell Haliburton attempts a 3Pt. Contested by DeMar Harden (5.9 feet, MAN). Wendell Haliburton misses. Rebound secured by Kawhi Russell.

[05:10] Team_022 possession (Score: 51-28)
Lauri Gobert attempts a 3Pt. Contested by Pau Russell (4.8 feet, ZONE). Lauri Gobert misses. Rebound secured by Kristaps Young.

[04:52] Team_087 possession (Score: 51-28)
Larry Green attempts a 3Pt. Contested by Kawhi Russell (4.4 feet, ZONE). Larry Green misses. Offensive rebound by Larry Green! Larry Green kicks it out.

[04:37] Team_087 possession (Score: 51-28)
Wendell Haliburton attempts a 3Pt. Contested by Kawhi Russell (4.6 feet, ZONE). Wendell Haliburton misses. Offensive rebound by Kristaps Young! Kristaps Young's putback is no good. Rebound secured by Kawhi Russell.

[04:20] Team_022 possession (Score: 51-28)
DeMar Harden attempts a 3Pt. Contested by Wendell Haliburton (5.2 feet, MAN). DeMar Harden misses. Rebound secured by Pau Russell.

[04:09] Team_087 possession (Score: 51-28)
Pau Russell attempts a 3Pt. Contested by Kawhi Russell (4.1 feet, ZONE). Pau Russell misses. Rebound secured by Lauri Gobert.

[03:55] Team_022 possession (Score: 51-28)
Dejounte Towns attempts a 3Pt. Contested by Larry Green (4.2 feet, MAN). Dejounte Towns misses. Rebound secured by Kristaps Young.

[03:40] Team_087 possession (Score: 51-28)
Kristaps Young drives, picks up Cole Iverson. Help arrives from Lauri Gobert! Kristaps Young attempts a Dunk. Contested by Lauri Gobert (5.5 feet, MAN). Kristaps Young misses. Rebound secured by Kawhi Russell.

[03:28] Team_022 possession (Score: 51-28)
DeMar Harden makes the Midrange and draws the foul on Wendell Haliburton! And-1! DeMar Harden to the line for 1. [Team fouls: 4] (Wendell Haliburton: 1 personal fouls)   FT 1/1: GOOD DeMar Harden makes 1/1 from the line.
Score: 51-31

[03:10] Team_087 possession (Score: 51-31)
Larry Green attempts a 3Pt. Contested by Kawhi Russell (4.4 feet, ZONE). Larry Green misses. Rebound secured by Kawhi Russell.

[02:55] Team_022 possession (Score: 51-31)
Dejounte Towns attempts a 3Pt. Contested by Wendell Haliburton (5.3 feet, ZONE). DEJOUNTE TOWNS MAKES IT! Assist: Lauri Gobert
Score: 51-34

[02:41] Team_087 possession (Score: 51-34)
Pau Russell attempts a 3Pt. Contested by Kawhi Russell (4.1 feet, ZONE). Pau Russell misses. Offensive rebound by Larry Green! Larry Green kicks it out.

[02:25] Team_087 possession (Score: 51-34)
FOUL! Shooting foul on Lauri Gobert. Kristaps Young to the line for 2 free throws. [BONUS: 7 team fouls] (Lauri Gobert: 1 personal fouls)   FT 1/2: GOOD   FT 2/2: GOOD Kristaps Young makes 2/2 from the line.
Score: 53-34

[02:13] Team_022 possession (Score: 53-34)
DeMar Harden attempts a 3Pt. Contested by Wendell Haliburton (5.2 feet, MAN). DeMar Harden misses. Rebound secured by Pau Russell.

[02:00] Team_087 possession (Score: 53-34)
Ben Lillard attempts a Layup. Contested by Lauri Gobert (4.7 feet, MAN). BEN LILLARD MAKES IT!
Score: 55-34

[01:44] Team_022 possession (Score: 55-34)
Dejounte Towns attempts a Layup. Contested by Kristaps Young (5.0 feet, ZONE). DEJOUNTE TOWNS MAKES IT! Assist: Kawhi Russell
Score: 55-36

[01:32] Team_087 possession (Score: 55-36)
Larry Green attempts a 3Pt. Contested by Dejounte Towns (4.8 feet, MAN). Larry Green misses. Rebound secured by Kawhi Russell.

[01:18] Team_022 possession (Score: 55-36)
DeMar Harden drives and kicks out. Cole Iverson attempts a Midrange. Contested by Kristaps Young (4.9 feet, MAN). Cole Iverson misses. Rebound secured by Larry Green.

[01:03] Team_087 possession (Score: 55-36)
Ben Lillard attempts a Layup. Contested by Lauri Gobert (4.7 feet, MAN). Ben Lillard misses. Rebound secured by Lauri Gobert.

[00:50] Team_022 possession (Score: 55-36)
Cole Iverson attempts a 3Pt. Contested by Pau Russell (4.9 feet, ZONE). Cole Iverson misses. Rebound secured by Kristaps Young.

[00:33] Team_087 possession (Score: 55-36)
Wendell Haliburton drives, DeMar Harden stays with him. Wendell Haliburton attempts a Layup. Contested by DeMar Harden (6.0 feet, MAN). Wendell Haliburton misses. Offensive rebound by Larry Green! Larry Green kicks it out.

[00:19] Team_087 possession (Score: 55-36)
Kristaps Young attempts a Layup. Contested by Kawhi Russell (4.5 feet, ZONE). KRISTAPS YOUNG MAKES IT!
Score: 57-36

[00:06] Team_022 possession (Score: 57-36)
Kawhi Russell attempts a 3Pt. Contested by Pau Russell (5.2 feet, MAN). Kawhi Russell misses. Offensive rebound by Dejounte Towns! Dejounte Towns kicks it out.

================================================================================
                              2ND QUARTER COMPLETE                              
================================================================================

2ND QUARTER SCORE: Team_087 32, Team_022 19

BOX SCORE:
================================================================================

Team_087
--------------------------------------------------------------------------------
Player                MIN  PTS  REB  AST  TO      FG   FG%      3P   3P%
--------------------------------------------------------------------------------
Jimmy Ming             17    9    0    0   0   3/3   100.0     0/0   0.0
Pau Russell             8    4    2    0   0   2/3    66.7     0/0   0.0
Kristaps Young          8    4    3    1   0   2/3    66.7     0/0   0.0
Ben Brogdon            17    3    1    1   0   1/2    50.0     0/0   0.0
Allen Mitchell         17    3    0    0   0   1/1   100.0     0/0   0.0
Wendell Haliburton      8    3    0    0   0   1/3    33.3     0/0   0.0
Malcolm Embiid         17    2    1    1   0   1/2    50.0     0/0   0.0
Larry Green             8    2    6    0   0   1/3    33.3     0/0   0.0
Ben Lillard             8    2    0    1   0   1/2    50.0     0/0   0.0
Devin Anunoby          17    0    3    1   0   0/0     0.0     0/0   0.0

TEAM: FG: 13/22 (59.1%), 3PT: 4/10 (40.0%), REB: 17 (5 off, 12 def), AST: 5, TO: 0
TEAM FOULS: 4


Team_022
--------------------------------------------------------------------------------
Player                MIN  PTS  REB  AST  TO      FG   FG%      3P   3P%
--------------------------------------------------------------------------------
Dejounte Towns          8    7    2    0   0   3/4    75.0     0/0   0.0
Dirk Markkanen         17    5    1    0   0   2/4    50.0     0/0   0.0
DeMar Harden            8    3    0    0   0   1/5    20.0     0/0   0.0
Malcolm Allen          17    2    0    0   0   1/1   100.0     0/0   0.0
Cole Iverson            8    2    0    0   0   1/2    50.0     0/0   0.0
Michael Ginobili       17    0    1    1   0   0/1     0.0     0/0   0.0
Myles Anthony          17    0    0    1   0   0/1     0.0     0/0   0.0
Kawhi Russell           8    0    5    2   0   0/1     0.0     0/0   0.0
Lauri Gobert            8    0    2    1   0   0/1     0.0     0/0   0.0

TEAM: FG: 8/20 (40.0%), 3PT: 2/9 (22.2%), REB: 10 (2 off, 8 def), AST: 5, TO: 1
TEAM FOULS: 7 [Team_087 in BONUS]

================================================================================

================================================================================
                       3RD QUARTER - Team_087 vs Team_022                       
================================================================================

[12:00] Team_087 possession (Score: 57-36)
Ben Brogdon makes the Layup and draws the foul on Dirk Markkanen! And-1! Ben Brogdon to the line for 1. [Team fouls: 1] (Dirk Markkanen: 1 personal fouls)   FT 1/1: GOOD Ben Brogdon makes 1/1 from the line.
Score: 60-36

[11:47] Team_022 possession (Score: 60-36)
Lamelo Dosunmu attempts a Midrange. Contested by Malcolm Embiid (3.8 feet, MAN). LAMELO DOSUNMU MAKES IT! Assist: Myles Anthony
Score: 60-38

[11:34] Team_087 possession (Score: 60-38)
Malcolm Embiid drives, Lamelo Dosunmu stays with him. Malcolm Embiid attempts a Dunk. Contested by Lamelo Dosunmu (4.9 feet, MAN). MALCOLM EMBIID MAKES IT!
Score: 62-38

[11:21] Team_022 possession (Score: 62-38)
Myles Anthony drives, picks up Malcolm Embiid. Help arrives from Jimmy Ming! Myles Anthony attempts a Layup. Contested by Jimmy Ming (3.5 feet, ZONE). MYLES ANTHONY MAKES IT!
Score: 62-40

[11:05] Team_087 possession (Score: 62-40)
Jimmy Ming makes the Dunk and draws the foul on Michael Ginobili! And-1! Jimmy Ming to the line for 1. [Team fouls: 2] (Michael Ginobili: 1 personal fouls)   FT 1/1: GOOD Jimmy Ming makes 1/1 from the line.
Score: 65-40

[10:53] Team_022 possession (Score: 65-40)
Michael Ginobili attempts a 3Pt. Contested by Jimmy Ming (4.9 feet, MAN). Michael Ginobili misses. Rebound secured by Devin Anunoby.

[10:42] Team_087 possession (Score: 65-40)
Devin Anunoby loses the ball! Stripped by Myles Anthony! TURNOVER! (live ball)

[10:26] Team_022 possession (Score: 65-40)
Myles Anthony attempts a 3Pt. Contested by Devin Anunoby (4.5 feet, MAN). MYLES ANTHONY MAKES IT! Assist: Michael Ginobili
Score: 65-43

[10:15] Team_087 possession (Score: 65-43)
Devin Anunoby drives, Dirk Markkanen stays with him. Devin Anunoby attempts a Layup. Contested by Dirk Markkanen (4.8 feet, ZONE). Devin Anunoby misses. Offensive rebound by Devin Anunoby! Devin Anunoby puts it back in!
Score: 67-43

[09:57] Team_022 possession (Score: 67-43)
Dirk Markkanen attempts a Midrange. Contested by Malcolm Embiid (3.8 feet, MAN). Dirk Markkanen misses. Rebound secured by Malcolm Embiid.

[09:45] Team_087 possession (Score: 67-43)
Jimmy Ming attempts a 3Pt. Contested by Michael Ginobili (4.2 feet, ZONE). Jimmy Ming misses. Rebound secured by Myles Anthony.

[09:33] Team_022 possession (Score: 67-43)
Lamelo Dosunmu attempts a Midrange. Contested by Jimmy Ming (5.3 feet, ZONE). Lamelo Dosunmu misses. Rebound secured by Malcolm Embiid.

[09:21] Team_087 possession (Score: 67-43)
FOUL! Shooting foul on Michael Ginobili. Ben Brogdon to the line for 2 free throws. [Team fouls: 3] (Michael Ginobili: 2 personal fouls)   FT 1/2: GOOD   FT 2/2: GOOD Ben Brogdon makes 2/2 from the line.
Score: 69-43

[09:07] Team_022 possession (Score: 69-43)
Malcolm Allen drives, Malcolm Embiid stays with him. Malcolm Allen attempts a Dunk. Contested by Malcolm Embiid (4.0 feet, ZONE). MALCOLM ALLEN MAKES IT! Assist: Lamelo Dosunmu
Score: 69-45

[08:48] Team_087 possession (Score: 69-45)
Jimmy Ming drives, Michael Ginobili stays with him. Jimmy Ming attempts a Dunk. Contested by Michael Ginobili (4.2 feet, MAN). Jimmy Ming misses. Offensive rebound by Devin Anunoby! Devin Anunoby puts it back in!
Score: 71-45

[08:31] Team_022 possession (Score: 71-45)
Michael Ginobili attempts a Midrange. Contested by Jimmy Ming (4.9 feet, MAN). MICHAEL GINOBILI MAKES IT!
Score: 71-47

[08:17] Team_087 possession (Score: 71-47)
Devin Anunoby attempts a 3Pt. Contested by Myles Anthony (4.7 feet, MAN). Devin Anunoby misses. Offensive rebound by Malcolm Embiid! Malcolm Embiid puts it back in!
Score: 73-47

[08:04] Team_022 possession (Score: 73-47)
FOUL! Holding foul on Devin Anunoby. [Team fouls: 1] No free throws, side out. (Devin Anunoby: 1 personal fouls)

[07:47] Team_022 possession (Score: 73-47)
Michael Ginobili attempts a Layup. BLOCKED BY JIMMY MING! Ball is loose! Rebound secured by Malcolm Embiid.

[07:30] Team_087 possession (Score: 73-47)
Malcolm Embiid attempts a 3Pt. Contested by Malcolm Allen (4.7 feet, ZONE). Malcolm Embiid misses. Rebound secured by Dirk Markkanen.

[07:15] Team_022 possession (Score: 73-47)
Dirk Markkanen attempts a Midrange. Contested by Malcolm Embiid (3.8 feet, ZONE). DIRK MARKKANEN MAKES IT! Assist: Malcolm Allen
Score: 73-49

[07:05] Team_087 possession (Score: 73-49)
Allen Mitchell attempts a Midrange. Contested by Malcolm Allen (4.8 feet, MAN). Allen Mitchell misses. Rebound secured by Myles Anthony.

[06:55] Team_022 possession (Score: 73-49)
Malcolm Allen attempts a 3Pt. Contested by Allen Mitchell (5.5 feet, ZONE). MALCOLM ALLEN MAKES IT! Assist: Michael Ginobili
Score: 73-52

[06:39] Team_087 possession (Score: 73-52)
Ben Brogdon attempts a Layup. Contested by Dirk Markkanen (4.9 feet, ZONE). BEN BROGDON MAKES IT! Assist: Devin Anunoby
Score: 75-52

[06:24] Team_022 possession (Score: 75-52)
FOUL! Shooting foul on Jimmy Ming. Lamelo Dosunmu to the line for 2 free throws. [Team fouls: 2] (Jimmy Ming: 1 personal fouls)   FT 1/2: GOOD   FT 2/2: GOOD Lamelo Dosunmu makes 2/2 from the line.
Score: 75-54

[06:08] Team_087 possession (Score: 75-54)
Malcolm Embiid attempts a Midrange. Contested by Michael Ginobili (3.8 feet, ZONE). MALCOLM EMBIID MAKES IT!
Score: 77-54

[05:55] Team_022 possession (Score: 77-54)
FOUL! Reach-in foul on Malcolm Embiid during the drive. [Team fouls: 3] No free throws, side out. (Malcolm Embiid: 1 personal fouls)

[05:38] Team_022 possession (Score: 77-54)
Lamelo Dosunmu drives and kicks out. Myles Anthony attempts a Midrange. Contested by Devin Anunoby (4.3 feet, MAN). Myles Anthony misses. Rebound secured by Malcolm Embiid.

[05:22] Team_087 possession (Score: 77-54)
FOUL! Shooting foul on Michael Ginobili. Ben Brogdon to the line for 2 free throws. [Team fouls: 4] (Michael Ginobili: 3 personal fouls)   FT 1/2: GOOD   FT 2/2: GOOD Ben Brogdon makes 2/2 from the line.
Score: 79-54

[05:08] Team_022 possession (Score: 79-54)
Lamelo Dosunmu loses the ball! Stripped by Malcolm Embiid! TURNOVER! (live ball)

[04:52] Team_087 possession (Score: 79-54)
Malcolm Embiid attempts a Midrange. Contested by Lamelo Dosunmu (5.0 feet, MAN). Malcolm Embiid misses. Rebound secured by Dirk Markkanen.

[04:37] Team_022 possession (Score: 79-54)
Dirk Markkanen attempts a Dunk. BLOCKED BY MALCOLM EMBIID! Ball is loose! Rebound secured by Ben Brogdon.

[04:20] Team_087 possession (Score: 79-54)
Jimmy Ming drives and kicks out. Allen Mitchell attempts a 3Pt. Contested by Malcolm Allen (4.5 feet, MAN). Allen Mitchell misses. Offensive rebound by Devin Anunoby! Devin Anunoby puts it back in!
Score: 81-54

[04:03] Team_022 possession (Score: 81-54)
Malcolm Allen attempts a 3Pt. Contested by Allen Mitchell (5.5 feet, MAN). MALCOLM ALLEN MAKES IT! Assist: Michael Ginobili
Score: 81-57

[03:46] Team_087 possession (Score: 81-57)
Allen Mitchell attempts a 3Pt. Contested by Malcolm Allen (5.0 feet, MAN). Allen Mitchell misses. Rebound secured by Michael Ginobili.

[03:37] Team_022 possession (Score: 81-57)
Michael Ginobili attempts a 3Pt. Contested by Allen Mitchell (4.9 feet, ZONE). Michael Ginobili misses. Offensive rebound by Dirk Markkanen! Dirk Markkanen's putback is no good. Rebound secured by Devin Anunoby.

[03:23] Team_087 possession (Score: 81-57)
Jimmy Ming drives, Dirk Markkanen stays with him. Jimmy Ming attempts a Dunk. Contested by Dirk Markkanen (5.5 feet, ZONE). JIMMY MING MAKES IT! Assist: Allen Mitchell
Score: 83-57

[03:10] Team_022 possession (Score: 83-57)
Michael Ginobili attempts a Midrange. Contested by Jimmy Ming (5.0 feet, MAN). Michael Ginobili misses. Rebound secured by Devin Anunoby.

[02:54] Team_087 possession (Score: 83-57)
Devin Anunoby attempts a Layup. Contested by Myles Anthony (4.9 feet, MAN). DEVIN ANUNOBY MAKES IT! Assist: Ben Brogdon
Score: 85-57

[02:38] Team_022 possession (Score: 85-57)
Myles Anthony attempts a Midrange. Contested by Devin Anunoby (4.8 feet, MAN). MYLES ANTHONY MAKES IT! Assist: Dirk Markkanen
Score: 85-59

[02:22] Team_087 possession (Score: 85-59)
Devin Anunoby makes the Midrange and draws the foul on Myles Anthony! And-1! Devin Anunoby to the line for 1. [BONUS: 5 team fouls] (Myles Anthony: 1 personal fouls)   FT 1/1: GOOD Devin Anunoby makes 1/1 from the line.
Score: 88-59

[02:08] Team_022 possession (Score: 88-59)
Malcolm Allen attempts a 3Pt. Contested by Allen Mitchell (5.6 feet, ZONE). Malcolm Allen misses. FOUL! Loose ball foul on Devin Anunoby during the rebound battle. [Team fouls: 4] No free throws, side out. (Devin Anunoby: 2 personal fouls)

[01:56] Team_022 possession (Score: 88-59)
Malcolm Allen attempts a Midrange. Contested by Allen Mitchell (5.6 feet, MAN). Malcolm Allen misses. Offensive rebound by Dirk Markkanen! Dirk Markkanen puts it back in!
Score: 88-61

[01:43] Team_087 possession (Score: 88-61)
Malcolm Embiid attempts a Layup. Contested by Dirk Markkanen (5.2 feet, ZONE). MALCOLM EMBIID MAKES IT!
Score: 90-61

[01:31] Team_022 possession (Score: 90-61)
FOUL! Shooting foul on Allen Mitchell. Lamelo Dosunmu to the line for 3 free throws. [BONUS: 5 team fouls] (Allen Mitchell: 1 personal fouls)   FT 1/3: MISS   FT 2/3: GOOD   FT 3/3: GOOD Lamelo Dosunmu makes 2/3 from the line.
Score: 90-63

[01:18] Team_087 possession (Score: 90-63)
Allen Mitchell attempts a Layup. Contested by Dirk Markkanen (5.4 feet, ZONE). ALLEN MITCHELL MAKES IT! Assist: Ben Brogdon
Score: 92-63

[01:06] Team_022 possession (Score: 92-63)
Michael Ginobili makes the Dunk and draws the foul on Jimmy Ming! And-1! Michael Ginobili to the line for 1. [BONUS: 6 team fouls] (Jimmy Ming: 2 personal fouls)   FT 1/1: MISS Michael Ginobili makes 0/1 from the line. Rebound secured by Devin Anunoby.
Score: 92-65

[00:55] Team_087 possession (Score: 92-65)
Jimmy Ming attempts a Layup. Contested by Dirk Markkanen (5.8 feet, ZONE). JIMMY MING MAKES IT!
Score: 94-65

[00:44] Team_022 possession (Score: 94-65)
Lamelo Dosunmu attempts a 3Pt. Contested by Allen Mitchell (5.5 feet, ZONE). Lamelo Dosunmu misses. Rebound secured by Malcolm Embiid.

[00:33] Team_087 possession (Score: 94-65)
FOUL! Shooting foul on Michael Ginobili. Ben Brogdon to the line for 2 free throws. [BONUS: 6 team fouls] (Michael Ginobili: 4 personal fouls)   FT 1/2: GOOD   FT 2/2: GOOD Ben Brogdon makes 2/2 from the line.
Score: 96-65

[00:24] Team_022 possession (Score: 96-65)
Myles Anthony attempts a Midrange. Contested by Devin Anunoby (5.1 feet, MAN). MYLES ANTHONY MAKES IT! Assist: Lamelo Dosunmu
Score: 96-67

[00:09] Team_087 possession (Score: 96-67)
Malcolm Embiid attempts a Layup. Contested by Dirk Markkanen (5.4 feet, ZONE). Malcolm Embiid misses. Rebound secured by Michael Ginobili.

================================================================================
                              3RD QUARTER COMPLETE                              
================================================================================

3RD QUARTER SCORE: Team_087 39, Team_022 31

BOX SCORE:
================================================================================

Team_087
--------------------------------------------------------------------------------
Player                MIN  PTS  REB  AST  TO      FG   FG%      3P   3P%
--------------------------------------------------------------------------------
Ben Brogdon            29   11    1    2   0   5/5   100.0     0/0   0.0
Devin Anunoby          29   11    7    1   0   5/5   100.0     0/0   0.0
Malcolm Embiid         29    8    6    0   0   4/7    57.1     0/0   0.0
Jimmy Ming             29    7    0    0   0   3/4    75.0     0/0   0.0
Allen Mitchell         29    2    0    1   0   1/3    33.3     0/0   0.0

TEAM: FG: 18/24 (75.0%), 3PT: 1/4 (25.0%), REB: 13 (4 off, 9 def), AST: 4, TO: 1
TEAM FOULS: 6 [Team_022 in BONUS]


Team_022
--------------------------------------------------------------------------------
Player                MIN  PTS  REB  AST  TO      FG   FG%      3P   3P%
--------------------------------------------------------------------------------
Myles Anthony          29    9    2    1   0   4/4   100.0     0/0   0.0
Malcolm Allen          29    8    0    1   0   3/3   100.0     0/0   0.0
Lamelo Dosunmu         29    6    0    2   0   3/6    50.0     0/0   0.0
Dirk Markkanen         29    4    3    1   0   2/4    50.0     0/0   0.0
Michael Ginobili       29    2    3    3   0   1/6    16.7     0/0   0.0

TEAM: FG: 13/23 (56.5%), 3PT: 4/7 (57.1%), REB: 9 (3 off, 6 def), AST: 8, TO: 1
TEAM FOULS: 6 [Team_087 in BONUS]

================================================================================

================================================================================
                       4TH QUARTER - Team_087 vs Team_022                       
================================================================================

[12:00] Team_087 possession (Score: 96-67)
FOUL! Shooting foul on Dirk Markkanen. Allen Mitchell to the line for 2 free throws. [Team fouls: 1] (Dirk Markkanen: 1 personal fouls)   FT 1/2: GOOD   FT 2/2: MISS Allen Mitchell makes 1/2 from the line. Rebound secured by Michael Ginobili.
Score: 97-67

[11:43] Team_022 possession (Score: 97-67)
Dirk Markkanen drives, Malcolm Embiid stays with him. Dirk Markkanen attempts a Dunk. Contested by Malcolm Embiid (4.2 feet, ZONE). Dirk Markkanen misses. Rebound secured by Devin Anunoby.

[11:30] Team_087 possession (Score: 97-67)
FOUL! Offensive foul on Malcolm Embiid! Lamelo Dosunmu drew the charge! [Team fouls: 1] (Malcolm Embiid: 1 personal fouls) TURNOVER! (dead ball)

[11:14] Team_022 possession (Score: 97-67)
Lamelo Dosunmu attempts a Layup. Contested by Malcolm Embiid (4.2 feet, ZONE). LAMELO DOSUNMU MAKES IT!
Score: 97-69

[11:02] Team_087 possession (Score: 97-69)
Jimmy Ming attempts a 3Pt. Contested by Michael Ginobili (4.7 feet, MAN). Jimmy Ming misses. Rebound secured by Dirk Markkanen.

[10:48] Team_022 possession (Score: 97-69)
Lamelo Dosunmu attempts a Layup. Contested by Malcolm Embiid (4.2 feet, MAN). Lamelo Dosunmu misses. Rebound secured by Devin Anunoby.

[10:30] Team_087 possession (Score: 97-69)
Jimmy Ming attempts a 3Pt. Contested by Michael Ginobili (4.7 feet, MAN). Jimmy Ming misses. Rebound secured by Michael Ginobili.

[10:20] Team_022 possession (Score: 97-69)
Lamelo Dosunmu attempts a Midrange. Contested by Jimmy Ming (5.6 feet, ZONE). Lamelo Dosunmu misses. Rebound secured by Ben Brogdon.

[10:05] Team_087 possession (Score: 97-69)
Allen Mitchell attempts a Midrange. Contested by Lamelo Dosunmu (5.7 feet, ZONE). Allen Mitchell misses. Rebound secured by Myles Anthony.

[09:50] Team_022 possession (Score: 97-69)
Lamelo Dosunmu drives, Malcolm Embiid stays with him. Lamelo Dosunmu attempts a Dunk. Contested by Malcolm Embiid (4.4 feet, MAN). LAMELO DOSUNMU MAKES IT! Assist: Michael Ginobili
Score: 97-71

[09:35] Team_087 possession (Score: 97-71)
Malcolm Embiid attempts a Midrange. Contested by Lamelo Dosunmu (5.6 feet, MAN). MALCOLM EMBIID MAKES IT! Assist: Ben Brogdon
Score: 99-71

[09:23] Team_022 possession (Score: 99-71)
Dirk Markkanen drives, Malcolm Embiid stays with him. Dirk Markkanen attempts a Layup. Contested by Malcolm Embiid (4.5 feet, ZONE). Dirk Markkanen misses. Rebound secured by Ben Brogdon.

[09:09] Team_087 possession (Score: 99-71)
Allen Mitchell drives to the basket... Allen Mitchell commits a violation (traveling/carry)! TURNOVER! (dead ball)

[09:09] Substitution (Team_087): Allen Mitchell OUT → Wendell Haliburton IN (stamina_rule2)

[09:09] Substitution (Team_087): Jimmy Ming OUT → Ben Lillard IN (stamina_rule2)

[09:09] Substitution (Team_087): Devin Anunoby OUT → Larry Green IN (stamina_rule2)

[09:09] Substitution (Team_087): Malcolm Embiid OUT → Pau Russell IN (stamina_rule2)

[09:09] Substitution (Team_087): Ben Brogdon OUT → Kristaps Young IN (stamina_rule2)

[09:09] Substitution (Team_022): Malcolm Allen OUT → DeMar Harden IN (stamina_rule2)

[09:09] Substitution (Team_022): Michael Ginobili OUT → Lauri Gobert IN (stamina_rule2)

[09:09] Substitution (Team_022): Myles Anthony OUT → Dejounte Towns IN (stamina_rule2)

[09:09] Substitution (Team_022): Lamelo Dosunmu OUT → Kawhi Russell IN (stamina_rule2)

[09:09] Substitution (Team_022): Dirk Markkanen OUT → Cole Iverson IN (stamina_rule2)

[08:57] Team_022 possession (Score: 99-71)
Dejounte Towns attempts a Midrange. Contested by Pau Russell (4.9 feet, ZONE). Dejounte Towns misses. Rebound secured by Pau Russell.

[08:40] Team_087 possession (Score: 99-71)
Kristaps Young attempts a Midrange. Contested by Cole Iverson (5.5 feet, MAN). Kristaps Young misses. Rebound secured by Dejounte Towns.

[08:24] Team_022 possession (Score: 99-71)
FOUL! Reach-in foul on Wendell Haliburton during the drive. [Team fouls: 2] No free throws, side out. (Wendell Haliburton: 1 personal fouls)

[08:07] Team_022 possession (Score: 99-71)
DeMar Harden attempts a 3Pt. Contested by Pau Russell (4.8 feet, ZONE). DeMar Harden misses. Offensive rebound by Lauri Gobert! Lauri Gobert kicks it out.

[07:52] Team_022 possession (Score: 99-71)
FOUL! Holding foul on Kristaps Young. [Team fouls: 3] No free throws, side out. (Kristaps Young: 1 personal fouls)

[07:37] Team_022 possession (Score: 99-71)
Kawhi Russell attempts a Midrange. Contested by Pau Russell (5.1 feet, MAN). KAWHI RUSSELL MAKES IT! Assist: Cole Iverson
Score: 99-73

[07:19] Team_087 possession (Score: 99-73)
Larry Green drives and kicks out. Larry Green attempts a Midrange. Contested by Dejounte Towns (4.5 feet, MAN). Larry Green misses. Rebound secured by Dejounte Towns.

[07:00] Team_022 possession (Score: 99-73)
Kawhi Russell attempts a 3Pt. Contested by Pau Russell (5.1 feet, ZONE). Kawhi Russell misses. Rebound secured by Larry Green.

[06:43] Team_087 possession (Score: 99-73)
FOUL! Reach-in foul on Lauri Gobert during the drive. [Team fouls: 2] No free throws, side out. (Lauri Gobert: 1 personal fouls)

[06:27] Team_087 possession (Score: 99-73)
Pau Russell attempts a 3Pt. Contested by Lauri Gobert (4.6 feet, ZONE). Pau Russell misses. Rebound secured by Dejounte Towns.

[06:11] Team_022 possession (Score: 99-73)
Kawhi Russell loses the ball! Stripped by Pau Russell! TURNOVER! (live ball)

[05:57] Team_087 possession (Score: 99-73)
Pau Russell drives and kicks out. Ben Lillard attempts a 3Pt. Contested by Kawhi Russell (4.0 feet, ZONE). Ben Lillard misses. FOUL! Loose ball foul on Kawhi Russell during the rebound battle. [Team fouls: 3] No free throws, side out. (Kawhi Russell: 1 personal fouls)

[05:44] Team_087 possession (Score: 99-73)
Kristaps Young drives to the basket... Kristaps Young throws a bad pass! Stolen by Kawhi Russell! TURNOVER! (live ball)

[05:30] Team_022 possession (Score: 99-73)
Kawhi Russell makes the Layup and draws the foul on Ben Lillard! And-1! Kawhi Russell to the line for 1. [Team fouls: 4] (Ben Lillard: 1 personal fouls)   FT 1/1: GOOD Kawhi Russell makes 1/1 from the line.
Score: 99-76

[05:17] Team_087 possession (Score: 99-76)
Larry Green drives, picks up Dejounte Towns. Help arrives from Lauri Gobert! Larry Green attempts a Dunk. Contested by Lauri Gobert (4.8 feet, MAN). Larry Green misses. Rebound secured by Kawhi Russell.

[05:01] Team_022 possession (Score: 99-76)
DeMar Harden attempts a 3Pt. Contested by Wendell Haliburton (5.2 feet, MAN). DEMAR HARDEN MAKES IT! Assist: Dejounte Towns
Score: 99-79

[04:47] Team_087 possession (Score: 99-79)
Kristaps Young makes the Layup and draws the foul on Cole Iverson! And-1! Kristaps Young to the line for 1. [Team fouls: 4] (Cole Iverson: 1 personal fouls)   FT 1/1: GOOD Kristaps Young makes 1/1 from the line.
Score: 102-79

[04:32] Team_022 possession (Score: 102-79)
Lauri Gobert attempts a 3Pt. Contested by Ben Lillard (5.3 feet, MAN). Lauri Gobert misses. Rebound secured by Kristaps Young.

[04:21] Team_087 possession (Score: 102-79)
Kristaps Young drives, Cole Iverson stays with him. Kristaps Young attempts a Layup. Contested by Cole Iverson (5.5 feet, MAN). KRISTAPS YOUNG MAKES IT! Assist: Wendell Haliburton
Score: 104-79

[04:05] Team_022 possession (Score: 104-79)
Dejounte Towns commits a violation (traveling/carry)! TURNOVER! (dead ball)

[03:53] Team_087 possession (Score: 104-79)
FOUL! Shooting foul on Lauri Gobert. Pau Russell to the line for 2 free throws. [BONUS: 5 team fouls] (Lauri Gobert: 2 personal fouls)   FT 1/2: GOOD   FT 2/2: MISS Pau Russell makes 1/2 from the line. Rebound secured by Dejounte Towns.
Score: 105-79

[03:41] Team_022 possession (Score: 105-79)
DeMar Harden attempts a 3Pt. Contested by Wendell Haliburton (5.2 feet, ZONE). DeMar Harden misses. Rebound secured by Kristaps Young.

[03:26] Team_087 possession (Score: 105-79)
FOUL! Shooting foul on Kawhi Russell. Wendell Haliburton to the line for 2 free throws. [BONUS: 6 team fouls] (Kawhi Russell: 2 personal fouls)   FT 1/2: GOOD   FT 2/2: GOOD Wendell Haliburton makes 2/2 from the line.
Score: 107-79

[03:13] Team_022 possession (Score: 107-79)
Kawhi Russell drives, Pau Russell stays with him. Kawhi Russell attempts a Dunk. Contested by Pau Russell (5.1 feet, MAN). Kawhi Russell misses. Rebound secured by Larry Green.

[02:58] Team_087 possession (Score: 107-79)
FOUL! Holding foul on Cole Iverson. [IN THE BONUS! 7 team fouls] Kristaps Young to the line for 2 free throws. (Cole Iverson: 2 personal fouls)   FT 1/2: GOOD   FT 2/2: GOOD Kristaps Young makes 2/2 from the line.
Score: 109-79

[02:47] Team_022 possession (Score: 109-79)
DeMar Harden attempts a 3Pt. Contested by Wendell Haliburton (5.2 feet, MAN). DEMAR HARDEN MAKES IT! Assist: Lauri Gobert
Score: 109-82

[02:36] Team_087 possession (Score: 109-82)
FOUL! Holding foul on Dejounte Towns. [IN THE BONUS! 8 team fouls] Larry Green to the line for 2 free throws. (Dejounte Towns: 1 personal fouls)   FT 1/2: GOOD   FT 2/2: MISS Larry Green makes 1/2 from the line. FOUL! Loose ball foul on Dejounte Towns during the free throw rebound! [IN THE BONUS! 9 team fouls] Kristaps Young to the line for 2 free throws. (Dejounte Towns: 2 personal fouls)   FT 1/2: GOOD   FT 2/2: GOOD Kristaps Young makes 2/2 from the line.
Score: 112-82

[02:22] Team_022 possession (Score: 112-82)
Lauri Gobert attempts a Layup. Contested by Kristaps Young (4.9 feet, ZONE). Lauri Gobert misses. FOUL! Loose ball foul on Pau Russell during the rebound battle. [IN THE BONUS! 5 team fouls] Dejounte Towns to the line for 2 free throws. (Pau Russell: 1 personal fouls)   FT 1/2: MISS   FT 2/2: MISS Dejounte Towns makes 0/2 from the line. Rebound secured by Larry Green.

[02:06] Team_087 possession (Score: 112-82)
Kristaps Young drives and kicks out. Kristaps Young makes the Midrange and draws the foul on Cole Iverson! And-1! Kristaps Young to the line for 1. [BONUS: 10 team fouls] (Cole Iverson: 3 personal fouls)   FT 1/1: GOOD Kristaps Young makes 1/1 from the line.
Score: 115-82

[01:52] Team_022 possession (Score: 115-82)
Cole Iverson drives to the basket... FOUL! Offensive foul on Cole Iverson! Kristaps Young drew the charge! [Team fouls: 11] (Cole Iverson: 4 personal fouls) TURNOVER! (dead ball)

[01:41] Team_087 possession (Score: 115-82)
Wendell Haliburton drives, DeMar Harden stays with him. Wendell Haliburton attempts a Layup. Contested by DeMar Harden (6.0 feet, MAN). Wendell Haliburton misses. Rebound secured by Kawhi Russell.

[01:23] Team_022 possession (Score: 115-82)
Cole Iverson attempts a 3Pt. Contested by Pau Russell (4.9 feet, ZONE). Cole Iverson misses. Offensive rebound by Lauri Gobert! Lauri Gobert kicks it out.

[01:07] Team_022 possession (Score: 115-82)
Kawhi Russell drives and kicks out. Dejounte Towns attempts a Midrange. Contested by Larry Green (4.2 feet, MAN). Dejounte Towns misses. Offensive rebound by Lauri Gobert! Lauri Gobert kicks it out.

[00:50] Team_022 possession (Score: 115-82)
Dejounte Towns attempts a 3Pt. Contested by Pau Russell (5.0 feet, ZONE). Dejounte Towns misses. Offensive rebound by Dejounte Towns! Dejounte Towns kicks it out.

[00:37] Team_022 possession (Score: 115-82)
FOUL! Reach-in foul on Kristaps Young during the drive. [IN THE BONUS! 6 team fouls] Cole Iverson to the line for 2 free throws. (Kristaps Young: 2 personal fouls)   FT 1/2: GOOD   FT 2/2: GOOD Cole Iverson makes 2/2 from the line.
Score: 115-84

[00:25] Team_087 possession (Score: 115-84)
Kristaps Young attempts a 3Pt. Contested by Kawhi Russell (4.6 feet, ZONE). Kristaps Young misses. FOUL! Loose ball foul on Dejounte Towns during the rebound battle. [IN THE BONUS! 12 team fouls] Larry Green to the line for 2 free throws. (Dejounte Towns: 3 personal fouls)   FT 1/2: GOOD   FT 2/2: GOOD Larry Green makes 2/2 from the line.
Score: 117-84

[00:06] Team_022 possession (Score: 117-84)
Cole Iverson attempts a Layup. Contested by Kristaps Young (5.2 feet, MAN). Cole Iverson misses. Offensive rebound by Lauri Gobert! Lauri Gobert kicks it out.

================================================================================
                              4TH QUARTER COMPLETE                              
================================================================================

4TH QUARTER SCORE: Team_087 21, Team_022 17

BOX SCORE:
================================================================================

Team_087
--------------------------------------------------------------------------------
Player                MIN  PTS  REB  AST  TO      FG   FG%      3P   3P%
--------------------------------------------------------------------------------
Kristaps Young         17   13    2    0   0   5/6    83.3     0/0   0.0
Malcolm Embiid         32    2    0    0   0   1/1   100.0     0/0   0.0
Larry Green            17    2    4    0   0   1/3    33.3     0/0   0.0
Wendell Haliburton     17    2    0    1   0   1/2    50.0     0/0   0.0
Allen Mitchell         32    0    0    0   0   0/2     0.0     0/0   0.0
Devin Anunoby          32    0    2    0   0   0/0     0.0     0/0   0.0
Jimmy Ming             32    0    0    0   0   0/2     0.0     0/0   0.0
Ben Brogdon            32    0    2    1   0   0/0     0.0     0/0   0.0
Pau Russell            17    0    1    0   0   0/2     0.0     0/0   0.0

TEAM: FG: 8/18 (44.4%), 3PT: 1/4 (25.0%), REB: 10 (1 off, 9 def), AST: 2, TO: 3
TEAM FOULS: 6 [Team_022 in BONUS]


Team_022
--------------------------------------------------------------------------------
Player                MIN  PTS  REB  AST  TO      FG   FG%      3P   3P%
--------------------------------------------------------------------------------
DeMar Harden           17    6    0    0   0   2/3    66.7     0/0   0.0
Kawhi Russell          17    5    2    0   0   2/4    50.0     0/0   0.0
Lamelo Dosunmu         32    4    0    0   0   2/4    50.0     0/0   0.0
Cole Iverson           17    2    0    1   0   1/1   100.0     0/0   0.0
Michael Ginobili       32    0    2    1   0   0/0     0.0     0/0   0.0
Dirk Markkanen         32    0    1    0   0   0/2     0.0     0/0   0.0
Myles Anthony          32    0    1    0   0   0/0     0.0     0/0   0.0
Dejounte Towns         17    0    5    1   0   0/1     0.0     0/0   0.0
Lauri Gobert           17    0    4    1   0   0/2     0.0     0/0   0.0

TEAM: FG: 7/17 (41.2%), 3PT: 2/5 (40.0%), REB: 16 (6 off, 10 def), AST: 4, TO: 3
TEAM FOULS: 12 [Team_087 in BONUS]

================================================================================

================================================================================
                               FULL GAME COMPLETE                               
================================================================================

FINAL SCORE: Team_087 117, Team_022 84

SCORING BY QUARTER:
--------------------------------------------------------------------------------
Team                     Q1     Q2     Q3     Q4    FINAL
--------------------------------------------------------------------------------
Team_087                 25     32     39     21      117
Team_022                 17     19     31     17       84
--------------------------------------------------------------------------------

FULL GAME BOX SCORE:
================================================================================

Team_087
--------------------------------------------------------------------------------
Player                MIN  PTS  REB  AST  TO      FG   FG%      3P   3P%      FT STL BLK
--------------------------------------------------------------------------------
Allen Mitchell         32    7    0    2   1   3/10   30.0   0/1     0.0   2/3     0   0
Jimmy Ming             32   18    0    0   1  10/15   66.7   3/8    37.5   1/1     0   1
Devin Anunoby          32   20   15    2   2   7/9    77.8   3/3   100.0   5/6     2   0
Malcolm Embiid         32   20   13    2   1   7/13   53.8   0/2     0.0   6/6     2   1
Ben Brogdon            32   17    6    4   0   8/9    88.9   0/1     0.0  11/12    0   0
Wendell Haliburton     17    5    0    1   0   2/5    40.0   1/3    33.3   2/2     0   0
Ben Lillard            17    2    0    1   0   1/2    50.0   0/0     0.0   0/0     0   0
Larry Green            17    4   10    0   0   1/5    20.0   0/2     0.0   5/6     0   0
Pau Russell            17    4    3    0   1   2/5    40.0   0/2     0.0   3/4     1   0
Kristaps Young         17   17    5    1   0   6/8    75.0   1/1   100.0   6/6     0   1

TEAM: FG: 50/84 (59.5%), 3PT: 8/23 (34.8%), REB: 51 (12 off, 39 def), AST: 13, TO: 6


Team_022
--------------------------------------------------------------------------------
Player                MIN  PTS  REB  AST  TO      FG   FG%      3P   3P%      FT STL BLK
--------------------------------------------------------------------------------
Malcolm Allen          32   12    0    2   1   6/8    75.0   2/4    50.0   0/0     0   1
Michael Ginobili       32    7   10    6   0   2/9    22.2   0/4     0.0   0/1     0   0
Myles Anthony          32    9    6    2   2   4/7    57.1   1/1   100.0   1/2     1   0
Lamelo Dosunmu         32   10    0    3   4   5/11   45.5   1/2    50.0   4/5     0   0
Dirk Markkanen         32   18    9    1   1   8/17   47.1   1/3    33.3   1/1     0   0
DeMar Harden           17    9    0    0   1   3/8    37.5   2/5    40.0   1/1     0   0
Lauri Gobert           17    0    6    2   0   0/3     0.0   0/2     0.0   0/0     0   0
Dejounte Towns         17    7    7    1   1   3/5    60.0   1/2    50.0   2/4     0   0
Kawhi Russell          17    5    7    2   1   2/5    40.0   0/1     0.0   1/1     1   0
Cole Iverson           17    4    0    1   0   2/3    66.7   0/1     0.0   2/2     0   0

TEAM: FG: 35/76 (46.1%), 3PT: 8/25 (32.0%), REB: 46 (14 off, 32 def), AST: 20, TO: 11

================================================================================
