================================================================================
                        FULL GAME - Team_027 vs Team_028                        
================================================================================

================================================================================
                       1ST QUARTER - Team_027 vs Team_028                       
================================================================================

[12:00] Team_027 possession (Score: 0-0)
John Russell drives and kicks out. Scottie Harden attempts a Midrange. Contested by Kawhi Ball (4.2 feet, ZONE). Scottie Harden misses. Rebound secured by Jimmy Brogdon.

[11:48] Team_028 possession (Score: 0-0)
Austin Russell drives and kicks out. Myles Haliburton attempts a 3Pt. Contested by Tim Johnson (4.9 feet, ZONE). MYLES HALIBURTON MAKES IT! Assist: Austin Russell
Score: 0-3

[11:31] Team_027 possession (Score: 0-3)
Tony Doncic drives, picks up Carmelo Carter. Help arrives from Myles Haliburton! Tony Doncic attempts a Layup. Contested by Myles Haliburton (4.6 feet, MAN). Tony Doncic misses. Rebound secured by Jimmy Brogdon.

[11:22] Team_028 possession (Score: 0-3)
Kawhi Ball attempts a Midrange. Contested by Bradley Dosunmu (4.6 feet, MAN). Kawhi Ball misses. Offensive rebound by Jimmy Brogdon! Jimmy Brogdon kicks it out.

[11:12] Team_028 possession (Score: 0-3)
Carmelo Carter attempts a Midrange. Contested by Tony Doncic (4.2 feet, MAN). CARMELO CARTER MAKES IT! Assist: Austin Russell
Score: 0-5

[10:57] Team_027 possession (Score: 0-5)
Scottie Harden drives to the basket... Scottie Harden throws a bad pass out of bounds! TURNOVER! (dead ball)

[10:43] Team_028 possession (Score: 0-5)
Carmelo Carter attempts a Midrange. Contested by Tony Doncic (4.2 feet, MAN). CARMELO CARTER MAKES IT! Assist: Kawhi Ball
Score: 0-7

[10:30] Team_027 possession (Score: 0-7)
Bradley Dosunmu attempts a Layup. Contested by Kawhi Ball (4.3 feet, MAN). BRADLEY DOSUNMU MAKES IT!
Score: 2-7

[10:19] Team_028 possession (Score: 2-7)
Carmelo Carter attempts a Midrange. Contested by Tony Doncic (4.2 feet, MAN). Carmelo Carter misses. Rebound secured by Bradley Dosunmu.

[10:02] Team_027 possession (Score: 2-7)
Scottie Harden attempts a 3Pt. Contested by Myles Haliburton (3.7 feet, MAN). Scottie Harden misses. Offensive rebound by John Russell! John Russell puts it back in!
Score: 4-7

[09:48] Team_028 possession (Score: 4-7)
Carmelo Carter drives, Bradley Dosunmu stays with him. Carmelo Carter attempts a Layup. Contested by Bradley Dosunmu (4.7 feet, ZONE). CARMELO CARTER MAKES IT!
Score: 4-9

[09:33] Team_027 possession (Score: 4-9)
Tony Doncic drives, Carmelo Carter stays with him. Tony Doncic attempts a Layup. Contested by Carmelo Carter (4.6 feet, MAN). TONY DONCIC MAKES IT!
Score: 6-9

[09:15] Team_028 possession (Score: 6-9)
Austin Russell attempts a 3Pt. Contested by Tim Johnson (4.8 feet, ZONE). Austin Russell misses. Rebound secured by Bradley Dosunmu.

[09:04] Team_027 possession (Score: 6-9)
Scottie Harden attempts a 3Pt. Contested by Myles Haliburton (3.7 feet, MAN). Scottie Harden misses. Rebound secured by Jimmy Brogdon.

[08:52] Team_028 possession (Score: 6-9)
Austin Russell attempts a Layup. Contested by John Russell (3.8 feet, ZONE). AUSTIN RUSSELL MAKES IT! Assist: Jimmy Brogdon
Score: 6-11

[08:40] Team_027 possession (Score: 6-11)
FOUL! Reach-in foul on Kawhi Ball during the drive. [Team fouls: 1] No free throws, side out. (Kawhi Ball: 1 personal fouls)

[08:28] Team_027 possession (Score: 6-11)
John Russell attempts a 3Pt. Contested by Austin Russell (5.2 feet, ZONE). John Russell misses. Rebound secured by Jimmy Brogdon.

[08:14] Team_028 possession (Score: 6-11)
Jimmy Brogdon attempts a 3Pt. Contested by John Russell (4.4 feet, MAN). JIMMY BROGDON MAKES IT! Assist: Austin Russell
Score: 6-14

[08:01] Team_027 possession (Score: 6-14)
Bradley Dosunmu drives to the basket... Bradley Dosunmu loses the ball! Stripped by Kawhi Ball! TURNOVER! (live ball)

[07:44] Team_028 possession (Score: 6-14)
Austin Russell attempts a Layup. Contested by Tim Johnson (4.8 feet, MAN). AUSTIN RUSSELL MAKES IT! Assist: Carmelo Carter
Score: 6-16

[07:34] Team_027 possession (Score: 6-16)
FOUL! Reach-in foul on Austin Russell during the drive. [Team fouls: 2] No free throws, side out. (Austin Russell: 1 personal fouls)

[07:19] Team_027 possession (Score: 6-16)
Tony Doncic attempts a 3Pt. Contested by Austin Russell (4.6 feet, ZONE). Tony Doncic misses. Rebound secured by Carmelo Carter.

[07:07] Team_028 possession (Score: 6-16)
Myles Haliburton drives, Scottie Harden stays with him. Myles Haliburton attempts a Dunk. Contested by Scottie Harden (4.6 feet, MAN). MYLES HALIBURTON MAKES IT! Assist: Carmelo Carter
Score: 6-18

[06:53] Team_027 possession (Score: 6-18)
John Russell throws a bad pass out of bounds! TURNOVER! (dead ball)

[06:43] Team_028 possession (Score: 6-18)
Austin Russell makes the Layup and draws the foul on John Russell! And-1! Austin Russell to the line for 1. [Team fouls: 1] (John Russell: 1 personal fouls)   FT 1/1: MISS Austin Russell makes 0/1 from the line. Offensive rebound by Jimmy Brogdon! Jimmy Brogdon kicks it out.
Score: 6-20

[06:27] Team_028 possession (Score: 6-20)
FOUL! Shooting foul on John Russell. Jimmy Brogdon to the line for 2 free throws. [Team fouls: 2] (John Russell: 2 personal fouls)   FT 1/2: GOOD   FT 2/2: GOOD Jimmy Brogdon makes 2/2 from the line.
Score: 6-22

[06:11] Team_027 possession (Score: 6-22)
Bradley Dosunmu attempts a Layup. BLOCKED BY KAWHI BALL! Ball deflects out of bounds off Bradley Dosunmu.

[06:01] Team_028 possession (Score: 6-22)
Myles Haliburton drives to the basket... Myles Haliburton throws a bad pass out of bounds! TURNOVER! (dead ball)

[05:49] Team_027 possession (Score: 6-22)
Tony Doncic attempts a Layup. Contested by Carmelo Carter (4.6 feet, MAN). TONY DONCIC MAKES IT!
Score: 8-22

[05:33] Team_028 possession (Score: 8-22)
Kawhi Ball attempts a Dunk. BLOCKED BY BRADLEY DOSUNMU! Ball deflects out of bounds off Kawhi Ball.

[05:13] Team_027 possession (Score: 8-22)
Tony Doncic drives and kicks out. Tim Johnson attempts a 3Pt. Contested by Austin Russell (4.5 feet, ZONE). Tim Johnson misses. Offensive rebound by John Russell! John Russell puts it back in!
Score: 10-22

[04:57] Team_028 possession (Score: 10-22)
Kawhi Ball drives to the basket... Kawhi Ball loses the ball! Stripped by John Russell! TURNOVER! (live ball)

[04:40] Team_027 possession (Score: 10-22)
Tim Johnson drives to the basket... Tim Johnson throws a bad pass! Stolen by Austin Russell! TURNOVER! (live ball)

[04:25] Team_028 possession (Score: 10-22)
Austin Russell makes the 3Pt and draws the foul on Tim Johnson! And-1! Austin Russell to the line for 1. [Team fouls: 3] (Tim Johnson: 1 personal fouls)   FT 1/1: GOOD Austin Russell makes 1/1 from the line.
Score: 10-26

[04:11] Team_027 possession (Score: 10-26)
Scottie Harden drives and kicks out. Tony Doncic attempts a Midrange. Contested by Austin Russell (4.6 feet, ZONE). TONY DONCIC MAKES IT! Assist: Scottie Harden
Score: 12-26

[04:01] Team_028 possession (Score: 12-26)
Kawhi Ball makes the Layup and draws the foul on Tony Doncic! And-1! Kawhi Ball to the line for 1. [Team fouls: 4] (Tony Doncic: 1 personal fouls)   FT 1/1: GOOD Kawhi Ball makes 1/1 from the line.
Score: 12-29

[03:46] Team_027 possession (Score: 12-29)
Tim Johnson makes the Layup and draws the foul on Austin Russell! And-1! Tim Johnson to the line for 1. [Team fouls: 3] (Austin Russell: 2 personal fouls)   FT 1/1: GOOD Tim Johnson makes 1/1 from the line.
Score: 15-29

[03:34] Team_028 possession (Score: 15-29)
Austin Russell attempts a 3Pt. Contested by Tony Doncic (3.9 feet, ZONE). AUSTIN RUSSELL MAKES IT! Assist: Jimmy Brogdon
Score: 15-32

[03:16] Team_027 possession (Score: 15-32)
Bradley Dosunmu attempts a Midrange. Contested by Kawhi Ball (4.6 feet, ZONE). BRADLEY DOSUNMU MAKES IT!
Score: 17-32

[03:06] Team_028 possession (Score: 17-32)
Carmelo Carter attempts a Midrange. Contested by Tony Doncic (4.4 feet, MAN). Carmelo Carter misses. Rebound secured by John Russell.

[02:52] Team_027 possession (Score: 17-32)
FOUL! Holding foul on Austin Russell. [Team fouls: 4] No free throws, side out. (Austin Russell: 3 personal fouls)

[02:38] Team_027 possession (Score: 17-32)
John Russell drives and kicks out. Tim Johnson attempts a Midrange. Contested by Austin Russell (4.7 feet, MAN). Tim Johnson misses. Rebound secured by Jimmy Brogdon.

[02:27] Team_028 possession (Score: 17-32)
Austin Russell attempts a Layup. Contested by John Russell (4.2 feet, ZONE). Austin Russell misses. Rebound secured by John Russell.

[02:14] Team_027 possession (Score: 17-32)
Bradley Dosunmu attempts a 3Pt. Contested by Kawhi Ball (4.7 feet, MAN). Bradley Dosunmu misses. Rebound secured by Jimmy Brogdon.

[02:03] Team_028 possession (Score: 17-32)
Austin Russell attempts a 3Pt. Contested by Tim Johnson (5.1 feet, MAN). Austin Russell misses. Rebound secured by John Russell.

[01:44] Team_027 possession (Score: 17-32)
Tony Doncic attempts a 3Pt. Contested by Myles Haliburton (4.1 feet, ZONE). TONY DONCIC MAKES IT! Assist: Scottie Harden
Score: 20-32

[01:27] Team_028 possession (Score: 20-32)
Kawhi Ball drives and kicks out. Jimmy Brogdon attempts a Midrange. Contested by Bradley Dosunmu (4.8 feet, ZONE). Jimmy Brogdon misses. Rebound secured by Bradley Dosunmu.

[01:12] Team_027 possession (Score: 20-32)
Bradley Dosunmu makes the Layup and draws the foul on Kawhi Ball! And-1! Bradley Dosunmu to the line for 1. [BONUS: 5 team fouls] (Kawhi Ball: 2 personal fouls)   FT 1/1: GOOD Bradley Dosunmu makes 1/1 from the line.
Score: 23-32

[00:55] Team_028 possession (Score: 23-32)
Austin Russell attempts a 3Pt. Contested by Bradley Dosunmu (4.7 feet, ZONE). Austin Russell misses. Rebound secured by John Russell.

[00:39] Team_027 possession (Score: 23-32)
Scottie Harden drives and kicks out. FOUL! Shooting foul on Kawhi Ball. Bradley Dosunmu to the line for 2 free throws. [BONUS: 6 team fouls] (Kawhi Ball: 3 personal fouls)   FT 1/2: GOOD   FT 2/2: GOOD Bradley Dosunmu makes 2/2 from the line.
Score: 25-32

[00:26] Team_028 possession (Score: 25-32)
Carmelo Carter attempts a 3Pt. Contested by Tim Johnson (5.7 feet, ZONE). Carmelo Carter misses. Offensive rebound by Kawhi Ball! Kawhi Ball kicks it out.

[00:14] Team_028 possession (Score: 25-32)
Carmelo Carter makes the Midrange and draws the foul on Tony Doncic! And-1! Carmelo Carter to the line for 1. [BONUS: 5 team fouls] (Tony Doncic: 2 personal fouls)   FT 1/1: GOOD Carmelo Carter makes 1/1 from the line.
Score: 25-35

================================================================================
                              1ST QUARTER COMPLETE                              
================================================================================

1ST QUARTER SCORE: Team_027 25, Team_028 35

BOX SCORE:
================================================================================

Team_027
--------------------------------------------------------------------------------
Player                MIN  PTS  REB  AST  TO      FG   FG%      3P   3P%
--------------------------------------------------------------------------------
Tony Doncic            12    9    0    0   0   4/6    66.7     0/0   0.0
Bradley Dosunmu        12    9    3    0   0   4/6    66.7     0/0   0.0
John Russell           12    4    6    0   0   2/5    40.0     0/0   0.0
Tim Johnson            12    3    0    0   0   1/1   100.0     0/0   0.0
Scottie Harden         12    0    0    2   0   0/1     0.0     0/0   0.0

TEAM: FG: 11/19 (57.9%), 3PT: 2/6 (33.3%), REB: 9 (2 off, 7 def), AST: 2, TO: 4
TEAM FOULS: 5 [Team_028 in BONUS]


Team_028
--------------------------------------------------------------------------------
Player                MIN  PTS  REB  AST  TO      FG   FG%      3P   3P%
--------------------------------------------------------------------------------
Austin Russell         12   11    0    3   0   4/8    50.0     0/0   0.0
Carmelo Carter         12    9    1    2   0   4/6    66.7     0/0   0.0
Jimmy Brogdon          12    5    8    2   0   2/2   100.0     0/0   0.0
Myles Haliburton       12    5    0    0   0   2/2   100.0     0/0   0.0
Kawhi Ball             12    3    1    1   0   1/3    33.3     0/0   0.0

TEAM: FG: 13/21 (61.9%), 3PT: 3/6 (50.0%), REB: 10 (3 off, 7 def), AST: 8, TO: 2
TEAM FOULS: 6 [Team_027 in BONUS]

================================================================================

================================================================================
                       2ND QUARTER - Team_027 vs Team_028                       
================================================================================

[12:00] Team_027 possession (Score: 25-35)
Bradley Dosunmu attempts a Midrange. Contested by Kawhi Ball (4.7 feet, ZONE). BRADLEY DOSUNMU MAKES IT!
Score: 27-35

[11:46] Team_028 possession (Score: 27-35)
Kawhi Ball makes the Dunk and draws the foul on Tony Doncic! And-1! Kawhi Ball to the line for 1. [Team fouls: 1] (Tony Doncic: 1 personal fouls)   FT 1/1: GOOD Kawhi Ball makes 1/1 from the line.
Score: 27-38

[11:31] Team_027 possession (Score: 27-38)
Tony Doncic drives and kicks out. John Russell attempts a Midrange. Contested by Jimmy Brogdon (4.8 feet, MAN). JOHN RUSSELL MAKES IT!
Score: 29-38

[11:18] Team_028 possession (Score: 29-38)
Jimmy Brogdon attempts a Layup. BLOCKED BY JOHN RUSSELL! Ball is loose! Offensive rebound by Jimmy Brogdon! Jimmy Brogdon kicks it out.

[11:08] Team_028 possession (Score: 29-38)
Jimmy Brogdon drives, John Russell stays with him. Jimmy Brogdon attempts a Layup. Contested by John Russell (4.9 feet, ZONE). JIMMY BROGDON MAKES IT!
Score: 29-40

[10:56] Team_027 possession (Score: 29-40)
Tony Doncic attempts a Layup. Contested by Kawhi Ball (4.9 feet, ZONE). TONY DONCIC MAKES IT! Assist: Tim Johnson
Score: 31-40

[10:44] Team_028 possession (Score: 31-40)
Myles Haliburton attempts a Midrange. Contested by Tony Doncic (4.4 feet, ZONE). MYLES HALIBURTON MAKES IT! Assist: Austin Russell
Score: 31-42

[10:30] Team_027 possession (Score: 31-42)
Tim Johnson attempts a 3Pt. Contested by Austin Russell (5.2 feet, ZONE). Tim Johnson misses. Offensive rebound by John Russell! John Russell puts it back in!
Score: 33-42

[10:15] Team_028 possession (Score: 33-42)
Kawhi Ball attempts a 3Pt. Contested by Bradley Dosunmu (5.0 feet, MAN). Kawhi Ball misses. Rebound secured by Bradley Dosunmu.

[10:01] Team_027 possession (Score: 33-42)
John Russell attempts a 3Pt. Contested by Austin Russell (5.7 feet, ZONE). John Russell misses. Rebound secured by Kawhi Ball.

[09:47] Team_028 possession (Score: 33-42)
Austin Russell attempts a Midrange. Contested by Tim Johnson (5.4 feet, MAN). Austin Russell misses. Rebound secured by John Russell.

[09:29] Team_027 possession (Score: 33-42)
John Russell attempts a Midrange. Contested by Austin Russell (5.7 feet, ZONE). John Russell misses. Rebound secured by Carmelo Carter.

[09:15] Team_028 possession (Score: 33-42)
Jimmy Brogdon attempts a Midrange. Contested by Tony Doncic (4.9 feet, ZONE). Jimmy Brogdon misses. Rebound secured by Bradley Dosunmu.

[09:02] Team_027 possession (Score: 33-42)
FOUL! Reach-in foul on Austin Russell during the drive. [Team fouls: 1] No free throws, side out. (Austin Russell: 1 personal fouls)

[08:46] Team_027 possession (Score: 33-42)
Scottie Harden attempts a Midrange. Contested by Myles Haliburton (4.3 feet, MAN). Scottie Harden misses. Rebound secured by Jimmy Brogdon.

[08:36] Team_028 possession (Score: 33-42)
Carmelo Carter attempts a 3Pt. Contested by Tony Doncic (4.9 feet, MAN). CARMELO CARTER MAKES IT! Assist: Austin Russell
Score: 33-45

[08:21] Team_027 possession (Score: 33-45)
John Russell attempts a Midrange. Contested by Jimmy Brogdon (5.8 feet, MAN). JOHN RUSSELL MAKES IT!
Score: 35-45

[08:02] Team_028 possession (Score: 35-45)
Austin Russell attempts a Midrange. Contested by Scottie Harden (5.3 feet, ZONE). Austin Russell misses. Rebound secured by Bradley Dosunmu.

[07:49] Team_027 possession (Score: 35-45)
Scottie Harden attempts a Midrange. Contested by Myles Haliburton (4.5 feet, MAN). Scottie Harden misses. Rebound secured by Jimmy Brogdon.

[07:36] Team_028 possession (Score: 35-45)
Myles Haliburton attempts a 3Pt. Contested by Scottie Harden (5.6 feet, MAN). Myles Haliburton misses. Rebound secured by Bradley Dosunmu.

[07:21] Team_027 possession (Score: 35-45)
Tim Johnson attempts a Midrange. Contested by Austin Russell (5.5 feet, MAN). Tim Johnson misses. Rebound secured by Kawhi Ball.

[07:03] Team_028 possession (Score: 35-45)
Jimmy Brogdon drives and kicks out. Austin Russell attempts a 3Pt. Contested by Bradley Dosunmu (5.4 feet, ZONE). Austin Russell misses. Offensive rebound by Jimmy Brogdon! Jimmy Brogdon kicks it out.

[06:50] Team_028 possession (Score: 35-45)
Kawhi Ball makes the Layup and draws the foul on Tony Doncic! And-1! Kawhi Ball to the line for 1. [Team fouls: 3] (Tony Doncic: 2 personal fouls)   FT 1/1: GOOD Kawhi Ball makes 1/1 from the line.
Score: 35-48

[06:36] Team_027 possession (Score: 35-48)
Scottie Harden loses the ball! Stripped by Myles Haliburton! TURNOVER! (live ball)

[06:20] Team_028 possession (Score: 35-48)
Jimmy Brogdon attempts a Layup. Contested by John Russell (5.5 feet, ZONE). JIMMY BROGDON MAKES IT! Assist: Myles Haliburton
Score: 35-50

[06:07] Team_027 possession (Score: 35-50)
Tim Johnson attempts a Midrange. Contested by Carmelo Carter (5.7 feet, ZONE). Tim Johnson misses. Offensive rebound by Bradley Dosunmu! Bradley Dosunmu kicks it out.

[05:54] Team_027 possession (Score: 35-50)
John Russell attempts a Layup. Wide open! Jimmy Brogdon is 6.2 feet away. [MAN] JOHN RUSSELL MAKES IT! Assist: Bradley Dosunmu
Score: 37-50

[05:35] Team_028 possession (Score: 37-50)
Jimmy Brogdon drives to the basket... Jimmy Brogdon throws a bad pass! Stolen by Bradley Dosunmu! TURNOVER! (live ball)

[05:21] Team_027 possession (Score: 37-50)
FOUL! Reach-in foul on Myles Haliburton during the drive. [Team fouls: 2] No free throws, side out. (Myles Haliburton: 1 personal fouls)

[05:03] Team_027 possession (Score: 37-50)
Bradley Dosunmu attempts a Layup. Contested by Jimmy Brogdon (5.7 feet, ZONE). Bradley Dosunmu misses. Rebound secured by Jimmy Brogdon.

[04:47] Team_028 possession (Score: 37-50)
Austin Russell drives and kicks out. Myles Haliburton attempts a Midrange. Wide open! Scottie Harden is 6.0 feet away. [MAN] Myles Haliburton misses. Rebound secured by John Russell.

[04:33] Team_027 possession (Score: 37-50)
Bradley Dosunmu drives, picks up Kawhi Ball. Help arrives from Carmelo Carter! Bradley Dosunmu attempts a Layup. Contested by Carmelo Carter (5.8 feet, ZONE). BRADLEY DOSUNMU MAKES IT!
Score: 39-50

[04:21] Team_028 possession (Score: 39-50)
Myles Haliburton attempts a Layup. Wide open! Scottie Harden is 6.0 feet away. [MAN] MYLES HALIBURTON MAKES IT! Assist: Austin Russell
Score: 39-52

[04:08] Team_027 possession (Score: 39-52)
Tony Doncic attempts a Midrange. Contested by Carmelo Carter (5.9 feet, ZONE). Tony Doncic misses. Rebound secured by Kawhi Ball.

[03:52] Team_028 possession (Score: 39-52)
Jimmy Brogdon drives and kicks out. Carmelo Carter attempts a Midrange. Wide open! Scottie Harden is 6.2 feet away. [ZONE] Carmelo Carter misses. Rebound secured by Bradley Dosunmu.

[03:38] Team_027 possession (Score: 39-52)
Tim Johnson makes the Layup and draws the foul on Kawhi Ball! And-1! Tim Johnson to the line for 1. [Team fouls: 3] (Kawhi Ball: 1 personal fouls)   FT 1/1: MISS Tim Johnson makes 0/1 from the line. Rebound secured by Carmelo Carter.
Score: 41-52

[03:22] Team_028 possession (Score: 41-52)
Austin Russell drives to the basket... Austin Russell throws a bad pass! Stolen by Tim Johnson! TURNOVER! (live ball)

[03:10] Team_027 possession (Score: 41-52)
Tony Doncic attempts a 3Pt. Wide open! Carmelo Carter is 6.0 feet away. [MAN] Tony Doncic misses. Rebound secured by Carmelo Carter.

[02:55] Team_028 possession (Score: 41-52)
Myles Haliburton attempts a 3Pt. Contested by Bradley Dosunmu (5.9 feet, ZONE). Myles Haliburton misses. Rebound secured by Bradley Dosunmu.

[02:39] Team_027 possession (Score: 41-52)
Tim Johnson throws a bad pass out of bounds! TURNOVER! (dead ball)

[02:39] Substitution (Team_027): Tim Johnson OUT → CJ Green IN (stamina_rule2)

[02:39] Substitution (Team_027): Tony Doncic OUT → Dirk Lillard IN (stamina_rule2)

[02:39] Substitution (Team_027): Scottie Harden OUT → Rudy Quickley IN (stamina_rule2)

[02:39] Substitution (Team_027): Bradley Dosunmu OUT → LeBron Russell IN (stamina_rule2)

[02:39] Substitution (Team_027): John Russell OUT → Ben Stewart IN (stamina_rule2)

[02:39] Substitution (Team_028): Austin Russell OUT → Scottie Ingram IN (stamina_rule2)

[02:39] Substitution (Team_028): Carmelo Carter OUT → Tyrese Quickley IN (stamina_rule2)

[02:39] Substitution (Team_028): Myles Haliburton OUT → Miles Booker IN (stamina_rule2)

[02:39] Substitution (Team_028): Kawhi Ball OUT → Bam Towns IN (stamina_rule2)

[02:39] Substitution (Team_028): Jimmy Brogdon OUT → Collin Bridges IN (stamina_rule2)

[02:28] Team_028 possession (Score: 41-52)
Bam Towns attempts a Midrange. Contested by LeBron Russell (5.5 feet, ZONE). BAM TOWNS MAKES IT! Assist: Collin Bridges
Score: 41-54

[02:13] Team_027 possession (Score: 41-54)
Dirk Lillard drives, Tyrese Quickley stays with him. Dirk Lillard attempts a Dunk. Contested by Tyrese Quickley (4.5 feet, MAN). DIRK LILLARD MAKES IT! Assist: Rudy Quickley
Score: 43-54

[02:00] Team_028 possession (Score: 43-54)
Tyrese Quickley attempts a 3Pt. Contested by Rudy Quickley (3.5 feet, ZONE). TYRESE QUICKLEY MAKES IT! Assist: Miles Booker
Score: 43-57

[01:45] Team_027 possession (Score: 43-57)
LeBron Russell drives to the basket... LeBron Russell throws a bad pass! Stolen by Collin Bridges! TURNOVER! (live ball)

[01:29] Team_028 possession (Score: 43-57)
FOUL! Shooting foul on Rudy Quickley. Miles Booker to the line for 2 free throws. [Team fouls: 4] (Rudy Quickley: 1 personal fouls)   FT 1/2: GOOD   FT 2/2: GOOD Miles Booker makes 2/2 from the line.
Score: 43-59

[01:15] Team_027 possession (Score: 43-59)
Ben Stewart drives to the basket... Ben Stewart loses control! Ball rolls out of bounds! TURNOVER! (dead ball)

[01:01] Team_028 possession (Score: 43-59)
Miles Booker attempts a 3Pt. Contested by Rudy Quickley (3.3 feet, MAN). Miles Booker misses. Rebound secured by Ben Stewart.

[00:46] Team_027 possession (Score: 43-59)
Rudy Quickley attempts a 3Pt. Wide open! Miles Booker is 6.4 feet away. [MAN] RUDY QUICKLEY MAKES IT! Assist: Ben Stewart
Score: 46-59

[00:36] Team_028 possession (Score: 46-59)
FOUL! Reach-in foul on Ben Stewart during the drive. [IN THE BONUS! 5 team fouls] Collin Bridges to the line for 2 free throws. (Ben Stewart: 1 personal fouls)   FT 1/2: GOOD   FT 2/2: GOOD Collin Bridges makes 2/2 from the line.
Score: 46-61

[00:20] Team_027 possession (Score: 46-61)
Dirk Lillard attempts a Layup. BLOCKED BY TYRESE QUICKLEY! Ball is loose! Rebound secured by Bam Towns.

[00:09] Team_028 possession (Score: 46-61)
Collin Bridges attempts a Midrange. Contested by Ben Stewart (4.9 feet, MAN). Collin Bridges misses. Rebound secured by Ben Stewart.

================================================================================
                              2ND QUARTER COMPLETE                              
================================================================================

2ND QUARTER SCORE: Team_027 21, Team_028 26

BOX SCORE:
================================================================================

Team_027
--------------------------------------------------------------------------------
Player                MIN  PTS  REB  AST  TO      FG   FG%      3P   3P%
--------------------------------------------------------------------------------
John Russell           22    8    3    0   0   4/6    66.7     0/0   0.0
Bradley Dosunmu        22    4    7    1   0   2/3    66.7     0/0   0.0
Rudy Quickley           2    3    0    1   0   1/1   100.0     0/0   0.0
Tony Doncic            22    2    0    0   0   1/3    33.3     0/0   0.0
Dirk Lillard            2    2    0    0   0   1/2    50.0     0/0   0.0
Tim Johnson            22    0    0    1   0   0/2     0.0     0/0   0.0
Scottie Harden         22    0    0    0   0   0/2     0.0     0/0   0.0
Ben Stewart             2    0    2    1   0   0/0     0.0     0/0   0.0

TEAM: FG: 9/19 (47.4%), 3PT: 2/4 (50.0%), REB: 12 (2 off, 10 def), AST: 4, TO: 4
TEAM FOULS: 5 [Team_028 in BONUS]


Team_028
--------------------------------------------------------------------------------
Player                MIN  PTS  REB  AST  TO      FG   FG%      3P   3P%
--------------------------------------------------------------------------------
Kawhi Ball             22    6    3    0   0   2/3    66.7     0/0   0.0
Jimmy Brogdon          22    4    5    0   0   2/4    50.0     0/0   0.0
Myles Haliburton       22    4    0    1   0   2/4    50.0     0/0   0.0
Carmelo Carter         22    3    3    0   0   1/1   100.0     0/0   0.0
Tyrese Quickley         2    3    0    0   0   1/1   100.0     0/0   0.0
Bam Towns               2    2    1    0   0   1/1   100.0     0/0   0.0
Collin Bridges          2    2    0    1   0   1/2    50.0     0/0   0.0
Miles Booker            2    2    0    1   0   1/2    50.0     0/0   0.0
Austin Russell         22    0    0    3   0   0/3     0.0     0/0   0.0

TEAM: FG: 11/21 (52.4%), 3PT: 2/6 (33.3%), REB: 12 (2 off, 10 def), AST: 6, TO: 2
TEAM FOULS: 3

================================================================================

================================================================================
                       3RD QUARTER - Team_027 vs Team_028                       
================================================================================

[12:00] Team_027 possession (Score: 46-61)
Scottie Harden drives, Kawhi Ball stays with him. Scottie Harden attempts a Dunk. Contested by Kawhi Ball (4.3 feet, ZONE). Scottie Harden misses. Rebound secured by Kawhi Ball.

[11:47] Team_028 possession (Score: 46-61)
Carmelo Carter makes the Layup and draws the foul on John Russell! And-1! Carmelo Carter to the line for 1. [Team fouls: 1] (John Russell: 1 personal fouls)   FT 1/1: GOOD Carmelo Carter makes 1/1 from the line.
Score: 46-64

[11:29] Team_027 possession (Score: 46-64)
Tim Johnson drives, picks up Austin Russell. Help arrives from Carmelo Carter! Tim Johnson attempts a Dunk. Contested by Carmelo Carter (4.7 feet, MAN). TIM JOHNSON MAKES IT! Assist: Bradley Dosunmu
Score: 48-64

[11:13] Team_028 possession (Score: 48-64)
Kawhi Ball attempts a Midrange. Contested by Bradley Dosunmu (4.6 feet, MAN). Kawhi Ball misses. Rebound secured by Bradley Dosunmu.

[11:00] Team_027 possession (Score: 48-64)
Scottie Harden attempts a Midrange. Contested by Myles Haliburton (3.7 feet, MAN). Scottie Harden misses. Rebound secured by Jimmy Brogdon.

[10:41] Team_028 possession (Score: 48-64)
Kawhi Ball attempts a Layup. Contested by Bradley Dosunmu (4.6 feet, MAN). KAWHI BALL MAKES IT! Assist: Myles Haliburton
Score: 48-66

[10:28] Team_027 possession (Score: 48-66)
Bradley Dosunmu makes the Layup and draws the foul on Kawhi Ball! And-1! Bradley Dosunmu to the line for 1. [Team fouls: 1] (Kawhi Ball: 1 personal fouls)   FT 1/1: GOOD Bradley Dosunmu makes 1/1 from the line.
Score: 51-66

[10:15] Team_028 possession (Score: 51-66)
Kawhi Ball attempts a 3Pt. Contested by Bradley Dosunmu (4.6 feet, MAN). Kawhi Ball misses. Rebound secured by Bradley Dosunmu.

[10:02] Team_027 possession (Score: 51-66)
Tim Johnson throws a bad pass out of bounds! TURNOVER! (dead ball)

[09:50] Team_028 possession (Score: 51-66)
Kawhi Ball drives and kicks out. Carmelo Carter attempts a 3Pt. Contested by Tony Doncic (3.9 feet, MAN). Carmelo Carter misses. Rebound secured by Tony Doncic.

[09:34] Team_027 possession (Score: 51-66)
Scottie Harden attempts a Midrange. Contested by Carmelo Carter (4.5 feet, ZONE). Scottie Harden misses. Rebound secured by Carmelo Carter.

[09:19] Team_028 possession (Score: 51-66)
FOUL! Holding foul on Tony Doncic. [Team fouls: 2] No free throws, side out. (Tony Doncic: 1 personal fouls)

[09:06] Team_028 possession (Score: 51-66)
Austin Russell attempts a 3Pt. Contested by Tim Johnson (4.8 feet, MAN). Austin Russell misses. Rebound secured by John Russell.

[08:48] Team_027 possession (Score: 51-66)
Tony Doncic attempts a 3Pt. Contested by Carmelo Carter (4.6 feet, MAN). TONY DONCIC MAKES IT! Assist: Tim Johnson
Score: 54-66

[08:29] Team_028 possession (Score: 54-66)
Myles Haliburton attempts a Layup. Contested by Scottie Harden (4.6 feet, MAN). MYLES HALIBURTON MAKES IT! Assist: Kawhi Ball
Score: 54-68

[08:13] Team_027 possession (Score: 54-68)
Tony Doncic attempts a Midrange. Contested by Carmelo Carter (4.6 feet, MAN). TONY DONCIC MAKES IT! Assist: Scottie Harden
Score: 56-68

[08:02] Team_028 possession (Score: 56-68)
FOUL! Reach-in foul on John Russell during the drive. [Team fouls: 3] No free throws, side out. (John Russell: 2 personal fouls)

[07:44] Team_028 possession (Score: 56-68)
Myles Haliburton drives, picks up Scottie Harden. Help arrives from Tony Doncic! Myles Haliburton attempts a Layup. Contested by Tony Doncic (4.6 feet, MAN). Myles Haliburton misses. Rebound secured by Tony Doncic.

[07:28] Team_027 possession (Score: 56-68)
FOUL! Reach-in foul on Kawhi Ball during the drive. [Team fouls: 2] No free throws, side out. (Kawhi Ball: 2 personal fouls)

[07:17] Team_027 possession (Score: 56-68)
Bradley Dosunmu makes the Midrange and draws the foul on Myles Haliburton! And-1! Bradley Dosunmu to the line for 1. [Team fouls: 3] (Myles Haliburton: 1 personal fouls)   FT 1/1: GOOD Bradley Dosunmu makes 1/1 from the line.
Score: 59-68

[07:03] Team_028 possession (Score: 59-68)
Kawhi Ball attempts a 3Pt. Contested by Bradley Dosunmu (4.6 feet, MAN). Kawhi Ball misses. Rebound secured by Bradley Dosunmu.

[06:49] Team_027 possession (Score: 59-68)
Scottie Harden drives and kicks out. Tim Johnson attempts a Midrange. Contested by Austin Russell (4.4 feet, MAN). Tim Johnson misses. Rebound secured by Carmelo Carter.

[06:36] Team_028 possession (Score: 59-68)
Carmelo Carter makes the Layup and draws the foul on Scottie Harden! And-1! Carmelo Carter to the line for 1. [Team fouls: 4] (Scottie Harden: 1 personal fouls)   FT 1/1: MISS Carmelo Carter makes 0/1 from the line. Rebound secured by John Russell.
Score: 59-70

[06:18] Team_027 possession (Score: 59-70)
Bradley Dosunmu attempts a Layup. Contested by Kawhi Ball (4.3 feet, ZONE). Bradley Dosunmu misses. Rebound secured by Carmelo Carter.

[06:03] Team_028 possession (Score: 59-70)
FOUL! Holding foul on Tony Doncic. [IN THE BONUS! 5 team fouls] Carmelo Carter to the line for 2 free throws. (Tony Doncic: 2 personal fouls)   FT 1/2: GOOD   FT 2/2: GOOD Carmelo Carter makes 2/2 from the line.
Score: 59-72

[05:47] Team_027 possession (Score: 59-72)
FOUL! Shooting foul on Carmelo Carter. Tony Doncic to the line for 2 free throws. [Team fouls: 4] (Carmelo Carter: 1 personal fouls)   FT 1/2: GOOD   FT 2/2: GOOD Tony Doncic makes 2/2 from the line.
Score: 61-72

[05:31] Team_028 possession (Score: 61-72)
FOUL! Shooting foul on John Russell. Austin Russell to the line for 2 free throws. [BONUS: 6 team fouls] (John Russell: 3 personal fouls)   FT 1/2: GOOD   FT 2/2: GOOD Austin Russell makes 2/2 from the line.
Score: 61-74

[05:18] Team_027 possession (Score: 61-74)
FOUL! Shooting foul on Carmelo Carter. Tony Doncic to the line for 3 free throws. [BONUS: 5 team fouls] (Carmelo Carter: 2 personal fouls)   FT 1/3: GOOD   FT 2/3: GOOD   FT 3/3: GOOD Tony Doncic makes 3/3 from the line.
Score: 64-74

[05:04] Team_028 possession (Score: 64-74)
FOUL! Holding foul on Scottie Harden. [IN THE BONUS! 7 team fouls] Myles Haliburton to the line for 2 free throws. (Scottie Harden: 2 personal fouls)   FT 1/2: GOOD   FT 2/2: MISS Myles Haliburton makes 1/2 from the line. Rebound secured by Tony Doncic.
Score: 64-75

[04:50] Team_027 possession (Score: 64-75)
Tony Doncic attempts a Layup. Contested by Kawhi Ball (4.4 feet, ZONE). TONY DONCIC MAKES IT! Assist: Tim Johnson
Score: 66-75

[04:36] Team_028 possession (Score: 66-75)
Myles Haliburton drives to the basket... Myles Haliburton loses the ball! Stripped by John Russell! TURNOVER! (live ball)

[04:21] Team_027 possession (Score: 66-75)
FOUL! Holding foul on Austin Russell. [IN THE BONUS! 6 team fouls] Tim Johnson to the line for 2 free throws. (Austin Russell: 1 personal fouls)   FT 1/2: GOOD   FT 2/2: GOOD Tim Johnson makes 2/2 from the line.
Score: 68-75

[04:11] Team_028 possession (Score: 68-75)
Myles Haliburton attempts a 3Pt. Contested by Scottie Harden (4.7 feet, MAN). MYLES HALIBURTON MAKES IT! Assist: Carmelo Carter
Score: 68-78

[03:56] Team_027 possession (Score: 68-78)
Tony Doncic drives and kicks out. Scottie Harden attempts a 3Pt. Contested by Austin Russell (4.5 feet, ZONE). Scottie Harden misses. Offensive rebound by Bradley Dosunmu! Bradley Dosunmu kicks it out.

[03:39] Team_027 possession (Score: 68-78)
Bradley Dosunmu attempts a Midrange. Contested by Carmelo Carter (4.7 feet, ZONE). Bradley Dosunmu misses. Rebound secured by Kawhi Ball.

[03:21] Team_028 possession (Score: 68-78)
Carmelo Carter attempts a Midrange. Contested by Bradley Dosunmu (4.8 feet, ZONE). Carmelo Carter misses. Rebound secured by Bradley Dosunmu.

[03:04] Team_027 possession (Score: 68-78)
Scottie Harden attempts a 3Pt. Contested by Austin Russell (4.6 feet, ZONE). SCOTTIE HARDEN MAKES IT! Assist: Tim Johnson
Score: 71-78

[02:53] Team_028 possession (Score: 71-78)
Austin Russell attempts a Midrange. Contested by Tim Johnson (5.0 feet, MAN). Austin Russell misses. Rebound secured by Tony Doncic.

[02:38] Team_027 possession (Score: 71-78)
Scottie Harden drives, Kawhi Ball stays with him. Scottie Harden attempts a Dunk. Contested by Kawhi Ball (4.6 feet, ZONE). SCOTTIE HARDEN MAKES IT! Assist: Tim Johnson
Score: 73-78

[02:24] Team_028 possession (Score: 73-78)
Austin Russell attempts a 3Pt. Contested by Tim Johnson (5.0 feet, MAN). Austin Russell misses. Rebound secured by Bradley Dosunmu.

[02:07] Team_027 possession (Score: 73-78)
FOUL! Offensive foul on Tim Johnson! Austin Russell drew the charge! [Team fouls: 8] (Tim Johnson: 1 personal fouls) TURNOVER! (dead ball)

[01:56] Team_028 possession (Score: 73-78)
Jimmy Brogdon drives and kicks out. Jimmy Brogdon attempts a 3Pt. Contested by John Russell (4.3 feet, MAN). Jimmy Brogdon misses. Rebound secured by John Russell.

[01:43] Team_027 possession (Score: 73-78)
John Russell drives, picks up Jimmy Brogdon. Help arrives from Carmelo Carter! John Russell attempts a Layup. Contested by Carmelo Carter (5.4 feet, MAN). JOHN RUSSELL MAKES IT! Assist: Tony Doncic
Score: 75-78

[01:30] Team_028 possession (Score: 75-78)
Kawhi Ball attempts a 3Pt. Contested by Bradley Dosunmu (4.9 feet, MAN). Kawhi Ball misses. Rebound secured by John Russell.

[01:15] Team_027 possession (Score: 75-78)
Tony Doncic attempts a 3Pt. Contested by Austin Russell (4.9 feet, ZONE). Tony Doncic misses. Rebound secured by Jimmy Brogdon.

[00:57] Team_028 possession (Score: 75-78)
FOUL! Shooting foul on John Russell. Jimmy Brogdon to the line for 2 free throws. [BONUS: 9 team fouls] (John Russell: 4 personal fouls)   FT 1/2: GOOD   FT 2/2: GOOD Jimmy Brogdon makes 2/2 from the line.
Score: 75-80

[00:45] Team_027 possession (Score: 75-80)
Tim Johnson attempts a 3Pt. Contested by Austin Russell (5.1 feet, ZONE). Tim Johnson misses. Offensive rebound by Bradley Dosunmu! Bradley Dosunmu kicks it out.

[00:27] Team_027 possession (Score: 75-80)
John Russell attempts a Midrange. Contested by Jimmy Brogdon (5.5 feet, MAN). JOHN RUSSELL MAKES IT! Assist: Scottie Harden
Score: 77-80

[00:12] Team_028 possession (Score: 77-80)
Myles Haliburton attempts a 3Pt. Contested by Scottie Harden (5.1 feet, ZONE). Myles Haliburton misses. Rebound secured by John Russell.

================================================================================
                              3RD QUARTER COMPLETE                              
================================================================================

3RD QUARTER SCORE: Team_027 31, Team_028 19

BOX SCORE:
================================================================================

Team_027
--------------------------------------------------------------------------------
Player                MIN  PTS  REB  AST  TO      FG   FG%      3P   3P%
--------------------------------------------------------------------------------
Tony Doncic            34   12    4    1   0   5/6    83.3     0/0   0.0
Bradley Dosunmu        34    6    7    1   0   2/4    50.0     0/0   0.0
Scottie Harden         34    5    0    2   0   2/6    33.3     0/0   0.0
Tim Johnson            34    4    0    4   0   2/2   100.0     0/0   0.0
John Russell           34    4    5    0   0   2/2   100.0     0/0   0.0

TEAM: FG: 13/20 (65.0%), 3PT: 3/4 (75.0%), REB: 16 (2 off, 14 def), AST: 8, TO: 2
TEAM FOULS: 9 [Team_028 in BONUS]


Team_028
--------------------------------------------------------------------------------
Player                MIN  PTS  REB  AST  TO      FG   FG%      3P   3P%
--------------------------------------------------------------------------------
Carmelo Carter         34    5    3    1   0   2/4    50.0     0/0   0.0
Myles Haliburton       34    5    0    1   0   2/4    50.0     0/0   0.0
Kawhi Ball             34    2    2    1   0   1/6    16.7     0/0   0.0
Jimmy Brogdon          34    2    2    0   0   1/2    50.0     0/0   0.0
Austin Russell         34    2    0    0   0   1/4    25.0     0/0   0.0

TEAM: FG: 7/21 (33.3%), 3PT: 1/7 (14.3%), REB: 7 (0 off, 7 def), AST: 3, TO: 1
TEAM FOULS: 6 [Team_027 in BONUS]

================================================================================

================================================================================
                       4TH QUARTER - Team_027 vs Team_028                       
================================================================================

[12:00] Team_027 possession (Score: 77-80)
Tony Doncic attempts a 3Pt. Contested by Austin Russell (4.8 feet, ZONE). Tony Doncic misses. Rebound secured by Kawhi Ball.

[11:48] Team_028 possession (Score: 77-80)
Austin Russell attempts a 3Pt. Contested by Tony Doncic (4.0 feet, ZONE). Austin Russell misses. Rebound secured by John Russell.

[11:32] Team_027 possession (Score: 77-80)
Tony Doncic drives, picks up Kawhi Ball. Help arrives from Carmelo Carter! Tony Doncic attempts a Dunk. Contested by Carmelo Carter (4.8 feet, ZONE). Tony Doncic misses. Offensive rebound by John Russell! John Russell's putback is no good. Rebound secured by Kawhi Ball.

[11:19] Team_028 possession (Score: 77-80)
Austin Russell attempts a 3Pt. Contested by Tim Johnson (5.1 feet, MAN). Austin Russell misses. Rebound secured by Tony Doncic.

[11:07] Team_027 possession (Score: 77-80)
FOUL! Shooting foul on Myles Haliburton. Scottie Harden to the line for 3 free throws. [Team fouls: 1] (Myles Haliburton: 1 personal fouls)   FT 1/3: GOOD   FT 2/3: GOOD   FT 3/3: GOOD Scottie Harden makes 3/3 from the line.
Score: 80-80

[10:52] Team_028 possession (Score: 80-80)
Austin Russell attempts a 3Pt. Contested by Tim Johnson (5.2 feet, ZONE). Austin Russell misses. Rebound secured by John Russell.

[10:35] Team_027 possession (Score: 80-80)
John Russell makes the Layup and draws the foul on Jimmy Brogdon! And-1! John Russell to the line for 1. [Team fouls: 2] (Jimmy Brogdon: 1 personal fouls)   FT 1/1: GOOD John Russell makes 1/1 from the line.
Score: 83-80

[10:23] Team_028 possession (Score: 83-80)
FOUL! Shooting foul on Tim Johnson. Austin Russell to the line for 2 free throws. [Team fouls: 1] (Tim Johnson: 1 personal fouls)   FT 1/2: GOOD   FT 2/2: GOOD Austin Russell makes 2/2 from the line.
Score: 83-82

[10:09] Team_027 possession (Score: 83-82)
John Russell attempts a Midrange. Contested by Myles Haliburton (4.8 feet, ZONE). John Russell misses. Rebound secured by Jimmy Brogdon.

[09:58] Team_028 possession (Score: 83-82)
Carmelo Carter attempts a Layup. Contested by Tony Doncic (4.6 feet, MAN). Carmelo Carter misses. Rebound secured by Tony Doncic.

[09:42] Team_027 possession (Score: 83-82)
Bradley Dosunmu drives to the basket... FOUL! Offensive foul on Bradley Dosunmu! Kawhi Ball drew the charge! [Team fouls: 2] (Bradley Dosunmu: 1 personal fouls) TURNOVER! (dead ball)

[09:29] Team_028 possession (Score: 83-82)
Jimmy Brogdon attempts a Layup. BLOCKED BY TONY DONCIC! Ball deflects out of bounds off Jimmy Brogdon.

[09:10] Team_027 possession (Score: 83-82)
Scottie Harden attempts a Midrange. Contested by Austin Russell (5.0 feet, ZONE). Scottie Harden misses. Rebound secured by Kawhi Ball.

[08:54] Team_028 possession (Score: 83-82)
Kawhi Ball throws a bad pass! Stolen by Bradley Dosunmu! TURNOVER! (live ball)

[08:37] Team_027 possession (Score: 83-82)
Tim Johnson drives and kicks out. John Russell attempts a Midrange. Contested by Jimmy Brogdon (5.1 feet, MAN). JOHN RUSSELL MAKES IT! Assist: Bradley Dosunmu
Score: 85-82

[08:23] Team_028 possession (Score: 85-82)
FOUL! Reach-in foul on John Russell during the drive. [Team fouls: 3] No free throws, side out. (John Russell: 1 personal fouls)

[08:07] Team_028 possession (Score: 85-82)
Carmelo Carter drives to the basket... Carmelo Carter loses the ball! Stripped by John Russell! TURNOVER! (live ball)

[07:50] Team_027 possession (Score: 85-82)
Scottie Harden attempts a Midrange. Contested by Myles Haliburton (4.4 feet, MAN). Scottie Harden misses. Rebound secured by Jimmy Brogdon.

[07:33] Team_028 possession (Score: 85-82)
Myles Haliburton attempts a Midrange. Contested by Scottie Harden (5.4 feet, ZONE). MYLES HALIBURTON MAKES IT!
Score: 85-84

[07:19] Team_027 possession (Score: 85-84)
Scottie Harden attempts a 3Pt. Contested by Austin Russell (5.2 feet, ZONE). Scottie Harden misses. Rebound secured by Carmelo Carter.

[07:06] Team_028 possession (Score: 85-84)
Kawhi Ball attempts a 3Pt. Contested by Bradley Dosunmu (5.3 feet, MAN). Kawhi Ball misses. Rebound secured by Tony Doncic.

[06:50] Team_027 possession (Score: 85-84)
Tim Johnson attempts a 3Pt. Contested by Austin Russell (5.5 feet, ZONE). Tim Johnson misses. Rebound secured by Jimmy Brogdon.

[06:33] Team_028 possession (Score: 85-84)
Kawhi Ball attempts a Midrange. Contested by Scottie Harden (5.6 feet, ZONE). KAWHI BALL MAKES IT!
Score: 85-86

[06:18] Team_027 possession (Score: 85-86)
FOUL! Holding foul on Myles Haliburton. [Team fouls: 3] No free throws, side out. (Myles Haliburton: 2 personal fouls)

[06:02] Team_027 possession (Score: 85-86)
FOUL! Reach-in foul on Carmelo Carter during the drive. [Team fouls: 4] No free throws, side out. (Carmelo Carter: 1 personal fouls)

[05:51] Team_027 possession (Score: 85-86)
Scottie Harden throws a bad pass! Stolen by Myles Haliburton! TURNOVER! (live ball)

[05:39] Team_028 possession (Score: 85-86)
FOUL! Reach-in foul on John Russell during the drive. [Team fouls: 4] No free throws, side out. (John Russell: 2 personal fouls)

[05:23] Team_028 possession (Score: 85-86)
FOUL! Shooting foul on Tim Johnson. Austin Russell to the line for 3 free throws. [BONUS: 5 team fouls] (Tim Johnson: 2 personal fouls)   FT 1/3: GOOD   FT 2/3: MISS   FT 3/3: GOOD Austin Russell makes 2/3 from the line.
Score: 85-88

[05:04] Team_027 possession (Score: 85-88)
Scottie Harden makes the Layup and draws the foul on Kawhi Ball! And-1! Scottie Harden to the line for 1. [BONUS: 5 team fouls] (Kawhi Ball: 1 personal fouls)   FT 1/1: GOOD Scottie Harden makes 1/1 from the line.
Score: 88-88

[04:51] Team_028 possession (Score: 88-88)
Myles Haliburton drives and kicks out. Myles Haliburton attempts a 3Pt. Contested by Bradley Dosunmu (5.6 feet, ZONE). Myles Haliburton misses. Offensive rebound by Kawhi Ball! Kawhi Ball kicks it out.

[04:36] Team_028 possession (Score: 88-88)
Jimmy Brogdon attempts a Midrange. Wide open! Scottie Harden is 6.1 feet away. [ZONE] JIMMY BROGDON MAKES IT! Assist: Austin Russell
Score: 88-90

[04:22] Team_027 possession (Score: 88-90)
Tim Johnson attempts a 3Pt. Contested by Austin Russell (5.7 feet, MAN). TIM JOHNSON MAKES IT! Assist: Tony Doncic
Score: 91-90

[04:06] Team_028 possession (Score: 91-90)
Myles Haliburton attempts a 3Pt. Contested by Bradley Dosunmu (5.6 feet, ZONE). Myles Haliburton misses. Offensive rebound by Kawhi Ball! Kawhi Ball kicks it out.

[03:51] Team_028 possession (Score: 91-90)
Carmelo Carter attempts a Layup. Contested by John Russell (5.7 feet, ZONE). CARMELO CARTER MAKES IT! Assist: Jimmy Brogdon
Score: 91-92

[03:37] Team_027 possession (Score: 91-92)
John Russell attempts a Midrange. Contested by Myles Haliburton (5.5 feet, ZONE). John Russell misses. Rebound secured by Kawhi Ball.

[03:23] Team_028 possession (Score: 91-92)
Kawhi Ball attempts a 3Pt. Contested by Bradley Dosunmu (5.8 feet, ZONE). Kawhi Ball misses. Rebound secured by John Russell.

[03:08] Team_027 possession (Score: 91-92)
FOUL! Reach-in foul on Austin Russell during the drive. [IN THE BONUS! 6 team fouls] Tim Johnson to the line for 2 free throws. (Austin Russell: 1 personal fouls)   FT 1/2: MISS   FT 2/2: GOOD Tim Johnson makes 1/2 from the line.
Score: 92-92

[02:52] Team_028 possession (Score: 92-92)
Myles Haliburton drives, Scottie Harden stays with him. Myles Haliburton attempts a Layup. Wide open! Scottie Harden is 6.1 feet away. [MAN] MYLES HALIBURTON MAKES IT! Assist: Austin Russell
Score: 92-94

[02:40] Team_027 possession (Score: 92-94)
Scottie Harden attempts a 3Pt. Contested by Myles Haliburton (5.1 feet, MAN). Scottie Harden misses. Rebound secured by Jimmy Brogdon.

[02:26] Team_028 possession (Score: 92-94)
Jimmy Brogdon attempts a Midrange. Contested by John Russell (6.0 feet, MAN). JIMMY BROGDON MAKES IT! Assist: Carmelo Carter
Score: 92-96

[02:14] Team_027 possession (Score: 92-96)
Scottie Harden makes the Layup and draws the foul on Jimmy Brogdon! And-1! Scottie Harden to the line for 1. [BONUS: 7 team fouls] (Jimmy Brogdon: 2 personal fouls)   FT 1/1: GOOD Scottie Harden makes 1/1 from the line.
Score: 95-96

[01:59] Team_028 possession (Score: 95-96)
Kawhi Ball commits a violation (traveling/carry)! TURNOVER! (dead ball)

[01:59] Substitution (Team_027): Tim Johnson OUT → CJ Green IN (stamina_rule2)

[01:59] Substitution (Team_027): Tony Doncic OUT → Dirk Lillard IN (stamina_rule2)

[01:59] Substitution (Team_027): Scottie Harden OUT → Rudy Quickley IN (stamina_rule2)

[01:59] Substitution (Team_027): Bradley Dosunmu OUT → LeBron Russell IN (stamina_rule2)

[01:59] Substitution (Team_027): John Russell OUT → Ben Stewart IN (stamina_rule2)

[01:59] Substitution (Team_028): Austin Russell OUT → Scottie Ingram IN (stamina_rule2)

[01:59] Substitution (Team_028): Carmelo Carter OUT → Tyrese Quickley IN (stamina_rule2)

[01:59] Substitution (Team_028): Myles Haliburton OUT → Miles Booker IN (stamina_rule2)

[01:59] Substitution (Team_028): Kawhi Ball OUT → Bam Towns IN (stamina_rule2)

[01:59] Substitution (Team_028): Jimmy Brogdon OUT → Collin Bridges IN (stamina_rule2)

[01:44] Team_027 possession (Score: 95-96)
CJ Green attempts a 3Pt. Contested by Scottie Ingram (5.7 feet, ZONE). CJ Green misses. Offensive rebound by Ben Stewart! Ben Stewart puts it back in!
Score: 97-96

[01:27] Team_028 possession (Score: 97-96)
Bam Towns attempts a 3Pt. Contested by LeBron Russell (5.5 feet, MAN). Bam Towns misses. Rebound secured by Ben Stewart.

[01:08] Team_027 possession (Score: 97-96)
CJ Green throws a bad pass! Stolen by Scottie Ingram! TURNOVER! (live ball)

[00:54] Team_028 possession (Score: 97-96)
Miles Booker drives and kicks out. Bam Towns attempts a Midrange. Contested by LeBron Russell (5.5 feet, MAN). Bam Towns misses. Rebound secured by Ben Stewart.

[00:37] Team_027 possession (Score: 97-96)
Dirk Lillard drives to the basket... Dirk Lillard loses control! Ball rolls out of bounds! TURNOVER! (dead ball)

[00:24] Team_028 possession (Score: 97-96)
Scottie Ingram attempts a 3Pt. Contested by Rudy Quickley (3.3 feet, ZONE). Scottie Ingram misses. Rebound secured by LeBron Russell.

[00:09] Team_027 possession (Score: 97-96)
Ben Stewart attempts a Layup. Contested by Collin Bridges (3.7 feet, ZONE). BEN STEWART MAKES IT!
Score: 99-96

================================================================================
                              4TH QUARTER COMPLETE                              
================================================================================

4TH QUARTER SCORE: Team_027 22, Team_028 16

BOX SCORE:
================================================================================

Team_027
--------------------------------------------------------------------------------
Player                MIN  PTS  REB  AST  TO      FG   FG%      3P   3P%
--------------------------------------------------------------------------------
Scottie Harden         44    9    0    0   0   3/7    42.9     0/0   0.0
John Russell           44    5    3    0   0   2/4    50.0     0/0   0.0
Tim Johnson            44    4    0    0   0   2/3    66.7     0/0   0.0
Ben Stewart             4    4    3    0   0   2/2   100.0     0/0   0.0
Tony Doncic            44    0    3    1   0   0/2     0.0     0/0   0.0
Bradley Dosunmu        44    0    0    1   0   0/0     0.0     0/0   0.0
LeBron Russell          4    0    1    0   0   0/0     0.0     0/0   0.0

TEAM: FG: 9/18 (50.0%), 3PT: 3/7 (42.9%), REB: 11 (2 off, 9 def), AST: 2, TO: 4
TEAM FOULS: 5 [Team_028 in BONUS]


Team_028
--------------------------------------------------------------------------------
Player                MIN  PTS  REB  AST  TO      FG   FG%      3P   3P%
--------------------------------------------------------------------------------
Austin Russell         44    4    0    2   0   2/5    40.0     0/0   0.0
Jimmy Brogdon          44    4    4    1   0   2/3    66.7     0/0   0.0
Myles Haliburton       44    4    0    0   0   2/2   100.0     0/0   0.0
Kawhi Ball             44    2    6    0   0   1/3    33.3     0/0   0.0
Carmelo Carter         44    2    1    1   0   1/2    50.0     0/0   0.0
Bam Towns               4    0    0    0   0   0/1     0.0     0/0   0.0
Miles Booker            4    0    0    0   0   0/1     0.0     0/0   0.0
Scottie Ingram          4    0    0    0   0   0/1     0.0     0/0   0.0

TEAM: FG: 8/18 (44.4%), 3PT: 1/8 (12.5%), REB: 10 (2 off, 8 def), AST: 4, TO: 3
TEAM FOULS: 7 [Team_027 in BONUS]

================================================================================

================================================================================
                               FULL GAME COMPLETE                               
================================================================================

FINAL SCORE: Team_027 99, Team_028 96

SCORING BY QUARTER:
--------------------------------------------------------------------------------
Team                     Q1     Q2     Q3     Q4    FINAL
--------------------------------------------------------------------------------
Team_027                 25     21     31     22       99
Team_028                 35     26     19     16       96
--------------------------------------------------------------------------------

FULL GAME BOX SCORE:
================================================================================

Team_027
--------------------------------------------------------------------------------
Player                MIN  PTS  REB  AST  TO      FG   FG%      3P   3P%      FT STL BLK
--------------------------------------------------------------------------------
Tim Johnson            44   11    0    5   5   6/9    66.7   2/3    66.7   4/6     1   0
Tony Doncic            44   23    7    2   0  11/18   61.1   3/7    42.9   5/5     0   1
Scottie Harden         44   14    0    4   3   8/19   42.1   3/6    50.0   5/5     0   0
Bradley Dosunmu        44   19   17    3   0   7/12   58.3   0/1     0.0   5/5     2   1
John Russell           44   21   17    0   2   5/12   41.7   0/2     0.0   1/1     3   1
CJ Green                4    0    0    0   3   1/1   100.0   1/1   100.0   0/0     0   0
Dirk Lillard            4    2    0    0   0   1/2    50.0   0/0     0.0   0/0     0   0
Rudy Quickley           4    3    0    1   1   1/1   100.0   1/1   100.0   0/0     0   0
LeBron Russell          4    0    1    0   0   0/0     0.0   0/0     0.0   0/0     0   0
Ben Stewart             4    4    5    1   0   1/1   100.0   0/0     0.0   0/0     0   0

TEAM: FG: 42/76 (55.3%), 3PT: 10/21 (47.6%), REB: 48 (8 off, 40 def), AST: 16, TO: 14


Team_028
--------------------------------------------------------------------------------
Player                MIN  PTS  REB  AST  TO      FG   FG%      3P   3P%      FT STL BLK
--------------------------------------------------------------------------------
Austin Russell         44   17    0    8   3   8/21   38.1   3/11   27.3   7/9     1   0
Carmelo Carter         44   19    8    4   1   7/12   58.3   1/1   100.0   4/5     0   0
Myles Haliburton       44   18    0    2   0   7/11   63.6   1/4    25.0   1/2     2   0
Kawhi Ball             44   13   12    2   4   5/15   33.3   0/6     0.0   3/3     1   1
Jimmy Brogdon          44   15   19    3   0   7/11   63.6   1/1   100.0   4/4     0   0
Scottie Ingram          4    0    0    0   0   0/1     0.0   0/1     0.0   0/0     1   0
Tyrese Quickley         4    3    0    0   0   1/1   100.0   1/1   100.0   0/0     0   1
Miles Booker            4    2    0    1   0   1/3    33.3   0/1     0.0   2/2     0   0
Bam Towns               4    2    1    0   0   1/2    50.0   0/1     0.0   0/0     0   0
Collin Bridges          4    2    0    1   0   1/2    50.0   0/0     0.0   2/2     1   0

TEAM: FG: 39/81 (48.1%), 3PT: 7/27 (25.9%), REB: 39 (7 off, 32 def), AST: 21, TO: 8

================================================================================
