================================================================================
                        FULL GAME - Team_089 vs Team_060                        
================================================================================

================================================================================
                       1ST QUARTER - Team_089 vs Team_060                       
================================================================================

[12:00] Team_089 possession (Score: 0-0)
Terry Simmons attempts a Layup. Contested by Jaren George (5.8 feet, MAN). TERRY SIMMONS MAKES IT! Assist: Rudy Smith
Score: 2-0

[11:46] Team_060 possession (Score: 2-0)
FOUL! Offensive foul on Joel Morant! Jordan Brogdon drew the charge! [Team fouls: 1] (Joel Morant: 1 personal fouls) TURNOVER! (dead ball)

[11:32] Team_089 possession (Score: 2-0)
Jalen Jackson attempts a 3Pt. Contested by Julius Green (4.0 feet, ZONE). Jalen Jackson misses. Offensive rebound by Jalen Jackson! Jalen Jackson kicks it out.

[11:22] Team_089 possession (Score: 2-0)
FOUL! Holding foul on Joel Morant. [Team fouls: 2] No free throws, side out. (Joel Morant: 2 personal fouls)

[11:07] Team_089 possession (Score: 2-0)
Jalen Jackson attempts a 3Pt. Contested by Julius Green (4.0 feet, ZONE). Jalen Jackson misses. Rebound secured by Immanuel Ming.

[10:54] Team_060 possession (Score: 2-0)
Jaren George attempts a Midrange. Contested by Terry Simmons (3.6 feet, MAN). Jaren George misses. Rebound secured by Jalen Jackson.

[10:41] Team_089 possession (Score: 2-0)
Jordan Brogdon attempts a 3Pt. Contested by Julius Green (3.8 feet, ZONE). Jordan Brogdon misses. Rebound secured by Larry Westbrook.

[10:29] Team_060 possession (Score: 2-0)
Joel Morant attempts a 3Pt. Contested by Jordan Brogdon (2.9 feet, MAN). JOEL MORANT MAKES IT! Assist: Julius Green
Score: 2-3

[10:18] Team_089 possession (Score: 2-3)
Allen Mobley drives to the basket... Allen Mobley commits a violation (traveling/carry)! TURNOVER! (dead ball)

[10:01] Team_060 possession (Score: 2-3)
Joel Morant attempts a Layup. BLOCKED BY JORDAN BROGDON! Ball deflects out of bounds off Joel Morant.

[09:46] Team_089 possession (Score: 2-3)
Terry Simmons drives and kicks out. Jalen Jackson attempts a Midrange. BLOCKED BY JULIUS GREEN! Ball is loose! Rebound secured by Jaren George.

[09:35] Team_060 possession (Score: 2-3)
FOUL! Shooting foul on Rudy Smith. Larry Westbrook to the line for 2 free throws. [Team fouls: 1] (Rudy Smith: 1 personal fouls)   FT 1/2: GOOD   FT 2/2: MISS Larry Westbrook makes 1/2 from the line. Rebound secured by Jalen Jackson.
Score: 2-4

[09:20] Team_089 possession (Score: 2-4)
Jordan Brogdon drives and kicks out. Allen Mobley attempts a Midrange. Contested by Immanuel Ming (3.7 feet, MAN). ALLEN MOBLEY MAKES IT!
Score: 4-4

[09:09] Team_060 possession (Score: 4-4)
Jaren George drives, picks up Terry Simmons. Help arrives from Jalen Jackson! Jaren George attempts a Dunk. Contested by Jalen Jackson (3.6 feet, MAN). Jaren George misses. Rebound secured by Terry Simmons.

[08:57] Team_089 possession (Score: 4-4)
Jalen Jackson attempts a 3Pt. Contested by Julius Green (4.0 feet, ZONE). Jalen Jackson misses. Offensive rebound by Jalen Jackson! Jalen Jackson kicks it out.

[08:42] Team_089 possession (Score: 4-4)
FOUL! Reach-in foul on Jaren George during the drive. [Team fouls: 3] No free throws, side out. (Jaren George: 1 personal fouls)

[08:31] Team_089 possession (Score: 4-4)
Rudy Smith attempts a 3Pt. Contested by Larry Westbrook (5.1 feet, MAN). Rudy Smith misses. Rebound secured by Jaren George.

[08:17] Team_060 possession (Score: 4-4)
Larry Westbrook attempts a 3Pt. Contested by Jordan Brogdon (3.7 feet, ZONE). Larry Westbrook misses. Rebound secured by Jalen Jackson.

[08:03] Team_089 possession (Score: 4-4)
Rudy Smith attempts a Midrange. Contested by Larry Westbrook (5.1 feet, MAN). Rudy Smith misses. Rebound secured by Larry Westbrook.

[07:48] Team_060 possession (Score: 4-4)
Immanuel Ming drives, Terry Simmons stays with him. Immanuel Ming attempts a Dunk. Contested by Terry Simmons (3.5 feet, ZONE). IMMANUEL MING MAKES IT! Assist: Jaren George
Score: 4-6

[07:30] Team_089 possession (Score: 4-6)
Terry Simmons attempts a 3Pt. Contested by Jaren George (5.8 feet, MAN). Terry Simmons misses. Rebound secured by Larry Westbrook.

[07:17] Team_060 possession (Score: 4-6)
Joel Morant attempts a 3Pt. Contested by Jordan Brogdon (2.9 feet, MAN). Joel Morant misses. Rebound secured by Rudy Smith.

[07:00] Team_089 possession (Score: 4-6)
FOUL! Offensive foul on Rudy Smith! Larry Westbrook drew the charge! [Team fouls: 2] (Rudy Smith: 2 personal fouls) TURNOVER! (dead ball)

[06:43] Team_060 possession (Score: 4-6)
Julius Green attempts a Midrange. Contested by Jalen Jackson (4.5 feet, ZONE). JULIUS GREEN MAKES IT! Assist: Larry Westbrook
Score: 4-8

[06:27] Team_089 possession (Score: 4-8)
Jalen Jackson attempts a Midrange. Contested by Julius Green (4.0 feet, MAN). Jalen Jackson misses. Rebound secured by Larry Westbrook.

[06:10] Team_060 possession (Score: 4-8)
FOUL! Shooting foul on Jalen Jackson. Julius Green to the line for 3 free throws. [Team fouls: 3] (Jalen Jackson: 1 personal fouls)   FT 1/3: GOOD   FT 2/3: MISS   FT 3/3: MISS Julius Green makes 1/3 from the line. Rebound secured by Terry Simmons.
Score: 4-9

[05:56] Team_089 possession (Score: 4-9)
FOUL! Holding foul on Julius Green. [Team fouls: 4] No free throws, side out. (Julius Green: 1 personal fouls)

[05:41] Team_089 possession (Score: 4-9)
FOUL! Reach-in foul on Julius Green during the drive. [IN THE BONUS! 5 team fouls] Jalen Jackson to the line for 2 free throws. (Julius Green: 2 personal fouls)   FT 1/2: GOOD   FT 2/2: GOOD Jalen Jackson makes 2/2 from the line.
Score: 6-9

[05:29] Team_060 possession (Score: 6-9)
Immanuel Ming attempts a 3Pt. Contested by Allen Mobley (4.1 feet, MAN). Immanuel Ming misses. Rebound secured by Rudy Smith.

[05:14] Team_089 possession (Score: 6-9)
Jordan Brogdon attempts a 3Pt. Contested by Joel Morant (5.3 feet, MAN). JORDAN BROGDON MAKES IT! Assist: Terry Simmons
Score: 9-9

[05:00] Team_060 possession (Score: 9-9)
Julius Green attempts a 3Pt. Contested by Jalen Jackson (4.5 feet, MAN). Julius Green misses. Rebound secured by Rudy Smith.

[04:50] Team_089 possession (Score: 9-9)
Terry Simmons attempts a Midrange. Contested by Jaren George (5.9 feet, MAN). Terry Simmons misses. Rebound secured by Immanuel Ming.

[04:36] Team_060 possession (Score: 9-9)
Julius Green attempts a 3Pt. Contested by Jordan Brogdon (3.1 feet, ZONE). Julius Green misses. Rebound secured by Terry Simmons.

[04:22] Team_089 possession (Score: 9-9)
Jordan Brogdon attempts a Midrange. Contested by Joel Morant (5.4 feet, MAN). JORDAN BROGDON MAKES IT! Assist: Rudy Smith
Score: 11-9

[04:04] Team_060 possession (Score: 11-9)
Jaren George attempts a Midrange. Contested by Terry Simmons (3.8 feet, ZONE). Jaren George misses. Rebound secured by Terry Simmons.

[03:53] Team_089 possession (Score: 11-9)
FOUL! Shooting foul on Julius Green. Allen Mobley to the line for 2 free throws. [BONUS: 6 team fouls] (Julius Green: 3 personal fouls)   FT 1/2: MISS   FT 2/2: GOOD Allen Mobley makes 1/2 from the line.
Score: 12-9

[03:38] Team_060 possession (Score: 12-9)
Joel Morant drives to the basket... Joel Morant commits a violation (traveling/carry)! TURNOVER! (dead ball)

[03:38] Substitution (Team_060): Joel Morant OUT → Domantas Barnes IN (stamina_rule2)

[03:38] Substitution (Team_060): Larry Westbrook OUT → Yao Tatum IN (stamina_rule2)

[03:38] Substitution (Team_060): Jaren George OUT → Klay Haliburton IN (stamina_rule2)

[03:25] Team_089 possession (Score: 12-9)
Jordan Brogdon attempts a 3Pt. Contested by Domantas Barnes (4.6 feet, MAN). Jordan Brogdon misses. Rebound secured by Klay Haliburton.

[03:08] Team_060 possession (Score: 12-9)
Domantas Barnes drives and kicks out. Klay Haliburton attempts a 3Pt. Contested by Terry Simmons (3.8 feet, MAN). Klay Haliburton misses. Offensive rebound by Immanuel Ming! Immanuel Ming kicks it out.

[02:51] Team_060 possession (Score: 12-9)
Julius Green drives to the basket... FOUL! Offensive foul on Julius Green! Terry Simmons drew the charge! [Team fouls: 7] (Julius Green: 4 personal fouls) TURNOVER! (dead ball)

[02:39] Team_089 possession (Score: 12-9)
Jordan Brogdon attempts a Layup. BLOCKED BY DOMANTAS BARNES! Ball goes out off Domantas Barnes. Jordan Brogdon's ball!

[02:22] Team_089 possession (Score: 12-9)
Terry Simmons loses the ball! Stripped by Klay Haliburton! TURNOVER! (live ball)

[02:08] Team_060 possession (Score: 12-9)
FOUL! Holding foul on Terry Simmons. [Team fouls: 4] No free throws, side out. (Terry Simmons: 1 personal fouls)

[01:57] Team_060 possession (Score: 12-9)
Julius Green attempts a 3Pt. Contested by Jordan Brogdon (3.4 feet, ZONE). Julius Green misses. FOUL! Loose ball foul on Rudy Smith during the rebound battle. [IN THE BONUS! 5 team fouls] Klay Haliburton to the line for 2 free throws. (Rudy Smith: 3 personal fouls)   FT 1/2: GOOD   FT 2/2: GOOD Klay Haliburton makes 2/2 from the line.
Score: 12-11

[01:47] Team_089 possession (Score: 12-11)
FOUL! Holding foul on Klay Haliburton. [IN THE BONUS! 8 team fouls] Terry Simmons to the line for 2 free throws. (Klay Haliburton: 1 personal fouls)   FT 1/2: MISS   FT 2/2: GOOD Terry Simmons makes 1/2 from the line.
Score: 13-11

[01:33] Team_060 possession (Score: 13-11)
Klay Haliburton attempts a Layup. Contested by Terry Simmons (4.3 feet, MAN). Klay Haliburton misses. Rebound secured by Jalen Jackson.

[01:22] Team_089 possession (Score: 13-11)
Allen Mobley drives, Klay Haliburton stays with him. Allen Mobley attempts a Layup. Contested by Klay Haliburton (4.3 feet, ZONE). Allen Mobley misses. Rebound secured by Domantas Barnes.

[01:04] Team_060 possession (Score: 13-11)
Immanuel Ming attempts a 3Pt. Contested by Jordan Brogdon (3.7 feet, ZONE). Immanuel Ming misses. Rebound secured by Terry Simmons.

[00:54] Team_089 possession (Score: 13-11)
FOUL! Reach-in foul on Klay Haliburton during the drive. [IN THE BONUS! 9 team fouls] Allen Mobley to the line for 2 free throws. (Klay Haliburton: 2 personal fouls)   FT 1/2: MISS   FT 2/2: GOOD Allen Mobley makes 1/2 from the line.
Score: 14-11

[00:39] Team_060 possession (Score: 14-11)
Yao Tatum attempts a 3Pt. Contested by Jordan Brogdon (3.9 feet, ZONE). Yao Tatum misses. Offensive rebound by Immanuel Ming! Immanuel Ming kicks it out.

[00:23] Team_060 possession (Score: 14-11)
Immanuel Ming drives, Allen Mobley stays with him. Immanuel Ming attempts a Layup. Contested by Allen Mobley (4.5 feet, MAN). Immanuel Ming misses. Rebound secured by Jalen Jackson.

[00:08] Team_089 possession (Score: 14-11)
Rudy Smith attempts a 3Pt. Contested by Yao Tatum (5.6 feet, MAN). Rudy Smith misses. Rebound secured by Domantas Barnes.

================================================================================
                              1ST QUARTER COMPLETE                              
================================================================================

1ST QUARTER SCORE: Team_089 14, Team_060 11

BOX SCORE:
================================================================================

Team_089
--------------------------------------------------------------------------------
Player                MIN  PTS  REB  AST  TO      FG   FG%      3P   3P%
--------------------------------------------------------------------------------
Jordan Brogdon         12    5    0    0   0   2/4    50.0     0/0   0.0
Allen Mobley           12    4    0    0   0   3/4    75.0     0/0   0.0
Terry Simmons          12    3    5    1   0   2/5    40.0     0/0   0.0
Jalen Jackson          12    2    7    0   0   1/3    33.3     0/0   0.0
Rudy Smith             12    0    3    2   0   0/3     0.0     0/0   0.0

TEAM: FG: 8/19 (42.1%), 3PT: 1/7 (14.3%), REB: 15 (2 off, 13 def), AST: 3, TO: 3
TEAM FOULS: 5 [Team_060 in BONUS]


Team_060
--------------------------------------------------------------------------------
Player                MIN  PTS  REB  AST  TO      FG   FG%      3P   3P%
--------------------------------------------------------------------------------
Joel Morant             9    3    0    0   0   1/3    33.3     0/0   0.0
Immanuel Ming          12    2    4    0   0   1/4    25.0     0/0   0.0
Julius Green           12    2    0    1   0   1/4    25.0     0/0   0.0
Klay Haliburton         3    2    1    0   0   1/2    50.0     0/0   0.0
Jaren George            9    0    2    1   0   0/3     0.0     0/0   0.0
Larry Westbrook         9    0    4    1   0   0/2     0.0     0/0   0.0
Domantas Barnes         3    0    2    0   0   0/0     0.0     0/0   0.0

TEAM: FG: 4/18 (22.2%), 3PT: 2/9 (22.2%), REB: 13 (2 off, 11 def), AST: 3, TO: 3
TEAM FOULS: 9 [Team_089 in BONUS]

================================================================================

================================================================================
                       2ND QUARTER - Team_089 vs Team_060                       
================================================================================

[12:00] Substitution (Team_089): Jordan Brogdon OUT → Tony Parker IN (stamina_rule2)

[12:00] Substitution (Team_089): Jalen Jackson OUT → Joel Barnes IN (stamina_rule2)

[12:00] Substitution (Team_089): Rudy Smith OUT → Devin Haliburton IN (stamina_rule2)

[12:00] Substitution (Team_089): Terry Simmons OUT → Evan Gasol IN (stamina_rule2)

[12:00] Substitution (Team_060): Julius Green OUT → Rudy Ginobili IN (stamina_rule2)

[12:00] Team_089 possession (Score: 14-11)
Terry Simmons drives to the basket... Terry Simmons throws a bad pass out of bounds! TURNOVER! (dead ball)

[11:42] Team_060 possession (Score: 14-11)
Immanuel Ming attempts a 3Pt. Contested by Allen Mobley (4.3 feet, MAN). Immanuel Ming misses. Rebound secured by Allen Mobley.

[11:27] Team_089 possession (Score: 14-11)
Devin Haliburton attempts a Layup. Contested by Jaren George (5.6 feet, ZONE). DEVIN HALIBURTON MAKES IT! Assist: Tony Parker
Score: 16-11

[11:14] Team_060 possession (Score: 16-11)
Jaren George attempts a Midrange. Contested by Devin Haliburton (5.1 feet, ZONE). JAREN GEORGE MAKES IT!
Score: 16-13

[10:55] Team_089 possession (Score: 16-13)
Allen Mobley drives, Immanuel Ming stays with him. Allen Mobley attempts a Layup. Contested by Immanuel Ming (4.1 feet, MAN). Allen Mobley misses. Rebound secured by Larry Westbrook.

[10:40] Team_060 possession (Score: 16-13)
Larry Westbrook attempts a 3Pt. Contested by Devin Haliburton (5.4 feet, ZONE). LARRY WESTBROOK MAKES IT! Assist: Immanuel Ming
Score: 16-16

[10:23] Team_089 possession (Score: 16-16)
Devin Haliburton attempts a Midrange. Contested by Larry Westbrook (5.1 feet, ZONE). DEVIN HALIBURTON MAKES IT! Assist: Allen Mobley
Score: 18-16

[10:08] Team_060 possession (Score: 18-16)
FOUL! Shooting foul on Devin Haliburton. Joel Morant to the line for 2 free throws. [Team fouls: 1] (Devin Haliburton: 1 personal fouls)   FT 1/2: MISS   FT 2/2: GOOD Joel Morant makes 1/2 from the line.
Score: 18-17

[09:56] Team_089 possession (Score: 18-17)
Joel Barnes attempts a Midrange. Contested by Rudy Ginobili (4.5 feet, MAN). JOEL BARNES MAKES IT! Assist: Allen Mobley
Score: 20-17

[09:42] Team_060 possession (Score: 20-17)
Joel Morant attempts a 3Pt. Contested by Devin Haliburton (4.6 feet, ZONE). Joel Morant misses. Rebound secured by Allen Mobley.

[09:30] Team_089 possession (Score: 20-17)
FOUL! Reach-in foul on Larry Westbrook during the drive. [Team fouls: 1] No free throws, side out. (Larry Westbrook: 1 personal fouls)

[09:17] Team_089 possession (Score: 20-17)
Tony Parker throws a bad pass! Stolen by Joel Morant! TURNOVER! (live ball)

[09:06] Team_060 possession (Score: 20-17)
Immanuel Ming drives, Allen Mobley stays with him. Immanuel Ming attempts a Layup. Contested by Allen Mobley (4.6 feet, MAN). IMMANUEL MING MAKES IT!
Score: 20-19

[08:48] Team_089 possession (Score: 20-19)
Tony Parker makes the Dunk and draws the foul on Rudy Ginobili! And-1! Tony Parker to the line for 1. [Team fouls: 2] (Rudy Ginobili: 1 personal fouls)   FT 1/1: GOOD Tony Parker makes 1/1 from the line.
Score: 23-19

[08:34] Team_060 possession (Score: 23-19)
Larry Westbrook attempts a 3Pt. Contested by Devin Haliburton (5.4 feet, MAN). Larry Westbrook misses. Rebound secured by Allen Mobley.

[08:21] Team_089 possession (Score: 23-19)
FOUL! Reach-in foul on Jaren George during the drive. [Team fouls: 3] No free throws, side out. (Jaren George: 1 personal fouls)

[08:05] Team_089 possession (Score: 23-19)
Evan Gasol makes the Dunk and draws the foul on Jaren George! And-1! Evan Gasol to the line for 1. [Team fouls: 4] (Jaren George: 2 personal fouls)   FT 1/1: GOOD Evan Gasol makes 1/1 from the line.
Score: 26-19

[07:53] Team_060 possession (Score: 26-19)
Joel Morant attempts a Midrange. Contested by Tony Parker (5.0 feet, MAN). Joel Morant misses. Rebound secured by Allen Mobley.

[07:40] Team_089 possession (Score: 26-19)
Devin Haliburton drives, picks up Jaren George. Help arrives from Rudy Ginobili! Devin Haliburton attempts a Layup. Wide open! Rudy Ginobili is 6.0 feet away. [ZONE] DEVIN HALIBURTON MAKES IT!
Score: 28-19

[07:26] Team_060 possession (Score: 28-19)
Joel Morant attempts a 3Pt. Contested by Devin Haliburton (4.6 feet, ZONE). Joel Morant misses. Rebound secured by Evan Gasol.

[07:11] Team_089 possession (Score: 28-19)
Evan Gasol attempts a Midrange. Contested by Immanuel Ming (4.7 feet, ZONE). Evan Gasol misses. Rebound secured by Jaren George.

[06:55] Team_060 possession (Score: 28-19)
Immanuel Ming attempts a 3Pt. Contested by Allen Mobley (4.8 feet, MAN). Immanuel Ming misses. Offensive rebound by Jaren George! Jaren George's putback is no good. Offensive rebound by Jaren George! Jaren George kicks it out.

[06:38] Team_060 possession (Score: 28-19)
Rudy Ginobili drives and kicks out. Joel Morant attempts a 3Pt. Contested by Tony Parker (5.3 feet, MAN). Joel Morant misses. Rebound secured by Devin Haliburton.

[06:24] Team_089 possession (Score: 28-19)
Allen Mobley attempts a Midrange. Contested by Immanuel Ming (4.6 feet, MAN). Allen Mobley misses. Offensive rebound by Devin Haliburton! Devin Haliburton kicks it out.

[06:10] Team_089 possession (Score: 28-19)
Joel Barnes attempts a Midrange. Contested by Rudy Ginobili (4.5 feet, MAN). Joel Barnes misses. Rebound secured by Larry Westbrook.

[05:55] Team_060 possession (Score: 28-19)
FOUL! Holding foul on Joel Barnes. [Team fouls: 3] No free throws, side out. (Joel Barnes: 1 personal fouls)

[05:37] Team_060 possession (Score: 28-19)
Joel Morant throws a bad pass! Stolen by Tony Parker! TURNOVER! (live ball)

[05:24] Team_089 possession (Score: 28-19)
Allen Mobley attempts a Midrange. Contested by Jaren George (5.8 feet, ZONE). Allen Mobley misses. Rebound secured by Larry Westbrook.

[05:09] Team_060 possession (Score: 28-19)
Joel Morant attempts a 3Pt. Contested by Tony Parker (4.9 feet, MAN). Joel Morant misses. Offensive rebound by Rudy Ginobili! Rudy Ginobili kicks it out.

[04:55] Team_060 possession (Score: 28-19)
FOUL! Shooting foul on Devin Haliburton. Larry Westbrook to the line for 2 free throws. [Team fouls: 4] (Devin Haliburton: 2 personal fouls)   FT 1/2: MISS   FT 2/2: GOOD Larry Westbrook makes 1/2 from the line.
Score: 28-20

[04:39] Team_089 possession (Score: 28-20)
FOUL! Shooting foul on Rudy Ginobili. Joel Barnes to the line for 3 free throws. [BONUS: 5 team fouls] (Rudy Ginobili: 2 personal fouls)   FT 1/3: GOOD   FT 2/3: MISS   FT 3/3: GOOD Joel Barnes makes 2/3 from the line.
Score: 30-20

[04:21] Team_060 possession (Score: 30-20)
Immanuel Ming drives, Allen Mobley stays with him. Immanuel Ming attempts a Dunk. Contested by Allen Mobley (5.1 feet, MAN). IMMANUEL MING MAKES IT!
Score: 30-22

[04:11] Team_089 possession (Score: 30-22)
Allen Mobley attempts a Layup. Contested by Immanuel Ming (4.9 feet, MAN). Allen Mobley misses. FOUL! Loose ball foul on Rudy Ginobili during the rebound battle. [IN THE BONUS! 6 team fouls] Evan Gasol to the line for 2 free throws. (Rudy Ginobili: 3 personal fouls)   FT 1/2: GOOD   FT 2/2: GOOD Evan Gasol makes 2/2 from the line.
Score: 32-22

[03:57] Team_060 possession (Score: 32-22)
Jaren George attempts a Midrange. Contested by Evan Gasol (4.5 feet, MAN). JAREN GEORGE MAKES IT!
Score: 32-24

[03:39] Team_089 possession (Score: 32-24)
Devin Haliburton attempts a 3Pt. Contested by Rudy Ginobili (4.9 feet, ZONE). Devin Haliburton misses. FOUL! Loose ball foul on Jaren George during the rebound battle. [IN THE BONUS! 7 team fouls] Devin Haliburton to the line for 2 free throws. (Jaren George: 3 personal fouls)   FT 1/2: GOOD   FT 2/2: MISS Devin Haliburton makes 1/2 from the line. Rebound secured by Rudy Ginobili.
Score: 33-24

[03:20] Team_060 possession (Score: 33-24)
Joel Morant attempts a 3Pt. BLOCKED BY TONY PARKER! Ball is loose! Rebound secured by Evan Gasol.

[03:06] Team_089 possession (Score: 33-24)
Evan Gasol drives to the basket... Evan Gasol throws a bad pass! Stolen by Jaren George! TURNOVER! (live ball)

[02:50] Team_060 possession (Score: 33-24)
Jaren George attempts a Midrange. Contested by Evan Gasol (4.6 feet, MAN). Jaren George misses. Rebound secured by Allen Mobley.

[02:38] Team_089 possession (Score: 33-24)
FOUL! Reach-in foul on Jaren George during the drive. [IN THE BONUS! 8 team fouls] Tony Parker to the line for 2 free throws. (Jaren George: 4 personal fouls)   FT 1/2: GOOD   FT 2/2: GOOD Tony Parker makes 2/2 from the line.
Score: 35-24

[02:21] Team_060 possession (Score: 35-24)
Jaren George loses the ball! Stripped by Evan Gasol! TURNOVER! (live ball)

[02:03] Team_089 possession (Score: 35-24)
Evan Gasol attempts a Layup. Wide open! Jaren George is 6.4 feet away. [MAN] Evan Gasol misses. Rebound secured by Jaren George.

[01:46] Team_060 possession (Score: 35-24)
Immanuel Ming attempts a Midrange. Contested by Allen Mobley (5.4 feet, MAN). Immanuel Ming misses. Rebound secured by Evan Gasol.

[01:36] Team_089 possession (Score: 35-24)
Evan Gasol attempts a Layup. Wide open! Jaren George is 6.4 feet away. [MAN] EVAN GASOL MAKES IT! Assist: Joel Barnes
Score: 37-24

[01:22] Team_060 possession (Score: 37-24)
Jaren George drives, picks up Evan Gasol. Help arrives from Tony Parker! Jaren George attempts a Dunk. Contested by Tony Parker (4.7 feet, MAN). JAREN GEORGE MAKES IT! Assist: Rudy Ginobili
Score: 37-26

[01:04] Team_089 possession (Score: 37-26)
Devin Haliburton attempts a 3Pt. Wide open! Larry Westbrook is 6.4 feet away. [MAN] DEVIN HALIBURTON MAKES IT!
Score: 40-26

[00:50] Team_060 possession (Score: 40-26)
Joel Morant attempts a Midrange. Contested by Tony Parker (5.2 feet, MAN). JOEL MORANT MAKES IT!
Score: 40-28

[00:37] Team_089 possession (Score: 40-28)
FOUL! Shooting foul on Joel Morant. Devin Haliburton to the line for 2 free throws. [BONUS: 9 team fouls] (Joel Morant: 1 personal fouls)   FT 1/2: GOOD   FT 2/2: MISS Devin Haliburton makes 1/2 from the line. Rebound secured by Jaren George.
Score: 41-28

[00:24] Team_060 possession (Score: 41-28)
Joel Morant attempts a Midrange. Contested by Tony Parker (5.2 feet, MAN). Joel Morant misses. Rebound secured by Joel Barnes.

[00:14] Team_089 possession (Score: 41-28)
FOUL! Reach-in foul on Larry Westbrook during the drive. [IN THE BONUS! 10 team fouls] Devin Haliburton to the line for 2 free throws. (Larry Westbrook: 2 personal fouls)   FT 1/2: GOOD   FT 2/2: GOOD Devin Haliburton makes 2/2 from the line.
Score: 43-28

[00:02] Team_060 possession (Score: 43-28)
Larry Westbrook attempts a Midrange. Contested by Devin Haliburton (5.6 feet, MAN). LARRY WESTBROOK MAKES IT!
Score: 43-30

================================================================================
                              2ND QUARTER COMPLETE                              
================================================================================

2ND QUARTER SCORE: Team_089 29, Team_060 19

BOX SCORE:
================================================================================

Team_089
--------------------------------------------------------------------------------
Player                MIN  PTS  REB  AST  TO      FG   FG%      3P   3P%
--------------------------------------------------------------------------------
Devin Haliburton       12   11    2    0   0   5/7    71.4     0/0   0.0
Evan Gasol             12    7    3    0   0   3/5    60.0     0/0   0.0
Tony Parker            12    5    0    1   0   2/2   100.0     0/0   0.0
Joel Barnes            12    4    1    1   0   2/3    66.7     0/0   0.0
Allen Mobley           24    0    5    2   0   0/2     0.0     0/0   0.0

TEAM: FG: 12/19 (63.2%), 3PT: 2/3 (66.7%), REB: 12 (2 off, 10 def), AST: 4, TO: 3
TEAM FOULS: 4


Team_060
--------------------------------------------------------------------------------
Player                MIN  PTS  REB  AST  TO      FG   FG%      3P   3P%
--------------------------------------------------------------------------------
Jaren George           21    6    4    0   0   3/4    75.0     0/0   0.0
Larry Westbrook        21    6    3    0   0   3/4    75.0     0/0   0.0
Immanuel Ming          24    4    0    1   0   2/4    50.0     0/0   0.0
Joel Morant            21    3    0    0   0   2/7    28.6     0/0   0.0
Rudy Ginobili          12    0    2    1   0   0/1     0.0     0/0   0.0

TEAM: FG: 10/20 (50.0%), 3PT: 1/6 (16.7%), REB: 8 (2 off, 6 def), AST: 2, TO: 2
TEAM FOULS: 10 [Team_089 in BONUS]

================================================================================

================================================================================
                       3RD QUARTER - Team_089 vs Team_060                       
================================================================================

[12:00] Team_089 possession (Score: 43-30)
Jalen Jackson attempts a 3Pt. Contested by Julius Green (4.0 feet, ZONE). Jalen Jackson misses. Rebound secured by Larry Westbrook.

[11:47] Team_060 possession (Score: 43-30)
FOUL! Reach-in foul on Terry Simmons during the drive. [Team fouls: 1] No free throws, side out. (Terry Simmons: 1 personal fouls)

[11:37] Team_060 possession (Score: 43-30)
Joel Morant attempts a Midrange. Contested by Jordan Brogdon (2.9 feet, MAN). JOEL MORANT MAKES IT!
Score: 43-32

[11:28] Team_089 possession (Score: 43-32)
Rudy Smith attempts a Layup. Contested by Larry Westbrook (5.1 feet, MAN). RUDY SMITH MAKES IT!
Score: 45-32

[11:13] Team_060 possession (Score: 45-32)
FOUL! Shooting foul on Terry Simmons. Jaren George to the line for 2 free throws. [Team fouls: 2] (Terry Simmons: 2 personal fouls)   FT 1/2: GOOD   FT 2/2: GOOD Jaren George makes 2/2 from the line.
Score: 45-34

[11:03] Team_089 possession (Score: 45-34)
Jalen Jackson attempts a 3Pt. Contested by Immanuel Ming (3.9 feet, ZONE). Jalen Jackson misses. Rebound secured by Larry Westbrook.

[10:44] Team_060 possession (Score: 45-34)
Julius Green attempts a 3Pt. Contested by Jalen Jackson (4.5 feet, MAN). Julius Green misses. Rebound secured by Jalen Jackson.

[10:29] Team_089 possession (Score: 45-34)
Terry Simmons drives, Jaren George stays with him. Terry Simmons attempts a Layup. Contested by Jaren George (5.8 feet, MAN). TERRY SIMMONS MAKES IT! Assist: Jalen Jackson
Score: 47-34

[10:09] Team_060 possession (Score: 47-34)
Immanuel Ming attempts a 3Pt. Contested by Jordan Brogdon (3.2 feet, ZONE). Immanuel Ming misses. Rebound secured by Terry Simmons.

[09:57] Team_089 possession (Score: 47-34)
Rudy Smith attempts a Layup. Contested by Jaren George (5.7 feet, ZONE). Rudy Smith misses. Offensive rebound by Terry Simmons! Terry Simmons puts it back in!
Score: 49-34

[09:40] Team_060 possession (Score: 49-34)
Julius Green attempts a Layup. BLOCKED BY TERRY SIMMONS! Ball goes out off Terry Simmons. Julius Green's ball!

[09:25] Team_060 possession (Score: 49-34)
FOUL! Shooting foul on Jalen Jackson. Immanuel Ming to the line for 2 free throws. [Team fouls: 3] (Jalen Jackson: 1 personal fouls)   FT 1/2: MISS   FT 2/2: GOOD Immanuel Ming makes 1/2 from the line.
Score: 49-35

[09:10] Team_089 possession (Score: 49-35)
Rudy Smith drives and kicks out. Jordan Brogdon makes the 3Pt and draws the foul on Julius Green! And-1! Jordan Brogdon to the line for 1. [Team fouls: 1] (Julius Green: 1 personal fouls)   FT 1/1: GOOD Jordan Brogdon makes 1/1 from the line.
Score: 53-35

[08:53] Team_060 possession (Score: 53-35)
Immanuel Ming attempts a Layup. BLOCKED BY TERRY SIMMONS! Ball deflects out of bounds off Immanuel Ming.

[08:38] Team_089 possession (Score: 53-35)
FOUL! Offensive foul on Jalen Jackson! Julius Green drew the charge! [Team fouls: 4] (Jalen Jackson: 2 personal fouls) TURNOVER! (dead ball)

[08:22] Team_060 possession (Score: 53-35)
Joel Morant attempts a 3Pt. Contested by Jordan Brogdon (2.9 feet, MAN). Joel Morant misses. Rebound secured by Terry Simmons.

[08:11] Team_089 possession (Score: 53-35)
Jordan Brogdon drives, Jaren George stays with him. Jordan Brogdon attempts a Layup. Contested by Jaren George (5.2 feet, ZONE). JORDAN BROGDON MAKES IT! Assist: Jalen Jackson
Score: 55-35

[07:55] Team_060 possession (Score: 55-35)
Julius Green attempts a Layup. Contested by Jalen Jackson (4.5 feet, MAN). Julius Green misses. Rebound secured by Terry Simmons.

[07:37] Team_089 possession (Score: 55-35)
Jordan Brogdon attempts a 3Pt. Contested by Joel Morant (5.3 feet, MAN). JORDAN BROGDON MAKES IT! Assist: Rudy Smith
Score: 58-35

[07:23] Team_060 possession (Score: 58-35)
FOUL! Reach-in foul on Terry Simmons during the drive. [IN THE BONUS! 5 team fouls] Julius Green to the line for 2 free throws. (Terry Simmons: 3 personal fouls)   FT 1/2: GOOD   FT 2/2: GOOD Julius Green makes 2/2 from the line.
Score: 58-37

[07:07] Team_089 possession (Score: 58-37)
Jordan Brogdon attempts a Midrange. Contested by Joel Morant (5.3 feet, MAN). JORDAN BROGDON MAKES IT!
Score: 60-37

[06:55] Team_060 possession (Score: 60-37)
Larry Westbrook attempts a 3Pt. Contested by Rudy Smith (5.2 feet, MAN). LARRY WESTBROOK MAKES IT! Assist: Julius Green
Score: 60-40

[06:44] Team_089 possession (Score: 60-40)
Rudy Smith attempts a 3Pt. BLOCKED BY LARRY WESTBROOK! Ball is loose! Rebound secured by Immanuel Ming.

[06:31] Team_060 possession (Score: 60-40)
Jaren George attempts a Midrange. Contested by Terry Simmons (3.6 feet, MAN). Jaren George misses. Rebound secured by Terry Simmons.

[06:16] Team_089 possession (Score: 60-40)
Jalen Jackson drives to the basket... Jalen Jackson throws a bad pass! Stolen by Jaren George! TURNOVER! (live ball)

[06:04] Team_060 possession (Score: 60-40)
Julius Green drives, picks up Terry Simmons. Help arrives from Jalen Jackson! Julius Green attempts a Layup. Contested by Jalen Jackson (3.3 feet, ZONE). Julius Green misses. Rebound secured by Rudy Smith.

[05:48] Team_089 possession (Score: 60-40)
Terry Simmons drives to the basket... Terry Simmons throws a bad pass out of bounds! TURNOVER! (dead ball)

[05:37] Team_060 possession (Score: 60-40)
Joel Morant attempts a 3Pt. Contested by Jordan Brogdon (2.9 feet, ZONE). Joel Morant misses. Rebound secured by Jalen Jackson.

[05:23] Team_089 possession (Score: 60-40)
Terry Simmons attempts a 3Pt. Contested by Julius Green (4.4 feet, ZONE). Terry Simmons misses. Rebound secured by Jaren George.

[05:04] Team_060 possession (Score: 60-40)
FOUL! Shooting foul on Rudy Smith. Joel Morant to the line for 2 free throws. [BONUS: 6 team fouls] (Rudy Smith: 1 personal fouls)   FT 1/2: GOOD   FT 2/2: GOOD Joel Morant makes 2/2 from the line.
Score: 60-42

[04:44] Team_089 possession (Score: 60-42)
Allen Mobley attempts a 3Pt. Contested by Larry Westbrook (4.8 feet, ZONE). Allen Mobley misses. FOUL! Loose ball foul on Larry Westbrook during the rebound battle. [Team fouls: 2] No free throws, side out. (Larry Westbrook: 1 personal fouls)

[04:30] Team_089 possession (Score: 60-42)
FOUL! Offensive foul on Jalen Jackson! Julius Green drew the charge! [Team fouls: 7] (Jalen Jackson: 3 personal fouls) TURNOVER! (dead ball)

[04:15] Team_060 possession (Score: 60-42)
FOUL! Shooting foul on Terry Simmons. Larry Westbrook to the line for 2 free throws. [BONUS: 8 team fouls] (Terry Simmons: 4 personal fouls)   FT 1/2: GOOD   FT 2/2: GOOD Larry Westbrook makes 2/2 from the line.
Score: 60-44

[03:58] Team_089 possession (Score: 60-44)
Jalen Jackson attempts a 3Pt. Contested by Julius Green (4.1 feet, ZONE). JALEN JACKSON MAKES IT! Assist: Jordan Brogdon
Score: 63-44

[03:46] Team_060 possession (Score: 63-44)
Immanuel Ming drives and kicks out. Jaren George makes the Midrange and draws the foul on Allen Mobley! And-1! Jaren George to the line for 1. [BONUS: 9 team fouls] (Allen Mobley: 1 personal fouls)   FT 1/1: GOOD Jaren George makes 1/1 from the line.
Score: 63-47

[03:32] Team_089 possession (Score: 63-47)
Terry Simmons drives, picks up Jaren George. Help arrives from Julius Green! Terry Simmons attempts a Layup. Contested by Julius Green (6.0 feet, MAN). TERRY SIMMONS MAKES IT!
Score: 65-47

[03:18] Team_060 possession (Score: 65-47)
Jaren George makes the Layup and draws the foul on Terry Simmons! And-1! Jaren George to the line for 1. [BONUS: 10 team fouls] (Terry Simmons: 5 personal fouls)   FT 1/1: GOOD Jaren George makes 1/1 from the line.
Score: 65-50

[03:07] Team_089 possession (Score: 65-50)
Jalen Jackson makes the 3Pt and draws the foul on Julius Green! And-1! Jalen Jackson to the line for 1. [Team fouls: 3] (Julius Green: 2 personal fouls)   FT 1/1: GOOD Jalen Jackson makes 1/1 from the line.
Score: 69-50

[02:56] Team_060 possession (Score: 69-50)
Joel Morant makes the Midrange and draws the foul on Jalen Jackson! And-1! Joel Morant to the line for 1. [BONUS: 11 team fouls] (Jalen Jackson: 4 personal fouls)   FT 1/1: GOOD Joel Morant makes 1/1 from the line.
Score: 69-53

[02:39] Team_089 possession (Score: 69-53)
Jalen Jackson attempts a Midrange. Contested by Larry Westbrook (5.2 feet, ZONE). JALEN JACKSON MAKES IT! Assist: Terry Simmons
Score: 71-53

[02:21] Team_060 possession (Score: 71-53)
Jaren George attempts a Layup. Contested by Terry Simmons (3.9 feet, MAN). JAREN GEORGE MAKES IT!
Score: 71-55

[02:12] Team_089 possession (Score: 71-55)
Rudy Smith drives, Jaren George stays with him. Rudy Smith attempts a Dunk. Contested by Jaren George (6.0 feet, ZONE). RUDY SMITH MAKES IT!
Score: 73-55

[01:54] Team_060 possession (Score: 73-55)
FOUL! Reach-in foul on Terry Simmons during the drive. [IN THE BONUS! 12 team fouls] Immanuel Ming to the line for 2 free throws. (Terry Simmons: 6 personal fouls) Terry Simmons FOULS OUT!   FT 1/2: MISS   FT 2/2: GOOD Immanuel Ming makes 1/2 from the line.
Score: 73-56

[01:54] Substitution (Team_089): Terry Simmons OUT (stamina: 68) → Tony Parker IN (foul_out)

[01:42] Team_089 possession (Score: 73-56)
Rudy Smith drives and kicks out. Jalen Jackson attempts a Midrange. Contested by Julius Green (4.1 feet, MAN). JALEN JACKSON MAKES IT!
Score: 75-56

[01:29] Team_060 possession (Score: 75-56)
FOUL! Holding foul on Rudy Smith. [IN THE BONUS! 13 team fouls] Larry Westbrook to the line for 2 free throws. (Rudy Smith: 2 personal fouls)   FT 1/2: GOOD   FT 2/2: GOOD Larry Westbrook makes 2/2 from the line.
Score: 75-58

[01:17] Team_089 possession (Score: 75-58)
Jordan Brogdon makes the Layup and draws the foul on Joel Morant! And-1! Jordan Brogdon to the line for 1. [Team fouls: 4] (Joel Morant: 1 personal fouls)   FT 1/1: MISS Jordan Brogdon makes 0/1 from the line. Rebound secured by Jaren George.
Score: 77-58

[01:05] Team_060 possession (Score: 77-58)
FOUL! Reach-in foul on Jalen Jackson during the drive. [IN THE BONUS! 14 team fouls] Julius Green to the line for 2 free throws. (Jalen Jackson: 5 personal fouls)   FT 1/2: GOOD   FT 2/2: GOOD Julius Green makes 2/2 from the line.
Score: 77-60

[00:48] Team_089 possession (Score: 77-60)
Allen Mobley drives, Jaren George stays with him. Allen Mobley attempts a Dunk. Contested by Jaren George (5.8 feet, ZONE). Allen Mobley misses. Rebound secured by Jaren George.

[00:34] Team_060 possession (Score: 77-60)
Joel Morant attempts a 3Pt. Contested by Jordan Brogdon (3.5 feet, ZONE). Joel Morant misses. Rebound secured by Jalen Jackson.

[00:21] Team_089 possession (Score: 77-60)
Jordan Brogdon attempts a Midrange. Contested by Immanuel Ming (4.1 feet, ZONE). JORDAN BROGDON MAKES IT!
Score: 79-60

[00:08] Team_060 possession (Score: 79-60)
FOUL! Shooting foul on Jalen Jackson. Immanuel Ming to the line for 2 free throws. [BONUS: 15 team fouls] (Jalen Jackson: 6 personal fouls) Jalen Jackson FOULS OUT!   FT 1/2: GOOD   FT 2/2: GOOD Immanuel Ming makes 2/2 from the line.
Score: 79-62

[00:08] Substitution (Team_089): Jalen Jackson OUT (stamina: 63) → Joel Barnes IN (foul_out)

================================================================================
                              3RD QUARTER COMPLETE                              
================================================================================

3RD QUARTER SCORE: Team_089 36, Team_060 32

BOX SCORE:
================================================================================

Team_089
--------------------------------------------------------------------------------
Player                MIN  PTS  REB  AST  TO      FG   FG%      3P   3P%
--------------------------------------------------------------------------------
Jordan Brogdon         24   13    0    1   0   5/6    83.3     0/0   0.0
Jalen Jackson          24   11    4    2   0   4/6    66.7     0/0   0.0
Terry Simmons          23    6    5    1   0   3/4    75.0     0/0   0.0
Rudy Smith             24    4    1    1   0   2/3    66.7     0/0   0.0
Allen Mobley           36    0    0    0   0   0/1     0.0     0/0   0.0

TEAM: FG: 14/20 (70.0%), 3PT: 3/7 (42.9%), REB: 10 (2 off, 8 def), AST: 5, TO: 4
TEAM FOULS: 15 [Team_060 in BONUS]


Team_060
--------------------------------------------------------------------------------
Player                MIN  PTS  REB  AST  TO      FG   FG%      3P   3P%
--------------------------------------------------------------------------------
Jaren George           33   10    3    0   0   4/5    80.0     0/0   0.0
Larry Westbrook        33    7    2    0   0   3/3   100.0     0/0   0.0
Joel Morant            33    7    0    0   0   3/6    50.0     0/0   0.0
Julius Green           24    4    0    1   0   2/5    40.0     0/0   0.0
Immanuel Ming          36    4    1    0   0   3/5    60.0     0/0   0.0

TEAM: FG: 15/24 (62.5%), 3PT: 1/6 (16.7%), REB: 6 (0 off, 6 def), AST: 1, TO: 0
TEAM FOULS: 4

================================================================================

================================================================================
                       4TH QUARTER - Team_089 vs Team_060                       
================================================================================

[12:00] Team_089 possession (Score: 79-62)
Jordan Brogdon drives and kicks out. Jalen Jackson attempts a 3Pt. Contested by Julius Green (4.1 feet, MAN). JALEN JACKSON MAKES IT! Assist: Rudy Smith
Score: 82-62

[11:40] Team_060 possession (Score: 82-62)
Immanuel Ming throws a bad pass out of bounds! TURNOVER! (dead ball)

[11:40] Substitution (Team_089): Jordan Brogdon OUT → Tony Parker IN (stamina_rule2)

[11:40] Substitution (Team_089): Jalen Jackson OUT → Joel Barnes IN (stamina_rule2)

[11:40] Substitution (Team_089): Rudy Smith OUT → Devin Haliburton IN (stamina_rule2)

[11:40] Substitution (Team_060): Joel Morant OUT → Domantas Barnes IN (stamina_rule2)

[11:40] Substitution (Team_060): Julius Green OUT → Rudy Ginobili IN (stamina_rule2)

[11:40] Substitution (Team_060): Larry Westbrook OUT → Yao Tatum IN (stamina_rule2)

[11:40] Substitution (Team_060): Jaren George OUT → Klay Haliburton IN (stamina_rule2)

[11:26] Team_089 possession (Score: 82-62)
Terry Simmons drives, Klay Haliburton stays with him. Terry Simmons attempts a Dunk. Contested by Klay Haliburton (4.8 feet, ZONE). TERRY SIMMONS MAKES IT! Assist: Allen Mobley
Score: 84-62

[11:13] Team_060 possession (Score: 84-62)
Immanuel Ming attempts a 3Pt. Contested by Allen Mobley (4.3 feet, ZONE). Immanuel Ming misses. Rebound secured by Allen Mobley.

[11:02] Team_089 possession (Score: 84-62)
Tony Parker drives to the basket... Tony Parker throws a bad pass! Stolen by Klay Haliburton! TURNOVER! (live ball)

[10:43] Team_060 possession (Score: 84-62)
Rudy Ginobili attempts a 3Pt. Contested by Devin Haliburton (5.2 feet, ZONE). Rudy Ginobili misses. Rebound secured by Devin Haliburton.

[10:31] Team_089 possession (Score: 84-62)
Allen Mobley loses control! Ball rolls out of bounds! TURNOVER! (dead ball)

[10:31] Substitution (Team_089): Allen Mobley OUT → Pascal Durant IN (stamina_rule2)

[10:31] Substitution (Team_060): Immanuel Ming OUT → Jarrett Wagner IN (stamina_rule2)

[10:15] Team_060 possession (Score: 84-62)
Jarrett Wagner attempts a 3Pt. Contested by Pascal Durant (3.9 feet, ZONE). Jarrett Wagner misses. Offensive rebound by Klay Haliburton! Klay Haliburton puts it back in!
Score: 84-64

[09:57] Team_089 possession (Score: 84-64)
Devin Haliburton attempts a Midrange. Contested by Yao Tatum (5.7 feet, MAN). Devin Haliburton misses. Rebound secured by Domantas Barnes.

[09:47] Team_060 possession (Score: 84-64)
Domantas Barnes attempts a 3Pt. Contested by Tony Parker (5.3 feet, MAN). Domantas Barnes misses. Rebound secured by Pascal Durant.

[09:32] Team_089 possession (Score: 84-64)
Pascal Durant attempts a Midrange. Contested by Jarrett Wagner (5.7 feet, MAN). PASCAL DURANT MAKES IT! Assist: Terry Simmons
Score: 86-64

[09:13] Team_060 possession (Score: 86-64)
Jarrett Wagner attempts a 3Pt. Contested by Pascal Durant (3.9 feet, MAN). Jarrett Wagner misses. Rebound secured by Terry Simmons.

[09:01] Team_089 possession (Score: 86-64)
Joel Barnes attempts a Midrange. Contested by Rudy Ginobili (4.5 feet, MAN). JOEL BARNES MAKES IT!
Score: 88-64

[08:49] Team_060 possession (Score: 88-64)
Jarrett Wagner attempts a Layup. Contested by Pascal Durant (3.9 feet, MAN). JARRETT WAGNER MAKES IT! Assist: Klay Haliburton
Score: 88-66

[08:36] Team_089 possession (Score: 88-66)
Pascal Durant drives, Jarrett Wagner stays with him. Pascal Durant attempts a Layup. Contested by Jarrett Wagner (5.7 feet, MAN). PASCAL DURANT MAKES IT! Assist: Devin Haliburton
Score: 90-66

[08:25] Team_060 possession (Score: 90-66)
Domantas Barnes attempts a Layup. Contested by Terry Simmons (4.0 feet, ZONE). Domantas Barnes misses. Rebound secured by Terry Simmons.

[08:11] Team_089 possession (Score: 90-66)
Devin Haliburton drives, picks up Klay Haliburton. Help arrives from Domantas Barnes! Devin Haliburton attempts a Layup. Contested by Domantas Barnes (4.7 feet, ZONE). DEVIN HALIBURTON MAKES IT! Assist: Terry Simmons
Score: 92-66

[07:54] Team_060 possession (Score: 92-66)
Jarrett Wagner attempts a 3Pt. Contested by Pascal Durant (3.9 feet, ZONE). Jarrett Wagner misses. Rebound secured by Terry Simmons.

[07:41] Team_089 possession (Score: 92-66)
Tony Parker attempts a Midrange. Contested by Domantas Barnes (4.8 feet, ZONE). Tony Parker misses. Rebound secured by Rudy Ginobili.

[07:28] Team_060 possession (Score: 92-66)
Rudy Ginobili drives to the basket... Rudy Ginobili throws a bad pass out of bounds! TURNOVER! (dead ball)

[07:28] Substitution (Team_089): Terry Simmons OUT → Evan Gasol IN (stamina_rule2)

[07:15] Team_089 possession (Score: 92-66)
Pascal Durant drives, picks up Klay Haliburton. Help arrives from Domantas Barnes! Pascal Durant attempts a Layup. Contested by Domantas Barnes (5.1 feet, ZONE). Pascal Durant misses. Offensive rebound by Devin Haliburton! Devin Haliburton kicks it out.

[07:00] Team_089 possession (Score: 92-66)
Pascal Durant drives to the basket... Pascal Durant commits a violation (traveling/carry)! TURNOVER! (dead ball)

[06:45] Team_060 possession (Score: 92-66)
Rudy Ginobili attempts a Midrange. Contested by Joel Barnes (5.8 feet, MAN). Rudy Ginobili misses. Offensive rebound by Domantas Barnes! Domantas Barnes kicks it out.

[06:36] Team_060 possession (Score: 92-66)
Domantas Barnes attempts a Midrange. Contested by Tony Parker (5.3 feet, MAN). Domantas Barnes misses. Offensive rebound by Klay Haliburton! Klay Haliburton puts it back in!
Score: 92-68

[06:22] Team_089 possession (Score: 92-68)
FOUL! Reach-in foul on Klay Haliburton during the drive. [Team fouls: 1] No free throws, side out. (Klay Haliburton: 1 personal fouls)

[06:13] Team_089 possession (Score: 92-68)
Joel Barnes attempts a Layup. BLOCKED BY RUDY GINOBILI! Ball deflects out of bounds off Joel Barnes.

[06:01] Team_060 possession (Score: 92-68)
Domantas Barnes attempts a Layup. Contested by Tony Parker (5.3 feet, MAN). Domantas Barnes misses. Rebound secured by Devin Haliburton.

[05:46] Team_089 possession (Score: 92-68)
Joel Barnes throws a bad pass out of bounds! TURNOVER! (dead ball)

[05:29] Team_060 possession (Score: 92-68)
Domantas Barnes attempts a Midrange. Contested by Tony Parker (5.3 feet, MAN). DOMANTAS BARNES MAKES IT! Assist: Klay Haliburton
Score: 92-70

[05:15] Team_089 possession (Score: 92-70)
Pascal Durant drives to the basket... Pascal Durant throws a bad pass! Stolen by Klay Haliburton! TURNOVER! (live ball)

[04:59] Team_060 possession (Score: 92-70)
Rudy Ginobili attempts a 3Pt. Contested by Joel Barnes (5.8 feet, MAN). RUDY GINOBILI MAKES IT! Assist: Domantas Barnes
Score: 92-73

[04:43] Team_089 possession (Score: 92-73)
Pascal Durant attempts a 3Pt. Contested by Jarrett Wagner (5.7 feet, MAN). Pascal Durant misses. FOUL! Loose ball foul on Domantas Barnes during the rebound battle. [Team fouls: 2] No free throws, side out. (Domantas Barnes: 1 personal fouls)

[04:28] Team_089 possession (Score: 92-73)
Joel Barnes attempts a 3Pt. Contested by Domantas Barnes (4.8 feet, ZONE). JOEL BARNES MAKES IT! Assist: Tony Parker
Score: 95-73

[04:09] Team_060 possession (Score: 95-73)
Yao Tatum attempts a 3Pt. Contested by Devin Haliburton (5.0 feet, MAN). Yao Tatum misses. Rebound secured by Devin Haliburton.

[03:55] Team_089 possession (Score: 95-73)
Joel Barnes attempts a 3Pt. Contested by Rudy Ginobili (4.6 feet, MAN). Joel Barnes misses. Rebound secured by Rudy Ginobili.

[03:41] Team_060 possession (Score: 95-73)
Yao Tatum drives and kicks out. Klay Haliburton attempts a 3Pt. Contested by Pascal Durant (3.8 feet, ZONE). KLAY HALIBURTON MAKES IT! Assist: Domantas Barnes
Score: 95-76

[03:29] Team_089 possession (Score: 95-76)
Evan Gasol makes the Layup and draws the foul on Klay Haliburton! And-1! Evan Gasol to the line for 1. [Team fouls: 3] (Klay Haliburton: 2 personal fouls)   FT 1/1: GOOD Evan Gasol makes 1/1 from the line.
Score: 98-76

[03:16] Team_060 possession (Score: 98-76)
Domantas Barnes attempts a 3Pt. Contested by Pascal Durant (3.8 feet, ZONE). Domantas Barnes misses. Rebound secured by Devin Haliburton.

[03:02] Team_089 possession (Score: 98-76)
Joel Barnes loses the ball! Stripped by Rudy Ginobili! TURNOVER! (live ball)

[02:51] Team_060 possession (Score: 98-76)
Jarrett Wagner attempts a Layup. Contested by Pascal Durant (4.0 feet, MAN). JARRETT WAGNER MAKES IT! Assist: Klay Haliburton
Score: 98-78

[02:36] Team_089 possession (Score: 98-78)
Joel Barnes commits a violation (traveling/carry)! TURNOVER! (dead ball)

[02:20] Team_060 possession (Score: 98-78)
Jarrett Wagner attempts a 3Pt. Contested by Pascal Durant (4.0 feet, MAN). JARRETT WAGNER MAKES IT! Assist: Rudy Ginobili
Score: 98-81

[02:05] Team_089 possession (Score: 98-81)
Tony Parker drives, picks up Klay Haliburton. Help arrives from Domantas Barnes! Tony Parker attempts a Dunk. Contested by Domantas Barnes (4.7 feet, ZONE). TONY PARKER MAKES IT! Assist: Joel Barnes
Score: 100-81

[01:47] Team_060 possession (Score: 100-81)
Klay Haliburton drives and kicks out. FOUL! Shooting foul on Evan Gasol. Klay Haliburton to the line for 3 free throws. [Team fouls: 1] (Evan Gasol: 1 personal fouls)   FT 1/3: GOOD   FT 2/3: GOOD   FT 3/3: GOOD Klay Haliburton makes 3/3 from the line.
Score: 100-84

[01:31] Team_089 possession (Score: 100-84)
Evan Gasol attempts a Midrange. Contested by Klay Haliburton (4.7 feet, MAN). EVAN GASOL MAKES IT! Assist: Joel Barnes
Score: 102-84

[01:14] Team_060 possession (Score: 102-84)
Domantas Barnes attempts a 3Pt. Contested by Pascal Durant (3.9 feet, ZONE). Domantas Barnes misses. FOUL! Loose ball foul on Devin Haliburton during the rebound battle. [Team fouls: 2] No free throws, side out. (Devin Haliburton: 1 personal fouls)

[00:58] Team_060 possession (Score: 102-84)
Klay Haliburton drives and kicks out. Rudy Ginobili attempts a 3Pt. Contested by Joel Barnes (5.9 feet, MAN). RUDY GINOBILI MAKES IT! Assist: Yao Tatum
Score: 102-87

[00:40] Team_089 possession (Score: 102-87)
Pascal Durant attempts a 3Pt. Contested by Domantas Barnes (5.7 feet, ZONE). Pascal Durant misses. Offensive rebound by Evan Gasol! Evan Gasol kicks it out.

[00:25] Team_089 possession (Score: 102-87)
Devin Haliburton attempts a Midrange. Contested by Yao Tatum (6.0 feet, MAN). Devin Haliburton misses. Rebound secured by Domantas Barnes.

[00:10] Team_060 possession (Score: 102-87)
FOUL! Holding foul on Joel Barnes. [Team fouls: 3] No free throws, side out. (Joel Barnes: 1 personal fouls)

================================================================================
                              4TH QUARTER COMPLETE                              
================================================================================

4TH QUARTER SCORE: Team_089 23, Team_060 25

BOX SCORE:
================================================================================

Team_089
--------------------------------------------------------------------------------
Player                MIN  PTS  REB  AST  TO      FG   FG%      3P   3P%
--------------------------------------------------------------------------------
Joel Barnes            23    5    0    2   0   2/4    50.0     0/0   0.0
Evan Gasol             19    5    1    0   0   2/2   100.0     0/0   0.0
Pascal Durant          10    4    1    0   0   2/2   100.0     0/0   0.0
Jalen Jackson          25    3    0    0   0   1/1   100.0     0/0   0.0
Terry Simmons          27    2    3    2   0   1/1   100.0     0/0   0.0
Devin Haliburton       23    2    6    1   0   1/3    33.3     0/0   0.0
Tony Parker            25    2    0    1   0   1/2    50.0     0/0   0.0
Rudy Smith             25    0    0    1   0   0/0     0.0     0/0   0.0
Allen Mobley           38    0    1    1   0   0/0     0.0     0/0   0.0

TEAM: FG: 10/15 (66.7%), 3PT: 1/2 (50.0%), REB: 12 (3 off, 9 def), AST: 8, TO: 7
TEAM FOULS: 3


Team_060
--------------------------------------------------------------------------------
Player                MIN  PTS  REB  AST  TO      FG   FG%      3P   3P%
--------------------------------------------------------------------------------
Klay Haliburton        15   10    3    3   0   4/4   100.0     0/0   0.0
Jarrett Wagner         10    7    0    0   0   3/5    60.0     0/0   0.0
Rudy Ginobili          23    6    2    1   0   2/3    66.7     0/0   0.0
Domantas Barnes        15    2    3    2   0   1/5    20.0     0/0   0.0
Immanuel Ming          38    0    0    0   0   0/1     0.0     0/0   0.0
Yao Tatum              15    0    0    1   0   0/1     0.0     0/0   0.0

TEAM: FG: 10/19 (52.6%), 3PT: 3/10 (30.0%), REB: 8 (4 off, 4 def), AST: 7, TO: 2
TEAM FOULS: 3

================================================================================

================================================================================
                               FULL GAME COMPLETE                               
================================================================================

FINAL SCORE: Team_089 102, Team_060 87

SCORING BY QUARTER:
--------------------------------------------------------------------------------
Team                     Q1     Q2     Q3     Q4    FINAL
--------------------------------------------------------------------------------
Team_089                 14     29     36     23      102
Team_060                 11     19     32     25       87
--------------------------------------------------------------------------------

FULL GAME BOX SCORE:
================================================================================

Team_089
--------------------------------------------------------------------------------
Player                MIN  PTS  REB  AST  TO      FG   FG%      3P   3P%      FT STL BLK
--------------------------------------------------------------------------------
Allen Mobley           38    4    6    3   3   3/7    42.9   0/0     0.0   2/4     0   0
Terry Simmons          27   11   13    4   1   4/8    50.0   0/2     0.0   1/2     0   2
Tony Parker            25    7    0    2   2   3/4    75.0   0/0     0.0   3/3     1   1
Jordan Brogdon         25   18    0    1   1   8/11   72.7   2/4    50.0   1/2     0   1
Jalen Jackson          25   16   11    2   3   4/8    50.0   2/5    40.0   3/3     0   0
Rudy Smith             25    4    4    4   1   5/9    55.6   0/3     0.0   0/0     0   0
Joel Barnes            23    9    1    3   4   4/7    57.1   2/3    66.7   2/3     0   0
Devin Haliburton       23   13    8    1   0   6/10   60.0   1/2    50.0   4/6     0   0
Evan Gasol             19   12    4    0   2   4/6    66.7   0/0     0.0   4/4     1   0
Pascal Durant          10    4    1    0   0   2/2   100.0   0/0     0.0   0/0     0   0

TEAM: FG: 44/73 (60.3%), 3PT: 7/19 (36.8%), REB: 49 (9 off, 40 def), AST: 20, TO: 17


Team_060
--------------------------------------------------------------------------------
Player                MIN  PTS  REB  AST  TO      FG   FG%      3P   3P%      FT STL BLK
--------------------------------------------------------------------------------
Immanuel Ming          38   10    5    1   1   7/15   46.7   0/5     0.0   4/6     0   0
Joel Morant            34   13    0    0   2   6/16   37.5   1/8    12.5   4/5     1   0
Larry Westbrook        34   13    9    1   0   5/8    62.5   2/4    50.0   6/8     0   1
Jaren George           34   16    9    1   1   6/11   54.5   0/0     0.0   4/4     2   0
Julius Green           25    6    0    2   1   4/10   40.0   1/5    20.0   5/7     0   1
Rudy Ginobili          23    6    4    2   0   1/3    33.3   1/2    50.0   0/0     1   1
Domantas Barnes        15    2    5    2   0   2/6    33.3   0/2     0.0   0/0     0   1
Yao Tatum              15    0    0    1   0   1/2    50.0   0/1     0.0   0/0     0   0
Klay Haliburton        15   12    4    3   2   2/3    66.7   0/0     0.0   5/5     3   0
Jarrett Wagner         10    7    0    0   0   4/6    66.7   2/4    50.0   0/0     0   0

TEAM: FG: 39/81 (48.1%), 3PT: 7/31 (22.6%), REB: 35 (8 off, 27 def), AST: 13, TO: 7

================================================================================
