================================================================================
                        FULL GAME - Team_076 vs Team_080                        
================================================================================

================================================================================
                       1ST QUARTER - Team_076 vs Team_080                       
================================================================================

[12:00] Team_076 possession (Score: 0-0)
FOUL! Shooting foul on Khris Turner. Paul Leonard to the line for 2 free throws. [Team fouls: 1] (Khris Turner: 1 personal fouls)   FT 1/2: GOOD   FT 2/2: GOOD Paul Leonard makes 2/2 from the line.
Score: 2-0

[11:44] Team_080 possession (Score: 2-0)
Lauri Dosunmu attempts a 3Pt. Contested by Cade Barnes (4.3 feet, ZONE). Lauri Dosunmu misses. Rebound secured by D'Angelo Tatum.

[11:31] Team_076 possession (Score: 2-0)
Dejounte LaVine attempts a 3Pt. Contested by Lauri Dosunmu (4.0 feet, ZONE). Dejounte LaVine misses. FOUL! Loose ball foul on Draymond Simons during the rebound battle. [Team fouls: 2] No free throws, side out. (Draymond Simons: 1 personal fouls)

[11:19] Team_076 possession (Score: 2-0)
D'Angelo Tatum throws a bad pass out of bounds! TURNOVER! (dead ball)

[11:02] Team_080 possession (Score: 2-0)
Khris Turner makes the Dunk and draws the foul on Tobias Mitchell! And-1! Khris Turner to the line for 1. [Team fouls: 1] (Tobias Mitchell: 1 personal fouls)   FT 1/1: GOOD Khris Turner makes 1/1 from the line.
Score: 2-3

[10:46] Team_076 possession (Score: 2-3)
Dejounte LaVine attempts a 3Pt. Contested by Lauri Dosunmu (4.0 feet, ZONE). Dejounte LaVine misses. Offensive rebound by D'Angelo Tatum! D'Angelo Tatum kicks it out.

[10:32] Team_076 possession (Score: 2-3)
D'Angelo Tatum drives, picks up Draymond Simons. Help arrives from Khris Turner! D'Angelo Tatum attempts a Layup. Contested by Khris Turner (4.1 feet, MAN). D'ANGELO TATUM MAKES IT! Assist: Paul Leonard
Score: 4-3

[10:18] Team_080 possession (Score: 4-3)
Lauri Dosunmu drives and kicks out. Larry Paul attempts a Midrange. Contested by Paul Leonard (5.1 feet, MAN). Larry Paul misses. Rebound secured by Tobias Mitchell.

[10:06] Team_076 possession (Score: 4-3)
Tobias Mitchell attempts a 3Pt. Contested by Lauri Dosunmu (4.4 feet, ZONE). TOBIAS MITCHELL MAKES IT! Assist: D'Angelo Tatum
Score: 7-3

[09:49] Team_080 possession (Score: 7-3)
Draymond Simons attempts a Layup. Contested by Cade Barnes (3.7 feet, ZONE). Draymond Simons misses. Rebound secured by Tobias Mitchell.

[09:31] Team_076 possession (Score: 7-3)
D'Angelo Tatum drives and kicks out. Cade Barnes attempts a Midrange. Contested by Khris Turner (4.6 feet, ZONE). Cade Barnes misses. Rebound secured by Larry Paul.

[09:19] Team_080 possession (Score: 7-3)
Jaren Morant drives and kicks out. Larry Paul attempts a Midrange. Contested by Paul Leonard (5.1 feet, MAN). Larry Paul misses. Offensive rebound by Jaren Morant! Jaren Morant kicks it out.

[09:04] Team_080 possession (Score: 7-3)
Draymond Simons attempts a 3Pt. Contested by Cade Barnes (3.7 feet, ZONE). DRAYMOND SIMONS MAKES IT! Assist: Jaren Morant
Score: 7-6

[08:48] Team_076 possession (Score: 7-6)
D'Angelo Tatum drives and kicks out. Dejounte LaVine attempts a Midrange. Contested by Lauri Dosunmu (4.0 feet, MAN). Dejounte LaVine misses. Rebound secured by Draymond Simons.

[08:32] Team_080 possession (Score: 7-6)
FOUL! Holding foul on Tobias Mitchell. [Team fouls: 2] No free throws, side out. (Tobias Mitchell: 2 personal fouls)

[08:17] Team_080 possession (Score: 7-6)
FOUL! Shooting foul on Tobias Mitchell. Khris Turner to the line for 2 free throws. [Team fouls: 3] (Tobias Mitchell: 3 personal fouls)   FT 1/2: GOOD   FT 2/2: GOOD Khris Turner makes 2/2 from the line.
Score: 7-8

[08:02] Team_076 possession (Score: 7-8)
Paul Leonard drives and kicks out. Tobias Mitchell attempts a Midrange. Contested by Jaren Morant (3.7 feet, ZONE). Tobias Mitchell misses. Rebound secured by Jaren Morant.

[07:45] Team_080 possession (Score: 7-8)
Khris Turner drives and kicks out. Larry Paul attempts a Midrange. Contested by Cade Barnes (3.5 feet, ZONE). Larry Paul misses. Offensive rebound by Draymond Simons! Draymond Simons's putback is no good. Offensive rebound by Draymond Simons! Draymond Simons kicks it out.

[07:34] Team_080 possession (Score: 7-8)
Draymond Simons drives, Cade Barnes stays with him. Draymond Simons attempts a Dunk. Contested by Cade Barnes (3.7 feet, ZONE). DRAYMOND SIMONS MAKES IT!
Score: 7-10

[07:21] Team_076 possession (Score: 7-10)
Cade Barnes throws a bad pass! Stolen by Jaren Morant! TURNOVER! (live ball)

[07:06] Team_080 possession (Score: 7-10)
FOUL! Holding foul on Paul Leonard. [Team fouls: 4] No free throws, side out. (Paul Leonard: 1 personal fouls)

[06:50] Team_080 possession (Score: 7-10)
Draymond Simons drives to the basket... Draymond Simons throws a bad pass out of bounds! TURNOVER! (dead ball)

[06:40] Team_076 possession (Score: 7-10)
FOUL! Holding foul on Lauri Dosunmu. [Team fouls: 3] No free throws, side out. (Lauri Dosunmu: 1 personal fouls)

[06:26] Team_076 possession (Score: 7-10)
Tobias Mitchell attempts a Layup. BLOCKED BY DRAYMOND SIMONS! Ball goes out off Draymond Simons. Tobias Mitchell's ball!

[06:12] Team_076 possession (Score: 7-10)
FOUL! Reach-in foul on Draymond Simons during the drive. [Team fouls: 4] No free throws, side out. (Draymond Simons: 2 personal fouls)

[05:53] Team_076 possession (Score: 7-10)
Dejounte LaVine drives to the basket... Dejounte LaVine loses the ball! Stripped by Draymond Simons! TURNOVER! (live ball)

[05:40] Team_080 possession (Score: 7-10)
Larry Paul drives and kicks out. Draymond Simons attempts a Midrange. Contested by D'Angelo Tatum (3.7 feet, MAN). DRAYMOND SIMONS MAKES IT! Assist: Larry Paul
Score: 7-12

[05:29] Team_076 possession (Score: 7-12)
Dejounte LaVine attempts a 3Pt. Contested by Lauri Dosunmu (4.0 feet, MAN). Dejounte LaVine misses. Offensive rebound by D'Angelo Tatum! D'Angelo Tatum kicks it out.

[05:15] Team_076 possession (Score: 7-12)
FOUL! Holding foul on Draymond Simons. [IN THE BONUS! 5 team fouls] D'Angelo Tatum to the line for 2 free throws. (Draymond Simons: 3 personal fouls)   FT 1/2: MISS   FT 2/2: GOOD D'Angelo Tatum makes 1/2 from the line.
Score: 8-12

[05:04] Team_080 possession (Score: 8-12)
Khris Turner attempts a 3Pt. Contested by Cade Barnes (3.8 feet, ZONE). Khris Turner misses. Rebound secured by Cade Barnes.

[04:49] Team_076 possession (Score: 8-12)
Paul Leonard attempts a Midrange. Contested by Larry Paul (3.9 feet, MAN). Paul Leonard misses. Rebound secured by Jaren Morant.

[04:35] Team_080 possession (Score: 8-12)
Jaren Morant makes the Midrange and draws the foul on Paul Leonard! And-1! Jaren Morant to the line for 1. [BONUS: 5 team fouls] (Paul Leonard: 2 personal fouls)   FT 1/1: GOOD Jaren Morant makes 1/1 from the line.
Score: 8-15

[04:20] Team_076 possession (Score: 8-15)
Paul Leonard drives, picks up Draymond Simons. Help arrives from Khris Turner! Paul Leonard attempts a Dunk. Contested by Khris Turner (4.3 feet, ZONE). Paul Leonard misses. Rebound secured by Jaren Morant.

[04:06] Team_080 possession (Score: 8-15)
Jaren Morant attempts a Midrange. Contested by Cade Barnes (4.0 feet, MAN). Jaren Morant misses. Rebound secured by D'Angelo Tatum.

[03:50] Team_076 possession (Score: 8-15)
D'Angelo Tatum attempts a 3Pt. Contested by Draymond Simons (4.3 feet, MAN). D'Angelo Tatum misses. Rebound secured by Draymond Simons.

[03:31] Team_080 possession (Score: 8-15)
Larry Paul attempts a 3Pt. Contested by Paul Leonard (5.5 feet, MAN). Larry Paul misses. Rebound secured by Tobias Mitchell.

[03:16] Team_076 possession (Score: 8-15)
D'Angelo Tatum attempts a Layup. Contested by Draymond Simons (4.3 feet, ZONE). D'ANGELO TATUM MAKES IT! Assist: Paul Leonard
Score: 10-15

[03:05] Team_080 possession (Score: 10-15)
Draymond Simons attempts a 3Pt. Contested by D'Angelo Tatum (4.0 feet, MAN). Draymond Simons misses. Rebound secured by Cade Barnes.

[02:50] Team_076 possession (Score: 10-15)
D'Angelo Tatum attempts a Midrange. Contested by Draymond Simons (4.4 feet, MAN). D'ANGELO TATUM MAKES IT! Assist: Cade Barnes
Score: 12-15

[02:36] Team_080 possession (Score: 12-15)
Jaren Morant drives and kicks out. Draymond Simons attempts a 3Pt. Contested by Cade Barnes (3.8 feet, ZONE). DRAYMOND SIMONS MAKES IT! Assist: Lauri Dosunmu
Score: 12-18

[02:19] Team_076 possession (Score: 12-18)
Cade Barnes drives, picks up Jaren Morant. Help arrives from Khris Turner! Cade Barnes attempts a Dunk. Contested by Khris Turner (4.2 feet, MAN). Cade Barnes misses. Rebound secured by Jaren Morant.

[02:05] Team_080 possession (Score: 12-18)
Jaren Morant attempts a Midrange. Contested by Paul Leonard (5.7 feet, ZONE). Jaren Morant misses. Offensive rebound by Jaren Morant! Jaren Morant kicks it out.

[01:51] Team_080 possession (Score: 12-18)
Jaren Morant attempts a Midrange. Contested by Tobias Mitchell (4.8 feet, ZONE). Jaren Morant misses. Rebound secured by Tobias Mitchell.

[01:37] Team_076 possession (Score: 12-18)
Dejounte LaVine drives, Draymond Simons stays with him. Dejounte LaVine attempts a Layup. Contested by Draymond Simons (4.2 feet, ZONE). Dejounte LaVine misses. Offensive rebound by Cade Barnes! Cade Barnes kicks it out.

[01:20] Team_076 possession (Score: 12-18)
Dejounte LaVine attempts a 3Pt. Contested by Lauri Dosunmu (4.4 feet, MAN). Dejounte LaVine misses. Rebound secured by Draymond Simons.

[01:06] Team_080 possession (Score: 12-18)
Draymond Simons attempts a Midrange. Contested by Tobias Mitchell (4.7 feet, ZONE). Draymond Simons misses. Rebound secured by Cade Barnes.

[00:48] Team_076 possession (Score: 12-18)
FOUL! Holding foul on Lauri Dosunmu. [IN THE BONUS! 6 team fouls] Dejounte LaVine to the line for 2 free throws. (Lauri Dosunmu: 2 personal fouls)   FT 1/2: GOOD   FT 2/2: MISS Dejounte LaVine makes 1/2 from the line. Rebound secured by Draymond Simons.
Score: 13-18

[00:30] Team_080 possession (Score: 13-18)
Lauri Dosunmu attempts a 3Pt. Contested by Cade Barnes (4.7 feet, ZONE). Lauri Dosunmu misses. Rebound secured by Tobias Mitchell.

[00:18] Team_076 possession (Score: 13-18)
Paul Leonard drives to the basket... Paul Leonard loses control! Ball rolls out of bounds! TURNOVER! (dead ball)

[00:18] Substitution (Team_076): Dejounte LaVine OUT → Pascal Lowry IN (stamina_rule2)

[00:18] Substitution (Team_076): Tobias Mitchell OUT → Jalen Poole IN (stamina_rule2)

[00:18] Substitution (Team_076): Paul Leonard OUT → Vince Lowry IN (stamina_rule2)

[00:18] Substitution (Team_076): Cade Barnes OUT → Kevin Nowitzki IN (stamina_rule2)

[00:18] Substitution (Team_076): D'Angelo Tatum OUT → Jordan Doncic IN (stamina_rule2)

[00:18] Substitution (Team_080): Lauri Dosunmu OUT → Tony James IN (stamina_rule2)

[00:18] Substitution (Team_080): Khris Turner OUT → Larry Reaves IN (stamina_rule2)

[00:18] Substitution (Team_080): Larry Paul OUT → Joel Bryant IN (stamina_rule2)

[00:18] Substitution (Team_080): Jaren Morant OUT → Ja Cunningham IN (stamina_rule2)

[00:18] Substitution (Team_080): Draymond Simons OUT → Trae Brogdon IN (stamina_rule2)

[00:05] Team_080 possession (Score: 13-18)
Ja Cunningham attempts a Midrange. Wide open! Pascal Lowry is 6.3 feet away. [ZONE] JA CUNNINGHAM MAKES IT! Assist: Joel Bryant
Score: 13-20

================================================================================
                              1ST QUARTER COMPLETE                              
================================================================================

1ST QUARTER SCORE: Team_076 13, Team_080 20

BOX SCORE:
================================================================================

Team_076
--------------------------------------------------------------------------------
Player                MIN  PTS  REB  AST  TO      FG   FG%      3P   3P%
--------------------------------------------------------------------------------
D'Angelo Tatum         12    7    5    1   0   4/7    57.1     0/0   0.0
Tobias Mitchell        12    3    5    0   0   1/1   100.0     0/0   0.0
Paul Leonard           12    2    0    2   0   1/4    25.0     0/0   0.0
Cade Barnes            12    0    4    1   0   0/1     0.0     0/0   0.0
Dejounte LaVine        12    0    0    0   0   0/1     0.0     0/0   0.0

TEAM: FG: 6/15 (40.0%), 3PT: 1/3 (33.3%), REB: 14 (4 off, 10 def), AST: 4, TO: 4
TEAM FOULS: 5 [Team_080 in BONUS]


Team_080
--------------------------------------------------------------------------------
Player                MIN  PTS  REB  AST  TO      FG   FG%      3P   3P%
--------------------------------------------------------------------------------
Draymond Simons        12   10    5    0   0   4/7    57.1     0/0   0.0
Khris Turner           12    5    0    0   0   2/3    66.7     0/0   0.0
Jaren Morant           12    3    6    1   0   1/3    33.3     0/0   0.0
Ja Cunningham           0    2    0    0   0   1/1   100.0     0/0   0.0
Lauri Dosunmu          12    0    0    1   0   0/3     0.0     0/0   0.0
Larry Paul             12    0    1    1   0   0/1     0.0     0/0   0.0
Joel Bryant             0    0    0    1   0   0/0     0.0     0/0   0.0

TEAM: FG: 8/18 (44.4%), 3PT: 1/6 (16.7%), REB: 12 (3 off, 9 def), AST: 4, TO: 1
TEAM FOULS: 6 [Team_076 in BONUS]

================================================================================

================================================================================
                       2ND QUARTER - Team_076 vs Team_080                       
================================================================================

[12:00] Team_076 possession (Score: 13-20)
FOUL! Reach-in foul on Draymond Simons during the drive. [Team fouls: 1] No free throws, side out. (Draymond Simons: 1 personal fouls)

[11:45] Team_076 possession (Score: 13-20)
Tobias Mitchell drives and kicks out. Paul Leonard attempts a 3Pt. Contested by Lauri Dosunmu (4.4 feet, ZONE). Paul Leonard misses. Rebound secured by Jaren Morant.

[11:33] Team_080 possession (Score: 13-20)
Draymond Simons attempts a Midrange. BLOCKED BY DEJOUNTE LAVINE! Ball deflects out of bounds off Draymond Simons.

[11:14] Team_076 possession (Score: 13-20)
Dejounte LaVine attempts a Midrange. Contested by Lauri Dosunmu (4.3 feet, MAN). Dejounte LaVine misses. Rebound secured by Larry Paul.

[10:58] Team_080 possession (Score: 13-20)
Jaren Morant makes the Layup and draws the foul on Cade Barnes! And-1! Jaren Morant to the line for 1. [Team fouls: 1] (Cade Barnes: 1 personal fouls)   FT 1/1: GOOD Jaren Morant makes 1/1 from the line.
Score: 13-23

[10:43] Team_076 possession (Score: 13-23)
Paul Leonard attempts a 3Pt. Contested by Khris Turner (5.3 feet, ZONE). Paul Leonard misses. Offensive rebound by Cade Barnes! Cade Barnes kicks it out.

[10:25] Team_076 possession (Score: 13-23)
Tobias Mitchell loses the ball! Stripped by Khris Turner! TURNOVER! (live ball)

[10:14] Team_080 possession (Score: 13-23)
Draymond Simons loses the ball! Stripped by D'Angelo Tatum! TURNOVER! (live ball)

[09:58] Team_076 possession (Score: 13-23)
D'Angelo Tatum attempts a Midrange. Contested by Larry Paul (4.1 feet, ZONE). D'ANGELO TATUM MAKES IT! Assist: Dejounte LaVine
Score: 15-23

[09:43] Team_080 possession (Score: 15-23)
Draymond Simons drives and kicks out. Jaren Morant attempts a 3Pt. Contested by Cade Barnes (4.1 feet, ZONE). Jaren Morant misses. Rebound secured by D'Angelo Tatum.

[09:31] Team_076 possession (Score: 15-23)
Dejounte LaVine attempts a Midrange. Contested by Lauri Dosunmu (4.5 feet, MAN). Dejounte LaVine misses. Rebound secured by Draymond Simons.

[09:19] Team_080 possession (Score: 15-23)
Jaren Morant makes the Dunk and draws the foul on Cade Barnes! And-1! Jaren Morant to the line for 1. [Team fouls: 2] (Cade Barnes: 2 personal fouls)   FT 1/1: GOOD Jaren Morant makes 1/1 from the line.
Score: 15-26

[09:05] Team_076 possession (Score: 15-26)
Tobias Mitchell makes the Layup and draws the foul on Khris Turner! And-1! Tobias Mitchell to the line for 1. [Team fouls: 2] (Khris Turner: 1 personal fouls)   FT 1/1: GOOD Tobias Mitchell makes 1/1 from the line.
Score: 18-26

[08:47] Team_080 possession (Score: 18-26)
Jaren Morant drives, Cade Barnes stays with him. Jaren Morant attempts a Layup. Contested by Cade Barnes (4.5 feet, ZONE). Jaren Morant misses. Rebound secured by D'Angelo Tatum.

[08:32] Team_076 possession (Score: 18-26)
Tobias Mitchell attempts a Midrange. Contested by Khris Turner (5.5 feet, MAN). TOBIAS MITCHELL MAKES IT! Assist: D'Angelo Tatum
Score: 20-26

[08:20] Team_080 possession (Score: 20-26)
Jaren Morant attempts a 3Pt. Contested by Cade Barnes (4.5 feet, ZONE). JAREN MORANT MAKES IT! Assist: Larry Paul
Score: 20-29

[08:07] Team_076 possession (Score: 20-29)
Tobias Mitchell attempts a 3Pt. BLOCKED BY KHRIS TURNER! Ball is loose! Rebound secured by Larry Paul.

[07:53] Team_080 possession (Score: 20-29)
Draymond Simons attempts a Layup. Contested by D'Angelo Tatum (4.6 feet, MAN). DRAYMOND SIMONS MAKES IT! Assist: Jaren Morant
Score: 20-31

[07:39] Team_076 possession (Score: 20-31)
FOUL! Holding foul on Draymond Simons. [Team fouls: 3] No free throws, side out. (Draymond Simons: 2 personal fouls)

[07:24] Team_076 possession (Score: 20-31)
Dejounte LaVine makes the Layup and draws the foul on Lauri Dosunmu! And-1! Dejounte LaVine to the line for 1. [Team fouls: 4] (Lauri Dosunmu: 1 personal fouls)   FT 1/1: GOOD Dejounte LaVine makes 1/1 from the line.
Score: 23-31

[07:12] Team_080 possession (Score: 23-31)
Draymond Simons drives, D'Angelo Tatum stays with him. Draymond Simons attempts a Layup. Contested by D'Angelo Tatum (4.7 feet, MAN). DRAYMOND SIMONS MAKES IT! Assist: Larry Paul
Score: 23-33

[07:00] Team_076 possession (Score: 23-33)
FOUL! Holding foul on Draymond Simons. [IN THE BONUS! 5 team fouls] D'Angelo Tatum to the line for 2 free throws. (Draymond Simons: 3 personal fouls)   FT 1/2: GOOD   FT 2/2: GOOD D'Angelo Tatum makes 2/2 from the line.
Score: 25-33

[06:46] Team_080 possession (Score: 25-33)
Draymond Simons attempts a 3Pt. Contested by D'Angelo Tatum (4.7 feet, MAN). Draymond Simons misses. Rebound secured by Cade Barnes.

[06:33] Team_076 possession (Score: 25-33)
Cade Barnes loses control! Ball rolls out of bounds! TURNOVER! (dead ball)

[06:33] Substitution (Team_076): Dejounte LaVine OUT → Pascal Lowry IN (stamina_rule2)

[06:33] Substitution (Team_076): Tobias Mitchell OUT → Jalen Poole IN (stamina_rule2)

[06:33] Substitution (Team_076): Paul Leonard OUT → Vince Lowry IN (stamina_rule2)

[06:33] Substitution (Team_076): Cade Barnes OUT → Kevin Nowitzki IN (stamina_rule2)

[06:33] Substitution (Team_076): D'Angelo Tatum OUT → Jordan Doncic IN (stamina_rule2)

[06:33] Substitution (Team_080): Lauri Dosunmu OUT → Tony James IN (stamina_rule2)

[06:33] Substitution (Team_080): Khris Turner OUT → Larry Reaves IN (stamina_rule2)

[06:33] Substitution (Team_080): Larry Paul OUT → Joel Bryant IN (stamina_rule2)

[06:33] Substitution (Team_080): Jaren Morant OUT → Ja Cunningham IN (stamina_rule2)

[06:33] Substitution (Team_080): Draymond Simons OUT → Trae Brogdon IN (stamina_rule2)

[06:17] Team_080 possession (Score: 25-33)
Tony James attempts a 3Pt. Contested by Vince Lowry (4.4 feet, ZONE). Tony James misses. Rebound secured by Kevin Nowitzki.

[06:01] Team_076 possession (Score: 25-33)
Vince Lowry attempts a Layup. Contested by Joel Bryant (4.3 feet, MAN). VINCE LOWRY MAKES IT! Assist: Pascal Lowry
Score: 27-33

[05:47] Team_080 possession (Score: 27-33)
Trae Brogdon drives, Jordan Doncic stays with him. Trae Brogdon attempts a Dunk. Contested by Jordan Doncic (3.2 feet, MAN). TRAE BROGDON MAKES IT! Assist: Larry Reaves
Score: 27-35

[05:38] Team_076 possession (Score: 27-35)
Vince Lowry drives to the basket... Vince Lowry throws a bad pass! Stolen by Ja Cunningham! TURNOVER! (live ball)

[05:20] Team_080 possession (Score: 27-35)
Larry Reaves attempts a 3Pt. Contested by Vince Lowry (4.4 feet, ZONE). LARRY REAVES MAKES IT! Assist: Tony James
Score: 27-38

[05:05] Team_076 possession (Score: 27-38)
Kevin Nowitzki attempts a 3Pt. Contested by Joel Bryant (4.7 feet, ZONE). Kevin Nowitzki misses. Rebound secured by Ja Cunningham.

[04:52] Team_080 possession (Score: 27-38)
FOUL! Holding foul on Jalen Poole. [Team fouls: 3] No free throws, side out. (Jalen Poole: 1 personal fouls)

[04:36] Team_080 possession (Score: 27-38)
Trae Brogdon attempts a 3Pt. Contested by Jordan Doncic (3.2 feet, MAN). Trae Brogdon misses. Rebound secured by Jordan Doncic.

[04:23] Team_076 possession (Score: 27-38)
FOUL! Reach-in foul on Larry Reaves during the drive. [IN THE BONUS! 6 team fouls] Jalen Poole to the line for 2 free throws. (Larry Reaves: 1 personal fouls)   FT 1/2: MISS   FT 2/2: MISS Jalen Poole makes 0/2 from the line. Rebound secured by Trae Brogdon.

[04:05] Team_080 possession (Score: 27-38)
Ja Cunningham attempts a Midrange. Contested by Kevin Nowitzki (4.3 feet, MAN). JA CUNNINGHAM MAKES IT! Assist: Trae Brogdon
Score: 27-40

[03:47] Team_076 possession (Score: 27-40)
Vince Lowry drives and kicks out. Jalen Poole attempts a 3Pt. Contested by Joel Bryant (4.4 feet, ZONE). Jalen Poole misses. Rebound secured by Trae Brogdon.

[03:32] Team_080 possession (Score: 27-40)
Larry Reaves attempts a 3Pt. Contested by Jalen Poole (5.6 feet, MAN). Larry Reaves misses. Offensive rebound by Larry Reaves! Larry Reaves kicks it out.

[03:16] Team_080 possession (Score: 27-40)
FOUL! Shooting foul on Jordan Doncic. Ja Cunningham to the line for 2 free throws. [Team fouls: 4] (Jordan Doncic: 1 personal fouls)   FT 1/2: GOOD   FT 2/2: GOOD Ja Cunningham makes 2/2 from the line.
Score: 27-42

[03:04] Team_076 possession (Score: 27-42)
Vince Lowry attempts a Midrange. Contested by Joel Bryant (4.3 feet, MAN). Vince Lowry misses. Rebound secured by Larry Reaves.

[02:49] Team_080 possession (Score: 27-42)
FOUL! Shooting foul on Jordan Doncic. Joel Bryant to the line for 2 free throws. [BONUS: 5 team fouls] (Jordan Doncic: 2 personal fouls)   FT 1/2: GOOD   FT 2/2: MISS Joel Bryant makes 1/2 from the line. Offensive rebound by Ja Cunningham! Ja Cunningham kicks it out.
Score: 27-43

[02:35] Team_080 possession (Score: 27-43)
Joel Bryant drives to the basket... Joel Bryant loses the ball! Stripped by Vince Lowry! TURNOVER! (live ball)

[02:20] Team_076 possession (Score: 27-43)
Vince Lowry attempts a Midrange. Contested by Joel Bryant (4.3 feet, MAN). Vince Lowry misses. Offensive rebound by Jordan Doncic! Jordan Doncic kicks it out.

[02:03] Team_076 possession (Score: 27-43)
Jordan Doncic makes the Layup and draws the foul on Trae Brogdon! And-1! Jordan Doncic to the line for 1. [BONUS: 7 team fouls] (Trae Brogdon: 1 personal fouls)   FT 1/1: MISS Jordan Doncic makes 0/1 from the line. Rebound secured by Larry Reaves.
Score: 29-43

[01:49] Team_080 possession (Score: 29-43)
FOUL! Reach-in foul on Kevin Nowitzki during the drive. [IN THE BONUS! 6 team fouls] Ja Cunningham to the line for 2 free throws. (Kevin Nowitzki: 1 personal fouls)   FT 1/2: GOOD   FT 2/2: GOOD Ja Cunningham makes 2/2 from the line.
Score: 29-45

[01:31] Team_076 possession (Score: 29-45)
Jalen Poole attempts a 3Pt. Contested by Joel Bryant (4.8 feet, ZONE). Jalen Poole misses. Rebound secured by Ja Cunningham.

[01:19] Team_080 possession (Score: 29-45)
Tony James attempts a 3Pt. Wide open! Pascal Lowry is 6.5 feet away. [MAN] Tony James misses. Rebound secured by Jordan Doncic.

[01:06] Team_076 possession (Score: 29-45)
FOUL! Offensive foul on Pascal Lowry! Tony James drew the charge! [Team fouls: 7] (Pascal Lowry: 1 personal fouls) TURNOVER! (dead ball)

[00:51] Team_080 possession (Score: 29-45)
Ja Cunningham attempts a 3Pt. Contested by Kevin Nowitzki (4.3 feet, ZONE). JA CUNNINGHAM MAKES IT! Assist: Trae Brogdon
Score: 29-48

[00:36] Team_076 possession (Score: 29-48)
Pascal Lowry makes the Layup and draws the foul on Tony James! And-1! Pascal Lowry to the line for 1. [BONUS: 8 team fouls] (Tony James: 1 personal fouls)   FT 1/1: MISS Pascal Lowry makes 0/1 from the line. FOUL! Loose ball foul on Larry Reaves during the free throw rebound! [IN THE BONUS! 9 team fouls] Kevin Nowitzki to the line for 2 free throws. (Larry Reaves: 2 personal fouls)   FT 1/2: GOOD   FT 2/2: GOOD Kevin Nowitzki makes 2/2 from the line.
Score: 33-48

[00:24] Team_080 possession (Score: 33-48)
Tony James attempts a Layup. Contested by Jordan Doncic (3.5 feet, ZONE). Tony James misses. Rebound secured by Vince Lowry.

[00:06] Team_076 possession (Score: 33-48)
Pascal Lowry attempts a 3Pt. Contested by Joel Bryant (4.1 feet, ZONE). Pascal Lowry misses. Offensive rebound by Jordan Doncic! Jordan Doncic kicks it out.

================================================================================
                              2ND QUARTER COMPLETE                              
================================================================================

2ND QUARTER SCORE: Team_076 20, Team_080 28

BOX SCORE:
================================================================================

Team_076
--------------------------------------------------------------------------------
Player                MIN  PTS  REB  AST  TO      FG   FG%      3P   3P%
--------------------------------------------------------------------------------
Tobias Mitchell        18    5    0    0   0   2/4    50.0     0/0   0.0
D'Angelo Tatum         18    4    2    1   0   2/2   100.0     0/0   0.0
Kevin Nowitzki          7    4    1    0   0   1/2    50.0     0/0   0.0
Dejounte LaVine        18    3    0    1   0   1/3    33.3     0/0   0.0
Vince Lowry             7    2    1    0   0   1/3    33.3     0/0   0.0
Cade Barnes            18    0    2    0   0   0/0     0.0     0/0   0.0
Pascal Lowry            7    0    0    1   0   0/0     0.0     0/0   0.0
Jordan Doncic           7    0    4    0   0   0/1     0.0     0/0   0.0
Jalen Poole             7    0    0    0   0   0/2     0.0     0/0   0.0

TEAM: FG: 7/17 (41.2%), 3PT: 0/3 (0.0%), REB: 10 (3 off, 7 def), AST: 3, TO: 4
TEAM FOULS: 7 [Team_080 in BONUS]


Team_080
--------------------------------------------------------------------------------
Player                MIN  PTS  REB  AST  TO      FG   FG%      3P   3P%
--------------------------------------------------------------------------------
Jaren Morant           18    9    1    1   0   3/4    75.0     0/0   0.0
Ja Cunningham           7    9    3    0   0   4/4   100.0     0/0   0.0
Draymond Simons        18    4    1    0   0   2/5    40.0     0/0   0.0
Larry Reaves            7    3    3    1   0   1/1   100.0     0/0   0.0
Trae Brogdon            7    2    2    2   0   1/2    50.0     0/0   0.0
Larry Paul             18    0    2    2   0   0/0     0.0     0/0   0.0
Tony James              7    0    0    1   0   0/3     0.0     0/0   0.0

TEAM: FG: 11/19 (57.9%), 3PT: 3/7 (42.9%), REB: 12 (2 off, 10 def), AST: 7, TO: 2
TEAM FOULS: 9 [Team_076 in BONUS]

================================================================================

================================================================================
                       3RD QUARTER - Team_076 vs Team_080                       
================================================================================

[12:00] Team_076 possession (Score: 33-48)
D'Angelo Tatum attempts a Layup. Contested by Draymond Simons (4.1 feet, ZONE). D'ANGELO TATUM MAKES IT! Assist: Cade Barnes
Score: 35-48

[11:44] Team_080 possession (Score: 35-48)
Draymond Simons attempts a Layup. Contested by Cade Barnes (3.7 feet, ZONE). DRAYMOND SIMONS MAKES IT! Assist: Khris Turner
Score: 35-50

[11:29] Team_076 possession (Score: 35-50)
FOUL! Shooting foul on Larry Paul. Paul Leonard to the line for 2 free throws. [Team fouls: 1] (Larry Paul: 1 personal fouls)   FT 1/2: GOOD   FT 2/2: GOOD Paul Leonard makes 2/2 from the line.
Score: 37-50

[11:14] Team_080 possession (Score: 37-50)
Draymond Simons attempts a 3Pt. Contested by Paul Leonard (5.3 feet, ZONE). Draymond Simons misses. Rebound secured by D'Angelo Tatum.

[10:59] Team_076 possession (Score: 37-50)
FOUL! Reach-in foul on Larry Paul during the drive. [Team fouls: 2] No free throws, side out. (Larry Paul: 2 personal fouls)

[10:45] Team_076 possession (Score: 37-50)
Dejounte LaVine attempts a 3Pt. Contested by Lauri Dosunmu (4.0 feet, MAN). DEJOUNTE LAVINE MAKES IT! Assist: Tobias Mitchell
Score: 40-50

[10:28] Team_080 possession (Score: 40-50)
Khris Turner attempts a 3Pt. Contested by Tobias Mitchell (4.3 feet, ZONE). Khris Turner misses. Rebound secured by D'Angelo Tatum.

[10:13] Team_076 possession (Score: 40-50)
Dejounte LaVine attempts a 3Pt. Contested by Lauri Dosunmu (4.0 feet, MAN). Dejounte LaVine misses. Rebound secured by Jaren Morant.

[09:57] Team_080 possession (Score: 40-50)
Lauri Dosunmu attempts a Midrange. Contested by Cade Barnes (4.3 feet, ZONE). LAURI DOSUNMU MAKES IT!
Score: 40-52

[09:47] Team_076 possession (Score: 40-52)
FOUL! Shooting foul on Draymond Simons. Cade Barnes to the line for 2 free throws. [Team fouls: 3] (Draymond Simons: 1 personal fouls)   FT 1/2: GOOD   FT 2/2: GOOD Cade Barnes makes 2/2 from the line.
Score: 42-52

[09:27] Team_080 possession (Score: 42-52)
FOUL! Reach-in foul on Cade Barnes during the drive. [Team fouls: 1] No free throws, side out. (Cade Barnes: 1 personal fouls)

[09:14] Team_080 possession (Score: 42-52)
Draymond Simons drives and kicks out. Khris Turner attempts a 3Pt. Contested by Cade Barnes (3.5 feet, ZONE). Khris Turner misses. Rebound secured by Tobias Mitchell.

[09:00] Team_076 possession (Score: 42-52)
Cade Barnes attempts a Layup. Contested by Draymond Simons (4.1 feet, ZONE). CADE BARNES MAKES IT!
Score: 44-52

[08:47] Team_080 possession (Score: 44-52)
Jaren Morant throws a bad pass! Stolen by Cade Barnes! TURNOVER! (live ball)

[08:33] Team_076 possession (Score: 44-52)
Dejounte LaVine attempts a Layup. BLOCKED BY DRAYMOND SIMONS! Ball deflects out of bounds off Dejounte LaVine.

[08:17] Team_080 possession (Score: 44-52)
FOUL! Holding foul on D'Angelo Tatum. [Team fouls: 2] No free throws, side out. (D'Angelo Tatum: 1 personal fouls)

[08:03] Team_080 possession (Score: 44-52)
Lauri Dosunmu attempts a Layup. BLOCKED BY CADE BARNES! Ball is loose! Rebound secured by Tobias Mitchell.

[07:49] Team_076 possession (Score: 44-52)
Cade Barnes drives and kicks out. Dejounte LaVine attempts a 3Pt. Contested by Lauri Dosunmu (4.0 feet, ZONE). Dejounte LaVine misses. Rebound secured by Draymond Simons.

[07:34] Team_080 possession (Score: 44-52)
Draymond Simons attempts a 3Pt. Contested by D'Angelo Tatum (3.9 feet, MAN). Draymond Simons misses. Rebound secured by Tobias Mitchell.

[07:20] Team_076 possession (Score: 44-52)
FOUL! Holding foul on Jaren Morant. [Team fouls: 4] No free throws, side out. (Jaren Morant: 1 personal fouls)

[07:02] Team_076 possession (Score: 44-52)
Cade Barnes drives and kicks out. Cade Barnes attempts a 3Pt. Contested by Jaren Morant (3.7 feet, MAN). Cade Barnes misses. Rebound secured by Jaren Morant.

[06:48] Team_080 possession (Score: 44-52)
Larry Paul attempts a Layup. Contested by Cade Barnes (3.8 feet, ZONE). LARRY PAUL MAKES IT! Assist: Draymond Simons
Score: 44-54

[06:35] Team_076 possession (Score: 44-54)
Paul Leonard attempts a 3Pt. Contested by Lauri Dosunmu (4.4 feet, ZONE). Paul Leonard misses. Rebound secured by Larry Paul.

[06:21] Team_080 possession (Score: 44-54)
Lauri Dosunmu attempts a 3Pt. Contested by Dejounte LaVine (5.7 feet, MAN). Lauri Dosunmu misses. FOUL! Loose ball foul on Tobias Mitchell during the rebound battle. [Team fouls: 3] No free throws, side out. (Tobias Mitchell: 1 personal fouls)

[06:04] Team_080 possession (Score: 44-54)
Larry Paul attempts a 3Pt. Contested by Paul Leonard (5.4 feet, MAN). Larry Paul misses. Rebound secured by Cade Barnes.

[05:51] Team_076 possession (Score: 44-54)
D'Angelo Tatum attempts a Layup. Contested by Draymond Simons (4.1 feet, MAN). D'Angelo Tatum misses. Offensive rebound by D'Angelo Tatum! D'Angelo Tatum kicks it out.

[05:36] Team_076 possession (Score: 44-54)
Cade Barnes attempts a 3Pt. Contested by Jaren Morant (3.9 feet, MAN). Cade Barnes misses. Rebound secured by Jaren Morant.

[05:25] Team_080 possession (Score: 44-54)
Larry Paul attempts a 3Pt. Contested by Paul Leonard (5.4 feet, MAN). Larry Paul misses. Rebound secured by Cade Barnes.

[05:11] Team_076 possession (Score: 44-54)
Tobias Mitchell attempts a Layup. Contested by Khris Turner (5.0 feet, MAN). Tobias Mitchell misses. Rebound secured by Draymond Simons.

[04:54] Team_080 possession (Score: 44-54)
Khris Turner attempts a 3Pt. Contested by Cade Barnes (3.8 feet, ZONE). Khris Turner misses. Rebound secured by Tobias Mitchell.

[04:40] Team_076 possession (Score: 44-54)
Dejounte LaVine attempts a 3Pt. Contested by Lauri Dosunmu (4.0 feet, MAN). Dejounte LaVine misses. Rebound secured by Jaren Morant.

[04:29] Team_080 possession (Score: 44-54)
Khris Turner attempts a 3Pt. Contested by Cade Barnes (3.8 feet, ZONE). Khris Turner misses. Rebound secured by D'Angelo Tatum.

[04:10] Team_076 possession (Score: 44-54)
Dejounte LaVine attempts a 3Pt. Contested by Larry Paul (3.5 feet, ZONE). Dejounte LaVine misses. Rebound secured by Jaren Morant.

[03:54] Team_080 possession (Score: 44-54)
FOUL! Reach-in foul on D'Angelo Tatum during the drive. [Team fouls: 4] No free throws, side out. (D'Angelo Tatum: 2 personal fouls)

[03:44] Team_080 possession (Score: 44-54)
Draymond Simons makes the Midrange and draws the foul on D'Angelo Tatum! And-1! Draymond Simons to the line for 1. [BONUS: 5 team fouls] (D'Angelo Tatum: 3 personal fouls)   FT 1/1: GOOD Draymond Simons makes 1/1 from the line.
Score: 44-57

[03:32] Team_076 possession (Score: 44-57)
Paul Leonard attempts a 3Pt. Contested by Lauri Dosunmu (4.5 feet, ZONE). Paul Leonard misses. Rebound secured by Jaren Morant.

[03:12] Team_080 possession (Score: 44-57)
Draymond Simons drives, Cade Barnes stays with him. Draymond Simons attempts a Layup. Contested by Cade Barnes (3.9 feet, ZONE). DRAYMOND SIMONS MAKES IT!
Score: 44-59

[02:58] Team_076 possession (Score: 44-59)
D'Angelo Tatum drives, picks up Draymond Simons. Help arrives from Khris Turner! D'Angelo Tatum attempts a Layup. Contested by Khris Turner (4.4 feet, MAN). D'Angelo Tatum misses. Rebound secured by Draymond Simons.

[02:43] Team_080 possession (Score: 44-59)
Larry Paul attempts a 3Pt. Contested by Paul Leonard (5.6 feet, MAN). Larry Paul misses. Rebound secured by Cade Barnes.

[02:30] Team_076 possession (Score: 44-59)
Dejounte LaVine attempts a Layup. Contested by Draymond Simons (4.1 feet, ZONE). DEJOUNTE LAVINE MAKES IT!
Score: 46-59

[02:16] Team_080 possession (Score: 46-59)
Draymond Simons drives to the basket... Draymond Simons loses the ball! Stripped by Cade Barnes! TURNOVER! (live ball)

[02:01] Team_076 possession (Score: 46-59)
Paul Leonard attempts a Midrange. Contested by Larry Paul (4.1 feet, MAN). Paul Leonard misses. Offensive rebound by Cade Barnes! Cade Barnes kicks it out.

[01:48] Team_076 possession (Score: 46-59)
Tobias Mitchell drives, Draymond Simons stays with him. Tobias Mitchell attempts a Dunk. Contested by Draymond Simons (4.6 feet, ZONE). TOBIAS MITCHELL MAKES IT!
Score: 48-59

[01:35] Team_080 possession (Score: 48-59)
Larry Paul attempts a 3Pt. Contested by Paul Leonard (5.7 feet, MAN). LARRY PAUL MAKES IT! Assist: Draymond Simons
Score: 48-62

[01:24] Team_076 possession (Score: 48-62)
Tobias Mitchell throws a bad pass out of bounds! TURNOVER! (dead ball)

[01:24] Substitution (Team_076): Dejounte LaVine OUT → Pascal Lowry IN (stamina_rule2)

[01:24] Substitution (Team_076): Tobias Mitchell OUT → Jalen Poole IN (stamina_rule2)

[01:24] Substitution (Team_076): Paul Leonard OUT → Vince Lowry IN (stamina_rule2)

[01:24] Substitution (Team_076): Cade Barnes OUT → Kevin Nowitzki IN (stamina_rule2)

[01:24] Substitution (Team_076): D'Angelo Tatum OUT → Jordan Doncic IN (stamina_rule2)

[01:24] Substitution (Team_080): Lauri Dosunmu OUT → Tony James IN (stamina_rule2)

[01:24] Substitution (Team_080): Khris Turner OUT → Larry Reaves IN (stamina_rule2)

[01:24] Substitution (Team_080): Larry Paul OUT → Joel Bryant IN (stamina_rule2)

[01:24] Substitution (Team_080): Jaren Morant OUT → Ja Cunningham IN (stamina_rule2)

[01:24] Substitution (Team_080): Draymond Simons OUT → Trae Brogdon IN (stamina_rule2)

[01:11] Team_080 possession (Score: 48-62)
Joel Bryant drives to the basket... Joel Bryant throws a bad pass! Stolen by Jordan Doncic! TURNOVER! (live ball)

[01:00] Team_076 possession (Score: 48-62)
Pascal Lowry drives, Tony James stays with him. Pascal Lowry attempts a Layup. Contested by Tony James (3.8 feet, MAN). Pascal Lowry misses. FOUL! Loose ball foul on Trae Brogdon during the rebound battle. [IN THE BONUS! 5 team fouls] Kevin Nowitzki to the line for 2 free throws. (Trae Brogdon: 1 personal fouls)   FT 1/2: GOOD   FT 2/2: GOOD Kevin Nowitzki makes 2/2 from the line.
Score: 50-62

[00:45] Team_080 possession (Score: 50-62)
Trae Brogdon drives, Jordan Doncic stays with him. Trae Brogdon attempts a Dunk. Contested by Jordan Doncic (3.2 feet, ZONE). Trae Brogdon misses. Rebound secured by Vince Lowry.

[00:35] Team_076 possession (Score: 50-62)
Pascal Lowry loses the ball! Stripped by Tony James! TURNOVER! (live ball)

[00:24] Team_080 possession (Score: 50-62)
Tony James attempts a Midrange. Wide open! Pascal Lowry is 6.5 feet away. [MAN] TONY JAMES MAKES IT! Assist: Ja Cunningham
Score: 50-64

[00:09] Team_076 possession (Score: 50-64)
Kevin Nowitzki attempts a Layup. Contested by Ja Cunningham (5.0 feet, ZONE). Kevin Nowitzki misses. Rebound secured by Larry Reaves.

================================================================================
                              3RD QUARTER COMPLETE                              
================================================================================

3RD QUARTER SCORE: Team_076 17, Team_080 16

BOX SCORE:
================================================================================

Team_076
--------------------------------------------------------------------------------
Player                MIN  PTS  REB  AST  TO      FG   FG%      3P   3P%
--------------------------------------------------------------------------------
Dejounte LaVine        28    5    0    0   0   2/6    33.3     0/0   0.0
Cade Barnes            28    4    4    1   0   2/5    40.0     0/0   0.0
D'Angelo Tatum         28    2    4    0   0   1/2    50.0     0/0   0.0
Paul Leonard           28    2    0    0   0   1/3    33.3     0/0   0.0
Tobias Mitchell        28    2    4    1   0   1/2    50.0     0/0   0.0
Kevin Nowitzki          8    2    0    0   0   1/2    50.0     0/0   0.0
Vince Lowry             8    0    1    0   0   0/0     0.0     0/0   0.0

TEAM: FG: 8/20 (40.0%), 3PT: 1/7 (14.3%), REB: 13 (2 off, 11 def), AST: 2, TO: 2
TEAM FOULS: 5 [Team_080 in BONUS]


Team_080
--------------------------------------------------------------------------------
Player                MIN  PTS  REB  AST  TO      FG   FG%      3P   3P%
--------------------------------------------------------------------------------
Draymond Simons        28    7    4    2   0   3/6    50.0     0/0   0.0
Larry Paul             28    5    1    0   0   2/5    40.0     0/0   0.0
Lauri Dosunmu          28    2    0    0   0   1/2    50.0     0/0   0.0
Tony James              8    2    0    0   0   1/1   100.0     0/0   0.0
Khris Turner           28    0    0    1   0   0/3     0.0     0/0   0.0
Jaren Morant           28    0    6    0   0   0/0     0.0     0/0   0.0
Trae Brogdon            8    0    0    0   0   0/1     0.0     0/0   0.0
Ja Cunningham           8    0    0    1   0   0/0     0.0     0/0   0.0
Larry Reaves            8    0    1    0   0   0/0     0.0     0/0   0.0

TEAM: FG: 7/18 (38.9%), 3PT: 1/9 (11.1%), REB: 12 (1 off, 11 def), AST: 4, TO: 3
TEAM FOULS: 5 [Team_076 in BONUS]

================================================================================

================================================================================
                       4TH QUARTER - Team_076 vs Team_080                       
================================================================================

[12:00] Substitution (Team_076): Dejounte LaVine OUT (stamina: 75) → Pascal Lowry IN (comeback_detected)

[12:00] Substitution (Team_080): Lauri Dosunmu OUT (stamina: 74) → Tony James IN (comeback_detected)

[12:00] Team_076 possession (Score: 50-64)
Paul Leonard attempts a Layup. BLOCKED BY LARRY PAUL! Ball is loose! Rebound secured by Draymond Simons.

[11:42] Team_080 possession (Score: 50-64)
Larry Paul attempts a Midrange. Contested by Paul Leonard (5.5 feet, MAN). Larry Paul misses. Rebound secured by Tobias Mitchell.

[11:29] Team_076 possession (Score: 50-64)
FOUL! Reach-in foul on Jaren Morant during the drive. [Team fouls: 1] No free throws, side out. (Jaren Morant: 1 personal fouls)

[11:13] Team_076 possession (Score: 50-64)
FOUL! Holding foul on Tony James. [Team fouls: 2] No free throws, side out. (Tony James: 1 personal fouls)

[10:56] Team_076 possession (Score: 50-64)
Cade Barnes loses the ball! Stripped by Jaren Morant! TURNOVER! (live ball)

[10:43] Team_080 possession (Score: 50-64)
Jaren Morant drives to the basket... Jaren Morant throws a bad pass! Stolen by Cade Barnes! TURNOVER! (live ball)

[10:24] Team_076 possession (Score: 50-64)
Cade Barnes drives and kicks out. Paul Leonard attempts a Midrange. Contested by Larry Paul (3.7 feet, ZONE). Paul Leonard misses. Rebound secured by Draymond Simons.

[10:09] Team_080 possession (Score: 50-64)
Larry Paul attempts a 3Pt. Contested by Cade Barnes (4.1 feet, ZONE). Larry Paul misses. Offensive rebound by Jaren Morant! Jaren Morant kicks it out.

[09:51] Team_080 possession (Score: 50-64)
Tony James loses the ball! Stripped by Pascal Lowry! TURNOVER! (live ball)

[09:38] Team_076 possession (Score: 50-64)
Pascal Lowry attempts a Layup. Contested by Tony James (3.8 feet, MAN). Pascal Lowry misses. Offensive rebound by D'Angelo Tatum! D'Angelo Tatum kicks it out.

[09:26] Team_076 possession (Score: 50-64)
D'Angelo Tatum attempts a Layup. Contested by Draymond Simons (4.6 feet, MAN). D'Angelo Tatum misses. Rebound secured by Jaren Morant.

[09:08] Team_080 possession (Score: 50-64)
Tony James drives and kicks out. Draymond Simons attempts a 3Pt. Contested by D'Angelo Tatum (4.1 feet, MAN). Draymond Simons misses. Rebound secured by D'Angelo Tatum.

[08:53] Team_076 possession (Score: 50-64)
Tobias Mitchell attempts a 3Pt. Contested by Khris Turner (5.3 feet, MAN). TOBIAS MITCHELL MAKES IT! Assist: Pascal Lowry
Score: 53-64

[08:40] Team_080 possession (Score: 53-64)
Draymond Simons attempts a Midrange. Contested by D'Angelo Tatum (4.3 feet, MAN). Draymond Simons misses. Rebound secured by Tobias Mitchell.

[08:26] Team_076 possession (Score: 53-64)
FOUL! Shooting foul on Tony James. Pascal Lowry to the line for 2 free throws. [Team fouls: 3] (Tony James: 2 personal fouls)   FT 1/2: GOOD   FT 2/2: GOOD Pascal Lowry makes 2/2 from the line.
Score: 55-64

[08:11] Team_080 possession (Score: 55-64)
Khris Turner drives to the basket... Khris Turner loses control! Ball rolls out of bounds! TURNOVER! (dead ball)

[08:11] Substitution (Team_076): Tobias Mitchell OUT → Jalen Poole IN (stamina_rule2)

[08:11] Substitution (Team_076): Paul Leonard OUT → Vince Lowry IN (stamina_rule2)

[08:11] Substitution (Team_076): Cade Barnes OUT → Kevin Nowitzki IN (stamina_rule2)

[08:11] Substitution (Team_076): D'Angelo Tatum OUT → Jordan Doncic IN (stamina_rule2)

[08:11] Substitution (Team_080): Khris Turner OUT → Larry Reaves IN (stamina_rule2)

[08:11] Substitution (Team_080): Larry Paul OUT → Joel Bryant IN (stamina_rule2)

[08:11] Substitution (Team_080): Jaren Morant OUT → Ja Cunningham IN (stamina_rule2)

[08:11] Substitution (Team_080): Draymond Simons OUT → Trae Brogdon IN (stamina_rule2)

[07:58] Team_076 possession (Score: 55-64)
Jordan Doncic drives, Ja Cunningham stays with him. Jordan Doncic attempts a Layup. Contested by Ja Cunningham (4.2 feet, ZONE). Jordan Doncic misses. Rebound secured by Ja Cunningham.

[07:44] Team_080 possession (Score: 55-64)
FOUL! Holding foul on Jalen Poole. [Team fouls: 1] No free throws, side out. (Jalen Poole: 1 personal fouls)

[07:32] Team_080 possession (Score: 55-64)
FOUL! Holding foul on Kevin Nowitzki. [Team fouls: 2] No free throws, side out. (Kevin Nowitzki: 1 personal fouls)

[07:14] Team_080 possession (Score: 55-64)
Joel Bryant attempts a 3Pt. Contested by Vince Lowry (4.5 feet, ZONE). Joel Bryant misses. Rebound secured by Kevin Nowitzki.

[07:02] Team_076 possession (Score: 55-64)
Pascal Lowry attempts a Midrange. Contested by Tony James (3.8 feet, MAN). Pascal Lowry misses. Offensive rebound by Kevin Nowitzki! Kevin Nowitzki kicks it out.

[06:52] Team_076 possession (Score: 55-64)
Vince Lowry attempts a Midrange. Contested by Joel Bryant (4.3 feet, MAN). Vince Lowry misses. FOUL! Loose ball foul on Larry Reaves during the rebound battle. [Team fouls: 4] No free throws, side out. (Larry Reaves: 1 personal fouls)

[06:37] Team_076 possession (Score: 55-64)
FOUL! Shooting foul on Larry Reaves. Pascal Lowry to the line for 3 free throws. [BONUS: 5 team fouls] (Larry Reaves: 2 personal fouls)   FT 1/3: MISS   FT 2/3: GOOD   FT 3/3: GOOD Pascal Lowry makes 2/3 from the line.
Score: 57-64

[06:19] Team_080 possession (Score: 57-64)
Joel Bryant drives and kicks out. Joel Bryant attempts a 3Pt. Contested by Vince Lowry (4.2 feet, MAN). Joel Bryant misses. Offensive rebound by Ja Cunningham! Ja Cunningham kicks it out.

[06:07] Team_080 possession (Score: 57-64)
Larry Reaves drives to the basket... Larry Reaves loses the ball! Stripped by Jalen Poole! TURNOVER! (live ball)

[05:53] Team_076 possession (Score: 57-64)
Vince Lowry attempts a Midrange. Contested by Larry Reaves (4.4 feet, ZONE). Vince Lowry misses. Rebound secured by Ja Cunningham.

[05:38] Team_080 possession (Score: 57-64)
Trae Brogdon drives to the basket... Trae Brogdon throws a bad pass! Stolen by Jordan Doncic! TURNOVER! (live ball)

[05:22] Team_076 possession (Score: 57-64)
Pascal Lowry attempts a Midrange. Contested by Tony James (3.9 feet, MAN). Pascal Lowry misses. Offensive rebound by Jordan Doncic! Jordan Doncic kicks it out.

[05:11] Team_076 possession (Score: 57-64)
Jordan Doncic drives, Trae Brogdon stays with him. Jordan Doncic attempts a Dunk. Contested by Trae Brogdon (4.9 feet, MAN). Jordan Doncic misses. Rebound secured by Larry Reaves.

[04:55] Team_080 possession (Score: 57-64)
Ja Cunningham attempts a 3Pt. Contested by Kevin Nowitzki (4.3 feet, MAN). Ja Cunningham misses. Rebound secured by Jordan Doncic.

[04:39] Team_076 possession (Score: 57-64)
Jordan Doncic drives and kicks out. Jalen Poole attempts a 3Pt. Contested by Larry Reaves (4.5 feet, ZONE). Jalen Poole misses. Rebound secured by Trae Brogdon.

[04:28] Team_080 possession (Score: 57-64)
Trae Brogdon drives, picks up Jordan Doncic. Help arrives from Jalen Poole! Trae Brogdon attempts a Layup. Contested by Jalen Poole (3.2 feet, ZONE). Trae Brogdon misses. Offensive rebound by Ja Cunningham! Ja Cunningham kicks it out.

[04:15] Team_080 possession (Score: 57-64)
FOUL! Reach-in foul on Jordan Doncic during the drive. [Team fouls: 3] No free throws, side out. (Jordan Doncic: 1 personal fouls)

[04:00] Team_080 possession (Score: 57-64)
Joel Bryant attempts a 3Pt. Contested by Kevin Nowitzki (4.5 feet, ZONE). JOEL BRYANT MAKES IT! Assist: Larry Reaves
Score: 57-67

[03:45] Team_076 possession (Score: 57-67)
Pascal Lowry commits a violation (traveling/carry)! TURNOVER! (dead ball)

[03:34] Team_080 possession (Score: 57-67)
Larry Reaves loses the ball! Stripped by Jalen Poole! TURNOVER! (live ball)

[03:19] Team_076 possession (Score: 57-67)
Pascal Lowry attempts a 3Pt. Contested by Joel Bryant (4.0 feet, ZONE). Pascal Lowry misses. Offensive rebound by Jordan Doncic! Jordan Doncic kicks it out.

[03:05] Team_076 possession (Score: 57-67)
Jalen Poole drives and kicks out. Kevin Nowitzki attempts a Midrange. Contested by Ja Cunningham (4.8 feet, ZONE). KEVIN NOWITZKI MAKES IT!
Score: 59-67

[02:51] Team_080 possession (Score: 59-67)
Trae Brogdon attempts a Midrange. Contested by Vince Lowry (4.1 feet, ZONE). TRAE BROGDON MAKES IT!
Score: 59-69

[02:36] Team_076 possession (Score: 59-69)
Kevin Nowitzki drives and kicks out. Kevin Nowitzki attempts a 3Pt. Contested by Ja Cunningham (4.8 feet, MAN). Kevin Nowitzki misses. Rebound secured by Larry Reaves.

[02:22] Team_080 possession (Score: 59-69)
Joel Bryant makes the Midrange and draws the foul on Jalen Poole! And-1! Joel Bryant to the line for 1. [Team fouls: 4] (Jalen Poole: 2 personal fouls)   FT 1/1: GOOD Joel Bryant makes 1/1 from the line.
Score: 59-72

[02:09] Team_076 possession (Score: 59-72)
Jordan Doncic attempts a Layup. Contested by Trae Brogdon (5.0 feet, MAN). JORDAN DONCIC MAKES IT!
Score: 61-72

[01:55] Team_080 possession (Score: 61-72)
Tony James attempts a 3Pt. Contested by Jalen Poole (5.6 feet, ZONE). Tony James misses. FOUL! Loose ball foul on Kevin Nowitzki during the rebound battle. [IN THE BONUS! 5 team fouls] Larry Reaves to the line for 2 free throws. (Kevin Nowitzki: 2 personal fouls)   FT 1/2: GOOD   FT 2/2: MISS Larry Reaves makes 1/2 from the line. Rebound secured by Vince Lowry.
Score: 61-73

[01:46] Team_076 possession (Score: 61-73)
Vince Lowry attempts a 3Pt. Contested by Joel Bryant (4.3 feet, MAN). Vince Lowry misses. Rebound secured by Trae Brogdon.

[01:35] Team_080 possession (Score: 61-73)
Joel Bryant attempts a Midrange. Contested by Vince Lowry (4.5 feet, ZONE). Joel Bryant misses. Rebound secured by Jordan Doncic.

[01:18] Team_076 possession (Score: 61-73)
Pascal Lowry attempts a 3Pt. Contested by Tony James (4.3 feet, MAN). Pascal Lowry misses. Offensive rebound by Kevin Nowitzki! Kevin Nowitzki kicks it out.

[01:00] Team_076 possession (Score: 61-73)
Kevin Nowitzki drives, Ja Cunningham stays with him. Kevin Nowitzki attempts a Layup. Contested by Ja Cunningham (5.1 feet, MAN). KEVIN NOWITZKI MAKES IT! Assist: Jordan Doncic
Score: 63-73

[00:45] Team_080 possession (Score: 63-73)
Trae Brogdon drives, Jordan Doncic stays with him. Trae Brogdon attempts a Layup. Contested by Jordan Doncic (3.3 feet, ZONE). Trae Brogdon misses. Rebound secured by Jordan Doncic.

[00:31] Team_076 possession (Score: 63-73)
Jalen Poole attempts a 3Pt. Contested by Tony James (5.2 feet, ZONE). Jalen Poole misses. Offensive rebound by Kevin Nowitzki! Kevin Nowitzki kicks it out.

[00:15] Team_076 possession (Score: 63-73)
Jalen Poole attempts a 3Pt. Contested by Larry Reaves (5.0 feet, MAN). JALEN POOLE MAKES IT! Assist: Kevin Nowitzki
Score: 66-73

================================================================================
                              4TH QUARTER COMPLETE                              
================================================================================

4TH QUARTER SCORE: Team_076 16, Team_080 9

BOX SCORE:
================================================================================

Team_076
--------------------------------------------------------------------------------
Player                MIN  PTS  REB  AST  TO      FG   FG%      3P   3P%
--------------------------------------------------------------------------------
Pascal Lowry           20    4    0    1   0   2/2   100.0     0/0   0.0
Kevin Nowitzki         16    4    5    1   0   2/3    66.7     0/0   0.0
Tobias Mitchell        32    3    2    0   0   1/1   100.0     0/0   0.0
Jalen Poole            16    3    0    0   0   1/1   100.0     0/0   0.0
Jordan Doncic          16    2    5    1   0   1/4    25.0     0/0   0.0
Paul Leonard           32    0    0    0   0   0/1     0.0     0/0   0.0
Cade Barnes            32    0    0    0   0   0/1     0.0     0/0   0.0
D'Angelo Tatum         32    0    2    0   0   0/1     0.0     0/0   0.0
Vince Lowry            16    0    1    0   0   0/2     0.0     0/0   0.0

TEAM: FG: 7/16 (43.8%), 3PT: 3/4 (75.0%), REB: 14 (7 off, 7 def), AST: 3, TO: 2
TEAM FOULS: 5 [Team_080 in BONUS]


Team_080
--------------------------------------------------------------------------------
Player                MIN  PTS  REB  AST  TO      FG   FG%      3P   3P%
--------------------------------------------------------------------------------
Joel Bryant            16    6    0    0   0   2/4    50.0     0/0   0.0
Trae Brogdon           16    2    2    0   0   1/2    50.0     0/0   0.0
Draymond Simons        32    0    2    0   0   0/1     0.0     0/0   0.0
Larry Paul             32    0    0    0   0   0/1     0.0     0/0   0.0
Jaren Morant           32    0    2    0   0   0/0     0.0     0/0   0.0
Tony James             20    0    0    0   0   0/2     0.0     0/0   0.0
Ja Cunningham          16    0    4    0   0   0/1     0.0     0/0   0.0
Larry Reaves           16    0    2    1   0   0/0     0.0     0/0   0.0

TEAM: FG: 3/11 (27.3%), 3PT: 1/4 (25.0%), REB: 13 (4 off, 9 def), AST: 1, TO: 6
TEAM FOULS: 5 [Team_076 in BONUS]

================================================================================

================================================================================
                               FULL GAME COMPLETE                               
================================================================================

FINAL SCORE: Team_076 66, Team_080 73

SCORING BY QUARTER:
--------------------------------------------------------------------------------
Team                     Q1     Q2     Q3     Q4    FINAL
--------------------------------------------------------------------------------
Team_076                 13     20     17     16       66
Team_080                 20     28     16      9       73
--------------------------------------------------------------------------------

FULL GAME BOX SCORE:
================================================================================

Team_076
--------------------------------------------------------------------------------
Player                MIN  PTS  REB  AST  TO      FG   FG%      3P   3P%      FT STL BLK
--------------------------------------------------------------------------------
Tobias Mitchell        32   13   11    1   2   5/8    62.5   2/3    66.7   1/1     0   0
Paul Leonard           32    4    0    2   0   2/8    25.0   0/2     0.0   4/4     0   0
Cade Barnes            32    4   10    2   5   2/7    28.6   0/1     0.0   2/2     3   1
D'Angelo Tatum         32   13   13    2   1   5/10   50.0   0/1     0.0   3/4     1   0
Dejounte LaVine        28    8    0    1   0   3/10   30.0   1/5    20.0   2/3     0   1
Pascal Lowry           20    4    0    2   4   4/4   100.0   1/1   100.0   4/6     1   0
Jalen Poole            16    3    0    0   0   2/4    50.0   1/2    50.0   0/2     2   0
Vince Lowry            16    2    3    0   0   1/5    20.0   0/1     0.0   0/0     1   0
Kevin Nowitzki         16   10    6    1   0   1/4    25.0   0/1     0.0   2/2     0   0
Jordan Doncic          16    2    9    1   0   1/5    20.0   0/0     0.0   0/1     2   0

TEAM: FG: 28/68 (41.2%), 3PT: 5/17 (29.4%), REB: 51 (16 off, 35 def), AST: 12, TO: 12


Team_080
--------------------------------------------------------------------------------
Player                MIN  PTS  REB  AST  TO      FG   FG%      3P   3P%      FT STL BLK
--------------------------------------------------------------------------------
Khris Turner           32    5    0    1   1   2/6    33.3   0/4     0.0   3/3     1   1
Larry Paul             32    5    4    3   0   3/8    37.5   1/5    20.0   0/0     0   1
Jaren Morant           32   12   15    2   4   5/8    62.5   1/1   100.0   3/3     2   0
Draymond Simons        32   21   12    2   1   7/17   41.2   1/5    20.0   1/1     1   2
Lauri Dosunmu          28    2    0    1   0   1/5    20.0   0/2     0.0   0/0     0   0
Tony James             20    2    0    1   2   1/6    16.7   0/3     0.0   0/0     1   0
Larry Reaves           16    3    6    2   2   1/1   100.0   1/1   100.0   1/2     0   0
Joel Bryant            16    6    0    1   0   2/4    50.0   1/2    50.0   2/3     0   0
Ja Cunningham          16   11    7    1   1   5/6    83.3   1/2    50.0   4/4     1   0
Trae Brogdon           16    4    4    2   1   2/5    40.0   0/1     0.0   0/0     0   0

TEAM: FG: 29/66 (43.9%), 3PT: 6/26 (23.1%), REB: 49 (10 off, 39 def), AST: 16, TO: 12

================================================================================
