================================================================================
                        FULL GAME - Team_037 vs Team_027                        
================================================================================

================================================================================
                       1ST QUARTER - Team_037 vs Team_027                       
================================================================================

[12:00] Team_037 possession (Score: 0-0)
Giannis Middleton drives to the basket... Giannis Middleton loses control! Ball rolls out of bounds! TURNOVER! (dead ball)

[11:46] Team_027 possession (Score: 0-0)
FOUL! Shooting foul on Scottie Jackson. Tony Doncic to the line for 2 free throws. [Team fouls: 1] (Scottie Jackson: 1 personal fouls)   FT 1/2: GOOD   FT 2/2: GOOD Tony Doncic makes 2/2 from the line.
Score: 0-2

[11:34] Team_037 possession (Score: 0-2)
Scottie Jackson attempts a 3Pt. Contested by Tim Johnson (5.4 feet, ZONE). Scottie Jackson misses. Rebound secured by John Russell.

[11:20] Team_027 possession (Score: 0-2)
FOUL! Offensive foul on Tony Doncic! Giannis Middleton drew the charge! [Team fouls: 1] (Tony Doncic: 1 personal fouls) TURNOVER! (dead ball)

[11:04] Team_037 possession (Score: 0-2)
Collin Young drives, picks up John Russell. Help arrives from Tony Doncic! Collin Young attempts a Dunk. Contested by Tony Doncic (3.9 feet, MAN). COLLIN YOUNG MAKES IT!
Score: 2-2

[10:51] Team_027 possession (Score: 2-2)
Tony Doncic attempts a Layup. BLOCKED BY GIANNIS MIDDLETON! Ball is loose! Offensive rebound by Bradley Dosunmu! Bradley Dosunmu kicks it out.

[10:33] Team_027 possession (Score: 2-2)
Tony Doncic attempts a 3Pt. Contested by Scottie Jackson (3.7 feet, ZONE). Tony Doncic misses. Rebound secured by Collin Young.

[10:22] Team_037 possession (Score: 2-2)
RJ Mitchell attempts a 3Pt. Contested by Tim Johnson (5.1 feet, MAN). RJ Mitchell misses. Offensive rebound by Collin Young! Collin Young puts it back in!
Score: 4-2

[10:08] Team_027 possession (Score: 4-2)
Bradley Dosunmu attempts a 3Pt. Contested by Scottie Jackson (3.7 feet, ZONE). BRADLEY DOSUNMU MAKES IT! Assist: John Russell
Score: 4-5

[09:55] Team_037 possession (Score: 4-5)
Scottie Jackson attempts a Midrange. Contested by Scottie Harden (5.1 feet, ZONE). Scottie Jackson misses. Rebound secured by Tony Doncic.

[09:36] Team_027 possession (Score: 4-5)
Scottie Harden attempts a Midrange. Contested by Jarrett Tatum (4.0 feet, MAN). Scottie Harden misses. FOUL! Loose ball foul on Jarrett Tatum during the rebound battle. [Team fouls: 3] No free throws, side out. (Jarrett Tatum: 1 personal fouls)

[09:25] Team_027 possession (Score: 4-5)
John Russell drives, Collin Young stays with him. John Russell attempts a Dunk. Contested by Collin Young (4.8 feet, MAN). JOHN RUSSELL MAKES IT!
Score: 4-7

[09:12] Team_037 possession (Score: 4-7)
RJ Mitchell attempts a 3Pt. Contested by Tim Johnson (5.1 feet, ZONE). RJ MITCHELL MAKES IT! Assist: Giannis Middleton
Score: 7-7

[08:54] Team_027 possession (Score: 7-7)
Bradley Dosunmu drives and kicks out. John Russell attempts a 3Pt. Contested by Scottie Jackson (3.6 feet, ZONE). John Russell misses. Rebound secured by Scottie Jackson.

[08:38] Team_037 possession (Score: 7-7)
Giannis Middleton attempts a 3Pt. Contested by Tony Doncic (4.3 feet, ZONE). Giannis Middleton misses. Rebound secured by Bradley Dosunmu.

[08:26] Team_027 possession (Score: 7-7)
FOUL! Holding foul on Collin Young. [Team fouls: 4] No free throws, side out. (Collin Young: 1 personal fouls)

[08:12] Team_027 possession (Score: 7-7)
Tim Johnson attempts a 3Pt. Contested by Scottie Jackson (3.9 feet, ZONE). Tim Johnson misses. Rebound secured by Collin Young.

[07:59] Team_037 possession (Score: 7-7)
RJ Mitchell attempts a 3Pt. Contested by Tim Johnson (5.1 feet, MAN). RJ MITCHELL MAKES IT! Assist: Collin Young
Score: 10-7

[07:45] Team_027 possession (Score: 10-7)
Bradley Dosunmu loses the ball! Stripped by Scottie Jackson! TURNOVER! (live ball)

[07:33] Team_037 possession (Score: 10-7)
Scottie Jackson attempts a 3Pt. Contested by Tim Johnson (5.4 feet, ZONE). Scottie Jackson misses. Rebound secured by John Russell.

[07:16] Team_027 possession (Score: 10-7)
Tim Johnson drives, picks up RJ Mitchell. Help arrives from Giannis Middleton! Tim Johnson attempts a Dunk. Contested by Giannis Middleton (4.9 feet, MAN). Tim Johnson misses. Rebound secured by Jarrett Tatum.

[07:02] Team_037 possession (Score: 10-7)
RJ Mitchell attempts a Midrange. Contested by Scottie Harden (4.7 feet, ZONE). RJ MITCHELL MAKES IT!
Score: 12-7

[06:45] Team_027 possession (Score: 12-7)
Tony Doncic attempts a 3Pt. Contested by Scottie Jackson (3.7 feet, ZONE). Tony Doncic misses. Rebound secured by Collin Young.

[06:29] Team_037 possession (Score: 12-7)
Scottie Jackson attempts a 3Pt. Contested by Tim Johnson (5.4 feet, ZONE). Scottie Jackson misses. Offensive rebound by Collin Young! Collin Young's putback is no good. Rebound secured by Bradley Dosunmu.

[06:10] Team_027 possession (Score: 12-7)
Tim Johnson attempts a Layup. Contested by Scottie Jackson (3.9 feet, ZONE). TIM JOHNSON MAKES IT! Assist: John Russell
Score: 12-9

[05:55] Team_037 possession (Score: 12-9)
Giannis Middleton drives, picks up Tony Doncic. Help arrives from Scottie Harden! Giannis Middleton attempts a Dunk. Contested by Scottie Harden (4.3 feet, MAN). GIANNIS MIDDLETON MAKES IT! Assist: Collin Young
Score: 14-9

[05:43] Team_027 possession (Score: 14-9)
Tim Johnson attempts a Layup. Contested by RJ Mitchell (4.9 feet, MAN). TIM JOHNSON MAKES IT! Assist: Bradley Dosunmu
Score: 14-11

[05:31] Team_037 possession (Score: 14-11)
Giannis Middleton attempts a Midrange. Contested by Tony Doncic (4.3 feet, MAN). GIANNIS MIDDLETON MAKES IT!
Score: 16-11

[05:16] Team_027 possession (Score: 16-11)
Scottie Harden attempts a 3Pt. Contested by Scottie Jackson (3.6 feet, ZONE). SCOTTIE HARDEN MAKES IT!
Score: 16-14

[05:00] Team_037 possession (Score: 16-14)
Giannis Middleton drives to the basket... Giannis Middleton throws a bad pass! Stolen by Tony Doncic! TURNOVER! (live ball)

[04:44] Team_027 possession (Score: 16-14)
FOUL! Reach-in foul on Collin Young during the drive. [IN THE BONUS! 5 team fouls] John Russell to the line for 2 free throws. (Collin Young: 2 personal fouls)   FT 1/2: MISS   FT 2/2: GOOD John Russell makes 1/2 from the line.
Score: 16-15

[04:34] Team_037 possession (Score: 16-15)
Collin Young drives and kicks out. Scottie Jackson attempts a 3Pt. Contested by Bradley Dosunmu (4.4 feet, MAN). Scottie Jackson misses. Rebound secured by John Russell.

[04:18] Team_027 possession (Score: 16-15)
Tony Doncic attempts a Midrange. Contested by Scottie Jackson (3.8 feet, ZONE). Tony Doncic misses. Rebound secured by Scottie Jackson.

[04:03] Team_037 possession (Score: 16-15)
FOUL! Shooting foul on Scottie Harden. Jarrett Tatum to the line for 2 free throws. [Team fouls: 2] (Scottie Harden: 1 personal fouls)   FT 1/2: GOOD   FT 2/2: GOOD Jarrett Tatum makes 2/2 from the line.
Score: 18-15

[03:50] Team_027 possession (Score: 18-15)
Tony Doncic attempts a 3Pt. Contested by Scottie Jackson (3.8 feet, ZONE). TONY DONCIC MAKES IT!
Score: 18-18

[03:38] Team_037 possession (Score: 18-18)
Giannis Middleton attempts a 3Pt. Contested by Tony Doncic (4.4 feet, MAN). Giannis Middleton misses. Rebound secured by John Russell.

[03:23] Team_027 possession (Score: 18-18)
Tony Doncic attempts a 3Pt. Contested by Scottie Jackson (3.8 feet, ZONE). Tony Doncic misses. Rebound secured by Scottie Jackson.

[03:06] Team_037 possession (Score: 18-18)
RJ Mitchell attempts a Midrange. Contested by Bradley Dosunmu (4.8 feet, ZONE). RJ Mitchell misses. Rebound secured by Tony Doncic.

[02:52] Team_027 possession (Score: 18-18)
FOUL! Shooting foul on Collin Young. John Russell to the line for 2 free throws. [BONUS: 6 team fouls] (Collin Young: 3 personal fouls)   FT 1/2: GOOD   FT 2/2: GOOD John Russell makes 2/2 from the line.
Score: 18-20

[02:35] Team_037 possession (Score: 18-20)
RJ Mitchell attempts a 3Pt. Contested by Tim Johnson (5.3 feet, ZONE). RJ MITCHELL MAKES IT! Assist: Jarrett Tatum
Score: 21-20

[02:19] Team_027 possession (Score: 21-20)
Scottie Harden throws a bad pass! Stolen by Jarrett Tatum! TURNOVER! (live ball)

[02:03] Team_037 possession (Score: 21-20)
Collin Young loses the ball! Stripped by John Russell! TURNOVER! (live ball)

[01:49] Team_027 possession (Score: 21-20)
John Russell drives, picks up Collin Young. Help arrives from Giannis Middleton! John Russell attempts a Dunk. Contested by Giannis Middleton (5.1 feet, MAN). JOHN RUSSELL MAKES IT! Assist: Tony Doncic
Score: 21-22

[01:32] Team_037 possession (Score: 21-22)
RJ Mitchell attempts a Midrange. Contested by Tim Johnson (5.4 feet, MAN). RJ Mitchell misses. Rebound secured by Bradley Dosunmu.

[01:15] Team_027 possession (Score: 21-22)
John Russell drives, picks up Scottie Jackson. Help arrives from Giannis Middleton! John Russell attempts a Layup. Contested by Giannis Middleton (4.6 feet, ZONE). JOHN RUSSELL MAKES IT! Assist: Bradley Dosunmu
Score: 21-24

[01:03] Team_037 possession (Score: 21-24)
Giannis Middleton attempts a 3Pt. Contested by Tony Doncic (4.6 feet, MAN). Giannis Middleton misses. Offensive rebound by Scottie Jackson! Scottie Jackson puts it back in!
Score: 23-24

[00:50] Team_027 possession (Score: 23-24)
John Russell attempts a Midrange. Contested by Collin Young (5.2 feet, ZONE). JOHN RUSSELL MAKES IT!
Score: 23-26

[00:34] Team_037 possession (Score: 23-26)
RJ Mitchell attempts a 3Pt. Contested by Tim Johnson (5.5 feet, MAN). RJ Mitchell misses. Offensive rebound by Collin Young! Collin Young puts it back in!
Score: 25-26

[00:15] Team_027 possession (Score: 25-26)
Scottie Harden attempts a 3Pt. Contested by Jarrett Tatum (4.5 feet, MAN). Scottie Harden misses. FOUL! Loose ball foul on Jarrett Tatum during the rebound battle. [IN THE BONUS! 7 team fouls] Bradley Dosunmu to the line for 2 free throws. (Jarrett Tatum: 2 personal fouls)   FT 1/2: MISS   FT 2/2: GOOD Bradley Dosunmu makes 1/2 from the line.
Score: 25-27

================================================================================
                              1ST QUARTER COMPLETE                              
================================================================================

1ST QUARTER SCORE: Team_037 25, Team_027 27

BOX SCORE:
================================================================================

Team_037
--------------------------------------------------------------------------------
Player                MIN  PTS  REB  AST  TO      FG   FG%      3P   3P%
--------------------------------------------------------------------------------
RJ Mitchell            12   11    0    0   0   4/6    66.7     0/0   0.0
Collin Young           12    6    5    2   0   3/4    75.0     0/0   0.0
Giannis Middleton      12    4    0    1   0   2/4    50.0     0/0   0.0
Scottie Jackson        12    2    4    0   0   1/5    20.0     0/0   0.0
Jarrett Tatum          12    2    1    1   0   1/1   100.0     0/0   0.0

TEAM: FG: 11/20 (55.0%), 3PT: 6/11 (54.5%), REB: 11 (4 off, 7 def), AST: 4, TO: 3
TEAM FOULS: 7 [Team_027 in BONUS]


Team_027
--------------------------------------------------------------------------------
Player                MIN  PTS  REB  AST  TO      FG   FG%      3P   3P%
--------------------------------------------------------------------------------
John Russell           12   11    4    2   0   6/6   100.0     0/0   0.0
Tony Doncic            12    5    2    1   0   2/6    33.3     0/0   0.0
Bradley Dosunmu        12    4    5    2   0   2/3    66.7     0/0   0.0
Tim Johnson            12    4    0    0   0   2/4    50.0     0/0   0.0
Scottie Harden         12    3    0    0   0   1/1   100.0     0/0   0.0

TEAM: FG: 13/20 (65.0%), 3PT: 4/8 (50.0%), REB: 10 (2 off, 8 def), AST: 5, TO: 3
TEAM FOULS: 2

================================================================================

================================================================================
                       2ND QUARTER - Team_037 vs Team_027                       
================================================================================

[12:00] Team_037 possession (Score: 25-27)
FOUL! Reach-in foul on John Russell during the drive. [Team fouls: 1] No free throws, side out. (John Russell: 1 personal fouls)

[11:43] Team_037 possession (Score: 25-27)
RJ Mitchell drives to the basket... RJ Mitchell loses control! Ball rolls out of bounds! TURNOVER! (dead ball)

[11:43] Substitution (Team_037): RJ Mitchell OUT → Jarrett Randle IN (stamina_rule2)

[11:43] Substitution (Team_037): Jarrett Tatum OUT → Julius Bird IN (stamina_rule2)

[11:43] Substitution (Team_037): Collin Young OUT → Wendell Herro IN (stamina_rule2)

[11:43] Substitution (Team_027): Tim Johnson OUT → CJ Green IN (stamina_rule2)

[11:43] Substitution (Team_027): Scottie Harden OUT → Rudy Quickley IN (stamina_rule2)

[11:43] Substitution (Team_027): Bradley Dosunmu OUT → LeBron Russell IN (stamina_rule2)

[11:43] Substitution (Team_027): John Russell OUT → Ben Stewart IN (stamina_rule2)

[11:29] Team_027 possession (Score: 25-27)
LeBron Russell drives to the basket... LeBron Russell throws a bad pass! Stolen by Scottie Jackson! TURNOVER! (live ball)

[11:17] Team_037 possession (Score: 25-27)
Jarrett Randle attempts a 3Pt. Contested by CJ Green (5.2 feet, MAN). Jarrett Randle misses. Rebound secured by Ben Stewart.

[10:58] Team_027 possession (Score: 25-27)
CJ Green attempts a Layup. BLOCKED BY JARRETT RANDLE! Ball goes out off Jarrett Randle. CJ Green's ball!

[10:47] Team_027 possession (Score: 25-27)
Tony Doncic attempts a 3Pt. Contested by Jarrett Randle (3.9 feet, ZONE). Tony Doncic misses. FOUL! Loose ball foul on Scottie Jackson during the rebound battle. [Team fouls: 1] No free throws, side out. (Scottie Jackson: 1 personal fouls)

[10:34] Team_027 possession (Score: 25-27)
Rudy Quickley drives and kicks out. Tony Doncic attempts a Midrange. Contested by Giannis Middleton (4.4 feet, MAN). Tony Doncic misses. Rebound secured by Wendell Herro.

[10:17] Team_037 possession (Score: 25-27)
Wendell Herro drives to the basket... Wendell Herro throws a bad pass out of bounds! TURNOVER! (dead ball)

[10:17] Substitution (Team_037): Giannis Middleton OUT → Collin Trent IN (stamina_rule2)

[10:17] Substitution (Team_037): Scottie Jackson OUT → Russell Anthony IN (stamina_rule2)

[10:17] Substitution (Team_027): Tony Doncic OUT → Dirk Lillard IN (stamina_rule2)

[10:04] Team_027 possession (Score: 25-27)
LeBron Russell attempts a Midrange. Contested by Russell Anthony (3.8 feet, MAN). LeBron Russell misses. Rebound secured by Julius Bird.

[09:49] Team_037 possession (Score: 25-27)
Julius Bird attempts a 3Pt. Contested by Rudy Quickley (3.7 feet, ZONE). Julius Bird misses. Rebound secured by Ben Stewart.

[09:38] Team_027 possession (Score: 25-27)
Rudy Quickley attempts a Midrange. Contested by Julius Bird (4.9 feet, ZONE). Rudy Quickley misses. Rebound secured by Julius Bird.

[09:27] Team_037 possession (Score: 25-27)
FOUL! Holding foul on Rudy Quickley. [Team fouls: 2] No free throws, side out. (Rudy Quickley: 1 personal fouls)

[09:15] Team_037 possession (Score: 25-27)
Julius Bird attempts a 3Pt. Contested by Rudy Quickley (3.7 feet, MAN). Julius Bird misses. Offensive rebound by Julius Bird! Julius Bird kicks it out.

[09:01] Team_037 possession (Score: 25-27)
FOUL! Shooting foul on Rudy Quickley. Julius Bird to the line for 3 free throws. [Team fouls: 3] (Rudy Quickley: 2 personal fouls)   FT 1/3: GOOD   FT 2/3: GOOD   FT 3/3: GOOD Julius Bird makes 3/3 from the line.
Score: 28-27

[08:46] Team_027 possession (Score: 28-27)
CJ Green attempts a 3Pt. Contested by Jarrett Randle (4.0 feet, MAN). CJ Green misses. Offensive rebound by Ben Stewart! Ben Stewart puts it back in!
Score: 28-29

[08:33] Team_037 possession (Score: 28-29)
Jarrett Randle attempts a 3Pt. Contested by Rudy Quickley (3.5 feet, ZONE). JARRETT RANDLE MAKES IT! Assist: Russell Anthony
Score: 31-29

[08:18] Team_027 possession (Score: 31-29)
Dirk Lillard makes the Layup and draws the foul on Russell Anthony! And-1! Dirk Lillard to the line for 1. [Team fouls: 2] (Russell Anthony: 1 personal fouls)   FT 1/1: GOOD Dirk Lillard makes 1/1 from the line.
Score: 31-32

[08:02] Team_037 possession (Score: 31-32)
Jarrett Randle drives to the basket... Jarrett Randle throws a bad pass out of bounds! TURNOVER! (dead ball)

[07:47] Team_027 possession (Score: 31-32)
Dirk Lillard attempts a 3Pt. Contested by Collin Trent (5.7 feet, MAN). Dirk Lillard misses. Rebound secured by Russell Anthony.

[07:32] Team_037 possession (Score: 31-32)
Collin Trent attempts a Midrange. Contested by Rudy Quickley (3.7 feet, ZONE). Collin Trent misses. Rebound secured by Ben Stewart.

[07:22] Team_027 possession (Score: 31-32)
Rudy Quickley loses control! Ball rolls out of bounds! TURNOVER! (dead ball)

[07:09] Team_037 possession (Score: 31-32)
Wendell Herro attempts a Layup. Contested by Ben Stewart (5.0 feet, MAN). Wendell Herro misses. Offensive rebound by Julius Bird! Julius Bird kicks it out.

[06:51] Team_037 possession (Score: 31-32)
Jarrett Randle attempts a 3Pt. Contested by CJ Green (5.2 feet, MAN). Jarrett Randle misses. Rebound secured by LeBron Russell.

[06:37] Team_027 possession (Score: 31-32)
Dirk Lillard attempts a 3Pt. Contested by Jarrett Randle (3.9 feet, ZONE). DIRK LILLARD MAKES IT! Assist: LeBron Russell
Score: 31-35

[06:21] Team_037 possession (Score: 31-35)
Collin Trent attempts a Midrange. Contested by Dirk Lillard (4.5 feet, MAN). Collin Trent misses. Rebound secured by Ben Stewart.

[06:09] Team_027 possession (Score: 31-35)
Dirk Lillard attempts a Midrange. Contested by Jarrett Randle (3.9 feet, ZONE). DIRK LILLARD MAKES IT!
Score: 31-37

[05:53] Team_037 possession (Score: 31-37)
Collin Trent attempts a 3Pt. Contested by Rudy Quickley (3.7 feet, ZONE). Collin Trent misses. Rebound secured by Dirk Lillard.

[05:43] Team_027 possession (Score: 31-37)
Dirk Lillard drives and kicks out. Dirk Lillard attempts a 3Pt. Contested by Collin Trent (5.7 feet, MAN). Dirk Lillard misses. Rebound secured by Russell Anthony.

[05:29] Team_037 possession (Score: 31-37)
Collin Trent attempts a Midrange. Contested by LeBron Russell (5.8 feet, ZONE). COLLIN TRENT MAKES IT! Assist: Jarrett Randle
Score: 33-37

[05:17] Team_027 possession (Score: 33-37)
FOUL! Shooting foul on Russell Anthony. CJ Green to the line for 2 free throws. [Team fouls: 3] (Russell Anthony: 2 personal fouls)   FT 1/2: GOOD   FT 2/2: GOOD CJ Green makes 2/2 from the line.
Score: 33-39

[05:00] Team_037 possession (Score: 33-39)
Wendell Herro attempts a Midrange. Contested by Ben Stewart (5.0 feet, MAN). Wendell Herro misses. Rebound secured by Dirk Lillard.

[04:45] Team_027 possession (Score: 33-39)
Ben Stewart drives and kicks out. Ben Stewart attempts a Midrange. Contested by Russell Anthony (3.8 feet, MAN). Ben Stewart misses. Rebound secured by Julius Bird.

[04:29] Team_037 possession (Score: 33-39)
Russell Anthony drives and kicks out. Julius Bird attempts a Midrange. Contested by CJ Green (5.1 feet, ZONE). JULIUS BIRD MAKES IT! Assist: Jarrett Randle
Score: 35-39

[04:16] Team_027 possession (Score: 35-39)
CJ Green attempts a 3Pt. Contested by Jarrett Randle (4.0 feet, ZONE). CJ Green misses. Rebound secured by Wendell Herro.

[04:05] Team_037 possession (Score: 35-39)
Russell Anthony loses the ball! Stripped by LeBron Russell! TURNOVER! (live ball)

[03:50] Team_027 possession (Score: 35-39)
Rudy Quickley attempts a 3Pt. Contested by Julius Bird (5.0 feet, MAN). Rudy Quickley misses. Offensive rebound by Ben Stewart! Ben Stewart puts it back in!
Score: 35-41

[03:36] Team_037 possession (Score: 35-41)
Wendell Herro attempts a Layup. BLOCKED BY BEN STEWART! Ball is loose! Rebound secured by Ben Stewart.

[03:21] Team_027 possession (Score: 35-41)
FOUL! Offensive foul on LeBron Russell! Russell Anthony drew the charge! [Team fouls: 4] (LeBron Russell: 1 personal fouls) TURNOVER! (dead ball)

[03:07] Team_037 possession (Score: 35-41)
Julius Bird attempts a 3Pt. Contested by Rudy Quickley (3.9 feet, MAN). Julius Bird misses. Offensive rebound by Russell Anthony! Russell Anthony puts it back in!
Score: 37-41

[02:52] Team_027 possession (Score: 37-41)
Ben Stewart drives, Russell Anthony stays with him. Ben Stewart attempts a Dunk. Contested by Russell Anthony (3.7 feet, ZONE). BEN STEWART MAKES IT! Assist: CJ Green
Score: 37-43

[02:40] Team_037 possession (Score: 37-43)
Wendell Herro attempts a Midrange. Contested by Ben Stewart (5.2 feet, MAN). Wendell Herro misses. Rebound secured by LeBron Russell.

[02:26] Team_027 possession (Score: 37-43)
LeBron Russell attempts a 3Pt. Contested by Russell Anthony (3.9 feet, MAN). LeBron Russell misses. Offensive rebound by Ben Stewart! Ben Stewart puts it back in!
Score: 37-45

[02:15] Team_037 possession (Score: 37-45)
Julius Bird drives, picks up Rudy Quickley. Help arrives from Dirk Lillard! Julius Bird attempts a Layup. Contested by Dirk Lillard (4.0 feet, MAN). Julius Bird misses. Rebound secured by Ben Stewart.

[02:00] Team_027 possession (Score: 37-45)
CJ Green drives to the basket... CJ Green throws a bad pass out of bounds! TURNOVER! (dead ball)

[01:46] Team_037 possession (Score: 37-45)
FOUL! Holding foul on Dirk Lillard. [IN THE BONUS! 5 team fouls] Collin Trent to the line for 2 free throws. (Dirk Lillard: 1 personal fouls)   FT 1/2: GOOD   FT 2/2: MISS Collin Trent makes 1/2 from the line. Rebound secured by Dirk Lillard.
Score: 38-45

[01:27] Team_027 possession (Score: 38-45)
Dirk Lillard attempts a Midrange. Contested by Collin Trent (5.9 feet, MAN). Dirk Lillard misses. Offensive rebound by Ben Stewart! Ben Stewart puts it back in!
Score: 38-47

[01:14] Team_037 possession (Score: 38-47)
Jarrett Randle attempts a 3Pt. Contested by CJ Green (5.6 feet, MAN). Jarrett Randle misses. Rebound secured by Dirk Lillard.

[00:56] Team_027 possession (Score: 38-47)
Dirk Lillard drives and kicks out. Rudy Quickley attempts a Midrange. Contested by Julius Bird (4.8 feet, MAN). Rudy Quickley misses. FOUL! Loose ball foul on Wendell Herro during the rebound battle. [Team fouls: 4] No free throws, side out. (Wendell Herro: 1 personal fouls)

[00:42] Team_027 possession (Score: 38-47)
Dirk Lillard loses control! Ball rolls out of bounds! TURNOVER! (dead ball)

[00:24] Team_037 possession (Score: 38-47)
Russell Anthony attempts a 3Pt. Contested by Rudy Quickley (4.2 feet, ZONE). Russell Anthony misses. Rebound secured by Ben Stewart.

[00:09] Team_027 possession (Score: 38-47)
Rudy Quickley attempts a Midrange. Contested by Julius Bird (5.3 feet, MAN). RUDY QUICKLEY MAKES IT!
Score: 38-49

================================================================================
                              2ND QUARTER COMPLETE                              
================================================================================

2ND QUARTER SCORE: Team_037 13, Team_027 22

BOX SCORE:
================================================================================

Team_037
--------------------------------------------------------------------------------
Player                MIN  PTS  REB  AST  TO      FG   FG%      3P   3P%
--------------------------------------------------------------------------------
Julius Bird            12    5    5    0   0   2/4    50.0     0/0   0.0
Jarrett Randle         12    3    0    2   0   1/4    25.0     0/0   0.0
Russell Anthony        10    2    3    1   0   1/2    50.0     0/0   0.0
Collin Trent           10    2    0    0   0   1/4    25.0     0/0   0.0
Wendell Herro          12    0    2    0   0   0/3     0.0     0/0   0.0

TEAM: FG: 5/18 (27.8%), 3PT: 3/9 (33.3%), REB: 10 (3 off, 7 def), AST: 3, TO: 4
TEAM FOULS: 4


Team_027
--------------------------------------------------------------------------------
Player                MIN  PTS  REB  AST  TO      FG   FG%      3P   3P%
--------------------------------------------------------------------------------
Ben Stewart            12   10   12    0   0   5/6    83.3     0/0   0.0
Dirk Lillard           10    8    4    0   0   3/5    60.0     0/0   0.0
Rudy Quickley          12    2    0    0   0   1/3    33.3     0/0   0.0
CJ Green               12    2    0    1   0   1/2    50.0     0/0   0.0
LeBron Russell         12    0    3    1   0   0/1     0.0     0/0   0.0

TEAM: FG: 10/17 (58.8%), 3PT: 4/6 (66.7%), REB: 19 (6 off, 13 def), AST: 2, TO: 5
TEAM FOULS: 5 [Team_037 in BONUS]

================================================================================

================================================================================
                       3RD QUARTER - Team_037 vs Team_027                       
================================================================================

[12:00] Team_037 possession (Score: 38-49)
Giannis Middleton attempts a Midrange. Contested by Tony Doncic (4.3 feet, ZONE). Giannis Middleton misses. Rebound secured by Tony Doncic.

[11:47] Team_027 possession (Score: 38-49)
John Russell makes the Dunk and draws the foul on Collin Young! And-1! John Russell to the line for 1. [Team fouls: 1] (Collin Young: 1 personal fouls)   FT 1/1: MISS John Russell makes 0/1 from the line. Rebound secured by Jarrett Tatum.
Score: 38-51

[11:31] Team_037 possession (Score: 38-51)
Giannis Middleton attempts a 3Pt. Contested by Tim Johnson (5.3 feet, ZONE). Giannis Middleton misses. Offensive rebound by Collin Young! Collin Young's putback is no good. Rebound secured by Tony Doncic.

[11:18] Team_027 possession (Score: 38-51)
Scottie Harden drives to the basket... FOUL! Offensive foul on Scottie Harden! Jarrett Tatum drew the charge! [Team fouls: 1] (Scottie Harden: 1 personal fouls) TURNOVER! (dead ball)

[11:03] Team_037 possession (Score: 38-51)
Jarrett Tatum drives, Scottie Harden stays with him. Jarrett Tatum attempts a Dunk. Contested by Scottie Harden (4.7 feet, MAN). Jarrett Tatum misses. Rebound secured by Bradley Dosunmu.

[10:48] Team_027 possession (Score: 38-51)
John Russell attempts a Midrange. Contested by Scottie Jackson (4.4 feet, ZONE). John Russell misses. Offensive rebound by John Russell! John Russell puts it back in!
Score: 38-53

[10:30] Team_037 possession (Score: 38-53)
Scottie Jackson drives, Bradley Dosunmu stays with him. Scottie Jackson attempts a Dunk. Contested by Bradley Dosunmu (4.9 feet, MAN). Scottie Jackson misses. Offensive rebound by Collin Young! Collin Young's putback is no good. Rebound secured by John Russell.

[10:18] Team_027 possession (Score: 38-53)
Bradley Dosunmu drives, Collin Young stays with him. Bradley Dosunmu attempts a Dunk. Contested by Collin Young (4.1 feet, ZONE). Bradley Dosunmu misses. Rebound secured by Jarrett Tatum.

[10:03] Team_037 possession (Score: 38-53)
RJ Mitchell attempts a 3Pt. Contested by Tim Johnson (5.1 feet, ZONE). RJ Mitchell misses. Offensive rebound by Collin Young! Collin Young's putback is no good. Rebound secured by Tony Doncic.

[09:47] Team_027 possession (Score: 38-53)
Tim Johnson drives, Scottie Jackson stays with him. Tim Johnson attempts a Layup. Contested by Scottie Jackson (3.9 feet, ZONE). Tim Johnson misses. Offensive rebound by John Russell! John Russell's putback is no good. Offensive rebound by Bradley Dosunmu! Bradley Dosunmu kicks it out.

[09:30] Team_027 possession (Score: 38-53)
Scottie Harden drives to the basket... Scottie Harden loses control! Ball rolls out of bounds! TURNOVER! (dead ball)

[09:13] Team_037 possession (Score: 38-53)
FOUL! Shooting foul on Scottie Harden. Jarrett Tatum to the line for 2 free throws. [Team fouls: 2] (Scottie Harden: 2 personal fouls)   FT 1/2: GOOD   FT 2/2: GOOD Jarrett Tatum makes 2/2 from the line.
Score: 40-53

[09:02] Team_027 possession (Score: 40-53)
Bradley Dosunmu drives to the basket... Bradley Dosunmu loses control! Ball rolls out of bounds! TURNOVER! (dead ball)

[08:48] Team_037 possession (Score: 40-53)
FOUL! Offensive foul on Collin Young! John Russell drew the charge! [Team fouls: 2] (Collin Young: 2 personal fouls) TURNOVER! (dead ball)

[08:33] Team_027 possession (Score: 40-53)
Scottie Harden drives and kicks out. Tim Johnson attempts a Midrange. Contested by Scottie Jackson (3.6 feet, ZONE). Tim Johnson misses. Rebound secured by Scottie Jackson.

[08:17] Team_037 possession (Score: 40-53)
Giannis Middleton attempts a 3Pt. Contested by Tony Doncic (4.3 feet, MAN). Giannis Middleton misses. Rebound secured by Bradley Dosunmu.

[08:02] Team_027 possession (Score: 40-53)
Tim Johnson attempts a 3Pt. Contested by Giannis Middleton (4.3 feet, ZONE). Tim Johnson misses. Rebound secured by Scottie Jackson.

[07:47] Team_037 possession (Score: 40-53)
RJ Mitchell makes the Layup and draws the foul on Tim Johnson! And-1! RJ Mitchell to the line for 1. [Team fouls: 3] (Tim Johnson: 1 personal fouls)   FT 1/1: GOOD RJ Mitchell makes 1/1 from the line.
Score: 43-53

[07:32] Team_027 possession (Score: 43-53)
Bradley Dosunmu drives, Scottie Jackson stays with him. Bradley Dosunmu attempts a Dunk. Contested by Scottie Jackson (3.7 feet, ZONE). Bradley Dosunmu misses. Rebound secured by Jarrett Tatum.

[07:20] Team_037 possession (Score: 43-53)
Jarrett Tatum commits a violation (traveling/carry)! TURNOVER! (dead ball)

[07:03] Team_027 possession (Score: 43-53)
Tony Doncic attempts a 3Pt. Contested by Scottie Jackson (3.7 feet, ZONE). Tony Doncic misses. Rebound secured by Collin Young.

[06:54] Team_037 possession (Score: 43-53)
FOUL! Shooting foul on Tim Johnson. RJ Mitchell to the line for 3 free throws. [Team fouls: 4] (Tim Johnson: 2 personal fouls)   FT 1/3: MISS   FT 2/3: GOOD   FT 3/3: GOOD RJ Mitchell makes 2/3 from the line.
Score: 45-53

[06:38] Team_027 possession (Score: 45-53)
Bradley Dosunmu attempts a Layup. Contested by Scottie Jackson (3.7 feet, ZONE). BRADLEY DOSUNMU MAKES IT!
Score: 45-55

[06:23] Team_037 possession (Score: 45-55)
Collin Young makes the Dunk and draws the foul on John Russell! And-1! Collin Young to the line for 1. [BONUS: 5 team fouls] (John Russell: 1 personal fouls)   FT 1/1: GOOD Collin Young makes 1/1 from the line.
Score: 48-55

[06:11] Team_027 possession (Score: 48-55)
Bradley Dosunmu attempts a Midrange. Contested by Scottie Jackson (3.7 feet, MAN). Bradley Dosunmu misses. Rebound secured by Jarrett Tatum.

[05:54] Team_037 possession (Score: 48-55)
Jarrett Tatum drives to the basket... FOUL! Offensive foul on Jarrett Tatum! Scottie Harden drew the charge! [Team fouls: 3] (Jarrett Tatum: 1 personal fouls) TURNOVER! (dead ball)

[05:40] Team_027 possession (Score: 48-55)
John Russell drives and kicks out. Bradley Dosunmu attempts a Midrange. Contested by Giannis Middleton (4.0 feet, ZONE). Bradley Dosunmu misses. FOUL! Loose ball foul on Jarrett Tatum during the rebound battle. [Team fouls: 4] No free throws, side out. (Jarrett Tatum: 2 personal fouls)

[05:27] Team_027 possession (Score: 48-55)
Bradley Dosunmu attempts a 3Pt. Contested by Scottie Jackson (3.7 feet, MAN). Bradley Dosunmu misses. Rebound secured by Jarrett Tatum.

[05:12] Team_037 possession (Score: 48-55)
RJ Mitchell attempts a Layup. Contested by Tim Johnson (5.1 feet, MAN). RJ MITCHELL MAKES IT! Assist: Collin Young
Score: 50-55

[04:55] Team_027 possession (Score: 50-55)
Tim Johnson attempts a 3Pt. Contested by RJ Mitchell (4.9 feet, MAN). Tim Johnson misses. Rebound secured by Jarrett Tatum.

[04:40] Team_037 possession (Score: 50-55)
FOUL! Shooting foul on John Russell. Collin Young to the line for 2 free throws. [BONUS: 6 team fouls] (John Russell: 2 personal fouls)   FT 1/2: MISS   FT 2/2: GOOD Collin Young makes 1/2 from the line.
Score: 51-55

[04:24] Team_027 possession (Score: 51-55)
FOUL! Shooting foul on Jarrett Tatum. Scottie Harden to the line for 2 free throws. [BONUS: 5 team fouls] (Jarrett Tatum: 3 personal fouls)   FT 1/2: MISS   FT 2/2: MISS Scottie Harden makes 0/2 from the line. Rebound secured by Collin Young.

[04:13] Team_037 possession (Score: 51-55)
FOUL! Shooting foul on Tim Johnson. RJ Mitchell to the line for 3 free throws. [BONUS: 7 team fouls] (Tim Johnson: 3 personal fouls)   FT 1/3: GOOD   FT 2/3: GOOD   FT 3/3: GOOD RJ Mitchell makes 3/3 from the line.
Score: 54-55

[03:56] Team_027 possession (Score: 54-55)
Bradley Dosunmu attempts a Layup. Contested by Scottie Jackson (3.7 feet, MAN). BRADLEY DOSUNMU MAKES IT!
Score: 54-57

[03:44] Team_037 possession (Score: 54-57)
Scottie Jackson attempts a Layup. Contested by John Russell (4.6 feet, ZONE). SCOTTIE JACKSON MAKES IT! Assist: Giannis Middleton
Score: 56-57

[03:30] Team_027 possession (Score: 56-57)
Tim Johnson attempts a 3Pt. Contested by RJ Mitchell (5.0 feet, MAN). Tim Johnson misses. Rebound secured by Jarrett Tatum.

[03:15] Team_037 possession (Score: 56-57)
Scottie Jackson attempts a Midrange. Contested by Bradley Dosunmu (5.1 feet, MAN). Scottie Jackson misses. Rebound secured by John Russell.

[03:00] Team_027 possession (Score: 56-57)
Scottie Harden attempts a Midrange. Contested by Jarrett Tatum (4.2 feet, ZONE). SCOTTIE HARDEN MAKES IT!
Score: 56-59

[02:47] Team_037 possession (Score: 56-59)
RJ Mitchell attempts a Midrange. Contested by Tim Johnson (5.3 feet, MAN). RJ Mitchell misses. Rebound secured by Tony Doncic.

[02:32] Team_027 possession (Score: 56-59)
Bradley Dosunmu attempts a 3Pt. Contested by Scottie Jackson (3.9 feet, ZONE). Bradley Dosunmu misses. Rebound secured by Scottie Jackson.

[02:19] Team_037 possession (Score: 56-59)
Giannis Middleton attempts a 3Pt. Contested by Tim Johnson (5.5 feet, ZONE). GIANNIS MIDDLETON MAKES IT! Assist: RJ Mitchell
Score: 59-59

[02:10] Team_027 possession (Score: 59-59)
John Russell drives, Scottie Jackson stays with him. John Russell attempts a Dunk. Contested by Scottie Jackson (4.6 feet, ZONE). JOHN RUSSELL MAKES IT! Assist: Tony Doncic
Score: 59-61

[01:57] Team_037 possession (Score: 59-61)
FOUL! Reach-in foul on John Russell during the drive. [IN THE BONUS! 8 team fouls] Scottie Jackson to the line for 2 free throws. (John Russell: 3 personal fouls)   FT 1/2: GOOD   FT 2/2: MISS Scottie Jackson makes 1/2 from the line. Rebound secured by Bradley Dosunmu.
Score: 60-61

[01:42] Team_027 possession (Score: 60-61)
Tim Johnson attempts a 3Pt. Contested by Scottie Jackson (4.1 feet, ZONE). Tim Johnson misses. Rebound secured by Collin Young.

[01:30] Team_037 possession (Score: 60-61)
Giannis Middleton makes the Midrange and draws the foul on Tony Doncic! And-1! Giannis Middleton to the line for 1. [BONUS: 9 team fouls] (Tony Doncic: 1 personal fouls)   FT 1/1: GOOD Giannis Middleton makes 1/1 from the line.
Score: 63-61

[01:12] Team_027 possession (Score: 63-61)
Tony Doncic attempts a Midrange. Contested by Collin Young (4.6 feet, ZONE). TONY DONCIC MAKES IT! Assist: John Russell
Score: 63-63

[00:56] Team_037 possession (Score: 63-63)
Giannis Middleton drives and kicks out. Scottie Jackson attempts a 3Pt. Contested by Tim Johnson (5.4 feet, ZONE). Scottie Jackson misses. Rebound secured by John Russell.

[00:45] Team_027 possession (Score: 63-63)
Bradley Dosunmu makes the Layup and draws the foul on Scottie Jackson! And-1! Bradley Dosunmu to the line for 1. [BONUS: 6 team fouls] (Scottie Jackson: 1 personal fouls)   FT 1/1: GOOD Bradley Dosunmu makes 1/1 from the line.
Score: 63-66

[00:27] Team_037 possession (Score: 63-66)
Jarrett Tatum makes the Dunk and draws the foul on Tony Doncic! And-1! Jarrett Tatum to the line for 1. [BONUS: 10 team fouls] (Tony Doncic: 2 personal fouls)   FT 1/1: GOOD Jarrett Tatum makes 1/1 from the line.
Score: 66-66

[00:17] Team_027 possession (Score: 66-66)
Bradley Dosunmu attempts a Midrange. Contested by Scottie Jackson (4.1 feet, MAN). Bradley Dosunmu misses. Rebound secured by Collin Young.

[00:04] Team_037 possession (Score: 66-66)
Jarrett Tatum attempts a Layup. BLOCKED BY BRADLEY DOSUNMU! Ball is loose! Rebound secured by John Russell.

================================================================================
                              3RD QUARTER COMPLETE                              
================================================================================

3RD QUARTER SCORE: Team_037 28, Team_027 17

BOX SCORE:
================================================================================

Team_037
--------------------------------------------------------------------------------
Player                MIN  PTS  REB  AST  TO      FG   FG%      3P   3P%
--------------------------------------------------------------------------------
RJ Mitchell            25   10    0    1   0   4/6    66.7     0/0   0.0
Giannis Middleton      26    6    0    1   0   2/6    33.3     0/0   0.0
Jarrett Tatum          25    5    7    0   0   2/4    50.0     0/0   0.0
Collin Young           25    4    4    1   0   2/2   100.0     0/0   0.0
Scottie Jackson        26    2    3    0   0   1/4    25.0     0/0   0.0

TEAM: FG: 11/22 (50.0%), 3PT: 3/6 (50.0%), REB: 17 (3 off, 14 def), AST: 3, TO: 3
TEAM FOULS: 6 [Team_027 in BONUS]


Team_027
--------------------------------------------------------------------------------
Player                MIN  PTS  REB  AST  TO      FG   FG%      3P   3P%
--------------------------------------------------------------------------------
Bradley Dosunmu        25    7    5    0   0   3/9    33.3     0/0   0.0
John Russell           25    4    5    1   0   2/3    66.7     0/0   0.0
Tony Doncic            26    2    4    1   0   1/2    50.0     0/0   0.0
Scottie Harden         25    2    0    0   0   1/3    33.3     0/0   0.0
Tim Johnson            25    0    0    0   0   0/4     0.0     0/0   0.0

TEAM: FG: 7/21 (33.3%), 3PT: 0/7 (0.0%), REB: 11 (3 off, 8 def), AST: 2, TO: 3
TEAM FOULS: 10 [Team_037 in BONUS]

================================================================================

================================================================================
                       4TH QUARTER - Team_037 vs Team_027                       
================================================================================

[12:00] Team_037 possession (Score: 66-66)
RJ Mitchell attempts a Midrange. Contested by Tim Johnson (5.4 feet, MAN). RJ Mitchell misses. Rebound secured by Tony Doncic.

[11:46] Team_027 possession (Score: 66-66)
Scottie Harden attempts a 3Pt. Contested by Jarrett Tatum (4.3 feet, MAN). Scottie Harden misses. Rebound secured by Collin Young.

[11:32] Team_037 possession (Score: 66-66)
RJ Mitchell attempts a Layup. Contested by John Russell (4.5 feet, ZONE). RJ MITCHELL MAKES IT! Assist: Scottie Jackson
Score: 68-66

[11:20] Team_027 possession (Score: 68-66)
John Russell attempts a Layup. Contested by Scottie Jackson (4.6 feet, ZONE). JOHN RUSSELL MAKES IT! Assist: Bradley Dosunmu
Score: 68-68

[11:11] Team_037 possession (Score: 68-68)
Collin Young attempts a Layup. Contested by John Russell (4.4 feet, ZONE). Collin Young misses. Rebound secured by Tony Doncic.

[10:58] Team_027 possession (Score: 68-68)
Tony Doncic attempts a 3Pt. Contested by Scottie Jackson (4.1 feet, ZONE). TONY DONCIC MAKES IT! Assist: Scottie Harden
Score: 68-71

[10:41] Team_037 possession (Score: 68-71)
Scottie Jackson attempts a 3Pt. Contested by Tim Johnson (5.9 feet, ZONE). Scottie Jackson misses. Rebound secured by Tony Doncic.

[10:29] Team_027 possession (Score: 68-71)
Tim Johnson attempts a 3Pt. Contested by Scottie Jackson (4.3 feet, ZONE). Tim Johnson misses. Rebound secured by Jarrett Tatum.

[10:18] Team_037 possession (Score: 68-71)
Scottie Jackson attempts a 3Pt. Contested by Bradley Dosunmu (5.4 feet, MAN). Scottie Jackson misses. Rebound secured by John Russell.

[10:07] Team_027 possession (Score: 68-71)
FOUL! Reach-in foul on Jarrett Tatum during the drive. [Team fouls: 1] No free throws, side out. (Jarrett Tatum: 1 personal fouls)

[09:53] Team_027 possession (Score: 68-71)
Bradley Dosunmu attempts a Midrange. Contested by Scottie Jackson (4.2 feet, MAN). BRADLEY DOSUNMU MAKES IT! Assist: Tony Doncic
Score: 68-73

[09:38] Team_037 possession (Score: 68-73)
Scottie Jackson drives to the basket... Scottie Jackson throws a bad pass! Stolen by John Russell! TURNOVER! (live ball)

[09:21] Team_027 possession (Score: 68-73)
Scottie Harden loses the ball! Stripped by Jarrett Tatum! TURNOVER! (live ball)

[09:07] Team_037 possession (Score: 68-73)
RJ Mitchell attempts a Midrange. Contested by Tim Johnson (5.8 feet, MAN). RJ Mitchell misses. Rebound secured by Bradley Dosunmu.

[08:55] Team_027 possession (Score: 68-73)
Tim Johnson throws a bad pass! Stolen by RJ Mitchell! TURNOVER! (live ball)

[08:40] Team_037 possession (Score: 68-73)
Giannis Middleton attempts a 3Pt. Contested by Tony Doncic (4.9 feet, MAN). GIANNIS MIDDLETON MAKES IT! Assist: Scottie Jackson
Score: 71-73

[08:27] Team_027 possession (Score: 71-73)
Tim Johnson attempts a Midrange. Contested by Scottie Jackson (4.5 feet, ZONE). TIM JOHNSON MAKES IT!
Score: 71-75

[08:08] Team_037 possession (Score: 71-75)
RJ Mitchell attempts a 3Pt. Contested by Tim Johnson (5.9 feet, MAN). RJ Mitchell misses. Rebound secured by Tony Doncic.

[07:55] Team_027 possession (Score: 71-75)
Scottie Harden attempts a 3Pt. Contested by Jarrett Tatum (4.8 feet, MAN). Scottie Harden misses. Rebound secured by Scottie Jackson.

[07:39] Team_037 possession (Score: 71-75)
Giannis Middleton attempts a 3Pt. Wide open! Tim Johnson is 6.1 feet away. [ZONE] GIANNIS MIDDLETON MAKES IT! Assist: Scottie Jackson
Score: 74-75

[07:26] Team_027 possession (Score: 74-75)
Scottie Harden attempts a 3Pt. Contested by Jarrett Tatum (4.9 feet, ZONE). Scottie Harden misses. Rebound secured by Scottie Jackson.

[07:15] Team_037 possession (Score: 74-75)
FOUL! Shooting foul on Bradley Dosunmu. Jarrett Tatum to the line for 3 free throws. [Team fouls: 1] (Bradley Dosunmu: 1 personal fouls)   FT 1/3: MISS   FT 2/3: GOOD   FT 3/3: GOOD Jarrett Tatum makes 2/3 from the line.
Score: 76-75

[07:05] Team_027 possession (Score: 76-75)
Bradley Dosunmu attempts a Midrange. Contested by Scottie Jackson (4.6 feet, MAN). Bradley Dosunmu misses. Rebound secured by Jarrett Tatum.

[06:50] Team_037 possession (Score: 76-75)
Jarrett Tatum attempts a 3Pt. Wide open! Tim Johnson is 6.0 feet away. [ZONE] JARRETT TATUM MAKES IT! Assist: RJ Mitchell
Score: 79-75

[06:37] Team_027 possession (Score: 79-75)
Bradley Dosunmu makes the Layup and draws the foul on Scottie Jackson! And-1! Bradley Dosunmu to the line for 1. [Team fouls: 2] (Scottie Jackson: 1 personal fouls)   FT 1/1: GOOD Bradley Dosunmu makes 1/1 from the line.
Score: 79-78

[06:18] Team_037 possession (Score: 79-78)
Jarrett Tatum attempts a 3Pt. Contested by Scottie Harden (5.8 feet, MAN). Jarrett Tatum misses. Offensive rebound by Collin Young! Collin Young kicks it out.

[06:08] Team_037 possession (Score: 79-78)
RJ Mitchell loses the ball! Stripped by Tim Johnson! TURNOVER! (live ball)

[05:53] Team_027 possession (Score: 79-78)
Tony Doncic attempts a Layup. Contested by Giannis Middleton (5.2 feet, MAN). TONY DONCIC MAKES IT! Assist: Bradley Dosunmu
Score: 79-80

[05:41] Team_037 possession (Score: 79-80)
Giannis Middleton attempts a Midrange. Contested by Tony Doncic (5.3 feet, MAN). GIANNIS MIDDLETON MAKES IT! Assist: Scottie Jackson
Score: 81-80

[05:25] Team_027 possession (Score: 81-80)
Bradley Dosunmu drives, Scottie Jackson stays with him. Bradley Dosunmu attempts a Dunk. Contested by Scottie Jackson (4.8 feet, ZONE). Bradley Dosunmu misses. Rebound secured by Jarrett Tatum.

[05:12] Team_037 possession (Score: 81-80)
Jarrett Tatum drives, picks up Scottie Harden. Help arrives from Tony Doncic! Jarrett Tatum attempts a Dunk. Contested by Tony Doncic (6.0 feet, MAN). JARRETT TATUM MAKES IT! Assist: RJ Mitchell
Score: 83-80

[04:59] Team_027 possession (Score: 83-80)
FOUL! Shooting foul on Scottie Jackson. Bradley Dosunmu to the line for 3 free throws. [Team fouls: 3] (Scottie Jackson: 2 personal fouls)   FT 1/3: GOOD   FT 2/3: GOOD   FT 3/3: GOOD Bradley Dosunmu makes 3/3 from the line.
Score: 83-83

[04:47] Team_037 possession (Score: 83-83)
Scottie Jackson attempts a 3Pt. Wide open! Bradley Dosunmu is 6.1 feet away. [MAN] Scottie Jackson misses. Rebound secured by Tony Doncic.

[04:32] Team_027 possession (Score: 83-83)
Tony Doncic drives to the basket... FOUL! Offensive foul on Tony Doncic! Scottie Jackson drew the charge! [Team fouls: 2] (Tony Doncic: 1 personal fouls) TURNOVER! (dead ball)

[04:15] Team_037 possession (Score: 83-83)
Giannis Middleton attempts a 3Pt. Contested by Tony Doncic (5.5 feet, MAN). Giannis Middleton misses. Rebound secured by Tony Doncic.

[04:00] Team_027 possession (Score: 83-83)
Tony Doncic attempts a 3Pt. Contested by Scottie Jackson (5.1 feet, ZONE). TONY DONCIC MAKES IT! Assist: John Russell
Score: 83-86

[03:43] Team_037 possession (Score: 83-86)
Collin Young drives to the basket... FOUL! Offensive foul on Collin Young! John Russell drew the charge! [Team fouls: 4] (Collin Young: 1 personal fouls) TURNOVER! (dead ball)

[03:29] Team_027 possession (Score: 83-86)
John Russell attempts a Layup. Wide open! Collin Young is 6.3 feet away. [MAN] JOHN RUSSELL MAKES IT! Assist: Tim Johnson
Score: 83-88

[03:16] Team_037 possession (Score: 83-88)
Giannis Middleton attempts a 3Pt. Wide open! Bradley Dosunmu is 6.1 feet away. [ZONE] Giannis Middleton misses. Rebound secured by Bradley Dosunmu.

[03:02] Team_027 possession (Score: 83-88)
FOUL! Shooting foul on Giannis Middleton. Tony Doncic to the line for 2 free throws. [BONUS: 5 team fouls] (Giannis Middleton: 1 personal fouls)   FT 1/2: GOOD   FT 2/2: GOOD Tony Doncic makes 2/2 from the line.
Score: 83-90

[02:44] Team_037 possession (Score: 83-90)
Collin Young attempts a Midrange. Contested by John Russell (5.7 feet, MAN). Collin Young misses. Offensive rebound by Scottie Jackson! Scottie Jackson kicks it out.

[02:29] Team_037 possession (Score: 83-90)
Jarrett Tatum attempts a 3Pt. Wide open! Scottie Harden is 6.4 feet away. [MAN] Jarrett Tatum misses. FOUL! Loose ball foul on Bradley Dosunmu during the rebound battle. [Team fouls: 3] No free throws, side out. (Bradley Dosunmu: 2 personal fouls)

[02:15] Team_037 possession (Score: 83-90)
FOUL! Reach-in foul on Scottie Harden during the drive. [Team fouls: 4] No free throws, side out. (Scottie Harden: 1 personal fouls)

[02:01] Team_037 possession (Score: 83-90)
Giannis Middleton drives, John Russell stays with him. Giannis Middleton attempts a Dunk. Wide open! John Russell is 6.2 feet away. [ZONE] GIANNIS MIDDLETON MAKES IT! Assist: Collin Young
Score: 85-90

[01:50] Team_027 possession (Score: 85-90)
Tim Johnson attempts a Layup. BLOCKED BY SCOTTIE JACKSON! Ball is loose! Offensive rebound by Bradley Dosunmu! Bradley Dosunmu kicks it out.

[01:37] Team_027 possession (Score: 85-90)
John Russell attempts a Midrange. Wide open! Giannis Middleton is 6.2 feet away. [ZONE] John Russell misses. Rebound secured by Collin Young.

[01:26] Team_037 possession (Score: 85-90)
RJ Mitchell attempts a 3Pt. Wide open! Bradley Dosunmu is 6.3 feet away. [ZONE] RJ Mitchell misses. Rebound secured by Tony Doncic.

[01:14] Team_027 possession (Score: 85-90)
Bradley Dosunmu attempts a 3Pt. Contested by Scottie Jackson (5.5 feet, ZONE). Bradley Dosunmu misses. Rebound secured by Scottie Jackson.

[00:56] Team_037 possession (Score: 85-90)
Jarrett Tatum drives to the basket... Jarrett Tatum throws a bad pass! Stolen by Scottie Harden! TURNOVER! (live ball)

[00:44] Team_027 possession (Score: 85-90)
Scottie Harden drives to the basket... Scottie Harden throws a bad pass! Stolen by Scottie Jackson! TURNOVER! (live ball)

[00:30] Team_037 possession (Score: 85-90)
Giannis Middleton attempts a 3Pt. Wide open! Bradley Dosunmu is 6.6 feet away. [ZONE] GIANNIS MIDDLETON MAKES IT! Assist: Collin Young
Score: 88-90

[00:18] Team_027 possession (Score: 88-90)
John Russell attempts a Midrange. Wide open! Scottie Jackson is 6.0 feet away. [ZONE] John Russell misses. FOUL! Loose ball foul on Scottie Jackson during the rebound battle. [IN THE BONUS! 6 team fouls] John Russell to the line for 2 free throws. (Scottie Jackson: 3 personal fouls)   FT 1/2: GOOD   FT 2/2: MISS John Russell makes 1/2 from the line. Rebound secured by Collin Young.
Score: 88-91

[00:03] Team_037 possession (Score: 88-91)
Collin Young attempts a Layup. Wide open! John Russell is 6.3 feet away. [ZONE] COLLIN YOUNG MAKES IT! Assist: Giannis Middleton
Score: 90-91

================================================================================
                              4TH QUARTER COMPLETE                              
================================================================================

4TH QUARTER SCORE: Team_037 24, Team_027 25

BOX SCORE:
================================================================================

Team_037
--------------------------------------------------------------------------------
Player                MIN  PTS  REB  AST  TO      FG   FG%      3P   3P%
--------------------------------------------------------------------------------
Giannis Middleton      38   13    0    1   0   5/7    71.4     0/0   0.0
Jarrett Tatum          37    7    3    0   0   3/3   100.0     0/0   0.0
RJ Mitchell            37    2    0    2   0   1/5    20.0     0/0   0.0
Collin Young           37    2    5    2   0   1/2    50.0     0/0   0.0
Scottie Jackson        38    0    4    4   0   0/3     0.0     0/0   0.0

TEAM: FG: 10/20 (50.0%), 3PT: 5/12 (41.7%), REB: 11 (3 off, 8 def), AST: 9, TO: 4
TEAM FOULS: 6 [Team_027 in BONUS]


Team_027
--------------------------------------------------------------------------------
Player                MIN  PTS  REB  AST  TO      FG   FG%      3P   3P%
--------------------------------------------------------------------------------
Tony Doncic            38   10    7    1   0   4/4   100.0     0/0   0.0
Bradley Dosunmu        37    8    3    2   0   3/6    50.0     0/0   0.0
John Russell           37    4    1    1   0   2/4    50.0     0/0   0.0
Tim Johnson            37    2    0    1   0   1/2    50.0     0/0   0.0
Scottie Harden         37    0    0    1   0   0/3     0.0     0/0   0.0

TEAM: FG: 10/19 (52.6%), 3PT: 3/8 (37.5%), REB: 12 (2 off, 10 def), AST: 6, TO: 4
TEAM FOULS: 4

================================================================================

================================================================================
                               FULL GAME COMPLETE                               
================================================================================

FINAL SCORE: Team_037 90, Team_027 91

SCORING BY QUARTER:
--------------------------------------------------------------------------------
Team                     Q1     Q2     Q3     Q4    FINAL
--------------------------------------------------------------------------------
Team_037                 25     13     28     24       90
Team_027                 27     22     17     25       91
--------------------------------------------------------------------------------

FULL GAME BOX SCORE:
================================================================================

Team_037
--------------------------------------------------------------------------------
Player                MIN  PTS  REB  AST  TO      FG   FG%      3P   3P%      FT STL BLK
--------------------------------------------------------------------------------
Giannis Middleton      38   23    0    3   2  10/18   55.6   5/11   45.5   1/1     0   1
Scottie Jackson        38    4   11    4   0   1/11    9.1   0/6     0.0   1/2     3   1
RJ Mitchell            37   23    0    3   3  11/19   57.9   7/10   70.0   6/7     1   0
Jarrett Tatum          37   14   11    1   4   6/8    75.0   2/2   100.0   7/8     2   0
Collin Young           37   12   14    5   3   4/6    66.7   0/0     0.0   2/3     0   0
Jarrett Randle         12    3    0    2   0   1/4    25.0   1/4    25.0   0/0     0   1
Julius Bird            12    5    5    0   0   2/4    50.0   2/3    66.7   3/3     0   0
Wendell Herro          12    0    2    0   0   0/3     0.0   0/0     0.0   0/0     0   0
Collin Trent           10    2    0    0   1   1/4    25.0   0/1     0.0   1/2     0   0
Russell Anthony        10    2    3    1   1   1/2    50.0   0/1     0.0   0/0     0   0

TEAM: FG: 37/80 (46.2%), 3PT: 17/38 (44.7%), REB: 49 (13 off, 36 def), AST: 19, TO: 14


Team_027
--------------------------------------------------------------------------------
Player                MIN  PTS  REB  AST  TO      FG   FG%      3P   3P%      FT STL BLK
--------------------------------------------------------------------------------
Tony Doncic            38   17   13    3   2   7/12   58.3   3/7    42.9   4/4     1   0
Tim Johnson            37    6    0    1   2   3/10   30.0   0/6     0.0   0/0     1   0
Scottie Harden         37    5    0    1   5   3/8    37.5   2/5    40.0   0/2     1   0
Bradley Dosunmu        37   19   13    4   2   7/17   41.2   2/5    40.0   6/7     0   1
John Russell           37   19   10    4   0  10/13   76.9   0/0     0.0   4/7     2   0
CJ Green               12    2    0    1   0   2/3    66.7   1/2    50.0   2/2     0   0
Rudy Quickley          12    2    0    0   1   2/4    50.0   1/1   100.0   0/0     0   0
LeBron Russell         12    0    3    1   1   1/2    50.0   1/1   100.0   0/0     1   0
Ben Stewart            12   10   12    0   0   1/2    50.0   0/0     0.0   0/0     0   1
Dirk Lillard           10    8    4    0   2   4/6    66.7   1/2    50.0   1/1     0   0

TEAM: FG: 40/77 (51.9%), 3PT: 11/29 (37.9%), REB: 52 (13 off, 39 def), AST: 15, TO: 15

================================================================================
