================================================================================
                        FULL GAME - Team_066 vs Team_013                        
================================================================================

================================================================================
                       1ST QUARTER - Team_066 vs Team_013                       
================================================================================

[12:00] Team_066 possession (Score: 0-0)
Brandon Reaves attempts a Midrange. Contested by Jayson Morant (4.5 feet, MAN). BRANDON REAVES MAKES IT! Assist: Pau Curry
Score: 2-0

[11:45] Team_013 possession (Score: 2-0)
Jayson Morant attempts a Layup. Contested by Kyle Wagner (4.2 feet, ZONE). Jayson Morant misses. Rebound secured by Brandon Reaves.

[11:29] Team_066 possession (Score: 2-0)
Brandon Reaves attempts a Midrange. Contested by Desmond Ginobili (5.3 feet, ZONE). Brandon Reaves misses. Rebound secured by Pau Mobley.

[11:10] Team_013 possession (Score: 2-0)
Nikola Curry attempts a 3Pt. Contested by Kyle Wagner (4.4 feet, MAN). Nikola Curry misses. FOUL! Loose ball foul on Yao Brogdon during the rebound battle. [Team fouls: 1] No free throws, side out. (Yao Brogdon: 1 personal fouls)

[10:58] Team_013 possession (Score: 2-0)
Manu Smith attempts a 3Pt. Contested by Jimmy Davis (4.4 feet, MAN). Manu Smith misses. Rebound secured by Brandon Reaves.

[10:47] Team_066 possession (Score: 2-0)
Kyle Wagner makes the Layup and draws the foul on Desmond Ginobili! And-1! Kyle Wagner to the line for 1. [Team fouls: 1] (Desmond Ginobili: 1 personal fouls)   FT 1/1: GOOD Kyle Wagner makes 1/1 from the line.
Score: 5-0

[10:33] Team_013 possession (Score: 5-0)
Desmond Ginobili attempts a 3Pt. Contested by Pau Curry (5.8 feet, ZONE). Desmond Ginobili misses. Rebound secured by Yao Brogdon.

[10:21] Team_066 possession (Score: 5-0)
Jimmy Davis attempts a Midrange. Contested by Manu Smith (5.2 feet, MAN). JIMMY DAVIS MAKES IT!
Score: 7-0

[10:09] Team_013 possession (Score: 7-0)
Nikola Curry attempts a Layup. Contested by Kyle Wagner (4.4 feet, MAN). Nikola Curry misses. FOUL! Loose ball foul on Brandon Reaves during the rebound battle. [Team fouls: 2] No free throws, side out. (Brandon Reaves: 1 personal fouls)

[09:54] Team_013 possession (Score: 7-0)
Jayson Morant attempts a Midrange. Contested by Brandon Reaves (5.4 feet, MAN). JAYSON MORANT MAKES IT!
Score: 7-2

[09:40] Team_066 possession (Score: 7-2)
Jimmy Davis attempts a Layup. Contested by Manu Smith (5.2 feet, MAN). JIMMY DAVIS MAKES IT!
Score: 9-2

[09:30] Team_013 possession (Score: 9-2)
Pau Mobley attempts a 3Pt. Contested by Pau Curry (5.5 feet, ZONE). Pau Mobley misses. Rebound secured by Kyle Wagner.

[09:14] Team_066 possession (Score: 9-2)
Kyle Wagner attempts a Midrange. Contested by Jayson Morant (3.9 feet, ZONE). KYLE WAGNER MAKES IT!
Score: 11-2

[08:56] Team_013 possession (Score: 11-2)
Pau Mobley attempts a 3Pt. Contested by Pau Curry (5.5 feet, ZONE). Pau Mobley misses. Rebound secured by Kyle Wagner.

[08:42] Team_066 possession (Score: 11-2)
Kyle Wagner attempts a Layup. Contested by Nikola Curry (4.8 feet, MAN). Kyle Wagner misses. Rebound secured by Pau Mobley.

[08:24] Team_013 possession (Score: 11-2)
Nikola Curry drives and kicks out. Pau Mobley attempts a Midrange. Contested by Yao Brogdon (5.1 feet, ZONE). PAU MOBLEY MAKES IT! Assist: Desmond Ginobili
Score: 11-4

[08:05] Team_066 possession (Score: 11-4)
FOUL! Shooting foul on Pau Mobley. Kyle Wagner to the line for 2 free throws. [Team fouls: 2] (Pau Mobley: 1 personal fouls)   FT 1/2: GOOD   FT 2/2: MISS Kyle Wagner makes 1/2 from the line. Rebound secured by Nikola Curry.
Score: 12-4

[07:47] Team_013 possession (Score: 12-4)
Nikola Curry attempts a Layup. Contested by Kyle Wagner (4.4 feet, MAN). NIKOLA CURRY MAKES IT! Assist: Pau Mobley
Score: 12-6

[07:34] Team_066 possession (Score: 12-6)
Jimmy Davis attempts a 3Pt. Contested by Manu Smith (5.2 feet, MAN). JIMMY DAVIS MAKES IT! Assist: Brandon Reaves
Score: 15-6

[07:22] Team_013 possession (Score: 15-6)
Jayson Morant attempts a Layup. Contested by Kyle Wagner (4.2 feet, ZONE). JAYSON MORANT MAKES IT! Assist: Manu Smith
Score: 15-8

[07:07] Team_066 possession (Score: 15-8)
Brandon Reaves attempts a Layup. BLOCKED BY JAYSON MORANT! Ball deflects out of bounds off Brandon Reaves.

[06:53] Team_013 possession (Score: 15-8)
FOUL! Holding foul on Brandon Reaves. [Team fouls: 3] No free throws, side out. (Brandon Reaves: 2 personal fouls)

[06:39] Team_013 possession (Score: 15-8)
Pau Mobley attempts a 3Pt. Contested by Pau Curry (5.5 feet, MAN). PAU MOBLEY MAKES IT! Assist: Manu Smith
Score: 15-11

[06:24] Team_066 possession (Score: 15-11)
Yao Brogdon attempts a Midrange. Contested by Desmond Ginobili (5.3 feet, ZONE). Yao Brogdon misses. Rebound secured by Nikola Curry.

[06:08] Team_013 possession (Score: 15-11)
Nikola Curry attempts a 3Pt. Contested by Kyle Wagner (4.4 feet, MAN). Nikola Curry misses. Rebound secured by Brandon Reaves.

[05:53] Team_066 possession (Score: 15-11)
Kyle Wagner drives and kicks out. Brandon Reaves attempts a 3Pt. Contested by Desmond Ginobili (4.8 feet, ZONE). Brandon Reaves misses. Rebound secured by Nikola Curry.

[05:38] Team_013 possession (Score: 15-11)
Jayson Morant throws a bad pass out of bounds! TURNOVER! (dead ball)

[05:24] Team_066 possession (Score: 15-11)
FOUL! Reach-in foul on Desmond Ginobili during the drive. [Team fouls: 3] No free throws, side out. (Desmond Ginobili: 2 personal fouls)

[05:11] Team_066 possession (Score: 15-11)
Brandon Reaves attempts a 3Pt. Contested by Pau Mobley (4.2 feet, ZONE). BRANDON REAVES MAKES IT! Assist: Yao Brogdon
Score: 18-11

[04:58] Team_013 possession (Score: 18-11)
FOUL! Shooting foul on Kyle Wagner. Nikola Curry to the line for 2 free throws. [Team fouls: 4] (Kyle Wagner: 1 personal fouls)   FT 1/2: GOOD   FT 2/2: GOOD Nikola Curry makes 2/2 from the line.
Score: 18-13

[04:49] Team_066 possession (Score: 18-13)
Jimmy Davis attempts a 3Pt. Contested by Pau Mobley (4.2 feet, ZONE). Jimmy Davis misses. Rebound secured by Pau Mobley.

[04:30] Team_013 possession (Score: 18-13)
Manu Smith drives and kicks out. Desmond Ginobili attempts a Midrange. Contested by Brandon Reaves (5.1 feet, ZONE). Desmond Ginobili misses. FOUL! Loose ball foul on Yao Brogdon during the rebound battle. [IN THE BONUS! 5 team fouls] Desmond Ginobili to the line for 2 free throws. (Yao Brogdon: 2 personal fouls)   FT 1/2: GOOD   FT 2/2: GOOD Desmond Ginobili makes 2/2 from the line.
Score: 18-15

[04:16] Team_066 possession (Score: 18-15)
Brandon Reaves attempts a 3Pt. Contested by Desmond Ginobili (5.4 feet, ZONE). BRANDON REAVES MAKES IT! Assist: Kyle Wagner
Score: 21-15

[04:00] Team_013 possession (Score: 21-15)
Pau Mobley drives and kicks out. Pau Mobley attempts a 3Pt. Contested by Yao Brogdon (5.2 feet, ZONE). Pau Mobley misses. Rebound secured by Brandon Reaves.

[03:46] Team_066 possession (Score: 21-15)
Yao Brogdon drives and kicks out. Kyle Wagner attempts a 3Pt. Contested by Pau Mobley (3.9 feet, ZONE). Kyle Wagner misses. Rebound secured by Pau Mobley.

[03:28] Team_013 possession (Score: 21-15)
Desmond Ginobili attempts a 3Pt. Contested by Yao Brogdon (5.6 feet, MAN). Desmond Ginobili misses. Rebound secured by Kyle Wagner.

[03:12] Team_066 possession (Score: 21-15)
FOUL! Reach-in foul on Nikola Curry during the drive. [Team fouls: 4] No free throws, side out. (Nikola Curry: 1 personal fouls)

[03:02] Team_066 possession (Score: 21-15)
Jimmy Davis attempts a 3Pt. Contested by Jayson Morant (4.7 feet, ZONE). Jimmy Davis misses. Rebound secured by Nikola Curry.

[02:50] Team_013 possession (Score: 21-15)
FOUL! Reach-in foul on Yao Brogdon during the drive. [IN THE BONUS! 6 team fouls] Desmond Ginobili to the line for 2 free throws. (Yao Brogdon: 3 personal fouls)   FT 1/2: GOOD   FT 2/2: GOOD Desmond Ginobili makes 2/2 from the line.
Score: 21-17

[02:37] Team_066 possession (Score: 21-17)
Brandon Reaves attempts a 3Pt. Contested by Pau Mobley (4.4 feet, ZONE). Brandon Reaves misses. Rebound secured by Nikola Curry.

[02:26] Team_013 possession (Score: 21-17)
Desmond Ginobili attempts a 3Pt. Contested by Yao Brogdon (5.7 feet, MAN). Desmond Ginobili misses. Rebound secured by Yao Brogdon.

[02:12] Team_066 possession (Score: 21-17)
Kyle Wagner drives, Nikola Curry stays with him. Kyle Wagner attempts a Layup. Contested by Nikola Curry (5.1 feet, MAN). Kyle Wagner misses. Rebound secured by Desmond Ginobili.

[01:54] Team_013 possession (Score: 21-17)
FOUL! Reach-in foul on Kyle Wagner during the drive. [IN THE BONUS! 7 team fouls] Pau Mobley to the line for 2 free throws. (Kyle Wagner: 2 personal fouls)   FT 1/2: MISS   FT 2/2: GOOD Pau Mobley makes 1/2 from the line.
Score: 21-18

[01:43] Team_066 possession (Score: 21-18)
Jimmy Davis attempts a 3Pt. Contested by Desmond Ginobili (5.6 feet, ZONE). JIMMY DAVIS MAKES IT!
Score: 24-18

[01:32] Team_013 possession (Score: 24-18)
Pau Mobley attempts a 3Pt. Contested by Pau Curry (5.8 feet, ZONE). Pau Mobley misses. FOUL! Loose ball foul on Yao Brogdon during the rebound battle. [IN THE BONUS! 8 team fouls] Desmond Ginobili to the line for 2 free throws. (Yao Brogdon: 4 personal fouls)   FT 1/2: GOOD   FT 2/2: GOOD Desmond Ginobili makes 2/2 from the line.
Score: 24-20

[01:17] Team_066 possession (Score: 24-20)
Pau Curry attempts a 3Pt. Contested by Pau Mobley (4.4 feet, ZONE). Pau Curry misses. Rebound secured by Nikola Curry.

[01:01] Team_013 possession (Score: 24-20)
Desmond Ginobili attempts a 3Pt. Wide open! Pau Curry is 6.1 feet away. [ZONE] Desmond Ginobili misses. Rebound secured by Yao Brogdon.

[00:47] Team_066 possession (Score: 24-20)
Pau Curry attempts a Midrange. Contested by Pau Mobley (4.4 feet, ZONE). PAU CURRY MAKES IT! Assist: Brandon Reaves
Score: 26-20

[00:34] Team_013 possession (Score: 26-20)
Jayson Morant attempts a Midrange. Contested by Brandon Reaves (5.7 feet, MAN). Jayson Morant misses. Rebound secured by Yao Brogdon.

[00:21] Team_066 possession (Score: 26-20)
Pau Curry drives, picks up Pau Mobley. Help arrives from Jayson Morant! Pau Curry attempts a Layup. Contested by Jayson Morant (4.5 feet, MAN). Pau Curry misses. Rebound secured by Pau Mobley.

[00:06] Team_013 possession (Score: 26-20)
FOUL! Reach-in foul on Kyle Wagner during the drive. [IN THE BONUS! 9 team fouls] Nikola Curry to the line for 2 free throws. (Kyle Wagner: 3 personal fouls)   FT 1/2: GOOD   FT 2/2: GOOD Nikola Curry makes 2/2 from the line.
Score: 26-22

================================================================================
                              1ST QUARTER COMPLETE                              
================================================================================

1ST QUARTER SCORE: Team_066 26, Team_013 22

BOX SCORE:
================================================================================

Team_066
--------------------------------------------------------------------------------
Player                MIN  PTS  REB  AST  TO      FG   FG%      3P   3P%
--------------------------------------------------------------------------------
Jimmy Davis            12   10    0    0   0   4/6    66.7     0/0   0.0
Brandon Reaves         12    8    4    2   0   3/6    50.0     0/0   0.0
Kyle Wagner            12    5    3    1   0   2/6    33.3     0/0   0.0
Pau Curry              12    2    0    1   0   1/3    33.3     0/0   0.0
Yao Brogdon            12    0    4    1   0   0/2     0.0     0/0   0.0

TEAM: FG: 10/23 (43.5%), 3PT: 4/8 (50.0%), REB: 11 (0 off, 11 def), AST: 5, TO: 0
TEAM FOULS: 9 [Team_013 in BONUS]


Team_013
--------------------------------------------------------------------------------
Player                MIN  PTS  REB  AST  TO      FG   FG%      3P   3P%
--------------------------------------------------------------------------------
Pau Mobley             12    6    5    1   0   3/6    50.0     0/0   0.0
Nikola Curry           12    6    8    0   0   3/4    75.0     0/0   0.0
Desmond Ginobili       12    6    1    1   0   3/7    42.9     0/0   0.0
Jayson Morant          12    4    0    0   0   2/4    50.0     0/0   0.0
Manu Smith             12    0    0    2   0   0/1     0.0     0/0   0.0

TEAM: FG: 11/22 (50.0%), 3PT: 2/10 (20.0%), REB: 14 (2 off, 12 def), AST: 4, TO: 1
TEAM FOULS: 4

================================================================================

================================================================================
                       2ND QUARTER - Team_066 vs Team_013                       
================================================================================

[12:00] Team_066 possession (Score: 26-22)
Pau Curry attempts a 3Pt. Contested by Pau Mobley (4.3 feet, MAN). Pau Curry misses. Rebound secured by Desmond Ginobili.

[11:47] Team_013 possession (Score: 26-22)
Manu Smith attempts a 3Pt. Wide open! Pau Curry is 6.3 feet away. [ZONE] Manu Smith misses. Rebound secured by Brandon Reaves.

[11:31] Team_066 possession (Score: 26-22)
Kyle Wagner drives, Desmond Ginobili stays with him. Kyle Wagner attempts a Layup. Contested by Desmond Ginobili (5.0 feet, ZONE). Kyle Wagner misses. Rebound secured by Nikola Curry.

[11:18] Team_013 possession (Score: 26-22)
Pau Mobley attempts a 3Pt. Contested by Pau Curry (5.8 feet, ZONE). Pau Mobley misses. Offensive rebound by Nikola Curry! Nikola Curry kicks it out.

[11:01] Team_013 possession (Score: 26-22)
Desmond Ginobili commits a violation (traveling/carry)! TURNOVER! (dead ball)

[11:01] Substitution (Team_066): Jimmy Davis OUT → Pascal Carter IN (stamina_rule2)

[11:01] Substitution (Team_066): Pau Curry OUT → Lauri LaVine IN (stamina_rule2)

[11:01] Substitution (Team_066): Brandon Reaves OUT → Brandon Middleton IN (stamina_rule2)

[11:01] Substitution (Team_066): Yao Brogdon OUT → Cole Morant IN (stamina_rule2)

[11:01] Substitution (Team_066): Kyle Wagner OUT → Donovan Simmons IN (stamina_rule2)

[11:01] Substitution (Team_013): Manu Smith OUT → Gary Iverson IN (stamina_rule2)

[11:01] Substitution (Team_013): Pau Mobley OUT → Chris Bryant IN (stamina_rule2)

[11:01] Substitution (Team_013): Jayson Morant OUT → Vince Nowitzki IN (stamina_rule2)

[11:01] Substitution (Team_013): Desmond Ginobili OUT → Dirk Booker IN (stamina_rule2)

[11:01] Substitution (Team_013): Nikola Curry OUT → Jayson Nowitzki IN (stamina_rule2)

[10:48] Team_066 possession (Score: 26-22)
FOUL! Shooting foul on Vince Nowitzki. Brandon Middleton to the line for 2 free throws. [Team fouls: 1] (Vince Nowitzki: 1 personal fouls)   FT 1/2: GOOD   FT 2/2: GOOD Brandon Middleton makes 2/2 from the line.
Score: 28-22

[10:33] Team_013 possession (Score: 28-22)
FOUL! Offensive foul on Gary Iverson! Pascal Carter drew the charge! [Team fouls: 2] (Gary Iverson: 1 personal fouls) TURNOVER! (dead ball)

[10:14] Team_066 possession (Score: 28-22)
FOUL! Reach-in foul on Jayson Nowitzki during the drive. [Team fouls: 3] No free throws, side out. (Jayson Nowitzki: 1 personal fouls)

[10:00] Team_066 possession (Score: 28-22)
FOUL! Shooting foul on Vince Nowitzki. Brandon Middleton to the line for 2 free throws. [Team fouls: 4] (Vince Nowitzki: 2 personal fouls)   FT 1/2: GOOD   FT 2/2: GOOD Brandon Middleton makes 2/2 from the line.
Score: 30-22

[09:48] Team_013 possession (Score: 30-22)
Dirk Booker attempts a Midrange. BLOCKED BY DONOVAN SIMMONS! Ball goes out off Donovan Simmons. Dirk Booker's ball!

[09:36] Team_013 possession (Score: 30-22)
Dirk Booker attempts a Midrange. Contested by Cole Morant (5.7 feet, MAN). DIRK BOOKER MAKES IT!
Score: 30-24

[09:17] Team_066 possession (Score: 30-24)
Cole Morant attempts a 3Pt. Contested by Dirk Booker (6.0 feet, MAN). Cole Morant misses. Offensive rebound by Lauri LaVine! Lauri LaVine kicks it out.

[09:06] Team_066 possession (Score: 30-24)
Lauri LaVine attempts a 3Pt. Contested by Chris Bryant (4.8 feet, ZONE). LAURI LAVINE MAKES IT! Assist: Pascal Carter
Score: 33-24

[08:50] Team_013 possession (Score: 33-24)
FOUL! Offensive foul on Vince Nowitzki! Brandon Middleton drew the charge! [Team fouls: 5] (Vince Nowitzki: 3 personal fouls) TURNOVER! (dead ball)

[08:36] Team_066 possession (Score: 33-24)
Pascal Carter attempts a 3Pt. Contested by Chris Bryant (4.8 feet, ZONE). Pascal Carter misses. Rebound secured by Jayson Nowitzki.

[08:17] Team_013 possession (Score: 33-24)
Dirk Booker attempts a 3Pt. Contested by Lauri LaVine (4.1 feet, ZONE). Dirk Booker misses. Rebound secured by Brandon Middleton.

[08:05] Team_066 possession (Score: 33-24)
Cole Morant drives, Jayson Nowitzki stays with him. Cole Morant attempts a Dunk. Wide open! Jayson Nowitzki is 7.2 feet away. [ZONE] Cole Morant misses. Rebound secured by Chris Bryant.

[07:52] Team_013 possession (Score: 33-24)
Vince Nowitzki attempts a 3Pt. Contested by Lauri LaVine (3.6 feet, ZONE). Vince Nowitzki misses. Rebound secured by Lauri LaVine.

[07:41] Team_066 possession (Score: 33-24)
Lauri LaVine attempts a 3Pt. Contested by Chris Bryant (4.8 feet, ZONE). Lauri LaVine misses. Rebound secured by Dirk Booker.

[07:27] Team_013 possession (Score: 33-24)
Chris Bryant attempts a Midrange. Contested by Cole Morant (5.8 feet, ZONE). CHRIS BRYANT MAKES IT!
Score: 33-26

[07:16] Team_066 possession (Score: 33-26)
Lauri LaVine attempts a 3Pt. Contested by Chris Bryant (4.8 feet, MAN). Lauri LaVine misses. Rebound secured by Chris Bryant.

[07:01] Team_013 possession (Score: 33-26)
Chris Bryant attempts a 3Pt. Contested by Lauri LaVine (4.2 feet, MAN). Chris Bryant misses. Rebound secured by Donovan Simmons.

[06:47] Team_066 possession (Score: 33-26)
Pascal Carter attempts a Layup. Wide open! Jayson Nowitzki is 6.8 feet away. [ZONE] PASCAL CARTER MAKES IT! Assist: Donovan Simmons
Score: 35-26

[06:29] Team_013 possession (Score: 35-26)
Gary Iverson attempts a Midrange. Contested by Cole Morant (5.3 feet, ZONE). Gary Iverson misses. Offensive rebound by Jayson Nowitzki! Jayson Nowitzki kicks it out.

[06:13] Team_013 possession (Score: 35-26)
Vince Nowitzki attempts a 3Pt. Contested by Lauri LaVine (3.6 feet, ZONE). Vince Nowitzki misses. Rebound secured by Lauri LaVine.

[06:00] Team_066 possession (Score: 35-26)
Pascal Carter loses the ball! Stripped by Gary Iverson! TURNOVER! (live ball)

[05:45] Team_013 possession (Score: 35-26)
Gary Iverson drives to the basket... FOUL! Offensive foul on Gary Iverson! Pascal Carter drew the charge! [Team fouls: 6] (Gary Iverson: 2 personal fouls) TURNOVER! (dead ball)

[05:35] Team_066 possession (Score: 35-26)
Pascal Carter attempts a Midrange. Contested by Chris Bryant (4.8 feet, ZONE). Pascal Carter misses. Rebound secured by Chris Bryant.

[05:22] Team_013 possession (Score: 35-26)
Dirk Booker attempts a Layup. Contested by Cole Morant (5.7 feet, MAN). Dirk Booker misses. Offensive rebound by Dirk Booker! Dirk Booker kicks it out.

[05:05] Team_013 possession (Score: 35-26)
Jayson Nowitzki attempts a Layup. Contested by Donovan Simmons (4.7 feet, ZONE). JAYSON NOWITZKI MAKES IT! Assist: Chris Bryant
Score: 35-28

[04:55] Team_066 possession (Score: 35-28)
Cole Morant attempts a 3Pt. Wide open! Vince Nowitzki is 6.6 feet away. [ZONE] COLE MORANT MAKES IT! Assist: Lauri LaVine
Score: 38-28

[04:38] Team_013 possession (Score: 38-28)
FOUL! Holding foul on Cole Morant. [Team fouls: 1] No free throws, side out. (Cole Morant: 1 personal fouls)

[04:19] Team_013 possession (Score: 38-28)
Dirk Booker attempts a 3Pt. Contested by Cole Morant (5.7 feet, MAN). Dirk Booker misses. Rebound secured by Lauri LaVine.

[04:02] Team_066 possession (Score: 38-28)
FOUL! Shooting foul on Chris Bryant. Lauri LaVine to the line for 3 free throws. [BONUS: 7 team fouls] (Chris Bryant: 1 personal fouls)   FT 1/3: GOOD   FT 2/3: GOOD   FT 3/3: GOOD Lauri LaVine makes 3/3 from the line.
Score: 41-28

[03:47] Team_013 possession (Score: 41-28)
Gary Iverson drives, picks up Pascal Carter. Help arrives from Lauri LaVine! Gary Iverson attempts a Dunk. Wide open! Lauri LaVine is 6.5 feet away. [MAN] Gary Iverson misses. Rebound secured by Donovan Simmons.

[03:34] Team_066 possession (Score: 41-28)
Pascal Carter attempts a 3Pt. Contested by Gary Iverson (4.9 feet, MAN). Pascal Carter misses. Rebound secured by Dirk Booker.

[03:24] Team_013 possession (Score: 41-28)
Gary Iverson attempts a 3Pt. Contested by Cole Morant (5.4 feet, ZONE). GARY IVERSON MAKES IT! Assist: Dirk Booker
Score: 41-31

[03:11] Team_066 possession (Score: 41-31)
Donovan Simmons drives to the basket... Donovan Simmons throws a bad pass! Stolen by Dirk Booker! TURNOVER! (live ball)

[02:56] Team_013 possession (Score: 41-31)
Jayson Nowitzki attempts a Layup. Contested by Donovan Simmons (4.9 feet, ZONE). JAYSON NOWITZKI MAKES IT! Assist: Gary Iverson
Score: 41-33

[02:41] Team_066 possession (Score: 41-33)
Cole Morant makes the 3Pt and draws the foul on Chris Bryant! And-1! Cole Morant to the line for 1. [BONUS: 8 team fouls] (Chris Bryant: 2 personal fouls)   FT 1/1: GOOD Cole Morant makes 1/1 from the line.
Score: 45-33

[02:28] Team_013 possession (Score: 45-33)
Vince Nowitzki drives and kicks out. Chris Bryant attempts a 3Pt. Contested by Lauri LaVine (4.1 feet, MAN). CHRIS BRYANT MAKES IT! Assist: Gary Iverson
Score: 45-36

[02:09] Team_066 possession (Score: 45-36)
Brandon Middleton attempts a Layup. Wide open! Jayson Nowitzki is 6.6 feet away. [ZONE] Brandon Middleton misses. Rebound secured by Dirk Booker.

[01:56] Team_013 possession (Score: 45-36)
Vince Nowitzki attempts a 3Pt. Contested by Lauri LaVine (3.9 feet, ZONE). Vince Nowitzki misses. Rebound secured by Donovan Simmons.

[01:43] Team_066 possession (Score: 45-36)
Donovan Simmons drives and kicks out. Lauri LaVine attempts a 3Pt. Contested by Chris Bryant (4.8 feet, ZONE). LAURI LAVINE MAKES IT! Assist: Donovan Simmons
Score: 48-36

[01:31] Team_013 possession (Score: 48-36)
Vince Nowitzki attempts a Midrange. Contested by Brandon Middleton (5.0 feet, MAN). Vince Nowitzki misses. Rebound secured by Lauri LaVine.

[01:14] Team_066 possession (Score: 48-36)
Lauri LaVine throws a bad pass! Stolen by Chris Bryant! TURNOVER! (live ball)

[00:56] Team_013 possession (Score: 48-36)
Jayson Nowitzki makes the Layup and draws the foul on Donovan Simmons! And-1! Jayson Nowitzki to the line for 1. [Team fouls: 2] (Donovan Simmons: 1 personal fouls)   FT 1/1: GOOD Jayson Nowitzki makes 1/1 from the line.
Score: 48-39

[00:43] Team_066 possession (Score: 48-39)
Cole Morant drives and kicks out. Pascal Carter attempts a 3Pt. Contested by Chris Bryant (4.9 feet, ZONE). Pascal Carter misses. Rebound secured by Dirk Booker.

[00:26] Team_013 possession (Score: 48-39)
FOUL! Shooting foul on Cole Morant. Vince Nowitzki to the line for 2 free throws. [Team fouls: 3] (Cole Morant: 2 personal fouls)   FT 1/2: GOOD   FT 2/2: GOOD Vince Nowitzki makes 2/2 from the line.
Score: 48-41

[00:13] Team_066 possession (Score: 48-41)
Cole Morant attempts a Midrange. Wide open! Dirk Booker is 6.2 feet away. [ZONE] COLE MORANT MAKES IT!
Score: 50-41

================================================================================
                              2ND QUARTER COMPLETE                              
================================================================================

2ND QUARTER SCORE: Team_066 24, Team_013 19

BOX SCORE:
================================================================================

Team_066
--------------------------------------------------------------------------------
Player                MIN  PTS  REB  AST  TO      FG   FG%      3P   3P%
--------------------------------------------------------------------------------
Lauri LaVine           11    9    5    1   0   3/5    60.0     0/0   0.0
Cole Morant            11    9    0    0   0   3/5    60.0     0/0   0.0
Brandon Middleton      11    4    1    0   0   2/3    66.7     0/0   0.0
Pascal Carter          11    2    0    1   0   1/4    25.0     0/0   0.0
Pau Curry              13    0    0    0   0   0/1     0.0     0/0   0.0
Brandon Reaves         13    0    1    0   0   0/0     0.0     0/0   0.0
Kyle Wagner            13    0    0    0   0   0/1     0.0     0/0   0.0
Donovan Simmons        11    0    3    2   0   0/0     0.0     0/0   0.0

TEAM: FG: 9/19 (47.4%), 3PT: 4/9 (44.4%), REB: 10 (1 off, 9 def), AST: 4, TO: 3
TEAM FOULS: 3


Team_013
--------------------------------------------------------------------------------
Player                MIN  PTS  REB  AST  TO      FG   FG%      3P   3P%
--------------------------------------------------------------------------------
Jayson Nowitzki        11    7    2    0   0   3/3   100.0     0/0   0.0
Chris Bryant           11    5    3    1   0   2/3    66.7     0/0   0.0
Gary Iverson           11    3    0    2   0   1/2    50.0     0/0   0.0
Dirk Booker            11    2    5    1   0   1/3    33.3     0/0   0.0
Vince Nowitzki         11    2    0    0   0   1/5    20.0     0/0   0.0
Desmond Ginobili       13    0    1    0   0   0/0     0.0     0/0   0.0
Manu Smith             13    0    0    0   0   0/1     0.0     0/0   0.0
Nikola Curry           13    0    2    0   0   0/0     0.0     0/0   0.0

TEAM: FG: 8/17 (47.1%), 3PT: 1/8 (12.5%), REB: 13 (3 off, 10 def), AST: 4, TO: 4
TEAM FOULS: 8 [Team_066 in BONUS]

================================================================================

================================================================================
                       3RD QUARTER - Team_066 vs Team_013                       
================================================================================

[12:00] Team_066 possession (Score: 50-41)
Jimmy Davis drives, Manu Smith stays with him. Jimmy Davis attempts a Dunk. Contested by Manu Smith (5.2 feet, MAN). Jimmy Davis misses. Rebound secured by Pau Mobley.

[11:43] Team_013 possession (Score: 50-41)
Jayson Morant attempts a 3Pt. Contested by Brandon Reaves (5.4 feet, MAN). Jayson Morant misses. Rebound secured by Yao Brogdon.

[11:26] Team_066 possession (Score: 50-41)
Jimmy Davis attempts a Midrange. Contested by Manu Smith (5.2 feet, MAN). JIMMY DAVIS MAKES IT! Assist: Pau Curry
Score: 52-41

[11:10] Team_013 possession (Score: 52-41)
Desmond Ginobili attempts a 3Pt. Contested by Pau Curry (5.8 feet, ZONE). Desmond Ginobili misses. Offensive rebound by Desmond Ginobili! Desmond Ginobili kicks it out.

[10:58] Team_013 possession (Score: 52-41)
Manu Smith drives and kicks out. Nikola Curry attempts a Midrange. Contested by Kyle Wagner (3.9 feet, MAN). NIKOLA CURRY MAKES IT!
Score: 52-43

[10:42] Team_066 possession (Score: 52-43)
Kyle Wagner attempts a Layup. Contested by Desmond Ginobili (4.7 feet, ZONE). KYLE WAGNER MAKES IT! Assist: Jimmy Davis
Score: 54-43

[10:27] Team_013 possession (Score: 54-43)
Pau Mobley attempts a 3Pt. Contested by Pau Curry (5.5 feet, ZONE). PAU MOBLEY MAKES IT! Assist: Desmond Ginobili
Score: 54-46

[10:09] Team_066 possession (Score: 54-46)
Pau Curry attempts a 3Pt. Contested by Desmond Ginobili (5.1 feet, ZONE). PAU CURRY MAKES IT! Assist: Yao Brogdon
Score: 57-46

[09:53] Team_013 possession (Score: 57-46)
Manu Smith attempts a Layup. Contested by Jimmy Davis (4.4 feet, MAN). MANU SMITH MAKES IT! Assist: Pau Mobley
Score: 57-48

[09:38] Team_066 possession (Score: 57-48)
Kyle Wagner attempts a 3Pt. Contested by Nikola Curry (4.8 feet, MAN). KYLE WAGNER MAKES IT! Assist: Brandon Reaves
Score: 60-48

[09:19] Team_013 possession (Score: 60-48)
Manu Smith attempts a Midrange. Contested by Jimmy Davis (4.4 feet, MAN). Manu Smith misses. Offensive rebound by Desmond Ginobili! Desmond Ginobili kicks it out.

[09:01] Team_013 possession (Score: 60-48)
Manu Smith attempts a 3Pt. Contested by Pau Curry (6.0 feet, ZONE). MANU SMITH MAKES IT! Assist: Pau Mobley
Score: 60-51

[08:45] Team_066 possession (Score: 60-51)
Jimmy Davis attempts a 3Pt. Contested by Manu Smith (5.2 feet, MAN). JIMMY DAVIS MAKES IT! Assist: Pau Curry
Score: 63-51

[08:33] Team_013 possession (Score: 63-51)
Manu Smith attempts a Midrange. Contested by Jimmy Davis (4.4 feet, MAN). MANU SMITH MAKES IT! Assist: Nikola Curry
Score: 63-53

[08:21] Team_066 possession (Score: 63-53)
Jimmy Davis throws a bad pass out of bounds! TURNOVER! (dead ball)

[08:06] Team_013 possession (Score: 63-53)
Nikola Curry attempts a Layup. Contested by Kyle Wagner (4.4 feet, ZONE). NIKOLA CURRY MAKES IT! Assist: Pau Mobley
Score: 63-55

[07:55] Team_066 possession (Score: 63-55)
Yao Brogdon attempts a 3Pt. Contested by Pau Mobley (4.2 feet, ZONE). Yao Brogdon misses. Rebound secured by Pau Mobley.

[07:38] Team_013 possession (Score: 63-55)
Desmond Ginobili throws a bad pass! Stolen by Yao Brogdon! TURNOVER! (live ball)

[07:24] Team_066 possession (Score: 63-55)
Kyle Wagner attempts a Layup. Contested by Nikola Curry (4.8 feet, MAN). KYLE WAGNER MAKES IT! Assist: Yao Brogdon
Score: 65-55

[07:13] Team_013 possession (Score: 65-55)
Jayson Morant attempts a 3Pt. Contested by Pau Curry (5.8 feet, ZONE). Jayson Morant misses. Rebound secured by Yao Brogdon.

[06:58] Team_066 possession (Score: 65-55)
FOUL! Reach-in foul on Manu Smith during the drive. [Team fouls: 1] No free throws, side out. (Manu Smith: 1 personal fouls)

[06:42] Team_066 possession (Score: 65-55)
Jimmy Davis attempts a 3Pt. Contested by Pau Mobley (4.2 feet, ZONE). Jimmy Davis misses. Rebound secured by Pau Mobley.

[06:25] Team_013 possession (Score: 65-55)
Manu Smith drives and kicks out. Nikola Curry attempts a Midrange. Contested by Kyle Wagner (3.9 feet, MAN). Nikola Curry misses. Rebound secured by Kyle Wagner.

[06:12] Team_066 possession (Score: 65-55)
FOUL! Holding foul on Manu Smith. [Team fouls: 2] No free throws, side out. (Manu Smith: 2 personal fouls)

[05:57] Team_066 possession (Score: 65-55)
Pau Curry attempts a Midrange. Contested by Desmond Ginobili (5.1 feet, ZONE). Pau Curry misses. Rebound secured by Nikola Curry.

[05:42] Team_013 possession (Score: 65-55)
Desmond Ginobili drives to the basket... Desmond Ginobili throws a bad pass out of bounds! TURNOVER! (dead ball)

[05:30] Team_066 possession (Score: 65-55)
Jimmy Davis attempts a Midrange. Contested by Desmond Ginobili (5.3 feet, ZONE). JIMMY DAVIS MAKES IT! Assist: Brandon Reaves
Score: 67-55

[05:19] Team_013 possession (Score: 67-55)
Pau Mobley attempts a 3Pt. Contested by Pau Curry (5.5 feet, MAN). PAU MOBLEY MAKES IT!
Score: 67-58

[05:04] Team_066 possession (Score: 67-58)
Pau Curry drives, Desmond Ginobili stays with him. Pau Curry attempts a Layup. Contested by Desmond Ginobili (5.1 feet, ZONE). Pau Curry misses. FOUL! Loose ball foul on Nikola Curry during the rebound battle. [Team fouls: 3] No free throws, side out. (Nikola Curry: 1 personal fouls)

[04:49] Team_066 possession (Score: 67-58)
Kyle Wagner attempts a 3Pt. Contested by Nikola Curry (4.9 feet, MAN). KYLE WAGNER MAKES IT!
Score: 70-58

[04:33] Team_013 possession (Score: 70-58)
FOUL! Holding foul on Yao Brogdon. [Team fouls: 1] No free throws, side out. (Yao Brogdon: 1 personal fouls)

[04:18] Team_013 possession (Score: 70-58)
FOUL! Shooting foul on Yao Brogdon. Desmond Ginobili to the line for 3 free throws. [Team fouls: 2] (Yao Brogdon: 2 personal fouls)   FT 1/3: GOOD   FT 2/3: GOOD   FT 3/3: MISS Desmond Ginobili makes 2/3 from the line. Rebound secured by Yao Brogdon.
Score: 70-60

[03:59] Team_066 possession (Score: 70-60)
Brandon Reaves attempts a Midrange. Contested by Desmond Ginobili (5.4 feet, ZONE). Brandon Reaves misses. Rebound secured by Desmond Ginobili.

[03:46] Team_013 possession (Score: 70-60)
Jayson Morant makes the Midrange and draws the foul on Yao Brogdon! And-1! Jayson Morant to the line for 1. [Team fouls: 3] (Yao Brogdon: 3 personal fouls)   FT 1/1: GOOD Jayson Morant makes 1/1 from the line.
Score: 70-63

[03:34] Team_066 possession (Score: 70-63)
Yao Brogdon attempts a Midrange. Contested by Desmond Ginobili (5.4 feet, ZONE). YAO BROGDON MAKES IT!
Score: 72-63

[03:20] Team_013 possession (Score: 72-63)
Nikola Curry drives to the basket... Nikola Curry throws a bad pass! Stolen by Kyle Wagner! TURNOVER! (live ball)

[03:06] Team_066 possession (Score: 72-63)
FOUL! Shooting foul on Desmond Ginobili. Yao Brogdon to the line for 2 free throws. [Team fouls: 4] (Desmond Ginobili: 1 personal fouls)   FT 1/2: MISS   FT 2/2: GOOD Yao Brogdon makes 1/2 from the line.
Score: 73-63

[02:51] Team_013 possession (Score: 73-63)
Jayson Morant attempts a Layup. Contested by Brandon Reaves (5.5 feet, MAN). JAYSON MORANT MAKES IT! Assist: Pau Mobley
Score: 73-65

[02:35] Team_066 possession (Score: 73-65)
Jimmy Davis drives and kicks out. Pau Curry attempts a 3Pt. Contested by Pau Mobley (4.0 feet, MAN). Pau Curry misses. Rebound secured by Pau Mobley.

[02:22] Team_013 possession (Score: 73-65)
Nikola Curry drives to the basket... Nikola Curry throws a bad pass out of bounds! TURNOVER! (dead ball)

[02:22] Substitution (Team_066): Jimmy Davis OUT → Pascal Carter IN (stamina_rule2)

[02:22] Substitution (Team_066): Pau Curry OUT → Lauri LaVine IN (stamina_rule2)

[02:22] Substitution (Team_066): Yao Brogdon OUT → Cole Morant IN (stamina_rule2)

[02:22] Substitution (Team_013): Pau Mobley OUT → Chris Bryant IN (stamina_rule2)

[02:22] Substitution (Team_013): Jayson Morant OUT → Vince Nowitzki IN (stamina_rule2)

[02:22] Substitution (Team_013): Desmond Ginobili OUT → Dirk Booker IN (stamina_rule2)

[02:22] Substitution (Team_013): Nikola Curry OUT → Jayson Nowitzki IN (stamina_rule2)

[02:09] Team_066 possession (Score: 73-65)
Lauri LaVine attempts a Midrange. Contested by Chris Bryant (4.8 feet, MAN). LAURI LAVINE MAKES IT! Assist: Brandon Reaves
Score: 75-65

[01:52] Team_013 possession (Score: 75-65)
FOUL! Shooting foul on Brandon Reaves. Vince Nowitzki to the line for 3 free throws. [Team fouls: 4] (Brandon Reaves: 1 personal fouls)   FT 1/3: GOOD   FT 2/3: GOOD   FT 3/3: GOOD Vince Nowitzki makes 3/3 from the line.
Score: 75-68

[01:39] Team_066 possession (Score: 75-68)
FOUL! Reach-in foul on Jayson Nowitzki during the drive. [IN THE BONUS! 5 team fouls] Brandon Reaves to the line for 2 free throws. (Jayson Nowitzki: 1 personal fouls)   FT 1/2: GOOD   FT 2/2: GOOD Brandon Reaves makes 2/2 from the line.
Score: 77-68

[01:24] Team_013 possession (Score: 77-68)
Jayson Nowitzki drives to the basket... Jayson Nowitzki loses the ball! Stripped by Kyle Wagner! TURNOVER! (live ball)

[01:11] Team_066 possession (Score: 77-68)
Brandon Reaves attempts a 3Pt. Wide open! Vince Nowitzki is 6.4 feet away. [MAN] Brandon Reaves misses. Rebound secured by Dirk Booker.

[00:58] Team_013 possession (Score: 77-68)
Manu Smith drives, Pascal Carter stays with him. Manu Smith attempts a Layup. Wide open! Pascal Carter is 7.1 feet away. [MAN] MANU SMITH MAKES IT!
Score: 77-70

[00:41] Team_066 possession (Score: 77-70)
Lauri LaVine attempts a 3Pt. Contested by Chris Bryant (4.8 feet, MAN). Lauri LaVine misses. Rebound secured by Jayson Nowitzki.

[00:26] Team_013 possession (Score: 77-70)
Jayson Nowitzki attempts a Layup. BLOCKED BY KYLE WAGNER! Ball is loose! Rebound secured by Kyle Wagner.

[00:17] Team_066 possession (Score: 77-70)
Pascal Carter attempts a Layup. Contested by Manu Smith (5.3 feet, MAN). PASCAL CARTER MAKES IT!
Score: 79-70

[00:03] Team_013 possession (Score: 79-70)
FOUL! Reach-in foul on Cole Morant during the drive. [IN THE BONUS! 5 team fouls] Dirk Booker to the line for 2 free throws. (Cole Morant: 1 personal fouls)   FT 1/2: MISS   FT 2/2: GOOD Dirk Booker makes 1/2 from the line.
Score: 79-71

================================================================================
                              3RD QUARTER COMPLETE                              
================================================================================

3RD QUARTER SCORE: Team_066 29, Team_013 30

BOX SCORE:
================================================================================

Team_066
--------------------------------------------------------------------------------
Player                MIN  PTS  REB  AST  TO      FG   FG%      3P   3P%
--------------------------------------------------------------------------------
Kyle Wagner            26   10    2    0   0   4/4   100.0     0/0   0.0
Jimmy Davis            23    7    0    1   0   3/6    50.0     0/0   0.0
Yao Brogdon            23    3    4    2   0   2/3    66.7     0/0   0.0
Pau Curry              23    3    0    2   0   1/2    50.0     0/0   0.0
Brandon Reaves         26    2    0    3   0   1/3    33.3     0/0   0.0
Lauri LaVine           13    2    0    0   0   1/2    50.0     0/0   0.0
Pascal Carter          13    2    0    0   0   1/1   100.0     0/0   0.0

TEAM: FG: 13/21 (61.9%), 3PT: 4/8 (50.0%), REB: 6 (1 off, 5 def), AST: 8, TO: 1
TEAM FOULS: 5 [Team_013 in BONUS]


Team_013
--------------------------------------------------------------------------------
Player                MIN  PTS  REB  AST  TO      FG   FG%      3P   3P%
--------------------------------------------------------------------------------
Manu Smith             26    9    0    0   0   4/5    80.0     0/0   0.0
Pau Mobley             23    6    4    4   0   2/2   100.0     0/0   0.0
Jayson Morant          23    5    0    0   0   2/4    50.0     0/0   0.0
Nikola Curry           23    4    1    1   0   2/2   100.0     0/0   0.0
Vince Nowitzki         13    3    0    0   0   1/1   100.0     0/0   0.0
Dirk Booker            13    1    1    0   0   1/1   100.0     0/0   0.0
Desmond Ginobili       23    0    3    1   0   0/1     0.0     0/0   0.0
Jayson Nowitzki        13    0    1    0   0   0/1     0.0     0/0   0.0

TEAM: FG: 12/17 (70.6%), 3PT: 4/7 (57.1%), REB: 10 (2 off, 8 def), AST: 6, TO: 5
TEAM FOULS: 5 [Team_066 in BONUS]

================================================================================

================================================================================
                       4TH QUARTER - Team_066 vs Team_013                       
================================================================================

[12:00] Team_066 possession (Score: 79-71)
Pau Curry attempts a Layup. Contested by Pau Mobley (4.0 feet, MAN). PAU CURRY MAKES IT! Assist: Yao Brogdon
Score: 81-71

[11:42] Team_013 possession (Score: 81-71)
Nikola Curry makes the Dunk and draws the foul on Yao Brogdon! And-1! Nikola Curry to the line for 1. [Team fouls: 1] (Yao Brogdon: 1 personal fouls)   FT 1/1: MISS Nikola Curry makes 0/1 from the line. Rebound secured by Kyle Wagner.
Score: 81-73

[11:27] Team_066 possession (Score: 81-73)
Brandon Reaves drives, Desmond Ginobili stays with him. Brandon Reaves attempts a Dunk. Contested by Desmond Ginobili (5.3 feet, ZONE). Brandon Reaves misses. Rebound secured by Desmond Ginobili.

[11:14] Team_013 possession (Score: 81-73)
Pau Mobley attempts a Midrange. Contested by Pau Curry (5.5 feet, ZONE). Pau Mobley misses. Rebound secured by Brandon Reaves.

[11:03] Team_066 possession (Score: 81-73)
Yao Brogdon loses the ball! Stripped by Desmond Ginobili! TURNOVER! (live ball)

[10:48] Team_013 possession (Score: 81-73)
FOUL! Reach-in foul on Kyle Wagner during the drive. [Team fouls: 2] No free throws, side out. (Kyle Wagner: 1 personal fouls)

[10:31] Team_013 possession (Score: 81-73)
Desmond Ginobili drives and kicks out. Pau Mobley attempts a 3Pt. Contested by Pau Curry (5.6 feet, MAN). Pau Mobley misses. Rebound secured by Brandon Reaves.

[10:15] Team_066 possession (Score: 81-73)
Brandon Reaves attempts a Layup. BLOCKED BY PAU MOBLEY! Ball is loose! Offensive rebound by Yao Brogdon! Yao Brogdon kicks it out.

[09:58] Team_066 possession (Score: 81-73)
Yao Brogdon drives to the basket... Yao Brogdon throws a bad pass! Stolen by Desmond Ginobili! TURNOVER! (live ball)

[09:44] Team_013 possession (Score: 81-73)
Jayson Morant attempts a 3Pt. Contested by Pau Curry (5.9 feet, ZONE). Jayson Morant misses. Rebound secured by Kyle Wagner.

[09:31] Team_066 possession (Score: 81-73)
Jimmy Davis makes the Midrange and draws the foul on Desmond Ginobili! And-1! Jimmy Davis to the line for 1. [Team fouls: 2] (Desmond Ginobili: 2 personal fouls)   FT 1/1: MISS Jimmy Davis makes 0/1 from the line. Rebound secured by Pau Mobley.
Score: 83-73

[09:14] Team_013 possession (Score: 83-73)
Desmond Ginobili attempts a 3Pt. Contested by Pau Curry (6.0 feet, ZONE). Desmond Ginobili misses. Rebound secured by Yao Brogdon.

[09:04] Team_066 possession (Score: 83-73)
Jimmy Davis makes the Dunk and draws the foul on Manu Smith! And-1! Jimmy Davis to the line for 1. [Team fouls: 3] (Manu Smith: 1 personal fouls)   FT 1/1: GOOD Jimmy Davis makes 1/1 from the line.
Score: 86-73

[08:46] Team_013 possession (Score: 86-73)
Jayson Morant makes the 3Pt and draws the foul on Brandon Reaves! And-1! Jayson Morant to the line for 1. [Team fouls: 3] (Brandon Reaves: 1 personal fouls)   FT 1/1: GOOD Jayson Morant makes 1/1 from the line.
Score: 86-77

[08:34] Team_066 possession (Score: 86-77)
Jimmy Davis attempts a Midrange. Contested by Desmond Ginobili (5.5 feet, ZONE). JIMMY DAVIS MAKES IT! Assist: Yao Brogdon
Score: 88-77

[08:17] Team_013 possession (Score: 88-77)
Nikola Curry drives, picks up Kyle Wagner. Help arrives from Jimmy Davis! Nikola Curry attempts a Layup. Contested by Jimmy Davis (5.1 feet, MAN). Nikola Curry misses. Offensive rebound by Nikola Curry! Nikola Curry kicks it out.

[08:02] Team_013 possession (Score: 88-77)
Nikola Curry drives and kicks out. Pau Mobley attempts a Midrange. Contested by Pau Curry (5.8 feet, MAN). Pau Mobley misses. Rebound secured by Yao Brogdon.

[07:51] Team_066 possession (Score: 88-77)
Jimmy Davis attempts a 3Pt. Contested by Pau Mobley (4.5 feet, ZONE). JIMMY DAVIS MAKES IT! Assist: Pau Curry
Score: 91-77

[07:36] Team_013 possession (Score: 91-77)
Desmond Ginobili attempts a 3Pt. Wide open! Pau Curry is 6.1 feet away. [ZONE] DESMOND GINOBILI MAKES IT! Assist: Jayson Morant
Score: 91-80

[07:23] Team_066 possession (Score: 91-80)
Brandon Reaves drives and kicks out. Brandon Reaves attempts a Midrange. Contested by Jayson Morant (4.5 feet, MAN). Brandon Reaves misses. Rebound secured by Desmond Ginobili.

[07:07] Team_013 possession (Score: 91-80)
Manu Smith drives, picks up Yao Brogdon. Help arrives from Jimmy Davis! Manu Smith attempts a Dunk. Contested by Jimmy Davis (5.9 feet, ZONE). MANU SMITH MAKES IT! Assist: Pau Mobley
Score: 91-82

[06:51] Team_066 possession (Score: 91-82)
Yao Brogdon drives to the basket... FOUL! Offensive foul on Yao Brogdon! Desmond Ginobili drew the charge! [Team fouls: 4] (Yao Brogdon: 2 personal fouls) TURNOVER! (dead ball)

[06:39] Team_013 possession (Score: 91-82)
Desmond Ginobili drives to the basket... Desmond Ginobili loses the ball! Stripped by Yao Brogdon! TURNOVER! (live ball)

[06:27] Team_066 possession (Score: 91-82)
Jimmy Davis attempts a 3Pt. Contested by Pau Mobley (4.7 feet, ZONE). Jimmy Davis misses. Rebound secured by Pau Mobley.

[06:14] Team_013 possession (Score: 91-82)
Manu Smith drives, Jimmy Davis stays with him. Manu Smith attempts a Dunk. Contested by Jimmy Davis (5.0 feet, MAN). MANU SMITH MAKES IT! Assist: Jayson Morant
Score: 91-84

[05:59] Team_066 possession (Score: 91-84)
Kyle Wagner attempts a 3Pt. Contested by Nikola Curry (5.4 feet, MAN). Kyle Wagner misses. Rebound secured by Pau Mobley.

[05:48] Team_013 possession (Score: 91-84)
Jayson Morant attempts a 3Pt. Wide open! Pau Curry is 6.3 feet away. [ZONE] Jayson Morant misses. Rebound secured by Kyle Wagner.

[05:35] Team_066 possession (Score: 91-84)
Kyle Wagner drives and kicks out. Pau Curry attempts a Midrange. Contested by Pau Mobley (4.5 feet, MAN). PAU CURRY MAKES IT!
Score: 93-84

[05:18] Team_013 possession (Score: 93-84)
Desmond Ginobili makes the Dunk and draws the foul on Kyle Wagner! And-1! Desmond Ginobili to the line for 1. [BONUS: 5 team fouls] (Kyle Wagner: 2 personal fouls)   FT 1/1: GOOD Desmond Ginobili makes 1/1 from the line.
Score: 93-87

[05:01] Team_066 possession (Score: 93-87)
FOUL! Offensive foul on Yao Brogdon! Desmond Ginobili drew the charge! [Team fouls: 6] (Yao Brogdon: 3 personal fouls) TURNOVER! (dead ball)

[04:48] Team_013 possession (Score: 93-87)
Jayson Morant attempts a Layup. Wide open! Brandon Reaves is 6.4 feet away. [MAN] Jayson Morant misses. Rebound secured by Kyle Wagner.

[04:31] Team_066 possession (Score: 93-87)
Jimmy Davis attempts a Layup. Contested by Desmond Ginobili (5.9 feet, ZONE). JIMMY DAVIS MAKES IT! Assist: Kyle Wagner
Score: 95-87

[04:14] Team_013 possession (Score: 95-87)
Pau Mobley attempts a Layup. Contested by Yao Brogdon (5.9 feet, ZONE). Pau Mobley misses. Rebound secured by Kyle Wagner.

[04:01] Team_066 possession (Score: 95-87)
Yao Brogdon attempts a 3Pt. Contested by Pau Mobley (5.0 feet, ZONE). Yao Brogdon misses. Rebound secured by Pau Mobley.

[03:44] Team_013 possession (Score: 95-87)
Pau Mobley drives, picks up Pau Curry. Help arrives from Jimmy Davis! Pau Mobley attempts a Dunk. Wide open! Jimmy Davis is 6.2 feet away. [MAN] Pau Mobley misses. Rebound secured by Brandon Reaves.

[03:29] Team_066 possession (Score: 95-87)
Yao Brogdon drives, picks up Desmond Ginobili. Help arrives from Pau Mobley! Yao Brogdon attempts a Layup. Wide open! Pau Mobley is 6.0 feet away. [MAN] YAO BROGDON MAKES IT! Assist: Brandon Reaves
Score: 97-87

[03:14] Team_013 possession (Score: 97-87)
Desmond Ginobili attempts a Layup. Wide open! Yao Brogdon is 6.3 feet away. [ZONE] Desmond Ginobili misses. Rebound secured by Kyle Wagner.

[03:01] Team_066 possession (Score: 97-87)
Pau Curry attempts a 3Pt. Contested by Pau Mobley (5.0 feet, ZONE). Pau Curry misses. Offensive rebound by Kyle Wagner! Kyle Wagner kicks it out.

[02:51] Team_066 possession (Score: 97-87)
Jimmy Davis drives and kicks out. Kyle Wagner attempts a 3Pt. Wide open! Manu Smith is 6.1 feet away. [ZONE] KYLE WAGNER MAKES IT! Assist: Jimmy Davis
Score: 100-87

[02:37] Team_013 possession (Score: 100-87)
Desmond Ginobili attempts a Layup. Wide open! Yao Brogdon is 6.3 feet away. [MAN] Desmond Ginobili misses. Offensive rebound by Desmond Ginobili! Desmond Ginobili kicks it out.

[02:21] Team_013 possession (Score: 100-87)
Pau Mobley attempts a 3Pt. Wide open! Pau Curry is 6.4 feet away. [ZONE] Pau Mobley misses. Rebound secured by Brandon Reaves.

[02:01] Team_066 possession (Score: 100-87)
Kyle Wagner attempts a Midrange. Contested by Nikola Curry (5.8 feet, MAN). KYLE WAGNER MAKES IT! Assist: Jimmy Davis
Score: 102-87

[01:47] Team_013 possession (Score: 102-87)
Nikola Curry makes the Midrange and draws the foul on Kyle Wagner! And-1! Nikola Curry to the line for 1. [BONUS: 7 team fouls] (Kyle Wagner: 3 personal fouls)   FT 1/1: GOOD Nikola Curry makes 1/1 from the line.
Score: 102-90

[01:34] Team_066 possession (Score: 102-90)
Brandon Reaves attempts a 3Pt. Contested by Jayson Morant (5.6 feet, MAN). BRANDON REAVES MAKES IT! Assist: Pau Curry
Score: 105-90

[01:19] Team_013 possession (Score: 105-90)
Desmond Ginobili attempts a Midrange. Wide open! Brandon Reaves is 6.8 feet away. [ZONE] DESMOND GINOBILI MAKES IT!
Score: 105-92

[01:05] Team_066 possession (Score: 105-92)
Yao Brogdon drives, Desmond Ginobili stays with him. Yao Brogdon attempts a Dunk. Wide open! Desmond Ginobili is 6.3 feet away. [MAN] Yao Brogdon misses. Rebound secured by Pau Mobley.

[00:47] Team_013 possession (Score: 105-92)
Pau Mobley attempts a 3Pt. Wide open! Pau Curry is 6.6 feet away. [ZONE] PAU MOBLEY MAKES IT! Assist: Jayson Morant
Score: 105-95

[00:29] Team_066 possession (Score: 105-95)
Brandon Reaves drives, picks up Desmond Ginobili. Help arrives from Pau Mobley! Brandon Reaves attempts a Dunk. Wide open! Pau Mobley is 6.3 feet away. [ZONE] BRANDON REAVES MAKES IT! Assist: Jimmy Davis
Score: 107-95

[00:17] Team_013 possession (Score: 107-95)
FOUL! Reach-in foul on Yao Brogdon during the drive. [IN THE BONUS! 8 team fouls] Desmond Ginobili to the line for 2 free throws. (Yao Brogdon: 4 personal fouls)   FT 1/2: GOOD   FT 2/2: GOOD Desmond Ginobili makes 2/2 from the line.
Score: 107-97

[00:01] Team_066 possession (Score: 107-97)
Pau Curry drives to the basket... Pau Curry loses the ball! Stripped by Desmond Ginobili! TURNOVER! (live ball)

================================================================================
                              4TH QUARTER COMPLETE                              
================================================================================

4TH QUARTER SCORE: Team_066 28, Team_013 26

BOX SCORE:
================================================================================

Team_066
--------------------------------------------------------------------------------
Player                MIN  PTS  REB  AST  TO      FG   FG%      3P   3P%
--------------------------------------------------------------------------------
Jimmy Davis            35   10    0    3   0   4/6    66.7     0/0   0.0
Kyle Wagner            38    5    7    1   0   2/3    66.7     0/0   0.0
Brandon Reaves         38    5    4    1   0   2/4    50.0     0/0   0.0
Pau Curry              35    4    0    2   0   2/2   100.0     0/0   0.0
Yao Brogdon            35    2    3    2   0   1/3    33.3     0/0   0.0

TEAM: FG: 11/18 (61.1%), 3PT: 2/5 (40.0%), REB: 14 (2 off, 12 def), AST: 9, TO: 5
TEAM FOULS: 8 [Team_013 in BONUS]


Team_013
--------------------------------------------------------------------------------
Player                MIN  PTS  REB  AST  TO      FG   FG%      3P   3P%
--------------------------------------------------------------------------------
Desmond Ginobili       35   10    3    0   0   4/7    57.1     0/0   0.0
Jayson Morant          35    4    0    3   0   1/4    25.0     0/0   0.0
Manu Smith             38    4    0    0   0   2/2   100.0     0/0   0.0
Nikola Curry           35    3    1    0   0   1/3    33.3     0/0   0.0
Pau Mobley             35    3    5    1   0   1/5    20.0     0/0   0.0

TEAM: FG: 9/21 (42.9%), 3PT: 3/7 (42.9%), REB: 9 (2 off, 7 def), AST: 4, TO: 1
TEAM FOULS: 3

================================================================================

================================================================================
                               FULL GAME COMPLETE                               
================================================================================

FINAL SCORE: Team_066 107, Team_013 97

SCORING BY QUARTER:
--------------------------------------------------------------------------------
Team                     Q1     Q2     Q3     Q4    FINAL
--------------------------------------------------------------------------------
Team_066                 26     24     29     28      107
Team_013                 22     19     30     26       97
--------------------------------------------------------------------------------

FULL GAME BOX SCORE:
================================================================================

Team_066
--------------------------------------------------------------------------------
Player                MIN  PTS  REB  AST  TO      FG   FG%      3P   3P%      FT STL BLK
--------------------------------------------------------------------------------
Brandon Reaves         38   15    9    6   0   6/13   46.2   3/5    60.0   2/2     0   0
Kyle Wagner            38   20   12    2   0   8/14   57.1   2/3    66.7   2/3     2   1
Jimmy Davis            35   27    0    4   3  12/19   63.2   4/8    50.0   1/2     0   0
Pau Curry              35    9    0    5   0   3/7    42.9   1/3    33.3   0/0     0   0
Yao Brogdon            35    5   11    5   3   3/8    37.5   0/2     0.0   1/2     2   0
Pascal Carter          13    4    0    1   1   2/5    40.0   0/2     0.0   0/0     0   0
Lauri LaVine           13   11    5    1   1   3/6    50.0   2/5    40.0   3/3     0   0
Cole Morant            13    9    0    0   0   3/5    60.0   2/2   100.0   1/1     0   0
Brandon Middleton      11    4    1    0   1   2/3    66.7   0/0     0.0   4/4     0   0
Donovan Simmons        11    0    3    2   0   1/1   100.0   0/0     0.0   0/0     0   1

TEAM: FG: 43/81 (53.1%), 3PT: 14/30 (46.7%), REB: 41 (4 off, 37 def), AST: 26, TO: 9


Team_013
--------------------------------------------------------------------------------
Player                MIN  PTS  REB  AST  TO      FG   FG%      3P   3P%      FT STL BLK
--------------------------------------------------------------------------------
Manu Smith             38   13    0    2   1   8/11   72.7   1/3    33.3   0/0     0   0
Pau Mobley             35   15   14    6   0   6/13   46.2   5/8    62.5   1/2     0   1
Jayson Morant          35   13    0    3   2   5/12   41.7   1/5    20.0   2/2     0   1
Desmond Ginobili       35   16    8    2   3   5/13   38.5   1/7    14.3  11/12    3   0
Nikola Curry           35   13   12    1   1   6/9    66.7   0/1     0.0   5/6     0   0
Chris Bryant           13    5    3    1   0   1/2    50.0   0/1     0.0   0/0     1   0
Vince Nowitzki         13    5    0    0   2   3/7    42.9   1/4    25.0   5/5     0   0
Dirk Booker            13    3    6    1   0   2/4    50.0   0/2     0.0   1/2     1   0
Jayson Nowitzki        13    7    3    0   0   3/4    75.0   0/0     0.0   1/1     0   0
Gary Iverson           11    3    0    2   2   1/2    50.0   1/1   100.0   0/0     1   0

TEAM: FG: 40/77 (51.9%), 3PT: 10/32 (31.2%), REB: 46 (9 off, 37 def), AST: 18, TO: 11

================================================================================
