================================================================================
                        FULL GAME - Team_025 vs Team_076                        
================================================================================

================================================================================
                       1ST QUARTER - Team_025 vs Team_076                       
================================================================================

[12:00] Team_025 possession (Score: 0-0)
Ben Giddey attempts a Midrange. Contested by Tobias Mitchell (4.5 feet, MAN). Ben Giddey misses. FOUL! Loose ball foul on Cade Barnes during the rebound battle. [Team fouls: 1] No free throws, side out. (Cade Barnes: 1 personal fouls)

[11:43] Team_025 possession (Score: 0-0)
Cade Anthony drives to the basket... Cade Anthony loses the ball! Stripped by Cade Barnes! TURNOVER! (live ball)

[11:26] Team_076 possession (Score: 0-0)
Paul Leonard attempts a Layup. Contested by Desmond Jordan (3.7 feet, MAN). PAUL LEONARD MAKES IT!
Score: 0-2

[11:10] Team_025 possession (Score: 0-2)
Cade Anthony loses the ball! Stripped by Cade Barnes! TURNOVER! (live ball)

[10:52] Team_076 possession (Score: 0-2)
FOUL! Reach-in foul on Ben Giddey during the drive. [Team fouls: 1] No free throws, side out. (Ben Giddey: 1 personal fouls)

[10:37] Team_076 possession (Score: 0-2)
Dejounte LaVine drives to the basket... Dejounte LaVine loses the ball! Stripped by Paolo Lowry! TURNOVER! (live ball)

[10:22] Team_025 possession (Score: 0-2)
Cade Anthony makes the Layup and draws the foul on Cade Barnes! And-1! Cade Anthony to the line for 1. [Team fouls: 2] (Cade Barnes: 2 personal fouls)   FT 1/1: MISS Cade Anthony makes 0/1 from the line. Rebound secured by D'Angelo Tatum.
Score: 2-2

[10:06] Team_076 possession (Score: 2-2)
Cade Barnes drives, picks up Cade Anthony. Help arrives from Ben Giddey! Cade Barnes attempts a Dunk. Contested by Ben Giddey (4.4 feet, MAN). CADE BARNES MAKES IT! Assist: Dejounte LaVine
Score: 2-4

[09:53] Team_025 possession (Score: 2-4)
Desmond Jordan drives, Cade Barnes stays with him. Desmond Jordan attempts a Layup. Contested by Cade Barnes (3.7 feet, ZONE). DESMOND JORDAN MAKES IT! Assist: Paolo Lowry
Score: 4-4

[09:41] Team_076 possession (Score: 4-4)
Dejounte LaVine attempts a Midrange. Contested by Paolo Lowry (4.8 feet, MAN). Dejounte LaVine misses. Rebound secured by Desmond Jordan.

[09:26] Team_025 possession (Score: 4-4)
Paolo Lowry attempts a Midrange. Contested by Tobias Mitchell (4.5 feet, ZONE). PAOLO LOWRY MAKES IT! Assist: Desmond Jordan
Score: 6-4

[09:11] Team_076 possession (Score: 6-4)
Paul Leonard makes the Layup and draws the foul on Allen Embiid! And-1! Paul Leonard to the line for 1. [Team fouls: 2] (Allen Embiid: 1 personal fouls)   FT 1/1: GOOD Paul Leonard makes 1/1 from the line.
Score: 6-7

[08:54] Team_025 possession (Score: 6-7)
Cade Anthony attempts a Layup. Contested by Cade Barnes (4.2 feet, MAN). Cade Anthony misses. Offensive rebound by Allen Embiid! Allen Embiid puts it back in!
Score: 8-7

[08:39] Team_076 possession (Score: 8-7)
FOUL! Shooting foul on Cade Anthony. Dejounte LaVine to the line for 2 free throws. [Team fouls: 3] (Cade Anthony: 1 personal fouls)   FT 1/2: GOOD   FT 2/2: GOOD Dejounte LaVine makes 2/2 from the line.
Score: 8-9

[08:26] Team_025 possession (Score: 8-9)
Paolo Lowry attempts a Layup. Contested by Dejounte LaVine (5.2 feet, MAN). Paolo Lowry misses. Offensive rebound by Desmond Jordan! Desmond Jordan puts it back in!
Score: 10-9

[08:13] Team_076 possession (Score: 10-9)
Cade Barnes attempts a Midrange. Contested by Allen Embiid (3.1 feet, ZONE). Cade Barnes misses. Rebound secured by Desmond Jordan.

[08:04] Team_025 possession (Score: 10-9)
Ben Giddey attempts a Layup. Contested by Tobias Mitchell (4.5 feet, MAN). Ben Giddey misses. Rebound secured by Cade Barnes.

[07:47] Team_076 possession (Score: 10-9)
Cade Barnes attempts a 3Pt. Contested by Cade Anthony (4.4 feet, MAN). CADE BARNES MAKES IT! Assist: Paul Leonard
Score: 10-12

[07:35] Team_025 possession (Score: 10-12)
Desmond Jordan attempts a 3Pt. Contested by Paul Leonard (5.2 feet, MAN). Desmond Jordan misses. Rebound secured by D'Angelo Tatum.

[07:23] Team_076 possession (Score: 10-12)
Paul Leonard attempts a 3Pt. Contested by Ben Giddey (4.0 feet, ZONE). Paul Leonard misses. Rebound secured by Desmond Jordan.

[07:09] Team_025 possession (Score: 10-12)
Desmond Jordan attempts a 3Pt. Contested by Cade Barnes (3.7 feet, ZONE). Desmond Jordan misses. Rebound secured by D'Angelo Tatum.

[06:58] Team_076 possession (Score: 10-12)
FOUL! Shooting foul on Allen Embiid. D'Angelo Tatum to the line for 2 free throws. [Team fouls: 4] (Allen Embiid: 2 personal fouls)   FT 1/2: GOOD   FT 2/2: GOOD D'Angelo Tatum makes 2/2 from the line.
Score: 10-14

[06:39] Team_025 possession (Score: 10-14)
Desmond Jordan attempts a Midrange. Contested by Dejounte LaVine (5.0 feet, ZONE). DESMOND JORDAN MAKES IT!
Score: 12-14

[06:25] Team_076 possession (Score: 12-14)
Tobias Mitchell attempts a 3Pt. Contested by Ben Giddey (4.0 feet, ZONE). Tobias Mitchell misses. Rebound secured by Desmond Jordan.

[06:13] Team_025 possession (Score: 12-14)
Ben Giddey attempts a 3Pt. Contested by Cade Barnes (4.0 feet, ZONE). BEN GIDDEY MAKES IT! Assist: Desmond Jordan
Score: 15-14

[05:57] Team_076 possession (Score: 15-14)
FOUL! Shooting foul on Desmond Jordan. Paul Leonard to the line for 2 free throws. [BONUS: 5 team fouls] (Desmond Jordan: 1 personal fouls)   FT 1/2: GOOD   FT 2/2: GOOD Paul Leonard makes 2/2 from the line.
Score: 15-16

[05:42] Team_025 possession (Score: 15-16)
Allen Embiid attempts a 3Pt. Contested by D'Angelo Tatum (3.8 feet, MAN). Allen Embiid misses. Rebound secured by Cade Barnes.

[05:28] Team_076 possession (Score: 15-16)
D'Angelo Tatum drives to the basket... D'Angelo Tatum loses the ball! Stripped by Allen Embiid! TURNOVER! (live ball)

[05:13] Team_025 possession (Score: 15-16)
Allen Embiid throws a bad pass out of bounds! TURNOVER! (dead ball)

[05:04] Team_076 possession (Score: 15-16)
Cade Barnes drives, Cade Anthony stays with him. Cade Barnes attempts a Dunk. Contested by Cade Anthony (4.4 feet, MAN). CADE BARNES MAKES IT! Assist: Dejounte LaVine
Score: 15-18

[04:52] Team_025 possession (Score: 15-18)
Cade Anthony attempts a 3Pt. Contested by Cade Barnes (4.2 feet, ZONE). Cade Anthony misses. Rebound secured by D'Angelo Tatum.

[04:35] Team_076 possession (Score: 15-18)
Tobias Mitchell attempts a Layup. BLOCKED BY BEN GIDDEY! Ball is loose! Rebound secured by Allen Embiid.

[04:19] Team_025 possession (Score: 15-18)
FOUL! Shooting foul on Dejounte LaVine. Paolo Lowry to the line for 2 free throws. [Team fouls: 3] (Dejounte LaVine: 1 personal fouls)   FT 1/2: GOOD   FT 2/2: GOOD Paolo Lowry makes 2/2 from the line.
Score: 17-18

[04:02] Team_076 possession (Score: 17-18)
D'Angelo Tatum drives, picks up Allen Embiid. Help arrives from Ben Giddey! D'Angelo Tatum attempts a Layup. Contested by Ben Giddey (3.3 feet, MAN). D'Angelo Tatum misses. Rebound secured by Allen Embiid.

[03:47] Team_025 possession (Score: 17-18)
Allen Embiid makes the Layup and draws the foul on Tobias Mitchell! And-1! Allen Embiid to the line for 1. [Team fouls: 4] (Tobias Mitchell: 1 personal fouls)   FT 1/1: GOOD Allen Embiid makes 1/1 from the line.
Score: 20-18

[03:32] Team_076 possession (Score: 20-18)
Cade Barnes makes the Layup and draws the foul on Allen Embiid! And-1! Cade Barnes to the line for 1. [BONUS: 6 team fouls] (Allen Embiid: 3 personal fouls)   FT 1/1: MISS Cade Barnes makes 0/1 from the line. Rebound secured by Allen Embiid.
Score: 20-20

[03:16] Team_025 possession (Score: 20-20)
Ben Giddey makes the Layup and draws the foul on Tobias Mitchell! And-1! Ben Giddey to the line for 1. [BONUS: 5 team fouls] (Tobias Mitchell: 2 personal fouls)   FT 1/1: GOOD Ben Giddey makes 1/1 from the line.
Score: 23-20

[02:59] Team_076 possession (Score: 23-20)
FOUL! Holding foul on Cade Anthony. [IN THE BONUS! 7 team fouls] Cade Barnes to the line for 2 free throws. (Cade Anthony: 2 personal fouls)   FT 1/2: GOOD   FT 2/2: GOOD Cade Barnes makes 2/2 from the line.
Score: 23-22

[02:49] Team_025 possession (Score: 23-22)
Ben Giddey attempts a Layup. BLOCKED BY TOBIAS MITCHELL! Ball is loose! Offensive rebound by Desmond Jordan! Desmond Jordan kicks it out.

[02:36] Team_025 possession (Score: 23-22)
Ben Giddey attempts a 3Pt. Contested by Tobias Mitchell (4.8 feet, MAN). Ben Giddey misses. Offensive rebound by Allen Embiid! Allen Embiid puts it back in!
Score: 25-22

[02:20] Team_076 possession (Score: 25-22)
Tobias Mitchell commits a violation (traveling/carry)! TURNOVER! (dead ball)

[02:20] Substitution (Team_025): Paolo Lowry OUT → LeBron Griffin IN (stamina_rule2)

[02:20] Substitution (Team_025): Ben Giddey OUT → Dirk Gilgeous-Alexander IN (stamina_rule2)

[02:20] Substitution (Team_025): Desmond Jordan OUT → Immanuel LaVine IN (stamina_rule2)

[02:20] Substitution (Team_025): Allen Embiid OUT → Nikola Lillard IN (stamina_rule2)

[02:20] Substitution (Team_076): Dejounte LaVine OUT → Pascal Lowry IN (stamina_rule2)

[02:20] Substitution (Team_076): Tobias Mitchell OUT → Jalen Poole IN (stamina_rule2)

[02:20] Substitution (Team_076): Paul Leonard OUT → Vince Lowry IN (stamina_rule2)

[02:20] Substitution (Team_076): Cade Barnes OUT → Kevin Nowitzki IN (stamina_rule2)

[02:20] Substitution (Team_076): D'Angelo Tatum OUT → Jordan Doncic IN (stamina_rule2)

[02:03] Team_025 possession (Score: 25-22)
Dirk Gilgeous-Alexander drives to the basket... Dirk Gilgeous-Alexander loses the ball! Stripped by Jordan Doncic! TURNOVER! (live ball)

[01:49] Team_076 possession (Score: 25-22)
Jordan Doncic attempts a Layup. Contested by Cade Anthony (3.9 feet, ZONE). JORDAN DONCIC MAKES IT!
Score: 25-24

[01:36] Team_025 possession (Score: 25-24)
Cade Anthony attempts a Midrange. Contested by Kevin Nowitzki (4.9 feet, MAN). Cade Anthony misses. Rebound secured by Kevin Nowitzki.

[01:21] Team_076 possession (Score: 25-24)
Kevin Nowitzki throws a bad pass out of bounds! TURNOVER! (dead ball)

[01:21] Substitution (Team_025): Cade Anthony OUT → Damian Adebayo IN (stamina_rule2)

[01:09] Team_025 possession (Score: 25-24)
Nikola Lillard drives, picks up Jordan Doncic. Help arrives from Jalen Poole! Nikola Lillard attempts a Dunk. Contested by Jalen Poole (3.5 feet, MAN). Nikola Lillard misses. Rebound secured by Vince Lowry.

[00:54] Team_076 possession (Score: 25-24)
Pascal Lowry drives and kicks out. FOUL! Shooting foul on Immanuel LaVine. Vince Lowry to the line for 2 free throws. [BONUS: 8 team fouls] (Immanuel LaVine: 1 personal fouls)   FT 1/2: MISS   FT 2/2: GOOD Vince Lowry makes 1/2 from the line.
Score: 25-25

[00:35] Team_025 possession (Score: 25-25)
Damian Adebayo attempts a 3Pt. Wide open! Pascal Lowry is 6.2 feet away. [ZONE] Damian Adebayo misses. Rebound secured by Jordan Doncic.

[00:22] Team_076 possession (Score: 25-25)
Jordan Doncic drives and kicks out. Jalen Poole attempts a Midrange. Contested by Dirk Gilgeous-Alexander (5.6 feet, MAN). Jalen Poole misses. Offensive rebound by Kevin Nowitzki! Kevin Nowitzki kicks it out.

[00:07] Team_076 possession (Score: 25-25)
Jalen Poole attempts a 3Pt. Contested by Dirk Gilgeous-Alexander (6.0 feet, MAN). Jalen Poole misses. Rebound secured by Immanuel LaVine.

================================================================================
                              1ST QUARTER COMPLETE                              
================================================================================

1ST QUARTER SCORE: Team_025 25, Team_076 25

BOX SCORE:
================================================================================

Team_025
--------------------------------------------------------------------------------
Player                MIN  PTS  REB  AST  TO      FG   FG%      3P   3P%
--------------------------------------------------------------------------------
Allen Embiid           10    7    6    0   0   3/4    75.0     0/0   0.0
Desmond Jordan         10    6    6    2   0   3/5    60.0     0/0   0.0
Ben Giddey             10    6    0    0   0   2/3    66.7     0/0   0.0
Paolo Lowry            10    4    0    1   0   2/2   100.0     0/0   0.0
Cade Anthony           11    0    0    0   0   0/3     0.0     0/0   0.0
Nikola Lillard          2    0    0    0   0   0/1     0.0     0/0   0.0
Damian Adebayo          1    0    0    0   0   0/1     0.0     0/0   0.0
Immanuel LaVine         2    0    1    0   0   0/0     0.0     0/0   0.0

TEAM: FG: 10/19 (52.6%), 3PT: 2/7 (28.6%), REB: 13 (5 off, 8 def), AST: 3, TO: 4
TEAM FOULS: 8 [Team_076 in BONUS]


Team_076
--------------------------------------------------------------------------------
Player                MIN  PTS  REB  AST  TO      FG   FG%      3P   3P%
--------------------------------------------------------------------------------
Cade Barnes            10    9    2    0   0   4/6    66.7     0/0   0.0
Paul Leonard           10    7    0    1   0   3/4    75.0     0/0   0.0
D'Angelo Tatum         10    2    4    0   0   1/2    50.0     0/0   0.0
Dejounte LaVine        10    2    0    2   0   1/2    50.0     0/0   0.0
Jordan Doncic           2    2    1    0   0   1/1   100.0     0/0   0.0
Vince Lowry             2    1    1    0   0   1/1   100.0     0/0   0.0
Tobias Mitchell        10    0    0    0   0   0/2     0.0     0/0   0.0
Kevin Nowitzki          2    0    2    0   0   0/0     0.0     0/0   0.0
Jalen Poole             2    0    0    0   0   0/1     0.0     0/0   0.0

TEAM: FG: 11/19 (57.9%), 3PT: 1/4 (25.0%), REB: 10 (1 off, 9 def), AST: 3, TO: 4
TEAM FOULS: 5 [Team_025 in BONUS]

================================================================================

================================================================================
                       2ND QUARTER - Team_025 vs Team_076                       
================================================================================

[12:00] Team_025 possession (Score: 25-25)
Cade Anthony drives and kicks out. Desmond Jordan attempts a 3Pt. Contested by Cade Barnes (3.5 feet, ZONE). Desmond Jordan misses. FOUL! Loose ball foul on Cade Barnes during the rebound battle. [Team fouls: 1] No free throws, side out. (Cade Barnes: 1 personal fouls)

[11:42] Team_025 possession (Score: 25-25)
FOUL! Reach-in foul on Cade Barnes during the drive. [Team fouls: 2] No free throws, side out. (Cade Barnes: 2 personal fouls)

[11:27] Team_025 possession (Score: 25-25)
Allen Embiid attempts a 3Pt. Contested by Cade Barnes (3.7 feet, ZONE). Allen Embiid misses. Rebound secured by Cade Barnes.

[11:09] Team_076 possession (Score: 25-25)
Dejounte LaVine drives to the basket... FOUL! Offensive foul on Dejounte LaVine! Paolo Lowry drew the charge! [Team fouls: 3] (Dejounte LaVine: 1 personal fouls) TURNOVER! (dead ball)

[10:56] Team_025 possession (Score: 25-25)
Desmond Jordan makes the 3Pt and draws the foul on Paul Leonard! And-1! Desmond Jordan to the line for 1. [Team fouls: 4] (Paul Leonard: 1 personal fouls)   FT 1/1: GOOD Desmond Jordan makes 1/1 from the line.
Score: 29-25

[10:42] Team_076 possession (Score: 29-25)
Cade Barnes drives, picks up Cade Anthony. Help arrives from Ben Giddey! Cade Barnes attempts a Layup. Contested by Ben Giddey (4.6 feet, MAN). CADE BARNES MAKES IT!
Score: 29-27

[10:31] Team_025 possession (Score: 29-27)
Cade Anthony attempts a Midrange. Contested by Cade Barnes (4.3 feet, ZONE). CADE ANTHONY MAKES IT!
Score: 31-27

[10:16] Team_076 possession (Score: 31-27)
Paul Leonard attempts a 3Pt. Contested by Ben Giddey (4.1 feet, ZONE). Paul Leonard misses. Rebound secured by Cade Anthony.

[10:03] Team_025 possession (Score: 31-27)
Ben Giddey attempts a Midrange. Contested by Tobias Mitchell (4.7 feet, MAN). BEN GIDDEY MAKES IT!
Score: 33-27

[09:52] Team_076 possession (Score: 33-27)
Dejounte LaVine attempts a Midrange. Contested by Paolo Lowry (5.0 feet, MAN). DEJOUNTE LAVINE MAKES IT! Assist: D'Angelo Tatum
Score: 33-29

[09:37] Team_025 possession (Score: 33-29)
Cade Anthony makes the Midrange and draws the foul on Cade Barnes! And-1! Cade Anthony to the line for 1. [BONUS: 5 team fouls] (Cade Barnes: 3 personal fouls)   FT 1/1: GOOD Cade Anthony makes 1/1 from the line.
Score: 36-29

[09:22] Team_076 possession (Score: 36-29)
FOUL! Reach-in foul on Cade Anthony during the drive. [Team fouls: 1] No free throws, side out. (Cade Anthony: 1 personal fouls)

[09:07] Team_076 possession (Score: 36-29)
Cade Barnes drives and kicks out. Paul Leonard attempts a 3Pt. Contested by Desmond Jordan (3.6 feet, MAN). Paul Leonard misses. Rebound secured by Allen Embiid.

[08:53] Team_025 possession (Score: 36-29)
Desmond Jordan attempts a 3Pt. Contested by Paul Leonard (5.5 feet, MAN). Desmond Jordan misses. Rebound secured by Tobias Mitchell.

[08:42] Team_076 possession (Score: 36-29)
Tobias Mitchell drives to the basket... Tobias Mitchell throws a bad pass! Stolen by Ben Giddey! TURNOVER! (live ball)

[08:31] Team_025 possession (Score: 36-29)
Paolo Lowry drives, picks up Cade Barnes. Help arrives from Tobias Mitchell! Paolo Lowry attempts a Dunk. Contested by Tobias Mitchell (4.2 feet, ZONE). PAOLO LOWRY MAKES IT! Assist: Cade Anthony
Score: 38-29

[08:16] Team_076 possession (Score: 38-29)
FOUL! Holding foul on Ben Giddey. [Team fouls: 2] No free throws, side out. (Ben Giddey: 1 personal fouls)

[08:01] Team_076 possession (Score: 38-29)
Paul Leonard drives, Desmond Jordan stays with him. Paul Leonard attempts a Layup. Contested by Desmond Jordan (4.1 feet, MAN). PAUL LEONARD MAKES IT!
Score: 38-31

[07:45] Team_025 possession (Score: 38-31)
Cade Anthony attempts a 3Pt. Contested by Cade Barnes (4.6 feet, ZONE). Cade Anthony misses. Rebound secured by D'Angelo Tatum.

[07:31] Team_076 possession (Score: 38-31)
Tobias Mitchell drives to the basket... Tobias Mitchell loses the ball! Stripped by Ben Giddey! TURNOVER! (live ball)

[07:12] Team_025 possession (Score: 38-31)
Allen Embiid attempts a 3Pt. Contested by Cade Barnes (4.1 feet, ZONE). Allen Embiid misses. Offensive rebound by Allen Embiid! Allen Embiid puts it back in!
Score: 40-31

[06:58] Team_076 possession (Score: 40-31)
D'Angelo Tatum drives and kicks out. Cade Barnes attempts a Midrange. Contested by Desmond Jordan (3.9 feet, ZONE). Cade Barnes misses. Rebound secured by Desmond Jordan.

[06:44] Team_025 possession (Score: 40-31)
Allen Embiid attempts a Layup. Contested by D'Angelo Tatum (4.3 feet, ZONE). ALLEN EMBIID MAKES IT! Assist: Cade Anthony
Score: 42-31

[06:29] Team_076 possession (Score: 42-31)
D'Angelo Tatum drives and kicks out. D'Angelo Tatum attempts a 3Pt. Contested by Allen Embiid (3.7 feet, MAN). D'ANGELO TATUM MAKES IT! Assist: Paul Leonard
Score: 42-34

[06:16] Team_025 possession (Score: 42-34)
Desmond Jordan attempts a Midrange. Contested by D'Angelo Tatum (4.4 feet, ZONE). Desmond Jordan misses. Rebound secured by Cade Barnes.

[05:58] Team_076 possession (Score: 42-34)
FOUL! Offensive foul on Paul Leonard! Desmond Jordan drew the charge! [Team fouls: 6] (Paul Leonard: 2 personal fouls) TURNOVER! (dead ball)

[05:47] Team_025 possession (Score: 42-34)
FOUL! Shooting foul on Cade Barnes. Cade Anthony to the line for 2 free throws. [BONUS: 7 team fouls] (Cade Barnes: 4 personal fouls)   FT 1/2: GOOD   FT 2/2: GOOD Cade Anthony makes 2/2 from the line.
Score: 44-34

[05:30] Team_076 possession (Score: 44-34)
Dejounte LaVine attempts a 3Pt. Contested by Paolo Lowry (5.4 feet, MAN). Dejounte LaVine misses. Offensive rebound by D'Angelo Tatum! D'Angelo Tatum kicks it out.

[05:14] Team_076 possession (Score: 44-34)
D'Angelo Tatum drives to the basket... D'Angelo Tatum loses the ball! Stripped by Allen Embiid! TURNOVER! (live ball)

[05:04] Team_025 possession (Score: 44-34)
FOUL! Holding foul on Dejounte LaVine. [IN THE BONUS! 8 team fouls] Paolo Lowry to the line for 2 free throws. (Dejounte LaVine: 2 personal fouls)   FT 1/2: MISS   FT 2/2: GOOD Paolo Lowry makes 1/2 from the line.
Score: 45-34

[04:49] Team_076 possession (Score: 45-34)
Tobias Mitchell attempts a 3Pt. Contested by Ben Giddey (4.7 feet, ZONE). Tobias Mitchell misses. Rebound secured by Desmond Jordan.

[04:34] Team_025 possession (Score: 45-34)
Paolo Lowry attempts a 3Pt. Contested by Cade Barnes (4.7 feet, ZONE). Paolo Lowry misses. Offensive rebound by Allen Embiid! Allen Embiid's putback is no good. Rebound secured by Tobias Mitchell.

[04:18] Team_076 possession (Score: 45-34)
Cade Barnes attempts a Layup. Contested by Cade Anthony (5.3 feet, MAN). CADE BARNES MAKES IT! Assist: D'Angelo Tatum
Score: 45-36

[03:59] Team_025 possession (Score: 45-36)
Cade Anthony attempts a Layup. BLOCKED BY CADE BARNES! Ball is loose! Offensive rebound by Allen Embiid! Allen Embiid kicks it out.

[03:47] Team_025 possession (Score: 45-36)
Desmond Jordan attempts a Midrange. Contested by Tobias Mitchell (5.2 feet, ZONE). Desmond Jordan misses. Rebound secured by Tobias Mitchell.

[03:31] Team_076 possession (Score: 45-36)
D'Angelo Tatum drives and kicks out. Cade Barnes attempts a 3Pt. Contested by Cade Anthony (5.3 feet, MAN). Cade Barnes misses. Rebound secured by Desmond Jordan.

[03:20] Team_025 possession (Score: 45-36)
FOUL! Reach-in foul on Cade Barnes during the drive. [IN THE BONUS! 10 team fouls] Desmond Jordan to the line for 2 free throws. (Cade Barnes: 5 personal fouls)   FT 1/2: GOOD   FT 2/2: GOOD Desmond Jordan makes 2/2 from the line.
Score: 47-36

[03:05] Team_076 possession (Score: 47-36)
Paul Leonard throws a bad pass out of bounds! TURNOVER! (dead ball)

[03:05] Substitution (Team_025): Paolo Lowry OUT → LeBron Griffin IN (stamina_rule2)

[03:05] Substitution (Team_025): Ben Giddey OUT → Dirk Gilgeous-Alexander IN (stamina_rule2)

[03:05] Substitution (Team_025): Desmond Jordan OUT → Immanuel LaVine IN (stamina_rule2)

[03:05] Substitution (Team_025): Cade Anthony OUT → Damian Adebayo IN (stamina_rule2)

[03:05] Substitution (Team_025): Allen Embiid OUT → Nikola Lillard IN (stamina_rule2)

[03:05] Substitution (Team_076): Dejounte LaVine OUT → Pascal Lowry IN (stamina_rule2)

[03:05] Substitution (Team_076): Tobias Mitchell OUT → Jalen Poole IN (stamina_rule2)

[03:05] Substitution (Team_076): Paul Leonard OUT → Vince Lowry IN (stamina_rule2)

[03:05] Substitution (Team_076): Cade Barnes OUT → Kevin Nowitzki IN (stamina_rule2)

[03:05] Substitution (Team_076): D'Angelo Tatum OUT → Jordan Doncic IN (stamina_rule2)

[02:53] Team_025 possession (Score: 47-36)
LeBron Griffin attempts a Midrange. Wide open! Pascal Lowry is 6.2 feet away. [MAN] LEBRON GRIFFIN MAKES IT! Assist: Dirk Gilgeous-Alexander
Score: 49-36

[02:37] Team_076 possession (Score: 49-36)
Pascal Lowry attempts a 3Pt. Contested by LeBron Griffin (4.3 feet, MAN). Pascal Lowry misses. Offensive rebound by Kevin Nowitzki! Kevin Nowitzki kicks it out.

[02:28] Team_076 possession (Score: 49-36)
Jordan Doncic makes the Layup and draws the foul on Nikola Lillard! And-1! Jordan Doncic to the line for 1. [Team fouls: 3] (Nikola Lillard: 1 personal fouls)   FT 1/1: MISS Jordan Doncic makes 0/1 from the line. Rebound secured by Immanuel LaVine.
Score: 49-38

[02:13] Team_025 possession (Score: 49-38)
Nikola Lillard drives and kicks out. LeBron Griffin attempts a Midrange. Contested by Vince Lowry (4.2 feet, ZONE). LeBron Griffin misses. Offensive rebound by Immanuel LaVine! Immanuel LaVine kicks it out.

[01:55] Team_025 possession (Score: 49-38)
LeBron Griffin attempts a 3Pt. Contested by Vince Lowry (4.1 feet, ZONE). LeBron Griffin misses. Rebound secured by Vince Lowry.

[01:45] Team_076 possession (Score: 49-38)
Pascal Lowry attempts a 3Pt. Contested by LeBron Griffin (4.3 feet, MAN). PASCAL LOWRY MAKES IT! Assist: Jalen Poole
Score: 49-41

[01:28] Team_025 possession (Score: 49-41)
FOUL! Shooting foul on Jalen Poole. Dirk Gilgeous-Alexander to the line for 2 free throws. [BONUS: 11 team fouls] (Jalen Poole: 1 personal fouls)   FT 1/2: GOOD   FT 2/2: GOOD Dirk Gilgeous-Alexander makes 2/2 from the line.
Score: 51-41

[01:12] Team_076 possession (Score: 51-41)
Jalen Poole throws a bad pass out of bounds! TURNOVER! (dead ball)

[00:58] Team_025 possession (Score: 51-41)
Nikola Lillard drives to the basket... FOUL! Offensive foul on Nikola Lillard! Jordan Doncic drew the charge! [Team fouls: 4] (Nikola Lillard: 2 personal fouls) TURNOVER! (dead ball)

[00:44] Team_076 possession (Score: 51-41)
FOUL! Offensive foul on Pascal Lowry! LeBron Griffin drew the charge! [Team fouls: 12] (Pascal Lowry: 1 personal fouls) TURNOVER! (dead ball)

[00:30] Team_025 possession (Score: 51-41)
Damian Adebayo attempts a 3Pt. Contested by Jalen Poole (5.4 feet, ZONE). Damian Adebayo misses. Offensive rebound by Immanuel LaVine! Immanuel LaVine kicks it out.

[00:16] Team_025 possession (Score: 51-41)
LeBron Griffin attempts a 3Pt. Wide open! Pascal Lowry is 6.2 feet away. [MAN] LEBRON GRIFFIN MAKES IT! Assist: Damian Adebayo
Score: 54-41

[00:04] Team_076 possession (Score: 54-41)
Pascal Lowry attempts a Midrange. Contested by LeBron Griffin (4.3 feet, MAN). PASCAL LOWRY MAKES IT!
Score: 54-43

================================================================================
                              2ND QUARTER COMPLETE                              
================================================================================

2ND QUARTER SCORE: Team_025 29, Team_076 18

BOX SCORE:
================================================================================

Team_025
--------------------------------------------------------------------------------
Player                MIN  PTS  REB  AST  TO      FG   FG%      3P   3P%
--------------------------------------------------------------------------------
Cade Anthony           20    7    1    2   0   3/4    75.0     0/0   0.0
Desmond Jordan         19    6    3    0   0   2/5    40.0     0/0   0.0
LeBron Griffin          5    5    0    0   0   2/3    66.7     0/0   0.0
Allen Embiid           19    4    4    0   0   2/3    66.7     0/0   0.0
Paolo Lowry            19    3    0    0   0   2/3    66.7     0/0   0.0
Ben Giddey             19    2    0    0   0   1/1   100.0     0/0   0.0
Dirk Gilgeous-Alexander    5    2    0    1   0   1/1   100.0     0/0   0.0
Immanuel LaVine         5    0    3    0   0   0/0     0.0     0/0   0.0
Damian Adebayo          4    0    0    1   0   0/0     0.0     0/0   0.0

TEAM: FG: 13/20 (65.0%), 3PT: 3/8 (37.5%), REB: 12 (6 off, 6 def), AST: 4, TO: 1
TEAM FOULS: 4


Team_076
--------------------------------------------------------------------------------
Player                MIN  PTS  REB  AST  TO      FG   FG%      3P   3P%
--------------------------------------------------------------------------------
Pascal Lowry            5    5    0    0   0   2/2   100.0     0/0   0.0
Cade Barnes            19    4    2    0   0   2/3    66.7     0/0   0.0
D'Angelo Tatum         19    3    2    2   0   1/3    33.3     0/0   0.0
Paul Leonard           19    2    0    1   0   1/2    50.0     0/0   0.0
Dejounte LaVine        19    2    0    0   0   1/1   100.0     0/0   0.0
Tobias Mitchell        19    0    3    0   0   0/1     0.0     0/0   0.0
Kevin Nowitzki          5    0    1    0   0   0/0     0.0     0/0   0.0
Jordan Doncic           5    0    0    0   0   0/1     0.0     0/0   0.0
Vince Lowry             5    0    1    0   0   0/0     0.0     0/0   0.0
Jalen Poole             5    0    0    1   0   0/0     0.0     0/0   0.0

TEAM: FG: 7/13 (53.8%), 3PT: 1/3 (33.3%), REB: 8 (2 off, 6 def), AST: 4, TO: 8
TEAM FOULS: 12 [Team_025 in BONUS]

================================================================================

================================================================================
                       3RD QUARTER - Team_025 vs Team_076                       
================================================================================

[12:00] Team_025 possession (Score: 54-43)
Paolo Lowry drives and kicks out. FOUL! Shooting foul on Dejounte LaVine. Paolo Lowry to the line for 2 free throws. [Team fouls: 1] (Dejounte LaVine: 1 personal fouls)   FT 1/2: MISS   FT 2/2: GOOD Paolo Lowry makes 1/2 from the line.
Score: 55-43

[11:46] Team_076 possession (Score: 55-43)
FOUL! Holding foul on Paolo Lowry. [Team fouls: 1] No free throws, side out. (Paolo Lowry: 1 personal fouls)

[11:31] Team_076 possession (Score: 55-43)
FOUL! Holding foul on Desmond Jordan. [Team fouls: 2] No free throws, side out. (Desmond Jordan: 1 personal fouls)

[11:14] Team_076 possession (Score: 55-43)
Cade Barnes makes the Midrange and draws the foul on Cade Anthony! And-1! Cade Barnes to the line for 1. [Team fouls: 3] (Cade Anthony: 1 personal fouls)   FT 1/1: GOOD Cade Barnes makes 1/1 from the line.
Score: 55-46

[11:00] Team_025 possession (Score: 55-46)
Desmond Jordan drives, picks up Cade Barnes. Help arrives from Tobias Mitchell! Desmond Jordan attempts a Layup. Contested by Tobias Mitchell (3.7 feet, ZONE). DESMOND JORDAN MAKES IT! Assist: Ben Giddey
Score: 57-46

[10:49] Team_076 possession (Score: 57-46)
Paul Leonard attempts a 3Pt. Contested by Ben Giddey (4.0 feet, ZONE). Paul Leonard misses. Rebound secured by Cade Anthony.

[10:31] Team_025 possession (Score: 57-46)
Ben Giddey drives and kicks out. Cade Anthony attempts a 3Pt. Contested by Cade Barnes (3.5 feet, MAN). Cade Anthony misses. Offensive rebound by Allen Embiid! Allen Embiid puts it back in!
Score: 59-46

[10:16] Team_076 possession (Score: 59-46)
Paul Leonard attempts a Layup. Contested by Desmond Jordan (3.7 feet, MAN). Paul Leonard misses. Rebound secured by Cade Anthony.

[10:04] Team_025 possession (Score: 59-46)
Desmond Jordan drives and kicks out. Cade Anthony attempts a 3Pt. Contested by Cade Barnes (3.5 feet, MAN). Cade Anthony misses. Rebound secured by D'Angelo Tatum.

[09:46] Team_076 possession (Score: 59-46)
Paul Leonard attempts a Layup. Contested by Desmond Jordan (3.7 feet, MAN). Paul Leonard misses. Rebound secured by Allen Embiid.

[09:30] Team_025 possession (Score: 59-46)
Desmond Jordan attempts a 3Pt. Contested by Paul Leonard (5.2 feet, MAN). DESMOND JORDAN MAKES IT! Assist: Allen Embiid
Score: 62-46

[09:16] Team_076 possession (Score: 62-46)
Tobias Mitchell loses control! Ball rolls out of bounds! TURNOVER! (dead ball)

[09:03] Team_025 possession (Score: 62-46)
Ben Giddey makes the Layup and draws the foul on Tobias Mitchell! And-1! Ben Giddey to the line for 1. [Team fouls: 2] (Tobias Mitchell: 1 personal fouls)   FT 1/1: GOOD Ben Giddey makes 1/1 from the line.
Score: 65-46

[08:53] Team_076 possession (Score: 65-46)
Cade Barnes attempts a Midrange. Contested by Cade Anthony (4.4 feet, ZONE). Cade Barnes misses. Rebound secured by Cade Anthony.

[08:42] Team_025 possession (Score: 65-46)
Paolo Lowry makes the Midrange and draws the foul on Dejounte LaVine! And-1! Paolo Lowry to the line for 1. [Team fouls: 3] (Dejounte LaVine: 2 personal fouls)   FT 1/1: GOOD Paolo Lowry makes 1/1 from the line.
Score: 68-46

[08:24] Team_076 possession (Score: 68-46)
Cade Barnes attempts a 3Pt. Contested by Paolo Lowry (5.1 feet, ZONE). Cade Barnes misses. Offensive rebound by Cade Barnes! Cade Barnes kicks it out.

[08:07] Team_076 possession (Score: 68-46)
Paul Leonard attempts a 3Pt. Contested by Desmond Jordan (3.7 feet, MAN). Paul Leonard misses. Rebound secured by Desmond Jordan.

[07:52] Team_025 possession (Score: 68-46)
FOUL! Shooting foul on Cade Barnes. Cade Anthony to the line for 2 free throws. [Team fouls: 4] (Cade Barnes: 1 personal fouls)   FT 1/2: GOOD   FT 2/2: GOOD Cade Anthony makes 2/2 from the line.
Score: 70-46

[07:38] Team_076 possession (Score: 70-46)
Paul Leonard attempts a 3Pt. Contested by Desmond Jordan (3.7 feet, MAN). Paul Leonard misses. Rebound secured by Desmond Jordan.

[07:19] Team_025 possession (Score: 70-46)
Desmond Jordan attempts a 3Pt. BLOCKED BY CADE BARNES! Ball is loose! Offensive rebound by Allen Embiid! Allen Embiid kicks it out.

[07:08] Team_025 possession (Score: 70-46)
Desmond Jordan attempts a 3Pt. Contested by Cade Barnes (3.7 feet, ZONE). Desmond Jordan misses. Rebound secured by Tobias Mitchell.

[06:53] Team_076 possession (Score: 70-46)
Paul Leonard attempts a 3Pt. Contested by Ben Giddey (4.0 feet, ZONE). Paul Leonard misses. Rebound secured by Desmond Jordan.

[06:37] Team_025 possession (Score: 70-46)
Desmond Jordan drives to the basket... Desmond Jordan commits a violation (traveling/carry)! TURNOVER! (dead ball)

[06:24] Team_076 possession (Score: 70-46)
Cade Barnes drives, Allen Embiid stays with him. Cade Barnes attempts a Dunk. Contested by Allen Embiid (3.1 feet, ZONE). CADE BARNES MAKES IT! Assist: Tobias Mitchell
Score: 70-48

[06:11] Team_025 possession (Score: 70-48)
Desmond Jordan attempts a Layup. Contested by Paul Leonard (5.2 feet, MAN). DESMOND JORDAN MAKES IT! Assist: Ben Giddey
Score: 72-48

[05:54] Team_076 possession (Score: 72-48)
FOUL! Shooting foul on Paolo Lowry. Paul Leonard to the line for 3 free throws. [Team fouls: 4] (Paolo Lowry: 2 personal fouls)   FT 1/3: GOOD   FT 2/3: GOOD   FT 3/3: GOOD Paul Leonard makes 3/3 from the line.
Score: 72-51

[05:43] Team_025 possession (Score: 72-51)
Allen Embiid attempts a 3Pt. Contested by Cade Barnes (3.6 feet, ZONE). Allen Embiid misses. Rebound secured by Tobias Mitchell.

[05:25] Team_076 possession (Score: 72-51)
Paul Leonard attempts a 3Pt. Contested by Desmond Jordan (3.7 feet, MAN). PAUL LEONARD MAKES IT!
Score: 72-54

[05:10] Team_025 possession (Score: 72-54)
Allen Embiid attempts a 3Pt. Contested by D'Angelo Tatum (3.8 feet, MAN). Allen Embiid misses. Rebound secured by Tobias Mitchell.

[04:57] Team_076 possession (Score: 72-54)
FOUL! Shooting foul on Allen Embiid. D'Angelo Tatum to the line for 2 free throws. [BONUS: 5 team fouls] (Allen Embiid: 1 personal fouls)   FT 1/2: GOOD   FT 2/2: MISS D'Angelo Tatum makes 1/2 from the line. Rebound secured by Cade Anthony.
Score: 72-55

[04:42] Team_025 possession (Score: 72-55)
Desmond Jordan attempts a Midrange. Contested by Paul Leonard (5.3 feet, MAN). Desmond Jordan misses. Rebound secured by D'Angelo Tatum.

[04:27] Team_076 possession (Score: 72-55)
Paul Leonard attempts a Midrange. Contested by Desmond Jordan (3.7 feet, ZONE). Paul Leonard misses. Rebound secured by Cade Anthony.

[04:13] Team_025 possession (Score: 72-55)
Desmond Jordan drives and kicks out. Desmond Jordan attempts a 3Pt. Contested by Cade Barnes (3.6 feet, ZONE). Desmond Jordan misses. Rebound secured by Cade Barnes.

[03:57] Team_076 possession (Score: 72-55)
Cade Barnes attempts a Midrange. Contested by Cade Anthony (4.5 feet, MAN). Cade Barnes misses. Rebound secured by Allen Embiid.

[03:41] Team_025 possession (Score: 72-55)
FOUL! Shooting foul on D'Angelo Tatum. Allen Embiid to the line for 2 free throws. [BONUS: 5 team fouls] (D'Angelo Tatum: 1 personal fouls)   FT 1/2: GOOD   FT 2/2: GOOD Allen Embiid makes 2/2 from the line.
Score: 74-55

[03:26] Team_076 possession (Score: 74-55)
Paul Leonard attempts a 3Pt. BLOCKED BY DESMOND JORDAN! Ball is loose! Rebound secured by Desmond Jordan.

[03:13] Team_025 possession (Score: 74-55)
Paolo Lowry drives, Dejounte LaVine stays with him. Paolo Lowry attempts a Dunk. Contested by Dejounte LaVine (5.4 feet, MAN). PAOLO LOWRY MAKES IT!
Score: 76-55

[02:56] Team_076 possession (Score: 76-55)
Paul Leonard drives and kicks out. Cade Barnes attempts a 3Pt. Contested by Cade Anthony (4.4 feet, MAN). Cade Barnes misses. Rebound secured by Desmond Jordan.

[02:44] Team_025 possession (Score: 76-55)
FOUL! Shooting foul on Cade Barnes. Paolo Lowry to the line for 3 free throws. [BONUS: 6 team fouls] (Cade Barnes: 2 personal fouls)   FT 1/3: GOOD   FT 2/3: GOOD   FT 3/3: GOOD Paolo Lowry makes 3/3 from the line.
Score: 79-55

[02:27] Team_076 possession (Score: 79-55)
Dejounte LaVine attempts a Layup. Contested by Allen Embiid (3.1 feet, ZONE). DEJOUNTE LAVINE MAKES IT! Assist: Tobias Mitchell
Score: 79-57

[02:16] Team_025 possession (Score: 79-57)
Ben Giddey drives and kicks out. Desmond Jordan attempts a 3Pt. Contested by Paul Leonard (5.3 feet, MAN). Desmond Jordan misses. Rebound secured by D'Angelo Tatum.

[01:59] Team_076 possession (Score: 79-57)
FOUL! Holding foul on Allen Embiid. [IN THE BONUS! 6 team fouls] D'Angelo Tatum to the line for 2 free throws. (Allen Embiid: 2 personal fouls)   FT 1/2: GOOD   FT 2/2: GOOD D'Angelo Tatum makes 2/2 from the line.
Score: 79-59

[01:45] Team_025 possession (Score: 79-59)
Ben Giddey drives to the basket... FOUL! Offensive foul on Ben Giddey! Tobias Mitchell drew the charge! [Team fouls: 7] (Ben Giddey: 1 personal fouls) TURNOVER! (dead ball)

[01:30] Team_076 possession (Score: 79-59)
D'Angelo Tatum attempts a Layup. Contested by Allen Embiid (3.6 feet, ZONE). D'ANGELO TATUM MAKES IT! Assist: Dejounte LaVine
Score: 79-61

[01:20] Team_025 possession (Score: 79-61)
Ben Giddey attempts a Midrange. Contested by Paul Leonard (5.8 feet, ZONE). Ben Giddey misses. Rebound secured by D'Angelo Tatum.

[01:04] Team_076 possession (Score: 79-61)
Cade Barnes attempts a Midrange. Contested by Cade Anthony (4.7 feet, MAN). Cade Barnes misses. Rebound secured by Allen Embiid.

[00:49] Team_025 possession (Score: 79-61)
Desmond Jordan drives, Paul Leonard stays with him. Desmond Jordan attempts a Dunk. Contested by Paul Leonard (5.6 feet, MAN). DESMOND JORDAN MAKES IT! Assist: Paolo Lowry
Score: 81-61

[00:39] Team_076 possession (Score: 81-61)
Dejounte LaVine attempts a Midrange. Contested by Paolo Lowry (5.2 feet, MAN). Dejounte LaVine misses. Rebound secured by Allen Embiid.

[00:28] Team_025 possession (Score: 81-61)
Desmond Jordan drives, picks up Cade Barnes. Help arrives from Tobias Mitchell! Desmond Jordan attempts a Layup. Contested by Tobias Mitchell (4.2 feet, ZONE). DESMOND JORDAN MAKES IT! Assist: Allen Embiid
Score: 83-61

[00:15] Team_076 possession (Score: 83-61)
D'Angelo Tatum makes the Midrange and draws the foul on Desmond Jordan! And-1! D'Angelo Tatum to the line for 1. [BONUS: 8 team fouls] (Desmond Jordan: 2 personal fouls)   FT 1/1: GOOD D'Angelo Tatum makes 1/1 from the line.
Score: 83-64

================================================================================
                              3RD QUARTER COMPLETE                              
================================================================================

3RD QUARTER SCORE: Team_025 29, Team_076 21

BOX SCORE:
================================================================================

Team_025
--------------------------------------------------------------------------------
Player                MIN  PTS  REB  AST  TO      FG   FG%      3P   3P%
--------------------------------------------------------------------------------
Desmond Jordan         31   11    5    0   0   5/9    55.6     0/0   0.0
Paolo Lowry            31    9    0    1   0   4/4   100.0     0/0   0.0
Allen Embiid           31    4    6    2   0   2/4    50.0     0/0   0.0
Ben Giddey             31    3    0    2   0   1/3    33.3     0/0   0.0
Cade Anthony           32    2    5    0   0   1/1   100.0     0/0   0.0

TEAM: FG: 13/21 (61.9%), 3PT: 2/5 (40.0%), REB: 16 (2 off, 14 def), AST: 5, TO: 2
TEAM FOULS: 8 [Team_076 in BONUS]


Team_076
--------------------------------------------------------------------------------
Player                MIN  PTS  REB  AST  TO      FG   FG%      3P   3P%
--------------------------------------------------------------------------------
D'Angelo Tatum         31    7    4    0   0   3/4    75.0     0/0   0.0
Paul Leonard           31    6    0    0   0   2/11   18.2     0/0   0.0
Cade Barnes            31    5    2    0   0   2/5    40.0     0/0   0.0
Dejounte LaVine        31    2    0    1   0   1/2    50.0     0/0   0.0
Tobias Mitchell        31    0    3    2   0   0/0     0.0     0/0   0.0

TEAM: FG: 8/22 (36.4%), 3PT: 2/7 (28.6%), REB: 9 (1 off, 8 def), AST: 3, TO: 1
TEAM FOULS: 6 [Team_025 in BONUS]

================================================================================

================================================================================
                       4TH QUARTER - Team_025 vs Team_076                       
================================================================================

[12:00] Team_025 possession (Score: 83-64)
Allen Embiid attempts a Midrange. Contested by Cade Barnes (3.9 feet, ZONE). Allen Embiid misses. Rebound secured by Cade Barnes.

[11:43] Team_076 possession (Score: 83-64)
Tobias Mitchell attempts a Layup. Contested by Ben Giddey (4.3 feet, MAN). TOBIAS MITCHELL MAKES IT!
Score: 83-66

[11:28] Team_025 possession (Score: 83-66)
Desmond Jordan attempts a 3Pt. Contested by Paul Leonard (5.5 feet, MAN). Desmond Jordan misses. FOUL! Loose ball foul on Tobias Mitchell during the rebound battle. [Team fouls: 1] No free throws, side out. (Tobias Mitchell: 1 personal fouls)

[11:09] Team_025 possession (Score: 83-66)
Allen Embiid makes the Midrange and draws the foul on Cade Barnes! And-1! Allen Embiid to the line for 1. [Team fouls: 2] (Cade Barnes: 1 personal fouls)   FT 1/1: MISS Allen Embiid makes 0/1 from the line. Rebound secured by D'Angelo Tatum.
Score: 85-66

[10:58] Team_076 possession (Score: 85-66)
Cade Barnes drives and kicks out. D'Angelo Tatum attempts a Midrange. Contested by Allen Embiid (3.5 feet, MAN). D'Angelo Tatum misses. Rebound secured by Cade Anthony.

[10:44] Team_025 possession (Score: 85-66)
Cade Anthony attempts a Layup. Contested by Cade Barnes (4.6 feet, ZONE). CADE ANTHONY MAKES IT! Assist: Desmond Jordan
Score: 87-66

[10:29] Team_076 possession (Score: 87-66)
Dejounte LaVine attempts a Midrange. Contested by Desmond Jordan (3.7 feet, ZONE). DEJOUNTE LAVINE MAKES IT! Assist: Paul Leonard
Score: 87-68

[10:18] Team_025 possession (Score: 87-68)
Ben Giddey drives, picks up Tobias Mitchell. Help arrives from Dejounte LaVine! Ben Giddey attempts a Layup. Contested by Dejounte LaVine (5.0 feet, MAN). Ben Giddey misses. Offensive rebound by Allen Embiid! Allen Embiid puts it back in!
Score: 89-68

[10:04] Team_076 possession (Score: 89-68)
D'Angelo Tatum attempts a 3Pt. Contested by Ben Giddey (4.4 feet, ZONE). D'ANGELO TATUM MAKES IT! Assist: Dejounte LaVine
Score: 89-71

[09:48] Team_025 possession (Score: 89-71)
Allen Embiid drives and kicks out. Allen Embiid attempts a 3Pt. Contested by Dejounte LaVine (5.4 feet, ZONE). Allen Embiid misses. Rebound secured by D'Angelo Tatum.

[09:32] Team_076 possession (Score: 89-71)
FOUL! Reach-in foul on Desmond Jordan during the drive. [Team fouls: 1] No free throws, side out. (Desmond Jordan: 1 personal fouls)

[09:14] Team_076 possession (Score: 89-71)
Dejounte LaVine attempts a Layup. Contested by Allen Embiid (3.6 feet, ZONE). Dejounte LaVine misses. Rebound secured by Allen Embiid.

[09:02] Team_025 possession (Score: 89-71)
FOUL! Offensive foul on Paolo Lowry! Dejounte LaVine drew the charge! [Team fouls: 2] (Paolo Lowry: 1 personal fouls) TURNOVER! (dead ball)

[08:48] Team_076 possession (Score: 89-71)
D'Angelo Tatum drives, Allen Embiid stays with him. D'Angelo Tatum attempts a Layup. Contested by Allen Embiid (4.0 feet, MAN). D'Angelo Tatum misses. Rebound secured by Cade Anthony.

[08:36] Team_025 possession (Score: 89-71)
Cade Anthony attempts a 3Pt. Contested by Cade Barnes (4.9 feet, MAN). Cade Anthony misses. Rebound secured by Tobias Mitchell.

[08:19] Team_076 possession (Score: 89-71)
D'Angelo Tatum attempts a 3Pt. Contested by Cade Anthony (5.0 feet, ZONE). D'Angelo Tatum misses. Rebound secured by Cade Anthony.

[08:06] Team_025 possession (Score: 89-71)
Paolo Lowry drives to the basket... Paolo Lowry loses the ball! Stripped by Cade Barnes! TURNOVER! (live ball)

[07:48] Team_076 possession (Score: 89-71)
Paul Leonard attempts a 3Pt. Contested by Desmond Jordan (4.5 feet, MAN). PAUL LEONARD MAKES IT! Assist: Dejounte LaVine
Score: 89-74

[07:33] Team_025 possession (Score: 89-74)
Cade Anthony drives, D'Angelo Tatum stays with him. Cade Anthony attempts a Layup. Contested by D'Angelo Tatum (5.1 feet, ZONE). CADE ANTHONY MAKES IT!
Score: 91-74

[07:18] Team_076 possession (Score: 91-74)
Cade Barnes attempts a Midrange. Contested by Cade Anthony (5.1 feet, MAN). Cade Barnes misses. Rebound secured by Desmond Jordan.

[06:59] Team_025 possession (Score: 91-74)
Ben Giddey attempts a 3Pt. Contested by Cade Barnes (4.8 feet, ZONE). Ben Giddey misses. Rebound secured by D'Angelo Tatum.

[06:47] Team_076 possession (Score: 91-74)
Paul Leonard commits a violation (traveling/carry)! TURNOVER! (dead ball)

[06:47] Substitution (Team_025): Paolo Lowry OUT → LeBron Griffin IN (stamina_rule2)

[06:47] Substitution (Team_025): Ben Giddey OUT → Dirk Gilgeous-Alexander IN (stamina_rule2)

[06:47] Substitution (Team_025): Desmond Jordan OUT → Immanuel LaVine IN (stamina_rule2)

[06:47] Substitution (Team_025): Cade Anthony OUT → Damian Adebayo IN (stamina_rule2)

[06:47] Substitution (Team_025): Allen Embiid OUT → Nikola Lillard IN (stamina_rule2)

[06:47] Substitution (Team_076): Dejounte LaVine OUT → Pascal Lowry IN (stamina_rule2)

[06:47] Substitution (Team_076): Tobias Mitchell OUT → Jalen Poole IN (stamina_rule2)

[06:47] Substitution (Team_076): Paul Leonard OUT → Vince Lowry IN (stamina_rule2)

[06:47] Substitution (Team_076): Cade Barnes OUT → Kevin Nowitzki IN (stamina_rule2)

[06:47] Substitution (Team_076): D'Angelo Tatum OUT → Jordan Doncic IN (stamina_rule2)

[06:31] Team_025 possession (Score: 91-74)
Dirk Gilgeous-Alexander drives and kicks out. Damian Adebayo attempts a 3Pt. Contested by Kevin Nowitzki (4.2 feet, MAN). Damian Adebayo misses. Rebound secured by Vince Lowry.

[06:16] Team_076 possession (Score: 91-74)
Vince Lowry attempts a 3Pt. Contested by LeBron Griffin (4.6 feet, ZONE). Vince Lowry misses. Rebound secured by Immanuel LaVine.

[05:57] Team_025 possession (Score: 91-74)
Dirk Gilgeous-Alexander attempts a 3Pt. Contested by Vince Lowry (4.4 feet, ZONE). Dirk Gilgeous-Alexander misses. Rebound secured by Jordan Doncic.

[05:42] Team_076 possession (Score: 91-74)
Pascal Lowry attempts a 3Pt. Contested by LeBron Griffin (4.3 feet, ZONE). Pascal Lowry misses. FOUL! Loose ball foul on Dirk Gilgeous-Alexander during the rebound battle. [Team fouls: 3] No free throws, side out. (Dirk Gilgeous-Alexander: 1 personal fouls)

[05:29] Team_076 possession (Score: 91-74)
Jalen Poole attempts a 3Pt. Contested by LeBron Griffin (5.0 feet, ZONE). Jalen Poole misses. Rebound secured by Immanuel LaVine.

[05:13] Team_025 possession (Score: 91-74)
Dirk Gilgeous-Alexander makes the Layup and draws the foul on Kevin Nowitzki! And-1! Dirk Gilgeous-Alexander to the line for 1. [Team fouls: 3] (Kevin Nowitzki: 1 personal fouls)   FT 1/1: MISS Dirk Gilgeous-Alexander makes 0/1 from the line. Rebound secured by Jordan Doncic.
Score: 93-74

[05:00] Team_076 possession (Score: 93-74)
Vince Lowry attempts a Midrange. Contested by Immanuel LaVine (4.4 feet, MAN). VINCE LOWRY MAKES IT!
Score: 93-76

[04:45] Team_025 possession (Score: 93-76)
Immanuel LaVine attempts a 3Pt. Contested by Vince Lowry (4.3 feet, ZONE). IMMANUEL LAVINE MAKES IT! Assist: Dirk Gilgeous-Alexander
Score: 96-76

[04:32] Team_076 possession (Score: 96-76)
Kevin Nowitzki drives, Nikola Lillard stays with him. Kevin Nowitzki attempts a Layup. Contested by Nikola Lillard (4.6 feet, ZONE). KEVIN NOWITZKI MAKES IT! Assist: Pascal Lowry
Score: 96-78

[04:15] Team_025 possession (Score: 96-78)
LeBron Griffin drives to the basket... LeBron Griffin loses control! Ball rolls out of bounds! TURNOVER! (dead ball)

[03:59] Team_076 possession (Score: 96-78)
FOUL! Reach-in foul on Damian Adebayo during the drive. [Team fouls: 4] No free throws, side out. (Damian Adebayo: 1 personal fouls)

[03:44] Team_076 possession (Score: 96-78)
Jalen Poole drives, Nikola Lillard stays with him. Jalen Poole attempts a Layup. Contested by Nikola Lillard (4.8 feet, ZONE). JALEN POOLE MAKES IT! Assist: Kevin Nowitzki
Score: 96-80

[03:26] Team_025 possession (Score: 96-80)
Damian Adebayo attempts a 3Pt. Wide open! Pascal Lowry is 6.2 feet away. [ZONE] Damian Adebayo misses. Offensive rebound by Nikola Lillard! Nikola Lillard kicks it out.

[03:07] Team_025 possession (Score: 96-80)
FOUL! Reach-in foul on Kevin Nowitzki during the drive. [Team fouls: 4] No free throws, side out. (Kevin Nowitzki: 2 personal fouls)

[02:54] Team_025 possession (Score: 96-80)
Damian Adebayo makes the Dunk and draws the foul on Jalen Poole! And-1! Damian Adebayo to the line for 1. [BONUS: 5 team fouls] (Jalen Poole: 1 personal fouls)   FT 1/1: GOOD Damian Adebayo makes 1/1 from the line.
Score: 99-80

[02:36] Team_076 possession (Score: 99-80)
Vince Lowry attempts a 3Pt. Contested by LeBron Griffin (4.6 feet, ZONE). Vince Lowry misses. Rebound secured by Dirk Gilgeous-Alexander.

[02:20] Team_025 possession (Score: 99-80)
Damian Adebayo drives to the basket... Damian Adebayo throws a bad pass! Stolen by Jordan Doncic! TURNOVER! (live ball)

[02:07] Team_076 possession (Score: 99-80)
Kevin Nowitzki attempts a Midrange. Contested by Damian Adebayo (5.2 feet, MAN). Kevin Nowitzki misses. Rebound secured by Dirk Gilgeous-Alexander.

[01:57] Team_025 possession (Score: 99-80)
Dirk Gilgeous-Alexander attempts a Midrange. Contested by Jalen Poole (5.6 feet, MAN). DIRK GILGEOUS-ALEXANDER MAKES IT!
Score: 101-80

[01:47] Team_076 possession (Score: 101-80)
Jalen Poole attempts a 3Pt. Contested by Immanuel LaVine (4.8 feet, ZONE). JALEN POOLE MAKES IT! Assist: Jordan Doncic
Score: 101-83

[01:33] Team_025 possession (Score: 101-83)
Dirk Gilgeous-Alexander attempts a Layup. Contested by Jordan Doncic (3.5 feet, ZONE). Dirk Gilgeous-Alexander misses. Rebound secured by Vince Lowry.

[01:19] Team_076 possession (Score: 101-83)
Jordan Doncic makes the 3Pt and draws the foul on LeBron Griffin! And-1! Jordan Doncic to the line for 1. [BONUS: 5 team fouls] (LeBron Griffin: 1 personal fouls)   FT 1/1: GOOD Jordan Doncic makes 1/1 from the line.
Score: 101-87

[01:04] Team_025 possession (Score: 101-87)
Immanuel LaVine attempts a 3Pt. Contested by Vince Lowry (4.3 feet, MAN). Immanuel LaVine misses. Rebound secured by Kevin Nowitzki.

[00:50] Team_076 possession (Score: 101-87)
Pascal Lowry attempts a 3Pt. Contested by LeBron Griffin (4.3 feet, MAN). PASCAL LOWRY MAKES IT! Assist: Jalen Poole
Score: 101-90

[00:41] Team_025 possession (Score: 101-90)
Immanuel LaVine attempts a Layup. Contested by Vince Lowry (4.3 feet, MAN). Immanuel LaVine misses. Rebound secured by Kevin Nowitzki.

[00:31] Team_076 possession (Score: 101-90)
Jalen Poole attempts a Midrange. Contested by Dirk Gilgeous-Alexander (6.0 feet, MAN). JALEN POOLE MAKES IT!
Score: 101-92

[00:21] Team_025 possession (Score: 101-92)
Dirk Gilgeous-Alexander makes the Layup and draws the foul on Jordan Doncic! And-1! Dirk Gilgeous-Alexander to the line for 1. [BONUS: 6 team fouls] (Jordan Doncic: 1 personal fouls)   FT 1/1: MISS Dirk Gilgeous-Alexander makes 0/1 from the line. Offensive rebound by Nikola Lillard! Nikola Lillard kicks it out.
Score: 103-92

[00:04] Team_025 possession (Score: 103-92)
Nikola Lillard attempts a Midrange. Contested by Jordan Doncic (3.5 feet, MAN). Nikola Lillard misses. Rebound secured by Jordan Doncic.

================================================================================
                              4TH QUARTER COMPLETE                              
================================================================================

4TH QUARTER SCORE: Team_025 20, Team_076 28

BOX SCORE:
================================================================================

Team_025
--------------------------------------------------------------------------------
Player                MIN  PTS  REB  AST  TO      FG   FG%      3P   3P%
--------------------------------------------------------------------------------
Cade Anthony           37    4    3    0   0   2/3    66.7     0/0   0.0
Immanuel LaVine        12    3    2    0   0   1/3    33.3     0/0   0.0
Damian Adebayo         11    3    0    0   0   1/1   100.0     0/0   0.0
Allen Embiid           37    2    2    0   0   1/4    25.0     0/0   0.0
Dirk Gilgeous-Alexander   12    2    2    1   0   1/5    20.0     0/0   0.0
Desmond Jordan         37    0    2    1   0   0/0     0.0     0/0   0.0
Ben Giddey             37    0    0    0   0   0/1     0.0     0/0   0.0
Nikola Lillard         12    0    2    0   0   0/1     0.0     0/0   0.0

TEAM: FG: 6/18 (33.3%), 3PT: 1/5 (20.0%), REB: 13 (4 off, 9 def), AST: 2, TO: 4
TEAM FOULS: 5 [Team_076 in BONUS]


Team_076
--------------------------------------------------------------------------------
Player                MIN  PTS  REB  AST  TO      FG   FG%      3P   3P%
--------------------------------------------------------------------------------
Jalen Poole            12    7    0    1   0   3/4    75.0     0/0   0.0
Jordan Doncic          12    4    3    1   0   1/1   100.0     0/0   0.0
D'Angelo Tatum         37    3    3    0   0   1/3    33.3     0/0   0.0
Paul Leonard           37    3    0    1   0   1/1   100.0     0/0   0.0
Pascal Lowry           12    3    0    1   0   1/1   100.0     0/0   0.0
Tobias Mitchell        37    2    1    0   0   1/1   100.0     0/0   0.0
Dejounte LaVine        37    2    0    2   0   1/2    50.0     0/0   0.0
Vince Lowry            12    2    2    0   0   1/3    33.3     0/0   0.0
Kevin Nowitzki         12    2    3    1   0   1/2    50.0     0/0   0.0
Cade Barnes            37    0    1    0   0   0/2     0.0     0/0   0.0

TEAM: FG: 11/20 (55.0%), 3PT: 5/9 (55.6%), REB: 13 (1 off, 12 def), AST: 7, TO: 1
TEAM FOULS: 6 [Team_025 in BONUS]

================================================================================

================================================================================
                               FULL GAME COMPLETE                               
================================================================================

FINAL SCORE: Team_025 103, Team_076 92

SCORING BY QUARTER:
--------------------------------------------------------------------------------
Team                     Q1     Q2     Q3     Q4    FINAL
--------------------------------------------------------------------------------
Team_025                 25     29     29     20      103
Team_076                 25     18     21     28       92
--------------------------------------------------------------------------------

FULL GAME BOX SCORE:
================================================================================

Team_025
--------------------------------------------------------------------------------
Player                MIN  PTS  REB  AST  TO      FG   FG%      3P   3P%      FT STL BLK
--------------------------------------------------------------------------------
Cade Anthony           37   13    9    2   2   7/12   58.3   0/3     0.0   5/6     0   0
Paolo Lowry            37   16    0    2   3   8/9    88.9   1/2    50.0   8/10    1   0
Ben Giddey             37   11    0    2   0   7/11   63.6   2/3    66.7   2/2     2   1
Desmond Jordan         37   23   16    3   0   9/18   50.0   2/6    33.3   3/3     0   1
Allen Embiid           37   17   18    2   2   4/11   36.4   1/5    20.0   3/4     2   0
LeBron Griffin         12    5    0    0   0   2/3    66.7   1/2    50.0   0/0     0   0
Dirk Gilgeous-Alexander   12    4    2    2   1   2/6    33.3   0/1     0.0   2/4     0   0
Immanuel LaVine        12    3    6    0   1   1/3    33.3   1/2    50.0   0/0     0   0
Nikola Lillard         12    0    2    0   1   0/2     0.0   0/0     0.0   0/0     0   0
Damian Adebayo         11    3    0    1   1   1/2    50.0   0/1     0.0   1/1     0   0

TEAM: FG: 42/78 (53.8%), 3PT: 8/25 (32.0%), REB: 54 (17 off, 37 def), AST: 14, TO: 11


Team_076
--------------------------------------------------------------------------------
Player                MIN  PTS  REB  AST  TO      FG   FG%      3P   3P%      FT STL BLK
--------------------------------------------------------------------------------
Dejounte LaVine        37    8    0    5   2   4/7    57.1   0/0     0.0   2/2     0   0
Tobias Mitchell        37    2    7    2   3   1/4    25.0   0/2     0.0   0/0     0   1
Paul Leonard           37   18    0    3   4   7/18   38.9   3/10   30.0   6/6     0   0
Cade Barnes            37   18    7    0   2   7/15   46.7   1/1   100.0   3/4     3   2
D'Angelo Tatum         37   15   13    2   0   5/11   45.5   1/2    50.0   6/7     0   0
Pascal Lowry           12    8    0    1   1   4/4   100.0   2/2   100.0   0/0     0   0
Jalen Poole            12    7    0    2   1   3/5    60.0   1/3    33.3   0/0     0   0
Vince Lowry            12    3    4    0   0   1/3    33.3   0/2     0.0   1/2     0   0
Kevin Nowitzki         12    2    6    1   1   1/2    50.0   0/0     0.0   0/0     0   0
Jordan Doncic          12    6    4    1   0   2/3    66.7   1/1   100.0   1/2     2   0

TEAM: FG: 37/74 (50.0%), 3PT: 9/23 (39.1%), REB: 40 (5 off, 35 def), AST: 17, TO: 14

================================================================================
