================================================================================
                        FULL GAME - Team_029 vs Team_023                        
================================================================================

================================================================================
                       1ST QUARTER - Team_029 vs Team_023                       
================================================================================

[12:00] Team_029 possession (Score: 0-0)
FOUL! Holding foul on Kyle Paul. [Team fouls: 1] No free throws, side out. (Kyle Paul: 1 personal fouls)

[11:41] Team_029 possession (Score: 0-0)
Scottie Bird attempts a 3Pt. Contested by Josh Morant (4.4 feet, ZONE). Scottie Bird misses. Offensive rebound by Devin Butler! Devin Butler kicks it out.

[11:28] Team_029 possession (Score: 0-0)
Giannis Banchero attempts a Midrange. Contested by Kyle Paul (3.4 feet, MAN). Giannis Banchero misses. Rebound secured by Tim Bane.

[11:11] Team_023 possession (Score: 0-0)
FOUL! Holding foul on Paul Iverson. [Team fouls: 1] No free throws, side out. (Paul Iverson: 1 personal fouls)

[10:56] Team_023 possession (Score: 0-0)
Kyle Paul attempts a Layup. Contested by Devin Butler (4.4 feet, ZONE). Kyle Paul misses. Rebound secured by James Wall.

[10:42] Team_029 possession (Score: 0-0)
Giannis Banchero attempts a 3Pt. Contested by Kyle Paul (3.4 feet, MAN). Giannis Banchero misses. Rebound secured by Tim Bane.

[10:33] Team_023 possession (Score: 0-0)
Josh Morant attempts a 3Pt. Contested by James Wall (2.8 feet, MAN). Josh Morant misses. Rebound secured by Giannis Banchero.

[10:18] Team_029 possession (Score: 0-0)
Giannis Banchero drives, Tim Bane stays with him. Giannis Banchero attempts a Dunk. Contested by Tim Bane (4.4 feet, ZONE). Giannis Banchero misses. Rebound secured by Kyle Paul.

[10:04] Team_023 possession (Score: 0-0)
Tim Bane drives, picks up Devin Butler. Help arrives from Scottie Bird! Tim Bane attempts a Layup. Contested by Scottie Bird (4.5 feet, MAN). TIM BANE MAKES IT! Assist: Collin Ginobili
Score: 0-2

[09:50] Team_029 possession (Score: 0-2)
James Wall drives, Tim Bane stays with him. James Wall attempts a Layup. Contested by Tim Bane (4.4 feet, ZONE). James Wall misses. Offensive rebound by James Wall! James Wall puts it back in!
Score: 2-2

[09:33] Team_023 possession (Score: 2-2)
Kyle Paul attempts a Midrange. Contested by Scottie Bird (3.4 feet, ZONE). KYLE PAUL MAKES IT!
Score: 2-4

[09:19] Team_029 possession (Score: 2-4)
Giannis Banchero makes the Layup and draws the foul on Tim Bane! And-1! Giannis Banchero to the line for 1. [Team fouls: 2] (Tim Bane: 1 personal fouls)   FT 1/1: GOOD Giannis Banchero makes 1/1 from the line.
Score: 5-4

[09:05] Team_023 possession (Score: 5-4)
Trae Ingram attempts a 3Pt. Contested by Paul Iverson (4.2 feet, MAN). Trae Ingram misses. Offensive rebound by Tim Bane! Tim Bane's putback is no good. Rebound secured by Giannis Banchero.

[08:51] Team_029 possession (Score: 5-4)
FOUL! Holding foul on Josh Morant. [Team fouls: 3] No free throws, side out. (Josh Morant: 1 personal fouls)

[08:38] Team_029 possession (Score: 5-4)
FOUL! Reach-in foul on Tim Bane during the drive. [Team fouls: 4] No free throws, side out. (Tim Bane: 2 personal fouls)

[08:24] Team_029 possession (Score: 5-4)
James Wall attempts a Layup. Contested by Tim Bane (4.4 feet, ZONE). JAMES WALL MAKES IT! Assist: Scottie Bird
Score: 7-4

[08:09] Team_023 possession (Score: 7-4)
Collin Ginobili drives, Scottie Bird stays with him. Collin Ginobili attempts a Layup. Contested by Scottie Bird (3.6 feet, MAN). Collin Ginobili misses. Offensive rebound by Tim Bane! Tim Bane puts it back in!
Score: 7-6

[07:58] Team_029 possession (Score: 7-6)
Scottie Bird attempts a 3Pt. Contested by Kyle Paul (3.1 feet, ZONE). Scottie Bird misses. Rebound secured by Kyle Paul.

[07:46] Team_023 possession (Score: 7-6)
Trae Ingram drives to the basket... FOUL! Offensive foul on Trae Ingram! James Wall drew the charge! [Team fouls: 5] (Trae Ingram: 1 personal fouls) TURNOVER! (dead ball)

[07:32] Team_029 possession (Score: 7-6)
James Wall attempts a 3Pt. Contested by Josh Morant (4.6 feet, MAN). JAMES WALL MAKES IT! Assist: Scottie Bird
Score: 10-6

[07:17] Team_023 possession (Score: 10-6)
Kyle Paul attempts a Midrange. Contested by Giannis Banchero (3.9 feet, MAN). KYLE PAUL MAKES IT! Assist: Tim Bane
Score: 10-8

[07:04] Team_029 possession (Score: 10-8)
FOUL! Shooting foul on Josh Morant. James Wall to the line for 2 free throws. [BONUS: 6 team fouls] (Josh Morant: 2 personal fouls)   FT 1/2: MISS   FT 2/2: GOOD James Wall makes 1/2 from the line.
Score: 11-8

[06:50] Team_023 possession (Score: 11-8)
Kyle Paul attempts a 3Pt. Contested by Giannis Banchero (3.9 feet, MAN). Kyle Paul misses. Offensive rebound by Tim Bane! Tim Bane's putback is no good. Rebound secured by Devin Butler.

[06:36] Team_029 possession (Score: 11-8)
James Wall attempts a 3Pt. Contested by Kyle Paul (3.4 feet, ZONE). James Wall misses. Rebound secured by Tim Bane.

[06:21] Team_023 possession (Score: 11-8)
FOUL! Reach-in foul on James Wall during the drive. [Team fouls: 2] No free throws, side out. (James Wall: 1 personal fouls)

[06:03] Team_023 possession (Score: 11-8)
Josh Morant drives and kicks out. Trae Ingram attempts a 3Pt. Contested by Paul Iverson (4.3 feet, MAN). Trae Ingram misses. Rebound secured by Giannis Banchero.

[05:50] Team_029 possession (Score: 11-8)
James Wall attempts a Midrange. Contested by Josh Morant (4.6 feet, MAN). James Wall misses. Rebound secured by Tim Bane.

[05:34] Team_023 possession (Score: 11-8)
Collin Ginobili drives and kicks out. Tim Bane attempts a 3Pt. Contested by Devin Butler (4.1 feet, MAN). Tim Bane misses. Rebound secured by Devin Butler.

[05:19] Team_029 possession (Score: 11-8)
Devin Butler attempts a Midrange. Contested by Kyle Paul (3.3 feet, ZONE). Devin Butler misses. Rebound secured by Kyle Paul.

[05:03] Team_023 possession (Score: 11-8)
Trae Ingram drives to the basket... Trae Ingram throws a bad pass out of bounds! TURNOVER! (dead ball)

[04:46] Team_029 possession (Score: 11-8)
FOUL! Holding foul on Collin Ginobili. [IN THE BONUS! 7 team fouls] Scottie Bird to the line for 2 free throws. (Collin Ginobili: 1 personal fouls)   FT 1/2: GOOD   FT 2/2: GOOD Scottie Bird makes 2/2 from the line.
Score: 13-8

[04:32] Team_023 possession (Score: 13-8)
Kyle Paul makes the Layup and draws the foul on Scottie Bird! And-1! Kyle Paul to the line for 1. [Team fouls: 3] (Scottie Bird: 1 personal fouls)   FT 1/1: GOOD Kyle Paul makes 1/1 from the line.
Score: 13-11

[04:20] Team_029 possession (Score: 13-11)
FOUL! Offensive foul on Paul Iverson! Trae Ingram drew the charge! [Team fouls: 4] (Paul Iverson: 2 personal fouls) TURNOVER! (dead ball)

[04:07] Team_023 possession (Score: 13-11)
Tim Bane makes the Dunk and draws the foul on Devin Butler! And-1! Tim Bane to the line for 1. [BONUS: 5 team fouls] (Devin Butler: 1 personal fouls)   FT 1/1: GOOD Tim Bane makes 1/1 from the line.
Score: 13-14

[03:50] Team_029 possession (Score: 13-14)
James Wall drives, Tim Bane stays with him. James Wall attempts a Layup. Contested by Tim Bane (4.6 feet, ZONE). James Wall misses. Rebound secured by Tim Bane.

[03:37] Team_023 possession (Score: 13-14)
Tim Bane drives, James Wall stays with him. Tim Bane attempts a Dunk. Contested by James Wall (3.1 feet, ZONE). TIM BANE MAKES IT!
Score: 13-16

[03:24] Team_029 possession (Score: 13-16)
James Wall attempts a Midrange. Contested by Josh Morant (4.8 feet, MAN). James Wall misses. Rebound secured by Kyle Paul.

[03:11] Team_023 possession (Score: 13-16)
Tim Bane attempts a Midrange. Contested by Devin Butler (4.7 feet, MAN). TIM BANE MAKES IT!
Score: 13-18

[02:57] Team_029 possession (Score: 13-18)
FOUL! Holding foul on Tim Bane. [IN THE BONUS! 8 team fouls] Devin Butler to the line for 2 free throws. (Tim Bane: 3 personal fouls)   FT 1/2: GOOD   FT 2/2: GOOD Devin Butler makes 2/2 from the line.
Score: 15-18

[02:47] Team_023 possession (Score: 15-18)
Collin Ginobili attempts a Layup. Contested by Scottie Bird (3.9 feet, MAN). Collin Ginobili misses. Offensive rebound by Josh Morant! Josh Morant kicks it out.

[02:34] Team_023 possession (Score: 15-18)
Josh Morant drives, James Wall stays with him. Josh Morant attempts a Dunk. Contested by James Wall (3.0 feet, ZONE). Josh Morant misses. Rebound secured by Giannis Banchero.

[02:19] Team_029 possession (Score: 15-18)
Scottie Bird attempts a Midrange. BLOCKED BY COLLIN GINOBILI! Ball is loose! Offensive rebound by James Wall! James Wall kicks it out.

[02:01] Team_029 possession (Score: 15-18)
James Wall attempts a Midrange. Contested by Josh Morant (4.9 feet, ZONE). JAMES WALL MAKES IT!
Score: 17-18

[01:45] Team_023 possession (Score: 17-18)
Trae Ingram drives, James Wall stays with him. Trae Ingram attempts a Dunk. Contested by James Wall (2.9 feet, ZONE). Trae Ingram misses. Rebound secured by James Wall.

[01:31] Team_029 possession (Score: 17-18)
Giannis Banchero drives to the basket... Giannis Banchero throws a bad pass! Stolen by Tim Bane! TURNOVER! (live ball)

[01:12] Team_023 possession (Score: 17-18)
Josh Morant attempts a Layup. Contested by James Wall (3.2 feet, MAN). JOSH MORANT MAKES IT! Assist: Trae Ingram
Score: 17-20

[01:00] Team_029 possession (Score: 17-20)
FOUL! Reach-in foul on Tim Bane during the drive. [IN THE BONUS! 9 team fouls] Devin Butler to the line for 2 free throws. (Tim Bane: 4 personal fouls)   FT 1/2: GOOD   FT 2/2: GOOD Devin Butler makes 2/2 from the line.
Score: 19-20

[00:42] Team_023 possession (Score: 19-20)
Tim Bane attempts a 3Pt. Contested by Paul Iverson (5.0 feet, ZONE). Tim Bane misses. Rebound secured by Devin Butler.

[00:27] Team_029 possession (Score: 19-20)
Giannis Banchero drives and kicks out. James Wall attempts a 3Pt. Contested by Josh Morant (4.6 feet, MAN). James Wall misses. Rebound secured by Tim Bane.

[00:09] Team_023 possession (Score: 19-20)
Collin Ginobili drives and kicks out. Josh Morant attempts a 3Pt. Contested by James Wall (3.2 feet, MAN). Josh Morant misses. Rebound secured by James Wall.

================================================================================
                              1ST QUARTER COMPLETE                              
================================================================================

1ST QUARTER SCORE: Team_029 19, Team_023 20

BOX SCORE:
================================================================================

Team_029
--------------------------------------------------------------------------------
Player                MIN  PTS  REB  AST  TO      FG   FG%      3P   3P%
--------------------------------------------------------------------------------
James Wall             12   10    5    0   0   5/9    55.6     0/0   0.0
Devin Butler           12    4    4    0   0   2/3    66.7     0/0   0.0
Giannis Banchero       12    3    4    0   0   1/5    20.0     0/0   0.0
Scottie Bird           12    2    0    2   0   1/2    50.0     0/0   0.0

TEAM: FG: 9/19 (47.4%), 3PT: 1/4 (25.0%), REB: 11 (3 off, 8 def), AST: 2, TO: 2
TEAM FOULS: 5 [Team_023 in BONUS]


Team_023
--------------------------------------------------------------------------------
Player                MIN  PTS  REB  AST  TO      FG   FG%      3P   3P%
--------------------------------------------------------------------------------
Tim Bane               12   11    7    1   0   5/6    83.3     0/0   0.0
Kyle Paul              12    7    4    0   0   3/5    60.0     0/0   0.0
Josh Morant            12    2    1    0   0   1/4    25.0     0/0   0.0
Collin Ginobili        12    0    0    1   0   0/2     0.0     0/0   0.0
Trae Ingram            12    0    0    1   0   0/2     0.0     0/0   0.0

TEAM: FG: 9/19 (47.4%), 3PT: 0/4 (0.0%), REB: 14 (4 off, 10 def), AST: 3, TO: 2
TEAM FOULS: 9 [Team_029 in BONUS]

================================================================================

================================================================================
                       2ND QUARTER - Team_029 vs Team_023                       
================================================================================

[12:00] Team_029 possession (Score: 19-20)
Giannis Banchero attempts a 3Pt. Contested by Kyle Paul (3.7 feet, MAN). Giannis Banchero misses. Rebound secured by Tim Bane.

[11:48] Team_023 possession (Score: 19-20)
Tim Bane throws a bad pass! Stolen by Devin Butler! TURNOVER! (live ball)

[11:34] Team_029 possession (Score: 19-20)
Devin Butler drives to the basket... FOUL! Offensive foul on Devin Butler! Tim Bane drew the charge! [Team fouls: 1] (Devin Butler: 1 personal fouls) TURNOVER! (dead ball)

[11:24] Team_023 possession (Score: 19-20)
Collin Ginobili drives to the basket... Collin Ginobili throws a bad pass! Stolen by James Wall! TURNOVER! (live ball)

[11:07] Team_029 possession (Score: 19-20)
Paul Iverson attempts a 3Pt. Contested by Trae Ingram (4.0 feet, MAN). PAUL IVERSON MAKES IT! Assist: James Wall
Score: 22-20

[10:56] Team_023 possession (Score: 22-20)
FOUL! Holding foul on Paul Iverson. [Team fouls: 2] No free throws, side out. (Paul Iverson: 1 personal fouls)

[10:42] Team_023 possession (Score: 22-20)
Kyle Paul attempts a 3Pt. Contested by Giannis Banchero (4.5 feet, MAN). Kyle Paul misses. Rebound secured by Giannis Banchero.

[10:24] Team_029 possession (Score: 22-20)
Devin Butler drives, Tim Bane stays with him. Devin Butler attempts a Layup. Contested by Tim Bane (4.9 feet, MAN). DEVIN BUTLER MAKES IT!
Score: 24-20

[10:11] Team_023 possession (Score: 24-20)
Trae Ingram drives, James Wall stays with him. Trae Ingram attempts a Dunk. Contested by James Wall (3.0 feet, ZONE). Trae Ingram misses. Offensive rebound by Tim Bane! Tim Bane puts it back in!
Score: 24-22

[10:00] Team_029 possession (Score: 24-22)
James Wall makes the Layup and draws the foul on Tim Bane! And-1! James Wall to the line for 1. [Team fouls: 1] (Tim Bane: 1 personal fouls)   FT 1/1: GOOD James Wall makes 1/1 from the line.
Score: 27-22

[09:47] Team_023 possession (Score: 27-22)
FOUL! Shooting foul on Giannis Banchero. Kyle Paul to the line for 2 free throws. [Team fouls: 3] (Giannis Banchero: 1 personal fouls)   FT 1/2: MISS   FT 2/2: GOOD Kyle Paul makes 1/2 from the line.
Score: 27-23

[09:36] Team_029 possession (Score: 27-23)
Giannis Banchero makes the Dunk and draws the foul on Tim Bane! And-1! Giannis Banchero to the line for 1. [Team fouls: 2] (Tim Bane: 2 personal fouls)   FT 1/1: MISS Giannis Banchero makes 0/1 from the line. Rebound secured by Josh Morant.
Score: 29-23

[09:22] Team_023 possession (Score: 29-23)
Kyle Paul drives, picks up James Wall. Help arrives from Scottie Bird! Kyle Paul attempts a Layup. Contested by Scottie Bird (3.5 feet, ZONE). KYLE PAUL MAKES IT! Assist: Tim Bane
Score: 29-25

[09:10] Team_029 possession (Score: 29-25)
James Wall attempts a 3Pt. Contested by Josh Morant (5.2 feet, MAN). James Wall misses. Rebound secured by Kyle Paul.

[08:56] Team_023 possession (Score: 29-25)
FOUL! Shooting foul on Devin Butler. Tim Bane to the line for 2 free throws. [Team fouls: 4] (Devin Butler: 2 personal fouls)   FT 1/2: GOOD   FT 2/2: GOOD Tim Bane makes 2/2 from the line.
Score: 29-27

[08:36] Team_029 possession (Score: 29-27)
Paul Iverson attempts a Midrange. Contested by Kyle Paul (3.9 feet, ZONE). Paul Iverson misses. FOUL! Loose ball foul on Tim Bane during the rebound battle. [Team fouls: 3] No free throws, side out. (Tim Bane: 3 personal fouls)

[08:22] Team_029 possession (Score: 29-27)
Giannis Banchero attempts a 3Pt. Contested by Kyle Paul (4.3 feet, MAN). Giannis Banchero misses. FOUL! Loose ball foul on Kyle Paul during the rebound battle. [Team fouls: 4] No free throws, side out. (Kyle Paul: 1 personal fouls)

[08:09] Team_029 possession (Score: 29-27)
FOUL! Shooting foul on Collin Ginobili. Scottie Bird to the line for 2 free throws. [BONUS: 5 team fouls] (Collin Ginobili: 1 personal fouls)   FT 1/2: MISS   FT 2/2: GOOD Scottie Bird makes 1/2 from the line.
Score: 30-27

[07:51] Team_023 possession (Score: 30-27)
Collin Ginobili drives to the basket... Collin Ginobili throws a bad pass! Stolen by James Wall! TURNOVER! (live ball)

[07:37] Team_029 possession (Score: 30-27)
Giannis Banchero attempts a 3Pt. Contested by Kyle Paul (4.4 feet, MAN). Giannis Banchero misses. Rebound secured by Josh Morant.

[07:23] Team_023 possession (Score: 30-27)
Collin Ginobili attempts a 3Pt. Contested by Giannis Banchero (5.1 feet, ZONE). COLLIN GINOBILI MAKES IT! Assist: Josh Morant
Score: 30-30

[07:03] Team_029 possession (Score: 30-30)
James Wall makes the Layup and draws the foul on Josh Morant! And-1! James Wall to the line for 1. [BONUS: 6 team fouls] (Josh Morant: 1 personal fouls)   FT 1/1: GOOD James Wall makes 1/1 from the line.
Score: 33-30

[06:48] Team_023 possession (Score: 33-30)
Josh Morant attempts a Midrange. Contested by James Wall (3.7 feet, MAN). Josh Morant misses. Offensive rebound by Tim Bane! Tim Bane kicks it out.

[06:35] Team_023 possession (Score: 33-30)
Trae Ingram attempts a 3Pt. Contested by Giannis Banchero (4.7 feet, ZONE). TRAE INGRAM MAKES IT!
Score: 33-33

[06:18] Team_029 possession (Score: 33-33)
FOUL! Shooting foul on Tim Bane. Paul Iverson to the line for 2 free throws. [BONUS: 7 team fouls] (Tim Bane: 4 personal fouls)   FT 1/2: GOOD   FT 2/2: GOOD Paul Iverson makes 2/2 from the line.
Score: 35-33

[06:02] Team_023 possession (Score: 35-33)
Collin Ginobili attempts a Layup. Contested by Scottie Bird (4.8 feet, MAN). Collin Ginobili misses. Offensive rebound by Josh Morant! Josh Morant kicks it out.

[05:47] Team_023 possession (Score: 35-33)
Collin Ginobili attempts a Layup. Contested by James Wall (4.2 feet, ZONE). Collin Ginobili misses. Rebound secured by James Wall.

[05:29] Team_029 possession (Score: 35-33)
Giannis Banchero attempts a 3Pt. Contested by Kyle Paul (4.7 feet, MAN). Giannis Banchero misses. Rebound secured by Tim Bane.

[05:11] Team_023 possession (Score: 35-33)
Tim Bane attempts a 3Pt. Contested by Giannis Banchero (5.3 feet, ZONE). TIM BANE MAKES IT! Assist: Collin Ginobili
Score: 35-36

[04:57] Team_029 possession (Score: 35-36)
Paul Iverson drives to the basket... FOUL! Offensive foul on Paul Iverson! Trae Ingram drew the charge! [Team fouls: 5] (Paul Iverson: 2 personal fouls) TURNOVER! (dead ball)

[04:44] Team_023 possession (Score: 35-36)
Josh Morant attempts a Midrange. Contested by Devin Butler (5.5 feet, ZONE). Josh Morant misses. Rebound secured by Devin Butler.

[04:29] Team_029 possession (Score: 35-36)
Scottie Bird attempts a Layup. BLOCKED BY TIM BANE! Ball is loose! Rebound secured by Josh Morant.

[04:17] Team_023 possession (Score: 35-36)
Tim Bane attempts a Midrange. Contested by Scottie Bird (5.0 feet, ZONE). Tim Bane misses. Offensive rebound by Josh Morant! Josh Morant kicks it out.

[04:02] Team_023 possession (Score: 35-36)
Trae Ingram attempts a 3Pt. Contested by Giannis Banchero (5.2 feet, ZONE). Trae Ingram misses. Rebound secured by Giannis Banchero.

[03:48] Team_029 possession (Score: 35-36)
Paul Iverson attempts a 3Pt. Contested by Trae Ingram (5.1 feet, ZONE). Paul Iverson misses. Rebound secured by Josh Morant.

[03:33] Team_023 possession (Score: 35-36)
Kyle Paul attempts a 3Pt. Contested by Giannis Banchero (5.6 feet, MAN). Kyle Paul misses. Offensive rebound by Josh Morant! Josh Morant kicks it out.

[03:16] Team_023 possession (Score: 35-36)
Trae Ingram attempts a Midrange. Contested by James Wall (4.1 feet, ZONE). Trae Ingram misses. Rebound secured by Giannis Banchero.

[03:02] Team_029 possession (Score: 35-36)
James Wall attempts a 3Pt. Contested by Trae Ingram (5.5 feet, ZONE). James Wall misses. Rebound secured by Kyle Paul.

[02:51] Team_023 possession (Score: 35-36)
Josh Morant attempts a Layup. BLOCKED BY JAMES WALL! Ball is loose! Rebound secured by Devin Butler.

[02:32] Team_029 possession (Score: 35-36)
Devin Butler drives, Tim Bane stays with him. Devin Butler attempts a Dunk. Wide open! Tim Bane is 6.0 feet away. [ZONE] DEVIN BUTLER MAKES IT!
Score: 37-36

[02:20] Team_023 possession (Score: 37-36)
Josh Morant attempts a 3Pt. Contested by Paul Iverson (5.9 feet, ZONE). Josh Morant misses. Rebound secured by Devin Butler.

[02:10] Team_029 possession (Score: 37-36)
Devin Butler makes the Layup and draws the foul on Tim Bane! And-1! Devin Butler to the line for 1. [BONUS: 8 team fouls] (Tim Bane: 5 personal fouls)   FT 1/1: GOOD Devin Butler makes 1/1 from the line.
Score: 40-36

[01:53] Team_023 possession (Score: 40-36)
Collin Ginobili attempts a 3Pt. Contested by Scottie Bird (5.5 feet, MAN). Collin Ginobili misses. Offensive rebound by Josh Morant! Josh Morant kicks it out.

[01:41] Team_023 possession (Score: 40-36)
Josh Morant attempts a Midrange. Contested by Scottie Bird (5.3 feet, ZONE). Josh Morant misses. Offensive rebound by Josh Morant! Josh Morant kicks it out.

[01:23] Team_023 possession (Score: 40-36)
Kyle Paul attempts a 3Pt. Contested by Giannis Banchero (6.0 feet, MAN). KYLE PAUL MAKES IT! Assist: Tim Bane
Score: 40-39

[01:09] Team_029 possession (Score: 40-39)
Scottie Bird attempts a 3Pt. Contested by Trae Ingram (5.6 feet, ZONE). Scottie Bird misses. Rebound secured by Josh Morant.

[00:52] Team_023 possession (Score: 40-39)
Kyle Paul attempts a Midrange. Wide open! Giannis Banchero is 6.0 feet away. [MAN] Kyle Paul misses. Rebound secured by Giannis Banchero.

[00:41] Team_029 possession (Score: 40-39)
Devin Butler attempts a Midrange. Contested by Kyle Paul (5.5 feet, ZONE). Devin Butler misses. Rebound secured by Josh Morant.

[00:32] Team_023 possession (Score: 40-39)
Tim Bane drives to the basket... Tim Bane throws a bad pass! Stolen by James Wall! TURNOVER! (live ball)

[00:20] Team_029 possession (Score: 40-39)
James Wall drives, picks up Josh Morant. Help arrives from Trae Ingram! James Wall attempts a Dunk. Wide open! Trae Ingram is 6.4 feet away. [MAN] JAMES WALL MAKES IT! Assist: Giannis Banchero
Score: 42-39

[00:10] Team_023 possession (Score: 42-39)
Kyle Paul attempts a 3Pt. Wide open! Giannis Banchero is 6.2 feet away. [MAN] Kyle Paul misses. Offensive rebound by Josh Morant! Josh Morant kicks it out.

================================================================================
                              2ND QUARTER COMPLETE                              
================================================================================

2ND QUARTER SCORE: Team_029 23, Team_023 19

BOX SCORE:
================================================================================

Team_029
--------------------------------------------------------------------------------
Player                MIN  PTS  REB  AST  TO      FG   FG%      3P   3P%
--------------------------------------------------------------------------------
James Wall             24    8    3    1   0   3/5    60.0     0/0   0.0
Devin Butler           24    7    3    0   0   3/4    75.0     0/0   0.0
Paul Iverson           24    5    0    0   0   2/3    66.7     0/0   0.0
Scottie Bird           24    1    0    0   0   1/3    33.3     0/0   0.0
Giannis Banchero       24    0    4    1   0   0/4     0.0     0/0   0.0

TEAM: FG: 9/19 (47.4%), 3PT: 1/8 (12.5%), REB: 10 (2 off, 8 def), AST: 2, TO: 2
TEAM FOULS: 5 [Team_023 in BONUS]


Team_023
--------------------------------------------------------------------------------
Player                MIN  PTS  REB  AST  TO      FG   FG%      3P   3P%
--------------------------------------------------------------------------------
Tim Bane               24    7    4    2   0   3/3   100.0     0/0   0.0
Kyle Paul              24    6    2    0   0   3/5    60.0     0/0   0.0
Collin Ginobili        24    3    0    1   0   1/2    50.0     0/0   0.0
Trae Ingram            24    3    0    0   0   1/3    33.3     0/0   0.0
Josh Morant            24    0   12    1   0   0/3     0.0     0/0   0.0

TEAM: FG: 8/16 (50.0%), 3PT: 4/7 (57.1%), REB: 18 (8 off, 10 def), AST: 4, TO: 4
TEAM FOULS: 8 [Team_029 in BONUS]

================================================================================

================================================================================
                       3RD QUARTER - Team_029 vs Team_023                       
================================================================================

[12:00] Team_029 possession (Score: 42-39)
Giannis Banchero attempts a 3Pt. Contested by Kyle Paul (3.4 feet, ZONE). GIANNIS BANCHERO MAKES IT! Assist: Scottie Bird
Score: 45-39

[11:45] Team_023 possession (Score: 45-39)
Tim Bane attempts a Layup. Contested by Devin Butler (4.5 feet, MAN). TIM BANE MAKES IT! Assist: Collin Ginobili
Score: 45-41

[11:30] Team_029 possession (Score: 45-41)
Devin Butler commits a violation (traveling/carry)! TURNOVER! (dead ball)

[11:21] Team_023 possession (Score: 45-41)
Trae Ingram attempts a 3Pt. Contested by Paul Iverson (4.2 feet, MAN). Trae Ingram misses. Offensive rebound by Tim Bane! Tim Bane puts it back in!
Score: 45-43

[11:06] Team_029 possession (Score: 45-43)
FOUL! Reach-in foul on Josh Morant during the drive. [Team fouls: 1] No free throws, side out. (Josh Morant: 1 personal fouls)

[10:52] Team_029 possession (Score: 45-43)
James Wall makes the Midrange and draws the foul on Josh Morant! And-1! James Wall to the line for 1. [Team fouls: 2] (Josh Morant: 2 personal fouls)   FT 1/1: GOOD James Wall makes 1/1 from the line.
Score: 48-43

[10:39] Team_023 possession (Score: 48-43)
Josh Morant drives and kicks out. Josh Morant attempts a 3Pt. Contested by Giannis Banchero (3.5 feet, ZONE). JOSH MORANT MAKES IT! Assist: Kyle Paul
Score: 48-46

[10:26] Team_029 possession (Score: 48-46)
James Wall drives to the basket... James Wall throws a bad pass! Stolen by Josh Morant! TURNOVER! (live ball)

[10:08] Team_023 possession (Score: 48-46)
Collin Ginobili attempts a 3Pt. Contested by Giannis Banchero (4.1 feet, ZONE). Collin Ginobili misses. Offensive rebound by Tim Bane! Tim Bane puts it back in!
Score: 48-48

[09:53] Team_029 possession (Score: 48-48)
FOUL! Offensive foul on James Wall! Josh Morant drew the charge! [Team fouls: 1] (James Wall: 1 personal fouls) TURNOVER! (dead ball)

[09:38] Team_023 possession (Score: 48-48)
Trae Ingram attempts a 3Pt. Contested by Giannis Banchero (3.5 feet, ZONE). TRAE INGRAM MAKES IT! Assist: Kyle Paul
Score: 48-51

[09:24] Team_029 possession (Score: 48-51)
Paul Iverson drives and kicks out. Scottie Bird attempts a Midrange. Contested by Collin Ginobili (4.9 feet, MAN). Scottie Bird misses. Rebound secured by Tim Bane.

[09:06] Team_023 possession (Score: 48-51)
Tim Bane attempts a Midrange. Contested by Devin Butler (4.5 feet, MAN). Tim Bane misses. Offensive rebound by Tim Bane! Tim Bane's putback is no good. Rebound secured by James Wall.

[08:51] Team_029 possession (Score: 48-51)
FOUL! Reach-in foul on Tim Bane during the drive. [Team fouls: 3] No free throws, side out. (Tim Bane: 1 personal fouls)

[08:36] Team_029 possession (Score: 48-51)
Paul Iverson attempts a Midrange. Contested by Trae Ingram (3.6 feet, MAN). Paul Iverson misses. Rebound secured by Josh Morant.

[08:25] Team_023 possession (Score: 48-51)
Josh Morant attempts a Layup. Contested by James Wall (2.8 feet, MAN). JOSH MORANT MAKES IT! Assist: Trae Ingram
Score: 48-53

[08:13] Team_029 possession (Score: 48-53)
Paul Iverson attempts a 3Pt. Contested by Trae Ingram (3.6 feet, MAN). PAUL IVERSON MAKES IT! Assist: Devin Butler
Score: 51-53

[07:59] Team_023 possession (Score: 51-53)
Trae Ingram attempts a 3Pt. Contested by Paul Iverson (4.2 feet, MAN). TRAE INGRAM MAKES IT! Assist: Collin Ginobili
Score: 51-56

[07:41] Team_029 possession (Score: 51-56)
Devin Butler attempts a 3Pt. Contested by Kyle Paul (3.3 feet, ZONE). Devin Butler misses. Rebound secured by Josh Morant.

[07:26] Team_023 possession (Score: 51-56)
Josh Morant attempts a Layup. BLOCKED BY JAMES WALL! Ball goes out off James Wall. Josh Morant's ball!

[07:15] Team_023 possession (Score: 51-56)
Tim Bane drives and kicks out. Josh Morant attempts a Midrange. Contested by James Wall (2.6 feet, MAN). Josh Morant misses. Rebound secured by Devin Butler.

[07:01] Team_029 possession (Score: 51-56)
James Wall attempts a 3Pt. Contested by Kyle Paul (3.4 feet, ZONE). James Wall misses. Rebound secured by Josh Morant.

[06:48] Team_023 possession (Score: 51-56)
Kyle Paul makes the Midrange and draws the foul on Giannis Banchero! And-1! Kyle Paul to the line for 1. [Team fouls: 2] (Giannis Banchero: 1 personal fouls)   FT 1/1: GOOD Kyle Paul makes 1/1 from the line.
Score: 51-59

[06:34] Team_029 possession (Score: 51-59)
Scottie Bird drives, picks up Josh Morant. Help arrives from Trae Ingram! Scottie Bird attempts a Dunk. Contested by Trae Ingram (4.4 feet, ZONE). SCOTTIE BIRD MAKES IT!
Score: 53-59

[06:20] Team_023 possession (Score: 53-59)
Trae Ingram attempts a 3Pt. Contested by Paul Iverson (4.2 feet, MAN). Trae Ingram misses. Offensive rebound by Josh Morant! Josh Morant kicks it out.

[06:08] Team_023 possession (Score: 53-59)
Trae Ingram makes the Dunk and draws the foul on James Wall! And-1! Trae Ingram to the line for 1. [Team fouls: 3] (James Wall: 2 personal fouls)   FT 1/1: GOOD Trae Ingram makes 1/1 from the line.
Score: 53-62

[05:54] Team_029 possession (Score: 53-62)
FOUL! Holding foul on Collin Ginobili. [Team fouls: 4] No free throws, side out. (Collin Ginobili: 1 personal fouls)

[05:40] Team_029 possession (Score: 53-62)
Scottie Bird attempts a Midrange. Contested by Collin Ginobili (5.2 feet, MAN). Scottie Bird misses. FOUL! Loose ball foul on Tim Bane during the rebound battle. [IN THE BONUS! 5 team fouls] James Wall to the line for 2 free throws. (Tim Bane: 2 personal fouls)   FT 1/2: GOOD   FT 2/2: GOOD James Wall makes 2/2 from the line.
Score: 55-62

[05:28] Team_023 possession (Score: 55-62)
Trae Ingram throws a bad pass! Stolen by Paul Iverson! TURNOVER! (live ball)

[05:12] Team_029 possession (Score: 55-62)
Giannis Banchero attempts a 3Pt. Contested by Kyle Paul (3.4 feet, MAN). GIANNIS BANCHERO MAKES IT! Assist: James Wall
Score: 58-62

[05:01] Team_023 possession (Score: 58-62)
Trae Ingram attempts a 3Pt. Contested by Giannis Banchero (3.6 feet, ZONE). Trae Ingram misses. Rebound secured by Giannis Banchero.

[04:45] Team_029 possession (Score: 58-62)
Devin Butler attempts a Midrange. Contested by Tim Bane (4.4 feet, MAN). DEVIN BUTLER MAKES IT! Assist: Scottie Bird
Score: 60-62

[04:30] Team_023 possession (Score: 60-62)
Trae Ingram attempts a 3Pt. Contested by Paul Iverson (4.3 feet, MAN). Trae Ingram misses. Rebound secured by James Wall.

[04:15] Team_029 possession (Score: 60-62)
FOUL! Shooting foul on Tim Bane. Giannis Banchero to the line for 2 free throws. [BONUS: 6 team fouls] (Tim Bane: 3 personal fouls)   FT 1/2: MISS   FT 2/2: MISS Giannis Banchero makes 0/2 from the line. Rebound secured by Kyle Paul.

[04:01] Team_023 possession (Score: 60-62)
Josh Morant attempts a 3Pt. Contested by James Wall (2.9 feet, MAN). Josh Morant misses. Offensive rebound by Tim Bane! Tim Bane's putback is no good. Rebound secured by Devin Butler.

[03:51] Team_029 possession (Score: 60-62)
Scottie Bird attempts a Midrange. Contested by Josh Morant (4.5 feet, ZONE). Scottie Bird misses. Rebound secured by Kyle Paul.

[03:36] Team_023 possession (Score: 60-62)
Collin Ginobili attempts a Layup. BLOCKED BY SCOTTIE BIRD! Ball is loose! Rebound secured by James Wall.

[03:20] Team_029 possession (Score: 60-62)
Scottie Bird attempts a 3Pt. Contested by Kyle Paul (3.4 feet, ZONE). Scottie Bird misses. Rebound secured by Kyle Paul.

[03:07] Team_023 possession (Score: 60-62)
Kyle Paul attempts a Layup. BLOCKED BY GIANNIS BANCHERO! Ball is loose! Rebound secured by Devin Butler.

[02:49] Team_029 possession (Score: 60-62)
FOUL! Shooting foul on Kyle Paul. Scottie Bird to the line for 3 free throws. [BONUS: 7 team fouls] (Kyle Paul: 1 personal fouls)   FT 1/3: GOOD   FT 2/3: GOOD   FT 3/3: GOOD Scottie Bird makes 3/3 from the line.
Score: 63-62

[02:35] Team_023 possession (Score: 63-62)
Tim Bane attempts a Midrange. Contested by Devin Butler (4.8 feet, MAN). Tim Bane misses. Offensive rebound by Tim Bane! Tim Bane's putback is no good. Rebound secured by Giannis Banchero.

[02:20] Team_029 possession (Score: 63-62)
James Wall attempts a Midrange. Contested by Josh Morant (4.9 feet, MAN). James Wall misses. Rebound secured by Kyle Paul.

[02:09] Team_023 possession (Score: 63-62)
Collin Ginobili attempts a 3Pt. Contested by Giannis Banchero (4.4 feet, ZONE). Collin Ginobili misses. Rebound secured by James Wall.

[01:56] Team_029 possession (Score: 63-62)
Devin Butler attempts a Layup. BLOCKED BY TIM BANE! Ball is loose! Offensive rebound by James Wall! James Wall kicks it out.

[01:42] Team_029 possession (Score: 63-62)
Giannis Banchero attempts a 3Pt. Contested by Josh Morant (4.9 feet, ZONE). GIANNIS BANCHERO MAKES IT! Assist: James Wall
Score: 66-62

[01:25] Team_023 possession (Score: 66-62)
Kyle Paul attempts a 3Pt. Contested by Paul Iverson (4.9 feet, ZONE). Kyle Paul misses. Rebound secured by Devin Butler.

[01:11] Team_029 possession (Score: 66-62)
James Wall attempts a Layup. BLOCKED BY TRAE INGRAM! Ball is loose! Rebound secured by Josh Morant.

[00:56] Team_023 possession (Score: 66-62)
Trae Ingram attempts a 3Pt. Contested by Giannis Banchero (4.1 feet, ZONE). TRAE INGRAM MAKES IT! Assist: Josh Morant
Score: 66-65

[00:42] Team_029 possession (Score: 66-65)
FOUL! Holding foul on Tim Bane. [IN THE BONUS! 8 team fouls] Devin Butler to the line for 2 free throws. (Tim Bane: 4 personal fouls)   FT 1/2: GOOD   FT 2/2: MISS Devin Butler makes 1/2 from the line. Offensive rebound by Devin Butler! Devin Butler kicks it out.
Score: 67-65

[00:27] Team_029 possession (Score: 67-65)
Devin Butler attempts a Midrange. Contested by Tim Bane (4.9 feet, MAN). DEVIN BUTLER MAKES IT! Assist: Scottie Bird
Score: 69-65

[00:14] Team_023 possession (Score: 69-65)
Collin Ginobili attempts a Layup. BLOCKED BY SCOTTIE BIRD! Ball deflects out of bounds off Collin Ginobili.

[00:01] Team_029 possession (Score: 69-65)
Paul Iverson makes the Layup and draws the foul on Trae Ingram! And-1! Paul Iverson to the line for 1. [BONUS: 9 team fouls] (Trae Ingram: 1 personal fouls)   FT 1/1: GOOD Paul Iverson makes 1/1 from the line.
Score: 72-65

================================================================================
                              3RD QUARTER COMPLETE                              
================================================================================

3RD QUARTER SCORE: Team_029 30, Team_023 26

BOX SCORE:
================================================================================

Team_029
--------------------------------------------------------------------------------
Player                MIN  PTS  REB  AST  TO      FG   FG%      3P   3P%
--------------------------------------------------------------------------------
Giannis Banchero       36    9    2    0   0   3/4    75.0     0/0   0.0
Paul Iverson           36    6    0    0   0   2/4    50.0     0/0   0.0
Scottie Bird           36    5    0    3   0   2/4    50.0     0/0   0.0
James Wall             36    5    5    2   0   2/5    40.0     0/0   0.0
Devin Butler           36    4    5    1   0   2/3    66.7     0/0   0.0

TEAM: FG: 11/20 (55.0%), 3PT: 5/8 (62.5%), REB: 9 (2 off, 7 def), AST: 6, TO: 3
TEAM FOULS: 3


Team_023
--------------------------------------------------------------------------------
Player                MIN  PTS  REB  AST  TO      FG   FG%      3P   3P%
--------------------------------------------------------------------------------
Trae Ingram            36   12    0    1   0   4/6    66.7     0/0   0.0
Tim Bane               36    6    3    0   0   3/6    50.0     0/0   0.0
Josh Morant            36    5    5    1   0   2/3    66.7     0/0   0.0
Kyle Paul              36    3    4    2   0   1/3    33.3     0/0   0.0
Collin Ginobili        36    0    0    2   0   0/3     0.0     0/0   0.0

TEAM: FG: 10/21 (47.6%), 3PT: 5/10 (50.0%), REB: 15 (6 off, 9 def), AST: 6, TO: 1
TEAM FOULS: 9 [Team_029 in BONUS]

================================================================================

================================================================================
                       4TH QUARTER - Team_029 vs Team_023                       
================================================================================

[12:00] Team_029 possession (Score: 72-65)
Giannis Banchero attempts a Midrange. Contested by Kyle Paul (3.8 feet, MAN). GIANNIS BANCHERO MAKES IT! Assist: Scottie Bird
Score: 74-65

[11:43] Team_023 possession (Score: 74-65)
FOUL! Shooting foul on Scottie Bird. Tim Bane to the line for 2 free throws. [Team fouls: 1] (Scottie Bird: 1 personal fouls)   FT 1/2: GOOD   FT 2/2: GOOD Tim Bane makes 2/2 from the line.
Score: 74-67

[11:26] Team_029 possession (Score: 74-67)
Paul Iverson attempts a 3Pt. Contested by Trae Ingram (4.0 feet, ZONE). Paul Iverson misses. Rebound secured by Tim Bane.

[11:13] Team_023 possession (Score: 74-67)
Tim Bane drives, Devin Butler stays with him. Tim Bane attempts a Dunk. Contested by Devin Butler (4.9 feet, MAN). TIM BANE MAKES IT! Assist: Collin Ginobili
Score: 74-69

[11:01] Team_029 possession (Score: 74-69)
Paul Iverson attempts a Midrange. Contested by Trae Ingram (4.1 feet, MAN). Paul Iverson misses. Rebound secured by Josh Morant.

[10:49] Team_023 possession (Score: 74-69)
Tim Bane attempts a 3Pt. Contested by Giannis Banchero (4.5 feet, ZONE). Tim Bane misses. Rebound secured by Devin Butler.

[10:34] Team_029 possession (Score: 74-69)
Giannis Banchero attempts a 3Pt. Contested by Trae Ingram (4.4 feet, ZONE). Giannis Banchero misses. FOUL! Loose ball foul on Kyle Paul during the rebound battle. [Team fouls: 1] No free throws, side out. (Kyle Paul: 1 personal fouls)

[10:17] Team_029 possession (Score: 74-69)
James Wall attempts a Layup. BLOCKED BY TIM BANE! Ball is loose! Rebound secured by Josh Morant.

[10:06] Team_023 possession (Score: 74-69)
Tim Bane drives, Devin Butler stays with him. Tim Bane attempts a Dunk. Contested by Devin Butler (5.0 feet, MAN). Tim Bane misses. Rebound secured by James Wall.

[09:49] Team_029 possession (Score: 74-69)
Paul Iverson drives to the basket... Paul Iverson loses the ball! Stripped by Trae Ingram! TURNOVER! (live ball)

[09:34] Team_023 possession (Score: 74-69)
FOUL! Shooting foul on Giannis Banchero. Kyle Paul to the line for 3 free throws. [Team fouls: 2] (Giannis Banchero: 1 personal fouls)   FT 1/3: MISS   FT 2/3: GOOD   FT 3/3: GOOD Kyle Paul makes 2/3 from the line.
Score: 74-71

[09:19] Team_029 possession (Score: 74-71)
Scottie Bird attempts a Midrange. Contested by Collin Ginobili (5.7 feet, ZONE). Scottie Bird misses. Rebound secured by Josh Morant.

[09:06] Team_023 possession (Score: 74-71)
Kyle Paul attempts a Layup. Contested by Giannis Banchero (4.7 feet, MAN). Kyle Paul misses. Rebound secured by James Wall.

[08:51] Team_029 possession (Score: 74-71)
James Wall attempts a 3Pt. Contested by Trae Ingram (4.7 feet, ZONE). James Wall misses. Rebound secured by Tim Bane.

[08:41] Team_023 possession (Score: 74-71)
FOUL! Shooting foul on Paul Iverson. Kyle Paul to the line for 2 free throws. [Team fouls: 3] (Paul Iverson: 1 personal fouls)   FT 1/2: GOOD   FT 2/2: GOOD Kyle Paul makes 2/2 from the line.
Score: 74-73

[08:29] Team_029 possession (Score: 74-73)
Scottie Bird drives to the basket... Scottie Bird loses the ball! Stripped by Tim Bane! TURNOVER! (live ball)

[08:17] Team_023 possession (Score: 74-73)
Josh Morant attempts a Layup. BLOCKED BY JAMES WALL! Ball is loose! Rebound secured by Devin Butler.

[08:00] Team_029 possession (Score: 74-73)
James Wall drives, picks up Josh Morant. Help arrives from Trae Ingram! James Wall attempts a Layup. Contested by Trae Ingram (5.4 feet, ZONE). James Wall misses. Rebound secured by Josh Morant.

[07:44] Team_023 possession (Score: 74-73)
Trae Ingram loses control! Ball rolls out of bounds! TURNOVER! (dead ball)

[07:44] Substitution (Team_029): Paul Iverson OUT → Immanuel Irving IN (stamina_rule2)

[07:44] Substitution (Team_029): Scottie Bird OUT → Bones Carter IN (stamina_rule2)

[07:44] Substitution (Team_029): Giannis Banchero OUT → Pau Anthony IN (stamina_rule2)

[07:44] Substitution (Team_029): James Wall OUT → Derrick Rozier IN (stamina_rule2)

[07:44] Substitution (Team_029): Devin Butler OUT → Shai Ball IN (stamina_rule2)

[07:44] Substitution (Team_023): Trae Ingram OUT → Tracy Anthony IN (stamina_rule2)

[07:44] Substitution (Team_023): Collin Ginobili OUT → Magic Booker IN (stamina_rule2)

[07:44] Substitution (Team_023): Kyle Paul OUT → Gary Westbrook IN (stamina_rule2)

[07:44] Substitution (Team_023): Josh Morant OUT → Evan Parker IN (stamina_rule2)

[07:44] Substitution (Team_023): Tim Bane OUT → Vince Gasol IN (stamina_rule2)

[07:25] Team_029 possession (Score: 74-73)
Derrick Rozier attempts a 3Pt. Contested by Tracy Anthony (3.9 feet, ZONE). Derrick Rozier misses. Rebound secured by Vince Gasol.

[07:09] Team_023 possession (Score: 74-73)
Vince Gasol drives to the basket... Vince Gasol loses the ball! Stripped by Shai Ball! TURNOVER! (live ball)

[06:55] Team_029 possession (Score: 74-73)
Immanuel Irving drives and kicks out. Immanuel Irving attempts a 3Pt. Contested by Tracy Anthony (3.6 feet, MAN). Immanuel Irving misses. Rebound secured by Vince Gasol.

[06:37] Team_023 possession (Score: 74-73)
Magic Booker attempts a 3Pt. Contested by Pau Anthony (3.4 feet, ZONE). Magic Booker misses. Offensive rebound by Vince Gasol! Vince Gasol puts it back in!
Score: 74-75

[06:20] Team_029 possession (Score: 74-75)
Pau Anthony attempts a 3Pt. Contested by Tracy Anthony (4.0 feet, ZONE). Pau Anthony misses. Rebound secured by Evan Parker.

[06:05] Team_023 possession (Score: 74-75)
Magic Booker attempts a 3Pt. Contested by Immanuel Irving (4.9 feet, ZONE). Magic Booker misses. Rebound secured by Derrick Rozier.

[05:52] Team_029 possession (Score: 74-75)
Pau Anthony attempts a Midrange. BLOCKED BY MAGIC BOOKER! Ball is loose! Rebound secured by Gary Westbrook.

[05:39] Team_023 possession (Score: 74-75)
Tracy Anthony attempts a Layup. Contested by Derrick Rozier (4.0 feet, ZONE). TRACY ANTHONY MAKES IT!
Score: 74-77

[05:26] Team_029 possession (Score: 74-77)
Derrick Rozier drives to the basket... Derrick Rozier loses the ball! Stripped by Evan Parker! TURNOVER! (live ball)

[05:11] Team_023 possession (Score: 74-77)
Evan Parker makes the Dunk and draws the foul on Bones Carter! And-1! Evan Parker to the line for 1. [Team fouls: 4] (Bones Carter: 1 personal fouls)   FT 1/1: GOOD Evan Parker makes 1/1 from the line.
Score: 74-80

[04:57] Team_029 possession (Score: 74-80)
Pau Anthony attempts a Midrange. Contested by Evan Parker (3.4 feet, ZONE). Pau Anthony misses. Rebound secured by Vince Gasol.

[04:45] Team_023 possession (Score: 74-80)
FOUL! Shooting foul on Shai Ball. Vince Gasol to the line for 2 free throws. [BONUS: 5 team fouls] (Shai Ball: 1 personal fouls)   FT 1/2: GOOD   FT 2/2: GOOD Vince Gasol makes 2/2 from the line.
Score: 74-82

[04:30] Team_029 possession (Score: 74-82)
Derrick Rozier drives to the basket... Derrick Rozier commits a violation (traveling/carry)! TURNOVER! (dead ball)

[04:18] Team_023 possession (Score: 74-82)
Tracy Anthony attempts a Midrange. Contested by Pau Anthony (3.8 feet, ZONE). Tracy Anthony misses. Offensive rebound by Evan Parker! Evan Parker puts it back in!
Score: 74-84

[04:00] Team_029 possession (Score: 74-84)
Shai Ball drives and kicks out. Derrick Rozier attempts a 3Pt. Contested by Evan Parker (3.0 feet, MAN). Derrick Rozier misses. Rebound secured by Vince Gasol.

[03:47] Team_023 possession (Score: 74-84)
Magic Booker attempts a 3Pt. Contested by Pau Anthony (3.4 feet, ZONE). Magic Booker misses. Rebound secured by Shai Ball.

[03:32] Team_029 possession (Score: 74-84)
FOUL! Holding foul on Evan Parker. [Team fouls: 2] No free throws, side out. (Evan Parker: 1 personal fouls)

[03:19] Team_029 possession (Score: 74-84)
FOUL! Shooting foul on Vince Gasol. Shai Ball to the line for 2 free throws. [Team fouls: 3] (Vince Gasol: 1 personal fouls)   FT 1/2: GOOD   FT 2/2: GOOD Shai Ball makes 2/2 from the line.
Score: 76-84

[03:07] Team_023 possession (Score: 76-84)
Gary Westbrook drives, Pau Anthony stays with him. Gary Westbrook attempts a Layup. Contested by Pau Anthony (4.0 feet, MAN). GARY WESTBROOK MAKES IT!
Score: 76-86

[02:52] Team_029 possession (Score: 76-86)
FOUL! Shooting foul on Vince Gasol. Pau Anthony to the line for 2 free throws. [Team fouls: 4] (Vince Gasol: 2 personal fouls)   FT 1/2: MISS   FT 2/2: GOOD Pau Anthony makes 1/2 from the line.
Score: 77-86

[02:40] Team_023 possession (Score: 77-86)
Vince Gasol drives to the basket... Vince Gasol loses the ball! Stripped by Derrick Rozier! TURNOVER! (live ball)

[02:27] Team_029 possession (Score: 77-86)
FOUL! Shooting foul on Vince Gasol. Derrick Rozier to the line for 2 free throws. [BONUS: 5 team fouls] (Vince Gasol: 3 personal fouls)   FT 1/2: GOOD   FT 2/2: GOOD Derrick Rozier makes 2/2 from the line.
Score: 79-86

[02:16] Team_023 possession (Score: 79-86)
Evan Parker attempts a 3Pt. Contested by Derrick Rozier (4.0 feet, MAN). Evan Parker misses. FOUL! Loose ball foul on Pau Anthony during the rebound battle. [IN THE BONUS! 6 team fouls] Evan Parker to the line for 2 free throws. (Pau Anthony: 1 personal fouls)   FT 1/2: GOOD   FT 2/2: GOOD Evan Parker makes 2/2 from the line.
Score: 79-88

[02:00] Team_029 possession (Score: 79-88)
Shai Ball attempts a Midrange. Contested by Evan Parker (3.4 feet, ZONE). Shai Ball misses. Rebound secured by Gary Westbrook.

[01:49] Team_023 possession (Score: 79-88)
Tracy Anthony attempts a Layup. Contested by Immanuel Irving (5.2 feet, MAN). TRACY ANTHONY MAKES IT!
Score: 79-90

[01:37] Team_029 possession (Score: 79-90)
Shai Ball attempts a 3Pt. Contested by Gary Westbrook (4.2 feet, ZONE). Shai Ball misses. Rebound secured by Vince Gasol.

[01:21] Team_023 possession (Score: 79-90)
Vince Gasol drives, Derrick Rozier stays with him. Vince Gasol attempts a Dunk. Contested by Derrick Rozier (4.0 feet, ZONE). VINCE GASOL MAKES IT!
Score: 79-92

[01:08] Team_029 possession (Score: 79-92)
Immanuel Irving attempts a 3Pt. Contested by Magic Booker (4.8 feet, ZONE). Immanuel Irving misses. Rebound secured by Gary Westbrook.

[00:55] Team_023 possession (Score: 79-92)
FOUL! Holding foul on Bones Carter. [IN THE BONUS! 7 team fouls] Magic Booker to the line for 2 free throws. (Bones Carter: 2 personal fouls)   FT 1/2: GOOD   FT 2/2: GOOD Magic Booker makes 2/2 from the line.
Score: 79-94

[00:44] Team_029 possession (Score: 79-94)
Pau Anthony attempts a 3Pt. Contested by Gary Westbrook (4.3 feet, MAN). Pau Anthony misses. Rebound secured by Evan Parker.

[00:32] Team_023 possession (Score: 79-94)
Vince Gasol drives, Shai Ball stays with him. Vince Gasol attempts a Layup. Contested by Shai Ball (3.9 feet, MAN). VINCE GASOL MAKES IT! Assist: Evan Parker
Score: 79-96

[00:16] Team_029 possession (Score: 79-96)
Derrick Rozier attempts a 3Pt. Contested by Magic Booker (4.6 feet, ZONE). Derrick Rozier misses. Rebound secured by Vince Gasol.

================================================================================
                              4TH QUARTER COMPLETE                              
================================================================================

4TH QUARTER SCORE: Team_029 7, Team_023 31

BOX SCORE:
================================================================================

Team_029
--------------------------------------------------------------------------------
Player                MIN  PTS  REB  AST  TO      FG   FG%      3P   3P%
--------------------------------------------------------------------------------
Giannis Banchero       41    2    0    0   0   1/1   100.0     0/0   0.0
Derrick Rozier          7    2    1    0   0   1/3    33.3     0/0   0.0
Shai Ball               7    2    1    0   0   1/4    25.0     0/0   0.0
Pau Anthony             7    1    0    0   0   1/5    20.0     0/0   0.0
Scottie Bird           41    0    0    1   0   0/1     0.0     0/0   0.0
Paul Iverson           41    0    0    0   0   0/2     0.0     0/0   0.0
Devin Butler           41    0    2    0   0   0/0     0.0     0/0   0.0
James Wall             41    0    3    0   0   0/3     0.0     0/0   0.0
Immanuel Irving         7    0    0    0   0   0/2     0.0     0/0   0.0

TEAM: FG: 4/21 (19.0%), 3PT: 0/8 (0.0%), REB: 7 (1 off, 6 def), AST: 1, TO: 4
TEAM FOULS: 7 [Team_023 in BONUS]


Team_023
--------------------------------------------------------------------------------
Player                MIN  PTS  REB  AST  TO      FG   FG%      3P   3P%
--------------------------------------------------------------------------------
Vince Gasol             7    8    7    0   0   4/4   100.0     0/0   0.0
Evan Parker             7    7    3    1   0   3/3   100.0     0/0   0.0
Tim Bane               41    4    2    0   0   2/4    50.0     0/0   0.0
Kyle Paul              41    4    0    0   0   2/3    66.7     0/0   0.0
Tracy Anthony           7    4    0    0   0   2/2   100.0     0/0   0.0
Magic Booker            7    2    0    0   0   1/3    33.3     0/0   0.0
Gary Westbrook          7    2    3    0   0   1/1   100.0     0/0   0.0
Collin Ginobili        41    0    0    1   0   0/0     0.0     0/0   0.0
Josh Morant            41    0    4    0   0   0/1     0.0     0/0   0.0

TEAM: FG: 15/21 (71.4%), 3PT: 3/6 (50.0%), REB: 19 (2 off, 17 def), AST: 2, TO: 3
TEAM FOULS: 5 [Team_029 in BONUS]

================================================================================

================================================================================
                               FULL GAME COMPLETE                               
================================================================================

FINAL SCORE: Team_029 79, Team_023 96

SCORING BY QUARTER:
--------------------------------------------------------------------------------
Team                     Q1     Q2     Q3     Q4    FINAL
--------------------------------------------------------------------------------
Team_029                 19     23     30      7       79
Team_023                 20     19     26     31       96
--------------------------------------------------------------------------------

FULL GAME BOX SCORE:
================================================================================

Team_029
--------------------------------------------------------------------------------
Player                MIN  PTS  REB  AST  TO      FG   FG%      3P   3P%      FT STL BLK
--------------------------------------------------------------------------------
Paul Iverson           41   11    0    0   2   4/9    44.4   2/4    50.0   3/3     1   0
Scottie Bird           41    8    0    6   2   4/10   40.0   1/4    25.0   6/7     0   2
Giannis Banchero       41   14   10    1   1   5/14   35.7   3/7    42.9   1/4     0   1
James Wall             41   23   16    3   2   9/21   42.9   1/6    16.7   6/7     3   3
Devin Butler           41   15   14    1   2   6/9    66.7   0/1     0.0   6/7     1   0
Immanuel Irving         7    0    0    0   0   0/2     0.0   0/1     0.0   0/0     0   0
Bones Carter            7    0    0    0   1   0/0     0.0   0/0     0.0   0/0     0   0
Pau Anthony             7    1    0    0   0   1/5    20.0   0/2     0.0   1/2     0   0
Derrick Rozier          7    2    1    0   0   1/3    33.3   0/2     0.0   2/2     1   0
Shai Ball               7    2    1    0   1   1/4    25.0   0/1     0.0   2/2     1   0

TEAM: FG: 33/79 (41.8%), 3PT: 7/28 (25.0%), REB: 37 (8 off, 29 def), AST: 11, TO: 11


Team_023
--------------------------------------------------------------------------------
Player                MIN  PTS  REB  AST  TO      FG   FG%      3P   3P%      FT STL BLK
--------------------------------------------------------------------------------
Trae Ingram            41   15    0    2   3   7/13   53.8   5/9    55.6   1/1     1   1
Collin Ginobili        41    3    0    5   1   3/9    33.3   2/3    66.7   0/0     0   1
Kyle Paul              41   20   10    2   0   9/16   56.2   2/5    40.0   7/9     0   0
Josh Morant            41    7   22    2   3   3/11   27.3   0/3     0.0   0/0     1   0
Tim Bane               41   28   16    3   1   9/15   60.0   1/3    33.3   5/5     2   3
Tracy Anthony           7    4    0    0   0   3/3   100.0   0/0     0.0   0/0     0   0
Magic Booker            7    2    0    0   0   1/3    33.3   1/3    33.3   2/2     0   1
Gary Westbrook          7    2    3    0   1   1/1   100.0   0/0     0.0   0/0     0   0
Evan Parker             7    7    3    1   0   2/2   100.0   1/1   100.0   3/3     1   0
Vince Gasol             7    8    7    0   1   3/3   100.0   0/0     0.0   2/2     0   0

TEAM: FG: 42/77 (54.5%), 3PT: 12/27 (44.4%), REB: 66 (20 off, 46 def), AST: 15, TO: 10

================================================================================
