================================================================================
                        FULL GAME - Team_098 vs Team_056                        
================================================================================

================================================================================
                       1ST QUARTER - Team_098 vs Team_056                       
================================================================================

[12:00] Team_098 possession (Score: 0-0)
FOUL! Holding foul on Tony Carter. [Team fouls: 1] No free throws, side out. (Tony Carter: 1 personal fouls)

[11:44] Team_098 possession (Score: 0-0)
Pascal Lillard throws a bad pass! Stolen by Jrue Lillard! TURNOVER! (live ball)

[11:28] Team_056 possession (Score: 0-0)
Jrue Lillard attempts a Midrange. Contested by Pascal Lillard (4.7 feet, MAN). Jrue Lillard misses. Offensive rebound by Jrue Lillard! Jrue Lillard's putback is no good. Rebound secured by Derrick Durant.

[11:16] Team_098 possession (Score: 0-0)
FOUL! Reach-in foul on Tony Carter during the drive. [Team fouls: 2] No free throws, side out. (Tony Carter: 2 personal fouls)

[11:02] Team_098 possession (Score: 0-0)
Pascal Lillard attempts a 3Pt. Contested by Tony Carter (4.7 feet, ZONE). Pascal Lillard misses. Rebound secured by Jrue Lillard.

[10:47] Team_056 possession (Score: 0-0)
FOUL! Offensive foul on Tony Carter! Blake Murray drew the charge! [Team fouls: 3] (Tony Carter: 3 personal fouls) TURNOVER! (dead ball)

[10:32] Team_098 possession (Score: 0-0)
Malcolm Tatum attempts a Midrange. Contested by Magic Russell (5.7 feet, ZONE). MALCOLM TATUM MAKES IT! Assist: Pascal Lillard
Score: 2-0

[10:19] Team_056 possession (Score: 2-0)
Magic Russell attempts a 3Pt. Contested by Nikola Rose (3.6 feet, ZONE). Magic Russell misses. Offensive rebound by Jrue Lillard! Jrue Lillard puts it back in!
Score: 2-2

[10:02] Team_098 possession (Score: 2-2)
Blake Murray attempts a 3Pt. Contested by Tony Carter (4.3 feet, MAN). Blake Murray misses. Rebound secured by Yao Poole.

[09:44] Team_056 possession (Score: 2-2)
Jrue Lillard attempts a 3Pt. Contested by Nikola Rose (3.8 feet, ZONE). Jrue Lillard misses. Offensive rebound by Yao Poole! Yao Poole kicks it out.

[09:25] Team_056 possession (Score: 2-2)
Giannis Jokic attempts a Midrange. Contested by Nikola Rose (3.6 feet, ZONE). GIANNIS JOKIC MAKES IT!
Score: 2-4

[09:08] Team_098 possession (Score: 2-4)
Malcolm Tatum attempts a 3Pt. Contested by Giannis Jokic (4.5 feet, ZONE). Malcolm Tatum misses. Rebound secured by Yao Poole.

[08:48] Team_056 possession (Score: 2-4)
Jrue Lillard drives, Pascal Lillard stays with him. Jrue Lillard attempts a Layup. Contested by Pascal Lillard (4.7 feet, MAN). JRUE LILLARD MAKES IT! Assist: Giannis Jokic
Score: 2-6

[08:33] Team_098 possession (Score: 2-6)
Pascal Lillard attempts a Midrange. Contested by Jrue Lillard (4.4 feet, MAN). Pascal Lillard misses. Rebound secured by Yao Poole.

[08:18] Team_056 possession (Score: 2-6)
Magic Russell throws a bad pass! Stolen by Nikola Rose! TURNOVER! (live ball)

[08:06] Team_098 possession (Score: 2-6)
Malcolm Tatum drives and kicks out. Pascal Lillard attempts a Midrange. Contested by Jrue Lillard (3.8 feet, MAN). PASCAL LILLARD MAKES IT!
Score: 4-6

[07:53] Team_056 possession (Score: 4-6)
Giannis Jokic attempts a 3Pt. Contested by Nikola Rose (3.6 feet, ZONE). Giannis Jokic misses. Rebound secured by Nikola Rose.

[07:37] Team_098 possession (Score: 4-6)
Blake Murray drives, picks up Tony Carter. Help arrives from Giannis Jokic! Blake Murray attempts a Dunk. Contested by Giannis Jokic (4.3 feet, MAN). Blake Murray misses. Rebound secured by Yao Poole.

[07:22] Team_056 possession (Score: 4-6)
FOUL! Reach-in foul on Pascal Lillard during the drive. [Team fouls: 1] No free throws, side out. (Pascal Lillard: 1 personal fouls)

[07:09] Team_056 possession (Score: 4-6)
Magic Russell attempts a 3Pt. Contested by Nikola Rose (3.6 feet, ZONE). Magic Russell misses. FOUL! Loose ball foul on Nikola Rose during the rebound battle. [Team fouls: 2] No free throws, side out. (Nikola Rose: 1 personal fouls)

[06:56] Team_056 possession (Score: 4-6)
Jrue Lillard drives, picks up Pascal Lillard. Help arrives from Nikola Rose! Jrue Lillard attempts a Dunk. Contested by Nikola Rose (4.7 feet, MAN). Jrue Lillard misses. Rebound secured by Pascal Lillard.

[06:45] Team_098 possession (Score: 4-6)
Derrick Durant drives to the basket... Derrick Durant commits a violation (traveling/carry)! TURNOVER! (dead ball)

[06:32] Team_056 possession (Score: 4-6)
Giannis Jokic drives and kicks out. Jrue Lillard attempts a 3Pt. Contested by Nikola Rose (3.2 feet, ZONE). Jrue Lillard misses. FOUL! Loose ball foul on Nikola Rose during the rebound battle. [Team fouls: 3] No free throws, side out. (Nikola Rose: 2 personal fouls)

[06:19] Team_056 possession (Score: 4-6)
Magic Russell attempts a 3Pt. Contested by Nikola Rose (3.6 feet, MAN). Magic Russell misses. Rebound secured by Nikola Rose.

[06:05] Team_098 possession (Score: 4-6)
Derrick Durant drives and kicks out. Derrick Durant attempts a 3Pt. Contested by Giannis Jokic (4.3 feet, ZONE). DERRICK DURANT MAKES IT! Assist: Pascal Lillard
Score: 7-6

[05:54] Team_056 possession (Score: 7-6)
Giannis Jokic attempts a 3Pt. Contested by Malcolm Tatum (4.3 feet, MAN). Giannis Jokic misses. Rebound secured by Derrick Durant.

[05:42] Team_098 possession (Score: 7-6)
FOUL! Holding foul on Giannis Jokic. [Team fouls: 4] No free throws, side out. (Giannis Jokic: 1 personal fouls)

[05:30] Team_098 possession (Score: 7-6)
Malcolm Tatum attempts a Midrange. Contested by Magic Russell (5.7 feet, ZONE). MALCOLM TATUM MAKES IT! Assist: Derrick Durant
Score: 9-6

[05:15] Team_056 possession (Score: 9-6)
Jrue Lillard attempts a Midrange. Contested by Pascal Lillard (4.7 feet, MAN). Jrue Lillard misses. Rebound secured by Pascal Lillard.

[05:02] Team_098 possession (Score: 9-6)
FOUL! Holding foul on Tony Carter. [IN THE BONUS! 5 team fouls] Blake Murray to the line for 2 free throws. (Tony Carter: 4 personal fouls)   FT 1/2: GOOD   FT 2/2: GOOD Blake Murray makes 2/2 from the line.
Score: 11-6

[04:46] Team_056 possession (Score: 11-6)
Jrue Lillard attempts a Midrange. Contested by Nikola Rose (3.8 feet, ZONE). Jrue Lillard misses. Rebound secured by Derrick Durant.

[04:34] Team_098 possession (Score: 11-6)
Pascal Lillard drives to the basket... FOUL! Offensive foul on Pascal Lillard! Jrue Lillard drew the charge! [Team fouls: 4] (Pascal Lillard: 2 personal fouls) TURNOVER! (dead ball)

[04:18] Team_056 possession (Score: 11-6)
Tony Carter makes the Midrange and draws the foul on Blake Murray! And-1! Tony Carter to the line for 1. [BONUS: 5 team fouls] (Blake Murray: 1 personal fouls)   FT 1/1: GOOD Tony Carter makes 1/1 from the line.
Score: 11-9

[04:03] Team_098 possession (Score: 11-9)
Nikola Rose drives and kicks out. Malcolm Tatum attempts a 3Pt. Contested by Giannis Jokic (4.4 feet, ZONE). MALCOLM TATUM MAKES IT! Assist: Blake Murray
Score: 14-9

[03:48] Team_056 possession (Score: 14-9)
Yao Poole drives and kicks out. Jrue Lillard attempts a Midrange. Contested by Nikola Rose (3.3 feet, ZONE). Jrue Lillard misses. Rebound secured by Derrick Durant.

[03:37] Team_098 possession (Score: 14-9)
Derrick Durant makes the Dunk and draws the foul on Jrue Lillard! And-1! Derrick Durant to the line for 1. [BONUS: 6 team fouls] (Jrue Lillard: 1 personal fouls)   FT 1/1: MISS Derrick Durant makes 0/1 from the line. Rebound secured by Jrue Lillard.
Score: 16-9

[03:21] Team_056 possession (Score: 16-9)
Giannis Jokic attempts a Midrange. Contested by Malcolm Tatum (4.5 feet, MAN). GIANNIS JOKIC MAKES IT!
Score: 16-11

[03:03] Team_098 possession (Score: 16-11)
Pascal Lillard attempts a Layup. Contested by Jrue Lillard (4.6 feet, ZONE). Pascal Lillard misses. Rebound secured by Yao Poole.

[02:51] Team_056 possession (Score: 16-11)
Magic Russell drives to the basket... Magic Russell throws a bad pass! Stolen by Pascal Lillard! TURNOVER! (live ball)

[02:40] Team_098 possession (Score: 16-11)
Pascal Lillard drives and kicks out. Pascal Lillard attempts a Midrange. Contested by Giannis Jokic (4.6 feet, ZONE). Pascal Lillard misses. Rebound secured by Yao Poole.

[02:30] Team_056 possession (Score: 16-11)
Yao Poole drives and kicks out. Giannis Jokic attempts a 3Pt. Contested by Malcolm Tatum (4.2 feet, MAN). Giannis Jokic misses. Offensive rebound by Yao Poole! Yao Poole kicks it out.

[02:15] Team_056 possession (Score: 16-11)
Magic Russell attempts a Midrange. Contested by Blake Murray (5.1 feet, ZONE). Magic Russell misses. Rebound secured by Pascal Lillard.

[02:02] Team_098 possession (Score: 16-11)
Derrick Durant drives, picks up Yao Poole. Help arrives from Giannis Jokic! Derrick Durant attempts a Layup. Contested by Giannis Jokic (4.7 feet, MAN). DERRICK DURANT MAKES IT! Assist: Blake Murray
Score: 18-11

[01:47] Team_056 possession (Score: 18-11)
Yao Poole drives to the basket... Yao Poole loses the ball! Stripped by Pascal Lillard! TURNOVER! (live ball)

[01:33] Team_098 possession (Score: 18-11)
Nikola Rose drives and kicks out. Blake Murray attempts a 3Pt. Contested by Giannis Jokic (4.7 feet, ZONE). BLAKE MURRAY MAKES IT! Assist: Pascal Lillard
Score: 21-11

[01:19] Team_056 possession (Score: 21-11)
Tony Carter attempts a 3Pt. Contested by Blake Murray (5.5 feet, MAN). Tony Carter misses. Offensive rebound by Yao Poole! Yao Poole kicks it out.

[01:03] Team_056 possession (Score: 21-11)
Yao Poole attempts a Midrange. Contested by Derrick Durant (4.6 feet, MAN). YAO POOLE MAKES IT! Assist: Giannis Jokic
Score: 21-13

[00:48] Team_098 possession (Score: 21-13)
Pascal Lillard drives, Jrue Lillard stays with him. Pascal Lillard attempts a Layup. Contested by Jrue Lillard (4.8 feet, MAN). PASCAL LILLARD MAKES IT! Assist: Derrick Durant
Score: 23-13

[00:33] Team_056 possession (Score: 23-13)
Tony Carter attempts a 3Pt. Contested by Nikola Rose (4.3 feet, ZONE). TONY CARTER MAKES IT! Assist: Giannis Jokic
Score: 23-16

[00:14] Team_098 possession (Score: 23-16)
Derrick Durant makes the Dunk and draws the foul on Yao Poole! And-1! Derrick Durant to the line for 1. [BONUS: 7 team fouls] (Yao Poole: 1 personal fouls)   FT 1/1: GOOD Derrick Durant makes 1/1 from the line.
Score: 26-16

================================================================================
                              1ST QUARTER COMPLETE                              
================================================================================

1ST QUARTER SCORE: Team_098 26, Team_056 16

BOX SCORE:
================================================================================

Team_098
--------------------------------------------------------------------------------
Player                MIN  PTS  REB  AST  TO      FG   FG%      3P   3P%
--------------------------------------------------------------------------------
Derrick Durant         12    8    4    2   0   3/4    75.0     0/0   0.0
Malcolm Tatum          12    7    0    0   0   3/4    75.0     0/0   0.0
Blake Murray           12    5    0    2   0   2/4    50.0     0/0   0.0
Pascal Lillard         12    4    3    3   0   2/6    33.3     0/0   0.0
Nikola Rose            12    0    2    0   0   0/0     0.0     0/0   0.0

TEAM: FG: 10/18 (55.6%), 3PT: 0/3 (0.0%), REB: 8 (0 off, 8 def), AST: 7, TO: 3
TEAM FOULS: 5 [Team_056 in BONUS]


Team_056
--------------------------------------------------------------------------------
Player                MIN  PTS  REB  AST  TO      FG   FG%      3P   3P%
--------------------------------------------------------------------------------
Tony Carter            12    6    0    0   0   2/2   100.0     0/0   0.0
Jrue Lillard           12    4    5    0   0   2/6    33.3     0/0   0.0
Giannis Jokic          12    4    0    3   0   2/4    50.0     0/0   0.0
Yao Poole              12    2    9    0   0   1/2    50.0     0/0   0.0
Magic Russell          12    0    0    0   0   0/2     0.0     0/0   0.0

TEAM: FG: 7/16 (43.8%), 3PT: 2/5 (40.0%), REB: 15 (7 off, 8 def), AST: 3, TO: 4
TEAM FOULS: 7 [Team_098 in BONUS]

================================================================================

================================================================================
                       2ND QUARTER - Team_098 vs Team_056                       
================================================================================

[12:00] Team_098 possession (Score: 26-16)
Malcolm Tatum attempts a 3Pt. Contested by Giannis Jokic (4.8 feet, MAN). Malcolm Tatum misses. Offensive rebound by Derrick Durant! Derrick Durant puts it back in!
Score: 28-16

[11:50] Team_056 possession (Score: 28-16)
FOUL! Reach-in foul on Malcolm Tatum during the drive. [Team fouls: 1] No free throws, side out. (Malcolm Tatum: 1 personal fouls)

[11:37] Team_056 possession (Score: 28-16)
Tony Carter attempts a Midrange. BLOCKED BY BLAKE MURRAY! Ball is loose! Rebound secured by Derrick Durant.

[11:20] Team_098 possession (Score: 28-16)
Blake Murray attempts a Midrange. Contested by Tony Carter (4.7 feet, MAN). Blake Murray misses. Rebound secured by Tony Carter.

[11:09] Team_056 possession (Score: 28-16)
Jrue Lillard drives and kicks out. Magic Russell attempts a Midrange. Contested by Nikola Rose (3.6 feet, MAN). Magic Russell misses. Offensive rebound by Yao Poole! Yao Poole kicks it out.

[10:51] Team_056 possession (Score: 28-16)
Magic Russell attempts a 3Pt. Contested by Nikola Rose (3.9 feet, MAN). Magic Russell misses. Rebound secured by Nikola Rose.

[10:35] Team_098 possession (Score: 28-16)
Pascal Lillard attempts a Midrange. Contested by Jrue Lillard (4.8 feet, MAN). Pascal Lillard misses. Rebound secured by Jrue Lillard.

[10:18] Team_056 possession (Score: 28-16)
Jrue Lillard attempts a 3Pt. Contested by Nikola Rose (4.2 feet, ZONE). JRUE LILLARD MAKES IT! Assist: Giannis Jokic
Score: 28-19

[10:05] Team_098 possession (Score: 28-19)
Blake Murray drives and kicks out. Derrick Durant attempts a 3Pt. Contested by Giannis Jokic (4.9 feet, ZONE). Derrick Durant misses. Rebound secured by Yao Poole.

[09:52] Team_056 possession (Score: 28-19)
Yao Poole attempts a Layup. Contested by Pascal Lillard (4.3 feet, ZONE). Yao Poole misses. Offensive rebound by Jrue Lillard! Jrue Lillard puts it back in!
Score: 28-21

[09:41] Team_098 possession (Score: 28-21)
Nikola Rose attempts a 3Pt. Wide open! Magic Russell is 6.3 feet away. [MAN] Nikola Rose misses. Rebound secured by Tony Carter.

[09:24] Team_056 possession (Score: 28-21)
Jrue Lillard attempts a Midrange. Contested by Pascal Lillard (5.2 feet, ZONE). Jrue Lillard misses. Rebound secured by Pascal Lillard.

[09:10] Team_098 possession (Score: 28-21)
Blake Murray makes the Layup and draws the foul on Jrue Lillard! And-1! Blake Murray to the line for 1. [Team fouls: 1] (Jrue Lillard: 1 personal fouls)   FT 1/1: GOOD Blake Murray makes 1/1 from the line.
Score: 31-21

[08:55] Team_056 possession (Score: 31-21)
Jrue Lillard throws a bad pass out of bounds! TURNOVER! (dead ball)

[08:55] Substitution (Team_098): Malcolm Tatum OUT → Tracy Rose IN (stamina_rule2)

[08:55] Substitution (Team_098): Nikola Rose OUT → Dirk McCollum IN (stamina_rule2)

[08:55] Substitution (Team_098): Blake Murray OUT → Kristaps Iverson IN (stamina_rule2)

[08:55] Substitution (Team_098): Pascal Lillard OUT → Manu Jordan IN (stamina_rule2)

[08:55] Substitution (Team_098): Derrick Durant OUT → Russell McGrady IN (stamina_rule2)

[08:55] Substitution (Team_056): Giannis Jokic OUT → De'Aaron Murray IN (stamina_rule2)

[08:55] Substitution (Team_056): Magic Russell OUT → Damian Barrett IN (stamina_rule2)

[08:55] Substitution (Team_056): Tony Carter OUT → CJ Anthony IN (stamina_rule2)

[08:55] Substitution (Team_056): Jrue Lillard OUT → RJ Johnson IN (stamina_rule2)

[08:55] Substitution (Team_056): Yao Poole OUT → Derrick Bane IN (stamina_rule2)

[08:42] Team_098 possession (Score: 31-21)
Dirk McCollum attempts a Midrange. Contested by Damian Barrett (5.7 feet, MAN). Dirk McCollum misses. Rebound secured by RJ Johnson.

[08:28] Team_056 possession (Score: 31-21)
Damian Barrett attempts a 3Pt. Contested by Dirk McCollum (4.3 feet, ZONE). Damian Barrett misses. Rebound secured by Manu Jordan.

[08:16] Team_098 possession (Score: 31-21)
FOUL! Offensive foul on Manu Jordan! RJ Johnson drew the charge! [Team fouls: 2] (Manu Jordan: 1 personal fouls) TURNOVER! (dead ball)

[08:04] Team_056 possession (Score: 31-21)
FOUL! Holding foul on Tracy Rose. [Team fouls: 3] No free throws, side out. (Tracy Rose: 1 personal fouls)

[07:51] Team_056 possession (Score: 31-21)
Damian Barrett drives and kicks out. Damian Barrett attempts a 3Pt. Contested by Tracy Rose (3.2 feet, ZONE). Damian Barrett misses. Rebound secured by Manu Jordan.

[07:37] Team_098 possession (Score: 31-21)
Kristaps Iverson attempts a Midrange. Wide open! De'Aaron Murray is 6.0 feet away. [ZONE] Kristaps Iverson misses. Rebound secured by Derrick Bane.

[07:21] Team_056 possession (Score: 31-21)
FOUL! Reach-in foul on Manu Jordan during the drive. [Team fouls: 4] No free throws, side out. (Manu Jordan: 2 personal fouls)

[07:06] Team_056 possession (Score: 31-21)
FOUL! Shooting foul on Manu Jordan. RJ Johnson to the line for 2 free throws. [BONUS: 5 team fouls] (Manu Jordan: 3 personal fouls)   FT 1/2: GOOD   FT 2/2: GOOD RJ Johnson makes 2/2 from the line.
Score: 31-23

[06:53] Team_098 possession (Score: 31-23)
Kristaps Iverson attempts a Layup. Contested by RJ Johnson (4.5 feet, ZONE). KRISTAPS IVERSON MAKES IT!
Score: 33-23

[06:37] Team_056 possession (Score: 33-23)
CJ Anthony drives, Russell McGrady stays with him. CJ Anthony attempts a Dunk. Contested by Russell McGrady (3.7 feet, ZONE). CJ ANTHONY MAKES IT! Assist: Derrick Bane
Score: 33-25

[06:21] Team_098 possession (Score: 33-25)
Russell McGrady attempts a Midrange. Contested by Damian Barrett (5.4 feet, ZONE). Russell McGrady misses. Rebound secured by CJ Anthony.

[06:07] Team_056 possession (Score: 33-25)
FOUL! Holding foul on Kristaps Iverson. [IN THE BONUS! 6 team fouls] CJ Anthony to the line for 2 free throws. (Kristaps Iverson: 1 personal fouls)   FT 1/2: GOOD   FT 2/2: GOOD CJ Anthony makes 2/2 from the line.
Score: 33-27

[05:54] Team_098 possession (Score: 33-27)
FOUL! Reach-in foul on RJ Johnson during the drive. [Team fouls: 2] No free throws, side out. (RJ Johnson: 1 personal fouls)

[05:40] Team_098 possession (Score: 33-27)
Tracy Rose attempts a Midrange. Contested by CJ Anthony (4.3 feet, ZONE). Tracy Rose misses. Rebound secured by CJ Anthony.

[05:21] Team_056 possession (Score: 33-27)
CJ Anthony attempts a 3Pt. Contested by Dirk McCollum (4.1 feet, ZONE). CJ Anthony misses. Rebound secured by Kristaps Iverson.

[05:08] Team_098 possession (Score: 33-27)
Russell McGrady attempts a 3Pt. Contested by Derrick Bane (5.3 feet, MAN). RUSSELL MCGRADY MAKES IT! Assist: Dirk McCollum
Score: 36-27

[04:50] Team_056 possession (Score: 36-27)
CJ Anthony attempts a 3Pt. Contested by Dirk McCollum (4.1 feet, ZONE). CJ Anthony misses. Rebound secured by Kristaps Iverson.

[04:37] Team_098 possession (Score: 36-27)
Dirk McCollum attempts a Midrange. Contested by Derrick Bane (5.6 feet, ZONE). Dirk McCollum misses. Offensive rebound by Russell McGrady! Russell McGrady puts it back in!
Score: 38-27

[04:27] Team_056 possession (Score: 38-27)
RJ Johnson attempts a Midrange. Contested by Manu Jordan (4.8 feet, MAN). RJ JOHNSON MAKES IT!
Score: 38-29

[04:11] Team_098 possession (Score: 38-29)
Manu Jordan attempts a Layup. Contested by RJ Johnson (4.6 feet, ZONE). MANU JORDAN MAKES IT! Assist: Russell McGrady
Score: 40-29

[03:53] Team_056 possession (Score: 40-29)
CJ Anthony attempts a 3Pt. Contested by Dirk McCollum (4.1 feet, ZONE). CJ Anthony misses. Rebound secured by Manu Jordan.

[03:39] Team_098 possession (Score: 40-29)
Kristaps Iverson attempts a Layup. BLOCKED BY CJ ANTHONY! Ball is loose! Rebound secured by RJ Johnson.

[03:24] Team_056 possession (Score: 40-29)
Derrick Bane attempts a Layup. Contested by Russell McGrady (4.2 feet, ZONE). DERRICK BANE MAKES IT! Assist: CJ Anthony
Score: 40-31

[03:12] Team_098 possession (Score: 40-31)
Tracy Rose makes the Dunk and draws the foul on De'Aaron Murray! And-1! Tracy Rose to the line for 1. [Team fouls: 3] (De'Aaron Murray: 1 personal fouls)   FT 1/1: GOOD Tracy Rose makes 1/1 from the line.
Score: 43-31

[02:56] Team_056 possession (Score: 43-31)
CJ Anthony attempts a 3Pt. Contested by Dirk McCollum (4.1 feet, ZONE). CJ ANTHONY MAKES IT! Assist: Damian Barrett
Score: 43-34

[02:42] Team_098 possession (Score: 43-34)
Dirk McCollum makes the Midrange and draws the foul on Damian Barrett! And-1! Dirk McCollum to the line for 1. [Team fouls: 4] (Damian Barrett: 1 personal fouls)   FT 1/1: GOOD Dirk McCollum makes 1/1 from the line.
Score: 46-34

[02:28] Team_056 possession (Score: 46-34)
CJ Anthony attempts a 3Pt. Contested by Kristaps Iverson (3.9 feet, MAN). CJ Anthony misses. Rebound secured by Manu Jordan.

[02:13] Team_098 possession (Score: 46-34)
Kristaps Iverson throws a bad pass! Stolen by CJ Anthony! TURNOVER! (live ball)

[01:58] Team_056 possession (Score: 46-34)
De'Aaron Murray drives, Tracy Rose stays with him. De'Aaron Murray attempts a Dunk. Contested by Tracy Rose (3.4 feet, MAN). DE'AARON MURRAY MAKES IT! Assist: Damian Barrett
Score: 46-36

[01:44] Team_098 possession (Score: 46-36)
FOUL! Reach-in foul on RJ Johnson during the drive. [IN THE BONUS! 5 team fouls] Manu Jordan to the line for 2 free throws. (RJ Johnson: 2 personal fouls)   FT 1/2: GOOD   FT 2/2: GOOD Manu Jordan makes 2/2 from the line.
Score: 48-36

[01:30] Team_056 possession (Score: 48-36)
CJ Anthony attempts a Midrange. Contested by Kristaps Iverson (4.0 feet, MAN). CJ Anthony misses. Offensive rebound by RJ Johnson! RJ Johnson kicks it out.

[01:12] Team_056 possession (Score: 48-36)
Damian Barrett drives and kicks out. De'Aaron Murray attempts a 3Pt. Contested by Tracy Rose (3.3 feet, MAN). De'Aaron Murray misses. FOUL! Loose ball foul on Kristaps Iverson during the rebound battle. [IN THE BONUS! 7 team fouls] RJ Johnson to the line for 2 free throws. (Kristaps Iverson: 2 personal fouls)   FT 1/2: GOOD   FT 2/2: GOOD RJ Johnson makes 2/2 from the line.
Score: 48-38

[00:58] Team_098 possession (Score: 48-38)
Russell McGrady attempts a Layup. Contested by RJ Johnson (4.4 feet, ZONE). RUSSELL MCGRADY MAKES IT! Assist: Kristaps Iverson
Score: 50-38

[00:45] Team_056 possession (Score: 50-38)
FOUL! Shooting foul on Dirk McCollum. Damian Barrett to the line for 2 free throws. [BONUS: 8 team fouls] (Dirk McCollum: 1 personal fouls)   FT 1/2: GOOD   FT 2/2: GOOD Damian Barrett makes 2/2 from the line.
Score: 50-40

[00:30] Team_098 possession (Score: 50-40)
Russell McGrady attempts a Layup. BLOCKED BY RJ JOHNSON! Ball goes out off RJ Johnson. Russell McGrady's ball!

[00:19] Team_098 possession (Score: 50-40)
Tracy Rose attempts a 3Pt. Wide open! De'Aaron Murray is 6.1 feet away. [ZONE] TRACY ROSE MAKES IT! Assist: Dirk McCollum
Score: 53-40

[00:06] Team_056 possession (Score: 53-40)
De'Aaron Murray attempts a 3Pt. Contested by Tracy Rose (3.5 feet, MAN). De'Aaron Murray misses. Rebound secured by Russell McGrady.

================================================================================
                              2ND QUARTER COMPLETE                              
================================================================================

2ND QUARTER SCORE: Team_098 27, Team_056 24

BOX SCORE:
================================================================================

Team_098
--------------------------------------------------------------------------------
Player                MIN  PTS  REB  AST  TO      FG   FG%      3P   3P%
--------------------------------------------------------------------------------
Russell McGrady         9    7    2    1   0   3/4    75.0     0/0   0.0
Tracy Rose              9    6    0    0   0   2/3    66.7     0/0   0.0
Manu Jordan             9    4    4    0   0   2/2   100.0     0/0   0.0
Blake Murray           15    3    0    0   0   1/3    33.3     0/0   0.0
Dirk McCollum           9    3    0    2   0   1/2    50.0     0/0   0.0
Derrick Durant         15    2    2    0   0   1/1   100.0     0/0   0.0
Kristaps Iverson        9    2    2    1   0   1/3    33.3     0/0   0.0
Nikola Rose            15    0    1    0   0   0/1     0.0     0/0   0.0
Pascal Lillard         15    0    1    0   0   0/1     0.0     0/0   0.0

TEAM: FG: 11/20 (55.0%), 3PT: 3/4 (75.0%), REB: 12 (2 off, 10 def), AST: 4, TO: 2
TEAM FOULS: 8 [Team_056 in BONUS]


Team_056
--------------------------------------------------------------------------------
Player                MIN  PTS  REB  AST  TO      FG   FG%      3P   3P%
--------------------------------------------------------------------------------
CJ Anthony              9    7    2    1   0   3/7    42.9     0/0   0.0
RJ Johnson              9    6    3    0   0   3/3   100.0     0/0   0.0
Jrue Lillard           15    5    2    0   0   2/3    66.7     0/0   0.0
Damian Barrett          9    2    0    2   0   1/3    33.3     0/0   0.0
Derrick Bane            9    2    1    1   0   1/1   100.0     0/0   0.0
De'Aaron Murray         9    2    0    0   0   1/2    50.0     0/0   0.0
Tony Carter            15    0    2    0   0   0/1     0.0     0/0   0.0
Yao Poole              15    0    2    0   0   0/0     0.0     0/0   0.0
Magic Russell          15    0    0    0   0   0/1     0.0     0/0   0.0
Giannis Jokic          15    0    0    1   0   0/0     0.0     0/0   0.0

TEAM: FG: 11/21 (52.4%), 3PT: 2/9 (22.2%), REB: 12 (3 off, 9 def), AST: 5, TO: 1
TEAM FOULS: 5 [Team_098 in BONUS]

================================================================================

================================================================================
                       3RD QUARTER - Team_098 vs Team_056                       
================================================================================

[12:00] Team_098 possession (Score: 53-40)
Malcolm Tatum loses control! Ball rolls out of bounds! TURNOVER! (dead ball)

[11:42] Team_056 possession (Score: 53-40)
Magic Russell attempts a 3Pt. Contested by Nikola Rose (3.6 feet, MAN). Magic Russell misses. Rebound secured by Nikola Rose.

[11:30] Team_098 possession (Score: 53-40)
Pascal Lillard drives, picks up Jrue Lillard. Help arrives from Giannis Jokic! Pascal Lillard attempts a Layup. Contested by Giannis Jokic (4.4 feet, ZONE). PASCAL LILLARD MAKES IT! Assist: Derrick Durant
Score: 55-40

[11:13] Team_056 possession (Score: 55-40)
Giannis Jokic drives to the basket... Giannis Jokic commits a violation (traveling/carry)! TURNOVER! (dead ball)

[11:03] Team_098 possession (Score: 55-40)
Nikola Rose attempts a 3Pt. Contested by Giannis Jokic (4.6 feet, ZONE). Nikola Rose misses. Offensive rebound by Derrick Durant! Derrick Durant puts it back in!
Score: 57-40

[10:49] Team_056 possession (Score: 57-40)
Jrue Lillard attempts a Layup. Contested by Pascal Lillard (4.7 feet, MAN). Jrue Lillard misses. Rebound secured by Nikola Rose.

[10:33] Team_098 possession (Score: 57-40)
Derrick Durant drives, picks up Jrue Lillard. Help arrives from Giannis Jokic! Derrick Durant attempts a Dunk. Contested by Giannis Jokic (4.0 feet, ZONE). DERRICK DURANT MAKES IT! Assist: Malcolm Tatum
Score: 59-40

[10:16] Team_056 possession (Score: 59-40)
Yao Poole attempts a Layup. Contested by Pascal Lillard (3.8 feet, ZONE). Yao Poole misses. Offensive rebound by Yao Poole! Yao Poole kicks it out.

[09:57] Team_056 possession (Score: 59-40)
Jrue Lillard drives and kicks out. Jrue Lillard attempts a Midrange. Contested by Pascal Lillard (4.0 feet, MAN). JRUE LILLARD MAKES IT!
Score: 59-42

[09:38] Team_098 possession (Score: 59-42)
Blake Murray drives, Tony Carter stays with him. Blake Murray attempts a Layup. Contested by Tony Carter (4.3 feet, MAN). BLAKE MURRAY MAKES IT! Assist: Derrick Durant
Score: 61-42

[09:26] Team_056 possession (Score: 61-42)
FOUL! Shooting foul on Nikola Rose. Magic Russell to the line for 3 free throws. [Team fouls: 1] (Nikola Rose: 1 personal fouls)   FT 1/3: GOOD   FT 2/3: GOOD   FT 3/3: GOOD Magic Russell makes 3/3 from the line.
Score: 61-45

[09:08] Team_098 possession (Score: 61-45)
Derrick Durant drives to the basket... Derrick Durant throws a bad pass! Stolen by Jrue Lillard! TURNOVER! (live ball)

[08:57] Team_056 possession (Score: 61-45)
FOUL! Holding foul on Derrick Durant. [Team fouls: 2] No free throws, side out. (Derrick Durant: 1 personal fouls)

[08:43] Team_056 possession (Score: 61-45)
Tony Carter attempts a 3Pt. Contested by Blake Murray (5.1 feet, MAN). Tony Carter misses. Offensive rebound by Yao Poole! Yao Poole kicks it out.

[08:29] Team_056 possession (Score: 61-45)
Jrue Lillard drives and kicks out. Tony Carter attempts a Midrange. Contested by Blake Murray (4.4 feet, MAN). TONY CARTER MAKES IT! Assist: Yao Poole
Score: 61-47

[08:16] Team_098 possession (Score: 61-47)
Derrick Durant makes the Layup and draws the foul on Jrue Lillard! And-1! Derrick Durant to the line for 1. [Team fouls: 1] (Jrue Lillard: 1 personal fouls)   FT 1/1: GOOD Derrick Durant makes 1/1 from the line.
Score: 64-47

[08:00] Team_056 possession (Score: 64-47)
Tony Carter attempts a Midrange. Contested by Blake Murray (5.1 feet, MAN). Tony Carter misses. Rebound secured by Nikola Rose.

[07:47] Team_098 possession (Score: 64-47)
Malcolm Tatum drives, picks up Giannis Jokic. Help arrives from Tony Carter! Malcolm Tatum attempts a Layup. Contested by Tony Carter (4.5 feet, MAN). Malcolm Tatum misses. Rebound secured by Jrue Lillard.

[07:36] Team_056 possession (Score: 64-47)
FOUL! Holding foul on Malcolm Tatum. [Team fouls: 3] No free throws, side out. (Malcolm Tatum: 1 personal fouls)

[07:20] Team_056 possession (Score: 64-47)
Magic Russell drives, picks up Nikola Rose. Help arrives from Blake Murray! Magic Russell attempts a Dunk. Contested by Blake Murray (3.6 feet, MAN). MAGIC RUSSELL MAKES IT! Assist: Yao Poole
Score: 64-49

[07:04] Team_098 possession (Score: 64-49)
Pascal Lillard throws a bad pass out of bounds! TURNOVER! (dead ball)

[06:51] Team_056 possession (Score: 64-49)
Jrue Lillard attempts a Midrange. Contested by Nikola Rose (3.8 feet, ZONE). Jrue Lillard misses. Rebound secured by Pascal Lillard.

[06:40] Team_098 possession (Score: 64-49)
Derrick Durant drives, picks up Jrue Lillard. Help arrives from Giannis Jokic! Derrick Durant attempts a Dunk. Contested by Giannis Jokic (4.0 feet, ZONE). DERRICK DURANT MAKES IT! Assist: Malcolm Tatum
Score: 66-49

[06:28] Team_056 possession (Score: 66-49)
Tony Carter attempts a Midrange. Contested by Blake Murray (5.1 feet, MAN). Tony Carter misses. Rebound secured by Nikola Rose.

[06:16] Team_098 possession (Score: 66-49)
Malcolm Tatum drives, picks up Giannis Jokic. Help arrives from Tony Carter! Malcolm Tatum attempts a Layup. Contested by Tony Carter (4.5 feet, MAN). MALCOLM TATUM MAKES IT! Assist: Pascal Lillard
Score: 68-49

[05:59] Team_056 possession (Score: 68-49)
Magic Russell loses the ball! Stripped by Nikola Rose! TURNOVER! (live ball)

[05:42] Team_098 possession (Score: 68-49)
Nikola Rose attempts a 3Pt. Contested by Giannis Jokic (4.6 feet, ZONE). Nikola Rose misses. Offensive rebound by Pascal Lillard! Pascal Lillard kicks it out.

[05:27] Team_098 possession (Score: 68-49)
Malcolm Tatum drives and kicks out. Nikola Rose attempts a Midrange. Contested by Giannis Jokic (4.3 feet, ZONE). NIKOLA ROSE MAKES IT!
Score: 70-49

[05:13] Team_056 possession (Score: 70-49)
Giannis Jokic attempts a 3Pt. Contested by Pascal Lillard (4.4 feet, ZONE). Giannis Jokic misses. FOUL! Loose ball foul on Pascal Lillard during the rebound battle. [Team fouls: 4] No free throws, side out. (Pascal Lillard: 1 personal fouls)

[04:58] Team_056 possession (Score: 70-49)
Jrue Lillard attempts a 3Pt. Contested by Nikola Rose (3.8 feet, ZONE). Jrue Lillard misses. Rebound secured by Nikola Rose.

[04:40] Team_098 possession (Score: 70-49)
FOUL! Shooting foul on Magic Russell. Nikola Rose to the line for 2 free throws. [Team fouls: 2] (Magic Russell: 1 personal fouls)   FT 1/2: GOOD   FT 2/2: GOOD Nikola Rose makes 2/2 from the line.
Score: 72-49

[04:30] Team_056 possession (Score: 72-49)
Magic Russell attempts a 3Pt. Contested by Malcolm Tatum (4.4 feet, ZONE). Magic Russell misses. Rebound secured by Pascal Lillard.

[04:15] Team_098 possession (Score: 72-49)
FOUL! Shooting foul on Giannis Jokic. Blake Murray to the line for 3 free throws. [Team fouls: 3] (Giannis Jokic: 1 personal fouls)   FT 1/3: MISS   FT 2/3: GOOD   FT 3/3: GOOD Blake Murray makes 2/3 from the line.
Score: 74-49

[04:01] Team_056 possession (Score: 74-49)
Yao Poole attempts a Midrange. Contested by Pascal Lillard (3.8 feet, ZONE). Yao Poole misses. Rebound secured by Derrick Durant.

[03:51] Team_098 possession (Score: 74-49)
Nikola Rose drives and kicks out. Malcolm Tatum attempts a 3Pt. Contested by Giannis Jokic (4.5 feet, ZONE). Malcolm Tatum misses. Rebound secured by Jrue Lillard.

[03:36] Team_056 possession (Score: 74-49)
FOUL! Reach-in foul on Pascal Lillard during the drive. [IN THE BONUS! 5 team fouls] Yao Poole to the line for 2 free throws. (Pascal Lillard: 2 personal fouls)   FT 1/2: GOOD   FT 2/2: GOOD Yao Poole makes 2/2 from the line.
Score: 74-51

[03:20] Team_098 possession (Score: 74-51)
Pascal Lillard attempts a Midrange. Contested by Jrue Lillard (4.6 feet, MAN). Pascal Lillard misses. Rebound secured by Jrue Lillard.

[03:00] Team_056 possession (Score: 74-51)
Giannis Jokic drives and kicks out. Magic Russell attempts a 3Pt. Contested by Nikola Rose (3.4 feet, ZONE). Magic Russell misses. Rebound secured by Pascal Lillard.

[02:49] Team_098 possession (Score: 74-51)
Nikola Rose drives, picks up Magic Russell. Help arrives from Tony Carter! Nikola Rose attempts a Layup. Wide open! Tony Carter is 6.0 feet away. [MAN] NIKOLA ROSE MAKES IT! Assist: Pascal Lillard
Score: 76-51

[02:36] Team_056 possession (Score: 76-51)
Yao Poole attempts a Layup. Contested by Pascal Lillard (4.0 feet, ZONE). Yao Poole misses. Offensive rebound by Yao Poole! Yao Poole kicks it out.

[02:21] Team_056 possession (Score: 76-51)
Giannis Jokic attempts a 3Pt. Contested by Malcolm Tatum (4.6 feet, MAN). Giannis Jokic misses. FOUL! Loose ball foul on Derrick Durant during the rebound battle. [IN THE BONUS! 6 team fouls] Yao Poole to the line for 2 free throws. (Derrick Durant: 2 personal fouls)   FT 1/2: MISS   FT 2/2: GOOD Yao Poole makes 1/2 from the line.
Score: 76-52

[02:03] Team_098 possession (Score: 76-52)
Blake Murray attempts a 3Pt. Contested by Tony Carter (4.6 feet, MAN). BLAKE MURRAY MAKES IT! Assist: Pascal Lillard
Score: 79-52

[01:51] Team_056 possession (Score: 79-52)
Jrue Lillard drives and kicks out. Tony Carter attempts a Midrange. Contested by Blake Murray (4.9 feet, MAN). TONY CARTER MAKES IT!
Score: 79-54

[01:39] Team_098 possession (Score: 79-54)
Nikola Rose attempts a 3Pt. Contested by Giannis Jokic (5.0 feet, ZONE). Nikola Rose misses. Rebound secured by Jrue Lillard.

[01:25] Team_056 possession (Score: 79-54)
Tony Carter drives, Blake Murray stays with him. Tony Carter attempts a Layup. Contested by Blake Murray (5.5 feet, MAN). Tony Carter misses. Rebound secured by Derrick Durant.

[01:10] Team_098 possession (Score: 79-54)
Derrick Durant attempts a 3Pt. Contested by Giannis Jokic (4.9 feet, ZONE). Derrick Durant misses. Rebound secured by Jrue Lillard.

[00:53] Team_056 possession (Score: 79-54)
Tony Carter attempts a 3Pt. Contested by Blake Murray (5.6 feet, MAN). Tony Carter misses. Rebound secured by Pascal Lillard.

[00:40] Team_098 possession (Score: 79-54)
Malcolm Tatum attempts a 3Pt. Contested by Giannis Jokic (5.0 feet, ZONE). MALCOLM TATUM MAKES IT! Assist: Blake Murray
Score: 82-54

[00:23] Team_056 possession (Score: 82-54)
Jrue Lillard commits a violation (traveling/carry)! TURNOVER! (dead ball)

[00:23] Substitution (Team_098): Malcolm Tatum OUT → Tracy Rose IN (stamina_rule2)

[00:23] Substitution (Team_098): Nikola Rose OUT → Dirk McCollum IN (stamina_rule2)

[00:23] Substitution (Team_098): Blake Murray OUT → Kristaps Iverson IN (stamina_rule2)

[00:23] Substitution (Team_098): Pascal Lillard OUT → Manu Jordan IN (stamina_rule2)

[00:23] Substitution (Team_098): Derrick Durant OUT → Russell McGrady IN (stamina_rule2)

[00:23] Substitution (Team_056): Giannis Jokic OUT → De'Aaron Murray IN (stamina_rule2)

[00:23] Substitution (Team_056): Magic Russell OUT → Damian Barrett IN (stamina_rule2)

[00:23] Substitution (Team_056): Tony Carter OUT → CJ Anthony IN (stamina_rule2)

[00:23] Substitution (Team_056): Jrue Lillard OUT → RJ Johnson IN (stamina_rule2)

[00:23] Substitution (Team_056): Yao Poole OUT → Derrick Bane IN (stamina_rule2)

[00:08] Team_098 possession (Score: 82-54)
Dirk McCollum drives and kicks out. Dirk McCollum attempts a Midrange. Contested by RJ Johnson (4.4 feet, ZONE). Dirk McCollum misses. Rebound secured by Derrick Bane.

================================================================================
                              3RD QUARTER COMPLETE                              
================================================================================

3RD QUARTER SCORE: Team_098 29, Team_056 14

BOX SCORE:
================================================================================

Team_098
--------------------------------------------------------------------------------
Player                MIN  PTS  REB  AST  TO      FG   FG%      3P   3P%
--------------------------------------------------------------------------------
Derrick Durant         27    9    3    2   0   4/5    80.0     0/0   0.0
Blake Murray           27    7    0    1   0   3/3   100.0     0/0   0.0
Nikola Rose            27    6    5    0   0   3/5    60.0     0/0   0.0
Malcolm Tatum          27    5    0    2   0   2/3    66.7     0/0   0.0
Pascal Lillard         27    2    5    3   0   1/2    50.0     0/0   0.0
Dirk McCollum           9    0    0    0   0   0/1     0.0     0/0   0.0

TEAM: FG: 13/19 (68.4%), 3PT: 4/6 (66.7%), REB: 13 (2 off, 11 def), AST: 8, TO: 3
TEAM FOULS: 6 [Team_056 in BONUS]


Team_056
--------------------------------------------------------------------------------
Player                MIN  PTS  REB  AST  TO      FG   FG%      3P   3P%
--------------------------------------------------------------------------------
Magic Russell          27    5    0    0   0   2/4    50.0     0/0   0.0
Tony Carter            27    4    0    0   0   2/6    33.3     0/0   0.0
Yao Poole              27    3    3    2   0   2/3    66.7     0/0   0.0
Jrue Lillard           27    2    6    0   0   1/4    25.0     0/0   0.0
Giannis Jokic          27    0    0    0   0   0/1     0.0     0/0   0.0
Derrick Bane            9    0    1    0   0   0/0     0.0     0/0   0.0

TEAM: FG: 7/18 (38.9%), 3PT: 2/6 (33.3%), REB: 10 (4 off, 6 def), AST: 2, TO: 3
TEAM FOULS: 3

================================================================================

================================================================================
                       4TH QUARTER - Team_098 vs Team_056                       
================================================================================

[12:00] Team_098 possession (Score: 82-54)
Nikola Rose attempts a 3Pt. Contested by Giannis Jokic (4.9 feet, ZONE). Nikola Rose misses. Rebound secured by Tony Carter.

[11:45] Team_056 possession (Score: 82-54)
FOUL! Shooting foul on Pascal Lillard. Jrue Lillard to the line for 2 free throws. [Team fouls: 1] (Pascal Lillard: 1 personal fouls)   FT 1/2: GOOD   FT 2/2: GOOD Jrue Lillard makes 2/2 from the line.
Score: 82-56

[11:29] Team_098 possession (Score: 82-56)
Malcolm Tatum attempts a 3Pt. Contested by Giannis Jokic (4.8 feet, ZONE). Malcolm Tatum misses. Rebound secured by Tony Carter.

[11:14] Team_056 possession (Score: 82-56)
FOUL! Shooting foul on Blake Murray. Tony Carter to the line for 2 free throws. [Team fouls: 2] (Blake Murray: 1 personal fouls)   FT 1/2: GOOD   FT 2/2: GOOD Tony Carter makes 2/2 from the line.
Score: 82-58

[10:56] Team_098 possession (Score: 82-58)
FOUL! Reach-in foul on Jrue Lillard during the drive. [Team fouls: 1] No free throws, side out. (Jrue Lillard: 1 personal fouls)

[10:44] Team_098 possession (Score: 82-58)
Pascal Lillard attempts a Layup. Contested by Jrue Lillard (4.8 feet, MAN). Pascal Lillard misses. Rebound secured by Tony Carter.

[10:30] Team_056 possession (Score: 82-58)
Yao Poole attempts a 3Pt. Contested by Blake Murray (4.7 feet, ZONE). Yao Poole misses. Rebound secured by Pascal Lillard.

[10:14] Team_098 possession (Score: 82-58)
Malcolm Tatum attempts a 3Pt. Contested by Giannis Jokic (5.0 feet, ZONE). Malcolm Tatum misses. Rebound secured by Tony Carter.

[09:57] Team_056 possession (Score: 82-58)
Giannis Jokic attempts a 3Pt. Contested by Malcolm Tatum (4.8 feet, MAN). Giannis Jokic misses. Rebound secured by Pascal Lillard.

[09:42] Team_098 possession (Score: 82-58)
Malcolm Tatum attempts a Midrange. Contested by Giannis Jokic (5.0 feet, MAN). Malcolm Tatum misses. Rebound secured by Tony Carter.

[09:24] Team_056 possession (Score: 82-58)
Giannis Jokic attempts a 3Pt. Contested by Malcolm Tatum (4.8 feet, MAN). Giannis Jokic misses. Offensive rebound by Jrue Lillard! Jrue Lillard puts it back in!
Score: 82-60

[09:05] Team_098 possession (Score: 82-60)
Pascal Lillard drives and kicks out. Malcolm Tatum attempts a Midrange. Contested by Giannis Jokic (5.0 feet, MAN). MALCOLM TATUM MAKES IT! Assist: Nikola Rose
Score: 84-60

[08:47] Team_056 possession (Score: 84-60)
Magic Russell attempts a 3Pt. Contested by Nikola Rose (4.1 feet, ZONE). MAGIC RUSSELL MAKES IT! Assist: Yao Poole
Score: 84-63

[08:31] Team_098 possession (Score: 84-63)
Malcolm Tatum attempts a 3Pt. Contested by Giannis Jokic (5.1 feet, ZONE). Malcolm Tatum misses. Rebound secured by Tony Carter.

[08:20] Team_056 possession (Score: 84-63)
Magic Russell attempts a 3Pt. Contested by Nikola Rose (4.1 feet, ZONE). MAGIC RUSSELL MAKES IT! Assist: Jrue Lillard
Score: 84-66

[08:05] Team_098 possession (Score: 84-66)
FOUL! Shooting foul on Yao Poole. Derrick Durant to the line for 2 free throws. [Team fouls: 2] (Yao Poole: 1 personal fouls)   FT 1/2: GOOD   FT 2/2: GOOD Derrick Durant makes 2/2 from the line.
Score: 86-66

[07:46] Team_056 possession (Score: 86-66)
FOUL! Holding foul on Nikola Rose. [Team fouls: 3] No free throws, side out. (Nikola Rose: 1 personal fouls)

[07:34] Team_056 possession (Score: 86-66)
FOUL! Offensive foul on Magic Russell! Nikola Rose drew the charge! [Team fouls: 3] (Magic Russell: 1 personal fouls) TURNOVER! (dead ball)

[07:22] Team_098 possession (Score: 86-66)
Blake Murray attempts a Layup. BLOCKED BY JRUE LILLARD! Ball is loose! Rebound secured by Jrue Lillard.

[07:06] Team_056 possession (Score: 86-66)
Tony Carter attempts a Midrange. Contested by Blake Murray (5.9 feet, MAN). Tony Carter misses. Offensive rebound by Yao Poole! Yao Poole kicks it out.

[06:53] Team_056 possession (Score: 86-66)
Magic Russell drives, Nikola Rose stays with him. Magic Russell attempts a Dunk. Contested by Nikola Rose (4.3 feet, MAN). Magic Russell misses. Offensive rebound by Jrue Lillard! Jrue Lillard puts it back in!
Score: 86-68

[06:35] Team_098 possession (Score: 86-68)
Malcolm Tatum attempts a Midrange. Contested by Yao Poole (5.4 feet, ZONE). MALCOLM TATUM MAKES IT! Assist: Nikola Rose
Score: 88-68

[06:22] Team_056 possession (Score: 88-68)
Giannis Jokic makes the 3Pt and draws the foul on Nikola Rose! And-1! Giannis Jokic to the line for 1. [Team fouls: 4] (Nikola Rose: 2 personal fouls)   FT 1/1: GOOD Giannis Jokic makes 1/1 from the line.
Score: 88-72

[06:05] Team_098 possession (Score: 88-72)
Nikola Rose attempts a 3Pt. Contested by Giannis Jokic (5.6 feet, ZONE). Nikola Rose misses. Rebound secured by Tony Carter.

[05:56] Team_056 possession (Score: 88-72)
Magic Russell drives and kicks out. FOUL! Shooting foul on Pascal Lillard. Jrue Lillard to the line for 3 free throws. [BONUS: 5 team fouls] (Pascal Lillard: 2 personal fouls)   FT 1/3: GOOD   FT 2/3: GOOD   FT 3/3: MISS Jrue Lillard makes 2/3 from the line. Offensive rebound by Jrue Lillard! Jrue Lillard puts it back in!
Score: 88-76

[05:41] Team_098 possession (Score: 88-76)
Malcolm Tatum attempts a 3Pt. Contested by Giannis Jokic (5.5 feet, MAN). Malcolm Tatum misses. Offensive rebound by Pascal Lillard! Pascal Lillard kicks it out.

[05:31] Team_098 possession (Score: 88-76)
Nikola Rose drives and kicks out. Derrick Durant attempts a Midrange. Contested by Tony Carter (5.3 feet, ZONE). Derrick Durant misses. Rebound secured by Tony Carter.

[05:17] Team_056 possession (Score: 88-76)
Yao Poole drives to the basket... Yao Poole throws a bad pass! Stolen by Derrick Durant! TURNOVER! (live ball)

[05:05] Team_098 possession (Score: 88-76)
Nikola Rose drives and kicks out. Derrick Durant attempts a 3Pt. Contested by Yao Poole (5.6 feet, MAN). Derrick Durant misses. Offensive rebound by Pascal Lillard! Pascal Lillard kicks it out.

[04:53] Team_098 possession (Score: 88-76)
Malcolm Tatum attempts a 3Pt. Contested by Giannis Jokic (5.7 feet, ZONE). Malcolm Tatum misses. Offensive rebound by Derrick Durant! Derrick Durant kicks it out.

[04:43] Team_098 possession (Score: 88-76)
Nikola Rose attempts a 3Pt. Contested by Tony Carter (5.6 feet, ZONE). NIKOLA ROSE MAKES IT! Assist: Derrick Durant
Score: 91-76

[04:29] Team_056 possession (Score: 91-76)
Yao Poole drives and kicks out. Giannis Jokic attempts a Midrange. Contested by Malcolm Tatum (5.3 feet, MAN). Giannis Jokic misses. FOUL! Loose ball foul on Nikola Rose during the rebound battle. [IN THE BONUS! 6 team fouls] Yao Poole to the line for 2 free throws. (Nikola Rose: 3 personal fouls)   FT 1/2: GOOD   FT 2/2: GOOD Yao Poole makes 2/2 from the line.
Score: 91-78

[04:11] Team_098 possession (Score: 91-78)
Blake Murray attempts a 3Pt. Contested by Tony Carter (5.5 feet, MAN). BLAKE MURRAY MAKES IT! Assist: Malcolm Tatum
Score: 94-78

[03:58] Team_056 possession (Score: 94-78)
Jrue Lillard makes the Midrange and draws the foul on Pascal Lillard! And-1! Jrue Lillard to the line for 1. [BONUS: 7 team fouls] (Pascal Lillard: 3 personal fouls)   FT 1/1: GOOD Jrue Lillard makes 1/1 from the line.
Score: 94-81

[03:43] Team_098 possession (Score: 94-81)
Pascal Lillard attempts a Midrange. Contested by Jrue Lillard (5.7 feet, MAN). Pascal Lillard misses. Rebound secured by Yao Poole.

[03:23] Team_056 possession (Score: 94-81)
Giannis Jokic attempts a 3Pt. Contested by Malcolm Tatum (5.6 feet, MAN). Giannis Jokic misses. Rebound secured by Pascal Lillard.

[03:08] Team_098 possession (Score: 94-81)
FOUL! Shooting foul on Giannis Jokic. Blake Murray to the line for 2 free throws. [Team fouls: 4] (Giannis Jokic: 1 personal fouls)   FT 1/2: GOOD   FT 2/2: GOOD Blake Murray makes 2/2 from the line.
Score: 96-81

[02:49] Team_056 possession (Score: 96-81)
FOUL! Shooting foul on Pascal Lillard. Jrue Lillard to the line for 2 free throws. [BONUS: 8 team fouls] (Pascal Lillard: 4 personal fouls)   FT 1/2: GOOD   FT 2/2: GOOD Jrue Lillard makes 2/2 from the line.
Score: 96-83

[02:34] Team_098 possession (Score: 96-83)
Blake Murray drives to the basket... Blake Murray throws a bad pass! Stolen by Jrue Lillard! TURNOVER! (live ball)

[02:19] Team_056 possession (Score: 96-83)
FOUL! Shooting foul on Derrick Durant. Yao Poole to the line for 2 free throws. [BONUS: 9 team fouls] (Derrick Durant: 1 personal fouls)   FT 1/2: MISS   FT 2/2: GOOD Yao Poole makes 1/2 from the line.
Score: 96-84

[02:07] Team_098 possession (Score: 96-84)
Pascal Lillard attempts a 3Pt. Contested by Jrue Lillard (5.9 feet, MAN). PASCAL LILLARD MAKES IT! Assist: Blake Murray
Score: 99-84

[01:52] Team_056 possession (Score: 99-84)
Yao Poole drives to the basket... Yao Poole loses the ball! Stripped by Pascal Lillard! TURNOVER! (live ball)

[01:37] Team_098 possession (Score: 99-84)
FOUL! Reach-in foul on Yao Poole during the drive. [IN THE BONUS! 5 team fouls] Derrick Durant to the line for 2 free throws. (Yao Poole: 2 personal fouls)   FT 1/2: GOOD   FT 2/2: GOOD Derrick Durant makes 2/2 from the line.
Score: 101-84

[01:20] Team_056 possession (Score: 101-84)
Tony Carter drives and kicks out. Magic Russell attempts a 3Pt. Contested by Nikola Rose (5.1 feet, MAN). Magic Russell misses. Rebound secured by Nikola Rose.

[01:06] Team_098 possession (Score: 101-84)
Nikola Rose attempts a 3Pt. Wide open! Tony Carter is 6.0 feet away. [ZONE] Nikola Rose misses. Rebound secured by Tony Carter.

[00:52] Team_056 possession (Score: 101-84)
Magic Russell attempts a Midrange. Contested by Nikola Rose (5.2 feet, MAN). MAGIC RUSSELL MAKES IT! Assist: Yao Poole
Score: 101-86

[00:43] Team_098 possession (Score: 101-86)
FOUL! Reach-in foul on Jrue Lillard during the drive. [IN THE BONUS! 6 team fouls] Derrick Durant to the line for 2 free throws. (Jrue Lillard: 2 personal fouls)   FT 1/2: GOOD   FT 2/2: GOOD Derrick Durant makes 2/2 from the line.
Score: 103-86

[00:27] Team_056 possession (Score: 103-86)
Yao Poole drives, picks up Derrick Durant. Help arrives from Nikola Rose! Yao Poole attempts a Layup. Wide open! Nikola Rose is 6.2 feet away. [MAN] Yao Poole misses. Rebound secured by Nikola Rose.

[00:14] Team_098 possession (Score: 103-86)
FOUL! Holding foul on Tony Carter. [IN THE BONUS! 7 team fouls] Blake Murray to the line for 2 free throws. (Tony Carter: 1 personal fouls)   FT 1/2: GOOD   FT 2/2: GOOD Blake Murray makes 2/2 from the line.
Score: 105-86

[00:04] Team_056 possession (Score: 105-86)
Magic Russell attempts a 3Pt. Contested by Nikola Rose (5.3 feet, MAN). Magic Russell misses. Offensive rebound by Yao Poole! Yao Poole kicks it out.

================================================================================
                              4TH QUARTER COMPLETE                              
================================================================================

4TH QUARTER SCORE: Team_098 23, Team_056 32

BOX SCORE:
================================================================================

Team_098
--------------------------------------------------------------------------------
Player                MIN  PTS  REB  AST  TO      FG   FG%      3P   3P%
--------------------------------------------------------------------------------
Blake Murray           39    7    0    1   0   3/4    75.0     0/0   0.0
Derrick Durant         39    6    1    1   0   3/3   100.0     0/0   0.0
Malcolm Tatum          39    4    0    1   0   2/6    33.3     0/0   0.0
Nikola Rose            39    3    2    2   0   1/5    20.0     0/0   0.0
Pascal Lillard         39    3    5    0   0   1/3    33.3     0/0   0.0

TEAM: FG: 10/21 (47.6%), 3PT: 3/9 (33.3%), REB: 8 (3 off, 5 def), AST: 5, TO: 1
TEAM FOULS: 9 [Team_056 in BONUS]


Team_056
--------------------------------------------------------------------------------
Player                MIN  PTS  REB  AST  TO      FG   FG%      3P   3P%
--------------------------------------------------------------------------------
Jrue Lillard           39   15    3    1   0   6/6   100.0     0/0   0.0
Magic Russell          39    8    0    0   0   3/3   100.0     0/0   0.0
Giannis Jokic          39    4    0    0   0   1/3    33.3     0/0   0.0
Yao Poole              39    3    3    2   0   2/4    50.0     0/0   0.0
Tony Carter            39    2    9    0   0   1/2    50.0     0/0   0.0

TEAM: FG: 13/18 (72.2%), 3PT: 4/7 (57.1%), REB: 15 (4 off, 11 def), AST: 3, TO: 3
TEAM FOULS: 7 [Team_098 in BONUS]

================================================================================

================================================================================
                               FULL GAME COMPLETE                               
================================================================================

FINAL SCORE: Team_098 105, Team_056 86

SCORING BY QUARTER:
--------------------------------------------------------------------------------
Team                     Q1     Q2     Q3     Q4    FINAL
--------------------------------------------------------------------------------
Team_098                 26     27     29     23      105
Team_056                 16     24     14     32       86
--------------------------------------------------------------------------------

FULL GAME BOX SCORE:
================================================================================

Team_098
--------------------------------------------------------------------------------
Player                MIN  PTS  REB  AST  TO      FG   FG%      3P   3P%      FT STL BLK
--------------------------------------------------------------------------------
Malcolm Tatum          39   16    0    3   3   8/14   57.1   2/6    33.3   0/0     0   0
Nikola Rose            39    9   10    2   0   6/13   46.2   2/7    28.6   2/2     2   0
Blake Murray           39   22    0    4   0   6/11   54.5   3/4    75.0   9/10    0   1
Pascal Lillard         39    9   14    6   3   4/12   33.3   1/2    50.0   0/0     3   0
Derrick Durant         39   25   10    5   1   9/11   81.8   0/1     0.0   8/9     1   0
Tracy Rose              9    6    0    0   0   2/3    66.7   1/1   100.0   1/1     0   0
Dirk McCollum           9    3    0    2   0   2/4    50.0   0/0     0.0   1/1     0   0
Kristaps Iverson        9    2    2    1   1   1/3    33.3   0/0     0.0   0/0     0   0
Manu Jordan             9    4    4    0   1   2/2   100.0   0/0     0.0   2/2     0   0
Russell McGrady         9    7    2    1   0   2/3    66.7   1/1   100.0   0/0     0   0

TEAM: FG: 44/78 (56.4%), 3PT: 10/22 (45.5%), REB: 41 (7 off, 34 def), AST: 24, TO: 9


Team_056
--------------------------------------------------------------------------------
Player                MIN  PTS  REB  AST  TO      FG   FG%      3P   3P%      FT STL BLK
--------------------------------------------------------------------------------
Giannis Jokic          39    8    0    4   0   5/10   50.0   3/7    42.9   1/1     0   0
Magic Russell          39   13    0    0   5   8/13   61.5   4/8    50.0   3/3     0   0
Tony Carter            39   12   11    0   3   3/9    33.3   1/2    50.0   3/3     0   0
Jrue Lillard           39   26   17    1   3   8/16   50.0   1/2    50.0   7/8     3   1
Yao Poole              39    8   17    4   0   5/9    55.6   0/1     0.0   6/8     0   0
De'Aaron Murray         9    2    0    0   0   1/2    50.0   0/1     0.0   0/0     0   0
Damian Barrett          9    2    0    2   0   2/4    50.0   0/1     0.0   2/2     0   0
CJ Anthony              9    7    2    1   0   2/6    33.3   1/5    20.0   2/2     1   1
RJ Johnson              9    6    3    0   0   2/2   100.0   0/0     0.0   4/4     0   1
Derrick Bane            9    2    2    1   0   1/1   100.0   0/0     0.0   0/0     0   0

TEAM: FG: 38/73 (52.1%), 3PT: 10/27 (37.0%), REB: 52 (18 off, 34 def), AST: 13, TO: 11

================================================================================
