================================================================================
                        FULL GAME - Team_066 vs Team_045                        
================================================================================

================================================================================
                       1ST QUARTER - Team_066 vs Team_045                       
================================================================================

[12:00] Team_066 possession (Score: 0-0)
Kyle Wagner drives to the basket... Kyle Wagner commits a violation (traveling/carry)! TURNOVER! (dead ball)

[11:45] Team_045 possession (Score: 0-0)
Rudy Antetokounmpo attempts a 3Pt. Contested by Jimmy Davis (4.3 feet, MAN). Rudy Antetokounmpo misses. Rebound secured by Yao Brogdon.

[11:30] Team_066 possession (Score: 0-0)
Yao Brogdon drives, Zion Butler stays with him. Yao Brogdon attempts a Dunk. Contested by Zion Butler (3.7 feet, MAN). YAO BROGDON MAKES IT!
Score: 2-0

[11:14] Team_045 possession (Score: 2-0)
Zion Butler drives, Kyle Wagner stays with him. Zion Butler attempts a Layup. Contested by Kyle Wagner (4.2 feet, ZONE). ZION BUTLER MAKES IT!
Score: 2-2

[11:01] Team_066 possession (Score: 2-2)
Kyle Wagner attempts a Layup. Contested by Zion Butler (3.1 feet, MAN). KYLE WAGNER MAKES IT! Assist: Jimmy Davis
Score: 4-2

[10:47] Team_045 possession (Score: 4-2)
DeMar Turner loses the ball! Stripped by Yao Brogdon! TURNOVER! (live ball)

[10:32] Team_066 possession (Score: 4-2)
FOUL! Reach-in foul on Zion Butler during the drive. [Team fouls: 1] No free throws, side out. (Zion Butler: 1 personal fouls)

[10:17] Team_066 possession (Score: 4-2)
Kyle Wagner attempts a Midrange. Contested by Zion Butler (3.1 feet, MAN). Kyle Wagner misses. Offensive rebound by Kyle Wagner! Kyle Wagner kicks it out.

[10:02] Team_066 possession (Score: 4-2)
FOUL! Offensive foul on Yao Brogdon! Zion Butler drew the charge! [Team fouls: 1] (Yao Brogdon: 1 personal fouls) TURNOVER! (dead ball)

[09:51] Team_045 possession (Score: 4-2)
Rudy Antetokounmpo throws a bad pass out of bounds! TURNOVER! (dead ball)

[09:31] Team_066 possession (Score: 4-2)
Jimmy Davis drives and kicks out. Pau Curry makes the Midrange and draws the foul on Trae Russell! And-1! Pau Curry to the line for 1. [Team fouls: 2] (Trae Russell: 1 personal fouls)   FT 1/1: GOOD Pau Curry makes 1/1 from the line.
Score: 7-2

[09:16] Team_045 possession (Score: 7-2)
DeMar Turner drives to the basket... DeMar Turner throws a bad pass out of bounds! TURNOVER! (dead ball)

[09:04] Team_066 possession (Score: 7-2)
Yao Brogdon drives, Zion Butler stays with him. Yao Brogdon attempts a Layup. Contested by Zion Butler (3.7 feet, ZONE). Yao Brogdon misses. Rebound secured by Cole Simons.

[08:50] Team_045 possession (Score: 7-2)
Trae Russell attempts a 3Pt. Wide open! Pau Curry is 6.0 feet away. [ZONE] TRAE RUSSELL MAKES IT!
Score: 7-5

[08:35] Team_066 possession (Score: 7-5)
Brandon Reaves attempts a 3Pt. Contested by Cole Simons (3.8 feet, MAN). Brandon Reaves misses. Rebound secured by Zion Butler.

[08:23] Team_045 possession (Score: 7-5)
Cole Simons attempts a 3Pt. Contested by Brandon Reaves (5.7 feet, MAN). Cole Simons misses. Rebound secured by Kyle Wagner.

[08:05] Team_066 possession (Score: 7-5)
Kyle Wagner drives, Zion Butler stays with him. Kyle Wagner attempts a Dunk. Contested by Zion Butler (3.1 feet, MAN). KYLE WAGNER MAKES IT! Assist: Yao Brogdon
Score: 9-5

[07:46] Team_045 possession (Score: 9-5)
Trae Russell attempts a Midrange. Contested by Brandon Reaves (5.6 feet, ZONE). Trae Russell misses. Offensive rebound by Zion Butler! Zion Butler puts it back in!
Score: 9-7

[07:31] Team_066 possession (Score: 9-7)
Yao Brogdon attempts a Layup. BLOCKED BY ZION BUTLER! Ball is loose! Offensive rebound by Kyle Wagner! Kyle Wagner kicks it out.

[07:16] Team_066 possession (Score: 9-7)
Pau Curry attempts a 3Pt. Contested by Cole Simons (3.5 feet, MAN). Pau Curry misses. Rebound secured by DeMar Turner.

[07:03] Team_045 possession (Score: 9-7)
Cole Simons makes the Layup and draws the foul on Kyle Wagner! And-1! Cole Simons to the line for 1. [Team fouls: 2] (Kyle Wagner: 1 personal fouls)   FT 1/1: GOOD Cole Simons makes 1/1 from the line.
Score: 9-10

[06:51] Team_066 possession (Score: 9-10)
Yao Brogdon attempts a Layup. Contested by Zion Butler (3.7 feet, MAN). Yao Brogdon misses. Rebound secured by Cole Simons.

[06:38] Team_045 possession (Score: 9-10)
Cole Simons attempts a Layup. Contested by Brandon Reaves (5.7 feet, MAN). COLE SIMONS MAKES IT! Assist: Trae Russell
Score: 9-12

[06:24] Team_066 possession (Score: 9-12)
Pau Curry attempts a Layup. BLOCKED BY ZION BUTLER! Ball deflects out of bounds off Pau Curry.

[06:09] Team_045 possession (Score: 9-12)
DeMar Turner attempts a 3Pt. Contested by Pau Curry (5.8 feet, ZONE). DeMar Turner misses. Rebound secured by Kyle Wagner.

[05:53] Team_066 possession (Score: 9-12)
Yao Brogdon drives and kicks out. FOUL! Shooting foul on Trae Russell. Pau Curry to the line for 2 free throws. [Team fouls: 3] (Trae Russell: 2 personal fouls)   FT 1/2: GOOD   FT 2/2: GOOD Pau Curry makes 2/2 from the line.
Score: 11-12

[05:39] Team_045 possession (Score: 11-12)
FOUL! Shooting foul on Jimmy Davis. Rudy Antetokounmpo to the line for 2 free throws. [Team fouls: 3] (Jimmy Davis: 1 personal fouls)   FT 1/2: MISS   FT 2/2: GOOD Rudy Antetokounmpo makes 1/2 from the line.
Score: 11-13

[05:24] Team_066 possession (Score: 11-13)
Brandon Reaves drives to the basket... FOUL! Offensive foul on Brandon Reaves! Zion Butler drew the charge! [Team fouls: 4] (Brandon Reaves: 1 personal fouls) TURNOVER! (dead ball)

[05:10] Team_045 possession (Score: 11-13)
Rudy Antetokounmpo attempts a 3Pt. Contested by Jimmy Davis (4.3 feet, MAN). Rudy Antetokounmpo misses. Rebound secured by Brandon Reaves.

[04:55] Team_066 possession (Score: 11-13)
Yao Brogdon attempts a 3Pt. Contested by DeMar Turner (5.4 feet, MAN). Yao Brogdon misses. Rebound secured by Zion Butler.

[04:36] Team_045 possession (Score: 11-13)
FOUL! Shooting foul on Yao Brogdon. Cole Simons to the line for 3 free throws. [BONUS: 5 team fouls] (Yao Brogdon: 2 personal fouls)   FT 1/3: MISS   FT 2/3: GOOD   FT 3/3: GOOD Cole Simons makes 2/3 from the line.
Score: 11-15

[04:20] Team_066 possession (Score: 11-15)
Jimmy Davis drives, Rudy Antetokounmpo stays with him. Jimmy Davis attempts a Dunk. Contested by Rudy Antetokounmpo (4.9 feet, MAN). Jimmy Davis misses. Offensive rebound by Yao Brogdon! Yao Brogdon kicks it out.

[04:07] Team_066 possession (Score: 11-15)
Yao Brogdon attempts a 3Pt. Contested by DeMar Turner (5.4 feet, MAN). Yao Brogdon misses. Rebound secured by Cole Simons.

[03:52] Team_045 possession (Score: 11-15)
FOUL! Holding foul on Brandon Reaves. [IN THE BONUS! 6 team fouls] Cole Simons to the line for 2 free throws. (Brandon Reaves: 2 personal fouls)   FT 1/2: MISS   FT 2/2: GOOD Cole Simons makes 1/2 from the line.
Score: 11-16

[03:38] Team_066 possession (Score: 11-16)
Yao Brogdon drives, Zion Butler stays with him. Yao Brogdon attempts a Dunk. Contested by Zion Butler (3.9 feet, ZONE). YAO BROGDON MAKES IT! Assist: Pau Curry
Score: 13-16

[03:24] Team_045 possession (Score: 13-16)
Trae Russell attempts a Midrange. Contested by Yao Brogdon (5.8 feet, ZONE). Trae Russell misses. Rebound secured by Yao Brogdon.

[03:13] Team_066 possession (Score: 13-16)
Jimmy Davis attempts a Midrange. Contested by Rudy Antetokounmpo (5.0 feet, MAN). Jimmy Davis misses. Rebound secured by Zion Butler.

[02:59] Team_045 possession (Score: 13-16)
FOUL! Reach-in foul on Kyle Wagner during the drive. [IN THE BONUS! 7 team fouls] Zion Butler to the line for 2 free throws. (Kyle Wagner: 2 personal fouls)   FT 1/2: MISS   FT 2/2: GOOD Zion Butler makes 1/2 from the line.
Score: 13-17

[02:45] Team_066 possession (Score: 13-17)
Kyle Wagner drives, picks up Zion Butler. Help arrives from Rudy Antetokounmpo! Kyle Wagner attempts a Layup. Contested by Rudy Antetokounmpo (3.5 feet, ZONE). KYLE WAGNER MAKES IT!
Score: 15-17

[02:30] Team_045 possession (Score: 15-17)
Rudy Antetokounmpo attempts a Midrange. Contested by Yao Brogdon (5.7 feet, ZONE). Rudy Antetokounmpo misses. FOUL! Loose ball foul on Brandon Reaves during the rebound battle. [IN THE BONUS! 8 team fouls] DeMar Turner to the line for 2 free throws. (Brandon Reaves: 3 personal fouls)   FT 1/2: GOOD   FT 2/2: MISS DeMar Turner makes 1/2 from the line. Rebound secured by Kyle Wagner.
Score: 15-18

[02:17] Team_066 possession (Score: 15-18)
Jimmy Davis drives to the basket... Jimmy Davis loses control! Ball rolls out of bounds! TURNOVER! (dead ball)

[02:17] Substitution (Team_066): Jimmy Davis OUT → Pascal Carter IN (stamina_rule2)

[02:17] Substitution (Team_066): Pau Curry OUT → Lauri LaVine IN (stamina_rule2)

[02:17] Substitution (Team_066): Brandon Reaves OUT → Brandon Middleton IN (stamina_rule2)

[02:17] Substitution (Team_066): Yao Brogdon OUT → Cole Morant IN (stamina_rule2)

[02:17] Substitution (Team_066): Kyle Wagner OUT → Donovan Simmons IN (stamina_rule2)

[02:17] Substitution (Team_045): Trae Russell OUT → Julius James IN (stamina_rule2)

[02:17] Substitution (Team_045): Cole Simons OUT → Gary Towns IN (stamina_rule2)

[02:17] Substitution (Team_045): Zion Butler OUT → Stephen Paul IN (stamina_rule2)

[02:03] Team_045 possession (Score: 15-18)
DeMar Turner loses control! Ball rolls out of bounds! TURNOVER! (dead ball)

[02:03] Substitution (Team_045): Rudy Antetokounmpo OUT → John Wagner IN (stamina_rule2)

[02:03] Substitution (Team_045): DeMar Turner OUT → Tim Sexton IN (stamina_rule2)

[01:54] Team_066 possession (Score: 15-18)
Lauri LaVine makes the Layup and draws the foul on Julius James! And-1! Lauri LaVine to the line for 1. [Team fouls: 4] (Julius James: 1 personal fouls)   FT 1/1: GOOD Lauri LaVine makes 1/1 from the line.
Score: 18-18

[01:39] Team_045 possession (Score: 18-18)
John Wagner attempts a 3Pt. Contested by Lauri LaVine (4.1 feet, ZONE). John Wagner misses. FOUL! Loose ball foul on Brandon Middleton during the rebound battle. [IN THE BONUS! 9 team fouls] Tim Sexton to the line for 2 free throws. (Brandon Middleton: 1 personal fouls)   FT 1/2: GOOD   FT 2/2: GOOD Tim Sexton makes 2/2 from the line.
Score: 18-20

[01:22] Team_066 possession (Score: 18-20)
Donovan Simmons attempts a Layup. Contested by Stephen Paul (4.5 feet, MAN). DONOVAN SIMMONS MAKES IT! Assist: Cole Morant
Score: 20-20

[01:11] Team_045 possession (Score: 20-20)
Stephen Paul drives and kicks out. Gary Towns attempts a 3Pt. Contested by Brandon Middleton (5.1 feet, MAN). Gary Towns misses. Rebound secured by Brandon Middleton.

[00:54] Team_066 possession (Score: 20-20)
Lauri LaVine drives, Julius James stays with him. Lauri LaVine attempts a Layup. Contested by Julius James (4.1 feet, MAN). Lauri LaVine misses. Rebound secured by Julius James.

[00:40] Team_045 possession (Score: 20-20)
Gary Towns throws a bad pass out of bounds! TURNOVER! (dead ball)

[00:23] Team_066 possession (Score: 20-20)
Lauri LaVine attempts a 3Pt. Contested by John Wagner (4.2 feet, ZONE). Lauri LaVine misses. Offensive rebound by Donovan Simmons! Donovan Simmons kicks it out.

[00:08] Team_066 possession (Score: 20-20)
Cole Morant drives and kicks out. Donovan Simmons attempts a 3Pt. Contested by Stephen Paul (4.5 feet, MAN). Donovan Simmons misses. Rebound secured by Tim Sexton.

================================================================================
                              1ST QUARTER COMPLETE                              
================================================================================

1ST QUARTER SCORE: Team_066 20, Team_045 20

BOX SCORE:
================================================================================

Team_066
--------------------------------------------------------------------------------
Player                MIN  PTS  REB  AST  TO      FG   FG%      3P   3P%
--------------------------------------------------------------------------------
Pau Curry              10    5    0    1   0   2/4    50.0     0/0   0.0
Yao Brogdon            10    4    3    1   0   2/6    33.3     0/0   0.0
Lauri LaVine            2    3    0    0   0   1/2    50.0     0/0   0.0
Donovan Simmons         2    2    1    0   0   1/1   100.0     0/0   0.0
Jimmy Davis            10    0    0    1   0   0/1     0.0     0/0   0.0
Brandon Reaves         10    0    1    0   0   0/1     0.0     0/0   0.0
Cole Morant             2    0    0    1   0   0/1     0.0     0/0   0.0
Brandon Middleton       2    0    1    0   0   0/0     0.0     0/0   0.0

TEAM: FG: 9/19 (47.4%), 3PT: 0/4 (0.0%), REB: 10 (4 off, 6 def), AST: 4, TO: 4
TEAM FOULS: 9 [Team_045 in BONUS]


Team_045
--------------------------------------------------------------------------------
Player                MIN  PTS  REB  AST  TO      FG   FG%      3P   3P%
--------------------------------------------------------------------------------
Cole Simons            10    8    3    0   0   4/5    80.0     0/0   0.0
Kyle Wagner            10    6    5    0   0   3/3   100.0     0/0   0.0
Zion Butler            10    5    4    0   0   3/3   100.0     0/0   0.0
Trae Russell           10    3    0    1   0   1/2    50.0     0/0   0.0
Tim Sexton              2    2    1    0   0   1/1   100.0     0/0   0.0
Rudy Antetokounmpo     10    1    0    0   0   1/4    25.0     0/0   0.0
DeMar Turner           10    0    1    0   0   0/1     0.0     0/0   0.0
Stephen Paul            2    0    0    0   0   0/1     0.0     0/0   0.0
Julius James            2    0    1    0   0   0/0     0.0     0/0   0.0

TEAM: FG: 10/17 (58.8%), 3PT: 3/7 (42.9%), REB: 11 (2 off, 9 def), AST: 1, TO: 5
TEAM FOULS: 4

================================================================================

================================================================================
                       2ND QUARTER - Team_066 vs Team_045                       
================================================================================

[12:00] Team_066 possession (Score: 20-20)
FOUL! Reach-in foul on Zion Butler during the drive. [Team fouls: 1] No free throws, side out. (Zion Butler: 1 personal fouls)

[11:50] Team_066 possession (Score: 20-20)
Pau Curry attempts a 3Pt. Contested by DeMar Turner (5.2 feet, ZONE). Pau Curry misses. Rebound secured by DeMar Turner.

[11:40] Team_045 possession (Score: 20-20)
Zion Butler makes the Layup and draws the foul on Jimmy Davis! And-1! Zion Butler to the line for 1. [Team fouls: 1] (Jimmy Davis: 1 personal fouls)   FT 1/1: GOOD Zion Butler makes 1/1 from the line.
Score: 20-23

[11:31] Team_066 possession (Score: 20-23)
Jimmy Davis drives to the basket... FOUL! Offensive foul on Jimmy Davis! Zion Butler drew the charge! [Team fouls: 2] (Jimmy Davis: 2 personal fouls) TURNOVER! (dead ball)

[11:19] Team_045 possession (Score: 20-23)
FOUL! Shooting foul on Kyle Wagner. Cole Simons to the line for 2 free throws. [Team fouls: 3] (Kyle Wagner: 1 personal fouls)   FT 1/2: GOOD   FT 2/2: MISS Cole Simons makes 1/2 from the line. Rebound secured by Kyle Wagner.
Score: 20-24

[11:08] Team_066 possession (Score: 20-24)
Yao Brogdon attempts a 3Pt. Contested by DeMar Turner (5.4 feet, ZONE). Yao Brogdon misses. Offensive rebound by Kyle Wagner! Kyle Wagner kicks it out.

[10:55] Team_066 possession (Score: 20-24)
Brandon Reaves attempts a Midrange. Contested by DeMar Turner (5.5 feet, ZONE). BRANDON REAVES MAKES IT!
Score: 22-24

[10:42] Team_045 possession (Score: 22-24)
FOUL! Holding foul on Jimmy Davis. [Team fouls: 4] No free throws, side out. (Jimmy Davis: 3 personal fouls)

[10:33] Team_045 possession (Score: 22-24)
Trae Russell attempts a 3Pt. Wide open! Pau Curry is 6.2 feet away. [MAN] Trae Russell misses. Rebound secured by Yao Brogdon.

[10:20] Team_066 possession (Score: 22-24)
Kyle Wagner attempts a Layup. Contested by Zion Butler (3.5 feet, ZONE). Kyle Wagner misses. Rebound secured by DeMar Turner.

[10:03] Team_045 possession (Score: 22-24)
Trae Russell attempts a Layup. Contested by Kyle Wagner (4.6 feet, ZONE). Trae Russell misses. Rebound secured by Yao Brogdon.

[09:45] Team_066 possession (Score: 22-24)
Pau Curry attempts a Midrange. Contested by Trae Russell (5.8 feet, ZONE). Pau Curry misses. Rebound secured by Cole Simons.

[09:36] Team_045 possession (Score: 22-24)
Cole Simons attempts a 3Pt. Contested by Jimmy Davis (4.9 feet, ZONE). Cole Simons misses. Rebound secured by Yao Brogdon.

[09:17] Team_066 possession (Score: 22-24)
FOUL! Holding foul on Cole Simons. [Team fouls: 2] No free throws, side out. (Cole Simons: 1 personal fouls)

[09:03] Team_066 possession (Score: 22-24)
Yao Brogdon attempts a Midrange. Contested by Cole Simons (4.1 feet, ZONE). Yao Brogdon misses. Rebound secured by DeMar Turner.

[08:47] Team_045 possession (Score: 22-24)
DeMar Turner drives, picks up Yao Brogdon. Help arrives from Jimmy Davis! DeMar Turner attempts a Layup. Contested by Jimmy Davis (5.7 feet, MAN). DEMAR TURNER MAKES IT! Assist: Trae Russell
Score: 22-26

[08:35] Team_066 possession (Score: 22-26)
FOUL! Shooting foul on Rudy Antetokounmpo. Kyle Wagner to the line for 2 free throws. [Team fouls: 3] (Rudy Antetokounmpo: 1 personal fouls)   FT 1/2: GOOD   FT 2/2: GOOD Kyle Wagner makes 2/2 from the line.
Score: 24-26

[08:26] Team_045 possession (Score: 24-26)
Cole Simons attempts a 3Pt. Wide open! Pau Curry is 6.4 feet away. [ZONE] COLE SIMONS MAKES IT! Assist: DeMar Turner
Score: 24-29

[08:10] Team_066 possession (Score: 24-29)
Brandon Reaves attempts a Midrange. Contested by Cole Simons (4.3 feet, MAN). Brandon Reaves misses. Offensive rebound by Kyle Wagner! Kyle Wagner kicks it out.

[07:58] Team_066 possession (Score: 24-29)
FOUL! Holding foul on Zion Butler. [Team fouls: 4] No free throws, side out. (Zion Butler: 2 personal fouls)

[07:43] Team_066 possession (Score: 24-29)
Brandon Reaves attempts a 3Pt. Wide open! Trae Russell is 6.2 feet away. [ZONE] Brandon Reaves misses. Rebound secured by Zion Butler.

[07:32] Team_045 possession (Score: 24-29)
Rudy Antetokounmpo attempts a Midrange. Contested by Jimmy Davis (4.9 feet, MAN). Rudy Antetokounmpo misses. Offensive rebound by Zion Butler! Zion Butler puts it back in!
Score: 24-31

[07:19] Team_066 possession (Score: 24-31)
Brandon Reaves drives and kicks out. Brandon Reaves attempts a Midrange. Contested by Trae Russell (5.9 feet, ZONE). BRANDON REAVES MAKES IT! Assist: Yao Brogdon
Score: 26-31

[07:03] Team_045 possession (Score: 26-31)
DeMar Turner drives and kicks out. Trae Russell attempts a 3Pt. Wide open! Pau Curry is 6.1 feet away. [ZONE] Trae Russell misses. Offensive rebound by Zion Butler! Zion Butler's putback is no good. Offensive rebound by Zion Butler! Zion Butler kicks it out.

[06:46] Team_045 possession (Score: 26-31)
Rudy Antetokounmpo drives, Kyle Wagner stays with him. Rudy Antetokounmpo attempts a Dunk. Contested by Kyle Wagner (4.8 feet, ZONE). Rudy Antetokounmpo misses. Rebound secured by Kyle Wagner.

[06:29] Team_066 possession (Score: 26-31)
Kyle Wagner attempts a 3Pt. Contested by Cole Simons (3.9 feet, ZONE). Kyle Wagner misses. Rebound secured by Zion Butler.

[06:11] Team_045 possession (Score: 26-31)
Cole Simons attempts a 3Pt. Wide open! Pau Curry is 6.6 feet away. [ZONE] Cole Simons misses. Rebound secured by Kyle Wagner.

[05:59] Team_066 possession (Score: 26-31)
FOUL! Holding foul on DeMar Turner. [IN THE BONUS! 5 team fouls] Yao Brogdon to the line for 2 free throws. (DeMar Turner: 1 personal fouls)   FT 1/2: GOOD   FT 2/2: GOOD Yao Brogdon makes 2/2 from the line.
Score: 28-31

[05:44] Team_045 possession (Score: 28-31)
DeMar Turner attempts a Midrange. Wide open! Yao Brogdon is 6.1 feet away. [MAN] DeMar Turner misses. Offensive rebound by Zion Butler! Zion Butler's putback is no good. Rebound secured by Yao Brogdon.

[05:31] Team_066 possession (Score: 28-31)
Pau Curry attempts a 3Pt. Contested by Cole Simons (4.4 feet, ZONE). Pau Curry misses. Rebound secured by DeMar Turner.

[05:13] Team_045 possession (Score: 28-31)
Trae Russell attempts a 3Pt. Wide open! Pau Curry is 6.6 feet away. [MAN] Trae Russell misses. Offensive rebound by DeMar Turner! DeMar Turner kicks it out.

[04:56] Team_045 possession (Score: 28-31)
DeMar Turner attempts a Midrange. Wide open! Yao Brogdon is 6.2 feet away. [MAN] DeMar Turner misses. Rebound secured by Yao Brogdon.

[04:42] Team_066 possession (Score: 28-31)
Kyle Wagner attempts a 3Pt. Contested by Cole Simons (4.2 feet, ZONE). KYLE WAGNER MAKES IT!
Score: 31-31

[04:28] Team_045 possession (Score: 31-31)
Zion Butler drives and kicks out. Cole Simons attempts a 3Pt. Contested by Brandon Reaves (5.9 feet, MAN). Cole Simons misses. Rebound secured by Yao Brogdon.

[04:10] Team_066 possession (Score: 31-31)
FOUL! Shooting foul on DeMar Turner. Yao Brogdon to the line for 2 free throws. [BONUS: 6 team fouls] (DeMar Turner: 2 personal fouls)   FT 1/2: GOOD   FT 2/2: GOOD Yao Brogdon makes 2/2 from the line.
Score: 33-31

[03:55] Team_045 possession (Score: 33-31)
Rudy Antetokounmpo attempts a Midrange. Wide open! Brandon Reaves is 6.2 feet away. [ZONE] Rudy Antetokounmpo misses. Rebound secured by Kyle Wagner.

[03:39] Team_066 possession (Score: 33-31)
Kyle Wagner drives, picks up Zion Butler. Help arrives from Rudy Antetokounmpo! Kyle Wagner attempts a Layup. Contested by Rudy Antetokounmpo (4.6 feet, MAN). KYLE WAGNER MAKES IT! Assist: Yao Brogdon
Score: 35-31

[03:22] Team_045 possession (Score: 35-31)
Rudy Antetokounmpo attempts a 3Pt. Contested by Jimmy Davis (5.5 feet, MAN). RUDY ANTETOKOUNMPO MAKES IT! Assist: DeMar Turner
Score: 35-34

[03:04] Team_066 possession (Score: 35-34)
Jimmy Davis makes the Layup and draws the foul on Zion Butler! And-1! Jimmy Davis to the line for 1. [BONUS: 7 team fouls] (Zion Butler: 3 personal fouls)   FT 1/1: MISS Jimmy Davis makes 0/1 from the line. Rebound secured by DeMar Turner.
Score: 37-34

[02:49] Team_045 possession (Score: 37-34)
FOUL! Shooting foul on Jimmy Davis. Rudy Antetokounmpo to the line for 2 free throws. [BONUS: 5 team fouls] (Jimmy Davis: 4 personal fouls)   FT 1/2: MISS   FT 2/2: MISS Rudy Antetokounmpo makes 0/2 from the line. Rebound secured by Yao Brogdon.

[02:35] Team_066 possession (Score: 37-34)
Jimmy Davis attempts a Midrange. Wide open! Trae Russell is 6.6 feet away. [ZONE] Jimmy Davis misses. Rebound secured by Cole Simons.

[02:17] Team_045 possession (Score: 37-34)
Zion Butler drives to the basket... Zion Butler throws a bad pass! Stolen by Kyle Wagner! TURNOVER! (live ball)

[01:59] Team_066 possession (Score: 37-34)
Brandon Reaves attempts a 3Pt. Wide open! Trae Russell is 6.7 feet away. [ZONE] BRANDON REAVES MAKES IT! Assist: Pau Curry
Score: 40-34

[01:44] Team_045 possession (Score: 40-34)
Cole Simons attempts a 3Pt. Wide open! Pau Curry is 7.0 feet away. [ZONE] COLE SIMONS MAKES IT!
Score: 40-37

[01:31] Team_066 possession (Score: 40-37)
Brandon Reaves attempts a 3Pt. Contested by Cole Simons (5.2 feet, ZONE). Brandon Reaves misses. Rebound secured by DeMar Turner.

[01:16] Team_045 possession (Score: 40-37)
FOUL! Holding foul on Brandon Reaves. [IN THE BONUS! 6 team fouls] Cole Simons to the line for 2 free throws. (Brandon Reaves: 1 personal fouls)   FT 1/2: GOOD   FT 2/2: GOOD Cole Simons makes 2/2 from the line.
Score: 40-39

[01:02] Team_066 possession (Score: 40-39)
Yao Brogdon attempts a 3Pt. Wide open! DeMar Turner is 6.3 feet away. [MAN] Yao Brogdon misses. Rebound secured by Cole Simons.

[00:46] Team_045 possession (Score: 40-39)
DeMar Turner drives, Yao Brogdon stays with him. DeMar Turner attempts a Layup. Wide open! Yao Brogdon is 6.6 feet away. [MAN] DEMAR TURNER MAKES IT!
Score: 40-41

[00:32] Team_066 possession (Score: 40-41)
Yao Brogdon attempts a 3Pt. Wide open! Rudy Antetokounmpo is 6.0 feet away. [ZONE] Yao Brogdon misses. Rebound secured by Zion Butler.

[00:21] Team_045 possession (Score: 40-41)
Cole Simons drives, Kyle Wagner stays with him. Cole Simons attempts a Layup. Contested by Kyle Wagner (5.7 feet, ZONE). Cole Simons misses. Rebound secured by Kyle Wagner.

[00:08] Team_066 possession (Score: 40-41)
Yao Brogdon attempts a Layup. Wide open! DeMar Turner is 6.5 feet away. [MAN] Yao Brogdon misses. Offensive rebound by Yao Brogdon! Yao Brogdon kicks it out.

================================================================================
                              2ND QUARTER COMPLETE                              
================================================================================

2ND QUARTER SCORE: Team_066 20, Team_045 21

BOX SCORE:
================================================================================

Team_066
--------------------------------------------------------------------------------
Player                MIN  PTS  REB  AST  TO      FG   FG%      3P   3P%
--------------------------------------------------------------------------------
Kyle Wagner            22    7    7    0   0   3/5    60.0     0/0   0.0
Brandon Reaves         22    7    0    0   0   3/5    60.0     0/0   0.0
Yao Brogdon            22    4    8    2   0   2/5    40.0     0/0   0.0
Pau Curry              22    0    0    1   0   0/3     0.0     0/0   0.0
Jimmy Davis            22    0    0    0   0   0/2     0.0     0/0   0.0

TEAM: FG: 8/20 (40.0%), 3PT: 2/9 (22.2%), REB: 14 (3 off, 11 def), AST: 3, TO: 1
TEAM FOULS: 6 [Team_045 in BONUS]


Team_045
--------------------------------------------------------------------------------
Player                MIN  PTS  REB  AST  TO      FG   FG%      3P   3P%
--------------------------------------------------------------------------------
Cole Simons            22    8    3    0   0   3/7    42.9     0/0   0.0
Zion Butler            22    5    5    0   0   2/3    66.7     0/0   0.0
DeMar Turner           22    4    7    2   0   2/4    50.0     0/0   0.0
Rudy Antetokounmpo     22    3    0    0   0   1/4    25.0     0/0   0.0
Trae Russell           22    0    0    1   0   0/2     0.0     0/0   0.0

TEAM: FG: 8/20 (40.0%), 3PT: 3/6 (50.0%), REB: 16 (4 off, 12 def), AST: 3, TO: 1
TEAM FOULS: 7 [Team_066 in BONUS]

================================================================================

================================================================================
                       3RD QUARTER - Team_066 vs Team_045                       
================================================================================

[12:00] Team_066 possession (Score: 40-41)
Yao Brogdon attempts a 3Pt. Contested by Rudy Antetokounmpo (4.9 feet, ZONE). Yao Brogdon misses. Rebound secured by Cole Simons.

[11:48] Team_045 possession (Score: 40-41)
FOUL! Shooting foul on Brandon Reaves. Cole Simons to the line for 2 free throws. [Team fouls: 1] (Brandon Reaves: 1 personal fouls)   FT 1/2: GOOD   FT 2/2: GOOD Cole Simons makes 2/2 from the line.
Score: 40-43

[11:29] Team_066 possession (Score: 40-43)
Yao Brogdon attempts a Midrange. Contested by Zion Butler (3.7 feet, MAN). Yao Brogdon misses. Offensive rebound by Yao Brogdon! Yao Brogdon kicks it out.

[11:17] Team_066 possession (Score: 40-43)
Pau Curry drives to the basket... FOUL! Offensive foul on Pau Curry! Cole Simons drew the charge! [Team fouls: 2] (Pau Curry: 1 personal fouls) TURNOVER! (dead ball)

[11:03] Team_045 possession (Score: 40-43)
Trae Russell attempts a 3Pt. Wide open! Pau Curry is 6.0 feet away. [ZONE] Trae Russell misses. Rebound secured by Kyle Wagner.

[10:50] Team_066 possession (Score: 40-43)
Jimmy Davis attempts a 3Pt. Contested by Cole Simons (3.7 feet, ZONE). Jimmy Davis misses. Rebound secured by Zion Butler.

[10:39] Team_045 possession (Score: 40-43)
Zion Butler drives and kicks out. DeMar Turner attempts a 3Pt. Contested by Yao Brogdon (5.1 feet, MAN). DEMAR TURNER MAKES IT! Assist: Cole Simons
Score: 40-46

[10:26] Team_066 possession (Score: 40-46)
Yao Brogdon attempts a 3Pt. Contested by Zion Butler (3.7 feet, MAN). Yao Brogdon misses. Rebound secured by Zion Butler.

[10:10] Team_045 possession (Score: 40-46)
Zion Butler drives to the basket... Zion Butler throws a bad pass out of bounds! TURNOVER! (dead ball)

[09:58] Team_066 possession (Score: 40-46)
Jimmy Davis attempts a 3Pt. Contested by Rudy Antetokounmpo (4.9 feet, MAN). JIMMY DAVIS MAKES IT! Assist: Pau Curry
Score: 43-46

[09:43] Team_045 possession (Score: 43-46)
Rudy Antetokounmpo attempts a Midrange. Contested by Pau Curry (5.9 feet, ZONE). Rudy Antetokounmpo misses. Rebound secured by Yao Brogdon.

[09:32] Team_066 possession (Score: 43-46)
Brandon Reaves attempts a Layup. BLOCKED BY COLE SIMONS! Ball is loose! Rebound secured by Cole Simons.

[09:18] Team_045 possession (Score: 43-46)
Cole Simons attempts a Midrange. Contested by Brandon Reaves (5.7 feet, MAN). COLE SIMONS MAKES IT!
Score: 43-48

[09:06] Team_066 possession (Score: 43-48)
FOUL! Holding foul on Cole Simons. [Team fouls: 1] No free throws, side out. (Cole Simons: 1 personal fouls)

[08:49] Team_066 possession (Score: 43-48)
Yao Brogdon attempts a Layup. Contested by Zion Butler (3.7 feet, ZONE). Yao Brogdon misses. FOUL! Loose ball foul on Zion Butler during the rebound battle. [Team fouls: 2] No free throws, side out. (Zion Butler: 1 personal fouls)

[08:34] Team_066 possession (Score: 43-48)
Brandon Reaves attempts a Midrange. Contested by Cole Simons (3.8 feet, MAN). Brandon Reaves misses. Rebound secured by Cole Simons.

[08:25] Team_045 possession (Score: 43-48)
DeMar Turner attempts a Midrange. Contested by Pau Curry (5.8 feet, ZONE). DEMAR TURNER MAKES IT!
Score: 43-50

[08:09] Team_066 possession (Score: 43-50)
Kyle Wagner makes the Layup and draws the foul on Zion Butler! And-1! Kyle Wagner to the line for 1. [Team fouls: 3] (Zion Butler: 2 personal fouls)   FT 1/1: GOOD Kyle Wagner makes 1/1 from the line.
Score: 46-50

[07:56] Team_045 possession (Score: 46-50)
Zion Butler drives to the basket... Zion Butler throws a bad pass! Stolen by Kyle Wagner! TURNOVER! (live ball)

[07:40] Team_066 possession (Score: 46-50)
Yao Brogdon attempts a 3Pt. Contested by Zion Butler (3.7 feet, MAN). Yao Brogdon misses. Rebound secured by Cole Simons.

[07:24] Team_045 possession (Score: 46-50)
Trae Russell drives to the basket... Trae Russell loses control! Ball rolls out of bounds! TURNOVER! (dead ball)

[07:11] Team_066 possession (Score: 46-50)
Pau Curry attempts a 3Pt. Contested by DeMar Turner (5.2 feet, ZONE). PAU CURRY MAKES IT! Assist: Yao Brogdon
Score: 49-50

[06:54] Team_045 possession (Score: 49-50)
Rudy Antetokounmpo attempts a 3Pt. Contested by Pau Curry (5.9 feet, ZONE). Rudy Antetokounmpo misses. Rebound secured by Kyle Wagner.

[06:43] Team_066 possession (Score: 49-50)
FOUL! Reach-in foul on Zion Butler during the drive. [Team fouls: 4] No free throws, side out. (Zion Butler: 3 personal fouls)

[06:28] Team_066 possession (Score: 49-50)
Brandon Reaves attempts a 3Pt. Contested by Cole Simons (3.8 feet, MAN). Brandon Reaves misses. Rebound secured by Cole Simons.

[06:15] Team_045 possession (Score: 49-50)
Zion Butler attempts a 3Pt. Contested by Pau Curry (5.8 feet, ZONE). ZION BUTLER MAKES IT! Assist: Trae Russell
Score: 49-53

[05:57] Team_066 possession (Score: 49-53)
Yao Brogdon throws a bad pass out of bounds! TURNOVER! (dead ball)

[05:41] Team_045 possession (Score: 49-53)
Trae Russell drives and kicks out. Rudy Antetokounmpo attempts a Midrange. Contested by Pau Curry (5.5 feet, ZONE). Rudy Antetokounmpo misses. Offensive rebound by Zion Butler! Zion Butler's putback is no good. Rebound secured by Kyle Wagner.

[05:24] Team_066 possession (Score: 49-53)
FOUL! Shooting foul on Cole Simons. Brandon Reaves to the line for 2 free throws. [BONUS: 5 team fouls] (Cole Simons: 2 personal fouls)   FT 1/2: MISS   FT 2/2: GOOD Brandon Reaves makes 1/2 from the line.
Score: 50-53

[05:09] Team_045 possession (Score: 50-53)
Rudy Antetokounmpo attempts a Midrange. Contested by Jimmy Davis (4.4 feet, MAN). Rudy Antetokounmpo misses. Rebound secured by Yao Brogdon.

[04:57] Team_066 possession (Score: 50-53)
Brandon Reaves attempts a 3Pt. Contested by Cole Simons (3.8 feet, MAN). Brandon Reaves misses. FOUL! Loose ball foul on Zion Butler during the rebound battle. [IN THE BONUS! 6 team fouls] Yao Brogdon to the line for 2 free throws. (Zion Butler: 4 personal fouls)   FT 1/2: GOOD   FT 2/2: GOOD Yao Brogdon makes 2/2 from the line.
Score: 52-53

[04:44] Team_045 possession (Score: 52-53)
DeMar Turner attempts a 3Pt. Contested by Pau Curry (5.9 feet, ZONE). DeMar Turner misses. Rebound secured by Yao Brogdon.

[04:28] Team_066 possession (Score: 52-53)
Pau Curry drives and kicks out. Yao Brogdon attempts a Midrange. Contested by Trae Russell (5.5 feet, ZONE). Yao Brogdon misses. Rebound secured by Zion Butler.

[04:17] Team_045 possession (Score: 52-53)
DeMar Turner attempts a Midrange. Contested by Yao Brogdon (5.5 feet, MAN). DeMar Turner misses. Rebound secured by Brandon Reaves.

[04:03] Team_066 possession (Score: 52-53)
Brandon Reaves attempts a Midrange. Contested by Cole Simons (3.9 feet, MAN). BRANDON REAVES MAKES IT!
Score: 54-53

[03:52] Team_045 possession (Score: 54-53)
Cole Simons makes the Layup and draws the foul on Brandon Reaves! And-1! Cole Simons to the line for 1. [Team fouls: 3] (Brandon Reaves: 2 personal fouls)   FT 1/1: GOOD Cole Simons makes 1/1 from the line.
Score: 54-56

[03:40] Team_066 possession (Score: 54-56)
Pau Curry drives to the basket... Pau Curry loses control! Ball rolls out of bounds! TURNOVER! (dead ball)

[03:40] Substitution (Team_045): Zion Butler OUT → Stephen Paul IN (stamina_rule2)

[03:22] Team_045 possession (Score: 54-56)
Trae Russell attempts a 3Pt. Wide open! Pau Curry is 6.2 feet away. [ZONE] Trae Russell misses. Rebound secured by Brandon Reaves.

[03:06] Team_066 possession (Score: 54-56)
Kyle Wagner attempts a Midrange. Contested by Trae Russell (5.4 feet, ZONE). Kyle Wagner misses. Rebound secured by Stephen Paul.

[02:51] Team_045 possession (Score: 54-56)
Trae Russell attempts a Layup. BLOCKED BY KYLE WAGNER! Ball deflects out of bounds off Trae Russell.

[02:40] Team_066 possession (Score: 54-56)
Jimmy Davis attempts a Midrange. Contested by Rudy Antetokounmpo (5.1 feet, MAN). Jimmy Davis misses. Rebound secured by Stephen Paul.

[02:26] Team_045 possession (Score: 54-56)
Trae Russell drives and kicks out. Rudy Antetokounmpo attempts a Midrange. Contested by Jimmy Davis (4.3 feet, MAN). Rudy Antetokounmpo misses. Offensive rebound by Cole Simons! Cole Simons kicks it out.

[02:08] Team_045 possession (Score: 54-56)
Cole Simons attempts a Midrange. Wide open! Pau Curry is 6.3 feet away. [ZONE] COLE SIMONS MAKES IT! Assist: Stephen Paul
Score: 54-58

[01:53] Team_066 possession (Score: 54-58)
Kyle Wagner drives, Stephen Paul stays with him. Kyle Wagner attempts a Dunk. Contested by Stephen Paul (4.3 feet, MAN). Kyle Wagner misses. FOUL! Loose ball foul on DeMar Turner during the rebound battle. [IN THE BONUS! 7 team fouls] Yao Brogdon to the line for 2 free throws. (DeMar Turner: 1 personal fouls)   FT 1/2: GOOD   FT 2/2: GOOD Yao Brogdon makes 2/2 from the line.
Score: 56-58

[01:40] Team_045 possession (Score: 56-58)
DeMar Turner attempts a Midrange. Contested by Brandon Reaves (5.7 feet, ZONE). DeMar Turner misses. Rebound secured by Yao Brogdon.

[01:26] Team_066 possession (Score: 56-58)
Yao Brogdon attempts a Midrange. Contested by Cole Simons (4.2 feet, ZONE). Yao Brogdon misses. Rebound secured by Stephen Paul.

[01:12] Team_045 possession (Score: 56-58)
FOUL! Shooting foul on Kyle Wagner. Stephen Paul to the line for 2 free throws. [Team fouls: 4] (Kyle Wagner: 1 personal fouls)   FT 1/2: GOOD   FT 2/2: GOOD Stephen Paul makes 2/2 from the line.
Score: 56-60

[00:58] Team_066 possession (Score: 56-60)
FOUL! Reach-in foul on DeMar Turner during the drive. [IN THE BONUS! 8 team fouls] Jimmy Davis to the line for 2 free throws. (DeMar Turner: 2 personal fouls)   FT 1/2: GOOD   FT 2/2: GOOD Jimmy Davis makes 2/2 from the line.
Score: 58-60

[00:44] Team_045 possession (Score: 58-60)
FOUL! Shooting foul on Brandon Reaves. DeMar Turner to the line for 3 free throws. [BONUS: 5 team fouls] (Brandon Reaves: 3 personal fouls)   FT 1/3: GOOD   FT 2/3: GOOD   FT 3/3: GOOD DeMar Turner makes 3/3 from the line.
Score: 58-63

[00:29] Team_066 possession (Score: 58-63)
Kyle Wagner drives, Stephen Paul stays with him. Kyle Wagner attempts a Dunk. Contested by Stephen Paul (4.3 feet, MAN). Kyle Wagner misses. Rebound secured by DeMar Turner.

[00:12] Team_045 possession (Score: 58-63)
Trae Russell drives, picks up Pau Curry. Help arrives from Jimmy Davis! Trae Russell attempts a Dunk. Wide open! Jimmy Davis is 6.4 feet away. [MAN] TRAE RUSSELL MAKES IT!
Score: 58-65

================================================================================
                              3RD QUARTER COMPLETE                              
================================================================================

3RD QUARTER SCORE: Team_066 18, Team_045 24

BOX SCORE:
================================================================================

Team_066
--------------------------------------------------------------------------------
Player                MIN  PTS  REB  AST  TO      FG   FG%      3P   3P%
--------------------------------------------------------------------------------
Jimmy Davis            34    5    0    0   0   2/4    50.0     0/0   0.0
Yao Brogdon            34    4    5    1   0   2/6    33.3     0/0   0.0
Kyle Wagner            34    3    4    0   0   1/3    33.3     0/0   0.0
Pau Curry              34    3    0    1   0   1/2    50.0     0/0   0.0
Brandon Reaves         34    3    2    0   0   2/5    40.0     0/0   0.0

TEAM: FG: 8/20 (40.0%), 3PT: 3/8 (37.5%), REB: 10 (2 off, 8 def), AST: 2, TO: 3
TEAM FOULS: 5 [Team_045 in BONUS]


Team_045
--------------------------------------------------------------------------------
Player                MIN  PTS  REB  AST  TO      FG   FG%      3P   3P%
--------------------------------------------------------------------------------
Cole Simons            34    9    6    1   0   4/4   100.0     0/0   0.0
DeMar Turner           34    8    1    0   0   3/6    50.0     0/0   0.0
Zion Butler            31    3    3    0   0   1/1   100.0     0/0   0.0
Trae Russell           34    2    0    1   0   1/5    20.0     0/0   0.0
Stephen Paul            6    2    3    1   0   1/1   100.0     0/0   0.0
Rudy Antetokounmpo     34    0    0    0   0   0/3     0.0     0/0   0.0

TEAM: FG: 10/20 (50.0%), 3PT: 2/6 (33.3%), REB: 14 (2 off, 12 def), AST: 3, TO: 3
TEAM FOULS: 8 [Team_066 in BONUS]

================================================================================

================================================================================
                       4TH QUARTER - Team_066 vs Team_045                       
================================================================================

[12:00] Team_066 possession (Score: 58-65)
Pau Curry attempts a Midrange. Contested by Cole Simons (3.9 feet, MAN). PAU CURRY MAKES IT!
Score: 60-65

[11:45] Team_045 possession (Score: 60-65)
Cole Simons attempts a 3Pt. Wide open! Pau Curry is 6.4 feet away. [ZONE] Cole Simons misses. Rebound secured by Kyle Wagner.

[11:31] Team_066 possession (Score: 60-65)
Brandon Reaves drives, Cole Simons stays with him. Brandon Reaves attempts a Layup. Contested by Cole Simons (4.2 feet, MAN). BRANDON REAVES MAKES IT! Assist: Pau Curry
Score: 62-65

[11:19] Team_045 possession (Score: 62-65)
Rudy Antetokounmpo attempts a Layup. Contested by Jimmy Davis (4.8 feet, MAN). Rudy Antetokounmpo misses. Rebound secured by Brandon Reaves.

[11:04] Team_066 possession (Score: 62-65)
Pau Curry attempts a Layup. Contested by Zion Butler (3.5 feet, ZONE). Pau Curry misses. Rebound secured by Cole Simons.

[10:49] Team_045 possession (Score: 62-65)
Rudy Antetokounmpo attempts a Midrange. Contested by Brandon Reaves (5.8 feet, ZONE). RUDY ANTETOKOUNMPO MAKES IT! Assist: DeMar Turner
Score: 62-67

[10:30] Team_066 possession (Score: 62-67)
Jimmy Davis drives, Rudy Antetokounmpo stays with him. Jimmy Davis attempts a Layup. Contested by Rudy Antetokounmpo (5.2 feet, MAN). Jimmy Davis misses. Rebound secured by Cole Simons.

[10:16] Team_045 possession (Score: 62-67)
Rudy Antetokounmpo attempts a Layup. BLOCKED BY JIMMY DAVIS! Ball is loose! Offensive rebound by Zion Butler! Zion Butler kicks it out.

[10:02] Team_045 possession (Score: 62-67)
Rudy Antetokounmpo attempts a 3Pt. Wide open! Pau Curry is 6.3 feet away. [ZONE] Rudy Antetokounmpo misses. Rebound secured by Brandon Reaves.

[09:49] Team_066 possession (Score: 62-67)
Pau Curry attempts a Midrange. Contested by DeMar Turner (5.6 feet, ZONE). Pau Curry misses. Rebound secured by Zion Butler.

[09:31] Team_045 possession (Score: 62-67)
Rudy Antetokounmpo drives, picks up Jimmy Davis. Help arrives from Brandon Reaves! Rudy Antetokounmpo attempts a Layup. Contested by Brandon Reaves (5.0 feet, MAN). RUDY ANTETOKOUNMPO MAKES IT!
Score: 62-69

[09:17] Team_066 possession (Score: 62-69)
Pau Curry attempts a 3Pt. Contested by Cole Simons (4.3 feet, ZONE). Pau Curry misses. Offensive rebound by Yao Brogdon! Yao Brogdon kicks it out.

[09:00] Team_066 possession (Score: 62-69)
Pau Curry throws a bad pass out of bounds! TURNOVER! (dead ball)

[09:00] Substitution (Team_066): Jimmy Davis OUT → Pascal Carter IN (stamina_rule2)

[09:00] Substitution (Team_066): Pau Curry OUT → Lauri LaVine IN (stamina_rule2)

[09:00] Substitution (Team_066): Brandon Reaves OUT → Brandon Middleton IN (stamina_rule2)

[09:00] Substitution (Team_066): Yao Brogdon OUT → Cole Morant IN (stamina_rule2)

[09:00] Substitution (Team_066): Kyle Wagner OUT → Donovan Simmons IN (stamina_rule2)

[09:00] Substitution (Team_045): Rudy Antetokounmpo OUT → John Wagner IN (stamina_rule2)

[09:00] Substitution (Team_045): Trae Russell OUT → Julius James IN (stamina_rule2)

[09:00] Substitution (Team_045): Cole Simons OUT → Gary Towns IN (stamina_rule2)

[09:00] Substitution (Team_045): DeMar Turner OUT → Tim Sexton IN (stamina_rule2)

[09:00] Substitution (Team_045): Zion Butler OUT → Stephen Paul IN (stamina_rule2)

[08:42] Team_045 possession (Score: 62-69)
John Wagner attempts a 3Pt. Contested by Brandon Middleton (5.3 feet, ZONE). John Wagner misses. Rebound secured by Lauri LaVine.

[08:26] Team_066 possession (Score: 62-69)
Donovan Simmons drives, picks up Stephen Paul. Help arrives from Julius James! Donovan Simmons attempts a Layup. Contested by Julius James (4.5 feet, MAN). Donovan Simmons misses. Rebound secured by Stephen Paul.

[08:07] Team_045 possession (Score: 62-69)
Gary Towns throws a bad pass! Stolen by Brandon Middleton! TURNOVER! (live ball)

[07:56] Team_066 possession (Score: 62-69)
FOUL! Holding foul on Gary Towns. [Team fouls: 1] No free throws, side out. (Gary Towns: 1 personal fouls)

[07:42] Team_066 possession (Score: 62-69)
Cole Morant attempts a Midrange. Contested by John Wagner (4.6 feet, ZONE). COLE MORANT MAKES IT! Assist: Lauri LaVine
Score: 64-69

[07:33] Team_045 possession (Score: 64-69)
John Wagner attempts a 3Pt. Wide open! Pascal Carter is 6.8 feet away. [MAN] John Wagner misses. Rebound secured by Donovan Simmons.

[07:20] Team_066 possession (Score: 64-69)
Cole Morant attempts a Layup. BLOCKED BY TIM SEXTON! Ball is loose! Rebound secured by Tim Sexton.

[07:09] Team_045 possession (Score: 64-69)
John Wagner attempts a 3Pt. Wide open! Pascal Carter is 6.8 feet away. [MAN] JOHN WAGNER MAKES IT! Assist: Julius James
Score: 64-72

[06:55] Team_066 possession (Score: 64-72)
Lauri LaVine attempts a 3Pt. Contested by Julius James (4.1 feet, MAN). Lauri LaVine misses. Rebound secured by Julius James.

[06:39] Team_045 possession (Score: 64-72)
John Wagner makes the Layup and draws the foul on Lauri LaVine! And-1! John Wagner to the line for 1. [Team fouls: 1] (Lauri LaVine: 1 personal fouls)   FT 1/1: GOOD John Wagner makes 1/1 from the line.
Score: 64-75

[06:30] Team_066 possession (Score: 64-75)
Cole Morant attempts a Layup. Contested by Tim Sexton (5.1 feet, MAN). Cole Morant misses. Rebound secured by Julius James.

[06:16] Team_045 possession (Score: 64-75)
Julius James attempts a 3Pt. Contested by Lauri LaVine (4.1 feet, MAN). Julius James misses. Rebound secured by Donovan Simmons.

[06:04] Team_066 possession (Score: 64-75)
Lauri LaVine makes the Layup and draws the foul on Stephen Paul! And-1! Lauri LaVine to the line for 1. [Team fouls: 2] (Stephen Paul: 1 personal fouls)   FT 1/1: GOOD Lauri LaVine makes 1/1 from the line.
Score: 67-75

[05:51] Team_045 possession (Score: 67-75)
Gary Towns attempts a Layup. BLOCKED BY BRANDON MIDDLETON! Ball is loose! Offensive rebound by Tim Sexton! Tim Sexton kicks it out.

[05:34] Team_045 possession (Score: 67-75)
Julius James attempts a 3Pt. Contested by Lauri LaVine (4.1 feet, ZONE). Julius James misses. Offensive rebound by Julius James! Julius James kicks it out.

[05:23] Team_045 possession (Score: 67-75)
Tim Sexton attempts a Dunk. BLOCKED BY COLE MORANT! Ball goes out off Cole Morant. Tim Sexton's ball!

[05:05] Team_045 possession (Score: 67-75)
Julius James attempts a 3Pt. Contested by Lauri LaVine (4.1 feet, MAN). JULIUS JAMES MAKES IT! Assist: Stephen Paul
Score: 67-78

[04:50] Team_066 possession (Score: 67-78)
Cole Morant attempts a 3Pt. Contested by Tim Sexton (5.1 feet, MAN). COLE MORANT MAKES IT! Assist: Lauri LaVine
Score: 70-78

[04:31] Team_045 possession (Score: 70-78)
Tim Sexton attempts a 3Pt. Contested by Cole Morant (5.9 feet, MAN). Tim Sexton misses. Rebound secured by Donovan Simmons.

[04:19] Team_066 possession (Score: 70-78)
Cole Morant attempts a Midrange. Contested by Julius James (4.5 feet, ZONE). Cole Morant misses. Rebound secured by Tim Sexton.

[04:01] Team_045 possession (Score: 70-78)
Gary Towns makes the Layup and draws the foul on Brandon Middleton! And-1! Gary Towns to the line for 1. [Team fouls: 2] (Brandon Middleton: 1 personal fouls)   FT 1/1: GOOD Gary Towns makes 1/1 from the line.
Score: 70-81

[03:44] Team_066 possession (Score: 70-81)
Pascal Carter attempts a 3Pt. Contested by Gary Towns (5.2 feet, ZONE). Pascal Carter misses. Rebound secured by Julius James.

[03:31] Team_045 possession (Score: 70-81)
Stephen Paul attempts a Midrange. Contested by Cole Morant (5.4 feet, ZONE). Stephen Paul misses. Rebound secured by Lauri LaVine.

[03:13] Team_066 possession (Score: 70-81)
Lauri LaVine makes the Midrange and draws the foul on Julius James! And-1! Lauri LaVine to the line for 1. [Team fouls: 3] (Julius James: 1 personal fouls)   FT 1/1: GOOD Lauri LaVine makes 1/1 from the line.
Score: 73-81

[02:59] Team_045 possession (Score: 73-81)
Tim Sexton drives and kicks out. John Wagner attempts a 3Pt. Contested by Lauri LaVine (3.9 feet, ZONE). JOHN WAGNER MAKES IT! Assist: Tim Sexton
Score: 73-84

[02:41] Team_066 possession (Score: 73-84)
Lauri LaVine attempts a 3Pt. Contested by Julius James (4.1 feet, ZONE). Lauri LaVine misses. Rebound secured by Stephen Paul.

[02:23] Team_045 possession (Score: 73-84)
Julius James attempts a 3Pt. Contested by Lauri LaVine (4.1 feet, MAN). Julius James misses. Rebound secured by Lauri LaVine.

[02:05] Team_066 possession (Score: 73-84)
Cole Morant attempts a Midrange. Contested by Gary Towns (5.6 feet, ZONE). Cole Morant misses. Rebound secured by Tim Sexton.

[01:50] Team_045 possession (Score: 73-84)
Gary Towns attempts a Layup. BLOCKED BY LAURI LAVINE! Ball is loose! Rebound secured by Brandon Middleton.

[01:35] Team_066 possession (Score: 73-84)
Pascal Carter attempts a 3Pt. Contested by John Wagner (4.3 feet, MAN). Pascal Carter misses. Rebound secured by Tim Sexton.

[01:23] Team_045 possession (Score: 73-84)
Stephen Paul drives to the basket... Stephen Paul throws a bad pass out of bounds! TURNOVER! (dead ball)

[01:12] Team_066 possession (Score: 73-84)
Brandon Middleton makes the Layup and draws the foul on Julius James! And-1! Brandon Middleton to the line for 1. [Team fouls: 4] (Julius James: 2 personal fouls)   FT 1/1: GOOD Brandon Middleton makes 1/1 from the line.
Score: 76-84

[01:02] Team_045 possession (Score: 76-84)
Tim Sexton attempts a Midrange. Contested by Cole Morant (6.0 feet, MAN). Tim Sexton misses. Rebound secured by Lauri LaVine.

[00:49] Team_066 possession (Score: 76-84)
Cole Morant makes the Midrange and draws the foul on John Wagner! And-1! Cole Morant to the line for 1. [BONUS: 5 team fouls] (John Wagner: 1 personal fouls)   FT 1/1: MISS Cole Morant makes 0/1 from the line. Rebound secured by Stephen Paul.
Score: 78-84

[00:37] Team_045 possession (Score: 78-84)
Stephen Paul attempts a 3Pt. Contested by Lauri LaVine (3.9 feet, ZONE). Stephen Paul misses. Rebound secured by Brandon Middleton.

[00:22] Team_066 possession (Score: 78-84)
Brandon Middleton attempts a 3Pt. Contested by Gary Towns (4.9 feet, MAN). Brandon Middleton misses. Rebound secured by Stephen Paul.

[00:06] Team_045 possession (Score: 78-84)
Tim Sexton makes the Layup and draws the foul on Donovan Simmons! And-1! Tim Sexton to the line for 1. [Team fouls: 3] (Donovan Simmons: 1 personal fouls)   FT 1/1: GOOD Tim Sexton makes 1/1 from the line.
Score: 78-87

================================================================================
                              4TH QUARTER COMPLETE                              
================================================================================

4TH QUARTER SCORE: Team_066 20, Team_045 22

BOX SCORE:
================================================================================

Team_066
--------------------------------------------------------------------------------
Player                MIN  PTS  REB  AST  TO      FG   FG%      3P   3P%
--------------------------------------------------------------------------------
Lauri LaVine           11    6    4    2   0   2/4    50.0     0/0   0.0
Cole Morant            11    5    0    0   0   2/7    28.6     0/0   0.0
Brandon Middleton      11    3    2    0   0   1/2    50.0     0/0   0.0
Pau Curry              37    2    0    1   0   1/3    33.3     0/0   0.0
Brandon Reaves         37    2    2    0   0   1/1   100.0     0/0   0.0
Kyle Wagner            37    0    1    0   0   0/0     0.0     0/0   0.0
Jimmy Davis            37    0    0    0   0   0/1     0.0     0/0   0.0
Yao Brogdon            37    0    1    0   0   0/0     0.0     0/0   0.0
Donovan Simmons        11    0    3    0   0   0/1     0.0     0/0   0.0
Pascal Carter          11    0    0    0   0   0/2     0.0     0/0   0.0

TEAM: FG: 7/21 (33.3%), 3PT: 1/6 (16.7%), REB: 13 (1 off, 12 def), AST: 3, TO: 1
TEAM FOULS: 3


Team_045
--------------------------------------------------------------------------------
Player                MIN  PTS  REB  AST  TO      FG   FG%      3P   3P%
--------------------------------------------------------------------------------
John Wagner            11    9    0    0   0   3/5    60.0     0/0   0.0
Rudy Antetokounmpo     38    4    0    0   0   2/4    50.0     0/0   0.0
Tim Sexton             11    3    5    1   0   1/3    33.3     0/0   0.0
Julius James           11    3    4    1   0   1/3    33.3     0/0   0.0
Gary Towns             11    3    0    0   0   1/2    50.0     0/0   0.0
Cole Simons            37    0    2    0   0   0/1     0.0     0/0   0.0
DeMar Turner           38    0    0    1   0   0/0     0.0     0/0   0.0
Zion Butler            34    0    2    0   0   0/0     0.0     0/0   0.0
Stephen Paul           15    0    4    1   0   0/2     0.0     0/0   0.0

TEAM: FG: 8/20 (40.0%), 3PT: 2/10 (20.0%), REB: 17 (3 off, 14 def), AST: 4, TO: 2
TEAM FOULS: 5 [Team_066 in BONUS]

================================================================================

================================================================================
                               FULL GAME COMPLETE                               
================================================================================

FINAL SCORE: Team_066 78, Team_045 87

SCORING BY QUARTER:
--------------------------------------------------------------------------------
Team                     Q1     Q2     Q3     Q4    FINAL
--------------------------------------------------------------------------------
Team_066                 20     20     18     20       78
Team_045                 20     21     24     22       87
--------------------------------------------------------------------------------

FULL GAME BOX SCORE:
================================================================================

Team_066
--------------------------------------------------------------------------------
Player                MIN  PTS  REB  AST  TO      FG   FG%      3P   3P%      FT STL BLK
--------------------------------------------------------------------------------
Jimmy Davis            37    5    0    1   2   3/9    33.3   1/2    50.0   2/3     0   1
Pau Curry              37   10    0    4   2   2/10   20.0   1/4    25.0   3/3     0   0
Brandon Reaves         37   12    5    0   2   7/13   53.8   2/6    33.3   1/2     0   0
Yao Brogdon            37   12   17    4   3   4/15   26.7   0/7     0.0   8/8     1   0
Kyle Wagner            37   16   17    0   0   8/12   66.7   1/2    50.0   3/3     2   1
Pascal Carter          11    0    0    0   0   0/2     0.0   0/2     0.0   0/0     0   0
Lauri LaVine           11    9    4    2   0   3/6    50.0   0/2     0.0   3/3     0   1
Brandon Middleton      11    3    3    0   0   1/2    50.0   0/1     0.0   1/1     1   1
Cole Morant            11    5    0    1   0   2/8    25.0   1/1   100.0   0/1     0   1
Donovan Simmons        11    2    4    0   0   1/2    50.0   0/0     0.0   0/0     0   0

TEAM: FG: 32/80 (40.0%), 3PT: 6/27 (22.2%), REB: 47 (10 off, 37 def), AST: 12, TO: 9


Team_045
--------------------------------------------------------------------------------
Player                MIN  PTS  REB  AST  TO      FG   FG%      3P   3P%      FT STL BLK
--------------------------------------------------------------------------------
Rudy Antetokounmpo     38    8    0    0   1   5/16   31.2   1/5    20.0   1/4     0   0
DeMar Turner           38   12    9    3   3   4/10   40.0   1/3    33.3   4/5     0   0
Trae Russell           37    5    0    3   3   3/10   30.0   1/4    25.0   0/0     0   0
Cole Simons            37   25   14    1   0   9/15   60.0   3/7    42.9  10/13    0   1
Zion Butler            34   13   14    0   1   5/6    83.3   1/1   100.0   2/3     0   2
Stephen Paul           15    2    7    2   0   1/4    25.0   0/1     0.0   2/2     0   0
Julius James           11    3    5    1   1   1/3    33.3   1/3    33.3   0/0     0   0
Gary Towns             11    3    0    0   2   1/2    50.0   0/0     0.0   1/1     0   0
John Wagner            11    9    0    0   0   3/5    60.0   2/4    50.0   1/1     0   0
Tim Sexton             11    5    6    1   0   2/4    50.0   0/1     0.0   3/3     0   1

TEAM: FG: 36/77 (46.8%), 3PT: 10/29 (34.5%), REB: 58 (11 off, 47 def), AST: 11, TO: 11

================================================================================
