================================================================================
                        FULL GAME - Team_057 vs Team_016                        
================================================================================

================================================================================
                       1ST QUARTER - Team_057 vs Team_016                       
================================================================================

[12:00] Team_057 possession (Score: 0-0)
Klay Rozier attempts a Layup. BLOCKED BY COLLIN BARNES! Ball is loose! Rebound secured by Ben Barrett.

[11:44] Team_016 possession (Score: 0-0)
Ben Barrett attempts a Midrange. Contested by Ben Adebayo (5.0 feet, MAN). BEN BARRETT MAKES IT!
Score: 0-2

[11:33] Team_057 possession (Score: 0-2)
Anfernee Adebayo attempts a 3Pt. Contested by Vince Quickley (4.7 feet, MAN). ANFERNEE ADEBAYO MAKES IT! Assist: Kobe Ming
Score: 3-2

[11:23] Team_016 possession (Score: 3-2)
Collin Barnes attempts a 3Pt. Contested by Kobe Ming (4.5 feet, ZONE). COLLIN BARNES MAKES IT! Assist: Vince Duncan
Score: 3-5

[11:10] Team_057 possession (Score: 3-5)
Kobe Ming attempts a Layup. Contested by Vince Duncan (3.5 feet, ZONE). Kobe Ming misses. Rebound secured by Ben Barrett.

[11:00] Team_016 possession (Score: 3-5)
Vince Quickley attempts a 3Pt. Contested by Anfernee Adebayo (4.4 feet, MAN). Vince Quickley misses. Rebound secured by Ben Adebayo.

[10:46] Team_057 possession (Score: 3-5)
FOUL! Shooting foul on Vince Duncan. Miles Middleton to the line for 2 free throws. [Team fouls: 1] (Vince Duncan: 1 personal fouls)   FT 1/2: GOOD   FT 2/2: GOOD Miles Middleton makes 2/2 from the line.
Score: 5-5

[10:37] Team_016 possession (Score: 5-5)
Collin Barnes attempts a 3Pt. Contested by Kobe Ming (4.5 feet, ZONE). COLLIN BARNES MAKES IT! Assist: Vince Quickley
Score: 5-8

[10:23] Team_057 possession (Score: 5-8)
Anfernee Adebayo attempts a 3Pt. Contested by Ben Barrett (4.1 feet, ZONE). Anfernee Adebayo misses. Offensive rebound by Ben Adebayo! Ben Adebayo kicks it out.

[10:08] Team_057 possession (Score: 5-8)
Kobe Ming makes the Midrange and draws the foul on Vince Quickley! And-1! Kobe Ming to the line for 1. [Team fouls: 2] (Vince Quickley: 1 personal fouls)   FT 1/1: MISS Kobe Ming makes 0/1 from the line. Rebound secured by Ben Barrett.
Score: 7-8

[09:53] Team_016 possession (Score: 7-8)
Giannis Ginobili attempts a 3Pt. Contested by Klay Rozier (3.7 feet, MAN). Giannis Ginobili misses. Rebound secured by Miles Middleton.

[09:36] Team_057 possession (Score: 7-8)
FOUL! Shooting foul on Vince Duncan. Klay Rozier to the line for 2 free throws. [Team fouls: 3] (Vince Duncan: 2 personal fouls)   FT 1/2: GOOD   FT 2/2: GOOD Klay Rozier makes 2/2 from the line.
Score: 9-8

[09:24] Team_016 possession (Score: 9-8)
Vince Quickley attempts a Midrange. Contested by Klay Rozier (3.2 feet, ZONE). VINCE QUICKLEY MAKES IT! Assist: Ben Barrett
Score: 9-10

[09:09] Team_057 possession (Score: 9-10)
Anfernee Adebayo attempts a 3Pt. Contested by Collin Barnes (4.5 feet, ZONE). Anfernee Adebayo misses. Rebound secured by Vince Duncan.

[08:55] Team_016 possession (Score: 9-10)
Collin Barnes drives, Ben Adebayo stays with him. Collin Barnes attempts a Layup. Contested by Ben Adebayo (4.5 feet, ZONE). COLLIN BARNES MAKES IT! Assist: Giannis Ginobili
Score: 9-12

[08:39] Team_057 possession (Score: 9-12)
Ben Adebayo drives, Ben Barrett stays with him. Ben Adebayo attempts a Layup. Contested by Ben Barrett (4.2 feet, ZONE). BEN ADEBAYO MAKES IT! Assist: Anfernee Adebayo
Score: 11-12

[08:22] Team_016 possession (Score: 11-12)
Vince Quickley attempts a 3Pt. Contested by Anfernee Adebayo (4.4 feet, MAN). Vince Quickley misses. Rebound secured by Anfernee Adebayo.

[08:07] Team_057 possession (Score: 11-12)
Ben Adebayo attempts a Midrange. Contested by Ben Barrett (4.2 feet, ZONE). BEN ADEBAYO MAKES IT!
Score: 13-12

[07:54] Team_016 possession (Score: 13-12)
Giannis Ginobili attempts a 3Pt. Contested by Klay Rozier (3.7 feet, MAN). GIANNIS GINOBILI MAKES IT! Assist: Vince Duncan
Score: 13-15

[07:38] Team_057 possession (Score: 13-15)
Anfernee Adebayo attempts a 3Pt. Wide open! Giannis Ginobili is 6.1 feet away. [ZONE] Anfernee Adebayo misses. Rebound secured by Vince Duncan.

[07:26] Team_016 possession (Score: 13-15)
Ben Barrett attempts a 3Pt. Contested by Kobe Ming (5.0 feet, ZONE). BEN BARRETT MAKES IT! Assist: Giannis Ginobili
Score: 13-18

[07:11] Team_057 possession (Score: 13-18)
FOUL! Shooting foul on Vince Duncan. Klay Rozier to the line for 2 free throws. [Team fouls: 4] (Vince Duncan: 3 personal fouls)   FT 1/2: MISS   FT 2/2: GOOD Klay Rozier makes 1/2 from the line.
Score: 14-18

[06:55] Team_016 possession (Score: 14-18)
Collin Barnes attempts a 3Pt. Contested by Kobe Ming (4.5 feet, MAN). Collin Barnes misses. Rebound secured by Anfernee Adebayo.

[06:39] Team_057 possession (Score: 14-18)
Kobe Ming attempts a 3Pt. Contested by Collin Barnes (4.3 feet, ZONE). Kobe Ming misses. Rebound secured by Ben Barrett.

[06:26] Team_016 possession (Score: 14-18)
Collin Barnes drives, picks up Ben Adebayo. Help arrives from Klay Rozier! Collin Barnes attempts a Layup. Contested by Klay Rozier (4.5 feet, ZONE). COLLIN BARNES MAKES IT! Assist: Vince Duncan
Score: 14-20

[06:08] Team_057 possession (Score: 14-20)
Kobe Ming attempts a 3Pt. Contested by Collin Barnes (4.3 feet, ZONE). Kobe Ming misses. Offensive rebound by Ben Adebayo! Ben Adebayo kicks it out.

[05:49] Team_057 possession (Score: 14-20)
Anfernee Adebayo drives, picks up Vince Quickley. Help arrives from Collin Barnes! Anfernee Adebayo attempts a Layup. Contested by Collin Barnes (4.7 feet, MAN). ANFERNEE ADEBAYO MAKES IT!
Score: 16-20

[05:39] Team_016 possession (Score: 16-20)
Ben Barrett attempts a Layup. Contested by Ben Adebayo (5.0 feet, ZONE). BEN BARRETT MAKES IT! Assist: Collin Barnes
Score: 16-22

[05:26] Team_057 possession (Score: 16-22)
Anfernee Adebayo drives, Vince Duncan stays with him. Anfernee Adebayo attempts a Layup. Contested by Vince Duncan (3.7 feet, ZONE). ANFERNEE ADEBAYO MAKES IT! Assist: Miles Middleton
Score: 18-22

[05:12] Team_016 possession (Score: 18-22)
Vince Duncan attempts a Layup. Contested by Miles Middleton (4.8 feet, MAN). Vince Duncan misses. Offensive rebound by Vince Duncan! Vince Duncan's putback is no good. Rebound secured by Ben Adebayo.

[04:56] Team_057 possession (Score: 18-22)
FOUL! Reach-in foul on Vince Duncan during the drive. [IN THE BONUS! 5 team fouls] Klay Rozier to the line for 2 free throws. (Vince Duncan: 4 personal fouls)   FT 1/2: GOOD   FT 2/2: GOOD Klay Rozier makes 2/2 from the line.
Score: 20-22

[04:39] Team_016 possession (Score: 20-22)
Giannis Ginobili throws a bad pass out of bounds! TURNOVER! (dead ball)

[04:23] Team_057 possession (Score: 20-22)
Kobe Ming drives and kicks out. Miles Middleton attempts a 3Pt. Contested by Collin Barnes (4.1 feet, ZONE). Miles Middleton misses. Rebound secured by Vince Duncan.

[04:08] Team_016 possession (Score: 20-22)
Ben Barrett attempts a Layup. Contested by Ben Adebayo (5.1 feet, ZONE). BEN BARRETT MAKES IT!
Score: 20-24

[03:52] Team_057 possession (Score: 20-24)
Klay Rozier attempts a 3Pt. Contested by Giannis Ginobili (5.8 feet, MAN). Klay Rozier misses. Rebound secured by Vince Quickley.

[03:40] Team_016 possession (Score: 20-24)
Vince Duncan makes the Layup and draws the foul on Miles Middleton! And-1! Vince Duncan to the line for 1. [Team fouls: 1] (Miles Middleton: 1 personal fouls)   FT 1/1: GOOD Vince Duncan makes 1/1 from the line.
Score: 20-27

[03:21] Team_057 possession (Score: 20-27)
Anfernee Adebayo attempts a 3Pt. Contested by Vince Quickley (4.8 feet, ZONE). Anfernee Adebayo misses. Rebound secured by Vince Duncan.

[03:06] Team_016 possession (Score: 20-27)
Giannis Ginobili commits a violation (traveling/carry)! TURNOVER! (dead ball)

[02:49] Team_057 possession (Score: 20-27)
Kobe Ming attempts a Midrange. Contested by Collin Barnes (4.6 feet, MAN). KOBE MING MAKES IT! Assist: Klay Rozier
Score: 22-27

[02:33] Team_016 possession (Score: 22-27)
FOUL! Shooting foul on Ben Adebayo. Collin Barnes to the line for 2 free throws. [Team fouls: 2] (Ben Adebayo: 1 personal fouls)   FT 1/2: GOOD   FT 2/2: MISS Collin Barnes makes 1/2 from the line. Rebound secured by Ben Adebayo.
Score: 22-28

[02:17] Team_057 possession (Score: 22-28)
Anfernee Adebayo attempts a 3Pt. Contested by Vince Quickley (4.8 feet, MAN). Anfernee Adebayo misses. Rebound secured by Ben Barrett.

[02:03] Team_016 possession (Score: 22-28)
Vince Quickley attempts a 3Pt. Contested by Anfernee Adebayo (4.7 feet, MAN). Vince Quickley misses. Rebound secured by Ben Adebayo.

[01:48] Team_057 possession (Score: 22-28)
Anfernee Adebayo attempts a 3Pt. Contested by Collin Barnes (4.8 feet, ZONE). Anfernee Adebayo misses. Rebound secured by Vince Duncan.

[01:30] Team_016 possession (Score: 22-28)
Giannis Ginobili attempts a Midrange. Contested by Klay Rozier (4.1 feet, MAN). Giannis Ginobili misses. Rebound secured by Miles Middleton.

[01:17] Team_057 possession (Score: 22-28)
Ben Adebayo drives, Vince Duncan stays with him. Ben Adebayo attempts a Dunk. Contested by Vince Duncan (4.1 feet, ZONE). Ben Adebayo misses. Offensive rebound by Ben Adebayo! Ben Adebayo kicks it out.

[01:06] Team_057 possession (Score: 22-28)
Anfernee Adebayo attempts a 3Pt. Contested by Vince Quickley (4.9 feet, MAN). ANFERNEE ADEBAYO MAKES IT! Assist: Miles Middleton
Score: 25-28

[00:54] Team_016 possession (Score: 25-28)
Ben Barrett attempts a Layup. Contested by Ben Adebayo (5.4 feet, MAN). Ben Barrett misses. Rebound secured by Miles Middleton.

[00:42] Team_057 possession (Score: 25-28)
Miles Middleton drives to the basket... FOUL! Offensive foul on Miles Middleton! Vince Duncan drew the charge! [Team fouls: 3] (Miles Middleton: 2 personal fouls) TURNOVER! (dead ball)

[00:27] Team_016 possession (Score: 25-28)
Vince Quickley attempts a 3Pt. Contested by Klay Rozier (3.7 feet, ZONE). Vince Quickley misses. Offensive rebound by Ben Barrett! Ben Barrett puts it back in!
Score: 25-30

[00:11] Team_057 possession (Score: 25-30)
FOUL! Shooting foul on Collin Barnes. Anfernee Adebayo to the line for 3 free throws. [BONUS: 6 team fouls] (Collin Barnes: 1 personal fouls)   FT 1/3: GOOD   FT 2/3: GOOD   FT 3/3: GOOD Anfernee Adebayo makes 3/3 from the line.
Score: 28-30

================================================================================
                              1ST QUARTER COMPLETE                              
================================================================================

1ST QUARTER SCORE: Team_057 28, Team_016 30

BOX SCORE:
================================================================================

Team_057
--------------------------------------------------------------------------------
Player                MIN  PTS  REB  AST  TO      FG   FG%      3P   3P%
--------------------------------------------------------------------------------
Anfernee Adebayo       12   13    2    1   0   5/10   50.0     0/0   0.0
Klay Rozier            12    5    0    1   0   3/5    60.0     0/0   0.0
Ben Adebayo            12    4    7    0   0   2/2   100.0     0/0   0.0
Kobe Ming              12    2    0    1   0   1/5    20.0     0/0   0.0
Miles Middleton        12    2    3    2   0   1/1   100.0     0/0   0.0

TEAM: FG: 12/23 (52.2%), 3PT: 3/10 (30.0%), REB: 11 (3 off, 8 def), AST: 5, TO: 1
TEAM FOULS: 3


Team_016
--------------------------------------------------------------------------------
Player                MIN  PTS  REB  AST  TO      FG   FG%      3P   3P%
--------------------------------------------------------------------------------
Ben Barrett            12   11    6    1   0   5/6    83.3     0/0   0.0
Collin Barnes          12   10    0    1   0   4/6    66.7     0/0   0.0
Vince Duncan           12    3    5    3   0   1/2    50.0     0/0   0.0
Giannis Ginobili       12    3    0    2   0   1/3    33.3     0/0   0.0
Vince Quickley         12    2    1    1   0   1/4    25.0     0/0   0.0

TEAM: FG: 12/21 (57.1%), 3PT: 5/10 (50.0%), REB: 13 (2 off, 11 def), AST: 8, TO: 2
TEAM FOULS: 6 [Team_057 in BONUS]

================================================================================

================================================================================
                       2ND QUARTER - Team_057 vs Team_016                       
================================================================================

[12:00] Team_057 possession (Score: 28-30)
Klay Rozier attempts a 3Pt. Contested by Giannis Ginobili (5.9 feet, MAN). KLAY ROZIER MAKES IT! Assist: Anfernee Adebayo
Score: 31-30

[11:49] Team_016 possession (Score: 31-30)
Ben Barrett attempts a 3Pt. Contested by Ben Adebayo (5.3 feet, MAN). BEN BARRETT MAKES IT! Assist: Giannis Ginobili
Score: 31-33

[11:35] Team_057 possession (Score: 31-33)
Anfernee Adebayo drives and kicks out. Miles Middleton attempts a 3Pt. Contested by Vince Duncan (3.6 feet, MAN). Miles Middleton misses. Rebound secured by Ben Barrett.

[11:21] Team_016 possession (Score: 31-33)
Vince Duncan attempts a Midrange. Contested by Ben Adebayo (5.2 feet, ZONE). Vince Duncan misses. Rebound secured by Anfernee Adebayo.

[11:04] Team_057 possession (Score: 31-33)
Klay Rozier drives and kicks out. Anfernee Adebayo attempts a 3Pt. Contested by Collin Barnes (4.5 feet, ZONE). Anfernee Adebayo misses. Rebound secured by Ben Barrett.

[10:49] Team_016 possession (Score: 31-33)
FOUL! Shooting foul on Kobe Ming. Collin Barnes to the line for 2 free throws. [Team fouls: 1] (Kobe Ming: 1 personal fouls)   FT 1/2: GOOD   FT 2/2: GOOD Collin Barnes makes 2/2 from the line.
Score: 31-35

[10:31] Team_057 possession (Score: 31-35)
Kobe Ming attempts a 3Pt. Contested by Collin Barnes (4.8 feet, MAN). Kobe Ming misses. Rebound secured by Vince Duncan.

[10:15] Team_016 possession (Score: 31-35)
FOUL! Holding foul on Anfernee Adebayo. [Team fouls: 2] No free throws, side out. (Anfernee Adebayo: 1 personal fouls)

[09:58] Team_016 possession (Score: 31-35)
Vince Quickley attempts a Midrange. Contested by Anfernee Adebayo (4.9 feet, MAN). Vince Quickley misses. Offensive rebound by Vince Duncan! Vince Duncan kicks it out.

[09:42] Team_016 possession (Score: 31-35)
Vince Quickley attempts a Layup. Contested by Ben Adebayo (4.6 feet, ZONE). Vince Quickley misses. Rebound secured by Miles Middleton.

[09:23] Team_057 possession (Score: 31-35)
Anfernee Adebayo attempts a Layup. Contested by Vince Quickley (5.0 feet, MAN). Anfernee Adebayo misses. Offensive rebound by Miles Middleton! Miles Middleton kicks it out.

[09:07] Team_057 possession (Score: 31-35)
Anfernee Adebayo attempts a 3Pt. Contested by Collin Barnes (5.1 feet, ZONE). Anfernee Adebayo misses. Rebound secured by Vince Duncan.

[08:56] Team_016 possession (Score: 31-35)
Vince Quickley attempts a 3Pt. Contested by Kobe Ming (4.6 feet, ZONE). Vince Quickley misses. Rebound secured by Miles Middleton.

[08:39] Team_057 possession (Score: 31-35)
Anfernee Adebayo attempts a Layup. BLOCKED BY VINCE QUICKLEY! Ball is loose! Rebound secured by Vince Duncan.

[08:28] Team_016 possession (Score: 31-35)
Collin Barnes attempts a 3Pt. Contested by Kobe Ming (5.1 feet, ZONE). Collin Barnes misses. Rebound secured by Ben Adebayo.

[08:09] Team_057 possession (Score: 31-35)
Ben Adebayo attempts a Midrange. Contested by Vince Quickley (5.2 feet, ZONE). Ben Adebayo misses. Rebound secured by Ben Barrett.

[07:55] Team_016 possession (Score: 31-35)
Ben Barrett attempts a Layup. Contested by Ben Adebayo (5.7 feet, MAN). BEN BARRETT MAKES IT!
Score: 31-37

[07:43] Team_057 possession (Score: 31-37)
Klay Rozier attempts a 3Pt. Contested by Collin Barnes (5.1 feet, ZONE). Klay Rozier misses. Offensive rebound by Ben Adebayo! Ben Adebayo kicks it out.

[07:26] Team_057 possession (Score: 31-37)
Klay Rozier attempts a Midrange. Contested by Vince Duncan (4.3 feet, ZONE). Klay Rozier misses. Rebound secured by Vince Duncan.

[07:15] Team_016 possession (Score: 31-37)
Vince Duncan attempts a Layup. Contested by Ben Adebayo (5.6 feet, ZONE). VINCE DUNCAN MAKES IT! Assist: Vince Quickley
Score: 31-39

[06:56] Team_057 possession (Score: 31-39)
Ben Adebayo attempts a 3Pt. Contested by Vince Quickley (5.3 feet, ZONE). Ben Adebayo misses. Rebound secured by Vince Duncan.

[06:42] Team_016 possession (Score: 31-39)
Collin Barnes drives and kicks out. Collin Barnes makes the Midrange and draws the foul on Ben Adebayo! And-1! Collin Barnes to the line for 1. [Team fouls: 3] (Ben Adebayo: 1 personal fouls)   FT 1/1: MISS Collin Barnes makes 0/1 from the line. Rebound secured by Miles Middleton.
Score: 31-41

[06:26] Team_057 possession (Score: 31-41)
Kobe Ming attempts a 3Pt. Contested by Vince Quickley (5.2 feet, ZONE). Kobe Ming misses. Offensive rebound by Ben Adebayo! Ben Adebayo kicks it out.

[06:11] Team_057 possession (Score: 31-41)
FOUL! Holding foul on Collin Barnes. [Team fouls: 1] No free throws, side out. (Collin Barnes: 1 personal fouls)

[05:57] Team_057 possession (Score: 31-41)
FOUL! Shooting foul on Collin Barnes. Klay Rozier to the line for 3 free throws. [Team fouls: 2] (Collin Barnes: 2 personal fouls)   FT 1/3: GOOD   FT 2/3: GOOD   FT 3/3: MISS Klay Rozier makes 2/3 from the line. Rebound secured by Ben Barrett.
Score: 33-41

[05:42] Team_016 possession (Score: 33-41)
Collin Barnes loses the ball! Stripped by Kobe Ming! TURNOVER! (live ball)

[05:30] Team_057 possession (Score: 33-41)
Anfernee Adebayo throws a bad pass out of bounds! TURNOVER! (dead ball)

[05:30] Substitution (Team_057): Kobe Ming OUT → Scottie Johnson IN (stamina_rule2)

[05:30] Substitution (Team_057): Klay Rozier OUT → Bradley Ginobili IN (stamina_rule2)

[05:30] Substitution (Team_057): Anfernee Adebayo OUT → Joel Wade IN (stamina_rule2)

[05:30] Substitution (Team_057): Ben Adebayo OUT → Lamelo Irving IN (stamina_rule2)

[05:30] Substitution (Team_057): Miles Middleton OUT → Zion Lillard IN (stamina_rule2)

[05:30] Substitution (Team_016): Collin Barnes OUT → Lamelo Herro IN (stamina_rule2)

[05:30] Substitution (Team_016): Giannis Ginobili OUT → Immanuel Nowitzki IN (stamina_rule2)

[05:30] Substitution (Team_016): Vince Quickley OUT → Kevin Butler IN (stamina_rule2)

[05:30] Substitution (Team_016): Ben Barrett OUT → Giannis Doncic IN (stamina_rule2)

[05:30] Substitution (Team_016): Vince Duncan OUT → Trae Barnes IN (stamina_rule2)

[05:14] Team_016 possession (Score: 33-41)
Immanuel Nowitzki attempts a 3Pt. Contested by Bradley Ginobili (5.0 feet, MAN). IMMANUEL NOWITZKI MAKES IT! Assist: Lamelo Herro
Score: 33-44

[04:59] Team_057 possession (Score: 33-44)
Lamelo Irving drives and kicks out. Scottie Johnson attempts a 3Pt. Contested by Lamelo Herro (3.8 feet, MAN). SCOTTIE JOHNSON MAKES IT!
Score: 36-44

[04:42] Team_016 possession (Score: 36-44)
Lamelo Herro attempts a 3Pt. Contested by Scottie Johnson (4.8 feet, MAN). LAMELO HERRO MAKES IT! Assist: Kevin Butler
Score: 36-47

[04:23] Team_057 possession (Score: 36-47)
Joel Wade attempts a Midrange. Contested by Kevin Butler (4.3 feet, MAN). Joel Wade misses. FOUL! Loose ball foul on Giannis Doncic during the rebound battle. [Team fouls: 3] No free throws, side out. (Giannis Doncic: 1 personal fouls)

[04:12] Team_057 possession (Score: 36-47)
Scottie Johnson attempts a Layup. Contested by Giannis Doncic (4.0 feet, ZONE). SCOTTIE JOHNSON MAKES IT! Assist: Joel Wade
Score: 38-47

[03:56] Team_016 possession (Score: 38-47)
Lamelo Herro attempts a 3Pt. Contested by Scottie Johnson (4.8 feet, MAN). Lamelo Herro misses. Rebound secured by Zion Lillard.

[03:45] Team_057 possession (Score: 38-47)
Lamelo Irving attempts a 3Pt. Contested by Giannis Doncic (4.4 feet, MAN). Lamelo Irving misses. Rebound secured by Trae Barnes.

[03:30] Team_016 possession (Score: 38-47)
Immanuel Nowitzki attempts a 3Pt. Contested by Bradley Ginobili (5.0 feet, MAN). Immanuel Nowitzki misses. Rebound secured by Zion Lillard.

[03:11] Team_057 possession (Score: 38-47)
Joel Wade attempts a 3Pt. Contested by Immanuel Nowitzki (4.5 feet, ZONE). JOEL WADE MAKES IT! Assist: Bradley Ginobili
Score: 41-47

[02:57] Team_016 possession (Score: 41-47)
Lamelo Herro attempts a 3Pt. Contested by Scottie Johnson (4.8 feet, ZONE). LAMELO HERRO MAKES IT! Assist: Kevin Butler
Score: 41-50

[02:44] Team_057 possession (Score: 41-50)
Zion Lillard attempts a 3Pt. Contested by Trae Barnes (5.9 feet, MAN). Zion Lillard misses. Rebound secured by Giannis Doncic.

[02:35] Team_016 possession (Score: 41-50)
Lamelo Herro attempts a 3Pt. Contested by Scottie Johnson (4.8 feet, ZONE). Lamelo Herro misses. Rebound secured by Lamelo Irving.

[02:20] Team_057 possession (Score: 41-50)
Joel Wade attempts a 3Pt. Contested by Kevin Butler (4.3 feet, MAN). Joel Wade misses. Rebound secured by Lamelo Herro.

[02:05] Team_016 possession (Score: 41-50)
Immanuel Nowitzki loses the ball! Stripped by Bradley Ginobili! TURNOVER! (live ball)

[01:53] Team_057 possession (Score: 41-50)
Lamelo Irving drives and kicks out. Lamelo Irving attempts a 3Pt. Contested by Lamelo Herro (3.8 feet, ZONE). Lamelo Irving misses. Offensive rebound by Lamelo Irving! Lamelo Irving kicks it out.

[01:40] Team_057 possession (Score: 41-50)
Scottie Johnson attempts a Midrange. Contested by Lamelo Herro (4.0 feet, MAN). Scottie Johnson misses. Offensive rebound by Lamelo Irving! Lamelo Irving kicks it out.

[01:29] Team_057 possession (Score: 41-50)
Zion Lillard drives and kicks out. Scottie Johnson attempts a Midrange. Contested by Immanuel Nowitzki (4.6 feet, ZONE). SCOTTIE JOHNSON MAKES IT! Assist: Zion Lillard
Score: 43-50

[01:18] Team_016 possession (Score: 43-50)
Kevin Butler drives to the basket... Kevin Butler throws a bad pass! Stolen by Lamelo Irving! TURNOVER! (live ball)

[00:59] Team_057 possession (Score: 43-50)
Zion Lillard attempts a 3Pt. Contested by Trae Barnes (5.9 feet, MAN). Zion Lillard misses. Rebound secured by Giannis Doncic.

[00:44] Team_016 possession (Score: 43-50)
Kevin Butler drives, picks up Lamelo Irving. Help arrives from Bradley Ginobili! Kevin Butler attempts a Layup. Contested by Bradley Ginobili (4.5 feet, ZONE). Kevin Butler misses. Rebound secured by Zion Lillard.

[00:31] Team_057 possession (Score: 43-50)
Zion Lillard attempts a 3Pt. Contested by Trae Barnes (5.9 feet, MAN). ZION LILLARD MAKES IT! Assist: Scottie Johnson
Score: 46-50

[00:20] Team_016 possession (Score: 46-50)
FOUL! Shooting foul on Lamelo Irving. Trae Barnes to the line for 2 free throws. [Team fouls: 4] (Lamelo Irving: 1 personal fouls)   FT 1/2: GOOD   FT 2/2: GOOD Trae Barnes makes 2/2 from the line.
Score: 46-52

[00:01] Team_057 possession (Score: 46-52)
Scottie Johnson attempts a 3Pt. Contested by Lamelo Herro (4.0 feet, ZONE). Scottie Johnson misses. Rebound secured by Trae Barnes.

================================================================================
                              2ND QUARTER COMPLETE                              
================================================================================

2ND QUARTER SCORE: Team_057 18, Team_016 22

BOX SCORE:
================================================================================

Team_057
--------------------------------------------------------------------------------
Player                MIN  PTS  REB  AST  TO      FG   FG%      3P   3P%
--------------------------------------------------------------------------------
Scottie Johnson         5    7    0    1   0   3/4    75.0     0/0   0.0
Klay Rozier            19    3    0    0   0   1/4    25.0     0/0   0.0
Zion Lillard            5    3    4    1   0   1/3    33.3     0/0   0.0
Joel Wade               5    3    0    1   0   1/2    50.0     0/0   0.0
Anfernee Adebayo       19    0    1    1   0   0/3     0.0     0/0   0.0
Kobe Ming              19    0    0    0   0   0/1     0.0     0/0   0.0
Miles Middleton        19    0    4    0   0   0/0     0.0     0/0   0.0
Ben Adebayo            19    0    3    0   0   0/2     0.0     0/0   0.0
Lamelo Irving           5    0    3    0   0   0/1     0.0     0/0   0.0
Bradley Ginobili        5    0    0    1   0   0/0     0.0     0/0   0.0

TEAM: FG: 6/20 (30.0%), 3PT: 3/12 (25.0%), REB: 15 (6 off, 9 def), AST: 5, TO: 1
TEAM FOULS: 4


Team_016
--------------------------------------------------------------------------------
Player                MIN  PTS  REB  AST  TO      FG   FG%      3P   3P%
--------------------------------------------------------------------------------
Lamelo Herro            5    6    1    1   0   2/4    50.0     0/0   0.0
Ben Barrett            19    5    4    0   0   2/2   100.0     0/0   0.0
Immanuel Nowitzki       5    3    0    0   0   1/2    50.0     0/0   0.0
Vince Duncan           19    2    6    0   0   1/2    50.0     0/0   0.0
Collin Barnes          19    2    0    0   0   1/3    33.3     0/0   0.0
Trae Barnes             5    2    2    0   0   1/1   100.0     0/0   0.0
Giannis Ginobili       19    0    0    1   0   0/0     0.0     0/0   0.0
Vince Quickley         19    0    0    1   0   0/2     0.0     0/0   0.0
Kevin Butler            5    0    0    2   0   0/1     0.0     0/0   0.0
Giannis Doncic          5    0    2    0   0   0/0     0.0     0/0   0.0

TEAM: FG: 8/17 (47.1%), 3PT: 4/9 (44.4%), REB: 15 (1 off, 14 def), AST: 5, TO: 3
TEAM FOULS: 3

================================================================================

================================================================================
                       3RD QUARTER - Team_057 vs Team_016                       
================================================================================

[12:00] Team_057 possession (Score: 46-52)
Miles Middleton attempts a 3Pt. Contested by Collin Barnes (3.9 feet, ZONE). MILES MIDDLETON MAKES IT! Assist: Klay Rozier
Score: 49-52

[11:42] Team_016 possession (Score: 49-52)
Ben Barrett makes the 3Pt and draws the foul on Ben Adebayo! And-1! Ben Barrett to the line for 1. [Team fouls: 1] (Ben Adebayo: 1 personal fouls)   FT 1/1: GOOD Ben Barrett makes 1/1 from the line.
Score: 49-56

[11:26] Team_057 possession (Score: 49-56)
FOUL! Shooting foul on Vince Duncan. Klay Rozier to the line for 2 free throws. [Team fouls: 1] (Vince Duncan: 1 personal fouls)   FT 1/2: MISS   FT 2/2: GOOD Klay Rozier makes 1/2 from the line.
Score: 50-56

[11:11] Team_016 possession (Score: 50-56)
Collin Barnes makes the Midrange and draws the foul on Anfernee Adebayo! And-1! Collin Barnes to the line for 1. [Team fouls: 2] (Anfernee Adebayo: 1 personal fouls)   FT 1/1: GOOD Collin Barnes makes 1/1 from the line.
Score: 50-59

[10:54] Team_057 possession (Score: 50-59)
Ben Adebayo attempts a Midrange. Contested by Ben Barrett (4.2 feet, ZONE). BEN ADEBAYO MAKES IT! Assist: Anfernee Adebayo
Score: 52-59

[10:37] Team_016 possession (Score: 52-59)
Giannis Ginobili loses the ball! Stripped by Klay Rozier! TURNOVER! (live ball)

[10:19] Team_057 possession (Score: 52-59)
Miles Middleton drives, Vince Duncan stays with him. Miles Middleton attempts a Dunk. Contested by Vince Duncan (3.1 feet, MAN). MILES MIDDLETON MAKES IT!
Score: 54-59

[10:04] Team_016 possession (Score: 54-59)
FOUL! Offensive foul on Vince Duncan! Miles Middleton drew the charge! [Team fouls: 2] (Vince Duncan: 2 personal fouls) TURNOVER! (dead ball)

[09:46] Team_057 possession (Score: 54-59)
Miles Middleton attempts a Midrange. Contested by Vince Duncan (3.1 feet, MAN). MILES MIDDLETON MAKES IT!
Score: 56-59

[09:29] Team_016 possession (Score: 56-59)
Ben Barrett drives and kicks out. Vince Quickley attempts a 3Pt. Contested by Anfernee Adebayo (4.8 feet, MAN). Vince Quickley misses. Rebound secured by Miles Middleton.

[09:14] Team_057 possession (Score: 56-59)
Miles Middleton attempts a Layup. BLOCKED BY COLLIN BARNES! Ball is loose! Offensive rebound by Miles Middleton! Miles Middleton kicks it out.

[09:01] Team_057 possession (Score: 56-59)
Anfernee Adebayo attempts a 3Pt. Contested by Vince Quickley (4.7 feet, MAN). Anfernee Adebayo misses. Offensive rebound by Miles Middleton! Miles Middleton kicks it out.

[08:49] Team_057 possession (Score: 56-59)
FOUL! Shooting foul on Vince Quickley. Anfernee Adebayo to the line for 2 free throws. [Team fouls: 3] (Vince Quickley: 1 personal fouls)   FT 1/2: GOOD   FT 2/2: GOOD Anfernee Adebayo makes 2/2 from the line.
Score: 58-59

[08:36] Team_016 possession (Score: 58-59)
Ben Barrett attempts a Layup. Contested by Ben Adebayo (5.0 feet, ZONE). Ben Barrett misses. Rebound secured by Anfernee Adebayo.

[08:21] Team_057 possession (Score: 58-59)
Ben Adebayo makes the Layup and draws the foul on Vince Duncan! And-1! Ben Adebayo to the line for 1. [Team fouls: 4] (Vince Duncan: 3 personal fouls)   FT 1/1: GOOD Ben Adebayo makes 1/1 from the line.
Score: 61-59

[08:05] Team_016 possession (Score: 61-59)
Vince Duncan attempts a Midrange. Contested by Miles Middleton (4.8 feet, MAN). Vince Duncan misses. Offensive rebound by Vince Duncan! Vince Duncan puts it back in!
Score: 61-61

[07:51] Team_057 possession (Score: 61-61)
Miles Middleton attempts a Midrange. Contested by Vince Duncan (3.1 feet, MAN). MILES MIDDLETON MAKES IT!
Score: 63-61

[07:38] Team_016 possession (Score: 63-61)
Giannis Ginobili attempts a 3Pt. Contested by Klay Rozier (3.7 feet, MAN). Giannis Ginobili misses. Rebound secured by Ben Adebayo.

[07:20] Team_057 possession (Score: 63-61)
FOUL! Holding foul on Vince Duncan. [IN THE BONUS! 5 team fouls] Miles Middleton to the line for 2 free throws. (Vince Duncan: 4 personal fouls)   FT 1/2: GOOD   FT 2/2: GOOD Miles Middleton makes 2/2 from the line.
Score: 65-61

[07:07] Team_016 possession (Score: 65-61)
FOUL! Shooting foul on Klay Rozier. Vince Duncan to the line for 2 free throws. [Team fouls: 3] (Klay Rozier: 1 personal fouls)   FT 1/2: GOOD   FT 2/2: GOOD Vince Duncan makes 2/2 from the line.
Score: 65-63

[06:58] Team_057 possession (Score: 65-63)
FOUL! Reach-in foul on Giannis Ginobili during the drive. [IN THE BONUS! 6 team fouls] Klay Rozier to the line for 2 free throws. (Giannis Ginobili: 1 personal fouls)   FT 1/2: GOOD   FT 2/2: GOOD Klay Rozier makes 2/2 from the line.
Score: 67-63

[06:40] Team_016 possession (Score: 67-63)
FOUL! Holding foul on Kobe Ming. [Team fouls: 4] No free throws, side out. (Kobe Ming: 1 personal fouls)

[06:22] Team_016 possession (Score: 67-63)
FOUL! Shooting foul on Klay Rozier. Giannis Ginobili to the line for 3 free throws. [BONUS: 5 team fouls] (Klay Rozier: 2 personal fouls)   FT 1/3: GOOD   FT 2/3: GOOD   FT 3/3: GOOD Giannis Ginobili makes 3/3 from the line.
Score: 67-66

[06:03] Team_057 possession (Score: 67-66)
Klay Rozier drives to the basket... Klay Rozier loses control! Ball rolls out of bounds! TURNOVER! (dead ball)

[05:48] Team_016 possession (Score: 67-66)
Ben Barrett drives to the basket... FOUL! Offensive foul on Ben Barrett! Ben Adebayo drew the charge! [Team fouls: 7] (Ben Barrett: 1 personal fouls) TURNOVER! (dead ball)

[05:33] Team_057 possession (Score: 67-66)
Anfernee Adebayo attempts a Midrange. Contested by Vince Quickley (4.7 feet, MAN). Anfernee Adebayo misses. FOUL! Loose ball foul on Vince Quickley during the rebound battle. [IN THE BONUS! 8 team fouls] Miles Middleton to the line for 2 free throws. (Vince Quickley: 2 personal fouls)   FT 1/2: GOOD   FT 2/2: GOOD Miles Middleton makes 2/2 from the line.
Score: 69-66

[05:17] Team_016 possession (Score: 69-66)
Giannis Ginobili makes the Layup and draws the foul on Klay Rozier! And-1! Giannis Ginobili to the line for 1. [BONUS: 6 team fouls] (Klay Rozier: 3 personal fouls)   FT 1/1: GOOD Giannis Ginobili makes 1/1 from the line.
Score: 69-69

[05:08] Team_057 possession (Score: 69-69)
FOUL! Shooting foul on Giannis Ginobili. Klay Rozier to the line for 3 free throws. [BONUS: 9 team fouls] (Giannis Ginobili: 2 personal fouls)   FT 1/3: GOOD   FT 2/3: GOOD   FT 3/3: GOOD Klay Rozier makes 3/3 from the line.
Score: 72-69

[04:50] Team_016 possession (Score: 72-69)
Collin Barnes attempts a Layup. Contested by Ben Adebayo (4.5 feet, ZONE). Collin Barnes misses. Offensive rebound by Ben Barrett! Ben Barrett puts it back in!
Score: 72-71

[04:31] Team_057 possession (Score: 72-71)
Anfernee Adebayo attempts a 3Pt. Contested by Vince Quickley (4.7 feet, MAN). Anfernee Adebayo misses. Offensive rebound by Miles Middleton! Miles Middleton kicks it out.

[04:18] Team_057 possession (Score: 72-71)
Anfernee Adebayo makes the Layup and draws the foul on Vince Duncan! And-1! Anfernee Adebayo to the line for 1. [BONUS: 10 team fouls] (Vince Duncan: 5 personal fouls)   FT 1/1: GOOD Anfernee Adebayo makes 1/1 from the line.
Score: 75-71

[04:02] Team_016 possession (Score: 75-71)
Collin Barnes drives and kicks out. Vince Quickley attempts a Midrange. Contested by Anfernee Adebayo (4.9 feet, MAN). VINCE QUICKLEY MAKES IT!
Score: 75-73

[03:44] Team_057 possession (Score: 75-73)
Miles Middleton attempts a Midrange. Contested by Vince Duncan (3.2 feet, MAN). MILES MIDDLETON MAKES IT!
Score: 77-73

[03:28] Team_016 possession (Score: 77-73)
Collin Barnes commits a violation (traveling/carry)! TURNOVER! (dead ball)

[03:12] Team_057 possession (Score: 77-73)
Ben Adebayo attempts a Layup. Contested by Ben Barrett (4.3 feet, MAN). BEN ADEBAYO MAKES IT! Assist: Kobe Ming
Score: 79-73

[02:57] Team_016 possession (Score: 79-73)
Giannis Ginobili makes the Layup and draws the foul on Klay Rozier! And-1! Giannis Ginobili to the line for 1. [BONUS: 7 team fouls] (Klay Rozier: 4 personal fouls)   FT 1/1: GOOD Giannis Ginobili makes 1/1 from the line.
Score: 79-76

[02:46] Team_057 possession (Score: 79-76)
Miles Middleton attempts a Midrange. Contested by Vince Duncan (3.3 feet, MAN). MILES MIDDLETON MAKES IT! Assist: Anfernee Adebayo
Score: 81-76

[02:30] Team_016 possession (Score: 81-76)
FOUL! Shooting foul on Ben Adebayo. Giannis Ginobili to the line for 2 free throws. [BONUS: 8 team fouls] (Ben Adebayo: 2 personal fouls)   FT 1/2: GOOD   FT 2/2: MISS Giannis Ginobili makes 1/2 from the line. Rebound secured by Miles Middleton.
Score: 81-77

[02:18] Team_057 possession (Score: 81-77)
Ben Adebayo attempts a 3Pt. Contested by Ben Barrett (4.4 feet, MAN). Ben Adebayo misses. Rebound secured by Ben Barrett.

[02:02] Team_016 possession (Score: 81-77)
FOUL! Holding foul on Anfernee Adebayo. [IN THE BONUS! 9 team fouls] Vince Quickley to the line for 2 free throws. (Anfernee Adebayo: 2 personal fouls)   FT 1/2: MISS   FT 2/2: MISS Vince Quickley makes 0/2 from the line. Rebound secured by Ben Adebayo.

[01:45] Team_057 possession (Score: 81-77)
FOUL! Shooting foul on Vince Quickley. Anfernee Adebayo to the line for 2 free throws. [BONUS: 11 team fouls] (Vince Quickley: 3 personal fouls)   FT 1/2: GOOD   FT 2/2: GOOD Anfernee Adebayo makes 2/2 from the line.
Score: 83-77

[01:33] Team_016 possession (Score: 83-77)
Vince Quickley makes the Midrange and draws the foul on Klay Rozier! And-1! Vince Quickley to the line for 1. [BONUS: 10 team fouls] (Klay Rozier: 5 personal fouls)   FT 1/1: GOOD Vince Quickley makes 1/1 from the line.
Score: 83-80

[01:19] Team_057 possession (Score: 83-80)
Anfernee Adebayo makes the Layup and draws the foul on Collin Barnes! And-1! Anfernee Adebayo to the line for 1. [BONUS: 12 team fouls] (Collin Barnes: 1 personal fouls)   FT 1/1: GOOD Anfernee Adebayo makes 1/1 from the line.
Score: 86-80

[01:05] Team_016 possession (Score: 86-80)
Ben Barrett attempts a 3Pt. Contested by Kobe Ming (5.3 feet, ZONE). BEN BARRETT MAKES IT!
Score: 86-83

[00:51] Team_057 possession (Score: 86-83)
Anfernee Adebayo attempts a 3Pt. Contested by Vince Quickley (4.9 feet, MAN). ANFERNEE ADEBAYO MAKES IT! Assist: Kobe Ming
Score: 89-83

[00:38] Team_016 possession (Score: 89-83)
FOUL! Shooting foul on Anfernee Adebayo. Collin Barnes to the line for 2 free throws. [BONUS: 11 team fouls] (Anfernee Adebayo: 3 personal fouls)   FT 1/2: GOOD   FT 2/2: GOOD Collin Barnes makes 2/2 from the line.
Score: 89-85

[00:25] Team_057 possession (Score: 89-85)
Kobe Ming throws a bad pass out of bounds! TURNOVER! (dead ball)

[00:25] Substitution (Team_057): Kobe Ming OUT → Scottie Johnson IN (stamina_rule2)

[00:25] Substitution (Team_057): Klay Rozier OUT → Bradley Ginobili IN (stamina_rule2)

[00:25] Substitution (Team_057): Anfernee Adebayo OUT → Joel Wade IN (stamina_rule2)

[00:25] Substitution (Team_057): Ben Adebayo OUT → Lamelo Irving IN (stamina_rule2)

[00:25] Substitution (Team_057): Miles Middleton OUT → Zion Lillard IN (stamina_rule2)

[00:25] Substitution (Team_016): Collin Barnes OUT → Lamelo Herro IN (stamina_rule2)

[00:25] Substitution (Team_016): Giannis Ginobili OUT → Immanuel Nowitzki IN (stamina_rule2)

[00:25] Substitution (Team_016): Vince Quickley OUT → Kevin Butler IN (stamina_rule2)

[00:25] Substitution (Team_016): Ben Barrett OUT → Giannis Doncic IN (stamina_rule2)

[00:25] Substitution (Team_016): Vince Duncan OUT → Trae Barnes IN (stamina_rule2)

[00:09] Team_016 possession (Score: 89-85)
Giannis Doncic attempts a 3Pt. Contested by Lamelo Irving (4.8 feet, ZONE). GIANNIS DONCIC MAKES IT! Assist: Trae Barnes
Score: 89-88

================================================================================
                              3RD QUARTER COMPLETE                              
================================================================================

3RD QUARTER SCORE: Team_057 43, Team_016 36

BOX SCORE:
================================================================================

Team_057
--------------------------------------------------------------------------------
Player                MIN  PTS  REB  AST  TO      FG   FG%      3P   3P%
--------------------------------------------------------------------------------
Miles Middleton        31   17    5    0   0   8/8   100.0     0/0   0.0
Anfernee Adebayo       31   13    1    2   0   5/5   100.0     0/0   0.0
Ben Adebayo            31    7    2    0   0   3/4    75.0     0/0   0.0
Klay Rozier            31    6    0    1   0   3/3   100.0     0/0   0.0
Kobe Ming              31    0    0    2   0   0/0     0.0     0/0   0.0

TEAM: FG: 19/20 (95.0%), 3PT: 3/4 (75.0%), REB: 8 (3 off, 5 def), AST: 5, TO: 2
TEAM FOULS: 11 [Team_016 in BONUS]


Team_016
--------------------------------------------------------------------------------
Player                MIN  PTS  REB  AST  TO      FG   FG%      3P   3P%
--------------------------------------------------------------------------------
Ben Barrett            31    9    2    0   0   3/5    60.0     0/0   0.0
Giannis Ginobili       31    9    0    0   0   3/5    60.0     0/0   0.0
Collin Barnes          31    5    0    0   0   2/2   100.0     0/0   0.0
Vince Quickley         31    5    0    0   0   2/2   100.0     0/0   0.0
Vince Duncan           31    4    1    0   0   2/2   100.0     0/0   0.0
Giannis Doncic          6    3    0    0   0   1/1   100.0     0/0   0.0
Trae Barnes             6    0    0    1   0   0/0     0.0     0/0   0.0

TEAM: FG: 13/18 (72.2%), 3PT: 4/5 (80.0%), REB: 3 (2 off, 1 def), AST: 1, TO: 4
TEAM FOULS: 12 [Team_057 in BONUS]

================================================================================

================================================================================
                       4TH QUARTER - Team_057 vs Team_016                       
================================================================================

[12:00] Team_057 possession (Score: 89-88)
FOUL! Offensive foul on Kobe Ming! Collin Barnes drew the charge! [Team fouls: 1] (Kobe Ming: 1 personal fouls) TURNOVER! (dead ball)

[11:50] Team_016 possession (Score: 89-88)
Ben Barrett attempts a 3Pt. Contested by Ben Adebayo (5.2 feet, ZONE). BEN BARRETT MAKES IT! Assist: Giannis Ginobili
Score: 89-91

[11:35] Team_057 possession (Score: 89-91)
Miles Middleton drives, Vince Duncan stays with him. Miles Middleton attempts a Layup. Contested by Vince Duncan (3.4 feet, MAN). MILES MIDDLETON MAKES IT! Assist: Kobe Ming
Score: 91-91

[11:18] Team_016 possession (Score: 91-91)
Ben Barrett attempts a Layup. Contested by Ben Adebayo (5.3 feet, MAN). BEN BARRETT MAKES IT! Assist: Vince Duncan
Score: 91-93

[11:01] Team_057 possession (Score: 91-93)
Klay Rozier attempts a 3Pt. Contested by Giannis Ginobili (5.9 feet, MAN). Klay Rozier misses. Rebound secured by Ben Barrett.

[10:48] Team_016 possession (Score: 91-93)
Vince Duncan drives to the basket... Vince Duncan loses the ball! Stripped by Miles Middleton! TURNOVER! (live ball)

[10:36] Team_057 possession (Score: 91-93)
Klay Rozier drives to the basket... Klay Rozier throws a bad pass out of bounds! TURNOVER! (dead ball)

[10:36] Substitution (Team_057): Kobe Ming OUT → Scottie Johnson IN (stamina_rule2)

[10:36] Substitution (Team_057): Klay Rozier OUT → Bradley Ginobili IN (stamina_rule2)

[10:36] Substitution (Team_057): Anfernee Adebayo OUT → Joel Wade IN (stamina_rule2)

[10:36] Substitution (Team_057): Ben Adebayo OUT → Lamelo Irving IN (stamina_rule2)

[10:36] Substitution (Team_057): Miles Middleton OUT → Zion Lillard IN (stamina_rule2)

[10:36] Substitution (Team_016): Collin Barnes OUT → Lamelo Herro IN (stamina_rule2)

[10:36] Substitution (Team_016): Giannis Ginobili OUT → Immanuel Nowitzki IN (stamina_rule2)

[10:36] Substitution (Team_016): Vince Quickley OUT → Kevin Butler IN (stamina_rule2)

[10:36] Substitution (Team_016): Ben Barrett OUT → Giannis Doncic IN (stamina_rule2)

[10:36] Substitution (Team_016): Vince Duncan OUT → Trae Barnes IN (stamina_rule2)

[10:21] Team_016 possession (Score: 91-93)
Kevin Butler attempts a 3Pt. Contested by Scottie Johnson (4.5 feet, ZONE). Kevin Butler misses. Rebound secured by Zion Lillard.

[10:03] Team_057 possession (Score: 91-93)
Bradley Ginobili attempts a Midrange. Contested by Immanuel Nowitzki (5.0 feet, MAN). Bradley Ginobili misses. Rebound secured by Giannis Doncic.

[09:48] Team_016 possession (Score: 91-93)
Kevin Butler attempts a Layup. Contested by Zion Lillard (3.3 feet, ZONE). KEVIN BUTLER MAKES IT! Assist: Giannis Doncic
Score: 91-95

[09:36] Team_057 possession (Score: 91-95)
Bradley Ginobili attempts a Midrange. Contested by Immanuel Nowitzki (5.0 feet, MAN). BRADLEY GINOBILI MAKES IT! Assist: Scottie Johnson
Score: 93-95

[09:24] Team_016 possession (Score: 93-95)
Trae Barnes drives, picks up Lamelo Irving. Help arrives from Bradley Ginobili! Trae Barnes attempts a Layup. Contested by Bradley Ginobili (4.6 feet, ZONE). Trae Barnes misses. Rebound secured by Joel Wade.

[09:08] Team_057 possession (Score: 93-95)
Lamelo Irving drives and kicks out. Scottie Johnson attempts a 3Pt. Contested by Lamelo Herro (3.8 feet, MAN). Scottie Johnson misses. Rebound secured by Giannis Doncic.

[08:52] Team_016 possession (Score: 93-95)
FOUL! Reach-in foul on Lamelo Irving during the drive. [Team fouls: 2] No free throws, side out. (Lamelo Irving: 1 personal fouls)

[08:39] Team_016 possession (Score: 93-95)
Lamelo Herro attempts a 3Pt. Contested by Scottie Johnson (4.8 feet, ZONE). LAMELO HERRO MAKES IT! Assist: Giannis Doncic
Score: 93-98

[08:25] Team_057 possession (Score: 93-98)
Joel Wade drives and kicks out. Zion Lillard attempts a 3Pt. Contested by Trae Barnes (5.7 feet, MAN). Zion Lillard misses. FOUL! Loose ball foul on Lamelo Herro during the rebound battle. [Team fouls: 1] No free throws, side out. (Lamelo Herro: 1 personal fouls)

[08:11] Team_057 possession (Score: 93-98)
Zion Lillard attempts a Midrange. Contested by Kevin Butler (4.7 feet, ZONE). Zion Lillard misses. Offensive rebound by Lamelo Irving! Lamelo Irving kicks it out.

[07:59] Team_057 possession (Score: 93-98)
Bradley Ginobili attempts a 3Pt. Contested by Immanuel Nowitzki (5.0 feet, MAN). Bradley Ginobili misses. Rebound secured by Lamelo Herro.

[07:48] Team_016 possession (Score: 93-98)
Kevin Butler throws a bad pass out of bounds! TURNOVER! (dead ball)

[07:33] Team_057 possession (Score: 93-98)
FOUL! Reach-in foul on Kevin Butler during the drive. [Team fouls: 2] No free throws, side out. (Kevin Butler: 1 personal fouls)

[07:18] Team_057 possession (Score: 93-98)
Scottie Johnson attempts a 3Pt. Contested by Lamelo Herro (4.0 feet, ZONE). Scottie Johnson misses. Rebound secured by Lamelo Herro.

[07:04] Team_016 possession (Score: 93-98)
Trae Barnes drives, Zion Lillard stays with him. Trae Barnes attempts a Layup. Contested by Zion Lillard (3.4 feet, MAN). TRAE BARNES MAKES IT!
Score: 93-100

[06:49] Team_057 possession (Score: 93-100)
Lamelo Irving attempts a 3Pt. Contested by Lamelo Herro (4.5 feet, ZONE). LAMELO IRVING MAKES IT! Assist: Zion Lillard
Score: 96-100

[06:37] Team_016 possession (Score: 96-100)
Lamelo Herro attempts a Midrange. Contested by Scottie Johnson (4.8 feet, ZONE). Lamelo Herro misses. Rebound secured by Joel Wade.

[06:24] Team_057 possession (Score: 96-100)
Lamelo Irving attempts a 3Pt. Contested by Lamelo Herro (4.5 feet, ZONE). Lamelo Irving misses. Offensive rebound by Lamelo Irving! Lamelo Irving kicks it out.

[06:11] Team_057 possession (Score: 96-100)
FOUL! Reach-in foul on Giannis Doncic during the drive. [Team fouls: 3] No free throws, side out. (Giannis Doncic: 1 personal fouls)

[05:57] Team_057 possession (Score: 96-100)
Bradley Ginobili attempts a Layup. Contested by Immanuel Nowitzki (5.0 feet, MAN). Bradley Ginobili misses. Rebound secured by Lamelo Herro.

[05:48] Team_016 possession (Score: 96-100)
Kevin Butler attempts a Layup. BLOCKED BY LAMELO IRVING! Ball is loose! Rebound secured by Lamelo Irving.

[05:33] Team_057 possession (Score: 96-100)
FOUL! Shooting foul on Giannis Doncic. Lamelo Irving to the line for 2 free throws. [Team fouls: 4] (Giannis Doncic: 2 personal fouls)   FT 1/2: GOOD   FT 2/2: GOOD Lamelo Irving makes 2/2 from the line.
Score: 98-100

[05:20] Team_016 possession (Score: 98-100)
Giannis Doncic attempts a 3Pt. Contested by Scottie Johnson (4.8 feet, ZONE). Giannis Doncic misses. Offensive rebound by Trae Barnes! Trae Barnes kicks it out.

[05:05] Team_016 possession (Score: 98-100)
Immanuel Nowitzki attempts a 3Pt. Contested by Scottie Johnson (4.9 feet, ZONE). Immanuel Nowitzki misses. FOUL! Loose ball foul on Lamelo Irving during the rebound battle. [Team fouls: 3] No free throws, side out. (Lamelo Irving: 2 personal fouls)

[04:55] Team_016 possession (Score: 98-100)
FOUL! Shooting foul on Zion Lillard. Trae Barnes to the line for 2 free throws. [Team fouls: 4] (Zion Lillard: 1 personal fouls)   FT 1/2: GOOD   FT 2/2: GOOD Trae Barnes makes 2/2 from the line.
Score: 98-102

[04:42] Team_057 possession (Score: 98-102)
Joel Wade attempts a 3Pt. Contested by Lamelo Herro (3.7 feet, ZONE). JOEL WADE MAKES IT! Assist: Bradley Ginobili
Score: 101-102

[04:28] Team_016 possession (Score: 101-102)
Giannis Doncic attempts a Layup. Contested by Lamelo Irving (4.8 feet, ZONE). GIANNIS DONCIC MAKES IT! Assist: Lamelo Herro
Score: 101-104

[04:15] Team_057 possession (Score: 101-104)
Lamelo Irving attempts a 3Pt. Contested by Lamelo Herro (4.5 feet, ZONE). Lamelo Irving misses. Rebound secured by Lamelo Herro.

[04:00] Team_016 possession (Score: 101-104)
Trae Barnes attempts a Layup. Contested by Lamelo Irving (4.7 feet, ZONE). Trae Barnes misses. Offensive rebound by Trae Barnes! Trae Barnes kicks it out.

[03:45] Team_016 possession (Score: 101-104)
Lamelo Herro attempts a Midrange. Contested by Bradley Ginobili (4.9 feet, ZONE). Lamelo Herro misses. Rebound secured by Lamelo Irving.

[03:28] Team_057 possession (Score: 101-104)
Lamelo Irving makes the Layup and draws the foul on Giannis Doncic! And-1! Lamelo Irving to the line for 1. [BONUS: 5 team fouls] (Giannis Doncic: 3 personal fouls)   FT 1/1: GOOD Lamelo Irving makes 1/1 from the line.
Score: 104-104

[03:10] Team_016 possession (Score: 104-104)
Trae Barnes attempts a Layup. Contested by Zion Lillard (3.5 feet, MAN). TRAE BARNES MAKES IT! Assist: Giannis Doncic
Score: 104-106

[02:51] Team_057 possession (Score: 104-106)
Bradley Ginobili attempts a Midrange. Contested by Kevin Butler (4.8 feet, ZONE). Bradley Ginobili misses. Rebound secured by Giannis Doncic.

[02:37] Team_016 possession (Score: 104-106)
FOUL! Shooting foul on Bradley Ginobili. Giannis Doncic to the line for 2 free throws. [BONUS: 5 team fouls] (Bradley Ginobili: 1 personal fouls)   FT 1/2: GOOD   FT 2/2: GOOD Giannis Doncic makes 2/2 from the line.
Score: 104-108

[02:26] Team_057 possession (Score: 104-108)
Lamelo Irving attempts a Layup. Contested by Giannis Doncic (4.5 feet, ZONE). LAMELO IRVING MAKES IT! Assist: Zion Lillard
Score: 106-108

[02:13] Team_016 possession (Score: 106-108)
Kevin Butler attempts a Layup. BLOCKED BY JOEL WADE! Ball goes out off Joel Wade. Kevin Butler's ball!

[01:57] Team_016 possession (Score: 106-108)
Lamelo Herro attempts a 3Pt. Contested by Scottie Johnson (5.0 feet, MAN). Lamelo Herro misses. Rebound secured by Lamelo Irving.

[01:44] Team_057 possession (Score: 106-108)
Scottie Johnson attempts a Midrange. Contested by Lamelo Herro (4.2 feet, MAN). Scottie Johnson misses. Rebound secured by Lamelo Herro.

[01:27] Team_016 possession (Score: 106-108)
Immanuel Nowitzki attempts a 3Pt. Contested by Bradley Ginobili (5.2 feet, MAN). Immanuel Nowitzki misses. Rebound secured by Zion Lillard.

[01:07] Team_057 possession (Score: 106-108)
Lamelo Irving attempts a Midrange. Contested by Giannis Doncic (4.6 feet, MAN). LAMELO IRVING MAKES IT! Assist: Scottie Johnson
Score: 108-108

[00:56] Team_016 possession (Score: 108-108)
Lamelo Herro drives, picks up Lamelo Irving. Help arrives from Bradley Ginobili! Lamelo Herro attempts a Layup. Contested by Bradley Ginobili (5.1 feet, ZONE). LAMELO HERRO MAKES IT! Assist: Giannis Doncic
Score: 108-110

[00:41] Team_057 possession (Score: 108-110)
Bradley Ginobili drives, Giannis Doncic stays with him. Bradley Ginobili attempts a Layup. Contested by Giannis Doncic (4.3 feet, ZONE). BRADLEY GINOBILI MAKES IT! Assist: Zion Lillard
Score: 110-110

[00:25] Team_016 possession (Score: 110-110)
Kevin Butler attempts a Layup. Contested by Joel Wade (5.4 feet, MAN). KEVIN BUTLER MAKES IT! Assist: Immanuel Nowitzki
Score: 110-112

[00:08] Team_057 possession (Score: 110-112)
Joel Wade attempts a 3Pt. Contested by Lamelo Herro (4.0 feet, ZONE). Joel Wade misses. Rebound secured by Giannis Doncic.

================================================================================
                              4TH QUARTER COMPLETE                              
================================================================================

4TH QUARTER SCORE: Team_057 21, Team_016 24

BOX SCORE:
================================================================================

Team_057
--------------------------------------------------------------------------------
Player                MIN  PTS  REB  AST  TO      FG   FG%      3P   3P%
--------------------------------------------------------------------------------
Lamelo Irving          16   12    6    0   0   5/7    71.4     0/0   0.0
Bradley Ginobili       16    4    0    1   0   2/6    33.3     0/0   0.0
Joel Wade              16    3    2    0   0   1/2    50.0     0/0   0.0
Miles Middleton        32    2    0    0   0   1/1   100.0     0/0   0.0
Kobe Ming              32    0    0    1   0   0/0     0.0     0/0   0.0
Klay Rozier            32    0    0    0   0   0/1     0.0     0/0   0.0
Zion Lillard           16    0    2    3   0   0/0     0.0     0/0   0.0
Scottie Johnson        16    0    0    2   0   0/2     0.0     0/0   0.0

TEAM: FG: 9/19 (47.4%), 3PT: 2/7 (28.6%), REB: 10 (3 off, 7 def), AST: 7, TO: 2
TEAM FOULS: 5 [Team_016 in BONUS]


Team_016
--------------------------------------------------------------------------------
Player                MIN  PTS  REB  AST  TO      FG   FG%      3P   3P%
--------------------------------------------------------------------------------
Trae Barnes            16    6    3    0   0   3/4    75.0     0/0   0.0
Ben Barrett            32    5    1    0   0   2/2   100.0     0/0   0.0
Lamelo Herro           16    5    5    1   0   2/5    40.0     0/0   0.0
Kevin Butler           16    4    0    0   0   2/4    50.0     0/0   0.0
Giannis Doncic         16    4    4    4   0   2/2   100.0     0/0   0.0
Giannis Ginobili       32    0    0    1   0   0/0     0.0     0/0   0.0
Vince Duncan           32    0    0    1   0   0/0     0.0     0/0   0.0
Immanuel Nowitzki      16    0    0    1   0   0/1     0.0     0/0   0.0

TEAM: FG: 11/18 (61.1%), 3PT: 2/5 (40.0%), REB: 13 (3 off, 10 def), AST: 8, TO: 2
TEAM FOULS: 5 [Team_057 in BONUS]

================================================================================

================================================================================
                               FULL GAME COMPLETE                               
================================================================================

FINAL SCORE: Team_057 110, Team_016 112

SCORING BY QUARTER:
--------------------------------------------------------------------------------
Team                     Q1     Q2     Q3     Q4    FINAL
--------------------------------------------------------------------------------
Team_057                 28     18     43     21      110
Team_016                 30     22     36     24      112
--------------------------------------------------------------------------------

FULL GAME BOX SCORE:
================================================================================

Team_057
--------------------------------------------------------------------------------
Player                MIN  PTS  REB  AST  TO      FG   FG%      3P   3P%      FT STL BLK
--------------------------------------------------------------------------------
Kobe Ming              32    2    0    4   2   1/6    16.7   0/2     0.0   0/1     1   0
Klay Rozier            32   14    0    2   1   7/13   53.8   2/5    40.0  13/16    1   0
Anfernee Adebayo       32   26    4    4   2  11/19   57.9   4/10   40.0   9/9     0   0
Ben Adebayo            32   11   12    0   0   5/8    62.5   0/2     0.0   1/1     0   0
Miles Middleton        32   21   12    2   1   8/8   100.0   1/1   100.0   6/6     1   0
Scottie Johnson        16    7    0    3   0   1/4    25.0   0/2     0.0   0/0     0   0
Bradley Ginobili       16    4    0    2   0   2/6    33.3   0/1     0.0   0/0     1   0
Joel Wade              16    6    2    1   0   2/4    50.0   2/4    50.0   0/0     0   1
Lamelo Irving          16   12    9    0   0   6/9    66.7   1/3    33.3   3/3     1   1
Zion Lillard           16    3    6    4   0   2/4    50.0   1/3    33.3   0/0     0   0

TEAM: FG: 46/82 (56.1%), 3PT: 11/33 (33.3%), REB: 44 (15 off, 29 def), AST: 22, TO: 6


Team_016
--------------------------------------------------------------------------------
Player                MIN  PTS  REB  AST  TO      FG   FG%      3P   3P%      FT STL BLK
--------------------------------------------------------------------------------
Collin Barnes          32   17    0    1   2   9/13   69.2   2/4    50.0   6/8     0   2
Giannis Ginobili       32   12    0    4   4   4/8    50.0   2/4    50.0   6/7     0   0
Vince Quickley         32    7    1    2   1   3/8    37.5   1/5    20.0   1/3     0   1
Ben Barrett            32   30   13    1   0  10/13   76.9   5/5   100.0   1/1     0   0
Vince Duncan           32    9   12    4   1   4/6    66.7   0/0     0.0   3/3     0   0
Lamelo Herro           16   11    6    2   0   4/9    44.4   3/6    50.0   0/0     0   0
Immanuel Nowitzki      16    3    0    1   1   1/3    33.3   1/3    33.3   0/0     0   0
Kevin Butler           16    4    0    2   1   2/5    40.0   0/1     0.0   0/0     0   0
Giannis Doncic         16    7    6    4   0   3/3   100.0   1/1   100.0   2/2     0   0
Trae Barnes            16    8    5    1   1   4/5    80.0   0/0     0.0   4/4     0   0

TEAM: FG: 44/74 (59.5%), 3PT: 15/29 (51.7%), REB: 44 (8 off, 36 def), AST: 22, TO: 11

================================================================================
