================================================================================
                        FULL GAME - Team_060 vs Team_050                        
================================================================================

================================================================================
                       1ST QUARTER - Team_060 vs Team_050                       
================================================================================

[12:00] Team_060 possession (Score: 0-0)
Joel Morant drives and kicks out. FOUL! Shooting foul on Donovan Trent. Jaren George to the line for 2 free throws. [Team fouls: 1] (Donovan Trent: 1 personal fouls)   FT 1/2: GOOD   FT 2/2: GOOD Jaren George makes 2/2 from the line.
Score: 2-0

[11:49] Team_050 possession (Score: 2-0)
Joel Banchero attempts a 3Pt. Contested by Julius Green (3.6 feet, MAN). Joel Banchero misses. Rebound secured by Immanuel Ming.

[11:33] Team_060 possession (Score: 2-0)
FOUL! Shooting foul on Joel Banchero. Larry Westbrook to the line for 2 free throws. [Team fouls: 2] (Joel Banchero: 1 personal fouls)   FT 1/2: GOOD   FT 2/2: MISS Larry Westbrook makes 1/2 from the line. Rebound secured by Collin Bane.
Score: 3-0

[11:16] Team_050 possession (Score: 3-0)
FOUL! Holding foul on Immanuel Ming. [Team fouls: 1] No free throws, side out. (Immanuel Ming: 1 personal fouls)

[11:01] Team_050 possession (Score: 3-0)
Donovan Trent attempts a Midrange. Contested by Julius Green (3.6 feet, ZONE). Donovan Trent misses. Offensive rebound by Collin Bane! Collin Bane kicks it out.

[10:50] Team_050 possession (Score: 3-0)
LeBron Bridges drives and kicks out. Giannis LaVine attempts a Midrange. Contested by Julius Green (3.8 feet, ZONE). GIANNIS LAVINE MAKES IT!
Score: 3-2

[10:33] Team_060 possession (Score: 3-2)
Julius Green drives, picks up Joel Banchero. Help arrives from Collin Bane! Julius Green attempts a Dunk. Contested by Collin Bane (4.1 feet, MAN). Julius Green misses. Rebound secured by Joel Banchero.

[10:21] Team_050 possession (Score: 3-2)
Joel Banchero attempts a 3Pt. Contested by Julius Green (3.6 feet, ZONE). JOEL BANCHERO MAKES IT! Assist: Donovan Trent
Score: 3-5

[10:04] Team_060 possession (Score: 3-5)
Joel Morant attempts a 3Pt. Contested by Giannis LaVine (3.6 feet, ZONE). JOEL MORANT MAKES IT! Assist: Immanuel Ming
Score: 6-5

[09:50] Team_050 possession (Score: 6-5)
Donovan Trent drives, picks up Jaren George. Help arrives from Julius Green! Donovan Trent attempts a Layup. Contested by Julius Green (5.0 feet, ZONE). Donovan Trent misses. Offensive rebound by Collin Bane! Collin Bane kicks it out.

[09:35] Team_050 possession (Score: 6-5)
Joel Banchero makes the Layup and draws the foul on Julius Green! And-1! Joel Banchero to the line for 1. [Team fouls: 2] (Julius Green: 1 personal fouls)   FT 1/1: GOOD Joel Banchero makes 1/1 from the line.
Score: 6-8

[09:22] Team_060 possession (Score: 6-8)
Larry Westbrook attempts a Midrange. Contested by LeBron Bridges (4.7 feet, ZONE). LARRY WESTBROOK MAKES IT! Assist: Julius Green
Score: 8-8

[09:06] Team_050 possession (Score: 8-8)
Donovan Trent drives and kicks out. LeBron Bridges attempts a Midrange. Contested by Larry Westbrook (4.6 feet, MAN). LeBron Bridges misses. Rebound secured by Immanuel Ming.

[08:52] Team_060 possession (Score: 8-8)
Larry Westbrook attempts a 3Pt. Contested by LeBron Bridges (4.7 feet, MAN). Larry Westbrook misses. Rebound secured by Collin Bane.

[08:38] Team_050 possession (Score: 8-8)
Joel Banchero attempts a 3Pt. Contested by Julius Green (3.6 feet, ZONE). Joel Banchero misses. Rebound secured by Larry Westbrook.

[08:21] Team_060 possession (Score: 8-8)
Larry Westbrook attempts a 3Pt. Contested by Giannis LaVine (4.4 feet, ZONE). LARRY WESTBROOK MAKES IT! Assist: Julius Green
Score: 11-8

[08:04] Team_050 possession (Score: 11-8)
Donovan Trent drives and kicks out. FOUL! Shooting foul on Jaren George. Donovan Trent to the line for 3 free throws. [Team fouls: 3] (Jaren George: 1 personal fouls)   FT 1/3: GOOD   FT 2/3: GOOD   FT 3/3: MISS Donovan Trent makes 2/3 from the line. Rebound secured by Immanuel Ming.
Score: 11-10

[07:47] Team_060 possession (Score: 11-10)
Jaren George attempts a Midrange. Contested by Collin Bane (4.3 feet, ZONE). JAREN GEORGE MAKES IT! Assist: Joel Morant
Score: 13-10

[07:37] Team_050 possession (Score: 13-10)
Joel Banchero attempts a Layup. BLOCKED BY JULIUS GREEN! Ball is loose! Rebound secured by Larry Westbrook.

[07:23] Team_060 possession (Score: 13-10)
FOUL! Holding foul on Joel Banchero. [Team fouls: 3] No free throws, side out. (Joel Banchero: 2 personal fouls)

[07:05] Team_060 possession (Score: 13-10)
Larry Westbrook attempts a Layup. Contested by Donovan Trent (5.3 feet, ZONE). Larry Westbrook misses. Rebound secured by Collin Bane.

[06:52] Team_050 possession (Score: 13-10)
LeBron Bridges attempts a Midrange. Contested by Larry Westbrook (4.8 feet, MAN). LeBron Bridges misses. Rebound secured by Jaren George.

[06:41] Team_060 possession (Score: 13-10)
Immanuel Ming attempts a Layup. Contested by LeBron Bridges (4.2 feet, ZONE). Immanuel Ming misses. Rebound secured by Joel Banchero.

[06:26] Team_050 possession (Score: 13-10)
Collin Bane attempts a 3Pt. Contested by Immanuel Ming (3.8 feet, MAN). COLLIN BANE MAKES IT! Assist: Joel Banchero
Score: 13-13

[06:14] Team_060 possession (Score: 13-13)
Julius Green drives and kicks out. Jaren George attempts a Midrange. Contested by Donovan Trent (4.8 feet, MAN). Jaren George misses. Rebound secured by Joel Banchero.

[06:03] Team_050 possession (Score: 13-13)
Collin Bane attempts a 3Pt. Contested by Immanuel Ming (3.8 feet, MAN). Collin Bane misses. Rebound secured by Jaren George.

[05:49] Team_060 possession (Score: 13-13)
Julius Green attempts a 3Pt. Contested by Joel Banchero (4.1 feet, MAN). Julius Green misses. Offensive rebound by Jaren George! Jaren George puts it back in!
Score: 15-13

[05:31] Team_050 possession (Score: 15-13)
Joel Banchero attempts a 3Pt. Contested by Julius Green (3.6 feet, ZONE). Joel Banchero misses. Offensive rebound by Collin Bane! Collin Bane kicks it out.

[05:19] Team_050 possession (Score: 15-13)
Giannis LaVine attempts a Midrange. Contested by Joel Morant (5.7 feet, MAN). GIANNIS LAVINE MAKES IT!
Score: 15-15

[05:02] Team_060 possession (Score: 15-15)
Joel Morant attempts a Layup. Contested by Giannis LaVine (3.6 feet, MAN). JOEL MORANT MAKES IT! Assist: Jaren George
Score: 17-15

[04:46] Team_050 possession (Score: 17-15)
LeBron Bridges drives and kicks out. Donovan Trent attempts a Midrange. Contested by Jaren George (5.3 feet, MAN). DONOVAN TRENT MAKES IT! Assist: Joel Banchero
Score: 17-17

[04:34] Team_060 possession (Score: 17-17)
FOUL! Shooting foul on Giannis LaVine. Joel Morant to the line for 2 free throws. [Team fouls: 4] (Giannis LaVine: 1 personal fouls)   FT 1/2: GOOD   FT 2/2: GOOD Joel Morant makes 2/2 from the line.
Score: 19-17

[04:22] Team_050 possession (Score: 19-17)
Joel Banchero attempts a Midrange. Contested by Julius Green (3.7 feet, MAN). Joel Banchero misses. Offensive rebound by LeBron Bridges! LeBron Bridges kicks it out.

[04:05] Team_050 possession (Score: 19-17)
Collin Bane drives to the basket... Collin Bane loses control! Ball rolls out of bounds! TURNOVER! (dead ball)

[03:50] Team_060 possession (Score: 19-17)
Julius Green attempts a 3Pt. Contested by Joel Banchero (4.2 feet, MAN). Julius Green misses. Rebound secured by Collin Bane.

[03:39] Team_050 possession (Score: 19-17)
Joel Banchero attempts a 3Pt. Contested by Joel Morant (5.3 feet, ZONE). Joel Banchero misses. Offensive rebound by Collin Bane! Collin Bane kicks it out.

[03:26] Team_050 possession (Score: 19-17)
Giannis LaVine attempts a Midrange. Contested by Joel Morant (5.9 feet, MAN). Giannis LaVine misses. Offensive rebound by Collin Bane! Collin Bane kicks it out.

[03:12] Team_050 possession (Score: 19-17)
Joel Banchero attempts a 3Pt. Contested by Julius Green (3.8 feet, ZONE). Joel Banchero misses. Rebound secured by Jaren George.

[02:55] Team_060 possession (Score: 19-17)
FOUL! Reach-in foul on LeBron Bridges during the drive. [IN THE BONUS! 5 team fouls] Larry Westbrook to the line for 2 free throws. (LeBron Bridges: 1 personal fouls)   FT 1/2: GOOD   FT 2/2: MISS Larry Westbrook makes 1/2 from the line. Rebound secured by Joel Banchero.
Score: 20-17

[02:39] Team_050 possession (Score: 20-17)
LeBron Bridges attempts a Layup. Contested by Jaren George (5.6 feet, ZONE). LEBRON BRIDGES MAKES IT! Assist: Donovan Trent
Score: 20-19

[02:26] Team_060 possession (Score: 20-19)
Larry Westbrook attempts a 3Pt. Contested by Giannis LaVine (4.6 feet, ZONE). Larry Westbrook misses. Rebound secured by Collin Bane.

[02:10] Team_050 possession (Score: 20-19)
LeBron Bridges makes the Layup and draws the foul on Larry Westbrook! And-1! LeBron Bridges to the line for 1. [Team fouls: 4] (Larry Westbrook: 1 personal fouls)   FT 1/1: GOOD LeBron Bridges makes 1/1 from the line.
Score: 20-22

[01:55] Team_060 possession (Score: 20-22)
Larry Westbrook commits a violation (traveling/carry)! TURNOVER! (dead ball)

[01:55] Substitution (Team_060): Joel Morant OUT → Domantas Barnes IN (stamina_rule2)

[01:55] Substitution (Team_060): Julius Green OUT → Rudy Ginobili IN (stamina_rule2)

[01:55] Substitution (Team_060): Larry Westbrook OUT → Yao Tatum IN (stamina_rule2)

[01:55] Substitution (Team_060): Jaren George OUT → Klay Haliburton IN (stamina_rule2)

[01:55] Substitution (Team_050): Giannis LaVine OUT → Damian O'Neal IN (stamina_rule2)

[01:55] Substitution (Team_050): Joel Banchero OUT → Dwyane Towns IN (stamina_rule2)

[01:55] Substitution (Team_050): Collin Bane OUT → Larry Curry IN (stamina_rule2)

[01:55] Substitution (Team_050): LeBron Bridges OUT → Luka Gasol IN (stamina_rule2)

[01:55] Substitution (Team_050): Donovan Trent OUT → Tyler Smith IN (stamina_rule2)

[01:38] Team_050 possession (Score: 20-22)
Damian O'Neal drives and kicks out. Tyler Smith attempts a Midrange. Contested by Klay Haliburton (4.3 feet, MAN). Tyler Smith misses. Offensive rebound by Larry Curry! Larry Curry kicks it out.

[01:24] Team_050 possession (Score: 20-22)
Larry Curry attempts a Layup. BLOCKED BY DOMANTAS BARNES! Ball is loose! Rebound secured by Immanuel Ming.

[01:07] Team_060 possession (Score: 20-22)
Rudy Ginobili attempts a 3Pt. Contested by Dwyane Towns (4.6 feet, MAN). Rudy Ginobili misses. FOUL! Loose ball foul on Larry Curry during the rebound battle. [IN THE BONUS! 6 team fouls] Klay Haliburton to the line for 2 free throws. (Larry Curry: 1 personal fouls)   FT 1/2: GOOD   FT 2/2: GOOD Klay Haliburton makes 2/2 from the line.
Score: 22-22

[00:52] Team_050 possession (Score: 22-22)
Larry Curry drives, picks up Yao Tatum. Help arrives from Domantas Barnes! Larry Curry attempts a Layup. Contested by Domantas Barnes (5.3 feet, ZONE). Larry Curry misses. Rebound secured by Immanuel Ming.

[00:37] Team_060 possession (Score: 22-22)
Domantas Barnes throws a bad pass! Stolen by Damian O'Neal! TURNOVER! (live ball)

[00:20] Team_050 possession (Score: 22-22)
Larry Curry attempts a 3Pt. Contested by Rudy Ginobili (4.5 feet, ZONE). Larry Curry misses. Rebound secured by Domantas Barnes.

[00:02] Team_060 possession (Score: 22-22)
Domantas Barnes drives to the basket... Domantas Barnes loses control! Ball rolls out of bounds! TURNOVER! (dead ball)

[00:02] Substitution (Team_060): Immanuel Ming OUT → Jarrett Wagner IN (stamina_rule2)

================================================================================
                              1ST QUARTER COMPLETE                              
================================================================================

1ST QUARTER SCORE: Team_060 22, Team_050 22

BOX SCORE:
================================================================================

Team_060
--------------------------------------------------------------------------------
Player                MIN  PTS  REB  AST  TO      FG   FG%      3P   3P%
--------------------------------------------------------------------------------
Joel Morant            10    7    0    1   0   3/3   100.0     0/0   0.0
Jaren George           10    6    4    1   0   3/3   100.0     0/0   0.0
Larry Westbrook        10    5    2    0   0   2/7    28.6     0/0   0.0
Klay Haliburton         2    2    0    0   0   1/1   100.0     0/0   0.0
Immanuel Ming          12    0    5    1   0   0/1     0.0     0/0   0.0
Julius Green           10    0    0    2   0   0/3     0.0     0/0   0.0
Domantas Barnes         2    0    1    0   0   0/0     0.0     0/0   0.0

TEAM: FG: 9/18 (50.0%), 3PT: 4/7 (57.1%), REB: 12 (1 off, 11 def), AST: 5, TO: 3
TEAM FOULS: 4


Team_050
--------------------------------------------------------------------------------
Player                MIN  PTS  REB  AST  TO      FG   FG%      3P   3P%
--------------------------------------------------------------------------------
Joel Banchero          10    6    4    2   0   2/6    33.3     0/0   0.0
LeBron Bridges         10    5    1    0   0   2/3    66.7     0/0   0.0
Giannis LaVine         10    4    0    0   0   2/2   100.0     0/0   0.0
Collin Bane            10    3   10    0   0   1/2    50.0     0/0   0.0
Donovan Trent          10    2    0    2   0   1/3    33.3     0/0   0.0
Larry Curry             2    0    1    0   0   0/3     0.0     0/0   0.0

TEAM: FG: 8/19 (42.1%), 3PT: 2/7 (28.6%), REB: 16 (7 off, 9 def), AST: 4, TO: 1
TEAM FOULS: 6 [Team_060 in BONUS]

================================================================================

================================================================================
                       2ND QUARTER - Team_060 vs Team_050                       
================================================================================

[12:00] Team_060 possession (Score: 22-22)
Immanuel Ming loses the ball! Stripped by Collin Bane! TURNOVER! (live ball)

[11:45] Team_050 possession (Score: 22-22)
Joel Banchero makes the Midrange and draws the foul on Julius Green! And-1! Joel Banchero to the line for 1. [Team fouls: 1] (Julius Green: 1 personal fouls)   FT 1/1: MISS Joel Banchero makes 0/1 from the line. Rebound secured by Larry Westbrook.
Score: 22-24

[11:28] Team_060 possession (Score: 22-24)
Immanuel Ming drives, Collin Bane stays with him. Immanuel Ming attempts a Layup. Contested by Collin Bane (4.1 feet, MAN). IMMANUEL MING MAKES IT! Assist: Jaren George
Score: 24-24

[11:14] Team_050 possession (Score: 24-24)
LeBron Bridges drives, Larry Westbrook stays with him. LeBron Bridges attempts a Layup. Contested by Larry Westbrook (4.9 feet, MAN). LEBRON BRIDGES MAKES IT!
Score: 24-26

[11:02] Team_060 possession (Score: 24-26)
Larry Westbrook attempts a 3Pt. Contested by Giannis LaVine (4.5 feet, ZONE). LARRY WESTBROOK MAKES IT! Assist: Immanuel Ming
Score: 27-26

[10:48] Team_050 possession (Score: 27-26)
Giannis LaVine attempts a 3Pt. Contested by Joel Morant (5.9 feet, MAN). GIANNIS LAVINE MAKES IT! Assist: LeBron Bridges
Score: 27-29

[10:30] Team_060 possession (Score: 27-29)
Joel Morant attempts a 3Pt. Contested by Giannis LaVine (3.7 feet, ZONE). Joel Morant misses. Offensive rebound by Immanuel Ming! Immanuel Ming kicks it out.

[10:14] Team_060 possession (Score: 27-29)
Jaren George drives to the basket... Jaren George throws a bad pass out of bounds! TURNOVER! (dead ball)

[10:14] Substitution (Team_060): Joel Morant OUT → Domantas Barnes IN (stamina_rule2)

[10:14] Substitution (Team_060): Immanuel Ming OUT → Jarrett Wagner IN (stamina_rule2)

[10:14] Substitution (Team_060): Larry Westbrook OUT → Yao Tatum IN (stamina_rule2)

[10:14] Substitution (Team_060): Jaren George OUT → Klay Haliburton IN (stamina_rule2)

[10:14] Substitution (Team_050): LeBron Bridges OUT → Luka Gasol IN (stamina_rule2)

[10:14] Substitution (Team_050): Donovan Trent OUT → Tyler Smith IN (stamina_rule2)

[09:58] Team_050 possession (Score: 27-29)
Tyler Smith drives to the basket... Tyler Smith throws a bad pass! Stolen by Klay Haliburton! TURNOVER! (live ball)

[09:39] Team_060 possession (Score: 27-29)
Klay Haliburton attempts a 3Pt. Contested by Tyler Smith (5.5 feet, MAN). Klay Haliburton misses. Offensive rebound by Domantas Barnes! Domantas Barnes kicks it out.

[09:24] Team_060 possession (Score: 27-29)
Jarrett Wagner makes the Layup and draws the foul on Tyler Smith! And-1! Jarrett Wagner to the line for 1. [Team fouls: 1] (Tyler Smith: 1 personal fouls)   FT 1/1: GOOD Jarrett Wagner makes 1/1 from the line.
Score: 30-29

[09:10] Team_050 possession (Score: 30-29)
Luka Gasol attempts a Midrange. BLOCKED BY JARRETT WAGNER! Ball is loose! Rebound secured by Klay Haliburton.

[08:55] Team_060 possession (Score: 30-29)
Jarrett Wagner attempts a 3Pt. Contested by Giannis LaVine (4.4 feet, ZONE). Jarrett Wagner misses. Rebound secured by Joel Banchero.

[08:37] Team_050 possession (Score: 30-29)
Collin Bane makes the Dunk and draws the foul on Julius Green! And-1! Collin Bane to the line for 1. [Team fouls: 2] (Julius Green: 2 personal fouls)   FT 1/1: GOOD Collin Bane makes 1/1 from the line.
Score: 30-32

[08:17] Team_060 possession (Score: 30-32)
Domantas Barnes attempts a Midrange. Contested by Giannis LaVine (4.3 feet, MAN). Domantas Barnes misses. Rebound secured by Collin Bane.

[08:02] Team_050 possession (Score: 30-32)
FOUL! Holding foul on Julius Green. [Team fouls: 3] No free throws, side out. (Julius Green: 3 personal fouls)

[07:50] Team_050 possession (Score: 30-32)
Tyler Smith attempts a Midrange. Contested by Julius Green (4.6 feet, ZONE). Tyler Smith misses. Offensive rebound by Joel Banchero! Joel Banchero kicks it out.

[07:31] Team_050 possession (Score: 30-32)
Collin Bane attempts a 3Pt. Contested by Jarrett Wagner (4.9 feet, MAN). Collin Bane misses. Rebound secured by Klay Haliburton.

[07:17] Team_060 possession (Score: 30-32)
Domantas Barnes attempts a 3Pt. Contested by Giannis LaVine (4.4 feet, MAN). Domantas Barnes misses. Offensive rebound by Domantas Barnes! Domantas Barnes kicks it out.

[07:04] Team_060 possession (Score: 30-32)
Domantas Barnes attempts a 3Pt. Contested by Giannis LaVine (4.4 feet, MAN). DOMANTAS BARNES MAKES IT!
Score: 33-32

[06:49] Team_050 possession (Score: 33-32)
Joel Banchero attempts a 3Pt. Contested by Julius Green (4.2 feet, MAN). Joel Banchero misses. Rebound secured by Yao Tatum.

[06:32] Team_060 possession (Score: 33-32)
Domantas Barnes drives, Giannis LaVine stays with him. Domantas Barnes attempts a Dunk. Contested by Giannis LaVine (4.5 feet, MAN). DOMANTAS BARNES MAKES IT! Assist: Yao Tatum
Score: 35-32

[06:14] Team_050 possession (Score: 35-32)
Joel Banchero drives and kicks out. Luka Gasol attempts a 3Pt. Contested by Yao Tatum (5.2 feet, MAN). Luka Gasol misses. Rebound secured by Domantas Barnes.

[05:58] Team_060 possession (Score: 35-32)
Domantas Barnes throws a bad pass out of bounds! TURNOVER! (dead ball)

[05:58] Substitution (Team_060): Julius Green OUT → Rudy Ginobili IN (stamina_rule2)

[05:58] Substitution (Team_050): Giannis LaVine OUT → Damian O'Neal IN (stamina_rule2)

[05:58] Substitution (Team_050): Joel Banchero OUT → Dwyane Towns IN (stamina_rule2)

[05:58] Substitution (Team_050): Collin Bane OUT → Larry Curry IN (stamina_rule2)

[05:45] Team_050 possession (Score: 35-32)
Tyler Smith drives and kicks out. Larry Curry attempts a Midrange. Contested by Yao Tatum (5.2 feet, ZONE). LARRY CURRY MAKES IT! Assist: Damian O'Neal
Score: 35-34

[05:31] Team_060 possession (Score: 35-34)
Yao Tatum makes the Midrange and draws the foul on Luka Gasol! And-1! Yao Tatum to the line for 1. [Team fouls: 2] (Luka Gasol: 1 personal fouls)   FT 1/1: MISS Yao Tatum makes 0/1 from the line. Rebound secured by Dwyane Towns.
Score: 37-34

[05:15] Team_050 possession (Score: 37-34)
Luka Gasol attempts a 3Pt. Contested by Domantas Barnes (4.6 feet, ZONE). Luka Gasol misses. Rebound secured by Rudy Ginobili.

[04:58] Team_060 possession (Score: 37-34)
Jarrett Wagner drives, Larry Curry stays with him. Jarrett Wagner attempts a Dunk. Contested by Larry Curry (5.0 feet, MAN). Jarrett Wagner misses. Offensive rebound by Klay Haliburton! Klay Haliburton puts it back in!
Score: 39-34

[04:44] Team_050 possession (Score: 39-34)
Luka Gasol drives, Klay Haliburton stays with him. Luka Gasol attempts a Layup. Contested by Klay Haliburton (4.3 feet, ZONE). LUKA GASOL MAKES IT! Assist: Tyler Smith
Score: 39-36

[04:28] Team_060 possession (Score: 39-36)
Domantas Barnes attempts a 3Pt. Wide open! Damian O'Neal is 6.3 feet away. [MAN] Domantas Barnes misses. Rebound secured by Tyler Smith.

[04:18] Team_050 possession (Score: 39-36)
Luka Gasol attempts a 3Pt. Contested by Domantas Barnes (4.6 feet, ZONE). Luka Gasol misses. Rebound secured by Klay Haliburton.

[04:04] Team_060 possession (Score: 39-36)
Rudy Ginobili attempts a Layup. Contested by Luka Gasol (5.2 feet, ZONE). RUDY GINOBILI MAKES IT!
Score: 41-36

[03:48] Team_050 possession (Score: 41-36)
Larry Curry attempts a Layup. Contested by Jarrett Wagner (4.9 feet, MAN). LARRY CURRY MAKES IT! Assist: Damian O'Neal
Score: 41-38

[03:36] Team_060 possession (Score: 41-38)
FOUL! Reach-in foul on Tyler Smith during the drive. [Team fouls: 3] No free throws, side out. (Tyler Smith: 2 personal fouls)

[03:21] Team_060 possession (Score: 41-38)
Domantas Barnes attempts a 3Pt. Wide open! Damian O'Neal is 6.3 feet away. [MAN] DOMANTAS BARNES MAKES IT! Assist: Rudy Ginobili
Score: 44-38

[03:06] Team_050 possession (Score: 44-38)
Larry Curry drives and kicks out. Tyler Smith attempts a 3Pt. Contested by Domantas Barnes (4.6 feet, ZONE). Tyler Smith misses. Offensive rebound by Larry Curry! Larry Curry kicks it out.

[02:52] Team_050 possession (Score: 44-38)
Larry Curry attempts a 3Pt. Contested by Jarrett Wagner (5.0 feet, MAN). Larry Curry misses. Rebound secured by Domantas Barnes.

[02:34] Team_060 possession (Score: 44-38)
FOUL! Offensive foul on Klay Haliburton! Tyler Smith drew the charge! [Team fouls: 4] (Klay Haliburton: 1 personal fouls) TURNOVER! (dead ball)

[02:19] Team_050 possession (Score: 44-38)
Tyler Smith commits a violation (traveling/carry)! TURNOVER! (dead ball)

[02:05] Team_060 possession (Score: 44-38)
Jarrett Wagner throws a bad pass out of bounds! TURNOVER! (dead ball)

[01:50] Team_050 possession (Score: 44-38)
Damian O'Neal makes the Layup and draws the foul on Domantas Barnes! And-1! Damian O'Neal to the line for 1. [BONUS: 5 team fouls] (Domantas Barnes: 1 personal fouls)   FT 1/1: MISS Damian O'Neal makes 0/1 from the line. Rebound secured by Klay Haliburton.
Score: 44-40

[01:37] Team_060 possession (Score: 44-40)
Klay Haliburton drives to the basket... FOUL! Offensive foul on Klay Haliburton! Tyler Smith drew the charge! [Team fouls: 6] (Klay Haliburton: 2 personal fouls) TURNOVER! (dead ball)

[01:27] Team_050 possession (Score: 44-40)
Luka Gasol attempts a 3Pt. Contested by Domantas Barnes (4.7 feet, ZONE). Luka Gasol misses. Rebound secured by Rudy Ginobili.

[01:16] Team_060 possession (Score: 44-40)
Jarrett Wagner attempts a Layup. Contested by Tyler Smith (5.6 feet, ZONE). Jarrett Wagner misses. Rebound secured by Larry Curry.

[01:03] Team_050 possession (Score: 44-40)
Luka Gasol attempts a Midrange. Contested by Jarrett Wagner (5.0 feet, ZONE). Luka Gasol misses. Rebound secured by Domantas Barnes.

[00:46] Team_060 possession (Score: 44-40)
Yao Tatum makes the 3Pt and draws the foul on Luka Gasol! And-1! Yao Tatum to the line for 1. [Team fouls: 4] (Luka Gasol: 2 personal fouls)   FT 1/1: GOOD Yao Tatum makes 1/1 from the line.
Score: 48-40

[00:36] Team_050 possession (Score: 48-40)
Luka Gasol makes the Layup and draws the foul on Klay Haliburton! And-1! Luka Gasol to the line for 1. [BONUS: 7 team fouls] (Klay Haliburton: 3 personal fouls)   FT 1/1: GOOD Luka Gasol makes 1/1 from the line.
Score: 48-43

[00:23] Team_060 possession (Score: 48-43)
Yao Tatum drives to the basket... Yao Tatum throws a bad pass out of bounds! TURNOVER! (dead ball)

[00:07] Team_050 possession (Score: 48-43)
Tyler Smith drives, Klay Haliburton stays with him. Tyler Smith attempts a Dunk. Contested by Klay Haliburton (5.0 feet, MAN). Tyler Smith misses. Rebound secured by Klay Haliburton.

================================================================================
                              2ND QUARTER COMPLETE                              
================================================================================

2ND QUARTER SCORE: Team_060 26, Team_050 21

BOX SCORE:
================================================================================

Team_060
--------------------------------------------------------------------------------
Player                MIN  PTS  REB  AST  TO      FG   FG%      3P   3P%
--------------------------------------------------------------------------------
Domantas Barnes        12    8    5    0   0   3/5    60.0     0/0   0.0
Yao Tatum              12    4    1    1   0   1/2    50.0     0/0   0.0
Larry Westbrook        12    3    1    0   0   1/1   100.0     0/0   0.0
Jarrett Wagner         10    3    0    0   0   1/3    33.3     0/0   0.0
Immanuel Ming          14    2    1    1   0   1/1   100.0     0/0   0.0
Klay Haliburton        12    2    6    0   0   1/1   100.0     0/0   0.0
Rudy Ginobili           8    2    2    1   0   1/1   100.0     0/0   0.0
Jaren George           12    0    0    1   0   0/0     0.0     0/0   0.0

TEAM: FG: 9/14 (64.3%), 3PT: 4/6 (66.7%), REB: 16 (4 off, 12 def), AST: 4, TO: 7
TEAM FOULS: 7 [Team_050 in BONUS]


Team_050
--------------------------------------------------------------------------------
Player                MIN  PTS  REB  AST  TO      FG   FG%      3P   3P%
--------------------------------------------------------------------------------
Luka Gasol             12    5    0    0   0   2/7    28.6     0/0   0.0
Larry Curry             8    4    2    0   0   2/3    66.7     0/0   0.0
Giannis LaVine         17    3    0    0   0   1/1   100.0     0/0   0.0
Collin Bane            17    3    1    0   0   1/2    50.0     0/0   0.0
LeBron Bridges         12    2    0    1   0   1/1   100.0     0/0   0.0
Joel Banchero          17    0    2    0   0   0/3     0.0     0/0   0.0
Damian O'Neal           8    0    0    2   0   0/1     0.0     0/0   0.0
Dwyane Towns            8    0    1    0   0   0/0     0.0     0/0   0.0
Tyler Smith            12    0    1    1   0   0/1     0.0     0/0   0.0

TEAM: FG: 7/19 (36.8%), 3PT: 1/7 (14.3%), REB: 7 (2 off, 5 def), AST: 4, TO: 2
TEAM FOULS: 4

================================================================================

================================================================================
                       3RD QUARTER - Team_060 vs Team_050                       
================================================================================

[12:00] Team_060 possession (Score: 48-43)
Larry Westbrook attempts a 3Pt. Contested by LeBron Bridges (4.7 feet, ZONE). Larry Westbrook misses. Rebound secured by LeBron Bridges.

[11:46] Team_050 possession (Score: 48-43)
LeBron Bridges drives to the basket... LeBron Bridges throws a bad pass out of bounds! TURNOVER! (dead ball)

[11:36] Team_060 possession (Score: 48-43)
Larry Westbrook attempts a Midrange. Contested by Collin Bane (4.6 feet, ZONE). Larry Westbrook misses. Offensive rebound by Jaren George! Jaren George puts it back in!
Score: 50-43

[11:24] Team_050 possession (Score: 50-43)
FOUL! Reach-in foul on Jaren George during the drive. [Team fouls: 1] No free throws, side out. (Jaren George: 1 personal fouls)

[11:07] Team_050 possession (Score: 50-43)
Donovan Trent drives to the basket... Donovan Trent throws a bad pass out of bounds! TURNOVER! (dead ball)

[10:56] Team_060 possession (Score: 50-43)
Joel Morant commits a violation (traveling/carry)! TURNOVER! (dead ball)

[10:40] Team_050 possession (Score: 50-43)
Collin Bane attempts a 3Pt. Contested by Immanuel Ming (3.8 feet, MAN). Collin Bane misses. Rebound secured by Jaren George.

[10:23] Team_060 possession (Score: 50-43)
Larry Westbrook drives, LeBron Bridges stays with him. Larry Westbrook attempts a Dunk. Contested by LeBron Bridges (4.7 feet, MAN). LARRY WESTBROOK MAKES IT!
Score: 52-43

[10:04] Team_050 possession (Score: 52-43)
Joel Banchero throws a bad pass out of bounds! TURNOVER! (dead ball)

[09:48] Team_060 possession (Score: 52-43)
Larry Westbrook attempts a 3Pt. Contested by LeBron Bridges (4.7 feet, MAN). Larry Westbrook misses. Rebound secured by LeBron Bridges.

[09:36] Team_050 possession (Score: 52-43)
Donovan Trent attempts a 3Pt. Contested by Julius Green (3.6 feet, ZONE). Donovan Trent misses. Rebound secured by Larry Westbrook.

[09:25] Team_060 possession (Score: 52-43)
Jaren George drives to the basket... Jaren George throws a bad pass out of bounds! TURNOVER! (dead ball)

[09:12] Team_050 possession (Score: 52-43)
Donovan Trent attempts a Midrange. Contested by Julius Green (3.6 feet, ZONE). Donovan Trent misses. Rebound secured by Larry Westbrook.

[08:57] Team_060 possession (Score: 52-43)
FOUL! Shooting foul on Collin Bane. Immanuel Ming to the line for 2 free throws. [Team fouls: 1] (Collin Bane: 1 personal fouls)   FT 1/2: GOOD   FT 2/2: GOOD Immanuel Ming makes 2/2 from the line.
Score: 54-43

[08:47] Team_050 possession (Score: 54-43)
Joel Banchero throws a bad pass out of bounds! TURNOVER! (dead ball)

[08:32] Team_060 possession (Score: 54-43)
Joel Morant attempts a 3Pt. Contested by Giannis LaVine (3.6 feet, MAN). Joel Morant misses. Offensive rebound by Jaren George! Jaren George puts it back in!
Score: 56-43

[08:16] Team_050 possession (Score: 56-43)
FOUL! Shooting foul on Jaren George. Donovan Trent to the line for 2 free throws. [Team fouls: 2] (Jaren George: 2 personal fouls)   FT 1/2: GOOD   FT 2/2: GOOD Donovan Trent makes 2/2 from the line.
Score: 56-45

[08:03] Team_060 possession (Score: 56-45)
Julius Green attempts a 3Pt. Contested by Collin Bane (3.9 feet, ZONE). JULIUS GREEN MAKES IT! Assist: Joel Morant
Score: 59-45

[07:47] Team_050 possession (Score: 59-45)
Joel Banchero attempts a 3Pt. Contested by Julius Green (3.6 feet, ZONE). Joel Banchero misses. Rebound secured by Immanuel Ming.

[07:35] Team_060 possession (Score: 59-45)
Joel Morant attempts a 3Pt. Contested by Giannis LaVine (3.6 feet, ZONE). Joel Morant misses. Rebound secured by Joel Banchero.

[07:19] Team_050 possession (Score: 59-45)
Joel Banchero attempts a Midrange. Contested by Julius Green (3.6 feet, MAN). Joel Banchero misses. Rebound secured by Jaren George.

[07:08] Team_060 possession (Score: 59-45)
Larry Westbrook drives, Donovan Trent stays with him. Larry Westbrook attempts a Dunk. Contested by Donovan Trent (5.3 feet, ZONE). LARRY WESTBROOK MAKES IT! Assist: Jaren George
Score: 61-45

[06:50] Team_050 possession (Score: 61-45)
Joel Banchero attempts a 3Pt. Contested by Julius Green (3.6 feet, ZONE). JOEL BANCHERO MAKES IT! Assist: LeBron Bridges
Score: 61-48

[06:34] Team_060 possession (Score: 61-48)
Jaren George attempts a Layup. Contested by Donovan Trent (5.0 feet, ZONE). JAREN GEORGE MAKES IT! Assist: Julius Green
Score: 63-48

[06:18] Team_050 possession (Score: 63-48)
Donovan Trent drives, Jaren George stays with him. Donovan Trent attempts a Layup. Contested by Jaren George (5.0 feet, MAN). Donovan Trent misses. Rebound secured by Immanuel Ming.

[06:05] Team_060 possession (Score: 63-48)
Joel Morant attempts a 3Pt. Contested by Giannis LaVine (3.6 feet, MAN). Joel Morant misses. Rebound secured by Collin Bane.

[05:47] Team_050 possession (Score: 63-48)
Joel Banchero makes the Layup and draws the foul on Julius Green! And-1! Joel Banchero to the line for 1. [Team fouls: 3] (Julius Green: 1 personal fouls)   FT 1/1: GOOD Joel Banchero makes 1/1 from the line.
Score: 63-51

[05:34] Team_060 possession (Score: 63-51)
Immanuel Ming attempts a 3Pt. Contested by Giannis LaVine (3.8 feet, ZONE). Immanuel Ming misses. Rebound secured by Collin Bane.

[05:22] Team_050 possession (Score: 63-51)
Collin Bane attempts a 3Pt. Contested by Immanuel Ming (3.8 feet, MAN). Collin Bane misses. Rebound secured by Jaren George.

[05:11] Team_060 possession (Score: 63-51)
Larry Westbrook attempts a Layup. Contested by Donovan Trent (5.4 feet, ZONE). LARRY WESTBROOK MAKES IT!
Score: 65-51

[04:54] Team_050 possession (Score: 65-51)
Collin Bane attempts a Midrange. Contested by Immanuel Ming (3.8 feet, MAN). Collin Bane misses. Offensive rebound by LeBron Bridges! LeBron Bridges kicks it out.

[04:40] Team_050 possession (Score: 65-51)
Donovan Trent drives, picks up Jaren George. Help arrives from Julius Green! Donovan Trent attempts a Dunk. Contested by Julius Green (5.1 feet, MAN). Donovan Trent misses. Offensive rebound by LeBron Bridges! LeBron Bridges kicks it out.

[04:27] Team_050 possession (Score: 65-51)
Joel Banchero drives, picks up Jaren George. Help arrives from Julius Green! Joel Banchero attempts a Layup. Contested by Julius Green (5.2 feet, ZONE). JOEL BANCHERO MAKES IT! Assist: Collin Bane
Score: 65-53

[04:12] Team_060 possession (Score: 65-53)
Jaren George drives, picks up Donovan Trent. Help arrives from Joel Banchero! Jaren George attempts a Layup. Contested by Joel Banchero (5.1 feet, ZONE). JAREN GEORGE MAKES IT! Assist: Immanuel Ming
Score: 67-53

[03:57] Team_050 possession (Score: 67-53)
LeBron Bridges drives and kicks out. Giannis LaVine attempts a 3Pt. Contested by Joel Morant (5.4 feet, MAN). Giannis LaVine misses. Rebound secured by Larry Westbrook.

[03:43] Team_060 possession (Score: 67-53)
Immanuel Ming attempts a 3Pt. Contested by Giannis LaVine (4.0 feet, ZONE). IMMANUEL MING MAKES IT! Assist: Joel Morant
Score: 70-53

[03:25] Team_050 possession (Score: 70-53)
LeBron Bridges attempts a 3Pt. Contested by Julius Green (4.1 feet, ZONE). LeBron Bridges misses. Rebound secured by Jaren George.

[03:08] Team_060 possession (Score: 70-53)
Immanuel Ming drives, Donovan Trent stays with him. Immanuel Ming attempts a Layup. Contested by Donovan Trent (5.0 feet, ZONE). IMMANUEL MING MAKES IT! Assist: Jaren George
Score: 72-53

[02:50] Team_050 possession (Score: 72-53)
Joel Banchero drives, Julius Green stays with him. Joel Banchero attempts a Layup. Contested by Julius Green (3.8 feet, MAN). JOEL BANCHERO MAKES IT! Assist: Donovan Trent
Score: 72-55

[02:38] Team_060 possession (Score: 72-55)
FOUL! Holding foul on Joel Banchero. [Team fouls: 2] No free throws, side out. (Joel Banchero: 1 personal fouls)

[02:26] Team_060 possession (Score: 72-55)
Jaren George attempts a Midrange. Contested by Donovan Trent (5.3 feet, MAN). Jaren George misses. Rebound secured by LeBron Bridges.

[02:07] Team_050 possession (Score: 72-55)
Joel Banchero drives, Julius Green stays with him. Joel Banchero attempts a Dunk. Contested by Julius Green (3.9 feet, MAN). JOEL BANCHERO MAKES IT!
Score: 72-57

[01:54] Team_060 possession (Score: 72-57)
Joel Morant attempts a Midrange. Contested by Giannis LaVine (3.9 feet, MAN). JOEL MORANT MAKES IT! Assist: Jaren George
Score: 74-57

[01:37] Team_050 possession (Score: 74-57)
LeBron Bridges attempts a 3Pt. Contested by Larry Westbrook (5.2 feet, MAN). LEBRON BRIDGES MAKES IT! Assist: Collin Bane
Score: 74-60

[01:23] Team_060 possession (Score: 74-60)
Julius Green drives to the basket... FOUL! Offensive foul on Julius Green! Donovan Trent drew the charge! [Team fouls: 4] (Julius Green: 2 personal fouls) TURNOVER! (dead ball)

[01:12] Team_050 possession (Score: 74-60)
Collin Bane throws a bad pass! Stolen by Immanuel Ming! TURNOVER! (live ball)

[00:57] Team_060 possession (Score: 74-60)
Joel Morant attempts a Midrange. Contested by Giannis LaVine (4.0 feet, MAN). JOEL MORANT MAKES IT!
Score: 76-60

[00:43] Team_050 possession (Score: 76-60)
Collin Bane attempts a Midrange. Contested by Immanuel Ming (4.2 feet, MAN). COLLIN BANE MAKES IT! Assist: Giannis LaVine
Score: 76-62

[00:28] Team_060 possession (Score: 76-62)
Jaren George attempts a Midrange. Contested by Donovan Trent (5.5 feet, MAN). Jaren George misses. Rebound secured by Joel Banchero.

[00:13] Team_050 possession (Score: 76-62)
Joel Banchero attempts a Midrange. Contested by Immanuel Ming (3.9 feet, ZONE). Joel Banchero misses. Rebound secured by Larry Westbrook.

================================================================================
                              3RD QUARTER COMPLETE                              
================================================================================

3RD QUARTER SCORE: Team_060 28, Team_050 19

BOX SCORE:
================================================================================

Team_060
--------------------------------------------------------------------------------
Player                MIN  PTS  REB  AST  TO      FG   FG%      3P   3P%
--------------------------------------------------------------------------------
Jaren George           24    8    6    3   0   4/6    66.7     0/0   0.0
Immanuel Ming          26    7    2    1   0   3/4    75.0     0/0   0.0
Larry Westbrook        24    6    4    0   0   3/5    60.0     0/0   0.0
Joel Morant            24    4    0    2   0   2/4    50.0     0/0   0.0
Julius Green           29    3    0    1   0   1/1   100.0     0/0   0.0

TEAM: FG: 13/20 (65.0%), 3PT: 3/8 (37.5%), REB: 12 (2 off, 10 def), AST: 7, TO: 3
TEAM FOULS: 4


Team_050
--------------------------------------------------------------------------------
Player                MIN  PTS  REB  AST  TO      FG   FG%      3P   3P%
--------------------------------------------------------------------------------
Joel Banchero          29   12    2    0   0   5/8    62.5     0/0   0.0
LeBron Bridges         24    3    5    1   0   1/3    33.3     0/0   0.0
Collin Bane            29    2    2    2   0   1/3    33.3     0/0   0.0
Donovan Trent          24    2    0    1   0   1/4    25.0     0/0   0.0
Giannis LaVine         29    0    0    1   0   0/0     0.0     0/0   0.0

TEAM: FG: 8/18 (44.4%), 3PT: 2/7 (28.6%), REB: 9 (2 off, 7 def), AST: 5, TO: 5
TEAM FOULS: 2

================================================================================

================================================================================
                       4TH QUARTER - Team_060 vs Team_050                       
================================================================================

[12:00] Team_060 possession (Score: 76-62)
Jaren George drives to the basket... Jaren George loses the ball! Stripped by Donovan Trent! TURNOVER! (live ball)

[11:45] Team_050 possession (Score: 76-62)
Collin Bane loses control! Ball rolls out of bounds! TURNOVER! (dead ball)

[11:45] Substitution (Team_060): Joel Morant OUT → Domantas Barnes IN (stamina_rule2)

[11:45] Substitution (Team_060): Julius Green OUT → Rudy Ginobili IN (stamina_rule2)

[11:45] Substitution (Team_060): Larry Westbrook OUT → Yao Tatum IN (stamina_rule2)

[11:45] Substitution (Team_060): Jaren George OUT → Klay Haliburton IN (stamina_rule2)

[11:45] Substitution (Team_050): Giannis LaVine OUT → Damian O'Neal IN (stamina_rule2)

[11:45] Substitution (Team_050): Joel Banchero OUT → Dwyane Towns IN (stamina_rule2)

[11:45] Substitution (Team_050): Collin Bane OUT → Larry Curry IN (stamina_rule2)

[11:45] Substitution (Team_050): LeBron Bridges OUT → Luka Gasol IN (stamina_rule2)

[11:45] Substitution (Team_050): Donovan Trent OUT → Tyler Smith IN (stamina_rule2)

[11:33] Team_060 possession (Score: 76-62)
Rudy Ginobili attempts a Layup. Contested by Tyler Smith (5.5 feet, ZONE). RUDY GINOBILI MAKES IT! Assist: Immanuel Ming
Score: 78-62

[11:16] Team_050 possession (Score: 78-62)
FOUL! Shooting foul on Klay Haliburton. Tyler Smith to the line for 2 free throws. [Team fouls: 1] (Klay Haliburton: 1 personal fouls)   FT 1/2: GOOD   FT 2/2: GOOD Tyler Smith makes 2/2 from the line.
Score: 78-64

[11:01] Team_060 possession (Score: 78-64)
Immanuel Ming attempts a Layup. Contested by Larry Curry (4.8 feet, MAN). Immanuel Ming misses. Rebound secured by Tyler Smith.

[10:49] Team_050 possession (Score: 78-64)
Larry Curry attempts a 3Pt. Contested by Immanuel Ming (4.1 feet, MAN). Larry Curry misses. Rebound secured by Domantas Barnes.

[10:35] Team_060 possession (Score: 78-64)
Domantas Barnes loses the ball! Stripped by Damian O'Neal! TURNOVER! (live ball)

[10:21] Team_050 possession (Score: 78-64)
Damian O'Neal attempts a 3Pt. Contested by Domantas Barnes (4.7 feet, MAN). Damian O'Neal misses. Rebound secured by Domantas Barnes.

[10:02] Team_060 possession (Score: 78-64)
FOUL! Holding foul on Dwyane Towns. [Team fouls: 1] No free throws, side out. (Dwyane Towns: 1 personal fouls)

[09:47] Team_060 possession (Score: 78-64)
Immanuel Ming attempts a Midrange. Contested by Larry Curry (4.8 feet, ZONE). Immanuel Ming misses. Offensive rebound by Klay Haliburton! Klay Haliburton puts it back in!
Score: 80-64

[09:36] Team_050 possession (Score: 80-64)
Dwyane Towns attempts a 3Pt. Contested by Rudy Ginobili (4.6 feet, MAN). Dwyane Towns misses. Rebound secured by Immanuel Ming.

[09:18] Team_060 possession (Score: 80-64)
Domantas Barnes attempts a Layup. Contested by Tyler Smith (5.2 feet, ZONE). DOMANTAS BARNES MAKES IT! Assist: Klay Haliburton
Score: 82-64

[09:04] Team_050 possession (Score: 82-64)
Damian O'Neal attempts a Midrange. Contested by Immanuel Ming (4.3 feet, ZONE). DAMIAN O'NEAL MAKES IT! Assist: Larry Curry
Score: 82-66

[08:50] Team_060 possession (Score: 82-66)
Domantas Barnes drives and kicks out. Rudy Ginobili attempts a Midrange. Contested by Dwyane Towns (4.3 feet, ZONE). RUDY GINOBILI MAKES IT! Assist: Yao Tatum
Score: 84-66

[08:38] Team_050 possession (Score: 84-66)
FOUL! Holding foul on Immanuel Ming. [Team fouls: 2] No free throws, side out. (Immanuel Ming: 1 personal fouls)

[08:25] Team_050 possession (Score: 84-66)
FOUL! Shooting foul on Klay Haliburton. Tyler Smith to the line for 2 free throws. [Team fouls: 3] (Klay Haliburton: 2 personal fouls)   FT 1/2: GOOD   FT 2/2: GOOD Tyler Smith makes 2/2 from the line.
Score: 84-68

[08:08] Team_060 possession (Score: 84-68)
Rudy Ginobili throws a bad pass! Stolen by Dwyane Towns! TURNOVER! (live ball)

[07:53] Team_050 possession (Score: 84-68)
Larry Curry drives and kicks out. Tyler Smith attempts a Midrange. Contested by Immanuel Ming (4.4 feet, ZONE). Tyler Smith misses. Rebound secured by Klay Haliburton.

[07:37] Team_060 possession (Score: 84-68)
Domantas Barnes drives to the basket... Domantas Barnes loses control! Ball rolls out of bounds! TURNOVER! (dead ball)

[07:37] Substitution (Team_060): Immanuel Ming OUT → Jarrett Wagner IN (stamina_rule2)

[07:27] Team_050 possession (Score: 84-68)
Dwyane Towns attempts a 3Pt. Contested by Rudy Ginobili (4.6 feet, MAN). Dwyane Towns misses. Rebound secured by Domantas Barnes.

[07:13] Team_060 possession (Score: 84-68)
Rudy Ginobili drives and kicks out. Yao Tatum attempts a Midrange. Contested by Dwyane Towns (4.3 feet, ZONE). Yao Tatum misses. Rebound secured by Dwyane Towns.

[06:59] Team_050 possession (Score: 84-68)
Tyler Smith drives and kicks out. Damian O'Neal attempts a Midrange. Contested by Domantas Barnes (4.6 feet, MAN). Damian O'Neal misses. Rebound secured by Domantas Barnes.

[06:47] Team_060 possession (Score: 84-68)
FOUL! Reach-in foul on Tyler Smith during the drive. [Team fouls: 2] No free throws, side out. (Tyler Smith: 1 personal fouls)

[06:34] Team_060 possession (Score: 84-68)
Yao Tatum attempts a Midrange. Contested by Luka Gasol (4.9 feet, MAN). YAO TATUM MAKES IT!
Score: 86-68

[06:21] Team_050 possession (Score: 86-68)
Tyler Smith drives, Klay Haliburton stays with him. Tyler Smith attempts a Dunk. Contested by Klay Haliburton (4.6 feet, ZONE). TYLER SMITH MAKES IT! Assist: Dwyane Towns
Score: 86-70

[06:09] Team_060 possession (Score: 86-70)
Jarrett Wagner attempts a Layup. Contested by Luka Gasol (5.1 feet, ZONE). JARRETT WAGNER MAKES IT!
Score: 88-70

[05:58] Team_050 possession (Score: 88-70)
Tyler Smith attempts a 3Pt. Contested by Klay Haliburton (4.6 feet, MAN). Tyler Smith misses. Rebound secured by Domantas Barnes.

[05:44] Team_060 possession (Score: 88-70)
Yao Tatum drives, Luka Gasol stays with him. Yao Tatum attempts a Layup. Contested by Luka Gasol (4.9 feet, MAN). YAO TATUM MAKES IT!
Score: 90-70

[05:31] Team_050 possession (Score: 90-70)
Luka Gasol makes the Layup and draws the foul on Klay Haliburton! And-1! Luka Gasol to the line for 1. [Team fouls: 4] (Klay Haliburton: 3 personal fouls)   FT 1/1: GOOD Luka Gasol makes 1/1 from the line.
Score: 90-73

[05:18] Team_060 possession (Score: 90-73)
Domantas Barnes attempts a 3Pt. Contested by Luka Gasol (4.9 feet, ZONE). DOMANTAS BARNES MAKES IT! Assist: Rudy Ginobili
Score: 93-73

[05:05] Team_050 possession (Score: 93-73)
Dwyane Towns attempts a Midrange. Contested by Rudy Ginobili (4.6 feet, MAN). Dwyane Towns misses. Rebound secured by Klay Haliburton.

[04:52] Team_060 possession (Score: 93-73)
Yao Tatum attempts a 3Pt. Contested by Luka Gasol (5.0 feet, ZONE). Yao Tatum misses. Rebound secured by Dwyane Towns.

[04:34] Team_050 possession (Score: 93-73)
Larry Curry makes the Layup and draws the foul on Jarrett Wagner! And-1! Larry Curry to the line for 1. [BONUS: 5 team fouls] (Jarrett Wagner: 1 personal fouls)   FT 1/1: MISS Larry Curry makes 0/1 from the line. Rebound secured by Rudy Ginobili.
Score: 93-75

[04:20] Team_060 possession (Score: 93-75)
Domantas Barnes drives and kicks out. FOUL! Shooting foul on Tyler Smith. Klay Haliburton to the line for 2 free throws. [Team fouls: 3] (Tyler Smith: 2 personal fouls)   FT 1/2: GOOD   FT 2/2: GOOD Klay Haliburton makes 2/2 from the line.
Score: 95-75

[04:04] Team_050 possession (Score: 95-75)
Dwyane Towns attempts a Midrange. Contested by Rudy Ginobili (4.6 feet, MAN). Dwyane Towns misses. Rebound secured by Domantas Barnes.

[03:48] Team_060 possession (Score: 95-75)
Jarrett Wagner attempts a Layup. Contested by Tyler Smith (5.5 feet, ZONE). JARRETT WAGNER MAKES IT!
Score: 97-75

[03:37] Team_050 possession (Score: 97-75)
Damian O'Neal loses the ball! Stripped by Domantas Barnes! TURNOVER! (live ball)

[03:20] Team_060 possession (Score: 97-75)
FOUL! Shooting foul on Dwyane Towns. Yao Tatum to the line for 2 free throws. [Team fouls: 4] (Dwyane Towns: 2 personal fouls)   FT 1/2: GOOD   FT 2/2: GOOD Yao Tatum makes 2/2 from the line.
Score: 99-75

[03:03] Team_050 possession (Score: 99-75)
Damian O'Neal attempts a Layup. BLOCKED BY DOMANTAS BARNES! Ball is loose! Rebound secured by Domantas Barnes.

[02:43] Team_060 possession (Score: 99-75)
Yao Tatum attempts a Midrange. Contested by Luka Gasol (5.1 feet, MAN). Yao Tatum misses. Rebound secured by Larry Curry.

[02:26] Team_050 possession (Score: 99-75)
Luka Gasol attempts a Layup. BLOCKED BY KLAY HALIBURTON! Ball is loose! Rebound secured by Rudy Ginobili.

[02:10] Team_060 possession (Score: 99-75)
Domantas Barnes makes the Midrange and draws the foul on Larry Curry! And-1! Domantas Barnes to the line for 1. [BONUS: 5 team fouls] (Larry Curry: 1 personal fouls)   FT 1/1: MISS Domantas Barnes makes 0/1 from the line. Offensive rebound by Klay Haliburton! Klay Haliburton's putback is no good.
Score: 101-75

[01:58] Team_050 possession (Score: 101-75)
Luka Gasol attempts a 3Pt. Contested by Domantas Barnes (4.8 feet, ZONE). Luka Gasol misses. Rebound secured by Klay Haliburton.

[01:42] Team_060 possession (Score: 101-75)
Rudy Ginobili attempts a 3Pt. Contested by Luka Gasol (5.5 feet, ZONE). RUDY GINOBILI MAKES IT! Assist: Klay Haliburton
Score: 104-75

[01:28] Team_050 possession (Score: 104-75)
Tyler Smith attempts a Layup. Contested by Klay Haliburton (4.9 feet, ZONE). Tyler Smith misses. FOUL! Loose ball foul on Rudy Ginobili during the rebound battle. [IN THE BONUS! 6 team fouls] Dwyane Towns to the line for 2 free throws. (Rudy Ginobili: 1 personal fouls)   FT 1/2: MISS   FT 2/2: GOOD Dwyane Towns makes 1/2 from the line.
Score: 104-76

[01:09] Team_060 possession (Score: 104-76)
Rudy Ginobili drives and kicks out. Yao Tatum attempts a 3Pt. Contested by Luka Gasol (5.3 feet, ZONE). Yao Tatum misses. Rebound secured by Tyler Smith.

[00:57] Team_050 possession (Score: 104-76)
FOUL! Holding foul on Klay Haliburton. [IN THE BONUS! 7 team fouls] Tyler Smith to the line for 2 free throws. (Klay Haliburton: 4 personal fouls)   FT 1/2: GOOD   FT 2/2: GOOD Tyler Smith makes 2/2 from the line.
Score: 104-78

[00:43] Team_060 possession (Score: 104-78)
Klay Haliburton loses control! Ball rolls out of bounds! TURNOVER! (dead ball)

[00:28] Team_050 possession (Score: 104-78)
Damian O'Neal attempts a 3Pt. Contested by Domantas Barnes (5.0 feet, MAN). Damian O'Neal misses. Rebound secured by Klay Haliburton.

[00:10] Team_060 possession (Score: 104-78)
Rudy Ginobili attempts a Midrange. Contested by Dwyane Towns (4.9 feet, ZONE). RUDY GINOBILI MAKES IT! Assist: Domantas Barnes
Score: 106-78

================================================================================
                              4TH QUARTER COMPLETE                              
================================================================================

4TH QUARTER SCORE: Team_060 30, Team_050 16

BOX SCORE:
================================================================================

Team_060
--------------------------------------------------------------------------------
Player                MIN  PTS  REB  AST  TO      FG   FG%      3P   3P%
--------------------------------------------------------------------------------
Rudy Ginobili          19    9    2    1   0   4/6    66.7     0/0   0.0
Yao Tatum              23    6    0    1   0   3/5    60.0     0/0   0.0
Domantas Barnes        23    5    7    1   0   2/3    66.7     0/0   0.0
Klay Haliburton        23    4    6    2   0   2/2   100.0     0/0   0.0
Jarrett Wagner         18    4    0    0   0   2/2   100.0     0/0   0.0
Immanuel Ming          31    0    1    1   0   0/1     0.0     0/0   0.0

TEAM: FG: 13/19 (68.4%), 3PT: 2/3 (66.7%), REB: 15 (1 off, 14 def), AST: 6, TO: 5
TEAM FOULS: 7 [Team_050 in BONUS]


Team_050
--------------------------------------------------------------------------------
Player                MIN  PTS  REB  AST  TO      FG   FG%      3P   3P%
--------------------------------------------------------------------------------
Tyler Smith            23    8    2    0   0   4/6    66.7     0/0   0.0
Luka Gasol             23    3    0    0   0   1/3    33.3     0/0   0.0
Damian O'Neal          19    2    0    0   0   1/4    25.0     0/0   0.0
Dwyane Towns           19    1    2    1   0   1/5    20.0     0/0   0.0
Larry Curry            19    0    1    1   0   0/3     0.0     0/0   0.0

TEAM: FG: 7/21 (33.3%), 3PT: 0/7 (0.0%), REB: 6 (0 off, 6 def), AST: 2, TO: 2
TEAM FOULS: 5 [Team_060 in BONUS]

================================================================================

================================================================================
                               FULL GAME COMPLETE                               
================================================================================

FINAL SCORE: Team_060 106, Team_050 78

SCORING BY QUARTER:
--------------------------------------------------------------------------------
Team                     Q1     Q2     Q3     Q4    FINAL
--------------------------------------------------------------------------------
Team_060                 22     26     28     30      106
Team_050                 22     21     19     16       78
--------------------------------------------------------------------------------

FULL GAME BOX SCORE:
================================================================================

Team_060
--------------------------------------------------------------------------------
Player                MIN  PTS  REB  AST  TO      FG   FG%      3P   3P%      FT STL BLK
--------------------------------------------------------------------------------
Immanuel Ming          31    9    9    4   1   5/8    62.5   1/2    50.0   2/2     1   0
Julius Green           29    3    0    3   2   2/5    40.0   2/3    66.7   0/0     0   1
Joel Morant            25   11    0    3   2   7/9    77.8   2/4    50.0   2/2     0   0
Larry Westbrook        25   14    7    0   1   7/14   50.0   2/6    33.3   2/4     0   0
Jaren George           25   14   10    5   1   3/5    60.0   0/0     0.0   2/2     0   0
Domantas Barnes        23   13   13    1   4   7/10   70.0   3/4    75.0   0/1     1   2
Yao Tatum              23   10    1    2   1   4/7    57.1   1/2    50.0   3/4     0   0
Klay Haliburton        23    8   12    2   3   0/0     0.0   0/0     0.0   4/4     1   1
Rudy Ginobili          19   11    4    2   2   5/7    71.4   2/2   100.0   0/0     0   0
Jarrett Wagner         18    7    0    0   1   4/6    66.7   0/1     0.0   1/1     0   1

TEAM: FG: 44/71 (62.0%), 3PT: 13/24 (54.2%), REB: 55 (8 off, 47 def), AST: 22, TO: 18


Team_050
--------------------------------------------------------------------------------
Player                MIN  PTS  REB  AST  TO      FG   FG%      3P   3P%      FT STL BLK
--------------------------------------------------------------------------------
Giannis LaVine         29    7    0    1   0   2/2   100.0   1/1   100.0   0/0     0   0
Joel Banchero          29   18    8    2   2   7/17   41.2   2/7    28.6   2/3     0   0
Collin Bane            29    8   13    2   3   3/7    42.9   1/5    20.0   1/1     1   0
LeBron Bridges         25   10    6    2   2   6/9    66.7   1/2    50.0   1/1     0   0
Donovan Trent          25    4    0    3   1   1/6    16.7   0/1     0.0   4/5     1   0
Luka Gasol             23    8    0    0   0   3/10   30.0   0/4     0.0   2/2     0   0
Tyler Smith            23    8    3    1   1   5/8    62.5   0/1     0.0   6/6     0   0
Damian O'Neal          19    2    0    2   1   1/5    20.0   0/2     0.0   0/1     2   0
Dwyane Towns           19    1    3    1   0   0/4     0.0   0/2     0.0   1/2     1   0
Larry Curry            19    4    4    1   0   1/8    12.5   0/3     0.0   0/1     0   0

TEAM: FG: 30/77 (39.0%), 3PT: 5/28 (17.9%), REB: 38 (11 off, 27 def), AST: 15, TO: 10

================================================================================
