================================================================================
                        FULL GAME - Team_030 vs Team_098                        
================================================================================

================================================================================
                       1ST QUARTER - Team_030 vs Team_098                       
================================================================================

[12:00] Team_030 possession (Score: 0-0)
Jordan Nowitzki attempts a Midrange. Contested by Pascal Lillard (4.6 feet, MAN). Jordan Nowitzki misses. Rebound secured by Derrick Durant.

[11:50] Team_098 possession (Score: 0-0)
Blake Murray makes the Layup and draws the foul on Joel Anunoby! And-1! Blake Murray to the line for 1. [Team fouls: 1] (Joel Anunoby: 1 personal fouls)   FT 1/1: GOOD Blake Murray makes 1/1 from the line.
Score: 0-3

[11:35] Team_030 possession (Score: 0-3)
Joel Anunoby attempts a 3Pt. Contested by Blake Murray (4.8 feet, MAN). Joel Anunoby misses. Rebound secured by Derrick Durant.

[11:24] Team_098 possession (Score: 0-3)
Derrick Durant attempts a Midrange. Contested by Tim Barrett (5.0 feet, ZONE). Derrick Durant misses. Rebound secured by Joel Anunoby.

[11:11] Team_030 possession (Score: 0-3)
Tyler Beal attempts a 3Pt. Contested by Malcolm Tatum (4.2 feet, MAN). Tyler Beal misses. Rebound secured by Derrick Durant.

[10:52] Team_098 possession (Score: 0-3)
Pascal Lillard makes the Layup and draws the foul on Jordan Nowitzki! And-1! Pascal Lillard to the line for 1. [Team fouls: 2] (Jordan Nowitzki: 1 personal fouls)   FT 1/1: GOOD Pascal Lillard makes 1/1 from the line.
Score: 0-6

[10:37] Team_030 possession (Score: 0-6)
Tyler Beal attempts a 3Pt. Contested by Nikola Rose (3.4 feet, ZONE). Tyler Beal misses. Rebound secured by Nikola Rose.

[10:21] Team_098 possession (Score: 0-6)
Pascal Lillard makes the Layup and draws the foul on Jordan Nowitzki! And-1! Pascal Lillard to the line for 1. [Team fouls: 3] (Jordan Nowitzki: 2 personal fouls)   FT 1/1: GOOD Pascal Lillard makes 1/1 from the line.
Score: 0-9

[10:07] Team_030 possession (Score: 0-9)
Joel Anunoby attempts a 3Pt. Contested by Nikola Rose (3.5 feet, ZONE). Joel Anunoby misses. Rebound secured by Derrick Durant.

[09:57] Team_098 possession (Score: 0-9)
FOUL! Reach-in foul on Joel Anunoby during the drive. [Team fouls: 4] No free throws, side out. (Joel Anunoby: 2 personal fouls)

[09:39] Team_098 possession (Score: 0-9)
Blake Murray attempts a Midrange. Contested by Joel Anunoby (3.6 feet, MAN). BLAKE MURRAY MAKES IT!
Score: 0-11

[09:28] Team_030 possession (Score: 0-11)
FOUL! Shooting foul on Nikola Rose. Jaren Green to the line for 3 free throws. [Team fouls: 1] (Nikola Rose: 1 personal fouls)   FT 1/3: GOOD   FT 2/3: GOOD   FT 3/3: MISS Jaren Green makes 2/3 from the line. Rebound secured by Nikola Rose.
Score: 2-11

[09:16] Team_098 possession (Score: 2-11)
Pascal Lillard attempts a Midrange. Contested by Jordan Nowitzki (4.9 feet, ZONE). Pascal Lillard misses. Rebound secured by Joel Anunoby.

[08:57] Team_030 possession (Score: 2-11)
Jordan Nowitzki attempts a 3Pt. Contested by Nikola Rose (3.7 feet, ZONE). Jordan Nowitzki misses. Rebound secured by Pascal Lillard.

[08:42] Team_098 possession (Score: 2-11)
Pascal Lillard attempts a Midrange. Contested by Jordan Nowitzki (4.9 feet, MAN). PASCAL LILLARD MAKES IT! Assist: Derrick Durant
Score: 2-13

[08:29] Team_030 possession (Score: 2-13)
Tyler Beal attempts a 3Pt. Contested by Malcolm Tatum (4.2 feet, MAN). Tyler Beal misses. Rebound secured by Pascal Lillard.

[08:15] Team_098 possession (Score: 2-13)
Malcolm Tatum attempts a 3Pt. Contested by Tyler Beal (4.4 feet, ZONE). Malcolm Tatum misses. FOUL! Loose ball foul on Jordan Nowitzki during the rebound battle. [IN THE BONUS! 5 team fouls] Derrick Durant to the line for 2 free throws. (Jordan Nowitzki: 3 personal fouls)   FT 1/2: GOOD   FT 2/2: GOOD Derrick Durant makes 2/2 from the line.
Score: 2-15

[07:58] Team_030 possession (Score: 2-15)
Jordan Nowitzki throws a bad pass! Stolen by Pascal Lillard! TURNOVER! (live ball)

[07:44] Team_098 possession (Score: 2-15)
Blake Murray loses the ball! Stripped by Joel Anunoby! TURNOVER! (live ball)

[07:31] Team_030 possession (Score: 2-15)
Jaren Green drives, Derrick Durant stays with him. Jaren Green attempts a Layup. Contested by Derrick Durant (5.1 feet, MAN). JAREN GREEN MAKES IT! Assist: Tim Barrett
Score: 4-15

[07:17] Team_098 possession (Score: 4-15)
Blake Murray attempts a 3Pt. Contested by Joel Anunoby (3.6 feet, MAN). Blake Murray misses. Rebound secured by Jordan Nowitzki.

[07:03] Team_030 possession (Score: 4-15)
Joel Anunoby drives to the basket... Joel Anunoby loses the ball! Stripped by Blake Murray! TURNOVER! (live ball)

[06:43] Team_098 possession (Score: 4-15)
Blake Murray attempts a Midrange. Contested by Tim Barrett (4.9 feet, ZONE). Blake Murray misses. Rebound secured by Jaren Green.

[06:29] Team_030 possession (Score: 4-15)
Tyler Beal throws a bad pass! Stolen by Malcolm Tatum! TURNOVER! (live ball)

[06:15] Team_098 possession (Score: 4-15)
Blake Murray attempts a 3Pt. Contested by Tyler Beal (4.4 feet, ZONE). BLAKE MURRAY MAKES IT! Assist: Malcolm Tatum
Score: 4-18

[06:03] Team_030 possession (Score: 4-18)
Jaren Green drives, Pascal Lillard stays with him. Jaren Green attempts a Dunk. Contested by Pascal Lillard (4.9 feet, ZONE). Jaren Green misses. Rebound secured by Pascal Lillard.

[05:48] Team_098 possession (Score: 4-18)
Malcolm Tatum throws a bad pass out of bounds! TURNOVER! (dead ball)

[05:33] Team_030 possession (Score: 4-18)
Tyler Beal attempts a 3Pt. Contested by Malcolm Tatum (4.2 feet, MAN). TYLER BEAL MAKES IT! Assist: Tim Barrett
Score: 7-18

[05:16] Team_098 possession (Score: 7-18)
Blake Murray drives and kicks out. Pascal Lillard attempts a 3Pt. Contested by Jordan Nowitzki (4.3 feet, MAN). Pascal Lillard misses. Rebound secured by Jordan Nowitzki.

[05:03] Team_030 possession (Score: 7-18)
Tim Barrett attempts a Layup. Contested by Nikola Rose (3.2 feet, MAN). Tim Barrett misses. Rebound secured by Pascal Lillard.

[04:46] Team_098 possession (Score: 7-18)
Malcolm Tatum drives, picks up Tyler Beal. Help arrives from Joel Anunoby! Malcolm Tatum attempts a Dunk. Contested by Joel Anunoby (4.4 feet, MAN). MALCOLM TATUM MAKES IT! Assist: Nikola Rose
Score: 7-20

[04:36] Team_030 possession (Score: 7-20)
Tyler Beal attempts a 3Pt. Contested by Malcolm Tatum (4.2 feet, MAN). Tyler Beal misses. Rebound secured by Nikola Rose.

[04:20] Team_098 possession (Score: 7-20)
Malcolm Tatum attempts a 3Pt. Contested by Tyler Beal (4.5 feet, MAN). Malcolm Tatum misses. Rebound secured by Jordan Nowitzki.

[04:06] Team_030 possession (Score: 7-20)
Jaren Green attempts a Layup. Contested by Derrick Durant (5.3 feet, MAN). JAREN GREEN MAKES IT!
Score: 9-20

[03:49] Team_098 possession (Score: 9-20)
Malcolm Tatum attempts a Layup. Contested by Jaren Green (4.3 feet, ZONE). MALCOLM TATUM MAKES IT! Assist: Blake Murray
Score: 9-22

[03:36] Team_030 possession (Score: 9-22)
Tim Barrett attempts a 3Pt. Contested by Nikola Rose (3.3 feet, MAN). Tim Barrett misses. Rebound secured by Derrick Durant.

[03:22] Team_098 possession (Score: 9-22)
Nikola Rose makes the Layup and draws the foul on Tim Barrett! And-1! Nikola Rose to the line for 1. [BONUS: 6 team fouls] (Tim Barrett: 1 personal fouls)   FT 1/1: GOOD Nikola Rose makes 1/1 from the line.
Score: 9-25

[03:03] Team_030 possession (Score: 9-25)
Jordan Nowitzki drives and kicks out. FOUL! Shooting foul on Nikola Rose. Tim Barrett to the line for 2 free throws. [Team fouls: 2] (Nikola Rose: 2 personal fouls)   FT 1/2: GOOD   FT 2/2: GOOD Tim Barrett makes 2/2 from the line.
Score: 11-25

[02:46] Team_098 possession (Score: 11-25)
Malcolm Tatum makes the Layup and draws the foul on Tyler Beal! And-1! Malcolm Tatum to the line for 1. [BONUS: 7 team fouls] (Tyler Beal: 1 personal fouls)   FT 1/1: GOOD Malcolm Tatum makes 1/1 from the line.
Score: 11-28

[02:31] Team_030 possession (Score: 11-28)
Joel Anunoby drives, Pascal Lillard stays with him. Joel Anunoby attempts a Dunk. Contested by Pascal Lillard (4.6 feet, ZONE). JOEL ANUNOBY MAKES IT! Assist: Tim Barrett
Score: 13-28

[02:16] Team_098 possession (Score: 13-28)
Malcolm Tatum attempts a 3Pt. Contested by Tyler Beal (4.6 feet, ZONE). MALCOLM TATUM MAKES IT! Assist: Derrick Durant
Score: 13-31

[01:59] Team_030 possession (Score: 13-31)
Jordan Nowitzki attempts a 3Pt. Contested by Pascal Lillard (4.8 feet, MAN). Jordan Nowitzki misses. Offensive rebound by Jordan Nowitzki! Jordan Nowitzki kicks it out.

[01:45] Team_030 possession (Score: 13-31)
Tim Barrett attempts a 3Pt. Contested by Nikola Rose (3.4 feet, ZONE). TIM BARRETT MAKES IT! Assist: Tyler Beal
Score: 16-31

[01:33] Team_098 possession (Score: 16-31)
Derrick Durant attempts a Midrange. Contested by Jaren Green (4.5 feet, MAN). DERRICK DURANT MAKES IT! Assist: Malcolm Tatum
Score: 16-33

[01:21] Team_030 possession (Score: 16-33)
Tyler Beal drives to the basket... Tyler Beal commits a violation (traveling/carry)! TURNOVER! (dead ball)

[01:21] Substitution (Team_030): Tyler Beal OUT → RJ Carter IN (stamina_rule2)

[01:21] Substitution (Team_030): Tim Barrett OUT → Josh Smith IN (stamina_rule2)

[01:21] Substitution (Team_030): Joel Anunoby OUT → Pau James IN (stamina_rule2)

[01:21] Substitution (Team_030): Jordan Nowitzki OUT → Damian Green IN (stamina_rule2)

[01:21] Substitution (Team_030): Jaren Green OUT → Franz Anunoby IN (stamina_rule2)

[01:21] Substitution (Team_098): Malcolm Tatum OUT → Tracy Rose IN (stamina_rule2)

[01:21] Substitution (Team_098): Nikola Rose OUT → Dirk McCollum IN (stamina_rule2)

[01:21] Substitution (Team_098): Blake Murray OUT → Kristaps Iverson IN (stamina_rule2)

[01:21] Substitution (Team_098): Pascal Lillard OUT → Manu Jordan IN (stamina_rule2)

[01:21] Substitution (Team_098): Derrick Durant OUT → Russell McGrady IN (stamina_rule2)

[01:09] Team_098 possession (Score: 16-33)
Tracy Rose makes the Layup and draws the foul on Josh Smith! And-1! Tracy Rose to the line for 1. [BONUS: 8 team fouls] (Josh Smith: 1 personal fouls)   FT 1/1: GOOD Tracy Rose makes 1/1 from the line.
Score: 16-36

[00:58] Team_030 possession (Score: 16-36)
Josh Smith attempts a 3Pt. Contested by Dirk McCollum (4.3 feet, ZONE). Josh Smith misses. Rebound secured by Russell McGrady.

[00:42] Team_098 possession (Score: 16-36)
Russell McGrady attempts a Midrange. Contested by Franz Anunoby (4.3 feet, MAN). RUSSELL MCGRADY MAKES IT!
Score: 16-38

[00:32] Team_030 possession (Score: 16-38)
FOUL! Reach-in foul on Manu Jordan during the drive. [Team fouls: 3] No free throws, side out. (Manu Jordan: 1 personal fouls)

[00:17] Team_030 possession (Score: 16-38)
Josh Smith attempts a Layup. Contested by Russell McGrady (4.0 feet, ZONE). JOSH SMITH MAKES IT! Assist: Damian Green
Score: 18-38

[00:04] Team_098 possession (Score: 18-38)
Manu Jordan throws a bad pass out of bounds! TURNOVER! (dead ball)

================================================================================
                              1ST QUARTER COMPLETE                              
================================================================================

1ST QUARTER SCORE: Team_030 18, Team_098 38

BOX SCORE:
================================================================================

Team_030
--------------------------------------------------------------------------------
Player                MIN  PTS  REB  AST  TO      FG   FG%      3P   3P%
--------------------------------------------------------------------------------
Tim Barrett            11    5    0    3   0   2/4    50.0     0/0   0.0
Jaren Green            11    4    1    0   0   2/4    50.0     0/0   0.0
Tyler Beal             11    3    0    1   0   1/5    20.0     0/0   0.0
Joel Anunoby           11    2    2    0   0   1/3    33.3     0/0   0.0
Josh Smith              1    2    0    0   0   1/2    50.0     0/0   0.0
Jordan Nowitzki        11    0    4    0   0   0/2     0.0     0/0   0.0
Damian Green            1    0    0    1   0   0/0     0.0     0/0   0.0

TEAM: FG: 7/20 (35.0%), 3PT: 2/12 (16.7%), REB: 7 (1 off, 6 def), AST: 5, TO: 4
TEAM FOULS: 8 [Team_098 in BONUS]


Team_098
--------------------------------------------------------------------------------
Player                MIN  PTS  REB  AST  TO      FG   FG%      3P   3P%
--------------------------------------------------------------------------------
Malcolm Tatum          11   10    0    2   0   4/5    80.0     0/0   0.0
Blake Murray           11    8    0    1   0   3/6    50.0     0/0   0.0
Pascal Lillard         11    8    4    0   0   3/4    75.0     0/0   0.0
Derrick Durant         11    4    5    2   0   2/3    66.7     0/0   0.0
Nikola Rose            11    3    3    1   0   1/1   100.0     0/0   0.0
Tracy Rose              1    3    0    0   0   1/1   100.0     0/0   0.0
Russell McGrady         1    2    1    0   0   1/1   100.0     0/0   0.0

TEAM: FG: 15/21 (71.4%), 3PT: 3/5 (60.0%), REB: 13 (0 off, 13 def), AST: 6, TO: 3
TEAM FOULS: 3

================================================================================

================================================================================
                       2ND QUARTER - Team_030 vs Team_098                       
================================================================================

[12:00] Team_030 possession (Score: 18-38)
Tyler Beal attempts a 3Pt. Contested by Nikola Rose (3.5 feet, ZONE). Tyler Beal misses. Offensive rebound by Joel Anunoby! Joel Anunoby kicks it out.

[11:47] Team_030 possession (Score: 18-38)
Jordan Nowitzki drives, Pascal Lillard stays with him. Jordan Nowitzki attempts a Layup. Contested by Pascal Lillard (4.6 feet, ZONE). Jordan Nowitzki misses. Rebound secured by Nikola Rose.

[11:34] Team_098 possession (Score: 18-38)
FOUL! Reach-in foul on Jaren Green during the drive. [Team fouls: 1] No free throws, side out. (Jaren Green: 1 personal fouls)

[11:22] Team_098 possession (Score: 18-38)
Blake Murray attempts a Layup. BLOCKED BY JOEL ANUNOBY! Ball is loose! Rebound secured by Joel Anunoby.

[11:04] Team_030 possession (Score: 18-38)
Joel Anunoby makes the Layup and draws the foul on Pascal Lillard! And-1! Joel Anunoby to the line for 1. [Team fouls: 1] (Pascal Lillard: 1 personal fouls)   FT 1/1: GOOD Joel Anunoby makes 1/1 from the line.
Score: 21-38

[10:48] Team_098 possession (Score: 21-38)
Derrick Durant drives, Jaren Green stays with him. Derrick Durant attempts a Dunk. Contested by Jaren Green (4.4 feet, MAN). DERRICK DURANT MAKES IT! Assist: Pascal Lillard
Score: 21-40

[10:34] Team_030 possession (Score: 21-40)
Tim Barrett attempts a 3Pt. Contested by Nikola Rose (3.4 feet, MAN). TIM BARRETT MAKES IT!
Score: 24-40

[10:21] Team_098 possession (Score: 24-40)
Blake Murray drives, picks up Jaren Green. Help arrives from Tyler Beal! Blake Murray attempts a Layup. Contested by Tyler Beal (4.4 feet, ZONE). Blake Murray misses. Offensive rebound by Pascal Lillard! Pascal Lillard kicks it out.

[10:07] Team_098 possession (Score: 24-40)
Nikola Rose drives, Jaren Green stays with him. Nikola Rose attempts a Dunk. Contested by Jaren Green (4.6 feet, ZONE). NIKOLA ROSE MAKES IT!
Score: 24-42

[09:51] Team_030 possession (Score: 24-42)
Tyler Beal loses control! Ball rolls out of bounds! TURNOVER! (dead ball)

[09:51] Substitution (Team_030): Tyler Beal OUT → RJ Carter IN (stamina_rule2)

[09:51] Substitution (Team_030): Tim Barrett OUT → Josh Smith IN (stamina_rule2)

[09:51] Substitution (Team_030): Joel Anunoby OUT → Pau James IN (stamina_rule2)

[09:51] Substitution (Team_030): Jordan Nowitzki OUT → Damian Green IN (stamina_rule2)

[09:51] Substitution (Team_030): Jaren Green OUT → Franz Anunoby IN (stamina_rule2)

[09:51] Substitution (Team_098): Malcolm Tatum OUT → Tracy Rose IN (stamina_rule2)

[09:51] Substitution (Team_098): Nikola Rose OUT → Dirk McCollum IN (stamina_rule2)

[09:51] Substitution (Team_098): Blake Murray OUT → Kristaps Iverson IN (stamina_rule2)

[09:51] Substitution (Team_098): Pascal Lillard OUT → Manu Jordan IN (stamina_rule2)

[09:51] Substitution (Team_098): Derrick Durant OUT → Russell McGrady IN (stamina_rule2)

[09:37] Team_098 possession (Score: 24-42)
Kristaps Iverson attempts a Layup. Contested by Pau James (4.5 feet, MAN). KRISTAPS IVERSON MAKES IT! Assist: Tracy Rose
Score: 24-44

[09:21] Team_030 possession (Score: 24-44)
Pau James attempts a 3Pt. Contested by Dirk McCollum (4.2 feet, ZONE). Pau James misses. Rebound secured by Kristaps Iverson.

[09:02] Team_098 possession (Score: 24-44)
Kristaps Iverson attempts a 3Pt. Contested by Pau James (4.5 feet, MAN). KRISTAPS IVERSON MAKES IT! Assist: Manu Jordan
Score: 24-47

[08:43] Team_030 possession (Score: 24-47)
Josh Smith attempts a 3Pt. Contested by Dirk McCollum (4.3 feet, ZONE). Josh Smith misses. Rebound secured by Manu Jordan.

[08:27] Team_098 possession (Score: 24-47)
Dirk McCollum attempts a Layup. Contested by Josh Smith (4.7 feet, MAN). Dirk McCollum misses. Rebound secured by Franz Anunoby.

[08:14] Team_030 possession (Score: 24-47)
Josh Smith loses the ball! Stripped by Dirk McCollum! TURNOVER! (live ball)

[08:00] Team_098 possession (Score: 24-47)
Manu Jordan attempts a Midrange. Contested by Damian Green (5.4 feet, ZONE). Manu Jordan misses. Rebound secured by Damian Green.

[07:45] Team_030 possession (Score: 24-47)
Damian Green attempts a Layup. Contested by Russell McGrady (3.6 feet, ZONE). Damian Green misses. Rebound secured by Russell McGrady.

[07:34] Team_098 possession (Score: 24-47)
Manu Jordan commits a violation (traveling/carry)! TURNOVER! (dead ball)

[07:20] Team_030 possession (Score: 24-47)
Josh Smith attempts a Layup. BLOCKED BY DIRK MCCOLLUM! Ball goes out off Dirk McCollum. Josh Smith's ball!

[07:07] Team_030 possession (Score: 24-47)
Pau James attempts a 3Pt. Contested by Kristaps Iverson (4.0 feet, MAN). PAU JAMES MAKES IT! Assist: Franz Anunoby
Score: 27-47

[06:58] Team_098 possession (Score: 27-47)
Dirk McCollum drives, Damian Green stays with him. Dirk McCollum attempts a Dunk. Contested by Damian Green (5.2 feet, ZONE). Dirk McCollum misses. Rebound secured by Franz Anunoby.

[06:44] Team_030 possession (Score: 27-47)
Damian Green drives and kicks out. Josh Smith attempts a Midrange. Contested by Dirk McCollum (4.2 feet, MAN). Josh Smith misses. Rebound secured by Russell McGrady.

[06:31] Team_098 possession (Score: 27-47)
Russell McGrady attempts a 3Pt. Contested by RJ Carter (5.5 feet, ZONE). Russell McGrady misses. Rebound secured by Franz Anunoby.

[06:13] Team_030 possession (Score: 27-47)
Josh Smith attempts a Midrange. BLOCKED BY MANU JORDAN! Ball is loose! Rebound secured by Manu Jordan.

[06:01] Team_098 possession (Score: 27-47)
Kristaps Iverson drives, Pau James stays with him. Kristaps Iverson attempts a Layup. Contested by Pau James (4.5 feet, MAN). Kristaps Iverson misses. Rebound secured by Damian Green.

[05:44] Team_030 possession (Score: 27-47)
Josh Smith drives, Dirk McCollum stays with him. Josh Smith attempts a Dunk. Contested by Dirk McCollum (4.3 feet, MAN). JOSH SMITH MAKES IT! Assist: RJ Carter
Score: 29-47

[05:29] Team_098 possession (Score: 29-47)
FOUL! Reach-in foul on Josh Smith during the drive. [Team fouls: 2] No free throws, side out. (Josh Smith: 1 personal fouls)

[05:14] Team_098 possession (Score: 29-47)
Dirk McCollum attempts a 3Pt. Contested by RJ Carter (5.8 feet, ZONE). Dirk McCollum misses. Offensive rebound by Kristaps Iverson! Kristaps Iverson kicks it out.

[05:03] Team_098 possession (Score: 29-47)
Manu Jordan drives and kicks out. Manu Jordan attempts a Midrange. Contested by Pau James (4.4 feet, ZONE). Manu Jordan misses. Rebound secured by Franz Anunoby.

[04:45] Team_030 possession (Score: 29-47)
FOUL! Reach-in foul on Dirk McCollum during the drive. [Team fouls: 2] No free throws, side out. (Dirk McCollum: 1 personal fouls)

[04:29] Team_030 possession (Score: 29-47)
Damian Green attempts a Midrange. Contested by Dirk McCollum (3.9 feet, ZONE). Damian Green misses. Rebound secured by Kristaps Iverson.

[04:13] Team_098 possession (Score: 29-47)
Tracy Rose drives, picks up RJ Carter. Help arrives from Pau James! Tracy Rose attempts a Layup. Contested by Pau James (5.7 feet, MAN). TRACY ROSE MAKES IT! Assist: Dirk McCollum
Score: 29-49

[03:56] Team_030 possession (Score: 29-49)
Franz Anunoby attempts a Midrange. Contested by Russell McGrady (4.1 feet, MAN). Franz Anunoby misses. Offensive rebound by Pau James! Pau James kicks it out.

[03:44] Team_030 possession (Score: 29-49)
FOUL! Offensive foul on Pau James! Kristaps Iverson drew the charge! [Team fouls: 3] (Pau James: 1 personal fouls) TURNOVER! (dead ball)

[03:28] Team_098 possession (Score: 29-49)
Tracy Rose makes the Layup and draws the foul on Josh Smith! And-1! Tracy Rose to the line for 1. [Team fouls: 4] (Josh Smith: 2 personal fouls)   FT 1/1: GOOD Tracy Rose makes 1/1 from the line.
Score: 29-52

[03:10] Team_030 possession (Score: 29-52)
FOUL! Shooting foul on Manu Jordan. Pau James to the line for 2 free throws. [Team fouls: 3] (Manu Jordan: 1 personal fouls)   FT 1/2: GOOD   FT 2/2: MISS Pau James makes 1/2 from the line. Rebound secured by Russell McGrady.
Score: 30-52

[02:53] Team_098 possession (Score: 30-52)
Tracy Rose throws a bad pass out of bounds! TURNOVER! (dead ball)

[02:41] Team_030 possession (Score: 30-52)
Pau James attempts a 3Pt. Contested by Dirk McCollum (4.2 feet, ZONE). Pau James misses. Rebound secured by Manu Jordan.

[02:30] Team_098 possession (Score: 30-52)
Manu Jordan attempts a 3Pt. Contested by Damian Green (5.4 feet, MAN). MANU JORDAN MAKES IT! Assist: Kristaps Iverson
Score: 30-55

[02:15] Team_030 possession (Score: 30-55)
Franz Anunoby attempts a Midrange. Contested by Kristaps Iverson (4.4 feet, ZONE). Franz Anunoby misses. Rebound secured by Russell McGrady.

[02:05] Team_098 possession (Score: 30-55)
FOUL! Offensive foul on Tracy Rose! RJ Carter drew the charge! [Team fouls: 4] (Tracy Rose: 1 personal fouls) TURNOVER! (dead ball)

[01:50] Team_030 possession (Score: 30-55)
Franz Anunoby attempts a Midrange. Contested by Russell McGrady (4.2 feet, ZONE). FRANZ ANUNOBY MAKES IT!
Score: 32-55

[01:32] Team_098 possession (Score: 32-55)
FOUL! Reach-in foul on Josh Smith during the drive. [IN THE BONUS! 5 team fouls] Dirk McCollum to the line for 2 free throws. (Josh Smith: 3 personal fouls)   FT 1/2: GOOD   FT 2/2: MISS Dirk McCollum makes 1/2 from the line. Offensive rebound by Russell McGrady! Russell McGrady's putback is no good.
Score: 32-56

[01:20] Team_030 possession (Score: 32-56)
Franz Anunoby attempts a Midrange. Contested by Russell McGrady (4.3 feet, MAN). Franz Anunoby misses. Rebound secured by Kristaps Iverson.

[01:01] Team_098 possession (Score: 32-56)
FOUL! Reach-in foul on Damian Green during the drive. [IN THE BONUS! 6 team fouls] Russell McGrady to the line for 2 free throws. (Damian Green: 1 personal fouls)   FT 1/2: GOOD   FT 2/2: GOOD Russell McGrady makes 2/2 from the line.
Score: 32-58

[00:46] Team_030 possession (Score: 32-58)
Josh Smith attempts a Midrange. Contested by Manu Jordan (5.1 feet, ZONE). JOSH SMITH MAKES IT! Assist: RJ Carter
Score: 34-58

[00:34] Team_098 possession (Score: 34-58)
Dirk McCollum drives, Damian Green stays with him. Dirk McCollum attempts a Layup. Contested by Damian Green (5.5 feet, ZONE). DIRK MCCOLLUM MAKES IT!
Score: 34-60

[00:21] Team_030 possession (Score: 34-60)
Pau James attempts a Midrange. Contested by Kristaps Iverson (4.4 feet, MAN). PAU JAMES MAKES IT! Assist: RJ Carter
Score: 36-60

[00:12] Team_098 possession (Score: 36-60)
FOUL! Holding foul on Damian Green. [IN THE BONUS! 7 team fouls] Manu Jordan to the line for 2 free throws. (Damian Green: 2 personal fouls)   FT 1/2: GOOD   FT 2/2: MISS Manu Jordan makes 1/2 from the line. Rebound secured by Damian Green.
Score: 36-61

================================================================================
                              2ND QUARTER COMPLETE                              
================================================================================

2ND QUARTER SCORE: Team_030 18, Team_098 23

BOX SCORE:
================================================================================

Team_030
--------------------------------------------------------------------------------
Player                MIN  PTS  REB  AST  TO      FG   FG%      3P   3P%
--------------------------------------------------------------------------------
Pau James              11    5    1    0   0   2/5    40.0     0/0   0.0
Josh Smith             11    4    0    0   0   2/4    50.0     0/0   0.0
Joel Anunoby           13    3    2    0   0   1/1   100.0     0/0   0.0
Tim Barrett            13    3    0    0   0   1/1   100.0     0/0   0.0
Franz Anunoby          11    2    4    1   0   1/3    33.3     0/0   0.0
Jordan Nowitzki        13    0    0    0   0   0/1     0.0     0/0   0.0
Damian Green           11    0    3    0   0   0/3     0.0     0/0   0.0
RJ Carter              11    0    0    3   0   0/0     0.0     0/0   0.0

TEAM: FG: 7/18 (38.9%), 3PT: 2/5 (40.0%), REB: 11 (2 off, 9 def), AST: 4, TO: 3
TEAM FOULS: 7 [Team_098 in BONUS]


Team_098
--------------------------------------------------------------------------------
Player                MIN  PTS  REB  AST  TO      FG   FG%      3P   3P%
--------------------------------------------------------------------------------
Kristaps Iverson       11    5    4    1   0   2/3    66.7     0/0   0.0
Tracy Rose             11    5    0    1   0   2/2   100.0     0/0   0.0
Manu Jordan            11    3    3    1   0   1/3    33.3     0/0   0.0
Nikola Rose            13    2    1    0   0   1/1   100.0     0/0   0.0
Derrick Durant         13    2    0    0   0   1/1   100.0     0/0   0.0
Dirk McCollum          11    2    0    1   0   1/4    25.0     0/0   0.0
Russell McGrady        11    2    5    0   0   1/2    50.0     0/0   0.0
Blake Murray           13    0    0    0   0   0/1     0.0     0/0   0.0
Pascal Lillard         13    0    1    1   0   0/0     0.0     0/0   0.0

TEAM: FG: 9/18 (50.0%), 3PT: 2/3 (66.7%), REB: 13 (2 off, 11 def), AST: 5, TO: 3
TEAM FOULS: 4

================================================================================

================================================================================
                       3RD QUARTER - Team_030 vs Team_098                       
================================================================================

[12:00] Team_030 possession (Score: 36-61)
Tim Barrett attempts a Layup. Contested by Pascal Lillard (4.0 feet, ZONE). TIM BARRETT MAKES IT!
Score: 38-61

[11:46] Team_098 possession (Score: 38-61)
Malcolm Tatum attempts a 3Pt. Contested by Tyler Beal (4.4 feet, MAN). Malcolm Tatum misses. Rebound secured by Jordan Nowitzki.

[11:34] Team_030 possession (Score: 38-61)
Jaren Green drives to the basket... Jaren Green throws a bad pass! Stolen by Pascal Lillard! TURNOVER! (live ball)

[11:23] Team_098 possession (Score: 38-61)
Malcolm Tatum attempts a 3Pt. Contested by Tyler Beal (4.4 feet, MAN). Malcolm Tatum misses. Offensive rebound by Pascal Lillard! Pascal Lillard kicks it out.

[11:10] Team_098 possession (Score: 38-61)
FOUL! Shooting foul on Jordan Nowitzki. Pascal Lillard to the line for 2 free throws. [Team fouls: 1] (Jordan Nowitzki: 1 personal fouls)   FT 1/2: GOOD   FT 2/2: GOOD Pascal Lillard makes 2/2 from the line.
Score: 38-63

[10:56] Team_030 possession (Score: 38-63)
Tyler Beal attempts a Midrange. Contested by Pascal Lillard (4.3 feet, ZONE). TYLER BEAL MAKES IT! Assist: Tim Barrett
Score: 40-63

[10:41] Team_098 possession (Score: 40-63)
Pascal Lillard drives, picks up Jaren Green. Help arrives from Tyler Beal! Pascal Lillard attempts a Layup. Contested by Tyler Beal (4.6 feet, ZONE). PASCAL LILLARD MAKES IT! Assist: Derrick Durant
Score: 40-65

[10:27] Team_030 possession (Score: 40-65)
Jordan Nowitzki drives, picks up Pascal Lillard. Help arrives from Nikola Rose! Jordan Nowitzki attempts a Dunk. Contested by Nikola Rose (4.6 feet, ZONE). Jordan Nowitzki misses. Offensive rebound by Jordan Nowitzki! Jordan Nowitzki puts it back in!
Score: 42-65

[10:12] Team_098 possession (Score: 42-65)
FOUL! Shooting foul on Joel Anunoby. Blake Murray to the line for 3 free throws. [Team fouls: 2] (Joel Anunoby: 1 personal fouls)   FT 1/3: GOOD   FT 2/3: GOOD   FT 3/3: MISS Blake Murray makes 2/3 from the line. Rebound secured by Jaren Green.
Score: 42-67

[09:58] Team_030 possession (Score: 42-67)
Jordan Nowitzki makes the Layup and draws the foul on Pascal Lillard! And-1! Jordan Nowitzki to the line for 1. [Team fouls: 1] (Pascal Lillard: 1 personal fouls)   FT 1/1: MISS Jordan Nowitzki makes 0/1 from the line. Rebound secured by Derrick Durant.
Score: 44-67

[09:45] Team_098 possession (Score: 44-67)
Blake Murray attempts a Midrange. Contested by Joel Anunoby (3.6 feet, MAN). Blake Murray misses. Rebound secured by Joel Anunoby.

[09:32] Team_030 possession (Score: 44-67)
Tim Barrett drives to the basket... Tim Barrett throws a bad pass! Stolen by Nikola Rose! TURNOVER! (live ball)

[09:14] Team_098 possession (Score: 44-67)
Nikola Rose attempts a Midrange. Contested by Tim Barrett (5.1 feet, MAN). Nikola Rose misses. FOUL! Loose ball foul on Joel Anunoby during the rebound battle. [Team fouls: 3] No free throws, side out. (Joel Anunoby: 2 personal fouls)

[09:00] Team_098 possession (Score: 44-67)
Blake Murray drives, Joel Anunoby stays with him. Blake Murray attempts a Dunk. Contested by Joel Anunoby (3.6 feet, MAN). BLAKE MURRAY MAKES IT!
Score: 44-69

[08:49] Team_030 possession (Score: 44-69)
Jordan Nowitzki attempts a Midrange. Contested by Pascal Lillard (4.6 feet, MAN). Jordan Nowitzki misses. Rebound secured by Derrick Durant.

[08:36] Team_098 possession (Score: 44-69)
Pascal Lillard drives and kicks out. Pascal Lillard attempts a 3Pt. Contested by Jordan Nowitzki (4.3 feet, MAN). Pascal Lillard misses. Rebound secured by Joel Anunoby.

[08:20] Team_030 possession (Score: 44-69)
Tyler Beal drives and kicks out. Tyler Beal attempts a 3Pt. Contested by Nikola Rose (3.2 feet, ZONE). Tyler Beal misses. Offensive rebound by Jordan Nowitzki! Jordan Nowitzki's putback is no good. Rebound secured by Derrick Durant.

[08:03] Team_098 possession (Score: 44-69)
Pascal Lillard attempts a Layup. Contested by Jaren Green (4.6 feet, ZONE). PASCAL LILLARD MAKES IT! Assist: Malcolm Tatum
Score: 44-71

[07:45] Team_030 possession (Score: 44-71)
Tim Barrett attempts a Midrange. Contested by Nikola Rose (3.1 feet, ZONE). TIM BARRETT MAKES IT! Assist: Jaren Green
Score: 46-71

[07:34] Team_098 possession (Score: 46-71)
Nikola Rose drives, Tim Barrett stays with him. Nikola Rose attempts a Layup. Contested by Tim Barrett (5.1 feet, MAN). NIKOLA ROSE MAKES IT!
Score: 46-73

[07:24] Team_030 possession (Score: 46-73)
Tim Barrett attempts a Midrange. Contested by Nikola Rose (3.1 feet, MAN). TIM BARRETT MAKES IT! Assist: Tyler Beal
Score: 48-73

[07:14] Team_098 possession (Score: 48-73)
Nikola Rose attempts a 3Pt. Contested by Tim Barrett (5.1 feet, MAN). Nikola Rose misses. FOUL! Loose ball foul on Jaren Green during the rebound battle. [Team fouls: 4] No free throws, side out. (Jaren Green: 1 personal fouls)

[07:04] Team_098 possession (Score: 48-73)
FOUL! Reach-in foul on Jaren Green during the drive. [IN THE BONUS! 5 team fouls] Blake Murray to the line for 2 free throws. (Jaren Green: 2 personal fouls)   FT 1/2: GOOD   FT 2/2: GOOD Blake Murray makes 2/2 from the line.
Score: 48-75

[06:48] Team_030 possession (Score: 48-75)
Tim Barrett drives and kicks out. Jordan Nowitzki attempts a Midrange. Contested by Pascal Lillard (4.0 feet, MAN). JORDAN NOWITZKI MAKES IT!
Score: 50-75

[06:33] Team_098 possession (Score: 50-75)
Malcolm Tatum attempts a 3Pt. Contested by Tyler Beal (4.4 feet, ZONE). Malcolm Tatum misses. Rebound secured by Jaren Green.

[06:18] Team_030 possession (Score: 50-75)
Joel Anunoby attempts a 3Pt. Contested by Blake Murray (4.8 feet, MAN). JOEL ANUNOBY MAKES IT! Assist: Jordan Nowitzki
Score: 53-75

[06:06] Team_098 possession (Score: 53-75)
Pascal Lillard attempts a 3Pt. Contested by Jordan Nowitzki (4.9 feet, ZONE). PASCAL LILLARD MAKES IT! Assist: Blake Murray
Score: 53-78

[05:49] Team_030 possession (Score: 53-78)
Jordan Nowitzki attempts a 3Pt. Contested by Nikola Rose (3.7 feet, ZONE). JORDAN NOWITZKI MAKES IT! Assist: Tim Barrett
Score: 56-78

[05:37] Team_098 possession (Score: 56-78)
Pascal Lillard makes the 3Pt and draws the foul on Jordan Nowitzki! And-1! Pascal Lillard to the line for 1. [BONUS: 6 team fouls] (Jordan Nowitzki: 2 personal fouls)   FT 1/1: MISS Pascal Lillard makes 0/1 from the line. Offensive rebound by Pascal Lillard! Pascal Lillard kicks it out.
Score: 56-81

[05:24] Team_098 possession (Score: 56-81)
Derrick Durant drives, Jaren Green stays with him. Derrick Durant attempts a Layup. Contested by Jaren Green (4.2 feet, ZONE). Derrick Durant misses. Rebound secured by Jordan Nowitzki.

[05:13] Team_030 possession (Score: 56-81)
Tim Barrett commits a violation (traveling/carry)! TURNOVER! (dead ball)

[04:56] Team_098 possession (Score: 56-81)
Pascal Lillard attempts a Midrange. Contested by Jordan Nowitzki (5.0 feet, MAN). PASCAL LILLARD MAKES IT!
Score: 56-83

[04:41] Team_030 possession (Score: 56-83)
Jordan Nowitzki attempts a 3Pt. Contested by Nikola Rose (3.7 feet, ZONE). Jordan Nowitzki misses. Rebound secured by Derrick Durant.

[04:26] Team_098 possession (Score: 56-83)
Blake Murray attempts a 3Pt. Contested by Joel Anunoby (3.7 feet, MAN). Blake Murray misses. FOUL! Loose ball foul on Joel Anunoby during the rebound battle. [IN THE BONUS! 7 team fouls] Derrick Durant to the line for 2 free throws. (Joel Anunoby: 3 personal fouls)   FT 1/2: MISS   FT 2/2: GOOD Derrick Durant makes 1/2 from the line.
Score: 56-84

[04:10] Team_030 possession (Score: 56-84)
Jordan Nowitzki attempts a Midrange. Contested by Nikola Rose (3.8 feet, ZONE). Jordan Nowitzki misses. Rebound secured by Derrick Durant.

[03:56] Team_098 possession (Score: 56-84)
Malcolm Tatum attempts a Midrange. Contested by Tyler Beal (4.5 feet, ZONE). MALCOLM TATUM MAKES IT!
Score: 56-86

[03:38] Team_030 possession (Score: 56-86)
Jordan Nowitzki attempts a 3Pt. Contested by Nikola Rose (3.8 feet, ZONE). Jordan Nowitzki misses. Rebound secured by Nikola Rose.

[03:22] Team_098 possession (Score: 56-86)
Malcolm Tatum attempts a 3Pt. Contested by Tyler Beal (4.6 feet, MAN). Malcolm Tatum misses. Rebound secured by Jordan Nowitzki.

[03:09] Team_030 possession (Score: 56-86)
Tyler Beal attempts a Midrange. Contested by Blake Murray (4.9 feet, ZONE). Tyler Beal misses. Rebound secured by Derrick Durant.

[02:56] Team_098 possession (Score: 56-86)
Derrick Durant attempts a 3Pt. Contested by Tyler Beal (4.6 feet, ZONE). Derrick Durant misses. Offensive rebound by Derrick Durant! Derrick Durant's putback is no good. Rebound secured by Jaren Green.

[02:42] Team_030 possession (Score: 56-86)
Jaren Green attempts a 3Pt. Contested by Nikola Rose (4.2 feet, ZONE). JAREN GREEN MAKES IT! Assist: Tim Barrett
Score: 59-86

[02:25] Team_098 possession (Score: 59-86)
Nikola Rose attempts a Midrange. Contested by Jordan Nowitzki (4.9 feet, ZONE). Nikola Rose misses. Rebound secured by Joel Anunoby.

[02:11] Team_030 possession (Score: 59-86)
FOUL! Holding foul on Malcolm Tatum. [Team fouls: 2] No free throws, side out. (Malcolm Tatum: 1 personal fouls)

[02:00] Team_030 possession (Score: 59-86)
Tim Barrett attempts a 3Pt. Contested by Nikola Rose (3.5 feet, MAN). Tim Barrett misses. Rebound secured by Nikola Rose.

[01:49] Team_098 possession (Score: 59-86)
Blake Murray attempts a 3Pt. Contested by Joel Anunoby (3.9 feet, ZONE). Blake Murray misses. FOUL! Loose ball foul on Jordan Nowitzki during the rebound battle. [IN THE BONUS! 8 team fouls] Pascal Lillard to the line for 2 free throws. (Jordan Nowitzki: 3 personal fouls)   FT 1/2: GOOD   FT 2/2: GOOD Pascal Lillard makes 2/2 from the line.
Score: 59-88

[01:37] Team_030 possession (Score: 59-88)
Tyler Beal attempts a 3Pt. Contested by Nikola Rose (3.8 feet, ZONE). Tyler Beal misses. FOUL! Loose ball foul on Nikola Rose during the rebound battle. [Team fouls: 3] No free throws, side out. (Nikola Rose: 1 personal fouls)

[01:27] Team_030 possession (Score: 59-88)
Jaren Green drives and kicks out. Jordan Nowitzki attempts a Midrange. Contested by Pascal Lillard (4.5 feet, MAN). Jordan Nowitzki misses. Rebound secured by Derrick Durant.

[01:13] Team_098 possession (Score: 59-88)
Pascal Lillard commits a violation (traveling/carry)! TURNOVER! (dead ball)

[01:13] Substitution (Team_030): Tyler Beal OUT → RJ Carter IN (stamina_rule2)

[01:13] Substitution (Team_030): Tim Barrett OUT → Josh Smith IN (stamina_rule2)

[01:13] Substitution (Team_030): Joel Anunoby OUT → Pau James IN (stamina_rule2)

[01:13] Substitution (Team_030): Jordan Nowitzki OUT → Damian Green IN (stamina_rule2)

[01:13] Substitution (Team_030): Jaren Green OUT → Franz Anunoby IN (stamina_rule2)

[01:13] Substitution (Team_098): Malcolm Tatum OUT → Tracy Rose IN (stamina_rule2)

[01:13] Substitution (Team_098): Nikola Rose OUT → Dirk McCollum IN (stamina_rule2)

[01:13] Substitution (Team_098): Blake Murray OUT → Kristaps Iverson IN (stamina_rule2)

[01:13] Substitution (Team_098): Pascal Lillard OUT → Manu Jordan IN (stamina_rule2)

[01:13] Substitution (Team_098): Derrick Durant OUT → Russell McGrady IN (stamina_rule2)

[00:56] Team_030 possession (Score: 59-88)
RJ Carter attempts a 3Pt. Contested by Dirk McCollum (4.3 feet, ZONE). RJ Carter misses. Offensive rebound by Damian Green! Damian Green kicks it out.

[00:41] Team_030 possession (Score: 59-88)
FOUL! Shooting foul on Manu Jordan. Damian Green to the line for 2 free throws. [Team fouls: 4] (Manu Jordan: 1 personal fouls)   FT 1/2: GOOD   FT 2/2: GOOD Damian Green makes 2/2 from the line.
Score: 61-88

[00:27] Team_098 possession (Score: 61-88)
Russell McGrady drives to the basket... Russell McGrady loses the ball! Stripped by Damian Green! TURNOVER! (live ball)

[00:16] Team_030 possession (Score: 61-88)
Damian Green attempts a Layup. BLOCKED BY MANU JORDAN! Ball is loose! Rebound secured by Russell McGrady.

[00:02] Team_098 possession (Score: 61-88)
Manu Jordan attempts a 3Pt. Contested by Damian Green (5.4 feet, MAN). Manu Jordan misses. Rebound secured by Pau James.

================================================================================
                              3RD QUARTER COMPLETE                              
================================================================================

3RD QUARTER SCORE: Team_030 25, Team_098 27

BOX SCORE:
================================================================================

Team_030
--------------------------------------------------------------------------------
Player                MIN  PTS  REB  AST  TO      FG   FG%      3P   3P%
--------------------------------------------------------------------------------
Jordan Nowitzki        24    7    4    1   0   3/8    37.5     0/0   0.0
Tim Barrett            24    6    0    3   0   3/4    75.0     0/0   0.0
Jaren Green            24    3    3    1   0   1/2    50.0     0/0   0.0
Joel Anunoby           24    3    4    0   0   1/1   100.0     0/0   0.0
Tyler Beal             24    2    0    1   0   1/3    33.3     0/0   0.0
Damian Green           12    2    1    0   0   1/2    50.0     0/0   0.0
Pau James              12    0    1    0   0   0/0     0.0     0/0   0.0

TEAM: FG: 10/20 (50.0%), 3PT: 3/6 (50.0%), REB: 13 (4 off, 9 def), AST: 6, TO: 3
TEAM FOULS: 8 [Team_098 in BONUS]


Team_098
--------------------------------------------------------------------------------
Player                MIN  PTS  REB  AST  TO      FG   FG%      3P   3P%
--------------------------------------------------------------------------------
Pascal Lillard         24   13    3    0   0   6/7    85.7     0/0   0.0
Blake Murray           24    4    0    1   0   2/4    50.0     0/0   0.0
Malcolm Tatum          24    2    0    1   0   1/4    25.0     0/0   0.0
Nikola Rose            24    2    2    0   0   1/2    50.0     0/0   0.0
Derrick Durant         24    1    8    1   0   1/3    33.3     0/0   0.0
Russell McGrady        12    0    1    0   0   0/0     0.0     0/0   0.0
Manu Jordan            12    0    0    0   0   0/1     0.0     0/0   0.0

TEAM: FG: 11/21 (52.4%), 3PT: 3/9 (33.3%), REB: 14 (5 off, 9 def), AST: 3, TO: 2
TEAM FOULS: 4

================================================================================

================================================================================
                       4TH QUARTER - Team_030 vs Team_098                       
================================================================================

[12:00] Substitution (Team_030): Tyler Beal OUT (stamina: 74) → RJ Carter IN (comeback_detected)

[12:00] Substitution (Team_098): Malcolm Tatum OUT (stamina: 73) → Tracy Rose IN (comeback_detected)

[12:00] Substitution (Team_098): Derrick Durant OUT → Russell McGrady IN (stamina_rule2)

[12:00] Team_030 possession (Score: 61-88)
Tim Barrett throws a bad pass out of bounds! TURNOVER! (dead ball)

[11:48] Team_098 possession (Score: 61-88)
Tracy Rose attempts a Midrange. Contested by Tim Barrett (5.0 feet, ZONE). TRACY ROSE MAKES IT!
Score: 61-90

[11:33] Team_030 possession (Score: 61-90)
RJ Carter attempts a 3Pt. Contested by Tracy Rose (3.3 feet, MAN). RJ Carter misses. Rebound secured by Pascal Lillard.

[11:17] Team_098 possession (Score: 61-90)
Tracy Rose attempts a 3Pt. Contested by Tim Barrett (5.1 feet, ZONE). Tracy Rose misses. Rebound secured by Joel Anunoby.

[11:00] Team_030 possession (Score: 61-90)
RJ Carter loses the ball! Stripped by Tracy Rose! TURNOVER! (live ball)

[10:45] Team_098 possession (Score: 61-90)
Pascal Lillard attempts a 3Pt. Contested by Tim Barrett (5.6 feet, ZONE). Pascal Lillard misses. Rebound secured by Jordan Nowitzki.

[10:31] Team_030 possession (Score: 61-90)
Joel Anunoby attempts a 3Pt. Contested by Tracy Rose (3.5 feet, ZONE). Joel Anunoby misses. Rebound secured by Nikola Rose.

[10:14] Team_098 possession (Score: 61-90)
Pascal Lillard attempts a Midrange. Contested by Jordan Nowitzki (5.2 feet, MAN). Pascal Lillard misses. FOUL! Loose ball foul on Jordan Nowitzki during the rebound battle. [Team fouls: 1] No free throws, side out. (Jordan Nowitzki: 1 personal fouls)

[09:55] Team_098 possession (Score: 61-90)
Tracy Rose attempts a Midrange. Contested by RJ Carter (5.8 feet, MAN). Tracy Rose misses. Rebound secured by Jaren Green.

[09:41] Team_030 possession (Score: 61-90)
Jaren Green drives and kicks out. Joel Anunoby attempts a Midrange. Contested by Blake Murray (5.0 feet, MAN). Joel Anunoby misses. Rebound secured by Pascal Lillard.

[09:23] Team_098 possession (Score: 61-90)
Russell McGrady drives, picks up Jaren Green. Help arrives from RJ Carter! Russell McGrady attempts a Dunk. Contested by RJ Carter (4.3 feet, ZONE). Russell McGrady misses. Rebound secured by Joel Anunoby.

[09:09] Team_030 possession (Score: 61-90)
Joel Anunoby drives to the basket... Joel Anunoby throws a bad pass! Stolen by Blake Murray! TURNOVER! (live ball)

[08:57] Team_098 possession (Score: 61-90)
FOUL! Offensive foul on Tracy Rose! RJ Carter drew the charge! [Team fouls: 1] (Tracy Rose: 1 personal fouls) TURNOVER! (dead ball)

[08:39] Team_030 possession (Score: 61-90)
Jordan Nowitzki drives and kicks out. Joel Anunoby attempts a 3Pt. Contested by Tracy Rose (3.2 feet, ZONE). Joel Anunoby misses. Rebound secured by Russell McGrady.

[08:26] Team_098 possession (Score: 61-90)
Nikola Rose makes the Layup and draws the foul on Tim Barrett! And-1! Nikola Rose to the line for 1. [Team fouls: 2] (Tim Barrett: 1 personal fouls)   FT 1/1: MISS Nikola Rose makes 0/1 from the line. Offensive rebound by Pascal Lillard! Pascal Lillard kicks it out.
Score: 61-92

[08:12] Team_098 possession (Score: 61-92)
Tracy Rose attempts a 3Pt. Contested by RJ Carter (5.8 feet, MAN). Tracy Rose misses. Rebound secured by Joel Anunoby.

[07:59] Team_030 possession (Score: 61-92)
Joel Anunoby attempts a Midrange. Contested by Nikola Rose (4.1 feet, ZONE). JOEL ANUNOBY MAKES IT! Assist: Jordan Nowitzki
Score: 63-92

[07:46] Team_098 possession (Score: 63-92)
Russell McGrady attempts a 3Pt. Contested by RJ Carter (5.5 feet, ZONE). Russell McGrady misses. Rebound secured by Jordan Nowitzki.

[07:30] Team_030 possession (Score: 63-92)
RJ Carter drives, picks up Russell McGrady. Help arrives from Nikola Rose! RJ Carter attempts a Layup. Contested by Nikola Rose (3.9 feet, ZONE). RJ CARTER MAKES IT!
Score: 65-92

[07:19] Team_098 possession (Score: 65-92)
Nikola Rose attempts a 3Pt. Contested by Tim Barrett (5.7 feet, MAN). NIKOLA ROSE MAKES IT! Assist: Blake Murray
Score: 65-95

[07:02] Team_030 possession (Score: 65-95)
Jaren Green attempts a Midrange. Contested by Nikola Rose (4.6 feet, ZONE). JAREN GREEN MAKES IT! Assist: Tim Barrett
Score: 67-95

[06:48] Team_098 possession (Score: 67-95)
Blake Murray attempts a Midrange. Contested by Joel Anunoby (4.3 feet, MAN). Blake Murray misses. Offensive rebound by Russell McGrady! Russell McGrady's putback is no good. Offensive rebound by Russell McGrady! Russell McGrady kicks it out.

[06:33] Team_098 possession (Score: 67-95)
FOUL! Holding foul on Jaren Green. [Team fouls: 3] No free throws, side out. (Jaren Green: 1 personal fouls)

[06:20] Team_098 possession (Score: 67-95)
Pascal Lillard attempts a Layup. Contested by Jaren Green (5.3 feet, ZONE). PASCAL LILLARD MAKES IT! Assist: Tracy Rose
Score: 67-97

[06:03] Team_030 possession (Score: 67-97)
Joel Anunoby attempts a Layup. Contested by Russell McGrady (4.0 feet, ZONE). JOEL ANUNOBY MAKES IT!
Score: 69-97

[05:46] Team_098 possession (Score: 69-97)
Russell McGrady attempts a Layup. Contested by Jaren Green (4.9 feet, ZONE). RUSSELL MCGRADY MAKES IT! Assist: Tracy Rose
Score: 69-99

[05:30] Team_030 possession (Score: 69-99)
Jaren Green drives to the basket... FOUL! Offensive foul on Jaren Green! Russell McGrady drew the charge! [Team fouls: 4] (Jaren Green: 2 personal fouls) TURNOVER! (dead ball)

[05:17] Team_098 possession (Score: 69-99)
Nikola Rose drives and kicks out. Tracy Rose attempts a 3Pt. Contested by RJ Carter (5.7 feet, MAN). Tracy Rose misses. Rebound secured by Jaren Green.

[05:05] Team_030 possession (Score: 69-99)
RJ Carter attempts a 3Pt. Contested by Tracy Rose (3.5 feet, MAN). RJ Carter misses. Rebound secured by Pascal Lillard.

[04:49] Team_098 possession (Score: 69-99)
Nikola Rose attempts a 3Pt. Contested by Tim Barrett (5.9 feet, MAN). Nikola Rose misses. Rebound secured by Jaren Green.

[04:30] Team_030 possession (Score: 69-99)
FOUL! Reach-in foul on Russell McGrady during the drive. [Team fouls: 2] No free throws, side out. (Russell McGrady: 1 personal fouls)

[04:16] Team_030 possession (Score: 69-99)
Jaren Green attempts a 3Pt. Contested by Russell McGrady (4.5 feet, MAN). Jaren Green misses. Rebound secured by Russell McGrady.

[04:02] Team_098 possession (Score: 69-99)
Nikola Rose attempts a 3Pt. Wide open! Tim Barrett is 6.0 feet away. [MAN] Nikola Rose misses. Rebound secured by Jordan Nowitzki.

[03:47] Team_030 possession (Score: 69-99)
FOUL! Holding foul on Russell McGrady. [Team fouls: 3] No free throws, side out. (Russell McGrady: 2 personal fouls)

[03:29] Team_030 possession (Score: 69-99)
Tim Barrett drives to the basket... Tim Barrett loses control! Ball rolls out of bounds! TURNOVER! (dead ball)

[03:29] Substitution (Team_030): Tim Barrett OUT → Josh Smith IN (stamina_rule2)

[03:29] Substitution (Team_030): Joel Anunoby OUT → Pau James IN (stamina_rule2)

[03:29] Substitution (Team_030): Jordan Nowitzki OUT → Damian Green IN (stamina_rule2)

[03:29] Substitution (Team_030): Jaren Green OUT → Franz Anunoby IN (stamina_rule2)

[03:29] Substitution (Team_098): Nikola Rose OUT → Dirk McCollum IN (stamina_rule2)

[03:29] Substitution (Team_098): Blake Murray OUT → Kristaps Iverson IN (stamina_rule2)

[03:29] Substitution (Team_098): Pascal Lillard OUT → Manu Jordan IN (stamina_rule2)

[03:17] Team_098 possession (Score: 69-99)
Kristaps Iverson attempts a Layup. Contested by Pau James (4.5 feet, MAN). KRISTAPS IVERSON MAKES IT! Assist: Tracy Rose
Score: 69-101

[03:06] Team_030 possession (Score: 69-101)
FOUL! Holding foul on Manu Jordan. [Team fouls: 4] No free throws, side out. (Manu Jordan: 1 personal fouls)

[02:52] Team_030 possession (Score: 69-101)
Pau James drives to the basket... Pau James throws a bad pass out of bounds! TURNOVER! (dead ball)

[02:34] Team_098 possession (Score: 69-101)
Dirk McCollum attempts a Midrange. Wide open! RJ Carter is 6.1 feet away. [ZONE] Dirk McCollum misses. Offensive rebound by Kristaps Iverson! Kristaps Iverson kicks it out.

[02:22] Team_098 possession (Score: 69-101)
Manu Jordan makes the Dunk and draws the foul on Damian Green! And-1! Manu Jordan to the line for 1. [BONUS: 5 team fouls] (Damian Green: 1 personal fouls)   FT 1/1: MISS Manu Jordan makes 0/1 from the line. Rebound secured by Damian Green.
Score: 69-103

[02:11] Team_030 possession (Score: 69-103)
Pau James attempts a 3Pt. Contested by Dirk McCollum (4.2 feet, ZONE). Pau James misses. Rebound secured by Kristaps Iverson.

[01:57] Team_098 possession (Score: 69-103)
Dirk McCollum attempts a 3Pt. Contested by Josh Smith (4.7 feet, ZONE). Dirk McCollum misses. FOUL! Loose ball foul on Pau James during the rebound battle. [IN THE BONUS! 6 team fouls] Kristaps Iverson to the line for 2 free throws. (Pau James: 1 personal fouls)   FT 1/2: GOOD   FT 2/2: GOOD Kristaps Iverson makes 2/2 from the line.
Score: 69-105

[01:42] Team_030 possession (Score: 69-105)
Damian Green attempts a Midrange. Contested by Kristaps Iverson (3.7 feet, ZONE). Damian Green misses. FOUL! Loose ball foul on Kristaps Iverson during the rebound battle. [IN THE BONUS! 5 team fouls] Pau James to the line for 2 free throws. (Kristaps Iverson: 1 personal fouls)   FT 1/2: GOOD   FT 2/2: GOOD Pau James makes 2/2 from the line.
Score: 71-105

[01:27] Team_098 possession (Score: 71-105)
Kristaps Iverson attempts a Midrange. Contested by Pau James (4.5 feet, MAN). Kristaps Iverson misses. Offensive rebound by Kristaps Iverson! Kristaps Iverson kicks it out.

[01:10] Team_098 possession (Score: 71-105)
Russell McGrady attempts a Midrange. Contested by Franz Anunoby (4.2 feet, MAN). Russell McGrady misses. Rebound secured by Pau James.

[00:57] Team_030 possession (Score: 71-105)
Josh Smith attempts a Layup. BLOCKED BY RUSSELL MCGRADY! Ball is loose! Rebound secured by Manu Jordan.

[00:43] Team_098 possession (Score: 71-105)
Tracy Rose attempts a 3Pt. Contested by Damian Green (5.1 feet, ZONE). Tracy Rose misses. Rebound secured by Pau James.

[00:34] Team_030 possession (Score: 71-105)
Pau James drives and kicks out. Pau James attempts a 3Pt. Contested by Dirk McCollum (4.2 feet, ZONE). Pau James misses. Offensive rebound by Pau James! Pau James kicks it out.

[00:17] Team_030 possession (Score: 71-105)
RJ Carter attempts a 3Pt. Contested by Dirk McCollum (4.2 feet, ZONE). RJ Carter misses. Rebound secured by Kristaps Iverson.

[00:02] Team_098 possession (Score: 71-105)
Tracy Rose attempts a Midrange. Wide open! RJ Carter is 6.2 feet away. [MAN] TRACY ROSE MAKES IT!
Score: 71-107

================================================================================
                              4TH QUARTER COMPLETE                              
================================================================================

4TH QUARTER SCORE: Team_030 10, Team_098 19

BOX SCORE:
================================================================================

Team_030
--------------------------------------------------------------------------------
Player                MIN  PTS  REB  AST  TO      FG   FG%      3P   3P%
--------------------------------------------------------------------------------
Joel Anunoby           33    4    3    0   0   2/3    66.7     0/0   0.0
RJ Carter              24    2    0    0   0   1/4    25.0     0/0   0.0
Jaren Green            33    2    3    0   0   1/3    33.3     0/0   0.0
Pau James              16    2    3    0   0   1/2    50.0     0/0   0.0
Jordan Nowitzki        33    0    3    1   0   0/1     0.0     0/0   0.0
Tim Barrett            33    0    0    1   0   0/0     0.0     0/0   0.0
Damian Green           16    0    1    0   0   0/0     0.0     0/0   0.0
Josh Smith             16    0    0    0   0   0/1     0.0     0/0   0.0

TEAM: FG: 5/14 (35.7%), 3PT: 0/6 (0.0%), REB: 13 (1 off, 12 def), AST: 2, TO: 6
TEAM FOULS: 6 [Team_098 in BONUS]


Team_098
--------------------------------------------------------------------------------
Player                MIN  PTS  REB  AST  TO      FG   FG%      3P   3P%
--------------------------------------------------------------------------------
Tracy Rose             24    4    0    3   0   2/6    33.3     0/0   0.0
Kristaps Iverson       16    4    4    0   0   2/2   100.0     0/0   0.0
Nikola Rose            33    3    1    0   0   1/4    25.0     0/0   0.0
Pascal Lillard         33    2    4    0   0   1/2    50.0     0/0   0.0
Russell McGrady        24    2    4    0   0   1/4    25.0     0/0   0.0
Blake Murray           33    0    0    1   0   0/0     0.0     0/0   0.0
Manu Jordan            16    0    1    0   0   0/1     0.0     0/0   0.0

TEAM: FG: 7/19 (36.8%), 3PT: 2/9 (22.2%), REB: 14 (5 off, 9 def), AST: 4, TO: 1
TEAM FOULS: 5 [Team_030 in BONUS]

================================================================================

================================================================================
                               FULL GAME COMPLETE                               
================================================================================

FINAL SCORE: Team_030 71, Team_098 107

SCORING BY QUARTER:
--------------------------------------------------------------------------------
Team                     Q1     Q2     Q3     Q4    FINAL
--------------------------------------------------------------------------------
Team_030                 18     18     25     10       71
Team_098                 38     23     27     19      107
--------------------------------------------------------------------------------

FULL GAME BOX SCORE:
================================================================================

Team_030
--------------------------------------------------------------------------------
Player                MIN  PTS  REB  AST  TO      FG   FG%      3P   3P%      FT STL BLK
--------------------------------------------------------------------------------
Tim Barrett            33   14    0    7   5   6/9    66.7   2/4    50.0   2/2     0   0
Joel Anunoby           33   12   11    0   0   5/8    62.5   1/4    25.0   1/1     1   1
Jordan Nowitzki        33    7   11    2   2   3/12   25.0   1/4    25.0   0/1     0   0
Jaren Green            33    9    7    1   2   4/9    44.4   1/3    33.3   2/3     0   0
RJ Carter              24    2    0    3   2   1/4    25.0   0/3     0.0   0/0     0   0
Tyler Beal             24    5    0    2   3   2/8    25.0   1/5    20.0   0/0     0   0
Josh Smith             16    6    0    0   1   3/7    42.9   0/2     0.0   0/0     0   0
Pau James              16    7    5    0   1   2/6    33.3   1/4    25.0   3/4     0   0
Damian Green           16    2    5    1   0   2/6    33.3   0/0     0.0   2/2     1   0
Franz Anunoby          16    2    4    1   0   1/3    33.3   0/0     0.0   0/0     0   0

TEAM: FG: 29/72 (40.3%), 3PT: 7/29 (24.1%), REB: 44 (8 off, 36 def), AST: 17, TO: 16


Team_098
--------------------------------------------------------------------------------
Player                MIN  PTS  REB  AST  TO      FG   FG%      3P   3P%      FT STL BLK
--------------------------------------------------------------------------------
Nikola Rose            33   10    7    1   0   4/8    50.0   1/3    33.3   1/2     1   0
Blake Murray           33   12    0    3   1   7/13   53.8   3/5    60.0   5/6     2   0
Pascal Lillard         33   23   12    1   1   9/12   75.0   1/2    50.0   6/7     2   0
Derrick Durant         24    7   13    3   0   2/5    40.0   0/1     0.0   3/4     0   0
Tracy Rose             24   12    0    4   3   5/9    55.6   0/3     0.0   2/2     1   0
Malcolm Tatum          24   12    0    3   1   6/10   60.0   2/6    33.3   1/1     1   0
Russell McGrady        24    6   11    0   1   3/7    42.9   0/2     0.0   2/2     0   1
Dirk McCollum          16    2    0    1   0   2/5    40.0   1/1   100.0   1/2     1   1
Kristaps Iverson       16    9    8    1   0   3/4    75.0   1/1   100.0   2/2     0   0
Manu Jordan            16    3    4    1   2   1/5    20.0   1/2    50.0   1/3     0   2

TEAM: FG: 42/79 (53.2%), 3PT: 10/26 (38.5%), REB: 54 (12 off, 42 def), AST: 18, TO: 9

================================================================================
