================================================================================
                        FULL GAME - Team_061 vs Team_091                        
================================================================================

================================================================================
                       1ST QUARTER - Team_061 vs Team_091                       
================================================================================

[12:00] Team_061 possession (Score: 0-0)
Michael Russell attempts a 3Pt. Contested by Kyrie Rozier (4.4 feet, ZONE). Michael Russell misses. Rebound secured by Rudy Bridges.

[11:51] Team_091 possession (Score: 0-0)
Kevin Simons attempts a Layup. Contested by Draymond Banchero (3.0 feet, MAN). Kevin Simons misses. Rebound secured by Bam Sexton.

[11:39] Team_061 possession (Score: 0-0)
Bam Sexton attempts a 3Pt. Contested by Rudy Bridges (4.8 feet, ZONE). Bam Sexton misses. Rebound secured by Kyrie Rozier.

[11:22] Team_091 possession (Score: 0-0)
FOUL! Shooting foul on Michael Russell. Kyrie Rozier to the line for 2 free throws. [Team fouls: 1] (Michael Russell: 1 personal fouls)   FT 1/2: GOOD   FT 2/2: MISS Kyrie Rozier makes 1/2 from the line. Offensive rebound by Rudy Bridges! Rudy Bridges kicks it out.
Score: 0-1

[11:11] Team_091 possession (Score: 0-1)
FOUL! Shooting foul on Jayson Holiday. Kevin Simons to the line for 2 free throws. [Team fouls: 2] (Jayson Holiday: 1 personal fouls)   FT 1/2: GOOD   FT 2/2: GOOD Kevin Simons makes 2/2 from the line.
Score: 0-3

[10:56] Team_061 possession (Score: 0-3)
Draymond Banchero throws a bad pass! Stolen by Kevin Simons! TURNOVER! (live ball)

[10:45] Team_091 possession (Score: 0-3)
FOUL! Reach-in foul on Jayson Holiday during the drive. [Team fouls: 3] No free throws, side out. (Jayson Holiday: 2 personal fouls)

[10:26] Team_091 possession (Score: 0-3)
Isaiah Siakam drives and kicks out. Kevin Simons attempts a 3Pt. Contested by Brandon Russell (3.9 feet, ZONE). Kevin Simons misses. Rebound secured by Draymond Banchero.

[10:15] Team_061 possession (Score: 0-3)
Draymond Banchero attempts a Midrange. Contested by Kevin Simons (4.2 feet, MAN). Draymond Banchero misses. Offensive rebound by Draymond Banchero! Draymond Banchero puts it back in!
Score: 2-3

[10:00] Team_091 possession (Score: 2-3)
D'Angelo Ingram drives, Draymond Banchero stays with him. D'Angelo Ingram attempts a Layup. Contested by Draymond Banchero (3.6 feet, ZONE). D'Angelo Ingram misses. Rebound secured by Bam Sexton.

[09:44] Team_061 possession (Score: 2-3)
Bam Sexton drives and kicks out. Michael Russell attempts a 3Pt. Contested by Rudy Bridges (4.3 feet, MAN). Michael Russell misses. Offensive rebound by Michael Russell! Michael Russell puts it back in!
Score: 4-3

[09:30] Team_091 possession (Score: 4-3)
FOUL! Offensive foul on Isaiah Siakam! Jayson Holiday drew the charge! [Team fouls: 1] (Isaiah Siakam: 1 personal fouls) TURNOVER! (dead ball)

[09:17] Team_061 possession (Score: 4-3)
Brandon Russell attempts a 3Pt. Contested by Rudy Bridges (4.6 feet, ZONE). BRANDON RUSSELL MAKES IT! Assist: Draymond Banchero
Score: 7-3

[09:04] Team_091 possession (Score: 7-3)
FOUL! Shooting foul on Draymond Banchero. Isaiah Siakam to the line for 2 free throws. [Team fouls: 4] (Draymond Banchero: 1 personal fouls)   FT 1/2: GOOD   FT 2/2: GOOD Isaiah Siakam makes 2/2 from the line.
Score: 7-5

[08:50] Team_061 possession (Score: 7-5)
Jayson Holiday makes the Layup and draws the foul on Kyrie Rozier! And-1! Jayson Holiday to the line for 1. [Team fouls: 2] (Kyrie Rozier: 1 personal fouls)   FT 1/1: GOOD Jayson Holiday makes 1/1 from the line.
Score: 10-5

[08:35] Team_091 possession (Score: 10-5)
FOUL! Reach-in foul on Draymond Banchero during the drive. [IN THE BONUS! 5 team fouls] Kevin Simons to the line for 2 free throws. (Draymond Banchero: 2 personal fouls)   FT 1/2: MISS   FT 2/2: GOOD Kevin Simons makes 1/2 from the line.
Score: 10-6

[08:19] Team_061 possession (Score: 10-6)
Bam Sexton attempts a 3Pt. Contested by D'Angelo Ingram (5.1 feet, MAN). Bam Sexton misses. Rebound secured by Kyrie Rozier.

[08:06] Team_091 possession (Score: 10-6)
Kevin Simons drives and kicks out. Isaiah Siakam attempts a 3Pt. Contested by Jayson Holiday (4.0 feet, MAN). Isaiah Siakam misses. Rebound secured by Draymond Banchero.

[07:55] Team_061 possession (Score: 10-6)
Brandon Russell attempts a 3Pt. Contested by Kyrie Rozier (4.3 feet, ZONE). Brandon Russell misses. Rebound secured by Kevin Simons.

[07:39] Team_091 possession (Score: 10-6)
FOUL! Shooting foul on Draymond Banchero. Kyrie Rozier to the line for 2 free throws. [BONUS: 6 team fouls] (Draymond Banchero: 3 personal fouls)   FT 1/2: GOOD   FT 2/2: GOOD Kyrie Rozier makes 2/2 from the line.
Score: 10-8

[07:24] Team_061 possession (Score: 10-8)
Brandon Russell drives and kicks out. Bam Sexton attempts a 3Pt. Contested by Kyrie Rozier (4.1 feet, ZONE). Bam Sexton misses. FOUL! Loose ball foul on Kevin Simons during the rebound battle. [Team fouls: 3] No free throws, side out. (Kevin Simons: 1 personal fouls)

[07:09] Team_061 possession (Score: 10-8)
Brandon Russell attempts a 3Pt. Contested by Kyrie Rozier (4.3 feet, ZONE). Brandon Russell misses. Rebound secured by Kevin Simons.

[06:58] Team_091 possession (Score: 10-8)
D'Angelo Ingram attempts a Layup. Contested by Draymond Banchero (3.6 feet, ZONE). D'Angelo Ingram misses. Rebound secured by Draymond Banchero.

[06:45] Team_061 possession (Score: 10-8)
Michael Russell attempts a 3Pt. Contested by Rudy Bridges (4.6 feet, MAN). Michael Russell misses. Rebound secured by Kevin Simons.

[06:27] Team_091 possession (Score: 10-8)
Isaiah Siakam drives, picks up Draymond Banchero. Help arrives from Jayson Holiday! Isaiah Siakam attempts a Dunk. Contested by Jayson Holiday (2.9 feet, ZONE). ISAIAH SIAKAM MAKES IT! Assist: Kevin Simons
Score: 10-10

[06:08] Team_061 possession (Score: 10-10)
Jayson Holiday attempts a 3Pt. Contested by Kyrie Rozier (4.5 feet, ZONE). Jayson Holiday misses. Rebound secured by Kevin Simons.

[05:48] Team_091 possession (Score: 10-10)
Isaiah Siakam loses the ball! Stripped by Jayson Holiday! TURNOVER! (live ball)

[05:33] Team_061 possession (Score: 10-10)
Bam Sexton drives, D'Angelo Ingram stays with him. Bam Sexton attempts a Layup. Contested by D'Angelo Ingram (5.1 feet, MAN). BAM SEXTON MAKES IT!
Score: 12-10

[05:18] Team_091 possession (Score: 12-10)
Isaiah Siakam attempts a 3Pt. Contested by Brandon Russell (4.2 feet, ZONE). Isaiah Siakam misses. Rebound secured by Draymond Banchero.

[05:05] Team_061 possession (Score: 12-10)
Draymond Banchero loses the ball! Stripped by Kevin Simons! TURNOVER! (live ball)

[04:47] Team_091 possession (Score: 12-10)
Isaiah Siakam attempts a 3Pt. Contested by Jayson Holiday (4.3 feet, MAN). Isaiah Siakam misses. Rebound secured by Michael Russell.

[04:33] Team_061 possession (Score: 12-10)
Jayson Holiday drives, picks up Isaiah Siakam. Help arrives from Rudy Bridges! Jayson Holiday attempts a Dunk. Wide open! Rudy Bridges is 6.1 feet away. [MAN] Jayson Holiday misses. Rebound secured by Kevin Simons.

[04:21] Team_091 possession (Score: 12-10)
Kevin Simons attempts a Midrange. Contested by Draymond Banchero (3.0 feet, MAN). KEVIN SIMONS MAKES IT!
Score: 12-12

[04:05] Team_061 possession (Score: 12-12)
Michael Russell attempts a Midrange. Contested by Rudy Bridges (4.7 feet, MAN). Michael Russell misses. Rebound secured by Kevin Simons.

[03:49] Team_091 possession (Score: 12-12)
FOUL! Shooting foul on Michael Russell. Rudy Bridges to the line for 2 free throws. [BONUS: 7 team fouls] (Michael Russell: 2 personal fouls)   FT 1/2: GOOD   FT 2/2: GOOD Rudy Bridges makes 2/2 from the line.
Score: 12-14

[03:33] Team_061 possession (Score: 12-14)
Michael Russell attempts a Midrange. Contested by D'Angelo Ingram (5.1 feet, ZONE). MICHAEL RUSSELL MAKES IT! Assist: Brandon Russell
Score: 14-14

[03:18] Team_091 possession (Score: 14-14)
D'Angelo Ingram drives, picks up Bam Sexton. Help arrives from Jayson Holiday! D'Angelo Ingram attempts a Layup. Contested by Jayson Holiday (5.9 feet, MAN). D'ANGELO INGRAM MAKES IT! Assist: Kyrie Rozier
Score: 14-16

[03:04] Team_061 possession (Score: 14-16)
Michael Russell attempts a 3Pt. Contested by Kyrie Rozier (4.5 feet, ZONE). MICHAEL RUSSELL MAKES IT! Assist: Draymond Banchero
Score: 17-16

[02:49] Team_091 possession (Score: 17-16)
Kevin Simons drives, Draymond Banchero stays with him. Kevin Simons attempts a Layup. Contested by Draymond Banchero (3.2 feet, MAN). Kevin Simons misses. Rebound secured by Bam Sexton.

[02:39] Team_061 possession (Score: 17-16)
Jayson Holiday drives, Isaiah Siakam stays with him. Jayson Holiday attempts a Dunk. Wide open! Isaiah Siakam is 6.3 feet away. [MAN] JAYSON HOLIDAY MAKES IT! Assist: Draymond Banchero
Score: 19-16

[02:26] Team_091 possession (Score: 19-16)
D'Angelo Ingram attempts a 3Pt. Contested by Bam Sexton (5.9 feet, ZONE). D'ANGELO INGRAM MAKES IT! Assist: Kevin Simons
Score: 19-19

[02:14] Team_061 possession (Score: 19-19)
Draymond Banchero attempts a 3Pt. Contested by Kyrie Rozier (4.9 feet, ZONE). Draymond Banchero misses. Offensive rebound by Draymond Banchero! Draymond Banchero's putback is no good. Rebound secured by Kyrie Rozier.

[02:01] Team_091 possession (Score: 19-19)
D'Angelo Ingram makes the 3Pt and draws the foul on Bam Sexton! And-1! D'Angelo Ingram to the line for 1. [BONUS: 8 team fouls] (Bam Sexton: 1 personal fouls)   FT 1/1: GOOD D'Angelo Ingram makes 1/1 from the line.
Score: 19-23

[01:50] Team_061 possession (Score: 19-23)
FOUL! Shooting foul on D'Angelo Ingram. Bam Sexton to the line for 2 free throws. [Team fouls: 4] (D'Angelo Ingram: 1 personal fouls)   FT 1/2: MISS   FT 2/2: GOOD Bam Sexton makes 1/2 from the line.
Score: 20-23

[01:31] Team_091 possession (Score: 20-23)
Kyrie Rozier drives, Brandon Russell stays with him. Kyrie Rozier attempts a Layup. Contested by Brandon Russell (4.3 feet, MAN). KYRIE ROZIER MAKES IT!
Score: 20-25

[01:13] Team_061 possession (Score: 20-25)
Draymond Banchero attempts a Midrange. Wide open! Isaiah Siakam is 6.7 feet away. [ZONE] DRAYMOND BANCHERO MAKES IT! Assist: Bam Sexton
Score: 22-25

[00:54] Team_091 possession (Score: 22-25)
D'Angelo Ingram attempts a Layup. Contested by Draymond Banchero (3.9 feet, ZONE). D'Angelo Ingram misses. Rebound secured by Michael Russell.

[00:38] Team_061 possession (Score: 22-25)
Jayson Holiday attempts a Layup. Contested by Kevin Simons (4.5 feet, ZONE). JAYSON HOLIDAY MAKES IT! Assist: Michael Russell
Score: 24-25

[00:24] Team_091 possession (Score: 24-25)
FOUL! Offensive foul on Rudy Bridges! Michael Russell drew the charge! [Team fouls: 5] (Rudy Bridges: 1 personal fouls) TURNOVER! (dead ball)

[00:10] Team_061 possession (Score: 24-25)
Michael Russell makes the Layup and draws the foul on Kevin Simons! And-1! Michael Russell to the line for 1. [BONUS: 6 team fouls] (Kevin Simons: 2 personal fouls)   FT 1/1: GOOD Michael Russell makes 1/1 from the line.
Score: 27-25

================================================================================
                              1ST QUARTER COMPLETE                              
================================================================================

1ST QUARTER SCORE: Team_061 27, Team_091 25

BOX SCORE:
================================================================================

Team_061
--------------------------------------------------------------------------------
Player                MIN  PTS  REB  AST  TO      FG   FG%      3P   3P%
--------------------------------------------------------------------------------
Michael Russell        12   10    4    1   0   4/7    57.1     0/0   0.0
Jayson Holiday         12    7    0    0   0   3/5    60.0     0/0   0.0
Draymond Banchero      12    4    5    3   0   2/3    66.7     0/0   0.0
Bam Sexton             12    3    3    1   0   2/4    50.0     0/0   0.0
Brandon Russell        12    3    0    1   0   1/3    33.3     0/0   0.0

TEAM: FG: 12/22 (54.5%), 3PT: 2/10 (20.0%), REB: 13 (4 off, 9 def), AST: 6, TO: 2
TEAM FOULS: 8 [Team_091 in BONUS]


Team_091
--------------------------------------------------------------------------------
Player                MIN  PTS  REB  AST  TO      FG   FG%      3P   3P%
--------------------------------------------------------------------------------
D'Angelo Ingram        12    9    0    0   0   3/6    50.0     0/0   0.0
Kevin Simons           12    5    6    2   0   3/6    50.0     0/0   0.0
Kyrie Rozier           12    4    3    1   0   2/2   100.0     0/0   0.0
Isaiah Siakam          12    4    0    0   0   2/5    40.0     0/0   0.0
Rudy Bridges           12    2    2    0   0   1/1   100.0     0/0   0.0

TEAM: FG: 11/20 (55.0%), 3PT: 2/4 (50.0%), REB: 10 (1 off, 9 def), AST: 3, TO: 3
TEAM FOULS: 6 [Team_061 in BONUS]

================================================================================

================================================================================
                       2ND QUARTER - Team_061 vs Team_091                       
================================================================================

[12:00] Team_061 possession (Score: 27-25)
FOUL! Shooting foul on Kevin Simons. Michael Russell to the line for 2 free throws. [Team fouls: 1] (Kevin Simons: 1 personal fouls)   FT 1/2: GOOD   FT 2/2: MISS Michael Russell makes 1/2 from the line. Rebound secured by Kevin Simons.
Score: 28-25

[11:47] Team_091 possession (Score: 28-25)
Isaiah Siakam loses the ball! Stripped by Jayson Holiday! TURNOVER! (live ball)

[11:32] Team_061 possession (Score: 28-25)
Michael Russell attempts a Midrange. Contested by Rudy Bridges (4.8 feet, MAN). Michael Russell misses. Rebound secured by Rudy Bridges.

[11:15] Team_091 possession (Score: 28-25)
D'Angelo Ingram drives to the basket... D'Angelo Ingram loses the ball! Stripped by Bam Sexton! TURNOVER! (live ball)

[11:00] Team_061 possession (Score: 28-25)
FOUL! Reach-in foul on Isaiah Siakam during the drive. [Team fouls: 2] No free throws, side out. (Isaiah Siakam: 1 personal fouls)

[10:49] Team_061 possession (Score: 28-25)
Bam Sexton drives, picks up Kevin Simons. Help arrives from Kyrie Rozier! Bam Sexton attempts a Layup. Contested by Kyrie Rozier (4.5 feet, ZONE). BAM SEXTON MAKES IT! Assist: Brandon Russell
Score: 30-25

[10:36] Team_091 possession (Score: 30-25)
Isaiah Siakam attempts a 3Pt. Contested by Jayson Holiday (4.7 feet, MAN). Isaiah Siakam misses. Offensive rebound by Rudy Bridges! Rudy Bridges kicks it out.

[10:17] Team_091 possession (Score: 30-25)
Isaiah Siakam drives, Jayson Holiday stays with him. Isaiah Siakam attempts a Dunk. Contested by Jayson Holiday (4.8 feet, MAN). Isaiah Siakam misses. Rebound secured by Michael Russell.

[09:59] Team_061 possession (Score: 30-25)
Bam Sexton drives and kicks out. Jayson Holiday attempts a Midrange. Wide open! Isaiah Siakam is 6.2 feet away. [MAN] JAYSON HOLIDAY MAKES IT! Assist: Draymond Banchero
Score: 32-25

[09:47] Team_091 possession (Score: 32-25)
D'Angelo Ingram attempts a 3Pt. Contested by Brandon Russell (5.2 feet, ZONE). D'Angelo Ingram misses. Rebound secured by Draymond Banchero.

[09:34] Team_061 possession (Score: 32-25)
FOUL! Holding foul on Kevin Simons. [Team fouls: 3] No free throws, side out. (Kevin Simons: 2 personal fouls)

[09:19] Team_061 possession (Score: 32-25)
Bam Sexton throws a bad pass! Stolen by D'Angelo Ingram! TURNOVER! (live ball)

[09:06] Team_091 possession (Score: 32-25)
Rudy Bridges attempts a 3Pt. Contested by Brandon Russell (4.5 feet, ZONE). Rudy Bridges misses. Rebound secured by Draymond Banchero.

[08:54] Team_061 possession (Score: 32-25)
Bam Sexton attempts a Layup. BLOCKED BY KEVIN SIMONS! Ball goes out off Kevin Simons. Bam Sexton's ball!

[08:39] Team_061 possession (Score: 32-25)
Draymond Banchero drives and kicks out. Brandon Russell attempts a 3Pt. Contested by Kyrie Rozier (4.7 feet, MAN). Brandon Russell misses. Offensive rebound by Michael Russell! Michael Russell kicks it out.

[08:25] Team_061 possession (Score: 32-25)
Bam Sexton drives, Kevin Simons stays with him. Bam Sexton attempts a Layup. Contested by Kevin Simons (4.8 feet, ZONE). BAM SEXTON MAKES IT!
Score: 34-25

[08:05] Team_091 possession (Score: 34-25)
D'Angelo Ingram attempts a 3Pt. Wide open! Bam Sexton is 6.2 feet away. [MAN] D'Angelo Ingram misses. Rebound secured by Bam Sexton.

[07:50] Team_061 possession (Score: 34-25)
Brandon Russell makes the Dunk and draws the foul on Kevin Simons! And-1! Brandon Russell to the line for 1. [Team fouls: 4] (Kevin Simons: 3 personal fouls)   FT 1/1: GOOD Brandon Russell makes 1/1 from the line.
Score: 37-25

[07:35] Team_091 possession (Score: 37-25)
Kyrie Rozier drives to the basket... FOUL! Offensive foul on Kyrie Rozier! Draymond Banchero drew the charge! [Team fouls: 5] (Kyrie Rozier: 1 personal fouls) TURNOVER! (dead ball)

[07:24] Team_061 possession (Score: 37-25)
FOUL! Shooting foul on Kyrie Rozier. Bam Sexton to the line for 2 free throws. [BONUS: 6 team fouls] (Kyrie Rozier: 2 personal fouls)   FT 1/2: MISS   FT 2/2: GOOD Bam Sexton makes 1/2 from the line.
Score: 38-25

[07:05] Team_091 possession (Score: 38-25)
D'Angelo Ingram attempts a Midrange. Contested by Jayson Holiday (5.7 feet, ZONE). D'Angelo Ingram misses. Rebound secured by Draymond Banchero.

[06:53] Team_061 possession (Score: 38-25)
FOUL! Shooting foul on D'Angelo Ingram. Brandon Russell to the line for 2 free throws. [BONUS: 7 team fouls] (D'Angelo Ingram: 1 personal fouls)   FT 1/2: MISS   FT 2/2: GOOD Brandon Russell makes 1/2 from the line.
Score: 39-25

[06:38] Team_091 possession (Score: 39-25)
Isaiah Siakam attempts a Layup. BLOCKED BY MICHAEL RUSSELL! Ball deflects out of bounds off Isaiah Siakam.

[06:23] Team_061 possession (Score: 39-25)
Brandon Russell attempts a Midrange. Contested by Kyrie Rozier (5.1 feet, MAN). BRANDON RUSSELL MAKES IT!
Score: 41-25

[06:08] Team_091 possession (Score: 41-25)
D'Angelo Ingram attempts a 3Pt. Wide open! Bam Sexton is 6.3 feet away. [MAN] D'Angelo Ingram misses. Rebound secured by Michael Russell.

[05:55] Team_061 possession (Score: 41-25)
Jayson Holiday drives to the basket... FOUL! Offensive foul on Jayson Holiday! Isaiah Siakam drew the charge! [Team fouls: 1] (Jayson Holiday: 1 personal fouls) TURNOVER! (dead ball)

[05:43] Team_091 possession (Score: 41-25)
Rudy Bridges drives, Michael Russell stays with him. Rudy Bridges attempts a Layup. Contested by Michael Russell (5.1 feet, MAN). Rudy Bridges misses. Rebound secured by Draymond Banchero.

[05:33] Team_061 possession (Score: 41-25)
Jayson Holiday attempts a 3Pt. Wide open! Isaiah Siakam is 7.0 feet away. [MAN] Jayson Holiday misses. Rebound secured by Kevin Simons.

[05:20] Team_091 possession (Score: 41-25)
Kyrie Rozier attempts a Midrange. Contested by Bam Sexton (5.8 feet, ZONE). KYRIE ROZIER MAKES IT!
Score: 41-27

[05:03] Team_061 possession (Score: 41-27)
Jayson Holiday attempts a 3Pt. Contested by Kyrie Rozier (5.4 feet, ZONE). Jayson Holiday misses. Rebound secured by Kyrie Rozier.

[04:52] Team_091 possession (Score: 41-27)
FOUL! Reach-in foul on Brandon Russell during the drive. [Team fouls: 2] No free throws, side out. (Brandon Russell: 1 personal fouls)

[04:35] Team_091 possession (Score: 41-27)
Kevin Simons drives, Bam Sexton stays with him. Kevin Simons attempts a Dunk. Wide open! Bam Sexton is 6.0 feet away. [ZONE] KEVIN SIMONS MAKES IT!
Score: 41-29

[04:21] Team_061 possession (Score: 41-29)
Jayson Holiday attempts a Layup. Contested by Kevin Simons (5.4 feet, ZONE). JAYSON HOLIDAY MAKES IT! Assist: Draymond Banchero
Score: 43-29

[04:03] Team_091 possession (Score: 43-29)
Rudy Bridges attempts a 3Pt. Contested by Michael Russell (5.3 feet, MAN). RUDY BRIDGES MAKES IT! Assist: Isaiah Siakam
Score: 43-32

[03:48] Team_061 possession (Score: 43-32)
Bam Sexton attempts a 3Pt. Contested by Kyrie Rozier (5.6 feet, ZONE). Bam Sexton misses. Rebound secured by Kevin Simons.

[03:34] Team_091 possession (Score: 43-32)
Kevin Simons attempts a Layup. Contested by Draymond Banchero (4.4 feet, ZONE). KEVIN SIMONS MAKES IT! Assist: D'Angelo Ingram
Score: 43-34

[03:21] Team_061 possession (Score: 43-34)
Brandon Russell attempts a 3Pt. Contested by Kyrie Rozier (5.5 feet, MAN). Brandon Russell misses. Rebound secured by Kyrie Rozier.

[03:06] Team_091 possession (Score: 43-34)
Isaiah Siakam attempts a 3Pt. Contested by Brandon Russell (5.3 feet, ZONE). Isaiah Siakam misses. Rebound secured by Draymond Banchero.

[02:53] Team_061 possession (Score: 43-34)
Brandon Russell attempts a 3Pt. Contested by Kyrie Rozier (5.6 feet, MAN). BRANDON RUSSELL MAKES IT! Assist: Bam Sexton
Score: 46-34

[02:38] Team_091 possession (Score: 46-34)
FOUL! Reach-in foul on Draymond Banchero during the drive. [Team fouls: 3] No free throws, side out. (Draymond Banchero: 1 personal fouls)

[02:24] Team_091 possession (Score: 46-34)
Kevin Simons attempts a Layup. Contested by Draymond Banchero (4.5 feet, ZONE). Kevin Simons misses. Rebound secured by Michael Russell.

[02:12] Team_061 possession (Score: 46-34)
FOUL! Reach-in foul on Kevin Simons during the drive. [IN THE BONUS! 8 team fouls] Jayson Holiday to the line for 2 free throws. (Kevin Simons: 4 personal fouls)   FT 1/2: GOOD   FT 2/2: GOOD Jayson Holiday makes 2/2 from the line.
Score: 48-34

[01:58] Team_091 possession (Score: 48-34)
Kevin Simons attempts a Layup. Contested by Draymond Banchero (4.6 feet, ZONE). KEVIN SIMONS MAKES IT! Assist: Isaiah Siakam
Score: 48-36

[01:40] Team_061 possession (Score: 48-36)
Brandon Russell attempts a Midrange. Contested by Kyrie Rozier (5.7 feet, MAN). Brandon Russell misses. Rebound secured by Kevin Simons.

[01:22] Team_091 possession (Score: 48-36)
D'Angelo Ingram drives and kicks out. Kevin Simons attempts a Midrange. Contested by Draymond Banchero (4.7 feet, MAN). Kevin Simons misses. Rebound secured by Michael Russell.

[01:10] Team_061 possession (Score: 48-36)
Jayson Holiday attempts a Layup. Contested by Kevin Simons (5.9 feet, ZONE). JAYSON HOLIDAY MAKES IT! Assist: Draymond Banchero
Score: 50-36

[00:53] Team_091 possession (Score: 50-36)
Rudy Bridges attempts a 3Pt. Contested by Michael Russell (5.9 feet, MAN). Rudy Bridges misses. Rebound secured by Bam Sexton.

[00:40] Team_061 possession (Score: 50-36)
Brandon Russell attempts a 3Pt. Contested by Kyrie Rozier (5.9 feet, MAN). BRANDON RUSSELL MAKES IT!
Score: 53-36

[00:28] Team_091 possession (Score: 53-36)
D'Angelo Ingram attempts a 3Pt. Wide open! Brandon Russell is 6.2 feet away. [ZONE] D'Angelo Ingram misses. FOUL! Loose ball foul on Draymond Banchero during the rebound battle. [Team fouls: 4] No free throws, side out. (Draymond Banchero: 2 personal fouls)

[00:09] Team_091 possession (Score: 53-36)
D'Angelo Ingram attempts a Midrange. Wide open! Bam Sexton is 6.9 feet away. [ZONE] D'Angelo Ingram misses. Offensive rebound by Rudy Bridges! Rudy Bridges kicks it out.

================================================================================
                              2ND QUARTER COMPLETE                              
================================================================================

2ND QUARTER SCORE: Team_061 26, Team_091 11

BOX SCORE:
================================================================================

Team_061
--------------------------------------------------------------------------------
Player                MIN  PTS  REB  AST  TO      FG   FG%      3P   3P%
--------------------------------------------------------------------------------
Brandon Russell        24   12    0    1   0   5/7    71.4     0/0   0.0
Jayson Holiday         24    8    0    0   0   4/6    66.7     0/0   0.0
Bam Sexton             24    5    2    1   0   3/4    75.0     0/0   0.0
Michael Russell        24    0    5    0   0   0/2     0.0     0/0   0.0
Draymond Banchero      24    0    5    3   0   0/0     0.0     0/0   0.0

TEAM: FG: 12/19 (63.2%), 3PT: 2/6 (33.3%), REB: 12 (1 off, 11 def), AST: 5, TO: 2
TEAM FOULS: 4


Team_091
--------------------------------------------------------------------------------
Player                MIN  PTS  REB  AST  TO      FG   FG%      3P   3P%
--------------------------------------------------------------------------------
Kevin Simons           24    6    4    0   0   3/4    75.0     0/0   0.0
Rudy Bridges           24    3    4    0   0   1/4    25.0     0/0   0.0
Kyrie Rozier           24    2    2    0   0   1/1   100.0     0/0   0.0
Isaiah Siakam          24    0    0    2   0   0/3     0.0     0/0   0.0
D'Angelo Ingram        24    0    0    1   0   0/5     0.0     0/0   0.0

TEAM: FG: 5/17 (29.4%), 3PT: 1/7 (14.3%), REB: 10 (3 off, 7 def), AST: 3, TO: 3
TEAM FOULS: 8 [Team_061 in BONUS]

================================================================================

================================================================================
                       3RD QUARTER - Team_061 vs Team_091                       
================================================================================

[12:00] Team_061 possession (Score: 53-36)
Michael Russell attempts a 3Pt. Contested by Rudy Bridges (4.6 feet, MAN). Michael Russell misses. Offensive rebound by Draymond Banchero! Draymond Banchero's putback is no good. Rebound secured by Kyrie Rozier.

[11:46] Team_091 possession (Score: 53-36)
Isaiah Siakam attempts a 3Pt. Contested by Brandon Russell (4.2 feet, ZONE). Isaiah Siakam misses. Rebound secured by Draymond Banchero.

[11:29] Team_061 possession (Score: 53-36)
Bam Sexton attempts a 3Pt. Contested by D'Angelo Ingram (5.1 feet, MAN). Bam Sexton misses. Rebound secured by Rudy Bridges.

[11:15] Team_091 possession (Score: 53-36)
FOUL! Shooting foul on Bam Sexton. Kyrie Rozier to the line for 2 free throws. [Team fouls: 1] (Bam Sexton: 1 personal fouls)   FT 1/2: GOOD   FT 2/2: GOOD Kyrie Rozier makes 2/2 from the line.
Score: 53-38

[11:01] Team_061 possession (Score: 53-38)
Bam Sexton attempts a 3Pt. Contested by D'Angelo Ingram (5.1 feet, MAN). Bam Sexton misses. Rebound secured by Rudy Bridges.

[10:44] Team_091 possession (Score: 53-38)
FOUL! Reach-in foul on Draymond Banchero during the drive. [Team fouls: 2] No free throws, side out. (Draymond Banchero: 1 personal fouls)

[10:30] Team_091 possession (Score: 53-38)
FOUL! Holding foul on Bam Sexton. [Team fouls: 3] No free throws, side out. (Bam Sexton: 2 personal fouls)

[10:14] Team_091 possession (Score: 53-38)
FOUL! Shooting foul on Bam Sexton. Kevin Simons to the line for 2 free throws. [Team fouls: 4] (Bam Sexton: 3 personal fouls)   FT 1/2: MISS   FT 2/2: GOOD Kevin Simons makes 1/2 from the line.
Score: 53-39

[09:59] Team_061 possession (Score: 53-39)
Draymond Banchero attempts a Layup. BLOCKED BY KEVIN SIMONS! Ball is loose! Offensive rebound by Draymond Banchero! Draymond Banchero kicks it out.

[09:49] Team_061 possession (Score: 53-39)
FOUL! Holding foul on Rudy Bridges. [Team fouls: 1] No free throws, side out. (Rudy Bridges: 1 personal fouls)

[09:34] Team_061 possession (Score: 53-39)
Draymond Banchero attempts a Layup. Contested by Kevin Simons (4.2 feet, ZONE). DRAYMOND BANCHERO MAKES IT!
Score: 55-39

[09:21] Team_091 possession (Score: 55-39)
Rudy Bridges attempts a Dunk. BLOCKED BY DRAYMOND BANCHERO! Ball deflects out of bounds off Rudy Bridges.

[09:03] Team_061 possession (Score: 55-39)
Bam Sexton throws a bad pass out of bounds! TURNOVER! (dead ball)

[08:49] Team_091 possession (Score: 55-39)
Isaiah Siakam attempts a 3Pt. Contested by Michael Russell (4.0 feet, ZONE). Isaiah Siakam misses. Rebound secured by Draymond Banchero.

[08:32] Team_061 possession (Score: 55-39)
Brandon Russell attempts a 3Pt. Contested by Isaiah Siakam (5.8 feet, ZONE). Brandon Russell misses. Rebound secured by Rudy Bridges.

[08:17] Team_091 possession (Score: 55-39)
Kyrie Rozier attempts a Midrange. Contested by Draymond Banchero (2.7 feet, ZONE). Kyrie Rozier misses. Offensive rebound by Kevin Simons! Kevin Simons puts it back in!
Score: 55-41

[08:02] Team_061 possession (Score: 55-41)
Bam Sexton drives, picks up D'Angelo Ingram. Help arrives from Kyrie Rozier! Bam Sexton attempts a Dunk. Contested by Kyrie Rozier (5.1 feet, MAN). BAM SEXTON MAKES IT! Assist: Jayson Holiday
Score: 57-41

[07:47] Team_091 possession (Score: 57-41)
D'Angelo Ingram attempts a Layup. Contested by Bam Sexton (5.8 feet, MAN). D'ANGELO INGRAM MAKES IT! Assist: Isaiah Siakam
Score: 57-43

[07:36] Team_061 possession (Score: 57-43)
FOUL! Shooting foul on Kevin Simons. Bam Sexton to the line for 2 free throws. [Team fouls: 2] (Kevin Simons: 1 personal fouls)   FT 1/2: GOOD   FT 2/2: GOOD Bam Sexton makes 2/2 from the line.
Score: 59-43

[07:27] Team_091 possession (Score: 59-43)
Rudy Bridges drives and kicks out. Kevin Simons attempts a Midrange. Contested by Draymond Banchero (2.6 feet, MAN). Kevin Simons misses. Rebound secured by Michael Russell.

[07:15] Team_061 possession (Score: 59-43)
Michael Russell drives, Rudy Bridges stays with him. Michael Russell attempts a Dunk. Contested by Rudy Bridges (4.6 feet, MAN). MICHAEL RUSSELL MAKES IT! Assist: Draymond Banchero
Score: 61-43

[06:59] Team_091 possession (Score: 61-43)
Rudy Bridges attempts a Layup. Contested by Michael Russell (3.8 feet, MAN). Rudy Bridges misses. Rebound secured by Draymond Banchero.

[06:49] Team_061 possession (Score: 61-43)
Bam Sexton drives, Kevin Simons stays with him. Bam Sexton attempts a Dunk. Contested by Kevin Simons (4.0 feet, ZONE). BAM SEXTON MAKES IT! Assist: Jayson Holiday
Score: 63-43

[06:36] Team_091 possession (Score: 63-43)
FOUL! Reach-in foul on Michael Russell during the drive. [IN THE BONUS! 5 team fouls] Rudy Bridges to the line for 2 free throws. (Michael Russell: 1 personal fouls)   FT 1/2: GOOD   FT 2/2: GOOD Rudy Bridges makes 2/2 from the line.
Score: 63-45

[06:21] Team_061 possession (Score: 63-45)
FOUL! Reach-in foul on Kevin Simons during the drive. [Team fouls: 3] No free throws, side out. (Kevin Simons: 2 personal fouls)

[06:08] Team_061 possession (Score: 63-45)
Bam Sexton attempts a 3Pt. Contested by Kyrie Rozier (4.5 feet, ZONE). Bam Sexton misses. Rebound secured by Rudy Bridges.

[05:54] Team_091 possession (Score: 63-45)
D'Angelo Ingram drives, Draymond Banchero stays with him. D'Angelo Ingram attempts a Layup. Contested by Draymond Banchero (3.6 feet, ZONE). D'ANGELO INGRAM MAKES IT! Assist: Kyrie Rozier
Score: 63-47

[05:42] Team_061 possession (Score: 63-47)
Michael Russell attempts a 3Pt. Contested by Rudy Bridges (4.6 feet, MAN). MICHAEL RUSSELL MAKES IT!
Score: 66-47

[05:25] Team_091 possession (Score: 66-47)
FOUL! Reach-in foul on Jayson Holiday during the drive. [IN THE BONUS! 6 team fouls] Isaiah Siakam to the line for 2 free throws. (Jayson Holiday: 1 personal fouls)   FT 1/2: GOOD   FT 2/2: GOOD Isaiah Siakam makes 2/2 from the line.
Score: 66-49

[05:12] Team_061 possession (Score: 66-49)
Draymond Banchero attempts a 3Pt. Contested by D'Angelo Ingram (5.4 feet, ZONE). Draymond Banchero misses. Rebound secured by Rudy Bridges.

[04:57] Team_091 possession (Score: 66-49)
Rudy Bridges attempts a 3Pt. Contested by Brandon Russell (4.0 feet, ZONE). RUDY BRIDGES MAKES IT! Assist: D'Angelo Ingram
Score: 66-52

[04:41] Team_061 possession (Score: 66-52)
Draymond Banchero attempts a Midrange. Contested by Kevin Simons (4.3 feet, MAN). Draymond Banchero misses. Rebound secured by Rudy Bridges.

[04:29] Team_091 possession (Score: 66-52)
Isaiah Siakam drives, Draymond Banchero stays with him. Isaiah Siakam attempts a Layup. Contested by Draymond Banchero (3.0 feet, ZONE). Isaiah Siakam misses. Rebound secured by Michael Russell.

[04:15] Team_061 possession (Score: 66-52)
Brandon Russell attempts a Midrange. Contested by Kevin Simons (3.9 feet, ZONE). Brandon Russell misses. Offensive rebound by Michael Russell! Michael Russell's putback is no good. Rebound secured by Kyrie Rozier.

[03:59] Team_091 possession (Score: 66-52)
Kevin Simons drives to the basket... Kevin Simons throws a bad pass out of bounds! TURNOVER! (dead ball)

[03:46] Team_061 possession (Score: 66-52)
FOUL! Reach-in foul on D'Angelo Ingram during the drive. [Team fouls: 4] No free throws, side out. (D'Angelo Ingram: 1 personal fouls)

[03:31] Team_061 possession (Score: 66-52)
Michael Russell attempts a 3Pt. Contested by Rudy Bridges (4.7 feet, MAN). Michael Russell misses. Rebound secured by Kevin Simons.

[03:13] Team_091 possession (Score: 66-52)
Kyrie Rozier attempts a Midrange. Contested by Brandon Russell (4.1 feet, MAN). Kyrie Rozier misses. Rebound secured by Draymond Banchero.

[02:58] Team_061 possession (Score: 66-52)
FOUL! Shooting foul on D'Angelo Ingram. Bam Sexton to the line for 2 free throws. [BONUS: 5 team fouls] (D'Angelo Ingram: 2 personal fouls)   FT 1/2: GOOD   FT 2/2: GOOD Bam Sexton makes 2/2 from the line.
Score: 68-52

[02:44] Team_091 possession (Score: 68-52)
Rudy Bridges makes the Layup and draws the foul on Draymond Banchero! And-1! Rudy Bridges to the line for 1. [BONUS: 7 team fouls] (Draymond Banchero: 2 personal fouls)   FT 1/1: GOOD Rudy Bridges makes 1/1 from the line.
Score: 68-55

[02:30] Team_061 possession (Score: 68-55)
Brandon Russell attempts a 3Pt. Wide open! Isaiah Siakam is 6.1 feet away. [ZONE] Brandon Russell misses. Rebound secured by Kyrie Rozier.

[02:15] Team_091 possession (Score: 68-55)
FOUL! Shooting foul on Draymond Banchero. Kevin Simons to the line for 2 free throws. [BONUS: 8 team fouls] (Draymond Banchero: 3 personal fouls)   FT 1/2: GOOD   FT 2/2: MISS Kevin Simons makes 1/2 from the line. Rebound secured by Michael Russell.
Score: 68-56

[02:05] Team_061 possession (Score: 68-56)
FOUL! Shooting foul on Kyrie Rozier. Brandon Russell to the line for 2 free throws. [BONUS: 6 team fouls] (Kyrie Rozier: 1 personal fouls)   FT 1/2: MISS   FT 2/2: GOOD Brandon Russell makes 1/2 from the line.
Score: 69-56

[01:55] Team_091 possession (Score: 69-56)
D'Angelo Ingram attempts a 3Pt. Contested by Brandon Russell (5.0 feet, ZONE). D'Angelo Ingram misses. Rebound secured by Bam Sexton.

[01:41] Team_061 possession (Score: 69-56)
FOUL! Shooting foul on Kyrie Rozier. Draymond Banchero to the line for 2 free throws. [BONUS: 7 team fouls] (Kyrie Rozier: 2 personal fouls)   FT 1/2: GOOD   FT 2/2: GOOD Draymond Banchero makes 2/2 from the line.
Score: 71-56

[01:21] Team_091 possession (Score: 71-56)
Kevin Simons attempts a 3Pt. Contested by Draymond Banchero (3.3 feet, MAN). KEVIN SIMONS MAKES IT! Assist: Rudy Bridges
Score: 71-59

[01:03] Team_061 possession (Score: 71-59)
Draymond Banchero drives, Kevin Simons stays with him. Draymond Banchero attempts a Dunk. Contested by Kevin Simons (4.7 feet, MAN). Draymond Banchero misses. Rebound secured by Kevin Simons.

[00:49] Team_091 possession (Score: 71-59)
Isaiah Siakam attempts a Midrange. Contested by Michael Russell (4.5 feet, ZONE). Isaiah Siakam misses. Rebound secured by Bam Sexton.

[00:35] Team_061 possession (Score: 71-59)
Draymond Banchero makes the Layup and draws the foul on Kevin Simons! And-1! Draymond Banchero to the line for 1. [BONUS: 8 team fouls] (Kevin Simons: 3 personal fouls)   FT 1/1: GOOD Draymond Banchero makes 1/1 from the line.
Score: 74-59

[00:18] Team_091 possession (Score: 74-59)
Kevin Simons drives to the basket... Kevin Simons loses the ball! Stripped by Draymond Banchero! TURNOVER! (live ball)

[00:04] Team_061 possession (Score: 74-59)
Jayson Holiday attempts a Midrange. Wide open! Isaiah Siakam is 6.5 feet away. [MAN] Jayson Holiday misses. Rebound secured by Rudy Bridges.

================================================================================
                              3RD QUARTER COMPLETE                              
================================================================================

3RD QUARTER SCORE: Team_061 21, Team_091 23

BOX SCORE:
================================================================================

Team_061
--------------------------------------------------------------------------------
Player                MIN  PTS  REB  AST  TO      FG   FG%      3P   3P%
--------------------------------------------------------------------------------
Bam Sexton             36    8    2    0   0   4/7    57.1     0/0   0.0
Draymond Banchero      36    7    5    1   0   3/6    50.0     0/0   0.0
Michael Russell        36    5    3    0   0   2/4    50.0     0/0   0.0
Brandon Russell        36    1    0    0   0   1/4    25.0     0/0   0.0
Jayson Holiday         36    0    0    2   0   0/1     0.0     0/0   0.0

TEAM: FG: 10/22 (45.5%), 3PT: 1/9 (11.1%), REB: 12 (3 off, 9 def), AST: 3, TO: 1
TEAM FOULS: 8 [Team_091 in BONUS]


Team_091
--------------------------------------------------------------------------------
Player                MIN  PTS  REB  AST  TO      FG   FG%      3P   3P%
--------------------------------------------------------------------------------
Rudy Bridges           36    8    7    1   0   3/6    50.0     0/0   0.0
Kevin Simons           36    6    3    0   0   3/4    75.0     0/0   0.0
D'Angelo Ingram        36    4    0    1   0   2/3    66.7     0/0   0.0
Kyrie Rozier           36    2    3    1   0   1/2    50.0     0/0   0.0
Isaiah Siakam          36    2    0    1   0   1/5    20.0     0/0   0.0

TEAM: FG: 10/20 (50.0%), 3PT: 2/5 (40.0%), REB: 11 (1 off, 10 def), AST: 4, TO: 2
TEAM FOULS: 8 [Team_061 in BONUS]

================================================================================

================================================================================
                       4TH QUARTER - Team_061 vs Team_091                       
================================================================================

[12:00] Team_061 possession (Score: 74-59)
Bam Sexton attempts a 3Pt. Contested by D'Angelo Ingram (5.4 feet, MAN). BAM SEXTON MAKES IT! Assist: Brandon Russell
Score: 77-59

[11:44] Team_091 possession (Score: 77-59)
Isaiah Siakam drives, picks up Draymond Banchero. Help arrives from Jayson Holiday! Isaiah Siakam attempts a Layup. Contested by Jayson Holiday (3.2 feet, ZONE). Isaiah Siakam misses. Offensive rebound by Kevin Simons! Kevin Simons's putback is no good. Rebound secured by Michael Russell.

[11:30] Team_061 possession (Score: 77-59)
Draymond Banchero drives and kicks out. Brandon Russell attempts a 3Pt. Contested by Kyrie Rozier (4.4 feet, ZONE). Brandon Russell misses. Rebound secured by Kyrie Rozier.

[11:15] Team_091 possession (Score: 77-59)
D'Angelo Ingram attempts a 3Pt. Contested by Bam Sexton (6.0 feet, MAN). D'Angelo Ingram misses. Rebound secured by Bam Sexton.

[11:02] Team_061 possession (Score: 77-59)
FOUL! Shooting foul on Kyrie Rozier. Brandon Russell to the line for 2 free throws. [Team fouls: 1] (Kyrie Rozier: 1 personal fouls)   FT 1/2: MISS   FT 2/2: GOOD Brandon Russell makes 1/2 from the line.
Score: 78-59

[10:47] Team_091 possession (Score: 78-59)
Rudy Bridges drives and kicks out. Kevin Simons attempts a 3Pt. Contested by Draymond Banchero (3.1 feet, MAN). Kevin Simons misses. Rebound secured by Bam Sexton.

[10:30] Team_061 possession (Score: 78-59)
Jayson Holiday drives to the basket... FOUL! Offensive foul on Jayson Holiday! Kevin Simons drew the charge! [Team fouls: 1] (Jayson Holiday: 1 personal fouls) TURNOVER! (dead ball)

[10:16] Team_091 possession (Score: 78-59)
D'Angelo Ingram attempts a 3Pt. Contested by Brandon Russell (5.1 feet, ZONE). D'Angelo Ingram misses. Rebound secured by Draymond Banchero.

[09:59] Team_061 possession (Score: 78-59)
Jayson Holiday attempts a 3Pt. Wide open! Isaiah Siakam is 6.5 feet away. [MAN] Jayson Holiday misses. Offensive rebound by Draymond Banchero! Draymond Banchero's putback is no good. Rebound secured by Rudy Bridges.

[09:41] Team_091 possession (Score: 78-59)
Rudy Bridges attempts a 3Pt. Contested by Brandon Russell (4.4 feet, ZONE). Rudy Bridges misses. Rebound secured by Draymond Banchero.

[09:26] Team_061 possession (Score: 78-59)
Bam Sexton drives and kicks out. Bam Sexton attempts a Midrange. Contested by Kevin Simons (4.3 feet, ZONE). Bam Sexton misses. Rebound secured by Kevin Simons.

[09:12] Team_091 possession (Score: 78-59)
D'Angelo Ingram attempts a Midrange. Wide open! Bam Sexton is 6.1 feet away. [MAN] D'Angelo Ingram misses. Offensive rebound by Rudy Bridges! Rudy Bridges kicks it out.

[08:55] Team_091 possession (Score: 78-59)
Isaiah Siakam makes the Midrange and draws the foul on Michael Russell! And-1! Isaiah Siakam to the line for 1. [Team fouls: 2] (Michael Russell: 1 personal fouls)   FT 1/1: GOOD Isaiah Siakam makes 1/1 from the line.
Score: 78-62

[08:38] Team_061 possession (Score: 78-62)
Michael Russell attempts a Midrange. Contested by Rudy Bridges (5.1 feet, MAN). MICHAEL RUSSELL MAKES IT! Assist: Bam Sexton
Score: 80-62

[08:20] Team_091 possession (Score: 80-62)
FOUL! Holding foul on Brandon Russell. [Team fouls: 3] No free throws, side out. (Brandon Russell: 1 personal fouls)

[08:02] Team_091 possession (Score: 80-62)
Rudy Bridges attempts a Midrange. Contested by Draymond Banchero (3.4 feet, ZONE). Rudy Bridges misses. Rebound secured by Bam Sexton.

[07:48] Team_061 possession (Score: 80-62)
Bam Sexton drives and kicks out. Bam Sexton attempts a 3Pt. Contested by Rudy Bridges (5.1 feet, ZONE). Bam Sexton misses. Offensive rebound by Draymond Banchero! Draymond Banchero's putback is no good. Offensive rebound by Draymond Banchero! Draymond Banchero kicks it out.

[07:38] Team_061 possession (Score: 80-62)
Michael Russell attempts a 3Pt. Contested by Rudy Bridges (5.2 feet, MAN). MICHAEL RUSSELL MAKES IT! Assist: Jayson Holiday
Score: 83-62

[07:22] Team_091 possession (Score: 83-62)
FOUL! Holding foul on Bam Sexton. [Team fouls: 4] No free throws, side out. (Bam Sexton: 1 personal fouls)

[07:09] Team_091 possession (Score: 83-62)
D'Angelo Ingram attempts a Midrange. Contested by Jayson Holiday (5.7 feet, ZONE). D'Angelo Ingram misses. Rebound secured by Michael Russell.

[06:54] Team_061 possession (Score: 83-62)
Bam Sexton drives to the basket... Bam Sexton loses the ball! Stripped by D'Angelo Ingram! TURNOVER! (live ball)

[06:40] Team_091 possession (Score: 83-62)
D'Angelo Ingram loses control! Ball rolls out of bounds! TURNOVER! (dead ball)

[06:40] Substitution (Team_061): Brandon Russell OUT → Evan Rose IN (stamina_rule2)

[06:40] Substitution (Team_061): Jayson Holiday OUT → Gary Fox IN (stamina_rule2)

[06:40] Substitution (Team_061): Michael Russell OUT → Desmond Morant IN (stamina_rule2)

[06:40] Substitution (Team_061): Bam Sexton OUT → Stephen Towns IN (stamina_rule2)

[06:40] Substitution (Team_061): Draymond Banchero OUT → Tim Durant IN (stamina_rule2)

[06:40] Substitution (Team_091): Kyrie Rozier OUT → Karl Morant IN (stamina_rule2)

[06:40] Substitution (Team_091): Isaiah Siakam OUT → Julius Barnes IN (stamina_rule2)

[06:40] Substitution (Team_091): Rudy Bridges OUT → Tim Antetokounmpo IN (stamina_rule2)

[06:40] Substitution (Team_091): D'Angelo Ingram OUT → Zion Mitchell IN (stamina_rule2)

[06:40] Substitution (Team_091): Kevin Simons OUT → Ja George IN (stamina_rule2)

[06:27] Team_061 possession (Score: 83-62)
Stephen Towns attempts a 3Pt. Contested by Karl Morant (5.2 feet, ZONE). Stephen Towns misses. Offensive rebound by Stephen Towns! Stephen Towns kicks it out.

[06:15] Team_061 possession (Score: 83-62)
FOUL! Holding foul on Karl Morant. [Team fouls: 2] No free throws, side out. (Karl Morant: 1 personal fouls)

[06:01] Team_061 possession (Score: 83-62)
Stephen Towns drives, picks up Zion Mitchell. Help arrives from Karl Morant! Stephen Towns attempts a Layup. Contested by Karl Morant (5.2 feet, MAN). STEPHEN TOWNS MAKES IT! Assist: Gary Fox
Score: 85-62

[05:45] Team_091 possession (Score: 85-62)
Zion Mitchell attempts a 3Pt. Contested by Desmond Morant (4.6 feet, ZONE). Zion Mitchell misses. Offensive rebound by Zion Mitchell! Zion Mitchell kicks it out.

[05:32] Team_091 possession (Score: 85-62)
Tim Antetokounmpo attempts a 3Pt. Contested by Desmond Morant (4.6 feet, ZONE). TIM ANTETOKOUNMPO MAKES IT! Assist: Julius Barnes
Score: 85-65

[05:16] Team_061 possession (Score: 85-65)
Tim Durant attempts a Layup. Contested by Ja George (5.3 feet, MAN). Tim Durant misses. Rebound secured by Zion Mitchell.

[05:00] Team_091 possession (Score: 85-65)
Tim Antetokounmpo attempts a 3Pt. Contested by Desmond Morant (4.6 feet, MAN). TIM ANTETOKOUNMPO MAKES IT! Assist: Julius Barnes
Score: 85-68

[04:47] Team_061 possession (Score: 85-68)
Stephen Towns drives, Zion Mitchell stays with him. Stephen Towns attempts a Dunk. Contested by Zion Mitchell (5.2 feet, MAN). STEPHEN TOWNS MAKES IT! Assist: Evan Rose
Score: 87-68

[04:33] Team_091 possession (Score: 87-68)
Ja George drives, Tim Durant stays with him. Ja George attempts a Dunk. Contested by Tim Durant (4.2 feet, MAN). JA GEORGE MAKES IT!
Score: 87-70

[04:17] Team_061 possession (Score: 87-70)
FOUL! Shooting foul on Ja George. Tim Durant to the line for 2 free throws. [Team fouls: 3] (Ja George: 1 personal fouls)   FT 1/2: GOOD   FT 2/2: GOOD Tim Durant makes 2/2 from the line.
Score: 89-70

[04:02] Team_091 possession (Score: 89-70)
FOUL! Shooting foul on Stephen Towns. Tim Antetokounmpo to the line for 2 free throws. [BONUS: 5 team fouls] (Stephen Towns: 1 personal fouls)   FT 1/2: GOOD   FT 2/2: GOOD Tim Antetokounmpo makes 2/2 from the line.
Score: 89-72

[03:48] Team_061 possession (Score: 89-72)
Stephen Towns attempts a Midrange. Contested by Julius Barnes (5.2 feet, ZONE). Stephen Towns misses. Rebound secured by Ja George.

[03:35] Team_091 possession (Score: 89-72)
Karl Morant attempts a Layup. Contested by Evan Rose (5.3 feet, MAN). KARL MORANT MAKES IT! Assist: Tim Antetokounmpo
Score: 89-74

[03:20] Team_061 possession (Score: 89-74)
FOUL! Holding foul on Ja George. [Team fouls: 4] No free throws, side out. (Ja George: 2 personal fouls)

[03:06] Team_061 possession (Score: 89-74)
FOUL! Holding foul on Zion Mitchell. [IN THE BONUS! 5 team fouls] Stephen Towns to the line for 2 free throws. (Zion Mitchell: 1 personal fouls)   FT 1/2: GOOD   FT 2/2: GOOD Stephen Towns makes 2/2 from the line.
Score: 91-74

[02:53] Team_091 possession (Score: 91-74)
Ja George drives and kicks out. FOUL! Shooting foul on Stephen Towns. Zion Mitchell to the line for 3 free throws. [BONUS: 6 team fouls] (Stephen Towns: 2 personal fouls)   FT 1/3: GOOD   FT 2/3: GOOD   FT 3/3: GOOD Zion Mitchell makes 3/3 from the line.
Score: 91-77

[02:36] Team_061 possession (Score: 91-77)
Desmond Morant drives, Tim Antetokounmpo stays with him. Desmond Morant attempts a Dunk. Contested by Tim Antetokounmpo (5.7 feet, MAN). Desmond Morant misses. FOUL! Loose ball foul on Ja George during the rebound battle. [IN THE BONUS! 6 team fouls] Stephen Towns to the line for 2 free throws. (Ja George: 3 personal fouls)   FT 1/2: MISS   FT 2/2: GOOD Stephen Towns makes 1/2 from the line.
Score: 92-77

[02:22] Team_091 possession (Score: 92-77)
Ja George drives, Tim Durant stays with him. Ja George attempts a Dunk. Contested by Tim Durant (4.2 feet, ZONE). Ja George misses. Rebound secured by Tim Durant.

[02:06] Team_061 possession (Score: 92-77)
Tim Durant attempts a Midrange. Contested by Tim Antetokounmpo (6.0 feet, ZONE). TIM DURANT MAKES IT! Assist: Evan Rose
Score: 94-77

[01:47] Team_091 possession (Score: 94-77)
Tim Antetokounmpo drives, picks up Desmond Morant. Help arrives from Evan Rose! Tim Antetokounmpo attempts a Layup. Contested by Evan Rose (4.6 feet, MAN). TIM ANTETOKOUNMPO MAKES IT! Assist: Karl Morant
Score: 94-79

[01:31] Team_061 possession (Score: 94-79)
Desmond Morant attempts a Layup. Contested by Zion Mitchell (5.2 feet, ZONE). Desmond Morant misses. Rebound secured by Tim Antetokounmpo.

[01:13] Team_091 possession (Score: 94-79)
Julius Barnes attempts a Layup. Contested by Tim Durant (4.1 feet, ZONE). JULIUS BARNES MAKES IT! Assist: Tim Antetokounmpo
Score: 94-81

[00:56] Team_061 possession (Score: 94-81)
Tim Durant drives and kicks out. Tim Durant attempts a 3Pt. Contested by Karl Morant (4.9 feet, ZONE). TIM DURANT MAKES IT! Assist: Gary Fox
Score: 97-81

[00:42] Team_091 possession (Score: 97-81)
Karl Morant attempts a 3Pt. Contested by Evan Rose (5.3 feet, MAN). Karl Morant misses. Rebound secured by Tim Durant.

[00:31] Team_061 possession (Score: 97-81)
Gary Fox attempts a 3Pt. Contested by Karl Morant (4.9 feet, ZONE). Gary Fox misses. Rebound secured by Zion Mitchell.

[00:15] Team_091 possession (Score: 97-81)
FOUL! Reach-in foul on Tim Durant during the drive. [IN THE BONUS! 7 team fouls] Ja George to the line for 2 free throws. (Tim Durant: 1 personal fouls)   FT 1/2: GOOD   FT 2/2: GOOD Ja George makes 2/2 from the line.
Score: 97-83

[00:02] Team_061 possession (Score: 97-83)
Tim Durant drives and kicks out. Stephen Towns attempts a 3Pt. Contested by Karl Morant (4.9 feet, ZONE). Stephen Towns misses. Offensive rebound by Tim Durant! Tim Durant puts it back in!
Score: 99-83

================================================================================
                              4TH QUARTER COMPLETE                              
================================================================================

4TH QUARTER SCORE: Team_061 25, Team_091 24

BOX SCORE:
================================================================================

Team_061
--------------------------------------------------------------------------------
Player                MIN  PTS  REB  AST  TO      FG   FG%      3P   3P%
--------------------------------------------------------------------------------
Tim Durant              7    9    3    0   0   4/5    80.0     0/0   0.0
Stephen Towns           7    7    1    0   0   4/5    80.0     0/0   0.0
Michael Russell        42    5    2    0   0   2/2   100.0     0/0   0.0
Bam Sexton             42    3    3    1   0   1/2    50.0     0/0   0.0
Brandon Russell        42    1    0    1   0   1/1   100.0     0/0   0.0
Draymond Banchero      42    0    3    0   0   0/1     0.0     0/0   0.0
Jayson Holiday         42    0    0    1   0   0/1     0.0     0/0   0.0
Gary Fox                7    0    0    2   0   0/1     0.0     0/0   0.0
Evan Rose               7    0    0    2   0   0/0     0.0     0/0   0.0
Desmond Morant          7    0    0    0   0   0/1     0.0     0/0   0.0

TEAM: FG: 12/19 (63.2%), 3PT: 2/4 (50.0%), REB: 12 (4 off, 8 def), AST: 7, TO: 2
TEAM FOULS: 7 [Team_091 in BONUS]


Team_091
--------------------------------------------------------------------------------
Player                MIN  PTS  REB  AST  TO      FG   FG%      3P   3P%
--------------------------------------------------------------------------------
Tim Antetokounmpo       7   10    1    2   0   4/4   100.0     0/0   0.0
Ja George               7    4    1    0   0   2/3    66.7     0/0   0.0
Isaiah Siakam          42    3    0    0   0   1/2    50.0     0/0   0.0
Zion Mitchell           7    3    3    0   0   1/1   100.0     0/0   0.0
Julius Barnes           7    2    0    2   0   1/1   100.0     0/0   0.0
Karl Morant             7    2    0    1   0   1/2    50.0     0/0   0.0
Kyrie Rozier           42    0    1    0   0   0/0     0.0     0/0   0.0
D'Angelo Ingram        42    0    0    0   0   0/3     0.0     0/0   0.0
Rudy Bridges           42    0    2    0   0   0/3     0.0     0/0   0.0
Kevin Simons           42    0    1    0   0   0/0     0.0     0/0   0.0

TEAM: FG: 10/19 (52.6%), 3PT: 2/6 (33.3%), REB: 9 (3 off, 6 def), AST: 5, TO: 1
TEAM FOULS: 6 [Team_061 in BONUS]

================================================================================

================================================================================
                               FULL GAME COMPLETE                               
================================================================================

FINAL SCORE: Team_061 99, Team_091 83

SCORING BY QUARTER:
--------------------------------------------------------------------------------
Team                     Q1     Q2     Q3     Q4    FINAL
--------------------------------------------------------------------------------
Team_061                 27     26     21     25       99
Team_091                 25     11     23     24       83
--------------------------------------------------------------------------------

FULL GAME BOX SCORE:
================================================================================

Team_061
--------------------------------------------------------------------------------
Player                MIN  PTS  REB  AST  TO      FG   FG%      3P   3P%      FT STL BLK
--------------------------------------------------------------------------------
Brandon Russell        42   17    0    3   1   8/15   53.3   3/8    37.5   4/7     0   0
Jayson Holiday         42   15    0    3   1   6/12   50.0   0/4     0.0   3/3     2   0
Michael Russell        42   20   14    1   0   7/14   50.0   3/7    42.9   2/3     0   1
Bam Sexton             42   19   10    3   3  12/19   63.2   1/7    14.3   6/8     1   0
Draymond Banchero      42   11   18    7   2   5/10   50.0   0/2     0.0   3/3     1   1
Evan Rose               7    0    0    2   0   0/0     0.0   0/0     0.0   0/0     0   0
Gary Fox                7    0    0    2   0   0/1     0.0   0/1     0.0   0/0     0   0
Desmond Morant          7    0    0    0   0   1/2    50.0   0/0     0.0   0/0     0   0
Stephen Towns           7    7    1    0   0   2/3    66.7   0/0     0.0   3/4     0   0
Tim Durant              7    9    3    0   0   4/5    80.0   0/0     0.0   2/2     0   0

TEAM: FG: 46/82 (56.1%), 3PT: 7/29 (24.1%), REB: 49 (12 off, 37 def), AST: 21, TO: 7


Team_091
--------------------------------------------------------------------------------
Player                MIN  PTS  REB  AST  TO      FG   FG%      3P   3P%      FT STL BLK
--------------------------------------------------------------------------------
Kyrie Rozier           42    8    9    2   0   5/6    83.3   0/0     0.0   5/6     0   0
Isaiah Siakam          42    9    0    3   4   4/15   26.7   0/5     0.0   5/5     0   0
Rudy Bridges           42   13   15    1   2   5/14   35.7   2/5    40.0   5/5     0   0
D'Angelo Ingram        42   13    0    2   2   5/17   29.4   2/8    25.0   1/1     2   0
Kevin Simons           42   17   14    2   1   8/13   61.5   1/1   100.0   5/8     2   2
Karl Morant             7    2    0    1   0   1/2    50.0   0/1     0.0   0/0     0   0
Julius Barnes           7    2    0    2   0   1/1   100.0   0/0     0.0   0/0     0   0
Tim Antetokounmpo       7   10    1    2   0   4/4   100.0   2/2   100.0   2/2     0   0
Zion Mitchell           7    3    3    0   0   0/0     0.0   0/0     0.0   3/3     0   0
Ja George               7    4    1    0   0   3/4    75.0   0/0     0.0   2/2     0   0

TEAM: FG: 36/76 (47.4%), 3PT: 7/22 (31.8%), REB: 40 (8 off, 32 def), AST: 15, TO: 9

================================================================================
