================================================================================
                        FULL GAME - Team_027 vs Team_083                        
================================================================================

================================================================================
                       1ST QUARTER - Team_027 vs Team_083                       
================================================================================

[12:00] Team_027 possession (Score: 0-0)
Bradley Dosunmu attempts a Midrange. Contested by Kyrie Griffin (3.5 feet, ZONE). BRADLEY DOSUNMU MAKES IT! Assist: Scottie Harden
Score: 2-0

[11:46] Team_083 possession (Score: 2-0)
Kyrie Griffin attempts a 3Pt. Contested by Tim Johnson (5.2 feet, ZONE). KYRIE GRIFFIN MAKES IT! Assist: Karl Jokic
Score: 2-3

[11:36] Team_027 possession (Score: 2-3)
John Russell drives to the basket... John Russell throws a bad pass! Stolen by Kyrie Griffin! TURNOVER! (live ball)

[11:19] Team_083 possession (Score: 2-3)
FOUL! Holding foul on Scottie Harden. [Team fouls: 1] No free throws, side out. (Scottie Harden: 1 personal fouls)

[11:08] Team_083 possession (Score: 2-3)
FOUL! Reach-in foul on John Russell during the drive. [Team fouls: 2] No free throws, side out. (John Russell: 1 personal fouls)

[10:58] Team_083 possession (Score: 2-3)
FOUL! Reach-in foul on John Russell during the drive. [Team fouls: 3] No free throws, side out. (John Russell: 2 personal fouls)

[10:48] Team_083 possession (Score: 2-3)
Bradley Thompson attempts a Layup. Contested by John Russell (4.0 feet, MAN). Bradley Thompson misses. Rebound secured by Bradley Dosunmu.

[10:35] Team_027 possession (Score: 2-3)
Tim Johnson attempts a 3Pt. Contested by Malcolm Brogdon (5.1 feet, MAN). Tim Johnson misses. Rebound secured by Kyrie Griffin.

[10:21] Team_083 possession (Score: 2-3)
Malcolm Brogdon makes the Midrange and draws the foul on Tim Johnson! And-1! Malcolm Brogdon to the line for 1. [Team fouls: 4] (Tim Johnson: 1 personal fouls)   FT 1/1: MISS Malcolm Brogdon makes 0/1 from the line. Rebound secured by Bradley Dosunmu.
Score: 2-5

[10:06] Team_027 possession (Score: 2-5)
Tim Johnson attempts a Midrange. Contested by Malcolm Brogdon (5.1 feet, MAN). TIM JOHNSON MAKES IT!
Score: 4-5

[09:51] Team_083 possession (Score: 4-5)
Kyrie Griffin makes the Dunk and draws the foul on Bradley Dosunmu! And-1! Kyrie Griffin to the line for 1. [BONUS: 5 team fouls] (Bradley Dosunmu: 1 personal fouls)   FT 1/1: GOOD Kyrie Griffin makes 1/1 from the line.
Score: 4-8

[09:33] Team_027 possession (Score: 4-8)
Bradley Dosunmu attempts a Midrange. Contested by Kyrie Griffin (3.5 feet, MAN). Bradley Dosunmu misses. Rebound secured by Yao Oladipo.

[09:20] Team_083 possession (Score: 4-8)
Yao Oladipo drives to the basket... FOUL! Offensive foul on Yao Oladipo! Scottie Harden drew the charge! [Team fouls: 1] (Yao Oladipo: 1 personal fouls) TURNOVER! (dead ball)

[09:03] Team_027 possession (Score: 4-8)
John Russell throws a bad pass! Stolen by Bradley Thompson! TURNOVER! (live ball)

[08:47] Team_083 possession (Score: 4-8)
Karl Jokic drives, Tony Doncic stays with him. Karl Jokic attempts a Layup. Contested by Tony Doncic (4.4 feet, MAN). KARL JOKIC MAKES IT! Assist: Kyrie Griffin
Score: 4-10

[08:34] Team_027 possession (Score: 4-10)
John Russell attempts a Midrange. Contested by Karl Jokic (5.4 feet, ZONE). John Russell misses. Rebound secured by Bradley Thompson.

[08:17] Team_083 possession (Score: 4-10)
Karl Jokic attempts a Midrange. Contested by Tony Doncic (4.4 feet, MAN). KARL JOKIC MAKES IT! Assist: Kyrie Griffin
Score: 4-12

[08:02] Team_027 possession (Score: 4-12)
John Russell attempts a Midrange. Contested by Bradley Thompson (4.5 feet, MAN). John Russell misses. Rebound secured by Bradley Thompson.

[07:49] Team_083 possession (Score: 4-12)
Kyrie Griffin drives, John Russell stays with him. Kyrie Griffin attempts a Dunk. Contested by John Russell (4.2 feet, ZONE). KYRIE GRIFFIN MAKES IT! Assist: Karl Jokic
Score: 4-14

[07:37] Team_027 possession (Score: 4-14)
John Russell attempts a Midrange. Contested by Bradley Thompson (4.5 feet, MAN). John Russell misses. Offensive rebound by John Russell! John Russell puts it back in!
Score: 6-14

[07:21] Team_083 possession (Score: 6-14)
FOUL! Holding foul on Scottie Harden. [IN THE BONUS! 6 team fouls] Yao Oladipo to the line for 2 free throws. (Scottie Harden: 2 personal fouls)   FT 1/2: GOOD   FT 2/2: GOOD Yao Oladipo makes 2/2 from the line.
Score: 6-16

[07:03] Team_027 possession (Score: 6-16)
FOUL! Reach-in foul on Bradley Thompson during the drive. [Team fouls: 2] No free throws, side out. (Bradley Thompson: 1 personal fouls)

[06:50] Team_027 possession (Score: 6-16)
Tim Johnson drives to the basket... Tim Johnson throws a bad pass out of bounds! TURNOVER! (dead ball)

[06:34] Team_083 possession (Score: 6-16)
Yao Oladipo makes the Layup and draws the foul on Scottie Harden! And-1! Yao Oladipo to the line for 1. [BONUS: 7 team fouls] (Scottie Harden: 3 personal fouls)   FT 1/1: MISS Yao Oladipo makes 0/1 from the line. Rebound secured by Tony Doncic.
Score: 6-18

[06:19] Team_027 possession (Score: 6-18)
John Russell attempts a Midrange. Contested by Bradley Thompson (4.5 feet, MAN). JOHN RUSSELL MAKES IT! Assist: Tim Johnson
Score: 8-18

[06:05] Team_083 possession (Score: 8-18)
Kyrie Griffin attempts a Midrange. Contested by Bradley Dosunmu (4.7 feet, ZONE). Kyrie Griffin misses. Rebound secured by Bradley Dosunmu.

[05:47] Team_027 possession (Score: 8-18)
Tony Doncic attempts a Midrange. Contested by Karl Jokic (4.7 feet, MAN). Tony Doncic misses. Rebound secured by Yao Oladipo.

[05:36] Team_083 possession (Score: 8-18)
Malcolm Brogdon attempts a 3Pt. Contested by Tim Johnson (4.6 feet, ZONE). Malcolm Brogdon misses. Rebound secured by Bradley Dosunmu.

[05:17] Team_027 possession (Score: 8-18)
Scottie Harden drives to the basket... Scottie Harden throws a bad pass! Stolen by Kyrie Griffin! TURNOVER! (live ball)

[05:03] Team_083 possession (Score: 8-18)
FOUL! Reach-in foul on John Russell during the drive. [IN THE BONUS! 8 team fouls] Malcolm Brogdon to the line for 2 free throws. (John Russell: 3 personal fouls)   FT 1/2: GOOD   FT 2/2: GOOD Malcolm Brogdon makes 2/2 from the line.
Score: 8-20

[04:49] Team_027 possession (Score: 8-20)
Bradley Dosunmu drives to the basket... Bradley Dosunmu commits a violation (traveling/carry)! TURNOVER! (dead ball)

[04:31] Team_083 possession (Score: 8-20)
Yao Oladipo drives, picks up John Russell. Help arrives from Tony Doncic! Yao Oladipo attempts a Layup. Contested by Tony Doncic (4.3 feet, ZONE). YAO OLADIPO MAKES IT! Assist: Bradley Thompson
Score: 8-22

[04:14] Team_027 possession (Score: 8-22)
FOUL! Shooting foul on Bradley Thompson. John Russell to the line for 2 free throws. [Team fouls: 3] (Bradley Thompson: 2 personal fouls)   FT 1/2: GOOD   FT 2/2: GOOD John Russell makes 2/2 from the line.
Score: 10-22

[03:56] Team_083 possession (Score: 10-22)
Malcolm Brogdon attempts a 3Pt. Contested by Tim Johnson (4.7 feet, ZONE). Malcolm Brogdon misses. Rebound secured by Bradley Dosunmu.

[03:43] Team_027 possession (Score: 10-22)
Bradley Dosunmu attempts a Layup. Contested by Kyrie Griffin (3.6 feet, MAN). BRADLEY DOSUNMU MAKES IT!
Score: 12-22

[03:27] Team_083 possession (Score: 12-22)
Karl Jokic drives, John Russell stays with him. Karl Jokic attempts a Layup. Contested by John Russell (4.6 feet, ZONE). Karl Jokic misses. Rebound secured by Bradley Dosunmu.

[03:14] Team_027 possession (Score: 12-22)
Tim Johnson attempts a 3Pt. Contested by Malcolm Brogdon (5.2 feet, MAN). Tim Johnson misses. Rebound secured by Kyrie Griffin.

[03:01] Team_083 possession (Score: 12-22)
Kyrie Griffin loses the ball! Stripped by Bradley Dosunmu! TURNOVER! (live ball)

[02:43] Team_027 possession (Score: 12-22)
John Russell attempts a Layup. Contested by Bradley Thompson (4.7 feet, MAN). JOHN RUSSELL MAKES IT! Assist: Tony Doncic
Score: 14-22

[02:27] Team_083 possession (Score: 14-22)
Karl Jokic drives and kicks out. Karl Jokic attempts a Midrange. Contested by Tim Johnson (5.2 feet, ZONE). Karl Jokic misses. Rebound secured by Tony Doncic.

[02:15] Team_027 possession (Score: 14-22)
John Russell makes the Midrange and draws the foul on Bradley Thompson! And-1! John Russell to the line for 1. [Team fouls: 4] (Bradley Thompson: 3 personal fouls)   FT 1/1: GOOD John Russell makes 1/1 from the line.
Score: 17-22

[02:03] Team_083 possession (Score: 17-22)
Bradley Thompson attempts a Layup. Contested by John Russell (4.3 feet, ZONE). Bradley Thompson misses. Rebound secured by Tony Doncic.

[01:50] Team_027 possession (Score: 17-22)
Tim Johnson attempts a 3Pt. Contested by Malcolm Brogdon (5.4 feet, MAN). Tim Johnson misses. Offensive rebound by Bradley Dosunmu! Bradley Dosunmu kicks it out.

[01:31] Team_027 possession (Score: 17-22)
Tim Johnson attempts a 3Pt. Contested by Malcolm Brogdon (5.4 feet, ZONE). Tim Johnson misses. Rebound secured by Yao Oladipo.

[01:16] Team_083 possession (Score: 17-22)
Kyrie Griffin attempts a Midrange. Contested by Bradley Dosunmu (5.0 feet, MAN). KYRIE GRIFFIN MAKES IT! Assist: Malcolm Brogdon
Score: 17-24

[01:02] Team_027 possession (Score: 17-24)
Scottie Harden attempts a 3Pt. Contested by Yao Oladipo (3.8 feet, ZONE). Scottie Harden misses. Rebound secured by Kyrie Griffin.

[00:48] Team_083 possession (Score: 17-24)
FOUL! Reach-in foul on Tim Johnson during the drive. [IN THE BONUS! 9 team fouls] Malcolm Brogdon to the line for 2 free throws. (Tim Johnson: 2 personal fouls)   FT 1/2: GOOD   FT 2/2: GOOD Malcolm Brogdon makes 2/2 from the line.
Score: 17-26

[00:35] Team_027 possession (Score: 17-26)
Tony Doncic drives, picks up Kyrie Griffin. Help arrives from Karl Jokic! Tony Doncic attempts a Dunk. Contested by Karl Jokic (4.0 feet, ZONE). TONY DONCIC MAKES IT! Assist: John Russell
Score: 19-26

[00:22] Team_083 possession (Score: 19-26)
Kyrie Griffin drives, John Russell stays with him. Kyrie Griffin attempts a Layup. Contested by John Russell (4.8 feet, ZONE). Kyrie Griffin misses. Rebound secured by John Russell.

[00:08] Team_027 possession (Score: 19-26)
John Russell attempts a Layup. Contested by Bradley Thompson (5.0 feet, MAN). JOHN RUSSELL MAKES IT!
Score: 21-26

================================================================================
                              1ST QUARTER COMPLETE                              
================================================================================

1ST QUARTER SCORE: Team_027 21, Team_083 26

BOX SCORE:
================================================================================

Team_027
--------------------------------------------------------------------------------
Player                MIN  PTS  REB  AST  TO      FG   FG%      3P   3P%
--------------------------------------------------------------------------------
John Russell           12   13    2    1   0   6/8    75.0     0/0   0.0
Bradley Dosunmu        12    4    7    0   0   2/3    66.7     0/0   0.0
Tim Johnson            12    2    0    1   0   1/4    25.0     0/0   0.0
Tony Doncic            12    2    3    1   0   1/2    50.0     0/0   0.0
Scottie Harden         12    0    0    1   0   0/1     0.0     0/0   0.0

TEAM: FG: 10/18 (55.6%), 3PT: 0/4 (0.0%), REB: 12 (2 off, 10 def), AST: 4, TO: 5
TEAM FOULS: 9 [Team_083 in BONUS]


Team_083
--------------------------------------------------------------------------------
Player                MIN  PTS  REB  AST  TO      FG   FG%      3P   3P%
--------------------------------------------------------------------------------
Kyrie Griffin          12   10    3    2   0   4/6    66.7     0/0   0.0
Karl Jokic             12    4    0    2   0   2/4    50.0     0/0   0.0
Malcolm Brogdon        12    4    0    1   0   2/5    40.0     0/0   0.0
Yao Oladipo            12    4    3    0   0   2/3    66.7     0/0   0.0
Bradley Thompson       12    0    2    1   0   0/2     0.0     0/0   0.0

TEAM: FG: 10/20 (50.0%), 3PT: 1/3 (33.3%), REB: 8 (0 off, 8 def), AST: 6, TO: 2
TEAM FOULS: 4

================================================================================

================================================================================
                       2ND QUARTER - Team_027 vs Team_083                       
================================================================================

[12:00] Team_027 possession (Score: 21-26)
Scottie Harden drives to the basket... Scottie Harden throws a bad pass! Stolen by Kyrie Griffin! TURNOVER! (live ball)

[11:49] Team_083 possession (Score: 21-26)
Malcolm Brogdon attempts a Layup. Contested by John Russell (4.0 feet, ZONE). Malcolm Brogdon misses. Rebound secured by Tony Doncic.

[11:35] Team_027 possession (Score: 21-26)
Tim Johnson attempts a 3Pt. Contested by Yao Oladipo (3.9 feet, ZONE). Tim Johnson misses. Offensive rebound by John Russell! John Russell puts it back in!
Score: 23-26

[11:24] Team_083 possession (Score: 23-26)
Karl Jokic drives to the basket... Karl Jokic throws a bad pass out of bounds! TURNOVER! (dead ball)

[11:24] Substitution (Team_027): Tim Johnson OUT → CJ Green IN (stamina_rule2)

[11:24] Substitution (Team_027): Tony Doncic OUT → Dirk Lillard IN (stamina_rule2)

[11:24] Substitution (Team_027): Scottie Harden OUT → Rudy Quickley IN (stamina_rule2)

[11:24] Substitution (Team_027): Bradley Dosunmu OUT → LeBron Russell IN (stamina_rule2)

[11:24] Substitution (Team_027): John Russell OUT → Ben Stewart IN (stamina_rule2)

[11:24] Substitution (Team_083): Malcolm Brogdon OUT → Zion Markkanen IN (stamina_rule2)

[11:24] Substitution (Team_083): Karl Jokic OUT → Damian Towns IN (stamina_rule2)

[11:24] Substitution (Team_083): Yao Oladipo OUT → Domantas Doncic IN (stamina_rule2)

[11:24] Substitution (Team_083): Kyrie Griffin OUT → Cole Simmons IN (stamina_rule2)

[11:24] Substitution (Team_083): Bradley Thompson OUT → Victor McCollum IN (stamina_rule2)

[11:07] Team_027 possession (Score: 23-26)
CJ Green attempts a 3Pt. Contested by Zion Markkanen (5.5 feet, ZONE). CJ Green misses. Rebound secured by Damian Towns.

[10:50] Team_083 possession (Score: 23-26)
FOUL! Holding foul on CJ Green. [Team fouls: 1] No free throws, side out. (CJ Green: 1 personal fouls)

[10:31] Team_083 possession (Score: 23-26)
Zion Markkanen drives to the basket... Zion Markkanen commits a violation (traveling/carry)! TURNOVER! (dead ball)

[10:19] Team_027 possession (Score: 23-26)
CJ Green attempts a Midrange. BLOCKED BY DAMIAN TOWNS! Ball is loose! Rebound secured by Cole Simmons.

[10:03] Team_083 possession (Score: 23-26)
Zion Markkanen attempts a 3Pt. Contested by CJ Green (5.3 feet, ZONE). Zion Markkanen misses. FOUL! Loose ball foul on LeBron Russell during the rebound battle. [Team fouls: 2] No free throws, side out. (LeBron Russell: 1 personal fouls)

[09:45] Team_083 possession (Score: 23-26)
Cole Simmons attempts a Midrange. Contested by LeBron Russell (5.4 feet, ZONE). Cole Simmons misses. Offensive rebound by Victor McCollum! Victor McCollum's putback is no good. Rebound secured by Ben Stewart.

[09:30] Team_027 possession (Score: 23-26)
Dirk Lillard drives, Damian Towns stays with him. Dirk Lillard attempts a Layup. Contested by Damian Towns (5.0 feet, MAN). Dirk Lillard misses. Rebound secured by Damian Towns.

[09:19] Team_083 possession (Score: 23-26)
Victor McCollum makes the Dunk and draws the foul on Ben Stewart! And-1! Victor McCollum to the line for 1. [Team fouls: 3] (Ben Stewart: 1 personal fouls)   FT 1/1: GOOD Victor McCollum makes 1/1 from the line.
Score: 23-29

[09:06] Team_027 possession (Score: 23-29)
Dirk Lillard attempts a 3Pt. Contested by Cole Simmons (4.8 feet, ZONE). Dirk Lillard misses. Rebound secured by Damian Towns.

[08:51] Team_083 possession (Score: 23-29)
Domantas Doncic attempts a Midrange. Contested by Rudy Quickley (3.4 feet, MAN). Domantas Doncic misses. Rebound secured by LeBron Russell.

[08:37] Team_027 possession (Score: 23-29)
Dirk Lillard attempts a 3Pt. Contested by Damian Towns (5.0 feet, MAN). Dirk Lillard misses. Rebound secured by Victor McCollum.

[08:23] Team_083 possession (Score: 23-29)
FOUL! Reach-in foul on LeBron Russell during the drive. [Team fouls: 4] No free throws, side out. (LeBron Russell: 2 personal fouls)

[08:12] Team_083 possession (Score: 23-29)
Domantas Doncic attempts a 3Pt. Contested by Rudy Quickley (3.4 feet, ZONE). Domantas Doncic misses. Rebound secured by LeBron Russell.

[07:54] Team_027 possession (Score: 23-29)
CJ Green drives to the basket... CJ Green loses the ball! Stripped by Zion Markkanen! TURNOVER! (live ball)

[07:44] Team_083 possession (Score: 23-29)
Damian Towns attempts a 3Pt. Contested by Rudy Quickley (3.8 feet, ZONE). Damian Towns misses. Rebound secured by LeBron Russell.

[07:27] Team_027 possession (Score: 23-29)
Dirk Lillard attempts a 3Pt. Contested by Zion Markkanen (5.4 feet, ZONE). Dirk Lillard misses. Rebound secured by Damian Towns.

[07:08] Team_083 possession (Score: 23-29)
Zion Markkanen attempts a Layup. Contested by Ben Stewart (4.9 feet, ZONE). ZION MARKKANEN MAKES IT! Assist: Domantas Doncic
Score: 23-31

[06:49] Team_027 possession (Score: 23-31)
Dirk Lillard attempts a Layup. Contested by Damian Towns (5.0 feet, MAN). DIRK LILLARD MAKES IT!
Score: 25-31

[06:39] Team_083 possession (Score: 25-31)
Zion Markkanen throws a bad pass! Stolen by CJ Green! TURNOVER! (live ball)

[06:25] Team_027 possession (Score: 25-31)
Ben Stewart drives to the basket... Ben Stewart loses the ball! Stripped by Victor McCollum! TURNOVER! (live ball)

[06:10] Team_083 possession (Score: 25-31)
Damian Towns attempts a 3Pt. Contested by Dirk Lillard (4.6 feet, MAN). Damian Towns misses. Rebound secured by Ben Stewart.

[05:51] Team_027 possession (Score: 25-31)
CJ Green attempts a 3Pt. Contested by Zion Markkanen (5.5 feet, ZONE). CJ Green misses. Rebound secured by Cole Simmons.

[05:39] Team_083 possession (Score: 25-31)
Domantas Doncic drives and kicks out. Domantas Doncic attempts a 3Pt. Contested by Rudy Quickley (3.3 feet, MAN). DOMANTAS DONCIC MAKES IT! Assist: Cole Simmons
Score: 25-34

[05:24] Team_027 possession (Score: 25-34)
LeBron Russell attempts a 3Pt. Contested by Zion Markkanen (5.4 feet, ZONE). LEBRON RUSSELL MAKES IT! Assist: Rudy Quickley
Score: 28-34

[05:07] Team_083 possession (Score: 28-34)
Zion Markkanen attempts a 3Pt. Contested by CJ Green (5.3 feet, MAN). Zion Markkanen misses. Offensive rebound by Victor McCollum! Victor McCollum puts it back in!
Score: 28-36

[04:50] Team_027 possession (Score: 28-36)
FOUL! Reach-in foul on Victor McCollum during the drive. [Team fouls: 1] No free throws, side out. (Victor McCollum: 1 personal fouls)

[04:37] Team_027 possession (Score: 28-36)
Dirk Lillard attempts a 3Pt. Contested by Damian Towns (5.0 feet, MAN). Dirk Lillard misses. Rebound secured by Damian Towns.

[04:26] Team_083 possession (Score: 28-36)
Damian Towns attempts a 3Pt. Contested by CJ Green (5.6 feet, ZONE). Damian Towns misses. Rebound secured by Ben Stewart.

[04:13] Team_027 possession (Score: 28-36)
LeBron Russell drives, Victor McCollum stays with him. LeBron Russell attempts a Dunk. Contested by Victor McCollum (4.0 feet, ZONE). LeBron Russell misses. Rebound secured by Victor McCollum.

[04:02] Team_083 possession (Score: 28-36)
Zion Markkanen attempts a Midrange. Contested by Rudy Quickley (3.5 feet, ZONE). Zion Markkanen misses. Rebound secured by Dirk Lillard.

[03:50] Team_027 possession (Score: 28-36)
LeBron Russell attempts a Midrange. Contested by Cole Simmons (4.8 feet, MAN). LEBRON RUSSELL MAKES IT! Assist: CJ Green
Score: 30-36

[03:37] Team_083 possession (Score: 30-36)
Damian Towns attempts a 3Pt. Contested by Dirk Lillard (4.7 feet, MAN). DAMIAN TOWNS MAKES IT! Assist: Cole Simmons
Score: 30-39

[03:20] Team_027 possession (Score: 30-39)
Ben Stewart loses control! Ball rolls out of bounds! TURNOVER! (dead ball)

[03:00] Team_083 possession (Score: 30-39)
Cole Simmons attempts a Midrange. Contested by LeBron Russell (5.5 feet, MAN). Cole Simmons misses. Rebound secured by LeBron Russell.

[02:42] Team_027 possession (Score: 30-39)
FOUL! Holding foul on Victor McCollum. [Team fouls: 2] No free throws, side out. (Victor McCollum: 2 personal fouls)

[02:26] Team_027 possession (Score: 30-39)
LeBron Russell attempts a Midrange. Contested by Cole Simmons (4.9 feet, MAN). LEBRON RUSSELL MAKES IT! Assist: Dirk Lillard
Score: 32-39

[02:13] Team_083 possession (Score: 32-39)
Domantas Doncic makes the Layup and draws the foul on Rudy Quickley! And-1! Domantas Doncic to the line for 1. [BONUS: 5 team fouls] (Rudy Quickley: 1 personal fouls)   FT 1/1: MISS Domantas Doncic makes 0/1 from the line. Offensive rebound by Victor McCollum! Victor McCollum's putback is no good.
Score: 32-41

[02:00] Team_027 possession (Score: 32-41)
CJ Green attempts a 3Pt. Contested by Zion Markkanen (5.6 feet, MAN). CJ Green misses. Offensive rebound by Ben Stewart! Ben Stewart puts it back in!
Score: 34-41

[01:46] Team_083 possession (Score: 34-41)
Cole Simmons drives, LeBron Russell stays with him. Cole Simmons attempts a Dunk. Contested by LeBron Russell (5.6 feet, MAN). COLE SIMMONS MAKES IT! Assist: Domantas Doncic
Score: 34-43

[01:32] Team_027 possession (Score: 34-43)
Ben Stewart drives, Victor McCollum stays with him. Ben Stewart attempts a Layup. Contested by Victor McCollum (4.1 feet, ZONE). Ben Stewart misses. Rebound secured by Damian Towns.

[01:19] Team_083 possession (Score: 34-43)
Victor McCollum attempts a Midrange. Contested by Dirk Lillard (5.0 feet, ZONE). Victor McCollum misses. Rebound secured by Dirk Lillard.

[01:05] Team_027 possession (Score: 34-43)
CJ Green attempts a Layup. Contested by Victor McCollum (4.4 feet, ZONE). CJ Green misses. Rebound secured by Cole Simmons.

[00:52] Team_083 possession (Score: 34-43)
FOUL! Reach-in foul on Ben Stewart during the drive. [IN THE BONUS! 6 team fouls] Victor McCollum to the line for 2 free throws. (Ben Stewart: 2 personal fouls)   FT 1/2: GOOD   FT 2/2: GOOD Victor McCollum makes 2/2 from the line.
Score: 34-45

[00:41] Team_027 possession (Score: 34-45)
CJ Green attempts a Layup. Contested by Zion Markkanen (5.7 feet, MAN). CJ Green misses. Rebound secured by Damian Towns.

[00:30] Team_083 possession (Score: 34-45)
Victor McCollum drives to the basket... FOUL! Offensive foul on Victor McCollum! Ben Stewart drew the charge! [Team fouls: 3] (Victor McCollum: 3 personal fouls) TURNOVER! (dead ball)

[00:18] Team_027 possession (Score: 34-45)
LeBron Russell attempts a 3Pt. Contested by Cole Simmons (5.1 feet, MAN). LEBRON RUSSELL MAKES IT! Assist: Ben Stewart
Score: 37-45

[00:04] Team_083 possession (Score: 37-45)
FOUL! Holding foul on Ben Stewart. [IN THE BONUS! 7 team fouls] Victor McCollum to the line for 2 free throws. (Ben Stewart: 3 personal fouls)   FT 1/2: GOOD   FT 2/2: GOOD Victor McCollum makes 2/2 from the line.
Score: 37-47

================================================================================
                              2ND QUARTER COMPLETE                              
================================================================================

2ND QUARTER SCORE: Team_027 16, Team_083 21

BOX SCORE:
================================================================================

Team_027
--------------------------------------------------------------------------------
Player                MIN  PTS  REB  AST  TO      FG   FG%      3P   3P%
--------------------------------------------------------------------------------
LeBron Russell         11   10    4    0   0   4/5    80.0     0/0   0.0
John Russell           13    2    1    0   0   1/1   100.0     0/0   0.0
Ben Stewart            11    2    4    1   0   1/2    50.0     0/0   0.0
Dirk Lillard           11    2    2    1   0   1/6    16.7     0/0   0.0
Tony Doncic            13    0    1    0   0   0/0     0.0     0/0   0.0
CJ Green               11    0    0    1   0   0/5     0.0     0/0   0.0
Rudy Quickley          11    0    0    1   0   0/0     0.0     0/0   0.0

TEAM: FG: 7/19 (36.8%), 3PT: 4/10 (40.0%), REB: 12 (2 off, 10 def), AST: 4, TO: 4
TEAM FOULS: 7 [Team_083 in BONUS]


Team_083
--------------------------------------------------------------------------------
Player                MIN  PTS  REB  AST  TO      FG   FG%      3P   3P%
--------------------------------------------------------------------------------
Victor McCollum        11    9    4    0   0   4/5    80.0     0/0   0.0
Damian Towns           11    3    8    0   0   1/4    25.0     0/0   0.0
Domantas Doncic        11    3    0    2   0   1/4    25.0     0/0   0.0
Cole Simmons           11    2    3    2   0   1/3    33.3     0/0   0.0
Zion Markkanen         11    2    0    0   0   1/2    50.0     0/0   0.0
Malcolm Brogdon        13    0    0    0   0   0/1     0.0     0/0   0.0

TEAM: FG: 8/19 (42.1%), 3PT: 2/6 (33.3%), REB: 15 (3 off, 12 def), AST: 4, TO: 4
TEAM FOULS: 3

================================================================================

================================================================================
                       3RD QUARTER - Team_027 vs Team_083                       
================================================================================

[12:00] Team_027 possession (Score: 37-47)
Scottie Harden attempts a 3Pt. Contested by Yao Oladipo (3.4 feet, MAN). SCOTTIE HARDEN MAKES IT! Assist: John Russell
Score: 40-47

[11:47] Team_083 possession (Score: 40-47)
Bradley Thompson drives, picks up John Russell. Help arrives from Tony Doncic! Bradley Thompson attempts a Dunk. Contested by Tony Doncic (4.0 feet, ZONE). Bradley Thompson misses. Rebound secured by Tony Doncic.

[11:31] Team_027 possession (Score: 40-47)
FOUL! Shooting foul on Karl Jokic. John Russell to the line for 2 free throws. [Team fouls: 1] (Karl Jokic: 1 personal fouls)   FT 1/2: GOOD   FT 2/2: GOOD John Russell makes 2/2 from the line.
Score: 42-47

[11:18] Team_083 possession (Score: 42-47)
Malcolm Brogdon attempts a 3Pt. Contested by Tim Johnson (4.5 feet, MAN). Malcolm Brogdon misses. FOUL! Loose ball foul on Bradley Dosunmu during the rebound battle. [Team fouls: 1] No free throws, side out. (Bradley Dosunmu: 1 personal fouls)

[11:00] Team_083 possession (Score: 42-47)
Karl Jokic drives and kicks out. Kyrie Griffin attempts a Midrange. Contested by Bradley Dosunmu (4.4 feet, MAN). Kyrie Griffin misses. Offensive rebound by Bradley Thompson! Bradley Thompson puts it back in!
Score: 42-49

[10:43] Team_027 possession (Score: 42-49)
Scottie Harden attempts a 3Pt. Contested by Yao Oladipo (3.4 feet, ZONE). SCOTTIE HARDEN MAKES IT! Assist: Tim Johnson
Score: 45-49

[10:28] Team_083 possession (Score: 45-49)
Kyrie Griffin drives, John Russell stays with him. Kyrie Griffin attempts a Dunk. Contested by John Russell (4.2 feet, ZONE). Kyrie Griffin misses. Rebound secured by Bradley Dosunmu.

[10:16] Team_027 possession (Score: 45-49)
Tony Doncic throws a bad pass out of bounds! TURNOVER! (dead ball)

[10:00] Team_083 possession (Score: 45-49)
Yao Oladipo attempts a 3Pt. Contested by Scottie Harden (4.8 feet, MAN). Yao Oladipo misses. Rebound secured by Bradley Dosunmu.

[09:44] Team_027 possession (Score: 45-49)
John Russell drives to the basket... John Russell commits a violation (traveling/carry)! TURNOVER! (dead ball)

[09:32] Team_083 possession (Score: 45-49)
Malcolm Brogdon drives, picks up John Russell. Help arrives from Tony Doncic! Malcolm Brogdon attempts a Layup. Contested by Tony Doncic (3.6 feet, ZONE). MALCOLM BROGDON MAKES IT! Assist: Karl Jokic
Score: 45-51

[09:17] Team_027 possession (Score: 45-51)
Tony Doncic attempts a Midrange. Contested by Yao Oladipo (3.5 feet, ZONE). Tony Doncic misses. Rebound secured by Kyrie Griffin.

[09:02] Team_083 possession (Score: 45-51)
Kyrie Griffin drives and kicks out. Yao Oladipo attempts a 3Pt. Contested by Tim Johnson (4.9 feet, ZONE). Yao Oladipo misses. Rebound secured by Bradley Dosunmu.

[08:46] Team_027 possession (Score: 45-51)
John Russell makes the Layup and draws the foul on Kyrie Griffin! And-1! John Russell to the line for 1. [Team fouls: 2] (Kyrie Griffin: 1 personal fouls)   FT 1/1: MISS John Russell makes 0/1 from the line. FOUL! Loose ball foul on Bradley Thompson during the free throw rebound! [Team fouls: 3] No free throws, side out. (Bradley Thompson: 1 personal fouls)
Score: 47-51

[08:29] Team_027 possession (Score: 47-51)
FOUL! Shooting foul on Yao Oladipo. Scottie Harden to the line for 2 free throws. [Team fouls: 4] (Yao Oladipo: 1 personal fouls)   FT 1/2: GOOD   FT 2/2: GOOD Scottie Harden makes 2/2 from the line.
Score: 49-51

[08:13] Team_083 possession (Score: 49-51)
FOUL! Shooting foul on Tony Doncic. Kyrie Griffin to the line for 2 free throws. [Team fouls: 2] (Tony Doncic: 1 personal fouls)   FT 1/2: MISS   FT 2/2: GOOD Kyrie Griffin makes 1/2 from the line.
Score: 49-52

[07:56] Team_027 possession (Score: 49-52)
Tim Johnson attempts a Midrange. Contested by Malcolm Brogdon (5.1 feet, MAN). TIM JOHNSON MAKES IT! Assist: Bradley Dosunmu
Score: 51-52

[07:40] Team_083 possession (Score: 51-52)
Kyrie Griffin attempts a Midrange. Contested by Scottie Harden (4.8 feet, ZONE). Kyrie Griffin misses. Rebound secured by Tony Doncic.

[07:27] Team_027 possession (Score: 51-52)
FOUL! Offensive foul on Bradley Dosunmu! Kyrie Griffin drew the charge! [Team fouls: 3] (Bradley Dosunmu: 2 personal fouls) TURNOVER! (dead ball)

[07:14] Team_083 possession (Score: 51-52)
Malcolm Brogdon attempts a Layup. Contested by John Russell (3.6 feet, ZONE). MALCOLM BROGDON MAKES IT! Assist: Karl Jokic
Score: 51-54

[06:58] Team_027 possession (Score: 51-54)
Tony Doncic attempts a 3Pt. Contested by Karl Jokic (4.7 feet, MAN). Tony Doncic misses. Offensive rebound by Bradley Dosunmu! Bradley Dosunmu kicks it out.

[06:43] Team_027 possession (Score: 51-54)
Tony Doncic drives, Karl Jokic stays with him. Tony Doncic attempts a Layup. Contested by Karl Jokic (4.7 feet, MAN). Tony Doncic misses. Rebound secured by Bradley Thompson.

[06:24] Team_083 possession (Score: 51-54)
Kyrie Griffin makes the Dunk and draws the foul on John Russell! And-1! Kyrie Griffin to the line for 1. [Team fouls: 4] (John Russell: 1 personal fouls)   FT 1/1: GOOD Kyrie Griffin makes 1/1 from the line.
Score: 51-57

[06:10] Team_027 possession (Score: 51-57)
Tony Doncic attempts a Midrange. Contested by Yao Oladipo (3.5 feet, ZONE). TONY DONCIC MAKES IT!
Score: 53-57

[05:54] Team_083 possession (Score: 53-57)
FOUL! Offensive foul on Yao Oladipo! Scottie Harden drew the charge! [Team fouls: 5] (Yao Oladipo: 2 personal fouls) TURNOVER! (dead ball)

[05:38] Team_027 possession (Score: 53-57)
Bradley Dosunmu attempts a Midrange. Contested by Kyrie Griffin (3.5 feet, MAN). Bradley Dosunmu misses. FOUL! Loose ball foul on Kyrie Griffin during the rebound battle. [IN THE BONUS! 6 team fouls] John Russell to the line for 2 free throws. (Kyrie Griffin: 2 personal fouls)   FT 1/2: GOOD   FT 2/2: GOOD John Russell makes 2/2 from the line.
Score: 55-57

[05:19] Team_083 possession (Score: 55-57)
Yao Oladipo attempts a 3Pt. Contested by Tim Johnson (5.2 feet, ZONE). Yao Oladipo misses. Rebound secured by Bradley Dosunmu.

[05:05] Team_027 possession (Score: 55-57)
Tim Johnson drives to the basket... Tim Johnson throws a bad pass! Stolen by Kyrie Griffin! TURNOVER! (live ball)

[04:49] Team_083 possession (Score: 55-57)
Karl Jokic drives, picks up Tony Doncic. Help arrives from Scottie Harden! Karl Jokic attempts a Dunk. Contested by Scottie Harden (4.4 feet, MAN). Karl Jokic misses. Rebound secured by Tony Doncic.

[04:35] Team_027 possession (Score: 55-57)
Tim Johnson attempts a Layup. Contested by Kyrie Griffin (3.7 feet, ZONE). TIM JOHNSON MAKES IT! Assist: Bradley Dosunmu
Score: 57-57

[04:17] Team_083 possession (Score: 57-57)
Malcolm Brogdon attempts a 3Pt. Contested by Tim Johnson (4.6 feet, ZONE). Malcolm Brogdon misses. Rebound secured by John Russell.

[04:03] Team_027 possession (Score: 57-57)
John Russell makes the Layup and draws the foul on Bradley Thompson! And-1! John Russell to the line for 1. [BONUS: 7 team fouls] (Bradley Thompson: 2 personal fouls)   FT 1/1: GOOD John Russell makes 1/1 from the line.
Score: 60-57

[03:48] Team_083 possession (Score: 60-57)
Karl Jokic attempts a 3Pt. Contested by Tim Johnson (5.5 feet, ZONE). Karl Jokic misses. Rebound secured by John Russell.

[03:31] Team_027 possession (Score: 60-57)
Tim Johnson attempts a Layup. Contested by Kyrie Griffin (3.8 feet, ZONE). TIM JOHNSON MAKES IT! Assist: Tony Doncic
Score: 62-57

[03:19] Team_083 possession (Score: 62-57)
FOUL! Shooting foul on Tim Johnson. Malcolm Brogdon to the line for 2 free throws. [BONUS: 5 team fouls] (Tim Johnson: 1 personal fouls)   FT 1/2: GOOD   FT 2/2: GOOD Malcolm Brogdon makes 2/2 from the line.
Score: 62-59

[03:03] Team_027 possession (Score: 62-59)
FOUL! Holding foul on Yao Oladipo. [IN THE BONUS! 8 team fouls] Scottie Harden to the line for 2 free throws. (Yao Oladipo: 3 personal fouls)   FT 1/2: GOOD   FT 2/2: GOOD Scottie Harden makes 2/2 from the line.
Score: 64-59

[02:52] Team_083 possession (Score: 64-59)
Kyrie Griffin attempts a 3Pt. Contested by Tim Johnson (5.4 feet, ZONE). Kyrie Griffin misses. Rebound secured by Bradley Dosunmu.

[02:38] Team_027 possession (Score: 64-59)
John Russell loses control! Ball rolls out of bounds! TURNOVER! (dead ball)

[02:29] Team_083 possession (Score: 64-59)
Malcolm Brogdon attempts a 3Pt. Contested by Tim Johnson (4.8 feet, MAN). MALCOLM BROGDON MAKES IT! Assist: Kyrie Griffin
Score: 64-62

[02:19] Team_027 possession (Score: 64-62)
John Russell attempts a Layup. Contested by Bradley Thompson (4.7 feet, MAN). John Russell misses. Rebound secured by Kyrie Griffin.

[02:05] Team_083 possession (Score: 64-62)
Bradley Thompson attempts a Layup. Contested by John Russell (4.3 feet, MAN). BRADLEY THOMPSON MAKES IT!
Score: 64-64

[01:52] Team_027 possession (Score: 64-64)
Tony Doncic attempts a Midrange. Contested by Yao Oladipo (3.8 feet, ZONE). TONY DONCIC MAKES IT! Assist: Bradley Dosunmu
Score: 66-64

[01:43] Team_083 possession (Score: 66-64)
Kyrie Griffin attempts a Layup. Contested by Bradley Dosunmu (5.0 feet, MAN). KYRIE GRIFFIN MAKES IT!
Score: 66-66

[01:28] Team_027 possession (Score: 66-66)
Tony Doncic attempts a Midrange. Contested by Yao Oladipo (3.8 feet, ZONE). TONY DONCIC MAKES IT!
Score: 68-66

[01:12] Team_083 possession (Score: 68-66)
Karl Jokic attempts a Midrange. Contested by Scottie Harden (5.4 feet, ZONE). Karl Jokic misses. Rebound secured by Bradley Dosunmu.

[00:57] Team_027 possession (Score: 68-66)
Tim Johnson makes the Dunk and draws the foul on Yao Oladipo! And-1! Tim Johnson to the line for 1. [BONUS: 9 team fouls] (Yao Oladipo: 4 personal fouls)   FT 1/1: GOOD Tim Johnson makes 1/1 from the line.
Score: 71-66

[00:45] Team_083 possession (Score: 71-66)
Yao Oladipo attempts a 3Pt. Contested by Scottie Harden (5.2 feet, MAN). Yao Oladipo misses. Rebound secured by Bradley Dosunmu.

[00:33] Team_027 possession (Score: 71-66)
John Russell attempts a Midrange. Contested by Bradley Thompson (4.9 feet, MAN). John Russell misses. Rebound secured by Yao Oladipo.

[00:23] Team_083 possession (Score: 71-66)
Malcolm Brogdon drives, picks up Tim Johnson. Help arrives from Tony Doncic! Malcolm Brogdon attempts a Dunk. Contested by Tony Doncic (5.0 feet, MAN). MALCOLM BROGDON MAKES IT!
Score: 71-68

[00:08] Team_027 possession (Score: 71-68)
FOUL! Reach-in foul on Kyrie Griffin during the drive. [IN THE BONUS! 10 team fouls] John Russell to the line for 2 free throws. (Kyrie Griffin: 3 personal fouls)   FT 1/2: MISS   FT 2/2: GOOD John Russell makes 1/2 from the line.
Score: 72-68

================================================================================
                              3RD QUARTER COMPLETE                              
================================================================================

3RD QUARTER SCORE: Team_027 35, Team_083 21

BOX SCORE:
================================================================================

Team_027
--------------------------------------------------------------------------------
Player                MIN  PTS  REB  AST  TO      FG   FG%      3P   3P%
--------------------------------------------------------------------------------
Scottie Harden         25   10    0    0   0   4/4   100.0     0/0   0.0
Tim Johnson            25    9    0    1   0   4/4   100.0     0/0   0.0
John Russell           25    8    2    1   0   4/6    66.7     0/0   0.0
Tony Doncic            25    6    3    1   0   3/5    60.0     0/0   0.0
Bradley Dosunmu        25    0    9    3   0   0/0     0.0     0/0   0.0

TEAM: FG: 15/19 (78.9%), 3PT: 2/2 (100.0%), REB: 14 (2 off, 12 def), AST: 6, TO: 5
TEAM FOULS: 5 [Team_083 in BONUS]


Team_083
--------------------------------------------------------------------------------
Player                MIN  PTS  REB  AST  TO      FG   FG%      3P   3P%
--------------------------------------------------------------------------------
Malcolm Brogdon        25   11    0    0   0   5/6    83.3     0/0   0.0
Kyrie Griffin          25    6    3    1   0   3/7    42.9     0/0   0.0
Bradley Thompson       25    4    2    0   0   2/3    66.7     0/0   0.0
Yao Oladipo            25    0    1    0   0   0/3     0.0     0/0   0.0
Karl Jokic             25    0    0    2   0   0/3     0.0     0/0   0.0

TEAM: FG: 10/22 (45.5%), 3PT: 1/7 (14.3%), REB: 6 (2 off, 4 def), AST: 3, TO: 1
TEAM FOULS: 10 [Team_027 in BONUS]

================================================================================

================================================================================
                       4TH QUARTER - Team_027 vs Team_083                       
================================================================================

[12:00] Team_027 possession (Score: 72-68)
FOUL! Shooting foul on Bradley Thompson. John Russell to the line for 2 free throws. [Team fouls: 1] (Bradley Thompson: 1 personal fouls)   FT 1/2: GOOD   FT 2/2: GOOD John Russell makes 2/2 from the line.
Score: 74-68

[11:47] Team_083 possession (Score: 74-68)
Yao Oladipo drives and kicks out. Malcolm Brogdon attempts a Midrange. Contested by Tim Johnson (5.3 feet, MAN). Malcolm Brogdon misses. Offensive rebound by Kyrie Griffin! Kyrie Griffin kicks it out.

[11:33] Team_083 possession (Score: 74-68)
Malcolm Brogdon attempts a 3Pt. Contested by Scottie Harden (4.6 feet, ZONE). Malcolm Brogdon misses. Rebound secured by John Russell.

[11:20] Team_027 possession (Score: 74-68)
Tony Doncic drives and kicks out. Scottie Harden attempts a Midrange. Contested by Yao Oladipo (3.8 feet, MAN). SCOTTIE HARDEN MAKES IT!
Score: 76-68

[11:07] Team_083 possession (Score: 76-68)
Karl Jokic attempts a Midrange. Contested by Tony Doncic (4.7 feet, ZONE). Karl Jokic misses. Rebound secured by Bradley Dosunmu.

[10:52] Team_027 possession (Score: 76-68)
Tim Johnson drives, Malcolm Brogdon stays with him. Tim Johnson attempts a Dunk. Contested by Malcolm Brogdon (5.5 feet, MAN). Tim Johnson misses. Rebound secured by Yao Oladipo.

[10:41] Team_083 possession (Score: 76-68)
Kyrie Griffin attempts a 3Pt. Contested by Bradley Dosunmu (5.1 feet, MAN). Kyrie Griffin misses. Rebound secured by Bradley Dosunmu.

[10:24] Team_027 possession (Score: 76-68)
Scottie Harden attempts a 3Pt. Contested by Yao Oladipo (3.9 feet, MAN). SCOTTIE HARDEN MAKES IT! Assist: Tim Johnson
Score: 79-68

[10:08] Team_083 possession (Score: 79-68)
Yao Oladipo attempts a Midrange. Contested by Scottie Harden (5.3 feet, MAN). Yao Oladipo misses. Offensive rebound by Bradley Thompson! Bradley Thompson kicks it out.

[09:53] Team_083 possession (Score: 79-68)
FOUL! Holding foul on Bradley Dosunmu. [Team fouls: 1] No free throws, side out. (Bradley Dosunmu: 1 personal fouls)

[09:39] Team_083 possession (Score: 79-68)
Malcolm Brogdon attempts a 3Pt. Contested by Bradley Dosunmu (4.6 feet, ZONE). Malcolm Brogdon misses. Rebound secured by Bradley Dosunmu.

[09:24] Team_027 possession (Score: 79-68)
Tim Johnson attempts a Midrange. Contested by Malcolm Brogdon (5.6 feet, ZONE). TIM JOHNSON MAKES IT! Assist: John Russell
Score: 81-68

[09:10] Team_083 possession (Score: 81-68)
Kyrie Griffin attempts a 3Pt. Contested by Bradley Dosunmu (5.2 feet, MAN). Kyrie Griffin misses. Offensive rebound by Kyrie Griffin! Kyrie Griffin kicks it out.

[08:56] Team_083 possession (Score: 81-68)
Kyrie Griffin makes the Layup and draws the foul on John Russell! And-1! Kyrie Griffin to the line for 1. [Team fouls: 2] (John Russell: 1 personal fouls)   FT 1/1: MISS Kyrie Griffin makes 0/1 from the line. Rebound secured by Tony Doncic.
Score: 81-70

[08:43] Team_027 possession (Score: 81-70)
John Russell attempts a Midrange. Contested by Bradley Thompson (5.1 feet, MAN). John Russell misses. Rebound secured by Bradley Thompson.

[08:25] Team_083 possession (Score: 81-70)
Yao Oladipo drives and kicks out. Yao Oladipo attempts a 3Pt. Contested by Scottie Harden (5.4 feet, MAN). Yao Oladipo misses. Rebound secured by John Russell.

[08:09] Team_027 possession (Score: 81-70)
Bradley Dosunmu drives and kicks out. Tony Doncic attempts a Midrange. Contested by Karl Jokic (5.3 feet, MAN). TONY DONCIC MAKES IT! Assist: Bradley Dosunmu
Score: 83-70

[07:53] Team_083 possession (Score: 83-70)
Yao Oladipo drives and kicks out. Malcolm Brogdon attempts a Midrange. Contested by Tony Doncic (4.7 feet, ZONE). Malcolm Brogdon misses. Rebound secured by Bradley Dosunmu.

[07:42] Team_027 possession (Score: 83-70)
Bradley Dosunmu attempts a Midrange. Contested by Kyrie Griffin (4.4 feet, ZONE). BRADLEY DOSUNMU MAKES IT!
Score: 85-70

[07:26] Team_083 possession (Score: 85-70)
Malcolm Brogdon attempts a 3Pt. Contested by Tim Johnson (5.4 feet, MAN). Malcolm Brogdon misses. Rebound secured by Tony Doncic.

[07:13] Team_027 possession (Score: 85-70)
Bradley Dosunmu throws a bad pass out of bounds! TURNOVER! (dead ball)

[07:13] Substitution (Team_027): Tim Johnson OUT → CJ Green IN (stamina_rule2)

[07:13] Substitution (Team_027): Tony Doncic OUT → Dirk Lillard IN (stamina_rule2)

[07:13] Substitution (Team_027): Scottie Harden OUT → Rudy Quickley IN (stamina_rule2)

[07:13] Substitution (Team_027): Bradley Dosunmu OUT → LeBron Russell IN (stamina_rule2)

[07:13] Substitution (Team_027): John Russell OUT → Ben Stewart IN (stamina_rule2)

[07:13] Substitution (Team_083): Malcolm Brogdon OUT → Zion Markkanen IN (stamina_rule2)

[07:13] Substitution (Team_083): Karl Jokic OUT → Damian Towns IN (stamina_rule2)

[07:13] Substitution (Team_083): Yao Oladipo OUT → Domantas Doncic IN (stamina_rule2)

[07:13] Substitution (Team_083): Kyrie Griffin OUT → Cole Simmons IN (stamina_rule2)

[07:13] Substitution (Team_083): Bradley Thompson OUT → Victor McCollum IN (stamina_rule2)

[06:56] Team_083 possession (Score: 85-70)
Domantas Doncic attempts a 3Pt. Contested by Rudy Quickley (3.4 feet, ZONE). Domantas Doncic misses. Rebound secured by Ben Stewart.

[06:43] Team_027 possession (Score: 85-70)
LeBron Russell attempts a Midrange. Contested by Cole Simmons (4.8 feet, MAN). LeBron Russell misses. Rebound secured by Victor McCollum.

[06:29] Team_083 possession (Score: 85-70)
Cole Simmons attempts a Layup. Contested by LeBron Russell (5.4 feet, MAN). Cole Simmons misses. Offensive rebound by Victor McCollum! Victor McCollum puts it back in!
Score: 85-72

[06:12] Team_027 possession (Score: 85-72)
Dirk Lillard drives, Victor McCollum stays with him. Dirk Lillard attempts a Dunk. Contested by Victor McCollum (4.0 feet, ZONE). Dirk Lillard misses. Offensive rebound by Dirk Lillard! Dirk Lillard kicks it out.

[06:02] Team_027 possession (Score: 85-72)
FOUL! Reach-in foul on Victor McCollum during the drive. [Team fouls: 2] No free throws, side out. (Victor McCollum: 1 personal fouls)

[05:47] Team_027 possession (Score: 85-72)
Rudy Quickley attempts a Midrange. Contested by Domantas Doncic (5.0 feet, MAN). Rudy Quickley misses. Rebound secured by Damian Towns.

[05:32] Team_083 possession (Score: 85-72)
Domantas Doncic drives and kicks out. Victor McCollum attempts a 3Pt. Contested by LeBron Russell (5.5 feet, ZONE). VICTOR MCCOLLUM MAKES IT! Assist: Zion Markkanen
Score: 85-75

[05:18] Team_027 possession (Score: 85-75)
FOUL! Shooting foul on Damian Towns. Dirk Lillard to the line for 3 free throws. [Team fouls: 3] (Damian Towns: 1 personal fouls)   FT 1/3: GOOD   FT 2/3: GOOD   FT 3/3: GOOD Dirk Lillard makes 3/3 from the line.
Score: 88-75

[05:06] Team_083 possession (Score: 88-75)
Domantas Doncic attempts a 3Pt. Contested by Rudy Quickley (3.4 feet, ZONE). DOMANTAS DONCIC MAKES IT! Assist: Zion Markkanen
Score: 88-78

[04:47] Team_027 possession (Score: 88-78)
Dirk Lillard attempts a Midrange. Contested by Cole Simmons (4.8 feet, ZONE). Dirk Lillard misses. Rebound secured by Cole Simmons.

[04:32] Team_083 possession (Score: 88-78)
Domantas Doncic attempts a Midrange. Contested by Rudy Quickley (3.4 feet, MAN). DOMANTAS DONCIC MAKES IT! Assist: Damian Towns
Score: 88-80

[04:18] Team_027 possession (Score: 88-80)
LeBron Russell drives and kicks out. Ben Stewart attempts a 3Pt. Contested by Zion Markkanen (5.4 feet, ZONE). Ben Stewart misses. Rebound secured by Cole Simmons.

[04:04] Team_083 possession (Score: 88-80)
Domantas Doncic attempts a 3Pt. Contested by Rudy Quickley (3.4 feet, MAN). DOMANTAS DONCIC MAKES IT! Assist: Zion Markkanen
Score: 88-83

[03:52] Team_027 possession (Score: 88-83)
Rudy Quickley attempts a 3Pt. Contested by Zion Markkanen (5.8 feet, ZONE). Rudy Quickley misses. Rebound secured by Cole Simmons.

[03:38] Team_083 possession (Score: 88-83)
Domantas Doncic drives, Ben Stewart stays with him. Domantas Doncic attempts a Dunk. Contested by Ben Stewart (4.8 feet, ZONE). Domantas Doncic misses. Offensive rebound by Damian Towns! Damian Towns kicks it out.

[03:24] Team_083 possession (Score: 88-83)
Domantas Doncic attempts a Midrange. Contested by Rudy Quickley (3.4 feet, ZONE). Domantas Doncic misses. Rebound secured by Dirk Lillard.

[03:12] Team_027 possession (Score: 88-83)
LeBron Russell throws a bad pass out of bounds! TURNOVER! (dead ball)

[02:56] Team_083 possession (Score: 88-83)
Damian Towns attempts a 3Pt. Contested by Rudy Quickley (3.8 feet, ZONE). Damian Towns misses. Offensive rebound by Damian Towns! Damian Towns kicks it out.

[02:40] Team_083 possession (Score: 88-83)
Zion Markkanen attempts a Layup. Contested by CJ Green (5.3 feet, MAN). ZION MARKKANEN MAKES IT! Assist: Damian Towns
Score: 88-85

[02:27] Team_027 possession (Score: 88-85)
Dirk Lillard attempts a Midrange. Contested by Domantas Doncic (4.6 feet, ZONE). DIRK LILLARD MAKES IT!
Score: 90-85

[02:17] Team_083 possession (Score: 90-85)
FOUL! Shooting foul on Rudy Quickley. Zion Markkanen to the line for 3 free throws. [Team fouls: 3] (Rudy Quickley: 1 personal fouls)   FT 1/3: GOOD   FT 2/3: MISS   FT 3/3: GOOD Zion Markkanen makes 2/3 from the line.
Score: 90-87

[02:00] Team_027 possession (Score: 90-87)
CJ Green attempts a Midrange. Contested by Damian Towns (5.1 feet, ZONE). CJ GREEN MAKES IT! Assist: Dirk Lillard
Score: 92-87

[01:46] Team_083 possession (Score: 92-87)
Cole Simmons drives, LeBron Russell stays with him. Cole Simmons attempts a Layup. Contested by LeBron Russell (5.4 feet, MAN). COLE SIMMONS MAKES IT!
Score: 92-89

[01:33] Team_027 possession (Score: 92-89)
CJ Green attempts a 3Pt. Contested by Zion Markkanen (5.5 feet, MAN). CJ Green misses. Rebound secured by Victor McCollum.

[01:21] Team_083 possession (Score: 92-89)
Zion Markkanen attempts a Layup. Contested by CJ Green (5.3 feet, MAN). ZION MARKKANEN MAKES IT! Assist: Victor McCollum
Score: 92-91

[01:05] Team_027 possession (Score: 92-91)
FOUL! Holding foul on Cole Simmons. [Team fouls: 4] No free throws, side out. (Cole Simmons: 1 personal fouls)

[00:52] Team_027 possession (Score: 92-91)
FOUL! Reach-in foul on Victor McCollum during the drive. [IN THE BONUS! 5 team fouls] Ben Stewart to the line for 2 free throws. (Victor McCollum: 2 personal fouls)   FT 1/2: GOOD   FT 2/2: MISS Ben Stewart makes 1/2 from the line. Rebound secured by Damian Towns.
Score: 93-91

[00:33] Team_083 possession (Score: 93-91)
FOUL! Holding foul on CJ Green. [Team fouls: 4] No free throws, side out. (CJ Green: 1 personal fouls)

[00:20] Team_083 possession (Score: 93-91)
Domantas Doncic attempts a 3Pt. Contested by Rudy Quickley (3.5 feet, ZONE). Domantas Doncic misses. Rebound secured by Dirk Lillard.

[00:07] Team_027 possession (Score: 93-91)
Ben Stewart attempts a Layup. Contested by Cole Simmons (4.7 feet, ZONE). BEN STEWART MAKES IT!
Score: 95-91

================================================================================
                              4TH QUARTER COMPLETE                              
================================================================================

4TH QUARTER SCORE: Team_027 23, Team_083 23

BOX SCORE:
================================================================================

Team_027
--------------------------------------------------------------------------------
Player                MIN  PTS  REB  AST  TO      FG   FG%      3P   3P%
--------------------------------------------------------------------------------
Scottie Harden         30    5    0    0   0   2/2   100.0     0/0   0.0
Dirk Lillard           18    5    3    1   0   2/3    66.7     0/0   0.0
John Russell           30    2    2    1   0   1/2    50.0     0/0   0.0
Bradley Dosunmu        30    2    4    1   0   1/1   100.0     0/0   0.0
Tim Johnson            30    2    0    1   0   1/2    50.0     0/0   0.0
Tony Doncic            30    2    2    0   0   1/1   100.0     0/0   0.0
Ben Stewart            18    2    1    0   0   1/2    50.0     0/0   0.0
CJ Green               18    2    0    0   0   1/2    50.0     0/0   0.0
LeBron Russell         18    0    0    0   0   0/2     0.0     0/0   0.0
Rudy Quickley          18    0    0    0   0   0/2     0.0     0/0   0.0

TEAM: FG: 10/19 (52.6%), 3PT: 2/4 (50.0%), REB: 12 (1 off, 11 def), AST: 4, TO: 2
TEAM FOULS: 4


Team_083
--------------------------------------------------------------------------------
Player                MIN  PTS  REB  AST  TO      FG   FG%      3P   3P%
--------------------------------------------------------------------------------
Domantas Doncic        18    8    0    0   0   3/6    50.0     0/0   0.0
Zion Markkanen         18    6    0    3   0   3/3   100.0     0/0   0.0
Victor McCollum        18    5    3    1   0   2/2   100.0     0/0   0.0
Cole Simmons           18    2    3    0   0   1/1   100.0     0/0   0.0
Kyrie Griffin          30    0    2    0   0   0/2     0.0     0/0   0.0
Malcolm Brogdon        30    0    0    0   0   0/3     0.0     0/0   0.0
Karl Jokic             30    0    0    0   0   0/1     0.0     0/0   0.0
Yao Oladipo            30    0    1    0   0   0/2     0.0     0/0   0.0
Bradley Thompson       30    0    2    0   0   0/0     0.0     0/0   0.0
Damian Towns           18    0    4    2   0   0/0     0.0     0/0   0.0

TEAM: FG: 9/20 (45.0%), 3PT: 3/9 (33.3%), REB: 15 (6 off, 9 def), AST: 6, TO: 0
TEAM FOULS: 5 [Team_027 in BONUS]

================================================================================

================================================================================
                               FULL GAME COMPLETE                               
================================================================================

FINAL SCORE: Team_027 95, Team_083 91

SCORING BY QUARTER:
--------------------------------------------------------------------------------
Team                     Q1     Q2     Q3     Q4    FINAL
--------------------------------------------------------------------------------
Team_027                 21     16     35     23       95
Team_083                 26     21     21     23       91
--------------------------------------------------------------------------------

FULL GAME BOX SCORE:
================================================================================

Team_027
--------------------------------------------------------------------------------
Player                MIN  PTS  REB  AST  TO      FG   FG%      3P   3P%      FT STL BLK
--------------------------------------------------------------------------------
Tim Johnson            30   13    0    3   1   7/11   63.6   1/4    25.0   1/1     0   0
Tony Doncic            30   10    9    2   2   5/8    62.5   0/0     0.0   0/0     0   0
Scottie Harden         30   15    0    1   3   4/5    80.0   3/4    75.0   4/4     0   0
Bradley Dosunmu        30    6   20    4   2   5/6    83.3   0/0     0.0   0/0     1   0
John Russell           30   25    7    3   4  10/15   66.7   0/0     0.0  11/13    0   0
CJ Green               18    2    0    1   0   2/8    25.0   1/4    25.0   0/0     1   0
Dirk Lillard           18    7    5    2   0   3/9    33.3   1/5    20.0   3/3     0   0
Rudy Quickley          18    0    0    1   0   0/2     0.0   0/1     0.0   0/0     0   0
LeBron Russell         18   10    4    0   1   4/7    57.1   2/2   100.0   0/0     0   0
Ben Stewart            18    4    5    1   3   1/3    33.3   0/0     0.0   1/2     0   0

TEAM: FG: 42/75 (56.0%), 3PT: 8/20 (40.0%), REB: 50 (7 off, 43 def), AST: 18, TO: 16


Team_083
--------------------------------------------------------------------------------
Player                MIN  PTS  REB  AST  TO      FG   FG%      3P   3P%      FT STL BLK
--------------------------------------------------------------------------------
Malcolm Brogdon        30   15    0    1   0   7/15   46.7   1/7    14.3   6/7     0   0
Karl Jokic             30    4    0    4   0   3/9    33.3   0/1     0.0   0/0     0   0
Yao Oladipo            30    4    5    0   2   1/7    14.3   0/3     0.0   2/3     0   0
Kyrie Griffin          30   16    8    3   2   7/15   46.7   1/3    33.3   3/5     4   0
Bradley Thompson       30    4    6    1   0   1/4    25.0   0/0     0.0   0/0     1   0
Zion Markkanen         18    8    0    3   2   5/6    83.3   2/2   100.0   2/3     1   0
Damian Towns           18    3   12    2   0   1/4    25.0   1/4    25.0   0/0     0   1
Domantas Doncic        18   11    0    2   0   5/11   45.5   2/5    40.0   0/1     0   0
Cole Simmons           18    4    6    2   0   3/5    60.0   0/0     0.0   0/0     0   0
Victor McCollum        18   14    7    1   1   2/3    66.7   0/0     0.0   5/5     1   0

TEAM: FG: 37/81 (45.7%), 3PT: 7/25 (28.0%), REB: 44 (11 off, 33 def), AST: 19, TO: 7

================================================================================
