================================================================================
                        FULL GAME - Team_022 vs Team_049                        
================================================================================

================================================================================
                       1ST QUARTER - Team_022 vs Team_049                       
================================================================================

[12:00] Team_022 possession (Score: 0-0)
Myles Anthony drives and kicks out. Dirk Markkanen attempts a Midrange. Contested by Ja Oladipo (4.2 feet, ZONE). Dirk Markkanen misses. Rebound secured by Shai Mobley.

[11:44] Team_049 possession (Score: 0-0)
Shai Mobley drives, Dirk Markkanen stays with him. Shai Mobley attempts a Dunk. Contested by Dirk Markkanen (4.9 feet, MAN). Shai Mobley misses. Rebound secured by Myles Anthony.

[11:28] Team_022 possession (Score: 0-0)
Michael Ginobili attempts a 3Pt. Contested by Ja Oladipo (4.3 feet, ZONE). Michael Ginobili misses. Rebound secured by Jimmy Griffin.

[11:19] Team_049 possession (Score: 0-0)
Ja Oladipo attempts a 3Pt. Contested by Michael Ginobili (3.7 feet, ZONE). JA OLADIPO MAKES IT! Assist: De'Aaron Allen
Score: 0-3

[11:08] Team_022 possession (Score: 0-3)
Malcolm Allen drives and kicks out. Myles Anthony attempts a 3Pt. Contested by Ja Oladipo (4.2 feet, ZONE). MYLES ANTHONY MAKES IT! Assist: Malcolm Allen
Score: 3-3

[10:53] Team_049 possession (Score: 3-3)
FOUL! Shooting foul on Lamelo Dosunmu. De'Aaron Allen to the line for 2 free throws. [Team fouls: 1] (Lamelo Dosunmu: 1 personal fouls)   FT 1/2: GOOD   FT 2/2: GOOD De'Aaron Allen makes 2/2 from the line.
Score: 3-5

[10:37] Team_022 possession (Score: 3-5)
Malcolm Allen commits a violation (traveling/carry)! TURNOVER! (dead ball)

[10:21] Team_049 possession (Score: 3-5)
FOUL! Reach-in foul on Dirk Markkanen during the drive. [Team fouls: 2] No free throws, side out. (Dirk Markkanen: 1 personal fouls)

[10:02] Team_049 possession (Score: 3-5)
Ja Oladipo attempts a 3Pt. Contested by Michael Ginobili (3.7 feet, ZONE). Ja Oladipo misses. Rebound secured by Michael Ginobili.

[09:47] Team_022 possession (Score: 3-5)
Myles Anthony attempts a 3Pt. Contested by Ja Oladipo (4.4 feet, ZONE). MYLES ANTHONY MAKES IT! Assist: Michael Ginobili
Score: 6-5

[09:31] Team_049 possession (Score: 6-5)
Shai Bird attempts a 3Pt. Contested by Malcolm Allen (4.9 feet, MAN). Shai Bird misses. Rebound secured by Dirk Markkanen.

[09:16] Team_022 possession (Score: 6-5)
Michael Ginobili drives to the basket... FOUL! Offensive foul on Michael Ginobili! Ja Oladipo drew the charge! [Team fouls: 3] (Michael Ginobili: 1 personal fouls) TURNOVER! (dead ball)

[09:02] Team_049 possession (Score: 6-5)
Ja Oladipo attempts a 3Pt. Contested by Lamelo Dosunmu (4.9 feet, ZONE). Ja Oladipo misses. Rebound secured by Michael Ginobili.

[08:46] Team_022 possession (Score: 6-5)
Dirk Markkanen attempts a Dunk. BLOCKED BY DE'AARON ALLEN! Ball deflects out of bounds off Dirk Markkanen.

[08:30] Team_049 possession (Score: 6-5)
Ja Oladipo drives, picks up Dirk Markkanen. Help arrives from Michael Ginobili! Ja Oladipo attempts a Layup. Contested by Michael Ginobili (4.8 feet, ZONE). JA OLADIPO MAKES IT! Assist: Shai Bird
Score: 6-7

[08:17] Team_022 possession (Score: 6-7)
Malcolm Allen makes the 3Pt and draws the foul on Shai Bird! And-1! Malcolm Allen to the line for 1. [Team fouls: 1] (Shai Bird: 1 personal fouls)   FT 1/1: GOOD Malcolm Allen makes 1/1 from the line.
Score: 10-7

[08:01] Team_049 possession (Score: 10-7)
Jimmy Griffin attempts a Midrange. Contested by Michael Ginobili (3.6 feet, ZONE). JIMMY GRIFFIN MAKES IT!
Score: 10-9

[07:48] Team_022 possession (Score: 10-9)
Myles Anthony drives, De'Aaron Allen stays with him. Myles Anthony attempts a Layup. Contested by De'Aaron Allen (4.5 feet, ZONE). MYLES ANTHONY MAKES IT! Assist: Dirk Markkanen
Score: 12-9

[07:30] Team_049 possession (Score: 12-9)
Jimmy Griffin makes the Layup and draws the foul on Dirk Markkanen! And-1! Jimmy Griffin to the line for 1. [Team fouls: 4] (Dirk Markkanen: 2 personal fouls)   FT 1/1: MISS Jimmy Griffin makes 0/1 from the line. Rebound secured by Myles Anthony.
Score: 12-11

[07:13] Team_022 possession (Score: 12-11)
Myles Anthony drives to the basket... Myles Anthony throws a bad pass out of bounds! TURNOVER! (dead ball)

[06:55] Team_049 possession (Score: 12-11)
FOUL! Reach-in foul on Malcolm Allen during the drive. [IN THE BONUS! 5 team fouls] Shai Bird to the line for 2 free throws. (Malcolm Allen: 1 personal fouls)   FT 1/2: GOOD   FT 2/2: GOOD Shai Bird makes 2/2 from the line.
Score: 12-13

[06:40] Team_022 possession (Score: 12-13)
FOUL! Shooting foul on Ja Oladipo. Myles Anthony to the line for 2 free throws. [Team fouls: 2] (Ja Oladipo: 1 personal fouls)   FT 1/2: GOOD   FT 2/2: GOOD Myles Anthony makes 2/2 from the line.
Score: 14-13

[06:27] Team_049 possession (Score: 14-13)
FOUL! Holding foul on Malcolm Allen. [IN THE BONUS! 6 team fouls] Shai Bird to the line for 2 free throws. (Malcolm Allen: 2 personal fouls)   FT 1/2: GOOD   FT 2/2: GOOD Shai Bird makes 2/2 from the line.
Score: 14-15

[06:15] Team_022 possession (Score: 14-15)
FOUL! Shooting foul on De'Aaron Allen. Dirk Markkanen to the line for 2 free throws. [Team fouls: 3] (De'Aaron Allen: 1 personal fouls)   FT 1/2: GOOD   FT 2/2: GOOD Dirk Markkanen makes 2/2 from the line.
Score: 16-15

[05:59] Team_049 possession (Score: 16-15)
FOUL! Shooting foul on Michael Ginobili. Jimmy Griffin to the line for 2 free throws. [BONUS: 7 team fouls] (Michael Ginobili: 2 personal fouls)   FT 1/2: GOOD   FT 2/2: GOOD Jimmy Griffin makes 2/2 from the line.
Score: 16-17

[05:44] Team_022 possession (Score: 16-17)
Dirk Markkanen attempts a 3Pt. Contested by Ja Oladipo (4.7 feet, ZONE). Dirk Markkanen misses. Offensive rebound by Michael Ginobili! Michael Ginobili kicks it out.

[05:27] Team_022 possession (Score: 16-17)
Dirk Markkanen attempts a Midrange. Contested by Shai Mobley (4.7 feet, MAN). Dirk Markkanen misses. Rebound secured by Shai Mobley.

[05:09] Team_049 possession (Score: 16-17)
De'Aaron Allen drives to the basket... De'Aaron Allen loses the ball! Stripped by Lamelo Dosunmu! TURNOVER! (live ball)

[04:53] Team_022 possession (Score: 16-17)
Malcolm Allen attempts a Midrange. Contested by Shai Bird (4.6 feet, MAN). Malcolm Allen misses. Rebound secured by Shai Mobley.

[04:38] Team_049 possession (Score: 16-17)
Jimmy Griffin attempts a Midrange. Contested by Michael Ginobili (3.6 feet, ZONE). Jimmy Griffin misses. Rebound secured by Michael Ginobili.

[04:19] Team_022 possession (Score: 16-17)
Michael Ginobili attempts a 3Pt. Contested by Ja Oladipo (4.4 feet, MAN). Michael Ginobili misses. Rebound secured by De'Aaron Allen.

[04:09] Team_049 possession (Score: 16-17)
Shai Mobley attempts a Midrange. Contested by Dirk Markkanen (5.0 feet, MAN). SHAI MOBLEY MAKES IT!
Score: 16-19

[03:56] Team_022 possession (Score: 16-19)
Malcolm Allen attempts a Midrange. Contested by Shai Bird (4.7 feet, MAN). Malcolm Allen misses. Offensive rebound by Michael Ginobili! Michael Ginobili kicks it out.

[03:42] Team_022 possession (Score: 16-19)
Dirk Markkanen drives and kicks out. Malcolm Allen attempts a Midrange. Contested by De'Aaron Allen (4.4 feet, ZONE). MALCOLM ALLEN MAKES IT! Assist: Michael Ginobili
Score: 18-19

[03:32] Team_049 possession (Score: 18-19)
Ja Oladipo attempts a 3Pt. Contested by Michael Ginobili (3.9 feet, MAN). Ja Oladipo misses. Rebound secured by Dirk Markkanen.

[03:15] Team_022 possession (Score: 18-19)
Malcolm Allen attempts a 3Pt. Contested by Shai Bird (4.8 feet, MAN). Malcolm Allen misses. Rebound secured by De'Aaron Allen.

[03:04] Team_049 possession (Score: 18-19)
Shai Bird attempts a 3Pt. Contested by Michael Ginobili (4.1 feet, ZONE). Shai Bird misses. Rebound secured by Michael Ginobili.

[02:50] Team_022 possession (Score: 18-19)
Malcolm Allen attempts a 3Pt. Contested by Shai Bird (4.8 feet, MAN). Malcolm Allen misses. Offensive rebound by Dirk Markkanen! Dirk Markkanen puts it back in!
Score: 20-19

[02:34] Team_049 possession (Score: 20-19)
Shai Bird attempts a Layup. Contested by Dirk Markkanen (5.2 feet, ZONE). Shai Bird misses. Rebound secured by Myles Anthony.

[02:19] Team_022 possession (Score: 20-19)
Myles Anthony commits a violation (traveling/carry)! TURNOVER! (dead ball)

[02:19] Substitution (Team_022): Malcolm Allen OUT → DeMar Harden IN (stamina_rule2)

[02:19] Substitution (Team_022): Myles Anthony OUT → Dejounte Towns IN (stamina_rule2)

[02:19] Substitution (Team_022): Lamelo Dosunmu OUT → Kawhi Russell IN (stamina_rule2)

[02:19] Substitution (Team_022): Dirk Markkanen OUT → Cole Iverson IN (stamina_rule2)

[02:19] Substitution (Team_049): Shai Bird OUT → Shaquille Lillard IN (stamina_rule2)

[02:19] Substitution (Team_049): Jimmy Griffin OUT → Desmond Towns IN (stamina_rule2)

[02:09] Team_049 possession (Score: 20-19)
Shai Mobley attempts a Layup. Contested by Kawhi Russell (4.3 feet, ZONE). SHAI MOBLEY MAKES IT! Assist: Ja Oladipo
Score: 20-21

[01:53] Team_022 possession (Score: 20-21)
Cole Iverson attempts a Midrange. Contested by Shai Mobley (4.6 feet, MAN). Cole Iverson misses. Rebound secured by De'Aaron Allen.

[01:39] Team_049 possession (Score: 20-21)
Ja Oladipo attempts a 3Pt. Contested by Michael Ginobili (4.1 feet, MAN). JA OLADIPO MAKES IT! Assist: Desmond Towns
Score: 20-24

[01:25] Team_022 possession (Score: 20-24)
Cole Iverson attempts a 3Pt. Contested by Shai Mobley (4.6 feet, MAN). Cole Iverson misses. Rebound secured by Shai Mobley.

[01:11] Team_049 possession (Score: 20-24)
Shai Mobley attempts a Midrange. Contested by Kawhi Russell (4.3 feet, ZONE). Shai Mobley misses. Rebound secured by Michael Ginobili.

[00:57] Team_022 possession (Score: 20-24)
DeMar Harden drives, Shaquille Lillard stays with him. DeMar Harden attempts a Dunk. Contested by Shaquille Lillard (4.5 feet, MAN). DEMAR HARDEN MAKES IT! Assist: Cole Iverson
Score: 22-24

[00:41] Team_049 possession (Score: 22-24)
Shai Mobley attempts a Midrange. Contested by Cole Iverson (5.3 feet, MAN). Shai Mobley misses. Rebound secured by Dejounte Towns.

[00:27] Team_022 possession (Score: 22-24)
Kawhi Russell drives and kicks out. DeMar Harden attempts a 3Pt. Contested by Shaquille Lillard (4.5 feet, MAN). DeMar Harden misses. Rebound secured by De'Aaron Allen.

[00:11] Team_049 possession (Score: 22-24)
Desmond Towns attempts a Layup. Contested by Kawhi Russell (4.2 feet, ZONE). DESMOND TOWNS MAKES IT! Assist: De'Aaron Allen
Score: 22-26

================================================================================
                              1ST QUARTER COMPLETE                              
================================================================================

1ST QUARTER SCORE: Team_022 22, Team_049 26

BOX SCORE:
================================================================================

Team_022
--------------------------------------------------------------------------------
Player                MIN  PTS  REB  AST  TO      FG   FG%      3P   3P%
--------------------------------------------------------------------------------
Myles Anthony          10   10    3    0   0   4/5    80.0     0/0   0.0
Malcolm Allen          10    6    0    1   0   2/4    50.0     0/0   0.0
Dirk Markkanen         10    4    3    1   0   2/4    50.0     0/0   0.0
DeMar Harden            2    2    0    0   0   1/1   100.0     0/0   0.0
Michael Ginobili       12    0    7    2   0   0/2     0.0     0/0   0.0
Cole Iverson            2    0    0    1   0   0/2     0.0     0/0   0.0
Dejounte Towns          2    0    1    0   0   0/0     0.0     0/0   0.0
Kawhi Russell           2    0    0    0   0   0/1     0.0     0/0   0.0

TEAM: FG: 9/19 (47.4%), 3PT: 3/7 (42.9%), REB: 14 (3 off, 11 def), AST: 5, TO: 4
TEAM FOULS: 7 [Team_049 in BONUS]


Team_049
--------------------------------------------------------------------------------
Player                MIN  PTS  REB  AST  TO      FG   FG%      3P   3P%
--------------------------------------------------------------------------------
Ja Oladipo             12    8    0    1   0   3/6    50.0     0/0   0.0
Shai Mobley            12    4    4    0   0   2/5    40.0     0/0   0.0
Jimmy Griffin          10    4    1    0   0   2/4    50.0     0/0   0.0
Shai Bird              10    4    0    1   0   2/5    40.0     0/0   0.0
De'Aaron Allen         12    2    4    2   0   1/1   100.0     0/0   0.0
Desmond Towns           2    2    0    1   0   1/1   100.0     0/0   0.0

TEAM: FG: 11/22 (50.0%), 3PT: 2/7 (28.6%), REB: 9 (0 off, 9 def), AST: 5, TO: 1
TEAM FOULS: 3

================================================================================

================================================================================
                       2ND QUARTER - Team_022 vs Team_049                       
================================================================================

[12:00] Team_022 possession (Score: 22-26)
Malcolm Allen attempts a Midrange. Contested by Jimmy Griffin (5.4 feet, ZONE). Malcolm Allen misses. Rebound secured by Shai Mobley.

[11:44] Team_049 possession (Score: 22-26)
Shai Mobley attempts a Midrange. Contested by Dirk Markkanen (4.9 feet, MAN). Shai Mobley misses. Rebound secured by Michael Ginobili.

[11:28] Team_022 possession (Score: 22-26)
Dirk Markkanen drives to the basket... FOUL! Offensive foul on Dirk Markkanen! Shai Mobley drew the charge! [Team fouls: 1] (Dirk Markkanen: 1 personal fouls) TURNOVER! (dead ball)

[11:15] Team_049 possession (Score: 22-26)
Shai Bird attempts a Midrange. Contested by Malcolm Allen (4.9 feet, MAN). Shai Bird misses. Offensive rebound by Shai Mobley! Shai Mobley puts it back in!
Score: 22-28

[10:59] Team_022 possession (Score: 22-28)
Malcolm Allen attempts a Midrange. Contested by Shai Bird (4.7 feet, MAN). Malcolm Allen misses. Rebound secured by De'Aaron Allen.

[10:44] Team_049 possession (Score: 22-28)
Jimmy Griffin attempts a 3Pt. Contested by Michael Ginobili (4.0 feet, ZONE). Jimmy Griffin misses. Rebound secured by Dirk Markkanen.

[10:30] Team_022 possession (Score: 22-28)
FOUL! Shooting foul on De'Aaron Allen. Lamelo Dosunmu to the line for 2 free throws. [Team fouls: 1] (De'Aaron Allen: 1 personal fouls)   FT 1/2: GOOD   FT 2/2: GOOD Lamelo Dosunmu makes 2/2 from the line.
Score: 24-28

[10:14] Team_049 possession (Score: 24-28)
De'Aaron Allen attempts a Midrange. Contested by Myles Anthony (4.4 feet, ZONE). De'Aaron Allen misses. Rebound secured by Myles Anthony.

[09:59] Team_022 possession (Score: 24-28)
Dirk Markkanen attempts a Layup. Contested by De'Aaron Allen (5.2 feet, ZONE). DIRK MARKKANEN MAKES IT! Assist: Lamelo Dosunmu
Score: 26-28

[09:40] Team_049 possession (Score: 26-28)
De'Aaron Allen attempts a 3Pt. Contested by Lamelo Dosunmu (4.7 feet, MAN). De'Aaron Allen misses. Rebound secured by Dirk Markkanen.

[09:26] Team_022 possession (Score: 26-28)
Lamelo Dosunmu makes the Layup and draws the foul on De'Aaron Allen! And-1! Lamelo Dosunmu to the line for 1. [Team fouls: 2] (De'Aaron Allen: 2 personal fouls)   FT 1/1: GOOD Lamelo Dosunmu makes 1/1 from the line.
Score: 29-28

[09:13] Team_049 possession (Score: 29-28)
Shai Mobley attempts a Midrange. Contested by Myles Anthony (4.9 feet, ZONE). Shai Mobley misses. FOUL! Loose ball foul on Michael Ginobili during the rebound battle. [Team fouls: 2] No free throws, side out. (Michael Ginobili: 1 personal fouls)

[09:01] Team_049 possession (Score: 29-28)
Shai Bird attempts a 3Pt. Contested by Malcolm Allen (5.1 feet, MAN). Shai Bird misses. Rebound secured by Michael Ginobili.

[08:46] Team_022 possession (Score: 29-28)
Myles Anthony attempts a Midrange. Contested by Jimmy Griffin (5.1 feet, MAN). MYLES ANTHONY MAKES IT! Assist: Dirk Markkanen
Score: 31-28

[08:32] Team_049 possession (Score: 31-28)
Jimmy Griffin attempts a 3Pt. Contested by Myles Anthony (4.8 feet, MAN). Jimmy Griffin misses. Rebound secured by Dirk Markkanen.

[08:19] Team_022 possession (Score: 31-28)
FOUL! Reach-in foul on De'Aaron Allen during the drive. [Team fouls: 3] No free throws, side out. (De'Aaron Allen: 3 personal fouls)

[08:04] Team_022 possession (Score: 31-28)
Michael Ginobili attempts a Midrange. Contested by Jimmy Griffin (5.0 feet, ZONE). MICHAEL GINOBILI MAKES IT!
Score: 33-28

[07:50] Team_049 possession (Score: 33-28)
Jimmy Griffin attempts a 3Pt. Contested by Michael Ginobili (4.4 feet, ZONE). Jimmy Griffin misses. Rebound secured by Dirk Markkanen.

[07:37] Team_022 possession (Score: 33-28)
Lamelo Dosunmu attempts a Midrange. Contested by De'Aaron Allen (5.4 feet, MAN). Lamelo Dosunmu misses. Offensive rebound by Dirk Markkanen! Dirk Markkanen's putback is no good. Offensive rebound by Dirk Markkanen! Dirk Markkanen kicks it out.

[07:26] Team_022 possession (Score: 33-28)
Lamelo Dosunmu attempts a Midrange. Contested by Shai Bird (4.8 feet, ZONE). Lamelo Dosunmu misses. Rebound secured by De'Aaron Allen.

[07:13] Team_049 possession (Score: 33-28)
FOUL! Holding foul on Michael Ginobili. [Team fouls: 3] No free throws, side out. (Michael Ginobili: 2 personal fouls)

[07:01] Team_049 possession (Score: 33-28)
De'Aaron Allen makes the Midrange and draws the foul on Michael Ginobili! And-1! De'Aaron Allen to the line for 1. [Team fouls: 4] (Michael Ginobili: 3 personal fouls)   FT 1/1: GOOD De'Aaron Allen makes 1/1 from the line.
Score: 33-31

[06:50] Team_022 possession (Score: 33-31)
Dirk Markkanen attempts a Layup. Contested by Shai Mobley (5.6 feet, MAN). DIRK MARKKANEN MAKES IT!
Score: 35-31

[06:33] Team_049 possession (Score: 35-31)
De'Aaron Allen attempts a Midrange. Contested by Lamelo Dosunmu (5.1 feet, MAN). De'Aaron Allen misses. Rebound secured by Michael Ginobili.

[06:21] Team_022 possession (Score: 35-31)
Malcolm Allen attempts a Layup. Contested by Shai Bird (5.2 feet, MAN). MALCOLM ALLEN MAKES IT!
Score: 37-31

[06:02] Team_049 possession (Score: 37-31)
Ja Oladipo attempts a Midrange. BLOCKED BY MICHAEL GINOBILI! Ball is loose! Offensive rebound by Shai Mobley! Shai Mobley kicks it out.

[05:48] Team_049 possession (Score: 37-31)
FOUL! Holding foul on Lamelo Dosunmu. [IN THE BONUS! 6 team fouls] De'Aaron Allen to the line for 2 free throws. (Lamelo Dosunmu: 1 personal fouls)   FT 1/2: GOOD   FT 2/2: MISS De'Aaron Allen makes 1/2 from the line. Rebound secured by Dirk Markkanen.
Score: 37-32

[05:35] Team_022 possession (Score: 37-32)
Dirk Markkanen attempts a Midrange. Contested by Ja Oladipo (5.8 feet, ZONE). DIRK MARKKANEN MAKES IT! Assist: Lamelo Dosunmu
Score: 39-32

[05:25] Team_049 possession (Score: 39-32)
FOUL! Reach-in foul on Dirk Markkanen during the drive. [IN THE BONUS! 7 team fouls] Shai Mobley to the line for 2 free throws. (Dirk Markkanen: 2 personal fouls)   FT 1/2: MISS   FT 2/2: GOOD Shai Mobley makes 1/2 from the line.
Score: 39-33

[05:14] Team_022 possession (Score: 39-33)
Dirk Markkanen attempts a Layup. Contested by De'Aaron Allen (5.8 feet, ZONE). Dirk Markkanen misses. Rebound secured by Jimmy Griffin.

[04:58] Team_049 possession (Score: 39-33)
Ja Oladipo makes the Midrange and draws the foul on Michael Ginobili! And-1! Ja Oladipo to the line for 1. [BONUS: 8 team fouls] (Michael Ginobili: 5 personal fouls)   FT 1/1: GOOD Ja Oladipo makes 1/1 from the line.
Score: 39-36

[04:46] Team_022 possession (Score: 39-36)
Myles Anthony attempts a Midrange. Contested by Jimmy Griffin (5.6 feet, MAN). Myles Anthony misses. Rebound secured by Shai Mobley.

[04:32] Team_049 possession (Score: 39-36)
Shai Mobley drives, Dirk Markkanen stays with him. Shai Mobley attempts a Layup. Contested by Dirk Markkanen (5.6 feet, MAN). Shai Mobley misses. Rebound secured by Michael Ginobili.

[04:14] Team_022 possession (Score: 39-36)
Michael Ginobili drives and kicks out. Malcolm Allen attempts a Midrange. Contested by De'Aaron Allen (5.6 feet, ZONE). Malcolm Allen misses. Rebound secured by Jimmy Griffin.

[03:56] Team_049 possession (Score: 39-36)
Jimmy Griffin attempts a 3Pt. Contested by Michael Ginobili (5.1 feet, ZONE). Jimmy Griffin misses. Rebound secured by Myles Anthony.

[03:37] Team_022 possession (Score: 39-36)
Lamelo Dosunmu attempts a Midrange. Contested by Shai Mobley (5.9 feet, ZONE). LAMELO DOSUNMU MAKES IT! Assist: Michael Ginobili
Score: 41-36

[03:26] Team_049 possession (Score: 41-36)
Jimmy Griffin throws a bad pass! Stolen by Myles Anthony! TURNOVER! (live ball)

[03:07] Team_022 possession (Score: 41-36)
Michael Ginobili attempts a 3Pt. Contested by Jimmy Griffin (5.6 feet, ZONE). Michael Ginobili misses. Rebound secured by De'Aaron Allen.

[02:57] Team_049 possession (Score: 41-36)
FOUL! Reach-in foul on Dirk Markkanen during the drive. [IN THE BONUS! 9 team fouls] Shai Mobley to the line for 2 free throws. (Dirk Markkanen: 3 personal fouls)   FT 1/2: MISS   FT 2/2: GOOD Shai Mobley makes 1/2 from the line.
Score: 41-37

[02:39] Team_022 possession (Score: 41-37)
Dirk Markkanen drives and kicks out. Lamelo Dosunmu attempts a Midrange. Contested by De'Aaron Allen (5.8 feet, ZONE). Lamelo Dosunmu misses. Offensive rebound by Dirk Markkanen! Dirk Markkanen kicks it out.

[02:25] Team_022 possession (Score: 41-37)
Michael Ginobili drives and kicks out. Malcolm Allen attempts a Midrange. Contested by Shai Bird (5.3 feet, MAN). Malcolm Allen misses. Rebound secured by Shai Mobley.

[02:11] Team_049 possession (Score: 41-37)
Shai Mobley drives, picks up Dirk Markkanen. Help arrives from Michael Ginobili! Shai Mobley attempts a Dunk. Contested by Michael Ginobili (5.9 feet, ZONE). SHAI MOBLEY MAKES IT!
Score: 41-39

[01:58] Team_022 possession (Score: 41-39)
Myles Anthony attempts a Midrange. Contested by Jimmy Griffin (5.9 feet, MAN). Myles Anthony misses. Rebound secured by Shai Mobley.

[01:45] Team_049 possession (Score: 41-39)
Shai Mobley attempts a Midrange. Contested by Dirk Markkanen (6.0 feet, MAN). Shai Mobley misses. Rebound secured by Dirk Markkanen.

[01:32] Team_022 possession (Score: 41-39)
Michael Ginobili attempts a Layup. Contested by Ja Oladipo (6.0 feet, MAN). MICHAEL GINOBILI MAKES IT! Assist: Malcolm Allen
Score: 43-39

[01:15] Team_049 possession (Score: 43-39)
Shai Mobley drives, picks up Dirk Markkanen. Help arrives from Michael Ginobili! Shai Mobley attempts a Dunk. Wide open! Michael Ginobili is 6.1 feet away. [ZONE] SHAI MOBLEY MAKES IT! Assist: Ja Oladipo
Score: 43-41

[01:01] Team_022 possession (Score: 43-41)
Dirk Markkanen drives and kicks out. Dirk Markkanen attempts a Midrange. Wide open! Shai Mobley is 6.2 feet away. [MAN] Dirk Markkanen misses. Rebound secured by Jimmy Griffin.

[00:43] Team_049 possession (Score: 43-41)
Ja Oladipo attempts a 3Pt. Contested by Michael Ginobili (5.7 feet, MAN). Ja Oladipo misses. Rebound secured by Michael Ginobili.

[00:28] Team_022 possession (Score: 43-41)
Myles Anthony drives, picks up De'Aaron Allen. Help arrives from Ja Oladipo! Myles Anthony attempts a Layup. Wide open! Ja Oladipo is 6.1 feet away. [ZONE] MYLES ANTHONY MAKES IT! Assist: Malcolm Allen
Score: 45-41

[00:13] Team_049 possession (Score: 45-41)
De'Aaron Allen attempts a Midrange. Wide open! Lamelo Dosunmu is 6.0 feet away. [MAN] De'Aaron Allen misses. Rebound secured by Dirk Markkanen.

================================================================================
                              2ND QUARTER COMPLETE                              
================================================================================

2ND QUARTER SCORE: Team_022 23, Team_049 15

BOX SCORE:
================================================================================

Team_022
--------------------------------------------------------------------------------
Player                MIN  PTS  REB  AST  TO      FG   FG%      3P   3P%
--------------------------------------------------------------------------------
Lamelo Dosunmu         22    7    0    2   0   3/4    75.0     0/0   0.0
Dirk Markkanen         22    6    9    1   0   3/5    60.0     0/0   0.0
Michael Ginobili       24    4    5    1   0   2/5    40.0     0/0   0.0
Myles Anthony          22    4    2    0   0   2/4    50.0     0/0   0.0
Malcolm Allen          22    2    0    2   0   1/3    33.3     0/0   0.0

TEAM: FG: 11/21 (52.4%), 3PT: 0/1 (0.0%), REB: 16 (2 off, 14 def), AST: 6, TO: 1
TEAM FOULS: 9 [Team_049 in BONUS]


Team_049
--------------------------------------------------------------------------------
Player                MIN  PTS  REB  AST  TO      FG   FG%      3P   3P%
--------------------------------------------------------------------------------
Shai Mobley            24    8    6    0   0   5/8    62.5     0/0   0.0
De'Aaron Allen         24    3    3    0   0   1/5    20.0     0/0   0.0
Ja Oladipo             24    3    0    1   0   1/2    50.0     0/0   0.0
Jimmy Griffin          22    0    4    0   0   0/4     0.0     0/0   0.0
Shai Bird              22    0    0    0   0   0/1     0.0     0/0   0.0

TEAM: FG: 7/21 (33.3%), 3PT: 0/7 (0.0%), REB: 13 (3 off, 10 def), AST: 1, TO: 1
TEAM FOULS: 3

================================================================================

================================================================================
                       3RD QUARTER - Team_022 vs Team_049                       
================================================================================

[12:00] Team_022 possession (Score: 45-41)
Lamelo Dosunmu drives, De'Aaron Allen stays with him. Lamelo Dosunmu attempts a Dunk. Contested by De'Aaron Allen (4.7 feet, MAN). Lamelo Dosunmu misses. Rebound secured by De'Aaron Allen.

[11:47] Team_049 possession (Score: 45-41)
Shai Bird makes the 3Pt and draws the foul on Michael Ginobili! And-1! Shai Bird to the line for 1. [Team fouls: 1] (Michael Ginobili: 1 personal fouls)   FT 1/1: GOOD Shai Bird makes 1/1 from the line.
Score: 45-45

[11:36] Team_022 possession (Score: 45-45)
Dirk Markkanen drives and kicks out. Michael Ginobili attempts a Midrange. Contested by Ja Oladipo (4.2 feet, MAN). Michael Ginobili misses. Rebound secured by Shai Mobley.

[11:20] Team_049 possession (Score: 45-45)
Shai Mobley drives to the basket... Shai Mobley loses the ball! Stripped by Dirk Markkanen! TURNOVER! (live ball)

[11:05] Team_022 possession (Score: 45-45)
Malcolm Allen attempts a 3Pt. Contested by Shai Bird (4.6 feet, MAN). Malcolm Allen misses. Rebound secured by Jimmy Griffin.

[10:51] Team_049 possession (Score: 45-45)
Shai Mobley attempts a 3Pt. Contested by Dirk Markkanen (4.9 feet, MAN). Shai Mobley misses. Rebound secured by Michael Ginobili.

[10:36] Team_022 possession (Score: 45-45)
Malcolm Allen attempts a 3Pt. Contested by Shai Bird (4.6 feet, MAN). Malcolm Allen misses. Rebound secured by De'Aaron Allen.

[10:23] Team_049 possession (Score: 45-45)
De'Aaron Allen attempts a Layup. Contested by Lamelo Dosunmu (4.5 feet, MAN). DE'AARON ALLEN MAKES IT! Assist: Jimmy Griffin
Score: 45-47

[10:08] Team_022 possession (Score: 45-47)
Dirk Markkanen attempts a Midrange. Contested by Shai Bird (4.4 feet, ZONE). Dirk Markkanen misses. Rebound secured by De'Aaron Allen.

[09:55] Team_049 possession (Score: 45-47)
De'Aaron Allen drives to the basket... De'Aaron Allen loses the ball! Stripped by Lamelo Dosunmu! TURNOVER! (live ball)

[09:40] Team_022 possession (Score: 45-47)
Myles Anthony attempts a Layup. BLOCKED BY DE'AARON ALLEN! Ball is loose! Rebound secured by Shai Mobley.

[09:28] Team_049 possession (Score: 45-47)
Shai Mobley attempts a Layup. Contested by Dirk Markkanen (4.9 feet, ZONE). Shai Mobley misses. Rebound secured by Myles Anthony.

[09:14] Team_022 possession (Score: 45-47)
Malcolm Allen attempts a Layup. Contested by Shai Bird (4.6 feet, MAN). MALCOLM ALLEN MAKES IT!
Score: 47-47

[08:58] Team_049 possession (Score: 47-47)
De'Aaron Allen loses control! Ball rolls out of bounds! TURNOVER! (dead ball)

[08:40] Team_022 possession (Score: 47-47)
Michael Ginobili makes the Layup and draws the foul on Ja Oladipo! And-1! Michael Ginobili to the line for 1. [Team fouls: 1] (Ja Oladipo: 1 personal fouls)   FT 1/1: GOOD Michael Ginobili makes 1/1 from the line.
Score: 50-47

[08:26] Team_049 possession (Score: 50-47)
De'Aaron Allen attempts a Layup. BLOCKED BY DIRK MARKKANEN! Ball is loose! Rebound secured by Myles Anthony.

[08:10] Team_022 possession (Score: 50-47)
Michael Ginobili drives and kicks out. Michael Ginobili attempts a Midrange. Contested by Ja Oladipo (4.2 feet, MAN). MICHAEL GINOBILI MAKES IT!
Score: 52-47

[07:58] Team_049 possession (Score: 52-47)
Jimmy Griffin attempts a Layup. Contested by Myles Anthony (4.5 feet, MAN). Jimmy Griffin misses. Rebound secured by Myles Anthony.

[07:47] Team_022 possession (Score: 52-47)
Lamelo Dosunmu attempts a 3Pt. Contested by Ja Oladipo (4.7 feet, ZONE). LAMELO DOSUNMU MAKES IT! Assist: Dirk Markkanen
Score: 55-47

[07:34] Team_049 possession (Score: 55-47)
Shai Mobley drives, Dirk Markkanen stays with him. Shai Mobley attempts a Layup. Contested by Dirk Markkanen (4.9 feet, ZONE). SHAI MOBLEY MAKES IT!
Score: 55-49

[07:19] Team_022 possession (Score: 55-49)
Michael Ginobili attempts a 3Pt. Contested by Ja Oladipo (4.3 feet, ZONE). Michael Ginobili misses. Rebound secured by De'Aaron Allen.

[07:04] Team_049 possession (Score: 55-49)
Jimmy Griffin attempts a Midrange. Contested by Lamelo Dosunmu (4.7 feet, ZONE). Jimmy Griffin misses. Rebound secured by Michael Ginobili.

[06:48] Team_022 possession (Score: 55-49)
FOUL! Holding foul on Jimmy Griffin. [Team fouls: 2] No free throws, side out. (Jimmy Griffin: 1 personal fouls)

[06:36] Team_022 possession (Score: 55-49)
Dirk Markkanen attempts a Midrange. Contested by Shai Mobley (4.8 feet, ZONE). DIRK MARKKANEN MAKES IT!
Score: 57-49

[06:23] Team_049 possession (Score: 57-49)
Shai Bird attempts a Midrange. Contested by Michael Ginobili (4.0 feet, ZONE). SHAI BIRD MAKES IT! Assist: De'Aaron Allen
Score: 57-51

[06:08] Team_022 possession (Score: 57-51)
FOUL! Shooting foul on Jimmy Griffin. Malcolm Allen to the line for 2 free throws. [Team fouls: 3] (Jimmy Griffin: 2 personal fouls)   FT 1/2: GOOD   FT 2/2: MISS Malcolm Allen makes 1/2 from the line. Rebound secured by Jimmy Griffin.
Score: 58-51

[05:51] Team_049 possession (Score: 58-51)
Shai Bird attempts a 3Pt. Contested by Malcolm Allen (4.9 feet, MAN). Shai Bird misses. Rebound secured by Myles Anthony.

[05:39] Team_022 possession (Score: 58-51)
Michael Ginobili drives and kicks out. Myles Anthony attempts a 3Pt. Contested by Jimmy Griffin (4.7 feet, MAN). Myles Anthony misses. Rebound secured by Shai Mobley.

[05:29] Team_049 possession (Score: 58-51)
FOUL! Reach-in foul on Dirk Markkanen during the drive. [Team fouls: 2] No free throws, side out. (Dirk Markkanen: 1 personal fouls)

[05:11] Team_049 possession (Score: 58-51)
Shai Mobley attempts a 3Pt. Contested by Dirk Markkanen (4.9 feet, MAN). Shai Mobley misses. Rebound secured by Dirk Markkanen.

[04:56] Team_022 possession (Score: 58-51)
Lamelo Dosunmu drives to the basket... Lamelo Dosunmu loses the ball! Stripped by De'Aaron Allen! TURNOVER! (live ball)

[04:41] Team_049 possession (Score: 58-51)
Shai Bird attempts a 3Pt. Contested by Malcolm Allen (4.9 feet, MAN). Shai Bird misses. Rebound secured by Dirk Markkanen.

[04:28] Team_022 possession (Score: 58-51)
Myles Anthony attempts a 3Pt. Contested by Jimmy Griffin (4.9 feet, MAN). Myles Anthony misses. Rebound secured by Jimmy Griffin.

[04:14] Team_049 possession (Score: 58-51)
Jimmy Griffin attempts a Midrange. Contested by Myles Anthony (4.6 feet, MAN). Jimmy Griffin misses. Rebound secured by Michael Ginobili.

[03:57] Team_022 possession (Score: 58-51)
Myles Anthony drives to the basket... Myles Anthony throws a bad pass! Stolen by De'Aaron Allen! TURNOVER! (live ball)

[03:41] Team_049 possession (Score: 58-51)
Jimmy Griffin attempts a 3Pt. Contested by Myles Anthony (4.6 feet, MAN). JIMMY GRIFFIN MAKES IT! Assist: De'Aaron Allen
Score: 58-54

[03:29] Team_022 possession (Score: 58-54)
Malcolm Allen attempts a Midrange. Contested by Shai Bird (4.8 feet, MAN). MALCOLM ALLEN MAKES IT! Assist: Dirk Markkanen
Score: 60-54

[03:13] Team_049 possession (Score: 60-54)
Shai Bird makes the Layup and draws the foul on Dirk Markkanen! And-1! Shai Bird to the line for 1. [Team fouls: 3] (Dirk Markkanen: 2 personal fouls)   FT 1/1: GOOD Shai Bird makes 1/1 from the line.
Score: 60-57

[02:58] Team_022 possession (Score: 60-57)
FOUL! Reach-in foul on Shai Bird during the drive. [Team fouls: 4] No free throws, side out. (Shai Bird: 1 personal fouls)

[02:43] Team_022 possession (Score: 60-57)
FOUL! Shooting foul on De'Aaron Allen. Lamelo Dosunmu to the line for 2 free throws. [BONUS: 5 team fouls] (De'Aaron Allen: 1 personal fouls)   FT 1/2: MISS   FT 2/2: GOOD Lamelo Dosunmu makes 1/2 from the line.
Score: 61-57

[02:32] Team_049 possession (Score: 61-57)
FOUL! Offensive foul on Shai Bird! Malcolm Allen drew the charge! [Team fouls: 6] (Shai Bird: 2 personal fouls) TURNOVER! (dead ball)

[02:18] Team_022 possession (Score: 61-57)
Lamelo Dosunmu drives and kicks out. Lamelo Dosunmu attempts a 3Pt. Contested by Ja Oladipo (4.6 feet, ZONE). Lamelo Dosunmu misses. FOUL! Loose ball foul on De'Aaron Allen during the rebound battle. [IN THE BONUS! 7 team fouls] Dirk Markkanen to the line for 2 free throws. (De'Aaron Allen: 2 personal fouls)   FT 1/2: GOOD   FT 2/2: GOOD Dirk Markkanen makes 2/2 from the line.
Score: 63-57

[02:03] Team_049 possession (Score: 63-57)
Ja Oladipo attempts a 3Pt. Contested by Michael Ginobili (4.1 feet, ZONE). JA OLADIPO MAKES IT! Assist: De'Aaron Allen
Score: 63-60

[01:49] Team_022 possession (Score: 63-60)
Malcolm Allen attempts a 3Pt. Contested by Shai Bird (4.9 feet, ZONE). Malcolm Allen misses. Rebound secured by De'Aaron Allen.

[01:31] Team_049 possession (Score: 63-60)
Shai Mobley attempts a Midrange. Contested by Myles Anthony (5.1 feet, ZONE). Shai Mobley misses. Rebound secured by Dirk Markkanen.

[01:13] Team_022 possession (Score: 63-60)
Michael Ginobili attempts a 3Pt. Contested by Ja Oladipo (4.7 feet, MAN). Michael Ginobili misses. Rebound secured by Shai Mobley.

[01:02] Team_049 possession (Score: 63-60)
Shai Bird drives and kicks out. De'Aaron Allen attempts a 3Pt. Contested by Michael Ginobili (4.0 feet, ZONE). De'Aaron Allen misses. FOUL! Loose ball foul on Myles Anthony during the rebound battle. [Team fouls: 4] No free throws, side out. (Myles Anthony: 1 personal fouls)

[00:47] Team_049 possession (Score: 63-60)
De'Aaron Allen attempts a Midrange. Contested by Michael Ginobili (3.8 feet, ZONE). DE'AARON ALLEN MAKES IT! Assist: Shai Bird
Score: 63-62

[00:30] Team_022 possession (Score: 63-62)
Dirk Markkanen makes the Layup and draws the foul on De'Aaron Allen! And-1! Dirk Markkanen to the line for 1. [BONUS: 8 team fouls] (De'Aaron Allen: 3 personal fouls)   FT 1/1: GOOD Dirk Markkanen makes 1/1 from the line.
Score: 66-62

[00:18] Team_049 possession (Score: 66-62)
De'Aaron Allen makes the Midrange and draws the foul on Lamelo Dosunmu! And-1! De'Aaron Allen to the line for 1. [BONUS: 5 team fouls] (Lamelo Dosunmu: 1 personal fouls)   FT 1/1: GOOD De'Aaron Allen makes 1/1 from the line.
Score: 66-65

[00:08] Team_022 possession (Score: 66-65)
FOUL! Reach-in foul on Shai Mobley during the drive. [IN THE BONUS! 9 team fouls] Lamelo Dosunmu to the line for 2 free throws. (Shai Mobley: 1 personal fouls)   FT 1/2: GOOD   FT 2/2: MISS Lamelo Dosunmu makes 1/2 from the line. Offensive rebound by Michael Ginobili! Michael Ginobili kicks it out.
Score: 67-65

================================================================================
                              3RD QUARTER COMPLETE                              
================================================================================

3RD QUARTER SCORE: Team_022 22, Team_049 24

BOX SCORE:
================================================================================

Team_022
--------------------------------------------------------------------------------
Player                MIN  PTS  REB  AST  TO      FG   FG%      3P   3P%
--------------------------------------------------------------------------------
Dirk Markkanen         34    7    3    2   0   3/5    60.0     0/0   0.0
Michael Ginobili       36    5    4    0   0   2/5    40.0     0/0   0.0
Lamelo Dosunmu         34    4    0    0   0   2/3    66.7     0/0   0.0
Malcolm Allen          34    4    0    0   0   2/6    33.3     0/0   0.0
Myles Anthony          34    0    4    0   0   0/2     0.0     0/0   0.0

TEAM: FG: 9/21 (42.9%), 3PT: 1/7 (14.3%), REB: 11 (1 off, 10 def), AST: 2, TO: 2
TEAM FOULS: 5 [Team_049 in BONUS]


Team_049
--------------------------------------------------------------------------------
Player                MIN  PTS  REB  AST  TO      FG   FG%      3P   3P%
--------------------------------------------------------------------------------
Shai Bird              34    9    0    1   0   3/5    60.0     0/0   0.0
De'Aaron Allen         36    7    6    3   0   3/4    75.0     0/0   0.0
Jimmy Griffin          34    3    3    1   0   1/4    25.0     0/0   0.0
Ja Oladipo             36    3    0    0   0   1/1   100.0     0/0   0.0
Shai Mobley            36    2    4    0   0   1/5    20.0     0/0   0.0

TEAM: FG: 9/19 (47.4%), 3PT: 3/7 (42.9%), REB: 13 (1 off, 12 def), AST: 5, TO: 4
TEAM FOULS: 9 [Team_022 in BONUS]

================================================================================

================================================================================
                       4TH QUARTER - Team_022 vs Team_049                       
================================================================================

[12:00] Team_022 possession (Score: 67-65)
Myles Anthony attempts a Midrange. Contested by Jimmy Griffin (5.1 feet, ZONE). Myles Anthony misses. Rebound secured by Shai Mobley.

[11:49] Team_049 possession (Score: 67-65)
Shai Mobley attempts a Midrange. Contested by Michael Ginobili (4.2 feet, ZONE). SHAI MOBLEY MAKES IT!
Score: 67-67

[11:31] Team_022 possession (Score: 67-67)
Malcolm Allen drives, Shai Bird stays with him. Malcolm Allen attempts a Dunk. Contested by Shai Bird (5.0 feet, MAN). MALCOLM ALLEN MAKES IT!
Score: 69-67

[11:18] Team_049 possession (Score: 69-67)
De'Aaron Allen attempts a Layup. Contested by Lamelo Dosunmu (5.0 feet, MAN). DE'AARON ALLEN MAKES IT!
Score: 69-69

[11:00] Team_022 possession (Score: 69-69)
Lamelo Dosunmu attempts a 3Pt. Contested by De'Aaron Allen (5.0 feet, MAN). Lamelo Dosunmu misses. Rebound secured by De'Aaron Allen.

[10:41] Team_049 possession (Score: 69-69)
Shai Mobley attempts a Midrange. Contested by Michael Ginobili (4.3 feet, ZONE). Shai Mobley misses. Offensive rebound by Shai Mobley! Shai Mobley puts it back in!
Score: 69-71

[10:28] Team_022 possession (Score: 69-71)
Malcolm Allen attempts a Midrange. Contested by Shai Bird (5.1 feet, MAN). Malcolm Allen misses. Rebound secured by De'Aaron Allen.

[10:14] Team_049 possession (Score: 69-71)
FOUL! Holding foul on Myles Anthony. [Team fouls: 1] No free throws, side out. (Myles Anthony: 1 personal fouls)

[10:01] Team_049 possession (Score: 69-71)
FOUL! Shooting foul on Dirk Markkanen. De'Aaron Allen to the line for 2 free throws. [Team fouls: 2] (Dirk Markkanen: 1 personal fouls)   FT 1/2: GOOD   FT 2/2: GOOD De'Aaron Allen makes 2/2 from the line.
Score: 69-73

[09:46] Team_022 possession (Score: 69-73)
FOUL! Reach-in foul on Shai Bird during the drive. [Team fouls: 1] No free throws, side out. (Shai Bird: 1 personal fouls)

[09:31] Team_022 possession (Score: 69-73)
Myles Anthony attempts a 3Pt. Contested by Ja Oladipo (5.0 feet, ZONE). Myles Anthony misses. Rebound secured by Shai Mobley.

[09:15] Team_049 possession (Score: 69-73)
FOUL! Shooting foul on Michael Ginobili. De'Aaron Allen to the line for 2 free throws. [Team fouls: 3] (Michael Ginobili: 1 personal fouls)   FT 1/2: GOOD   FT 2/2: MISS De'Aaron Allen makes 1/2 from the line. Rebound secured by Michael Ginobili.
Score: 69-74

[09:00] Team_022 possession (Score: 69-74)
Lamelo Dosunmu drives, De'Aaron Allen stays with him. Lamelo Dosunmu attempts a Dunk. Contested by De'Aaron Allen (5.2 feet, MAN). Lamelo Dosunmu misses. Rebound secured by Jimmy Griffin.

[08:47] Team_049 possession (Score: 69-74)
FOUL! Reach-in foul on Dirk Markkanen during the drive. [Team fouls: 4] No free throws, side out. (Dirk Markkanen: 2 personal fouls)

[08:32] Team_049 possession (Score: 69-74)
Ja Oladipo attempts a Layup. Contested by Michael Ginobili (4.5 feet, MAN). JA OLADIPO MAKES IT! Assist: Shai Bird
Score: 69-76

[08:16] Team_022 possession (Score: 69-76)
Dirk Markkanen drives, Shai Mobley stays with him. Dirk Markkanen attempts a Dunk. Contested by Shai Mobley (5.4 feet, ZONE). Dirk Markkanen misses. Offensive rebound by Michael Ginobili! Michael Ginobili kicks it out.

[08:03] Team_022 possession (Score: 69-76)
Myles Anthony drives and kicks out. Lamelo Dosunmu attempts a Midrange. Contested by Jimmy Griffin (5.5 feet, ZONE). Lamelo Dosunmu misses. Rebound secured by Jimmy Griffin.

[07:53] Team_049 possession (Score: 69-76)
FOUL! Offensive foul on Shai Mobley! Dirk Markkanen drew the charge! [Team fouls: 2] (Shai Mobley: 1 personal fouls) TURNOVER! (dead ball)

[07:39] Team_022 possession (Score: 69-76)
Malcolm Allen attempts a Layup. Contested by De'Aaron Allen (5.6 feet, ZONE). Malcolm Allen misses. Offensive rebound by Dirk Markkanen! Dirk Markkanen kicks it out.

[07:27] Team_022 possession (Score: 69-76)
Lamelo Dosunmu attempts a Midrange. Contested by De'Aaron Allen (5.4 feet, MAN). Lamelo Dosunmu misses. Rebound secured by Jimmy Griffin.

[07:13] Team_049 possession (Score: 69-76)
De'Aaron Allen loses the ball! Stripped by Lamelo Dosunmu! TURNOVER! (live ball)

[06:58] Team_022 possession (Score: 69-76)
Malcolm Allen attempts a Layup. Contested by De'Aaron Allen (5.7 feet, ZONE). Malcolm Allen misses. Rebound secured by De'Aaron Allen.

[06:42] Team_049 possession (Score: 69-76)
Shai Mobley attempts a Midrange. Contested by Dirk Markkanen (5.9 feet, MAN). Shai Mobley misses. Offensive rebound by De'Aaron Allen! De'Aaron Allen kicks it out.

[06:26] Team_049 possession (Score: 69-76)
Jimmy Griffin attempts a 3Pt. Contested by Myles Anthony (5.5 feet, MAN). Jimmy Griffin misses. Rebound secured by Myles Anthony.

[06:13] Team_022 possession (Score: 69-76)
Myles Anthony loses control! Ball rolls out of bounds! TURNOVER! (dead ball)

[06:13] Substitution (Team_022): Malcolm Allen OUT → DeMar Harden IN (stamina_rule2)

[06:13] Substitution (Team_022): Michael Ginobili OUT → Lauri Gobert IN (stamina_rule2)

[06:13] Substitution (Team_022): Myles Anthony OUT → Dejounte Towns IN (stamina_rule2)

[06:13] Substitution (Team_022): Lamelo Dosunmu OUT → Kawhi Russell IN (stamina_rule2)

[06:13] Substitution (Team_022): Dirk Markkanen OUT → Cole Iverson IN (stamina_rule2)

[06:13] Substitution (Team_049): Shai Bird OUT → Shaquille Lillard IN (stamina_rule2)

[06:13] Substitution (Team_049): Ja Oladipo OUT → Shai Jordan IN (stamina_rule2)

[06:13] Substitution (Team_049): Jimmy Griffin OUT → Desmond Towns IN (stamina_rule2)

[06:13] Substitution (Team_049): De'Aaron Allen OUT → Giannis Anunoby IN (stamina_rule2)

[06:13] Substitution (Team_049): Shai Mobley OUT → Miles Jackson IN (stamina_rule2)

[05:56] Team_049 possession (Score: 69-76)
FOUL! Shooting foul on Lauri Gobert. Miles Jackson to the line for 2 free throws. [BONUS: 5 team fouls] (Lauri Gobert: 1 personal fouls)   FT 1/2: MISS   FT 2/2: GOOD Miles Jackson makes 1/2 from the line.
Score: 69-77

[05:40] Team_022 possession (Score: 69-77)
DeMar Harden attempts a Layup. BLOCKED BY SHAQUILLE LILLARD! Ball deflects out of bounds off DeMar Harden.

[05:26] Team_049 possession (Score: 69-77)
Miles Jackson attempts a 3Pt. Contested by Lauri Gobert (4.5 feet, ZONE). Miles Jackson misses. Rebound secured by Kawhi Russell.

[05:12] Team_022 possession (Score: 69-77)
Dejounte Towns attempts a 3Pt. Contested by Desmond Towns (4.6 feet, MAN). Dejounte Towns misses. Rebound secured by Miles Jackson.

[04:57] Team_049 possession (Score: 69-77)
FOUL! Holding foul on Kawhi Russell. [IN THE BONUS! 6 team fouls] Giannis Anunoby to the line for 2 free throws. (Kawhi Russell: 1 personal fouls)   FT 1/2: GOOD   FT 2/2: MISS Giannis Anunoby makes 1/2 from the line. Offensive rebound by Miles Jackson! Miles Jackson puts it back in!
Score: 69-80

[04:47] Team_022 possession (Score: 69-80)
DeMar Harden throws a bad pass! Stolen by Shaquille Lillard! TURNOVER! (live ball)

[04:34] Team_049 possession (Score: 69-80)
Desmond Towns attempts a 3Pt. Contested by Dejounte Towns (4.6 feet, MAN). DESMOND TOWNS MAKES IT!
Score: 69-83

[04:16] Team_022 possession (Score: 69-83)
DeMar Harden attempts a 3Pt. Contested by Shaquille Lillard (4.5 feet, MAN). DeMar Harden misses. Rebound secured by Miles Jackson.

[04:00] Team_049 possession (Score: 69-83)
Giannis Anunoby drives and kicks out. Miles Jackson attempts a 3Pt. Contested by Kawhi Russell (4.0 feet, ZONE). MILES JACKSON MAKES IT! Assist: Shai Jordan
Score: 69-86

[03:47] Team_022 possession (Score: 69-86)
Lauri Gobert attempts a 3Pt. Contested by Shaquille Lillard (4.5 feet, ZONE). Lauri Gobert misses. Rebound secured by Miles Jackson.

[03:27] Team_049 possession (Score: 69-86)
Shai Jordan attempts a 3Pt. Contested by Kawhi Russell (4.1 feet, ZONE). Shai Jordan misses. Rebound secured by Dejounte Towns.

[03:12] Team_022 possession (Score: 69-86)
Cole Iverson drives, picks up Miles Jackson. Help arrives from Shai Jordan! Cole Iverson attempts a Layup. Contested by Shai Jordan (3.5 feet, ZONE). COLE IVERSON MAKES IT! Assist: Kawhi Russell
Score: 71-86

[02:59] Team_049 possession (Score: 71-86)
FOUL! Reach-in foul on Kawhi Russell during the drive. [IN THE BONUS! 7 team fouls] Shaquille Lillard to the line for 2 free throws. (Kawhi Russell: 2 personal fouls)   FT 1/2: GOOD   FT 2/2: GOOD Shaquille Lillard makes 2/2 from the line.
Score: 71-88

[02:44] Team_022 possession (Score: 71-88)
Kawhi Russell commits a violation (traveling/carry)! TURNOVER! (dead ball)

[02:28] Team_049 possession (Score: 71-88)
Shaquille Lillard attempts a 3Pt. Contested by DeMar Harden (5.6 feet, MAN). Shaquille Lillard misses. Rebound secured by Lauri Gobert.

[02:18] Team_022 possession (Score: 71-88)
DeMar Harden attempts a 3Pt. Contested by Shaquille Lillard (4.5 feet, MAN). DEMAR HARDEN MAKES IT!
Score: 74-88

[02:05] Team_049 possession (Score: 74-88)
FOUL! Reach-in foul on Lauri Gobert during the drive. [IN THE BONUS! 8 team fouls] Shai Jordan to the line for 2 free throws. (Lauri Gobert: 2 personal fouls)   FT 1/2: GOOD   FT 2/2: GOOD Shai Jordan makes 2/2 from the line.
Score: 74-90

[01:53] Team_022 possession (Score: 74-90)
Dejounte Towns drives, picks up Miles Jackson. Help arrives from Shai Jordan! Dejounte Towns attempts a Layup. Contested by Shai Jordan (3.5 feet, ZONE). DEJOUNTE TOWNS MAKES IT! Assist: Kawhi Russell
Score: 76-90

[01:39] Team_049 possession (Score: 76-90)
Giannis Anunoby attempts a 3Pt. Contested by Kawhi Russell (4.0 feet, ZONE). Giannis Anunoby misses. Rebound secured by Dejounte Towns.

[01:28] Team_022 possession (Score: 76-90)
Kawhi Russell attempts a 3Pt. Contested by Shaquille Lillard (4.8 feet, ZONE). Kawhi Russell misses. Offensive rebound by Dejounte Towns! Dejounte Towns kicks it out.

[01:14] Team_022 possession (Score: 76-90)
Kawhi Russell drives, picks up Giannis Anunoby. Help arrives from Shai Jordan! Kawhi Russell attempts a Layup. Contested by Shai Jordan (4.9 feet, MAN). KAWHI RUSSELL MAKES IT! Assist: Lauri Gobert
Score: 78-90

[01:00] Team_049 possession (Score: 78-90)
Shaquille Lillard attempts a 3Pt. Contested by DeMar Harden (5.6 feet, MAN). SHAQUILLE LILLARD MAKES IT! Assist: Desmond Towns
Score: 78-93

[00:48] Team_022 possession (Score: 78-93)
DeMar Harden attempts a 3Pt. Contested by Giannis Anunoby (4.6 feet, ZONE). DeMar Harden misses. Rebound secured by Shai Jordan.

[00:36] Team_049 possession (Score: 78-93)
FOUL! Reach-in foul on Kawhi Russell during the drive. [IN THE BONUS! 9 team fouls] Miles Jackson to the line for 2 free throws. (Kawhi Russell: 3 personal fouls)   FT 1/2: GOOD   FT 2/2: GOOD Miles Jackson makes 2/2 from the line.
Score: 78-95

[00:20] Team_022 possession (Score: 78-95)
Kawhi Russell attempts a Layup. BLOCKED BY GIANNIS ANUNOBY! Ball is loose! Offensive rebound by Dejounte Towns! Dejounte Towns kicks it out.

[00:04] Team_022 possession (Score: 78-95)
Dejounte Towns attempts a Midrange. Contested by Desmond Towns (4.6 feet, MAN). Dejounte Towns misses. Offensive rebound by Dejounte Towns! Dejounte Towns kicks it out.

================================================================================
                              4TH QUARTER COMPLETE                              
================================================================================

4TH QUARTER SCORE: Team_022 11, Team_049 30

BOX SCORE:
================================================================================

Team_022
--------------------------------------------------------------------------------
Player                MIN  PTS  REB  AST  TO      FG   FG%      3P   3P%
--------------------------------------------------------------------------------
DeMar Harden            8    3    0    0   0   1/4    25.0     0/0   0.0
Malcolm Allen          40    2    0    0   0   1/3    33.3     0/0   0.0
Kawhi Russell           8    2    1    2   0   1/1   100.0     0/0   0.0
Dejounte Towns          8    2    5    0   0   1/2    50.0     0/0   0.0
Cole Iverson            8    2    0    0   0   1/1   100.0     0/0   0.0
Myles Anthony          40    0    1    0   0   0/3     0.0     0/0   0.0
Lamelo Dosunmu         40    0    0    0   0   0/3     0.0     0/0   0.0
Michael Ginobili       42    0    2    0   0   0/0     0.0     0/0   0.0
Dirk Markkanen         40    0    1    0   0   0/0     0.0     0/0   0.0
Lauri Gobert            6    0    1    1   0   0/1     0.0     0/0   0.0

TEAM: FG: 5/18 (27.8%), 3PT: 1/7 (14.3%), REB: 11 (5 off, 6 def), AST: 3, TO: 3
TEAM FOULS: 9 [Team_049 in BONUS]


Team_049
--------------------------------------------------------------------------------
Player                MIN  PTS  REB  AST  TO      FG   FG%      3P   3P%
--------------------------------------------------------------------------------
Miles Jackson           6    9    3    0   0   4/5    80.0     0/0   0.0
Shaquille Lillard       8    5    0    0   0   2/3    66.7     0/0   0.0
Shai Mobley            42    4    3    0   0   2/2   100.0     0/0   0.0
De'Aaron Allen         42    4    4    0   0   2/3    66.7     0/0   0.0
Desmond Towns           8    3    0    1   0   1/1   100.0     0/0   0.0
Ja Oladipo             42    2    0    0   0   1/1   100.0     0/0   0.0
Shai Jordan             6    2    1    1   0   1/2    50.0     0/0   0.0
Jimmy Griffin          40    0    3    0   0   0/1     0.0     0/0   0.0
Shai Bird              40    0    0    1   0   0/0     0.0     0/0   0.0
Giannis Anunoby         6    0    0    0   0   0/1     0.0     0/0   0.0

TEAM: FG: 13/19 (68.4%), 3PT: 2/7 (28.6%), REB: 14 (2 off, 12 def), AST: 3, TO: 2
TEAM FOULS: 2

================================================================================

================================================================================
                               FULL GAME COMPLETE                               
================================================================================

FINAL SCORE: Team_022 78, Team_049 95

SCORING BY QUARTER:
--------------------------------------------------------------------------------
Team                     Q1     Q2     Q3     Q4    FINAL
--------------------------------------------------------------------------------
Team_022                 22     23     22     11       78
Team_049                 26     15     24     30       95
--------------------------------------------------------------------------------

FULL GAME BOX SCORE:
================================================================================

Team_022
--------------------------------------------------------------------------------
Player                MIN  PTS  REB  AST  TO      FG   FG%      3P   3P%      FT STL BLK
--------------------------------------------------------------------------------
Michael Ginobili       42    9   18    3   3   4/12   33.3   0/5     0.0   1/1     0   1
Malcolm Allen          40   14    0    3   1   7/17   41.2   2/6    33.3   2/3     0   0
Myles Anthony          40   14   10    0   3   5/13   38.5   1/3    33.3   2/2     1   0
Lamelo Dosunmu         40   11    0    2   1   6/11   54.5   1/2    50.0   5/7     3   0
Dirk Markkanen         40   17   16    4   0   7/13   53.8   0/0     0.0   5/5     1   1
DeMar Harden            8    5    0    0   1   2/5    40.0   1/3    33.3   0/0     0   0
Dejounte Towns          8    2    6    0   0   1/2    50.0   0/1     0.0   0/0     0   0
Kawhi Russell           8    2    1    2   1   1/2    50.0   0/0     0.0   0/0     0   0
Cole Iverson            8    2    0    1   0   1/3    33.3   0/1     0.0   0/0     0   0
Lauri Gobert            6    0    1    1   0   0/1     0.0   0/1     0.0   0/0     0   0

TEAM: FG: 34/79 (43.0%), 3PT: 5/22 (22.7%), REB: 52 (11 off, 41 def), AST: 16, TO: 10


Team_049
--------------------------------------------------------------------------------
Player                MIN  PTS  REB  AST  TO      FG   FG%      3P   3P%      FT STL BLK
--------------------------------------------------------------------------------
Ja Oladipo             42   16    0    2   1   6/10   60.0   3/7    42.9   1/1     0   0
De'Aaron Allen         42   16   17    5   2   7/13   53.8   0/1     0.0   8/10    2   2
Shai Mobley            42   18   17    0   2   9/19   47.4   0/2     0.0   2/4     0   0
Shai Bird              40   13    0    3   1   5/11   45.5   1/6    16.7   6/6     0   0
Jimmy Griffin          40    7   11    1   2   3/13   23.1   1/6    16.7   2/3     0   0
Shaquille Lillard       8    5    0    0   0   2/3    66.7   1/2    50.0   2/2     1   1
Desmond Towns           8    5    0    2   0   2/2   100.0   1/1   100.0   0/0     0   0
Shai Jordan             6    2    1    1   0   1/2    50.0   0/1     0.0   2/2     0   0
Giannis Anunoby         6    0    0    0   0   1/2    50.0   0/1     0.0   1/2     0   1
Miles Jackson           6    9    4    0   0   2/3    66.7   0/1     0.0   3/4     0   0

TEAM: FG: 40/81 (49.4%), 3PT: 7/28 (25.0%), REB: 49 (6 off, 43 def), AST: 14, TO: 8

================================================================================
