================================================================================
                        FULL GAME - Team_024 vs Team_017                        
================================================================================

================================================================================
                       1ST QUARTER - Team_024 vs Team_017                       
================================================================================

[12:00] Team_024 possession (Score: 0-0)
Anfernee Williamson drives, picks up Kyrie Middleton. Help arrives from Vince Banchero! Anfernee Williamson attempts a Dunk. Contested by Vince Banchero (4.9 feet, MAN). ANFERNEE WILLIAMSON MAKES IT! Assist: Draymond Towns
Score: 2-0

[11:47] Team_017 possession (Score: 2-0)
Vince Banchero attempts a Layup. Contested by Zach Fox (3.5 feet, MAN). VINCE BANCHERO MAKES IT! Assist: Desmond Reaves
Score: 2-2

[11:28] Team_024 possession (Score: 2-2)
FOUL! Holding foul on Tony Smith. [Team fouls: 1] No free throws, side out. (Tony Smith: 1 personal fouls)

[11:17] Team_024 possession (Score: 2-2)
Zach Fox drives, Vince Banchero stays with him. Zach Fox attempts a Layup. Contested by Vince Banchero (4.4 feet, MAN). Zach Fox misses. Offensive rebound by Draymond Towns! Draymond Towns's putback is no good. Rebound secured by Bam Williamson.

[11:06] Team_017 possession (Score: 2-2)
Vince Banchero drives and kicks out. Kyrie Middleton attempts a 3Pt. Contested by Anfernee Williamson (3.6 feet, ZONE). KYRIE MIDDLETON MAKES IT! Assist: Bam Williamson
Score: 2-5

[10:47] Team_024 possession (Score: 2-5)
Bradley Allen drives, Kyrie Middleton stays with him. Bradley Allen attempts a Dunk. Contested by Kyrie Middleton (5.0 feet, ZONE). BRADLEY ALLEN MAKES IT!
Score: 4-5

[10:32] Team_017 possession (Score: 4-5)
Tony Smith makes the Layup and draws the foul on Bradley Allen! And-1! Tony Smith to the line for 1. [Team fouls: 1] (Bradley Allen: 1 personal fouls)   FT 1/1: GOOD Tony Smith makes 1/1 from the line.
Score: 4-8

[10:20] Team_024 possession (Score: 4-8)
Ja Reaves drives to the basket... Ja Reaves loses the ball! Stripped by Bam Williamson! TURNOVER! (live ball)

[10:03] Team_017 possession (Score: 4-8)
Tony Smith attempts a Midrange. Contested by Bradley Allen (4.4 feet, MAN). Tony Smith misses. Rebound secured by Zach Fox.

[09:48] Team_024 possession (Score: 4-8)
Zach Fox attempts a Midrange. Contested by Vince Banchero (4.4 feet, ZONE). Zach Fox misses. FOUL! Loose ball foul on Kyrie Middleton during the rebound battle. [Team fouls: 2] No free throws, side out. (Kyrie Middleton: 1 personal fouls)

[09:35] Team_024 possession (Score: 4-8)
Ja Reaves attempts a 3Pt. Contested by Desmond Reaves (4.2 feet, ZONE). Ja Reaves misses. Rebound secured by Bam Williamson.

[09:22] Team_017 possession (Score: 4-8)
Bam Williamson drives, Anfernee Williamson stays with him. Bam Williamson attempts a Layup. Contested by Anfernee Williamson (4.4 feet, ZONE). BAM WILLIAMSON MAKES IT! Assist: Desmond Reaves
Score: 4-10

[09:08] Team_024 possession (Score: 4-10)
Anfernee Williamson attempts a Midrange. Contested by Kyrie Middleton (4.9 feet, MAN). Anfernee Williamson misses. FOUL! Loose ball foul on Tony Smith during the rebound battle. [Team fouls: 3] No free throws, side out. (Tony Smith: 2 personal fouls)

[08:52] Team_024 possession (Score: 4-10)
Bradley Allen attempts a 3Pt. Contested by Tony Smith (2.8 feet, MAN). Bradley Allen misses. Offensive rebound by Zach Fox! Zach Fox kicks it out.

[08:35] Team_024 possession (Score: 4-10)
Draymond Towns throws a bad pass! Stolen by Bam Williamson! TURNOVER! (live ball)

[08:20] Team_017 possession (Score: 4-10)
Tony Smith drives and kicks out. Bam Williamson attempts a Midrange. Contested by Anfernee Williamson (3.6 feet, MAN). BAM WILLIAMSON MAKES IT!
Score: 4-12

[08:09] Team_024 possession (Score: 4-12)
Draymond Towns attempts a Midrange. Contested by Kyrie Middleton (4.6 feet, ZONE). DRAYMOND TOWNS MAKES IT!
Score: 6-12

[07:51] Team_017 possession (Score: 6-12)
Tony Smith attempts a 3Pt. Contested by Zach Fox (4.1 feet, ZONE). Tony Smith misses. Rebound secured by Draymond Towns.

[07:40] Team_024 possession (Score: 6-12)
Draymond Towns attempts a Layup. Contested by Bam Williamson (3.6 feet, ZONE). DRAYMOND TOWNS MAKES IT! Assist: Ja Reaves
Score: 8-12

[07:29] Team_017 possession (Score: 8-12)
Kyrie Middleton makes the Dunk and draws the foul on Zach Fox! And-1! Kyrie Middleton to the line for 1. [Team fouls: 2] (Zach Fox: 1 personal fouls)   FT 1/1: GOOD Kyrie Middleton makes 1/1 from the line.
Score: 8-15

[07:18] Team_024 possession (Score: 8-15)
Ja Reaves attempts a Layup. BLOCKED BY KYRIE MIDDLETON! Ball is loose! Rebound secured by Tony Smith.

[07:01] Team_017 possession (Score: 8-15)
Vince Banchero attempts a 3Pt. Contested by Bradley Allen (3.8 feet, ZONE). Vince Banchero misses. Rebound secured by Zach Fox.

[06:49] Team_024 possession (Score: 8-15)
Bradley Allen attempts a 3Pt. Contested by Desmond Reaves (4.0 feet, ZONE). BRADLEY ALLEN MAKES IT! Assist: Anfernee Williamson
Score: 11-15

[06:34] Team_017 possession (Score: 11-15)
Bam Williamson makes the Dunk and draws the foul on Zach Fox! And-1! Bam Williamson to the line for 1. [Team fouls: 3] (Zach Fox: 2 personal fouls)   FT 1/1: MISS Bam Williamson makes 0/1 from the line. Rebound secured by Draymond Towns.
Score: 11-17

[06:16] Team_024 possession (Score: 11-17)
Anfernee Williamson attempts a Midrange. Contested by Kyrie Middleton (4.9 feet, MAN). ANFERNEE WILLIAMSON MAKES IT! Assist: Bradley Allen
Score: 13-17

[06:02] Team_017 possession (Score: 13-17)
Tony Smith attempts a Layup. Contested by Bradley Allen (4.4 feet, MAN). Tony Smith misses. Rebound secured by Draymond Towns.

[05:51] Team_024 possession (Score: 13-17)
FOUL! Reach-in foul on Vince Banchero during the drive. [Team fouls: 4] No free throws, side out. (Vince Banchero: 1 personal fouls)

[05:37] Team_024 possession (Score: 13-17)
FOUL! Holding foul on Bam Williamson. [IN THE BONUS! 5 team fouls] Draymond Towns to the line for 2 free throws. (Bam Williamson: 1 personal fouls)   FT 1/2: MISS   FT 2/2: GOOD Draymond Towns makes 1/2 from the line.
Score: 14-17

[05:24] Team_017 possession (Score: 14-17)
Vince Banchero attempts a Midrange. Contested by Zach Fox (3.5 feet, MAN). Vince Banchero misses. Rebound secured by Zach Fox.

[05:09] Team_024 possession (Score: 14-17)
Bradley Allen attempts a 3Pt. Contested by Tony Smith (2.8 feet, ZONE). Bradley Allen misses. Rebound secured by Tony Smith.

[04:54] Team_017 possession (Score: 14-17)
Tony Smith drives, Bradley Allen stays with him. Tony Smith attempts a Dunk. Contested by Bradley Allen (4.4 feet, MAN). TONY SMITH MAKES IT! Assist: Bam Williamson
Score: 14-19

[04:38] Team_024 possession (Score: 14-19)
Anfernee Williamson attempts a Layup. BLOCKED BY BAM WILLIAMSON! Ball is loose! Rebound secured by Kyrie Middleton.

[04:24] Team_017 possession (Score: 14-19)
Desmond Reaves makes the 3Pt and draws the foul on Zach Fox! And-1! Desmond Reaves to the line for 1. [Team fouls: 4] (Zach Fox: 3 personal fouls)   FT 1/1: GOOD Desmond Reaves makes 1/1 from the line.
Score: 14-23

[04:13] Team_024 possession (Score: 14-23)
Draymond Towns drives and kicks out. Bradley Allen attempts a Midrange. Contested by Tony Smith (2.8 feet, ZONE). Bradley Allen misses. Rebound secured by Kyrie Middleton.

[03:59] Team_017 possession (Score: 14-23)
Bam Williamson makes the Dunk and draws the foul on Zach Fox! And-1! Bam Williamson to the line for 1. [BONUS: 5 team fouls] (Zach Fox: 4 personal fouls)   FT 1/1: GOOD Bam Williamson makes 1/1 from the line.
Score: 14-26

[03:48] Team_024 possession (Score: 14-26)
Bradley Allen drives, Kyrie Middleton stays with him. Bradley Allen attempts a Dunk. Contested by Kyrie Middleton (5.1 feet, ZONE). Bradley Allen misses. Rebound secured by Bam Williamson.

[03:37] Team_017 possession (Score: 14-26)
Vince Banchero attempts a 3Pt. Contested by Zach Fox (3.6 feet, ZONE). Vince Banchero misses. Rebound secured by Draymond Towns.

[03:23] Team_024 possession (Score: 14-26)
Draymond Towns attempts a Midrange. Contested by Bam Williamson (3.8 feet, MAN). Draymond Towns misses. Rebound secured by Kyrie Middleton.

[03:08] Team_017 possession (Score: 14-26)
Tony Smith attempts a 3Pt. Contested by Zach Fox (4.2 feet, ZONE). Tony Smith misses. Offensive rebound by Bam Williamson! Bam Williamson puts it back in!
Score: 14-28

[02:56] Team_024 possession (Score: 14-28)
Draymond Towns attempts a Layup. BLOCKED BY BAM WILLIAMSON! Ball is loose! Offensive rebound by Draymond Towns! Draymond Towns kicks it out.

[02:43] Team_024 possession (Score: 14-28)
Bradley Allen attempts a 3Pt. Contested by Tony Smith (3.0 feet, ZONE). Bradley Allen misses. Rebound secured by Bam Williamson.

[02:34] Team_017 possession (Score: 14-28)
Desmond Reaves attempts a 3Pt. Contested by Zach Fox (4.2 feet, ZONE). Desmond Reaves misses. Rebound secured by Zach Fox.

[02:23] Team_024 possession (Score: 14-28)
Bradley Allen attempts a Midrange. Contested by Vince Banchero (4.3 feet, ZONE). BRADLEY ALLEN MAKES IT! Assist: Anfernee Williamson
Score: 16-28

[02:11] Team_017 possession (Score: 16-28)
Tony Smith throws a bad pass out of bounds! TURNOVER! (dead ball)

[02:11] Substitution (Team_024): Ja Reaves OUT → Victor Simons IN (stamina_rule2)

[02:11] Substitution (Team_024): Zach Fox OUT → Vince Irving IN (stamina_rule2)

[02:11] Substitution (Team_024): Bradley Allen OUT → Zach Durant IN (stamina_rule2)

[02:11] Substitution (Team_024): Anfernee Williamson OUT → Julius Harris IN (stamina_rule2)

[02:11] Substitution (Team_024): Draymond Towns OUT → Terry Rozier IN (stamina_rule2)

[02:11] Substitution (Team_017): Desmond Reaves OUT → Blake Reaves IN (stamina_rule2)

[02:11] Substitution (Team_017): Vince Banchero OUT → Tobias Bridges IN (stamina_rule2)

[02:11] Substitution (Team_017): Tony Smith OUT → Shaquille Stewart IN (stamina_rule2)

[02:11] Substitution (Team_017): Kyrie Middleton OUT → Ja Stewart IN (stamina_rule2)

[02:11] Substitution (Team_017): Bam Williamson OUT → Klay Holiday IN (stamina_rule2)

[01:55] Team_024 possession (Score: 16-28)
Terry Rozier drives, Ja Stewart stays with him. Terry Rozier attempts a Dunk. Contested by Ja Stewart (5.1 feet, ZONE). TERRY ROZIER MAKES IT!
Score: 18-28

[01:42] Team_017 possession (Score: 18-28)
Ja Stewart drives and kicks out. Tobias Bridges attempts a 3Pt. Contested by Vince Irving (4.9 feet, MAN). TOBIAS BRIDGES MAKES IT!
Score: 18-31

[01:29] Team_024 possession (Score: 18-31)
Victor Simons attempts a 3Pt. Contested by Blake Reaves (5.3 feet, MAN). Victor Simons misses. Rebound secured by Shaquille Stewart.

[01:11] Team_017 possession (Score: 18-31)
Shaquille Stewart attempts a Midrange. Contested by Zach Durant (3.6 feet, MAN). Shaquille Stewart misses. Rebound secured by Zach Durant.

[00:57] Team_024 possession (Score: 18-31)
Terry Rozier attempts a 3Pt. Contested by Tobias Bridges (4.4 feet, ZONE). Terry Rozier misses. Offensive rebound by Terry Rozier! Terry Rozier puts it back in!
Score: 20-31

[00:41] Team_017 possession (Score: 20-31)
FOUL! Reach-in foul on Terry Rozier during the drive. [IN THE BONUS! 6 team fouls] Klay Holiday to the line for 2 free throws. (Terry Rozier: 1 personal fouls)   FT 1/2: GOOD   FT 2/2: MISS Klay Holiday makes 1/2 from the line. Rebound secured by Terry Rozier.
Score: 20-32

[00:26] Team_024 possession (Score: 20-32)
Victor Simons attempts a 3Pt. Contested by Tobias Bridges (4.1 feet, ZONE). Victor Simons misses. Rebound secured by Ja Stewart.

[00:09] Team_017 possession (Score: 20-32)
Ja Stewart attempts a 3Pt. Contested by Julius Harris (4.6 feet, MAN). Ja Stewart misses. Rebound secured by Zach Durant.

================================================================================
                              1ST QUARTER COMPLETE                              
================================================================================

1ST QUARTER SCORE: Team_024 20, Team_017 32

BOX SCORE:
================================================================================

Team_024
--------------------------------------------------------------------------------
Player                MIN  PTS  REB  AST  TO      FG   FG%      3P   3P%
--------------------------------------------------------------------------------
Bradley Allen          10    7    0    1   0   3/6    50.0     0/0   0.0
Draymond Towns         10    5    6    1   0   3/5    60.0     0/0   0.0
Anfernee Williamson    10    4    0    2   0   2/3    66.7     0/0   0.0
Terry Rozier            2    4    2    0   0   2/2   100.0     0/0   0.0
Zach Fox               10    0    6    0   0   0/1     0.0     0/0   0.0
Ja Reaves              10    0    0    1   0   0/2     0.0     0/0   0.0
Victor Simons           2    0    0    0   0   0/2     0.0     0/0   0.0
Zach Durant             2    0    2    0   0   0/0     0.0     0/0   0.0

TEAM: FG: 10/21 (47.6%), 3PT: 2/7 (28.6%), REB: 17 (6 off, 11 def), AST: 5, TO: 2
TEAM FOULS: 6 [Team_017 in BONUS]


Team_017
--------------------------------------------------------------------------------
Player                MIN  PTS  REB  AST  TO      FG   FG%      3P   3P%
--------------------------------------------------------------------------------
Bam Williamson         10    9    5    2   0   4/5    80.0     0/0   0.0
Kyrie Middleton        10    6    3    0   0   2/2   100.0     0/0   0.0
Tony Smith             10    5    2    0   0   2/5    40.0     0/0   0.0
Desmond Reaves         10    4    0    2   0   1/2    50.0     0/0   0.0
Tobias Bridges          2    3    0    0   0   1/1   100.0     0/0   0.0
Vince Banchero         10    2    0    0   0   1/4    25.0     0/0   0.0
Shaquille Stewart       2    0    1    0   0   0/1     0.0     0/0   0.0
Klay Holiday            2    0    0    0   0   0/1     0.0     0/0   0.0
Ja Stewart              2    0    1    0   0   0/1     0.0     0/0   0.0

TEAM: FG: 11/22 (50.0%), 3PT: 2/7 (28.6%), REB: 11 (1 off, 10 def), AST: 4, TO: 1
TEAM FOULS: 5 [Team_024 in BONUS]

================================================================================

================================================================================
                       2ND QUARTER - Team_024 vs Team_017                       
================================================================================

[12:00] Team_024 possession (Score: 20-32)
Draymond Towns makes the Layup and draws the foul on Bam Williamson! And-1! Draymond Towns to the line for 1. [Team fouls: 1] (Bam Williamson: 1 personal fouls)   FT 1/1: GOOD Draymond Towns makes 1/1 from the line.
Score: 23-32

[11:45] Team_017 possession (Score: 23-32)
Bam Williamson attempts a Layup. Contested by Anfernee Williamson (4.4 feet, MAN). BAM WILLIAMSON MAKES IT!
Score: 23-34

[11:28] Team_024 possession (Score: 23-34)
FOUL! Reach-in foul on Bam Williamson during the drive. [Team fouls: 2] No free throws, side out. (Bam Williamson: 2 personal fouls)

[11:11] Team_024 possession (Score: 23-34)
Bradley Allen makes the Layup and draws the foul on Bam Williamson! And-1! Bradley Allen to the line for 1. [Team fouls: 3] (Bam Williamson: 3 personal fouls)   FT 1/1: GOOD Bradley Allen makes 1/1 from the line.
Score: 26-34

[10:54] Team_017 possession (Score: 26-34)
Vince Banchero drives to the basket... Vince Banchero loses the ball! Stripped by Zach Fox! TURNOVER! (live ball)

[10:44] Team_024 possession (Score: 26-34)
Zach Fox attempts a 3Pt. Contested by Vince Banchero (4.5 feet, ZONE). Zach Fox misses. Rebound secured by Kyrie Middleton.

[10:30] Team_017 possession (Score: 26-34)
Tony Smith attempts a 3Pt. Contested by Bradley Allen (4.6 feet, MAN). Tony Smith misses. Rebound secured by Anfernee Williamson.

[10:12] Team_024 possession (Score: 26-34)
FOUL! Holding foul on Kyrie Middleton. [Team fouls: 4] No free throws, side out. (Kyrie Middleton: 1 personal fouls)

[09:59] Team_024 possession (Score: 26-34)
Zach Fox drives, Vince Banchero stays with him. Zach Fox attempts a Dunk. Contested by Vince Banchero (4.6 feet, MAN). Zach Fox misses. Rebound secured by Bam Williamson.

[09:43] Team_017 possession (Score: 26-34)
Vince Banchero drives and kicks out. Tony Smith attempts a 3Pt. Contested by Zach Fox (3.7 feet, ZONE). Tony Smith misses. Rebound secured by Anfernee Williamson.

[09:25] Team_024 possession (Score: 26-34)
Anfernee Williamson attempts a Midrange. Contested by Kyrie Middleton (5.1 feet, ZONE). ANFERNEE WILLIAMSON MAKES IT! Assist: Draymond Towns
Score: 28-34

[09:09] Team_017 possession (Score: 28-34)
Desmond Reaves drives, Anfernee Williamson stays with him. Desmond Reaves attempts a Layup. Contested by Anfernee Williamson (4.4 feet, ZONE). Desmond Reaves misses. Rebound secured by Draymond Towns.

[08:58] Team_024 possession (Score: 28-34)
Draymond Towns drives and kicks out. Zach Fox makes the 3Pt and draws the foul on Vince Banchero! And-1! Zach Fox to the line for 1. [BONUS: 5 team fouls] (Vince Banchero: 1 personal fouls)   FT 1/1: MISS Zach Fox makes 0/1 from the line. Offensive rebound by Draymond Towns! Draymond Towns puts it back in!
Score: 33-34

[08:46] Team_017 possession (Score: 33-34)
Desmond Reaves attempts a 3Pt. Contested by Zach Fox (4.2 feet, ZONE). Desmond Reaves misses. Rebound secured by Draymond Towns.

[08:30] Team_024 possession (Score: 33-34)
Zach Fox attempts a 3Pt. Contested by Tony Smith (3.5 feet, ZONE). ZACH FOX MAKES IT! Assist: Anfernee Williamson
Score: 36-34

[08:19] Team_017 possession (Score: 36-34)
Bam Williamson attempts a 3Pt. Contested by Zach Fox (4.5 feet, ZONE). Bam Williamson misses. Rebound secured by Anfernee Williamson.

[08:03] Team_024 possession (Score: 36-34)
Anfernee Williamson drives, Kyrie Middleton stays with him. Anfernee Williamson attempts a Dunk. Contested by Kyrie Middleton (5.2 feet, MAN). Anfernee Williamson misses. FOUL! Loose ball foul on Kyrie Middleton during the rebound battle. [IN THE BONUS! 6 team fouls] Draymond Towns to the line for 2 free throws. (Kyrie Middleton: 2 personal fouls)   FT 1/2: GOOD   FT 2/2: GOOD Draymond Towns makes 2/2 from the line.
Score: 38-34

[07:50] Team_017 possession (Score: 38-34)
Bam Williamson drives and kicks out. Bam Williamson attempts a Midrange. Contested by Draymond Towns (4.4 feet, MAN). BAM WILLIAMSON MAKES IT! Assist: Kyrie Middleton
Score: 38-36

[07:38] Team_024 possession (Score: 38-36)
FOUL! Shooting foul on Kyrie Middleton. Anfernee Williamson to the line for 2 free throws. [BONUS: 7 team fouls] (Kyrie Middleton: 3 personal fouls)   FT 1/2: GOOD   FT 2/2: GOOD Anfernee Williamson makes 2/2 from the line.
Score: 40-36

[07:22] Team_017 possession (Score: 40-36)
Bam Williamson attempts a Layup. Contested by Draymond Towns (5.0 feet, MAN). BAM WILLIAMSON MAKES IT!
Score: 40-38

[07:10] Team_024 possession (Score: 40-38)
Ja Reaves attempts a 3Pt. Contested by Desmond Reaves (4.7 feet, MAN). Ja Reaves misses. Offensive rebound by Draymond Towns! Draymond Towns's putback is no good. Rebound secured by Kyrie Middleton.

[06:54] Team_017 possession (Score: 40-38)
FOUL! Shooting foul on Ja Reaves. Desmond Reaves to the line for 2 free throws. [Team fouls: 1] (Ja Reaves: 1 personal fouls)   FT 1/2: GOOD   FT 2/2: GOOD Desmond Reaves makes 2/2 from the line.
Score: 40-40

[06:39] Team_024 possession (Score: 40-40)
Draymond Towns drives to the basket... FOUL! Offensive foul on Draymond Towns! Bam Williamson drew the charge! [Team fouls: 2] (Draymond Towns: 1 personal fouls) TURNOVER! (dead ball)

[06:25] Team_017 possession (Score: 40-40)
Kyrie Middleton drives, Anfernee Williamson stays with him. Kyrie Middleton attempts a Dunk. Contested by Anfernee Williamson (4.7 feet, ZONE). KYRIE MIDDLETON MAKES IT!
Score: 40-42

[06:09] Team_024 possession (Score: 40-42)
Ja Reaves attempts a 3Pt. Contested by Tony Smith (3.6 feet, ZONE). JA REAVES MAKES IT! Assist: Draymond Towns
Score: 43-42

[05:52] Team_017 possession (Score: 43-42)
Kyrie Middleton drives, Anfernee Williamson stays with him. Kyrie Middleton attempts a Dunk. Contested by Anfernee Williamson (4.7 feet, MAN). KYRIE MIDDLETON MAKES IT! Assist: Vince Banchero
Score: 43-44

[05:36] Team_024 possession (Score: 43-44)
Draymond Towns attempts a Midrange. Contested by Vince Banchero (4.3 feet, ZONE). Draymond Towns misses. Offensive rebound by Zach Fox! Zach Fox kicks it out.

[05:18] Team_024 possession (Score: 43-44)
Ja Reaves attempts a Layup. Contested by Bam Williamson (5.0 feet, ZONE). Ja Reaves misses. Rebound secured by Bam Williamson.

[04:59] Team_017 possession (Score: 43-44)
Tony Smith drives and kicks out. Vince Banchero attempts a Midrange. Contested by Bradley Allen (4.7 feet, ZONE). VINCE BANCHERO MAKES IT!
Score: 43-46

[04:45] Team_024 possession (Score: 43-46)
Zach Fox attempts a Midrange. Wide open! Kyrie Middleton is 6.0 feet away. [ZONE] ZACH FOX MAKES IT!
Score: 45-46

[04:27] Team_017 possession (Score: 45-46)
Tony Smith drives, picks up Anfernee Williamson. Help arrives from Zach Fox! Tony Smith attempts a Layup. Contested by Zach Fox (5.1 feet, ZONE). Tony Smith misses. Rebound secured by Draymond Towns.

[04:12] Team_024 possession (Score: 45-46)
Ja Reaves attempts a Midrange. Contested by Vince Banchero (5.0 feet, ZONE). Ja Reaves misses. Offensive rebound by Draymond Towns! Draymond Towns's putback is no good. Rebound secured by Kyrie Middleton.

[03:58] Team_017 possession (Score: 45-46)
Tony Smith attempts a 3Pt. Contested by Bradley Allen (5.3 feet, MAN). Tony Smith misses. Rebound secured by Anfernee Williamson.

[03:45] Team_024 possession (Score: 45-46)
Bradley Allen attempts a Midrange. Contested by Tony Smith (3.8 feet, MAN). Bradley Allen misses. Rebound secured by Tony Smith.

[03:32] Team_017 possession (Score: 45-46)
Desmond Reaves attempts a 3Pt. Contested by Zach Fox (4.8 feet, ZONE). DESMOND REAVES MAKES IT! Assist: Kyrie Middleton
Score: 45-49

[03:15] Team_024 possession (Score: 45-49)
Zach Fox attempts a 3Pt. Contested by Tony Smith (4.2 feet, ZONE). Zach Fox misses. Rebound secured by Tony Smith.

[03:05] Team_017 possession (Score: 45-49)
Bam Williamson attempts a Midrange. Contested by Draymond Towns (5.5 feet, MAN). Bam Williamson misses. Rebound secured by Zach Fox.

[02:50] Team_024 possession (Score: 45-49)
Draymond Towns attempts a Midrange. Contested by Kyrie Middleton (5.5 feet, ZONE). Draymond Towns misses. Rebound secured by Kyrie Middleton.

[02:37] Team_017 possession (Score: 45-49)
Tony Smith attempts a 3Pt. Contested by Zach Fox (5.1 feet, ZONE). Tony Smith misses. Rebound secured by Zach Fox.

[02:19] Team_024 possession (Score: 45-49)
Draymond Towns attempts a 3Pt. Contested by Tony Smith (3.7 feet, ZONE). Draymond Towns misses. Offensive rebound by Draymond Towns! Draymond Towns kicks it out.

[02:01] Team_024 possession (Score: 45-49)
Zach Fox attempts a 3Pt. Contested by Tony Smith (4.4 feet, ZONE). Zach Fox misses. Rebound secured by Bam Williamson.

[01:47] Team_017 possession (Score: 45-49)
Bam Williamson attempts a Layup. Contested by Draymond Towns (5.7 feet, MAN). Bam Williamson misses. Offensive rebound by Bam Williamson! Bam Williamson kicks it out.

[01:35] Team_017 possession (Score: 45-49)
FOUL! Shooting foul on Bradley Allen. Tony Smith to the line for 2 free throws. [Team fouls: 3] (Bradley Allen: 1 personal fouls)   FT 1/2: GOOD   FT 2/2: MISS Tony Smith makes 1/2 from the line. Offensive rebound by Kyrie Middleton! Kyrie Middleton kicks it out.
Score: 45-50

[01:19] Team_017 possession (Score: 45-50)
FOUL! Shooting foul on Zach Fox. Vince Banchero to the line for 2 free throws. [Team fouls: 4] (Zach Fox: 1 personal fouls)   FT 1/2: GOOD   FT 2/2: GOOD Vince Banchero makes 2/2 from the line.
Score: 45-52

[01:06] Team_024 possession (Score: 45-52)
Zach Fox drives to the basket... Zach Fox throws a bad pass! Stolen by Vince Banchero! TURNOVER! (live ball)

[00:53] Team_017 possession (Score: 45-52)
Kyrie Middleton attempts a Layup. BLOCKED BY ANFERNEE WILLIAMSON! Ball deflects out of bounds off Kyrie Middleton.

[00:35] Team_024 possession (Score: 45-52)
Bradley Allen attempts a 3Pt. Contested by Tony Smith (4.4 feet, ZONE). Bradley Allen misses. Rebound secured by Kyrie Middleton.

[00:19] Team_017 possession (Score: 45-52)
Kyrie Middleton attempts a 3Pt. Contested by Anfernee Williamson (5.6 feet, MAN). Kyrie Middleton misses. Rebound secured by Zach Fox.

================================================================================
                              2ND QUARTER COMPLETE                              
================================================================================

2ND QUARTER SCORE: Team_024 25, Team_017 20

BOX SCORE:
================================================================================

Team_024
--------------------------------------------------------------------------------
Player                MIN  PTS  REB  AST  TO      FG   FG%      3P   3P%
--------------------------------------------------------------------------------
Draymond Towns         22   10    4    2   0   3/4    75.0     0/0   0.0
Zach Fox               22    5    4    0   0   2/6    33.3     0/0   0.0
Anfernee Williamson    22    4    4    1   0   2/2   100.0     0/0   0.0
Bradley Allen          22    3    0    0   0   1/3    33.3     0/0   0.0
Ja Reaves              22    3    0    0   0   1/4    25.0     0/0   0.0

TEAM: FG: 9/19 (47.4%), 3PT: 2/7 (28.6%), REB: 14 (4 off, 10 def), AST: 3, TO: 2
TEAM FOULS: 4


Team_017
--------------------------------------------------------------------------------
Player                MIN  PTS  REB  AST  TO      FG   FG%      3P   3P%
--------------------------------------------------------------------------------
Bam Williamson         22    6    4    0   0   3/5    60.0     0/0   0.0
Desmond Reaves         22    5    0    0   0   2/4    50.0     0/0   0.0
Kyrie Middleton        22    4    6    2   0   2/4    50.0     0/0   0.0
Vince Banchero         22    4    0    1   0   2/3    66.7     0/0   0.0
Tony Smith             22    0    2    0   0   0/4     0.0     0/0   0.0

TEAM: FG: 9/20 (45.0%), 3PT: 1/7 (14.3%), REB: 10 (2 off, 8 def), AST: 3, TO: 1
TEAM FOULS: 7 [Team_024 in BONUS]

================================================================================

================================================================================
                       3RD QUARTER - Team_024 vs Team_017                       
================================================================================

[12:00] Team_024 possession (Score: 45-52)
Draymond Towns drives and kicks out. Draymond Towns attempts a 3Pt. Contested by Bam Williamson (4.0 feet, MAN). DRAYMOND TOWNS MAKES IT! Assist: Anfernee Williamson
Score: 48-52

[11:44] Team_017 possession (Score: 48-52)
Vince Banchero attempts a 3Pt. Contested by Zach Fox (3.5 feet, ZONE). Vince Banchero misses. Rebound secured by Anfernee Williamson.

[11:26] Team_024 possession (Score: 48-52)
Draymond Towns attempts a Layup. BLOCKED BY VINCE BANCHERO! Ball deflects out of bounds off Draymond Towns.

[11:14] Team_017 possession (Score: 48-52)
FOUL! Shooting foul on Bradley Allen. Tony Smith to the line for 3 free throws. [Team fouls: 1] (Bradley Allen: 1 personal fouls)   FT 1/3: MISS   FT 2/3: MISS   FT 3/3: MISS Tony Smith makes 0/3 from the line. Rebound secured by Anfernee Williamson.

[11:01] Team_024 possession (Score: 48-52)
Bradley Allen attempts a Layup. Contested by Tony Smith (2.8 feet, MAN). BRADLEY ALLEN MAKES IT! Assist: Draymond Towns
Score: 50-52

[10:43] Team_017 possession (Score: 50-52)
Desmond Reaves attempts a Layup. Contested by Anfernee Williamson (4.1 feet, ZONE). DESMOND REAVES MAKES IT!
Score: 50-54

[10:28] Team_024 possession (Score: 50-54)
FOUL! Shooting foul on Desmond Reaves. Ja Reaves to the line for 2 free throws. [Team fouls: 1] (Desmond Reaves: 1 personal fouls)   FT 1/2: GOOD   FT 2/2: GOOD Ja Reaves makes 2/2 from the line.
Score: 52-54

[10:17] Team_017 possession (Score: 52-54)
FOUL! Shooting foul on Draymond Towns. Bam Williamson to the line for 2 free throws. [Team fouls: 2] (Draymond Towns: 1 personal fouls)   FT 1/2: GOOD   FT 2/2: GOOD Bam Williamson makes 2/2 from the line.
Score: 52-56

[10:01] Team_024 possession (Score: 52-56)
Ja Reaves attempts a Midrange. Contested by Desmond Reaves (4.2 feet, MAN). Ja Reaves misses. Rebound secured by Tony Smith.

[09:42] Team_017 possession (Score: 52-56)
Kyrie Middleton attempts a Layup. Contested by Draymond Towns (4.1 feet, ZONE). KYRIE MIDDLETON MAKES IT! Assist: Desmond Reaves
Score: 52-58

[09:29] Team_024 possession (Score: 52-58)
Ja Reaves attempts a 3Pt. Contested by Desmond Reaves (4.2 feet, ZONE). Ja Reaves misses. Rebound secured by Bam Williamson.

[09:17] Team_017 possession (Score: 52-58)
Kyrie Middleton drives to the basket... Kyrie Middleton loses control! Ball rolls out of bounds! TURNOVER! (dead ball)

[09:05] Team_024 possession (Score: 52-58)
Anfernee Williamson attempts a 3Pt. Contested by Desmond Reaves (3.9 feet, ZONE). Anfernee Williamson misses. Rebound secured by Tony Smith.

[08:56] Team_017 possession (Score: 52-58)
Desmond Reaves attempts a 3Pt. Contested by Ja Reaves (4.9 feet, MAN). Desmond Reaves misses. Rebound secured by Anfernee Williamson.

[08:41] Team_024 possession (Score: 52-58)
Draymond Towns drives to the basket... Draymond Towns loses the ball! Stripped by Bam Williamson! TURNOVER! (live ball)

[08:25] Team_017 possession (Score: 52-58)
Bam Williamson drives, picks up Anfernee Williamson. Help arrives from Zach Fox! Bam Williamson attempts a Layup. Contested by Zach Fox (4.4 feet, ZONE). BAM WILLIAMSON MAKES IT! Assist: Vince Banchero
Score: 52-60

[08:11] Team_024 possession (Score: 52-60)
Anfernee Williamson drives and kicks out. Zach Fox attempts a 3Pt. Contested by Desmond Reaves (4.0 feet, ZONE). ZACH FOX MAKES IT!
Score: 55-60

[07:53] Team_017 possession (Score: 55-60)
Desmond Reaves makes the Midrange and draws the foul on Ja Reaves! And-1! Desmond Reaves to the line for 1. [Team fouls: 3] (Ja Reaves: 1 personal fouls)   FT 1/1: GOOD Desmond Reaves makes 1/1 from the line.
Score: 55-63

[07:38] Team_024 possession (Score: 55-63)
Ja Reaves drives, Bam Williamson stays with him. Ja Reaves attempts a Dunk. Contested by Bam Williamson (4.2 feet, ZONE). Ja Reaves misses. Rebound secured by Kyrie Middleton.

[07:21] Team_017 possession (Score: 55-63)
FOUL! Shooting foul on Anfernee Williamson. Kyrie Middleton to the line for 2 free throws. [Team fouls: 4] (Anfernee Williamson: 1 personal fouls)   FT 1/2: GOOD   FT 2/2: GOOD Kyrie Middleton makes 2/2 from the line.
Score: 55-65

[07:06] Team_024 possession (Score: 55-65)
Draymond Towns makes the Layup and draws the foul on Bam Williamson! And-1! Draymond Towns to the line for 1. [Team fouls: 2] (Bam Williamson: 1 personal fouls)   FT 1/1: GOOD Draymond Towns makes 1/1 from the line.
Score: 58-65

[06:51] Team_017 possession (Score: 58-65)
Desmond Reaves drives and kicks out. Tony Smith attempts a Midrange. Contested by Anfernee Williamson (3.6 feet, ZONE). Tony Smith misses. FOUL! Loose ball foul on Draymond Towns during the rebound battle. [IN THE BONUS! 5 team fouls] Kyrie Middleton to the line for 2 free throws. (Draymond Towns: 2 personal fouls)   FT 1/2: GOOD   FT 2/2: MISS Kyrie Middleton makes 1/2 from the line. Offensive rebound by Kyrie Middleton! Kyrie Middleton kicks it out.
Score: 58-66

[06:33] Team_017 possession (Score: 58-66)
Vince Banchero attempts a 3Pt. Contested by Zach Fox (3.5 feet, MAN). Vince Banchero misses. Offensive rebound by Bam Williamson! Bam Williamson puts it back in!
Score: 58-68

[06:20] Team_024 possession (Score: 58-68)
Draymond Towns attempts a Layup. Contested by Bam Williamson (3.6 feet, MAN). DRAYMOND TOWNS MAKES IT!
Score: 60-68

[06:07] Team_017 possession (Score: 60-68)
Kyrie Middleton drives, picks up Anfernee Williamson. Help arrives from Zach Fox! Kyrie Middleton attempts a Layup. Contested by Zach Fox (4.0 feet, ZONE). Kyrie Middleton misses. Rebound secured by Draymond Towns.

[05:52] Team_024 possession (Score: 60-68)
Ja Reaves makes the Dunk and draws the foul on Vince Banchero! And-1! Ja Reaves to the line for 1. [Team fouls: 3] (Vince Banchero: 1 personal fouls)   FT 1/1: MISS Ja Reaves makes 0/1 from the line. Rebound secured by Bam Williamson.
Score: 62-68

[05:39] Team_017 possession (Score: 62-68)
Desmond Reaves attempts a 3Pt. Contested by Ja Reaves (4.9 feet, MAN). Desmond Reaves misses. Rebound secured by Anfernee Williamson.

[05:22] Team_024 possession (Score: 62-68)
Draymond Towns drives, Bam Williamson stays with him. Draymond Towns attempts a Layup. Contested by Bam Williamson (3.6 feet, ZONE). Draymond Towns misses. Offensive rebound by Draymond Towns! Draymond Towns puts it back in!
Score: 64-68

[05:06] Team_017 possession (Score: 64-68)
Kyrie Middleton drives and kicks out. Desmond Reaves attempts a 3Pt. Contested by Ja Reaves (4.5 feet, MAN). DESMOND REAVES MAKES IT! Assist: Tony Smith
Score: 64-71

[04:50] Team_024 possession (Score: 64-71)
Anfernee Williamson drives and kicks out. FOUL! Shooting foul on Kyrie Middleton. Anfernee Williamson to the line for 2 free throws. [Team fouls: 4] (Kyrie Middleton: 1 personal fouls)   FT 1/2: GOOD   FT 2/2: MISS Anfernee Williamson makes 1/2 from the line. Rebound secured by Kyrie Middleton.
Score: 65-71

[04:37] Team_017 possession (Score: 65-71)
Tony Smith attempts a 3Pt. Contested by Bradley Allen (4.4 feet, MAN). TONY SMITH MAKES IT!
Score: 65-74

[04:23] Team_024 possession (Score: 65-74)
Draymond Towns drives to the basket... FOUL! Offensive foul on Draymond Towns! Bam Williamson drew the charge! [Team fouls: 6] (Draymond Towns: 3 personal fouls) TURNOVER! (dead ball)

[04:07] Team_017 possession (Score: 65-74)
FOUL! Shooting foul on Anfernee Williamson. Bam Williamson to the line for 2 free throws. [BONUS: 7 team fouls] (Anfernee Williamson: 2 personal fouls)   FT 1/2: GOOD   FT 2/2: GOOD Bam Williamson makes 2/2 from the line.
Score: 65-76

[03:52] Team_024 possession (Score: 65-76)
Anfernee Williamson attempts a Layup. BLOCKED BY BAM WILLIAMSON! Ball goes out off Bam Williamson. Anfernee Williamson's ball!

[03:37] Team_024 possession (Score: 65-76)
Bradley Allen attempts a 3Pt. Contested by Tony Smith (2.9 feet, MAN). Bradley Allen misses. Offensive rebound by Zach Fox! Zach Fox kicks it out.

[03:23] Team_024 possession (Score: 65-76)
Zach Fox attempts a 3Pt. Contested by Vince Banchero (4.5 feet, MAN). Zach Fox misses. Offensive rebound by Zach Fox! Zach Fox kicks it out.

[03:06] Team_024 possession (Score: 65-76)
FOUL! Shooting foul on Tony Smith. Ja Reaves to the line for 2 free throws. [BONUS: 5 team fouls] (Tony Smith: 1 personal fouls)   FT 1/2: GOOD   FT 2/2: GOOD Ja Reaves makes 2/2 from the line.
Score: 67-76

[02:48] Team_017 possession (Score: 67-76)
Desmond Reaves drives, picks up Ja Reaves. Help arrives from Zach Fox! Desmond Reaves attempts a Layup. Contested by Zach Fox (5.1 feet, MAN). Desmond Reaves misses. Rebound secured by Draymond Towns.

[02:36] Team_024 possession (Score: 67-76)
Zach Fox attempts a 3Pt. Contested by Vince Banchero (4.6 feet, MAN). Zach Fox misses. Rebound secured by Tony Smith.

[02:23] Team_017 possession (Score: 67-76)
Bam Williamson attempts a Midrange. Contested by Bradley Allen (4.8 feet, ZONE). BAM WILLIAMSON MAKES IT! Assist: Tony Smith
Score: 67-78

[02:11] Team_024 possession (Score: 67-78)
Ja Reaves loses control! Ball rolls out of bounds! TURNOVER! (dead ball)

[02:11] Substitution (Team_024): Ja Reaves OUT → Victor Simons IN (stamina_rule2)

[02:11] Substitution (Team_024): Bradley Allen OUT → Zach Durant IN (stamina_rule2)

[02:11] Substitution (Team_024): Anfernee Williamson OUT → Julius Harris IN (stamina_rule2)

[02:11] Substitution (Team_024): Draymond Towns OUT → Terry Rozier IN (stamina_rule2)

[02:11] Substitution (Team_017): Desmond Reaves OUT → Blake Reaves IN (stamina_rule2)

[02:11] Substitution (Team_017): Kyrie Middleton OUT → Ja Stewart IN (stamina_rule2)

[02:11] Substitution (Team_017): Bam Williamson OUT → Klay Holiday IN (stamina_rule2)

[01:57] Team_017 possession (Score: 67-78)
Tony Smith attempts a Layup. Contested by Terry Rozier (4.5 feet, ZONE). TONY SMITH MAKES IT! Assist: Blake Reaves
Score: 67-80

[01:41] Team_024 possession (Score: 67-80)
Zach Durant drives and kicks out. Terry Rozier attempts a Midrange. Contested by Ja Stewart (4.7 feet, ZONE). Terry Rozier misses. Rebound secured by Tony Smith.

[01:23] Team_017 possession (Score: 67-80)
Tony Smith drives to the basket... Tony Smith loses the ball! Stripped by Terry Rozier! TURNOVER! (live ball)

[01:11] Team_024 possession (Score: 67-80)
Zach Fox attempts a 3Pt. Contested by Vince Banchero (4.7 feet, MAN). ZACH FOX MAKES IT! Assist: Julius Harris
Score: 70-80

[00:58] Team_017 possession (Score: 70-80)
Vince Banchero makes the Dunk and draws the foul on Terry Rozier! And-1! Vince Banchero to the line for 1. [BONUS: 8 team fouls] (Terry Rozier: 1 personal fouls)   FT 1/1: GOOD Vince Banchero makes 1/1 from the line.
Score: 70-83

[00:42] Team_024 possession (Score: 70-83)
FOUL! Holding foul on Ja Stewart. [IN THE BONUS! 6 team fouls] Julius Harris to the line for 2 free throws. (Ja Stewart: 1 personal fouls)   FT 1/2: MISS   FT 2/2: GOOD Julius Harris makes 1/2 from the line.
Score: 71-83

[00:31] Team_017 possession (Score: 71-83)
Klay Holiday drives and kicks out. Vince Banchero attempts a 3Pt. Contested by Victor Simons (3.9 feet, ZONE). VINCE BANCHERO MAKES IT! Assist: Tony Smith
Score: 71-86

[00:15] Team_024 possession (Score: 71-86)
Zach Fox attempts a 3Pt. Contested by Vince Banchero (4.8 feet, MAN). Zach Fox misses. Rebound secured by Ja Stewart.

================================================================================
                              3RD QUARTER COMPLETE                              
================================================================================

3RD QUARTER SCORE: Team_024 26, Team_017 34

BOX SCORE:
================================================================================

Team_024
--------------------------------------------------------------------------------
Player                MIN  PTS  REB  AST  TO      FG   FG%      3P   3P%
--------------------------------------------------------------------------------
Draymond Towns         32   10    3    1   0   4/5    80.0     0/0   0.0
Zach Fox               34    6    2    0   0   2/4    50.0     0/0   0.0
Ja Reaves              32    4    0    0   0   2/6    33.3     0/0   0.0
Bradley Allen          32    2    0    0   0   1/1   100.0     0/0   0.0
Julius Harris           4    1    0    1   0   1/1   100.0     0/0   0.0
Anfernee Williamson    32    0    4    1   0   0/2     0.0     0/0   0.0
Zach Durant             4    0    0    0   0   0/1     0.0     0/0   0.0

TEAM: FG: 10/20 (50.0%), 3PT: 1/5 (20.0%), REB: 9 (3 off, 6 def), AST: 3, TO: 3
TEAM FOULS: 8 [Team_017 in BONUS]


Team_017
--------------------------------------------------------------------------------
Player                MIN  PTS  REB  AST  TO      FG   FG%      3P   3P%
--------------------------------------------------------------------------------
Bam Williamson         32   10    3    0   0   5/5   100.0     0/0   0.0
Desmond Reaves         32    8    0    1   0   3/6    50.0     0/0   0.0
Vince Banchero         34    6    0    1   0   2/3    66.7     0/0   0.0
Tony Smith             34    5    4    3   0   2/3    66.7     0/0   0.0
Kyrie Middleton        32    4    3    0   0   2/3    66.7     0/0   0.0
Blake Reaves            4    0    0    1   0   0/0     0.0     0/0   0.0
Ja Stewart              4    0    1    0   0   0/0     0.0     0/0   0.0

TEAM: FG: 14/20 (70.0%), 3PT: 2/6 (33.3%), REB: 11 (2 off, 9 def), AST: 6, TO: 2
TEAM FOULS: 6 [Team_024 in BONUS]

================================================================================

================================================================================
                       4TH QUARTER - Team_024 vs Team_017                       
================================================================================

[12:00] Substitution (Team_024): Ja Reaves OUT (stamina: 79) → Victor Simons IN (comeback_detected)

[12:00] Substitution (Team_017): Desmond Reaves OUT (stamina: 78) → Blake Reaves IN (comeback_detected)

[12:00] Team_024 possession (Score: 71-86)
Bradley Allen attempts a 3Pt. Contested by Tony Smith (3.1 feet, ZONE). BRADLEY ALLEN MAKES IT! Assist: Anfernee Williamson
Score: 74-86

[11:50] Team_017 possession (Score: 74-86)
Blake Reaves attempts a Layup. Contested by Anfernee Williamson (3.6 feet, ZONE). Blake Reaves misses. Offensive rebound by Bam Williamson! Bam Williamson puts it back in!
Score: 74-88

[11:32] Team_024 possession (Score: 74-88)
Zach Fox attempts a Midrange. Contested by Vince Banchero (4.7 feet, MAN). ZACH FOX MAKES IT!
Score: 76-88

[11:18] Team_017 possession (Score: 76-88)
Tony Smith attempts a 3Pt. Contested by Bradley Allen (4.4 feet, MAN). Tony Smith misses. Rebound secured by Draymond Towns.

[11:06] Team_024 possession (Score: 76-88)
Anfernee Williamson attempts a 3Pt. Contested by Tony Smith (3.0 feet, ZONE). Anfernee Williamson misses. Rebound secured by Bam Williamson.

[10:51] Team_017 possession (Score: 76-88)
Kyrie Middleton makes the Midrange and draws the foul on Bradley Allen! And-1! Kyrie Middleton to the line for 1. [Team fouls: 1] (Bradley Allen: 1 personal fouls)   FT 1/1: MISS Kyrie Middleton makes 0/1 from the line. Rebound secured by Zach Fox.
Score: 76-90

[10:35] Team_024 possession (Score: 76-90)
Anfernee Williamson drives and kicks out. Anfernee Williamson attempts a Midrange. Contested by Kyrie Middleton (5.1 feet, ZONE). ANFERNEE WILLIAMSON MAKES IT!
Score: 78-90

[10:22] Team_017 possession (Score: 78-90)
FOUL! Holding foul on Zach Fox. [Team fouls: 2] No free throws, side out. (Zach Fox: 1 personal fouls)

[10:08] Team_017 possession (Score: 78-90)
Vince Banchero drives, picks up Zach Fox. Help arrives from Bradley Allen! Vince Banchero attempts a Layup. Contested by Bradley Allen (3.9 feet, MAN). Vince Banchero misses. Rebound secured by Draymond Towns.

[09:56] Team_024 possession (Score: 78-90)
Zach Fox attempts a 3Pt. Contested by Tony Smith (3.6 feet, ZONE). Zach Fox misses. Offensive rebound by Draymond Towns! Draymond Towns puts it back in!
Score: 80-90

[09:43] Team_017 possession (Score: 80-90)
Kyrie Middleton drives to the basket... Kyrie Middleton loses the ball! Stripped by Anfernee Williamson! TURNOVER! (live ball)

[09:28] Team_024 possession (Score: 80-90)
Anfernee Williamson attempts a Layup. Contested by Kyrie Middleton (5.1 feet, ZONE). ANFERNEE WILLIAMSON MAKES IT! Assist: Zach Fox
Score: 82-90

[09:16] Team_017 possession (Score: 82-90)
Kyrie Middleton attempts a 3Pt. Contested by Victor Simons (4.2 feet, ZONE). KYRIE MIDDLETON MAKES IT! Assist: Blake Reaves
Score: 82-93

[09:02] Team_024 possession (Score: 82-93)
Draymond Towns attempts a 3Pt. Contested by Bam Williamson (4.0 feet, MAN). Draymond Towns misses. Rebound secured by Kyrie Middleton.

[08:44] Team_017 possession (Score: 82-93)
Vince Banchero attempts a 3Pt. Contested by Victor Simons (3.8 feet, ZONE). Vince Banchero misses. Rebound secured by Draymond Towns.

[08:32] Team_024 possession (Score: 82-93)
Victor Simons attempts a 3Pt. Contested by Tony Smith (3.7 feet, ZONE). Victor Simons misses. Offensive rebound by Zach Fox! Zach Fox kicks it out.

[08:17] Team_024 possession (Score: 82-93)
Draymond Towns throws a bad pass! Stolen by Bam Williamson! TURNOVER! (live ball)

[08:00] Team_017 possession (Score: 82-93)
Tony Smith attempts a 3Pt. BLOCKED BY VICTOR SIMONS! Ball goes out off Victor Simons. Tony Smith's ball!

[07:45] Team_017 possession (Score: 82-93)
Tony Smith drives and kicks out. Vince Banchero attempts a 3Pt. Contested by Zach Fox (4.4 feet, MAN). Vince Banchero misses. Rebound secured by Draymond Towns.

[07:31] Team_024 possession (Score: 82-93)
Victor Simons attempts a 3Pt. Contested by Vince Banchero (5.0 feet, ZONE). Victor Simons misses. Rebound secured by Kyrie Middleton.

[07:14] Team_017 possession (Score: 82-93)
Kyrie Middleton attempts a Midrange. Contested by Anfernee Williamson (4.5 feet, ZONE). Kyrie Middleton misses. Rebound secured by Draymond Towns.

[06:55] Team_024 possession (Score: 82-93)
FOUL! Shooting foul on Vince Banchero. Zach Fox to the line for 2 free throws. [Team fouls: 1] (Vince Banchero: 1 personal fouls)   FT 1/2: GOOD   FT 2/2: MISS Zach Fox makes 1/2 from the line. Rebound secured by Tony Smith.
Score: 83-93

[06:44] Team_017 possession (Score: 83-93)
Tony Smith throws a bad pass out of bounds! TURNOVER! (dead ball)

[06:44] Substitution (Team_024): Zach Fox OUT → Vince Irving IN (stamina_rule2)

[06:44] Substitution (Team_024): Bradley Allen OUT → Zach Durant IN (stamina_rule2)

[06:44] Substitution (Team_024): Anfernee Williamson OUT → Julius Harris IN (stamina_rule2)

[06:44] Substitution (Team_024): Draymond Towns OUT → Terry Rozier IN (stamina_rule2)

[06:44] Substitution (Team_017): Vince Banchero OUT → Tobias Bridges IN (stamina_rule2)

[06:44] Substitution (Team_017): Tony Smith OUT → Shaquille Stewart IN (stamina_rule2)

[06:44] Substitution (Team_017): Kyrie Middleton OUT → Ja Stewart IN (stamina_rule2)

[06:44] Substitution (Team_017): Bam Williamson OUT → Klay Holiday IN (stamina_rule2)

[06:29] Team_024 possession (Score: 83-93)
FOUL! Reach-in foul on Ja Stewart during the drive. [Team fouls: 2] No free throws, side out. (Ja Stewart: 1 personal fouls)

[06:10] Team_024 possession (Score: 83-93)
Victor Simons attempts a 3Pt. Contested by Tobias Bridges (4.1 feet, ZONE). Victor Simons misses. Rebound secured by Shaquille Stewart.

[05:56] Team_017 possession (Score: 83-93)
Shaquille Stewart drives and kicks out. Tobias Bridges attempts a Midrange. Contested by Vince Irving (4.9 feet, ZONE). TOBIAS BRIDGES MAKES IT!
Score: 83-95

[05:46] Team_024 possession (Score: 83-95)
Julius Harris attempts a Layup. Contested by Ja Stewart (4.9 feet, MAN). JULIUS HARRIS MAKES IT!
Score: 85-95

[05:35] Team_017 possession (Score: 85-95)
Tobias Bridges drives, Vince Irving stays with him. Tobias Bridges attempts a Layup. Contested by Vince Irving (5.0 feet, MAN). Tobias Bridges misses. Offensive rebound by Ja Stewart! Ja Stewart kicks it out.

[05:23] Team_017 possession (Score: 85-95)
Ja Stewart attempts a 3Pt. Contested by Victor Simons (3.8 feet, ZONE). Ja Stewart misses. Rebound secured by Terry Rozier.

[05:07] Team_024 possession (Score: 85-95)
Zach Durant drives to the basket... Zach Durant throws a bad pass! Stolen by Shaquille Stewart! TURNOVER! (live ball)

[04:53] Team_017 possession (Score: 85-95)
Ja Stewart drives and kicks out. Tobias Bridges attempts a 3Pt. Contested by Vince Irving (4.9 feet, MAN). Tobias Bridges misses. Rebound secured by Zach Durant.

[04:43] Team_024 possession (Score: 85-95)
FOUL! Shooting foul on Tobias Bridges. Vince Irving to the line for 2 free throws. [Team fouls: 3] (Tobias Bridges: 1 personal fouls)   FT 1/2: GOOD   FT 2/2: GOOD Vince Irving makes 2/2 from the line.
Score: 87-95

[04:29] Team_017 possession (Score: 87-95)
Klay Holiday drives, Terry Rozier stays with him. Klay Holiday attempts a Dunk. Contested by Terry Rozier (4.2 feet, ZONE). Klay Holiday misses. Rebound secured by Terry Rozier.

[04:18] Team_024 possession (Score: 87-95)
Vince Irving attempts a 3Pt. Contested by Tobias Bridges (4.1 feet, ZONE). Vince Irving misses. Offensive rebound by Terry Rozier! Terry Rozier's putback is no good. Rebound secured by Ja Stewart.

[04:04] Team_017 possession (Score: 87-95)
Blake Reaves attempts a Midrange. Contested by Victor Simons (4.2 feet, MAN). BLAKE REAVES MAKES IT! Assist: Tobias Bridges
Score: 87-97

[03:52] Team_024 possession (Score: 87-97)
Victor Simons drives to the basket... FOUL! Offensive foul on Victor Simons! Ja Stewart drew the charge! [Team fouls: 3] (Victor Simons: 1 personal fouls) TURNOVER! (dead ball)

[03:35] Team_017 possession (Score: 87-97)
Tobias Bridges attempts a 3Pt. Contested by Vince Irving (5.0 feet, MAN). Tobias Bridges misses. FOUL! Loose ball foul on Zach Durant during the rebound battle. [Team fouls: 4] No free throws, side out. (Zach Durant: 1 personal fouls)

[03:24] Team_017 possession (Score: 87-97)
Tobias Bridges drives and kicks out. Shaquille Stewart attempts a Midrange. Contested by Zach Durant (3.2 feet, MAN). Shaquille Stewart misses. FOUL! Loose ball foul on Terry Rozier during the rebound battle. [IN THE BONUS! 5 team fouls] Shaquille Stewart to the line for 2 free throws. (Terry Rozier: 1 personal fouls)   FT 1/2: GOOD   FT 2/2: GOOD Shaquille Stewart makes 2/2 from the line.
Score: 87-99

[03:07] Team_024 possession (Score: 87-99)
Zach Durant drives and kicks out. FOUL! Shooting foul on Shaquille Stewart. Zach Durant to the line for 2 free throws. [Team fouls: 4] (Shaquille Stewart: 1 personal fouls)   FT 1/2: MISS   FT 2/2: MISS Zach Durant makes 0/2 from the line. Rebound secured by Ja Stewart.

[02:51] Team_017 possession (Score: 87-99)
Klay Holiday attempts a Midrange. Contested by Terry Rozier (4.2 feet, MAN). Klay Holiday misses. Rebound secured by Julius Harris.

[02:36] Team_024 possession (Score: 87-99)
FOUL! Reach-in foul on Ja Stewart during the drive. [IN THE BONUS! 5 team fouls] Julius Harris to the line for 2 free throws. (Ja Stewart: 2 personal fouls)   FT 1/2: MISS   FT 2/2: GOOD Julius Harris makes 1/2 from the line.
Score: 88-99

[02:20] Team_017 possession (Score: 88-99)
Ja Stewart drives, picks up Julius Harris. Help arrives from Vince Irving! Ja Stewart attempts a Layup. Contested by Vince Irving (4.6 feet, MAN). Ja Stewart misses. Rebound secured by Julius Harris.

[02:05] Team_024 possession (Score: 88-99)
Zach Durant attempts a 3Pt. Contested by Shaquille Stewart (4.6 feet, MAN). Zach Durant misses. Rebound secured by Ja Stewart.

[01:50] Team_017 possession (Score: 88-99)
FOUL! Reach-in foul on Terry Rozier during the drive. [IN THE BONUS! 6 team fouls] Klay Holiday to the line for 2 free throws. (Terry Rozier: 2 personal fouls)   FT 1/2: GOOD   FT 2/2: GOOD Klay Holiday makes 2/2 from the line.
Score: 88-101

[01:35] Team_024 possession (Score: 88-101)
Terry Rozier drives, Klay Holiday stays with him. Terry Rozier attempts a Dunk. Contested by Klay Holiday (5.4 feet, MAN). TERRY ROZIER MAKES IT! Assist: Zach Durant
Score: 90-101

[01:20] Team_017 possession (Score: 90-101)
Shaquille Stewart attempts a 3Pt. Contested by Zach Durant (3.6 feet, MAN). Shaquille Stewart misses. Rebound secured by Vince Irving.

[01:07] Team_024 possession (Score: 90-101)
Vince Irving attempts a 3Pt. Contested by Tobias Bridges (4.1 feet, ZONE). Vince Irving misses. Rebound secured by Shaquille Stewart.

[00:49] Team_017 possession (Score: 90-101)
Shaquille Stewart attempts a 3Pt. Contested by Zach Durant (3.7 feet, ZONE). Shaquille Stewart misses. Rebound secured by Vince Irving.

[00:34] Team_024 possession (Score: 90-101)
Julius Harris attempts a 3Pt. Contested by Ja Stewart (5.0 feet, MAN). JULIUS HARRIS MAKES IT! Assist: Zach Durant
Score: 93-101

[00:15] Team_017 possession (Score: 93-101)
Blake Reaves drives and kicks out. Klay Holiday attempts a Midrange. Contested by Julius Harris (5.0 feet, ZONE). Klay Holiday misses. Offensive rebound by Ja Stewart! Ja Stewart kicks it out.

[00:01] Team_017 possession (Score: 93-101)
Shaquille Stewart makes the Dunk and draws the foul on Vince Irving! And-1! Shaquille Stewart to the line for 1. [BONUS: 7 team fouls] (Vince Irving: 1 personal fouls)   FT 1/1: GOOD Shaquille Stewart makes 1/1 from the line.
Score: 93-104

================================================================================
                              4TH QUARTER COMPLETE                              
================================================================================

4TH QUARTER SCORE: Team_024 22, Team_017 18

BOX SCORE:
================================================================================

Team_024
--------------------------------------------------------------------------------
Player                MIN  PTS  REB  AST  TO      FG   FG%      3P   3P%
--------------------------------------------------------------------------------
Julius Harris          11    6    2    0   0   3/3   100.0     0/0   0.0
Anfernee Williamson    38    4    0    1   0   2/3    66.7     0/0   0.0
Bradley Allen          38    3    0    0   0   1/1   100.0     0/0   0.0
Zach Fox               40    2    2    1   0   1/2    50.0     0/0   0.0
Draymond Towns         38    2    6    0   0   1/2    50.0     0/0   0.0
Terry Rozier           11    2    2    0   0   1/1   100.0     0/0   0.0
Vince Irving            9    2    2    0   0   1/3    33.3     0/0   0.0
Victor Simons          16    0    0    0   0   0/2     0.0     0/0   0.0
Zach Durant            11    0    1    2   0   0/2     0.0     0/0   0.0

TEAM: FG: 10/19 (52.6%), 3PT: 3/10 (30.0%), REB: 16 (3 off, 13 def), AST: 4, TO: 3
TEAM FOULS: 7 [Team_017 in BONUS]


Team_017
--------------------------------------------------------------------------------
Player                MIN  PTS  REB  AST  TO      FG   FG%      3P   3P%
--------------------------------------------------------------------------------
Shaquille Stewart       9    5    3    0   0   2/4    50.0     0/0   0.0
Kyrie Middleton        38    3    2    0   0   1/3    33.3     0/0   0.0
Bam Williamson         38    2    2    0   0   1/1   100.0     0/0   0.0
Blake Reaves           16    2    0    1   0   1/1   100.0     0/0   0.0
Tobias Bridges          9    2    0    1   0   1/1   100.0     0/0   0.0
Klay Holiday           11    2    0    0   0   1/3    33.3     0/0   0.0
Tony Smith             40    0    1    0   0   0/2     0.0     0/0   0.0
Vince Banchero         40    0    0    0   0   0/2     0.0     0/0   0.0
Ja Stewart             11    0    5    0   0   0/3     0.0     0/0   0.0

TEAM: FG: 7/20 (35.0%), 3PT: 1/6 (16.7%), REB: 12 (4 off, 8 def), AST: 2, TO: 2
TEAM FOULS: 5 [Team_024 in BONUS]

================================================================================

================================================================================
                               FULL GAME COMPLETE                               
================================================================================

FINAL SCORE: Team_024 93, Team_017 104

SCORING BY QUARTER:
--------------------------------------------------------------------------------
Team                     Q1     Q2     Q3     Q4    FINAL
--------------------------------------------------------------------------------
Team_024                 20     25     26     22       93
Team_017                 32     20     34     18      104
--------------------------------------------------------------------------------

FULL GAME BOX SCORE:
================================================================================

Team_024
--------------------------------------------------------------------------------
Player                MIN  PTS  REB  AST  TO      FG   FG%      3P   3P%      FT STL BLK
--------------------------------------------------------------------------------
Zach Fox               40   13   14    1   1   5/13   38.5   3/8    37.5   1/3     1   0
Bradley Allen          38   15    0    1   0   6/11   54.5   2/5    40.0   1/1     0   0
Anfernee Williamson    38   12    8    5   1   8/12   66.7   0/2     0.0   3/4     1   1
Draymond Towns         38   27   20    4   2   8/13   61.5   0/1     0.0   5/6     0   0
Ja Reaves              32    7    0    1   4   3/12   25.0   1/4    25.0   4/5     0   0
Victor Simons          16    0    0    0   1   0/4     0.0   0/4     0.0   0/0     0   1
Zach Durant            11    0    3    2   0   0/3     0.0   0/1     0.0   0/2     0   0
Julius Harris          11    7    2    1   0   3/3   100.0   1/1   100.0   2/4     0   0
Terry Rozier           11    6    4    0   0   3/3   100.0   1/1   100.0   0/0     1   0
Vince Irving            9    2    2    0   1   1/3    33.3   0/2     0.0   2/2     0   0

TEAM: FG: 39/79 (49.4%), 3PT: 8/29 (27.6%), REB: 56 (16 off, 40 def), AST: 15, TO: 10


Team_017
--------------------------------------------------------------------------------
Player                MIN  PTS  REB  AST  TO      FG   FG%      3P   3P%      FT STL BLK
--------------------------------------------------------------------------------
Vince Banchero         40   12    0    2   2   5/12   41.7   1/5    20.0   3/3     1   1
Tony Smith             40   10    9    3   2   7/17   41.2   2/8    25.0   2/6     0   0
Kyrie Middleton        38   17   14    2   1   7/12   58.3   1/2    50.0   4/6     0   1
Bam Williamson         38   27   14    2   0   9/12   75.0   0/1     0.0   5/6     4   3
Desmond Reaves         32   17    0    3   0   5/11   45.5   2/6    33.3   4/4     0   0
Blake Reaves           16    2    0    2   0   2/2   100.0   0/0     0.0   0/0     0   0
Ja Stewart             11    0    7    0   0   1/5    20.0   0/2     0.0   0/0     0   0
Klay Holiday           11    2    0    0   1   2/5    40.0   0/0     0.0   3/4     0   0
Tobias Bridges          9    5    0    1   0   1/1   100.0   0/0     0.0   0/0     0   0
Shaquille Stewart       9    5    4    0   0   2/5    40.0   0/2     0.0   3/3     1   0

TEAM: FG: 41/82 (50.0%), 3PT: 6/26 (23.1%), REB: 44 (9 off, 35 def), AST: 15, TO: 6

================================================================================
