================================================================================
                        FULL GAME - Team_029 vs Team_004                        
================================================================================

================================================================================
                       1ST QUARTER - Team_029 vs Team_004                       
================================================================================

[12:00] Team_029 possession (Score: 0-0)
Devin Butler commits a violation (traveling/carry)! TURNOVER! (dead ball)

[11:42] Team_004 possession (Score: 0-0)
Michael Curry attempts a 3Pt. Contested by Giannis Banchero (3.7 feet, ZONE). Michael Curry misses. Rebound secured by James Wall.

[11:31] Team_029 possession (Score: 0-0)
Giannis Banchero attempts a 3Pt. Contested by Michael Curry (5.6 feet, ZONE). Giannis Banchero misses. Offensive rebound by Devin Butler! Devin Butler kicks it out.

[11:18] Team_029 possession (Score: 0-0)
Giannis Banchero attempts a 3Pt. Contested by Dwyane Irving (4.1 feet, MAN). Giannis Banchero misses. Rebound secured by Dwyane Irving.

[11:04] Team_004 possession (Score: 0-0)
Anthony Lillard attempts a Midrange. Contested by Devin Butler (4.5 feet, MAN). ANTHONY LILLARD MAKES IT!
Score: 0-2

[10:48] Team_029 possession (Score: 0-2)
Devin Butler drives, Anthony Lillard stays with him. Devin Butler attempts a Layup. Contested by Anthony Lillard (4.6 feet, MAN). DEVIN BUTLER MAKES IT! Assist: Paul Iverson
Score: 2-2

[10:34] Team_004 possession (Score: 2-2)
FOUL! Holding foul on Scottie Bird. [Team fouls: 1] No free throws, side out. (Scottie Bird: 1 personal fouls)

[10:23] Team_004 possession (Score: 2-2)
Draymond Fox drives and kicks out. Jabari Wade attempts a 3Pt. Contested by Scottie Bird (3.1 feet, MAN). Jabari Wade misses. Offensive rebound by Anthony Lillard! Anthony Lillard kicks it out.

[10:06] Team_004 possession (Score: 2-2)
FOUL! Shooting foul on Scottie Bird. Jabari Wade to the line for 2 free throws. [Team fouls: 2] (Scottie Bird: 2 personal fouls)   FT 1/2: GOOD   FT 2/2: GOOD Jabari Wade makes 2/2 from the line.
Score: 2-4

[09:53] Team_029 possession (Score: 2-4)
Scottie Bird drives and kicks out. James Wall attempts a Midrange. Contested by Draymond Fox (4.1 feet, MAN). James Wall misses. Rebound secured by Dwyane Irving.

[09:38] Team_004 possession (Score: 2-4)
Dwyane Irving drives, James Wall stays with him. Dwyane Irving attempts a Dunk. Contested by James Wall (2.9 feet, ZONE). Dwyane Irving misses. Rebound secured by James Wall.

[09:21] Team_029 possession (Score: 2-4)
Paul Iverson attempts a Midrange. Contested by Michael Curry (5.2 feet, MAN). Paul Iverson misses. Rebound secured by Anthony Lillard.

[09:06] Team_004 possession (Score: 2-4)
Draymond Fox drives, James Wall stays with him. Draymond Fox attempts a Dunk. Contested by James Wall (3.0 feet, MAN). DRAYMOND FOX MAKES IT!
Score: 2-6

[08:47] Team_029 possession (Score: 2-6)
FOUL! Holding foul on Michael Curry. [Team fouls: 1] No free throws, side out. (Michael Curry: 1 personal fouls)

[08:31] Team_029 possession (Score: 2-6)
James Wall attempts a 3Pt. Contested by Draymond Fox (4.7 feet, MAN). James Wall misses. Rebound secured by Dwyane Irving.

[08:14] Team_004 possession (Score: 2-6)
Anthony Lillard drives to the basket... Anthony Lillard loses the ball! Stripped by James Wall! TURNOVER! (live ball)

[07:59] Team_029 possession (Score: 2-6)
FOUL! Shooting foul on Michael Curry. Paul Iverson to the line for 3 free throws. [Team fouls: 2] (Michael Curry: 2 personal fouls)   FT 1/3: GOOD   FT 2/3: GOOD   FT 3/3: GOOD Paul Iverson makes 3/3 from the line.
Score: 5-6

[07:45] Team_004 possession (Score: 5-6)
Anthony Lillard attempts a 3Pt. Contested by Devin Butler (4.5 feet, MAN). Anthony Lillard misses. Rebound secured by James Wall.

[07:32] Team_029 possession (Score: 5-6)
Paul Iverson attempts a 3Pt. Contested by Michael Curry (5.2 feet, ZONE). Paul Iverson misses. Offensive rebound by James Wall! James Wall puts it back in!
Score: 7-6

[07:18] Team_004 possession (Score: 7-6)
Jabari Wade attempts a 3Pt. Contested by Scottie Bird (3.8 feet, MAN). Jabari Wade misses. Offensive rebound by Anthony Lillard! Anthony Lillard kicks it out.

[07:08] Team_004 possession (Score: 7-6)
Anthony Lillard drives and kicks out. Jabari Wade attempts a 3Pt. Contested by Giannis Banchero (3.5 feet, ZONE). Jabari Wade misses. Rebound secured by Giannis Banchero.

[06:55] Team_029 possession (Score: 7-6)
FOUL! Reach-in foul on Anthony Lillard during the drive. [Team fouls: 3] No free throws, side out. (Anthony Lillard: 1 personal fouls)

[06:44] Team_029 possession (Score: 7-6)
Giannis Banchero attempts a Midrange. Contested by Dwyane Irving (4.1 feet, MAN). Giannis Banchero misses. Offensive rebound by Devin Butler! Devin Butler kicks it out.

[06:29] Team_029 possession (Score: 7-6)
Scottie Bird attempts a 3Pt. Contested by Jabari Wade (5.0 feet, MAN). Scottie Bird misses. Rebound secured by Draymond Fox.

[06:16] Team_004 possession (Score: 7-6)
Jabari Wade attempts a 3Pt. Contested by Giannis Banchero (4.2 feet, ZONE). JABARI WADE MAKES IT! Assist: Dwyane Irving
Score: 7-9

[05:58] Team_029 possession (Score: 7-9)
Scottie Bird attempts a 3Pt. Contested by Jabari Wade (5.0 feet, MAN). Scottie Bird misses. Rebound secured by Dwyane Irving.

[05:44] Team_004 possession (Score: 7-9)
Jabari Wade drives to the basket... Jabari Wade throws a bad pass out of bounds! TURNOVER! (dead ball)

[05:26] Team_029 possession (Score: 7-9)
Giannis Banchero attempts a 3Pt. Contested by Dwyane Irving (4.1 feet, MAN). Giannis Banchero misses. Rebound secured by Anthony Lillard.

[05:16] Team_004 possession (Score: 7-9)
Dwyane Irving attempts a Layup. Contested by James Wall (2.9 feet, ZONE). Dwyane Irving misses. Offensive rebound by Draymond Fox! Draymond Fox kicks it out.

[05:05] Team_004 possession (Score: 7-9)
Michael Curry attempts a Midrange. Contested by Giannis Banchero (3.8 feet, ZONE). Michael Curry misses. Rebound secured by Devin Butler.

[04:48] Team_029 possession (Score: 7-9)
Devin Butler drives and kicks out. FOUL! Shooting foul on Anthony Lillard. Devin Butler to the line for 3 free throws. [Team fouls: 4] (Anthony Lillard: 2 personal fouls)   FT 1/3: GOOD   FT 2/3: GOOD   FT 3/3: GOOD Devin Butler makes 3/3 from the line.
Score: 10-9

[04:32] Team_004 possession (Score: 10-9)
Dwyane Irving attempts a 3Pt. Contested by Giannis Banchero (4.0 feet, MAN). Dwyane Irving misses. Rebound secured by Giannis Banchero.

[04:17] Team_029 possession (Score: 10-9)
James Wall throws a bad pass! Stolen by Draymond Fox! TURNOVER! (live ball)

[04:05] Team_004 possession (Score: 10-9)
FOUL! Holding foul on Paul Iverson. [Team fouls: 3] No free throws, side out. (Paul Iverson: 1 personal fouls)

[03:48] Team_004 possession (Score: 10-9)
Dwyane Irving attempts a 3Pt. Contested by Paul Iverson (4.7 feet, ZONE). DWYANE IRVING MAKES IT! Assist: Draymond Fox
Score: 10-12

[03:32] Team_029 possession (Score: 10-12)
James Wall drives to the basket... James Wall loses the ball! Stripped by Draymond Fox! TURNOVER! (live ball)

[03:17] Team_004 possession (Score: 10-12)
Jabari Wade attempts a Midrange. Contested by Scottie Bird (4.0 feet, MAN). JABARI WADE MAKES IT!
Score: 10-14

[03:04] Team_029 possession (Score: 10-14)
James Wall loses control! Ball rolls out of bounds! TURNOVER! (dead ball)

[03:04] Substitution (Team_029): Giannis Banchero OUT → Pau Anthony IN (stamina_rule2)

[03:04] Substitution (Team_004): Jabari Wade OUT → Russell Barnes IN (stamina_rule2)

[03:04] Substitution (Team_004): Anthony Lillard OUT → Shai Beal IN (stamina_rule2)

[02:52] Team_004 possession (Score: 10-14)
Draymond Fox throws a bad pass! Stolen by James Wall! TURNOVER! (live ball)

[02:38] Team_029 possession (Score: 10-14)
FOUL! Offensive foul on Pau Anthony! Dwyane Irving drew the charge! [Team fouls: 4] (Pau Anthony: 1 personal fouls) TURNOVER! (dead ball)

[02:22] Team_004 possession (Score: 10-14)
Shai Beal attempts a 3Pt. Contested by Pau Anthony (3.8 feet, ZONE). Shai Beal misses. Rebound secured by Pau Anthony.

[02:08] Team_029 possession (Score: 10-14)
FOUL! Shooting foul on Dwyane Irving. Pau Anthony to the line for 2 free throws. [BONUS: 5 team fouls] (Dwyane Irving: 1 personal fouls)   FT 1/2: MISS   FT 2/2: GOOD Pau Anthony makes 1/2 from the line.
Score: 11-14

[01:51] Team_004 possession (Score: 11-14)
Russell Barnes drives to the basket... Russell Barnes loses the ball! Stripped by James Wall! TURNOVER! (live ball)

[01:39] Team_029 possession (Score: 11-14)
Pau Anthony attempts a Midrange. Contested by Dwyane Irving (4.2 feet, MAN). PAU ANTHONY MAKES IT! Assist: James Wall
Score: 13-14

[01:22] Team_004 possession (Score: 13-14)
Dwyane Irving attempts a 3Pt. Contested by Pau Anthony (3.9 feet, ZONE). DWYANE IRVING MAKES IT! Assist: Draymond Fox
Score: 13-17

[01:06] Team_029 possession (Score: 13-17)
FOUL! Shooting foul on Shai Beal. Devin Butler to the line for 2 free throws. [BONUS: 6 team fouls] (Shai Beal: 1 personal fouls)   FT 1/2: GOOD   FT 2/2: GOOD Devin Butler makes 2/2 from the line.
Score: 15-17

[00:51] Team_004 possession (Score: 15-17)
Dwyane Irving attempts a 3Pt. Contested by Pau Anthony (3.9 feet, MAN). Dwyane Irving misses. Rebound secured by Devin Butler.

[00:37] Team_029 possession (Score: 15-17)
Devin Butler attempts a Layup. Contested by Shai Beal (5.5 feet, MAN). Devin Butler misses. Rebound secured by Shai Beal.

[00:22] Team_004 possession (Score: 15-17)
Shai Beal drives and kicks out. Shai Beal attempts a Midrange. Contested by Devin Butler (4.7 feet, MAN). SHAI BEAL MAKES IT!
Score: 15-19

[00:12] Team_029 possession (Score: 15-19)
Paul Iverson attempts a Midrange. Contested by Draymond Fox (4.9 feet, ZONE). Paul Iverson misses. Rebound secured by Russell Barnes.

================================================================================
                              1ST QUARTER COMPLETE                              
================================================================================

1ST QUARTER SCORE: Team_029 15, Team_004 19

BOX SCORE:
================================================================================

Team_029
--------------------------------------------------------------------------------
Player                MIN  PTS  REB  AST  TO      FG   FG%      3P   3P%
--------------------------------------------------------------------------------
Devin Butler           12    7    4    0   0   3/4    75.0     0/0   0.0
Paul Iverson           12    3    0    1   0   1/3    33.3     0/0   0.0
Pau Anthony             3    3    1    0   0   2/2   100.0     0/0   0.0
James Wall             12    2    4    1   0   1/2    50.0     0/0   0.0
Giannis Banchero        9    0    2    0   0   0/2     0.0     0/0   0.0
Scottie Bird           12    0    0    0   0   0/3     0.0     0/0   0.0

TEAM: FG: 7/16 (43.8%), 3PT: 2/7 (28.6%), REB: 11 (3 off, 8 def), AST: 2, TO: 5
TEAM FOULS: 4


Team_004
--------------------------------------------------------------------------------
Player                MIN  PTS  REB  AST  TO      FG   FG%      3P   3P%
--------------------------------------------------------------------------------
Jabari Wade             9    7    0    0   0   3/3   100.0     0/0   0.0
Dwyane Irving          12    6    4    1   0   2/5    40.0     0/0   0.0
Anthony Lillard         9    2    4    0   0   1/3    33.3     0/0   0.0
Draymond Fox           12    2    2    2   0   1/1   100.0     0/0   0.0
Shai Beal               3    2    1    0   0   1/2    50.0     0/0   0.0
Michael Curry          12    0    0    0   0   0/2     0.0     0/0   0.0
Russell Barnes          3    0    1    0   0   0/0     0.0     0/0   0.0

TEAM: FG: 8/16 (50.0%), 3PT: 3/8 (37.5%), REB: 12 (3 off, 9 def), AST: 3, TO: 4
TEAM FOULS: 6 [Team_029 in BONUS]

================================================================================

================================================================================
                       2ND QUARTER - Team_029 vs Team_004                       
================================================================================

[12:00] Team_029 possession (Score: 15-19)
Paul Iverson attempts a 3Pt. Contested by Michael Curry (5.5 feet, MAN). Paul Iverson misses. Rebound secured by Dwyane Irving.

[11:44] Team_004 possession (Score: 15-19)
Draymond Fox commits a violation (traveling/carry)! TURNOVER! (dead ball)

[11:44] Substitution (Team_029): Paul Iverson OUT → Immanuel Irving IN (stamina_rule2)

[11:44] Substitution (Team_029): Scottie Bird OUT → Bones Carter IN (stamina_rule2)

[11:44] Substitution (Team_029): Devin Butler OUT → Shai Ball IN (stamina_rule2)

[11:44] Substitution (Team_004): Michael Curry OUT → Karl Reaves IN (stamina_rule2)

[11:44] Substitution (Team_004): Dwyane Irving OUT → Kristaps Green IN (stamina_rule2)

[11:44] Substitution (Team_004): Draymond Fox OUT → Michael Sabonis IN (stamina_rule2)

[11:27] Team_029 possession (Score: 15-19)
Immanuel Irving attempts a 3Pt. Contested by Karl Reaves (5.6 feet, ZONE). Immanuel Irving misses. Rebound secured by Anthony Lillard.

[11:16] Team_004 possession (Score: 15-19)
Michael Sabonis drives to the basket... Michael Sabonis throws a bad pass! Stolen by James Wall! TURNOVER! (live ball)

[11:04] Team_029 possession (Score: 15-19)
FOUL! Shooting foul on Anthony Lillard. Shai Ball to the line for 2 free throws. [Team fouls: 1] (Anthony Lillard: 1 personal fouls)   FT 1/2: MISS   FT 2/2: GOOD Shai Ball makes 1/2 from the line.
Score: 16-19

[10:49] Team_004 possession (Score: 16-19)
Michael Sabonis attempts a Layup. Contested by James Wall (3.1 feet, MAN). Michael Sabonis misses. Rebound secured by Giannis Banchero.

[10:34] Team_029 possession (Score: 16-19)
Bones Carter attempts a 3Pt. Contested by Jabari Wade (4.9 feet, ZONE). Bones Carter misses. Rebound secured by Anthony Lillard.

[10:23] Team_004 possession (Score: 16-19)
Michael Sabonis throws a bad pass! Stolen by James Wall! TURNOVER! (live ball)

[10:10] Team_029 possession (Score: 16-19)
Shai Ball drives and kicks out. Giannis Banchero attempts a Midrange. Contested by Michael Sabonis (4.9 feet, ZONE). GIANNIS BANCHERO MAKES IT! Assist: Immanuel Irving
Score: 18-19

[09:55] Team_004 possession (Score: 18-19)
FOUL! Reach-in foul on James Wall during the drive. [Team fouls: 1] No free throws, side out. (James Wall: 1 personal fouls)

[09:40] Team_004 possession (Score: 18-19)
Michael Sabonis attempts a 3Pt. Contested by James Wall (3.3 feet, MAN). Michael Sabonis misses. Rebound secured by Giannis Banchero.

[09:28] Team_029 possession (Score: 18-19)
FOUL! Offensive foul on Giannis Banchero! Kristaps Green drew the charge! [Team fouls: 2] (Giannis Banchero: 1 personal fouls) TURNOVER! (dead ball)

[09:17] Team_004 possession (Score: 18-19)
FOUL! Offensive foul on Karl Reaves! Immanuel Irving drew the charge! [Team fouls: 2] (Karl Reaves: 1 personal fouls) TURNOVER! (dead ball)

[09:06] Team_029 possession (Score: 18-19)
Bones Carter attempts a Layup. BLOCKED BY KRISTAPS GREEN! Ball deflects out of bounds off Bones Carter.

[08:52] Team_004 possession (Score: 18-19)
Anthony Lillard attempts a Midrange. Contested by James Wall (3.8 feet, ZONE). ANTHONY LILLARD MAKES IT!
Score: 18-21

[08:33] Team_029 possession (Score: 18-21)
Shai Ball attempts a 3Pt. Contested by Anthony Lillard (4.8 feet, MAN). Shai Ball misses. Rebound secured by Kristaps Green.

[08:24] Team_004 possession (Score: 18-21)
Anthony Lillard attempts a Midrange. Contested by James Wall (3.8 feet, ZONE). Anthony Lillard misses. FOUL! Loose ball foul on Shai Ball during the rebound battle. [Team fouls: 3] No free throws, side out. (Shai Ball: 1 personal fouls)

[08:05] Team_004 possession (Score: 18-21)
Karl Reaves makes the Dunk and draws the foul on Immanuel Irving! And-1! Karl Reaves to the line for 1. [Team fouls: 4] (Immanuel Irving: 1 personal fouls)   FT 1/1: GOOD Karl Reaves makes 1/1 from the line.
Score: 18-24

[07:51] Team_029 possession (Score: 18-24)
Shai Ball drives, picks up Anthony Lillard. Help arrives from Karl Reaves! Shai Ball attempts a Dunk. Contested by Karl Reaves (4.9 feet, MAN). SHAI BALL MAKES IT! Assist: Bones Carter
Score: 20-24

[07:37] Team_004 possession (Score: 20-24)
FOUL! Reach-in foul on James Wall during the drive. [IN THE BONUS! 5 team fouls] Michael Sabonis to the line for 2 free throws. (James Wall: 2 personal fouls)   FT 1/2: GOOD   FT 2/2: GOOD Michael Sabonis makes 2/2 from the line.
Score: 20-26

[07:20] Team_029 possession (Score: 20-26)
Giannis Banchero attempts a 3Pt. Contested by Kristaps Green (4.9 feet, MAN). Giannis Banchero misses. Offensive rebound by James Wall! James Wall puts it back in!
Score: 22-26

[07:02] Team_004 possession (Score: 22-26)
Karl Reaves drives to the basket... Karl Reaves throws a bad pass out of bounds! TURNOVER! (dead ball)

[07:02] Substitution (Team_029): Giannis Banchero OUT → Pau Anthony IN (stamina_rule2)

[07:02] Substitution (Team_029): James Wall OUT → Derrick Rozier IN (stamina_rule2)

[07:02] Substitution (Team_004): Jabari Wade OUT → Russell Barnes IN (stamina_rule2)

[07:02] Substitution (Team_004): Anthony Lillard OUT → Shai Beal IN (stamina_rule2)

[06:50] Team_029 possession (Score: 22-26)
Shai Ball drives and kicks out. Derrick Rozier attempts a 3Pt. Contested by Michael Sabonis (4.9 feet, MAN). DERRICK ROZIER MAKES IT! Assist: Bones Carter
Score: 25-26

[06:39] Team_004 possession (Score: 25-26)
FOUL! Reach-in foul on Derrick Rozier during the drive. [IN THE BONUS! 6 team fouls] Michael Sabonis to the line for 2 free throws. (Derrick Rozier: 1 personal fouls)   FT 1/2: GOOD   FT 2/2: GOOD Michael Sabonis makes 2/2 from the line.
Score: 25-28

[06:24] Team_029 possession (Score: 25-28)
Immanuel Irving drives to the basket... FOUL! Offensive foul on Immanuel Irving! Shai Beal drew the charge! [Team fouls: 7] (Immanuel Irving: 2 personal fouls) TURNOVER! (dead ball)

[06:12] Team_004 possession (Score: 25-28)
Shai Beal attempts a 3Pt. Contested by Pau Anthony (3.8 feet, ZONE). SHAI BEAL MAKES IT! Assist: Michael Sabonis
Score: 25-31

[05:52] Team_029 possession (Score: 25-31)
Immanuel Irving attempts a 3Pt. Contested by Karl Reaves (5.6 feet, ZONE). Immanuel Irving misses. Offensive rebound by Pau Anthony! Pau Anthony kicks it out.

[05:41] Team_029 possession (Score: 25-31)
Derrick Rozier drives and kicks out. Immanuel Irving attempts a 3Pt. Contested by Karl Reaves (5.1 feet, MAN). Immanuel Irving misses. Offensive rebound by Derrick Rozier! Derrick Rozier kicks it out.

[05:23] Team_029 possession (Score: 25-31)
Derrick Rozier attempts a Midrange. Contested by Russell Barnes (4.9 feet, ZONE). Derrick Rozier misses. Rebound secured by Shai Beal.

[05:06] Team_004 possession (Score: 25-31)
Kristaps Green drives, Derrick Rozier stays with him. Kristaps Green attempts a Layup. Contested by Derrick Rozier (3.9 feet, ZONE). Kristaps Green misses. Rebound secured by Pau Anthony.

[04:49] Team_029 possession (Score: 25-31)
FOUL! Holding foul on Kristaps Green. [Team fouls: 3] No free throws, side out. (Kristaps Green: 1 personal fouls)

[04:34] Team_029 possession (Score: 25-31)
FOUL! Shooting foul on Kristaps Green. Pau Anthony to the line for 2 free throws. [Team fouls: 4] (Kristaps Green: 2 personal fouls)   FT 1/2: GOOD   FT 2/2: GOOD Pau Anthony makes 2/2 from the line.
Score: 27-31

[04:21] Team_004 possession (Score: 27-31)
Russell Barnes attempts a 3Pt. Wide open! Bones Carter is 6.1 feet away. [MAN] Russell Barnes misses. Rebound secured by Pau Anthony.

[04:09] Team_029 possession (Score: 27-31)
Bones Carter attempts a Midrange. Contested by Russell Barnes (4.7 feet, MAN). Bones Carter misses. Rebound secured by Shai Beal.

[03:55] Team_004 possession (Score: 27-31)
Michael Sabonis attempts a 3Pt. Contested by Derrick Rozier (3.9 feet, MAN). Michael Sabonis misses. Rebound secured by Derrick Rozier.

[03:45] Team_029 possession (Score: 27-31)
Bones Carter attempts a 3Pt. Contested by Russell Barnes (4.7 feet, MAN). Bones Carter misses. Rebound secured by Russell Barnes.

[03:31] Team_004 possession (Score: 27-31)
Kristaps Green attempts a 3Pt. Contested by Pau Anthony (3.7 feet, MAN). KRISTAPS GREEN MAKES IT! Assist: Karl Reaves
Score: 27-34

[03:20] Team_029 possession (Score: 27-34)
FOUL! Holding foul on Michael Sabonis. [IN THE BONUS! 5 team fouls] Derrick Rozier to the line for 2 free throws. (Michael Sabonis: 1 personal fouls)   FT 1/2: GOOD   FT 2/2: GOOD Derrick Rozier makes 2/2 from the line.
Score: 29-34

[03:07] Team_004 possession (Score: 29-34)
FOUL! Shooting foul on Bones Carter. Michael Sabonis to the line for 3 free throws. [BONUS: 8 team fouls] (Bones Carter: 1 personal fouls)   FT 1/3: GOOD   FT 2/3: MISS   FT 3/3: GOOD Michael Sabonis makes 2/3 from the line.
Score: 29-36

[02:53] Team_029 possession (Score: 29-36)
Immanuel Irving attempts a 3Pt. Contested by Karl Reaves (5.8 feet, ZONE). Immanuel Irving misses. Rebound secured by Russell Barnes.

[02:41] Team_004 possession (Score: 29-36)
Kristaps Green attempts a Layup. Contested by Derrick Rozier (3.9 feet, ZONE). Kristaps Green misses. Rebound secured by Shai Ball.

[02:22] Team_029 possession (Score: 29-36)
FOUL! Offensive foul on Immanuel Irving! Karl Reaves drew the charge! [Team fouls: 9] (Immanuel Irving: 3 personal fouls) TURNOVER! (dead ball)

[02:12] Team_004 possession (Score: 29-36)
Shai Beal attempts a Midrange. Contested by Bones Carter (5.9 feet, ZONE). SHAI BEAL MAKES IT!
Score: 29-38

[01:55] Team_029 possession (Score: 29-38)
Shai Ball drives to the basket... Shai Ball throws a bad pass out of bounds! TURNOVER! (dead ball)

[01:42] Team_004 possession (Score: 29-38)
Karl Reaves drives, Derrick Rozier stays with him. Karl Reaves attempts a Layup. Contested by Derrick Rozier (3.4 feet, ZONE). KARL REAVES MAKES IT! Assist: Shai Beal
Score: 29-40

[01:28] Team_029 possession (Score: 29-40)
Pau Anthony attempts a 3Pt. Contested by Kristaps Green (5.1 feet, MAN). Pau Anthony misses. Rebound secured by Michael Sabonis.

[01:15] Team_004 possession (Score: 29-40)
Karl Reaves attempts a Midrange. Contested by Derrick Rozier (3.4 feet, ZONE). Karl Reaves misses. Rebound secured by Derrick Rozier.

[00:57] Team_029 possession (Score: 29-40)
Pau Anthony attempts a 3Pt. Contested by Karl Reaves (5.9 feet, ZONE). Pau Anthony misses. FOUL! Loose ball foul on Russell Barnes during the rebound battle. [IN THE BONUS! 6 team fouls] Derrick Rozier to the line for 2 free throws. (Russell Barnes: 1 personal fouls)   FT 1/2: GOOD   FT 2/2: GOOD Derrick Rozier makes 2/2 from the line.
Score: 31-40

[00:47] Team_004 possession (Score: 31-40)
Russell Barnes attempts a 3Pt. Contested by Pau Anthony (4.3 feet, ZONE). Russell Barnes misses. Offensive rebound by Shai Beal! Shai Beal kicks it out.

[00:34] Team_004 possession (Score: 31-40)
Kristaps Green drives and kicks out. Shai Beal attempts a 3Pt. Contested by Shai Ball (4.3 feet, MAN). Shai Beal misses. Offensive rebound by Russell Barnes! Russell Barnes kicks it out.

[00:24] Team_004 possession (Score: 31-40)
Shai Beal throws a bad pass out of bounds! TURNOVER! (dead ball)

[00:09] Team_029 possession (Score: 31-40)
Immanuel Irving attempts a 3Pt. Wide open! Karl Reaves is 6.0 feet away. [ZONE] IMMANUEL IRVING MAKES IT! Assist: Derrick Rozier
Score: 34-40

================================================================================
                              2ND QUARTER COMPLETE                              
================================================================================

2ND QUARTER SCORE: Team_029 19, Team_004 21

BOX SCORE:
================================================================================

Team_029
--------------------------------------------------------------------------------
Player                MIN  PTS  REB  AST  TO      FG   FG%      3P   3P%
--------------------------------------------------------------------------------
Derrick Rozier          7    7    3    1   0   3/4    75.0     0/0   0.0
Immanuel Irving        12    3    0    1   0   1/3    33.3     0/0   0.0
Shai Ball              12    3    1    0   0   2/3    66.7     0/0   0.0
Giannis Banchero       14    2    2    0   0   1/1   100.0     0/0   0.0
James Wall             17    2    1    0   0   1/1   100.0     0/0   0.0
Pau Anthony            10    2    3    0   0   1/2    50.0     0/0   0.0
Paul Iverson           13    0    0    0   0   0/1     0.0     0/0   0.0
Bones Carter           12    0    0    2   0   0/4     0.0     0/0   0.0

TEAM: FG: 9/19 (47.4%), 3PT: 3/10 (30.0%), REB: 10 (3 off, 7 def), AST: 4, TO: 4
TEAM FOULS: 9 [Team_004 in BONUS]


Team_004
--------------------------------------------------------------------------------
Player                MIN  PTS  REB  AST  TO      FG   FG%      3P   3P%
--------------------------------------------------------------------------------
Michael Sabonis        12    6    1    1   0   3/6    50.0     0/0   0.0
Karl Reaves            12    5    0    1   0   2/3    66.7     0/0   0.0
Shai Beal              10    5    3    1   0   2/2   100.0     0/0   0.0
Kristaps Green         12    3    1    0   0   1/3    33.3     0/0   0.0
Anthony Lillard        14    2    3    0   0   1/1   100.0     0/0   0.0
Dwyane Irving          13    0    1    0   0   0/0     0.0     0/0   0.0
Russell Barnes         10    0    3    0   0   0/1     0.0     0/0   0.0

TEAM: FG: 9/16 (56.2%), 3PT: 3/6 (50.0%), REB: 12 (3 off, 9 def), AST: 3, TO: 6
TEAM FOULS: 6 [Team_029 in BONUS]

================================================================================

================================================================================
                       3RD QUARTER - Team_029 vs Team_004                       
================================================================================

[12:00] Team_029 possession (Score: 34-40)
Giannis Banchero attempts a Midrange. Contested by Dwyane Irving (4.1 feet, MAN). Giannis Banchero misses. Rebound secured by Draymond Fox.

[11:46] Team_004 possession (Score: 34-40)
Jabari Wade attempts a 3Pt. Contested by Scottie Bird (3.8 feet, MAN). Jabari Wade misses. Rebound secured by Devin Butler.

[11:33] Team_029 possession (Score: 34-40)
James Wall makes the Midrange and draws the foul on Draymond Fox! And-1! James Wall to the line for 1. [Team fouls: 1] (Draymond Fox: 1 personal fouls)   FT 1/1: GOOD James Wall makes 1/1 from the line.
Score: 37-40

[11:14] Team_004 possession (Score: 37-40)
Draymond Fox drives and kicks out. Jabari Wade attempts a 3Pt. Contested by Scottie Bird (3.1 feet, MAN). Jabari Wade misses. Offensive rebound by Draymond Fox! Draymond Fox kicks it out.

[10:58] Team_004 possession (Score: 37-40)
FOUL! Shooting foul on Devin Butler. Anthony Lillard to the line for 2 free throws. [Team fouls: 1] (Devin Butler: 1 personal fouls)   FT 1/2: GOOD   FT 2/2: GOOD Anthony Lillard makes 2/2 from the line.
Score: 37-42

[10:47] Team_029 possession (Score: 37-42)
Devin Butler drives, Anthony Lillard stays with him. Devin Butler attempts a Layup. Contested by Anthony Lillard (4.6 feet, ZONE). DEVIN BUTLER MAKES IT!
Score: 39-42

[10:31] Team_004 possession (Score: 39-42)
Anthony Lillard attempts a Midrange. Contested by Devin Butler (4.5 feet, MAN). ANTHONY LILLARD MAKES IT!
Score: 39-44

[10:13] Team_029 possession (Score: 39-44)
James Wall attempts a Midrange. BLOCKED BY DRAYMOND FOX! Ball is loose! Offensive rebound by Devin Butler! Devin Butler kicks it out.

[10:01] Team_029 possession (Score: 39-44)
James Wall attempts a Midrange. Contested by Draymond Fox (4.7 feet, MAN). James Wall misses. Rebound secured by Draymond Fox.

[09:44] Team_004 possession (Score: 39-44)
Dwyane Irving drives, James Wall stays with him. Dwyane Irving attempts a Dunk. Contested by James Wall (2.9 feet, ZONE). DWYANE IRVING MAKES IT!
Score: 39-46

[09:30] Team_029 possession (Score: 39-46)
Giannis Banchero attempts a 3Pt. Contested by Dwyane Irving (4.1 feet, MAN). GIANNIS BANCHERO MAKES IT! Assist: James Wall
Score: 42-46

[09:17] Team_004 possession (Score: 42-46)
Draymond Fox attempts a Layup. Contested by James Wall (3.0 feet, MAN). Draymond Fox misses. Offensive rebound by Draymond Fox! Draymond Fox kicks it out.

[09:02] Team_004 possession (Score: 42-46)
Draymond Fox drives and kicks out. Draymond Fox attempts a 3Pt. Contested by Giannis Banchero (3.5 feet, ZONE). Draymond Fox misses. Offensive rebound by Anthony Lillard! Anthony Lillard kicks it out.

[08:45] Team_004 possession (Score: 42-46)
Dwyane Irving attempts a Layup. BLOCKED BY GIANNIS BANCHERO! Ball goes out off Giannis Banchero. Dwyane Irving's ball!

[08:31] Team_004 possession (Score: 42-46)
Draymond Fox attempts a Layup. BLOCKED BY JAMES WALL! Ball deflects out of bounds off Draymond Fox.

[08:17] Team_029 possession (Score: 42-46)
Scottie Bird drives and kicks out. James Wall attempts a Midrange. Contested by Jabari Wade (4.7 feet, ZONE). James Wall misses. Rebound secured by Anthony Lillard.

[08:02] Team_004 possession (Score: 42-46)
FOUL! Reach-in foul on James Wall during the drive. [Team fouls: 2] No free throws, side out. (James Wall: 1 personal fouls)

[07:46] Team_004 possession (Score: 42-46)
Draymond Fox drives, picks up James Wall. Help arrives from Scottie Bird! Draymond Fox attempts a Layup. Contested by Scottie Bird (3.0 feet, ZONE). Draymond Fox misses. Rebound secured by Giannis Banchero.

[07:30] Team_029 possession (Score: 42-46)
James Wall throws a bad pass! Stolen by Draymond Fox! TURNOVER! (live ball)

[07:17] Team_004 possession (Score: 42-46)
Anthony Lillard attempts a Layup. Contested by Devin Butler (4.5 feet, MAN). ANTHONY LILLARD MAKES IT! Assist: Draymond Fox
Score: 42-48

[07:00] Team_029 possession (Score: 42-48)
James Wall makes the Layup and draws the foul on Anthony Lillard! And-1! James Wall to the line for 1. [Team fouls: 2] (Anthony Lillard: 1 personal fouls)   FT 1/1: GOOD James Wall makes 1/1 from the line.
Score: 45-48

[06:50] Team_004 possession (Score: 45-48)
Michael Curry attempts a 3Pt. Contested by Paul Iverson (4.4 feet, MAN). Michael Curry misses. Offensive rebound by Draymond Fox! Draymond Fox kicks it out.

[06:33] Team_004 possession (Score: 45-48)
Anthony Lillard attempts a 3Pt. Contested by Giannis Banchero (4.0 feet, ZONE). ANTHONY LILLARD MAKES IT! Assist: Jabari Wade
Score: 45-51

[06:24] Team_029 possession (Score: 45-51)
James Wall drives and kicks out. Scottie Bird attempts a Midrange. Contested by Dwyane Irving (3.5 feet, ZONE). Scottie Bird misses. Rebound secured by Draymond Fox.

[06:09] Team_004 possession (Score: 45-51)
Draymond Fox attempts a Midrange. Contested by Scottie Bird (3.5 feet, ZONE). Draymond Fox misses. Rebound secured by James Wall.

[05:57] Team_029 possession (Score: 45-51)
Scottie Bird attempts a 3Pt. Contested by Michael Curry (5.3 feet, ZONE). Scottie Bird misses. Rebound secured by Draymond Fox.

[05:44] Team_004 possession (Score: 45-51)
Anthony Lillard attempts a 3Pt. Contested by Devin Butler (4.5 feet, MAN). ANTHONY LILLARD MAKES IT! Assist: Dwyane Irving
Score: 45-54

[05:32] Team_029 possession (Score: 45-54)
Giannis Banchero attempts a 3Pt. Contested by Jabari Wade (5.3 feet, ZONE). Giannis Banchero misses. Rebound secured by Dwyane Irving.

[05:16] Team_004 possession (Score: 45-54)
Jabari Wade drives and kicks out. Draymond Fox attempts a 3Pt. Contested by Giannis Banchero (3.6 feet, ZONE). Draymond Fox misses. Rebound secured by Devin Butler.

[05:02] Team_029 possession (Score: 45-54)
James Wall drives, Draymond Fox stays with him. James Wall attempts a Layup. Contested by Draymond Fox (4.7 feet, MAN). JAMES WALL MAKES IT! Assist: Paul Iverson
Score: 47-54

[04:50] Team_004 possession (Score: 47-54)
Draymond Fox attempts a Midrange. Contested by James Wall (3.0 feet, MAN). Draymond Fox misses. Offensive rebound by Anthony Lillard! Anthony Lillard kicks it out.

[04:38] Team_004 possession (Score: 47-54)
Draymond Fox drives and kicks out. Draymond Fox attempts a Midrange. Contested by James Wall (2.7 feet, MAN). Draymond Fox misses. Rebound secured by James Wall.

[04:22] Team_029 possession (Score: 47-54)
Paul Iverson throws a bad pass out of bounds! TURNOVER! (dead ball)

[04:11] Team_004 possession (Score: 47-54)
FOUL! Holding foul on Giannis Banchero. [Team fouls: 3] No free throws, side out. (Giannis Banchero: 1 personal fouls)

[03:56] Team_004 possession (Score: 47-54)
Anthony Lillard drives to the basket... Anthony Lillard loses control! Ball rolls out of bounds! TURNOVER! (dead ball)

[03:38] Team_029 possession (Score: 47-54)
Giannis Banchero attempts a 3Pt. Contested by Michael Curry (5.7 feet, ZONE). Giannis Banchero misses. Offensive rebound by Devin Butler! Devin Butler kicks it out.

[03:25] Team_029 possession (Score: 47-54)
James Wall makes the Layup and draws the foul on Anthony Lillard! And-1! James Wall to the line for 1. [Team fouls: 3] (Anthony Lillard: 2 personal fouls)   FT 1/1: GOOD James Wall makes 1/1 from the line.
Score: 50-54

[03:07] Team_004 possession (Score: 50-54)
FOUL! Holding foul on Giannis Banchero. [Team fouls: 4] No free throws, side out. (Giannis Banchero: 2 personal fouls)

[02:49] Team_004 possession (Score: 50-54)
Dwyane Irving drives to the basket... FOUL! Offensive foul on Dwyane Irving! James Wall drew the charge! [Team fouls: 4] (Dwyane Irving: 1 personal fouls) TURNOVER! (dead ball)

[02:32] Team_029 possession (Score: 50-54)
FOUL! Reach-in foul on Anthony Lillard during the drive. [IN THE BONUS! 5 team fouls] James Wall to the line for 2 free throws. (Anthony Lillard: 3 personal fouls)   FT 1/2: GOOD   FT 2/2: GOOD James Wall makes 2/2 from the line.
Score: 52-54

[02:20] Team_004 possession (Score: 52-54)
Dwyane Irving drives to the basket... Dwyane Irving loses control! Ball rolls out of bounds! TURNOVER! (dead ball)

[02:20] Substitution (Team_029): Scottie Bird OUT → Bones Carter IN (stamina_rule2)

[02:20] Substitution (Team_029): Giannis Banchero OUT → Pau Anthony IN (stamina_rule2)

[02:20] Substitution (Team_029): Devin Butler OUT → Shai Ball IN (stamina_rule2)

[02:20] Substitution (Team_004): Michael Curry OUT → Karl Reaves IN (stamina_rule2)

[02:20] Substitution (Team_004): Jabari Wade OUT → Russell Barnes IN (stamina_rule2)

[02:20] Substitution (Team_004): Draymond Fox OUT → Michael Sabonis IN (stamina_rule2)

[02:20] Substitution (Team_004): Anthony Lillard OUT → Shai Beal IN (stamina_rule2)

[02:04] Team_029 possession (Score: 52-54)
James Wall attempts a Midrange. Contested by Michael Sabonis (5.4 feet, MAN). JAMES WALL MAKES IT!
Score: 54-54

[01:49] Team_004 possession (Score: 54-54)
FOUL! Reach-in foul on Shai Ball during the drive. [IN THE BONUS! 5 team fouls] Shai Beal to the line for 2 free throws. (Shai Ball: 1 personal fouls)   FT 1/2: GOOD   FT 2/2: GOOD Shai Beal makes 2/2 from the line.
Score: 54-56

[01:36] Team_029 possession (Score: 54-56)
FOUL! Shooting foul on Dwyane Irving. Pau Anthony to the line for 2 free throws. [BONUS: 6 team fouls] (Dwyane Irving: 2 personal fouls)   FT 1/2: MISS   FT 2/2: GOOD Pau Anthony makes 1/2 from the line.
Score: 55-56

[01:18] Team_004 possession (Score: 55-56)
Dwyane Irving attempts a 3Pt. Contested by Pau Anthony (3.9 feet, MAN). Dwyane Irving misses. Rebound secured by Shai Ball.

[01:03] Team_029 possession (Score: 55-56)
Shai Ball attempts a Midrange. Contested by Russell Barnes (4.9 feet, ZONE). Shai Ball misses. Rebound secured by Michael Sabonis.

[00:50] Team_004 possession (Score: 55-56)
Russell Barnes attempts a 3Pt. Wide open! Bones Carter is 6.1 feet away. [MAN] Russell Barnes misses. Rebound secured by Pau Anthony.

[00:36] Team_029 possession (Score: 55-56)
Paul Iverson drives, picks up Karl Reaves. Help arrives from Russell Barnes! Paul Iverson attempts a Dunk. Contested by Russell Barnes (5.2 feet, MAN). PAUL IVERSON MAKES IT! Assist: Bones Carter
Score: 57-56

[00:20] Team_004 possession (Score: 57-56)
Michael Sabonis attempts a 3Pt. Contested by Pau Anthony (3.7 feet, ZONE). Michael Sabonis misses. Rebound secured by Pau Anthony.

[00:03] Team_029 possession (Score: 57-56)
Pau Anthony drives and kicks out. Bones Carter attempts a Midrange. Contested by Dwyane Irving (4.1 feet, ZONE). Bones Carter misses. Rebound secured by Shai Beal.

================================================================================
                              3RD QUARTER COMPLETE                              
================================================================================

3RD QUARTER SCORE: Team_029 23, Team_004 16

BOX SCORE:
================================================================================

Team_029
--------------------------------------------------------------------------------
Player                MIN  PTS  REB  AST  TO      FG   FG%      3P   3P%
--------------------------------------------------------------------------------
James Wall             29   15    2    1   0   6/8    75.0     0/0   0.0
Giannis Banchero       24    3    1    0   0   1/3    33.3     0/0   0.0
Devin Butler           22    2    4    0   0   1/1   100.0     0/0   0.0
Paul Iverson           25    2    0    1   0   1/1   100.0     0/0   0.0
Pau Anthony            12    1    2    0   0   1/2    50.0     0/0   0.0
Scottie Bird           22    0    0    0   0   0/2     0.0     0/0   0.0
Shai Ball              14    0    1    0   0   0/1     0.0     0/0   0.0
Bones Carter           14    0    0    1   0   0/0     0.0     0/0   0.0

TEAM: FG: 10/18 (55.6%), 3PT: 1/3 (33.3%), REB: 10 (2 off, 8 def), AST: 3, TO: 2
TEAM FOULS: 5 [Team_004 in BONUS]


Team_004
--------------------------------------------------------------------------------
Player                MIN  PTS  REB  AST  TO      FG   FG%      3P   3P%
--------------------------------------------------------------------------------
Anthony Lillard        24   12    3    0   0   5/5   100.0     0/0   0.0
Dwyane Irving          25    2    1    1   0   1/2    50.0     0/0   0.0
Shai Beal              12    2    1    0   0   1/1   100.0     0/0   0.0
Draymond Fox           22    0    7    1   0   0/4     0.0     0/0   0.0
Jabari Wade            24    0    0    1   0   0/2     0.0     0/0   0.0
Michael Sabonis        14    0    1    0   0   0/1     0.0     0/0   0.0
Russell Barnes         12    0    0    0   0   0/1     0.0     0/0   0.0

TEAM: FG: 7/16 (43.8%), 3PT: 2/6 (33.3%), REB: 13 (5 off, 8 def), AST: 3, TO: 3
TEAM FOULS: 6 [Team_029 in BONUS]

================================================================================

================================================================================
                       4TH QUARTER - Team_029 vs Team_004                       
================================================================================

[12:00] Team_029 possession (Score: 57-56)
Giannis Banchero attempts a Layup. Contested by Dwyane Irving (4.4 feet, MAN). Giannis Banchero misses. Offensive rebound by James Wall! James Wall puts it back in!
Score: 59-56

[11:51] Team_004 possession (Score: 59-56)
Jabari Wade attempts a 3Pt. Contested by Giannis Banchero (4.3 feet, ZONE). Jabari Wade misses. Rebound secured by Giannis Banchero.

[11:41] Team_029 possession (Score: 59-56)
Devin Butler drives, Anthony Lillard stays with him. Devin Butler attempts a Dunk. Contested by Anthony Lillard (4.7 feet, MAN). DEVIN BUTLER MAKES IT! Assist: Paul Iverson
Score: 61-56

[11:27] Team_004 possession (Score: 61-56)
Michael Curry drives, Paul Iverson stays with him. Michael Curry attempts a Layup. Contested by Paul Iverson (4.8 feet, MAN). MICHAEL CURRY MAKES IT! Assist: Dwyane Irving
Score: 61-58

[11:09] Team_029 possession (Score: 61-58)
FOUL! Shooting foul on Draymond Fox. James Wall to the line for 2 free throws. [Team fouls: 1] (Draymond Fox: 1 personal fouls)   FT 1/2: GOOD   FT 2/2: GOOD James Wall makes 2/2 from the line.
Score: 63-58

[10:52] Team_004 possession (Score: 63-58)
Dwyane Irving attempts a Layup. Contested by Giannis Banchero (4.0 feet, MAN). DWYANE IRVING MAKES IT!
Score: 63-60

[10:38] Team_029 possession (Score: 63-60)
James Wall attempts a 3Pt. Contested by Michael Curry (5.6 feet, ZONE). James Wall misses. Rebound secured by Anthony Lillard.

[10:23] Team_004 possession (Score: 63-60)
Michael Curry attempts a Layup. Contested by Paul Iverson (4.9 feet, MAN). MICHAEL CURRY MAKES IT!
Score: 63-62

[10:09] Team_029 possession (Score: 63-62)
James Wall drives to the basket... James Wall loses the ball! Stripped by Draymond Fox! TURNOVER! (live ball)

[09:55] Team_004 possession (Score: 63-62)
Anthony Lillard makes the Layup and draws the foul on Scottie Bird! And-1! Anthony Lillard to the line for 1. [Team fouls: 1] (Scottie Bird: 1 personal fouls)   FT 1/1: GOOD Anthony Lillard makes 1/1 from the line.
Score: 63-65

[09:39] Team_029 possession (Score: 63-65)
FOUL! Reach-in foul on Anthony Lillard during the drive. [Team fouls: 2] No free throws, side out. (Anthony Lillard: 1 personal fouls)

[09:22] Team_029 possession (Score: 63-65)
FOUL! Holding foul on Anthony Lillard. [Team fouls: 3] No free throws, side out. (Anthony Lillard: 2 personal fouls)

[09:06] Team_029 possession (Score: 63-65)
Paul Iverson attempts a 3Pt. Contested by Michael Curry (5.4 feet, ZONE). PAUL IVERSON MAKES IT! Assist: Devin Butler
Score: 66-65

[08:53] Team_004 possession (Score: 66-65)
FOUL! Reach-in foul on Paul Iverson during the drive. [Team fouls: 2] No free throws, side out. (Paul Iverson: 1 personal fouls)

[08:34] Team_004 possession (Score: 66-65)
Draymond Fox drives, picks up James Wall. Help arrives from Scottie Bird! Draymond Fox attempts a Dunk. Contested by Scottie Bird (3.7 feet, ZONE). Draymond Fox misses. Rebound secured by Devin Butler.

[08:15] Team_029 possession (Score: 66-65)
Devin Butler attempts a Layup. Contested by Anthony Lillard (5.0 feet, ZONE). DEVIN BUTLER MAKES IT!
Score: 68-65

[07:58] Team_004 possession (Score: 68-65)
Draymond Fox drives, James Wall stays with him. Draymond Fox attempts a Dunk. Contested by James Wall (3.8 feet, MAN). DRAYMOND FOX MAKES IT!
Score: 68-67

[07:44] Team_029 possession (Score: 68-67)
Giannis Banchero attempts a Layup. Contested by Anthony Lillard (5.1 feet, ZONE). GIANNIS BANCHERO MAKES IT!
Score: 70-67

[07:28] Team_004 possession (Score: 70-67)
Anthony Lillard attempts a Layup. Contested by Devin Butler (4.9 feet, MAN). ANTHONY LILLARD MAKES IT!
Score: 70-69

[07:16] Team_029 possession (Score: 70-69)
James Wall attempts a 3Pt. Contested by Michael Curry (5.9 feet, ZONE). James Wall misses. Rebound secured by Dwyane Irving.

[07:02] Team_004 possession (Score: 70-69)
Dwyane Irving attempts a 3Pt. Contested by Giannis Banchero (4.4 feet, ZONE). Dwyane Irving misses. Offensive rebound by Draymond Fox! Draymond Fox kicks it out.

[06:44] Team_004 possession (Score: 70-69)
Michael Curry attempts a 3Pt. Contested by Paul Iverson (5.3 feet, MAN). Michael Curry misses. Rebound secured by James Wall.

[06:29] Team_029 possession (Score: 70-69)
FOUL! Offensive foul on Giannis Banchero! Dwyane Irving drew the charge! [Team fouls: 3] (Giannis Banchero: 1 personal fouls) TURNOVER! (dead ball)

[06:18] Team_004 possession (Score: 70-69)
Anthony Lillard attempts a Midrange. Contested by Scottie Bird (4.1 feet, ZONE). Anthony Lillard misses. Rebound secured by Giannis Banchero.

[06:04] Team_029 possession (Score: 70-69)
Scottie Bird attempts a 3Pt. Contested by Jabari Wade (5.6 feet, MAN). Scottie Bird misses. Rebound secured by Anthony Lillard.

[05:51] Team_004 possession (Score: 70-69)
Michael Curry attempts a 3Pt. Contested by Giannis Banchero (4.5 feet, ZONE). Michael Curry misses. Rebound secured by Giannis Banchero.

[05:37] Team_029 possession (Score: 70-69)
Paul Iverson attempts a 3Pt. Contested by Michael Curry (5.7 feet, ZONE). PAUL IVERSON MAKES IT! Assist: James Wall
Score: 73-69

[05:22] Team_004 possession (Score: 73-69)
Draymond Fox attempts a Midrange. Contested by James Wall (4.2 feet, MAN). DRAYMOND FOX MAKES IT! Assist: Michael Curry
Score: 73-71

[05:07] Team_029 possession (Score: 73-71)
Paul Iverson drives and kicks out. Giannis Banchero attempts a Midrange. Contested by Draymond Fox (5.0 feet, ZONE). Giannis Banchero misses. Offensive rebound by James Wall! James Wall puts it back in!
Score: 75-71

[04:53] Team_004 possession (Score: 75-71)
Michael Curry attempts a Midrange. Contested by Giannis Banchero (4.6 feet, ZONE). Michael Curry misses. Rebound secured by Devin Butler.

[04:38] Team_029 possession (Score: 75-71)
Devin Butler attempts a Midrange. Contested by Draymond Fox (5.4 feet, ZONE). Devin Butler misses. Rebound secured by Dwyane Irving.

[04:28] Team_004 possession (Score: 75-71)
Dwyane Irving attempts a Midrange. Contested by James Wall (4.2 feet, ZONE). Dwyane Irving misses. Rebound secured by James Wall.

[04:18] Team_029 possession (Score: 75-71)
FOUL! Shooting foul on Anthony Lillard. Devin Butler to the line for 2 free throws. [Team fouls: 4] (Anthony Lillard: 3 personal fouls)   FT 1/2: GOOD   FT 2/2: GOOD Devin Butler makes 2/2 from the line.
Score: 77-71

[04:05] Team_004 possession (Score: 77-71)
Michael Curry commits a violation (traveling/carry)! TURNOVER! (dead ball)

[04:05] Substitution (Team_029): Paul Iverson OUT → Immanuel Irving IN (stamina_rule2)

[04:05] Substitution (Team_029): Scottie Bird OUT → Bones Carter IN (stamina_rule2)

[04:05] Substitution (Team_029): Giannis Banchero OUT → Pau Anthony IN (stamina_rule2)

[04:05] Substitution (Team_029): James Wall OUT → Derrick Rozier IN (stamina_rule2)

[04:05] Substitution (Team_029): Devin Butler OUT → Shai Ball IN (stamina_rule2)

[04:05] Substitution (Team_004): Michael Curry OUT → Karl Reaves IN (stamina_rule2)

[04:05] Substitution (Team_004): Jabari Wade OUT → Russell Barnes IN (stamina_rule2)

[04:05] Substitution (Team_004): Dwyane Irving OUT → Kristaps Green IN (stamina_rule2)

[04:05] Substitution (Team_004): Draymond Fox OUT → Michael Sabonis IN (stamina_rule2)

[04:05] Substitution (Team_004): Anthony Lillard OUT → Shai Beal IN (stamina_rule2)

[03:50] Team_029 possession (Score: 77-71)
Derrick Rozier makes the Layup and draws the foul on Michael Sabonis! And-1! Derrick Rozier to the line for 1. [BONUS: 5 team fouls] (Michael Sabonis: 1 personal fouls)   FT 1/1: GOOD Derrick Rozier makes 1/1 from the line.
Score: 80-71

[03:38] Team_004 possession (Score: 80-71)
Kristaps Green attempts a 3Pt. Contested by Pau Anthony (3.7 feet, ZONE). Kristaps Green misses. Rebound secured by Derrick Rozier.

[03:22] Team_029 possession (Score: 80-71)
Immanuel Irving drives, picks up Karl Reaves. Help arrives from Russell Barnes! Immanuel Irving attempts a Layup. Contested by Russell Barnes (5.6 feet, MAN). Immanuel Irving misses. Rebound secured by Shai Beal.

[03:07] Team_004 possession (Score: 80-71)
Karl Reaves attempts a Midrange. Contested by Immanuel Irving (4.7 feet, MAN). KARL REAVES MAKES IT! Assist: Russell Barnes
Score: 80-73

[02:47] Team_029 possession (Score: 80-73)
Derrick Rozier attempts a Layup. BLOCKED BY RUSSELL BARNES! Ball is loose! Rebound secured by Shai Beal.

[02:31] Team_004 possession (Score: 80-73)
Shai Beal attempts a Midrange. Contested by Pau Anthony (3.8 feet, ZONE). Shai Beal misses. Rebound secured by Pau Anthony.

[02:14] Team_029 possession (Score: 80-73)
Bones Carter attempts a 3Pt. Contested by Karl Reaves (5.2 feet, ZONE). Bones Carter misses. Rebound secured by Russell Barnes.

[02:02] Team_004 possession (Score: 80-73)
Michael Sabonis drives, picks up Derrick Rozier. Help arrives from Bones Carter! Michael Sabonis attempts a Layup. Contested by Bones Carter (4.0 feet, MAN). MICHAEL SABONIS MAKES IT!
Score: 80-75

[01:46] Team_029 possession (Score: 80-75)
Immanuel Irving attempts a 3Pt. Contested by Karl Reaves (5.6 feet, ZONE). Immanuel Irving misses. Offensive rebound by Derrick Rozier! Derrick Rozier kicks it out.

[01:32] Team_029 possession (Score: 80-75)
Bones Carter attempts a Midrange. Contested by Michael Sabonis (5.0 feet, ZONE). Bones Carter misses. Rebound secured by Shai Beal.

[01:16] Team_004 possession (Score: 80-75)
Karl Reaves makes the Layup and draws the foul on Bones Carter! And-1! Karl Reaves to the line for 1. [Team fouls: 4] (Bones Carter: 1 personal fouls)   FT 1/1: MISS Karl Reaves makes 0/1 from the line. Offensive rebound by Russell Barnes! Russell Barnes kicks it out.
Score: 80-77

[01:01] Team_004 possession (Score: 80-77)
FOUL! Shooting foul on Bones Carter. Karl Reaves to the line for 2 free throws. [BONUS: 5 team fouls] (Bones Carter: 2 personal fouls)   FT 1/2: GOOD   FT 2/2: GOOD Karl Reaves makes 2/2 from the line.
Score: 80-79

[00:45] Team_029 possession (Score: 80-79)
Bones Carter attempts a 3Pt. Contested by Karl Reaves (5.2 feet, ZONE). Bones Carter misses. Rebound secured by Shai Beal.

[00:33] Team_004 possession (Score: 80-79)
Shai Beal drives and kicks out. Russell Barnes attempts a Midrange. Contested by Bones Carter (5.5 feet, MAN). RUSSELL BARNES MAKES IT! Assist: Michael Sabonis
Score: 80-81

[00:18] Team_029 possession (Score: 80-81)
Immanuel Irving attempts a 3Pt. BLOCKED BY KARL REAVES! Ball is loose! Rebound secured by Shai Beal.

[00:06] Team_004 possession (Score: 80-81)
FOUL! Shooting foul on Derrick Rozier. Michael Sabonis to the line for 2 free throws. [BONUS: 6 team fouls] (Derrick Rozier: 1 personal fouls)   FT 1/2: MISS   FT 2/2: MISS Michael Sabonis makes 0/2 from the line. FOUL! Loose ball foul on Pau Anthony during the free throw rebound! [IN THE BONUS! 7 team fouls] Russell Barnes to the line for 2 free throws. (Pau Anthony: 1 personal fouls)   FT 1/2: GOOD   FT 2/2: GOOD Russell Barnes makes 2/2 from the line.
Score: 80-83

================================================================================
                              4TH QUARTER COMPLETE                              
================================================================================

4TH QUARTER SCORE: Team_029 23, Team_004 27

BOX SCORE:
================================================================================

Team_029
--------------------------------------------------------------------------------
Player                MIN  PTS  REB  AST  TO      FG   FG%      3P   3P%
--------------------------------------------------------------------------------
James Wall             37    6    4    1   0   3/5    60.0     0/0   0.0
Devin Butler           31    6    2    1   0   3/4    75.0     0/0   0.0
Paul Iverson           33    6    0    1   0   2/2   100.0     0/0   0.0
Derrick Rozier         11    3    2    0   0   1/2    50.0     0/0   0.0
Giannis Banchero       32    2    3    0   0   1/1   100.0     0/0   0.0
Scottie Bird           31    0    0    0   0   0/1     0.0     0/0   0.0
Immanuel Irving        16    0    0    0   0   0/2     0.0     0/0   0.0
Pau Anthony            16    0    1    0   0   0/0     0.0     0/0   0.0
Bones Carter           18    0    0    0   0   0/3     0.0     0/0   0.0

TEAM: FG: 10/20 (50.0%), 3PT: 2/8 (25.0%), REB: 12 (3 off, 9 def), AST: 3, TO: 2
TEAM FOULS: 7 [Team_004 in BONUS]


Team_004
--------------------------------------------------------------------------------
Player                MIN  PTS  REB  AST  TO      FG   FG%      3P   3P%
--------------------------------------------------------------------------------
Anthony Lillard        32    5    2    0   0   2/3    66.7     0/0   0.0
Michael Curry          31    4    0    1   0   2/5    40.0     0/0   0.0
Draymond Fox           31    4    1    0   0   2/3    66.7     0/0   0.0
Karl Reaves            18    4    0    0   0   2/2   100.0     0/0   0.0
Russell Barnes         16    4    2    1   0   2/2   100.0     0/0   0.0
Dwyane Irving          33    2    2    1   0   1/2    50.0     0/0   0.0
Michael Sabonis        18    2    0    1   0   1/1   100.0     0/0   0.0
Jabari Wade            32    0    0    0   0   0/1     0.0     0/0   0.0
Kristaps Green         16    0    0    0   0   0/1     0.0     0/0   0.0
Shai Beal              16    0    5    0   0   0/1     0.0     0/0   0.0

TEAM: FG: 12/21 (57.1%), 3PT: 0/4 (0.0%), REB: 12 (2 off, 10 def), AST: 4, TO: 1
TEAM FOULS: 5 [Team_029 in BONUS]

================================================================================

================================================================================
                               FULL GAME COMPLETE                               
================================================================================

FINAL SCORE: Team_029 80, Team_004 83

SCORING BY QUARTER:
--------------------------------------------------------------------------------
Team                     Q1     Q2     Q3     Q4    FINAL
--------------------------------------------------------------------------------
Team_029                 15     19     23     23       80
Team_004                 19     21     16     27       83
--------------------------------------------------------------------------------

FULL GAME BOX SCORE:
================================================================================

Team_029
--------------------------------------------------------------------------------
Player                MIN  PTS  REB  AST  TO      FG   FG%      3P   3P%      FT STL BLK
--------------------------------------------------------------------------------
James Wall             37   25   11    3   3   7/12   58.3   0/3     0.0   7/7     5   1
Paul Iverson           33   11    0    3   3   6/9    66.7   4/5    80.0   3/3     0   0
Giannis Banchero       32    7    8    0   2   4/8    50.0   2/5    40.0   0/0     0   1
Scottie Bird           31    0    0    0   0   0/6     0.0   0/4     0.0   0/0     0   0
Devin Butler           31   15   10    1   1   7/9    77.8   0/0     0.0   7/7     0   0
Bones Carter           18    0    0    3   2   0/7     0.0   0/4     0.0   0/0     0   0
Shai Ball              18    3    2    0   0   4/6    66.7   0/1     0.0   1/2     0   0
Pau Anthony            16    6    7    0   1   5/7    71.4   1/2    50.0   4/6     0   0
Immanuel Irving        16    3    0    1   1   1/5    20.0   1/4    25.0   0/0     0   0
Derrick Rozier         11   10    5    1   0   1/3    33.3   0/0     0.0   5/5     0   0

TEAM: FG: 36/73 (49.3%), 3PT: 8/28 (28.6%), REB: 43 (11 off, 32 def), AST: 12, TO: 13


Team_004
--------------------------------------------------------------------------------
Player                MIN  PTS  REB  AST  TO      FG   FG%      3P   3P%      FT STL BLK
--------------------------------------------------------------------------------
Dwyane Irving          33   10    8    3   1   4/9    44.4   2/5    40.0   0/0     0   0
Jabari Wade            32    7    0    1   0   3/6    50.0   1/3    33.3   2/2     0   0
Anthony Lillard        32   21   12    0   0   9/12   75.0   2/3    66.7   3/3     0   0
Michael Curry          31    4    0    1   4   2/7    28.6   0/3     0.0   0/0     0   0
Draymond Fox           31    6   10    3   4   3/8    37.5   0/0     0.0   0/0     4   1
Karl Reaves            18    9    0    1   1   4/5    80.0   0/0     0.0   3/4     0   1
Michael Sabonis        18    8    2    2   3   5/9    55.6   1/4    25.0   6/9     0   0
Russell Barnes         16    4    6    1   0   0/2     0.0   0/2     0.0   0/0     0   1
Shai Beal              16    9   10    1   1   5/7    71.4   1/2    50.0   2/2     0   0
Kristaps Green         16    3    1    0   0   1/4    25.0   1/2    50.0   0/0     0   1

TEAM: FG: 36/69 (52.2%), 3PT: 8/24 (33.3%), REB: 49 (13 off, 36 def), AST: 13, TO: 14

================================================================================
