================================================================================
                        FULL GAME - Team_068 vs Team_070                        
================================================================================

================================================================================
                       1ST QUARTER - Team_068 vs Team_070                       
================================================================================

[12:00] Team_068 possession (Score: 0-0)
Jaren Johnson attempts a 3Pt. Contested by John Hyland (5.0 feet, MAN). JAREN JOHNSON MAKES IT! Assist: Zion Anunoby
Score: 3-0

[11:47] Team_070 possession (Score: 3-0)
Khris Bryant attempts a Layup. Contested by Gary Simons (3.1 feet, ZONE). KHRIS BRYANT MAKES IT! Assist: LeBron Barnes
Score: 3-2

[11:31] Team_068 possession (Score: 3-2)
Zion Anunoby drives, picks up Khris Bryant. Help arrives from LeBron Barnes! Zion Anunoby attempts a Dunk. Contested by LeBron Barnes (2.8 feet, ZONE). Zion Anunoby misses. Offensive rebound by Nikola Ginobili! Nikola Ginobili puts it back in!
Score: 5-2

[11:16] Team_070 possession (Score: 5-2)
LeBron Barnes attempts a 3Pt. Contested by Malcolm Herro (4.6 feet, MAN). LeBron Barnes misses. Rebound secured by Gary Simons.

[11:05] Team_068 possession (Score: 5-2)
Nikola Ginobili commits a violation (traveling/carry)! TURNOVER! (dead ball)

[10:54] Team_070 possession (Score: 5-2)
John Hyland attempts a Midrange. Contested by Jaren Johnson (3.5 feet, ZONE). JOHN HYLAND MAKES IT! Assist: Cole Gasol
Score: 5-4

[10:43] Team_068 possession (Score: 5-4)
Jaren Johnson attempts a 3Pt. Contested by John Hyland (5.0 feet, MAN). Jaren Johnson misses. Offensive rebound by Jaren Johnson! Jaren Johnson kicks it out.

[10:30] Team_068 possession (Score: 5-4)
Gary Simons attempts a Midrange. Contested by LeBron Barnes (4.3 feet, ZONE). GARY SIMONS MAKES IT! Assist: Malcolm Herro
Score: 7-4

[10:17] Team_070 possession (Score: 7-4)
Khris Bryant attempts a Midrange. Contested by Gary Simons (3.1 feet, MAN). Khris Bryant misses. Rebound secured by Gary Simons.

[10:06] Team_068 possession (Score: 7-4)
FOUL! Shooting foul on Khris Bryant. Nikola Ginobili to the line for 2 free throws. [Team fouls: 1] (Khris Bryant: 1 personal fouls)   FT 1/2: MISS   FT 2/2: GOOD Nikola Ginobili makes 1/2 from the line.
Score: 8-4

[09:55] Team_070 possession (Score: 8-4)
Jabari Paul attempts a Midrange. Contested by Jaren Johnson (4.3 feet, ZONE). Jabari Paul misses. Rebound secured by Gary Simons.

[09:39] Team_068 possession (Score: 8-4)
FOUL! Reach-in foul on Khris Bryant during the drive. [Team fouls: 2] No free throws, side out. (Khris Bryant: 2 personal fouls)

[09:23] Team_068 possession (Score: 8-4)
Gary Simons makes the Layup and draws the foul on Khris Bryant! And-1! Gary Simons to the line for 1. [Team fouls: 3] (Khris Bryant: 3 personal fouls)   FT 1/1: GOOD Gary Simons makes 1/1 from the line.
Score: 11-4

[09:06] Team_070 possession (Score: 11-4)
FOUL! Shooting foul on Nikola Ginobili. Cole Gasol to the line for 2 free throws. [Team fouls: 1] (Nikola Ginobili: 1 personal fouls)   FT 1/2: GOOD   FT 2/2: GOOD Cole Gasol makes 2/2 from the line.
Score: 11-6

[08:49] Team_068 possession (Score: 11-6)
Zion Anunoby attempts a Layup. BLOCKED BY LEBRON BARNES! Ball is loose! Offensive rebound by Nikola Ginobili! Nikola Ginobili kicks it out.

[08:36] Team_068 possession (Score: 11-6)
Malcolm Herro attempts a 3Pt. Contested by Khris Bryant (2.4 feet, ZONE). Malcolm Herro misses. Rebound secured by Khris Bryant.

[08:25] Team_070 possession (Score: 11-6)
Khris Bryant drives and kicks out. LeBron Barnes attempts a 3Pt. Contested by Malcolm Herro (4.2 feet, MAN). LeBron Barnes misses. Rebound secured by Nikola Ginobili.

[08:09] Team_068 possession (Score: 11-6)
Jaren Johnson attempts a 3Pt. Contested by Cole Gasol (5.7 feet, ZONE). Jaren Johnson misses. Rebound secured by Khris Bryant.

[07:57] Team_070 possession (Score: 11-6)
Cole Gasol drives and kicks out. John Hyland attempts a Midrange. Contested by Jaren Johnson (3.6 feet, MAN). John Hyland misses. Rebound secured by Gary Simons.

[07:46] Team_068 possession (Score: 11-6)
Zion Anunoby attempts a Midrange. Contested by Cole Gasol (5.7 feet, MAN). ZION ANUNOBY MAKES IT!
Score: 13-6

[07:34] Team_070 possession (Score: 13-6)
John Hyland attempts a Midrange. Contested by Jaren Johnson (3.5 feet, MAN). John Hyland misses. Rebound secured by Gary Simons.

[07:19] Team_068 possession (Score: 13-6)
Gary Simons attempts a Midrange. Contested by Khris Bryant (3.2 feet, ZONE). Gary Simons misses. Rebound secured by LeBron Barnes.

[07:10] Team_070 possession (Score: 13-6)
FOUL! Shooting foul on Zion Anunoby. Cole Gasol to the line for 3 free throws. [Team fouls: 2] (Zion Anunoby: 1 personal fouls)   FT 1/3: GOOD   FT 2/3: GOOD   FT 3/3: GOOD Cole Gasol makes 3/3 from the line.
Score: 13-9

[07:00] Team_068 possession (Score: 13-9)
Malcolm Herro attempts a Midrange. Contested by LeBron Barnes (3.5 feet, MAN). Malcolm Herro misses. Offensive rebound by Jaren Johnson! Jaren Johnson kicks it out.

[06:46] Team_068 possession (Score: 13-9)
Malcolm Herro attempts a 3Pt. Contested by Khris Bryant (2.4 feet, ZONE). Malcolm Herro misses. Rebound secured by Jabari Paul.

[06:35] Team_070 possession (Score: 13-9)
FOUL! Shooting foul on Zion Anunoby. Cole Gasol to the line for 2 free throws. [Team fouls: 3] (Zion Anunoby: 2 personal fouls)   FT 1/2: GOOD   FT 2/2: MISS Cole Gasol makes 1/2 from the line. Offensive rebound by Khris Bryant! Khris Bryant's putback is no good.
Score: 13-10

[06:24] Team_068 possession (Score: 13-10)
Gary Simons attempts a 3Pt. Contested by Khris Bryant (3.2 feet, MAN). GARY SIMONS MAKES IT! Assist: Jaren Johnson
Score: 16-10

[06:10] Team_070 possession (Score: 16-10)
John Hyland drives, picks up Gary Simons. Help arrives from Malcolm Herro! John Hyland attempts a Dunk. Contested by Malcolm Herro (3.2 feet, ZONE). JOHN HYLAND MAKES IT! Assist: Khris Bryant
Score: 16-12

[05:57] Team_068 possession (Score: 16-12)
Zion Anunoby attempts a 3Pt. Contested by Cole Gasol (5.7 feet, MAN). Zion Anunoby misses. Rebound secured by LeBron Barnes.

[05:44] Team_070 possession (Score: 16-12)
Cole Gasol attempts a 3Pt. Contested by Zion Anunoby (4.6 feet, ZONE). Cole Gasol misses. Rebound secured by Gary Simons.

[05:28] Team_068 possession (Score: 16-12)
Gary Simons attempts a 3Pt. Contested by John Hyland (5.3 feet, ZONE). Gary Simons misses. Rebound secured by Jabari Paul.

[05:14] Team_070 possession (Score: 16-12)
FOUL! Holding foul on Jaren Johnson. [Team fouls: 4] No free throws, side out. (Jaren Johnson: 1 personal fouls)

[04:58] Team_070 possession (Score: 16-12)
Cole Gasol attempts a 3Pt. Contested by Zion Anunoby (4.6 feet, MAN). Cole Gasol misses. Offensive rebound by LeBron Barnes! LeBron Barnes kicks it out.

[04:44] Team_070 possession (Score: 16-12)
LeBron Barnes drives and kicks out. Khris Bryant attempts a 3Pt. Contested by Gary Simons (3.3 feet, MAN). Khris Bryant misses. Rebound secured by Nikola Ginobili.

[04:26] Team_068 possession (Score: 16-12)
FOUL! Holding foul on Cole Gasol. [Team fouls: 4] No free throws, side out. (Cole Gasol: 1 personal fouls)

[04:17] Team_068 possession (Score: 16-12)
Jaren Johnson makes the Layup and draws the foul on LeBron Barnes! And-1! Jaren Johnson to the line for 1. [BONUS: 5 team fouls] (LeBron Barnes: 1 personal fouls)   FT 1/1: GOOD Jaren Johnson makes 1/1 from the line.
Score: 19-12

[04:05] Team_070 possession (Score: 19-12)
Khris Bryant makes the Midrange and draws the foul on Gary Simons! And-1! Khris Bryant to the line for 1. [BONUS: 5 team fouls] (Gary Simons: 1 personal fouls)   FT 1/1: GOOD Khris Bryant makes 1/1 from the line.
Score: 19-15

[03:53] Team_068 possession (Score: 19-15)
Zion Anunoby drives and kicks out. Jaren Johnson attempts a Midrange. Contested by Jabari Paul (4.6 feet, ZONE). Jaren Johnson misses. Rebound secured by Jabari Paul.

[03:42] Team_070 possession (Score: 19-15)
LeBron Barnes drives, Nikola Ginobili stays with him. LeBron Barnes attempts a Dunk. Contested by Nikola Ginobili (4.8 feet, ZONE). LEBRON BARNES MAKES IT! Assist: Cole Gasol
Score: 19-17

[03:26] Team_068 possession (Score: 19-17)
Jaren Johnson attempts a 3Pt. Contested by John Hyland (5.1 feet, MAN). JAREN JOHNSON MAKES IT! Assist: Malcolm Herro
Score: 22-17

[03:15] Team_070 possession (Score: 22-17)
FOUL! Reach-in foul on Gary Simons during the drive. [IN THE BONUS! 6 team fouls] Khris Bryant to the line for 2 free throws. (Gary Simons: 2 personal fouls)   FT 1/2: GOOD   FT 2/2: GOOD Khris Bryant makes 2/2 from the line.
Score: 22-19

[03:00] Team_068 possession (Score: 22-19)
Zion Anunoby attempts a Midrange. Contested by Cole Gasol (5.9 feet, MAN). Zion Anunoby misses. Rebound secured by LeBron Barnes.

[02:47] Team_070 possession (Score: 22-19)
LeBron Barnes attempts a 3Pt. Contested by Zion Anunoby (5.1 feet, ZONE). LEBRON BARNES MAKES IT! Assist: Cole Gasol
Score: 22-22

[02:32] Team_068 possession (Score: 22-22)
Zion Anunoby attempts a Layup. Contested by Cole Gasol (5.9 feet, MAN). ZION ANUNOBY MAKES IT! Assist: Malcolm Herro
Score: 24-22

[02:17] Team_070 possession (Score: 24-22)
Jabari Paul drives and kicks out. Khris Bryant attempts a 3Pt. BLOCKED BY GARY SIMONS! Ball is loose! Rebound secured by Jaren Johnson.

[02:06] Team_068 possession (Score: 24-22)
Zion Anunoby attempts a Midrange. Contested by Khris Bryant (3.3 feet, ZONE). Zion Anunoby misses. Rebound secured by Jabari Paul.

[01:53] Team_070 possession (Score: 24-22)
LeBron Barnes attempts a 3Pt. Contested by Zion Anunoby (5.1 feet, ZONE). LeBron Barnes misses. Offensive rebound by Khris Bryant! Khris Bryant puts it back in!
Score: 24-24

[01:38] Team_068 possession (Score: 24-24)
FOUL! Shooting foul on Khris Bryant. Nikola Ginobili to the line for 2 free throws. [BONUS: 6 team fouls] (Khris Bryant: 4 personal fouls)   FT 1/2: GOOD   FT 2/2: GOOD Nikola Ginobili makes 2/2 from the line.
Score: 26-24

[01:25] Team_070 possession (Score: 26-24)
Jabari Paul attempts a Midrange. Contested by Malcolm Herro (5.4 feet, ZONE). JABARI PAUL MAKES IT!
Score: 26-26

[01:13] Team_068 possession (Score: 26-26)
FOUL! Offensive foul on Nikola Ginobili! Khris Bryant drew the charge! [Team fouls: 7] (Nikola Ginobili: 2 personal fouls) TURNOVER! (dead ball)

[00:57] Team_070 possession (Score: 26-26)
LeBron Barnes attempts a 3Pt. Contested by Malcolm Herro (5.2 feet, MAN). LEBRON BARNES MAKES IT! Assist: Khris Bryant
Score: 26-29

[00:39] Team_068 possession (Score: 26-29)
Jaren Johnson attempts a 3Pt. Contested by Khris Bryant (3.6 feet, ZONE). Jaren Johnson misses. Rebound secured by Khris Bryant.

[00:27] Team_070 possession (Score: 26-29)
Cole Gasol attempts a Layup. Contested by Nikola Ginobili (5.0 feet, ZONE). COLE GASOL MAKES IT! Assist: Jabari Paul
Score: 26-31

[00:12] Team_068 possession (Score: 26-31)
Nikola Ginobili attempts a Midrange. Contested by John Hyland (5.0 feet, ZONE). Nikola Ginobili misses. Rebound secured by Jabari Paul.

================================================================================
                              1ST QUARTER COMPLETE                              
================================================================================

1ST QUARTER SCORE: Team_068 26, Team_070 31

BOX SCORE:
================================================================================

Team_068
--------------------------------------------------------------------------------
Player                MIN  PTS  REB  AST  TO      FG   FG%      3P   3P%
--------------------------------------------------------------------------------
Jaren Johnson          12    9    3    1   0   3/5    60.0     0/0   0.0
Gary Simons            12    8    6    0   0   3/5    60.0     0/0   0.0
Nikola Ginobili        12    5    4    0   0   3/4    75.0     0/0   0.0
Zion Anunoby           12    4    0    1   0   2/6    33.3     0/0   0.0
Malcolm Herro          12    0    0    3   0   0/2     0.0     0/0   0.0

TEAM: FG: 11/22 (50.0%), 3PT: 3/9 (33.3%), REB: 14 (4 off, 10 def), AST: 5, TO: 2
TEAM FOULS: 7 [Team_070 in BONUS]


Team_070
--------------------------------------------------------------------------------
Player                MIN  PTS  REB  AST  TO      FG   FG%      3P   3P%
--------------------------------------------------------------------------------
Khris Bryant           12    9    5    2   0   4/6    66.7     0/0   0.0
LeBron Barnes          12    8    4    1   0   3/5    60.0     0/0   0.0
Cole Gasol             12    7    0    3   0   3/6    50.0     0/0   0.0
John Hyland            12    4    0    0   0   2/3    66.7     0/0   0.0
Jabari Paul            12    2    5    1   0   1/3    33.3     0/0   0.0

TEAM: FG: 13/23 (56.5%), 3PT: 4/6 (66.7%), REB: 13 (2 off, 11 def), AST: 7, TO: 0
TEAM FOULS: 6 [Team_068 in BONUS]

================================================================================

================================================================================
                       2ND QUARTER - Team_068 vs Team_070                       
================================================================================

[12:00] Team_068 possession (Score: 26-31)
Nikola Ginobili attempts a Midrange. Contested by Khris Bryant (2.9 feet, ZONE). Nikola Ginobili misses. Rebound secured by Jabari Paul.

[11:42] Team_070 possession (Score: 26-31)
Cole Gasol attempts a 3Pt. Contested by Zion Anunoby (4.9 feet, ZONE). COLE GASOL MAKES IT! Assist: Khris Bryant
Score: 26-34

[11:26] Team_068 possession (Score: 26-34)
Gary Simons attempts a 3Pt. Contested by John Hyland (5.6 feet, ZONE). Gary Simons misses. Offensive rebound by Jaren Johnson! Jaren Johnson kicks it out.

[11:15] Team_068 possession (Score: 26-34)
Jaren Johnson attempts a Midrange. Contested by John Hyland (5.3 feet, MAN). Jaren Johnson misses. Rebound secured by Jabari Paul.

[10:59] Team_070 possession (Score: 26-34)
Cole Gasol drives, picks up Zion Anunoby. Help arrives from Jaren Johnson! Cole Gasol attempts a Layup. Contested by Jaren Johnson (5.0 feet, MAN). COLE GASOL MAKES IT! Assist: John Hyland
Score: 26-36

[10:45] Team_068 possession (Score: 26-36)
FOUL! Shooting foul on Khris Bryant. Malcolm Herro to the line for 2 free throws. [Team fouls: 1] (Khris Bryant: 1 personal fouls)   FT 1/2: GOOD   FT 2/2: GOOD Malcolm Herro makes 2/2 from the line.
Score: 28-36

[10:32] Team_070 possession (Score: 28-36)
John Hyland attempts a 3Pt. Contested by Jaren Johnson (4.1 feet, MAN). John Hyland misses. Rebound secured by Nikola Ginobili.

[10:17] Team_068 possession (Score: 28-36)
Zion Anunoby attempts a 3Pt. Wide open! Cole Gasol is 6.1 feet away. [MAN] ZION ANUNOBY MAKES IT! Assist: Nikola Ginobili
Score: 31-36

[10:03] Team_070 possession (Score: 31-36)
Cole Gasol loses control! Ball rolls out of bounds! TURNOVER! (dead ball)

[10:03] Substitution (Team_068): Zion Anunoby OUT → Cole Anthony IN (stamina_rule2)

[10:03] Substitution (Team_068): Malcolm Herro OUT → Ja Banchero IN (stamina_rule2)

[10:03] Substitution (Team_068): Jaren Johnson OUT → Miles Murray IN (stamina_rule2)

[10:03] Substitution (Team_068): Gary Simons OUT → Jarrett Oladipo IN (stamina_rule2)

[10:03] Substitution (Team_068): Nikola Ginobili OUT → Franz Curry IN (stamina_rule2)

[10:03] Substitution (Team_070): Cole Gasol OUT → Paul Quickley IN (stamina_rule2)

[10:03] Substitution (Team_070): LeBron Barnes OUT → Allen Quickley IN (stamina_rule2)

[10:03] Substitution (Team_070): John Hyland OUT → D'Angelo McGrady IN (stamina_rule2)

[10:03] Substitution (Team_070): Khris Bryant OUT → Luka Gobert IN (stamina_rule2)

[10:03] Substitution (Team_070): Jabari Paul OUT → Russell Morant IN (stamina_rule2)

[09:47] Team_068 possession (Score: 31-36)
Cole Anthony attempts a 3Pt. Contested by Paul Quickley (4.2 feet, MAN). Cole Anthony misses. Rebound secured by D'Angelo McGrady.

[09:34] Team_070 possession (Score: 31-36)
FOUL! Shooting foul on Miles Murray. D'Angelo McGrady to the line for 2 free throws. [Team fouls: 1] (Miles Murray: 1 personal fouls)   FT 1/2: GOOD   FT 2/2: GOOD D'Angelo McGrady makes 2/2 from the line.
Score: 31-38

[09:24] Team_068 possession (Score: 31-38)
FOUL! Shooting foul on Russell Morant. Miles Murray to the line for 2 free throws. [Team fouls: 2] (Russell Morant: 1 personal fouls)   FT 1/2: MISS   FT 2/2: GOOD Miles Murray makes 1/2 from the line.
Score: 32-38

[09:07] Team_070 possession (Score: 32-38)
Paul Quickley attempts a 3Pt. Contested by Cole Anthony (4.6 feet, MAN). PAUL QUICKLEY MAKES IT! Assist: D'Angelo McGrady
Score: 32-41

[08:54] Team_068 possession (Score: 32-41)
FOUL! Reach-in foul on Luka Gobert during the drive. [Team fouls: 3] No free throws, side out. (Luka Gobert: 1 personal fouls)

[08:38] Team_068 possession (Score: 32-41)
Cole Anthony attempts a 3Pt. Contested by D'Angelo McGrady (5.5 feet, ZONE). COLE ANTHONY MAKES IT! Assist: Miles Murray
Score: 35-41

[08:29] Team_070 possession (Score: 35-41)
FOUL! Reach-in foul on Franz Curry during the drive. [Team fouls: 2] No free throws, side out. (Franz Curry: 1 personal fouls)

[08:18] Team_070 possession (Score: 35-41)
D'Angelo McGrady attempts a 3Pt. Contested by Ja Banchero (5.2 feet, ZONE). D'ANGELO MCGRADY MAKES IT! Assist: Paul Quickley
Score: 35-44

[08:05] Team_068 possession (Score: 35-44)
Miles Murray commits a violation (traveling/carry)! TURNOVER! (dead ball)

[07:54] Team_070 possession (Score: 35-44)
Allen Quickley drives, picks up Ja Banchero. Help arrives from Miles Murray! Allen Quickley attempts a Dunk. Contested by Miles Murray (5.2 feet, MAN). Allen Quickley misses. FOUL! Loose ball foul on Ja Banchero during the rebound battle. [Team fouls: 3] No free throws, side out. (Ja Banchero: 1 personal fouls)

[07:43] Team_070 possession (Score: 35-44)
Allen Quickley attempts a 3Pt. Contested by Ja Banchero (5.2 feet, MAN). Allen Quickley misses. Rebound secured by Jarrett Oladipo.

[07:32] Team_068 possession (Score: 35-44)
Ja Banchero attempts a Layup. Contested by Russell Morant (3.9 feet, ZONE). JA BANCHERO MAKES IT! Assist: Franz Curry
Score: 37-44

[07:18] Team_070 possession (Score: 37-44)
FOUL! Offensive foul on D'Angelo McGrady! Miles Murray drew the charge! [Team fouls: 4] (D'Angelo McGrady: 1 personal fouls) TURNOVER! (dead ball)

[07:08] Team_068 possession (Score: 37-44)
Cole Anthony attempts a Midrange. Contested by D'Angelo McGrady (5.5 feet, ZONE). Cole Anthony misses. FOUL! Loose ball foul on Luka Gobert during the rebound battle. [IN THE BONUS! 5 team fouls] Jarrett Oladipo to the line for 2 free throws. (Luka Gobert: 2 personal fouls)   FT 1/2: GOOD   FT 2/2: GOOD Jarrett Oladipo makes 2/2 from the line.
Score: 39-44

[06:52] Team_070 possession (Score: 39-44)
Russell Morant attempts a Midrange. Contested by Cole Anthony (4.9 feet, ZONE). Russell Morant misses. Rebound secured by Franz Curry.

[06:41] Team_068 possession (Score: 39-44)
Miles Murray attempts a Layup. BLOCKED BY PAUL QUICKLEY! Ball is loose! Rebound secured by D'Angelo McGrady.

[06:29] Team_070 possession (Score: 39-44)
D'Angelo McGrady drives, Jarrett Oladipo stays with him. D'Angelo McGrady attempts a Dunk. Contested by Jarrett Oladipo (3.9 feet, ZONE). D'ANGELO MCGRADY MAKES IT! Assist: Allen Quickley
Score: 39-46

[06:17] Team_068 possession (Score: 39-46)
Cole Anthony drives to the basket... Cole Anthony loses the ball! Stripped by Luka Gobert! TURNOVER! (live ball)

[06:02] Team_070 possession (Score: 39-46)
Luka Gobert attempts a Midrange. Contested by Jarrett Oladipo (3.9 feet, MAN). Luka Gobert misses. FOUL! Loose ball foul on Franz Curry during the rebound battle. [Team fouls: 4] No free throws, side out. (Franz Curry: 2 personal fouls)

[05:49] Team_070 possession (Score: 39-46)
Paul Quickley attempts a Midrange. Contested by Cole Anthony (4.6 feet, MAN). Paul Quickley misses. Rebound secured by Jarrett Oladipo.

[05:34] Team_068 possession (Score: 39-46)
Ja Banchero attempts a 3Pt. Contested by Paul Quickley (4.5 feet, ZONE). Ja Banchero misses. Offensive rebound by Jarrett Oladipo! Jarrett Oladipo kicks it out.

[05:18] Team_068 possession (Score: 39-46)
Jarrett Oladipo attempts a 3Pt. Contested by Luka Gobert (5.1 feet, MAN). Jarrett Oladipo misses. Rebound secured by D'Angelo McGrady.

[05:06] Team_070 possession (Score: 39-46)
FOUL! Offensive foul on Paul Quickley! Cole Anthony drew the charge! [Team fouls: 6] (Paul Quickley: 1 personal fouls) TURNOVER! (dead ball)

[04:51] Team_068 possession (Score: 39-46)
Jarrett Oladipo attempts a Midrange. Contested by Luka Gobert (5.1 feet, MAN). Jarrett Oladipo misses. Offensive rebound by Franz Curry! Franz Curry puts it back in!
Score: 41-46

[04:39] Team_070 possession (Score: 41-46)
Paul Quickley attempts a Midrange. Contested by Cole Anthony (4.6 feet, ZONE). Paul Quickley misses. Rebound secured by Jarrett Oladipo.

[04:25] Team_068 possession (Score: 41-46)
FOUL! Reach-in foul on Russell Morant during the drive. [IN THE BONUS! 7 team fouls] Franz Curry to the line for 2 free throws. (Russell Morant: 2 personal fouls)   FT 1/2: GOOD   FT 2/2: GOOD Franz Curry makes 2/2 from the line.
Score: 43-46

[04:14] Team_070 possession (Score: 43-46)
Luka Gobert drives to the basket... FOUL! Offensive foul on Luka Gobert! Franz Curry drew the charge! [Team fouls: 8] (Luka Gobert: 3 personal fouls) TURNOVER! (dead ball)

[04:00] Team_068 possession (Score: 43-46)
Miles Murray attempts a 3Pt. Contested by D'Angelo McGrady (5.8 feet, MAN). Miles Murray misses. Rebound secured by Russell Morant.

[03:45] Team_070 possession (Score: 43-46)
Allen Quickley drives to the basket... FOUL! Offensive foul on Allen Quickley! Ja Banchero drew the charge! [Team fouls: 9] (Allen Quickley: 1 personal fouls) TURNOVER! (dead ball)

[03:34] Team_068 possession (Score: 43-46)
Ja Banchero attempts a Layup. Contested by Allen Quickley (5.4 feet, MAN). JA BANCHERO MAKES IT!
Score: 45-46

[03:20] Team_070 possession (Score: 45-46)
FOUL! Reach-in foul on Franz Curry during the drive. [IN THE BONUS! 5 team fouls] Russell Morant to the line for 2 free throws. (Franz Curry: 3 personal fouls)   FT 1/2: GOOD   FT 2/2: GOOD Russell Morant makes 2/2 from the line.
Score: 45-48

[03:06] Team_068 possession (Score: 45-48)
FOUL! Shooting foul on Russell Morant. Miles Murray to the line for 2 free throws. [BONUS: 10 team fouls] (Russell Morant: 3 personal fouls)   FT 1/2: GOOD   FT 2/2: GOOD Miles Murray makes 2/2 from the line.
Score: 47-48

[02:50] Team_070 possession (Score: 47-48)
Paul Quickley attempts a 3Pt. Contested by Ja Banchero (5.1 feet, ZONE). Paul Quickley misses. Offensive rebound by Luka Gobert! Luka Gobert kicks it out.

[02:35] Team_070 possession (Score: 47-48)
Russell Morant makes the Layup and draws the foul on Franz Curry! And-1! Russell Morant to the line for 1. [BONUS: 6 team fouls] (Franz Curry: 4 personal fouls)   FT 1/1: GOOD Russell Morant makes 1/1 from the line.
Score: 47-51

[02:21] Team_068 possession (Score: 47-51)
Jarrett Oladipo makes the Dunk and draws the foul on Luka Gobert! And-1! Jarrett Oladipo to the line for 1. [BONUS: 11 team fouls] (Luka Gobert: 4 personal fouls)   FT 1/1: GOOD Jarrett Oladipo makes 1/1 from the line.
Score: 50-51

[02:10] Team_070 possession (Score: 50-51)
Allen Quickley attempts a Midrange. Contested by Ja Banchero (5.3 feet, MAN). Allen Quickley misses. Rebound secured by Franz Curry.

[01:55] Team_068 possession (Score: 50-51)
Miles Murray drives to the basket... Miles Murray throws a bad pass! Stolen by D'Angelo McGrady! TURNOVER! (live ball)

[01:44] Team_070 possession (Score: 50-51)
Allen Quickley attempts a Midrange. Contested by Ja Banchero (5.3 feet, MAN). Allen Quickley misses. Rebound secured by Franz Curry.

[01:29] Team_068 possession (Score: 50-51)
Franz Curry attempts a Midrange. Contested by Russell Morant (4.4 feet, MAN). FRANZ CURRY MAKES IT! Assist: Cole Anthony
Score: 52-51

[01:12] Team_070 possession (Score: 52-51)
Luka Gobert attempts a Layup. Contested by Franz Curry (4.6 feet, ZONE). LUKA GOBERT MAKES IT! Assist: Paul Quickley
Score: 52-53

[00:56] Team_068 possession (Score: 52-53)
Ja Banchero drives to the basket... Ja Banchero loses the ball! Stripped by Allen Quickley! TURNOVER! (live ball)

[00:37] Team_070 possession (Score: 52-53)
Luka Gobert makes the Layup and draws the foul on Franz Curry! And-1! Luka Gobert to the line for 1. [BONUS: 7 team fouls] (Franz Curry: 5 personal fouls)   FT 1/1: GOOD Luka Gobert makes 1/1 from the line.
Score: 52-56

[00:18] Team_068 possession (Score: 52-56)
Cole Anthony attempts a Midrange. Contested by Paul Quickley (4.6 feet, MAN). COLE ANTHONY MAKES IT!
Score: 54-56

[00:06] Team_070 possession (Score: 54-56)
FOUL! Reach-in foul on Jarrett Oladipo during the drive. [IN THE BONUS! 8 team fouls] Luka Gobert to the line for 2 free throws. (Jarrett Oladipo: 1 personal fouls)   FT 1/2: GOOD   FT 2/2: GOOD Luka Gobert makes 2/2 from the line.
Score: 54-58

================================================================================
                              2ND QUARTER COMPLETE                              
================================================================================

2ND QUARTER SCORE: Team_068 28, Team_070 27

BOX SCORE:
================================================================================

Team_068
--------------------------------------------------------------------------------
Player                MIN  PTS  REB  AST  TO      FG   FG%      3P   3P%
--------------------------------------------------------------------------------
Franz Curry            10    6    4    1   0   3/3   100.0     0/0   0.0
Cole Anthony           10    5    0    1   0   2/3    66.7     0/0   0.0
Jarrett Oladipo        10    5    4    0   0   2/3    66.7     0/0   0.0
Ja Banchero            10    4    0    0   0   2/2   100.0     0/0   0.0
Zion Anunoby           14    3    0    0   0   1/1   100.0     0/0   0.0
Miles Murray           10    3    0    1   0   2/4    50.0     0/0   0.0
Malcolm Herro          14    2    0    0   0   1/1   100.0     0/0   0.0
Nikola Ginobili        14    0    1    1   0   0/1     0.0     0/0   0.0
Jaren Johnson          14    0    1    0   0   0/1     0.0     0/0   0.0

TEAM: FG: 13/19 (68.4%), 3PT: 2/5 (40.0%), REB: 10 (3 off, 7 def), AST: 4, TO: 4
TEAM FOULS: 8 [Team_070 in BONUS]


Team_070
--------------------------------------------------------------------------------
Player                MIN  PTS  REB  AST  TO      FG   FG%      3P   3P%
--------------------------------------------------------------------------------
D'Angelo McGrady       10    7    3    1   0   3/3   100.0     0/0   0.0
Luka Gobert            10    7    2    0   0   3/3   100.0     0/0   0.0
Cole Gasol             14    5    0    0   0   2/2   100.0     0/0   0.0
Russell Morant         10    5    2    0   0   2/3    66.7     0/0   0.0
Paul Quickley          10    3    0    2   0   1/3    33.3     0/0   0.0
Jabari Paul            14    0    2    0   0   0/0     0.0     0/0   0.0
Khris Bryant           14    0    0    1   0   0/0     0.0     0/0   0.0
John Hyland            14    0    0    1   0   0/1     0.0     0/0   0.0
Allen Quickley         10    0    0    1   0   0/3     0.0     0/0   0.0

TEAM: FG: 11/18 (61.1%), 3PT: 3/5 (60.0%), REB: 9 (3 off, 6 def), AST: 6, TO: 5
TEAM FOULS: 11 [Team_068 in BONUS]

================================================================================

================================================================================
                       3RD QUARTER - Team_068 vs Team_070                       
================================================================================

[12:00] Team_068 possession (Score: 54-58)
Nikola Ginobili attempts a 3Pt. Contested by Khris Bryant (2.5 feet, MAN). Nikola Ginobili misses. Rebound secured by LeBron Barnes.

[11:43] Team_070 possession (Score: 54-58)
FOUL! Holding foul on Nikola Ginobili. [Team fouls: 1] No free throws, side out. (Nikola Ginobili: 1 personal fouls)

[11:29] Team_070 possession (Score: 54-58)
FOUL! Shooting foul on Zion Anunoby. Jabari Paul to the line for 3 free throws. [Team fouls: 2] (Zion Anunoby: 1 personal fouls)   FT 1/3: GOOD   FT 2/3: GOOD   FT 3/3: GOOD Jabari Paul makes 3/3 from the line.
Score: 54-61

[11:17] Team_068 possession (Score: 54-61)
Jaren Johnson attempts a 3Pt. Contested by Khris Bryant (2.9 feet, ZONE). Jaren Johnson misses. Rebound secured by Jabari Paul.

[11:07] Team_070 possession (Score: 54-61)
John Hyland drives and kicks out. Jabari Paul attempts a 3Pt. Contested by Zion Anunoby (4.4 feet, ZONE). Jabari Paul misses. Rebound secured by Jaren Johnson.

[10:53] Team_068 possession (Score: 54-61)
Jaren Johnson attempts a 3Pt. Contested by Khris Bryant (2.9 feet, ZONE). Jaren Johnson misses. Rebound secured by Khris Bryant.

[10:39] Team_070 possession (Score: 54-61)
John Hyland attempts a 3Pt. Contested by Zion Anunoby (4.3 feet, ZONE). John Hyland misses. Rebound secured by Gary Simons.

[10:24] Team_068 possession (Score: 54-61)
Malcolm Herro drives to the basket... Malcolm Herro loses control! Ball rolls out of bounds! TURNOVER! (dead ball)

[10:10] Team_070 possession (Score: 54-61)
Khris Bryant throws a bad pass! Stolen by Gary Simons! TURNOVER! (live ball)

[09:54] Team_068 possession (Score: 54-61)
Zion Anunoby throws a bad pass out of bounds! TURNOVER! (dead ball)

[09:37] Team_070 possession (Score: 54-61)
John Hyland drives and kicks out. Jabari Paul attempts a 3Pt. Contested by Zion Anunoby (4.4 feet, ZONE). Jabari Paul misses. Rebound secured by Jaren Johnson.

[09:21] Team_068 possession (Score: 54-61)
FOUL! Shooting foul on John Hyland. Jaren Johnson to the line for 2 free throws. [Team fouls: 1] (John Hyland: 1 personal fouls)   FT 1/2: GOOD   FT 2/2: GOOD Jaren Johnson makes 2/2 from the line.
Score: 56-61

[09:08] Team_070 possession (Score: 56-61)
LeBron Barnes drives and kicks out. FOUL! Shooting foul on Gary Simons. Jabari Paul to the line for 2 free throws. [Team fouls: 3] (Gary Simons: 1 personal fouls)   FT 1/2: MISS   FT 2/2: GOOD Jabari Paul makes 1/2 from the line.
Score: 56-62

[08:57] Team_068 possession (Score: 56-62)
Gary Simons throws a bad pass! Stolen by Khris Bryant! TURNOVER! (live ball)

[08:44] Team_070 possession (Score: 56-62)
FOUL! Holding foul on Jaren Johnson. [Team fouls: 4] No free throws, side out. (Jaren Johnson: 1 personal fouls)

[08:27] Team_070 possession (Score: 56-62)
LeBron Barnes drives to the basket... LeBron Barnes loses the ball! Stripped by Gary Simons! TURNOVER! (live ball)

[08:14] Team_068 possession (Score: 56-62)
Nikola Ginobili attempts a Layup. Contested by Khris Bryant (2.5 feet, MAN). NIKOLA GINOBILI MAKES IT!
Score: 58-62

[07:56] Team_070 possession (Score: 58-62)
FOUL! Shooting foul on Zion Anunoby. Jabari Paul to the line for 2 free throws. [BONUS: 5 team fouls] (Zion Anunoby: 2 personal fouls)   FT 1/2: GOOD   FT 2/2: GOOD Jabari Paul makes 2/2 from the line.
Score: 58-64

[07:41] Team_068 possession (Score: 58-64)
Gary Simons drives, picks up Khris Bryant. Help arrives from LeBron Barnes! Gary Simons attempts a Dunk. Contested by LeBron Barnes (3.2 feet, MAN). GARY SIMONS MAKES IT! Assist: Jaren Johnson
Score: 60-64

[07:29] Team_070 possession (Score: 60-64)
John Hyland attempts a 3Pt. Contested by Zion Anunoby (4.3 feet, ZONE). John Hyland misses. Offensive rebound by LeBron Barnes! LeBron Barnes kicks it out.

[07:11] Team_070 possession (Score: 60-64)
FOUL! Shooting foul on Malcolm Herro. Khris Bryant to the line for 2 free throws. [BONUS: 6 team fouls] (Malcolm Herro: 1 personal fouls)   FT 1/2: GOOD   FT 2/2: GOOD Khris Bryant makes 2/2 from the line.
Score: 60-66

[06:57] Team_068 possession (Score: 60-66)
Zion Anunoby makes the Layup and draws the foul on Jabari Paul! And-1! Zion Anunoby to the line for 1. [Team fouls: 2] (Jabari Paul: 1 personal fouls)   FT 1/1: GOOD Zion Anunoby makes 1/1 from the line.
Score: 63-66

[06:43] Team_070 possession (Score: 63-66)
Khris Bryant drives, Gary Simons stays with him. Khris Bryant attempts a Layup. Contested by Gary Simons (3.1 feet, MAN). KHRIS BRYANT MAKES IT!
Score: 63-68

[06:27] Team_068 possession (Score: 63-68)
Zion Anunoby attempts a 3Pt. Contested by Cole Gasol (5.7 feet, MAN). ZION ANUNOBY MAKES IT! Assist: Jaren Johnson
Score: 66-68

[06:11] Team_070 possession (Score: 66-68)
John Hyland attempts a 3Pt. Contested by Jaren Johnson (3.5 feet, MAN). John Hyland misses. Rebound secured by Gary Simons.

[05:56] Team_068 possession (Score: 66-68)
Gary Simons drives, picks up Khris Bryant. Help arrives from LeBron Barnes! Gary Simons attempts a Dunk. Contested by LeBron Barnes (3.2 feet, ZONE). GARY SIMONS MAKES IT! Assist: Zion Anunoby
Score: 68-68

[05:40] Team_070 possession (Score: 68-68)
John Hyland attempts a 3Pt. Contested by Zion Anunoby (4.3 feet, ZONE). John Hyland misses. Rebound secured by Gary Simons.

[05:26] Team_068 possession (Score: 68-68)
Zion Anunoby drives, Khris Bryant stays with him. Zion Anunoby attempts a Layup. Contested by Khris Bryant (2.8 feet, ZONE). ZION ANUNOBY MAKES IT!
Score: 70-68

[05:08] Team_070 possession (Score: 70-68)
Jabari Paul attempts a Midrange. Contested by Nikola Ginobili (4.9 feet, MAN). Jabari Paul misses. Rebound secured by Jaren Johnson.

[04:50] Team_068 possession (Score: 70-68)
Malcolm Herro attempts a 3Pt. Contested by Khris Bryant (2.5 feet, ZONE). Malcolm Herro misses. Offensive rebound by Nikola Ginobili! Nikola Ginobili's putback is no good. Rebound secured by Jabari Paul.

[04:38] Team_070 possession (Score: 70-68)
LeBron Barnes attempts a 3Pt. Contested by Zion Anunoby (4.9 feet, ZONE). LeBron Barnes misses. Rebound secured by Jaren Johnson.

[04:19] Team_068 possession (Score: 70-68)
Jaren Johnson drives, Khris Bryant stays with him. Jaren Johnson attempts a Dunk. Contested by Khris Bryant (3.0 feet, ZONE). JAREN JOHNSON MAKES IT!
Score: 72-68

[04:04] Team_070 possession (Score: 72-68)
Khris Bryant attempts a Midrange. Contested by Gary Simons (3.2 feet, MAN). Khris Bryant misses. Rebound secured by Gary Simons.

[03:46] Team_068 possession (Score: 72-68)
Zion Anunoby drives and kicks out. Malcolm Herro attempts a 3Pt. Contested by LeBron Barnes (3.7 feet, MAN). MALCOLM HERRO MAKES IT! Assist: Zion Anunoby
Score: 75-68

[03:33] Team_070 possession (Score: 75-68)
Khris Bryant attempts a 3Pt. Contested by Gary Simons (3.3 feet, ZONE). Khris Bryant misses. Rebound secured by Nikola Ginobili.

[03:17] Team_068 possession (Score: 75-68)
FOUL! Holding foul on Cole Gasol. [Team fouls: 3] No free throws, side out. (Cole Gasol: 1 personal fouls)

[03:01] Team_068 possession (Score: 75-68)
Zion Anunoby attempts a 3Pt. Contested by Khris Bryant (3.0 feet, ZONE). ZION ANUNOBY MAKES IT! Assist: Jaren Johnson
Score: 78-68

[02:48] Team_070 possession (Score: 78-68)
Jabari Paul attempts a 3Pt. Contested by Nikola Ginobili (5.1 feet, MAN). Jabari Paul misses. Offensive rebound by Khris Bryant! Khris Bryant puts it back in!
Score: 78-70

[02:34] Team_068 possession (Score: 78-70)
Jaren Johnson attempts a 3Pt. Contested by John Hyland (5.1 feet, MAN). Jaren Johnson misses. Offensive rebound by Jaren Johnson! Jaren Johnson kicks it out.

[02:17] Team_068 possession (Score: 78-70)
Nikola Ginobili attempts a Midrange. Contested by Khris Bryant (2.8 feet, MAN). Nikola Ginobili misses. Rebound secured by Jabari Paul.

[02:03] Team_070 possession (Score: 78-70)
Jabari Paul drives and kicks out. Jabari Paul attempts a Midrange. Contested by Nikola Ginobili (4.5 feet, MAN). JABARI PAUL MAKES IT! Assist: Cole Gasol
Score: 78-72

[01:44] Team_068 possession (Score: 78-72)
Gary Simons attempts a 3Pt. Contested by Khris Bryant (3.5 feet, MAN). GARY SIMONS MAKES IT! Assist: Nikola Ginobili
Score: 81-72

[01:29] Team_070 possession (Score: 81-72)
Jabari Paul loses the ball! Stripped by Nikola Ginobili! TURNOVER! (live ball)

[01:15] Team_068 possession (Score: 81-72)
Jaren Johnson drives to the basket... FOUL! Offensive foul on Jaren Johnson! John Hyland drew the charge! [Team fouls: 7] (Jaren Johnson: 2 personal fouls) TURNOVER! (dead ball)

[00:59] Team_070 possession (Score: 81-72)
Cole Gasol attempts a Layup. Contested by Zion Anunoby (4.9 feet, MAN). COLE GASOL MAKES IT! Assist: LeBron Barnes
Score: 81-74

[00:45] Team_068 possession (Score: 81-74)
Zion Anunoby drives to the basket... FOUL! Offensive foul on Zion Anunoby! Cole Gasol drew the charge! [Team fouls: 8] (Zion Anunoby: 3 personal fouls) TURNOVER! (dead ball)

[00:26] Team_070 possession (Score: 81-74)
John Hyland attempts a 3Pt. Contested by Jaren Johnson (4.0 feet, MAN). John Hyland misses. Rebound secured by Jaren Johnson.

[00:10] Team_068 possession (Score: 81-74)
Gary Simons commits a violation (traveling/carry)! TURNOVER! (dead ball)

[00:10] Substitution (Team_068): Zion Anunoby OUT → Cole Anthony IN (stamina_rule2)

[00:10] Substitution (Team_068): Malcolm Herro OUT → Ja Banchero IN (stamina_rule2)

[00:10] Substitution (Team_068): Jaren Johnson OUT → Miles Murray IN (stamina_rule2)

[00:10] Substitution (Team_068): Gary Simons OUT → Jarrett Oladipo IN (stamina_rule2)

[00:10] Substitution (Team_068): Nikola Ginobili OUT → Franz Curry IN (stamina_rule2)

[00:10] Substitution (Team_070): Cole Gasol OUT → Paul Quickley IN (stamina_rule2)

[00:10] Substitution (Team_070): LeBron Barnes OUT → Allen Quickley IN (stamina_rule2)

[00:10] Substitution (Team_070): John Hyland OUT → D'Angelo McGrady IN (stamina_rule2)

[00:10] Substitution (Team_070): Khris Bryant OUT → Luka Gobert IN (stamina_rule2)

[00:10] Substitution (Team_070): Jabari Paul OUT → Russell Morant IN (stamina_rule2)

================================================================================
                              3RD QUARTER COMPLETE                              
================================================================================

3RD QUARTER SCORE: Team_068 27, Team_070 16

BOX SCORE:
================================================================================

Team_068
--------------------------------------------------------------------------------
Player                MIN  PTS  REB  AST  TO      FG   FG%      3P   3P%
--------------------------------------------------------------------------------
Zion Anunoby           26   11    0    2   0   4/4   100.0     0/0   0.0
Gary Simons            26    7    4    0   0   3/3   100.0     0/0   0.0
Jaren Johnson          26    4    6    3   0   2/4    50.0     0/0   0.0
Malcolm Herro          26    3    0    0   0   1/2    50.0     0/0   0.0
Nikola Ginobili        26    2    1    1   0   1/3    33.3     0/0   0.0

TEAM: FG: 11/16 (68.8%), 3PT: 3/7 (42.9%), REB: 12 (2 off, 10 def), AST: 6, TO: 6
TEAM FOULS: 8 [Team_070 in BONUS]


Team_070
--------------------------------------------------------------------------------
Player                MIN  PTS  REB  AST  TO      FG   FG%      3P   3P%
--------------------------------------------------------------------------------
Jabari Paul            26    8    3    0   0   4/5    80.0     0/0   0.0
Khris Bryant           26    6    2    0   0   3/5    60.0     0/0   0.0
Cole Gasol             26    2    0    1   0   1/1   100.0     0/0   0.0
LeBron Barnes          26    0    2    1   0   0/1     0.0     0/0   0.0
John Hyland            26    0    0    0   0   0/6     0.0     0/0   0.0

TEAM: FG: 8/18 (44.4%), 3PT: 2/8 (25.0%), REB: 6 (2 off, 4 def), AST: 2, TO: 3
TEAM FOULS: 3

================================================================================

================================================================================
                       4TH QUARTER - Team_068 vs Team_070                       
================================================================================

[12:00] Team_068 possession (Score: 81-74)
Malcolm Herro attempts a 3Pt. Contested by Cole Gasol (5.4 feet, ZONE). Malcolm Herro misses. Rebound secured by Jabari Paul.

[11:46] Team_070 possession (Score: 81-74)
LeBron Barnes makes the Dunk and draws the foul on Malcolm Herro! And-1! LeBron Barnes to the line for 1. [Team fouls: 1] (Malcolm Herro: 1 personal fouls)   FT 1/1: GOOD LeBron Barnes makes 1/1 from the line.
Score: 81-77

[11:32] Team_068 possession (Score: 81-77)
Jaren Johnson drives, Khris Bryant stays with him. Jaren Johnson attempts a Dunk. Contested by Khris Bryant (3.3 feet, ZONE). Jaren Johnson misses. Rebound secured by Jabari Paul.

[11:20] Team_070 possession (Score: 81-77)
Cole Gasol attempts a 3Pt. Contested by Zion Anunoby (4.8 feet, MAN). COLE GASOL MAKES IT! Assist: LeBron Barnes
Score: 81-80

[11:01] Team_068 possession (Score: 81-80)
Zion Anunoby throws a bad pass out of bounds! TURNOVER! (dead ball)

[11:01] Substitution (Team_068): Zion Anunoby OUT → Cole Anthony IN (stamina_rule2)

[11:01] Substitution (Team_068): Malcolm Herro OUT → Ja Banchero IN (stamina_rule2)

[11:01] Substitution (Team_068): Jaren Johnson OUT → Miles Murray IN (stamina_rule2)

[11:01] Substitution (Team_068): Gary Simons OUT → Jarrett Oladipo IN (stamina_rule2)

[11:01] Substitution (Team_068): Nikola Ginobili OUT → Franz Curry IN (stamina_rule2)

[11:01] Substitution (Team_070): Cole Gasol OUT → Paul Quickley IN (stamina_rule2)

[11:01] Substitution (Team_070): LeBron Barnes OUT → Allen Quickley IN (stamina_rule2)

[11:01] Substitution (Team_070): John Hyland OUT → D'Angelo McGrady IN (stamina_rule2)

[11:01] Substitution (Team_070): Khris Bryant OUT → Luka Gobert IN (stamina_rule2)

[11:01] Substitution (Team_070): Jabari Paul OUT → Russell Morant IN (stamina_rule2)

[10:46] Team_070 possession (Score: 81-80)
Paul Quickley attempts a 3Pt. Contested by Cole Anthony (4.6 feet, MAN). Paul Quickley misses. Rebound secured by Ja Banchero.

[10:30] Team_068 possession (Score: 81-80)
Franz Curry drives and kicks out. Miles Murray attempts a 3Pt. Contested by Paul Quickley (4.3 feet, ZONE). Miles Murray misses. Offensive rebound by Franz Curry! Franz Curry's putback is no good. Rebound secured by D'Angelo McGrady.

[10:15] Team_070 possession (Score: 81-80)
Russell Morant attempts a Midrange. Contested by Franz Curry (4.5 feet, MAN). Russell Morant misses. Rebound secured by Franz Curry.

[10:00] Team_068 possession (Score: 81-80)
Cole Anthony attempts a 3Pt. Contested by Paul Quickley (4.2 feet, MAN). COLE ANTHONY MAKES IT! Assist: Ja Banchero
Score: 84-80

[09:44] Team_070 possession (Score: 84-80)
Russell Morant drives, Franz Curry stays with him. Russell Morant attempts a Dunk. Contested by Franz Curry (4.5 feet, MAN). Russell Morant misses. Rebound secured by Jarrett Oladipo.

[09:28] Team_068 possession (Score: 84-80)
Ja Banchero attempts a 3Pt. Contested by Paul Quickley (4.5 feet, ZONE). Ja Banchero misses. Rebound secured by Luka Gobert.

[09:17] Team_070 possession (Score: 84-80)
D'Angelo McGrady attempts a Midrange. Contested by Jarrett Oladipo (3.9 feet, ZONE). D'ANGELO MCGRADY MAKES IT! Assist: Luka Gobert
Score: 84-82

[09:06] Team_068 possession (Score: 84-82)
Miles Murray drives and kicks out. Cole Anthony attempts a 3Pt. Contested by Paul Quickley (4.3 feet, MAN). Cole Anthony misses. Offensive rebound by Jarrett Oladipo! Jarrett Oladipo kicks it out.

[08:47] Team_068 possession (Score: 84-82)
Jarrett Oladipo attempts a 3Pt. Contested by Paul Quickley (4.7 feet, ZONE). Jarrett Oladipo misses. Rebound secured by D'Angelo McGrady.

[08:34] Team_070 possession (Score: 84-82)
Russell Morant attempts a Midrange. Contested by Jarrett Oladipo (4.0 feet, ZONE). Russell Morant misses. Offensive rebound by Luka Gobert! Luka Gobert kicks it out.

[08:17] Team_070 possession (Score: 84-82)
Russell Morant drives and kicks out. Luka Gobert attempts a Midrange. Contested by Jarrett Oladipo (3.8 feet, MAN). Luka Gobert misses. Rebound secured by Franz Curry.

[08:02] Team_068 possession (Score: 84-82)
Ja Banchero throws a bad pass out of bounds! TURNOVER! (dead ball)

[07:43] Team_070 possession (Score: 84-82)
D'Angelo McGrady drives to the basket... FOUL! Offensive foul on D'Angelo McGrady! Miles Murray drew the charge! [Team fouls: 1] (D'Angelo McGrady: 1 personal fouls) TURNOVER! (dead ball)

[07:28] Team_068 possession (Score: 84-82)
Miles Murray drives, Luka Gobert stays with him. Miles Murray attempts a Layup. Contested by Luka Gobert (4.9 feet, ZONE). MILES MURRAY MAKES IT!
Score: 86-82

[07:13] Team_070 possession (Score: 86-82)
Luka Gobert attempts a Midrange. Contested by Jarrett Oladipo (3.9 feet, MAN). Luka Gobert misses. Rebound secured by Jarrett Oladipo.

[06:55] Team_068 possession (Score: 86-82)
Franz Curry drives and kicks out. Cole Anthony attempts a Midrange. Contested by Allen Quickley (5.2 feet, ZONE). COLE ANTHONY MAKES IT! Assist: Jarrett Oladipo
Score: 88-82

[06:41] Team_070 possession (Score: 88-82)
Paul Quickley commits a violation (traveling/carry)! TURNOVER! (dead ball)

[06:28] Team_068 possession (Score: 88-82)
FOUL! Offensive foul on Jarrett Oladipo! Luka Gobert drew the charge! [Team fouls: 2] (Jarrett Oladipo: 1 personal fouls) TURNOVER! (dead ball)

[06:11] Team_070 possession (Score: 88-82)
Paul Quickley attempts a 3Pt. Contested by Cole Anthony (4.6 feet, MAN). Paul Quickley misses. Rebound secured by Ja Banchero.

[05:59] Team_068 possession (Score: 88-82)
Franz Curry attempts a Layup. Contested by Russell Morant (4.2 feet, ZONE). FRANZ CURRY MAKES IT! Assist: Miles Murray
Score: 90-82

[05:45] Team_070 possession (Score: 90-82)
Luka Gobert attempts a 3Pt. Contested by Ja Banchero (5.2 feet, ZONE). Luka Gobert misses. Offensive rebound by Luka Gobert! Luka Gobert kicks it out.

[05:34] Team_070 possession (Score: 90-82)
Russell Morant throws a bad pass out of bounds! TURNOVER! (dead ball)

[05:16] Team_068 possession (Score: 90-82)
Franz Curry attempts a Layup. Contested by Russell Morant (4.2 feet, ZONE). FRANZ CURRY MAKES IT!
Score: 92-82

[05:04] Team_070 possession (Score: 92-82)
Paul Quickley attempts a 3Pt. Contested by Ja Banchero (5.0 feet, ZONE). PAUL QUICKLEY MAKES IT! Assist: D'Angelo McGrady
Score: 92-85

[04:49] Team_068 possession (Score: 92-85)
Ja Banchero attempts a 3Pt. Contested by Allen Quickley (5.3 feet, MAN). Ja Banchero misses. FOUL! Loose ball foul on Russell Morant during the rebound battle. [Team fouls: 2] No free throws, side out. (Russell Morant: 1 personal fouls)

[04:39] Team_068 possession (Score: 92-85)
FOUL! Shooting foul on D'Angelo McGrady. Miles Murray to the line for 2 free throws. [Team fouls: 3] (D'Angelo McGrady: 2 personal fouls)   FT 1/2: GOOD   FT 2/2: GOOD Miles Murray makes 2/2 from the line.
Score: 94-85

[04:22] Team_070 possession (Score: 94-85)
Luka Gobert drives to the basket... Luka Gobert loses the ball! Stripped by Franz Curry! TURNOVER! (live ball)

[04:03] Team_068 possession (Score: 94-85)
Franz Curry drives, Russell Morant stays with him. Franz Curry attempts a Layup. Contested by Russell Morant (4.2 feet, MAN). FRANZ CURRY MAKES IT! Assist: Jarrett Oladipo
Score: 96-85

[03:52] Team_070 possession (Score: 96-85)
D'Angelo McGrady attempts a 3Pt. Contested by Ja Banchero (5.2 feet, ZONE). D'ANGELO MCGRADY MAKES IT!
Score: 96-88

[03:39] Team_068 possession (Score: 96-88)
Cole Anthony attempts a Midrange. Contested by Paul Quickley (4.3 feet, MAN). Cole Anthony misses. Rebound secured by Luka Gobert.

[03:23] Team_070 possession (Score: 96-88)
Allen Quickley drives and kicks out. Paul Quickley attempts a Midrange. Contested by Cole Anthony (4.8 feet, MAN). PAUL QUICKLEY MAKES IT!
Score: 96-90

[03:06] Team_068 possession (Score: 96-90)
Cole Anthony drives, Paul Quickley stays with him. Cole Anthony attempts a Layup. Contested by Paul Quickley (4.3 feet, MAN). Cole Anthony misses. FOUL! Loose ball foul on Russell Morant during the rebound battle. [Team fouls: 4] No free throws, side out. (Russell Morant: 2 personal fouls)

[02:53] Team_068 possession (Score: 96-90)
Jarrett Oladipo attempts a 3Pt. Contested by Paul Quickley (4.8 feet, ZONE). Jarrett Oladipo misses. Rebound secured by Luka Gobert.

[02:36] Team_070 possession (Score: 96-90)
Russell Morant drives, Franz Curry stays with him. Russell Morant attempts a Dunk. Contested by Franz Curry (4.6 feet, ZONE). RUSSELL MORANT MAKES IT!
Score: 96-92

[02:17] Team_068 possession (Score: 96-92)
Ja Banchero drives, Luka Gobert stays with him. Ja Banchero attempts a Dunk. Contested by Luka Gobert (5.1 feet, ZONE). Ja Banchero misses. Rebound secured by Luka Gobert.

[02:05] Team_070 possession (Score: 96-92)
Russell Morant drives to the basket... Russell Morant throws a bad pass! Stolen by Franz Curry! TURNOVER! (live ball)

[01:52] Team_068 possession (Score: 96-92)
FOUL! Holding foul on Russell Morant. [IN THE BONUS! 5 team fouls] Franz Curry to the line for 2 free throws. (Russell Morant: 3 personal fouls)   FT 1/2: GOOD   FT 2/2: GOOD Franz Curry makes 2/2 from the line.
Score: 98-92

[01:40] Team_070 possession (Score: 98-92)
Allen Quickley attempts a 3Pt. Contested by Ja Banchero (5.3 feet, MAN). Allen Quickley misses. Rebound secured by Franz Curry.

[01:29] Team_068 possession (Score: 98-92)
Franz Curry drives to the basket... Franz Curry loses control! Ball rolls out of bounds! TURNOVER! (dead ball)

[01:16] Team_070 possession (Score: 98-92)
FOUL! Reach-in foul on Ja Banchero during the drive. [Team fouls: 3] No free throws, side out. (Ja Banchero: 1 personal fouls)

[00:58] Team_070 possession (Score: 98-92)
Paul Quickley makes the Dunk and draws the foul on Franz Curry! And-1! Paul Quickley to the line for 1. [Team fouls: 4] (Franz Curry: 1 personal fouls)   FT 1/1: GOOD Paul Quickley makes 1/1 from the line.
Score: 98-95

[00:44] Team_068 possession (Score: 98-95)
Ja Banchero drives, picks up Russell Morant. Help arrives from Paul Quickley! Ja Banchero attempts a Layup. Contested by Paul Quickley (4.2 feet, ZONE). JA BANCHERO MAKES IT! Assist: Jarrett Oladipo
Score: 100-95

[00:31] Team_070 possession (Score: 100-95)
Allen Quickley attempts a Midrange. Contested by Jarrett Oladipo (4.3 feet, ZONE). Allen Quickley misses. Offensive rebound by Russell Morant! Russell Morant's putback is no good. Offensive rebound by Luka Gobert! Luka Gobert kicks it out.

[00:14] Team_070 possession (Score: 100-95)
Allen Quickley attempts a 3Pt. Contested by Jarrett Oladipo (4.3 feet, ZONE). Allen Quickley misses. Rebound secured by Ja Banchero.

================================================================================
                              4TH QUARTER COMPLETE                              
================================================================================

4TH QUARTER SCORE: Team_068 19, Team_070 21

BOX SCORE:
================================================================================

Team_068
--------------------------------------------------------------------------------
Player                MIN  PTS  REB  AST  TO      FG   FG%      3P   3P%
--------------------------------------------------------------------------------
Franz Curry            21    8    5    0   0   4/5    80.0     0/0   0.0
Cole Anthony           21    5    0    0   0   2/3    66.7     0/0   0.0
Miles Murray           21    4    0    1   0   2/2   100.0     0/0   0.0
Ja Banchero            21    2    3    1   0   1/3    33.3     0/0   0.0
Malcolm Herro          28    0    0    0   0   0/1     0.0     0/0   0.0
Jaren Johnson          28    0    0    0   0   0/1     0.0     0/0   0.0
Jarrett Oladipo        21    0    3    3   0   0/2     0.0     0/0   0.0

TEAM: FG: 9/17 (52.9%), 3PT: 1/5 (20.0%), REB: 12 (4 off, 8 def), AST: 5, TO: 4
TEAM FOULS: 4


Team_070
--------------------------------------------------------------------------------
Player                MIN  PTS  REB  AST  TO      FG   FG%      3P   3P%
--------------------------------------------------------------------------------
Paul Quickley          21    8    0    0   0   3/5    60.0     0/0   0.0
D'Angelo McGrady       21    5    2    1   0   2/2   100.0     0/0   0.0
LeBron Barnes          28    3    0    1   0   1/1   100.0     0/0   0.0
Cole Gasol             28    3    0    0   0   1/1   100.0     0/0   0.0
Russell Morant         21    2    0    0   0   1/4    25.0     0/0   0.0
Jabari Paul            28    0    2    0   0   0/0     0.0     0/0   0.0
Luka Gobert            21    0    7    1   0   0/1     0.0     0/0   0.0
Allen Quickley         21    0    0    0   0   0/2     0.0     0/0   0.0

TEAM: FG: 8/16 (50.0%), 3PT: 3/7 (42.9%), REB: 10 (3 off, 7 def), AST: 3, TO: 5
TEAM FOULS: 5 [Team_068 in BONUS]

================================================================================

================================================================================
                               FULL GAME COMPLETE                               
================================================================================

FINAL SCORE: Team_068 100, Team_070 95

SCORING BY QUARTER:
--------------------------------------------------------------------------------
Team                     Q1     Q2     Q3     Q4    FINAL
--------------------------------------------------------------------------------
Team_068                 26     28     27     19      100
Team_070                 31     27     16     21       95
--------------------------------------------------------------------------------

FULL GAME BOX SCORE:
================================================================================

Team_068
--------------------------------------------------------------------------------
Player                MIN  PTS  REB  AST  TO      FG   FG%      3P   3P%      FT STL BLK
--------------------------------------------------------------------------------
Zion Anunoby           28   18    0    3   3   9/13   69.2   3/4    75.0   1/1     0   0
Malcolm Herro          28    5    0    3   1   1/5    20.0   0/4     0.0   2/2     0   0
Jaren Johnson          28   13   10    4   0   5/11   45.5   2/6    33.3   3/3     0   0
Gary Simons            28   15   10    0   2   6/8    75.0   2/3    66.7   1/1     2   1
Nikola Ginobili        28    7    6    2   3   3/7    42.9   0/1     0.0   3/4     1   0
Cole Anthony           21   10    0    1   1   4/6    66.7   2/3    66.7   0/0     0   0
Ja Banchero            21    6    3    1   4   3/5    60.0   0/1     0.0   0/0     0   0
Miles Murray           21    7    0    2   1   4/6    66.7   0/1     0.0   5/6     0   0
Jarrett Oladipo        21    5    7    3   1   2/5    40.0   0/3     0.0   3/3     0   0
Franz Curry            21   14    9    1   0   6/7    85.7   0/0     0.0   4/4     2   0

TEAM: FG: 44/74 (59.5%), 3PT: 9/26 (34.6%), REB: 48 (13 off, 35 def), AST: 20, TO: 16


Team_070
--------------------------------------------------------------------------------
Player                MIN  PTS  REB  AST  TO      FG   FG%      3P   3P%      FT STL BLK
--------------------------------------------------------------------------------
Cole Gasol             28   17    0    4   1   7/10   70.0   3/4    75.0   6/7     0   0
LeBron Barnes          28   11    6    3   0   6/9    66.7   3/5    60.0   1/1     0   1
John Hyland            28    4    0    1   1   2/10   20.0   0/5     0.0   0/0     0   0
Khris Bryant           28   15    7    3   1   5/9    55.6   0/1     0.0   5/5     1   0
Jabari Paul            28   10   12    1   1   5/8    62.5   2/2   100.0   6/7     0   0
Paul Quickley          21   11    0    2   3   3/7    42.9   2/4    50.0   1/1     0   1
Allen Quickley         21    0    0    1   4   1/6    16.7   0/3     0.0   0/0     1   0
D'Angelo McGrady       21   12    5    2   1   5/5   100.0   2/2   100.0   2/2     1   0
Luka Gobert            21    7    9    1   0   3/4    75.0   0/0     0.0   3/3     1   0
Russell Morant         21    7    2    0   1   3/7    42.9   0/0     0.0   3/3     0   0

TEAM: FG: 40/75 (53.3%), 3PT: 12/26 (46.2%), REB: 38 (10 off, 28 def), AST: 18, TO: 13

================================================================================
