================================================================================
                        FULL GAME - Team_068 vs Team_035                        
================================================================================

================================================================================
                       1ST QUARTER - Team_068 vs Team_035                       
================================================================================

[12:00] Team_068 possession (Score: 0-0)
Nikola Ginobili drives to the basket... Nikola Ginobili loses the ball! Stripped by Magic Westbrook! TURNOVER! (live ball)

[11:49] Team_035 possession (Score: 0-0)
Dwyane Johnson drives, Gary Simons stays with him. Dwyane Johnson attempts a Layup. Contested by Gary Simons (3.1 feet, MAN). DWYANE JOHNSON MAKES IT! Assist: Domantas Green
Score: 0-2

[11:35] Team_068 possession (Score: 0-2)
Gary Simons attempts a 3Pt. Contested by Shaquille Ginobili (4.7 feet, ZONE). Gary Simons misses. Rebound secured by Magic Westbrook.

[11:19] Team_035 possession (Score: 0-2)
Magic Westbrook attempts a Layup. Contested by Nikola Ginobili (4.5 feet, MAN). Magic Westbrook misses. Rebound secured by Jaren Johnson.

[11:00] Team_068 possession (Score: 0-2)
Nikola Ginobili drives, picks up Magic Westbrook. Help arrives from Domantas Green! Nikola Ginobili attempts a Dunk. Contested by Domantas Green (4.3 feet, MAN). NIKOLA GINOBILI MAKES IT! Assist: Malcolm Herro
Score: 2-2

[10:45] Team_035 possession (Score: 2-2)
Magic Westbrook throws a bad pass out of bounds! TURNOVER! (dead ball)

[10:30] Team_068 possession (Score: 2-2)
Nikola Ginobili drives, Magic Westbrook stays with him. Nikola Ginobili attempts a Dunk. Contested by Magic Westbrook (4.3 feet, MAN). Nikola Ginobili misses. Rebound secured by Gary Johnson.

[10:15] Team_035 possession (Score: 2-2)
Shaquille Ginobili attempts a Layup. Contested by Malcolm Herro (4.0 feet, MAN). SHAQUILLE GINOBILI MAKES IT! Assist: Gary Johnson
Score: 2-4

[10:01] Team_068 possession (Score: 2-4)
Gary Simons drives, Dwyane Johnson stays with him. Gary Simons attempts a Layup. Contested by Dwyane Johnson (4.7 feet, ZONE). Gary Simons misses. Offensive rebound by Jaren Johnson! Jaren Johnson kicks it out.

[09:51] Team_068 possession (Score: 2-4)
Jaren Johnson attempts a 3Pt. Contested by Gary Johnson (4.3 feet, MAN). JAREN JOHNSON MAKES IT! Assist: Nikola Ginobili
Score: 5-4

[09:40] Team_035 possession (Score: 5-4)
Gary Johnson attempts a Midrange. Contested by Jaren Johnson (4.1 feet, MAN). GARY JOHNSON MAKES IT!
Score: 5-6

[09:26] Team_068 possession (Score: 5-6)
Gary Simons attempts a Midrange. Contested by Dwyane Johnson (4.7 feet, MAN). GARY SIMONS MAKES IT!
Score: 7-6

[09:12] Team_035 possession (Score: 7-6)
Gary Johnson attempts a Midrange. Contested by Jaren Johnson (4.1 feet, MAN). Gary Johnson misses. Rebound secured by Nikola Ginobili.

[08:59] Team_068 possession (Score: 7-6)
Gary Simons drives and kicks out. Gary Simons attempts a 3Pt. Contested by Shaquille Ginobili (3.9 feet, ZONE). GARY SIMONS MAKES IT! Assist: Jaren Johnson
Score: 10-6

[08:44] Team_035 possession (Score: 10-6)
FOUL! Shooting foul on Jaren Johnson. Shaquille Ginobili to the line for 3 free throws. [Team fouls: 1] (Jaren Johnson: 1 personal fouls)   FT 1/3: GOOD   FT 2/3: GOOD   FT 3/3: MISS Shaquille Ginobili makes 2/3 from the line. Rebound secured by Nikola Ginobili.
Score: 10-8

[08:28] Team_068 possession (Score: 10-8)
Malcolm Herro drives, Shaquille Ginobili stays with him. Malcolm Herro attempts a Layup. Contested by Shaquille Ginobili (3.9 feet, MAN). MALCOLM HERRO MAKES IT! Assist: Nikola Ginobili
Score: 12-8

[08:13] Team_035 possession (Score: 12-8)
Domantas Green attempts a Layup. Contested by Gary Simons (3.6 feet, ZONE). Domantas Green misses. Offensive rebound by Magic Westbrook! Magic Westbrook kicks it out.

[07:59] Team_035 possession (Score: 12-8)
Magic Westbrook drives and kicks out. Domantas Green attempts a Midrange. Contested by Nikola Ginobili (4.0 feet, ZONE). Domantas Green misses. Rebound secured by Nikola Ginobili.

[07:45] Team_068 possession (Score: 12-8)
Jaren Johnson attempts a 3Pt. Contested by Gary Johnson (4.3 feet, MAN). Jaren Johnson misses. Rebound secured by Magic Westbrook.

[07:32] Team_035 possession (Score: 12-8)
Magic Westbrook attempts a 3Pt. Contested by Nikola Ginobili (4.5 feet, MAN). Magic Westbrook misses. Rebound secured by Nikola Ginobili.

[07:17] Team_068 possession (Score: 12-8)
FOUL! Shooting foul on Dwyane Johnson. Zion Anunoby to the line for 2 free throws. [Team fouls: 1] (Dwyane Johnson: 1 personal fouls)   FT 1/2: GOOD   FT 2/2: GOOD Zion Anunoby makes 2/2 from the line.
Score: 14-8

[07:03] Team_035 possession (Score: 14-8)
Dwyane Johnson attempts a 3Pt. Contested by Zion Anunoby (4.3 feet, ZONE). Dwyane Johnson misses. Rebound secured by Nikola Ginobili.

[06:52] Team_068 possession (Score: 14-8)
Gary Simons attempts a 3Pt. Contested by Dwyane Johnson (4.7 feet, MAN). GARY SIMONS MAKES IT! Assist: Nikola Ginobili
Score: 17-8

[06:38] Team_035 possession (Score: 17-8)
Gary Johnson drives, picks up Gary Simons. Help arrives from Malcolm Herro! Gary Johnson attempts a Dunk. Contested by Malcolm Herro (3.7 feet, ZONE). GARY JOHNSON MAKES IT! Assist: Dwyane Johnson
Score: 17-10

[06:25] Team_068 possession (Score: 17-10)
Malcolm Herro drives to the basket... Malcolm Herro throws a bad pass out of bounds! TURNOVER! (dead ball)

[06:12] Team_035 possession (Score: 17-10)
Gary Johnson makes the Layup and draws the foul on Jaren Johnson! And-1! Gary Johnson to the line for 1. [Team fouls: 2] (Jaren Johnson: 2 personal fouls)   FT 1/1: GOOD Gary Johnson makes 1/1 from the line.
Score: 17-13

[05:57] Team_068 possession (Score: 17-13)
FOUL! Reach-in foul on Dwyane Johnson during the drive. [Team fouls: 2] No free throws, side out. (Dwyane Johnson: 2 personal fouls)

[05:42] Team_068 possession (Score: 17-13)
Jaren Johnson drives and kicks out. Gary Simons attempts a 3Pt. Contested by Shaquille Ginobili (3.9 feet, ZONE). GARY SIMONS MAKES IT! Assist: Nikola Ginobili
Score: 20-13

[05:25] Team_035 possession (Score: 20-13)
Domantas Green drives, Gary Simons stays with him. Domantas Green attempts a Dunk. Contested by Gary Simons (3.6 feet, ZONE). Domantas Green misses. Rebound secured by Jaren Johnson.

[05:10] Team_068 possession (Score: 20-13)
Malcolm Herro attempts a Midrange. Contested by Gary Johnson (3.8 feet, ZONE). Malcolm Herro misses. Rebound secured by Dwyane Johnson.

[04:56] Team_035 possession (Score: 20-13)
Shaquille Ginobili attempts a 3Pt. Contested by Malcolm Herro (4.1 feet, MAN). Shaquille Ginobili misses. Offensive rebound by Dwyane Johnson! Dwyane Johnson's putback is no good. Rebound secured by Gary Simons.

[04:40] Team_068 possession (Score: 20-13)
Nikola Ginobili loses the ball! Stripped by Magic Westbrook! TURNOVER! (live ball)

[04:23] Team_035 possession (Score: 20-13)
FOUL! Reach-in foul on Zion Anunoby during the drive. [Team fouls: 3] No free throws, side out. (Zion Anunoby: 1 personal fouls)

[04:12] Team_035 possession (Score: 20-13)
Magic Westbrook drives and kicks out. Magic Westbrook attempts a Midrange. Contested by Nikola Ginobili (4.2 feet, MAN). MAGIC WESTBROOK MAKES IT!
Score: 20-15

[03:52] Team_068 possession (Score: 20-15)
Zion Anunoby attempts a Midrange. Contested by Domantas Green (5.1 feet, ZONE). Zion Anunoby misses. Offensive rebound by Nikola Ginobili! Nikola Ginobili puts it back in!
Score: 22-15

[03:37] Team_035 possession (Score: 22-15)
Shaquille Ginobili drives and kicks out. Domantas Green attempts a 3Pt. Contested by Zion Anunoby (4.5 feet, ZONE). DOMANTAS GREEN MAKES IT! Assist: Dwyane Johnson
Score: 22-18

[03:24] Team_068 possession (Score: 22-18)
Gary Simons drives to the basket... Gary Simons throws a bad pass! Stolen by Dwyane Johnson! TURNOVER! (live ball)

[03:12] Team_035 possession (Score: 22-18)
Gary Johnson drives and kicks out. Shaquille Ginobili attempts a 3Pt. Contested by Zion Anunoby (4.5 feet, ZONE). Shaquille Ginobili misses. Rebound secured by Gary Simons.

[02:55] Team_068 possession (Score: 22-18)
Jaren Johnson attempts a 3Pt. Contested by Shaquille Ginobili (4.6 feet, ZONE). Jaren Johnson misses. Rebound secured by Gary Johnson.

[02:35] Team_035 possession (Score: 22-18)
Magic Westbrook drives and kicks out. FOUL! Shooting foul on Jaren Johnson. Dwyane Johnson to the line for 3 free throws. [Team fouls: 4] (Jaren Johnson: 3 personal fouls)   FT 1/3: GOOD   FT 2/3: GOOD   FT 3/3: GOOD Dwyane Johnson makes 3/3 from the line.
Score: 22-21

[02:20] Team_068 possession (Score: 22-21)
Gary Simons attempts a 3Pt. Contested by Domantas Green (5.6 feet, ZONE). GARY SIMONS MAKES IT! Assist: Zion Anunoby
Score: 25-21

[02:05] Team_035 possession (Score: 25-21)
Magic Westbrook attempts a Layup. Contested by Gary Simons (4.0 feet, ZONE). MAGIC WESTBROOK MAKES IT! Assist: Dwyane Johnson
Score: 25-23

[01:50] Team_068 possession (Score: 25-23)
Jaren Johnson attempts a 3Pt. Contested by Gary Johnson (4.5 feet, MAN). JAREN JOHNSON MAKES IT! Assist: Zion Anunoby
Score: 28-23

[01:37] Team_035 possession (Score: 28-23)
Gary Johnson attempts a 3Pt. Contested by Zion Anunoby (5.1 feet, ZONE). Gary Johnson misses. Rebound secured by Jaren Johnson.

[01:20] Team_068 possession (Score: 28-23)
Gary Simons makes the Layup and draws the foul on Dwyane Johnson! And-1! Gary Simons to the line for 1. [Team fouls: 3] (Dwyane Johnson: 3 personal fouls)   FT 1/1: GOOD Gary Simons makes 1/1 from the line.
Score: 31-23

[01:06] Team_035 possession (Score: 31-23)
Magic Westbrook attempts a Layup. Contested by Gary Simons (4.1 feet, ZONE). Magic Westbrook misses. Rebound secured by Gary Simons.

[00:51] Team_068 possession (Score: 31-23)
Malcolm Herro drives, picks up Dwyane Johnson. Help arrives from Domantas Green! Malcolm Herro attempts a Layup. Contested by Domantas Green (4.3 feet, ZONE). Malcolm Herro misses. Offensive rebound by Nikola Ginobili! Nikola Ginobili's putback is no good. Offensive rebound by Jaren Johnson! Jaren Johnson kicks it out.

[00:35] Team_068 possession (Score: 31-23)
Jaren Johnson attempts a 3Pt. Contested by Gary Johnson (4.6 feet, MAN). Jaren Johnson misses. Offensive rebound by Nikola Ginobili! Nikola Ginobili puts it back in!
Score: 33-23

[00:20] Team_035 possession (Score: 33-23)
Gary Johnson drives and kicks out. Domantas Green attempts a 3Pt. Contested by Zion Anunoby (4.8 feet, ZONE). Domantas Green misses. Rebound secured by Nikola Ginobili.

[00:07] Team_068 possession (Score: 33-23)
Malcolm Herro attempts a Midrange. Contested by Gary Johnson (4.2 feet, ZONE). Malcolm Herro misses. Rebound secured by Magic Westbrook.

================================================================================
                              1ST QUARTER COMPLETE                              
================================================================================

1ST QUARTER SCORE: Team_068 33, Team_035 23

BOX SCORE:
================================================================================

Team_068
--------------------------------------------------------------------------------
Player                MIN  PTS  REB  AST  TO      FG   FG%      3P   3P%
--------------------------------------------------------------------------------
Gary Simons            12   17    3    0   0   6/7    85.7     0/0   0.0
Jaren Johnson          12    6    5    1   0   2/4    50.0     0/0   0.0
Nikola Ginobili        12    6    8    4   0   3/4    75.0     0/0   0.0
Malcolm Herro          12    2    0    1   0   1/3    33.3     0/0   0.0
Zion Anunoby           12    2    0    2   0   1/1   100.0     0/0   0.0

TEAM: FG: 13/19 (68.4%), 3PT: 5/8 (62.5%), REB: 15 (4 off, 11 def), AST: 8, TO: 4
TEAM FOULS: 4


Team_035
--------------------------------------------------------------------------------
Player                MIN  PTS  REB  AST  TO      FG   FG%      3P   3P%
--------------------------------------------------------------------------------
Gary Johnson           12    7    2    1   0   3/7    42.9     0/0   0.0
Dwyane Johnson         12    5    1    3   0   2/3    66.7     0/0   0.0
Magic Westbrook        12    4    4    0   0   2/6    33.3     0/0   0.0
Domantas Green         12    3    0    1   0   1/2    50.0     0/0   0.0
Shaquille Ginobili     12    2    0    0   0   1/3    33.3     0/0   0.0

TEAM: FG: 9/21 (42.9%), 3PT: 0/5 (0.0%), REB: 8 (2 off, 6 def), AST: 5, TO: 1
TEAM FOULS: 3

================================================================================

================================================================================
                       2ND QUARTER - Team_068 vs Team_035                       
================================================================================

[12:00] Team_068 possession (Score: 33-23)
Jaren Johnson attempts a Midrange. Contested by Dwyane Johnson (4.6 feet, ZONE). Jaren Johnson misses. Rebound secured by Dwyane Johnson.

[11:44] Team_035 possession (Score: 33-23)
Gary Johnson attempts a 3Pt. Contested by Jaren Johnson (4.4 feet, MAN). Gary Johnson misses. Rebound secured by Jaren Johnson.

[11:32] Team_068 possession (Score: 33-23)
Zion Anunoby attempts a Layup. BLOCKED BY DOMANTAS GREEN! Ball is loose! Rebound secured by Dwyane Johnson.

[11:13] Team_035 possession (Score: 33-23)
Dwyane Johnson drives, picks up Gary Simons. Help arrives from Malcolm Herro! Dwyane Johnson attempts a Layup. Contested by Malcolm Herro (3.6 feet, MAN). Dwyane Johnson misses. Rebound secured by Nikola Ginobili.

[10:55] Team_068 possession (Score: 33-23)
Jaren Johnson attempts a Midrange. Contested by Gary Johnson (4.5 feet, ZONE). JAREN JOHNSON MAKES IT!
Score: 35-23

[10:39] Team_035 possession (Score: 35-23)
Shaquille Ginobili attempts a 3Pt. Contested by Zion Anunoby (4.6 feet, ZONE). Shaquille Ginobili misses. Rebound secured by Jaren Johnson.

[10:21] Team_068 possession (Score: 35-23)
Nikola Ginobili drives, Dwyane Johnson stays with him. Nikola Ginobili attempts a Dunk. Contested by Dwyane Johnson (4.3 feet, ZONE). NIKOLA GINOBILI MAKES IT!
Score: 37-23

[10:08] Team_035 possession (Score: 37-23)
Dwyane Johnson attempts a Layup. Contested by Gary Simons (3.7 feet, ZONE). DWYANE JOHNSON MAKES IT! Assist: Gary Johnson
Score: 37-25

[09:52] Team_068 possession (Score: 37-25)
FOUL! Reach-in foul on Dwyane Johnson during the drive. [Team fouls: 1] No free throws, side out. (Dwyane Johnson: 1 personal fouls)

[09:38] Team_068 possession (Score: 37-25)
FOUL! Holding foul on Domantas Green. [Team fouls: 2] No free throws, side out. (Domantas Green: 1 personal fouls)

[09:26] Team_068 possession (Score: 37-25)
Gary Simons attempts a 3Pt. Contested by Dwyane Johnson (5.1 feet, MAN). GARY SIMONS MAKES IT! Assist: Jaren Johnson
Score: 40-25

[09:12] Team_035 possession (Score: 40-25)
Shaquille Ginobili attempts a 3Pt. Contested by Malcolm Herro (4.7 feet, MAN). Shaquille Ginobili misses. Rebound secured by Jaren Johnson.

[08:57] Team_068 possession (Score: 40-25)
Gary Simons attempts a Layup. Contested by Dwyane Johnson (5.2 feet, ZONE). GARY SIMONS MAKES IT! Assist: Jaren Johnson
Score: 42-25

[08:43] Team_035 possession (Score: 42-25)
Shaquille Ginobili drives, Malcolm Herro stays with him. Shaquille Ginobili attempts a Dunk. Contested by Malcolm Herro (4.7 feet, MAN). SHAQUILLE GINOBILI MAKES IT!
Score: 42-27

[08:24] Team_068 possession (Score: 42-27)
Malcolm Herro drives and kicks out. Gary Simons attempts a Midrange. Contested by Dwyane Johnson (4.6 feet, MAN). Gary Simons misses. Rebound secured by Dwyane Johnson.

[08:11] Team_035 possession (Score: 42-27)
FOUL! Reach-in foul on Nikola Ginobili during the drive. [Team fouls: 1] No free throws, side out. (Nikola Ginobili: 1 personal fouls)

[07:59] Team_035 possession (Score: 42-27)
FOUL! Shooting foul on Zion Anunoby. Domantas Green to the line for 2 free throws. [Team fouls: 2] (Zion Anunoby: 1 personal fouls)   FT 1/2: GOOD   FT 2/2: GOOD Domantas Green makes 2/2 from the line.
Score: 42-29

[07:47] Team_068 possession (Score: 42-29)
Gary Simons attempts a 3Pt. Contested by Shaquille Ginobili (5.3 feet, ZONE). Gary Simons misses. Rebound secured by Magic Westbrook.

[07:33] Team_035 possession (Score: 42-29)
FOUL! Reach-in foul on Jaren Johnson during the drive. [Team fouls: 3] No free throws, side out. (Jaren Johnson: 1 personal fouls)

[07:17] Team_035 possession (Score: 42-29)
Shaquille Ginobili drives and kicks out. Gary Johnson attempts a 3Pt. Contested by Jaren Johnson (4.6 feet, MAN). Gary Johnson misses. Rebound secured by Gary Simons.

[07:02] Team_068 possession (Score: 42-29)
Jaren Johnson makes the Layup and draws the foul on Gary Johnson! And-1! Jaren Johnson to the line for 1. [Team fouls: 3] (Gary Johnson: 1 personal fouls)   FT 1/1: GOOD Jaren Johnson makes 1/1 from the line.
Score: 45-29

[06:49] Team_035 possession (Score: 45-29)
Shaquille Ginobili drives, picks up Gary Simons. Help arrives from Malcolm Herro! Shaquille Ginobili attempts a Layup. Contested by Malcolm Herro (4.2 feet, ZONE). SHAQUILLE GINOBILI MAKES IT! Assist: Dwyane Johnson
Score: 45-31

[06:36] Team_068 possession (Score: 45-31)
Zion Anunoby drives to the basket... Zion Anunoby throws a bad pass out of bounds! TURNOVER! (dead ball)

[06:36] Substitution (Team_068): Zion Anunoby OUT → Cole Anthony IN (stamina_rule2)

[06:36] Substitution (Team_068): Malcolm Herro OUT → Ja Banchero IN (stamina_rule2)

[06:36] Substitution (Team_068): Jaren Johnson OUT → Miles Murray IN (stamina_rule2)

[06:36] Substitution (Team_068): Gary Simons OUT → Jarrett Oladipo IN (stamina_rule2)

[06:36] Substitution (Team_068): Nikola Ginobili OUT → Franz Curry IN (stamina_rule2)

[06:36] Substitution (Team_035): Domantas Green OUT → CJ LaVine IN (stamina_rule2)

[06:36] Substitution (Team_035): Shaquille Ginobili OUT → Cole George IN (stamina_rule2)

[06:36] Substitution (Team_035): Gary Johnson OUT → Malcolm Turner IN (stamina_rule2)

[06:36] Substitution (Team_035): Dwyane Johnson OUT → Tobias Jordan IN (stamina_rule2)

[06:36] Substitution (Team_035): Magic Westbrook OUT → John Durant IN (stamina_rule2)

[06:21] Team_035 possession (Score: 45-31)
Malcolm Turner attempts a Midrange. Contested by Miles Murray (4.5 feet, ZONE). Malcolm Turner misses. Rebound secured by Jarrett Oladipo.

[06:07] Team_068 possession (Score: 45-31)
Jarrett Oladipo drives and kicks out. Jarrett Oladipo attempts a 3Pt. Contested by CJ LaVine (4.2 feet, ZONE). Jarrett Oladipo misses. Rebound secured by Cole George.

[05:53] Team_035 possession (Score: 45-31)
Tobias Jordan attempts a Midrange. Contested by Jarrett Oladipo (3.6 feet, MAN). TOBIAS JORDAN MAKES IT!
Score: 45-33

[05:40] Team_068 possession (Score: 45-33)
FOUL! Reach-in foul on Tobias Jordan during the drive. [Team fouls: 4] No free throws, side out. (Tobias Jordan: 1 personal fouls)

[05:27] Team_068 possession (Score: 45-33)
Ja Banchero drives, picks up Cole George. Help arrives from Malcolm Turner! Ja Banchero attempts a Dunk. Contested by Malcolm Turner (3.7 feet, MAN). JA BANCHERO MAKES IT! Assist: Franz Curry
Score: 47-33

[05:16] Team_035 possession (Score: 47-33)
Malcolm Turner attempts a 3Pt. Contested by Miles Murray (4.5 feet, MAN). Malcolm Turner misses. Rebound secured by Ja Banchero.

[05:03] Team_068 possession (Score: 47-33)
Franz Curry drives, picks up John Durant. Help arrives from Cole George! Franz Curry attempts a Layup. Contested by Cole George (4.8 feet, MAN). FRANZ CURRY MAKES IT! Assist: Miles Murray
Score: 49-33

[04:48] Team_035 possession (Score: 49-33)
Cole George attempts a Midrange. Contested by Ja Banchero (5.5 feet, MAN). Cole George misses. Offensive rebound by Tobias Jordan! Tobias Jordan kicks it out.

[04:36] Team_035 possession (Score: 49-33)
Cole George drives, picks up Ja Banchero. Help arrives from Miles Murray! Cole George attempts a Layup. Contested by Miles Murray (5.5 feet, MAN). Cole George misses. FOUL! Loose ball foul on Jarrett Oladipo during the rebound battle. [Team fouls: 4] No free throws, side out. (Jarrett Oladipo: 1 personal fouls)

[04:18] Team_035 possession (Score: 49-33)
Cole George drives to the basket... Cole George throws a bad pass! Stolen by Franz Curry! TURNOVER! (live ball)

[04:03] Team_068 possession (Score: 49-33)
Cole Anthony attempts a 3Pt. Contested by CJ LaVine (4.1 feet, MAN). Cole Anthony misses. Rebound secured by Cole George.

[03:50] Team_035 possession (Score: 49-33)
Malcolm Turner attempts a Midrange. Contested by Miles Murray (4.5 feet, MAN). MALCOLM TURNER MAKES IT!
Score: 49-35

[03:33] Team_068 possession (Score: 49-35)
Ja Banchero drives to the basket... Ja Banchero loses control! Ball rolls out of bounds! TURNOVER! (dead ball)

[03:16] Team_035 possession (Score: 49-35)
Tobias Jordan attempts a 3Pt. Contested by Jarrett Oladipo (3.6 feet, MAN). Tobias Jordan misses. Rebound secured by Ja Banchero.

[03:04] Team_068 possession (Score: 49-35)
Cole Anthony drives to the basket... FOUL! Offensive foul on Cole Anthony! John Durant drew the charge! [Team fouls: 5] (Cole Anthony: 1 personal fouls) TURNOVER! (dead ball)

[02:51] Team_035 possession (Score: 49-35)
CJ LaVine attempts a Midrange. Contested by Ja Banchero (5.3 feet, ZONE). CJ LaVine misses. Rebound secured by Franz Curry.

[02:37] Team_068 possession (Score: 49-35)
Ja Banchero attempts a Midrange. Contested by Cole George (3.7 feet, MAN). JA BANCHERO MAKES IT! Assist: Franz Curry
Score: 51-35

[02:27] Team_035 possession (Score: 51-35)
Cole George attempts a Midrange. Contested by Jarrett Oladipo (4.2 feet, ZONE). Cole George misses. Offensive rebound by Tobias Jordan! Tobias Jordan kicks it out.

[02:09] Team_035 possession (Score: 51-35)
John Durant drives, Franz Curry stays with him. John Durant attempts a Dunk. Contested by Franz Curry (4.3 feet, ZONE). John Durant misses. Offensive rebound by Tobias Jordan! Tobias Jordan kicks it out.

[01:53] Team_035 possession (Score: 51-35)
John Durant attempts a 3Pt. Contested by Ja Banchero (5.1 feet, ZONE). JOHN DURANT MAKES IT! Assist: Malcolm Turner
Score: 51-38

[01:38] Team_068 possession (Score: 51-38)
Ja Banchero attempts a 3Pt. Contested by CJ LaVine (4.3 feet, ZONE). Ja Banchero misses. Rebound secured by Cole George.

[01:24] Team_035 possession (Score: 51-38)
Cole George attempts a Midrange. Contested by Miles Murray (4.3 feet, ZONE). Cole George misses. Offensive rebound by Tobias Jordan! Tobias Jordan kicks it out.

[01:13] Team_035 possession (Score: 51-38)
CJ LaVine attempts a 3Pt. Contested by Cole Anthony (4.9 feet, MAN). CJ LaVine misses. FOUL! Loose ball foul on Franz Curry during the rebound battle. [IN THE BONUS! 6 team fouls] John Durant to the line for 2 free throws. (Franz Curry: 1 personal fouls)   FT 1/2: GOOD   FT 2/2: MISS John Durant makes 1/2 from the line. Rebound secured by Ja Banchero.
Score: 51-39

[01:03] Team_068 possession (Score: 51-39)
Miles Murray attempts a 3Pt. Contested by Malcolm Turner (4.9 feet, MAN). MILES MURRAY MAKES IT! Assist: Jarrett Oladipo
Score: 54-39

[00:44] Team_035 possession (Score: 54-39)
Cole George attempts a Midrange. Contested by Ja Banchero (5.5 feet, MAN). COLE GEORGE MAKES IT!
Score: 54-41

[00:30] Team_068 possession (Score: 54-41)
FOUL! Shooting foul on John Durant. Franz Curry to the line for 2 free throws. [BONUS: 5 team fouls] (John Durant: 1 personal fouls)   FT 1/2: GOOD   FT 2/2: GOOD Franz Curry makes 2/2 from the line.
Score: 56-41

[00:11] Team_035 possession (Score: 56-41)
CJ LaVine attempts a Midrange. Contested by Cole Anthony (4.9 feet, MAN). CJ LAVINE MAKES IT! Assist: Cole George
Score: 56-43

================================================================================
                              2ND QUARTER COMPLETE                              
================================================================================

2ND QUARTER SCORE: Team_068 23, Team_035 20

BOX SCORE:
================================================================================

Team_068
--------------------------------------------------------------------------------
Player                MIN  PTS  REB  AST  TO      FG   FG%      3P   3P%
--------------------------------------------------------------------------------
Jaren Johnson          18    5    3    2   0   2/3    66.7     0/0   0.0
Gary Simons            18    5    1    0   0   2/3    66.7     0/0   0.0
Franz Curry             6    4    1    2   0   2/2   100.0     0/0   0.0
Miles Murray            6    3    0    1   0   1/1   100.0     0/0   0.0
Nikola Ginobili        18    2    1    0   0   1/1   100.0     0/0   0.0
Zion Anunoby           18    0    0    0   0   0/1     0.0     0/0   0.0
Malcolm Herro          18    0    0    0   0   0/1     0.0     0/0   0.0
Jarrett Oladipo         6    0    1    1   0   0/1     0.0     0/0   0.0
Cole Anthony            6    0    0    0   0   0/1     0.0     0/0   0.0

TEAM: FG: 10/17 (58.8%), 3PT: 2/5 (40.0%), REB: 9 (0 off, 9 def), AST: 6, TO: 3
TEAM FOULS: 6 [Team_035 in BONUS]


Team_035
--------------------------------------------------------------------------------
Player                MIN  PTS  REB  AST  TO      FG   FG%      3P   3P%
--------------------------------------------------------------------------------
Shaquille Ginobili     18    4    0    0   0   2/5    40.0     0/0   0.0
Ja Banchero             6    4    3    0   0   2/3    66.7     0/0   0.0
John Durant             6    3    0    0   0   1/1   100.0     0/0   0.0
Dwyane Johnson         18    2    3    1   0   1/2    50.0     0/0   0.0
Domantas Green         18    2    0    0   0   1/1   100.0     0/0   0.0
Malcolm Turner          6    2    0    1   0   1/3    33.3     0/0   0.0
Cole George             6    2    3    1   0   1/1   100.0     0/0   0.0
Tobias Jordan           6    2    5    0   0   1/2    50.0     0/0   0.0
CJ LaVine               6    2    0    0   0   1/3    33.3     0/0   0.0
Gary Johnson           18    0    0    1   0   0/1     0.0     0/0   0.0
Magic Westbrook        18    0    1    0   0   0/0     0.0     0/0   0.0

TEAM: FG: 9/19 (47.4%), 3PT: 1/7 (14.3%), REB: 13 (6 off, 7 def), AST: 4, TO: 1
TEAM FOULS: 5 [Team_068 in BONUS]

================================================================================

================================================================================
                       3RD QUARTER - Team_068 vs Team_035                       
================================================================================

[12:00] Team_068 possession (Score: 56-43)
Malcolm Herro attempts a Midrange. Contested by Gary Johnson (3.8 feet, ZONE). Malcolm Herro misses. Rebound secured by Gary Johnson.

[11:45] Team_035 possession (Score: 56-43)
Magic Westbrook drives and kicks out. FOUL! Shooting foul on Malcolm Herro. Shaquille Ginobili to the line for 2 free throws. [Team fouls: 1] (Malcolm Herro: 1 personal fouls)   FT 1/2: GOOD   FT 2/2: GOOD Shaquille Ginobili makes 2/2 from the line.
Score: 56-45

[11:31] Team_068 possession (Score: 56-45)
Nikola Ginobili attempts a Layup. Contested by Dwyane Johnson (4.0 feet, ZONE). NIKOLA GINOBILI MAKES IT! Assist: Zion Anunoby
Score: 58-45

[11:14] Team_035 possession (Score: 58-45)
Gary Johnson attempts a Midrange. Contested by Jaren Johnson (4.1 feet, MAN). Gary Johnson misses. Rebound secured by Jaren Johnson.

[10:57] Team_068 possession (Score: 58-45)
Nikola Ginobili drives to the basket... Nikola Ginobili throws a bad pass! Stolen by Magic Westbrook! TURNOVER! (live ball)

[10:44] Team_035 possession (Score: 58-45)
Domantas Green attempts a Layup. Contested by Zion Anunoby (4.8 feet, MAN). DOMANTAS GREEN MAKES IT! Assist: Gary Johnson
Score: 58-47

[10:32] Team_068 possession (Score: 58-47)
Zion Anunoby drives, picks up Dwyane Johnson. Help arrives from Domantas Green! Zion Anunoby attempts a Layup. Contested by Domantas Green (4.3 feet, ZONE). ZION ANUNOBY MAKES IT! Assist: Malcolm Herro
Score: 60-47

[10:18] Team_035 possession (Score: 60-47)
FOUL! Shooting foul on Gary Simons. Dwyane Johnson to the line for 2 free throws. [Team fouls: 2] (Gary Simons: 1 personal fouls)   FT 1/2: GOOD   FT 2/2: GOOD Dwyane Johnson makes 2/2 from the line.
Score: 60-49

[10:01] Team_068 possession (Score: 60-49)
Nikola Ginobili makes the Layup and draws the foul on Dwyane Johnson! And-1! Nikola Ginobili to the line for 1. [Team fouls: 1] (Dwyane Johnson: 1 personal fouls)   FT 1/1: GOOD Nikola Ginobili makes 1/1 from the line.
Score: 63-49

[09:44] Team_035 possession (Score: 63-49)
Shaquille Ginobili attempts a Midrange. BLOCKED BY MALCOLM HERRO! Ball deflects out of bounds off Shaquille Ginobili.

[09:30] Team_068 possession (Score: 63-49)
Nikola Ginobili drives to the basket... Nikola Ginobili loses the ball! Stripped by Dwyane Johnson! TURNOVER! (live ball)

[09:13] Team_035 possession (Score: 63-49)
Gary Johnson attempts a Layup. Contested by Gary Simons (3.7 feet, ZONE). Gary Johnson misses. Rebound secured by Jaren Johnson.

[08:57] Team_068 possession (Score: 63-49)
Zion Anunoby drives, Dwyane Johnson stays with him. Zion Anunoby attempts a Layup. Contested by Dwyane Johnson (4.3 feet, ZONE). ZION ANUNOBY MAKES IT! Assist: Jaren Johnson
Score: 65-49

[08:38] Team_035 possession (Score: 65-49)
Shaquille Ginobili attempts a Midrange. Contested by Malcolm Herro (4.0 feet, MAN). Shaquille Ginobili misses. Rebound secured by Nikola Ginobili.

[08:22] Team_068 possession (Score: 65-49)
Malcolm Herro attempts a Layup. Contested by Dwyane Johnson (3.9 feet, ZONE). Malcolm Herro misses. Offensive rebound by Jaren Johnson! Jaren Johnson kicks it out.

[08:06] Team_068 possession (Score: 65-49)
Jaren Johnson drives and kicks out. FOUL! Shooting foul on Dwyane Johnson. Malcolm Herro to the line for 2 free throws. [Team fouls: 2] (Dwyane Johnson: 2 personal fouls)   FT 1/2: GOOD   FT 2/2: GOOD Malcolm Herro makes 2/2 from the line.
Score: 67-49

[07:51] Team_035 possession (Score: 67-49)
Shaquille Ginobili drives, Gary Simons stays with him. Shaquille Ginobili attempts a Dunk. Contested by Gary Simons (3.0 feet, ZONE). SHAQUILLE GINOBILI MAKES IT! Assist: Magic Westbrook
Score: 67-51

[07:36] Team_068 possession (Score: 67-51)
Nikola Ginobili drives to the basket... Nikola Ginobili commits a violation (traveling/carry)! TURNOVER! (dead ball)

[07:23] Team_035 possession (Score: 67-51)
Shaquille Ginobili drives and kicks out. Gary Johnson attempts a 3Pt. Contested by Jaren Johnson (3.6 feet, MAN). Gary Johnson misses. Rebound secured by Gary Simons.

[07:09] Team_068 possession (Score: 67-51)
Jaren Johnson loses control! Ball rolls out of bounds! TURNOVER! (dead ball)

[06:55] Team_035 possession (Score: 67-51)
Shaquille Ginobili drives and kicks out. Domantas Green attempts a 3Pt. Contested by Zion Anunoby (4.4 feet, ZONE). Domantas Green misses. Rebound secured by Gary Simons.

[06:40] Team_068 possession (Score: 67-51)
Gary Simons attempts a 3Pt. Contested by Dwyane Johnson (4.7 feet, MAN). GARY SIMONS MAKES IT!
Score: 70-51

[06:24] Team_035 possession (Score: 70-51)
FOUL! Holding foul on Nikola Ginobili. [Team fouls: 3] No free throws, side out. (Nikola Ginobili: 1 personal fouls)

[06:06] Team_035 possession (Score: 70-51)
Dwyane Johnson makes the Dunk and draws the foul on Malcolm Herro! And-1! Dwyane Johnson to the line for 1. [Team fouls: 4] (Malcolm Herro: 2 personal fouls)   FT 1/1: GOOD Dwyane Johnson makes 1/1 from the line.
Score: 70-54

[05:53] Team_068 possession (Score: 70-54)
Nikola Ginobili attempts a 3Pt. Contested by Shaquille Ginobili (4.0 feet, ZONE). NIKOLA GINOBILI MAKES IT! Assist: Malcolm Herro
Score: 73-54

[05:40] Team_035 possession (Score: 73-54)
Dwyane Johnson drives, Gary Simons stays with him. Dwyane Johnson attempts a Dunk. Contested by Gary Simons (3.1 feet, MAN). DWYANE JOHNSON MAKES IT!
Score: 73-56

[05:24] Team_068 possession (Score: 73-56)
Nikola Ginobili drives to the basket... Nikola Ginobili throws a bad pass out of bounds! TURNOVER! (dead ball)

[05:12] Team_035 possession (Score: 73-56)
Gary Johnson makes the Layup and draws the foul on Gary Simons! And-1! Gary Johnson to the line for 1. [BONUS: 5 team fouls] (Gary Simons: 2 personal fouls)   FT 1/1: MISS Gary Johnson makes 0/1 from the line. Rebound secured by Gary Simons.
Score: 73-58

[04:54] Team_068 possession (Score: 73-58)
Jaren Johnson drives and kicks out. Jaren Johnson attempts a 3Pt. Contested by Gary Johnson (3.8 feet, MAN). Jaren Johnson misses. Rebound secured by Magic Westbrook.

[04:44] Team_035 possession (Score: 73-58)
Dwyane Johnson drives, Gary Simons stays with him. Dwyane Johnson attempts a Dunk. Contested by Gary Simons (3.1 feet, MAN). Dwyane Johnson misses. FOUL! Loose ball foul on Gary Simons during the rebound battle. [IN THE BONUS! 6 team fouls] Magic Westbrook to the line for 2 free throws. (Gary Simons: 3 personal fouls)   FT 1/2: GOOD   FT 2/2: GOOD Magic Westbrook makes 2/2 from the line.
Score: 73-60

[04:27] Team_068 possession (Score: 73-60)
Gary Simons attempts a 3Pt. Contested by Shaquille Ginobili (4.8 feet, ZONE). GARY SIMONS MAKES IT! Assist: Malcolm Herro
Score: 76-60

[04:12] Team_035 possession (Score: 76-60)
Shaquille Ginobili makes the Layup and draws the foul on Gary Simons! And-1! Shaquille Ginobili to the line for 1. [BONUS: 7 team fouls] (Gary Simons: 4 personal fouls)   FT 1/1: GOOD Shaquille Ginobili makes 1/1 from the line.
Score: 76-63

[04:00] Team_068 possession (Score: 76-63)
Gary Simons drives and kicks out. Nikola Ginobili attempts a 3Pt. Contested by Magic Westbrook (4.4 feet, MAN). Nikola Ginobili misses. Offensive rebound by Jaren Johnson! Jaren Johnson kicks it out.

[03:46] Team_068 possession (Score: 76-63)
Zion Anunoby drives to the basket... Zion Anunoby throws a bad pass out of bounds! TURNOVER! (dead ball)

[03:32] Team_035 possession (Score: 76-63)
Magic Westbrook makes the Dunk and draws the foul on Nikola Ginobili! And-1! Magic Westbrook to the line for 1. [BONUS: 8 team fouls] (Nikola Ginobili: 2 personal fouls)   FT 1/1: GOOD Magic Westbrook makes 1/1 from the line.
Score: 76-66

[03:18] Team_068 possession (Score: 76-66)
Jaren Johnson makes the Layup and draws the foul on Gary Johnson! And-1! Jaren Johnson to the line for 1. [Team fouls: 3] (Gary Johnson: 1 personal fouls)   FT 1/1: GOOD Jaren Johnson makes 1/1 from the line.
Score: 79-66

[03:06] Team_035 possession (Score: 79-66)
FOUL! Shooting foul on Jaren Johnson. Gary Johnson to the line for 3 free throws. [BONUS: 9 team fouls] (Jaren Johnson: 1 personal fouls)   FT 1/3: MISS   FT 2/3: GOOD   FT 3/3: GOOD Gary Johnson makes 2/3 from the line.
Score: 79-68

[02:53] Team_068 possession (Score: 79-68)
Gary Simons attempts a Midrange. Contested by Shaquille Ginobili (4.9 feet, ZONE). GARY SIMONS MAKES IT!
Score: 81-68

[02:36] Team_035 possession (Score: 81-68)
Gary Johnson attempts a Midrange. Contested by Gary Simons (4.0 feet, ZONE). Gary Johnson misses. Rebound secured by Nikola Ginobili.

[02:21] Team_068 possession (Score: 81-68)
Nikola Ginobili drives, Dwyane Johnson stays with him. Nikola Ginobili attempts a Dunk. Contested by Dwyane Johnson (4.1 feet, ZONE). NIKOLA GINOBILI MAKES IT!
Score: 83-68

[02:08] Team_035 possession (Score: 83-68)
Shaquille Ginobili attempts a 3Pt. Contested by Zion Anunoby (4.4 feet, ZONE). SHAQUILLE GINOBILI MAKES IT! Assist: Domantas Green
Score: 83-71

[01:51] Team_068 possession (Score: 83-71)
Jaren Johnson drives, Gary Johnson stays with him. Jaren Johnson attempts a Dunk. Contested by Gary Johnson (4.5 feet, MAN). Jaren Johnson misses. Offensive rebound by Nikola Ginobili! Nikola Ginobili puts it back in!
Score: 85-71

[01:39] Team_035 possession (Score: 85-71)
Dwyane Johnson drives and kicks out. Domantas Green attempts a 3Pt. Contested by Zion Anunoby (4.7 feet, MAN). DOMANTAS GREEN MAKES IT! Assist: Magic Westbrook
Score: 85-74

[01:24] Team_068 possession (Score: 85-74)
Zion Anunoby drives, Domantas Green stays with him. Zion Anunoby attempts a Layup. Contested by Domantas Green (5.2 feet, MAN). ZION ANUNOBY MAKES IT! Assist: Nikola Ginobili
Score: 87-74

[01:09] Team_035 possession (Score: 87-74)
Gary Johnson drives and kicks out. Domantas Green attempts a 3Pt. Contested by Zion Anunoby (4.7 feet, ZONE). Domantas Green misses. Rebound secured by Nikola Ginobili.

[00:52] Team_068 possession (Score: 87-74)
Malcolm Herro attempts a 3Pt. Contested by Shaquille Ginobili (4.3 feet, ZONE). Malcolm Herro misses. Rebound secured by Magic Westbrook.

[00:40] Team_035 possession (Score: 87-74)
Dwyane Johnson attempts a Layup. Contested by Gary Simons (3.6 feet, ZONE). Dwyane Johnson misses. Offensive rebound by Magic Westbrook! Magic Westbrook kicks it out.

[00:26] Team_035 possession (Score: 87-74)
FOUL! Holding foul on Nikola Ginobili. [IN THE BONUS! 10 team fouls] Magic Westbrook to the line for 2 free throws. (Nikola Ginobili: 3 personal fouls)   FT 1/2: GOOD   FT 2/2: GOOD Magic Westbrook makes 2/2 from the line.
Score: 87-76

[00:13] Team_068 possession (Score: 87-76)
Gary Simons attempts a Midrange. BLOCKED BY DWYANE JOHNSON! Ball is loose! Rebound secured by Magic Westbrook.

================================================================================
                              3RD QUARTER COMPLETE                              
================================================================================

3RD QUARTER SCORE: Team_068 31, Team_035 33

BOX SCORE:
================================================================================

Team_068
--------------------------------------------------------------------------------
Player                MIN  PTS  REB  AST  TO      FG   FG%      3P   3P%
--------------------------------------------------------------------------------
Nikola Ginobili        30   12    4    1   0   5/5   100.0     0/0   0.0
Gary Simons            30    8    3    0   0   3/4    75.0     0/0   0.0
Zion Anunoby           30    6    0    1   0   3/3   100.0     0/0   0.0
Jaren Johnson          30    3    4    1   0   1/2    50.0     0/0   0.0
Malcolm Herro          30    2    0    3   0   1/3    33.3     0/0   0.0

TEAM: FG: 13/17 (76.5%), 3PT: 3/4 (75.0%), REB: 11 (3 off, 8 def), AST: 6, TO: 6
TEAM FOULS: 10 [Team_035 in BONUS]


Team_035
--------------------------------------------------------------------------------
Player                MIN  PTS  REB  AST  TO      FG   FG%      3P   3P%
--------------------------------------------------------------------------------
Shaquille Ginobili     30   10    0    0   0   4/8    50.0     0/0   0.0
Dwyane Johnson         30    7    0    0   0   3/3   100.0     0/0   0.0
Magic Westbrook        30    7    4    2   0   3/3   100.0     0/0   0.0
Domantas Green         30    5    0    1   0   2/2   100.0     0/0   0.0
Gary Johnson           30    2    1    1   0   1/6    16.7     0/0   0.0

TEAM: FG: 13/22 (59.1%), 3PT: 2/2 (100.0%), REB: 5 (1 off, 4 def), AST: 4, TO: 0
TEAM FOULS: 3

================================================================================

================================================================================
                       4TH QUARTER - Team_068 vs Team_035                       
================================================================================

[12:00] Team_068 possession (Score: 87-76)
Jaren Johnson attempts a 3Pt. Contested by Gary Johnson (4.4 feet, ZONE). Jaren Johnson misses. Rebound secured by Gary Johnson.

[11:42] Team_035 possession (Score: 87-76)
Domantas Green attempts a Midrange. Contested by Malcolm Herro (4.9 feet, ZONE). Domantas Green misses. Rebound secured by Gary Simons.

[11:28] Team_068 possession (Score: 87-76)
FOUL! Reach-in foul on Domantas Green during the drive. [Team fouls: 1] No free throws, side out. (Domantas Green: 1 personal fouls)

[11:10] Team_068 possession (Score: 87-76)
Malcolm Herro attempts a Midrange. Contested by Shaquille Ginobili (4.2 feet, MAN). Malcolm Herro misses. Rebound secured by Magic Westbrook.

[10:58] Team_035 possession (Score: 87-76)
Dwyane Johnson attempts a 3Pt. Contested by Zion Anunoby (4.6 feet, ZONE). DWYANE JOHNSON MAKES IT! Assist: Gary Johnson
Score: 87-79

[10:44] Team_068 possession (Score: 87-79)
Gary Simons attempts a Layup. BLOCKED BY DWYANE JOHNSON! Ball is loose! Rebound secured by Dwyane Johnson.

[10:28] Team_035 possession (Score: 87-79)
Dwyane Johnson drives and kicks out. Dwyane Johnson attempts a 3Pt. Contested by Zion Anunoby (4.8 feet, ZONE). Dwyane Johnson misses. Rebound secured by Nikola Ginobili.

[10:15] Team_068 possession (Score: 87-79)
Jaren Johnson drives, picks up Dwyane Johnson. Help arrives from Domantas Green! Jaren Johnson attempts a Layup. Contested by Domantas Green (4.8 feet, ZONE). Jaren Johnson misses. Rebound secured by Dwyane Johnson.

[10:03] Team_035 possession (Score: 87-79)
Shaquille Ginobili attempts a 3Pt. Contested by Zion Anunoby (4.6 feet, ZONE). Shaquille Ginobili misses. Rebound secured by Gary Simons.

[09:49] Team_068 possession (Score: 87-79)
Gary Simons attempts a 3Pt. Contested by Shaquille Ginobili (5.1 feet, ZONE). Gary Simons misses. Rebound secured by Dwyane Johnson.

[09:34] Team_035 possession (Score: 87-79)
Domantas Green attempts a Midrange. Contested by Zion Anunoby (5.2 feet, MAN). DOMANTAS GREEN MAKES IT!
Score: 87-81

[09:16] Team_068 possession (Score: 87-81)
Malcolm Herro drives to the basket... FOUL! Offensive foul on Malcolm Herro! Shaquille Ginobili drew the charge! [Team fouls: 1] (Malcolm Herro: 1 personal fouls) TURNOVER! (dead ball)

[09:01] Team_035 possession (Score: 87-81)
Gary Johnson drives, picks up Jaren Johnson. Help arrives from Malcolm Herro! Gary Johnson attempts a Layup. Contested by Malcolm Herro (4.7 feet, MAN). GARY JOHNSON MAKES IT!
Score: 87-83

[08:45] Team_068 possession (Score: 87-83)
FOUL! Reach-in foul on Dwyane Johnson during the drive. [Team fouls: 2] No free throws, side out. (Dwyane Johnson: 1 personal fouls)

[08:32] Team_068 possession (Score: 87-83)
Malcolm Herro drives, Shaquille Ginobili stays with him. Malcolm Herro attempts a Dunk. Contested by Shaquille Ginobili (4.5 feet, MAN). MALCOLM HERRO MAKES IT! Assist: Gary Simons
Score: 89-83

[08:19] Team_035 possession (Score: 89-83)
Shaquille Ginobili attempts a 3Pt. Contested by Malcolm Herro (4.8 feet, MAN). Shaquille Ginobili misses. Rebound secured by Nikola Ginobili.

[08:05] Team_068 possession (Score: 89-83)
Malcolm Herro attempts a Midrange. Contested by Shaquille Ginobili (4.6 feet, MAN). MALCOLM HERRO MAKES IT! Assist: Nikola Ginobili
Score: 91-83

[07:51] Team_035 possession (Score: 91-83)
Dwyane Johnson attempts a Layup. BLOCKED BY GARY SIMONS! Ball is loose! Rebound secured by Nikola Ginobili.

[07:39] Team_068 possession (Score: 91-83)
Malcolm Herro attempts a Midrange. Contested by Shaquille Ginobili (4.7 feet, MAN). Malcolm Herro misses. Rebound secured by Magic Westbrook.

[07:25] Team_035 possession (Score: 91-83)
Gary Johnson attempts a 3Pt. Contested by Jaren Johnson (4.9 feet, MAN). GARY JOHNSON MAKES IT! Assist: Domantas Green
Score: 91-86

[07:08] Team_068 possession (Score: 91-86)
FOUL! Offensive foul on Jaren Johnson! Gary Johnson drew the charge! [Team fouls: 2] (Jaren Johnson: 1 personal fouls) TURNOVER! (dead ball)

[06:54] Team_035 possession (Score: 91-86)
Shaquille Ginobili drives and kicks out. Shaquille Ginobili attempts a Midrange. Contested by Malcolm Herro (5.2 feet, MAN). Shaquille Ginobili misses. Rebound secured by Gary Simons.

[06:38] Team_068 possession (Score: 91-86)
Jaren Johnson attempts a 3Pt. Contested by Dwyane Johnson (5.2 feet, ZONE). Jaren Johnson misses. Rebound secured by Magic Westbrook.

[06:25] Team_035 possession (Score: 91-86)
Dwyane Johnson attempts a 3Pt. Contested by Jaren Johnson (4.5 feet, ZONE). DWYANE JOHNSON MAKES IT! Assist: Domantas Green
Score: 91-89

[06:07] Team_068 possession (Score: 91-89)
Jaren Johnson attempts a Midrange. Contested by Dwyane Johnson (5.2 feet, ZONE). Jaren Johnson misses. Rebound secured by Dwyane Johnson.

[05:53] Team_035 possession (Score: 91-89)
FOUL! Reach-in foul on Gary Simons during the drive. [Team fouls: 3] No free throws, side out. (Gary Simons: 1 personal fouls)

[05:37] Team_035 possession (Score: 91-89)
Magic Westbrook attempts a Midrange. Contested by Zion Anunoby (5.6 feet, ZONE). MAGIC WESTBROOK MAKES IT! Assist: Dwyane Johnson
Score: 91-91

[05:21] Team_068 possession (Score: 91-91)
Malcolm Herro attempts a 3Pt. Contested by Shaquille Ginobili (5.0 feet, ZONE). Malcolm Herro misses. Offensive rebound by Jaren Johnson! Jaren Johnson kicks it out.

[05:08] Team_068 possession (Score: 91-91)
Nikola Ginobili attempts a Midrange. Contested by Shaquille Ginobili (5.0 feet, ZONE). Nikola Ginobili misses. Rebound secured by Dwyane Johnson.

[04:54] Team_035 possession (Score: 91-91)
Shaquille Ginobili attempts a Midrange. Contested by Gary Simons (4.5 feet, ZONE). SHAQUILLE GINOBILI MAKES IT!
Score: 91-93

[04:42] Team_068 possession (Score: 91-93)
Zion Anunoby attempts a 3Pt. Wide open! Domantas Green is 6.0 feet away. [MAN] Zion Anunoby misses. Rebound secured by Magic Westbrook.

[04:23] Team_035 possession (Score: 91-93)
Gary Johnson attempts a Layup. Contested by Gary Simons (5.2 feet, ZONE). Gary Johnson misses. FOUL! Loose ball foul on Gary Simons during the rebound battle. [Team fouls: 4] No free throws, side out. (Gary Simons: 2 personal fouls)

[04:05] Team_035 possession (Score: 91-93)
Domantas Green drives and kicks out. Shaquille Ginobili attempts a 3Pt. Contested by Zion Anunoby (5.7 feet, ZONE). SHAQUILLE GINOBILI MAKES IT! Assist: Dwyane Johnson
Score: 91-96

[03:49] Team_068 possession (Score: 91-96)
Nikola Ginobili makes the Layup and draws the foul on Domantas Green! And-1! Nikola Ginobili to the line for 1. [Team fouls: 3] (Domantas Green: 2 personal fouls)   FT 1/1: GOOD Nikola Ginobili makes 1/1 from the line.
Score: 94-96

[03:32] Team_035 possession (Score: 94-96)
Dwyane Johnson attempts a 3Pt. Contested by Zion Anunoby (5.5 feet, ZONE). Dwyane Johnson misses. Rebound secured by Jaren Johnson.

[03:19] Team_068 possession (Score: 94-96)
Zion Anunoby drives to the basket... Zion Anunoby loses the ball! Stripped by Domantas Green! TURNOVER! (live ball)

[03:05] Team_035 possession (Score: 94-96)
Dwyane Johnson attempts a Layup. Contested by Gary Simons (4.9 feet, ZONE). DWYANE JOHNSON MAKES IT!
Score: 94-98

[02:48] Team_068 possession (Score: 94-98)
FOUL! Holding foul on Shaquille Ginobili. [Team fouls: 4] No free throws, side out. (Shaquille Ginobili: 1 personal fouls)

[02:36] Team_068 possession (Score: 94-98)
Jaren Johnson drives and kicks out. Zion Anunoby attempts a 3Pt. Wide open! Domantas Green is 6.2 feet away. [MAN] Zion Anunoby misses. Rebound secured by Gary Johnson.

[02:25] Team_035 possession (Score: 94-98)
FOUL! Offensive foul on Domantas Green! Zion Anunoby drew the charge! [Team fouls: 5] (Domantas Green: 3 personal fouls) TURNOVER! (dead ball)

[02:08] Team_068 possession (Score: 94-98)
Gary Simons drives and kicks out. Nikola Ginobili attempts a 3Pt. Wide open! Magic Westbrook is 6.2 feet away. [MAN] Nikola Ginobili misses. Rebound secured by Magic Westbrook.

[01:58] Team_035 possession (Score: 94-98)
Shaquille Ginobili attempts a Midrange. Contested by Malcolm Herro (5.7 feet, MAN). Shaquille Ginobili misses. Rebound secured by Jaren Johnson.

[01:43] Team_068 possession (Score: 94-98)
Zion Anunoby makes the Dunk and draws the foul on Domantas Green! And-1! Zion Anunoby to the line for 1. [BONUS: 6 team fouls] (Domantas Green: 4 personal fouls)   FT 1/1: GOOD Zion Anunoby makes 1/1 from the line.
Score: 97-98

[01:28] Team_035 possession (Score: 97-98)
FOUL! Shooting foul on Gary Simons. Magic Westbrook to the line for 2 free throws. [BONUS: 5 team fouls] (Gary Simons: 3 personal fouls)   FT 1/2: GOOD   FT 2/2: GOOD Magic Westbrook makes 2/2 from the line.
Score: 97-100

[01:14] Team_068 possession (Score: 97-100)
Malcolm Herro attempts a 3Pt. Contested by Shaquille Ginobili (5.6 feet, MAN). Malcolm Herro misses. Rebound secured by Magic Westbrook.

[01:00] Team_035 possession (Score: 97-100)
Dwyane Johnson makes the Dunk and draws the foul on Gary Simons! And-1! Dwyane Johnson to the line for 1. [BONUS: 6 team fouls] (Gary Simons: 4 personal fouls)   FT 1/1: GOOD Dwyane Johnson makes 1/1 from the line.
Score: 97-103

[00:42] Team_068 possession (Score: 97-103)
Nikola Ginobili drives, picks up Magic Westbrook. Help arrives from Domantas Green! Nikola Ginobili attempts a Layup. Wide open! Domantas Green is 6.2 feet away. [MAN] NIKOLA GINOBILI MAKES IT!
Score: 99-103

[00:26] Team_035 possession (Score: 99-103)
Gary Johnson attempts a 3Pt. Contested by Jaren Johnson (6.0 feet, MAN). Gary Johnson misses. Rebound secured by Nikola Ginobili.

[00:13] Team_068 possession (Score: 99-103)
Zion Anunoby attempts a 3Pt. Wide open! Shaquille Ginobili is 6.0 feet away. [ZONE] Zion Anunoby misses. Offensive rebound by Nikola Ginobili! Nikola Ginobili kicks it out.

================================================================================
                              4TH QUARTER COMPLETE                              
================================================================================

4TH QUARTER SCORE: Team_068 12, Team_035 27

BOX SCORE:
================================================================================

Team_068
--------------------------------------------------------------------------------
Player                MIN  PTS  REB  AST  TO      FG   FG%      3P   3P%
--------------------------------------------------------------------------------
Nikola Ginobili        42    5    5    1   0   2/3    66.7     0/0   0.0
Malcolm Herro          42    4    0    0   0   2/5    40.0     0/0   0.0
Zion Anunoby           42    3    0    0   0   1/2    50.0     0/0   0.0
Jaren Johnson          42    0    3    0   0   0/5     0.0     0/0   0.0
Gary Simons            42    0    3    1   0   0/3     0.0     0/0   0.0

TEAM: FG: 5/18 (27.8%), 3PT: 0/5 (0.0%), REB: 11 (2 off, 9 def), AST: 2, TO: 3
TEAM FOULS: 6 [Team_035 in BONUS]


Team_035
--------------------------------------------------------------------------------
Player                MIN  PTS  REB  AST  TO      FG   FG%      3P   3P%
--------------------------------------------------------------------------------
Dwyane Johnson         42   11    5    2   0   4/7    57.1     0/0   0.0
Gary Johnson           42    5    3    1   0   2/3    66.7     0/0   0.0
Shaquille Ginobili     42    5    0    0   0   2/6    33.3     0/0   0.0
Magic Westbrook        42    4    6    0   0   2/2   100.0     0/0   0.0
Domantas Green         42    2    0    2   0   1/2    50.0     0/0   0.0

TEAM: FG: 11/20 (55.0%), 3PT: 3/7 (42.9%), REB: 14 (1 off, 13 def), AST: 5, TO: 1
TEAM FOULS: 6 [Team_068 in BONUS]

================================================================================

================================================================================
                               FULL GAME COMPLETE                               
================================================================================

FINAL SCORE: Team_068 99, Team_035 103

SCORING BY QUARTER:
--------------------------------------------------------------------------------
Team                     Q1     Q2     Q3     Q4    FINAL
--------------------------------------------------------------------------------
Team_068                 33     23     31     12       99
Team_035                 23     20     33     27      103
--------------------------------------------------------------------------------

FULL GAME BOX SCORE:
================================================================================

Team_068
--------------------------------------------------------------------------------
Player                MIN  PTS  REB  AST  TO      FG   FG%      3P   3P%      FT STL BLK
--------------------------------------------------------------------------------
Zion Anunoby           42   11    0    3   1   6/8    75.0   0/1     0.0   3/3     0   0
Malcolm Herro          42    8    0    4   2   3/11   27.3   0/2     0.0   2/2     0   1
Jaren Johnson          42   14   15    4   4   9/18   50.0   3/7    42.9   2/2     0   0
Gary Simons            42   30   10    1   4  10/16   62.5   5/8    62.5   1/1     0   1
Nikola Ginobili        42   25   18    6   3   8/10   80.0   1/1   100.0   2/2     0   0
Cole Anthony            6    0    0    0   0   0/1     0.0   0/1     0.0   0/0     0   0
Ja Banchero             6    4    3    0   0   2/3    66.7   0/1     0.0   0/0     0   0
Miles Murray            6    3    0    1   0   1/1   100.0   1/1   100.0   0/0     0   0
Jarrett Oladipo         6    0    1    1   1   0/1     0.0   0/0     0.0   0/0     0   0
Franz Curry             6    4    1    2   1   2/2   100.0   0/0     0.0   2/2     1   0

TEAM: FG: 41/71 (57.7%), 3PT: 10/22 (45.5%), REB: 46 (9 off, 37 def), AST: 22, TO: 16


Team_035
--------------------------------------------------------------------------------
Player                MIN  PTS  REB  AST  TO      FG   FG%      3P   3P%      FT STL BLK
--------------------------------------------------------------------------------
Domantas Green         42   12    0    4   1   4/6    66.7   0/0     0.0   2/2     1   1
Shaquille Ginobili     42   21    0    0   0   8/21   38.1   1/7    14.3   5/6     0   0
Gary Johnson           42   14    6    4   0   6/17   35.3   2/5    40.0   3/5     0   0
Dwyane Johnson         42   25    9    6   0  11/16   68.8   2/4    50.0   7/7     2   2
Magic Westbrook        42   15   15    2   1   7/11   63.6   0/1     0.0   7/7     3   0
CJ LaVine               6    2    0    0   1   1/3    33.3   0/1     0.0   0/0     0   0
Cole George             6    2    3    1   0   1/1   100.0   0/0     0.0   0/0     0   0
Malcolm Turner          6    2    0    1   0   1/3    33.3   0/1     0.0   0/0     0   0
Tobias Jordan           6    2    5    0   0   1/2    50.0   0/1     0.0   0/0     0   0
John Durant             6    3    0    0   0   1/1   100.0   1/1   100.0   1/2     0   0

TEAM: FG: 42/82 (51.2%), 3PT: 6/21 (28.6%), REB: 40 (10 off, 30 def), AST: 18, TO: 3

================================================================================
