================================================================================
                        FULL GAME - Team_042 vs Team_099                        
================================================================================

================================================================================
                       1ST QUARTER - Team_042 vs Team_099                       
================================================================================

[12:00] Team_042 possession (Score: 0-0)
Kristaps Parker attempts a Layup. Contested by Larry James (5.0 feet, MAN). KRISTAPS PARKER MAKES IT!
Score: 2-0

[11:45] Team_099 possession (Score: 2-0)
Larry Wade throws a bad pass! Stolen by Cade Dosunmu! TURNOVER! (live ball)

[11:30] Team_042 possession (Score: 2-0)
FOUL! Shooting foul on Damian Ginobili. Jarrett Sabonis to the line for 2 free throws. [Team fouls: 1] (Damian Ginobili: 1 personal fouls)   FT 1/2: GOOD   FT 2/2: GOOD Jarrett Sabonis makes 2/2 from the line.
Score: 4-0

[11:15] Team_099 possession (Score: 4-0)
Damian Ginobili attempts a 3Pt. Contested by Tyler Barrett (3.6 feet, ZONE). Damian Ginobili misses. Offensive rebound by Larry Wade! Larry Wade puts it back in!
Score: 4-2

[11:04] Team_042 possession (Score: 4-2)
Kristaps Parker attempts a 3Pt. Contested by Ayo Barrett (3.7 feet, ZONE). Kristaps Parker misses. Rebound secured by Larry Wade.

[10:48] Team_099 possession (Score: 4-2)
Damian Ginobili attempts a Midrange. Contested by Tyler Barrett (3.6 feet, ZONE). Damian Ginobili misses. Offensive rebound by Vince Lillard! Vince Lillard's putback is no good. Rebound secured by Dejounte Butler.

[10:38] Team_042 possession (Score: 4-2)
Kristaps Parker attempts a Layup. Contested by Larry James (5.0 feet, MAN). KRISTAPS PARKER MAKES IT!
Score: 6-2

[10:24] Team_099 possession (Score: 6-2)
Larry Wade drives, Cade Dosunmu stays with him. Larry Wade attempts a Layup. Contested by Cade Dosunmu (4.2 feet, MAN). LARRY WADE MAKES IT! Assist: Larry James
Score: 6-4

[10:06] Team_042 possession (Score: 6-4)
Dejounte Butler attempts a Midrange. Contested by Larry James (5.3 feet, ZONE). DEJOUNTE BUTLER MAKES IT! Assist: Tyler Barrett
Score: 8-4

[09:53] Team_099 possession (Score: 8-4)
Larry Wade drives to the basket... FOUL! Offensive foul on Larry Wade! Cade Dosunmu drew the charge! [Team fouls: 2] (Larry Wade: 1 personal fouls) TURNOVER! (dead ball)

[09:39] Team_042 possession (Score: 8-4)
FOUL! Reach-in foul on Vince Lillard during the drive. [Team fouls: 3] No free throws, side out. (Vince Lillard: 1 personal fouls)

[09:25] Team_042 possession (Score: 8-4)
Cade Dosunmu drives, picks up Larry Wade. Help arrives from Ayo Barrett! Cade Dosunmu attempts a Dunk. Contested by Ayo Barrett (4.5 feet, MAN). CADE DOSUNMU MAKES IT! Assist: Dejounte Butler
Score: 10-4

[09:09] Team_099 possession (Score: 10-4)
Damian Ginobili attempts a Midrange. Contested by Dejounte Butler (3.8 feet, ZONE). Damian Ginobili misses. Rebound secured by Dejounte Butler.

[08:53] Team_042 possession (Score: 10-4)
Dejounte Butler drives and kicks out. Jarrett Sabonis attempts a Midrange. Contested by Damian Ginobili (3.5 feet, MAN). Jarrett Sabonis misses. Rebound secured by Larry Wade.

[08:39] Team_099 possession (Score: 10-4)
Ayo Barrett attempts a Layup. Contested by Tyler Barrett (3.5 feet, MAN). AYO BARRETT MAKES IT! Assist: Larry Wade
Score: 10-6

[08:24] Team_042 possession (Score: 10-6)
Cade Dosunmu drives and kicks out. Tyler Barrett attempts a 3Pt. Contested by Ayo Barrett (3.7 feet, ZONE). Tyler Barrett misses. Rebound secured by Larry Wade.

[08:08] Team_099 possession (Score: 10-6)
Larry James makes the Layup and draws the foul on Dejounte Butler! And-1! Larry James to the line for 1. [Team fouls: 1] (Dejounte Butler: 1 personal fouls)   FT 1/1: MISS Larry James makes 0/1 from the line. Rebound secured by Tyler Barrett.
Score: 10-8

[07:53] Team_042 possession (Score: 10-8)
Jarrett Sabonis makes the Layup and draws the foul on Larry Wade! And-1! Jarrett Sabonis to the line for 1. [Team fouls: 4] (Larry Wade: 2 personal fouls)   FT 1/1: GOOD Jarrett Sabonis makes 1/1 from the line.
Score: 13-8

[07:38] Team_099 possession (Score: 13-8)
Larry Wade attempts a 3Pt. Contested by Tyler Barrett (3.7 feet, ZONE). LARRY WADE MAKES IT! Assist: Larry James
Score: 13-11

[07:21] Team_042 possession (Score: 13-11)
Jarrett Sabonis attempts a 3Pt. Contested by Ayo Barrett (4.2 feet, ZONE). JARRETT SABONIS MAKES IT! Assist: Kristaps Parker
Score: 16-11

[07:02] Team_099 possession (Score: 16-11)
Damian Ginobili attempts a 3Pt. Contested by Jarrett Sabonis (4.1 feet, MAN). DAMIAN GINOBILI MAKES IT! Assist: Larry Wade
Score: 16-14

[06:47] Team_042 possession (Score: 16-14)
Cade Dosunmu drives and kicks out. Dejounte Butler attempts a Midrange. Contested by Vince Lillard (2.5 feet, MAN). DEJOUNTE BUTLER MAKES IT! Assist: Kristaps Parker
Score: 18-14

[06:35] Team_099 possession (Score: 18-14)
Ayo Barrett drives and kicks out. Larry Wade attempts a 3Pt. Contested by Cade Dosunmu (3.9 feet, MAN). Larry Wade misses. Rebound secured by Dejounte Butler.

[06:19] Team_042 possession (Score: 18-14)
Cade Dosunmu drives, Vince Lillard stays with him. Cade Dosunmu attempts a Layup. Contested by Vince Lillard (2.8 feet, ZONE). Cade Dosunmu misses. FOUL! Loose ball foul on Damian Ginobili during the rebound battle. [IN THE BONUS! 5 team fouls] Dejounte Butler to the line for 2 free throws. (Damian Ginobili: 2 personal fouls)   FT 1/2: GOOD   FT 2/2: GOOD Dejounte Butler makes 2/2 from the line.
Score: 20-14

[06:09] Team_099 possession (Score: 20-14)
Vince Lillard attempts a 3Pt. Contested by Tyler Barrett (3.5 feet, ZONE). Vince Lillard misses. Rebound secured by Cade Dosunmu.

[05:52] Team_042 possession (Score: 20-14)
Kristaps Parker throws a bad pass out of bounds! TURNOVER! (dead ball)

[05:36] Team_099 possession (Score: 20-14)
Ayo Barrett attempts a 3Pt. Contested by Tyler Barrett (3.5 feet, MAN). Ayo Barrett misses. Rebound secured by Dejounte Butler.

[05:18] Team_042 possession (Score: 20-14)
Tyler Barrett attempts a 3Pt. Contested by Ayo Barrett (4.2 feet, ZONE). Tyler Barrett misses. Rebound secured by Vince Lillard.

[05:03] Team_099 possession (Score: 20-14)
FOUL! Offensive foul on Damian Ginobili! Jarrett Sabonis drew the charge! [Team fouls: 6] (Damian Ginobili: 3 personal fouls) TURNOVER! (dead ball)

[04:47] Team_042 possession (Score: 20-14)
Cade Dosunmu drives, Larry Wade stays with him. Cade Dosunmu attempts a Layup. Contested by Larry Wade (4.5 feet, MAN). CADE DOSUNMU MAKES IT! Assist: Tyler Barrett
Score: 22-14

[04:29] Team_099 possession (Score: 22-14)
Larry James attempts a Midrange. Contested by Kristaps Parker (5.1 feet, MAN). LARRY JAMES MAKES IT! Assist: Ayo Barrett
Score: 22-16

[04:16] Team_042 possession (Score: 22-16)
Jarrett Sabonis drives, Larry Wade stays with him. Jarrett Sabonis attempts a Layup. Contested by Larry Wade (4.7 feet, ZONE). Jarrett Sabonis misses. Rebound secured by Larry Wade.

[04:03] Team_099 possession (Score: 22-16)
Ayo Barrett attempts a 3Pt. Contested by Tyler Barrett (3.6 feet, ZONE). Ayo Barrett misses. Rebound secured by Dejounte Butler.

[03:51] Team_042 possession (Score: 22-16)
Jarrett Sabonis drives, Damian Ginobili stays with him. Jarrett Sabonis attempts a Layup. Contested by Damian Ginobili (4.1 feet, MAN). JARRETT SABONIS MAKES IT! Assist: Kristaps Parker
Score: 24-16

[03:33] Team_099 possession (Score: 24-16)
Damian Ginobili attempts a Midrange. Contested by Jarrett Sabonis (4.2 feet, MAN). Damian Ginobili misses. Rebound secured by Dejounte Butler.

[03:18] Team_042 possession (Score: 24-16)
Kristaps Parker drives and kicks out. Cade Dosunmu attempts a Midrange. Contested by Damian Ginobili (3.7 feet, ZONE). Cade Dosunmu misses. Rebound secured by Larry Wade.

[03:05] Team_099 possession (Score: 24-16)
Ayo Barrett attempts a 3Pt. Contested by Tyler Barrett (3.7 feet, MAN). Ayo Barrett misses. Rebound secured by Dejounte Butler.

[02:53] Team_042 possession (Score: 24-16)
Dejounte Butler drives, Vince Lillard stays with him. Dejounte Butler attempts a Dunk. Contested by Vince Lillard (3.0 feet, ZONE). DEJOUNTE BUTLER MAKES IT! Assist: Kristaps Parker
Score: 26-16

[02:35] Team_099 possession (Score: 26-16)
Larry James attempts a 3Pt. Contested by Tyler Barrett (3.7 feet, ZONE). Larry James misses. Offensive rebound by Vince Lillard! Vince Lillard's putback is no good. Rebound secured by Cade Dosunmu.

[02:21] Team_042 possession (Score: 26-16)
Jarrett Sabonis drives to the basket... FOUL! Offensive foul on Jarrett Sabonis! Vince Lillard drew the charge! [Team fouls: 2] (Jarrett Sabonis: 1 personal fouls) TURNOVER! (dead ball)

[02:07] Team_099 possession (Score: 26-16)
Larry James attempts a Layup. Contested by Cade Dosunmu (4.4 feet, ZONE). LARRY JAMES MAKES IT! Assist: Larry Wade
Score: 26-18

[01:53] Team_042 possession (Score: 26-18)
Jarrett Sabonis attempts a 3Pt. Contested by Damian Ginobili (4.3 feet, MAN). JARRETT SABONIS MAKES IT! Assist: Tyler Barrett
Score: 29-18

[01:36] Team_099 possession (Score: 29-18)
Vince Lillard loses the ball! Stripped by Dejounte Butler! TURNOVER! (live ball)

[01:20] Team_042 possession (Score: 29-18)
FOUL! Reach-in foul on Ayo Barrett during the drive. [IN THE BONUS! 7 team fouls] Tyler Barrett to the line for 2 free throws. (Ayo Barrett: 1 personal fouls)   FT 1/2: GOOD   FT 2/2: GOOD Tyler Barrett makes 2/2 from the line.
Score: 31-18

[01:06] Team_099 possession (Score: 31-18)
Larry James attempts a 3Pt. Contested by Kristaps Parker (5.4 feet, MAN). Larry James misses. Offensive rebound by Vince Lillard! Vince Lillard's putback is no good. Offensive rebound by Larry Wade! Larry Wade kicks it out.

[00:48] Team_099 possession (Score: 31-18)
Larry James drives to the basket... FOUL! Offensive foul on Larry James! Kristaps Parker drew the charge! [Team fouls: 8] (Larry James: 1 personal fouls) TURNOVER! (dead ball)

[00:34] Team_042 possession (Score: 31-18)
Tyler Barrett attempts a 3Pt. Contested by Ayo Barrett (4.5 feet, MAN). Tyler Barrett misses. Offensive rebound by Dejounte Butler! Dejounte Butler puts it back in!
Score: 33-18

[00:22] Team_099 possession (Score: 33-18)
Ayo Barrett drives, Cade Dosunmu stays with him. Ayo Barrett attempts a Layup. Contested by Cade Dosunmu (4.6 feet, ZONE). Ayo Barrett misses. Rebound secured by Cade Dosunmu.

[00:08] Team_042 possession (Score: 33-18)
Dejounte Butler drives, Vince Lillard stays with him. Dejounte Butler attempts a Layup. Contested by Vince Lillard (3.4 feet, ZONE). DEJOUNTE BUTLER MAKES IT!
Score: 35-18

================================================================================
                              1ST QUARTER COMPLETE                              
================================================================================

1ST QUARTER SCORE: Team_042 35, Team_099 18

BOX SCORE:
================================================================================

Team_042
--------------------------------------------------------------------------------
Player                MIN  PTS  REB  AST  TO      FG   FG%      3P   3P%
--------------------------------------------------------------------------------
Jarrett Sabonis        12   13    0    0   0   5/6    83.3     0/0   0.0
Dejounte Butler        12   12    8    1   0   6/7    85.7     0/0   0.0
Kristaps Parker        12    4    0    4   0   2/4    50.0     0/0   0.0
Cade Dosunmu           12    4    3    0   0   2/3    66.7     0/0   0.0
Tyler Barrett          12    2    1    3   0   1/2    50.0     0/0   0.0

TEAM: FG: 16/22 (72.7%), 3PT: 3/5 (60.0%), REB: 10 (1 off, 9 def), AST: 8, TO: 2
TEAM FOULS: 2


Team_099
--------------------------------------------------------------------------------
Player                MIN  PTS  REB  AST  TO      FG   FG%      3P   3P%
--------------------------------------------------------------------------------
Larry Wade             12    7    7    3   0   3/3   100.0     0/0   0.0
Larry James            12    4    0    2   0   2/4    50.0     0/0   0.0
Damian Ginobili        12    3    0    0   0   1/4    25.0     0/0   0.0
Ayo Barrett            12    2    0    1   0   1/6    16.7     0/0   0.0
Vince Lillard          12    0    1    0   0   0/1     0.0     0/0   0.0

TEAM: FG: 7/18 (38.9%), 3PT: 3/8 (37.5%), REB: 10 (4 off, 6 def), AST: 6, TO: 5
TEAM FOULS: 8 [Team_042 in BONUS]

================================================================================

================================================================================
                       2ND QUARTER - Team_042 vs Team_099                       
================================================================================

[12:00] Team_042 possession (Score: 35-18)
Jarrett Sabonis attempts a Midrange. Contested by Damian Ginobili (4.2 feet, MAN). JARRETT SABONIS MAKES IT! Assist: Kristaps Parker
Score: 37-18

[11:47] Team_099 possession (Score: 37-18)
Larry Wade attempts a Midrange. Contested by Cade Dosunmu (4.6 feet, MAN). Larry Wade misses. Rebound secured by Dejounte Butler.

[11:35] Team_042 possession (Score: 37-18)
Kristaps Parker attempts a Midrange. Contested by Larry James (5.2 feet, MAN). KRISTAPS PARKER MAKES IT!
Score: 39-18

[11:23] Team_099 possession (Score: 39-18)
Vince Lillard drives and kicks out. Damian Ginobili attempts a 3Pt. Contested by Tyler Barrett (3.8 feet, ZONE). Damian Ginobili misses. Rebound secured by Cade Dosunmu.

[11:05] Team_042 possession (Score: 39-18)
Tyler Barrett attempts a 3Pt. Contested by Ayo Barrett (4.5 feet, MAN). Tyler Barrett misses. Rebound secured by Vince Lillard.

[10:49] Team_099 possession (Score: 39-18)
Vince Lillard makes the Dunk and draws the foul on Tyler Barrett! And-1! Vince Lillard to the line for 1. [Team fouls: 1] (Tyler Barrett: 1 personal fouls)   FT 1/1: GOOD Vince Lillard makes 1/1 from the line.
Score: 39-21

[10:32] Team_042 possession (Score: 39-21)
Kristaps Parker throws a bad pass! Stolen by Larry James! TURNOVER! (live ball)

[10:17] Team_099 possession (Score: 39-21)
Vince Lillard drives and kicks out. Larry James attempts a Midrange. Contested by Kristaps Parker (5.4 feet, ZONE). Larry James misses. Offensive rebound by Vince Lillard! Vince Lillard's putback is no good. Rebound secured by Tyler Barrett.

[09:59] Team_042 possession (Score: 39-21)
Cade Dosunmu attempts a 3Pt. Contested by Vince Lillard (3.4 feet, ZONE). CADE DOSUNMU MAKES IT!
Score: 42-21

[09:43] Team_099 possession (Score: 42-21)
Larry James makes the Midrange and draws the foul on Kristaps Parker! And-1! Larry James to the line for 1. [Team fouls: 2] (Kristaps Parker: 1 personal fouls)   FT 1/1: GOOD Larry James makes 1/1 from the line.
Score: 42-24

[09:24] Team_042 possession (Score: 42-24)
Jarrett Sabonis drives to the basket... Jarrett Sabonis throws a bad pass! Stolen by Damian Ginobili! TURNOVER! (live ball)

[09:14] Team_099 possession (Score: 42-24)
Larry James attempts a 3Pt. Contested by Tyler Barrett (4.1 feet, ZONE). Larry James misses. Rebound secured by Dejounte Butler.

[08:59] Team_042 possession (Score: 42-24)
Dejounte Butler attempts a 3Pt. Contested by Vince Lillard (3.5 feet, MAN). Dejounte Butler misses. Offensive rebound by Dejounte Butler! Dejounte Butler's putback is no good. Rebound secured by Larry Wade.

[08:44] Team_099 possession (Score: 42-24)
Larry Wade attempts a Midrange. Contested by Cade Dosunmu (5.0 feet, MAN). Larry Wade misses. Rebound secured by Cade Dosunmu.

[08:32] Team_042 possession (Score: 42-24)
Cade Dosunmu drives, Larry Wade stays with him. Cade Dosunmu attempts a Layup. Contested by Larry Wade (5.1 feet, ZONE). CADE DOSUNMU MAKES IT! Assist: Jarrett Sabonis
Score: 44-24

[08:16] Team_099 possession (Score: 44-24)
Ayo Barrett attempts a Layup. BLOCKED BY TYLER BARRETT! Ball is loose! Rebound secured by Dejounte Butler.

[08:07] Team_042 possession (Score: 44-24)
Kristaps Parker attempts a 3Pt. Contested by Ayo Barrett (4.3 feet, ZONE). Kristaps Parker misses. Rebound secured by Vince Lillard.

[07:47] Team_099 possession (Score: 44-24)
Damian Ginobili attempts a 3Pt. Contested by Jarrett Sabonis (4.8 feet, MAN). Damian Ginobili misses. Rebound secured by Dejounte Butler.

[07:36] Team_042 possession (Score: 44-24)
Tyler Barrett attempts a Midrange. Contested by Damian Ginobili (4.8 feet, ZONE). Tyler Barrett misses. Offensive rebound by Cade Dosunmu! Cade Dosunmu's putback is no good. Rebound secured by Damian Ginobili.

[07:25] Team_099 possession (Score: 44-24)
Ayo Barrett attempts a Midrange. Contested by Tyler Barrett (4.4 feet, MAN). AYO BARRETT MAKES IT! Assist: Larry James
Score: 44-26

[07:11] Team_042 possession (Score: 44-26)
Tyler Barrett drives, Vince Lillard stays with him. Tyler Barrett attempts a Layup. Contested by Vince Lillard (4.1 feet, ZONE). Tyler Barrett misses. Rebound secured by Vince Lillard.

[06:57] Team_099 possession (Score: 44-26)
Larry James attempts a Midrange. Contested by Kristaps Parker (5.9 feet, MAN). Larry James misses. Rebound secured by Dejounte Butler.

[06:44] Team_042 possession (Score: 44-26)
Cade Dosunmu drives and kicks out. Cade Dosunmu attempts a 3Pt. Contested by Larry Wade (5.3 feet, MAN). Cade Dosunmu misses. Rebound secured by Damian Ginobili.

[06:30] Team_099 possession (Score: 44-26)
Ayo Barrett attempts a 3Pt. Contested by Tyler Barrett (4.6 feet, MAN). AYO BARRETT MAKES IT! Assist: Damian Ginobili
Score: 44-29

[06:13] Team_042 possession (Score: 44-29)
Jarrett Sabonis attempts a Layup. Contested by Damian Ginobili (4.9 feet, MAN). JARRETT SABONIS MAKES IT! Assist: Tyler Barrett
Score: 46-29

[05:59] Team_099 possession (Score: 46-29)
Damian Ginobili drives to the basket... Damian Ginobili loses control! Ball rolls out of bounds! TURNOVER! (dead ball)

[05:59] Substitution (Team_042): Tyler Barrett OUT → Khris George IN (stamina_rule2)

[05:59] Substitution (Team_042): Kristaps Parker OUT → Isaiah Randle IN (stamina_rule2)

[05:59] Substitution (Team_042): Jarrett Sabonis OUT → Gary Jackson IN (stamina_rule2)

[05:59] Substitution (Team_042): Dejounte Butler OUT → Allen Towns IN (stamina_rule2)

[05:59] Substitution (Team_042): Cade Dosunmu OUT → Lamelo Stewart IN (stamina_rule2)

[05:59] Substitution (Team_099): Ayo Barrett OUT → CJ Cunningham IN (stamina_rule2)

[05:59] Substitution (Team_099): Larry James OUT → Manu Johnson IN (stamina_rule2)

[05:59] Substitution (Team_099): Damian Ginobili OUT → Scottie Quickley IN (stamina_rule2)

[05:59] Substitution (Team_099): Vince Lillard OUT → Donovan Green IN (stamina_rule2)

[05:59] Substitution (Team_099): Larry Wade OUT → Jarrett Fox IN (stamina_rule2)

[05:43] Team_042 possession (Score: 46-29)
Isaiah Randle attempts a Midrange. Contested by Manu Johnson (5.0 feet, MAN). ISAIAH RANDLE MAKES IT! Assist: Allen Towns
Score: 48-29

[05:25] Team_099 possession (Score: 48-29)
Manu Johnson drives and kicks out. Donovan Green attempts a Midrange. Contested by Allen Towns (4.3 feet, MAN). DONOVAN GREEN MAKES IT!
Score: 48-31

[05:11] Team_042 possession (Score: 48-31)
Isaiah Randle attempts a Layup. Contested by Jarrett Fox (4.2 feet, ZONE). ISAIAH RANDLE MAKES IT!
Score: 50-31

[04:52] Team_099 possession (Score: 50-31)
Jarrett Fox drives to the basket... Jarrett Fox loses control! Ball rolls out of bounds! TURNOVER! (dead ball)

[04:36] Team_042 possession (Score: 50-31)
Lamelo Stewart attempts a Layup. Contested by Jarrett Fox (3.9 feet, MAN). Lamelo Stewart misses. Rebound secured by Scottie Quickley.

[04:19] Team_099 possession (Score: 50-31)
Manu Johnson attempts a Midrange. Contested by Isaiah Randle (5.2 feet, MAN). Manu Johnson misses. Rebound secured by Lamelo Stewart.

[04:05] Team_042 possession (Score: 50-31)
Gary Jackson attempts a 3Pt. Contested by Manu Johnson (4.9 feet, ZONE). Gary Jackson misses. Rebound secured by Scottie Quickley.

[03:49] Team_099 possession (Score: 50-31)
CJ Cunningham attempts a 3Pt. Contested by Khris George (4.2 feet, ZONE). CJ CUNNINGHAM MAKES IT! Assist: Manu Johnson
Score: 50-34

[03:38] Team_042 possession (Score: 50-34)
Isaiah Randle throws a bad pass! Stolen by Manu Johnson! TURNOVER! (live ball)

[03:26] Team_099 possession (Score: 50-34)
Manu Johnson drives and kicks out. Manu Johnson attempts a Midrange. Contested by Isaiah Randle (5.1 feet, MAN). Manu Johnson misses. Rebound secured by Lamelo Stewart.

[03:11] Team_042 possession (Score: 50-34)
Khris George attempts a 3Pt. Wide open! CJ Cunningham is 6.5 feet away. [MAN] Khris George misses. Rebound secured by Donovan Green.

[02:57] Team_099 possession (Score: 50-34)
Jarrett Fox drives to the basket... Jarrett Fox loses the ball! Stripped by Lamelo Stewart! TURNOVER! (live ball)

[02:45] Team_042 possession (Score: 50-34)
Gary Jackson drives and kicks out. Lamelo Stewart attempts a 3Pt. Contested by Manu Johnson (4.9 feet, ZONE). Lamelo Stewart misses. Rebound secured by Jarrett Fox.

[02:33] Team_099 possession (Score: 50-34)
Manu Johnson drives, Isaiah Randle stays with him. Manu Johnson attempts a Dunk. Contested by Isaiah Randle (5.2 feet, MAN). MANU JOHNSON MAKES IT!
Score: 50-36

[02:16] Team_042 possession (Score: 50-36)
Gary Jackson attempts a Midrange. Contested by Scottie Quickley (4.0 feet, MAN). Gary Jackson misses. FOUL! Loose ball foul on Donovan Green during the rebound battle. [Team fouls: 1] No free throws, side out. (Donovan Green: 1 personal fouls)

[02:02] Team_042 possession (Score: 50-36)
Isaiah Randle attempts a 3Pt. Contested by Manu Johnson (5.0 feet, MAN). Isaiah Randle misses. FOUL! Loose ball foul on Jarrett Fox during the rebound battle. [Team fouls: 2] No free throws, side out. (Jarrett Fox: 1 personal fouls)

[01:52] Team_042 possession (Score: 50-36)
Gary Jackson makes the Layup and draws the foul on Scottie Quickley! And-1! Gary Jackson to the line for 1. [Team fouls: 3] (Scottie Quickley: 1 personal fouls)   FT 1/1: GOOD Gary Jackson makes 1/1 from the line.
Score: 53-36

[01:38] Team_099 possession (Score: 53-36)
CJ Cunningham attempts a 3Pt. Contested by Khris George (4.2 feet, MAN). CJ Cunningham misses. Rebound secured by Gary Jackson.

[01:22] Team_042 possession (Score: 53-36)
FOUL! Reach-in foul on Jarrett Fox during the drive. [Team fouls: 4] No free throws, side out. (Jarrett Fox: 2 personal fouls)

[01:08] Team_042 possession (Score: 53-36)
Lamelo Stewart drives to the basket... Lamelo Stewart loses control! Ball rolls out of bounds! TURNOVER! (dead ball)

[00:59] Team_099 possession (Score: 53-36)
Donovan Green attempts a Layup. Contested by Allen Towns (4.4 feet, MAN). Donovan Green misses. Offensive rebound by Donovan Green! Donovan Green kicks it out.

[00:46] Team_099 possession (Score: 53-36)
FOUL! Shooting foul on Isaiah Randle. Manu Johnson to the line for 3 free throws. [Team fouls: 3] (Isaiah Randle: 1 personal fouls)   FT 1/3: GOOD   FT 2/3: GOOD   FT 3/3: MISS Manu Johnson makes 2/3 from the line. FOUL! Loose ball foul on Lamelo Stewart during the free throw rebound! [Team fouls: 4] No free throws, side out. (Lamelo Stewart: 1 personal fouls)
Score: 53-38

[00:28] Team_099 possession (Score: 53-38)
Jarrett Fox attempts a Layup. Contested by Lamelo Stewart (4.6 feet, MAN). Jarrett Fox misses. Rebound secured by Gary Jackson.

[00:09] Team_042 possession (Score: 53-38)
Lamelo Stewart makes the Dunk and draws the foul on Manu Johnson! And-1! Lamelo Stewart to the line for 1. [BONUS: 5 team fouls] (Manu Johnson: 1 personal fouls)   FT 1/1: GOOD Lamelo Stewart makes 1/1 from the line.
Score: 56-38

================================================================================
                              2ND QUARTER COMPLETE                              
================================================================================

2ND QUARTER SCORE: Team_042 21, Team_099 20

BOX SCORE:
================================================================================

Team_042
--------------------------------------------------------------------------------
Player                MIN  PTS  REB  AST  TO      FG   FG%      3P   3P%
--------------------------------------------------------------------------------
Cade Dosunmu           18    5    2    0   0   2/3    66.7     0/0   0.0
Jarrett Sabonis        18    4    0    1   0   2/2   100.0     0/0   0.0
Isaiah Randle           6    4    0    0   0   2/2   100.0     0/0   0.0
Lamelo Stewart          6    3    2    0   0   1/2    50.0     0/0   0.0
Gary Jackson            6    3    2    0   0   1/3    33.3     0/0   0.0
Kristaps Parker        18    2    0    1   0   1/2    50.0     0/0   0.0
Dejounte Butler        18    0    5    0   0   0/1     0.0     0/0   0.0
Tyler Barrett          18    0    1    1   0   0/3     0.0     0/0   0.0
Allen Towns             6    0    2    1   0   0/0     0.0     0/0   0.0
Khris George            6    0    0    0   0   0/1     0.0     0/0   0.0

TEAM: FG: 9/19 (47.4%), 3PT: 1/6 (16.7%), REB: 15 (4 off, 11 def), AST: 4, TO: 4
TEAM FOULS: 4


Team_099
--------------------------------------------------------------------------------
Player                MIN  PTS  REB  AST  TO      FG   FG%      3P   3P%
--------------------------------------------------------------------------------
Ayo Barrett            18    5    0    0   0   2/3    66.7     0/0   0.0
Vince Lillard          18    3    3    0   0   1/3    33.3     0/0   0.0
Larry James            18    3    0    1   0   1/3    33.3     0/0   0.0
CJ Cunningham           6    3    0    0   0   1/2    50.0     0/0   0.0
Donovan Green           6    2    3    0   0   1/1   100.0     0/0   0.0
Manu Johnson            6    2    0    1   0   1/3    33.3     0/0   0.0
Larry Wade             18    0    1    0   0   0/2     0.0     0/0   0.0
Damian Ginobili        18    0    2    1   0   0/1     0.0     0/0   0.0
Scottie Quickley        6    0    2    0   0   0/0     0.0     0/0   0.0
Jarrett Fox             6    0    1    0   0   0/1     0.0     0/0   0.0

TEAM: FG: 7/19 (36.8%), 3PT: 2/5 (40.0%), REB: 11 (3 off, 8 def), AST: 3, TO: 3
TEAM FOULS: 5 [Team_042 in BONUS]

================================================================================

================================================================================
                       3RD QUARTER - Team_042 vs Team_099                       
================================================================================

[12:00] Team_042 possession (Score: 56-38)
Kristaps Parker attempts a 3Pt. Contested by Larry James (5.0 feet, MAN). Kristaps Parker misses. FOUL! Loose ball foul on Larry Wade during the rebound battle. [Team fouls: 1] No free throws, side out. (Larry Wade: 1 personal fouls)

[11:41] Team_042 possession (Score: 56-38)
Cade Dosunmu attempts a 3Pt. Contested by Ayo Barrett (4.0 feet, ZONE). Cade Dosunmu misses. Offensive rebound by Dejounte Butler! Dejounte Butler puts it back in!
Score: 58-38

[11:29] Team_099 possession (Score: 58-38)
Ayo Barrett attempts a Midrange. Contested by Kristaps Parker (5.1 feet, ZONE). Ayo Barrett misses. Rebound secured by Tyler Barrett.

[11:11] Team_042 possession (Score: 58-38)
Jarrett Sabonis attempts a 3Pt. Contested by Ayo Barrett (4.2 feet, ZONE). Jarrett Sabonis misses. Offensive rebound by Cade Dosunmu! Cade Dosunmu puts it back in!
Score: 60-38

[10:59] Team_099 possession (Score: 60-38)
Ayo Barrett attempts a 3Pt. Contested by Tyler Barrett (3.5 feet, MAN). Ayo Barrett misses. FOUL! Loose ball foul on Dejounte Butler during the rebound battle. [Team fouls: 1] No free throws, side out. (Dejounte Butler: 1 personal fouls)

[10:43] Team_099 possession (Score: 60-38)
Ayo Barrett drives, Cade Dosunmu stays with him. Ayo Barrett attempts a Layup. Contested by Cade Dosunmu (4.1 feet, ZONE). Ayo Barrett misses. Offensive rebound by Vince Lillard! Vince Lillard's putback is no good. Offensive rebound by Vince Lillard! Vince Lillard kicks it out.

[10:28] Team_099 possession (Score: 60-38)
Damian Ginobili attempts a 3Pt. Contested by Tyler Barrett (3.6 feet, ZONE). Damian Ginobili misses. Rebound secured by Cade Dosunmu.

[10:13] Team_042 possession (Score: 60-38)
FOUL! Shooting foul on Damian Ginobili. Jarrett Sabonis to the line for 2 free throws. [Team fouls: 2] (Damian Ginobili: 1 personal fouls)   FT 1/2: GOOD   FT 2/2: GOOD Jarrett Sabonis makes 2/2 from the line.
Score: 62-38

[10:02] Team_099 possession (Score: 62-38)
Ayo Barrett attempts a 3Pt. Contested by Tyler Barrett (3.5 feet, MAN). Ayo Barrett misses. Rebound secured by Tyler Barrett.

[09:44] Team_042 possession (Score: 62-38)
Cade Dosunmu drives to the basket... Cade Dosunmu loses the ball! Stripped by Larry Wade! TURNOVER! (live ball)

[09:27] Team_099 possession (Score: 62-38)
Larry James drives to the basket... FOUL! Offensive foul on Larry James! Kristaps Parker drew the charge! [Team fouls: 3] (Larry James: 1 personal fouls) TURNOVER! (dead ball)

[09:12] Team_042 possession (Score: 62-38)
Cade Dosunmu drives and kicks out. FOUL! Shooting foul on Larry Wade. Cade Dosunmu to the line for 2 free throws. [Team fouls: 4] (Larry Wade: 2 personal fouls)   FT 1/2: MISS   FT 2/2: GOOD Cade Dosunmu makes 1/2 from the line.
Score: 63-38

[09:01] Team_099 possession (Score: 63-38)
FOUL! Holding foul on Tyler Barrett. [Team fouls: 2] No free throws, side out. (Tyler Barrett: 1 personal fouls)

[08:47] Team_099 possession (Score: 63-38)
Vince Lillard drives and kicks out. Larry James attempts a 3Pt. Contested by Kristaps Parker (5.0 feet, MAN). Larry James misses. Rebound secured by Dejounte Butler.

[08:30] Team_042 possession (Score: 63-38)
Dejounte Butler attempts a 3Pt. Contested by Damian Ginobili (3.8 feet, ZONE). DEJOUNTE BUTLER MAKES IT! Assist: Jarrett Sabonis
Score: 66-38

[08:15] Team_099 possession (Score: 66-38)
FOUL! Reach-in foul on Cade Dosunmu during the drive. [Team fouls: 3] No free throws, side out. (Cade Dosunmu: 1 personal fouls)

[07:58] Team_099 possession (Score: 66-38)
FOUL! Reach-in foul on Jarrett Sabonis during the drive. [Team fouls: 4] No free throws, side out. (Jarrett Sabonis: 1 personal fouls)

[07:45] Team_099 possession (Score: 66-38)
Ayo Barrett attempts a 3Pt. Contested by Tyler Barrett (3.5 feet, ZONE). AYO BARRETT MAKES IT! Assist: Larry Wade
Score: 66-41

[07:27] Team_042 possession (Score: 66-41)
Jarrett Sabonis attempts a Midrange. BLOCKED BY DAMIAN GINOBILI! Ball is loose! Offensive rebound by Cade Dosunmu! Cade Dosunmu kicks it out.

[07:10] Team_042 possession (Score: 66-41)
Dejounte Butler attempts a 3Pt. Contested by Ayo Barrett (4.0 feet, ZONE). Dejounte Butler misses. Rebound secured by Damian Ginobili.

[06:58] Team_099 possession (Score: 66-41)
Damian Ginobili makes the Dunk and draws the foul on Jarrett Sabonis! And-1! Damian Ginobili to the line for 1. [BONUS: 5 team fouls] (Jarrett Sabonis: 2 personal fouls)   FT 1/1: GOOD Damian Ginobili makes 1/1 from the line.
Score: 66-44

[06:48] Team_042 possession (Score: 66-44)
Dejounte Butler attempts a Midrange. Contested by Vince Lillard (2.7 feet, ZONE). DEJOUNTE BUTLER MAKES IT!
Score: 68-44

[06:31] Team_099 possession (Score: 68-44)
Vince Lillard drives and kicks out. Larry James attempts a Midrange. Contested by Kristaps Parker (5.0 feet, ZONE). Larry James misses. Rebound secured by Cade Dosunmu.

[06:15] Team_042 possession (Score: 68-44)
Cade Dosunmu attempts a Dunk. BLOCKED BY VINCE LILLARD! Ball is loose! Offensive rebound by Cade Dosunmu! Cade Dosunmu kicks it out.

[05:59] Team_042 possession (Score: 68-44)
Dejounte Butler drives, Vince Lillard stays with him. Dejounte Butler attempts a Layup. Contested by Vince Lillard (2.7 feet, ZONE). Dejounte Butler misses. Rebound secured by Larry Wade.

[05:45] Team_099 possession (Score: 68-44)
Larry Wade attempts a Midrange. Contested by Kristaps Parker (5.3 feet, ZONE). Larry Wade misses. Rebound secured by Dejounte Butler.

[05:34] Team_042 possession (Score: 68-44)
Cade Dosunmu drives to the basket... Cade Dosunmu throws a bad pass! Stolen by Vince Lillard! TURNOVER! (live ball)

[05:20] Team_099 possession (Score: 68-44)
FOUL! Holding foul on Cade Dosunmu. [IN THE BONUS! 6 team fouls] Larry Wade to the line for 2 free throws. (Cade Dosunmu: 2 personal fouls)   FT 1/2: MISS   FT 2/2: GOOD Larry Wade makes 1/2 from the line.
Score: 68-45

[05:02] Team_042 possession (Score: 68-45)
FOUL! Shooting foul on Ayo Barrett. Tyler Barrett to the line for 3 free throws. [BONUS: 6 team fouls] (Ayo Barrett: 1 personal fouls)   FT 1/3: GOOD   FT 2/3: GOOD   FT 3/3: GOOD Tyler Barrett makes 3/3 from the line.
Score: 71-45

[04:47] Team_099 possession (Score: 71-45)
Vince Lillard throws a bad pass! Stolen by Dejounte Butler! TURNOVER! (live ball)

[04:38] Team_042 possession (Score: 71-45)
Cade Dosunmu drives to the basket... FOUL! Offensive foul on Cade Dosunmu! Larry Wade drew the charge! [Team fouls: 7] (Cade Dosunmu: 3 personal fouls) TURNOVER! (dead ball)

[04:23] Team_099 possession (Score: 71-45)
FOUL! Reach-in foul on Cade Dosunmu during the drive. [IN THE BONUS! 8 team fouls] Damian Ginobili to the line for 2 free throws. (Cade Dosunmu: 4 personal fouls)   FT 1/2: MISS   FT 2/2: GOOD Damian Ginobili makes 1/2 from the line.
Score: 71-46

[04:09] Team_042 possession (Score: 71-46)
Jarrett Sabonis drives and kicks out. Cade Dosunmu attempts a 3Pt. Contested by Ayo Barrett (3.8 feet, ZONE). Cade Dosunmu misses. Rebound secured by Damian Ginobili.

[03:54] Team_099 possession (Score: 71-46)
Damian Ginobili drives and kicks out. Larry James attempts a 3Pt. Contested by Dejounte Butler (3.7 feet, ZONE). LARRY JAMES MAKES IT! Assist: Larry Wade
Score: 71-49

[03:41] Team_042 possession (Score: 71-49)
Cade Dosunmu drives and kicks out. Cade Dosunmu attempts a Midrange. Contested by Damian Ginobili (3.7 feet, ZONE). Cade Dosunmu misses. Rebound secured by Larry Wade.

[03:25] Team_099 possession (Score: 71-49)
FOUL! Shooting foul on Tyler Barrett. Larry James to the line for 2 free throws. [BONUS: 9 team fouls] (Tyler Barrett: 2 personal fouls)   FT 1/2: GOOD   FT 2/2: GOOD Larry James makes 2/2 from the line.
Score: 71-51

[03:10] Team_042 possession (Score: 71-51)
Dejounte Butler drives, Vince Lillard stays with him. Dejounte Butler attempts a Layup. Contested by Vince Lillard (3.0 feet, MAN). Dejounte Butler misses. Rebound secured by Larry Wade.

[02:57] Team_099 possession (Score: 71-51)
FOUL! Shooting foul on Tyler Barrett. Ayo Barrett to the line for 3 free throws. [BONUS: 10 team fouls] (Tyler Barrett: 3 personal fouls)   FT 1/3: GOOD   FT 2/3: GOOD   FT 3/3: GOOD Ayo Barrett makes 3/3 from the line.
Score: 71-54

[02:45] Team_042 possession (Score: 71-54)
FOUL! Offensive foul on Tyler Barrett! Ayo Barrett drew the charge! [Team fouls: 11] (Tyler Barrett: 4 personal fouls) TURNOVER! (dead ball)

[02:33] Team_099 possession (Score: 71-54)
FOUL! Offensive foul on Damian Ginobili! Jarrett Sabonis drew the charge! [Team fouls: 7] (Damian Ginobili: 2 personal fouls) TURNOVER! (dead ball)

[02:22] Team_042 possession (Score: 71-54)
Dejounte Butler throws a bad pass out of bounds! TURNOVER! (dead ball)

[02:22] Substitution (Team_042): Tyler Barrett OUT → Khris George IN (stamina_rule2)

[02:22] Substitution (Team_042): Kristaps Parker OUT → Isaiah Randle IN (stamina_rule2)

[02:22] Substitution (Team_042): Jarrett Sabonis OUT → Gary Jackson IN (stamina_rule2)

[02:22] Substitution (Team_042): Dejounte Butler OUT → Allen Towns IN (stamina_rule2)

[02:22] Substitution (Team_042): Cade Dosunmu OUT → Lamelo Stewart IN (stamina_rule2)

[02:22] Substitution (Team_099): Damian Ginobili OUT → Scottie Quickley IN (stamina_rule2)

[02:22] Substitution (Team_099): Vince Lillard OUT → Donovan Green IN (stamina_rule2)

[02:22] Substitution (Team_099): Larry Wade OUT → Jarrett Fox IN (stamina_rule2)

[02:07] Team_099 possession (Score: 71-54)
Larry James throws a bad pass out of bounds! TURNOVER! (dead ball)

[01:50] Team_042 possession (Score: 71-54)
Allen Towns drives, Donovan Green stays with him. Allen Towns attempts a Dunk. Contested by Donovan Green (4.4 feet, MAN). ALLEN TOWNS MAKES IT! Assist: Lamelo Stewart
Score: 73-54

[01:38] Team_099 possession (Score: 73-54)
FOUL! Reach-in foul on Lamelo Stewart during the drive. [IN THE BONUS! 12 team fouls] Jarrett Fox to the line for 2 free throws. (Lamelo Stewart: 1 personal fouls)   FT 1/2: GOOD   FT 2/2: GOOD Jarrett Fox makes 2/2 from the line.
Score: 73-56

[01:22] Team_042 possession (Score: 73-56)
Khris George attempts a 3Pt. Contested by Ayo Barrett (4.8 feet, ZONE). KHRIS GEORGE MAKES IT! Assist: Allen Towns
Score: 76-56

[01:09] Team_099 possession (Score: 76-56)
Scottie Quickley drives to the basket... Scottie Quickley throws a bad pass out of bounds! TURNOVER! (dead ball)

[01:09] Substitution (Team_099): Ayo Barrett OUT → CJ Cunningham IN (stamina_rule2)

[01:09] Substitution (Team_099): Larry James OUT → Manu Johnson IN (stamina_rule2)

[00:56] Team_042 possession (Score: 76-56)
Isaiah Randle drives to the basket... Isaiah Randle loses control! Ball rolls out of bounds! TURNOVER! (dead ball)

[00:44] Team_099 possession (Score: 76-56)
Jarrett Fox drives to the basket... Jarrett Fox throws a bad pass! Stolen by Allen Towns! TURNOVER! (live ball)

[00:31] Team_042 possession (Score: 76-56)
Gary Jackson attempts a 3Pt. Contested by Manu Johnson (4.9 feet, ZONE). Gary Jackson misses. Rebound secured by Donovan Green.

[00:13] Team_099 possession (Score: 76-56)
Jarrett Fox drives and kicks out. Manu Johnson attempts a 3Pt. Contested by Isaiah Randle (5.1 feet, MAN). Manu Johnson misses. Rebound secured by Allen Towns.

================================================================================
                              3RD QUARTER COMPLETE                              
================================================================================

3RD QUARTER SCORE: Team_042 20, Team_099 18

BOX SCORE:
================================================================================

Team_042
--------------------------------------------------------------------------------
Player                MIN  PTS  REB  AST  TO      FG   FG%      3P   3P%
--------------------------------------------------------------------------------
Dejounte Butler        28    7    3    0   0   3/6    50.0     0/0   0.0
Cade Dosunmu           28    3    6    0   0   2/3    66.7     0/0   0.0
Tyler Barrett          28    3    2    0   0   1/1   100.0     0/0   0.0
Khris George            8    3    0    0   0   1/1   100.0     0/0   0.0
Jarrett Sabonis        28    2    0    1   0   1/2    50.0     0/0   0.0
Allen Towns             8    2    1    1   0   1/1   100.0     0/0   0.0
Lamelo Stewart          8    0    0    1   0   0/0     0.0     0/0   0.0
Gary Jackson            8    0    0    0   0   0/1     0.0     0/0   0.0

TEAM: FG: 9/15 (60.0%), 3PT: 5/7 (71.4%), REB: 12 (5 off, 7 def), AST: 3, TO: 6
TEAM FOULS: 12 [Team_099 in BONUS]


Team_099
--------------------------------------------------------------------------------
Player                MIN  PTS  REB  AST  TO      FG   FG%      3P   3P%
--------------------------------------------------------------------------------
Ayo Barrett            30    6    0    0   0   2/4    50.0     0/0   0.0
Larry James            30    5    0    0   0   2/2   100.0     0/0   0.0
Damian Ginobili        28    4    2    0   0   2/3    66.7     0/0   0.0
Jarrett Fox             8    2    0    0   0   1/2    50.0     0/0   0.0
Larry Wade             28    1    4    2   0   1/2    50.0     0/0   0.0
Vince Lillard          28    0    1    0   0   0/2     0.0     0/0   0.0
Donovan Green           8    0    1    0   0   0/0     0.0     0/0   0.0

TEAM: FG: 8/15 (53.3%), 3PT: 2/4 (50.0%), REB: 8 (2 off, 6 def), AST: 2, TO: 6
TEAM FOULS: 7 [Team_042 in BONUS]

================================================================================

================================================================================
                       4TH QUARTER - Team_042 vs Team_099                       
================================================================================

[12:00] Team_042 possession (Score: 76-56)
Jarrett Sabonis attempts a 3Pt. Contested by Damian Ginobili (4.0 feet, MAN). Jarrett Sabonis misses. Rebound secured by Larry Wade.

[11:46] Team_099 possession (Score: 76-56)
Larry Wade attempts a Midrange. Contested by Cade Dosunmu (4.3 feet, MAN). Larry Wade misses. Rebound secured by Cade Dosunmu.

[11:30] Team_042 possession (Score: 76-56)
Kristaps Parker attempts a 3Pt. Contested by Ayo Barrett (3.8 feet, ZONE). Kristaps Parker misses. Offensive rebound by Cade Dosunmu! Cade Dosunmu's putback is no good. Rebound secured by Larry Wade.

[11:17] Team_099 possession (Score: 76-56)
Ayo Barrett attempts a Midrange. Contested by Kristaps Parker (5.2 feet, ZONE). AYO BARRETT MAKES IT!
Score: 76-58

[11:04] Team_042 possession (Score: 76-58)
Dejounte Butler attempts a Midrange. Contested by Damian Ginobili (3.9 feet, ZONE). Dejounte Butler misses. Rebound secured by Vince Lillard.

[10:50] Team_099 possession (Score: 76-58)
Damian Ginobili attempts a Midrange. BLOCKED BY JARRETT SABONIS! Ball deflects out of bounds off Damian Ginobili.

[10:35] Team_042 possession (Score: 76-58)
Dejounte Butler attempts a Layup. BLOCKED BY VINCE LILLARD! Ball goes out off Vince Lillard. Dejounte Butler's ball!

[10:23] Team_042 possession (Score: 76-58)
Cade Dosunmu drives and kicks out. Dejounte Butler attempts a Midrange. Contested by Vince Lillard (2.7 feet, ZONE). DEJOUNTE BUTLER MAKES IT!
Score: 78-58

[10:13] Team_099 possession (Score: 78-58)
Ayo Barrett drives to the basket... Ayo Barrett commits a violation (traveling/carry)! TURNOVER! (dead ball)

[10:13] Substitution (Team_099): Ayo Barrett OUT → CJ Cunningham IN (stamina_rule2)

[10:13] Substitution (Team_099): Larry James OUT → Manu Johnson IN (stamina_rule2)

[09:54] Team_042 possession (Score: 78-58)
Dejounte Butler drives and kicks out. Cade Dosunmu attempts a 3Pt. Contested by Damian Ginobili (3.8 feet, ZONE). Cade Dosunmu misses. Rebound secured by Vince Lillard.

[09:44] Team_099 possession (Score: 78-58)
Manu Johnson attempts a Layup. Contested by Cade Dosunmu (4.3 feet, ZONE). Manu Johnson misses. Rebound secured by Dejounte Butler.

[09:27] Team_042 possession (Score: 78-58)
Cade Dosunmu drives and kicks out. Dejounte Butler attempts a Midrange. Contested by Vince Lillard (2.9 feet, ZONE). Dejounte Butler misses. Offensive rebound by Cade Dosunmu! Cade Dosunmu puts it back in!
Score: 80-58

[09:10] Team_099 possession (Score: 80-58)
Vince Lillard attempts a Midrange. Contested by Kristaps Parker (5.3 feet, ZONE). VINCE LILLARD MAKES IT!
Score: 80-60

[08:53] Team_042 possession (Score: 80-60)
Cade Dosunmu drives, picks up Larry Wade. Help arrives from Manu Johnson! Cade Dosunmu attempts a Dunk. Contested by Manu Johnson (4.8 feet, MAN). Cade Dosunmu misses. Offensive rebound by Cade Dosunmu! Cade Dosunmu's putback is no good. Rebound secured by Larry Wade.

[08:42] Team_099 possession (Score: 80-60)
Vince Lillard drives, Dejounte Butler stays with him. Vince Lillard attempts a Layup. Contested by Dejounte Butler (4.0 feet, MAN). VINCE LILLARD MAKES IT! Assist: Manu Johnson
Score: 80-62

[08:24] Team_042 possession (Score: 80-62)
Cade Dosunmu attempts a Layup. BLOCKED BY MANU JOHNSON! Ball goes out off Manu Johnson. Cade Dosunmu's ball!

[08:10] Team_042 possession (Score: 80-62)
Dejounte Butler attempts a Layup. Contested by Larry Wade (4.9 feet, ZONE). DEJOUNTE BUTLER MAKES IT!
Score: 82-62

[07:59] Team_099 possession (Score: 82-62)
FOUL! Shooting foul on Dejounte Butler. Larry Wade to the line for 2 free throws. [Team fouls: 1] (Dejounte Butler: 1 personal fouls)   FT 1/2: GOOD   FT 2/2: MISS Larry Wade makes 1/2 from the line. Rebound secured by Tyler Barrett.
Score: 82-63

[07:47] Team_042 possession (Score: 82-63)
Jarrett Sabonis attempts a 3Pt. Contested by Manu Johnson (5.2 feet, ZONE). Jarrett Sabonis misses. Rebound secured by Vince Lillard.

[07:36] Team_099 possession (Score: 82-63)
Larry Wade drives, Cade Dosunmu stays with him. Larry Wade attempts a Layup. Contested by Cade Dosunmu (4.8 feet, ZONE). LARRY WADE MAKES IT! Assist: Damian Ginobili
Score: 82-65

[07:17] Team_042 possession (Score: 82-65)
Jarrett Sabonis loses control! Ball rolls out of bounds! TURNOVER! (dead ball)

[07:17] Substitution (Team_042): Tyler Barrett OUT → Khris George IN (stamina_rule2)

[07:17] Substitution (Team_042): Kristaps Parker OUT → Isaiah Randle IN (stamina_rule2)

[07:17] Substitution (Team_042): Jarrett Sabonis OUT → Gary Jackson IN (stamina_rule2)

[07:17] Substitution (Team_042): Dejounte Butler OUT → Allen Towns IN (stamina_rule2)

[07:17] Substitution (Team_042): Cade Dosunmu OUT → Lamelo Stewart IN (stamina_rule2)

[07:17] Substitution (Team_099): Damian Ginobili OUT → Scottie Quickley IN (stamina_rule2)

[07:17] Substitution (Team_099): Vince Lillard OUT → Donovan Green IN (stamina_rule2)

[07:17] Substitution (Team_099): Larry Wade OUT → Jarrett Fox IN (stamina_rule2)

[07:00] Team_099 possession (Score: 82-65)
Scottie Quickley attempts a Midrange. Contested by Gary Jackson (4.9 feet, MAN). Scottie Quickley misses. Rebound secured by Lamelo Stewart.

[06:45] Team_042 possession (Score: 82-65)
Gary Jackson drives to the basket... Gary Jackson loses control! Ball rolls out of bounds! TURNOVER! (dead ball)

[06:32] Team_099 possession (Score: 82-65)
Jarrett Fox attempts a Layup. BLOCKED BY LAMELO STEWART! Ball is loose! Offensive rebound by Jarrett Fox! Jarrett Fox kicks it out.

[06:20] Team_099 possession (Score: 82-65)
Donovan Green attempts a Layup. Contested by Allen Towns (4.4 feet, MAN). DONOVAN GREEN MAKES IT! Assist: Manu Johnson
Score: 82-67

[06:05] Team_042 possession (Score: 82-67)
Allen Towns makes the Dunk and draws the foul on Donovan Green! And-1! Allen Towns to the line for 1. [Team fouls: 1] (Donovan Green: 1 personal fouls)   FT 1/1: GOOD Allen Towns makes 1/1 from the line.
Score: 85-67

[05:48] Team_099 possession (Score: 85-67)
Manu Johnson attempts a 3Pt. Contested by Isaiah Randle (5.2 feet, MAN). Manu Johnson misses. Rebound secured by Allen Towns.

[05:33] Team_042 possession (Score: 85-67)
Allen Towns attempts a Midrange. Contested by Donovan Green (4.4 feet, MAN). Allen Towns misses. Rebound secured by Scottie Quickley.

[05:22] Team_099 possession (Score: 85-67)
Jarrett Fox attempts a Layup. Contested by Allen Towns (4.7 feet, ZONE). JARRETT FOX MAKES IT! Assist: Donovan Green
Score: 85-69

[05:12] Team_042 possession (Score: 85-69)
Isaiah Randle drives and kicks out. Lamelo Stewart attempts a 3Pt. Contested by Manu Johnson (4.9 feet, ZONE). LAMELO STEWART MAKES IT! Assist: Allen Towns
Score: 88-69

[04:57] Team_099 possession (Score: 88-69)
CJ Cunningham attempts a 3Pt. Contested by Khris George (4.2 feet, ZONE). CJ Cunningham misses. Rebound secured by Allen Towns.

[04:43] Team_042 possession (Score: 88-69)
FOUL! Holding foul on Scottie Quickley. [Team fouls: 2] No free throws, side out. (Scottie Quickley: 1 personal fouls)

[04:26] Team_042 possession (Score: 88-69)
Khris George attempts a Layup. BLOCKED BY JARRETT FOX! Ball is loose! Rebound secured by Jarrett Fox.

[04:11] Team_099 possession (Score: 88-69)
CJ Cunningham attempts a 3Pt. Contested by Khris George (4.2 feet, ZONE). CJ Cunningham misses. Rebound secured by Gary Jackson.

[04:00] Team_042 possession (Score: 88-69)
FOUL! Reach-in foul on CJ Cunningham during the drive. [Team fouls: 3] No free throws, side out. (CJ Cunningham: 1 personal fouls)

[03:44] Team_042 possession (Score: 88-69)
Khris George drives, Jarrett Fox stays with him. Khris George attempts a Dunk. Contested by Jarrett Fox (4.7 feet, ZONE). KHRIS GEORGE MAKES IT! Assist: Lamelo Stewart
Score: 90-69

[03:32] Team_099 possession (Score: 90-69)
FOUL! Reach-in foul on Allen Towns during the drive. [Team fouls: 3] No free throws, side out. (Allen Towns: 1 personal fouls)

[03:14] Team_099 possession (Score: 90-69)
Scottie Quickley attempts a Midrange. Contested by Allen Towns (4.6 feet, ZONE). SCOTTIE QUICKLEY MAKES IT! Assist: Donovan Green
Score: 90-71

[02:57] Team_042 possession (Score: 90-71)
Isaiah Randle makes the Midrange and draws the foul on Manu Johnson! And-1! Isaiah Randle to the line for 1. [Team fouls: 4] (Manu Johnson: 1 personal fouls)   FT 1/1: GOOD Isaiah Randle makes 1/1 from the line.
Score: 93-71

[02:46] Team_099 possession (Score: 93-71)
Jarrett Fox drives to the basket... FOUL! Offensive foul on Jarrett Fox! Allen Towns drew the charge! [Team fouls: 5] (Jarrett Fox: 1 personal fouls) TURNOVER! (dead ball)

[02:29] Team_042 possession (Score: 93-71)
Lamelo Stewart attempts a Layup. Contested by Jarrett Fox (3.9 feet, MAN). LAMELO STEWART MAKES IT!
Score: 95-71

[02:14] Team_099 possession (Score: 95-71)
Manu Johnson attempts a 3Pt. Contested by Isaiah Randle (5.1 feet, MAN). Manu Johnson misses. Rebound secured by Lamelo Stewart.

[01:57] Team_042 possession (Score: 95-71)
Allen Towns attempts a Midrange. Contested by Donovan Green (4.4 feet, MAN). Allen Towns misses. Offensive rebound by Lamelo Stewart! Lamelo Stewart kicks it out.

[01:41] Team_042 possession (Score: 95-71)
Gary Jackson drives, Scottie Quickley stays with him. Gary Jackson attempts a Layup. Contested by Scottie Quickley (4.1 feet, MAN). Gary Jackson misses. Rebound secured by Jarrett Fox.

[01:31] Team_099 possession (Score: 95-71)
CJ Cunningham attempts a 3Pt. Contested by Khris George (4.2 feet, MAN). CJ Cunningham misses. Offensive rebound by Donovan Green! Donovan Green kicks it out.

[01:15] Team_099 possession (Score: 95-71)
Donovan Green drives and kicks out. Donovan Green attempts a 3Pt. Contested by Allen Towns (4.3 feet, MAN). Donovan Green misses. Rebound secured by Lamelo Stewart.

[01:01] Team_042 possession (Score: 95-71)
Lamelo Stewart drives to the basket... Lamelo Stewart throws a bad pass! Stolen by Jarrett Fox! TURNOVER! (live ball)

[00:42] Team_099 possession (Score: 95-71)
Manu Johnson drives, picks up Isaiah Randle. Help arrives from Khris George! Manu Johnson attempts a Dunk. Contested by Khris George (5.2 feet, MAN). Manu Johnson misses. Rebound secured by Gary Jackson.

[00:30] Team_042 possession (Score: 95-71)
Lamelo Stewart throws a bad pass! Stolen by Jarrett Fox! TURNOVER! (live ball)

[00:17] Team_099 possession (Score: 95-71)
FOUL! Reach-in foul on Isaiah Randle during the drive. [Team fouls: 4] No free throws, side out. (Isaiah Randle: 1 personal fouls)

[00:06] Team_099 possession (Score: 95-71)
Scottie Quickley attempts a Midrange. Contested by Isaiah Randle (5.5 feet, ZONE). Scottie Quickley misses. Rebound secured by Allen Towns.

================================================================================
                              4TH QUARTER COMPLETE                              
================================================================================

4TH QUARTER SCORE: Team_042 19, Team_099 15

BOX SCORE:
================================================================================

Team_042
--------------------------------------------------------------------------------
Player                MIN  PTS  REB  AST  TO      FG   FG%      3P   3P%
--------------------------------------------------------------------------------
Lamelo Stewart         15    5    4    1   0   2/2   100.0     0/0   0.0
Dejounte Butler        33    4    1    0   0   2/4    50.0     0/0   0.0
Allen Towns            15    3    3    1   0   1/2    50.0     0/0   0.0
Isaiah Randle          15    3    0    0   0   1/1   100.0     0/0   0.0
Cade Dosunmu           33    2    2    0   0   1/2    50.0     0/0   0.0
Khris George           15    2    0    0   0   1/2    50.0     0/0   0.0
Jarrett Sabonis        33    0    0    0   0   0/2     0.0     0/0   0.0
Kristaps Parker        33    0    0    0   0   0/1     0.0     0/0   0.0
Tyler Barrett          33    0    1    0   0   0/0     0.0     0/0   0.0
Gary Jackson           15    0    2    0   0   0/1     0.0     0/0   0.0

TEAM: FG: 8/17 (47.1%), 3PT: 0/3 (0.0%), REB: 15 (4 off, 11 def), AST: 2, TO: 4
TEAM FOULS: 4


Team_099
--------------------------------------------------------------------------------
Player                MIN  PTS  REB  AST  TO      FG   FG%      3P   3P%
--------------------------------------------------------------------------------
Vince Lillard          33    4    3    0   0   2/2   100.0     0/0   0.0
Larry Wade             33    2    3    0   0   1/3    33.3     0/0   0.0
Ayo Barrett            32    2    0    0   0   1/1   100.0     0/0   0.0
Scottie Quickley       15    2    1    0   0   1/3    33.3     0/0   0.0
Jarrett Fox            15    2    3    0   0   1/1   100.0     0/0   0.0
Donovan Green          15    2    1    2   0   1/2    50.0     0/0   0.0
Damian Ginobili        33    0    0    1   0   0/1     0.0     0/0   0.0
Manu Johnson           17    0    0    2   0   0/4     0.0     0/0   0.0
CJ Cunningham          17    0    0    0   0   0/2     0.0     0/0   0.0

TEAM: FG: 7/19 (36.8%), 3PT: 0/4 (0.0%), REB: 9 (2 off, 7 def), AST: 5, TO: 2
TEAM FOULS: 5 [Team_042 in BONUS]

================================================================================

================================================================================
                               FULL GAME COMPLETE                               
================================================================================

FINAL SCORE: Team_042 95, Team_099 71

SCORING BY QUARTER:
--------------------------------------------------------------------------------
Team                     Q1     Q2     Q3     Q4    FINAL
--------------------------------------------------------------------------------
Team_042                 35     21     20     19       95
Team_099                 18     20     18     15       71
--------------------------------------------------------------------------------

FULL GAME BOX SCORE:
================================================================================

Team_042
--------------------------------------------------------------------------------
Player                MIN  PTS  REB  AST  TO      FG   FG%      3P   3P%      FT STL BLK
--------------------------------------------------------------------------------
Tyler Barrett          33    5    5    4   2   3/7    42.9   2/4    50.0   5/5     0   1
Kristaps Parker        33    6    0    5   2   3/7    42.9   0/3     0.0   0/0     0   0
Jarrett Sabonis        33   19    0    2   2   9/13   69.2   3/5    60.0   5/5     0   1
Dejounte Butler        33   23   17    1   3   6/13   46.2   1/3    33.3   2/2     2   0
Cade Dosunmu           33   14   13    0   1  10/14   71.4   2/2   100.0   1/2     1   0
Khris George           15    5    0    0   1   2/4    50.0   1/2    50.0   0/0     0   0
Isaiah Randle          15    7    0    0   3   4/4   100.0   0/0     0.0   1/1     0   0
Gary Jackson           15    3    4    0   0   1/5    20.0   0/2     0.0   1/1     0   0
Allen Towns            15    5    6    3   1   2/3    66.7   0/0     0.0   1/1     1   0
Lamelo Stewart         15    8    6    2   1   2/3    66.7   0/0     0.0   1/1     1   1

TEAM: FG: 42/73 (57.5%), 3PT: 9/21 (42.9%), REB: 52 (14 off, 38 def), AST: 17, TO: 16


Team_099
--------------------------------------------------------------------------------
Player                MIN  PTS  REB  AST  TO      FG   FG%      3P   3P%      FT STL BLK
--------------------------------------------------------------------------------
Damian Ginobili        33    7    4    2   3   5/11   45.5   2/4    50.0   2/3     1   1
Vince Lillard          33    7    8    0   3   3/8    37.5   0/1     0.0   1/1     1   2
Larry Wade             33   10   15    5   3   3/8    37.5   1/1   100.0   2/4     1   0
Ayo Barrett            32   15    0    1   0   6/14   42.9   3/7    42.9   3/3     0   0
Larry James            32   12    0    3   2   4/8    50.0   0/2     0.0   3/4     1   0
CJ Cunningham          17    3    0    0   1   1/4    25.0   1/4    25.0   0/0     0   0
Manu Johnson           17    2    0    3   1   2/8    25.0   0/2     0.0   2/3     1   1
Scottie Quickley       15    2    3    0   2   1/3    33.3   0/0     0.0   0/0     0   0
Donovan Green          15    4    5    2   0   1/2    50.0   0/0     0.0   0/0     0   0
Jarrett Fox            15    4    4    0   1   2/4    50.0   0/0     0.0   2/2     2   1

TEAM: FG: 29/71 (40.8%), 3PT: 7/21 (33.3%), REB: 38 (11 off, 27 def), AST: 16, TO: 16

================================================================================
