================================================================================
                        FULL GAME - Team_081 vs Team_002                        
================================================================================

================================================================================
                       1ST QUARTER - Team_081 vs Team_002                       
================================================================================

[12:00] Team_081 possession (Score: 0-0)
Julius Durant makes the Dunk and draws the foul on Tyler Porzingis! And-1! Julius Durant to the line for 1. [Team fouls: 1] (Tyler Porzingis: 1 personal fouls)   FT 1/1: GOOD Julius Durant makes 1/1 from the line.
Score: 3-0

[11:45] Team_002 possession (Score: 3-0)
Carmelo Lowry drives and kicks out. Jordan Green attempts a 3Pt. Contested by Vince Adebayo (3.4 feet, ZONE). Jordan Green misses. Rebound secured by Franz Antetokounmpo.

[11:34] Team_081 possession (Score: 3-0)
Julius Durant drives, picks up Miles Bane. Help arrives from CJ Barrett! Julius Durant attempts a Dunk. Contested by CJ Barrett (4.4 feet, MAN). Julius Durant misses. Rebound secured by Miles Bane.

[11:21] Team_002 possession (Score: 3-0)
Miles Bane drives and kicks out. Miles Bane attempts a 3Pt. Contested by Vince Adebayo (3.4 feet, ZONE). Miles Bane misses. Rebound secured by Franz Antetokounmpo.

[11:11] Team_081 possession (Score: 3-0)
Bradley Leonard attempts a Midrange. Contested by CJ Barrett (4.1 feet, MAN). Bradley Leonard misses. Rebound secured by Miles Bane.

[10:58] Team_002 possession (Score: 3-0)
Carmelo Lowry attempts a Layup. Contested by Franz Antetokounmpo (4.2 feet, ZONE). Carmelo Lowry misses. Rebound secured by Franz Antetokounmpo.

[10:46] Team_081 possession (Score: 3-0)
Franz Antetokounmpo makes the Dunk and draws the foul on Tyler Porzingis! And-1! Franz Antetokounmpo to the line for 1. [Team fouls: 2] (Tyler Porzingis: 2 personal fouls)   FT 1/1: GOOD Franz Antetokounmpo makes 1/1 from the line.
Score: 6-0

[10:31] Team_002 possession (Score: 6-0)
Miles Bane attempts a Midrange. Contested by Bradley Leonard (3.6 feet, ZONE). Miles Bane misses. Rebound secured by Franz Antetokounmpo.

[10:16] Team_081 possession (Score: 6-0)
Julius Durant drives to the basket... Julius Durant throws a bad pass out of bounds! TURNOVER! (dead ball)

[09:58] Team_002 possession (Score: 6-0)
Tyler Porzingis drives and kicks out. Jordan Green attempts a 3Pt. Contested by Bradley Leonard (3.7 feet, ZONE). Jordan Green misses. Rebound secured by Bradley Sabonis.

[09:44] Team_081 possession (Score: 6-0)
Vince Adebayo attempts a 3Pt. Contested by Jordan Green (4.4 feet, MAN). VINCE ADEBAYO MAKES IT! Assist: Julius Durant
Score: 9-0

[09:25] Team_002 possession (Score: 9-0)
Miles Bane drives, picks up Franz Antetokounmpo. Help arrives from Bradley Leonard! Miles Bane attempts a Layup. Contested by Bradley Leonard (4.2 feet, ZONE). MILES BANE MAKES IT! Assist: Tyler Porzingis
Score: 9-2

[09:11] Team_081 possession (Score: 9-2)
Bradley Leonard drives, CJ Barrett stays with him. Bradley Leonard attempts a Layup. Contested by CJ Barrett (4.1 feet, MAN). Bradley Leonard misses. Rebound secured by Carmelo Lowry.

[08:57] Team_002 possession (Score: 9-2)
Tyler Porzingis drives and kicks out. Tyler Porzingis attempts a 3Pt. Contested by Franz Antetokounmpo (4.2 feet, MAN). Tyler Porzingis misses. Offensive rebound by Carmelo Lowry! Carmelo Lowry kicks it out.

[08:39] Team_002 possession (Score: 9-2)
CJ Barrett attempts a 3Pt. Contested by Vince Adebayo (3.8 feet, ZONE). CJ Barrett misses. Rebound secured by Franz Antetokounmpo.

[08:25] Team_081 possession (Score: 9-2)
Bradley Sabonis attempts a 3Pt. Contested by Carmelo Lowry (3.7 feet, MAN). Bradley Sabonis misses. Rebound secured by Miles Bane.

[08:12] Team_002 possession (Score: 9-2)
Miles Bane drives to the basket... FOUL! Offensive foul on Miles Bane! Franz Antetokounmpo drew the charge! [Team fouls: 3] (Miles Bane: 1 personal fouls) TURNOVER! (dead ball)

[08:00] Team_081 possession (Score: 9-2)
Franz Antetokounmpo attempts a 3Pt. Contested by Tyler Porzingis (3.2 feet, MAN). Franz Antetokounmpo misses. Rebound secured by Tyler Porzingis.

[07:45] Team_002 possession (Score: 9-2)
FOUL! Offensive foul on Tyler Porzingis! Franz Antetokounmpo drew the charge! [Team fouls: 4] (Tyler Porzingis: 3 personal fouls) TURNOVER! (dead ball)

[07:30] Team_081 possession (Score: 9-2)
Bradley Leonard attempts a Midrange. Contested by Carmelo Lowry (3.9 feet, ZONE). Bradley Leonard misses. Rebound secured by Tyler Porzingis.

[07:16] Team_002 possession (Score: 9-2)
FOUL! Shooting foul on Julius Durant. Miles Bane to the line for 2 free throws. [Team fouls: 1] (Julius Durant: 1 personal fouls)   FT 1/2: GOOD   FT 2/2: GOOD Miles Bane makes 2/2 from the line.
Score: 9-4

[06:56] Team_081 possession (Score: 9-4)
FOUL! Reach-in foul on Tyler Porzingis during the drive. [IN THE BONUS! 5 team fouls] Bradley Sabonis to the line for 2 free throws. (Tyler Porzingis: 4 personal fouls)   FT 1/2: GOOD   FT 2/2: GOOD Bradley Sabonis makes 2/2 from the line.
Score: 11-4

[06:44] Team_002 possession (Score: 11-4)
FOUL! Shooting foul on Franz Antetokounmpo. Tyler Porzingis to the line for 2 free throws. [Team fouls: 2] (Franz Antetokounmpo: 1 personal fouls)   FT 1/2: GOOD   FT 2/2: GOOD Tyler Porzingis makes 2/2 from the line.
Score: 11-6

[06:26] Team_081 possession (Score: 11-6)
Bradley Leonard attempts a 3Pt. Contested by CJ Barrett (4.1 feet, MAN). BRADLEY LEONARD MAKES IT! Assist: Julius Durant
Score: 14-6

[06:12] Team_002 possession (Score: 14-6)
Jordan Green attempts a 3Pt. Contested by Vince Adebayo (4.3 feet, MAN). Jordan Green misses. Rebound secured by Bradley Sabonis.

[05:57] Team_081 possession (Score: 14-6)
Vince Adebayo drives and kicks out. FOUL! Shooting foul on Miles Bane. Julius Durant to the line for 2 free throws. [BONUS: 6 team fouls] (Miles Bane: 2 personal fouls)   FT 1/2: GOOD   FT 2/2: GOOD Julius Durant makes 2/2 from the line.
Score: 16-6

[05:42] Team_002 possession (Score: 16-6)
Miles Bane drives and kicks out. Miles Bane attempts a Midrange. Contested by Bradley Leonard (3.7 feet, ZONE). MILES BANE MAKES IT!
Score: 16-8

[05:26] Team_081 possession (Score: 16-8)
Franz Antetokounmpo drives to the basket... FOUL! Offensive foul on Franz Antetokounmpo! Tyler Porzingis drew the charge! [Team fouls: 3] (Franz Antetokounmpo: 2 personal fouls) TURNOVER! (dead ball)

[05:09] Team_002 possession (Score: 16-8)
Tyler Porzingis attempts a Midrange. Contested by Bradley Sabonis (4.3 feet, ZONE). Tyler Porzingis misses. Rebound secured by Vince Adebayo.

[04:53] Team_081 possession (Score: 16-8)
Julius Durant attempts a Midrange. Contested by Miles Bane (4.4 feet, MAN). Julius Durant misses. Rebound secured by Tyler Porzingis.

[04:37] Team_002 possession (Score: 16-8)
Tyler Porzingis makes the Layup and draws the foul on Franz Antetokounmpo! And-1! Tyler Porzingis to the line for 1. [Team fouls: 4] (Franz Antetokounmpo: 3 personal fouls)   FT 1/1: GOOD Tyler Porzingis makes 1/1 from the line.
Score: 16-11

[04:21] Team_081 possession (Score: 16-11)
Franz Antetokounmpo drives and kicks out. Bradley Sabonis attempts a Midrange. Contested by CJ Barrett (4.0 feet, ZONE). Bradley Sabonis misses. Rebound secured by Carmelo Lowry.

[04:06] Team_002 possession (Score: 16-11)
Jordan Green attempts a 3Pt. Contested by Vince Adebayo (4.4 feet, MAN). Jordan Green misses. Offensive rebound by Carmelo Lowry! Carmelo Lowry kicks it out.

[03:46] Team_002 possession (Score: 16-11)
Jordan Green attempts a 3Pt. Contested by Vince Adebayo (4.4 feet, MAN). Jordan Green misses. Offensive rebound by Tyler Porzingis! Tyler Porzingis's putback is no good. Rebound secured by Bradley Sabonis.

[03:32] Team_081 possession (Score: 16-11)
Vince Adebayo makes the Layup and draws the foul on Jordan Green! And-1! Vince Adebayo to the line for 1. [BONUS: 7 team fouls] (Jordan Green: 1 personal fouls)   FT 1/1: GOOD Vince Adebayo makes 1/1 from the line.
Score: 19-11

[03:15] Team_002 possession (Score: 19-11)
CJ Barrett attempts a 3Pt. Contested by Bradley Leonard (4.2 feet, MAN). CJ Barrett misses. Offensive rebound by Tyler Porzingis! Tyler Porzingis's putback is no good. Rebound secured by Vince Adebayo.

[03:00] Team_081 possession (Score: 19-11)
Vince Adebayo attempts a Midrange. Contested by Jordan Green (4.5 feet, MAN). Vince Adebayo misses. Rebound secured by Tyler Porzingis.

[02:43] Team_002 possession (Score: 19-11)
Jordan Green attempts a 3Pt. Contested by Bradley Leonard (4.7 feet, ZONE). Jordan Green misses. Rebound secured by Franz Antetokounmpo.

[02:28] Team_081 possession (Score: 19-11)
Bradley Sabonis makes the Layup and draws the foul on Carmelo Lowry! And-1! Bradley Sabonis to the line for 1. [BONUS: 8 team fouls] (Carmelo Lowry: 1 personal fouls)   FT 1/1: GOOD Bradley Sabonis makes 1/1 from the line.
Score: 22-11

[02:16] Team_002 possession (Score: 22-11)
Jordan Green attempts a 3Pt. Contested by Vince Adebayo (4.6 feet, MAN). Jordan Green misses. Rebound secured by Franz Antetokounmpo.

[02:02] Team_081 possession (Score: 22-11)
Vince Adebayo attempts a Layup. Contested by Jordan Green (4.6 feet, MAN). VINCE ADEBAYO MAKES IT! Assist: Julius Durant
Score: 24-11

[01:47] Team_002 possession (Score: 24-11)
CJ Barrett attempts a Midrange. Contested by Bradley Leonard (4.3 feet, MAN). CJ Barrett misses. Rebound secured by Vince Adebayo.

[01:31] Team_081 possession (Score: 24-11)
Bradley Sabonis attempts a Midrange. Contested by Carmelo Lowry (4.1 feet, MAN). Bradley Sabonis misses. Offensive rebound by Bradley Sabonis! Bradley Sabonis kicks it out.

[01:14] Team_081 possession (Score: 24-11)
Bradley Sabonis drives, Carmelo Lowry stays with him. Bradley Sabonis attempts a Dunk. Contested by Carmelo Lowry (4.1 feet, MAN). Bradley Sabonis misses. Rebound secured by Miles Bane.

[00:59] Team_002 possession (Score: 24-11)
Miles Bane attempts a Midrange. Contested by Vince Adebayo (3.8 feet, ZONE). Miles Bane misses. Rebound secured by Bradley Sabonis.

[00:48] Team_081 possession (Score: 24-11)
FOUL! Holding foul on Miles Bane. [IN THE BONUS! 9 team fouls] Julius Durant to the line for 2 free throws. (Miles Bane: 3 personal fouls)   FT 1/2: GOOD   FT 2/2: GOOD Julius Durant makes 2/2 from the line.
Score: 26-11

[00:30] Team_002 possession (Score: 26-11)
FOUL! Holding foul on Julius Durant. [IN THE BONUS! 5 team fouls] Miles Bane to the line for 2 free throws. (Julius Durant: 2 personal fouls)   FT 1/2: GOOD   FT 2/2: GOOD Miles Bane makes 2/2 from the line.
Score: 26-13

[00:15] Team_081 possession (Score: 26-13)
Bradley Sabonis attempts a 3Pt. Contested by Carmelo Lowry (4.3 feet, MAN). BRADLEY SABONIS MAKES IT! Assist: Bradley Leonard
Score: 29-13

================================================================================
                              1ST QUARTER COMPLETE                              
================================================================================

1ST QUARTER SCORE: Team_081 29, Team_002 13

BOX SCORE:
================================================================================

Team_081
--------------------------------------------------------------------------------
Player                MIN  PTS  REB  AST  TO      FG   FG%      3P   3P%
--------------------------------------------------------------------------------
Bradley Sabonis        12    8    5    0   0   3/5    60.0     0/0   0.0
Vince Adebayo          12    8    3    0   0   3/4    75.0     0/0   0.0
Julius Durant          12    7    0    3   0   3/5    60.0     0/0   0.0
Franz Antetokounmpo    12    3    7    0   0   1/3    33.3     0/0   0.0
Bradley Leonard        12    3    0    1   0   1/4    25.0     0/0   0.0

TEAM: FG: 11/21 (52.4%), 3PT: 3/5 (60.0%), REB: 13 (1 off, 12 def), AST: 4, TO: 2
TEAM FOULS: 5 [Team_002 in BONUS]


Team_002
--------------------------------------------------------------------------------
Player                MIN  PTS  REB  AST  TO      FG   FG%      3P   3P%
--------------------------------------------------------------------------------
Miles Bane             12    8    4    0   0   4/7    57.1     0/0   0.0
Tyler Porzingis        12    5    4    1   0   2/4    50.0     0/0   0.0
Carmelo Lowry          12    0    4    0   0   0/2     0.0     0/0   0.0
CJ Barrett             12    0    0    0   0   0/3     0.0     0/0   0.0
Jordan Green           12    0    0    0   0   0/4     0.0     0/0   0.0

TEAM: FG: 6/20 (30.0%), 3PT: 0/6 (0.0%), REB: 14 (4 off, 10 def), AST: 1, TO: 2
TEAM FOULS: 9 [Team_081 in BONUS]

================================================================================

================================================================================
                       2ND QUARTER - Team_081 vs Team_002                       
================================================================================

[12:00] Team_081 possession (Score: 29-13)
Julius Durant attempts a Midrange. Contested by Miles Bane (4.6 feet, MAN). Julius Durant misses. Rebound secured by Carmelo Lowry.

[11:43] Team_002 possession (Score: 29-13)
Jordan Green drives, picks up Vince Adebayo. Help arrives from Bradley Leonard! Jordan Green attempts a Dunk. Contested by Bradley Leonard (4.6 feet, MAN). Jordan Green misses. Rebound secured by Vince Adebayo.

[11:26] Team_081 possession (Score: 29-13)
Bradley Sabonis attempts a Midrange. Contested by Carmelo Lowry (4.1 feet, MAN). Bradley Sabonis misses. Rebound secured by Miles Bane.

[11:10] Team_002 possession (Score: 29-13)
Carmelo Lowry drives, Bradley Sabonis stays with him. Carmelo Lowry attempts a Layup. Contested by Bradley Sabonis (4.2 feet, MAN). CARMELO LOWRY MAKES IT! Assist: Tyler Porzingis
Score: 29-15

[10:58] Team_081 possession (Score: 29-15)
Bradley Sabonis attempts a 3Pt. Contested by Carmelo Lowry (4.2 feet, MAN). Bradley Sabonis misses. Offensive rebound by Franz Antetokounmpo! Franz Antetokounmpo's putback is no good. Offensive rebound by Franz Antetokounmpo! Franz Antetokounmpo kicks it out.

[10:45] Team_081 possession (Score: 29-15)
Julius Durant drives to the basket... Julius Durant loses control! Ball rolls out of bounds! TURNOVER! (dead ball)

[10:45] Substitution (Team_081): Julius Durant OUT → Dejounte Bane IN (stamina_rule2)

[10:45] Substitution (Team_081): Bradley Leonard OUT → Lamelo Wade IN (stamina_rule2)

[10:45] Substitution (Team_081): Vince Adebayo OUT → Larry Adebayo IN (stamina_rule2)

[10:45] Substitution (Team_081): Bradley Sabonis OUT → Chris Holiday IN (stamina_rule2)

[10:45] Substitution (Team_081): Franz Antetokounmpo OUT → D'Angelo Markkanen IN (stamina_rule2)

[10:45] Substitution (Team_002): Miles Bane OUT → John Duncan IN (stamina_rule2)

[10:45] Substitution (Team_002): CJ Barrett OUT → Dirk Middleton IN (stamina_rule2)

[10:45] Substitution (Team_002): Jordan Green OUT → Anfernee Sexton IN (stamina_rule2)

[10:45] Substitution (Team_002): Carmelo Lowry OUT → Julius Curry IN (stamina_rule2)

[10:45] Substitution (Team_002): Tyler Porzingis OUT → Lamelo O'Neal IN (stamina_rule2)

[10:27] Team_002 possession (Score: 29-15)
Julius Curry attempts a Layup. Contested by Chris Holiday (4.1 feet, ZONE). JULIUS CURRY MAKES IT! Assist: Anfernee Sexton
Score: 29-17

[10:10] Team_081 possession (Score: 29-17)
Larry Adebayo attempts a 3Pt. Contested by Anfernee Sexton (4.4 feet, MAN). Larry Adebayo misses. Offensive rebound by Lamelo Wade! Lamelo Wade kicks it out.

[09:51] Team_081 possession (Score: 29-17)
Larry Adebayo attempts a 3Pt. Contested by Julius Curry (5.3 feet, ZONE). LARRY ADEBAYO MAKES IT! Assist: Lamelo Wade
Score: 32-17

[09:36] Team_002 possession (Score: 32-17)
John Duncan makes the Layup and draws the foul on Chris Holiday! And-1! John Duncan to the line for 1. [Team fouls: 1] (Chris Holiday: 1 personal fouls)   FT 1/1: GOOD John Duncan makes 1/1 from the line.
Score: 32-20

[09:20] Team_081 possession (Score: 32-20)
Larry Adebayo attempts a Midrange. Contested by Anfernee Sexton (4.4 feet, MAN). LARRY ADEBAYO MAKES IT! Assist: Lamelo Wade
Score: 34-20

[09:07] Team_002 possession (Score: 34-20)
FOUL! Reach-in foul on Lamelo Wade during the drive. [Team fouls: 2] No free throws, side out. (Lamelo Wade: 1 personal fouls)

[08:51] Team_002 possession (Score: 34-20)
Lamelo O'Neal drives and kicks out. Dirk Middleton attempts a Midrange. Contested by Lamelo Wade (4.7 feet, MAN). Dirk Middleton misses. Offensive rebound by Anfernee Sexton! Anfernee Sexton kicks it out.

[08:36] Team_002 possession (Score: 34-20)
Anfernee Sexton drives to the basket... Anfernee Sexton commits a violation (traveling/carry)! TURNOVER! (dead ball)

[08:18] Team_081 possession (Score: 34-20)
FOUL! Reach-in foul on Lamelo O'Neal during the drive. [Team fouls: 2] No free throws, side out. (Lamelo O'Neal: 1 personal fouls)

[08:04] Team_081 possession (Score: 34-20)
Dejounte Bane makes the Midrange and draws the foul on John Duncan! And-1! Dejounte Bane to the line for 1. [Team fouls: 3] (John Duncan: 1 personal fouls)   FT 1/1: GOOD Dejounte Bane makes 1/1 from the line.
Score: 37-20

[07:45] Team_002 possession (Score: 37-20)
Dirk Middleton attempts a 3Pt. Contested by Chris Holiday (4.4 feet, ZONE). Dirk Middleton misses. Rebound secured by Larry Adebayo.

[07:34] Team_081 possession (Score: 37-20)
Dejounte Bane throws a bad pass! Stolen by John Duncan! TURNOVER! (live ball)

[07:19] Team_002 possession (Score: 37-20)
John Duncan attempts a 3Pt. Contested by Chris Holiday (4.1 feet, ZONE). JOHN DUNCAN MAKES IT! Assist: Lamelo O'Neal
Score: 37-23

[07:06] Team_081 possession (Score: 37-23)
Larry Adebayo throws a bad pass! Stolen by Anfernee Sexton! TURNOVER! (live ball)

[06:53] Team_002 possession (Score: 37-23)
FOUL! Shooting foul on Chris Holiday. Lamelo O'Neal to the line for 2 free throws. [Team fouls: 3] (Chris Holiday: 2 personal fouls)   FT 1/2: GOOD   FT 2/2: GOOD Lamelo O'Neal makes 2/2 from the line.
Score: 37-25

[06:43] Team_081 possession (Score: 37-25)
Chris Holiday drives, Lamelo O'Neal stays with him. Chris Holiday attempts a Dunk. Contested by Lamelo O'Neal (3.7 feet, MAN). CHRIS HOLIDAY MAKES IT! Assist: Larry Adebayo
Score: 39-25

[06:31] Team_002 possession (Score: 39-25)
Dirk Middleton attempts a 3Pt. Contested by Chris Holiday (4.4 feet, ZONE). DIRK MIDDLETON MAKES IT! Assist: Anfernee Sexton
Score: 39-28

[06:18] Team_081 possession (Score: 39-28)
D'Angelo Markkanen makes the Layup and draws the foul on Lamelo O'Neal! And-1! D'Angelo Markkanen to the line for 1. [Team fouls: 4] (Lamelo O'Neal: 2 personal fouls)   FT 1/1: GOOD D'Angelo Markkanen makes 1/1 from the line.
Score: 42-28

[06:03] Team_002 possession (Score: 42-28)
John Duncan attempts a 3Pt. Contested by Dejounte Bane (5.3 feet, MAN). John Duncan misses. Rebound secured by Lamelo Wade.

[05:46] Team_081 possession (Score: 42-28)
Lamelo Wade attempts a 3Pt. Contested by Julius Curry (5.2 feet, ZONE). LAMELO WADE MAKES IT! Assist: Chris Holiday
Score: 45-28

[05:32] Team_002 possession (Score: 45-28)
John Duncan attempts a 3Pt. Contested by Dejounte Bane (5.3 feet, MAN). John Duncan misses. Rebound secured by Chris Holiday.

[05:19] Team_081 possession (Score: 45-28)
Lamelo Wade attempts a 3Pt. Contested by Dirk Middleton (5.5 feet, MAN). Lamelo Wade misses. Rebound secured by Lamelo O'Neal.

[05:01] Team_002 possession (Score: 45-28)
FOUL! Offensive foul on Julius Curry! Chris Holiday drew the charge! [Team fouls: 5] (Julius Curry: 1 personal fouls) TURNOVER! (dead ball)

[04:46] Team_081 possession (Score: 45-28)
Chris Holiday attempts a 3Pt. Contested by Julius Curry (5.4 feet, ZONE). Chris Holiday misses. Rebound secured by Anfernee Sexton.

[04:31] Team_002 possession (Score: 45-28)
Julius Curry attempts a Layup. BLOCKED BY CHRIS HOLIDAY! Ball is loose! Offensive rebound by Anfernee Sexton! Anfernee Sexton kicks it out.

[04:14] Team_002 possession (Score: 45-28)
Julius Curry drives, picks up Chris Holiday. Help arrives from Lamelo Wade! Julius Curry attempts a Dunk. Contested by Lamelo Wade (4.1 feet, MAN). Julius Curry misses. Rebound secured by Lamelo Wade.

[03:58] Team_081 possession (Score: 45-28)
D'Angelo Markkanen drives, picks up Lamelo O'Neal. Help arrives from John Duncan! D'Angelo Markkanen attempts a Layup. Contested by John Duncan (3.8 feet, MAN). D'Angelo Markkanen misses. Rebound secured by Anfernee Sexton.

[03:47] Team_002 possession (Score: 45-28)
Dirk Middleton attempts a 3Pt. Contested by Lamelo Wade (4.8 feet, MAN). Dirk Middleton misses. Rebound secured by Larry Adebayo.

[03:35] Team_081 possession (Score: 45-28)
Dejounte Bane attempts a 3Pt. Contested by John Duncan (5.5 feet, MAN). Dejounte Bane misses. Rebound secured by Anfernee Sexton.

[03:17] Team_002 possession (Score: 45-28)
Anfernee Sexton attempts a 3Pt. Contested by Larry Adebayo (5.8 feet, MAN). Anfernee Sexton misses. FOUL! Loose ball foul on Larry Adebayo during the rebound battle. [IN THE BONUS! 5 team fouls] Lamelo O'Neal to the line for 2 free throws. (Larry Adebayo: 1 personal fouls)   FT 1/2: GOOD   FT 2/2: GOOD Lamelo O'Neal makes 2/2 from the line.
Score: 45-30

[03:08] Team_081 possession (Score: 45-30)
Chris Holiday throws a bad pass out of bounds! TURNOVER! (dead ball)

[02:54] Team_002 possession (Score: 45-30)
FOUL! Offensive foul on Anfernee Sexton! Larry Adebayo drew the charge! [Team fouls: 6] (Anfernee Sexton: 1 personal fouls) TURNOVER! (dead ball)

[02:40] Team_081 possession (Score: 45-30)
Lamelo Wade attempts a 3Pt. Contested by Julius Curry (5.3 feet, ZONE). Lamelo Wade misses. Offensive rebound by Chris Holiday! Chris Holiday kicks it out.

[02:22] Team_081 possession (Score: 45-30)
Dejounte Bane drives, picks up John Duncan. Help arrives from Anfernee Sexton! Dejounte Bane attempts a Dunk. Contested by Anfernee Sexton (5.6 feet, MAN). DEJOUNTE BANE MAKES IT! Assist: Larry Adebayo
Score: 47-30

[02:10] Team_002 possession (Score: 47-30)
Julius Curry attempts a 3Pt. Contested by Chris Holiday (4.2 feet, ZONE). Julius Curry misses. Rebound secured by Larry Adebayo.

[01:53] Team_081 possession (Score: 47-30)
Dejounte Bane attempts a Midrange. Contested by Anfernee Sexton (4.8 feet, ZONE). Dejounte Bane misses. Rebound secured by Lamelo O'Neal.

[01:37] Team_002 possession (Score: 47-30)
FOUL! Holding foul on Chris Holiday. [IN THE BONUS! 6 team fouls] Lamelo O'Neal to the line for 2 free throws. (Chris Holiday: 4 personal fouls)   FT 1/2: GOOD   FT 2/2: GOOD Lamelo O'Neal makes 2/2 from the line.
Score: 47-32

[01:20] Team_081 possession (Score: 47-32)
Larry Adebayo attempts a 3Pt. Contested by Julius Curry (5.5 feet, ZONE). Larry Adebayo misses. Rebound secured by Anfernee Sexton.

[01:08] Team_002 possession (Score: 47-32)
Julius Curry drives, picks up Chris Holiday. Help arrives from Lamelo Wade! Julius Curry attempts a Layup. Contested by Lamelo Wade (4.3 feet, ZONE). JULIUS CURRY MAKES IT! Assist: Dirk Middleton
Score: 47-34

[00:55] Team_081 possession (Score: 47-34)
Chris Holiday attempts a 3Pt. Contested by Julius Curry (5.6 feet, ZONE). Chris Holiday misses. Rebound secured by Lamelo O'Neal.

[00:40] Team_002 possession (Score: 47-34)
Lamelo O'Neal drives, picks up Chris Holiday. Help arrives from Lamelo Wade! Lamelo O'Neal attempts a Dunk. Contested by Lamelo Wade (4.7 feet, ZONE). Lamelo O'Neal misses. Rebound secured by Lamelo Wade.

[00:24] Team_081 possession (Score: 47-34)
Dejounte Bane drives, John Duncan stays with him. Dejounte Bane attempts a Dunk. Contested by John Duncan (5.8 feet, MAN). DEJOUNTE BANE MAKES IT! Assist: Larry Adebayo
Score: 49-34

[00:07] Team_002 possession (Score: 49-34)
FOUL! Offensive foul on John Duncan! Dejounte Bane drew the charge! [Team fouls: 7] (John Duncan: 2 personal fouls) TURNOVER! (dead ball)

================================================================================
                              2ND QUARTER COMPLETE                              
================================================================================

2ND QUARTER SCORE: Team_081 20, Team_002 21

BOX SCORE:
================================================================================

Team_081
--------------------------------------------------------------------------------
Player                MIN  PTS  REB  AST  TO      FG   FG%      3P   3P%
--------------------------------------------------------------------------------
Dejounte Bane          10    7    0    0   0   3/5    60.0     0/0   0.0
Larry Adebayo          10    5    3    3   0   2/3    66.7     0/0   0.0
Lamelo Wade            10    3    4    2   0   1/2    50.0     0/0   0.0
D'Angelo Markkanen     10    3    0    0   0   1/2    50.0     0/0   0.0
Chris Holiday          10    2    2    1   0   1/3    33.3     0/0   0.0
Julius Durant          14    0    0    0   0   0/1     0.0     0/0   0.0
Vince Adebayo          14    0    1    0   0   0/0     0.0     0/0   0.0
Bradley Sabonis        14    0    0    0   0   0/1     0.0     0/0   0.0
Franz Antetokounmpo    14    0    1    0   0   0/0     0.0     0/0   0.0

TEAM: FG: 8/17 (47.1%), 3PT: 2/7 (28.6%), REB: 11 (3 off, 8 def), AST: 6, TO: 4
TEAM FOULS: 6 [Team_002 in BONUS]


Team_002
--------------------------------------------------------------------------------
Player                MIN  PTS  REB  AST  TO      FG   FG%      3P   3P%
--------------------------------------------------------------------------------
John Duncan            10    6    0    0   0   2/4    50.0     0/0   0.0
Lamelo O'Neal          10    6    3    1   0   3/4    75.0     0/0   0.0
Julius Curry           10    4    0    0   0   2/4    50.0     0/0   0.0
Dirk Middleton         10    3    0    1   0   1/3    33.3     0/0   0.0
Carmelo Lowry          14    2    1    0   0   1/1   100.0     0/0   0.0
Jordan Green           14    0    0    0   0   0/1     0.0     0/0   0.0
Miles Bane             14    0    1    0   0   0/0     0.0     0/0   0.0
Tyler Porzingis        14    0    0    1   0   0/0     0.0     0/0   0.0
Anfernee Sexton        10    0    6    2   0   0/0     0.0     0/0   0.0

TEAM: FG: 9/17 (52.9%), 3PT: 3/8 (37.5%), REB: 11 (2 off, 9 def), AST: 5, TO: 4
TEAM FOULS: 7 [Team_081 in BONUS]

================================================================================

================================================================================
                       3RD QUARTER - Team_081 vs Team_002                       
================================================================================

[12:00] Team_081 possession (Score: 49-34)
Bradley Leonard drives, picks up Tyler Porzingis. Help arrives from CJ Barrett! Bradley Leonard attempts a Layup. Contested by CJ Barrett (3.2 feet, ZONE). BRADLEY LEONARD MAKES IT! Assist: Julius Durant
Score: 51-34

[11:43] Team_002 possession (Score: 51-34)
Miles Bane attempts a 3Pt. Contested by Julius Durant (4.0 feet, MAN). Miles Bane misses. Rebound secured by Vince Adebayo.

[11:29] Team_081 possession (Score: 51-34)
FOUL! Reach-in foul on Tyler Porzingis during the drive. [Team fouls: 1] No free throws, side out. (Tyler Porzingis: 1 personal fouls)

[11:17] Team_081 possession (Score: 51-34)
Vince Adebayo attempts a 3Pt. Contested by Miles Bane (4.3 feet, ZONE). Vince Adebayo misses. Rebound secured by Tyler Porzingis.

[11:02] Team_002 possession (Score: 51-34)
Tyler Porzingis drives, Franz Antetokounmpo stays with him. Tyler Porzingis attempts a Layup. Contested by Franz Antetokounmpo (4.5 feet, ZONE). TYLER PORZINGIS MAKES IT! Assist: Carmelo Lowry
Score: 51-36

[10:42] Team_081 possession (Score: 51-36)
Julius Durant attempts a Layup. BLOCKED BY CJ BARRETT! Ball is loose! Offensive rebound by Bradley Sabonis! Bradley Sabonis kicks it out.

[10:30] Team_081 possession (Score: 51-36)
FOUL! Holding foul on Carmelo Lowry. [Team fouls: 2] No free throws, side out. (Carmelo Lowry: 1 personal fouls)

[10:13] Team_081 possession (Score: 51-36)
Franz Antetokounmpo drives, Tyler Porzingis stays with him. Franz Antetokounmpo attempts a Dunk. Contested by Tyler Porzingis (3.2 feet, MAN). FRANZ ANTETOKOUNMPO MAKES IT! Assist: Julius Durant
Score: 53-36

[09:59] Team_002 possession (Score: 53-36)
Jordan Green attempts a Midrange. Contested by Vince Adebayo (4.3 feet, ZONE). Jordan Green misses. Offensive rebound by Carmelo Lowry! Carmelo Lowry kicks it out.

[09:45] Team_002 possession (Score: 53-36)
Carmelo Lowry drives to the basket... Carmelo Lowry throws a bad pass out of bounds! TURNOVER! (dead ball)

[09:31] Team_081 possession (Score: 53-36)
Bradley Sabonis drives to the basket... Bradley Sabonis loses control! Ball rolls out of bounds! TURNOVER! (dead ball)

[09:14] Team_002 possession (Score: 53-36)
Tyler Porzingis attempts a Layup. Contested by Franz Antetokounmpo (4.5 feet, MAN). TYLER PORZINGIS MAKES IT! Assist: Miles Bane
Score: 53-38

[09:01] Team_081 possession (Score: 53-38)
Julius Durant attempts a 3Pt. Contested by Miles Bane (4.4 feet, MAN). JULIUS DURANT MAKES IT!
Score: 56-38

[08:46] Team_002 possession (Score: 56-38)
Tyler Porzingis drives and kicks out. Jordan Green attempts a 3Pt. Contested by Vince Adebayo (3.4 feet, MAN). Jordan Green misses. Rebound secured by Franz Antetokounmpo.

[08:31] Team_081 possession (Score: 56-38)
Franz Antetokounmpo makes the Layup and draws the foul on Tyler Porzingis! And-1! Franz Antetokounmpo to the line for 1. [Team fouls: 3] (Tyler Porzingis: 2 personal fouls)   FT 1/1: GOOD Franz Antetokounmpo makes 1/1 from the line.
Score: 59-38

[08:18] Team_002 possession (Score: 59-38)
CJ Barrett attempts a 3Pt. Contested by Vince Adebayo (3.8 feet, ZONE). CJ Barrett misses. Rebound secured by Franz Antetokounmpo.

[08:01] Team_081 possession (Score: 59-38)
Vince Adebayo drives to the basket... Vince Adebayo loses the ball! Stripped by Tyler Porzingis! TURNOVER! (live ball)

[07:42] Team_002 possession (Score: 59-38)
CJ Barrett attempts a Midrange. Contested by Bradley Leonard (4.1 feet, ZONE). CJ BARRETT MAKES IT!
Score: 59-40

[07:25] Team_081 possession (Score: 59-40)
FOUL! Offensive foul on Vince Adebayo! Jordan Green drew the charge! [Team fouls: 1] (Vince Adebayo: 1 personal fouls) TURNOVER! (dead ball)

[07:12] Team_002 possession (Score: 59-40)
Miles Bane attempts a Midrange. Contested by Julius Durant (4.0 feet, ZONE). Miles Bane misses. Rebound secured by Vince Adebayo.

[06:55] Team_081 possession (Score: 59-40)
Bradley Leonard attempts a 3Pt. Contested by CJ Barrett (4.1 feet, ZONE). Bradley Leonard misses. Rebound secured by Carmelo Lowry.

[06:41] Team_002 possession (Score: 59-40)
Jordan Green attempts a 3Pt. Contested by Vince Adebayo (4.3 feet, MAN). JORDAN GREEN MAKES IT! Assist: CJ Barrett
Score: 59-43

[06:30] Team_081 possession (Score: 59-43)
Bradley Sabonis attempts a 3Pt. Contested by Carmelo Lowry (3.7 feet, MAN). Bradley Sabonis misses. FOUL! Loose ball foul on Miles Bane during the rebound battle. [Team fouls: 4] No free throws, side out. (Miles Bane: 1 personal fouls)

[06:19] Team_081 possession (Score: 59-43)
Franz Antetokounmpo attempts a Midrange. Contested by Carmelo Lowry (3.9 feet, ZONE). FRANZ ANTETOKOUNMPO MAKES IT! Assist: Bradley Leonard
Score: 61-43

[06:03] Team_002 possession (Score: 61-43)
FOUL! Reach-in foul on Bradley Leonard during the drive. [Team fouls: 2] No free throws, side out. (Bradley Leonard: 1 personal fouls)

[05:49] Team_002 possession (Score: 61-43)
FOUL! Shooting foul on Bradley Leonard. CJ Barrett to the line for 2 free throws. [Team fouls: 3] (Bradley Leonard: 2 personal fouls)   FT 1/2: MISS   FT 2/2: GOOD CJ Barrett makes 1/2 from the line.
Score: 61-44

[05:29] Team_081 possession (Score: 61-44)
Franz Antetokounmpo attempts a Layup. Contested by Tyler Porzingis (3.2 feet, ZONE). FRANZ ANTETOKOUNMPO MAKES IT! Assist: Vince Adebayo
Score: 63-44

[05:13] Team_002 possession (Score: 63-44)
Jordan Green drives, Franz Antetokounmpo stays with him. Jordan Green attempts a Dunk. Contested by Franz Antetokounmpo (5.1 feet, ZONE). Jordan Green misses. Offensive rebound by Carmelo Lowry! Carmelo Lowry kicks it out.

[04:59] Team_002 possession (Score: 63-44)
Jordan Green attempts a 3Pt. Contested by Vince Adebayo (4.3 feet, ZONE). JORDAN GREEN MAKES IT!
Score: 63-47

[04:46] Team_081 possession (Score: 63-47)
Julius Durant attempts a 3Pt. Contested by Miles Bane (4.4 feet, MAN). JULIUS DURANT MAKES IT! Assist: Franz Antetokounmpo
Score: 66-47

[04:31] Team_002 possession (Score: 66-47)
Tyler Porzingis throws a bad pass out of bounds! TURNOVER! (dead ball)

[04:18] Team_081 possession (Score: 66-47)
Franz Antetokounmpo makes the Midrange and draws the foul on Tyler Porzingis! And-1! Franz Antetokounmpo to the line for 1. [BONUS: 5 team fouls] (Tyler Porzingis: 3 personal fouls)   FT 1/1: MISS Franz Antetokounmpo makes 0/1 from the line. Rebound secured by Miles Bane.
Score: 68-47

[04:02] Team_002 possession (Score: 68-47)
Miles Bane attempts a 3Pt. Contested by Bradley Leonard (3.7 feet, ZONE). Miles Bane misses. Rebound secured by Franz Antetokounmpo.

[03:47] Team_081 possession (Score: 68-47)
Bradley Leonard drives and kicks out. Vince Adebayo attempts a 3Pt. Contested by Jordan Green (4.5 feet, MAN). Vince Adebayo misses. Rebound secured by Tyler Porzingis.

[03:31] Team_002 possession (Score: 68-47)
Jordan Green drives and kicks out. Carmelo Lowry attempts a Midrange. Contested by Bradley Sabonis (4.1 feet, MAN). CARMELO LOWRY MAKES IT!
Score: 68-49

[03:14] Team_081 possession (Score: 68-49)
Vince Adebayo attempts a Midrange. Contested by CJ Barrett (4.0 feet, ZONE). Vince Adebayo misses. FOUL! Loose ball foul on Miles Bane during the rebound battle. [IN THE BONUS! 6 team fouls] Bradley Sabonis to the line for 2 free throws. (Miles Bane: 2 personal fouls)   FT 1/2: GOOD   FT 2/2: GOOD Bradley Sabonis makes 2/2 from the line.
Score: 70-49

[02:56] Team_002 possession (Score: 70-49)
FOUL! Shooting foul on Bradley Sabonis. Carmelo Lowry to the line for 2 free throws. [Team fouls: 4] (Bradley Sabonis: 1 personal fouls)   FT 1/2: MISS   FT 2/2: MISS Carmelo Lowry makes 0/2 from the line. Rebound secured by Bradley Sabonis.

[02:45] Team_081 possession (Score: 70-49)
Bradley Sabonis drives, picks up Carmelo Lowry. Help arrives from CJ Barrett! Bradley Sabonis attempts a Layup. Contested by CJ Barrett (3.9 feet, MAN). Bradley Sabonis misses. Offensive rebound by Franz Antetokounmpo! Franz Antetokounmpo's putback is no good. Rebound secured by Tyler Porzingis.

[02:34] Team_002 possession (Score: 70-49)
FOUL! Offensive foul on Carmelo Lowry! Bradley Sabonis drew the charge! [Team fouls: 7] (Carmelo Lowry: 2 personal fouls) TURNOVER! (dead ball)

[02:23] Team_081 possession (Score: 70-49)
FOUL! Holding foul on CJ Barrett. [IN THE BONUS! 8 team fouls] Bradley Leonard to the line for 2 free throws. (CJ Barrett: 1 personal fouls)   FT 1/2: GOOD   FT 2/2: GOOD Bradley Leonard makes 2/2 from the line.
Score: 72-49

[02:09] Team_002 possession (Score: 72-49)
Tyler Porzingis attempts a 3Pt. Contested by Vince Adebayo (4.0 feet, ZONE). Tyler Porzingis misses. Rebound secured by Vince Adebayo.

[01:57] Team_081 possession (Score: 72-49)
Julius Durant attempts a Midrange. Contested by Miles Bane (4.7 feet, MAN). Julius Durant misses. Rebound secured by Carmelo Lowry.

[01:44] Team_002 possession (Score: 72-49)
Carmelo Lowry attempts a Layup. Contested by Bradley Sabonis (4.2 feet, MAN). CARMELO LOWRY MAKES IT! Assist: CJ Barrett
Score: 72-51

[01:29] Team_081 possession (Score: 72-51)
Vince Adebayo attempts a 3Pt. Contested by Miles Bane (4.6 feet, ZONE). Vince Adebayo misses. Offensive rebound by Franz Antetokounmpo! Franz Antetokounmpo puts it back in!
Score: 74-51

[01:16] Team_002 possession (Score: 74-51)
FOUL! Shooting foul on Bradley Sabonis. Carmelo Lowry to the line for 2 free throws. [BONUS: 5 team fouls] (Bradley Sabonis: 2 personal fouls)   FT 1/2: GOOD   FT 2/2: GOOD Carmelo Lowry makes 2/2 from the line.
Score: 74-53

[01:03] Team_081 possession (Score: 74-53)
Vince Adebayo attempts a Midrange. Contested by Jordan Green (4.7 feet, ZONE). Vince Adebayo misses. Offensive rebound by Bradley Sabonis! Bradley Sabonis kicks it out.

[00:48] Team_081 possession (Score: 74-53)
FOUL! Holding foul on Tyler Porzingis. [IN THE BONUS! 9 team fouls] Franz Antetokounmpo to the line for 2 free throws. (Tyler Porzingis: 4 personal fouls)   FT 1/2: MISS   FT 2/2: GOOD Franz Antetokounmpo makes 1/2 from the line.
Score: 75-53

[00:32] Team_002 possession (Score: 75-53)
Tyler Porzingis makes the Midrange and draws the foul on Franz Antetokounmpo! And-1! Tyler Porzingis to the line for 1. [BONUS: 6 team fouls] (Franz Antetokounmpo: 1 personal fouls)   FT 1/1: MISS Tyler Porzingis makes 0/1 from the line. Rebound secured by Franz Antetokounmpo.
Score: 75-55

[00:15] Team_081 possession (Score: 75-55)
Franz Antetokounmpo attempts a Midrange. Contested by CJ Barrett (4.5 feet, ZONE). Franz Antetokounmpo misses. Offensive rebound by Franz Antetokounmpo! Franz Antetokounmpo's putback is no good. Rebound secured by Miles Bane.

================================================================================
                              3RD QUARTER COMPLETE                              
================================================================================

3RD QUARTER SCORE: Team_081 26, Team_002 21

BOX SCORE:
================================================================================

Team_081
--------------------------------------------------------------------------------
Player                MIN  PTS  REB  AST  TO      FG   FG%      3P   3P%
--------------------------------------------------------------------------------
Franz Antetokounmpo    26   12    6    1   0   6/8    75.0     0/0   0.0
Julius Durant          26    6    0    2   0   2/3    66.7     0/0   0.0
Bradley Leonard        26    4    0    1   0   2/4    50.0     0/0   0.0
Bradley Sabonis        26    2    3    0   0   1/2    50.0     0/0   0.0
Miles Bane             26    0    2    1   0   0/3     0.0     0/0   0.0
Vince Adebayo          26    0    3    1   0   0/1     0.0     0/0   0.0

TEAM: FG: 11/18 (61.1%), 3PT: 3/5 (60.0%), REB: 14 (6 off, 8 def), AST: 5, TO: 3
TEAM FOULS: 6 [Team_002 in BONUS]


Team_002
--------------------------------------------------------------------------------
Player                MIN  PTS  REB  AST  TO      FG   FG%      3P   3P%
--------------------------------------------------------------------------------
Carmelo Lowry          26    6    4    1   0   3/4    75.0     0/0   0.0
Jordan Green           26    6    0    0   0   2/2   100.0     0/0   0.0
Tyler Porzingis        26    4    3    0   0   2/5    40.0     0/0   0.0
CJ Barrett             26    3    0    2   0   2/3    66.7     0/0   0.0

TEAM: FG: 9/17 (52.9%), 3PT: 2/6 (33.3%), REB: 7 (2 off, 5 def), AST: 4, TO: 3
TEAM FOULS: 9 [Team_081 in BONUS]

================================================================================

================================================================================
                       4TH QUARTER - Team_081 vs Team_002                       
================================================================================

[12:00] Team_081 possession (Score: 75-55)
Bradley Leonard drives and kicks out. Julius Durant attempts a Midrange. Contested by Miles Bane (4.6 feet, MAN). JULIUS DURANT MAKES IT! Assist: Franz Antetokounmpo
Score: 77-55

[11:44] Team_002 possession (Score: 77-55)
Jordan Green drives, picks up Vince Adebayo. Help arrives from Bradley Leonard! Jordan Green attempts a Layup. Contested by Bradley Leonard (4.6 feet, MAN). JORDAN GREEN MAKES IT! Assist: Carmelo Lowry
Score: 77-57

[11:27] Team_081 possession (Score: 77-57)
Franz Antetokounmpo drives and kicks out. FOUL! Shooting foul on Jordan Green. Vince Adebayo to the line for 3 free throws. [Team fouls: 1] (Jordan Green: 1 personal fouls)   FT 1/3: GOOD   FT 2/3: MISS   FT 3/3: GOOD Vince Adebayo makes 2/3 from the line.
Score: 79-57

[11:16] Team_002 possession (Score: 79-57)
Tyler Porzingis throws a bad pass! Stolen by Franz Antetokounmpo! TURNOVER! (live ball)

[10:56] Team_081 possession (Score: 79-57)
Franz Antetokounmpo drives and kicks out. Julius Durant attempts a 3Pt. Contested by Miles Bane (4.7 feet, ZONE). Julius Durant misses. Rebound secured by Miles Bane.

[10:41] Team_002 possession (Score: 79-57)
CJ Barrett attempts a 3Pt. Contested by Bradley Leonard (4.4 feet, MAN). CJ Barrett misses. Rebound secured by Franz Antetokounmpo.

[10:26] Team_081 possession (Score: 79-57)
Vince Adebayo makes the Dunk and draws the foul on Tyler Porzingis! And-1! Vince Adebayo to the line for 1. [Team fouls: 2] (Tyler Porzingis: 1 personal fouls)   FT 1/1: GOOD Vince Adebayo makes 1/1 from the line.
Score: 82-57

[10:15] Team_002 possession (Score: 82-57)
Tyler Porzingis drives and kicks out. CJ Barrett attempts a 3Pt. Contested by Vince Adebayo (4.1 feet, ZONE). CJ Barrett misses. Rebound secured by Vince Adebayo.

[10:03] Team_081 possession (Score: 82-57)
Franz Antetokounmpo attempts a Layup. Contested by Tyler Porzingis (3.8 feet, MAN). FRANZ ANTETOKOUNMPO MAKES IT!
Score: 84-57

[09:46] Team_002 possession (Score: 84-57)
Miles Bane attempts a Midrange. Contested by Bradley Leonard (4.1 feet, ZONE). Miles Bane misses. Rebound secured by Franz Antetokounmpo.

[09:34] Team_081 possession (Score: 84-57)
Bradley Sabonis throws a bad pass! Stolen by Carmelo Lowry! TURNOVER! (live ball)

[09:24] Team_002 possession (Score: 84-57)
Carmelo Lowry attempts a 3Pt. Contested by Bradley Sabonis (4.4 feet, MAN). Carmelo Lowry misses. Rebound secured by Franz Antetokounmpo.

[09:04] Team_081 possession (Score: 84-57)
Julius Durant drives and kicks out. Julius Durant attempts a 3Pt. Contested by Miles Bane (4.9 feet, MAN). JULIUS DURANT MAKES IT! Assist: Franz Antetokounmpo
Score: 87-57

[08:53] Team_002 possession (Score: 87-57)
Miles Bane drives, picks up Franz Antetokounmpo. Help arrives from Bradley Leonard! Miles Bane attempts a Layup. Contested by Bradley Leonard (4.8 feet, ZONE). Miles Bane misses. Rebound secured by Vince Adebayo.

[08:38] Team_081 possession (Score: 87-57)
Julius Durant drives and kicks out. Franz Antetokounmpo attempts a 3Pt. Contested by Miles Bane (5.0 feet, ZONE). Franz Antetokounmpo misses. Rebound secured by Carmelo Lowry.

[08:22] Team_002 possession (Score: 87-57)
Miles Bane attempts a Midrange. Contested by Bradley Sabonis (4.6 feet, ZONE). Miles Bane misses. Rebound secured by Franz Antetokounmpo.

[08:08] Team_081 possession (Score: 87-57)
Bradley Leonard attempts a Layup. BLOCKED BY CJ BARRETT! Ball is loose! Rebound secured by Miles Bane.

[07:54] Team_002 possession (Score: 87-57)
Miles Bane drives to the basket... Miles Bane throws a bad pass out of bounds! TURNOVER! (dead ball)

[07:54] Substitution (Team_081): Julius Durant OUT → Dejounte Bane IN (stamina_rule2)

[07:54] Substitution (Team_081): Bradley Leonard OUT → Lamelo Wade IN (stamina_rule2)

[07:54] Substitution (Team_081): Vince Adebayo OUT → Larry Adebayo IN (stamina_rule2)

[07:54] Substitution (Team_081): Bradley Sabonis OUT → Chris Holiday IN (stamina_rule2)

[07:54] Substitution (Team_081): Franz Antetokounmpo OUT → D'Angelo Markkanen IN (stamina_rule2)

[07:54] Substitution (Team_002): Miles Bane OUT → John Duncan IN (stamina_rule2)

[07:54] Substitution (Team_002): CJ Barrett OUT → Dirk Middleton IN (stamina_rule2)

[07:54] Substitution (Team_002): Jordan Green OUT → Anfernee Sexton IN (stamina_rule2)

[07:54] Substitution (Team_002): Carmelo Lowry OUT → Julius Curry IN (stamina_rule2)

[07:54] Substitution (Team_002): Tyler Porzingis OUT → Lamelo O'Neal IN (stamina_rule2)

[07:40] Team_081 possession (Score: 87-57)
FOUL! Reach-in foul on Lamelo O'Neal during the drive. [Team fouls: 3] No free throws, side out. (Lamelo O'Neal: 1 personal fouls)

[07:21] Team_081 possession (Score: 87-57)
Chris Holiday attempts a 3Pt. Contested by Lamelo O'Neal (3.7 feet, MAN). Chris Holiday misses. Rebound secured by Julius Curry.

[07:04] Team_002 possession (Score: 87-57)
Dirk Middleton attempts a Layup. Contested by Chris Holiday (4.4 feet, ZONE). DIRK MIDDLETON MAKES IT! Assist: Julius Curry
Score: 87-59

[06:50] Team_081 possession (Score: 87-59)
D'Angelo Markkanen attempts a Layup. Contested by Lamelo O'Neal (3.8 feet, ZONE). D'Angelo Markkanen misses. Rebound secured by Julius Curry.

[06:39] Team_002 possession (Score: 87-59)
Anfernee Sexton makes the Midrange and draws the foul on Chris Holiday! And-1! Anfernee Sexton to the line for 1. [Team fouls: 1] (Chris Holiday: 1 personal fouls)   FT 1/1: GOOD Anfernee Sexton makes 1/1 from the line.
Score: 87-62

[06:27] Team_081 possession (Score: 87-62)
Dejounte Bane drives and kicks out. Dejounte Bane attempts a Midrange. Contested by Anfernee Sexton (4.4 feet, ZONE). DEJOUNTE BANE MAKES IT!
Score: 89-62

[06:12] Team_002 possession (Score: 89-62)
John Duncan attempts a 3Pt. Contested by Dejounte Bane (5.3 feet, MAN). John Duncan misses. Offensive rebound by Lamelo O'Neal! Lamelo O'Neal puts it back in!
Score: 89-64

[05:57] Team_081 possession (Score: 89-64)
Dejounte Bane attempts a 3Pt. Contested by Julius Curry (5.5 feet, ZONE). Dejounte Bane misses. Rebound secured by Julius Curry.

[05:46] Team_002 possession (Score: 89-64)
John Duncan makes the Dunk and draws the foul on Dejounte Bane! And-1! John Duncan to the line for 1. [Team fouls: 2] (Dejounte Bane: 1 personal fouls)   FT 1/1: GOOD John Duncan makes 1/1 from the line.
Score: 89-67

[05:32] Team_081 possession (Score: 89-67)
Larry Adebayo drives, Julius Curry stays with him. Larry Adebayo attempts a Dunk. Contested by Julius Curry (5.3 feet, ZONE). LARRY ADEBAYO MAKES IT! Assist: Lamelo Wade
Score: 91-67

[05:18] Team_002 possession (Score: 91-67)
John Duncan attempts a 3Pt. Contested by Dejounte Bane (5.3 feet, MAN). John Duncan misses. Rebound secured by Lamelo Wade.

[05:00] Team_081 possession (Score: 91-67)
Dejounte Bane attempts a Midrange. Contested by Anfernee Sexton (4.7 feet, ZONE). Dejounte Bane misses. Rebound secured by Lamelo O'Neal.

[04:49] Team_002 possession (Score: 91-67)
Anfernee Sexton drives and kicks out. Anfernee Sexton attempts a 3Pt. Contested by Larry Adebayo (5.3 feet, MAN). Anfernee Sexton misses. Rebound secured by Larry Adebayo.

[04:34] Team_081 possession (Score: 91-67)
Lamelo Wade attempts a Layup. Contested by Lamelo O'Neal (3.5 feet, ZONE). Lamelo Wade misses. FOUL! Loose ball foul on Julius Curry during the rebound battle. [Team fouls: 4] No free throws, side out. (Julius Curry: 1 personal fouls)

[04:21] Team_081 possession (Score: 91-67)
Chris Holiday drives and kicks out. Lamelo Wade attempts a 3Pt. Contested by Julius Curry (5.3 feet, ZONE). LAMELO WADE MAKES IT! Assist: Larry Adebayo
Score: 94-67

[04:03] Team_002 possession (Score: 94-67)
Dirk Middleton attempts a Midrange. Contested by D'Angelo Markkanen (5.3 feet, ZONE). Dirk Middleton misses. Rebound secured by Larry Adebayo.

[03:49] Team_081 possession (Score: 94-67)
Chris Holiday loses control! Ball rolls out of bounds! TURNOVER! (dead ball)

[03:37] Team_002 possession (Score: 94-67)
Julius Curry attempts a 3Pt. Contested by Chris Holiday (4.1 feet, ZONE). Julius Curry misses. Offensive rebound by Lamelo O'Neal! Lamelo O'Neal puts it back in!
Score: 94-69

[03:20] Team_081 possession (Score: 94-69)
Lamelo Wade attempts a 3Pt. Contested by Julius Curry (5.2 feet, ZONE). LAMELO WADE MAKES IT! Assist: Chris Holiday
Score: 97-69

[03:10] Team_002 possession (Score: 97-69)
John Duncan attempts a 3Pt. Contested by Dejounte Bane (5.3 feet, MAN). John Duncan misses. Rebound secured by Larry Adebayo.

[02:55] Team_081 possession (Score: 97-69)
Lamelo Wade attempts a 3Pt. Contested by Julius Curry (5.2 feet, ZONE). LAMELO WADE MAKES IT! Assist: Chris Holiday
Score: 100-69

[02:43] Team_002 possession (Score: 100-69)
John Duncan makes the Midrange and draws the foul on Lamelo Wade! And-1! John Duncan to the line for 1. [Team fouls: 3] (Lamelo Wade: 1 personal fouls)   FT 1/1: MISS John Duncan makes 0/1 from the line. Rebound secured by Lamelo Wade.
Score: 100-71

[02:29] Team_081 possession (Score: 100-71)
Chris Holiday loses the ball! Stripped by Lamelo O'Neal! TURNOVER! (live ball)

[02:19] Team_002 possession (Score: 100-71)
Anfernee Sexton attempts a Midrange. Contested by Larry Adebayo (5.7 feet, MAN). Anfernee Sexton misses. Rebound secured by Lamelo Wade.

[02:05] Team_081 possession (Score: 100-71)
D'Angelo Markkanen attempts a 3Pt. Contested by Julius Curry (5.5 feet, ZONE). D'ANGELO MARKKANEN MAKES IT! Assist: Lamelo Wade
Score: 103-71

[01:51] Team_002 possession (Score: 103-71)
Lamelo O'Neal attempts a Layup. Contested by Chris Holiday (4.5 feet, ZONE). LAMELO O'NEAL MAKES IT! Assist: Julius Curry
Score: 103-73

[01:35] Team_081 possession (Score: 103-73)
D'Angelo Markkanen attempts a 3Pt. Contested by Lamelo O'Neal (3.8 feet, MAN). D'Angelo Markkanen misses. Offensive rebound by Chris Holiday! Chris Holiday kicks it out.

[01:18] Team_081 possession (Score: 103-73)
Dejounte Bane attempts a Midrange. Contested by John Duncan (5.5 feet, MAN). DEJOUNTE BANE MAKES IT! Assist: D'Angelo Markkanen
Score: 105-73

[01:03] Team_002 possession (Score: 105-73)
Anfernee Sexton attempts a 3Pt. Contested by Larry Adebayo (5.7 feet, MAN). Anfernee Sexton misses. Rebound secured by Larry Adebayo.

[00:48] Team_081 possession (Score: 105-73)
D'Angelo Markkanen attempts a Midrange. Contested by Anfernee Sexton (4.6 feet, ZONE). D'ANGELO MARKKANEN MAKES IT! Assist: Larry Adebayo
Score: 107-73

[00:31] Team_002 possession (Score: 107-73)
John Duncan makes the 3Pt and draws the foul on Chris Holiday! And-1! John Duncan to the line for 1. [Team fouls: 4] (Chris Holiday: 2 personal fouls)   FT 1/1: GOOD John Duncan makes 1/1 from the line.
Score: 107-77

[00:16] Team_081 possession (Score: 107-77)
Dejounte Bane loses the ball! Stripped by John Duncan! TURNOVER! (live ball)

[00:04] Team_002 possession (Score: 107-77)
Julius Curry attempts a Midrange. Contested by Larry Adebayo (5.2 feet, ZONE). JULIUS CURRY MAKES IT!
Score: 107-79

================================================================================
                              4TH QUARTER COMPLETE                              
================================================================================

4TH QUARTER SCORE: Team_081 32, Team_002 24

BOX SCORE:
================================================================================

Team_081
--------------------------------------------------------------------------------
Player                MIN  PTS  REB  AST  TO      FG   FG%      3P   3P%
--------------------------------------------------------------------------------
Lamelo Wade            18    9    3    2   0   3/3   100.0     0/0   0.0
Julius Durant          30    5    0    0   0   2/3    66.7     0/0   0.0
Vince Adebayo          30    5    2    0   0   2/2   100.0     0/0   0.0
D'Angelo Markkanen     18    5    0    1   0   2/3    66.7     0/0   0.0
Dejounte Bane          18    4    0    0   0   2/4    50.0     0/0   0.0
Franz Antetokounmpo    30    2    4    2   0   1/2    50.0     0/0   0.0
Larry Adebayo          18    2    4    2   0   1/1   100.0     0/0   0.0
Bradley Leonard        30    0    0    0   0   0/1     0.0     0/0   0.0
Chris Holiday          18    0    2    2   0   0/1     0.0     0/0   0.0

TEAM: FG: 13/20 (65.0%), 3PT: 3/5 (60.0%), REB: 15 (2 off, 13 def), AST: 9, TO: 4
TEAM FOULS: 4


Team_002
--------------------------------------------------------------------------------
Player                MIN  PTS  REB  AST  TO      FG   FG%      3P   3P%
--------------------------------------------------------------------------------
John Duncan            18    7    0    0   0   2/5    40.0     0/0   0.0
Lamelo O'Neal          18    6    3    0   0   3/3   100.0     0/0   0.0
Anfernee Sexton        18    3    0    0   0   1/4    25.0     0/0   0.0
Jordan Green           30    2    0    0   0   1/1   100.0     0/0   0.0
Julius Curry           18    2    3    2   0   1/1   100.0     0/0   0.0
Dirk Middleton         18    2    0    0   0   1/2    50.0     0/0   0.0
Carmelo Lowry          30    0    1    1   0   0/1     0.0     0/0   0.0
Miles Bane             30    0    2    0   0   0/3     0.0     0/0   0.0
CJ Barrett             30    0    0    0   0   0/1     0.0     0/0   0.0
Tyler Porzingis        30    0    0    0   0   0/1     0.0     0/0   0.0

TEAM: FG: 9/22 (40.9%), 3PT: 3/8 (37.5%), REB: 9 (2 off, 7 def), AST: 3, TO: 2
TEAM FOULS: 4

================================================================================

================================================================================
                               FULL GAME COMPLETE                               
================================================================================

FINAL SCORE: Team_081 107, Team_002 79

SCORING BY QUARTER:
--------------------------------------------------------------------------------
Team                     Q1     Q2     Q3     Q4    FINAL
--------------------------------------------------------------------------------
Team_081                 29     20     26     32      107
Team_002                 13     21     21     24       79
--------------------------------------------------------------------------------

FULL GAME BOX SCORE:
================================================================================

Team_081
--------------------------------------------------------------------------------
Player                MIN  PTS  REB  AST  TO      FG   FG%      3P   3P%      FT STL BLK
--------------------------------------------------------------------------------
Julius Durant          30   18    0    5   2   4/9    44.4   2/2   100.0   5/5     0   0
Bradley Leonard        30    7    0    2   1   3/9    33.3   1/2    50.0   2/2     0   0
Vince Adebayo          30   13    9    1   2   7/9    77.8   2/3    66.7   4/5     0   0
Bradley Sabonis        30   10    8    0   2   3/7    42.9   1/2    50.0   5/5     0   0
Franz Antetokounmpo    30   17   18    3   0   7/12   58.3   0/1     0.0   3/5     1   0
Dejounte Bane          18   11    0    0   2   5/9    55.6   0/2     0.0   1/1     0   0
Lamelo Wade            18   12    7    4   0   3/4    75.0   3/4    75.0   0/0     0   0
Larry Adebayo          18    7    7    5   1   3/4    75.0   1/2    50.0   0/0     0   0
Chris Holiday          18    2    4    3   3   2/5    40.0   0/3     0.0   0/0     0   1
D'Angelo Markkanen     18    8    0    1   0   3/5    60.0   1/1   100.0   1/1     0   0

TEAM: FG: 43/76 (56.6%), 3PT: 11/22 (50.0%), REB: 53 (12 off, 41 def), AST: 24, TO: 13


Team_002
--------------------------------------------------------------------------------
Player                MIN  PTS  REB  AST  TO      FG   FG%      3P   3P%      FT STL BLK
--------------------------------------------------------------------------------
Miles Bane             30    8    9    1   2   3/12   25.0   0/2     0.0   4/4     0   0
CJ Barrett             30    3    0    2   1   2/7    28.6   0/4     0.0   1/2     0   2
Jordan Green           30    8    0    0   0   4/9    44.4   2/6    33.3   0/0     0   0
Carmelo Lowry          30    8   10    2   1   3/7    42.9   0/1     0.0   2/4     1   0
Tyler Porzingis        30    9    7    2   3   4/10   40.0   0/1     0.0   3/4     1   0
John Duncan            18   13    0    0   1   5/10   50.0   3/7    42.9   3/4     2   0
Dirk Middleton         18    5    0    1   0   2/5    40.0   1/3    33.3   0/0     0   0
Anfernee Sexton        18    3    6    2   1   2/5    40.0   1/2    50.0   1/1     1   0
Julius Curry           18    6    3    2   1   4/6    66.7   1/2    50.0   0/0     0   0
Lamelo O'Neal          18   12    6    1   1   2/3    66.7   0/0     0.0   6/6     1   0

TEAM: FG: 33/76 (43.4%), 3PT: 8/28 (28.6%), REB: 41 (10 off, 31 def), AST: 13, TO: 11

================================================================================
