================================================================================
                        FULL GAME - Team_084 vs Team_074                        
================================================================================

================================================================================
                       1ST QUARTER - Team_084 vs Team_074                       
================================================================================

[12:00] Team_084 possession (Score: 0-0)
Dejounte Ginobili attempts a 3Pt. Contested by Chris Carter (4.5 feet, MAN). Dejounte Ginobili misses. Rebound secured by Shai Green.

[11:43] Team_074 possession (Score: 0-0)
Shai Green attempts a 3Pt. Contested by Luka Sexton (4.2 feet, ZONE). Shai Green misses. Rebound secured by Dejounte Ginobili.

[11:26] Team_084 possession (Score: 0-0)
Jarrett Booker attempts a Layup. Contested by James Turner (3.7 feet, ZONE). Jarrett Booker misses. Rebound secured by Donovan Doncic.

[11:12] Team_074 possession (Score: 0-0)
Donovan Doncic attempts a 3Pt. Contested by Luka Sexton (4.0 feet, ZONE). DONOVAN DONCIC MAKES IT! Assist: Dwyane Quickley
Score: 0-3

[10:56] Team_084 possession (Score: 0-3)
Luka Sexton attempts a Midrange. Contested by Shai Green (3.8 feet, ZONE). Luka Sexton misses. Rebound secured by Donovan Doncic.

[10:37] Team_074 possession (Score: 0-3)
FOUL! Holding foul on Giannis Quickley. [Team fouls: 1] No free throws, side out. (Giannis Quickley: 1 personal fouls)

[10:22] Team_074 possession (Score: 0-3)
Dwyane Quickley attempts a 3Pt. Contested by Luka Sexton (3.9 feet, MAN). Dwyane Quickley misses. Rebound secured by Giannis Quickley.

[10:04] Team_084 possession (Score: 0-3)
Luka Sexton attempts a 3Pt. Contested by Dwyane Quickley (5.7 feet, MAN). Luka Sexton misses. Rebound secured by Donovan Doncic.

[09:48] Team_074 possession (Score: 0-3)
FOUL! Shooting foul on Dejounte Ginobili. Chris Carter to the line for 3 free throws. [Team fouls: 2] (Dejounte Ginobili: 1 personal fouls)   FT 1/3: GOOD   FT 2/3: GOOD   FT 3/3: MISS Chris Carter makes 2/3 from the line. Rebound secured by Dejounte Ginobili.
Score: 0-5

[09:33] Team_084 possession (Score: 0-5)
Giannis Quickley drives to the basket... Giannis Quickley throws a bad pass! Stolen by Donovan Doncic! TURNOVER! (live ball)

[09:15] Team_074 possession (Score: 0-5)
James Turner drives and kicks out. Donovan Doncic attempts a 3Pt. Contested by Jarrett Booker (4.6 feet, MAN). DONOVAN DONCIC MAKES IT! Assist: Shai Green
Score: 0-8

[09:06] Team_084 possession (Score: 0-8)
FOUL! Reach-in foul on James Turner during the drive. [Team fouls: 1] No free throws, side out. (James Turner: 1 personal fouls)

[08:51] Team_084 possession (Score: 0-8)
Jarrett Booker attempts a 3Pt. Contested by Dwyane Quickley (5.7 feet, ZONE). Jarrett Booker misses. Offensive rebound by Giannis Quickley! Giannis Quickley puts it back in!
Score: 2-8

[08:34] Team_074 possession (Score: 2-8)
FOUL! Shooting foul on Giannis Quickley. James Turner to the line for 2 free throws. [Team fouls: 3] (Giannis Quickley: 2 personal fouls)   FT 1/2: GOOD   FT 2/2: MISS James Turner makes 1/2 from the line. Rebound secured by Giannis Quickley.
Score: 2-9

[08:20] Team_084 possession (Score: 2-9)
Dejounte Ginobili attempts a 3Pt. Contested by Dwyane Quickley (5.7 feet, ZONE). DEJOUNTE GINOBILI MAKES IT! Assist: Klay Thompson
Score: 5-9

[08:05] Team_074 possession (Score: 5-9)
James Turner attempts a 3Pt. Contested by Jarrett Booker (5.2 feet, ZONE). JAMES TURNER MAKES IT! Assist: Chris Carter
Score: 5-12

[07:49] Team_084 possession (Score: 5-12)
Luka Sexton attempts a Layup. Contested by Dwyane Quickley (5.7 feet, MAN). Luka Sexton misses. Rebound secured by Donovan Doncic.

[07:36] Team_074 possession (Score: 5-12)
Chris Carter attempts a 3Pt. Contested by Luka Sexton (4.3 feet, ZONE). CHRIS CARTER MAKES IT! Assist: Donovan Doncic
Score: 5-15

[07:25] Team_084 possession (Score: 5-15)
Jarrett Booker attempts a Midrange. Contested by Shai Green (3.7 feet, ZONE). Jarrett Booker misses. Offensive rebound by Dejounte Ginobili! Dejounte Ginobili kicks it out.

[07:14] Team_084 possession (Score: 5-15)
Dejounte Ginobili drives and kicks out. Jarrett Booker attempts a 3Pt. Contested by Donovan Doncic (3.7 feet, MAN). Jarrett Booker misses. Rebound secured by Shai Green.

[06:58] Team_074 possession (Score: 5-15)
Shai Green attempts a Layup. Contested by Giannis Quickley (4.9 feet, ZONE). Shai Green misses. Rebound secured by Klay Thompson.

[06:39] Team_084 possession (Score: 5-15)
Luka Sexton drives to the basket... Luka Sexton throws a bad pass out of bounds! TURNOVER! (dead ball)

[06:24] Team_074 possession (Score: 5-15)
Dwyane Quickley attempts a 3Pt. Contested by Luka Sexton (3.9 feet, MAN). Dwyane Quickley misses. Rebound secured by Giannis Quickley.

[06:09] Team_084 possession (Score: 5-15)
Jarrett Booker drives, Donovan Doncic stays with him. Jarrett Booker attempts a Dunk. Contested by Donovan Doncic (3.9 feet, MAN). JARRETT BOOKER MAKES IT!
Score: 7-15

[05:54] Team_074 possession (Score: 7-15)
Shai Green attempts a Layup. Contested by Giannis Quickley (4.9 feet, ZONE). SHAI GREEN MAKES IT! Assist: Dwyane Quickley
Score: 7-17

[05:40] Team_084 possession (Score: 7-17)
Luka Sexton attempts a 3Pt. Contested by Dwyane Quickley (5.7 feet, MAN). LUKA SEXTON MAKES IT! Assist: Klay Thompson
Score: 10-17

[05:29] Team_074 possession (Score: 10-17)
Donovan Doncic attempts a Midrange. Contested by Jarrett Booker (4.9 feet, MAN). DONOVAN DONCIC MAKES IT!
Score: 10-19

[05:17] Team_084 possession (Score: 10-19)
Jarrett Booker drives, picks up Donovan Doncic. Help arrives from Chris Carter! Jarrett Booker attempts a Dunk. Contested by Chris Carter (3.9 feet, ZONE). Jarrett Booker misses. Rebound secured by James Turner.

[05:06] Team_074 possession (Score: 10-19)
Shai Green attempts a 3Pt. Contested by Luka Sexton (4.2 feet, ZONE). Shai Green misses. Rebound secured by Giannis Quickley.

[04:54] Team_084 possession (Score: 10-19)
Jarrett Booker attempts a 3Pt. Contested by Dwyane Quickley (5.7 feet, ZONE). Jarrett Booker misses. Rebound secured by Donovan Doncic.

[04:36] Team_074 possession (Score: 10-19)
James Turner attempts a Midrange. Contested by Klay Thompson (5.5 feet, ZONE). James Turner misses. Rebound secured by Giannis Quickley.

[04:23] Team_084 possession (Score: 10-19)
Giannis Quickley loses the ball! Stripped by James Turner! TURNOVER! (live ball)

[04:07] Team_074 possession (Score: 10-19)
Dwyane Quickley attempts a Midrange. Contested by Jarrett Booker (5.0 feet, ZONE). Dwyane Quickley misses. Rebound secured by Dejounte Ginobili.

[03:54] Team_084 possession (Score: 10-19)
Jarrett Booker attempts a Midrange. Contested by Donovan Doncic (4.0 feet, MAN). JARRETT BOOKER MAKES IT! Assist: Dejounte Ginobili
Score: 12-19

[03:38] Team_074 possession (Score: 12-19)
Dwyane Quickley attempts a 3Pt. Contested by Dejounte Ginobili (5.0 feet, ZONE). Dwyane Quickley misses. Rebound secured by Klay Thompson.

[03:25] Team_084 possession (Score: 12-19)
Jarrett Booker attempts a 3Pt. Contested by Dwyane Quickley (5.8 feet, ZONE). Jarrett Booker misses. Rebound secured by Shai Green.

[03:09] Team_074 possession (Score: 12-19)
James Turner attempts a Layup. Contested by Giannis Quickley (5.2 feet, ZONE). JAMES TURNER MAKES IT! Assist: Chris Carter
Score: 12-21

[02:54] Team_084 possession (Score: 12-21)
Giannis Quickley drives to the basket... FOUL! Offensive foul on Giannis Quickley! James Turner drew the charge! [Team fouls: 4] (Giannis Quickley: 3 personal fouls) TURNOVER! (dead ball)

[02:44] Team_074 possession (Score: 12-21)
Donovan Doncic drives, Jarrett Booker stays with him. Donovan Doncic attempts a Dunk. Contested by Jarrett Booker (5.1 feet, MAN). Donovan Doncic misses. Rebound secured by Klay Thompson.

[02:30] Team_084 possession (Score: 12-21)
Jarrett Booker drives and kicks out. Giannis Quickley attempts a 3Pt. Contested by Dwyane Quickley (5.6 feet, ZONE). Giannis Quickley misses. Rebound secured by James Turner.

[02:16] Team_074 possession (Score: 12-21)
FOUL! Reach-in foul on Dejounte Ginobili during the drive. [IN THE BONUS! 5 team fouls] Chris Carter to the line for 2 free throws. (Dejounte Ginobili: 2 personal fouls)   FT 1/2: MISS   FT 2/2: GOOD Chris Carter makes 1/2 from the line.
Score: 12-22

[02:00] Team_084 possession (Score: 12-22)
Luka Sexton attempts a Midrange. BLOCKED BY SHAI GREEN! Ball is loose! Rebound secured by Donovan Doncic.

[01:44] Team_074 possession (Score: 12-22)
Chris Carter attempts a Layup. Contested by Dejounte Ginobili (5.5 feet, MAN). CHRIS CARTER MAKES IT! Assist: Shai Green
Score: 12-24

[01:30] Team_084 possession (Score: 12-24)
Giannis Quickley makes the Layup and draws the foul on Donovan Doncic! And-1! Giannis Quickley to the line for 1. [Team fouls: 2] (Donovan Doncic: 1 personal fouls)   FT 1/1: GOOD Giannis Quickley makes 1/1 from the line.
Score: 15-24

[01:13] Team_074 possession (Score: 15-24)
Shai Green attempts a 3Pt. Contested by Luka Sexton (4.5 feet, ZONE). Shai Green misses. Rebound secured by Dejounte Ginobili.

[00:55] Team_084 possession (Score: 15-24)
Dejounte Ginobili attempts a 3Pt. Contested by Dwyane Quickley (5.9 feet, ZONE). Dejounte Ginobili misses. Rebound secured by Donovan Doncic.

[00:37] Team_074 possession (Score: 15-24)
Donovan Doncic attempts a Layup. Contested by Jarrett Booker (5.3 feet, MAN). Donovan Doncic misses. Rebound secured by Klay Thompson.

[00:24] Team_084 possession (Score: 15-24)
Jarrett Booker drives, picks up Donovan Doncic. Help arrives from Chris Carter! Jarrett Booker attempts a Dunk. Contested by Chris Carter (4.3 feet, ZONE). Jarrett Booker misses. Offensive rebound by Dejounte Ginobili! Dejounte Ginobili kicks it out.

[00:08] Team_084 possession (Score: 15-24)
Jarrett Booker attempts a 3Pt. Wide open! Dwyane Quickley is 6.0 feet away. [ZONE] Jarrett Booker misses. Rebound secured by Shai Green.

================================================================================
                              1ST QUARTER COMPLETE                              
================================================================================

1ST QUARTER SCORE: Team_084 15, Team_074 24

BOX SCORE:
================================================================================

Team_084
--------------------------------------------------------------------------------
Player                MIN  PTS  REB  AST  TO      FG   FG%      3P   3P%
--------------------------------------------------------------------------------
Giannis Quickley       12    5    6    0   0   2/2   100.0     0/0   0.0
Jarrett Booker         12    4    0    0   0   2/8    25.0     0/0   0.0
Dejounte Ginobili      12    3    6    1   0   1/4    25.0     0/0   0.0
Luka Sexton            12    3    0    0   0   1/5    20.0     0/0   0.0
Klay Thompson          12    0    4    2   0   0/0     0.0     0/0   0.0

TEAM: FG: 6/19 (31.6%), 3PT: 3/9 (33.3%), REB: 16 (3 off, 13 def), AST: 3, TO: 4
TEAM FOULS: 5 [Team_074 in BONUS]


Team_074
--------------------------------------------------------------------------------
Player                MIN  PTS  REB  AST  TO      FG   FG%      3P   3P%
--------------------------------------------------------------------------------
Donovan Doncic         12    8    7    1   0   3/5    60.0     0/0   0.0
Chris Carter           12    6    0    2   0   3/4    75.0     0/0   0.0
James Turner           12    5    2    0   0   2/4    50.0     0/0   0.0
Shai Green             12    2    4    2   0   1/5    20.0     0/0   0.0
Dwyane Quickley        12    0    0    2   0   0/4     0.0     0/0   0.0

TEAM: FG: 9/22 (40.9%), 3PT: 3/10 (30.0%), REB: 13 (0 off, 13 def), AST: 7, TO: 0
TEAM FOULS: 2

================================================================================

================================================================================
                       2ND QUARTER - Team_084 vs Team_074                       
================================================================================

[12:00] Team_084 possession (Score: 15-24)
FOUL! Reach-in foul on Chris Carter during the drive. [Team fouls: 1] No free throws, side out. (Chris Carter: 1 personal fouls)

[11:46] Team_084 possession (Score: 15-24)
Jarrett Booker attempts a Midrange. Contested by Donovan Doncic (4.1 feet, MAN). Jarrett Booker misses. Rebound secured by Donovan Doncic.

[11:29] Team_074 possession (Score: 15-24)
Dwyane Quickley attempts a Layup. Contested by Luka Sexton (4.2 feet, MAN). DWYANE QUICKLEY MAKES IT! Assist: James Turner
Score: 15-26

[11:16] Team_084 possession (Score: 15-26)
FOUL! Shooting foul on Chris Carter. Dejounte Ginobili to the line for 3 free throws. [Team fouls: 2] (Chris Carter: 2 personal fouls)   FT 1/3: MISS   FT 2/3: GOOD   FT 3/3: GOOD Dejounte Ginobili makes 2/3 from the line.
Score: 17-26

[11:02] Team_074 possession (Score: 17-26)
Shai Green attempts a 3Pt. Contested by Luka Sexton (4.5 feet, ZONE). Shai Green misses. Rebound secured by Klay Thompson.

[10:50] Team_084 possession (Score: 17-26)
Jarrett Booker attempts a Layup. BLOCKED BY DONOVAN DONCIC! Ball is loose! Rebound secured by Donovan Doncic.

[10:37] Team_074 possession (Score: 17-26)
FOUL! Holding foul on Dejounte Ginobili. [Team fouls: 1] No free throws, side out. (Dejounte Ginobili: 1 personal fouls)

[10:20] Team_074 possession (Score: 17-26)
FOUL! Holding foul on Klay Thompson. [Team fouls: 2] No free throws, side out. (Klay Thompson: 1 personal fouls)

[10:06] Team_074 possession (Score: 17-26)
Donovan Doncic drives and kicks out. Chris Carter attempts a Midrange. Contested by Jarrett Booker (5.1 feet, ZONE). CHRIS CARTER MAKES IT!
Score: 17-28

[09:54] Team_084 possession (Score: 17-28)
Giannis Quickley attempts a 3Pt. Wide open! Dwyane Quickley is 6.1 feet away. [ZONE] Giannis Quickley misses. Rebound secured by Donovan Doncic.

[09:42] Team_074 possession (Score: 17-28)
FOUL! Reach-in foul on Giannis Quickley during the drive. [Team fouls: 3] No free throws, side out. (Giannis Quickley: 1 personal fouls)

[09:26] Team_074 possession (Score: 17-28)
Dwyane Quickley attempts a 3Pt. Contested by Luka Sexton (4.4 feet, ZONE). DWYANE QUICKLEY MAKES IT! Assist: Donovan Doncic
Score: 17-31

[09:15] Team_084 possession (Score: 17-31)
Jarrett Booker throws a bad pass! Stolen by Donovan Doncic! TURNOVER! (live ball)

[09:01] Team_074 possession (Score: 17-31)
James Turner drives to the basket... James Turner throws a bad pass! Stolen by Giannis Quickley! TURNOVER! (live ball)

[08:46] Team_084 possession (Score: 17-31)
Dejounte Ginobili attempts a Midrange. Contested by Chris Carter (5.1 feet, MAN). Dejounte Ginobili misses. Offensive rebound by Dejounte Ginobili! Dejounte Ginobili kicks it out.

[08:30] Team_084 possession (Score: 17-31)
Dejounte Ginobili attempts a 3Pt. Contested by Chris Carter (5.2 feet, MAN). DEJOUNTE GINOBILI MAKES IT! Assist: Giannis Quickley
Score: 20-31

[08:16] Team_074 possession (Score: 20-31)
FOUL! Reach-in foul on Dejounte Ginobili during the drive. [Team fouls: 4] No free throws, side out. (Dejounte Ginobili: 2 personal fouls)

[07:58] Team_074 possession (Score: 20-31)
FOUL! Shooting foul on Jarrett Booker. Donovan Doncic to the line for 2 free throws. [BONUS: 5 team fouls] (Jarrett Booker: 1 personal fouls)   FT 1/2: GOOD   FT 2/2: GOOD Donovan Doncic makes 2/2 from the line.
Score: 20-33

[07:44] Team_084 possession (Score: 20-33)
Dejounte Ginobili attempts a 3Pt. Wide open! Dwyane Quickley is 6.2 feet away. [ZONE] Dejounte Ginobili misses. Offensive rebound by Giannis Quickley! Giannis Quickley's putback is no good. Rebound secured by Shai Green.

[07:31] Team_074 possession (Score: 20-33)
Dwyane Quickley attempts a Layup. BLOCKED BY LUKA SEXTON! Ball is loose! Offensive rebound by Donovan Doncic! Donovan Doncic kicks it out.

[07:15] Team_074 possession (Score: 20-33)
James Turner drives and kicks out. James Turner attempts a 3Pt. Contested by Luka Sexton (4.6 feet, ZONE). James Turner misses. Rebound secured by Klay Thompson.

[06:59] Team_084 possession (Score: 20-33)
Klay Thompson attempts a 3Pt. Wide open! Dwyane Quickley is 6.5 feet away. [ZONE] Klay Thompson misses. Rebound secured by Donovan Doncic.

[06:40] Team_074 possession (Score: 20-33)
Chris Carter attempts a Layup. BLOCKED BY GIANNIS QUICKLEY! Ball is loose! Offensive rebound by Donovan Doncic! Donovan Doncic kicks it out.

[06:29] Team_074 possession (Score: 20-33)
Shai Green attempts a 3Pt. Wide open! Klay Thompson is 6.2 feet away. [MAN] Shai Green misses. Offensive rebound by Donovan Doncic! Donovan Doncic kicks it out.

[06:11] Team_074 possession (Score: 20-33)
Dwyane Quickley attempts a Midrange. Contested by Luka Sexton (4.8 feet, MAN). Dwyane Quickley misses. Rebound secured by Giannis Quickley.

[05:57] Team_084 possession (Score: 20-33)
Klay Thompson attempts a 3Pt. Contested by Shai Green (5.0 feet, MAN). Klay Thompson misses. Rebound secured by Donovan Doncic.

[05:47] Team_074 possession (Score: 20-33)
Shai Green attempts a 3Pt. Wide open! Klay Thompson is 6.3 feet away. [MAN] Shai Green misses. Rebound secured by Giannis Quickley.

[05:36] Team_084 possession (Score: 20-33)
Giannis Quickley drives to the basket... Giannis Quickley throws a bad pass out of bounds! TURNOVER! (dead ball)

[05:36] Substitution (Team_084): Luka Sexton OUT → Magic Bryant IN (stamina_rule2)

[05:36] Substitution (Team_084): Dejounte Ginobili OUT → Chris Parker IN (stamina_rule2)

[05:36] Substitution (Team_084): Klay Thompson OUT → Evan Quickley IN (stamina_rule2)

[05:36] Substitution (Team_084): Jarrett Booker OUT → Pascal Jackson IN (stamina_rule2)

[05:36] Substitution (Team_084): Giannis Quickley OUT → Dejounte Porzingis IN (stamina_rule2)

[05:36] Substitution (Team_074): Dwyane Quickley OUT → James Barnes IN (stamina_rule2)

[05:36] Substitution (Team_074): Chris Carter OUT → Giannis Westbrook IN (stamina_rule2)

[05:36] Substitution (Team_074): Shai Green OUT → Ayo Smith IN (stamina_rule2)

[05:36] Substitution (Team_074): Donovan Doncic OUT → Yao Randle IN (stamina_rule2)

[05:36] Substitution (Team_074): James Turner OUT → Jaren Rozier IN (stamina_rule2)

[05:26] Team_074 possession (Score: 20-33)
FOUL! Holding foul on Chris Parker. [IN THE BONUS! 7 team fouls] Giannis Westbrook to the line for 2 free throws. (Chris Parker: 1 personal fouls)   FT 1/2: GOOD   FT 2/2: GOOD Giannis Westbrook makes 2/2 from the line.
Score: 20-35

[05:09] Team_084 possession (Score: 20-35)
Evan Quickley attempts a Midrange. Contested by James Barnes (4.2 feet, ZONE). Evan Quickley misses. Rebound secured by Jaren Rozier.

[04:55] Team_074 possession (Score: 20-35)
Jaren Rozier attempts a Layup. BLOCKED BY DEJOUNTE PORZINGIS! Ball is loose! Offensive rebound by Jaren Rozier! Jaren Rozier kicks it out.

[04:42] Team_074 possession (Score: 20-35)
Jaren Rozier attempts a Layup. Contested by Dejounte Porzingis (4.8 feet, ZONE). Jaren Rozier misses. Rebound secured by Dejounte Porzingis.

[04:29] Team_084 possession (Score: 20-35)
FOUL! Reach-in foul on Jaren Rozier during the drive. [Team fouls: 3] No free throws, side out. (Jaren Rozier: 1 personal fouls)

[04:16] Team_084 possession (Score: 20-35)
Magic Bryant attempts a 3Pt. Contested by James Barnes (4.3 feet, MAN). Magic Bryant misses. Rebound secured by Jaren Rozier.

[04:03] Team_074 possession (Score: 20-35)
James Barnes attempts a 3Pt. Contested by Magic Bryant (3.6 feet, ZONE). James Barnes misses. Rebound secured by Pascal Jackson.

[03:50] Team_084 possession (Score: 20-35)
Evan Quickley attempts a Layup. BLOCKED BY GIANNIS WESTBROOK! Ball is loose! Offensive rebound by Dejounte Porzingis! Dejounte Porzingis kicks it out.

[03:35] Team_084 possession (Score: 20-35)
Magic Bryant attempts a Midrange. Contested by Giannis Westbrook (4.5 feet, ZONE). Magic Bryant misses. Rebound secured by Ayo Smith.

[03:22] Team_074 possession (Score: 20-35)
Ayo Smith attempts a 3Pt. Contested by Evan Quickley (5.0 feet, ZONE). Ayo Smith misses. Rebound secured by Evan Quickley.

[03:04] Team_084 possession (Score: 20-35)
FOUL! Shooting foul on Giannis Westbrook. Pascal Jackson to the line for 2 free throws. [BONUS: 5 team fouls] (Giannis Westbrook: 1 personal fouls)   FT 1/2: GOOD   FT 2/2: MISS Pascal Jackson makes 1/2 from the line. Offensive rebound by Dejounte Porzingis! Dejounte Porzingis kicks it out.
Score: 21-35

[02:51] Team_084 possession (Score: 21-35)
Chris Parker makes the 3Pt and draws the foul on Giannis Westbrook! And-1! Chris Parker to the line for 1. [BONUS: 6 team fouls] (Giannis Westbrook: 2 personal fouls)   FT 1/1: GOOD Chris Parker makes 1/1 from the line.
Score: 25-35

[02:33] Team_074 possession (Score: 25-35)
Ayo Smith attempts a 3Pt. Contested by Magic Bryant (3.8 feet, ZONE). AYO SMITH MAKES IT! Assist: Giannis Westbrook
Score: 25-38

[02:16] Team_084 possession (Score: 25-38)
FOUL! Holding foul on Ayo Smith. [IN THE BONUS! 7 team fouls] Evan Quickley to the line for 2 free throws. (Ayo Smith: 2 personal fouls)   FT 1/2: MISS   FT 2/2: GOOD Evan Quickley makes 1/2 from the line.
Score: 26-38

[02:00] Team_074 possession (Score: 26-38)
FOUL! Shooting foul on Pascal Jackson. Yao Randle to the line for 2 free throws. [BONUS: 9 team fouls] (Pascal Jackson: 1 personal fouls)   FT 1/2: GOOD   FT 2/2: GOOD Yao Randle makes 2/2 from the line.
Score: 26-40

[01:46] Team_084 possession (Score: 26-40)
Magic Bryant drives and kicks out. Magic Bryant attempts a Midrange. Contested by Ayo Smith (4.8 feet, ZONE). MAGIC BRYANT MAKES IT!
Score: 28-40

[01:34] Team_074 possession (Score: 28-40)
Ayo Smith attempts a Midrange. Contested by Chris Parker (4.7 feet, ZONE). AYO SMITH MAKES IT! Assist: Jaren Rozier
Score: 28-42

[01:21] Team_084 possession (Score: 28-42)
Dejounte Porzingis drives and kicks out. Evan Quickley attempts a 3Pt. BLOCKED BY AYO SMITH! Ball is loose! Rebound secured by Ayo Smith.

[01:04] Team_074 possession (Score: 28-42)
Yao Randle drives and kicks out. Giannis Westbrook attempts a 3Pt. Contested by Magic Bryant (3.7 feet, ZONE). Giannis Westbrook misses. Offensive rebound by Yao Randle! Yao Randle kicks it out.

[00:53] Team_074 possession (Score: 28-42)
FOUL! Shooting foul on Dejounte Porzingis. Jaren Rozier to the line for 3 free throws. [BONUS: 10 team fouls] (Dejounte Porzingis: 2 personal fouls)   FT 1/3: GOOD   FT 2/3: GOOD   FT 3/3: GOOD Jaren Rozier makes 3/3 from the line.
Score: 28-45

[00:38] Team_084 possession (Score: 28-45)
Evan Quickley attempts a 3Pt. Contested by Giannis Westbrook (4.4 feet, ZONE). EVAN QUICKLEY MAKES IT! Assist: Chris Parker
Score: 31-45

[00:23] Team_074 possession (Score: 31-45)
Jaren Rozier drives and kicks out. Ayo Smith attempts a 3Pt. Contested by Evan Quickley (4.9 feet, MAN). AYO SMITH MAKES IT! Assist: Giannis Westbrook
Score: 31-48

[00:07] Team_084 possession (Score: 31-48)
Magic Bryant attempts a 3Pt. Contested by James Barnes (4.3 feet, ZONE). Magic Bryant misses. Rebound secured by Yao Randle.

================================================================================
                              2ND QUARTER COMPLETE                              
================================================================================

2ND QUARTER SCORE: Team_084 16, Team_074 24

BOX SCORE:
================================================================================

Team_084
--------------------------------------------------------------------------------
Player                MIN  PTS  REB  AST  TO      FG   FG%      3P   3P%
--------------------------------------------------------------------------------
Dejounte Ginobili      19    5    1    0   0   2/3    66.7     0/0   0.0
Evan Quickley           6    4    1    0   0   2/3    66.7     0/0   0.0
Chris Parker            6    4    0    1   0   1/1   100.0     0/0   0.0
Magic Bryant            6    2    0    0   0   1/4    25.0     0/0   0.0
Jarrett Booker         19    0    0    0   0   0/2     0.0     0/0   0.0
Klay Thompson          19    0    2    0   0   0/2     0.0     0/0   0.0
Giannis Quickley       19    0    2    1   0   0/1     0.0     0/0   0.0
Dejounte Porzingis      6    0    3    0   0   0/1     0.0     0/0   0.0
Pascal Jackson          6    0    1    0   0   0/0     0.0     0/0   0.0

TEAM: FG: 6/17 (35.3%), 3PT: 4/10 (40.0%), REB: 11 (4 off, 7 def), AST: 2, TO: 2
TEAM FOULS: 10 [Team_074 in BONUS]


Team_074
--------------------------------------------------------------------------------
Player                MIN  PTS  REB  AST  TO      FG   FG%      3P   3P%
--------------------------------------------------------------------------------
Ayo Smith               6    8    2    0   0   3/4    75.0     0/0   0.0
Dwyane Quickley        19    5    0    0   0   2/3    66.7     0/0   0.0
Jaren Rozier            6    3    3    1   0   1/2    50.0     0/0   0.0
Donovan Doncic         19    2    8    1   0   1/1   100.0     0/0   0.0
Chris Carter           19    2    0    0   0   1/1   100.0     0/0   0.0
Giannis Westbrook       6    2    0    2   0   1/1   100.0     0/0   0.0
Yao Randle              6    2    2    0   0   1/1   100.0     0/0   0.0
James Turner           19    0    0    1   0   0/1     0.0     0/0   0.0
Shai Green             19    0    1    0   0   0/2     0.0     0/0   0.0
James Barnes            6    0    0    0   0   0/1     0.0     0/0   0.0

TEAM: FG: 10/17 (58.8%), 3PT: 3/7 (42.9%), REB: 15 (5 off, 10 def), AST: 5, TO: 1
TEAM FOULS: 7 [Team_084 in BONUS]

================================================================================

================================================================================
                       3RD QUARTER - Team_084 vs Team_074                       
================================================================================

[12:00] Team_084 possession (Score: 31-48)
Klay Thompson attempts a 3Pt. Contested by Dwyane Quickley (5.9 feet, ZONE). Klay Thompson misses. Rebound secured by James Turner.

[11:44] Team_074 possession (Score: 31-48)
Shai Green attempts a 3Pt. Contested by Luka Sexton (4.2 feet, ZONE). Shai Green misses. Rebound secured by Klay Thompson.

[11:32] Team_084 possession (Score: 31-48)
FOUL! Holding foul on Dwyane Quickley. [Team fouls: 1] No free throws, side out. (Dwyane Quickley: 1 personal fouls)

[11:20] Team_084 possession (Score: 31-48)
Giannis Quickley attempts a Midrange. Contested by James Turner (3.7 feet, MAN). Giannis Quickley misses. Rebound secured by Donovan Doncic.

[11:03] Team_074 possession (Score: 31-48)
Shai Green attempts a 3Pt. Contested by Luka Sexton (4.2 feet, ZONE). Shai Green misses. Rebound secured by Klay Thompson.

[10:50] Team_084 possession (Score: 31-48)
Klay Thompson attempts a 3Pt. Contested by Dwyane Quickley (5.9 feet, ZONE). Klay Thompson misses. Rebound secured by Shai Green.

[10:38] Team_074 possession (Score: 31-48)
Dwyane Quickley attempts a 3Pt. Contested by Luka Sexton (3.9 feet, MAN). DWYANE QUICKLEY MAKES IT! Assist: James Turner
Score: 31-51

[10:23] Team_084 possession (Score: 31-51)
Jarrett Booker makes the Dunk and draws the foul on Donovan Doncic! And-1! Jarrett Booker to the line for 1. [Team fouls: 2] (Donovan Doncic: 1 personal fouls)   FT 1/1: MISS Jarrett Booker makes 0/1 from the line. Rebound secured by James Turner.
Score: 33-51

[10:08] Team_074 possession (Score: 33-51)
James Turner drives, Giannis Quickley stays with him. James Turner attempts a Layup. Contested by Giannis Quickley (5.1 feet, MAN). JAMES TURNER MAKES IT!
Score: 33-53

[09:53] Team_084 possession (Score: 33-53)
Dejounte Ginobili attempts a 3Pt. Contested by Dwyane Quickley (5.7 feet, ZONE). Dejounte Ginobili misses. Offensive rebound by Dejounte Ginobili! Dejounte Ginobili kicks it out.

[09:36] Team_084 possession (Score: 33-53)
Jarrett Booker attempts a Layup. BLOCKED BY CHRIS CARTER! Ball is loose! Rebound secured by Shai Green.

[09:21] Team_074 possession (Score: 33-53)
Shai Green attempts a 3Pt. Contested by Klay Thompson (5.3 feet, ZONE). Shai Green misses. Rebound secured by Giannis Quickley.

[09:08] Team_084 possession (Score: 33-53)
Jarrett Booker attempts a Midrange. Contested by Shai Green (3.7 feet, ZONE). Jarrett Booker misses. FOUL! Loose ball foul on Shai Green during the rebound battle. [Team fouls: 3] No free throws, side out. (Shai Green: 1 personal fouls)

[08:52] Team_084 possession (Score: 33-53)
Dejounte Ginobili attempts a Midrange. Contested by Chris Carter (4.5 feet, MAN). Dejounte Ginobili misses. Rebound secured by Donovan Doncic.

[08:39] Team_074 possession (Score: 33-53)
Shai Green drives, picks up Giannis Quickley. Help arrives from Dejounte Ginobili! Shai Green attempts a Layup. Contested by Dejounte Ginobili (4.9 feet, ZONE). SHAI GREEN MAKES IT!
Score: 33-55

[08:24] Team_084 possession (Score: 33-55)
Klay Thompson attempts a 3Pt. Contested by Dwyane Quickley (5.9 feet, ZONE). Klay Thompson misses. Rebound secured by Donovan Doncic.

[08:12] Team_074 possession (Score: 33-55)
Dwyane Quickley attempts a 3Pt. Contested by Luka Sexton (3.9 feet, ZONE). Dwyane Quickley misses. Rebound secured by Giannis Quickley.

[08:01] Team_084 possession (Score: 33-55)
Klay Thompson drives, Donovan Doncic stays with him. Klay Thompson attempts a Dunk. Contested by Donovan Doncic (4.2 feet, ZONE). KLAY THOMPSON MAKES IT! Assist: Luka Sexton
Score: 35-55

[07:46] Team_074 possession (Score: 35-55)
FOUL! Shooting foul on Dejounte Ginobili. Donovan Doncic to the line for 2 free throws. [Team fouls: 1] (Dejounte Ginobili: 1 personal fouls)   FT 1/2: GOOD   FT 2/2: GOOD Donovan Doncic makes 2/2 from the line.
Score: 35-57

[07:27] Team_084 possession (Score: 35-57)
Giannis Quickley attempts a Layup. Contested by James Turner (3.7 feet, MAN). GIANNIS QUICKLEY MAKES IT!
Score: 37-57

[07:16] Team_074 possession (Score: 37-57)
Donovan Doncic attempts a 3Pt. Contested by Jarrett Booker (4.9 feet, MAN). Donovan Doncic misses. Rebound secured by Klay Thompson.

[07:03] Team_084 possession (Score: 37-57)
FOUL! Shooting foul on Chris Carter. Jarrett Booker to the line for 2 free throws. [Team fouls: 4] (Chris Carter: 1 personal fouls)   FT 1/2: GOOD   FT 2/2: GOOD Jarrett Booker makes 2/2 from the line.
Score: 39-57

[06:49] Team_074 possession (Score: 39-57)
Shai Green attempts a Midrange. Contested by Klay Thompson (5.3 feet, MAN). SHAI GREEN MAKES IT! Assist: James Turner
Score: 39-59

[06:32] Team_084 possession (Score: 39-59)
FOUL! Shooting foul on Shai Green. Klay Thompson to the line for 2 free throws. [BONUS: 5 team fouls] (Shai Green: 2 personal fouls)   FT 1/2: GOOD   FT 2/2: GOOD Klay Thompson makes 2/2 from the line.
Score: 41-59

[06:19] Team_074 possession (Score: 41-59)
Chris Carter attempts a Midrange. Contested by Dejounte Ginobili (5.2 feet, MAN). Chris Carter misses. Rebound secured by Dejounte Ginobili.

[06:06] Team_084 possession (Score: 41-59)
FOUL! Holding foul on James Turner. [IN THE BONUS! 6 team fouls] Giannis Quickley to the line for 2 free throws. (James Turner: 1 personal fouls)   FT 1/2: GOOD   FT 2/2: GOOD Giannis Quickley makes 2/2 from the line.
Score: 43-59

[05:52] Team_074 possession (Score: 43-59)
Chris Carter attempts a 3Pt. Contested by Dejounte Ginobili (5.2 feet, MAN). CHRIS CARTER MAKES IT! Assist: James Turner
Score: 43-62

[05:42] Team_084 possession (Score: 43-62)
Klay Thompson attempts a 3Pt. Contested by Shai Green (4.0 feet, MAN). Klay Thompson misses. Offensive rebound by Dejounte Ginobili! Dejounte Ginobili kicks it out.

[05:26] Team_084 possession (Score: 43-62)
FOUL! Shooting foul on Shai Green. Klay Thompson to the line for 2 free throws. [BONUS: 7 team fouls] (Shai Green: 3 personal fouls)   FT 1/2: GOOD   FT 2/2: GOOD Klay Thompson makes 2/2 from the line.
Score: 45-62

[05:10] Team_074 possession (Score: 45-62)
Shai Green drives to the basket... Shai Green commits a violation (traveling/carry)! TURNOVER! (dead ball)

[04:58] Team_084 possession (Score: 45-62)
Jarrett Booker attempts a 3Pt. Contested by Donovan Doncic (3.9 feet, MAN). Jarrett Booker misses. Rebound secured by James Turner.

[04:42] Team_074 possession (Score: 45-62)
James Turner loses the ball! Stripped by Giannis Quickley! TURNOVER! (live ball)

[04:27] Team_084 possession (Score: 45-62)
Dejounte Ginobili attempts a Midrange. Contested by Donovan Doncic (3.9 feet, ZONE). Dejounte Ginobili misses. Rebound secured by Donovan Doncic.

[04:11] Team_074 possession (Score: 45-62)
Shai Green loses control! Ball rolls out of bounds! TURNOVER! (dead ball)

[03:56] Team_084 possession (Score: 45-62)
FOUL! Reach-in foul on Dwyane Quickley during the drive. [IN THE BONUS! 8 team fouls] Luka Sexton to the line for 2 free throws. (Dwyane Quickley: 2 personal fouls)   FT 1/2: GOOD   FT 2/2: GOOD Luka Sexton makes 2/2 from the line.
Score: 47-62

[03:43] Team_074 possession (Score: 47-62)
Dwyane Quickley drives to the basket... Dwyane Quickley loses the ball! Stripped by Giannis Quickley! TURNOVER! (live ball)

[03:27] Team_084 possession (Score: 47-62)
Luka Sexton attempts a 3Pt. Contested by Dwyane Quickley (5.9 feet, ZONE). Luka Sexton misses. Rebound secured by Donovan Doncic.

[03:17] Team_074 possession (Score: 47-62)
Donovan Doncic drives and kicks out. Donovan Doncic attempts a 3Pt. Contested by Luka Sexton (3.8 feet, ZONE). DONOVAN DONCIC MAKES IT! Assist: Dwyane Quickley
Score: 47-65

[03:08] Team_084 possession (Score: 47-65)
Giannis Quickley drives and kicks out. Klay Thompson attempts a Midrange. Contested by Shai Green (3.7 feet, MAN). Klay Thompson misses. Offensive rebound by Dejounte Ginobili! Dejounte Ginobili kicks it out.

[02:55] Team_084 possession (Score: 47-65)
Luka Sexton attempts a 3Pt. Contested by Dwyane Quickley (5.9 feet, ZONE). Luka Sexton misses. Rebound secured by James Turner.

[02:46] Team_074 possession (Score: 47-65)
FOUL! Shooting foul on Luka Sexton. Shai Green to the line for 3 free throws. [Team fouls: 2] (Luka Sexton: 1 personal fouls)   FT 1/3: MISS   FT 2/3: GOOD   FT 3/3: GOOD Shai Green makes 2/3 from the line.
Score: 47-67

[02:32] Team_084 possession (Score: 47-67)
Dejounte Ginobili throws a bad pass! Stolen by Chris Carter! TURNOVER! (live ball)

[02:18] Team_074 possession (Score: 47-67)
FOUL! Reach-in foul on Giannis Quickley during the drive. [Team fouls: 3] No free throws, side out. (Giannis Quickley: 1 personal fouls)

[02:08] Team_074 possession (Score: 47-67)
James Turner drives and kicks out. Donovan Doncic attempts a 3Pt. Contested by Luka Sexton (4.0 feet, ZONE). Donovan Doncic misses. Rebound secured by Klay Thompson.

[01:54] Team_084 possession (Score: 47-67)
Giannis Quickley attempts a Midrange. Contested by James Turner (4.0 feet, MAN). Giannis Quickley misses. FOUL! Loose ball foul on Donovan Doncic during the rebound battle. [IN THE BONUS! 9 team fouls] Giannis Quickley to the line for 2 free throws. (Donovan Doncic: 2 personal fouls)   FT 1/2: MISS   FT 2/2: MISS Giannis Quickley makes 0/2 from the line. Rebound secured by Donovan Doncic.

[01:44] Team_074 possession (Score: 47-67)
James Turner attempts a Layup. BLOCKED BY GIANNIS QUICKLEY! Ball deflects out of bounds off James Turner.

[01:29] Team_084 possession (Score: 47-67)
Giannis Quickley attempts a Midrange. Contested by James Turner (4.1 feet, MAN). GIANNIS QUICKLEY MAKES IT!
Score: 49-67

[01:15] Team_074 possession (Score: 49-67)
Dwyane Quickley attempts a Midrange. Contested by Luka Sexton (4.3 feet, MAN). DWYANE QUICKLEY MAKES IT! Assist: Donovan Doncic
Score: 49-69

[01:02] Team_084 possession (Score: 49-69)
Dejounte Ginobili drives and kicks out. Jarrett Booker attempts a Midrange. Contested by Chris Carter (4.8 feet, ZONE). Jarrett Booker misses. Rebound secured by Donovan Doncic.

[00:51] Team_074 possession (Score: 49-69)
Chris Carter drives and kicks out. Shai Green attempts a 3Pt. Contested by Luka Sexton (4.2 feet, ZONE). Shai Green misses. Offensive rebound by Donovan Doncic! Donovan Doncic kicks it out.

[00:38] Team_074 possession (Score: 49-69)
Chris Carter attempts a 3Pt. Contested by Dejounte Ginobili (5.6 feet, MAN). Chris Carter misses. Offensive rebound by Donovan Doncic! Donovan Doncic kicks it out.

[00:20] Team_074 possession (Score: 49-69)
Shai Green attempts a Midrange. Contested by Dejounte Ginobili (5.6 feet, ZONE). Shai Green misses. FOUL! Loose ball foul on Giannis Quickley during the rebound battle. [Team fouls: 4] No free throws, side out. (Giannis Quickley: 2 personal fouls)

[00:07] Team_074 possession (Score: 49-69)
Dwyane Quickley attempts a 3Pt. Contested by Luka Sexton (4.5 feet, ZONE). DWYANE QUICKLEY MAKES IT! Assist: James Turner
Score: 49-72

================================================================================
                              3RD QUARTER COMPLETE                              
================================================================================

3RD QUARTER SCORE: Team_084 18, Team_074 24

BOX SCORE:
================================================================================

Team_084
--------------------------------------------------------------------------------
Player                MIN  PTS  REB  AST  TO      FG   FG%      3P   3P%
--------------------------------------------------------------------------------
Klay Thompson          31    6    4    0   0   3/6    50.0     0/0   0.0
Giannis Quickley       31    6    3    0   0   3/5    60.0     0/0   0.0
Jarrett Booker         31    2    0    0   0   1/4    25.0     0/0   0.0
Luka Sexton            31    2    0    1   0   1/3    33.3     0/0   0.0
Dejounte Ginobili      31    0    4    0   0   0/3     0.0     0/0   0.0

TEAM: FG: 8/21 (38.1%), 3PT: 0/6 (0.0%), REB: 12 (5 off, 7 def), AST: 1, TO: 1
TEAM FOULS: 4


Team_074
--------------------------------------------------------------------------------
Player                MIN  PTS  REB  AST  TO      FG   FG%      3P   3P%
--------------------------------------------------------------------------------
Dwyane Quickley        31    8    0    1   0   3/4    75.0     0/0   0.0
Shai Green             31    6    2    0   0   3/6    50.0     0/0   0.0
Donovan Doncic         31    5   10    1   0   2/3    66.7     0/0   0.0
Chris Carter           31    3    0    0   0   1/2    50.0     0/0   0.0
James Turner           31    2    4    4   0   1/3    33.3     0/0   0.0

TEAM: FG: 10/18 (55.6%), 3PT: 4/9 (44.4%), REB: 15 (3 off, 12 def), AST: 6, TO: 4
TEAM FOULS: 9 [Team_084 in BONUS]

================================================================================

================================================================================
                       4TH QUARTER - Team_084 vs Team_074                       
================================================================================

[12:00] Substitution (Team_084): Luka Sexton OUT (stamina: 69) → Magic Bryant IN (comeback_detected)

[12:00] Substitution (Team_074): Dwyane Quickley OUT (stamina: 68) → James Barnes IN (comeback_detected)

[12:00] Team_084 possession (Score: 49-72)
Giannis Quickley attempts a Midrange. Contested by James Turner (4.0 feet, MAN). Giannis Quickley misses. Rebound secured by James Turner.

[11:44] Team_074 possession (Score: 49-72)
Donovan Doncic attempts a Midrange. Contested by Jarrett Booker (5.3 feet, ZONE). Donovan Doncic misses. Rebound secured by Dejounte Ginobili.

[11:27] Team_084 possession (Score: 49-72)
Klay Thompson attempts a 3Pt. Contested by James Barnes (4.6 feet, ZONE). Klay Thompson misses. Rebound secured by Donovan Doncic.

[11:11] Team_074 possession (Score: 49-72)
Donovan Doncic attempts a Midrange. Contested by Magic Bryant (3.9 feet, ZONE). Donovan Doncic misses. Rebound secured by Dejounte Ginobili.

[10:58] Team_084 possession (Score: 49-72)
Magic Bryant attempts a 3Pt. Contested by James Barnes (4.3 feet, ZONE). Magic Bryant misses. Rebound secured by James Turner.

[10:40] Team_074 possession (Score: 49-72)
Chris Carter makes the Layup and draws the foul on Giannis Quickley! And-1! Chris Carter to the line for 1. [Team fouls: 1] (Giannis Quickley: 1 personal fouls)   FT 1/1: GOOD Chris Carter makes 1/1 from the line.
Score: 49-75

[10:26] Team_084 possession (Score: 49-75)
FOUL! Holding foul on James Barnes. [Team fouls: 1] No free throws, side out. (James Barnes: 1 personal fouls)

[10:11] Team_084 possession (Score: 49-75)
Jarrett Booker attempts a 3Pt. Contested by Chris Carter (5.0 feet, ZONE). JARRETT BOOKER MAKES IT! Assist: Magic Bryant
Score: 52-75

[09:58] Team_074 possession (Score: 52-75)
Chris Carter drives, picks up Giannis Quickley. Help arrives from Dejounte Ginobili! Chris Carter attempts a Layup. Contested by Dejounte Ginobili (5.6 feet, ZONE). Chris Carter misses. Rebound secured by Dejounte Ginobili.

[09:45] Team_084 possession (Score: 52-75)
Magic Bryant attempts a 3Pt. Contested by James Barnes (4.3 feet, ZONE). Magic Bryant misses. FOUL! Loose ball foul on James Turner during the rebound battle. [Team fouls: 2] No free throws, side out. (James Turner: 1 personal fouls)

[09:33] Team_084 possession (Score: 52-75)
Dejounte Ginobili attempts a 3Pt. Contested by James Barnes (4.4 feet, ZONE). Dejounte Ginobili misses. Rebound secured by Donovan Doncic.

[09:16] Team_074 possession (Score: 52-75)
James Barnes drives, Giannis Quickley stays with him. James Barnes attempts a Layup. Contested by Giannis Quickley (5.1 feet, ZONE). JAMES BARNES MAKES IT! Assist: Chris Carter
Score: 52-77

[09:02] Team_084 possession (Score: 52-77)
Giannis Quickley attempts a Layup. Contested by James Turner (4.3 feet, MAN). GIANNIS QUICKLEY MAKES IT! Assist: Jarrett Booker
Score: 54-77

[08:47] Team_074 possession (Score: 54-77)
FOUL! Holding foul on Giannis Quickley. [Team fouls: 2] No free throws, side out. (Giannis Quickley: 2 personal fouls)

[08:32] Team_074 possession (Score: 54-77)
Donovan Doncic throws a bad pass out of bounds! TURNOVER! (dead ball)

[08:32] Substitution (Team_084): Dejounte Ginobili OUT → Chris Parker IN (stamina_rule2)

[08:32] Substitution (Team_084): Klay Thompson OUT → Evan Quickley IN (stamina_rule2)

[08:32] Substitution (Team_084): Jarrett Booker OUT → Pascal Jackson IN (stamina_rule2)

[08:32] Substitution (Team_084): Giannis Quickley OUT → Dejounte Porzingis IN (stamina_rule2)

[08:32] Substitution (Team_074): Chris Carter OUT → Giannis Westbrook IN (stamina_rule2)

[08:32] Substitution (Team_074): Shai Green OUT → Ayo Smith IN (stamina_rule2)

[08:32] Substitution (Team_074): Donovan Doncic OUT → Yao Randle IN (stamina_rule2)

[08:32] Substitution (Team_074): James Turner OUT → Jaren Rozier IN (stamina_rule2)

[08:17] Team_084 possession (Score: 54-77)
Magic Bryant attempts a Midrange. Contested by Ayo Smith (4.8 feet, ZONE). Magic Bryant misses. Rebound secured by Ayo Smith.

[08:05] Team_074 possession (Score: 54-77)
Giannis Westbrook drives and kicks out. Jaren Rozier attempts a Midrange. Contested by Dejounte Porzingis (5.0 feet, MAN). JAREN ROZIER MAKES IT!
Score: 54-79

[07:50] Team_084 possession (Score: 54-79)
Evan Quickley attempts a Midrange. Contested by Ayo Smith (4.7 feet, MAN). EVAN QUICKLEY MAKES IT!
Score: 56-79

[07:38] Team_074 possession (Score: 56-79)
Ayo Smith drives to the basket... Ayo Smith loses the ball! Stripped by Dejounte Porzingis! TURNOVER! (live ball)

[07:23] Team_084 possession (Score: 56-79)
Pascal Jackson throws a bad pass! Stolen by Yao Randle! TURNOVER! (live ball)

[07:12] Team_074 possession (Score: 56-79)
Jaren Rozier drives, picks up Dejounte Porzingis. Help arrives from Magic Bryant! Jaren Rozier attempts a Layup. Contested by Magic Bryant (4.8 feet, MAN). Jaren Rozier misses. FOUL! Loose ball foul on Pascal Jackson during the rebound battle. [Team fouls: 3] No free throws, side out. (Pascal Jackson: 1 personal fouls)

[06:57] Team_074 possession (Score: 56-79)
Ayo Smith attempts a Layup. Contested by Dejounte Porzingis (5.2 feet, ZONE). AYO SMITH MAKES IT! Assist: James Barnes
Score: 56-81

[06:40] Team_084 possession (Score: 56-81)
Magic Bryant attempts a Layup. Contested by Yao Randle (4.5 feet, ZONE). Magic Bryant misses. Rebound secured by Ayo Smith.

[06:24] Team_074 possession (Score: 56-81)
James Barnes drives and kicks out. Yao Randle attempts a 3Pt. Contested by Magic Bryant (3.7 feet, ZONE). Yao Randle misses. Rebound secured by Evan Quickley.

[06:11] Team_084 possession (Score: 56-81)
Chris Parker attempts a 3Pt. Contested by James Barnes (4.4 feet, ZONE). Chris Parker misses. Rebound secured by Ayo Smith.

[06:02] Team_074 possession (Score: 56-81)
James Barnes attempts a 3Pt. Contested by Magic Bryant (3.6 feet, MAN). James Barnes misses. Rebound secured by Evan Quickley.

[05:51] Team_084 possession (Score: 56-81)
Dejounte Porzingis attempts a 3Pt. Contested by Jaren Rozier (4.5 feet, MAN). Dejounte Porzingis misses. Rebound secured by Yao Randle.

[05:37] Team_074 possession (Score: 56-81)
Ayo Smith attempts a 3Pt. Contested by Evan Quickley (5.0 feet, MAN). Ayo Smith misses. Rebound secured by Pascal Jackson.

[05:22] Team_084 possession (Score: 56-81)
Pascal Jackson attempts a 3Pt. Contested by Yao Randle (4.7 feet, MAN). Pascal Jackson misses. Rebound secured by Jaren Rozier.

[05:09] Team_074 possession (Score: 56-81)
Yao Randle drives to the basket... Yao Randle throws a bad pass out of bounds! TURNOVER! (dead ball)

[04:53] Team_084 possession (Score: 56-81)
Magic Bryant attempts a 3Pt. Contested by James Barnes (4.3 feet, MAN). Magic Bryant misses. Rebound secured by Jaren Rozier.

[04:35] Team_074 possession (Score: 56-81)
Ayo Smith attempts a 3Pt. Contested by Evan Quickley (5.0 feet, MAN). Ayo Smith misses. Rebound secured by Dejounte Porzingis.

[04:23] Team_084 possession (Score: 56-81)
Dejounte Porzingis drives, picks up Yao Randle. Help arrives from Giannis Westbrook! Dejounte Porzingis attempts a Dunk. Contested by Giannis Westbrook (4.6 feet, ZONE). DEJOUNTE PORZINGIS MAKES IT! Assist: Magic Bryant
Score: 58-81

[04:06] Team_074 possession (Score: 58-81)
FOUL! Reach-in foul on Pascal Jackson during the drive. [Team fouls: 4] No free throws, side out. (Pascal Jackson: 2 personal fouls)

[03:52] Team_074 possession (Score: 58-81)
Giannis Westbrook drives, Dejounte Porzingis stays with him. Giannis Westbrook attempts a Dunk. Contested by Dejounte Porzingis (5.1 feet, ZONE). GIANNIS WESTBROOK MAKES IT! Assist: James Barnes
Score: 58-83

[03:38] Team_084 possession (Score: 58-83)
Magic Bryant attempts a Midrange. Contested by Jaren Rozier (4.4 feet, ZONE). Magic Bryant misses. Rebound secured by Jaren Rozier.

[03:20] Team_074 possession (Score: 58-83)
FOUL! Reach-in foul on Dejounte Porzingis during the drive. [IN THE BONUS! 5 team fouls] Yao Randle to the line for 2 free throws. (Dejounte Porzingis: 1 personal fouls)   FT 1/2: MISS   FT 2/2: GOOD Yao Randle makes 1/2 from the line.
Score: 58-84

[03:08] Team_084 possession (Score: 58-84)
Magic Bryant attempts a Midrange. Contested by Ayo Smith (4.7 feet, ZONE). Magic Bryant misses. FOUL! Loose ball foul on Jaren Rozier during the rebound battle. [Team fouls: 3] No free throws, side out. (Jaren Rozier: 1 personal fouls)

[02:57] Team_084 possession (Score: 58-84)
Evan Quickley attempts a Midrange. Contested by Ayo Smith (4.7 feet, MAN). EVAN QUICKLEY MAKES IT!
Score: 60-84

[02:40] Team_074 possession (Score: 60-84)
FOUL! Reach-in foul on Dejounte Porzingis during the drive. [IN THE BONUS! 6 team fouls] Jaren Rozier to the line for 2 free throws. (Dejounte Porzingis: 2 personal fouls)   FT 1/2: GOOD   FT 2/2: GOOD Jaren Rozier makes 2/2 from the line.
Score: 60-86

[02:27] Team_084 possession (Score: 60-86)
Pascal Jackson attempts a Midrange. Contested by Yao Randle (4.7 feet, MAN). PASCAL JACKSON MAKES IT!
Score: 62-86

[02:09] Team_074 possession (Score: 62-86)
Yao Randle commits a violation (traveling/carry)! TURNOVER! (dead ball)

[01:54] Team_084 possession (Score: 62-86)
Chris Parker drives and kicks out. Dejounte Porzingis attempts a Midrange. Contested by James Barnes (4.7 feet, ZONE). Dejounte Porzingis misses. Rebound secured by Jaren Rozier.

[01:38] Team_074 possession (Score: 62-86)
Jaren Rozier makes the Layup and draws the foul on Dejounte Porzingis! And-1! Jaren Rozier to the line for 1. [BONUS: 7 team fouls] (Dejounte Porzingis: 3 personal fouls)   FT 1/1: MISS Jaren Rozier makes 0/1 from the line. Rebound secured by Dejounte Porzingis.
Score: 62-88

[01:23] Team_084 possession (Score: 62-88)
Chris Parker drives to the basket... Chris Parker throws a bad pass out of bounds! TURNOVER! (dead ball)

[01:07] Team_074 possession (Score: 62-88)
Giannis Westbrook attempts a 3Pt. Contested by Chris Parker (4.7 feet, MAN). Giannis Westbrook misses. Rebound secured by Dejounte Porzingis.

[00:57] Team_084 possession (Score: 62-88)
FOUL! Shooting foul on Yao Randle. Evan Quickley to the line for 2 free throws. [Team fouls: 4] (Yao Randle: 1 personal fouls)   FT 1/2: GOOD   FT 2/2: GOOD Evan Quickley makes 2/2 from the line.
Score: 64-88

[00:44] Team_074 possession (Score: 64-88)
Yao Randle attempts a Layup. Contested by Dejounte Porzingis (5.2 feet, ZONE). YAO RANDLE MAKES IT!
Score: 64-90

[00:27] Team_084 possession (Score: 64-90)
Pascal Jackson drives and kicks out. Magic Bryant attempts a 3Pt. Contested by Ayo Smith (4.9 feet, ZONE). Magic Bryant misses. Rebound secured by Jaren Rozier.

[00:10] Team_074 possession (Score: 64-90)
Giannis Westbrook drives and kicks out. Jaren Rozier attempts a 3Pt. Contested by Dejounte Porzingis (5.2 feet, MAN). Jaren Rozier misses. Rebound secured by Pascal Jackson.

================================================================================
                              4TH QUARTER COMPLETE                              
================================================================================

4TH QUARTER SCORE: Team_084 15, Team_074 18

BOX SCORE:
================================================================================

Team_084
--------------------------------------------------------------------------------
Player                MIN  PTS  REB  AST  TO      FG   FG%      3P   3P%
--------------------------------------------------------------------------------
Evan Quickley          14    6    2    0   0   3/3   100.0     0/0   0.0
Jarrett Booker         35    3    0    1   0   1/1   100.0     0/0   0.0
Giannis Quickley       35    2    0    0   0   1/2    50.0     0/0   0.0
Dejounte Porzingis     14    2    4    0   0   1/2    50.0     0/0   0.0
Pascal Jackson         14    2    2    0   0   1/3    33.3     0/0   0.0
Dejounte Ginobili      35    0    4    0   0   0/1     0.0     0/0   0.0
Klay Thompson          35    0    0    0   0   0/1     0.0     0/0   0.0
Magic Bryant           18    0    0    2   0   0/5     0.0     0/0   0.0
Chris Parker           14    0    0    0   0   0/2     0.0     0/0   0.0

TEAM: FG: 7/20 (35.0%), 3PT: 1/8 (12.5%), REB: 12 (2 off, 10 def), AST: 3, TO: 2
TEAM FOULS: 7 [Team_074 in BONUS]


Team_074
--------------------------------------------------------------------------------
Player                MIN  PTS  REB  AST  TO      FG   FG%      3P   3P%
--------------------------------------------------------------------------------
Jaren Rozier           14    4    5    0   0   2/3    66.7     0/0   0.0
Chris Carter           35    3    0    1   0   1/2    50.0     0/0   0.0
Yao Randle             14    3    2    0   0   2/2   100.0     0/0   0.0
James Barnes           18    2    0    2   0   1/3    33.3     0/0   0.0
Ayo Smith              14    2    3    0   0   1/3    33.3     0/0   0.0
Giannis Westbrook      14    2    0    0   0   1/3    33.3     0/0   0.0
James Turner           35    0    2    0   0   0/0     0.0     0/0   0.0
Donovan Doncic         35    0    2    0   0   0/2     0.0     0/0   0.0

TEAM: FG: 8/18 (44.4%), 3PT: 0/4 (0.0%), REB: 14 (1 off, 13 def), AST: 3, TO: 4
TEAM FOULS: 4

================================================================================

================================================================================
                               FULL GAME COMPLETE                               
================================================================================

FINAL SCORE: Team_084 64, Team_074 90

SCORING BY QUARTER:
--------------------------------------------------------------------------------
Team                     Q1     Q2     Q3     Q4    FINAL
--------------------------------------------------------------------------------
Team_084                 15     16     18     15       64
Team_074                 24     24     24     18       90
--------------------------------------------------------------------------------

FULL GAME BOX SCORE:
================================================================================

Team_084
--------------------------------------------------------------------------------
Player                MIN  PTS  REB  AST  TO      FG   FG%      3P   3P%      FT STL BLK
--------------------------------------------------------------------------------
Dejounte Ginobili      35    8   15    1   1   3/11   27.3   3/7    42.9   2/3     0   0
Klay Thompson          35    6   10    2   1   3/9    33.3   0/6     0.0   4/4     0   0
Jarrett Booker         35    9    0    1   3   5/16   31.2   2/6    33.3   2/3     0   0
Giannis Quickley       35   13   11    1   1   4/8    50.0   0/1     0.0   3/5     3   2
Luka Sexton            31    5    0    1   1   2/8    25.0   1/4    25.0   2/2     0   1
Magic Bryant           18    2    0    2   0   1/9    11.1   0/4     0.0   0/0     0   0
Chris Parker           14    4    0    1   0   1/3    33.3   1/2    50.0   1/1     0   0
Evan Quickley          14   10    3    0   0   4/5    80.0   1/1   100.0   3/4     0   0
Pascal Jackson         14    2    3    0   1   1/3    33.3   0/1     0.0   1/2     0   0
Dejounte Porzingis     14    2    7    0   1   1/3    33.3   0/1     0.0   0/0     1   1

TEAM: FG: 27/77 (35.1%), 3PT: 8/33 (24.2%), REB: 51 (14 off, 37 def), AST: 9, TO: 9


Team_074
--------------------------------------------------------------------------------
Player                MIN  PTS  REB  AST  TO      FG   FG%      3P   3P%      FT STL BLK
--------------------------------------------------------------------------------
Chris Carter           35   14    0    3   0   5/8    62.5   2/3    66.7   4/6     1   1
Shai Green             35    8    7    2   1   4/13   30.8   1/9    11.1   2/3     0   1
Donovan Doncic         35   15   27    3   2   6/11   54.5   1/2    50.0   4/4     2   1
James Turner           35    7    8    5   3   4/9    44.4   1/1   100.0   1/2     1   0
Dwyane Quickley        31   13    0    3   0   5/11   45.5   3/7    42.9   0/0     0   0
James Barnes           18    2    0    2   0   1/4    25.0   0/2     0.0   0/0     0   0
Giannis Westbrook      14    4    0    2   0   2/4    50.0   0/1     0.0   2/2     0   1
Ayo Smith              14   10    5    0   1   3/6    50.0   1/4    25.0   0/0     0   1
Yao Randle             14    5    4    0   1   3/3   100.0   0/0     0.0   3/4     1   0
Jaren Rozier           14    7    8    1   1   3/5    60.0   1/1   100.0   5/6     0   0

TEAM: FG: 37/75 (49.3%), 3PT: 10/30 (33.3%), REB: 57 (9 off, 48 def), AST: 21, TO: 9

================================================================================
