================================================================================
                        FULL GAME - Team_086 vs Team_011                        
================================================================================

================================================================================
                       1ST QUARTER - Team_086 vs Team_011                       
================================================================================

[12:00] Team_086 possession (Score: 0-0)
Lauri Johnson attempts a Midrange. Contested by Magic Tatum (3.7 feet, MAN). Lauri Johnson misses. Rebound secured by Evan George.

[11:44] Team_011 possession (Score: 0-0)
Pau Barnes attempts a Midrange. Contested by Bones Ginobili (5.4 feet, MAN). PAU BARNES MAKES IT!
Score: 0-2

[11:31] Team_086 possession (Score: 0-2)
Miles Gobert attempts a Midrange. Contested by Michael Carter (4.4 feet, ZONE). Miles Gobert misses. Rebound secured by Michael Carter.

[11:17] Team_011 possession (Score: 0-2)
Magic Tatum loses control! Ball rolls out of bounds! TURNOVER! (dead ball)

[11:04] Team_086 possession (Score: 0-2)
Miles Gobert attempts a 3Pt. Contested by Pau Barnes (3.2 feet, ZONE). Miles Gobert misses. Rebound secured by Pau Barnes.

[10:46] Team_011 possession (Score: 0-2)
FOUL! Shooting foul on Anfernee Harris. Trae Tatum to the line for 2 free throws. [Team fouls: 1] (Anfernee Harris: 1 personal fouls)   FT 1/2: GOOD   FT 2/2: GOOD Trae Tatum makes 2/2 from the line.
Score: 0-4

[10:31] Team_086 possession (Score: 0-4)
Anfernee Harris attempts a Midrange. Contested by Michael Carter (4.7 feet, ZONE). ANFERNEE HARRIS MAKES IT! Assist: Bones Ginobili
Score: 2-4

[10:16] Team_011 possession (Score: 2-4)
Magic Tatum drives and kicks out. Evan George attempts a Midrange. Contested by Rudy Rose (3.7 feet, MAN). Evan George misses. Rebound secured by Miles Gobert.

[10:00] Team_086 possession (Score: 2-4)
Bones Ginobili drives and kicks out. Rudy Rose attempts a 3Pt. Contested by Pau Barnes (2.9 feet, MAN). Rudy Rose misses. Offensive rebound by Rudy Rose! Rudy Rose puts it back in!
Score: 4-4

[09:43] Team_011 possession (Score: 4-4)
Evan George drives and kicks out. Michael Carter attempts a Midrange. Contested by Anfernee Harris (4.2 feet, ZONE). Michael Carter misses. Rebound secured by Bones Ginobili.

[09:33] Team_086 possession (Score: 4-4)
Anfernee Harris loses control! Ball rolls out of bounds! TURNOVER! (dead ball)

[09:20] Team_011 possession (Score: 4-4)
Pau Barnes attempts a Layup. Contested by Rudy Rose (4.4 feet, ZONE). Pau Barnes misses. FOUL! Loose ball foul on Rudy Rose during the rebound battle. [Team fouls: 2] No free throws, side out. (Rudy Rose: 1 personal fouls)

[09:09] Team_011 possession (Score: 4-4)
Michael Carter attempts a 3Pt. Contested by Lauri Johnson (4.3 feet, ZONE). Michael Carter misses. FOUL! Loose ball foul on Rudy Rose during the rebound battle. [Team fouls: 3] No free throws, side out. (Rudy Rose: 2 personal fouls)

[08:51] Team_011 possession (Score: 4-4)
Evan George drives and kicks out. Trae Tatum attempts a 3Pt. Contested by Lauri Johnson (4.4 feet, ZONE). TRAE TATUM MAKES IT! Assist: Pau Barnes
Score: 4-7

[08:32] Team_086 possession (Score: 4-7)
FOUL! Shooting foul on Magic Tatum. Lauri Johnson to the line for 2 free throws. [Team fouls: 1] (Magic Tatum: 1 personal fouls)   FT 1/2: GOOD   FT 2/2: GOOD Lauri Johnson makes 2/2 from the line.
Score: 6-7

[08:19] Team_011 possession (Score: 6-7)
Evan George drives, Rudy Rose stays with him. Evan George attempts a Dunk. Contested by Rudy Rose (4.0 feet, ZONE). EVAN GEORGE MAKES IT! Assist: Michael Carter
Score: 6-9

[08:05] Team_086 possession (Score: 6-9)
Bones Ginobili attempts a 3Pt. Contested by Magic Tatum (3.9 feet, ZONE). Bones Ginobili misses. Rebound secured by Evan George.

[07:51] Team_011 possession (Score: 6-9)
Pau Barnes attempts a Midrange. Contested by Rudy Rose (4.4 feet, ZONE). PAU BARNES MAKES IT! Assist: Magic Tatum
Score: 6-11

[07:37] Team_086 possession (Score: 6-11)
Rudy Rose makes the Layup and draws the foul on Pau Barnes! And-1! Rudy Rose to the line for 1. [Team fouls: 2] (Pau Barnes: 1 personal fouls)   FT 1/1: GOOD Rudy Rose makes 1/1 from the line.
Score: 9-11

[07:28] Team_011 possession (Score: 9-11)
FOUL! Shooting foul on Rudy Rose. Magic Tatum to the line for 2 free throws. [Team fouls: 4] (Rudy Rose: 3 personal fouls)   FT 1/2: GOOD   FT 2/2: MISS Magic Tatum makes 1/2 from the line. Rebound secured by Miles Gobert.
Score: 9-12

[07:16] Team_086 possession (Score: 9-12)
Lauri Johnson attempts a Midrange. Contested by Magic Tatum (3.7 feet, MAN). Lauri Johnson misses. Rebound secured by Pau Barnes.

[07:00] Team_011 possession (Score: 9-12)
Pau Barnes attempts a Midrange. Contested by Bones Ginobili (5.4 feet, MAN). Pau Barnes misses. Rebound secured by Bones Ginobili.

[06:48] Team_086 possession (Score: 9-12)
Rudy Rose drives to the basket... Rudy Rose loses control! Ball rolls out of bounds! TURNOVER! (dead ball)

[06:34] Team_011 possession (Score: 9-12)
Evan George drives, Rudy Rose stays with him. Evan George attempts a Layup. Contested by Rudy Rose (4.0 feet, MAN). EVAN GEORGE MAKES IT!
Score: 9-14

[06:20] Team_086 possession (Score: 9-14)
Miles Gobert drives, Pau Barnes stays with him. Miles Gobert attempts a Dunk. Contested by Pau Barnes (3.2 feet, ZONE). MILES GOBERT MAKES IT!
Score: 11-14

[06:02] Team_011 possession (Score: 11-14)
Magic Tatum drives and kicks out. Trae Tatum attempts a Midrange. Contested by Anfernee Harris (4.2 feet, MAN). Trae Tatum misses. Rebound secured by Miles Gobert.

[05:47] Team_086 possession (Score: 11-14)
Lauri Johnson drives, picks up Pau Barnes. Help arrives from Magic Tatum! Lauri Johnson attempts a Layup. Contested by Magic Tatum (3.2 feet, ZONE). Lauri Johnson misses. FOUL! Loose ball foul on Michael Carter during the rebound battle. [Team fouls: 3] No free throws, side out. (Michael Carter: 1 personal fouls)

[05:33] Team_086 possession (Score: 11-14)
Lauri Johnson drives and kicks out. Rudy Rose attempts a Midrange. Contested by Trae Tatum (4.6 feet, ZONE). Rudy Rose misses. Rebound secured by Pau Barnes.

[05:14] Team_011 possession (Score: 11-14)
Trae Tatum attempts a 3Pt. Contested by Lauri Johnson (4.3 feet, ZONE). TRAE TATUM MAKES IT! Assist: Magic Tatum
Score: 11-17

[04:58] Team_086 possession (Score: 11-17)
Lauri Johnson drives, Magic Tatum stays with him. Lauri Johnson attempts a Layup. Contested by Magic Tatum (3.7 feet, MAN). LAURI JOHNSON MAKES IT! Assist: Bones Ginobili
Score: 13-17

[04:41] Team_011 possession (Score: 13-17)
Evan George attempts a Layup. Contested by Rudy Rose (4.0 feet, ZONE). Evan George misses. Rebound secured by Rudy Rose.

[04:27] Team_086 possession (Score: 13-17)
Lauri Johnson attempts a 3Pt. Contested by Magic Tatum (3.7 feet, MAN). Lauri Johnson misses. Rebound secured by Evan George.

[04:16] Team_011 possession (Score: 13-17)
Evan George drives and kicks out. Evan George attempts a 3Pt. Contested by Lauri Johnson (4.4 feet, ZONE). Evan George misses. Rebound secured by Rudy Rose.

[04:00] Team_086 possession (Score: 13-17)
FOUL! Shooting foul on Pau Barnes. Rudy Rose to the line for 2 free throws. [Team fouls: 4] (Pau Barnes: 2 personal fouls)   FT 1/2: MISS   FT 2/2: MISS Rudy Rose makes 0/2 from the line. Rebound secured by Michael Carter.

[03:45] Team_011 possession (Score: 13-17)
Trae Tatum makes the Layup and draws the foul on Rudy Rose! And-1! Trae Tatum to the line for 1. [BONUS: 5 team fouls] (Rudy Rose: 4 personal fouls)   FT 1/1: GOOD Trae Tatum makes 1/1 from the line.
Score: 13-20

[03:29] Team_086 possession (Score: 13-20)
Bones Ginobili attempts a Layup. Contested by Pau Barnes (3.6 feet, ZONE). Bones Ginobili misses. Rebound secured by Michael Carter.

[03:15] Team_011 possession (Score: 13-20)
Pau Barnes attempts a Dunk. BLOCKED BY RUDY ROSE! Ball deflects out of bounds off Pau Barnes.

[03:02] Team_086 possession (Score: 13-20)
Lauri Johnson attempts a 3Pt. Contested by Magic Tatum (3.8 feet, ZONE). Lauri Johnson misses. Offensive rebound by Miles Gobert! Miles Gobert kicks it out.

[02:51] Team_086 possession (Score: 13-20)
Rudy Rose drives, Pau Barnes stays with him. Rudy Rose attempts a Dunk. Contested by Pau Barnes (3.5 feet, ZONE). Rudy Rose misses. Offensive rebound by Rudy Rose! Rudy Rose puts it back in!
Score: 15-20

[02:35] Team_011 possession (Score: 15-20)
Pau Barnes makes the Layup and draws the foul on Rudy Rose! And-1! Pau Barnes to the line for 1. [BONUS: 6 team fouls] (Rudy Rose: 5 personal fouls)   FT 1/1: GOOD Pau Barnes makes 1/1 from the line.
Score: 15-23

[02:17] Team_086 possession (Score: 15-23)
FOUL! Holding foul on Pau Barnes. [IN THE BONUS! 5 team fouls] Rudy Rose to the line for 2 free throws. (Pau Barnes: 3 personal fouls)   FT 1/2: GOOD   FT 2/2: GOOD Rudy Rose makes 2/2 from the line.
Score: 17-23

[01:59] Team_011 possession (Score: 17-23)
Michael Carter drives, Rudy Rose stays with him. Michael Carter attempts a Layup. Contested by Rudy Rose (3.9 feet, ZONE). Michael Carter misses. Rebound secured by Miles Gobert.

[01:49] Team_086 possession (Score: 17-23)
Rudy Rose makes the Layup and draws the foul on Pau Barnes! And-1! Rudy Rose to the line for 1. [BONUS: 6 team fouls] (Pau Barnes: 4 personal fouls)   FT 1/1: GOOD Rudy Rose makes 1/1 from the line.
Score: 20-23

[01:34] Team_011 possession (Score: 20-23)
Magic Tatum attempts a 3Pt. Contested by Lauri Johnson (4.8 feet, MAN). Magic Tatum misses. Rebound secured by Rudy Rose.

[01:22] Team_086 possession (Score: 20-23)
Anfernee Harris attempts a 3Pt. Contested by Magic Tatum (4.3 feet, ZONE). Anfernee Harris misses. Rebound secured by Pau Barnes.

[01:10] Team_011 possession (Score: 20-23)
Pau Barnes attempts a Midrange. Contested by Bones Ginobili (5.7 feet, MAN). Pau Barnes misses. Rebound secured by Bones Ginobili.

[00:55] Team_086 possession (Score: 20-23)
Bones Ginobili drives to the basket... Bones Ginobili throws a bad pass out of bounds! TURNOVER! (dead ball)

[00:55] Substitution (Team_086): Lauri Johnson OUT → Anfernee Green IN (stamina_rule2)

[00:55] Substitution (Team_086): Anfernee Harris OUT → Anthony James IN (stamina_rule2)

[00:55] Substitution (Team_086): Miles Gobert OUT → Franz McGrady IN (stamina_rule2)

[00:55] Substitution (Team_086): Bones Ginobili OUT → Kyle McCollum IN (stamina_rule2)

[00:55] Substitution (Team_086): Rudy Rose OUT → Lamelo Towns IN (stamina_rule2)

[00:55] Substitution (Team_011): Magic Tatum OUT → Shai Leonard IN (stamina_rule2)

[00:55] Substitution (Team_011): Trae Tatum OUT → De'Aaron George IN (stamina_rule2)

[00:55] Substitution (Team_011): Michael Carter OUT → Tyrese Nowitzki IN (stamina_rule2)

[00:55] Substitution (Team_011): Pau Barnes OUT → Russell Davis IN (stamina_rule2)

[00:55] Substitution (Team_011): Evan George OUT → Pau Towns IN (stamina_rule2)

[00:42] Team_011 possession (Score: 20-23)
Tyrese Nowitzki attempts a 3Pt. Contested by Anfernee Green (4.0 feet, ZONE). Tyrese Nowitzki misses. Offensive rebound by Pau Towns! Pau Towns kicks it out.

[00:30] Team_011 possession (Score: 20-23)
Shai Leonard attempts a Midrange. Contested by Anthony James (4.1 feet, ZONE). Shai Leonard misses. FOUL! Loose ball foul on Anfernee Green during the rebound battle. [IN THE BONUS! 7 team fouls] Tyrese Nowitzki to the line for 2 free throws. (Anfernee Green: 1 personal fouls)   FT 1/2: GOOD   FT 2/2: MISS Tyrese Nowitzki makes 1/2 from the line. Rebound secured by Anfernee Green.
Score: 20-24

[00:19] Team_086 possession (Score: 20-24)
Anfernee Green drives, Russell Davis stays with him. Anfernee Green attempts a Dunk. Contested by Russell Davis (4.0 feet, ZONE). Anfernee Green misses. Rebound secured by Russell Davis.

[00:05] Team_011 possession (Score: 20-24)
De'Aaron George loses the ball! Stripped by Anthony James! TURNOVER! (live ball)

================================================================================
                              1ST QUARTER COMPLETE                              
================================================================================

1ST QUARTER SCORE: Team_086 20, Team_011 24

BOX SCORE:
================================================================================

Team_086
--------------------------------------------------------------------------------
Player                MIN  PTS  REB  AST  TO      FG   FG%      3P   3P%
--------------------------------------------------------------------------------
Rudy Rose              11   12    6    0   0   5/6    83.3     0/0   0.0
Lauri Johnson          11    4    0    0   0   2/6    33.3     0/0   0.0
Miles Gobert           11    2    5    0   0   1/3    33.3     0/0   0.0
Anfernee Harris        11    2    0    0   0   1/2    50.0     0/0   0.0
Bones Ginobili         11    0    3    2   0   0/2     0.0     0/0   0.0
Anfernee Green          1    0    1    0   0   0/1     0.0     0/0   0.0

TEAM: FG: 9/20 (45.0%), 3PT: 0/4 (0.0%), REB: 14 (4 off, 10 def), AST: 2, TO: 3
TEAM FOULS: 7 [Team_011 in BONUS]


Team_011
--------------------------------------------------------------------------------
Player                MIN  PTS  REB  AST  TO      FG   FG%      3P   3P%
--------------------------------------------------------------------------------
Trae Tatum             11   11    0    0   0   4/4   100.0     0/0   0.0
Pau Barnes             11    7    5    1   0   3/6    50.0     0/0   0.0
Evan George            11    4    4    0   0   2/5    40.0     0/0   0.0
Michael Carter         11    0    3    1   0   0/1     0.0     0/0   0.0
Magic Tatum            11    0    0    2   0   0/4     0.0     0/0   0.0
Pau Towns               1    0    1    0   0   0/0     0.0     0/0   0.0
Shai Leonard            1    0    0    0   0   0/1     0.0     0/0   0.0
Russell Davis           1    0    1    0   0   0/0     0.0     0/0   0.0

TEAM: FG: 9/21 (42.9%), 3PT: 1/2 (50.0%), REB: 15 (4 off, 11 def), AST: 4, TO: 2
TEAM FOULS: 6 [Team_086 in BONUS]

================================================================================

================================================================================
                       2ND QUARTER - Team_086 vs Team_011                       
================================================================================

[12:00] Team_086 possession (Score: 20-24)
Miles Gobert attempts a Layup. Contested by Pau Barnes (3.4 feet, ZONE). Miles Gobert misses. Offensive rebound by Rudy Rose! Rudy Rose puts it back in!
Score: 22-24

[11:46] Team_011 possession (Score: 22-24)
Trae Tatum attempts a 3Pt. Contested by Anfernee Harris (4.4 feet, MAN). Trae Tatum misses. Rebound secured by Miles Gobert.

[11:27] Team_086 possession (Score: 22-24)
Bones Ginobili attempts a Midrange. Contested by Pau Barnes (3.7 feet, MAN). Bones Ginobili misses. Offensive rebound by Miles Gobert! Miles Gobert kicks it out.

[11:14] Team_086 possession (Score: 22-24)
Rudy Rose attempts a Layup. Contested by Pau Barnes (3.6 feet, MAN). Rudy Rose misses. Rebound secured by Evan George.

[11:04] Team_011 possession (Score: 22-24)
Trae Tatum attempts a 3Pt. Contested by Lauri Johnson (4.5 feet, ZONE). Trae Tatum misses. Rebound secured by Rudy Rose.

[10:51] Team_086 possession (Score: 22-24)
FOUL! Holding foul on Trae Tatum. [Team fouls: 1] No free throws, side out. (Trae Tatum: 1 personal fouls)

[10:32] Team_086 possession (Score: 22-24)
FOUL! Shooting foul on Magic Tatum. Bones Ginobili to the line for 3 free throws. [Team fouls: 2] (Magic Tatum: 1 personal fouls)   FT 1/3: GOOD   FT 2/3: GOOD   FT 3/3: GOOD Bones Ginobili makes 3/3 from the line.
Score: 25-24

[10:23] Team_011 possession (Score: 25-24)
Pau Barnes attempts a 3Pt. Contested by Bones Ginobili (5.7 feet, MAN). Pau Barnes misses. Offensive rebound by Evan George! Evan George's putback is no good. Rebound secured by Miles Gobert.

[10:05] Team_086 possession (Score: 25-24)
Bones Ginobili makes the Layup and draws the foul on Magic Tatum! And-1! Bones Ginobili to the line for 1. [Team fouls: 3] (Magic Tatum: 2 personal fouls)   FT 1/1: GOOD Bones Ginobili makes 1/1 from the line.
Score: 28-24

[09:47] Team_011 possession (Score: 28-24)
Pau Barnes drives, Bones Ginobili stays with him. Pau Barnes attempts a Layup. Contested by Bones Ginobili (5.7 feet, MAN). PAU BARNES MAKES IT! Assist: Trae Tatum
Score: 28-26

[09:31] Team_086 possession (Score: 28-26)
Bones Ginobili attempts a Layup. Contested by Pau Barnes (3.9 feet, MAN). Bones Ginobili misses. Rebound secured by Evan George.

[09:17] Team_011 possession (Score: 28-26)
Pau Barnes throws a bad pass out of bounds! TURNOVER! (dead ball)

[09:17] Substitution (Team_086): Lauri Johnson OUT → Anfernee Green IN (stamina_rule2)

[09:17] Substitution (Team_086): Anfernee Harris OUT → Anthony James IN (stamina_rule2)

[09:17] Substitution (Team_086): Miles Gobert OUT → Franz McGrady IN (stamina_rule2)

[09:17] Substitution (Team_086): Bones Ginobili OUT → Kyle McCollum IN (stamina_rule2)

[09:17] Substitution (Team_086): Rudy Rose OUT → Lamelo Towns IN (stamina_rule2)

[09:17] Substitution (Team_011): Magic Tatum OUT → Shai Leonard IN (stamina_rule2)

[09:17] Substitution (Team_011): Trae Tatum OUT → De'Aaron George IN (stamina_rule2)

[09:17] Substitution (Team_011): Michael Carter OUT → Tyrese Nowitzki IN (stamina_rule2)

[09:17] Substitution (Team_011): Pau Barnes OUT → Russell Davis IN (stamina_rule2)

[09:17] Substitution (Team_011): Evan George OUT → Pau Towns IN (stamina_rule2)

[09:03] Team_086 possession (Score: 28-26)
Kyle McCollum attempts a Layup. Contested by Russell Davis (3.8 feet, MAN). KYLE MCCOLLUM MAKES IT! Assist: Franz McGrady
Score: 30-26

[08:50] Team_011 possession (Score: 30-26)
Shai Leonard attempts a 3Pt. Contested by Anfernee Green (4.2 feet, ZONE). Shai Leonard misses. FOUL! Loose ball foul on Kyle McCollum during the rebound battle. [Team fouls: 1] No free throws, side out. (Kyle McCollum: 1 personal fouls)

[08:41] Team_011 possession (Score: 30-26)
Tyrese Nowitzki attempts a Midrange. Contested by Franz McGrady (4.9 feet, MAN). TYRESE NOWITZKI MAKES IT!
Score: 30-28

[08:28] Team_086 possession (Score: 30-28)
Lamelo Towns drives to the basket... Lamelo Towns throws a bad pass out of bounds! TURNOVER! (dead ball)

[08:18] Team_011 possession (Score: 30-28)
Tyrese Nowitzki attempts a 3Pt. Contested by Franz McGrady (4.9 feet, MAN). Tyrese Nowitzki misses. Rebound secured by Lamelo Towns.

[08:06] Team_086 possession (Score: 30-28)
Franz McGrady drives, Russell Davis stays with him. Franz McGrady attempts a Layup. Contested by Russell Davis (3.9 feet, ZONE). Franz McGrady misses. Rebound secured by Tyrese Nowitzki.

[07:51] Team_011 possession (Score: 30-28)
Shai Leonard throws a bad pass out of bounds! TURNOVER! (dead ball)

[07:37] Team_086 possession (Score: 30-28)
Anthony James attempts a Layup. Contested by De'Aaron George (5.4 feet, MAN). Anthony James misses. Rebound secured by Pau Towns.

[07:25] Team_011 possession (Score: 30-28)
De'Aaron George attempts a 3Pt. Contested by Anthony James (4.4 feet, MAN). DE'AARON GEORGE MAKES IT! Assist: Pau Towns
Score: 30-31

[07:15] Team_086 possession (Score: 30-31)
Kyle McCollum makes the Dunk and draws the foul on Russell Davis! And-1! Kyle McCollum to the line for 1. [Team fouls: 4] (Russell Davis: 1 personal fouls)   FT 1/1: GOOD Kyle McCollum makes 1/1 from the line.
Score: 33-31

[07:04] Team_011 possession (Score: 33-31)
Russell Davis attempts a Layup. Contested by Kyle McCollum (4.9 feet, MAN). Russell Davis misses. FOUL! Loose ball foul on Lamelo Towns during the rebound battle. [Team fouls: 2] No free throws, side out. (Lamelo Towns: 1 personal fouls)

[06:49] Team_011 possession (Score: 33-31)
De'Aaron George attempts a Layup. Contested by Lamelo Towns (5.6 feet, ZONE). De'Aaron George misses. Rebound secured by Kyle McCollum.

[06:35] Team_086 possession (Score: 33-31)
FOUL! Shooting foul on Shai Leonard. Anfernee Green to the line for 2 free throws. [BONUS: 5 team fouls] (Shai Leonard: 1 personal fouls)   FT 1/2: GOOD   FT 2/2: MISS Anfernee Green makes 1/2 from the line. FOUL! Loose ball foul on Russell Davis during the free throw rebound! [IN THE BONUS! 6 team fouls] Lamelo Towns to the line for 2 free throws. (Russell Davis: 2 personal fouls)   FT 1/2: GOOD   FT 2/2: GOOD Lamelo Towns makes 2/2 from the line.
Score: 36-31

[06:16] Team_011 possession (Score: 36-31)
FOUL! Reach-in foul on Lamelo Towns during the drive. [Team fouls: 3] No free throws, side out. (Lamelo Towns: 2 personal fouls)

[05:59] Team_011 possession (Score: 36-31)
De'Aaron George attempts a 3Pt. Contested by Anfernee Green (4.4 feet, ZONE). De'Aaron George misses. Offensive rebound by Tyrese Nowitzki! Tyrese Nowitzki kicks it out.

[05:43] Team_011 possession (Score: 36-31)
Russell Davis makes the Layup and draws the foul on Lamelo Towns! And-1! Russell Davis to the line for 1. [Team fouls: 4] (Lamelo Towns: 3 personal fouls)   FT 1/1: GOOD Russell Davis makes 1/1 from the line.
Score: 36-34

[05:31] Team_086 possession (Score: 36-34)
FOUL! Offensive foul on Anthony James! De'Aaron George drew the charge! [Team fouls: 5] (Anthony James: 1 personal fouls) TURNOVER! (dead ball)

[05:17] Team_011 possession (Score: 36-34)
Russell Davis attempts a 3Pt. Contested by Anfernee Green (3.7 feet, ZONE). Russell Davis misses. Rebound secured by Anfernee Green.

[05:02] Team_086 possession (Score: 36-34)
Lamelo Towns attempts a Layup. Contested by Russell Davis (3.5 feet, ZONE). Lamelo Towns misses. Rebound secured by Tyrese Nowitzki.

[04:49] Team_011 possession (Score: 36-34)
De'Aaron George attempts a 3Pt. Contested by Anfernee Green (4.4 feet, ZONE). De'Aaron George misses. Rebound secured by Kyle McCollum.

[04:36] Team_086 possession (Score: 36-34)
Franz McGrady attempts a 3Pt. Contested by Shai Leonard (4.4 feet, ZONE). Franz McGrady misses. Rebound secured by Pau Towns.

[04:19] Team_011 possession (Score: 36-34)
FOUL! Holding foul on Anfernee Green. [IN THE BONUS! 6 team fouls] Shai Leonard to the line for 2 free throws. (Anfernee Green: 1 personal fouls)   FT 1/2: GOOD   FT 2/2: MISS Shai Leonard makes 1/2 from the line. Rebound secured by Anfernee Green.
Score: 36-35

[04:07] Team_086 possession (Score: 36-35)
Anfernee Green drives and kicks out. Lamelo Towns attempts a 3Pt. Contested by Shai Leonard (4.3 feet, ZONE). Lamelo Towns misses. Rebound secured by Pau Towns.

[03:52] Team_011 possession (Score: 36-35)
Pau Towns makes the Dunk and draws the foul on Anfernee Green! And-1! Pau Towns to the line for 1. [BONUS: 7 team fouls] (Anfernee Green: 2 personal fouls)   FT 1/1: GOOD Pau Towns makes 1/1 from the line.
Score: 36-38

[03:35] Team_086 possession (Score: 36-38)
Anthony James attempts a Layup. Contested by De'Aaron George (5.4 feet, MAN). Anthony James misses. Rebound secured by Pau Towns.

[03:19] Team_011 possession (Score: 36-38)
Pau Towns attempts a Midrange. Contested by Anthony James (4.0 feet, ZONE). Pau Towns misses. Offensive rebound by Tyrese Nowitzki! Tyrese Nowitzki kicks it out.

[03:07] Team_011 possession (Score: 36-38)
Tyrese Nowitzki attempts a Midrange. Contested by Franz McGrady (4.9 feet, MAN). Tyrese Nowitzki misses. Rebound secured by Anfernee Green.

[02:57] Team_086 possession (Score: 36-38)
Kyle McCollum attempts a Layup. Contested by Russell Davis (3.8 feet, MAN). KYLE MCCOLLUM MAKES IT!
Score: 38-38

[02:40] Team_011 possession (Score: 38-38)
Russell Davis drives to the basket... Russell Davis loses control! Ball rolls out of bounds! TURNOVER! (dead ball)

[02:27] Team_086 possession (Score: 38-38)
FOUL! Reach-in foul on Pau Towns during the drive. [IN THE BONUS! 7 team fouls] Franz McGrady to the line for 2 free throws. (Pau Towns: 1 personal fouls)   FT 1/2: GOOD   FT 2/2: GOOD Franz McGrady makes 2/2 from the line.
Score: 40-38

[02:10] Team_011 possession (Score: 40-38)
Russell Davis drives, Kyle McCollum stays with him. Russell Davis attempts a Dunk. Contested by Kyle McCollum (5.0 feet, MAN). Russell Davis misses. Rebound secured by Lamelo Towns.

[01:59] Team_086 possession (Score: 40-38)
Anfernee Green makes the Layup and draws the foul on Shai Leonard! And-1! Anfernee Green to the line for 1. [BONUS: 8 team fouls] (Shai Leonard: 2 personal fouls)   FT 1/1: MISS Anfernee Green makes 0/1 from the line. Rebound secured by Pau Towns.
Score: 42-38

[01:41] Team_011 possession (Score: 42-38)
Pau Towns drives, picks up Lamelo Towns. Help arrives from Anfernee Green! Pau Towns attempts a Layup. Contested by Anfernee Green (5.4 feet, MAN). PAU TOWNS MAKES IT! Assist: Shai Leonard
Score: 42-40

[01:27] Team_086 possession (Score: 42-40)
FOUL! Reach-in foul on De'Aaron George during the drive. [IN THE BONUS! 9 team fouls] Anthony James to the line for 2 free throws. (De'Aaron George: 1 personal fouls)   FT 1/2: GOOD   FT 2/2: GOOD Anthony James makes 2/2 from the line.
Score: 44-40

[01:09] Team_011 possession (Score: 44-40)
De'Aaron George attempts a 3Pt. Contested by Anfernee Green (4.6 feet, ZONE). De'Aaron George misses. Rebound secured by Lamelo Towns.

[00:53] Team_086 possession (Score: 44-40)
Lamelo Towns attempts a Layup. Contested by Russell Davis (3.7 feet, ZONE). Lamelo Towns misses. Offensive rebound by Lamelo Towns! Lamelo Towns kicks it out.

[00:37] Team_086 possession (Score: 44-40)
Kyle McCollum attempts a Layup. Contested by Russell Davis (4.0 feet, MAN). Kyle McCollum misses. Rebound secured by Tyrese Nowitzki.

[00:23] Team_011 possession (Score: 44-40)
De'Aaron George attempts a 3Pt. Contested by Anthony James (4.6 feet, MAN). De'Aaron George misses. Rebound secured by Kyle McCollum.

[00:12] Team_086 possession (Score: 44-40)
Kyle McCollum attempts a Layup. Contested by Russell Davis (4.0 feet, MAN). KYLE MCCOLLUM MAKES IT!
Score: 46-40

================================================================================
                              2ND QUARTER COMPLETE                              
================================================================================

2ND QUARTER SCORE: Team_086 26, Team_011 16

BOX SCORE:
================================================================================

Team_086
--------------------------------------------------------------------------------
Player                MIN  PTS  REB  AST  TO      FG   FG%      3P   3P%
--------------------------------------------------------------------------------
Kyle McCollum          10    9    3    0   0   4/5    80.0     0/0   0.0
Bones Ginobili         14    6    0    0   0   2/3    66.7     0/0   0.0
Lamelo Towns           10    3    4    0   0   1/2    50.0     0/0   0.0
Rudy Rose              14    2    2    0   0   1/2    50.0     0/0   0.0
Franz McGrady          10    2    0    1   0   1/3    33.3     0/0   0.0
Anthony James          10    2    0    0   0   1/3    33.3     0/0   0.0
Anfernee Green         10    0    3    0   0   0/2     0.0     0/0   0.0

TEAM: FG: 10/20 (50.0%), 3PT: 1/2 (50.0%), REB: 14 (3 off, 11 def), AST: 1, TO: 2
TEAM FOULS: 7 [Team_011 in BONUS]


Team_011
--------------------------------------------------------------------------------
Player                MIN  PTS  REB  AST  TO      FG   FG%      3P   3P%
--------------------------------------------------------------------------------
Pau Towns              10    5    6    1   0   2/2   100.0     0/0   0.0
De'Aaron George        10    3    0    0   0   1/5    20.0     0/0   0.0
Russell Davis          10    3    0    0   0   1/3    33.3     0/0   0.0
Pau Barnes             14    2    0    0   0   1/2    50.0     0/0   0.0
Tyrese Nowitzki        10    2    6    0   0   1/3    33.3     0/0   0.0
Trae Tatum             14    0    0    1   0   0/2     0.0     0/0   0.0
Miles Gobert           14    0    3    0   0   0/0     0.0     0/0   0.0
Evan George            14    0    2    0   0   0/0     0.0     0/0   0.0
Shai Leonard           10    0    0    1   0   0/0     0.0     0/0   0.0

TEAM: FG: 6/18 (33.3%), 3PT: 1/9 (11.1%), REB: 15 (5 off, 10 def), AST: 3, TO: 3
TEAM FOULS: 9 [Team_086 in BONUS]

================================================================================

================================================================================
                       3RD QUARTER - Team_086 vs Team_011                       
================================================================================

[12:00] Team_086 possession (Score: 46-40)
Rudy Rose drives, picks up Pau Barnes. Help arrives from Magic Tatum! Rudy Rose attempts a Layup. Contested by Magic Tatum (3.2 feet, MAN). RUDY ROSE MAKES IT!
Score: 48-40

[11:46] Team_011 possession (Score: 48-40)
Michael Carter attempts a Midrange. Contested by Rudy Rose (3.6 feet, ZONE). MICHAEL CARTER MAKES IT! Assist: Trae Tatum
Score: 48-42

[11:36] Team_086 possession (Score: 48-42)
Bones Ginobili attempts a 3Pt. Contested by Pau Barnes (3.4 feet, MAN). Bones Ginobili misses. Rebound secured by Michael Carter.

[11:23] Team_011 possession (Score: 48-42)
Michael Carter drives and kicks out. Magic Tatum attempts a Midrange. Contested by Lauri Johnson (4.4 feet, MAN). MAGIC TATUM MAKES IT!
Score: 48-44

[11:07] Team_086 possession (Score: 48-44)
Rudy Rose attempts a Midrange. Contested by Pau Barnes (3.2 feet, MAN). RUDY ROSE MAKES IT!
Score: 50-44

[10:50] Team_011 possession (Score: 50-44)
Evan George attempts a Midrange. Contested by Miles Gobert (3.8 feet, ZONE). Evan George misses. Rebound secured by Miles Gobert.

[10:37] Team_086 possession (Score: 50-44)
Bones Ginobili makes the Layup and draws the foul on Magic Tatum! And-1! Bones Ginobili to the line for 1. [Team fouls: 1] (Magic Tatum: 1 personal fouls)   FT 1/1: GOOD Bones Ginobili makes 1/1 from the line.
Score: 53-44

[10:26] Team_011 possession (Score: 53-44)
Evan George throws a bad pass! Stolen by Rudy Rose! TURNOVER! (live ball)

[10:16] Team_086 possession (Score: 53-44)
Lauri Johnson drives to the basket... Lauri Johnson commits a violation (traveling/carry)! TURNOVER! (dead ball)

[09:58] Team_011 possession (Score: 53-44)
Pau Barnes drives and kicks out. Evan George attempts a 3Pt. Contested by Rudy Rose (3.7 feet, MAN). Evan George misses. Rebound secured by Rudy Rose.

[09:45] Team_086 possession (Score: 53-44)
Rudy Rose attempts a Midrange. Contested by Trae Tatum (4.9 feet, ZONE). RUDY ROSE MAKES IT! Assist: Miles Gobert
Score: 55-44

[09:27] Team_011 possession (Score: 55-44)
Magic Tatum drives and kicks out. FOUL! Shooting foul on Anfernee Harris. Trae Tatum to the line for 3 free throws. [Team fouls: 1] (Anfernee Harris: 1 personal fouls)   FT 1/3: MISS   FT 2/3: GOOD   FT 3/3: GOOD Trae Tatum makes 2/3 from the line.
Score: 55-46

[09:10] Team_086 possession (Score: 55-46)
Rudy Rose makes the Layup and draws the foul on Pau Barnes! And-1! Rudy Rose to the line for 1. [Team fouls: 2] (Pau Barnes: 1 personal fouls)   FT 1/1: GOOD Rudy Rose makes 1/1 from the line.
Score: 58-46

[08:59] Team_011 possession (Score: 58-46)
Evan George attempts a Layup. BLOCKED BY ANFERNEE HARRIS! Ball is loose! Offensive rebound by Pau Barnes! Pau Barnes kicks it out.

[08:42] Team_011 possession (Score: 58-46)
Michael Carter makes the Layup and draws the foul on Miles Gobert! And-1! Michael Carter to the line for 1. [Team fouls: 2] (Miles Gobert: 1 personal fouls)   FT 1/1: GOOD Michael Carter makes 1/1 from the line.
Score: 58-49

[08:25] Team_086 possession (Score: 58-49)
Miles Gobert attempts a 3Pt. Contested by Michael Carter (4.4 feet, MAN). MILES GOBERT MAKES IT! Assist: Anfernee Harris
Score: 61-49

[08:08] Team_011 possession (Score: 61-49)
Magic Tatum attempts a Midrange. Contested by Lauri Johnson (4.6 feet, MAN). Magic Tatum misses. Rebound secured by Rudy Rose.

[07:57] Team_086 possession (Score: 61-49)
Miles Gobert attempts a Midrange. Contested by Michael Carter (4.4 feet, MAN). Miles Gobert misses. Rebound secured by Michael Carter.

[07:39] Team_011 possession (Score: 61-49)
Evan George drives and kicks out. Trae Tatum attempts a 3Pt. Contested by Lauri Johnson (4.4 feet, ZONE). Trae Tatum misses. Rebound secured by Miles Gobert.

[07:21] Team_086 possession (Score: 61-49)
Miles Gobert commits a violation (traveling/carry)! TURNOVER! (dead ball)

[07:10] Team_011 possession (Score: 61-49)
Magic Tatum attempts a Layup. Contested by Lauri Johnson (4.6 feet, MAN). MAGIC TATUM MAKES IT!
Score: 61-51

[06:57] Team_086 possession (Score: 61-51)
Anfernee Harris attempts a 3Pt. Contested by Magic Tatum (4.0 feet, ZONE). Anfernee Harris misses. Rebound secured by Evan George.

[06:44] Team_011 possession (Score: 61-51)
Trae Tatum makes the Layup and draws the foul on Anfernee Harris! And-1! Trae Tatum to the line for 1. [Team fouls: 3] (Anfernee Harris: 2 personal fouls)   FT 1/1: GOOD Trae Tatum makes 1/1 from the line.
Score: 61-54

[06:30] Team_086 possession (Score: 61-54)
Bones Ginobili attempts a Layup. Contested by Pau Barnes (3.4 feet, MAN). Bones Ginobili misses. Rebound secured by Evan George.

[06:17] Team_011 possession (Score: 61-54)
Trae Tatum drives and kicks out. Magic Tatum attempts a 3Pt. Contested by Lauri Johnson (4.4 feet, ZONE). Magic Tatum misses. Offensive rebound by Evan George! Evan George puts it back in!
Score: 61-56

[06:03] Team_086 possession (Score: 61-56)
Lauri Johnson drives to the basket... FOUL! Offensive foul on Lauri Johnson! Magic Tatum drew the charge! [Team fouls: 4] (Lauri Johnson: 1 personal fouls) TURNOVER! (dead ball)

[05:49] Team_011 possession (Score: 61-56)
FOUL! Shooting foul on Lauri Johnson. Pau Barnes to the line for 3 free throws. [BONUS: 5 team fouls] (Lauri Johnson: 2 personal fouls)   FT 1/3: GOOD   FT 2/3: MISS   FT 3/3: GOOD Pau Barnes makes 2/3 from the line.
Score: 61-58

[05:34] Team_086 possession (Score: 61-58)
Lauri Johnson drives and kicks out. Bones Ginobili attempts a 3Pt. Contested by Magic Tatum (3.4 feet, ZONE). Bones Ginobili misses. FOUL! Loose ball foul on Evan George during the rebound battle. [Team fouls: 3] No free throws, side out. (Evan George: 1 personal fouls)

[05:22] Team_086 possession (Score: 61-58)
Lauri Johnson attempts a 3Pt. Contested by Magic Tatum (3.7 feet, MAN). LAURI JOHNSON MAKES IT!
Score: 64-58

[05:06] Team_011 possession (Score: 64-58)
Michael Carter drives to the basket... Michael Carter commits a violation (traveling/carry)! TURNOVER! (dead ball)

[04:53] Team_086 possession (Score: 64-58)
Lauri Johnson attempts a 3Pt. Contested by Magic Tatum (3.7 feet, ZONE). Lauri Johnson misses. Rebound secured by Evan George.

[04:36] Team_011 possession (Score: 64-58)
Pau Barnes attempts a Midrange. Contested by Bones Ginobili (5.5 feet, MAN). Pau Barnes misses. Rebound secured by Bones Ginobili.

[04:19] Team_086 possession (Score: 64-58)
Rudy Rose attempts a Midrange. Contested by Magic Tatum (3.8 feet, ZONE). RUDY ROSE MAKES IT!
Score: 66-58

[04:01] Team_011 possession (Score: 66-58)
FOUL! Reach-in foul on Rudy Rose during the drive. [IN THE BONUS! 6 team fouls] Trae Tatum to the line for 2 free throws. (Rudy Rose: 1 personal fouls)   FT 1/2: GOOD   FT 2/2: GOOD Trae Tatum makes 2/2 from the line.
Score: 66-60

[03:47] Team_086 possession (Score: 66-60)
Anfernee Harris drives, picks up Trae Tatum. Help arrives from Magic Tatum! Anfernee Harris attempts a Layup. Contested by Magic Tatum (5.3 feet, MAN). ANFERNEE HARRIS MAKES IT! Assist: Miles Gobert
Score: 68-60

[03:35] Team_011 possession (Score: 68-60)
Magic Tatum makes the Dunk and draws the foul on Lauri Johnson! And-1! Magic Tatum to the line for 1. [BONUS: 7 team fouls] (Lauri Johnson: 3 personal fouls)   FT 1/1: MISS Magic Tatum makes 0/1 from the line. Rebound secured by Bones Ginobili.
Score: 68-62

[03:21] Team_086 possession (Score: 68-62)
Lauri Johnson attempts a 3Pt. Contested by Magic Tatum (3.8 feet, ZONE). Lauri Johnson misses. FOUL! Loose ball foul on Michael Carter during the rebound battle. [Team fouls: 4] No free throws, side out. (Michael Carter: 1 personal fouls)

[03:05] Team_086 possession (Score: 68-62)
Miles Gobert attempts a 3Pt. Contested by Magic Tatum (3.8 feet, ZONE). Miles Gobert misses. Rebound secured by Pau Barnes.

[02:53] Team_011 possession (Score: 68-62)
Michael Carter attempts a 3Pt. Contested by Miles Gobert (3.6 feet, MAN). Michael Carter misses. Rebound secured by Miles Gobert.

[02:35] Team_086 possession (Score: 68-62)
Miles Gobert drives, picks up Pau Barnes. Help arrives from Magic Tatum! Miles Gobert attempts a Layup. Contested by Magic Tatum (3.5 feet, ZONE). MILES GOBERT MAKES IT! Assist: Lauri Johnson
Score: 70-62

[02:18] Team_011 possession (Score: 70-62)
Pau Barnes attempts a 3Pt. Contested by Bones Ginobili (5.6 feet, MAN). PAU BARNES MAKES IT! Assist: Michael Carter
Score: 70-65

[02:07] Team_086 possession (Score: 70-65)
Bones Ginobili attempts a Layup. Contested by Pau Barnes (3.8 feet, MAN). BONES GINOBILI MAKES IT! Assist: Miles Gobert
Score: 72-65

[01:51] Team_011 possession (Score: 72-65)
Michael Carter attempts a 3Pt. Contested by Miles Gobert (3.6 feet, MAN). Michael Carter misses. Offensive rebound by Pau Barnes! Pau Barnes puts it back in!
Score: 72-67

[01:34] Team_086 possession (Score: 72-67)
Anfernee Harris attempts a Layup. Contested by Trae Tatum (5.5 feet, MAN). ANFERNEE HARRIS MAKES IT! Assist: Bones Ginobili
Score: 74-67

[01:18] Team_011 possession (Score: 74-67)
Evan George attempts a Midrange. Contested by Anfernee Harris (4.9 feet, ZONE). EVAN GEORGE MAKES IT!
Score: 74-69

[01:04] Team_086 possession (Score: 74-69)
FOUL! Reach-in foul on Pau Barnes during the drive. [IN THE BONUS! 5 team fouls] Bones Ginobili to the line for 2 free throws. (Pau Barnes: 2 personal fouls)   FT 1/2: GOOD   FT 2/2: GOOD Bones Ginobili makes 2/2 from the line.
Score: 76-69

[00:51] Team_011 possession (Score: 76-69)
FOUL! Shooting foul on Lauri Johnson. Michael Carter to the line for 3 free throws. [BONUS: 8 team fouls] (Lauri Johnson: 4 personal fouls)   FT 1/3: MISS   FT 2/3: GOOD   FT 3/3: MISS Michael Carter makes 1/3 from the line. Rebound secured by Rudy Rose.
Score: 76-70

[00:35] Team_086 possession (Score: 76-70)
Miles Gobert attempts a 3Pt. Contested by Magic Tatum (4.1 feet, ZONE). MILES GOBERT MAKES IT! Assist: Anfernee Harris
Score: 79-70

[00:24] Team_011 possession (Score: 79-70)
Magic Tatum attempts a 3Pt. Contested by Lauri Johnson (5.0 feet, MAN). MAGIC TATUM MAKES IT!
Score: 79-73

[00:10] Team_086 possession (Score: 79-73)
FOUL! Shooting foul on Pau Barnes. Bones Ginobili to the line for 2 free throws. [BONUS: 6 team fouls] (Pau Barnes: 3 personal fouls)   FT 1/2: GOOD   FT 2/2: GOOD Bones Ginobili makes 2/2 from the line.
Score: 81-73

================================================================================
                              3RD QUARTER COMPLETE                              
================================================================================

3RD QUARTER SCORE: Team_086 35, Team_011 33

BOX SCORE:
================================================================================

Team_086
--------------------------------------------------------------------------------
Player                MIN  PTS  REB  AST  TO      FG   FG%      3P   3P%
--------------------------------------------------------------------------------
Rudy Rose              26   11    4    0   0   5/5   100.0     0/0   0.0
Bones Ginobili         26    9    2    1   0   4/6    66.7     0/0   0.0
Miles Gobert           26    8    4    3   0   3/5    60.0     0/0   0.0
Anfernee Harris        26    4    0    2   0   2/3    66.7     0/0   0.0
Lauri Johnson          26    3    0    1   0   1/2    50.0     0/0   0.0

TEAM: FG: 15/21 (71.4%), 3PT: 3/7 (42.9%), REB: 10 (2 off, 8 def), AST: 7, TO: 3
TEAM FOULS: 8 [Team_011 in BONUS]


Team_011
--------------------------------------------------------------------------------
Player                MIN  PTS  REB  AST  TO      FG   FG%      3P   3P%
--------------------------------------------------------------------------------
Trae Tatum             26    7    0    1   0   3/3   100.0     0/0   0.0
Magic Tatum            26    7    0    0   0   3/5    60.0     0/0   0.0
Pau Barnes             26    7    3    0   0   3/5    60.0     0/0   0.0
Michael Carter         26    5    2    1   0   2/4    50.0     0/0   0.0
Evan George            26    4    4    0   0   2/4    50.0     0/0   0.0

TEAM: FG: 13/21 (61.9%), 3PT: 4/6 (66.7%), REB: 9 (3 off, 6 def), AST: 2, TO: 2
TEAM FOULS: 6 [Team_086 in BONUS]

================================================================================

================================================================================
                       4TH QUARTER - Team_086 vs Team_011                       
================================================================================

[12:00] Team_086 possession (Score: 81-73)
Miles Gobert attempts a 3Pt. Contested by Michael Carter (4.7 feet, MAN). Miles Gobert misses. Rebound secured by Michael Carter.

[11:43] Team_011 possession (Score: 81-73)
FOUL! Shooting foul on Bones Ginobili. Evan George to the line for 2 free throws. [Team fouls: 1] (Bones Ginobili: 1 personal fouls)   FT 1/2: GOOD   FT 2/2: GOOD Evan George makes 2/2 from the line.
Score: 81-75

[11:30] Team_086 possession (Score: 81-75)
Bones Ginobili drives, Pau Barnes stays with him. Bones Ginobili attempts a Dunk. Contested by Pau Barnes (3.8 feet, MAN). Bones Ginobili misses. Offensive rebound by Miles Gobert! Miles Gobert kicks it out.

[11:17] Team_086 possession (Score: 81-75)
FOUL! Shooting foul on Pau Barnes. Rudy Rose to the line for 2 free throws. [Team fouls: 1] (Pau Barnes: 1 personal fouls)   FT 1/2: GOOD   FT 2/2: GOOD Rudy Rose makes 2/2 from the line.
Score: 83-75

[11:00] Team_011 possession (Score: 83-75)
Trae Tatum drives and kicks out. Evan George attempts a Midrange. Contested by Anfernee Harris (4.7 feet, ZONE). Evan George misses. Rebound secured by Miles Gobert.

[10:46] Team_086 possession (Score: 83-75)
Miles Gobert attempts a 3Pt. Contested by Michael Carter (4.8 feet, MAN). MILES GOBERT MAKES IT! Assist: Anfernee Harris
Score: 86-75

[10:33] Team_011 possession (Score: 86-75)
Michael Carter attempts a Midrange. Contested by Miles Gobert (3.8 feet, MAN). MICHAEL CARTER MAKES IT! Assist: Magic Tatum
Score: 86-77

[10:20] Team_086 possession (Score: 86-77)
Rudy Rose drives and kicks out. Rudy Rose attempts a Midrange. Contested by Pau Barnes (3.7 feet, ZONE). RUDY ROSE MAKES IT!
Score: 88-77

[10:09] Team_011 possession (Score: 88-77)
Pau Barnes drives, picks up Bones Ginobili. Help arrives from Anfernee Harris! Pau Barnes attempts a Layup. Contested by Anfernee Harris (5.8 feet, MAN). Pau Barnes misses. Rebound secured by Rudy Rose.

[09:59] Team_086 possession (Score: 88-77)
Anfernee Harris attempts a Layup. BLOCKED BY TRAE TATUM! Ball is loose! Offensive rebound by Rudy Rose! Rudy Rose kicks it out.

[09:44] Team_086 possession (Score: 88-77)
Lauri Johnson makes the Midrange and draws the foul on Michael Carter! And-1! Lauri Johnson to the line for 1. [Team fouls: 2] (Michael Carter: 1 personal fouls)   FT 1/1: MISS Lauri Johnson makes 0/1 from the line. Offensive rebound by Rudy Rose! Rudy Rose puts it back in!
Score: 92-77

[09:32] Team_011 possession (Score: 92-77)
Magic Tatum attempts a 3Pt. Contested by Bones Ginobili (5.5 feet, ZONE). Magic Tatum misses. Rebound secured by Miles Gobert.

[09:17] Team_086 possession (Score: 92-77)
Bones Ginobili drives, Pau Barnes stays with him. Bones Ginobili attempts a Layup. Contested by Pau Barnes (4.2 feet, ZONE). BONES GINOBILI MAKES IT! Assist: Miles Gobert
Score: 94-77

[09:03] Team_011 possession (Score: 94-77)
Michael Carter attempts a Layup. Contested by Bones Ginobili (5.3 feet, ZONE). MICHAEL CARTER MAKES IT!
Score: 94-79

[08:50] Team_086 possession (Score: 94-79)
Lauri Johnson loses the ball! Stripped by Magic Tatum! TURNOVER! (live ball)

[08:31] Team_011 possession (Score: 94-79)
Evan George attempts a 3Pt. Contested by Lauri Johnson (5.2 feet, ZONE). EVAN GEORGE MAKES IT! Assist: Pau Barnes
Score: 94-82

[08:17] Team_086 possession (Score: 94-82)
FOUL! Shooting foul on Pau Barnes. Rudy Rose to the line for 2 free throws. [Team fouls: 3] (Pau Barnes: 2 personal fouls)   FT 1/2: GOOD   FT 2/2: GOOD Rudy Rose makes 2/2 from the line.
Score: 96-82

[08:07] Team_011 possession (Score: 96-82)
Trae Tatum attempts a 3Pt. Contested by Lauri Johnson (5.0 feet, ZONE). TRAE TATUM MAKES IT! Assist: Pau Barnes
Score: 96-85

[07:50] Team_086 possession (Score: 96-85)
Rudy Rose drives and kicks out. Lauri Johnson attempts a Midrange. Contested by Pau Barnes (4.2 feet, ZONE). LAURI JOHNSON MAKES IT!
Score: 98-85

[07:37] Team_011 possession (Score: 98-85)
Trae Tatum drives to the basket... Trae Tatum throws a bad pass out of bounds! TURNOVER! (dead ball)

[07:37] Substitution (Team_086): Lauri Johnson OUT → Anfernee Green IN (stamina_rule2)

[07:37] Substitution (Team_086): Anfernee Harris OUT → Anthony James IN (stamina_rule2)

[07:37] Substitution (Team_086): Miles Gobert OUT → Franz McGrady IN (stamina_rule2)

[07:37] Substitution (Team_086): Bones Ginobili OUT → Kyle McCollum IN (stamina_rule2)

[07:37] Substitution (Team_086): Rudy Rose OUT → Lamelo Towns IN (stamina_rule2)

[07:37] Substitution (Team_011): Magic Tatum OUT → Shai Leonard IN (stamina_rule2)

[07:37] Substitution (Team_011): Trae Tatum OUT → De'Aaron George IN (stamina_rule2)

[07:37] Substitution (Team_011): Michael Carter OUT → Tyrese Nowitzki IN (stamina_rule2)

[07:37] Substitution (Team_011): Pau Barnes OUT → Russell Davis IN (stamina_rule2)

[07:37] Substitution (Team_011): Evan George OUT → Pau Towns IN (stamina_rule2)

[07:22] Team_086 possession (Score: 98-85)
FOUL! Shooting foul on De'Aaron George. Anthony James to the line for 2 free throws. [Team fouls: 4] (De'Aaron George: 1 personal fouls)   FT 1/2: GOOD   FT 2/2: GOOD Anthony James makes 2/2 from the line.
Score: 100-85

[07:02] Team_011 possession (Score: 100-85)
De'Aaron George attempts a 3Pt. Contested by Anfernee Green (4.4 feet, ZONE). DE'AARON GEORGE MAKES IT! Assist: Russell Davis
Score: 100-88

[06:51] Team_086 possession (Score: 100-88)
FOUL! Holding foul on Pau Towns. [IN THE BONUS! 5 team fouls] Lamelo Towns to the line for 2 free throws. (Pau Towns: 1 personal fouls)   FT 1/2: GOOD   FT 2/2: GOOD Lamelo Towns makes 2/2 from the line.
Score: 102-88

[06:37] Team_011 possession (Score: 102-88)
Russell Davis attempts a Layup. Contested by Kyle McCollum (4.9 feet, MAN). RUSSELL DAVIS MAKES IT! Assist: De'Aaron George
Score: 102-90

[06:24] Team_086 possession (Score: 102-90)
FOUL! Reach-in foul on Russell Davis during the drive. [IN THE BONUS! 6 team fouls] Franz McGrady to the line for 2 free throws. (Russell Davis: 1 personal fouls)   FT 1/2: GOOD   FT 2/2: GOOD Franz McGrady makes 2/2 from the line.
Score: 104-90

[06:09] Team_011 possession (Score: 104-90)
Russell Davis drives, picks up Kyle McCollum. Help arrives from Anfernee Green! Russell Davis attempts a Dunk. Contested by Anfernee Green (4.9 feet, MAN). RUSSELL DAVIS MAKES IT! Assist: Shai Leonard
Score: 104-92

[05:56] Team_086 possession (Score: 104-92)
Anthony James attempts a Layup. Contested by Russell Davis (4.4 feet, ZONE). Anthony James misses. Rebound secured by Pau Towns.

[05:38] Team_011 possession (Score: 104-92)
De'Aaron George attempts a Layup. Contested by Lamelo Towns (5.6 feet, ZONE). DE'AARON GEORGE MAKES IT! Assist: Shai Leonard
Score: 104-94

[05:27] Team_086 possession (Score: 104-94)
Anthony James attempts a Layup. Contested by Russell Davis (4.4 feet, ZONE). ANTHONY JAMES MAKES IT! Assist: Lamelo Towns
Score: 106-94

[05:11] Team_011 possession (Score: 106-94)
Pau Towns attempts a 3Pt. Contested by Franz McGrady (4.9 feet, ZONE). Pau Towns misses. Rebound secured by Lamelo Towns.

[04:57] Team_086 possession (Score: 106-94)
Anthony James attempts a 3Pt. Contested by Shai Leonard (5.0 feet, ZONE). Anthony James misses. Rebound secured by Pau Towns.

[04:42] Team_011 possession (Score: 106-94)
FOUL! Holding foul on Franz McGrady. [Team fouls: 2] No free throws, side out. (Franz McGrady: 1 personal fouls)

[04:28] Team_011 possession (Score: 106-94)
Tyrese Nowitzki attempts a 3Pt. Contested by Franz McGrady (4.9 feet, MAN). TYRESE NOWITZKI MAKES IT! Assist: Shai Leonard
Score: 106-97

[04:18] Team_086 possession (Score: 106-97)
Kyle McCollum attempts a Midrange. Contested by Tyrese Nowitzki (4.7 feet, ZONE). Kyle McCollum misses. Rebound secured by Pau Towns.

[04:03] Team_011 possession (Score: 106-97)
Tyrese Nowitzki attempts a 3Pt. Contested by Franz McGrady (4.9 feet, MAN). Tyrese Nowitzki misses. Rebound secured by Lamelo Towns.

[03:46] Team_086 possession (Score: 106-97)
Anthony James drives and kicks out. Franz McGrady attempts a Midrange. Contested by Tyrese Nowitzki (4.7 feet, ZONE). FRANZ MCGRADY MAKES IT! Assist: Lamelo Towns
Score: 108-97

[03:31] Team_011 possession (Score: 108-97)
FOUL! Holding foul on Kyle McCollum. [Team fouls: 3] No free throws, side out. (Kyle McCollum: 1 personal fouls)

[03:14] Team_011 possession (Score: 108-97)
Pau Towns attempts a Midrange. Contested by Lamelo Towns (5.3 feet, MAN). Pau Towns misses. Rebound secured by Anfernee Green.

[03:03] Team_086 possession (Score: 108-97)
Kyle McCollum attempts a 3Pt. Contested by Shai Leonard (4.3 feet, ZONE). Kyle McCollum misses. Rebound secured by Russell Davis.

[02:49] Team_011 possession (Score: 108-97)
Russell Davis drives, picks up Kyle McCollum. Help arrives from Anfernee Green! Russell Davis attempts a Dunk. Contested by Anfernee Green (4.9 feet, MAN). RUSSELL DAVIS MAKES IT! Assist: De'Aaron George
Score: 108-99

[02:36] Team_086 possession (Score: 108-99)
Kyle McCollum drives, Russell Davis stays with him. Kyle McCollum attempts a Dunk. Contested by Russell Davis (3.8 feet, ZONE). KYLE MCCOLLUM MAKES IT! Assist: Anthony James
Score: 110-99

[02:20] Team_011 possession (Score: 110-99)
Russell Davis drives and kicks out. Russell Davis attempts a 3Pt. Contested by Kyle McCollum (5.2 feet, MAN). RUSSELL DAVIS MAKES IT! Assist: De'Aaron George
Score: 110-102

[02:03] Team_086 possession (Score: 110-102)
FOUL! Shooting foul on Russell Davis. Anfernee Green to the line for 2 free throws. [BONUS: 7 team fouls] (Russell Davis: 2 personal fouls)   FT 1/2: GOOD   FT 2/2: GOOD Anfernee Green makes 2/2 from the line.
Score: 112-102

[01:51] Team_011 possession (Score: 112-102)
De'Aaron George attempts a 3Pt. Contested by Anthony James (4.4 feet, MAN). DE'AARON GEORGE MAKES IT! Assist: Pau Towns
Score: 112-105

[01:35] Team_086 possession (Score: 112-105)
Anthony James drives, De'Aaron George stays with him. Anthony James attempts a Dunk. Contested by De'Aaron George (5.4 feet, MAN). Anthony James misses. Rebound secured by Russell Davis.

[01:23] Team_011 possession (Score: 112-105)
Shai Leonard attempts a 3Pt. Contested by Anfernee Green (4.2 feet, ZONE). Shai Leonard misses. Offensive rebound by Pau Towns! Pau Towns kicks it out.

[01:09] Team_011 possession (Score: 112-105)
Pau Towns attempts a Layup. Contested by Lamelo Towns (5.3 feet, ZONE). PAU TOWNS MAKES IT! Assist: Shai Leonard
Score: 112-107

[00:50] Team_086 possession (Score: 112-107)
Anthony James attempts a 3Pt. Contested by Shai Leonard (5.0 feet, ZONE). ANTHONY JAMES MAKES IT! Assist: Kyle McCollum
Score: 115-107

[00:40] Team_011 possession (Score: 115-107)
De'Aaron George attempts a 3Pt. Contested by Anfernee Green (4.4 feet, ZONE). De'Aaron George misses. Offensive rebound by Pau Towns! Pau Towns kicks it out.

[00:25] Team_011 possession (Score: 115-107)
Shai Leonard drives to the basket... Shai Leonard throws a bad pass! Stolen by Anfernee Green! TURNOVER! (live ball)

[00:10] Team_086 possession (Score: 115-107)
Franz McGrady attempts a 3Pt. Contested by Tyrese Nowitzki (4.9 feet, ZONE). Franz McGrady misses. FOUL! Loose ball foul on Pau Towns during the rebound battle. [IN THE BONUS! 8 team fouls] Anfernee Green to the line for 2 free throws. (Pau Towns: 2 personal fouls)   FT 1/2: MISS   FT 2/2: MISS Anfernee Green makes 0/2 from the line. FOUL! Loose ball foul on Tyrese Nowitzki during the free throw rebound! [IN THE BONUS! 9 team fouls] Lamelo Towns to the line for 2 free throws. (Tyrese Nowitzki: 1 personal fouls)   FT 1/2: GOOD   FT 2/2: GOOD Lamelo Towns makes 2/2 from the line.
Score: 117-107

================================================================================
                              4TH QUARTER COMPLETE                              
================================================================================

4TH QUARTER SCORE: Team_086 36, Team_011 34

BOX SCORE:
================================================================================

Team_086
--------------------------------------------------------------------------------
Player                MIN  PTS  REB  AST  TO      FG   FG%      3P   3P%
--------------------------------------------------------------------------------
Rudy Rose              31   10    2    0   0   4/4   100.0     0/0   0.0
Anthony James          17    7    0    1   0   3/6    50.0     0/0   0.0
Lamelo Towns           17    4    2    2   0   2/2   100.0     0/0   0.0
Franz McGrady          17    4    0    0   0   2/2   100.0     0/0   0.0
Miles Gobert           31    3    3    1   0   1/2    50.0     0/0   0.0
Bones Ginobili         31    2    0    0   0   1/1   100.0     0/0   0.0
Lauri Johnson          31    2    0    0   0   1/1   100.0     0/0   0.0
Kyle McCollum          17    2    0    1   0   1/3    33.3     0/0   0.0
Anfernee Green         17    2    1    0   0   1/1   100.0     0/0   0.0
Anfernee Harris        31    0    0    1   0   0/0     0.0     0/0   0.0

TEAM: FG: 16/22 (72.7%), 3PT: 3/6 (50.0%), REB: 8 (2 off, 6 def), AST: 6, TO: 1
TEAM FOULS: 3


Team_011
--------------------------------------------------------------------------------
Player                MIN  PTS  REB  AST  TO      FG   FG%      3P   3P%
--------------------------------------------------------------------------------
Russell Davis          17    9    2    1   0   4/4   100.0     0/0   0.0
De'Aaron George        17    8    0    3   0   3/3   100.0     0/0   0.0
Evan George            31    5    0    0   0   2/2   100.0     0/0   0.0
Michael Carter         31    4    1    0   0   2/2   100.0     0/0   0.0
Trae Tatum             31    3    0    0   0   1/2    50.0     0/0   0.0
Tyrese Nowitzki        17    3    0    0   0   1/2    50.0     0/0   0.0
Pau Towns              17    2    5    1   0   1/3    33.3     0/0   0.0
Magic Tatum            31    0    0    1   0   0/1     0.0     0/0   0.0
Pau Barnes             31    0    0    2   0   0/1     0.0     0/0   0.0
Shai Leonard           17    0    0    4   0   0/0     0.0     0/0   0.0

TEAM: FG: 14/20 (70.0%), 3PT: 5/8 (62.5%), REB: 8 (2 off, 6 def), AST: 12, TO: 2
TEAM FOULS: 9 [Team_086 in BONUS]

================================================================================

================================================================================
                               FULL GAME COMPLETE                               
================================================================================

FINAL SCORE: Team_086 117, Team_011 107

SCORING BY QUARTER:
--------------------------------------------------------------------------------
Team                     Q1     Q2     Q3     Q4    FINAL
--------------------------------------------------------------------------------
Team_086                 20     26     35     36      117
Team_011                 24     16     33     34      107
--------------------------------------------------------------------------------

FULL GAME BOX SCORE:
================================================================================

Team_086
--------------------------------------------------------------------------------
Player                MIN  PTS  REB  AST  TO      FG   FG%      3P   3P%      FT STL BLK
--------------------------------------------------------------------------------
Lauri Johnson          31    9    0    1   2   4/9    44.4   1/3    33.3   2/3     0   0
Anfernee Harris        31    6    0    3   4   3/5    60.0   0/2     0.0   0/0     0   1
Miles Gobert           31   13   15    4   1   6/11   54.5   3/6    50.0   0/0     0   0
Bones Ginobili         31   17    5    3   0   8/13   61.5   1/3    33.3   9/9     0   0
Rudy Rose              31   35   15    0   0  12/14   85.7   0/0     0.0   9/11    1   1
Anfernee Green         17    2    5    0   0   2/5    40.0   0/0     0.0   3/7     1   0
Anthony James          17    9    0    1   2   5/10   50.0   1/2    50.0   4/4     1   0
Franz McGrady          17    6    0    1   0   3/5    60.0   1/2    50.0   4/4     0   0
Kyle McCollum          17   11    3    1   0   5/8    62.5   0/1     0.0   1/1     0   0
Lamelo Towns           17    7    6    2   0   0/1     0.0   0/0     0.0   2/2     0   0

TEAM: FG: 50/83 (60.2%), 3PT: 7/19 (36.8%), REB: 46 (11 off, 35 def), AST: 16, TO: 9


Team_011
--------------------------------------------------------------------------------
Player                MIN  PTS  REB  AST  TO      FG   FG%      3P   3P%      FT STL BLK
--------------------------------------------------------------------------------
Magic Tatum            31    7    0    3   1   3/10   30.0   1/3    33.3   1/3     1   0
Trae Tatum             31   21    0    2   0   7/10   70.0   2/4    50.0   8/9     0   1
Michael Carter         31    9    6    2   0   6/9    66.7   1/3    33.3   2/4     0   0
Pau Barnes             31   16    8    3   2   6/13   46.2   2/3    66.7   3/4     0   0
Evan George            31   13   10    0   2   6/11   54.5   1/1   100.0   2/2     0   0
Shai Leonard           17    0    0    5   1   0/1     0.0   0/0     0.0   1/2     0   0
De'Aaron George        17   11    0    3   2   4/8    50.0   3/6    50.0   0/0     0   0
Tyrese Nowitzki        17    5    6    0   1   2/5    40.0   1/3    33.3   1/2     0   0
Russell Davis          17   12    3    1   0   5/7    71.4   0/1     0.0   1/1     0   0
Pau Towns              17    7   12    2   0   3/5    60.0   0/1     0.0   1/1     0   0

TEAM: FG: 42/80 (52.5%), 3PT: 11/25 (44.0%), REB: 47 (14 off, 33 def), AST: 21, TO: 9

================================================================================
