================================================================================
                        FULL GAME - Team_082 vs Team_037                        
================================================================================

================================================================================
                       1ST QUARTER - Team_082 vs Team_037                       
================================================================================

[12:00] Team_082 possession (Score: 0-0)
Jrue Green attempts a Midrange. Contested by Scottie Jackson (3.9 feet, MAN). JRUE GREEN MAKES IT!
Score: 2-0

[11:46] Team_037 possession (Score: 2-0)
Jarrett Tatum attempts a Layup. Contested by Kristaps Fox (4.4 feet, MAN). Jarrett Tatum misses. Rebound secured by Dwyane O'Neal.

[11:30] Team_082 possession (Score: 2-0)
Jrue Green attempts a Layup. Contested by Scottie Jackson (3.9 feet, MAN). Jrue Green misses. Rebound secured by Jarrett Tatum.

[11:16] Team_037 possession (Score: 2-0)
RJ Mitchell attempts a 3Pt. Contested by Dwyane O'Neal (3.5 feet, ZONE). RJ MITCHELL MAKES IT!
Score: 2-3

[11:05] Team_082 possession (Score: 2-3)
Kristaps Fox attempts a Layup. BLOCKED BY JARRETT TATUM! Ball deflects out of bounds off Kristaps Fox.

[10:52] Team_037 possession (Score: 2-3)
Scottie Jackson loses control! Ball rolls out of bounds! TURNOVER! (dead ball)

[10:38] Team_082 possession (Score: 2-3)
Dwyane O'Neal attempts a 3Pt. Contested by Scottie Jackson (3.6 feet, ZONE). Dwyane O'Neal misses. Rebound secured by Scottie Jackson.

[10:23] Team_037 possession (Score: 2-3)
Collin Young attempts a Midrange. Contested by Julius Carter (5.8 feet, MAN). Collin Young misses. Rebound secured by Julius Carter.

[10:07] Team_082 possession (Score: 2-3)
Dwyane O'Neal attempts a 3Pt. Contested by Scottie Jackson (3.6 feet, ZONE). Dwyane O'Neal misses. Offensive rebound by Julius Carter! Julius Carter kicks it out.

[09:56] Team_082 possession (Score: 2-3)
Julius Anthony throws a bad pass! Stolen by RJ Mitchell! TURNOVER! (live ball)

[09:41] Team_037 possession (Score: 2-3)
Scottie Jackson attempts a 3Pt. Contested by Dwyane O'Neal (3.8 feet, ZONE). Scottie Jackson misses. Rebound secured by Jrue Green.

[09:30] Team_082 possession (Score: 2-3)
Kristaps Fox drives, picks up Jarrett Tatum. Help arrives from Giannis Middleton! Kristaps Fox attempts a Dunk. Contested by Giannis Middleton (4.1 feet, MAN). KRISTAPS FOX MAKES IT! Assist: Julius Carter
Score: 4-3

[09:14] Team_037 possession (Score: 4-3)
FOUL! Shooting foul on Dwyane O'Neal. Jarrett Tatum to the line for 3 free throws. [Team fouls: 1] (Dwyane O'Neal: 1 personal fouls)   FT 1/3: GOOD   FT 2/3: MISS   FT 3/3: GOOD Jarrett Tatum makes 2/3 from the line.
Score: 4-5

[09:01] Team_082 possession (Score: 4-5)
Dwyane O'Neal makes the Layup and draws the foul on Giannis Middleton! And-1! Dwyane O'Neal to the line for 1. [Team fouls: 1] (Giannis Middleton: 1 personal fouls)   FT 1/1: GOOD Dwyane O'Neal makes 1/1 from the line.
Score: 7-5

[08:49] Team_037 possession (Score: 7-5)
Giannis Middleton drives, picks up Dwyane O'Neal. Help arrives from Kristaps Fox! Giannis Middleton attempts a Dunk. Contested by Kristaps Fox (3.7 feet, MAN). GIANNIS MIDDLETON MAKES IT!
Score: 7-7

[08:35] Team_082 possession (Score: 7-7)
Kristaps Fox attempts a 3Pt. Contested by Scottie Jackson (3.7 feet, ZONE). Kristaps Fox misses. Rebound secured by Scottie Jackson.

[08:22] Team_037 possession (Score: 7-7)
Scottie Jackson attempts a Midrange. Contested by Jrue Green (5.6 feet, ZONE). Scottie Jackson misses. FOUL! Loose ball foul on Jrue Green during the rebound battle. [Team fouls: 2] No free throws, side out. (Jrue Green: 1 personal fouls)

[08:08] Team_037 possession (Score: 7-7)
Jarrett Tatum attempts a 3Pt. Contested by Julius Anthony (4.7 feet, ZONE). Jarrett Tatum misses. Rebound secured by Dwyane O'Neal.

[07:56] Team_082 possession (Score: 7-7)
Jrue Green attempts a Layup. Contested by Scottie Jackson (3.9 feet, ZONE). JRUE GREEN MAKES IT! Assist: Kristaps Fox
Score: 9-7

[07:43] Team_037 possession (Score: 9-7)
RJ Mitchell attempts a Midrange. Contested by Dwyane O'Neal (3.5 feet, ZONE). RJ MITCHELL MAKES IT!
Score: 9-9

[07:27] Team_082 possession (Score: 9-9)
Dwyane O'Neal attempts a Layup. Contested by Scottie Jackson (3.6 feet, ZONE). Dwyane O'Neal misses. Rebound secured by Scottie Jackson.

[07:13] Team_037 possession (Score: 9-9)
Collin Young drives, picks up Jrue Green. Help arrives from Dwyane O'Neal! Collin Young attempts a Dunk. Contested by Dwyane O'Neal (5.1 feet, ZONE). COLLIN YOUNG MAKES IT!
Score: 9-11

[06:55] Team_082 possession (Score: 9-11)
Dwyane O'Neal attempts a 3Pt. Contested by Giannis Middleton (4.0 feet, MAN). Dwyane O'Neal misses. Rebound secured by Jarrett Tatum.

[06:38] Team_037 possession (Score: 9-11)
Jarrett Tatum drives, picks up Kristaps Fox. Help arrives from Dwyane O'Neal! Jarrett Tatum attempts a Dunk. Contested by Dwyane O'Neal (4.4 feet, MAN). JARRETT TATUM MAKES IT! Assist: RJ Mitchell
Score: 9-13

[06:23] Team_082 possession (Score: 9-13)
Julius Anthony attempts a Midrange. Contested by Scottie Jackson (4.0 feet, ZONE). Julius Anthony misses. Rebound secured by Collin Young.

[06:09] Team_037 possession (Score: 9-13)
Scottie Jackson attempts a 3Pt. Contested by Dwyane O'Neal (3.8 feet, ZONE). Scottie Jackson misses. Offensive rebound by Scottie Jackson! Scottie Jackson's putback is no good. Rebound secured by Dwyane O'Neal.

[05:53] Team_082 possession (Score: 9-13)
FOUL! Shooting foul on Scottie Jackson. Kristaps Fox to the line for 3 free throws. [Team fouls: 2] (Scottie Jackson: 1 personal fouls)   FT 1/3: MISS   FT 2/3: GOOD   FT 3/3: GOOD Kristaps Fox makes 2/3 from the line.
Score: 11-13

[05:40] Team_037 possession (Score: 11-13)
Scottie Jackson attempts a 3Pt. Contested by Jrue Green (5.6 feet, MAN). Scottie Jackson misses. Rebound secured by Jrue Green.

[05:25] Team_082 possession (Score: 11-13)
Julius Carter drives, Collin Young stays with him. Julius Carter attempts a Dunk. Contested by Collin Young (4.4 feet, MAN). JULIUS CARTER MAKES IT! Assist: Jrue Green
Score: 13-13

[05:11] Team_037 possession (Score: 13-13)
Jarrett Tatum attempts a 3Pt. Contested by Kristaps Fox (4.4 feet, MAN). JARRETT TATUM MAKES IT! Assist: Scottie Jackson
Score: 13-16

[04:52] Team_082 possession (Score: 13-16)
Julius Anthony makes the Dunk and draws the foul on Giannis Middleton! And-1! Julius Anthony to the line for 1. [Team fouls: 3] (Giannis Middleton: 2 personal fouls)   FT 1/1: GOOD Julius Anthony makes 1/1 from the line.
Score: 16-16

[04:41] Team_037 possession (Score: 16-16)
Jarrett Tatum attempts a 3Pt. Contested by Dwyane O'Neal (3.5 feet, ZONE). JARRETT TATUM MAKES IT! Assist: Collin Young
Score: 16-19

[04:27] Team_082 possession (Score: 16-19)
FOUL! Shooting foul on Scottie Jackson. Jrue Green to the line for 2 free throws. [Team fouls: 4] (Scottie Jackson: 2 personal fouls)   FT 1/2: GOOD   FT 2/2: GOOD Jrue Green makes 2/2 from the line.
Score: 18-19

[04:12] Team_037 possession (Score: 18-19)
Jarrett Tatum attempts a Midrange. Contested by Kristaps Fox (4.5 feet, ZONE). Jarrett Tatum misses. Rebound secured by Jrue Green.

[03:55] Team_082 possession (Score: 18-19)
Dwyane O'Neal attempts a 3Pt. Contested by Scottie Jackson (3.7 feet, ZONE). Dwyane O'Neal misses. Rebound secured by Collin Young.

[03:39] Team_037 possession (Score: 18-19)
RJ Mitchell attempts a Layup. Contested by Jrue Green (5.4 feet, ZONE). RJ MITCHELL MAKES IT!
Score: 18-21

[03:27] Team_082 possession (Score: 18-21)
Jrue Green drives and kicks out. FOUL! Shooting foul on Giannis Middleton. Dwyane O'Neal to the line for 3 free throws. [BONUS: 5 team fouls] (Giannis Middleton: 3 personal fouls)   FT 1/3: GOOD   FT 2/3: MISS   FT 3/3: GOOD Dwyane O'Neal makes 2/3 from the line.
Score: 20-21

[03:09] Team_037 possession (Score: 20-21)
Jarrett Tatum attempts a 3Pt. Contested by Kristaps Fox (4.6 feet, MAN). Jarrett Tatum misses. Rebound secured by Julius Carter.

[02:56] Team_082 possession (Score: 20-21)
Julius Anthony attempts a Midrange. Contested by RJ Mitchell (5.2 feet, MAN). JULIUS ANTHONY MAKES IT!
Score: 22-21

[02:38] Team_037 possession (Score: 22-21)
Collin Young throws a bad pass out of bounds! TURNOVER! (dead ball)

[02:38] Substitution (Team_082): Julius Anthony OUT → Jordan Rozier IN (stamina_rule2)

[02:38] Substitution (Team_082): Kristaps Fox OUT → Shaquille Griffin IN (stamina_rule2)

[02:38] Substitution (Team_082): Jrue Green OUT → Tony Jokic IN (stamina_rule2)

[02:38] Substitution (Team_082): Julius Carter OUT → D'Angelo Parker IN (stamina_rule2)

[02:38] Substitution (Team_037): Collin Young OUT → Wendell Herro IN (stamina_rule2)

[02:22] Team_082 possession (Score: 22-21)
Jordan Rozier attempts a 3Pt. Contested by RJ Mitchell (5.0 feet, MAN). JORDAN ROZIER MAKES IT! Assist: Shaquille Griffin
Score: 25-21

[02:04] Team_037 possession (Score: 25-21)
Jarrett Tatum attempts a 3Pt. Contested by Tony Jokic (5.2 feet, ZONE). Jarrett Tatum misses. Rebound secured by Shaquille Griffin.

[01:45] Team_082 possession (Score: 25-21)
Dwyane O'Neal attempts a 3Pt. Contested by Scottie Jackson (3.9 feet, ZONE). Dwyane O'Neal misses. Rebound secured by Jarrett Tatum.

[01:28] Team_037 possession (Score: 25-21)
Scottie Jackson attempts a Midrange. Contested by Tony Jokic (5.6 feet, MAN). Scottie Jackson misses. Rebound secured by Dwyane O'Neal.

[01:12] Team_082 possession (Score: 25-21)
Jordan Rozier attempts a 3Pt. Contested by RJ Mitchell (5.1 feet, MAN). Jordan Rozier misses. Rebound secured by Wendell Herro.

[00:59] Team_037 possession (Score: 25-21)
Giannis Middleton attempts a 3Pt. Contested by Dwyane O'Neal (4.1 feet, ZONE). Giannis Middleton misses. Rebound secured by Tony Jokic.

[00:42] Team_082 possession (Score: 25-21)
Shaquille Griffin makes the Layup and draws the foul on Jarrett Tatum! And-1! Shaquille Griffin to the line for 1. [BONUS: 6 team fouls] (Jarrett Tatum: 1 personal fouls)   FT 1/1: GOOD Shaquille Griffin makes 1/1 from the line.
Score: 28-21

[00:25] Team_037 possession (Score: 28-21)
Jarrett Tatum attempts a 3Pt. Contested by Dwyane O'Neal (3.9 feet, ZONE). Jarrett Tatum misses. Offensive rebound by Jarrett Tatum! Jarrett Tatum kicks it out.

[00:09] Team_037 possession (Score: 28-21)
FOUL! Holding foul on Shaquille Griffin. [Team fouls: 3] No free throws, side out. (Shaquille Griffin: 1 personal fouls)

================================================================================
                              1ST QUARTER COMPLETE                              
================================================================================

1ST QUARTER SCORE: Team_082 28, Team_037 21

BOX SCORE:
================================================================================

Team_082
--------------------------------------------------------------------------------
Player                MIN  PTS  REB  AST  TO      FG   FG%      3P   3P%
--------------------------------------------------------------------------------
Jrue Green             10    6    3    1   0   3/4    75.0     0/0   0.0
Dwyane O'Neal          12    5    4    0   0   2/7    28.6     0/0   0.0
Julius Anthony         10    5    0    0   0   2/3    66.7     0/0   0.0
Kristaps Fox           10    4    0    1   0   2/4    50.0     0/0   0.0
Jordan Rozier           2    3    0    0   0   1/2    50.0     0/0   0.0
Shaquille Griffin       2    3    1    1   0   1/1   100.0     0/0   0.0
Julius Carter          10    2    3    1   0   1/1   100.0     0/0   0.0
Tony Jokic              2    0    1    0   0   0/0     0.0     0/0   0.0

TEAM: FG: 12/22 (54.5%), 3PT: 2/8 (25.0%), REB: 11 (1 off, 10 def), AST: 4, TO: 1
TEAM FOULS: 3


Team_037
--------------------------------------------------------------------------------
Player                MIN  PTS  REB  AST  TO      FG   FG%      3P   3P%
--------------------------------------------------------------------------------
Jarrett Tatum          12   10    4    0   0   4/9    44.4     0/0   0.0
RJ Mitchell            12    7    0    1   0   3/3   100.0     0/0   0.0
Collin Young           10    2    2    1   0   1/2    50.0     0/0   0.0
Giannis Middleton      12    2    0    0   0   1/2    50.0     0/0   0.0
Scottie Jackson        12    0    4    1   0   0/4     0.0     0/0   0.0
Wendell Herro           2    0    1    0   0   0/0     0.0     0/0   0.0

TEAM: FG: 9/20 (45.0%), 3PT: 4/11 (36.4%), REB: 12 (3 off, 9 def), AST: 3, TO: 2
TEAM FOULS: 6 [Team_082 in BONUS]

================================================================================

================================================================================
                       2ND QUARTER - Team_082 vs Team_037                       
================================================================================

[12:00] Team_082 possession (Score: 28-21)
FOUL! Shooting foul on Scottie Jackson. Jrue Green to the line for 2 free throws. [Team fouls: 1] (Scottie Jackson: 1 personal fouls)   FT 1/2: GOOD   FT 2/2: GOOD Jrue Green makes 2/2 from the line.
Score: 30-21

[11:47] Team_037 possession (Score: 30-21)
Scottie Jackson drives to the basket... Scottie Jackson throws a bad pass out of bounds! TURNOVER! (dead ball)

[11:47] Substitution (Team_082): Dwyane O'Neal OUT → Kawhi Poole IN (stamina_rule2)

[11:47] Substitution (Team_037): RJ Mitchell OUT → Jarrett Randle IN (stamina_rule2)

[11:47] Substitution (Team_037): Jarrett Tatum OUT → Julius Bird IN (stamina_rule2)

[11:32] Team_082 possession (Score: 30-21)
Julius Anthony attempts a 3Pt. Contested by Jarrett Randle (4.2 feet, ZONE). Julius Anthony misses. Offensive rebound by Jrue Green! Jrue Green kicks it out.

[11:15] Team_082 possession (Score: 30-21)
Kristaps Fox attempts a 3Pt. Contested by Jarrett Randle (3.9 feet, ZONE). Kristaps Fox misses. Rebound secured by Julius Bird.

[11:05] Team_037 possession (Score: 30-21)
Collin Young attempts a Layup. Contested by Julius Carter (5.8 feet, MAN). COLLIN YOUNG MAKES IT!
Score: 30-23

[10:55] Team_082 possession (Score: 30-23)
Julius Anthony loses the ball! Stripped by Jarrett Randle! TURNOVER! (live ball)

[10:40] Team_037 possession (Score: 30-23)
Julius Bird attempts a 3Pt. Contested by Kristaps Fox (4.7 feet, MAN). Julius Bird misses. Offensive rebound by Scottie Jackson! Scottie Jackson kicks it out.

[10:29] Team_037 possession (Score: 30-23)
Collin Young attempts a Midrange. Contested by Julius Carter (5.9 feet, MAN). Collin Young misses. Offensive rebound by Collin Young! Collin Young puts it back in!
Score: 30-25

[10:15] Team_082 possession (Score: 30-25)
Kawhi Poole attempts a 3Pt. Contested by Jarrett Randle (4.4 feet, ZONE). Kawhi Poole misses. Rebound secured by Collin Young.

[10:02] Team_037 possession (Score: 30-25)
Jarrett Randle attempts a 3Pt. Contested by Julius Anthony (4.8 feet, MAN). Jarrett Randle misses. Rebound secured by Kristaps Fox.

[09:48] Team_082 possession (Score: 30-25)
FOUL! Offensive foul on Julius Carter! Collin Young drew the charge! [Team fouls: 1] (Julius Carter: 1 personal fouls) TURNOVER! (dead ball)

[09:33] Team_037 possession (Score: 30-25)
Scottie Jackson attempts a 3Pt. Contested by Jrue Green (5.8 feet, ZONE). Scottie Jackson misses. Rebound secured by Kristaps Fox.

[09:21] Team_082 possession (Score: 30-25)
Kristaps Fox drives and kicks out. Kristaps Fox attempts a 3Pt. Contested by Julius Bird (4.4 feet, MAN). KRISTAPS FOX MAKES IT! Assist: Julius Carter
Score: 33-25

[09:10] Team_037 possession (Score: 33-25)
Collin Young attempts a Layup. Contested by Julius Carter (6.0 feet, MAN). Collin Young misses. Offensive rebound by Collin Young! Collin Young puts it back in!
Score: 33-27

[08:53] Team_082 possession (Score: 33-27)
Kristaps Fox drives, Scottie Jackson stays with him. Kristaps Fox attempts a Dunk. Contested by Scottie Jackson (4.3 feet, ZONE). Kristaps Fox misses. Offensive rebound by Julius Carter! Julius Carter kicks it out.

[08:40] Team_082 possession (Score: 33-27)
Julius Carter drives to the basket... Julius Carter commits a violation (traveling/carry)! TURNOVER! (dead ball)

[08:40] Substitution (Team_082): Julius Anthony OUT → Jordan Rozier IN (stamina_rule2)

[08:40] Substitution (Team_082): Kristaps Fox OUT → Shaquille Griffin IN (stamina_rule2)

[08:40] Substitution (Team_082): Jrue Green OUT → Tony Jokic IN (stamina_rule2)

[08:40] Substitution (Team_082): Julius Carter OUT → D'Angelo Parker IN (stamina_rule2)

[08:40] Substitution (Team_037): Giannis Middleton OUT → Collin Trent IN (stamina_rule2)

[08:40] Substitution (Team_037): Scottie Jackson OUT → Russell Anthony IN (stamina_rule2)

[08:40] Substitution (Team_037): Collin Young OUT → Wendell Herro IN (stamina_rule2)

[08:24] Team_037 possession (Score: 33-27)
Russell Anthony drives, D'Angelo Parker stays with him. Russell Anthony attempts a Layup. Contested by D'Angelo Parker (5.3 feet, ZONE). RUSSELL ANTHONY MAKES IT!
Score: 33-29

[08:07] Team_082 possession (Score: 33-29)
Kawhi Poole attempts a Layup. Wide open! Collin Trent is 6.2 feet away. [MAN] KAWHI POOLE MAKES IT!
Score: 35-29

[07:50] Team_037 possession (Score: 35-29)
Wendell Herro drives, picks up D'Angelo Parker. Help arrives from Kawhi Poole! Wendell Herro attempts a Layup. Contested by Kawhi Poole (5.3 feet, MAN). Wendell Herro misses. Rebound secured by D'Angelo Parker.

[07:33] Team_082 possession (Score: 35-29)
D'Angelo Parker attempts a Layup. Contested by Russell Anthony (4.2 feet, MAN). D'Angelo Parker misses. Rebound secured by Wendell Herro.

[07:21] Team_037 possession (Score: 35-29)
Collin Trent makes the Layup and draws the foul on Kawhi Poole! And-1! Collin Trent to the line for 1. [Team fouls: 2] (Kawhi Poole: 1 personal fouls)   FT 1/1: GOOD Collin Trent makes 1/1 from the line.
Score: 35-32

[07:03] Team_082 possession (Score: 35-32)
FOUL! Holding foul on Jarrett Randle. [Team fouls: 2] No free throws, side out. (Jarrett Randle: 1 personal fouls)

[06:49] Team_082 possession (Score: 35-32)
D'Angelo Parker attempts a Layup. Contested by Russell Anthony (4.2 feet, MAN). D'Angelo Parker misses. FOUL! Loose ball foul on Julius Bird during the rebound battle. [Team fouls: 3] No free throws, side out. (Julius Bird: 1 personal fouls)

[06:34] Team_082 possession (Score: 35-32)
Jordan Rozier makes the Layup and draws the foul on Wendell Herro! And-1! Jordan Rozier to the line for 1. [Team fouls: 4] (Wendell Herro: 1 personal fouls)   FT 1/1: MISS Jordan Rozier makes 0/1 from the line. Rebound secured by Julius Bird.
Score: 37-32

[06:19] Team_037 possession (Score: 37-32)
Julius Bird drives and kicks out. Russell Anthony attempts a 3Pt. Contested by Kawhi Poole (5.4 feet, ZONE). Russell Anthony misses. Rebound secured by Tony Jokic.

[06:07] Team_082 possession (Score: 37-32)
Jordan Rozier drives to the basket... Jordan Rozier commits a violation (traveling/carry)! TURNOVER! (dead ball)

[05:52] Team_037 possession (Score: 37-32)
Russell Anthony attempts a 3Pt. Contested by Kawhi Poole (5.8 feet, ZONE). Russell Anthony misses. Rebound secured by Shaquille Griffin.

[05:39] Team_082 possession (Score: 37-32)
Kawhi Poole attempts a Layup. Wide open! Collin Trent is 6.2 feet away. [MAN] Kawhi Poole misses. Rebound secured by Wendell Herro.

[05:22] Team_037 possession (Score: 37-32)
Jarrett Randle attempts a Layup. Contested by D'Angelo Parker (5.2 feet, ZONE). Jarrett Randle misses. Rebound secured by Shaquille Griffin.

[05:06] Team_082 possession (Score: 37-32)
Kawhi Poole attempts a 3Pt. Contested by Jarrett Randle (4.4 feet, ZONE). KAWHI POOLE MAKES IT! Assist: D'Angelo Parker
Score: 40-32

[04:51] Team_037 possession (Score: 40-32)
Wendell Herro makes the Layup and draws the foul on D'Angelo Parker! And-1! Wendell Herro to the line for 1. [Team fouls: 3] (D'Angelo Parker: 1 personal fouls)   FT 1/1: MISS Wendell Herro makes 0/1 from the line. Offensive rebound by Julius Bird! Julius Bird kicks it out.
Score: 40-34

[04:37] Team_037 possession (Score: 40-34)
Russell Anthony drives, picks up Tony Jokic. Help arrives from Kawhi Poole! Russell Anthony attempts a Layup. Contested by Kawhi Poole (5.4 feet, MAN). Russell Anthony misses. Rebound secured by Shaquille Griffin.

[04:18] Team_082 possession (Score: 40-34)
Kawhi Poole drives, Collin Trent stays with him. Kawhi Poole attempts a Layup. Wide open! Collin Trent is 6.2 feet away. [MAN] KAWHI POOLE MAKES IT! Assist: D'Angelo Parker
Score: 42-34

[04:05] Team_037 possession (Score: 42-34)
Jarrett Randle attempts a Midrange. Wide open! Jordan Rozier is 6.2 feet away. [MAN] JARRETT RANDLE MAKES IT! Assist: Russell Anthony
Score: 42-36

[03:50] Team_082 possession (Score: 42-36)
Jordan Rozier drives, Jarrett Randle stays with him. Jordan Rozier attempts a Dunk. Contested by Jarrett Randle (4.0 feet, MAN). Jordan Rozier misses. Rebound secured by Wendell Herro.

[03:34] Team_037 possession (Score: 42-36)
Wendell Herro attempts a 3Pt. Contested by Shaquille Griffin (5.0 feet, ZONE). Wendell Herro misses. Offensive rebound by Julius Bird! Julius Bird kicks it out.

[03:18] Team_037 possession (Score: 42-36)
Collin Trent drives, Kawhi Poole stays with him. Collin Trent attempts a Layup. Contested by Kawhi Poole (5.9 feet, MAN). Collin Trent misses. Rebound secured by Shaquille Griffin.

[03:03] Team_082 possession (Score: 42-36)
Kawhi Poole attempts a 3Pt. Wide open! Collin Trent is 6.2 feet away. [MAN] Kawhi Poole misses. Rebound secured by Wendell Herro.

[02:47] Team_037 possession (Score: 42-36)
Julius Bird throws a bad pass! Stolen by Shaquille Griffin! TURNOVER! (live ball)

[02:33] Team_082 possession (Score: 42-36)
Tony Jokic attempts a 3Pt. Contested by Russell Anthony (3.5 feet, MAN). Tony Jokic misses. Rebound secured by Russell Anthony.

[02:22] Team_037 possession (Score: 42-36)
FOUL! Reach-in foul on D'Angelo Parker during the drive. [Team fouls: 4] No free throws, side out. (D'Angelo Parker: 2 personal fouls)

[02:09] Team_037 possession (Score: 42-36)
FOUL! Reach-in foul on D'Angelo Parker during the drive. [IN THE BONUS! 5 team fouls] Wendell Herro to the line for 2 free throws. (D'Angelo Parker: 3 personal fouls)   FT 1/2: GOOD   FT 2/2: MISS Wendell Herro makes 1/2 from the line. Offensive rebound by Russell Anthony! Russell Anthony puts it back in!
Score: 42-39

[01:53] Team_082 possession (Score: 42-39)
Kawhi Poole attempts a Midrange. Wide open! Collin Trent is 6.2 feet away. [MAN] KAWHI POOLE MAKES IT! Assist: Tony Jokic
Score: 44-39

[01:40] Team_037 possession (Score: 44-39)
Wendell Herro makes the Dunk and draws the foul on D'Angelo Parker! And-1! Wendell Herro to the line for 1. [BONUS: 6 team fouls] (D'Angelo Parker: 4 personal fouls)   FT 1/1: GOOD Wendell Herro makes 1/1 from the line.
Score: 44-42

[01:20] Team_082 possession (Score: 44-42)
Kawhi Poole attempts a 3Pt. Wide open! Collin Trent is 6.2 feet away. [MAN] Kawhi Poole misses. Rebound secured by Russell Anthony.

[01:07] Team_037 possession (Score: 44-42)
Jarrett Randle drives, D'Angelo Parker stays with him. Jarrett Randle attempts a Dunk. Contested by D'Angelo Parker (5.2 feet, ZONE). Jarrett Randle misses. Offensive rebound by Russell Anthony! Russell Anthony puts it back in!
Score: 44-44

[00:50] Team_082 possession (Score: 44-44)
Shaquille Griffin attempts a 3Pt. Contested by Julius Bird (4.7 feet, MAN). Shaquille Griffin misses. Offensive rebound by Tony Jokic! Tony Jokic kicks it out.

[00:34] Team_082 possession (Score: 44-44)
FOUL! Shooting foul on Russell Anthony. D'Angelo Parker to the line for 2 free throws. [BONUS: 5 team fouls] (Russell Anthony: 1 personal fouls)   FT 1/2: MISS   FT 2/2: GOOD D'Angelo Parker makes 1/2 from the line.
Score: 45-44

[00:21] Team_037 possession (Score: 45-44)
Julius Bird attempts a Midrange. Contested by Shaquille Griffin (5.2 feet, MAN). Julius Bird misses. Rebound secured by Shaquille Griffin.

[00:07] Team_082 possession (Score: 45-44)
Tony Jokic attempts a 3Pt. Contested by Collin Trent (5.5 feet, ZONE). Tony Jokic misses. Rebound secured by Russell Anthony.

================================================================================
                              2ND QUARTER COMPLETE                              
================================================================================

2ND QUARTER SCORE: Team_082 17, Team_037 23

BOX SCORE:
================================================================================

Team_082
--------------------------------------------------------------------------------
Player                MIN  PTS  REB  AST  TO      FG   FG%      3P   3P%
--------------------------------------------------------------------------------
Kawhi Poole            12    9    0    0   0   4/8    50.0     0/0   0.0
Kristaps Fox           13    3    2    0   0   1/2    50.0     0/0   0.0
Jrue Green             13    2    1    0   0   1/1   100.0     0/0   0.0
D'Angelo Parker        11    1    1    2   0   1/2    50.0     0/0   0.0
Julius Carter          13    0    1    1   0   0/0     0.0     0/0   0.0
Tony Jokic             11    0    3    1   0   0/2     0.0     0/0   0.0
Jordan Rozier          11    0    0    0   0   0/2     0.0     0/0   0.0
Shaquille Griffin      11    0    5    0   0   0/0     0.0     0/0   0.0

TEAM: FG: 7/17 (41.2%), 3PT: 1/7 (14.3%), REB: 13 (4 off, 9 def), AST: 4, TO: 4
TEAM FOULS: 6 [Team_037 in BONUS]


Team_037
--------------------------------------------------------------------------------
Player                MIN  PTS  REB  AST  TO      FG   FG%      3P   3P%
--------------------------------------------------------------------------------
Russell Anthony         9    7    4    1   0   3/5    60.0     0/0   0.0
Collin Young           13    6    3    0   0   3/3   100.0     0/0   0.0
Wendell Herro          11    3    4    0   0   1/2    50.0     0/0   0.0
Collin Trent            9    3    0    0   0   1/2    50.0     0/0   0.0
Jarrett Randle         12    2    0    0   0   1/3    33.3     0/0   0.0
Julius Bird            12    0    4    0   0   0/2     0.0     0/0   0.0
Scottie Jackson        16    0    1    0   0   0/1     0.0     0/0   0.0

TEAM: FG: 9/18 (50.0%), 3PT: 0/3 (0.0%), REB: 16 (6 off, 10 def), AST: 1, TO: 2
TEAM FOULS: 5 [Team_082 in BONUS]

================================================================================

================================================================================
                       3RD QUARTER - Team_082 vs Team_037                       
================================================================================

[12:00] Team_082 possession (Score: 45-44)
Julius Anthony makes the 3Pt and draws the foul on RJ Mitchell! And-1! Julius Anthony to the line for 1. [Team fouls: 1] (RJ Mitchell: 1 personal fouls)   FT 1/1: GOOD Julius Anthony makes 1/1 from the line.
Score: 49-44

[11:46] Team_037 possession (Score: 49-44)
FOUL! Shooting foul on Jrue Green. Collin Young to the line for 2 free throws. [Team fouls: 1] (Jrue Green: 1 personal fouls)   FT 1/2: GOOD   FT 2/2: GOOD Collin Young makes 2/2 from the line.
Score: 49-46

[11:30] Team_082 possession (Score: 49-46)
Julius Anthony attempts a 3Pt. Contested by Scottie Jackson (4.0 feet, ZONE). Julius Anthony misses. Rebound secured by Collin Young.

[11:15] Team_037 possession (Score: 49-46)
Scottie Jackson drives and kicks out. Jarrett Tatum attempts a 3Pt. Contested by Dwyane O'Neal (3.3 feet, ZONE). JARRETT TATUM MAKES IT! Assist: Collin Young
Score: 49-49

[10:59] Team_082 possession (Score: 49-49)
Julius Carter attempts a Layup. Contested by Scottie Jackson (4.0 feet, ZONE). Julius Carter misses. Rebound secured by Scottie Jackson.

[10:44] Team_037 possession (Score: 49-49)
Scottie Jackson makes the Dunk and draws the foul on Dwyane O'Neal! And-1! Scottie Jackson to the line for 1. [Team fouls: 2] (Dwyane O'Neal: 1 personal fouls)   FT 1/1: GOOD Scottie Jackson makes 1/1 from the line.
Score: 49-52

[10:30] Team_082 possession (Score: 49-52)
Kristaps Fox attempts a Layup. Contested by Jarrett Tatum (4.1 feet, MAN). Kristaps Fox misses. Rebound secured by Scottie Jackson.

[10:19] Team_037 possession (Score: 49-52)
Giannis Middleton attempts a 3Pt. Contested by Dwyane O'Neal (3.7 feet, MAN). GIANNIS MIDDLETON MAKES IT! Assist: Scottie Jackson
Score: 49-55

[10:05] Team_082 possession (Score: 49-55)
Kristaps Fox makes the Layup and draws the foul on Scottie Jackson! And-1! Kristaps Fox to the line for 1. [Team fouls: 2] (Scottie Jackson: 1 personal fouls)   FT 1/1: GOOD Kristaps Fox makes 1/1 from the line.
Score: 52-55

[09:49] Team_037 possession (Score: 52-55)
Jarrett Tatum attempts a 3Pt. Contested by Dwyane O'Neal (3.5 feet, ZONE). Jarrett Tatum misses. Rebound secured by Jrue Green.

[09:33] Team_082 possession (Score: 52-55)
Julius Anthony makes the 3Pt and draws the foul on RJ Mitchell! And-1! Julius Anthony to the line for 1. [Team fouls: 3] (RJ Mitchell: 2 personal fouls)   FT 1/1: GOOD Julius Anthony makes 1/1 from the line.
Score: 56-55

[09:23] Team_037 possession (Score: 56-55)
Scottie Jackson makes the Layup and draws the foul on Jrue Green! And-1! Scottie Jackson to the line for 1. [Team fouls: 3] (Jrue Green: 2 personal fouls)   FT 1/1: GOOD Scottie Jackson makes 1/1 from the line.
Score: 56-58

[09:12] Team_082 possession (Score: 56-58)
Kristaps Fox attempts a Layup. BLOCKED BY JARRETT TATUM! Ball is loose! Rebound secured by Jarrett Tatum.

[08:58] Team_037 possession (Score: 56-58)
Giannis Middleton makes the Layup and draws the foul on Jrue Green! And-1! Giannis Middleton to the line for 1. [Team fouls: 4] (Jrue Green: 3 personal fouls)   FT 1/1: GOOD Giannis Middleton makes 1/1 from the line.
Score: 56-61

[08:41] Team_082 possession (Score: 56-61)
Jrue Green drives to the basket... FOUL! Offensive foul on Jrue Green! Scottie Jackson drew the charge! [Team fouls: 5] (Jrue Green: 4 personal fouls) TURNOVER! (dead ball)

[08:25] Team_037 possession (Score: 56-61)
Scottie Jackson attempts a 3Pt. Contested by Jrue Green (5.6 feet, MAN). Scottie Jackson misses. Rebound secured by Julius Carter.

[08:16] Team_082 possession (Score: 56-61)
Jrue Green attempts a 3Pt. Contested by Scottie Jackson (3.9 feet, MAN). JRUE GREEN MAKES IT! Assist: Julius Carter
Score: 59-61

[08:00] Team_037 possession (Score: 59-61)
Jarrett Tatum attempts a 3Pt. Contested by Kristaps Fox (4.4 feet, MAN). Jarrett Tatum misses. Rebound secured by Jrue Green.

[07:43] Team_082 possession (Score: 59-61)
FOUL! Shooting foul on Giannis Middleton. Dwyane O'Neal to the line for 2 free throws. [Team fouls: 4] (Giannis Middleton: 1 personal fouls)   FT 1/2: GOOD   FT 2/2: GOOD Dwyane O'Neal makes 2/2 from the line.
Score: 61-61

[07:26] Team_037 possession (Score: 61-61)
RJ Mitchell attempts a 3Pt. Contested by Dwyane O'Neal (3.5 feet, ZONE). RJ MITCHELL MAKES IT! Assist: Collin Young
Score: 61-64

[07:15] Team_082 possession (Score: 61-64)
FOUL! Offensive foul on Kristaps Fox! Jarrett Tatum drew the charge! [Team fouls: 6] (Kristaps Fox: 1 personal fouls) TURNOVER! (dead ball)

[07:00] Team_037 possession (Score: 61-64)
Giannis Middleton attempts a 3Pt. Contested by Dwyane O'Neal (3.7 feet, ZONE). Giannis Middleton misses. Offensive rebound by Scottie Jackson! Scottie Jackson puts it back in!
Score: 61-66

[06:42] Team_082 possession (Score: 61-66)
Kristaps Fox makes the Layup and draws the foul on Giannis Middleton! And-1! Kristaps Fox to the line for 1. [BONUS: 5 team fouls] (Giannis Middleton: 2 personal fouls)   FT 1/1: GOOD Kristaps Fox makes 1/1 from the line.
Score: 64-66

[06:27] Team_037 possession (Score: 64-66)
Jarrett Tatum attempts a Midrange. Contested by Kristaps Fox (4.4 feet, ZONE). Jarrett Tatum misses. FOUL! Loose ball foul on Jrue Green during the rebound battle. [IN THE BONUS! 7 team fouls] Scottie Jackson to the line for 2 free throws. (Jrue Green: 5 personal fouls)   FT 1/2: GOOD   FT 2/2: GOOD Scottie Jackson makes 2/2 from the line.
Score: 64-68

[06:15] Team_082 possession (Score: 64-68)
Julius Anthony drives, picks up RJ Mitchell. Help arrives from Giannis Middleton! Julius Anthony attempts a Dunk. Contested by Giannis Middleton (5.0 feet, MAN). JULIUS ANTHONY MAKES IT! Assist: Kristaps Fox
Score: 66-68

[05:59] Team_037 possession (Score: 66-68)
RJ Mitchell drives, Jrue Green stays with him. RJ Mitchell attempts a Dunk. Contested by Jrue Green (5.3 feet, ZONE). RJ MITCHELL MAKES IT! Assist: Jarrett Tatum
Score: 66-70

[05:43] Team_082 possession (Score: 66-70)
Dwyane O'Neal drives, picks up Scottie Jackson. Help arrives from Giannis Middleton! Dwyane O'Neal attempts a Layup. Contested by Giannis Middleton (3.6 feet, ZONE). Dwyane O'Neal misses. Rebound secured by Scottie Jackson.

[05:28] Team_037 possession (Score: 66-70)
RJ Mitchell attempts a 3Pt. Contested by Dwyane O'Neal (3.5 feet, ZONE). RJ Mitchell misses. Rebound secured by Julius Carter.

[05:14] Team_082 possession (Score: 66-70)
Jrue Green attempts a Midrange. Contested by Jarrett Tatum (4.3 feet, ZONE). JRUE GREEN MAKES IT!
Score: 68-70

[04:57] Team_037 possession (Score: 68-70)
Giannis Middleton drives, picks up Jrue Green. Help arrives from Dwyane O'Neal! Giannis Middleton attempts a Dunk. Contested by Dwyane O'Neal (5.5 feet, ZONE). GIANNIS MIDDLETON MAKES IT! Assist: Scottie Jackson
Score: 68-72

[04:44] Team_082 possession (Score: 68-72)
Julius Anthony drives, picks up RJ Mitchell. Help arrives from Giannis Middleton! Julius Anthony attempts a Layup. Contested by Giannis Middleton (5.0 feet, MAN). JULIUS ANTHONY MAKES IT! Assist: Jrue Green
Score: 70-72

[04:33] Team_037 possession (Score: 70-72)
Giannis Middleton attempts a Midrange. Contested by Dwyane O'Neal (3.7 feet, MAN). GIANNIS MIDDLETON MAKES IT!
Score: 70-74

[04:17] Team_082 possession (Score: 70-74)
Julius Carter throws a bad pass! Stolen by Collin Young! TURNOVER! (live ball)

[04:03] Team_037 possession (Score: 70-74)
Giannis Middleton attempts a 3Pt. Contested by Dwyane O'Neal (3.8 feet, MAN). Giannis Middleton misses. Rebound secured by Jrue Green.

[03:45] Team_082 possession (Score: 70-74)
FOUL! Holding foul on Scottie Jackson. [IN THE BONUS! 6 team fouls] Jrue Green to the line for 2 free throws. (Scottie Jackson: 2 personal fouls)   FT 1/2: GOOD   FT 2/2: GOOD Jrue Green makes 2/2 from the line.
Score: 72-74

[03:34] Team_037 possession (Score: 72-74)
Jarrett Tatum attempts a Midrange. Contested by Dwyane O'Neal (3.6 feet, ZONE). Jarrett Tatum misses. Rebound secured by Julius Carter.

[03:21] Team_082 possession (Score: 72-74)
FOUL! Holding foul on Giannis Middleton. [IN THE BONUS! 7 team fouls] Dwyane O'Neal to the line for 2 free throws. (Giannis Middleton: 3 personal fouls)   FT 1/2: GOOD   FT 2/2: GOOD Dwyane O'Neal makes 2/2 from the line.
Score: 74-74

[03:10] Team_037 possession (Score: 74-74)
FOUL! Reach-in foul on Julius Carter during the drive. [IN THE BONUS! 8 team fouls] Collin Young to the line for 2 free throws. (Julius Carter: 1 personal fouls)   FT 1/2: GOOD   FT 2/2: GOOD Collin Young makes 2/2 from the line.
Score: 74-76

[02:56] Team_082 possession (Score: 74-76)
Kristaps Fox drives, Jarrett Tatum stays with him. Kristaps Fox attempts a Dunk. Contested by Jarrett Tatum (4.3 feet, MAN). KRISTAPS FOX MAKES IT! Assist: Jrue Green
Score: 76-76

[02:40] Team_037 possession (Score: 76-76)
Scottie Jackson drives and kicks out. RJ Mitchell attempts a Midrange. Contested by Julius Anthony (4.7 feet, MAN). RJ MITCHELL MAKES IT!
Score: 76-78

[02:27] Team_082 possession (Score: 76-78)
FOUL! Holding foul on Jarrett Tatum. [IN THE BONUS! 8 team fouls] Kristaps Fox to the line for 2 free throws. (Jarrett Tatum: 1 personal fouls)   FT 1/2: GOOD   FT 2/2: GOOD Kristaps Fox makes 2/2 from the line.
Score: 78-78

[02:11] Team_037 possession (Score: 78-78)
Giannis Middleton drives and kicks out. RJ Mitchell attempts a 3Pt. Contested by Julius Anthony (4.8 feet, MAN). RJ Mitchell misses. Rebound secured by Julius Carter.

[01:55] Team_082 possession (Score: 78-78)
FOUL! Shooting foul on Jarrett Tatum. Dwyane O'Neal to the line for 2 free throws. [BONUS: 9 team fouls] (Jarrett Tatum: 2 personal fouls)   FT 1/2: GOOD   FT 2/2: GOOD Dwyane O'Neal makes 2/2 from the line.
Score: 80-78

[01:44] Team_037 possession (Score: 80-78)
Giannis Middleton attempts a 3Pt. Contested by Dwyane O'Neal (4.0 feet, ZONE). Giannis Middleton misses. Offensive rebound by Collin Young! Collin Young puts it back in!
Score: 80-80

[01:28] Team_082 possession (Score: 80-80)
Dwyane O'Neal throws a bad pass! Stolen by Giannis Middleton! TURNOVER! (live ball)

[01:14] Team_037 possession (Score: 80-80)
Jarrett Tatum attempts a 3Pt. Contested by Kristaps Fox (4.8 feet, MAN). Jarrett Tatum misses. Rebound secured by Jrue Green.

[00:59] Team_082 possession (Score: 80-80)
FOUL! Reach-in foul on Scottie Jackson during the drive. [IN THE BONUS! 10 team fouls] Julius Carter to the line for 2 free throws. (Scottie Jackson: 3 personal fouls)   FT 1/2: MISS   FT 2/2: GOOD Julius Carter makes 1/2 from the line.
Score: 81-80

[00:42] Team_037 possession (Score: 81-80)
FOUL! Holding foul on Jrue Green. [IN THE BONUS! 9 team fouls] Scottie Jackson to the line for 2 free throws. (Jrue Green: 6 personal fouls) Jrue Green FOULS OUT!   FT 1/2: GOOD   FT 2/2: GOOD Scottie Jackson makes 2/2 from the line.
Score: 81-82

[00:42] Substitution (Team_082): Jrue Green OUT (stamina: 62) → Jordan Rozier IN (foul_out)

[00:26] Team_082 possession (Score: 81-82)
Kristaps Fox makes the Midrange and draws the foul on Jarrett Tatum! And-1! Kristaps Fox to the line for 1. [BONUS: 11 team fouls] (Jarrett Tatum: 3 personal fouls)   FT 1/1: GOOD Kristaps Fox makes 1/1 from the line.
Score: 84-82

[00:16] Team_037 possession (Score: 84-82)
Scottie Jackson attempts a Midrange. Contested by Kristaps Fox (5.3 feet, ZONE). SCOTTIE JACKSON MAKES IT!
Score: 84-84

================================================================================
                              3RD QUARTER COMPLETE                              
================================================================================

3RD QUARTER SCORE: Team_082 39, Team_037 40

BOX SCORE:
================================================================================

Team_082
--------------------------------------------------------------------------------
Player                MIN  PTS  REB  AST  TO      FG   FG%      3P   3P%
--------------------------------------------------------------------------------
Kristaps Fox           25   13    0    1   0   5/7    71.4     0/0   0.0
Julius Anthony         25   12    0    0   0   4/5    80.0     0/0   0.0
Jrue Green             25    7    4    2   0   3/3   100.0     0/0   0.0
Dwyane O'Neal          25    6    0    0   0   3/4    75.0     0/0   0.0
Julius Carter          25    1    4    1   0   1/2    50.0     0/0   0.0

TEAM: FG: 16/21 (76.2%), 3PT: 3/4 (75.0%), REB: 8 (0 off, 8 def), AST: 4, TO: 4
TEAM FOULS: 9 [Team_037 in BONUS]


Team_037
--------------------------------------------------------------------------------
Player                MIN  PTS  REB  AST  TO      FG   FG%      3P   3P%
--------------------------------------------------------------------------------
Scottie Jackson        28   14    4    2   0   6/7    85.7     0/0   0.0
Giannis Middleton      28   10    0    0   0   4/6    66.7     0/0   0.0
RJ Mitchell            25    7    0    0   0   3/4    75.0     0/0   0.0
Collin Young           25    6    2    2   0   3/3   100.0     0/0   0.0
Jarrett Tatum          25    3    1    1   0   1/5    20.0     0/0   0.0

TEAM: FG: 17/25 (68.0%), 3PT: 4/10 (40.0%), REB: 7 (2 off, 5 def), AST: 5, TO: 0
TEAM FOULS: 11 [Team_082 in BONUS]

================================================================================

================================================================================
                       4TH QUARTER - Team_082 vs Team_037                       
================================================================================

[12:00] Team_082 possession (Score: 84-84)
Kristaps Fox attempts a 3Pt. Contested by Scottie Jackson (3.9 feet, ZONE). KRISTAPS FOX MAKES IT! Assist: Julius Carter
Score: 87-84

[11:47] Team_037 possession (Score: 87-84)
RJ Mitchell attempts a 3Pt. Contested by Julius Anthony (5.0 feet, MAN). RJ Mitchell misses. Rebound secured by Dwyane O'Neal.

[11:37] Team_082 possession (Score: 87-84)
Julius Anthony drives to the basket... Julius Anthony throws a bad pass! Stolen by Scottie Jackson! TURNOVER! (live ball)

[11:26] Team_037 possession (Score: 87-84)
FOUL! Holding foul on Julius Anthony. [Team fouls: 1] No free throws, side out. (Julius Anthony: 1 personal fouls)

[11:08] Team_037 possession (Score: 87-84)
FOUL! Reach-in foul on Jrue Green during the drive. [Team fouls: 2] No free throws, side out. (Jrue Green: 1 personal fouls)

[10:52] Team_037 possession (Score: 87-84)
Scottie Jackson attempts a 3Pt. Contested by Dwyane O'Neal (4.3 feet, ZONE). SCOTTIE JACKSON MAKES IT! Assist: Collin Young
Score: 87-87

[10:36] Team_082 possession (Score: 87-87)
Julius Carter attempts a Midrange. Contested by Scottie Jackson (4.3 feet, ZONE). JULIUS CARTER MAKES IT!
Score: 89-87

[10:23] Team_037 possession (Score: 89-87)
RJ Mitchell attempts a 3Pt. Contested by Julius Anthony (5.2 feet, MAN). RJ Mitchell misses. Rebound secured by Julius Carter.

[10:08] Team_082 possession (Score: 89-87)
FOUL! Reach-in foul on Scottie Jackson during the drive. [Team fouls: 1] No free throws, side out. (Scottie Jackson: 1 personal fouls)

[09:53] Team_082 possession (Score: 89-87)
Julius Carter attempts a Layup. Contested by Collin Young (5.0 feet, MAN). Julius Carter misses. FOUL! Loose ball foul on Collin Young during the rebound battle. [Team fouls: 2] No free throws, side out. (Collin Young: 1 personal fouls)

[09:36] Team_082 possession (Score: 89-87)
Kristaps Fox attempts a 3Pt. Contested by Jarrett Tatum (4.6 feet, MAN). KRISTAPS FOX MAKES IT! Assist: Julius Carter
Score: 92-87

[09:22] Team_037 possession (Score: 92-87)
RJ Mitchell attempts a 3Pt. Contested by Dwyane O'Neal (4.1 feet, ZONE). RJ Mitchell misses. Rebound secured by Jrue Green.

[09:08] Team_082 possession (Score: 92-87)
Jrue Green attempts a 3Pt. Contested by Scottie Jackson (4.4 feet, MAN). Jrue Green misses. Offensive rebound by Jrue Green! Jrue Green kicks it out.

[08:55] Team_082 possession (Score: 92-87)
Jrue Green attempts a 3Pt. Contested by Scottie Jackson (4.4 feet, MAN). Jrue Green misses. Offensive rebound by Jrue Green! Jrue Green kicks it out.

[08:38] Team_082 possession (Score: 92-87)
Jrue Green attempts a Midrange. Contested by Scottie Jackson (4.5 feet, MAN). JRUE GREEN MAKES IT! Assist: Dwyane O'Neal
Score: 94-87

[08:24] Team_037 possession (Score: 94-87)
Giannis Middleton drives to the basket... Giannis Middleton loses the ball! Stripped by Dwyane O'Neal! TURNOVER! (live ball)

[08:10] Team_082 possession (Score: 94-87)
Julius Anthony drives and kicks out. Julius Anthony attempts a Midrange. Contested by Giannis Middleton (4.8 feet, ZONE). Julius Anthony misses. FOUL! Loose ball foul on Jarrett Tatum during the rebound battle. [Team fouls: 3] No free throws, side out. (Jarrett Tatum: 1 personal fouls)

[07:58] Team_082 possession (Score: 94-87)
Julius Carter drives to the basket... FOUL! Offensive foul on Julius Carter! Scottie Jackson drew the charge! [Team fouls: 3] (Julius Carter: 1 personal fouls) TURNOVER! (dead ball)

[07:41] Team_037 possession (Score: 94-87)
Scottie Jackson drives to the basket... FOUL! Offensive foul on Scottie Jackson! Jrue Green drew the charge! [Team fouls: 4] (Scottie Jackson: 2 personal fouls) TURNOVER! (dead ball)

[07:32] Team_082 possession (Score: 94-87)
Kristaps Fox attempts a 3Pt. Contested by Scottie Jackson (4.4 feet, ZONE). Kristaps Fox misses. Rebound secured by Collin Young.

[07:20] Team_037 possession (Score: 94-87)
Scottie Jackson attempts a 3Pt. Wide open! Jrue Green is 6.3 feet away. [MAN] SCOTTIE JACKSON MAKES IT! Assist: RJ Mitchell
Score: 94-90

[07:04] Team_082 possession (Score: 94-90)
Dwyane O'Neal attempts a Midrange. Contested by Giannis Middleton (4.8 feet, ZONE). DWYANE O'NEAL MAKES IT!
Score: 96-90

[06:49] Team_037 possession (Score: 96-90)
RJ Mitchell attempts a 3Pt. Contested by Dwyane O'Neal (4.5 feet, ZONE). RJ MITCHELL MAKES IT! Assist: Scottie Jackson
Score: 96-93

[06:38] Team_082 possession (Score: 96-93)
Jrue Green attempts a 3Pt. Contested by Scottie Jackson (4.7 feet, ZONE). Jrue Green misses. Rebound secured by Scottie Jackson.

[06:23] Team_037 possession (Score: 96-93)
Jarrett Tatum attempts a 3Pt. Contested by Kristaps Fox (5.4 feet, MAN). Jarrett Tatum misses. Rebound secured by Dwyane O'Neal.

[06:09] Team_082 possession (Score: 96-93)
Julius Carter attempts a Midrange. Contested by Giannis Middleton (5.3 feet, ZONE). Julius Carter misses. Offensive rebound by Julius Carter! Julius Carter kicks it out.

[05:56] Team_082 possession (Score: 96-93)
Julius Carter attempts a 3Pt. Contested by Collin Young (5.6 feet, MAN). JULIUS CARTER MAKES IT! Assist: Kristaps Fox
Score: 99-93

[05:41] Team_037 possession (Score: 99-93)
RJ Mitchell drives, picks up Julius Anthony. Help arrives from Dwyane O'Neal! RJ Mitchell attempts a Layup. Contested by Dwyane O'Neal (5.8 feet, MAN). RJ MITCHELL MAKES IT! Assist: Giannis Middleton
Score: 99-95

[05:29] Team_082 possession (Score: 99-95)
Julius Carter attempts a 3Pt. Contested by Scottie Jackson (5.0 feet, ZONE). Julius Carter misses. Rebound secured by Collin Young.

[05:17] Team_037 possession (Score: 99-95)
Scottie Jackson drives to the basket... Scottie Jackson loses control! Ball rolls out of bounds! TURNOVER! (dead ball)

[05:17] Substitution (Team_082): Julius Anthony OUT → Jordan Rozier IN (stamina_rule2)

[05:17] Substitution (Team_082): Dwyane O'Neal OUT → Kawhi Poole IN (stamina_rule2)

[05:17] Substitution (Team_082): Kristaps Fox OUT → Shaquille Griffin IN (stamina_rule2)

[05:17] Substitution (Team_082): Jrue Green OUT → Tony Jokic IN (stamina_rule2)

[05:17] Substitution (Team_082): Julius Carter OUT → D'Angelo Parker IN (stamina_rule2)

[05:17] Substitution (Team_037): RJ Mitchell OUT → Jarrett Randle IN (stamina_rule2)

[05:17] Substitution (Team_037): Giannis Middleton OUT → Collin Trent IN (stamina_rule2)

[05:17] Substitution (Team_037): Jarrett Tatum OUT → Julius Bird IN (stamina_rule2)

[05:17] Substitution (Team_037): Scottie Jackson OUT → Russell Anthony IN (stamina_rule2)

[05:17] Substitution (Team_037): Collin Young OUT → Wendell Herro IN (stamina_rule2)

[05:01] Team_082 possession (Score: 99-95)
FOUL! Holding foul on Julius Bird. [IN THE BONUS! 5 team fouls] Shaquille Griffin to the line for 2 free throws. (Julius Bird: 1 personal fouls)   FT 1/2: GOOD   FT 2/2: GOOD Shaquille Griffin makes 2/2 from the line.
Score: 101-95

[04:42] Team_037 possession (Score: 101-95)
Jarrett Randle attempts a 3Pt. Contested by Kawhi Poole (5.6 feet, ZONE). Jarrett Randle misses. FOUL! Loose ball foul on Shaquille Griffin during the rebound battle. [Team fouls: 4] No free throws, side out. (Shaquille Griffin: 1 personal fouls)

[04:24] Team_037 possession (Score: 101-95)
Wendell Herro attempts a Midrange. Contested by D'Angelo Parker (5.3 feet, MAN). Wendell Herro misses. Rebound secured by D'Angelo Parker.

[04:14] Team_082 possession (Score: 101-95)
D'Angelo Parker drives and kicks out. D'Angelo Parker attempts a 3Pt. Contested by Jarrett Randle (3.8 feet, ZONE). D'Angelo Parker misses. Rebound secured by Julius Bird.

[03:58] Team_037 possession (Score: 101-95)
Jarrett Randle attempts a 3Pt. Contested by Kawhi Poole (5.6 feet, ZONE). JARRETT RANDLE MAKES IT! Assist: Collin Trent
Score: 101-98

[03:43] Team_082 possession (Score: 101-98)
Jordan Rozier attempts a 3Pt. Contested by Jarrett Randle (4.0 feet, ZONE). Jordan Rozier misses. Rebound secured by Wendell Herro.

[03:28] Team_037 possession (Score: 101-98)
Russell Anthony makes the 3Pt and draws the foul on Kawhi Poole! And-1! Russell Anthony to the line for 1. [BONUS: 5 team fouls] (Kawhi Poole: 1 personal fouls)   FT 1/1: GOOD Russell Anthony makes 1/1 from the line.
Score: 101-102

[03:10] Team_082 possession (Score: 101-102)
Jordan Rozier drives to the basket... FOUL! Offensive foul on Jordan Rozier! Jarrett Randle drew the charge! [Team fouls: 6] (Jordan Rozier: 1 personal fouls) TURNOVER! (dead ball)

[02:55] Team_037 possession (Score: 101-102)
Collin Trent attempts a 3Pt. Contested by Kawhi Poole (5.8 feet, MAN). Collin Trent misses. Rebound secured by Shaquille Griffin.

[02:43] Team_082 possession (Score: 101-102)
Tony Jokic attempts a 3Pt. Contested by Jarrett Randle (3.6 feet, ZONE). TONY JOKIC MAKES IT! Assist: Jordan Rozier
Score: 104-102

[02:30] Team_037 possession (Score: 104-102)
Jarrett Randle attempts a 3Pt. Contested by Kawhi Poole (5.6 feet, ZONE). Jarrett Randle misses. Rebound secured by D'Angelo Parker.

[02:16] Team_082 possession (Score: 104-102)
Tony Jokic attempts a Layup. BLOCKED BY COLLIN TRENT! Ball is loose! Rebound secured by Wendell Herro.

[02:02] Team_037 possession (Score: 104-102)
Jarrett Randle attempts a 3Pt. Contested by Kawhi Poole (5.6 feet, ZONE). Jarrett Randle misses. Rebound secured by Shaquille Griffin.

[01:47] Team_082 possession (Score: 104-102)
Kawhi Poole drives, Russell Anthony stays with him. Kawhi Poole attempts a Dunk. Contested by Russell Anthony (4.3 feet, ZONE). Kawhi Poole misses. Rebound secured by Wendell Herro.

[01:33] Team_037 possession (Score: 104-102)
Jarrett Randle drives and kicks out. Wendell Herro attempts a 3Pt. Contested by D'Angelo Parker (5.0 feet, MAN). Wendell Herro misses. Rebound secured by Tony Jokic.

[01:18] Team_082 possession (Score: 104-102)
FOUL! Reach-in foul on Russell Anthony during the drive. [IN THE BONUS! 6 team fouls] Shaquille Griffin to the line for 2 free throws. (Russell Anthony: 1 personal fouls)   FT 1/2: MISS   FT 2/2: GOOD Shaquille Griffin makes 1/2 from the line.
Score: 105-102

[01:02] Team_037 possession (Score: 105-102)
Wendell Herro drives to the basket... Wendell Herro loses control! Ball rolls out of bounds! TURNOVER! (dead ball)

[00:52] Team_082 possession (Score: 105-102)
Tony Jokic attempts a 3Pt. Contested by Russell Anthony (3.5 feet, MAN). Tony Jokic misses. Rebound secured by Russell Anthony.

[00:37] Team_037 possession (Score: 105-102)
Julius Bird attempts a 3Pt. Contested by Shaquille Griffin (5.1 feet, MAN). JULIUS BIRD MAKES IT! Assist: Collin Trent
Score: 105-105

[00:24] Team_082 possession (Score: 105-105)
Tony Jokic attempts a 3Pt. Contested by Jarrett Randle (3.6 feet, ZONE). Tony Jokic misses. Rebound secured by Julius Bird.

[00:12] Team_037 possession (Score: 105-105)
Collin Trent makes the Dunk and draws the foul on D'Angelo Parker! And-1! Collin Trent to the line for 1. [BONUS: 7 team fouls] (D'Angelo Parker: 1 personal fouls)   FT 1/1: GOOD Collin Trent makes 1/1 from the line.
Score: 105-108

================================================================================
                              4TH QUARTER COMPLETE                              
================================================================================

4TH QUARTER SCORE: Team_082 21, Team_037 24

BOX SCORE:
================================================================================

Team_082
--------------------------------------------------------------------------------
Player                MIN  PTS  REB  AST  TO      FG   FG%      3P   3P%
--------------------------------------------------------------------------------
Kristaps Fox           32    6    0    1   0   2/3    66.7     0/0   0.0
Julius Carter          32    5    2    2   0   2/3    66.7     0/0   0.0
Shaquille Griffin      16    3    2    0   0   2/2   100.0     0/0   0.0
Tony Jokic             16    3    1    0   0   1/4    25.0     0/0   0.0
Dwyane O'Neal          32    2    2    1   0   1/1   100.0     0/0   0.0
Jrue Green             32    2    5    0   0   1/2    50.0     0/0   0.0
D'Angelo Parker        16    0    2    0   0   0/1     0.0     0/0   0.0
Jordan Rozier          17    0    0    1   0   0/1     0.0     0/0   0.0
Kawhi Poole            17    0    0    0   0   0/1     0.0     0/0   0.0

TEAM: FG: 9/18 (50.0%), 3PT: 4/10 (40.0%), REB: 14 (5 off, 9 def), AST: 5, TO: 3
TEAM FOULS: 7 [Team_037 in BONUS]


Team_037
--------------------------------------------------------------------------------
Player                MIN  PTS  REB  AST  TO      FG   FG%      3P   3P%
--------------------------------------------------------------------------------
Scottie Jackson        35    6    1    1   0   2/2   100.0     0/0   0.0
RJ Mitchell            32    5    0    1   0   2/5    40.0     0/0   0.0
Russell Anthony        14    4    2    0   0   1/1   100.0     0/0   0.0
Julius Bird            17    3    2    0   0   1/1   100.0     0/0   0.0
Jarrett Randle         17    3    0    0   0   1/4    25.0     0/0   0.0
Collin Trent           14    3    0    2   0   1/2    50.0     0/0   0.0
Collin Young           32    0    2    1   0   0/0     0.0     0/0   0.0
Jarrett Tatum          32    0    0    0   0   0/1     0.0     0/0   0.0
Giannis Middleton      35    0    0    1   0   0/0     0.0     0/0   0.0
Wendell Herro          16    0    3    0   0   0/1     0.0     0/0   0.0

TEAM: FG: 8/17 (47.1%), 3PT: 6/13 (46.2%), REB: 10 (1 off, 9 def), AST: 6, TO: 4
TEAM FOULS: 6 [Team_082 in BONUS]

================================================================================

================================================================================
                               FULL GAME COMPLETE                               
================================================================================

FINAL SCORE: Team_082 105, Team_037 108

SCORING BY QUARTER:
--------------------------------------------------------------------------------
Team                     Q1     Q2     Q3     Q4    FINAL
--------------------------------------------------------------------------------
Team_082                 28     17     39     21      105
Team_037                 21     23     40     24      108
--------------------------------------------------------------------------------

FULL GAME BOX SCORE:
================================================================================

Team_082
--------------------------------------------------------------------------------
Player                MIN  PTS  REB  AST  TO      FG   FG%      3P   3P%      FT STL BLK
--------------------------------------------------------------------------------
Julius Anthony         32   17    0    0   2   6/8    75.0   2/3    66.7   3/3     0   0
Kristaps Fox           32   26    2    3   3   9/15   60.0   3/6    50.0   7/8     0   0
Julius Carter          32    8   10    5   2   4/6    66.7   1/2    50.0   1/2     0   0
Jrue Green             32   17   13    3   0   8/10   80.0   1/2    50.0   6/6     0   0
Dwyane O'Neal          32   13    6    1   3   4/10   40.0   0/4     0.0   9/10    1   0
Kawhi Poole            17    9    0    0   0   4/9    44.4   1/4    25.0   0/0     0   0
Jordan Rozier          17    3    0    1   2   1/5    20.0   1/3    33.3   0/1     0   0
Shaquille Griffin      16    6    8    1   0   2/2   100.0   0/0     0.0   4/5     1   0
Tony Jokic             16    3    5    1   0   1/6    16.7   1/5    20.0   0/0     0   0
D'Angelo Parker        16    1    3    2   0   1/3    33.3   0/0     0.0   1/2     0   0

TEAM: FG: 44/78 (56.4%), 3PT: 10/29 (34.5%), REB: 46 (10 off, 36 def), AST: 17, TO: 12


Team_037
--------------------------------------------------------------------------------
Player                MIN  PTS  REB  AST  TO      FG   FG%      3P   3P%      FT STL BLK
--------------------------------------------------------------------------------
Giannis Middleton      35   12    0    1   1   7/10   70.0   3/5    60.0   1/1     1   0
Scottie Jackson        35   20   10    4   2   7/13   53.8   2/7    28.6   6/6     1   0
Collin Young           32   14    9    4   3   6/7    85.7   0/0     0.0   4/4     1   0
RJ Mitchell            32   19    0    2   0   7/11   63.6   3/7    42.9   0/0     1   0
Jarrett Tatum          32   13    5    1   0   5/15   33.3   3/10   30.0   2/3     0   2
Jarrett Randle         17    5    0    0   1   3/8    37.5   1/4    25.0   0/0     1   0
Julius Bird            17    3    6    0   1   1/3    33.3   1/1   100.0   0/0     0   0
Wendell Herro          16    3    8    0   0   2/4    50.0   0/0     0.0   2/4     0   0
Collin Trent           14    6    0    2   0   2/4    50.0   0/1     0.0   2/2     0   1
Russell Anthony        14   11    7    1   0   2/4    50.0   1/2    50.0   1/1     0   0

TEAM: FG: 43/80 (53.8%), 3PT: 14/37 (37.8%), REB: 45 (12 off, 33 def), AST: 15, TO: 8

================================================================================
