================================================================================
                        FULL GAME - Team_036 vs Team_073                        
================================================================================

================================================================================
                       1ST QUARTER - Team_036 vs Team_073                       
================================================================================

[12:00] Team_036 possession (Score: 0-0)
Anthony Poole attempts a Midrange. Contested by Carmelo Porzingis (4.4 feet, ZONE). Anthony Poole misses. Rebound secured by Carmelo Porzingis.

[11:51] Team_073 possession (Score: 0-0)
Isaiah Smith attempts a 3Pt. Contested by Michael Westbrook (4.8 feet, ZONE). ISAIAH SMITH MAKES IT!
Score: 0-3

[11:37] Team_036 possession (Score: 0-3)
Terry Durant attempts a Midrange. Contested by Karl Williamson (3.5 feet, ZONE). Terry Durant misses. Offensive rebound by Kobe Simmons! Kobe Simmons puts it back in!
Score: 2-3

[11:25] Team_073 possession (Score: 2-3)
Carmelo Porzingis attempts a Midrange. Contested by Terry Durant (4.6 feet, ZONE). Carmelo Porzingis misses. Rebound secured by Giannis Booker.

[11:07] Team_036 possession (Score: 2-3)
Terry Durant attempts a Midrange. Contested by Carmelo Porzingis (4.1 feet, MAN). Terry Durant misses. Rebound secured by Isaiah Smith.

[10:56] Team_073 possession (Score: 2-3)
Isaiah Smith drives, Kobe Simmons stays with him. Isaiah Smith attempts a Dunk. Contested by Kobe Simmons (3.7 feet, ZONE). ISAIAH SMITH MAKES IT! Assist: Bradley Morant
Score: 2-5

[10:46] Team_036 possession (Score: 2-5)
Michael Westbrook attempts a Layup. Contested by Carmelo Young (5.0 feet, MAN). MICHAEL WESTBROOK MAKES IT! Assist: Terry Durant
Score: 4-5

[10:31] Team_073 possession (Score: 4-5)
Isaiah Smith drives to the basket... Isaiah Smith commits a violation (traveling/carry)! TURNOVER! (dead ball)

[10:17] Team_036 possession (Score: 4-5)
Anthony Poole makes the Midrange and draws the foul on Karl Williamson! And-1! Anthony Poole to the line for 1. [Team fouls: 1] (Karl Williamson: 1 personal fouls)   FT 1/1: MISS Anthony Poole makes 0/1 from the line. Rebound secured by Isaiah Smith.
Score: 6-5

[10:05] Team_073 possession (Score: 6-5)
Carmelo Young attempts a 3Pt. Contested by Michael Westbrook (4.9 feet, MAN). Carmelo Young misses. Offensive rebound by Bradley Morant! Bradley Morant kicks it out.

[09:52] Team_073 possession (Score: 6-5)
Bradley Morant attempts a Layup. Contested by Kobe Simmons (3.8 feet, MAN). BRADLEY MORANT MAKES IT! Assist: Carmelo Young
Score: 6-7

[09:38] Team_036 possession (Score: 6-7)
Kobe Simmons attempts a 3Pt. Contested by Bradley Morant (4.3 feet, MAN). Kobe Simmons misses. Rebound secured by Bradley Morant.

[09:25] Team_073 possession (Score: 6-7)
FOUL! Reach-in foul on Kobe Simmons during the drive. [Team fouls: 1] No free throws, side out. (Kobe Simmons: 1 personal fouls)

[09:09] Team_073 possession (Score: 6-7)
Carmelo Porzingis attempts a 3Pt. Contested by Terry Durant (4.6 feet, MAN). Carmelo Porzingis misses. Offensive rebound by Carmelo Porzingis! Carmelo Porzingis kicks it out.

[08:52] Team_073 possession (Score: 6-7)
Carmelo Young drives to the basket... Carmelo Young loses control! Ball rolls out of bounds! TURNOVER! (dead ball)

[08:34] Team_036 possession (Score: 6-7)
Giannis Booker attempts a Midrange. Contested by Carmelo Porzingis (4.1 feet, ZONE). Giannis Booker misses. Rebound secured by Carmelo Porzingis.

[08:21] Team_073 possession (Score: 6-7)
FOUL! Reach-in foul on Terry Durant during the drive. [Team fouls: 2] No free throws, side out. (Terry Durant: 1 personal fouls)

[08:05] Team_073 possession (Score: 6-7)
Karl Williamson attempts a 3Pt. Contested by Michael Westbrook (4.9 feet, ZONE). Karl Williamson misses. Rebound secured by Kobe Simmons.

[07:53] Team_036 possession (Score: 6-7)
Anthony Poole loses control! Ball rolls out of bounds! TURNOVER! (dead ball)

[07:40] Team_073 possession (Score: 6-7)
Isaiah Smith attempts a Layup. Contested by Terry Durant (4.6 feet, ZONE). ISAIAH SMITH MAKES IT!
Score: 6-9

[07:27] Team_036 possession (Score: 6-9)
Michael Westbrook attempts a 3Pt. Contested by Karl Williamson (3.6 feet, ZONE). Michael Westbrook misses. FOUL! Loose ball foul on Isaiah Smith during the rebound battle. [Team fouls: 2] No free throws, side out. (Isaiah Smith: 1 personal fouls)

[07:12] Team_036 possession (Score: 6-9)
Anthony Poole attempts a 3Pt. Contested by Isaiah Smith (4.9 feet, ZONE). ANTHONY POOLE MAKES IT! Assist: Kobe Simmons
Score: 9-9

[06:57] Team_073 possession (Score: 9-9)
Carmelo Porzingis attempts a 3Pt. Contested by Terry Durant (4.6 feet, MAN). Carmelo Porzingis misses. Rebound secured by Terry Durant.

[06:43] Team_036 possession (Score: 9-9)
Kobe Simmons attempts a Layup. Contested by Bradley Morant (4.3 feet, MAN). KOBE SIMMONS MAKES IT!
Score: 11-9

[06:32] Team_073 possession (Score: 11-9)
Karl Williamson makes the Dunk and draws the foul on Terry Durant! And-1! Karl Williamson to the line for 1. [Team fouls: 3] (Terry Durant: 2 personal fouls)   FT 1/1: MISS Karl Williamson makes 0/1 from the line. Rebound secured by Kobe Simmons.
Score: 11-11

[06:16] Team_036 possession (Score: 11-11)
Terry Durant makes the Layup and draws the foul on Carmelo Porzingis! And-1! Terry Durant to the line for 1. [Team fouls: 3] (Carmelo Porzingis: 1 personal fouls)   FT 1/1: MISS Terry Durant makes 0/1 from the line. Offensive rebound by Terry Durant! Terry Durant puts it back in!
Score: 15-11

[06:05] Team_073 possession (Score: 15-11)
Isaiah Smith drives, picks up Giannis Booker. Help arrives from Anthony Poole! Isaiah Smith attempts a Dunk. Contested by Anthony Poole (4.7 feet, MAN). ISAIAH SMITH MAKES IT! Assist: Carmelo Porzingis
Score: 15-13

[05:54] Team_036 possession (Score: 15-13)
Anthony Poole drives and kicks out. Anthony Poole attempts a Midrange. Contested by Carmelo Porzingis (3.7 feet, ZONE). Anthony Poole misses. Rebound secured by Bradley Morant.

[05:37] Team_073 possession (Score: 15-13)
Karl Williamson makes the Layup and draws the foul on Giannis Booker! And-1! Karl Williamson to the line for 1. [Team fouls: 4] (Giannis Booker: 1 personal fouls)   FT 1/1: GOOD Karl Williamson makes 1/1 from the line.
Score: 15-16

[05:21] Team_036 possession (Score: 15-16)
FOUL! Reach-in foul on Bradley Morant during the drive. [Team fouls: 4] No free throws, side out. (Bradley Morant: 1 personal fouls)

[05:07] Team_036 possession (Score: 15-16)
Michael Westbrook attempts a Layup. Contested by Carmelo Young (5.1 feet, MAN). Michael Westbrook misses. Offensive rebound by Kobe Simmons! Kobe Simmons's putback is no good. Rebound secured by Isaiah Smith.

[04:51] Team_073 possession (Score: 15-16)
Carmelo Young drives and kicks out. Bradley Morant attempts a Midrange. Contested by Kobe Simmons (3.6 feet, MAN). Bradley Morant misses. Rebound secured by Kobe Simmons.

[04:38] Team_036 possession (Score: 15-16)
FOUL! Shooting foul on Carmelo Young. Giannis Booker to the line for 3 free throws. [BONUS: 5 team fouls] (Carmelo Young: 1 personal fouls)   FT 1/3: MISS   FT 2/3: MISS   FT 3/3: GOOD Giannis Booker makes 1/3 from the line.
Score: 16-16

[04:23] Team_073 possession (Score: 16-16)
FOUL! Offensive foul on Bradley Morant! Kobe Simmons drew the charge! [Team fouls: 6] (Bradley Morant: 2 personal fouls) TURNOVER! (dead ball)

[04:08] Team_036 possession (Score: 16-16)
Anthony Poole attempts a Layup. BLOCKED BY KARL WILLIAMSON! Ball is loose! Rebound secured by Bradley Morant.

[03:55] Team_073 possession (Score: 16-16)
Isaiah Smith attempts a Layup. Contested by Giannis Booker (4.8 feet, MAN). Isaiah Smith misses. Rebound secured by Giannis Booker.

[03:41] Team_036 possession (Score: 16-16)
FOUL! Reach-in foul on Bradley Morant during the drive. [IN THE BONUS! 7 team fouls] Giannis Booker to the line for 2 free throws. (Bradley Morant: 3 personal fouls)   FT 1/2: GOOD   FT 2/2: GOOD Giannis Booker makes 2/2 from the line.
Score: 18-16

[03:25] Team_073 possession (Score: 18-16)
Carmelo Porzingis drives, Terry Durant stays with him. Carmelo Porzingis attempts a Layup. Contested by Terry Durant (4.7 feet, MAN). Carmelo Porzingis misses. Rebound secured by Giannis Booker.

[03:09] Team_036 possession (Score: 18-16)
Terry Durant drives, Carmelo Porzingis stays with him. Terry Durant attempts a Layup. Contested by Carmelo Porzingis (4.3 feet, MAN). Terry Durant misses. Rebound secured by Carmelo Porzingis.

[02:56] Team_073 possession (Score: 18-16)
Bradley Morant makes the Layup and draws the foul on Kobe Simmons! And-1! Bradley Morant to the line for 1. [BONUS: 5 team fouls] (Kobe Simmons: 2 personal fouls)   FT 1/1: MISS Bradley Morant makes 0/1 from the line. Rebound secured by Terry Durant.
Score: 18-18

[02:44] Team_036 possession (Score: 18-18)
Terry Durant drives, picks up Bradley Morant. Help arrives from Isaiah Smith! Terry Durant attempts a Dunk. Contested by Isaiah Smith (4.6 feet, ZONE). Terry Durant misses. Rebound secured by Isaiah Smith.

[02:28] Team_073 possession (Score: 18-18)
FOUL! Holding foul on Michael Westbrook. [IN THE BONUS! 6 team fouls] Carmelo Young to the line for 2 free throws. (Michael Westbrook: 1 personal fouls)   FT 1/2: GOOD   FT 2/2: GOOD Carmelo Young makes 2/2 from the line.
Score: 18-20

[02:13] Team_036 possession (Score: 18-20)
FOUL! Reach-in foul on Bradley Morant during the drive. [IN THE BONUS! 8 team fouls] Kobe Simmons to the line for 2 free throws. (Bradley Morant: 4 personal fouls)   FT 1/2: MISS   FT 2/2: MISS Kobe Simmons makes 0/2 from the line. Rebound secured by Isaiah Smith.

[02:01] Team_073 possession (Score: 18-20)
Bradley Morant attempts a Layup. Contested by Kobe Simmons (4.2 feet, MAN). BRADLEY MORANT MAKES IT!
Score: 18-22

[01:50] Team_036 possession (Score: 18-22)
Giannis Booker throws a bad pass out of bounds! TURNOVER! (dead ball)

[01:50] Substitution (Team_036): Michael Westbrook OUT → Dirk Anunoby IN (stamina_rule2)

[01:50] Substitution (Team_036): Giannis Booker OUT → Tobias Fox IN (stamina_rule2)

[01:50] Substitution (Team_036): Anthony Poole OUT → Pascal Antetokounmpo IN (stamina_rule2)

[01:50] Substitution (Team_036): Terry Durant OUT → Devin Simmons IN (stamina_rule2)

[01:50] Substitution (Team_036): Kobe Simmons OUT → Bradley Murray IN (stamina_rule2)

[01:50] Substitution (Team_073): Carmelo Young OUT → Zach Quickley IN (stamina_rule2)

[01:50] Substitution (Team_073): Isaiah Smith OUT → Luka Butler IN (stamina_rule2)

[01:50] Substitution (Team_073): Karl Williamson OUT → Dwyane McCollum IN (stamina_rule2)

[01:50] Substitution (Team_073): Carmelo Porzingis OUT → Shai Thompson IN (stamina_rule2)

[01:50] Substitution (Team_073): Bradley Morant OUT → Ja Rose IN (stamina_rule2)

[01:36] Team_073 possession (Score: 18-22)
Luka Butler attempts a Layup. BLOCKED BY TOBIAS FOX! Ball is loose! Rebound secured by Devin Simmons.

[01:20] Team_036 possession (Score: 18-22)
Bradley Murray attempts a Midrange. Contested by Zach Quickley (4.4 feet, ZONE). Bradley Murray misses. Offensive rebound by Devin Simmons! Devin Simmons kicks it out.

[01:05] Team_036 possession (Score: 18-22)
Devin Simmons attempts a 3Pt. Contested by Shai Thompson (3.9 feet, MAN). DEVIN SIMMONS MAKES IT! Assist: Pascal Antetokounmpo
Score: 21-22

[00:50] Team_073 possession (Score: 21-22)
Dwyane McCollum attempts a Midrange. Contested by Pascal Antetokounmpo (4.8 feet, MAN). Dwyane McCollum misses. Offensive rebound by Ja Rose! Ja Rose kicks it out.

[00:38] Team_073 possession (Score: 21-22)
Zach Quickley attempts a 3Pt. Contested by Tobias Fox (4.8 feet, ZONE). Zach Quickley misses. Rebound secured by Bradley Murray.

[00:28] Team_036 possession (Score: 21-22)
FOUL! Offensive foul on Bradley Murray! Ja Rose drew the charge! [Team fouls: 7] (Bradley Murray: 1 personal fouls) TURNOVER! (dead ball)

[00:14] Team_073 possession (Score: 21-22)
Shai Thompson drives to the basket... FOUL! Offensive foul on Shai Thompson! Devin Simmons drew the charge! [Team fouls: 9] (Shai Thompson: 1 personal fouls) TURNOVER! (dead ball)

================================================================================
                              1ST QUARTER COMPLETE                              
================================================================================

1ST QUARTER SCORE: Team_036 21, Team_073 22

BOX SCORE:
================================================================================

Team_036
--------------------------------------------------------------------------------
Player                MIN  PTS  REB  AST  TO      FG   FG%      3P   3P%
--------------------------------------------------------------------------------
Kobe Simmons           10    4    5    1   0   2/4    50.0     0/0   0.0
Terry Durant           10    4    2    1   0   1/4    25.0     0/0   0.0
Anthony Poole          10    3    0    0   0   1/5    20.0     0/0   0.0
Giannis Booker         10    3    3    0   0   2/3    66.7     0/0   0.0
Devin Simmons           2    3    2    0   0   1/1   100.0     0/0   0.0
Michael Westbrook      10    2    0    0   0   1/2    50.0     0/0   0.0
Pascal Antetokounmpo    2    0    0    1   0   0/0     0.0     0/0   0.0
Bradley Murray          2    0    1    0   0   0/0     0.0     0/0   0.0

TEAM: FG: 8/19 (42.1%), 3PT: 3/4 (75.0%), REB: 14 (4 off, 10 def), AST: 3, TO: 3
TEAM FOULS: 7 [Team_073 in BONUS]


Team_073
--------------------------------------------------------------------------------
Player                MIN  PTS  REB  AST  TO      FG   FG%      3P   3P%
--------------------------------------------------------------------------------
Isaiah Smith           10    9    5    0   0   4/5    80.0     0/0   0.0
Bradley Morant         10    4    4    1   0   2/3    66.7     0/0   0.0
Karl Williamson        10    3    0    0   0   1/3    33.3     0/0   0.0
Carmelo Young          10    2    0    1   0   1/2    50.0     0/0   0.0
Carmelo Porzingis      10    0    4    1   0   0/3     0.0     0/0   0.0
Luka Butler             2    0    0    0   0   0/1     0.0     0/0   0.0
Ja Rose                 2    0    1    0   0   0/0     0.0     0/0   0.0
Zach Quickley           2    0    0    0   0   0/1     0.0     0/0   0.0

TEAM: FG: 8/18 (44.4%), 3PT: 1/4 (25.0%), REB: 13 (3 off, 10 def), AST: 3, TO: 4
TEAM FOULS: 9 [Team_036 in BONUS]

================================================================================

================================================================================
                       2ND QUARTER - Team_036 vs Team_073                       
================================================================================

[12:00] Team_036 possession (Score: 21-22)
Michael Westbrook attempts a Midrange. Contested by Carmelo Young (5.1 feet, MAN). Michael Westbrook misses. Rebound secured by Carmelo Porzingis.

[11:44] Team_073 possession (Score: 21-22)
Bradley Morant attempts a Midrange. Contested by Kobe Simmons (4.0 feet, MAN). Bradley Morant misses. Rebound secured by Kobe Simmons.

[11:30] Team_036 possession (Score: 21-22)
Terry Durant drives to the basket... Terry Durant throws a bad pass out of bounds! TURNOVER! (dead ball)

[11:17] Team_073 possession (Score: 21-22)
Bradley Morant drives to the basket... Bradley Morant throws a bad pass! Stolen by Kobe Simmons! TURNOVER! (live ball)

[11:02] Team_036 possession (Score: 21-22)
Anthony Poole attempts a 3Pt. Contested by Karl Williamson (4.0 feet, ZONE). Anthony Poole misses. Rebound secured by Carmelo Porzingis.

[10:51] Team_073 possession (Score: 21-22)
Karl Williamson drives to the basket... Karl Williamson loses the ball! Stripped by Anthony Poole! TURNOVER! (live ball)

[10:36] Team_036 possession (Score: 21-22)
Kobe Simmons attempts a 3Pt. Contested by Karl Williamson (3.7 feet, ZONE). KOBE SIMMONS MAKES IT! Assist: Michael Westbrook
Score: 24-22

[10:19] Team_073 possession (Score: 24-22)
Carmelo Young attempts a 3Pt. Contested by Michael Westbrook (5.1 feet, ZONE). Carmelo Young misses. Offensive rebound by Bradley Morant! Bradley Morant kicks it out.

[10:09] Team_073 possession (Score: 24-22)
Carmelo Young attempts a 3Pt. Contested by Michael Westbrook (5.1 feet, ZONE). Carmelo Young misses. Rebound secured by Kobe Simmons.

[09:54] Team_036 possession (Score: 24-22)
Anthony Poole attempts a 3Pt. Contested by Karl Williamson (4.1 feet, ZONE). Anthony Poole misses. Rebound secured by Bradley Morant.

[09:37] Team_073 possession (Score: 24-22)
Karl Williamson drives, Anthony Poole stays with him. Karl Williamson attempts a Dunk. Contested by Anthony Poole (5.4 feet, MAN). KARL WILLIAMSON MAKES IT!
Score: 24-24

[09:22] Team_036 possession (Score: 24-24)
Michael Westbrook throws a bad pass out of bounds! TURNOVER! (dead ball)

[09:22] Substitution (Team_036): Michael Westbrook OUT → Dirk Anunoby IN (stamina_rule2)

[09:22] Substitution (Team_036): Giannis Booker OUT → Tobias Fox IN (stamina_rule2)

[09:22] Substitution (Team_036): Anthony Poole OUT → Pascal Antetokounmpo IN (stamina_rule2)

[09:22] Substitution (Team_036): Terry Durant OUT → Devin Simmons IN (stamina_rule2)

[09:22] Substitution (Team_036): Kobe Simmons OUT → Bradley Murray IN (stamina_rule2)

[09:22] Substitution (Team_073): Carmelo Young OUT → Zach Quickley IN (stamina_rule2)

[09:22] Substitution (Team_073): Isaiah Smith OUT → Luka Butler IN (stamina_rule2)

[09:22] Substitution (Team_073): Karl Williamson OUT → Dwyane McCollum IN (stamina_rule2)

[09:22] Substitution (Team_073): Carmelo Porzingis OUT → Shai Thompson IN (stamina_rule2)

[09:22] Substitution (Team_073): Bradley Morant OUT → Ja Rose IN (stamina_rule2)

[09:06] Team_073 possession (Score: 24-24)
Luka Butler makes the Layup and draws the foul on Devin Simmons! And-1! Luka Butler to the line for 1. [Team fouls: 1] (Devin Simmons: 1 personal fouls)   FT 1/1: GOOD Luka Butler makes 1/1 from the line.
Score: 24-27

[08:54] Team_036 possession (Score: 24-27)
Bradley Murray attempts a Midrange. Contested by Dwyane McCollum (4.0 feet, ZONE). Bradley Murray misses. Rebound secured by Ja Rose.

[08:41] Team_073 possession (Score: 24-27)
Luka Butler drives and kicks out. Zach Quickley attempts a 3Pt. Contested by Dirk Anunoby (5.5 feet, MAN). ZACH QUICKLEY MAKES IT! Assist: Dwyane McCollum
Score: 24-30

[08:28] Team_036 possession (Score: 24-30)
Tobias Fox attempts a 3Pt. Contested by Luka Butler (4.8 feet, MAN). TOBIAS FOX MAKES IT! Assist: Devin Simmons
Score: 27-30

[08:10] Team_073 possession (Score: 27-30)
Luka Butler attempts a Midrange. BLOCKED BY TOBIAS FOX! Ball is loose! Rebound secured by Pascal Antetokounmpo.

[07:55] Team_036 possession (Score: 27-30)
Pascal Antetokounmpo attempts a Midrange. Contested by Dwyane McCollum (4.4 feet, MAN). Pascal Antetokounmpo misses. Rebound secured by Dwyane McCollum.

[07:41] Team_073 possession (Score: 27-30)
Zach Quickley commits a violation (traveling/carry)! TURNOVER! (dead ball)

[07:22] Team_036 possession (Score: 27-30)
FOUL! Holding foul on Shai Thompson. [Team fouls: 1] No free throws, side out. (Shai Thompson: 1 personal fouls)

[07:05] Team_036 possession (Score: 27-30)
Devin Simmons attempts a Layup. Contested by Shai Thompson (3.9 feet, MAN). Devin Simmons misses. Rebound secured by Shai Thompson.

[06:49] Team_073 possession (Score: 27-30)
Shai Thompson attempts a Layup. Contested by Devin Simmons (5.4 feet, ZONE). Shai Thompson misses. Rebound secured by Bradley Murray.

[06:34] Team_036 possession (Score: 27-30)
Dirk Anunoby throws a bad pass out of bounds! TURNOVER! (dead ball)

[06:18] Team_073 possession (Score: 27-30)
Dwyane McCollum makes the Layup and draws the foul on Devin Simmons! And-1! Dwyane McCollum to the line for 1. [Team fouls: 2] (Devin Simmons: 2 personal fouls)   FT 1/1: GOOD Dwyane McCollum makes 1/1 from the line.
Score: 27-33

[06:04] Team_036 possession (Score: 27-33)
Bradley Murray drives to the basket... Bradley Murray commits a violation (traveling/carry)! TURNOVER! (dead ball)

[05:51] Team_073 possession (Score: 27-33)
Shai Thompson attempts a 3Pt. Contested by Devin Simmons (5.4 feet, MAN). Shai Thompson misses. Rebound secured by Pascal Antetokounmpo.

[05:32] Team_036 possession (Score: 27-33)
Bradley Murray attempts a Midrange. Contested by Ja Rose (5.5 feet, MAN). Bradley Murray misses. Rebound secured by Ja Rose.

[05:18] Team_073 possession (Score: 27-33)
Ja Rose attempts a 3Pt. Contested by Tobias Fox (4.7 feet, ZONE). Ja Rose misses. Rebound secured by Pascal Antetokounmpo.

[05:03] Team_036 possession (Score: 27-33)
FOUL! Shooting foul on Shai Thompson. Devin Simmons to the line for 2 free throws. [Team fouls: 2] (Shai Thompson: 2 personal fouls)   FT 1/2: MISS   FT 2/2: GOOD Devin Simmons makes 1/2 from the line.
Score: 28-33

[04:48] Team_073 possession (Score: 28-33)
Zach Quickley drives and kicks out. Ja Rose attempts a 3Pt. Contested by Tobias Fox (4.5 feet, ZONE). Ja Rose misses. Rebound secured by Bradley Murray.

[04:37] Team_036 possession (Score: 28-33)
Pascal Antetokounmpo makes the Layup and draws the foul on Dwyane McCollum! And-1! Pascal Antetokounmpo to the line for 1. [Team fouls: 3] (Dwyane McCollum: 1 personal fouls)   FT 1/1: GOOD Pascal Antetokounmpo makes 1/1 from the line.
Score: 31-33

[04:20] Team_073 possession (Score: 31-33)
Dwyane McCollum attempts a 3Pt. Contested by Pascal Antetokounmpo (4.8 feet, MAN). Dwyane McCollum misses. Rebound secured by Pascal Antetokounmpo.

[04:04] Team_036 possession (Score: 31-33)
Bradley Murray drives to the basket... Bradley Murray throws a bad pass! Stolen by Ja Rose! TURNOVER! (live ball)

[03:55] Team_073 possession (Score: 31-33)
Ja Rose attempts a Layup. Contested by Bradley Murray (4.8 feet, MAN). JA ROSE MAKES IT! Assist: Dwyane McCollum
Score: 31-35

[03:37] Team_036 possession (Score: 31-35)
FOUL! Reach-in foul on Shai Thompson during the drive. [Team fouls: 4] No free throws, side out. (Shai Thompson: 3 personal fouls)

[03:25] Team_036 possession (Score: 31-35)
Tobias Fox attempts a Midrange. Contested by Luka Butler (4.8 feet, ZONE). TOBIAS FOX MAKES IT! Assist: Pascal Antetokounmpo
Score: 33-35

[03:08] Team_073 possession (Score: 33-35)
Zach Quickley makes the Layup and draws the foul on Dirk Anunoby! And-1! Zach Quickley to the line for 1. [Team fouls: 3] (Dirk Anunoby: 1 personal fouls)   FT 1/1: GOOD Zach Quickley makes 1/1 from the line.
Score: 33-38

[02:53] Team_036 possession (Score: 33-38)
Tobias Fox attempts a 3Pt. Contested by Luka Butler (4.9 feet, ZONE). TOBIAS FOX MAKES IT! Assist: Devin Simmons
Score: 36-38

[02:40] Team_073 possession (Score: 36-38)
Luka Butler attempts a 3Pt. Contested by Tobias Fox (5.1 feet, MAN). Luka Butler misses. Rebound secured by Pascal Antetokounmpo.

[02:27] Team_036 possession (Score: 36-38)
FOUL! Shooting foul on Luka Butler. Pascal Antetokounmpo to the line for 3 free throws. [BONUS: 5 team fouls] (Luka Butler: 1 personal fouls)   FT 1/3: GOOD   FT 2/3: GOOD   FT 3/3: GOOD Pascal Antetokounmpo makes 3/3 from the line.
Score: 39-38

[02:10] Team_073 possession (Score: 39-38)
Ja Rose drives and kicks out. Zach Quickley attempts a 3Pt. Contested by Dirk Anunoby (5.6 feet, MAN). ZACH QUICKLEY MAKES IT! Assist: Dwyane McCollum
Score: 39-41

[01:59] Team_036 possession (Score: 39-41)
Devin Simmons attempts a Layup. Contested by Ja Rose (5.8 feet, ZONE). DEVIN SIMMONS MAKES IT! Assist: Bradley Murray
Score: 41-41

[01:45] Team_073 possession (Score: 41-41)
Ja Rose drives and kicks out. Shai Thompson attempts a 3Pt. Contested by Devin Simmons (5.4 feet, MAN). Shai Thompson misses. Rebound secured by Pascal Antetokounmpo.

[01:27] Team_036 possession (Score: 41-41)
Devin Simmons attempts a Layup. Contested by Shai Thompson (4.1 feet, MAN). Devin Simmons misses. Rebound secured by Dwyane McCollum.

[01:10] Team_073 possession (Score: 41-41)
Zach Quickley attempts a 3Pt. Wide open! Dirk Anunoby is 6.0 feet away. [MAN] ZACH QUICKLEY MAKES IT! Assist: Ja Rose
Score: 41-44

[00:52] Team_036 possession (Score: 41-44)
Pascal Antetokounmpo drives to the basket... Pascal Antetokounmpo loses the ball! Stripped by Dwyane McCollum! TURNOVER! (live ball)

[00:41] Team_073 possession (Score: 41-44)
FOUL! Shooting foul on Pascal Antetokounmpo. Shai Thompson to the line for 2 free throws. [Team fouls: 4] (Pascal Antetokounmpo: 1 personal fouls)   FT 1/2: MISS   FT 2/2: GOOD Shai Thompson makes 1/2 from the line.
Score: 41-45

[00:26] Team_036 possession (Score: 41-45)
Pascal Antetokounmpo attempts a Midrange. Contested by Luka Butler (5.0 feet, ZONE). Pascal Antetokounmpo misses. Offensive rebound by Devin Simmons! Devin Simmons kicks it out.

[00:11] Team_036 possession (Score: 41-45)
Dirk Anunoby attempts a Midrange. Wide open! Ja Rose is 6.2 feet away. [ZONE] Dirk Anunoby misses. Rebound secured by Dwyane McCollum.

================================================================================
                              2ND QUARTER COMPLETE                              
================================================================================

2ND QUARTER SCORE: Team_036 20, Team_073 23

BOX SCORE:
================================================================================

Team_036
--------------------------------------------------------------------------------
Player                MIN  PTS  REB  AST  TO      FG   FG%      3P   3P%
--------------------------------------------------------------------------------
Tobias Fox             11    8    0    0   0   3/3   100.0     0/0   0.0
Pascal Antetokounmpo   11    6    6    1   0   2/3    66.7     0/0   0.0
Kobe Simmons           13    3    2    0   0   1/1   100.0     0/0   0.0
Devin Simmons          11    3    1    2   0   2/4    50.0     0/0   0.0
Michael Westbrook      13    0    0    1   0   0/1     0.0     0/0   0.0
Anthony Poole          13    0    0    0   0   0/2     0.0     0/0   0.0
Bradley Murray         11    0    2    1   0   0/2     0.0     0/0   0.0
Dirk Anunoby           11    0    0    0   0   0/1     0.0     0/0   0.0

TEAM: FG: 8/17 (47.1%), 3PT: 4/6 (66.7%), REB: 11 (1 off, 10 def), AST: 5, TO: 6
TEAM FOULS: 4


Team_073
--------------------------------------------------------------------------------
Player                MIN  PTS  REB  AST  TO      FG   FG%      3P   3P%
--------------------------------------------------------------------------------
Zach Quickley          11   12    0    0   0   4/5    80.0     0/0   0.0
Luka Butler            11    3    0    0   0   1/3    33.3     0/0   0.0
Dwyane McCollum        11    3    3    3   0   1/2    50.0     0/0   0.0
Karl Williamson        13    2    0    0   0   1/1   100.0     0/0   0.0
Ja Rose                11    2    2    1   0   1/3    33.3     0/0   0.0
Shai Thompson          11    1    1    0   0   1/3    33.3     0/0   0.0
Carmelo Porzingis      13    0    2    0   0   0/0     0.0     0/0   0.0
Bradley Morant         13    0    2    0   0   0/1     0.0     0/0   0.0
Carmelo Young          13    0    0    0   0   0/1     0.0     0/0   0.0

TEAM: FG: 9/19 (47.4%), 3PT: 1/6 (16.7%), REB: 10 (1 off, 9 def), AST: 4, TO: 3
TEAM FOULS: 5 [Team_036 in BONUS]

================================================================================

================================================================================
                       3RD QUARTER - Team_036 vs Team_073                       
================================================================================

[12:00] Team_036 possession (Score: 41-45)
Michael Westbrook attempts a 3Pt. Contested by Karl Williamson (3.6 feet, ZONE). MICHAEL WESTBROOK MAKES IT!
Score: 44-45

[11:46] Team_073 possession (Score: 44-45)
Bradley Morant makes the Midrange and draws the foul on Kobe Simmons! And-1! Bradley Morant to the line for 1. [Team fouls: 1] (Kobe Simmons: 1 personal fouls)   FT 1/1: GOOD Bradley Morant makes 1/1 from the line.
Score: 44-48

[11:34] Team_036 possession (Score: 44-48)
Kobe Simmons drives to the basket... Kobe Simmons loses control! Ball rolls out of bounds! TURNOVER! (dead ball)

[11:18] Team_073 possession (Score: 44-48)
Karl Williamson makes the Layup and draws the foul on Terry Durant! And-1! Karl Williamson to the line for 1. [Team fouls: 2] (Terry Durant: 1 personal fouls)   FT 1/1: MISS Karl Williamson makes 0/1 from the line. Rebound secured by Terry Durant.
Score: 44-50

[11:01] Team_036 possession (Score: 44-50)
Michael Westbrook drives and kicks out. Terry Durant attempts a 3Pt. Contested by Carmelo Porzingis (3.7 feet, MAN). Terry Durant misses. FOUL! Loose ball foul on Bradley Morant during the rebound battle. [Team fouls: 1] No free throws, side out. (Bradley Morant: 1 personal fouls)

[10:44] Team_036 possession (Score: 44-50)
Kobe Simmons attempts a Midrange. Contested by Karl Williamson (3.5 feet, ZONE). Kobe Simmons misses. Rebound secured by Isaiah Smith.

[10:31] Team_073 possession (Score: 44-50)
Isaiah Smith makes the Layup and draws the foul on Giannis Booker! And-1! Isaiah Smith to the line for 1. [Team fouls: 3] (Giannis Booker: 1 personal fouls)   FT 1/1: GOOD Isaiah Smith makes 1/1 from the line.
Score: 44-53

[10:19] Team_036 possession (Score: 44-53)
Giannis Booker attempts a 3Pt. Contested by Isaiah Smith (4.6 feet, MAN). Giannis Booker misses. Offensive rebound by Kobe Simmons! Kobe Simmons's putback is no good. Rebound secured by Carmelo Porzingis.

[10:03] Team_073 possession (Score: 44-53)
Carmelo Young attempts a Layup. Contested by Michael Westbrook (4.9 feet, MAN). CARMELO YOUNG MAKES IT! Assist: Bradley Morant
Score: 44-55

[09:48] Team_036 possession (Score: 44-55)
Terry Durant attempts a 3Pt. Contested by Karl Williamson (3.5 feet, ZONE). Terry Durant misses. Rebound secured by Carmelo Porzingis.

[09:36] Team_073 possession (Score: 44-55)
Carmelo Porzingis makes the Dunk and draws the foul on Terry Durant! And-1! Carmelo Porzingis to the line for 1. [Team fouls: 4] (Terry Durant: 2 personal fouls)   FT 1/1: GOOD Carmelo Porzingis makes 1/1 from the line.
Score: 44-58

[09:18] Team_036 possession (Score: 44-58)
Terry Durant drives, Carmelo Porzingis stays with him. Terry Durant attempts a Layup. Contested by Carmelo Porzingis (4.1 feet, MAN). TERRY DURANT MAKES IT! Assist: Anthony Poole
Score: 46-58

[09:08] Team_073 possession (Score: 46-58)
Bradley Morant attempts a Midrange. Contested by Kobe Simmons (3.8 feet, MAN). Bradley Morant misses. FOUL! Loose ball foul on Terry Durant during the rebound battle. [IN THE BONUS! 5 team fouls] Bradley Morant to the line for 2 free throws. (Terry Durant: 3 personal fouls)   FT 1/2: MISS   FT 2/2: GOOD Bradley Morant makes 1/2 from the line.
Score: 46-59

[08:53] Team_036 possession (Score: 46-59)
FOUL! Offensive foul on Terry Durant! Carmelo Porzingis drew the charge! [Team fouls: 6] (Terry Durant: 4 personal fouls) TURNOVER! (dead ball)

[08:39] Team_073 possession (Score: 46-59)
Bradley Morant drives to the basket... Bradley Morant throws a bad pass! Stolen by Kobe Simmons! TURNOVER! (live ball)

[08:22] Team_036 possession (Score: 46-59)
Michael Westbrook attempts a 3Pt. Contested by Carmelo Young (5.0 feet, ZONE). Michael Westbrook misses. Offensive rebound by Kobe Simmons! Kobe Simmons puts it back in!
Score: 48-59

[08:12] Team_073 possession (Score: 48-59)
Carmelo Porzingis attempts a Midrange. Contested by Michael Westbrook (4.8 feet, ZONE). Carmelo Porzingis misses. FOUL! Loose ball foul on Giannis Booker during the rebound battle. [IN THE BONUS! 7 team fouls] Bradley Morant to the line for 2 free throws. (Giannis Booker: 2 personal fouls)   FT 1/2: GOOD   FT 2/2: GOOD Bradley Morant makes 2/2 from the line.
Score: 48-61

[07:57] Team_036 possession (Score: 48-61)
Terry Durant attempts a Layup. Contested by Carmelo Porzingis (4.1 feet, MAN). Terry Durant misses. Rebound secured by Bradley Morant.

[07:45] Team_073 possession (Score: 48-61)
Isaiah Smith attempts a 3Pt. Contested by Michael Westbrook (4.8 feet, ZONE). ISAIAH SMITH MAKES IT! Assist: Karl Williamson
Score: 48-64

[07:33] Team_036 possession (Score: 48-64)
FOUL! Offensive foul on Anthony Poole! Karl Williamson drew the charge! [Team fouls: 8] (Anthony Poole: 1 personal fouls) TURNOVER! (dead ball)

[07:21] Team_073 possession (Score: 48-64)
Isaiah Smith attempts a Midrange. Contested by Giannis Booker (4.7 feet, MAN). ISAIAH SMITH MAKES IT!
Score: 48-66

[07:06] Team_036 possession (Score: 48-66)
Michael Westbrook drives to the basket... FOUL! Offensive foul on Michael Westbrook! Carmelo Young drew the charge! [Team fouls: 9] (Michael Westbrook: 1 personal fouls) TURNOVER! (dead ball)

[06:52] Team_073 possession (Score: 48-66)
Bradley Morant attempts a Midrange. Contested by Kobe Simmons (3.8 feet, MAN). BRADLEY MORANT MAKES IT! Assist: Karl Williamson
Score: 48-68

[06:33] Team_036 possession (Score: 48-68)
Kobe Simmons attempts a Midrange. Contested by Bradley Morant (4.3 feet, MAN). KOBE SIMMONS MAKES IT! Assist: Michael Westbrook
Score: 50-68

[06:18] Team_073 possession (Score: 50-68)
Isaiah Smith drives and kicks out. Isaiah Smith attempts a Midrange. Contested by Kobe Simmons (3.5 feet, ZONE). ISAIAH SMITH MAKES IT! Assist: Carmelo Young
Score: 50-70

[06:00] Team_036 possession (Score: 50-70)
Giannis Booker drives, Bradley Morant stays with him. Giannis Booker attempts a Dunk. Contested by Bradley Morant (4.3 feet, ZONE). GIANNIS BOOKER MAKES IT! Assist: Terry Durant
Score: 52-70

[05:49] Team_073 possession (Score: 52-70)
Carmelo Young drives and kicks out. Carmelo Young attempts a 3Pt. Contested by Michael Westbrook (4.6 feet, ZONE). CARMELO YOUNG MAKES IT! Assist: Isaiah Smith
Score: 52-73

[05:34] Team_036 possession (Score: 52-73)
Michael Westbrook attempts a 3Pt. Contested by Carmelo Young (5.0 feet, MAN). Michael Westbrook misses. Offensive rebound by Kobe Simmons! Kobe Simmons puts it back in!
Score: 54-73

[05:18] Team_073 possession (Score: 54-73)
Bradley Morant drives, Kobe Simmons stays with him. Bradley Morant attempts a Layup. Contested by Kobe Simmons (3.9 feet, ZONE). BRADLEY MORANT MAKES IT! Assist: Carmelo Young
Score: 54-75

[05:01] Team_036 possession (Score: 54-75)
Giannis Booker drives to the basket... Giannis Booker loses control! Ball rolls out of bounds! TURNOVER! (dead ball)

[04:45] Team_073 possession (Score: 54-75)
FOUL! Reach-in foul on Kobe Simmons during the drive. [IN THE BONUS! 10 team fouls] Carmelo Porzingis to the line for 2 free throws. (Kobe Simmons: 2 personal fouls)   FT 1/2: GOOD   FT 2/2: GOOD Carmelo Porzingis makes 2/2 from the line.
Score: 54-77

[04:29] Team_036 possession (Score: 54-77)
Terry Durant commits a violation (traveling/carry)! TURNOVER! (dead ball)

[04:16] Team_073 possession (Score: 54-77)
Bradley Morant attempts a Layup. Contested by Kobe Simmons (3.9 feet, ZONE). BRADLEY MORANT MAKES IT!
Score: 54-79

[03:57] Team_036 possession (Score: 54-79)
Terry Durant attempts a 3Pt. Contested by Karl Williamson (3.6 feet, ZONE). Terry Durant misses. Offensive rebound by Terry Durant! Terry Durant puts it back in!
Score: 56-79

[03:40] Team_073 possession (Score: 56-79)
Bradley Morant attempts a 3Pt. Contested by Kobe Simmons (4.0 feet, MAN). BRADLEY MORANT MAKES IT! Assist: Karl Williamson
Score: 56-82

[03:23] Team_036 possession (Score: 56-82)
Anthony Poole drives, picks up Karl Williamson. Help arrives from Isaiah Smith! Anthony Poole attempts a Layup. Contested by Isaiah Smith (3.9 feet, MAN). ANTHONY POOLE MAKES IT!
Score: 58-82

[03:08] Team_073 possession (Score: 58-82)
Carmelo Young attempts a Layup. Contested by Kobe Simmons (3.9 feet, ZONE). Carmelo Young misses. Rebound secured by Terry Durant.

[02:51] Team_036 possession (Score: 58-82)
Kobe Simmons attempts a Midrange. Contested by Bradley Morant (4.4 feet, MAN). Kobe Simmons misses. Rebound secured by Carmelo Porzingis.

[02:38] Team_073 possession (Score: 58-82)
Isaiah Smith attempts a Layup. Contested by Giannis Booker (4.9 feet, MAN). ISAIAH SMITH MAKES IT!
Score: 58-84

[02:22] Team_036 possession (Score: 58-84)
Michael Westbrook drives to the basket... Michael Westbrook commits a violation (traveling/carry)! TURNOVER! (dead ball)

[02:22] Substitution (Team_036): Terry Durant OUT → Devin Simmons IN (stamina_rule2)

[02:22] Substitution (Team_036): Kobe Simmons OUT → Bradley Murray IN (stamina_rule2)

[02:22] Substitution (Team_073): Carmelo Young OUT → Zach Quickley IN (stamina_rule2)

[02:10] Team_073 possession (Score: 58-84)
Isaiah Smith attempts a 3Pt. Contested by Giannis Booker (4.9 feet, MAN). Isaiah Smith misses. Rebound secured by Devin Simmons.

[01:53] Team_036 possession (Score: 58-84)
Giannis Booker throws a bad pass out of bounds! TURNOVER! (dead ball)

[01:53] Substitution (Team_036): Michael Westbrook OUT → Dirk Anunoby IN (stamina_rule2)

[01:53] Substitution (Team_036): Anthony Poole OUT → Pascal Antetokounmpo IN (stamina_rule2)

[01:53] Substitution (Team_073): Isaiah Smith OUT → Luka Butler IN (stamina_rule2)

[01:53] Substitution (Team_073): Karl Williamson OUT → Dwyane McCollum IN (stamina_rule2)

[01:53] Substitution (Team_073): Carmelo Porzingis OUT → Shai Thompson IN (stamina_rule2)

[01:53] Substitution (Team_073): Bradley Morant OUT → Ja Rose IN (stamina_rule2)

[01:41] Team_073 possession (Score: 58-84)
Ja Rose attempts a 3Pt. Contested by Pascal Antetokounmpo (4.9 feet, ZONE). Ja Rose misses. Offensive rebound by Ja Rose! Ja Rose kicks it out.

[01:26] Team_073 possession (Score: 58-84)
Shai Thompson attempts a Midrange. Contested by Devin Simmons (5.4 feet, MAN). Shai Thompson misses. Rebound secured by Devin Simmons.

[01:12] Team_036 possession (Score: 58-84)
Dirk Anunoby attempts a Midrange. Contested by Shai Thompson (4.2 feet, ZONE). DIRK ANUNOBY MAKES IT! Assist: Pascal Antetokounmpo
Score: 60-84

[00:55] Team_073 possession (Score: 60-84)
Dwyane McCollum commits a violation (traveling/carry)! TURNOVER! (dead ball)

[00:55] Substitution (Team_036): Giannis Booker OUT → Tobias Fox IN (stamina_rule2)

[00:40] Team_036 possession (Score: 60-84)
Dirk Anunoby attempts a 3Pt. Contested by Zach Quickley (4.9 feet, MAN). DIRK ANUNOBY MAKES IT! Assist: Bradley Murray
Score: 63-84

[00:24] Team_073 possession (Score: 63-84)
Zach Quickley attempts a Midrange. Contested by Pascal Antetokounmpo (5.1 feet, ZONE). Zach Quickley misses. Offensive rebound by Dwyane McCollum! Dwyane McCollum puts it back in!
Score: 63-86

[00:13] Team_036 possession (Score: 63-86)
Dirk Anunoby drives, Shai Thompson stays with him. Dirk Anunoby attempts a Dunk. Contested by Shai Thompson (4.2 feet, ZONE). DIRK ANUNOBY MAKES IT!
Score: 65-86

================================================================================
                              3RD QUARTER COMPLETE                              
================================================================================

3RD QUARTER SCORE: Team_036 24, Team_073 41

BOX SCORE:
================================================================================

Team_036
--------------------------------------------------------------------------------
Player                MIN  PTS  REB  AST  TO      FG   FG%      3P   3P%
--------------------------------------------------------------------------------
Dirk Anunoby           13    7    0    0   0   3/3   100.0     0/0   0.0
Kobe Simmons           23    6    3    0   0   3/5    60.0     0/0   0.0
Terry Durant           23    4    3    1   0   2/4    50.0     0/0   0.0
Michael Westbrook      24    3    0    1   0   1/1   100.0     0/0   0.0
Giannis Booker         25    2    0    0   0   1/2    50.0     0/0   0.0
Anthony Poole          24    2    0    1   0   1/1   100.0     0/0   0.0
Devin Simmons          13    0    2    0   0   0/0     0.0     0/0   0.0
Pascal Antetokounmpo   13    0    0    1   0   0/0     0.0     0/0   0.0
Bradley Murray         13    0    0    1   0   0/0     0.0     0/0   0.0

TEAM: FG: 11/16 (68.8%), 3PT: 5/7 (71.4%), REB: 9 (5 off, 4 def), AST: 5, TO: 8
TEAM FOULS: 10 [Team_073 in BONUS]


Team_073
--------------------------------------------------------------------------------
Player                MIN  PTS  REB  AST  TO      FG   FG%      3P   3P%
--------------------------------------------------------------------------------
Bradley Morant         24   15    1    1   0   7/7   100.0     0/0   0.0
Isaiah Smith           24   12    1    1   0   5/6    83.3     0/0   0.0
Carmelo Porzingis      24    5    3    0   0   2/2   100.0     0/0   0.0
Carmelo Young          23    5    0    2   0   2/3    66.7     0/0   0.0
Dwyane McCollum        13    2    1    0   0   1/1   100.0     0/0   0.0
Karl Williamson        24    0    0    3   0   0/1     0.0     0/0   0.0
Ja Rose                13    0    1    0   0   0/0     0.0     0/0   0.0
Shai Thompson          13    0    0    0   0   0/1     0.0     0/0   0.0

TEAM: FG: 17/21 (81.0%), 3PT: 2/3 (66.7%), REB: 6 (2 off, 4 def), AST: 7, TO: 2
TEAM FOULS: 1

================================================================================

================================================================================
                       4TH QUARTER - Team_036 vs Team_073                       
================================================================================

[12:00] Substitution (Team_036): Michael Westbrook OUT (stamina: 78) → Dirk Anunoby IN (comeback_detected)

[12:00] Substitution (Team_073): Carmelo Young OUT (stamina: 79) → Zach Quickley IN (comeback_detected)

[12:00] Team_036 possession (Score: 65-86)
Dirk Anunoby attempts a Midrange. Contested by Zach Quickley (4.9 feet, MAN). Dirk Anunoby misses. Offensive rebound by Kobe Simmons! Kobe Simmons's putback is no good. Rebound secured by Bradley Morant.

[11:42] Team_073 possession (Score: 65-86)
Isaiah Smith attempts a 3Pt. Contested by Giannis Booker (4.9 feet, ZONE). Isaiah Smith misses. Rebound secured by Kobe Simmons.

[11:28] Team_036 possession (Score: 65-86)
Kobe Simmons attempts a 3Pt. Contested by Karl Williamson (3.5 feet, ZONE). KOBE SIMMONS MAKES IT! Assist: Terry Durant
Score: 68-86

[11:12] Team_073 possession (Score: 68-86)
Zach Quickley attempts a 3Pt. Contested by Giannis Booker (5.0 feet, ZONE). Zach Quickley misses. Rebound secured by Terry Durant.

[10:53] Team_036 possession (Score: 68-86)
Giannis Booker drives, picks up Bradley Morant. Help arrives from Isaiah Smith! Giannis Booker attempts a Dunk. Contested by Isaiah Smith (4.4 feet, ZONE). Giannis Booker misses. Rebound secured by Isaiah Smith.

[10:35] Team_073 possession (Score: 68-86)
Zach Quickley makes the 3Pt and draws the foul on Giannis Booker! And-1! Zach Quickley to the line for 1. [Team fouls: 1] (Giannis Booker: 1 personal fouls)   FT 1/1: MISS Zach Quickley makes 0/1 from the line. Offensive rebound by Carmelo Porzingis! Carmelo Porzingis kicks it out.
Score: 68-89

[10:22] Team_073 possession (Score: 68-89)
Zach Quickley attempts a 3Pt. Contested by Dirk Anunoby (5.8 feet, MAN). Zach Quickley misses. Rebound secured by Kobe Simmons.

[10:08] Team_036 possession (Score: 68-89)
Terry Durant drives and kicks out. Kobe Simmons attempts a 3Pt. Contested by Bradley Morant (4.1 feet, MAN). Kobe Simmons misses. Rebound secured by Bradley Morant.

[09:51] Team_073 possession (Score: 68-89)
Bradley Morant attempts a Midrange. Contested by Kobe Simmons (4.0 feet, MAN). Bradley Morant misses. Rebound secured by Anthony Poole.

[09:39] Team_036 possession (Score: 68-89)
Kobe Simmons attempts a Midrange. Contested by Bradley Morant (4.5 feet, MAN). Kobe Simmons misses. Offensive rebound by Kobe Simmons! Kobe Simmons puts it back in!
Score: 70-89

[09:23] Team_073 possession (Score: 70-89)
Bradley Morant attempts a 3Pt. Contested by Giannis Booker (5.2 feet, ZONE). Bradley Morant misses. Rebound secured by Kobe Simmons.

[09:10] Team_036 possession (Score: 70-89)
FOUL! Reach-in foul on Bradley Morant during the drive. [Team fouls: 1] No free throws, side out. (Bradley Morant: 1 personal fouls)

[08:59] Team_036 possession (Score: 70-89)
Dirk Anunoby attempts a Midrange. Contested by Zach Quickley (4.9 feet, MAN). Dirk Anunoby misses. Rebound secured by Carmelo Porzingis.

[08:47] Team_073 possession (Score: 70-89)
Carmelo Porzingis attempts a Midrange. Contested by Anthony Poole (5.2 feet, ZONE). CARMELO PORZINGIS MAKES IT!
Score: 70-91

[08:32] Team_036 possession (Score: 70-91)
Kobe Simmons attempts a 3Pt. Contested by Karl Williamson (3.8 feet, ZONE). Kobe Simmons misses. FOUL! Loose ball foul on Bradley Morant during the rebound battle. [Team fouls: 2] No free throws, side out. (Bradley Morant: 2 personal fouls)

[08:14] Team_036 possession (Score: 70-91)
FOUL! Reach-in foul on Bradley Morant during the drive. [Team fouls: 3] No free throws, side out. (Bradley Morant: 3 personal fouls)

[07:55] Team_036 possession (Score: 70-91)
Anthony Poole loses the ball! Stripped by Karl Williamson! TURNOVER! (live ball)

[07:44] Team_073 possession (Score: 70-91)
Karl Williamson attempts a 3Pt. Contested by Anthony Poole (5.5 feet, MAN). KARL WILLIAMSON MAKES IT! Assist: Carmelo Porzingis
Score: 70-94

[07:29] Team_036 possession (Score: 70-94)
Dirk Anunoby drives to the basket... Dirk Anunoby throws a bad pass out of bounds! TURNOVER! (dead ball)

[07:29] Substitution (Team_036): Giannis Booker OUT → Tobias Fox IN (stamina_rule2)

[07:29] Substitution (Team_036): Anthony Poole OUT → Pascal Antetokounmpo IN (stamina_rule2)

[07:29] Substitution (Team_036): Terry Durant OUT → Devin Simmons IN (stamina_rule2)

[07:29] Substitution (Team_036): Kobe Simmons OUT → Bradley Murray IN (stamina_rule2)

[07:29] Substitution (Team_073): Isaiah Smith OUT → Luka Butler IN (stamina_rule2)

[07:29] Substitution (Team_073): Karl Williamson OUT → Dwyane McCollum IN (stamina_rule2)

[07:29] Substitution (Team_073): Carmelo Porzingis OUT → Shai Thompson IN (stamina_rule2)

[07:29] Substitution (Team_073): Bradley Morant OUT → Ja Rose IN (stamina_rule2)

[07:11] Team_073 possession (Score: 70-94)
Dwyane McCollum attempts a 3Pt. Contested by Pascal Antetokounmpo (4.8 feet, MAN). Dwyane McCollum misses. Offensive rebound by Ja Rose! Ja Rose kicks it out.

[06:52] Team_073 possession (Score: 70-94)
Ja Rose attempts a Layup. BLOCKED BY DEVIN SIMMONS! Ball is loose! Offensive rebound by Dwyane McCollum! Dwyane McCollum kicks it out.

[06:41] Team_073 possession (Score: 70-94)
Shai Thompson throws a bad pass! Stolen by Devin Simmons! TURNOVER! (live ball)

[06:29] Team_036 possession (Score: 70-94)
Devin Simmons attempts a 3Pt. Contested by Shai Thompson (3.9 feet, MAN). Devin Simmons misses. Offensive rebound by Devin Simmons! Devin Simmons kicks it out.

[06:17] Team_036 possession (Score: 70-94)
Tobias Fox attempts a Midrange. Contested by Dwyane McCollum (4.5 feet, ZONE). Tobias Fox misses. Rebound secured by Dwyane McCollum.

[06:02] Team_073 possession (Score: 70-94)
Luka Butler attempts a 3Pt. Contested by Tobias Fox (5.1 feet, ZONE). Luka Butler misses. Rebound secured by Devin Simmons.

[05:50] Team_036 possession (Score: 70-94)
Pascal Antetokounmpo attempts a 3Pt. Contested by Dwyane McCollum (4.4 feet, MAN). PASCAL ANTETOKOUNMPO MAKES IT! Assist: Tobias Fox
Score: 73-94

[05:33] Team_073 possession (Score: 73-94)
Dwyane McCollum attempts a 3Pt. Contested by Pascal Antetokounmpo (4.8 feet, MAN). DWYANE MCCOLLUM MAKES IT! Assist: Ja Rose
Score: 73-97

[05:19] Team_036 possession (Score: 73-97)
Dirk Anunoby attempts a Midrange. Contested by Zach Quickley (4.9 feet, ZONE). Dirk Anunoby misses. Rebound secured by Shai Thompson.

[05:06] Team_073 possession (Score: 73-97)
Dwyane McCollum drives and kicks out. Zach Quickley attempts a 3Pt. Contested by Dirk Anunoby (5.7 feet, MAN). ZACH QUICKLEY MAKES IT! Assist: Ja Rose
Score: 73-100

[04:51] Team_036 possession (Score: 73-100)
FOUL! Reach-in foul on Shai Thompson during the drive. [Team fouls: 4] No free throws, side out. (Shai Thompson: 1 personal fouls)

[04:40] Team_036 possession (Score: 73-100)
Dirk Anunoby drives, picks up Zach Quickley. Help arrives from Luka Butler! Dirk Anunoby attempts a Layup. Contested by Luka Butler (5.0 feet, MAN). Dirk Anunoby misses. Offensive rebound by Bradley Murray! Bradley Murray kicks it out.

[04:25] Team_036 possession (Score: 73-100)
Pascal Antetokounmpo attempts a 3Pt. Contested by Luka Butler (4.7 feet, ZONE). Pascal Antetokounmpo misses. Offensive rebound by Bradley Murray! Bradley Murray kicks it out.

[04:08] Team_036 possession (Score: 73-100)
Devin Simmons drives and kicks out. Dirk Anunoby attempts a Midrange. Contested by Luka Butler (4.4 feet, ZONE). Dirk Anunoby misses. Rebound secured by Ja Rose.

[03:54] Team_073 possession (Score: 73-100)
Luka Butler attempts a 3Pt. Contested by Tobias Fox (5.1 feet, ZONE). Luka Butler misses. Rebound secured by Pascal Antetokounmpo.

[03:39] Team_036 possession (Score: 73-100)
Tobias Fox attempts a Midrange. BLOCKED BY LUKA BUTLER! Ball deflects out of bounds off Tobias Fox.

[03:27] Team_073 possession (Score: 73-100)
Luka Butler attempts a 3Pt. Contested by Tobias Fox (5.1 feet, MAN). LUKA BUTLER MAKES IT! Assist: Dwyane McCollum
Score: 73-103

[03:11] Team_036 possession (Score: 73-103)
FOUL! Reach-in foul on Luka Butler during the drive. [IN THE BONUS! 5 team fouls] Tobias Fox to the line for 2 free throws. (Luka Butler: 1 personal fouls)   FT 1/2: GOOD   FT 2/2: GOOD Tobias Fox makes 2/2 from the line.
Score: 75-103

[02:54] Team_073 possession (Score: 75-103)
Dwyane McCollum attempts a 3Pt. Contested by Tobias Fox (4.6 feet, ZONE). DWYANE MCCOLLUM MAKES IT! Assist: Shai Thompson
Score: 75-106

[02:39] Team_036 possession (Score: 75-106)
Dirk Anunoby attempts a 3Pt. Contested by Luka Butler (4.8 feet, ZONE). Dirk Anunoby misses. Offensive rebound by Devin Simmons! Devin Simmons kicks it out.

[02:25] Team_036 possession (Score: 75-106)
Devin Simmons drives, Shai Thompson stays with him. Devin Simmons attempts a Layup. Contested by Shai Thompson (3.9 feet, ZONE). Devin Simmons misses. Offensive rebound by Devin Simmons! Devin Simmons kicks it out.

[02:15] Team_036 possession (Score: 75-106)
Devin Simmons attempts a Midrange. Contested by Luka Butler (4.5 feet, ZONE). Devin Simmons misses. Offensive rebound by Bradley Murray! Bradley Murray kicks it out.

[02:02] Team_036 possession (Score: 75-106)
Pascal Antetokounmpo drives to the basket... Pascal Antetokounmpo throws a bad pass out of bounds! TURNOVER! (dead ball)

[02:02] Substitution (Team_036): Dirk Anunoby OUT → Michael Westbrook IN (starter_return_rule1)

[02:02] Substitution (Team_073): Zach Quickley OUT → Carmelo Young IN (starter_return_rule1)

[01:48] Team_073 possession (Score: 75-106)
Dwyane McCollum attempts a Midrange. Contested by Devin Simmons (5.3 feet, ZONE). Dwyane McCollum misses. Rebound secured by Pascal Antetokounmpo.

[01:35] Team_036 possession (Score: 75-106)
Pascal Antetokounmpo attempts a 3Pt. Contested by Dwyane McCollum (4.4 feet, MAN). PASCAL ANTETOKOUNMPO MAKES IT! Assist: Bradley Murray
Score: 78-106

[01:17] Team_073 possession (Score: 78-106)
Luka Butler attempts a Midrange. Contested by Tobias Fox (5.0 feet, MAN). Luka Butler misses. Rebound secured by Bradley Murray.

[01:05] Team_036 possession (Score: 78-106)
Pascal Antetokounmpo attempts a Midrange. Contested by Dwyane McCollum (4.4 feet, MAN). Pascal Antetokounmpo misses. Rebound secured by Shai Thompson.

[00:52] Team_073 possession (Score: 78-106)
Carmelo Young attempts a 3Pt. Contested by Michael Westbrook (4.9 feet, MAN). Carmelo Young misses. Offensive rebound by Ja Rose! Ja Rose kicks it out.

[00:38] Team_073 possession (Score: 78-106)
Dwyane McCollum attempts a 3Pt. BLOCKED BY MICHAEL WESTBROOK! Ball is loose! Rebound secured by Bradley Murray.

[00:26] Team_036 possession (Score: 78-106)
Bradley Murray attempts a 3Pt. Contested by Carmelo Young (4.4 feet, ZONE). Bradley Murray misses. FOUL! Loose ball foul on Dwyane McCollum during the rebound battle. [IN THE BONUS! 6 team fouls] Devin Simmons to the line for 2 free throws. (Dwyane McCollum: 1 personal fouls)   FT 1/2: GOOD   FT 2/2: MISS Devin Simmons makes 1/2 from the line. Rebound secured by Ja Rose.
Score: 79-106

[00:10] Team_073 possession (Score: 79-106)
Dwyane McCollum makes the Midrange and draws the foul on Pascal Antetokounmpo! And-1! Dwyane McCollum to the line for 1. [Team fouls: 2] (Pascal Antetokounmpo: 1 personal fouls)   FT 1/1: GOOD Dwyane McCollum makes 1/1 from the line.
Score: 79-109

================================================================================
                              4TH QUARTER COMPLETE                              
================================================================================

4TH QUARTER SCORE: Team_036 14, Team_073 23

BOX SCORE:
================================================================================

Team_036
--------------------------------------------------------------------------------
Player                MIN  PTS  REB  AST  TO      FG   FG%      3P   3P%
--------------------------------------------------------------------------------
Pascal Antetokounmpo   20    6    2    0   0   2/3    66.7     0/0   0.0
Kobe Simmons           28    5    4    0   0   2/2   100.0     0/0   0.0
Tobias Fox             19    2    0    1   0   1/3    33.3     0/0   0.0
Dirk Anunoby           23    0    0    0   0   0/3     0.0     0/0   0.0
Terry Durant           28    0    2    1   0   0/1     0.0     0/0   0.0
Giannis Booker         29    0    0    0   0   0/1     0.0     0/0   0.0
Anthony Poole          28    0    1    0   0   0/0     0.0     0/0   0.0
Ja Rose                20    0    4    2   0   0/0     0.0     0/0   0.0
Devin Simmons          20    0    4    0   0   0/1     0.0     0/0   0.0
Bradley Murray         20    0    5    1   0   0/1     0.0     0/0   0.0

TEAM: FG: 5/15 (33.3%), 3PT: 3/4 (75.0%), REB: 20 (10 off, 10 def), AST: 3, TO: 3
TEAM FOULS: 2


Team_073
--------------------------------------------------------------------------------
Player                MIN  PTS  REB  AST  TO      FG   FG%      3P   3P%
--------------------------------------------------------------------------------
Dwyane McCollum        20    9    2    1   0   3/5    60.0     0/0   0.0
Zach Quickley          23    3    0    0   0   1/3    33.3     0/0   0.0
Karl Williamson        28    3    0    0   0   1/1   100.0     0/0   0.0
Luka Butler            20    3    0    0   0   1/4    25.0     0/0   0.0
Carmelo Porzingis      28    2    2    1   0   1/1   100.0     0/0   0.0
Bradley Morant         28    0    2    0   0   0/2     0.0     0/0   0.0
Isaiah Smith           28    0    1    0   0   0/1     0.0     0/0   0.0
Shai Thompson          20    0    2    1   0   0/0     0.0     0/0   0.0

TEAM: FG: 7/17 (41.2%), 3PT: 4/11 (36.4%), REB: 11 (4 off, 7 def), AST: 5, TO: 1
TEAM FOULS: 6 [Team_036 in BONUS]

================================================================================

================================================================================
                               FULL GAME COMPLETE                               
================================================================================

FINAL SCORE: Team_036 79, Team_073 109

SCORING BY QUARTER:
--------------------------------------------------------------------------------
Team                     Q1     Q2     Q3     Q4    FINAL
--------------------------------------------------------------------------------
Team_036                 21     20     24     14       79
Team_073                 22     23     41     23      109
--------------------------------------------------------------------------------

FULL GAME BOX SCORE:
================================================================================

Team_036
--------------------------------------------------------------------------------
Player                MIN  PTS  REB  AST  TO      FG   FG%      3P   3P%      FT STL BLK
--------------------------------------------------------------------------------
Giannis Booker         29    5    3    0   4   3/6    50.0   1/2    50.0   3/5     0   0
Anthony Poole          28    5    1    1   4   2/8    25.0   1/3    33.3   0/1     1   0
Terry Durant           28    8    8    3   3   4/10   40.0   1/2    50.0   0/1     0   0
Kobe Simmons           28   18   14    1   1   5/9    55.6   2/3    66.7   0/2     2   0
Michael Westbrook      26    5    0    2   2   4/6    66.7   3/3   100.0   0/0     0   1
Dirk Anunoby           23    7    0    0   1   3/7    42.9   1/1   100.0   0/0     0   0
Devin Simmons          20    6    9    2   1   3/6    50.0   1/1   100.0   2/4     1   1
Bradley Murray         20    0    8    3   1   0/3     0.0   0/1     0.0   0/0     0   0
Pascal Antetokounmpo   20   12    8    3   2   4/6    66.7   3/3   100.0   4/4     0   0
Tobias Fox             19   10    0    1   1   4/6    66.7   2/2   100.0   2/2     0   2

TEAM: FG: 32/67 (47.8%), 3PT: 15/21 (71.4%), REB: 54 (20 off, 34 def), AST: 16, TO: 20


Team_073
--------------------------------------------------------------------------------
Player                MIN  PTS  REB  AST  TO      FG   FG%      3P   3P%      FT STL BLK
--------------------------------------------------------------------------------
Isaiah Smith           28   21    7    1   1   9/12   75.0   2/4    50.0   1/1     0   0
Karl Williamson        28    8    0    3   0   3/6    50.0   1/2    50.0   1/3     1   1
Carmelo Porzingis      28    7   11    2   0   4/7    57.1   0/1     0.0   3/3     0   0
Bradley Morant         28   19    9    2   3   8/12   66.7   1/2    50.0   4/6     0   0
Carmelo Young          25    7    0    3   2   2/5    40.0   0/1     0.0   2/2     0   0
Zach Quickley          23   15    0    0   1   3/7    42.9   1/4    25.0   1/2     0   0
Luka Butler            20    6    0    0   0   3/9    33.3   1/4    25.0   1/1     0   1
Dwyane McCollum        20   14    6    4   1   5/8    62.5   2/4    50.0   2/2     1   0
Shai Thompson          20    1    3    1   1   1/4    25.0   0/1     0.0   1/2     0   0
Ja Rose                20    2    8    3   1   2/4    50.0   0/1     0.0   0/0     1   0

TEAM: FG: 41/75 (54.7%), 3PT: 8/24 (33.3%), REB: 40 (10 off, 30 def), AST: 19, TO: 10

================================================================================
