================================================================================
                        FULL GAME - Team_048 vs Team_043                        
================================================================================

================================================================================
                       1ST QUARTER - Team_048 vs Team_043                       
================================================================================

[12:00] Team_048 possession (Score: 0-0)
Dejounte Sexton attempts a 3Pt. Contested by D'Angelo Iverson (3.6 feet, ZONE). Dejounte Sexton misses. Rebound secured by Manu Carter.

[11:49] Team_043 possession (Score: 0-0)
Manu Carter drives and kicks out. Magic Durant attempts a 3Pt. Contested by Dejounte Sexton (3.0 feet, ZONE). Magic Durant misses. Rebound secured by Dejounte Sexton.

[11:37] Team_048 possession (Score: 0-0)
Damian Mobley drives and kicks out. Karl Johnson attempts a 3Pt. Contested by Magic Durant (5.1 feet, MAN). KARL JOHNSON MAKES IT! Assist: Damian Mobley
Score: 3-0

[11:19] Team_043 possession (Score: 3-0)
Magic Durant attempts a Layup. Contested by Kevin Fox (3.4 feet, ZONE). MAGIC DURANT MAKES IT!
Score: 3-2

[11:05] Team_048 possession (Score: 3-2)
Damian Mobley attempts a 3Pt. Contested by Manu Carter (4.8 feet, MAN). Damian Mobley misses. Offensive rebound by Damian Mobley! Damian Mobley's putback is no good. Offensive rebound by Kevin Fox! Kevin Fox kicks it out.

[10:52] Team_048 possession (Score: 3-2)
Dejounte Sexton attempts a 3Pt. Contested by D'Angelo Iverson (3.6 feet, ZONE). Dejounte Sexton misses. Rebound secured by Manu Carter.

[10:39] Team_043 possession (Score: 3-2)
D'Angelo Iverson attempts a Midrange. Contested by Dejounte Sexton (3.1 feet, MAN). D'Angelo Iverson misses. Rebound secured by Dejounte Sexton.

[10:24] Team_048 possession (Score: 3-2)
Damian Mobley attempts a Midrange. Contested by Manu Carter (4.8 feet, MAN). DAMIAN MOBLEY MAKES IT! Assist: Karl Johnson
Score: 5-2

[10:12] Team_043 possession (Score: 5-2)
FOUL! Shooting foul on Kevin Fox. Manu Carter to the line for 3 free throws. [Team fouls: 1] (Kevin Fox: 1 personal fouls)   FT 1/3: GOOD   FT 2/3: GOOD   FT 3/3: GOOD Manu Carter makes 3/3 from the line.
Score: 5-5

[09:55] Team_048 possession (Score: 5-5)
FOUL! Shooting foul on Manu Carter. Damian Mobley to the line for 2 free throws. [Team fouls: 1] (Manu Carter: 1 personal fouls)   FT 1/2: GOOD   FT 2/2: GOOD Damian Mobley makes 2/2 from the line.
Score: 7-5

[09:38] Team_043 possession (Score: 7-5)
D'Angelo Iverson attempts a Midrange. Contested by Dejounte Sexton (3.1 feet, MAN). D'ANGELO IVERSON MAKES IT! Assist: Dwyane Dosunmu
Score: 7-7

[09:23] Team_048 possession (Score: 7-7)
Kevin Fox attempts a Layup. Contested by Manu Carter (5.1 feet, ZONE). KEVIN FOX MAKES IT!
Score: 9-7

[09:08] Team_043 possession (Score: 9-7)
Manu Carter attempts a Layup. Contested by Kevin Fox (3.9 feet, MAN). MANU CARTER MAKES IT!
Score: 9-9

[08:55] Team_048 possession (Score: 9-9)
Karl Johnson attempts a 3Pt. Contested by Magic Durant (5.6 feet, MAN). Karl Johnson misses. Rebound secured by Dwyane Dosunmu.

[08:37] Team_043 possession (Score: 9-9)
Manu Carter attempts a Midrange. Contested by Kevin Fox (3.9 feet, ZONE). MANU CARTER MAKES IT! Assist: Dwyane Dosunmu
Score: 9-11

[08:24] Team_048 possession (Score: 9-11)
Damian Mobley drives and kicks out. Damian Mobley attempts a 3Pt. Contested by Manu Carter (4.2 feet, MAN). Damian Mobley misses. Offensive rebound by Damian Mobley! Damian Mobley's putback is no good. Rebound secured by D'Angelo Iverson.

[08:07] Team_043 possession (Score: 9-11)
Magic Durant attempts a Layup. Contested by Karl Johnson (4.4 feet, MAN). MAGIC DURANT MAKES IT!
Score: 9-13

[07:50] Team_048 possession (Score: 9-13)
FOUL! Shooting foul on Malcolm Murray. Paolo Rozier to the line for 2 free throws. [Team fouls: 2] (Malcolm Murray: 1 personal fouls)   FT 1/2: GOOD   FT 2/2: GOOD Paolo Rozier makes 2/2 from the line.
Score: 11-13

[07:35] Team_043 possession (Score: 11-13)
Dwyane Dosunmu drives, picks up Kevin Fox. Help arrives from Karl Johnson! Dwyane Dosunmu attempts a Layup. Contested by Karl Johnson (3.5 feet, MAN). DWYANE DOSUNMU MAKES IT! Assist: Magic Durant
Score: 11-15

[07:19] Team_048 possession (Score: 11-15)
Kevin Fox drives, Manu Carter stays with him. Kevin Fox attempts a Dunk. Contested by Manu Carter (5.1 feet, MAN). KEVIN FOX MAKES IT! Assist: Paolo Rozier
Score: 13-15

[07:07] Team_043 possession (Score: 13-15)
Manu Carter attempts a Layup. Contested by Kevin Fox (3.9 feet, ZONE). Manu Carter misses. Rebound secured by Damian Mobley.

[06:57] Team_048 possession (Score: 13-15)
Damian Mobley drives to the basket... FOUL! Offensive foul on Damian Mobley! Manu Carter drew the charge! [Team fouls: 2] (Damian Mobley: 1 personal fouls) TURNOVER! (dead ball)

[06:39] Team_043 possession (Score: 13-15)
Dwyane Dosunmu attempts a Midrange. Contested by Kevin Fox (3.5 feet, MAN). DWYANE DOSUNMU MAKES IT!
Score: 13-17

[06:25] Team_048 possession (Score: 13-17)
Paolo Rozier attempts a Midrange. Contested by Malcolm Murray (3.8 feet, MAN). Paolo Rozier misses. Rebound secured by Dwyane Dosunmu.

[06:11] Team_043 possession (Score: 13-17)
Dwyane Dosunmu attempts a Layup. Contested by Damian Mobley (3.6 feet, ZONE). Dwyane Dosunmu misses. Rebound secured by Dejounte Sexton.

[05:57] Team_048 possession (Score: 13-17)
Karl Johnson attempts a 3Pt. Contested by D'Angelo Iverson (3.5 feet, ZONE). KARL JOHNSON MAKES IT! Assist: Damian Mobley
Score: 16-17

[05:38] Team_043 possession (Score: 16-17)
D'Angelo Iverson attempts a 3Pt. Contested by Dejounte Sexton (3.1 feet, ZONE). D'Angelo Iverson misses. Rebound secured by Kevin Fox.

[05:21] Team_048 possession (Score: 16-17)
Damian Mobley drives, Manu Carter stays with him. Damian Mobley attempts a Layup. Contested by Manu Carter (4.9 feet, MAN). DAMIAN MOBLEY MAKES IT!
Score: 18-17

[05:05] Team_043 possession (Score: 18-17)
Dwyane Dosunmu drives and kicks out. Dwyane Dosunmu attempts a 3Pt. Contested by Kevin Fox (3.5 feet, ZONE). Dwyane Dosunmu misses. Offensive rebound by D'Angelo Iverson! D'Angelo Iverson kicks it out.

[04:47] Team_043 possession (Score: 18-17)
Malcolm Murray attempts a 3Pt. Contested by Paolo Rozier (5.2 feet, MAN). Malcolm Murray misses. Rebound secured by Kevin Fox.

[04:30] Team_048 possession (Score: 18-17)
Kevin Fox makes the Midrange and draws the foul on Manu Carter! And-1! Kevin Fox to the line for 1. [Team fouls: 3] (Manu Carter: 2 personal fouls)   FT 1/1: GOOD Kevin Fox makes 1/1 from the line.
Score: 21-17

[04:14] Team_043 possession (Score: 21-17)
Malcolm Murray attempts a 3Pt. Contested by Dejounte Sexton (3.1 feet, ZONE). MALCOLM MURRAY MAKES IT! Assist: Manu Carter
Score: 21-20

[04:00] Team_048 possession (Score: 21-20)
Dejounte Sexton attempts a 3Pt. Contested by D'Angelo Iverson (3.7 feet, ZONE). Dejounte Sexton misses. Rebound secured by D'Angelo Iverson.

[03:44] Team_043 possession (Score: 21-20)
Dwyane Dosunmu makes the Layup and draws the foul on Kevin Fox! And-1! Dwyane Dosunmu to the line for 1. [Team fouls: 3] (Kevin Fox: 2 personal fouls)   FT 1/1: MISS Dwyane Dosunmu makes 0/1 from the line. Rebound secured by Dejounte Sexton.
Score: 21-22

[03:34] Team_048 possession (Score: 21-22)
Dejounte Sexton attempts a 3Pt. Contested by D'Angelo Iverson (3.7 feet, MAN). Dejounte Sexton misses. Offensive rebound by Kevin Fox! Kevin Fox kicks it out.

[03:24] Team_048 possession (Score: 21-22)
Paolo Rozier attempts a 3Pt. Contested by D'Angelo Iverson (3.2 feet, ZONE). Paolo Rozier misses. Rebound secured by D'Angelo Iverson.

[03:10] Team_043 possession (Score: 21-22)
FOUL! Shooting foul on Kevin Fox. Dwyane Dosunmu to the line for 2 free throws. [Team fouls: 4] (Kevin Fox: 3 personal fouls)   FT 1/2: MISS   FT 2/2: GOOD Dwyane Dosunmu makes 1/2 from the line.
Score: 21-23

[02:55] Team_048 possession (Score: 21-23)
Karl Johnson attempts a 3Pt. Contested by D'Angelo Iverson (3.6 feet, ZONE). Karl Johnson misses. Rebound secured by Manu Carter.

[02:37] Team_043 possession (Score: 21-23)
Dwyane Dosunmu drives, Kevin Fox stays with him. Dwyane Dosunmu attempts a Dunk. Contested by Kevin Fox (3.7 feet, MAN). DWYANE DOSUNMU MAKES IT!
Score: 21-25

[02:21] Team_048 possession (Score: 21-25)
Karl Johnson drives, picks up Manu Carter. Help arrives from Malcolm Murray! Karl Johnson attempts a Layup. Contested by Malcolm Murray (5.0 feet, ZONE). Karl Johnson misses. Rebound secured by Dwyane Dosunmu.

[02:03] Team_043 possession (Score: 21-25)
Magic Durant drives, picks up Kevin Fox. Help arrives from Karl Johnson! Magic Durant attempts a Layup. Contested by Karl Johnson (3.7 feet, ZONE). MAGIC DURANT MAKES IT! Assist: Manu Carter
Score: 21-27

[01:52] Team_048 possession (Score: 21-27)
Kevin Fox loses control! Ball rolls out of bounds! TURNOVER! (dead ball)

[01:52] Substitution (Team_048): Paolo Rozier OUT → Lauri Curry IN (stamina_rule2)

[01:52] Substitution (Team_048): Karl Johnson OUT → Yao Booker IN (stamina_rule2)

[01:52] Substitution (Team_048): Dejounte Sexton OUT → Kyle Irving IN (stamina_rule2)

[01:52] Substitution (Team_048): Kevin Fox OUT → DeMar Hyland IN (stamina_rule2)

[01:52] Substitution (Team_048): Damian Mobley OUT → Gary Giddey IN (stamina_rule2)

[01:52] Substitution (Team_043): Malcolm Murray OUT → Jabari Holiday IN (stamina_rule2)

[01:52] Substitution (Team_043): Magic Durant OUT → Ben LaVine IN (stamina_rule2)

[01:52] Substitution (Team_043): Manu Carter OUT → Joel Murray IN (stamina_rule2)

[01:52] Substitution (Team_043): Dwyane Dosunmu OUT → Terry Randle IN (stamina_rule2)

[01:41] Team_043 possession (Score: 21-27)
Jabari Holiday attempts a 3Pt. Contested by DeMar Hyland (3.9 feet, ZONE). Jabari Holiday misses. Rebound secured by DeMar Hyland.

[01:26] Team_048 possession (Score: 21-27)
Yao Booker makes the Layup and draws the foul on Ben LaVine! And-1! Yao Booker to the line for 1. [Team fouls: 4] (Ben LaVine: 1 personal fouls)   FT 1/1: GOOD Yao Booker makes 1/1 from the line.
Score: 24-27

[01:16] Team_043 possession (Score: 24-27)
Ben LaVine drives and kicks out. D'Angelo Iverson attempts a Midrange. Contested by Kyle Irving (4.5 feet, MAN). D'Angelo Iverson misses. Rebound secured by DeMar Hyland.

[01:04] Team_048 possession (Score: 24-27)
FOUL! Shooting foul on Terry Randle. DeMar Hyland to the line for 2 free throws. [BONUS: 5 team fouls] (Terry Randle: 1 personal fouls)   FT 1/2: GOOD   FT 2/2: GOOD DeMar Hyland makes 2/2 from the line.
Score: 26-27

[00:48] Team_043 possession (Score: 26-27)
Ben LaVine makes the Dunk and draws the foul on Kyle Irving! And-1! Ben LaVine to the line for 1. [BONUS: 5 team fouls] (Kyle Irving: 1 personal fouls)   FT 1/1: MISS Ben LaVine makes 0/1 from the line. Offensive rebound by D'Angelo Iverson! D'Angelo Iverson kicks it out.
Score: 26-29

[00:35] Team_043 possession (Score: 26-29)
Ben LaVine attempts a 3Pt. Contested by Yao Booker (5.1 feet, MAN). Ben LaVine misses. Rebound secured by Gary Giddey.

[00:22] Team_048 possession (Score: 26-29)
Yao Booker attempts a 3Pt. Contested by Ben LaVine (5.1 feet, MAN). Yao Booker misses. Rebound secured by D'Angelo Iverson.

[00:07] Team_043 possession (Score: 26-29)
Joel Murray attempts a Midrange. Contested by DeMar Hyland (3.8 feet, MAN). Joel Murray misses. Rebound secured by Gary Giddey.

================================================================================
                              1ST QUARTER COMPLETE                              
================================================================================

1ST QUARTER SCORE: Team_048 26, Team_043 29

BOX SCORE:
================================================================================

Team_048
--------------------------------------------------------------------------------
Player                MIN  PTS  REB  AST  TO      FG   FG%      3P   3P%
--------------------------------------------------------------------------------
Kevin Fox              10    7    4    0   0   3/3   100.0     0/0   0.0
Karl Johnson           10    6    0    1   0   2/5    40.0     0/0   0.0
Damian Mobley          10    6    1    2   0   3/4    75.0     0/0   0.0
Yao Booker              2    3    0    0   0   1/2    50.0     0/0   0.0
Paolo Rozier           10    2    0    1   0   1/3    33.3     0/0   0.0
DeMar Hyland            2    2    2    0   0   1/1   100.0     0/0   0.0
Dejounte Sexton        10    0    4    0   0   0/3     0.0     0/0   0.0
Gary Giddey             2    0    2    0   0   0/0     0.0     0/0   0.0

TEAM: FG: 11/21 (52.4%), 3PT: 1/8 (12.5%), REB: 14 (3 off, 11 def), AST: 4, TO: 2
TEAM FOULS: 5 [Team_043 in BONUS]


Team_043
--------------------------------------------------------------------------------
Player                MIN  PTS  REB  AST  TO      FG   FG%      3P   3P%
--------------------------------------------------------------------------------
Manu Carter            10    7    3    2   0   3/5    60.0     0/0   0.0
Dwyane Dosunmu         10    7    3    2   0   4/6    66.7     0/0   0.0
Magic Durant           10    6    0    1   0   3/3   100.0     0/0   0.0
Malcolm Murray         10    3    0    0   0   1/2    50.0     0/0   0.0
D'Angelo Iverson       12    2    6    0   0   1/3    33.3     0/0   0.0
Jabari Holiday          2    0    0    0   0   0/1     0.0     0/0   0.0
Ben LaVine              2    0    0    0   0   0/2     0.0     0/0   0.0
Joel Murray             2    0    0    0   0   0/1     0.0     0/0   0.0

TEAM: FG: 12/23 (52.2%), 3PT: 2/6 (33.3%), REB: 11 (2 off, 9 def), AST: 5, TO: 0
TEAM FOULS: 5 [Team_048 in BONUS]

================================================================================

================================================================================
                       2ND QUARTER - Team_048 vs Team_043                       
================================================================================

[12:00] Team_048 possession (Score: 26-29)
Dejounte Sexton attempts a Midrange. Contested by Magic Durant (5.9 feet, ZONE). Dejounte Sexton misses. Offensive rebound by Damian Mobley! Damian Mobley puts it back in!
Score: 28-29

[11:44] Team_043 possession (Score: 28-29)
Magic Durant drives to the basket... Magic Durant throws a bad pass out of bounds! TURNOVER! (dead ball)

[11:44] Substitution (Team_043): D'Angelo Iverson OUT → Dirk Herro IN (stamina_rule2)

[11:29] Team_048 possession (Score: 28-29)
Paolo Rozier attempts a 3Pt. Contested by Malcolm Murray (3.9 feet, MAN). Paolo Rozier misses. Rebound secured by Dirk Herro.

[11:16] Team_043 possession (Score: 28-29)
Manu Carter attempts a Midrange. Contested by Kevin Fox (4.0 feet, MAN). Manu Carter misses. Rebound secured by Dejounte Sexton.

[10:57] Team_048 possession (Score: 28-29)
Dejounte Sexton attempts a 3Pt. Contested by Manu Carter (5.0 feet, ZONE). DEJOUNTE SEXTON MAKES IT! Assist: Paolo Rozier
Score: 31-29

[10:46] Team_043 possession (Score: 31-29)
FOUL! Holding foul on Dejounte Sexton. [Team fouls: 1] No free throws, side out. (Dejounte Sexton: 1 personal fouls)

[10:29] Team_043 possession (Score: 31-29)
Manu Carter drives, Kevin Fox stays with him. Manu Carter attempts a Dunk. Contested by Kevin Fox (4.1 feet, ZONE). Manu Carter misses. Offensive rebound by Dwyane Dosunmu! Dwyane Dosunmu puts it back in!
Score: 31-31

[10:15] Team_048 possession (Score: 31-31)
Kevin Fox attempts a Midrange. Wide open! Magic Durant is 6.2 feet away. [ZONE] Kevin Fox misses. Rebound secured by Dwyane Dosunmu.

[10:02] Team_043 possession (Score: 31-31)
Dirk Herro drives to the basket... Dirk Herro loses the ball! Stripped by Dejounte Sexton! TURNOVER! (live ball)

[09:46] Team_048 possession (Score: 31-31)
Dejounte Sexton attempts a 3Pt. Contested by Dirk Herro (4.7 feet, MAN). Dejounte Sexton misses. Rebound secured by Manu Carter.

[09:26] Team_043 possession (Score: 31-31)
Magic Durant makes the Layup and draws the foul on Karl Johnson! And-1! Magic Durant to the line for 1. [Team fouls: 2] (Karl Johnson: 1 personal fouls)   FT 1/1: GOOD Magic Durant makes 1/1 from the line.
Score: 31-34

[09:16] Team_048 possession (Score: 31-34)
Karl Johnson attempts a Layup. Contested by Manu Carter (5.0 feet, ZONE). Karl Johnson misses. Rebound secured by Manu Carter.

[09:04] Team_043 possession (Score: 31-34)
Manu Carter throws a bad pass out of bounds! TURNOVER! (dead ball)

[09:04] Substitution (Team_048): Paolo Rozier OUT → Lauri Curry IN (stamina_rule2)

[09:04] Substitution (Team_048): Karl Johnson OUT → Yao Booker IN (stamina_rule2)

[09:04] Substitution (Team_048): Dejounte Sexton OUT → Kyle Irving IN (stamina_rule2)

[09:04] Substitution (Team_048): Kevin Fox OUT → DeMar Hyland IN (stamina_rule2)

[09:04] Substitution (Team_048): Damian Mobley OUT → Gary Giddey IN (stamina_rule2)

[09:04] Substitution (Team_043): Malcolm Murray OUT → Jabari Holiday IN (stamina_rule2)

[09:04] Substitution (Team_043): Magic Durant OUT → Ben LaVine IN (stamina_rule2)

[09:04] Substitution (Team_043): Manu Carter OUT → Joel Murray IN (stamina_rule2)

[09:04] Substitution (Team_043): Dwyane Dosunmu OUT → Terry Randle IN (stamina_rule2)

[08:49] Team_048 possession (Score: 31-34)
DeMar Hyland attempts a Midrange. Contested by Joel Murray (5.9 feet, MAN). DeMar Hyland misses. Rebound secured by Dirk Herro.

[08:37] Team_043 possession (Score: 31-34)
Terry Randle drives and kicks out. Terry Randle attempts a 3Pt. Contested by DeMar Hyland (3.4 feet, MAN). TERRY RANDLE MAKES IT! Assist: Jabari Holiday
Score: 31-37

[08:22] Team_048 possession (Score: 31-37)
Yao Booker attempts a Midrange. Contested by Dirk Herro (4.0 feet, ZONE). YAO BOOKER MAKES IT!
Score: 33-37

[08:10] Team_043 possession (Score: 33-37)
Dirk Herro attempts a Midrange. Contested by Kyle Irving (4.8 feet, ZONE). Dirk Herro misses. Offensive rebound by Terry Randle! Terry Randle kicks it out.

[07:55] Team_043 possession (Score: 33-37)
FOUL! Reach-in foul on DeMar Hyland during the drive. [Team fouls: 3] No free throws, side out. (DeMar Hyland: 1 personal fouls)

[07:43] Team_043 possession (Score: 33-37)
Terry Randle attempts a Layup. BLOCKED BY DEMAR HYLAND! Ball is loose! Rebound secured by DeMar Hyland.

[07:30] Team_048 possession (Score: 33-37)
Gary Giddey attempts a Midrange. Contested by Terry Randle (4.6 feet, MAN). Gary Giddey misses. Rebound secured by Terry Randle.

[07:16] Team_043 possession (Score: 33-37)
Dirk Herro attempts a Layup. Contested by Kyle Irving (4.8 feet, MAN). DIRK HERRO MAKES IT! Assist: Ben LaVine
Score: 33-39

[06:59] Team_048 possession (Score: 33-39)
DeMar Hyland attempts a 3Pt. Contested by Dirk Herro (4.2 feet, ZONE). DeMar Hyland misses. Rebound secured by Ben LaVine.

[06:41] Team_043 possession (Score: 33-39)
FOUL! Reach-in foul on Yao Booker during the drive. [Team fouls: 4] No free throws, side out. (Yao Booker: 1 personal fouls)

[06:27] Team_043 possession (Score: 33-39)
Jabari Holiday drives, Lauri Curry stays with him. Jabari Holiday attempts a Dunk. Contested by Lauri Curry (5.0 feet, MAN). Jabari Holiday misses. Rebound secured by Kyle Irving.

[06:17] Team_048 possession (Score: 33-39)
Kyle Irving attempts a Midrange. Contested by Ben LaVine (5.1 feet, ZONE). Kyle Irving misses. Offensive rebound by DeMar Hyland! DeMar Hyland kicks it out.

[06:04] Team_048 possession (Score: 33-39)
Gary Giddey drives, Terry Randle stays with him. Gary Giddey attempts a Dunk. Contested by Terry Randle (4.6 feet, ZONE). GARY GIDDEY MAKES IT!
Score: 35-39

[05:45] Team_043 possession (Score: 35-39)
Ben LaVine drives and kicks out. Terry Randle attempts a 3Pt. Contested by DeMar Hyland (3.4 feet, ZONE). Terry Randle misses. Rebound secured by Kyle Irving.

[05:27] Team_048 possession (Score: 35-39)
Kyle Irving attempts a Layup. Contested by Terry Randle (4.3 feet, ZONE). KYLE IRVING MAKES IT!
Score: 37-39

[05:13] Team_043 possession (Score: 37-39)
Ben LaVine attempts a 3Pt. Contested by DeMar Hyland (3.8 feet, ZONE). Ben LaVine misses. Rebound secured by Gary Giddey.

[04:59] Team_048 possession (Score: 37-39)
Lauri Curry attempts a 3Pt. Contested by Dirk Herro (4.1 feet, ZONE). Lauri Curry misses. Offensive rebound by Kyle Irving! Kyle Irving's putback is no good. Rebound secured by Ben LaVine.

[04:47] Team_043 possession (Score: 37-39)
Terry Randle attempts a Midrange. Contested by Yao Booker (5.1 feet, ZONE). Terry Randle misses. Rebound secured by Gary Giddey.

[04:35] Team_048 possession (Score: 37-39)
FOUL! Offensive foul on Yao Booker! Ben LaVine drew the charge! [Team fouls: 5] (Yao Booker: 2 personal fouls) TURNOVER! (dead ball)

[04:19] Team_043 possession (Score: 37-39)
FOUL! Shooting foul on DeMar Hyland. Dirk Herro to the line for 2 free throws. [BONUS: 6 team fouls] (DeMar Hyland: 2 personal fouls)   FT 1/2: GOOD   FT 2/2: GOOD Dirk Herro makes 2/2 from the line.
Score: 37-41

[04:00] Team_048 possession (Score: 37-41)
Kyle Irving attempts a Midrange. Contested by Dirk Herro (4.0 feet, MAN). KYLE IRVING MAKES IT!
Score: 39-41

[03:43] Team_043 possession (Score: 39-41)
Ben LaVine attempts a 3Pt. Contested by Yao Booker (5.1 feet, MAN). Ben LaVine misses. Rebound secured by Kyle Irving.

[03:29] Team_048 possession (Score: 39-41)
Gary Giddey attempts a Layup. Contested by Terry Randle (4.6 feet, MAN). Gary Giddey misses. Rebound secured by Terry Randle.

[03:20] Team_043 possession (Score: 39-41)
Jabari Holiday attempts a 3Pt. Contested by Lauri Curry (5.0 feet, MAN). Jabari Holiday misses. Offensive rebound by Terry Randle! Terry Randle kicks it out.

[03:04] Team_043 possession (Score: 39-41)
FOUL! Shooting foul on Kyle Irving. Terry Randle to the line for 2 free throws. [BONUS: 7 team fouls] (Kyle Irving: 1 personal fouls)   FT 1/2: GOOD   FT 2/2: GOOD Terry Randle makes 2/2 from the line.
Score: 39-43

[02:47] Team_048 possession (Score: 39-43)
Gary Giddey attempts a 3Pt. Contested by Terry Randle (4.6 feet, MAN). Gary Giddey misses. Rebound secured by Dirk Herro.

[02:36] Team_043 possession (Score: 39-43)
Dirk Herro attempts a Midrange. Contested by Kyle Irving (4.8 feet, MAN). Dirk Herro misses. Rebound secured by DeMar Hyland.

[02:17] Team_048 possession (Score: 39-43)
Gary Giddey attempts a Midrange. Contested by Terry Randle (4.6 feet, MAN). Gary Giddey misses. Rebound secured by Terry Randle.

[01:59] Team_043 possession (Score: 39-43)
Terry Randle attempts a 3Pt. Contested by DeMar Hyland (4.0 feet, MAN). Terry Randle misses. Rebound secured by Gary Giddey.

[01:44] Team_048 possession (Score: 39-43)
FOUL! Shooting foul on Dirk Herro. DeMar Hyland to the line for 3 free throws. [Team fouls: 1] (Dirk Herro: 1 personal fouls)   FT 1/3: GOOD   FT 2/3: GOOD   FT 3/3: GOOD DeMar Hyland makes 3/3 from the line.
Score: 42-43

[01:28] Team_043 possession (Score: 42-43)
Ben LaVine attempts a Midrange. Contested by Yao Booker (5.2 feet, MAN). Ben LaVine misses. Rebound secured by DeMar Hyland.

[01:18] Team_048 possession (Score: 42-43)
Gary Giddey drives, Terry Randle stays with him. Gary Giddey attempts a Dunk. Contested by Terry Randle (4.7 feet, ZONE). GARY GIDDEY MAKES IT!
Score: 44-43

[01:00] Team_043 possession (Score: 44-43)
Ben LaVine attempts a Midrange. Contested by Yao Booker (5.2 feet, MAN). BEN LAVINE MAKES IT! Assist: Terry Randle
Score: 44-45

[00:50] Team_048 possession (Score: 44-45)
DeMar Hyland drives, Joel Murray stays with him. DeMar Hyland attempts a Layup. Wide open! Joel Murray is 6.1 feet away. [MAN] DeMar Hyland misses. FOUL! Loose ball foul on Ben LaVine during the rebound battle. [Team fouls: 2] No free throws, side out. (Ben LaVine: 1 personal fouls)

[00:30] Team_048 possession (Score: 44-45)
Kyle Irving makes the Layup and draws the foul on Dirk Herro! And-1! Kyle Irving to the line for 1. [Team fouls: 3] (Dirk Herro: 2 personal fouls)   FT 1/1: MISS Kyle Irving makes 0/1 from the line. Rebound secured by Dirk Herro.
Score: 46-45

[00:14] Team_043 possession (Score: 46-45)
FOUL! Offensive foul on Terry Randle! DeMar Hyland drew the charge! [Team fouls: 4] (Terry Randle: 1 personal fouls) TURNOVER! (dead ball)

================================================================================
                              2ND QUARTER COMPLETE                              
================================================================================

2ND QUARTER SCORE: Team_048 20, Team_043 16

BOX SCORE:
================================================================================

Team_048
--------------------------------------------------------------------------------
Player                MIN  PTS  REB  AST  TO      FG   FG%      3P   3P%
--------------------------------------------------------------------------------
Gary Giddey            11    4    3    0   0   2/6    33.3     0/0   0.0
Kyle Irving            11    4    4    0   0   2/3    66.7     0/0   0.0
Dejounte Sexton        14    3    1    0   0   1/2    50.0     0/0   0.0
DeMar Hyland           11    3    4    0   0   1/3    33.3     0/0   0.0
Damian Mobley          14    2    1    0   0   1/1   100.0     0/0   0.0
Yao Booker             11    2    0    0   0   1/1   100.0     0/0   0.0
Paolo Rozier           14    0    0    1   0   0/1     0.0     0/0   0.0
Kevin Fox              14    0    0    0   0   0/1     0.0     0/0   0.0
Karl Johnson           14    0    0    0   0   0/1     0.0     0/0   0.0
Lauri Curry            11    0    0    0   0   0/1     0.0     0/0   0.0

TEAM: FG: 8/20 (40.0%), 3PT: 2/7 (28.6%), REB: 14 (4 off, 10 def), AST: 1, TO: 1
TEAM FOULS: 7 [Team_043 in BONUS]


Team_043
--------------------------------------------------------------------------------
Player                MIN  PTS  REB  AST  TO      FG   FG%      3P   3P%
--------------------------------------------------------------------------------
Terry Randle           11    5    5    1   0   2/5    40.0     0/0   0.0
Dirk Herro             12    4    4    0   0   2/3    66.7     0/0   0.0
Magic Durant           14    3    0    0   0   1/1   100.0     0/0   0.0
Dwyane Dosunmu         14    2    2    0   0   1/1   100.0     0/0   0.0
Ben LaVine             11    2    2    1   0   1/5    20.0     0/0   0.0
Manu Carter            14    0    2    0   0   0/1     0.0     0/0   0.0
Jabari Holiday         11    0    0    1   0   0/1     0.0     0/0   0.0

TEAM: FG: 7/17 (41.2%), 3PT: 0/3 (0.0%), REB: 14 (3 off, 11 def), AST: 3, TO: 4
TEAM FOULS: 4

================================================================================

================================================================================
                       3RD QUARTER - Team_048 vs Team_043                       
================================================================================

[12:00] Team_048 possession (Score: 46-45)
Damian Mobley attempts a Midrange. Contested by Manu Carter (4.8 feet, MAN). DAMIAN MOBLEY MAKES IT!
Score: 48-45

[11:48] Team_043 possession (Score: 48-45)
Magic Durant attempts a Midrange. Contested by Karl Johnson (4.4 feet, MAN). MAGIC DURANT MAKES IT!
Score: 48-47

[11:32] Team_048 possession (Score: 48-47)
Karl Johnson attempts a 3Pt. Contested by D'Angelo Iverson (3.5 feet, ZONE). Karl Johnson misses. Rebound secured by D'Angelo Iverson.

[11:19] Team_043 possession (Score: 48-47)
D'Angelo Iverson drives and kicks out. Magic Durant attempts a Midrange. Contested by Karl Johnson (4.4 feet, MAN). Magic Durant misses. FOUL! Loose ball foul on Damian Mobley during the rebound battle. [Team fouls: 1] No free throws, side out. (Damian Mobley: 1 personal fouls)

[11:02] Team_043 possession (Score: 48-47)
Dwyane Dosunmu throws a bad pass! Stolen by Kevin Fox! TURNOVER! (live ball)

[10:45] Team_048 possession (Score: 48-47)
Dejounte Sexton attempts a 3Pt. Contested by D'Angelo Iverson (3.6 feet, ZONE). DEJOUNTE SEXTON MAKES IT! Assist: Damian Mobley
Score: 51-47

[10:29] Team_043 possession (Score: 51-47)
Malcolm Murray drives and kicks out. D'Angelo Iverson attempts a 3Pt. Contested by Dejounte Sexton (3.0 feet, ZONE). D'Angelo Iverson misses. Rebound secured by Kevin Fox.

[10:14] Team_048 possession (Score: 51-47)
FOUL! Shooting foul on Magic Durant. Karl Johnson to the line for 2 free throws. [Team fouls: 1] (Magic Durant: 1 personal fouls)   FT 1/2: MISS   FT 2/2: GOOD Karl Johnson makes 1/2 from the line.
Score: 52-47

[09:59] Team_043 possession (Score: 52-47)
Manu Carter attempts a 3Pt. Contested by Dejounte Sexton (3.5 feet, ZONE). Manu Carter misses. Rebound secured by Dejounte Sexton.

[09:48] Team_048 possession (Score: 52-47)
Karl Johnson attempts a Midrange. Contested by Manu Carter (4.7 feet, ZONE). Karl Johnson misses. Rebound secured by Dwyane Dosunmu.

[09:36] Team_043 possession (Score: 52-47)
D'Angelo Iverson attempts a 3Pt. Contested by Dejounte Sexton (3.1 feet, ZONE). D'ANGELO IVERSON MAKES IT! Assist: Manu Carter
Score: 52-50

[09:25] Team_048 possession (Score: 52-50)
Kevin Fox attempts a Midrange. Contested by Manu Carter (5.1 feet, MAN). KEVIN FOX MAKES IT!
Score: 54-50

[09:10] Team_043 possession (Score: 54-50)
FOUL! Holding foul on Dejounte Sexton. [Team fouls: 2] No free throws, side out. (Dejounte Sexton: 1 personal fouls)

[08:56] Team_043 possession (Score: 54-50)
Magic Durant loses control! Ball rolls out of bounds! TURNOVER! (dead ball)

[08:42] Team_048 possession (Score: 54-50)
Kevin Fox attempts a 3Pt. Contested by Manu Carter (5.1 feet, MAN). Kevin Fox misses. Rebound secured by Dwyane Dosunmu.

[08:28] Team_043 possession (Score: 54-50)
Magic Durant attempts a 3Pt. Contested by Karl Johnson (4.4 feet, MAN). Magic Durant misses. Rebound secured by Kevin Fox.

[08:14] Team_048 possession (Score: 54-50)
Damian Mobley attempts a Midrange. Contested by Manu Carter (4.8 feet, MAN). Damian Mobley misses. Rebound secured by D'Angelo Iverson.

[08:01] Team_043 possession (Score: 54-50)
Manu Carter attempts a Midrange. Contested by Kevin Fox (3.9 feet, MAN). Manu Carter misses. Rebound secured by Dejounte Sexton.

[07:45] Team_048 possession (Score: 54-50)
Kevin Fox attempts a 3Pt. Contested by Manu Carter (5.1 feet, MAN). KEVIN FOX MAKES IT! Assist: Dejounte Sexton
Score: 57-50

[07:29] Team_043 possession (Score: 57-50)
FOUL! Holding foul on Karl Johnson. [Team fouls: 3] No free throws, side out. (Karl Johnson: 1 personal fouls)

[07:10] Team_043 possession (Score: 57-50)
Magic Durant attempts a 3Pt. Contested by Kevin Fox (3.4 feet, ZONE). Magic Durant misses. Rebound secured by Damian Mobley.

[06:56] Team_048 possession (Score: 57-50)
Karl Johnson drives and kicks out. Paolo Rozier attempts a 3Pt. Contested by Magic Durant (5.1 feet, ZONE). Paolo Rozier misses. Rebound secured by Dwyane Dosunmu.

[06:40] Team_043 possession (Score: 57-50)
D'Angelo Iverson attempts a 3Pt. Contested by Dejounte Sexton (3.1 feet, MAN). D'Angelo Iverson misses. Rebound secured by Kevin Fox.

[06:22] Team_048 possession (Score: 57-50)
Kevin Fox drives, picks up Manu Carter. Help arrives from Malcolm Murray! Kevin Fox attempts a Layup. Contested by Malcolm Murray (5.1 feet, ZONE). KEVIN FOX MAKES IT!
Score: 59-50

[06:06] Team_043 possession (Score: 59-50)
FOUL! Reach-in foul on Karl Johnson during the drive. [Team fouls: 4] No free throws, side out. (Karl Johnson: 2 personal fouls)

[05:49] Team_043 possession (Score: 59-50)
Dwyane Dosunmu attempts a Midrange. Contested by Kevin Fox (3.5 feet, MAN). Dwyane Dosunmu misses. Offensive rebound by Manu Carter! Manu Carter kicks it out.

[05:33] Team_043 possession (Score: 59-50)
Magic Durant attempts a Midrange. Contested by Karl Johnson (4.4 feet, ZONE). Magic Durant misses. Rebound secured by Damian Mobley.

[05:17] Team_048 possession (Score: 59-50)
Kevin Fox drives to the basket... FOUL! Offensive foul on Kevin Fox! Manu Carter drew the charge! [Team fouls: 5] (Kevin Fox: 1 personal fouls) TURNOVER! (dead ball)

[05:05] Team_043 possession (Score: 59-50)
D'Angelo Iverson attempts a Layup. Contested by Dejounte Sexton (3.1 feet, MAN). D'ANGELO IVERSON MAKES IT!
Score: 59-52

[04:56] Team_048 possession (Score: 59-52)
Kevin Fox attempts a Dunk. BLOCKED BY MANU CARTER! Ball is loose! Offensive rebound by Damian Mobley! Damian Mobley kicks it out.

[04:43] Team_048 possession (Score: 59-52)
Dejounte Sexton drives and kicks out. Damian Mobley attempts a 3Pt. Contested by Manu Carter (4.2 feet, MAN). Damian Mobley misses. Offensive rebound by Kevin Fox! Kevin Fox kicks it out.

[04:32] Team_048 possession (Score: 59-52)
Kevin Fox attempts a Midrange. Wide open! Magic Durant is 6.1 feet away. [ZONE] Kevin Fox misses. Rebound secured by Manu Carter.

[04:15] Team_043 possession (Score: 59-52)
Manu Carter attempts a Midrange. Contested by Kevin Fox (4.0 feet, MAN). MANU CARTER MAKES IT! Assist: Dwyane Dosunmu
Score: 59-54

[04:00] Team_048 possession (Score: 59-54)
Paolo Rozier attempts a Layup. BLOCKED BY MALCOLM MURRAY! Ball is loose! Offensive rebound by Damian Mobley! Damian Mobley kicks it out.

[03:43] Team_048 possession (Score: 59-54)
Kevin Fox makes the Layup and draws the foul on Malcolm Murray! And-1! Kevin Fox to the line for 1. [Team fouls: 2] (Malcolm Murray: 1 personal fouls)   FT 1/1: MISS Kevin Fox makes 0/1 from the line. Rebound secured by Dwyane Dosunmu.
Score: 61-54

[03:32] Team_043 possession (Score: 61-54)
Manu Carter makes the Midrange and draws the foul on Kevin Fox! And-1! Manu Carter to the line for 1. [BONUS: 6 team fouls] (Kevin Fox: 2 personal fouls)   FT 1/1: GOOD Manu Carter makes 1/1 from the line.
Score: 61-57

[03:14] Team_048 possession (Score: 61-57)
Kevin Fox makes the Dunk and draws the foul on Manu Carter! And-1! Kevin Fox to the line for 1. [Team fouls: 3] (Manu Carter: 1 personal fouls)   FT 1/1: GOOD Kevin Fox makes 1/1 from the line.
Score: 64-57

[02:57] Team_043 possession (Score: 64-57)
D'Angelo Iverson attempts a 3Pt. Contested by Dejounte Sexton (3.2 feet, ZONE). D'Angelo Iverson misses. Rebound secured by Dejounte Sexton.

[02:38] Team_048 possession (Score: 64-57)
Karl Johnson drives, Manu Carter stays with him. Karl Johnson attempts a Layup. Contested by Manu Carter (4.9 feet, ZONE). KARL JOHNSON MAKES IT!
Score: 66-57

[02:24] Team_043 possession (Score: 66-57)
Manu Carter makes the Layup and draws the foul on Kevin Fox! And-1! Manu Carter to the line for 1. [BONUS: 7 team fouls] (Kevin Fox: 3 personal fouls)   FT 1/1: GOOD Manu Carter makes 1/1 from the line.
Score: 66-60

[02:13] Team_048 possession (Score: 66-60)
Dejounte Sexton attempts a Midrange. Contested by D'Angelo Iverson (3.9 feet, MAN). Dejounte Sexton misses. Rebound secured by Dwyane Dosunmu.

[02:03] Team_043 possession (Score: 66-60)
Magic Durant attempts a 3Pt. Contested by Karl Johnson (4.7 feet, MAN). Magic Durant misses. Rebound secured by Damian Mobley.

[01:48] Team_048 possession (Score: 66-60)
Karl Johnson attempts a Layup. Contested by Manu Carter (5.0 feet, ZONE). KARL JOHNSON MAKES IT!
Score: 68-60

[01:35] Team_043 possession (Score: 68-60)
D'Angelo Iverson attempts a Midrange. Contested by Kevin Fox (3.9 feet, ZONE). D'Angelo Iverson misses. Rebound secured by Damian Mobley.

[01:21] Team_048 possession (Score: 68-60)
Paolo Rozier attempts a 3Pt. Contested by Malcolm Murray (4.2 feet, MAN). PAOLO ROZIER MAKES IT! Assist: Damian Mobley
Score: 71-60

[01:11] Team_043 possession (Score: 71-60)
Magic Durant attempts a 3Pt. Contested by Karl Johnson (4.8 feet, MAN). Magic Durant misses. Offensive rebound by Manu Carter! Manu Carter kicks it out.

[00:59] Team_043 possession (Score: 71-60)
FOUL! Holding foul on Paolo Rozier. [IN THE BONUS! 8 team fouls] Malcolm Murray to the line for 2 free throws. (Paolo Rozier: 1 personal fouls)   FT 1/2: GOOD   FT 2/2: GOOD Malcolm Murray makes 2/2 from the line.
Score: 71-62

[00:42] Team_048 possession (Score: 71-62)
Dejounte Sexton attempts a Layup. Contested by Manu Carter (5.4 feet, ZONE). Dejounte Sexton misses. Rebound secured by D'Angelo Iverson.

[00:27] Team_043 possession (Score: 71-62)
Manu Carter attempts a Midrange. Contested by Dejounte Sexton (3.9 feet, ZONE). MANU CARTER MAKES IT! Assist: Malcolm Murray
Score: 71-64

[00:17] Team_048 possession (Score: 71-64)
FOUL! Shooting foul on Malcolm Murray. Dejounte Sexton to the line for 2 free throws. [Team fouls: 4] (Malcolm Murray: 2 personal fouls)   FT 1/2: GOOD   FT 2/2: MISS Dejounte Sexton makes 1/2 from the line. Offensive rebound by Damian Mobley! Damian Mobley's putback is no good.
Score: 72-64

================================================================================
                              3RD QUARTER COMPLETE                              
================================================================================

3RD QUARTER SCORE: Team_048 26, Team_043 19

BOX SCORE:
================================================================================

Team_048
--------------------------------------------------------------------------------
Player                MIN  PTS  REB  AST  TO      FG   FG%      3P   3P%
--------------------------------------------------------------------------------
Kevin Fox              26   10    4    0   0   4/7    57.1     0/0   0.0
Karl Johnson           26    5    0    0   0   3/6    50.0     0/0   0.0
Dejounte Sexton        26    3    3    1   0   1/4    25.0     0/0   0.0
Paolo Rozier           26    3    0    0   0   1/1   100.0     0/0   0.0

TEAM: FG: 10/20 (50.0%), 3PT: 3/5 (60.0%), REB: 13 (3 off, 10 def), AST: 3, TO: 1
TEAM FOULS: 8 [Team_043 in BONUS]


Team_043
--------------------------------------------------------------------------------
Player                MIN  PTS  REB  AST  TO      FG   FG%      3P   3P%
--------------------------------------------------------------------------------
Manu Carter            26   10    4    1   0   4/6    66.7     0/0   0.0
D'Angelo Iverson       25    5    3    0   0   2/5    40.0     0/0   0.0
Damian Mobley          26    2    7    2   0   1/2    50.0     0/0   0.0
Magic Durant           26    2    0    0   0   1/5    20.0     0/0   0.0
Malcolm Murray         26    2    0    1   0   1/2    50.0     0/0   0.0
Dwyane Dosunmu         26    0    5    1   0   0/0     0.0     0/0   0.0

TEAM: FG: 8/18 (44.4%), 3PT: 1/7 (14.3%), REB: 13 (3 off, 10 def), AST: 3, TO: 2
TEAM FOULS: 4

================================================================================

================================================================================
                       4TH QUARTER - Team_048 vs Team_043                       
================================================================================

[12:00] Substitution (Team_048): Paolo Rozier OUT → Lauri Curry IN (stamina_rule2)

[12:00] Substitution (Team_048): Karl Johnson OUT → Yao Booker IN (stamina_rule2)

[12:00] Substitution (Team_048): Dejounte Sexton OUT → Kyle Irving IN (stamina_rule2)

[12:00] Substitution (Team_048): Kevin Fox OUT → DeMar Hyland IN (stamina_rule2)

[12:00] Substitution (Team_048): Damian Mobley OUT → Gary Giddey IN (stamina_rule2)

[12:00] Substitution (Team_043): Malcolm Murray OUT → Jabari Holiday IN (stamina_rule2)

[12:00] Substitution (Team_043): Magic Durant OUT → Ben LaVine IN (stamina_rule2)

[12:00] Substitution (Team_043): Manu Carter OUT → Joel Murray IN (stamina_rule2)

[12:00] Substitution (Team_043): Dwyane Dosunmu OUT → Terry Randle IN (stamina_rule2)

[12:00] Team_048 possession (Score: 72-64)
Damian Mobley throws a bad pass out of bounds! TURNOVER! (dead ball)

[11:43] Team_043 possession (Score: 72-64)
Terry Randle drives, DeMar Hyland stays with him. Terry Randle attempts a Dunk. Contested by DeMar Hyland (3.8 feet, ZONE). TERRY RANDLE MAKES IT! Assist: D'Angelo Iverson
Score: 72-66

[11:32] Team_048 possession (Score: 72-66)
Gary Giddey attempts a Layup. Contested by Terry Randle (4.6 feet, ZONE). Gary Giddey misses. Offensive rebound by Kyle Irving! Kyle Irving puts it back in!
Score: 74-66

[11:20] Team_043 possession (Score: 74-66)
Jabari Holiday attempts a Midrange. Contested by Lauri Curry (5.0 feet, MAN). JABARI HOLIDAY MAKES IT!
Score: 74-68

[11:08] Team_048 possession (Score: 74-68)
Gary Giddey attempts a Midrange. Contested by Terry Randle (4.6 feet, ZONE). Gary Giddey misses. Rebound secured by Terry Randle.

[10:52] Team_043 possession (Score: 74-68)
D'Angelo Iverson attempts a Midrange. Contested by Kyle Irving (4.5 feet, MAN). D'ANGELO IVERSON MAKES IT!
Score: 74-70

[10:40] Team_048 possession (Score: 74-70)
Yao Booker attempts a 3Pt. Contested by Ben LaVine (5.1 feet, MAN). Yao Booker misses. Rebound secured by Ben LaVine.

[10:22] Team_043 possession (Score: 74-70)
Terry Randle attempts a Midrange. Contested by Yao Booker (5.1 feet, ZONE). Terry Randle misses. FOUL! Loose ball foul on DeMar Hyland during the rebound battle. [Team fouls: 1] No free throws, side out. (DeMar Hyland: 1 personal fouls)

[10:06] Team_043 possession (Score: 74-70)
Joel Murray drives to the basket... Joel Murray throws a bad pass out of bounds! TURNOVER! (dead ball)

[10:06] Substitution (Team_043): D'Angelo Iverson OUT → Dirk Herro IN (stamina_rule2)

[09:51] Team_048 possession (Score: 74-70)
Kyle Irving attempts a 3Pt. Contested by Jabari Holiday (4.5 feet, ZONE). Kyle Irving misses. Rebound secured by Dirk Herro.

[09:35] Team_043 possession (Score: 74-70)
Dirk Herro attempts a Layup. BLOCKED BY KYLE IRVING! Ball is loose! Rebound secured by Gary Giddey.

[09:20] Team_048 possession (Score: 74-70)
FOUL! Shooting foul on Terry Randle. DeMar Hyland to the line for 2 free throws. [Team fouls: 1] (Terry Randle: 1 personal fouls)   FT 1/2: GOOD   FT 2/2: GOOD DeMar Hyland makes 2/2 from the line.
Score: 76-70

[09:03] Team_043 possession (Score: 76-70)
Dirk Herro attempts a Midrange. Contested by DeMar Hyland (3.7 feet, ZONE). Dirk Herro misses. Rebound secured by Gary Giddey.

[08:50] Team_048 possession (Score: 76-70)
Kyle Irving attempts a 3Pt. Contested by Dirk Herro (4.0 feet, ZONE). Kyle Irving misses. Rebound secured by Dirk Herro.

[08:37] Team_043 possession (Score: 76-70)
Ben LaVine drives, Yao Booker stays with him. Ben LaVine attempts a Layup. Contested by Yao Booker (5.1 feet, MAN). Ben LaVine misses. Rebound secured by DeMar Hyland.

[08:22] Team_048 possession (Score: 76-70)
Yao Booker attempts a 3Pt. Contested by Ben LaVine (5.1 feet, MAN). Yao Booker misses. Offensive rebound by DeMar Hyland! DeMar Hyland kicks it out.

[08:09] Team_048 possession (Score: 76-70)
FOUL! Holding foul on Joel Murray. [Team fouls: 2] No free throws, side out. (Joel Murray: 1 personal fouls)

[07:55] Team_048 possession (Score: 76-70)
Kyle Irving attempts a 3Pt. Contested by Dirk Herro (4.0 feet, MAN). Kyle Irving misses. Rebound secured by Ben LaVine.

[07:39] Team_043 possession (Score: 76-70)
Jabari Holiday attempts a Layup. Contested by DeMar Hyland (3.9 feet, ZONE). JABARI HOLIDAY MAKES IT!
Score: 76-72

[07:26] Team_048 possession (Score: 76-72)
Lauri Curry drives, Jabari Holiday stays with him. Lauri Curry attempts a Dunk. Contested by Jabari Holiday (4.7 feet, MAN). LAURI CURRY MAKES IT! Assist: Gary Giddey
Score: 78-72

[07:14] Team_043 possession (Score: 78-72)
Ben LaVine attempts a 3Pt. Contested by DeMar Hyland (3.8 feet, ZONE). Ben LaVine misses. Rebound secured by Kyle Irving.

[06:59] Team_048 possession (Score: 78-72)
Yao Booker attempts a 3Pt. Contested by Ben LaVine (5.1 feet, MAN). Yao Booker misses. Rebound secured by Ben LaVine.

[06:45] Team_043 possession (Score: 78-72)
Dirk Herro attempts a 3Pt. Contested by DeMar Hyland (3.7 feet, ZONE). DIRK HERRO MAKES IT! Assist: Terry Randle
Score: 78-75

[06:32] Team_048 possession (Score: 78-75)
Gary Giddey drives and kicks out. Kyle Irving attempts a Midrange. Contested by Dirk Herro (4.0 feet, MAN). Kyle Irving misses. Offensive rebound by Kyle Irving! Kyle Irving's putback is no good. Rebound secured by Ben LaVine.

[06:18] Team_043 possession (Score: 78-75)
Joel Murray drives and kicks out. FOUL! Shooting foul on DeMar Hyland. Jabari Holiday to the line for 3 free throws. [Team fouls: 2] (DeMar Hyland: 2 personal fouls)   FT 1/3: GOOD   FT 2/3: MISS   FT 3/3: MISS Jabari Holiday makes 1/3 from the line. Rebound secured by Gary Giddey.
Score: 78-76

[06:05] Team_048 possession (Score: 78-76)
Gary Giddey attempts a Layup. Contested by Terry Randle (4.6 feet, MAN). GARY GIDDEY MAKES IT!
Score: 80-76

[05:53] Team_043 possession (Score: 80-76)
Joel Murray attempts a 3Pt. Contested by DeMar Hyland (3.8 feet, MAN). Joel Murray misses. Rebound secured by Gary Giddey.

[05:36] Team_048 possession (Score: 80-76)
Lauri Curry attempts a Midrange. Contested by Joel Murray (5.8 feet, ZONE). LAURI CURRY MAKES IT!
Score: 82-76

[05:25] Team_043 possession (Score: 82-76)
FOUL! Reach-in foul on DeMar Hyland during the drive. [Team fouls: 3] No free throws, side out. (DeMar Hyland: 3 personal fouls)

[05:12] Team_043 possession (Score: 82-76)
Dirk Herro attempts a 3Pt. Contested by Kyle Irving (4.8 feet, MAN). Dirk Herro misses. Rebound secured by Kyle Irving.

[04:54] Team_048 possession (Score: 82-76)
Kyle Irving drives, Terry Randle stays with him. Kyle Irving attempts a Dunk. Contested by Terry Randle (4.4 feet, ZONE). KYLE IRVING MAKES IT! Assist: Yao Booker
Score: 84-76

[04:41] Team_043 possession (Score: 84-76)
Joel Murray attempts a 3Pt. Contested by DeMar Hyland (3.8 feet, ZONE). JOEL MURRAY MAKES IT! Assist: Jabari Holiday
Score: 84-79

[04:30] Team_048 possession (Score: 84-79)
FOUL! Reach-in foul on Dirk Herro during the drive. [Team fouls: 3] No free throws, side out. (Dirk Herro: 1 personal fouls)

[04:17] Team_048 possession (Score: 84-79)
DeMar Hyland drives, Joel Murray stays with him. DeMar Hyland attempts a Dunk. Contested by Joel Murray (6.0 feet, MAN). DEMAR HYLAND MAKES IT!
Score: 86-79

[04:02] Team_043 possession (Score: 86-79)
FOUL! Holding foul on DeMar Hyland. [Team fouls: 4] No free throws, side out. (DeMar Hyland: 4 personal fouls)

[03:50] Team_043 possession (Score: 86-79)
Joel Murray throws a bad pass! Stolen by DeMar Hyland! TURNOVER! (live ball)

[03:36] Team_048 possession (Score: 86-79)
Gary Giddey makes the Dunk and draws the foul on Terry Randle! And-1! Gary Giddey to the line for 1. [Team fouls: 4] (Terry Randle: 2 personal fouls)   FT 1/1: GOOD Gary Giddey makes 1/1 from the line.
Score: 89-79

[03:22] Team_043 possession (Score: 89-79)
Dirk Herro attempts a 3Pt. Contested by DeMar Hyland (4.0 feet, ZONE). DIRK HERRO MAKES IT! Assist: Jabari Holiday
Score: 89-82

[03:03] Team_048 possession (Score: 89-82)
Kyle Irving drives and kicks out. DeMar Hyland attempts a Midrange. Contested by Ben LaVine (5.3 feet, ZONE). DeMar Hyland misses. Rebound secured by Terry Randle.

[02:51] Team_043 possession (Score: 89-82)
Joel Murray attempts a Layup. Contested by DeMar Hyland (4.0 feet, ZONE). Joel Murray misses. Rebound secured by DeMar Hyland.

[02:36] Team_048 possession (Score: 89-82)
Gary Giddey drives and kicks out. Yao Booker attempts a 3Pt. Contested by Ben LaVine (5.3 feet, MAN). Yao Booker misses. Rebound secured by Dirk Herro.

[02:23] Team_043 possession (Score: 89-82)
Terry Randle makes the Dunk and draws the foul on DeMar Hyland! And-1! Terry Randle to the line for 1. [BONUS: 5 team fouls] (DeMar Hyland: 5 personal fouls)   FT 1/1: GOOD Terry Randle makes 1/1 from the line.
Score: 89-85

[02:10] Team_048 possession (Score: 89-85)
DeMar Hyland attempts a Layup. Wide open! Joel Murray is 6.1 feet away. [MAN] DEMAR HYLAND MAKES IT!
Score: 91-85

[01:57] Team_043 possession (Score: 91-85)
FOUL! Shooting foul on DeMar Hyland. Dirk Herro to the line for 2 free throws. [BONUS: 6 team fouls] (DeMar Hyland: 6 personal fouls) DeMar Hyland FOULS OUT!   FT 1/2: MISS   FT 2/2: GOOD Dirk Herro makes 1/2 from the line.
Score: 91-86

[01:57] Substitution (Team_048): DeMar Hyland OUT (stamina: 67) → Paolo Rozier IN (foul_out)

[01:46] Team_048 possession (Score: 91-86)
Gary Giddey drives to the basket... Gary Giddey throws a bad pass! Stolen by Terry Randle! TURNOVER! (live ball)

[01:31] Team_043 possession (Score: 91-86)
Joel Murray attempts a 3Pt. Contested by Gary Giddey (5.3 feet, MAN). Joel Murray misses. Rebound secured by Paolo Rozier.

[01:16] Team_048 possession (Score: 91-86)
Kyle Irving attempts a Layup. Contested by Dirk Herro (4.1 feet, MAN). KYLE IRVING MAKES IT!
Score: 93-86

[01:02] Team_043 possession (Score: 93-86)
Dirk Herro drives, picks up Gary Giddey. Help arrives from Lauri Curry! Dirk Herro attempts a Dunk. Contested by Lauri Curry (5.4 feet, ZONE). DIRK HERRO MAKES IT! Assist: Jabari Holiday
Score: 93-88

[00:51] Team_048 possession (Score: 93-88)
Yao Booker attempts a 3Pt. Contested by Ben LaVine (5.5 feet, MAN). Yao Booker misses. Rebound secured by Ben LaVine.

[00:39] Team_043 possession (Score: 93-88)
Dirk Herro drives, picks up Gary Giddey. Help arrives from Lauri Curry! Dirk Herro attempts a Dunk. Contested by Lauri Curry (5.5 feet, ZONE). Dirk Herro misses. Rebound secured by Kyle Irving.

[00:25] Team_048 possession (Score: 93-88)
Yao Booker attempts a 3Pt. Wide open! Joel Murray is 6.2 feet away. [ZONE] YAO BOOKER MAKES IT! Assist: Lauri Curry
Score: 96-88

[00:09] Team_043 possession (Score: 96-88)
Joel Murray attempts a Midrange. Contested by Gary Giddey (5.5 feet, MAN). Joel Murray misses. Offensive rebound by Terry Randle! Terry Randle kicks it out.

================================================================================
                              4TH QUARTER COMPLETE                              
================================================================================

4TH QUARTER SCORE: Team_048 24, Team_043 24

BOX SCORE:
================================================================================

Team_048
--------------------------------------------------------------------------------
Player                MIN  PTS  REB  AST  TO      FG   FG%      3P   3P%
--------------------------------------------------------------------------------
Kyle Irving            23    6    4    0   0   3/7    42.9     0/0   0.0
DeMar Hyland           21    6    3    0   0   3/3   100.0     0/0   0.0
Gary Giddey            23    5    4    1   0   2/5    40.0     0/0   0.0
Lauri Curry            23    4    0    1   0   2/2   100.0     0/0   0.0
Yao Booker             23    3    0    1   0   1/4    25.0     0/0   0.0
Paolo Rozier           28    0    1    0   0   0/0     0.0     0/0   0.0

TEAM: FG: 11/21 (52.4%), 3PT: 1/7 (14.3%), REB: 13 (3 off, 10 def), AST: 3, TO: 2
TEAM FOULS: 6 [Team_043 in BONUS]


Team_043
--------------------------------------------------------------------------------
Player                MIN  PTS  REB  AST  TO      FG   FG%      3P   3P%
--------------------------------------------------------------------------------
Dirk Herro             21    9    3    0   0   4/8    50.0     0/0   0.0
Terry Randle           23    5    3    1   0   2/2   100.0     0/0   0.0
Jabari Holiday         23    4    0    3   0   2/2   100.0     0/0   0.0
Joel Murray            23    3    0    0   0   1/5    20.0     0/0   0.0
D'Angelo Iverson       27    2    1    1   0   1/1   100.0     0/0   0.0
Ben LaVine             23    0    5    0   0   0/2     0.0     0/0   0.0

TEAM: FG: 10/20 (50.0%), 3PT: 3/7 (42.9%), REB: 11 (2 off, 9 def), AST: 5, TO: 2
TEAM FOULS: 4

================================================================================

================================================================================
                               FULL GAME COMPLETE                               
================================================================================

FINAL SCORE: Team_048 96, Team_043 88

SCORING BY QUARTER:
--------------------------------------------------------------------------------
Team                     Q1     Q2     Q3     Q4    FINAL
--------------------------------------------------------------------------------
Team_048                 26     20     26     24       96
Team_043                 29     16     19     24       88
--------------------------------------------------------------------------------

FULL GAME BOX SCORE:
================================================================================

Team_048
--------------------------------------------------------------------------------
Player                MIN  PTS  REB  AST  TO      FG   FG%      3P   3P%      FT STL BLK
--------------------------------------------------------------------------------
Paolo Rozier           28    5    1    2   1   2/5    40.0   1/3    33.3   2/2     0   0
Karl Johnson           26   11    0    1   0   4/11   36.4   1/4    25.0   1/2     0   0
Dejounte Sexton        26    6    8    1   0   3/10   30.0   2/6    33.3   1/2     1   0
Kevin Fox              26   17    8    0   1   7/11   63.6   1/2    50.0   2/3     1   0
Damian Mobley          26   10    9    4   2   5/7    71.4   0/0     0.0   2/2     0   0
Lauri Curry            23    4    0    1   1   2/3    66.7   0/1     0.0   0/0     0   0
Yao Booker             23    8    0    1   1   3/7    42.9   1/5    20.0   1/1     0   0
Kyle Irving            23   10    8    0   0   4/9    44.4   0/3     0.0   0/1     0   1
Gary Giddey            23    9    9    1   0   5/12   41.7   0/1     0.0   1/1     0   0
DeMar Hyland           21   11    9    0   0   5/7    71.4   1/2    50.0   7/7     1   1

TEAM: FG: 40/82 (48.8%), 3PT: 7/27 (25.9%), REB: 54 (13 off, 41 def), AST: 11, TO: 6


Team_043
--------------------------------------------------------------------------------
Player                MIN  PTS  REB  AST  TO      FG   FG%      3P   3P%      FT STL BLK
--------------------------------------------------------------------------------
D'Angelo Iverson       27    9   10    1   1   4/9    44.4   1/4    25.0   0/0     0   0
Malcolm Murray         26    5    0    1   0   1/3    33.3   1/2    50.0   2/2     0   1
Magic Durant           26   11    0    1   2   5/9    55.6   0/3     0.0   1/1     0   0
Manu Carter            26   17    9    3   1   8/13   61.5   1/2    50.0   5/5     0   1
Dwyane Dosunmu         26    9   10    3   1   4/6    66.7   0/0     0.0   1/3     0   0
Jabari Holiday         23    4    0    4   0   2/4    50.0   0/1     0.0   1/3     0   0
Ben LaVine             23    2    7    1   1   1/9    11.1   0/4     0.0   0/1     0   0
Joel Murray            23    3    0    0   1   1/6    16.7   1/3    33.3   0/0     0   0
Terry Randle           23   10    8    2   1   4/7    57.1   0/1     0.0   3/3     1   0
Dirk Herro             21   13    7    0   0   6/11   54.5   2/3    66.7   3/4     0   0

TEAM: FG: 37/78 (47.4%), 3PT: 6/23 (26.1%), REB: 49 (10 off, 39 def), AST: 16, TO: 8

================================================================================
