================================================================================
                        FULL GAME - Team_059 vs Team_089                        
================================================================================

================================================================================
                       1ST QUARTER - Team_059 vs Team_089                       
================================================================================

[12:00] Team_059 possession (Score: 0-0)
Nikola Jokic drives and kicks out. Jarrett Smith attempts a 3Pt. Contested by Allen Mobley (4.1 feet, ZONE). JARRETT SMITH MAKES IT! Assist: John Iverson
Score: 3-0

[11:46] Team_089 possession (Score: 3-0)
Jalen Jackson attempts a 3Pt. Contested by Bam Wade (4.0 feet, ZONE). Jalen Jackson misses. Rebound secured by Bam Wade.

[11:27] Team_059 possession (Score: 3-0)
Nikola Jokic attempts a 3Pt. Contested by Rudy Smith (4.8 feet, MAN). NIKOLA JOKIC MAKES IT! Assist: Jarrett Smith
Score: 6-0

[11:11] Team_089 possession (Score: 6-0)
Rudy Smith attempts a 3Pt. Contested by Nikola Jokic (5.9 feet, MAN). Rudy Smith misses. Offensive rebound by Terry Simmons! Terry Simmons puts it back in!
Score: 6-2

[10:58] Team_059 possession (Score: 6-2)
Nikola Jokic attempts a Layup. BLOCKED BY RUDY SMITH! Ball is loose! Rebound secured by Terry Simmons.

[10:44] Team_089 possession (Score: 6-2)
Allen Mobley drives and kicks out. Allen Mobley attempts a 3Pt. Contested by John Iverson (5.3 feet, MAN). Allen Mobley misses. Rebound secured by Bam Wade.

[10:27] Team_059 possession (Score: 6-2)
Bam Wade attempts a Layup. Contested by Jordan Brogdon (3.7 feet, MAN). BAM WADE MAKES IT! Assist: Blake Tatum
Score: 8-2

[10:10] Team_089 possession (Score: 8-2)
FOUL! Shooting foul on Jarrett Smith. Jalen Jackson to the line for 2 free throws. [Team fouls: 1] (Jarrett Smith: 1 personal fouls)   FT 1/2: GOOD   FT 2/2: MISS Jalen Jackson makes 1/2 from the line. Offensive rebound by Jalen Jackson! Jalen Jackson kicks it out.
Score: 8-3

[09:56] Team_089 possession (Score: 8-3)
Jalen Jackson attempts a 3Pt. Contested by Bam Wade (4.0 feet, ZONE). Jalen Jackson misses. Offensive rebound by Jalen Jackson! Jalen Jackson kicks it out.

[09:40] Team_089 possession (Score: 8-3)
FOUL! Holding foul on Blake Tatum. [Team fouls: 2] No free throws, side out. (Blake Tatum: 1 personal fouls)

[09:25] Team_089 possession (Score: 8-3)
Jordan Brogdon attempts a 3Pt. Contested by Bam Wade (3.8 feet, MAN). Jordan Brogdon misses. Offensive rebound by Terry Simmons! Terry Simmons's putback is no good. Rebound secured by Bam Wade.

[09:13] Team_059 possession (Score: 8-3)
Jarrett Smith drives to the basket... Jarrett Smith throws a bad pass out of bounds! TURNOVER! (dead ball)

[09:01] Team_089 possession (Score: 8-3)
Allen Mobley drives, Nikola Jokic stays with him. Allen Mobley attempts a Layup. Contested by Nikola Jokic (5.4 feet, ZONE). ALLEN MOBLEY MAKES IT! Assist: Rudy Smith
Score: 8-5

[08:46] Team_059 possession (Score: 8-5)
Bam Wade makes the Layup and draws the foul on Terry Simmons! And-1! Bam Wade to the line for 1. [Team fouls: 1] (Terry Simmons: 1 personal fouls)   FT 1/1: GOOD Bam Wade makes 1/1 from the line.
Score: 11-5

[08:31] Team_089 possession (Score: 11-5)
FOUL! Shooting foul on Blake Tatum. Jalen Jackson to the line for 2 free throws. [Team fouls: 3] (Blake Tatum: 2 personal fouls)   FT 1/2: GOOD   FT 2/2: GOOD Jalen Jackson makes 2/2 from the line.
Score: 11-7

[08:15] Team_059 possession (Score: 11-7)
Blake Tatum attempts a Layup. Contested by Terry Simmons (3.4 feet, ZONE). Blake Tatum misses. Rebound secured by Jalen Jackson.

[08:03] Team_089 possession (Score: 11-7)
Rudy Smith makes the Layup and draws the foul on Jarrett Smith! And-1! Rudy Smith to the line for 1. [Team fouls: 4] (Jarrett Smith: 2 personal fouls)   FT 1/1: GOOD Rudy Smith makes 1/1 from the line.
Score: 11-10

[07:47] Team_059 possession (Score: 11-10)
FOUL! Reach-in foul on Terry Simmons during the drive. [Team fouls: 2] No free throws, side out. (Terry Simmons: 2 personal fouls)

[07:35] Team_059 possession (Score: 11-10)
Nikola Jokic drives to the basket... Nikola Jokic throws a bad pass! Stolen by Rudy Smith! TURNOVER! (live ball)

[07:17] Team_089 possession (Score: 11-10)
FOUL! Holding foul on Blake Tatum. [IN THE BONUS! 5 team fouls] Jalen Jackson to the line for 2 free throws. (Blake Tatum: 3 personal fouls)   FT 1/2: MISS   FT 2/2: MISS Jalen Jackson makes 0/2 from the line. Rebound secured by John Iverson.

[07:04] Team_059 possession (Score: 11-10)
Nikola Jokic drives to the basket... Nikola Jokic loses the ball! Stripped by Rudy Smith! TURNOVER! (live ball)

[06:49] Team_089 possession (Score: 11-10)
Jalen Jackson attempts a Layup. Contested by Blake Tatum (4.5 feet, MAN). JALEN JACKSON MAKES IT! Assist: Allen Mobley
Score: 11-12

[06:39] Team_059 possession (Score: 11-12)
Bam Wade attempts a 3Pt. Contested by Jordan Brogdon (3.7 feet, MAN). BAM WADE MAKES IT! Assist: Jarrett Smith
Score: 14-12

[06:22] Team_089 possession (Score: 14-12)
Allen Mobley makes the Layup and draws the foul on John Iverson! And-1! Allen Mobley to the line for 1. [BONUS: 6 team fouls] (John Iverson: 1 personal fouls)   FT 1/1: GOOD Allen Mobley makes 1/1 from the line.
Score: 14-15

[06:06] Team_059 possession (Score: 14-15)
Nikola Jokic attempts a 3Pt. Contested by Jordan Brogdon (3.3 feet, ZONE). Nikola Jokic misses. Rebound secured by Jalen Jackson.

[05:51] Team_089 possession (Score: 14-15)
Jalen Jackson attempts a Midrange. Contested by Blake Tatum (4.5 feet, ZONE). Jalen Jackson misses. Rebound secured by Bam Wade.

[05:36] Team_059 possession (Score: 14-15)
John Iverson attempts a 3Pt. Contested by Allen Mobley (4.2 feet, MAN). JOHN IVERSON MAKES IT! Assist: Jarrett Smith
Score: 17-15

[05:21] Team_089 possession (Score: 17-15)
Rudy Smith attempts a Midrange. Contested by Nikola Jokic (5.9 feet, MAN). Rudy Smith misses. Rebound secured by Bam Wade.

[05:05] Team_059 possession (Score: 17-15)
John Iverson attempts a 3Pt. Contested by Allen Mobley (4.2 feet, MAN). John Iverson misses. Offensive rebound by Jarrett Smith! Jarrett Smith kicks it out.

[04:52] Team_059 possession (Score: 17-15)
Blake Tatum makes the Midrange and draws the foul on Rudy Smith! And-1! Blake Tatum to the line for 1. [Team fouls: 3] (Rudy Smith: 1 personal fouls)   FT 1/1: GOOD Blake Tatum makes 1/1 from the line.
Score: 20-15

[04:36] Team_089 possession (Score: 20-15)
Allen Mobley drives and kicks out. Allen Mobley attempts a 3Pt. Contested by John Iverson (5.4 feet, MAN). Allen Mobley misses. Rebound secured by Bam Wade.

[04:20] Team_059 possession (Score: 20-15)
Bam Wade makes the Dunk and draws the foul on Jordan Brogdon! And-1! Bam Wade to the line for 1. [Team fouls: 4] (Jordan Brogdon: 1 personal fouls)   FT 1/1: GOOD Bam Wade makes 1/1 from the line.
Score: 23-15

[04:03] Team_089 possession (Score: 23-15)
Terry Simmons attempts a Midrange. Contested by Bam Wade (4.4 feet, ZONE). Terry Simmons misses. Rebound secured by Jarrett Smith.

[03:50] Team_059 possession (Score: 23-15)
Bam Wade attempts a 3Pt. Contested by Jordan Brogdon (3.8 feet, ZONE). Bam Wade misses. Rebound secured by Jalen Jackson.

[03:35] Team_089 possession (Score: 23-15)
FOUL! Shooting foul on Jarrett Smith. Jordan Brogdon to the line for 2 free throws. [BONUS: 7 team fouls] (Jarrett Smith: 3 personal fouls)   FT 1/2: GOOD   FT 2/2: GOOD Jordan Brogdon makes 2/2 from the line.
Score: 23-17

[03:18] Team_059 possession (Score: 23-17)
Blake Tatum attempts a Midrange. Contested by Jalen Jackson (4.7 feet, MAN). Blake Tatum misses. Rebound secured by Rudy Smith.

[03:03] Team_089 possession (Score: 23-17)
Terry Simmons drives, picks up Jarrett Smith. Help arrives from Bam Wade! Terry Simmons attempts a Layup. Contested by Bam Wade (5.2 feet, ZONE). TERRY SIMMONS MAKES IT! Assist: Allen Mobley
Score: 23-19

[02:48] Team_059 possession (Score: 23-19)
FOUL! Holding foul on Jordan Brogdon. [IN THE BONUS! 5 team fouls] Bam Wade to the line for 2 free throws. (Jordan Brogdon: 2 personal fouls)   FT 1/2: GOOD   FT 2/2: GOOD Bam Wade makes 2/2 from the line.
Score: 25-19

[02:34] Team_089 possession (Score: 25-19)
Jalen Jackson drives, Blake Tatum stays with him. Jalen Jackson attempts a Layup. Contested by Blake Tatum (4.7 feet, MAN). Jalen Jackson misses. Offensive rebound by Jalen Jackson! Jalen Jackson kicks it out.

[02:17] Team_089 possession (Score: 25-19)
Allen Mobley drives to the basket... FOUL! Offensive foul on Allen Mobley! Nikola Jokic drew the charge! [Team fouls: 6] (Allen Mobley: 1 personal fouls) TURNOVER! (dead ball)

[02:01] Team_059 possession (Score: 25-19)
Jarrett Smith attempts a Layup. Contested by Terry Simmons (4.2 feet, MAN). JARRETT SMITH MAKES IT! Assist: Nikola Jokic
Score: 27-19

[01:45] Team_089 possession (Score: 27-19)
Jordan Brogdon drives to the basket... Jordan Brogdon throws a bad pass! Stolen by Bam Wade! TURNOVER! (live ball)

[01:27] Team_059 possession (Score: 27-19)
FOUL! Shooting foul on Allen Mobley. John Iverson to the line for 2 free throws. [BONUS: 7 team fouls] (Allen Mobley: 2 personal fouls)   FT 1/2: MISS   FT 2/2: GOOD John Iverson makes 1/2 from the line.
Score: 28-19

[01:15] Team_089 possession (Score: 28-19)
Rudy Smith drives, Nikola Jokic stays with him. Rudy Smith attempts a Layup. Wide open! Nikola Jokic is 6.1 feet away. [MAN] RUDY SMITH MAKES IT!
Score: 28-21

[00:59] Team_059 possession (Score: 28-21)
Jarrett Smith drives and kicks out. Jarrett Smith attempts a 3Pt. Contested by Jordan Brogdon (3.7 feet, ZONE). Jarrett Smith misses. Rebound secured by Jalen Jackson.

[00:43] Team_089 possession (Score: 28-21)
Jalen Jackson attempts a 3Pt. Contested by Blake Tatum (4.9 feet, MAN). JALEN JACKSON MAKES IT! Assist: Allen Mobley
Score: 28-24

[00:28] Team_059 possession (Score: 28-24)
John Iverson attempts a Midrange. Contested by Allen Mobley (4.4 feet, MAN). John Iverson misses. Offensive rebound by Jarrett Smith! Jarrett Smith kicks it out.

[00:10] Team_059 possession (Score: 28-24)
Blake Tatum attempts a Midrange. Contested by Rudy Smith (5.0 feet, ZONE). BLAKE TATUM MAKES IT! Assist: Nikola Jokic
Score: 30-24

================================================================================
                              1ST QUARTER COMPLETE                              
================================================================================

1ST QUARTER SCORE: Team_059 30, Team_089 24

BOX SCORE:
================================================================================

Team_059
--------------------------------------------------------------------------------
Player                MIN  PTS  REB  AST  TO      FG   FG%      3P   3P%
--------------------------------------------------------------------------------
Bam Wade               12   13    6    0   0   5/6    83.3     0/0   0.0
Jarrett Smith          12    5    3    3   0   2/3    66.7     0/0   0.0
Blake Tatum            12    5    0    1   0   2/4    50.0     0/0   0.0
John Iverson           12    4    1    1   0   2/2   100.0     0/0   0.0
Nikola Jokic           12    3    0    2   0   1/3    33.3     0/0   0.0

TEAM: FG: 12/18 (66.7%), 3PT: 3/5 (60.0%), REB: 9 (2 off, 7 def), AST: 7, TO: 3
TEAM FOULS: 7 [Team_089 in BONUS]


Team_089
--------------------------------------------------------------------------------
Player                MIN  PTS  REB  AST  TO      FG   FG%      3P   3P%
--------------------------------------------------------------------------------
Jalen Jackson          12    7    7    0   0   3/5    60.0     0/0   0.0
Allen Mobley           12    5    0    3   0   2/4    50.0     0/0   0.0
Rudy Smith             12    5    1    1   0   2/3    66.7     0/0   0.0
Terry Simmons          12    4    2    0   0   2/3    66.7     0/0   0.0
Jordan Brogdon         12    2    0    0   0   1/2    50.0     0/0   0.0

TEAM: FG: 10/18 (55.6%), 3PT: 2/4 (50.0%), REB: 11 (5 off, 6 def), AST: 4, TO: 2
TEAM FOULS: 7 [Team_059 in BONUS]

================================================================================

================================================================================
                       2ND QUARTER - Team_059 vs Team_089                       
================================================================================

[12:00] Team_059 possession (Score: 30-24)
Jarrett Smith attempts a Layup. BLOCKED BY TERRY SIMMONS! Ball goes out off Terry Simmons. Jarrett Smith's ball!

[11:51] Team_059 possession (Score: 30-24)
Bam Wade drives, Terry Simmons stays with him. Bam Wade attempts a Dunk. Contested by Terry Simmons (4.3 feet, ZONE). BAM WADE MAKES IT!
Score: 32-24

[11:35] Team_089 possession (Score: 32-24)
Jordan Brogdon drives to the basket... Jordan Brogdon throws a bad pass! Stolen by Bam Wade! TURNOVER! (live ball)

[11:22] Team_059 possession (Score: 32-24)
Blake Tatum drives and kicks out. Jarrett Smith attempts a 3Pt. Contested by Terry Simmons (3.9 feet, MAN). Jarrett Smith misses. Rebound secured by Rudy Smith.

[11:10] Team_089 possession (Score: 32-24)
FOUL! Holding foul on Bam Wade. [Team fouls: 1] No free throws, side out. (Bam Wade: 1 personal fouls)

[10:57] Team_089 possession (Score: 32-24)
Rudy Smith drives, Jarrett Smith stays with him. Rudy Smith attempts a Dunk. Contested by Jarrett Smith (5.2 feet, ZONE). Rudy Smith misses. Rebound secured by Jarrett Smith.

[10:45] Team_059 possession (Score: 32-24)
Nikola Jokic attempts a 3Pt. Contested by Jordan Brogdon (3.8 feet, ZONE). Nikola Jokic misses. Rebound secured by Jalen Jackson.

[10:33] Team_089 possession (Score: 32-24)
Jalen Jackson attempts a 3Pt. Contested by Blake Tatum (4.9 feet, MAN). JALEN JACKSON MAKES IT! Assist: Terry Simmons
Score: 32-27

[10:22] Team_059 possession (Score: 32-27)
FOUL! Holding foul on Allen Mobley. [Team fouls: 1] No free throws, side out. (Allen Mobley: 1 personal fouls)

[10:11] Team_059 possession (Score: 32-27)
Jarrett Smith makes the Layup and draws the foul on Jalen Jackson! And-1! Jarrett Smith to the line for 1. [Team fouls: 2] (Jalen Jackson: 1 personal fouls)   FT 1/1: GOOD Jarrett Smith makes 1/1 from the line.
Score: 35-27

[09:59] Team_089 possession (Score: 35-27)
Jalen Jackson attempts a 3Pt. Contested by Blake Tatum (5.0 feet, MAN). Jalen Jackson misses. Rebound secured by Nikola Jokic.

[09:43] Team_059 possession (Score: 35-27)
FOUL! Holding foul on Jordan Brogdon. [Team fouls: 3] No free throws, side out. (Jordan Brogdon: 1 personal fouls)

[09:25] Team_059 possession (Score: 35-27)
Jarrett Smith drives to the basket... Jarrett Smith loses the ball! Stripped by Terry Simmons! TURNOVER! (live ball)

[09:09] Team_089 possession (Score: 35-27)
Allen Mobley attempts a Layup. Wide open! John Iverson is 6.0 feet away. [MAN] ALLEN MOBLEY MAKES IT!
Score: 35-29

[08:54] Team_059 possession (Score: 35-29)
FOUL! Shooting foul on Rudy Smith. Nikola Jokic to the line for 2 free throws. [Team fouls: 4] (Rudy Smith: 1 personal fouls)   FT 1/2: GOOD   FT 2/2: GOOD Nikola Jokic makes 2/2 from the line.
Score: 37-29

[08:42] Team_089 possession (Score: 37-29)
Jalen Jackson attempts a Midrange. Wide open! Nikola Jokic is 6.1 feet away. [ZONE] JALEN JACKSON MAKES IT!
Score: 37-31

[08:26] Team_059 possession (Score: 37-31)
Blake Tatum attempts a 3Pt. Contested by Jordan Brogdon (4.0 feet, ZONE). BLAKE TATUM MAKES IT! Assist: John Iverson
Score: 40-31

[08:08] Team_089 possession (Score: 40-31)
Terry Simmons attempts a Layup. Contested by Jarrett Smith (5.6 feet, ZONE). Terry Simmons misses. Offensive rebound by Jalen Jackson! Jalen Jackson kicks it out.

[07:54] Team_089 possession (Score: 40-31)
Rudy Smith attempts a 3Pt. Contested by Bam Wade (5.0 feet, ZONE). Rudy Smith misses. Rebound secured by Jarrett Smith.

[07:43] Team_059 possession (Score: 40-31)
John Iverson attempts a 3Pt. Contested by Jordan Brogdon (4.2 feet, ZONE). John Iverson misses. Rebound secured by Terry Simmons.

[07:26] Team_089 possession (Score: 40-31)
Jalen Jackson attempts a 3Pt. Contested by Blake Tatum (5.3 feet, MAN). Jalen Jackson misses. Rebound secured by Nikola Jokic.

[07:09] Team_059 possession (Score: 40-31)
Nikola Jokic attempts a 3Pt. Contested by Rudy Smith (5.6 feet, MAN). Nikola Jokic misses. Rebound secured by Terry Simmons.

[06:53] Team_089 possession (Score: 40-31)
Terry Simmons drives, Jarrett Smith stays with him. Terry Simmons attempts a Layup. Contested by Jarrett Smith (5.7 feet, ZONE). TERRY SIMMONS MAKES IT! Assist: Jalen Jackson
Score: 40-33

[06:36] Team_059 possession (Score: 40-33)
FOUL! Shooting foul on Jordan Brogdon. Bam Wade to the line for 3 free throws. [BONUS: 5 team fouls] (Jordan Brogdon: 2 personal fouls)   FT 1/3: GOOD   FT 2/3: GOOD   FT 3/3: GOOD Bam Wade makes 3/3 from the line.
Score: 43-33

[06:22] Team_089 possession (Score: 43-33)
Jordan Brogdon attempts a 3Pt. Contested by Bam Wade (4.8 feet, MAN). Jordan Brogdon misses. Rebound secured by Jarrett Smith.

[06:04] Team_059 possession (Score: 43-33)
Nikola Jokic attempts a Layup. Contested by Terry Simmons (4.8 feet, ZONE). Nikola Jokic misses. Rebound secured by Terry Simmons.

[05:49] Team_089 possession (Score: 43-33)
Jordan Brogdon attempts a 3Pt. Contested by Bam Wade (4.8 feet, MAN). Jordan Brogdon misses. Rebound secured by John Iverson.

[05:33] Team_059 possession (Score: 43-33)
John Iverson attempts a 3Pt. Contested by Jordan Brogdon (4.5 feet, ZONE). John Iverson misses. Rebound secured by Allen Mobley.

[05:19] Team_089 possession (Score: 43-33)
Jordan Brogdon attempts a Layup. Contested by Bam Wade (4.9 feet, MAN). Jordan Brogdon misses. Rebound secured by John Iverson.

[05:02] Team_059 possession (Score: 43-33)
Bam Wade attempts a Midrange. Contested by Jordan Brogdon (4.9 feet, MAN). Bam Wade misses. Rebound secured by Terry Simmons.

[04:46] Team_089 possession (Score: 43-33)
Jalen Jackson attempts a Midrange. Contested by Blake Tatum (5.6 feet, MAN). Jalen Jackson misses. Rebound secured by John Iverson.

[04:33] Team_059 possession (Score: 43-33)
Bam Wade attempts a 3Pt. Contested by Jordan Brogdon (5.0 feet, ZONE). Bam Wade misses. Rebound secured by Terry Simmons.

[04:19] Team_089 possession (Score: 43-33)
Rudy Smith makes the Midrange and draws the foul on Bam Wade! And-1! Rudy Smith to the line for 1. [Team fouls: 2] (Bam Wade: 2 personal fouls)   FT 1/1: GOOD Rudy Smith makes 1/1 from the line.
Score: 43-36

[04:05] Team_059 possession (Score: 43-36)
Blake Tatum attempts a Midrange. Contested by Jalen Jackson (5.7 feet, ZONE). Blake Tatum misses. Rebound secured by Allen Mobley.

[03:52] Team_089 possession (Score: 43-36)
Jalen Jackson attempts a 3Pt. Contested by Blake Tatum (5.7 feet, MAN). JALEN JACKSON MAKES IT! Assist: Terry Simmons
Score: 43-39

[03:38] Team_059 possession (Score: 43-39)
Nikola Jokic attempts a Layup. Contested by Terry Simmons (5.2 feet, ZONE). NIKOLA JOKIC MAKES IT!
Score: 45-39

[03:20] Team_089 possession (Score: 45-39)
Jordan Brogdon attempts a Midrange. Contested by Bam Wade (5.2 feet, MAN). JORDAN BROGDON MAKES IT!
Score: 45-41

[03:08] Team_059 possession (Score: 45-41)
Jarrett Smith attempts a Layup. Contested by Terry Simmons (5.4 feet, ZONE). JARRETT SMITH MAKES IT!
Score: 47-41

[02:57] Team_089 possession (Score: 47-41)
Rudy Smith attempts a Midrange. Wide open! Nikola Jokic is 6.8 feet away. [MAN] RUDY SMITH MAKES IT! Assist: Jalen Jackson
Score: 47-43

[02:39] Team_059 possession (Score: 47-43)
FOUL! Shooting foul on Rudy Smith. Nikola Jokic to the line for 2 free throws. [BONUS: 6 team fouls] (Rudy Smith: 2 personal fouls)   FT 1/2: MISS   FT 2/2: GOOD Nikola Jokic makes 1/2 from the line.
Score: 48-43

[02:24] Team_089 possession (Score: 48-43)
Jalen Jackson attempts a Midrange. Contested by Blake Tatum (5.9 feet, MAN). JALEN JACKSON MAKES IT!
Score: 48-45

[02:12] Team_059 possession (Score: 48-45)
Blake Tatum attempts a 3Pt. Wide open! Jalen Jackson is 6.0 feet away. [MAN] Blake Tatum misses. Rebound secured by Jalen Jackson.

[02:01] Team_089 possession (Score: 48-45)
Jordan Brogdon attempts a 3Pt. Contested by Bam Wade (5.4 feet, ZONE). Jordan Brogdon misses. Rebound secured by Nikola Jokic.

[01:48] Team_059 possession (Score: 48-45)
Jarrett Smith attempts a Midrange. Contested by Allen Mobley (5.7 feet, ZONE). Jarrett Smith misses. Offensive rebound by Jarrett Smith! Jarrett Smith kicks it out.

[01:36] Team_059 possession (Score: 48-45)
Nikola Jokic attempts a Midrange. Wide open! Rudy Smith is 6.4 feet away. [MAN] Nikola Jokic misses. Rebound secured by Jalen Jackson.

[01:23] Team_089 possession (Score: 48-45)
Rudy Smith attempts a Midrange. Wide open! Nikola Jokic is 7.0 feet away. [MAN] RUDY SMITH MAKES IT!
Score: 48-47

[01:09] Team_059 possession (Score: 48-47)
Nikola Jokic attempts a 3Pt. Wide open! Rudy Smith is 6.4 feet away. [MAN] Nikola Jokic misses. Rebound secured by Allen Mobley.

[00:56] Team_089 possession (Score: 48-47)
Rudy Smith attempts a Midrange. Wide open! Blake Tatum is 6.3 feet away. [ZONE] Rudy Smith misses. Rebound secured by Nikola Jokic.

[00:43] Team_059 possession (Score: 48-47)
Nikola Jokic drives and kicks out. Nikola Jokic attempts a 3Pt. Contested by Jordan Brogdon (5.6 feet, ZONE). Nikola Jokic misses. Rebound secured by Terry Simmons.

[00:29] Team_089 possession (Score: 48-47)
Rudy Smith drives and kicks out. Jordan Brogdon makes the Midrange and draws the foul on John Iverson! And-1! Jordan Brogdon to the line for 1. [Team fouls: 3] (John Iverson: 1 personal fouls)   FT 1/1: GOOD Jordan Brogdon makes 1/1 from the line.
Score: 48-50

[00:16] Team_059 possession (Score: 48-50)
John Iverson attempts a Midrange. Wide open! Rudy Smith is 6.5 feet away. [ZONE] John Iverson misses. Rebound secured by Jalen Jackson.

[00:04] Team_089 possession (Score: 48-50)
Terry Simmons drives to the basket... Terry Simmons loses the ball! Stripped by Jarrett Smith! TURNOVER! (live ball)

================================================================================
                              2ND QUARTER COMPLETE                              
================================================================================

2ND QUARTER SCORE: Team_059 18, Team_089 26

BOX SCORE:
================================================================================

Team_059
--------------------------------------------------------------------------------
Player                MIN  PTS  REB  AST  TO      FG   FG%      3P   3P%
--------------------------------------------------------------------------------
Bam Wade               24    5    0    0   0   2/4    50.0     0/0   0.0
Jarrett Smith          24    5    4    0   0   2/2   100.0     0/0   0.0
Nikola Jokic           24    5    4    0   0   3/9    33.3     0/0   0.0
Blake Tatum            24    3    0    0   0   1/4    25.0     0/0   0.0
John Iverson           24    0    3    1   0   0/3     0.0     0/0   0.0

TEAM: FG: 8/22 (36.4%), 3PT: 2/9 (22.2%), REB: 11 (1 off, 10 def), AST: 1, TO: 1
TEAM FOULS: 3


Team_089
--------------------------------------------------------------------------------
Player                MIN  PTS  REB  AST  TO      FG   FG%      3P   3P%
--------------------------------------------------------------------------------
Jalen Jackson          24   10    5    2   0   4/7    57.1     0/0   0.0
Rudy Smith             24    7    1    0   0   3/6    50.0     0/0   0.0
Jordan Brogdon         24    5    0    0   0   2/6    33.3     0/0   0.0
Terry Simmons          24    2    6    2   0   1/1   100.0     0/0   0.0
Allen Mobley           24    2    3    0   0   1/1   100.0     0/0   0.0

TEAM: FG: 11/21 (52.4%), 3PT: 2/8 (25.0%), REB: 15 (1 off, 14 def), AST: 4, TO: 2
TEAM FOULS: 6 [Team_059 in BONUS]

================================================================================

================================================================================
                       3RD QUARTER - Team_059 vs Team_089                       
================================================================================

[12:00] Team_059 possession (Score: 48-50)
Nikola Jokic attempts a 3Pt. Contested by Jordan Brogdon (3.3 feet, ZONE). Nikola Jokic misses. Rebound secured by Jalen Jackson.

[11:45] Team_089 possession (Score: 48-50)
Allen Mobley attempts a 3Pt. Contested by Bam Wade (3.8 feet, ZONE). Allen Mobley misses. Rebound secured by Jarrett Smith.

[11:35] Team_059 possession (Score: 48-50)
Jarrett Smith attempts a Midrange. Contested by Jordan Brogdon (3.6 feet, ZONE). Jarrett Smith misses. Rebound secured by Rudy Smith.

[11:21] Team_089 possession (Score: 48-50)
Jalen Jackson drives, picks up Blake Tatum. Help arrives from Bam Wade! Jalen Jackson attempts a Layup. Contested by Bam Wade (4.5 feet, MAN). JALEN JACKSON MAKES IT! Assist: Rudy Smith
Score: 48-52

[11:03] Team_059 possession (Score: 48-52)
Jarrett Smith attempts a Midrange. Contested by Terry Simmons (3.9 feet, MAN). Jarrett Smith misses. Rebound secured by Rudy Smith.

[10:51] Team_089 possession (Score: 48-52)
Rudy Smith attempts a Midrange. Contested by John Iverson (5.8 feet, ZONE). Rudy Smith misses. Rebound secured by John Iverson.

[10:35] Team_059 possession (Score: 48-52)
Jarrett Smith makes the Midrange and draws the foul on Rudy Smith! And-1! Jarrett Smith to the line for 1. [Team fouls: 1] (Rudy Smith: 1 personal fouls)   FT 1/1: GOOD Jarrett Smith makes 1/1 from the line.
Score: 51-52

[10:18] Team_089 possession (Score: 51-52)
Terry Simmons attempts a Midrange. Contested by Jarrett Smith (5.1 feet, MAN). Terry Simmons misses. Offensive rebound by Terry Simmons! Terry Simmons puts it back in!
Score: 51-54

[10:05] Team_059 possession (Score: 51-54)
Blake Tatum attempts a 3Pt. Contested by Jalen Jackson (4.6 feet, MAN). Blake Tatum misses. Rebound secured by Jalen Jackson.

[09:53] Team_089 possession (Score: 51-54)
Allen Mobley drives and kicks out. Rudy Smith attempts a 3Pt. Contested by Bam Wade (3.7 feet, ZONE). RUDY SMITH MAKES IT! Assist: Allen Mobley
Score: 51-57

[09:40] Team_059 possession (Score: 51-57)
Nikola Jokic attempts a Midrange. Contested by Rudy Smith (4.8 feet, MAN). Nikola Jokic misses. Rebound secured by Rudy Smith.

[09:29] Team_089 possession (Score: 51-57)
Rudy Smith attempts a 3Pt. Contested by Bam Wade (4.2 feet, ZONE). RUDY SMITH MAKES IT! Assist: Allen Mobley
Score: 51-60

[09:16] Team_059 possession (Score: 51-60)
Nikola Jokic drives and kicks out. Nikola Jokic attempts a Midrange. Contested by Rudy Smith (4.7 feet, MAN). NIKOLA JOKIC MAKES IT! Assist: Bam Wade
Score: 53-60

[08:58] Team_089 possession (Score: 53-60)
Jalen Jackson attempts a 3Pt. Contested by Bam Wade (4.0 feet, ZONE). JALEN JACKSON MAKES IT! Assist: Allen Mobley
Score: 53-63

[08:42] Team_059 possession (Score: 53-63)
Jarrett Smith drives and kicks out. Nikola Jokic attempts a Midrange. Contested by Rudy Smith (4.7 feet, ZONE). Nikola Jokic misses. Rebound secured by Jalen Jackson.

[08:30] Team_089 possession (Score: 53-63)
Jalen Jackson attempts a 3Pt. Contested by Bam Wade (4.0 feet, ZONE). Jalen Jackson misses. Rebound secured by Jarrett Smith.

[08:17] Team_059 possession (Score: 53-63)
John Iverson attempts a 3Pt. Contested by Jordan Brogdon (3.3 feet, ZONE). John Iverson misses. Rebound secured by Jalen Jackson.

[07:58] Team_089 possession (Score: 53-63)
Jalen Jackson attempts a 3Pt. Contested by Bam Wade (4.0 feet, ZONE). Jalen Jackson misses. Rebound secured by Jarrett Smith.

[07:42] Team_059 possession (Score: 53-63)
Blake Tatum attempts a 3Pt. Contested by Jalen Jackson (4.6 feet, MAN). Blake Tatum misses. Offensive rebound by John Iverson! John Iverson kicks it out.

[07:29] Team_059 possession (Score: 53-63)
Bam Wade drives and kicks out. John Iverson attempts a 3Pt. Contested by Jalen Jackson (4.7 feet, ZONE). JOHN IVERSON MAKES IT! Assist: Bam Wade
Score: 56-63

[07:14] Team_089 possession (Score: 56-63)
FOUL! Shooting foul on Blake Tatum. Jalen Jackson to the line for 2 free throws. [Team fouls: 1] (Blake Tatum: 1 personal fouls)   FT 1/2: GOOD   FT 2/2: GOOD Jalen Jackson makes 2/2 from the line.
Score: 56-65

[06:58] Team_059 possession (Score: 56-65)
Bam Wade attempts a Midrange. Contested by Jordan Brogdon (3.7 feet, MAN). Bam Wade misses. Rebound secured by Jalen Jackson.

[06:41] Team_089 possession (Score: 56-65)
Jordan Brogdon makes the Midrange and draws the foul on Bam Wade! And-1! Jordan Brogdon to the line for 1. [Team fouls: 2] (Bam Wade: 1 personal fouls)   FT 1/1: GOOD Jordan Brogdon makes 1/1 from the line.
Score: 56-68

[06:29] Team_059 possession (Score: 56-68)
Jarrett Smith drives and kicks out. Bam Wade attempts a 3Pt. Contested by Jordan Brogdon (3.2 feet, ZONE). BAM WADE MAKES IT! Assist: John Iverson
Score: 59-68

[06:16] Team_089 possession (Score: 59-68)
Jordan Brogdon attempts a Layup. Contested by Jarrett Smith (4.5 feet, ZONE). JORDAN BROGDON MAKES IT! Assist: Rudy Smith
Score: 59-70

[06:00] Team_059 possession (Score: 59-70)
Jarrett Smith attempts a 3Pt. Contested by Jordan Brogdon (3.6 feet, ZONE). Jarrett Smith misses. Rebound secured by Rudy Smith.

[05:47] Team_089 possession (Score: 59-70)
Rudy Smith drives, Jarrett Smith stays with him. Rudy Smith attempts a Layup. Contested by Jarrett Smith (5.0 feet, ZONE). RUDY SMITH MAKES IT! Assist: Allen Mobley
Score: 59-72

[05:35] Team_059 possession (Score: 59-72)
Nikola Jokic attempts a 3Pt. Contested by Rudy Smith (4.8 feet, MAN). NIKOLA JOKIC MAKES IT! Assist: Blake Tatum
Score: 62-72

[05:16] Team_089 possession (Score: 62-72)
Terry Simmons drives and kicks out. Terry Simmons attempts a 3Pt. Contested by Bam Wade (3.7 feet, ZONE). Terry Simmons misses. Offensive rebound by Terry Simmons! Terry Simmons's putback is no good. Rebound secured by Jarrett Smith.

[05:01] Team_059 possession (Score: 62-72)
Nikola Jokic drives and kicks out. Nikola Jokic attempts a 3Pt. Contested by Rudy Smith (4.7 feet, MAN). Nikola Jokic misses. Rebound secured by Terry Simmons.

[04:47] Team_089 possession (Score: 62-72)
FOUL! Holding foul on John Iverson. [Team fouls: 3] No free throws, side out. (John Iverson: 1 personal fouls)

[04:31] Team_089 possession (Score: 62-72)
Allen Mobley attempts a Layup. Contested by Jarrett Smith (4.6 feet, ZONE). Allen Mobley misses. Offensive rebound by Terry Simmons! Terry Simmons puts it back in!
Score: 62-74

[04:15] Team_059 possession (Score: 62-74)
Nikola Jokic drives and kicks out. John Iverson attempts a Midrange. Contested by Allen Mobley (4.1 feet, MAN). John Iverson misses. Offensive rebound by Jarrett Smith! Jarrett Smith kicks it out.

[04:03] Team_059 possession (Score: 62-74)
Blake Tatum attempts a 3Pt. Contested by Jalen Jackson (4.7 feet, MAN). Blake Tatum misses. Rebound secured by Terry Simmons.

[03:51] Team_089 possession (Score: 62-74)
Jalen Jackson attempts a Midrange. Contested by Blake Tatum (4.6 feet, MAN). JALEN JACKSON MAKES IT! Assist: Rudy Smith
Score: 62-76

[03:35] Team_059 possession (Score: 62-76)
Blake Tatum attempts a 3Pt. Contested by Jalen Jackson (4.7 feet, ZONE). Blake Tatum misses. Rebound secured by Terry Simmons.

[03:18] Team_089 possession (Score: 62-76)
FOUL! Reach-in foul on Jarrett Smith during the drive. [Team fouls: 4] No free throws, side out. (Jarrett Smith: 1 personal fouls)

[03:05] Team_089 possession (Score: 62-76)
Jordan Brogdon makes the Dunk and draws the foul on Bam Wade! And-1! Jordan Brogdon to the line for 1. [BONUS: 5 team fouls] (Bam Wade: 2 personal fouls)   FT 1/1: GOOD Jordan Brogdon makes 1/1 from the line.
Score: 62-79

[02:55] Team_059 possession (Score: 62-79)
Bam Wade commits a violation (traveling/carry)! TURNOVER! (dead ball)

[02:55] Substitution (Team_059): John Iverson OUT → Allen Giddey IN (stamina_rule2)

[02:41] Team_089 possession (Score: 62-79)
Terry Simmons attempts a Layup. Contested by Jarrett Smith (5.2 feet, ZONE). TERRY SIMMONS MAKES IT! Assist: Allen Mobley
Score: 62-81

[02:24] Team_059 possession (Score: 62-81)
Blake Tatum loses control! Ball rolls out of bounds! TURNOVER! (dead ball)

[02:24] Substitution (Team_059): Bam Wade OUT → Russell Quickley IN (stamina_rule2)

[02:24] Substitution (Team_059): Blake Tatum OUT → Scottie Ginobili IN (stamina_rule2)

[02:24] Substitution (Team_059): Nikola Jokic OUT → Bones Middleton IN (stamina_rule2)

[02:24] Substitution (Team_089): Jordan Brogdon OUT → Tony Parker IN (stamina_rule2)

[02:24] Substitution (Team_089): Jalen Jackson OUT → Joel Barnes IN (stamina_rule2)

[02:24] Substitution (Team_089): Rudy Smith OUT → Devin Haliburton IN (stamina_rule2)

[02:24] Substitution (Team_089): Terry Simmons OUT → Evan Gasol IN (stamina_rule2)

[02:13] Team_089 possession (Score: 62-81)
Devin Haliburton attempts a Midrange. Contested by Bones Middleton (5.0 feet, MAN). Devin Haliburton misses. Offensive rebound by Devin Haliburton! Devin Haliburton kicks it out.

[01:57] Team_089 possession (Score: 62-81)
Allen Mobley attempts a 3Pt. Wide open! Allen Giddey is 6.7 feet away. [MAN] ALLEN MOBLEY MAKES IT! Assist: Joel Barnes
Score: 62-84

[01:48] Team_059 possession (Score: 62-84)
Bones Middleton attempts a Layup. Contested by Devin Haliburton (5.3 feet, MAN). BONES MIDDLETON MAKES IT! Assist: Russell Quickley
Score: 64-84

[01:34] Team_089 possession (Score: 64-84)
Allen Mobley drives, Bones Middleton stays with him. Allen Mobley attempts a Layup. Contested by Bones Middleton (4.6 feet, ZONE). Allen Mobley misses. Rebound secured by Scottie Ginobili.

[01:21] Team_059 possession (Score: 64-84)
Allen Giddey attempts a 3Pt. Contested by Devin Haliburton (4.8 feet, ZONE). Allen Giddey misses. Offensive rebound by Scottie Ginobili! Scottie Ginobili kicks it out.

[01:06] Team_059 possession (Score: 64-84)
Scottie Ginobili drives, Joel Barnes stays with him. Scottie Ginobili attempts a Layup. Wide open! Joel Barnes is 6.1 feet away. [MAN] Scottie Ginobili misses. Rebound secured by Devin Haliburton.

[00:47] Team_089 possession (Score: 64-84)
Tony Parker attempts a 3Pt. Contested by Russell Quickley (4.6 feet, ZONE). Tony Parker misses. Rebound secured by Bones Middleton.

[00:27] Team_059 possession (Score: 64-84)
Russell Quickley drives and kicks out. Jarrett Smith attempts a Midrange. Contested by Evan Gasol (4.4 feet, MAN). Jarrett Smith misses. Rebound secured by Allen Mobley.

[00:15] Team_089 possession (Score: 64-84)
Evan Gasol attempts a 3Pt. Contested by Jarrett Smith (5.1 feet, MAN). Evan Gasol misses. Rebound secured by Scottie Ginobili.

================================================================================
                              3RD QUARTER COMPLETE                              
================================================================================

3RD QUARTER SCORE: Team_059 16, Team_089 34

BOX SCORE:
================================================================================

Team_059
--------------------------------------------------------------------------------
Player                MIN  PTS  REB  AST  TO      FG   FG%      3P   3P%
--------------------------------------------------------------------------------
Nikola Jokic           34    5    0    0   0   2/5    40.0     0/0   0.0
Jarrett Smith          36    3    5    0   0   1/5    20.0     0/0   0.0
John Iverson           34    3    2    1   0   1/2    50.0     0/0   0.0
Bam Wade               34    3    0    2   0   1/2    50.0     0/0   0.0
Bones Middleton         2    2    1    0   0   1/1   100.0     0/0   0.0
Blake Tatum            34    0    0    1   0   0/3     0.0     0/0   0.0
Russell Quickley        2    0    0    1   0   0/1     0.0     0/0   0.0
Scottie Ginobili        2    0    3    0   0   0/1     0.0     0/0   0.0

TEAM: FG: 6/20 (30.0%), 3PT: 1/7 (14.3%), REB: 10 (3 off, 7 def), AST: 5, TO: 2
TEAM FOULS: 5 [Team_089 in BONUS]


Team_089
--------------------------------------------------------------------------------
Player                MIN  PTS  REB  AST  TO      FG   FG%      3P   3P%
--------------------------------------------------------------------------------
Jalen Jackson          34    9    5    0   0   4/6    66.7     0/0   0.0
Rudy Smith             34    8    4    3   0   3/4    75.0     0/0   0.0
Jordan Brogdon         34    8    0    0   0   3/3   100.0     0/0   0.0
Terry Simmons          34    6    5    0   0   3/4    75.0     0/0   0.0
Allen Mobley           36    3    1    5   0   1/3    33.3     0/0   0.0
Devin Haliburton        2    0    2    0   0   0/0     0.0     0/0   0.0
Joel Barnes             2    0    0    1   0   0/0     0.0     0/0   0.0
Tony Parker             2    0    0    0   0   0/1     0.0     0/0   0.0
Evan Gasol              2    0    0    0   0   0/1     0.0     0/0   0.0

TEAM: FG: 14/22 (63.6%), 3PT: 3/8 (37.5%), REB: 18 (4 off, 14 def), AST: 9, TO: 0
TEAM FOULS: 1

================================================================================

================================================================================
                       4TH QUARTER - Team_059 vs Team_089                       
================================================================================

[12:00] Substitution (Team_059): Bam Wade OUT (stamina: 79) → Russell Quickley IN (comeback_detected)

[12:00] Substitution (Team_089): Jordan Brogdon OUT (stamina: 78) → Tony Parker IN (comeback_detected)

[12:00] Team_059 possession (Score: 64-84)
Jarrett Smith attempts a Layup. Contested by Terry Simmons (3.8 feet, ZONE). JARRETT SMITH MAKES IT! Assist: Russell Quickley
Score: 66-84

[11:45] Team_089 possession (Score: 66-84)
Allen Mobley drives, picks up John Iverson. Help arrives from Blake Tatum! Allen Mobley attempts a Dunk. Contested by Blake Tatum (5.4 feet, MAN). ALLEN MOBLEY MAKES IT! Assist: Tony Parker
Score: 66-86

[11:30] Team_059 possession (Score: 66-86)
Russell Quickley drives, Terry Simmons stays with him. Russell Quickley attempts a Layup. Contested by Terry Simmons (3.9 feet, ZONE). Russell Quickley misses. Rebound secured by Jalen Jackson.

[11:15] Team_089 possession (Score: 66-86)
Rudy Smith drives and kicks out. Jalen Jackson attempts a 3Pt. Contested by Blake Tatum (4.3 feet, MAN). Jalen Jackson misses. Rebound secured by John Iverson.

[10:59] Team_059 possession (Score: 66-86)
Jarrett Smith attempts a Midrange. Contested by Allen Mobley (4.7 feet, ZONE). Jarrett Smith misses. FOUL! Loose ball foul on Rudy Smith during the rebound battle. [Team fouls: 1] No free throws, side out. (Rudy Smith: 1 personal fouls)

[10:44] Team_059 possession (Score: 66-86)
Nikola Jokic attempts a Midrange. Contested by Rudy Smith (4.9 feet, MAN). Nikola Jokic misses. Rebound secured by Jalen Jackson.

[10:28] Team_089 possession (Score: 66-86)
Jalen Jackson drives, Blake Tatum stays with him. Jalen Jackson attempts a Dunk. Contested by Blake Tatum (4.6 feet, MAN). Jalen Jackson misses. Rebound secured by Nikola Jokic.

[10:16] Team_059 possession (Score: 66-86)
Blake Tatum drives to the basket... Blake Tatum throws a bad pass out of bounds! TURNOVER! (dead ball)

[10:16] Substitution (Team_059): Jarrett Smith OUT → LeBron Lowry IN (stamina_rule2)

[10:16] Substitution (Team_089): Allen Mobley OUT → Pascal Durant IN (stamina_rule2)

[09:57] Team_089 possession (Score: 66-86)
Tony Parker attempts a 3Pt. Contested by Russell Quickley (4.6 feet, MAN). Tony Parker misses. Rebound secured by Nikola Jokic.

[09:41] Team_059 possession (Score: 66-86)
Russell Quickley attempts a 3Pt. Contested by Tony Parker (5.6 feet, MAN). Russell Quickley misses. Rebound secured by Terry Simmons.

[09:24] Team_089 possession (Score: 66-86)
Jalen Jackson drives and kicks out. Pascal Durant attempts a Midrange. Contested by John Iverson (5.5 feet, MAN). PASCAL DURANT MAKES IT!
Score: 66-88

[09:11] Team_059 possession (Score: 66-88)
Blake Tatum attempts a 3Pt. Contested by Jalen Jackson (4.8 feet, ZONE). Blake Tatum misses. Rebound secured by Rudy Smith.

[08:57] Team_089 possession (Score: 66-88)
Terry Simmons drives, LeBron Lowry stays with him. Terry Simmons attempts a Dunk. Contested by LeBron Lowry (5.2 feet, ZONE). TERRY SIMMONS MAKES IT! Assist: Tony Parker
Score: 66-90

[08:43] Team_059 possession (Score: 66-90)
LeBron Lowry attempts a Midrange. Contested by Terry Simmons (4.0 feet, MAN). LEBRON LOWRY MAKES IT!
Score: 68-90

[08:29] Team_089 possession (Score: 68-90)
Rudy Smith attempts a Layup. Wide open! Nikola Jokic is 6.1 feet away. [MAN] RUDY SMITH MAKES IT! Assist: Terry Simmons
Score: 68-92

[08:16] Team_059 possession (Score: 68-92)
Russell Quickley attempts a Midrange. Contested by Tony Parker (5.6 feet, MAN). Russell Quickley misses. Offensive rebound by Nikola Jokic! Nikola Jokic kicks it out.

[08:00] Team_059 possession (Score: 68-92)
Nikola Jokic attempts a Layup. Contested by Terry Simmons (4.1 feet, ZONE). NIKOLA JOKIC MAKES IT! Assist: John Iverson
Score: 70-92

[07:46] Team_089 possession (Score: 70-92)
Tony Parker attempts a Layup. Contested by Russell Quickley (4.6 feet, MAN). Tony Parker misses. Rebound secured by LeBron Lowry.

[07:32] Team_059 possession (Score: 70-92)
Russell Quickley attempts a 3Pt. Contested by Pascal Durant (4.1 feet, ZONE). Russell Quickley misses. Rebound secured by Rudy Smith.

[07:19] Team_089 possession (Score: 70-92)
Rudy Smith attempts a Midrange. Wide open! Nikola Jokic is 6.1 feet away. [MAN] Rudy Smith misses. Offensive rebound by Terry Simmons! Terry Simmons kicks it out.

[07:09] Team_089 possession (Score: 70-92)
Tony Parker attempts a Midrange. Contested by Nikola Jokic (6.0 feet, ZONE). TONY PARKER MAKES IT! Assist: Terry Simmons
Score: 70-94

[06:54] Team_059 possession (Score: 70-94)
LeBron Lowry attempts a Midrange. Contested by Terry Simmons (4.3 feet, MAN). LEBRON LOWRY MAKES IT!
Score: 72-94

[06:40] Team_089 possession (Score: 72-94)
Jalen Jackson attempts a 3Pt. Contested by Blake Tatum (5.0 feet, MAN). Jalen Jackson misses. Rebound secured by LeBron Lowry.

[06:24] Team_059 possession (Score: 72-94)
Blake Tatum drives and kicks out. Russell Quickley attempts a Midrange. Contested by Tony Parker (5.3 feet, MAN). Russell Quickley misses. Rebound secured by Rudy Smith.

[06:10] Team_089 possession (Score: 72-94)
Terry Simmons drives, LeBron Lowry stays with him. Terry Simmons attempts a Layup. Contested by LeBron Lowry (5.1 feet, ZONE). TERRY SIMMONS MAKES IT! Assist: Pascal Durant
Score: 72-96

[05:52] Team_059 possession (Score: 72-96)
John Iverson attempts a 3Pt. Contested by Pascal Durant (3.8 feet, ZONE). John Iverson misses. Offensive rebound by John Iverson! John Iverson kicks it out.

[05:41] Team_059 possession (Score: 72-96)
LeBron Lowry drives and kicks out. John Iverson attempts a 3Pt. Contested by Pascal Durant (3.8 feet, MAN). John Iverson misses. Rebound secured by Rudy Smith.

[05:27] Team_089 possession (Score: 72-96)
Pascal Durant attempts a Midrange. Contested by LeBron Lowry (5.5 feet, ZONE). Pascal Durant misses. Offensive rebound by Terry Simmons! Terry Simmons kicks it out.

[05:09] Team_089 possession (Score: 72-96)
FOUL! Shooting foul on Blake Tatum. Jalen Jackson to the line for 2 free throws. [Team fouls: 1] (Blake Tatum: 1 personal fouls)   FT 1/2: GOOD   FT 2/2: GOOD Jalen Jackson makes 2/2 from the line.
Score: 72-98

[04:55] Team_059 possession (Score: 72-98)
Blake Tatum attempts a 3Pt. Contested by Pascal Durant (3.6 feet, ZONE). Blake Tatum misses. Rebound secured by Pascal Durant.

[04:40] Team_089 possession (Score: 72-98)
Terry Simmons makes the Layup and draws the foul on LeBron Lowry! And-1! Terry Simmons to the line for 1. [Team fouls: 2] (LeBron Lowry: 1 personal fouls)   FT 1/1: GOOD Terry Simmons makes 1/1 from the line.
Score: 72-101

[04:27] Team_059 possession (Score: 72-101)
LeBron Lowry attempts a 3Pt. Contested by Terry Simmons (4.7 feet, MAN). LeBron Lowry misses. Rebound secured by Terry Simmons.

[04:09] Team_089 possession (Score: 72-101)
Tony Parker attempts a 3Pt. Contested by Russell Quickley (4.9 feet, ZONE). Tony Parker misses. Rebound secured by Nikola Jokic.

[04:00] Team_059 possession (Score: 72-101)
LeBron Lowry drives to the basket... LeBron Lowry loses the ball! Stripped by Terry Simmons! TURNOVER! (live ball)

[03:45] Team_089 possession (Score: 72-101)
Tony Parker makes the 3Pt and draws the foul on Russell Quickley! And-1! Tony Parker to the line for 1. [Team fouls: 3] (Russell Quickley: 1 personal fouls)   FT 1/1: GOOD Tony Parker makes 1/1 from the line.
Score: 72-105

[03:34] Team_059 possession (Score: 72-105)
Russell Quickley attempts a 3Pt. Contested by Pascal Durant (4.0 feet, ZONE). Russell Quickley misses. Rebound secured by Pascal Durant.

[03:15] Team_089 possession (Score: 72-105)
Rudy Smith attempts a 3Pt. Contested by Russell Quickley (5.1 feet, ZONE). Rudy Smith misses. Rebound secured by Nikola Jokic.

[02:59] Team_059 possession (Score: 72-105)
Blake Tatum drives to the basket... FOUL! Offensive foul on Blake Tatum! Jalen Jackson drew the charge! [Team fouls: 4] (Blake Tatum: 2 personal fouls) TURNOVER! (dead ball)

[02:44] Team_089 possession (Score: 72-105)
Terry Simmons drives and kicks out. Pascal Durant attempts a 3Pt. Contested by Russell Quickley (4.9 feet, ZONE). Pascal Durant misses. Rebound secured by LeBron Lowry.

[02:30] Team_059 possession (Score: 72-105)
Nikola Jokic attempts a Midrange. Contested by Rudy Smith (5.8 feet, ZONE). NIKOLA JOKIC MAKES IT! Assist: Russell Quickley
Score: 74-105

[02:16] Team_089 possession (Score: 74-105)
Rudy Smith drives and kicks out. Tony Parker attempts a 3Pt. Contested by Russell Quickley (5.0 feet, ZONE). Tony Parker misses. Rebound secured by John Iverson.

[02:01] Team_059 possession (Score: 74-105)
LeBron Lowry drives, picks up Terry Simmons. Help arrives from Jalen Jackson! LeBron Lowry attempts a Layup. Contested by Jalen Jackson (5.1 feet, ZONE). LEBRON LOWRY MAKES IT! Assist: John Iverson
Score: 76-105

[01:49] Team_089 possession (Score: 76-105)
Jalen Jackson attempts a Midrange. Contested by Blake Tatum (5.6 feet, MAN). Jalen Jackson misses. Offensive rebound by Terry Simmons! Terry Simmons kicks it out.

[01:34] Team_089 possession (Score: 76-105)
Jalen Jackson makes the Layup and draws the foul on John Iverson! And-1! Jalen Jackson to the line for 1. [BONUS: 5 team fouls] (John Iverson: 1 personal fouls)   FT 1/1: GOOD Jalen Jackson makes 1/1 from the line.
Score: 76-108

[01:21] Team_059 possession (Score: 76-108)
Nikola Jokic drives to the basket... Nikola Jokic throws a bad pass! Stolen by Terry Simmons! TURNOVER! (live ball)

[01:07] Team_089 possession (Score: 76-108)
Pascal Durant throws a bad pass! Stolen by John Iverson! TURNOVER! (live ball)

[00:54] Team_059 possession (Score: 76-108)
Russell Quickley attempts a 3Pt. Contested by Pascal Durant (4.2 feet, ZONE). Russell Quickley misses. Rebound secured by Pascal Durant.

[00:44] Team_089 possession (Score: 76-108)
Pascal Durant attempts a Midrange. Wide open! Blake Tatum is 6.5 feet away. [ZONE] Pascal Durant misses. Rebound secured by LeBron Lowry.

[00:31] Team_059 possession (Score: 76-108)
Russell Quickley attempts a 3Pt. Contested by Pascal Durant (4.2 feet, ZONE). RUSSELL QUICKLEY MAKES IT! Assist: Blake Tatum
Score: 79-108

[00:17] Team_089 possession (Score: 79-108)
Terry Simmons attempts a Layup. Contested by LeBron Lowry (5.4 feet, MAN). Terry Simmons misses. Rebound secured by LeBron Lowry.

[00:03] Team_059 possession (Score: 79-108)
Russell Quickley attempts a 3Pt. Contested by Pascal Durant (4.3 feet, ZONE). RUSSELL QUICKLEY MAKES IT! Assist: LeBron Lowry
Score: 82-108

================================================================================
                              4TH QUARTER COMPLETE                              
================================================================================

4TH QUARTER SCORE: Team_059 18, Team_089 24

BOX SCORE:
================================================================================

Team_059
--------------------------------------------------------------------------------
Player                MIN  PTS  REB  AST  TO      FG   FG%      3P   3P%
--------------------------------------------------------------------------------
Russell Quickley       14    6    0    2   0   2/7    28.6     0/0   0.0
LeBron Lowry           10    6    5    1   0   3/5    60.0     0/0   0.0
Nikola Jokic           46    4    5    0   0   2/3    66.7     0/0   0.0
Jarrett Smith          38    2    0    0   0   1/1   100.0     0/0   0.0
John Iverson           46    0    4    2   0   0/0     0.0     0/0   0.0
Blake Tatum            46    0    0    1   0   0/3     0.0     0/0   0.0

TEAM: FG: 8/19 (42.1%), 3PT: 2/9 (22.2%), REB: 14 (3 off, 11 def), AST: 6, TO: 4
TEAM FOULS: 5 [Team_089 in BONUS]


Team_089
--------------------------------------------------------------------------------
Player                MIN  PTS  REB  AST  TO      FG   FG%      3P   3P%
--------------------------------------------------------------------------------
Terry Simmons          46    7    5    2   0   3/5    60.0     0/0   0.0
Tony Parker            14    6    0    2   0   2/5    40.0     0/0   0.0
Jalen Jackson          46    5    2    0   0   2/4    50.0     0/0   0.0
Allen Mobley           38    2    0    0   0   1/1   100.0     0/0   0.0
Rudy Smith             46    2    4    0   0   1/4    25.0     0/0   0.0
Pascal Durant          10    2    3    1   0   1/2    50.0     0/0   0.0

TEAM: FG: 10/21 (47.6%), 3PT: 1/5 (20.0%), REB: 14 (3 off, 11 def), AST: 5, TO: 1
TEAM FOULS: 1

================================================================================

================================================================================
                               FULL GAME COMPLETE                               
================================================================================

FINAL SCORE: Team_059 82, Team_089 108

SCORING BY QUARTER:
--------------------------------------------------------------------------------
Team                     Q1     Q2     Q3     Q4    FINAL
--------------------------------------------------------------------------------
Team_059                 30     18     16     18       82
Team_089                 24     26     34     24      108
--------------------------------------------------------------------------------

FULL GAME BOX SCORE:
================================================================================

Team_059
--------------------------------------------------------------------------------
Player                MIN  PTS  REB  AST  TO      FG   FG%      3P   3P%      FT STL BLK
--------------------------------------------------------------------------------
Blake Tatum            46    8    0    3   4   3/14   21.4   1/7    14.3   1/1     0   0
Nikola Jokic           46   17    9    2   3   9/21   42.9   2/7    28.6   3/4     0   0
John Iverson           46    7   10    5   1   2/6    33.3   1/4    25.0   1/2     1   0
Jarrett Smith          38   15   12    3   0   6/11   54.5   0/1     0.0   2/2     1   0
Bam Wade               34   21    6    2   2   7/11   63.6   2/4    50.0   7/7     2   0
Russell Quickley       14    6    0    3   0   2/8    25.0   2/6    33.3   0/0     0   0
LeBron Lowry           10    6    5    1   0   3/5    60.0   0/1     0.0   0/0     0   0
Allen Giddey            3    0    0    0   0   0/0     0.0   0/0     0.0   0/0     0   0
Scottie Ginobili        2    0    3    0   0   0/1     0.0   0/0     0.0   0/0     0   0
Bones Middleton         2    2    1    0   0   1/1   100.0   0/0     0.0   0/0     0   0

TEAM: FG: 34/79 (43.0%), 3PT: 8/30 (26.7%), REB: 44 (9 off, 35 def), AST: 19, TO: 10


Team_089
--------------------------------------------------------------------------------
Player                MIN  PTS  REB  AST  TO      FG   FG%      3P   3P%      FT STL BLK
--------------------------------------------------------------------------------
Jalen Jackson          46   31   19    2   1  14/23   60.9   4/10   40.0   8/11    0   0
Rudy Smith             46   22   10    4   1  10/18   55.6   2/4    50.0   2/2     2   1
Terry Simmons          46   19   18    4   0   7/11   63.6   0/0     0.0   1/1     3   1
Allen Mobley           38   12    4    8   1   7/11   63.6   1/2    50.0   1/1     0   0
Jordan Brogdon         34   15    0    0   1   5/10   50.0   0/4     0.0   5/5     0   0
Tony Parker            14    6    0    2   0   2/6    33.3   1/4    25.0   1/1     0   0
Pascal Durant          10    2    3    1   1   0/1     0.0   0/0     0.0   0/0     0   0
Joel Barnes             2    0    0    1   0   0/0     0.0   0/0     0.0   0/0     0   0
Devin Haliburton        2    0    2    0   0   0/0     0.0   0/0     0.0   0/0     0   0
Evan Gasol              2    0    0    0   0   0/1     0.0   0/1     0.0   0/0     0   0

TEAM: FG: 45/82 (54.9%), 3PT: 8/25 (32.0%), REB: 58 (13 off, 45 def), AST: 22, TO: 5

================================================================================
