================================================================================
                        FULL GAME - Team_026 vs Team_004                        
================================================================================

================================================================================
                       1ST QUARTER - Team_026 vs Team_004                       
================================================================================

[12:00] Team_026 possession (Score: 0-0)
Klay Giddey attempts a 3Pt. Contested by Dwyane Irving (3.5 feet, MAN). Klay Giddey misses. Rebound secured by Draymond Fox.

[11:49] Team_004 possession (Score: 0-0)
Jabari Wade attempts a Layup. Contested by Immanuel Hyland (4.7 feet, MAN). Jabari Wade misses. Rebound secured by Immanuel Hyland.

[11:33] Team_026 possession (Score: 0-0)
Wendell Gasol attempts a Layup. BLOCKED BY MICHAEL CURRY! Ball is loose! Rebound secured by Anthony Lillard.

[11:17] Team_004 possession (Score: 0-0)
Dwyane Irving attempts a 3Pt. Contested by Immanuel Hyland (4.3 feet, ZONE). Dwyane Irving misses. Rebound secured by Kobe Booker.

[11:00] Team_026 possession (Score: 0-0)
FOUL! Reach-in foul on Anthony Lillard during the drive. [Team fouls: 1] No free throws, side out. (Anthony Lillard: 1 personal fouls)

[10:45] Team_026 possession (Score: 0-0)
Wendell Gasol drives and kicks out. Immanuel Hyland attempts a 3Pt. Contested by Michael Curry (5.0 feet, ZONE). Immanuel Hyland misses. Rebound secured by Draymond Fox.

[10:33] Team_004 possession (Score: 0-0)
Jabari Wade attempts a Midrange. Wide open! Klay Giddey is 6.2 feet away. [ZONE] JABARI WADE MAKES IT!
Score: 0-2

[10:13] Team_026 possession (Score: 0-2)
FOUL! Shooting foul on Michael Curry. Wendell Gasol to the line for 3 free throws. [Team fouls: 2] (Michael Curry: 1 personal fouls)   FT 1/3: GOOD   FT 2/3: GOOD   FT 3/3: GOOD Wendell Gasol makes 3/3 from the line.
Score: 3-2

[10:03] Team_004 possession (Score: 3-2)
Michael Curry drives, Wendell Gasol stays with him. Michael Curry attempts a Dunk. Contested by Wendell Gasol (4.7 feet, MAN). MICHAEL CURRY MAKES IT! Assist: Anthony Lillard
Score: 3-4

[09:46] Team_026 possession (Score: 3-4)
FOUL! Reach-in foul on Anthony Lillard during the drive. [Team fouls: 3] No free throws, side out. (Anthony Lillard: 2 personal fouls)

[09:31] Team_026 possession (Score: 3-4)
Kobe Booker attempts a 3Pt. Contested by Anthony Lillard (4.4 feet, MAN). Kobe Booker misses. FOUL! Loose ball foul on Draymond Fox during the rebound battle. [Team fouls: 4] No free throws, side out. (Draymond Fox: 1 personal fouls)

[09:20] Team_026 possession (Score: 3-4)
FOUL! Shooting foul on Draymond Fox. Shaquille Trent to the line for 2 free throws. [BONUS: 5 team fouls] (Draymond Fox: 2 personal fouls)   FT 1/2: GOOD   FT 2/2: MISS Shaquille Trent makes 1/2 from the line. Offensive rebound by Shaquille Trent! Shaquille Trent kicks it out.
Score: 4-4

[09:03] Team_026 possession (Score: 4-4)
Immanuel Hyland attempts a 3Pt. Contested by Michael Curry (5.1 feet, ZONE). IMMANUEL HYLAND MAKES IT! Assist: Klay Giddey
Score: 7-4

[08:47] Team_004 possession (Score: 7-4)
Draymond Fox attempts a Midrange. Contested by Shaquille Trent (6.0 feet, MAN). DRAYMOND FOX MAKES IT!
Score: 7-6

[08:32] Team_026 possession (Score: 7-6)
Wendell Gasol attempts a 3Pt. Contested by Michael Curry (5.4 feet, MAN). Wendell Gasol misses. Rebound secured by Anthony Lillard.

[08:18] Team_004 possession (Score: 7-6)
Dwyane Irving drives and kicks out. Draymond Fox attempts a 3Pt. Contested by Shaquille Trent (5.6 feet, ZONE). Draymond Fox misses. Rebound secured by Immanuel Hyland.

[08:06] Team_026 possession (Score: 7-6)
Klay Giddey attempts a Midrange. Contested by Dwyane Irving (3.5 feet, MAN). Klay Giddey misses. Rebound secured by Draymond Fox.

[07:48] Team_004 possession (Score: 7-6)
Michael Curry drives and kicks out. Dwyane Irving attempts a Midrange. Contested by Immanuel Hyland (4.0 feet, ZONE). Dwyane Irving misses. Offensive rebound by Draymond Fox! Draymond Fox kicks it out.

[07:32] Team_004 possession (Score: 7-6)
Draymond Fox makes the Layup and draws the foul on Kobe Booker! And-1! Draymond Fox to the line for 1. [Team fouls: 1] (Kobe Booker: 1 personal fouls)   FT 1/1: GOOD Draymond Fox makes 1/1 from the line.
Score: 7-9

[07:17] Team_026 possession (Score: 7-9)
Kobe Booker makes the Layup and draws the foul on Anthony Lillard! And-1! Kobe Booker to the line for 1. [BONUS: 6 team fouls] (Anthony Lillard: 3 personal fouls)   FT 1/1: GOOD Kobe Booker makes 1/1 from the line.
Score: 10-9

[07:05] Team_004 possession (Score: 10-9)
Michael Curry attempts a 3Pt. Contested by Wendell Gasol (4.7 feet, MAN). Michael Curry misses. Rebound secured by Immanuel Hyland.

[06:51] Team_026 possession (Score: 10-9)
Klay Giddey attempts a 3Pt. Contested by Michael Curry (5.0 feet, ZONE). Klay Giddey misses. Rebound secured by Anthony Lillard.

[06:37] Team_004 possession (Score: 10-9)
Jabari Wade attempts a 3Pt. Contested by Immanuel Hyland (4.7 feet, MAN). Jabari Wade misses. Rebound secured by Shaquille Trent.

[06:23] Team_026 possession (Score: 10-9)
Immanuel Hyland attempts a Layup. BLOCKED BY ANTHONY LILLARD! Ball deflects out of bounds off Immanuel Hyland.

[06:07] Team_004 possession (Score: 10-9)
FOUL! Shooting foul on Kobe Booker. Jabari Wade to the line for 2 free throws. [Team fouls: 2] (Kobe Booker: 2 personal fouls)   FT 1/2: GOOD   FT 2/2: GOOD Jabari Wade makes 2/2 from the line.
Score: 10-11

[05:52] Team_026 possession (Score: 10-11)
FOUL! Shooting foul on Dwyane Irving. Klay Giddey to the line for 3 free throws. [BONUS: 7 team fouls] (Dwyane Irving: 1 personal fouls)   FT 1/3: GOOD   FT 2/3: GOOD   FT 3/3: MISS Klay Giddey makes 2/3 from the line. Rebound secured by Dwyane Irving.
Score: 12-11

[05:33] Team_004 possession (Score: 12-11)
Anthony Lillard drives to the basket... Anthony Lillard loses the ball! Stripped by Kobe Booker! TURNOVER! (live ball)

[05:20] Team_026 possession (Score: 12-11)
Klay Giddey attempts a Midrange. Contested by Dwyane Irving (3.5 feet, MAN). Klay Giddey misses. Offensive rebound by Shaquille Trent! Shaquille Trent kicks it out.

[05:05] Team_026 possession (Score: 12-11)
Wendell Gasol drives to the basket... Wendell Gasol throws a bad pass out of bounds! TURNOVER! (dead ball)

[04:51] Team_004 possession (Score: 12-11)
Draymond Fox drives to the basket... Draymond Fox throws a bad pass! Stolen by Kobe Booker! TURNOVER! (live ball)

[04:38] Team_026 possession (Score: 12-11)
Shaquille Trent attempts a Midrange. Contested by Draymond Fox (4.0 feet, ZONE). Shaquille Trent misses. Rebound secured by Draymond Fox.

[04:19] Team_004 possession (Score: 12-11)
Dwyane Irving attempts a Midrange. Contested by Immanuel Hyland (4.4 feet, ZONE). DWYANE IRVING MAKES IT! Assist: Draymond Fox
Score: 12-13

[04:02] Team_026 possession (Score: 12-13)
Immanuel Hyland attempts a 3Pt. Contested by Michael Curry (5.2 feet, ZONE). IMMANUEL HYLAND MAKES IT! Assist: Wendell Gasol
Score: 15-13

[03:43] Team_004 possession (Score: 15-13)
Michael Curry drives, picks up Kobe Booker. Help arrives from Immanuel Hyland! Michael Curry attempts a Dunk. Contested by Immanuel Hyland (4.5 feet, ZONE). Michael Curry misses. Rebound secured by Shaquille Trent.

[03:31] Team_026 possession (Score: 15-13)
Shaquille Trent attempts a Layup. Contested by Anthony Lillard (4.1 feet, ZONE). Shaquille Trent misses. Rebound secured by Dwyane Irving.

[03:18] Team_004 possession (Score: 15-13)
Dwyane Irving attempts a Layup. Contested by Klay Giddey (5.9 feet, MAN). DWYANE IRVING MAKES IT!
Score: 15-15

[03:02] Team_026 possession (Score: 15-15)
Klay Giddey attempts a Midrange. Contested by Draymond Fox (4.3 feet, ZONE). Klay Giddey misses. Rebound secured by Draymond Fox.

[02:45] Team_004 possession (Score: 15-15)
Michael Curry attempts a 3Pt. Contested by Shaquille Trent (5.9 feet, ZONE). MICHAEL CURRY MAKES IT! Assist: Dwyane Irving
Score: 15-18

[02:30] Team_026 possession (Score: 15-18)
Kobe Booker throws a bad pass out of bounds! TURNOVER! (dead ball)

[02:30] Substitution (Team_026): Immanuel Hyland OUT → Karl Barrett IN (stamina_rule2)

[02:30] Substitution (Team_026): Klay Giddey OUT → Josh Simons IN (stamina_rule2)

[02:30] Substitution (Team_026): Shaquille Trent OUT → Damian Doncic IN (stamina_rule2)

[02:30] Substitution (Team_026): Kobe Booker OUT → Dirk Randle IN (stamina_rule2)

[02:30] Substitution (Team_004): Jabari Wade OUT → Russell Barnes IN (stamina_rule2)

[02:30] Substitution (Team_004): Anthony Lillard OUT → Shai Beal IN (stamina_rule2)

[02:13] Team_004 possession (Score: 15-18)
Dwyane Irving attempts a 3Pt. Contested by Karl Barrett (5.0 feet, ZONE). Dwyane Irving misses. Rebound secured by Josh Simons.

[01:57] Team_026 possession (Score: 15-18)
FOUL! Shooting foul on Draymond Fox. Karl Barrett to the line for 3 free throws. [BONUS: 8 team fouls] (Draymond Fox: 3 personal fouls)   FT 1/3: GOOD   FT 2/3: MISS   FT 3/3: GOOD Karl Barrett makes 2/3 from the line.
Score: 17-18

[01:44] Team_004 possession (Score: 17-18)
Draymond Fox throws a bad pass! Stolen by Damian Doncic! TURNOVER! (live ball)

[01:31] Team_026 possession (Score: 17-18)
Wendell Gasol attempts a Midrange. Contested by Michael Curry (5.6 feet, ZONE). Wendell Gasol misses. Rebound secured by Shai Beal.

[01:17] Team_004 possession (Score: 17-18)
Draymond Fox loses control! Ball rolls out of bounds! TURNOVER! (dead ball)

[01:17] Substitution (Team_026): Wendell Gasol OUT → Myles Tatum IN (stamina_rule2)

[01:17] Substitution (Team_004): Michael Curry OUT → Karl Reaves IN (stamina_rule2)

[01:17] Substitution (Team_004): Dwyane Irving OUT → Kristaps Green IN (stamina_rule2)

[01:17] Substitution (Team_004): Draymond Fox OUT → Michael Sabonis IN (stamina_rule2)

[01:01] Team_026 possession (Score: 17-18)
Karl Barrett attempts a 3Pt. Contested by Russell Barnes (4.7 feet, MAN). Karl Barrett misses. Rebound secured by Russell Barnes.

[00:46] Team_004 possession (Score: 17-18)
Shai Beal attempts a Layup. Contested by Damian Doncic (5.7 feet, ZONE). Shai Beal misses. Rebound secured by Damian Doncic.

[00:37] Team_026 possession (Score: 17-18)
Damian Doncic attempts a 3Pt. Contested by Michael Sabonis (4.6 feet, MAN). DAMIAN DONCIC MAKES IT! Assist: Karl Barrett
Score: 20-18

[00:20] Team_004 possession (Score: 20-18)
Karl Reaves attempts a 3Pt. Contested by Myles Tatum (4.8 feet, MAN). Karl Reaves misses. Offensive rebound by Shai Beal! Shai Beal kicks it out.

[00:02] Team_004 possession (Score: 20-18)
FOUL! Holding foul on Dirk Randle. [Team fouls: 3] No free throws, side out. (Dirk Randle: 1 personal fouls)

================================================================================
                              1ST QUARTER COMPLETE                              
================================================================================

1ST QUARTER SCORE: Team_026 20, Team_004 18

BOX SCORE:
================================================================================

Team_026
--------------------------------------------------------------------------------
Player                MIN  PTS  REB  AST  TO      FG   FG%      3P   3P%
--------------------------------------------------------------------------------
Immanuel Hyland        10    6    3    0   0   2/3    66.7     0/0   0.0
Wendell Gasol          11    3    0    1   0   1/5    20.0     0/0   0.0
Kobe Booker            10    3    2    0   0   1/1   100.0     0/0   0.0
Damian Doncic           2    3    1    0   0   1/1   100.0     0/0   0.0
Karl Barrett            2    2    0    1   0   1/2    50.0     0/0   0.0
Klay Giddey            10    0    0    1   0   0/5     0.0     0/0   0.0
Shaquille Trent        10    0    4    0   0   0/2     0.0     0/0   0.0
Josh Simons             2    0    1    0   0   0/0     0.0     0/0   0.0

TEAM: FG: 6/19 (31.6%), 3PT: 5/10 (50.0%), REB: 11 (3 off, 8 def), AST: 3, TO: 2
TEAM FOULS: 3


Team_004
--------------------------------------------------------------------------------
Player                MIN  PTS  REB  AST  TO      FG   FG%      3P   3P%
--------------------------------------------------------------------------------
Draymond Fox           11    5    6    1   0   2/2   100.0     0/0   0.0
Michael Curry          11    5    0    0   0   2/4    50.0     0/0   0.0
Jabari Wade            10    4    0    0   0   2/4    50.0     0/0   0.0
Dwyane Irving          11    4    2    1   0   2/5    40.0     0/0   0.0
Anthony Lillard        10    0    3    1   0   0/0     0.0     0/0   0.0
Shai Beal               2    0    2    0   0   0/1     0.0     0/0   0.0
Russell Barnes          2    0    1    0   0   0/0     0.0     0/0   0.0

TEAM: FG: 8/16 (50.0%), 3PT: 1/5 (20.0%), REB: 14 (2 off, 12 def), AST: 3, TO: 4
TEAM FOULS: 8 [Team_026 in BONUS]

================================================================================

================================================================================
                       2ND QUARTER - Team_026 vs Team_004                       
================================================================================

[12:00] Team_026 possession (Score: 20-18)
FOUL! Shooting foul on Draymond Fox. Shaquille Trent to the line for 2 free throws. [Team fouls: 1] (Draymond Fox: 1 personal fouls)   FT 1/2: GOOD   FT 2/2: GOOD Shaquille Trent makes 2/2 from the line.
Score: 22-18

[11:44] Team_004 possession (Score: 22-18)
Michael Curry attempts a 3Pt. Contested by Immanuel Hyland (4.1 feet, ZONE). MICHAEL CURRY MAKES IT! Assist: Anthony Lillard
Score: 22-21

[11:32] Team_026 possession (Score: 22-21)
FOUL! Reach-in foul on Draymond Fox during the drive. [Team fouls: 2] No free throws, side out. (Draymond Fox: 2 personal fouls)

[11:18] Team_026 possession (Score: 22-21)
Kobe Booker drives and kicks out. Klay Giddey attempts a 3Pt. Contested by Michael Curry (5.2 feet, ZONE). Klay Giddey misses. Rebound secured by Draymond Fox.

[11:01] Team_004 possession (Score: 22-21)
Anthony Lillard attempts a 3Pt. Contested by Kobe Booker (4.7 feet, MAN). ANTHONY LILLARD MAKES IT! Assist: Jabari Wade
Score: 22-24

[10:46] Team_026 possession (Score: 22-24)
Kobe Booker attempts a Midrange. Contested by Anthony Lillard (4.5 feet, MAN). KOBE BOOKER MAKES IT! Assist: Wendell Gasol
Score: 24-24

[10:29] Team_004 possession (Score: 24-24)
Michael Curry attempts a 3Pt. Contested by Immanuel Hyland (4.2 feet, ZONE). Michael Curry misses. Rebound secured by Shaquille Trent.

[10:13] Team_026 possession (Score: 24-24)
Shaquille Trent attempts a Midrange. Contested by Dwyane Irving (3.6 feet, ZONE). Shaquille Trent misses. Rebound secured by Anthony Lillard.

[09:57] Team_004 possession (Score: 24-24)
Draymond Fox drives to the basket... FOUL! Offensive foul on Draymond Fox! Kobe Booker drew the charge! [Team fouls: 3] (Draymond Fox: 3 personal fouls) TURNOVER! (dead ball)

[09:42] Team_026 possession (Score: 24-24)
Wendell Gasol attempts a 3Pt. Contested by Michael Curry (5.6 feet, ZONE). WENDELL GASOL MAKES IT! Assist: Immanuel Hyland
Score: 27-24

[09:22] Team_004 possession (Score: 27-24)
Anthony Lillard drives and kicks out. Dwyane Irving attempts a Midrange. Contested by Immanuel Hyland (4.2 feet, ZONE). Dwyane Irving misses. Rebound secured by Shaquille Trent.

[09:08] Team_026 possession (Score: 27-24)
Shaquille Trent attempts a Midrange. Contested by Draymond Fox (4.4 feet, ZONE). Shaquille Trent misses. Offensive rebound by Kobe Booker! Kobe Booker kicks it out.

[08:53] Team_026 possession (Score: 27-24)
Klay Giddey drives to the basket... Klay Giddey commits a violation (traveling/carry)! TURNOVER! (dead ball)

[08:53] Substitution (Team_026): Wendell Gasol OUT → Myles Tatum IN (stamina_rule2)

[08:53] Substitution (Team_026): Immanuel Hyland OUT → Karl Barrett IN (stamina_rule2)

[08:53] Substitution (Team_026): Klay Giddey OUT → Josh Simons IN (stamina_rule2)

[08:53] Substitution (Team_026): Shaquille Trent OUT → Damian Doncic IN (stamina_rule2)

[08:53] Substitution (Team_026): Kobe Booker OUT → Dirk Randle IN (stamina_rule2)

[08:53] Substitution (Team_004): Michael Curry OUT → Karl Reaves IN (stamina_rule2)

[08:53] Substitution (Team_004): Jabari Wade OUT → Russell Barnes IN (stamina_rule2)

[08:53] Substitution (Team_004): Dwyane Irving OUT → Kristaps Green IN (stamina_rule2)

[08:53] Substitution (Team_004): Draymond Fox OUT → Michael Sabonis IN (stamina_rule2)

[08:53] Substitution (Team_004): Anthony Lillard OUT → Shai Beal IN (stamina_rule2)

[08:42] Team_004 possession (Score: 27-24)
Russell Barnes drives, picks up Karl Barrett. Help arrives from Josh Simons! Russell Barnes attempts a Dunk. Contested by Josh Simons (5.3 feet, MAN). Russell Barnes misses. Offensive rebound by Russell Barnes! Russell Barnes kicks it out.

[08:22] Team_004 possession (Score: 27-24)
Russell Barnes attempts a 3Pt. Contested by Karl Barrett (5.3 feet, MAN). Russell Barnes misses. Rebound secured by Karl Barrett.

[08:08] Team_026 possession (Score: 27-24)
Myles Tatum attempts a Layup. Contested by Karl Reaves (4.9 feet, MAN). MYLES TATUM MAKES IT! Assist: Damian Doncic
Score: 29-24

[07:58] Team_004 possession (Score: 29-24)
Shai Beal attempts a Layup. BLOCKED BY DAMIAN DONCIC! Ball goes out off Damian Doncic. Shai Beal's ball!

[07:45] Team_004 possession (Score: 29-24)
Karl Reaves attempts a Midrange. Contested by Myles Tatum (4.8 feet, ZONE). Karl Reaves misses. Rebound secured by Damian Doncic.

[07:30] Team_026 possession (Score: 29-24)
Karl Barrett drives, picks up Shai Beal. Help arrives from Russell Barnes! Karl Barrett attempts a Dunk. Contested by Russell Barnes (5.2 feet, ZONE). Karl Barrett misses. FOUL! Loose ball foul on Shai Beal during the rebound battle. [Team fouls: 4] No free throws, side out. (Shai Beal: 1 personal fouls)

[07:19] Team_026 possession (Score: 29-24)
Karl Barrett attempts a Midrange. Contested by Michael Sabonis (5.0 feet, ZONE). Karl Barrett misses. Rebound secured by Shai Beal.

[07:03] Team_004 possession (Score: 29-24)
Shai Beal drives to the basket... Shai Beal loses control! Ball rolls out of bounds! TURNOVER! (dead ball)

[06:46] Team_026 possession (Score: 29-24)
Karl Barrett attempts a 3Pt. Contested by Karl Reaves (5.1 feet, ZONE). Karl Barrett misses. Rebound secured by Michael Sabonis.

[06:34] Team_004 possession (Score: 29-24)
Russell Barnes attempts a 3Pt. Contested by Karl Barrett (5.3 feet, MAN). RUSSELL BARNES MAKES IT! Assist: Karl Reaves
Score: 29-27

[06:17] Team_026 possession (Score: 29-27)
Karl Barrett attempts a 3Pt. Contested by Russell Barnes (4.7 feet, MAN). Karl Barrett misses. Rebound secured by Russell Barnes.

[06:07] Team_004 possession (Score: 29-27)
Michael Sabonis attempts a Layup. BLOCKED BY DAMIAN DONCIC! Ball is loose! Offensive rebound by Shai Beal! Shai Beal kicks it out.

[05:51] Team_004 possession (Score: 29-27)
Shai Beal drives and kicks out. Russell Barnes attempts a Midrange. Contested by Karl Barrett (4.7 feet, MAN). Russell Barnes misses. Rebound secured by Damian Doncic.

[05:36] Team_026 possession (Score: 29-27)
Josh Simons attempts a 3Pt. Contested by Kristaps Green (4.2 feet, MAN). JOSH SIMONS MAKES IT! Assist: Karl Barrett
Score: 32-27

[05:20] Team_004 possession (Score: 32-27)
Michael Sabonis drives to the basket... Michael Sabonis loses the ball! Stripped by Damian Doncic! TURNOVER! (live ball)

[05:05] Team_026 possession (Score: 32-27)
Damian Doncic drives to the basket... Damian Doncic throws a bad pass! Stolen by Shai Beal! TURNOVER! (live ball)

[04:49] Team_004 possession (Score: 32-27)
Kristaps Green attempts a 3Pt. Contested by Josh Simons (5.1 feet, MAN). KRISTAPS GREEN MAKES IT! Assist: Shai Beal
Score: 32-30

[04:34] Team_026 possession (Score: 32-30)
Myles Tatum makes the Midrange and draws the foul on Karl Reaves! And-1! Myles Tatum to the line for 1. [BONUS: 5 team fouls] (Karl Reaves: 1 personal fouls)   FT 1/1: MISS Myles Tatum makes 0/1 from the line. Rebound secured by Russell Barnes.
Score: 34-30

[04:23] Team_004 possession (Score: 34-30)
Michael Sabonis attempts a 3Pt. Contested by Karl Barrett (4.8 feet, ZONE). Michael Sabonis misses. Rebound secured by Karl Barrett.

[04:09] Team_026 possession (Score: 34-30)
FOUL! Reach-in foul on Shai Beal during the drive. [IN THE BONUS! 6 team fouls] Karl Barrett to the line for 2 free throws. (Shai Beal: 2 personal fouls)   FT 1/2: MISS   FT 2/2: MISS Karl Barrett makes 0/2 from the line. Rebound secured by Shai Beal.

[03:53] Team_004 possession (Score: 34-30)
Michael Sabonis drives and kicks out. Karl Reaves attempts a 3Pt. Contested by Myles Tatum (5.3 feet, MAN). KARL REAVES MAKES IT! Assist: Michael Sabonis
Score: 34-33

[03:34] Team_026 possession (Score: 34-33)
Karl Barrett attempts a 3Pt. Contested by Karl Reaves (5.1 feet, ZONE). Karl Barrett misses. Rebound secured by Russell Barnes.

[03:19] Team_004 possession (Score: 34-33)
Shai Beal drives and kicks out. Kristaps Green attempts a Midrange. Contested by Josh Simons (5.2 feet, ZONE). Kristaps Green misses. Offensive rebound by Russell Barnes! Russell Barnes kicks it out.

[03:07] Team_004 possession (Score: 34-33)
FOUL! Offensive foul on Russell Barnes! Karl Barrett drew the charge! [Team fouls: 7] (Russell Barnes: 1 personal fouls) TURNOVER! (dead ball)

[02:53] Team_026 possession (Score: 34-33)
Dirk Randle attempts a 3Pt. Contested by Karl Reaves (5.4 feet, ZONE). DIRK RANDLE MAKES IT! Assist: Karl Barrett
Score: 37-33

[02:40] Team_004 possession (Score: 37-33)
Kristaps Green attempts a Midrange. Contested by Josh Simons (5.2 feet, ZONE). Kristaps Green misses. Rebound secured by Josh Simons.

[02:23] Team_026 possession (Score: 37-33)
FOUL! Shooting foul on Kristaps Green. Damian Doncic to the line for 2 free throws. [BONUS: 8 team fouls] (Kristaps Green: 1 personal fouls)   FT 1/2: GOOD   FT 2/2: GOOD Damian Doncic makes 2/2 from the line.
Score: 39-33

[02:08] Team_004 possession (Score: 39-33)
Russell Barnes drives and kicks out. FOUL! Shooting foul on Karl Barrett. Kristaps Green to the line for 3 free throws. [Team fouls: 2] (Karl Barrett: 1 personal fouls)   FT 1/3: GOOD   FT 2/3: GOOD   FT 3/3: MISS Kristaps Green makes 2/3 from the line. Rebound secured by Josh Simons.
Score: 39-35

[01:56] Team_026 possession (Score: 39-35)
Karl Barrett makes the Layup and draws the foul on Shai Beal! And-1! Karl Barrett to the line for 1. [BONUS: 9 team fouls] (Shai Beal: 3 personal fouls)   FT 1/1: GOOD Karl Barrett makes 1/1 from the line.
Score: 42-35

[01:40] Team_004 possession (Score: 42-35)
Kristaps Green drives to the basket... Kristaps Green loses the ball! Stripped by Josh Simons! TURNOVER! (live ball)

[01:27] Team_026 possession (Score: 42-35)
Josh Simons attempts a 3Pt. Contested by Karl Reaves (5.0 feet, ZONE). Josh Simons misses. Rebound secured by Russell Barnes.

[01:13] Team_004 possession (Score: 42-35)
Russell Barnes attempts a Midrange. Wide open! Damian Doncic is 6.3 feet away. [ZONE] Russell Barnes misses. Offensive rebound by Shai Beal! Shai Beal kicks it out.

[00:56] Team_004 possession (Score: 42-35)
Shai Beal makes the Layup and draws the foul on Damian Doncic! And-1! Shai Beal to the line for 1. [Team fouls: 3] (Damian Doncic: 2 personal fouls)   FT 1/1: GOOD Shai Beal makes 1/1 from the line.
Score: 42-38

[00:42] Team_026 possession (Score: 42-38)
Karl Barrett attempts a 3Pt. Contested by Russell Barnes (5.0 feet, MAN). Karl Barrett misses. Rebound secured by Russell Barnes.

[00:29] Team_004 possession (Score: 42-38)
Russell Barnes attempts a 3Pt. Contested by Karl Barrett (5.5 feet, MAN). Russell Barnes misses. Offensive rebound by Russell Barnes! Russell Barnes kicks it out.

[00:15] Team_004 possession (Score: 42-38)
Russell Barnes drives, Karl Barrett stays with him. Russell Barnes attempts a Dunk. Contested by Karl Barrett (5.5 feet, MAN). RUSSELL BARNES MAKES IT! Assist: Kristaps Green
Score: 42-40

[00:01] Team_026 possession (Score: 42-40)
Karl Barrett attempts a 3Pt. Contested by Russell Barnes (5.1 feet, MAN). Karl Barrett misses. Rebound secured by Shai Beal.

================================================================================
                              2ND QUARTER COMPLETE                              
================================================================================

2ND QUARTER SCORE: Team_026 22, Team_004 22

BOX SCORE:
================================================================================

Team_026
--------------------------------------------------------------------------------
Player                MIN  PTS  REB  AST  TO      FG   FG%      3P   3P%
--------------------------------------------------------------------------------
Wendell Gasol          14    3    0    1   0   1/1   100.0     0/0   0.0
Karl Barrett           11    3    2    2   0   1/8    12.5     0/0   0.0
Josh Simons            11    3    3    0   0   1/2    50.0     0/0   0.0
Dirk Randle            11    3    0    0   0   1/1   100.0     0/0   0.0
Shaquille Trent        13    2    2    0   0   1/2    50.0     0/0   0.0
Kobe Booker            13    2    1    0   0   1/2    50.0     0/0   0.0
Myles Tatum            10    2    0    0   0   1/2    50.0     0/0   0.0
Damian Doncic          11    2    2    1   0   1/1   100.0     0/0   0.0
Immanuel Hyland        13    0    0    1   0   0/0     0.0     0/0   0.0

TEAM: FG: 8/19 (42.1%), 3PT: 3/9 (33.3%), REB: 10 (2 off, 8 def), AST: 5, TO: 2
TEAM FOULS: 3


Team_004
--------------------------------------------------------------------------------
Player                MIN  PTS  REB  AST  TO      FG   FG%      3P   3P%
--------------------------------------------------------------------------------
Russell Barnes         11    5    8    0   0   2/4    50.0     0/0   0.0
Michael Curry          14    3    0    0   0   1/2    50.0     0/0   0.0
Anthony Lillard        13    3    1    1   0   1/2    50.0     0/0   0.0
Karl Reaves            10    3    0    1   0   1/2    50.0     0/0   0.0
Shai Beal              11    3    5    1   0   1/2    50.0     0/0   0.0
Kristaps Green         10    3    0    1   0   1/2    50.0     0/0   0.0
Draymond Fox           14    0    1    0   0   0/0     0.0     0/0   0.0
Jabari Wade            13    0    0    1   0   0/0     0.0     0/0   0.0
Michael Sabonis        10    0    1    1   0   0/1     0.0     0/0   0.0

TEAM: FG: 7/15 (46.7%), 3PT: 4/7 (57.1%), REB: 16 (5 off, 11 def), AST: 6, TO: 5
TEAM FOULS: 9 [Team_026 in BONUS]

================================================================================

================================================================================
                       3RD QUARTER - Team_026 vs Team_004                       
================================================================================

[12:00] Team_026 possession (Score: 42-40)
Wendell Gasol drives and kicks out. Klay Giddey attempts a 3Pt. Contested by Dwyane Irving (3.5 feet, MAN). KLAY GIDDEY MAKES IT! Assist: Wendell Gasol
Score: 45-40

[11:47] Team_004 possession (Score: 45-40)
Dwyane Irving attempts a 3Pt. Contested by Klay Giddey (5.8 feet, MAN). DWYANE IRVING MAKES IT! Assist: Jabari Wade
Score: 45-43

[11:34] Team_026 possession (Score: 45-43)
Shaquille Trent attempts a 3Pt. Contested by Michael Curry (4.9 feet, ZONE). SHAQUILLE TRENT MAKES IT! Assist: Kobe Booker
Score: 48-43

[11:21] Team_004 possession (Score: 48-43)
FOUL! Shooting foul on Kobe Booker. Dwyane Irving to the line for 2 free throws. [Team fouls: 1] (Kobe Booker: 1 personal fouls)   FT 1/2: GOOD   FT 2/2: GOOD Dwyane Irving makes 2/2 from the line.
Score: 48-45

[11:05] Team_026 possession (Score: 48-45)
Klay Giddey attempts a 3Pt. Contested by Dwyane Irving (3.5 feet, MAN). Klay Giddey misses. Rebound secured by Anthony Lillard.

[10:52] Team_004 possession (Score: 48-45)
Jabari Wade throws a bad pass out of bounds! TURNOVER! (dead ball)

[10:40] Team_026 possession (Score: 48-45)
Immanuel Hyland attempts a Midrange. Contested by Jabari Wade (4.8 feet, MAN). Immanuel Hyland misses. FOUL! Loose ball foul on Dwyane Irving during the rebound battle. [Team fouls: 1] No free throws, side out. (Dwyane Irving: 1 personal fouls)

[10:30] Team_026 possession (Score: 48-45)
FOUL! Holding foul on Jabari Wade. [Team fouls: 2] No free throws, side out. (Jabari Wade: 1 personal fouls)

[10:16] Team_026 possession (Score: 48-45)
Klay Giddey attempts a 3Pt. Contested by Dwyane Irving (3.5 feet, MAN). Klay Giddey misses. FOUL! Loose ball foul on Draymond Fox during the rebound battle. [Team fouls: 3] No free throws, side out. (Draymond Fox: 1 personal fouls)

[09:57] Team_026 possession (Score: 48-45)
FOUL! Holding foul on Dwyane Irving. [Team fouls: 4] No free throws, side out. (Dwyane Irving: 2 personal fouls)

[09:42] Team_026 possession (Score: 48-45)
Wendell Gasol attempts a Midrange. Contested by Draymond Fox (4.5 feet, ZONE). Wendell Gasol misses. Rebound secured by Dwyane Irving.

[09:27] Team_004 possession (Score: 48-45)
FOUL! Shooting foul on Immanuel Hyland. Jabari Wade to the line for 2 free throws. [Team fouls: 2] (Immanuel Hyland: 1 personal fouls)   FT 1/2: GOOD   FT 2/2: GOOD Jabari Wade makes 2/2 from the line.
Score: 48-47

[09:14] Team_026 possession (Score: 48-47)
Kobe Booker attempts a Layup. Contested by Anthony Lillard (4.4 feet, ZONE). KOBE BOOKER MAKES IT!
Score: 50-47

[09:01] Team_004 possession (Score: 50-47)
Dwyane Irving attempts a Layup. BLOCKED BY IMMANUEL HYLAND! Ball deflects out of bounds off Dwyane Irving.

[08:46] Team_026 possession (Score: 50-47)
Kobe Booker attempts a Midrange. Contested by Draymond Fox (4.4 feet, ZONE). Kobe Booker misses. Offensive rebound by Shaquille Trent! Shaquille Trent kicks it out.

[08:28] Team_026 possession (Score: 50-47)
Immanuel Hyland attempts a 3Pt. Contested by Jabari Wade (4.8 feet, MAN). IMMANUEL HYLAND MAKES IT! Assist: Wendell Gasol
Score: 53-47

[08:18] Team_004 possession (Score: 53-47)
Dwyane Irving attempts a Layup. BLOCKED BY KLAY GIDDEY! Ball deflects out of bounds off Dwyane Irving.

[08:02] Team_026 possession (Score: 53-47)
Kobe Booker drives, picks up Draymond Fox. Help arrives from Jabari Wade! Kobe Booker attempts a Layup. Contested by Jabari Wade (4.4 feet, ZONE). KOBE BOOKER MAKES IT!
Score: 55-47

[07:47] Team_004 possession (Score: 55-47)
Dwyane Irving attempts a 3Pt. Contested by Immanuel Hyland (4.3 feet, ZONE). DWYANE IRVING MAKES IT! Assist: Jabari Wade
Score: 55-50

[07:32] Team_026 possession (Score: 55-50)
Klay Giddey drives to the basket... Klay Giddey loses the ball! Stripped by Dwyane Irving! TURNOVER! (live ball)

[07:15] Team_004 possession (Score: 55-50)
Michael Curry drives to the basket... Michael Curry loses control! Ball rolls out of bounds! TURNOVER! (dead ball)

[07:06] Team_026 possession (Score: 55-50)
Immanuel Hyland attempts a 3Pt. Contested by Michael Curry (5.1 feet, ZONE). Immanuel Hyland misses. Offensive rebound by Kobe Booker! Kobe Booker kicks it out.

[06:48] Team_026 possession (Score: 55-50)
Immanuel Hyland attempts a Midrange. Contested by Jabari Wade (4.8 feet, ZONE). Immanuel Hyland misses. Rebound secured by Dwyane Irving.

[06:37] Team_004 possession (Score: 55-50)
Dwyane Irving attempts a 3Pt. Contested by Immanuel Hyland (4.3 feet, ZONE). Dwyane Irving misses. Rebound secured by Shaquille Trent.

[06:19] Team_026 possession (Score: 55-50)
FOUL! Offensive foul on Wendell Gasol! Michael Curry drew the charge! [Team fouls: 3] (Wendell Gasol: 1 personal fouls) TURNOVER! (dead ball)

[06:06] Team_004 possession (Score: 55-50)
Dwyane Irving drives and kicks out. Anthony Lillard attempts a 3Pt. Contested by Klay Giddey (5.5 feet, ZONE). Anthony Lillard misses. Rebound secured by Shaquille Trent.

[05:51] Team_026 possession (Score: 55-50)
FOUL! Reach-in foul on Dwyane Irving during the drive. [IN THE BONUS! 5 team fouls] Klay Giddey to the line for 2 free throws. (Dwyane Irving: 3 personal fouls)   FT 1/2: GOOD   FT 2/2: GOOD Klay Giddey makes 2/2 from the line.
Score: 57-50

[05:34] Team_004 possession (Score: 57-50)
Draymond Fox attempts a Midrange. Contested by Shaquille Trent (6.0 feet, MAN). Draymond Fox misses. Rebound secured by Shaquille Trent.

[05:17] Team_026 possession (Score: 57-50)
Klay Giddey attempts a 3Pt. Contested by Michael Curry (5.0 feet, ZONE). Klay Giddey misses. Rebound secured by Dwyane Irving.

[05:02] Team_004 possession (Score: 57-50)
FOUL! Shooting foul on Kobe Booker. Anthony Lillard to the line for 2 free throws. [Team fouls: 4] (Kobe Booker: 2 personal fouls)   FT 1/2: GOOD   FT 2/2: GOOD Anthony Lillard makes 2/2 from the line.
Score: 57-52

[04:46] Team_026 possession (Score: 57-52)
Kobe Booker attempts a 3Pt. Contested by Dwyane Irving (3.8 feet, ZONE). KOBE BOOKER MAKES IT! Assist: Shaquille Trent
Score: 60-52

[04:34] Team_004 possession (Score: 60-52)
Michael Curry attempts a Midrange. Contested by Wendell Gasol (4.8 feet, MAN). Michael Curry misses. Rebound secured by Shaquille Trent.

[04:20] Team_026 possession (Score: 60-52)
Wendell Gasol drives, picks up Anthony Lillard. Help arrives from Jabari Wade! Wendell Gasol attempts a Layup. Contested by Jabari Wade (4.6 feet, ZONE). WENDELL GASOL MAKES IT! Assist: Shaquille Trent
Score: 62-52

[04:08] Team_004 possession (Score: 62-52)
Michael Curry loses control! Ball rolls out of bounds! TURNOVER! (dead ball)

[03:52] Team_026 possession (Score: 62-52)
Immanuel Hyland attempts a Layup. Contested by Jabari Wade (5.0 feet, MAN). IMMANUEL HYLAND MAKES IT! Assist: Shaquille Trent
Score: 64-52

[03:36] Team_004 possession (Score: 64-52)
Jabari Wade throws a bad pass out of bounds! TURNOVER! (dead ball)

[03:22] Team_026 possession (Score: 64-52)
Klay Giddey attempts a Midrange. Contested by Dwyane Irving (3.6 feet, MAN). Klay Giddey misses. Offensive rebound by Kobe Booker! Kobe Booker kicks it out.

[03:05] Team_026 possession (Score: 64-52)
FOUL! Reach-in foul on Dwyane Irving during the drive. [IN THE BONUS! 6 team fouls] Klay Giddey to the line for 2 free throws. (Dwyane Irving: 4 personal fouls)   FT 1/2: MISS   FT 2/2: MISS Klay Giddey makes 0/2 from the line. Rebound secured by Anthony Lillard.

[02:51] Team_004 possession (Score: 64-52)
Dwyane Irving drives to the basket... FOUL! Offensive foul on Dwyane Irving! Kobe Booker drew the charge! [Team fouls: 7] (Dwyane Irving: 5 personal fouls) TURNOVER! (dead ball)

[02:36] Team_026 possession (Score: 64-52)
Wendell Gasol attempts a 3Pt. Contested by Jabari Wade (5.3 feet, ZONE). Wendell Gasol misses. Offensive rebound by Shaquille Trent! Shaquille Trent kicks it out.

[02:24] Team_026 possession (Score: 64-52)
Kobe Booker makes the Layup and draws the foul on Jabari Wade! And-1! Kobe Booker to the line for 1. [BONUS: 8 team fouls] (Jabari Wade: 2 personal fouls)   FT 1/1: GOOD Kobe Booker makes 1/1 from the line.
Score: 67-52

[02:11] Team_004 possession (Score: 67-52)
Jabari Wade attempts a Midrange. Wide open! Klay Giddey is 6.4 feet away. [ZONE] Jabari Wade misses. Rebound secured by Shaquille Trent.

[01:55] Team_026 possession (Score: 67-52)
Shaquille Trent makes the Midrange and draws the foul on Draymond Fox! And-1! Shaquille Trent to the line for 1. [BONUS: 9 team fouls] (Draymond Fox: 2 personal fouls)   FT 1/1: GOOD Shaquille Trent makes 1/1 from the line.
Score: 70-52

[01:42] Team_004 possession (Score: 70-52)
Anthony Lillard attempts a 3Pt. Contested by Immanuel Hyland (4.7 feet, ZONE). Anthony Lillard misses. FOUL! Loose ball foul on Shaquille Trent during the rebound battle. [IN THE BONUS! 5 team fouls] Dwyane Irving to the line for 2 free throws. (Shaquille Trent: 1 personal fouls)   FT 1/2: GOOD   FT 2/2: GOOD Dwyane Irving makes 2/2 from the line.
Score: 70-54

[01:28] Team_026 possession (Score: 70-54)
Kobe Booker attempts a Midrange. Contested by Michael Curry (5.6 feet, ZONE). KOBE BOOKER MAKES IT! Assist: Wendell Gasol
Score: 72-54

[01:15] Team_004 possession (Score: 72-54)
Draymond Fox drives, Kobe Booker stays with him. Draymond Fox attempts a Dunk. Contested by Kobe Booker (5.0 feet, ZONE). DRAYMOND FOX MAKES IT! Assist: Anthony Lillard
Score: 72-56

[01:02] Team_026 possession (Score: 72-56)
Shaquille Trent attempts a 3Pt. Contested by Michael Curry (5.2 feet, ZONE). SHAQUILLE TRENT MAKES IT! Assist: Kobe Booker
Score: 75-56

[00:48] Team_004 possession (Score: 75-56)
Michael Curry attempts a 3Pt. Contested by Wendell Gasol (5.1 feet, MAN). Michael Curry misses. Offensive rebound by Dwyane Irving! Dwyane Irving kicks it out.

[00:36] Team_004 possession (Score: 75-56)
Anthony Lillard attempts a Layup. Contested by Kobe Booker (5.1 feet, MAN). ANTHONY LILLARD MAKES IT! Assist: Dwyane Irving
Score: 75-58

[00:23] Team_026 possession (Score: 75-58)
Klay Giddey attempts a Layup. BLOCKED BY DWYANE IRVING! Ball is loose! Rebound secured by Anthony Lillard.

[00:11] Team_004 possession (Score: 75-58)
FOUL! Holding foul on Kobe Booker. [IN THE BONUS! 6 team fouls] Anthony Lillard to the line for 2 free throws. (Kobe Booker: 3 personal fouls)   FT 1/2: GOOD   FT 2/2: MISS Anthony Lillard makes 1/2 from the line. Offensive rebound by Dwyane Irving! Dwyane Irving kicks it out.
Score: 75-59

================================================================================
                              3RD QUARTER COMPLETE                              
================================================================================

3RD QUARTER SCORE: Team_026 33, Team_004 19

BOX SCORE:
================================================================================

Team_026
--------------------------------------------------------------------------------
Player                MIN  PTS  REB  AST  TO      FG   FG%      3P   3P%
--------------------------------------------------------------------------------
Kobe Booker            25   12    3    2   0   5/5   100.0     0/0   0.0
Shaquille Trent        25    9    8    3   0   3/3   100.0     0/0   0.0
Klay Giddey            25    5    0    0   0   2/6    33.3     0/0   0.0
Immanuel Hyland        25    5    0    0   0   2/3    66.7     0/0   0.0
Wendell Gasol          26    2    0    3   0   1/2    50.0     0/0   0.0

TEAM: FG: 13/19 (68.4%), 3PT: 4/6 (66.7%), REB: 11 (6 off, 5 def), AST: 8, TO: 2
TEAM FOULS: 6 [Team_004 in BONUS]


Team_004
--------------------------------------------------------------------------------
Player                MIN  PTS  REB  AST  TO      FG   FG%      3P   3P%
--------------------------------------------------------------------------------
Dwyane Irving          26   10    5    1   0   4/8    50.0     0/0   0.0
Anthony Lillard        25    4    3    1   0   2/2   100.0     0/0   0.0
Jabari Wade            25    2    0    2   0   1/2    50.0     0/0   0.0
Draymond Fox           26    2    0    0   0   1/2    50.0     0/0   0.0
Michael Curry          26    0    0    0   0   0/1     0.0     0/0   0.0

TEAM: FG: 8/15 (53.3%), 3PT: 3/4 (75.0%), REB: 8 (2 off, 6 def), AST: 4, TO: 5
TEAM FOULS: 9 [Team_026 in BONUS]

================================================================================

================================================================================
                       4TH QUARTER - Team_026 vs Team_004                       
================================================================================

[12:00] Team_026 possession (Score: 75-59)
Klay Giddey attempts a 3Pt. Contested by Dwyane Irving (3.7 feet, MAN). Klay Giddey misses. Rebound secured by Draymond Fox.

[11:43] Team_004 possession (Score: 75-59)
Michael Curry drives and kicks out. Draymond Fox attempts a 3Pt. Contested by Immanuel Hyland (4.4 feet, ZONE). Draymond Fox misses. Rebound secured by Kobe Booker.

[11:29] Team_026 possession (Score: 75-59)
Shaquille Trent attempts a Layup. Contested by Anthony Lillard (4.4 feet, ZONE). SHAQUILLE TRENT MAKES IT! Assist: Wendell Gasol
Score: 77-59

[11:14] Team_004 possession (Score: 77-59)
Michael Curry makes the Dunk and draws the foul on Kobe Booker! And-1! Michael Curry to the line for 1. [Team fouls: 1] (Kobe Booker: 1 personal fouls)   FT 1/1: GOOD Michael Curry makes 1/1 from the line.
Score: 77-62

[11:00] Team_026 possession (Score: 77-62)
Shaquille Trent drives and kicks out. Immanuel Hyland attempts a 3Pt. Contested by Michael Curry (5.4 feet, ZONE). Immanuel Hyland misses. Rebound secured by Anthony Lillard.

[10:49] Team_004 possession (Score: 77-62)
Draymond Fox attempts a Midrange. Contested by Immanuel Hyland (4.9 feet, ZONE). Draymond Fox misses. Rebound secured by Shaquille Trent.

[10:35] Team_026 possession (Score: 77-62)
Shaquille Trent makes the Layup and draws the foul on Draymond Fox! And-1! Shaquille Trent to the line for 1. [Team fouls: 1] (Draymond Fox: 1 personal fouls)   FT 1/1: GOOD Shaquille Trent makes 1/1 from the line.
Score: 80-62

[10:23] Team_004 possession (Score: 80-62)
Michael Curry makes the Dunk and draws the foul on Immanuel Hyland! And-1! Michael Curry to the line for 1. [Team fouls: 2] (Immanuel Hyland: 1 personal fouls)   FT 1/1: GOOD Michael Curry makes 1/1 from the line.
Score: 80-65

[10:06] Team_026 possession (Score: 80-65)
Immanuel Hyland attempts a 3Pt. Contested by Michael Curry (5.6 feet, ZONE). IMMANUEL HYLAND MAKES IT! Assist: Wendell Gasol
Score: 83-65

[09:54] Team_004 possession (Score: 83-65)
Jabari Wade drives to the basket... Jabari Wade throws a bad pass out of bounds! TURNOVER! (dead ball)

[09:54] Substitution (Team_026): Wendell Gasol OUT → Myles Tatum IN (stamina_rule2)

[09:54] Substitution (Team_026): Immanuel Hyland OUT → Karl Barrett IN (stamina_rule2)

[09:54] Substitution (Team_026): Klay Giddey OUT → Josh Simons IN (stamina_rule2)

[09:54] Substitution (Team_026): Shaquille Trent OUT → Damian Doncic IN (stamina_rule2)

[09:54] Substitution (Team_026): Kobe Booker OUT → Dirk Randle IN (stamina_rule2)

[09:54] Substitution (Team_004): Michael Curry OUT → Karl Reaves IN (stamina_rule2)

[09:54] Substitution (Team_004): Jabari Wade OUT → Russell Barnes IN (stamina_rule2)

[09:54] Substitution (Team_004): Dwyane Irving OUT → Kristaps Green IN (stamina_rule2)

[09:54] Substitution (Team_004): Draymond Fox OUT → Michael Sabonis IN (stamina_rule2)

[09:54] Substitution (Team_004): Anthony Lillard OUT → Shai Beal IN (stamina_rule2)

[09:43] Team_026 possession (Score: 83-65)
FOUL! Shooting foul on Michael Sabonis. Damian Doncic to the line for 2 free throws. [Team fouls: 2] (Michael Sabonis: 1 personal fouls)   FT 1/2: GOOD   FT 2/2: GOOD Damian Doncic makes 2/2 from the line.
Score: 85-65

[09:31] Team_004 possession (Score: 85-65)
Karl Reaves attempts a 3Pt. Contested by Myles Tatum (4.8 feet, MAN). Karl Reaves misses. Rebound secured by Josh Simons.

[09:13] Team_026 possession (Score: 85-65)
Karl Barrett attempts a 3Pt. Contested by Russell Barnes (4.7 feet, MAN). KARL BARRETT MAKES IT! Assist: Myles Tatum
Score: 88-65

[09:01] Team_004 possession (Score: 88-65)
FOUL! Holding foul on Damian Doncic. [Team fouls: 3] No free throws, side out. (Damian Doncic: 1 personal fouls)

[08:44] Team_004 possession (Score: 88-65)
Karl Reaves makes the Dunk and draws the foul on Damian Doncic! And-1! Karl Reaves to the line for 1. [Team fouls: 4] (Damian Doncic: 2 personal fouls)   FT 1/1: GOOD Karl Reaves makes 1/1 from the line.
Score: 88-68

[08:26] Team_026 possession (Score: 88-68)
Damian Doncic drives and kicks out. Dirk Randle attempts a 3Pt. Contested by Karl Reaves (5.1 feet, ZONE). Dirk Randle misses. Offensive rebound by Damian Doncic! Damian Doncic kicks it out.

[08:13] Team_026 possession (Score: 88-68)
Damian Doncic drives and kicks out. Karl Barrett attempts a Midrange. Contested by Kristaps Green (4.4 feet, ZONE). KARL BARRETT MAKES IT! Assist: Josh Simons
Score: 90-68

[08:01] Team_004 possession (Score: 90-68)
FOUL! Reach-in foul on Damian Doncic during the drive. [IN THE BONUS! 5 team fouls] Shai Beal to the line for 2 free throws. (Damian Doncic: 3 personal fouls)   FT 1/2: GOOD   FT 2/2: GOOD Shai Beal makes 2/2 from the line.
Score: 90-70

[07:45] Team_026 possession (Score: 90-70)
Damian Doncic attempts a 3Pt. Contested by Michael Sabonis (4.6 feet, MAN). Damian Doncic misses. Rebound secured by Michael Sabonis.

[07:30] Team_004 possession (Score: 90-70)
FOUL! Reach-in foul on Karl Barrett during the drive. [IN THE BONUS! 6 team fouls] Russell Barnes to the line for 2 free throws. (Karl Barrett: 1 personal fouls)   FT 1/2: GOOD   FT 2/2: GOOD Russell Barnes makes 2/2 from the line.
Score: 90-72

[07:19] Team_026 possession (Score: 90-72)
Damian Doncic attempts a 3Pt. Contested by Michael Sabonis (4.6 feet, MAN). Damian Doncic misses. Rebound secured by Russell Barnes.

[07:07] Team_004 possession (Score: 90-72)
Michael Sabonis attempts a Layup. Contested by Damian Doncic (5.6 feet, MAN). MICHAEL SABONIS MAKES IT! Assist: Karl Reaves
Score: 90-74

[06:50] Team_026 possession (Score: 90-74)
Damian Doncic attempts a Layup. Contested by Michael Sabonis (4.6 feet, MAN). DAMIAN DONCIC MAKES IT! Assist: Dirk Randle
Score: 92-74

[06:33] Team_004 possession (Score: 92-74)
Russell Barnes makes the Layup and draws the foul on Damian Doncic! And-1! Russell Barnes to the line for 1. [BONUS: 7 team fouls] (Damian Doncic: 4 personal fouls)   FT 1/1: GOOD Russell Barnes makes 1/1 from the line.
Score: 92-77

[06:16] Team_026 possession (Score: 92-77)
Karl Barrett attempts a 3Pt. Contested by Russell Barnes (4.7 feet, MAN). Karl Barrett misses. Rebound secured by Russell Barnes.

[06:02] Team_004 possession (Score: 92-77)
Michael Sabonis attempts a Layup. Contested by Damian Doncic (5.6 feet, ZONE). MICHAEL SABONIS MAKES IT! Assist: Kristaps Green
Score: 92-79

[05:51] Team_026 possession (Score: 92-79)
Dirk Randle attempts a Layup. Contested by Shai Beal (5.5 feet, ZONE). Dirk Randle misses. Rebound secured by Shai Beal.

[05:35] Team_004 possession (Score: 92-79)
Michael Sabonis attempts a 3Pt. Contested by Damian Doncic (5.6 feet, MAN). Michael Sabonis misses. Offensive rebound by Shai Beal! Shai Beal kicks it out.

[05:21] Team_004 possession (Score: 92-79)
Michael Sabonis drives, picks up Damian Doncic. Help arrives from Karl Barrett! Michael Sabonis attempts a Dunk. Contested by Karl Barrett (5.6 feet, MAN). MICHAEL SABONIS MAKES IT!
Score: 92-81

[05:10] Team_026 possession (Score: 92-81)
Dirk Randle attempts a Midrange. Contested by Kristaps Green (4.7 feet, ZONE). DIRK RANDLE MAKES IT! Assist: Damian Doncic
Score: 94-81

[04:57] Team_004 possession (Score: 94-81)
Kristaps Green attempts a 3Pt. Contested by Karl Barrett (4.7 feet, ZONE). Kristaps Green misses. Rebound secured by Karl Barrett.

[04:45] Team_026 possession (Score: 94-81)
FOUL! Shooting foul on Shai Beal. Myles Tatum to the line for 2 free throws. [Team fouls: 3] (Shai Beal: 1 personal fouls)   FT 1/2: GOOD   FT 2/2: GOOD Myles Tatum makes 2/2 from the line.
Score: 96-81

[04:31] Team_004 possession (Score: 96-81)
Kristaps Green attempts a 3Pt. Contested by Karl Barrett (4.7 feet, ZONE). Kristaps Green misses. Rebound secured by Karl Barrett.

[04:22] Team_026 possession (Score: 96-81)
Damian Doncic attempts a Layup. BLOCKED BY RUSSELL BARNES! Ball deflects out of bounds off Damian Doncic.

[04:07] Team_004 possession (Score: 96-81)
Karl Reaves attempts a Midrange. Contested by Karl Barrett (4.2 feet, ZONE). KARL REAVES MAKES IT!
Score: 96-83

[03:51] Team_026 possession (Score: 96-83)
Damian Doncic attempts a Midrange. Contested by Russell Barnes (4.3 feet, ZONE). DAMIAN DONCIC MAKES IT!
Score: 98-83

[03:38] Team_004 possession (Score: 98-83)
Russell Barnes attempts a 3Pt. Contested by Karl Barrett (5.3 feet, MAN). Russell Barnes misses. Rebound secured by Karl Barrett.

[03:24] Team_026 possession (Score: 98-83)
Josh Simons drives, picks up Kristaps Green. Help arrives from Russell Barnes! Josh Simons attempts a Layup. Contested by Russell Barnes (4.2 feet, MAN). JOSH SIMONS MAKES IT!
Score: 100-83

[03:14] Team_004 possession (Score: 100-83)
Michael Sabonis makes the Layup and draws the foul on Damian Doncic! And-1! Michael Sabonis to the line for 1. [BONUS: 8 team fouls] (Damian Doncic: 5 personal fouls)   FT 1/1: MISS Michael Sabonis makes 0/1 from the line. Offensive rebound by Russell Barnes! Russell Barnes kicks it out.
Score: 100-85

[02:56] Team_004 possession (Score: 100-85)
Kristaps Green drives to the basket... FOUL! Offensive foul on Kristaps Green! Damian Doncic drew the charge! [Team fouls: 4] (Kristaps Green: 1 personal fouls) TURNOVER! (dead ball)

[02:42] Team_026 possession (Score: 100-85)
Josh Simons attempts a 3Pt. Contested by Karl Reaves (5.0 feet, ZONE). Josh Simons misses. Rebound secured by Michael Sabonis.

[02:26] Team_004 possession (Score: 100-85)
Karl Reaves attempts a Midrange. Contested by Damian Doncic (5.2 feet, ZONE). Karl Reaves misses. Rebound secured by Josh Simons.

[02:13] Team_026 possession (Score: 100-85)
Damian Doncic attempts a 3Pt. Contested by Karl Reaves (4.9 feet, ZONE). Damian Doncic misses. Offensive rebound by Josh Simons! Josh Simons kicks it out.

[02:02] Team_026 possession (Score: 100-85)
Josh Simons drives and kicks out. Dirk Randle attempts a 3Pt. Contested by Shai Beal (5.2 feet, MAN). Dirk Randle misses. FOUL! Loose ball foul on Michael Sabonis during the rebound battle. [IN THE BONUS! 5 team fouls] Damian Doncic to the line for 2 free throws. (Michael Sabonis: 2 personal fouls)   FT 1/2: MISS   FT 2/2: GOOD Damian Doncic makes 1/2 from the line.
Score: 101-85

[01:49] Team_004 possession (Score: 101-85)
Kristaps Green attempts a 3Pt. Contested by Karl Barrett (4.9 feet, ZONE). Kristaps Green misses. Rebound secured by Damian Doncic.

[01:35] Team_026 possession (Score: 101-85)
FOUL! Reach-in foul on Shai Beal during the drive. [IN THE BONUS! 6 team fouls] Dirk Randle to the line for 2 free throws. (Shai Beal: 2 personal fouls)   FT 1/2: GOOD   FT 2/2: GOOD Dirk Randle makes 2/2 from the line.
Score: 103-85

[01:22] Team_004 possession (Score: 103-85)
Kristaps Green attempts a 3Pt. Contested by Josh Simons (5.3 feet, MAN). Kristaps Green misses. Rebound secured by Josh Simons.

[01:07] Team_026 possession (Score: 103-85)
Myles Tatum drives to the basket... Myles Tatum loses the ball! Stripped by Karl Reaves! TURNOVER! (live ball)

[00:51] Team_004 possession (Score: 103-85)
Shai Beal drives, picks up Dirk Randle. Help arrives from Karl Barrett! Shai Beal attempts a Layup. Wide open! Karl Barrett is 6.5 feet away. [MAN] SHAI BEAL MAKES IT! Assist: Michael Sabonis
Score: 103-87

[00:40] Team_026 possession (Score: 103-87)
FOUL! Shooting foul on Russell Barnes. Karl Barrett to the line for 2 free throws. [BONUS: 7 team fouls] (Russell Barnes: 1 personal fouls)   FT 1/2: MISS   FT 2/2: GOOD Karl Barrett makes 1/2 from the line.
Score: 104-87

[00:24] Team_004 possession (Score: 104-87)
Karl Reaves throws a bad pass! Stolen by Myles Tatum! TURNOVER! (live ball)

[00:11] Team_026 possession (Score: 104-87)
Karl Barrett drives, picks up Russell Barnes. Help arrives from Kristaps Green! Karl Barrett attempts a Dunk. Contested by Kristaps Green (5.0 feet, MAN). KARL BARRETT MAKES IT! Assist: Dirk Randle
Score: 106-87

================================================================================
                              4TH QUARTER COMPLETE                              
================================================================================

4TH QUARTER SCORE: Team_026 31, Team_004 28

BOX SCORE:
================================================================================

Team_026
--------------------------------------------------------------------------------
Player                MIN  PTS  REB  AST  TO      FG   FG%      3P   3P%
--------------------------------------------------------------------------------
Karl Barrett           21    8    3    0   0   4/5    80.0     0/0   0.0
Damian Doncic          21    7    2    1   0   4/7    57.1     0/0   0.0
Shaquille Trent        27    5    1    0   0   2/3    66.7     0/0   0.0
Dirk Randle            21    4    0    2   0   2/3    66.7     0/0   0.0
Immanuel Hyland        27    3    0    0   0   1/1   100.0     0/0   0.0
Josh Simons            21    2    4    1   0   1/2    50.0     0/0   0.0
Myles Tatum            20    2    0    1   0   1/1   100.0     0/0   0.0
Klay Giddey            27    0    0    0   0   0/1     0.0     0/0   0.0
Kobe Booker            27    0    1    0   0   0/0     0.0     0/0   0.0
Wendell Gasol          29    0    0    2   0   0/0     0.0     0/0   0.0

TEAM: FG: 15/23 (65.2%), 3PT: 2/7 (28.6%), REB: 11 (2 off, 9 def), AST: 7, TO: 1
TEAM FOULS: 8 [Team_004 in BONUS]


Team_004
--------------------------------------------------------------------------------
Player                MIN  PTS  REB  AST  TO      FG   FG%      3P   3P%
--------------------------------------------------------------------------------
Michael Curry          29    6    0    0   0   2/3    66.7     0/0   0.0
Michael Sabonis        20    6    2    1   0   3/3   100.0     0/0   0.0
Karl Reaves            20    5    0    1   0   2/4    50.0     0/0   0.0
Russell Barnes         21    5    3    0   0   2/3    66.7     0/0   0.0
Shai Beal              21    4    2    0   0   2/2   100.0     0/0   0.0
Draymond Fox           29    0    1    0   0   0/1     0.0     0/0   0.0
Anthony Lillard        27    0    1    0   0   0/0     0.0     0/0   0.0
Kristaps Green         20    0    0    1   0   0/4     0.0     0/0   0.0

TEAM: FG: 11/20 (55.0%), 3PT: 0/6 (0.0%), REB: 9 (2 off, 7 def), AST: 3, TO: 3
TEAM FOULS: 7 [Team_026 in BONUS]

================================================================================

================================================================================
                               FULL GAME COMPLETE                               
================================================================================

FINAL SCORE: Team_026 106, Team_004 87

SCORING BY QUARTER:
--------------------------------------------------------------------------------
Team                     Q1     Q2     Q3     Q4    FINAL
--------------------------------------------------------------------------------
Team_026                 20     22     33     31      106
Team_004                 18     22     19     28       87
--------------------------------------------------------------------------------

FULL GAME BOX SCORE:
================================================================================

Team_026
--------------------------------------------------------------------------------
Player                MIN  PTS  REB  AST  TO      FG   FG%      3P   3P%      FT STL BLK
--------------------------------------------------------------------------------
Wendell Gasol          29    8    0    7   1   4/9    44.4   2/3    66.7   3/3     0   0
Immanuel Hyland        27   14    3    1   1   5/7    71.4   4/4   100.0   0/0     0   1
Klay Giddey            27    5    0    1   2   1/11    9.1   0/6     0.0   4/7     0   1
Shaquille Trent        27   16   15    3   0   6/10   60.0   2/2   100.0   5/6     0   0
Kobe Booker            27   17    7    2   1   7/8    87.5   1/1   100.0   2/2     2   0
Karl Barrett           21   13    5    3   1   5/14   35.7   2/9    22.2   4/8     0   0
Josh Simons            21    5    8    1   1   3/5    60.0   1/3    33.3   0/0     1   0
Damian Doncic          21   12    5    2   0   6/9    66.7   1/3    33.3   5/6     2   2
Dirk Randle            21    7    0    2   0   3/4    75.0   1/1   100.0   2/2     0   0
Myles Tatum            20    4    0    1   0   2/3    66.7   0/0     0.0   2/3     1   0

TEAM: FG: 42/80 (52.5%), 3PT: 14/32 (43.8%), REB: 43 (13 off, 30 def), AST: 23, TO: 7


Team_004
--------------------------------------------------------------------------------
Player                MIN  PTS  REB  AST  TO      FG   FG%      3P   3P%      FT STL BLK
--------------------------------------------------------------------------------
Michael Curry          29   14    0    0   2   5/10   50.0   2/4    50.0   2/2     0   1
Dwyane Irving          29   14    7    2   2   5/12   41.7   2/5    40.0   4/4     1   1
Draymond Fox           29    7    8    1   2   3/5    60.0   0/0     0.0   1/1     0   0
Jabari Wade            27    6    0    3   3   3/6    50.0   0/1     0.0   4/4     0   0
Anthony Lillard        27    7    8    3   2   4/5    80.0   2/2   100.0   3/4     0   1
Russell Barnes         21   10   12    0   1   4/7    57.1   1/3    33.3   3/3     0   1
Shai Beal              21    7    9    1   3   3/5    60.0   0/0     0.0   3/3     1   0
Karl Reaves            20    8    0    2   1   2/5    40.0   0/1     0.0   1/1     1   0
Kristaps Green         20    3    0    2   0   1/6    16.7   1/5    20.0   2/3     0   0
Michael Sabonis        20    6    3    2   1   4/5    80.0   0/1     0.0   0/1     0   0

TEAM: FG: 34/66 (51.5%), 3PT: 8/22 (36.4%), REB: 47 (11 off, 36 def), AST: 16, TO: 17

================================================================================
