================================================================================
                        FULL GAME - Team_085 vs Team_008                        
================================================================================

================================================================================
                       1ST QUARTER - Team_085 vs Team_008                       
================================================================================

[12:00] Team_085 possession (Score: 0-0)
Collin Mobley drives and kicks out. Paul Wagner attempts a Midrange. Contested by Jrue Harris (4.3 feet, ZONE). Paul Wagner misses. Rebound secured by Khris Hyland.

[11:46] Team_008 possession (Score: 0-0)
Khris Hyland attempts a Midrange. Contested by Larry Duncan (3.1 feet, MAN). Khris Hyland misses. Rebound secured by Collin Mobley.

[11:31] Team_085 possession (Score: 0-0)
Stephen Bird drives and kicks out. Stephen Bird attempts a 3Pt. Contested by Victor Leonard (5.0 feet, ZONE). STEPHEN BIRD MAKES IT! Assist: Larry Duncan
Score: 3-0

[11:17] Team_008 possession (Score: 3-0)
Victor Leonard attempts a Midrange. Contested by Larry Duncan (3.4 feet, ZONE). VICTOR LEONARD MAKES IT! Assist: Jrue Harris
Score: 3-2

[11:02] Team_085 possession (Score: 3-2)
FOUL! Shooting foul on Tyrese Thompson. Collin Mobley to the line for 2 free throws. [Team fouls: 1] (Tyrese Thompson: 1 personal fouls)   FT 1/2: GOOD   FT 2/2: MISS Collin Mobley makes 1/2 from the line. Rebound secured by Khris Hyland.
Score: 4-2

[10:50] Team_008 possession (Score: 4-2)
Jrue Harris attempts a Midrange. Contested by Stephen Bird (3.5 feet, ZONE). Jrue Harris misses. Rebound secured by Larry Duncan.

[10:33] Team_085 possession (Score: 4-2)
Larry Duncan attempts a Midrange. Contested by Khris Hyland (4.4 feet, MAN). LARRY DUNCAN MAKES IT!
Score: 6-2

[10:17] Team_008 possession (Score: 6-2)
Tyrese Thompson attempts a Midrange. Contested by Larry Duncan (3.2 feet, ZONE). Tyrese Thompson misses. Rebound secured by Paul Wagner.

[10:01] Team_085 possession (Score: 6-2)
Stephen Bird drives, Tyrese Thompson stays with him. Stephen Bird attempts a Layup. Contested by Tyrese Thompson (4.6 feet, ZONE). STEPHEN BIRD MAKES IT! Assist: Larry Duncan
Score: 8-2

[09:47] Team_008 possession (Score: 8-2)
Magic Young attempts a Layup. BLOCKED BY PAUL WAGNER! Ball is loose! Offensive rebound by Magic Young! Magic Young kicks it out.

[09:32] Team_008 possession (Score: 8-2)
Tyrese Thompson attempts a 3Pt. Contested by Paul Wagner (3.7 feet, MAN). Tyrese Thompson misses. Rebound secured by Collin Mobley.

[09:17] Team_085 possession (Score: 8-2)
Paul Wagner attempts a Dunk. BLOCKED BY TYRESE THOMPSON! Ball deflects out of bounds off Paul Wagner.

[09:01] Team_008 possession (Score: 8-2)
Magic Young attempts a 3Pt. Contested by Collin Mobley (4.3 feet, MAN). Magic Young misses. Rebound secured by Collin Mobley.

[08:47] Team_085 possession (Score: 8-2)
Collin Mobley attempts a Midrange. Contested by Jrue Harris (4.2 feet, ZONE). Collin Mobley misses. Rebound secured by Khris Hyland.

[08:34] Team_008 possession (Score: 8-2)
Tyrese Thompson attempts a Layup. Contested by Paul Wagner (3.7 feet, MAN). TYRESE THOMPSON MAKES IT! Assist: Victor Leonard
Score: 8-4

[08:19] Team_085 possession (Score: 8-4)
FOUL! Offensive foul on Stephen Bird! Jrue Harris drew the charge! [Team fouls: 1] (Stephen Bird: 1 personal fouls) TURNOVER! (dead ball)

[08:08] Team_008 possession (Score: 8-4)
Victor Leonard attempts a Midrange. Contested by Magic Beal (4.3 feet, MAN). VICTOR LEONARD MAKES IT! Assist: Khris Hyland
Score: 8-6

[07:49] Team_085 possession (Score: 8-6)
Larry Duncan attempts a 3Pt. Contested by Khris Hyland (4.4 feet, MAN). Larry Duncan misses. Rebound secured by Magic Young.

[07:37] Team_008 possession (Score: 8-6)
Khris Hyland drives, Paul Wagner stays with him. Khris Hyland attempts a Dunk. Contested by Paul Wagner (3.6 feet, ZONE). Khris Hyland misses. Rebound secured by Larry Duncan.

[07:20] Team_085 possession (Score: 8-6)
Magic Beal attempts a 3Pt. Contested by Victor Leonard (5.4 feet, ZONE). MAGIC BEAL MAKES IT! Assist: Paul Wagner
Score: 11-6

[07:08] Team_008 possession (Score: 11-6)
Victor Leonard attempts a 3Pt. Contested by Magic Beal (4.3 feet, ZONE). Victor Leonard misses. Rebound secured by Larry Duncan.

[06:58] Team_085 possession (Score: 11-6)
Paul Wagner attempts a Dunk. BLOCKED BY TYRESE THOMPSON! Ball deflects out of bounds off Paul Wagner.

[06:46] Team_008 possession (Score: 11-6)
Tyrese Thompson attempts a Midrange. Contested by Paul Wagner (3.7 feet, MAN). TYRESE THOMPSON MAKES IT! Assist: Jrue Harris
Score: 11-8

[06:30] Team_085 possession (Score: 11-8)
Collin Mobley drives, picks up Tyrese Thompson. Help arrives from Jrue Harris! Collin Mobley attempts a Dunk. Contested by Jrue Harris (4.3 feet, ZONE). COLLIN MOBLEY MAKES IT! Assist: Paul Wagner
Score: 13-8

[06:18] Team_008 possession (Score: 13-8)
Khris Hyland attempts a 3Pt. Contested by Magic Beal (4.1 feet, ZONE). KHRIS HYLAND MAKES IT! Assist: Magic Young
Score: 13-11

[06:04] Team_085 possession (Score: 13-11)
Collin Mobley drives, Tyrese Thompson stays with him. Collin Mobley attempts a Layup. Contested by Tyrese Thompson (4.3 feet, ZONE). Collin Mobley misses. Offensive rebound by Larry Duncan! Larry Duncan kicks it out.

[05:50] Team_085 possession (Score: 13-11)
Larry Duncan makes the Layup and draws the foul on Magic Young! And-1! Larry Duncan to the line for 1. [Team fouls: 2] (Magic Young: 1 personal fouls)   FT 1/1: GOOD Larry Duncan makes 1/1 from the line.
Score: 16-11

[05:37] Team_008 possession (Score: 16-11)
Victor Leonard attempts a 3Pt. Contested by Magic Beal (4.3 feet, MAN). Victor Leonard misses. Rebound secured by Larry Duncan.

[05:21] Team_085 possession (Score: 16-11)
Collin Mobley attempts a Layup. Contested by Tyrese Thompson (4.3 feet, ZONE). Collin Mobley misses. Rebound secured by Khris Hyland.

[05:11] Team_008 possession (Score: 16-11)
Tyrese Thompson throws a bad pass out of bounds! TURNOVER! (dead ball)

[04:53] Team_085 possession (Score: 16-11)
Larry Duncan attempts a 3Pt. Contested by Victor Leonard (5.4 feet, ZONE). LARRY DUNCAN MAKES IT! Assist: Magic Beal
Score: 19-11

[04:37] Team_008 possession (Score: 19-11)
Magic Young attempts a Midrange. Contested by Stephen Bird (3.9 feet, ZONE). MAGIC YOUNG MAKES IT! Assist: Jrue Harris
Score: 19-13

[04:24] Team_085 possession (Score: 19-13)
FOUL! Holding foul on Victor Leonard. [Team fouls: 3] No free throws, side out. (Victor Leonard: 1 personal fouls)

[04:10] Team_085 possession (Score: 19-13)
FOUL! Holding foul on Victor Leonard. [Team fouls: 4] No free throws, side out. (Victor Leonard: 2 personal fouls)

[03:52] Team_085 possession (Score: 19-13)
FOUL! Shooting foul on Tyrese Thompson. Stephen Bird to the line for 2 free throws. [BONUS: 5 team fouls] (Tyrese Thompson: 2 personal fouls)   FT 1/2: GOOD   FT 2/2: GOOD Stephen Bird makes 2/2 from the line.
Score: 21-13

[03:35] Team_008 possession (Score: 21-13)
Victor Leonard attempts a 3Pt. Contested by Magic Beal (4.4 feet, ZONE). VICTOR LEONARD MAKES IT! Assist: Tyrese Thompson
Score: 21-16

[03:20] Team_085 possession (Score: 21-16)
Collin Mobley drives, picks up Magic Young. Help arrives from Jrue Harris! Collin Mobley attempts a Layup. Contested by Jrue Harris (5.0 feet, MAN). COLLIN MOBLEY MAKES IT! Assist: Stephen Bird
Score: 23-16

[03:04] Team_008 possession (Score: 23-16)
Khris Hyland attempts a Midrange. Contested by Larry Duncan (3.3 feet, MAN). Khris Hyland misses. Rebound secured by Collin Mobley.

[02:51] Team_085 possession (Score: 23-16)
Larry Duncan attempts a 3Pt. Contested by Khris Hyland (4.6 feet, MAN). Larry Duncan misses. Rebound secured by Khris Hyland.

[02:38] Team_008 possession (Score: 23-16)
Magic Young makes the Layup and draws the foul on Collin Mobley! And-1! Magic Young to the line for 1. [Team fouls: 2] (Collin Mobley: 1 personal fouls)   FT 1/1: MISS Magic Young makes 0/1 from the line. Rebound secured by Paul Wagner.
Score: 23-18

[02:27] Team_085 possession (Score: 23-18)
Stephen Bird attempts a 3Pt. Contested by Jrue Harris (4.8 feet, MAN). STEPHEN BIRD MAKES IT! Assist: Larry Duncan
Score: 26-18

[02:15] Team_008 possession (Score: 26-18)
Magic Young drives, Collin Mobley stays with him. Magic Young attempts a Dunk. Contested by Collin Mobley (4.6 feet, MAN). Magic Young misses. Rebound secured by Larry Duncan.

[01:57] Team_085 possession (Score: 26-18)
Collin Mobley drives to the basket... Collin Mobley loses control! Ball rolls out of bounds! TURNOVER! (dead ball)

[01:57] Substitution (Team_085): Magic Beal OUT → Khris Brogdon IN (stamina_rule2)

[01:57] Substitution (Team_085): Stephen Bird OUT → Jordan Morant IN (stamina_rule2)

[01:57] Substitution (Team_085): Larry Duncan OUT → Giannis Johnson IN (stamina_rule2)

[01:57] Substitution (Team_085): Collin Mobley OUT → Malcolm Beal IN (stamina_rule2)

[01:57] Substitution (Team_008): Victor Leonard OUT → Blake Holiday IN (stamina_rule2)

[01:57] Substitution (Team_008): Jrue Harris OUT → Chris Griffin IN (stamina_rule2)

[01:57] Substitution (Team_008): Khris Hyland OUT → Immanuel Young IN (stamina_rule2)

[01:57] Substitution (Team_008): Tyrese Thompson OUT → Khris Giddey IN (stamina_rule2)

[01:57] Substitution (Team_008): Magic Young OUT → Lamelo Middleton IN (stamina_rule2)

[01:43] Team_008 possession (Score: 26-18)
Blake Holiday attempts a 3Pt. Contested by Khris Brogdon (5.6 feet, MAN). Blake Holiday misses. Offensive rebound by Lamelo Middleton! Lamelo Middleton puts it back in!
Score: 26-20

[01:29] Team_085 possession (Score: 26-20)
Giannis Johnson attempts a 3Pt. Contested by Immanuel Young (4.3 feet, MAN). Giannis Johnson misses. Rebound secured by Chris Griffin.

[01:14] Team_008 possession (Score: 26-20)
Khris Giddey drives and kicks out. Chris Griffin attempts a Midrange. Contested by Paul Wagner (3.9 feet, ZONE). Chris Griffin misses. Rebound secured by Malcolm Beal.

[01:03] Team_085 possession (Score: 26-20)
Giannis Johnson makes the Layup and draws the foul on Lamelo Middleton! And-1! Giannis Johnson to the line for 1. [BONUS: 6 team fouls] (Lamelo Middleton: 1 personal fouls)   FT 1/1: GOOD Giannis Johnson makes 1/1 from the line.
Score: 29-20

[00:47] Team_008 possession (Score: 29-20)
Blake Holiday drives, Khris Brogdon stays with him. Blake Holiday attempts a Layup. Contested by Khris Brogdon (5.6 feet, MAN). BLAKE HOLIDAY MAKES IT! Assist: Lamelo Middleton
Score: 29-22

[00:32] Team_085 possession (Score: 29-22)
Paul Wagner makes the Midrange and draws the foul on Khris Giddey! And-1! Paul Wagner to the line for 1. [BONUS: 7 team fouls] (Khris Giddey: 1 personal fouls)   FT 1/1: GOOD Paul Wagner makes 1/1 from the line.
Score: 32-22

[00:18] Team_008 possession (Score: 32-22)
Lamelo Middleton makes the Dunk and draws the foul on Paul Wagner! And-1! Lamelo Middleton to the line for 1. [Team fouls: 3] (Paul Wagner: 1 personal fouls)   FT 1/1: GOOD Lamelo Middleton makes 1/1 from the line.
Score: 32-25

================================================================================
                              1ST QUARTER COMPLETE                              
================================================================================

1ST QUARTER SCORE: Team_085 32, Team_008 25

BOX SCORE:
================================================================================

Team_085
--------------------------------------------------------------------------------
Player                MIN  PTS  REB  AST  TO      FG   FG%      3P   3P%
--------------------------------------------------------------------------------
Stephen Bird           10   10    0    1   0   4/4   100.0     0/0   0.0
Larry Duncan           10    8    6    3   0   3/5    60.0     0/0   0.0
Collin Mobley          10    4    4    0   0   2/6    33.3     0/0   0.0
Paul Wagner            12    3    2    2   0   1/3    33.3     0/0   0.0
Magic Beal             10    3    0    1   0   1/1   100.0     0/0   0.0
Giannis Johnson         2    3    0    0   0   1/2    50.0     0/0   0.0
Malcolm Beal            2    0    1    0   0   0/0     0.0     0/0   0.0

TEAM: FG: 12/21 (57.1%), 3PT: 3/6 (50.0%), REB: 13 (1 off, 12 def), AST: 7, TO: 2
TEAM FOULS: 3


Team_008
--------------------------------------------------------------------------------
Player                MIN  PTS  REB  AST  TO      FG   FG%      3P   3P%
--------------------------------------------------------------------------------
Victor Leonard         10    7    0    1   0   3/5    60.0     0/0   0.0
Lamelo Middleton        2    5    1    1   0   2/2   100.0     0/0   0.0
Tyrese Thompson        10    4    0    1   0   2/4    50.0     0/0   0.0
Khris Hyland           10    3    5    1   0   1/4    25.0     0/0   0.0
Magic Young            10    2    2    1   0   1/4    25.0     0/0   0.0
Blake Holiday           2    2    0    0   0   1/1   100.0     0/0   0.0
Jrue Harris            10    0    0    3   0   0/1     0.0     0/0   0.0
Chris Griffin           2    0    1    0   0   0/0     0.0     0/0   0.0
Khris Giddey            2    0    0    0   0   0/1     0.0     0/0   0.0

TEAM: FG: 10/22 (45.5%), 3PT: 3/7 (42.9%), REB: 9 (2 off, 7 def), AST: 8, TO: 1
TEAM FOULS: 7 [Team_085 in BONUS]

================================================================================

================================================================================
                       2ND QUARTER - Team_085 vs Team_008                       
================================================================================

[12:00] Team_085 possession (Score: 32-25)
Larry Duncan drives and kicks out. FOUL! Shooting foul on Tyrese Thompson. Paul Wagner to the line for 2 free throws. [Team fouls: 1] (Tyrese Thompson: 1 personal fouls)   FT 1/2: GOOD   FT 2/2: GOOD Paul Wagner makes 2/2 from the line.
Score: 34-25

[11:42] Team_008 possession (Score: 34-25)
Khris Hyland drives and kicks out. Khris Hyland attempts a 3Pt. Contested by Magic Beal (4.1 feet, ZONE). Khris Hyland misses. Rebound secured by Larry Duncan.

[11:24] Team_085 possession (Score: 34-25)
Larry Duncan attempts a 3Pt. Contested by Khris Hyland (4.5 feet, MAN). Larry Duncan misses. Rebound secured by Magic Young.

[11:08] Team_008 possession (Score: 34-25)
Victor Leonard attempts a Layup. BLOCKED BY MAGIC BEAL! Ball is loose! Rebound secured by Collin Mobley.

[10:55] Team_085 possession (Score: 34-25)
Paul Wagner drives, Tyrese Thompson stays with him. Paul Wagner attempts a Dunk. Contested by Tyrese Thompson (4.9 feet, MAN). PAUL WAGNER MAKES IT! Assist: Collin Mobley
Score: 36-25

[10:43] Team_008 possession (Score: 36-25)
Magic Young drives to the basket... FOUL! Offensive foul on Magic Young! Paul Wagner drew the charge! [Team fouls: 2] (Magic Young: 1 personal fouls) TURNOVER! (dead ball)

[10:33] Team_085 possession (Score: 36-25)
Collin Mobley drives, Tyrese Thompson stays with him. Collin Mobley attempts a Layup. Contested by Tyrese Thompson (4.6 feet, ZONE). COLLIN MOBLEY MAKES IT!
Score: 38-25

[10:20] Team_008 possession (Score: 38-25)
Victor Leonard attempts a 3Pt. Contested by Magic Beal (4.5 feet, ZONE). Victor Leonard misses. Rebound secured by Larry Duncan.

[10:04] Team_085 possession (Score: 38-25)
FOUL! Reach-in foul on Tyrese Thompson during the drive. [Team fouls: 3] No free throws, side out. (Tyrese Thompson: 2 personal fouls)

[09:47] Team_085 possession (Score: 38-25)
Paul Wagner attempts a Layup. Contested by Tyrese Thompson (5.0 feet, ZONE). PAUL WAGNER MAKES IT!
Score: 40-25

[09:31] Team_008 possession (Score: 40-25)
Victor Leonard drives, Magic Beal stays with him. Victor Leonard attempts a Dunk. Contested by Magic Beal (4.6 feet, MAN). Victor Leonard misses. Rebound secured by Collin Mobley.

[09:21] Team_085 possession (Score: 40-25)
FOUL! Shooting foul on Jrue Harris. Stephen Bird to the line for 2 free throws. [Team fouls: 4] (Jrue Harris: 1 personal fouls)   FT 1/2: GOOD   FT 2/2: GOOD Stephen Bird makes 2/2 from the line.
Score: 42-25

[09:06] Team_008 possession (Score: 42-25)
Magic Young attempts a 3Pt. Contested by Magic Beal (4.7 feet, ZONE). MAGIC YOUNG MAKES IT! Assist: Victor Leonard
Score: 42-28

[08:55] Team_085 possession (Score: 42-28)
FOUL! Reach-in foul on Tyrese Thompson during the drive. [IN THE BONUS! 5 team fouls] Paul Wagner to the line for 2 free throws. (Tyrese Thompson: 3 personal fouls)   FT 1/2: GOOD   FT 2/2: MISS Paul Wagner makes 1/2 from the line. Rebound secured by Tyrese Thompson.
Score: 43-28

[08:39] Team_008 possession (Score: 43-28)
FOUL! Holding foul on Collin Mobley. [Team fouls: 1] No free throws, side out. (Collin Mobley: 1 personal fouls)

[08:26] Team_008 possession (Score: 43-28)
Victor Leonard attempts a Midrange. Contested by Larry Duncan (3.7 feet, ZONE). VICTOR LEONARD MAKES IT!
Score: 43-30

[08:08] Team_085 possession (Score: 43-30)
Stephen Bird attempts a 3Pt. Contested by Jrue Harris (4.9 feet, MAN). STEPHEN BIRD MAKES IT! Assist: Magic Beal
Score: 46-30

[07:57] Team_008 possession (Score: 46-30)
Magic Young attempts a Midrange. Contested by Paul Wagner (4.6 feet, ZONE). Magic Young misses. Offensive rebound by Tyrese Thompson! Tyrese Thompson kicks it out.

[07:42] Team_008 possession (Score: 46-30)
Khris Hyland attempts a 3Pt. Contested by Larry Duncan (3.6 feet, MAN). Khris Hyland misses. Rebound secured by Paul Wagner.

[07:26] Team_085 possession (Score: 46-30)
Larry Duncan drives and kicks out. Collin Mobley attempts a 3Pt. Contested by Magic Young (5.6 feet, MAN). Collin Mobley misses. Rebound secured by Magic Young.

[07:15] Team_008 possession (Score: 46-30)
FOUL! Holding foul on Stephen Bird. [Team fouls: 2] No free throws, side out. (Stephen Bird: 1 personal fouls)

[06:56] Team_008 possession (Score: 46-30)
FOUL! Holding foul on Collin Mobley. [Team fouls: 3] No free throws, side out. (Collin Mobley: 2 personal fouls)

[06:40] Team_008 possession (Score: 46-30)
Jrue Harris attempts a 3Pt. Contested by Magic Beal (4.7 feet, ZONE). JRUE HARRIS MAKES IT! Assist: Victor Leonard
Score: 46-33

[06:27] Team_085 possession (Score: 46-33)
Collin Mobley attempts a Layup. Contested by Tyrese Thompson (5.1 feet, ZONE). Collin Mobley misses. Rebound secured by Magic Young.

[06:09] Team_008 possession (Score: 46-33)
Victor Leonard loses the ball! Stripped by Magic Beal! TURNOVER! (live ball)

[05:55] Team_085 possession (Score: 46-33)
Stephen Bird loses control! Ball rolls out of bounds! TURNOVER! (dead ball)

[05:55] Substitution (Team_085): Magic Beal OUT → Khris Brogdon IN (stamina_rule2)

[05:55] Substitution (Team_085): Stephen Bird OUT → Jordan Morant IN (stamina_rule2)

[05:55] Substitution (Team_085): Larry Duncan OUT → Giannis Johnson IN (stamina_rule2)

[05:55] Substitution (Team_085): Paul Wagner OUT → Jalen Leonard IN (stamina_rule2)

[05:55] Substitution (Team_085): Collin Mobley OUT → Malcolm Beal IN (stamina_rule2)

[05:55] Substitution (Team_008): Victor Leonard OUT → Blake Holiday IN (stamina_rule2)

[05:55] Substitution (Team_008): Jrue Harris OUT → Chris Griffin IN (stamina_rule2)

[05:55] Substitution (Team_008): Khris Hyland OUT → Immanuel Young IN (stamina_rule2)

[05:55] Substitution (Team_008): Tyrese Thompson OUT → Khris Giddey IN (stamina_rule2)

[05:55] Substitution (Team_008): Magic Young OUT → Lamelo Middleton IN (stamina_rule2)

[05:37] Team_008 possession (Score: 46-33)
Chris Griffin attempts a 3Pt. Contested by Jordan Morant (3.8 feet, ZONE). Chris Griffin misses. Rebound secured by Giannis Johnson.

[05:19] Team_085 possession (Score: 46-33)
FOUL! Offensive foul on Jordan Morant! Chris Griffin drew the charge! [Team fouls: 4] (Jordan Morant: 1 personal fouls) TURNOVER! (dead ball)

[05:04] Team_008 possession (Score: 46-33)
Blake Holiday attempts a Midrange. Contested by Khris Brogdon (5.6 feet, MAN). BLAKE HOLIDAY MAKES IT! Assist: Khris Giddey
Score: 46-35

[04:46] Team_085 possession (Score: 46-35)
Giannis Johnson attempts a Midrange. Contested by Immanuel Young (4.3 feet, MAN). Giannis Johnson misses. FOUL! Loose ball foul on Khris Giddey during the rebound battle. [IN THE BONUS! 6 team fouls] Malcolm Beal to the line for 2 free throws. (Khris Giddey: 1 personal fouls)   FT 1/2: GOOD   FT 2/2: GOOD Malcolm Beal makes 2/2 from the line.
Score: 48-35

[04:35] Team_008 possession (Score: 48-35)
Khris Giddey drives, picks up Malcolm Beal. Help arrives from Jordan Morant! Khris Giddey attempts a Dunk. Contested by Jordan Morant (4.2 feet, ZONE). Khris Giddey misses. Offensive rebound by Khris Giddey! Khris Giddey kicks it out.

[04:21] Team_008 possession (Score: 48-35)
Khris Giddey throws a bad pass! Stolen by Jalen Leonard! TURNOVER! (live ball)

[04:09] Team_085 possession (Score: 48-35)
Jalen Leonard attempts a Midrange. Contested by Chris Griffin (5.6 feet, ZONE). Jalen Leonard misses. Offensive rebound by Malcolm Beal! Malcolm Beal kicks it out.

[03:58] Team_085 possession (Score: 48-35)
Khris Brogdon attempts a Midrange. Contested by Khris Giddey (4.1 feet, ZONE). Khris Brogdon misses. Rebound secured by Chris Griffin.

[03:48] Team_008 possession (Score: 48-35)
FOUL! Shooting foul on Jalen Leonard. Khris Giddey to the line for 2 free throws. [BONUS: 5 team fouls] (Jalen Leonard: 1 personal fouls)   FT 1/2: MISS   FT 2/2: GOOD Khris Giddey makes 1/2 from the line.
Score: 48-36

[03:34] Team_085 possession (Score: 48-36)
Malcolm Beal attempts a Layup. BLOCKED BY LAMELO MIDDLETON! Ball is loose! Rebound secured by Lamelo Middleton.

[03:24] Team_008 possession (Score: 48-36)
Lamelo Middleton attempts a 3Pt. Contested by Malcolm Beal (4.6 feet, MAN). Lamelo Middleton misses. Rebound secured by Malcolm Beal.

[03:08] Team_085 possession (Score: 48-36)
Khris Brogdon attempts a Layup. Contested by Blake Holiday (5.2 feet, MAN). KHRIS BROGDON MAKES IT! Assist: Jalen Leonard
Score: 50-36

[02:53] Team_008 possession (Score: 50-36)
Lamelo Middleton attempts a Layup. BLOCKED BY MALCOLM BEAL! Ball goes out off Malcolm Beal. Lamelo Middleton's ball!

[02:44] Team_008 possession (Score: 50-36)
Blake Holiday attempts a Midrange. Contested by Khris Brogdon (5.6 feet, MAN). BLAKE HOLIDAY MAKES IT!
Score: 50-38

[02:32] Team_085 possession (Score: 50-38)
Malcolm Beal attempts a Layup. Contested by Lamelo Middleton (3.8 feet, MAN). MALCOLM BEAL MAKES IT! Assist: Giannis Johnson
Score: 52-38

[02:17] Team_008 possession (Score: 52-38)
Khris Giddey drives, Malcolm Beal stays with him. Khris Giddey attempts a Layup. Contested by Malcolm Beal (4.2 feet, ZONE). KHRIS GIDDEY MAKES IT!
Score: 52-40

[02:01] Team_085 possession (Score: 52-40)
Jalen Leonard attempts a Midrange. Contested by Khris Giddey (4.6 feet, MAN). Jalen Leonard misses. Rebound secured by Khris Giddey.

[01:43] Team_008 possession (Score: 52-40)
FOUL! Shooting foul on Jordan Morant. Lamelo Middleton to the line for 2 free throws. [BONUS: 6 team fouls] (Jordan Morant: 2 personal fouls)   FT 1/2: GOOD   FT 2/2: GOOD Lamelo Middleton makes 2/2 from the line.
Score: 52-42

[01:24] Team_085 possession (Score: 52-42)
Giannis Johnson drives, picks up Immanuel Young. Help arrives from Chris Griffin! Giannis Johnson attempts a Layup. Contested by Chris Griffin (4.3 feet, MAN). Giannis Johnson misses. Rebound secured by Lamelo Middleton.

[01:10] Team_008 possession (Score: 52-42)
Blake Holiday makes the Layup and draws the foul on Khris Brogdon! And-1! Blake Holiday to the line for 1. [BONUS: 7 team fouls] (Khris Brogdon: 1 personal fouls)   FT 1/1: GOOD Blake Holiday makes 1/1 from the line.
Score: 52-45

[00:54] Team_085 possession (Score: 52-45)
Khris Brogdon attempts a 3Pt. Contested by Khris Giddey (4.1 feet, ZONE). KHRIS BROGDON MAKES IT! Assist: Jalen Leonard
Score: 55-45

[00:42] Team_008 possession (Score: 55-45)
Chris Griffin attempts a Midrange. Contested by Jordan Morant (3.8 feet, ZONE). CHRIS GRIFFIN MAKES IT!
Score: 55-47

[00:32] Team_085 possession (Score: 55-47)
Jalen Leonard drives, Khris Giddey stays with him. Jalen Leonard attempts a Dunk. Contested by Khris Giddey (4.6 feet, MAN). Jalen Leonard misses. Offensive rebound by Jalen Leonard! Jalen Leonard kicks it out.

[00:16] Team_085 possession (Score: 55-47)
FOUL! Shooting foul on Lamelo Middleton. Malcolm Beal to the line for 2 free throws. [BONUS: 7 team fouls] (Lamelo Middleton: 1 personal fouls)   FT 1/2: GOOD   FT 2/2: GOOD Malcolm Beal makes 2/2 from the line.
Score: 57-47

[00:01] Team_008 possession (Score: 57-47)
FOUL! Holding foul on Giannis Johnson. [IN THE BONUS! 8 team fouls] Immanuel Young to the line for 2 free throws. (Giannis Johnson: 1 personal fouls)   FT 1/2: GOOD   FT 2/2: GOOD Immanuel Young makes 2/2 from the line.
Score: 57-49

================================================================================
                              2ND QUARTER COMPLETE                              
================================================================================

2ND QUARTER SCORE: Team_085 25, Team_008 24

BOX SCORE:
================================================================================

Team_085
--------------------------------------------------------------------------------
Player                MIN  PTS  REB  AST  TO      FG   FG%      3P   3P%
--------------------------------------------------------------------------------
Paul Wagner            18    6    1    0   0   3/4    75.0     0/0   0.0
Malcolm Beal            7    6    2    0   0   3/4    75.0     0/0   0.0
Stephen Bird           17    5    0    0   0   2/2   100.0     0/0   0.0
Khris Brogdon           7    5    0    0   0   2/3    66.7     0/0   0.0
Collin Mobley          17    2    2    1   0   1/2    50.0     0/0   0.0
Larry Duncan           17    0    2    0   0   0/2     0.0     0/0   0.0
Magic Beal             17    0    0    1   0   0/0     0.0     0/0   0.0
Giannis Johnson         7    0    1    1   0   0/1     0.0     0/0   0.0
Jalen Leonard           6    0    1    2   0   0/1     0.0     0/0   0.0

TEAM: FG: 11/19 (57.9%), 3PT: 2/3 (66.7%), REB: 9 (2 off, 7 def), AST: 5, TO: 2
TEAM FOULS: 8 [Team_008 in BONUS]


Team_008
--------------------------------------------------------------------------------
Player                MIN  PTS  REB  AST  TO      FG   FG%      3P   3P%
--------------------------------------------------------------------------------
Blake Holiday           7    7    0    0   0   3/3   100.0     0/0   0.0
Magic Young            17    3    3    0   0   1/1   100.0     0/0   0.0
Jrue Harris            17    3    0    0   0   1/1   100.0     0/0   0.0
Khris Giddey            7    3    2    1   0   2/2   100.0     0/0   0.0
Victor Leonard         17    2    0    2   0   1/4    25.0     0/0   0.0
Chris Griffin           7    2    1    0   0   1/2    50.0     0/0   0.0
Lamelo Middleton        7    2    2    0   0   1/2    50.0     0/0   0.0
Immanuel Young          7    2    0    0   0   1/1   100.0     0/0   0.0
Khris Hyland           17    0    0    0   0   0/2     0.0     0/0   0.0
Tyrese Thompson        17    0    2    0   0   0/0     0.0     0/0   0.0

TEAM: FG: 11/18 (61.1%), 3PT: 2/6 (33.3%), REB: 10 (2 off, 8 def), AST: 3, TO: 3
TEAM FOULS: 7 [Team_085 in BONUS]

================================================================================

================================================================================
                       3RD QUARTER - Team_085 vs Team_008                       
================================================================================

[12:00] Team_085 possession (Score: 57-49)
Larry Duncan attempts a 3Pt. Contested by Khris Hyland (4.4 feet, MAN). Larry Duncan misses. Offensive rebound by Paul Wagner! Paul Wagner kicks it out.

[11:46] Team_085 possession (Score: 57-49)
Larry Duncan drives to the basket... Larry Duncan loses control! Ball rolls out of bounds! TURNOVER! (dead ball)

[11:30] Team_008 possession (Score: 57-49)
Tyrese Thompson attempts a Midrange. Contested by Stephen Bird (3.5 feet, ZONE). Tyrese Thompson misses. Rebound secured by Paul Wagner.

[11:20] Team_085 possession (Score: 57-49)
Collin Mobley attempts a Layup. Contested by Magic Young (4.8 feet, MAN). COLLIN MOBLEY MAKES IT!
Score: 59-49

[11:04] Team_008 possession (Score: 59-49)
Tyrese Thompson attempts a 3Pt. Contested by Paul Wagner (3.7 feet, MAN). Tyrese Thompson misses. Rebound secured by Larry Duncan.

[10:50] Team_085 possession (Score: 59-49)
Magic Beal drives, Victor Leonard stays with him. Magic Beal attempts a Dunk. Contested by Victor Leonard (5.4 feet, MAN). MAGIC BEAL MAKES IT! Assist: Collin Mobley
Score: 61-49

[10:33] Team_008 possession (Score: 61-49)
FOUL! Shooting foul on Stephen Bird. Jrue Harris to the line for 3 free throws. [Team fouls: 1] (Stephen Bird: 1 personal fouls)   FT 1/3: GOOD   FT 2/3: MISS   FT 3/3: GOOD Jrue Harris makes 2/3 from the line.
Score: 61-51

[10:16] Team_085 possession (Score: 61-51)
Larry Duncan attempts a Midrange. Contested by Jrue Harris (4.6 feet, ZONE). LARRY DUNCAN MAKES IT!
Score: 63-51

[10:05] Team_008 possession (Score: 63-51)
Khris Hyland attempts a Midrange. Contested by Stephen Bird (3.5 feet, ZONE). Khris Hyland misses. Rebound secured by Paul Wagner.

[09:51] Team_085 possession (Score: 63-51)
Collin Mobley attempts a Midrange. Contested by Tyrese Thompson (4.3 feet, ZONE). Collin Mobley misses. Rebound secured by Khris Hyland.

[09:31] Team_008 possession (Score: 63-51)
Magic Young attempts a Layup. BLOCKED BY PAUL WAGNER! Ball is loose! Rebound secured by Larry Duncan.

[09:18] Team_085 possession (Score: 63-51)
Paul Wagner drives and kicks out. Magic Beal attempts a 3Pt. Contested by Victor Leonard (5.0 feet, MAN). Magic Beal misses. Rebound secured by Khris Hyland.

[09:04] Team_008 possession (Score: 63-51)
Khris Hyland attempts a 3Pt. Contested by Larry Duncan (3.1 feet, MAN). Khris Hyland misses. Rebound secured by Collin Mobley.

[08:50] Team_085 possession (Score: 63-51)
Paul Wagner attempts a Layup. Contested by Tyrese Thompson (4.7 feet, MAN). PAUL WAGNER MAKES IT! Assist: Magic Beal
Score: 65-51

[08:35] Team_008 possession (Score: 65-51)
Victor Leonard attempts a 3Pt. Contested by Magic Beal (4.3 feet, MAN). Victor Leonard misses. Rebound secured by Paul Wagner.

[08:22] Team_085 possession (Score: 65-51)
Paul Wagner attempts a Midrange. Contested by Tyrese Thompson (4.7 feet, MAN). PAUL WAGNER MAKES IT! Assist: Larry Duncan
Score: 67-51

[08:05] Team_008 possession (Score: 67-51)
Victor Leonard attempts a Midrange. Contested by Magic Beal (4.3 feet, MAN). Victor Leonard misses. Offensive rebound by Tyrese Thompson! Tyrese Thompson kicks it out.

[07:54] Team_008 possession (Score: 67-51)
Jrue Harris attempts a 3Pt. Contested by Magic Beal (4.1 feet, ZONE). Jrue Harris misses. Rebound secured by Larry Duncan.

[07:42] Team_085 possession (Score: 67-51)
Stephen Bird makes the 3Pt and draws the foul on Victor Leonard! And-1! Stephen Bird to the line for 1. [Team fouls: 1] (Victor Leonard: 1 personal fouls)   FT 1/1: MISS Stephen Bird makes 0/1 from the line. Rebound secured by Khris Hyland.
Score: 70-51

[07:27] Team_008 possession (Score: 70-51)
Magic Young attempts a 3Pt. Contested by Magic Beal (4.4 feet, ZONE). MAGIC YOUNG MAKES IT! Assist: Khris Hyland
Score: 70-54

[07:15] Team_085 possession (Score: 70-54)
Larry Duncan drives and kicks out. Collin Mobley attempts a 3Pt. Contested by Magic Young (4.9 feet, MAN). Collin Mobley misses. Rebound secured by Khris Hyland.

[06:57] Team_008 possession (Score: 70-54)
FOUL! Shooting foul on Stephen Bird. Jrue Harris to the line for 3 free throws. [Team fouls: 2] (Stephen Bird: 2 personal fouls)   FT 1/3: GOOD   FT 2/3: GOOD   FT 3/3: GOOD Jrue Harris makes 3/3 from the line.
Score: 70-57

[06:44] Team_085 possession (Score: 70-57)
Paul Wagner attempts a Layup. Contested by Tyrese Thompson (4.7 feet, MAN). PAUL WAGNER MAKES IT!
Score: 72-57

[06:27] Team_008 possession (Score: 72-57)
FOUL! Shooting foul on Paul Wagner. Tyrese Thompson to the line for 2 free throws. [Team fouls: 3] (Paul Wagner: 1 personal fouls)   FT 1/2: GOOD   FT 2/2: GOOD Tyrese Thompson makes 2/2 from the line.
Score: 72-59

[06:13] Team_085 possession (Score: 72-59)
Stephen Bird throws a bad pass out of bounds! TURNOVER! (dead ball)

[06:00] Team_008 possession (Score: 72-59)
Tyrese Thompson attempts a Midrange. Contested by Stephen Bird (3.5 feet, ZONE). Tyrese Thompson misses. FOUL! Loose ball foul on Paul Wagner during the rebound battle. [Team fouls: 4] No free throws, side out. (Paul Wagner: 2 personal fouls)

[05:50] Team_008 possession (Score: 72-59)
Magic Young attempts a Layup. BLOCKED BY COLLIN MOBLEY! Ball is loose! Rebound secured by Larry Duncan.

[05:40] Team_085 possession (Score: 72-59)
Stephen Bird drives to the basket... Stephen Bird throws a bad pass! Stolen by Jrue Harris! TURNOVER! (live ball)

[05:24] Team_008 possession (Score: 72-59)
Jrue Harris attempts a 3Pt. Contested by Magic Beal (4.1 feet, ZONE). Jrue Harris misses. Rebound secured by Collin Mobley.

[05:14] Team_085 possession (Score: 72-59)
Larry Duncan drives to the basket... Larry Duncan throws a bad pass out of bounds! TURNOVER! (dead ball)

[04:59] Team_008 possession (Score: 72-59)
Magic Young attempts a 3Pt. Contested by Collin Mobley (4.3 feet, MAN). Magic Young misses. Rebound secured by Larry Duncan.

[04:46] Team_085 possession (Score: 72-59)
Larry Duncan attempts a Layup. Contested by Khris Hyland (4.5 feet, MAN). LARRY DUNCAN MAKES IT! Assist: Magic Beal
Score: 74-59

[04:29] Team_008 possession (Score: 74-59)
Victor Leonard drives and kicks out. Tyrese Thompson attempts a 3Pt. Contested by Magic Beal (4.1 feet, ZONE). Tyrese Thompson misses. Rebound secured by Larry Duncan.

[04:16] Team_085 possession (Score: 74-59)
Stephen Bird drives and kicks out. Collin Mobley attempts a Midrange. Contested by Khris Hyland (4.1 feet, ZONE). Collin Mobley misses. Rebound secured by Khris Hyland.

[04:04] Team_008 possession (Score: 74-59)
Khris Hyland attempts a 3Pt. Contested by Magic Beal (4.2 feet, ZONE). Khris Hyland misses. Rebound secured by Collin Mobley.

[03:47] Team_085 possession (Score: 74-59)
Collin Mobley attempts a Midrange. Contested by Magic Young (5.0 feet, MAN). Collin Mobley misses. FOUL! Loose ball foul on Khris Hyland during the rebound battle. [Team fouls: 2] No free throws, side out. (Khris Hyland: 1 personal fouls)

[03:32] Team_085 possession (Score: 74-59)
FOUL! Shooting foul on Tyrese Thompson. Paul Wagner to the line for 2 free throws. [Team fouls: 3] (Tyrese Thompson: 1 personal fouls)   FT 1/2: GOOD   FT 2/2: GOOD Paul Wagner makes 2/2 from the line.
Score: 76-59

[03:18] Team_008 possession (Score: 76-59)
Jrue Harris attempts a 3Pt. Contested by Magic Beal (4.3 feet, ZONE). JRUE HARRIS MAKES IT! Assist: Tyrese Thompson
Score: 76-62

[03:00] Team_085 possession (Score: 76-62)
Stephen Bird attempts a 3Pt. Contested by Victor Leonard (5.4 feet, ZONE). STEPHEN BIRD MAKES IT! Assist: Magic Beal
Score: 79-62

[02:46] Team_008 possession (Score: 79-62)
Magic Young drives to the basket... Magic Young loses the ball! Stripped by Collin Mobley! TURNOVER! (live ball)

[02:30] Team_085 possession (Score: 79-62)
Stephen Bird attempts a 3Pt. Contested by Jrue Harris (4.8 feet, MAN). Stephen Bird misses. Rebound secured by Tyrese Thompson.

[02:14] Team_008 possession (Score: 79-62)
Khris Hyland attempts a Layup. BLOCKED BY PAUL WAGNER! Ball is loose! Rebound secured by Larry Duncan.

[02:03] Team_085 possession (Score: 79-62)
Paul Wagner attempts a Midrange. Contested by Tyrese Thompson (5.1 feet, MAN). Paul Wagner misses. Rebound secured by Tyrese Thompson.

[01:45] Team_008 possession (Score: 79-62)
FOUL! Shooting foul on Paul Wagner. Jrue Harris to the line for 2 free throws. [BONUS: 5 team fouls] (Paul Wagner: 3 personal fouls)   FT 1/2: GOOD   FT 2/2: GOOD Jrue Harris makes 2/2 from the line.
Score: 79-64

[01:31] Team_085 possession (Score: 79-64)
Paul Wagner attempts a Midrange. Contested by Jrue Harris (4.9 feet, ZONE). Paul Wagner misses. Offensive rebound by Larry Duncan! Larry Duncan kicks it out.

[01:18] Team_085 possession (Score: 79-64)
Larry Duncan makes the Layup and draws the foul on Khris Hyland! And-1! Larry Duncan to the line for 1. [Team fouls: 4] (Khris Hyland: 2 personal fouls)   FT 1/1: GOOD Larry Duncan makes 1/1 from the line.
Score: 82-64

[01:04] Team_008 possession (Score: 82-64)
Khris Hyland attempts a 3Pt. Contested by Magic Beal (4.5 feet, ZONE). Khris Hyland misses. Rebound secured by Paul Wagner.

[00:48] Team_085 possession (Score: 82-64)
Larry Duncan throws a bad pass! Stolen by Khris Hyland! TURNOVER! (live ball)

[00:32] Team_008 possession (Score: 82-64)
Magic Young attempts a Midrange. BLOCKED BY PAUL WAGNER! Ball is loose! Rebound secured by Collin Mobley.

[00:20] Team_085 possession (Score: 82-64)
Collin Mobley drives to the basket... FOUL! Offensive foul on Collin Mobley! Magic Young drew the charge! [Team fouls: 6] (Collin Mobley: 1 personal fouls) TURNOVER! (dead ball)

[00:07] Team_008 possession (Score: 82-64)
Victor Leonard attempts a 3Pt. Contested by Magic Beal (4.8 feet, MAN). Victor Leonard misses. Offensive rebound by Tyrese Thompson! Tyrese Thompson kicks it out.

================================================================================
                              3RD QUARTER COMPLETE                              
================================================================================

3RD QUARTER SCORE: Team_085 25, Team_008 15

BOX SCORE:
================================================================================

Team_085
--------------------------------------------------------------------------------
Player                MIN  PTS  REB  AST  TO      FG   FG%      3P   3P%
--------------------------------------------------------------------------------
Paul Wagner            30    8    6    0   0   4/6    66.7     0/0   0.0
Larry Duncan           29    7    8    1   0   3/4    75.0     0/0   0.0
Stephen Bird           29    3    0    0   0   1/4    25.0     0/0   0.0
Collin Mobley          29    2    4    1   0   1/2    50.0     0/0   0.0
Magic Beal             29    2    0    3   0   1/1   100.0     0/0   0.0

TEAM: FG: 10/17 (58.8%), 3PT: 1/3 (33.3%), REB: 18 (3 off, 15 def), AST: 5, TO: 6
TEAM FOULS: 6 [Team_008 in BONUS]


Team_008
--------------------------------------------------------------------------------
Player                MIN  PTS  REB  AST  TO      FG   FG%      3P   3P%
--------------------------------------------------------------------------------
Jrue Harris            29   10    0    0   0   4/6    66.7     0/0   0.0
Magic Young            29    3    0    0   0   1/5    20.0     0/0   0.0
Tyrese Thompson        29    2    5    1   0   1/3    33.3     0/0   0.0
Khris Hyland           29    0    5    1   0   0/5     0.0     0/0   0.0
Victor Leonard         29    0    0    0   0   0/2     0.0     0/0   0.0

TEAM: FG: 6/21 (28.6%), 3PT: 4/12 (33.3%), REB: 10 (3 off, 7 def), AST: 2, TO: 1
TEAM FOULS: 4

================================================================================

================================================================================
                       4TH QUARTER - Team_085 vs Team_008                       
================================================================================

[12:00] Team_085 possession (Score: 82-64)
Larry Duncan attempts a Midrange. Contested by Khris Hyland (4.7 feet, ZONE). Larry Duncan misses. Rebound secured by Khris Hyland.

[11:45] Team_008 possession (Score: 82-64)
Tyrese Thompson drives and kicks out. Magic Young attempts a Midrange. Contested by Magic Beal (4.4 feet, ZONE). Magic Young misses. FOUL! Loose ball foul on Paul Wagner during the rebound battle. [Team fouls: 1] No free throws, side out. (Paul Wagner: 1 personal fouls)

[11:30] Team_008 possession (Score: 82-64)
Jrue Harris drives to the basket... Jrue Harris loses the ball! Stripped by Paul Wagner! TURNOVER! (live ball)

[11:18] Team_085 possession (Score: 82-64)
Magic Beal attempts a 3Pt. Contested by Victor Leonard (5.8 feet, ZONE). MAGIC BEAL MAKES IT! Assist: Collin Mobley
Score: 85-64

[11:06] Team_008 possession (Score: 85-64)
Jrue Harris attempts a Midrange. Contested by Stephen Bird (4.0 feet, ZONE). JRUE HARRIS MAKES IT! Assist: Magic Young
Score: 85-66

[10:51] Team_085 possession (Score: 85-66)
Stephen Bird drives to the basket... Stephen Bird commits a violation (traveling/carry)! TURNOVER! (dead ball)

[10:51] Substitution (Team_085): Magic Beal OUT → Khris Brogdon IN (stamina_rule2)

[10:51] Substitution (Team_085): Stephen Bird OUT → Jordan Morant IN (stamina_rule2)

[10:51] Substitution (Team_085): Larry Duncan OUT → Giannis Johnson IN (stamina_rule2)

[10:51] Substitution (Team_085): Paul Wagner OUT → Jalen Leonard IN (stamina_rule2)

[10:51] Substitution (Team_085): Collin Mobley OUT → Malcolm Beal IN (stamina_rule2)

[10:51] Substitution (Team_008): Victor Leonard OUT → Blake Holiday IN (stamina_rule2)

[10:51] Substitution (Team_008): Jrue Harris OUT → Chris Griffin IN (stamina_rule2)

[10:51] Substitution (Team_008): Khris Hyland OUT → Immanuel Young IN (stamina_rule2)

[10:51] Substitution (Team_008): Tyrese Thompson OUT → Khris Giddey IN (stamina_rule2)

[10:51] Substitution (Team_008): Magic Young OUT → Lamelo Middleton IN (stamina_rule2)

[10:34] Team_008 possession (Score: 85-66)
FOUL! Holding foul on Khris Brogdon. [Team fouls: 2] No free throws, side out. (Khris Brogdon: 1 personal fouls)

[10:20] Team_008 possession (Score: 85-66)
Immanuel Young attempts a Midrange. Contested by Jalen Leonard (4.6 feet, ZONE). Immanuel Young misses. Rebound secured by Giannis Johnson.

[10:00] Team_085 possession (Score: 85-66)
Jalen Leonard loses control! Ball rolls out of bounds! TURNOVER! (dead ball)

[09:43] Team_008 possession (Score: 85-66)
Lamelo Middleton attempts a 3Pt. Contested by Jordan Morant (3.8 feet, ZONE). Lamelo Middleton misses. Offensive rebound by Khris Giddey! Khris Giddey kicks it out.

[09:31] Team_008 possession (Score: 85-66)
Immanuel Young throws a bad pass! Stolen by Giannis Johnson! TURNOVER! (live ball)

[09:14] Team_085 possession (Score: 85-66)
FOUL! Reach-in foul on Lamelo Middleton during the drive. [Team fouls: 1] No free throws, side out. (Lamelo Middleton: 1 personal fouls)

[08:59] Team_085 possession (Score: 85-66)
Khris Brogdon attempts a 3Pt. Contested by Blake Holiday (5.2 feet, MAN). KHRIS BROGDON MAKES IT! Assist: Giannis Johnson
Score: 88-66

[08:49] Team_008 possession (Score: 88-66)
Blake Holiday drives to the basket... Blake Holiday throws a bad pass! Stolen by Khris Brogdon! TURNOVER! (live ball)

[08:35] Team_085 possession (Score: 88-66)
Khris Brogdon makes the Dunk and draws the foul on Chris Griffin! And-1! Khris Brogdon to the line for 1. [Team fouls: 2] (Chris Griffin: 1 personal fouls)   FT 1/1: GOOD Khris Brogdon makes 1/1 from the line.
Score: 91-66

[08:24] Team_008 possession (Score: 91-66)
FOUL! Holding foul on Jalen Leonard. [Team fouls: 3] No free throws, side out. (Jalen Leonard: 1 personal fouls)

[08:10] Team_008 possession (Score: 91-66)
Chris Griffin drives, picks up Malcolm Beal. Help arrives from Jordan Morant! Chris Griffin attempts a Layup. Contested by Jordan Morant (4.6 feet, ZONE). CHRIS GRIFFIN MAKES IT!
Score: 91-68

[07:51] Team_085 possession (Score: 91-68)
FOUL! Reach-in foul on Khris Giddey during the drive. [Team fouls: 3] No free throws, side out. (Khris Giddey: 1 personal fouls)

[07:37] Team_085 possession (Score: 91-68)
Jordan Morant attempts a 3Pt. Contested by Khris Giddey (4.4 feet, ZONE). JORDAN MORANT MAKES IT! Assist: Khris Brogdon
Score: 94-68

[07:23] Team_008 possession (Score: 94-68)
Immanuel Young attempts a 3Pt. Contested by Jordan Morant (4.0 feet, ZONE). Immanuel Young misses. Rebound secured by Giannis Johnson.

[07:07] Team_085 possession (Score: 94-68)
Khris Brogdon throws a bad pass! Stolen by Blake Holiday! TURNOVER! (live ball)

[06:54] Team_008 possession (Score: 94-68)
Khris Giddey attempts a 3Pt. Contested by Khris Brogdon (5.3 feet, ZONE). KHRIS GIDDEY MAKES IT!
Score: 94-71

[06:40] Team_085 possession (Score: 94-71)
Jordan Morant attempts a 3Pt. Contested by Chris Griffin (5.4 feet, MAN). JORDAN MORANT MAKES IT! Assist: Khris Brogdon
Score: 97-71

[06:26] Team_008 possession (Score: 97-71)
FOUL! Holding foul on Jordan Morant. [Team fouls: 4] No free throws, side out. (Jordan Morant: 1 personal fouls)

[06:11] Team_008 possession (Score: 97-71)
Lamelo Middleton attempts a Layup. Contested by Malcolm Beal (4.6 feet, ZONE). Lamelo Middleton misses. Rebound secured by Giannis Johnson.

[05:56] Team_085 possession (Score: 97-71)
Jalen Leonard attempts a Layup. Contested by Lamelo Middleton (4.6 feet, ZONE). Jalen Leonard misses. FOUL! Loose ball foul on Lamelo Middleton during the rebound battle. [Team fouls: 4] No free throws, side out. (Lamelo Middleton: 2 personal fouls)

[05:39] Team_085 possession (Score: 97-71)
Malcolm Beal attempts a 3Pt. Contested by Lamelo Middleton (3.8 feet, MAN). Malcolm Beal misses. Rebound secured by Chris Griffin.

[05:24] Team_008 possession (Score: 97-71)
Lamelo Middleton attempts a Midrange. Contested by Malcolm Beal (4.6 feet, MAN). LAMELO MIDDLETON MAKES IT!
Score: 97-73

[05:12] Team_085 possession (Score: 97-73)
Jordan Morant attempts a Midrange. Contested by Khris Giddey (4.4 feet, ZONE). Jordan Morant misses. Rebound secured by Chris Griffin.

[04:54] Team_008 possession (Score: 97-73)
Chris Griffin attempts a Layup. Contested by Malcolm Beal (4.6 feet, ZONE). CHRIS GRIFFIN MAKES IT!
Score: 97-75

[04:37] Team_085 possession (Score: 97-75)
Khris Brogdon attempts a 3Pt. Contested by Khris Giddey (4.1 feet, ZONE). KHRIS BROGDON MAKES IT! Assist: Giannis Johnson
Score: 100-75

[04:22] Team_008 possession (Score: 100-75)
Chris Griffin drives, Jordan Morant stays with him. Chris Griffin attempts a Layup. Contested by Jordan Morant (3.8 feet, MAN). CHRIS GRIFFIN MAKES IT!
Score: 100-77

[04:06] Team_085 possession (Score: 100-77)
Khris Brogdon attempts a 3Pt. Contested by Immanuel Young (4.2 feet, ZONE). Khris Brogdon misses. FOUL! Loose ball foul on Lamelo Middleton during the rebound battle. [IN THE BONUS! 5 team fouls] Jalen Leonard to the line for 2 free throws. (Lamelo Middleton: 3 personal fouls)   FT 1/2: GOOD   FT 2/2: GOOD Jalen Leonard makes 2/2 from the line.
Score: 102-77

[03:52] Team_008 possession (Score: 102-77)
Chris Griffin makes the Layup and draws the foul on Malcolm Beal! And-1! Chris Griffin to the line for 1. [BONUS: 5 team fouls] (Malcolm Beal: 1 personal fouls)   FT 1/1: GOOD Chris Griffin makes 1/1 from the line.
Score: 102-80

[03:39] Team_085 possession (Score: 102-80)
Malcolm Beal attempts a Midrange. Contested by Immanuel Young (3.8 feet, ZONE). MALCOLM BEAL MAKES IT!
Score: 104-80

[03:26] Team_008 possession (Score: 104-80)
Immanuel Young drives, picks up Giannis Johnson. Help arrives from Jordan Morant! Immanuel Young attempts a Layup. Wide open! Jordan Morant is 6.3 feet away. [MAN] Immanuel Young misses. Offensive rebound by Khris Giddey! Khris Giddey kicks it out.

[03:13] Team_008 possession (Score: 104-80)
Blake Holiday attempts a 3Pt. Contested by Jordan Morant (3.7 feet, ZONE). Blake Holiday misses. Rebound secured by Giannis Johnson.

[02:56] Team_085 possession (Score: 104-80)
Khris Brogdon drives, Lamelo Middleton stays with him. Khris Brogdon attempts a Dunk. Contested by Lamelo Middleton (4.2 feet, ZONE). KHRIS BROGDON MAKES IT! Assist: Malcolm Beal
Score: 106-80

[02:43] Team_008 possession (Score: 106-80)
Immanuel Young attempts a 3Pt. Wide open! Giannis Johnson is 6.4 feet away. [MAN] Immanuel Young misses. Rebound secured by Giannis Johnson.

[02:28] Team_085 possession (Score: 106-80)
Jalen Leonard attempts a 3Pt. Contested by Chris Griffin (5.7 feet, ZONE). Jalen Leonard misses. Rebound secured by Khris Giddey.

[02:12] Team_008 possession (Score: 106-80)
Blake Holiday attempts a 3Pt. Contested by Khris Brogdon (5.7 feet, MAN). Blake Holiday misses. Offensive rebound by Khris Giddey! Khris Giddey kicks it out.

[01:56] Team_008 possession (Score: 106-80)
FOUL! Reach-in foul on Malcolm Beal during the drive. [IN THE BONUS! 6 team fouls] Chris Griffin to the line for 2 free throws. (Malcolm Beal: 2 personal fouls)   FT 1/2: GOOD   FT 2/2: GOOD Chris Griffin makes 2/2 from the line.
Score: 106-82

[01:41] Team_085 possession (Score: 106-82)
Khris Brogdon attempts a Midrange. Contested by Blake Holiday (5.4 feet, MAN). KHRIS BROGDON MAKES IT!
Score: 108-82

[01:28] Team_008 possession (Score: 108-82)
Lamelo Middleton attempts a 3Pt. Contested by Malcolm Beal (4.8 feet, MAN). LAMELO MIDDLETON MAKES IT! Assist: Immanuel Young
Score: 108-85

[01:11] Team_085 possession (Score: 108-85)
Jalen Leonard drives and kicks out. Jalen Leonard attempts a 3Pt. Contested by Khris Giddey (4.5 feet, ZONE). Jalen Leonard misses. Rebound secured by Khris Giddey.

[00:57] Team_008 possession (Score: 108-85)
FOUL! Reach-in foul on Malcolm Beal during the drive. [IN THE BONUS! 7 team fouls] Khris Giddey to the line for 2 free throws. (Malcolm Beal: 3 personal fouls)   FT 1/2: MISS   FT 2/2: GOOD Khris Giddey makes 1/2 from the line.
Score: 108-86

[00:42] Team_085 possession (Score: 108-86)
Jordan Morant attempts a Midrange. Contested by Chris Griffin (5.7 feet, MAN). JORDAN MORANT MAKES IT!
Score: 110-86

[00:31] Team_008 possession (Score: 110-86)
Chris Griffin attempts a 3Pt. BLOCKED BY JORDAN MORANT! Ball deflects out of bounds off Chris Griffin.

[00:18] Team_085 possession (Score: 110-86)
FOUL! Holding foul on Blake Holiday. [IN THE BONUS! 6 team fouls] Khris Brogdon to the line for 2 free throws. (Blake Holiday: 1 personal fouls)   FT 1/2: MISS   FT 2/2: GOOD Khris Brogdon makes 1/2 from the line.
Score: 111-86

[00:07] Team_008 possession (Score: 111-86)
Lamelo Middleton attempts a Midrange. Contested by Malcolm Beal (4.9 feet, MAN). Lamelo Middleton misses. Rebound secured by Malcolm Beal.

================================================================================
                              4TH QUARTER COMPLETE                              
================================================================================

4TH QUARTER SCORE: Team_085 29, Team_008 22

BOX SCORE:
================================================================================

Team_085
--------------------------------------------------------------------------------
Player                MIN  PTS  REB  AST  TO      FG   FG%      3P   3P%
--------------------------------------------------------------------------------
Khris Brogdon          18   14    0    2   0   6/6   100.0     0/0   0.0
Jordan Morant          18    8    0    0   0   3/4    75.0     0/0   0.0
Magic Beal             30    3    0    0   0   1/1   100.0     0/0   0.0
Jalen Leonard          16    2    1    0   0   1/3    33.3     0/0   0.0
Malcolm Beal           18    2    1    1   0   1/2    50.0     0/0   0.0
Larry Duncan           30    0    0    0   0   0/1     0.0     0/0   0.0
Collin Mobley          30    0    0    1   0   0/0     0.0     0/0   0.0
Giannis Johnson        18    0    5    2   0   0/0     0.0     0/0   0.0

TEAM: FG: 12/17 (70.6%), 3PT: 6/8 (75.0%), REB: 7 (1 off, 6 def), AST: 6, TO: 3
TEAM FOULS: 7 [Team_008 in BONUS]


Team_008
--------------------------------------------------------------------------------
Player                MIN  PTS  REB  AST  TO      FG   FG%      3P   3P%
--------------------------------------------------------------------------------
Chris Griffin          18   11    2    0   0   5/6    83.3     0/0   0.0
Lamelo Middleton       18    5    0    0   0   2/4    50.0     0/0   0.0
Khris Giddey           18    4    5    0   0   2/2   100.0     0/0   0.0
Jrue Harris            30    2    0    0   0   1/1   100.0     0/0   0.0
Khris Hyland           30    0    1    0   0   0/0     0.0     0/0   0.0
Tyrese Thompson        30    0    1    0   0   0/0     0.0     0/0   0.0
Magic Young            30    0    0    1   0   0/0     0.0     0/0   0.0
Immanuel Young         18    0    0    1   0   0/3     0.0     0/0   0.0
Blake Holiday          18    0    0    0   0   0/1     0.0     0/0   0.0

TEAM: FG: 10/17 (58.8%), 3PT: 2/6 (33.3%), REB: 9 (4 off, 5 def), AST: 2, TO: 3
TEAM FOULS: 6 [Team_085 in BONUS]

================================================================================

================================================================================
                               FULL GAME COMPLETE                               
================================================================================

FINAL SCORE: Team_085 111, Team_008 86

SCORING BY QUARTER:
--------------------------------------------------------------------------------
Team                     Q1     Q2     Q3     Q4    FINAL
--------------------------------------------------------------------------------
Team_085                 32     25     25     29      111
Team_008                 25     24     15     22       86
--------------------------------------------------------------------------------

FULL GAME BOX SCORE:
================================================================================

Team_085
--------------------------------------------------------------------------------
Player                MIN  PTS  REB  AST  TO      FG   FG%      3P   3P%      FT STL BLK
--------------------------------------------------------------------------------
Paul Wagner            32   17    9    2   0   7/12   58.3   0/0     0.0   6/7     1   4
Magic Beal             30    8    0    5   2   3/3   100.0   2/2   100.0   0/0     1   1
Stephen Bird           30   18    0    1   4   7/10   70.0   3/5    60.0   4/5     0   0
Larry Duncan           30   15   16    4   4   7/13   53.8   1/4    25.0   2/2     0   0
Collin Mobley          30    8   10    3   0   4/10   40.0   0/0     0.0   1/2     1   1
Khris Brogdon          18   19    0    2   1   8/9    88.9   4/4   100.0   2/3     1   0
Jordan Morant          18    8    0    0   1   3/4    75.0   2/2   100.0   0/0     0   1
Giannis Johnson        18    3    6    3   0   2/4    50.0   0/1     0.0   1/1     1   0
Malcolm Beal           18    8    4    1   0   3/5    60.0   0/1     0.0   4/4     0   1
Jalen Leonard          16    2    2    2   1   0/3     0.0   0/1     0.0   2/2     1   0

TEAM: FG: 45/74 (60.8%), 3PT: 12/20 (60.0%), REB: 47 (7 off, 40 def), AST: 23, TO: 13


Team_008
--------------------------------------------------------------------------------
Player                MIN  PTS  REB  AST  TO      FG   FG%      3P   3P%      FT STL BLK
--------------------------------------------------------------------------------
Victor Leonard         30    9    0    3   1   4/11   36.4   1/5    20.0   0/0     0   0
Jrue Harris            30   15    0    3   2   6/9    66.7   4/6    66.7   7/8     1   0
Khris Hyland           30    3   11    2   1   1/11    9.1   1/5    20.0   0/0     1   0
Tyrese Thompson        30    6    8    2   1   3/7    42.9   0/2     0.0   2/2     0   2
Magic Young            30    8    5    2   0   3/10   30.0   2/4    50.0   0/1     0   0
Blake Holiday          18    9    0    0   0   5/6    83.3   1/2    50.0   1/1     1   0
Chris Griffin          18   13    4    0   1   6/8    75.0   0/2     0.0   3/3     0   0
Immanuel Young         18    2    0    1   1   0/3     0.0   0/2     0.0   2/2     0   0
Khris Giddey           18    7    7    1   1   4/5    80.0   1/1   100.0   2/4     0   0
Lamelo Middleton       18   12    3    1   0   4/7    57.1   1/2    50.0   3/3     0   1

TEAM: FG: 37/78 (47.4%), 3PT: 11/31 (35.5%), REB: 38 (11 off, 27 def), AST: 15, TO: 8

================================================================================
